library/src/amd_detail/rocblaslt/src/Tensile/Logic/streamk/gfx942_38cu/aquavanjaram942_Cijk_Ailk_Bjlk_BBS_BH_UserArgs.yaml
- {MinimumRequiredVersion: 4.33.0}
- aquavanjaram942
- {Architecture: gfx942, CUCount: 38}
- [Device 0049, Device 0050]
    SolutionIndex: 0
    SolutionNameMin: Cijk_Ailk_Bjlk_BBS_BH_UserArgs_MT256x256x32_MI16x16x1_SN_LDSB1_CLR1_GSU0_GSUC0_GSUWGMRR0_K1_LBSPPA2048_LBSPPB2048_LPA0_LPB16_MIWT8_8_PLR1_SU32_SUM0_SUS256_VWA8_VWB1_WGM1_WGMXCC1_WGMXCCGn1
    SolutionIndex: 1
    SolutionNameMin: Cijk_Ailk_Bjlk_BBS_BH_UserArgs_MT256x256x32_MI16x16x1_SN_LDSB1_CLR1_GSU0_GSUC0_GSUWGMRR0_K1_LBSPPA2048_LBSPPB2048_LPA0_LPB32_MIWT8_8_PLR1_SU32_SUM0_SUS256_VWA8_VWB2_WGM1_WGMXCC1_WGMXCCGn1
    SolutionIndex: 2
    SolutionNameMin: Cijk_Ailk_Bjlk_BBS_BH_UserArgs_MT256x256x32_MI16x16x1_SN_LDSB0_CLR1_GSU0_GSUC0_GSUWGMRR0_K1_LBSPPA2048_LBSPPB2048_LPA0_LPB0_MIWT8_8_PLR1_SU32_SUM0_SUS256_VWA8_VWB4_WGM1_WGMXCC1_WGMXCCGn1
    SolutionIndex: 3
    SolutionNameMin: Cijk_Ailk_Bjlk_BBS_BH_UserArgs_MT256x256x32_MI16x16x1_SN_LDSB1_CLR1_GSU0_GSUC0_GSUWGMRR0_K1_LBSPPA2048_LBSPPB2048_LPA16_LPB0_MIWT8_8_PLR1_SU32_SUM0_SUS256_VWA1_VWB8_WGM1_WGMXCC1_WGMXCCGn1
    SolutionIndex: 4
    SolutionNameMin: Cijk_Ailk_Bjlk_BBS_BH_UserArgs_MT256x256x32_MI16x16x1_SN_LDSB0_CLR1_GSU0_GSUC0_GSUWGMRR0_K1_LBSPPA2048_LBSPPB2048_LPA0_LPB0_MIWT8_8_PLR1_SU32_SUM0_SUS256_VWA4_VWB8_WGM1_WGMXCC1_WGMXCCGn1
    SolutionIndex: 5
    SolutionNameMin: Cijk_Ailk_Bjlk_BBS_BH_UserArgs_MT256x256x32_MI16x16x1_SN_LDSB0_CLR1_GSU0_GSUC0_GSUWGMRR0_K1_LBSPPA2048_LBSPPB2048_LPA0_LPB0_MIWT8_8_PLR1_SU32_SUM0_SUS256_VWA8_VWB8_WGM1_WGMXCC1_WGMXCCGn1
    SolutionIndex: 6
    SolutionNameMin: Cijk_Ailk_Bjlk_BBS_BH_UserArgs_MT256x256x32_MI16x16x1_SN_LDSB1_CLR1_GSU0_GSUC0_GSUWGMRR0_K1_LBSPPA2048_LBSPPB2048_LPA0_LPB16_MIWT8_8_PLR1_SU32_SUM0_SUS256_VWA8_VWB1_WGM4_WGMXCC1_WGMXCCGn1
    SolutionIndex: 7
    SolutionNameMin: Cijk_Ailk_Bjlk_BBS_BH_UserArgs_MT256x256x32_MI16x16x1_SN_LDSB1_CLR1_GSU0_GSUC0_GSUWGMRR0_K1_LBSPPA2048_LBSPPB2048_LPA0_LPB32_MIWT8_8_PLR1_SU32_SUM0_SUS256_VWA4_VWB2_WGM4_WGMXCC1_WGMXCCGn1
    SolutionIndex: 8
    SolutionNameMin: Cijk_Ailk_Bjlk_BBS_BH_UserArgs_MT256x256x32_MI16x16x1_SN_LDSB0_CLR1_GSU0_GSUC0_GSUWGMRR0_K1_LBSPPA2048_LBSPPB2048_LPA0_LPB0_MIWT8_8_PLR1_SU32_SUM0_SUS256_VWA8_VWB8_WGM4_WGMXCC1_WGMXCCGn1
    SolutionIndex: 9
    SolutionNameMin: Cijk_Ailk_Bjlk_BBS_BH_UserArgs_MT256x256x32_MI16x16x1_SN_LDSB0_CLR1_GSU0_GSUC0_GSUWGMRR0_K1_LBSPPA2048_LBSPPB2048_LPA0_LPB0_MIWT8_8_PLR1_SU32_SUM0_SUS256_VWA8_VWB8_WGM8_WGMXCC1_WGMXCCGn1
    SolutionIndex: 10
    SolutionNameMin: Cijk_Ailk_Bjlk_BBS_BH_UserArgs_MT128x256x32_MI16x16x1_SN_LDSB1_CLR1_GSU0_GSUC0_GSUWGMRR0_K1_LBSPPA1024_LBSPPB2048_LPA0_LPB32_MIWT4_8_PLR1_SU32_SUM0_SUS256_VWA4_VWB2_WGM1_WGMXCC1_WGMXCCGn1
    SolutionIndex: 11
    SolutionNameMin: Cijk_Ailk_Bjlk_BBS_BH_UserArgs_MT128x256x32_MI16x16x1_SN_LDSB1_CLR1_GSU0_GSUC0_GSUWGMRR0_K1_LBSPPA1024_LBSPPB2048_LPA0_LPB0_MIWT4_8_PLR1_SU32_SUM0_SUS256_VWA4_VWB4_WGM1_WGMXCC1_WGMXCCGn1
    SolutionIndex: 12
    SolutionNameMin: Cijk_Ailk_Bjlk_BBS_BH_UserArgs_MT128x256x32_MI16x16x1_SN_LDSB1_CLR1_GSU0_GSUC0_GSUWGMRR0_K1_LBSPPA1024_LBSPPB2048_LPA32_LPB0_MIWT4_8_PLR1_SU32_SUM0_SUS256_VWA2_VWB8_WGM1_WGMXCC1_WGMXCCGn1
    SolutionIndex: 13
    SolutionNameMin: Cijk_Ailk_Bjlk_BBS_BH_UserArgs_MT128x256x32_MI16x16x1_SN_LDSB1_CLR1_GSU0_GSUC0_GSUWGMRR0_K1_LBSPPA1024_LBSPPB2048_LPA0_LPB0_MIWT4_8_PLR1_SU32_SUM0_SUS256_VWA4_VWB8_WGM1_WGMXCC1_WGMXCCGn1
    SolutionIndex: 14
    SolutionNameMin: Cijk_Ailk_Bjlk_BBS_BH_UserArgs_MT128x256x32_MI16x16x1_SN_LDSB1_CLR1_GSU0_GSUC0_GSUWGMRR0_K1_LBSPPA1024_LBSPPB2048_LPA0_LPB32_MIWT4_8_PLR1_SU32_SUM0_SUS256_VWA4_VWB2_WGM4_WGMXCC1_WGMXCCGn1
    SolutionIndex: 15
    SolutionNameMin: Cijk_Ailk_Bjlk_BBS_BH_UserArgs_MT128x256x32_MI16x16x1_SN_LDSB1_CLR1_GSU0_GSUC0_GSUWGMRR0_K1_LBSPPA1024_LBSPPB2048_LPA32_LPB0_MIWT4_8_PLR1_SU32_SUM0_SUS256_VWA2_VWB4_WGM4_WGMXCC1_WGMXCCGn1
    SolutionIndex: 16
    SolutionNameMin: Cijk_Ailk_Bjlk_BBS_BH_UserArgs_MT128x256x32_MI16x16x1_SN_LDSB1_CLR1_GSU0_GSUC0_GSUWGMRR0_K1_LBSPPA1024_LBSPPB2048_LPA0_LPB0_MIWT4_8_PLR1_SU32_SUM0_SUS256_VWA4_VWB4_WGM4_WGMXCC1_WGMXCCGn1
    SolutionIndex: 17
    SolutionNameMin: Cijk_Ailk_Bjlk_BBS_BH_UserArgs_MT128x256x32_MI16x16x1_SN_LDSB1_CLR1_GSU0_GSUC0_GSUWGMRR0_K1_LBSPPA1024_LBSPPB2048_LPA32_LPB0_MIWT4_8_PLR1_SU32_SUM0_SUS256_VWA2_VWB8_WGM4_WGMXCC1_WGMXCCGn1
    SolutionIndex: 18
    SolutionNameMin: Cijk_Ailk_Bjlk_BBS_BH_UserArgs_MT128x256x32_MI16x16x1_SN_LDSB1_CLR1_GSU0_GSUC0_GSUWGMRR0_K1_LBSPPA1024_LBSPPB2048_LPA0_LPB0_MIWT4_8_PLR1_SU32_SUM0_SUS256_VWA4_VWB8_WGM4_WGMXCC1_WGMXCCGn1
    SolutionIndex: 19
    SolutionNameMin: Cijk_Ailk_Bjlk_BBS_BH_UserArgs_MT128x256x32_MI16x16x1_SN_LDSB1_CLR1_GSU0_GSUC0_GSUWGMRR0_K1_LBSPPA1024_LBSPPB2048_LPA0_LPB32_MIWT4_8_PLR1_SU32_SUM0_SUS256_VWA4_VWB2_WGM8_WGMXCC1_WGMXCCGn1
    SolutionIndex: 20
    SolutionNameMin: Cijk_Ailk_Bjlk_BBS_BH_UserArgs_MT128x256x32_MI16x16x1_SN_LDSB1_CLR1_GSU0_GSUC0_GSUWGMRR0_K1_LBSPPA1024_LBSPPB2048_LPA0_LPB0_MIWT4_8_PLR1_SU32_SUM0_SUS256_VWA4_VWB4_WGM8_WGMXCC1_WGMXCCGn1
    SolutionIndex: 21
    SolutionNameMin: Cijk_Ailk_Bjlk_BBS_BH_UserArgs_MT128x256x32_MI16x16x1_SN_LDSB1_CLR1_GSU0_GSUC0_GSUWGMRR0_K1_LBSPPA1024_LBSPPB2048_LPA0_LPB0_MIWT4_8_PLR1_SU32_SUM0_SUS256_VWA4_VWB8_WGM8_WGMXCC1_WGMXCCGn1
    SolutionIndex: 22
    SolutionNameMin: Cijk_Ailk_Bjlk_BBS_BH_UserArgs_MT256x128x32_MI16x16x1_SN_LDSB1_CLR1_GSU0_GSUC0_GSUWGMRR0_K1_LBSPPA2048_LBSPPB1024_LPA0_LPB16_MIWT8_4_PLR1_SU32_SUM0_SUS256_VWA8_VWB1_WGM1_WGMXCC1_WGMXCCGn1
    SolutionIndex: 23
    SolutionNameMin: Cijk_Ailk_Bjlk_BBS_BH_UserArgs_MT256x128x32_MI16x16x1_SN_LDSB1_CLR1_GSU0_GSUC0_GSUWGMRR0_K1_LBSPPA2048_LBSPPB1024_LPA32_LPB32_MIWT8_4_PLR1_SU32_SUM0_SUS256_VWA2_VWB2_WGM1_WGMXCC1_WGMXCCGn1
    SolutionIndex: 24
    SolutionNameMin: Cijk_Ailk_Bjlk_BBS_BH_UserArgs_MT256x128x32_MI16x16x1_SN_LDSB1_CLR1_GSU0_GSUC0_GSUWGMRR0_K1_LBSPPA2048_LBSPPB1024_LPA0_LPB32_MIWT8_4_PLR1_SU32_SUM0_SUS256_VWA8_VWB2_WGM1_WGMXCC1_WGMXCCGn1
    SolutionIndex: 25
    SolutionNameMin: Cijk_Ailk_Bjlk_BBS_BH_UserArgs_MT256x128x32_MI16x16x1_SN_LDSB1_CLR1_GSU0_GSUC0_GSUWGMRR0_K1_LBSPPA2048_LBSPPB1024_LPA32_LPB0_MIWT8_4_PLR1_SU32_SUM0_SUS256_VWA2_VWB4_WGM1_WGMXCC1_WGMXCCGn1
    SolutionIndex: 26
    SolutionNameMin: Cijk_Ailk_Bjlk_BBS_BH_UserArgs_MT256x128x32_MI16x16x1_SN_LDSB1_CLR1_GSU0_GSUC0_GSUWGMRR0_K1_LBSPPA2048_LBSPPB1024_LPA0_LPB0_MIWT8_4_PLR1_SU32_SUM0_SUS256_VWA4_VWB4_WGM1_WGMXCC1_WGMXCCGn1
    SolutionIndex: 27
    SolutionNameMin: Cijk_Ailk_Bjlk_BBS_BH_UserArgs_MT256x128x32_MI16x16x1_SN_LDSB1_CLR1_GSU0_GSUC0_GSUWGMRR0_K1_LBSPPA2048_LBSPPB1024_LPA0_LPB0_MIWT8_4_PLR1_SU32_SUM0_SUS256_VWA8_VWB4_WGM1_WGMXCC1_WGMXCCGn1
    SolutionIndex: 28
    SolutionNameMin: Cijk_Ailk_Bjlk_BBS_BH_UserArgs_MT256x128x32_MI16x16x1_SN_LDSB1_CLR1_GSU0_GSUC0_GSUWGMRR0_K1_LBSPPA2048_LBSPPB1024_LPA0_LPB16_MIWT8_4_PLR1_SU32_SUM0_SUS256_VWA4_VWB1_WGM4_WGMXCC1_WGMXCCGn1
    SolutionIndex: 29
    SolutionNameMin: Cijk_Ailk_Bjlk_BBS_BH_UserArgs_MT256x128x32_MI16x16x1_SN_LDSB1_CLR1_GSU0_GSUC0_GSUWGMRR0_K1_LBSPPA2048_LBSPPB1024_LPA0_LPB16_MIWT8_4_PLR1_SU32_SUM0_SUS256_VWA8_VWB1_WGM4_WGMXCC1_WGMXCCGn1
    SolutionIndex: 30
    SolutionNameMin: Cijk_Ailk_Bjlk_BBS_BH_UserArgs_MT256x128x32_MI16x16x1_SN_LDSB1_CLR1_GSU0_GSUC0_GSUWGMRR0_K1_LBSPPA2048_LBSPPB1024_LPA0_LPB32_MIWT8_4_PLR1_SU32_SUM0_SUS256_VWA4_VWB2_WGM4_WGMXCC1_WGMXCCGn1
    SolutionIndex: 31
    SolutionNameMin: Cijk_Ailk_Bjlk_BBS_BH_UserArgs_MT256x128x32_MI16x16x1_SN_LDSB1_CLR1_GSU0_GSUC0_GSUWGMRR0_K1_LBSPPA2048_LBSPPB1024_LPA0_LPB32_MIWT8_4_PLR1_SU32_SUM0_SUS256_VWA8_VWB2_WGM4_WGMXCC1_WGMXCCGn1
    SolutionIndex: 32
    SolutionNameMin: Cijk_Ailk_Bjlk_BBS_BH_UserArgs_MT256x128x32_MI16x16x1_SN_LDSB1_CLR1_GSU0_GSUC0_GSUWGMRR0_K1_LBSPPA2048_LBSPPB1024_LPA0_LPB0_MIWT8_4_PLR1_SU32_SUM0_SUS256_VWA8_VWB4_WGM4_WGMXCC1_WGMXCCGn1
    SolutionIndex: 33
    SolutionNameMin: Cijk_Ailk_Bjlk_BBS_BH_UserArgs_MT256x128x32_MI16x16x1_SN_LDSB1_CLR1_GSU0_GSUC0_GSUWGMRR0_K1_LBSPPA2048_LBSPPB1024_LPA0_LPB32_MIWT8_4_PLR1_SU32_SUM0_SUS256_VWA4_VWB2_WGM8_WGMXCC1_WGMXCCGn1
    SolutionIndex: 34
    SolutionNameMin: Cijk_Ailk_Bjlk_BBS_BH_UserArgs_MT256x128x32_MI16x16x1_SN_LDSB1_CLR1_GSU0_GSUC0_GSUWGMRR0_K1_LBSPPA2048_LBSPPB1024_LPA0_LPB32_MIWT8_4_PLR1_SU32_SUM0_SUS256_VWA8_VWB2_WGM8_WGMXCC1_WGMXCCGn1
    SolutionIndex: 35
    SolutionNameMin: Cijk_Ailk_Bjlk_BBS_BH_UserArgs_MT256x128x32_MI16x16x1_SN_LDSB1_CLR1_GSU0_GSUC0_GSUWGMRR0_K1_LBSPPA2048_LBSPPB1024_LPA0_LPB0_MIWT8_4_PLR1_SU32_SUM0_SUS256_VWA4_VWB4_WGM8_WGMXCC1_WGMXCCGn1
    SolutionIndex: 36
    SolutionNameMin: Cijk_Ailk_Bjlk_BBS_BH_UserArgs_MT256x128x32_MI16x16x1_SN_LDSB1_CLR1_GSU0_GSUC0_GSUWGMRR0_K1_LBSPPA2048_LBSPPB1024_LPA0_LPB0_MIWT8_4_PLR1_SU32_SUM0_SUS256_VWA8_VWB4_WGM8_WGMXCC1_WGMXCCGn1
    SolutionIndex: 37
    SolutionNameMin: Cijk_Ailk_Bjlk_BBS_BH_UserArgs_MT256x64x32_MI16x16x1_SN_LDSB1_CLR1_GSU0_GSUC0_GSUWGMRR0_K1_LBSPPA2048_LBSPPB512_LPA0_LPB16_MIWT8_2_PLR1_SU32_SUM0_SUS256_VWA8_VWB1_WGM1_WGMXCC1_WGMXCCGn1
    SolutionIndex: 38
    SolutionNameMin: Cijk_Ailk_Bjlk_BBS_BH_UserArgs_MT256x64x32_MI16x16x1_SN_LDSB1_CLR1_GSU0_GSUC0_GSUWGMRR0_K1_LBSPPA2048_LBSPPB512_LPA0_LPB32_MIWT8_2_PLR1_SU32_SUM0_SUS256_VWA8_VWB2_WGM1_WGMXCC1_WGMXCCGn1
    SolutionIndex: 39
    SolutionNameMin: Cijk_Ailk_Bjlk_BBS_BH_UserArgs_MT256x64x32_MI16x16x1_SN_LDSB1_CLR1_GSU0_GSUC0_GSUWGMRR0_K1_LBSPPA2048_LBSPPB512_LPA0_LPB16_MIWT8_2_PLR1_SU32_SUM0_SUS256_VWA4_VWB1_WGM4_WGMXCC1_WGMXCCGn1
    SolutionIndex: 40
    SolutionNameMin: Cijk_Ailk_Bjlk_BBS_BH_UserArgs_MT256x64x32_MI16x16x1_SN_LDSB1_CLR1_GSU0_GSUC0_GSUWGMRR0_K1_LBSPPA2048_LBSPPB512_LPA0_LPB32_MIWT8_2_PLR1_SU32_SUM0_SUS256_VWA8_VWB2_WGM4_WGMXCC1_WGMXCCGn1
    SolutionIndex: 41
    SolutionNameMin: Cijk_Ailk_Bjlk_BBS_BH_UserArgs_MT128x128x32_MI16x16x1_SN_LDSB1_CLR1_GSU0_GSUC0_GSUWGMRR0_K1_LBSPPA1024_LBSPPB1024_LPA0_LPB32_MIWT4_4_PLR1_SU32_SUM0_SUS256_VWA4_VWB2_WGM1_WGMXCC1_WGMXCCGn1
    SolutionIndex: 42
    SolutionNameMin: Cijk_Ailk_Bjlk_BBS_BH_UserArgs_MT128x128x32_MI16x16x1_SN_LDSB1_CLR1_GSU0_GSUC0_GSUWGMRR0_K1_LBSPPA1024_LBSPPB1024_LPA32_LPB0_MIWT4_4_PLR1_SU32_SUM0_SUS256_VWA2_VWB4_WGM1_WGMXCC1_WGMXCCGn1
    SolutionIndex: 43
    SolutionNameMin: Cijk_Ailk_Bjlk_BBS_BH_UserArgs_MT128x128x32_MI16x16x1_SN_LDSB0_CLR1_GSU0_GSUC0_GSUWGMRR0_K1_LBSPPA1024_LBSPPB1024_LPA0_LPB0_MIWT4_4_PLR1_SU32_SUM0_SUS256_VWA4_VWB4_WGM1_WGMXCC1_WGMXCCGn1
    SolutionIndex: 44
    SolutionNameMin: Cijk_Ailk_Bjlk_BBS_BH_UserArgs_MT128x128x32_MI16x16x1_SN_LDSB0_CLR0_GSU0_GSUC0_GSUWGMRR0_K1_LBSPPA1024_LBSPPB1024_LPA0_LPB0_MIWT4_4_PLR0_SU32_SUM0_SUS256_VWA4_VWB4_WGM1_WGMXCC1_WGMXCCGn1
    SolutionIndex: 45
    SolutionNameMin: Cijk_Ailk_Bjlk_BBS_BH_UserArgs_MT128x128x32_MI16x16x1_SN_LDSB1_CLR1_GSU0_GSUC0_GSUWGMRR0_K1_LBSPPA1024_LBSPPB1024_LPA0_LPB16_MIWT4_4_PLR1_SU32_SUM0_SUS256_VWA4_VWB1_WGM4_WGMXCC1_WGMXCCGn1
    SolutionIndex: 46
    SolutionNameMin: Cijk_Ailk_Bjlk_BBS_BH_UserArgs_MT128x128x32_MI16x16x1_SN_LDSB1_CLR1_GSU0_GSUC0_GSUWGMRR0_K1_LBSPPA1024_LBSPPB1024_LPA32_LPB0_MIWT4_4_PLR1_SU32_SUM0_SUS256_VWA2_VWB4_WGM4_WGMXCC1_WGMXCCGn1
    SolutionIndex: 47
    SolutionNameMin: Cijk_Ailk_Bjlk_BBS_BH_UserArgs_MT128x128x32_MI16x16x1_SN_LDSB0_CLR1_GSU0_GSUC0_GSUWGMRR0_K1_LBSPPA1024_LBSPPB1024_LPA0_LPB0_MIWT4_4_PLR1_SU32_SUM0_SUS256_VWA4_VWB4_WGM4_WGMXCC1_WGMXCCGn1
    SolutionIndex: 48
    SolutionNameMin: Cijk_Ailk_Bjlk_BBS_BH_UserArgs_MT128x128x32_MI16x16x1_SN_LDSB0_CLR0_GSU0_GSUC0_GSUWGMRR0_K1_LBSPPA1024_LBSPPB1024_LPA0_LPB0_MIWT4_4_PLR0_SU32_SUM0_SUS256_VWA4_VWB4_WGM4_WGMXCC1_WGMXCCGn1
    SolutionIndex: 49
    SolutionNameMin: Cijk_Ailk_Bjlk_BBS_BH_UserArgs_MT128x128x32_MI16x16x1_SN_LDSB1_CLR1_GSU0_GSUC0_GSUWGMRR0_K1_LBSPPA1024_LBSPPB1024_LPA32_LPB16_MIWT4_4_PLR1_SU32_SUM0_SUS256_VWA2_VWB1_WGM8_WGMXCC1_WGMXCCGn1
    SolutionIndex: 50
    SolutionNameMin: Cijk_Ailk_Bjlk_BBS_BH_UserArgs_MT128x128x32_MI16x16x1_SN_LDSB1_CLR1_GSU0_GSUC0_GSUWGMRR0_K1_LBSPPA1024_LBSPPB1024_LPA32_LPB32_MIWT4_4_PLR1_SU32_SUM0_SUS256_VWA2_VWB2_WGM8_WGMXCC1_WGMXCCGn1
    SolutionIndex: 51
    SolutionNameMin: Cijk_Ailk_Bjlk_BBS_BH_UserArgs_MT128x128x32_MI16x16x1_SN_LDSB1_CLR1_GSU0_GSUC0_GSUWGMRR0_K1_LBSPPA1024_LBSPPB1024_LPA0_LPB32_MIWT4_4_PLR1_SU32_SUM0_SUS256_VWA4_VWB2_WGM8_WGMXCC1_WGMXCCGn1
    SolutionIndex: 52
    SolutionNameMin: Cijk_Ailk_Bjlk_BBS_BH_UserArgs_MT128x128x32_MI16x16x1_SN_LDSB1_CLR1_GSU0_GSUC0_GSUWGMRR0_K1_LBSPPA1024_LBSPPB1024_LPA32_LPB0_MIWT4_4_PLR1_SU32_SUM0_SUS256_VWA2_VWB4_WGM8_WGMXCC1_WGMXCCGn1
    SolutionIndex: 53
    SolutionNameMin: Cijk_Ailk_Bjlk_BBS_BH_UserArgs_MT128x128x32_MI16x16x1_SN_LDSB0_CLR1_GSU0_GSUC0_GSUWGMRR0_K1_LBSPPA1024_LBSPPB1024_LPA0_LPB0_MIWT4_4_PLR1_SU32_SUM0_SUS256_VWA4_VWB4_WGM8_WGMXCC1_WGMXCCGn1
    SolutionIndex: 54
    SolutionNameMin: Cijk_Ailk_Bjlk_BBS_BH_UserArgs_MT128x128x32_MI16x16x1_SN_LDSB0_CLR0_GSU0_GSUC0_GSUWGMRR0_K1_LBSPPA1024_LBSPPB1024_LPA0_LPB0_MIWT4_4_PLR0_SU32_SUM0_SUS256_VWA4_VWB4_WGM8_WGMXCC1_WGMXCCGn1
    SolutionIndex: 55
    SolutionNameMin: Cijk_Ailk_Bjlk_BBS_BH_UserArgs_MT64x128x32_MI16x16x1_SN_LDSB0_CLR1_GSU0_GSUC0_GSUWGMRR0_K1_LBSPPA512_LBSPPB1024_LPA32_LPB0_MIWT2_4_PLR1_SU32_SUM0_SUS256_VWA2_VWB4_WGM1_WGMXCC1_WGMXCCGn1
    SolutionIndex: 56
    SolutionNameMin: Cijk_Ailk_Bjlk_BBS_BH_UserArgs_MT64x128x32_MI16x16x1_SN_LDSB0_CLR1_GSU0_GSUC0_GSUWGMRR0_K1_LBSPPA512_LBSPPB1024_LPA32_LPB0_MIWT2_4_PLR1_SU32_SUM0_SUS256_VWA2_VWB4_WGM4_WGMXCC1_WGMXCCGn1
    SolutionIndex: 57
    SolutionNameMin: Cijk_Ailk_Bjlk_BBS_BH_UserArgs_MT64x128x32_MI16x16x1_SN_LDSB0_CLR0_GSU0_GSUC0_GSUWGMRR0_K1_LBSPPA512_LBSPPB1024_LPA32_LPB32_MIWT2_4_PLR0_SU32_SUM0_SUS256_VWA2_VWB2_WGM8_WGMXCC1_WGMXCCGn1
    SolutionIndex: 58
    SolutionNameMin: Cijk_Ailk_Bjlk_BBS_BH_UserArgs_MT128x64x32_MI16x16x1_SN_LDSB0_CLR1_GSU0_GSUC0_GSUWGMRR0_K1_LBSPPA1024_LBSPPB512_LPA0_LPB16_MIWT4_2_PLR1_SU32_SUM0_SUS256_VWA4_VWB1_WGM1_WGMXCC1_WGMXCCGn1
    SolutionIndex: 59
    SolutionNameMin: Cijk_Ailk_Bjlk_BBS_BH_UserArgs_MT128x64x32_MI16x16x1_SN_LDSB0_CLR1_GSU0_GSUC0_GSUWGMRR0_K1_LBSPPA1024_LBSPPB512_LPA0_LPB32_MIWT4_2_PLR1_SU32_SUM0_SUS256_VWA4_VWB2_WGM1_WGMXCC1_WGMXCCGn1
    SolutionIndex: 60
    SolutionNameMin: Cijk_Ailk_Bjlk_BBS_BH_UserArgs_MT128x64x32_MI16x16x1_SN_LDSB0_CLR0_GSU0_GSUC0_GSUWGMRR0_K1_LBSPPA1024_LBSPPB512_LPA32_LPB32_MIWT4_2_PLR0_SU32_SUM0_SUS256_VWA2_VWB2_WGM1_WGMXCC1_WGMXCCGn1
    SolutionIndex: 61
    SolutionNameMin: Cijk_Ailk_Bjlk_BBS_BH_UserArgs_MT128x64x32_MI16x16x1_SN_LDSB0_CLR0_GSU0_GSUC0_GSUWGMRR0_K1_LBSPPA1024_LBSPPB512_LPA0_LPB32_MIWT4_2_PLR0_SU32_SUM0_SUS256_VWA4_VWB2_WGM1_WGMXCC1_WGMXCCGn1
    SolutionIndex: 62
    SolutionNameMin: Cijk_Ailk_Bjlk_BBS_BH_UserArgs_MT128x64x32_MI16x16x1_SN_LDSB0_CLR1_GSU0_GSUC0_GSUWGMRR0_K1_LBSPPA1024_LBSPPB512_LPA0_LPB16_MIWT4_2_PLR1_SU32_SUM0_SUS256_VWA4_VWB1_WGM4_WGMXCC1_WGMXCCGn1
    SolutionIndex: 63
    SolutionNameMin: Cijk_Ailk_Bjlk_BBS_BH_UserArgs_MT128x64x32_MI16x16x1_SN_LDSB0_CLR1_GSU0_GSUC0_GSUWGMRR0_K1_LBSPPA1024_LBSPPB512_LPA0_LPB32_MIWT4_2_PLR1_SU32_SUM0_SUS256_VWA4_VWB2_WGM4_WGMXCC1_WGMXCCGn1
    SolutionIndex: 64
    SolutionNameMin: Cijk_Ailk_Bjlk_BBS_BH_UserArgs_MT128x64x32_MI16x16x1_SN_LDSB0_CLR1_GSU0_GSUC0_GSUWGMRR0_K1_LBSPPA1024_LBSPPB512_LPA0_LPB16_MIWT4_2_PLR1_SU32_SUM0_SUS256_VWA4_VWB1_WGM8_WGMXCC1_WGMXCCGn1
    SolutionIndex: 65
    SolutionNameMin: Cijk_Ailk_Bjlk_BBS_BH_UserArgs_MT128x64x32_MI16x16x1_SN_LDSB0_CLR1_GSU0_GSUC0_GSUWGMRR0_K1_LBSPPA1024_LBSPPB512_LPA0_LPB32_MIWT4_2_PLR1_SU32_SUM0_SUS256_VWA4_VWB2_WGM8_WGMXCC1_WGMXCCGn1
    SolutionIndex: 66
    SolutionNameMin: Cijk_Ailk_Bjlk_BBS_BH_UserArgs_MT64x64x32_MI16x16x1_SN_LDSB0_CLR1_GSU0_GSUC0_GSUWGMRR0_K1_LBSPPA512_LBSPPB512_LPA32_LPB16_MIWT2_2_PLR1_SU32_SUM0_SUS256_VWA2_VWB1_WGM1_WGMXCC1_WGMXCCGn1
    SolutionIndex: 67
    SolutionNameMin: Cijk_Ailk_Bjlk_BBS_BH_UserArgs_MT64x64x32_MI16x16x1_SN_LDSB0_CLR1_GSU0_GSUC0_GSUWGMRR0_K1_LBSPPA512_LBSPPB512_LPA32_LPB32_MIWT2_2_PLR1_SU32_SUM0_SUS256_VWA2_VWB2_WGM1_WGMXCC1_WGMXCCGn1
    SolutionIndex: 68
    SolutionNameMin: Cijk_Ailk_Bjlk_BBS_BH_UserArgs_MT64x64x32_MI16x16x1_SN_LDSB0_CLR0_GSU0_GSUC0_GSUWGMRR0_K1_LBSPPA512_LBSPPB512_LPA32_LPB32_MIWT2_2_PLR0_SU32_SUM0_SUS256_VWA2_VWB2_WGM1_WGMXCC1_WGMXCCGn1
    SolutionIndex: 69
    SolutionNameMin: Cijk_Ailk_Bjlk_BBS_BH_UserArgs_MT32x64x32_MI16x16x1_SN_LDSB0_CLR0_GSU0_GSUC0_GSUWGMRR0_K1_LBSPPA256_LBSPPB512_LPA16_LPB32_MIWT1_2_PLR0_SU32_SUM0_SUS256_VWA1_VWB2_WGM1_WGMXCC1_WGMXCCGn1
    SolutionIndex: 70
    SolutionNameMin: Cijk_Ailk_Bjlk_BBS_BH_UserArgs_MT64x32x32_MI16x16x1_SN_LDSB0_CLR1_GSU0_GSUC0_GSUWGMRR0_K1_LBSPPA512_LBSPPB256_LPA32_LPB16_MIWT2_1_PLR1_SU32_SUM0_SUS256_VWA2_VWB1_WGM1_WGMXCC1_WGMXCCGn1
    SolutionIndex: 71
    SolutionNameMin: Cijk_Ailk_Bjlk_BBS_BH_UserArgs_MT32x32x32_MI16x16x1_SN_LDSB0_CLR1_GSU0_GSUC0_GSUWGMRR0_K1_LBSPPA256_LBSPPB256_LPA16_LPB16_MIWT1_1_PLR1_SU32_SUM0_SUS256_VWA1_VWB1_WGM1_WGMXCC1_WGMXCCGn1
    SolutionIndex: 72
    SolutionNameMin: Cijk_Ailk_Bjlk_BBS_BH_UserArgs_MT256x256x64_MI16x16x1_SN_LDSB1_CLR1_GSU0_GSUC0_GSUWGMRR0_K1_LBSPPA2048_LBSPPB2048_LPA0_LPB0_MIWT8_8_PLR1_SU32_SUM0_SUS256_VWA4_VWB4_WGM1_WGMXCC1_WGMXCCGn1
    SolutionIndex: 73
    SolutionNameMin: Cijk_Ailk_Bjlk_BBS_BH_UserArgs_MT256x256x64_MI16x16x1_SN_LDSB1_CLR1_GSU0_GSUC0_GSUWGMRR0_K1_LBSPPA2048_LBSPPB2048_LPA0_LPB0_MIWT8_8_PLR2_SU32_SUM0_SUS256_VWA4_VWB4_WGM1_WGMXCC1_WGMXCCGn1
    SolutionIndex: 74
    SolutionNameMin: Cijk_Ailk_Bjlk_BBS_BH_UserArgs_MT256x256x64_MI16x16x1_SN_LDSB1_CLR1_GSU0_GSUC0_GSUWGMRR0_K1_LBSPPA2048_LBSPPB2048_LPA0_LPB0_MIWT8_8_PLR2_SU32_SUM0_SUS256_VWA8_VWB8_WGM1_WGMXCC1_WGMXCCGn1
    SolutionIndex: 75
    SolutionNameMin: Cijk_Ailk_Bjlk_BBS_BH_UserArgs_MT256x256x64_MI16x16x1_SN_LDSB1_CLR1_GSU0_GSUC0_GSUWGMRR0_K1_LBSPPA2048_LBSPPB2048_LPA0_LPB0_MIWT8_8_PLR1_SU32_SUM0_SUS256_VWA4_VWB4_WGM4_WGMXCC1_WGMXCCGn1
    SolutionIndex: 76
    SolutionNameMin: Cijk_Ailk_Bjlk_BBS_BH_UserArgs_MT256x256x64_MI16x16x1_SN_LDSB1_CLR1_GSU0_GSUC0_GSUWGMRR0_K1_LBSPPA2048_LBSPPB2048_LPA0_LPB0_MIWT8_8_PLR2_SU32_SUM0_SUS256_VWA4_VWB4_WGM4_WGMXCC1_WGMXCCGn1
    SolutionIndex: 77
    SolutionNameMin: Cijk_Ailk_Bjlk_BBS_BH_UserArgs_MT128x256x64_MI16x16x1_SN_LDSB1_CLR1_GSU0_GSUC0_GSUWGMRR0_K1_LBSPPA1024_LBSPPB2048_LPA0_LPB32_MIWT4_8_PLR1_SU32_SUM0_SUS256_VWA4_VWB2_WGM1_WGMXCC1_WGMXCCGn1
    SolutionIndex: 78
    SolutionNameMin: Cijk_Ailk_Bjlk_BBS_BH_UserArgs_MT256x128x64_MI16x16x1_SN_LDSB1_CLR1_GSU0_GSUC0_GSUWGMRR0_K1_LBSPPA2048_LBSPPB1024_LPA0_LPB32_MIWT8_4_PLR2_SU32_SUM0_SUS256_VWA4_VWB2_WGM8_WGMXCC1_WGMXCCGn1
    SolutionIndex: 79
    SolutionNameMin: Cijk_Ailk_Bjlk_BBS_BH_UserArgs_MT128x128x64_MI16x16x1_SN_LDSB1_CLR1_GSU0_GSUC0_GSUWGMRR0_K1_LBSPPA1024_LBSPPB1024_LPA0_LPB0_MIWT4_4_PLR1_SU32_SUM0_SUS256_VWA4_VWB4_WGM1_WGMXCC1_WGMXCCGn1
    SolutionIndex: 80
    SolutionNameMin: Cijk_Ailk_Bjlk_BBS_BH_UserArgs_MT128x128x64_MI16x16x1_SN_LDSB1_CLR1_GSU0_GSUC0_GSUWGMRR0_K1_LBSPPA1024_LBSPPB1024_LPA0_LPB0_MIWT4_4_PLR2_SU32_SUM0_SUS256_VWA4_VWB4_WGM1_WGMXCC1_WGMXCCGn1
    SolutionIndex: 81
    SolutionNameMin: Cijk_Ailk_Bjlk_BBS_BH_UserArgs_MT128x128x64_MI16x16x1_SN_LDSB1_CLR1_GSU0_GSUC0_GSUWGMRR0_K1_LBSPPA1024_LBSPPB1024_LPA0_LPB0_MIWT4_4_PLR1_SU32_SUM0_SUS256_VWA4_VWB4_WGM4_WGMXCC1_WGMXCCGn1
    SolutionIndex: 82
    SolutionNameMin: Cijk_Ailk_Bjlk_BBS_BH_UserArgs_MT128x128x64_MI16x16x1_SN_LDSB1_CLR1_GSU0_GSUC0_GSUWGMRR0_K1_LBSPPA1024_LBSPPB1024_LPA0_LPB0_MIWT4_4_PLR2_SU32_SUM0_SUS256_VWA4_VWB4_WGM4_WGMXCC1_WGMXCCGn1
    SolutionIndex: 83
    SolutionNameMin: Cijk_Ailk_Bjlk_BBS_BH_UserArgs_MT128x128x64_MI16x16x1_SN_LDSB1_CLR1_GSU0_GSUC0_GSUWGMRR0_K1_LBSPPA1024_LBSPPB1024_LPA0_LPB0_MIWT4_4_PLR1_SU32_SUM0_SUS256_VWA4_VWB4_WGM8_WGMXCC1_WGMXCCGn1
    SolutionIndex: 84
    SolutionNameMin: Cijk_Ailk_Bjlk_BBS_BH_UserArgs_MT128x128x64_MI16x16x1_SN_LDSB1_CLR1_GSU0_GSUC0_GSUWGMRR0_K1_LBSPPA1024_LBSPPB1024_LPA0_LPB0_MIWT4_4_PLR2_SU32_SUM0_SUS256_VWA4_VWB4_WGM8_WGMXCC1_WGMXCCGn1
    SolutionIndex: 85
    SolutionNameMin: Cijk_Ailk_Bjlk_BBS_BH_UserArgs_MT128x64x64_MI16x16x1_SN_LDSB1_CLR1_GSU0_GSUC0_GSUWGMRR0_K1_LBSPPA1024_LBSPPB512_LPA0_LPB16_MIWT4_2_PLR1_SU32_SUM0_SUS256_VWA4_VWB1_WGM1_WGMXCC1_WGMXCCGn1
    SolutionIndex: 86
    SolutionNameMin: Cijk_Ailk_Bjlk_BBS_BH_UserArgs_MT128x64x64_MI16x16x1_SN_LDSB1_CLR1_GSU0_GSUC0_GSUWGMRR0_K1_LBSPPA1024_LBSPPB512_LPA0_LPB32_MIWT4_2_PLR1_SU32_SUM0_SUS256_VWA4_VWB2_WGM1_WGMXCC1_WGMXCCGn1
    SolutionIndex: 87
    SolutionNameMin: Cijk_Ailk_Bjlk_BBS_BH_UserArgs_MT128x64x64_MI16x16x1_SN_LDSB1_CLR1_GSU0_GSUC0_GSUWGMRR0_K1_LBSPPA1024_LBSPPB512_LPA0_LPB16_MIWT4_2_PLR2_SU32_SUM0_SUS256_VWA4_VWB1_WGM1_WGMXCC1_WGMXCCGn1
    SolutionIndex: 88
    SolutionNameMin: Cijk_Ailk_Bjlk_BBS_BH_UserArgs_MT128x64x64_MI16x16x1_SN_LDSB1_CLR1_GSU0_GSUC0_GSUWGMRR0_K1_LBSPPA1024_LBSPPB512_LPA0_LPB32_MIWT4_2_PLR2_SU32_SUM0_SUS256_VWA4_VWB2_WGM1_WGMXCC1_WGMXCCGn1
    SolutionIndex: 89
    SolutionNameMin: Cijk_Ailk_Bjlk_BBS_BH_UserArgs_MT128x64x64_MI16x16x1_SN_LDSB1_CLR1_GSU0_GSUC0_GSUWGMRR0_K1_LBSPPA1024_LBSPPB512_LPA0_LPB32_MIWT4_2_PLR1_SU32_SUM0_SUS256_VWA4_VWB2_WGM4_WGMXCC1_WGMXCCGn1
    SolutionIndex: 90
    SolutionNameMin: Cijk_Ailk_Bjlk_BBS_BH_UserArgs_MT128x64x64_MI16x16x1_SN_LDSB1_CLR1_GSU0_GSUC0_GSUWGMRR0_K1_LBSPPA1024_LBSPPB512_LPA0_LPB32_MIWT4_2_PLR2_SU32_SUM0_SUS256_VWA4_VWB2_WGM4_WGMXCC1_WGMXCCGn1
    SolutionIndex: 91
    SolutionNameMin: Cijk_Ailk_Bjlk_BBS_BH_UserArgs_MT128x64x64_MI16x16x1_SN_LDSB1_CLR1_GSU0_GSUC0_GSUWGMRR0_K1_LBSPPA1024_LBSPPB512_LPA0_LPB16_MIWT4_2_PLR1_SU32_SUM0_SUS256_VWA4_VWB1_WGM8_WGMXCC1_WGMXCCGn1
    SolutionIndex: 92
    SolutionNameMin: Cijk_Ailk_Bjlk_BBS_BH_UserArgs_MT128x64x64_MI16x16x1_SN_LDSB1_CLR1_GSU0_GSUC0_GSUWGMRR0_K1_LBSPPA1024_LBSPPB512_LPA32_LPB32_MIWT4_2_PLR1_SU32_SUM0_SUS256_VWA2_VWB2_WGM8_WGMXCC1_WGMXCCGn1
    SolutionIndex: 93
    SolutionNameMin: Cijk_Ailk_Bjlk_BBS_BH_UserArgs_MT128x64x64_MI16x16x1_SN_LDSB1_CLR1_GSU0_GSUC0_GSUWGMRR0_K1_LBSPPA1024_LBSPPB512_LPA0_LPB32_MIWT4_2_PLR1_SU32_SUM0_SUS256_VWA4_VWB2_WGM8_WGMXCC1_WGMXCCGn1
    SolutionIndex: 94
    SolutionNameMin: Cijk_Ailk_Bjlk_BBS_BH_UserArgs_MT128x64x64_MI16x16x1_SN_LDSB1_CLR1_GSU0_GSUC0_GSUWGMRR0_K1_LBSPPA1024_LBSPPB512_LPA0_LPB32_MIWT4_2_PLR2_SU32_SUM0_SUS256_VWA4_VWB2_WGM8_WGMXCC1_WGMXCCGn1
    SolutionIndex: 95
    SolutionNameMin: Cijk_Ailk_Bjlk_BBS_BH_UserArgs_MT64x64x64_MI16x16x1_SN_LDSB1_CLR1_GSU0_GSUC0_GSUWGMRR0_K1_LBSPPA512_LBSPPB512_LPA32_LPB16_MIWT2_2_PLR1_SU32_SUM0_SUS256_VWA2_VWB1_WGM1_WGMXCC1_WGMXCCGn1
    SolutionIndex: 96
    SolutionNameMin: Cijk_Ailk_Bjlk_BBS_BH_UserArgs_MT64x64x64_MI16x16x1_SN_LDSB1_CLR1_GSU0_GSUC0_GSUWGMRR0_K1_LBSPPA512_LBSPPB512_LPA32_LPB32_MIWT2_2_PLR1_SU32_SUM0_SUS256_VWA2_VWB2_WGM1_WGMXCC1_WGMXCCGn1
    SolutionIndex: 97
    SolutionNameMin: Cijk_Ailk_Bjlk_BBS_BH_UserArgs_MT64x64x64_MI16x16x1_SN_LDSB1_CLR1_GSU0_GSUC0_GSUWGMRR0_K1_LBSPPA512_LBSPPB512_LPA32_LPB32_MIWT2_2_PLR2_SU32_SUM0_SUS256_VWA2_VWB2_WGM1_WGMXCC1_WGMXCCGn1
    SolutionIndex: 98
    SolutionNameMin: Cijk_Ailk_Bjlk_BBS_BH_UserArgs_MT64x64x64_MI16x16x1_SN_LDSB1_CLR1_GSU0_GSUC0_GSUWGMRR0_K1_LBSPPA512_LBSPPB512_LPA32_LPB32_MIWT2_2_PLR1_SU32_SUM0_SUS256_VWA2_VWB2_WGM8_WGMXCC1_WGMXCCGn1
    SolutionIndex: 99
    SolutionNameMin: Cijk_Ailk_Bjlk_BBS_BH_UserArgs_MT64x64x64_MI16x16x1_SN_LDSB1_CLR1_GSU0_GSUC0_GSUWGMRR0_K1_LBSPPA512_LBSPPB512_LPA32_LPB32_MIWT2_2_PLR2_SU32_SUM0_SUS256_VWA2_VWB2_WGM8_WGMXCC1_WGMXCCGn1
    SolutionIndex: 100
    SolutionNameMin: Cijk_Ailk_Bjlk_BBS_BH_UserArgs_MT32x64x64_MI16x16x1_SN_LDSB0_CLR1_GSU0_GSUC0_GSUWGMRR0_K1_LBSPPA256_LBSPPB512_LPA16_LPB32_MIWT1_2_PLR1_SU32_SUM0_SUS256_VWA1_VWB2_WGM1_WGMXCC1_WGMXCCGn1
    SolutionIndex: 101
    SolutionNameMin: Cijk_Ailk_Bjlk_BBS_BH_UserArgs_MT32x64x64_MI16x16x1_SN_LDSB0_CLR1_GSU0_GSUC0_GSUWGMRR0_K1_LBSPPA256_LBSPPB512_LPA16_LPB32_MIWT1_2_PLR2_SU32_SUM0_SUS256_VWA1_VWB2_WGM1_WGMXCC1_WGMXCCGn1
    SolutionIndex: 102
    SolutionNameMin: Cijk_Ailk_Bjlk_BBS_BH_UserArgs_MT64x32x64_MI16x16x1_SN_LDSB0_CLR1_GSU0_GSUC0_GSUWGMRR0_K1_LBSPPA512_LBSPPB256_LPA32_LPB16_MIWT2_1_PLR2_SU32_SUM0_SUS256_VWA2_VWB1_WGM1_WGMXCC1_WGMXCCGn1
    SolutionIndex: 103
    SolutionNameMin: Cijk_Ailk_Bjlk_BBS_BH_UserArgs_MT128x128x128_MI16x16x1_SN_LDSB1_CLR1_GSU0_GSUC0_GSUWGMRR0_K1_LBSPPA1024_LBSPPB1024_LPA0_LPB0_MIWT4_4_PLR1_SU32_SUM0_SUS256_VWA4_VWB4_WGM1_WGMXCC1_WGMXCCGn1
    SolutionIndex: 104
    SolutionNameMin: Cijk_Ailk_Bjlk_BBS_BH_UserArgs_MT128x128x128_MI16x16x1_SN_LDSB1_CLR1_GSU0_GSUC0_GSUWGMRR0_K1_LBSPPA1024_LBSPPB1024_LPA0_LPB0_MIWT4_4_PLR2_SU32_SUM0_SUS256_VWA4_VWB4_WGM1_WGMXCC1_WGMXCCGn1
    SolutionIndex: 105
    SolutionNameMin: Cijk_Ailk_Bjlk_BBS_BH_UserArgs_MT128x128x128_MI16x16x1_SN_LDSB1_CLR1_GSU0_GSUC0_GSUWGMRR0_K1_LBSPPA1024_LBSPPB1024_LPA0_LPB0_MIWT4_4_PLR1_SU32_SUM0_SUS256_VWA4_VWB4_WGM4_WGMXCC1_WGMXCCGn1
    SolutionIndex: 106
    SolutionNameMin: Cijk_Ailk_Bjlk_BBS_BH_UserArgs_MT128x128x128_MI16x16x1_SN_LDSB1_CLR1_GSU0_GSUC0_GSUWGMRR0_K1_LBSPPA1024_LBSPPB1024_LPA0_LPB0_MIWT4_4_PLR2_SU32_SUM0_SUS256_VWA4_VWB4_WGM4_WGMXCC1_WGMXCCGn1
    SolutionIndex: 107
    SolutionNameMin: Cijk_Ailk_Bjlk_BBS_BH_UserArgs_MT128x128x128_MI16x16x1_SN_LDSB1_CLR1_GSU0_GSUC0_GSUWGMRR0_K1_LBSPPA1024_LBSPPB1024_LPA0_LPB0_MIWT4_4_PLR1_SU32_SUM0_SUS256_VWA4_VWB4_WGM8_WGMXCC1_WGMXCCGn1
    SolutionIndex: 108
    SolutionNameMin: Cijk_Ailk_Bjlk_BBS_BH_UserArgs_MT128x32x128_MI16x16x1_SN_LDSB1_CLR1_GSU0_GSUC0_GSUWGMRR0_K1_LBSPPA1024_LBSPPB256_LPA0_LPB16_MIWT4_1_PLR2_SU32_SUM0_SUS256_VWA4_VWB1_WGM1_WGMXCC1_WGMXCCGn1
    SolutionIndex: 109
    SolutionNameMin: Cijk_Ailk_Bjlk_BBS_BH_UserArgs_MT64x64x128_MI16x16x1_SN_LDSB1_CLR1_GSU0_GSUC0_GSUWGMRR0_K1_LBSPPA512_LBSPPB512_LPA32_LPB32_MIWT2_2_PLR1_SU32_SUM0_SUS256_VWA2_VWB2_WGM1_WGMXCC1_WGMXCCGn1
    SolutionIndex: 110
    SolutionNameMin: Cijk_Ailk_Bjlk_BBS_BH_UserArgs_MT64x64x128_MI16x16x1_SN_LDSB1_CLR1_GSU0_GSUC0_GSUWGMRR0_K1_LBSPPA512_LBSPPB512_LPA32_LPB16_MIWT2_2_PLR2_SU32_SUM0_SUS256_VWA2_VWB1_WGM1_WGMXCC1_WGMXCCGn1
    SolutionIndex: 111
    SolutionNameMin: Cijk_Ailk_Bjlk_BBS_BH_UserArgs_MT64x64x128_MI16x16x1_SN_LDSB1_CLR1_GSU0_GSUC0_GSUWGMRR0_K1_LBSPPA512_LBSPPB512_LPA32_LPB32_MIWT2_2_PLR2_SU32_SUM0_SUS256_VWA2_VWB2_WGM1_WGMXCC1_WGMXCCGn1
    SolutionIndex: 112
    SolutionNameMin: Cijk_Ailk_Bjlk_BBS_BH_UserArgs_MT64x64x128_MI16x16x1_SN_LDSB1_CLR1_GSU0_GSUC0_GSUWGMRR0_K1_LBSPPA512_LBSPPB512_LPA32_LPB32_MIWT2_2_PLR1_SU32_SUM0_SUS256_VWA2_VWB2_WGM8_WGMXCC1_WGMXCCGn1
    SolutionIndex: 113
    SolutionNameMin: Cijk_Ailk_Bjlk_BBS_BH_UserArgs_MT32x64x128_MI16x16x1_SN_LDSB1_CLR1_GSU0_GSUC0_GSUWGMRR0_K1_LBSPPA256_LBSPPB512_LPA16_LPB32_MIWT1_2_PLR2_SU32_SUM0_SUS256_VWA1_VWB2_WGM1_WGMXCC1_WGMXCCGn1
    SolutionIndex: 114
    SolutionNameMin: Cijk_Ailk_Bjlk_BBS_BH_UserArgs_MT32x64x128_MI16x16x1_SN_LDSB1_CLR1_GSU0_GSUC0_GSUWGMRR0_K1_LBSPPA256_LBSPPB512_LPA16_LPB32_MIWT1_2_PLR2_SU32_SUM0_SUS256_VWA1_VWB2_WGM4_WGMXCC1_WGMXCCGn1
    SolutionIndex: 115
    SolutionNameMin: Cijk_Ailk_Bjlk_BBS_BH_UserArgs_MT64x32x128_MI16x16x1_SN_LDSB1_CLR1_GSU0_GSUC0_GSUWGMRR0_K1_LBSPPA512_LBSPPB256_LPA32_LPB16_MIWT2_1_PLR1_SU32_SUM0_SUS256_VWA2_VWB1_WGM1_WGMXCC1_WGMXCCGn1
    SolutionIndex: 116
    SolutionNameMin: Cijk_Ailk_Bjlk_BBS_BH_UserArgs_MT64x32x128_MI16x16x1_SN_LDSB1_CLR1_GSU0_GSUC0_GSUWGMRR0_K1_LBSPPA512_LBSPPB256_LPA32_LPB16_MIWT2_1_PLR2_SU32_SUM0_SUS256_VWA2_VWB1_WGM1_WGMXCC1_WGMXCCGn1
    SolutionIndex: 117
    SolutionNameMin: Cijk_Ailk_Bjlk_BBS_BH_UserArgs_MT32x32x128_MI16x16x1_SN_LDSB1_CLR1_GSU0_GSUC0_GSUWGMRR0_K1_LBSPPA256_LBSPPB256_LPA16_LPB16_MIWT1_1_PLR1_SU32_SUM0_SUS256_VWA1_VWB1_WGM1_WGMXCC1_WGMXCCGn1
    SolutionIndex: 118
    SolutionNameMin: Cijk_Ailk_Bjlk_BBS_BH_UserArgs_MT32x32x128_MI16x16x1_SN_LDSB1_CLR1_GSU0_GSUC0_GSUWGMRR0_K1_LBSPPA256_LBSPPB256_LPA16_LPB16_MIWT1_1_PLR2_SU32_SUM0_SUS256_VWA1_VWB1_WGM1_WGMXCC1_WGMXCCGn1
    SolutionIndex: 119
    SolutionNameMin: Cijk_Ailk_Bjlk_BBS_BH_UserArgs_MT32x32x32_MI16x16x1_SN_LDSB0_CLR1_GSU0_GSUC0_GSUWGMRR0_K1_LBSPPA256_LBSPPB256_LPA16_LPB16_MIWT1_1_PLR1_SU32_SUM0_SUS256_VWA1_VWB1_WGM8_WGMXCC1_WGMXCCGn1
- - - [128, 128, 1, 128, 128, 128, 128, 128]
    - [118, 0.087]
  - - [128, 128, 1, 256, 128, 128, 128, 128]
    - [108, 0.1]
  - - [128, 128, 1, 512, 128, 128, 128, 128]
    - [115, 0.159]
  - - [128, 128, 1, 1024, 128, 128, 128, 128]
    - [117, 0.279]
  - - [128, 128, 1, 2048, 128, 128, 128, 128]
    - [71, 0.484]
  - - [128, 128, 1, 4096, 128, 128, 128, 128]
    - [101, 0.726]
  - - [128, 128, 1, 8192, 128, 128, 128, 128]
    - [113, 1.116]
  - - [128, 256, 1, 128, 128, 128, 128, 256]
    - [117, 0.153]
  - - [128, 256, 1, 256, 128, 128, 128, 256]
    - [118, 0.213]
  - - [128, 256, 1, 512, 128, 128, 128, 256]
    - [117, 0.299]
  - - [128, 256, 1, 1024, 128, 128, 128, 256]
    - [117, 0.516]
  - - [128, 256, 1, 2048, 128, 128, 128, 256]
    - [113, 0.794]
  - - [128, 256, 1, 4096, 128, 128, 128, 256]
    - [102, 1.226]
  - - [128, 256, 1, 8192, 128, 128, 128, 256]
    - [96, 1.81]
  - - [128, 512, 1, 128, 128, 128, 128, 512]
    - [114, 0.289]
  - - [128, 512, 1, 256, 128, 128, 128, 512]
    - [71, 0.459]
  - - [128, 512, 1, 512, 128, 128, 128, 512]
    - [117, 0.695]
  - - [128, 512, 1, 1024, 128, 128, 128, 512]
    - [118, 0.946]
  - - [128, 512, 1, 2048, 128, 128, 128, 512]
    - [67, 1.378]
  - - [128, 512, 1, 4096, 128, 128, 128, 512]
    - [99, 2.135]
  - - [128, 512, 1, 8192, 128, 128, 128, 512]
    - [93, 2.56]
  - - [128, 1024, 1, 128, 128, 128, 128, 1024]
    - [110, 0.55]
  - - [128, 1024, 1, 256, 128, 128, 128, 1024]
    - [115, 0.832]
  - - [128, 1024, 1, 512, 128, 128, 128, 1024]
    - [101, 1.259]
  - - [128, 1024, 1, 1024, 128, 128, 128, 1024]
    - [113, 1.697]
  - - [128, 1024, 1, 2048, 128, 128, 128, 1024]
    - [57, 2.045]
  - - [128, 1024, 1, 4096, 128, 128, 128, 1024]
    - [89, 3.053]
  - - [128, 1024, 1, 8192, 128, 128, 128, 1024]
    - [44, 3.842]
  - - [128, 2048, 1, 128, 128, 128, 128, 2048]
    - [66, 0.918]
  - - [128, 2048, 1, 256, 128, 128, 128, 2048]
    - [96, 1.502]
  - - [128, 2048, 1, 512, 128, 128, 128, 2048]
    - [97, 2.159]
  - - [128, 2048, 1, 1024, 128, 128, 128, 2048]
    - [90, 2.387]
  - - [128, 2048, 1, 2048, 128, 128, 128, 2048]
    - [47, 3.166]
  - - [128, 2048, 1, 4096, 128, 128, 128, 2048]
    - [81, 4.583]
  - - [128, 2048, 1, 8192, 128, 128, 128, 2048]
    - [106, 4.722]
  - - [128, 4096, 1, 128, 128, 128, 128, 4096]
    - [55, 1.497]
  - - [128, 4096, 1, 256, 128, 128, 128, 4096]
    - [59, 2.31]
  - - [128, 4096, 1, 512, 128, 128, 128, 4096]
    - [93, 3.076]
  - - [128, 4096, 1, 1024, 128, 128, 128, 4096]
    - [84, 3.104]
  - - [128, 4096, 1, 2048, 128, 128, 128, 4096]
    - [42, 3.679]
  - - [128, 4096, 1, 4096, 128, 128, 128, 4096]
    - [82, 5.09]
  - - [128, 4096, 1, 8192, 128, 128, 128, 4096]
    - [41, 5.411]
  - - [128, 8192, 1, 128, 128, 128, 128, 8192]
    - [49, 2.033]
  - - [128, 8192, 1, 256, 128, 128, 128, 8192]
    - [48, 3.12]
  - - [128, 8192, 1, 512, 128, 128, 128, 8192]
    - [81, 3.7]
  - - [128, 8192, 1, 1024, 128, 128, 128, 8192]
    - [103, 4.086]
  - - [128, 8192, 1, 2048, 128, 128, 128, 8192]
    - [81, 4.789]
  - - [128, 8192, 1, 4096, 128, 128, 128, 8192]
    - [81, 5.609]
  - - [128, 8192, 1, 8192, 128, 128, 128, 8192]
    - [82, 6.134]
  - - [256, 128, 1, 128, 256, 256, 256, 128]
    - [117, 0.159]
  - - [256, 128, 1, 256, 256, 256, 256, 128]
    - [118, 0.224]
  - - [256, 128, 1, 512, 256, 256, 256, 128]
    - [71, 0.304]
  - - [256, 128, 1, 1024, 256, 256, 256, 128]
    - [118, 0.52]
  - - [256, 128, 1, 2048, 256, 256, 256, 128]
    - [69, 0.801]
  - - [256, 128, 1, 4096, 256, 256, 256, 128]
    - [100, 1.242]
  - - [256, 128, 1, 8192, 256, 256, 256, 128]
    - [97, 1.788]
  - - [256, 256, 1, 128, 256, 256, 256, 256]
    - [115, 0.293]
  - - [256, 256, 1, 256, 256, 256, 256, 256]
    - [71, 0.467]
  - - [256, 256, 1, 512, 256, 256, 256, 256]
    - [118, 0.677]
  - - [256, 256, 1, 1024, 256, 256, 256, 256]
    - [116, 0.948]
  - - [256, 256, 1, 2048, 256, 256, 256, 256]
    - [67, 1.367]
  - - [256, 256, 1, 4096, 256, 256, 256, 256]
    - [99, 2.155]
  - - [256, 256, 1, 8192, 256, 256, 256, 256]
    - [63, 2.696]
  - - [256, 512, 1, 128, 256, 256, 256, 512]
    - [111, 0.55]
  - - [256, 512, 1, 256, 256, 256, 256, 512]
    - [70, 0.861]
  - - [256, 512, 1, 512, 256, 256, 256, 512]
    - [101, 1.25]
  - - [256, 512, 1, 1024, 256, 256, 256, 512]
    - [116, 1.693]
  - - [256, 512, 1, 2048, 256, 256, 256, 512]
    - [56, 2.168]
  - - [256, 512, 1, 4096, 256, 256, 256, 512]
    - [88, 3.15]
  - - [256, 512, 1, 8192, 256, 256, 256, 512]
    - [44, 3.764]
  - - [256, 1024, 1, 128, 256, 256, 256, 1024]
    - [67, 0.938]
  - - [256, 1024, 1, 256, 256, 256, 256, 1024]
    - [96, 1.486]
  - - [256, 1024, 1, 512, 256, 256, 256, 1024]
    - [96, 2.21]
  - - [256, 1024, 1, 1024, 256, 256, 256, 1024]
    - [94, 2.345]
  - - [256, 1024, 1, 2048, 256, 256, 256, 1024]
    - [42, 2.87]
  - - [256, 1024, 1, 4096, 256, 256, 256, 1024]
    - [83, 4.711]
  - - [256, 1024, 1, 8192, 256, 256, 256, 1024]
    - [21, 4.582]
  - - [256, 2048, 1, 128, 256, 256, 256, 2048]
    - [58, 1.523]
  - - [256, 2048, 1, 256, 256, 256, 256, 2048]
    - [59, 2.371]
  - - [256, 2048, 1, 512, 256, 256, 256, 2048]
    - [92, 3.068]
  - - [256, 2048, 1, 1024, 256, 256, 256, 2048]
    - [83, 3.395]
  - - [256, 2048, 1, 2048, 256, 256, 256, 2048]
    - [83, 4.153]
  - - [256, 2048, 1, 4096, 256, 256, 256, 2048]
    - [79, 5.166]
  - - [256, 2048, 1, 8192, 256, 256, 256, 2048]
    - [80, 5.674]
  - - [256, 4096, 1, 128, 256, 256, 256, 4096]
    - [40, 2.011]
  - - [256, 4096, 1, 256, 256, 256, 256, 4096]
    - [79, 3.133]
  - - [256, 4096, 1, 512, 256, 256, 256, 4096]
    - [80, 4.121]
  - - [256, 4096, 1, 1024, 256, 256, 256, 4096]
    - [104, 4.734]
  - - [256, 4096, 1, 2048, 256, 256, 256, 4096]
    - [79, 4.754]
  - - [256, 4096, 1, 4096, 256, 256, 256, 4096]
    - [45, 5.319]
  - - [256, 4096, 1, 8192, 256, 256, 256, 4096]
    - [49, 6.106]
  - - [256, 8192, 1, 128, 256, 256, 256, 8192]
    - [10, 2.678]
  - - [256, 8192, 1, 256, 256, 256, 256, 8192]
    - [35, 4.089]
  - - [256, 8192, 1, 512, 256, 256, 256, 8192]
    - [79, 5.049]
  - - [256, 8192, 1, 1024, 256, 256, 256, 8192]
    - [86, 5.108]
  - - [256, 8192, 1, 2048, 256, 256, 256, 8192]
    - [84, 6.179]
  - - [256, 8192, 1, 4096, 256, 256, 256, 8192]
    - [39, 6.186]
  - - [256, 8192, 1, 8192, 256, 256, 256, 8192]
    - [75, 6.65]
  - - [512, 128, 1, 128, 512, 512, 512, 128]
    - [115, 0.303]
  - - [512, 128, 1, 256, 512, 512, 512, 128]
    - [71, 0.476]
  - - [512, 128, 1, 512, 512, 512, 512, 128]
    - [118, 0.688]
  - - [512, 128, 1, 1024, 512, 512, 512, 128]
    - [117, 0.937]
  - - [512, 128, 1, 2048, 512, 512, 512, 128]
    - [67, 1.432]
  - - [512, 128, 1, 4096, 512, 512, 512, 128]
    - [97, 2.154]
  - - [512, 128, 1, 8192, 512, 512, 512, 128]
    - [64, 2.656]
  - - [512, 256, 1, 128, 512, 512, 512, 256]
    - [109, 0.545]
  - - [512, 256, 1, 256, 512, 512, 512, 256]
    - [102, 0.841]
  - - [512, 256, 1, 512, 512, 512, 512, 256]
    - [101, 1.261]
  - - [512, 256, 1, 1024, 512, 512, 512, 256]
    - [116, 1.714]
  - - [512, 256, 1, 2048, 512, 512, 512, 256]
    - [62, 2.185]
  - - [512, 256, 1, 4096, 512, 512, 512, 256]
    - [89, 3.253]
  - - [512, 256, 1, 8192, 512, 512, 512, 256]
    - [53, 3.858]
  - - [512, 512, 1, 128, 512, 512, 512, 512]
    - [68, 0.944]
  - - [512, 512, 1, 256, 512, 512, 512, 512]
    - [97, 1.492]
  - - [512, 512, 1, 512, 512, 512, 512, 512]
    - [98, 2.163]
  - - [512, 512, 1, 1024, 512, 512, 512, 512]
    - [87, 2.335]
  - - [512, 512, 1, 2048, 512, 512, 512, 512]
    - [48, 3.085]
  - - [512, 512, 1, 4096, 512, 512, 512, 512]
    - [80, 4.589]
  - - [512, 512, 1, 8192, 512, 512, 512, 512]
    - [79, 4.795]
  - - [512, 1024, 1, 128, 512, 512, 512, 1024]
    - [60, 1.478]
  - - [512, 1024, 1, 256, 512, 512, 512, 1024]
    - [55, 2.327]
  - - [512, 1024, 1, 512, 512, 512, 512, 1024]
    - [90, 3.215]
  - - [512, 1024, 1, 1024, 512, 512, 512, 1024]
    - [81, 3.273]
  - - [512, 1024, 1, 2048, 512, 512, 512, 1024]
    - [81, 4.198]
  - - [512, 1024, 1, 4096, 512, 512, 512, 1024]
    - [83, 5.269]
  - - [512, 1024, 1, 8192, 512, 512, 512, 1024]
    - [21, 5.794]
  - - [512, 2048, 1, 128, 512, 512, 512, 2048]
    - [47, 2.092]
  - - [512, 2048, 1, 256, 512, 512, 512, 2048]
    - [51, 3.021]
  - - [512, 2048, 1, 512, 512, 512, 512, 2048]
    - [83, 4.453]
  - - [512, 2048, 1, 1024, 512, 512, 512, 2048]
    - [107, 4.767]
  - - [512, 2048, 1, 2048, 512, 512, 512, 2048]
    - [96, 4.677]
  - - [512, 2048, 1, 4096, 512, 512, 512, 2048]
    - [80, 5.872]
  - - [512, 2048, 1, 8192, 512, 512, 512, 2048]
    - [13, 6.161]
  - - [512, 4096, 1, 128, 512, 512, 512, 4096]
    - [10, 2.645]
  - - [512, 4096, 1, 256, 512, 512, 512, 4096]
    - [23, 4.074]
  - - [512, 4096, 1, 512, 512, 512, 512, 4096]
    - [81, 5.049]
  - - [512, 4096, 1, 1024, 512, 512, 512, 4096]
    - [94, 5.163]
  - - [512, 4096, 1, 2048, 512, 512, 512, 4096]
    - [83, 6.005]
  - - [512, 4096, 1, 4096, 512, 512, 512, 4096]
    - [84, 6.533]
  - - [512, 4096, 1, 8192, 512, 512, 512, 4096]
    - [25, 6.706]
  - - [512, 8192, 1, 128, 512, 512, 512, 8192]
    - [41, 3.266]
  - - [512, 8192, 1, 256, 512, 512, 512, 8192]
    - [50, 4.715]
  - - [512, 8192, 1, 512, 512, 512, 512, 8192]
    - [42, 6.251]
  - - [512, 8192, 1, 1024, 512, 512, 512, 8192]
    - [79, 7.349]
  - - [512, 8192, 1, 2048, 512, 512, 512, 8192]
    - [81, 8.205]
  - - [512, 8192, 1, 4096, 512, 512, 512, 8192]
    - [33, 8.016]
  - - [512, 8192, 1, 8192, 512, 512, 512, 8192]
    - [78, 6.859]
  - - [1024, 128, 1, 128, 1024, 1024, 1024, 128]
    - [112, 0.544]
  - - [1024, 128, 1, 256, 1024, 1024, 1024, 128]
    - [101, 0.864]
  - - [1024, 128, 1, 512, 1024, 1024, 1024, 128]
    - [101, 1.269]
  - - [1024, 128, 1, 1024, 1024, 1024, 1024, 128]
    - [116, 1.703]
  - - [1024, 128, 1, 2048, 1024, 1024, 1024, 128]
    - [59, 2.301]
  - - [1024, 128, 1, 4096, 1024, 1024, 1024, 128]
    - [90, 3.279]
  - - [1024, 128, 1, 8192, 1024, 1024, 1024, 128]
    - [53, 3.819]
  - - [1024, 256, 1, 128, 1024, 1024, 1024, 256]
    - [96, 0.924]
  - - [1024, 256, 1, 256, 1024, 1024, 1024, 256]
    - [97, 1.491]
  - - [1024, 256, 1, 512, 1024, 1024, 1024, 256]
    - [97, 2.203]
  - - [1024, 256, 1, 1024, 1024, 1024, 1024, 256]
    - [85, 2.373]
  - - [1024, 256, 1, 2048, 1024, 1024, 1024, 256]
    - [54, 3.061]
  - - [1024, 256, 1, 4096, 1024, 1024, 1024, 256]
    - [81, 4.563]
  - - [1024, 256, 1, 8192, 1024, 1024, 1024, 256]
    - [11, 4.762]
  - - [1024, 512, 1, 128, 1024, 1024, 1024, 512]
    - [58, 1.486]
  - - [1024, 512, 1, 256, 1024, 1024, 1024, 512]
    - [55, 2.319]
  - - [1024, 512, 1, 512, 1024, 1024, 1024, 512]
    - [90, 3.21]
  - - [1024, 512, 1, 1024, 1024, 1024, 1024, 512]
    - [80, 3.275]
  - - [1024, 512, 1, 2048, 1024, 1024, 1024, 512]
    - [81, 4.208]
  - - [1024, 512, 1, 4096, 1024, 1024, 1024, 512]
    - [83, 5.133]
  - - [1024, 512, 1, 8192, 1024, 1024, 1024, 512]
    - [79, 5.836]
  - - [1024, 1024, 1, 128, 1024, 1024, 1024, 1024]
    - [79, 2.181]
  - - [1024, 1024, 1, 256, 1024, 1024, 1024, 1024]
    - [54, 3.063]
  - - [1024, 1024, 1, 512, 1024, 1024, 1024, 1024]
    - [79, 4.33]
  - - [1024, 1024, 1, 1024, 1024, 1024, 1024, 1024]
    - [107, 4.695]
  - - [1024, 1024, 1, 2048, 1024, 1024, 1024, 1024]
    - [79, 4.908]
  - - [1024, 1024, 1, 4096, 1024, 1024, 1024, 1024]
    - [82, 6.088]
  - - [1024, 1024, 1, 8192, 1024, 1024, 1024, 1024]
    - [19, 6.202]
  - - [1024, 2048, 1, 128, 1024, 1024, 1024, 2048]
    - [24, 2.864]
  - - [1024, 2048, 1, 256, 1024, 1024, 1024, 2048]
    - [31, 4.13]
  - - [1024, 2048, 1, 512, 1024, 1024, 1024, 2048]
    - [81, 4.937]
  - - [1024, 2048, 1, 1024, 1024, 1024, 1024, 2048]
    - [88, 5.195]
  - - [1024, 2048, 1, 2048, 1024, 1024, 1024, 2048]
    - [79, 6.462]
  - - [1024, 2048, 1, 4096, 1024, 1024, 1024, 2048]
    - [13, 6.274]
  - - [1024, 2048, 1, 8192, 1024, 1024, 1024, 2048]
    - [26, 7.623]
  - - [1024, 4096, 1, 128, 1024, 1024, 1024, 4096]
    - [42, 3.248]
  - - [1024, 4096, 1, 256, 1024, 1024, 1024, 4096]
    - [46, 4.75]
  - - [1024, 4096, 1, 512, 1024, 1024, 1024, 4096]
    - [42, 6.243]
  - - [1024, 4096, 1, 1024, 1024, 1024, 1024, 4096]
    - [79, 7.462]
  - - [1024, 4096, 1, 2048, 1024, 1024, 1024, 4096]
    - [79, 8.045]
  - - [1024, 4096, 1, 4096, 1024, 1024, 1024, 4096]
    - [17, 7.328]
  - - [1024, 4096, 1, 8192, 1024, 1024, 1024, 4096]
    - [73, 6.842]
  - - [1024, 8192, 1, 128, 1024, 1024, 1024, 8192]
    - [22, 3.327]
  - - [1024, 8192, 1, 256, 1024, 1024, 1024, 8192]
    - [27, 5.768]
  - - [1024, 8192, 1, 512, 1024, 1024, 1024, 8192]
    - [24, 7.269]
  - - [1024, 8192, 1, 1024, 1024, 1024, 1024, 8192]
    - [12, 8.008]
  - - [1024, 8192, 1, 2048, 1024, 1024, 1024, 8192]
    - [77, 7.52]
  - - [1024, 8192, 1, 4096, 1024, 1024, 1024, 8192]
    - [28, 7.601]
  - - [1024, 8192, 1, 8192, 1024, 1024, 1024, 8192]
    - [76, 8.026]
  - - [2048, 128, 1, 128, 2048, 2048, 2048, 128]
    - [95, 0.946]
  - - [2048, 128, 1, 256, 2048, 2048, 2048, 128]
    - [97, 1.547]
  - - [2048, 128, 1, 512, 2048, 2048, 2048, 128]
    - [96, 2.227]
  - - [2048, 128, 1, 1024, 2048, 2048, 2048, 128]
    - [91, 2.402]
  - - [2048, 128, 1, 2048, 2048, 2048, 2048, 128]
    - [41, 3.066]
  - - [2048, 128, 1, 4096, 2048, 2048, 2048, 128]
    - [79, 4.633]
  - - [2048, 128, 1, 8192, 2048, 2048, 2048, 128]
    - [33, 4.715]
  - - [2048, 256, 1, 128, 2048, 2048, 2048, 256]
    - [55, 1.485]
  - - [2048, 256, 1, 256, 2048, 2048, 2048, 256]
    - [55, 2.333]
  - - [2048, 256, 1, 512, 2048, 2048, 2048, 256]
    - [88, 3.148]
  - - [2048, 256, 1, 1024, 2048, 2048, 2048, 256]
    - [81, 3.305]
  - - [2048, 256, 1, 2048, 2048, 2048, 2048, 256]
    - [83, 4.193]
  - - [2048, 256, 1, 4096, 2048, 2048, 2048, 256]
    - [84, 5.112]
  - - [2048, 256, 1, 8192, 2048, 2048, 2048, 256]
    - [83, 6.018]
  - - [2048, 512, 1, 128, 2048, 2048, 2048, 512]
    - [43, 2.185]
  - - [2048, 512, 1, 256, 2048, 2048, 2048, 512]
    - [44, 3.127]
  - - [2048, 512, 1, 512, 2048, 2048, 2048, 512]
    - [79, 4.392]
  - - [2048, 512, 1, 1024, 2048, 2048, 2048, 512]
    - [104, 4.514]
  - - [2048, 512, 1, 2048, 2048, 2048, 2048, 512]
    - [82, 4.758]
  - - [2048, 512, 1, 4096, 2048, 2048, 2048, 512]
    - [81, 5.918]
  - - [2048, 512, 1, 8192, 2048, 2048, 2048, 512]
    - [18, 6.212]
  - - [2048, 1024, 1, 128, 2048, 2048, 2048, 1024]
    - [29, 2.852]
  - - [2048, 1024, 1, 256, 2048, 2048, 2048, 1024]
    - [27, 4.273]
  - - [2048, 1024, 1, 512, 2048, 2048, 2048, 1024]
    - [80, 4.953]
  - - [2048, 1024, 1, 1024, 2048, 2048, 2048, 1024]
    - [88, 5.091]
  - - [2048, 1024, 1, 2048, 2048, 2048, 2048, 1024]
    - [83, 6.485]
  - - [2048, 1024, 1, 4096, 2048, 2048, 2048, 1024]
    - [30, 6.387]
  - - [2048, 1024, 1, 8192, 2048, 2048, 2048, 1024]
    - [16, 7.607]
  - - [2048, 2048, 1, 128, 2048, 2048, 2048, 2048]
    - [37, 3.219]
  - - [2048, 2048, 1, 256, 2048, 2048, 2048, 2048]
    - [42, 4.705]
  - - [2048, 2048, 1, 512, 2048, 2048, 2048, 2048]
    - [41, 6.181]
  - - [2048, 2048, 1, 1024, 2048, 2048, 2048, 2048]
    - [83, 7.019]
  - - [2048, 2048, 1, 2048, 2048, 2048, 2048, 2048]
    - [83, 8.017]
  - - [2048, 2048, 1, 4096, 2048, 2048, 2048, 2048]
    - [107, 7.327]
  - - [2048, 2048, 1, 8192, 2048, 2048, 2048, 2048]
    - [15, 8.014]
  - - [2048, 4096, 1, 128, 2048, 2048, 2048, 4096]
    - [24, 3.837]
  - - [2048, 4096, 1, 256, 2048, 2048, 2048, 4096]
    - [27, 5.721]
  - - [2048, 4096, 1, 512, 2048, 2048, 2048, 4096]
    - [31, 7.263]
  - - [2048, 4096, 1, 1024, 2048, 2048, 2048, 4096]
    - [27, 8.488]
  - - [2048, 4096, 1, 2048, 2048, 2048, 2048, 4096]
    - [18, 7.745]
  - - [2048, 4096, 1, 4096, 2048, 2048, 2048, 4096]
    - [11, 8.431]
  - - [2048, 4096, 1, 8192, 2048, 2048, 2048, 4096]
    - [18, 8.12]
  - - [2048, 8192, 1, 128, 2048, 2048, 2048, 8192]
    - [9, 2.965]
  - - [2048, 8192, 1, 256, 2048, 2048, 2048, 8192]
    - [2, 4.832]
  - - [2048, 8192, 1, 512, 2048, 2048, 2048, 8192]
    - [5, 6.507]
  - - [2048, 8192, 1, 1024, 2048, 2048, 2048, 8192]
    - [4, 7.482]
  - - [2048, 8192, 1, 2048, 2048, 2048, 2048, 8192]
    - [74, 8.135]
  - - [2048, 8192, 1, 4096, 2048, 2048, 2048, 8192]
    - [17, 8.276]
  - - [2048, 8192, 1, 8192, 2048, 2048, 2048, 8192]
    - [27, 8.866]
  - - [4096, 128, 1, 128, 4096, 4096, 4096, 128]
    - [61, 1.537]
  - - [4096, 128, 1, 256, 4096, 4096, 4096, 128]
    - [58, 2.298]
  - - [4096, 128, 1, 512, 4096, 4096, 4096, 128]
    - [93, 3.059]
  - - [4096, 128, 1, 1024, 4096, 4096, 4096, 128]
    - [79, 3.245]
  - - [4096, 128, 1, 2048, 4096, 4096, 4096, 128]
    - [79, 4.211]
  - - [4096, 128, 1, 4096, 4096, 4096, 4096, 128]
    - [84, 4.85]
  - - [4096, 128, 1, 8192, 4096, 4096, 4096, 128]
    - [81, 6.173]
  - - [4096, 256, 1, 128, 4096, 4096, 4096, 256]
    - [54, 2.123]
  - - [4096, 256, 1, 256, 4096, 4096, 4096, 256]
    - [44, 3.14]
  - - [4096, 256, 1, 512, 4096, 4096, 4096, 256]
    - [79, 4.556]
  - - [4096, 256, 1, 1024, 4096, 4096, 4096, 256]
    - [105, 4.424]
  - - [4096, 256, 1, 2048, 4096, 4096, 4096, 256]
    - [82, 4.874]
  - - [4096, 256, 1, 4096, 4096, 4096, 4096, 256]
    - [83, 6.138]
  - - [4096, 256, 1, 8192, 4096, 4096, 4096, 256]
    - [79, 6.74]
  - - [4096, 512, 1, 128, 4096, 4096, 4096, 512]
    - [29, 2.951]
  - - [4096, 512, 1, 256, 4096, 4096, 4096, 512]
    - [34, 4.249]
  - - [4096, 512, 1, 512, 4096, 4096, 4096, 512]
    - [81, 4.99]
  - - [4096, 512, 1, 1024, 4096, 4096, 4096, 512]
    - [94, 5.097]
  - - [4096, 512, 1, 2048, 4096, 4096, 4096, 512]
    - [81, 6.4]
  - - [4096, 512, 1, 4096, 4096, 4096, 4096, 512]
    - [79, 6.89]
  - - [4096, 512, 1, 8192, 4096, 4096, 4096, 512]
    - [21, 7.967]
  - - [4096, 1024, 1, 128, 4096, 4096, 4096, 1024]
    - [34, 3.214]
  - - [4096, 1024, 1, 256, 4096, 4096, 4096, 1024]
    - [52, 4.692]
  - - [4096, 1024, 1, 512, 4096, 4096, 4096, 1024]
    - [41, 6.212]
  - - [4096, 1024, 1, 1024, 4096, 4096, 4096, 1024]
    - [46, 7.016]
  - - [4096, 1024, 1, 2048, 4096, 4096, 4096, 1024]
    - [83, 7.786]
  - - [4096, 1024, 1, 4096, 4096, 4096, 4096, 1024]
    - [33, 7.645]
  - - [4096, 1024, 1, 8192, 4096, 4096, 4096, 1024]
    - [20, 8.335]
  - - [4096, 2048, 1, 128, 4096, 4096, 4096, 2048]
    - [22, 3.752]
  - - [4096, 2048, 1, 256, 4096, 4096, 4096, 2048]
    - [34, 5.692]
  - - [4096, 2048, 1, 512, 4096, 4096, 4096, 2048]
    - [25, 7.214]
  - - [4096, 2048, 1, 1024, 4096, 4096, 4096, 2048]
    - [31, 8.367]
  - - [4096, 2048, 1, 2048, 4096, 4096, 4096, 2048]
    - [26, 7.842]
  - - [4096, 2048, 1, 4096, 4096, 4096, 4096, 2048]
    - [26, 8.421]
  - - [4096, 2048, 1, 8192, 4096, 4096, 4096, 2048]
    - [24, 8.292]
  - - [4096, 4096, 1, 128, 4096, 4096, 4096, 4096]
    - [0, 3.2]
  - - [4096, 4096, 1, 256, 4096, 4096, 4096, 4096]
    - [8, 4.822]
  - - [4096, 4096, 1, 512, 4096, 4096, 4096, 4096]
    - [5, 6.538]
  - - [4096, 4096, 1, 1024, 4096, 4096, 4096, 4096]
    - [2, 7.768]
  - - [4096, 4096, 1, 2048, 4096, 4096, 4096, 4096]
    - [11, 8.557]
  - - [4096, 4096, 1, 4096, 4096, 4096, 4096, 4096]
    - [13, 8.677]
  - - [4096, 4096, 1, 8192, 4096, 4096, 4096, 4096]
    - [30, 8.891]
  - - [4096, 8192, 1, 128, 4096, 4096, 4096, 8192]
    - [51, 3.419]
  - - [4096, 8192, 1, 256, 4096, 4096, 4096, 8192]
    - [33, 5.026]
  - - [4096, 8192, 1, 512, 4096, 4096, 4096, 8192]
    - [35, 6.671]
  - - [4096, 8192, 1, 1024, 4096, 4096, 4096, 8192]
    - [35, 7.776]
  - - [4096, 8192, 1, 2048, 4096, 4096, 4096, 8192]
    - [11, 8.445]
  - - [4096, 8192, 1, 4096, 4096, 4096, 4096, 8192]
    - [34, 8.622]
  - - [4096, 8192, 1, 8192, 4096, 4096, 4096, 8192]
    - [3, 7.645]
  - - [8192, 128, 1, 128, 8192, 8192, 8192, 128]
    - [41, 2.127]
  - - [8192, 128, 1, 256, 8192, 8192, 8192, 128]
    - [45, 3.038]
  - - [8192, 128, 1, 512, 8192, 8192, 8192, 128]
    - [81, 4.095]
  - - [8192, 128, 1, 1024, 8192, 8192, 8192, 128]
    - [105, 4.401]
  - - [8192, 128, 1, 2048, 8192, 8192, 8192, 128]
    - [80, 4.882]
  - - [8192, 128, 1, 4096, 8192, 8192, 8192, 128]
    - [79, 6.272]
  - - [8192, 128, 1, 8192, 8192, 8192, 8192, 128]
    - [79, 7.133]
  - - [8192, 256, 1, 128, 8192, 8192, 8192, 256]
    - [24, 2.99]
  - - [8192, 256, 1, 256, 8192, 8192, 8192, 256]
    - [22, 4.255]
  - - [8192, 256, 1, 512, 8192, 8192, 8192, 256]
    - [81, 4.464]
  - - [8192, 256, 1, 1024, 8192, 8192, 8192, 256]
    - [65, 4.981]
  - - [8192, 256, 1, 2048, 8192, 8192, 8192, 256]
    - [81, 6.364]
  - - [8192, 256, 1, 4096, 8192, 8192, 8192, 256]
    - [41, 6.905]
  - - [8192, 256, 1, 8192, 8192, 8192, 8192, 256]
    - [14, 7.857]
  - - [8192, 512, 1, 128, 8192, 8192, 8192, 512]
    - [40, 3.223]
  - - [8192, 512, 1, 256, 8192, 8192, 8192, 512]
    - [49, 4.728]
  - - [8192, 512, 1, 512, 8192, 8192, 8192, 512]
    - [81, 6.052]
  - - [8192, 512, 1, 1024, 8192, 8192, 8192, 512]
    - [52, 6.966]
  - - [8192, 512, 1, 2048, 8192, 8192, 8192, 512]
    - [82, 7.783]
  - - [8192, 512, 1, 4096, 8192, 8192, 8192, 512]
    - [14, 7.958]
  - - [8192, 512, 1, 8192, 8192, 8192, 8192, 512]
    - [11, 8.535]
  - - [8192, 1024, 1, 128, 8192, 8192, 8192, 1024]
    - [31, 3.745]
  - - [8192, 1024, 1, 256, 8192, 8192, 8192, 1024]
    - [36, 5.629]
  - - [8192, 1024, 1, 512, 8192, 8192, 8192, 1024]
    - [35, 7.283]
  - - [8192, 1024, 1, 1024, 8192, 8192, 8192, 1024]
    - [20, 8.423]
  - - [8192, 1024, 1, 2048, 8192, 8192, 8192, 1024]
    - [83, 7.599]
  - - [8192, 1024, 1, 4096, 8192, 8192, 8192, 1024]
    - [13, 8.498]
  - - [8192, 1024, 1, 8192, 8192, 8192, 8192, 1024]
    - [18, 8.267]
  - - [8192, 2048, 1, 128, 8192, 8192, 8192, 2048]
    - [0, 3.214]
  - - [8192, 2048, 1, 256, 8192, 8192, 8192, 2048]
    - [6, 4.722]
  - - [8192, 2048, 1, 512, 8192, 8192, 8192, 2048]
    - [1, 6.432]
  - - [8192, 2048, 1, 1024, 8192, 8192, 8192, 2048]
    - [8, 7.675]
  - - [8192, 2048, 1, 2048, 8192, 8192, 8192, 2048]
    - [26, 8.587]
  - - [8192, 2048, 1, 4096, 8192, 8192, 8192, 2048]
    - [13, 9.107]
  - - [8192, 2048, 1, 8192, 8192, 8192, 8192, 2048]
    - [13, 8.528]
  - - [8192, 4096, 1, 128, 8192, 8192, 8192, 4096]
    - [28, 3.365]
  - - [8192, 4096, 1, 256, 8192, 8192, 8192, 4096]
    - [33, 5.042]
  - - [8192, 4096, 1, 512, 8192, 8192, 8192, 4096]
    - [18, 6.604]
  - - [8192, 4096, 1, 1024, 8192, 8192, 8192, 4096]
    - [20, 7.763]
  - - [8192, 4096, 1, 2048, 8192, 8192, 8192, 4096]
    - [18, 8.335]
  - - [8192, 4096, 1, 4096, 8192, 8192, 8192, 4096]
    - [17, 8.118]
  - - [8192, 4096, 1, 8192, 8192, 8192, 8192, 4096]
    - [72, 8.2]
  - - [8192, 8192, 1, 128, 8192, 8192, 8192, 8192]
    - [38, 3.554]
  - - [8192, 8192, 1, 256, 8192, 8192, 8192, 8192]
    - [34, 5.18]
  - - [8192, 8192, 1, 512, 8192, 8192, 8192, 8192]
    - [30, 6.821]
  - - [8192, 8192, 1, 1024, 8192, 8192, 8192, 8192]
    - [26, 7.756]
  - - [8192, 8192, 1, 2048, 8192, 8192, 8192, 8192]
    - [32, 7.774]
  - - [8192, 8192, 1, 4096, 8192, 8192, 8192, 8192]
    - [72, 8.018]
  - - [8192, 8192, 1, 8192, 8192, 8192, 8192, 8192]
    - [7, 7.364]
  - - [1, 1, 1, 32, 1, 1, 1, 1]
    - [119, 0.0]
- null
- null
- DeviceEfficiency
- GridBased
