library/src/amd_detail/rocblaslt/src/Tensile/Logic/streamk/gfx942_38cu/aquavanjaram942_Cijk_Alik_Bjlk_HHS_BH_UserArgs.yaml
- {MinimumRequiredVersion: 4.33.0}
- aquavanjaram942
- {Architecture: gfx942, CUCount: 38}
- [Device 0049, Device 0050]
    SolutionIndex: 0
    SolutionNameMin: Cijk_Alik_Bjlk_HHS_BH_UserArgs_MT256x256x32_MI16x16x1_SN_LDSB1_CLR1_GSU0_GSUC0_GSUWGMRR0_K1_LBSPPA512_LBSPPB2048_LPB32_MIWT8_8_PLR1_SU32_SUM0_SUS256_VWA8_VWB2_WGM1_WGMXCC1_WGMXCCGn1
    SolutionIndex: 1
    SolutionNameMin: Cijk_Alik_Bjlk_HHS_BH_UserArgs_MT256x256x32_MI16x16x1_SN_LDSB1_CLR1_GSU0_GSUC0_GSUWGMRR0_K1_LBSPPA128_LBSPPB2048_LPB0_MIWT8_8_PLR1_SU32_SUM0_SUS256_VWA2_VWB4_WGM1_WGMXCC1_WGMXCCGn1
    SolutionIndex: 2
    SolutionNameMin: Cijk_Alik_Bjlk_HHS_BH_UserArgs_MT256x256x32_MI16x16x1_SN_LDSB1_CLR1_GSU0_GSUC0_GSUWGMRR0_K1_LBSPPA256_LBSPPB2048_LPB0_MIWT8_8_PLR1_SU32_SUM0_SUS256_VWA4_VWB4_WGM1_WGMXCC1_WGMXCCGn1
    SolutionIndex: 3
    SolutionNameMin: Cijk_Alik_Bjlk_HHS_BH_UserArgs_MT256x256x32_MI16x16x1_SN_LDSB1_CLR1_GSU0_GSUC0_GSUWGMRR0_K1_LBSPPA512_LBSPPB2048_LPB0_MIWT8_8_PLR1_SU32_SUM0_SUS256_VWA8_VWB4_WGM1_WGMXCC1_WGMXCCGn1
    SolutionIndex: 4
    SolutionNameMin: Cijk_Alik_Bjlk_HHS_BH_UserArgs_MT256x256x32_MI16x16x1_SN_LDSB1_CLR1_GSU0_GSUC0_GSUWGMRR0_K1_LBSPPA512_LBSPPB2048_LPB0_MIWT8_8_PLR1_SU32_SUM0_SUS256_VWA8_VWB8_WGM1_WGMXCC1_WGMXCCGn1
    SolutionIndex: 5
    SolutionNameMin: Cijk_Alik_Bjlk_HHS_BH_UserArgs_MT256x256x32_MI16x16x1_SN_LDSB1_CLR1_GSU0_GSUC0_GSUWGMRR0_K1_LBSPPA128_LBSPPB2048_LPB32_MIWT8_8_PLR1_SU32_SUM0_SUS256_VWA2_VWB2_WGM4_WGMXCC1_WGMXCCGn1
    SolutionIndex: 6
    SolutionNameMin: Cijk_Alik_Bjlk_HHS_BH_UserArgs_MT256x256x32_MI16x16x1_SN_LDSB1_CLR1_GSU0_GSUC0_GSUWGMRR0_K1_LBSPPA128_LBSPPB2048_LPB0_MIWT8_8_PLR1_SU32_SUM0_SUS256_VWA1_VWB4_WGM4_WGMXCC1_WGMXCCGn1
    SolutionIndex: 7
    SolutionNameMin: Cijk_Alik_Bjlk_HHS_BH_UserArgs_MT256x256x32_MI16x16x1_SN_LDSB1_CLR1_GSU0_GSUC0_GSUWGMRR0_K1_LBSPPA256_LBSPPB2048_LPB0_MIWT8_8_PLR1_SU32_SUM0_SUS256_VWA4_VWB4_WGM4_WGMXCC1_WGMXCCGn1
    SolutionIndex: 8
    SolutionNameMin: Cijk_Alik_Bjlk_HHS_BH_UserArgs_MT256x256x32_MI16x16x1_SN_LDSB1_CLR1_GSU0_GSUC0_GSUWGMRR0_K1_LBSPPA512_LBSPPB2048_LPB0_MIWT8_8_PLR1_SU32_SUM0_SUS256_VWA8_VWB4_WGM4_WGMXCC1_WGMXCCGn1
    SolutionIndex: 9
    SolutionNameMin: Cijk_Alik_Bjlk_HHS_BH_UserArgs_MT256x256x32_MI16x16x1_SN_LDSB1_CLR1_GSU0_GSUC0_GSUWGMRR0_K1_LBSPPA128_LBSPPB2048_LPB0_MIWT8_8_PLR1_SU32_SUM0_SUS256_VWA1_VWB8_WGM4_WGMXCC1_WGMXCCGn1
    SolutionIndex: 10
    SolutionNameMin: Cijk_Alik_Bjlk_HHS_BH_UserArgs_MT256x256x32_MI16x16x1_SN_LDSB1_CLR1_GSU0_GSUC0_GSUWGMRR0_K1_LBSPPA128_LBSPPB2048_LPB0_MIWT8_8_PLR1_SU32_SUM0_SUS256_VWA2_VWB8_WGM4_WGMXCC1_WGMXCCGn1
    SolutionIndex: 11
    SolutionNameMin: Cijk_Alik_Bjlk_HHS_BH_UserArgs_MT256x256x32_MI16x16x1_SN_LDSB1_CLR1_GSU0_GSUC0_GSUWGMRR0_K1_LBSPPA256_LBSPPB2048_LPB0_MIWT8_8_PLR1_SU32_SUM0_SUS256_VWA4_VWB8_WGM4_WGMXCC1_WGMXCCGn1
    SolutionIndex: 12
    SolutionNameMin: Cijk_Alik_Bjlk_HHS_BH_UserArgs_MT256x256x32_MI16x16x1_SN_LDSB1_CLR1_GSU0_GSUC0_GSUWGMRR0_K1_LBSPPA512_LBSPPB2048_LPB0_MIWT8_8_PLR1_SU32_SUM0_SUS256_VWA8_VWB8_WGM4_WGMXCC1_WGMXCCGn1
    SolutionIndex: 13
    SolutionNameMin: Cijk_Alik_Bjlk_HHS_BH_UserArgs_MT256x256x32_MI16x16x1_SN_LDSB1_CLR1_GSU0_GSUC0_GSUWGMRR0_K1_LBSPPA128_LBSPPB2048_LPB0_MIWT8_8_PLR1_SU32_SUM0_SUS256_VWA2_VWB4_WGM8_WGMXCC1_WGMXCCGn1
    SolutionIndex: 14
    SolutionNameMin: Cijk_Alik_Bjlk_HHS_BH_UserArgs_MT256x256x32_MI16x16x1_SN_LDSB1_CLR1_GSU0_GSUC0_GSUWGMRR0_K1_LBSPPA256_LBSPPB2048_LPB0_MIWT8_8_PLR1_SU32_SUM0_SUS256_VWA4_VWB4_WGM8_WGMXCC1_WGMXCCGn1
    SolutionIndex: 15
    SolutionNameMin: Cijk_Alik_Bjlk_HHS_BH_UserArgs_MT256x256x32_MI16x16x1_SN_LDSB1_CLR1_GSU0_GSUC0_GSUWGMRR0_K1_LBSPPA512_LBSPPB2048_LPB0_MIWT8_8_PLR1_SU32_SUM0_SUS256_VWA8_VWB4_WGM8_WGMXCC1_WGMXCCGn1
    SolutionIndex: 16
    SolutionNameMin: Cijk_Alik_Bjlk_HHS_BH_UserArgs_MT128x256x32_MI16x16x1_SN_LDSB1_CLR1_GSU0_GSUC0_GSUWGMRR0_K1_LBSPPA128_LBSPPB2048_LPB32_MIWT4_8_PLR1_SU32_SUM0_SUS256_VWA2_VWB2_WGM1_WGMXCC1_WGMXCCGn1
    SolutionIndex: 17
    SolutionNameMin: Cijk_Alik_Bjlk_HHS_BH_UserArgs_MT128x256x32_MI16x16x1_SN_LDSB1_CLR1_GSU0_GSUC0_GSUWGMRR0_K1_LBSPPA256_LBSPPB2048_LPB32_MIWT4_8_PLR1_SU32_SUM0_SUS256_VWA4_VWB2_WGM1_WGMXCC1_WGMXCCGn1
    SolutionIndex: 18
    SolutionNameMin: Cijk_Alik_Bjlk_HHS_BH_UserArgs_MT128x256x32_MI16x16x1_SN_LDSB1_CLR1_GSU0_GSUC0_GSUWGMRR0_K1_LBSPPA128_LBSPPB2048_LPB0_MIWT4_8_PLR1_SU32_SUM0_SUS256_VWA1_VWB4_WGM1_WGMXCC1_WGMXCCGn1
    SolutionIndex: 19
    SolutionNameMin: Cijk_Alik_Bjlk_HHS_BH_UserArgs_MT128x256x32_MI16x16x1_SN_LDSB1_CLR1_GSU0_GSUC0_GSUWGMRR0_K1_LBSPPA128_LBSPPB2048_LPB0_MIWT4_8_PLR1_SU32_SUM0_SUS256_VWA2_VWB4_WGM1_WGMXCC1_WGMXCCGn1
    SolutionIndex: 20
    SolutionNameMin: Cijk_Alik_Bjlk_HHS_BH_UserArgs_MT128x256x32_MI16x16x1_SN_LDSB1_CLR1_GSU0_GSUC0_GSUWGMRR0_K1_LBSPPA256_LBSPPB2048_LPB0_MIWT4_8_PLR1_SU32_SUM0_SUS256_VWA4_VWB4_WGM1_WGMXCC1_WGMXCCGn1
    SolutionIndex: 21
    SolutionNameMin: Cijk_Alik_Bjlk_HHS_BH_UserArgs_MT128x256x32_MI16x16x1_SN_LDSB1_CLR1_GSU0_GSUC0_GSUWGMRR0_K1_LBSPPA128_LBSPPB2048_LPB0_MIWT4_8_PLR1_SU32_SUM0_SUS256_VWA1_VWB8_WGM1_WGMXCC1_WGMXCCGn1
    SolutionIndex: 22
    SolutionNameMin: Cijk_Alik_Bjlk_HHS_BH_UserArgs_MT128x256x32_MI16x16x1_SN_LDSB1_CLR1_GSU0_GSUC0_GSUWGMRR0_K1_LBSPPA128_LBSPPB2048_LPB0_MIWT4_8_PLR1_SU32_SUM0_SUS256_VWA2_VWB8_WGM1_WGMXCC1_WGMXCCGn1
    SolutionIndex: 23
    SolutionNameMin: Cijk_Alik_Bjlk_HHS_BH_UserArgs_MT128x256x32_MI16x16x1_SN_LDSB1_CLR1_GSU0_GSUC0_GSUWGMRR0_K1_LBSPPA256_LBSPPB2048_LPB0_MIWT4_8_PLR1_SU32_SUM0_SUS256_VWA4_VWB8_WGM1_WGMXCC1_WGMXCCGn1
    SolutionIndex: 24
    SolutionNameMin: Cijk_Alik_Bjlk_HHS_BH_UserArgs_MT128x256x32_MI16x16x1_SN_LDSB1_CLR1_GSU0_GSUC0_GSUWGMRR0_K1_LBSPPA128_LBSPPB2048_LPB16_MIWT4_8_PLR1_SU32_SUM0_SUS256_VWA2_VWB1_WGM4_WGMXCC1_WGMXCCGn1
    SolutionIndex: 25
    SolutionNameMin: Cijk_Alik_Bjlk_HHS_BH_UserArgs_MT128x256x32_MI16x16x1_SN_LDSB1_CLR1_GSU0_GSUC0_GSUWGMRR0_K1_LBSPPA256_LBSPPB2048_LPB32_MIWT4_8_PLR1_SU32_SUM0_SUS256_VWA4_VWB2_WGM4_WGMXCC1_WGMXCCGn1
    SolutionIndex: 26
    SolutionNameMin: Cijk_Alik_Bjlk_HHS_BH_UserArgs_MT128x256x32_MI16x16x1_SN_LDSB1_CLR1_GSU0_GSUC0_GSUWGMRR0_K1_LBSPPA128_LBSPPB2048_LPB0_MIWT4_8_PLR1_SU32_SUM0_SUS256_VWA2_VWB4_WGM4_WGMXCC1_WGMXCCGn1
    SolutionIndex: 27
    SolutionNameMin: Cijk_Alik_Bjlk_HHS_BH_UserArgs_MT128x256x32_MI16x16x1_SN_LDSB1_CLR1_GSU0_GSUC0_GSUWGMRR0_K1_LBSPPA256_LBSPPB2048_LPB0_MIWT4_8_PLR1_SU32_SUM0_SUS256_VWA4_VWB4_WGM4_WGMXCC1_WGMXCCGn1
    SolutionIndex: 28
    SolutionNameMin: Cijk_Alik_Bjlk_HHS_BH_UserArgs_MT128x256x32_MI16x16x1_SN_LDSB1_CLR1_GSU0_GSUC0_GSUWGMRR0_K1_LBSPPA128_LBSPPB2048_LPB0_MIWT4_8_PLR1_SU32_SUM0_SUS256_VWA2_VWB8_WGM4_WGMXCC1_WGMXCCGn1
    SolutionIndex: 29
    SolutionNameMin: Cijk_Alik_Bjlk_HHS_BH_UserArgs_MT128x256x32_MI16x16x1_SN_LDSB1_CLR1_GSU0_GSUC0_GSUWGMRR0_K1_LBSPPA256_LBSPPB2048_LPB0_MIWT4_8_PLR1_SU32_SUM0_SUS256_VWA4_VWB8_WGM4_WGMXCC1_WGMXCCGn1
    SolutionIndex: 30
    SolutionNameMin: Cijk_Alik_Bjlk_HHS_BH_UserArgs_MT128x256x32_MI16x16x1_SN_LDSB1_CLR1_GSU0_GSUC0_GSUWGMRR0_K1_LBSPPA128_LBSPPB2048_LPB32_MIWT4_8_PLR1_SU32_SUM0_SUS256_VWA2_VWB2_WGM8_WGMXCC1_WGMXCCGn1
    SolutionIndex: 31
    SolutionNameMin: Cijk_Alik_Bjlk_HHS_BH_UserArgs_MT128x256x32_MI16x16x1_SN_LDSB1_CLR1_GSU0_GSUC0_GSUWGMRR0_K1_LBSPPA256_LBSPPB2048_LPB32_MIWT4_8_PLR1_SU32_SUM0_SUS256_VWA4_VWB2_WGM8_WGMXCC1_WGMXCCGn1
    SolutionIndex: 32
    SolutionNameMin: Cijk_Alik_Bjlk_HHS_BH_UserArgs_MT128x256x32_MI16x16x1_SN_LDSB1_CLR1_GSU0_GSUC0_GSUWGMRR0_K1_LBSPPA128_LBSPPB2048_LPB0_MIWT4_8_PLR1_SU32_SUM0_SUS256_VWA2_VWB4_WGM8_WGMXCC1_WGMXCCGn1
    SolutionIndex: 33
    SolutionNameMin: Cijk_Alik_Bjlk_HHS_BH_UserArgs_MT128x256x32_MI16x16x1_SN_LDSB1_CLR1_GSU0_GSUC0_GSUWGMRR0_K1_LBSPPA256_LBSPPB2048_LPB0_MIWT4_8_PLR1_SU32_SUM0_SUS256_VWA4_VWB4_WGM8_WGMXCC1_WGMXCCGn1
    SolutionIndex: 34
    SolutionNameMin: Cijk_Alik_Bjlk_HHS_BH_UserArgs_MT128x256x32_MI16x16x1_SN_LDSB1_CLR1_GSU0_GSUC0_GSUWGMRR0_K1_LBSPPA128_LBSPPB2048_LPB0_MIWT4_8_PLR1_SU32_SUM0_SUS256_VWA2_VWB8_WGM8_WGMXCC1_WGMXCCGn1
    SolutionIndex: 35
    SolutionNameMin: Cijk_Alik_Bjlk_HHS_BH_UserArgs_MT128x256x32_MI16x16x1_SN_LDSB1_CLR1_GSU0_GSUC0_GSUWGMRR0_K1_LBSPPA256_LBSPPB2048_LPB0_MIWT4_8_PLR1_SU32_SUM0_SUS256_VWA4_VWB8_WGM8_WGMXCC1_WGMXCCGn1
    SolutionIndex: 36
    SolutionNameMin: Cijk_Alik_Bjlk_HHS_BH_UserArgs_MT256x128x32_MI16x16x1_SN_LDSB1_CLR1_GSU0_GSUC0_GSUWGMRR0_K1_LBSPPA128_LBSPPB1024_LPB32_MIWT8_4_PLR1_SU32_SUM0_SUS256_VWA2_VWB2_WGM1_WGMXCC1_WGMXCCGn1
    SolutionIndex: 37
    SolutionNameMin: Cijk_Alik_Bjlk_HHS_BH_UserArgs_MT256x128x32_MI16x16x1_SN_LDSB1_CLR1_GSU0_GSUC0_GSUWGMRR0_K1_LBSPPA512_LBSPPB1024_LPB32_MIWT8_4_PLR1_SU32_SUM0_SUS256_VWA8_VWB2_WGM1_WGMXCC1_WGMXCCGn1
    SolutionIndex: 38
    SolutionNameMin: Cijk_Alik_Bjlk_HHS_BH_UserArgs_MT256x128x32_MI16x16x1_SN_LDSB1_CLR1_GSU0_GSUC0_GSUWGMRR0_K1_LBSPPA512_LBSPPB1024_LPB0_MIWT8_4_PLR1_SU32_SUM0_SUS256_VWA8_VWB4_WGM1_WGMXCC1_WGMXCCGn1
    SolutionIndex: 39
    SolutionNameMin: Cijk_Alik_Bjlk_HHS_BH_UserArgs_MT256x128x32_MI16x16x1_SN_LDSB1_CLR1_GSU0_GSUC0_GSUWGMRR0_K1_LBSPPA512_LBSPPB1024_LPB16_MIWT8_4_PLR1_SU32_SUM0_SUS256_VWA8_VWB1_WGM4_WGMXCC1_WGMXCCGn1
    SolutionIndex: 40
    SolutionNameMin: Cijk_Alik_Bjlk_HHS_BH_UserArgs_MT256x128x32_MI16x16x1_SN_LDSB1_CLR1_GSU0_GSUC0_GSUWGMRR0_K1_LBSPPA512_LBSPPB1024_LPB32_MIWT8_4_PLR1_SU32_SUM0_SUS256_VWA8_VWB2_WGM4_WGMXCC1_WGMXCCGn1
    SolutionIndex: 41
    SolutionNameMin: Cijk_Alik_Bjlk_HHS_BH_UserArgs_MT256x128x32_MI16x16x1_SN_LDSB1_CLR1_GSU0_GSUC0_GSUWGMRR0_K1_LBSPPA512_LBSPPB1024_LPB0_MIWT8_4_PLR1_SU32_SUM0_SUS256_VWA8_VWB4_WGM4_WGMXCC1_WGMXCCGn1
    SolutionIndex: 42
    SolutionNameMin: Cijk_Alik_Bjlk_HHS_BH_UserArgs_MT256x128x32_MI16x16x1_SN_LDSB1_CLR1_GSU0_GSUC0_GSUWGMRR0_K1_LBSPPA128_LBSPPB1024_LPB16_MIWT8_4_PLR1_SU32_SUM0_SUS256_VWA2_VWB1_WGM8_WGMXCC1_WGMXCCGn1
    SolutionIndex: 43
    SolutionNameMin: Cijk_Alik_Bjlk_HHS_BH_UserArgs_MT256x128x32_MI16x16x1_SN_LDSB1_CLR1_GSU0_GSUC0_GSUWGMRR0_K1_LBSPPA256_LBSPPB1024_LPB32_MIWT8_4_PLR1_SU32_SUM0_SUS256_VWA4_VWB2_WGM8_WGMXCC1_WGMXCCGn1
    SolutionIndex: 44
    SolutionNameMin: Cijk_Alik_Bjlk_HHS_BH_UserArgs_MT256x128x32_MI16x16x1_SN_LDSB1_CLR1_GSU0_GSUC0_GSUWGMRR0_K1_LBSPPA512_LBSPPB1024_LPB0_MIWT8_4_PLR1_SU32_SUM0_SUS256_VWA8_VWB4_WGM8_WGMXCC1_WGMXCCGn1
    SolutionIndex: 45
    SolutionNameMin: Cijk_Alik_Bjlk_HHS_BH_UserArgs_MT64x256x32_MI16x16x1_SN_LDSB1_CLR1_GSU0_GSUC0_GSUWGMRR0_K1_LBSPPA128_LBSPPB2048_LPB0_MIWT2_8_PLR1_SU32_SUM0_SUS256_VWA2_VWB4_WGM4_WGMXCC1_WGMXCCGn1
    SolutionIndex: 46
    SolutionNameMin: Cijk_Alik_Bjlk_HHS_BH_UserArgs_MT64x256x32_MI16x16x1_SN_LDSB1_CLR1_GSU0_GSUC0_GSUWGMRR0_K1_LBSPPA128_LBSPPB2048_LPB32_MIWT2_8_PLR1_SU32_SUM0_SUS256_VWA1_VWB2_WGM8_WGMXCC1_WGMXCCGn1
    SolutionIndex: 47
    SolutionNameMin: Cijk_Alik_Bjlk_HHS_BH_UserArgs_MT64x256x32_MI16x16x1_SN_LDSB1_CLR1_GSU0_GSUC0_GSUWGMRR0_K1_LBSPPA128_LBSPPB2048_LPB0_MIWT2_8_PLR1_SU32_SUM0_SUS256_VWA2_VWB4_WGM8_WGMXCC1_WGMXCCGn1
    SolutionIndex: 48
    SolutionNameMin: Cijk_Alik_Bjlk_HHS_BH_UserArgs_MT256x64x32_MI16x16x1_SN_LDSB1_CLR1_GSU0_GSUC0_GSUWGMRR0_K1_LBSPPA128_LBSPPB512_LPB16_MIWT8_2_PLR1_SU32_SUM0_SUS256_VWA2_VWB1_WGM8_WGMXCC1_WGMXCCGn1
    SolutionIndex: 49
    SolutionNameMin: Cijk_Alik_Bjlk_HHS_BH_UserArgs_MT256x64x32_MI16x16x1_SN_LDSB1_CLR1_GSU0_GSUC0_GSUWGMRR0_K1_LBSPPA512_LBSPPB512_LPB16_MIWT8_2_PLR1_SU32_SUM0_SUS256_VWA8_VWB1_WGM8_WGMXCC1_WGMXCCGn1
    SolutionIndex: 50
    SolutionNameMin: Cijk_Alik_Bjlk_HHS_BH_UserArgs_MT128x128x32_MI16x16x1_SN_LDSB1_CLR1_GSU0_GSUC0_GSUWGMRR0_K1_LBSPPA128_LBSPPB1024_LPB16_MIWT4_4_PLR1_SU32_SUM0_SUS256_VWA2_VWB1_WGM1_WGMXCC1_WGMXCCGn1
    SolutionIndex: 51
    SolutionNameMin: Cijk_Alik_Bjlk_HHS_BH_UserArgs_MT128x128x32_MI16x16x1_SN_LDSB1_CLR1_GSU0_GSUC0_GSUWGMRR0_K1_LBSPPA256_LBSPPB1024_LPB16_MIWT4_4_PLR1_SU32_SUM0_SUS256_VWA4_VWB1_WGM1_WGMXCC1_WGMXCCGn1
    SolutionIndex: 52
    SolutionNameMin: Cijk_Alik_Bjlk_HHS_BH_UserArgs_MT128x128x32_MI16x16x1_SN_LDSB1_CLR1_GSU0_GSUC0_GSUWGMRR0_K1_LBSPPA128_LBSPPB1024_LPB32_MIWT4_4_PLR1_SU32_SUM0_SUS256_VWA2_VWB2_WGM1_WGMXCC1_WGMXCCGn1
    SolutionIndex: 53
    SolutionNameMin: Cijk_Alik_Bjlk_HHS_BH_UserArgs_MT128x128x32_MI16x16x1_SN_LDSB1_CLR1_GSU0_GSUC0_GSUWGMRR0_K1_LBSPPA256_LBSPPB1024_LPB32_MIWT4_4_PLR1_SU32_SUM0_SUS256_VWA4_VWB2_WGM1_WGMXCC1_WGMXCCGn1
    SolutionIndex: 54
    SolutionNameMin: Cijk_Alik_Bjlk_HHS_BH_UserArgs_MT128x128x32_MI16x16x1_SN_LDSB1_CLR1_GSU0_GSUC0_GSUWGMRR0_K1_LBSPPA128_LBSPPB1024_LPB0_MIWT4_4_PLR1_SU32_SUM0_SUS256_VWA2_VWB4_WGM1_WGMXCC1_WGMXCCGn1
    SolutionIndex: 55
    SolutionNameMin: Cijk_Alik_Bjlk_HHS_BH_UserArgs_MT128x128x32_MI16x16x1_SN_LDSB1_CLR1_GSU0_GSUC0_GSUWGMRR0_K1_LBSPPA256_LBSPPB1024_LPB0_MIWT4_4_PLR1_SU32_SUM0_SUS256_VWA4_VWB4_WGM1_WGMXCC1_WGMXCCGn1
    SolutionIndex: 56
    SolutionNameMin: Cijk_Alik_Bjlk_HHS_BH_UserArgs_MT128x128x32_MI16x16x1_SN_LDSB1_CLR1_GSU0_GSUC0_GSUWGMRR0_K1_LBSPPA128_LBSPPB1024_LPB16_MIWT4_4_PLR1_SU32_SUM0_SUS256_VWA2_VWB1_WGM4_WGMXCC1_WGMXCCGn1
    SolutionIndex: 57
    SolutionNameMin: Cijk_Alik_Bjlk_HHS_BH_UserArgs_MT128x128x32_MI16x16x1_SN_LDSB1_CLR1_GSU0_GSUC0_GSUWGMRR0_K1_LBSPPA128_LBSPPB1024_LPB32_MIWT4_4_PLR1_SU32_SUM0_SUS256_VWA2_VWB2_WGM4_WGMXCC1_WGMXCCGn1
    SolutionIndex: 58
    SolutionNameMin: Cijk_Alik_Bjlk_HHS_BH_UserArgs_MT128x128x32_MI16x16x1_SN_LDSB1_CLR1_GSU0_GSUC0_GSUWGMRR0_K1_LBSPPA256_LBSPPB1024_LPB32_MIWT4_4_PLR1_SU32_SUM0_SUS256_VWA4_VWB2_WGM4_WGMXCC1_WGMXCCGn1
    SolutionIndex: 59
    SolutionNameMin: Cijk_Alik_Bjlk_HHS_BH_UserArgs_MT128x128x32_MI16x16x1_SN_LDSB1_CLR1_GSU0_GSUC0_GSUWGMRR0_K1_LBSPPA128_LBSPPB1024_LPB0_MIWT4_4_PLR1_SU32_SUM0_SUS256_VWA2_VWB4_WGM4_WGMXCC1_WGMXCCGn1
    SolutionIndex: 60
    SolutionNameMin: Cijk_Alik_Bjlk_HHS_BH_UserArgs_MT128x128x32_MI16x16x1_SN_LDSB1_CLR1_GSU0_GSUC0_GSUWGMRR0_K1_LBSPPA256_LBSPPB1024_LPB0_MIWT4_4_PLR1_SU32_SUM0_SUS256_VWA4_VWB4_WGM4_WGMXCC1_WGMXCCGn1
    SolutionIndex: 61
    SolutionNameMin: Cijk_Alik_Bjlk_HHS_BH_UserArgs_MT128x128x32_MI16x16x1_SN_LDSB1_CLR1_GSU0_GSUC0_GSUWGMRR0_K1_LBSPPA128_LBSPPB1024_LPB32_MIWT4_4_PLR1_SU32_SUM0_SUS256_VWA2_VWB2_WGM8_WGMXCC1_WGMXCCGn1
    SolutionIndex: 62
    SolutionNameMin: Cijk_Alik_Bjlk_HHS_BH_UserArgs_MT128x128x32_MI16x16x1_SN_LDSB1_CLR1_GSU0_GSUC0_GSUWGMRR0_K1_LBSPPA256_LBSPPB1024_LPB32_MIWT4_4_PLR1_SU32_SUM0_SUS256_VWA4_VWB2_WGM8_WGMXCC1_WGMXCCGn1
    SolutionIndex: 63
    SolutionNameMin: Cijk_Alik_Bjlk_HHS_BH_UserArgs_MT128x128x32_MI16x16x1_SN_LDSB1_CLR1_GSU0_GSUC0_GSUWGMRR0_K1_LBSPPA128_LBSPPB1024_LPB0_MIWT4_4_PLR1_SU32_SUM0_SUS256_VWA2_VWB4_WGM8_WGMXCC1_WGMXCCGn1
    SolutionIndex: 64
    SolutionNameMin: Cijk_Alik_Bjlk_HHS_BH_UserArgs_MT128x128x32_MI16x16x1_SN_LDSB1_CLR1_GSU0_GSUC0_GSUWGMRR0_K1_LBSPPA256_LBSPPB1024_LPB0_MIWT4_4_PLR1_SU32_SUM0_SUS256_VWA4_VWB4_WGM8_WGMXCC1_WGMXCCGn1
    SolutionIndex: 65
    SolutionNameMin: Cijk_Alik_Bjlk_HHS_BH_UserArgs_MT64x128x32_MI16x16x1_SN_LDSB0_CLR1_GSU0_GSUC0_GSUWGMRR0_K1_LBSPPA128_LBSPPB1024_LPB0_MIWT2_4_PLR1_SU32_SUM0_SUS256_VWA1_VWB4_WGM1_WGMXCC1_WGMXCCGn1
    SolutionIndex: 66
    SolutionNameMin: Cijk_Alik_Bjlk_HHS_BH_UserArgs_MT64x128x32_MI16x16x1_SN_LDSB0_CLR1_GSU0_GSUC0_GSUWGMRR0_K1_LBSPPA128_LBSPPB1024_LPB0_MIWT2_4_PLR1_SU32_SUM0_SUS256_VWA2_VWB4_WGM1_WGMXCC1_WGMXCCGn1
    SolutionIndex: 67
    SolutionNameMin: Cijk_Alik_Bjlk_HHS_BH_UserArgs_MT64x128x32_MI16x16x1_SN_LDSB0_CLR0_GSU0_GSUC0_GSUWGMRR0_K1_LBSPPA128_LBSPPB1024_LPB0_MIWT2_4_PLR0_SU32_SUM0_SUS256_VWA2_VWB4_WGM1_WGMXCC1_WGMXCCGn1
    SolutionIndex: 68
    SolutionNameMin: Cijk_Alik_Bjlk_HHS_BH_UserArgs_MT64x128x32_MI16x16x1_SN_LDSB0_CLR1_GSU0_GSUC0_GSUWGMRR0_K1_LBSPPA128_LBSPPB1024_LPB0_MIWT2_4_PLR1_SU32_SUM0_SUS256_VWA2_VWB4_WGM4_WGMXCC1_WGMXCCGn1
    SolutionIndex: 69
    SolutionNameMin: Cijk_Alik_Bjlk_HHS_BH_UserArgs_MT64x128x32_MI16x16x1_SN_LDSB0_CLR1_GSU0_GSUC0_GSUWGMRR0_K1_LBSPPA128_LBSPPB1024_LPB32_MIWT2_4_PLR1_SU32_SUM0_SUS256_VWA2_VWB2_WGM8_WGMXCC1_WGMXCCGn1
    SolutionIndex: 70
    SolutionNameMin: Cijk_Alik_Bjlk_HHS_BH_UserArgs_MT64x128x32_MI16x16x1_SN_LDSB0_CLR1_GSU0_GSUC0_GSUWGMRR0_K1_LBSPPA128_LBSPPB1024_LPB0_MIWT2_4_PLR1_SU32_SUM0_SUS256_VWA1_VWB4_WGM8_WGMXCC1_WGMXCCGn1
    SolutionIndex: 71
    SolutionNameMin: Cijk_Alik_Bjlk_HHS_BH_UserArgs_MT64x128x32_MI16x16x1_SN_LDSB0_CLR1_GSU0_GSUC0_GSUWGMRR0_K1_LBSPPA128_LBSPPB1024_LPB0_MIWT2_4_PLR1_SU32_SUM0_SUS256_VWA2_VWB4_WGM8_WGMXCC1_WGMXCCGn1
    SolutionIndex: 72
    SolutionNameMin: Cijk_Alik_Bjlk_HHS_BH_UserArgs_MT128x64x32_MI16x16x1_SN_LDSB0_CLR1_GSU0_GSUC0_GSUWGMRR0_K1_LBSPPA128_LBSPPB512_LPB32_MIWT4_2_PLR1_SU32_SUM0_SUS256_VWA2_VWB2_WGM1_WGMXCC1_WGMXCCGn1
    SolutionIndex: 73
    SolutionNameMin: Cijk_Alik_Bjlk_HHS_BH_UserArgs_MT64x64x32_MI16x16x1_SN_LDSB0_CLR1_GSU0_GSUC0_GSUWGMRR0_K1_LBSPPA128_LBSPPB512_LPB32_MIWT2_2_PLR1_SU32_SUM0_SUS256_VWA2_VWB2_WGM1_WGMXCC1_WGMXCCGn1
    SolutionIndex: 74
    SolutionNameMin: Cijk_Alik_Bjlk_HHS_BH_UserArgs_MT128x256x64_MI16x16x1_SN_LDSB1_CLR1_GSU0_GSUC0_GSUWGMRR0_K1_LBSPPA256_LBSPPB4096_LPB0_MIWT4_8_PLR1_SU32_SUM0_SUS256_VWA2_VWB4_WGM1_WGMXCC1_WGMXCCGn1
    SolutionIndex: 75
    SolutionNameMin: Cijk_Alik_Bjlk_HHS_BH_UserArgs_MT128x256x64_MI16x16x1_SN_LDSB1_CLR1_GSU0_GSUC0_GSUWGMRR0_K1_LBSPPA512_LBSPPB4096_LPB0_MIWT4_8_PLR1_SU32_SUM0_SUS256_VWA4_VWB4_WGM1_WGMXCC1_WGMXCCGn1
    SolutionIndex: 76
    SolutionNameMin: Cijk_Alik_Bjlk_HHS_BH_UserArgs_MT128x256x64_MI16x16x1_SN_LDSB1_CLR1_GSU0_GSUC0_GSUWGMRR0_K1_LBSPPA256_LBSPPB4096_LPB0_MIWT4_8_PLR1_SU32_SUM0_SUS256_VWA2_VWB4_WGM4_WGMXCC1_WGMXCCGn1
    SolutionIndex: 77
    SolutionNameMin: Cijk_Alik_Bjlk_HHS_BH_UserArgs_MT128x256x64_MI16x16x1_SN_LDSB1_CLR1_GSU0_GSUC0_GSUWGMRR0_K1_LBSPPA512_LBSPPB4096_LPB0_MIWT4_8_PLR1_SU32_SUM0_SUS256_VWA4_VWB4_WGM4_WGMXCC1_WGMXCCGn1
    SolutionIndex: 78
    SolutionNameMin: Cijk_Alik_Bjlk_HHS_BH_UserArgs_MT128x256x64_MI16x16x1_SN_LDSB1_CLR1_GSU0_GSUC0_GSUWGMRR0_K1_LBSPPA256_LBSPPB4096_LPB0_MIWT4_8_PLR1_SU32_SUM0_SUS256_VWA2_VWB4_WGM8_WGMXCC1_WGMXCCGn1
    SolutionIndex: 79
    SolutionNameMin: Cijk_Alik_Bjlk_HHS_BH_UserArgs_MT128x256x64_MI16x16x1_SN_LDSB1_CLR1_GSU0_GSUC0_GSUWGMRR0_K1_LBSPPA512_LBSPPB4096_LPB0_MIWT4_8_PLR1_SU32_SUM0_SUS256_VWA4_VWB4_WGM8_WGMXCC1_WGMXCCGn1
    SolutionIndex: 80
    SolutionNameMin: Cijk_Alik_Bjlk_HHS_BH_UserArgs_MT128x256x64_MI16x16x1_SN_LDSB1_CLR1_GSU0_GSUC0_GSUWGMRR0_K1_LBSPPA512_LBSPPB4096_LPB0_MIWT4_8_PLR1_SU32_SUM0_SUS256_VWA4_VWB8_WGM8_WGMXCC1_WGMXCCGn1
    SolutionIndex: 81
    SolutionNameMin: Cijk_Alik_Bjlk_HHS_BH_UserArgs_MT256x128x64_MI16x16x1_SN_LDSB1_CLR1_GSU0_GSUC0_GSUWGMRR0_K1_LBSPPA256_LBSPPB2048_LPB16_MIWT8_4_PLR1_SU32_SUM0_SUS256_VWA2_VWB1_WGM1_WGMXCC1_WGMXCCGn1
    SolutionIndex: 82
    SolutionNameMin: Cijk_Alik_Bjlk_HHS_BH_UserArgs_MT256x128x64_MI16x16x1_SN_LDSB1_CLR1_GSU0_GSUC0_GSUWGMRR0_K1_LBSPPA256_LBSPPB2048_LPB0_MIWT8_4_PLR1_SU32_SUM0_SUS256_VWA2_VWB4_WGM1_WGMXCC1_WGMXCCGn1
    SolutionIndex: 83
    SolutionNameMin: Cijk_Alik_Bjlk_HHS_BH_UserArgs_MT256x128x64_MI16x16x1_SN_LDSB1_CLR1_GSU0_GSUC0_GSUWGMRR0_K1_LBSPPA512_LBSPPB2048_LPB0_MIWT8_4_PLR1_SU32_SUM0_SUS256_VWA4_VWB4_WGM1_WGMXCC1_WGMXCCGn1
    SolutionIndex: 84
    SolutionNameMin: Cijk_Alik_Bjlk_HHS_BH_UserArgs_MT128x128x64_MI16x16x1_SN_LDSB1_CLR1_GSU0_GSUC0_GSUWGMRR0_K1_LBSPPA256_LBSPPB2048_LPB0_MIWT4_4_PLR1_SU32_SUM0_SUS256_VWA2_VWB4_WGM1_WGMXCC1_WGMXCCGn1
    SolutionIndex: 85
    SolutionNameMin: Cijk_Alik_Bjlk_HHS_BH_UserArgs_MT128x128x64_MI16x16x1_SN_LDSB1_CLR1_GSU0_GSUC0_GSUWGMRR0_K1_LBSPPA512_LBSPPB2048_LPB0_MIWT4_4_PLR1_SU32_SUM0_SUS256_VWA4_VWB4_WGM1_WGMXCC1_WGMXCCGn1
    SolutionIndex: 86
    SolutionNameMin: Cijk_Alik_Bjlk_HHS_BH_UserArgs_MT128x128x64_MI16x16x1_SN_LDSB1_CLR1_GSU0_GSUC0_GSUWGMRR0_K1_LBSPPA128_LBSPPB2048_LPB0_MIWT4_4_PLR1_SU32_SUM0_SUS256_VWA1_VWB4_WGM4_WGMXCC1_WGMXCCGn1
    SolutionIndex: 87
    SolutionNameMin: Cijk_Alik_Bjlk_HHS_BH_UserArgs_MT128x128x64_MI16x16x1_SN_LDSB1_CLR1_GSU0_GSUC0_GSUWGMRR0_K1_LBSPPA256_LBSPPB2048_LPB0_MIWT4_4_PLR1_SU32_SUM0_SUS256_VWA2_VWB4_WGM4_WGMXCC1_WGMXCCGn1
    SolutionIndex: 88
    SolutionNameMin: Cijk_Alik_Bjlk_HHS_BH_UserArgs_MT128x128x64_MI16x16x1_SN_LDSB1_CLR1_GSU0_GSUC0_GSUWGMRR0_K1_LBSPPA512_LBSPPB2048_LPB0_MIWT4_4_PLR1_SU32_SUM0_SUS256_VWA4_VWB4_WGM4_WGMXCC1_WGMXCCGn1
    SolutionIndex: 89
    SolutionNameMin: Cijk_Alik_Bjlk_HHS_BH_UserArgs_MT128x128x64_MI16x16x1_SN_LDSB1_CLR1_GSU0_GSUC0_GSUWGMRR0_K1_LBSPPA128_LBSPPB2048_LPB0_MIWT4_4_PLR1_SU32_SUM0_SUS256_VWA1_VWB4_WGM8_WGMXCC1_WGMXCCGn1
    SolutionIndex: 90
    SolutionNameMin: Cijk_Alik_Bjlk_HHS_BH_UserArgs_MT128x128x64_MI16x16x1_SN_LDSB1_CLR1_GSU0_GSUC0_GSUWGMRR0_K1_LBSPPA256_LBSPPB2048_LPB0_MIWT4_4_PLR1_SU32_SUM0_SUS256_VWA2_VWB4_WGM8_WGMXCC1_WGMXCCGn1
    SolutionIndex: 91
    SolutionNameMin: Cijk_Alik_Bjlk_HHS_BH_UserArgs_MT128x128x64_MI16x16x1_SN_LDSB1_CLR1_GSU0_GSUC0_GSUWGMRR0_K1_LBSPPA512_LBSPPB2048_LPB0_MIWT4_4_PLR1_SU32_SUM0_SUS256_VWA4_VWB4_WGM8_WGMXCC1_WGMXCCGn1
    SolutionIndex: 92
    SolutionNameMin: Cijk_Alik_Bjlk_HHS_BH_UserArgs_MT64x128x64_MI16x16x1_SN_LDSB1_CLR1_GSU0_GSUC0_GSUWGMRR0_K1_LBSPPA256_LBSPPB2048_LPB32_MIWT2_4_PLR1_SU32_SUM0_SUS256_VWA2_VWB2_WGM1_WGMXCC1_WGMXCCGn1
    SolutionIndex: 93
    SolutionNameMin: Cijk_Alik_Bjlk_HHS_BH_UserArgs_MT64x128x64_MI16x16x1_SN_LDSB1_CLR1_GSU0_GSUC0_GSUWGMRR0_K1_LBSPPA128_LBSPPB2048_LPB0_MIWT2_4_PLR1_SU32_SUM0_SUS256_VWA1_VWB4_WGM1_WGMXCC1_WGMXCCGn1
    SolutionIndex: 94
    SolutionNameMin: Cijk_Alik_Bjlk_HHS_BH_UserArgs_MT64x128x64_MI16x16x1_SN_LDSB1_CLR1_GSU0_GSUC0_GSUWGMRR0_K1_LBSPPA256_LBSPPB2048_LPB0_MIWT2_4_PLR1_SU32_SUM0_SUS256_VWA2_VWB4_WGM1_WGMXCC1_WGMXCCGn1
    SolutionIndex: 95
    SolutionNameMin: Cijk_Alik_Bjlk_HHS_BH_UserArgs_MT64x128x64_MI16x16x1_SN_LDSB1_CLR1_GSU0_GSUC0_GSUWGMRR0_K1_LBSPPA256_LBSPPB2048_LPB0_MIWT2_4_PLR1_SU32_SUM0_SUS256_VWA2_VWB4_WGM4_WGMXCC1_WGMXCCGn1
    SolutionIndex: 96
    SolutionNameMin: Cijk_Alik_Bjlk_HHS_BH_UserArgs_MT64x128x64_MI16x16x1_SN_LDSB1_CLR1_GSU0_GSUC0_GSUWGMRR0_K1_LBSPPA256_LBSPPB2048_LPB32_MIWT2_4_PLR1_SU32_SUM0_SUS256_VWA2_VWB2_WGM8_WGMXCC1_WGMXCCGn1
    SolutionIndex: 97
    SolutionNameMin: Cijk_Alik_Bjlk_HHS_BH_UserArgs_MT64x128x64_MI16x16x1_SN_LDSB1_CLR1_GSU0_GSUC0_GSUWGMRR0_K1_LBSPPA256_LBSPPB2048_LPB0_MIWT2_4_PLR1_SU32_SUM0_SUS256_VWA2_VWB4_WGM8_WGMXCC1_WGMXCCGn1
    SolutionIndex: 98
    SolutionNameMin: Cijk_Alik_Bjlk_HHS_BH_UserArgs_MT128x64x64_MI16x16x1_SN_LDSB1_CLR1_GSU0_GSUC0_GSUWGMRR0_K1_LBSPPA128_LBSPPB1024_LPB32_MIWT4_2_PLR1_SU32_SUM0_SUS256_VWA1_VWB2_WGM1_WGMXCC1_WGMXCCGn1
    SolutionIndex: 99
    SolutionNameMin: Cijk_Alik_Bjlk_HHS_BH_UserArgs_MT128x64x64_MI16x16x1_SN_LDSB1_CLR1_GSU0_GSUC0_GSUWGMRR0_K1_LBSPPA256_LBSPPB1024_LPB32_MIWT4_2_PLR1_SU32_SUM0_SUS256_VWA2_VWB2_WGM1_WGMXCC1_WGMXCCGn1
    SolutionIndex: 100
    SolutionNameMin: Cijk_Alik_Bjlk_HHS_BH_UserArgs_MT128x64x64_MI16x16x1_SN_LDSB1_CLR1_GSU0_GSUC0_GSUWGMRR0_K1_LBSPPA512_LBSPPB1024_LPB32_MIWT4_2_PLR1_SU32_SUM0_SUS256_VWA4_VWB2_WGM1_WGMXCC1_WGMXCCGn1
    SolutionIndex: 101
    SolutionNameMin: Cijk_Alik_Bjlk_HHS_BH_UserArgs_MT128x64x64_MI16x16x1_SN_LDSB1_CLR1_GSU0_GSUC0_GSUWGMRR0_K1_LBSPPA256_LBSPPB1024_LPB32_MIWT4_2_PLR1_SU32_SUM0_SUS256_VWA2_VWB2_WGM4_WGMXCC1_WGMXCCGn1
    SolutionIndex: 102
    SolutionNameMin: Cijk_Alik_Bjlk_HHS_BH_UserArgs_MT128x64x64_MI16x16x1_SN_LDSB1_CLR1_GSU0_GSUC0_GSUWGMRR0_K1_LBSPPA512_LBSPPB1024_LPB32_MIWT4_2_PLR1_SU32_SUM0_SUS256_VWA4_VWB2_WGM4_WGMXCC1_WGMXCCGn1
    SolutionIndex: 103
    SolutionNameMin: Cijk_Alik_Bjlk_HHS_BH_UserArgs_MT128x64x64_MI16x16x1_SN_LDSB1_CLR1_GSU0_GSUC0_GSUWGMRR0_K1_LBSPPA256_LBSPPB1024_LPB32_MIWT4_2_PLR1_SU32_SUM0_SUS256_VWA2_VWB2_WGM8_WGMXCC1_WGMXCCGn1
    SolutionIndex: 104
    SolutionNameMin: Cijk_Alik_Bjlk_HHS_BH_UserArgs_MT128x64x64_MI16x16x1_SN_LDSB1_CLR1_GSU0_GSUC0_GSUWGMRR0_K1_LBSPPA512_LBSPPB1024_LPB32_MIWT4_2_PLR1_SU32_SUM0_SUS256_VWA4_VWB2_WGM8_WGMXCC1_WGMXCCGn1
    SolutionIndex: 105
    SolutionNameMin: Cijk_Alik_Bjlk_HHS_BH_UserArgs_MT64x64x64_MI16x16x1_SN_LDSB1_CLR1_GSU0_GSUC0_GSUWGMRR0_K1_LBSPPA128_LBSPPB1024_LPB32_MIWT2_2_PLR1_SU32_SUM0_SUS256_VWA1_VWB2_WGM1_WGMXCC1_WGMXCCGn1
    SolutionIndex: 106
    SolutionNameMin: Cijk_Alik_Bjlk_HHS_BH_UserArgs_MT64x64x64_MI16x16x1_SN_LDSB1_CLR1_GSU0_GSUC0_GSUWGMRR0_K1_LBSPPA256_LBSPPB1024_LPB32_MIWT2_2_PLR1_SU32_SUM0_SUS256_VWA2_VWB2_WGM1_WGMXCC1_WGMXCCGn1
    SolutionIndex: 107
    SolutionNameMin: Cijk_Alik_Bjlk_HHS_BH_UserArgs_MT64x64x64_MI16x16x1_SN_LDSB1_CLR1_GSU0_GSUC0_GSUWGMRR0_K1_LBSPPA128_LBSPPB1024_LPB32_MIWT2_2_PLR2_SU32_SUM0_SUS256_VWA1_VWB2_WGM1_WGMXCC1_WGMXCCGn1
    SolutionIndex: 108
    SolutionNameMin: Cijk_Alik_Bjlk_HHS_BH_UserArgs_MT64x64x64_MI16x16x1_SN_LDSB1_CLR1_GSU0_GSUC0_GSUWGMRR0_K1_LBSPPA256_LBSPPB1024_LPB32_MIWT2_2_PLR1_SU32_SUM0_SUS256_VWA2_VWB2_WGM4_WGMXCC1_WGMXCCGn1
    SolutionIndex: 109
    SolutionNameMin: Cijk_Alik_Bjlk_HHS_BH_UserArgs_MT64x64x64_MI16x16x1_SN_LDSB1_CLR1_GSU0_GSUC0_GSUWGMRR0_K1_LBSPPA256_LBSPPB1024_LPB32_MIWT2_2_PLR1_SU32_SUM0_SUS256_VWA2_VWB2_WGM8_WGMXCC1_WGMXCCGn1
    SolutionIndex: 110
    SolutionNameMin: Cijk_Alik_Bjlk_HHS_BH_UserArgs_MT32x64x64_MI16x16x1_SN_LDSB0_CLR1_GSU0_GSUC0_GSUWGMRR0_K1_LBSPPA128_LBSPPB1024_LPB32_MIWT1_2_PLR1_SU32_SUM0_SUS256_VWA1_VWB2_WGM1_WGMXCC1_WGMXCCGn1
    SolutionIndex: 111
    SolutionNameMin: Cijk_Alik_Bjlk_HHS_BH_UserArgs_MT32x64x64_MI16x16x1_SN_LDSB0_CLR1_GSU0_GSUC0_GSUWGMRR0_K1_LBSPPA128_LBSPPB1024_LPB32_MIWT1_2_PLR1_SU32_SUM0_SUS256_VWA1_VWB2_WGM4_WGMXCC1_WGMXCCGn1
    SolutionIndex: 112
    SolutionNameMin: Cijk_Alik_Bjlk_HHS_BH_UserArgs_MT64x32x64_MI16x16x1_SN_LDSB0_CLR1_GSU0_GSUC0_GSUWGMRR0_K1_LBSPPA256_LBSPPB512_LPB16_MIWT2_1_PLR2_SU32_SUM0_SUS256_VWA2_VWB1_WGM1_WGMXCC1_WGMXCCGn1
    SolutionIndex: 113
    SolutionNameMin: Cijk_Alik_Bjlk_HHS_BH_UserArgs_MT64x32x64_MI16x16x1_SN_LDSB0_CLR1_GSU0_GSUC0_GSUWGMRR0_K1_LBSPPA256_LBSPPB512_LPB16_MIWT2_1_PLR1_SU32_SUM0_SUS256_VWA2_VWB1_WGM4_WGMXCC1_WGMXCCGn1
    SolutionIndex: 114
    SolutionNameMin: Cijk_Alik_Bjlk_HHS_BH_UserArgs_MT64x128x128_MI16x16x1_SN_LDSB1_CLR1_GSU0_GSUC0_GSUWGMRR0_K1_LBSPPA256_LBSPPB2048_LPB0_MIWT2_4_PLR2_SU32_SUM0_SUS256_VWA1_VWB4_WGM1_WGMXCC1_WGMXCCGn1
    SolutionIndex: 115
    SolutionNameMin: Cijk_Alik_Bjlk_HHS_BH_UserArgs_MT64x128x128_MI16x16x1_SN_LDSB1_CLR1_GSU0_GSUC0_GSUWGMRR0_K1_LBSPPA512_LBSPPB2048_LPB0_MIWT2_4_PLR2_SU32_SUM0_SUS256_VWA2_VWB4_WGM1_WGMXCC1_WGMXCCGn1
    SolutionIndex: 116
    SolutionNameMin: Cijk_Alik_Bjlk_HHS_BH_UserArgs_MT128x64x128_MI16x16x1_SN_LDSB1_CLR1_GSU0_GSUC0_GSUWGMRR0_K1_LBSPPA512_LBSPPB1024_LPB32_MIWT4_2_PLR2_SU32_SUM0_SUS256_VWA2_VWB2_WGM1_WGMXCC1_WGMXCCGn1
    SolutionIndex: 117
    SolutionNameMin: Cijk_Alik_Bjlk_HHS_BH_UserArgs_MT128x64x128_MI16x16x1_SN_LDSB1_CLR1_GSU0_GSUC0_GSUWGMRR0_K1_LBSPPA1024_LBSPPB1024_LPB32_MIWT4_2_PLR2_SU32_SUM0_SUS256_VWA4_VWB2_WGM1_WGMXCC1_WGMXCCGn1
    SolutionIndex: 118
    SolutionNameMin: Cijk_Alik_Bjlk_HHS_BH_UserArgs_MT128x64x128_MI16x16x1_SN_LDSB1_CLR1_GSU0_GSUC0_GSUWGMRR0_K1_LBSPPA1024_LBSPPB1024_LPB32_MIWT4_2_PLR2_SU32_SUM0_SUS256_VWA4_VWB2_WGM4_WGMXCC1_WGMXCCGn1
    SolutionIndex: 119
    SolutionNameMin: Cijk_Alik_Bjlk_HHS_BH_UserArgs_MT128x64x128_MI16x16x1_SN_LDSB1_CLR1_GSU0_GSUC0_GSUWGMRR0_K1_LBSPPA512_LBSPPB1024_LPB32_MIWT4_2_PLR2_SU32_SUM0_SUS256_VWA2_VWB2_WGM8_WGMXCC1_WGMXCCGn1
    SolutionIndex: 120
    SolutionNameMin: Cijk_Alik_Bjlk_HHS_BH_UserArgs_MT128x64x128_MI16x16x1_SN_LDSB1_CLR1_GSU0_GSUC0_GSUWGMRR0_K1_LBSPPA1024_LBSPPB1024_LPB32_MIWT4_2_PLR2_SU32_SUM0_SUS256_VWA4_VWB2_WGM8_WGMXCC1_WGMXCCGn1
    SolutionIndex: 121
    SolutionNameMin: Cijk_Alik_Bjlk_HHS_BH_UserArgs_MT32x128x128_MI16x16x1_SN_LDSB1_CLR1_GSU0_GSUC0_GSUWGMRR0_K1_LBSPPA256_LBSPPB2048_LPB0_MIWT1_4_PLR1_SU32_SUM0_SUS256_VWA1_VWB4_WGM4_WGMXCC1_WGMXCCGn1
    SolutionIndex: 122
    SolutionNameMin: Cijk_Alik_Bjlk_HHS_BH_UserArgs_MT64x64x128_MI16x16x1_SN_LDSB1_CLR1_GSU0_GSUC0_GSUWGMRR0_K1_LBSPPA256_LBSPPB1024_LPB16_MIWT2_2_PLR1_SU32_SUM0_SUS256_VWA1_VWB1_WGM1_WGMXCC1_WGMXCCGn1
    SolutionIndex: 123
    SolutionNameMin: Cijk_Alik_Bjlk_HHS_BH_UserArgs_MT64x64x128_MI16x16x1_SN_LDSB1_CLR1_GSU0_GSUC0_GSUWGMRR0_K1_LBSPPA512_LBSPPB1024_LPB32_MIWT2_2_PLR2_SU32_SUM0_SUS256_VWA2_VWB2_WGM1_WGMXCC1_WGMXCCGn1
    SolutionIndex: 124
    SolutionNameMin: Cijk_Alik_Bjlk_HHS_BH_UserArgs_MT64x64x128_MI16x16x1_SN_LDSB1_CLR1_GSU0_GSUC0_GSUWGMRR0_K1_LBSPPA512_LBSPPB1024_LPB32_MIWT2_2_PLR2_SU32_SUM0_SUS256_VWA2_VWB2_WGM4_WGMXCC1_WGMXCCGn1
    SolutionIndex: 125
    SolutionNameMin: Cijk_Alik_Bjlk_HHS_BH_UserArgs_MT64x64x128_MI16x16x1_SN_LDSB1_CLR1_GSU0_GSUC0_GSUWGMRR0_K1_LBSPPA512_LBSPPB1024_LPB32_MIWT2_2_PLR2_SU32_SUM0_SUS256_VWA2_VWB2_WGM8_WGMXCC1_WGMXCCGn1
    SolutionIndex: 126
    SolutionNameMin: Cijk_Alik_Bjlk_HHS_BH_UserArgs_MT32x64x128_MI16x16x1_SN_LDSB1_CLR1_GSU0_GSUC0_GSUWGMRR0_K1_LBSPPA256_LBSPPB1024_LPB32_MIWT1_2_PLR1_SU32_SUM0_SUS256_VWA1_VWB2_WGM1_WGMXCC1_WGMXCCGn1
    SolutionIndex: 127
    SolutionNameMin: Cijk_Alik_Bjlk_HHS_BH_UserArgs_MT32x64x128_MI16x16x1_SN_LDSB1_CLR1_GSU0_GSUC0_GSUWGMRR0_K1_LBSPPA256_LBSPPB1024_LPB32_MIWT1_2_PLR2_SU32_SUM0_SUS256_VWA1_VWB2_WGM1_WGMXCC1_WGMXCCGn1
    SolutionIndex: 128
    SolutionNameMin: Cijk_Alik_Bjlk_HHS_BH_UserArgs_MT32x64x128_MI16x16x1_SN_LDSB1_CLR1_GSU0_GSUC0_GSUWGMRR0_K1_LBSPPA256_LBSPPB1024_LPB32_MIWT1_2_PLR2_SU32_SUM0_SUS256_VWA1_VWB2_WGM4_WGMXCC1_WGMXCCGn1
    SolutionIndex: 129
    SolutionNameMin: Cijk_Alik_Bjlk_HHS_BH_UserArgs_MT32x64x128_MI16x16x1_SN_LDSB1_CLR1_GSU0_GSUC0_GSUWGMRR0_K1_LBSPPA256_LBSPPB1024_LPB32_MIWT1_2_PLR1_SU32_SUM0_SUS256_VWA1_VWB2_WGM8_WGMXCC1_WGMXCCGn1
    SolutionIndex: 130
    SolutionNameMin: Cijk_Alik_Bjlk_HHS_BH_UserArgs_MT32x64x128_MI16x16x1_SN_LDSB1_CLR1_GSU0_GSUC0_GSUWGMRR0_K1_LBSPPA256_LBSPPB1024_LPB32_MIWT1_2_PLR2_SU32_SUM0_SUS256_VWA1_VWB2_WGM8_WGMXCC1_WGMXCCGn1
    SolutionIndex: 131
    SolutionNameMin: Cijk_Alik_Bjlk_HHS_BH_UserArgs_MT64x32x128_MI16x16x1_SN_LDSB1_CLR1_GSU0_GSUC0_GSUWGMRR0_K1_LBSPPA512_LBSPPB512_LPB16_MIWT2_1_PLR2_SU32_SUM0_SUS256_VWA2_VWB1_WGM1_WGMXCC1_WGMXCCGn1
    SolutionIndex: 132
    SolutionNameMin: Cijk_Alik_Bjlk_HHS_BH_UserArgs_MT64x32x128_MI16x16x1_SN_LDSB1_CLR1_GSU0_GSUC0_GSUWGMRR0_K1_LBSPPA512_LBSPPB512_LPB16_MIWT2_1_PLR2_SU32_SUM0_SUS256_VWA2_VWB1_WGM8_WGMXCC1_WGMXCCGn1
    SolutionIndex: 133
    SolutionNameMin: Cijk_Alik_Bjlk_HHS_BH_UserArgs_MT32x32x128_MI16x16x1_SN_LDSB1_CLR1_GSU0_GSUC0_GSUWGMRR0_K1_LBSPPA256_LBSPPB512_LPB16_MIWT1_1_PLR1_SU32_SUM0_SUS256_VWA1_VWB1_WGM1_WGMXCC1_WGMXCCGn1
    SolutionIndex: 134
    SolutionNameMin: Cijk_Alik_Bjlk_HHS_BH_UserArgs_MT32x32x128_MI16x16x1_SN_LDSB1_CLR1_GSU0_GSUC0_GSUWGMRR0_K1_LBSPPA256_LBSPPB512_LPB16_MIWT1_1_PLR2_SU32_SUM0_SUS256_VWA1_VWB1_WGM1_WGMXCC1_WGMXCCGn1
    SolutionIndex: 135
    SolutionNameMin: Cijk_Alik_Bjlk_HHS_BH_UserArgs_MT32x32x128_MI16x16x1_SN_LDSB1_CLR1_GSU0_GSUC0_GSUWGMRR0_K1_LBSPPA256_LBSPPB512_LPB16_MIWT1_1_PLR1_SU32_SUM0_SUS256_VWA1_VWB1_WGM4_WGMXCC1_WGMXCCGn1
    SolutionIndex: 136
    SolutionNameMin: Cijk_Alik_Bjlk_HHS_BH_UserArgs_MT32x32x128_MI16x16x1_SN_LDSB1_CLR1_GSU0_GSUC0_GSUWGMRR0_K1_LBSPPA256_LBSPPB512_LPB16_MIWT1_1_PLR2_SU32_SUM0_SUS256_VWA1_VWB1_WGM4_WGMXCC1_WGMXCCGn1
    SolutionIndex: 137
    SolutionNameMin: Cijk_Alik_Bjlk_HHS_BH_UserArgs_MT32x32x128_MI16x16x1_SN_LDSB1_CLR1_GSU0_GSUC0_GSUWGMRR0_K1_LBSPPA256_LBSPPB512_LPB16_MIWT1_1_PLR1_SU32_SUM0_SUS256_VWA1_VWB1_WGM8_WGMXCC1_WGMXCCGn1
    SolutionIndex: 138
    SolutionNameMin: Cijk_Alik_Bjlk_HHS_BH_UserArgs_MT32x32x32_MI16x16x1_SN_LDSB0_CLR0_GSU0_GSUC0_GSUWGMRR0_K1_LBSPPA128_LBSPPB256_LPB16_MIWT1_1_PLR0_SU32_SUM0_SUS256_VWA1_VWB1_WGM1_WGMXCC1_WGMXCCGn1
- - - [128, 128, 1, 128, 128, 128, 128, 128]
    - [133, 0.083]
  - - [128, 128, 1, 256, 128, 128, 256, 128]
    - [133, 0.102]
  - - [128, 128, 1, 512, 128, 128, 512, 128]
    - [137, 0.167]
  - - [128, 128, 1, 1024, 128, 128, 1024, 128]
    - [133, 0.296]
  - - [128, 128, 1, 2048, 128, 128, 2048, 128]
    - [133, 0.498]
  - - [128, 128, 1, 4096, 128, 128, 4096, 128]
    - [127, 0.781]
  - - [128, 128, 1, 8192, 128, 128, 8192, 128]
    - [127, 1.223]
  - - [128, 256, 1, 128, 128, 128, 128, 256]
    - [121, 0.139]
  - - [128, 256, 1, 256, 128, 128, 256, 256]
    - [137, 0.231]
  - - [128, 256, 1, 512, 128, 128, 512, 256]
    - [133, 0.319]
  - - [128, 256, 1, 1024, 128, 128, 1024, 256]
    - [133, 0.556]
  - - [128, 256, 1, 2048, 128, 128, 2048, 256]
    - [127, 0.87]
  - - [128, 256, 1, 4096, 128, 128, 4096, 256]
    - [110, 1.358]
  - - [128, 256, 1, 8192, 128, 128, 8192, 256]
    - [126, 1.873]
  - - [128, 512, 1, 128, 128, 128, 128, 512]
    - [132, 0.295]
  - - [128, 512, 1, 256, 128, 128, 256, 512]
    - [133, 0.497]
  - - [128, 512, 1, 512, 128, 128, 512, 512]
    - [137, 0.756]
  - - [128, 512, 1, 1024, 128, 128, 1024, 512]
    - [134, 1.085]
  - - [128, 512, 1, 2048, 128, 128, 2048, 512]
    - [126, 1.467]
  - - [128, 512, 1, 4096, 128, 128, 4096, 512]
    - [109, 2.247]
  - - [128, 512, 1, 8192, 128, 128, 8192, 512]
    - [71, 2.53]
  - - [128, 1024, 1, 128, 128, 128, 128, 1024]
    - [124, 0.554]
  - - [128, 1024, 1, 256, 128, 128, 256, 1024]
    - [113, 0.9]
  - - [128, 1024, 1, 512, 128, 128, 512, 1024]
    - [127, 1.342]
  - - [128, 1024, 1, 1024, 128, 128, 1024, 1024]
    - [126, 1.868]
  - - [128, 1024, 1, 2048, 128, 128, 2048, 1024]
    - [69, 2.084]
  - - [128, 1024, 1, 4096, 128, 128, 4096, 1024]
    - [96, 3.153]
  - - [128, 1024, 1, 8192, 128, 128, 8192, 1024]
    - [114, 3.484]
  - - [128, 2048, 1, 128, 128, 128, 128, 2048]
    - [106, 0.998]
  - - [128, 2048, 1, 256, 128, 128, 256, 2048]
    - [107, 1.573]
  - - [128, 2048, 1, 512, 128, 128, 512, 2048]
    - [109, 2.332]
  - - [128, 2048, 1, 1024, 128, 128, 1024, 2048]
    - [97, 2.508]
  - - [128, 2048, 1, 2048, 128, 128, 2048, 2048]
    - [47, 2.873]
  - - [128, 2048, 1, 4096, 128, 128, 4096, 2048]
    - [102, 3.604]
  - - [128, 2048, 1, 8192, 128, 128, 8192, 2048]
    - [17, 4.565]
  - - [128, 4096, 1, 128, 128, 128, 128, 4096]
    - [72, 1.64]
  - - [128, 4096, 1, 256, 128, 128, 256, 4096]
    - [99, 2.48]
  - - [128, 4096, 1, 512, 128, 128, 512, 4096]
    - [95, 3.245]
  - - [128, 4096, 1, 1024, 128, 128, 1024, 4096]
    - [115, 3.67]
  - - [128, 4096, 1, 2048, 128, 128, 2048, 4096]
    - [25, 3.889]
  - - [128, 4096, 1, 4096, 128, 128, 4096, 4096]
    - [104, 4.395]
  - - [128, 4096, 1, 8192, 128, 128, 8192, 4096]
    - [18, 4.811]
  - - [128, 8192, 1, 128, 128, 128, 128, 8192]
    - [51, 2.186]
  - - [128, 8192, 1, 256, 128, 128, 256, 8192]
    - [46, 2.79]
  - - [128, 8192, 1, 512, 128, 128, 512, 8192]
    - [87, 3.878]
  - - [128, 8192, 1, 1024, 128, 128, 1024, 8192]
    - [109, 4.07]
  - - [128, 8192, 1, 2048, 128, 128, 2048, 8192]
    - [106, 4.967]
  - - [128, 8192, 1, 4096, 128, 128, 4096, 8192]
    - [35, 5.671]
  - - [128, 8192, 1, 8192, 128, 128, 8192, 8192]
    - [24, 4.973]
  - - [256, 128, 1, 128, 256, 256, 128, 128]
    - [134, 0.163]
  - - [256, 128, 1, 256, 256, 256, 256, 128]
    - [137, 0.246]
  - - [256, 128, 1, 512, 256, 256, 512, 128]
    - [133, 0.329]
  - - [256, 128, 1, 1024, 256, 256, 1024, 128]
    - [134, 0.557]
  - - [256, 128, 1, 2048, 256, 256, 2048, 128]
    - [130, 0.877]
  - - [256, 128, 1, 4096, 256, 256, 4096, 128]
    - [111, 1.332]
  - - [256, 128, 1, 8192, 256, 256, 8192, 128]
    - [128, 1.955]
  - - [256, 256, 1, 128, 256, 256, 128, 256]
    - [126, 0.29]
  - - [256, 256, 1, 256, 256, 256, 256, 256]
    - [135, 0.502]
  - - [256, 256, 1, 512, 256, 256, 512, 256]
    - [133, 0.827]
  - - [256, 256, 1, 1024, 256, 256, 1024, 256]
    - [136, 1.129]
  - - [256, 256, 1, 2048, 256, 256, 2048, 256]
    - [126, 1.491]
  - - [256, 256, 1, 4096, 256, 256, 4096, 256]
    - [109, 2.322]
  - - [256, 256, 1, 8192, 256, 256, 8192, 256]
    - [70, 2.641]
  - - [256, 512, 1, 128, 256, 256, 128, 512]
    - [122, 0.536]
  - - [256, 512, 1, 256, 256, 256, 256, 512]
    - [110, 0.89]
  - - [256, 512, 1, 512, 256, 256, 512, 512]
    - [131, 1.362]
  - - [256, 512, 1, 1024, 256, 256, 1024, 512]
    - [130, 1.898]
  - - [256, 512, 1, 2048, 256, 256, 2048, 512]
    - [71, 2.198]
  - - [256, 512, 1, 4096, 256, 256, 4096, 512]
    - [97, 3.365]
  - - [256, 512, 1, 8192, 256, 256, 8192, 512]
    - [55, 3.67]
  - - [256, 1024, 1, 128, 256, 256, 128, 1024]
    - [73, 0.971]
  - - [256, 1024, 1, 256, 256, 256, 256, 1024]
    - [108, 1.592]
  - - [256, 1024, 1, 512, 256, 256, 512, 1024]
    - [106, 2.476]
  - - [256, 1024, 1, 1024, 256, 256, 1024, 1024]
    - [123, 2.482]
  - - [256, 1024, 1, 2048, 256, 256, 2048, 1024]
    - [57, 2.924]
  - - [256, 1024, 1, 4096, 256, 256, 4096, 1024]
    - [88, 3.687]
  - - [256, 1024, 1, 8192, 256, 256, 8192, 1024]
    - [25, 4.731]
  - - [256, 2048, 1, 128, 256, 256, 128, 2048]
    - [94, 1.718]
  - - [256, 2048, 1, 256, 256, 256, 256, 2048]
    - [94, 2.538]
  - - [256, 2048, 1, 512, 256, 256, 512, 2048]
    - [103, 3.137]
  - - [256, 2048, 1, 1024, 256, 256, 1024, 2048]
    - [116, 3.675]
  - - [256, 2048, 1, 2048, 256, 256, 2048, 2048]
    - [20, 4.03]
  - - [256, 2048, 1, 4096, 256, 256, 4096, 2048]
    - [98, 4.139]
  - - [256, 2048, 1, 8192, 256, 256, 8192, 2048]
    - [83, 4.765]
  - - [256, 4096, 1, 128, 256, 256, 128, 4096]
    - [48, 1.921]
  - - [256, 4096, 1, 256, 256, 256, 256, 4096]
    - [57, 3.037]
  - - [256, 4096, 1, 512, 256, 256, 512, 4096]
    - [91, 3.725]
  - - [256, 4096, 1, 1024, 256, 256, 1024, 4096]
    - [106, 4.419]
  - - [256, 4096, 1, 2048, 256, 256, 2048, 4096]
    - [108, 4.838]
  - - [256, 4096, 1, 4096, 256, 256, 4096, 4096]
    - [43, 5.284]
  - - [256, 4096, 1, 8192, 256, 256, 8192, 4096]
    - [20, 5.995]
  - - [256, 8192, 1, 128, 256, 256, 128, 8192]
    - [38, 2.993]
  - - [256, 8192, 1, 256, 256, 256, 256, 8192]
    - [20, 4.205]
  - - [256, 8192, 1, 512, 256, 256, 512, 8192]
    - [81, 4.773]
  - - [256, 8192, 1, 1024, 256, 256, 1024, 8192]
    - [100, 5.409]
  - - [256, 8192, 1, 2048, 256, 256, 2048, 8192]
    - [94, 6.26]
  - - [256, 8192, 1, 4096, 256, 256, 4096, 8192]
    - [55, 5.927]
  - - [256, 8192, 1, 8192, 256, 256, 8192, 8192]
    - [21, 6.544]
  - - [512, 128, 1, 128, 512, 512, 128, 128]
    - [130, 0.321]
  - - [512, 128, 1, 256, 512, 512, 256, 128]
    - [134, 0.492]
  - - [512, 128, 1, 512, 512, 512, 512, 128]
    - [134, 0.768]
  - - [512, 128, 1, 1024, 512, 512, 1024, 128]
    - [133, 1.09]
  - - [512, 128, 1, 2048, 512, 512, 2048, 128]
    - [126, 1.496]
  - - [512, 128, 1, 4096, 512, 512, 4096, 128]
    - [105, 2.303]
  - - [512, 128, 1, 8192, 512, 512, 8192, 128]
    - [65, 2.659]
  - - [512, 256, 1, 128, 512, 512, 128, 256]
    - [125, 0.607]
  - - [512, 256, 1, 256, 512, 512, 256, 256]
    - [110, 0.972]
  - - [512, 256, 1, 512, 512, 512, 512, 256]
    - [130, 1.435]
  - - [512, 256, 1, 1024, 512, 512, 1024, 256]
    - [129, 1.918]
  - - [512, 256, 1, 2048, 512, 512, 2048, 256]
    - [66, 2.221]
  - - [512, 256, 1, 4096, 512, 512, 4096, 256]
    - [94, 3.394]
  - - [512, 256, 1, 8192, 512, 512, 8192, 256]
    - [120, 3.619]
  - - [512, 512, 1, 128, 512, 512, 128, 512]
    - [106, 1.007]
  - - [512, 512, 1, 256, 512, 512, 256, 512]
    - [106, 1.714]
  - - [512, 512, 1, 512, 512, 512, 512, 512]
    - [106, 2.397]
  - - [512, 512, 1, 1024, 512, 512, 1024, 512]
    - [125, 2.532]
  - - [512, 512, 1, 2048, 512, 512, 2048, 512]
    - [64, 3.1]
  - - [512, 512, 1, 4096, 512, 512, 4096, 512]
    - [88, 3.794]
  - - [512, 512, 1, 8192, 512, 512, 8192, 512]
    - [33, 4.753]
  - - [512, 1024, 1, 128, 512, 512, 128, 1024]
    - [102, 1.683]
  - - [512, 1024, 1, 256, 512, 512, 256, 1024]
    - [92, 2.564]
  - - [512, 1024, 1, 512, 512, 512, 512, 1024]
    - [101, 3.584]
  - - [512, 1024, 1, 1024, 512, 512, 1024, 1024]
    - [119, 3.692]
  - - [512, 1024, 1, 2048, 512, 512, 2048, 1024]
    - [20, 4.173]
  - - [512, 1024, 1, 4096, 512, 512, 4096, 1024]
    - [79, 4.404]
  - - [512, 1024, 1, 8192, 512, 512, 8192, 1024]
    - [33, 5.218]
  - - [512, 2048, 1, 128, 512, 512, 128, 2048]
    - [55, 2.209]
  - - [512, 2048, 1, 256, 512, 512, 256, 2048]
    - [63, 3.135]
  - - [512, 2048, 1, 512, 512, 512, 512, 2048]
    - [91, 3.952]
  - - [512, 2048, 1, 1024, 512, 512, 1024, 2048]
    - [109, 4.296]
  - - [512, 2048, 1, 2048, 512, 512, 2048, 2048]
    - [106, 4.947]
  - - [512, 2048, 1, 4096, 512, 512, 4096, 2048]
    - [20, 5.222]
  - - [512, 2048, 1, 8192, 512, 512, 8192, 2048]
    - [31, 5.868]
  - - [512, 4096, 1, 128, 512, 512, 128, 4096]
    - [36, 2.984]
  - - [512, 4096, 1, 256, 512, 512, 256, 4096]
    - [35, 4.297]
  - - [512, 4096, 1, 512, 512, 512, 512, 4096]
    - [82, 4.663]
  - - [512, 4096, 1, 1024, 512, 512, 1024, 4096]
    - [95, 5.503]
  - - [512, 4096, 1, 2048, 512, 512, 2048, 4096]
    - [93, 6.114]
  - - [512, 4096, 1, 4096, 512, 512, 4096, 4096]
    - [118, 5.578]
  - - [512, 4096, 1, 8192, 512, 512, 8192, 4096]
    - [16, 6.38]
  - - [512, 8192, 1, 128, 512, 512, 128, 8192]
    - [60, 3.319]
  - - [512, 8192, 1, 256, 512, 512, 256, 8192]
    - [63, 4.907]
  - - [512, 8192, 1, 512, 512, 512, 512, 8192]
    - [59, 6.34]
  - - [512, 8192, 1, 1024, 512, 512, 1024, 8192]
    - [54, 7.227]
  - - [512, 8192, 1, 2048, 512, 512, 2048, 8192]
    - [89, 6.865]
  - - [512, 8192, 1, 4096, 512, 512, 4096, 8192]
    - [29, 7.146]
  - - [512, 8192, 1, 8192, 512, 512, 8192, 8192]
    - [29, 7.719]
  - - [1024, 128, 1, 128, 1024, 1024, 128, 128]
    - [123, 0.617]
  - - [1024, 128, 1, 256, 1024, 1024, 256, 128]
    - [112, 0.984]
  - - [1024, 128, 1, 512, 1024, 1024, 512, 128]
    - [128, 1.427]
  - - [1024, 128, 1, 1024, 1024, 1024, 1024, 128]
    - [128, 1.943]
  - - [1024, 128, 1, 2048, 1024, 1024, 2048, 128]
    - [68, 2.228]
  - - [1024, 128, 1, 4096, 1024, 1024, 4096, 128]
    - [95, 3.373]
  - - [1024, 128, 1, 8192, 1024, 1024, 8192, 128]
    - [94, 3.63]
  - - [1024, 256, 1, 128, 1024, 1024, 128, 256]
    - [109, 1.063]
  - - [1024, 256, 1, 256, 1024, 1024, 256, 256]
    - [109, 1.7]
  - - [1024, 256, 1, 512, 1024, 1024, 512, 256]
    - [106, 2.447]
  - - [1024, 256, 1, 1024, 1024, 1024, 1024, 256]
    - [123, 2.588]
  - - [1024, 256, 1, 2048, 1024, 1024, 2048, 256]
    - [60, 3.056]
  - - [1024, 256, 1, 4096, 1024, 1024, 4096, 256]
    - [85, 3.766]
  - - [1024, 256, 1, 8192, 1024, 1024, 8192, 256]
    - [20, 4.661]
  - - [1024, 512, 1, 128, 1024, 1024, 128, 512]
    - [67, 1.686]
  - - [1024, 512, 1, 256, 1024, 1024, 256, 512]
    - [99, 2.524]
  - - [1024, 512, 1, 512, 1024, 1024, 512, 512]
    - [103, 3.474]
  - - [1024, 512, 1, 1024, 1024, 1024, 1024, 512]
    - [116, 3.676]
  - - [1024, 512, 1, 2048, 1024, 1024, 2048, 512]
    - [35, 4.092]
  - - [1024, 512, 1, 4096, 1024, 1024, 4096, 512]
    - [29, 4.531]
  - - [1024, 512, 1, 8192, 1024, 1024, 8192, 512]
    - [29, 5.132]
  - - [1024, 1024, 1, 128, 1024, 1024, 128, 1024]
    - [51, 2.19]
  - - [1024, 1024, 1, 256, 1024, 1024, 256, 1024]
    - [55, 3.203]
  - - [1024, 1024, 1, 512, 1024, 1024, 512, 1024]
    - [85, 4.129]
  - - [1024, 1024, 1, 1024, 1024, 1024, 1024, 1024]
    - [106, 4.502]
  - - [1024, 1024, 1, 2048, 1024, 1024, 2048, 1024]
    - [106, 4.684]
  - - [1024, 1024, 1, 4096, 1024, 1024, 4096, 1024]
    - [27, 5.22]
  - - [1024, 1024, 1, 8192, 1024, 1024, 8192, 1024]
    - [80, 5.831]
  - - [1024, 2048, 1, 128, 1024, 1024, 128, 2048]
    - [38, 2.971]
  - - [1024, 2048, 1, 256, 1024, 1024, 256, 2048]
    - [28, 4.339]
  - - [1024, 2048, 1, 512, 1024, 1024, 512, 2048]
    - [78, 4.805]
  - - [1024, 2048, 1, 1024, 1024, 1024, 1024, 2048]
    - [103, 5.458]
  - - [1024, 2048, 1, 2048, 1024, 1024, 2048, 2048]
    - [94, 6.06]
  - - [1024, 2048, 1, 4096, 1024, 1024, 4096, 2048]
    - [120, 5.676]
  - - [1024, 2048, 1, 8192, 1024, 1024, 8192, 2048]
    - [20, 6.71]
  - - [1024, 4096, 1, 128, 1024, 1024, 128, 4096]
    - [55, 3.451]
  - - [1024, 4096, 1, 256, 1024, 1024, 256, 4096]
    - [59, 4.727]
  - - [1024, 4096, 1, 512, 1024, 1024, 512, 4096]
    - [60, 6.057]
  - - [1024, 4096, 1, 1024, 1024, 1024, 1024, 4096]
    - [58, 6.717]
  - - [1024, 4096, 1, 2048, 1024, 1024, 2048, 4096]
    - [90, 6.946]
  - - [1024, 4096, 1, 4096, 1024, 1024, 4096, 4096]
    - [27, 7.064]
  - - [1024, 4096, 1, 8192, 1024, 1024, 8192, 4096]
    - [20, 7.675]
  - - [1024, 8192, 1, 128, 1024, 1024, 128, 8192]
    - [44, 3.984]
  - - [1024, 8192, 1, 256, 1024, 1024, 256, 8192]
    - [32, 5.672]
  - - [1024, 8192, 1, 512, 1024, 1024, 512, 8192]
    - [19, 7.476]
  - - [1024, 8192, 1, 1024, 1024, 1024, 1024, 8192]
    - [22, 8.442]
  - - [1024, 8192, 1, 2048, 1024, 1024, 2048, 8192]
    - [79, 7.995]
  - - [1024, 8192, 1, 4096, 1024, 1024, 4096, 8192]
    - [27, 7.692]
  - - [1024, 8192, 1, 8192, 1024, 1024, 8192, 8192]
    - [27, 7.82]
  - - [2048, 128, 1, 128, 2048, 2048, 128, 128]
    - [73, 1.068]
  - - [2048, 128, 1, 256, 2048, 2048, 256, 128]
    - [108, 1.623]
  - - [2048, 128, 1, 512, 2048, 2048, 512, 128]
    - [106, 2.43]
  - - [2048, 128, 1, 1024, 2048, 2048, 1024, 128]
    - [102, 2.591]
  - - [2048, 128, 1, 2048, 2048, 2048, 2048, 128]
    - [60, 2.88]
  - - [2048, 128, 1, 4096, 2048, 2048, 4096, 128]
    - [85, 3.726]
  - - [2048, 128, 1, 8192, 2048, 2048, 8192, 128]
    - [85, 4.543]
  - - [2048, 256, 1, 128, 2048, 2048, 128, 256]
    - [99, 1.756]
  - - [2048, 256, 1, 256, 2048, 2048, 256, 256]
    - [99, 2.642]
  - - [2048, 256, 1, 512, 2048, 2048, 512, 256]
    - [94, 3.419]
  - - [2048, 256, 1, 1024, 2048, 2048, 1024, 256]
    - [117, 3.495]
  - - [2048, 256, 1, 2048, 2048, 2048, 2048, 256]
    - [17, 3.988]
  - - [2048, 256, 1, 4096, 2048, 2048, 4096, 256]
    - [77, 4.433]
  - - [2048, 256, 1, 8192, 2048, 2048, 8192, 256]
    - [20, 5.58]
  - - [2048, 512, 1, 128, 2048, 2048, 128, 512]
    - [51, 2.264]
  - - [2048, 512, 1, 256, 2048, 2048, 256, 512]
    - [59, 3.244]
  - - [2048, 512, 1, 512, 2048, 2048, 512, 512]
    - [84, 3.865]
  - - [2048, 512, 1, 1024, 2048, 2048, 1024, 512]
    - [109, 4.376]
  - - [2048, 512, 1, 2048, 2048, 2048, 2048, 512]
    - [97, 4.799]
  - - [2048, 512, 1, 4096, 2048, 2048, 4096, 512]
    - [27, 5.631]
  - - [2048, 512, 1, 8192, 2048, 2048, 8192, 512]
    - [20, 6.274]
  - - [2048, 1024, 1, 128, 2048, 2048, 128, 1024]
    - [36, 2.991]
  - - [2048, 1024, 1, 256, 2048, 2048, 256, 1024]
    - [26, 4.355]
  - - [2048, 1024, 1, 512, 2048, 2048, 512, 1024]
    - [75, 4.732]
  - - [2048, 1024, 1, 1024, 2048, 2048, 1024, 1024]
    - [97, 5.414]
  - - [2048, 1024, 1, 2048, 2048, 2048, 2048, 1024]
    - [95, 6.021]
  - - [2048, 1024, 1, 4096, 2048, 2048, 4096, 1024]
    - [29, 6.026]
  - - [2048, 1024, 1, 8192, 2048, 2048, 8192, 1024]
    - [27, 6.819]
  - - [2048, 2048, 1, 128, 2048, 2048, 128, 2048]
    - [61, 3.268]
  - - [2048, 2048, 1, 256, 2048, 2048, 256, 2048]
    - [53, 4.597]
  - - [2048, 2048, 1, 512, 2048, 2048, 512, 2048]
    - [54, 5.804]
  - - [2048, 2048, 1, 1024, 2048, 2048, 1024, 2048]
    - [52, 6.256]
  - - [2048, 2048, 1, 2048, 2048, 2048, 2048, 2048]
    - [88, 6.767]
  - - [2048, 2048, 1, 4096, 2048, 2048, 4096, 2048]
    - [31, 6.771]
  - - [2048, 2048, 1, 8192, 2048, 2048, 8192, 2048]
    - [83, 7.095]
  - - [2048, 4096, 1, 128, 2048, 2048, 128, 4096]
    - [41, 4.027]
  - - [2048, 4096, 1, 256, 2048, 2048, 256, 4096]
    - [19, 5.716]
  - - [2048, 4096, 1, 512, 2048, 2048, 512, 4096]
    - [34, 7.035]
  - - [2048, 4096, 1, 1024, 2048, 2048, 1024, 4096]
    - [19, 8.22]
  - - [2048, 4096, 1, 2048, 2048, 2048, 2048, 4096]
    - [78, 8.007]
  - - [2048, 4096, 1, 4096, 2048, 2048, 4096, 4096]
    - [23, 7.816]
  - - [2048, 4096, 1, 8192, 2048, 2048, 8192, 4096]
    - [11, 7.91]
  - - [2048, 8192, 1, 128, 2048, 2048, 128, 8192]
    - [4, 3.473]
  - - [2048, 8192, 1, 256, 2048, 2048, 256, 8192]
    - [10, 4.982]
  - - [2048, 8192, 1, 512, 2048, 2048, 512, 8192]
    - [1, 6.672]
  - - [2048, 8192, 1, 1024, 2048, 2048, 1024, 8192]
    - [4, 7.897]
  - - [2048, 8192, 1, 2048, 2048, 2048, 2048, 8192]
    - [23, 7.876]
  - - [2048, 8192, 1, 4096, 2048, 2048, 4096, 8192]
    - [18, 8.251]
  - - [2048, 8192, 1, 8192, 2048, 2048, 8192, 8192]
    - [19, 8.285]
  - - [4096, 128, 1, 128, 4096, 4096, 128, 128]
    - [66, 1.693]
  - - [4096, 128, 1, 256, 4096, 4096, 256, 128]
    - [103, 2.482]
  - - [4096, 128, 1, 512, 4096, 4096, 512, 128]
    - [95, 3.221]
  - - [4096, 128, 1, 1024, 4096, 4096, 1024, 128]
    - [115, 3.414]
  - - [4096, 128, 1, 2048, 4096, 4096, 2048, 128]
    - [109, 3.68]
  - - [4096, 128, 1, 4096, 4096, 4096, 4096, 128]
    - [102, 4.226]
  - - [4096, 128, 1, 8192, 4096, 4096, 8192, 128]
    - [91, 5.294]
  - - [4096, 256, 1, 128, 4096, 4096, 128, 256]
    - [53, 2.163]
  - - [4096, 256, 1, 256, 4096, 4096, 256, 256]
    - [59, 3.042]
  - - [4096, 256, 1, 512, 4096, 4096, 512, 256]
    - [88, 3.802]
  - - [4096, 256, 1, 1024, 4096, 4096, 1024, 256]
    - [109, 4.168]
  - - [4096, 256, 1, 2048, 4096, 4096, 2048, 256]
    - [108, 4.685]
  - - [4096, 256, 1, 4096, 4096, 4096, 4096, 256]
    - [23, 5.598]
  - - [4096, 256, 1, 8192, 4096, 4096, 8192, 256]
    - [35, 6.385]
  - - [4096, 512, 1, 128, 4096, 4096, 128, 512]
    - [40, 3.031]
  - - [4096, 512, 1, 256, 4096, 4096, 256, 512]
    - [32, 4.212]
  - - [4096, 512, 1, 512, 4096, 4096, 512, 512]
    - [76, 4.747]
  - - [4096, 512, 1, 1024, 4096, 4096, 1024, 512]
    - [95, 5.377]
  - - [4096, 512, 1, 2048, 4096, 4096, 2048, 512]
    - [95, 6.048]
  - - [4096, 512, 1, 4096, 4096, 4096, 4096, 512]
    - [27, 6.259]
  - - [4096, 512, 1, 8192, 4096, 4096, 8192, 512]
    - [20, 7.29]
  - - [4096, 1024, 1, 128, 4096, 4096, 128, 1024]
    - [53, 3.339]
  - - [4096, 1024, 1, 256, 4096, 4096, 256, 1024]
    - [61, 4.759]
  - - [4096, 1024, 1, 512, 4096, 4096, 512, 1024]
    - [63, 6.02]
  - - [4096, 1024, 1, 1024, 4096, 4096, 1024, 1024]
    - [45, 6.466]
  - - [4096, 1024, 1, 2048, 4096, 4096, 2048, 1024]
    - [91, 6.959]
  - - [4096, 1024, 1, 4096, 4096, 4096, 4096, 1024]
    - [23, 6.975]
  - - [4096, 1024, 1, 8192, 4096, 4096, 8192, 1024]
    - [27, 7.567]
  - - [4096, 2048, 1, 128, 4096, 4096, 128, 2048]
    - [37, 3.912]
  - - [4096, 2048, 1, 256, 4096, 4096, 256, 2048]
    - [30, 5.513]
  - - [4096, 2048, 1, 512, 4096, 4096, 512, 2048]
    - [32, 7.122]
  - - [4096, 2048, 1, 1024, 4096, 4096, 1024, 2048]
    - [19, 7.763]
  - - [4096, 2048, 1, 2048, 4096, 4096, 2048, 2048]
    - [77, 7.966]
  - - [4096, 2048, 1, 4096, 4096, 4096, 4096, 2048]
    - [35, 7.553]
  - - [4096, 2048, 1, 8192, 4096, 4096, 8192, 2048]
    - [14, 7.832]
  - - [4096, 4096, 1, 128, 4096, 4096, 128, 4096]
    - [5, 3.415]
  - - [4096, 4096, 1, 256, 4096, 4096, 256, 4096]
    - [1, 5.032]
  - - [4096, 4096, 1, 512, 4096, 4096, 512, 4096]
    - [8, 6.578]
  - - [4096, 4096, 1, 1024, 4096, 4096, 1024, 4096]
    - [15, 7.793]
  - - [4096, 4096, 1, 2048, 4096, 4096, 2048, 4096]
    - [20, 8.04]
  - - [4096, 4096, 1, 4096, 4096, 4096, 4096, 4096]
    - [20, 8.354]
  - - [4096, 4096, 1, 8192, 4096, 4096, 8192, 4096]
    - [2, 8.327]
  - - [4096, 8192, 1, 128, 4096, 4096, 128, 8192]
    - [53, 3.579]
  - - [4096, 8192, 1, 256, 4096, 4096, 256, 8192]
    - [57, 4.805]
  - - [4096, 8192, 1, 512, 4096, 4096, 512, 8192]
    - [29, 6.382]
  - - [4096, 8192, 1, 1024, 4096, 4096, 1024, 8192]
    - [26, 7.411]
  - - [4096, 8192, 1, 2048, 4096, 4096, 2048, 8192]
    - [20, 8.183]
  - - [4096, 8192, 1, 4096, 4096, 4096, 4096, 8192]
    - [3, 8.254]
  - - [4096, 8192, 1, 8192, 4096, 4096, 8192, 8192]
    - [9, 8.488]
  - - [8192, 128, 1, 128, 8192, 8192, 128, 128]
    - [51, 2.245]
  - - [8192, 128, 1, 256, 8192, 8192, 256, 128]
    - [50, 2.923]
  - - [8192, 128, 1, 512, 8192, 8192, 512, 128]
    - [87, 3.76]
  - - [8192, 128, 1, 1024, 8192, 8192, 1024, 128]
    - [109, 4.133]
  - - [8192, 128, 1, 2048, 8192, 8192, 2048, 128]
    - [95, 4.667]
  - - [8192, 128, 1, 4096, 8192, 8192, 4096, 128]
    - [94, 5.201]
  - - [8192, 128, 1, 8192, 8192, 8192, 8192, 128]
    - [83, 6.03]
  - - [8192, 256, 1, 128, 8192, 8192, 128, 256]
    - [42, 3.057]
  - - [8192, 256, 1, 256, 8192, 8192, 256, 256]
    - [30, 3.909]
  - - [8192, 256, 1, 512, 8192, 8192, 512, 256]
    - [74, 4.718]
  - - [8192, 256, 1, 1024, 8192, 8192, 1024, 256]
    - [97, 5.113]
  - - [8192, 256, 1, 2048, 8192, 8192, 2048, 256]
    - [95, 6.035]
  - - [8192, 256, 1, 4096, 8192, 8192, 4096, 256]
    - [33, 6.387]
  - - [8192, 256, 1, 8192, 8192, 8192, 8192, 256]
    - [27, 7.601]
  - - [8192, 512, 1, 128, 8192, 8192, 128, 512]
    - [49, 3.294]
  - - [8192, 512, 1, 256, 8192, 8192, 256, 512]
    - [57, 4.591]
  - - [8192, 512, 1, 512, 8192, 8192, 512, 512]
    - [47, 5.54]
  - - [8192, 512, 1, 1024, 8192, 8192, 1024, 512]
    - [64, 6.14]
  - - [8192, 512, 1, 2048, 8192, 8192, 2048, 512]
    - [86, 6.648]
  - - [8192, 512, 1, 4096, 8192, 8192, 4096, 512]
    - [27, 7.361]
  - - [8192, 512, 1, 8192, 8192, 8192, 8192, 512]
    - [20, 7.964]
  - - [8192, 1024, 1, 128, 8192, 8192, 128, 1024]
    - [39, 3.685]
  - - [8192, 1024, 1, 256, 8192, 8192, 256, 1024]
    - [30, 5.338]
  - - [8192, 1024, 1, 512, 8192, 8192, 512, 1024]
    - [33, 6.889]
  - - [8192, 1024, 1, 1024, 8192, 8192, 1024, 1024]
    - [32, 8.094]
  - - [8192, 1024, 1, 2048, 8192, 8192, 2048, 1024]
    - [75, 7.918]
  - - [8192, 1024, 1, 4096, 8192, 8192, 4096, 1024]
    - [27, 7.478]
  - - [8192, 1024, 1, 8192, 8192, 8192, 8192, 1024]
    - [6, 7.991]
  - - [8192, 2048, 1, 128, 8192, 8192, 128, 2048]
    - [1, 3.344]
  - - [8192, 2048, 1, 256, 8192, 8192, 256, 2048]
    - [0, 4.87]
  - - [8192, 2048, 1, 512, 8192, 8192, 512, 2048]
    - [13, 6.486]
  - - [8192, 2048, 1, 1024, 8192, 8192, 1024, 2048]
    - [13, 7.828]
  - - [8192, 2048, 1, 2048, 8192, 8192, 2048, 2048]
    - [27, 7.674]
  - - [8192, 2048, 1, 4096, 8192, 8192, 4096, 2048]
    - [19, 7.993]
  - - [8192, 2048, 1, 8192, 8192, 8192, 8192, 2048]
    - [11, 8.238]
  - - [8192, 4096, 1, 128, 8192, 8192, 128, 4096]
    - [56, 3.513]
  - - [8192, 4096, 1, 256, 8192, 8192, 256, 4096]
    - [30, 4.717]
  - - [8192, 4096, 1, 512, 8192, 8192, 512, 4096]
    - [16, 6.16]
  - - [8192, 4096, 1, 1024, 8192, 8192, 1024, 4096]
    - [16, 7.101]
  - - [8192, 4096, 1, 2048, 8192, 8192, 2048, 4096]
    - [27, 8.075]
  - - [8192, 4096, 1, 4096, 8192, 8192, 4096, 4096]
    - [7, 8.358]
  - - [8192, 4096, 1, 8192, 8192, 8192, 8192, 4096]
    - [11, 8.639]
  - - [8192, 8192, 1, 128, 8192, 8192, 128, 8192]
    - [62, 3.379]
  - - [8192, 8192, 1, 256, 8192, 8192, 256, 8192]
    - [31, 4.809]
  - - [8192, 8192, 1, 512, 8192, 8192, 512, 8192]
    - [20, 6.428]
  - - [8192, 8192, 1, 1024, 8192, 8192, 1024, 8192]
    - [27, 7.401]
  - - [8192, 8192, 1, 2048, 8192, 8192, 2048, 8192]
    - [27, 8.056]
  - - [8192, 8192, 1, 4096, 8192, 8192, 4096, 8192]
    - [11, 8.261]
  - - [8192, 8192, 1, 8192, 8192, 8192, 8192, 8192]
    - [12, 8.391]
  - - [1, 1, 1, 32, 1, 1, 32, 1]
    - [138, 0.0]
- null
- null
- DeviceEfficiency
- GridBased
