library/src/amd_detail/rocblaslt/src/Tensile/Logic/streamk/gfx942_38cu/aquavanjaram942_Cijk_Ailk_Bljk_HHS_BH_UserArgs.yaml
- {MinimumRequiredVersion: 4.33.0}
- aquavanjaram942
- {Architecture: gfx942, CUCount: 38}
- [Device 0049, Device 0050]
    SolutionIndex: 0
    SolutionNameMin: Cijk_Ailk_Bljk_HHS_BH_UserArgs_MT256x256x32_MI16x16x1_SN_LDSB1_CLR1_GSU0_GSUC0_GSUWGMRR0_K1_LBSPPA2048_LBSPPB128_LPA0_MIWT8_8_PLR1_SU32_SUM0_SUS256_VWA8_VWB1_WGM1_WGMXCC1_WGMXCCGn1
    SolutionIndex: 1
    SolutionNameMin: Cijk_Ailk_Bljk_HHS_BH_UserArgs_MT256x256x32_MI16x16x1_SN_LDSB1_CLR1_GSU0_GSUC0_GSUWGMRR0_K1_LBSPPA2048_LBSPPB128_LPA0_MIWT8_8_PLR1_SU32_SUM0_SUS256_VWA4_VWB2_WGM1_WGMXCC1_WGMXCCGn1
    SolutionIndex: 2
    SolutionNameMin: Cijk_Ailk_Bljk_HHS_BH_UserArgs_MT256x256x32_MI16x16x1_SN_LDSB1_CLR1_GSU0_GSUC0_GSUWGMRR0_K1_LBSPPA2048_LBSPPB128_LPA0_MIWT8_8_PLR1_SU32_SUM0_SUS256_VWA8_VWB2_WGM1_WGMXCC1_WGMXCCGn1
    SolutionIndex: 3
    SolutionNameMin: Cijk_Ailk_Bljk_HHS_BH_UserArgs_MT256x256x32_MI16x16x1_SN_LDSB1_CLR1_GSU0_GSUC0_GSUWGMRR0_K1_LBSPPA2048_LBSPPB256_LPA0_MIWT8_8_PLR1_SU32_SUM0_SUS256_VWA8_VWB4_WGM1_WGMXCC1_WGMXCCGn1
    SolutionIndex: 4
    SolutionNameMin: Cijk_Ailk_Bljk_HHS_BH_UserArgs_MT256x256x32_MI16x16x1_SN_LDSB1_CLR1_GSU0_GSUC0_GSUWGMRR0_K1_LBSPPA2048_LBSPPB512_LPA0_MIWT8_8_PLR1_SU32_SUM0_SUS256_VWA4_VWB8_WGM1_WGMXCC1_WGMXCCGn1
    SolutionIndex: 5
    SolutionNameMin: Cijk_Ailk_Bljk_HHS_BH_UserArgs_MT256x256x32_MI16x16x1_SN_LDSB1_CLR1_GSU0_GSUC0_GSUWGMRR0_K1_LBSPPA2048_LBSPPB512_LPA0_MIWT8_8_PLR1_SU32_SUM0_SUS256_VWA8_VWB8_WGM1_WGMXCC1_WGMXCCGn1
    SolutionIndex: 6
    SolutionNameMin: Cijk_Ailk_Bljk_HHS_BH_UserArgs_MT256x256x32_MI16x16x1_SN_LDSB1_CLR1_GSU0_GSUC0_GSUWGMRR0_K1_LBSPPA2048_LBSPPB128_LPA0_MIWT8_8_PLR1_SU32_SUM0_SUS256_VWA4_VWB1_WGM4_WGMXCC1_WGMXCCGn1
    SolutionIndex: 7
    SolutionNameMin: Cijk_Ailk_Bljk_HHS_BH_UserArgs_MT256x256x32_MI16x16x1_SN_LDSB1_CLR1_GSU0_GSUC0_GSUWGMRR0_K1_LBSPPA2048_LBSPPB128_LPA0_MIWT8_8_PLR1_SU32_SUM0_SUS256_VWA4_VWB2_WGM4_WGMXCC1_WGMXCCGn1
    SolutionIndex: 8
    SolutionNameMin: Cijk_Ailk_Bljk_HHS_BH_UserArgs_MT256x256x32_MI16x16x1_SN_LDSB1_CLR1_GSU0_GSUC0_GSUWGMRR0_K1_LBSPPA2048_LBSPPB256_LPA0_MIWT8_8_PLR1_SU32_SUM0_SUS256_VWA4_VWB4_WGM4_WGMXCC1_WGMXCCGn1
    SolutionIndex: 9
    SolutionNameMin: Cijk_Ailk_Bljk_HHS_BH_UserArgs_MT256x256x32_MI16x16x1_SN_LDSB1_CLR1_GSU0_GSUC0_GSUWGMRR0_K1_LBSPPA2048_LBSPPB512_LPA0_MIWT8_8_PLR1_SU32_SUM0_SUS256_VWA4_VWB8_WGM4_WGMXCC1_WGMXCCGn1
    SolutionIndex: 10
    SolutionNameMin: Cijk_Ailk_Bljk_HHS_BH_UserArgs_MT256x256x32_MI16x16x1_SN_LDSB1_CLR1_GSU0_GSUC0_GSUWGMRR0_K1_LBSPPA2048_LBSPPB128_LPA0_MIWT8_8_PLR1_SU32_SUM0_SUS256_VWA4_VWB1_WGM8_WGMXCC1_WGMXCCGn1
    SolutionIndex: 11
    SolutionNameMin: Cijk_Ailk_Bljk_HHS_BH_UserArgs_MT256x256x32_MI16x16x1_SN_LDSB1_CLR1_GSU0_GSUC0_GSUWGMRR0_K1_LBSPPA2048_LBSPPB128_LPA0_MIWT8_8_PLR1_SU32_SUM0_SUS256_VWA4_VWB2_WGM8_WGMXCC1_WGMXCCGn1
    SolutionIndex: 12
    SolutionNameMin: Cijk_Ailk_Bljk_HHS_BH_UserArgs_MT256x256x32_MI16x16x1_SN_LDSB1_CLR1_GSU0_GSUC0_GSUWGMRR0_K1_LBSPPA2048_LBSPPB512_LPA32_MIWT8_8_PLR1_SU32_SUM0_SUS256_VWA2_VWB8_WGM8_WGMXCC1_WGMXCCGn1
    SolutionIndex: 13
    SolutionNameMin: Cijk_Ailk_Bljk_HHS_BH_UserArgs_MT256x256x32_MI16x16x1_SN_LDSB1_CLR1_GSU0_GSUC0_GSUWGMRR0_K1_LBSPPA2048_LBSPPB512_LPA0_MIWT8_8_PLR1_SU32_SUM0_SUS256_VWA8_VWB8_WGM8_WGMXCC1_WGMXCCGn1
    SolutionIndex: 14
    SolutionNameMin: Cijk_Ailk_Bljk_HHS_BH_UserArgs_MT256x128x32_MI16x16x1_SN_LDSB1_CLR1_GSU0_GSUC0_GSUWGMRR0_K1_LBSPPA2048_LBSPPB128_LPA0_MIWT8_4_PLR1_SU32_SUM0_SUS256_VWA4_VWB1_WGM1_WGMXCC1_WGMXCCGn1
    SolutionIndex: 15
    SolutionNameMin: Cijk_Ailk_Bljk_HHS_BH_UserArgs_MT256x128x32_MI16x16x1_SN_LDSB1_CLR1_GSU0_GSUC0_GSUWGMRR0_K1_LBSPPA2048_LBSPPB128_LPA0_MIWT8_4_PLR1_SU32_SUM0_SUS256_VWA8_VWB1_WGM1_WGMXCC1_WGMXCCGn1
    SolutionIndex: 16
    SolutionNameMin: Cijk_Ailk_Bljk_HHS_BH_UserArgs_MT256x128x32_MI16x16x1_SN_LDSB1_CLR1_GSU0_GSUC0_GSUWGMRR0_K1_LBSPPA2048_LBSPPB128_LPA32_MIWT8_4_PLR1_SU32_SUM0_SUS256_VWA2_VWB2_WGM1_WGMXCC1_WGMXCCGn1
    SolutionIndex: 17
    SolutionNameMin: Cijk_Ailk_Bljk_HHS_BH_UserArgs_MT256x128x32_MI16x16x1_SN_LDSB1_CLR1_GSU0_GSUC0_GSUWGMRR0_K1_LBSPPA2048_LBSPPB128_LPA0_MIWT8_4_PLR1_SU32_SUM0_SUS256_VWA4_VWB2_WGM1_WGMXCC1_WGMXCCGn1
    SolutionIndex: 18
    SolutionNameMin: Cijk_Ailk_Bljk_HHS_BH_UserArgs_MT256x128x32_MI16x16x1_SN_LDSB1_CLR1_GSU0_GSUC0_GSUWGMRR0_K1_LBSPPA2048_LBSPPB128_LPA0_MIWT8_4_PLR1_SU32_SUM0_SUS256_VWA8_VWB2_WGM1_WGMXCC1_WGMXCCGn1
    SolutionIndex: 19
    SolutionNameMin: Cijk_Ailk_Bljk_HHS_BH_UserArgs_MT256x128x32_MI16x16x1_SN_LDSB1_CLR1_GSU0_GSUC0_GSUWGMRR0_K1_LBSPPA2048_LBSPPB256_LPA0_MIWT8_4_PLR1_SU32_SUM0_SUS256_VWA4_VWB4_WGM1_WGMXCC1_WGMXCCGn1
    SolutionIndex: 20
    SolutionNameMin: Cijk_Ailk_Bljk_HHS_BH_UserArgs_MT256x128x32_MI16x16x1_SN_LDSB1_CLR1_GSU0_GSUC0_GSUWGMRR0_K1_LBSPPA2048_LBSPPB256_LPA0_MIWT8_4_PLR1_SU32_SUM0_SUS256_VWA8_VWB4_WGM1_WGMXCC1_WGMXCCGn1
    SolutionIndex: 21
    SolutionNameMin: Cijk_Ailk_Bljk_HHS_BH_UserArgs_MT256x128x32_MI16x16x1_SN_LDSB1_CLR1_GSU0_GSUC0_GSUWGMRR0_K1_LBSPPA2048_LBSPPB128_LPA0_MIWT8_4_PLR1_SU32_SUM0_SUS256_VWA4_VWB1_WGM4_WGMXCC1_WGMXCCGn1
    SolutionIndex: 22
    SolutionNameMin: Cijk_Ailk_Bljk_HHS_BH_UserArgs_MT256x128x32_MI16x16x1_SN_LDSB1_CLR1_GSU0_GSUC0_GSUWGMRR0_K1_LBSPPA2048_LBSPPB128_LPA0_MIWT8_4_PLR1_SU32_SUM0_SUS256_VWA8_VWB1_WGM4_WGMXCC1_WGMXCCGn1
    SolutionIndex: 23
    SolutionNameMin: Cijk_Ailk_Bljk_HHS_BH_UserArgs_MT256x128x32_MI16x16x1_SN_LDSB1_CLR1_GSU0_GSUC0_GSUWGMRR0_K1_LBSPPA2048_LBSPPB128_LPA0_MIWT8_4_PLR1_SU32_SUM0_SUS256_VWA4_VWB2_WGM4_WGMXCC1_WGMXCCGn1
    SolutionIndex: 24
    SolutionNameMin: Cijk_Ailk_Bljk_HHS_BH_UserArgs_MT256x128x32_MI16x16x1_SN_LDSB1_CLR1_GSU0_GSUC0_GSUWGMRR0_K1_LBSPPA2048_LBSPPB128_LPA0_MIWT8_4_PLR1_SU32_SUM0_SUS256_VWA8_VWB2_WGM4_WGMXCC1_WGMXCCGn1
    SolutionIndex: 25
    SolutionNameMin: Cijk_Ailk_Bljk_HHS_BH_UserArgs_MT256x128x32_MI16x16x1_SN_LDSB1_CLR1_GSU0_GSUC0_GSUWGMRR0_K1_LBSPPA2048_LBSPPB256_LPA0_MIWT8_4_PLR1_SU32_SUM0_SUS256_VWA4_VWB4_WGM4_WGMXCC1_WGMXCCGn1
    SolutionIndex: 26
    SolutionNameMin: Cijk_Ailk_Bljk_HHS_BH_UserArgs_MT256x128x32_MI16x16x1_SN_LDSB1_CLR1_GSU0_GSUC0_GSUWGMRR0_K1_LBSPPA2048_LBSPPB256_LPA0_MIWT8_4_PLR1_SU32_SUM0_SUS256_VWA8_VWB4_WGM4_WGMXCC1_WGMXCCGn1
    SolutionIndex: 27
    SolutionNameMin: Cijk_Ailk_Bljk_HHS_BH_UserArgs_MT256x128x32_MI16x16x1_SN_LDSB1_CLR1_GSU0_GSUC0_GSUWGMRR0_K1_LBSPPA2048_LBSPPB128_LPA0_MIWT8_4_PLR1_SU32_SUM0_SUS256_VWA4_VWB1_WGM8_WGMXCC1_WGMXCCGn1
    SolutionIndex: 28
    SolutionNameMin: Cijk_Ailk_Bljk_HHS_BH_UserArgs_MT256x128x32_MI16x16x1_SN_LDSB1_CLR1_GSU0_GSUC0_GSUWGMRR0_K1_LBSPPA2048_LBSPPB128_LPA0_MIWT8_4_PLR1_SU32_SUM0_SUS256_VWA8_VWB1_WGM8_WGMXCC1_WGMXCCGn1
    SolutionIndex: 29
    SolutionNameMin: Cijk_Ailk_Bljk_HHS_BH_UserArgs_MT256x128x32_MI16x16x1_SN_LDSB1_CLR1_GSU0_GSUC0_GSUWGMRR0_K1_LBSPPA2048_LBSPPB128_LPA0_MIWT8_4_PLR1_SU32_SUM0_SUS256_VWA4_VWB2_WGM8_WGMXCC1_WGMXCCGn1
    SolutionIndex: 30
    SolutionNameMin: Cijk_Ailk_Bljk_HHS_BH_UserArgs_MT256x128x32_MI16x16x1_SN_LDSB1_CLR1_GSU0_GSUC0_GSUWGMRR0_K1_LBSPPA2048_LBSPPB128_LPA0_MIWT8_4_PLR1_SU32_SUM0_SUS256_VWA8_VWB2_WGM8_WGMXCC1_WGMXCCGn1
    SolutionIndex: 31
    SolutionNameMin: Cijk_Ailk_Bljk_HHS_BH_UserArgs_MT256x128x32_MI16x16x1_SN_LDSB1_CLR1_GSU0_GSUC0_GSUWGMRR0_K1_LBSPPA2048_LBSPPB256_LPA0_MIWT8_4_PLR1_SU32_SUM0_SUS256_VWA4_VWB4_WGM8_WGMXCC1_WGMXCCGn1
    SolutionIndex: 32
    SolutionNameMin: Cijk_Ailk_Bljk_HHS_BH_UserArgs_MT256x128x32_MI16x16x1_SN_LDSB1_CLR1_GSU0_GSUC0_GSUWGMRR0_K1_LBSPPA2048_LBSPPB256_LPA0_MIWT8_4_PLR1_SU32_SUM0_SUS256_VWA8_VWB4_WGM8_WGMXCC1_WGMXCCGn1
    SolutionIndex: 33
    SolutionNameMin: Cijk_Ailk_Bljk_HHS_BH_UserArgs_MT256x64x32_MI16x16x1_SN_LDSB1_CLR1_GSU0_GSUC0_GSUWGMRR0_K1_LBSPPA2048_LBSPPB128_LPA0_MIWT8_2_PLR1_SU32_SUM0_SUS256_VWA4_VWB1_WGM1_WGMXCC1_WGMXCCGn1
    SolutionIndex: 34
    SolutionNameMin: Cijk_Ailk_Bljk_HHS_BH_UserArgs_MT256x64x32_MI16x16x1_SN_LDSB1_CLR1_GSU0_GSUC0_GSUWGMRR0_K1_LBSPPA2048_LBSPPB128_LPA0_MIWT8_2_PLR1_SU32_SUM0_SUS256_VWA8_VWB1_WGM1_WGMXCC1_WGMXCCGn1
    SolutionIndex: 35
    SolutionNameMin: Cijk_Ailk_Bljk_HHS_BH_UserArgs_MT256x64x32_MI16x16x1_SN_LDSB1_CLR1_GSU0_GSUC0_GSUWGMRR0_K1_LBSPPA2048_LBSPPB128_LPA32_MIWT8_2_PLR1_SU32_SUM0_SUS256_VWA2_VWB2_WGM1_WGMXCC1_WGMXCCGn1
    SolutionIndex: 36
    SolutionNameMin: Cijk_Ailk_Bljk_HHS_BH_UserArgs_MT256x64x32_MI16x16x1_SN_LDSB1_CLR1_GSU0_GSUC0_GSUWGMRR0_K1_LBSPPA2048_LBSPPB128_LPA0_MIWT8_2_PLR1_SU32_SUM0_SUS256_VWA4_VWB2_WGM1_WGMXCC1_WGMXCCGn1
    SolutionIndex: 37
    SolutionNameMin: Cijk_Ailk_Bljk_HHS_BH_UserArgs_MT256x64x32_MI16x16x1_SN_LDSB1_CLR1_GSU0_GSUC0_GSUWGMRR0_K1_LBSPPA2048_LBSPPB128_LPA0_MIWT8_2_PLR1_SU32_SUM0_SUS256_VWA8_VWB2_WGM1_WGMXCC1_WGMXCCGn1
    SolutionIndex: 38
    SolutionNameMin: Cijk_Ailk_Bljk_HHS_BH_UserArgs_MT256x64x32_MI16x16x1_SN_LDSB1_CLR1_GSU0_GSUC0_GSUWGMRR0_K1_LBSPPA2048_LBSPPB128_LPA32_MIWT8_2_PLR1_SU32_SUM0_SUS256_VWA2_VWB1_WGM4_WGMXCC1_WGMXCCGn1
    SolutionIndex: 39
    SolutionNameMin: Cijk_Ailk_Bljk_HHS_BH_UserArgs_MT256x64x32_MI16x16x1_SN_LDSB1_CLR1_GSU0_GSUC0_GSUWGMRR0_K1_LBSPPA2048_LBSPPB128_LPA0_MIWT8_2_PLR1_SU32_SUM0_SUS256_VWA4_VWB1_WGM4_WGMXCC1_WGMXCCGn1
    SolutionIndex: 40
    SolutionNameMin: Cijk_Ailk_Bljk_HHS_BH_UserArgs_MT256x64x32_MI16x16x1_SN_LDSB1_CLR1_GSU0_GSUC0_GSUWGMRR0_K1_LBSPPA2048_LBSPPB128_LPA0_MIWT8_2_PLR1_SU32_SUM0_SUS256_VWA8_VWB1_WGM4_WGMXCC1_WGMXCCGn1
    SolutionIndex: 41
    SolutionNameMin: Cijk_Ailk_Bljk_HHS_BH_UserArgs_MT256x64x32_MI16x16x1_SN_LDSB1_CLR1_GSU0_GSUC0_GSUWGMRR0_K1_LBSPPA2048_LBSPPB128_LPA0_MIWT8_2_PLR1_SU32_SUM0_SUS256_VWA8_VWB2_WGM4_WGMXCC1_WGMXCCGn1
    SolutionIndex: 42
    SolutionNameMin: Cijk_Ailk_Bljk_HHS_BH_UserArgs_MT256x64x32_MI16x16x1_SN_LDSB1_CLR1_GSU0_GSUC0_GSUWGMRR0_K1_LBSPPA2048_LBSPPB128_LPA0_MIWT8_2_PLR1_SU32_SUM0_SUS256_VWA4_VWB1_WGM8_WGMXCC1_WGMXCCGn1
    SolutionIndex: 43
    SolutionNameMin: Cijk_Ailk_Bljk_HHS_BH_UserArgs_MT256x64x32_MI16x16x1_SN_LDSB1_CLR1_GSU0_GSUC0_GSUWGMRR0_K1_LBSPPA2048_LBSPPB128_LPA0_MIWT8_2_PLR1_SU32_SUM0_SUS256_VWA8_VWB1_WGM8_WGMXCC1_WGMXCCGn1
    SolutionIndex: 44
    SolutionNameMin: Cijk_Ailk_Bljk_HHS_BH_UserArgs_MT256x64x32_MI16x16x1_SN_LDSB1_CLR1_GSU0_GSUC0_GSUWGMRR0_K1_LBSPPA2048_LBSPPB128_LPA0_MIWT8_2_PLR1_SU32_SUM0_SUS256_VWA4_VWB2_WGM8_WGMXCC1_WGMXCCGn1
    SolutionIndex: 45
    SolutionNameMin: Cijk_Ailk_Bljk_HHS_BH_UserArgs_MT256x64x32_MI16x16x1_SN_LDSB1_CLR1_GSU0_GSUC0_GSUWGMRR0_K1_LBSPPA2048_LBSPPB128_LPA0_MIWT8_2_PLR1_SU32_SUM0_SUS256_VWA8_VWB2_WGM8_WGMXCC1_WGMXCCGn1
    SolutionIndex: 46
    SolutionNameMin: Cijk_Ailk_Bljk_HHS_BH_UserArgs_MT128x128x32_MI16x16x1_SN_LDSB1_CLR1_GSU0_GSUC0_GSUWGMRR0_K1_LBSPPA1024_LBSPPB128_LPA32_MIWT4_4_PLR1_SU32_SUM0_SUS256_VWA2_VWB1_WGM1_WGMXCC1_WGMXCCGn1
    SolutionIndex: 47
    SolutionNameMin: Cijk_Ailk_Bljk_HHS_BH_UserArgs_MT128x128x32_MI16x16x1_SN_LDSB1_CLR1_GSU0_GSUC0_GSUWGMRR0_K1_LBSPPA1024_LBSPPB256_LPA32_MIWT4_4_PLR1_SU32_SUM0_SUS256_VWA2_VWB4_WGM1_WGMXCC1_WGMXCCGn1
    SolutionIndex: 48
    SolutionNameMin: Cijk_Ailk_Bljk_HHS_BH_UserArgs_MT128x128x32_MI16x16x1_SN_LDSB1_CLR1_GSU0_GSUC0_GSUWGMRR0_K1_LBSPPA1024_LBSPPB128_LPA32_MIWT4_4_PLR1_SU32_SUM0_SUS256_VWA2_VWB1_WGM4_WGMXCC1_WGMXCCGn1
    SolutionIndex: 49
    SolutionNameMin: Cijk_Ailk_Bljk_HHS_BH_UserArgs_MT128x128x32_MI16x16x1_SN_LDSB1_CLR1_GSU0_GSUC0_GSUWGMRR0_K1_LBSPPA1024_LBSPPB128_LPA32_MIWT4_4_PLR1_SU32_SUM0_SUS256_VWA2_VWB2_WGM4_WGMXCC1_WGMXCCGn1
    SolutionIndex: 50
    SolutionNameMin: Cijk_Ailk_Bljk_HHS_BH_UserArgs_MT128x128x32_MI16x16x1_SN_LDSB1_CLR1_GSU0_GSUC0_GSUWGMRR0_K1_LBSPPA1024_LBSPPB256_LPA32_MIWT4_4_PLR1_SU32_SUM0_SUS256_VWA2_VWB4_WGM4_WGMXCC1_WGMXCCGn1
    SolutionIndex: 51
    SolutionNameMin: Cijk_Ailk_Bljk_HHS_BH_UserArgs_MT128x64x32_MI16x16x1_SN_LDSB0_CLR1_GSU0_GSUC0_GSUWGMRR0_K1_LBSPPA1024_LBSPPB128_LPA32_MIWT4_2_PLR1_SU32_SUM0_SUS256_VWA2_VWB1_WGM1_WGMXCC1_WGMXCCGn1
    SolutionIndex: 52
    SolutionNameMin: Cijk_Ailk_Bljk_HHS_BH_UserArgs_MT128x64x32_MI16x16x1_SN_LDSB0_CLR1_GSU0_GSUC0_GSUWGMRR0_K1_LBSPPA1024_LBSPPB128_LPA0_MIWT4_2_PLR1_SU32_SUM0_SUS256_VWA4_VWB1_WGM1_WGMXCC1_WGMXCCGn1
    SolutionIndex: 53
    SolutionNameMin: Cijk_Ailk_Bljk_HHS_BH_UserArgs_MT128x64x32_MI16x16x1_SN_LDSB0_CLR1_GSU0_GSUC0_GSUWGMRR0_K1_LBSPPA1024_LBSPPB128_LPA32_MIWT4_2_PLR1_SU32_SUM0_SUS256_VWA2_VWB2_WGM1_WGMXCC1_WGMXCCGn1
    SolutionIndex: 54
    SolutionNameMin: Cijk_Ailk_Bljk_HHS_BH_UserArgs_MT128x64x32_MI16x16x1_SN_LDSB0_CLR0_GSU0_GSUC0_GSUWGMRR0_K1_LBSPPA1024_LBSPPB128_LPA0_MIWT4_2_PLR0_SU32_SUM0_SUS256_VWA4_VWB1_WGM1_WGMXCC1_WGMXCCGn1
    SolutionIndex: 55
    SolutionNameMin: Cijk_Ailk_Bljk_HHS_BH_UserArgs_MT128x64x32_MI16x16x1_SN_LDSB0_CLR1_GSU0_GSUC0_GSUWGMRR0_K1_LBSPPA1024_LBSPPB128_LPA0_MIWT4_2_PLR1_SU32_SUM0_SUS256_VWA4_VWB2_WGM4_WGMXCC1_WGMXCCGn1
    SolutionIndex: 56
    SolutionNameMin: Cijk_Ailk_Bljk_HHS_BH_UserArgs_MT128x64x32_MI16x16x1_SN_LDSB0_CLR0_GSU0_GSUC0_GSUWGMRR0_K1_LBSPPA1024_LBSPPB128_LPA0_MIWT4_2_PLR0_SU32_SUM0_SUS256_VWA4_VWB2_WGM4_WGMXCC1_WGMXCCGn1
    SolutionIndex: 57
    SolutionNameMin: Cijk_Ailk_Bljk_HHS_BH_UserArgs_MT128x64x32_MI16x16x1_SN_LDSB0_CLR1_GSU0_GSUC0_GSUWGMRR0_K1_LBSPPA1024_LBSPPB128_LPA0_MIWT4_2_PLR1_SU32_SUM0_SUS256_VWA4_VWB2_WGM8_WGMXCC1_WGMXCCGn1
    SolutionIndex: 58
    SolutionNameMin: Cijk_Ailk_Bljk_HHS_BH_UserArgs_MT64x64x32_MI16x16x1_SN_LDSB0_CLR1_GSU0_GSUC0_GSUWGMRR0_K1_LBSPPA512_LBSPPB128_LPA32_MIWT2_2_PLR1_SU32_SUM0_SUS256_VWA2_VWB2_WGM1_WGMXCC1_WGMXCCGn1
    SolutionIndex: 59
    SolutionNameMin: Cijk_Ailk_Bljk_HHS_BH_UserArgs_MT32x32x32_MI16x16x1_SN_LDSB0_CLR1_GSU0_GSUC0_GSUWGMRR0_K1_LBSPPA256_LBSPPB128_LPA16_MIWT1_1_PLR1_SU32_SUM0_SUS256_VWA1_VWB1_WGM1_WGMXCC1_WGMXCCGn1
    SolutionIndex: 60
    SolutionNameMin: Cijk_Ailk_Bljk_HHS_BH_UserArgs_MT32x32x32_MI16x16x1_SN_LDSB0_CLR0_GSU0_GSUC0_GSUWGMRR0_K1_LBSPPA256_LBSPPB128_LPA16_MIWT1_1_PLR0_SU32_SUM0_SUS256_VWA1_VWB1_WGM1_WGMXCC1_WGMXCCGn1
    SolutionIndex: 61
    SolutionNameMin: Cijk_Ailk_Bljk_HHS_BH_UserArgs_MT128x256x64_MI16x16x1_SN_LDSB1_CLR1_GSU0_GSUC0_GSUWGMRR0_K1_LBSPPA2048_LBSPPB256_LPA32_MIWT4_8_PLR1_SU32_SUM0_SUS256_VWA2_VWB2_WGM1_WGMXCC1_WGMXCCGn1
    SolutionIndex: 62
    SolutionNameMin: Cijk_Ailk_Bljk_HHS_BH_UserArgs_MT128x256x64_MI16x16x1_SN_LDSB1_CLR1_GSU0_GSUC0_GSUWGMRR0_K1_LBSPPA2048_LBSPPB256_LPA0_MIWT4_8_PLR1_SU32_SUM0_SUS256_VWA4_VWB2_WGM1_WGMXCC1_WGMXCCGn1
    SolutionIndex: 63
    SolutionNameMin: Cijk_Ailk_Bljk_HHS_BH_UserArgs_MT128x256x64_MI16x16x1_SN_LDSB1_CLR1_GSU0_GSUC0_GSUWGMRR0_K1_LBSPPA2048_LBSPPB1024_LPA0_MIWT4_8_PLR1_SU32_SUM0_SUS256_VWA4_VWB8_WGM1_WGMXCC1_WGMXCCGn1
    SolutionIndex: 64
    SolutionNameMin: Cijk_Ailk_Bljk_HHS_BH_UserArgs_MT128x256x64_MI16x16x1_SN_LDSB1_CLR1_GSU0_GSUC0_GSUWGMRR0_K1_LBSPPA2048_LBSPPB256_LPA0_MIWT4_8_PLR1_SU32_SUM0_SUS256_VWA4_VWB2_WGM8_WGMXCC1_WGMXCCGn1
    SolutionIndex: 65
    SolutionNameMin: Cijk_Ailk_Bljk_HHS_BH_UserArgs_MT128x256x64_MI16x16x1_SN_LDSB1_CLR1_GSU0_GSUC0_GSUWGMRR0_K1_LBSPPA2048_LBSPPB512_LPA0_MIWT4_8_PLR1_SU32_SUM0_SUS256_VWA4_VWB4_WGM8_WGMXCC1_WGMXCCGn1
    SolutionIndex: 66
    SolutionNameMin: Cijk_Ailk_Bljk_HHS_BH_UserArgs_MT128x256x64_MI16x16x1_SN_LDSB1_CLR1_GSU0_GSUC0_GSUWGMRR0_K1_LBSPPA2048_LBSPPB1024_LPA0_MIWT4_8_PLR1_SU32_SUM0_SUS256_VWA4_VWB8_WGM8_WGMXCC1_WGMXCCGn1
    SolutionIndex: 67
    SolutionNameMin: Cijk_Ailk_Bljk_HHS_BH_UserArgs_MT256x128x64_MI16x16x1_SN_LDSB1_CLR1_GSU0_GSUC0_GSUWGMRR0_K1_LBSPPA4096_LBSPPB128_LPA32_MIWT8_4_PLR1_SU32_SUM0_SUS256_VWA2_VWB1_WGM1_WGMXCC1_WGMXCCGn1
    SolutionIndex: 68
    SolutionNameMin: Cijk_Ailk_Bljk_HHS_BH_UserArgs_MT256x128x64_MI16x16x1_SN_LDSB1_CLR1_GSU0_GSUC0_GSUWGMRR0_K1_LBSPPA4096_LBSPPB512_LPA32_MIWT8_4_PLR1_SU32_SUM0_SUS256_VWA2_VWB4_WGM1_WGMXCC1_WGMXCCGn1
    SolutionIndex: 69
    SolutionNameMin: Cijk_Ailk_Bljk_HHS_BH_UserArgs_MT256x128x64_MI16x16x1_SN_LDSB1_CLR1_GSU0_GSUC0_GSUWGMRR0_K1_LBSPPA4096_LBSPPB512_LPA0_MIWT8_4_PLR1_SU32_SUM0_SUS256_VWA4_VWB4_WGM1_WGMXCC1_WGMXCCGn1
    SolutionIndex: 70
    SolutionNameMin: Cijk_Ailk_Bljk_HHS_BH_UserArgs_MT256x128x64_MI16x16x1_SN_LDSB1_CLR1_GSU0_GSUC0_GSUWGMRR0_K1_LBSPPA4096_LBSPPB128_LPA32_MIWT8_4_PLR1_SU32_SUM0_SUS256_VWA2_VWB1_WGM4_WGMXCC1_WGMXCCGn1
    SolutionIndex: 71
    SolutionNameMin: Cijk_Ailk_Bljk_HHS_BH_UserArgs_MT256x128x64_MI16x16x1_SN_LDSB1_CLR1_GSU0_GSUC0_GSUWGMRR0_K1_LBSPPA4096_LBSPPB128_LPA0_MIWT8_4_PLR1_SU32_SUM0_SUS256_VWA4_VWB1_WGM4_WGMXCC1_WGMXCCGn1
    SolutionIndex: 72
    SolutionNameMin: Cijk_Ailk_Bljk_HHS_BH_UserArgs_MT256x128x64_MI16x16x1_SN_LDSB1_CLR1_GSU0_GSUC0_GSUWGMRR0_K1_LBSPPA4096_LBSPPB512_LPA0_MIWT8_4_PLR1_SU32_SUM0_SUS256_VWA4_VWB4_WGM4_WGMXCC1_WGMXCCGn1
    SolutionIndex: 73
    SolutionNameMin: Cijk_Ailk_Bljk_HHS_BH_UserArgs_MT256x128x64_MI16x16x1_SN_LDSB1_CLR1_GSU0_GSUC0_GSUWGMRR0_K1_LBSPPA4096_LBSPPB512_LPA0_MIWT8_4_PLR1_SU32_SUM0_SUS256_VWA4_VWB4_WGM8_WGMXCC1_WGMXCCGn1
    SolutionIndex: 74
    SolutionNameMin: Cijk_Ailk_Bljk_HHS_BH_UserArgs_MT128x128x64_MI16x16x1_SN_LDSB1_CLR1_GSU0_GSUC0_GSUWGMRR0_K1_LBSPPA2048_LBSPPB128_LPA0_MIWT4_4_PLR1_SU32_SUM0_SUS256_VWA4_VWB1_WGM1_WGMXCC1_WGMXCCGn1
    SolutionIndex: 75
    SolutionNameMin: Cijk_Ailk_Bljk_HHS_BH_UserArgs_MT128x128x64_MI16x16x1_SN_LDSB1_CLR1_GSU0_GSUC0_GSUWGMRR0_K1_LBSPPA2048_LBSPPB256_LPA0_MIWT4_4_PLR1_SU32_SUM0_SUS256_VWA4_VWB2_WGM1_WGMXCC1_WGMXCCGn1
    SolutionIndex: 76
    SolutionNameMin: Cijk_Ailk_Bljk_HHS_BH_UserArgs_MT128x128x64_MI16x16x1_SN_LDSB1_CLR1_GSU0_GSUC0_GSUWGMRR0_K1_LBSPPA2048_LBSPPB512_LPA0_MIWT4_4_PLR1_SU32_SUM0_SUS256_VWA4_VWB4_WGM1_WGMXCC1_WGMXCCGn1
    SolutionIndex: 77
    SolutionNameMin: Cijk_Ailk_Bljk_HHS_BH_UserArgs_MT128x128x64_MI16x16x1_SN_LDSB1_CLR1_GSU0_GSUC0_GSUWGMRR0_K1_LBSPPA2048_LBSPPB256_LPA0_MIWT4_4_PLR1_SU32_SUM0_SUS256_VWA4_VWB2_WGM4_WGMXCC1_WGMXCCGn1
    SolutionIndex: 78
    SolutionNameMin: Cijk_Ailk_Bljk_HHS_BH_UserArgs_MT128x128x64_MI16x16x1_SN_LDSB1_CLR1_GSU0_GSUC0_GSUWGMRR0_K1_LBSPPA2048_LBSPPB512_LPA0_MIWT4_4_PLR1_SU32_SUM0_SUS256_VWA4_VWB4_WGM4_WGMXCC1_WGMXCCGn1
    SolutionIndex: 79
    SolutionNameMin: Cijk_Ailk_Bljk_HHS_BH_UserArgs_MT128x128x64_MI16x16x1_SN_LDSB1_CLR1_GSU0_GSUC0_GSUWGMRR0_K1_LBSPPA2048_LBSPPB512_LPA0_MIWT4_4_PLR1_SU32_SUM0_SUS256_VWA4_VWB4_WGM8_WGMXCC1_WGMXCCGn1
    SolutionIndex: 80
    SolutionNameMin: Cijk_Ailk_Bljk_HHS_BH_UserArgs_MT64x128x64_MI16x16x1_SN_LDSB1_CLR1_GSU0_GSUC0_GSUWGMRR0_K1_LBSPPA1024_LBSPPB512_LPA32_MIWT2_4_PLR1_SU32_SUM0_SUS256_VWA2_VWB4_WGM1_WGMXCC1_WGMXCCGn1
    SolutionIndex: 81
    SolutionNameMin: Cijk_Ailk_Bljk_HHS_BH_UserArgs_MT64x128x64_MI16x16x1_SN_LDSB1_CLR1_GSU0_GSUC0_GSUWGMRR0_K1_LBSPPA1024_LBSPPB256_LPA32_MIWT2_4_PLR1_SU32_SUM0_SUS256_VWA2_VWB2_WGM8_WGMXCC1_WGMXCCGn1
    SolutionIndex: 82
    SolutionNameMin: Cijk_Ailk_Bljk_HHS_BH_UserArgs_MT128x64x64_MI16x16x1_SN_LDSB1_CLR1_GSU0_GSUC0_GSUWGMRR0_K1_LBSPPA2048_LBSPPB128_LPA0_MIWT4_2_PLR1_SU32_SUM0_SUS256_VWA4_VWB1_WGM1_WGMXCC1_WGMXCCGn1
    SolutionIndex: 83
    SolutionNameMin: Cijk_Ailk_Bljk_HHS_BH_UserArgs_MT128x64x64_MI16x16x1_SN_LDSB1_CLR1_GSU0_GSUC0_GSUWGMRR0_K1_LBSPPA2048_LBSPPB256_LPA0_MIWT4_2_PLR1_SU32_SUM0_SUS256_VWA4_VWB2_WGM1_WGMXCC1_WGMXCCGn1
    SolutionIndex: 84
    SolutionNameMin: Cijk_Ailk_Bljk_HHS_BH_UserArgs_MT128x64x64_MI16x16x1_SN_LDSB1_CLR1_GSU0_GSUC0_GSUWGMRR0_K1_LBSPPA2048_LBSPPB128_LPA0_MIWT4_2_PLR2_SU32_SUM0_SUS256_VWA4_VWB1_WGM1_WGMXCC1_WGMXCCGn1
    SolutionIndex: 85
    SolutionNameMin: Cijk_Ailk_Bljk_HHS_BH_UserArgs_MT128x64x64_MI16x16x1_SN_LDSB1_CLR1_GSU0_GSUC0_GSUWGMRR0_K1_LBSPPA2048_LBSPPB128_LPA0_MIWT4_2_PLR1_SU32_SUM0_SUS256_VWA4_VWB1_WGM4_WGMXCC1_WGMXCCGn1
    SolutionIndex: 86
    SolutionNameMin: Cijk_Ailk_Bljk_HHS_BH_UserArgs_MT128x64x64_MI16x16x1_SN_LDSB1_CLR1_GSU0_GSUC0_GSUWGMRR0_K1_LBSPPA2048_LBSPPB256_LPA0_MIWT4_2_PLR1_SU32_SUM0_SUS256_VWA4_VWB2_WGM4_WGMXCC1_WGMXCCGn1
    SolutionIndex: 87
    SolutionNameMin: Cijk_Ailk_Bljk_HHS_BH_UserArgs_MT128x64x64_MI16x16x1_SN_LDSB1_CLR1_GSU0_GSUC0_GSUWGMRR0_K1_LBSPPA2048_LBSPPB128_LPA0_MIWT4_2_PLR1_SU32_SUM0_SUS256_VWA4_VWB1_WGM8_WGMXCC1_WGMXCCGn1
    SolutionIndex: 88
    SolutionNameMin: Cijk_Ailk_Bljk_HHS_BH_UserArgs_MT128x64x64_MI16x16x1_SN_LDSB1_CLR1_GSU0_GSUC0_GSUWGMRR0_K1_LBSPPA2048_LBSPPB256_LPA0_MIWT4_2_PLR1_SU32_SUM0_SUS256_VWA4_VWB2_WGM8_WGMXCC1_WGMXCCGn1
    SolutionIndex: 89
    SolutionNameMin: Cijk_Ailk_Bljk_HHS_BH_UserArgs_MT64x64x64_MI16x16x1_SN_LDSB1_CLR1_GSU0_GSUC0_GSUWGMRR0_K1_LBSPPA1024_LBSPPB128_LPA32_MIWT2_2_PLR1_SU32_SUM0_SUS256_VWA2_VWB1_WGM1_WGMXCC1_WGMXCCGn1
    SolutionIndex: 90
    SolutionNameMin: Cijk_Ailk_Bljk_HHS_BH_UserArgs_MT64x64x64_MI16x16x1_SN_LDSB1_CLR1_GSU0_GSUC0_GSUWGMRR0_K1_LBSPPA1024_LBSPPB256_LPA32_MIWT2_2_PLR1_SU32_SUM0_SUS256_VWA2_VWB2_WGM1_WGMXCC1_WGMXCCGn1
    SolutionIndex: 91
    SolutionNameMin: Cijk_Ailk_Bljk_HHS_BH_UserArgs_MT64x64x64_MI16x16x1_SN_LDSB1_CLR1_GSU0_GSUC0_GSUWGMRR0_K1_LBSPPA1024_LBSPPB256_LPA32_MIWT2_2_PLR2_SU32_SUM0_SUS256_VWA2_VWB2_WGM1_WGMXCC1_WGMXCCGn1
    SolutionIndex: 92
    SolutionNameMin: Cijk_Ailk_Bljk_HHS_BH_UserArgs_MT64x64x64_MI16x16x1_SN_LDSB1_CLR1_GSU0_GSUC0_GSUWGMRR0_K1_LBSPPA1024_LBSPPB128_LPA32_MIWT2_2_PLR1_SU32_SUM0_SUS256_VWA2_VWB1_WGM4_WGMXCC1_WGMXCCGn1
    SolutionIndex: 93
    SolutionNameMin: Cijk_Ailk_Bljk_HHS_BH_UserArgs_MT64x64x64_MI16x16x1_SN_LDSB1_CLR1_GSU0_GSUC0_GSUWGMRR0_K1_LBSPPA1024_LBSPPB128_LPA32_MIWT2_2_PLR1_SU32_SUM0_SUS256_VWA2_VWB1_WGM8_WGMXCC1_WGMXCCGn1
    SolutionIndex: 94
    SolutionNameMin: Cijk_Ailk_Bljk_HHS_BH_UserArgs_MT64x64x64_MI16x16x1_SN_LDSB1_CLR1_GSU0_GSUC0_GSUWGMRR0_K1_LBSPPA1024_LBSPPB256_LPA32_MIWT2_2_PLR1_SU32_SUM0_SUS256_VWA2_VWB2_WGM8_WGMXCC1_WGMXCCGn1
    SolutionIndex: 95
    SolutionNameMin: Cijk_Ailk_Bljk_HHS_BH_UserArgs_MT64x32x64_MI16x16x1_SN_LDSB0_CLR1_GSU0_GSUC0_GSUWGMRR0_K1_LBSPPA1024_LBSPPB128_LPA32_MIWT2_1_PLR1_SU32_SUM0_SUS256_VWA2_VWB1_WGM1_WGMXCC1_WGMXCCGn1
    SolutionIndex: 96
    SolutionNameMin: Cijk_Ailk_Bljk_HHS_BH_UserArgs_MT64x32x64_MI16x16x1_SN_LDSB0_CLR1_GSU0_GSUC0_GSUWGMRR0_K1_LBSPPA1024_LBSPPB128_LPA32_MIWT2_1_PLR2_SU32_SUM0_SUS256_VWA2_VWB1_WGM1_WGMXCC1_WGMXCCGn1
    SolutionIndex: 97
    SolutionNameMin: Cijk_Ailk_Bljk_HHS_BH_UserArgs_MT64x32x64_MI16x16x1_SN_LDSB0_CLR1_GSU0_GSUC0_GSUWGMRR0_K1_LBSPPA1024_LBSPPB128_LPA32_MIWT2_1_PLR1_SU32_SUM0_SUS256_VWA2_VWB1_WGM4_WGMXCC1_WGMXCCGn1
    SolutionIndex: 98
    SolutionNameMin: Cijk_Ailk_Bljk_HHS_BH_UserArgs_MT128x64x128_MI16x16x1_SN_LDSB1_CLR1_GSU0_GSUC0_GSUWGMRR0_K1_LBSPPA2048_LBSPPB256_LPA0_MIWT4_2_PLR1_SU32_SUM0_SUS256_VWA4_VWB1_WGM1_WGMXCC1_WGMXCCGn1
    SolutionIndex: 99
    SolutionNameMin: Cijk_Ailk_Bljk_HHS_BH_UserArgs_MT128x64x128_MI16x16x1_SN_LDSB1_CLR1_GSU0_GSUC0_GSUWGMRR0_K1_LBSPPA2048_LBSPPB256_LPA0_MIWT4_2_PLR2_SU32_SUM0_SUS256_VWA4_VWB1_WGM1_WGMXCC1_WGMXCCGn1
    SolutionIndex: 100
    SolutionNameMin: Cijk_Ailk_Bljk_HHS_BH_UserArgs_MT128x64x128_MI16x16x1_SN_LDSB1_CLR1_GSU0_GSUC0_GSUWGMRR0_K1_LBSPPA2048_LBSPPB512_LPA0_MIWT4_2_PLR2_SU32_SUM0_SUS256_VWA4_VWB2_WGM1_WGMXCC1_WGMXCCGn1
    SolutionIndex: 101
    SolutionNameMin: Cijk_Ailk_Bljk_HHS_BH_UserArgs_MT128x64x128_MI16x16x1_SN_LDSB1_CLR1_GSU0_GSUC0_GSUWGMRR0_K1_LBSPPA2048_LBSPPB256_LPA0_MIWT4_2_PLR1_SU32_SUM0_SUS256_VWA4_VWB1_WGM4_WGMXCC1_WGMXCCGn1
    SolutionIndex: 102
    SolutionNameMin: Cijk_Ailk_Bljk_HHS_BH_UserArgs_MT128x64x128_MI16x16x1_SN_LDSB1_CLR1_GSU0_GSUC0_GSUWGMRR0_K1_LBSPPA2048_LBSPPB512_LPA0_MIWT4_2_PLR2_SU32_SUM0_SUS256_VWA4_VWB2_WGM4_WGMXCC1_WGMXCCGn1
    SolutionIndex: 103
    SolutionNameMin: Cijk_Ailk_Bljk_HHS_BH_UserArgs_MT128x64x128_MI16x16x1_SN_LDSB1_CLR1_GSU0_GSUC0_GSUWGMRR0_K1_LBSPPA2048_LBSPPB512_LPA0_MIWT4_2_PLR2_SU32_SUM0_SUS256_VWA4_VWB2_WGM8_WGMXCC1_WGMXCCGn1
    SolutionIndex: 104
    SolutionNameMin: Cijk_Ailk_Bljk_HHS_BH_UserArgs_MT128x32x128_MI16x16x1_SN_LDSB1_CLR1_GSU0_GSUC0_GSUWGMRR0_K1_LBSPPA2048_LBSPPB256_LPA0_MIWT4_1_PLR2_SU32_SUM0_SUS256_VWA4_VWB1_WGM1_WGMXCC1_WGMXCCGn1
    SolutionIndex: 105
    SolutionNameMin: Cijk_Ailk_Bljk_HHS_BH_UserArgs_MT64x64x128_MI16x16x1_SN_LDSB1_CLR1_GSU0_GSUC0_GSUWGMRR0_K1_LBSPPA1024_LBSPPB256_LPA32_MIWT2_2_PLR2_SU32_SUM0_SUS256_VWA2_VWB1_WGM1_WGMXCC1_WGMXCCGn1
    SolutionIndex: 106
    SolutionNameMin: Cijk_Ailk_Bljk_HHS_BH_UserArgs_MT64x64x128_MI16x16x1_SN_LDSB1_CLR1_GSU0_GSUC0_GSUWGMRR0_K1_LBSPPA1024_LBSPPB512_LPA32_MIWT2_2_PLR2_SU32_SUM0_SUS256_VWA2_VWB2_WGM1_WGMXCC1_WGMXCCGn1
    SolutionIndex: 107
    SolutionNameMin: Cijk_Ailk_Bljk_HHS_BH_UserArgs_MT64x32x128_MI16x16x1_SN_LDSB1_CLR1_GSU0_GSUC0_GSUWGMRR0_K1_LBSPPA1024_LBSPPB256_LPA32_MIWT2_1_PLR1_SU32_SUM0_SUS256_VWA2_VWB1_WGM1_WGMXCC1_WGMXCCGn1
    SolutionIndex: 108
    SolutionNameMin: Cijk_Ailk_Bljk_HHS_BH_UserArgs_MT64x32x128_MI16x16x1_SN_LDSB1_CLR1_GSU0_GSUC0_GSUWGMRR0_K1_LBSPPA1024_LBSPPB256_LPA32_MIWT2_1_PLR2_SU32_SUM0_SUS256_VWA2_VWB1_WGM1_WGMXCC1_WGMXCCGn1
    SolutionIndex: 109
    SolutionNameMin: Cijk_Ailk_Bljk_HHS_BH_UserArgs_MT64x32x128_MI16x16x1_SN_LDSB1_CLR1_GSU0_GSUC0_GSUWGMRR0_K1_LBSPPA1024_LBSPPB256_LPA32_MIWT2_1_PLR2_SU32_SUM0_SUS256_VWA2_VWB1_WGM4_WGMXCC1_WGMXCCGn1
    SolutionIndex: 110
    SolutionNameMin: Cijk_Ailk_Bljk_HHS_BH_UserArgs_MT64x32x128_MI16x16x1_SN_LDSB1_CLR1_GSU0_GSUC0_GSUWGMRR0_K1_LBSPPA1024_LBSPPB256_LPA32_MIWT2_1_PLR2_SU32_SUM0_SUS256_VWA2_VWB1_WGM8_WGMXCC1_WGMXCCGn1
    SolutionIndex: 111
    SolutionNameMin: Cijk_Ailk_Bljk_HHS_BH_UserArgs_MT32x32x128_MI16x16x1_SN_LDSB1_CLR1_GSU0_GSUC0_GSUWGMRR0_K1_LBSPPA512_LBSPPB256_LPA16_MIWT1_1_PLR1_SU32_SUM0_SUS256_VWA1_VWB1_WGM1_WGMXCC1_WGMXCCGn1
    SolutionIndex: 112
    SolutionNameMin: Cijk_Ailk_Bljk_HHS_BH_UserArgs_MT32x32x128_MI16x16x1_SN_LDSB1_CLR1_GSU0_GSUC0_GSUWGMRR0_K1_LBSPPA512_LBSPPB256_LPA16_MIWT1_1_PLR2_SU32_SUM0_SUS256_VWA1_VWB1_WGM1_WGMXCC1_WGMXCCGn1
    SolutionIndex: 113
    SolutionNameMin: Cijk_Ailk_Bljk_HHS_BH_UserArgs_MT32x32x128_MI16x16x1_SN_LDSB1_CLR1_GSU0_GSUC0_GSUWGMRR0_K1_LBSPPA512_LBSPPB256_LPA16_MIWT1_1_PLR1_SU32_SUM0_SUS256_VWA1_VWB1_WGM4_WGMXCC1_WGMXCCGn1
    SolutionIndex: 114
    SolutionNameMin: Cijk_Ailk_Bljk_HHS_BH_UserArgs_MT32x32x32_MI16x16x1_SN_LDSB0_CLR1_GSU0_GSUC0_GSUWGMRR0_K1_LBSPPA256_LBSPPB128_LPA16_MIWT1_1_PLR1_SU32_SUM0_SUS256_VWA1_VWB1_WGM1_WGMXCC1_WGMXCCGn1
- - - [128, 128, 1, 128, 128, 128, 128, 128]
    - [98, 0.071]
  - - [128, 128, 1, 256, 128, 128, 128, 256]
    - [104, 0.107]
  - - [128, 128, 1, 512, 128, 128, 128, 512]
    - [111, 0.175]
  - - [128, 128, 1, 1024, 128, 128, 128, 1024]
    - [111, 0.308]
  - - [128, 128, 1, 2048, 128, 128, 128, 2048]
    - [59, 0.516]
  - - [128, 128, 1, 4096, 128, 128, 128, 4096]
    - [95, 0.808]
  - - [128, 128, 1, 8192, 128, 128, 128, 8192]
    - [109, 1.255]
  - - [128, 256, 1, 128, 128, 128, 128, 128]
    - [110, 0.16]
  - - [128, 256, 1, 256, 128, 128, 128, 256]
    - [111, 0.239]
  - - [128, 256, 1, 512, 128, 128, 128, 512]
    - [112, 0.331]
  - - [128, 256, 1, 1024, 128, 128, 128, 1024]
    - [111, 0.583]
  - - [128, 256, 1, 2048, 128, 128, 128, 2048]
    - [108, 0.89]
  - - [128, 256, 1, 4096, 128, 128, 128, 4096]
    - [95, 1.396]
  - - [128, 256, 1, 8192, 128, 128, 128, 8192]
    - [108, 1.964]
  - - [128, 512, 1, 128, 128, 128, 128, 128]
    - [108, 0.323]
  - - [128, 512, 1, 256, 128, 128, 128, 256]
    - [111, 0.505]
  - - [128, 512, 1, 512, 128, 128, 128, 512]
    - [112, 0.799]
  - - [128, 512, 1, 1024, 128, 128, 128, 1024]
    - [112, 1.115]
  - - [128, 512, 1, 2048, 128, 128, 128, 2048]
    - [108, 1.524]
  - - [128, 512, 1, 4096, 128, 128, 128, 4096]
    - [94, 2.313]
  - - [128, 512, 1, 8192, 128, 128, 128, 8192]
    - [83, 2.738]
  - - [128, 1024, 1, 128, 128, 128, 128, 128]
    - [105, 0.593]
  - - [128, 1024, 1, 256, 128, 128, 128, 256]
    - [97, 0.953]
  - - [128, 1024, 1, 512, 128, 128, 128, 512]
    - [108, 1.436]
  - - [128, 1024, 1, 1024, 128, 128, 128, 1024]
    - [108, 1.989]
  - - [128, 1024, 1, 2048, 128, 128, 128, 2048]
    - [56, 2.263]
  - - [128, 1024, 1, 4096, 128, 128, 128, 4096]
    - [83, 3.527]
  - - [128, 1024, 1, 8192, 128, 128, 128, 8192]
    - [101, 3.603]
  - - [128, 2048, 1, 128, 128, 128, 128, 128]
    - [58, 1.023]
  - - [128, 2048, 1, 256, 128, 128, 128, 256]
    - [91, 1.665]
  - - [128, 2048, 1, 512, 128, 128, 128, 512]
    - [90, 2.408]
  - - [128, 2048, 1, 1024, 128, 128, 128, 1024]
    - [86, 2.583]
  - - [128, 2048, 1, 2048, 128, 128, 128, 2048]
    - [83, 2.986]
  - - [128, 2048, 1, 4096, 128, 128, 128, 4096]
    - [82, 3.941]
  - - [128, 2048, 1, 8192, 128, 128, 128, 8192]
    - [78, 4.394]
  - - [128, 4096, 1, 128, 128, 128, 128, 128]
    - [51, 1.662]
  - - [128, 4096, 1, 256, 128, 128, 128, 256]
    - [81, 2.483]
  - - [128, 4096, 1, 512, 128, 128, 128, 512]
    - [83, 3.416]
  - - [128, 4096, 1, 1024, 128, 128, 128, 1024]
    - [100, 3.678]
  - - [128, 4096, 1, 2048, 128, 128, 128, 2048]
    - [92, 3.607]
  - - [128, 4096, 1, 4096, 128, 128, 128, 4096]
    - [83, 4.594]
  - - [128, 4096, 1, 8192, 128, 128, 128, 8192]
    - [78, 5.265]
  - - [128, 8192, 1, 128, 128, 128, 128, 128]
    - [49, 2.117]
  - - [128, 8192, 1, 256, 128, 128, 128, 256]
    - [47, 2.857]
  - - [128, 8192, 1, 512, 128, 128, 128, 512]
    - [78, 3.883]
  - - [128, 8192, 1, 1024, 128, 128, 128, 1024]
    - [93, 4.154]
  - - [128, 8192, 1, 2048, 128, 128, 128, 2048]
    - [86, 4.715]
  - - [128, 8192, 1, 4096, 128, 128, 128, 4096]
    - [83, 5.496]
  - - [128, 8192, 1, 8192, 128, 128, 128, 8192]
    - [64, 5.894]
  - - [256, 128, 1, 128, 256, 256, 256, 128]
    - [113, 0.165]
  - - [256, 128, 1, 256, 256, 256, 256, 256]
    - [112, 0.242]
  - - [256, 128, 1, 512, 256, 256, 256, 512]
    - [111, 0.336]
  - - [256, 128, 1, 1024, 256, 256, 256, 1024]
    - [112, 0.574]
  - - [256, 128, 1, 2048, 256, 256, 256, 2048]
    - [108, 0.891]
  - - [256, 128, 1, 4096, 256, 256, 256, 4096]
    - [95, 1.404]
  - - [256, 128, 1, 8192, 256, 256, 256, 8192]
    - [108, 1.931]
  - - [256, 256, 1, 128, 256, 256, 256, 128]
    - [60, 0.313]
  - - [256, 256, 1, 256, 256, 256, 256, 256]
    - [113, 0.514]
  - - [256, 256, 1, 512, 256, 256, 256, 512]
    - [112, 0.774]
  - - [256, 256, 1, 1024, 256, 256, 256, 1024]
    - [112, 1.115]
  - - [256, 256, 1, 2048, 256, 256, 256, 2048]
    - [108, 1.463]
  - - [256, 256, 1, 4096, 256, 256, 256, 4096]
    - [90, 2.27]
  - - [256, 256, 1, 8192, 256, 256, 256, 8192]
    - [52, 2.833]
  - - [256, 512, 1, 128, 256, 256, 256, 128]
    - [105, 0.592]
  - - [256, 512, 1, 256, 256, 256, 256, 256]
    - [96, 0.95]
  - - [256, 512, 1, 512, 256, 256, 256, 512]
    - [108, 1.415]
  - - [256, 512, 1, 1024, 256, 256, 256, 1024]
    - [108, 1.988]
  - - [256, 512, 1, 2048, 256, 256, 256, 2048]
    - [55, 2.384]
  - - [256, 512, 1, 4096, 256, 256, 256, 4096]
    - [83, 3.556]
  - - [256, 512, 1, 8192, 256, 256, 256, 8192]
    - [39, 3.637]
  - - [256, 1024, 1, 128, 256, 256, 256, 128]
    - [89, 1.017]
  - - [256, 1024, 1, 256, 256, 256, 256, 256]
    - [89, 1.632]
  - - [256, 1024, 1, 512, 256, 256, 256, 512]
    - [90, 2.397]
  - - [256, 1024, 1, 1024, 256, 256, 256, 1024]
    - [87, 2.584]
  - - [256, 1024, 1, 2048, 256, 256, 256, 2048]
    - [36, 3.102]
  - - [256, 1024, 1, 4096, 256, 256, 256, 4096]
    - [83, 3.949]
  - - [256, 1024, 1, 8192, 256, 256, 256, 8192]
    - [27, 4.742]
  - - [256, 2048, 1, 128, 256, 256, 256, 128]
    - [80, 1.663]
  - - [256, 2048, 1, 256, 256, 256, 256, 256]
    - [82, 2.537]
  - - [256, 2048, 1, 512, 256, 256, 256, 512]
    - [82, 3.477]
  - - [256, 2048, 1, 1024, 256, 256, 256, 1024]
    - [100, 3.725]
  - - [256, 2048, 1, 2048, 256, 256, 256, 2048]
    - [31, 4.104]
  - - [256, 2048, 1, 4096, 256, 256, 256, 4096]
    - [86, 4.514]
  - - [256, 2048, 1, 8192, 256, 256, 256, 8192]
    - [25, 5.716]
  - - [256, 4096, 1, 128, 256, 256, 256, 128]
    - [36, 2.055]
  - - [256, 4096, 1, 256, 256, 256, 256, 256]
    - [35, 3.032]
  - - [256, 4096, 1, 512, 256, 256, 256, 512]
    - [74, 3.954]
  - - [256, 4096, 1, 1024, 256, 256, 256, 1024]
    - [89, 4.322]
  - - [256, 4096, 1, 2048, 256, 256, 256, 2048]
    - [90, 4.818]
  - - [256, 4096, 1, 4096, 256, 256, 256, 4096]
    - [14, 5.292]
  - - [256, 4096, 1, 8192, 256, 256, 256, 8192]
    - [73, 6.095]
  - - [256, 8192, 1, 128, 256, 256, 256, 128]
    - [24, 2.698]
  - - [256, 8192, 1, 256, 256, 256, 256, 256]
    - [15, 4.369]
  - - [256, 8192, 1, 512, 256, 256, 256, 512]
    - [68, 4.692]
  - - [256, 8192, 1, 1024, 256, 256, 256, 1024]
    - [83, 5.602]
  - - [256, 8192, 1, 2048, 256, 256, 256, 2048]
    - [87, 6.253]
  - - [256, 8192, 1, 4096, 256, 256, 256, 4096]
    - [36, 6.371]
  - - [256, 8192, 1, 8192, 256, 256, 256, 8192]
    - [25, 6.796]
  - - [512, 128, 1, 128, 512, 512, 512, 128]
    - [107, 0.324]
  - - [512, 128, 1, 256, 512, 512, 512, 256]
    - [111, 0.495]
  - - [512, 128, 1, 512, 512, 512, 512, 512]
    - [112, 0.791]
  - - [512, 128, 1, 1024, 512, 512, 512, 1024]
    - [112, 1.106]
  - - [512, 128, 1, 2048, 512, 512, 512, 2048]
    - [110, 1.48]
  - - [512, 128, 1, 4096, 512, 512, 512, 4096]
    - [90, 2.284]
  - - [512, 128, 1, 8192, 512, 512, 512, 8192]
    - [54, 2.811]
  - - [512, 256, 1, 128, 512, 512, 512, 128]
    - [108, 0.581]
  - - [512, 256, 1, 256, 512, 512, 512, 256]
    - [95, 0.962]
  - - [512, 256, 1, 512, 512, 512, 512, 512]
    - [108, 1.424]
  - - [512, 256, 1, 1024, 512, 512, 512, 1024]
    - [108, 1.972]
  - - [512, 256, 1, 2048, 512, 512, 512, 2048]
    - [57, 2.372]
  - - [512, 256, 1, 4096, 512, 512, 512, 4096]
    - [82, 3.552]
  - - [512, 256, 1, 8192, 512, 512, 512, 8192]
    - [39, 3.656]
  - - [512, 512, 1, 128, 512, 512, 512, 128]
    - [58, 1.046]
  - - [512, 512, 1, 256, 512, 512, 512, 256]
    - [90, 1.602]
  - - [512, 512, 1, 512, 512, 512, 512, 512]
    - [89, 2.413]
  - - [512, 512, 1, 1024, 512, 512, 512, 1024]
    - [82, 2.629]
  - - [512, 512, 1, 2048, 512, 512, 512, 2048]
    - [33, 3.093]
  - - [512, 512, 1, 4096, 512, 512, 512, 4096]
    - [83, 3.955]
  - - [512, 512, 1, 8192, 512, 512, 512, 8192]
    - [19, 4.891]
  - - [512, 1024, 1, 128, 512, 512, 512, 128]
    - [83, 1.675]
  - - [512, 1024, 1, 256, 512, 512, 512, 256]
    - [82, 2.566]
  - - [512, 1024, 1, 512, 512, 512, 512, 512]
    - [85, 3.586]
  - - [512, 1024, 1, 1024, 512, 512, 512, 1024]
    - [99, 3.753]
  - - [512, 1024, 1, 2048, 512, 512, 512, 2048]
    - [17, 4.179]
  - - [512, 1024, 1, 4096, 512, 512, 512, 4096]
    - [82, 4.638]
  - - [512, 1024, 1, 8192, 512, 512, 512, 8192]
    - [75, 5.249]
  - - [512, 2048, 1, 128, 512, 512, 512, 128]
    - [45, 2.264]
  - - [512, 2048, 1, 256, 512, 512, 512, 256]
    - [34, 3.189]
  - - [512, 2048, 1, 512, 512, 512, 512, 512]
    - [77, 3.98]
  - - [512, 2048, 1, 1024, 512, 512, 512, 1024]
    - [94, 4.406]
  - - [512, 2048, 1, 2048, 512, 512, 512, 2048]
    - [87, 4.87]
  - - [512, 2048, 1, 4096, 512, 512, 512, 4096]
    - [14, 5.224]
  - - [512, 2048, 1, 8192, 512, 512, 512, 8192]
    - [72, 5.573]
  - - [512, 4096, 1, 128, 512, 512, 512, 128]
    - [40, 2.742]
  - - [512, 4096, 1, 256, 512, 512, 512, 256]
    - [30, 4.296]
  - - [512, 4096, 1, 512, 512, 512, 512, 512]
    - [70, 4.814]
  - - [512, 4096, 1, 1024, 512, 512, 512, 1024]
    - [86, 5.664]
  - - [512, 4096, 1, 2048, 512, 512, 512, 2048]
    - [83, 6.315]
  - - [512, 4096, 1, 4096, 512, 512, 512, 4096]
    - [103, 5.622]
  - - [512, 4096, 1, 8192, 512, 512, 512, 8192]
    - [67, 5.979]
  - - [512, 8192, 1, 128, 512, 512, 512, 128]
    - [45, 3.52]
  - - [512, 8192, 1, 256, 512, 512, 512, 256]
    - [43, 4.742]
  - - [512, 8192, 1, 512, 512, 512, 512, 512]
    - [43, 5.911]
  - - [512, 8192, 1, 1024, 512, 512, 512, 1024]
    - [34, 6.993]
  - - [512, 8192, 1, 2048, 512, 512, 512, 2048]
    - [74, 7.019]
  - - [512, 8192, 1, 4096, 512, 512, 512, 4096]
    - [71, 6.576]
  - - [512, 8192, 1, 8192, 512, 512, 512, 8192]
    - [7, 7.075]
  - - [1024, 128, 1, 128, 1024, 1024, 1024, 128]
    - [106, 0.59]
  - - [1024, 128, 1, 256, 1024, 1024, 1024, 256]
    - [95, 0.951]
  - - [1024, 128, 1, 512, 1024, 1024, 1024, 512]
    - [95, 1.424]
  - - [1024, 128, 1, 1024, 1024, 1024, 1024, 1024]
    - [108, 1.984]
  - - [1024, 128, 1, 2048, 1024, 1024, 1024, 2048]
    - [57, 2.244]
  - - [1024, 128, 1, 4096, 1024, 1024, 1024, 4096]
    - [85, 3.472]
  - - [1024, 128, 1, 8192, 1024, 1024, 1024, 8192]
    - [42, 3.485]
  - - [1024, 256, 1, 128, 1024, 1024, 1024, 128]
    - [90, 1.02]
  - - [1024, 256, 1, 256, 1024, 1024, 1024, 256]
    - [89, 1.616]
  - - [1024, 256, 1, 512, 1024, 1024, 1024, 512]
    - [89, 2.424]
  - - [1024, 256, 1, 1024, 1024, 1024, 1024, 1024]
    - [88, 2.578]
  - - [1024, 256, 1, 2048, 1024, 1024, 1024, 2048]
    - [36, 3.087]
  - - [1024, 256, 1, 4096, 1024, 1024, 1024, 4096]
    - [87, 3.877]
  - - [1024, 256, 1, 8192, 1024, 1024, 1024, 8192]
    - [25, 4.817]
  - - [1024, 512, 1, 128, 1024, 1024, 1024, 128]
    - [83, 1.668]
  - - [1024, 512, 1, 256, 1024, 1024, 1024, 256]
    - [82, 2.576]
  - - [1024, 512, 1, 512, 1024, 1024, 1024, 512]
    - [83, 3.615]
  - - [1024, 512, 1, 1024, 1024, 1024, 1024, 1024]
    - [99, 3.724]
  - - [1024, 512, 1, 2048, 1024, 1024, 1024, 2048]
    - [14, 4.213]
  - - [1024, 512, 1, 4096, 1024, 1024, 1024, 4096]
    - [86, 4.488]
  - - [1024, 512, 1, 8192, 1024, 1024, 1024, 8192]
    - [27, 5.642]
  - - [1024, 1024, 1, 128, 1024, 1024, 1024, 128]
    - [41, 2.262]
  - - [1024, 1024, 1, 256, 1024, 1024, 1024, 256]
    - [45, 3.311]
  - - [1024, 1024, 1, 512, 1024, 1024, 1024, 512]
    - [74, 4.002]
  - - [1024, 1024, 1, 1024, 1024, 1024, 1024, 1024]
    - [89, 4.438]
  - - [1024, 1024, 1, 2048, 1024, 1024, 1024, 2048]
    - [88, 4.924]
  - - [1024, 1024, 1, 4096, 1024, 1024, 1024, 4096]
    - [14, 5.378]
  - - [1024, 1024, 1, 8192, 1024, 1024, 1024, 8192]
    - [17, 6.129]
  - - [1024, 2048, 1, 128, 1024, 1024, 1024, 128]
    - [32, 3.037]
  - - [1024, 2048, 1, 256, 1024, 1024, 1024, 256]
    - [32, 4.491]
  - - [1024, 2048, 1, 512, 1024, 1024, 1024, 512]
    - [67, 4.773]
  - - [1024, 2048, 1, 1024, 1024, 1024, 1024, 1024]
    - [82, 5.716]
  - - [1024, 2048, 1, 2048, 1024, 1024, 1024, 2048]
    - [83, 6.276]
  - - [1024, 2048, 1, 4096, 1024, 1024, 1024, 4096]
    - [21, 6.039]
  - - [1024, 2048, 1, 8192, 1024, 1024, 1024, 8192]
    - [29, 6.996]
  - - [1024, 4096, 1, 128, 1024, 1024, 1024, 128]
    - [33, 3.297]
  - - [1024, 4096, 1, 256, 1024, 1024, 1024, 256]
    - [21, 4.699]
  - - [1024, 4096, 1, 512, 1024, 1024, 1024, 512]
    - [50, 5.922]
  - - [1024, 4096, 1, 1024, 1024, 1024, 1024, 1024]
    - [47, 6.719]
  - - [1024, 4096, 1, 2048, 1024, 1024, 1024, 2048]
    - [75, 7.074]
  - - [1024, 4096, 1, 4096, 1024, 1024, 1024, 4096]
    - [16, 6.207]
  - - [1024, 4096, 1, 8192, 1024, 1024, 1024, 8192]
    - [23, 6.743]
  - - [1024, 8192, 1, 128, 1024, 1024, 1024, 128]
    - [22, 3.842]
  - - [1024, 8192, 1, 256, 1024, 1024, 1024, 256]
    - [32, 5.638]
  - - [1024, 8192, 1, 512, 1024, 1024, 1024, 512]
    - [20, 7.431]
  - - [1024, 8192, 1, 1024, 1024, 1024, 1024, 1024]
    - [14, 8.143]
  - - [1024, 8192, 1, 2048, 1024, 1024, 1024, 2048]
    - [61, 7.952]
  - - [1024, 8192, 1, 4096, 1024, 1024, 1024, 4096]
    - [62, 7.019]
  - - [1024, 8192, 1, 8192, 1024, 1024, 1024, 8192]
    - [63, 7.801]
  - - [2048, 128, 1, 128, 2048, 2048, 2048, 128]
    - [92, 1.043]
  - - [2048, 128, 1, 256, 2048, 2048, 2048, 256]
    - [89, 1.614]
  - - [2048, 128, 1, 512, 2048, 2048, 2048, 512]
    - [90, 2.371]
  - - [2048, 128, 1, 1024, 2048, 2048, 2048, 1024]
    - [84, 2.474]
  - - [2048, 128, 1, 2048, 2048, 2048, 2048, 2048]
    - [86, 3.054]
  - - [2048, 128, 1, 4096, 2048, 2048, 2048, 4096]
    - [86, 3.731]
  - - [2048, 128, 1, 8192, 2048, 2048, 2048, 8192]
    - [29, 4.703]
  - - [2048, 256, 1, 128, 2048, 2048, 2048, 128]
    - [53, 1.646]
  - - [2048, 256, 1, 256, 2048, 2048, 2048, 256]
    - [82, 2.516]
  - - [2048, 256, 1, 512, 2048, 2048, 2048, 512]
    - [82, 3.424]
  - - [2048, 256, 1, 1024, 2048, 2048, 2048, 1024]
    - [102, 3.383]
  - - [2048, 256, 1, 2048, 2048, 2048, 2048, 2048]
    - [19, 4.142]
  - - [2048, 256, 1, 4096, 2048, 2048, 2048, 4096]
    - [85, 4.636]
  - - [2048, 256, 1, 8192, 2048, 2048, 2048, 8192]
    - [21, 5.587]
  - - [2048, 512, 1, 128, 2048, 2048, 2048, 128]
    - [37, 2.382]
  - - [2048, 512, 1, 256, 2048, 2048, 2048, 256]
    - [34, 3.279]
  - - [2048, 512, 1, 512, 2048, 2048, 2048, 512]
    - [75, 4.02]
  - - [2048, 512, 1, 1024, 2048, 2048, 2048, 1024]
    - [89, 4.318]
  - - [2048, 512, 1, 2048, 2048, 2048, 2048, 2048]
    - [88, 4.833]
  - - [2048, 512, 1, 4096, 2048, 2048, 2048, 4096]
    - [14, 5.369]
  - - [2048, 512, 1, 8192, 2048, 2048, 2048, 8192]
    - [66, 6.108]
  - - [2048, 1024, 1, 128, 2048, 2048, 2048, 128]
    - [18, 3.082]
  - - [2048, 1024, 1, 256, 2048, 2048, 2048, 256]
    - [18, 4.504]
  - - [2048, 1024, 1, 512, 2048, 2048, 2048, 512]
    - [83, 4.8]
  - - [2048, 1024, 1, 1024, 2048, 2048, 2048, 1024]
    - [83, 5.347]
  - - [2048, 1024, 1, 2048, 2048, 2048, 2048, 2048]
    - [88, 5.999]
  - - [2048, 1024, 1, 4096, 2048, 2048, 2048, 4096]
    - [27, 5.664]
  - - [2048, 1024, 1, 8192, 2048, 2048, 2048, 8192]
    - [14, 6.737]
  - - [2048, 2048, 1, 128, 2048, 2048, 2048, 128]
    - [37, 3.458]
  - - [2048, 2048, 1, 256, 2048, 2048, 2048, 256]
    - [41, 4.898]
  - - [2048, 2048, 1, 512, 2048, 2048, 2048, 512]
    - [41, 6.097]
  - - [2048, 2048, 1, 1024, 2048, 2048, 2048, 1024]
    - [47, 6.651]
  - - [2048, 2048, 1, 2048, 2048, 2048, 2048, 2048]
    - [74, 7.043]
  - - [2048, 2048, 1, 4096, 2048, 2048, 2048, 4096]
    - [21, 6.698]
  - - [2048, 2048, 1, 8192, 2048, 2048, 2048, 8192]
    - [29, 7.512]
  - - [2048, 4096, 1, 128, 2048, 2048, 2048, 128]
    - [20, 4.029]
  - - [2048, 4096, 1, 256, 2048, 2048, 2048, 256]
    - [26, 5.958]
  - - [2048, 4096, 1, 512, 2048, 2048, 2048, 512]
    - [30, 7.108]
  - - [2048, 4096, 1, 1024, 2048, 2048, 2048, 1024]
    - [14, 8.264]
  - - [2048, 4096, 1, 2048, 2048, 2048, 2048, 2048]
    - [61, 7.931]
  - - [2048, 4096, 1, 4096, 2048, 2048, 2048, 4096]
    - [14, 7.428]
  - - [2048, 4096, 1, 8192, 2048, 2048, 2048, 8192]
    - [1, 7.858]
  - - [2048, 8192, 1, 128, 2048, 2048, 2048, 128]
    - [9, 3.318]
  - - [2048, 8192, 1, 256, 2048, 2048, 2048, 256]
    - [13, 4.936]
  - - [2048, 8192, 1, 512, 2048, 2048, 2048, 512]
    - [3, 6.526]
  - - [2048, 8192, 1, 1024, 2048, 2048, 2048, 1024]
    - [0, 7.683]
  - - [2048, 8192, 1, 2048, 2048, 2048, 2048, 2048]
    - [19, 7.709]
  - - [2048, 8192, 1, 4096, 2048, 2048, 2048, 4096]
    - [19, 7.966]
  - - [2048, 8192, 1, 8192, 2048, 2048, 2048, 8192]
    - [8, 8.173]
  - - [4096, 128, 1, 128, 4096, 4096, 4096, 128]
    - [51, 1.742]
  - - [4096, 128, 1, 256, 4096, 4096, 4096, 256]
    - [83, 2.491]
  - - [4096, 128, 1, 512, 4096, 4096, 4096, 512]
    - [82, 3.36]
  - - [4096, 128, 1, 1024, 4096, 4096, 4096, 1024]
    - [98, 3.428]
  - - [4096, 128, 1, 2048, 4096, 4096, 4096, 2048]
    - [14, 4.112]
  - - [4096, 128, 1, 4096, 4096, 4096, 4096, 4096]
    - [23, 4.648]
  - - [4096, 128, 1, 8192, 4096, 4096, 4096, 8192]
    - [31, 5.472]
  - - [4096, 256, 1, 128, 4096, 4096, 4096, 128]
    - [37, 2.392]
  - - [4096, 256, 1, 256, 4096, 4096, 4096, 256]
    - [41, 3.295]
  - - [4096, 256, 1, 512, 4096, 4096, 4096, 512]
    - [75, 3.924]
  - - [4096, 256, 1, 1024, 4096, 4096, 4096, 1024]
    - [94, 4.269]
  - - [4096, 256, 1, 2048, 4096, 4096, 4096, 2048]
    - [87, 4.902]
  - - [4096, 256, 1, 4096, 4096, 4096, 4096, 4096]
    - [21, 5.595]
  - - [4096, 256, 1, 8192, 4096, 4096, 4096, 8192]
    - [27, 6.386]
  - - [4096, 512, 1, 128, 4096, 4096, 4096, 128]
    - [15, 3.179]
  - - [4096, 512, 1, 256, 4096, 4096, 4096, 256]
    - [18, 4.523]
  - - [4096, 512, 1, 512, 4096, 4096, 4096, 512]
    - [67, 4.671]
  - - [4096, 512, 1, 1024, 4096, 4096, 4096, 1024]
    - [88, 5.531]
  - - [4096, 512, 1, 2048, 4096, 4096, 4096, 2048]
    - [87, 6.154]
  - - [4096, 512, 1, 4096, 4096, 4096, 4096, 4096]
    - [25, 6.202]
  - - [4096, 512, 1, 8192, 4096, 4096, 4096, 8192]
    - [17, 6.893]
  - - [4096, 1024, 1, 128, 4096, 4096, 4096, 128]
    - [37, 3.605]
  - - [4096, 1024, 1, 256, 4096, 4096, 4096, 256]
    - [18, 4.869]
  - - [4096, 1024, 1, 512, 4096, 4096, 4096, 512]
    - [34, 5.95]
  - - [4096, 1024, 1, 1024, 4096, 4096, 4096, 1024]
    - [37, 6.736]
  - - [4096, 1024, 1, 2048, 4096, 4096, 4096, 2048]
    - [79, 7.058]
  - - [4096, 1024, 1, 4096, 4096, 4096, 4096, 4096]
    - [29, 7.23]
  - - [4096, 1024, 1, 8192, 4096, 4096, 4096, 8192]
    - [17, 8.02]
  - - [4096, 2048, 1, 128, 4096, 4096, 4096, 128]
    - [30, 3.999]
  - - [4096, 2048, 1, 256, 4096, 4096, 4096, 256]
    - [15, 5.885]
  - - [4096, 2048, 1, 512, 4096, 4096, 4096, 512]
    - [32, 7.215]
  - - [4096, 2048, 1, 1024, 4096, 4096, 4096, 1024]
    - [20, 8.303]
  - - [4096, 2048, 1, 2048, 4096, 4096, 4096, 2048]
    - [69, 7.933]
  - - [4096, 2048, 1, 4096, 4096, 4096, 4096, 4096]
    - [14, 8.231]
  - - [4096, 2048, 1, 8192, 4096, 4096, 4096, 8192]
    - [14, 8.194]
  - - [4096, 4096, 1, 128, 4096, 4096, 4096, 128]
    - [5, 3.408]
  - - [4096, 4096, 1, 256, 4096, 4096, 4096, 256]
    - [11, 4.687]
  - - [4096, 4096, 1, 512, 4096, 4096, 4096, 512]
    - [12, 6.365]
  - - [4096, 4096, 1, 1024, 4096, 4096, 4096, 1024]
    - [10, 7.679]
  - - [4096, 4096, 1, 2048, 4096, 4096, 4096, 2048]
    - [25, 8.053]
  - - [4096, 4096, 1, 4096, 4096, 4096, 4096, 4096]
    - [17, 8.51]
  - - [4096, 4096, 1, 8192, 4096, 4096, 4096, 8192]
    - [29, 8.414]
  - - [4096, 8192, 1, 128, 4096, 4096, 4096, 128]
    - [38, 3.458]
  - - [4096, 8192, 1, 256, 4096, 4096, 4096, 256]
    - [23, 4.922]
  - - [4096, 8192, 1, 512, 4096, 4096, 4096, 512]
    - [17, 6.246]
  - - [4096, 8192, 1, 1024, 4096, 4096, 4096, 1024]
    - [24, 7.379]
  - - [4096, 8192, 1, 2048, 4096, 4096, 4096, 2048]
    - [31, 8.077]
  - - [4096, 8192, 1, 4096, 4096, 4096, 4096, 4096]
    - [17, 8.374]
  - - [4096, 8192, 1, 8192, 4096, 4096, 4096, 8192]
    - [6, 8.868]
  - - [8192, 128, 1, 128, 8192, 8192, 8192, 128]
    - [37, 2.341]
  - - [8192, 128, 1, 256, 8192, 8192, 8192, 256]
    - [46, 3.047]
  - - [8192, 128, 1, 512, 8192, 8192, 8192, 512]
    - [76, 3.752]
  - - [8192, 128, 1, 1024, 8192, 8192, 8192, 1024]
    - [94, 4.182]
  - - [8192, 128, 1, 2048, 8192, 8192, 8192, 2048]
    - [94, 4.672]
  - - [8192, 128, 1, 4096, 8192, 8192, 8192, 4096]
    - [27, 5.639]
  - - [8192, 128, 1, 8192, 8192, 8192, 8192, 8192]
    - [14, 6.169]
  - - [8192, 256, 1, 128, 8192, 8192, 8192, 128]
    - [28, 3.188]
  - - [8192, 256, 1, 256, 8192, 8192, 8192, 256]
    - [28, 4.293]
  - - [8192, 256, 1, 512, 8192, 8192, 8192, 512]
    - [67, 4.715]
  - - [8192, 256, 1, 1024, 8192, 8192, 8192, 1024]
    - [86, 5.429]
  - - [8192, 256, 1, 2048, 8192, 8192, 8192, 2048]
    - [86, 6.237]
  - - [8192, 256, 1, 4096, 8192, 8192, 8192, 4096]
    - [17, 6.364]
  - - [8192, 256, 1, 8192, 8192, 8192, 8192, 8192]
    - [14, 7.668]
  - - [8192, 512, 1, 128, 8192, 8192, 8192, 128]
    - [43, 3.577]
  - - [8192, 512, 1, 256, 8192, 8192, 8192, 256]
    - [43, 5.03]
  - - [8192, 512, 1, 512, 8192, 8192, 8192, 512]
    - [34, 5.811]
  - - [8192, 512, 1, 1024, 8192, 8192, 8192, 1024]
    - [48, 6.583]
  - - [8192, 512, 1, 2048, 8192, 8192, 8192, 2048]
    - [79, 7.004]
  - - [8192, 512, 1, 4096, 8192, 8192, 8192, 4096]
    - [14, 7.776]
  - - [8192, 512, 1, 8192, 8192, 8192, 8192, 8192]
    - [29, 8.111]
  - - [8192, 1024, 1, 128, 8192, 8192, 8192, 128]
    - [22, 3.997]
  - - [8192, 1024, 1, 256, 8192, 8192, 8192, 256]
    - [22, 5.919]
  - - [8192, 1024, 1, 512, 8192, 8192, 8192, 512]
    - [28, 7.282]
  - - [8192, 1024, 1, 1024, 8192, 8192, 8192, 1024]
    - [27, 8.186]
  - - [8192, 1024, 1, 2048, 8192, 8192, 8192, 2048]
    - [65, 7.844]
  - - [8192, 1024, 1, 4096, 8192, 8192, 8192, 4096]
    - [17, 8.206]
  - - [8192, 1024, 1, 8192, 8192, 8192, 8192, 8192]
    - [31, 8.26]
  - - [8192, 2048, 1, 128, 8192, 8192, 8192, 128]
    - [5, 3.34]
  - - [8192, 2048, 1, 256, 8192, 8192, 8192, 256]
    - [2, 4.903]
  - - [8192, 2048, 1, 512, 8192, 8192, 8192, 512]
    - [0, 6.6]
  - - [8192, 2048, 1, 1024, 8192, 8192, 8192, 1024]
    - [0, 7.871]
  - - [8192, 2048, 1, 2048, 8192, 8192, 8192, 2048]
    - [14, 8.589]
  - - [8192, 2048, 1, 4096, 8192, 8192, 8192, 4096]
    - [19, 8.813]
  - - [8192, 2048, 1, 8192, 8192, 8192, 8192, 8192]
    - [10, 8.287]
  - - [8192, 4096, 1, 128, 8192, 8192, 8192, 128]
    - [27, 3.572]
  - - [8192, 4096, 1, 256, 8192, 8192, 8192, 256]
    - [44, 4.851]
  - - [8192, 4096, 1, 512, 8192, 8192, 8192, 512]
    - [28, 6.368]
  - - [8192, 4096, 1, 1024, 8192, 8192, 8192, 1024]
    - [20, 7.582]
  - - [8192, 4096, 1, 2048, 8192, 8192, 8192, 2048]
    - [17, 8.206]
  - - [8192, 4096, 1, 4096, 8192, 8192, 8192, 4096]
    - [15, 8.63]
  - - [8192, 4096, 1, 8192, 8192, 8192, 8192, 8192]
    - [9, 9.017]
  - - [8192, 8192, 1, 128, 8192, 8192, 8192, 128]
    - [34, 3.692]
  - - [8192, 8192, 1, 256, 8192, 8192, 8192, 256]
    - [41, 5.08]
  - - [8192, 8192, 1, 512, 8192, 8192, 8192, 512]
    - [29, 6.754]
  - - [8192, 8192, 1, 1024, 8192, 8192, 8192, 1024]
    - [30, 7.857]
  - - [8192, 8192, 1, 2048, 8192, 8192, 8192, 2048]
    - [24, 8.3]
  - - [8192, 8192, 1, 4096, 8192, 8192, 8192, 4096]
    - [22, 8.604]
  - - [8192, 8192, 1, 8192, 8192, 8192, 8192, 8192]
    - [4, 8.259]
  - - [1, 1, 1, 32, 1, 1, 1, 32]
    - [114, 0.0]
- null
- null
- DeviceEfficiency
- GridBased
