library/src/amd_detail/rocblaslt/src/Tensile/Logic/streamk/gfx942_38cu/aquavanjaram942_Cijk_Alik_Bjlk_BBS_BH_UserArgs.yaml
- {MinimumRequiredVersion: 4.33.0}
- aquavanjaram942
- {Architecture: gfx942, CUCount: 38}
- [Device 0049, Device 0050]
    SolutionIndex: 0
    SolutionNameMin: Cijk_Alik_Bjlk_BBS_BH_UserArgs_MT256x256x32_MI16x16x1_SN_LDSB1_CLR1_GSU0_GSUC0_GSUWGMRR0_K1_LBSPPA256_LBSPPB2048_LPB0_MIWT8_8_PLR1_SU32_SUM0_SUS256_VWA4_VWB8_WGM1_WGMXCC1_WGMXCCGn1
    SolutionIndex: 1
    SolutionNameMin: Cijk_Alik_Bjlk_BBS_BH_UserArgs_MT256x256x32_MI16x16x1_SN_LDSB1_CLR1_GSU0_GSUC0_GSUWGMRR0_K1_LBSPPA512_LBSPPB2048_LPB0_MIWT8_8_PLR1_SU32_SUM0_SUS256_VWA8_VWB8_WGM1_WGMXCC1_WGMXCCGn1
    SolutionIndex: 2
    SolutionNameMin: Cijk_Alik_Bjlk_BBS_BH_UserArgs_MT256x256x32_MI16x16x1_SN_LDSB1_CLR1_GSU0_GSUC0_GSUWGMRR0_K1_LBSPPA512_LBSPPB2048_LPB16_MIWT8_8_PLR1_SU32_SUM0_SUS256_VWA8_VWB1_WGM4_WGMXCC1_WGMXCCGn1
    SolutionIndex: 3
    SolutionNameMin: Cijk_Alik_Bjlk_BBS_BH_UserArgs_MT256x256x32_MI16x16x1_SN_LDSB1_CLR1_GSU0_GSUC0_GSUWGMRR0_K1_LBSPPA512_LBSPPB2048_LPB32_MIWT8_8_PLR1_SU32_SUM0_SUS256_VWA8_VWB2_WGM4_WGMXCC1_WGMXCCGn1
    SolutionIndex: 4
    SolutionNameMin: Cijk_Alik_Bjlk_BBS_BH_UserArgs_MT256x256x32_MI16x16x1_SN_LDSB1_CLR1_GSU0_GSUC0_GSUWGMRR0_K1_LBSPPA256_LBSPPB2048_LPB0_MIWT8_8_PLR1_SU32_SUM0_SUS256_VWA4_VWB4_WGM4_WGMXCC1_WGMXCCGn1
    SolutionIndex: 5
    SolutionNameMin: Cijk_Alik_Bjlk_BBS_BH_UserArgs_MT256x256x32_MI16x16x1_SN_LDSB1_CLR1_GSU0_GSUC0_GSUWGMRR0_K1_LBSPPA512_LBSPPB2048_LPB0_MIWT8_8_PLR1_SU32_SUM0_SUS256_VWA8_VWB4_WGM4_WGMXCC1_WGMXCCGn1
    SolutionIndex: 6
    SolutionNameMin: Cijk_Alik_Bjlk_BBS_BH_UserArgs_MT256x256x32_MI16x16x1_SN_LDSB1_CLR1_GSU0_GSUC0_GSUWGMRR0_K1_LBSPPA128_LBSPPB2048_LPB0_MIWT8_8_PLR1_SU32_SUM0_SUS256_VWA1_VWB8_WGM4_WGMXCC1_WGMXCCGn1
    SolutionIndex: 7
    SolutionNameMin: Cijk_Alik_Bjlk_BBS_BH_UserArgs_MT256x256x32_MI16x16x1_SN_LDSB1_CLR1_GSU0_GSUC0_GSUWGMRR0_K1_LBSPPA256_LBSPPB2048_LPB0_MIWT8_8_PLR1_SU32_SUM0_SUS256_VWA4_VWB8_WGM4_WGMXCC1_WGMXCCGn1
    SolutionIndex: 8
    SolutionNameMin: Cijk_Alik_Bjlk_BBS_BH_UserArgs_MT256x256x32_MI16x16x1_SN_LDSB1_CLR1_GSU0_GSUC0_GSUWGMRR0_K1_LBSPPA512_LBSPPB2048_LPB32_MIWT8_8_PLR1_SU32_SUM0_SUS256_VWA8_VWB2_WGM8_WGMXCC1_WGMXCCGn1
    SolutionIndex: 9
    SolutionNameMin: Cijk_Alik_Bjlk_BBS_BH_UserArgs_MT256x256x32_MI16x16x1_SN_LDSB1_CLR1_GSU0_GSUC0_GSUWGMRR0_K1_LBSPPA128_LBSPPB2048_LPB0_MIWT8_8_PLR1_SU32_SUM0_SUS256_VWA2_VWB4_WGM8_WGMXCC1_WGMXCCGn1
    SolutionIndex: 10
    SolutionNameMin: Cijk_Alik_Bjlk_BBS_BH_UserArgs_MT256x256x32_MI16x16x1_SN_LDSB1_CLR1_GSU0_GSUC0_GSUWGMRR0_K1_LBSPPA256_LBSPPB2048_LPB0_MIWT8_8_PLR1_SU32_SUM0_SUS256_VWA4_VWB4_WGM8_WGMXCC1_WGMXCCGn1
    SolutionIndex: 11
    SolutionNameMin: Cijk_Alik_Bjlk_BBS_BH_UserArgs_MT256x256x32_MI16x16x1_SN_LDSB1_CLR1_GSU0_GSUC0_GSUWGMRR0_K1_LBSPPA512_LBSPPB2048_LPB0_MIWT8_8_PLR1_SU32_SUM0_SUS256_VWA8_VWB4_WGM8_WGMXCC1_WGMXCCGn1
    SolutionIndex: 12
    SolutionNameMin: Cijk_Alik_Bjlk_BBS_BH_UserArgs_MT256x256x32_MI16x16x1_SN_LDSB1_CLR1_GSU0_GSUC0_GSUWGMRR0_K1_LBSPPA512_LBSPPB2048_LPB0_MIWT8_8_PLR1_SU32_SUM0_SUS256_VWA8_VWB8_WGM8_WGMXCC1_WGMXCCGn1
    SolutionIndex: 13
    SolutionNameMin: Cijk_Alik_Bjlk_BBS_BH_UserArgs_MT128x256x32_MI16x16x1_SN_LDSB1_CLR1_GSU0_GSUC0_GSUWGMRR0_K1_LBSPPA128_LBSPPB2048_LPB32_MIWT4_8_PLR1_SU32_SUM0_SUS256_VWA2_VWB2_WGM1_WGMXCC1_WGMXCCGn1
    SolutionIndex: 14
    SolutionNameMin: Cijk_Alik_Bjlk_BBS_BH_UserArgs_MT128x256x32_MI16x16x1_SN_LDSB1_CLR1_GSU0_GSUC0_GSUWGMRR0_K1_LBSPPA256_LBSPPB2048_LPB32_MIWT4_8_PLR1_SU32_SUM0_SUS256_VWA4_VWB2_WGM1_WGMXCC1_WGMXCCGn1
    SolutionIndex: 15
    SolutionNameMin: Cijk_Alik_Bjlk_BBS_BH_UserArgs_MT128x256x32_MI16x16x1_SN_LDSB1_CLR1_GSU0_GSUC0_GSUWGMRR0_K1_LBSPPA128_LBSPPB2048_LPB0_MIWT4_8_PLR1_SU32_SUM0_SUS256_VWA2_VWB4_WGM1_WGMXCC1_WGMXCCGn1
    SolutionIndex: 16
    SolutionNameMin: Cijk_Alik_Bjlk_BBS_BH_UserArgs_MT128x256x32_MI16x16x1_SN_LDSB1_CLR1_GSU0_GSUC0_GSUWGMRR0_K1_LBSPPA256_LBSPPB2048_LPB0_MIWT4_8_PLR1_SU32_SUM0_SUS256_VWA4_VWB4_WGM1_WGMXCC1_WGMXCCGn1
    SolutionIndex: 17
    SolutionNameMin: Cijk_Alik_Bjlk_BBS_BH_UserArgs_MT128x256x32_MI16x16x1_SN_LDSB1_CLR1_GSU0_GSUC0_GSUWGMRR0_K1_LBSPPA128_LBSPPB2048_LPB0_MIWT4_8_PLR1_SU32_SUM0_SUS256_VWA2_VWB8_WGM1_WGMXCC1_WGMXCCGn1
    SolutionIndex: 18
    SolutionNameMin: Cijk_Alik_Bjlk_BBS_BH_UserArgs_MT128x256x32_MI16x16x1_SN_LDSB1_CLR1_GSU0_GSUC0_GSUWGMRR0_K1_LBSPPA256_LBSPPB2048_LPB0_MIWT4_8_PLR1_SU32_SUM0_SUS256_VWA4_VWB8_WGM1_WGMXCC1_WGMXCCGn1
    SolutionIndex: 19
    SolutionNameMin: Cijk_Alik_Bjlk_BBS_BH_UserArgs_MT128x256x32_MI16x16x1_SN_LDSB1_CLR1_GSU0_GSUC0_GSUWGMRR0_K1_LBSPPA256_LBSPPB2048_LPB32_MIWT4_8_PLR1_SU32_SUM0_SUS256_VWA4_VWB2_WGM4_WGMXCC1_WGMXCCGn1
    SolutionIndex: 20
    SolutionNameMin: Cijk_Alik_Bjlk_BBS_BH_UserArgs_MT128x256x32_MI16x16x1_SN_LDSB1_CLR1_GSU0_GSUC0_GSUWGMRR0_K1_LBSPPA128_LBSPPB2048_LPB0_MIWT4_8_PLR1_SU32_SUM0_SUS256_VWA1_VWB4_WGM4_WGMXCC1_WGMXCCGn1
    SolutionIndex: 21
    SolutionNameMin: Cijk_Alik_Bjlk_BBS_BH_UserArgs_MT128x256x32_MI16x16x1_SN_LDSB1_CLR1_GSU0_GSUC0_GSUWGMRR0_K1_LBSPPA128_LBSPPB2048_LPB0_MIWT4_8_PLR1_SU32_SUM0_SUS256_VWA2_VWB4_WGM4_WGMXCC1_WGMXCCGn1
    SolutionIndex: 22
    SolutionNameMin: Cijk_Alik_Bjlk_BBS_BH_UserArgs_MT128x256x32_MI16x16x1_SN_LDSB1_CLR1_GSU0_GSUC0_GSUWGMRR0_K1_LBSPPA256_LBSPPB2048_LPB0_MIWT4_8_PLR1_SU32_SUM0_SUS256_VWA4_VWB4_WGM4_WGMXCC1_WGMXCCGn1
    SolutionIndex: 23
    SolutionNameMin: Cijk_Alik_Bjlk_BBS_BH_UserArgs_MT128x256x32_MI16x16x1_SN_LDSB1_CLR1_GSU0_GSUC0_GSUWGMRR0_K1_LBSPPA128_LBSPPB2048_LPB0_MIWT4_8_PLR1_SU32_SUM0_SUS256_VWA1_VWB8_WGM4_WGMXCC1_WGMXCCGn1
    SolutionIndex: 24
    SolutionNameMin: Cijk_Alik_Bjlk_BBS_BH_UserArgs_MT128x256x32_MI16x16x1_SN_LDSB1_CLR1_GSU0_GSUC0_GSUWGMRR0_K1_LBSPPA128_LBSPPB2048_LPB0_MIWT4_8_PLR1_SU32_SUM0_SUS256_VWA2_VWB8_WGM4_WGMXCC1_WGMXCCGn1
    SolutionIndex: 25
    SolutionNameMin: Cijk_Alik_Bjlk_BBS_BH_UserArgs_MT128x256x32_MI16x16x1_SN_LDSB1_CLR1_GSU0_GSUC0_GSUWGMRR0_K1_LBSPPA256_LBSPPB2048_LPB0_MIWT4_8_PLR1_SU32_SUM0_SUS256_VWA4_VWB8_WGM4_WGMXCC1_WGMXCCGn1
    SolutionIndex: 26
    SolutionNameMin: Cijk_Alik_Bjlk_BBS_BH_UserArgs_MT128x256x32_MI16x16x1_SN_LDSB1_CLR1_GSU0_GSUC0_GSUWGMRR0_K1_LBSPPA256_LBSPPB2048_LPB32_MIWT4_8_PLR1_SU32_SUM0_SUS256_VWA4_VWB2_WGM8_WGMXCC1_WGMXCCGn1
    SolutionIndex: 27
    SolutionNameMin: Cijk_Alik_Bjlk_BBS_BH_UserArgs_MT128x256x32_MI16x16x1_SN_LDSB1_CLR1_GSU0_GSUC0_GSUWGMRR0_K1_LBSPPA128_LBSPPB2048_LPB0_MIWT4_8_PLR1_SU32_SUM0_SUS256_VWA1_VWB4_WGM8_WGMXCC1_WGMXCCGn1
    SolutionIndex: 28
    SolutionNameMin: Cijk_Alik_Bjlk_BBS_BH_UserArgs_MT128x256x32_MI16x16x1_SN_LDSB1_CLR1_GSU0_GSUC0_GSUWGMRR0_K1_LBSPPA128_LBSPPB2048_LPB0_MIWT4_8_PLR1_SU32_SUM0_SUS256_VWA2_VWB4_WGM8_WGMXCC1_WGMXCCGn1
    SolutionIndex: 29
    SolutionNameMin: Cijk_Alik_Bjlk_BBS_BH_UserArgs_MT128x256x32_MI16x16x1_SN_LDSB1_CLR1_GSU0_GSUC0_GSUWGMRR0_K1_LBSPPA256_LBSPPB2048_LPB0_MIWT4_8_PLR1_SU32_SUM0_SUS256_VWA4_VWB4_WGM8_WGMXCC1_WGMXCCGn1
    SolutionIndex: 30
    SolutionNameMin: Cijk_Alik_Bjlk_BBS_BH_UserArgs_MT128x256x32_MI16x16x1_SN_LDSB1_CLR1_GSU0_GSUC0_GSUWGMRR0_K1_LBSPPA128_LBSPPB2048_LPB0_MIWT4_8_PLR1_SU32_SUM0_SUS256_VWA1_VWB8_WGM8_WGMXCC1_WGMXCCGn1
    SolutionIndex: 31
    SolutionNameMin: Cijk_Alik_Bjlk_BBS_BH_UserArgs_MT128x256x32_MI16x16x1_SN_LDSB1_CLR1_GSU0_GSUC0_GSUWGMRR0_K1_LBSPPA128_LBSPPB2048_LPB0_MIWT4_8_PLR1_SU32_SUM0_SUS256_VWA2_VWB8_WGM8_WGMXCC1_WGMXCCGn1
    SolutionIndex: 32
    SolutionNameMin: Cijk_Alik_Bjlk_BBS_BH_UserArgs_MT128x256x32_MI16x16x1_SN_LDSB1_CLR1_GSU0_GSUC0_GSUWGMRR0_K1_LBSPPA256_LBSPPB2048_LPB0_MIWT4_8_PLR1_SU32_SUM0_SUS256_VWA4_VWB8_WGM8_WGMXCC1_WGMXCCGn1
    SolutionIndex: 33
    SolutionNameMin: Cijk_Alik_Bjlk_BBS_BH_UserArgs_MT256x128x32_MI16x16x1_SN_LDSB1_CLR1_GSU0_GSUC0_GSUWGMRR0_K1_LBSPPA512_LBSPPB1024_LPB16_MIWT8_4_PLR1_SU32_SUM0_SUS256_VWA8_VWB1_WGM1_WGMXCC1_WGMXCCGn1
    SolutionIndex: 34
    SolutionNameMin: Cijk_Alik_Bjlk_BBS_BH_UserArgs_MT256x128x32_MI16x16x1_SN_LDSB1_CLR1_GSU0_GSUC0_GSUWGMRR0_K1_LBSPPA512_LBSPPB1024_LPB32_MIWT8_4_PLR1_SU32_SUM0_SUS256_VWA8_VWB2_WGM1_WGMXCC1_WGMXCCGn1
    SolutionIndex: 35
    SolutionNameMin: Cijk_Alik_Bjlk_BBS_BH_UserArgs_MT256x128x32_MI16x16x1_SN_LDSB1_CLR1_GSU0_GSUC0_GSUWGMRR0_K1_LBSPPA512_LBSPPB1024_LPB0_MIWT8_4_PLR1_SU32_SUM0_SUS256_VWA8_VWB4_WGM1_WGMXCC1_WGMXCCGn1
    SolutionIndex: 36
    SolutionNameMin: Cijk_Alik_Bjlk_BBS_BH_UserArgs_MT256x128x32_MI16x16x1_SN_LDSB1_CLR1_GSU0_GSUC0_GSUWGMRR0_K1_LBSPPA512_LBSPPB1024_LPB16_MIWT8_4_PLR1_SU32_SUM0_SUS256_VWA8_VWB1_WGM4_WGMXCC1_WGMXCCGn1
    SolutionIndex: 37
    SolutionNameMin: Cijk_Alik_Bjlk_BBS_BH_UserArgs_MT256x128x32_MI16x16x1_SN_LDSB1_CLR1_GSU0_GSUC0_GSUWGMRR0_K1_LBSPPA512_LBSPPB1024_LPB0_MIWT8_4_PLR1_SU32_SUM0_SUS256_VWA8_VWB4_WGM4_WGMXCC1_WGMXCCGn1
    SolutionIndex: 38
    SolutionNameMin: Cijk_Alik_Bjlk_BBS_BH_UserArgs_MT256x128x32_MI16x16x1_SN_LDSB1_CLR1_GSU0_GSUC0_GSUWGMRR0_K1_LBSPPA512_LBSPPB1024_LPB16_MIWT8_4_PLR1_SU32_SUM0_SUS256_VWA8_VWB1_WGM8_WGMXCC1_WGMXCCGn1
    SolutionIndex: 39
    SolutionNameMin: Cijk_Alik_Bjlk_BBS_BH_UserArgs_MT256x128x32_MI16x16x1_SN_LDSB1_CLR1_GSU0_GSUC0_GSUWGMRR0_K1_LBSPPA512_LBSPPB1024_LPB32_MIWT8_4_PLR1_SU32_SUM0_SUS256_VWA8_VWB2_WGM8_WGMXCC1_WGMXCCGn1
    SolutionIndex: 40
    SolutionNameMin: Cijk_Alik_Bjlk_BBS_BH_UserArgs_MT256x128x32_MI16x16x1_SN_LDSB1_CLR1_GSU0_GSUC0_GSUWGMRR0_K1_LBSPPA512_LBSPPB1024_LPB0_MIWT8_4_PLR1_SU32_SUM0_SUS256_VWA8_VWB4_WGM8_WGMXCC1_WGMXCCGn1
    SolutionIndex: 41
    SolutionNameMin: Cijk_Alik_Bjlk_BBS_BH_UserArgs_MT64x256x32_MI16x16x1_SN_LDSB1_CLR1_GSU0_GSUC0_GSUWGMRR0_K1_LBSPPA128_LBSPPB2048_LPB0_MIWT2_8_PLR1_SU32_SUM0_SUS256_VWA2_VWB8_WGM1_WGMXCC1_WGMXCCGn1
    SolutionIndex: 42
    SolutionNameMin: Cijk_Alik_Bjlk_BBS_BH_UserArgs_MT64x256x32_MI16x16x1_SN_LDSB1_CLR1_GSU0_GSUC0_GSUWGMRR0_K1_LBSPPA128_LBSPPB2048_LPB0_MIWT2_8_PLR1_SU32_SUM0_SUS256_VWA2_VWB8_WGM4_WGMXCC1_WGMXCCGn1
    SolutionIndex: 43
    SolutionNameMin: Cijk_Alik_Bjlk_BBS_BH_UserArgs_MT64x256x32_MI16x16x1_SN_LDSB1_CLR1_GSU0_GSUC0_GSUWGMRR0_K1_LBSPPA128_LBSPPB2048_LPB0_MIWT2_8_PLR1_SU32_SUM0_SUS256_VWA2_VWB4_WGM8_WGMXCC1_WGMXCCGn1
    SolutionIndex: 44
    SolutionNameMin: Cijk_Alik_Bjlk_BBS_BH_UserArgs_MT64x256x32_MI16x16x1_SN_LDSB1_CLR1_GSU0_GSUC0_GSUWGMRR0_K1_LBSPPA128_LBSPPB2048_LPB0_MIWT2_8_PLR1_SU32_SUM0_SUS256_VWA2_VWB8_WGM8_WGMXCC1_WGMXCCGn1
    SolutionIndex: 45
    SolutionNameMin: Cijk_Alik_Bjlk_BBS_BH_UserArgs_MT128x128x32_MI16x16x1_SN_LDSB1_CLR1_GSU0_GSUC0_GSUWGMRR0_K1_LBSPPA256_LBSPPB1024_LPB16_MIWT4_4_PLR1_SU32_SUM0_SUS256_VWA4_VWB1_WGM1_WGMXCC1_WGMXCCGn1
    SolutionIndex: 46
    SolutionNameMin: Cijk_Alik_Bjlk_BBS_BH_UserArgs_MT128x128x32_MI16x16x1_SN_LDSB1_CLR1_GSU0_GSUC0_GSUWGMRR0_K1_LBSPPA128_LBSPPB1024_LPB32_MIWT4_4_PLR1_SU32_SUM0_SUS256_VWA2_VWB2_WGM1_WGMXCC1_WGMXCCGn1
    SolutionIndex: 47
    SolutionNameMin: Cijk_Alik_Bjlk_BBS_BH_UserArgs_MT128x128x32_MI16x16x1_SN_LDSB1_CLR1_GSU0_GSUC0_GSUWGMRR0_K1_LBSPPA128_LBSPPB1024_LPB0_MIWT4_4_PLR1_SU32_SUM0_SUS256_VWA2_VWB4_WGM1_WGMXCC1_WGMXCCGn1
    SolutionIndex: 48
    SolutionNameMin: Cijk_Alik_Bjlk_BBS_BH_UserArgs_MT128x128x32_MI16x16x1_SN_LDSB1_CLR1_GSU0_GSUC0_GSUWGMRR0_K1_LBSPPA256_LBSPPB1024_LPB0_MIWT4_4_PLR1_SU32_SUM0_SUS256_VWA4_VWB4_WGM1_WGMXCC1_WGMXCCGn1
    SolutionIndex: 49
    SolutionNameMin: Cijk_Alik_Bjlk_BBS_BH_UserArgs_MT128x128x32_MI16x16x1_SN_LDSB1_CLR1_GSU0_GSUC0_GSUWGMRR0_K1_LBSPPA128_LBSPPB1024_LPB16_MIWT4_4_PLR1_SU32_SUM0_SUS256_VWA2_VWB1_WGM4_WGMXCC1_WGMXCCGn1
    SolutionIndex: 50
    SolutionNameMin: Cijk_Alik_Bjlk_BBS_BH_UserArgs_MT128x128x32_MI16x16x1_SN_LDSB1_CLR1_GSU0_GSUC0_GSUWGMRR0_K1_LBSPPA256_LBSPPB1024_LPB16_MIWT4_4_PLR1_SU32_SUM0_SUS256_VWA4_VWB1_WGM4_WGMXCC1_WGMXCCGn1
    SolutionIndex: 51
    SolutionNameMin: Cijk_Alik_Bjlk_BBS_BH_UserArgs_MT128x128x32_MI16x16x1_SN_LDSB1_CLR1_GSU0_GSUC0_GSUWGMRR0_K1_LBSPPA256_LBSPPB1024_LPB32_MIWT4_4_PLR1_SU32_SUM0_SUS256_VWA4_VWB2_WGM4_WGMXCC1_WGMXCCGn1
    SolutionIndex: 52
    SolutionNameMin: Cijk_Alik_Bjlk_BBS_BH_UserArgs_MT128x128x32_MI16x16x1_SN_LDSB1_CLR1_GSU0_GSUC0_GSUWGMRR0_K1_LBSPPA128_LBSPPB1024_LPB0_MIWT4_4_PLR1_SU32_SUM0_SUS256_VWA2_VWB4_WGM4_WGMXCC1_WGMXCCGn1
    SolutionIndex: 53
    SolutionNameMin: Cijk_Alik_Bjlk_BBS_BH_UserArgs_MT128x128x32_MI16x16x1_SN_LDSB1_CLR1_GSU0_GSUC0_GSUWGMRR0_K1_LBSPPA256_LBSPPB1024_LPB0_MIWT4_4_PLR1_SU32_SUM0_SUS256_VWA4_VWB4_WGM4_WGMXCC1_WGMXCCGn1
    SolutionIndex: 54
    SolutionNameMin: Cijk_Alik_Bjlk_BBS_BH_UserArgs_MT128x128x32_MI16x16x1_SN_LDSB1_CLR1_GSU0_GSUC0_GSUWGMRR0_K1_LBSPPA128_LBSPPB1024_LPB16_MIWT4_4_PLR1_SU32_SUM0_SUS256_VWA2_VWB1_WGM8_WGMXCC1_WGMXCCGn1
    SolutionIndex: 55
    SolutionNameMin: Cijk_Alik_Bjlk_BBS_BH_UserArgs_MT128x128x32_MI16x16x1_SN_LDSB1_CLR1_GSU0_GSUC0_GSUWGMRR0_K1_LBSPPA128_LBSPPB1024_LPB32_MIWT4_4_PLR1_SU32_SUM0_SUS256_VWA2_VWB2_WGM8_WGMXCC1_WGMXCCGn1
    SolutionIndex: 56
    SolutionNameMin: Cijk_Alik_Bjlk_BBS_BH_UserArgs_MT128x128x32_MI16x16x1_SN_LDSB1_CLR1_GSU0_GSUC0_GSUWGMRR0_K1_LBSPPA128_LBSPPB1024_LPB0_MIWT4_4_PLR1_SU32_SUM0_SUS256_VWA2_VWB4_WGM8_WGMXCC1_WGMXCCGn1
    SolutionIndex: 57
    SolutionNameMin: Cijk_Alik_Bjlk_BBS_BH_UserArgs_MT128x128x32_MI16x16x1_SN_LDSB1_CLR1_GSU0_GSUC0_GSUWGMRR0_K1_LBSPPA256_LBSPPB1024_LPB0_MIWT4_4_PLR1_SU32_SUM0_SUS256_VWA4_VWB4_WGM8_WGMXCC1_WGMXCCGn1
    SolutionIndex: 58
    SolutionNameMin: Cijk_Alik_Bjlk_BBS_BH_UserArgs_MT64x128x32_MI16x16x1_SN_LDSB0_CLR1_GSU0_GSUC0_GSUWGMRR0_K1_LBSPPA128_LBSPPB1024_LPB0_MIWT2_4_PLR1_SU32_SUM0_SUS256_VWA2_VWB4_WGM1_WGMXCC1_WGMXCCGn1
    SolutionIndex: 59
    SolutionNameMin: Cijk_Alik_Bjlk_BBS_BH_UserArgs_MT64x128x32_MI16x16x1_SN_LDSB0_CLR0_GSU0_GSUC0_GSUWGMRR0_K1_LBSPPA128_LBSPPB1024_LPB0_MIWT2_4_PLR0_SU32_SUM0_SUS256_VWA2_VWB4_WGM1_WGMXCC1_WGMXCCGn1
    SolutionIndex: 60
    SolutionNameMin: Cijk_Alik_Bjlk_BBS_BH_UserArgs_MT64x128x32_MI16x16x1_SN_LDSB0_CLR1_GSU0_GSUC0_GSUWGMRR0_K1_LBSPPA128_LBSPPB1024_LPB0_MIWT2_4_PLR1_SU32_SUM0_SUS256_VWA2_VWB4_WGM4_WGMXCC1_WGMXCCGn1
    SolutionIndex: 61
    SolutionNameMin: Cijk_Alik_Bjlk_BBS_BH_UserArgs_MT64x128x32_MI16x16x1_SN_LDSB0_CLR0_GSU0_GSUC0_GSUWGMRR0_K1_LBSPPA128_LBSPPB1024_LPB0_MIWT2_4_PLR0_SU32_SUM0_SUS256_VWA1_VWB4_WGM4_WGMXCC1_WGMXCCGn1
    SolutionIndex: 62
    SolutionNameMin: Cijk_Alik_Bjlk_BBS_BH_UserArgs_MT64x128x32_MI16x16x1_SN_LDSB0_CLR1_GSU0_GSUC0_GSUWGMRR0_K1_LBSPPA128_LBSPPB1024_LPB0_MIWT2_4_PLR1_SU32_SUM0_SUS256_VWA1_VWB4_WGM8_WGMXCC1_WGMXCCGn1
    SolutionIndex: 63
    SolutionNameMin: Cijk_Alik_Bjlk_BBS_BH_UserArgs_MT64x128x32_MI16x16x1_SN_LDSB0_CLR0_GSU0_GSUC0_GSUWGMRR0_K1_LBSPPA128_LBSPPB1024_LPB0_MIWT2_4_PLR0_SU32_SUM0_SUS256_VWA1_VWB4_WGM8_WGMXCC1_WGMXCCGn1
    SolutionIndex: 64
    SolutionNameMin: Cijk_Alik_Bjlk_BBS_BH_UserArgs_MT128x64x32_MI16x16x1_SN_LDSB0_CLR1_GSU0_GSUC0_GSUWGMRR0_K1_LBSPPA256_LBSPPB512_LPB32_MIWT4_2_PLR1_SU32_SUM0_SUS256_VWA4_VWB2_WGM1_WGMXCC1_WGMXCCGn1
    SolutionIndex: 65
    SolutionNameMin: Cijk_Alik_Bjlk_BBS_BH_UserArgs_MT128x64x32_MI16x16x1_SN_LDSB0_CLR0_GSU0_GSUC0_GSUWGMRR0_K1_LBSPPA128_LBSPPB512_LPB32_MIWT4_2_PLR0_SU32_SUM0_SUS256_VWA2_VWB2_WGM1_WGMXCC1_WGMXCCGn1
    SolutionIndex: 66
    SolutionNameMin: Cijk_Alik_Bjlk_BBS_BH_UserArgs_MT128x64x32_MI16x16x1_SN_LDSB0_CLR0_GSU0_GSUC0_GSUWGMRR0_K1_LBSPPA128_LBSPPB512_LPB32_MIWT4_2_PLR0_SU32_SUM0_SUS256_VWA2_VWB2_WGM4_WGMXCC1_WGMXCCGn1
    SolutionIndex: 67
    SolutionNameMin: Cijk_Alik_Bjlk_BBS_BH_UserArgs_MT64x64x32_MI16x16x1_SN_LDSB0_CLR1_GSU0_GSUC0_GSUWGMRR0_K1_LBSPPA128_LBSPPB512_LPB32_MIWT2_2_PLR1_SU32_SUM0_SUS256_VWA2_VWB2_WGM1_WGMXCC1_WGMXCCGn1
    SolutionIndex: 68
    SolutionNameMin: Cijk_Alik_Bjlk_BBS_BH_UserArgs_MT32x32x32_MI16x16x1_SN_LDSB0_CLR1_GSU0_GSUC0_GSUWGMRR0_K1_LBSPPA128_LBSPPB256_LPB16_MIWT1_1_PLR1_SU32_SUM0_SUS256_VWA1_VWB1_WGM1_WGMXCC1_WGMXCCGn1
    SolutionIndex: 69
    SolutionNameMin: Cijk_Alik_Bjlk_BBS_BH_UserArgs_MT128x256x64_MI16x16x1_SN_LDSB1_CLR1_GSU0_GSUC0_GSUWGMRR0_K1_LBSPPA512_LBSPPB4096_LPB0_MIWT4_8_PLR1_SU32_SUM0_SUS256_VWA4_VWB4_WGM1_WGMXCC1_WGMXCCGn1
    SolutionIndex: 70
    SolutionNameMin: Cijk_Alik_Bjlk_BBS_BH_UserArgs_MT128x256x64_MI16x16x1_SN_LDSB1_CLR1_GSU0_GSUC0_GSUWGMRR0_K1_LBSPPA512_LBSPPB4096_LPB0_MIWT4_8_PLR1_SU32_SUM0_SUS256_VWA4_VWB4_WGM4_WGMXCC1_WGMXCCGn1
    SolutionIndex: 71
    SolutionNameMin: Cijk_Alik_Bjlk_BBS_BH_UserArgs_MT128x256x64_MI16x16x1_SN_LDSB1_CLR1_GSU0_GSUC0_GSUWGMRR0_K1_LBSPPA256_LBSPPB4096_LPB0_MIWT4_8_PLR1_SU32_SUM0_SUS256_VWA2_VWB4_WGM8_WGMXCC1_WGMXCCGn1
    SolutionIndex: 72
    SolutionNameMin: Cijk_Alik_Bjlk_BBS_BH_UserArgs_MT128x256x64_MI16x16x1_SN_LDSB1_CLR1_GSU0_GSUC0_GSUWGMRR0_K1_LBSPPA512_LBSPPB4096_LPB0_MIWT4_8_PLR1_SU32_SUM0_SUS256_VWA4_VWB4_WGM8_WGMXCC1_WGMXCCGn1
    SolutionIndex: 73
    SolutionNameMin: Cijk_Alik_Bjlk_BBS_BH_UserArgs_MT256x128x64_MI16x16x1_SN_LDSB1_CLR1_GSU0_GSUC0_GSUWGMRR0_K1_LBSPPA1024_LBSPPB2048_LPB0_MIWT8_4_PLR1_SU32_SUM0_SUS256_VWA8_VWB4_WGM1_WGMXCC1_WGMXCCGn1
    SolutionIndex: 74
    SolutionNameMin: Cijk_Alik_Bjlk_BBS_BH_UserArgs_MT256x128x64_MI16x16x1_SN_LDSB1_CLR1_GSU0_GSUC0_GSUWGMRR0_K1_LBSPPA512_LBSPPB2048_LPB0_MIWT8_4_PLR1_SU32_SUM0_SUS256_VWA4_VWB4_WGM4_WGMXCC1_WGMXCCGn1
    SolutionIndex: 75
    SolutionNameMin: Cijk_Alik_Bjlk_BBS_BH_UserArgs_MT256x128x64_MI16x16x1_SN_LDSB1_CLR1_GSU0_GSUC0_GSUWGMRR0_K1_LBSPPA1024_LBSPPB2048_LPB0_MIWT8_4_PLR1_SU32_SUM0_SUS256_VWA8_VWB4_WGM4_WGMXCC1_WGMXCCGn1
    SolutionIndex: 76
    SolutionNameMin: Cijk_Alik_Bjlk_BBS_BH_UserArgs_MT128x128x64_MI16x16x1_SN_LDSB1_CLR1_GSU0_GSUC0_GSUWGMRR0_K1_LBSPPA256_LBSPPB2048_LPB0_MIWT4_4_PLR1_SU32_SUM0_SUS256_VWA2_VWB4_WGM1_WGMXCC1_WGMXCCGn1
    SolutionIndex: 77
    SolutionNameMin: Cijk_Alik_Bjlk_BBS_BH_UserArgs_MT128x128x64_MI16x16x1_SN_LDSB1_CLR1_GSU0_GSUC0_GSUWGMRR0_K1_LBSPPA512_LBSPPB2048_LPB0_MIWT4_4_PLR1_SU32_SUM0_SUS256_VWA4_VWB4_WGM1_WGMXCC1_WGMXCCGn1
    SolutionIndex: 78
    SolutionNameMin: Cijk_Alik_Bjlk_BBS_BH_UserArgs_MT128x128x64_MI16x16x1_SN_LDSB1_CLR1_GSU0_GSUC0_GSUWGMRR0_K1_LBSPPA512_LBSPPB2048_LPB0_MIWT4_4_PLR1_SU32_SUM0_SUS256_VWA4_VWB4_WGM4_WGMXCC1_WGMXCCGn1
    SolutionIndex: 79
    SolutionNameMin: Cijk_Alik_Bjlk_BBS_BH_UserArgs_MT128x128x64_MI16x16x1_SN_LDSB1_CLR1_GSU0_GSUC0_GSUWGMRR0_K1_LBSPPA256_LBSPPB2048_LPB0_MIWT4_4_PLR1_SU32_SUM0_SUS256_VWA2_VWB4_WGM8_WGMXCC1_WGMXCCGn1
    SolutionIndex: 80
    SolutionNameMin: Cijk_Alik_Bjlk_BBS_BH_UserArgs_MT128x128x64_MI16x16x1_SN_LDSB1_CLR1_GSU0_GSUC0_GSUWGMRR0_K1_LBSPPA512_LBSPPB2048_LPB0_MIWT4_4_PLR1_SU32_SUM0_SUS256_VWA4_VWB4_WGM8_WGMXCC1_WGMXCCGn1
    SolutionIndex: 81
    SolutionNameMin: Cijk_Alik_Bjlk_BBS_BH_UserArgs_MT64x128x64_MI16x16x1_SN_LDSB1_CLR1_GSU0_GSUC0_GSUWGMRR0_K1_LBSPPA128_LBSPPB2048_LPB0_MIWT2_4_PLR1_SU32_SUM0_SUS256_VWA1_VWB4_WGM1_WGMXCC1_WGMXCCGn1
    SolutionIndex: 82
    SolutionNameMin: Cijk_Alik_Bjlk_BBS_BH_UserArgs_MT64x128x64_MI16x16x1_SN_LDSB1_CLR1_GSU0_GSUC0_GSUWGMRR0_K1_LBSPPA256_LBSPPB2048_LPB0_MIWT2_4_PLR1_SU32_SUM0_SUS256_VWA2_VWB4_WGM1_WGMXCC1_WGMXCCGn1
    SolutionIndex: 83
    SolutionNameMin: Cijk_Alik_Bjlk_BBS_BH_UserArgs_MT64x128x64_MI16x16x1_SN_LDSB1_CLR1_GSU0_GSUC0_GSUWGMRR0_K1_LBSPPA256_LBSPPB2048_LPB0_MIWT2_4_PLR1_SU32_SUM0_SUS256_VWA2_VWB4_WGM4_WGMXCC1_WGMXCCGn1
    SolutionIndex: 84
    SolutionNameMin: Cijk_Alik_Bjlk_BBS_BH_UserArgs_MT64x128x64_MI16x16x1_SN_LDSB1_CLR1_GSU0_GSUC0_GSUWGMRR0_K1_LBSPPA128_LBSPPB2048_LPB0_MIWT2_4_PLR1_SU32_SUM0_SUS256_VWA1_VWB4_WGM8_WGMXCC1_WGMXCCGn1
    SolutionIndex: 85
    SolutionNameMin: Cijk_Alik_Bjlk_BBS_BH_UserArgs_MT64x128x64_MI16x16x1_SN_LDSB1_CLR1_GSU0_GSUC0_GSUWGMRR0_K1_LBSPPA256_LBSPPB2048_LPB0_MIWT2_4_PLR1_SU32_SUM0_SUS256_VWA2_VWB4_WGM8_WGMXCC1_WGMXCCGn1
    SolutionIndex: 86
    SolutionNameMin: Cijk_Alik_Bjlk_BBS_BH_UserArgs_MT128x64x64_MI16x16x1_SN_LDSB1_CLR1_GSU0_GSUC0_GSUWGMRR0_K1_LBSPPA256_LBSPPB1024_LPB32_MIWT4_2_PLR1_SU32_SUM0_SUS256_VWA2_VWB2_WGM1_WGMXCC1_WGMXCCGn1
    SolutionIndex: 87
    SolutionNameMin: Cijk_Alik_Bjlk_BBS_BH_UserArgs_MT128x64x64_MI16x16x1_SN_LDSB1_CLR1_GSU0_GSUC0_GSUWGMRR0_K1_LBSPPA512_LBSPPB1024_LPB32_MIWT4_2_PLR1_SU32_SUM0_SUS256_VWA4_VWB2_WGM1_WGMXCC1_WGMXCCGn1
    SolutionIndex: 88
    SolutionNameMin: Cijk_Alik_Bjlk_BBS_BH_UserArgs_MT128x64x64_MI16x16x1_SN_LDSB1_CLR1_GSU0_GSUC0_GSUWGMRR0_K1_LBSPPA256_LBSPPB1024_LPB32_MIWT4_2_PLR1_SU32_SUM0_SUS256_VWA2_VWB2_WGM4_WGMXCC1_WGMXCCGn1
    SolutionIndex: 89
    SolutionNameMin: Cijk_Alik_Bjlk_BBS_BH_UserArgs_MT128x64x64_MI16x16x1_SN_LDSB1_CLR1_GSU0_GSUC0_GSUWGMRR0_K1_LBSPPA128_LBSPPB1024_LPB32_MIWT4_2_PLR1_SU32_SUM0_SUS256_VWA1_VWB2_WGM8_WGMXCC1_WGMXCCGn1
    SolutionIndex: 90
    SolutionNameMin: Cijk_Alik_Bjlk_BBS_BH_UserArgs_MT128x64x64_MI16x16x1_SN_LDSB1_CLR1_GSU0_GSUC0_GSUWGMRR0_K1_LBSPPA256_LBSPPB1024_LPB32_MIWT4_2_PLR1_SU32_SUM0_SUS256_VWA2_VWB2_WGM8_WGMXCC1_WGMXCCGn1
    SolutionIndex: 91
    SolutionNameMin: Cijk_Alik_Bjlk_BBS_BH_UserArgs_MT128x64x64_MI16x16x1_SN_LDSB1_CLR1_GSU0_GSUC0_GSUWGMRR0_K1_LBSPPA512_LBSPPB1024_LPB32_MIWT4_2_PLR1_SU32_SUM0_SUS256_VWA4_VWB2_WGM8_WGMXCC1_WGMXCCGn1
    SolutionIndex: 92
    SolutionNameMin: Cijk_Alik_Bjlk_BBS_BH_UserArgs_MT64x64x64_MI16x16x1_SN_LDSB1_CLR1_GSU0_GSUC0_GSUWGMRR0_K1_LBSPPA128_LBSPPB1024_LPB32_MIWT2_2_PLR1_SU32_SUM0_SUS256_VWA1_VWB2_WGM1_WGMXCC1_WGMXCCGn1
    SolutionIndex: 93
    SolutionNameMin: Cijk_Alik_Bjlk_BBS_BH_UserArgs_MT64x64x64_MI16x16x1_SN_LDSB1_CLR1_GSU0_GSUC0_GSUWGMRR0_K1_LBSPPA256_LBSPPB1024_LPB32_MIWT2_2_PLR1_SU32_SUM0_SUS256_VWA2_VWB2_WGM1_WGMXCC1_WGMXCCGn1
    SolutionIndex: 94
    SolutionNameMin: Cijk_Alik_Bjlk_BBS_BH_UserArgs_MT64x64x64_MI16x16x1_SN_LDSB1_CLR1_GSU0_GSUC0_GSUWGMRR0_K1_LBSPPA128_LBSPPB1024_LPB32_MIWT2_2_PLR1_SU32_SUM0_SUS256_VWA1_VWB2_WGM4_WGMXCC1_WGMXCCGn1
    SolutionIndex: 95
    SolutionNameMin: Cijk_Alik_Bjlk_BBS_BH_UserArgs_MT64x64x64_MI16x16x1_SN_LDSB1_CLR1_GSU0_GSUC0_GSUWGMRR0_K1_LBSPPA256_LBSPPB1024_LPB32_MIWT2_2_PLR1_SU32_SUM0_SUS256_VWA2_VWB2_WGM4_WGMXCC1_WGMXCCGn1
    SolutionIndex: 96
    SolutionNameMin: Cijk_Alik_Bjlk_BBS_BH_UserArgs_MT64x64x64_MI16x16x1_SN_LDSB1_CLR1_GSU0_GSUC0_GSUWGMRR0_K1_LBSPPA256_LBSPPB1024_LPB32_MIWT2_2_PLR2_SU32_SUM0_SUS256_VWA2_VWB2_WGM4_WGMXCC1_WGMXCCGn1
    SolutionIndex: 97
    SolutionNameMin: Cijk_Alik_Bjlk_BBS_BH_UserArgs_MT64x64x64_MI16x16x1_SN_LDSB1_CLR1_GSU0_GSUC0_GSUWGMRR0_K1_LBSPPA128_LBSPPB1024_LPB32_MIWT2_2_PLR1_SU32_SUM0_SUS256_VWA1_VWB2_WGM8_WGMXCC1_WGMXCCGn1
    SolutionIndex: 98
    SolutionNameMin: Cijk_Alik_Bjlk_BBS_BH_UserArgs_MT64x64x64_MI16x16x1_SN_LDSB1_CLR1_GSU0_GSUC0_GSUWGMRR0_K1_LBSPPA256_LBSPPB1024_LPB32_MIWT2_2_PLR1_SU32_SUM0_SUS256_VWA2_VWB2_WGM8_WGMXCC1_WGMXCCGn1
    SolutionIndex: 99
    SolutionNameMin: Cijk_Alik_Bjlk_BBS_BH_UserArgs_MT32x64x64_MI16x16x1_SN_LDSB0_CLR1_GSU0_GSUC0_GSUWGMRR0_K1_LBSPPA128_LBSPPB1024_LPB32_MIWT1_2_PLR1_SU32_SUM0_SUS256_VWA1_VWB2_WGM1_WGMXCC1_WGMXCCGn1
    SolutionIndex: 100
    SolutionNameMin: Cijk_Alik_Bjlk_BBS_BH_UserArgs_MT32x64x64_MI16x16x1_SN_LDSB0_CLR1_GSU0_GSUC0_GSUWGMRR0_K1_LBSPPA128_LBSPPB1024_LPB32_MIWT1_2_PLR2_SU32_SUM0_SUS256_VWA1_VWB2_WGM1_WGMXCC1_WGMXCCGn1
    SolutionIndex: 101
    SolutionNameMin: Cijk_Alik_Bjlk_BBS_BH_UserArgs_MT32x64x64_MI16x16x1_SN_LDSB0_CLR1_GSU0_GSUC0_GSUWGMRR0_K1_LBSPPA128_LBSPPB1024_LPB32_MIWT1_2_PLR1_SU32_SUM0_SUS256_VWA1_VWB2_WGM4_WGMXCC1_WGMXCCGn1
    SolutionIndex: 102
    SolutionNameMin: Cijk_Alik_Bjlk_BBS_BH_UserArgs_MT32x64x64_MI16x16x1_SN_LDSB0_CLR1_GSU0_GSUC0_GSUWGMRR0_K1_LBSPPA128_LBSPPB1024_LPB32_MIWT1_2_PLR2_SU32_SUM0_SUS256_VWA1_VWB2_WGM4_WGMXCC1_WGMXCCGn1
    SolutionIndex: 103
    SolutionNameMin: Cijk_Alik_Bjlk_BBS_BH_UserArgs_MT32x64x64_MI16x16x1_SN_LDSB0_CLR1_GSU0_GSUC0_GSUWGMRR0_K1_LBSPPA128_LBSPPB1024_LPB32_MIWT1_2_PLR1_SU32_SUM0_SUS256_VWA1_VWB2_WGM8_WGMXCC1_WGMXCCGn1
    SolutionIndex: 104
    SolutionNameMin: Cijk_Alik_Bjlk_BBS_BH_UserArgs_MT64x32x64_MI16x16x1_SN_LDSB0_CLR1_GSU0_GSUC0_GSUWGMRR0_K1_LBSPPA256_LBSPPB512_LPB16_MIWT2_1_PLR1_SU32_SUM0_SUS256_VWA2_VWB1_WGM1_WGMXCC1_WGMXCCGn1
    SolutionIndex: 105
    SolutionNameMin: Cijk_Alik_Bjlk_BBS_BH_UserArgs_MT64x128x128_MI16x16x1_SN_LDSB1_CLR1_GSU0_GSUC0_GSUWGMRR0_K1_LBSPPA512_LBSPPB2048_LPB0_MIWT2_4_PLR1_SU32_SUM0_SUS256_VWA2_VWB4_WGM1_WGMXCC1_WGMXCCGn1
    SolutionIndex: 106
    SolutionNameMin: Cijk_Alik_Bjlk_BBS_BH_UserArgs_MT64x128x128_MI16x16x1_SN_LDSB1_CLR1_GSU0_GSUC0_GSUWGMRR0_K1_LBSPPA512_LBSPPB2048_LPB0_MIWT2_4_PLR2_SU32_SUM0_SUS256_VWA2_VWB4_WGM1_WGMXCC1_WGMXCCGn1
    SolutionIndex: 107
    SolutionNameMin: Cijk_Alik_Bjlk_BBS_BH_UserArgs_MT64x128x128_MI16x16x1_SN_LDSB1_CLR1_GSU0_GSUC0_GSUWGMRR0_K1_LBSPPA512_LBSPPB2048_LPB0_MIWT2_4_PLR2_SU32_SUM0_SUS256_VWA2_VWB4_WGM4_WGMXCC1_WGMXCCGn1
    SolutionIndex: 108
    SolutionNameMin: Cijk_Alik_Bjlk_BBS_BH_UserArgs_MT64x128x128_MI16x16x1_SN_LDSB1_CLR1_GSU0_GSUC0_GSUWGMRR0_K1_LBSPPA256_LBSPPB2048_LPB0_MIWT2_4_PLR2_SU32_SUM0_SUS256_VWA1_VWB4_WGM8_WGMXCC1_WGMXCCGn1
    SolutionIndex: 109
    SolutionNameMin: Cijk_Alik_Bjlk_BBS_BH_UserArgs_MT64x128x128_MI16x16x1_SN_LDSB1_CLR1_GSU0_GSUC0_GSUWGMRR0_K1_LBSPPA512_LBSPPB2048_LPB0_MIWT2_4_PLR2_SU32_SUM0_SUS256_VWA2_VWB4_WGM8_WGMXCC1_WGMXCCGn1
    SolutionIndex: 110
    SolutionNameMin: Cijk_Alik_Bjlk_BBS_BH_UserArgs_MT128x64x128_MI16x16x1_SN_LDSB1_CLR1_GSU0_GSUC0_GSUWGMRR0_K1_LBSPPA1024_LBSPPB1024_LPB32_MIWT4_2_PLR2_SU32_SUM0_SUS256_VWA4_VWB2_WGM1_WGMXCC1_WGMXCCGn1
    SolutionIndex: 111
    SolutionNameMin: Cijk_Alik_Bjlk_BBS_BH_UserArgs_MT128x64x128_MI16x16x1_SN_LDSB1_CLR1_GSU0_GSUC0_GSUWGMRR0_K1_LBSPPA512_LBSPPB1024_LPB32_MIWT4_2_PLR2_SU32_SUM0_SUS256_VWA2_VWB2_WGM4_WGMXCC1_WGMXCCGn1
    SolutionIndex: 112
    SolutionNameMin: Cijk_Alik_Bjlk_BBS_BH_UserArgs_MT128x64x128_MI16x16x1_SN_LDSB1_CLR1_GSU0_GSUC0_GSUWGMRR0_K1_LBSPPA1024_LBSPPB1024_LPB32_MIWT4_2_PLR2_SU32_SUM0_SUS256_VWA4_VWB2_WGM4_WGMXCC1_WGMXCCGn1
    SolutionIndex: 113
    SolutionNameMin: Cijk_Alik_Bjlk_BBS_BH_UserArgs_MT64x64x128_MI16x16x1_SN_LDSB1_CLR1_GSU0_GSUC0_GSUWGMRR0_K1_LBSPPA256_LBSPPB1024_LPB32_MIWT2_2_PLR2_SU32_SUM0_SUS256_VWA1_VWB2_WGM1_WGMXCC1_WGMXCCGn1
    SolutionIndex: 114
    SolutionNameMin: Cijk_Alik_Bjlk_BBS_BH_UserArgs_MT64x64x128_MI16x16x1_SN_LDSB1_CLR1_GSU0_GSUC0_GSUWGMRR0_K1_LBSPPA512_LBSPPB1024_LPB32_MIWT2_2_PLR2_SU32_SUM0_SUS256_VWA2_VWB2_WGM1_WGMXCC1_WGMXCCGn1
    SolutionIndex: 115
    SolutionNameMin: Cijk_Alik_Bjlk_BBS_BH_UserArgs_MT64x64x128_MI16x16x1_SN_LDSB1_CLR1_GSU0_GSUC0_GSUWGMRR0_K1_LBSPPA512_LBSPPB1024_LPB32_MIWT2_2_PLR1_SU32_SUM0_SUS256_VWA2_VWB2_WGM4_WGMXCC1_WGMXCCGn1
    SolutionIndex: 116
    SolutionNameMin: Cijk_Alik_Bjlk_BBS_BH_UserArgs_MT32x64x128_MI16x16x1_SN_LDSB1_CLR1_GSU0_GSUC0_GSUWGMRR0_K1_LBSPPA256_LBSPPB1024_LPB32_MIWT1_2_PLR1_SU32_SUM0_SUS256_VWA1_VWB2_WGM1_WGMXCC1_WGMXCCGn1
    SolutionIndex: 117
    SolutionNameMin: Cijk_Alik_Bjlk_BBS_BH_UserArgs_MT32x64x128_MI16x16x1_SN_LDSB1_CLR1_GSU0_GSUC0_GSUWGMRR0_K1_LBSPPA256_LBSPPB1024_LPB16_MIWT1_2_PLR2_SU32_SUM0_SUS256_VWA1_VWB1_WGM1_WGMXCC1_WGMXCCGn1
    SolutionIndex: 118
    SolutionNameMin: Cijk_Alik_Bjlk_BBS_BH_UserArgs_MT32x64x128_MI16x16x1_SN_LDSB1_CLR1_GSU0_GSUC0_GSUWGMRR0_K1_LBSPPA256_LBSPPB1024_LPB32_MIWT1_2_PLR2_SU32_SUM0_SUS256_VWA1_VWB2_WGM1_WGMXCC1_WGMXCCGn1
    SolutionIndex: 119
    SolutionNameMin: Cijk_Alik_Bjlk_BBS_BH_UserArgs_MT32x64x128_MI16x16x1_SN_LDSB1_CLR1_GSU0_GSUC0_GSUWGMRR0_K1_LBSPPA256_LBSPPB1024_LPB32_MIWT1_2_PLR1_SU32_SUM0_SUS256_VWA1_VWB2_WGM4_WGMXCC1_WGMXCCGn1
    SolutionIndex: 120
    SolutionNameMin: Cijk_Alik_Bjlk_BBS_BH_UserArgs_MT32x64x128_MI16x16x1_SN_LDSB1_CLR1_GSU0_GSUC0_GSUWGMRR0_K1_LBSPPA256_LBSPPB1024_LPB32_MIWT1_2_PLR2_SU32_SUM0_SUS256_VWA1_VWB2_WGM4_WGMXCC1_WGMXCCGn1
    SolutionIndex: 121
    SolutionNameMin: Cijk_Alik_Bjlk_BBS_BH_UserArgs_MT32x64x128_MI16x16x1_SN_LDSB1_CLR1_GSU0_GSUC0_GSUWGMRR0_K1_LBSPPA256_LBSPPB1024_LPB16_MIWT1_2_PLR2_SU32_SUM0_SUS256_VWA1_VWB1_WGM8_WGMXCC1_WGMXCCGn1
    SolutionIndex: 122
    SolutionNameMin: Cijk_Alik_Bjlk_BBS_BH_UserArgs_MT32x64x128_MI16x16x1_SN_LDSB1_CLR1_GSU0_GSUC0_GSUWGMRR0_K1_LBSPPA256_LBSPPB1024_LPB32_MIWT1_2_PLR2_SU32_SUM0_SUS256_VWA1_VWB2_WGM8_WGMXCC1_WGMXCCGn1
    SolutionIndex: 123
    SolutionNameMin: Cijk_Alik_Bjlk_BBS_BH_UserArgs_MT64x32x128_MI16x16x1_SN_LDSB1_CLR1_GSU0_GSUC0_GSUWGMRR0_K1_LBSPPA256_LBSPPB512_LPB16_MIWT2_1_PLR1_SU32_SUM0_SUS256_VWA1_VWB1_WGM1_WGMXCC1_WGMXCCGn1
    SolutionIndex: 124
    SolutionNameMin: Cijk_Alik_Bjlk_BBS_BH_UserArgs_MT64x32x128_MI16x16x1_SN_LDSB1_CLR1_GSU0_GSUC0_GSUWGMRR0_K1_LBSPPA256_LBSPPB512_LPB16_MIWT2_1_PLR2_SU32_SUM0_SUS256_VWA1_VWB1_WGM1_WGMXCC1_WGMXCCGn1
    SolutionIndex: 125
    SolutionNameMin: Cijk_Alik_Bjlk_BBS_BH_UserArgs_MT64x32x128_MI16x16x1_SN_LDSB1_CLR1_GSU0_GSUC0_GSUWGMRR0_K1_LBSPPA512_LBSPPB512_LPB16_MIWT2_1_PLR1_SU32_SUM0_SUS256_VWA2_VWB1_WGM8_WGMXCC1_WGMXCCGn1
    SolutionIndex: 126
    SolutionNameMin: Cijk_Alik_Bjlk_BBS_BH_UserArgs_MT32x32x128_MI16x16x1_SN_LDSB1_CLR1_GSU0_GSUC0_GSUWGMRR0_K1_LBSPPA256_LBSPPB512_LPB16_MIWT1_1_PLR1_SU32_SUM0_SUS256_VWA1_VWB1_WGM1_WGMXCC1_WGMXCCGn1
    SolutionIndex: 127
    SolutionNameMin: Cijk_Alik_Bjlk_BBS_BH_UserArgs_MT32x32x128_MI16x16x1_SN_LDSB1_CLR1_GSU0_GSUC0_GSUWGMRR0_K1_LBSPPA256_LBSPPB512_LPB16_MIWT1_1_PLR2_SU32_SUM0_SUS256_VWA1_VWB1_WGM1_WGMXCC1_WGMXCCGn1
    SolutionIndex: 128
    SolutionNameMin: Cijk_Alik_Bjlk_BBS_BH_UserArgs_MT32x32x128_MI16x16x1_SN_LDSB1_CLR1_GSU0_GSUC0_GSUWGMRR0_K1_LBSPPA256_LBSPPB512_LPB16_MIWT1_1_PLR1_SU32_SUM0_SUS256_VWA1_VWB1_WGM4_WGMXCC1_WGMXCCGn1
    SolutionIndex: 129
    SolutionNameMin: Cijk_Alik_Bjlk_BBS_BH_UserArgs_MT32x32x128_MI16x16x1_SN_LDSB1_CLR1_GSU0_GSUC0_GSUWGMRR0_K1_LBSPPA256_LBSPPB512_LPB16_MIWT1_1_PLR1_SU32_SUM0_SUS256_VWA1_VWB1_WGM8_WGMXCC1_WGMXCCGn1
    SolutionIndex: 130
    SolutionNameMin: Cijk_Alik_Bjlk_BBS_BH_UserArgs_MT32x32x128_MI16x16x1_SN_LDSB1_CLR1_GSU0_GSUC0_GSUWGMRR0_K1_LBSPPA256_LBSPPB512_LPB16_MIWT1_1_PLR2_SU32_SUM0_SUS256_VWA1_VWB1_WGM8_WGMXCC1_WGMXCCGn1
    SolutionIndex: 131
    SolutionNameMin: Cijk_Alik_Bjlk_BBS_BH_UserArgs_MT32x32x32_MI16x16x1_SN_LDSB0_CLR1_GSU0_GSUC0_GSUWGMRR0_K1_LBSPPA128_LBSPPB256_LPB16_MIWT1_1_PLR1_SU32_SUM0_SUS256_VWA1_VWB1_WGM8_WGMXCC1_WGMXCCGn1
- - - [128, 128, 1, 128, 128, 128, 128, 128]
    - [128, 0.083]
  - - [128, 128, 1, 256, 128, 128, 256, 128]
    - [126, 0.101]
  - - [128, 128, 1, 512, 128, 128, 512, 128]
    - [128, 0.17]
  - - [128, 128, 1, 1024, 128, 128, 1024, 128]
    - [126, 0.291]
  - - [128, 128, 1, 2048, 128, 128, 2048, 128]
    - [68, 0.516]
  - - [128, 128, 1, 4096, 128, 128, 4096, 128]
    - [99, 0.811]
  - - [128, 128, 1, 8192, 128, 128, 8192, 128]
    - [118, 1.264]
  - - [128, 256, 1, 128, 128, 128, 128, 256]
    - [121, 0.158]
  - - [128, 256, 1, 256, 128, 128, 256, 256]
    - [127, 0.245]
  - - [128, 256, 1, 512, 128, 128, 512, 256]
    - [117, 0.33]
  - - [128, 256, 1, 1024, 128, 128, 1024, 256]
    - [126, 0.586]
  - - [128, 256, 1, 2048, 128, 128, 2048, 256]
    - [118, 0.906]
  - - [128, 256, 1, 4096, 128, 128, 4096, 256]
    - [99, 1.378]
  - - [128, 256, 1, 8192, 128, 128, 8192, 256]
    - [119, 1.922]
  - - [128, 512, 1, 128, 128, 128, 128, 512]
    - [114, 0.303]
  - - [128, 512, 1, 256, 128, 128, 256, 512]
    - [130, 0.489]
  - - [128, 512, 1, 512, 128, 128, 512, 512]
    - [128, 0.776]
  - - [128, 512, 1, 1024, 128, 128, 1024, 512]
    - [130, 1.066]
  - - [128, 512, 1, 2048, 128, 128, 2048, 512]
    - [118, 1.499]
  - - [128, 512, 1, 4096, 128, 128, 4096, 512]
    - [97, 2.368]
  - - [128, 512, 1, 8192, 128, 128, 8192, 512]
    - [61, 2.668]
  - - [128, 1024, 1, 128, 128, 128, 128, 1024]
    - [102, 0.529]
  - - [128, 1024, 1, 256, 128, 128, 256, 1024]
    - [99, 0.886]
  - - [128, 1024, 1, 512, 128, 128, 512, 1024]
    - [123, 1.348]
  - - [128, 1024, 1, 1024, 128, 128, 1024, 1024]
    - [118, 1.924]
  - - [128, 1024, 1, 2048, 128, 128, 2048, 1024]
    - [62, 2.113]
  - - [128, 1024, 1, 4096, 128, 128, 4096, 1024]
    - [87, 3.144]
  - - [128, 1024, 1, 8192, 128, 128, 8192, 1024]
    - [108, 3.379]
  - - [128, 2048, 1, 128, 128, 128, 128, 2048]
    - [97, 0.934]
  - - [128, 2048, 1, 256, 128, 128, 256, 2048]
    - [94, 1.544]
  - - [128, 2048, 1, 512, 128, 128, 512, 2048]
    - [97, 2.291]
  - - [128, 2048, 1, 1024, 128, 128, 1024, 2048]
    - [82, 2.491]
  - - [128, 2048, 1, 2048, 128, 128, 2048, 2048]
    - [81, 2.925]
  - - [128, 2048, 1, 4096, 128, 128, 4096, 2048]
    - [82, 3.615]
  - - [128, 2048, 1, 8192, 128, 128, 8192, 2048]
    - [25, 4.521]
  - - [128, 4096, 1, 128, 128, 128, 128, 4096]
    - [66, 1.524]
  - - [128, 4096, 1, 256, 128, 128, 256, 4096]
    - [82, 2.388]
  - - [128, 4096, 1, 512, 128, 128, 512, 4096]
    - [81, 3.145]
  - - [128, 4096, 1, 1024, 128, 128, 1024, 4096]
    - [109, 3.597]
  - - [128, 4096, 1, 2048, 128, 128, 2048, 4096]
    - [92, 3.665]
  - - [128, 4096, 1, 4096, 128, 128, 4096, 4096]
    - [83, 4.322]
  - - [128, 4096, 1, 8192, 128, 128, 8192, 4096]
    - [13, 5.01]
  - - [128, 8192, 1, 128, 128, 128, 128, 8192]
    - [45, 2.103]
  - - [128, 8192, 1, 256, 128, 128, 256, 8192]
    - [47, 2.981]
  - - [128, 8192, 1, 512, 128, 128, 512, 8192]
    - [91, 3.648]
  - - [128, 8192, 1, 1024, 128, 128, 1024, 8192]
    - [96, 4.13]
  - - [128, 8192, 1, 2048, 128, 128, 2048, 8192]
    - [93, 4.938]
  - - [128, 8192, 1, 4096, 128, 128, 4096, 8192]
    - [26, 5.219]
  - - [128, 8192, 1, 8192, 128, 128, 8192, 8192]
    - [16, 5.562]
  - - [256, 128, 1, 128, 256, 256, 128, 128]
    - [126, 0.165]
  - - [256, 128, 1, 256, 256, 256, 256, 128]
    - [127, 0.237]
  - - [256, 128, 1, 512, 256, 256, 512, 128]
    - [129, 0.322]
  - - [256, 128, 1, 1024, 256, 256, 1024, 128]
    - [126, 0.567]
  - - [256, 128, 1, 2048, 256, 256, 2048, 128]
    - [124, 0.896]
  - - [256, 128, 1, 4096, 256, 256, 4096, 128]
    - [101, 1.357]
  - - [256, 128, 1, 8192, 256, 256, 8192, 128]
    - [120, 2.039]
  - - [256, 256, 1, 128, 256, 256, 128, 256]
    - [125, 0.322]
  - - [256, 256, 1, 256, 256, 256, 256, 256]
    - [130, 0.502]
  - - [256, 256, 1, 512, 256, 256, 512, 256]
    - [126, 0.786]
  - - [256, 256, 1, 1024, 256, 256, 1024, 256]
    - [130, 1.106]
  - - [256, 256, 1, 2048, 256, 256, 2048, 256]
    - [120, 1.5]
  - - [256, 256, 1, 4096, 256, 256, 4096, 256]
    - [92, 2.279]
  - - [256, 256, 1, 8192, 256, 256, 8192, 256]
    - [61, 2.736]
  - - [256, 512, 1, 128, 256, 256, 128, 512]
    - [115, 0.545]
  - - [256, 512, 1, 256, 256, 256, 256, 512]
    - [100, 0.896]
  - - [256, 512, 1, 512, 256, 256, 512, 512]
    - [118, 1.385]
  - - [256, 512, 1, 1024, 256, 256, 1024, 512]
    - [118, 1.954]
  - - [256, 512, 1, 2048, 256, 256, 2048, 512]
    - [60, 2.219]
  - - [256, 512, 1, 4096, 256, 256, 4096, 512]
    - [85, 3.322]
  - - [256, 512, 1, 8192, 256, 256, 8192, 512]
    - [57, 3.672]
  - - [256, 1024, 1, 128, 256, 256, 128, 1024]
    - [105, 0.983]
  - - [256, 1024, 1, 256, 256, 256, 256, 1024]
    - [93, 1.593]
  - - [256, 1024, 1, 512, 256, 256, 512, 1024]
    - [93, 2.193]
  - - [256, 1024, 1, 1024, 256, 256, 1024, 1024]
    - [85, 2.53]
  - - [256, 1024, 1, 2048, 256, 256, 2048, 1024]
    - [53, 3.059]
  - - [256, 1024, 1, 4096, 256, 256, 4096, 1024]
    - [82, 3.703]
  - - [256, 1024, 1, 8192, 256, 256, 8192, 1024]
    - [26, 4.806]
  - - [256, 2048, 1, 128, 256, 256, 128, 2048]
    - [65, 1.54]
  - - [256, 2048, 1, 256, 256, 256, 256, 2048]
    - [86, 2.438]
  - - [256, 2048, 1, 512, 256, 256, 512, 2048]
    - [86, 3.329]
  - - [256, 2048, 1, 1024, 256, 256, 1024, 2048]
    - [106, 3.61]
  - - [256, 2048, 1, 2048, 256, 256, 2048, 2048]
    - [18, 4.024]
  - - [256, 2048, 1, 4096, 256, 256, 4096, 2048]
    - [69, 4.219]
  - - [256, 2048, 1, 8192, 256, 256, 8192, 2048]
    - [22, 5.335]
  - - [256, 4096, 1, 128, 256, 256, 128, 4096]
    - [57, 1.95]
  - - [256, 4096, 1, 256, 256, 256, 256, 4096]
    - [44, 2.881]
  - - [256, 4096, 1, 512, 256, 256, 512, 4096]
    - [85, 3.691]
  - - [256, 4096, 1, 1024, 256, 256, 1024, 4096]
    - [93, 4.432]
  - - [256, 4096, 1, 2048, 256, 256, 2048, 4096]
    - [93, 4.96]
  - - [256, 4096, 1, 4096, 256, 256, 4096, 4096]
    - [32, 5.192]
  - - [256, 4096, 1, 8192, 256, 256, 8192, 4096]
    - [75, 5.72]
  - - [256, 8192, 1, 128, 256, 256, 128, 8192]
    - [38, 2.845]
  - - [256, 8192, 1, 256, 256, 256, 256, 8192]
    - [15, 4.032]
  - - [256, 8192, 1, 512, 256, 256, 512, 8192]
    - [73, 4.671]
  - - [256, 8192, 1, 1024, 256, 256, 1024, 8192]
    - [88, 5.369]
  - - [256, 8192, 1, 2048, 256, 256, 2048, 8192]
    - [87, 6.072]
  - - [256, 8192, 1, 4096, 256, 256, 4096, 8192]
    - [111, 5.501]
  - - [256, 8192, 1, 8192, 256, 256, 8192, 8192]
    - [25, 6.885]
  - - [512, 128, 1, 128, 512, 512, 128, 128]
    - [117, 0.305]
  - - [512, 128, 1, 256, 512, 512, 256, 128]
    - [127, 0.496]
  - - [512, 128, 1, 512, 512, 512, 512, 128]
    - [130, 0.774]
  - - [512, 128, 1, 1024, 512, 512, 1024, 128]
    - [126, 1.091]
  - - [512, 128, 1, 2048, 512, 512, 2048, 128]
    - [116, 1.52]
  - - [512, 128, 1, 4096, 512, 512, 4096, 128]
    - [92, 2.409]
  - - [512, 128, 1, 8192, 512, 512, 8192, 128]
    - [63, 2.719]
  - - [512, 256, 1, 128, 512, 512, 128, 256]
    - [99, 0.592]
  - - [512, 256, 1, 256, 512, 512, 256, 256]
    - [122, 0.95]
  - - [512, 256, 1, 512, 512, 512, 512, 256]
    - [103, 1.385]
  - - [512, 256, 1, 1024, 512, 512, 1024, 256]
    - [116, 1.912]
  - - [512, 256, 1, 2048, 512, 512, 2048, 256]
    - [58, 2.34]
  - - [512, 256, 1, 4096, 512, 512, 4096, 256]
    - [89, 3.27]
  - - [512, 256, 1, 8192, 512, 512, 8192, 256]
    - [112, 3.631]
  - - [512, 512, 1, 128, 512, 512, 128, 512]
    - [93, 1.023]
  - - [512, 512, 1, 256, 512, 512, 256, 512]
    - [93, 1.663]
  - - [512, 512, 1, 512, 512, 512, 512, 512]
    - [92, 2.364]
  - - [512, 512, 1, 1024, 512, 512, 1024, 512]
    - [113, 2.506]
  - - [512, 512, 1, 2048, 512, 512, 2048, 512]
    - [53, 3.031]
  - - [512, 512, 1, 4096, 512, 512, 4096, 512]
    - [78, 3.662]
  - - [512, 512, 1, 8192, 512, 512, 8192, 512]
    - [29, 4.725]
  - - [512, 1024, 1, 128, 512, 512, 128, 1024]
    - [86, 1.648]
  - - [512, 1024, 1, 256, 512, 512, 256, 1024]
    - [58, 2.488]
  - - [512, 1024, 1, 512, 512, 512, 512, 1024]
    - [90, 3.422]
  - - [512, 1024, 1, 1024, 512, 512, 1024, 1024]
    - [106, 3.696]
  - - [512, 1024, 1, 2048, 512, 512, 2048, 1024]
    - [25, 4.055]
  - - [512, 1024, 1, 4096, 512, 512, 4096, 1024]
    - [82, 4.438]
  - - [512, 1024, 1, 8192, 512, 512, 8192, 1024]
    - [22, 5.599]
  - - [512, 2048, 1, 128, 512, 512, 128, 2048]
    - [47, 2.037]
  - - [512, 2048, 1, 256, 512, 512, 256, 2048]
    - [50, 2.979]
  - - [512, 2048, 1, 512, 512, 512, 512, 2048]
    - [79, 3.847]
  - - [512, 2048, 1, 1024, 512, 512, 1024, 2048]
    - [93, 4.448]
  - - [512, 2048, 1, 2048, 512, 512, 2048, 2048]
    - [93, 5.037]
  - - [512, 2048, 1, 4096, 512, 512, 4096, 2048]
    - [18, 5.411]
  - - [512, 2048, 1, 8192, 512, 512, 8192, 2048]
    - [74, 5.999]
  - - [512, 4096, 1, 128, 512, 512, 128, 4096]
    - [33, 2.866]
  - - [512, 4096, 1, 256, 512, 512, 256, 4096]
    - [15, 4.133]
  - - [512, 4096, 1, 512, 512, 512, 512, 4096]
    - [82, 4.687]
  - - [512, 4096, 1, 1024, 512, 512, 1024, 4096]
    - [83, 5.57]
  - - [512, 4096, 1, 2048, 512, 512, 2048, 4096]
    - [85, 6.18]
  - - [512, 4096, 1, 4096, 512, 512, 4096, 4096]
    - [19, 5.81]
  - - [512, 4096, 1, 8192, 512, 512, 8192, 4096]
    - [23, 6.366]
  - - [512, 8192, 1, 128, 512, 512, 128, 8192]
    - [56, 3.256]
  - - [512, 8192, 1, 256, 512, 512, 256, 8192]
    - [57, 4.675]
  - - [512, 8192, 1, 512, 512, 512, 512, 8192]
    - [55, 6.043]
  - - [512, 8192, 1, 1024, 512, 512, 1024, 8192]
    - [47, 7.275]
  - - [512, 8192, 1, 2048, 512, 512, 2048, 8192]
    - [78, 6.743]
  - - [512, 8192, 1, 4096, 512, 512, 4096, 8192]
    - [32, 6.933]
  - - [512, 8192, 1, 8192, 512, 512, 8192, 8192]
    - [24, 7.202]
  - - [1024, 128, 1, 128, 1024, 1024, 128, 128]
    - [104, 0.6]
  - - [1024, 128, 1, 256, 1024, 1024, 256, 128]
    - [118, 0.949]
  - - [1024, 128, 1, 512, 1024, 1024, 512, 128]
    - [99, 1.465]
  - - [1024, 128, 1, 1024, 1024, 1024, 1024, 128]
    - [122, 1.884]
  - - [1024, 128, 1, 2048, 1024, 1024, 2048, 128]
    - [59, 2.268]
  - - [1024, 128, 1, 4096, 1024, 1024, 4096, 128]
    - [85, 3.38]
  - - [1024, 128, 1, 8192, 1024, 1024, 8192, 128]
    - [83, 3.626]
  - - [1024, 256, 1, 128, 1024, 1024, 128, 256]
    - [67, 1.025]
  - - [1024, 256, 1, 256, 1024, 1024, 256, 256]
    - [67, 1.682]
  - - [1024, 256, 1, 512, 1024, 1024, 512, 256]
    - [95, 2.423]
  - - [1024, 256, 1, 1024, 1024, 1024, 1024, 256]
    - [91, 2.633]
  - - [1024, 256, 1, 2048, 1024, 1024, 2048, 256]
    - [57, 2.989]
  - - [1024, 256, 1, 4096, 1024, 1024, 4096, 256]
    - [77, 3.619]
  - - [1024, 256, 1, 8192, 1024, 1024, 8192, 256]
    - [14, 4.309]
  - - [1024, 512, 1, 128, 1024, 1024, 128, 512]
    - [64, 1.565]
  - - [1024, 512, 1, 256, 1024, 1024, 256, 512]
    - [58, 2.467]
  - - [1024, 512, 1, 512, 1024, 1024, 512, 512]
    - [86, 3.514]
  - - [1024, 512, 1, 1024, 1024, 1024, 1024, 512]
    - [110, 3.619]
  - - [1024, 512, 1, 2048, 1024, 1024, 2048, 512]
    - [25, 3.867]
  - - [1024, 512, 1, 4096, 1024, 1024, 4096, 512]
    - [69, 4.365]
  - - [1024, 512, 1, 8192, 1024, 1024, 8192, 512]
    - [22, 5.565]
  - - [1024, 1024, 1, 128, 1024, 1024, 128, 1024]
    - [49, 2.03]
  - - [1024, 1024, 1, 256, 1024, 1024, 256, 1024]
    - [52, 3.053]
  - - [1024, 1024, 1, 512, 1024, 1024, 512, 1024]
    - [87, 3.801]
  - - [1024, 1024, 1, 1024, 1024, 1024, 1024, 1024]
    - [93, 4.459]
  - - [1024, 1024, 1, 2048, 1024, 1024, 2048, 1024]
    - [95, 4.809]
  - - [1024, 1024, 1, 4096, 1024, 1024, 4096, 1024]
    - [19, 5.458]
  - - [1024, 1024, 1, 8192, 1024, 1024, 8192, 1024]
    - [19, 6.054]
  - - [1024, 2048, 1, 128, 1024, 1024, 128, 2048]
    - [35, 2.871]
  - - [1024, 2048, 1, 256, 1024, 1024, 256, 2048]
    - [37, 4.14]
  - - [1024, 2048, 1, 512, 1024, 1024, 512, 2048]
    - [87, 4.648]
  - - [1024, 2048, 1, 1024, 1024, 1024, 1024, 2048]
    - [86, 5.571]
  - - [1024, 2048, 1, 2048, 1024, 1024, 2048, 2048]
    - [82, 6.097]
  - - [1024, 2048, 1, 4096, 1024, 1024, 4096, 2048]
    - [109, 5.71]
  - - [1024, 2048, 1, 8192, 1024, 1024, 8192, 2048]
    - [29, 6.751]
  - - [1024, 4096, 1, 128, 1024, 1024, 128, 4096]
    - [35, 3.224]
  - - [1024, 4096, 1, 256, 1024, 1024, 256, 4096]
    - [47, 4.747]
  - - [1024, 4096, 1, 512, 1024, 1024, 512, 4096]
    - [53, 6.077]
  - - [1024, 4096, 1, 1024, 1024, 1024, 1024, 4096]
    - [51, 6.718]
  - - [1024, 4096, 1, 2048, 1024, 1024, 2048, 4096]
    - [79, 6.91]
  - - [1024, 4096, 1, 4096, 1024, 1024, 4096, 4096]
    - [29, 7.09]
  - - [1024, 4096, 1, 8192, 1024, 1024, 8192, 4096]
    - [31, 7.511]
  - - [1024, 8192, 1, 128, 1024, 1024, 128, 8192]
    - [35, 3.9]
  - - [1024, 8192, 1, 256, 1024, 1024, 256, 8192]
    - [35, 5.698]
  - - [1024, 8192, 1, 512, 1024, 1024, 512, 8192]
    - [15, 7.206]
  - - [1024, 8192, 1, 1024, 1024, 1024, 1024, 8192]
    - [17, 8.29]
  - - [1024, 8192, 1, 2048, 1024, 1024, 2048, 8192]
    - [69, 7.896]
  - - [1024, 8192, 1, 4096, 1024, 1024, 4096, 8192]
    - [17, 7.653]
  - - [1024, 8192, 1, 8192, 1024, 1024, 8192, 8192]
    - [4, 7.663]
  - - [2048, 128, 1, 128, 2048, 2048, 128, 128]
    - [67, 1.053]
  - - [2048, 128, 1, 256, 2048, 2048, 256, 128]
    - [95, 1.696]
  - - [2048, 128, 1, 512, 2048, 2048, 512, 128]
    - [95, 2.392]
  - - [2048, 128, 1, 1024, 2048, 2048, 1024, 128]
    - [87, 2.528]
  - - [2048, 128, 1, 2048, 2048, 2048, 2048, 128]
    - [82, 2.905]
  - - [2048, 128, 1, 4096, 2048, 2048, 4096, 128]
    - [82, 3.74]
  - - [2048, 128, 1, 8192, 2048, 2048, 8192, 128]
    - [83, 4.563]
  - - [2048, 256, 1, 128, 2048, 2048, 128, 256]
    - [65, 1.615]
  - - [2048, 256, 1, 256, 2048, 2048, 256, 256]
    - [87, 2.512]
  - - [2048, 256, 1, 512, 2048, 2048, 512, 256]
    - [85, 3.357]
  - - [2048, 256, 1, 1024, 2048, 2048, 1024, 256]
    - [107, 3.471]
  - - [2048, 256, 1, 2048, 2048, 2048, 2048, 256]
    - [32, 3.925]
  - - [2048, 256, 1, 4096, 2048, 2048, 4096, 256]
    - [82, 4.393]
  - - [2048, 256, 1, 8192, 2048, 2048, 8192, 256]
    - [25, 5.596]
  - - [2048, 512, 1, 128, 2048, 2048, 128, 512]
    - [53, 2.065]
  - - [2048, 512, 1, 256, 2048, 2048, 256, 512]
    - [47, 3.183]
  - - [2048, 512, 1, 512, 2048, 2048, 512, 512]
    - [82, 3.85]
  - - [2048, 512, 1, 1024, 2048, 2048, 1024, 512]
    - [98, 4.432]
  - - [2048, 512, 1, 2048, 2048, 2048, 2048, 512]
    - [83, 4.883]
  - - [2048, 512, 1, 4096, 2048, 2048, 4096, 512]
    - [32, 5.496]
  - - [2048, 512, 1, 8192, 2048, 2048, 8192, 512]
    - [29, 6.283]
  - - [2048, 1024, 1, 128, 2048, 2048, 128, 1024]
    - [33, 2.861]
  - - [2048, 1024, 1, 256, 2048, 2048, 256, 1024]
    - [17, 4.115]
  - - [2048, 1024, 1, 512, 2048, 2048, 512, 1024]
    - [82, 4.645]
  - - [2048, 1024, 1, 1024, 2048, 2048, 1024, 1024]
    - [85, 5.391]
  - - [2048, 1024, 1, 2048, 2048, 2048, 2048, 1024]
    - [83, 6.012]
  - - [2048, 1024, 1, 4096, 2048, 2048, 4096, 1024]
    - [29, 6.015]
  - - [2048, 1024, 1, 8192, 2048, 2048, 8192, 1024]
    - [19, 6.81]
  - - [2048, 2048, 1, 128, 2048, 2048, 128, 2048]
    - [57, 3.081]
  - - [2048, 2048, 1, 256, 2048, 2048, 256, 2048]
    - [15, 4.475]
  - - [2048, 2048, 1, 512, 2048, 2048, 512, 2048]
    - [46, 5.792]
  - - [2048, 2048, 1, 1024, 2048, 2048, 1024, 2048]
    - [42, 6.28]
  - - [2048, 2048, 1, 2048, 2048, 2048, 2048, 2048]
    - [79, 6.85]
  - - [2048, 2048, 1, 4096, 2048, 2048, 4096, 2048]
    - [22, 6.744]
  - - [2048, 2048, 1, 8192, 2048, 2048, 8192, 2048]
    - [16, 7.119]
  - - [2048, 4096, 1, 128, 2048, 2048, 128, 4096]
    - [34, 3.77]
  - - [2048, 4096, 1, 256, 2048, 2048, 256, 4096]
    - [35, 5.494]
  - - [2048, 4096, 1, 512, 2048, 2048, 512, 4096]
    - [17, 7.0]
  - - [2048, 4096, 1, 1024, 2048, 2048, 1024, 4096]
    - [28, 8.202]
  - - [2048, 4096, 1, 2048, 2048, 2048, 2048, 4096]
    - [69, 7.836]
  - - [2048, 4096, 1, 4096, 2048, 2048, 4096, 4096]
    - [25, 7.547]
  - - [2048, 4096, 1, 8192, 2048, 2048, 8192, 4096]
    - [24, 7.605]
  - - [2048, 8192, 1, 128, 2048, 2048, 128, 8192]
    - [11, 3.235]
  - - [2048, 8192, 1, 256, 2048, 2048, 256, 8192]
    - [12, 4.724]
  - - [2048, 8192, 1, 512, 2048, 2048, 512, 8192]
    - [5, 6.464]
  - - [2048, 8192, 1, 1024, 2048, 2048, 1024, 8192]
    - [8, 7.683]
  - - [2048, 8192, 1, 2048, 2048, 2048, 2048, 8192]
    - [28, 7.515]
  - - [2048, 8192, 1, 4096, 2048, 2048, 4096, 8192]
    - [28, 7.662]
  - - [2048, 8192, 1, 8192, 2048, 2048, 8192, 8192]
    - [17, 7.48]
  - - [4096, 128, 1, 128, 4096, 4096, 128, 128]
    - [87, 1.654]
  - - [4096, 128, 1, 256, 4096, 4096, 256, 128]
    - [87, 2.403]
  - - [4096, 128, 1, 512, 4096, 4096, 512, 128]
    - [83, 3.193]
  - - [4096, 128, 1, 1024, 4096, 4096, 1024, 128]
    - [106, 3.335]
  - - [4096, 128, 1, 2048, 4096, 4096, 2048, 128]
    - [98, 3.626]
  - - [4096, 128, 1, 4096, 4096, 4096, 4096, 128]
    - [84, 4.293]
  - - [4096, 128, 1, 8192, 4096, 4096, 8192, 128]
    - [80, 5.401]
  - - [4096, 256, 1, 128, 4096, 4096, 128, 256]
    - [45, 2.092]
  - - [4096, 256, 1, 256, 4096, 4096, 256, 256]
    - [47, 3.051]
  - - [4096, 256, 1, 512, 4096, 4096, 512, 256]
    - [76, 3.726]
  - - [4096, 256, 1, 1024, 4096, 4096, 1024, 256]
    - [98, 4.244]
  - - [4096, 256, 1, 2048, 4096, 4096, 2048, 256]
    - [85, 4.827]
  - - [4096, 256, 1, 4096, 4096, 4096, 4096, 256]
    - [16, 5.651]
  - - [4096, 256, 1, 8192, 4096, 4096, 8192, 256]
    - [29, 6.36]
  - - [4096, 512, 1, 128, 4096, 4096, 128, 512]
    - [40, 2.907]
  - - [4096, 512, 1, 256, 4096, 4096, 256, 512]
    - [22, 3.964]
  - - [4096, 512, 1, 512, 4096, 4096, 512, 512]
    - [70, 4.523]
  - - [4096, 512, 1, 1024, 4096, 4096, 1024, 512]
    - [85, 5.446]
  - - [4096, 512, 1, 2048, 4096, 4096, 2048, 512]
    - [85, 6.123]
  - - [4096, 512, 1, 4096, 4096, 4096, 4096, 512]
    - [14, 6.111]
  - - [4096, 512, 1, 8192, 4096, 4096, 8192, 512]
    - [26, 7.167]
  - - [4096, 1024, 1, 128, 4096, 4096, 128, 1024]
    - [36, 3.184]
  - - [4096, 1024, 1, 256, 4096, 4096, 256, 1024]
    - [52, 4.528]
  - - [4096, 1024, 1, 512, 4096, 4096, 512, 1024]
    - [56, 5.976]
  - - [4096, 1024, 1, 1024, 4096, 4096, 1024, 1024]
    - [43, 6.487]
  - - [4096, 1024, 1, 2048, 4096, 4096, 2048, 1024]
    - [78, 6.507]
  - - [4096, 1024, 1, 4096, 4096, 4096, 4096, 1024]
    - [22, 6.808]
  - - [4096, 1024, 1, 8192, 4096, 4096, 8192, 1024]
    - [20, 7.303]
  - - [4096, 2048, 1, 128, 4096, 4096, 128, 2048]
    - [35, 3.695]
  - - [4096, 2048, 1, 256, 4096, 4096, 256, 2048]
    - [16, 5.293]
  - - [4096, 2048, 1, 512, 4096, 4096, 512, 2048]
    - [22, 6.641]
  - - [4096, 2048, 1, 1024, 4096, 4096, 1024, 2048]
    - [29, 8.19]
  - - [4096, 2048, 1, 2048, 4096, 4096, 2048, 2048]
    - [72, 7.873]
  - - [4096, 2048, 1, 4096, 4096, 4096, 4096, 2048]
    - [16, 7.314]
  - - [4096, 2048, 1, 8192, 4096, 4096, 8192, 2048]
    - [4, 7.605]
  - - [4096, 4096, 1, 128, 4096, 4096, 128, 4096]
    - [1, 3.303]
  - - [4096, 4096, 1, 256, 4096, 4096, 256, 4096]
    - [8, 4.796]
  - - [4096, 4096, 1, 512, 4096, 4096, 512, 4096]
    - [1, 6.402]
  - - [4096, 4096, 1, 1024, 4096, 4096, 1024, 4096]
    - [9, 7.638]
  - - [4096, 4096, 1, 2048, 4096, 4096, 2048, 4096]
    - [18, 7.91]
  - - [4096, 4096, 1, 4096, 4096, 4096, 4096, 4096]
    - [18, 7.789]
  - - [4096, 4096, 1, 8192, 4096, 4096, 8192, 4096]
    - [17, 7.39]
  - - [4096, 8192, 1, 128, 4096, 4096, 128, 8192]
    - [48, 3.436]
  - - [4096, 8192, 1, 256, 4096, 4096, 256, 8192]
    - [48, 4.715]
  - - [4096, 8192, 1, 512, 4096, 4096, 512, 8192]
    - [32, 6.211]
  - - [4096, 8192, 1, 1024, 4096, 4096, 1024, 8192]
    - [32, 7.163]
  - - [4096, 8192, 1, 2048, 4096, 4096, 2048, 8192]
    - [27, 7.642]
  - - [4096, 8192, 1, 4096, 4096, 4096, 4096, 8192]
    - [10, 7.843]
  - - [4096, 8192, 1, 8192, 4096, 4096, 8192, 8192]
    - [10, 6.907]
  - - [8192, 128, 1, 128, 8192, 8192, 128, 128]
    - [48, 2.055]
  - - [8192, 128, 1, 256, 8192, 8192, 256, 128]
    - [54, 2.884]
  - - [8192, 128, 1, 512, 8192, 8192, 512, 128]
    - [82, 3.611]
  - - [8192, 128, 1, 1024, 8192, 8192, 1024, 128]
    - [95, 4.14]
  - - [8192, 128, 1, 2048, 8192, 8192, 2048, 128]
    - [85, 4.711]
  - - [8192, 128, 1, 4096, 8192, 8192, 4096, 128]
    - [83, 5.242]
  - - [8192, 128, 1, 8192, 8192, 8192, 8192, 128]
    - [74, 6.09]
  - - [8192, 256, 1, 128, 8192, 8192, 128, 256]
    - [33, 2.864]
  - - [8192, 256, 1, 256, 8192, 8192, 256, 256]
    - [18, 3.9]
  - - [8192, 256, 1, 512, 8192, 8192, 512, 256]
    - [69, 4.529]
  - - [8192, 256, 1, 1024, 8192, 8192, 1024, 256]
    - [83, 5.323]
  - - [8192, 256, 1, 2048, 8192, 8192, 2048, 256]
    - [85, 6.003]
  - - [8192, 256, 1, 4096, 8192, 8192, 4096, 256]
    - [18, 6.325]
  - - [8192, 256, 1, 8192, 8192, 8192, 8192, 256]
    - [22, 7.599]
  - - [8192, 512, 1, 128, 8192, 8192, 128, 512]
    - [39, 3.161]
  - - [8192, 512, 1, 256, 8192, 8192, 256, 512]
    - [52, 4.486]
  - - [8192, 512, 1, 512, 8192, 8192, 512, 512]
    - [52, 5.563]
  - - [8192, 512, 1, 1024, 8192, 8192, 1024, 512]
    - [41, 6.309]
  - - [8192, 512, 1, 2048, 8192, 8192, 2048, 512]
    - [80, 6.483]
  - - [8192, 512, 1, 4096, 8192, 8192, 4096, 512]
    - [26, 7.014]
  - - [8192, 512, 1, 8192, 8192, 8192, 8192, 512]
    - [18, 7.713]
  - - [8192, 1024, 1, 128, 8192, 8192, 128, 1024]
    - [34, 3.431]
  - - [8192, 1024, 1, 256, 8192, 8192, 256, 1024]
    - [40, 5.274]
  - - [8192, 1024, 1, 512, 8192, 8192, 512, 1024]
    - [21, 6.9]
  - - [8192, 1024, 1, 1024, 8192, 8192, 1024, 1024]
    - [25, 7.844]
  - - [8192, 1024, 1, 2048, 8192, 8192, 2048, 1024]
    - [71, 7.79]
  - - [8192, 1024, 1, 4096, 8192, 8192, 4096, 1024]
    - [16, 7.537]
  - - [8192, 1024, 1, 8192, 8192, 8192, 8192, 1024]
    - [11, 7.457]
  - - [8192, 2048, 1, 128, 8192, 8192, 128, 2048]
    - [1, 3.227]
  - - [8192, 2048, 1, 256, 8192, 8192, 256, 2048]
    - [3, 4.762]
  - - [8192, 2048, 1, 512, 8192, 8192, 512, 2048]
    - [2, 6.318]
  - - [8192, 2048, 1, 1024, 8192, 8192, 1024, 2048]
    - [9, 7.644]
  - - [8192, 2048, 1, 2048, 8192, 8192, 2048, 2048]
    - [18, 7.707]
  - - [8192, 2048, 1, 4096, 8192, 8192, 4096, 2048]
    - [14, 7.654]
  - - [8192, 2048, 1, 8192, 8192, 8192, 8192, 2048]
    - [7, 7.407]
  - - [8192, 4096, 1, 128, 8192, 8192, 128, 4096]
    - [51, 3.282]
  - - [8192, 4096, 1, 256, 8192, 8192, 256, 4096]
    - [29, 4.695]
  - - [8192, 4096, 1, 512, 8192, 8192, 512, 4096]
    - [21, 6.105]
  - - [8192, 4096, 1, 1024, 8192, 8192, 1024, 4096]
    - [22, 7.221]
  - - [8192, 4096, 1, 2048, 8192, 8192, 2048, 4096]
    - [29, 7.545]
  - - [8192, 4096, 1, 4096, 8192, 8192, 4096, 4096]
    - [0, 7.407]
  - - [8192, 4096, 1, 8192, 8192, 8192, 8192, 4096]
    - [75, 7.259]
  - - [8192, 8192, 1, 128, 8192, 8192, 128, 8192]
    - [51, 3.261]
  - - [8192, 8192, 1, 256, 8192, 8192, 256, 8192]
    - [16, 4.698]
  - - [8192, 8192, 1, 512, 8192, 8192, 512, 8192]
    - [22, 6.281]
  - - [8192, 8192, 1, 1024, 8192, 8192, 1024, 8192]
    - [29, 7.126]
  - - [8192, 8192, 1, 2048, 8192, 8192, 2048, 8192]
    - [22, 7.596]
  - - [8192, 8192, 1, 4096, 8192, 8192, 4096, 8192]
    - [30, 7.35]
  - - [8192, 8192, 1, 8192, 8192, 8192, 8192, 8192]
    - [6, 7.632]
  - - [1, 1, 1, 32, 1, 1, 32, 1]
    - [131, 0.0]
- null
- null
- DeviceEfficiency
- GridBased
