library/src/amd_detail/rocblaslt/src/Tensile/Logic/streamk/gfx942_38cu/aquavanjaram942_Cijk_Alik_Bjlk_HSS_BH_UserArgs.yaml
- {MinimumRequiredVersion: 4.33.0}
- aquavanjaram942
- {Architecture: gfx942, CUCount: 38}
- [Device 0049, Device 0050]
    SolutionIndex: 0
    SolutionNameMin: Cijk_Alik_Bjlk_HSS_BH_UserArgs_MT256x256x32_MI16x16x1_SN_LDSB1_CLR1_GSU0_GSUC0_GSUWGMRR0_K1_LBSPPA256_LBSPPB2048_LPB32_MIWT8_8_PLR1_SU32_SUM0_SUS256_VWA4_VWB2_WGM1_WGMXCC1_WGMXCCGn1
    SolutionIndex: 1
    SolutionNameMin: Cijk_Alik_Bjlk_HSS_BH_UserArgs_MT256x256x32_MI16x16x1_SN_LDSB1_CLR1_GSU0_GSUC0_GSUWGMRR0_K1_LBSPPA128_LBSPPB2048_LPB0_MIWT8_8_PLR1_SU32_SUM0_SUS256_VWA1_VWB4_WGM1_WGMXCC1_WGMXCCGn1
    SolutionIndex: 2
    SolutionNameMin: Cijk_Alik_Bjlk_HSS_BH_UserArgs_MT256x256x32_MI16x16x1_SN_LDSB1_CLR1_GSU0_GSUC0_GSUWGMRR0_K1_LBSPPA128_LBSPPB2048_LPB0_MIWT8_8_PLR1_SU32_SUM0_SUS256_VWA2_VWB4_WGM1_WGMXCC1_WGMXCCGn1
    SolutionIndex: 3
    SolutionNameMin: Cijk_Alik_Bjlk_HSS_BH_UserArgs_MT256x256x32_MI16x16x1_SN_LDSB1_CLR1_GSU0_GSUC0_GSUWGMRR0_K1_LBSPPA256_LBSPPB2048_LPB0_MIWT8_8_PLR1_SU32_SUM0_SUS256_VWA4_VWB8_WGM1_WGMXCC1_WGMXCCGn1
    SolutionIndex: 4
    SolutionNameMin: Cijk_Alik_Bjlk_HSS_BH_UserArgs_MT256x256x32_MI16x16x1_SN_LDSB1_CLR1_GSU0_GSUC0_GSUWGMRR0_K1_LBSPPA512_LBSPPB2048_LPB0_MIWT8_8_PLR1_SU32_SUM0_SUS256_VWA8_VWB4_WGM4_WGMXCC1_WGMXCCGn1
    SolutionIndex: 5
    SolutionNameMin: Cijk_Alik_Bjlk_HSS_BH_UserArgs_MT256x256x32_MI16x16x1_SN_LDSB1_CLR1_GSU0_GSUC0_GSUWGMRR0_K1_LBSPPA256_LBSPPB2048_LPB0_MIWT8_8_PLR1_SU32_SUM0_SUS256_VWA4_VWB8_WGM4_WGMXCC1_WGMXCCGn1
    SolutionIndex: 6
    SolutionNameMin: Cijk_Alik_Bjlk_HSS_BH_UserArgs_MT256x256x32_MI16x16x1_SN_LDSB1_CLR1_GSU0_GSUC0_GSUWGMRR0_K1_LBSPPA128_LBSPPB2048_LPB16_MIWT8_8_PLR1_SU32_SUM0_SUS256_VWA1_VWB1_WGM8_WGMXCC1_WGMXCCGn1
    SolutionIndex: 7
    SolutionNameMin: Cijk_Alik_Bjlk_HSS_BH_UserArgs_MT256x256x32_MI16x16x1_SN_LDSB1_CLR1_GSU0_GSUC0_GSUWGMRR0_K1_LBSPPA128_LBSPPB2048_LPB0_MIWT8_8_PLR1_SU32_SUM0_SUS256_VWA1_VWB4_WGM8_WGMXCC1_WGMXCCGn1
    SolutionIndex: 8
    SolutionNameMin: Cijk_Alik_Bjlk_HSS_BH_UserArgs_MT256x256x32_MI16x16x1_SN_LDSB1_CLR1_GSU0_GSUC0_GSUWGMRR0_K1_LBSPPA256_LBSPPB2048_LPB0_MIWT8_8_PLR1_SU32_SUM0_SUS256_VWA4_VWB8_WGM8_WGMXCC1_WGMXCCGn1
    SolutionIndex: 9
    SolutionNameMin: Cijk_Alik_Bjlk_HSS_BH_UserArgs_MT128x256x32_MI16x16x1_SN_LDSB1_CLR1_GSU0_GSUC0_GSUWGMRR0_K1_LBSPPA128_LBSPPB2048_LPB32_MIWT4_8_PLR1_SU32_SUM0_SUS256_VWA1_VWB2_WGM1_WGMXCC1_WGMXCCGn1
    SolutionIndex: 10
    SolutionNameMin: Cijk_Alik_Bjlk_HSS_BH_UserArgs_MT128x256x32_MI16x16x1_SN_LDSB1_CLR1_GSU0_GSUC0_GSUWGMRR0_K1_LBSPPA256_LBSPPB2048_LPB32_MIWT4_8_PLR1_SU32_SUM0_SUS256_VWA4_VWB2_WGM1_WGMXCC1_WGMXCCGn1
    SolutionIndex: 11
    SolutionNameMin: Cijk_Alik_Bjlk_HSS_BH_UserArgs_MT128x256x32_MI16x16x1_SN_LDSB1_CLR1_GSU0_GSUC0_GSUWGMRR0_K1_LBSPPA128_LBSPPB2048_LPB0_MIWT4_8_PLR1_SU32_SUM0_SUS256_VWA1_VWB4_WGM1_WGMXCC1_WGMXCCGn1
    SolutionIndex: 12
    SolutionNameMin: Cijk_Alik_Bjlk_HSS_BH_UserArgs_MT128x256x32_MI16x16x1_SN_LDSB1_CLR1_GSU0_GSUC0_GSUWGMRR0_K1_LBSPPA256_LBSPPB2048_LPB0_MIWT4_8_PLR1_SU32_SUM0_SUS256_VWA4_VWB4_WGM1_WGMXCC1_WGMXCCGn1
    SolutionIndex: 13
    SolutionNameMin: Cijk_Alik_Bjlk_HSS_BH_UserArgs_MT128x256x32_MI16x16x1_SN_LDSB1_CLR1_GSU0_GSUC0_GSUWGMRR0_K1_LBSPPA128_LBSPPB2048_LPB0_MIWT4_8_PLR1_SU32_SUM0_SUS256_VWA1_VWB8_WGM1_WGMXCC1_WGMXCCGn1
    SolutionIndex: 14
    SolutionNameMin: Cijk_Alik_Bjlk_HSS_BH_UserArgs_MT128x256x32_MI16x16x1_SN_LDSB1_CLR1_GSU0_GSUC0_GSUWGMRR0_K1_LBSPPA128_LBSPPB2048_LPB0_MIWT4_8_PLR1_SU32_SUM0_SUS256_VWA2_VWB8_WGM1_WGMXCC1_WGMXCCGn1
    SolutionIndex: 15
    SolutionNameMin: Cijk_Alik_Bjlk_HSS_BH_UserArgs_MT128x256x32_MI16x16x1_SN_LDSB1_CLR1_GSU0_GSUC0_GSUWGMRR0_K1_LBSPPA256_LBSPPB2048_LPB0_MIWT4_8_PLR1_SU32_SUM0_SUS256_VWA4_VWB8_WGM1_WGMXCC1_WGMXCCGn1
    SolutionIndex: 16
    SolutionNameMin: Cijk_Alik_Bjlk_HSS_BH_UserArgs_MT128x256x32_MI16x16x1_SN_LDSB1_CLR1_GSU0_GSUC0_GSUWGMRR0_K1_LBSPPA256_LBSPPB2048_LPB16_MIWT4_8_PLR1_SU32_SUM0_SUS256_VWA4_VWB1_WGM4_WGMXCC1_WGMXCCGn1
    SolutionIndex: 17
    SolutionNameMin: Cijk_Alik_Bjlk_HSS_BH_UserArgs_MT128x256x32_MI16x16x1_SN_LDSB1_CLR1_GSU0_GSUC0_GSUWGMRR0_K1_LBSPPA128_LBSPPB2048_LPB32_MIWT4_8_PLR1_SU32_SUM0_SUS256_VWA1_VWB2_WGM4_WGMXCC1_WGMXCCGn1
    SolutionIndex: 18
    SolutionNameMin: Cijk_Alik_Bjlk_HSS_BH_UserArgs_MT128x256x32_MI16x16x1_SN_LDSB1_CLR1_GSU0_GSUC0_GSUWGMRR0_K1_LBSPPA128_LBSPPB2048_LPB32_MIWT4_8_PLR1_SU32_SUM0_SUS256_VWA2_VWB2_WGM4_WGMXCC1_WGMXCCGn1
    SolutionIndex: 19
    SolutionNameMin: Cijk_Alik_Bjlk_HSS_BH_UserArgs_MT128x256x32_MI16x16x1_SN_LDSB1_CLR1_GSU0_GSUC0_GSUWGMRR0_K1_LBSPPA256_LBSPPB2048_LPB32_MIWT4_8_PLR1_SU32_SUM0_SUS256_VWA4_VWB2_WGM4_WGMXCC1_WGMXCCGn1
    SolutionIndex: 20
    SolutionNameMin: Cijk_Alik_Bjlk_HSS_BH_UserArgs_MT128x256x32_MI16x16x1_SN_LDSB1_CLR1_GSU0_GSUC0_GSUWGMRR0_K1_LBSPPA128_LBSPPB2048_LPB0_MIWT4_8_PLR1_SU32_SUM0_SUS256_VWA1_VWB4_WGM4_WGMXCC1_WGMXCCGn1
    SolutionIndex: 21
    SolutionNameMin: Cijk_Alik_Bjlk_HSS_BH_UserArgs_MT128x256x32_MI16x16x1_SN_LDSB1_CLR1_GSU0_GSUC0_GSUWGMRR0_K1_LBSPPA256_LBSPPB2048_LPB0_MIWT4_8_PLR1_SU32_SUM0_SUS256_VWA4_VWB4_WGM4_WGMXCC1_WGMXCCGn1
    SolutionIndex: 22
    SolutionNameMin: Cijk_Alik_Bjlk_HSS_BH_UserArgs_MT128x256x32_MI16x16x1_SN_LDSB1_CLR1_GSU0_GSUC0_GSUWGMRR0_K1_LBSPPA128_LBSPPB2048_LPB0_MIWT4_8_PLR1_SU32_SUM0_SUS256_VWA1_VWB8_WGM4_WGMXCC1_WGMXCCGn1
    SolutionIndex: 23
    SolutionNameMin: Cijk_Alik_Bjlk_HSS_BH_UserArgs_MT128x256x32_MI16x16x1_SN_LDSB1_CLR1_GSU0_GSUC0_GSUWGMRR0_K1_LBSPPA256_LBSPPB2048_LPB0_MIWT4_8_PLR1_SU32_SUM0_SUS256_VWA4_VWB8_WGM4_WGMXCC1_WGMXCCGn1
    SolutionIndex: 24
    SolutionNameMin: Cijk_Alik_Bjlk_HSS_BH_UserArgs_MT128x256x32_MI16x16x1_SN_LDSB1_CLR1_GSU0_GSUC0_GSUWGMRR0_K1_LBSPPA128_LBSPPB2048_LPB32_MIWT4_8_PLR1_SU32_SUM0_SUS256_VWA1_VWB2_WGM8_WGMXCC1_WGMXCCGn1
    SolutionIndex: 25
    SolutionNameMin: Cijk_Alik_Bjlk_HSS_BH_UserArgs_MT128x256x32_MI16x16x1_SN_LDSB1_CLR1_GSU0_GSUC0_GSUWGMRR0_K1_LBSPPA256_LBSPPB2048_LPB32_MIWT4_8_PLR1_SU32_SUM0_SUS256_VWA4_VWB2_WGM8_WGMXCC1_WGMXCCGn1
    SolutionIndex: 26
    SolutionNameMin: Cijk_Alik_Bjlk_HSS_BH_UserArgs_MT128x256x32_MI16x16x1_SN_LDSB1_CLR1_GSU0_GSUC0_GSUWGMRR0_K1_LBSPPA128_LBSPPB2048_LPB0_MIWT4_8_PLR1_SU32_SUM0_SUS256_VWA1_VWB4_WGM8_WGMXCC1_WGMXCCGn1
    SolutionIndex: 27
    SolutionNameMin: Cijk_Alik_Bjlk_HSS_BH_UserArgs_MT128x256x32_MI16x16x1_SN_LDSB1_CLR1_GSU0_GSUC0_GSUWGMRR0_K1_LBSPPA256_LBSPPB2048_LPB0_MIWT4_8_PLR1_SU32_SUM0_SUS256_VWA4_VWB4_WGM8_WGMXCC1_WGMXCCGn1
    SolutionIndex: 28
    SolutionNameMin: Cijk_Alik_Bjlk_HSS_BH_UserArgs_MT128x256x32_MI16x16x1_SN_LDSB1_CLR1_GSU0_GSUC0_GSUWGMRR0_K1_LBSPPA128_LBSPPB2048_LPB0_MIWT4_8_PLR1_SU32_SUM0_SUS256_VWA2_VWB8_WGM8_WGMXCC1_WGMXCCGn1
    SolutionIndex: 29
    SolutionNameMin: Cijk_Alik_Bjlk_HSS_BH_UserArgs_MT128x256x32_MI16x16x1_SN_LDSB1_CLR1_GSU0_GSUC0_GSUWGMRR0_K1_LBSPPA256_LBSPPB2048_LPB0_MIWT4_8_PLR1_SU32_SUM0_SUS256_VWA4_VWB8_WGM8_WGMXCC1_WGMXCCGn1
    SolutionIndex: 30
    SolutionNameMin: Cijk_Alik_Bjlk_HSS_BH_UserArgs_MT256x128x32_MI16x16x1_SN_LDSB1_CLR1_GSU0_GSUC0_GSUWGMRR0_K1_LBSPPA128_LBSPPB1024_LPB16_MIWT8_4_PLR1_SU32_SUM0_SUS256_VWA1_VWB1_WGM4_WGMXCC1_WGMXCCGn1
    SolutionIndex: 31
    SolutionNameMin: Cijk_Alik_Bjlk_HSS_BH_UserArgs_MT256x128x32_MI16x16x1_SN_LDSB1_CLR1_GSU0_GSUC0_GSUWGMRR0_K1_LBSPPA128_LBSPPB1024_LPB32_MIWT8_4_PLR1_SU32_SUM0_SUS256_VWA1_VWB2_WGM4_WGMXCC1_WGMXCCGn1
    SolutionIndex: 32
    SolutionNameMin: Cijk_Alik_Bjlk_HSS_BH_UserArgs_MT64x256x32_MI16x16x1_SN_LDSB1_CLR1_GSU0_GSUC0_GSUWGMRR0_K1_LBSPPA128_LBSPPB2048_LPB0_MIWT2_8_PLR1_SU32_SUM0_SUS256_VWA1_VWB4_WGM1_WGMXCC1_WGMXCCGn1
    SolutionIndex: 33
    SolutionNameMin: Cijk_Alik_Bjlk_HSS_BH_UserArgs_MT64x256x32_MI16x16x1_SN_LDSB1_CLR1_GSU0_GSUC0_GSUWGMRR0_K1_LBSPPA128_LBSPPB2048_LPB32_MIWT2_8_PLR1_SU32_SUM0_SUS256_VWA1_VWB2_WGM4_WGMXCC1_WGMXCCGn1
    SolutionIndex: 34
    SolutionNameMin: Cijk_Alik_Bjlk_HSS_BH_UserArgs_MT64x256x32_MI16x16x1_SN_LDSB1_CLR1_GSU0_GSUC0_GSUWGMRR0_K1_LBSPPA128_LBSPPB2048_LPB0_MIWT2_8_PLR1_SU32_SUM0_SUS256_VWA1_VWB4_WGM8_WGMXCC1_WGMXCCGn1
    SolutionIndex: 35
    SolutionNameMin: Cijk_Alik_Bjlk_HSS_BH_UserArgs_MT128x128x32_MI16x16x1_SN_LDSB1_CLR1_GSU0_GSUC0_GSUWGMRR0_K1_LBSPPA128_LBSPPB1024_LPB16_MIWT4_4_PLR1_SU32_SUM0_SUS256_VWA1_VWB1_WGM1_WGMXCC1_WGMXCCGn1
    SolutionIndex: 36
    SolutionNameMin: Cijk_Alik_Bjlk_HSS_BH_UserArgs_MT128x128x32_MI16x16x1_SN_LDSB1_CLR1_GSU0_GSUC0_GSUWGMRR0_K1_LBSPPA256_LBSPPB1024_LPB16_MIWT4_4_PLR1_SU32_SUM0_SUS256_VWA4_VWB1_WGM1_WGMXCC1_WGMXCCGn1
    SolutionIndex: 37
    SolutionNameMin: Cijk_Alik_Bjlk_HSS_BH_UserArgs_MT128x128x32_MI16x16x1_SN_LDSB1_CLR1_GSU0_GSUC0_GSUWGMRR0_K1_LBSPPA128_LBSPPB1024_LPB32_MIWT4_4_PLR1_SU32_SUM0_SUS256_VWA1_VWB2_WGM1_WGMXCC1_WGMXCCGn1
    SolutionIndex: 38
    SolutionNameMin: Cijk_Alik_Bjlk_HSS_BH_UserArgs_MT128x128x32_MI16x16x1_SN_LDSB1_CLR1_GSU0_GSUC0_GSUWGMRR0_K1_LBSPPA128_LBSPPB1024_LPB32_MIWT4_4_PLR1_SU32_SUM0_SUS256_VWA2_VWB2_WGM1_WGMXCC1_WGMXCCGn1
    SolutionIndex: 39
    SolutionNameMin: Cijk_Alik_Bjlk_HSS_BH_UserArgs_MT128x128x32_MI16x16x1_SN_LDSB1_CLR1_GSU0_GSUC0_GSUWGMRR0_K1_LBSPPA256_LBSPPB1024_LPB32_MIWT4_4_PLR1_SU32_SUM0_SUS256_VWA4_VWB2_WGM1_WGMXCC1_WGMXCCGn1
    SolutionIndex: 40
    SolutionNameMin: Cijk_Alik_Bjlk_HSS_BH_UserArgs_MT128x128x32_MI16x16x1_SN_LDSB1_CLR1_GSU0_GSUC0_GSUWGMRR0_K1_LBSPPA128_LBSPPB1024_LPB0_MIWT4_4_PLR1_SU32_SUM0_SUS256_VWA1_VWB4_WGM1_WGMXCC1_WGMXCCGn1
    SolutionIndex: 41
    SolutionNameMin: Cijk_Alik_Bjlk_HSS_BH_UserArgs_MT128x128x32_MI16x16x1_SN_LDSB1_CLR1_GSU0_GSUC0_GSUWGMRR0_K1_LBSPPA256_LBSPPB1024_LPB0_MIWT4_4_PLR1_SU32_SUM0_SUS256_VWA4_VWB4_WGM1_WGMXCC1_WGMXCCGn1
    SolutionIndex: 42
    SolutionNameMin: Cijk_Alik_Bjlk_HSS_BH_UserArgs_MT128x128x32_MI16x16x1_SN_LDSB1_CLR1_GSU0_GSUC0_GSUWGMRR0_K1_LBSPPA256_LBSPPB1024_LPB16_MIWT4_4_PLR1_SU32_SUM0_SUS256_VWA4_VWB1_WGM4_WGMXCC1_WGMXCCGn1
    SolutionIndex: 43
    SolutionNameMin: Cijk_Alik_Bjlk_HSS_BH_UserArgs_MT128x128x32_MI16x16x1_SN_LDSB1_CLR1_GSU0_GSUC0_GSUWGMRR0_K1_LBSPPA256_LBSPPB1024_LPB32_MIWT4_4_PLR1_SU32_SUM0_SUS256_VWA4_VWB2_WGM4_WGMXCC1_WGMXCCGn1
    SolutionIndex: 44
    SolutionNameMin: Cijk_Alik_Bjlk_HSS_BH_UserArgs_MT128x128x32_MI16x16x1_SN_LDSB1_CLR1_GSU0_GSUC0_GSUWGMRR0_K1_LBSPPA128_LBSPPB1024_LPB0_MIWT4_4_PLR1_SU32_SUM0_SUS256_VWA1_VWB4_WGM4_WGMXCC1_WGMXCCGn1
    SolutionIndex: 45
    SolutionNameMin: Cijk_Alik_Bjlk_HSS_BH_UserArgs_MT128x128x32_MI16x16x1_SN_LDSB1_CLR1_GSU0_GSUC0_GSUWGMRR0_K1_LBSPPA128_LBSPPB1024_LPB16_MIWT4_4_PLR1_SU32_SUM0_SUS256_VWA1_VWB1_WGM8_WGMXCC1_WGMXCCGn1
    SolutionIndex: 46
    SolutionNameMin: Cijk_Alik_Bjlk_HSS_BH_UserArgs_MT128x128x32_MI16x16x1_SN_LDSB1_CLR1_GSU0_GSUC0_GSUWGMRR0_K1_LBSPPA256_LBSPPB1024_LPB16_MIWT4_4_PLR1_SU32_SUM0_SUS256_VWA4_VWB1_WGM8_WGMXCC1_WGMXCCGn1
    SolutionIndex: 47
    SolutionNameMin: Cijk_Alik_Bjlk_HSS_BH_UserArgs_MT128x128x32_MI16x16x1_SN_LDSB1_CLR1_GSU0_GSUC0_GSUWGMRR0_K1_LBSPPA128_LBSPPB1024_LPB32_MIWT4_4_PLR1_SU32_SUM0_SUS256_VWA1_VWB2_WGM8_WGMXCC1_WGMXCCGn1
    SolutionIndex: 48
    SolutionNameMin: Cijk_Alik_Bjlk_HSS_BH_UserArgs_MT128x128x32_MI16x16x1_SN_LDSB1_CLR1_GSU0_GSUC0_GSUWGMRR0_K1_LBSPPA256_LBSPPB1024_LPB32_MIWT4_4_PLR1_SU32_SUM0_SUS256_VWA4_VWB2_WGM8_WGMXCC1_WGMXCCGn1
    SolutionIndex: 49
    SolutionNameMin: Cijk_Alik_Bjlk_HSS_BH_UserArgs_MT128x128x32_MI16x16x1_SN_LDSB1_CLR1_GSU0_GSUC0_GSUWGMRR0_K1_LBSPPA256_LBSPPB1024_LPB0_MIWT4_4_PLR1_SU32_SUM0_SUS256_VWA4_VWB4_WGM8_WGMXCC1_WGMXCCGn1
    SolutionIndex: 50
    SolutionNameMin: Cijk_Alik_Bjlk_HSS_BH_UserArgs_MT64x128x32_MI16x16x1_SN_LDSB0_CLR1_GSU0_GSUC0_GSUWGMRR0_K1_LBSPPA128_LBSPPB1024_LPB0_MIWT2_4_PLR1_SU32_SUM0_SUS256_VWA1_VWB4_WGM1_WGMXCC1_WGMXCCGn1
    SolutionIndex: 51
    SolutionNameMin: Cijk_Alik_Bjlk_HSS_BH_UserArgs_MT64x128x32_MI16x16x1_SN_LDSB0_CLR1_GSU0_GSUC0_GSUWGMRR0_K1_LBSPPA128_LBSPPB1024_LPB0_MIWT2_4_PLR1_SU32_SUM0_SUS256_VWA1_VWB4_WGM4_WGMXCC1_WGMXCCGn1
    SolutionIndex: 52
    SolutionNameMin: Cijk_Alik_Bjlk_HSS_BH_UserArgs_MT64x128x32_MI16x16x1_SN_LDSB0_CLR1_GSU0_GSUC0_GSUWGMRR0_K1_LBSPPA128_LBSPPB1024_LPB0_MIWT2_4_PLR1_SU32_SUM0_SUS256_VWA1_VWB4_WGM8_WGMXCC1_WGMXCCGn1
    SolutionIndex: 53
    SolutionNameMin: Cijk_Alik_Bjlk_HSS_BH_UserArgs_MT64x64x32_MI16x16x1_SN_LDSB0_CLR1_GSU0_GSUC0_GSUWGMRR0_K1_LBSPPA128_LBSPPB512_LPB32_MIWT2_2_PLR1_SU32_SUM0_SUS256_VWA1_VWB2_WGM1_WGMXCC1_WGMXCCGn1
    SolutionIndex: 54
    SolutionNameMin: Cijk_Alik_Bjlk_HSS_BH_UserArgs_MT128x256x64_MI16x16x1_SN_LDSB1_CLR1_GSU0_GSUC0_GSUWGMRR0_K1_LBSPPA128_LBSPPB4096_LPB0_MIWT4_8_PLR1_SU32_SUM0_SUS256_VWA1_VWB4_WGM1_WGMXCC1_WGMXCCGn1
    SolutionIndex: 55
    SolutionNameMin: Cijk_Alik_Bjlk_HSS_BH_UserArgs_MT128x256x64_MI16x16x1_SN_LDSB1_CLR1_GSU0_GSUC0_GSUWGMRR0_K1_LBSPPA256_LBSPPB4096_LPB0_MIWT4_8_PLR1_SU32_SUM0_SUS256_VWA2_VWB4_WGM1_WGMXCC1_WGMXCCGn1
    SolutionIndex: 56
    SolutionNameMin: Cijk_Alik_Bjlk_HSS_BH_UserArgs_MT128x256x64_MI16x16x1_SN_LDSB1_CLR1_GSU0_GSUC0_GSUWGMRR0_K1_LBSPPA512_LBSPPB4096_LPB0_MIWT4_8_PLR1_SU32_SUM0_SUS256_VWA4_VWB4_WGM1_WGMXCC1_WGMXCCGn1
    SolutionIndex: 57
    SolutionNameMin: Cijk_Alik_Bjlk_HSS_BH_UserArgs_MT128x256x64_MI16x16x1_SN_LDSB1_CLR1_GSU0_GSUC0_GSUWGMRR0_K1_LBSPPA512_LBSPPB4096_LPB0_MIWT4_8_PLR1_SU32_SUM0_SUS256_VWA4_VWB4_WGM4_WGMXCC1_WGMXCCGn1
    SolutionIndex: 58
    SolutionNameMin: Cijk_Alik_Bjlk_HSS_BH_UserArgs_MT128x256x64_MI16x16x1_SN_LDSB1_CLR1_GSU0_GSUC0_GSUWGMRR0_K1_LBSPPA512_LBSPPB4096_LPB0_MIWT4_8_PLR1_SU32_SUM0_SUS256_VWA4_VWB4_WGM8_WGMXCC1_WGMXCCGn1
    SolutionIndex: 59
    SolutionNameMin: Cijk_Alik_Bjlk_HSS_BH_UserArgs_MT128x256x64_MI16x16x1_SN_LDSB1_CLR1_GSU0_GSUC0_GSUWGMRR0_K1_LBSPPA512_LBSPPB4096_LPB0_MIWT4_8_PLR1_SU32_SUM0_SUS256_VWA4_VWB8_WGM8_WGMXCC1_WGMXCCGn1
    SolutionIndex: 60
    SolutionNameMin: Cijk_Alik_Bjlk_HSS_BH_UserArgs_MT256x128x64_MI16x16x1_SN_LDSB1_CLR1_GSU0_GSUC0_GSUWGMRR0_K1_LBSPPA128_LBSPPB2048_LPB0_MIWT8_4_PLR1_SU32_SUM0_SUS256_VWA1_VWB4_WGM4_WGMXCC1_WGMXCCGn1
    SolutionIndex: 61
    SolutionNameMin: Cijk_Alik_Bjlk_HSS_BH_UserArgs_MT256x128x64_MI16x16x1_SN_LDSB1_CLR1_GSU0_GSUC0_GSUWGMRR0_K1_LBSPPA512_LBSPPB2048_LPB0_MIWT8_4_PLR1_SU32_SUM0_SUS256_VWA4_VWB4_WGM8_WGMXCC1_WGMXCCGn1
    SolutionIndex: 62
    SolutionNameMin: Cijk_Alik_Bjlk_HSS_BH_UserArgs_MT128x128x64_MI16x16x1_SN_LDSB1_CLR1_GSU0_GSUC0_GSUWGMRR0_K1_LBSPPA256_LBSPPB2048_LPB0_MIWT4_4_PLR1_SU32_SUM0_SUS256_VWA2_VWB4_WGM1_WGMXCC1_WGMXCCGn1
    SolutionIndex: 63
    SolutionNameMin: Cijk_Alik_Bjlk_HSS_BH_UserArgs_MT128x128x64_MI16x16x1_SN_LDSB1_CLR1_GSU0_GSUC0_GSUWGMRR0_K1_LBSPPA512_LBSPPB2048_LPB0_MIWT4_4_PLR1_SU32_SUM0_SUS256_VWA4_VWB4_WGM1_WGMXCC1_WGMXCCGn1
    SolutionIndex: 64
    SolutionNameMin: Cijk_Alik_Bjlk_HSS_BH_UserArgs_MT128x128x64_MI16x16x1_SN_LDSB1_CLR1_GSU0_GSUC0_GSUWGMRR0_K1_LBSPPA128_LBSPPB2048_LPB0_MIWT4_4_PLR1_SU32_SUM0_SUS256_VWA1_VWB4_WGM4_WGMXCC1_WGMXCCGn1
    SolutionIndex: 65
    SolutionNameMin: Cijk_Alik_Bjlk_HSS_BH_UserArgs_MT128x128x64_MI16x16x1_SN_LDSB1_CLR1_GSU0_GSUC0_GSUWGMRR0_K1_LBSPPA512_LBSPPB2048_LPB0_MIWT4_4_PLR1_SU32_SUM0_SUS256_VWA4_VWB4_WGM4_WGMXCC1_WGMXCCGn1
    SolutionIndex: 66
    SolutionNameMin: Cijk_Alik_Bjlk_HSS_BH_UserArgs_MT128x128x64_MI16x16x1_SN_LDSB1_CLR1_GSU0_GSUC0_GSUWGMRR0_K1_LBSPPA128_LBSPPB2048_LPB0_MIWT4_4_PLR1_SU32_SUM0_SUS256_VWA1_VWB4_WGM8_WGMXCC1_WGMXCCGn1
    SolutionIndex: 67
    SolutionNameMin: Cijk_Alik_Bjlk_HSS_BH_UserArgs_MT128x128x64_MI16x16x1_SN_LDSB1_CLR1_GSU0_GSUC0_GSUWGMRR0_K1_LBSPPA256_LBSPPB2048_LPB0_MIWT4_4_PLR1_SU32_SUM0_SUS256_VWA2_VWB4_WGM8_WGMXCC1_WGMXCCGn1
    SolutionIndex: 68
    SolutionNameMin: Cijk_Alik_Bjlk_HSS_BH_UserArgs_MT128x128x64_MI16x16x1_SN_LDSB1_CLR1_GSU0_GSUC0_GSUWGMRR0_K1_LBSPPA512_LBSPPB2048_LPB0_MIWT4_4_PLR1_SU32_SUM0_SUS256_VWA4_VWB4_WGM8_WGMXCC1_WGMXCCGn1
    SolutionIndex: 69
    SolutionNameMin: Cijk_Alik_Bjlk_HSS_BH_UserArgs_MT64x128x64_MI16x16x1_SN_LDSB1_CLR1_GSU0_GSUC0_GSUWGMRR0_K1_LBSPPA256_LBSPPB2048_LPB32_MIWT2_4_PLR1_SU32_SUM0_SUS256_VWA2_VWB2_WGM1_WGMXCC1_WGMXCCGn1
    SolutionIndex: 70
    SolutionNameMin: Cijk_Alik_Bjlk_HSS_BH_UserArgs_MT64x128x64_MI16x16x1_SN_LDSB1_CLR1_GSU0_GSUC0_GSUWGMRR0_K1_LBSPPA128_LBSPPB2048_LPB0_MIWT2_4_PLR1_SU32_SUM0_SUS256_VWA1_VWB4_WGM1_WGMXCC1_WGMXCCGn1
    SolutionIndex: 71
    SolutionNameMin: Cijk_Alik_Bjlk_HSS_BH_UserArgs_MT64x128x64_MI16x16x1_SN_LDSB1_CLR1_GSU0_GSUC0_GSUWGMRR0_K1_LBSPPA256_LBSPPB2048_LPB0_MIWT2_4_PLR1_SU32_SUM0_SUS256_VWA2_VWB4_WGM1_WGMXCC1_WGMXCCGn1
    SolutionIndex: 72
    SolutionNameMin: Cijk_Alik_Bjlk_HSS_BH_UserArgs_MT64x128x64_MI16x16x1_SN_LDSB1_CLR1_GSU0_GSUC0_GSUWGMRR0_K1_LBSPPA128_LBSPPB2048_LPB0_MIWT2_4_PLR1_SU32_SUM0_SUS256_VWA1_VWB4_WGM4_WGMXCC1_WGMXCCGn1
    SolutionIndex: 73
    SolutionNameMin: Cijk_Alik_Bjlk_HSS_BH_UserArgs_MT64x128x64_MI16x16x1_SN_LDSB1_CLR1_GSU0_GSUC0_GSUWGMRR0_K1_LBSPPA256_LBSPPB2048_LPB0_MIWT2_4_PLR1_SU32_SUM0_SUS256_VWA2_VWB4_WGM4_WGMXCC1_WGMXCCGn1
    SolutionIndex: 74
    SolutionNameMin: Cijk_Alik_Bjlk_HSS_BH_UserArgs_MT64x128x64_MI16x16x1_SN_LDSB1_CLR1_GSU0_GSUC0_GSUWGMRR0_K1_LBSPPA128_LBSPPB2048_LPB0_MIWT2_4_PLR1_SU32_SUM0_SUS256_VWA1_VWB4_WGM8_WGMXCC1_WGMXCCGn1
    SolutionIndex: 75
    SolutionNameMin: Cijk_Alik_Bjlk_HSS_BH_UserArgs_MT64x128x64_MI16x16x1_SN_LDSB1_CLR1_GSU0_GSUC0_GSUWGMRR0_K1_LBSPPA256_LBSPPB2048_LPB0_MIWT2_4_PLR1_SU32_SUM0_SUS256_VWA2_VWB4_WGM8_WGMXCC1_WGMXCCGn1
    SolutionIndex: 76
    SolutionNameMin: Cijk_Alik_Bjlk_HSS_BH_UserArgs_MT128x64x64_MI16x16x1_SN_LDSB1_CLR1_GSU0_GSUC0_GSUWGMRR0_K1_LBSPPA512_LBSPPB1024_LPB16_MIWT4_2_PLR1_SU32_SUM0_SUS256_VWA4_VWB1_WGM1_WGMXCC1_WGMXCCGn1
    SolutionIndex: 77
    SolutionNameMin: Cijk_Alik_Bjlk_HSS_BH_UserArgs_MT128x64x64_MI16x16x1_SN_LDSB1_CLR1_GSU0_GSUC0_GSUWGMRR0_K1_LBSPPA128_LBSPPB1024_LPB32_MIWT4_2_PLR1_SU32_SUM0_SUS256_VWA1_VWB2_WGM1_WGMXCC1_WGMXCCGn1
    SolutionIndex: 78
    SolutionNameMin: Cijk_Alik_Bjlk_HSS_BH_UserArgs_MT128x64x64_MI16x16x1_SN_LDSB1_CLR1_GSU0_GSUC0_GSUWGMRR0_K1_LBSPPA512_LBSPPB1024_LPB32_MIWT4_2_PLR1_SU32_SUM0_SUS256_VWA4_VWB2_WGM1_WGMXCC1_WGMXCCGn1
    SolutionIndex: 79
    SolutionNameMin: Cijk_Alik_Bjlk_HSS_BH_UserArgs_MT128x64x64_MI16x16x1_SN_LDSB1_CLR1_GSU0_GSUC0_GSUWGMRR0_K1_LBSPPA512_LBSPPB1024_LPB16_MIWT4_2_PLR1_SU32_SUM0_SUS256_VWA4_VWB1_WGM4_WGMXCC1_WGMXCCGn1
    SolutionIndex: 80
    SolutionNameMin: Cijk_Alik_Bjlk_HSS_BH_UserArgs_MT128x64x64_MI16x16x1_SN_LDSB1_CLR1_GSU0_GSUC0_GSUWGMRR0_K1_LBSPPA512_LBSPPB1024_LPB32_MIWT4_2_PLR1_SU32_SUM0_SUS256_VWA4_VWB2_WGM4_WGMXCC1_WGMXCCGn1
    SolutionIndex: 81
    SolutionNameMin: Cijk_Alik_Bjlk_HSS_BH_UserArgs_MT128x64x64_MI16x16x1_SN_LDSB1_CLR1_GSU0_GSUC0_GSUWGMRR0_K1_LBSPPA512_LBSPPB1024_LPB32_MIWT4_2_PLR2_SU32_SUM0_SUS256_VWA4_VWB2_WGM4_WGMXCC1_WGMXCCGn1
    SolutionIndex: 82
    SolutionNameMin: Cijk_Alik_Bjlk_HSS_BH_UserArgs_MT128x64x64_MI16x16x1_SN_LDSB1_CLR1_GSU0_GSUC0_GSUWGMRR0_K1_LBSPPA128_LBSPPB1024_LPB32_MIWT4_2_PLR1_SU32_SUM0_SUS256_VWA1_VWB2_WGM8_WGMXCC1_WGMXCCGn1
    SolutionIndex: 83
    SolutionNameMin: Cijk_Alik_Bjlk_HSS_BH_UserArgs_MT128x64x64_MI16x16x1_SN_LDSB1_CLR1_GSU0_GSUC0_GSUWGMRR0_K1_LBSPPA512_LBSPPB1024_LPB32_MIWT4_2_PLR1_SU32_SUM0_SUS256_VWA4_VWB2_WGM8_WGMXCC1_WGMXCCGn1
    SolutionIndex: 84
    SolutionNameMin: Cijk_Alik_Bjlk_HSS_BH_UserArgs_MT64x64x64_MI16x16x1_SN_LDSB1_CLR1_GSU0_GSUC0_GSUWGMRR0_K1_LBSPPA128_LBSPPB1024_LPB32_MIWT2_2_PLR1_SU32_SUM0_SUS256_VWA1_VWB2_WGM1_WGMXCC1_WGMXCCGn1
    SolutionIndex: 85
    SolutionNameMin: Cijk_Alik_Bjlk_HSS_BH_UserArgs_MT64x64x64_MI16x16x1_SN_LDSB1_CLR1_GSU0_GSUC0_GSUWGMRR0_K1_LBSPPA256_LBSPPB1024_LPB32_MIWT2_2_PLR1_SU32_SUM0_SUS256_VWA2_VWB2_WGM1_WGMXCC1_WGMXCCGn1
    SolutionIndex: 86
    SolutionNameMin: Cijk_Alik_Bjlk_HSS_BH_UserArgs_MT64x64x64_MI16x16x1_SN_LDSB1_CLR1_GSU0_GSUC0_GSUWGMRR0_K1_LBSPPA128_LBSPPB1024_LPB32_MIWT2_2_PLR1_SU32_SUM0_SUS256_VWA1_VWB2_WGM4_WGMXCC1_WGMXCCGn1
    SolutionIndex: 87
    SolutionNameMin: Cijk_Alik_Bjlk_HSS_BH_UserArgs_MT64x64x64_MI16x16x1_SN_LDSB1_CLR1_GSU0_GSUC0_GSUWGMRR0_K1_LBSPPA128_LBSPPB1024_LPB32_MIWT2_2_PLR2_SU32_SUM0_SUS256_VWA1_VWB2_WGM4_WGMXCC1_WGMXCCGn1
    SolutionIndex: 88
    SolutionNameMin: Cijk_Alik_Bjlk_HSS_BH_UserArgs_MT64x64x64_MI16x16x1_SN_LDSB1_CLR1_GSU0_GSUC0_GSUWGMRR0_K1_LBSPPA128_LBSPPB1024_LPB32_MIWT2_2_PLR1_SU32_SUM0_SUS256_VWA1_VWB2_WGM8_WGMXCC1_WGMXCCGn1
    SolutionIndex: 89
    SolutionNameMin: Cijk_Alik_Bjlk_HSS_BH_UserArgs_MT64x64x64_MI16x16x1_SN_LDSB1_CLR1_GSU0_GSUC0_GSUWGMRR0_K1_LBSPPA256_LBSPPB1024_LPB32_MIWT2_2_PLR1_SU32_SUM0_SUS256_VWA2_VWB2_WGM8_WGMXCC1_WGMXCCGn1
    SolutionIndex: 90
    SolutionNameMin: Cijk_Alik_Bjlk_HSS_BH_UserArgs_MT32x64x64_MI16x16x1_SN_LDSB0_CLR1_GSU0_GSUC0_GSUWGMRR0_K1_LBSPPA128_LBSPPB1024_LPB32_MIWT1_2_PLR1_SU32_SUM0_SUS256_VWA1_VWB2_WGM1_WGMXCC1_WGMXCCGn1
    SolutionIndex: 91
    SolutionNameMin: Cijk_Alik_Bjlk_HSS_BH_UserArgs_MT32x64x64_MI16x16x1_SN_LDSB0_CLR1_GSU0_GSUC0_GSUWGMRR0_K1_LBSPPA128_LBSPPB1024_LPB32_MIWT1_2_PLR1_SU32_SUM0_SUS256_VWA1_VWB2_WGM4_WGMXCC1_WGMXCCGn1
    SolutionIndex: 92
    SolutionNameMin: Cijk_Alik_Bjlk_HSS_BH_UserArgs_MT64x32x64_MI16x16x1_SN_LDSB0_CLR1_GSU0_GSUC0_GSUWGMRR0_K1_LBSPPA128_LBSPPB512_LPB16_MIWT2_1_PLR1_SU32_SUM0_SUS256_VWA1_VWB1_WGM1_WGMXCC1_WGMXCCGn1
    SolutionIndex: 93
    SolutionNameMin: Cijk_Alik_Bjlk_HSS_BH_UserArgs_MT64x32x64_MI16x16x1_SN_LDSB0_CLR1_GSU0_GSUC0_GSUWGMRR0_K1_LBSPPA256_LBSPPB512_LPB16_MIWT2_1_PLR1_SU32_SUM0_SUS256_VWA2_VWB1_WGM1_WGMXCC1_WGMXCCGn1
    SolutionIndex: 94
    SolutionNameMin: Cijk_Alik_Bjlk_HSS_BH_UserArgs_MT64x128x128_MI16x16x1_SN_LDSB1_CLR1_GSU0_GSUC0_GSUWGMRR0_K1_LBSPPA256_LBSPPB2048_LPB0_MIWT2_4_PLR2_SU32_SUM0_SUS256_VWA1_VWB4_WGM1_WGMXCC1_WGMXCCGn1
    SolutionIndex: 95
    SolutionNameMin: Cijk_Alik_Bjlk_HSS_BH_UserArgs_MT64x128x128_MI16x16x1_SN_LDSB1_CLR1_GSU0_GSUC0_GSUWGMRR0_K1_LBSPPA512_LBSPPB2048_LPB0_MIWT2_4_PLR2_SU32_SUM0_SUS256_VWA2_VWB4_WGM1_WGMXCC1_WGMXCCGn1
    SolutionIndex: 96
    SolutionNameMin: Cijk_Alik_Bjlk_HSS_BH_UserArgs_MT64x128x128_MI16x16x1_SN_LDSB1_CLR1_GSU0_GSUC0_GSUWGMRR0_K1_LBSPPA256_LBSPPB2048_LPB0_MIWT2_4_PLR2_SU32_SUM0_SUS256_VWA1_VWB4_WGM8_WGMXCC1_WGMXCCGn1
    SolutionIndex: 97
    SolutionNameMin: Cijk_Alik_Bjlk_HSS_BH_UserArgs_MT64x128x128_MI16x16x1_SN_LDSB1_CLR1_GSU0_GSUC0_GSUWGMRR0_K1_LBSPPA512_LBSPPB2048_LPB0_MIWT2_4_PLR2_SU32_SUM0_SUS256_VWA2_VWB4_WGM8_WGMXCC1_WGMXCCGn1
    SolutionIndex: 98
    SolutionNameMin: Cijk_Alik_Bjlk_HSS_BH_UserArgs_MT128x64x128_MI16x16x1_SN_LDSB1_CLR1_GSU0_GSUC0_GSUWGMRR0_K1_LBSPPA256_LBSPPB1024_LPB32_MIWT4_2_PLR2_SU32_SUM0_SUS256_VWA1_VWB2_WGM1_WGMXCC1_WGMXCCGn1
    SolutionIndex: 99
    SolutionNameMin: Cijk_Alik_Bjlk_HSS_BH_UserArgs_MT128x64x128_MI16x16x1_SN_LDSB1_CLR1_GSU0_GSUC0_GSUWGMRR0_K1_LBSPPA1024_LBSPPB1024_LPB32_MIWT4_2_PLR2_SU32_SUM0_SUS256_VWA4_VWB2_WGM4_WGMXCC1_WGMXCCGn1
    SolutionIndex: 100
    SolutionNameMin: Cijk_Alik_Bjlk_HSS_BH_UserArgs_MT128x64x128_MI16x16x1_SN_LDSB1_CLR1_GSU0_GSUC0_GSUWGMRR0_K1_LBSPPA1024_LBSPPB1024_LPB32_MIWT4_2_PLR2_SU32_SUM0_SUS256_VWA4_VWB2_WGM8_WGMXCC1_WGMXCCGn1
    SolutionIndex: 101
    SolutionNameMin: Cijk_Alik_Bjlk_HSS_BH_UserArgs_MT128x32x128_MI16x16x1_SN_LDSB1_CLR1_GSU0_GSUC0_GSUWGMRR0_K1_LBSPPA1024_LBSPPB512_LPB16_MIWT4_1_PLR2_SU32_SUM0_SUS256_VWA4_VWB1_WGM1_WGMXCC1_WGMXCCGn1
    SolutionIndex: 102
    SolutionNameMin: Cijk_Alik_Bjlk_HSS_BH_UserArgs_MT64x64x128_MI16x16x1_SN_LDSB1_CLR1_GSU0_GSUC0_GSUWGMRR0_K1_LBSPPA256_LBSPPB1024_LPB32_MIWT2_2_PLR2_SU32_SUM0_SUS256_VWA1_VWB2_WGM1_WGMXCC1_WGMXCCGn1
    SolutionIndex: 103
    SolutionNameMin: Cijk_Alik_Bjlk_HSS_BH_UserArgs_MT32x64x128_MI16x16x1_SN_LDSB1_CLR1_GSU0_GSUC0_GSUWGMRR0_K1_LBSPPA256_LBSPPB1024_LPB16_MIWT1_2_PLR1_SU32_SUM0_SUS256_VWA1_VWB1_WGM1_WGMXCC1_WGMXCCGn1
    SolutionIndex: 104
    SolutionNameMin: Cijk_Alik_Bjlk_HSS_BH_UserArgs_MT32x64x128_MI16x16x1_SN_LDSB1_CLR1_GSU0_GSUC0_GSUWGMRR0_K1_LBSPPA256_LBSPPB1024_LPB32_MIWT1_2_PLR1_SU32_SUM0_SUS256_VWA1_VWB2_WGM1_WGMXCC1_WGMXCCGn1
    SolutionIndex: 105
    SolutionNameMin: Cijk_Alik_Bjlk_HSS_BH_UserArgs_MT32x64x128_MI16x16x1_SN_LDSB1_CLR1_GSU0_GSUC0_GSUWGMRR0_K1_LBSPPA256_LBSPPB1024_LPB32_MIWT1_2_PLR2_SU32_SUM0_SUS256_VWA1_VWB2_WGM1_WGMXCC1_WGMXCCGn1
    SolutionIndex: 106
    SolutionNameMin: Cijk_Alik_Bjlk_HSS_BH_UserArgs_MT32x64x128_MI16x16x1_SN_LDSB1_CLR1_GSU0_GSUC0_GSUWGMRR0_K1_LBSPPA256_LBSPPB1024_LPB32_MIWT1_2_PLR1_SU32_SUM0_SUS256_VWA1_VWB2_WGM4_WGMXCC1_WGMXCCGn1
    SolutionIndex: 107
    SolutionNameMin: Cijk_Alik_Bjlk_HSS_BH_UserArgs_MT32x64x128_MI16x16x1_SN_LDSB1_CLR1_GSU0_GSUC0_GSUWGMRR0_K1_LBSPPA256_LBSPPB1024_LPB32_MIWT1_2_PLR2_SU32_SUM0_SUS256_VWA1_VWB2_WGM4_WGMXCC1_WGMXCCGn1
    SolutionIndex: 108
    SolutionNameMin: Cijk_Alik_Bjlk_HSS_BH_UserArgs_MT32x64x128_MI16x16x1_SN_LDSB1_CLR1_GSU0_GSUC0_GSUWGMRR0_K1_LBSPPA256_LBSPPB1024_LPB32_MIWT1_2_PLR1_SU32_SUM0_SUS256_VWA1_VWB2_WGM8_WGMXCC1_WGMXCCGn1
    SolutionIndex: 109
    SolutionNameMin: Cijk_Alik_Bjlk_HSS_BH_UserArgs_MT64x32x128_MI16x16x1_SN_LDSB1_CLR1_GSU0_GSUC0_GSUWGMRR0_K1_LBSPPA256_LBSPPB512_LPB16_MIWT2_1_PLR1_SU32_SUM0_SUS256_VWA1_VWB1_WGM1_WGMXCC1_WGMXCCGn1
    SolutionIndex: 110
    SolutionNameMin: Cijk_Alik_Bjlk_HSS_BH_UserArgs_MT64x32x128_MI16x16x1_SN_LDSB1_CLR1_GSU0_GSUC0_GSUWGMRR0_K1_LBSPPA512_LBSPPB512_LPB16_MIWT2_1_PLR1_SU32_SUM0_SUS256_VWA2_VWB1_WGM1_WGMXCC1_WGMXCCGn1
    SolutionIndex: 111
    SolutionNameMin: Cijk_Alik_Bjlk_HSS_BH_UserArgs_MT64x32x128_MI16x16x1_SN_LDSB1_CLR1_GSU0_GSUC0_GSUWGMRR0_K1_LBSPPA256_LBSPPB512_LPB16_MIWT2_1_PLR2_SU32_SUM0_SUS256_VWA1_VWB1_WGM8_WGMXCC1_WGMXCCGn1
    SolutionIndex: 112
    SolutionNameMin: Cijk_Alik_Bjlk_HSS_BH_UserArgs_MT32x32x128_MI16x16x1_SN_LDSB1_CLR1_GSU0_GSUC0_GSUWGMRR0_K1_LBSPPA256_LBSPPB512_LPB16_MIWT1_1_PLR1_SU32_SUM0_SUS256_VWA1_VWB1_WGM1_WGMXCC1_WGMXCCGn1
    SolutionIndex: 113
    SolutionNameMin: Cijk_Alik_Bjlk_HSS_BH_UserArgs_MT32x32x128_MI16x16x1_SN_LDSB1_CLR1_GSU0_GSUC0_GSUWGMRR0_K1_LBSPPA256_LBSPPB512_LPB16_MIWT1_1_PLR2_SU32_SUM0_SUS256_VWA1_VWB1_WGM1_WGMXCC1_WGMXCCGn1
    SolutionIndex: 114
    SolutionNameMin: Cijk_Alik_Bjlk_HSS_BH_UserArgs_MT32x32x128_MI16x16x1_SN_LDSB1_CLR1_GSU0_GSUC0_GSUWGMRR0_K1_LBSPPA256_LBSPPB512_LPB16_MIWT1_1_PLR2_SU32_SUM0_SUS256_VWA1_VWB1_WGM4_WGMXCC1_WGMXCCGn1
    SolutionIndex: 115
    SolutionNameMin: Cijk_Alik_Bjlk_HSS_BH_UserArgs_MT32x32x128_MI16x16x1_SN_LDSB1_CLR1_GSU0_GSUC0_GSUWGMRR0_K1_LBSPPA256_LBSPPB512_LPB16_MIWT1_1_PLR1_SU32_SUM0_SUS256_VWA1_VWB1_WGM8_WGMXCC1_WGMXCCGn1
    SolutionIndex: 116
    SolutionNameMin: Cijk_Alik_Bjlk_HSS_BH_UserArgs_MT32x32x32_MI16x16x1_SN_LDSB0_CLR0_GSU0_GSUC0_GSUWGMRR0_K1_LBSPPA128_LBSPPB256_LPB16_MIWT1_1_PLR0_SU32_SUM0_SUS256_VWA1_VWB1_WGM8_WGMXCC1_WGMXCCGn1
- - - [128, 128, 1, 128, 128, 128, 128, 128]
    - [106, 0.075]
  - - [128, 128, 1, 256, 128, 128, 256, 128]
    - [101, 0.103]
  - - [128, 128, 1, 512, 128, 128, 512, 128]
    - [113, 0.173]
  - - [128, 128, 1, 1024, 128, 128, 1024, 128]
    - [112, 0.301]
  - - [128, 128, 1, 2048, 128, 128, 2048, 128]
    - [113, 0.514]
  - - [128, 128, 1, 4096, 128, 128, 4096, 128]
    - [105, 0.807]
  - - [128, 128, 1, 8192, 128, 128, 8192, 128]
    - [105, 1.265]
  - - [128, 256, 1, 128, 128, 128, 128, 256]
    - [114, 0.162]
  - - [128, 256, 1, 256, 128, 128, 256, 256]
    - [112, 0.251]
  - - [128, 256, 1, 512, 128, 128, 512, 256]
    - [109, 0.331]
  - - [128, 256, 1, 1024, 128, 128, 1024, 256]
    - [113, 0.59]
  - - [128, 256, 1, 2048, 128, 128, 2048, 256]
    - [105, 0.884]
  - - [128, 256, 1, 4096, 128, 128, 4096, 256]
    - [91, 1.407]
  - - [128, 256, 1, 8192, 128, 128, 8192, 256]
    - [105, 1.964]
  - - [128, 512, 1, 128, 128, 128, 128, 512]
    - [110, 0.298]
  - - [128, 512, 1, 256, 128, 128, 256, 512]
    - [115, 0.506]
  - - [128, 512, 1, 512, 128, 128, 512, 512]
    - [113, 0.78]
  - - [128, 512, 1, 1024, 128, 128, 1024, 512]
    - [113, 1.124]
  - - [128, 512, 1, 2048, 128, 128, 2048, 512]
    - [105, 1.547]
  - - [128, 512, 1, 4096, 128, 128, 4096, 512]
    - [86, 2.29]
  - - [128, 512, 1, 8192, 128, 128, 8192, 512]
    - [51, 2.768]
  - - [128, 1024, 1, 128, 128, 128, 128, 1024]
    - [93, 0.554]
  - - [128, 1024, 1, 256, 128, 128, 256, 1024]
    - [90, 0.918]
  - - [128, 1024, 1, 512, 128, 128, 512, 1024]
    - [105, 1.393]
  - - [128, 1024, 1, 1024, 128, 128, 1024, 1024]
    - [104, 1.894]
  - - [128, 1024, 1, 2048, 128, 128, 2048, 1024]
    - [50, 2.206]
  - - [128, 1024, 1, 4096, 128, 128, 4096, 1024]
    - [70, 3.372]
  - - [128, 1024, 1, 8192, 128, 128, 8192, 1024]
    - [99, 3.614]
  - - [128, 2048, 1, 128, 128, 128, 128, 2048]
    - [84, 0.966]
  - - [128, 2048, 1, 256, 128, 128, 256, 2048]
    - [89, 1.528]
  - - [128, 2048, 1, 512, 128, 128, 512, 2048]
    - [88, 2.17]
  - - [128, 2048, 1, 1024, 128, 128, 1024, 2048]
    - [74, 2.467]
  - - [128, 2048, 1, 2048, 128, 128, 2048, 2048]
    - [43, 2.916]
  - - [128, 2048, 1, 4096, 128, 128, 4096, 2048]
    - [71, 3.595]
  - - [128, 2048, 1, 8192, 128, 128, 8192, 2048]
    - [15, 4.552]
  - - [128, 4096, 1, 128, 128, 128, 128, 4096]
    - [76, 1.292]
  - - [128, 4096, 1, 256, 128, 128, 256, 4096]
    - [78, 2.195]
  - - [128, 4096, 1, 512, 128, 128, 512, 4096]
    - [77, 3.094]
  - - [128, 4096, 1, 1024, 128, 128, 1024, 4096]
    - [98, 3.504]
  - - [128, 4096, 1, 2048, 128, 128, 2048, 4096]
    - [15, 4.071]
  - - [128, 4096, 1, 4096, 128, 128, 4096, 4096]
    - [10, 4.295]
  - - [128, 4096, 1, 8192, 128, 128, 8192, 4096]
    - [55, 4.279]
  - - [128, 8192, 1, 128, 128, 128, 128, 8192]
    - [35, 1.712]
  - - [128, 8192, 1, 256, 128, 128, 256, 8192]
    - [40, 2.656]
  - - [128, 8192, 1, 512, 128, 128, 512, 8192]
    - [62, 3.397]
  - - [128, 8192, 1, 1024, 128, 128, 1024, 8192]
    - [84, 4.241]
  - - [128, 8192, 1, 2048, 128, 128, 2048, 8192]
    - [70, 4.637]
  - - [128, 8192, 1, 4096, 128, 128, 4096, 8192]
    - [27, 5.608]
  - - [128, 8192, 1, 8192, 128, 128, 8192, 8192]
    - [58, 6.133]
  - - [256, 128, 1, 128, 256, 256, 128, 128]
    - [103, 0.159]
  - - [256, 128, 1, 256, 256, 256, 256, 128]
    - [113, 0.251]
  - - [256, 128, 1, 512, 256, 256, 512, 128]
    - [112, 0.339]
  - - [256, 128, 1, 1024, 256, 256, 1024, 128]
    - [113, 0.584]
  - - [256, 128, 1, 2048, 256, 256, 2048, 128]
    - [105, 0.887]
  - - [256, 128, 1, 4096, 256, 256, 4096, 128]
    - [92, 1.385]
  - - [256, 128, 1, 8192, 256, 256, 8192, 128]
    - [105, 2.011]
  - - [256, 256, 1, 128, 256, 256, 128, 256]
    - [107, 0.305]
  - - [256, 256, 1, 256, 256, 256, 256, 256]
    - [115, 0.505]
  - - [256, 256, 1, 512, 256, 256, 512, 256]
    - [113, 0.788]
  - - [256, 256, 1, 1024, 256, 256, 1024, 256]
    - [112, 1.119]
  - - [256, 256, 1, 2048, 256, 256, 2048, 256]
    - [108, 1.536]
  - - [256, 256, 1, 4096, 256, 256, 4096, 256]
    - [85, 2.335]
  - - [256, 256, 1, 8192, 256, 256, 8192, 256]
    - [52, 2.698]
  - - [256, 512, 1, 128, 256, 256, 128, 512]
    - [90, 0.555]
  - - [256, 512, 1, 256, 256, 256, 256, 512]
    - [90, 0.936]
  - - [256, 512, 1, 512, 256, 256, 512, 512]
    - [104, 1.38]
  - - [256, 512, 1, 1024, 256, 256, 1024, 512]
    - [104, 1.929]
  - - [256, 512, 1, 2048, 256, 256, 2048, 512]
    - [50, 2.341]
  - - [256, 512, 1, 4096, 256, 256, 4096, 512]
    - [78, 3.382]
  - - [256, 512, 1, 8192, 256, 256, 8192, 512]
    - [65, 3.402]
  - - [256, 1024, 1, 128, 256, 256, 128, 1024]
    - [84, 0.972]
  - - [256, 1024, 1, 256, 256, 256, 256, 1024]
    - [86, 1.525]
  - - [256, 1024, 1, 512, 256, 256, 512, 1024]
    - [85, 2.241]
  - - [256, 1024, 1, 1024, 256, 256, 1024, 1024]
    - [74, 2.461]
  - - [256, 1024, 1, 2048, 256, 256, 2048, 1024]
    - [36, 3.021]
  - - [256, 1024, 1, 4096, 256, 256, 4096, 1024]
    - [80, 3.577]
  - - [256, 1024, 1, 8192, 256, 256, 8192, 1024]
    - [29, 4.82]
  - - [256, 2048, 1, 128, 256, 256, 128, 2048]
    - [80, 1.315]
  - - [256, 2048, 1, 256, 256, 256, 256, 2048]
    - [77, 2.194]
  - - [256, 2048, 1, 512, 256, 256, 512, 2048]
    - [77, 3.073]
  - - [256, 2048, 1, 1024, 256, 256, 1024, 2048]
    - [100, 3.477]
  - - [256, 2048, 1, 2048, 256, 256, 2048, 2048]
    - [28, 3.609]
  - - [256, 2048, 1, 4096, 256, 256, 4096, 2048]
    - [79, 4.104]
  - - [256, 2048, 1, 8192, 256, 256, 8192, 2048]
    - [12, 5.432]
  - - [256, 4096, 1, 128, 256, 256, 128, 4096]
    - [38, 1.713]
  - - [256, 4096, 1, 256, 256, 256, 256, 4096]
    - [37, 2.805]
  - - [256, 4096, 1, 512, 256, 256, 512, 4096]
    - [72, 3.359]
  - - [256, 4096, 1, 1024, 256, 256, 1024, 4096]
    - [84, 4.31]
  - - [256, 4096, 1, 2048, 256, 256, 2048, 4096]
    - [89, 4.709]
  - - [256, 4096, 1, 4096, 256, 256, 4096, 4096]
    - [21, 5.432]
  - - [256, 4096, 1, 8192, 256, 256, 8192, 4096]
    - [56, 6.174]
  - - [256, 8192, 1, 128, 256, 256, 128, 8192]
    - [27, 2.154]
  - - [256, 8192, 1, 256, 256, 256, 256, 8192]
    - [29, 3.377]
  - - [256, 8192, 1, 512, 256, 256, 512, 8192]
    - [70, 4.225]
  - - [256, 8192, 1, 1024, 256, 256, 1024, 8192]
    - [71, 5.3]
  - - [256, 8192, 1, 2048, 256, 256, 2048, 8192]
    - [70, 6.107]
  - - [256, 8192, 1, 4096, 256, 256, 4096, 8192]
    - [12, 6.203]
  - - [256, 8192, 1, 8192, 256, 256, 8192, 8192]
    - [29, 7.253]
  - - [512, 128, 1, 128, 512, 512, 128, 128]
    - [111, 0.304]
  - - [512, 128, 1, 256, 512, 512, 256, 128]
    - [113, 0.508]
  - - [512, 128, 1, 512, 512, 512, 512, 128]
    - [115, 0.807]
  - - [512, 128, 1, 1024, 512, 512, 1024, 128]
    - [114, 1.108]
  - - [512, 128, 1, 2048, 512, 512, 2048, 128]
    - [105, 1.561]
  - - [512, 128, 1, 4096, 512, 512, 4096, 128]
    - [85, 2.291]
  - - [512, 128, 1, 8192, 512, 512, 8192, 128]
    - [89, 2.747]
  - - [512, 256, 1, 128, 512, 512, 128, 256]
    - [90, 0.569]
  - - [512, 256, 1, 256, 512, 512, 256, 256]
    - [90, 0.94]
  - - [512, 256, 1, 512, 512, 512, 512, 256]
    - [105, 1.386]
  - - [512, 256, 1, 1024, 512, 512, 1024, 256]
    - [104, 1.918]
  - - [512, 256, 1, 2048, 512, 512, 2048, 256]
    - [50, 2.317]
  - - [512, 256, 1, 4096, 512, 512, 4096, 256]
    - [83, 3.334]
  - - [512, 256, 1, 8192, 512, 512, 8192, 256]
    - [63, 3.5]
  - - [512, 512, 1, 128, 512, 512, 128, 512]
    - [53, 0.983]
  - - [512, 512, 1, 256, 512, 512, 256, 512]
    - [84, 1.581]
  - - [512, 512, 1, 512, 512, 512, 512, 512]
    - [86, 2.272]
  - - [512, 512, 1, 1024, 512, 512, 1024, 512]
    - [102, 2.482]
  - - [512, 512, 1, 2048, 512, 512, 2048, 512]
    - [46, 3.018]
  - - [512, 512, 1, 4096, 512, 512, 4096, 512]
    - [70, 3.703]
  - - [512, 512, 1, 8192, 512, 512, 8192, 512]
    - [23, 4.725]
  - - [512, 1024, 1, 128, 512, 512, 128, 1024]
    - [77, 1.315]
  - - [512, 1024, 1, 256, 512, 512, 256, 1024]
    - [80, 2.235]
  - - [512, 1024, 1, 512, 512, 512, 512, 1024]
    - [80, 3.094]
  - - [512, 1024, 1, 1024, 512, 512, 1024, 1024]
    - [100, 3.467]
  - - [512, 1024, 1, 2048, 512, 512, 2048, 1024]
    - [12, 4.089]
  - - [512, 1024, 1, 4096, 512, 512, 4096, 1024]
    - [21, 4.469]
  - - [512, 1024, 1, 8192, 512, 512, 8192, 1024]
    - [21, 5.481]
  - - [512, 2048, 1, 128, 512, 512, 128, 2048]
    - [42, 1.631]
  - - [512, 2048, 1, 256, 512, 512, 256, 2048]
    - [41, 2.811]
  - - [512, 2048, 1, 512, 512, 512, 512, 2048]
    - [88, 3.407]
  - - [512, 2048, 1, 1024, 512, 512, 1024, 2048]
    - [84, 4.292]
  - - [512, 2048, 1, 2048, 512, 512, 2048, 2048]
    - [84, 4.896]
  - - [512, 2048, 1, 4096, 512, 512, 4096, 2048]
    - [27, 5.404]
  - - [512, 2048, 1, 8192, 512, 512, 8192, 2048]
    - [56, 5.975]
  - - [512, 4096, 1, 128, 512, 512, 128, 4096]
    - [22, 2.14]
  - - [512, 4096, 1, 256, 512, 512, 256, 4096]
    - [20, 3.449]
  - - [512, 4096, 1, 512, 512, 512, 512, 4096]
    - [80, 4.246]
  - - [512, 4096, 1, 1024, 512, 512, 1024, 4096]
    - [70, 5.384]
  - - [512, 4096, 1, 2048, 512, 512, 2048, 4096]
    - [72, 6.076]
  - - [512, 4096, 1, 4096, 512, 512, 4096, 4096]
    - [21, 5.981]
  - - [512, 4096, 1, 8192, 512, 512, 8192, 4096]
    - [25, 7.038]
  - - [512, 8192, 1, 128, 512, 512, 128, 8192]
    - [41, 2.55]
  - - [512, 8192, 1, 256, 512, 512, 256, 8192]
    - [44, 3.982]
  - - [512, 8192, 1, 512, 512, 512, 512, 8192]
    - [44, 5.599]
  - - [512, 8192, 1, 1024, 512, 512, 1024, 8192]
    - [40, 6.728]
  - - [512, 8192, 1, 2048, 512, 512, 2048, 8192]
    - [65, 6.82]
  - - [512, 8192, 1, 4096, 512, 512, 4096, 8192]
    - [29, 7.136]
  - - [512, 8192, 1, 8192, 512, 512, 8192, 8192]
    - [29, 7.818]
  - - [1024, 128, 1, 128, 1024, 1024, 128, 128]
    - [90, 0.569]
  - - [1024, 128, 1, 256, 1024, 1024, 256, 128]
    - [90, 0.939]
  - - [1024, 128, 1, 512, 1024, 1024, 512, 128]
    - [90, 1.403]
  - - [1024, 128, 1, 1024, 1024, 1024, 1024, 128]
    - [105, 1.936]
  - - [1024, 128, 1, 2048, 1024, 1024, 2048, 128]
    - [52, 2.243]
  - - [1024, 128, 1, 4096, 1024, 1024, 4096, 128]
    - [74, 3.221]
  - - [1024, 128, 1, 8192, 1024, 1024, 8192, 128]
    - [94, 3.427]
  - - [1024, 256, 1, 128, 1024, 1024, 128, 256]
    - [86, 0.971]
  - - [1024, 256, 1, 256, 1024, 1024, 256, 256]
    - [85, 1.611]
  - - [1024, 256, 1, 512, 1024, 1024, 512, 256]
    - [89, 2.242]
  - - [1024, 256, 1, 1024, 1024, 1024, 1024, 256]
    - [82, 2.546]
  - - [1024, 256, 1, 2048, 1024, 1024, 2048, 256]
    - [80, 2.827]
  - - [1024, 256, 1, 4096, 1024, 1024, 4096, 256]
    - [74, 3.713]
  - - [1024, 256, 1, 8192, 1024, 1024, 8192, 256]
    - [15, 4.635]
  - - [1024, 512, 1, 128, 1024, 1024, 128, 512]
    - [77, 1.35]
  - - [1024, 512, 1, 256, 1024, 1024, 256, 512]
    - [80, 2.299]
  - - [1024, 512, 1, 512, 1024, 1024, 512, 512]
    - [74, 3.041]
  - - [1024, 512, 1, 1024, 1024, 1024, 1024, 512]
    - [95, 3.468]
  - - [1024, 512, 1, 2048, 1024, 1024, 2048, 512]
    - [12, 3.998]
  - - [1024, 512, 1, 4096, 1024, 1024, 4096, 512]
    - [21, 4.458]
  - - [1024, 512, 1, 8192, 1024, 1024, 8192, 512]
    - [64, 5.136]
  - - [1024, 1024, 1, 128, 1024, 1024, 128, 1024]
    - [41, 1.738]
  - - [1024, 1024, 1, 256, 1024, 1024, 256, 1024]
    - [39, 2.723]
  - - [1024, 1024, 1, 512, 1024, 1024, 512, 1024]
    - [84, 3.531]
  - - [1024, 1024, 1, 1024, 1024, 1024, 1024, 1024]
    - [87, 4.033]
  - - [1024, 1024, 1, 2048, 1024, 1024, 2048, 1024]
    - [85, 4.679]
  - - [1024, 1024, 1, 4096, 1024, 1024, 4096, 1024]
    - [29, 5.429]
  - - [1024, 1024, 1, 8192, 1024, 1024, 8192, 1024]
    - [61, 5.834]
  - - [1024, 2048, 1, 128, 1024, 1024, 128, 2048]
    - [15, 2.159]
  - - [1024, 2048, 1, 256, 1024, 1024, 256, 2048]
    - [26, 3.509]
  - - [1024, 2048, 1, 512, 1024, 1024, 512, 2048]
    - [78, 4.3]
  - - [1024, 2048, 1, 1024, 1024, 1024, 1024, 2048]
    - [70, 5.335]
  - - [1024, 2048, 1, 2048, 1024, 1024, 2048, 2048]
    - [72, 5.912]
  - - [1024, 2048, 1, 4096, 1024, 1024, 4096, 2048]
    - [21, 5.807]
  - - [1024, 2048, 1, 8192, 1024, 1024, 8192, 2048]
    - [25, 6.643]
  - - [1024, 4096, 1, 128, 1024, 1024, 128, 4096]
    - [41, 2.569]
  - - [1024, 4096, 1, 256, 1024, 1024, 256, 4096]
    - [40, 3.925]
  - - [1024, 4096, 1, 512, 1024, 1024, 512, 4096]
    - [37, 5.439]
  - - [1024, 4096, 1, 1024, 1024, 1024, 1024, 4096]
    - [44, 6.366]
  - - [1024, 4096, 1, 2048, 1024, 1024, 2048, 4096]
    - [66, 6.798]
  - - [1024, 4096, 1, 4096, 1024, 1024, 4096, 4096]
    - [27, 6.972]
  - - [1024, 4096, 1, 8192, 1024, 1024, 8192, 4096]
    - [12, 7.603]
  - - [1024, 8192, 1, 128, 1024, 1024, 128, 8192]
    - [13, 2.681]
  - - [1024, 8192, 1, 256, 1024, 1024, 256, 8192]
    - [13, 4.282]
  - - [1024, 8192, 1, 512, 1024, 1024, 512, 8192]
    - [21, 6.021]
  - - [1024, 8192, 1, 1024, 1024, 1024, 1024, 8192]
    - [21, 7.503]
  - - [1024, 8192, 1, 2048, 1024, 1024, 2048, 8192]
    - [55, 7.531]
  - - [1024, 8192, 1, 4096, 1024, 1024, 4096, 8192]
    - [21, 7.648]
  - - [1024, 8192, 1, 8192, 1024, 1024, 8192, 8192]
    - [5, 7.792]
  - - [2048, 128, 1, 128, 2048, 2048, 128, 128]
    - [53, 0.993]
  - - [2048, 128, 1, 256, 2048, 2048, 256, 128]
    - [85, 1.601]
  - - [2048, 128, 1, 512, 2048, 2048, 512, 128]
    - [84, 2.252]
  - - [2048, 128, 1, 1024, 2048, 2048, 1024, 128]
    - [80, 2.477]
  - - [2048, 128, 1, 2048, 2048, 2048, 2048, 128]
    - [41, 2.867]
  - - [2048, 128, 1, 4096, 2048, 2048, 4096, 128]
    - [72, 3.682]
  - - [2048, 128, 1, 8192, 2048, 2048, 8192, 128]
    - [70, 4.586]
  - - [2048, 256, 1, 128, 2048, 2048, 128, 256]
    - [81, 1.303]
  - - [2048, 256, 1, 256, 2048, 2048, 256, 256]
    - [78, 2.334]
  - - [2048, 256, 1, 512, 2048, 2048, 512, 256]
    - [72, 3.093]
  - - [2048, 256, 1, 1024, 2048, 2048, 1024, 256]
    - [95, 3.391]
  - - [2048, 256, 1, 2048, 2048, 2048, 2048, 256]
    - [12, 3.932]
  - - [2048, 256, 1, 4096, 2048, 2048, 4096, 256]
    - [74, 4.475]
  - - [2048, 256, 1, 8192, 2048, 2048, 8192, 256]
    - [23, 5.503]
  - - [2048, 512, 1, 128, 2048, 2048, 128, 512]
    - [49, 1.775]
  - - [2048, 512, 1, 256, 2048, 2048, 256, 512]
    - [41, 2.626]
  - - [2048, 512, 1, 512, 2048, 2048, 512, 512]
    - [88, 3.477]
  - - [2048, 512, 1, 1024, 2048, 2048, 1024, 512]
    - [84, 3.948]
  - - [2048, 512, 1, 2048, 2048, 2048, 2048, 512]
    - [73, 4.624]
  - - [2048, 512, 1, 4096, 2048, 2048, 4096, 512]
    - [21, 5.546]
  - - [2048, 512, 1, 8192, 2048, 2048, 8192, 512]
    - [29, 5.929]
  - - [2048, 1024, 1, 128, 2048, 2048, 128, 1024]
    - [24, 2.093]
  - - [2048, 1024, 1, 256, 2048, 2048, 256, 1024]
    - [11, 3.499]
  - - [2048, 1024, 1, 512, 2048, 2048, 512, 1024]
    - [78, 4.215]
  - - [2048, 1024, 1, 1024, 2048, 2048, 1024, 1024]
    - [74, 5.249]
  - - [2048, 1024, 1, 2048, 2048, 2048, 2048, 1024]
    - [75, 5.71]
  - - [2048, 1024, 1, 4096, 2048, 2048, 4096, 1024]
    - [97, 5.589]
  - - [2048, 1024, 1, 8192, 2048, 2048, 8192, 1024]
    - [19, 6.769]
  - - [2048, 2048, 1, 128, 2048, 2048, 128, 2048]
    - [39, 2.5]
  - - [2048, 2048, 1, 256, 2048, 2048, 256, 2048]
    - [37, 3.843]
  - - [2048, 2048, 1, 512, 2048, 2048, 512, 2048]
    - [37, 5.213]
  - - [2048, 2048, 1, 1024, 2048, 2048, 1024, 2048]
    - [40, 6.079]
  - - [2048, 2048, 1, 2048, 2048, 2048, 2048, 2048]
    - [64, 6.649]
  - - [2048, 2048, 1, 4096, 2048, 2048, 4096, 2048]
    - [10, 6.607]
  - - [2048, 2048, 1, 8192, 2048, 2048, 8192, 2048]
    - [27, 7.223]
  - - [2048, 4096, 1, 128, 2048, 2048, 128, 4096]
    - [20, 2.593]
  - - [2048, 4096, 1, 256, 2048, 2048, 256, 4096]
    - [26, 4.328]
  - - [2048, 4096, 1, 512, 2048, 2048, 512, 4096]
    - [9, 6.079]
  - - [2048, 4096, 1, 1024, 2048, 2048, 1024, 4096]
    - [21, 7.524]
  - - [2048, 4096, 1, 2048, 2048, 2048, 2048, 4096]
    - [57, 7.404]
  - - [2048, 4096, 1, 4096, 2048, 2048, 4096, 4096]
    - [12, 7.667]
  - - [2048, 4096, 1, 8192, 2048, 2048, 8192, 4096]
    - [5, 7.765]
  - - [2048, 8192, 1, 128, 2048, 2048, 128, 8192]
    - [78, 2.505]
  - - [2048, 8192, 1, 256, 2048, 2048, 256, 8192]
    - [39, 3.74]
  - - [2048, 8192, 1, 512, 2048, 2048, 512, 8192]
    - [7, 5.466]
  - - [2048, 8192, 1, 1024, 2048, 2048, 1024, 8192]
    - [1, 7.086]
  - - [2048, 8192, 1, 2048, 2048, 2048, 2048, 8192]
    - [27, 7.521]
  - - [2048, 8192, 1, 4096, 2048, 2048, 4096, 8192]
    - [23, 7.779]
  - - [2048, 8192, 1, 8192, 2048, 2048, 8192, 8192]
    - [15, 8.102]
  - - [4096, 128, 1, 128, 4096, 4096, 128, 128]
    - [79, 1.246]
  - - [4096, 128, 1, 256, 4096, 4096, 256, 128]
    - [69, 2.151]
  - - [4096, 128, 1, 512, 4096, 4096, 512, 128]
    - [70, 2.984]
  - - [4096, 128, 1, 1024, 4096, 4096, 1024, 128]
    - [96, 3.267]
  - - [4096, 128, 1, 2048, 4096, 4096, 2048, 128]
    - [88, 3.68]
  - - [4096, 128, 1, 4096, 4096, 4096, 4096, 128]
    - [70, 4.426]
  - - [4096, 128, 1, 8192, 4096, 4096, 8192, 128]
    - [63, 5.306]
  - - [4096, 256, 1, 128, 4096, 4096, 128, 256]
    - [46, 1.757]
  - - [4096, 256, 1, 256, 4096, 4096, 256, 256]
    - [42, 2.644]
  - - [4096, 256, 1, 512, 4096, 4096, 512, 256]
    - [65, 3.359]
  - - [4096, 256, 1, 1024, 4096, 4096, 1024, 256]
    - [88, 3.847]
  - - [4096, 256, 1, 2048, 4096, 4096, 2048, 256]
    - [83, 4.528]
  - - [4096, 256, 1, 4096, 4096, 4096, 4096, 256]
    - [12, 5.541]
  - - [4096, 256, 1, 8192, 4096, 4096, 8192, 256]
    - [21, 6.348]
  - - [4096, 512, 1, 128, 4096, 4096, 128, 512]
    - [31, 2.096]
  - - [4096, 512, 1, 256, 4096, 4096, 256, 512]
    - [10, 3.258]
  - - [4096, 512, 1, 512, 4096, 4096, 512, 512]
    - [82, 4.073]
  - - [4096, 512, 1, 1024, 4096, 4096, 1024, 512]
    - [72, 5.171]
  - - [4096, 512, 1, 2048, 4096, 4096, 2048, 512]
    - [73, 5.871]
  - - [4096, 512, 1, 4096, 4096, 4096, 4096, 512]
    - [29, 6.078]
  - - [4096, 512, 1, 8192, 4096, 4096, 8192, 512]
    - [19, 7.109]
  - - [4096, 1024, 1, 128, 4096, 4096, 128, 1024]
    - [46, 2.45]
  - - [4096, 1024, 1, 256, 4096, 4096, 256, 1024]
    - [42, 3.385]
  - - [4096, 1024, 1, 512, 4096, 4096, 512, 1024]
    - [47, 5.181]
  - - [4096, 1024, 1, 1024, 4096, 4096, 1024, 1024]
    - [32, 5.956]
  - - [4096, 1024, 1, 2048, 4096, 4096, 2048, 1024]
    - [67, 6.429]
  - - [4096, 1024, 1, 4096, 4096, 4096, 4096, 1024]
    - [12, 6.694]
  - - [4096, 1024, 1, 8192, 4096, 4096, 8192, 1024]
    - [27, 7.417]
  - - [4096, 2048, 1, 128, 4096, 4096, 128, 2048]
    - [30, 2.504]
  - - [4096, 2048, 1, 256, 4096, 4096, 256, 2048]
    - [19, 3.943]
  - - [4096, 2048, 1, 512, 4096, 4096, 512, 2048]
    - [9, 5.725]
  - - [4096, 2048, 1, 1024, 4096, 4096, 1024, 2048]
    - [27, 7.164]
  - - [4096, 2048, 1, 2048, 4096, 4096, 2048, 2048]
    - [59, 7.045]
  - - [4096, 2048, 1, 4096, 4096, 4096, 4096, 2048]
    - [58, 6.919]
  - - [4096, 2048, 1, 8192, 4096, 4096, 8192, 2048]
    - [60, 7.257]
  - - [4096, 4096, 1, 128, 4096, 4096, 128, 4096]
    - [48, 2.414]
  - - [4096, 4096, 1, 256, 4096, 4096, 256, 4096]
    - [43, 3.61]
  - - [4096, 4096, 1, 512, 4096, 4096, 512, 4096]
    - [0, 5.45]
  - - [4096, 4096, 1, 1024, 4096, 4096, 1024, 4096]
    - [12, 6.763]
  - - [4096, 4096, 1, 2048, 4096, 4096, 2048, 4096]
    - [15, 7.445]
  - - [4096, 4096, 1, 4096, 4096, 4096, 4096, 4096]
    - [18, 7.76]
  - - [4096, 4096, 1, 8192, 4096, 4096, 8192, 4096]
    - [7, 7.891]
  - - [4096, 8192, 1, 128, 4096, 4096, 128, 8192]
    - [77, 2.28]
  - - [4096, 8192, 1, 256, 4096, 4096, 256, 8192]
    - [19, 3.407]
  - - [4096, 8192, 1, 512, 4096, 4096, 512, 8192]
    - [27, 4.901]
  - - [4096, 8192, 1, 1024, 4096, 4096, 1024, 8192]
    - [12, 6.383]
  - - [4096, 8192, 1, 2048, 4096, 4096, 2048, 8192]
    - [11, 7.449]
  - - [4096, 8192, 1, 4096, 4096, 4096, 4096, 8192]
    - [14, 7.822]
  - - [4096, 8192, 1, 8192, 4096, 4096, 8192, 8192]
    - [4, 8.146]
  - - [8192, 128, 1, 128, 8192, 8192, 128, 128]
    - [42, 1.739]
  - - [8192, 128, 1, 256, 8192, 8192, 256, 128]
    - [49, 2.546]
  - - [8192, 128, 1, 512, 8192, 8192, 512, 128]
    - [68, 3.318]
  - - [8192, 128, 1, 1024, 8192, 8192, 1024, 128]
    - [89, 3.95]
  - - [8192, 128, 1, 2048, 8192, 8192, 2048, 128]
    - [88, 4.555]
  - - [8192, 128, 1, 4096, 8192, 8192, 4096, 128]
    - [71, 5.203]
  - - [8192, 128, 1, 8192, 8192, 8192, 8192, 128]
    - [71, 5.835]
  - - [8192, 256, 1, 128, 8192, 8192, 128, 256]
    - [15, 2.115]
  - - [8192, 256, 1, 256, 8192, 8192, 256, 256]
    - [22, 3.28]
  - - [8192, 256, 1, 512, 8192, 8192, 512, 256]
    - [83, 4.026]
  - - [8192, 256, 1, 1024, 8192, 8192, 1024, 256]
    - [72, 5.107]
  - - [8192, 256, 1, 2048, 8192, 8192, 2048, 256]
    - [72, 5.895]
  - - [8192, 256, 1, 4096, 8192, 8192, 4096, 256]
    - [12, 6.212]
  - - [8192, 256, 1, 8192, 8192, 8192, 8192, 256]
    - [21, 7.479]
  - - [8192, 512, 1, 128, 8192, 8192, 128, 512]
    - [45, 2.403]
  - - [8192, 512, 1, 256, 8192, 8192, 256, 512]
    - [45, 3.688]
  - - [8192, 512, 1, 512, 8192, 8192, 512, 512]
    - [33, 4.95]
  - - [8192, 512, 1, 1024, 8192, 8192, 1024, 512]
    - [34, 6.005]
  - - [8192, 512, 1, 2048, 8192, 8192, 2048, 512]
    - [65, 6.639]
  - - [8192, 512, 1, 4096, 8192, 8192, 4096, 512]
    - [23, 7.191]
  - - [8192, 512, 1, 8192, 8192, 8192, 8192, 512]
    - [24, 7.585]
  - - [8192, 1024, 1, 128, 8192, 8192, 128, 1024]
    - [9, 2.488]
  - - [8192, 1024, 1, 256, 8192, 8192, 256, 1024]
    - [17, 4.122]
  - - [8192, 1024, 1, 512, 8192, 8192, 512, 1024]
    - [22, 5.775]
  - - [8192, 1024, 1, 1024, 8192, 8192, 1024, 1024]
    - [27, 7.378]
  - - [8192, 1024, 1, 2048, 8192, 8192, 2048, 1024]
    - [54, 7.419]
  - - [8192, 1024, 1, 4096, 8192, 8192, 4096, 1024]
    - [10, 7.344]
  - - [8192, 1024, 1, 8192, 8192, 8192, 8192, 1024]
    - [19, 7.561]
  - - [8192, 2048, 1, 128, 8192, 8192, 128, 2048]
    - [48, 2.358]
  - - [8192, 2048, 1, 256, 8192, 8192, 256, 2048]
    - [5, 3.621]
  - - [8192, 2048, 1, 512, 8192, 8192, 512, 2048]
    - [0, 5.233]
  - - [8192, 2048, 1, 1024, 8192, 8192, 1024, 2048]
    - [6, 6.826]
  - - [8192, 2048, 1, 2048, 8192, 8192, 2048, 2048]
    - [9, 7.235]
  - - [8192, 2048, 1, 4096, 8192, 8192, 4096, 2048]
    - [15, 7.888]
  - - [8192, 2048, 1, 8192, 8192, 8192, 8192, 2048]
    - [8, 7.933]
  - - [8192, 4096, 1, 128, 8192, 8192, 128, 4096]
    - [83, 2.173]
  - - [8192, 4096, 1, 256, 8192, 8192, 256, 4096]
    - [42, 3.336]
  - - [8192, 4096, 1, 512, 8192, 8192, 512, 4096]
    - [9, 4.963]
  - - [8192, 4096, 1, 1024, 8192, 8192, 1024, 4096]
    - [10, 6.331]
  - - [8192, 4096, 1, 2048, 8192, 8192, 2048, 4096]
    - [20, 7.263]
  - - [8192, 4096, 1, 4096, 8192, 8192, 4096, 4096]
    - [3, 7.84]
  - - [8192, 4096, 1, 8192, 8192, 8192, 8192, 4096]
    - [7, 8.063]
  - - [8192, 8192, 1, 128, 8192, 8192, 128, 8192]
    - [16, 2.158]
  - - [8192, 8192, 1, 256, 8192, 8192, 256, 8192]
    - [24, 3.503]
  - - [8192, 8192, 1, 512, 8192, 8192, 512, 8192]
    - [9, 5.259]
  - - [8192, 8192, 1, 1024, 8192, 8192, 1024, 8192]
    - [9, 6.555]
  - - [8192, 8192, 1, 2048, 8192, 8192, 2048, 8192]
    - [12, 7.296]
  - - [8192, 8192, 1, 4096, 8192, 8192, 4096, 8192]
    - [15, 7.671]
  - - [8192, 8192, 1, 8192, 8192, 8192, 8192, 8192]
    - [2, 7.544]
  - - [1, 1, 1, 32, 1, 1, 32, 1]
    - [116, 0.0]
- null
- null
- DeviceEfficiency
- GridBased
