library/src/amd_detail/rocblaslt/src/Tensile/Logic/streamk/gfx942_38cu/aquavanjaram942_Cijk_Alik_Bljk_HHS_BH_UserArgs.yaml
- {MinimumRequiredVersion: 4.33.0}
- aquavanjaram942
- {Architecture: gfx942, CUCount: 38}
- [Device 0049, Device 0050]
    SolutionIndex: 0
    SolutionNameMin: Cijk_Alik_Bljk_HHS_BH_UserArgs_MT256x64x32_MI16x16x1_SN_LDSB1_CLR1_GSU0_GSUC0_GSUWGMRR0_K1_LBSPPA512_LBSPPB128_MIWT8_2_PLR1_SU32_SUM0_SUS256_VWA8_VWB2_WGM1_WGMXCC1_WGMXCCGn1
    SolutionIndex: 1
    SolutionNameMin: Cijk_Alik_Bljk_HHS_BH_UserArgs_MT256x64x32_MI16x16x1_SN_LDSB1_CLR1_GSU0_GSUC0_GSUWGMRR0_K1_LBSPPA512_LBSPPB128_MIWT8_2_PLR1_SU32_SUM0_SUS256_VWA8_VWB1_WGM4_WGMXCC1_WGMXCCGn1
    SolutionIndex: 2
    SolutionNameMin: Cijk_Alik_Bljk_HHS_BH_UserArgs_MT256x64x32_MI16x16x1_SN_LDSB1_CLR1_GSU0_GSUC0_GSUWGMRR0_K1_LBSPPA512_LBSPPB128_MIWT8_2_PLR1_SU32_SUM0_SUS256_VWA8_VWB1_WGM8_WGMXCC1_WGMXCCGn1
    SolutionIndex: 3
    SolutionNameMin: Cijk_Alik_Bljk_HHS_BH_UserArgs_MT256x64x32_MI16x16x1_SN_LDSB1_CLR1_GSU0_GSUC0_GSUWGMRR0_K1_LBSPPA512_LBSPPB128_MIWT8_2_PLR1_SU32_SUM0_SUS256_VWA8_VWB2_WGM8_WGMXCC1_WGMXCCGn1
    SolutionIndex: 4
    SolutionNameMin: Cijk_Alik_Bljk_HHS_BH_UserArgs_MT128x128x32_MI16x16x1_SN_LDSB1_CLR1_GSU0_GSUC0_GSUWGMRR0_K1_LBSPPA128_LBSPPB128_MIWT4_4_PLR1_SU32_SUM0_SUS256_VWA2_VWB1_WGM1_WGMXCC1_WGMXCCGn1
    SolutionIndex: 5
    SolutionNameMin: Cijk_Alik_Bljk_HHS_BH_UserArgs_MT128x128x32_MI16x16x1_SN_LDSB1_CLR1_GSU0_GSUC0_GSUWGMRR0_K1_LBSPPA256_LBSPPB128_MIWT4_4_PLR1_SU32_SUM0_SUS256_VWA4_VWB1_WGM1_WGMXCC1_WGMXCCGn1
    SolutionIndex: 6
    SolutionNameMin: Cijk_Alik_Bljk_HHS_BH_UserArgs_MT128x128x32_MI16x16x1_SN_LDSB1_CLR1_GSU0_GSUC0_GSUWGMRR0_K1_LBSPPA128_LBSPPB128_MIWT4_4_PLR1_SU32_SUM0_SUS256_VWA2_VWB2_WGM1_WGMXCC1_WGMXCCGn1
    SolutionIndex: 7
    SolutionNameMin: Cijk_Alik_Bljk_HHS_BH_UserArgs_MT128x128x32_MI16x16x1_SN_LDSB1_CLR1_GSU0_GSUC0_GSUWGMRR0_K1_LBSPPA256_LBSPPB128_MIWT4_4_PLR1_SU32_SUM0_SUS256_VWA4_VWB2_WGM1_WGMXCC1_WGMXCCGn1
    SolutionIndex: 8
    SolutionNameMin: Cijk_Alik_Bljk_HHS_BH_UserArgs_MT128x128x32_MI16x16x1_SN_LDSB1_CLR1_GSU0_GSUC0_GSUWGMRR0_K1_LBSPPA128_LBSPPB256_MIWT4_4_PLR1_SU32_SUM0_SUS256_VWA2_VWB4_WGM1_WGMXCC1_WGMXCCGn1
    SolutionIndex: 9
    SolutionNameMin: Cijk_Alik_Bljk_HHS_BH_UserArgs_MT128x128x32_MI16x16x1_SN_LDSB1_CLR1_GSU0_GSUC0_GSUWGMRR0_K1_LBSPPA256_LBSPPB256_MIWT4_4_PLR1_SU32_SUM0_SUS256_VWA4_VWB4_WGM1_WGMXCC1_WGMXCCGn1
    SolutionIndex: 10
    SolutionNameMin: Cijk_Alik_Bljk_HHS_BH_UserArgs_MT128x128x32_MI16x16x1_SN_LDSB1_CLR1_GSU0_GSUC0_GSUWGMRR0_K1_LBSPPA128_LBSPPB128_MIWT4_4_PLR1_SU32_SUM0_SUS256_VWA2_VWB1_WGM4_WGMXCC1_WGMXCCGn1
    SolutionIndex: 11
    SolutionNameMin: Cijk_Alik_Bljk_HHS_BH_UserArgs_MT128x128x32_MI16x16x1_SN_LDSB1_CLR1_GSU0_GSUC0_GSUWGMRR0_K1_LBSPPA256_LBSPPB128_MIWT4_4_PLR1_SU32_SUM0_SUS256_VWA4_VWB1_WGM4_WGMXCC1_WGMXCCGn1
    SolutionIndex: 12
    SolutionNameMin: Cijk_Alik_Bljk_HHS_BH_UserArgs_MT128x128x32_MI16x16x1_SN_LDSB1_CLR1_GSU0_GSUC0_GSUWGMRR0_K1_LBSPPA128_LBSPPB128_MIWT4_4_PLR1_SU32_SUM0_SUS256_VWA2_VWB2_WGM4_WGMXCC1_WGMXCCGn1
    SolutionIndex: 13
    SolutionNameMin: Cijk_Alik_Bljk_HHS_BH_UserArgs_MT128x128x32_MI16x16x1_SN_LDSB1_CLR1_GSU0_GSUC0_GSUWGMRR0_K1_LBSPPA256_LBSPPB128_MIWT4_4_PLR1_SU32_SUM0_SUS256_VWA4_VWB2_WGM4_WGMXCC1_WGMXCCGn1
    SolutionIndex: 14
    SolutionNameMin: Cijk_Alik_Bljk_HHS_BH_UserArgs_MT128x128x32_MI16x16x1_SN_LDSB1_CLR1_GSU0_GSUC0_GSUWGMRR0_K1_LBSPPA128_LBSPPB256_MIWT4_4_PLR1_SU32_SUM0_SUS256_VWA2_VWB4_WGM4_WGMXCC1_WGMXCCGn1
    SolutionIndex: 15
    SolutionNameMin: Cijk_Alik_Bljk_HHS_BH_UserArgs_MT128x128x32_MI16x16x1_SN_LDSB1_CLR1_GSU0_GSUC0_GSUWGMRR0_K1_LBSPPA256_LBSPPB256_MIWT4_4_PLR1_SU32_SUM0_SUS256_VWA4_VWB4_WGM4_WGMXCC1_WGMXCCGn1
    SolutionIndex: 16
    SolutionNameMin: Cijk_Alik_Bljk_HHS_BH_UserArgs_MT128x128x32_MI16x16x1_SN_LDSB1_CLR1_GSU0_GSUC0_GSUWGMRR0_K1_LBSPPA128_LBSPPB128_MIWT4_4_PLR1_SU32_SUM0_SUS256_VWA2_VWB1_WGM8_WGMXCC1_WGMXCCGn1
    SolutionIndex: 17
    SolutionNameMin: Cijk_Alik_Bljk_HHS_BH_UserArgs_MT128x128x32_MI16x16x1_SN_LDSB1_CLR1_GSU0_GSUC0_GSUWGMRR0_K1_LBSPPA256_LBSPPB128_MIWT4_4_PLR1_SU32_SUM0_SUS256_VWA4_VWB1_WGM8_WGMXCC1_WGMXCCGn1
    SolutionIndex: 18
    SolutionNameMin: Cijk_Alik_Bljk_HHS_BH_UserArgs_MT128x128x32_MI16x16x1_SN_LDSB1_CLR1_GSU0_GSUC0_GSUWGMRR0_K1_LBSPPA128_LBSPPB128_MIWT4_4_PLR1_SU32_SUM0_SUS256_VWA2_VWB2_WGM8_WGMXCC1_WGMXCCGn1
    SolutionIndex: 19
    SolutionNameMin: Cijk_Alik_Bljk_HHS_BH_UserArgs_MT128x128x32_MI16x16x1_SN_LDSB1_CLR1_GSU0_GSUC0_GSUWGMRR0_K1_LBSPPA256_LBSPPB256_MIWT4_4_PLR1_SU32_SUM0_SUS256_VWA4_VWB4_WGM8_WGMXCC1_WGMXCCGn1
    SolutionIndex: 20
    SolutionNameMin: Cijk_Alik_Bljk_HHS_BH_UserArgs_MT128x64x32_MI16x16x1_SN_LDSB0_CLR1_GSU0_GSUC0_GSUWGMRR0_K1_LBSPPA256_LBSPPB128_MIWT4_2_PLR1_SU32_SUM0_SUS256_VWA4_VWB1_WGM8_WGMXCC1_WGMXCCGn1
    SolutionIndex: 21
    SolutionNameMin: Cijk_Alik_Bljk_HHS_BH_UserArgs_MT256x64x64_MI16x16x1_SN_LDSB1_CLR1_GSU0_GSUC0_GSUWGMRR0_K1_LBSPPA1024_LBSPPB128_MIWT8_2_PLR1_SU32_SUM0_SUS256_VWA8_VWB1_WGM1_WGMXCC1_WGMXCCGn1
    SolutionIndex: 22
    SolutionNameMin: Cijk_Alik_Bljk_HHS_BH_UserArgs_MT256x64x64_MI16x16x1_SN_LDSB1_CLR1_GSU0_GSUC0_GSUWGMRR0_K1_LBSPPA256_LBSPPB256_MIWT8_2_PLR1_SU32_SUM0_SUS256_VWA2_VWB2_WGM8_WGMXCC1_WGMXCCGn1
    SolutionIndex: 23
    SolutionNameMin: Cijk_Alik_Bljk_HHS_BH_UserArgs_MT128x128x64_MI16x16x1_SN_LDSB1_CLR1_GSU0_GSUC0_GSUWGMRR0_K1_LBSPPA128_LBSPPB128_MIWT4_4_PLR1_SU32_SUM0_SUS256_VWA1_VWB1_WGM1_WGMXCC1_WGMXCCGn1
    SolutionIndex: 24
    SolutionNameMin: Cijk_Alik_Bljk_HHS_BH_UserArgs_MT128x128x64_MI16x16x1_SN_LDSB1_CLR1_GSU0_GSUC0_GSUWGMRR0_K1_LBSPPA256_LBSPPB128_MIWT4_4_PLR1_SU32_SUM0_SUS256_VWA2_VWB1_WGM1_WGMXCC1_WGMXCCGn1
    SolutionIndex: 25
    SolutionNameMin: Cijk_Alik_Bljk_HHS_BH_UserArgs_MT128x128x64_MI16x16x1_SN_LDSB1_CLR1_GSU0_GSUC0_GSUWGMRR0_K1_LBSPPA512_LBSPPB128_MIWT4_4_PLR1_SU32_SUM0_SUS256_VWA4_VWB1_WGM1_WGMXCC1_WGMXCCGn1
    SolutionIndex: 26
    SolutionNameMin: Cijk_Alik_Bljk_HHS_BH_UserArgs_MT128x128x64_MI16x16x1_SN_LDSB1_CLR1_GSU0_GSUC0_GSUWGMRR0_K1_LBSPPA128_LBSPPB256_MIWT4_4_PLR1_SU32_SUM0_SUS256_VWA1_VWB2_WGM1_WGMXCC1_WGMXCCGn1
    SolutionIndex: 27
    SolutionNameMin: Cijk_Alik_Bljk_HHS_BH_UserArgs_MT128x128x64_MI16x16x1_SN_LDSB1_CLR1_GSU0_GSUC0_GSUWGMRR0_K1_LBSPPA256_LBSPPB256_MIWT4_4_PLR1_SU32_SUM0_SUS256_VWA2_VWB2_WGM1_WGMXCC1_WGMXCCGn1
    SolutionIndex: 28
    SolutionNameMin: Cijk_Alik_Bljk_HHS_BH_UserArgs_MT128x128x64_MI16x16x1_SN_LDSB1_CLR1_GSU0_GSUC0_GSUWGMRR0_K1_LBSPPA512_LBSPPB256_MIWT4_4_PLR1_SU32_SUM0_SUS256_VWA4_VWB2_WGM1_WGMXCC1_WGMXCCGn1
    SolutionIndex: 29
    SolutionNameMin: Cijk_Alik_Bljk_HHS_BH_UserArgs_MT128x128x64_MI16x16x1_SN_LDSB1_CLR1_GSU0_GSUC0_GSUWGMRR0_K1_LBSPPA128_LBSPPB512_MIWT4_4_PLR1_SU32_SUM0_SUS256_VWA1_VWB4_WGM1_WGMXCC1_WGMXCCGn1
    SolutionIndex: 30
    SolutionNameMin: Cijk_Alik_Bljk_HHS_BH_UserArgs_MT128x128x64_MI16x16x1_SN_LDSB1_CLR1_GSU0_GSUC0_GSUWGMRR0_K1_LBSPPA256_LBSPPB512_MIWT4_4_PLR1_SU32_SUM0_SUS256_VWA2_VWB4_WGM1_WGMXCC1_WGMXCCGn1
    SolutionIndex: 31
    SolutionNameMin: Cijk_Alik_Bljk_HHS_BH_UserArgs_MT128x128x64_MI16x16x1_SN_LDSB1_CLR1_GSU0_GSUC0_GSUWGMRR0_K1_LBSPPA512_LBSPPB512_MIWT4_4_PLR1_SU32_SUM0_SUS256_VWA4_VWB4_WGM1_WGMXCC1_WGMXCCGn1
    SolutionIndex: 32
    SolutionNameMin: Cijk_Alik_Bljk_HHS_BH_UserArgs_MT128x128x64_MI16x16x1_SN_LDSB1_CLR1_GSU0_GSUC0_GSUWGMRR0_K1_LBSPPA256_LBSPPB512_MIWT4_4_PLR2_SU32_SUM0_SUS256_VWA2_VWB4_WGM1_WGMXCC1_WGMXCCGn1
    SolutionIndex: 33
    SolutionNameMin: Cijk_Alik_Bljk_HHS_BH_UserArgs_MT128x128x64_MI16x16x1_SN_LDSB1_CLR1_GSU0_GSUC0_GSUWGMRR0_K1_LBSPPA256_LBSPPB128_MIWT4_4_PLR1_SU32_SUM0_SUS256_VWA2_VWB1_WGM4_WGMXCC1_WGMXCCGn1
    SolutionIndex: 34
    SolutionNameMin: Cijk_Alik_Bljk_HHS_BH_UserArgs_MT128x128x64_MI16x16x1_SN_LDSB1_CLR1_GSU0_GSUC0_GSUWGMRR0_K1_LBSPPA512_LBSPPB128_MIWT4_4_PLR1_SU32_SUM0_SUS256_VWA4_VWB1_WGM4_WGMXCC1_WGMXCCGn1
    SolutionIndex: 35
    SolutionNameMin: Cijk_Alik_Bljk_HHS_BH_UserArgs_MT128x128x64_MI16x16x1_SN_LDSB1_CLR1_GSU0_GSUC0_GSUWGMRR0_K1_LBSPPA128_LBSPPB256_MIWT4_4_PLR1_SU32_SUM0_SUS256_VWA1_VWB2_WGM4_WGMXCC1_WGMXCCGn1
    SolutionIndex: 36
    SolutionNameMin: Cijk_Alik_Bljk_HHS_BH_UserArgs_MT128x128x64_MI16x16x1_SN_LDSB1_CLR1_GSU0_GSUC0_GSUWGMRR0_K1_LBSPPA512_LBSPPB256_MIWT4_4_PLR1_SU32_SUM0_SUS256_VWA4_VWB2_WGM4_WGMXCC1_WGMXCCGn1
    SolutionIndex: 37
    SolutionNameMin: Cijk_Alik_Bljk_HHS_BH_UserArgs_MT128x128x64_MI16x16x1_SN_LDSB1_CLR1_GSU0_GSUC0_GSUWGMRR0_K1_LBSPPA256_LBSPPB512_MIWT4_4_PLR1_SU32_SUM0_SUS256_VWA2_VWB4_WGM4_WGMXCC1_WGMXCCGn1
    SolutionIndex: 38
    SolutionNameMin: Cijk_Alik_Bljk_HHS_BH_UserArgs_MT128x128x64_MI16x16x1_SN_LDSB1_CLR1_GSU0_GSUC0_GSUWGMRR0_K1_LBSPPA512_LBSPPB512_MIWT4_4_PLR1_SU32_SUM0_SUS256_VWA4_VWB4_WGM4_WGMXCC1_WGMXCCGn1
    SolutionIndex: 39
    SolutionNameMin: Cijk_Alik_Bljk_HHS_BH_UserArgs_MT128x128x64_MI16x16x1_SN_LDSB1_CLR1_GSU0_GSUC0_GSUWGMRR0_K1_LBSPPA256_LBSPPB128_MIWT4_4_PLR1_SU32_SUM0_SUS256_VWA2_VWB1_WGM8_WGMXCC1_WGMXCCGn1
    SolutionIndex: 40
    SolutionNameMin: Cijk_Alik_Bljk_HHS_BH_UserArgs_MT128x128x64_MI16x16x1_SN_LDSB1_CLR1_GSU0_GSUC0_GSUWGMRR0_K1_LBSPPA512_LBSPPB128_MIWT4_4_PLR1_SU32_SUM0_SUS256_VWA4_VWB1_WGM8_WGMXCC1_WGMXCCGn1
    SolutionIndex: 41
    SolutionNameMin: Cijk_Alik_Bljk_HHS_BH_UserArgs_MT128x128x64_MI16x16x1_SN_LDSB1_CLR1_GSU0_GSUC0_GSUWGMRR0_K1_LBSPPA128_LBSPPB256_MIWT4_4_PLR1_SU32_SUM0_SUS256_VWA1_VWB2_WGM8_WGMXCC1_WGMXCCGn1
    SolutionIndex: 42
    SolutionNameMin: Cijk_Alik_Bljk_HHS_BH_UserArgs_MT128x128x64_MI16x16x1_SN_LDSB1_CLR1_GSU0_GSUC0_GSUWGMRR0_K1_LBSPPA256_LBSPPB256_MIWT4_4_PLR1_SU32_SUM0_SUS256_VWA2_VWB2_WGM8_WGMXCC1_WGMXCCGn1
    SolutionIndex: 43
    SolutionNameMin: Cijk_Alik_Bljk_HHS_BH_UserArgs_MT128x128x64_MI16x16x1_SN_LDSB1_CLR1_GSU0_GSUC0_GSUWGMRR0_K1_LBSPPA512_LBSPPB256_MIWT4_4_PLR1_SU32_SUM0_SUS256_VWA4_VWB2_WGM8_WGMXCC1_WGMXCCGn1
    SolutionIndex: 44
    SolutionNameMin: Cijk_Alik_Bljk_HHS_BH_UserArgs_MT128x128x64_MI16x16x1_SN_LDSB1_CLR1_GSU0_GSUC0_GSUWGMRR0_K1_LBSPPA128_LBSPPB512_MIWT4_4_PLR1_SU32_SUM0_SUS256_VWA1_VWB4_WGM8_WGMXCC1_WGMXCCGn1
    SolutionIndex: 45
    SolutionNameMin: Cijk_Alik_Bljk_HHS_BH_UserArgs_MT128x128x64_MI16x16x1_SN_LDSB1_CLR1_GSU0_GSUC0_GSUWGMRR0_K1_LBSPPA256_LBSPPB512_MIWT4_4_PLR1_SU32_SUM0_SUS256_VWA2_VWB4_WGM8_WGMXCC1_WGMXCCGn1
    SolutionIndex: 46
    SolutionNameMin: Cijk_Alik_Bljk_HHS_BH_UserArgs_MT128x128x64_MI16x16x1_SN_LDSB1_CLR1_GSU0_GSUC0_GSUWGMRR0_K1_LBSPPA512_LBSPPB512_MIWT4_4_PLR1_SU32_SUM0_SUS256_VWA4_VWB4_WGM8_WGMXCC1_WGMXCCGn1
    SolutionIndex: 47
    SolutionNameMin: Cijk_Alik_Bljk_HHS_BH_UserArgs_MT128x128x64_MI16x16x1_SN_LDSB1_CLR1_GSU0_GSUC0_GSUWGMRR0_K1_LBSPPA128_LBSPPB256_MIWT4_4_PLR2_SU32_SUM0_SUS256_VWA1_VWB2_WGM8_WGMXCC1_WGMXCCGn1
    SolutionIndex: 48
    SolutionNameMin: Cijk_Alik_Bljk_HHS_BH_UserArgs_MT64x128x64_MI16x16x1_SN_LDSB1_CLR1_GSU0_GSUC0_GSUWGMRR0_K1_LBSPPA128_LBSPPB128_MIWT2_4_PLR1_SU32_SUM0_SUS256_VWA1_VWB1_WGM1_WGMXCC1_WGMXCCGn1
    SolutionIndex: 49
    SolutionNameMin: Cijk_Alik_Bljk_HHS_BH_UserArgs_MT64x128x64_MI16x16x1_SN_LDSB1_CLR1_GSU0_GSUC0_GSUWGMRR0_K1_LBSPPA256_LBSPPB128_MIWT2_4_PLR1_SU32_SUM0_SUS256_VWA2_VWB1_WGM1_WGMXCC1_WGMXCCGn1
    SolutionIndex: 50
    SolutionNameMin: Cijk_Alik_Bljk_HHS_BH_UserArgs_MT64x128x64_MI16x16x1_SN_LDSB1_CLR1_GSU0_GSUC0_GSUWGMRR0_K1_LBSPPA128_LBSPPB256_MIWT2_4_PLR1_SU32_SUM0_SUS256_VWA1_VWB2_WGM1_WGMXCC1_WGMXCCGn1
    SolutionIndex: 51
    SolutionNameMin: Cijk_Alik_Bljk_HHS_BH_UserArgs_MT64x128x64_MI16x16x1_SN_LDSB1_CLR1_GSU0_GSUC0_GSUWGMRR0_K1_LBSPPA256_LBSPPB256_MIWT2_4_PLR1_SU32_SUM0_SUS256_VWA2_VWB2_WGM1_WGMXCC1_WGMXCCGn1
    SolutionIndex: 52
    SolutionNameMin: Cijk_Alik_Bljk_HHS_BH_UserArgs_MT64x128x64_MI16x16x1_SN_LDSB1_CLR1_GSU0_GSUC0_GSUWGMRR0_K1_LBSPPA128_LBSPPB512_MIWT2_4_PLR1_SU32_SUM0_SUS256_VWA1_VWB4_WGM1_WGMXCC1_WGMXCCGn1
    SolutionIndex: 53
    SolutionNameMin: Cijk_Alik_Bljk_HHS_BH_UserArgs_MT64x128x64_MI16x16x1_SN_LDSB1_CLR1_GSU0_GSUC0_GSUWGMRR0_K1_LBSPPA256_LBSPPB512_MIWT2_4_PLR1_SU32_SUM0_SUS256_VWA2_VWB4_WGM1_WGMXCC1_WGMXCCGn1
    SolutionIndex: 54
    SolutionNameMin: Cijk_Alik_Bljk_HHS_BH_UserArgs_MT64x128x64_MI16x16x1_SN_LDSB1_CLR1_GSU0_GSUC0_GSUWGMRR0_K1_LBSPPA128_LBSPPB256_MIWT2_4_PLR2_SU32_SUM0_SUS256_VWA1_VWB2_WGM1_WGMXCC1_WGMXCCGn1
    SolutionIndex: 55
    SolutionNameMin: Cijk_Alik_Bljk_HHS_BH_UserArgs_MT64x128x64_MI16x16x1_SN_LDSB1_CLR1_GSU0_GSUC0_GSUWGMRR0_K1_LBSPPA128_LBSPPB128_MIWT2_4_PLR1_SU32_SUM0_SUS256_VWA1_VWB1_WGM4_WGMXCC1_WGMXCCGn1
    SolutionIndex: 56
    SolutionNameMin: Cijk_Alik_Bljk_HHS_BH_UserArgs_MT64x128x64_MI16x16x1_SN_LDSB1_CLR1_GSU0_GSUC0_GSUWGMRR0_K1_LBSPPA256_LBSPPB128_MIWT2_4_PLR1_SU32_SUM0_SUS256_VWA2_VWB1_WGM4_WGMXCC1_WGMXCCGn1
    SolutionIndex: 57
    SolutionNameMin: Cijk_Alik_Bljk_HHS_BH_UserArgs_MT64x128x64_MI16x16x1_SN_LDSB1_CLR1_GSU0_GSUC0_GSUWGMRR0_K1_LBSPPA256_LBSPPB256_MIWT2_4_PLR1_SU32_SUM0_SUS256_VWA2_VWB2_WGM4_WGMXCC1_WGMXCCGn1
    SolutionIndex: 58
    SolutionNameMin: Cijk_Alik_Bljk_HHS_BH_UserArgs_MT64x128x64_MI16x16x1_SN_LDSB1_CLR1_GSU0_GSUC0_GSUWGMRR0_K1_LBSPPA256_LBSPPB512_MIWT2_4_PLR1_SU32_SUM0_SUS256_VWA2_VWB4_WGM4_WGMXCC1_WGMXCCGn1
    SolutionIndex: 59
    SolutionNameMin: Cijk_Alik_Bljk_HHS_BH_UserArgs_MT64x128x64_MI16x16x1_SN_LDSB1_CLR1_GSU0_GSUC0_GSUWGMRR0_K1_LBSPPA256_LBSPPB128_MIWT2_4_PLR1_SU32_SUM0_SUS256_VWA2_VWB1_WGM8_WGMXCC1_WGMXCCGn1
    SolutionIndex: 60
    SolutionNameMin: Cijk_Alik_Bljk_HHS_BH_UserArgs_MT64x128x64_MI16x16x1_SN_LDSB1_CLR1_GSU0_GSUC0_GSUWGMRR0_K1_LBSPPA128_LBSPPB256_MIWT2_4_PLR1_SU32_SUM0_SUS256_VWA1_VWB2_WGM8_WGMXCC1_WGMXCCGn1
    SolutionIndex: 61
    SolutionNameMin: Cijk_Alik_Bljk_HHS_BH_UserArgs_MT64x128x64_MI16x16x1_SN_LDSB1_CLR1_GSU0_GSUC0_GSUWGMRR0_K1_LBSPPA256_LBSPPB256_MIWT2_4_PLR1_SU32_SUM0_SUS256_VWA2_VWB2_WGM8_WGMXCC1_WGMXCCGn1
    SolutionIndex: 62
    SolutionNameMin: Cijk_Alik_Bljk_HHS_BH_UserArgs_MT128x64x64_MI16x16x1_SN_LDSB1_CLR1_GSU0_GSUC0_GSUWGMRR0_K1_LBSPPA128_LBSPPB128_MIWT4_2_PLR1_SU32_SUM0_SUS256_VWA1_VWB1_WGM1_WGMXCC1_WGMXCCGn1
    SolutionIndex: 63
    SolutionNameMin: Cijk_Alik_Bljk_HHS_BH_UserArgs_MT128x64x64_MI16x16x1_SN_LDSB1_CLR1_GSU0_GSUC0_GSUWGMRR0_K1_LBSPPA256_LBSPPB128_MIWT4_2_PLR1_SU32_SUM0_SUS256_VWA2_VWB1_WGM1_WGMXCC1_WGMXCCGn1
    SolutionIndex: 64
    SolutionNameMin: Cijk_Alik_Bljk_HHS_BH_UserArgs_MT128x64x64_MI16x16x1_SN_LDSB1_CLR1_GSU0_GSUC0_GSUWGMRR0_K1_LBSPPA512_LBSPPB128_MIWT4_2_PLR1_SU32_SUM0_SUS256_VWA4_VWB1_WGM1_WGMXCC1_WGMXCCGn1
    SolutionIndex: 65
    SolutionNameMin: Cijk_Alik_Bljk_HHS_BH_UserArgs_MT128x64x64_MI16x16x1_SN_LDSB1_CLR1_GSU0_GSUC0_GSUWGMRR0_K1_LBSPPA256_LBSPPB256_MIWT4_2_PLR1_SU32_SUM0_SUS256_VWA2_VWB2_WGM1_WGMXCC1_WGMXCCGn1
    SolutionIndex: 66
    SolutionNameMin: Cijk_Alik_Bljk_HHS_BH_UserArgs_MT128x64x64_MI16x16x1_SN_LDSB1_CLR1_GSU0_GSUC0_GSUWGMRR0_K1_LBSPPA512_LBSPPB256_MIWT4_2_PLR1_SU32_SUM0_SUS256_VWA4_VWB2_WGM1_WGMXCC1_WGMXCCGn1
    SolutionIndex: 67
    SolutionNameMin: Cijk_Alik_Bljk_HHS_BH_UserArgs_MT128x64x64_MI16x16x1_SN_LDSB1_CLR1_GSU0_GSUC0_GSUWGMRR0_K1_LBSPPA256_LBSPPB128_MIWT4_2_PLR2_SU32_SUM0_SUS256_VWA2_VWB1_WGM1_WGMXCC1_WGMXCCGn1
    SolutionIndex: 68
    SolutionNameMin: Cijk_Alik_Bljk_HHS_BH_UserArgs_MT128x64x64_MI16x16x1_SN_LDSB1_CLR1_GSU0_GSUC0_GSUWGMRR0_K1_LBSPPA256_LBSPPB256_MIWT4_2_PLR2_SU32_SUM0_SUS256_VWA2_VWB2_WGM1_WGMXCC1_WGMXCCGn1
    SolutionIndex: 69
    SolutionNameMin: Cijk_Alik_Bljk_HHS_BH_UserArgs_MT128x64x64_MI16x16x1_SN_LDSB1_CLR1_GSU0_GSUC0_GSUWGMRR0_K1_LBSPPA256_LBSPPB128_MIWT4_2_PLR1_SU32_SUM0_SUS256_VWA2_VWB1_WGM4_WGMXCC1_WGMXCCGn1
    SolutionIndex: 70
    SolutionNameMin: Cijk_Alik_Bljk_HHS_BH_UserArgs_MT128x64x64_MI16x16x1_SN_LDSB1_CLR1_GSU0_GSUC0_GSUWGMRR0_K1_LBSPPA512_LBSPPB128_MIWT4_2_PLR1_SU32_SUM0_SUS256_VWA4_VWB1_WGM4_WGMXCC1_WGMXCCGn1
    SolutionIndex: 71
    SolutionNameMin: Cijk_Alik_Bljk_HHS_BH_UserArgs_MT128x64x64_MI16x16x1_SN_LDSB1_CLR1_GSU0_GSUC0_GSUWGMRR0_K1_LBSPPA256_LBSPPB256_MIWT4_2_PLR1_SU32_SUM0_SUS256_VWA2_VWB2_WGM4_WGMXCC1_WGMXCCGn1
    SolutionIndex: 72
    SolutionNameMin: Cijk_Alik_Bljk_HHS_BH_UserArgs_MT128x64x64_MI16x16x1_SN_LDSB1_CLR1_GSU0_GSUC0_GSUWGMRR0_K1_LBSPPA512_LBSPPB256_MIWT4_2_PLR1_SU32_SUM0_SUS256_VWA4_VWB2_WGM4_WGMXCC1_WGMXCCGn1
    SolutionIndex: 73
    SolutionNameMin: Cijk_Alik_Bljk_HHS_BH_UserArgs_MT128x64x64_MI16x16x1_SN_LDSB1_CLR1_GSU0_GSUC0_GSUWGMRR0_K1_LBSPPA128_LBSPPB128_MIWT4_2_PLR1_SU32_SUM0_SUS256_VWA1_VWB1_WGM8_WGMXCC1_WGMXCCGn1
    SolutionIndex: 74
    SolutionNameMin: Cijk_Alik_Bljk_HHS_BH_UserArgs_MT128x64x64_MI16x16x1_SN_LDSB1_CLR1_GSU0_GSUC0_GSUWGMRR0_K1_LBSPPA256_LBSPPB128_MIWT4_2_PLR1_SU32_SUM0_SUS256_VWA2_VWB1_WGM8_WGMXCC1_WGMXCCGn1
    SolutionIndex: 75
    SolutionNameMin: Cijk_Alik_Bljk_HHS_BH_UserArgs_MT128x64x64_MI16x16x1_SN_LDSB1_CLR1_GSU0_GSUC0_GSUWGMRR0_K1_LBSPPA512_LBSPPB128_MIWT4_2_PLR1_SU32_SUM0_SUS256_VWA4_VWB1_WGM8_WGMXCC1_WGMXCCGn1
    SolutionIndex: 76
    SolutionNameMin: Cijk_Alik_Bljk_HHS_BH_UserArgs_MT128x64x64_MI16x16x1_SN_LDSB1_CLR1_GSU0_GSUC0_GSUWGMRR0_K1_LBSPPA128_LBSPPB256_MIWT4_2_PLR1_SU32_SUM0_SUS256_VWA1_VWB2_WGM8_WGMXCC1_WGMXCCGn1
    SolutionIndex: 77
    SolutionNameMin: Cijk_Alik_Bljk_HHS_BH_UserArgs_MT128x64x64_MI16x16x1_SN_LDSB1_CLR1_GSU0_GSUC0_GSUWGMRR0_K1_LBSPPA512_LBSPPB256_MIWT4_2_PLR1_SU32_SUM0_SUS256_VWA4_VWB2_WGM8_WGMXCC1_WGMXCCGn1
    SolutionIndex: 78
    SolutionNameMin: Cijk_Alik_Bljk_HHS_BH_UserArgs_MT128x32x64_MI16x16x1_SN_LDSB1_CLR1_GSU0_GSUC0_GSUWGMRR0_K1_LBSPPA512_LBSPPB128_MIWT4_1_PLR1_SU32_SUM0_SUS256_VWA4_VWB1_WGM1_WGMXCC1_WGMXCCGn1
    SolutionIndex: 79
    SolutionNameMin: Cijk_Alik_Bljk_HHS_BH_UserArgs_MT64x64x64_MI16x16x1_SN_LDSB1_CLR1_GSU0_GSUC0_GSUWGMRR0_K1_LBSPPA128_LBSPPB128_MIWT2_2_PLR1_SU32_SUM0_SUS256_VWA1_VWB1_WGM1_WGMXCC1_WGMXCCGn1
    SolutionIndex: 80
    SolutionNameMin: Cijk_Alik_Bljk_HHS_BH_UserArgs_MT64x64x64_MI16x16x1_SN_LDSB1_CLR1_GSU0_GSUC0_GSUWGMRR0_K1_LBSPPA256_LBSPPB128_MIWT2_2_PLR1_SU32_SUM0_SUS256_VWA2_VWB1_WGM1_WGMXCC1_WGMXCCGn1
    SolutionIndex: 81
    SolutionNameMin: Cijk_Alik_Bljk_HHS_BH_UserArgs_MT64x64x64_MI16x16x1_SN_LDSB1_CLR1_GSU0_GSUC0_GSUWGMRR0_K1_LBSPPA256_LBSPPB256_MIWT2_2_PLR1_SU32_SUM0_SUS256_VWA2_VWB2_WGM1_WGMXCC1_WGMXCCGn1
    SolutionIndex: 82
    SolutionNameMin: Cijk_Alik_Bljk_HHS_BH_UserArgs_MT64x64x64_MI16x16x1_SN_LDSB1_CLR1_GSU0_GSUC0_GSUWGMRR0_K1_LBSPPA256_LBSPPB128_MIWT2_2_PLR2_SU32_SUM0_SUS256_VWA2_VWB1_WGM1_WGMXCC1_WGMXCCGn1
    SolutionIndex: 83
    SolutionNameMin: Cijk_Alik_Bljk_HHS_BH_UserArgs_MT64x64x64_MI16x16x1_SN_LDSB1_CLR1_GSU0_GSUC0_GSUWGMRR0_K1_LBSPPA256_LBSPPB128_MIWT2_2_PLR1_SU32_SUM0_SUS256_VWA2_VWB1_WGM4_WGMXCC1_WGMXCCGn1
    SolutionIndex: 84
    SolutionNameMin: Cijk_Alik_Bljk_HHS_BH_UserArgs_MT64x64x64_MI16x16x1_SN_LDSB1_CLR1_GSU0_GSUC0_GSUWGMRR0_K1_LBSPPA128_LBSPPB256_MIWT2_2_PLR1_SU32_SUM0_SUS256_VWA1_VWB2_WGM4_WGMXCC1_WGMXCCGn1
    SolutionIndex: 85
    SolutionNameMin: Cijk_Alik_Bljk_HHS_BH_UserArgs_MT64x64x64_MI16x16x1_SN_LDSB1_CLR1_GSU0_GSUC0_GSUWGMRR0_K1_LBSPPA256_LBSPPB256_MIWT2_2_PLR1_SU32_SUM0_SUS256_VWA2_VWB2_WGM4_WGMXCC1_WGMXCCGn1
    SolutionIndex: 86
    SolutionNameMin: Cijk_Alik_Bljk_HHS_BH_UserArgs_MT64x64x64_MI16x16x1_SN_LDSB1_CLR1_GSU0_GSUC0_GSUWGMRR0_K1_LBSPPA128_LBSPPB128_MIWT2_2_PLR2_SU32_SUM0_SUS256_VWA1_VWB1_WGM4_WGMXCC1_WGMXCCGn1
    SolutionIndex: 87
    SolutionNameMin: Cijk_Alik_Bljk_HHS_BH_UserArgs_MT64x64x64_MI16x16x1_SN_LDSB1_CLR1_GSU0_GSUC0_GSUWGMRR0_K1_LBSPPA256_LBSPPB128_MIWT2_2_PLR2_SU32_SUM0_SUS256_VWA2_VWB1_WGM4_WGMXCC1_WGMXCCGn1
    SolutionIndex: 88
    SolutionNameMin: Cijk_Alik_Bljk_HHS_BH_UserArgs_MT64x64x64_MI16x16x1_SN_LDSB1_CLR1_GSU0_GSUC0_GSUWGMRR0_K1_LBSPPA256_LBSPPB256_MIWT2_2_PLR2_SU32_SUM0_SUS256_VWA2_VWB2_WGM4_WGMXCC1_WGMXCCGn1
    SolutionIndex: 89
    SolutionNameMin: Cijk_Alik_Bljk_HHS_BH_UserArgs_MT64x64x64_MI16x16x1_SN_LDSB1_CLR1_GSU0_GSUC0_GSUWGMRR0_K1_LBSPPA256_LBSPPB128_MIWT2_2_PLR1_SU32_SUM0_SUS256_VWA2_VWB1_WGM8_WGMXCC1_WGMXCCGn1
    SolutionIndex: 90
    SolutionNameMin: Cijk_Alik_Bljk_HHS_BH_UserArgs_MT64x64x64_MI16x16x1_SN_LDSB1_CLR1_GSU0_GSUC0_GSUWGMRR0_K1_LBSPPA128_LBSPPB256_MIWT2_2_PLR1_SU32_SUM0_SUS256_VWA1_VWB2_WGM8_WGMXCC1_WGMXCCGn1
    SolutionIndex: 91
    SolutionNameMin: Cijk_Alik_Bljk_HHS_BH_UserArgs_MT64x64x64_MI16x16x1_SN_LDSB1_CLR1_GSU0_GSUC0_GSUWGMRR0_K1_LBSPPA256_LBSPPB256_MIWT2_2_PLR1_SU32_SUM0_SUS256_VWA2_VWB2_WGM8_WGMXCC1_WGMXCCGn1
    SolutionIndex: 92
    SolutionNameMin: Cijk_Alik_Bljk_HHS_BH_UserArgs_MT64x64x64_MI16x16x1_SN_LDSB1_CLR1_GSU0_GSUC0_GSUWGMRR0_K1_LBSPPA256_LBSPPB128_MIWT2_2_PLR2_SU32_SUM0_SUS256_VWA2_VWB1_WGM8_WGMXCC1_WGMXCCGn1
    SolutionIndex: 93
    SolutionNameMin: Cijk_Alik_Bljk_HHS_BH_UserArgs_MT64x64x64_MI16x16x1_SN_LDSB1_CLR1_GSU0_GSUC0_GSUWGMRR0_K1_LBSPPA128_LBSPPB256_MIWT2_2_PLR2_SU32_SUM0_SUS256_VWA1_VWB2_WGM8_WGMXCC1_WGMXCCGn1
    SolutionIndex: 94
    SolutionNameMin: Cijk_Alik_Bljk_HHS_BH_UserArgs_MT32x64x64_MI16x16x1_SN_LDSB0_CLR1_GSU0_GSUC0_GSUWGMRR0_K1_LBSPPA128_LBSPPB128_MIWT1_2_PLR1_SU32_SUM0_SUS256_VWA1_VWB1_WGM1_WGMXCC1_WGMXCCGn1
    SolutionIndex: 95
    SolutionNameMin: Cijk_Alik_Bljk_HHS_BH_UserArgs_MT32x64x64_MI16x16x1_SN_LDSB0_CLR1_GSU0_GSUC0_GSUWGMRR0_K1_LBSPPA128_LBSPPB256_MIWT1_2_PLR2_SU32_SUM0_SUS256_VWA1_VWB2_WGM1_WGMXCC1_WGMXCCGn1
    SolutionIndex: 96
    SolutionNameMin: Cijk_Alik_Bljk_HHS_BH_UserArgs_MT32x64x64_MI16x16x1_SN_LDSB0_CLR1_GSU0_GSUC0_GSUWGMRR0_K1_LBSPPA128_LBSPPB256_MIWT1_2_PLR1_SU32_SUM0_SUS256_VWA1_VWB2_WGM8_WGMXCC1_WGMXCCGn1
    SolutionIndex: 97
    SolutionNameMin: Cijk_Alik_Bljk_HHS_BH_UserArgs_MT64x32x64_MI16x16x1_SN_LDSB0_CLR1_GSU0_GSUC0_GSUWGMRR0_K1_LBSPPA128_LBSPPB128_MIWT2_1_PLR1_SU32_SUM0_SUS256_VWA1_VWB1_WGM1_WGMXCC1_WGMXCCGn1
    SolutionIndex: 98
    SolutionNameMin: Cijk_Alik_Bljk_HHS_BH_UserArgs_MT64x32x64_MI16x16x1_SN_LDSB0_CLR1_GSU0_GSUC0_GSUWGMRR0_K1_LBSPPA256_LBSPPB128_MIWT2_1_PLR1_SU32_SUM0_SUS256_VWA2_VWB1_WGM1_WGMXCC1_WGMXCCGn1
    SolutionIndex: 99
    SolutionNameMin: Cijk_Alik_Bljk_HHS_BH_UserArgs_MT64x32x64_MI16x16x1_SN_LDSB0_CLR1_GSU0_GSUC0_GSUWGMRR0_K1_LBSPPA256_LBSPPB128_MIWT2_1_PLR2_SU32_SUM0_SUS256_VWA2_VWB1_WGM1_WGMXCC1_WGMXCCGn1
    SolutionIndex: 100
    SolutionNameMin: Cijk_Alik_Bljk_HHS_BH_UserArgs_MT64x32x64_MI16x16x1_SN_LDSB0_CLR1_GSU0_GSUC0_GSUWGMRR0_K1_LBSPPA128_LBSPPB128_MIWT2_1_PLR1_SU32_SUM0_SUS256_VWA1_VWB1_WGM8_WGMXCC1_WGMXCCGn1
    SolutionIndex: 101
    SolutionNameMin: Cijk_Alik_Bljk_HHS_BH_UserArgs_MT64x32x64_MI16x16x1_SN_LDSB0_CLR1_GSU0_GSUC0_GSUWGMRR0_K1_LBSPPA256_LBSPPB128_MIWT2_1_PLR1_SU32_SUM0_SUS256_VWA2_VWB1_WGM8_WGMXCC1_WGMXCCGn1
    SolutionIndex: 102
    SolutionNameMin: Cijk_Alik_Bljk_HHS_BH_UserArgs_MT64x64x128_MI16x16x1_SN_LDSB1_CLR1_GSU0_GSUC0_GSUWGMRR0_K1_LBSPPA512_LBSPPB256_MIWT2_2_PLR1_SU32_SUM0_SUS256_VWA2_VWB1_WGM1_WGMXCC1_WGMXCCGn1
    SolutionIndex: 103
    SolutionNameMin: Cijk_Alik_Bljk_HHS_BH_UserArgs_MT64x64x128_MI16x16x1_SN_LDSB1_CLR1_GSU0_GSUC0_GSUWGMRR0_K1_LBSPPA512_LBSPPB512_MIWT2_2_PLR1_SU32_SUM0_SUS256_VWA2_VWB2_WGM1_WGMXCC1_WGMXCCGn1
    SolutionIndex: 104
    SolutionNameMin: Cijk_Alik_Bljk_HHS_BH_UserArgs_MT64x64x128_MI16x16x1_SN_LDSB1_CLR1_GSU0_GSUC0_GSUWGMRR0_K1_LBSPPA512_LBSPPB256_MIWT2_2_PLR2_SU32_SUM0_SUS256_VWA2_VWB1_WGM1_WGMXCC1_WGMXCCGn1
    SolutionIndex: 105
    SolutionNameMin: Cijk_Alik_Bljk_HHS_BH_UserArgs_MT64x64x128_MI16x16x1_SN_LDSB1_CLR1_GSU0_GSUC0_GSUWGMRR0_K1_LBSPPA512_LBSPPB256_MIWT2_2_PLR1_SU32_SUM0_SUS256_VWA2_VWB1_WGM8_WGMXCC1_WGMXCCGn1
    SolutionIndex: 106
    SolutionNameMin: Cijk_Alik_Bljk_HHS_BH_UserArgs_MT32x64x128_MI16x16x1_SN_LDSB1_CLR1_GSU0_GSUC0_GSUWGMRR0_K1_LBSPPA256_LBSPPB256_MIWT1_2_PLR1_SU32_SUM0_SUS256_VWA1_VWB1_WGM1_WGMXCC1_WGMXCCGn1
    SolutionIndex: 107
    SolutionNameMin: Cijk_Alik_Bljk_HHS_BH_UserArgs_MT32x64x128_MI16x16x1_SN_LDSB1_CLR1_GSU0_GSUC0_GSUWGMRR0_K1_LBSPPA256_LBSPPB512_MIWT1_2_PLR1_SU32_SUM0_SUS256_VWA1_VWB2_WGM1_WGMXCC1_WGMXCCGn1
    SolutionIndex: 108
    SolutionNameMin: Cijk_Alik_Bljk_HHS_BH_UserArgs_MT32x64x128_MI16x16x1_SN_LDSB1_CLR1_GSU0_GSUC0_GSUWGMRR0_K1_LBSPPA256_LBSPPB256_MIWT1_2_PLR2_SU32_SUM0_SUS256_VWA1_VWB1_WGM1_WGMXCC1_WGMXCCGn1
    SolutionIndex: 109
    SolutionNameMin: Cijk_Alik_Bljk_HHS_BH_UserArgs_MT32x64x128_MI16x16x1_SN_LDSB1_CLR1_GSU0_GSUC0_GSUWGMRR0_K1_LBSPPA256_LBSPPB512_MIWT1_2_PLR2_SU32_SUM0_SUS256_VWA1_VWB2_WGM1_WGMXCC1_WGMXCCGn1
    SolutionIndex: 110
    SolutionNameMin: Cijk_Alik_Bljk_HHS_BH_UserArgs_MT32x64x128_MI16x16x1_SN_LDSB1_CLR1_GSU0_GSUC0_GSUWGMRR0_K1_LBSPPA256_LBSPPB512_MIWT1_2_PLR1_SU32_SUM0_SUS256_VWA1_VWB2_WGM4_WGMXCC1_WGMXCCGn1
    SolutionIndex: 111
    SolutionNameMin: Cijk_Alik_Bljk_HHS_BH_UserArgs_MT32x64x128_MI16x16x1_SN_LDSB1_CLR1_GSU0_GSUC0_GSUWGMRR0_K1_LBSPPA256_LBSPPB256_MIWT1_2_PLR2_SU32_SUM0_SUS256_VWA1_VWB1_WGM8_WGMXCC1_WGMXCCGn1
    SolutionIndex: 112
    SolutionNameMin: Cijk_Alik_Bljk_HHS_BH_UserArgs_MT32x64x128_MI16x16x1_SN_LDSB1_CLR1_GSU0_GSUC0_GSUWGMRR0_K1_LBSPPA256_LBSPPB512_MIWT1_2_PLR2_SU32_SUM0_SUS256_VWA1_VWB2_WGM8_WGMXCC1_WGMXCCGn1
    SolutionIndex: 113
    SolutionNameMin: Cijk_Alik_Bljk_HHS_BH_UserArgs_MT64x32x128_MI16x16x1_SN_LDSB1_CLR1_GSU0_GSUC0_GSUWGMRR0_K1_LBSPPA512_LBSPPB256_MIWT2_1_PLR1_SU32_SUM0_SUS256_VWA2_VWB1_WGM1_WGMXCC1_WGMXCCGn1
    SolutionIndex: 114
    SolutionNameMin: Cijk_Alik_Bljk_HHS_BH_UserArgs_MT64x32x128_MI16x16x1_SN_LDSB1_CLR1_GSU0_GSUC0_GSUWGMRR0_K1_LBSPPA512_LBSPPB256_MIWT2_1_PLR2_SU32_SUM0_SUS256_VWA2_VWB1_WGM1_WGMXCC1_WGMXCCGn1
    SolutionIndex: 115
    SolutionNameMin: Cijk_Alik_Bljk_HHS_BH_UserArgs_MT64x32x128_MI16x16x1_SN_LDSB1_CLR1_GSU0_GSUC0_GSUWGMRR0_K1_LBSPPA512_LBSPPB256_MIWT2_1_PLR2_SU32_SUM0_SUS256_VWA2_VWB1_WGM4_WGMXCC1_WGMXCCGn1
    SolutionIndex: 116
    SolutionNameMin: Cijk_Alik_Bljk_HHS_BH_UserArgs_MT64x32x128_MI16x16x1_SN_LDSB1_CLR1_GSU0_GSUC0_GSUWGMRR0_K1_LBSPPA512_LBSPPB256_MIWT2_1_PLR2_SU32_SUM0_SUS256_VWA2_VWB1_WGM8_WGMXCC1_WGMXCCGn1
    SolutionIndex: 117
    SolutionNameMin: Cijk_Alik_Bljk_HHS_BH_UserArgs_MT32x32x128_MI16x16x1_SN_LDSB1_CLR1_GSU0_GSUC0_GSUWGMRR0_K1_LBSPPA256_LBSPPB256_MIWT1_1_PLR1_SU32_SUM0_SUS256_VWA1_VWB1_WGM1_WGMXCC1_WGMXCCGn1
    SolutionIndex: 118
    SolutionNameMin: Cijk_Alik_Bljk_HHS_BH_UserArgs_MT32x32x128_MI16x16x1_SN_LDSB1_CLR1_GSU0_GSUC0_GSUWGMRR0_K1_LBSPPA256_LBSPPB256_MIWT1_1_PLR2_SU32_SUM0_SUS256_VWA1_VWB1_WGM1_WGMXCC1_WGMXCCGn1
    SolutionIndex: 119
    SolutionNameMin: Cijk_Alik_Bljk_HHS_BH_UserArgs_MT32x32x128_MI16x16x1_SN_LDSB1_CLR1_GSU0_GSUC0_GSUWGMRR0_K1_LBSPPA256_LBSPPB256_MIWT1_1_PLR1_SU32_SUM0_SUS256_VWA1_VWB1_WGM4_WGMXCC1_WGMXCCGn1
    SolutionIndex: 120
    SolutionNameMin: Cijk_Alik_Bljk_HHS_BH_UserArgs_MT32x32x128_MI16x16x1_SN_LDSB1_CLR1_GSU0_GSUC0_GSUWGMRR0_K1_LBSPPA256_LBSPPB256_MIWT1_1_PLR2_SU32_SUM0_SUS256_VWA1_VWB1_WGM4_WGMXCC1_WGMXCCGn1
    SolutionIndex: 121
    SolutionNameMin: Cijk_Alik_Bljk_HHS_BH_UserArgs_MT32x32x128_MI16x16x1_SN_LDSB1_CLR1_GSU0_GSUC0_GSUWGMRR0_K1_LBSPPA256_LBSPPB256_MIWT1_1_PLR1_SU32_SUM0_SUS256_VWA1_VWB1_WGM8_WGMXCC1_WGMXCCGn1
    SolutionIndex: 122
    SolutionNameMin: Cijk_Alik_Bljk_HHS_BH_UserArgs_MT32x32x128_MI16x16x1_SN_LDSB1_CLR1_GSU0_GSUC0_GSUWGMRR0_K1_LBSPPA256_LBSPPB256_MIWT1_1_PLR2_SU32_SUM0_SUS256_VWA1_VWB1_WGM8_WGMXCC1_WGMXCCGn1
    SolutionIndex: 123
    SolutionNameMin: Cijk_Alik_Bljk_HHS_BH_UserArgs_MT32x64x128_MI16x16x1_SN_LDSB1_CLR1_GSU0_GSUC0_GSUWGMRR0_K1_LBSPPA256_LBSPPB512_MIWT1_2_PLR2_SU32_SUM0_SUS256_VWA1_VWB2_WGM1_WGMXCC1_WGMXCCGn1
- - - [128, 128, 1, 128, 128, 128, 128, 128]
    - [116, 0.074]
  - - [128, 128, 1, 256, 128, 128, 256, 256]
    - [109, 0.112]
  - - [128, 128, 1, 512, 128, 128, 512, 512]
    - [119, 0.193]
  - - [128, 128, 1, 1024, 128, 128, 1024, 1024]
    - [118, 0.343]
  - - [128, 128, 1, 2048, 128, 128, 2048, 2048]
    - [120, 0.551]
  - - [128, 128, 1, 4096, 128, 128, 4096, 4096]
    - [106, 0.855]
  - - [128, 128, 1, 8192, 128, 128, 8192, 8192]
    - [106, 1.357]
  - - [128, 256, 1, 128, 128, 128, 128, 128]
    - [121, 0.165]
  - - [128, 256, 1, 256, 128, 128, 256, 256]
    - [117, 0.231]
  - - [128, 256, 1, 512, 128, 128, 512, 512]
    - [118, 0.369]
  - - [128, 256, 1, 1024, 128, 128, 1024, 1024]
    - [112, 0.575]
  - - [128, 256, 1, 2048, 128, 128, 2048, 2048]
    - [122, 1.017]
  - - [128, 256, 1, 4096, 128, 128, 4096, 4096]
    - [101, 1.549]
  - - [128, 256, 1, 8192, 128, 128, 8192, 8192]
    - [108, 2.125]
  - - [128, 512, 1, 128, 128, 128, 128, 128]
    - [110, 0.314]
  - - [128, 512, 1, 256, 128, 128, 256, 256]
    - [121, 0.523]
  - - [128, 512, 1, 512, 128, 128, 512, 512]
    - [120, 0.857]
  - - [128, 512, 1, 1024, 128, 128, 1024, 1024]
    - [121, 1.316]
  - - [128, 512, 1, 2048, 128, 128, 2048, 2048]
    - [107, 1.641]
  - - [128, 512, 1, 4096, 128, 128, 4096, 4096]
    - [86, 2.265]
  - - [128, 512, 1, 8192, 128, 128, 8192, 8192]
    - [60, 2.553]
  - - [128, 1024, 1, 128, 128, 128, 128, 128]
    - [97, 0.627]
  - - [128, 1024, 1, 256, 128, 128, 256, 256]
    - [98, 1.022]
  - - [128, 1024, 1, 512, 128, 128, 512, 512]
    - [96, 1.5]
  - - [128, 1024, 1, 1024, 128, 128, 1024, 1024]
    - [114, 2.065]
  - - [128, 1024, 1, 2048, 128, 128, 2048, 2048]
    - [79, 2.025]
  - - [128, 1024, 1, 4096, 128, 128, 4096, 4096]
    - [64, 3.324]
  - - [128, 1024, 1, 8192, 128, 128, 8192, 8192]
    - [65, 3.487]
  - - [128, 2048, 1, 128, 128, 128, 128, 128]
    - [78, 1.062]
  - - [128, 2048, 1, 256, 128, 128, 256, 256]
    - [81, 1.681]
  - - [128, 2048, 1, 512, 128, 128, 512, 512]
    - [79, 2.514]
  - - [128, 2048, 1, 1024, 128, 128, 1024, 1024]
    - [102, 2.586]
  - - [128, 2048, 1, 2048, 128, 128, 2048, 2048]
    - [54, 2.683]
  - - [128, 2048, 1, 4096, 128, 128, 4096, 4096]
    - [76, 3.529]
  - - [128, 2048, 1, 8192, 128, 128, 8192, 8192]
    - [36, 4.392]
  - - [128, 4096, 1, 128, 128, 128, 128, 128]
    - [56, 1.752]
  - - [128, 4096, 1, 256, 128, 128, 256, 256]
    - [70, 2.46]
  - - [128, 4096, 1, 512, 128, 128, 512, 512]
    - [74, 3.228]
  - - [128, 4096, 1, 1024, 128, 128, 1024, 1024]
    - [107, 2.898]
  - - [128, 4096, 1, 2048, 128, 128, 2048, 2048]
    - [114, 3.355]
  - - [128, 4096, 1, 4096, 128, 128, 4096, 4096]
    - [49, 3.922]
  - - [128, 4096, 1, 8192, 128, 128, 8192, 8192]
    - [34, 5.08]
  - - [128, 8192, 1, 128, 128, 128, 128, 128]
    - [7, 2.051]
  - - [128, 8192, 1, 256, 128, 128, 256, 256]
    - [19, 2.637]
  - - [128, 8192, 1, 512, 128, 128, 512, 512]
    - [24, 3.798]
  - - [128, 8192, 1, 1024, 128, 128, 1024, 1024]
    - [92, 3.977]
  - - [128, 8192, 1, 2048, 128, 128, 2048, 2048]
    - [92, 4.361]
  - - [128, 8192, 1, 4096, 128, 128, 4096, 4096]
    - [64, 5.101]
  - - [128, 8192, 1, 8192, 128, 128, 8192, 8192]
    - [47, 4.518]
  - - [256, 128, 1, 128, 256, 256, 128, 128]
    - [111, 0.17]
  - - [256, 128, 1, 256, 256, 256, 256, 256]
    - [117, 0.238]
  - - [256, 128, 1, 512, 256, 256, 512, 512]
    - [117, 0.359]
  - - [256, 128, 1, 1024, 256, 256, 1024, 1024]
    - [117, 0.615]
  - - [256, 128, 1, 2048, 256, 256, 2048, 2048]
    - [117, 1.019]
  - - [256, 128, 1, 4096, 256, 256, 4096, 4096]
    - [94, 1.565]
  - - [256, 128, 1, 8192, 256, 256, 8192, 8192]
    - [107, 2.079]
  - - [256, 256, 1, 128, 256, 256, 128, 128]
    - [106, 0.327]
  - - [256, 256, 1, 256, 256, 256, 256, 256]
    - [120, 0.583]
  - - [256, 256, 1, 512, 256, 256, 512, 512]
    - [118, 0.919]
  - - [256, 256, 1, 1024, 256, 256, 1024, 1024]
    - [121, 1.307]
  - - [256, 256, 1, 2048, 256, 256, 2048, 2048]
    - [107, 1.642]
  - - [256, 256, 1, 4096, 256, 256, 4096, 4096]
    - [80, 2.357]
  - - [256, 256, 1, 8192, 256, 256, 8192, 8192]
    - [93, 2.596]
  - - [256, 512, 1, 128, 256, 256, 128, 128]
    - [95, 0.605]
  - - [256, 512, 1, 256, 256, 256, 256, 256]
    - [98, 1.056]
  - - [256, 512, 1, 512, 256, 256, 512, 512]
    - [95, 1.581]
  - - [256, 512, 1, 1024, 256, 256, 1024, 1024]
    - [113, 2.132]
  - - [256, 512, 1, 2048, 256, 256, 2048, 2048]
    - [20, 2.043]
  - - [256, 512, 1, 4096, 256, 256, 4096, 4096]
    - [62, 3.297]
  - - [256, 512, 1, 8192, 256, 256, 8192, 8192]
    - [34, 3.522]
  - - [256, 1024, 1, 128, 256, 256, 128, 128]
    - [83, 1.139]
  - - [256, 1024, 1, 256, 256, 256, 256, 256]
    - [80, 1.689]
  - - [256, 1024, 1, 512, 256, 256, 512, 512]
    - [91, 2.601]
  - - [256, 1024, 1, 1024, 256, 256, 1024, 1024]
    - [104, 2.754]
  - - [256, 1024, 1, 2048, 256, 256, 2048, 2048]
    - [70, 2.91]
  - - [256, 1024, 1, 4096, 256, 256, 4096, 4096]
    - [66, 3.483]
  - - [256, 1024, 1, 8192, 256, 256, 8192, 8192]
    - [25, 4.286]
  - - [256, 2048, 1, 128, 256, 256, 128, 128]
    - [61, 1.815]
  - - [256, 2048, 1, 256, 256, 256, 256, 256]
    - [68, 2.625]
  - - [256, 2048, 1, 512, 256, 256, 512, 512]
    - [53, 3.246]
  - - [256, 2048, 1, 1024, 256, 256, 1024, 1024]
    - [77, 2.947]
  - - [256, 2048, 1, 2048, 256, 256, 2048, 2048]
    - [81, 3.893]
  - - [256, 2048, 1, 4096, 256, 256, 4096, 4096]
    - [71, 4.136]
  - - [256, 2048, 1, 8192, 256, 256, 8192, 8192]
    - [25, 5.371]
  - - [256, 4096, 1, 128, 256, 256, 128, 128]
    - [18, 2.027]
  - - [256, 4096, 1, 256, 256, 256, 256, 256]
    - [14, 2.803]
  - - [256, 4096, 1, 512, 256, 256, 512, 512]
    - [30, 4.119]
  - - [256, 4096, 1, 1024, 256, 256, 1024, 1024]
    - [80, 4.428]
  - - [256, 4096, 1, 2048, 256, 256, 2048, 2048]
    - [80, 4.843]
  - - [256, 4096, 1, 4096, 256, 256, 4096, 4096]
    - [73, 4.797]
  - - [256, 4096, 1, 8192, 256, 256, 8192, 8192]
    - [44, 4.763]
  - - [256, 8192, 1, 128, 256, 256, 128, 128]
    - [2, 2.483]
  - - [256, 8192, 1, 256, 256, 256, 256, 256]
    - [67, 3.31]
  - - [256, 8192, 1, 512, 256, 256, 512, 512]
    - [69, 4.741]
  - - [256, 8192, 1, 1024, 256, 256, 1024, 1024]
    - [74, 5.643]
  - - [256, 8192, 1, 2048, 256, 256, 2048, 2048]
    - [63, 6.253]
  - - [256, 8192, 1, 4096, 256, 256, 4096, 4096]
    - [62, 5.072]
  - - [256, 8192, 1, 8192, 256, 256, 8192, 8192]
    - [23, 5.286]
  - - [512, 128, 1, 128, 512, 512, 128, 128]
    - [115, 0.338]
  - - [512, 128, 1, 256, 512, 512, 256, 256]
    - [119, 0.595]
  - - [512, 128, 1, 512, 512, 512, 512, 512]
    - [117, 0.964]
  - - [512, 128, 1, 1024, 512, 512, 1024, 1024]
    - [121, 1.401]
  - - [512, 128, 1, 2048, 512, 512, 2048, 2048]
    - [109, 1.74]
  - - [512, 128, 1, 4096, 512, 512, 4096, 4096]
    - [80, 2.329]
  - - [512, 128, 1, 8192, 512, 512, 8192, 8192]
    - [84, 2.647]
  - - [512, 256, 1, 128, 512, 512, 128, 128]
    - [99, 0.666]
  - - [512, 256, 1, 256, 512, 512, 256, 256]
    - [100, 1.042]
  - - [512, 256, 1, 512, 512, 512, 512, 512]
    - [109, 1.54]
  - - [512, 256, 1, 1024, 512, 512, 1024, 1024]
    - [113, 2.083]
  - - [512, 256, 1, 2048, 512, 512, 2048, 2048]
    - [80, 2.046]
  - - [512, 256, 1, 4096, 512, 512, 4096, 4096]
    - [75, 3.219]
  - - [512, 256, 1, 8192, 512, 512, 8192, 8192]
    - [28, 3.428]
  - - [512, 512, 1, 128, 512, 512, 128, 128]
    - [82, 1.143]
  - - [512, 512, 1, 256, 512, 512, 256, 256]
    - [91, 1.805]
  - - [512, 512, 1, 512, 512, 512, 512, 512]
    - [85, 2.58]
  - - [512, 512, 1, 1024, 512, 512, 1024, 1024]
    - [103, 2.732]
  - - [512, 512, 1, 2048, 512, 512, 2048, 2048]
    - [75, 2.997]
  - - [512, 512, 1, 4096, 512, 512, 4096, 4096]
    - [34, 3.55]
  - - [512, 512, 1, 8192, 512, 512, 8192, 8192]
    - [71, 4.243]
  - - [512, 1024, 1, 128, 512, 512, 128, 128]
    - [63, 1.819]
  - - [512, 1024, 1, 256, 512, 512, 256, 256]
    - [65, 2.801]
  - - [512, 1024, 1, 512, 512, 512, 512, 512]
    - [63, 3.811]
  - - [512, 1024, 1, 1024, 512, 512, 1024, 1024]
    - [64, 3.089]
  - - [512, 1024, 1, 2048, 512, 512, 2048, 2048]
    - [79, 3.841]
  - - [512, 1024, 1, 4096, 512, 512, 4096, 4096]
    - [74, 4.13]
  - - [512, 1024, 1, 8192, 512, 512, 8192, 8192]
    - [30, 5.004]
  - - [512, 2048, 1, 128, 512, 512, 128, 128]
    - [12, 2.082]
  - - [512, 2048, 1, 256, 512, 512, 256, 256]
    - [12, 2.956]
  - - [512, 2048, 1, 512, 512, 512, 512, 512]
    - [27, 4.157]
  - - [512, 2048, 1, 1024, 512, 512, 1024, 1024]
    - [80, 4.625]
  - - [512, 2048, 1, 2048, 512, 512, 2048, 2048]
    - [81, 4.992]
  - - [512, 2048, 1, 4096, 512, 512, 4096, 4096]
    - [72, 4.508]
  - - [512, 2048, 1, 8192, 512, 512, 8192, 8192]
    - [30, 5.283]
  - - [512, 4096, 1, 128, 512, 512, 128, 128]
    - [6, 2.588]
  - - [512, 4096, 1, 256, 512, 512, 256, 256]
    - [64, 3.46]
  - - [512, 4096, 1, 512, 512, 512, 512, 512]
    - [74, 4.847]
  - - [512, 4096, 1, 1024, 512, 512, 1024, 1024]
    - [65, 5.77]
  - - [512, 4096, 1, 2048, 512, 512, 2048, 2048]
    - [63, 6.182]
  - - [512, 4096, 1, 4096, 512, 512, 4096, 4096]
    - [39, 5.238]
  - - [512, 4096, 1, 8192, 512, 512, 8192, 8192]
    - [35, 4.084]
  - - [512, 8192, 1, 128, 512, 512, 128, 128]
    - [3, 3.108]
  - - [512, 8192, 1, 256, 512, 512, 256, 256]
    - [19, 4.271]
  - - [512, 8192, 1, 512, 512, 512, 512, 512]
    - [8, 5.197]
  - - [512, 8192, 1, 1024, 512, 512, 1024, 1024]
    - [31, 6.348]
  - - [512, 8192, 1, 2048, 512, 512, 2048, 2048]
    - [46, 6.821]
  - - [512, 8192, 1, 4096, 512, 512, 4096, 4096]
    - [42, 5.784]
  - - [512, 8192, 1, 8192, 512, 512, 8192, 8192]
    - [22, 4.542]
  - - [1024, 128, 1, 128, 1024, 1024, 128, 128]
    - [107, 0.655]
  - - [1024, 128, 1, 256, 1024, 1024, 256, 256]
    - [101, 1.11]
  - - [1024, 128, 1, 512, 1024, 1024, 512, 512]
    - [98, 1.678]
  - - [1024, 128, 1, 1024, 1024, 1024, 1024, 1024]
    - [113, 2.16]
  - - [1024, 128, 1, 2048, 1024, 1024, 2048, 2048]
    - [85, 1.964]
  - - [1024, 128, 1, 4096, 1024, 1024, 4096, 4096]
    - [51, 3.256]
  - - [1024, 128, 1, 8192, 1024, 1024, 8192, 8192]
    - [50, 3.519]
  - - [1024, 256, 1, 128, 1024, 1024, 128, 128]
    - [82, 1.155]
  - - [1024, 256, 1, 256, 1024, 1024, 256, 256]
    - [81, 1.835]
  - - [1024, 256, 1, 512, 1024, 1024, 512, 512]
    - [81, 2.729]
  - - [1024, 256, 1, 1024, 1024, 1024, 1024, 1024]
    - [104, 2.807]
  - - [1024, 256, 1, 2048, 1024, 1024, 2048, 2048]
    - [77, 2.959]
  - - [1024, 256, 1, 4096, 1024, 1024, 4096, 4096]
    - [40, 3.704]
  - - [1024, 256, 1, 8192, 1024, 1024, 8192, 8192]
    - [51, 4.385]
  - - [1024, 512, 1, 128, 1024, 1024, 128, 128]
    - [49, 1.824]
  - - [1024, 512, 1, 256, 1024, 1024, 256, 256]
    - [63, 2.759]
  - - [1024, 512, 1, 512, 1024, 1024, 512, 512]
    - [65, 3.739]
  - - [1024, 512, 1, 1024, 1024, 1024, 1024, 1024]
    - [116, 3.014]
  - - [1024, 512, 1, 2048, 1024, 1024, 2048, 2048]
    - [89, 3.963]
  - - [1024, 512, 1, 4096, 1024, 1024, 4096, 4096]
    - [75, 4.355]
  - - [1024, 512, 1, 8192, 1024, 1024, 8192, 8192]
    - [25, 5.354]
  - - [1024, 1024, 1, 128, 1024, 1024, 128, 128]
    - [8, 2.141]
  - - [1024, 1024, 1, 256, 1024, 1024, 256, 256]
    - [69, 2.978]
  - - [1024, 1024, 1, 512, 1024, 1024, 512, 512]
    - [24, 4.208]
  - - [1024, 1024, 1, 1024, 1024, 1024, 1024, 1024]
    - [81, 4.73]
  - - [1024, 1024, 1, 2048, 1024, 1024, 2048, 2048]
    - [80, 4.858]
  - - [1024, 1024, 1, 4096, 1024, 1024, 4096, 4096]
    - [52, 4.572]
  - - [1024, 1024, 1, 8192, 1024, 1024, 8192, 8192]
    - [34, 5.648]
  - - [1024, 2048, 1, 128, 1024, 1024, 128, 128]
    - [12, 2.603]
  - - [1024, 2048, 1, 256, 1024, 1024, 256, 256]
    - [63, 3.627]
  - - [1024, 2048, 1, 512, 1024, 1024, 512, 512]
    - [71, 4.8]
  - - [1024, 2048, 1, 1024, 1024, 1024, 1024, 1024]
    - [65, 5.722]
  - - [1024, 2048, 1, 2048, 1024, 1024, 2048, 2048]
    - [66, 5.886]
  - - [1024, 2048, 1, 4096, 1024, 1024, 4096, 4096]
    - [25, 5.214]
  - - [1024, 2048, 1, 8192, 1024, 1024, 8192, 8192]
    - [46, 5.205]
  - - [1024, 4096, 1, 128, 1024, 1024, 128, 128]
    - [12, 3.242]
  - - [1024, 4096, 1, 256, 1024, 1024, 256, 256]
    - [8, 4.38]
  - - [1024, 4096, 1, 512, 1024, 1024, 512, 512]
    - [7, 5.318]
  - - [1024, 4096, 1, 1024, 1024, 1024, 1024, 1024]
    - [27, 5.977]
  - - [1024, 4096, 1, 2048, 1024, 1024, 2048, 2048]
    - [46, 6.728]
  - - [1024, 4096, 1, 4096, 1024, 1024, 4096, 4096]
    - [43, 5.856]
  - - [1024, 4096, 1, 8192, 1024, 1024, 8192, 8192]
    - [24, 6.42]
  - - [1024, 8192, 1, 128, 1024, 1024, 128, 128]
    - [21, 2.45]
  - - [1024, 8192, 1, 256, 1024, 1024, 256, 256]
    - [72, 3.563]
  - - [1024, 8192, 1, 512, 1024, 1024, 512, 512]
    - [64, 4.657]
  - - [1024, 8192, 1, 1024, 1024, 1024, 1024, 1024]
    - [63, 5.263]
  - - [1024, 8192, 1, 2048, 1024, 1024, 2048, 2048]
    - [28, 5.754]
  - - [1024, 8192, 1, 4096, 1024, 1024, 4096, 4096]
    - [44, 6.222]
  - - [1024, 8192, 1, 8192, 1024, 1024, 8192, 8192]
    - [29, 6.172]
  - - [2048, 128, 1, 128, 2048, 2048, 128, 128]
    - [82, 1.159]
  - - [2048, 128, 1, 256, 2048, 2048, 256, 256]
    - [88, 1.762]
  - - [2048, 128, 1, 512, 2048, 2048, 512, 512]
    - [91, 2.509]
  - - [2048, 128, 1, 1024, 2048, 2048, 1024, 1024]
    - [105, 2.622]
  - - [2048, 128, 1, 2048, 2048, 2048, 2048, 2048]
    - [53, 2.762]
  - - [2048, 128, 1, 4096, 2048, 2048, 4096, 4096]
    - [25, 3.56]
  - - [2048, 128, 1, 8192, 2048, 2048, 8192, 8192]
    - [55, 4.411]
  - - [2048, 256, 1, 128, 2048, 2048, 128, 128]
    - [74, 1.838]
  - - [2048, 256, 1, 256, 2048, 2048, 256, 256]
    - [49, 2.771]
  - - [2048, 256, 1, 512, 2048, 2048, 512, 512]
    - [71, 3.466]
  - - [2048, 256, 1, 1024, 2048, 2048, 1024, 1024]
    - [77, 2.882]
  - - [2048, 256, 1, 2048, 2048, 2048, 2048, 2048]
    - [83, 3.853]
  - - [2048, 256, 1, 4096, 2048, 2048, 4096, 4096]
    - [70, 4.314]
  - - [2048, 256, 1, 8192, 2048, 2048, 8192, 8192]
    - [27, 5.233]
  - - [2048, 512, 1, 128, 2048, 2048, 128, 128]
    - [65, 2.096]
  - - [2048, 512, 1, 256, 2048, 2048, 256, 256]
    - [8, 3.106]
  - - [2048, 512, 1, 512, 2048, 2048, 512, 512]
    - [64, 4.079]
  - - [2048, 512, 1, 1024, 2048, 2048, 1024, 1024]
    - [91, 4.518]
  - - [2048, 512, 1, 2048, 2048, 2048, 2048, 2048]
    - [90, 4.631]
  - - [2048, 512, 1, 4096, 2048, 2048, 4096, 4096]
    - [53, 4.901]
  - - [2048, 512, 1, 8192, 2048, 2048, 8192, 8192]
    - [36, 5.639]
  - - [2048, 1024, 1, 128, 2048, 2048, 128, 128]
    - [0, 2.677]
  - - [2048, 1024, 1, 256, 2048, 2048, 256, 256]
    - [65, 3.617]
  - - [2048, 1024, 1, 512, 2048, 2048, 512, 512]
    - [64, 4.94]
  - - [2048, 1024, 1, 1024, 2048, 2048, 1024, 1024]
    - [74, 5.448]
  - - [2048, 1024, 1, 2048, 2048, 2048, 2048, 2048]
    - [57, 5.622]
  - - [2048, 1024, 1, 4096, 2048, 2048, 4096, 4096]
    - [28, 5.332]
  - - [2048, 1024, 1, 8192, 2048, 2048, 8192, 8192]
    - [31, 6.442]
  - - [2048, 2048, 1, 128, 2048, 2048, 128, 128]
    - [8, 3.375]
  - - [2048, 2048, 1, 256, 2048, 2048, 256, 256]
    - [8, 4.508]
  - - [2048, 2048, 1, 512, 2048, 2048, 512, 512]
    - [4, 5.221]
  - - [2048, 2048, 1, 1024, 2048, 2048, 1024, 1024]
    - [40, 5.973]
  - - [2048, 2048, 1, 2048, 2048, 2048, 2048, 2048]
    - [45, 6.772]
  - - [2048, 2048, 1, 4096, 2048, 2048, 4096, 4096]
    - [28, 6.195]
  - - [2048, 2048, 1, 8192, 2048, 2048, 8192, 8192]
    - [30, 6.883]
  - - [2048, 4096, 1, 128, 2048, 2048, 128, 128]
    - [64, 2.534]
  - - [2048, 4096, 1, 256, 2048, 2048, 256, 256]
    - [63, 3.681]
  - - [2048, 4096, 1, 512, 2048, 2048, 512, 512]
    - [63, 4.388]
  - - [2048, 4096, 1, 1024, 2048, 2048, 1024, 1024]
    - [43, 5.21]
  - - [2048, 4096, 1, 2048, 2048, 2048, 2048, 2048]
    - [28, 5.957]
  - - [2048, 4096, 1, 4096, 2048, 2048, 4096, 4096]
    - [25, 6.466]
  - - [2048, 4096, 1, 8192, 2048, 2048, 8192, 8192]
    - [32, 5.998]
  - - [2048, 8192, 1, 128, 2048, 2048, 128, 128]
    - [15, 3.073]
  - - [2048, 8192, 1, 256, 2048, 2048, 256, 256]
    - [9, 4.053]
  - - [2048, 8192, 1, 512, 2048, 2048, 512, 512]
    - [7, 4.942]
  - - [2048, 8192, 1, 1024, 2048, 2048, 1024, 1024]
    - [46, 5.343]
  - - [2048, 8192, 1, 2048, 2048, 2048, 2048, 2048]
    - [24, 5.864]
  - - [2048, 8192, 1, 4096, 2048, 2048, 4096, 4096]
    - [30, 6.49]
  - - [2048, 8192, 1, 8192, 2048, 2048, 8192, 8192]
    - [33, 7.032]
  - - [4096, 128, 1, 128, 4096, 4096, 128, 128]
    - [65, 1.932]
  - - [4096, 128, 1, 256, 4096, 4096, 256, 256]
    - [69, 2.56]
  - - [4096, 128, 1, 512, 4096, 4096, 512, 512]
    - [65, 3.227]
  - - [4096, 128, 1, 1024, 4096, 4096, 1024, 1024]
    - [70, 2.79]
  - - [4096, 128, 1, 2048, 4096, 4096, 2048, 2048]
    - [90, 3.55]
  - - [4096, 128, 1, 4096, 4096, 4096, 4096, 4096]
    - [49, 4.199]
  - - [4096, 128, 1, 8192, 4096, 4096, 8192, 8192]
    - [38, 5.217]
  - - [4096, 256, 1, 128, 4096, 4096, 128, 128]
    - [18, 2.113]
  - - [4096, 256, 1, 256, 4096, 4096, 256, 256]
    - [80, 2.93]
  - - [4096, 256, 1, 512, 4096, 4096, 512, 512]
    - [34, 3.902]
  - - [4096, 256, 1, 1024, 4096, 4096, 1024, 1024]
    - [83, 4.245]
  - - [4096, 256, 1, 2048, 4096, 4096, 2048, 2048]
    - [85, 4.573]
  - - [4096, 256, 1, 4096, 4096, 4096, 4096, 4096]
    - [53, 4.926]
  - - [4096, 256, 1, 8192, 4096, 4096, 8192, 8192]
    - [36, 5.712]
  - - [4096, 512, 1, 128, 4096, 4096, 128, 128]
    - [0, 2.639]
  - - [4096, 512, 1, 256, 4096, 4096, 256, 256]
    - [63, 3.623]
  - - [4096, 512, 1, 512, 4096, 4096, 512, 512]
    - [74, 4.81]
  - - [4096, 512, 1, 1024, 4096, 4096, 1024, 1024]
    - [75, 5.412]
  - - [4096, 512, 1, 2048, 4096, 4096, 2048, 2048]
    - [76, 5.579]
  - - [4096, 512, 1, 4096, 4096, 4096, 4096, 4096]
    - [51, 5.549]
  - - [4096, 512, 1, 8192, 4096, 4096, 8192, 8192]
    - [28, 6.424]
  - - [4096, 1024, 1, 128, 4096, 4096, 128, 128]
    - [0, 3.386]
  - - [4096, 1024, 1, 256, 4096, 4096, 256, 256]
    - [16, 4.253]
  - - [4096, 1024, 1, 512, 4096, 4096, 512, 512]
    - [16, 5.105]
  - - [4096, 1024, 1, 1024, 4096, 4096, 1024, 1024]
    - [45, 6.039]
  - - [4096, 1024, 1, 2048, 4096, 4096, 2048, 2048]
    - [46, 6.818]
  - - [4096, 1024, 1, 4096, 4096, 4096, 4096, 4096]
    - [30, 5.995]
  - - [4096, 1024, 1, 8192, 4096, 4096, 8192, 8192]
    - [29, 6.989]
  - - [4096, 2048, 1, 128, 4096, 4096, 128, 128]
    - [66, 2.566]
  - - [4096, 2048, 1, 256, 4096, 4096, 256, 256]
    - [64, 3.55]
  - - [4096, 2048, 1, 512, 4096, 4096, 512, 512]
    - [7, 4.387]
  - - [4096, 2048, 1, 1024, 4096, 4096, 1024, 1024]
    - [40, 5.242]
  - - [4096, 2048, 1, 2048, 4096, 4096, 2048, 2048]
    - [29, 5.835]
  - - [4096, 2048, 1, 4096, 4096, 4096, 4096, 4096]
    - [26, 6.616]
  - - [4096, 2048, 1, 8192, 4096, 4096, 8192, 8192]
    - [29, 7.307]
  - - [4096, 4096, 1, 128, 4096, 4096, 128, 128]
    - [7, 3.141]
  - - [4096, 4096, 1, 256, 4096, 4096, 256, 256]
    - [7, 3.915]
  - - [4096, 4096, 1, 512, 4096, 4096, 512, 512]
    - [11, 4.577]
  - - [4096, 4096, 1, 1024, 4096, 4096, 1024, 1024]
    - [43, 5.298]
  - - [4096, 4096, 1, 2048, 4096, 4096, 2048, 2048]
    - [45, 5.979]
  - - [4096, 4096, 1, 4096, 4096, 4096, 4096, 4096]
    - [36, 6.76]
  - - [4096, 4096, 1, 8192, 4096, 4096, 8192, 8192]
    - [35, 6.955]
  - - [4096, 8192, 1, 128, 4096, 4096, 128, 128]
    - [10, 3.387]
  - - [4096, 8192, 1, 256, 4096, 4096, 256, 256]
    - [11, 4.024]
  - - [4096, 8192, 1, 512, 4096, 4096, 512, 512]
    - [11, 4.377]
  - - [4096, 8192, 1, 1024, 4096, 4096, 1024, 1024]
    - [44, 5.218]
  - - [4096, 8192, 1, 2048, 4096, 4096, 2048, 2048]
    - [44, 5.561]
  - - [4096, 8192, 1, 4096, 4096, 4096, 4096, 4096]
    - [36, 6.592]
  - - [4096, 8192, 1, 8192, 4096, 4096, 8192, 8192]
    - [42, 6.487]
  - - [8192, 128, 1, 128, 8192, 8192, 128, 128]
    - [64, 2.038]
  - - [8192, 128, 1, 256, 8192, 8192, 256, 256]
    - [5, 2.674]
  - - [8192, 128, 1, 512, 8192, 8192, 512, 512]
    - [59, 3.554]
  - - [8192, 128, 1, 1024, 8192, 8192, 1024, 1024]
    - [87, 3.891]
  - - [8192, 128, 1, 2048, 8192, 8192, 2048, 2048]
    - [88, 4.259]
  - - [8192, 128, 1, 4096, 8192, 8192, 4096, 4096]
    - [57, 5.04]
  - - [8192, 128, 1, 8192, 8192, 8192, 8192, 8192]
    - [56, 5.67]
  - - [8192, 256, 1, 128, 8192, 8192, 128, 128]
    - [1, 2.639]
  - - [8192, 256, 1, 256, 8192, 8192, 256, 256]
    - [74, 3.394]
  - - [8192, 256, 1, 512, 8192, 8192, 512, 512]
    - [74, 4.628]
  - - [8192, 256, 1, 1024, 8192, 8192, 1024, 1024]
    - [59, 5.338]
  - - [8192, 256, 1, 2048, 8192, 8192, 2048, 2048]
    - [58, 5.391]
  - - [8192, 256, 1, 4096, 8192, 8192, 4096, 4096]
    - [48, 5.563]
  - - [8192, 256, 1, 8192, 8192, 8192, 8192, 8192]
    - [33, 6.208]
  - - [8192, 512, 1, 128, 8192, 8192, 128, 128]
    - [16, 3.302]
  - - [8192, 512, 1, 256, 8192, 8192, 256, 256]
    - [10, 4.26]
  - - [8192, 512, 1, 512, 8192, 8192, 512, 512]
    - [10, 4.811]
  - - [8192, 512, 1, 1024, 8192, 8192, 1024, 1024]
    - [40, 5.783]
  - - [8192, 512, 1, 2048, 8192, 8192, 2048, 2048]
    - [34, 6.456]
  - - [8192, 512, 1, 4096, 8192, 8192, 4096, 4096]
    - [24, 6.151]
  - - [8192, 512, 1, 8192, 8192, 8192, 8192, 8192]
    - [25, 6.793]
  - - [8192, 1024, 1, 128, 8192, 8192, 128, 128]
    - [17, 2.476]
  - - [8192, 1024, 1, 256, 8192, 8192, 256, 256]
    - [69, 3.501]
  - - [8192, 1024, 1, 512, 8192, 8192, 512, 512]
    - [77, 4.307]
  - - [8192, 1024, 1, 1024, 8192, 8192, 1024, 1024]
    - [42, 5.1]
  - - [8192, 1024, 1, 2048, 8192, 8192, 2048, 2048]
    - [31, 5.983]
  - - [8192, 1024, 1, 4096, 8192, 8192, 4096, 4096]
    - [28, 6.894]
  - - [8192, 1024, 1, 8192, 8192, 8192, 8192, 8192]
    - [24, 6.843]
  - - [8192, 2048, 1, 128, 8192, 8192, 128, 128]
    - [18, 3.103]
  - - [8192, 2048, 1, 256, 8192, 8192, 256, 256]
    - [10, 3.876]
  - - [8192, 2048, 1, 512, 8192, 8192, 512, 512]
    - [10, 4.549]
  - - [8192, 2048, 1, 1024, 8192, 8192, 1024, 1024]
    - [46, 5.431]
  - - [8192, 2048, 1, 2048, 8192, 8192, 2048, 2048]
    - [41, 5.967]
  - - [8192, 2048, 1, 4096, 8192, 8192, 4096, 4096]
    - [40, 6.728]
  - - [8192, 2048, 1, 8192, 8192, 8192, 8192, 8192]
    - [25, 6.817]
  - - [8192, 4096, 1, 128, 8192, 8192, 128, 128]
    - [13, 3.393]
  - - [8192, 4096, 1, 256, 8192, 8192, 256, 256]
    - [69, 3.93]
  - - [8192, 4096, 1, 512, 8192, 8192, 512, 512]
    - [53, 4.568]
  - - [8192, 4096, 1, 1024, 8192, 8192, 1024, 1024]
    - [40, 5.43]
  - - [8192, 4096, 1, 2048, 8192, 8192, 2048, 2048]
    - [40, 5.774]
  - - [8192, 4096, 1, 4096, 8192, 8192, 4096, 4096]
    - [27, 6.473]
  - - [8192, 4096, 1, 8192, 8192, 8192, 8192, 8192]
    - [37, 6.858]
  - - [8192, 8192, 1, 128, 8192, 8192, 128, 128]
    - [1, 3.285]
  - - [8192, 8192, 1, 256, 8192, 8192, 256, 256]
    - [66, 3.73]
  - - [8192, 8192, 1, 512, 8192, 8192, 512, 512]
    - [43, 4.53]
  - - [8192, 8192, 1, 1024, 8192, 8192, 1024, 1024]
    - [46, 5.23]
  - - [8192, 8192, 1, 2048, 8192, 8192, 2048, 2048]
    - [40, 5.594]
  - - [8192, 8192, 1, 4096, 8192, 8192, 4096, 4096]
    - [41, 5.86]
  - - [8192, 8192, 1, 8192, 8192, 8192, 8192, 8192]
    - [30, 6.529]
  - - [1, 1, 1, 32, 1, 1, 32, 32]
    - [123, 0.0]
- null
- null
- DeviceEfficiency
- GridBased
