library/src/amd_detail/rocblaslt/src/Tensile/Logic/streamk/gfx942_38cu/aquavanjaram942_Cijk_Alik_Bljk_BBS_BH_UserArgs.yaml
- {MinimumRequiredVersion: 4.33.0}
- aquavanjaram942
- {Architecture: gfx942, CUCount: 38}
- [Device 0049, Device 0050]
    SolutionIndex: 0
    SolutionNameMin: Cijk_Alik_Bljk_BBS_BH_UserArgs_MT256x64x32_MI16x16x1_SN_LDSB1_CLR1_GSU0_GSUC0_GSUWGMRR0_K1_LBSPPA256_LBSPPB128_MIWT8_2_PLR1_SU32_SUM0_SUS256_VWA4_VWB2_WGM1_WGMXCC1_WGMXCCGn1
    SolutionIndex: 1
    SolutionNameMin: Cijk_Alik_Bljk_BBS_BH_UserArgs_MT256x64x32_MI16x16x1_SN_LDSB1_CLR1_GSU0_GSUC0_GSUWGMRR0_K1_LBSPPA512_LBSPPB128_MIWT8_2_PLR1_SU32_SUM0_SUS256_VWA8_VWB2_WGM1_WGMXCC1_WGMXCCGn1
    SolutionIndex: 2
    SolutionNameMin: Cijk_Alik_Bljk_BBS_BH_UserArgs_MT256x64x32_MI16x16x1_SN_LDSB1_CLR1_GSU0_GSUC0_GSUWGMRR0_K1_LBSPPA512_LBSPPB128_MIWT8_2_PLR1_SU32_SUM0_SUS256_VWA8_VWB1_WGM4_WGMXCC1_WGMXCCGn1
    SolutionIndex: 3
    SolutionNameMin: Cijk_Alik_Bljk_BBS_BH_UserArgs_MT256x64x32_MI16x16x1_SN_LDSB1_CLR1_GSU0_GSUC0_GSUWGMRR0_K1_LBSPPA512_LBSPPB128_MIWT8_2_PLR1_SU32_SUM0_SUS256_VWA8_VWB2_WGM4_WGMXCC1_WGMXCCGn1
    SolutionIndex: 4
    SolutionNameMin: Cijk_Alik_Bljk_BBS_BH_UserArgs_MT256x64x32_MI16x16x1_SN_LDSB1_CLR1_GSU0_GSUC0_GSUWGMRR0_K1_LBSPPA512_LBSPPB128_MIWT8_2_PLR1_SU32_SUM0_SUS256_VWA8_VWB1_WGM8_WGMXCC1_WGMXCCGn1
    SolutionIndex: 5
    SolutionNameMin: Cijk_Alik_Bljk_BBS_BH_UserArgs_MT256x64x32_MI16x16x1_SN_LDSB1_CLR1_GSU0_GSUC0_GSUWGMRR0_K1_LBSPPA512_LBSPPB128_MIWT8_2_PLR1_SU32_SUM0_SUS256_VWA8_VWB2_WGM8_WGMXCC1_WGMXCCGn1
    SolutionIndex: 6
    SolutionNameMin: Cijk_Alik_Bljk_BBS_BH_UserArgs_MT128x128x32_MI16x16x1_SN_LDSB1_CLR1_GSU0_GSUC0_GSUWGMRR0_K1_LBSPPA128_LBSPPB128_MIWT4_4_PLR1_SU32_SUM0_SUS256_VWA2_VWB1_WGM1_WGMXCC1_WGMXCCGn1
    SolutionIndex: 7
    SolutionNameMin: Cijk_Alik_Bljk_BBS_BH_UserArgs_MT128x128x32_MI16x16x1_SN_LDSB1_CLR1_GSU0_GSUC0_GSUWGMRR0_K1_LBSPPA256_LBSPPB128_MIWT4_4_PLR1_SU32_SUM0_SUS256_VWA4_VWB1_WGM1_WGMXCC1_WGMXCCGn1
    SolutionIndex: 8
    SolutionNameMin: Cijk_Alik_Bljk_BBS_BH_UserArgs_MT128x128x32_MI16x16x1_SN_LDSB1_CLR1_GSU0_GSUC0_GSUWGMRR0_K1_LBSPPA128_LBSPPB128_MIWT4_4_PLR1_SU32_SUM0_SUS256_VWA2_VWB2_WGM1_WGMXCC1_WGMXCCGn1
    SolutionIndex: 9
    SolutionNameMin: Cijk_Alik_Bljk_BBS_BH_UserArgs_MT128x128x32_MI16x16x1_SN_LDSB1_CLR1_GSU0_GSUC0_GSUWGMRR0_K1_LBSPPA256_LBSPPB128_MIWT4_4_PLR1_SU32_SUM0_SUS256_VWA4_VWB2_WGM1_WGMXCC1_WGMXCCGn1
    SolutionIndex: 10
    SolutionNameMin: Cijk_Alik_Bljk_BBS_BH_UserArgs_MT128x128x32_MI16x16x1_SN_LDSB1_CLR1_GSU0_GSUC0_GSUWGMRR0_K1_LBSPPA128_LBSPPB256_MIWT4_4_PLR1_SU32_SUM0_SUS256_VWA2_VWB4_WGM1_WGMXCC1_WGMXCCGn1
    SolutionIndex: 11
    SolutionNameMin: Cijk_Alik_Bljk_BBS_BH_UserArgs_MT128x128x32_MI16x16x1_SN_LDSB1_CLR1_GSU0_GSUC0_GSUWGMRR0_K1_LBSPPA256_LBSPPB256_MIWT4_4_PLR1_SU32_SUM0_SUS256_VWA4_VWB4_WGM1_WGMXCC1_WGMXCCGn1
    SolutionIndex: 12
    SolutionNameMin: Cijk_Alik_Bljk_BBS_BH_UserArgs_MT128x128x32_MI16x16x1_SN_LDSB1_CLR1_GSU0_GSUC0_GSUWGMRR0_K1_LBSPPA256_LBSPPB128_MIWT4_4_PLR1_SU32_SUM0_SUS256_VWA4_VWB1_WGM4_WGMXCC1_WGMXCCGn1
    SolutionIndex: 13
    SolutionNameMin: Cijk_Alik_Bljk_BBS_BH_UserArgs_MT128x128x32_MI16x16x1_SN_LDSB1_CLR1_GSU0_GSUC0_GSUWGMRR0_K1_LBSPPA128_LBSPPB128_MIWT4_4_PLR1_SU32_SUM0_SUS256_VWA2_VWB2_WGM4_WGMXCC1_WGMXCCGn1
    SolutionIndex: 14
    SolutionNameMin: Cijk_Alik_Bljk_BBS_BH_UserArgs_MT128x128x32_MI16x16x1_SN_LDSB1_CLR1_GSU0_GSUC0_GSUWGMRR0_K1_LBSPPA256_LBSPPB128_MIWT4_4_PLR1_SU32_SUM0_SUS256_VWA4_VWB2_WGM4_WGMXCC1_WGMXCCGn1
    SolutionIndex: 15
    SolutionNameMin: Cijk_Alik_Bljk_BBS_BH_UserArgs_MT128x128x32_MI16x16x1_SN_LDSB1_CLR1_GSU0_GSUC0_GSUWGMRR0_K1_LBSPPA128_LBSPPB256_MIWT4_4_PLR1_SU32_SUM0_SUS256_VWA2_VWB4_WGM4_WGMXCC1_WGMXCCGn1
    SolutionIndex: 16
    SolutionNameMin: Cijk_Alik_Bljk_BBS_BH_UserArgs_MT128x128x32_MI16x16x1_SN_LDSB1_CLR1_GSU0_GSUC0_GSUWGMRR0_K1_LBSPPA128_LBSPPB128_MIWT4_4_PLR1_SU32_SUM0_SUS256_VWA2_VWB1_WGM8_WGMXCC1_WGMXCCGn1
    SolutionIndex: 17
    SolutionNameMin: Cijk_Alik_Bljk_BBS_BH_UserArgs_MT128x128x32_MI16x16x1_SN_LDSB1_CLR1_GSU0_GSUC0_GSUWGMRR0_K1_LBSPPA256_LBSPPB128_MIWT4_4_PLR1_SU32_SUM0_SUS256_VWA4_VWB1_WGM8_WGMXCC1_WGMXCCGn1
    SolutionIndex: 18
    SolutionNameMin: Cijk_Alik_Bljk_BBS_BH_UserArgs_MT128x128x32_MI16x16x1_SN_LDSB1_CLR1_GSU0_GSUC0_GSUWGMRR0_K1_LBSPPA128_LBSPPB128_MIWT4_4_PLR1_SU32_SUM0_SUS256_VWA2_VWB2_WGM8_WGMXCC1_WGMXCCGn1
    SolutionIndex: 19
    SolutionNameMin: Cijk_Alik_Bljk_BBS_BH_UserArgs_MT128x128x32_MI16x16x1_SN_LDSB1_CLR1_GSU0_GSUC0_GSUWGMRR0_K1_LBSPPA256_LBSPPB128_MIWT4_4_PLR1_SU32_SUM0_SUS256_VWA4_VWB2_WGM8_WGMXCC1_WGMXCCGn1
    SolutionIndex: 20
    SolutionNameMin: Cijk_Alik_Bljk_BBS_BH_UserArgs_MT128x128x32_MI16x16x1_SN_LDSB1_CLR1_GSU0_GSUC0_GSUWGMRR0_K1_LBSPPA128_LBSPPB256_MIWT4_4_PLR1_SU32_SUM0_SUS256_VWA2_VWB4_WGM8_WGMXCC1_WGMXCCGn1
    SolutionIndex: 21
    SolutionNameMin: Cijk_Alik_Bljk_BBS_BH_UserArgs_MT128x128x32_MI16x16x1_SN_LDSB1_CLR1_GSU0_GSUC0_GSUWGMRR0_K1_LBSPPA256_LBSPPB256_MIWT4_4_PLR1_SU32_SUM0_SUS256_VWA4_VWB4_WGM8_WGMXCC1_WGMXCCGn1
    SolutionIndex: 22
    SolutionNameMin: Cijk_Alik_Bljk_BBS_BH_UserArgs_MT64x64x32_MI16x16x1_SN_LDSB0_CLR1_GSU0_GSUC0_GSUWGMRR0_K1_LBSPPA128_LBSPPB128_MIWT2_2_PLR1_SU32_SUM0_SUS256_VWA2_VWB1_WGM4_WGMXCC1_WGMXCCGn1
    SolutionIndex: 23
    SolutionNameMin: Cijk_Alik_Bljk_BBS_BH_UserArgs_MT256x64x64_MI16x16x1_SN_LDSB1_CLR1_GSU0_GSUC0_GSUWGMRR0_K1_LBSPPA1024_LBSPPB128_MIWT8_2_PLR1_SU32_SUM0_SUS256_VWA8_VWB1_WGM8_WGMXCC1_WGMXCCGn1
    SolutionIndex: 24
    SolutionNameMin: Cijk_Alik_Bljk_BBS_BH_UserArgs_MT128x128x64_MI16x16x1_SN_LDSB1_CLR1_GSU0_GSUC0_GSUWGMRR0_K1_LBSPPA128_LBSPPB128_MIWT4_4_PLR1_SU32_SUM0_SUS256_VWA1_VWB1_WGM1_WGMXCC1_WGMXCCGn1
    SolutionIndex: 25
    SolutionNameMin: Cijk_Alik_Bljk_BBS_BH_UserArgs_MT128x128x64_MI16x16x1_SN_LDSB1_CLR1_GSU0_GSUC0_GSUWGMRR0_K1_LBSPPA256_LBSPPB128_MIWT4_4_PLR1_SU32_SUM0_SUS256_VWA2_VWB1_WGM1_WGMXCC1_WGMXCCGn1
    SolutionIndex: 26
    SolutionNameMin: Cijk_Alik_Bljk_BBS_BH_UserArgs_MT128x128x64_MI16x16x1_SN_LDSB1_CLR1_GSU0_GSUC0_GSUWGMRR0_K1_LBSPPA512_LBSPPB128_MIWT4_4_PLR1_SU32_SUM0_SUS256_VWA4_VWB1_WGM1_WGMXCC1_WGMXCCGn1
    SolutionIndex: 27
    SolutionNameMin: Cijk_Alik_Bljk_BBS_BH_UserArgs_MT128x128x64_MI16x16x1_SN_LDSB1_CLR1_GSU0_GSUC0_GSUWGMRR0_K1_LBSPPA256_LBSPPB256_MIWT4_4_PLR1_SU32_SUM0_SUS256_VWA2_VWB2_WGM1_WGMXCC1_WGMXCCGn1
    SolutionIndex: 28
    SolutionNameMin: Cijk_Alik_Bljk_BBS_BH_UserArgs_MT128x128x64_MI16x16x1_SN_LDSB1_CLR1_GSU0_GSUC0_GSUWGMRR0_K1_LBSPPA512_LBSPPB256_MIWT4_4_PLR1_SU32_SUM0_SUS256_VWA4_VWB2_WGM1_WGMXCC1_WGMXCCGn1
    SolutionIndex: 29
    SolutionNameMin: Cijk_Alik_Bljk_BBS_BH_UserArgs_MT128x128x64_MI16x16x1_SN_LDSB1_CLR1_GSU0_GSUC0_GSUWGMRR0_K1_LBSPPA128_LBSPPB512_MIWT4_4_PLR1_SU32_SUM0_SUS256_VWA1_VWB4_WGM1_WGMXCC1_WGMXCCGn1
    SolutionIndex: 30
    SolutionNameMin: Cijk_Alik_Bljk_BBS_BH_UserArgs_MT128x128x64_MI16x16x1_SN_LDSB1_CLR1_GSU0_GSUC0_GSUWGMRR0_K1_LBSPPA256_LBSPPB512_MIWT4_4_PLR1_SU32_SUM0_SUS256_VWA2_VWB4_WGM1_WGMXCC1_WGMXCCGn1
    SolutionIndex: 31
    SolutionNameMin: Cijk_Alik_Bljk_BBS_BH_UserArgs_MT128x128x64_MI16x16x1_SN_LDSB1_CLR1_GSU0_GSUC0_GSUWGMRR0_K1_LBSPPA512_LBSPPB512_MIWT4_4_PLR1_SU32_SUM0_SUS256_VWA4_VWB4_WGM1_WGMXCC1_WGMXCCGn1
    SolutionIndex: 32
    SolutionNameMin: Cijk_Alik_Bljk_BBS_BH_UserArgs_MT128x128x64_MI16x16x1_SN_LDSB1_CLR1_GSU0_GSUC0_GSUWGMRR0_K1_LBSPPA256_LBSPPB128_MIWT4_4_PLR1_SU32_SUM0_SUS256_VWA2_VWB1_WGM4_WGMXCC1_WGMXCCGn1
    SolutionIndex: 33
    SolutionNameMin: Cijk_Alik_Bljk_BBS_BH_UserArgs_MT128x128x64_MI16x16x1_SN_LDSB1_CLR1_GSU0_GSUC0_GSUWGMRR0_K1_LBSPPA512_LBSPPB128_MIWT4_4_PLR1_SU32_SUM0_SUS256_VWA4_VWB1_WGM4_WGMXCC1_WGMXCCGn1
    SolutionIndex: 34
    SolutionNameMin: Cijk_Alik_Bljk_BBS_BH_UserArgs_MT128x128x64_MI16x16x1_SN_LDSB1_CLR1_GSU0_GSUC0_GSUWGMRR0_K1_LBSPPA128_LBSPPB256_MIWT4_4_PLR1_SU32_SUM0_SUS256_VWA1_VWB2_WGM4_WGMXCC1_WGMXCCGn1
    SolutionIndex: 35
    SolutionNameMin: Cijk_Alik_Bljk_BBS_BH_UserArgs_MT128x128x64_MI16x16x1_SN_LDSB1_CLR1_GSU0_GSUC0_GSUWGMRR0_K1_LBSPPA256_LBSPPB256_MIWT4_4_PLR1_SU32_SUM0_SUS256_VWA2_VWB2_WGM4_WGMXCC1_WGMXCCGn1
    SolutionIndex: 36
    SolutionNameMin: Cijk_Alik_Bljk_BBS_BH_UserArgs_MT128x128x64_MI16x16x1_SN_LDSB1_CLR1_GSU0_GSUC0_GSUWGMRR0_K1_LBSPPA512_LBSPPB256_MIWT4_4_PLR1_SU32_SUM0_SUS256_VWA4_VWB2_WGM4_WGMXCC1_WGMXCCGn1
    SolutionIndex: 37
    SolutionNameMin: Cijk_Alik_Bljk_BBS_BH_UserArgs_MT128x128x64_MI16x16x1_SN_LDSB1_CLR1_GSU0_GSUC0_GSUWGMRR0_K1_LBSPPA128_LBSPPB512_MIWT4_4_PLR1_SU32_SUM0_SUS256_VWA1_VWB4_WGM4_WGMXCC1_WGMXCCGn1
    SolutionIndex: 38
    SolutionNameMin: Cijk_Alik_Bljk_BBS_BH_UserArgs_MT128x128x64_MI16x16x1_SN_LDSB1_CLR1_GSU0_GSUC0_GSUWGMRR0_K1_LBSPPA256_LBSPPB512_MIWT4_4_PLR1_SU32_SUM0_SUS256_VWA2_VWB4_WGM4_WGMXCC1_WGMXCCGn1
    SolutionIndex: 39
    SolutionNameMin: Cijk_Alik_Bljk_BBS_BH_UserArgs_MT128x128x64_MI16x16x1_SN_LDSB1_CLR1_GSU0_GSUC0_GSUWGMRR0_K1_LBSPPA512_LBSPPB512_MIWT4_4_PLR1_SU32_SUM0_SUS256_VWA4_VWB4_WGM4_WGMXCC1_WGMXCCGn1
    SolutionIndex: 40
    SolutionNameMin: Cijk_Alik_Bljk_BBS_BH_UserArgs_MT128x128x64_MI16x16x1_SN_LDSB1_CLR1_GSU0_GSUC0_GSUWGMRR0_K1_LBSPPA256_LBSPPB128_MIWT4_4_PLR1_SU32_SUM0_SUS256_VWA2_VWB1_WGM8_WGMXCC1_WGMXCCGn1
    SolutionIndex: 41
    SolutionNameMin: Cijk_Alik_Bljk_BBS_BH_UserArgs_MT128x128x64_MI16x16x1_SN_LDSB1_CLR1_GSU0_GSUC0_GSUWGMRR0_K1_LBSPPA512_LBSPPB128_MIWT4_4_PLR1_SU32_SUM0_SUS256_VWA4_VWB1_WGM8_WGMXCC1_WGMXCCGn1
    SolutionIndex: 42
    SolutionNameMin: Cijk_Alik_Bljk_BBS_BH_UserArgs_MT128x128x64_MI16x16x1_SN_LDSB1_CLR1_GSU0_GSUC0_GSUWGMRR0_K1_LBSPPA256_LBSPPB256_MIWT4_4_PLR1_SU32_SUM0_SUS256_VWA2_VWB2_WGM8_WGMXCC1_WGMXCCGn1
    SolutionIndex: 43
    SolutionNameMin: Cijk_Alik_Bljk_BBS_BH_UserArgs_MT128x128x64_MI16x16x1_SN_LDSB1_CLR1_GSU0_GSUC0_GSUWGMRR0_K1_LBSPPA512_LBSPPB256_MIWT4_4_PLR1_SU32_SUM0_SUS256_VWA4_VWB2_WGM8_WGMXCC1_WGMXCCGn1
    SolutionIndex: 44
    SolutionNameMin: Cijk_Alik_Bljk_BBS_BH_UserArgs_MT128x128x64_MI16x16x1_SN_LDSB1_CLR1_GSU0_GSUC0_GSUWGMRR0_K1_LBSPPA128_LBSPPB512_MIWT4_4_PLR1_SU32_SUM0_SUS256_VWA1_VWB4_WGM8_WGMXCC1_WGMXCCGn1
    SolutionIndex: 45
    SolutionNameMin: Cijk_Alik_Bljk_BBS_BH_UserArgs_MT128x128x64_MI16x16x1_SN_LDSB1_CLR1_GSU0_GSUC0_GSUWGMRR0_K1_LBSPPA256_LBSPPB512_MIWT4_4_PLR1_SU32_SUM0_SUS256_VWA2_VWB4_WGM8_WGMXCC1_WGMXCCGn1
    SolutionIndex: 46
    SolutionNameMin: Cijk_Alik_Bljk_BBS_BH_UserArgs_MT128x128x64_MI16x16x1_SN_LDSB1_CLR1_GSU0_GSUC0_GSUWGMRR0_K1_LBSPPA512_LBSPPB512_MIWT4_4_PLR1_SU32_SUM0_SUS256_VWA4_VWB4_WGM8_WGMXCC1_WGMXCCGn1
    SolutionIndex: 47
    SolutionNameMin: Cijk_Alik_Bljk_BBS_BH_UserArgs_MT128x128x64_MI16x16x1_SN_LDSB1_CLR1_GSU0_GSUC0_GSUWGMRR0_K1_LBSPPA512_LBSPPB512_MIWT4_4_PLR2_SU32_SUM0_SUS256_VWA4_VWB4_WGM8_WGMXCC1_WGMXCCGn1
    SolutionIndex: 48
    SolutionNameMin: Cijk_Alik_Bljk_BBS_BH_UserArgs_MT64x128x64_MI16x16x1_SN_LDSB1_CLR1_GSU0_GSUC0_GSUWGMRR0_K1_LBSPPA128_LBSPPB128_MIWT2_4_PLR1_SU32_SUM0_SUS256_VWA1_VWB1_WGM1_WGMXCC1_WGMXCCGn1
    SolutionIndex: 49
    SolutionNameMin: Cijk_Alik_Bljk_BBS_BH_UserArgs_MT64x128x64_MI16x16x1_SN_LDSB1_CLR1_GSU0_GSUC0_GSUWGMRR0_K1_LBSPPA256_LBSPPB128_MIWT2_4_PLR1_SU32_SUM0_SUS256_VWA2_VWB1_WGM1_WGMXCC1_WGMXCCGn1
    SolutionIndex: 50
    SolutionNameMin: Cijk_Alik_Bljk_BBS_BH_UserArgs_MT64x128x64_MI16x16x1_SN_LDSB1_CLR1_GSU0_GSUC0_GSUWGMRR0_K1_LBSPPA256_LBSPPB256_MIWT2_4_PLR1_SU32_SUM0_SUS256_VWA2_VWB2_WGM1_WGMXCC1_WGMXCCGn1
    SolutionIndex: 51
    SolutionNameMin: Cijk_Alik_Bljk_BBS_BH_UserArgs_MT64x128x64_MI16x16x1_SN_LDSB1_CLR1_GSU0_GSUC0_GSUWGMRR0_K1_LBSPPA128_LBSPPB512_MIWT2_4_PLR1_SU32_SUM0_SUS256_VWA1_VWB4_WGM1_WGMXCC1_WGMXCCGn1
    SolutionIndex: 52
    SolutionNameMin: Cijk_Alik_Bljk_BBS_BH_UserArgs_MT64x128x64_MI16x16x1_SN_LDSB1_CLR1_GSU0_GSUC0_GSUWGMRR0_K1_LBSPPA256_LBSPPB512_MIWT2_4_PLR1_SU32_SUM0_SUS256_VWA2_VWB4_WGM1_WGMXCC1_WGMXCCGn1
    SolutionIndex: 53
    SolutionNameMin: Cijk_Alik_Bljk_BBS_BH_UserArgs_MT64x128x64_MI16x16x1_SN_LDSB1_CLR1_GSU0_GSUC0_GSUWGMRR0_K1_LBSPPA256_LBSPPB128_MIWT2_4_PLR1_SU32_SUM0_SUS256_VWA2_VWB1_WGM4_WGMXCC1_WGMXCCGn1
    SolutionIndex: 54
    SolutionNameMin: Cijk_Alik_Bljk_BBS_BH_UserArgs_MT64x128x64_MI16x16x1_SN_LDSB1_CLR1_GSU0_GSUC0_GSUWGMRR0_K1_LBSPPA256_LBSPPB256_MIWT2_4_PLR1_SU32_SUM0_SUS256_VWA2_VWB2_WGM4_WGMXCC1_WGMXCCGn1
    SolutionIndex: 55
    SolutionNameMin: Cijk_Alik_Bljk_BBS_BH_UserArgs_MT64x128x64_MI16x16x1_SN_LDSB1_CLR1_GSU0_GSUC0_GSUWGMRR0_K1_LBSPPA256_LBSPPB128_MIWT2_4_PLR1_SU32_SUM0_SUS256_VWA2_VWB1_WGM8_WGMXCC1_WGMXCCGn1
    SolutionIndex: 56
    SolutionNameMin: Cijk_Alik_Bljk_BBS_BH_UserArgs_MT64x128x64_MI16x16x1_SN_LDSB1_CLR1_GSU0_GSUC0_GSUWGMRR0_K1_LBSPPA128_LBSPPB512_MIWT2_4_PLR1_SU32_SUM0_SUS256_VWA1_VWB4_WGM8_WGMXCC1_WGMXCCGn1
    SolutionIndex: 57
    SolutionNameMin: Cijk_Alik_Bljk_BBS_BH_UserArgs_MT64x128x64_MI16x16x1_SN_LDSB1_CLR1_GSU0_GSUC0_GSUWGMRR0_K1_LBSPPA256_LBSPPB512_MIWT2_4_PLR1_SU32_SUM0_SUS256_VWA2_VWB4_WGM8_WGMXCC1_WGMXCCGn1
    SolutionIndex: 58
    SolutionNameMin: Cijk_Alik_Bljk_BBS_BH_UserArgs_MT128x64x64_MI16x16x1_SN_LDSB1_CLR1_GSU0_GSUC0_GSUWGMRR0_K1_LBSPPA256_LBSPPB128_MIWT4_2_PLR1_SU32_SUM0_SUS256_VWA2_VWB1_WGM1_WGMXCC1_WGMXCCGn1
    SolutionIndex: 59
    SolutionNameMin: Cijk_Alik_Bljk_BBS_BH_UserArgs_MT128x64x64_MI16x16x1_SN_LDSB1_CLR1_GSU0_GSUC0_GSUWGMRR0_K1_LBSPPA512_LBSPPB128_MIWT4_2_PLR1_SU32_SUM0_SUS256_VWA4_VWB1_WGM1_WGMXCC1_WGMXCCGn1
    SolutionIndex: 60
    SolutionNameMin: Cijk_Alik_Bljk_BBS_BH_UserArgs_MT128x64x64_MI16x16x1_SN_LDSB1_CLR1_GSU0_GSUC0_GSUWGMRR0_K1_LBSPPA256_LBSPPB256_MIWT4_2_PLR1_SU32_SUM0_SUS256_VWA2_VWB2_WGM1_WGMXCC1_WGMXCCGn1
    SolutionIndex: 61
    SolutionNameMin: Cijk_Alik_Bljk_BBS_BH_UserArgs_MT128x64x64_MI16x16x1_SN_LDSB1_CLR1_GSU0_GSUC0_GSUWGMRR0_K1_LBSPPA512_LBSPPB256_MIWT4_2_PLR1_SU32_SUM0_SUS256_VWA4_VWB2_WGM1_WGMXCC1_WGMXCCGn1
    SolutionIndex: 62
    SolutionNameMin: Cijk_Alik_Bljk_BBS_BH_UserArgs_MT128x64x64_MI16x16x1_SN_LDSB1_CLR1_GSU0_GSUC0_GSUWGMRR0_K1_LBSPPA256_LBSPPB128_MIWT4_2_PLR2_SU32_SUM0_SUS256_VWA2_VWB1_WGM1_WGMXCC1_WGMXCCGn1
    SolutionIndex: 63
    SolutionNameMin: Cijk_Alik_Bljk_BBS_BH_UserArgs_MT128x64x64_MI16x16x1_SN_LDSB1_CLR1_GSU0_GSUC0_GSUWGMRR0_K1_LBSPPA256_LBSPPB128_MIWT4_2_PLR1_SU32_SUM0_SUS256_VWA2_VWB1_WGM4_WGMXCC1_WGMXCCGn1
    SolutionIndex: 64
    SolutionNameMin: Cijk_Alik_Bljk_BBS_BH_UserArgs_MT128x64x64_MI16x16x1_SN_LDSB1_CLR1_GSU0_GSUC0_GSUWGMRR0_K1_LBSPPA512_LBSPPB128_MIWT4_2_PLR1_SU32_SUM0_SUS256_VWA4_VWB1_WGM4_WGMXCC1_WGMXCCGn1
    SolutionIndex: 65
    SolutionNameMin: Cijk_Alik_Bljk_BBS_BH_UserArgs_MT128x64x64_MI16x16x1_SN_LDSB1_CLR1_GSU0_GSUC0_GSUWGMRR0_K1_LBSPPA256_LBSPPB256_MIWT4_2_PLR1_SU32_SUM0_SUS256_VWA2_VWB2_WGM4_WGMXCC1_WGMXCCGn1
    SolutionIndex: 66
    SolutionNameMin: Cijk_Alik_Bljk_BBS_BH_UserArgs_MT128x64x64_MI16x16x1_SN_LDSB1_CLR1_GSU0_GSUC0_GSUWGMRR0_K1_LBSPPA512_LBSPPB256_MIWT4_2_PLR1_SU32_SUM0_SUS256_VWA4_VWB2_WGM4_WGMXCC1_WGMXCCGn1
    SolutionIndex: 67
    SolutionNameMin: Cijk_Alik_Bljk_BBS_BH_UserArgs_MT128x64x64_MI16x16x1_SN_LDSB1_CLR1_GSU0_GSUC0_GSUWGMRR0_K1_LBSPPA256_LBSPPB128_MIWT4_2_PLR1_SU32_SUM0_SUS256_VWA2_VWB1_WGM8_WGMXCC1_WGMXCCGn1
    SolutionIndex: 68
    SolutionNameMin: Cijk_Alik_Bljk_BBS_BH_UserArgs_MT128x64x64_MI16x16x1_SN_LDSB1_CLR1_GSU0_GSUC0_GSUWGMRR0_K1_LBSPPA512_LBSPPB128_MIWT4_2_PLR1_SU32_SUM0_SUS256_VWA4_VWB1_WGM8_WGMXCC1_WGMXCCGn1
    SolutionIndex: 69
    SolutionNameMin: Cijk_Alik_Bljk_BBS_BH_UserArgs_MT128x64x64_MI16x16x1_SN_LDSB1_CLR1_GSU0_GSUC0_GSUWGMRR0_K1_LBSPPA128_LBSPPB256_MIWT4_2_PLR1_SU32_SUM0_SUS256_VWA1_VWB2_WGM8_WGMXCC1_WGMXCCGn1
    SolutionIndex: 70
    SolutionNameMin: Cijk_Alik_Bljk_BBS_BH_UserArgs_MT128x64x64_MI16x16x1_SN_LDSB1_CLR1_GSU0_GSUC0_GSUWGMRR0_K1_LBSPPA256_LBSPPB256_MIWT4_2_PLR1_SU32_SUM0_SUS256_VWA2_VWB2_WGM8_WGMXCC1_WGMXCCGn1
    SolutionIndex: 71
    SolutionNameMin: Cijk_Alik_Bljk_BBS_BH_UserArgs_MT128x64x64_MI16x16x1_SN_LDSB1_CLR1_GSU0_GSUC0_GSUWGMRR0_K1_LBSPPA512_LBSPPB256_MIWT4_2_PLR1_SU32_SUM0_SUS256_VWA4_VWB2_WGM8_WGMXCC1_WGMXCCGn1
    SolutionIndex: 72
    SolutionNameMin: Cijk_Alik_Bljk_BBS_BH_UserArgs_MT128x64x64_MI16x16x1_SN_LDSB1_CLR1_GSU0_GSUC0_GSUWGMRR0_K1_LBSPPA512_LBSPPB128_MIWT4_2_PLR2_SU32_SUM0_SUS256_VWA4_VWB1_WGM8_WGMXCC1_WGMXCCGn1
    SolutionIndex: 73
    SolutionNameMin: Cijk_Alik_Bljk_BBS_BH_UserArgs_MT128x64x64_MI16x16x1_SN_LDSB1_CLR1_GSU0_GSUC0_GSUWGMRR0_K1_LBSPPA512_LBSPPB256_MIWT4_2_PLR2_SU32_SUM0_SUS256_VWA4_VWB2_WGM8_WGMXCC1_WGMXCCGn1
    SolutionIndex: 74
    SolutionNameMin: Cijk_Alik_Bljk_BBS_BH_UserArgs_MT64x64x64_MI16x16x1_SN_LDSB1_CLR1_GSU0_GSUC0_GSUWGMRR0_K1_LBSPPA128_LBSPPB128_MIWT2_2_PLR1_SU32_SUM0_SUS256_VWA1_VWB1_WGM1_WGMXCC1_WGMXCCGn1
    SolutionIndex: 75
    SolutionNameMin: Cijk_Alik_Bljk_BBS_BH_UserArgs_MT64x64x64_MI16x16x1_SN_LDSB1_CLR1_GSU0_GSUC0_GSUWGMRR0_K1_LBSPPA256_LBSPPB128_MIWT2_2_PLR1_SU32_SUM0_SUS256_VWA2_VWB1_WGM1_WGMXCC1_WGMXCCGn1
    SolutionIndex: 76
    SolutionNameMin: Cijk_Alik_Bljk_BBS_BH_UserArgs_MT64x64x64_MI16x16x1_SN_LDSB1_CLR1_GSU0_GSUC0_GSUWGMRR0_K1_LBSPPA128_LBSPPB256_MIWT2_2_PLR1_SU32_SUM0_SUS256_VWA1_VWB2_WGM1_WGMXCC1_WGMXCCGn1
    SolutionIndex: 77
    SolutionNameMin: Cijk_Alik_Bljk_BBS_BH_UserArgs_MT64x64x64_MI16x16x1_SN_LDSB1_CLR1_GSU0_GSUC0_GSUWGMRR0_K1_LBSPPA256_LBSPPB256_MIWT2_2_PLR1_SU32_SUM0_SUS256_VWA2_VWB2_WGM1_WGMXCC1_WGMXCCGn1
    SolutionIndex: 78
    SolutionNameMin: Cijk_Alik_Bljk_BBS_BH_UserArgs_MT64x64x64_MI16x16x1_SN_LDSB1_CLR1_GSU0_GSUC0_GSUWGMRR0_K1_LBSPPA256_LBSPPB128_MIWT2_2_PLR2_SU32_SUM0_SUS256_VWA2_VWB1_WGM1_WGMXCC1_WGMXCCGn1
    SolutionIndex: 79
    SolutionNameMin: Cijk_Alik_Bljk_BBS_BH_UserArgs_MT64x64x64_MI16x16x1_SN_LDSB1_CLR1_GSU0_GSUC0_GSUWGMRR0_K1_LBSPPA128_LBSPPB256_MIWT2_2_PLR2_SU32_SUM0_SUS256_VWA1_VWB2_WGM1_WGMXCC1_WGMXCCGn1
    SolutionIndex: 80
    SolutionNameMin: Cijk_Alik_Bljk_BBS_BH_UserArgs_MT64x64x64_MI16x16x1_SN_LDSB1_CLR1_GSU0_GSUC0_GSUWGMRR0_K1_LBSPPA256_LBSPPB128_MIWT2_2_PLR1_SU32_SUM0_SUS256_VWA2_VWB1_WGM4_WGMXCC1_WGMXCCGn1
    SolutionIndex: 81
    SolutionNameMin: Cijk_Alik_Bljk_BBS_BH_UserArgs_MT64x64x64_MI16x16x1_SN_LDSB1_CLR1_GSU0_GSUC0_GSUWGMRR0_K1_LBSPPA128_LBSPPB256_MIWT2_2_PLR1_SU32_SUM0_SUS256_VWA1_VWB2_WGM4_WGMXCC1_WGMXCCGn1
    SolutionIndex: 82
    SolutionNameMin: Cijk_Alik_Bljk_BBS_BH_UserArgs_MT64x64x64_MI16x16x1_SN_LDSB1_CLR1_GSU0_GSUC0_GSUWGMRR0_K1_LBSPPA256_LBSPPB256_MIWT2_2_PLR1_SU32_SUM0_SUS256_VWA2_VWB2_WGM4_WGMXCC1_WGMXCCGn1
    SolutionIndex: 83
    SolutionNameMin: Cijk_Alik_Bljk_BBS_BH_UserArgs_MT64x64x64_MI16x16x1_SN_LDSB1_CLR1_GSU0_GSUC0_GSUWGMRR0_K1_LBSPPA256_LBSPPB128_MIWT2_2_PLR1_SU32_SUM0_SUS256_VWA2_VWB1_WGM8_WGMXCC1_WGMXCCGn1
    SolutionIndex: 84
    SolutionNameMin: Cijk_Alik_Bljk_BBS_BH_UserArgs_MT64x64x64_MI16x16x1_SN_LDSB1_CLR1_GSU0_GSUC0_GSUWGMRR0_K1_LBSPPA128_LBSPPB256_MIWT2_2_PLR1_SU32_SUM0_SUS256_VWA1_VWB2_WGM8_WGMXCC1_WGMXCCGn1
    SolutionIndex: 85
    SolutionNameMin: Cijk_Alik_Bljk_BBS_BH_UserArgs_MT64x64x64_MI16x16x1_SN_LDSB1_CLR1_GSU0_GSUC0_GSUWGMRR0_K1_LBSPPA256_LBSPPB256_MIWT2_2_PLR1_SU32_SUM0_SUS256_VWA2_VWB2_WGM8_WGMXCC1_WGMXCCGn1
    SolutionIndex: 86
    SolutionNameMin: Cijk_Alik_Bljk_BBS_BH_UserArgs_MT64x64x64_MI16x16x1_SN_LDSB1_CLR1_GSU0_GSUC0_GSUWGMRR0_K1_LBSPPA256_LBSPPB256_MIWT2_2_PLR2_SU32_SUM0_SUS256_VWA2_VWB2_WGM8_WGMXCC1_WGMXCCGn1
    SolutionIndex: 87
    SolutionNameMin: Cijk_Alik_Bljk_BBS_BH_UserArgs_MT32x64x64_MI16x16x1_SN_LDSB0_CLR1_GSU0_GSUC0_GSUWGMRR0_K1_LBSPPA128_LBSPPB128_MIWT1_2_PLR1_SU32_SUM0_SUS256_VWA1_VWB1_WGM1_WGMXCC1_WGMXCCGn1
    SolutionIndex: 88
    SolutionNameMin: Cijk_Alik_Bljk_BBS_BH_UserArgs_MT32x64x64_MI16x16x1_SN_LDSB0_CLR1_GSU0_GSUC0_GSUWGMRR0_K1_LBSPPA128_LBSPPB256_MIWT1_2_PLR1_SU32_SUM0_SUS256_VWA1_VWB2_WGM1_WGMXCC1_WGMXCCGn1
    SolutionIndex: 89
    SolutionNameMin: Cijk_Alik_Bljk_BBS_BH_UserArgs_MT32x64x64_MI16x16x1_SN_LDSB0_CLR1_GSU0_GSUC0_GSUWGMRR0_K1_LBSPPA128_LBSPPB128_MIWT1_2_PLR2_SU32_SUM0_SUS256_VWA1_VWB1_WGM1_WGMXCC1_WGMXCCGn1
    SolutionIndex: 90
    SolutionNameMin: Cijk_Alik_Bljk_BBS_BH_UserArgs_MT32x64x64_MI16x16x1_SN_LDSB0_CLR1_GSU0_GSUC0_GSUWGMRR0_K1_LBSPPA128_LBSPPB256_MIWT1_2_PLR2_SU32_SUM0_SUS256_VWA1_VWB2_WGM1_WGMXCC1_WGMXCCGn1
    SolutionIndex: 91
    SolutionNameMin: Cijk_Alik_Bljk_BBS_BH_UserArgs_MT32x64x64_MI16x16x1_SN_LDSB0_CLR1_GSU0_GSUC0_GSUWGMRR0_K1_LBSPPA128_LBSPPB128_MIWT1_2_PLR1_SU32_SUM0_SUS256_VWA1_VWB1_WGM4_WGMXCC1_WGMXCCGn1
    SolutionIndex: 92
    SolutionNameMin: Cijk_Alik_Bljk_BBS_BH_UserArgs_MT32x64x64_MI16x16x1_SN_LDSB0_CLR1_GSU0_GSUC0_GSUWGMRR0_K1_LBSPPA128_LBSPPB256_MIWT1_2_PLR1_SU32_SUM0_SUS256_VWA1_VWB2_WGM8_WGMXCC1_WGMXCCGn1
    SolutionIndex: 93
    SolutionNameMin: Cijk_Alik_Bljk_BBS_BH_UserArgs_MT64x32x64_MI16x16x1_SN_LDSB0_CLR1_GSU0_GSUC0_GSUWGMRR0_K1_LBSPPA128_LBSPPB128_MIWT2_1_PLR1_SU32_SUM0_SUS256_VWA1_VWB1_WGM1_WGMXCC1_WGMXCCGn1
    SolutionIndex: 94
    SolutionNameMin: Cijk_Alik_Bljk_BBS_BH_UserArgs_MT64x32x64_MI16x16x1_SN_LDSB0_CLR1_GSU0_GSUC0_GSUWGMRR0_K1_LBSPPA256_LBSPPB128_MIWT2_1_PLR1_SU32_SUM0_SUS256_VWA2_VWB1_WGM1_WGMXCC1_WGMXCCGn1
    SolutionIndex: 95
    SolutionNameMin: Cijk_Alik_Bljk_BBS_BH_UserArgs_MT64x64x128_MI16x16x1_SN_LDSB1_CLR1_GSU0_GSUC0_GSUWGMRR0_K1_LBSPPA512_LBSPPB256_MIWT2_2_PLR1_SU32_SUM0_SUS256_VWA2_VWB1_WGM1_WGMXCC1_WGMXCCGn1
    SolutionIndex: 96
    SolutionNameMin: Cijk_Alik_Bljk_BBS_BH_UserArgs_MT64x64x128_MI16x16x1_SN_LDSB1_CLR1_GSU0_GSUC0_GSUWGMRR0_K1_LBSPPA256_LBSPPB512_MIWT2_2_PLR1_SU32_SUM0_SUS256_VWA1_VWB2_WGM1_WGMXCC1_WGMXCCGn1
    SolutionIndex: 97
    SolutionNameMin: Cijk_Alik_Bljk_BBS_BH_UserArgs_MT64x64x128_MI16x16x1_SN_LDSB1_CLR1_GSU0_GSUC0_GSUWGMRR0_K1_LBSPPA512_LBSPPB512_MIWT2_2_PLR1_SU32_SUM0_SUS256_VWA2_VWB2_WGM1_WGMXCC1_WGMXCCGn1
    SolutionIndex: 98
    SolutionNameMin: Cijk_Alik_Bljk_BBS_BH_UserArgs_MT64x64x128_MI16x16x1_SN_LDSB1_CLR1_GSU0_GSUC0_GSUWGMRR0_K1_LBSPPA512_LBSPPB512_MIWT2_2_PLR2_SU32_SUM0_SUS256_VWA2_VWB2_WGM1_WGMXCC1_WGMXCCGn1
    SolutionIndex: 99
    SolutionNameMin: Cijk_Alik_Bljk_BBS_BH_UserArgs_MT64x64x128_MI16x16x1_SN_LDSB1_CLR1_GSU0_GSUC0_GSUWGMRR0_K1_LBSPPA512_LBSPPB256_MIWT2_2_PLR1_SU32_SUM0_SUS256_VWA2_VWB1_WGM4_WGMXCC1_WGMXCCGn1
    SolutionIndex: 100
    SolutionNameMin: Cijk_Alik_Bljk_BBS_BH_UserArgs_MT64x64x128_MI16x16x1_SN_LDSB1_CLR1_GSU0_GSUC0_GSUWGMRR0_K1_LBSPPA512_LBSPPB512_MIWT2_2_PLR2_SU32_SUM0_SUS256_VWA2_VWB2_WGM4_WGMXCC1_WGMXCCGn1
    SolutionIndex: 101
    SolutionNameMin: Cijk_Alik_Bljk_BBS_BH_UserArgs_MT64x64x128_MI16x16x1_SN_LDSB1_CLR1_GSU0_GSUC0_GSUWGMRR0_K1_LBSPPA512_LBSPPB512_MIWT2_2_PLR2_SU32_SUM0_SUS256_VWA2_VWB2_WGM8_WGMXCC1_WGMXCCGn1
    SolutionIndex: 102
    SolutionNameMin: Cijk_Alik_Bljk_BBS_BH_UserArgs_MT32x64x128_MI16x16x1_SN_LDSB1_CLR1_GSU0_GSUC0_GSUWGMRR0_K1_LBSPPA256_LBSPPB256_MIWT1_2_PLR1_SU32_SUM0_SUS256_VWA1_VWB1_WGM1_WGMXCC1_WGMXCCGn1
    SolutionIndex: 103
    SolutionNameMin: Cijk_Alik_Bljk_BBS_BH_UserArgs_MT32x64x128_MI16x16x1_SN_LDSB1_CLR1_GSU0_GSUC0_GSUWGMRR0_K1_LBSPPA256_LBSPPB512_MIWT1_2_PLR1_SU32_SUM0_SUS256_VWA1_VWB2_WGM1_WGMXCC1_WGMXCCGn1
    SolutionIndex: 104
    SolutionNameMin: Cijk_Alik_Bljk_BBS_BH_UserArgs_MT32x64x128_MI16x16x1_SN_LDSB1_CLR1_GSU0_GSUC0_GSUWGMRR0_K1_LBSPPA256_LBSPPB512_MIWT1_2_PLR2_SU32_SUM0_SUS256_VWA1_VWB2_WGM1_WGMXCC1_WGMXCCGn1
    SolutionIndex: 105
    SolutionNameMin: Cijk_Alik_Bljk_BBS_BH_UserArgs_MT32x64x128_MI16x16x1_SN_LDSB1_CLR1_GSU0_GSUC0_GSUWGMRR0_K1_LBSPPA256_LBSPPB512_MIWT1_2_PLR2_SU32_SUM0_SUS256_VWA1_VWB2_WGM8_WGMXCC1_WGMXCCGn1
    SolutionIndex: 106
    SolutionNameMin: Cijk_Alik_Bljk_BBS_BH_UserArgs_MT64x32x128_MI16x16x1_SN_LDSB1_CLR1_GSU0_GSUC0_GSUWGMRR0_K1_LBSPPA256_LBSPPB256_MIWT2_1_PLR1_SU32_SUM0_SUS256_VWA1_VWB1_WGM1_WGMXCC1_WGMXCCGn1
    SolutionIndex: 107
    SolutionNameMin: Cijk_Alik_Bljk_BBS_BH_UserArgs_MT64x32x128_MI16x16x1_SN_LDSB1_CLR1_GSU0_GSUC0_GSUWGMRR0_K1_LBSPPA512_LBSPPB256_MIWT2_1_PLR1_SU32_SUM0_SUS256_VWA2_VWB1_WGM1_WGMXCC1_WGMXCCGn1
    SolutionIndex: 108
    SolutionNameMin: Cijk_Alik_Bljk_BBS_BH_UserArgs_MT64x32x128_MI16x16x1_SN_LDSB1_CLR1_GSU0_GSUC0_GSUWGMRR0_K1_LBSPPA256_LBSPPB256_MIWT2_1_PLR2_SU32_SUM0_SUS256_VWA1_VWB1_WGM1_WGMXCC1_WGMXCCGn1
    SolutionIndex: 109
    SolutionNameMin: Cijk_Alik_Bljk_BBS_BH_UserArgs_MT64x32x128_MI16x16x1_SN_LDSB1_CLR1_GSU0_GSUC0_GSUWGMRR0_K1_LBSPPA512_LBSPPB256_MIWT2_1_PLR2_SU32_SUM0_SUS256_VWA2_VWB1_WGM1_WGMXCC1_WGMXCCGn1
    SolutionIndex: 110
    SolutionNameMin: Cijk_Alik_Bljk_BBS_BH_UserArgs_MT64x32x128_MI16x16x1_SN_LDSB1_CLR1_GSU0_GSUC0_GSUWGMRR0_K1_LBSPPA256_LBSPPB256_MIWT2_1_PLR1_SU32_SUM0_SUS256_VWA1_VWB1_WGM8_WGMXCC1_WGMXCCGn1
    SolutionIndex: 111
    SolutionNameMin: Cijk_Alik_Bljk_BBS_BH_UserArgs_MT64x32x128_MI16x16x1_SN_LDSB1_CLR1_GSU0_GSUC0_GSUWGMRR0_K1_LBSPPA512_LBSPPB256_MIWT2_1_PLR1_SU32_SUM0_SUS256_VWA2_VWB1_WGM8_WGMXCC1_WGMXCCGn1
    SolutionIndex: 112
    SolutionNameMin: Cijk_Alik_Bljk_BBS_BH_UserArgs_MT64x32x128_MI16x16x1_SN_LDSB1_CLR1_GSU0_GSUC0_GSUWGMRR0_K1_LBSPPA256_LBSPPB256_MIWT2_1_PLR2_SU32_SUM0_SUS256_VWA1_VWB1_WGM8_WGMXCC1_WGMXCCGn1
    SolutionIndex: 113
    SolutionNameMin: Cijk_Alik_Bljk_BBS_BH_UserArgs_MT64x32x128_MI16x16x1_SN_LDSB1_CLR1_GSU0_GSUC0_GSUWGMRR0_K1_LBSPPA512_LBSPPB256_MIWT2_1_PLR2_SU32_SUM0_SUS256_VWA2_VWB1_WGM8_WGMXCC1_WGMXCCGn1
    SolutionIndex: 114
    SolutionNameMin: Cijk_Alik_Bljk_BBS_BH_UserArgs_MT32x32x128_MI16x16x1_SN_LDSB1_CLR1_GSU0_GSUC0_GSUWGMRR0_K1_LBSPPA256_LBSPPB256_MIWT1_1_PLR1_SU32_SUM0_SUS256_VWA1_VWB1_WGM1_WGMXCC1_WGMXCCGn1
    SolutionIndex: 115
    SolutionNameMin: Cijk_Alik_Bljk_BBS_BH_UserArgs_MT32x32x128_MI16x16x1_SN_LDSB1_CLR1_GSU0_GSUC0_GSUWGMRR0_K1_LBSPPA256_LBSPPB256_MIWT1_1_PLR2_SU32_SUM0_SUS256_VWA1_VWB1_WGM1_WGMXCC1_WGMXCCGn1
    SolutionIndex: 116
    SolutionNameMin: Cijk_Alik_Bljk_BBS_BH_UserArgs_MT32x32x128_MI16x16x1_SN_LDSB1_CLR1_GSU0_GSUC0_GSUWGMRR0_K1_LBSPPA256_LBSPPB256_MIWT1_1_PLR1_SU32_SUM0_SUS256_VWA1_VWB1_WGM4_WGMXCC1_WGMXCCGn1
    SolutionIndex: 117
    SolutionNameMin: Cijk_Alik_Bljk_BBS_BH_UserArgs_MT32x32x128_MI16x16x1_SN_LDSB1_CLR1_GSU0_GSUC0_GSUWGMRR0_K1_LBSPPA256_LBSPPB256_MIWT1_1_PLR2_SU32_SUM0_SUS256_VWA1_VWB1_WGM4_WGMXCC1_WGMXCCGn1
    SolutionIndex: 118
    SolutionNameMin: Cijk_Alik_Bljk_BBS_BH_UserArgs_MT32x32x128_MI16x16x1_SN_LDSB1_CLR1_GSU0_GSUC0_GSUWGMRR0_K1_LBSPPA256_LBSPPB256_MIWT1_1_PLR1_SU32_SUM0_SUS256_VWA1_VWB1_WGM8_WGMXCC1_WGMXCCGn1
    SolutionIndex: 119
    SolutionNameMin: Cijk_Alik_Bljk_BBS_BH_UserArgs_MT32x32x128_MI16x16x1_SN_LDSB1_CLR1_GSU0_GSUC0_GSUWGMRR0_K1_LBSPPA256_LBSPPB256_MIWT1_1_PLR2_SU32_SUM0_SUS256_VWA1_VWB1_WGM8_WGMXCC1_WGMXCCGn1
    SolutionIndex: 120
    SolutionNameMin: Cijk_Alik_Bljk_BBS_BH_UserArgs_MT32x32x32_MI16x16x1_SN_LDSB0_CLR0_GSU0_GSUC0_GSUWGMRR0_K1_LBSPPA128_LBSPPB128_MIWT1_1_PLR0_SU32_SUM0_SUS256_VWA1_VWB1_WGM8_WGMXCC1_WGMXCCGn1
- - - [128, 128, 1, 128, 128, 128, 128, 128]
    - [113, 0.097]
  - - [128, 128, 1, 256, 128, 128, 256, 256]
    - [96, 0.111]
  - - [128, 128, 1, 512, 128, 128, 512, 512]
    - [114, 0.2]
  - - [128, 128, 1, 1024, 128, 128, 1024, 1024]
    - [115, 0.354]
  - - [128, 128, 1, 2048, 128, 128, 2048, 2048]
    - [114, 0.606]
  - - [128, 128, 1, 4096, 128, 128, 4096, 4096]
    - [88, 0.94]
  - - [128, 128, 1, 8192, 128, 128, 8192, 8192]
    - [114, 1.441]
  - - [128, 256, 1, 128, 128, 128, 128, 128]
    - [97, 0.172]
  - - [128, 256, 1, 256, 128, 128, 256, 256]
    - [114, 0.231]
  - - [128, 256, 1, 512, 128, 128, 512, 512]
    - [114, 0.341]
  - - [128, 256, 1, 1024, 128, 128, 1024, 1024]
    - [115, 0.633]
  - - [128, 256, 1, 2048, 128, 128, 2048, 2048]
    - [116, 1.032]
  - - [128, 256, 1, 4096, 128, 128, 4096, 4096]
    - [92, 1.551]
  - - [128, 256, 1, 8192, 128, 128, 8192, 8192]
    - [103, 2.155]
  - - [128, 512, 1, 128, 128, 128, 128, 128]
    - [99, 0.302]
  - - [128, 512, 1, 256, 128, 128, 256, 256]
    - [114, 0.514]
  - - [128, 512, 1, 512, 128, 128, 512, 512]
    - [115, 0.857]
  - - [128, 512, 1, 1024, 128, 128, 1024, 1024]
    - [114, 1.331]
  - - [128, 512, 1, 2048, 128, 128, 2048, 2048]
    - [103, 1.591]
  - - [128, 512, 1, 4096, 128, 128, 4096, 4096]
    - [79, 2.282]
  - - [128, 512, 1, 8192, 128, 128, 8192, 8192]
    - [79, 2.661]
  - - [128, 1024, 1, 128, 128, 128, 128, 128]
    - [108, 0.577]
  - - [128, 1024, 1, 256, 128, 128, 256, 256]
    - [93, 1.012]
  - - [128, 1024, 1, 512, 128, 128, 512, 512]
    - [94, 1.516]
  - - [128, 1024, 1, 1024, 128, 128, 1024, 1024]
    - [106, 2.071]
  - - [128, 1024, 1, 2048, 128, 128, 2048, 2048]
    - [104, 1.92]
  - - [128, 1024, 1, 4096, 128, 128, 4096, 4096]
    - [71, 3.236]
  - - [128, 1024, 1, 8192, 128, 128, 8192, 8192]
    - [72, 3.292]
  - - [128, 2048, 1, 128, 128, 128, 128, 128]
    - [22, 1.057]
  - - [128, 2048, 1, 256, 128, 128, 256, 256]
    - [85, 1.627]
  - - [128, 2048, 1, 512, 128, 128, 512, 512]
    - [77, 2.518]
  - - [128, 2048, 1, 1024, 128, 128, 1024, 1024]
    - [101, 2.546]
  - - [128, 2048, 1, 2048, 128, 128, 2048, 2048]
    - [72, 2.827]
  - - [128, 2048, 1, 4096, 128, 128, 4096, 4096]
    - [60, 3.647]
  - - [128, 2048, 1, 8192, 128, 128, 8192, 8192]
    - [28, 4.13]
  - - [128, 4096, 1, 128, 128, 128, 128, 128]
    - [49, 1.698]
  - - [128, 4096, 1, 256, 128, 128, 256, 256]
    - [63, 2.417]
  - - [128, 4096, 1, 512, 128, 128, 512, 512]
    - [67, 3.162]
  - - [128, 4096, 1, 1024, 128, 128, 1024, 1024]
    - [109, 2.972]
  - - [128, 4096, 1, 2048, 128, 128, 2048, 2048]
    - [75, 3.516]
  - - [128, 4096, 1, 4096, 128, 128, 4096, 4096]
    - [64, 4.283]
  - - [128, 4096, 1, 8192, 128, 128, 8192, 8192]
    - [59, 4.538]
  - - [128, 8192, 1, 128, 128, 128, 128, 128]
    - [19, 1.917]
  - - [128, 8192, 1, 256, 128, 128, 256, 256]
    - [17, 2.574]
  - - [128, 8192, 1, 512, 128, 128, 512, 512]
    - [26, 3.761]
  - - [128, 8192, 1, 1024, 128, 128, 1024, 1024]
    - [86, 3.984]
  - - [128, 8192, 1, 2048, 128, 128, 2048, 2048]
    - [77, 4.361]
  - - [128, 8192, 1, 4096, 128, 128, 4096, 4096]
    - [73, 4.831]
  - - [128, 8192, 1, 8192, 128, 128, 8192, 8192]
    - [68, 4.983]
  - - [256, 128, 1, 128, 256, 256, 128, 128]
    - [105, 0.164]
  - - [256, 128, 1, 256, 256, 256, 256, 256]
    - [116, 0.251]
  - - [256, 128, 1, 512, 256, 256, 512, 512]
    - [114, 0.348]
  - - [256, 128, 1, 1024, 256, 256, 1024, 1024]
    - [114, 0.613]
  - - [256, 128, 1, 2048, 256, 256, 2048, 2048]
    - [118, 1.02]
  - - [256, 128, 1, 4096, 256, 256, 4096, 4096]
    - [91, 1.526]
  - - [256, 128, 1, 8192, 256, 256, 8192, 8192]
    - [102, 2.135]
  - - [256, 256, 1, 128, 256, 256, 128, 128]
    - [114, 0.36]
  - - [256, 256, 1, 256, 256, 256, 256, 256]
    - [114, 0.551]
  - - [256, 256, 1, 512, 256, 256, 512, 512]
    - [115, 0.912]
  - - [256, 256, 1, 1024, 256, 256, 1024, 1024]
    - [115, 1.307]
  - - [256, 256, 1, 2048, 256, 256, 2048, 2048]
    - [110, 1.593]
  - - [256, 256, 1, 4096, 256, 256, 4096, 4096]
    - [82, 2.388]
  - - [256, 256, 1, 8192, 256, 256, 8192, 8192]
    - [76, 2.663]
  - - [256, 512, 1, 128, 256, 256, 128, 128]
    - [88, 0.612]
  - - [256, 512, 1, 256, 256, 256, 256, 256]
    - [109, 1.028]
  - - [256, 512, 1, 512, 256, 256, 512, 512]
    - [90, 1.536]
  - - [256, 512, 1, 1024, 256, 256, 1024, 1024]
    - [107, 2.077]
  - - [256, 512, 1, 2048, 256, 256, 2048, 2048]
    - [74, 2.051]
  - - [256, 512, 1, 4096, 256, 256, 4096, 4096]
    - [61, 3.402]
  - - [256, 512, 1, 8192, 256, 256, 8192, 8192]
    - [39, 3.533]
  - - [256, 1024, 1, 128, 256, 256, 128, 128]
    - [74, 1.099]
  - - [256, 1024, 1, 256, 256, 256, 256, 256]
    - [75, 1.648]
  - - [256, 1024, 1, 512, 256, 256, 512, 512]
    - [75, 2.525]
  - - [256, 1024, 1, 1024, 256, 256, 1024, 1024]
    - [98, 2.777]
  - - [256, 1024, 1, 2048, 256, 256, 2048, 2048]
    - [64, 2.921]
  - - [256, 1024, 1, 4096, 256, 256, 4096, 4096]
    - [39, 3.576]
  - - [256, 1024, 1, 8192, 256, 256, 8192, 8192]
    - [59, 4.394]
  - - [256, 2048, 1, 128, 256, 256, 128, 128]
    - [54, 1.682]
  - - [256, 2048, 1, 256, 256, 256, 256, 256]
    - [59, 2.595]
  - - [256, 2048, 1, 512, 256, 256, 512, 512]
    - [71, 3.314]
  - - [256, 2048, 1, 1024, 256, 256, 1024, 1024]
    - [59, 2.948]
  - - [256, 2048, 1, 2048, 256, 256, 2048, 2048]
    - [74, 3.658]
  - - [256, 2048, 1, 4096, 256, 256, 4096, 4096]
    - [59, 4.379]
  - - [256, 2048, 1, 8192, 256, 256, 8192, 8192]
    - [26, 5.331]
  - - [256, 4096, 1, 128, 256, 256, 128, 128]
    - [0, 1.917]
  - - [256, 4096, 1, 256, 256, 256, 256, 256]
    - [9, 2.707]
  - - [256, 4096, 1, 512, 256, 256, 512, 512]
    - [27, 3.748]
  - - [256, 4096, 1, 1024, 256, 256, 1024, 1024]
    - [83, 4.392]
  - - [256, 4096, 1, 2048, 256, 256, 2048, 2048]
    - [77, 4.9]
  - - [256, 4096, 1, 4096, 256, 256, 4096, 4096]
    - [69, 4.719]
  - - [256, 4096, 1, 8192, 256, 256, 8192, 8192]
    - [43, 5.205]
  - - [256, 8192, 1, 128, 256, 256, 128, 128]
    - [5, 2.354]
  - - [256, 8192, 1, 256, 256, 256, 256, 256]
    - [13, 3.134]
  - - [256, 8192, 1, 512, 256, 256, 512, 512]
    - [63, 4.447]
  - - [256, 8192, 1, 1024, 256, 256, 1024, 1024]
    - [65, 5.563]
  - - [256, 8192, 1, 2048, 256, 256, 2048, 2048]
    - [61, 6.225]
  - - [256, 8192, 1, 4096, 256, 256, 4096, 4096]
    - [23, 5.065]
  - - [256, 8192, 1, 8192, 256, 256, 8192, 8192]
    - [37, 4.28]
  - - [512, 128, 1, 128, 512, 512, 128, 128]
    - [119, 0.327]
  - - [512, 128, 1, 256, 512, 512, 256, 256]
    - [117, 0.549]
  - - [512, 128, 1, 512, 512, 512, 512, 512]
    - [115, 0.883]
  - - [512, 128, 1, 1024, 512, 512, 1024, 1024]
    - [117, 1.365]
  - - [512, 128, 1, 2048, 512, 512, 2048, 2048]
    - [111, 1.617]
  - - [512, 128, 1, 4096, 512, 512, 4096, 4096]
    - [76, 2.323]
  - - [512, 128, 1, 8192, 512, 512, 8192, 8192]
    - [80, 2.805]
  - - [512, 256, 1, 128, 512, 512, 128, 128]
    - [89, 0.627]
  - - [512, 256, 1, 256, 512, 512, 256, 256]
    - [87, 1.082]
  - - [512, 256, 1, 512, 512, 512, 512, 512]
    - [90, 1.592]
  - - [512, 256, 1, 1024, 512, 512, 1024, 1024]
    - [107, 2.204]
  - - [512, 256, 1, 2048, 512, 512, 2048, 2048]
    - [77, 2.068]
  - - [512, 256, 1, 4096, 512, 512, 4096, 4096]
    - [71, 3.337]
  - - [512, 256, 1, 8192, 512, 512, 8192, 8192]
    - [26, 3.623]
  - - [512, 512, 1, 128, 512, 512, 128, 128]
    - [75, 1.094]
  - - [512, 512, 1, 256, 512, 512, 256, 256]
    - [77, 1.816]
  - - [512, 512, 1, 512, 512, 512, 512, 512]
    - [77, 2.566]
  - - [512, 512, 1, 1024, 512, 512, 1024, 1024]
    - [97, 2.731]
  - - [512, 512, 1, 2048, 512, 512, 2048, 2048]
    - [66, 2.968]
  - - [512, 512, 1, 4096, 512, 512, 4096, 4096]
    - [28, 3.615]
  - - [512, 512, 1, 8192, 512, 512, 8192, 8192]
    - [66, 4.342]
  - - [512, 1024, 1, 128, 512, 512, 128, 128]
    - [58, 1.689]
  - - [512, 1024, 1, 256, 512, 512, 256, 256]
    - [58, 2.594]
  - - [512, 1024, 1, 512, 512, 512, 512, 512]
    - [58, 3.61]
  - - [512, 1024, 1, 1024, 512, 512, 1024, 1024]
    - [59, 3.086]
  - - [512, 1024, 1, 2048, 512, 512, 2048, 2048]
    - [75, 3.954]
  - - [512, 1024, 1, 4096, 512, 512, 4096, 4096]
    - [68, 4.219]
  - - [512, 1024, 1, 8192, 512, 512, 8192, 8192]
    - [38, 4.843]
  - - [512, 2048, 1, 128, 512, 512, 128, 128]
    - [13, 1.943]
  - - [512, 2048, 1, 256, 512, 512, 256, 256]
    - [10, 2.937]
  - - [512, 2048, 1, 512, 512, 512, 512, 512]
    - [25, 3.985]
  - - [512, 2048, 1, 1024, 512, 512, 1024, 1024]
    - [77, 4.625]
  - - [512, 2048, 1, 2048, 512, 512, 2048, 2048]
    - [75, 5.037]
  - - [512, 2048, 1, 4096, 512, 512, 4096, 4096]
    - [48, 4.399]
  - - [512, 2048, 1, 8192, 512, 512, 8192, 8192]
    - [31, 5.741]
  - - [512, 4096, 1, 128, 512, 512, 128, 128]
    - [2, 2.372]
  - - [512, 4096, 1, 256, 512, 512, 256, 256]
    - [68, 3.388]
  - - [512, 4096, 1, 512, 512, 512, 512, 512]
    - [60, 4.862]
  - - [512, 4096, 1, 1024, 512, 512, 1024, 1024]
    - [63, 5.776]
  - - [512, 4096, 1, 2048, 512, 512, 2048, 2048]
    - [60, 6.166]
  - - [512, 4096, 1, 4096, 512, 512, 4096, 4096]
    - [26, 5.179]
  - - [512, 4096, 1, 8192, 512, 512, 8192, 8192]
    - [37, 5.825]
  - - [512, 8192, 1, 128, 512, 512, 128, 128]
    - [9, 3.004]
  - - [512, 8192, 1, 256, 512, 512, 256, 256]
    - [21, 4.148]
  - - [512, 8192, 1, 512, 512, 512, 512, 512]
    - [9, 4.969]
  - - [512, 8192, 1, 1024, 512, 512, 1024, 1024]
    - [25, 6.049]
  - - [512, 8192, 1, 2048, 512, 512, 2048, 2048]
    - [46, 6.663]
  - - [512, 8192, 1, 4096, 512, 512, 4096, 4096]
    - [26, 5.674]
  - - [512, 8192, 1, 8192, 512, 512, 8192, 8192]
    - [47, 4.752]
  - - [1024, 128, 1, 128, 1024, 1024, 128, 128]
    - [95, 0.655]
  - - [1024, 128, 1, 256, 1024, 1024, 256, 256]
    - [94, 1.096]
  - - [1024, 128, 1, 512, 1024, 1024, 512, 512]
    - [88, 1.627]
  - - [1024, 128, 1, 1024, 1024, 1024, 1024, 1024]
    - [106, 2.167]
  - - [1024, 128, 1, 2048, 1024, 1024, 2048, 2048]
    - [85, 1.995]
  - - [1024, 128, 1, 4096, 1024, 1024, 4096, 4096]
    - [55, 3.257]
  - - [1024, 128, 1, 8192, 1024, 1024, 8192, 8192]
    - [36, 3.687]
  - - [1024, 256, 1, 128, 1024, 1024, 128, 128]
    - [74, 1.082]
  - - [1024, 256, 1, 256, 1024, 1024, 256, 256]
    - [85, 1.783]
  - - [1024, 256, 1, 512, 1024, 1024, 512, 512]
    - [80, 2.653]
  - - [1024, 256, 1, 1024, 1024, 1024, 1024, 1024]
    - [98, 2.728]
  - - [1024, 256, 1, 2048, 1024, 1024, 2048, 2048]
    - [64, 2.993]
  - - [1024, 256, 1, 4096, 1024, 1024, 4096, 4096]
    - [71, 3.66]
  - - [1024, 256, 1, 8192, 1024, 1024, 8192, 8192]
    - [36, 4.515]
  - - [1024, 512, 1, 128, 1024, 1024, 128, 128]
    - [67, 1.713]
  - - [1024, 512, 1, 256, 1024, 1024, 256, 256]
    - [61, 2.693]
  - - [1024, 512, 1, 512, 1024, 1024, 512, 512]
    - [70, 3.79]
  - - [1024, 512, 1, 1024, 1024, 1024, 1024, 1024]
    - [112, 3.001]
  - - [1024, 512, 1, 2048, 1024, 1024, 2048, 2048]
    - [85, 3.994]
  - - [1024, 512, 1, 4096, 1024, 1024, 4096, 4096]
    - [68, 4.156]
  - - [1024, 512, 1, 8192, 1024, 1024, 8192, 8192]
    - [41, 5.348]
  - - [1024, 1024, 1, 128, 1024, 1024, 128, 128]
    - [14, 2.023]
  - - [1024, 1024, 1, 256, 1024, 1024, 256, 256]
    - [75, 2.876]
  - - [1024, 1024, 1, 512, 1024, 1024, 512, 512]
    - [67, 4.067]
  - - [1024, 1024, 1, 1024, 1024, 1024, 1024, 1024]
    - [77, 4.706]
  - - [1024, 1024, 1, 2048, 1024, 1024, 2048, 2048]
    - [75, 4.901]
  - - [1024, 1024, 1, 4096, 1024, 1024, 4096, 4096]
    - [97, 4.407]
  - - [1024, 1024, 1, 8192, 1024, 1024, 8192, 8192]
    - [26, 5.629]
  - - [1024, 2048, 1, 128, 1024, 1024, 128, 128]
    - [11, 2.556]
  - - [1024, 2048, 1, 256, 1024, 1024, 256, 256]
    - [59, 3.528]
  - - [1024, 2048, 1, 512, 1024, 1024, 512, 512]
    - [64, 4.838]
  - - [1024, 2048, 1, 1024, 1024, 1024, 1024, 1024]
    - [60, 5.867]
  - - [1024, 2048, 1, 2048, 1024, 1024, 2048, 2048]
    - [59, 5.949]
  - - [1024, 2048, 1, 4096, 1024, 1024, 4096, 4096]
    - [41, 5.333]
  - - [1024, 2048, 1, 8192, 1024, 1024, 8192, 8192]
    - [40, 5.985]
  - - [1024, 4096, 1, 128, 1024, 1024, 128, 128]
    - [15, 3.095]
  - - [1024, 4096, 1, 256, 1024, 1024, 256, 256]
    - [15, 4.23]
  - - [1024, 4096, 1, 512, 1024, 1024, 512, 512]
    - [10, 5.388]
  - - [1024, 4096, 1, 1024, 1024, 1024, 1024, 1024]
    - [27, 5.962]
  - - [1024, 4096, 1, 2048, 1024, 1024, 2048, 2048]
    - [46, 6.64]
  - - [1024, 4096, 1, 4096, 1024, 1024, 4096, 4096]
    - [27, 5.591]
  - - [1024, 4096, 1, 8192, 1024, 1024, 8192, 8192]
    - [36, 6.495]
  - - [1024, 8192, 1, 128, 1024, 1024, 128, 128]
    - [59, 2.407]
  - - [1024, 8192, 1, 256, 1024, 1024, 256, 256]
    - [60, 3.552]
  - - [1024, 8192, 1, 512, 1024, 1024, 512, 512]
    - [60, 4.57]
  - - [1024, 8192, 1, 1024, 1024, 1024, 1024, 1024]
    - [59, 5.296]
  - - [1024, 8192, 1, 2048, 1024, 1024, 2048, 2048]
    - [30, 5.573]
  - - [1024, 8192, 1, 4096, 1024, 1024, 4096, 4096]
    - [32, 6.255]
  - - [1024, 8192, 1, 8192, 1024, 1024, 8192, 8192]
    - [32, 5.956]
  - - [2048, 128, 1, 128, 2048, 2048, 128, 128]
    - [80, 1.073]
  - - [2048, 128, 1, 256, 2048, 2048, 256, 256]
    - [78, 1.716]
  - - [2048, 128, 1, 512, 2048, 2048, 512, 512]
    - [80, 2.538]
  - - [2048, 128, 1, 1024, 2048, 2048, 1024, 1024]
    - [100, 2.511]
  - - [2048, 128, 1, 2048, 2048, 2048, 2048, 2048]
    - [54, 2.815]
  - - [2048, 128, 1, 4096, 2048, 2048, 4096, 4096]
    - [52, 3.455]
  - - [2048, 128, 1, 8192, 2048, 2048, 8192, 8192]
    - [50, 4.507]
  - - [2048, 256, 1, 128, 2048, 2048, 128, 128]
    - [65, 1.737]
  - - [2048, 256, 1, 256, 2048, 2048, 256, 256]
    - [49, 2.615]
  - - [2048, 256, 1, 512, 2048, 2048, 512, 512]
    - [65, 3.427]
  - - [2048, 256, 1, 1024, 2048, 2048, 1024, 1024]
    - [112, 2.861]
  - - [2048, 256, 1, 2048, 2048, 2048, 2048, 2048]
    - [84, 3.917]
  - - [2048, 256, 1, 4096, 2048, 2048, 4096, 4096]
    - [64, 4.226]
  - - [2048, 256, 1, 8192, 2048, 2048, 8192, 8192]
    - [41, 4.659]
  - - [2048, 512, 1, 128, 2048, 2048, 128, 128]
    - [7, 1.977]
  - - [2048, 512, 1, 256, 2048, 2048, 256, 256]
    - [8, 2.971]
  - - [2048, 512, 1, 512, 2048, 2048, 512, 512]
    - [75, 3.978]
  - - [2048, 512, 1, 1024, 2048, 2048, 1024, 1024]
    - [83, 4.535]
  - - [2048, 512, 1, 2048, 2048, 2048, 2048, 2048]
    - [83, 4.693]
  - - [2048, 512, 1, 4096, 2048, 2048, 4096, 4096]
    - [51, 4.742]
  - - [2048, 512, 1, 8192, 2048, 2048, 8192, 8192]
    - [25, 5.526]
  - - [2048, 1024, 1, 128, 2048, 2048, 128, 128]
    - [1, 2.464]
  - - [2048, 1024, 1, 256, 2048, 2048, 256, 256]
    - [60, 3.599]
  - - [2048, 1024, 1, 512, 2048, 2048, 512, 512]
    - [66, 4.784]
  - - [2048, 1024, 1, 1024, 2048, 2048, 1024, 1024]
    - [69, 5.272]
  - - [2048, 1024, 1, 2048, 2048, 2048, 2048, 2048]
    - [71, 5.627]
  - - [2048, 1024, 1, 4096, 2048, 2048, 4096, 4096]
    - [27, 5.307]
  - - [2048, 1024, 1, 8192, 2048, 2048, 8192, 8192]
    - [30, 6.169]
  - - [2048, 2048, 1, 128, 2048, 2048, 128, 128]
    - [10, 3.188]
  - - [2048, 2048, 1, 256, 2048, 2048, 256, 256]
    - [6, 4.208]
  - - [2048, 2048, 1, 512, 2048, 2048, 512, 512]
    - [13, 5.086]
  - - [2048, 2048, 1, 1024, 2048, 2048, 1024, 1024]
    - [45, 5.829]
  - - [2048, 2048, 1, 2048, 2048, 2048, 2048, 2048]
    - [44, 6.582]
  - - [2048, 2048, 1, 4096, 2048, 2048, 4096, 4096]
    - [29, 5.892]
  - - [2048, 2048, 1, 8192, 2048, 2048, 8192, 8192]
    - [27, 6.619]
  - - [2048, 4096, 1, 128, 2048, 2048, 128, 128]
    - [61, 2.409]
  - - [2048, 4096, 1, 256, 2048, 2048, 256, 256]
    - [59, 3.538]
  - - [2048, 4096, 1, 512, 2048, 2048, 512, 512]
    - [59, 4.464]
  - - [2048, 4096, 1, 1024, 2048, 2048, 1024, 1024]
    - [46, 5.028]
  - - [2048, 4096, 1, 2048, 2048, 2048, 2048, 2048]
    - [27, 5.774]
  - - [2048, 4096, 1, 4096, 2048, 2048, 4096, 4096]
    - [24, 6.223]
  - - [2048, 4096, 1, 8192, 2048, 2048, 8192, 8192]
    - [30, 7.283]
  - - [2048, 8192, 1, 128, 2048, 2048, 128, 128]
    - [9, 3.057]
  - - [2048, 8192, 1, 256, 2048, 2048, 256, 256]
    - [8, 3.951]
  - - [2048, 8192, 1, 512, 2048, 2048, 512, 512]
    - [10, 4.838]
  - - [2048, 8192, 1, 1024, 2048, 2048, 1024, 1024]
    - [28, 5.24]
  - - [2048, 8192, 1, 2048, 2048, 2048, 2048, 2048]
    - [46, 5.855]
  - - [2048, 8192, 1, 4096, 2048, 2048, 4096, 4096]
    - [42, 6.214]
  - - [2048, 8192, 1, 8192, 2048, 2048, 8192, 8192]
    - [46, 6.71]
  - - [4096, 128, 1, 128, 4096, 4096, 128, 128]
    - [49, 1.801]
  - - [4096, 128, 1, 256, 4096, 4096, 256, 256]
    - [60, 2.537]
  - - [4096, 128, 1, 512, 4096, 4096, 512, 512]
    - [57, 3.115]
  - - [4096, 128, 1, 1024, 4096, 4096, 1024, 1024]
    - [113, 2.83]
  - - [4096, 128, 1, 2048, 4096, 4096, 2048, 2048]
    - [85, 3.611]
  - - [4096, 128, 1, 4096, 4096, 4096, 4096, 4096]
    - [66, 4.145]
  - - [4096, 128, 1, 8192, 4096, 4096, 8192, 8192]
    - [41, 5.231]
  - - [4096, 256, 1, 128, 4096, 4096, 128, 128]
    - [1, 2.069]
  - - [4096, 256, 1, 256, 4096, 4096, 256, 256]
    - [58, 2.895]
  - - [4096, 256, 1, 512, 4096, 4096, 512, 512]
    - [85, 3.716]
  - - [4096, 256, 1, 1024, 4096, 4096, 1024, 1024]
    - [83, 4.26]
  - - [4096, 256, 1, 2048, 4096, 4096, 2048, 2048]
    - [81, 4.553]
  - - [4096, 256, 1, 4096, 4096, 4096, 4096, 4096]
    - [52, 4.881]
  - - [4096, 256, 1, 8192, 4096, 4096, 8192, 8192]
    - [26, 5.762]
  - - [4096, 512, 1, 128, 4096, 4096, 128, 128]
    - [11, 2.471]
  - - [4096, 512, 1, 256, 4096, 4096, 256, 256]
    - [62, 3.403]
  - - [4096, 512, 1, 512, 4096, 4096, 512, 512]
    - [68, 4.682]
  - - [4096, 512, 1, 1024, 4096, 4096, 1024, 1024]
    - [67, 5.472]
  - - [4096, 512, 1, 2048, 4096, 4096, 2048, 2048]
    - [67, 5.672]
  - - [4096, 512, 1, 4096, 4096, 4096, 4096, 4096]
    - [31, 5.543]
  - - [4096, 512, 1, 8192, 4096, 4096, 8192, 8192]
    - [28, 6.49]
  - - [4096, 1024, 1, 128, 4096, 4096, 128, 128]
    - [3, 3.135]
  - - [4096, 1024, 1, 256, 4096, 4096, 256, 256]
    - [6, 4.159]
  - - [4096, 1024, 1, 512, 4096, 4096, 512, 512]
    - [20, 4.844]
  - - [4096, 1024, 1, 1024, 4096, 4096, 1024, 1024]
    - [42, 5.808]
  - - [4096, 1024, 1, 2048, 4096, 4096, 2048, 2048]
    - [43, 6.686]
  - - [4096, 1024, 1, 4096, 4096, 4096, 4096, 4096]
    - [26, 6.104]
  - - [4096, 1024, 1, 8192, 4096, 4096, 8192, 8192]
    - [29, 6.85]
  - - [4096, 2048, 1, 128, 4096, 4096, 128, 128]
    - [14, 2.39]
  - - [4096, 2048, 1, 256, 4096, 4096, 256, 256]
    - [59, 3.474]
  - - [4096, 2048, 1, 512, 4096, 4096, 512, 512]
    - [7, 4.299]
  - - [4096, 2048, 1, 1024, 4096, 4096, 1024, 1024]
    - [33, 4.929]
  - - [4096, 2048, 1, 2048, 4096, 4096, 2048, 2048]
    - [31, 5.914]
  - - [4096, 2048, 1, 4096, 4096, 4096, 4096, 4096]
    - [27, 6.559]
  - - [4096, 2048, 1, 8192, 4096, 4096, 8192, 8192]
    - [28, 7.517]
  - - [4096, 4096, 1, 128, 4096, 4096, 128, 128]
    - [19, 2.999]
  - - [4096, 4096, 1, 256, 4096, 4096, 256, 256]
    - [17, 3.729]
  - - [4096, 4096, 1, 512, 4096, 4096, 512, 512]
    - [11, 4.488]
  - - [4096, 4096, 1, 1024, 4096, 4096, 1024, 1024]
    - [43, 5.201]
  - - [4096, 4096, 1, 2048, 4096, 4096, 2048, 2048]
    - [40, 5.912]
  - - [4096, 4096, 1, 4096, 4096, 4096, 4096, 4096]
    - [39, 6.759]
  - - [4096, 4096, 1, 8192, 4096, 4096, 8192, 8192]
    - [42, 7.066]
  - - [4096, 8192, 1, 128, 4096, 4096, 128, 128]
    - [12, 3.238]
  - - [4096, 8192, 1, 256, 4096, 4096, 256, 256]
    - [59, 3.998]
  - - [4096, 8192, 1, 512, 4096, 4096, 512, 512]
    - [65, 4.646]
  - - [4096, 8192, 1, 1024, 4096, 4096, 1024, 1024]
    - [40, 5.172]
  - - [4096, 8192, 1, 2048, 4096, 4096, 2048, 2048]
    - [41, 5.432]
  - - [4096, 8192, 1, 4096, 4096, 4096, 4096, 4096]
    - [34, 6.494]
  - - [4096, 8192, 1, 8192, 4096, 4096, 8192, 8192]
    - [34, 6.206]
  - - [8192, 128, 1, 128, 8192, 8192, 128, 128]
    - [14, 1.949]
  - - [8192, 128, 1, 256, 8192, 8192, 256, 256]
    - [67, 2.57]
  - - [8192, 128, 1, 512, 8192, 8192, 512, 512]
    - [49, 3.539]
  - - [8192, 128, 1, 1024, 8192, 8192, 1024, 1024]
    - [85, 3.993]
  - - [8192, 128, 1, 2048, 8192, 8192, 2048, 2048]
    - [80, 4.277]
  - - [8192, 128, 1, 4096, 8192, 8192, 4096, 4096]
    - [52, 5.047]
  - - [8192, 128, 1, 8192, 8192, 8192, 8192, 8192]
    - [56, 5.669]
  - - [8192, 256, 1, 128, 8192, 8192, 128, 128]
    - [2, 2.482]
  - - [8192, 256, 1, 256, 8192, 8192, 256, 256]
    - [68, 3.239]
  - - [8192, 256, 1, 512, 8192, 8192, 512, 512]
    - [70, 4.57]
  - - [8192, 256, 1, 1024, 8192, 8192, 1024, 1024]
    - [55, 5.339]
  - - [8192, 256, 1, 2048, 8192, 8192, 2048, 2048]
    - [53, 5.387]
  - - [8192, 256, 1, 4096, 8192, 8192, 4096, 4096]
    - [49, 5.722]
  - - [8192, 256, 1, 8192, 8192, 8192, 8192, 8192]
    - [31, 6.505]
  - - [8192, 512, 1, 128, 8192, 8192, 128, 128]
    - [4, 3.147]
  - - [8192, 512, 1, 256, 8192, 8192, 256, 256]
    - [18, 3.848]
  - - [8192, 512, 1, 512, 8192, 8192, 512, 512]
    - [16, 4.772]
  - - [8192, 512, 1, 1024, 8192, 8192, 1024, 1024]
    - [33, 5.547]
  - - [8192, 512, 1, 2048, 8192, 8192, 2048, 2048]
    - [35, 6.329]
  - - [8192, 512, 1, 4096, 8192, 8192, 4096, 4096]
    - [26, 6.15]
  - - [8192, 512, 1, 8192, 8192, 8192, 8192, 8192]
    - [32, 6.594]
  - - [8192, 1024, 1, 128, 8192, 8192, 128, 128]
    - [19, 2.392]
  - - [8192, 1024, 1, 256, 8192, 8192, 256, 256]
    - [68, 3.441]
  - - [8192, 1024, 1, 512, 8192, 8192, 512, 512]
    - [71, 4.3]
  - - [8192, 1024, 1, 1024, 8192, 8192, 1024, 1024]
    - [43, 5.002]
  - - [8192, 1024, 1, 2048, 8192, 8192, 2048, 2048]
    - [27, 5.79]
  - - [8192, 1024, 1, 4096, 8192, 8192, 4096, 4096]
    - [28, 6.76]
  - - [8192, 1024, 1, 8192, 8192, 8192, 8192, 8192]
    - [45, 6.851]
  - - [8192, 2048, 1, 128, 8192, 8192, 128, 128]
    - [9, 2.975]
  - - [8192, 2048, 1, 256, 8192, 8192, 256, 256]
    - [16, 3.779]
  - - [8192, 2048, 1, 512, 8192, 8192, 512, 512]
    - [12, 4.547]
  - - [8192, 2048, 1, 1024, 8192, 8192, 1024, 1024]
    - [46, 5.265]
  - - [8192, 2048, 1, 2048, 8192, 8192, 2048, 2048]
    - [46, 5.921]
  - - [8192, 2048, 1, 4096, 8192, 8192, 4096, 4096]
    - [43, 6.529]
  - - [8192, 2048, 1, 8192, 8192, 8192, 8192, 8192]
    - [33, 7.443]
  - - [8192, 4096, 1, 128, 8192, 8192, 128, 128]
    - [7, 3.265]
  - - [8192, 4096, 1, 256, 8192, 8192, 256, 256]
    - [19, 3.947]
  - - [8192, 4096, 1, 512, 8192, 8192, 512, 512]
    - [67, 4.541]
  - - [8192, 4096, 1, 1024, 8192, 8192, 1024, 1024]
    - [46, 5.296]
  - - [8192, 4096, 1, 2048, 8192, 8192, 2048, 2048]
    - [41, 5.787]
  - - [8192, 4096, 1, 4096, 8192, 8192, 4096, 4096]
    - [37, 6.764]
  - - [8192, 4096, 1, 8192, 8192, 8192, 8192, 8192]
    - [43, 7.048]
  - - [8192, 8192, 1, 128, 8192, 8192, 128, 128]
    - [5, 3.154]
  - - [8192, 8192, 1, 256, 8192, 8192, 256, 256]
    - [71, 3.641]
  - - [8192, 8192, 1, 512, 8192, 8192, 512, 512]
    - [43, 4.334]
  - - [8192, 8192, 1, 1024, 8192, 8192, 1024, 1024]
    - [41, 5.111]
  - - [8192, 8192, 1, 2048, 8192, 8192, 2048, 2048]
    - [40, 5.49]
  - - [8192, 8192, 1, 4096, 8192, 8192, 4096, 4096]
    - [42, 5.485]
  - - [8192, 8192, 1, 8192, 8192, 8192, 8192, 8192]
    - [28, 6.203]
  - - [1, 1, 1, 32, 1, 1, 32, 32]
    - [120, 0.0]
- null
- null
- DeviceEfficiency
- GridBased
