library/src/amd_detail/rocblaslt/src/Tensile/Logic/streamk/gfx942_38cu/aquavanjaram942_Cijk_Alik_Bljk_BSS_BH_UserArgs.yaml
- {MinimumRequiredVersion: 4.33.0}
- aquavanjaram942
- {Architecture: gfx942, CUCount: 38}
- [Device 0049, Device 0050]
    SolutionIndex: 0
    SolutionNameMin: Cijk_Alik_Bljk_BSS_BH_UserArgs_MT256x64x32_MI16x16x1_SN_LDSB1_CLR1_GSU0_GSUC0_GSUWGMRR0_K1_LBSPPA256_LBSPPB128_MIWT8_2_PLR1_SU32_SUM0_SUS256_VWA4_VWB1_WGM8_WGMXCC1_WGMXCCGn1
    SolutionIndex: 1
    SolutionNameMin: Cijk_Alik_Bljk_BSS_BH_UserArgs_MT128x128x32_MI16x16x1_SN_LDSB1_CLR1_GSU0_GSUC0_GSUWGMRR0_K1_LBSPPA128_LBSPPB128_MIWT4_4_PLR1_SU32_SUM0_SUS256_VWA1_VWB1_WGM1_WGMXCC1_WGMXCCGn1
    SolutionIndex: 2
    SolutionNameMin: Cijk_Alik_Bljk_BSS_BH_UserArgs_MT128x128x32_MI16x16x1_SN_LDSB1_CLR1_GSU0_GSUC0_GSUWGMRR0_K1_LBSPPA256_LBSPPB128_MIWT4_4_PLR1_SU32_SUM0_SUS256_VWA4_VWB1_WGM1_WGMXCC1_WGMXCCGn1
    SolutionIndex: 3
    SolutionNameMin: Cijk_Alik_Bljk_BSS_BH_UserArgs_MT128x128x32_MI16x16x1_SN_LDSB1_CLR1_GSU0_GSUC0_GSUWGMRR0_K1_LBSPPA128_LBSPPB128_MIWT4_4_PLR1_SU32_SUM0_SUS256_VWA1_VWB2_WGM1_WGMXCC1_WGMXCCGn1
    SolutionIndex: 4
    SolutionNameMin: Cijk_Alik_Bljk_BSS_BH_UserArgs_MT128x128x32_MI16x16x1_SN_LDSB1_CLR1_GSU0_GSUC0_GSUWGMRR0_K1_LBSPPA256_LBSPPB128_MIWT4_4_PLR1_SU32_SUM0_SUS256_VWA4_VWB2_WGM1_WGMXCC1_WGMXCCGn1
    SolutionIndex: 5
    SolutionNameMin: Cijk_Alik_Bljk_BSS_BH_UserArgs_MT128x128x32_MI16x16x1_SN_LDSB1_CLR1_GSU0_GSUC0_GSUWGMRR0_K1_LBSPPA128_LBSPPB256_MIWT4_4_PLR1_SU32_SUM0_SUS256_VWA1_VWB4_WGM1_WGMXCC1_WGMXCCGn1
    SolutionIndex: 6
    SolutionNameMin: Cijk_Alik_Bljk_BSS_BH_UserArgs_MT128x128x32_MI16x16x1_SN_LDSB1_CLR1_GSU0_GSUC0_GSUWGMRR0_K1_LBSPPA256_LBSPPB256_MIWT4_4_PLR1_SU32_SUM0_SUS256_VWA4_VWB4_WGM1_WGMXCC1_WGMXCCGn1
    SolutionIndex: 7
    SolutionNameMin: Cijk_Alik_Bljk_BSS_BH_UserArgs_MT128x128x32_MI16x16x1_SN_LDSB1_CLR1_GSU0_GSUC0_GSUWGMRR0_K1_LBSPPA128_LBSPPB128_MIWT4_4_PLR1_SU32_SUM0_SUS256_VWA1_VWB1_WGM4_WGMXCC1_WGMXCCGn1
    SolutionIndex: 8
    SolutionNameMin: Cijk_Alik_Bljk_BSS_BH_UserArgs_MT128x128x32_MI16x16x1_SN_LDSB1_CLR1_GSU0_GSUC0_GSUWGMRR0_K1_LBSPPA128_LBSPPB128_MIWT4_4_PLR1_SU32_SUM0_SUS256_VWA1_VWB2_WGM4_WGMXCC1_WGMXCCGn1
    SolutionIndex: 9
    SolutionNameMin: Cijk_Alik_Bljk_BSS_BH_UserArgs_MT128x128x32_MI16x16x1_SN_LDSB1_CLR1_GSU0_GSUC0_GSUWGMRR0_K1_LBSPPA128_LBSPPB128_MIWT4_4_PLR1_SU32_SUM0_SUS256_VWA2_VWB2_WGM4_WGMXCC1_WGMXCCGn1
    SolutionIndex: 10
    SolutionNameMin: Cijk_Alik_Bljk_BSS_BH_UserArgs_MT128x128x32_MI16x16x1_SN_LDSB1_CLR1_GSU0_GSUC0_GSUWGMRR0_K1_LBSPPA256_LBSPPB128_MIWT4_4_PLR1_SU32_SUM0_SUS256_VWA4_VWB2_WGM4_WGMXCC1_WGMXCCGn1
    SolutionIndex: 11
    SolutionNameMin: Cijk_Alik_Bljk_BSS_BH_UserArgs_MT128x128x32_MI16x16x1_SN_LDSB1_CLR1_GSU0_GSUC0_GSUWGMRR0_K1_LBSPPA128_LBSPPB256_MIWT4_4_PLR1_SU32_SUM0_SUS256_VWA1_VWB4_WGM4_WGMXCC1_WGMXCCGn1
    SolutionIndex: 12
    SolutionNameMin: Cijk_Alik_Bljk_BSS_BH_UserArgs_MT128x128x32_MI16x16x1_SN_LDSB1_CLR1_GSU0_GSUC0_GSUWGMRR0_K1_LBSPPA256_LBSPPB256_MIWT4_4_PLR1_SU32_SUM0_SUS256_VWA4_VWB4_WGM4_WGMXCC1_WGMXCCGn1
    SolutionIndex: 13
    SolutionNameMin: Cijk_Alik_Bljk_BSS_BH_UserArgs_MT128x128x32_MI16x16x1_SN_LDSB1_CLR1_GSU0_GSUC0_GSUWGMRR0_K1_LBSPPA128_LBSPPB128_MIWT4_4_PLR1_SU32_SUM0_SUS256_VWA1_VWB1_WGM8_WGMXCC1_WGMXCCGn1
    SolutionIndex: 14
    SolutionNameMin: Cijk_Alik_Bljk_BSS_BH_UserArgs_MT128x128x32_MI16x16x1_SN_LDSB1_CLR1_GSU0_GSUC0_GSUWGMRR0_K1_LBSPPA256_LBSPPB128_MIWT4_4_PLR1_SU32_SUM0_SUS256_VWA4_VWB1_WGM8_WGMXCC1_WGMXCCGn1
    SolutionIndex: 15
    SolutionNameMin: Cijk_Alik_Bljk_BSS_BH_UserArgs_MT128x128x32_MI16x16x1_SN_LDSB1_CLR1_GSU0_GSUC0_GSUWGMRR0_K1_LBSPPA128_LBSPPB128_MIWT4_4_PLR1_SU32_SUM0_SUS256_VWA1_VWB2_WGM8_WGMXCC1_WGMXCCGn1
    SolutionIndex: 16
    SolutionNameMin: Cijk_Alik_Bljk_BSS_BH_UserArgs_MT128x128x32_MI16x16x1_SN_LDSB1_CLR1_GSU0_GSUC0_GSUWGMRR0_K1_LBSPPA128_LBSPPB128_MIWT4_4_PLR1_SU32_SUM0_SUS256_VWA2_VWB2_WGM8_WGMXCC1_WGMXCCGn1
    SolutionIndex: 17
    SolutionNameMin: Cijk_Alik_Bljk_BSS_BH_UserArgs_MT128x128x32_MI16x16x1_SN_LDSB1_CLR1_GSU0_GSUC0_GSUWGMRR0_K1_LBSPPA256_LBSPPB128_MIWT4_4_PLR1_SU32_SUM0_SUS256_VWA4_VWB2_WGM8_WGMXCC1_WGMXCCGn1
    SolutionIndex: 18
    SolutionNameMin: Cijk_Alik_Bljk_BSS_BH_UserArgs_MT128x128x32_MI16x16x1_SN_LDSB1_CLR1_GSU0_GSUC0_GSUWGMRR0_K1_LBSPPA128_LBSPPB256_MIWT4_4_PLR1_SU32_SUM0_SUS256_VWA1_VWB4_WGM8_WGMXCC1_WGMXCCGn1
    SolutionIndex: 19
    SolutionNameMin: Cijk_Alik_Bljk_BSS_BH_UserArgs_MT128x64x32_MI16x16x1_SN_LDSB0_CLR0_GSU0_GSUC0_GSUWGMRR0_K1_LBSPPA256_LBSPPB128_MIWT4_2_PLR0_SU32_SUM0_SUS256_VWA4_VWB2_WGM1_WGMXCC1_WGMXCCGn1
    SolutionIndex: 20
    SolutionNameMin: Cijk_Alik_Bljk_BSS_BH_UserArgs_MT32x32x32_MI16x16x1_SN_LDSB0_CLR1_GSU0_GSUC0_GSUWGMRR0_K1_LBSPPA128_LBSPPB128_MIWT1_1_PLR1_SU32_SUM0_SUS256_VWA1_VWB1_WGM1_WGMXCC1_WGMXCCGn1
    SolutionIndex: 21
    SolutionNameMin: Cijk_Alik_Bljk_BSS_BH_UserArgs_MT64x256x64_MI16x16x1_SN_LDSB1_CLR1_GSU0_GSUC0_GSUWGMRR0_K1_LBSPPA256_LBSPPB128_MIWT2_8_PLR1_SU32_SUM0_SUS256_VWA2_VWB1_WGM1_WGMXCC1_WGMXCCGn1
    SolutionIndex: 22
    SolutionNameMin: Cijk_Alik_Bljk_BSS_BH_UserArgs_MT128x128x64_MI16x16x1_SN_LDSB1_CLR1_GSU0_GSUC0_GSUWGMRR0_K1_LBSPPA128_LBSPPB128_MIWT4_4_PLR1_SU32_SUM0_SUS256_VWA1_VWB1_WGM1_WGMXCC1_WGMXCCGn1
    SolutionIndex: 23
    SolutionNameMin: Cijk_Alik_Bljk_BSS_BH_UserArgs_MT128x128x64_MI16x16x1_SN_LDSB1_CLR1_GSU0_GSUC0_GSUWGMRR0_K1_LBSPPA256_LBSPPB128_MIWT4_4_PLR1_SU32_SUM0_SUS256_VWA2_VWB1_WGM1_WGMXCC1_WGMXCCGn1
    SolutionIndex: 24
    SolutionNameMin: Cijk_Alik_Bljk_BSS_BH_UserArgs_MT128x128x64_MI16x16x1_SN_LDSB1_CLR1_GSU0_GSUC0_GSUWGMRR0_K1_LBSPPA512_LBSPPB128_MIWT4_4_PLR1_SU32_SUM0_SUS256_VWA4_VWB1_WGM1_WGMXCC1_WGMXCCGn1
    SolutionIndex: 25
    SolutionNameMin: Cijk_Alik_Bljk_BSS_BH_UserArgs_MT128x128x64_MI16x16x1_SN_LDSB1_CLR1_GSU0_GSUC0_GSUWGMRR0_K1_LBSPPA128_LBSPPB256_MIWT4_4_PLR1_SU32_SUM0_SUS256_VWA1_VWB2_WGM1_WGMXCC1_WGMXCCGn1
    SolutionIndex: 26
    SolutionNameMin: Cijk_Alik_Bljk_BSS_BH_UserArgs_MT128x128x64_MI16x16x1_SN_LDSB1_CLR1_GSU0_GSUC0_GSUWGMRR0_K1_LBSPPA256_LBSPPB256_MIWT4_4_PLR1_SU32_SUM0_SUS256_VWA2_VWB2_WGM1_WGMXCC1_WGMXCCGn1
    SolutionIndex: 27
    SolutionNameMin: Cijk_Alik_Bljk_BSS_BH_UserArgs_MT128x128x64_MI16x16x1_SN_LDSB1_CLR1_GSU0_GSUC0_GSUWGMRR0_K1_LBSPPA512_LBSPPB256_MIWT4_4_PLR1_SU32_SUM0_SUS256_VWA4_VWB2_WGM1_WGMXCC1_WGMXCCGn1
    SolutionIndex: 28
    SolutionNameMin: Cijk_Alik_Bljk_BSS_BH_UserArgs_MT128x128x64_MI16x16x1_SN_LDSB1_CLR1_GSU0_GSUC0_GSUWGMRR0_K1_LBSPPA128_LBSPPB512_MIWT4_4_PLR1_SU32_SUM0_SUS256_VWA1_VWB4_WGM1_WGMXCC1_WGMXCCGn1
    SolutionIndex: 29
    SolutionNameMin: Cijk_Alik_Bljk_BSS_BH_UserArgs_MT128x128x64_MI16x16x1_SN_LDSB1_CLR1_GSU0_GSUC0_GSUWGMRR0_K1_LBSPPA256_LBSPPB512_MIWT4_4_PLR1_SU32_SUM0_SUS256_VWA2_VWB4_WGM1_WGMXCC1_WGMXCCGn1
    SolutionIndex: 30
    SolutionNameMin: Cijk_Alik_Bljk_BSS_BH_UserArgs_MT128x128x64_MI16x16x1_SN_LDSB1_CLR1_GSU0_GSUC0_GSUWGMRR0_K1_LBSPPA512_LBSPPB512_MIWT4_4_PLR1_SU32_SUM0_SUS256_VWA4_VWB4_WGM1_WGMXCC1_WGMXCCGn1
    SolutionIndex: 31
    SolutionNameMin: Cijk_Alik_Bljk_BSS_BH_UserArgs_MT128x128x64_MI16x16x1_SN_LDSB1_CLR1_GSU0_GSUC0_GSUWGMRR0_K1_LBSPPA128_LBSPPB128_MIWT4_4_PLR1_SU32_SUM0_SUS256_VWA1_VWB1_WGM4_WGMXCC1_WGMXCCGn1
    SolutionIndex: 32
    SolutionNameMin: Cijk_Alik_Bljk_BSS_BH_UserArgs_MT128x128x64_MI16x16x1_SN_LDSB1_CLR1_GSU0_GSUC0_GSUWGMRR0_K1_LBSPPA512_LBSPPB128_MIWT4_4_PLR1_SU32_SUM0_SUS256_VWA4_VWB1_WGM4_WGMXCC1_WGMXCCGn1
    SolutionIndex: 33
    SolutionNameMin: Cijk_Alik_Bljk_BSS_BH_UserArgs_MT128x128x64_MI16x16x1_SN_LDSB1_CLR1_GSU0_GSUC0_GSUWGMRR0_K1_LBSPPA128_LBSPPB256_MIWT4_4_PLR1_SU32_SUM0_SUS256_VWA1_VWB2_WGM4_WGMXCC1_WGMXCCGn1
    SolutionIndex: 34
    SolutionNameMin: Cijk_Alik_Bljk_BSS_BH_UserArgs_MT128x128x64_MI16x16x1_SN_LDSB1_CLR1_GSU0_GSUC0_GSUWGMRR0_K1_LBSPPA256_LBSPPB256_MIWT4_4_PLR1_SU32_SUM0_SUS256_VWA2_VWB2_WGM4_WGMXCC1_WGMXCCGn1
    SolutionIndex: 35
    SolutionNameMin: Cijk_Alik_Bljk_BSS_BH_UserArgs_MT128x128x64_MI16x16x1_SN_LDSB1_CLR1_GSU0_GSUC0_GSUWGMRR0_K1_LBSPPA512_LBSPPB256_MIWT4_4_PLR1_SU32_SUM0_SUS256_VWA4_VWB2_WGM4_WGMXCC1_WGMXCCGn1
    SolutionIndex: 36
    SolutionNameMin: Cijk_Alik_Bljk_BSS_BH_UserArgs_MT128x128x64_MI16x16x1_SN_LDSB1_CLR1_GSU0_GSUC0_GSUWGMRR0_K1_LBSPPA512_LBSPPB512_MIWT4_4_PLR1_SU32_SUM0_SUS256_VWA4_VWB4_WGM4_WGMXCC1_WGMXCCGn1
    SolutionIndex: 37
    SolutionNameMin: Cijk_Alik_Bljk_BSS_BH_UserArgs_MT128x128x64_MI16x16x1_SN_LDSB1_CLR1_GSU0_GSUC0_GSUWGMRR0_K1_LBSPPA128_LBSPPB128_MIWT4_4_PLR1_SU32_SUM0_SUS256_VWA1_VWB1_WGM8_WGMXCC1_WGMXCCGn1
    SolutionIndex: 38
    SolutionNameMin: Cijk_Alik_Bljk_BSS_BH_UserArgs_MT128x128x64_MI16x16x1_SN_LDSB1_CLR1_GSU0_GSUC0_GSUWGMRR0_K1_LBSPPA512_LBSPPB128_MIWT4_4_PLR1_SU32_SUM0_SUS256_VWA4_VWB1_WGM8_WGMXCC1_WGMXCCGn1
    SolutionIndex: 39
    SolutionNameMin: Cijk_Alik_Bljk_BSS_BH_UserArgs_MT128x128x64_MI16x16x1_SN_LDSB1_CLR1_GSU0_GSUC0_GSUWGMRR0_K1_LBSPPA128_LBSPPB256_MIWT4_4_PLR1_SU32_SUM0_SUS256_VWA1_VWB2_WGM8_WGMXCC1_WGMXCCGn1
    SolutionIndex: 40
    SolutionNameMin: Cijk_Alik_Bljk_BSS_BH_UserArgs_MT128x128x64_MI16x16x1_SN_LDSB1_CLR1_GSU0_GSUC0_GSUWGMRR0_K1_LBSPPA512_LBSPPB256_MIWT4_4_PLR1_SU32_SUM0_SUS256_VWA4_VWB2_WGM8_WGMXCC1_WGMXCCGn1
    SolutionIndex: 41
    SolutionNameMin: Cijk_Alik_Bljk_BSS_BH_UserArgs_MT128x128x64_MI16x16x1_SN_LDSB1_CLR1_GSU0_GSUC0_GSUWGMRR0_K1_LBSPPA128_LBSPPB512_MIWT4_4_PLR1_SU32_SUM0_SUS256_VWA1_VWB4_WGM8_WGMXCC1_WGMXCCGn1
    SolutionIndex: 42
    SolutionNameMin: Cijk_Alik_Bljk_BSS_BH_UserArgs_MT128x128x64_MI16x16x1_SN_LDSB1_CLR1_GSU0_GSUC0_GSUWGMRR0_K1_LBSPPA256_LBSPPB512_MIWT4_4_PLR1_SU32_SUM0_SUS256_VWA2_VWB4_WGM8_WGMXCC1_WGMXCCGn1
    SolutionIndex: 43
    SolutionNameMin: Cijk_Alik_Bljk_BSS_BH_UserArgs_MT128x128x64_MI16x16x1_SN_LDSB1_CLR1_GSU0_GSUC0_GSUWGMRR0_K1_LBSPPA512_LBSPPB512_MIWT4_4_PLR1_SU32_SUM0_SUS256_VWA4_VWB4_WGM8_WGMXCC1_WGMXCCGn1
    SolutionIndex: 44
    SolutionNameMin: Cijk_Alik_Bljk_BSS_BH_UserArgs_MT128x128x64_MI16x16x1_SN_LDSB1_CLR1_GSU0_GSUC0_GSUWGMRR0_K1_LBSPPA128_LBSPPB128_MIWT4_4_PLR2_SU32_SUM0_SUS256_VWA1_VWB1_WGM8_WGMXCC1_WGMXCCGn1
    SolutionIndex: 45
    SolutionNameMin: Cijk_Alik_Bljk_BSS_BH_UserArgs_MT128x128x64_MI16x16x1_SN_LDSB1_CLR1_GSU0_GSUC0_GSUWGMRR0_K1_LBSPPA512_LBSPPB512_MIWT4_4_PLR2_SU32_SUM0_SUS256_VWA4_VWB4_WGM8_WGMXCC1_WGMXCCGn1
    SolutionIndex: 46
    SolutionNameMin: Cijk_Alik_Bljk_BSS_BH_UserArgs_MT64x128x64_MI16x16x1_SN_LDSB1_CLR1_GSU0_GSUC0_GSUWGMRR0_K1_LBSPPA128_LBSPPB128_MIWT2_4_PLR1_SU32_SUM0_SUS256_VWA1_VWB1_WGM1_WGMXCC1_WGMXCCGn1
    SolutionIndex: 47
    SolutionNameMin: Cijk_Alik_Bljk_BSS_BH_UserArgs_MT64x128x64_MI16x16x1_SN_LDSB1_CLR1_GSU0_GSUC0_GSUWGMRR0_K1_LBSPPA256_LBSPPB128_MIWT2_4_PLR1_SU32_SUM0_SUS256_VWA2_VWB1_WGM1_WGMXCC1_WGMXCCGn1
    SolutionIndex: 48
    SolutionNameMin: Cijk_Alik_Bljk_BSS_BH_UserArgs_MT64x128x64_MI16x16x1_SN_LDSB1_CLR1_GSU0_GSUC0_GSUWGMRR0_K1_LBSPPA128_LBSPPB256_MIWT2_4_PLR1_SU32_SUM0_SUS256_VWA1_VWB2_WGM1_WGMXCC1_WGMXCCGn1
    SolutionIndex: 49
    SolutionNameMin: Cijk_Alik_Bljk_BSS_BH_UserArgs_MT64x128x64_MI16x16x1_SN_LDSB1_CLR1_GSU0_GSUC0_GSUWGMRR0_K1_LBSPPA128_LBSPPB512_MIWT2_4_PLR1_SU32_SUM0_SUS256_VWA1_VWB4_WGM1_WGMXCC1_WGMXCCGn1
    SolutionIndex: 50
    SolutionNameMin: Cijk_Alik_Bljk_BSS_BH_UserArgs_MT64x128x64_MI16x16x1_SN_LDSB1_CLR1_GSU0_GSUC0_GSUWGMRR0_K1_LBSPPA128_LBSPPB128_MIWT2_4_PLR1_SU32_SUM0_SUS256_VWA1_VWB1_WGM4_WGMXCC1_WGMXCCGn1
    SolutionIndex: 51
    SolutionNameMin: Cijk_Alik_Bljk_BSS_BH_UserArgs_MT64x128x64_MI16x16x1_SN_LDSB1_CLR1_GSU0_GSUC0_GSUWGMRR0_K1_LBSPPA128_LBSPPB512_MIWT2_4_PLR1_SU32_SUM0_SUS256_VWA1_VWB4_WGM4_WGMXCC1_WGMXCCGn1
    SolutionIndex: 52
    SolutionNameMin: Cijk_Alik_Bljk_BSS_BH_UserArgs_MT64x128x64_MI16x16x1_SN_LDSB1_CLR1_GSU0_GSUC0_GSUWGMRR0_K1_LBSPPA128_LBSPPB128_MIWT2_4_PLR1_SU32_SUM0_SUS256_VWA1_VWB1_WGM8_WGMXCC1_WGMXCCGn1
    SolutionIndex: 53
    SolutionNameMin: Cijk_Alik_Bljk_BSS_BH_UserArgs_MT64x128x64_MI16x16x1_SN_LDSB1_CLR1_GSU0_GSUC0_GSUWGMRR0_K1_LBSPPA256_LBSPPB256_MIWT2_4_PLR1_SU32_SUM0_SUS256_VWA2_VWB2_WGM8_WGMXCC1_WGMXCCGn1
    SolutionIndex: 54
    SolutionNameMin: Cijk_Alik_Bljk_BSS_BH_UserArgs_MT128x64x64_MI16x16x1_SN_LDSB1_CLR1_GSU0_GSUC0_GSUWGMRR0_K1_LBSPPA128_LBSPPB128_MIWT4_2_PLR1_SU32_SUM0_SUS256_VWA1_VWB1_WGM1_WGMXCC1_WGMXCCGn1
    SolutionIndex: 55
    SolutionNameMin: Cijk_Alik_Bljk_BSS_BH_UserArgs_MT128x64x64_MI16x16x1_SN_LDSB1_CLR1_GSU0_GSUC0_GSUWGMRR0_K1_LBSPPA256_LBSPPB128_MIWT4_2_PLR1_SU32_SUM0_SUS256_VWA2_VWB1_WGM1_WGMXCC1_WGMXCCGn1
    SolutionIndex: 56
    SolutionNameMin: Cijk_Alik_Bljk_BSS_BH_UserArgs_MT128x64x64_MI16x16x1_SN_LDSB1_CLR1_GSU0_GSUC0_GSUWGMRR0_K1_LBSPPA512_LBSPPB128_MIWT4_2_PLR1_SU32_SUM0_SUS256_VWA4_VWB1_WGM1_WGMXCC1_WGMXCCGn1
    SolutionIndex: 57
    SolutionNameMin: Cijk_Alik_Bljk_BSS_BH_UserArgs_MT128x64x64_MI16x16x1_SN_LDSB1_CLR1_GSU0_GSUC0_GSUWGMRR0_K1_LBSPPA128_LBSPPB256_MIWT4_2_PLR1_SU32_SUM0_SUS256_VWA1_VWB2_WGM1_WGMXCC1_WGMXCCGn1
    SolutionIndex: 58
    SolutionNameMin: Cijk_Alik_Bljk_BSS_BH_UserArgs_MT128x64x64_MI16x16x1_SN_LDSB1_CLR1_GSU0_GSUC0_GSUWGMRR0_K1_LBSPPA256_LBSPPB256_MIWT4_2_PLR1_SU32_SUM0_SUS256_VWA2_VWB2_WGM1_WGMXCC1_WGMXCCGn1
    SolutionIndex: 59
    SolutionNameMin: Cijk_Alik_Bljk_BSS_BH_UserArgs_MT128x64x64_MI16x16x1_SN_LDSB1_CLR1_GSU0_GSUC0_GSUWGMRR0_K1_LBSPPA512_LBSPPB256_MIWT4_2_PLR1_SU32_SUM0_SUS256_VWA4_VWB2_WGM1_WGMXCC1_WGMXCCGn1
    SolutionIndex: 60
    SolutionNameMin: Cijk_Alik_Bljk_BSS_BH_UserArgs_MT128x64x64_MI16x16x1_SN_LDSB1_CLR1_GSU0_GSUC0_GSUWGMRR0_K1_LBSPPA512_LBSPPB128_MIWT4_2_PLR2_SU32_SUM0_SUS256_VWA4_VWB1_WGM1_WGMXCC1_WGMXCCGn1
    SolutionIndex: 61
    SolutionNameMin: Cijk_Alik_Bljk_BSS_BH_UserArgs_MT128x64x64_MI16x16x1_SN_LDSB1_CLR1_GSU0_GSUC0_GSUWGMRR0_K1_LBSPPA128_LBSPPB256_MIWT4_2_PLR2_SU32_SUM0_SUS256_VWA1_VWB2_WGM1_WGMXCC1_WGMXCCGn1
    SolutionIndex: 62
    SolutionNameMin: Cijk_Alik_Bljk_BSS_BH_UserArgs_MT128x64x64_MI16x16x1_SN_LDSB1_CLR1_GSU0_GSUC0_GSUWGMRR0_K1_LBSPPA512_LBSPPB256_MIWT4_2_PLR2_SU32_SUM0_SUS256_VWA4_VWB2_WGM1_WGMXCC1_WGMXCCGn1
    SolutionIndex: 63
    SolutionNameMin: Cijk_Alik_Bljk_BSS_BH_UserArgs_MT128x64x64_MI16x16x1_SN_LDSB1_CLR1_GSU0_GSUC0_GSUWGMRR0_K1_LBSPPA128_LBSPPB128_MIWT4_2_PLR1_SU32_SUM0_SUS256_VWA1_VWB1_WGM4_WGMXCC1_WGMXCCGn1
    SolutionIndex: 64
    SolutionNameMin: Cijk_Alik_Bljk_BSS_BH_UserArgs_MT128x64x64_MI16x16x1_SN_LDSB1_CLR1_GSU0_GSUC0_GSUWGMRR0_K1_LBSPPA512_LBSPPB128_MIWT4_2_PLR1_SU32_SUM0_SUS256_VWA4_VWB1_WGM4_WGMXCC1_WGMXCCGn1
    SolutionIndex: 65
    SolutionNameMin: Cijk_Alik_Bljk_BSS_BH_UserArgs_MT128x64x64_MI16x16x1_SN_LDSB1_CLR1_GSU0_GSUC0_GSUWGMRR0_K1_LBSPPA128_LBSPPB256_MIWT4_2_PLR1_SU32_SUM0_SUS256_VWA1_VWB2_WGM4_WGMXCC1_WGMXCCGn1
    SolutionIndex: 66
    SolutionNameMin: Cijk_Alik_Bljk_BSS_BH_UserArgs_MT128x64x64_MI16x16x1_SN_LDSB1_CLR1_GSU0_GSUC0_GSUWGMRR0_K1_LBSPPA512_LBSPPB256_MIWT4_2_PLR1_SU32_SUM0_SUS256_VWA4_VWB2_WGM4_WGMXCC1_WGMXCCGn1
    SolutionIndex: 67
    SolutionNameMin: Cijk_Alik_Bljk_BSS_BH_UserArgs_MT128x64x64_MI16x16x1_SN_LDSB1_CLR1_GSU0_GSUC0_GSUWGMRR0_K1_LBSPPA512_LBSPPB128_MIWT4_2_PLR2_SU32_SUM0_SUS256_VWA4_VWB1_WGM4_WGMXCC1_WGMXCCGn1
    SolutionIndex: 68
    SolutionNameMin: Cijk_Alik_Bljk_BSS_BH_UserArgs_MT128x64x64_MI16x16x1_SN_LDSB1_CLR1_GSU0_GSUC0_GSUWGMRR0_K1_LBSPPA128_LBSPPB128_MIWT4_2_PLR1_SU32_SUM0_SUS256_VWA1_VWB1_WGM8_WGMXCC1_WGMXCCGn1
    SolutionIndex: 69
    SolutionNameMin: Cijk_Alik_Bljk_BSS_BH_UserArgs_MT128x64x64_MI16x16x1_SN_LDSB1_CLR1_GSU0_GSUC0_GSUWGMRR0_K1_LBSPPA512_LBSPPB128_MIWT4_2_PLR1_SU32_SUM0_SUS256_VWA4_VWB1_WGM8_WGMXCC1_WGMXCCGn1
    SolutionIndex: 70
    SolutionNameMin: Cijk_Alik_Bljk_BSS_BH_UserArgs_MT128x64x64_MI16x16x1_SN_LDSB1_CLR1_GSU0_GSUC0_GSUWGMRR0_K1_LBSPPA128_LBSPPB256_MIWT4_2_PLR1_SU32_SUM0_SUS256_VWA1_VWB2_WGM8_WGMXCC1_WGMXCCGn1
    SolutionIndex: 71
    SolutionNameMin: Cijk_Alik_Bljk_BSS_BH_UserArgs_MT128x64x64_MI16x16x1_SN_LDSB1_CLR1_GSU0_GSUC0_GSUWGMRR0_K1_LBSPPA512_LBSPPB256_MIWT4_2_PLR1_SU32_SUM0_SUS256_VWA4_VWB2_WGM8_WGMXCC1_WGMXCCGn1
    SolutionIndex: 72
    SolutionNameMin: Cijk_Alik_Bljk_BSS_BH_UserArgs_MT128x64x64_MI16x16x1_SN_LDSB1_CLR1_GSU0_GSUC0_GSUWGMRR0_K1_LBSPPA512_LBSPPB256_MIWT4_2_PLR2_SU32_SUM0_SUS256_VWA4_VWB2_WGM8_WGMXCC1_WGMXCCGn1
    SolutionIndex: 73
    SolutionNameMin: Cijk_Alik_Bljk_BSS_BH_UserArgs_MT64x64x64_MI16x16x1_SN_LDSB1_CLR1_GSU0_GSUC0_GSUWGMRR0_K1_LBSPPA128_LBSPPB128_MIWT2_2_PLR1_SU32_SUM0_SUS256_VWA1_VWB1_WGM1_WGMXCC1_WGMXCCGn1
    SolutionIndex: 74
    SolutionNameMin: Cijk_Alik_Bljk_BSS_BH_UserArgs_MT64x64x64_MI16x16x1_SN_LDSB1_CLR1_GSU0_GSUC0_GSUWGMRR0_K1_LBSPPA256_LBSPPB128_MIWT2_2_PLR1_SU32_SUM0_SUS256_VWA2_VWB1_WGM1_WGMXCC1_WGMXCCGn1
    SolutionIndex: 75
    SolutionNameMin: Cijk_Alik_Bljk_BSS_BH_UserArgs_MT64x64x64_MI16x16x1_SN_LDSB1_CLR1_GSU0_GSUC0_GSUWGMRR0_K1_LBSPPA128_LBSPPB256_MIWT2_2_PLR1_SU32_SUM0_SUS256_VWA1_VWB2_WGM1_WGMXCC1_WGMXCCGn1
    SolutionIndex: 76
    SolutionNameMin: Cijk_Alik_Bljk_BSS_BH_UserArgs_MT64x64x64_MI16x16x1_SN_LDSB1_CLR1_GSU0_GSUC0_GSUWGMRR0_K1_LBSPPA256_LBSPPB256_MIWT2_2_PLR1_SU32_SUM0_SUS256_VWA2_VWB2_WGM1_WGMXCC1_WGMXCCGn1
    SolutionIndex: 77
    SolutionNameMin: Cijk_Alik_Bljk_BSS_BH_UserArgs_MT64x64x64_MI16x16x1_SN_LDSB1_CLR1_GSU0_GSUC0_GSUWGMRR0_K1_LBSPPA128_LBSPPB128_MIWT2_2_PLR2_SU32_SUM0_SUS256_VWA1_VWB1_WGM1_WGMXCC1_WGMXCCGn1
    SolutionIndex: 78
    SolutionNameMin: Cijk_Alik_Bljk_BSS_BH_UserArgs_MT64x64x64_MI16x16x1_SN_LDSB1_CLR1_GSU0_GSUC0_GSUWGMRR0_K1_LBSPPA256_LBSPPB128_MIWT2_2_PLR2_SU32_SUM0_SUS256_VWA2_VWB1_WGM1_WGMXCC1_WGMXCCGn1
    SolutionIndex: 79
    SolutionNameMin: Cijk_Alik_Bljk_BSS_BH_UserArgs_MT64x64x64_MI16x16x1_SN_LDSB1_CLR1_GSU0_GSUC0_GSUWGMRR0_K1_LBSPPA256_LBSPPB256_MIWT2_2_PLR2_SU32_SUM0_SUS256_VWA2_VWB2_WGM1_WGMXCC1_WGMXCCGn1
    SolutionIndex: 80
    SolutionNameMin: Cijk_Alik_Bljk_BSS_BH_UserArgs_MT64x64x64_MI16x16x1_SN_LDSB1_CLR1_GSU0_GSUC0_GSUWGMRR0_K1_LBSPPA128_LBSPPB128_MIWT2_2_PLR1_SU32_SUM0_SUS256_VWA1_VWB1_WGM4_WGMXCC1_WGMXCCGn1
    SolutionIndex: 81
    SolutionNameMin: Cijk_Alik_Bljk_BSS_BH_UserArgs_MT64x64x64_MI16x16x1_SN_LDSB1_CLR1_GSU0_GSUC0_GSUWGMRR0_K1_LBSPPA256_LBSPPB128_MIWT2_2_PLR1_SU32_SUM0_SUS256_VWA2_VWB1_WGM4_WGMXCC1_WGMXCCGn1
    SolutionIndex: 82
    SolutionNameMin: Cijk_Alik_Bljk_BSS_BH_UserArgs_MT64x64x64_MI16x16x1_SN_LDSB1_CLR1_GSU0_GSUC0_GSUWGMRR0_K1_LBSPPA128_LBSPPB256_MIWT2_2_PLR1_SU32_SUM0_SUS256_VWA1_VWB2_WGM4_WGMXCC1_WGMXCCGn1
    SolutionIndex: 83
    SolutionNameMin: Cijk_Alik_Bljk_BSS_BH_UserArgs_MT64x64x64_MI16x16x1_SN_LDSB1_CLR1_GSU0_GSUC0_GSUWGMRR0_K1_LBSPPA128_LBSPPB128_MIWT2_2_PLR2_SU32_SUM0_SUS256_VWA1_VWB1_WGM4_WGMXCC1_WGMXCCGn1
    SolutionIndex: 84
    SolutionNameMin: Cijk_Alik_Bljk_BSS_BH_UserArgs_MT64x64x64_MI16x16x1_SN_LDSB1_CLR1_GSU0_GSUC0_GSUWGMRR0_K1_LBSPPA128_LBSPPB128_MIWT2_2_PLR1_SU32_SUM0_SUS256_VWA1_VWB1_WGM8_WGMXCC1_WGMXCCGn1
    SolutionIndex: 85
    SolutionNameMin: Cijk_Alik_Bljk_BSS_BH_UserArgs_MT64x64x64_MI16x16x1_SN_LDSB1_CLR1_GSU0_GSUC0_GSUWGMRR0_K1_LBSPPA128_LBSPPB256_MIWT2_2_PLR1_SU32_SUM0_SUS256_VWA1_VWB2_WGM8_WGMXCC1_WGMXCCGn1
    SolutionIndex: 86
    SolutionNameMin: Cijk_Alik_Bljk_BSS_BH_UserArgs_MT64x64x64_MI16x16x1_SN_LDSB1_CLR1_GSU0_GSUC0_GSUWGMRR0_K1_LBSPPA256_LBSPPB256_MIWT2_2_PLR1_SU32_SUM0_SUS256_VWA2_VWB2_WGM8_WGMXCC1_WGMXCCGn1
    SolutionIndex: 87
    SolutionNameMin: Cijk_Alik_Bljk_BSS_BH_UserArgs_MT64x64x64_MI16x16x1_SN_LDSB1_CLR1_GSU0_GSUC0_GSUWGMRR0_K1_LBSPPA128_LBSPPB128_MIWT2_2_PLR2_SU32_SUM0_SUS256_VWA1_VWB1_WGM8_WGMXCC1_WGMXCCGn1
    SolutionIndex: 88
    SolutionNameMin: Cijk_Alik_Bljk_BSS_BH_UserArgs_MT64x64x64_MI16x16x1_SN_LDSB1_CLR1_GSU0_GSUC0_GSUWGMRR0_K1_LBSPPA256_LBSPPB256_MIWT2_2_PLR2_SU32_SUM0_SUS256_VWA2_VWB2_WGM8_WGMXCC1_WGMXCCGn1
    SolutionIndex: 89
    SolutionNameMin: Cijk_Alik_Bljk_BSS_BH_UserArgs_MT32x64x64_MI16x16x1_SN_LDSB0_CLR1_GSU0_GSUC0_GSUWGMRR0_K1_LBSPPA128_LBSPPB128_MIWT1_2_PLR1_SU32_SUM0_SUS256_VWA1_VWB1_WGM1_WGMXCC1_WGMXCCGn1
    SolutionIndex: 90
    SolutionNameMin: Cijk_Alik_Bljk_BSS_BH_UserArgs_MT32x64x64_MI16x16x1_SN_LDSB0_CLR1_GSU0_GSUC0_GSUWGMRR0_K1_LBSPPA128_LBSPPB256_MIWT1_2_PLR1_SU32_SUM0_SUS256_VWA1_VWB2_WGM1_WGMXCC1_WGMXCCGn1
    SolutionIndex: 91
    SolutionNameMin: Cijk_Alik_Bljk_BSS_BH_UserArgs_MT32x64x64_MI16x16x1_SN_LDSB0_CLR1_GSU0_GSUC0_GSUWGMRR0_K1_LBSPPA128_LBSPPB256_MIWT1_2_PLR1_SU32_SUM0_SUS256_VWA1_VWB2_WGM8_WGMXCC1_WGMXCCGn1
    SolutionIndex: 92
    SolutionNameMin: Cijk_Alik_Bljk_BSS_BH_UserArgs_MT64x32x64_MI16x16x1_SN_LDSB0_CLR1_GSU0_GSUC0_GSUWGMRR0_K1_LBSPPA128_LBSPPB128_MIWT2_1_PLR1_SU32_SUM0_SUS256_VWA1_VWB1_WGM1_WGMXCC1_WGMXCCGn1
    SolutionIndex: 93
    SolutionNameMin: Cijk_Alik_Bljk_BSS_BH_UserArgs_MT64x32x64_MI16x16x1_SN_LDSB0_CLR1_GSU0_GSUC0_GSUWGMRR0_K1_LBSPPA256_LBSPPB128_MIWT2_1_PLR1_SU32_SUM0_SUS256_VWA2_VWB1_WGM1_WGMXCC1_WGMXCCGn1
    SolutionIndex: 94
    SolutionNameMin: Cijk_Alik_Bljk_BSS_BH_UserArgs_MT64x32x64_MI16x16x1_SN_LDSB0_CLR1_GSU0_GSUC0_GSUWGMRR0_K1_LBSPPA128_LBSPPB128_MIWT2_1_PLR2_SU32_SUM0_SUS256_VWA1_VWB1_WGM1_WGMXCC1_WGMXCCGn1
    SolutionIndex: 95
    SolutionNameMin: Cijk_Alik_Bljk_BSS_BH_UserArgs_MT64x64x128_MI16x16x1_SN_LDSB1_CLR1_GSU0_GSUC0_GSUWGMRR0_K1_LBSPPA256_LBSPPB256_MIWT2_2_PLR1_SU32_SUM0_SUS256_VWA1_VWB1_WGM1_WGMXCC1_WGMXCCGn1
    SolutionIndex: 96
    SolutionNameMin: Cijk_Alik_Bljk_BSS_BH_UserArgs_MT64x64x128_MI16x16x1_SN_LDSB1_CLR1_GSU0_GSUC0_GSUWGMRR0_K1_LBSPPA512_LBSPPB512_MIWT2_2_PLR1_SU32_SUM0_SUS256_VWA2_VWB2_WGM1_WGMXCC1_WGMXCCGn1
    SolutionIndex: 97
    SolutionNameMin: Cijk_Alik_Bljk_BSS_BH_UserArgs_MT64x64x128_MI16x16x1_SN_LDSB1_CLR1_GSU0_GSUC0_GSUWGMRR0_K1_LBSPPA256_LBSPPB512_MIWT2_2_PLR2_SU32_SUM0_SUS256_VWA1_VWB2_WGM8_WGMXCC1_WGMXCCGn1
    SolutionIndex: 98
    SolutionNameMin: Cijk_Alik_Bljk_BSS_BH_UserArgs_MT32x64x128_MI16x16x1_SN_LDSB1_CLR1_GSU0_GSUC0_GSUWGMRR0_K1_LBSPPA256_LBSPPB256_MIWT1_2_PLR1_SU32_SUM0_SUS256_VWA1_VWB1_WGM1_WGMXCC1_WGMXCCGn1
    SolutionIndex: 99
    SolutionNameMin: Cijk_Alik_Bljk_BSS_BH_UserArgs_MT32x64x128_MI16x16x1_SN_LDSB1_CLR1_GSU0_GSUC0_GSUWGMRR0_K1_LBSPPA256_LBSPPB512_MIWT1_2_PLR1_SU32_SUM0_SUS256_VWA1_VWB2_WGM1_WGMXCC1_WGMXCCGn1
    SolutionIndex: 100
    SolutionNameMin: Cijk_Alik_Bljk_BSS_BH_UserArgs_MT32x64x128_MI16x16x1_SN_LDSB1_CLR1_GSU0_GSUC0_GSUWGMRR0_K1_LBSPPA256_LBSPPB512_MIWT1_2_PLR2_SU32_SUM0_SUS256_VWA1_VWB2_WGM8_WGMXCC1_WGMXCCGn1
    SolutionIndex: 101
    SolutionNameMin: Cijk_Alik_Bljk_BSS_BH_UserArgs_MT64x32x128_MI16x16x1_SN_LDSB1_CLR1_GSU0_GSUC0_GSUWGMRR0_K1_LBSPPA256_LBSPPB256_MIWT2_1_PLR1_SU32_SUM0_SUS256_VWA1_VWB1_WGM1_WGMXCC1_WGMXCCGn1
    SolutionIndex: 102
    SolutionNameMin: Cijk_Alik_Bljk_BSS_BH_UserArgs_MT64x32x128_MI16x16x1_SN_LDSB1_CLR1_GSU0_GSUC0_GSUWGMRR0_K1_LBSPPA512_LBSPPB256_MIWT2_1_PLR1_SU32_SUM0_SUS256_VWA2_VWB1_WGM1_WGMXCC1_WGMXCCGn1
    SolutionIndex: 103
    SolutionNameMin: Cijk_Alik_Bljk_BSS_BH_UserArgs_MT64x32x128_MI16x16x1_SN_LDSB1_CLR1_GSU0_GSUC0_GSUWGMRR0_K1_LBSPPA256_LBSPPB256_MIWT2_1_PLR2_SU32_SUM0_SUS256_VWA1_VWB1_WGM1_WGMXCC1_WGMXCCGn1
    SolutionIndex: 104
    SolutionNameMin: Cijk_Alik_Bljk_BSS_BH_UserArgs_MT64x32x128_MI16x16x1_SN_LDSB1_CLR1_GSU0_GSUC0_GSUWGMRR0_K1_LBSPPA512_LBSPPB256_MIWT2_1_PLR2_SU32_SUM0_SUS256_VWA2_VWB1_WGM1_WGMXCC1_WGMXCCGn1
    SolutionIndex: 105
    SolutionNameMin: Cijk_Alik_Bljk_BSS_BH_UserArgs_MT64x32x128_MI16x16x1_SN_LDSB1_CLR1_GSU0_GSUC0_GSUWGMRR0_K1_LBSPPA256_LBSPPB256_MIWT2_1_PLR1_SU32_SUM0_SUS256_VWA1_VWB1_WGM4_WGMXCC1_WGMXCCGn1
    SolutionIndex: 106
    SolutionNameMin: Cijk_Alik_Bljk_BSS_BH_UserArgs_MT64x32x128_MI16x16x1_SN_LDSB1_CLR1_GSU0_GSUC0_GSUWGMRR0_K1_LBSPPA256_LBSPPB256_MIWT2_1_PLR1_SU32_SUM0_SUS256_VWA1_VWB1_WGM8_WGMXCC1_WGMXCCGn1
    SolutionIndex: 107
    SolutionNameMin: Cijk_Alik_Bljk_BSS_BH_UserArgs_MT64x32x128_MI16x16x1_SN_LDSB1_CLR1_GSU0_GSUC0_GSUWGMRR0_K1_LBSPPA512_LBSPPB256_MIWT2_1_PLR1_SU32_SUM0_SUS256_VWA2_VWB1_WGM8_WGMXCC1_WGMXCCGn1
    SolutionIndex: 108
    SolutionNameMin: Cijk_Alik_Bljk_BSS_BH_UserArgs_MT32x32x128_MI16x16x1_SN_LDSB1_CLR1_GSU0_GSUC0_GSUWGMRR0_K1_LBSPPA256_LBSPPB256_MIWT1_1_PLR1_SU32_SUM0_SUS256_VWA1_VWB1_WGM1_WGMXCC1_WGMXCCGn1
    SolutionIndex: 109
    SolutionNameMin: Cijk_Alik_Bljk_BSS_BH_UserArgs_MT32x32x128_MI16x16x1_SN_LDSB1_CLR1_GSU0_GSUC0_GSUWGMRR0_K1_LBSPPA256_LBSPPB256_MIWT1_1_PLR2_SU32_SUM0_SUS256_VWA1_VWB1_WGM1_WGMXCC1_WGMXCCGn1
    SolutionIndex: 110
    SolutionNameMin: Cijk_Alik_Bljk_BSS_BH_UserArgs_MT32x32x128_MI16x16x1_SN_LDSB1_CLR1_GSU0_GSUC0_GSUWGMRR0_K1_LBSPPA256_LBSPPB256_MIWT1_1_PLR1_SU32_SUM0_SUS256_VWA1_VWB1_WGM4_WGMXCC1_WGMXCCGn1
    SolutionIndex: 111
    SolutionNameMin: Cijk_Alik_Bljk_BSS_BH_UserArgs_MT32x32x128_MI16x16x1_SN_LDSB1_CLR1_GSU0_GSUC0_GSUWGMRR0_K1_LBSPPA256_LBSPPB256_MIWT1_1_PLR2_SU32_SUM0_SUS256_VWA1_VWB1_WGM4_WGMXCC1_WGMXCCGn1
    SolutionIndex: 112
    SolutionNameMin: Cijk_Alik_Bljk_BSS_BH_UserArgs_MT32x32x128_MI16x16x1_SN_LDSB1_CLR1_GSU0_GSUC0_GSUWGMRR0_K1_LBSPPA256_LBSPPB256_MIWT1_1_PLR1_SU32_SUM0_SUS256_VWA1_VWB1_WGM8_WGMXCC1_WGMXCCGn1
    SolutionIndex: 113
    SolutionNameMin: Cijk_Alik_Bljk_BSS_BH_UserArgs_MT32x32x128_MI16x16x1_SN_LDSB1_CLR1_GSU0_GSUC0_GSUWGMRR0_K1_LBSPPA256_LBSPPB256_MIWT1_1_PLR2_SU32_SUM0_SUS256_VWA1_VWB1_WGM8_WGMXCC1_WGMXCCGn1
    SolutionIndex: 114
    SolutionNameMin: Cijk_Alik_Bljk_BSS_BH_UserArgs_MT32x128x64_MI16x16x1_SN_LDSB1_CLR1_GSU0_GSUC0_GSUWGMRR0_K1_LBSPPA128_LBSPPB128_MIWT1_4_PLR1_SU32_SUM0_SUS256_VWA1_VWB1_WGM1_WGMXCC1_WGMXCCGn1
- - - [128, 128, 1, 128, 128, 128, 128, 128]
    - [100, 0.086]
  - - [128, 128, 1, 256, 128, 128, 256, 256]
    - [101, 0.105]
  - - [128, 128, 1, 512, 128, 128, 512, 512]
    - [108, 0.19]
  - - [128, 128, 1, 1024, 128, 128, 1024, 1024]
    - [109, 0.322]
  - - [128, 128, 1, 2048, 128, 128, 2048, 2048]
    - [109, 0.558]
  - - [128, 128, 1, 4096, 128, 128, 4096, 4096]
    - [91, 0.873]
  - - [128, 128, 1, 8192, 128, 128, 8192, 8192]
    - [110, 1.354]
  - - [128, 256, 1, 128, 128, 128, 128, 128]
    - [101, 0.176]
  - - [128, 256, 1, 256, 128, 128, 256, 256]
    - [109, 0.262]
  - - [128, 256, 1, 512, 128, 128, 512, 512]
    - [113, 0.361]
  - - [128, 256, 1, 1024, 128, 128, 1024, 1024]
    - [113, 0.63]
  - - [128, 256, 1, 2048, 128, 128, 2048, 2048]
    - [108, 1.009]
  - - [128, 256, 1, 4096, 128, 128, 4096, 4096]
    - [89, 1.579]
  - - [128, 256, 1, 8192, 128, 128, 8192, 8192]
    - [98, 2.116]
  - - [128, 512, 1, 128, 128, 128, 128, 128]
    - [104, 0.331]
  - - [128, 512, 1, 256, 128, 128, 256, 256]
    - [113, 0.577]
  - - [128, 512, 1, 512, 128, 128, 512, 512]
    - [108, 0.928]
  - - [128, 512, 1, 1024, 128, 128, 1024, 1024]
    - [108, 1.394]
  - - [128, 512, 1, 2048, 128, 128, 2048, 2048]
    - [101, 1.663]
  - - [128, 512, 1, 4096, 128, 128, 4096, 4096]
    - [88, 2.217]
  - - [128, 512, 1, 8192, 128, 128, 8192, 8192]
    - [95, 2.546]
  - - [128, 1024, 1, 128, 128, 128, 128, 128]
    - [89, 0.619]
  - - [128, 1024, 1, 256, 128, 128, 256, 256]
    - [94, 1.035]
  - - [128, 1024, 1, 512, 128, 128, 512, 512]
    - [89, 1.588]
  - - [128, 1024, 1, 1024, 128, 128, 1024, 1024]
    - [103, 2.122]
  - - [128, 1024, 1, 2048, 128, 128, 2048, 2048]
    - [75, 1.977]
  - - [128, 1024, 1, 4096, 128, 128, 4096, 4096]
    - [56, 3.398]
  - - [128, 1024, 1, 8192, 128, 128, 8192, 8192]
    - [69, 3.576]
  - - [128, 2048, 1, 128, 128, 128, 128, 128]
    - [73, 1.048]
  - - [128, 2048, 1, 256, 128, 128, 256, 256]
    - [75, 1.7]
  - - [128, 2048, 1, 512, 128, 128, 512, 512]
    - [80, 2.355]
  - - [128, 2048, 1, 1024, 128, 128, 1024, 1024]
    - [69, 2.461]
  - - [128, 2048, 1, 2048, 128, 128, 2048, 2048]
    - [48, 2.638]
  - - [128, 2048, 1, 4096, 128, 128, 4096, 4096]
    - [64, 3.672]
  - - [128, 2048, 1, 8192, 128, 128, 8192, 8192]
    - [71, 4.493]
  - - [128, 4096, 1, 128, 128, 128, 128, 128]
    - [19, 1.224]
  - - [128, 4096, 1, 256, 128, 128, 256, 256]
    - [61, 2.026]
  - - [128, 4096, 1, 512, 128, 128, 512, 512]
    - [63, 3.057]
  - - [128, 4096, 1, 1024, 128, 128, 1024, 1024]
    - [104, 2.865]
  - - [128, 4096, 1, 2048, 128, 128, 2048, 2048]
    - [73, 3.551]
  - - [128, 4096, 1, 4096, 128, 128, 4096, 4096]
    - [64, 4.375]
  - - [128, 4096, 1, 8192, 128, 128, 8192, 8192]
    - [36, 5.181]
  - - [128, 8192, 1, 128, 128, 128, 128, 128]
    - [5, 1.66]
  - - [128, 8192, 1, 256, 128, 128, 256, 256]
    - [1, 2.339]
  - - [128, 8192, 1, 512, 128, 128, 512, 512]
    - [22, 3.366]
  - - [128, 8192, 1, 1024, 128, 128, 1024, 1024]
    - [73, 3.82]
  - - [128, 8192, 1, 2048, 128, 128, 2048, 2048]
    - [79, 4.262]
  - - [128, 8192, 1, 4096, 128, 128, 4096, 4096]
    - [59, 5.168]
  - - [128, 8192, 1, 8192, 128, 128, 8192, 8192]
    - [59, 5.633]
  - - [256, 128, 1, 128, 256, 256, 128, 128]
    - [107, 0.171]
  - - [256, 128, 1, 256, 256, 256, 256, 256]
    - [108, 0.259]
  - - [256, 128, 1, 512, 256, 256, 512, 512]
    - [109, 0.379]
  - - [256, 128, 1, 1024, 256, 256, 1024, 1024]
    - [111, 0.641]
  - - [256, 128, 1, 2048, 256, 256, 2048, 2048]
    - [108, 1.027]
  - - [256, 128, 1, 4096, 256, 256, 4096, 4096]
    - [89, 1.578]
  - - [256, 128, 1, 8192, 256, 256, 8192, 8192]
    - [98, 2.135]
  - - [256, 256, 1, 128, 256, 256, 128, 128]
    - [104, 0.338]
  - - [256, 256, 1, 256, 256, 256, 256, 256]
    - [109, 0.582]
  - - [256, 256, 1, 512, 256, 256, 512, 512]
    - [109, 0.928]
  - - [256, 256, 1, 1024, 256, 256, 1024, 1024]
    - [109, 1.378]
  - - [256, 256, 1, 2048, 256, 256, 2048, 2048]
    - [101, 1.655]
  - - [256, 256, 1, 4096, 256, 256, 4096, 4096]
    - [74, 2.426]
  - - [256, 256, 1, 8192, 256, 256, 8192, 8192]
    - [56, 2.602]
  - - [256, 512, 1, 128, 256, 256, 128, 128]
    - [92, 0.606]
  - - [256, 512, 1, 256, 256, 256, 256, 256]
    - [93, 1.025]
  - - [256, 512, 1, 512, 256, 256, 512, 512]
    - [90, 1.596]
  - - [256, 512, 1, 1024, 256, 256, 1024, 1024]
    - [99, 2.11]
  - - [256, 512, 1, 2048, 256, 256, 2048, 2048]
    - [75, 1.999]
  - - [256, 512, 1, 4096, 256, 256, 4096, 4096]
    - [56, 3.209]
  - - [256, 512, 1, 8192, 256, 256, 8192, 8192]
    - [27, 3.465]
  - - [256, 1024, 1, 128, 256, 256, 128, 128]
    - [76, 1.045]
  - - [256, 1024, 1, 256, 256, 256, 256, 256]
    - [75, 1.679]
  - - [256, 1024, 1, 512, 256, 256, 512, 512]
    - [85, 2.499]
  - - [256, 1024, 1, 1024, 256, 256, 1024, 1024]
    - [96, 2.553]
  - - [256, 1024, 1, 2048, 256, 256, 2048, 2048]
    - [56, 3.044]
  - - [256, 1024, 1, 4096, 256, 256, 4096, 4096]
    - [30, 3.729]
  - - [256, 1024, 1, 8192, 256, 256, 8192, 8192]
    - [65, 4.286]
  - - [256, 2048, 1, 128, 256, 256, 128, 128]
    - [57, 1.386]
  - - [256, 2048, 1, 256, 256, 256, 256, 256]
    - [57, 2.148]
  - - [256, 2048, 1, 512, 256, 256, 512, 512]
    - [57, 3.211]
  - - [256, 2048, 1, 1024, 256, 256, 1024, 1024]
    - [56, 2.907]
  - - [256, 2048, 1, 2048, 256, 256, 2048, 2048]
    - [75, 3.8]
  - - [256, 2048, 1, 4096, 256, 256, 4096, 4096]
    - [105, 3.595]
  - - [256, 2048, 1, 8192, 256, 256, 8192, 8192]
    - [59, 4.639]
  - - [256, 4096, 1, 128, 256, 256, 128, 128]
    - [86, 1.556]
  - - [256, 4096, 1, 256, 256, 256, 256, 256]
    - [10, 2.267]
  - - [256, 4096, 1, 512, 256, 256, 512, 512]
    - [27, 3.568]
  - - [256, 4096, 1, 1024, 256, 256, 1024, 1024]
    - [76, 4.216]
  - - [256, 4096, 1, 2048, 256, 256, 2048, 2048]
    - [84, 4.482]
  - - [256, 4096, 1, 4096, 256, 256, 4096, 4096]
    - [59, 4.745]
  - - [256, 4096, 1, 8192, 256, 256, 8192, 8192]
    - [76, 3.829]
  - - [256, 8192, 1, 128, 256, 256, 128, 128]
    - [56, 1.885]
  - - [256, 8192, 1, 256, 256, 256, 256, 256]
    - [15, 2.834]
  - - [256, 8192, 1, 512, 256, 256, 512, 512]
    - [70, 4.265]
  - - [256, 8192, 1, 1024, 256, 256, 1024, 1024]
    - [66, 5.346]
  - - [256, 8192, 1, 2048, 256, 256, 2048, 2048]
    - [56, 6.01]
  - - [256, 8192, 1, 4096, 256, 256, 4096, 4096]
    - [71, 5.105]
  - - [256, 8192, 1, 8192, 256, 256, 8192, 8192]
    - [45, 5.452]
  - - [512, 128, 1, 128, 512, 512, 128, 128]
    - [20, 0.314]
  - - [512, 128, 1, 256, 512, 512, 256, 256]
    - [108, 0.591]
  - - [512, 128, 1, 512, 512, 512, 512, 512]
    - [108, 0.934]
  - - [512, 128, 1, 1024, 512, 512, 1024, 1024]
    - [112, 1.313]
  - - [512, 128, 1, 2048, 512, 512, 2048, 2048]
    - [102, 1.662]
  - - [512, 128, 1, 4096, 512, 512, 4096, 4096]
    - [73, 2.344]
  - - [512, 128, 1, 8192, 512, 512, 8192, 8192]
    - [80, 2.822]
  - - [512, 256, 1, 128, 512, 512, 128, 128]
    - [92, 0.62]
  - - [512, 256, 1, 256, 512, 512, 256, 256]
    - [93, 1.03]
  - - [512, 256, 1, 512, 512, 512, 512, 512]
    - [90, 1.582]
  - - [512, 256, 1, 1024, 512, 512, 1024, 1024]
    - [101, 2.11]
  - - [512, 256, 1, 2048, 512, 512, 2048, 2048]
    - [78, 1.995]
  - - [512, 256, 1, 4096, 512, 512, 4096, 4096]
    - [51, 3.193]
  - - [512, 256, 1, 8192, 512, 512, 8192, 8192]
    - [35, 3.458]
  - - [512, 512, 1, 128, 512, 512, 128, 128]
    - [75, 1.06]
  - - [512, 512, 1, 256, 512, 512, 256, 256]
    - [73, 1.669]
  - - [512, 512, 1, 512, 512, 512, 512, 512]
    - [75, 2.496]
  - - [512, 512, 1, 1024, 512, 512, 1024, 1024]
    - [96, 2.665]
  - - [512, 512, 1, 2048, 512, 512, 2048, 2048]
    - [63, 2.849]
  - - [512, 512, 1, 4096, 512, 512, 4096, 4096]
    - [30, 3.601]
  - - [512, 512, 1, 8192, 512, 512, 8192, 8192]
    - [32, 4.418]
  - - [512, 1024, 1, 128, 512, 512, 128, 128]
    - [63, 1.377]
  - - [512, 1024, 1, 256, 512, 512, 256, 256]
    - [65, 2.171]
  - - [512, 1024, 1, 512, 512, 512, 512, 512]
    - [54, 3.222]
  - - [512, 1024, 1, 1024, 512, 512, 1024, 1024]
    - [101, 2.889]
  - - [512, 1024, 1, 2048, 512, 512, 2048, 2048]
    - [75, 3.787]
  - - [512, 1024, 1, 4096, 512, 512, 4096, 4096]
    - [50, 4.003]
  - - [512, 1024, 1, 8192, 512, 512, 8192, 8192]
    - [24, 4.465]
  - - [512, 2048, 1, 128, 512, 512, 128, 128]
    - [4, 1.526]
  - - [512, 2048, 1, 256, 512, 512, 256, 256]
    - [81, 2.435]
  - - [512, 2048, 1, 512, 512, 512, 512, 512]
    - [85, 3.625]
  - - [512, 2048, 1, 1024, 512, 512, 1024, 1024]
    - [75, 4.363]
  - - [512, 2048, 1, 2048, 512, 512, 2048, 2048]
    - [73, 4.816]
  - - [512, 2048, 1, 4096, 512, 512, 4096, 4096]
    - [49, 4.394]
  - - [512, 2048, 1, 8192, 512, 512, 8192, 8192]
    - [24, 5.225]
  - - [512, 4096, 1, 128, 512, 512, 128, 128]
    - [6, 2.024]
  - - [512, 4096, 1, 256, 512, 512, 256, 256]
    - [18, 2.945]
  - - [512, 4096, 1, 512, 512, 512, 512, 512]
    - [66, 4.444]
  - - [512, 4096, 1, 1024, 512, 512, 1024, 1024]
    - [57, 5.499]
  - - [512, 4096, 1, 2048, 512, 512, 2048, 2048]
    - [54, 6.002]
  - - [512, 4096, 1, 4096, 512, 512, 4096, 4096]
    - [38, 5.284]
  - - [512, 4096, 1, 8192, 512, 512, 8192, 8192]
    - [36, 6.016]
  - - [512, 8192, 1, 128, 512, 512, 128, 128]
    - [4, 2.439]
  - - [512, 8192, 1, 256, 512, 512, 256, 256]
    - [18, 3.554]
  - - [512, 8192, 1, 512, 512, 512, 512, 512]
    - [11, 4.683]
  - - [512, 8192, 1, 1024, 512, 512, 1024, 1024]
    - [24, 5.727]
  - - [512, 8192, 1, 2048, 512, 512, 2048, 2048]
    - [39, 6.548]
  - - [512, 8192, 1, 4096, 512, 512, 4096, 4096]
    - [72, 5.008]
  - - [512, 8192, 1, 8192, 512, 512, 8192, 8192]
    - [35, 5.192]
  - - [1024, 128, 1, 128, 1024, 1024, 128, 128]
    - [89, 0.62]
  - - [1024, 128, 1, 256, 1024, 1024, 256, 256]
    - [89, 1.041]
  - - [1024, 128, 1, 512, 1024, 1024, 512, 512]
    - [89, 1.57]
  - - [1024, 128, 1, 1024, 1024, 1024, 1024, 1024]
    - [103, 2.102]
  - - [1024, 128, 1, 2048, 1024, 1024, 2048, 2048]
    - [73, 1.912]
  - - [1024, 128, 1, 4096, 1024, 1024, 4096, 4096]
    - [51, 3.215]
  - - [1024, 128, 1, 8192, 1024, 1024, 8192, 8192]
    - [24, 3.647]
  - - [1024, 256, 1, 128, 1024, 1024, 128, 128]
    - [82, 1.052]
  - - [1024, 256, 1, 256, 1024, 1024, 256, 256]
    - [85, 1.672]
  - - [1024, 256, 1, 512, 1024, 1024, 512, 512]
    - [75, 2.515]
  - - [1024, 256, 1, 1024, 1024, 1024, 1024, 1024]
    - [95, 2.569]
  - - [1024, 256, 1, 2048, 1024, 1024, 2048, 2048]
    - [69, 2.898]
  - - [1024, 256, 1, 4096, 1024, 1024, 4096, 4096]
    - [40, 3.664]
  - - [1024, 256, 1, 8192, 1024, 1024, 8192, 8192]
    - [40, 4.448]
  - - [1024, 512, 1, 128, 1024, 1024, 128, 128]
    - [57, 1.419]
  - - [1024, 512, 1, 256, 1024, 1024, 256, 256]
    - [63, 2.133]
  - - [1024, 512, 1, 512, 1024, 1024, 512, 512]
    - [56, 3.199]
  - - [1024, 512, 1, 1024, 1024, 1024, 1024, 1024]
    - [104, 2.873]
  - - [1024, 512, 1, 2048, 1024, 1024, 2048, 2048]
    - [84, 3.616]
  - - [1024, 512, 1, 4096, 1024, 1024, 4096, 4096]
    - [72, 4.105]
  - - [1024, 512, 1, 8192, 1024, 1024, 8192, 8192]
    - [38, 4.535]
  - - [1024, 1024, 1, 128, 1024, 1024, 128, 128]
    - [57, 1.626]
  - - [1024, 1024, 1, 256, 1024, 1024, 256, 256]
    - [77, 2.575]
  - - [1024, 1024, 1, 512, 1024, 1024, 512, 512]
    - [85, 3.553]
  - - [1024, 1024, 1, 1024, 1024, 1024, 1024, 1024]
    - [75, 4.305]
  - - [1024, 1024, 1, 2048, 1024, 1024, 2048, 2048]
    - [75, 4.504]
  - - [1024, 1024, 1, 4096, 1024, 1024, 4096, 4096]
    - [47, 4.631]
  - - [1024, 1024, 1, 8192, 1024, 1024, 8192, 8192]
    - [30, 5.579]
  - - [1024, 2048, 1, 128, 1024, 1024, 128, 128]
    - [6, 2.049]
  - - [1024, 2048, 1, 256, 1024, 1024, 256, 256]
    - [5, 2.956]
  - - [1024, 2048, 1, 512, 1024, 1024, 512, 512]
    - [56, 4.299]
  - - [1024, 2048, 1, 1024, 1024, 1024, 1024, 1024]
    - [65, 5.221]
  - - [1024, 2048, 1, 2048, 1024, 1024, 2048, 2048]
    - [54, 5.695]
  - - [1024, 2048, 1, 4096, 1024, 1024, 4096, 4096]
    - [40, 5.316]
  - - [1024, 2048, 1, 8192, 1024, 1024, 8192, 8192]
    - [30, 6.012]
  - - [1024, 4096, 1, 128, 1024, 1024, 128, 128]
    - [12, 2.468]
  - - [1024, 4096, 1, 256, 1024, 1024, 256, 256]
    - [11, 3.556]
  - - [1024, 4096, 1, 512, 1024, 1024, 512, 512]
    - [3, 4.701]
  - - [1024, 4096, 1, 1024, 1024, 1024, 1024, 1024]
    - [24, 5.656]
  - - [1024, 4096, 1, 2048, 1024, 1024, 2048, 2048]
    - [39, 6.548]
  - - [1024, 4096, 1, 4096, 1024, 1024, 4096, 4096]
    - [27, 5.778]
  - - [1024, 4096, 1, 8192, 1024, 1024, 8192, 8192]
    - [39, 6.437]
  - - [1024, 8192, 1, 128, 1024, 1024, 128, 128]
    - [59, 2.166]
  - - [1024, 8192, 1, 256, 1024, 1024, 256, 256]
    - [59, 3.24]
  - - [1024, 8192, 1, 512, 1024, 1024, 512, 512]
    - [59, 4.252]
  - - [1024, 8192, 1, 1024, 1024, 1024, 1024, 1024]
    - [24, 4.958]
  - - [1024, 8192, 1, 2048, 1024, 1024, 2048, 2048]
    - [28, 5.568]
  - - [1024, 8192, 1, 4096, 1024, 1024, 4096, 4096]
    - [35, 6.219]
  - - [1024, 8192, 1, 8192, 1024, 1024, 8192, 8192]
    - [43, 6.952]
  - - [2048, 128, 1, 128, 2048, 2048, 128, 128]
    - [74, 1.044]
  - - [2048, 128, 1, 256, 2048, 2048, 256, 256]
    - [75, 1.699]
  - - [2048, 128, 1, 512, 2048, 2048, 512, 512]
    - [74, 2.303]
  - - [2048, 128, 1, 1024, 2048, 2048, 1024, 1024]
    - [97, 2.476]
  - - [2048, 128, 1, 2048, 2048, 2048, 2048, 2048]
    - [64, 2.767]
  - - [2048, 128, 1, 4096, 2048, 2048, 4096, 4096]
    - [49, 3.508]
  - - [2048, 128, 1, 8192, 2048, 2048, 8192, 8192]
    - [46, 4.458]
  - - [2048, 256, 1, 128, 2048, 2048, 128, 128]
    - [58, 1.389]
  - - [2048, 256, 1, 256, 2048, 2048, 256, 256]
    - [54, 2.18]
  - - [2048, 256, 1, 512, 2048, 2048, 512, 512]
    - [48, 3.121]
  - - [2048, 256, 1, 1024, 2048, 2048, 1024, 1024]
    - [66, 2.777]
  - - [2048, 256, 1, 2048, 2048, 2048, 2048, 2048]
    - [85, 3.788]
  - - [2048, 256, 1, 4096, 2048, 2048, 4096, 4096]
    - [48, 4.068]
  - - [2048, 256, 1, 8192, 2048, 2048, 8192, 8192]
    - [30, 4.358]
  - - [2048, 512, 1, 128, 2048, 2048, 128, 128]
    - [5, 1.628]
  - - [2048, 512, 1, 256, 2048, 2048, 256, 256]
    - [6, 2.537]
  - - [2048, 512, 1, 512, 2048, 2048, 512, 512]
    - [84, 3.508]
  - - [2048, 512, 1, 1024, 2048, 2048, 1024, 1024]
    - [84, 4.309]
  - - [2048, 512, 1, 2048, 2048, 2048, 2048, 2048]
    - [84, 4.604]
  - - [2048, 512, 1, 4096, 2048, 2048, 4096, 4096]
    - [46, 4.551]
  - - [2048, 512, 1, 8192, 2048, 2048, 8192, 8192]
    - [26, 5.363]
  - - [2048, 1024, 1, 128, 2048, 2048, 128, 128]
    - [6, 1.96]
  - - [2048, 1024, 1, 256, 2048, 2048, 256, 256]
    - [1, 3.012]
  - - [2048, 1024, 1, 512, 2048, 2048, 512, 512]
    - [54, 4.364]
  - - [2048, 1024, 1, 1024, 2048, 2048, 1024, 1024]
    - [68, 5.059]
  - - [2048, 1024, 1, 2048, 2048, 2048, 2048, 2048]
    - [51, 5.159]
  - - [2048, 1024, 1, 4096, 2048, 2048, 4096, 4096]
    - [27, 5.288]
  - - [2048, 1024, 1, 8192, 2048, 2048, 8192, 8192]
    - [21, 5.211]
  - - [2048, 2048, 1, 128, 2048, 2048, 128, 128]
    - [15, 2.386]
  - - [2048, 2048, 1, 256, 2048, 2048, 256, 256]
    - [3, 3.489]
  - - [2048, 2048, 1, 512, 2048, 2048, 512, 512]
    - [1, 4.555]
  - - [2048, 2048, 1, 1024, 2048, 2048, 1024, 1024]
    - [29, 5.164]
  - - [2048, 2048, 1, 2048, 2048, 2048, 2048, 2048]
    - [43, 6.403]
  - - [2048, 2048, 1, 4096, 2048, 2048, 4096, 4096]
    - [41, 5.465]
  - - [2048, 2048, 1, 8192, 2048, 2048, 8192, 8192]
    - [12, 4.591]
  - - [2048, 4096, 1, 128, 2048, 2048, 128, 128]
    - [56, 2.093]
  - - [2048, 4096, 1, 256, 2048, 2048, 256, 256]
    - [59, 3.268]
  - - [2048, 4096, 1, 512, 2048, 2048, 512, 512]
    - [56, 4.056]
  - - [2048, 4096, 1, 1024, 2048, 2048, 1024, 1024]
    - [40, 5.004]
  - - [2048, 4096, 1, 2048, 2048, 2048, 2048, 2048]
    - [38, 5.536]
  - - [2048, 4096, 1, 4096, 2048, 2048, 4096, 4096]
    - [25, 6.433]
  - - [2048, 4096, 1, 8192, 2048, 2048, 8192, 8192]
    - [41, 6.88]
  - - [2048, 8192, 1, 128, 2048, 2048, 128, 128]
    - [60, 2.594]
  - - [2048, 8192, 1, 256, 2048, 2048, 256, 256]
    - [4, 3.368]
  - - [2048, 8192, 1, 512, 2048, 2048, 512, 512]
    - [56, 4.419]
  - - [2048, 8192, 1, 1024, 2048, 2048, 1024, 1024]
    - [24, 5.106]
  - - [2048, 8192, 1, 2048, 2048, 2048, 2048, 2048]
    - [31, 5.531]
  - - [2048, 8192, 1, 4096, 2048, 2048, 4096, 4096]
    - [40, 6.563]
  - - [2048, 8192, 1, 8192, 2048, 2048, 8192, 8192]
    - [44, 5.736]
  - - [4096, 128, 1, 128, 4096, 4096, 128, 128]
    - [57, 1.312]
  - - [4096, 128, 1, 256, 4096, 4096, 256, 256]
    - [55, 2.018]
  - - [4096, 128, 1, 512, 4096, 4096, 512, 512]
    - [51, 2.911]
  - - [4096, 128, 1, 1024, 4096, 4096, 1024, 1024]
    - [106, 2.756]
  - - [4096, 128, 1, 2048, 4096, 4096, 2048, 2048]
    - [81, 3.486]
  - - [4096, 128, 1, 4096, 4096, 4096, 4096, 4096]
    - [69, 4.159]
  - - [4096, 128, 1, 8192, 4096, 4096, 8192, 8192]
    - [28, 4.993]
  - - [4096, 256, 1, 128, 4096, 4096, 128, 128]
    - [7, 1.728]
  - - [4096, 256, 1, 256, 4096, 4096, 256, 256]
    - [9, 2.368]
  - - [4096, 256, 1, 512, 4096, 4096, 512, 512]
    - [39, 3.368]
  - - [4096, 256, 1, 1024, 4096, 4096, 1024, 1024]
    - [82, 4.001]
  - - [4096, 256, 1, 2048, 4096, 4096, 2048, 2048]
    - [87, 4.44]
  - - [4096, 256, 1, 4096, 4096, 4096, 4096, 4096]
    - [53, 4.602]
  - - [4096, 256, 1, 8192, 4096, 4096, 8192, 8192]
    - [49, 5.457]
  - - [4096, 512, 1, 128, 4096, 4096, 128, 128]
    - [8, 1.951]
  - - [4096, 512, 1, 256, 4096, 4096, 256, 256]
    - [3, 2.924]
  - - [4096, 512, 1, 512, 4096, 4096, 512, 512]
    - [71, 4.196]
  - - [4096, 512, 1, 1024, 4096, 4096, 1024, 1024]
    - [68, 5.138]
  - - [4096, 512, 1, 2048, 4096, 4096, 2048, 2048]
    - [69, 5.507]
  - - [4096, 512, 1, 4096, 4096, 4096, 4096, 4096]
    - [40, 4.807]
  - - [4096, 512, 1, 8192, 4096, 4096, 8192, 8192]
    - [26, 5.65]
  - - [4096, 1024, 1, 128, 4096, 4096, 128, 128]
    - [17, 2.329]
  - - [4096, 1024, 1, 256, 4096, 4096, 256, 256]
    - [16, 3.152]
  - - [4096, 1024, 1, 512, 4096, 4096, 512, 512]
    - [4, 4.187]
  - - [4096, 1024, 1, 1024, 4096, 4096, 1024, 1024]
    - [43, 5.453]
  - - [4096, 1024, 1, 2048, 4096, 4096, 2048, 2048]
    - [39, 6.507]
  - - [4096, 1024, 1, 4096, 4096, 4096, 4096, 4096]
    - [22, 5.961]
  - - [4096, 1024, 1, 8192, 4096, 4096, 8192, 8192]
    - [22, 6.474]
  - - [4096, 2048, 1, 128, 4096, 4096, 128, 128]
    - [67, 2.087]
  - - [4096, 2048, 1, 256, 4096, 4096, 256, 256]
    - [64, 3.191]
  - - [4096, 2048, 1, 512, 4096, 4096, 512, 512]
    - [64, 4.006]
  - - [4096, 2048, 1, 1024, 4096, 4096, 1024, 1024]
    - [40, 4.898]
  - - [4096, 2048, 1, 2048, 4096, 4096, 2048, 2048]
    - [25, 5.734]
  - - [4096, 2048, 1, 4096, 4096, 4096, 4096, 4096]
    - [43, 6.18]
  - - [4096, 2048, 1, 8192, 4096, 4096, 8192, 8192]
    - [22, 7.12]
  - - [4096, 4096, 1, 128, 4096, 4096, 128, 128]
    - [59, 2.491]
  - - [4096, 4096, 1, 256, 4096, 4096, 256, 256]
    - [64, 3.273]
  - - [4096, 4096, 1, 512, 4096, 4096, 512, 512]
    - [66, 4.145]
  - - [4096, 4096, 1, 1024, 4096, 4096, 1024, 1024]
    - [38, 5.123]
  - - [4096, 4096, 1, 2048, 4096, 4096, 2048, 2048]
    - [43, 5.696]
  - - [4096, 4096, 1, 4096, 4096, 4096, 4096, 4096]
    - [31, 6.596]
  - - [4096, 4096, 1, 8192, 4096, 4096, 8192, 8192]
    - [33, 6.843]
  - - [4096, 8192, 1, 128, 4096, 4096, 128, 128]
    - [62, 2.3]
  - - [4096, 8192, 1, 256, 4096, 4096, 256, 256]
    - [69, 3.154]
  - - [4096, 8192, 1, 512, 4096, 4096, 512, 512]
    - [71, 4.026]
  - - [4096, 8192, 1, 1024, 4096, 4096, 1024, 1024]
    - [41, 5.015]
  - - [4096, 8192, 1, 2048, 4096, 4096, 2048, 2048]
    - [38, 5.633]
  - - [4096, 8192, 1, 4096, 4096, 4096, 4096, 4096]
    - [38, 5.598]
  - - [4096, 8192, 1, 8192, 4096, 4096, 8192, 8192]
    - [36, 5.843]
  - - [8192, 128, 1, 128, 8192, 8192, 128, 128]
    - [7, 1.681]
  - - [8192, 128, 1, 256, 8192, 8192, 256, 256]
    - [2, 2.366]
  - - [8192, 128, 1, 512, 8192, 8192, 512, 512]
    - [52, 3.258]
  - - [8192, 128, 1, 1024, 8192, 8192, 1024, 1024]
    - [82, 3.805]
  - - [8192, 128, 1, 2048, 8192, 8192, 2048, 2048]
    - [83, 4.131]
  - - [8192, 128, 1, 4096, 8192, 8192, 4096, 4096]
    - [50, 5.023]
  - - [8192, 128, 1, 8192, 8192, 8192, 8192, 8192]
    - [40, 5.643]
  - - [8192, 256, 1, 128, 8192, 8192, 128, 128]
    - [2, 1.927]
  - - [8192, 256, 1, 256, 8192, 8192, 256, 256]
    - [64, 2.829]
  - - [8192, 256, 1, 512, 8192, 8192, 512, 512]
    - [69, 4.146]
  - - [8192, 256, 1, 1024, 8192, 8192, 1024, 1024]
    - [50, 4.899]
  - - [8192, 256, 1, 2048, 8192, 8192, 2048, 2048]
    - [52, 5.185]
  - - [8192, 256, 1, 4096, 8192, 8192, 4096, 4096]
    - [48, 5.378]
  - - [8192, 256, 1, 8192, 8192, 8192, 8192, 8192]
    - [30, 6.398]
  - - [8192, 512, 1, 128, 8192, 8192, 128, 128]
    - [0, 2.288]
  - - [8192, 512, 1, 256, 8192, 8192, 256, 256]
    - [15, 3.282]
  - - [8192, 512, 1, 512, 8192, 8192, 512, 512]
    - [13, 4.173]
  - - [8192, 512, 1, 1024, 8192, 8192, 1024, 1024]
    - [43, 5.345]
  - - [8192, 512, 1, 2048, 8192, 8192, 2048, 2048]
    - [41, 6.006]
  - - [8192, 512, 1, 4096, 8192, 8192, 4096, 4096]
    - [27, 6.17]
  - - [8192, 512, 1, 8192, 8192, 8192, 8192, 8192]
    - [25, 6.705]
  - - [8192, 1024, 1, 128, 8192, 8192, 128, 128]
    - [84, 2.078]
  - - [8192, 1024, 1, 256, 8192, 8192, 256, 256]
    - [69, 3.171]
  - - [8192, 1024, 1, 512, 8192, 8192, 512, 512]
    - [71, 4.064]
  - - [8192, 1024, 1, 1024, 8192, 8192, 1024, 1024]
    - [38, 4.997]
  - - [8192, 1024, 1, 2048, 8192, 8192, 2048, 2048]
    - [26, 5.634]
  - - [8192, 1024, 1, 4096, 8192, 8192, 4096, 4096]
    - [23, 6.484]
  - - [8192, 1024, 1, 8192, 8192, 8192, 8192, 8192]
    - [27, 6.946]
  - - [8192, 2048, 1, 128, 8192, 8192, 128, 128]
    - [67, 2.435]
  - - [8192, 2048, 1, 256, 8192, 8192, 256, 256]
    - [64, 3.214]
  - - [8192, 2048, 1, 512, 8192, 8192, 512, 512]
    - [68, 4.151]
  - - [8192, 2048, 1, 1024, 8192, 8192, 1024, 1024]
    - [39, 5.026]
  - - [8192, 2048, 1, 2048, 8192, 8192, 2048, 2048]
    - [43, 5.896]
  - - [8192, 2048, 1, 4096, 8192, 8192, 4096, 4096]
    - [37, 6.581]
  - - [8192, 2048, 1, 8192, 8192, 8192, 8192, 8192]
    - [31, 6.9]
  - - [8192, 4096, 1, 128, 8192, 8192, 128, 128]
    - [67, 2.304]
  - - [8192, 4096, 1, 256, 8192, 8192, 256, 256]
    - [63, 3.073]
  - - [8192, 4096, 1, 512, 8192, 8192, 512, 512]
    - [69, 3.988]
  - - [8192, 4096, 1, 1024, 8192, 8192, 1024, 1024]
    - [40, 5.168]
  - - [8192, 4096, 1, 2048, 8192, 8192, 2048, 2048]
    - [43, 5.375]
  - - [8192, 4096, 1, 4096, 8192, 8192, 4096, 4096]
    - [34, 6.495]
  - - [8192, 4096, 1, 8192, 8192, 8192, 8192, 8192]
    - [24, 6.553]
  - - [8192, 8192, 1, 128, 8192, 8192, 128, 128]
    - [14, 2.129]
  - - [8192, 8192, 1, 256, 8192, 8192, 256, 256]
    - [60, 2.997]
  - - [8192, 8192, 1, 512, 8192, 8192, 512, 512]
    - [32, 3.879]
  - - [8192, 8192, 1, 1024, 8192, 8192, 1024, 1024]
    - [37, 4.708]
  - - [8192, 8192, 1, 2048, 8192, 8192, 2048, 2048]
    - [43, 5.436]
  - - [8192, 8192, 1, 4096, 8192, 8192, 4096, 4096]
    - [35, 5.741]
  - - [8192, 8192, 1, 8192, 8192, 8192, 8192, 8192]
    - [42, 5.516]
  - - [1, 1, 1, 32, 1, 1, 32, 32]
    - [114, 0.0]
- null
- null
- DeviceEfficiency
- GridBased
