library/src/amd_detail/rocblaslt/src/Tensile/Logic/streamk/gfx942_38cu/aquavanjaram942_Cijk_Ailk_Bljk_BSS_BH_UserArgs.yaml
- {MinimumRequiredVersion: 4.33.0}
- aquavanjaram942
- {Architecture: gfx942, CUCount: 38}
- [Device 0049, Device 0050]
    SolutionIndex: 0
    SolutionNameMin: Cijk_Ailk_Bljk_BSS_BH_UserArgs_MT256x256x32_MI16x16x1_SN_LDSB1_CLR1_GSU0_GSUC0_GSUWGMRR0_K1_LBSPPA2048_LBSPPB128_LPA32_MIWT8_8_PLR1_SU32_SUM0_SUS256_VWA2_VWB1_WGM1_WGMXCC1_WGMXCCGn1
    SolutionIndex: 1
    SolutionNameMin: Cijk_Ailk_Bljk_BSS_BH_UserArgs_MT256x256x32_MI16x16x1_SN_LDSB1_CLR1_GSU0_GSUC0_GSUWGMRR0_K1_LBSPPA2048_LBSPPB128_LPA0_MIWT8_8_PLR1_SU32_SUM0_SUS256_VWA4_VWB1_WGM1_WGMXCC1_WGMXCCGn1
    SolutionIndex: 2
    SolutionNameMin: Cijk_Ailk_Bljk_BSS_BH_UserArgs_MT256x256x32_MI16x16x1_SN_LDSB1_CLR1_GSU0_GSUC0_GSUWGMRR0_K1_LBSPPA2048_LBSPPB128_LPA0_MIWT8_8_PLR1_SU32_SUM0_SUS256_VWA4_VWB2_WGM1_WGMXCC1_WGMXCCGn1
    SolutionIndex: 3
    SolutionNameMin: Cijk_Ailk_Bljk_BSS_BH_UserArgs_MT256x256x32_MI16x16x1_SN_LDSB1_CLR1_GSU0_GSUC0_GSUWGMRR0_K1_LBSPPA2048_LBSPPB256_LPA0_MIWT8_8_PLR1_SU32_SUM0_SUS256_VWA4_VWB4_WGM1_WGMXCC1_WGMXCCGn1
    SolutionIndex: 4
    SolutionNameMin: Cijk_Ailk_Bljk_BSS_BH_UserArgs_MT256x256x32_MI16x16x1_SN_LDSB1_CLR1_GSU0_GSUC0_GSUWGMRR0_K1_LBSPPA2048_LBSPPB512_LPA0_MIWT8_8_PLR1_SU32_SUM0_SUS256_VWA4_VWB8_WGM1_WGMXCC1_WGMXCCGn1
    SolutionIndex: 5
    SolutionNameMin: Cijk_Ailk_Bljk_BSS_BH_UserArgs_MT256x256x32_MI16x16x1_SN_LDSB1_CLR1_GSU0_GSUC0_GSUWGMRR0_K1_LBSPPA2048_LBSPPB256_LPA0_MIWT8_8_PLR1_SU32_SUM0_SUS256_VWA4_VWB4_WGM4_WGMXCC1_WGMXCCGn1
    SolutionIndex: 6
    SolutionNameMin: Cijk_Ailk_Bljk_BSS_BH_UserArgs_MT256x256x32_MI16x16x1_SN_LDSB1_CLR1_GSU0_GSUC0_GSUWGMRR0_K1_LBSPPA2048_LBSPPB512_LPA0_MIWT8_8_PLR1_SU32_SUM0_SUS256_VWA4_VWB8_WGM8_WGMXCC1_WGMXCCGn1
    SolutionIndex: 7
    SolutionNameMin: Cijk_Ailk_Bljk_BSS_BH_UserArgs_MT128x256x32_MI16x16x1_SN_LDSB1_CLR1_GSU0_GSUC0_GSUWGMRR0_K1_LBSPPA1024_LBSPPB128_LPA16_MIWT4_8_PLR1_SU32_SUM0_SUS256_VWA1_VWB1_WGM1_WGMXCC1_WGMXCCGn1
    SolutionIndex: 8
    SolutionNameMin: Cijk_Ailk_Bljk_BSS_BH_UserArgs_MT256x128x32_MI16x16x1_SN_LDSB1_CLR1_GSU0_GSUC0_GSUWGMRR0_K1_LBSPPA2048_LBSPPB128_LPA16_MIWT8_4_PLR1_SU32_SUM0_SUS256_VWA1_VWB1_WGM1_WGMXCC1_WGMXCCGn1
    SolutionIndex: 9
    SolutionNameMin: Cijk_Ailk_Bljk_BSS_BH_UserArgs_MT256x128x32_MI16x16x1_SN_LDSB1_CLR1_GSU0_GSUC0_GSUWGMRR0_K1_LBSPPA2048_LBSPPB128_LPA0_MIWT8_4_PLR1_SU32_SUM0_SUS256_VWA4_VWB1_WGM1_WGMXCC1_WGMXCCGn1
    SolutionIndex: 10
    SolutionNameMin: Cijk_Ailk_Bljk_BSS_BH_UserArgs_MT256x128x32_MI16x16x1_SN_LDSB1_CLR1_GSU0_GSUC0_GSUWGMRR0_K1_LBSPPA2048_LBSPPB128_LPA0_MIWT8_4_PLR1_SU32_SUM0_SUS256_VWA4_VWB2_WGM1_WGMXCC1_WGMXCCGn1
    SolutionIndex: 11
    SolutionNameMin: Cijk_Ailk_Bljk_BSS_BH_UserArgs_MT256x128x32_MI16x16x1_SN_LDSB1_CLR1_GSU0_GSUC0_GSUWGMRR0_K1_LBSPPA2048_LBSPPB128_LPA0_MIWT8_4_PLR1_SU32_SUM0_SUS256_VWA8_VWB2_WGM1_WGMXCC1_WGMXCCGn1
    SolutionIndex: 12
    SolutionNameMin: Cijk_Ailk_Bljk_BSS_BH_UserArgs_MT256x128x32_MI16x16x1_SN_LDSB1_CLR1_GSU0_GSUC0_GSUWGMRR0_K1_LBSPPA2048_LBSPPB256_LPA0_MIWT8_4_PLR1_SU32_SUM0_SUS256_VWA4_VWB4_WGM1_WGMXCC1_WGMXCCGn1
    SolutionIndex: 13
    SolutionNameMin: Cijk_Ailk_Bljk_BSS_BH_UserArgs_MT256x128x32_MI16x16x1_SN_LDSB1_CLR1_GSU0_GSUC0_GSUWGMRR0_K1_LBSPPA2048_LBSPPB128_LPA0_MIWT8_4_PLR1_SU32_SUM0_SUS256_VWA4_VWB1_WGM4_WGMXCC1_WGMXCCGn1
    SolutionIndex: 14
    SolutionNameMin: Cijk_Ailk_Bljk_BSS_BH_UserArgs_MT256x128x32_MI16x16x1_SN_LDSB1_CLR1_GSU0_GSUC0_GSUWGMRR0_K1_LBSPPA2048_LBSPPB128_LPA0_MIWT8_4_PLR1_SU32_SUM0_SUS256_VWA4_VWB2_WGM4_WGMXCC1_WGMXCCGn1
    SolutionIndex: 15
    SolutionNameMin: Cijk_Ailk_Bljk_BSS_BH_UserArgs_MT256x128x32_MI16x16x1_SN_LDSB1_CLR1_GSU0_GSUC0_GSUWGMRR0_K1_LBSPPA2048_LBSPPB256_LPA0_MIWT8_4_PLR1_SU32_SUM0_SUS256_VWA4_VWB4_WGM4_WGMXCC1_WGMXCCGn1
    SolutionIndex: 16
    SolutionNameMin: Cijk_Ailk_Bljk_BSS_BH_UserArgs_MT256x128x32_MI16x16x1_SN_LDSB1_CLR1_GSU0_GSUC0_GSUWGMRR0_K1_LBSPPA2048_LBSPPB128_LPA32_MIWT8_4_PLR1_SU32_SUM0_SUS256_VWA2_VWB1_WGM8_WGMXCC1_WGMXCCGn1
    SolutionIndex: 17
    SolutionNameMin: Cijk_Ailk_Bljk_BSS_BH_UserArgs_MT256x128x32_MI16x16x1_SN_LDSB1_CLR1_GSU0_GSUC0_GSUWGMRR0_K1_LBSPPA2048_LBSPPB128_LPA0_MIWT8_4_PLR1_SU32_SUM0_SUS256_VWA4_VWB1_WGM8_WGMXCC1_WGMXCCGn1
    SolutionIndex: 18
    SolutionNameMin: Cijk_Ailk_Bljk_BSS_BH_UserArgs_MT256x128x32_MI16x16x1_SN_LDSB1_CLR1_GSU0_GSUC0_GSUWGMRR0_K1_LBSPPA2048_LBSPPB128_LPA0_MIWT8_4_PLR1_SU32_SUM0_SUS256_VWA4_VWB2_WGM8_WGMXCC1_WGMXCCGn1
    SolutionIndex: 19
    SolutionNameMin: Cijk_Ailk_Bljk_BSS_BH_UserArgs_MT256x128x32_MI16x16x1_SN_LDSB1_CLR1_GSU0_GSUC0_GSUWGMRR0_K1_LBSPPA2048_LBSPPB256_LPA16_MIWT8_4_PLR1_SU32_SUM0_SUS256_VWA1_VWB4_WGM8_WGMXCC1_WGMXCCGn1
    SolutionIndex: 20
    SolutionNameMin: Cijk_Ailk_Bljk_BSS_BH_UserArgs_MT256x128x32_MI16x16x1_SN_LDSB1_CLR1_GSU0_GSUC0_GSUWGMRR0_K1_LBSPPA2048_LBSPPB256_LPA0_MIWT8_4_PLR1_SU32_SUM0_SUS256_VWA4_VWB4_WGM8_WGMXCC1_WGMXCCGn1
    SolutionIndex: 21
    SolutionNameMin: Cijk_Ailk_Bljk_BSS_BH_UserArgs_MT256x64x32_MI16x16x1_SN_LDSB1_CLR1_GSU0_GSUC0_GSUWGMRR0_K1_LBSPPA2048_LBSPPB128_LPA0_MIWT8_2_PLR1_SU32_SUM0_SUS256_VWA4_VWB1_WGM1_WGMXCC1_WGMXCCGn1
    SolutionIndex: 22
    SolutionNameMin: Cijk_Ailk_Bljk_BSS_BH_UserArgs_MT256x64x32_MI16x16x1_SN_LDSB1_CLR1_GSU0_GSUC0_GSUWGMRR0_K1_LBSPPA2048_LBSPPB128_LPA0_MIWT8_2_PLR1_SU32_SUM0_SUS256_VWA4_VWB2_WGM1_WGMXCC1_WGMXCCGn1
    SolutionIndex: 23
    SolutionNameMin: Cijk_Ailk_Bljk_BSS_BH_UserArgs_MT256x64x32_MI16x16x1_SN_LDSB1_CLR1_GSU0_GSUC0_GSUWGMRR0_K1_LBSPPA2048_LBSPPB128_LPA0_MIWT8_2_PLR1_SU32_SUM0_SUS256_VWA4_VWB1_WGM4_WGMXCC1_WGMXCCGn1
    SolutionIndex: 24
    SolutionNameMin: Cijk_Ailk_Bljk_BSS_BH_UserArgs_MT256x64x32_MI16x16x1_SN_LDSB1_CLR1_GSU0_GSUC0_GSUWGMRR0_K1_LBSPPA2048_LBSPPB128_LPA0_MIWT8_2_PLR1_SU32_SUM0_SUS256_VWA4_VWB2_WGM4_WGMXCC1_WGMXCCGn1
    SolutionIndex: 25
    SolutionNameMin: Cijk_Ailk_Bljk_BSS_BH_UserArgs_MT256x64x32_MI16x16x1_SN_LDSB1_CLR1_GSU0_GSUC0_GSUWGMRR0_K1_LBSPPA2048_LBSPPB128_LPA0_MIWT8_2_PLR1_SU32_SUM0_SUS256_VWA4_VWB1_WGM8_WGMXCC1_WGMXCCGn1
    SolutionIndex: 26
    SolutionNameMin: Cijk_Ailk_Bljk_BSS_BH_UserArgs_MT256x64x32_MI16x16x1_SN_LDSB1_CLR1_GSU0_GSUC0_GSUWGMRR0_K1_LBSPPA2048_LBSPPB128_LPA0_MIWT8_2_PLR1_SU32_SUM0_SUS256_VWA4_VWB2_WGM8_WGMXCC1_WGMXCCGn1
    SolutionIndex: 27
    SolutionNameMin: Cijk_Ailk_Bljk_BSS_BH_UserArgs_MT128x128x32_MI16x16x1_SN_LDSB1_CLR1_GSU0_GSUC0_GSUWGMRR0_K1_LBSPPA1024_LBSPPB128_LPA16_MIWT4_4_PLR1_SU32_SUM0_SUS256_VWA1_VWB1_WGM1_WGMXCC1_WGMXCCGn1
    SolutionIndex: 28
    SolutionNameMin: Cijk_Ailk_Bljk_BSS_BH_UserArgs_MT128x128x32_MI16x16x1_SN_LDSB1_CLR1_GSU0_GSUC0_GSUWGMRR0_K1_LBSPPA1024_LBSPPB128_LPA0_MIWT4_4_PLR1_SU32_SUM0_SUS256_VWA4_VWB1_WGM1_WGMXCC1_WGMXCCGn1
    SolutionIndex: 29
    SolutionNameMin: Cijk_Ailk_Bljk_BSS_BH_UserArgs_MT128x128x32_MI16x16x1_SN_LDSB1_CLR1_GSU0_GSUC0_GSUWGMRR0_K1_LBSPPA1024_LBSPPB128_LPA0_MIWT4_4_PLR1_SU32_SUM0_SUS256_VWA4_VWB2_WGM1_WGMXCC1_WGMXCCGn1
    SolutionIndex: 30
    SolutionNameMin: Cijk_Ailk_Bljk_BSS_BH_UserArgs_MT128x128x32_MI16x16x1_SN_LDSB1_CLR1_GSU0_GSUC0_GSUWGMRR0_K1_LBSPPA1024_LBSPPB256_LPA0_MIWT4_4_PLR1_SU32_SUM0_SUS256_VWA4_VWB4_WGM1_WGMXCC1_WGMXCCGn1
    SolutionIndex: 31
    SolutionNameMin: Cijk_Ailk_Bljk_BSS_BH_UserArgs_MT128x128x32_MI16x16x1_SN_LDSB1_CLR1_GSU0_GSUC0_GSUWGMRR0_K1_LBSPPA1024_LBSPPB128_LPA16_MIWT4_4_PLR1_SU32_SUM0_SUS256_VWA1_VWB1_WGM4_WGMXCC1_WGMXCCGn1
    SolutionIndex: 32
    SolutionNameMin: Cijk_Ailk_Bljk_BSS_BH_UserArgs_MT128x128x32_MI16x16x1_SN_LDSB1_CLR1_GSU0_GSUC0_GSUWGMRR0_K1_LBSPPA1024_LBSPPB128_LPA0_MIWT4_4_PLR1_SU32_SUM0_SUS256_VWA4_VWB1_WGM4_WGMXCC1_WGMXCCGn1
    SolutionIndex: 33
    SolutionNameMin: Cijk_Ailk_Bljk_BSS_BH_UserArgs_MT128x128x32_MI16x16x1_SN_LDSB1_CLR1_GSU0_GSUC0_GSUWGMRR0_K1_LBSPPA1024_LBSPPB128_LPA16_MIWT4_4_PLR1_SU32_SUM0_SUS256_VWA1_VWB2_WGM4_WGMXCC1_WGMXCCGn1
    SolutionIndex: 34
    SolutionNameMin: Cijk_Ailk_Bljk_BSS_BH_UserArgs_MT128x128x32_MI16x16x1_SN_LDSB1_CLR1_GSU0_GSUC0_GSUWGMRR0_K1_LBSPPA1024_LBSPPB128_LPA0_MIWT4_4_PLR1_SU32_SUM0_SUS256_VWA4_VWB2_WGM4_WGMXCC1_WGMXCCGn1
    SolutionIndex: 35
    SolutionNameMin: Cijk_Ailk_Bljk_BSS_BH_UserArgs_MT128x128x32_MI16x16x1_SN_LDSB1_CLR1_GSU0_GSUC0_GSUWGMRR0_K1_LBSPPA1024_LBSPPB256_LPA0_MIWT4_4_PLR1_SU32_SUM0_SUS256_VWA4_VWB4_WGM4_WGMXCC1_WGMXCCGn1
    SolutionIndex: 36
    SolutionNameMin: Cijk_Ailk_Bljk_BSS_BH_UserArgs_MT128x128x32_MI16x16x1_SN_LDSB1_CLR1_GSU0_GSUC0_GSUWGMRR0_K1_LBSPPA1024_LBSPPB128_LPA16_MIWT4_4_PLR1_SU32_SUM0_SUS256_VWA1_VWB1_WGM8_WGMXCC1_WGMXCCGn1
    SolutionIndex: 37
    SolutionNameMin: Cijk_Ailk_Bljk_BSS_BH_UserArgs_MT128x128x32_MI16x16x1_SN_LDSB1_CLR1_GSU0_GSUC0_GSUWGMRR0_K1_LBSPPA1024_LBSPPB128_LPA0_MIWT4_4_PLR1_SU32_SUM0_SUS256_VWA4_VWB1_WGM8_WGMXCC1_WGMXCCGn1
    SolutionIndex: 38
    SolutionNameMin: Cijk_Ailk_Bljk_BSS_BH_UserArgs_MT128x128x32_MI16x16x1_SN_LDSB1_CLR1_GSU0_GSUC0_GSUWGMRR0_K1_LBSPPA1024_LBSPPB128_LPA16_MIWT4_4_PLR1_SU32_SUM0_SUS256_VWA1_VWB2_WGM8_WGMXCC1_WGMXCCGn1
    SolutionIndex: 39
    SolutionNameMin: Cijk_Ailk_Bljk_BSS_BH_UserArgs_MT128x128x32_MI16x16x1_SN_LDSB1_CLR1_GSU0_GSUC0_GSUWGMRR0_K1_LBSPPA1024_LBSPPB256_LPA16_MIWT4_4_PLR1_SU32_SUM0_SUS256_VWA1_VWB4_WGM8_WGMXCC1_WGMXCCGn1
    SolutionIndex: 40
    SolutionNameMin: Cijk_Ailk_Bljk_BSS_BH_UserArgs_MT128x64x32_MI16x16x1_SN_LDSB0_CLR1_GSU0_GSUC0_GSUWGMRR0_K1_LBSPPA1024_LBSPPB128_LPA0_MIWT4_2_PLR1_SU32_SUM0_SUS256_VWA4_VWB1_WGM1_WGMXCC1_WGMXCCGn1
    SolutionIndex: 41
    SolutionNameMin: Cijk_Ailk_Bljk_BSS_BH_UserArgs_MT128x64x32_MI16x16x1_SN_LDSB0_CLR1_GSU0_GSUC0_GSUWGMRR0_K1_LBSPPA1024_LBSPPB128_LPA32_MIWT4_2_PLR1_SU32_SUM0_SUS256_VWA2_VWB2_WGM1_WGMXCC1_WGMXCCGn1
    SolutionIndex: 42
    SolutionNameMin: Cijk_Ailk_Bljk_BSS_BH_UserArgs_MT128x64x32_MI16x16x1_SN_LDSB0_CLR1_GSU0_GSUC0_GSUWGMRR0_K1_LBSPPA1024_LBSPPB128_LPA0_MIWT4_2_PLR1_SU32_SUM0_SUS256_VWA4_VWB2_WGM1_WGMXCC1_WGMXCCGn1
    SolutionIndex: 43
    SolutionNameMin: Cijk_Ailk_Bljk_BSS_BH_UserArgs_MT128x64x32_MI16x16x1_SN_LDSB0_CLR1_GSU0_GSUC0_GSUWGMRR0_K1_LBSPPA1024_LBSPPB128_LPA32_MIWT4_2_PLR1_SU32_SUM0_SUS256_VWA2_VWB1_WGM4_WGMXCC1_WGMXCCGn1
    SolutionIndex: 44
    SolutionNameMin: Cijk_Ailk_Bljk_BSS_BH_UserArgs_MT128x64x32_MI16x16x1_SN_LDSB0_CLR1_GSU0_GSUC0_GSUWGMRR0_K1_LBSPPA1024_LBSPPB128_LPA0_MIWT4_2_PLR1_SU32_SUM0_SUS256_VWA4_VWB1_WGM8_WGMXCC1_WGMXCCGn1
    SolutionIndex: 45
    SolutionNameMin: Cijk_Ailk_Bljk_BSS_BH_UserArgs_MT128x64x32_MI16x16x1_SN_LDSB0_CLR1_GSU0_GSUC0_GSUWGMRR0_K1_LBSPPA1024_LBSPPB128_LPA0_MIWT4_2_PLR1_SU32_SUM0_SUS256_VWA4_VWB2_WGM8_WGMXCC1_WGMXCCGn1
    SolutionIndex: 46
    SolutionNameMin: Cijk_Ailk_Bljk_BSS_BH_UserArgs_MT64x64x32_MI16x16x1_SN_LDSB0_CLR1_GSU0_GSUC0_GSUWGMRR0_K1_LBSPPA512_LBSPPB128_LPA32_MIWT2_2_PLR1_SU32_SUM0_SUS256_VWA2_VWB1_WGM1_WGMXCC1_WGMXCCGn1
    SolutionIndex: 47
    SolutionNameMin: Cijk_Ailk_Bljk_BSS_BH_UserArgs_MT64x64x32_MI16x16x1_SN_LDSB0_CLR1_GSU0_GSUC0_GSUWGMRR0_K1_LBSPPA512_LBSPPB128_LPA16_MIWT2_2_PLR1_SU32_SUM0_SUS256_VWA1_VWB2_WGM4_WGMXCC1_WGMXCCGn1
    SolutionIndex: 48
    SolutionNameMin: Cijk_Ailk_Bljk_BSS_BH_UserArgs_MT32x64x32_MI16x16x1_SN_LDSB0_CLR0_GSU0_GSUC0_GSUWGMRR0_K1_LBSPPA256_LBSPPB128_LPA16_MIWT1_2_PLR0_SU32_SUM0_SUS256_VWA1_VWB1_WGM1_WGMXCC1_WGMXCCGn1
    SolutionIndex: 49
    SolutionNameMin: Cijk_Ailk_Bljk_BSS_BH_UserArgs_MT32x32x32_MI16x16x1_SN_LDSB0_CLR1_GSU0_GSUC0_GSUWGMRR0_K1_LBSPPA256_LBSPPB128_LPA16_MIWT1_1_PLR1_SU32_SUM0_SUS256_VWA1_VWB1_WGM1_WGMXCC1_WGMXCCGn1
    SolutionIndex: 50
    SolutionNameMin: Cijk_Ailk_Bljk_BSS_BH_UserArgs_MT32x32x32_MI16x16x1_SN_LDSB0_CLR0_GSU0_GSUC0_GSUWGMRR0_K1_LBSPPA256_LBSPPB128_LPA16_MIWT1_1_PLR0_SU32_SUM0_SUS256_VWA1_VWB1_WGM1_WGMXCC1_WGMXCCGn1
    SolutionIndex: 51
    SolutionNameMin: Cijk_Ailk_Bljk_BSS_BH_UserArgs_MT128x256x64_MI16x16x1_SN_LDSB1_CLR1_GSU0_GSUC0_GSUWGMRR0_K1_LBSPPA2048_LBSPPB256_LPA0_MIWT4_8_PLR1_SU32_SUM0_SUS256_VWA4_VWB2_WGM1_WGMXCC1_WGMXCCGn1
    SolutionIndex: 52
    SolutionNameMin: Cijk_Ailk_Bljk_BSS_BH_UserArgs_MT128x256x64_MI16x16x1_SN_LDSB1_CLR1_GSU0_GSUC0_GSUWGMRR0_K1_LBSPPA2048_LBSPPB512_LPA0_MIWT4_8_PLR1_SU32_SUM0_SUS256_VWA4_VWB4_WGM1_WGMXCC1_WGMXCCGn1
    SolutionIndex: 53
    SolutionNameMin: Cijk_Ailk_Bljk_BSS_BH_UserArgs_MT128x256x64_MI16x16x1_SN_LDSB1_CLR1_GSU0_GSUC0_GSUWGMRR0_K1_LBSPPA2048_LBSPPB256_LPA0_MIWT4_8_PLR1_SU32_SUM0_SUS256_VWA4_VWB2_WGM8_WGMXCC1_WGMXCCGn1
    SolutionIndex: 54
    SolutionNameMin: Cijk_Ailk_Bljk_BSS_BH_UserArgs_MT128x256x64_MI16x16x1_SN_LDSB1_CLR1_GSU0_GSUC0_GSUWGMRR0_K1_LBSPPA2048_LBSPPB512_LPA0_MIWT4_8_PLR1_SU32_SUM0_SUS256_VWA4_VWB4_WGM8_WGMXCC1_WGMXCCGn1
    SolutionIndex: 55
    SolutionNameMin: Cijk_Ailk_Bljk_BSS_BH_UserArgs_MT256x128x64_MI16x16x1_SN_LDSB1_CLR1_GSU0_GSUC0_GSUWGMRR0_K1_LBSPPA4096_LBSPPB128_LPA0_MIWT8_4_PLR1_SU32_SUM0_SUS256_VWA4_VWB1_WGM1_WGMXCC1_WGMXCCGn1
    SolutionIndex: 56
    SolutionNameMin: Cijk_Ailk_Bljk_BSS_BH_UserArgs_MT256x128x64_MI16x16x1_SN_LDSB1_CLR1_GSU0_GSUC0_GSUWGMRR0_K1_LBSPPA4096_LBSPPB512_LPA0_MIWT8_4_PLR1_SU32_SUM0_SUS256_VWA4_VWB4_WGM4_WGMXCC1_WGMXCCGn1
    SolutionIndex: 57
    SolutionNameMin: Cijk_Ailk_Bljk_BSS_BH_UserArgs_MT256x128x64_MI16x16x1_SN_LDSB1_CLR1_GSU0_GSUC0_GSUWGMRR0_K1_LBSPPA4096_LBSPPB128_LPA0_MIWT8_4_PLR1_SU32_SUM0_SUS256_VWA4_VWB1_WGM8_WGMXCC1_WGMXCCGn1
    SolutionIndex: 58
    SolutionNameMin: Cijk_Ailk_Bljk_BSS_BH_UserArgs_MT128x128x64_MI16x16x1_SN_LDSB1_CLR1_GSU0_GSUC0_GSUWGMRR0_K1_LBSPPA2048_LBSPPB128_LPA0_MIWT4_4_PLR1_SU32_SUM0_SUS256_VWA4_VWB1_WGM1_WGMXCC1_WGMXCCGn1
    SolutionIndex: 59
    SolutionNameMin: Cijk_Ailk_Bljk_BSS_BH_UserArgs_MT128x128x64_MI16x16x1_SN_LDSB1_CLR1_GSU0_GSUC0_GSUWGMRR0_K1_LBSPPA2048_LBSPPB256_LPA0_MIWT4_4_PLR1_SU32_SUM0_SUS256_VWA4_VWB2_WGM1_WGMXCC1_WGMXCCGn1
    SolutionIndex: 60
    SolutionNameMin: Cijk_Ailk_Bljk_BSS_BH_UserArgs_MT128x128x64_MI16x16x1_SN_LDSB1_CLR1_GSU0_GSUC0_GSUWGMRR0_K1_LBSPPA2048_LBSPPB512_LPA0_MIWT4_4_PLR1_SU32_SUM0_SUS256_VWA4_VWB4_WGM1_WGMXCC1_WGMXCCGn1
    SolutionIndex: 61
    SolutionNameMin: Cijk_Ailk_Bljk_BSS_BH_UserArgs_MT128x128x64_MI16x16x1_SN_LDSB1_CLR1_GSU0_GSUC0_GSUWGMRR0_K1_LBSPPA2048_LBSPPB256_LPA0_MIWT4_4_PLR1_SU32_SUM0_SUS256_VWA4_VWB2_WGM4_WGMXCC1_WGMXCCGn1
    SolutionIndex: 62
    SolutionNameMin: Cijk_Ailk_Bljk_BSS_BH_UserArgs_MT128x128x64_MI16x16x1_SN_LDSB1_CLR1_GSU0_GSUC0_GSUWGMRR0_K1_LBSPPA2048_LBSPPB256_LPA0_MIWT4_4_PLR1_SU32_SUM0_SUS256_VWA4_VWB2_WGM8_WGMXCC1_WGMXCCGn1
    SolutionIndex: 63
    SolutionNameMin: Cijk_Ailk_Bljk_BSS_BH_UserArgs_MT128x128x64_MI16x16x1_SN_LDSB1_CLR1_GSU0_GSUC0_GSUWGMRR0_K1_LBSPPA2048_LBSPPB512_LPA0_MIWT4_4_PLR1_SU32_SUM0_SUS256_VWA4_VWB4_WGM8_WGMXCC1_WGMXCCGn1
    SolutionIndex: 64
    SolutionNameMin: Cijk_Ailk_Bljk_BSS_BH_UserArgs_MT128x64x64_MI16x16x1_SN_LDSB1_CLR1_GSU0_GSUC0_GSUWGMRR0_K1_LBSPPA2048_LBSPPB128_LPA0_MIWT4_2_PLR1_SU32_SUM0_SUS256_VWA4_VWB1_WGM1_WGMXCC1_WGMXCCGn1
    SolutionIndex: 65
    SolutionNameMin: Cijk_Ailk_Bljk_BSS_BH_UserArgs_MT128x64x64_MI16x16x1_SN_LDSB1_CLR1_GSU0_GSUC0_GSUWGMRR0_K1_LBSPPA2048_LBSPPB256_LPA32_MIWT4_2_PLR1_SU32_SUM0_SUS256_VWA2_VWB2_WGM1_WGMXCC1_WGMXCCGn1
    SolutionIndex: 66
    SolutionNameMin: Cijk_Ailk_Bljk_BSS_BH_UserArgs_MT128x64x64_MI16x16x1_SN_LDSB1_CLR1_GSU0_GSUC0_GSUWGMRR0_K1_LBSPPA2048_LBSPPB256_LPA0_MIWT4_2_PLR1_SU32_SUM0_SUS256_VWA4_VWB2_WGM1_WGMXCC1_WGMXCCGn1
    SolutionIndex: 67
    SolutionNameMin: Cijk_Ailk_Bljk_BSS_BH_UserArgs_MT128x64x64_MI16x16x1_SN_LDSB1_CLR1_GSU0_GSUC0_GSUWGMRR0_K1_LBSPPA2048_LBSPPB128_LPA0_MIWT4_2_PLR1_SU32_SUM0_SUS256_VWA4_VWB1_WGM4_WGMXCC1_WGMXCCGn1
    SolutionIndex: 68
    SolutionNameMin: Cijk_Ailk_Bljk_BSS_BH_UserArgs_MT128x64x64_MI16x16x1_SN_LDSB1_CLR1_GSU0_GSUC0_GSUWGMRR0_K1_LBSPPA2048_LBSPPB256_LPA0_MIWT4_2_PLR1_SU32_SUM0_SUS256_VWA4_VWB2_WGM4_WGMXCC1_WGMXCCGn1
    SolutionIndex: 69
    SolutionNameMin: Cijk_Ailk_Bljk_BSS_BH_UserArgs_MT128x64x64_MI16x16x1_SN_LDSB1_CLR1_GSU0_GSUC0_GSUWGMRR0_K1_LBSPPA2048_LBSPPB128_LPA0_MIWT4_2_PLR2_SU32_SUM0_SUS256_VWA4_VWB1_WGM4_WGMXCC1_WGMXCCGn1
    SolutionIndex: 70
    SolutionNameMin: Cijk_Ailk_Bljk_BSS_BH_UserArgs_MT128x64x64_MI16x16x1_SN_LDSB1_CLR1_GSU0_GSUC0_GSUWGMRR0_K1_LBSPPA2048_LBSPPB128_LPA32_MIWT4_2_PLR1_SU32_SUM0_SUS256_VWA2_VWB1_WGM8_WGMXCC1_WGMXCCGn1
    SolutionIndex: 71
    SolutionNameMin: Cijk_Ailk_Bljk_BSS_BH_UserArgs_MT128x64x64_MI16x16x1_SN_LDSB1_CLR1_GSU0_GSUC0_GSUWGMRR0_K1_LBSPPA2048_LBSPPB128_LPA0_MIWT4_2_PLR1_SU32_SUM0_SUS256_VWA4_VWB1_WGM8_WGMXCC1_WGMXCCGn1
    SolutionIndex: 72
    SolutionNameMin: Cijk_Ailk_Bljk_BSS_BH_UserArgs_MT128x64x64_MI16x16x1_SN_LDSB1_CLR1_GSU0_GSUC0_GSUWGMRR0_K1_LBSPPA2048_LBSPPB256_LPA0_MIWT4_2_PLR1_SU32_SUM0_SUS256_VWA4_VWB2_WGM8_WGMXCC1_WGMXCCGn1
    SolutionIndex: 73
    SolutionNameMin: Cijk_Ailk_Bljk_BSS_BH_UserArgs_MT64x64x64_MI16x16x1_SN_LDSB1_CLR1_GSU0_GSUC0_GSUWGMRR0_K1_LBSPPA1024_LBSPPB128_LPA32_MIWT2_2_PLR1_SU32_SUM0_SUS256_VWA2_VWB1_WGM1_WGMXCC1_WGMXCCGn1
    SolutionIndex: 74
    SolutionNameMin: Cijk_Ailk_Bljk_BSS_BH_UserArgs_MT64x64x64_MI16x16x1_SN_LDSB1_CLR1_GSU0_GSUC0_GSUWGMRR0_K1_LBSPPA1024_LBSPPB256_LPA16_MIWT2_2_PLR1_SU32_SUM0_SUS256_VWA1_VWB2_WGM1_WGMXCC1_WGMXCCGn1
    SolutionIndex: 75
    SolutionNameMin: Cijk_Ailk_Bljk_BSS_BH_UserArgs_MT64x64x64_MI16x16x1_SN_LDSB1_CLR1_GSU0_GSUC0_GSUWGMRR0_K1_LBSPPA1024_LBSPPB256_LPA32_MIWT2_2_PLR1_SU32_SUM0_SUS256_VWA2_VWB2_WGM1_WGMXCC1_WGMXCCGn1
    SolutionIndex: 76
    SolutionNameMin: Cijk_Ailk_Bljk_BSS_BH_UserArgs_MT64x64x64_MI16x16x1_SN_LDSB1_CLR1_GSU0_GSUC0_GSUWGMRR0_K1_LBSPPA1024_LBSPPB128_LPA32_MIWT2_2_PLR2_SU32_SUM0_SUS256_VWA2_VWB1_WGM1_WGMXCC1_WGMXCCGn1
    SolutionIndex: 77
    SolutionNameMin: Cijk_Ailk_Bljk_BSS_BH_UserArgs_MT64x64x64_MI16x16x1_SN_LDSB1_CLR1_GSU0_GSUC0_GSUWGMRR0_K1_LBSPPA1024_LBSPPB128_LPA32_MIWT2_2_PLR1_SU32_SUM0_SUS256_VWA2_VWB1_WGM4_WGMXCC1_WGMXCCGn1
    SolutionIndex: 78
    SolutionNameMin: Cijk_Ailk_Bljk_BSS_BH_UserArgs_MT64x64x64_MI16x16x1_SN_LDSB1_CLR1_GSU0_GSUC0_GSUWGMRR0_K1_LBSPPA1024_LBSPPB256_LPA32_MIWT2_2_PLR1_SU32_SUM0_SUS256_VWA2_VWB2_WGM4_WGMXCC1_WGMXCCGn1
    SolutionIndex: 79
    SolutionNameMin: Cijk_Ailk_Bljk_BSS_BH_UserArgs_MT64x64x64_MI16x16x1_SN_LDSB1_CLR1_GSU0_GSUC0_GSUWGMRR0_K1_LBSPPA1024_LBSPPB128_LPA16_MIWT2_2_PLR1_SU32_SUM0_SUS256_VWA1_VWB1_WGM8_WGMXCC1_WGMXCCGn1
    SolutionIndex: 80
    SolutionNameMin: Cijk_Ailk_Bljk_BSS_BH_UserArgs_MT64x64x64_MI16x16x1_SN_LDSB1_CLR1_GSU0_GSUC0_GSUWGMRR0_K1_LBSPPA1024_LBSPPB128_LPA32_MIWT2_2_PLR1_SU32_SUM0_SUS256_VWA2_VWB1_WGM8_WGMXCC1_WGMXCCGn1
    SolutionIndex: 81
    SolutionNameMin: Cijk_Ailk_Bljk_BSS_BH_UserArgs_MT64x64x64_MI16x16x1_SN_LDSB1_CLR1_GSU0_GSUC0_GSUWGMRR0_K1_LBSPPA1024_LBSPPB256_LPA32_MIWT2_2_PLR1_SU32_SUM0_SUS256_VWA2_VWB2_WGM8_WGMXCC1_WGMXCCGn1
    SolutionIndex: 82
    SolutionNameMin: Cijk_Ailk_Bljk_BSS_BH_UserArgs_MT64x64x64_MI16x16x1_SN_LDSB1_CLR1_GSU0_GSUC0_GSUWGMRR0_K1_LBSPPA1024_LBSPPB256_LPA32_MIWT2_2_PLR2_SU32_SUM0_SUS256_VWA2_VWB2_WGM8_WGMXCC1_WGMXCCGn1
    SolutionIndex: 83
    SolutionNameMin: Cijk_Ailk_Bljk_BSS_BH_UserArgs_MT32x64x64_MI16x16x1_SN_LDSB0_CLR1_GSU0_GSUC0_GSUWGMRR0_K1_LBSPPA512_LBSPPB256_LPA16_MIWT1_2_PLR1_SU32_SUM0_SUS256_VWA1_VWB2_WGM1_WGMXCC1_WGMXCCGn1
    SolutionIndex: 84
    SolutionNameMin: Cijk_Ailk_Bljk_BSS_BH_UserArgs_MT64x32x64_MI16x16x1_SN_LDSB0_CLR1_GSU0_GSUC0_GSUWGMRR0_K1_LBSPPA1024_LBSPPB128_LPA32_MIWT2_1_PLR1_SU32_SUM0_SUS256_VWA2_VWB1_WGM1_WGMXCC1_WGMXCCGn1
    SolutionIndex: 85
    SolutionNameMin: Cijk_Ailk_Bljk_BSS_BH_UserArgs_MT64x32x64_MI16x16x1_SN_LDSB0_CLR1_GSU0_GSUC0_GSUWGMRR0_K1_LBSPPA1024_LBSPPB128_LPA32_MIWT2_1_PLR1_SU32_SUM0_SUS256_VWA2_VWB1_WGM4_WGMXCC1_WGMXCCGn1
    SolutionIndex: 86
    SolutionNameMin: Cijk_Ailk_Bljk_BSS_BH_UserArgs_MT64x32x64_MI16x16x1_SN_LDSB0_CLR1_GSU0_GSUC0_GSUWGMRR0_K1_LBSPPA1024_LBSPPB128_LPA32_MIWT2_1_PLR2_SU32_SUM0_SUS256_VWA2_VWB1_WGM4_WGMXCC1_WGMXCCGn1
    SolutionIndex: 87
    SolutionNameMin: Cijk_Ailk_Bljk_BSS_BH_UserArgs_MT128x64x128_MI16x16x1_SN_LDSB1_CLR1_GSU0_GSUC0_GSUWGMRR0_K1_LBSPPA2048_LBSPPB256_LPA0_MIWT4_2_PLR1_SU32_SUM0_SUS256_VWA4_VWB1_WGM1_WGMXCC1_WGMXCCGn1
    SolutionIndex: 88
    SolutionNameMin: Cijk_Ailk_Bljk_BSS_BH_UserArgs_MT128x64x128_MI16x16x1_SN_LDSB1_CLR1_GSU0_GSUC0_GSUWGMRR0_K1_LBSPPA2048_LBSPPB512_LPA0_MIWT4_2_PLR1_SU32_SUM0_SUS256_VWA4_VWB2_WGM1_WGMXCC1_WGMXCCGn1
    SolutionIndex: 89
    SolutionNameMin: Cijk_Ailk_Bljk_BSS_BH_UserArgs_MT128x64x128_MI16x16x1_SN_LDSB1_CLR1_GSU0_GSUC0_GSUWGMRR0_K1_LBSPPA2048_LBSPPB256_LPA0_MIWT4_2_PLR2_SU32_SUM0_SUS256_VWA4_VWB1_WGM1_WGMXCC1_WGMXCCGn1
    SolutionIndex: 90
    SolutionNameMin: Cijk_Ailk_Bljk_BSS_BH_UserArgs_MT128x64x128_MI16x16x1_SN_LDSB1_CLR1_GSU0_GSUC0_GSUWGMRR0_K1_LBSPPA2048_LBSPPB256_LPA0_MIWT4_2_PLR2_SU32_SUM0_SUS256_VWA4_VWB1_WGM8_WGMXCC1_WGMXCCGn1
    SolutionIndex: 91
    SolutionNameMin: Cijk_Ailk_Bljk_BSS_BH_UserArgs_MT128x32x128_MI16x16x1_SN_LDSB1_CLR1_GSU0_GSUC0_GSUWGMRR0_K1_LBSPPA2048_LBSPPB256_LPA0_MIWT4_1_PLR1_SU32_SUM0_SUS256_VWA4_VWB1_WGM1_WGMXCC1_WGMXCCGn1
    SolutionIndex: 92
    SolutionNameMin: Cijk_Ailk_Bljk_BSS_BH_UserArgs_MT32x64x128_MI16x16x1_SN_LDSB1_CLR1_GSU0_GSUC0_GSUWGMRR0_K1_LBSPPA512_LBSPPB512_LPA16_MIWT1_2_PLR1_SU32_SUM0_SUS256_VWA1_VWB2_WGM1_WGMXCC1_WGMXCCGn1
    SolutionIndex: 93
    SolutionNameMin: Cijk_Ailk_Bljk_BSS_BH_UserArgs_MT32x64x128_MI16x16x1_SN_LDSB1_CLR1_GSU0_GSUC0_GSUWGMRR0_K1_LBSPPA512_LBSPPB256_LPA16_MIWT1_2_PLR2_SU32_SUM0_SUS256_VWA1_VWB1_WGM1_WGMXCC1_WGMXCCGn1
    SolutionIndex: 94
    SolutionNameMin: Cijk_Ailk_Bljk_BSS_BH_UserArgs_MT32x64x128_MI16x16x1_SN_LDSB1_CLR1_GSU0_GSUC0_GSUWGMRR0_K1_LBSPPA512_LBSPPB256_LPA16_MIWT1_2_PLR2_SU32_SUM0_SUS256_VWA1_VWB1_WGM4_WGMXCC1_WGMXCCGn1
    SolutionIndex: 95
    SolutionNameMin: Cijk_Ailk_Bljk_BSS_BH_UserArgs_MT64x32x128_MI16x16x1_SN_LDSB1_CLR1_GSU0_GSUC0_GSUWGMRR0_K1_LBSPPA1024_LBSPPB256_LPA32_MIWT2_1_PLR1_SU32_SUM0_SUS256_VWA2_VWB1_WGM1_WGMXCC1_WGMXCCGn1
    SolutionIndex: 96
    SolutionNameMin: Cijk_Ailk_Bljk_BSS_BH_UserArgs_MT64x32x128_MI16x16x1_SN_LDSB1_CLR1_GSU0_GSUC0_GSUWGMRR0_K1_LBSPPA1024_LBSPPB256_LPA32_MIWT2_1_PLR2_SU32_SUM0_SUS256_VWA2_VWB1_WGM1_WGMXCC1_WGMXCCGn1
    SolutionIndex: 97
    SolutionNameMin: Cijk_Ailk_Bljk_BSS_BH_UserArgs_MT64x32x128_MI16x16x1_SN_LDSB1_CLR1_GSU0_GSUC0_GSUWGMRR0_K1_LBSPPA1024_LBSPPB256_LPA32_MIWT2_1_PLR2_SU32_SUM0_SUS256_VWA2_VWB1_WGM4_WGMXCC1_WGMXCCGn1
    SolutionIndex: 98
    SolutionNameMin: Cijk_Ailk_Bljk_BSS_BH_UserArgs_MT64x32x128_MI16x16x1_SN_LDSB1_CLR1_GSU0_GSUC0_GSUWGMRR0_K1_LBSPPA1024_LBSPPB256_LPA32_MIWT2_1_PLR1_SU32_SUM0_SUS256_VWA2_VWB1_WGM8_WGMXCC1_WGMXCCGn1
    SolutionIndex: 99
    SolutionNameMin: Cijk_Ailk_Bljk_BSS_BH_UserArgs_MT32x32x128_MI16x16x1_SN_LDSB1_CLR1_GSU0_GSUC0_GSUWGMRR0_K1_LBSPPA512_LBSPPB256_LPA16_MIWT1_1_PLR1_SU32_SUM0_SUS256_VWA1_VWB1_WGM1_WGMXCC1_WGMXCCGn1
    SolutionIndex: 100
    SolutionNameMin: Cijk_Ailk_Bljk_BSS_BH_UserArgs_MT32x32x128_MI16x16x1_SN_LDSB1_CLR1_GSU0_GSUC0_GSUWGMRR0_K1_LBSPPA512_LBSPPB256_LPA16_MIWT1_1_PLR2_SU32_SUM0_SUS256_VWA1_VWB1_WGM1_WGMXCC1_WGMXCCGn1
    SolutionIndex: 101
    SolutionNameMin: Cijk_Ailk_Bljk_BSS_BH_UserArgs_MT32x32x128_MI16x16x1_SN_LDSB1_CLR1_GSU0_GSUC0_GSUWGMRR0_K1_LBSPPA512_LBSPPB256_LPA16_MIWT1_1_PLR1_SU32_SUM0_SUS256_VWA1_VWB1_WGM4_WGMXCC1_WGMXCCGn1
    SolutionIndex: 102
    SolutionNameMin: Cijk_Ailk_Bljk_BSS_BH_UserArgs_MT32x32x128_MI16x16x1_SN_LDSB1_CLR1_GSU0_GSUC0_GSUWGMRR0_K1_LBSPPA512_LBSPPB256_LPA16_MIWT1_1_PLR2_SU32_SUM0_SUS256_VWA1_VWB1_WGM4_WGMXCC1_WGMXCCGn1
    SolutionIndex: 103
    SolutionNameMin: Cijk_Ailk_Bljk_BSS_BH_UserArgs_MT32x32x128_MI16x16x1_SN_LDSB1_CLR1_GSU0_GSUC0_GSUWGMRR0_K1_LBSPPA512_LBSPPB256_LPA16_MIWT1_1_PLR1_SU32_SUM0_SUS256_VWA1_VWB1_WGM8_WGMXCC1_WGMXCCGn1
    SolutionIndex: 104
    SolutionNameMin: Cijk_Ailk_Bljk_BSS_BH_UserArgs_MT32x32x128_MI16x16x1_SN_LDSB1_CLR1_GSU0_GSUC0_GSUWGMRR0_K1_LBSPPA512_LBSPPB256_LPA16_MIWT1_1_PLR2_SU32_SUM0_SUS256_VWA1_VWB1_WGM8_WGMXCC1_WGMXCCGn1
    SolutionIndex: 105
    SolutionNameMin: Cijk_Ailk_Bljk_BSS_BH_UserArgs_MT32x32x32_MI16x16x1_SN_LDSB0_CLR1_GSU0_GSUC0_GSUWGMRR0_K1_LBSPPA256_LBSPPB128_LPA16_MIWT1_1_PLR1_SU32_SUM0_SUS256_VWA1_VWB1_WGM4_WGMXCC1_WGMXCCGn1
- - - [128, 128, 1, 128, 128, 128, 128, 128]
    - [92, 0.078]
  - - [128, 128, 1, 256, 128, 128, 128, 256]
    - [93, 0.1]
  - - [128, 128, 1, 512, 128, 128, 128, 512]
    - [100, 0.167]
  - - [128, 128, 1, 1024, 128, 128, 128, 1024]
    - [99, 0.284]
  - - [128, 128, 1, 2048, 128, 128, 128, 2048]
    - [50, 0.497]
  - - [128, 128, 1, 4096, 128, 128, 128, 4096]
    - [83, 0.79]
  - - [128, 128, 1, 8192, 128, 128, 128, 8192]
    - [96, 1.233]
  - - [128, 256, 1, 128, 128, 128, 128, 128]
    - [104, 0.16]
  - - [128, 256, 1, 256, 128, 128, 128, 256]
    - [103, 0.237]
  - - [128, 256, 1, 512, 128, 128, 128, 512]
    - [99, 0.327]
  - - [128, 256, 1, 1024, 128, 128, 128, 1024]
    - [99, 0.559]
  - - [128, 256, 1, 2048, 128, 128, 128, 2048]
    - [99, 0.884]
  - - [128, 256, 1, 4096, 128, 128, 128, 4096]
    - [84, 1.388]
  - - [128, 256, 1, 8192, 128, 128, 128, 8192]
    - [96, 1.998]
  - - [128, 512, 1, 128, 128, 128, 128, 128]
    - [96, 0.302]
  - - [128, 512, 1, 256, 128, 128, 128, 256]
    - [49, 0.475]
  - - [128, 512, 1, 512, 128, 128, 128, 512]
    - [100, 0.746]
  - - [128, 512, 1, 1024, 128, 128, 128, 1024]
    - [102, 1.082]
  - - [128, 512, 1, 2048, 128, 128, 128, 2048]
    - [95, 1.529]
  - - [128, 512, 1, 4096, 128, 128, 128, 4096]
    - [78, 2.216]
  - - [128, 512, 1, 8192, 128, 128, 128, 8192]
    - [66, 2.744]
  - - [128, 1024, 1, 128, 128, 128, 128, 128]
    - [96, 0.541]
  - - [128, 1024, 1, 256, 128, 128, 128, 256]
    - [85, 0.921]
  - - [128, 1024, 1, 512, 128, 128, 128, 512]
    - [95, 1.309]
  - - [128, 1024, 1, 1024, 128, 128, 128, 1024]
    - [97, 1.819]
  - - [128, 1024, 1, 2048, 128, 128, 128, 2048]
    - [45, 2.231]
  - - [128, 1024, 1, 4096, 128, 128, 128, 4096]
    - [66, 3.515]
  - - [128, 1024, 1, 8192, 128, 128, 128, 8192]
    - [71, 3.712]
  - - [128, 2048, 1, 128, 128, 128, 128, 128]
    - [46, 0.923]
  - - [128, 2048, 1, 256, 128, 128, 128, 256]
    - [77, 1.465]
  - - [128, 2048, 1, 512, 128, 128, 128, 512]
    - [73, 2.109]
  - - [128, 2048, 1, 1024, 128, 128, 128, 1024]
    - [64, 2.476]
  - - [128, 2048, 1, 2048, 128, 128, 128, 2048]
    - [64, 3.001]
  - - [128, 2048, 1, 4096, 128, 128, 128, 4096]
    - [64, 3.892]
  - - [128, 2048, 1, 8192, 128, 128, 128, 8192]
    - [61, 4.361]
  - - [128, 4096, 1, 128, 128, 128, 128, 128]
    - [64, 1.257]
  - - [128, 4096, 1, 256, 128, 128, 128, 256]
    - [69, 2.074]
  - - [128, 4096, 1, 512, 128, 128, 128, 512]
    - [71, 3.073]
  - - [128, 4096, 1, 1024, 128, 128, 128, 1024]
    - [87, 3.464]
  - - [128, 4096, 1, 2048, 128, 128, 128, 2048]
    - [64, 3.62]
  - - [128, 4096, 1, 4096, 128, 128, 128, 4096]
    - [64, 4.342]
  - - [128, 4096, 1, 8192, 128, 128, 128, 8192]
    - [64, 5.442]
  - - [128, 8192, 1, 128, 128, 128, 128, 128]
    - [29, 1.663]
  - - [128, 8192, 1, 256, 128, 128, 128, 256]
    - [31, 2.566]
  - - [128, 8192, 1, 512, 128, 128, 128, 512]
    - [64, 3.37]
  - - [128, 8192, 1, 1024, 128, 128, 128, 1024]
    - [73, 4.051]
  - - [128, 8192, 1, 2048, 128, 128, 128, 2048]
    - [72, 4.828]
  - - [128, 8192, 1, 4096, 128, 128, 128, 4096]
    - [89, 4.532]
  - - [128, 8192, 1, 8192, 128, 128, 128, 8192]
    - [61, 5.685]
  - - [256, 128, 1, 128, 256, 256, 256, 128]
    - [100, 0.174]
  - - [256, 128, 1, 256, 256, 256, 256, 256]
    - [99, 0.236]
  - - [256, 128, 1, 512, 256, 256, 256, 512]
    - [100, 0.332]
  - - [256, 128, 1, 1024, 256, 256, 256, 1024]
    - [99, 0.559]
  - - [256, 128, 1, 2048, 256, 256, 256, 2048]
    - [48, 0.892]
  - - [256, 128, 1, 4096, 256, 256, 256, 4096]
    - [86, 1.341]
  - - [256, 128, 1, 8192, 256, 256, 256, 8192]
    - [96, 1.941]
  - - [256, 256, 1, 128, 256, 256, 256, 128]
    - [94, 0.308]
  - - [256, 256, 1, 256, 256, 256, 256, 256]
    - [99, 0.475]
  - - [256, 256, 1, 512, 256, 256, 256, 512]
    - [103, 0.736]
  - - [256, 256, 1, 1024, 256, 256, 256, 1024]
    - [104, 1.087]
  - - [256, 256, 1, 2048, 256, 256, 256, 2048]
    - [95, 1.522]
  - - [256, 256, 1, 4096, 256, 256, 256, 4096]
    - [66, 2.223]
  - - [256, 256, 1, 8192, 256, 256, 256, 8192]
    - [45, 2.825]
  - - [256, 512, 1, 128, 256, 256, 256, 128]
    - [91, 0.563]
  - - [256, 512, 1, 256, 256, 256, 256, 256]
    - [83, 0.903]
  - - [256, 512, 1, 512, 256, 256, 256, 512]
    - [95, 1.346]
  - - [256, 512, 1, 1024, 256, 256, 256, 1024]
    - [96, 1.881]
  - - [256, 512, 1, 2048, 256, 256, 256, 2048]
    - [44, 2.4]
  - - [256, 512, 1, 4096, 256, 256, 256, 4096]
    - [64, 3.503]
  - - [256, 512, 1, 8192, 256, 256, 256, 8192]
    - [22, 3.62]
  - - [256, 1024, 1, 128, 256, 256, 256, 128]
    - [77, 0.959]
  - - [256, 1024, 1, 256, 256, 256, 256, 256]
    - [79, 1.517]
  - - [256, 1024, 1, 512, 256, 256, 256, 512]
    - [75, 2.199]
  - - [256, 1024, 1, 1024, 256, 256, 256, 1024]
    - [66, 2.587]
  - - [256, 1024, 1, 2048, 256, 256, 256, 2048]
    - [21, 3.092]
  - - [256, 1024, 1, 4096, 256, 256, 256, 4096]
    - [66, 3.92]
  - - [256, 1024, 1, 8192, 256, 256, 256, 8192]
    - [12, 4.789]
  - - [256, 2048, 1, 128, 256, 256, 256, 128]
    - [70, 1.319]
  - - [256, 2048, 1, 256, 256, 256, 256, 256]
    - [66, 2.275]
  - - [256, 2048, 1, 512, 256, 256, 256, 512]
    - [66, 3.185]
  - - [256, 2048, 1, 1024, 256, 256, 256, 1024]
    - [87, 3.494]
  - - [256, 2048, 1, 2048, 256, 256, 256, 2048]
    - [15, 4.052]
  - - [256, 2048, 1, 4096, 256, 256, 256, 4096]
    - [72, 4.633]
  - - [256, 2048, 1, 8192, 256, 256, 256, 8192]
    - [9, 5.706]
  - - [256, 4096, 1, 128, 256, 256, 256, 128]
    - [29, 1.719]
  - - [256, 4096, 1, 256, 256, 256, 256, 256]
    - [33, 2.677]
  - - [256, 4096, 1, 512, 256, 256, 256, 512]
    - [66, 3.528]
  - - [256, 4096, 1, 1024, 256, 256, 256, 1024]
    - [78, 4.094]
  - - [256, 4096, 1, 2048, 256, 256, 256, 2048]
    - [72, 4.87]
  - - [256, 4096, 1, 4096, 256, 256, 256, 4096]
    - [17, 5.681]
  - - [256, 4096, 1, 8192, 256, 256, 256, 8192]
    - [14, 6.283]
  - - [256, 8192, 1, 128, 256, 256, 256, 128]
    - [18, 2.067]
  - - [256, 8192, 1, 256, 256, 256, 256, 256]
    - [9, 3.268]
  - - [256, 8192, 1, 512, 256, 256, 256, 512]
    - [66, 4.273]
  - - [256, 8192, 1, 1024, 256, 256, 256, 1024]
    - [66, 5.434]
  - - [256, 8192, 1, 2048, 256, 256, 256, 2048]
    - [72, 6.12]
  - - [256, 8192, 1, 4096, 256, 256, 256, 4096]
    - [14, 6.478]
  - - [256, 8192, 1, 8192, 256, 256, 256, 8192]
    - [9, 6.992]
  - - [512, 128, 1, 128, 512, 512, 512, 128]
    - [96, 0.316]
  - - [512, 128, 1, 256, 512, 512, 512, 256]
    - [101, 0.49]
  - - [512, 128, 1, 512, 512, 512, 512, 512]
    - [100, 0.752]
  - - [512, 128, 1, 1024, 512, 512, 512, 1024]
    - [100, 1.093]
  - - [512, 128, 1, 2048, 512, 512, 512, 2048]
    - [98, 1.506]
  - - [512, 128, 1, 4096, 512, 512, 512, 4096]
    - [75, 2.305]
  - - [512, 128, 1, 8192, 512, 512, 512, 8192]
    - [42, 2.837]
  - - [512, 256, 1, 128, 512, 512, 512, 128]
    - [96, 0.607]
  - - [512, 256, 1, 256, 512, 512, 512, 256]
    - [85, 0.928]
  - - [512, 256, 1, 512, 512, 512, 512, 512]
    - [84, 1.373]
  - - [512, 256, 1, 1024, 512, 512, 512, 1024]
    - [96, 1.921]
  - - [512, 256, 1, 2048, 512, 512, 512, 2048]
    - [40, 2.384]
  - - [512, 256, 1, 4096, 512, 512, 512, 4096]
    - [72, 3.567]
  - - [512, 256, 1, 8192, 512, 512, 512, 8192]
    - [21, 3.672]
  - - [512, 512, 1, 128, 512, 512, 512, 128]
    - [47, 0.968]
  - - [512, 512, 1, 256, 512, 512, 512, 256]
    - [82, 1.535]
  - - [512, 512, 1, 512, 512, 512, 512, 512]
    - [78, 2.224]
  - - [512, 512, 1, 1024, 512, 512, 512, 1024]
    - [64, 2.566]
  - - [512, 512, 1, 2048, 512, 512, 512, 2048]
    - [21, 3.107]
  - - [512, 512, 1, 4096, 512, 512, 512, 4096]
    - [72, 3.877]
  - - [512, 512, 1, 8192, 512, 512, 512, 8192]
    - [10, 4.842]
  - - [512, 1024, 1, 128, 512, 512, 512, 128]
    - [43, 1.364]
  - - [512, 1024, 1, 256, 512, 512, 512, 256]
    - [66, 2.28]
  - - [512, 1024, 1, 512, 512, 512, 512, 512]
    - [71, 3.152]
  - - [512, 1024, 1, 1024, 512, 512, 512, 1024]
    - [90, 3.521]
  - - [512, 1024, 1, 2048, 512, 512, 512, 2048]
    - [9, 4.136]
  - - [512, 1024, 1, 4096, 512, 512, 512, 4096]
    - [64, 4.693]
  - - [512, 1024, 1, 8192, 512, 512, 512, 8192]
    - [9, 5.63]
  - - [512, 2048, 1, 128, 512, 512, 512, 128]
    - [21, 1.722]
  - - [512, 2048, 1, 256, 512, 512, 512, 256]
    - [30, 2.683]
  - - [512, 2048, 1, 512, 512, 512, 512, 512]
    - [66, 3.601]
  - - [512, 2048, 1, 1024, 512, 512, 512, 1024]
    - [81, 4.139]
  - - [512, 2048, 1, 2048, 512, 512, 512, 2048]
    - [66, 4.953]
  - - [512, 2048, 1, 4096, 512, 512, 512, 4096]
    - [9, 5.621]
  - - [512, 2048, 1, 8192, 512, 512, 512, 8192]
    - [14, 6.323]
  - - [512, 4096, 1, 128, 512, 512, 512, 128]
    - [35, 2.084]
  - - [512, 4096, 1, 256, 512, 512, 512, 256]
    - [20, 3.344]
  - - [512, 4096, 1, 512, 512, 512, 512, 512]
    - [71, 4.294]
  - - [512, 4096, 1, 1024, 512, 512, 512, 1024]
    - [66, 5.457]
  - - [512, 4096, 1, 2048, 512, 512, 512, 2048]
    - [66, 6.226]
  - - [512, 4096, 1, 4096, 512, 512, 512, 4096]
    - [17, 6.139]
  - - [512, 4096, 1, 8192, 512, 512, 512, 8192]
    - [9, 7.482]
  - - [512, 8192, 1, 128, 512, 512, 512, 128]
    - [35, 2.469]
  - - [512, 8192, 1, 256, 512, 512, 512, 256]
    - [30, 3.822]
  - - [512, 8192, 1, 512, 512, 512, 512, 512]
    - [35, 5.264]
  - - [512, 8192, 1, 1024, 512, 512, 512, 1024]
    - [35, 6.273]
  - - [512, 8192, 1, 2048, 512, 512, 512, 2048]
    - [61, 6.796]
  - - [512, 8192, 1, 4096, 512, 512, 512, 4096]
    - [12, 7.559]
  - - [512, 8192, 1, 8192, 512, 512, 512, 8192]
    - [11, 7.617]
  - - [1024, 128, 1, 128, 1024, 1024, 1024, 128]
    - [95, 0.568]
  - - [1024, 128, 1, 256, 1024, 1024, 1024, 256]
    - [96, 0.913]
  - - [1024, 128, 1, 512, 1024, 1024, 1024, 512]
    - [96, 1.383]
  - - [1024, 128, 1, 1024, 1024, 1024, 1024, 1024]
    - [96, 1.85]
  - - [1024, 128, 1, 2048, 1024, 1024, 1024, 2048]
    - [40, 2.329]
  - - [1024, 128, 1, 4096, 1024, 1024, 1024, 4096]
    - [66, 3.439]
  - - [1024, 128, 1, 8192, 1024, 1024, 1024, 8192]
    - [24, 3.54]
  - - [1024, 256, 1, 128, 1024, 1024, 1024, 128]
    - [73, 0.993]
  - - [1024, 256, 1, 256, 1024, 1024, 1024, 256]
    - [80, 1.582]
  - - [1024, 256, 1, 512, 1024, 1024, 1024, 512]
    - [75, 2.346]
  - - [1024, 256, 1, 1024, 1024, 1024, 1024, 1024]
    - [67, 2.559]
  - - [1024, 256, 1, 2048, 1024, 1024, 1024, 2048]
    - [25, 3.071]
  - - [1024, 256, 1, 4096, 1024, 1024, 1024, 4096]
    - [68, 3.876]
  - - [1024, 256, 1, 8192, 1024, 1024, 1024, 8192]
    - [12, 4.801]
  - - [1024, 512, 1, 128, 1024, 1024, 1024, 128]
    - [64, 1.398]
  - - [1024, 512, 1, 256, 1024, 1024, 1024, 256]
    - [68, 2.255]
  - - [1024, 512, 1, 512, 1024, 1024, 1024, 512]
    - [64, 3.201]
  - - [1024, 512, 1, 1024, 1024, 1024, 1024, 1024]
    - [89, 3.496]
  - - [1024, 512, 1, 2048, 1024, 1024, 1024, 2048]
    - [10, 4.149]
  - - [1024, 512, 1, 4096, 1024, 1024, 1024, 4096]
    - [67, 4.616]
  - - [1024, 512, 1, 8192, 1024, 1024, 1024, 8192]
    - [17, 5.581]
  - - [1024, 1024, 1, 128, 1024, 1024, 1024, 128]
    - [30, 1.737]
  - - [1024, 1024, 1, 256, 1024, 1024, 1024, 256]
    - [39, 2.724]
  - - [1024, 1024, 1, 512, 1024, 1024, 1024, 512]
    - [60, 3.588]
  - - [1024, 1024, 1, 1024, 1024, 1024, 1024, 1024]
    - [75, 4.158]
  - - [1024, 1024, 1, 2048, 1024, 1024, 1024, 2048]
    - [68, 4.889]
  - - [1024, 1024, 1, 4096, 1024, 1024, 1024, 4096]
    - [13, 5.414]
  - - [1024, 1024, 1, 8192, 1024, 1024, 1024, 8192]
    - [12, 6.119]
  - - [1024, 2048, 1, 128, 1024, 1024, 1024, 128]
    - [30, 2.053]
  - - [1024, 2048, 1, 256, 1024, 1024, 1024, 256]
    - [14, 3.332]
  - - [1024, 2048, 1, 512, 1024, 1024, 1024, 512]
    - [64, 4.394]
  - - [1024, 2048, 1, 1024, 1024, 1024, 1024, 1024]
    - [68, 5.513]
  - - [1024, 2048, 1, 2048, 1024, 1024, 1024, 2048]
    - [72, 6.037]
  - - [1024, 2048, 1, 4096, 1024, 1024, 1024, 4096]
    - [9, 5.945]
  - - [1024, 2048, 1, 8192, 1024, 1024, 1024, 8192]
    - [14, 6.928]
  - - [1024, 4096, 1, 128, 1024, 1024, 1024, 128]
    - [30, 2.561]
  - - [1024, 4096, 1, 256, 1024, 1024, 1024, 256]
    - [22, 3.881]
  - - [1024, 4096, 1, 512, 1024, 1024, 1024, 512]
    - [26, 5.239]
  - - [1024, 4096, 1, 1024, 1024, 1024, 1024, 1024]
    - [30, 6.301]
  - - [1024, 4096, 1, 2048, 1024, 1024, 1024, 2048]
    - [58, 6.679]
  - - [1024, 4096, 1, 4096, 1024, 1024, 1024, 4096]
    - [12, 6.997]
  - - [1024, 4096, 1, 8192, 1024, 1024, 1024, 8192]
    - [13, 7.504]
  - - [1024, 8192, 1, 128, 1024, 1024, 1024, 128]
    - [19, 2.577]
  - - [1024, 8192, 1, 256, 1024, 1024, 1024, 256]
    - [14, 4.173]
  - - [1024, 8192, 1, 512, 1024, 1024, 1024, 512]
    - [15, 5.844]
  - - [1024, 8192, 1, 1024, 1024, 1024, 1024, 1024]
    - [20, 7.338]
  - - [1024, 8192, 1, 2048, 1024, 1024, 1024, 2048]
    - [55, 7.596]
  - - [1024, 8192, 1, 4096, 1024, 1024, 1024, 4096]
    - [10, 7.469]
  - - [1024, 8192, 1, 8192, 1024, 1024, 1024, 8192]
    - [53, 7.634]
  - - [2048, 128, 1, 128, 2048, 2048, 2048, 128]
    - [74, 1.017]
  - - [2048, 128, 1, 256, 2048, 2048, 2048, 256]
    - [76, 1.525]
  - - [2048, 128, 1, 512, 2048, 2048, 2048, 512]
    - [77, 2.143]
  - - [2048, 128, 1, 1024, 2048, 2048, 2048, 1024]
    - [69, 2.502]
  - - [2048, 128, 1, 2048, 2048, 2048, 2048, 2048]
    - [22, 2.989]
  - - [2048, 128, 1, 4096, 2048, 2048, 2048, 4096]
    - [67, 3.815]
  - - [2048, 128, 1, 8192, 2048, 2048, 2048, 8192]
    - [18, 4.603]
  - - [2048, 256, 1, 128, 2048, 2048, 2048, 128]
    - [65, 1.384]
  - - [2048, 256, 1, 256, 2048, 2048, 2048, 256]
    - [42, 2.291]
  - - [2048, 256, 1, 512, 2048, 2048, 2048, 512]
    - [67, 3.023]
  - - [2048, 256, 1, 1024, 2048, 2048, 2048, 1024]
    - [88, 3.36]
  - - [2048, 256, 1, 2048, 2048, 2048, 2048, 2048]
    - [17, 4.016]
  - - [2048, 256, 1, 4096, 2048, 2048, 2048, 4096]
    - [17, 4.498]
  - - [2048, 256, 1, 8192, 2048, 2048, 2048, 8192]
    - [20, 5.546]
  - - [2048, 512, 1, 128, 2048, 2048, 2048, 128]
    - [30, 1.742]
  - - [2048, 512, 1, 256, 2048, 2048, 2048, 256]
    - [38, 2.753]
  - - [2048, 512, 1, 512, 2048, 2048, 2048, 512]
    - [66, 3.546]
  - - [2048, 512, 1, 1024, 2048, 2048, 2048, 1024]
    - [80, 4.024]
  - - [2048, 512, 1, 2048, 2048, 2048, 2048, 2048]
    - [68, 4.705]
  - - [2048, 512, 1, 4096, 2048, 2048, 2048, 4096]
    - [13, 5.386]
  - - [2048, 512, 1, 8192, 2048, 2048, 2048, 8192]
    - [54, 6.09]
  - - [2048, 1024, 1, 128, 2048, 2048, 2048, 128]
    - [20, 2.145]
  - - [2048, 1024, 1, 256, 2048, 2048, 2048, 256]
    - [15, 3.487]
  - - [2048, 1024, 1, 512, 2048, 2048, 2048, 512]
    - [64, 4.445]
  - - [2048, 1024, 1, 1024, 2048, 2048, 2048, 1024]
    - [66, 5.277]
  - - [2048, 1024, 1, 2048, 2048, 2048, 2048, 2048]
    - [72, 5.989]
  - - [2048, 1024, 1, 4096, 2048, 2048, 2048, 4096]
    - [13, 5.769]
  - - [2048, 1024, 1, 8192, 2048, 2048, 2048, 8192]
    - [12, 6.91]
  - - [2048, 2048, 1, 128, 2048, 2048, 2048, 128]
    - [22, 2.522]
  - - [2048, 2048, 1, 256, 2048, 2048, 2048, 256]
    - [22, 3.844]
  - - [2048, 2048, 1, 512, 2048, 2048, 2048, 512]
    - [27, 5.093]
  - - [2048, 2048, 1, 1024, 2048, 2048, 2048, 1024]
    - [29, 6.322]
  - - [2048, 2048, 1, 2048, 2048, 2048, 2048, 2048]
    - [59, 6.766]
  - - [2048, 2048, 1, 4096, 2048, 2048, 2048, 4096]
    - [12, 6.787]
  - - [2048, 2048, 1, 8192, 2048, 2048, 2048, 8192]
    - [52, 7.463]
  - - [2048, 4096, 1, 128, 2048, 2048, 2048, 128]
    - [15, 2.524]
  - - [2048, 4096, 1, 256, 2048, 2048, 2048, 256]
    - [15, 4.237]
  - - [2048, 4096, 1, 512, 2048, 2048, 2048, 512]
    - [12, 5.814]
  - - [2048, 4096, 1, 1024, 2048, 2048, 2048, 1024]
    - [14, 7.202]
  - - [2048, 4096, 1, 2048, 2048, 2048, 2048, 2048]
    - [51, 7.576]
  - - [2048, 4096, 1, 4096, 2048, 2048, 2048, 4096]
    - [9, 7.616]
  - - [2048, 4096, 1, 8192, 2048, 2048, 2048, 8192]
    - [2, 8.013]
  - - [2048, 8192, 1, 128, 2048, 2048, 2048, 128]
    - [21, 2.474]
  - - [2048, 8192, 1, 256, 2048, 2048, 2048, 256]
    - [5, 3.682]
  - - [2048, 8192, 1, 512, 2048, 2048, 2048, 512]
    - [4, 5.473]
  - - [2048, 8192, 1, 1024, 2048, 2048, 2048, 1024]
    - [4, 7.052]
  - - [2048, 8192, 1, 2048, 2048, 2048, 2048, 2048]
    - [9, 7.351]
  - - [2048, 8192, 1, 4096, 2048, 2048, 2048, 4096]
    - [18, 7.914]
  - - [2048, 8192, 1, 8192, 2048, 2048, 2048, 8192]
    - [57, 7.908]
  - - [4096, 128, 1, 128, 4096, 4096, 4096, 128]
    - [41, 1.303]
  - - [4096, 128, 1, 256, 4096, 4096, 4096, 256]
    - [71, 2.195]
  - - [4096, 128, 1, 512, 4096, 4096, 4096, 512]
    - [64, 3.262]
  - - [4096, 128, 1, 1024, 4096, 4096, 4096, 1024]
    - [90, 3.338]
  - - [4096, 128, 1, 2048, 4096, 4096, 4096, 2048]
    - [14, 4.085]
  - - [4096, 128, 1, 4096, 4096, 4096, 4096, 4096]
    - [71, 4.547]
  - - [4096, 128, 1, 8192, 4096, 4096, 4096, 8192]
    - [18, 5.604]
  - - [4096, 256, 1, 128, 4096, 4096, 4096, 128]
    - [37, 1.804]
  - - [4096, 256, 1, 256, 4096, 4096, 4096, 256]
    - [23, 2.687]
  - - [4096, 256, 1, 512, 4096, 4096, 4096, 512]
    - [59, 3.468]
  - - [4096, 256, 1, 1024, 4096, 4096, 4096, 1024]
    - [77, 4.058]
  - - [4096, 256, 1, 2048, 4096, 4096, 4096, 2048]
    - [72, 4.98]
  - - [4096, 256, 1, 4096, 4096, 4096, 4096, 4096]
    - [14, 5.531]
  - - [4096, 256, 1, 8192, 4096, 4096, 4096, 8192]
    - [17, 6.198]
  - - [4096, 512, 1, 128, 4096, 4096, 4096, 128]
    - [26, 2.087]
  - - [4096, 512, 1, 256, 4096, 4096, 4096, 256]
    - [13, 3.4]
  - - [4096, 512, 1, 512, 4096, 4096, 4096, 512]
    - [71, 4.29]
  - - [4096, 512, 1, 1024, 4096, 4096, 4096, 1024]
    - [68, 5.161]
  - - [4096, 512, 1, 2048, 4096, 4096, 4096, 2048]
    - [68, 6.11]
  - - [4096, 512, 1, 4096, 4096, 4096, 4096, 4096]
    - [20, 6.03]
  - - [4096, 512, 1, 8192, 4096, 4096, 4096, 8192]
    - [17, 7.162]
  - - [4096, 1024, 1, 128, 4096, 4096, 4096, 128]
    - [34, 2.491]
  - - [4096, 1024, 1, 256, 4096, 4096, 4096, 256]
    - [25, 3.76]
  - - [4096, 1024, 1, 512, 4096, 4096, 4096, 512]
    - [36, 5.117]
  - - [4096, 1024, 1, 1024, 4096, 4096, 4096, 1024]
    - [32, 6.038]
  - - [4096, 1024, 1, 2048, 4096, 4096, 4096, 2048]
    - [63, 6.734]
  - - [4096, 1024, 1, 4096, 4096, 4096, 4096, 4096]
    - [10, 7.332]
  - - [4096, 1024, 1, 8192, 4096, 4096, 4096, 8192]
    - [9, 7.822]
  - - [4096, 2048, 1, 128, 4096, 4096, 4096, 128]
    - [8, 2.536]
  - - [4096, 2048, 1, 256, 4096, 4096, 4096, 256]
    - [13, 4.161]
  - - [4096, 2048, 1, 512, 4096, 4096, 4096, 512]
    - [9, 5.854]
  - - [4096, 2048, 1, 1024, 4096, 4096, 4096, 1024]
    - [10, 7.264]
  - - [4096, 2048, 1, 2048, 4096, 4096, 4096, 2048]
    - [55, 7.482]
  - - [4096, 2048, 1, 4096, 4096, 4096, 4096, 4096]
    - [10, 7.767]
  - - [4096, 2048, 1, 8192, 4096, 4096, 4096, 8192]
    - [10, 8.065]
  - - [4096, 4096, 1, 128, 4096, 4096, 4096, 128]
    - [66, 2.449]
  - - [4096, 4096, 1, 256, 4096, 4096, 4096, 256]
    - [3, 3.694]
  - - [4096, 4096, 1, 512, 4096, 4096, 4096, 512]
    - [3, 5.41]
  - - [4096, 4096, 1, 1024, 4096, 4096, 4096, 1024]
    - [1, 6.874]
  - - [4096, 4096, 1, 2048, 4096, 4096, 4096, 2048]
    - [12, 7.81]
  - - [4096, 4096, 1, 4096, 4096, 4096, 4096, 4096]
    - [9, 8.4]
  - - [4096, 4096, 1, 8192, 4096, 4096, 4096, 8192]
    - [11, 8.491]
  - - [4096, 8192, 1, 128, 4096, 4096, 4096, 128]
    - [24, 2.312]
  - - [4096, 8192, 1, 256, 4096, 4096, 4096, 256]
    - [25, 3.585]
  - - [4096, 8192, 1, 512, 4096, 4096, 4096, 512]
    - [13, 5.012]
  - - [4096, 8192, 1, 1024, 4096, 4096, 4096, 1024]
    - [9, 6.689]
  - - [4096, 8192, 1, 2048, 4096, 4096, 4096, 2048]
    - [13, 7.749]
  - - [4096, 8192, 1, 4096, 4096, 4096, 4096, 4096]
    - [2, 8.485]
  - - [4096, 8192, 1, 8192, 4096, 4096, 4096, 8192]
    - [0, 8.787]
  - - [8192, 128, 1, 128, 8192, 8192, 8192, 128]
    - [28, 1.821]
  - - [8192, 128, 1, 256, 8192, 8192, 8192, 256]
    - [37, 2.727]
  - - [8192, 128, 1, 512, 8192, 8192, 8192, 512]
    - [71, 3.436]
  - - [8192, 128, 1, 1024, 8192, 8192, 8192, 1024]
    - [77, 3.998]
  - - [8192, 128, 1, 2048, 8192, 8192, 8192, 2048]
    - [67, 4.888]
  - - [8192, 128, 1, 4096, 8192, 8192, 8192, 4096]
    - [9, 5.616]
  - - [8192, 128, 1, 8192, 8192, 8192, 8192, 8192]
    - [15, 6.333]
  - - [8192, 256, 1, 128, 8192, 8192, 8192, 128]
    - [23, 2.097]
  - - [8192, 256, 1, 256, 8192, 8192, 8192, 256]
    - [10, 3.254]
  - - [8192, 256, 1, 512, 8192, 8192, 8192, 512]
    - [67, 4.285]
  - - [8192, 256, 1, 1024, 8192, 8192, 8192, 1024]
    - [71, 5.397]
  - - [8192, 256, 1, 2048, 8192, 8192, 8192, 2048]
    - [72, 6.019]
  - - [8192, 256, 1, 4096, 8192, 8192, 8192, 4096]
    - [12, 6.266]
  - - [8192, 256, 1, 8192, 8192, 8192, 8192, 8192]
    - [9, 7.317]
  - - [8192, 512, 1, 128, 8192, 8192, 8192, 128]
    - [23, 2.486]
  - - [8192, 512, 1, 256, 8192, 8192, 8192, 256]
    - [37, 3.72]
  - - [8192, 512, 1, 512, 8192, 8192, 8192, 512]
    - [37, 5.034]
  - - [8192, 512, 1, 1024, 8192, 8192, 8192, 1024]
    - [37, 6.252]
  - - [8192, 512, 1, 2048, 8192, 8192, 8192, 2048]
    - [62, 6.728]
  - - [8192, 512, 1, 4096, 8192, 8192, 8192, 4096]
    - [15, 7.201]
  - - [8192, 512, 1, 8192, 8192, 8192, 8192, 8192]
    - [15, 7.946]
  - - [8192, 1024, 1, 128, 8192, 8192, 8192, 128]
    - [7, 2.495]
  - - [8192, 1024, 1, 256, 8192, 8192, 8192, 256]
    - [20, 4.187]
  - - [8192, 1024, 1, 512, 8192, 8192, 8192, 512]
    - [20, 5.93]
  - - [8192, 1024, 1, 1024, 8192, 8192, 8192, 1024]
    - [15, 7.273]
  - - [8192, 1024, 1, 2048, 8192, 8192, 8192, 2048]
    - [56, 7.448]
  - - [8192, 1024, 1, 4096, 8192, 8192, 8192, 4096]
    - [11, 7.909]
  - - [8192, 1024, 1, 8192, 8192, 8192, 8192, 8192]
    - [6, 8.029]
  - - [8192, 2048, 1, 128, 8192, 8192, 8192, 128]
    - [25, 2.45]
  - - [8192, 2048, 1, 256, 8192, 8192, 8192, 256]
    - [1, 3.709]
  - - [8192, 2048, 1, 512, 8192, 8192, 8192, 512]
    - [1, 5.467]
  - - [8192, 2048, 1, 1024, 8192, 8192, 8192, 1024]
    - [4, 6.949]
  - - [8192, 2048, 1, 2048, 8192, 8192, 8192, 2048]
    - [12, 8.138]
  - - [8192, 2048, 1, 4096, 8192, 8192, 8192, 4096]
    - [12, 8.507]
  - - [8192, 2048, 1, 8192, 8192, 8192, 8192, 8192]
    - [14, 8.327]
  - - [8192, 4096, 1, 128, 8192, 8192, 8192, 128]
    - [32, 2.289]
  - - [8192, 4096, 1, 256, 8192, 8192, 8192, 256]
    - [37, 3.524]
  - - [8192, 4096, 1, 512, 8192, 8192, 8192, 512]
    - [18, 4.997]
  - - [8192, 4096, 1, 1024, 8192, 8192, 8192, 1024]
    - [9, 6.636]
  - - [8192, 4096, 1, 2048, 8192, 8192, 8192, 2048]
    - [17, 7.787]
  - - [8192, 4096, 1, 4096, 8192, 8192, 8192, 4096]
    - [1, 8.559]
  - - [8192, 4096, 1, 8192, 8192, 8192, 8192, 8192]
    - [1, 9.037]
  - - [8192, 8192, 1, 128, 8192, 8192, 8192, 128]
    - [37, 2.177]
  - - [8192, 8192, 1, 256, 8192, 8192, 8192, 256]
    - [13, 3.617]
  - - [8192, 8192, 1, 512, 8192, 8192, 8192, 512]
    - [16, 5.206]
  - - [8192, 8192, 1, 1024, 8192, 8192, 8192, 1024]
    - [18, 6.832]
  - - [8192, 8192, 1, 2048, 8192, 8192, 8192, 2048]
    - [14, 8.006]
  - - [8192, 8192, 1, 4096, 8192, 8192, 8192, 4096]
    - [18, 8.664]
  - - [8192, 8192, 1, 8192, 8192, 8192, 8192, 8192]
    - [4, 8.664]
  - - [1, 1, 1, 32, 1, 1, 1, 32]
    - [105, 0.0]
- null
- null
- DeviceEfficiency
- GridBased
