library/src/amd_detail/rocblaslt/src/Tensile/Logic/streamk/gfx942_38cu/aquavanjaram942_Cijk_Alik_Bjlk_BSS_BH_UserArgs.yaml
- {MinimumRequiredVersion: 4.33.0}
- aquavanjaram942
- {Architecture: gfx942, CUCount: 38}
- [Device 0049, Device 0050]
    SolutionIndex: 0
    SolutionNameMin: Cijk_Alik_Bjlk_BSS_BH_UserArgs_MT256x256x32_MI16x16x1_SN_LDSB1_CLR1_GSU0_GSUC0_GSUWGMRR0_K1_LBSPPA128_LBSPPB2048_LPB16_MIWT8_8_PLR1_SU32_SUM0_SUS256_VWA1_VWB1_WGM1_WGMXCC1_WGMXCCGn1
    SolutionIndex: 1
    SolutionNameMin: Cijk_Alik_Bjlk_BSS_BH_UserArgs_MT256x256x32_MI16x16x1_SN_LDSB1_CLR1_GSU0_GSUC0_GSUWGMRR0_K1_LBSPPA256_LBSPPB2048_LPB32_MIWT8_8_PLR1_SU32_SUM0_SUS256_VWA4_VWB2_WGM1_WGMXCC1_WGMXCCGn1
    SolutionIndex: 2
    SolutionNameMin: Cijk_Alik_Bjlk_BSS_BH_UserArgs_MT256x256x32_MI16x16x1_SN_LDSB1_CLR1_GSU0_GSUC0_GSUWGMRR0_K1_LBSPPA128_LBSPPB2048_LPB0_MIWT8_8_PLR1_SU32_SUM0_SUS256_VWA1_VWB8_WGM1_WGMXCC1_WGMXCCGn1
    SolutionIndex: 3
    SolutionNameMin: Cijk_Alik_Bjlk_BSS_BH_UserArgs_MT256x256x32_MI16x16x1_SN_LDSB1_CLR1_GSU0_GSUC0_GSUWGMRR0_K1_LBSPPA256_LBSPPB2048_LPB0_MIWT8_8_PLR1_SU32_SUM0_SUS256_VWA4_VWB8_WGM1_WGMXCC1_WGMXCCGn1
    SolutionIndex: 4
    SolutionNameMin: Cijk_Alik_Bjlk_BSS_BH_UserArgs_MT256x256x32_MI16x16x1_SN_LDSB1_CLR1_GSU0_GSUC0_GSUWGMRR0_K1_LBSPPA512_LBSPPB2048_LPB0_MIWT8_8_PLR1_SU32_SUM0_SUS256_VWA8_VWB8_WGM1_WGMXCC1_WGMXCCGn1
    SolutionIndex: 5
    SolutionNameMin: Cijk_Alik_Bjlk_BSS_BH_UserArgs_MT256x256x32_MI16x16x1_SN_LDSB1_CLR1_GSU0_GSUC0_GSUWGMRR0_K1_LBSPPA128_LBSPPB2048_LPB0_MIWT8_8_PLR1_SU32_SUM0_SUS256_VWA1_VWB4_WGM4_WGMXCC1_WGMXCCGn1
    SolutionIndex: 6
    SolutionNameMin: Cijk_Alik_Bjlk_BSS_BH_UserArgs_MT256x256x32_MI16x16x1_SN_LDSB1_CLR1_GSU0_GSUC0_GSUWGMRR0_K1_LBSPPA256_LBSPPB2048_LPB0_MIWT8_8_PLR1_SU32_SUM0_SUS256_VWA4_VWB8_WGM4_WGMXCC1_WGMXCCGn1
    SolutionIndex: 7
    SolutionNameMin: Cijk_Alik_Bjlk_BSS_BH_UserArgs_MT256x256x32_MI16x16x1_SN_LDSB1_CLR1_GSU0_GSUC0_GSUWGMRR0_K1_LBSPPA128_LBSPPB2048_LPB32_MIWT8_8_PLR1_SU32_SUM0_SUS256_VWA2_VWB2_WGM8_WGMXCC1_WGMXCCGn1
    SolutionIndex: 8
    SolutionNameMin: Cijk_Alik_Bjlk_BSS_BH_UserArgs_MT256x256x32_MI16x16x1_SN_LDSB1_CLR1_GSU0_GSUC0_GSUWGMRR0_K1_LBSPPA128_LBSPPB2048_LPB0_MIWT8_8_PLR1_SU32_SUM0_SUS256_VWA1_VWB4_WGM8_WGMXCC1_WGMXCCGn1
    SolutionIndex: 9
    SolutionNameMin: Cijk_Alik_Bjlk_BSS_BH_UserArgs_MT256x256x32_MI16x16x1_SN_LDSB1_CLR1_GSU0_GSUC0_GSUWGMRR0_K1_LBSPPA128_LBSPPB2048_LPB0_MIWT8_8_PLR1_SU32_SUM0_SUS256_VWA2_VWB4_WGM8_WGMXCC1_WGMXCCGn1
    SolutionIndex: 10
    SolutionNameMin: Cijk_Alik_Bjlk_BSS_BH_UserArgs_MT256x256x32_MI16x16x1_SN_LDSB1_CLR1_GSU0_GSUC0_GSUWGMRR0_K1_LBSPPA256_LBSPPB2048_LPB0_MIWT8_8_PLR1_SU32_SUM0_SUS256_VWA4_VWB4_WGM8_WGMXCC1_WGMXCCGn1
    SolutionIndex: 11
    SolutionNameMin: Cijk_Alik_Bjlk_BSS_BH_UserArgs_MT256x256x32_MI16x16x1_SN_LDSB1_CLR1_GSU0_GSUC0_GSUWGMRR0_K1_LBSPPA256_LBSPPB2048_LPB0_MIWT8_8_PLR1_SU32_SUM0_SUS256_VWA4_VWB8_WGM8_WGMXCC1_WGMXCCGn1
    SolutionIndex: 12
    SolutionNameMin: Cijk_Alik_Bjlk_BSS_BH_UserArgs_MT128x256x32_MI16x16x1_SN_LDSB1_CLR1_GSU0_GSUC0_GSUWGMRR0_K1_LBSPPA128_LBSPPB2048_LPB32_MIWT4_8_PLR1_SU32_SUM0_SUS256_VWA1_VWB2_WGM1_WGMXCC1_WGMXCCGn1
    SolutionIndex: 13
    SolutionNameMin: Cijk_Alik_Bjlk_BSS_BH_UserArgs_MT128x256x32_MI16x16x1_SN_LDSB1_CLR1_GSU0_GSUC0_GSUWGMRR0_K1_LBSPPA256_LBSPPB2048_LPB32_MIWT4_8_PLR1_SU32_SUM0_SUS256_VWA4_VWB2_WGM1_WGMXCC1_WGMXCCGn1
    SolutionIndex: 14
    SolutionNameMin: Cijk_Alik_Bjlk_BSS_BH_UserArgs_MT128x256x32_MI16x16x1_SN_LDSB1_CLR1_GSU0_GSUC0_GSUWGMRR0_K1_LBSPPA128_LBSPPB2048_LPB0_MIWT4_8_PLR1_SU32_SUM0_SUS256_VWA1_VWB4_WGM1_WGMXCC1_WGMXCCGn1
    SolutionIndex: 15
    SolutionNameMin: Cijk_Alik_Bjlk_BSS_BH_UserArgs_MT128x256x32_MI16x16x1_SN_LDSB1_CLR1_GSU0_GSUC0_GSUWGMRR0_K1_LBSPPA256_LBSPPB2048_LPB0_MIWT4_8_PLR1_SU32_SUM0_SUS256_VWA4_VWB4_WGM1_WGMXCC1_WGMXCCGn1
    SolutionIndex: 16
    SolutionNameMin: Cijk_Alik_Bjlk_BSS_BH_UserArgs_MT128x256x32_MI16x16x1_SN_LDSB1_CLR1_GSU0_GSUC0_GSUWGMRR0_K1_LBSPPA128_LBSPPB2048_LPB0_MIWT4_8_PLR1_SU32_SUM0_SUS256_VWA1_VWB8_WGM1_WGMXCC1_WGMXCCGn1
    SolutionIndex: 17
    SolutionNameMin: Cijk_Alik_Bjlk_BSS_BH_UserArgs_MT128x256x32_MI16x16x1_SN_LDSB1_CLR1_GSU0_GSUC0_GSUWGMRR0_K1_LBSPPA256_LBSPPB2048_LPB0_MIWT4_8_PLR1_SU32_SUM0_SUS256_VWA4_VWB8_WGM1_WGMXCC1_WGMXCCGn1
    SolutionIndex: 18
    SolutionNameMin: Cijk_Alik_Bjlk_BSS_BH_UserArgs_MT128x256x32_MI16x16x1_SN_LDSB1_CLR1_GSU0_GSUC0_GSUWGMRR0_K1_LBSPPA128_LBSPPB2048_LPB16_MIWT4_8_PLR1_SU32_SUM0_SUS256_VWA1_VWB1_WGM4_WGMXCC1_WGMXCCGn1
    SolutionIndex: 19
    SolutionNameMin: Cijk_Alik_Bjlk_BSS_BH_UserArgs_MT128x256x32_MI16x16x1_SN_LDSB1_CLR1_GSU0_GSUC0_GSUWGMRR0_K1_LBSPPA128_LBSPPB2048_LPB32_MIWT4_8_PLR1_SU32_SUM0_SUS256_VWA1_VWB2_WGM4_WGMXCC1_WGMXCCGn1
    SolutionIndex: 20
    SolutionNameMin: Cijk_Alik_Bjlk_BSS_BH_UserArgs_MT128x256x32_MI16x16x1_SN_LDSB1_CLR1_GSU0_GSUC0_GSUWGMRR0_K1_LBSPPA256_LBSPPB2048_LPB32_MIWT4_8_PLR1_SU32_SUM0_SUS256_VWA4_VWB2_WGM4_WGMXCC1_WGMXCCGn1
    SolutionIndex: 21
    SolutionNameMin: Cijk_Alik_Bjlk_BSS_BH_UserArgs_MT128x256x32_MI16x16x1_SN_LDSB1_CLR1_GSU0_GSUC0_GSUWGMRR0_K1_LBSPPA128_LBSPPB2048_LPB0_MIWT4_8_PLR1_SU32_SUM0_SUS256_VWA1_VWB4_WGM4_WGMXCC1_WGMXCCGn1
    SolutionIndex: 22
    SolutionNameMin: Cijk_Alik_Bjlk_BSS_BH_UserArgs_MT128x256x32_MI16x16x1_SN_LDSB1_CLR1_GSU0_GSUC0_GSUWGMRR0_K1_LBSPPA128_LBSPPB2048_LPB0_MIWT4_8_PLR1_SU32_SUM0_SUS256_VWA2_VWB4_WGM4_WGMXCC1_WGMXCCGn1
    SolutionIndex: 23
    SolutionNameMin: Cijk_Alik_Bjlk_BSS_BH_UserArgs_MT128x256x32_MI16x16x1_SN_LDSB1_CLR1_GSU0_GSUC0_GSUWGMRR0_K1_LBSPPA256_LBSPPB2048_LPB0_MIWT4_8_PLR1_SU32_SUM0_SUS256_VWA4_VWB4_WGM4_WGMXCC1_WGMXCCGn1
    SolutionIndex: 24
    SolutionNameMin: Cijk_Alik_Bjlk_BSS_BH_UserArgs_MT128x256x32_MI16x16x1_SN_LDSB1_CLR1_GSU0_GSUC0_GSUWGMRR0_K1_LBSPPA128_LBSPPB2048_LPB0_MIWT4_8_PLR1_SU32_SUM0_SUS256_VWA1_VWB8_WGM4_WGMXCC1_WGMXCCGn1
    SolutionIndex: 25
    SolutionNameMin: Cijk_Alik_Bjlk_BSS_BH_UserArgs_MT128x256x32_MI16x16x1_SN_LDSB1_CLR1_GSU0_GSUC0_GSUWGMRR0_K1_LBSPPA256_LBSPPB2048_LPB0_MIWT4_8_PLR1_SU32_SUM0_SUS256_VWA4_VWB8_WGM4_WGMXCC1_WGMXCCGn1
    SolutionIndex: 26
    SolutionNameMin: Cijk_Alik_Bjlk_BSS_BH_UserArgs_MT128x256x32_MI16x16x1_SN_LDSB1_CLR1_GSU0_GSUC0_GSUWGMRR0_K1_LBSPPA128_LBSPPB2048_LPB32_MIWT4_8_PLR1_SU32_SUM0_SUS256_VWA1_VWB2_WGM8_WGMXCC1_WGMXCCGn1
    SolutionIndex: 27
    SolutionNameMin: Cijk_Alik_Bjlk_BSS_BH_UserArgs_MT128x256x32_MI16x16x1_SN_LDSB1_CLR1_GSU0_GSUC0_GSUWGMRR0_K1_LBSPPA256_LBSPPB2048_LPB32_MIWT4_8_PLR1_SU32_SUM0_SUS256_VWA4_VWB2_WGM8_WGMXCC1_WGMXCCGn1
    SolutionIndex: 28
    SolutionNameMin: Cijk_Alik_Bjlk_BSS_BH_UserArgs_MT128x256x32_MI16x16x1_SN_LDSB1_CLR1_GSU0_GSUC0_GSUWGMRR0_K1_LBSPPA128_LBSPPB2048_LPB0_MIWT4_8_PLR1_SU32_SUM0_SUS256_VWA1_VWB4_WGM8_WGMXCC1_WGMXCCGn1
    SolutionIndex: 29
    SolutionNameMin: Cijk_Alik_Bjlk_BSS_BH_UserArgs_MT128x256x32_MI16x16x1_SN_LDSB1_CLR1_GSU0_GSUC0_GSUWGMRR0_K1_LBSPPA128_LBSPPB2048_LPB0_MIWT4_8_PLR1_SU32_SUM0_SUS256_VWA2_VWB4_WGM8_WGMXCC1_WGMXCCGn1
    SolutionIndex: 30
    SolutionNameMin: Cijk_Alik_Bjlk_BSS_BH_UserArgs_MT128x256x32_MI16x16x1_SN_LDSB1_CLR1_GSU0_GSUC0_GSUWGMRR0_K1_LBSPPA256_LBSPPB2048_LPB0_MIWT4_8_PLR1_SU32_SUM0_SUS256_VWA4_VWB4_WGM8_WGMXCC1_WGMXCCGn1
    SolutionIndex: 31
    SolutionNameMin: Cijk_Alik_Bjlk_BSS_BH_UserArgs_MT128x256x32_MI16x16x1_SN_LDSB1_CLR1_GSU0_GSUC0_GSUWGMRR0_K1_LBSPPA128_LBSPPB2048_LPB0_MIWT4_8_PLR1_SU32_SUM0_SUS256_VWA1_VWB8_WGM8_WGMXCC1_WGMXCCGn1
    SolutionIndex: 32
    SolutionNameMin: Cijk_Alik_Bjlk_BSS_BH_UserArgs_MT128x256x32_MI16x16x1_SN_LDSB1_CLR1_GSU0_GSUC0_GSUWGMRR0_K1_LBSPPA256_LBSPPB2048_LPB0_MIWT4_8_PLR1_SU32_SUM0_SUS256_VWA4_VWB8_WGM8_WGMXCC1_WGMXCCGn1
    SolutionIndex: 33
    SolutionNameMin: Cijk_Alik_Bjlk_BSS_BH_UserArgs_MT256x128x32_MI16x16x1_SN_LDSB1_CLR1_GSU0_GSUC0_GSUWGMRR0_K1_LBSPPA256_LBSPPB1024_LPB32_MIWT8_4_PLR1_SU32_SUM0_SUS256_VWA4_VWB2_WGM1_WGMXCC1_WGMXCCGn1
    SolutionIndex: 34
    SolutionNameMin: Cijk_Alik_Bjlk_BSS_BH_UserArgs_MT256x128x32_MI16x16x1_SN_LDSB1_CLR1_GSU0_GSUC0_GSUWGMRR0_K1_LBSPPA128_LBSPPB1024_LPB32_MIWT8_4_PLR1_SU32_SUM0_SUS256_VWA1_VWB2_WGM4_WGMXCC1_WGMXCCGn1
    SolutionIndex: 35
    SolutionNameMin: Cijk_Alik_Bjlk_BSS_BH_UserArgs_MT256x128x32_MI16x16x1_SN_LDSB1_CLR1_GSU0_GSUC0_GSUWGMRR0_K1_LBSPPA128_LBSPPB1024_LPB16_MIWT8_4_PLR1_SU32_SUM0_SUS256_VWA1_VWB1_WGM8_WGMXCC1_WGMXCCGn1
    SolutionIndex: 36
    SolutionNameMin: Cijk_Alik_Bjlk_BSS_BH_UserArgs_MT64x256x32_MI16x16x1_SN_LDSB1_CLR1_GSU0_GSUC0_GSUWGMRR0_K1_LBSPPA128_LBSPPB2048_LPB32_MIWT2_8_PLR1_SU32_SUM0_SUS256_VWA1_VWB2_WGM1_WGMXCC1_WGMXCCGn1
    SolutionIndex: 37
    SolutionNameMin: Cijk_Alik_Bjlk_BSS_BH_UserArgs_MT64x256x32_MI16x16x1_SN_LDSB1_CLR1_GSU0_GSUC0_GSUWGMRR0_K1_LBSPPA128_LBSPPB2048_LPB0_MIWT2_8_PLR1_SU32_SUM0_SUS256_VWA1_VWB4_WGM4_WGMXCC1_WGMXCCGn1
    SolutionIndex: 38
    SolutionNameMin: Cijk_Alik_Bjlk_BSS_BH_UserArgs_MT64x256x32_MI16x16x1_SN_LDSB1_CLR1_GSU0_GSUC0_GSUWGMRR0_K1_LBSPPA128_LBSPPB2048_LPB0_MIWT2_8_PLR1_SU32_SUM0_SUS256_VWA1_VWB8_WGM4_WGMXCC1_WGMXCCGn1
    SolutionIndex: 39
    SolutionNameMin: Cijk_Alik_Bjlk_BSS_BH_UserArgs_MT64x256x32_MI16x16x1_SN_LDSB1_CLR1_GSU0_GSUC0_GSUWGMRR0_K1_LBSPPA128_LBSPPB2048_LPB0_MIWT2_8_PLR1_SU32_SUM0_SUS256_VWA1_VWB8_WGM8_WGMXCC1_WGMXCCGn1
    SolutionIndex: 40
    SolutionNameMin: Cijk_Alik_Bjlk_BSS_BH_UserArgs_MT128x128x32_MI16x16x1_SN_LDSB1_CLR1_GSU0_GSUC0_GSUWGMRR0_K1_LBSPPA128_LBSPPB1024_LPB16_MIWT4_4_PLR1_SU32_SUM0_SUS256_VWA1_VWB1_WGM1_WGMXCC1_WGMXCCGn1
    SolutionIndex: 41
    SolutionNameMin: Cijk_Alik_Bjlk_BSS_BH_UserArgs_MT128x128x32_MI16x16x1_SN_LDSB1_CLR1_GSU0_GSUC0_GSUWGMRR0_K1_LBSPPA256_LBSPPB1024_LPB16_MIWT4_4_PLR1_SU32_SUM0_SUS256_VWA4_VWB1_WGM1_WGMXCC1_WGMXCCGn1
    SolutionIndex: 42
    SolutionNameMin: Cijk_Alik_Bjlk_BSS_BH_UserArgs_MT128x128x32_MI16x16x1_SN_LDSB1_CLR1_GSU0_GSUC0_GSUWGMRR0_K1_LBSPPA128_LBSPPB1024_LPB32_MIWT4_4_PLR1_SU32_SUM0_SUS256_VWA1_VWB2_WGM1_WGMXCC1_WGMXCCGn1
    SolutionIndex: 43
    SolutionNameMin: Cijk_Alik_Bjlk_BSS_BH_UserArgs_MT128x128x32_MI16x16x1_SN_LDSB1_CLR1_GSU0_GSUC0_GSUWGMRR0_K1_LBSPPA256_LBSPPB1024_LPB32_MIWT4_4_PLR1_SU32_SUM0_SUS256_VWA4_VWB2_WGM1_WGMXCC1_WGMXCCGn1
    SolutionIndex: 44
    SolutionNameMin: Cijk_Alik_Bjlk_BSS_BH_UserArgs_MT128x128x32_MI16x16x1_SN_LDSB1_CLR1_GSU0_GSUC0_GSUWGMRR0_K1_LBSPPA128_LBSPPB1024_LPB0_MIWT4_4_PLR1_SU32_SUM0_SUS256_VWA1_VWB4_WGM1_WGMXCC1_WGMXCCGn1
    SolutionIndex: 45
    SolutionNameMin: Cijk_Alik_Bjlk_BSS_BH_UserArgs_MT128x128x32_MI16x16x1_SN_LDSB1_CLR1_GSU0_GSUC0_GSUWGMRR0_K1_LBSPPA256_LBSPPB1024_LPB0_MIWT4_4_PLR1_SU32_SUM0_SUS256_VWA4_VWB4_WGM1_WGMXCC1_WGMXCCGn1
    SolutionIndex: 46
    SolutionNameMin: Cijk_Alik_Bjlk_BSS_BH_UserArgs_MT128x128x32_MI16x16x1_SN_LDSB1_CLR1_GSU0_GSUC0_GSUWGMRR0_K1_LBSPPA128_LBSPPB1024_LPB16_MIWT4_4_PLR1_SU32_SUM0_SUS256_VWA1_VWB1_WGM4_WGMXCC1_WGMXCCGn1
    SolutionIndex: 47
    SolutionNameMin: Cijk_Alik_Bjlk_BSS_BH_UserArgs_MT128x128x32_MI16x16x1_SN_LDSB1_CLR1_GSU0_GSUC0_GSUWGMRR0_K1_LBSPPA256_LBSPPB1024_LPB16_MIWT4_4_PLR1_SU32_SUM0_SUS256_VWA4_VWB1_WGM4_WGMXCC1_WGMXCCGn1
    SolutionIndex: 48
    SolutionNameMin: Cijk_Alik_Bjlk_BSS_BH_UserArgs_MT128x128x32_MI16x16x1_SN_LDSB1_CLR1_GSU0_GSUC0_GSUWGMRR0_K1_LBSPPA128_LBSPPB1024_LPB0_MIWT4_4_PLR1_SU32_SUM0_SUS256_VWA1_VWB4_WGM4_WGMXCC1_WGMXCCGn1
    SolutionIndex: 49
    SolutionNameMin: Cijk_Alik_Bjlk_BSS_BH_UserArgs_MT128x128x32_MI16x16x1_SN_LDSB1_CLR1_GSU0_GSUC0_GSUWGMRR0_K1_LBSPPA256_LBSPPB1024_LPB0_MIWT4_4_PLR1_SU32_SUM0_SUS256_VWA4_VWB4_WGM4_WGMXCC1_WGMXCCGn1
    SolutionIndex: 50
    SolutionNameMin: Cijk_Alik_Bjlk_BSS_BH_UserArgs_MT128x128x32_MI16x16x1_SN_LDSB1_CLR1_GSU0_GSUC0_GSUWGMRR0_K1_LBSPPA128_LBSPPB1024_LPB16_MIWT4_4_PLR1_SU32_SUM0_SUS256_VWA1_VWB1_WGM8_WGMXCC1_WGMXCCGn1
    SolutionIndex: 51
    SolutionNameMin: Cijk_Alik_Bjlk_BSS_BH_UserArgs_MT128x128x32_MI16x16x1_SN_LDSB1_CLR1_GSU0_GSUC0_GSUWGMRR0_K1_LBSPPA256_LBSPPB1024_LPB16_MIWT4_4_PLR1_SU32_SUM0_SUS256_VWA4_VWB1_WGM8_WGMXCC1_WGMXCCGn1
    SolutionIndex: 52
    SolutionNameMin: Cijk_Alik_Bjlk_BSS_BH_UserArgs_MT128x128x32_MI16x16x1_SN_LDSB1_CLR1_GSU0_GSUC0_GSUWGMRR0_K1_LBSPPA128_LBSPPB1024_LPB32_MIWT4_4_PLR1_SU32_SUM0_SUS256_VWA1_VWB2_WGM8_WGMXCC1_WGMXCCGn1
    SolutionIndex: 53
    SolutionNameMin: Cijk_Alik_Bjlk_BSS_BH_UserArgs_MT128x128x32_MI16x16x1_SN_LDSB1_CLR1_GSU0_GSUC0_GSUWGMRR0_K1_LBSPPA128_LBSPPB1024_LPB0_MIWT4_4_PLR1_SU32_SUM0_SUS256_VWA1_VWB4_WGM8_WGMXCC1_WGMXCCGn1
    SolutionIndex: 54
    SolutionNameMin: Cijk_Alik_Bjlk_BSS_BH_UserArgs_MT64x128x32_MI16x16x1_SN_LDSB0_CLR1_GSU0_GSUC0_GSUWGMRR0_K1_LBSPPA128_LBSPPB1024_LPB32_MIWT2_4_PLR1_SU32_SUM0_SUS256_VWA2_VWB2_WGM1_WGMXCC1_WGMXCCGn1
    SolutionIndex: 55
    SolutionNameMin: Cijk_Alik_Bjlk_BSS_BH_UserArgs_MT64x128x32_MI16x16x1_SN_LDSB0_CLR1_GSU0_GSUC0_GSUWGMRR0_K1_LBSPPA128_LBSPPB1024_LPB0_MIWT2_4_PLR1_SU32_SUM0_SUS256_VWA2_VWB4_WGM4_WGMXCC1_WGMXCCGn1
    SolutionIndex: 56
    SolutionNameMin: Cijk_Alik_Bjlk_BSS_BH_UserArgs_MT64x128x32_MI16x16x1_SN_LDSB0_CLR1_GSU0_GSUC0_GSUWGMRR0_K1_LBSPPA128_LBSPPB1024_LPB0_MIWT2_4_PLR1_SU32_SUM0_SUS256_VWA1_VWB4_WGM8_WGMXCC1_WGMXCCGn1
    SolutionIndex: 57
    SolutionNameMin: Cijk_Alik_Bjlk_BSS_BH_UserArgs_MT64x128x32_MI16x16x1_SN_LDSB0_CLR0_GSU0_GSUC0_GSUWGMRR0_K1_LBSPPA128_LBSPPB1024_LPB0_MIWT2_4_PLR0_SU32_SUM0_SUS256_VWA2_VWB4_WGM8_WGMXCC1_WGMXCCGn1
    SolutionIndex: 58
    SolutionNameMin: Cijk_Alik_Bjlk_BSS_BH_UserArgs_MT128x64x32_MI16x16x1_SN_LDSB0_CLR0_GSU0_GSUC0_GSUWGMRR0_K1_LBSPPA128_LBSPPB512_LPB32_MIWT4_2_PLR0_SU32_SUM0_SUS256_VWA2_VWB2_WGM1_WGMXCC1_WGMXCCGn1
    SolutionIndex: 59
    SolutionNameMin: Cijk_Alik_Bjlk_BSS_BH_UserArgs_MT64x64x32_MI16x16x1_SN_LDSB0_CLR1_GSU0_GSUC0_GSUWGMRR0_K1_LBSPPA128_LBSPPB512_LPB32_MIWT2_2_PLR1_SU32_SUM0_SUS256_VWA1_VWB2_WGM1_WGMXCC1_WGMXCCGn1
    SolutionIndex: 60
    SolutionNameMin: Cijk_Alik_Bjlk_BSS_BH_UserArgs_MT32x64x32_MI16x16x1_SN_LDSB0_CLR1_GSU0_GSUC0_GSUWGMRR0_K1_LBSPPA128_LBSPPB512_LPB32_MIWT1_2_PLR1_SU32_SUM0_SUS256_VWA1_VWB2_WGM1_WGMXCC1_WGMXCCGn1
    SolutionIndex: 61
    SolutionNameMin: Cijk_Alik_Bjlk_BSS_BH_UserArgs_MT32x32x32_MI16x16x1_SN_LDSB0_CLR1_GSU0_GSUC0_GSUWGMRR0_K1_LBSPPA128_LBSPPB256_LPB16_MIWT1_1_PLR1_SU32_SUM0_SUS256_VWA1_VWB1_WGM1_WGMXCC1_WGMXCCGn1
    SolutionIndex: 62
    SolutionNameMin: Cijk_Alik_Bjlk_BSS_BH_UserArgs_MT128x256x64_MI16x16x1_SN_LDSB1_CLR1_GSU0_GSUC0_GSUWGMRR0_K1_LBSPPA128_LBSPPB4096_LPB0_MIWT4_8_PLR1_SU32_SUM0_SUS256_VWA1_VWB4_WGM1_WGMXCC1_WGMXCCGn1
    SolutionIndex: 63
    SolutionNameMin: Cijk_Alik_Bjlk_BSS_BH_UserArgs_MT128x256x64_MI16x16x1_SN_LDSB1_CLR1_GSU0_GSUC0_GSUWGMRR0_K1_LBSPPA256_LBSPPB4096_LPB0_MIWT4_8_PLR1_SU32_SUM0_SUS256_VWA2_VWB4_WGM1_WGMXCC1_WGMXCCGn1
    SolutionIndex: 64
    SolutionNameMin: Cijk_Alik_Bjlk_BSS_BH_UserArgs_MT128x256x64_MI16x16x1_SN_LDSB1_CLR1_GSU0_GSUC0_GSUWGMRR0_K1_LBSPPA512_LBSPPB4096_LPB0_MIWT4_8_PLR1_SU32_SUM0_SUS256_VWA4_VWB4_WGM1_WGMXCC1_WGMXCCGn1
    SolutionIndex: 65
    SolutionNameMin: Cijk_Alik_Bjlk_BSS_BH_UserArgs_MT128x256x64_MI16x16x1_SN_LDSB1_CLR1_GSU0_GSUC0_GSUWGMRR0_K1_LBSPPA512_LBSPPB4096_LPB0_MIWT4_8_PLR1_SU32_SUM0_SUS256_VWA4_VWB4_WGM4_WGMXCC1_WGMXCCGn1
    SolutionIndex: 66
    SolutionNameMin: Cijk_Alik_Bjlk_BSS_BH_UserArgs_MT128x256x64_MI16x16x1_SN_LDSB1_CLR1_GSU0_GSUC0_GSUWGMRR0_K1_LBSPPA512_LBSPPB4096_LPB32_MIWT4_8_PLR1_SU32_SUM0_SUS256_VWA4_VWB2_WGM8_WGMXCC1_WGMXCCGn1
    SolutionIndex: 67
    SolutionNameMin: Cijk_Alik_Bjlk_BSS_BH_UserArgs_MT128x256x64_MI16x16x1_SN_LDSB1_CLR1_GSU0_GSUC0_GSUWGMRR0_K1_LBSPPA512_LBSPPB4096_LPB0_MIWT4_8_PLR1_SU32_SUM0_SUS256_VWA4_VWB4_WGM8_WGMXCC1_WGMXCCGn1
    SolutionIndex: 68
    SolutionNameMin: Cijk_Alik_Bjlk_BSS_BH_UserArgs_MT256x128x64_MI16x16x1_SN_LDSB1_CLR1_GSU0_GSUC0_GSUWGMRR0_K1_LBSPPA512_LBSPPB2048_LPB0_MIWT8_4_PLR1_SU32_SUM0_SUS256_VWA4_VWB4_WGM1_WGMXCC1_WGMXCCGn1
    SolutionIndex: 69
    SolutionNameMin: Cijk_Alik_Bjlk_BSS_BH_UserArgs_MT256x128x64_MI16x16x1_SN_LDSB1_CLR1_GSU0_GSUC0_GSUWGMRR0_K1_LBSPPA512_LBSPPB2048_LPB0_MIWT8_4_PLR1_SU32_SUM0_SUS256_VWA4_VWB4_WGM8_WGMXCC1_WGMXCCGn1
    SolutionIndex: 70
    SolutionNameMin: Cijk_Alik_Bjlk_BSS_BH_UserArgs_MT128x128x64_MI16x16x1_SN_LDSB1_CLR1_GSU0_GSUC0_GSUWGMRR0_K1_LBSPPA256_LBSPPB2048_LPB0_MIWT4_4_PLR1_SU32_SUM0_SUS256_VWA2_VWB4_WGM1_WGMXCC1_WGMXCCGn1
    SolutionIndex: 71
    SolutionNameMin: Cijk_Alik_Bjlk_BSS_BH_UserArgs_MT128x128x64_MI16x16x1_SN_LDSB1_CLR1_GSU0_GSUC0_GSUWGMRR0_K1_LBSPPA512_LBSPPB2048_LPB0_MIWT4_4_PLR1_SU32_SUM0_SUS256_VWA4_VWB4_WGM1_WGMXCC1_WGMXCCGn1
    SolutionIndex: 72
    SolutionNameMin: Cijk_Alik_Bjlk_BSS_BH_UserArgs_MT128x128x64_MI16x16x1_SN_LDSB1_CLR1_GSU0_GSUC0_GSUWGMRR0_K1_LBSPPA128_LBSPPB2048_LPB0_MIWT4_4_PLR1_SU32_SUM0_SUS256_VWA1_VWB4_WGM4_WGMXCC1_WGMXCCGn1
    SolutionIndex: 73
    SolutionNameMin: Cijk_Alik_Bjlk_BSS_BH_UserArgs_MT128x128x64_MI16x16x1_SN_LDSB1_CLR1_GSU0_GSUC0_GSUWGMRR0_K1_LBSPPA512_LBSPPB2048_LPB0_MIWT4_4_PLR1_SU32_SUM0_SUS256_VWA4_VWB4_WGM4_WGMXCC1_WGMXCCGn1
    SolutionIndex: 74
    SolutionNameMin: Cijk_Alik_Bjlk_BSS_BH_UserArgs_MT128x128x64_MI16x16x1_SN_LDSB1_CLR1_GSU0_GSUC0_GSUWGMRR0_K1_LBSPPA256_LBSPPB2048_LPB32_MIWT4_4_PLR1_SU32_SUM0_SUS256_VWA2_VWB2_WGM8_WGMXCC1_WGMXCCGn1
    SolutionIndex: 75
    SolutionNameMin: Cijk_Alik_Bjlk_BSS_BH_UserArgs_MT128x128x64_MI16x16x1_SN_LDSB1_CLR1_GSU0_GSUC0_GSUWGMRR0_K1_LBSPPA512_LBSPPB2048_LPB0_MIWT4_4_PLR1_SU32_SUM0_SUS256_VWA4_VWB4_WGM8_WGMXCC1_WGMXCCGn1
    SolutionIndex: 76
    SolutionNameMin: Cijk_Alik_Bjlk_BSS_BH_UserArgs_MT64x128x64_MI16x16x1_SN_LDSB1_CLR1_GSU0_GSUC0_GSUWGMRR0_K1_LBSPPA128_LBSPPB2048_LPB0_MIWT2_4_PLR1_SU32_SUM0_SUS256_VWA1_VWB4_WGM1_WGMXCC1_WGMXCCGn1
    SolutionIndex: 77
    SolutionNameMin: Cijk_Alik_Bjlk_BSS_BH_UserArgs_MT64x128x64_MI16x16x1_SN_LDSB1_CLR1_GSU0_GSUC0_GSUWGMRR0_K1_LBSPPA256_LBSPPB2048_LPB0_MIWT2_4_PLR1_SU32_SUM0_SUS256_VWA2_VWB4_WGM1_WGMXCC1_WGMXCCGn1
    SolutionIndex: 78
    SolutionNameMin: Cijk_Alik_Bjlk_BSS_BH_UserArgs_MT64x128x64_MI16x16x1_SN_LDSB1_CLR1_GSU0_GSUC0_GSUWGMRR0_K1_LBSPPA128_LBSPPB2048_LPB32_MIWT2_4_PLR1_SU32_SUM0_SUS256_VWA1_VWB2_WGM4_WGMXCC1_WGMXCCGn1
    SolutionIndex: 79
    SolutionNameMin: Cijk_Alik_Bjlk_BSS_BH_UserArgs_MT64x128x64_MI16x16x1_SN_LDSB1_CLR1_GSU0_GSUC0_GSUWGMRR0_K1_LBSPPA256_LBSPPB2048_LPB32_MIWT2_4_PLR1_SU32_SUM0_SUS256_VWA2_VWB2_WGM4_WGMXCC1_WGMXCCGn1
    SolutionIndex: 80
    SolutionNameMin: Cijk_Alik_Bjlk_BSS_BH_UserArgs_MT64x128x64_MI16x16x1_SN_LDSB1_CLR1_GSU0_GSUC0_GSUWGMRR0_K1_LBSPPA128_LBSPPB2048_LPB0_MIWT2_4_PLR1_SU32_SUM0_SUS256_VWA1_VWB4_WGM4_WGMXCC1_WGMXCCGn1
    SolutionIndex: 81
    SolutionNameMin: Cijk_Alik_Bjlk_BSS_BH_UserArgs_MT64x128x64_MI16x16x1_SN_LDSB1_CLR1_GSU0_GSUC0_GSUWGMRR0_K1_LBSPPA128_LBSPPB2048_LPB0_MIWT2_4_PLR1_SU32_SUM0_SUS256_VWA1_VWB4_WGM8_WGMXCC1_WGMXCCGn1
    SolutionIndex: 82
    SolutionNameMin: Cijk_Alik_Bjlk_BSS_BH_UserArgs_MT64x128x64_MI16x16x1_SN_LDSB1_CLR1_GSU0_GSUC0_GSUWGMRR0_K1_LBSPPA256_LBSPPB2048_LPB0_MIWT2_4_PLR1_SU32_SUM0_SUS256_VWA2_VWB4_WGM8_WGMXCC1_WGMXCCGn1
    SolutionIndex: 83
    SolutionNameMin: Cijk_Alik_Bjlk_BSS_BH_UserArgs_MT128x64x64_MI16x16x1_SN_LDSB1_CLR1_GSU0_GSUC0_GSUWGMRR0_K1_LBSPPA128_LBSPPB1024_LPB16_MIWT4_2_PLR1_SU32_SUM0_SUS256_VWA1_VWB1_WGM1_WGMXCC1_WGMXCCGn1
    SolutionIndex: 84
    SolutionNameMin: Cijk_Alik_Bjlk_BSS_BH_UserArgs_MT128x64x64_MI16x16x1_SN_LDSB1_CLR1_GSU0_GSUC0_GSUWGMRR0_K1_LBSPPA128_LBSPPB1024_LPB32_MIWT4_2_PLR1_SU32_SUM0_SUS256_VWA1_VWB2_WGM1_WGMXCC1_WGMXCCGn1
    SolutionIndex: 85
    SolutionNameMin: Cijk_Alik_Bjlk_BSS_BH_UserArgs_MT128x64x64_MI16x16x1_SN_LDSB1_CLR1_GSU0_GSUC0_GSUWGMRR0_K1_LBSPPA512_LBSPPB1024_LPB32_MIWT4_2_PLR1_SU32_SUM0_SUS256_VWA4_VWB2_WGM1_WGMXCC1_WGMXCCGn1
    SolutionIndex: 86
    SolutionNameMin: Cijk_Alik_Bjlk_BSS_BH_UserArgs_MT128x64x64_MI16x16x1_SN_LDSB1_CLR1_GSU0_GSUC0_GSUWGMRR0_K1_LBSPPA256_LBSPPB1024_LPB16_MIWT4_2_PLR2_SU32_SUM0_SUS256_VWA2_VWB1_WGM1_WGMXCC1_WGMXCCGn1
    SolutionIndex: 87
    SolutionNameMin: Cijk_Alik_Bjlk_BSS_BH_UserArgs_MT128x64x64_MI16x16x1_SN_LDSB1_CLR1_GSU0_GSUC0_GSUWGMRR0_K1_LBSPPA128_LBSPPB1024_LPB32_MIWT4_2_PLR2_SU32_SUM0_SUS256_VWA1_VWB2_WGM1_WGMXCC1_WGMXCCGn1
    SolutionIndex: 88
    SolutionNameMin: Cijk_Alik_Bjlk_BSS_BH_UserArgs_MT128x64x64_MI16x16x1_SN_LDSB1_CLR1_GSU0_GSUC0_GSUWGMRR0_K1_LBSPPA512_LBSPPB1024_LPB32_MIWT4_2_PLR2_SU32_SUM0_SUS256_VWA4_VWB2_WGM1_WGMXCC1_WGMXCCGn1
    SolutionIndex: 89
    SolutionNameMin: Cijk_Alik_Bjlk_BSS_BH_UserArgs_MT128x64x64_MI16x16x1_SN_LDSB1_CLR1_GSU0_GSUC0_GSUWGMRR0_K1_LBSPPA128_LBSPPB1024_LPB32_MIWT4_2_PLR1_SU32_SUM0_SUS256_VWA1_VWB2_WGM4_WGMXCC1_WGMXCCGn1
    SolutionIndex: 90
    SolutionNameMin: Cijk_Alik_Bjlk_BSS_BH_UserArgs_MT128x64x64_MI16x16x1_SN_LDSB1_CLR1_GSU0_GSUC0_GSUWGMRR0_K1_LBSPPA512_LBSPPB1024_LPB32_MIWT4_2_PLR1_SU32_SUM0_SUS256_VWA4_VWB2_WGM4_WGMXCC1_WGMXCCGn1
    SolutionIndex: 91
    SolutionNameMin: Cijk_Alik_Bjlk_BSS_BH_UserArgs_MT128x64x64_MI16x16x1_SN_LDSB1_CLR1_GSU0_GSUC0_GSUWGMRR0_K1_LBSPPA128_LBSPPB1024_LPB32_MIWT4_2_PLR1_SU32_SUM0_SUS256_VWA1_VWB2_WGM8_WGMXCC1_WGMXCCGn1
    SolutionIndex: 92
    SolutionNameMin: Cijk_Alik_Bjlk_BSS_BH_UserArgs_MT128x64x64_MI16x16x1_SN_LDSB1_CLR1_GSU0_GSUC0_GSUWGMRR0_K1_LBSPPA512_LBSPPB1024_LPB32_MIWT4_2_PLR1_SU32_SUM0_SUS256_VWA4_VWB2_WGM8_WGMXCC1_WGMXCCGn1
    SolutionIndex: 93
    SolutionNameMin: Cijk_Alik_Bjlk_BSS_BH_UserArgs_MT64x64x64_MI16x16x1_SN_LDSB1_CLR1_GSU0_GSUC0_GSUWGMRR0_K1_LBSPPA128_LBSPPB1024_LPB32_MIWT2_2_PLR1_SU32_SUM0_SUS256_VWA1_VWB2_WGM1_WGMXCC1_WGMXCCGn1
    SolutionIndex: 94
    SolutionNameMin: Cijk_Alik_Bjlk_BSS_BH_UserArgs_MT64x64x64_MI16x16x1_SN_LDSB1_CLR1_GSU0_GSUC0_GSUWGMRR0_K1_LBSPPA128_LBSPPB1024_LPB32_MIWT2_2_PLR1_SU32_SUM0_SUS256_VWA1_VWB2_WGM4_WGMXCC1_WGMXCCGn1
    SolutionIndex: 95
    SolutionNameMin: Cijk_Alik_Bjlk_BSS_BH_UserArgs_MT64x64x64_MI16x16x1_SN_LDSB1_CLR1_GSU0_GSUC0_GSUWGMRR0_K1_LBSPPA256_LBSPPB1024_LPB32_MIWT2_2_PLR1_SU32_SUM0_SUS256_VWA2_VWB2_WGM4_WGMXCC1_WGMXCCGn1
    SolutionIndex: 96
    SolutionNameMin: Cijk_Alik_Bjlk_BSS_BH_UserArgs_MT64x64x64_MI16x16x1_SN_LDSB1_CLR1_GSU0_GSUC0_GSUWGMRR0_K1_LBSPPA128_LBSPPB1024_LPB32_MIWT2_2_PLR1_SU32_SUM0_SUS256_VWA1_VWB2_WGM8_WGMXCC1_WGMXCCGn1
    SolutionIndex: 97
    SolutionNameMin: Cijk_Alik_Bjlk_BSS_BH_UserArgs_MT64x64x64_MI16x16x1_SN_LDSB1_CLR1_GSU0_GSUC0_GSUWGMRR0_K1_LBSPPA256_LBSPPB1024_LPB32_MIWT2_2_PLR1_SU32_SUM0_SUS256_VWA2_VWB2_WGM8_WGMXCC1_WGMXCCGn1
    SolutionIndex: 98
    SolutionNameMin: Cijk_Alik_Bjlk_BSS_BH_UserArgs_MT32x64x64_MI16x16x1_SN_LDSB0_CLR1_GSU0_GSUC0_GSUWGMRR0_K1_LBSPPA128_LBSPPB1024_LPB32_MIWT1_2_PLR1_SU32_SUM0_SUS256_VWA1_VWB2_WGM1_WGMXCC1_WGMXCCGn1
    SolutionIndex: 99
    SolutionNameMin: Cijk_Alik_Bjlk_BSS_BH_UserArgs_MT32x64x64_MI16x16x1_SN_LDSB0_CLR1_GSU0_GSUC0_GSUWGMRR0_K1_LBSPPA128_LBSPPB1024_LPB32_MIWT1_2_PLR1_SU32_SUM0_SUS256_VWA1_VWB2_WGM8_WGMXCC1_WGMXCCGn1
    SolutionIndex: 100
    SolutionNameMin: Cijk_Alik_Bjlk_BSS_BH_UserArgs_MT64x32x64_MI16x16x1_SN_LDSB0_CLR1_GSU0_GSUC0_GSUWGMRR0_K1_LBSPPA128_LBSPPB512_LPB16_MIWT2_1_PLR1_SU32_SUM0_SUS256_VWA1_VWB1_WGM1_WGMXCC1_WGMXCCGn1
    SolutionIndex: 101
    SolutionNameMin: Cijk_Alik_Bjlk_BSS_BH_UserArgs_MT64x32x64_MI16x16x1_SN_LDSB0_CLR1_GSU0_GSUC0_GSUWGMRR0_K1_LBSPPA256_LBSPPB512_LPB16_MIWT2_1_PLR1_SU32_SUM0_SUS256_VWA2_VWB1_WGM1_WGMXCC1_WGMXCCGn1
    SolutionIndex: 102
    SolutionNameMin: Cijk_Alik_Bjlk_BSS_BH_UserArgs_MT64x128x128_MI16x16x1_SN_LDSB1_CLR1_GSU0_GSUC0_GSUWGMRR0_K1_LBSPPA256_LBSPPB2048_LPB0_MIWT2_4_PLR2_SU32_SUM0_SUS256_VWA1_VWB4_WGM1_WGMXCC1_WGMXCCGn1
    SolutionIndex: 103
    SolutionNameMin: Cijk_Alik_Bjlk_BSS_BH_UserArgs_MT64x128x128_MI16x16x1_SN_LDSB1_CLR1_GSU0_GSUC0_GSUWGMRR0_K1_LBSPPA512_LBSPPB2048_LPB0_MIWT2_4_PLR2_SU32_SUM0_SUS256_VWA2_VWB4_WGM4_WGMXCC1_WGMXCCGn1
    SolutionIndex: 104
    SolutionNameMin: Cijk_Alik_Bjlk_BSS_BH_UserArgs_MT64x128x128_MI16x16x1_SN_LDSB1_CLR1_GSU0_GSUC0_GSUWGMRR0_K1_LBSPPA256_LBSPPB2048_LPB0_MIWT2_4_PLR2_SU32_SUM0_SUS256_VWA1_VWB4_WGM8_WGMXCC1_WGMXCCGn1
    SolutionIndex: 105
    SolutionNameMin: Cijk_Alik_Bjlk_BSS_BH_UserArgs_MT128x64x128_MI16x16x1_SN_LDSB1_CLR1_GSU0_GSUC0_GSUWGMRR0_K1_LBSPPA1024_LBSPPB1024_LPB32_MIWT4_2_PLR2_SU32_SUM0_SUS256_VWA4_VWB2_WGM1_WGMXCC1_WGMXCCGn1
    SolutionIndex: 106
    SolutionNameMin: Cijk_Alik_Bjlk_BSS_BH_UserArgs_MT128x64x128_MI16x16x1_SN_LDSB1_CLR1_GSU0_GSUC0_GSUWGMRR0_K1_LBSPPA256_LBSPPB1024_LPB32_MIWT4_2_PLR2_SU32_SUM0_SUS256_VWA1_VWB2_WGM4_WGMXCC1_WGMXCCGn1
    SolutionIndex: 107
    SolutionNameMin: Cijk_Alik_Bjlk_BSS_BH_UserArgs_MT128x64x128_MI16x16x1_SN_LDSB1_CLR1_GSU0_GSUC0_GSUWGMRR0_K1_LBSPPA1024_LBSPPB1024_LPB32_MIWT4_2_PLR2_SU32_SUM0_SUS256_VWA4_VWB2_WGM4_WGMXCC1_WGMXCCGn1
    SolutionIndex: 108
    SolutionNameMin: Cijk_Alik_Bjlk_BSS_BH_UserArgs_MT128x64x128_MI16x16x1_SN_LDSB1_CLR1_GSU0_GSUC0_GSUWGMRR0_K1_LBSPPA256_LBSPPB1024_LPB32_MIWT4_2_PLR2_SU32_SUM0_SUS256_VWA1_VWB2_WGM8_WGMXCC1_WGMXCCGn1
    SolutionIndex: 109
    SolutionNameMin: Cijk_Alik_Bjlk_BSS_BH_UserArgs_MT64x64x128_MI16x16x1_SN_LDSB1_CLR1_GSU0_GSUC0_GSUWGMRR0_K1_LBSPPA256_LBSPPB1024_LPB32_MIWT2_2_PLR2_SU32_SUM0_SUS256_VWA1_VWB2_WGM1_WGMXCC1_WGMXCCGn1
    SolutionIndex: 110
    SolutionNameMin: Cijk_Alik_Bjlk_BSS_BH_UserArgs_MT32x64x128_MI16x16x1_SN_LDSB1_CLR1_GSU0_GSUC0_GSUWGMRR0_K1_LBSPPA256_LBSPPB1024_LPB32_MIWT1_2_PLR1_SU32_SUM0_SUS256_VWA1_VWB2_WGM1_WGMXCC1_WGMXCCGn1
    SolutionIndex: 111
    SolutionNameMin: Cijk_Alik_Bjlk_BSS_BH_UserArgs_MT32x64x128_MI16x16x1_SN_LDSB1_CLR1_GSU0_GSUC0_GSUWGMRR0_K1_LBSPPA256_LBSPPB1024_LPB32_MIWT1_2_PLR2_SU32_SUM0_SUS256_VWA1_VWB2_WGM1_WGMXCC1_WGMXCCGn1
    SolutionIndex: 112
    SolutionNameMin: Cijk_Alik_Bjlk_BSS_BH_UserArgs_MT32x64x128_MI16x16x1_SN_LDSB1_CLR1_GSU0_GSUC0_GSUWGMRR0_K1_LBSPPA256_LBSPPB1024_LPB32_MIWT1_2_PLR2_SU32_SUM0_SUS256_VWA1_VWB2_WGM4_WGMXCC1_WGMXCCGn1
    SolutionIndex: 113
    SolutionNameMin: Cijk_Alik_Bjlk_BSS_BH_UserArgs_MT32x64x128_MI16x16x1_SN_LDSB1_CLR1_GSU0_GSUC0_GSUWGMRR0_K1_LBSPPA256_LBSPPB1024_LPB32_MIWT1_2_PLR2_SU32_SUM0_SUS256_VWA1_VWB2_WGM8_WGMXCC1_WGMXCCGn1
    SolutionIndex: 114
    SolutionNameMin: Cijk_Alik_Bjlk_BSS_BH_UserArgs_MT64x32x128_MI16x16x1_SN_LDSB1_CLR1_GSU0_GSUC0_GSUWGMRR0_K1_LBSPPA256_LBSPPB512_LPB16_MIWT2_1_PLR1_SU32_SUM0_SUS256_VWA1_VWB1_WGM1_WGMXCC1_WGMXCCGn1
    SolutionIndex: 115
    SolutionNameMin: Cijk_Alik_Bjlk_BSS_BH_UserArgs_MT64x32x128_MI16x16x1_SN_LDSB1_CLR1_GSU0_GSUC0_GSUWGMRR0_K1_LBSPPA256_LBSPPB512_LPB16_MIWT2_1_PLR2_SU32_SUM0_SUS256_VWA1_VWB1_WGM8_WGMXCC1_WGMXCCGn1
    SolutionIndex: 116
    SolutionNameMin: Cijk_Alik_Bjlk_BSS_BH_UserArgs_MT32x32x128_MI16x16x1_SN_LDSB1_CLR1_GSU0_GSUC0_GSUWGMRR0_K1_LBSPPA256_LBSPPB512_LPB16_MIWT1_1_PLR1_SU32_SUM0_SUS256_VWA1_VWB1_WGM1_WGMXCC1_WGMXCCGn1
    SolutionIndex: 117
    SolutionNameMin: Cijk_Alik_Bjlk_BSS_BH_UserArgs_MT32x32x128_MI16x16x1_SN_LDSB1_CLR1_GSU0_GSUC0_GSUWGMRR0_K1_LBSPPA256_LBSPPB512_LPB16_MIWT1_1_PLR2_SU32_SUM0_SUS256_VWA1_VWB1_WGM1_WGMXCC1_WGMXCCGn1
    SolutionIndex: 118
    SolutionNameMin: Cijk_Alik_Bjlk_BSS_BH_UserArgs_MT32x32x128_MI16x16x1_SN_LDSB1_CLR1_GSU0_GSUC0_GSUWGMRR0_K1_LBSPPA256_LBSPPB512_LPB16_MIWT1_1_PLR1_SU32_SUM0_SUS256_VWA1_VWB1_WGM4_WGMXCC1_WGMXCCGn1
    SolutionIndex: 119
    SolutionNameMin: Cijk_Alik_Bjlk_BSS_BH_UserArgs_MT32x32x128_MI16x16x1_SN_LDSB1_CLR1_GSU0_GSUC0_GSUWGMRR0_K1_LBSPPA256_LBSPPB512_LPB16_MIWT1_1_PLR2_SU32_SUM0_SUS256_VWA1_VWB1_WGM4_WGMXCC1_WGMXCCGn1
    SolutionIndex: 120
    SolutionNameMin: Cijk_Alik_Bjlk_BSS_BH_UserArgs_MT32x32x128_MI16x16x1_SN_LDSB1_CLR1_GSU0_GSUC0_GSUWGMRR0_K1_LBSPPA256_LBSPPB512_LPB16_MIWT1_1_PLR2_SU32_SUM0_SUS256_VWA1_VWB1_WGM8_WGMXCC1_WGMXCCGn1
    SolutionIndex: 121
    SolutionNameMin: Cijk_Alik_Bjlk_BSS_BH_UserArgs_MT32x32x32_MI16x16x1_SN_LDSB0_CLR0_GSU0_GSUC0_GSUWGMRR0_K1_LBSPPA128_LBSPPB256_LPB16_MIWT1_1_PLR0_SU32_SUM0_SUS256_VWA1_VWB1_WGM4_WGMXCC1_WGMXCCGn1
- - - [128, 128, 1, 128, 128, 128, 128, 128]
    - [115, 0.077]
  - - [128, 128, 1, 256, 128, 128, 256, 128]
    - [109, 0.102]
  - - [128, 128, 1, 512, 128, 128, 512, 128]
    - [118, 0.173]
  - - [128, 128, 1, 1024, 128, 128, 1024, 128]
    - [116, 0.306]
  - - [128, 128, 1, 2048, 128, 128, 2048, 128]
    - [61, 0.516]
  - - [128, 128, 1, 4096, 128, 128, 4096, 128]
    - [98, 0.807]
  - - [128, 128, 1, 8192, 128, 128, 8192, 128]
    - [111, 1.289]
  - - [128, 256, 1, 128, 128, 128, 128, 256]
    - [116, 0.17]
  - - [128, 256, 1, 256, 128, 128, 256, 256]
    - [117, 0.253]
  - - [128, 256, 1, 512, 128, 128, 512, 256]
    - [117, 0.341]
  - - [128, 256, 1, 1024, 128, 128, 1024, 256]
    - [116, 0.587]
  - - [128, 256, 1, 2048, 128, 128, 2048, 256]
    - [111, 0.906]
  - - [128, 256, 1, 4096, 128, 128, 4096, 256]
    - [98, 1.415]
  - - [128, 256, 1, 8192, 128, 128, 8192, 256]
    - [111, 1.978]
  - - [128, 512, 1, 128, 128, 128, 128, 512]
    - [110, 0.315]
  - - [128, 512, 1, 256, 128, 128, 256, 512]
    - [116, 0.509]
  - - [128, 512, 1, 512, 128, 128, 512, 512]
    - [117, 0.793]
  - - [128, 512, 1, 1024, 128, 128, 1024, 512]
    - [120, 1.122]
  - - [128, 512, 1, 2048, 128, 128, 2048, 512]
    - [111, 1.576]
  - - [128, 512, 1, 4096, 128, 128, 4096, 512]
    - [96, 2.368]
  - - [128, 512, 1, 8192, 128, 128, 8192, 512]
    - [56, 2.805]
  - - [128, 1024, 1, 128, 128, 128, 128, 1024]
    - [111, 0.563]
  - - [128, 1024, 1, 256, 128, 128, 256, 1024]
    - [98, 0.929]
  - - [128, 1024, 1, 512, 128, 128, 512, 1024]
    - [111, 1.385]
  - - [128, 1024, 1, 1024, 128, 128, 1024, 1024]
    - [111, 1.946]
  - - [128, 1024, 1, 2048, 128, 128, 2048, 1024]
    - [57, 2.266]
  - - [128, 1024, 1, 4096, 128, 128, 4096, 1024]
    - [76, 3.372]
  - - [128, 1024, 1, 8192, 128, 128, 8192, 1024]
    - [71, 3.496]
  - - [128, 2048, 1, 128, 128, 128, 128, 2048]
    - [93, 0.984]
  - - [128, 2048, 1, 256, 128, 128, 256, 2048]
    - [93, 1.605]
  - - [128, 2048, 1, 512, 128, 128, 512, 2048]
    - [96, 2.21]
  - - [128, 2048, 1, 1024, 128, 128, 1024, 2048]
    - [81, 2.481]
  - - [128, 2048, 1, 2048, 128, 128, 2048, 2048]
    - [45, 2.955]
  - - [128, 2048, 1, 4096, 128, 128, 4096, 2048]
    - [77, 3.614]
  - - [128, 2048, 1, 8192, 128, 128, 8192, 2048]
    - [91, 4.112]
  - - [128, 4096, 1, 128, 128, 128, 128, 4096]
    - [86, 1.285]
  - - [128, 4096, 1, 256, 128, 128, 256, 4096]
    - [85, 2.199]
  - - [128, 4096, 1, 512, 128, 128, 512, 4096]
    - [80, 3.126]
  - - [128, 4096, 1, 1024, 128, 128, 1024, 4096]
    - [102, 3.483]
  - - [128, 4096, 1, 2048, 128, 128, 2048, 4096]
    - [17, 4.053]
  - - [128, 4096, 1, 4096, 128, 128, 4096, 4096]
    - [85, 4.392]
  - - [128, 4096, 1, 8192, 128, 128, 8192, 4096]
    - [24, 5.058]
  - - [128, 8192, 1, 128, 128, 128, 128, 8192]
    - [45, 1.763]
  - - [128, 8192, 1, 256, 128, 128, 256, 8192]
    - [44, 2.633]
  - - [128, 8192, 1, 512, 128, 128, 512, 8192]
    - [81, 3.426]
  - - [128, 8192, 1, 1024, 128, 128, 1024, 8192]
    - [105, 3.692]
  - - [128, 8192, 1, 2048, 128, 128, 2048, 8192]
    - [94, 4.71]
  - - [128, 8192, 1, 4096, 128, 128, 4096, 8192]
    - [15, 5.591]
  - - [128, 8192, 1, 8192, 128, 128, 8192, 8192]
    - [91, 5.638]
  - - [256, 128, 1, 128, 256, 256, 128, 128]
    - [119, 0.161]
  - - [256, 128, 1, 256, 256, 256, 256, 128]
    - [116, 0.242]
  - - [256, 128, 1, 512, 256, 256, 512, 128]
    - [117, 0.341]
  - - [256, 128, 1, 1024, 256, 256, 1024, 128]
    - [116, 0.581]
  - - [256, 128, 1, 2048, 256, 256, 2048, 128]
    - [60, 0.903]
  - - [256, 128, 1, 4096, 256, 256, 4096, 128]
    - [100, 1.407]
  - - [256, 128, 1, 8192, 256, 256, 8192, 128]
    - [113, 1.991]
  - - [256, 256, 1, 128, 256, 256, 128, 256]
    - [110, 0.309]
  - - [256, 256, 1, 256, 256, 256, 256, 256]
    - [118, 0.518]
  - - [256, 256, 1, 512, 256, 256, 512, 256]
    - [116, 0.788]
  - - [256, 256, 1, 1024, 256, 256, 1024, 256]
    - [117, 1.144]
  - - [256, 256, 1, 2048, 256, 256, 2048, 256]
    - [110, 1.532]
  - - [256, 256, 1, 4096, 256, 256, 4096, 256]
    - [93, 2.381]
  - - [256, 256, 1, 8192, 256, 256, 8192, 256]
    - [54, 2.694]
  - - [256, 512, 1, 128, 256, 256, 128, 512]
    - [111, 0.54]
  - - [256, 512, 1, 256, 256, 256, 256, 512]
    - [98, 0.938]
  - - [256, 512, 1, 512, 256, 256, 512, 512]
    - [98, 1.406]
  - - [256, 512, 1, 1024, 256, 256, 1024, 512]
    - [111, 1.944]
  - - [256, 512, 1, 2048, 256, 256, 2048, 512]
    - [56, 2.271]
  - - [256, 512, 1, 4096, 256, 256, 4096, 512]
    - [80, 3.401]
  - - [256, 512, 1, 8192, 256, 256, 8192, 512]
    - [107, 3.477]
  - - [256, 1024, 1, 128, 256, 256, 128, 1024]
    - [93, 0.981]
  - - [256, 1024, 1, 256, 256, 256, 256, 1024]
    - [93, 1.589]
  - - [256, 1024, 1, 512, 256, 256, 512, 1024]
    - [93, 2.329]
  - - [256, 1024, 1, 1024, 256, 256, 1024, 1024]
    - [92, 2.502]
  - - [256, 1024, 1, 2048, 256, 256, 2048, 1024]
    - [45, 3.099]
  - - [256, 1024, 1, 4096, 256, 256, 4096, 1024]
    - [71, 3.786]
  - - [256, 1024, 1, 8192, 256, 256, 8192, 1024]
    - [23, 4.834]
  - - [256, 2048, 1, 128, 256, 256, 128, 2048]
    - [58, 1.293]
  - - [256, 2048, 1, 256, 256, 256, 256, 2048]
    - [92, 2.209]
  - - [256, 2048, 1, 512, 256, 256, 512, 2048]
    - [90, 3.097]
  - - [256, 2048, 1, 1024, 256, 256, 1024, 2048]
    - [106, 3.457]
  - - [256, 2048, 1, 2048, 256, 256, 2048, 2048]
    - [97, 3.503]
  - - [256, 2048, 1, 4096, 256, 256, 4096, 2048]
    - [64, 4.414]
  - - [256, 2048, 1, 8192, 256, 256, 8192, 2048]
    - [15, 5.431]
  - - [256, 4096, 1, 128, 256, 256, 128, 4096]
    - [40, 1.702]
  - - [256, 4096, 1, 256, 256, 256, 256, 4096]
    - [42, 2.796]
  - - [256, 4096, 1, 512, 256, 256, 512, 4096]
    - [91, 3.433]
  - - [256, 4096, 1, 1024, 256, 256, 1024, 4096]
    - [93, 4.187]
  - - [256, 4096, 1, 2048, 256, 256, 2048, 4096]
    - [93, 4.94]
  - - [256, 4096, 1, 4096, 256, 256, 4096, 4096]
    - [33, 4.815]
  - - [256, 4096, 1, 8192, 256, 256, 8192, 4096]
    - [69, 6.132]
  - - [256, 8192, 1, 128, 256, 256, 128, 8192]
    - [17, 2.164]
  - - [256, 8192, 1, 256, 256, 256, 256, 8192]
    - [24, 3.423]
  - - [256, 8192, 1, 512, 256, 256, 512, 8192]
    - [76, 4.266]
  - - [256, 8192, 1, 1024, 256, 256, 1024, 8192]
    - [76, 5.476]
  - - [256, 8192, 1, 2048, 256, 256, 2048, 8192]
    - [80, 6.153]
  - - [256, 8192, 1, 4096, 256, 256, 4096, 8192]
    - [13, 6.105]
  - - [256, 8192, 1, 8192, 256, 256, 8192, 8192]
    - [23, 7.315]
  - - [512, 128, 1, 128, 512, 512, 128, 128]
    - [114, 0.316]
  - - [512, 128, 1, 256, 512, 512, 256, 128]
    - [117, 0.512]
  - - [512, 128, 1, 512, 512, 512, 512, 128]
    - [119, 0.787]
  - - [512, 128, 1, 1024, 512, 512, 1024, 128]
    - [117, 1.132]
  - - [512, 128, 1, 2048, 512, 512, 2048, 128]
    - [111, 1.548]
  - - [512, 128, 1, 4096, 512, 512, 4096, 128]
    - [97, 2.297]
  - - [512, 128, 1, 8192, 512, 512, 8192, 128]
    - [94, 2.765]
  - - [512, 256, 1, 128, 512, 512, 128, 256]
    - [111, 0.57]
  - - [512, 256, 1, 256, 512, 512, 256, 256]
    - [99, 0.937]
  - - [512, 256, 1, 512, 512, 512, 512, 256]
    - [98, 1.389]
  - - [512, 256, 1, 1024, 512, 512, 1024, 256]
    - [112, 1.907]
  - - [512, 256, 1, 2048, 512, 512, 2048, 256]
    - [55, 2.242]
  - - [512, 256, 1, 4096, 512, 512, 4096, 256]
    - [90, 3.433]
  - - [512, 256, 1, 8192, 512, 512, 8192, 256]
    - [49, 3.518]
  - - [512, 512, 1, 128, 512, 512, 128, 512]
    - [93, 0.993]
  - - [512, 512, 1, 256, 512, 512, 256, 512]
    - [97, 1.561]
  - - [512, 512, 1, 512, 512, 512, 512, 512]
    - [97, 2.282]
  - - [512, 512, 1, 1024, 512, 512, 1024, 512]
    - [85, 2.475]
  - - [512, 512, 1, 2048, 512, 512, 2048, 512]
    - [49, 3.072]
  - - [512, 512, 1, 4096, 512, 512, 4096, 512]
    - [77, 3.644]
  - - [512, 512, 1, 8192, 512, 512, 8192, 512]
    - [30, 4.583]
  - - [512, 1024, 1, 128, 512, 512, 128, 1024]
    - [87, 1.305]
  - - [512, 1024, 1, 256, 512, 512, 256, 1024]
    - [92, 2.274]
  - - [512, 1024, 1, 512, 512, 512, 512, 1024]
    - [78, 2.945]
  - - [512, 1024, 1, 1024, 512, 512, 1024, 1024]
    - [102, 3.514]
  - - [512, 1024, 1, 2048, 512, 512, 2048, 1024]
    - [15, 4.096]
  - - [512, 1024, 1, 4096, 512, 512, 4096, 1024]
    - [65, 4.408]
  - - [512, 1024, 1, 8192, 512, 512, 8192, 1024]
    - [23, 5.467]
  - - [512, 2048, 1, 128, 512, 512, 128, 2048]
    - [49, 1.685]
  - - [512, 2048, 1, 256, 512, 512, 256, 2048]
    - [44, 2.835]
  - - [512, 2048, 1, 512, 512, 512, 512, 2048]
    - [93, 3.446]
  - - [512, 2048, 1, 1024, 512, 512, 1024, 2048]
    - [94, 4.317]
  - - [512, 2048, 1, 2048, 512, 512, 2048, 2048]
    - [94, 4.819]
  - - [512, 2048, 1, 4096, 512, 512, 4096, 2048]
    - [23, 5.345]
  - - [512, 2048, 1, 8192, 512, 512, 8192, 2048]
    - [67, 6.162]
  - - [512, 4096, 1, 128, 512, 512, 128, 4096]
    - [32, 2.161]
  - - [512, 4096, 1, 256, 512, 512, 256, 4096]
    - [31, 3.575]
  - - [512, 4096, 1, 512, 512, 512, 512, 4096]
    - [76, 4.252]
  - - [512, 4096, 1, 1024, 512, 512, 1024, 4096]
    - [76, 5.398]
  - - [512, 4096, 1, 2048, 512, 512, 2048, 4096]
    - [76, 6.147]
  - - [512, 4096, 1, 4096, 512, 512, 4096, 4096]
    - [17, 6.008]
  - - [512, 4096, 1, 8192, 512, 512, 8192, 4096]
    - [27, 7.063]
  - - [512, 8192, 1, 128, 512, 512, 128, 8192]
    - [45, 2.537]
  - - [512, 8192, 1, 256, 512, 512, 256, 8192]
    - [48, 3.99]
  - - [512, 8192, 1, 512, 512, 512, 512, 8192]
    - [44, 5.628]
  - - [512, 8192, 1, 1024, 512, 512, 1024, 8192]
    - [53, 6.612]
  - - [512, 8192, 1, 2048, 512, 512, 2048, 8192]
    - [72, 6.848]
  - - [512, 8192, 1, 4096, 512, 512, 4096, 8192]
    - [30, 7.162]
  - - [512, 8192, 1, 8192, 512, 512, 8192, 8192]
    - [30, 7.819]
  - - [1024, 128, 1, 128, 1024, 1024, 128, 128]
    - [101, 0.565]
  - - [1024, 128, 1, 256, 1024, 1024, 256, 128]
    - [100, 0.921]
  - - [1024, 128, 1, 512, 1024, 1024, 512, 128]
    - [98, 1.404]
  - - [1024, 128, 1, 1024, 1024, 1024, 1024, 128]
    - [111, 1.941]
  - - [1024, 128, 1, 2048, 1024, 1024, 2048, 128]
    - [56, 2.235]
  - - [1024, 128, 1, 4096, 1024, 1024, 4096, 128]
    - [79, 3.174]
  - - [1024, 128, 1, 8192, 1024, 1024, 8192, 128]
    - [73, 3.587]
  - - [1024, 256, 1, 128, 1024, 1024, 128, 256]
    - [93, 0.977]
  - - [1024, 256, 1, 256, 1024, 1024, 256, 256]
    - [95, 1.609]
  - - [1024, 256, 1, 512, 1024, 1024, 512, 256]
    - [93, 2.37]
  - - [1024, 256, 1, 1024, 1024, 1024, 1024, 256]
    - [89, 2.497]
  - - [1024, 256, 1, 2048, 1024, 1024, 2048, 256]
    - [41, 2.928]
  - - [1024, 256, 1, 4096, 1024, 1024, 4096, 256]
    - [75, 3.794]
  - - [1024, 256, 1, 8192, 1024, 1024, 8192, 256]
    - [15, 4.651]
  - - [1024, 512, 1, 128, 1024, 1024, 128, 512]
    - [88, 1.353]
  - - [1024, 512, 1, 256, 1024, 1024, 256, 512]
    - [85, 2.284]
  - - [1024, 512, 1, 512, 1024, 1024, 512, 512]
    - [85, 3.103]
  - - [1024, 512, 1, 1024, 1024, 1024, 1024, 512]
    - [108, 3.418]
  - - [1024, 512, 1, 2048, 1024, 1024, 2048, 512]
    - [25, 3.967]
  - - [1024, 512, 1, 4096, 1024, 1024, 4096, 512]
    - [67, 4.408]
  - - [1024, 512, 1, 8192, 1024, 1024, 8192, 512]
    - [20, 5.398]
  - - [1024, 1024, 1, 128, 1024, 1024, 128, 1024]
    - [45, 1.783]
  - - [1024, 1024, 1, 256, 1024, 1024, 256, 1024]
    - [44, 2.805]
  - - [1024, 1024, 1, 512, 1024, 1024, 512, 1024]
    - [94, 3.508]
  - - [1024, 1024, 1, 1024, 1024, 1024, 1024, 1024]
    - [93, 4.361]
  - - [1024, 1024, 1, 2048, 1024, 1024, 2048, 1024]
    - [93, 4.776]
  - - [1024, 1024, 1, 4096, 1024, 1024, 4096, 1024]
    - [23, 4.997]
  - - [1024, 1024, 1, 8192, 1024, 1024, 8192, 1024]
    - [65, 6.144]
  - - [1024, 2048, 1, 128, 1024, 1024, 128, 2048]
    - [17, 2.176]
  - - [1024, 2048, 1, 256, 1024, 1024, 256, 2048]
    - [21, 3.509]
  - - [1024, 2048, 1, 512, 1024, 1024, 512, 2048]
    - [90, 4.281]
  - - [1024, 2048, 1, 1024, 1024, 1024, 1024, 2048]
    - [80, 5.235]
  - - [1024, 2048, 1, 2048, 1024, 1024, 2048, 2048]
    - [76, 5.826]
  - - [1024, 2048, 1, 4096, 1024, 1024, 4096, 2048]
    - [103, 5.555]
  - - [1024, 2048, 1, 8192, 1024, 1024, 8192, 2048]
    - [75, 6.162]
  - - [1024, 4096, 1, 128, 1024, 1024, 128, 4096]
    - [45, 2.561]
  - - [1024, 4096, 1, 256, 1024, 1024, 256, 4096]
    - [45, 3.876]
  - - [1024, 4096, 1, 512, 1024, 1024, 512, 4096]
    - [44, 5.553]
  - - [1024, 4096, 1, 1024, 1024, 1024, 1024, 4096]
    - [43, 6.292]
  - - [1024, 4096, 1, 2048, 1024, 1024, 2048, 4096]
    - [75, 6.868]
  - - [1024, 4096, 1, 4096, 1024, 1024, 4096, 4096]
    - [23, 6.93]
  - - [1024, 4096, 1, 8192, 1024, 1024, 8192, 4096]
    - [15, 7.696]
  - - [1024, 8192, 1, 128, 1024, 1024, 128, 8192]
    - [17, 2.657]
  - - [1024, 8192, 1, 256, 1024, 1024, 256, 8192]
    - [16, 4.312]
  - - [1024, 8192, 1, 512, 1024, 1024, 512, 8192]
    - [14, 6.216]
  - - [1024, 8192, 1, 1024, 1024, 1024, 1024, 8192]
    - [24, 7.618]
  - - [1024, 8192, 1, 2048, 1024, 1024, 2048, 8192]
    - [67, 7.618]
  - - [1024, 8192, 1, 4096, 1024, 1024, 4096, 8192]
    - [15, 7.618]
  - - [1024, 8192, 1, 8192, 1024, 1024, 8192, 8192]
    - [23, 8.057]
  - - [2048, 128, 1, 128, 2048, 2048, 128, 128]
    - [93, 1.009]
  - - [2048, 128, 1, 256, 2048, 2048, 256, 128]
    - [59, 1.638]
  - - [2048, 128, 1, 512, 2048, 2048, 512, 128]
    - [94, 2.226]
  - - [2048, 128, 1, 1024, 2048, 2048, 1024, 128]
    - [92, 2.535]
  - - [2048, 128, 1, 2048, 2048, 2048, 2048, 128]
    - [80, 2.893]
  - - [2048, 128, 1, 4096, 2048, 2048, 4096, 128]
    - [75, 3.72]
  - - [2048, 128, 1, 8192, 2048, 2048, 8192, 128]
    - [77, 4.571]
  - - [2048, 256, 1, 128, 2048, 2048, 128, 256]
    - [92, 1.369]
  - - [2048, 256, 1, 256, 2048, 2048, 256, 256]
    - [85, 2.371]
  - - [2048, 256, 1, 512, 2048, 2048, 512, 256]
    - [77, 3.127]
  - - [2048, 256, 1, 1024, 2048, 2048, 1024, 256]
    - [105, 3.354]
  - - [2048, 256, 1, 2048, 2048, 2048, 2048, 256]
    - [97, 3.682]
  - - [2048, 256, 1, 4096, 2048, 2048, 4096, 256]
    - [15, 4.359]
  - - [2048, 256, 1, 8192, 2048, 2048, 8192, 256]
    - [32, 5.535]
  - - [2048, 512, 1, 128, 2048, 2048, 128, 512]
    - [40, 1.676]
  - - [2048, 512, 1, 256, 2048, 2048, 256, 512]
    - [36, 2.662]
  - - [2048, 512, 1, 512, 2048, 2048, 512, 512]
    - [85, 3.519]
  - - [2048, 512, 1, 1024, 2048, 2048, 1024, 512]
    - [94, 4.043]
  - - [2048, 512, 1, 2048, 2048, 2048, 2048, 512]
    - [82, 4.684]
  - - [2048, 512, 1, 4096, 2048, 2048, 4096, 512]
    - [20, 5.418]
  - - [2048, 512, 1, 8192, 2048, 2048, 8192, 512]
    - [65, 6.104]
  - - [2048, 1024, 1, 128, 2048, 2048, 128, 1024]
    - [21, 2.113]
  - - [2048, 1024, 1, 256, 2048, 2048, 256, 1024]
    - [19, 3.455]
  - - [2048, 1024, 1, 512, 2048, 2048, 512, 1024]
    - [84, 4.192]
  - - [2048, 1024, 1, 1024, 2048, 2048, 1024, 1024]
    - [81, 4.837]
  - - [2048, 1024, 1, 2048, 2048, 2048, 2048, 1024]
    - [81, 5.78]
  - - [2048, 1024, 1, 4096, 2048, 2048, 4096, 1024]
    - [30, 5.836]
  - - [2048, 1024, 1, 8192, 2048, 2048, 8192, 1024]
    - [30, 6.901]
  - - [2048, 2048, 1, 128, 2048, 2048, 128, 2048]
    - [45, 2.493]
  - - [2048, 2048, 1, 256, 2048, 2048, 256, 2048]
    - [45, 3.776]
  - - [2048, 2048, 1, 512, 2048, 2048, 512, 2048]
    - [42, 5.261]
  - - [2048, 2048, 1, 1024, 2048, 2048, 1024, 2048]
    - [45, 6.015]
  - - [2048, 2048, 1, 2048, 2048, 2048, 2048, 2048]
    - [71, 6.678]
  - - [2048, 2048, 1, 4096, 2048, 2048, 4096, 2048]
    - [14, 6.553]
  - - [2048, 2048, 1, 8192, 2048, 2048, 8192, 2048]
    - [64, 7.136]
  - - [2048, 4096, 1, 128, 2048, 2048, 128, 4096]
    - [30, 2.651]
  - - [2048, 4096, 1, 256, 2048, 2048, 256, 4096]
    - [30, 4.285]
  - - [2048, 4096, 1, 512, 2048, 2048, 512, 4096]
    - [14, 6.15]
  - - [2048, 4096, 1, 1024, 2048, 2048, 1024, 4096]
    - [21, 7.543]
  - - [2048, 4096, 1, 2048, 2048, 2048, 2048, 4096]
    - [62, 7.73]
  - - [2048, 4096, 1, 4096, 2048, 2048, 4096, 4096]
    - [15, 7.671]
  - - [2048, 4096, 1, 8192, 2048, 2048, 8192, 4096]
    - [9, 7.872]
  - - [2048, 8192, 1, 128, 2048, 2048, 128, 8192]
    - [43, 2.51]
  - - [2048, 8192, 1, 256, 2048, 2048, 256, 8192]
    - [8, 3.781]
  - - [2048, 8192, 1, 512, 2048, 2048, 512, 8192]
    - [5, 5.437]
  - - [2048, 8192, 1, 1024, 2048, 2048, 1024, 8192]
    - [3, 7.145]
  - - [2048, 8192, 1, 2048, 2048, 2048, 2048, 8192]
    - [13, 7.676]
  - - [2048, 8192, 1, 4096, 2048, 2048, 4096, 8192]
    - [25, 7.727]
  - - [2048, 8192, 1, 8192, 2048, 2048, 8192, 8192]
    - [15, 8.181]
  - - [4096, 128, 1, 128, 4096, 4096, 128, 128]
    - [87, 1.296]
  - - [4096, 128, 1, 256, 4096, 4096, 256, 128]
    - [83, 2.052]
  - - [4096, 128, 1, 512, 4096, 4096, 512, 128]
    - [84, 2.863]
  - - [4096, 128, 1, 1024, 4096, 4096, 1024, 128]
    - [104, 3.318]
  - - [4096, 128, 1, 2048, 4096, 4096, 2048, 128]
    - [96, 3.642]
  - - [4096, 128, 1, 4096, 4096, 4096, 4096, 128]
    - [77, 4.329]
  - - [4096, 128, 1, 8192, 4096, 4096, 8192, 128]
    - [77, 5.255]
  - - [4096, 256, 1, 128, 4096, 4096, 128, 256]
    - [43, 1.757]
  - - [4096, 256, 1, 256, 4096, 4096, 256, 256]
    - [43, 2.661]
  - - [4096, 256, 1, 512, 4096, 4096, 512, 256]
    - [94, 3.428]
  - - [4096, 256, 1, 1024, 4096, 4096, 1024, 256]
    - [96, 4.129]
  - - [4096, 256, 1, 2048, 4096, 4096, 2048, 256]
    - [81, 4.693]
  - - [4096, 256, 1, 4096, 4096, 4096, 4096, 256]
    - [30, 5.572]
  - - [4096, 256, 1, 8192, 4096, 4096, 8192, 256]
    - [30, 6.394]
  - - [4096, 512, 1, 128, 4096, 4096, 128, 512]
    - [34, 2.108]
  - - [4096, 512, 1, 256, 4096, 4096, 256, 512]
    - [12, 3.311]
  - - [4096, 512, 1, 512, 4096, 4096, 512, 512]
    - [66, 4.054]
  - - [4096, 512, 1, 1024, 4096, 4096, 1024, 512]
    - [81, 5.145]
  - - [4096, 512, 1, 2048, 4096, 4096, 2048, 512]
    - [82, 5.871]
  - - [4096, 512, 1, 4096, 4096, 4096, 4096, 512]
    - [15, 6.187]
  - - [4096, 512, 1, 8192, 4096, 4096, 8192, 512]
    - [15, 7.247]
  - - [4096, 1024, 1, 128, 4096, 4096, 128, 1024]
    - [50, 2.473]
  - - [4096, 1024, 1, 256, 4096, 4096, 256, 1024]
    - [52, 3.699]
  - - [4096, 1024, 1, 512, 4096, 4096, 512, 1024]
    - [42, 5.006]
  - - [4096, 1024, 1, 1024, 4096, 4096, 1024, 1024]
    - [37, 6.042]
  - - [4096, 1024, 1, 2048, 4096, 4096, 2048, 1024]
    - [74, 6.064]
  - - [4096, 1024, 1, 4096, 4096, 4096, 4096, 1024]
    - [15, 6.773]
  - - [4096, 1024, 1, 8192, 4096, 4096, 8192, 1024]
    - [29, 7.448]
  - - [4096, 2048, 1, 128, 4096, 4096, 128, 2048]
    - [35, 2.525]
  - - [4096, 2048, 1, 256, 4096, 4096, 256, 2048]
    - [15, 3.99]
  - - [4096, 2048, 1, 512, 4096, 4096, 512, 2048]
    - [28, 5.758]
  - - [4096, 2048, 1, 1024, 4096, 4096, 1024, 2048]
    - [19, 7.272]
  - - [4096, 2048, 1, 2048, 4096, 4096, 2048, 2048]
    - [67, 6.958]
  - - [4096, 2048, 1, 4096, 4096, 4096, 4096, 2048]
    - [21, 7.06]
  - - [4096, 2048, 1, 8192, 4096, 4096, 8192, 2048]
    - [4, 7.548]
  - - [4096, 4096, 1, 128, 4096, 4096, 128, 4096]
    - [47, 2.425]
  - - [4096, 4096, 1, 256, 4096, 4096, 256, 4096]
    - [0, 3.655]
  - - [4096, 4096, 1, 512, 4096, 4096, 512, 4096]
    - [1, 5.494]
  - - [4096, 4096, 1, 1024, 4096, 4096, 1024, 4096]
    - [13, 6.955]
  - - [4096, 4096, 1, 2048, 4096, 4096, 2048, 4096]
    - [14, 7.765]
  - - [4096, 4096, 1, 4096, 4096, 4096, 4096, 4096]
    - [22, 7.782]
  - - [4096, 4096, 1, 8192, 4096, 4096, 8192, 4096]
    - [6, 8.144]
  - - [4096, 8192, 1, 128, 4096, 4096, 128, 8192]
    - [41, 2.286]
  - - [4096, 8192, 1, 256, 4096, 4096, 256, 8192]
    - [46, 3.393]
  - - [4096, 8192, 1, 512, 4096, 4096, 512, 8192]
    - [19, 4.901]
  - - [4096, 8192, 1, 1024, 4096, 4096, 1024, 8192]
    - [30, 6.354]
  - - [4096, 8192, 1, 2048, 4096, 4096, 2048, 8192]
    - [15, 7.469]
  - - [4096, 8192, 1, 4096, 4096, 4096, 4096, 8192]
    - [21, 7.992]
  - - [4096, 8192, 1, 8192, 4096, 4096, 8192, 8192]
    - [7, 7.764]
  - - [8192, 128, 1, 128, 8192, 8192, 128, 128]
    - [51, 1.733]
  - - [8192, 128, 1, 256, 8192, 8192, 256, 128]
    - [43, 2.631]
  - - [8192, 128, 1, 512, 8192, 8192, 512, 128]
    - [70, 3.326]
  - - [8192, 128, 1, 1024, 8192, 8192, 1024, 128]
    - [96, 3.994]
  - - [8192, 128, 1, 2048, 8192, 8192, 2048, 128]
    - [81, 4.603]
  - - [8192, 128, 1, 4096, 8192, 8192, 4096, 128]
    - [76, 5.174]
  - - [8192, 128, 1, 8192, 8192, 8192, 8192, 128]
    - [76, 5.983]
  - - [8192, 256, 1, 128, 8192, 8192, 128, 256]
    - [25, 2.079]
  - - [8192, 256, 1, 256, 8192, 8192, 256, 256]
    - [14, 3.272]
  - - [8192, 256, 1, 512, 8192, 8192, 512, 256]
    - [63, 4.03]
  - - [8192, 256, 1, 1024, 8192, 8192, 1024, 256]
    - [81, 5.113]
  - - [8192, 256, 1, 2048, 8192, 8192, 2048, 256]
    - [80, 5.771]
  - - [8192, 256, 1, 4096, 8192, 8192, 4096, 256]
    - [20, 6.168]
  - - [8192, 256, 1, 8192, 8192, 8192, 8192, 256]
    - [25, 7.522]
  - - [8192, 512, 1, 128, 8192, 8192, 128, 512]
    - [50, 2.408]
  - - [8192, 512, 1, 256, 8192, 8192, 256, 512]
    - [50, 3.668]
  - - [8192, 512, 1, 512, 8192, 8192, 512, 512]
    - [38, 5.028]
  - - [8192, 512, 1, 1024, 8192, 8192, 1024, 512]
    - [39, 6.114]
  - - [8192, 512, 1, 2048, 8192, 8192, 2048, 512]
    - [72, 6.652]
  - - [8192, 512, 1, 4096, 8192, 8192, 4096, 512]
    - [30, 7.222]
  - - [8192, 512, 1, 8192, 8192, 8192, 8192, 512]
    - [15, 7.794]
  - - [8192, 1024, 1, 128, 8192, 8192, 128, 1024]
    - [27, 2.52]
  - - [8192, 1024, 1, 256, 8192, 8192, 256, 1024]
    - [27, 4.144]
  - - [8192, 1024, 1, 512, 8192, 8192, 512, 1024]
    - [26, 5.898]
  - - [8192, 1024, 1, 1024, 8192, 8192, 1024, 1024]
    - [28, 7.401]
  - - [8192, 1024, 1, 2048, 8192, 8192, 2048, 1024]
    - [62, 7.354]
  - - [8192, 1024, 1, 4096, 8192, 8192, 4096, 1024]
    - [17, 7.408]
  - - [8192, 1024, 1, 8192, 8192, 8192, 8192, 1024]
    - [3, 7.952]
  - - [8192, 2048, 1, 128, 8192, 8192, 128, 2048]
    - [47, 2.383]
  - - [8192, 2048, 1, 256, 8192, 8192, 256, 2048]
    - [6, 3.666]
  - - [8192, 2048, 1, 512, 8192, 8192, 512, 2048]
    - [11, 5.274]
  - - [8192, 2048, 1, 1024, 8192, 8192, 1024, 2048]
    - [11, 6.86]
  - - [8192, 2048, 1, 2048, 8192, 8192, 2048, 2048]
    - [17, 7.618]
  - - [8192, 2048, 1, 4096, 8192, 8192, 4096, 2048]
    - [15, 7.848]
  - - [8192, 2048, 1, 8192, 8192, 8192, 8192, 2048]
    - [68, 8.057]
  - - [8192, 4096, 1, 128, 8192, 8192, 128, 4096]
    - [47, 2.276]
  - - [8192, 4096, 1, 256, 8192, 8192, 256, 4096]
    - [18, 3.358]
  - - [8192, 4096, 1, 512, 8192, 8192, 512, 4096]
    - [20, 4.927]
  - - [8192, 4096, 1, 1024, 8192, 8192, 1024, 4096]
    - [15, 6.364]
  - - [8192, 4096, 1, 2048, 8192, 8192, 2048, 4096]
    - [24, 7.387]
  - - [8192, 4096, 1, 4096, 8192, 8192, 4096, 4096]
    - [10, 8.063]
  - - [8192, 4096, 1, 8192, 8192, 8192, 8192, 4096]
    - [2, 8.258]
  - - [8192, 8192, 1, 128, 8192, 8192, 128, 8192]
    - [43, 2.13]
  - - [8192, 8192, 1, 256, 8192, 8192, 256, 8192]
    - [20, 3.614]
  - - [8192, 8192, 1, 512, 8192, 8192, 512, 8192]
    - [20, 5.417]
  - - [8192, 8192, 1, 1024, 8192, 8192, 1024, 8192]
    - [24, 6.617]
  - - [8192, 8192, 1, 2048, 8192, 8192, 2048, 8192]
    - [20, 7.453]
  - - [8192, 8192, 1, 4096, 8192, 8192, 4096, 8192]
    - [3, 7.973]
  - - [8192, 8192, 1, 8192, 8192, 8192, 8192, 8192]
    - [5, 8.163]
  - - [1, 1, 1, 32, 1, 1, 32, 1]
    - [121, 0.0]
- null
- null
- DeviceEfficiency
- GridBased
