library/src/amd_detail/rocblaslt/src/Tensile/Logic/streamk/gfx942_38cu/aquavanjaram942_Cijk_Ailk_Bjlk_BSS_BH_UserArgs.yaml
- {MinimumRequiredVersion: 4.33.0}
- aquavanjaram942
- {Architecture: gfx942, CUCount: 38}
- [Device 0049, Device 0050]
    SolutionIndex: 0
    SolutionNameMin: Cijk_Ailk_Bjlk_BSS_BH_UserArgs_MT256x256x32_MI16x16x1_SN_LDSB0_CLR1_GSU0_GSUC0_GSUWGMRR0_K1_LBSPPA2048_LBSPPB2048_LPA0_LPB0_MIWT8_8_PLR1_SU32_SUM0_SUS256_VWA4_VWB8_WGM1_WGMXCC1_WGMXCCGn1
    SolutionIndex: 1
    SolutionNameMin: Cijk_Ailk_Bjlk_BSS_BH_UserArgs_MT256x256x32_MI16x16x1_SN_LDSB0_CLR1_GSU0_GSUC0_GSUWGMRR0_K1_LBSPPA2048_LBSPPB2048_LPA0_LPB0_MIWT8_8_PLR1_SU32_SUM0_SUS256_VWA4_VWB8_WGM4_WGMXCC1_WGMXCCGn1
    SolutionIndex: 2
    SolutionNameMin: Cijk_Ailk_Bjlk_BSS_BH_UserArgs_MT256x256x32_MI16x16x1_SN_LDSB0_CLR1_GSU0_GSUC0_GSUWGMRR0_K1_LBSPPA2048_LBSPPB2048_LPA0_LPB0_MIWT8_8_PLR1_SU32_SUM0_SUS256_VWA4_VWB8_WGM8_WGMXCC1_WGMXCCGn1
    SolutionIndex: 3
    SolutionNameMin: Cijk_Ailk_Bjlk_BSS_BH_UserArgs_MT128x256x32_MI16x16x1_SN_LDSB1_CLR1_GSU0_GSUC0_GSUWGMRR0_K1_LBSPPA1024_LBSPPB2048_LPA0_LPB32_MIWT4_8_PLR1_SU32_SUM0_SUS256_VWA4_VWB2_WGM1_WGMXCC1_WGMXCCGn1
    SolutionIndex: 4
    SolutionNameMin: Cijk_Ailk_Bjlk_BSS_BH_UserArgs_MT128x256x32_MI16x16x1_SN_LDSB1_CLR1_GSU0_GSUC0_GSUWGMRR0_K1_LBSPPA1024_LBSPPB2048_LPA0_LPB0_MIWT4_8_PLR1_SU32_SUM0_SUS256_VWA4_VWB4_WGM1_WGMXCC1_WGMXCCGn1
    SolutionIndex: 5
    SolutionNameMin: Cijk_Ailk_Bjlk_BSS_BH_UserArgs_MT128x256x32_MI16x16x1_SN_LDSB1_CLR1_GSU0_GSUC0_GSUWGMRR0_K1_LBSPPA1024_LBSPPB2048_LPA16_LPB0_MIWT4_8_PLR1_SU32_SUM0_SUS256_VWA1_VWB8_WGM1_WGMXCC1_WGMXCCGn1
    SolutionIndex: 6
    SolutionNameMin: Cijk_Ailk_Bjlk_BSS_BH_UserArgs_MT128x256x32_MI16x16x1_SN_LDSB1_CLR1_GSU0_GSUC0_GSUWGMRR0_K1_LBSPPA1024_LBSPPB2048_LPA32_LPB0_MIWT4_8_PLR1_SU32_SUM0_SUS256_VWA2_VWB8_WGM1_WGMXCC1_WGMXCCGn1
    SolutionIndex: 7
    SolutionNameMin: Cijk_Ailk_Bjlk_BSS_BH_UserArgs_MT128x256x32_MI16x16x1_SN_LDSB1_CLR1_GSU0_GSUC0_GSUWGMRR0_K1_LBSPPA1024_LBSPPB2048_LPA0_LPB0_MIWT4_8_PLR1_SU32_SUM0_SUS256_VWA4_VWB8_WGM1_WGMXCC1_WGMXCCGn1
    SolutionIndex: 8
    SolutionNameMin: Cijk_Ailk_Bjlk_BSS_BH_UserArgs_MT128x256x32_MI16x16x1_SN_LDSB1_CLR1_GSU0_GSUC0_GSUWGMRR0_K1_LBSPPA1024_LBSPPB2048_LPA0_LPB32_MIWT4_8_PLR1_SU32_SUM0_SUS256_VWA4_VWB2_WGM4_WGMXCC1_WGMXCCGn1
    SolutionIndex: 9
    SolutionNameMin: Cijk_Ailk_Bjlk_BSS_BH_UserArgs_MT128x256x32_MI16x16x1_SN_LDSB1_CLR1_GSU0_GSUC0_GSUWGMRR0_K1_LBSPPA1024_LBSPPB2048_LPA32_LPB0_MIWT4_8_PLR1_SU32_SUM0_SUS256_VWA2_VWB4_WGM4_WGMXCC1_WGMXCCGn1
    SolutionIndex: 10
    SolutionNameMin: Cijk_Ailk_Bjlk_BSS_BH_UserArgs_MT128x256x32_MI16x16x1_SN_LDSB1_CLR1_GSU0_GSUC0_GSUWGMRR0_K1_LBSPPA1024_LBSPPB2048_LPA0_LPB0_MIWT4_8_PLR1_SU32_SUM0_SUS256_VWA4_VWB4_WGM4_WGMXCC1_WGMXCCGn1
    SolutionIndex: 11
    SolutionNameMin: Cijk_Ailk_Bjlk_BSS_BH_UserArgs_MT128x256x32_MI16x16x1_SN_LDSB1_CLR1_GSU0_GSUC0_GSUWGMRR0_K1_LBSPPA1024_LBSPPB2048_LPA0_LPB0_MIWT4_8_PLR1_SU32_SUM0_SUS256_VWA4_VWB8_WGM4_WGMXCC1_WGMXCCGn1
    SolutionIndex: 12
    SolutionNameMin: Cijk_Ailk_Bjlk_BSS_BH_UserArgs_MT128x256x32_MI16x16x1_SN_LDSB1_CLR1_GSU0_GSUC0_GSUWGMRR0_K1_LBSPPA1024_LBSPPB2048_LPA0_LPB32_MIWT4_8_PLR1_SU32_SUM0_SUS256_VWA4_VWB2_WGM8_WGMXCC1_WGMXCCGn1
    SolutionIndex: 13
    SolutionNameMin: Cijk_Ailk_Bjlk_BSS_BH_UserArgs_MT128x256x32_MI16x16x1_SN_LDSB1_CLR1_GSU0_GSUC0_GSUWGMRR0_K1_LBSPPA1024_LBSPPB2048_LPA0_LPB0_MIWT4_8_PLR1_SU32_SUM0_SUS256_VWA4_VWB4_WGM8_WGMXCC1_WGMXCCGn1
    SolutionIndex: 14
    SolutionNameMin: Cijk_Ailk_Bjlk_BSS_BH_UserArgs_MT128x256x32_MI16x16x1_SN_LDSB1_CLR1_GSU0_GSUC0_GSUWGMRR0_K1_LBSPPA1024_LBSPPB2048_LPA32_LPB0_MIWT4_8_PLR1_SU32_SUM0_SUS256_VWA2_VWB8_WGM8_WGMXCC1_WGMXCCGn1
    SolutionIndex: 15
    SolutionNameMin: Cijk_Ailk_Bjlk_BSS_BH_UserArgs_MT128x256x32_MI16x16x1_SN_LDSB1_CLR1_GSU0_GSUC0_GSUWGMRR0_K1_LBSPPA1024_LBSPPB2048_LPA0_LPB0_MIWT4_8_PLR1_SU32_SUM0_SUS256_VWA4_VWB8_WGM8_WGMXCC1_WGMXCCGn1
    SolutionIndex: 16
    SolutionNameMin: Cijk_Ailk_Bjlk_BSS_BH_UserArgs_MT256x128x32_MI16x16x1_SN_LDSB1_CLR1_GSU0_GSUC0_GSUWGMRR0_K1_LBSPPA2048_LBSPPB1024_LPA0_LPB32_MIWT8_4_PLR1_SU32_SUM0_SUS256_VWA4_VWB2_WGM1_WGMXCC1_WGMXCCGn1
    SolutionIndex: 17
    SolutionNameMin: Cijk_Ailk_Bjlk_BSS_BH_UserArgs_MT256x128x32_MI16x16x1_SN_LDSB1_CLR1_GSU0_GSUC0_GSUWGMRR0_K1_LBSPPA2048_LBSPPB1024_LPA32_LPB0_MIWT8_4_PLR1_SU32_SUM0_SUS256_VWA2_VWB4_WGM1_WGMXCC1_WGMXCCGn1
    SolutionIndex: 18
    SolutionNameMin: Cijk_Ailk_Bjlk_BSS_BH_UserArgs_MT256x128x32_MI16x16x1_SN_LDSB1_CLR1_GSU0_GSUC0_GSUWGMRR0_K1_LBSPPA2048_LBSPPB1024_LPA0_LPB0_MIWT8_4_PLR1_SU32_SUM0_SUS256_VWA4_VWB4_WGM1_WGMXCC1_WGMXCCGn1
    SolutionIndex: 19
    SolutionNameMin: Cijk_Ailk_Bjlk_BSS_BH_UserArgs_MT256x128x32_MI16x16x1_SN_LDSB1_CLR1_GSU0_GSUC0_GSUWGMRR0_K1_LBSPPA2048_LBSPPB1024_LPA0_LPB32_MIWT8_4_PLR1_SU32_SUM0_SUS256_VWA4_VWB2_WGM4_WGMXCC1_WGMXCCGn1
    SolutionIndex: 20
    SolutionNameMin: Cijk_Ailk_Bjlk_BSS_BH_UserArgs_MT256x128x32_MI16x16x1_SN_LDSB1_CLR1_GSU0_GSUC0_GSUWGMRR0_K1_LBSPPA2048_LBSPPB1024_LPA0_LPB0_MIWT8_4_PLR1_SU32_SUM0_SUS256_VWA4_VWB4_WGM4_WGMXCC1_WGMXCCGn1
    SolutionIndex: 21
    SolutionNameMin: Cijk_Ailk_Bjlk_BSS_BH_UserArgs_MT256x128x32_MI16x16x1_SN_LDSB1_CLR1_GSU0_GSUC0_GSUWGMRR0_K1_LBSPPA2048_LBSPPB1024_LPA0_LPB0_MIWT8_4_PLR1_SU32_SUM0_SUS256_VWA8_VWB4_WGM4_WGMXCC1_WGMXCCGn1
    SolutionIndex: 22
    SolutionNameMin: Cijk_Ailk_Bjlk_BSS_BH_UserArgs_MT256x128x32_MI16x16x1_SN_LDSB1_CLR1_GSU0_GSUC0_GSUWGMRR0_K1_LBSPPA2048_LBSPPB1024_LPA0_LPB32_MIWT8_4_PLR1_SU32_SUM0_SUS256_VWA4_VWB2_WGM8_WGMXCC1_WGMXCCGn1
    SolutionIndex: 23
    SolutionNameMin: Cijk_Ailk_Bjlk_BSS_BH_UserArgs_MT256x128x32_MI16x16x1_SN_LDSB1_CLR1_GSU0_GSUC0_GSUWGMRR0_K1_LBSPPA2048_LBSPPB1024_LPA0_LPB0_MIWT8_4_PLR1_SU32_SUM0_SUS256_VWA4_VWB4_WGM8_WGMXCC1_WGMXCCGn1
    SolutionIndex: 24
    SolutionNameMin: Cijk_Ailk_Bjlk_BSS_BH_UserArgs_MT256x64x32_MI16x16x1_SN_LDSB1_CLR1_GSU0_GSUC0_GSUWGMRR0_K1_LBSPPA2048_LBSPPB512_LPA0_LPB32_MIWT8_2_PLR1_SU32_SUM0_SUS256_VWA4_VWB2_WGM1_WGMXCC1_WGMXCCGn1
    SolutionIndex: 25
    SolutionNameMin: Cijk_Ailk_Bjlk_BSS_BH_UserArgs_MT256x64x32_MI16x16x1_SN_LDSB1_CLR1_GSU0_GSUC0_GSUWGMRR0_K1_LBSPPA2048_LBSPPB512_LPA0_LPB16_MIWT8_2_PLR1_SU32_SUM0_SUS256_VWA4_VWB1_WGM8_WGMXCC1_WGMXCCGn1
    SolutionIndex: 26
    SolutionNameMin: Cijk_Ailk_Bjlk_BSS_BH_UserArgs_MT128x128x32_MI16x16x1_SN_LDSB1_CLR1_GSU0_GSUC0_GSUWGMRR0_K1_LBSPPA1024_LBSPPB1024_LPA32_LPB16_MIWT4_4_PLR1_SU32_SUM0_SUS256_VWA2_VWB1_WGM1_WGMXCC1_WGMXCCGn1
    SolutionIndex: 27
    SolutionNameMin: Cijk_Ailk_Bjlk_BSS_BH_UserArgs_MT128x128x32_MI16x16x1_SN_LDSB1_CLR1_GSU0_GSUC0_GSUWGMRR0_K1_LBSPPA1024_LBSPPB1024_LPA0_LPB16_MIWT4_4_PLR1_SU32_SUM0_SUS256_VWA4_VWB1_WGM1_WGMXCC1_WGMXCCGn1
    SolutionIndex: 28
    SolutionNameMin: Cijk_Ailk_Bjlk_BSS_BH_UserArgs_MT128x128x32_MI16x16x1_SN_LDSB1_CLR1_GSU0_GSUC0_GSUWGMRR0_K1_LBSPPA1024_LBSPPB1024_LPA0_LPB32_MIWT4_4_PLR1_SU32_SUM0_SUS256_VWA4_VWB2_WGM1_WGMXCC1_WGMXCCGn1
    SolutionIndex: 29
    SolutionNameMin: Cijk_Ailk_Bjlk_BSS_BH_UserArgs_MT128x128x32_MI16x16x1_SN_LDSB1_CLR1_GSU0_GSUC0_GSUWGMRR0_K1_LBSPPA1024_LBSPPB1024_LPA16_LPB0_MIWT4_4_PLR1_SU32_SUM0_SUS256_VWA1_VWB4_WGM1_WGMXCC1_WGMXCCGn1
    SolutionIndex: 30
    SolutionNameMin: Cijk_Ailk_Bjlk_BSS_BH_UserArgs_MT128x128x32_MI16x16x1_SN_LDSB1_CLR1_GSU0_GSUC0_GSUWGMRR0_K1_LBSPPA1024_LBSPPB1024_LPA32_LPB0_MIWT4_4_PLR1_SU32_SUM0_SUS256_VWA2_VWB4_WGM1_WGMXCC1_WGMXCCGn1
    SolutionIndex: 31
    SolutionNameMin: Cijk_Ailk_Bjlk_BSS_BH_UserArgs_MT128x128x32_MI16x16x1_SN_LDSB0_CLR1_GSU0_GSUC0_GSUWGMRR0_K1_LBSPPA1024_LBSPPB1024_LPA0_LPB0_MIWT4_4_PLR1_SU32_SUM0_SUS256_VWA4_VWB4_WGM1_WGMXCC1_WGMXCCGn1
    SolutionIndex: 32
    SolutionNameMin: Cijk_Ailk_Bjlk_BSS_BH_UserArgs_MT128x128x32_MI16x16x1_SN_LDSB0_CLR0_GSU0_GSUC0_GSUWGMRR0_K1_LBSPPA1024_LBSPPB1024_LPA0_LPB0_MIWT4_4_PLR0_SU32_SUM0_SUS256_VWA4_VWB4_WGM1_WGMXCC1_WGMXCCGn1
    SolutionIndex: 33
    SolutionNameMin: Cijk_Ailk_Bjlk_BSS_BH_UserArgs_MT128x128x32_MI16x16x1_SN_LDSB1_CLR1_GSU0_GSUC0_GSUWGMRR0_K1_LBSPPA1024_LBSPPB1024_LPA0_LPB32_MIWT4_4_PLR1_SU32_SUM0_SUS256_VWA4_VWB2_WGM4_WGMXCC1_WGMXCCGn1
    SolutionIndex: 34
    SolutionNameMin: Cijk_Ailk_Bjlk_BSS_BH_UserArgs_MT128x128x32_MI16x16x1_SN_LDSB1_CLR1_GSU0_GSUC0_GSUWGMRR0_K1_LBSPPA1024_LBSPPB1024_LPA16_LPB0_MIWT4_4_PLR1_SU32_SUM0_SUS256_VWA1_VWB4_WGM4_WGMXCC1_WGMXCCGn1
    SolutionIndex: 35
    SolutionNameMin: Cijk_Ailk_Bjlk_BSS_BH_UserArgs_MT128x128x32_MI16x16x1_SN_LDSB0_CLR1_GSU0_GSUC0_GSUWGMRR0_K1_LBSPPA1024_LBSPPB1024_LPA0_LPB0_MIWT4_4_PLR1_SU32_SUM0_SUS256_VWA4_VWB4_WGM4_WGMXCC1_WGMXCCGn1
    SolutionIndex: 36
    SolutionNameMin: Cijk_Ailk_Bjlk_BSS_BH_UserArgs_MT128x128x32_MI16x16x1_SN_LDSB1_CLR1_GSU0_GSUC0_GSUWGMRR0_K1_LBSPPA1024_LBSPPB1024_LPA16_LPB16_MIWT4_4_PLR1_SU32_SUM0_SUS256_VWA1_VWB1_WGM8_WGMXCC1_WGMXCCGn1
    SolutionIndex: 37
    SolutionNameMin: Cijk_Ailk_Bjlk_BSS_BH_UserArgs_MT128x128x32_MI16x16x1_SN_LDSB1_CLR1_GSU0_GSUC0_GSUWGMRR0_K1_LBSPPA1024_LBSPPB1024_LPA0_LPB16_MIWT4_4_PLR1_SU32_SUM0_SUS256_VWA4_VWB1_WGM8_WGMXCC1_WGMXCCGn1
    SolutionIndex: 38
    SolutionNameMin: Cijk_Ailk_Bjlk_BSS_BH_UserArgs_MT128x128x32_MI16x16x1_SN_LDSB1_CLR1_GSU0_GSUC0_GSUWGMRR0_K1_LBSPPA1024_LBSPPB1024_LPA16_LPB32_MIWT4_4_PLR1_SU32_SUM0_SUS256_VWA1_VWB2_WGM8_WGMXCC1_WGMXCCGn1
    SolutionIndex: 39
    SolutionNameMin: Cijk_Ailk_Bjlk_BSS_BH_UserArgs_MT128x128x32_MI16x16x1_SN_LDSB1_CLR1_GSU0_GSUC0_GSUWGMRR0_K1_LBSPPA1024_LBSPPB1024_LPA0_LPB32_MIWT4_4_PLR1_SU32_SUM0_SUS256_VWA4_VWB2_WGM8_WGMXCC1_WGMXCCGn1
    SolutionIndex: 40
    SolutionNameMin: Cijk_Ailk_Bjlk_BSS_BH_UserArgs_MT128x128x32_MI16x16x1_SN_LDSB1_CLR1_GSU0_GSUC0_GSUWGMRR0_K1_LBSPPA1024_LBSPPB1024_LPA16_LPB0_MIWT4_4_PLR1_SU32_SUM0_SUS256_VWA1_VWB4_WGM8_WGMXCC1_WGMXCCGn1
    SolutionIndex: 41
    SolutionNameMin: Cijk_Ailk_Bjlk_BSS_BH_UserArgs_MT128x128x32_MI16x16x1_SN_LDSB1_CLR1_GSU0_GSUC0_GSUWGMRR0_K1_LBSPPA1024_LBSPPB1024_LPA32_LPB0_MIWT4_4_PLR1_SU32_SUM0_SUS256_VWA2_VWB4_WGM8_WGMXCC1_WGMXCCGn1
    SolutionIndex: 42
    SolutionNameMin: Cijk_Ailk_Bjlk_BSS_BH_UserArgs_MT128x128x32_MI16x16x1_SN_LDSB0_CLR1_GSU0_GSUC0_GSUWGMRR0_K1_LBSPPA1024_LBSPPB1024_LPA0_LPB0_MIWT4_4_PLR1_SU32_SUM0_SUS256_VWA4_VWB4_WGM8_WGMXCC1_WGMXCCGn1
    SolutionIndex: 43
    SolutionNameMin: Cijk_Ailk_Bjlk_BSS_BH_UserArgs_MT128x64x32_MI16x16x1_SN_LDSB0_CLR1_GSU0_GSUC0_GSUWGMRR0_K1_LBSPPA1024_LBSPPB512_LPA0_LPB16_MIWT4_2_PLR1_SU32_SUM0_SUS256_VWA4_VWB1_WGM1_WGMXCC1_WGMXCCGn1
    SolutionIndex: 44
    SolutionNameMin: Cijk_Ailk_Bjlk_BSS_BH_UserArgs_MT128x64x32_MI16x16x1_SN_LDSB0_CLR1_GSU0_GSUC0_GSUWGMRR0_K1_LBSPPA1024_LBSPPB512_LPA0_LPB32_MIWT4_2_PLR1_SU32_SUM0_SUS256_VWA4_VWB2_WGM1_WGMXCC1_WGMXCCGn1
    SolutionIndex: 45
    SolutionNameMin: Cijk_Ailk_Bjlk_BSS_BH_UserArgs_MT128x64x32_MI16x16x1_SN_LDSB0_CLR0_GSU0_GSUC0_GSUWGMRR0_K1_LBSPPA1024_LBSPPB512_LPA0_LPB32_MIWT4_2_PLR0_SU32_SUM0_SUS256_VWA4_VWB2_WGM1_WGMXCC1_WGMXCCGn1
    SolutionIndex: 46
    SolutionNameMin: Cijk_Ailk_Bjlk_BSS_BH_UserArgs_MT128x64x32_MI16x16x1_SN_LDSB0_CLR1_GSU0_GSUC0_GSUWGMRR0_K1_LBSPPA1024_LBSPPB512_LPA0_LPB32_MIWT4_2_PLR1_SU32_SUM0_SUS256_VWA4_VWB2_WGM4_WGMXCC1_WGMXCCGn1
    SolutionIndex: 47
    SolutionNameMin: Cijk_Ailk_Bjlk_BSS_BH_UserArgs_MT128x64x32_MI16x16x1_SN_LDSB0_CLR1_GSU0_GSUC0_GSUWGMRR0_K1_LBSPPA1024_LBSPPB512_LPA0_LPB16_MIWT4_2_PLR1_SU32_SUM0_SUS256_VWA4_VWB1_WGM8_WGMXCC1_WGMXCCGn1
    SolutionIndex: 48
    SolutionNameMin: Cijk_Ailk_Bjlk_BSS_BH_UserArgs_MT128x64x32_MI16x16x1_SN_LDSB0_CLR1_GSU0_GSUC0_GSUWGMRR0_K1_LBSPPA1024_LBSPPB512_LPA0_LPB32_MIWT4_2_PLR1_SU32_SUM0_SUS256_VWA4_VWB2_WGM8_WGMXCC1_WGMXCCGn1
    SolutionIndex: 49
    SolutionNameMin: Cijk_Ailk_Bjlk_BSS_BH_UserArgs_MT128x64x32_MI16x16x1_SN_LDSB0_CLR0_GSU0_GSUC0_GSUWGMRR0_K1_LBSPPA1024_LBSPPB512_LPA0_LPB32_MIWT4_2_PLR0_SU32_SUM0_SUS256_VWA4_VWB2_WGM8_WGMXCC1_WGMXCCGn1
    SolutionIndex: 50
    SolutionNameMin: Cijk_Ailk_Bjlk_BSS_BH_UserArgs_MT128x32x32_MI16x16x1_SN_LDSB0_CLR1_GSU0_GSUC0_GSUWGMRR0_K1_LBSPPA1024_LBSPPB256_LPA0_LPB16_MIWT4_1_PLR1_SU32_SUM0_SUS256_VWA4_VWB1_WGM1_WGMXCC1_WGMXCCGn1
    SolutionIndex: 51
    SolutionNameMin: Cijk_Ailk_Bjlk_BSS_BH_UserArgs_MT64x64x32_MI16x16x1_SN_LDSB0_CLR1_GSU0_GSUC0_GSUWGMRR0_K1_LBSPPA512_LBSPPB512_LPA32_LPB32_MIWT2_2_PLR1_SU32_SUM0_SUS256_VWA2_VWB2_WGM1_WGMXCC1_WGMXCCGn1
    SolutionIndex: 52
    SolutionNameMin: Cijk_Ailk_Bjlk_BSS_BH_UserArgs_MT64x64x32_MI16x16x1_SN_LDSB0_CLR1_GSU0_GSUC0_GSUWGMRR0_K1_LBSPPA512_LBSPPB512_LPA32_LPB32_MIWT2_2_PLR1_SU32_SUM0_SUS256_VWA2_VWB2_WGM4_WGMXCC1_WGMXCCGn1
    SolutionIndex: 53
    SolutionNameMin: Cijk_Ailk_Bjlk_BSS_BH_UserArgs_MT32x64x32_MI16x16x1_SN_LDSB0_CLR1_GSU0_GSUC0_GSUWGMRR0_K1_LBSPPA256_LBSPPB512_LPA16_LPB32_MIWT1_2_PLR1_SU32_SUM0_SUS256_VWA1_VWB2_WGM1_WGMXCC1_WGMXCCGn1
    SolutionIndex: 54
    SolutionNameMin: Cijk_Ailk_Bjlk_BSS_BH_UserArgs_MT32x32x32_MI16x16x1_SN_LDSB0_CLR1_GSU0_GSUC0_GSUWGMRR0_K1_LBSPPA256_LBSPPB256_LPA16_LPB16_MIWT1_1_PLR1_SU32_SUM0_SUS256_VWA1_VWB1_WGM1_WGMXCC1_WGMXCCGn1
    SolutionIndex: 55
    SolutionNameMin: Cijk_Ailk_Bjlk_BSS_BH_UserArgs_MT32x32x32_MI16x16x1_SN_LDSB0_CLR0_GSU0_GSUC0_GSUWGMRR0_K1_LBSPPA256_LBSPPB256_LPA16_LPB16_MIWT1_1_PLR0_SU32_SUM0_SUS256_VWA1_VWB1_WGM1_WGMXCC1_WGMXCCGn1
    SolutionIndex: 56
    SolutionNameMin: Cijk_Ailk_Bjlk_BSS_BH_UserArgs_MT256x256x64_MI16x16x1_SN_LDSB1_CLR1_GSU0_GSUC0_GSUWGMRR0_K1_LBSPPA2048_LBSPPB2048_LPA0_LPB0_MIWT8_8_PLR1_SU32_SUM0_SUS256_VWA4_VWB4_WGM1_WGMXCC1_WGMXCCGn1
    SolutionIndex: 57
    SolutionNameMin: Cijk_Ailk_Bjlk_BSS_BH_UserArgs_MT256x256x64_MI16x16x1_SN_LDSB1_CLR1_GSU0_GSUC0_GSUWGMRR0_K1_LBSPPA2048_LBSPPB2048_LPA0_LPB0_MIWT8_8_PLR1_SU32_SUM0_SUS256_VWA4_VWB4_WGM4_WGMXCC1_WGMXCCGn1
    SolutionIndex: 58
    SolutionNameMin: Cijk_Ailk_Bjlk_BSS_BH_UserArgs_MT128x128x64_MI16x16x1_SN_LDSB1_CLR1_GSU0_GSUC0_GSUWGMRR0_K1_LBSPPA1024_LBSPPB1024_LPA0_LPB0_MIWT4_4_PLR1_SU32_SUM0_SUS256_VWA4_VWB4_WGM1_WGMXCC1_WGMXCCGn1
    SolutionIndex: 59
    SolutionNameMin: Cijk_Ailk_Bjlk_BSS_BH_UserArgs_MT128x128x64_MI16x16x1_SN_LDSB1_CLR1_GSU0_GSUC0_GSUWGMRR0_K1_LBSPPA1024_LBSPPB1024_LPA0_LPB0_MIWT4_4_PLR2_SU32_SUM0_SUS256_VWA4_VWB4_WGM1_WGMXCC1_WGMXCCGn1
    SolutionIndex: 60
    SolutionNameMin: Cijk_Ailk_Bjlk_BSS_BH_UserArgs_MT128x128x64_MI16x16x1_SN_LDSB1_CLR1_GSU0_GSUC0_GSUWGMRR0_K1_LBSPPA1024_LBSPPB1024_LPA0_LPB0_MIWT4_4_PLR1_SU32_SUM0_SUS256_VWA4_VWB4_WGM4_WGMXCC1_WGMXCCGn1
    SolutionIndex: 61
    SolutionNameMin: Cijk_Ailk_Bjlk_BSS_BH_UserArgs_MT128x128x64_MI16x16x1_SN_LDSB1_CLR1_GSU0_GSUC0_GSUWGMRR0_K1_LBSPPA1024_LBSPPB1024_LPA0_LPB0_MIWT4_4_PLR2_SU32_SUM0_SUS256_VWA4_VWB4_WGM4_WGMXCC1_WGMXCCGn1
    SolutionIndex: 62
    SolutionNameMin: Cijk_Ailk_Bjlk_BSS_BH_UserArgs_MT128x128x64_MI16x16x1_SN_LDSB1_CLR1_GSU0_GSUC0_GSUWGMRR0_K1_LBSPPA1024_LBSPPB1024_LPA0_LPB0_MIWT4_4_PLR1_SU32_SUM0_SUS256_VWA4_VWB4_WGM8_WGMXCC1_WGMXCCGn1
    SolutionIndex: 63
    SolutionNameMin: Cijk_Ailk_Bjlk_BSS_BH_UserArgs_MT128x128x64_MI16x16x1_SN_LDSB1_CLR1_GSU0_GSUC0_GSUWGMRR0_K1_LBSPPA1024_LBSPPB1024_LPA0_LPB0_MIWT4_4_PLR2_SU32_SUM0_SUS256_VWA4_VWB4_WGM8_WGMXCC1_WGMXCCGn1
    SolutionIndex: 64
    SolutionNameMin: Cijk_Ailk_Bjlk_BSS_BH_UserArgs_MT64x128x64_MI16x16x1_SN_LDSB1_CLR1_GSU0_GSUC0_GSUWGMRR0_K1_LBSPPA512_LBSPPB1024_LPA32_LPB0_MIWT2_4_PLR2_SU32_SUM0_SUS256_VWA2_VWB4_WGM4_WGMXCC1_WGMXCCGn1
    SolutionIndex: 65
    SolutionNameMin: Cijk_Ailk_Bjlk_BSS_BH_UserArgs_MT128x64x64_MI16x16x1_SN_LDSB1_CLR1_GSU0_GSUC0_GSUWGMRR0_K1_LBSPPA1024_LBSPPB512_LPA32_LPB16_MIWT4_2_PLR1_SU32_SUM0_SUS256_VWA2_VWB1_WGM1_WGMXCC1_WGMXCCGn1
    SolutionIndex: 66
    SolutionNameMin: Cijk_Ailk_Bjlk_BSS_BH_UserArgs_MT128x64x64_MI16x16x1_SN_LDSB1_CLR1_GSU0_GSUC0_GSUWGMRR0_K1_LBSPPA1024_LBSPPB512_LPA32_LPB32_MIWT4_2_PLR1_SU32_SUM0_SUS256_VWA2_VWB2_WGM1_WGMXCC1_WGMXCCGn1
    SolutionIndex: 67
    SolutionNameMin: Cijk_Ailk_Bjlk_BSS_BH_UserArgs_MT128x64x64_MI16x16x1_SN_LDSB1_CLR1_GSU0_GSUC0_GSUWGMRR0_K1_LBSPPA1024_LBSPPB512_LPA0_LPB32_MIWT4_2_PLR1_SU32_SUM0_SUS256_VWA4_VWB2_WGM1_WGMXCC1_WGMXCCGn1
    SolutionIndex: 68
    SolutionNameMin: Cijk_Ailk_Bjlk_BSS_BH_UserArgs_MT128x64x64_MI16x16x1_SN_LDSB1_CLR1_GSU0_GSUC0_GSUWGMRR0_K1_LBSPPA1024_LBSPPB512_LPA32_LPB32_MIWT4_2_PLR2_SU32_SUM0_SUS256_VWA2_VWB2_WGM1_WGMXCC1_WGMXCCGn1
    SolutionIndex: 69
    SolutionNameMin: Cijk_Ailk_Bjlk_BSS_BH_UserArgs_MT128x64x64_MI16x16x1_SN_LDSB1_CLR1_GSU0_GSUC0_GSUWGMRR0_K1_LBSPPA1024_LBSPPB512_LPA0_LPB32_MIWT4_2_PLR2_SU32_SUM0_SUS256_VWA4_VWB2_WGM1_WGMXCC1_WGMXCCGn1
    SolutionIndex: 70
    SolutionNameMin: Cijk_Ailk_Bjlk_BSS_BH_UserArgs_MT128x64x64_MI16x16x1_SN_LDSB1_CLR1_GSU0_GSUC0_GSUWGMRR0_K1_LBSPPA1024_LBSPPB512_LPA0_LPB16_MIWT4_2_PLR1_SU32_SUM0_SUS256_VWA4_VWB1_WGM4_WGMXCC1_WGMXCCGn1
    SolutionIndex: 71
    SolutionNameMin: Cijk_Ailk_Bjlk_BSS_BH_UserArgs_MT128x64x64_MI16x16x1_SN_LDSB1_CLR1_GSU0_GSUC0_GSUWGMRR0_K1_LBSPPA1024_LBSPPB512_LPA32_LPB16_MIWT4_2_PLR2_SU32_SUM0_SUS256_VWA2_VWB1_WGM4_WGMXCC1_WGMXCCGn1
    SolutionIndex: 72
    SolutionNameMin: Cijk_Ailk_Bjlk_BSS_BH_UserArgs_MT128x64x64_MI16x16x1_SN_LDSB1_CLR1_GSU0_GSUC0_GSUWGMRR0_K1_LBSPPA1024_LBSPPB512_LPA0_LPB32_MIWT4_2_PLR2_SU32_SUM0_SUS256_VWA4_VWB2_WGM4_WGMXCC1_WGMXCCGn1
    SolutionIndex: 73
    SolutionNameMin: Cijk_Ailk_Bjlk_BSS_BH_UserArgs_MT128x64x64_MI16x16x1_SN_LDSB1_CLR1_GSU0_GSUC0_GSUWGMRR0_K1_LBSPPA1024_LBSPPB512_LPA0_LPB32_MIWT4_2_PLR1_SU32_SUM0_SUS256_VWA4_VWB2_WGM8_WGMXCC1_WGMXCCGn1
    SolutionIndex: 74
    SolutionNameMin: Cijk_Ailk_Bjlk_BSS_BH_UserArgs_MT128x64x64_MI16x16x1_SN_LDSB1_CLR1_GSU0_GSUC0_GSUWGMRR0_K1_LBSPPA1024_LBSPPB512_LPA0_LPB16_MIWT4_2_PLR2_SU32_SUM0_SUS256_VWA4_VWB1_WGM8_WGMXCC1_WGMXCCGn1
    SolutionIndex: 75
    SolutionNameMin: Cijk_Ailk_Bjlk_BSS_BH_UserArgs_MT128x64x64_MI16x16x1_SN_LDSB1_CLR1_GSU0_GSUC0_GSUWGMRR0_K1_LBSPPA1024_LBSPPB512_LPA0_LPB32_MIWT4_2_PLR2_SU32_SUM0_SUS256_VWA4_VWB2_WGM8_WGMXCC1_WGMXCCGn1
    SolutionIndex: 76
    SolutionNameMin: Cijk_Ailk_Bjlk_BSS_BH_UserArgs_MT64x64x64_MI16x16x1_SN_LDSB1_CLR1_GSU0_GSUC0_GSUWGMRR0_K1_LBSPPA512_LBSPPB512_LPA32_LPB32_MIWT2_2_PLR1_SU32_SUM0_SUS256_VWA2_VWB2_WGM1_WGMXCC1_WGMXCCGn1
    SolutionIndex: 77
    SolutionNameMin: Cijk_Ailk_Bjlk_BSS_BH_UserArgs_MT64x64x64_MI16x16x1_SN_LDSB1_CLR1_GSU0_GSUC0_GSUWGMRR0_K1_LBSPPA512_LBSPPB512_LPA16_LPB16_MIWT2_2_PLR2_SU32_SUM0_SUS256_VWA1_VWB1_WGM1_WGMXCC1_WGMXCCGn1
    SolutionIndex: 78
    SolutionNameMin: Cijk_Ailk_Bjlk_BSS_BH_UserArgs_MT64x64x64_MI16x16x1_SN_LDSB1_CLR1_GSU0_GSUC0_GSUWGMRR0_K1_LBSPPA512_LBSPPB512_LPA32_LPB32_MIWT2_2_PLR2_SU32_SUM0_SUS256_VWA2_VWB2_WGM1_WGMXCC1_WGMXCCGn1
    SolutionIndex: 79
    SolutionNameMin: Cijk_Ailk_Bjlk_BSS_BH_UserArgs_MT64x64x64_MI16x16x1_SN_LDSB1_CLR1_GSU0_GSUC0_GSUWGMRR0_K1_LBSPPA512_LBSPPB512_LPA32_LPB32_MIWT2_2_PLR1_SU32_SUM0_SUS256_VWA2_VWB2_WGM4_WGMXCC1_WGMXCCGn1
    SolutionIndex: 80
    SolutionNameMin: Cijk_Ailk_Bjlk_BSS_BH_UserArgs_MT64x64x64_MI16x16x1_SN_LDSB1_CLR1_GSU0_GSUC0_GSUWGMRR0_K1_LBSPPA512_LBSPPB512_LPA32_LPB32_MIWT2_2_PLR2_SU32_SUM0_SUS256_VWA2_VWB2_WGM4_WGMXCC1_WGMXCCGn1
    SolutionIndex: 81
    SolutionNameMin: Cijk_Ailk_Bjlk_BSS_BH_UserArgs_MT64x64x64_MI16x16x1_SN_LDSB1_CLR1_GSU0_GSUC0_GSUWGMRR0_K1_LBSPPA512_LBSPPB512_LPA32_LPB32_MIWT2_2_PLR1_SU32_SUM0_SUS256_VWA2_VWB2_WGM8_WGMXCC1_WGMXCCGn1
    SolutionIndex: 82
    SolutionNameMin: Cijk_Ailk_Bjlk_BSS_BH_UserArgs_MT64x64x64_MI16x16x1_SN_LDSB1_CLR1_GSU0_GSUC0_GSUWGMRR0_K1_LBSPPA512_LBSPPB512_LPA32_LPB32_MIWT2_2_PLR2_SU32_SUM0_SUS256_VWA2_VWB2_WGM8_WGMXCC1_WGMXCCGn1
    SolutionIndex: 83
    SolutionNameMin: Cijk_Ailk_Bjlk_BSS_BH_UserArgs_MT32x64x64_MI16x16x1_SN_LDSB0_CLR1_GSU0_GSUC0_GSUWGMRR0_K1_LBSPPA256_LBSPPB512_LPA16_LPB32_MIWT1_2_PLR1_SU32_SUM0_SUS256_VWA1_VWB2_WGM1_WGMXCC1_WGMXCCGn1
    SolutionIndex: 84
    SolutionNameMin: Cijk_Ailk_Bjlk_BSS_BH_UserArgs_MT32x64x64_MI16x16x1_SN_LDSB0_CLR1_GSU0_GSUC0_GSUWGMRR0_K1_LBSPPA256_LBSPPB512_LPA16_LPB32_MIWT1_2_PLR2_SU32_SUM0_SUS256_VWA1_VWB2_WGM1_WGMXCC1_WGMXCCGn1
    SolutionIndex: 85
    SolutionNameMin: Cijk_Ailk_Bjlk_BSS_BH_UserArgs_MT32x64x64_MI16x16x1_SN_LDSB0_CLR1_GSU0_GSUC0_GSUWGMRR0_K1_LBSPPA256_LBSPPB512_LPA16_LPB32_MIWT1_2_PLR1_SU32_SUM0_SUS256_VWA1_VWB2_WGM4_WGMXCC1_WGMXCCGn1
    SolutionIndex: 86
    SolutionNameMin: Cijk_Ailk_Bjlk_BSS_BH_UserArgs_MT32x64x64_MI16x16x1_SN_LDSB0_CLR1_GSU0_GSUC0_GSUWGMRR0_K1_LBSPPA256_LBSPPB512_LPA16_LPB32_MIWT1_2_PLR2_SU32_SUM0_SUS256_VWA1_VWB2_WGM8_WGMXCC1_WGMXCCGn1
    SolutionIndex: 87
    SolutionNameMin: Cijk_Ailk_Bjlk_BSS_BH_UserArgs_MT64x32x64_MI16x16x1_SN_LDSB0_CLR1_GSU0_GSUC0_GSUWGMRR0_K1_LBSPPA512_LBSPPB256_LPA32_LPB16_MIWT2_1_PLR1_SU32_SUM0_SUS256_VWA2_VWB1_WGM1_WGMXCC1_WGMXCCGn1
    SolutionIndex: 88
    SolutionNameMin: Cijk_Ailk_Bjlk_BSS_BH_UserArgs_MT64x32x64_MI16x16x1_SN_LDSB0_CLR1_GSU0_GSUC0_GSUWGMRR0_K1_LBSPPA512_LBSPPB256_LPA32_LPB16_MIWT2_1_PLR2_SU32_SUM0_SUS256_VWA2_VWB1_WGM1_WGMXCC1_WGMXCCGn1
    SolutionIndex: 89
    SolutionNameMin: Cijk_Ailk_Bjlk_BSS_BH_UserArgs_MT128x128x128_MI16x16x1_SN_LDSB1_CLR1_GSU0_GSUC0_GSUWGMRR0_K1_LBSPPA1024_LBSPPB1024_LPA0_LPB0_MIWT4_4_PLR1_SU32_SUM0_SUS256_VWA4_VWB4_WGM1_WGMXCC1_WGMXCCGn1
    SolutionIndex: 90
    SolutionNameMin: Cijk_Ailk_Bjlk_BSS_BH_UserArgs_MT128x128x128_MI16x16x1_SN_LDSB1_CLR1_GSU0_GSUC0_GSUWGMRR0_K1_LBSPPA1024_LBSPPB1024_LPA0_LPB0_MIWT4_4_PLR2_SU32_SUM0_SUS256_VWA4_VWB4_WGM1_WGMXCC1_WGMXCCGn1
    SolutionIndex: 91
    SolutionNameMin: Cijk_Ailk_Bjlk_BSS_BH_UserArgs_MT128x128x128_MI16x16x1_SN_LDSB1_CLR1_GSU0_GSUC0_GSUWGMRR0_K1_LBSPPA1024_LBSPPB1024_LPA0_LPB0_MIWT4_4_PLR1_SU32_SUM0_SUS256_VWA4_VWB4_WGM4_WGMXCC1_WGMXCCGn1
    SolutionIndex: 92
    SolutionNameMin: Cijk_Ailk_Bjlk_BSS_BH_UserArgs_MT128x128x128_MI16x16x1_SN_LDSB1_CLR1_GSU0_GSUC0_GSUWGMRR0_K1_LBSPPA1024_LBSPPB1024_LPA0_LPB0_MIWT4_4_PLR1_SU32_SUM0_SUS256_VWA4_VWB4_WGM8_WGMXCC1_WGMXCCGn1
    SolutionIndex: 93
    SolutionNameMin: Cijk_Ailk_Bjlk_BSS_BH_UserArgs_MT128x32x128_MI16x16x1_SN_LDSB1_CLR1_GSU0_GSUC0_GSUWGMRR0_K1_LBSPPA1024_LBSPPB256_LPA0_LPB16_MIWT4_1_PLR2_SU32_SUM0_SUS256_VWA4_VWB1_WGM8_WGMXCC1_WGMXCCGn1
    SolutionIndex: 94
    SolutionNameMin: Cijk_Ailk_Bjlk_BSS_BH_UserArgs_MT64x64x128_MI16x16x1_SN_LDSB1_CLR1_GSU0_GSUC0_GSUWGMRR0_K1_LBSPPA512_LBSPPB512_LPA32_LPB32_MIWT2_2_PLR2_SU32_SUM0_SUS256_VWA2_VWB2_WGM1_WGMXCC1_WGMXCCGn1
    SolutionIndex: 95
    SolutionNameMin: Cijk_Ailk_Bjlk_BSS_BH_UserArgs_MT64x64x128_MI16x16x1_SN_LDSB1_CLR1_GSU0_GSUC0_GSUWGMRR0_K1_LBSPPA512_LBSPPB512_LPA32_LPB32_MIWT2_2_PLR2_SU32_SUM0_SUS256_VWA2_VWB2_WGM4_WGMXCC1_WGMXCCGn1
    SolutionIndex: 96
    SolutionNameMin: Cijk_Ailk_Bjlk_BSS_BH_UserArgs_MT64x64x128_MI16x16x1_SN_LDSB1_CLR1_GSU0_GSUC0_GSUWGMRR0_K1_LBSPPA512_LBSPPB512_LPA16_LPB32_MIWT2_2_PLR2_SU32_SUM0_SUS256_VWA1_VWB2_WGM8_WGMXCC1_WGMXCCGn1
    SolutionIndex: 97
    SolutionNameMin: Cijk_Ailk_Bjlk_BSS_BH_UserArgs_MT32x64x128_MI16x16x1_SN_LDSB1_CLR1_GSU0_GSUC0_GSUWGMRR0_K1_LBSPPA256_LBSPPB512_LPA16_LPB32_MIWT1_2_PLR1_SU32_SUM0_SUS256_VWA1_VWB2_WGM1_WGMXCC1_WGMXCCGn1
    SolutionIndex: 98
    SolutionNameMin: Cijk_Ailk_Bjlk_BSS_BH_UserArgs_MT32x64x128_MI16x16x1_SN_LDSB1_CLR1_GSU0_GSUC0_GSUWGMRR0_K1_LBSPPA256_LBSPPB512_LPA16_LPB32_MIWT1_2_PLR2_SU32_SUM0_SUS256_VWA1_VWB2_WGM1_WGMXCC1_WGMXCCGn1
    SolutionIndex: 99
    SolutionNameMin: Cijk_Ailk_Bjlk_BSS_BH_UserArgs_MT32x64x128_MI16x16x1_SN_LDSB1_CLR1_GSU0_GSUC0_GSUWGMRR0_K1_LBSPPA256_LBSPPB512_LPA16_LPB32_MIWT1_2_PLR1_SU32_SUM0_SUS256_VWA1_VWB2_WGM4_WGMXCC1_WGMXCCGn1
    SolutionIndex: 100
    SolutionNameMin: Cijk_Ailk_Bjlk_BSS_BH_UserArgs_MT32x64x128_MI16x16x1_SN_LDSB1_CLR1_GSU0_GSUC0_GSUWGMRR0_K1_LBSPPA256_LBSPPB512_LPA16_LPB32_MIWT1_2_PLR2_SU32_SUM0_SUS256_VWA1_VWB2_WGM4_WGMXCC1_WGMXCCGn1
    SolutionIndex: 101
    SolutionNameMin: Cijk_Ailk_Bjlk_BSS_BH_UserArgs_MT32x64x128_MI16x16x1_SN_LDSB1_CLR1_GSU0_GSUC0_GSUWGMRR0_K1_LBSPPA256_LBSPPB512_LPA16_LPB32_MIWT1_2_PLR2_SU32_SUM0_SUS256_VWA1_VWB2_WGM8_WGMXCC1_WGMXCCGn1
    SolutionIndex: 102
    SolutionNameMin: Cijk_Ailk_Bjlk_BSS_BH_UserArgs_MT64x32x128_MI16x16x1_SN_LDSB1_CLR1_GSU0_GSUC0_GSUWGMRR0_K1_LBSPPA512_LBSPPB256_LPA32_LPB16_MIWT2_1_PLR1_SU32_SUM0_SUS256_VWA2_VWB1_WGM1_WGMXCC1_WGMXCCGn1
    SolutionIndex: 103
    SolutionNameMin: Cijk_Ailk_Bjlk_BSS_BH_UserArgs_MT64x32x128_MI16x16x1_SN_LDSB1_CLR1_GSU0_GSUC0_GSUWGMRR0_K1_LBSPPA512_LBSPPB256_LPA16_LPB16_MIWT2_1_PLR2_SU32_SUM0_SUS256_VWA1_VWB1_WGM1_WGMXCC1_WGMXCCGn1
    SolutionIndex: 104
    SolutionNameMin: Cijk_Ailk_Bjlk_BSS_BH_UserArgs_MT64x32x128_MI16x16x1_SN_LDSB1_CLR1_GSU0_GSUC0_GSUWGMRR0_K1_LBSPPA512_LBSPPB256_LPA32_LPB16_MIWT2_1_PLR2_SU32_SUM0_SUS256_VWA2_VWB1_WGM1_WGMXCC1_WGMXCCGn1
    SolutionIndex: 105
    SolutionNameMin: Cijk_Ailk_Bjlk_BSS_BH_UserArgs_MT64x32x128_MI16x16x1_SN_LDSB1_CLR1_GSU0_GSUC0_GSUWGMRR0_K1_LBSPPA512_LBSPPB256_LPA32_LPB16_MIWT2_1_PLR2_SU32_SUM0_SUS256_VWA2_VWB1_WGM8_WGMXCC1_WGMXCCGn1
    SolutionIndex: 106
    SolutionNameMin: Cijk_Ailk_Bjlk_BSS_BH_UserArgs_MT32x32x128_MI16x16x1_SN_LDSB1_CLR1_GSU0_GSUC0_GSUWGMRR0_K1_LBSPPA256_LBSPPB256_LPA16_LPB16_MIWT1_1_PLR1_SU32_SUM0_SUS256_VWA1_VWB1_WGM1_WGMXCC1_WGMXCCGn1
    SolutionIndex: 107
    SolutionNameMin: Cijk_Ailk_Bjlk_BSS_BH_UserArgs_MT32x32x128_MI16x16x1_SN_LDSB1_CLR1_GSU0_GSUC0_GSUWGMRR0_K1_LBSPPA256_LBSPPB256_LPA16_LPB16_MIWT1_1_PLR2_SU32_SUM0_SUS256_VWA1_VWB1_WGM1_WGMXCC1_WGMXCCGn1
    SolutionIndex: 108
    SolutionNameMin: Cijk_Ailk_Bjlk_BSS_BH_UserArgs_MT32x32x128_MI16x16x1_SN_LDSB1_CLR1_GSU0_GSUC0_GSUWGMRR0_K1_LBSPPA256_LBSPPB256_LPA16_LPB16_MIWT1_1_PLR2_SU32_SUM0_SUS256_VWA1_VWB1_WGM4_WGMXCC1_WGMXCCGn1
    SolutionIndex: 109
    SolutionNameMin: Cijk_Ailk_Bjlk_BSS_BH_UserArgs_MT32x32x128_MI16x16x1_SN_LDSB1_CLR1_GSU0_GSUC0_GSUWGMRR0_K1_LBSPPA256_LBSPPB256_LPA16_LPB16_MIWT1_1_PLR1_SU32_SUM0_SUS256_VWA1_VWB1_WGM8_WGMXCC1_WGMXCCGn1
    SolutionIndex: 110
    SolutionNameMin: Cijk_Ailk_Bjlk_BSS_BH_UserArgs_MT32x32x128_MI16x16x1_SN_LDSB1_CLR1_GSU0_GSUC0_GSUWGMRR0_K1_LBSPPA256_LBSPPB256_LPA16_LPB16_MIWT1_1_PLR2_SU32_SUM0_SUS256_VWA1_VWB1_WGM8_WGMXCC1_WGMXCCGn1
    SolutionIndex: 111
    SolutionNameMin: Cijk_Ailk_Bjlk_BSS_BH_UserArgs_MT32x32x32_MI16x16x1_SN_LDSB0_CLR1_GSU0_GSUC0_GSUWGMRR0_K1_LBSPPA256_LBSPPB256_LPA16_LPB16_MIWT1_1_PLR1_SU32_SUM0_SUS256_VWA1_VWB1_WGM4_WGMXCC1_WGMXCCGn1
- - - [128, 128, 1, 128, 128, 128, 128, 128]
    - [110, 0.072]
  - - [128, 128, 1, 256, 128, 128, 128, 128]
    - [93, 0.096]
  - - [128, 128, 1, 512, 128, 128, 128, 128]
    - [106, 0.161]
  - - [128, 128, 1, 1024, 128, 128, 128, 128]
    - [106, 0.268]
  - - [128, 128, 1, 2048, 128, 128, 128, 128]
    - [54, 0.476]
  - - [128, 128, 1, 4096, 128, 128, 128, 128]
    - [101, 0.709]
  - - [128, 128, 1, 8192, 128, 128, 128, 128]
    - [99, 1.087]
  - - [128, 256, 1, 128, 128, 128, 128, 256]
    - [110, 0.145]
  - - [128, 256, 1, 256, 128, 128, 128, 256]
    - [106, 0.219]
  - - [128, 256, 1, 512, 128, 128, 128, 256]
    - [54, 0.294]
  - - [128, 256, 1, 1024, 128, 128, 128, 256]
    - [107, 0.52]
  - - [128, 256, 1, 2048, 128, 128, 128, 256]
    - [97, 0.819]
  - - [128, 256, 1, 4096, 128, 128, 128, 256]
    - [83, 1.258]
  - - [128, 256, 1, 8192, 128, 128, 128, 256]
    - [80, 1.828]
  - - [128, 512, 1, 128, 128, 128, 128, 512]
    - [103, 0.274]
  - - [128, 512, 1, 256, 128, 128, 128, 512]
    - [55, 0.447]
  - - [128, 512, 1, 512, 128, 128, 128, 512]
    - [106, 0.684]
  - - [128, 512, 1, 1024, 128, 128, 128, 512]
    - [97, 0.961]
  - - [128, 512, 1, 2048, 128, 128, 128, 512]
    - [51, 1.405]
  - - [128, 512, 1, 4096, 128, 128, 128, 512]
    - [80, 2.185]
  - - [128, 512, 1, 8192, 128, 128, 128, 512]
    - [43, 2.731]
  - - [128, 1024, 1, 128, 128, 128, 128, 1024]
    - [95, 0.496]
  - - [128, 1024, 1, 256, 128, 128, 128, 1024]
    - [83, 0.807]
  - - [128, 1024, 1, 512, 128, 128, 128, 1024]
    - [98, 1.251]
  - - [128, 1024, 1, 1024, 128, 128, 128, 1024]
    - [101, 1.665]
  - - [128, 1024, 1, 2048, 128, 128, 128, 1024]
    - [46, 2.277]
  - - [128, 1024, 1, 4096, 128, 128, 128, 1024]
    - [72, 3.248]
  - - [128, 1024, 1, 8192, 128, 128, 128, 1024]
    - [60, 3.565]
  - - [128, 2048, 1, 128, 128, 128, 128, 2048]
    - [78, 0.864]
  - - [128, 2048, 1, 256, 128, 128, 128, 2048]
    - [76, 1.484]
  - - [128, 2048, 1, 512, 128, 128, 128, 2048]
    - [76, 2.048]
  - - [128, 2048, 1, 1024, 128, 128, 128, 2048]
    - [68, 2.315]
  - - [128, 2048, 1, 2048, 128, 128, 128, 2048]
    - [31, 3.242]
  - - [128, 2048, 1, 4096, 128, 128, 128, 2048]
    - [58, 4.742]
  - - [128, 2048, 1, 8192, 128, 128, 128, 2048]
    - [28, 4.639]
  - - [128, 4096, 1, 128, 128, 128, 128, 4096]
    - [74, 1.166]
  - - [128, 4096, 1, 256, 128, 128, 128, 4096]
    - [64, 2.129]
  - - [128, 4096, 1, 512, 128, 128, 128, 4096]
    - [75, 2.945]
  - - [128, 4096, 1, 1024, 128, 128, 128, 4096]
    - [59, 3.269]
  - - [128, 4096, 1, 2048, 128, 128, 128, 4096]
    - [63, 3.903]
  - - [128, 4096, 1, 4096, 128, 128, 128, 4096]
    - [60, 5.147]
  - - [128, 4096, 1, 8192, 128, 128, 128, 4096]
    - [62, 5.75]
  - - [128, 8192, 1, 128, 128, 128, 128, 8192]
    - [41, 1.652]
  - - [128, 8192, 1, 256, 128, 128, 128, 8192]
    - [28, 2.77]
  - - [128, 8192, 1, 512, 128, 128, 128, 8192]
    - [60, 3.898]
  - - [128, 8192, 1, 1024, 128, 128, 128, 8192]
    - [90, 4.379]
  - - [128, 8192, 1, 2048, 128, 128, 128, 8192]
    - [63, 4.857]
  - - [128, 8192, 1, 4096, 128, 128, 128, 8192]
    - [61, 5.9]
  - - [128, 8192, 1, 8192, 128, 128, 128, 8192]
    - [58, 6.551]
  - - [256, 128, 1, 128, 256, 256, 256, 128]
    - [97, 0.143]
  - - [256, 128, 1, 256, 256, 256, 256, 128]
    - [107, 0.223]
  - - [256, 128, 1, 512, 256, 256, 256, 128]
    - [54, 0.308]
  - - [256, 128, 1, 1024, 256, 256, 256, 128]
    - [108, 0.514]
  - - [256, 128, 1, 2048, 256, 256, 256, 128]
    - [100, 0.803]
  - - [256, 128, 1, 4096, 256, 256, 256, 128]
    - [84, 1.285]
  - - [256, 128, 1, 8192, 256, 256, 256, 128]
    - [81, 1.791]
  - - [256, 256, 1, 128, 256, 256, 256, 256]
    - [98, 0.288]
  - - [256, 256, 1, 256, 256, 256, 256, 256]
    - [54, 0.47]
  - - [256, 256, 1, 512, 256, 256, 256, 256]
    - [109, 0.658]
  - - [256, 256, 1, 1024, 256, 256, 256, 256]
    - [109, 0.913]
  - - [256, 256, 1, 2048, 256, 256, 256, 256]
    - [52, 1.37]
  - - [256, 256, 1, 4096, 256, 256, 256, 256]
    - [78, 2.173]
  - - [256, 256, 1, 8192, 256, 256, 256, 256]
    - [46, 2.79]
  - - [256, 512, 1, 128, 256, 256, 256, 512]
    - [53, 0.515]
  - - [256, 512, 1, 256, 256, 256, 256, 512]
    - [88, 0.796]
  - - [256, 512, 1, 512, 256, 256, 256, 512]
    - [86, 1.255]
  - - [256, 512, 1, 1024, 256, 256, 256, 512]
    - [105, 1.629]
  - - [256, 512, 1, 2048, 256, 256, 256, 512]
    - [49, 2.183]
  - - [256, 512, 1, 4096, 256, 256, 256, 512]
    - [72, 3.154]
  - - [256, 512, 1, 8192, 256, 256, 256, 512]
    - [42, 3.893]
  - - [256, 1024, 1, 128, 256, 256, 256, 1024]
    - [78, 0.905]
  - - [256, 1024, 1, 256, 256, 256, 256, 1024]
    - [76, 1.439]
  - - [256, 1024, 1, 512, 256, 256, 256, 1024]
    - [78, 2.036]
  - - [256, 1024, 1, 1024, 256, 256, 256, 1024]
    - [67, 2.405]
  - - [256, 1024, 1, 2048, 256, 256, 256, 1024]
    - [35, 3.192]
  - - [256, 1024, 1, 4096, 256, 256, 256, 1024]
    - [59, 4.553]
  - - [256, 1024, 1, 8192, 256, 256, 256, 1024]
    - [15, 4.813]
  - - [256, 2048, 1, 128, 256, 256, 256, 2048]
    - [65, 1.246]
  - - [256, 2048, 1, 256, 256, 256, 256, 2048]
    - [66, 2.12]
  - - [256, 2048, 1, 512, 256, 256, 256, 2048]
    - [75, 2.915]
  - - [256, 2048, 1, 1024, 256, 256, 256, 2048]
    - [60, 3.446]
  - - [256, 2048, 1, 2048, 256, 256, 256, 2048]
    - [58, 4.249]
  - - [256, 2048, 1, 4096, 256, 256, 256, 2048]
    - [61, 5.028]
  - - [256, 2048, 1, 8192, 256, 256, 256, 2048]
    - [13, 5.563]
  - - [256, 4096, 1, 128, 256, 256, 256, 4096]
    - [33, 1.634]
  - - [256, 4096, 1, 256, 256, 256, 256, 4096]
    - [58, 2.751]
  - - [256, 4096, 1, 512, 256, 256, 256, 4096]
    - [63, 3.891]
  - - [256, 4096, 1, 1024, 256, 256, 256, 4096]
    - [91, 4.378]
  - - [256, 4096, 1, 2048, 256, 256, 256, 4096]
    - [28, 4.922]
  - - [256, 4096, 1, 4096, 256, 256, 256, 4096]
    - [60, 6.401]
  - - [256, 4096, 1, 8192, 256, 256, 256, 4096]
    - [18, 6.775]
  - - [256, 8192, 1, 128, 256, 256, 256, 8192]
    - [13, 2.109]
  - - [256, 8192, 1, 256, 256, 256, 256, 8192]
    - [19, 3.438]
  - - [256, 8192, 1, 512, 256, 256, 256, 8192]
    - [63, 4.485]
  - - [256, 8192, 1, 1024, 256, 256, 256, 8192]
    - [69, 5.04]
  - - [256, 8192, 1, 2048, 256, 256, 256, 8192]
    - [59, 5.829]
  - - [256, 8192, 1, 4096, 256, 256, 256, 8192]
    - [32, 6.32]
  - - [256, 8192, 1, 8192, 256, 256, 256, 8192]
    - [21, 7.261]
  - - [512, 128, 1, 128, 512, 512, 512, 128]
    - [102, 0.292]
  - - [512, 128, 1, 256, 512, 512, 512, 128]
    - [106, 0.469]
  - - [512, 128, 1, 512, 512, 512, 512, 128]
    - [106, 0.68]
  - - [512, 128, 1, 1024, 512, 512, 512, 128]
    - [104, 0.933]
  - - [512, 128, 1, 2048, 512, 512, 512, 128]
    - [50, 1.405]
  - - [512, 128, 1, 4096, 512, 512, 512, 128]
    - [76, 2.195]
  - - [512, 128, 1, 8192, 512, 512, 512, 128]
    - [48, 2.844]
  - - [512, 256, 1, 128, 512, 512, 512, 256]
    - [96, 0.536]
  - - [512, 256, 1, 256, 512, 512, 512, 256]
    - [85, 0.828]
  - - [512, 256, 1, 512, 512, 512, 512, 256]
    - [102, 1.225]
  - - [512, 256, 1, 1024, 512, 512, 512, 256]
    - [98, 1.707]
  - - [512, 256, 1, 2048, 512, 512, 512, 256]
    - [43, 2.307]
  - - [512, 256, 1, 4096, 512, 512, 512, 256]
    - [67, 3.167]
  - - [512, 256, 1, 8192, 512, 512, 512, 256]
    - [42, 3.899]
  - - [512, 512, 1, 128, 512, 512, 512, 512]
    - [78, 0.89]
  - - [512, 512, 1, 256, 512, 512, 512, 512]
    - [81, 1.457]
  - - [512, 512, 1, 512, 512, 512, 512, 512]
    - [79, 2.093]
  - - [512, 512, 1, 1024, 512, 512, 512, 512]
    - [72, 2.398]
  - - [512, 512, 1, 2048, 512, 512, 512, 512]
    - [31, 3.276]
  - - [512, 512, 1, 4096, 512, 512, 512, 512]
    - [58, 4.815]
  - - [512, 512, 1, 8192, 512, 512, 512, 512]
    - [19, 4.833]
  - - [512, 1024, 1, 128, 512, 512, 512, 1024]
    - [47, 1.255]
  - - [512, 1024, 1, 256, 512, 512, 512, 1024]
    - [75, 2.161]
  - - [512, 1024, 1, 512, 512, 512, 512, 1024]
    - [69, 2.977]
  - - [512, 1024, 1, 1024, 512, 512, 512, 1024]
    - [63, 3.346]
  - - [512, 1024, 1, 2048, 512, 512, 512, 1024]
    - [58, 4.236]
  - - [512, 1024, 1, 4096, 512, 512, 512, 1024]
    - [58, 5.252]
  - - [512, 1024, 1, 8192, 512, 512, 512, 1024]
    - [4, 5.777]
  - - [512, 2048, 1, 128, 512, 512, 512, 2048]
    - [34, 1.613]
  - - [512, 2048, 1, 256, 512, 512, 512, 2048]
    - [60, 2.83]
  - - [512, 2048, 1, 512, 512, 512, 512, 2048]
    - [61, 3.909]
  - - [512, 2048, 1, 1024, 512, 512, 512, 2048]
    - [91, 4.305]
  - - [512, 2048, 1, 2048, 512, 512, 512, 2048]
    - [58, 4.935]
  - - [512, 2048, 1, 4096, 512, 512, 512, 2048]
    - [60, 6.236]
  - - [512, 2048, 1, 8192, 512, 512, 512, 2048]
    - [19, 6.463]
  - - [512, 4096, 1, 128, 512, 512, 512, 4096]
    - [20, 2.095]
  - - [512, 4096, 1, 256, 512, 512, 512, 4096]
    - [11, 3.453]
  - - [512, 4096, 1, 512, 512, 512, 512, 4096]
    - [61, 4.499]
  - - [512, 4096, 1, 1024, 512, 512, 512, 4096]
    - [73, 4.952]
  - - [512, 4096, 1, 2048, 512, 512, 512, 4096]
    - [58, 6.695]
  - - [512, 4096, 1, 4096, 512, 512, 512, 4096]
    - [16, 6.672]
  - - [512, 4096, 1, 8192, 512, 512, 512, 4096]
    - [20, 7.844]
  - - [512, 8192, 1, 128, 512, 512, 512, 8192]
    - [40, 2.494]
  - - [512, 8192, 1, 256, 512, 512, 512, 8192]
    - [34, 4.07]
  - - [512, 8192, 1, 512, 512, 512, 512, 8192]
    - [29, 5.688]
  - - [512, 8192, 1, 1024, 512, 512, 512, 8192]
    - [39, 6.658]
  - - [512, 8192, 1, 2048, 512, 512, 512, 8192]
    - [58, 7.478]
  - - [512, 8192, 1, 4096, 512, 512, 512, 8192]
    - [18, 7.945]
  - - [512, 8192, 1, 8192, 512, 512, 512, 8192]
    - [20, 8.589]
  - - [1024, 128, 1, 128, 1024, 1024, 1024, 128]
    - [94, 0.553]
  - - [1024, 128, 1, 256, 1024, 1024, 1024, 128]
    - [83, 0.881]
  - - [1024, 128, 1, 512, 1024, 1024, 1024, 128]
    - [87, 1.273]
  - - [1024, 128, 1, 1024, 1024, 1024, 1024, 128]
    - [98, 1.697]
  - - [1024, 128, 1, 2048, 1024, 1024, 1024, 128]
    - [44, 2.407]
  - - [1024, 128, 1, 4096, 1024, 1024, 1024, 128]
    - [67, 3.258]
  - - [1024, 128, 1, 8192, 1024, 1024, 1024, 128]
    - [28, 3.726]
  - - [1024, 256, 1, 128, 1024, 1024, 1024, 256]
    - [77, 0.937]
  - - [1024, 256, 1, 256, 1024, 1024, 1024, 256]
    - [82, 1.523]
  - - [1024, 256, 1, 512, 1024, 1024, 1024, 256]
    - [76, 2.214]
  - - [1024, 256, 1, 1024, 1024, 1024, 1024, 256]
    - [70, 2.481]
  - - [1024, 256, 1, 2048, 1024, 1024, 1024, 256]
    - [32, 3.344]
  - - [1024, 256, 1, 4096, 1024, 1024, 1024, 256]
    - [62, 4.73]
  - - [1024, 256, 1, 8192, 1024, 1024, 1024, 256]
    - [60, 4.882]
  - - [1024, 512, 1, 128, 1024, 1024, 1024, 512]
    - [71, 1.32]
  - - [1024, 512, 1, 256, 1024, 1024, 1024, 512]
    - [72, 2.291]
  - - [1024, 512, 1, 512, 1024, 1024, 1024, 512]
    - [69, 3.084]
  - - [1024, 512, 1, 1024, 1024, 1024, 1024, 512]
    - [59, 3.457]
  - - [1024, 512, 1, 2048, 1024, 1024, 1024, 512]
    - [62, 4.196]
  - - [1024, 512, 1, 4096, 1024, 1024, 1024, 512]
    - [60, 5.394]
  - - [1024, 512, 1, 8192, 1024, 1024, 1024, 512]
    - [60, 5.898]
  - - [1024, 1024, 1, 128, 1024, 1024, 1024, 1024]
    - [30, 1.704]
  - - [1024, 1024, 1, 256, 1024, 1024, 1024, 1024]
    - [60, 2.921]
  - - [1024, 1024, 1, 512, 1024, 1024, 1024, 1024]
    - [60, 4.218]
  - - [1024, 1024, 1, 1024, 1024, 1024, 1024, 1024]
    - [91, 4.373]
  - - [1024, 1024, 1, 2048, 1024, 1024, 1024, 1024]
    - [58, 4.862]
  - - [1024, 1024, 1, 4096, 1024, 1024, 1024, 1024]
    - [61, 6.135]
  - - [1024, 1024, 1, 8192, 1024, 1024, 1024, 1024]
    - [4, 6.389]
  - - [1024, 2048, 1, 128, 1024, 1024, 1024, 2048]
    - [10, 2.082]
  - - [1024, 2048, 1, 256, 1024, 1024, 1024, 2048]
    - [5, 3.377]
  - - [1024, 2048, 1, 512, 1024, 1024, 1024, 2048]
    - [58, 4.454]
  - - [1024, 2048, 1, 1024, 1024, 1024, 1024, 2048]
    - [69, 5.051]
  - - [1024, 2048, 1, 2048, 1024, 1024, 1024, 2048]
    - [62, 6.216]
  - - [1024, 2048, 1, 4096, 1024, 1024, 1024, 2048]
    - [62, 6.344]
  - - [1024, 2048, 1, 8192, 1024, 1024, 1024, 2048]
    - [18, 7.29]
  - - [1024, 4096, 1, 128, 1024, 1024, 1024, 4096]
    - [28, 2.465]
  - - [1024, 4096, 1, 256, 1024, 1024, 1024, 4096]
    - [29, 4.09]
  - - [1024, 4096, 1, 512, 1024, 1024, 1024, 4096]
    - [58, 5.562]
  - - [1024, 4096, 1, 1024, 1024, 1024, 1024, 4096]
    - [34, 6.589]
  - - [1024, 4096, 1, 2048, 1024, 1024, 1024, 4096]
    - [58, 8.038]
  - - [1024, 4096, 1, 4096, 1024, 1024, 1024, 4096]
    - [10, 7.458]
  - - [1024, 4096, 1, 8192, 1024, 1024, 1024, 4096]
    - [13, 7.862]
  - - [1024, 8192, 1, 128, 1024, 1024, 1024, 8192]
    - [7, 2.659]
  - - [1024, 8192, 1, 256, 1024, 1024, 1024, 8192]
    - [7, 4.479]
  - - [1024, 8192, 1, 512, 1024, 1024, 1024, 8192]
    - [10, 6.186]
  - - [1024, 8192, 1, 1024, 1024, 1024, 1024, 8192]
    - [11, 7.78]
  - - [1024, 8192, 1, 2048, 1024, 1024, 1024, 8192]
    - [62, 7.518]
  - - [1024, 8192, 1, 4096, 1024, 1024, 1024, 8192]
    - [4, 8.345]
  - - [1024, 8192, 1, 8192, 1024, 1024, 1024, 8192]
    - [14, 8.141]
  - - [2048, 128, 1, 128, 2048, 2048, 2048, 128]
    - [76, 0.978]
  - - [2048, 128, 1, 256, 2048, 2048, 2048, 128]
    - [78, 1.565]
  - - [2048, 128, 1, 512, 2048, 2048, 2048, 128]
    - [79, 2.006]
  - - [2048, 128, 1, 1024, 2048, 2048, 2048, 128]
    - [72, 2.434]
  - - [2048, 128, 1, 2048, 2048, 2048, 2048, 128]
    - [32, 3.274]
  - - [2048, 128, 1, 4096, 2048, 2048, 2048, 128]
    - [62, 4.583]
  - - [2048, 128, 1, 8192, 2048, 2048, 2048, 128]
    - [18, 4.848]
  - - [2048, 256, 1, 128, 2048, 2048, 2048, 256]
    - [45, 1.337]
  - - [2048, 256, 1, 256, 2048, 2048, 2048, 256]
    - [69, 2.239]
  - - [2048, 256, 1, 512, 2048, 2048, 2048, 256]
    - [67, 2.987]
  - - [2048, 256, 1, 1024, 2048, 2048, 2048, 256]
    - [63, 3.362]
  - - [2048, 256, 1, 2048, 2048, 2048, 2048, 256]
    - [62, 4.176]
  - - [2048, 256, 1, 4096, 2048, 2048, 2048, 256]
    - [60, 5.288]
  - - [2048, 256, 1, 8192, 2048, 2048, 2048, 256]
    - [7, 5.849]
  - - [2048, 512, 1, 128, 2048, 2048, 2048, 512]
    - [24, 1.739]
  - - [2048, 512, 1, 256, 2048, 2048, 2048, 512]
    - [38, 2.882]
  - - [2048, 512, 1, 512, 2048, 2048, 2048, 512]
    - [59, 3.937]
  - - [2048, 512, 1, 1024, 2048, 2048, 2048, 512]
    - [89, 4.525]
  - - [2048, 512, 1, 2048, 2048, 2048, 2048, 512]
    - [62, 4.943]
  - - [2048, 512, 1, 4096, 2048, 2048, 2048, 512]
    - [61, 6.258]
  - - [2048, 512, 1, 8192, 2048, 2048, 2048, 512]
    - [4, 6.469]
  - - [2048, 1024, 1, 128, 2048, 2048, 2048, 1024]
    - [22, 2.16]
  - - [2048, 1024, 1, 256, 2048, 2048, 2048, 1024]
    - [18, 3.529]
  - - [2048, 1024, 1, 512, 2048, 2048, 2048, 1024]
    - [59, 4.534]
  - - [2048, 1024, 1, 1024, 2048, 2048, 2048, 1024]
    - [39, 5.056]
  - - [2048, 1024, 1, 2048, 2048, 2048, 2048, 1024]
    - [60, 6.595]
  - - [2048, 1024, 1, 4096, 2048, 2048, 2048, 1024]
    - [3, 6.372]
  - - [2048, 1024, 1, 8192, 2048, 2048, 2048, 1024]
    - [13, 7.566]
  - - [2048, 2048, 1, 128, 2048, 2048, 2048, 2048]
    - [33, 2.537]
  - - [2048, 2048, 1, 256, 2048, 2048, 2048, 2048]
    - [33, 4.128]
  - - [2048, 2048, 1, 512, 2048, 2048, 2048, 2048]
    - [58, 5.585]
  - - [2048, 2048, 1, 1024, 2048, 2048, 2048, 2048]
    - [58, 6.935]
  - - [2048, 2048, 1, 2048, 2048, 2048, 2048, 2048]
    - [58, 7.981]
  - - [2048, 2048, 1, 4096, 2048, 2048, 2048, 2048]
    - [8, 7.405]
  - - [2048, 2048, 1, 8192, 2048, 2048, 2048, 2048]
    - [7, 8.063]
  - - [2048, 4096, 1, 128, 2048, 2048, 2048, 4096]
    - [17, 2.613]
  - - [2048, 4096, 1, 256, 2048, 2048, 2048, 4096]
    - [3, 4.436]
  - - [2048, 4096, 1, 512, 2048, 2048, 2048, 4096]
    - [13, 6.231]
  - - [2048, 4096, 1, 1024, 2048, 2048, 2048, 4096]
    - [4, 7.706]
  - - [2048, 4096, 1, 2048, 2048, 2048, 2048, 4096]
    - [58, 7.502]
  - - [2048, 4096, 1, 4096, 2048, 2048, 2048, 4096]
    - [7, 8.348]
  - - [2048, 4096, 1, 8192, 2048, 2048, 2048, 4096]
    - [9, 8.052]
  - - [2048, 8192, 1, 128, 2048, 2048, 2048, 8192]
    - [33, 2.544]
  - - [2048, 8192, 1, 256, 2048, 2048, 2048, 8192]
    - [1, 3.883]
  - - [2048, 8192, 1, 512, 2048, 2048, 2048, 8192]
    - [2, 5.497]
  - - [2048, 8192, 1, 1024, 2048, 2048, 2048, 8192]
    - [4, 7.288]
  - - [2048, 8192, 1, 2048, 2048, 2048, 2048, 8192]
    - [10, 8.186]
  - - [2048, 8192, 1, 4096, 2048, 2048, 2048, 8192]
    - [15, 8.724]
  - - [2048, 8192, 1, 8192, 2048, 2048, 2048, 8192]
    - [15, 8.826]
  - - [4096, 128, 1, 128, 4096, 4096, 4096, 128]
    - [44, 1.275]
  - - [4096, 128, 1, 256, 4096, 4096, 4096, 128]
    - [67, 2.154]
  - - [4096, 128, 1, 512, 4096, 4096, 4096, 128]
    - [69, 2.941]
  - - [4096, 128, 1, 1024, 4096, 4096, 4096, 128]
    - [62, 3.388]
  - - [4096, 128, 1, 2048, 4096, 4096, 4096, 128]
    - [22, 4.105]
  - - [4096, 128, 1, 4096, 4096, 4096, 4096, 128]
    - [58, 5.218]
  - - [4096, 128, 1, 8192, 4096, 4096, 4096, 128]
    - [60, 6.208]
  - - [4096, 256, 1, 128, 4096, 4096, 4096, 256]
    - [37, 1.713]
  - - [4096, 256, 1, 256, 4096, 4096, 4096, 256]
    - [26, 2.85]
  - - [4096, 256, 1, 512, 4096, 4096, 4096, 256]
    - [59, 3.812]
  - - [4096, 256, 1, 1024, 4096, 4096, 4096, 256]
    - [92, 4.312]
  - - [4096, 256, 1, 2048, 4096, 4096, 4096, 256]
    - [58, 4.897]
  - - [4096, 256, 1, 4096, 4096, 4096, 4096, 256]
    - [62, 6.443]
  - - [4096, 256, 1, 8192, 4096, 4096, 4096, 256]
    - [11, 6.656]
  - - [4096, 512, 1, 128, 4096, 4096, 4096, 512]
    - [18, 2.143]
  - - [4096, 512, 1, 256, 4096, 4096, 4096, 512]
    - [22, 3.486]
  - - [4096, 512, 1, 512, 4096, 4096, 4096, 512]
    - [58, 4.577]
  - - [4096, 512, 1, 1024, 4096, 4096, 4096, 512]
    - [39, 5.086]
  - - [4096, 512, 1, 2048, 4096, 4096, 4096, 512]
    - [62, 6.66]
  - - [4096, 512, 1, 4096, 4096, 4096, 4096, 512]
    - [58, 6.768]
  - - [4096, 512, 1, 8192, 4096, 4096, 4096, 512]
    - [8, 7.838]
  - - [4096, 1024, 1, 128, 4096, 4096, 4096, 1024]
    - [36, 2.478]
  - - [4096, 1024, 1, 256, 4096, 4096, 4096, 1024]
    - [37, 4.055]
  - - [4096, 1024, 1, 512, 4096, 4096, 4096, 1024]
    - [27, 5.468]
  - - [4096, 1024, 1, 1024, 4096, 4096, 4096, 1024]
    - [60, 6.826]
  - - [4096, 1024, 1, 2048, 4096, 4096, 4096, 1024]
    - [62, 7.686]
  - - [4096, 1024, 1, 4096, 4096, 4096, 4096, 1024]
    - [10, 7.631]
  - - [4096, 1024, 1, 8192, 4096, 4096, 4096, 1024]
    - [23, 8.154]
  - - [4096, 2048, 1, 128, 4096, 4096, 4096, 2048]
    - [16, 2.591]
  - - [4096, 2048, 1, 256, 4096, 4096, 4096, 2048]
    - [23, 4.378]
  - - [4096, 2048, 1, 512, 4096, 4096, 4096, 2048]
    - [3, 6.153]
  - - [4096, 2048, 1, 1024, 4096, 4096, 4096, 2048]
    - [18, 7.414]
  - - [4096, 2048, 1, 2048, 4096, 4096, 4096, 2048]
    - [3, 7.651]
  - - [4096, 2048, 1, 4096, 4096, 4096, 4096, 2048]
    - [16, 8.33]
  - - [4096, 2048, 1, 8192, 4096, 4096, 4096, 2048]
    - [20, 8.238]
  - - [4096, 4096, 1, 128, 4096, 4096, 4096, 4096]
    - [27, 2.498]
  - - [4096, 4096, 1, 256, 4096, 4096, 4096, 4096]
    - [0, 3.84]
  - - [4096, 4096, 1, 512, 4096, 4096, 4096, 4096]
    - [4, 5.62]
  - - [4096, 4096, 1, 1024, 4096, 4096, 4096, 4096]
    - [7, 7.149]
  - - [4096, 4096, 1, 2048, 4096, 4096, 4096, 4096]
    - [12, 8.088]
  - - [4096, 4096, 1, 4096, 4096, 4096, 4096, 4096]
    - [18, 8.856]
  - - [4096, 4096, 1, 8192, 4096, 4096, 4096, 4096]
    - [11, 8.6]
  - - [4096, 8192, 1, 128, 4096, 4096, 4096, 8192]
    - [58, 2.411]
  - - [4096, 8192, 1, 256, 4096, 4096, 4096, 8192]
    - [39, 3.904]
  - - [4096, 8192, 1, 512, 4096, 4096, 4096, 8192]
    - [8, 5.403]
  - - [4096, 8192, 1, 1024, 4096, 4096, 4096, 8192]
    - [22, 7.116]
  - - [4096, 8192, 1, 2048, 4096, 4096, 4096, 8192]
    - [11, 8.127]
  - - [4096, 8192, 1, 4096, 4096, 4096, 4096, 8192]
    - [56, 8.447]
  - - [4096, 8192, 1, 8192, 4096, 4096, 4096, 8192]
    - [16, 8.149]
  - - [8192, 128, 1, 128, 8192, 8192, 8192, 128]
    - [28, 1.752]
  - - [8192, 128, 1, 256, 8192, 8192, 8192, 128]
    - [37, 2.865]
  - - [8192, 128, 1, 512, 8192, 8192, 8192, 128]
    - [60, 3.827]
  - - [8192, 128, 1, 1024, 8192, 8192, 8192, 128]
    - [89, 4.228]
  - - [8192, 128, 1, 2048, 8192, 8192, 8192, 128]
    - [58, 4.991]
  - - [8192, 128, 1, 4096, 8192, 8192, 8192, 128]
    - [62, 6.194]
  - - [8192, 128, 1, 8192, 8192, 8192, 8192, 128]
    - [60, 7.044]
  - - [8192, 256, 1, 128, 8192, 8192, 8192, 256]
    - [22, 2.122]
  - - [8192, 256, 1, 256, 8192, 8192, 8192, 256]
    - [11, 3.437]
  - - [8192, 256, 1, 512, 8192, 8192, 8192, 256]
    - [61, 4.211]
  - - [8192, 256, 1, 1024, 8192, 8192, 8192, 256]
    - [33, 5.021]
  - - [8192, 256, 1, 2048, 8192, 8192, 8192, 256]
    - [62, 6.582]
  - - [8192, 256, 1, 4096, 8192, 8192, 8192, 256]
    - [58, 7.077]
  - - [8192, 256, 1, 8192, 8192, 8192, 8192, 256]
    - [15, 8.206]
  - - [8192, 512, 1, 128, 8192, 8192, 8192, 512]
    - [25, 2.43]
  - - [8192, 512, 1, 256, 8192, 8192, 8192, 512]
    - [37, 4.018]
  - - [8192, 512, 1, 512, 8192, 8192, 8192, 512]
    - [39, 5.603]
  - - [8192, 512, 1, 1024, 8192, 8192, 8192, 512]
    - [60, 6.968]
  - - [8192, 512, 1, 2048, 8192, 8192, 8192, 512]
    - [62, 7.893]
  - - [8192, 512, 1, 4096, 8192, 8192, 8192, 512]
    - [7, 8.136]
  - - [8192, 512, 1, 8192, 8192, 8192, 8192, 512]
    - [11, 8.494]
  - - [8192, 1024, 1, 128, 8192, 8192, 8192, 1024]
    - [16, 2.557]
  - - [8192, 1024, 1, 256, 8192, 8192, 8192, 1024]
    - [3, 4.31]
  - - [8192, 1024, 1, 512, 8192, 8192, 8192, 1024]
    - [11, 6.212]
  - - [8192, 1024, 1, 1024, 8192, 8192, 8192, 1024]
    - [15, 7.768]
  - - [8192, 1024, 1, 2048, 8192, 8192, 8192, 1024]
    - [4, 7.878]
  - - [8192, 1024, 1, 4096, 8192, 8192, 8192, 1024]
    - [4, 8.547]
  - - [8192, 1024, 1, 8192, 8192, 8192, 8192, 1024]
    - [10, 8.302]
  - - [8192, 2048, 1, 128, 8192, 8192, 8192, 2048]
    - [37, 2.418]
  - - [8192, 2048, 1, 256, 8192, 8192, 8192, 2048]
    - [0, 3.759]
  - - [8192, 2048, 1, 512, 8192, 8192, 8192, 2048]
    - [7, 5.652]
  - - [8192, 2048, 1, 1024, 8192, 8192, 8192, 2048]
    - [7, 7.523]
  - - [8192, 2048, 1, 2048, 8192, 8192, 8192, 2048]
    - [3, 8.472]
  - - [8192, 2048, 1, 4096, 8192, 8192, 8192, 2048]
    - [4, 8.973]
  - - [8192, 2048, 1, 8192, 8192, 8192, 8192, 2048]
    - [6, 8.466]
  - - [8192, 4096, 1, 128, 8192, 8192, 8192, 4096]
    - [58, 2.534]
  - - [8192, 4096, 1, 256, 8192, 8192, 8192, 4096]
    - [36, 3.765]
  - - [8192, 4096, 1, 512, 8192, 8192, 8192, 4096]
    - [3, 5.547]
  - - [8192, 4096, 1, 1024, 8192, 8192, 8192, 4096]
    - [3, 7.147]
  - - [8192, 4096, 1, 2048, 8192, 8192, 8192, 4096]
    - [4, 8.359]
  - - [8192, 4096, 1, 4096, 8192, 8192, 8192, 4096]
    - [11, 8.579]
  - - [8192, 4096, 1, 8192, 8192, 8192, 8192, 4096]
    - [57, 8.497]
  - - [8192, 8192, 1, 128, 8192, 8192, 8192, 8192]
    - [25, 2.206]
  - - [8192, 8192, 1, 256, 8192, 8192, 8192, 8192]
    - [7, 3.74]
  - - [8192, 8192, 1, 512, 8192, 8192, 8192, 8192]
    - [8, 5.824]
  - - [8192, 8192, 1, 1024, 8192, 8192, 8192, 8192]
    - [4, 7.498]
  - - [8192, 8192, 1, 2048, 8192, 8192, 8192, 8192]
    - [4, 8.119]
  - - [8192, 8192, 1, 4096, 8192, 8192, 8192, 8192]
    - [23, 8.479]
  - - [8192, 8192, 1, 8192, 8192, 8192, 8192, 8192]
    - [15, 8.503]
  - - [1, 1, 1, 32, 1, 1, 1, 1]
    - [111, 0.0]
- null
- null
- DeviceEfficiency
- GridBased
