library/src/amd_detail/rocblaslt/src/Tensile/Logic/streamk/gfx942_38cu/aquavanjaram942_Cijk_Ailk_Bjlk_HSS_BH_UserArgs.yaml
- {MinimumRequiredVersion: 4.33.0}
- aquavanjaram942
- {Architecture: gfx942, CUCount: 38}
- [Device 0049, Device 0050]
    SolutionIndex: 0
    SolutionNameMin: Cijk_Ailk_Bjlk_HSS_BH_UserArgs_MT256x256x32_MI16x16x1_SN_LDSB1_CLR1_GSU0_GSUC0_GSUWGMRR0_K1_LBSPPA2048_LBSPPB2048_LPA0_LPB32_MIWT8_8_PLR1_SU32_SUM0_SUS256_VWA4_VWB2_WGM1_WGMXCC1_WGMXCCGn1
    SolutionIndex: 1
    SolutionNameMin: Cijk_Ailk_Bjlk_HSS_BH_UserArgs_MT256x256x32_MI16x16x1_SN_LDSB0_CLR1_GSU0_GSUC0_GSUWGMRR0_K1_LBSPPA2048_LBSPPB2048_LPA0_LPB0_MIWT8_8_PLR1_SU32_SUM0_SUS256_VWA4_VWB8_WGM1_WGMXCC1_WGMXCCGn1
    SolutionIndex: 2
    SolutionNameMin: Cijk_Ailk_Bjlk_HSS_BH_UserArgs_MT128x256x32_MI16x16x1_SN_LDSB1_CLR1_GSU0_GSUC0_GSUWGMRR0_K1_LBSPPA1024_LBSPPB2048_LPA0_LPB32_MIWT4_8_PLR1_SU32_SUM0_SUS256_VWA4_VWB2_WGM1_WGMXCC1_WGMXCCGn1
    SolutionIndex: 3
    SolutionNameMin: Cijk_Ailk_Bjlk_HSS_BH_UserArgs_MT128x256x32_MI16x16x1_SN_LDSB1_CLR1_GSU0_GSUC0_GSUWGMRR0_K1_LBSPPA1024_LBSPPB2048_LPA32_LPB0_MIWT4_8_PLR1_SU32_SUM0_SUS256_VWA2_VWB4_WGM1_WGMXCC1_WGMXCCGn1
    SolutionIndex: 4
    SolutionNameMin: Cijk_Ailk_Bjlk_HSS_BH_UserArgs_MT128x256x32_MI16x16x1_SN_LDSB1_CLR1_GSU0_GSUC0_GSUWGMRR0_K1_LBSPPA1024_LBSPPB2048_LPA0_LPB0_MIWT4_8_PLR1_SU32_SUM0_SUS256_VWA4_VWB4_WGM1_WGMXCC1_WGMXCCGn1
    SolutionIndex: 5
    SolutionNameMin: Cijk_Ailk_Bjlk_HSS_BH_UserArgs_MT128x256x32_MI16x16x1_SN_LDSB1_CLR1_GSU0_GSUC0_GSUWGMRR0_K1_LBSPPA1024_LBSPPB2048_LPA32_LPB0_MIWT4_8_PLR1_SU32_SUM0_SUS256_VWA2_VWB8_WGM1_WGMXCC1_WGMXCCGn1
    SolutionIndex: 6
    SolutionNameMin: Cijk_Ailk_Bjlk_HSS_BH_UserArgs_MT128x256x32_MI16x16x1_SN_LDSB1_CLR1_GSU0_GSUC0_GSUWGMRR0_K1_LBSPPA1024_LBSPPB2048_LPA0_LPB0_MIWT4_8_PLR1_SU32_SUM0_SUS256_VWA4_VWB8_WGM1_WGMXCC1_WGMXCCGn1
    SolutionIndex: 7
    SolutionNameMin: Cijk_Ailk_Bjlk_HSS_BH_UserArgs_MT128x256x32_MI16x16x1_SN_LDSB1_CLR1_GSU0_GSUC0_GSUWGMRR0_K1_LBSPPA1024_LBSPPB2048_LPA0_LPB32_MIWT4_8_PLR1_SU32_SUM0_SUS256_VWA4_VWB2_WGM4_WGMXCC1_WGMXCCGn1
    SolutionIndex: 8
    SolutionNameMin: Cijk_Ailk_Bjlk_HSS_BH_UserArgs_MT128x256x32_MI16x16x1_SN_LDSB1_CLR1_GSU0_GSUC0_GSUWGMRR0_K1_LBSPPA1024_LBSPPB2048_LPA0_LPB0_MIWT4_8_PLR1_SU32_SUM0_SUS256_VWA4_VWB4_WGM4_WGMXCC1_WGMXCCGn1
    SolutionIndex: 9
    SolutionNameMin: Cijk_Ailk_Bjlk_HSS_BH_UserArgs_MT128x256x32_MI16x16x1_SN_LDSB1_CLR1_GSU0_GSUC0_GSUWGMRR0_K1_LBSPPA1024_LBSPPB2048_LPA0_LPB0_MIWT4_8_PLR1_SU32_SUM0_SUS256_VWA4_VWB8_WGM4_WGMXCC1_WGMXCCGn1
    SolutionIndex: 10
    SolutionNameMin: Cijk_Ailk_Bjlk_HSS_BH_UserArgs_MT128x256x32_MI16x16x1_SN_LDSB1_CLR1_GSU0_GSUC0_GSUWGMRR0_K1_LBSPPA1024_LBSPPB2048_LPA0_LPB32_MIWT4_8_PLR1_SU32_SUM0_SUS256_VWA4_VWB2_WGM8_WGMXCC1_WGMXCCGn1
    SolutionIndex: 11
    SolutionNameMin: Cijk_Ailk_Bjlk_HSS_BH_UserArgs_MT128x256x32_MI16x16x1_SN_LDSB1_CLR1_GSU0_GSUC0_GSUWGMRR0_K1_LBSPPA1024_LBSPPB2048_LPA32_LPB0_MIWT4_8_PLR1_SU32_SUM0_SUS256_VWA2_VWB4_WGM8_WGMXCC1_WGMXCCGn1
    SolutionIndex: 12
    SolutionNameMin: Cijk_Ailk_Bjlk_HSS_BH_UserArgs_MT128x256x32_MI16x16x1_SN_LDSB1_CLR1_GSU0_GSUC0_GSUWGMRR0_K1_LBSPPA1024_LBSPPB2048_LPA0_LPB0_MIWT4_8_PLR1_SU32_SUM0_SUS256_VWA4_VWB4_WGM8_WGMXCC1_WGMXCCGn1
    SolutionIndex: 13
    SolutionNameMin: Cijk_Ailk_Bjlk_HSS_BH_UserArgs_MT128x256x32_MI16x16x1_SN_LDSB1_CLR1_GSU0_GSUC0_GSUWGMRR0_K1_LBSPPA1024_LBSPPB2048_LPA0_LPB0_MIWT4_8_PLR1_SU32_SUM0_SUS256_VWA4_VWB8_WGM8_WGMXCC1_WGMXCCGn1
    SolutionIndex: 14
    SolutionNameMin: Cijk_Ailk_Bjlk_HSS_BH_UserArgs_MT256x128x32_MI16x16x1_SN_LDSB1_CLR1_GSU0_GSUC0_GSUWGMRR0_K1_LBSPPA2048_LBSPPB1024_LPA0_LPB16_MIWT8_4_PLR1_SU32_SUM0_SUS256_VWA4_VWB1_WGM1_WGMXCC1_WGMXCCGn1
    SolutionIndex: 15
    SolutionNameMin: Cijk_Ailk_Bjlk_HSS_BH_UserArgs_MT256x128x32_MI16x16x1_SN_LDSB1_CLR1_GSU0_GSUC0_GSUWGMRR0_K1_LBSPPA2048_LBSPPB1024_LPA0_LPB16_MIWT8_4_PLR1_SU32_SUM0_SUS256_VWA8_VWB1_WGM1_WGMXCC1_WGMXCCGn1
    SolutionIndex: 16
    SolutionNameMin: Cijk_Ailk_Bjlk_HSS_BH_UserArgs_MT256x128x32_MI16x16x1_SN_LDSB1_CLR1_GSU0_GSUC0_GSUWGMRR0_K1_LBSPPA2048_LBSPPB1024_LPA0_LPB32_MIWT8_4_PLR1_SU32_SUM0_SUS256_VWA4_VWB2_WGM1_WGMXCC1_WGMXCCGn1
    SolutionIndex: 17
    SolutionNameMin: Cijk_Ailk_Bjlk_HSS_BH_UserArgs_MT256x128x32_MI16x16x1_SN_LDSB1_CLR1_GSU0_GSUC0_GSUWGMRR0_K1_LBSPPA2048_LBSPPB1024_LPA0_LPB0_MIWT8_4_PLR1_SU32_SUM0_SUS256_VWA4_VWB4_WGM1_WGMXCC1_WGMXCCGn1
    SolutionIndex: 18
    SolutionNameMin: Cijk_Ailk_Bjlk_HSS_BH_UserArgs_MT256x128x32_MI16x16x1_SN_LDSB1_CLR1_GSU0_GSUC0_GSUWGMRR0_K1_LBSPPA2048_LBSPPB1024_LPA0_LPB16_MIWT8_4_PLR1_SU32_SUM0_SUS256_VWA4_VWB1_WGM4_WGMXCC1_WGMXCCGn1
    SolutionIndex: 19
    SolutionNameMin: Cijk_Ailk_Bjlk_HSS_BH_UserArgs_MT256x128x32_MI16x16x1_SN_LDSB1_CLR1_GSU0_GSUC0_GSUWGMRR0_K1_LBSPPA2048_LBSPPB1024_LPA0_LPB32_MIWT8_4_PLR1_SU32_SUM0_SUS256_VWA4_VWB2_WGM4_WGMXCC1_WGMXCCGn1
    SolutionIndex: 20
    SolutionNameMin: Cijk_Ailk_Bjlk_HSS_BH_UserArgs_MT256x128x32_MI16x16x1_SN_LDSB1_CLR1_GSU0_GSUC0_GSUWGMRR0_K1_LBSPPA2048_LBSPPB1024_LPA0_LPB0_MIWT8_4_PLR1_SU32_SUM0_SUS256_VWA4_VWB4_WGM4_WGMXCC1_WGMXCCGn1
    SolutionIndex: 21
    SolutionNameMin: Cijk_Ailk_Bjlk_HSS_BH_UserArgs_MT256x128x32_MI16x16x1_SN_LDSB1_CLR1_GSU0_GSUC0_GSUWGMRR0_K1_LBSPPA2048_LBSPPB1024_LPA0_LPB32_MIWT8_4_PLR1_SU32_SUM0_SUS256_VWA4_VWB2_WGM8_WGMXCC1_WGMXCCGn1
    SolutionIndex: 22
    SolutionNameMin: Cijk_Ailk_Bjlk_HSS_BH_UserArgs_MT256x128x32_MI16x16x1_SN_LDSB1_CLR1_GSU0_GSUC0_GSUWGMRR0_K1_LBSPPA2048_LBSPPB1024_LPA0_LPB0_MIWT8_4_PLR1_SU32_SUM0_SUS256_VWA4_VWB4_WGM8_WGMXCC1_WGMXCCGn1
    SolutionIndex: 23
    SolutionNameMin: Cijk_Ailk_Bjlk_HSS_BH_UserArgs_MT256x64x32_MI16x16x1_SN_LDSB1_CLR1_GSU0_GSUC0_GSUWGMRR0_K1_LBSPPA2048_LBSPPB512_LPA0_LPB16_MIWT8_2_PLR1_SU32_SUM0_SUS256_VWA4_VWB1_WGM1_WGMXCC1_WGMXCCGn1
    SolutionIndex: 24
    SolutionNameMin: Cijk_Ailk_Bjlk_HSS_BH_UserArgs_MT256x64x32_MI16x16x1_SN_LDSB1_CLR1_GSU0_GSUC0_GSUWGMRR0_K1_LBSPPA2048_LBSPPB512_LPA0_LPB32_MIWT8_2_PLR1_SU32_SUM0_SUS256_VWA4_VWB2_WGM1_WGMXCC1_WGMXCCGn1
    SolutionIndex: 25
    SolutionNameMin: Cijk_Ailk_Bjlk_HSS_BH_UserArgs_MT256x64x32_MI16x16x1_SN_LDSB1_CLR1_GSU0_GSUC0_GSUWGMRR0_K1_LBSPPA2048_LBSPPB512_LPA0_LPB16_MIWT8_2_PLR1_SU32_SUM0_SUS256_VWA4_VWB1_WGM8_WGMXCC1_WGMXCCGn1
    SolutionIndex: 26
    SolutionNameMin: Cijk_Ailk_Bjlk_HSS_BH_UserArgs_MT128x128x32_MI16x16x1_SN_LDSB1_CLR1_GSU0_GSUC0_GSUWGMRR0_K1_LBSPPA1024_LBSPPB1024_LPA0_LPB32_MIWT4_4_PLR1_SU32_SUM0_SUS256_VWA4_VWB2_WGM1_WGMXCC1_WGMXCCGn1
    SolutionIndex: 27
    SolutionNameMin: Cijk_Ailk_Bjlk_HSS_BH_UserArgs_MT128x128x32_MI16x16x1_SN_LDSB1_CLR1_GSU0_GSUC0_GSUWGMRR0_K1_LBSPPA1024_LBSPPB1024_LPA16_LPB0_MIWT4_4_PLR1_SU32_SUM0_SUS256_VWA1_VWB4_WGM1_WGMXCC1_WGMXCCGn1
    SolutionIndex: 28
    SolutionNameMin: Cijk_Ailk_Bjlk_HSS_BH_UserArgs_MT128x128x32_MI16x16x1_SN_LDSB0_CLR0_GSU0_GSUC0_GSUWGMRR0_K1_LBSPPA1024_LBSPPB1024_LPA0_LPB0_MIWT4_4_PLR0_SU32_SUM0_SUS256_VWA4_VWB4_WGM1_WGMXCC1_WGMXCCGn1
    SolutionIndex: 29
    SolutionNameMin: Cijk_Ailk_Bjlk_HSS_BH_UserArgs_MT128x128x32_MI16x16x1_SN_LDSB1_CLR1_GSU0_GSUC0_GSUWGMRR0_K1_LBSPPA1024_LBSPPB1024_LPA16_LPB16_MIWT4_4_PLR1_SU32_SUM0_SUS256_VWA1_VWB1_WGM4_WGMXCC1_WGMXCCGn1
    SolutionIndex: 30
    SolutionNameMin: Cijk_Ailk_Bjlk_HSS_BH_UserArgs_MT128x128x32_MI16x16x1_SN_LDSB1_CLR1_GSU0_GSUC0_GSUWGMRR0_K1_LBSPPA1024_LBSPPB1024_LPA0_LPB16_MIWT4_4_PLR1_SU32_SUM0_SUS256_VWA4_VWB1_WGM4_WGMXCC1_WGMXCCGn1
    SolutionIndex: 31
    SolutionNameMin: Cijk_Ailk_Bjlk_HSS_BH_UserArgs_MT128x128x32_MI16x16x1_SN_LDSB1_CLR1_GSU0_GSUC0_GSUWGMRR0_K1_LBSPPA1024_LBSPPB1024_LPA16_LPB32_MIWT4_4_PLR1_SU32_SUM0_SUS256_VWA1_VWB2_WGM4_WGMXCC1_WGMXCCGn1
    SolutionIndex: 32
    SolutionNameMin: Cijk_Ailk_Bjlk_HSS_BH_UserArgs_MT128x128x32_MI16x16x1_SN_LDSB1_CLR1_GSU0_GSUC0_GSUWGMRR0_K1_LBSPPA1024_LBSPPB1024_LPA0_LPB32_MIWT4_4_PLR1_SU32_SUM0_SUS256_VWA4_VWB2_WGM4_WGMXCC1_WGMXCCGn1
    SolutionIndex: 33
    SolutionNameMin: Cijk_Ailk_Bjlk_HSS_BH_UserArgs_MT128x128x32_MI16x16x1_SN_LDSB1_CLR1_GSU0_GSUC0_GSUWGMRR0_K1_LBSPPA1024_LBSPPB1024_LPA16_LPB0_MIWT4_4_PLR1_SU32_SUM0_SUS256_VWA1_VWB4_WGM4_WGMXCC1_WGMXCCGn1
    SolutionIndex: 34
    SolutionNameMin: Cijk_Ailk_Bjlk_HSS_BH_UserArgs_MT128x128x32_MI16x16x1_SN_LDSB0_CLR1_GSU0_GSUC0_GSUWGMRR0_K1_LBSPPA1024_LBSPPB1024_LPA0_LPB0_MIWT4_4_PLR1_SU32_SUM0_SUS256_VWA4_VWB4_WGM4_WGMXCC1_WGMXCCGn1
    SolutionIndex: 35
    SolutionNameMin: Cijk_Ailk_Bjlk_HSS_BH_UserArgs_MT128x128x32_MI16x16x1_SN_LDSB0_CLR0_GSU0_GSUC0_GSUWGMRR0_K1_LBSPPA1024_LBSPPB1024_LPA0_LPB0_MIWT4_4_PLR0_SU32_SUM0_SUS256_VWA4_VWB4_WGM4_WGMXCC1_WGMXCCGn1
    SolutionIndex: 36
    SolutionNameMin: Cijk_Ailk_Bjlk_HSS_BH_UserArgs_MT128x128x32_MI16x16x1_SN_LDSB1_CLR1_GSU0_GSUC0_GSUWGMRR0_K1_LBSPPA1024_LBSPPB1024_LPA0_LPB32_MIWT4_4_PLR1_SU32_SUM0_SUS256_VWA4_VWB2_WGM8_WGMXCC1_WGMXCCGn1
    SolutionIndex: 37
    SolutionNameMin: Cijk_Ailk_Bjlk_HSS_BH_UserArgs_MT128x128x32_MI16x16x1_SN_LDSB0_CLR1_GSU0_GSUC0_GSUWGMRR0_K1_LBSPPA1024_LBSPPB1024_LPA0_LPB0_MIWT4_4_PLR1_SU32_SUM0_SUS256_VWA4_VWB4_WGM8_WGMXCC1_WGMXCCGn1
    SolutionIndex: 38
    SolutionNameMin: Cijk_Ailk_Bjlk_HSS_BH_UserArgs_MT64x128x32_MI16x16x1_SN_LDSB0_CLR1_GSU0_GSUC0_GSUWGMRR0_K1_LBSPPA512_LBSPPB1024_LPA16_LPB0_MIWT2_4_PLR1_SU32_SUM0_SUS256_VWA1_VWB4_WGM1_WGMXCC1_WGMXCCGn1
    SolutionIndex: 39
    SolutionNameMin: Cijk_Ailk_Bjlk_HSS_BH_UserArgs_MT128x64x32_MI16x16x1_SN_LDSB0_CLR1_GSU0_GSUC0_GSUWGMRR0_K1_LBSPPA1024_LBSPPB512_LPA0_LPB16_MIWT4_2_PLR1_SU32_SUM0_SUS256_VWA4_VWB1_WGM1_WGMXCC1_WGMXCCGn1
    SolutionIndex: 40
    SolutionNameMin: Cijk_Ailk_Bjlk_HSS_BH_UserArgs_MT128x64x32_MI16x16x1_SN_LDSB0_CLR1_GSU0_GSUC0_GSUWGMRR0_K1_LBSPPA1024_LBSPPB512_LPA0_LPB32_MIWT4_2_PLR1_SU32_SUM0_SUS256_VWA4_VWB2_WGM1_WGMXCC1_WGMXCCGn1
    SolutionIndex: 41
    SolutionNameMin: Cijk_Ailk_Bjlk_HSS_BH_UserArgs_MT128x64x32_MI16x16x1_SN_LDSB0_CLR0_GSU0_GSUC0_GSUWGMRR0_K1_LBSPPA1024_LBSPPB512_LPA32_LPB32_MIWT4_2_PLR0_SU32_SUM0_SUS256_VWA2_VWB2_WGM1_WGMXCC1_WGMXCCGn1
    SolutionIndex: 42
    SolutionNameMin: Cijk_Ailk_Bjlk_HSS_BH_UserArgs_MT128x64x32_MI16x16x1_SN_LDSB0_CLR1_GSU0_GSUC0_GSUWGMRR0_K1_LBSPPA1024_LBSPPB512_LPA0_LPB16_MIWT4_2_PLR1_SU32_SUM0_SUS256_VWA4_VWB1_WGM4_WGMXCC1_WGMXCCGn1
    SolutionIndex: 43
    SolutionNameMin: Cijk_Ailk_Bjlk_HSS_BH_UserArgs_MT128x32x32_MI16x16x1_SN_LDSB0_CLR1_GSU0_GSUC0_GSUWGMRR0_K1_LBSPPA1024_LBSPPB256_LPA0_LPB16_MIWT4_1_PLR1_SU32_SUM0_SUS256_VWA4_VWB1_WGM1_WGMXCC1_WGMXCCGn1
    SolutionIndex: 44
    SolutionNameMin: Cijk_Ailk_Bjlk_HSS_BH_UserArgs_MT64x64x32_MI16x16x1_SN_LDSB0_CLR1_GSU0_GSUC0_GSUWGMRR0_K1_LBSPPA512_LBSPPB512_LPA16_LPB32_MIWT2_2_PLR1_SU32_SUM0_SUS256_VWA1_VWB2_WGM1_WGMXCC1_WGMXCCGn1
    SolutionIndex: 45
    SolutionNameMin: Cijk_Ailk_Bjlk_HSS_BH_UserArgs_MT64x64x32_MI16x16x1_SN_LDSB0_CLR1_GSU0_GSUC0_GSUWGMRR0_K1_LBSPPA512_LBSPPB512_LPA32_LPB32_MIWT2_2_PLR1_SU32_SUM0_SUS256_VWA2_VWB2_WGM1_WGMXCC1_WGMXCCGn1
    SolutionIndex: 46
    SolutionNameMin: Cijk_Ailk_Bjlk_HSS_BH_UserArgs_MT64x64x32_MI16x16x1_SN_LDSB0_CLR1_GSU0_GSUC0_GSUWGMRR0_K1_LBSPPA512_LBSPPB512_LPA32_LPB32_MIWT2_2_PLR1_SU32_SUM0_SUS256_VWA2_VWB2_WGM8_WGMXCC1_WGMXCCGn1
    SolutionIndex: 47
    SolutionNameMin: Cijk_Ailk_Bjlk_HSS_BH_UserArgs_MT32x64x32_MI16x16x1_SN_LDSB0_CLR0_GSU0_GSUC0_GSUWGMRR0_K1_LBSPPA256_LBSPPB512_LPA16_LPB32_MIWT1_2_PLR0_SU32_SUM0_SUS256_VWA1_VWB2_WGM1_WGMXCC1_WGMXCCGn1
    SolutionIndex: 48
    SolutionNameMin: Cijk_Ailk_Bjlk_HSS_BH_UserArgs_MT32x32x32_MI16x16x1_SN_LDSB0_CLR1_GSU0_GSUC0_GSUWGMRR0_K1_LBSPPA256_LBSPPB256_LPA16_LPB16_MIWT1_1_PLR1_SU32_SUM0_SUS256_VWA1_VWB1_WGM1_WGMXCC1_WGMXCCGn1
    SolutionIndex: 49
    SolutionNameMin: Cijk_Ailk_Bjlk_HSS_BH_UserArgs_MT32x32x32_MI16x16x1_SN_LDSB0_CLR0_GSU0_GSUC0_GSUWGMRR0_K1_LBSPPA256_LBSPPB256_LPA16_LPB16_MIWT1_1_PLR0_SU32_SUM0_SUS256_VWA1_VWB1_WGM1_WGMXCC1_WGMXCCGn1
    SolutionIndex: 50
    SolutionNameMin: Cijk_Ailk_Bjlk_HSS_BH_UserArgs_MT256x256x64_MI16x16x1_SN_LDSB1_CLR1_GSU0_GSUC0_GSUWGMRR0_K1_LBSPPA2048_LBSPPB2048_LPA0_LPB0_MIWT8_8_PLR1_SU32_SUM0_SUS256_VWA4_VWB4_WGM1_WGMXCC1_WGMXCCGn1
    SolutionIndex: 51
    SolutionNameMin: Cijk_Ailk_Bjlk_HSS_BH_UserArgs_MT256x256x64_MI16x16x1_SN_LDSB1_CLR1_GSU0_GSUC0_GSUWGMRR0_K1_LBSPPA2048_LBSPPB2048_LPA0_LPB0_MIWT8_8_PLR2_SU32_SUM0_SUS256_VWA4_VWB4_WGM8_WGMXCC1_WGMXCCGn1
    SolutionIndex: 52
    SolutionNameMin: Cijk_Ailk_Bjlk_HSS_BH_UserArgs_MT256x128x64_MI16x16x1_SN_LDSB1_CLR1_GSU0_GSUC0_GSUWGMRR0_K1_LBSPPA2048_LBSPPB1024_LPA0_LPB32_MIWT8_4_PLR2_SU32_SUM0_SUS256_VWA4_VWB2_WGM8_WGMXCC1_WGMXCCGn1
    SolutionIndex: 53
    SolutionNameMin: Cijk_Ailk_Bjlk_HSS_BH_UserArgs_MT128x128x64_MI16x16x1_SN_LDSB1_CLR1_GSU0_GSUC0_GSUWGMRR0_K1_LBSPPA1024_LBSPPB1024_LPA0_LPB0_MIWT4_4_PLR1_SU32_SUM0_SUS256_VWA4_VWB4_WGM1_WGMXCC1_WGMXCCGn1
    SolutionIndex: 54
    SolutionNameMin: Cijk_Ailk_Bjlk_HSS_BH_UserArgs_MT128x128x64_MI16x16x1_SN_LDSB1_CLR1_GSU0_GSUC0_GSUWGMRR0_K1_LBSPPA1024_LBSPPB1024_LPA0_LPB0_MIWT4_4_PLR2_SU32_SUM0_SUS256_VWA4_VWB4_WGM1_WGMXCC1_WGMXCCGn1
    SolutionIndex: 55
    SolutionNameMin: Cijk_Ailk_Bjlk_HSS_BH_UserArgs_MT128x128x64_MI16x16x1_SN_LDSB1_CLR1_GSU0_GSUC0_GSUWGMRR0_K1_LBSPPA1024_LBSPPB1024_LPA0_LPB0_MIWT4_4_PLR1_SU32_SUM0_SUS256_VWA4_VWB4_WGM4_WGMXCC1_WGMXCCGn1
    SolutionIndex: 56
    SolutionNameMin: Cijk_Ailk_Bjlk_HSS_BH_UserArgs_MT128x128x64_MI16x16x1_SN_LDSB1_CLR1_GSU0_GSUC0_GSUWGMRR0_K1_LBSPPA1024_LBSPPB1024_LPA0_LPB0_MIWT4_4_PLR2_SU32_SUM0_SUS256_VWA4_VWB4_WGM4_WGMXCC1_WGMXCCGn1
    SolutionIndex: 57
    SolutionNameMin: Cijk_Ailk_Bjlk_HSS_BH_UserArgs_MT128x128x64_MI16x16x1_SN_LDSB1_CLR1_GSU0_GSUC0_GSUWGMRR0_K1_LBSPPA1024_LBSPPB1024_LPA0_LPB0_MIWT4_4_PLR1_SU32_SUM0_SUS256_VWA4_VWB4_WGM8_WGMXCC1_WGMXCCGn1
    SolutionIndex: 58
    SolutionNameMin: Cijk_Ailk_Bjlk_HSS_BH_UserArgs_MT128x128x64_MI16x16x1_SN_LDSB1_CLR1_GSU0_GSUC0_GSUWGMRR0_K1_LBSPPA1024_LBSPPB1024_LPA0_LPB0_MIWT4_4_PLR2_SU32_SUM0_SUS256_VWA4_VWB4_WGM8_WGMXCC1_WGMXCCGn1
    SolutionIndex: 59
    SolutionNameMin: Cijk_Ailk_Bjlk_HSS_BH_UserArgs_MT128x64x64_MI16x16x1_SN_LDSB1_CLR1_GSU0_GSUC0_GSUWGMRR0_K1_LBSPPA1024_LBSPPB512_LPA0_LPB32_MIWT4_2_PLR1_SU32_SUM0_SUS256_VWA4_VWB2_WGM1_WGMXCC1_WGMXCCGn1
    SolutionIndex: 60
    SolutionNameMin: Cijk_Ailk_Bjlk_HSS_BH_UserArgs_MT128x64x64_MI16x16x1_SN_LDSB1_CLR1_GSU0_GSUC0_GSUWGMRR0_K1_LBSPPA1024_LBSPPB512_LPA32_LPB16_MIWT4_2_PLR2_SU32_SUM0_SUS256_VWA2_VWB1_WGM1_WGMXCC1_WGMXCCGn1
    SolutionIndex: 61
    SolutionNameMin: Cijk_Ailk_Bjlk_HSS_BH_UserArgs_MT128x64x64_MI16x16x1_SN_LDSB1_CLR1_GSU0_GSUC0_GSUWGMRR0_K1_LBSPPA1024_LBSPPB512_LPA0_LPB16_MIWT4_2_PLR2_SU32_SUM0_SUS256_VWA4_VWB1_WGM1_WGMXCC1_WGMXCCGn1
    SolutionIndex: 62
    SolutionNameMin: Cijk_Ailk_Bjlk_HSS_BH_UserArgs_MT128x64x64_MI16x16x1_SN_LDSB1_CLR1_GSU0_GSUC0_GSUWGMRR0_K1_LBSPPA1024_LBSPPB512_LPA32_LPB32_MIWT4_2_PLR2_SU32_SUM0_SUS256_VWA2_VWB2_WGM1_WGMXCC1_WGMXCCGn1
    SolutionIndex: 63
    SolutionNameMin: Cijk_Ailk_Bjlk_HSS_BH_UserArgs_MT128x64x64_MI16x16x1_SN_LDSB1_CLR1_GSU0_GSUC0_GSUWGMRR0_K1_LBSPPA1024_LBSPPB512_LPA0_LPB32_MIWT4_2_PLR2_SU32_SUM0_SUS256_VWA4_VWB2_WGM1_WGMXCC1_WGMXCCGn1
    SolutionIndex: 64
    SolutionNameMin: Cijk_Ailk_Bjlk_HSS_BH_UserArgs_MT128x64x64_MI16x16x1_SN_LDSB1_CLR1_GSU0_GSUC0_GSUWGMRR0_K1_LBSPPA1024_LBSPPB512_LPA0_LPB16_MIWT4_2_PLR1_SU32_SUM0_SUS256_VWA4_VWB1_WGM4_WGMXCC1_WGMXCCGn1
    SolutionIndex: 65
    SolutionNameMin: Cijk_Ailk_Bjlk_HSS_BH_UserArgs_MT128x64x64_MI16x16x1_SN_LDSB1_CLR1_GSU0_GSUC0_GSUWGMRR0_K1_LBSPPA1024_LBSPPB512_LPA0_LPB32_MIWT4_2_PLR1_SU32_SUM0_SUS256_VWA4_VWB2_WGM4_WGMXCC1_WGMXCCGn1
    SolutionIndex: 66
    SolutionNameMin: Cijk_Ailk_Bjlk_HSS_BH_UserArgs_MT128x64x64_MI16x16x1_SN_LDSB1_CLR1_GSU0_GSUC0_GSUWGMRR0_K1_LBSPPA1024_LBSPPB512_LPA0_LPB16_MIWT4_2_PLR2_SU32_SUM0_SUS256_VWA4_VWB1_WGM4_WGMXCC1_WGMXCCGn1
    SolutionIndex: 67
    SolutionNameMin: Cijk_Ailk_Bjlk_HSS_BH_UserArgs_MT128x64x64_MI16x16x1_SN_LDSB1_CLR1_GSU0_GSUC0_GSUWGMRR0_K1_LBSPPA1024_LBSPPB512_LPA32_LPB32_MIWT4_2_PLR2_SU32_SUM0_SUS256_VWA2_VWB2_WGM4_WGMXCC1_WGMXCCGn1
    SolutionIndex: 68
    SolutionNameMin: Cijk_Ailk_Bjlk_HSS_BH_UserArgs_MT128x64x64_MI16x16x1_SN_LDSB1_CLR1_GSU0_GSUC0_GSUWGMRR0_K1_LBSPPA1024_LBSPPB512_LPA0_LPB32_MIWT4_2_PLR2_SU32_SUM0_SUS256_VWA4_VWB2_WGM4_WGMXCC1_WGMXCCGn1
    SolutionIndex: 69
    SolutionNameMin: Cijk_Ailk_Bjlk_HSS_BH_UserArgs_MT128x64x64_MI16x16x1_SN_LDSB1_CLR1_GSU0_GSUC0_GSUWGMRR0_K1_LBSPPA1024_LBSPPB512_LPA0_LPB32_MIWT4_2_PLR1_SU32_SUM0_SUS256_VWA4_VWB2_WGM8_WGMXCC1_WGMXCCGn1
    SolutionIndex: 70
    SolutionNameMin: Cijk_Ailk_Bjlk_HSS_BH_UserArgs_MT128x64x64_MI16x16x1_SN_LDSB1_CLR1_GSU0_GSUC0_GSUWGMRR0_K1_LBSPPA1024_LBSPPB512_LPA0_LPB16_MIWT4_2_PLR2_SU32_SUM0_SUS256_VWA4_VWB1_WGM8_WGMXCC1_WGMXCCGn1
    SolutionIndex: 71
    SolutionNameMin: Cijk_Ailk_Bjlk_HSS_BH_UserArgs_MT128x64x64_MI16x16x1_SN_LDSB1_CLR1_GSU0_GSUC0_GSUWGMRR0_K1_LBSPPA1024_LBSPPB512_LPA32_LPB32_MIWT4_2_PLR2_SU32_SUM0_SUS256_VWA2_VWB2_WGM8_WGMXCC1_WGMXCCGn1
    SolutionIndex: 72
    SolutionNameMin: Cijk_Ailk_Bjlk_HSS_BH_UserArgs_MT128x64x64_MI16x16x1_SN_LDSB1_CLR1_GSU0_GSUC0_GSUWGMRR0_K1_LBSPPA1024_LBSPPB512_LPA0_LPB32_MIWT4_2_PLR2_SU32_SUM0_SUS256_VWA4_VWB2_WGM8_WGMXCC1_WGMXCCGn1
    SolutionIndex: 73
    SolutionNameMin: Cijk_Ailk_Bjlk_HSS_BH_UserArgs_MT64x64x64_MI16x16x1_SN_LDSB1_CLR1_GSU0_GSUC0_GSUWGMRR0_K1_LBSPPA512_LBSPPB512_LPA32_LPB32_MIWT2_2_PLR1_SU32_SUM0_SUS256_VWA2_VWB2_WGM1_WGMXCC1_WGMXCCGn1
    SolutionIndex: 74
    SolutionNameMin: Cijk_Ailk_Bjlk_HSS_BH_UserArgs_MT64x64x64_MI16x16x1_SN_LDSB1_CLR1_GSU0_GSUC0_GSUWGMRR0_K1_LBSPPA512_LBSPPB512_LPA32_LPB32_MIWT2_2_PLR2_SU32_SUM0_SUS256_VWA2_VWB2_WGM1_WGMXCC1_WGMXCCGn1
    SolutionIndex: 75
    SolutionNameMin: Cijk_Ailk_Bjlk_HSS_BH_UserArgs_MT64x64x64_MI16x16x1_SN_LDSB1_CLR1_GSU0_GSUC0_GSUWGMRR0_K1_LBSPPA512_LBSPPB512_LPA32_LPB32_MIWT2_2_PLR1_SU32_SUM0_SUS256_VWA2_VWB2_WGM4_WGMXCC1_WGMXCCGn1
    SolutionIndex: 76
    SolutionNameMin: Cijk_Ailk_Bjlk_HSS_BH_UserArgs_MT64x64x64_MI16x16x1_SN_LDSB1_CLR1_GSU0_GSUC0_GSUWGMRR0_K1_LBSPPA512_LBSPPB512_LPA32_LPB32_MIWT2_2_PLR2_SU32_SUM0_SUS256_VWA2_VWB2_WGM4_WGMXCC1_WGMXCCGn1
    SolutionIndex: 77
    SolutionNameMin: Cijk_Ailk_Bjlk_HSS_BH_UserArgs_MT64x64x64_MI16x16x1_SN_LDSB1_CLR1_GSU0_GSUC0_GSUWGMRR0_K1_LBSPPA512_LBSPPB512_LPA32_LPB32_MIWT2_2_PLR1_SU32_SUM0_SUS256_VWA2_VWB2_WGM8_WGMXCC1_WGMXCCGn1
    SolutionIndex: 78
    SolutionNameMin: Cijk_Ailk_Bjlk_HSS_BH_UserArgs_MT64x64x64_MI16x16x1_SN_LDSB1_CLR1_GSU0_GSUC0_GSUWGMRR0_K1_LBSPPA512_LBSPPB512_LPA32_LPB32_MIWT2_2_PLR2_SU32_SUM0_SUS256_VWA2_VWB2_WGM8_WGMXCC1_WGMXCCGn1
    SolutionIndex: 79
    SolutionNameMin: Cijk_Ailk_Bjlk_HSS_BH_UserArgs_MT32x64x64_MI16x16x1_SN_LDSB0_CLR1_GSU0_GSUC0_GSUWGMRR0_K1_LBSPPA256_LBSPPB512_LPA16_LPB32_MIWT1_2_PLR2_SU32_SUM0_SUS256_VWA1_VWB2_WGM1_WGMXCC1_WGMXCCGn1
    SolutionIndex: 80
    SolutionNameMin: Cijk_Ailk_Bjlk_HSS_BH_UserArgs_MT32x64x64_MI16x16x1_SN_LDSB0_CLR1_GSU0_GSUC0_GSUWGMRR0_K1_LBSPPA256_LBSPPB512_LPA16_LPB32_MIWT1_2_PLR2_SU32_SUM0_SUS256_VWA1_VWB2_WGM4_WGMXCC1_WGMXCCGn1
    SolutionIndex: 81
    SolutionNameMin: Cijk_Ailk_Bjlk_HSS_BH_UserArgs_MT64x32x64_MI16x16x1_SN_LDSB0_CLR1_GSU0_GSUC0_GSUWGMRR0_K1_LBSPPA512_LBSPPB256_LPA32_LPB16_MIWT2_1_PLR2_SU32_SUM0_SUS256_VWA2_VWB1_WGM1_WGMXCC1_WGMXCCGn1
    SolutionIndex: 82
    SolutionNameMin: Cijk_Ailk_Bjlk_HSS_BH_UserArgs_MT128x128x128_MI16x16x1_SN_LDSB1_CLR1_GSU0_GSUC0_GSUWGMRR0_K1_LBSPPA1024_LBSPPB1024_LPA0_LPB0_MIWT4_4_PLR1_SU32_SUM0_SUS256_VWA4_VWB4_WGM1_WGMXCC1_WGMXCCGn1
    SolutionIndex: 83
    SolutionNameMin: Cijk_Ailk_Bjlk_HSS_BH_UserArgs_MT128x128x128_MI16x16x1_SN_LDSB1_CLR1_GSU0_GSUC0_GSUWGMRR0_K1_LBSPPA1024_LBSPPB1024_LPA0_LPB0_MIWT4_4_PLR1_SU32_SUM0_SUS256_VWA4_VWB4_WGM4_WGMXCC1_WGMXCCGn1
    SolutionIndex: 84
    SolutionNameMin: Cijk_Ailk_Bjlk_HSS_BH_UserArgs_MT128x128x128_MI16x16x1_SN_LDSB1_CLR1_GSU0_GSUC0_GSUWGMRR0_K1_LBSPPA1024_LBSPPB1024_LPA0_LPB0_MIWT4_4_PLR2_SU32_SUM0_SUS256_VWA4_VWB4_WGM4_WGMXCC1_WGMXCCGn1
    SolutionIndex: 85
    SolutionNameMin: Cijk_Ailk_Bjlk_HSS_BH_UserArgs_MT128x128x128_MI16x16x1_SN_LDSB1_CLR1_GSU0_GSUC0_GSUWGMRR0_K1_LBSPPA1024_LBSPPB1024_LPA0_LPB0_MIWT4_4_PLR1_SU32_SUM0_SUS256_VWA4_VWB4_WGM8_WGMXCC1_WGMXCCGn1
    SolutionIndex: 86
    SolutionNameMin: Cijk_Ailk_Bjlk_HSS_BH_UserArgs_MT128x128x128_MI16x16x1_SN_LDSB1_CLR1_GSU0_GSUC0_GSUWGMRR0_K1_LBSPPA1024_LBSPPB1024_LPA0_LPB0_MIWT4_4_PLR2_SU32_SUM0_SUS256_VWA4_VWB4_WGM8_WGMXCC1_WGMXCCGn1
    SolutionIndex: 87
    SolutionNameMin: Cijk_Ailk_Bjlk_HSS_BH_UserArgs_MT128x32x128_MI16x16x1_SN_LDSB1_CLR1_GSU0_GSUC0_GSUWGMRR0_K1_LBSPPA1024_LBSPPB256_LPA0_LPB16_MIWT4_1_PLR2_SU32_SUM0_SUS256_VWA4_VWB1_WGM1_WGMXCC1_WGMXCCGn1
    SolutionIndex: 88
    SolutionNameMin: Cijk_Ailk_Bjlk_HSS_BH_UserArgs_MT64x64x128_MI16x16x1_SN_LDSB1_CLR1_GSU0_GSUC0_GSUWGMRR0_K1_LBSPPA512_LBSPPB512_LPA16_LPB32_MIWT2_2_PLR2_SU32_SUM0_SUS256_VWA1_VWB2_WGM1_WGMXCC1_WGMXCCGn1
    SolutionIndex: 89
    SolutionNameMin: Cijk_Ailk_Bjlk_HSS_BH_UserArgs_MT64x64x128_MI16x16x1_SN_LDSB1_CLR1_GSU0_GSUC0_GSUWGMRR0_K1_LBSPPA512_LBSPPB512_LPA32_LPB32_MIWT2_2_PLR2_SU32_SUM0_SUS256_VWA2_VWB2_WGM1_WGMXCC1_WGMXCCGn1
    SolutionIndex: 90
    SolutionNameMin: Cijk_Ailk_Bjlk_HSS_BH_UserArgs_MT64x64x128_MI16x16x1_SN_LDSB1_CLR1_GSU0_GSUC0_GSUWGMRR0_K1_LBSPPA512_LBSPPB512_LPA32_LPB16_MIWT2_2_PLR2_SU32_SUM0_SUS256_VWA2_VWB1_WGM8_WGMXCC1_WGMXCCGn1
    SolutionIndex: 91
    SolutionNameMin: Cijk_Ailk_Bjlk_HSS_BH_UserArgs_MT64x64x128_MI16x16x1_SN_LDSB1_CLR1_GSU0_GSUC0_GSUWGMRR0_K1_LBSPPA512_LBSPPB512_LPA32_LPB32_MIWT2_2_PLR2_SU32_SUM0_SUS256_VWA2_VWB2_WGM8_WGMXCC1_WGMXCCGn1
    SolutionIndex: 92
    SolutionNameMin: Cijk_Ailk_Bjlk_HSS_BH_UserArgs_MT32x64x128_MI16x16x1_SN_LDSB1_CLR1_GSU0_GSUC0_GSUWGMRR0_K1_LBSPPA256_LBSPPB512_LPA16_LPB16_MIWT1_2_PLR1_SU32_SUM0_SUS256_VWA1_VWB1_WGM1_WGMXCC1_WGMXCCGn1
    SolutionIndex: 93
    SolutionNameMin: Cijk_Ailk_Bjlk_HSS_BH_UserArgs_MT32x64x128_MI16x16x1_SN_LDSB1_CLR1_GSU0_GSUC0_GSUWGMRR0_K1_LBSPPA256_LBSPPB512_LPA16_LPB32_MIWT1_2_PLR1_SU32_SUM0_SUS256_VWA1_VWB2_WGM1_WGMXCC1_WGMXCCGn1
    SolutionIndex: 94
    SolutionNameMin: Cijk_Ailk_Bjlk_HSS_BH_UserArgs_MT32x64x128_MI16x16x1_SN_LDSB1_CLR1_GSU0_GSUC0_GSUWGMRR0_K1_LBSPPA256_LBSPPB512_LPA16_LPB32_MIWT1_2_PLR2_SU32_SUM0_SUS256_VWA1_VWB2_WGM1_WGMXCC1_WGMXCCGn1
    SolutionIndex: 95
    SolutionNameMin: Cijk_Ailk_Bjlk_HSS_BH_UserArgs_MT64x32x128_MI16x16x1_SN_LDSB1_CLR1_GSU0_GSUC0_GSUWGMRR0_K1_LBSPPA512_LBSPPB256_LPA16_LPB16_MIWT2_1_PLR1_SU32_SUM0_SUS256_VWA1_VWB1_WGM1_WGMXCC1_WGMXCCGn1
    SolutionIndex: 96
    SolutionNameMin: Cijk_Ailk_Bjlk_HSS_BH_UserArgs_MT64x32x128_MI16x16x1_SN_LDSB1_CLR1_GSU0_GSUC0_GSUWGMRR0_K1_LBSPPA512_LBSPPB256_LPA32_LPB16_MIWT2_1_PLR1_SU32_SUM0_SUS256_VWA2_VWB1_WGM1_WGMXCC1_WGMXCCGn1
    SolutionIndex: 97
    SolutionNameMin: Cijk_Ailk_Bjlk_HSS_BH_UserArgs_MT64x32x128_MI16x16x1_SN_LDSB1_CLR1_GSU0_GSUC0_GSUWGMRR0_K1_LBSPPA512_LBSPPB256_LPA32_LPB16_MIWT2_1_PLR2_SU32_SUM0_SUS256_VWA2_VWB1_WGM1_WGMXCC1_WGMXCCGn1
    SolutionIndex: 98
    SolutionNameMin: Cijk_Ailk_Bjlk_HSS_BH_UserArgs_MT64x32x128_MI16x16x1_SN_LDSB1_CLR1_GSU0_GSUC0_GSUWGMRR0_K1_LBSPPA512_LBSPPB256_LPA32_LPB16_MIWT2_1_PLR2_SU32_SUM0_SUS256_VWA2_VWB1_WGM4_WGMXCC1_WGMXCCGn1
    SolutionIndex: 99
    SolutionNameMin: Cijk_Ailk_Bjlk_HSS_BH_UserArgs_MT32x32x128_MI16x16x1_SN_LDSB1_CLR1_GSU0_GSUC0_GSUWGMRR0_K1_LBSPPA256_LBSPPB256_LPA16_LPB16_MIWT1_1_PLR1_SU32_SUM0_SUS256_VWA1_VWB1_WGM1_WGMXCC1_WGMXCCGn1
    SolutionIndex: 100
    SolutionNameMin: Cijk_Ailk_Bjlk_HSS_BH_UserArgs_MT32x32x128_MI16x16x1_SN_LDSB1_CLR1_GSU0_GSUC0_GSUWGMRR0_K1_LBSPPA256_LBSPPB256_LPA16_LPB16_MIWT1_1_PLR2_SU32_SUM0_SUS256_VWA1_VWB1_WGM1_WGMXCC1_WGMXCCGn1
    SolutionIndex: 101
    SolutionNameMin: Cijk_Ailk_Bjlk_HSS_BH_UserArgs_MT32x32x128_MI16x16x1_SN_LDSB1_CLR1_GSU0_GSUC0_GSUWGMRR0_K1_LBSPPA256_LBSPPB256_LPA16_LPB16_MIWT1_1_PLR1_SU32_SUM0_SUS256_VWA1_VWB1_WGM4_WGMXCC1_WGMXCCGn1
    SolutionIndex: 102
    SolutionNameMin: Cijk_Ailk_Bjlk_HSS_BH_UserArgs_MT32x32x128_MI16x16x1_SN_LDSB1_CLR1_GSU0_GSUC0_GSUWGMRR0_K1_LBSPPA256_LBSPPB256_LPA16_LPB16_MIWT1_1_PLR2_SU32_SUM0_SUS256_VWA1_VWB1_WGM4_WGMXCC1_WGMXCCGn1
    SolutionIndex: 103
    SolutionNameMin: Cijk_Ailk_Bjlk_HSS_BH_UserArgs_MT32x32x128_MI16x16x1_SN_LDSB1_CLR1_GSU0_GSUC0_GSUWGMRR0_K1_LBSPPA256_LBSPPB256_LPA16_LPB16_MIWT1_1_PLR1_SU32_SUM0_SUS256_VWA1_VWB1_WGM8_WGMXCC1_WGMXCCGn1
    SolutionIndex: 104
    SolutionNameMin: Cijk_Ailk_Bjlk_HSS_BH_UserArgs_MT32x32x32_MI16x16x1_SN_LDSB0_CLR1_GSU0_GSUC0_GSUWGMRR0_K1_LBSPPA256_LBSPPB256_LPA16_LPB16_MIWT1_1_PLR1_SU32_SUM0_SUS256_VWA1_VWB1_WGM8_WGMXCC1_WGMXCCGn1
- - - [128, 128, 1, 128, 128, 128, 128, 128]
    - [103, 0.074]
  - - [128, 128, 1, 256, 128, 128, 128, 128]
    - [88, 0.09]
  - - [128, 128, 1, 512, 128, 128, 128, 128]
    - [101, 0.156]
  - - [128, 128, 1, 1024, 128, 128, 128, 128]
    - [100, 0.272]
  - - [128, 128, 1, 2048, 128, 128, 128, 128]
    - [48, 0.478]
  - - [128, 128, 1, 4096, 128, 128, 128, 128]
    - [93, 0.708]
  - - [128, 128, 1, 8192, 128, 128, 128, 128]
    - [97, 1.106]
  - - [128, 256, 1, 128, 128, 128, 128, 256]
    - [94, 0.15]
  - - [128, 256, 1, 256, 128, 128, 128, 256]
    - [100, 0.216]
  - - [128, 256, 1, 512, 128, 128, 128, 256]
    - [95, 0.294]
  - - [128, 256, 1, 1024, 128, 128, 128, 256]
    - [101, 0.489]
  - - [128, 256, 1, 2048, 128, 128, 128, 256]
    - [47, 0.805]
  - - [128, 256, 1, 4096, 128, 128, 128, 256]
    - [79, 1.232]
  - - [128, 256, 1, 8192, 128, 128, 128, 256]
    - [76, 1.804]
  - - [128, 512, 1, 128, 128, 128, 128, 512]
    - [92, 0.279]
  - - [128, 512, 1, 256, 128, 128, 128, 512]
    - [48, 0.461]
  - - [128, 512, 1, 512, 128, 128, 128, 512]
    - [100, 0.656]
  - - [128, 512, 1, 1024, 128, 128, 128, 512]
    - [97, 0.923]
  - - [128, 512, 1, 2048, 128, 128, 128, 512]
    - [46, 1.349]
  - - [128, 512, 1, 4096, 128, 128, 128, 512]
    - [74, 2.179]
  - - [128, 512, 1, 8192, 128, 128, 128, 512]
    - [40, 2.725]
  - - [128, 1024, 1, 128, 128, 128, 128, 1024]
    - [91, 0.503]
  - - [128, 1024, 1, 256, 128, 128, 128, 1024]
    - [97, 0.804]
  - - [128, 1024, 1, 512, 128, 128, 128, 1024]
    - [94, 1.229]
  - - [128, 1024, 1, 1024, 128, 128, 128, 1024]
    - [94, 1.669]
  - - [128, 1024, 1, 2048, 128, 128, 128, 1024]
    - [42, 2.251]
  - - [128, 1024, 1, 4096, 128, 128, 128, 1024]
    - [70, 3.108]
  - - [128, 1024, 1, 8192, 128, 128, 128, 1024]
    - [35, 3.788]
  - - [128, 2048, 1, 128, 128, 128, 128, 2048]
    - [43, 0.861]
  - - [128, 2048, 1, 256, 128, 128, 128, 2048]
    - [73, 1.442]
  - - [128, 2048, 1, 512, 128, 128, 128, 2048]
    - [78, 1.947]
  - - [128, 2048, 1, 1024, 128, 128, 128, 2048]
    - [71, 2.278]
  - - [128, 2048, 1, 2048, 128, 128, 128, 2048]
    - [34, 3.18]
  - - [128, 2048, 1, 4096, 128, 128, 128, 2048]
    - [59, 3.435]
  - - [128, 2048, 1, 8192, 128, 128, 128, 2048]
    - [57, 4.901]
  - - [128, 4096, 1, 128, 128, 128, 128, 4096]
    - [61, 1.197]
  - - [128, 4096, 1, 256, 128, 128, 128, 4096]
    - [63, 2.088]
  - - [128, 4096, 1, 512, 128, 128, 128, 4096]
    - [69, 2.868]
  - - [128, 4096, 1, 1024, 128, 128, 128, 4096]
    - [57, 3.159]
  - - [128, 4096, 1, 2048, 128, 128, 128, 4096]
    - [83, 3.588]
  - - [128, 4096, 1, 4096, 128, 128, 128, 4096]
    - [57, 4.812]
  - - [128, 4096, 1, 8192, 128, 128, 128, 4096]
    - [55, 6.133]
  - - [128, 8192, 1, 128, 128, 128, 128, 8192]
    - [30, 1.666]
  - - [128, 8192, 1, 256, 128, 128, 128, 8192]
    - [33, 2.733]
  - - [128, 8192, 1, 512, 128, 128, 128, 8192]
    - [53, 3.942]
  - - [128, 8192, 1, 1024, 128, 128, 128, 8192]
    - [85, 4.312]
  - - [128, 8192, 1, 2048, 128, 128, 128, 8192]
    - [54, 4.854]
  - - [128, 8192, 1, 4096, 128, 128, 128, 8192]
    - [55, 6.292]
  - - [128, 8192, 1, 8192, 128, 128, 128, 8192]
    - [26, 6.77]
  - - [256, 128, 1, 128, 256, 256, 256, 128]
    - [94, 0.169]
  - - [256, 128, 1, 256, 256, 256, 256, 128]
    - [102, 0.21]
  - - [256, 128, 1, 512, 256, 256, 256, 128]
    - [48, 0.302]
  - - [256, 128, 1, 1024, 256, 256, 256, 128]
    - [100, 0.514]
  - - [256, 128, 1, 2048, 256, 256, 256, 128]
    - [94, 0.808]
  - - [256, 128, 1, 4096, 256, 256, 256, 128]
    - [80, 1.23]
  - - [256, 128, 1, 8192, 256, 256, 256, 128]
    - [75, 1.805]
  - - [256, 256, 1, 128, 256, 256, 256, 256]
    - [49, 0.28]
  - - [256, 256, 1, 256, 256, 256, 256, 256]
    - [99, 0.433]
  - - [256, 256, 1, 512, 256, 256, 256, 256]
    - [100, 0.654]
  - - [256, 256, 1, 1024, 256, 256, 256, 256]
    - [93, 0.951]
  - - [256, 256, 1, 2048, 256, 256, 256, 256]
    - [45, 1.414]
  - - [256, 256, 1, 4096, 256, 256, 256, 256]
    - [74, 2.171]
  - - [256, 256, 1, 8192, 256, 256, 256, 256]
    - [40, 2.681]
  - - [256, 512, 1, 128, 256, 256, 256, 512]
    - [90, 0.52]
  - - [256, 512, 1, 256, 256, 256, 256, 512]
    - [79, 0.842]
  - - [256, 512, 1, 512, 256, 256, 256, 512]
    - [79, 1.262]
  - - [256, 512, 1, 1024, 256, 256, 256, 512]
    - [97, 1.661]
  - - [256, 512, 1, 2048, 256, 256, 256, 512]
    - [38, 2.131]
  - - [256, 512, 1, 4096, 256, 256, 256, 512]
    - [61, 3.214]
  - - [256, 512, 1, 8192, 256, 256, 256, 512]
    - [37, 3.91]
  - - [256, 1024, 1, 128, 256, 256, 256, 1024]
    - [77, 0.894]
  - - [256, 1024, 1, 256, 256, 256, 256, 1024]
    - [46, 1.397]
  - - [256, 1024, 1, 512, 256, 256, 256, 1024]
    - [73, 2.089]
  - - [256, 1024, 1, 1024, 256, 256, 256, 1024]
    - [66, 2.368]
  - - [256, 1024, 1, 2048, 256, 256, 256, 1024]
    - [37, 3.288]
  - - [256, 1024, 1, 4096, 256, 256, 256, 1024]
    - [36, 3.825]
  - - [256, 1024, 1, 8192, 256, 256, 256, 1024]
    - [7, 4.707]
  - - [256, 2048, 1, 128, 256, 256, 256, 2048]
    - [61, 1.266]
  - - [256, 2048, 1, 256, 256, 256, 256, 2048]
    - [67, 2.141]
  - - [256, 2048, 1, 512, 256, 256, 256, 2048]
    - [59, 3.007]
  - - [256, 2048, 1, 1024, 256, 256, 256, 2048]
    - [53, 3.325]
  - - [256, 2048, 1, 2048, 256, 256, 256, 2048]
    - [57, 4.149]
  - - [256, 2048, 1, 4096, 256, 256, 256, 2048]
    - [56, 4.88]
  - - [256, 2048, 1, 8192, 256, 256, 256, 2048]
    - [20, 5.639]
  - - [256, 4096, 1, 128, 256, 256, 256, 4096]
    - [30, 1.66]
  - - [256, 4096, 1, 256, 256, 256, 256, 4096]
    - [55, 2.751]
  - - [256, 4096, 1, 512, 256, 256, 256, 4096]
    - [58, 3.846]
  - - [256, 4096, 1, 1024, 256, 256, 256, 4096]
    - [84, 4.34]
  - - [256, 4096, 1, 2048, 256, 256, 256, 4096]
    - [26, 4.819]
  - - [256, 4096, 1, 4096, 256, 256, 256, 4096]
    - [54, 6.19]
  - - [256, 4096, 1, 8192, 256, 256, 256, 4096]
    - [17, 6.496]
  - - [256, 8192, 1, 128, 256, 256, 256, 8192]
    - [10, 2.118]
  - - [256, 8192, 1, 256, 256, 256, 256, 8192]
    - [16, 3.382]
  - - [256, 8192, 1, 512, 256, 256, 256, 8192]
    - [53, 4.521]
  - - [256, 8192, 1, 1024, 256, 256, 256, 8192]
    - [65, 4.923]
  - - [256, 8192, 1, 2048, 256, 256, 256, 8192]
    - [54, 6.487]
  - - [256, 8192, 1, 4096, 256, 256, 256, 8192]
    - [54, 6.683]
  - - [256, 8192, 1, 8192, 256, 256, 256, 8192]
    - [16, 7.957]
  - - [512, 128, 1, 128, 512, 512, 512, 128]
    - [96, 0.288]
  - - [512, 128, 1, 256, 512, 512, 512, 128]
    - [48, 0.442]
  - - [512, 128, 1, 512, 512, 512, 512, 128]
    - [99, 0.686]
  - - [512, 128, 1, 1024, 512, 512, 512, 128]
    - [98, 0.924]
  - - [512, 128, 1, 2048, 512, 512, 512, 128]
    - [44, 1.357]
  - - [512, 128, 1, 4096, 512, 512, 512, 128]
    - [75, 2.127]
  - - [512, 128, 1, 8192, 512, 512, 512, 128]
    - [40, 2.862]
  - - [512, 256, 1, 128, 512, 512, 512, 256]
    - [87, 0.498]
  - - [512, 256, 1, 256, 512, 512, 512, 256]
    - [93, 0.826]
  - - [512, 256, 1, 512, 512, 512, 512, 256]
    - [79, 1.287]
  - - [512, 256, 1, 1024, 512, 512, 512, 256]
    - [96, 1.666]
  - - [512, 256, 1, 2048, 512, 512, 512, 256]
    - [40, 2.336]
  - - [512, 256, 1, 4096, 512, 512, 512, 256]
    - [59, 3.294]
  - - [512, 256, 1, 8192, 512, 512, 512, 256]
    - [35, 3.89]
  - - [512, 512, 1, 128, 512, 512, 512, 512]
    - [77, 0.938]
  - - [512, 512, 1, 256, 512, 512, 512, 512]
    - [77, 1.485]
  - - [512, 512, 1, 512, 512, 512, 512, 512]
    - [77, 2.1]
  - - [512, 512, 1, 1024, 512, 512, 512, 512]
    - [61, 2.431]
  - - [512, 512, 1, 2048, 512, 512, 512, 512]
    - [35, 3.283]
  - - [512, 512, 1, 4096, 512, 512, 512, 512]
    - [55, 4.865]
  - - [512, 512, 1, 8192, 512, 512, 512, 512]
    - [16, 4.859]
  - - [512, 1024, 1, 128, 512, 512, 512, 1024]
    - [60, 1.284]
  - - [512, 1024, 1, 256, 512, 512, 512, 1024]
    - [67, 2.133]
  - - [512, 1024, 1, 512, 512, 512, 512, 1024]
    - [64, 2.931]
  - - [512, 1024, 1, 1024, 512, 512, 512, 1024]
    - [57, 3.389]
  - - [512, 1024, 1, 2048, 512, 512, 512, 1024]
    - [6, 4.176]
  - - [512, 1024, 1, 4096, 512, 512, 512, 1024]
    - [58, 5.069]
  - - [512, 1024, 1, 8192, 512, 512, 512, 1024]
    - [53, 5.981]
  - - [512, 2048, 1, 128, 512, 512, 512, 2048]
    - [23, 1.618]
  - - [512, 2048, 1, 256, 512, 512, 512, 2048]
    - [57, 2.856]
  - - [512, 2048, 1, 512, 512, 512, 512, 2048]
    - [56, 3.989]
  - - [512, 2048, 1, 1024, 512, 512, 512, 2048]
    - [85, 4.379]
  - - [512, 2048, 1, 2048, 512, 512, 512, 2048]
    - [17, 4.659]
  - - [512, 2048, 1, 4096, 512, 512, 512, 2048]
    - [53, 6.345]
  - - [512, 2048, 1, 8192, 512, 512, 512, 2048]
    - [19, 6.461]
  - - [512, 4096, 1, 128, 512, 512, 512, 4096]
    - [12, 2.129]
  - - [512, 4096, 1, 256, 512, 512, 512, 4096]
    - [9, 3.436]
  - - [512, 4096, 1, 512, 512, 512, 512, 4096]
    - [53, 4.606]
  - - [512, 4096, 1, 1024, 512, 512, 512, 4096]
    - [53, 4.925]
  - - [512, 4096, 1, 2048, 512, 512, 512, 4096]
    - [54, 6.484]
  - - [512, 4096, 1, 4096, 512, 512, 512, 4096]
    - [17, 6.673]
  - - [512, 4096, 1, 8192, 512, 512, 512, 4096]
    - [22, 7.891]
  - - [512, 8192, 1, 128, 512, 512, 512, 8192]
    - [32, 2.472]
  - - [512, 8192, 1, 256, 512, 512, 512, 8192]
    - [33, 4.078]
  - - [512, 8192, 1, 512, 512, 512, 512, 8192]
    - [36, 5.709]
  - - [512, 8192, 1, 1024, 512, 512, 512, 8192]
    - [55, 7.094]
  - - [512, 8192, 1, 2048, 512, 512, 512, 8192]
    - [56, 7.133]
  - - [512, 8192, 1, 4096, 512, 512, 512, 8192]
    - [18, 7.454]
  - - [512, 8192, 1, 8192, 512, 512, 512, 8192]
    - [0, 7.089]
  - - [1024, 128, 1, 128, 1024, 1024, 1024, 128]
    - [89, 0.544]
  - - [1024, 128, 1, 256, 1024, 1024, 1024, 128]
    - [96, 0.872]
  - - [1024, 128, 1, 512, 1024, 1024, 1024, 128]
    - [81, 1.288]
  - - [1024, 128, 1, 1024, 1024, 1024, 1024, 128]
    - [97, 1.688]
  - - [1024, 128, 1, 2048, 1024, 1024, 1024, 128]
    - [39, 2.286]
  - - [1024, 128, 1, 4096, 1024, 1024, 1024, 128]
    - [72, 3.26]
  - - [1024, 128, 1, 8192, 1024, 1024, 1024, 128]
    - [34, 3.778]
  - - [1024, 256, 1, 128, 1024, 1024, 1024, 256]
    - [77, 0.935]
  - - [1024, 256, 1, 256, 1024, 1024, 1024, 256]
    - [75, 1.505]
  - - [1024, 256, 1, 512, 1024, 1024, 1024, 256]
    - [74, 2.16]
  - - [1024, 256, 1, 1024, 1024, 1024, 1024, 256]
    - [65, 2.467]
  - - [1024, 256, 1, 2048, 1024, 1024, 1024, 256]
    - [28, 3.365]
  - - [1024, 256, 1, 4096, 1024, 1024, 1024, 256]
    - [53, 4.829]
  - - [1024, 256, 1, 8192, 1024, 1024, 1024, 256]
    - [4, 4.863]
  - - [1024, 512, 1, 128, 1024, 1024, 1024, 512]
    - [62, 1.315]
  - - [1024, 512, 1, 256, 1024, 1024, 1024, 512]
    - [68, 2.198]
  - - [1024, 512, 1, 512, 1024, 1024, 1024, 512]
    - [59, 3.022]
  - - [1024, 512, 1, 1024, 1024, 1024, 1024, 512]
    - [56, 3.24]
  - - [1024, 512, 1, 2048, 1024, 1024, 1024, 512]
    - [57, 4.23]
  - - [1024, 512, 1, 4096, 1024, 1024, 1024, 512]
    - [55, 5.369]
  - - [1024, 512, 1, 8192, 1024, 1024, 1024, 512]
    - [55, 5.891]
  - - [1024, 1024, 1, 128, 1024, 1024, 1024, 1024]
    - [26, 1.744]
  - - [1024, 1024, 1, 256, 1024, 1024, 1024, 1024]
    - [53, 2.887]
  - - [1024, 1024, 1, 512, 1024, 1024, 1024, 1024]
    - [53, 4.136]
  - - [1024, 1024, 1, 1024, 1024, 1024, 1024, 1024]
    - [82, 4.45]
  - - [1024, 1024, 1, 2048, 1024, 1024, 1024, 1024]
    - [57, 4.897]
  - - [1024, 1024, 1, 4096, 1024, 1024, 1024, 1024]
    - [56, 6.163]
  - - [1024, 1024, 1, 8192, 1024, 1024, 1024, 1024]
    - [19, 6.426]
  - - [1024, 2048, 1, 128, 1024, 1024, 1024, 2048]
    - [6, 2.171]
  - - [1024, 2048, 1, 256, 1024, 1024, 1024, 2048]
    - [8, 3.484]
  - - [1024, 2048, 1, 512, 1024, 1024, 1024, 2048]
    - [55, 4.596]
  - - [1024, 2048, 1, 1024, 1024, 1024, 1024, 2048]
    - [63, 5.049]
  - - [1024, 2048, 1, 2048, 1024, 1024, 1024, 2048]
    - [53, 6.558]
  - - [1024, 2048, 1, 4096, 1024, 1024, 1024, 2048]
    - [21, 6.221]
  - - [1024, 2048, 1, 8192, 1024, 1024, 1024, 2048]
    - [52, 6.149]
  - - [1024, 4096, 1, 128, 1024, 1024, 1024, 4096]
    - [27, 2.437]
  - - [1024, 4096, 1, 256, 1024, 1024, 1024, 4096]
    - [31, 3.926]
  - - [1024, 4096, 1, 512, 1024, 1024, 1024, 4096]
    - [32, 5.757]
  - - [1024, 4096, 1, 1024, 1024, 1024, 1024, 4096]
    - [55, 7.01]
  - - [1024, 4096, 1, 2048, 1024, 1024, 1024, 4096]
    - [53, 7.737]
  - - [1024, 4096, 1, 4096, 1024, 1024, 1024, 4096]
    - [8, 7.454]
  - - [1024, 4096, 1, 8192, 1024, 1024, 1024, 4096]
    - [17, 8.064]
  - - [1024, 8192, 1, 128, 1024, 1024, 1024, 8192]
    - [16, 2.66]
  - - [1024, 8192, 1, 256, 1024, 1024, 1024, 8192]
    - [16, 4.514]
  - - [1024, 8192, 1, 512, 1024, 1024, 1024, 8192]
    - [4, 6.289]
  - - [1024, 8192, 1, 1024, 1024, 1024, 1024, 8192]
    - [16, 7.629]
  - - [1024, 8192, 1, 2048, 1024, 1024, 1024, 8192]
    - [9, 7.477]
  - - [1024, 8192, 1, 4096, 1024, 1024, 1024, 8192]
    - [17, 7.923]
  - - [1024, 8192, 1, 8192, 1024, 1024, 1024, 8192]
    - [22, 8.27]
  - - [2048, 128, 1, 128, 2048, 2048, 2048, 128]
    - [73, 0.933]
  - - [2048, 128, 1, 256, 2048, 2048, 2048, 128]
    - [73, 1.563]
  - - [2048, 128, 1, 512, 2048, 2048, 2048, 128]
    - [74, 2.066]
  - - [2048, 128, 1, 1024, 2048, 2048, 2048, 128]
    - [64, 2.486]
  - - [2048, 128, 1, 2048, 2048, 2048, 2048, 128]
    - [28, 3.293]
  - - [2048, 128, 1, 4096, 2048, 2048, 2048, 128]
    - [55, 4.638]
  - - [2048, 128, 1, 8192, 2048, 2048, 2048, 128]
    - [22, 4.79]
  - - [2048, 256, 1, 128, 2048, 2048, 2048, 256]
    - [62, 1.307]
  - - [2048, 256, 1, 256, 2048, 2048, 2048, 256]
    - [63, 2.194]
  - - [2048, 256, 1, 512, 2048, 2048, 2048, 256]
    - [59, 3.025]
  - - [2048, 256, 1, 1024, 2048, 2048, 2048, 256]
    - [54, 3.449]
  - - [2048, 256, 1, 2048, 2048, 2048, 2048, 256]
    - [55, 4.232]
  - - [2048, 256, 1, 4096, 2048, 2048, 2048, 256]
    - [55, 5.314]
  - - [2048, 256, 1, 8192, 2048, 2048, 2048, 256]
    - [57, 5.877]
  - - [2048, 512, 1, 128, 2048, 2048, 2048, 512]
    - [26, 1.744]
  - - [2048, 512, 1, 256, 2048, 2048, 2048, 512]
    - [55, 2.916]
  - - [2048, 512, 1, 512, 2048, 2048, 2048, 512]
    - [53, 4.077]
  - - [2048, 512, 1, 1024, 2048, 2048, 2048, 512]
    - [82, 4.513]
  - - [2048, 512, 1, 2048, 2048, 2048, 2048, 512]
    - [55, 4.927]
  - - [2048, 512, 1, 4096, 2048, 2048, 2048, 512]
    - [56, 6.228]
  - - [2048, 512, 1, 8192, 2048, 2048, 2048, 512]
    - [2, 6.472]
  - - [2048, 1024, 1, 128, 2048, 2048, 2048, 1024]
    - [22, 2.144]
  - - [2048, 1024, 1, 256, 2048, 2048, 2048, 1024]
    - [8, 3.486]
  - - [2048, 1024, 1, 512, 2048, 2048, 2048, 1024]
    - [57, 4.476]
  - - [2048, 1024, 1, 1024, 2048, 2048, 2048, 1024]
    - [36, 5.034]
  - - [2048, 1024, 1, 2048, 2048, 2048, 2048, 1024]
    - [57, 6.61]
  - - [2048, 1024, 1, 4096, 2048, 2048, 2048, 1024]
    - [4, 6.348]
  - - [2048, 1024, 1, 8192, 2048, 2048, 2048, 1024]
    - [12, 7.567]
  - - [2048, 2048, 1, 128, 2048, 2048, 2048, 2048]
    - [24, 2.547]
  - - [2048, 2048, 1, 256, 2048, 2048, 2048, 2048]
    - [26, 4.177]
  - - [2048, 2048, 1, 512, 2048, 2048, 2048, 2048]
    - [26, 5.838]
  - - [2048, 2048, 1, 1024, 2048, 2048, 2048, 2048]
    - [53, 6.965]
  - - [2048, 2048, 1, 2048, 2048, 2048, 2048, 2048]
    - [56, 7.413]
  - - [2048, 2048, 1, 4096, 2048, 2048, 2048, 2048]
    - [22, 7.428]
  - - [2048, 2048, 1, 8192, 2048, 2048, 2048, 2048]
    - [22, 7.743]
  - - [2048, 4096, 1, 128, 2048, 2048, 2048, 4096]
    - [14, 2.686]
  - - [2048, 4096, 1, 256, 2048, 2048, 2048, 4096]
    - [14, 4.443]
  - - [2048, 4096, 1, 512, 2048, 2048, 2048, 4096]
    - [4, 6.179]
  - - [2048, 4096, 1, 1024, 2048, 2048, 2048, 4096]
    - [11, 7.293]
  - - [2048, 4096, 1, 2048, 2048, 2048, 2048, 4096]
    - [4, 7.502]
  - - [2048, 4096, 1, 4096, 2048, 2048, 2048, 4096]
    - [15, 7.802]
  - - [2048, 4096, 1, 8192, 2048, 2048, 2048, 4096]
    - [9, 8.215]
  - - [2048, 8192, 1, 128, 2048, 2048, 2048, 8192]
    - [36, 2.524]
  - - [2048, 8192, 1, 256, 2048, 2048, 2048, 8192]
    - [53, 3.892]
  - - [2048, 8192, 1, 512, 2048, 2048, 2048, 8192]
    - [26, 5.606]
  - - [2048, 8192, 1, 1024, 2048, 2048, 2048, 8192]
    - [17, 7.122]
  - - [2048, 8192, 1, 2048, 2048, 2048, 2048, 8192]
    - [12, 8.178]
  - - [2048, 8192, 1, 4096, 2048, 2048, 2048, 8192]
    - [20, 8.585]
  - - [2048, 8192, 1, 8192, 2048, 2048, 2048, 8192]
    - [13, 8.822]
  - - [4096, 128, 1, 128, 4096, 4096, 4096, 128]
    - [41, 1.247]
  - - [4096, 128, 1, 256, 4096, 4096, 4096, 128]
    - [39, 2.114]
  - - [4096, 128, 1, 512, 4096, 4096, 4096, 128]
    - [63, 2.906]
  - - [4096, 128, 1, 1024, 4096, 4096, 4096, 128]
    - [57, 3.334]
  - - [4096, 128, 1, 2048, 4096, 4096, 4096, 128]
    - [55, 4.211]
  - - [4096, 128, 1, 4096, 4096, 4096, 4096, 128]
    - [53, 5.308]
  - - [4096, 128, 1, 8192, 4096, 4096, 4096, 128]
    - [57, 6.212]
  - - [4096, 256, 1, 128, 4096, 4096, 4096, 256]
    - [24, 1.758]
  - - [4096, 256, 1, 256, 4096, 4096, 4096, 256]
    - [30, 2.894]
  - - [4096, 256, 1, 512, 4096, 4096, 4096, 256]
    - [53, 3.908]
  - - [4096, 256, 1, 1024, 4096, 4096, 4096, 256]
    - [86, 4.245]
  - - [4096, 256, 1, 2048, 4096, 4096, 4096, 256]
    - [32, 4.96]
  - - [4096, 256, 1, 4096, 4096, 4096, 4096, 256]
    - [53, 6.308]
  - - [4096, 256, 1, 8192, 4096, 4096, 4096, 256]
    - [13, 6.748]
  - - [4096, 512, 1, 128, 4096, 4096, 4096, 512]
    - [19, 2.174]
  - - [4096, 512, 1, 256, 4096, 4096, 4096, 512]
    - [16, 3.44]
  - - [4096, 512, 1, 512, 4096, 4096, 4096, 512]
    - [57, 4.549]
  - - [4096, 512, 1, 1024, 4096, 4096, 4096, 512]
    - [36, 5.066]
  - - [4096, 512, 1, 2048, 4096, 4096, 4096, 512]
    - [55, 6.627]
  - - [4096, 512, 1, 4096, 4096, 4096, 4096, 512]
    - [2, 6.58]
  - - [4096, 512, 1, 8192, 4096, 4096, 4096, 512]
    - [12, 7.929]
  - - [4096, 1024, 1, 128, 4096, 4096, 4096, 1024]
    - [32, 2.516]
  - - [4096, 1024, 1, 256, 4096, 4096, 4096, 1024]
    - [32, 4.064]
  - - [4096, 1024, 1, 512, 4096, 4096, 4096, 1024]
    - [26, 5.682]
  - - [4096, 1024, 1, 1024, 4096, 4096, 4096, 1024]
    - [26, 6.666]
  - - [4096, 1024, 1, 2048, 4096, 4096, 4096, 1024]
    - [53, 7.786]
  - - [4096, 1024, 1, 4096, 4096, 4096, 4096, 1024]
    - [6, 7.629]
  - - [4096, 1024, 1, 8192, 4096, 4096, 4096, 1024]
    - [19, 8.012]
  - - [4096, 2048, 1, 128, 4096, 4096, 4096, 2048]
    - [17, 2.594]
  - - [4096, 2048, 1, 256, 4096, 4096, 4096, 2048]
    - [2, 4.324]
  - - [4096, 2048, 1, 512, 4096, 4096, 4096, 2048]
    - [19, 5.964]
  - - [4096, 2048, 1, 1024, 4096, 4096, 4096, 2048]
    - [16, 7.625]
  - - [4096, 2048, 1, 2048, 4096, 4096, 4096, 2048]
    - [16, 7.407]
  - - [4096, 2048, 1, 4096, 4096, 4096, 4096, 2048]
    - [16, 8.274]
  - - [4096, 2048, 1, 8192, 4096, 4096, 4096, 2048]
    - [8, 8.176]
  - - [4096, 4096, 1, 128, 4096, 4096, 4096, 4096]
    - [24, 2.444]
  - - [4096, 4096, 1, 256, 4096, 4096, 4096, 4096]
    - [1, 3.856]
  - - [4096, 4096, 1, 512, 4096, 4096, 4096, 4096]
    - [2, 5.499]
  - - [4096, 4096, 1, 1024, 4096, 4096, 4096, 4096]
    - [3, 6.942]
  - - [4096, 4096, 1, 2048, 4096, 4096, 4096, 4096]
    - [5, 7.735]
  - - [4096, 4096, 1, 4096, 4096, 4096, 4096, 4096]
    - [7, 8.637]
  - - [4096, 4096, 1, 8192, 4096, 4096, 4096, 4096]
    - [6, 8.893]
  - - [4096, 8192, 1, 128, 4096, 4096, 4096, 8192]
    - [29, 2.324]
  - - [4096, 8192, 1, 256, 4096, 4096, 4096, 8192]
    - [26, 3.883]
  - - [4096, 8192, 1, 512, 4096, 4096, 4096, 8192]
    - [19, 5.257]
  - - [4096, 8192, 1, 1024, 4096, 4096, 4096, 8192]
    - [4, 6.921]
  - - [4096, 8192, 1, 2048, 4096, 4096, 4096, 8192]
    - [4, 7.97]
  - - [4096, 8192, 1, 4096, 4096, 4096, 4096, 8192]
    - [6, 8.475]
  - - [4096, 8192, 1, 8192, 4096, 4096, 4096, 8192]
    - [50, 8.475]
  - - [8192, 128, 1, 128, 8192, 8192, 8192, 128]
    - [36, 1.744]
  - - [8192, 128, 1, 256, 8192, 8192, 8192, 128]
    - [36, 2.857]
  - - [8192, 128, 1, 512, 8192, 8192, 8192, 128]
    - [57, 3.861]
  - - [8192, 128, 1, 1024, 8192, 8192, 8192, 128]
    - [82, 4.215]
  - - [8192, 128, 1, 2048, 8192, 8192, 8192, 128]
    - [57, 4.931]
  - - [8192, 128, 1, 4096, 8192, 8192, 8192, 128]
    - [57, 6.271]
  - - [8192, 128, 1, 8192, 8192, 8192, 8192, 128]
    - [57, 7.038]
  - - [8192, 256, 1, 128, 8192, 8192, 8192, 256]
    - [14, 2.167]
  - - [8192, 256, 1, 256, 8192, 8192, 8192, 256]
    - [13, 3.439]
  - - [8192, 256, 1, 512, 8192, 8192, 8192, 256]
    - [55, 4.48]
  - - [8192, 256, 1, 1024, 8192, 8192, 8192, 256]
    - [32, 4.982]
  - - [8192, 256, 1, 2048, 8192, 8192, 8192, 256]
    - [55, 6.57]
  - - [8192, 256, 1, 4096, 8192, 8192, 8192, 256]
    - [4, 6.722]
  - - [8192, 256, 1, 8192, 8192, 8192, 8192, 256]
    - [6, 8.023]
  - - [8192, 512, 1, 128, 8192, 8192, 8192, 512]
    - [25, 2.469]
  - - [8192, 512, 1, 256, 8192, 8192, 8192, 512]
    - [32, 4.025]
  - - [8192, 512, 1, 512, 8192, 8192, 8192, 512]
    - [32, 5.559]
  - - [8192, 512, 1, 1024, 8192, 8192, 8192, 512]
    - [57, 6.935]
  - - [8192, 512, 1, 2048, 8192, 8192, 8192, 512]
    - [58, 7.549]
  - - [8192, 512, 1, 4096, 8192, 8192, 8192, 512]
    - [12, 7.979]
  - - [8192, 512, 1, 8192, 8192, 8192, 8192, 512]
    - [9, 8.612]
  - - [8192, 1024, 1, 128, 8192, 8192, 8192, 1024]
    - [14, 2.619]
  - - [8192, 1024, 1, 256, 8192, 8192, 8192, 1024]
    - [2, 4.328]
  - - [8192, 1024, 1, 512, 8192, 8192, 8192, 1024]
    - [6, 6.197]
  - - [8192, 1024, 1, 1024, 8192, 8192, 8192, 1024]
    - [9, 7.724]
  - - [8192, 1024, 1, 2048, 8192, 8192, 8192, 1024]
    - [9, 7.627]
  - - [8192, 1024, 1, 4096, 8192, 8192, 8192, 1024]
    - [13, 8.409]
  - - [8192, 1024, 1, 8192, 8192, 8192, 8192, 1024]
    - [13, 8.264]
  - - [8192, 2048, 1, 128, 8192, 8192, 8192, 2048]
    - [30, 2.435]
  - - [8192, 2048, 1, 256, 8192, 8192, 8192, 2048]
    - [1, 3.762]
  - - [8192, 2048, 1, 512, 8192, 8192, 8192, 2048]
    - [2, 5.722]
  - - [8192, 2048, 1, 1024, 8192, 8192, 8192, 2048]
    - [16, 7.185]
  - - [8192, 2048, 1, 2048, 8192, 8192, 8192, 2048]
    - [4, 8.503]
  - - [8192, 2048, 1, 4096, 8192, 8192, 8192, 2048]
    - [6, 8.832]
  - - [8192, 2048, 1, 8192, 8192, 8192, 8192, 2048]
    - [6, 8.887]
  - - [8192, 4096, 1, 128, 8192, 8192, 8192, 4096]
    - [53, 2.534]
  - - [8192, 4096, 1, 256, 8192, 8192, 8192, 4096]
    - [56, 3.627]
  - - [8192, 4096, 1, 512, 8192, 8192, 8192, 4096]
    - [2, 5.478]
  - - [8192, 4096, 1, 1024, 8192, 8192, 8192, 4096]
    - [6, 7.099]
  - - [8192, 4096, 1, 2048, 8192, 8192, 8192, 4096]
    - [6, 8.2]
  - - [8192, 4096, 1, 4096, 8192, 8192, 8192, 4096]
    - [13, 8.479]
  - - [8192, 4096, 1, 8192, 8192, 8192, 8192, 4096]
    - [51, 8.73]
  - - [8192, 8192, 1, 128, 8192, 8192, 8192, 8192]
    - [25, 2.208]
  - - [8192, 8192, 1, 256, 8192, 8192, 8192, 8192]
    - [7, 3.805]
  - - [8192, 8192, 1, 512, 8192, 8192, 8192, 8192]
    - [2, 5.9]
  - - [8192, 8192, 1, 1024, 8192, 8192, 8192, 8192]
    - [4, 7.429]
  - - [8192, 8192, 1, 2048, 8192, 8192, 8192, 8192]
    - [6, 8.255]
  - - [8192, 8192, 1, 4096, 8192, 8192, 8192, 8192]
    - [6, 8.582]
  - - [8192, 8192, 1, 8192, 8192, 8192, 8192, 8192]
    - [6, 8.439]
  - - [1, 1, 1, 32, 1, 1, 1, 1]
    - [104, 0.0]
- null
- null
- DeviceEfficiency
- GridBased
