library/src/amd_detail/rocblaslt/src/Tensile/Logic/streamk/gfx942_38cu/aquavanjaram942_Cijk_Ailk_Bljk_BBS_BH_UserArgs.yaml
- {MinimumRequiredVersion: 4.33.0}
- aquavanjaram942
- {Architecture: gfx942, CUCount: 38}
- [Device 0049, Device 0050]
    SolutionIndex: 0
    SolutionNameMin: Cijk_Ailk_Bljk_BBS_BH_UserArgs_MT256x256x32_MI16x16x1_SN_LDSB1_CLR1_GSU0_GSUC0_GSUWGMRR0_K1_LBSPPA2048_LBSPPB128_LPA0_MIWT8_8_PLR1_SU32_SUM0_SUS256_VWA4_VWB1_WGM1_WGMXCC1_WGMXCCGn1
    SolutionIndex: 1
    SolutionNameMin: Cijk_Ailk_Bljk_BBS_BH_UserArgs_MT256x256x32_MI16x16x1_SN_LDSB1_CLR1_GSU0_GSUC0_GSUWGMRR0_K1_LBSPPA2048_LBSPPB128_LPA0_MIWT8_8_PLR1_SU32_SUM0_SUS256_VWA8_VWB1_WGM1_WGMXCC1_WGMXCCGn1
    SolutionIndex: 2
    SolutionNameMin: Cijk_Ailk_Bljk_BBS_BH_UserArgs_MT256x256x32_MI16x16x1_SN_LDSB1_CLR1_GSU0_GSUC0_GSUWGMRR0_K1_LBSPPA2048_LBSPPB128_LPA0_MIWT8_8_PLR1_SU32_SUM0_SUS256_VWA8_VWB2_WGM1_WGMXCC1_WGMXCCGn1
    SolutionIndex: 3
    SolutionNameMin: Cijk_Ailk_Bljk_BBS_BH_UserArgs_MT256x256x32_MI16x16x1_SN_LDSB1_CLR1_GSU0_GSUC0_GSUWGMRR0_K1_LBSPPA2048_LBSPPB256_LPA32_MIWT8_8_PLR1_SU32_SUM0_SUS256_VWA2_VWB4_WGM1_WGMXCC1_WGMXCCGn1
    SolutionIndex: 4
    SolutionNameMin: Cijk_Ailk_Bljk_BBS_BH_UserArgs_MT256x256x32_MI16x16x1_SN_LDSB1_CLR1_GSU0_GSUC0_GSUWGMRR0_K1_LBSPPA2048_LBSPPB256_LPA0_MIWT8_8_PLR1_SU32_SUM0_SUS256_VWA8_VWB4_WGM1_WGMXCC1_WGMXCCGn1
    SolutionIndex: 5
    SolutionNameMin: Cijk_Ailk_Bljk_BBS_BH_UserArgs_MT256x256x32_MI16x16x1_SN_LDSB1_CLR1_GSU0_GSUC0_GSUWGMRR0_K1_LBSPPA2048_LBSPPB512_LPA0_MIWT8_8_PLR1_SU32_SUM0_SUS256_VWA8_VWB8_WGM1_WGMXCC1_WGMXCCGn1
    SolutionIndex: 6
    SolutionNameMin: Cijk_Ailk_Bljk_BBS_BH_UserArgs_MT256x256x32_MI16x16x1_SN_LDSB1_CLR1_GSU0_GSUC0_GSUWGMRR0_K1_LBSPPA2048_LBSPPB128_LPA0_MIWT8_8_PLR1_SU32_SUM0_SUS256_VWA8_VWB1_WGM4_WGMXCC1_WGMXCCGn1
    SolutionIndex: 7
    SolutionNameMin: Cijk_Ailk_Bljk_BBS_BH_UserArgs_MT256x256x32_MI16x16x1_SN_LDSB1_CLR1_GSU0_GSUC0_GSUWGMRR0_K1_LBSPPA2048_LBSPPB256_LPA0_MIWT8_8_PLR1_SU32_SUM0_SUS256_VWA4_VWB4_WGM4_WGMXCC1_WGMXCCGn1
    SolutionIndex: 8
    SolutionNameMin: Cijk_Ailk_Bljk_BBS_BH_UserArgs_MT256x256x32_MI16x16x1_SN_LDSB1_CLR1_GSU0_GSUC0_GSUWGMRR0_K1_LBSPPA2048_LBSPPB256_LPA0_MIWT8_8_PLR1_SU32_SUM0_SUS256_VWA8_VWB4_WGM4_WGMXCC1_WGMXCCGn1
    SolutionIndex: 9
    SolutionNameMin: Cijk_Ailk_Bljk_BBS_BH_UserArgs_MT256x256x32_MI16x16x1_SN_LDSB1_CLR1_GSU0_GSUC0_GSUWGMRR0_K1_LBSPPA2048_LBSPPB512_LPA0_MIWT8_8_PLR1_SU32_SUM0_SUS256_VWA8_VWB8_WGM4_WGMXCC1_WGMXCCGn1
    SolutionIndex: 10
    SolutionNameMin: Cijk_Ailk_Bljk_BBS_BH_UserArgs_MT256x256x32_MI16x16x1_SN_LDSB1_CLR1_GSU0_GSUC0_GSUWGMRR0_K1_LBSPPA2048_LBSPPB128_LPA0_MIWT8_8_PLR1_SU32_SUM0_SUS256_VWA8_VWB1_WGM8_WGMXCC1_WGMXCCGn1
    SolutionIndex: 11
    SolutionNameMin: Cijk_Ailk_Bljk_BBS_BH_UserArgs_MT256x256x32_MI16x16x1_SN_LDSB1_CLR1_GSU0_GSUC0_GSUWGMRR0_K1_LBSPPA2048_LBSPPB512_LPA0_MIWT8_8_PLR1_SU32_SUM0_SUS256_VWA4_VWB8_WGM8_WGMXCC1_WGMXCCGn1
    SolutionIndex: 12
    SolutionNameMin: Cijk_Ailk_Bljk_BBS_BH_UserArgs_MT256x128x32_MI16x16x1_SN_LDSB1_CLR1_GSU0_GSUC0_GSUWGMRR0_K1_LBSPPA2048_LBSPPB128_LPA0_MIWT8_4_PLR1_SU32_SUM0_SUS256_VWA4_VWB1_WGM1_WGMXCC1_WGMXCCGn1
    SolutionIndex: 13
    SolutionNameMin: Cijk_Ailk_Bljk_BBS_BH_UserArgs_MT256x128x32_MI16x16x1_SN_LDSB1_CLR1_GSU0_GSUC0_GSUWGMRR0_K1_LBSPPA2048_LBSPPB128_LPA0_MIWT8_4_PLR1_SU32_SUM0_SUS256_VWA8_VWB1_WGM1_WGMXCC1_WGMXCCGn1
    SolutionIndex: 14
    SolutionNameMin: Cijk_Ailk_Bljk_BBS_BH_UserArgs_MT256x128x32_MI16x16x1_SN_LDSB1_CLR1_GSU0_GSUC0_GSUWGMRR0_K1_LBSPPA2048_LBSPPB128_LPA0_MIWT8_4_PLR1_SU32_SUM0_SUS256_VWA4_VWB2_WGM1_WGMXCC1_WGMXCCGn1
    SolutionIndex: 15
    SolutionNameMin: Cijk_Ailk_Bljk_BBS_BH_UserArgs_MT256x128x32_MI16x16x1_SN_LDSB1_CLR1_GSU0_GSUC0_GSUWGMRR0_K1_LBSPPA2048_LBSPPB128_LPA0_MIWT8_4_PLR1_SU32_SUM0_SUS256_VWA8_VWB2_WGM1_WGMXCC1_WGMXCCGn1
    SolutionIndex: 16
    SolutionNameMin: Cijk_Ailk_Bljk_BBS_BH_UserArgs_MT256x128x32_MI16x16x1_SN_LDSB1_CLR1_GSU0_GSUC0_GSUWGMRR0_K1_LBSPPA2048_LBSPPB256_LPA0_MIWT8_4_PLR1_SU32_SUM0_SUS256_VWA4_VWB4_WGM1_WGMXCC1_WGMXCCGn1
    SolutionIndex: 17
    SolutionNameMin: Cijk_Ailk_Bljk_BBS_BH_UserArgs_MT256x128x32_MI16x16x1_SN_LDSB1_CLR1_GSU0_GSUC0_GSUWGMRR0_K1_LBSPPA2048_LBSPPB256_LPA0_MIWT8_4_PLR1_SU32_SUM0_SUS256_VWA8_VWB4_WGM1_WGMXCC1_WGMXCCGn1
    SolutionIndex: 18
    SolutionNameMin: Cijk_Ailk_Bljk_BBS_BH_UserArgs_MT256x128x32_MI16x16x1_SN_LDSB1_CLR1_GSU0_GSUC0_GSUWGMRR0_K1_LBSPPA2048_LBSPPB128_LPA0_MIWT8_4_PLR1_SU32_SUM0_SUS256_VWA4_VWB1_WGM4_WGMXCC1_WGMXCCGn1
    SolutionIndex: 19
    SolutionNameMin: Cijk_Ailk_Bljk_BBS_BH_UserArgs_MT256x128x32_MI16x16x1_SN_LDSB1_CLR1_GSU0_GSUC0_GSUWGMRR0_K1_LBSPPA2048_LBSPPB128_LPA0_MIWT8_4_PLR1_SU32_SUM0_SUS256_VWA8_VWB1_WGM4_WGMXCC1_WGMXCCGn1
    SolutionIndex: 20
    SolutionNameMin: Cijk_Ailk_Bljk_BBS_BH_UserArgs_MT256x128x32_MI16x16x1_SN_LDSB1_CLR1_GSU0_GSUC0_GSUWGMRR0_K1_LBSPPA2048_LBSPPB128_LPA0_MIWT8_4_PLR1_SU32_SUM0_SUS256_VWA4_VWB2_WGM4_WGMXCC1_WGMXCCGn1
    SolutionIndex: 21
    SolutionNameMin: Cijk_Ailk_Bljk_BBS_BH_UserArgs_MT256x128x32_MI16x16x1_SN_LDSB1_CLR1_GSU0_GSUC0_GSUWGMRR0_K1_LBSPPA2048_LBSPPB128_LPA0_MIWT8_4_PLR1_SU32_SUM0_SUS256_VWA8_VWB2_WGM4_WGMXCC1_WGMXCCGn1
    SolutionIndex: 22
    SolutionNameMin: Cijk_Ailk_Bljk_BBS_BH_UserArgs_MT256x128x32_MI16x16x1_SN_LDSB1_CLR1_GSU0_GSUC0_GSUWGMRR0_K1_LBSPPA2048_LBSPPB256_LPA0_MIWT8_4_PLR1_SU32_SUM0_SUS256_VWA4_VWB4_WGM4_WGMXCC1_WGMXCCGn1
    SolutionIndex: 23
    SolutionNameMin: Cijk_Ailk_Bljk_BBS_BH_UserArgs_MT256x128x32_MI16x16x1_SN_LDSB1_CLR1_GSU0_GSUC0_GSUWGMRR0_K1_LBSPPA2048_LBSPPB256_LPA0_MIWT8_4_PLR1_SU32_SUM0_SUS256_VWA8_VWB4_WGM4_WGMXCC1_WGMXCCGn1
    SolutionIndex: 24
    SolutionNameMin: Cijk_Ailk_Bljk_BBS_BH_UserArgs_MT256x128x32_MI16x16x1_SN_LDSB1_CLR1_GSU0_GSUC0_GSUWGMRR0_K1_LBSPPA2048_LBSPPB128_LPA0_MIWT8_4_PLR1_SU32_SUM0_SUS256_VWA4_VWB1_WGM8_WGMXCC1_WGMXCCGn1
    SolutionIndex: 25
    SolutionNameMin: Cijk_Ailk_Bljk_BBS_BH_UserArgs_MT256x128x32_MI16x16x1_SN_LDSB1_CLR1_GSU0_GSUC0_GSUWGMRR0_K1_LBSPPA2048_LBSPPB128_LPA0_MIWT8_4_PLR1_SU32_SUM0_SUS256_VWA8_VWB1_WGM8_WGMXCC1_WGMXCCGn1
    SolutionIndex: 26
    SolutionNameMin: Cijk_Ailk_Bljk_BBS_BH_UserArgs_MT256x128x32_MI16x16x1_SN_LDSB1_CLR1_GSU0_GSUC0_GSUWGMRR0_K1_LBSPPA2048_LBSPPB128_LPA0_MIWT8_4_PLR1_SU32_SUM0_SUS256_VWA4_VWB2_WGM8_WGMXCC1_WGMXCCGn1
    SolutionIndex: 27
    SolutionNameMin: Cijk_Ailk_Bljk_BBS_BH_UserArgs_MT256x128x32_MI16x16x1_SN_LDSB1_CLR1_GSU0_GSUC0_GSUWGMRR0_K1_LBSPPA2048_LBSPPB128_LPA0_MIWT8_4_PLR1_SU32_SUM0_SUS256_VWA8_VWB2_WGM8_WGMXCC1_WGMXCCGn1
    SolutionIndex: 28
    SolutionNameMin: Cijk_Ailk_Bljk_BBS_BH_UserArgs_MT256x128x32_MI16x16x1_SN_LDSB1_CLR1_GSU0_GSUC0_GSUWGMRR0_K1_LBSPPA2048_LBSPPB256_LPA0_MIWT8_4_PLR1_SU32_SUM0_SUS256_VWA4_VWB4_WGM8_WGMXCC1_WGMXCCGn1
    SolutionIndex: 29
    SolutionNameMin: Cijk_Ailk_Bljk_BBS_BH_UserArgs_MT256x128x32_MI16x16x1_SN_LDSB1_CLR1_GSU0_GSUC0_GSUWGMRR0_K1_LBSPPA2048_LBSPPB256_LPA0_MIWT8_4_PLR1_SU32_SUM0_SUS256_VWA8_VWB4_WGM8_WGMXCC1_WGMXCCGn1
    SolutionIndex: 30
    SolutionNameMin: Cijk_Ailk_Bljk_BBS_BH_UserArgs_MT256x64x32_MI16x16x1_SN_LDSB1_CLR1_GSU0_GSUC0_GSUWGMRR0_K1_LBSPPA2048_LBSPPB128_LPA0_MIWT8_2_PLR1_SU32_SUM0_SUS256_VWA4_VWB1_WGM1_WGMXCC1_WGMXCCGn1
    SolutionIndex: 31
    SolutionNameMin: Cijk_Ailk_Bljk_BBS_BH_UserArgs_MT256x64x32_MI16x16x1_SN_LDSB1_CLR1_GSU0_GSUC0_GSUWGMRR0_K1_LBSPPA2048_LBSPPB128_LPA0_MIWT8_2_PLR1_SU32_SUM0_SUS256_VWA8_VWB1_WGM1_WGMXCC1_WGMXCCGn1
    SolutionIndex: 32
    SolutionNameMin: Cijk_Ailk_Bljk_BBS_BH_UserArgs_MT256x64x32_MI16x16x1_SN_LDSB1_CLR1_GSU0_GSUC0_GSUWGMRR0_K1_LBSPPA2048_LBSPPB128_LPA0_MIWT8_2_PLR1_SU32_SUM0_SUS256_VWA4_VWB2_WGM1_WGMXCC1_WGMXCCGn1
    SolutionIndex: 33
    SolutionNameMin: Cijk_Ailk_Bljk_BBS_BH_UserArgs_MT256x64x32_MI16x16x1_SN_LDSB1_CLR1_GSU0_GSUC0_GSUWGMRR0_K1_LBSPPA2048_LBSPPB128_LPA0_MIWT8_2_PLR1_SU32_SUM0_SUS256_VWA8_VWB2_WGM1_WGMXCC1_WGMXCCGn1
    SolutionIndex: 34
    SolutionNameMin: Cijk_Ailk_Bljk_BBS_BH_UserArgs_MT256x64x32_MI16x16x1_SN_LDSB1_CLR1_GSU0_GSUC0_GSUWGMRR0_K1_LBSPPA2048_LBSPPB128_LPA0_MIWT8_2_PLR1_SU32_SUM0_SUS256_VWA8_VWB1_WGM4_WGMXCC1_WGMXCCGn1
    SolutionIndex: 35
    SolutionNameMin: Cijk_Ailk_Bljk_BBS_BH_UserArgs_MT256x64x32_MI16x16x1_SN_LDSB1_CLR1_GSU0_GSUC0_GSUWGMRR0_K1_LBSPPA2048_LBSPPB128_LPA0_MIWT8_2_PLR1_SU32_SUM0_SUS256_VWA8_VWB2_WGM4_WGMXCC1_WGMXCCGn1
    SolutionIndex: 36
    SolutionNameMin: Cijk_Ailk_Bljk_BBS_BH_UserArgs_MT256x64x32_MI16x16x1_SN_LDSB1_CLR1_GSU0_GSUC0_GSUWGMRR0_K1_LBSPPA2048_LBSPPB128_LPA0_MIWT8_2_PLR1_SU32_SUM0_SUS256_VWA8_VWB1_WGM8_WGMXCC1_WGMXCCGn1
    SolutionIndex: 37
    SolutionNameMin: Cijk_Ailk_Bljk_BBS_BH_UserArgs_MT256x64x32_MI16x16x1_SN_LDSB1_CLR1_GSU0_GSUC0_GSUWGMRR0_K1_LBSPPA2048_LBSPPB128_LPA0_MIWT8_2_PLR1_SU32_SUM0_SUS256_VWA8_VWB2_WGM8_WGMXCC1_WGMXCCGn1
    SolutionIndex: 38
    SolutionNameMin: Cijk_Ailk_Bljk_BBS_BH_UserArgs_MT128x128x32_MI16x16x1_SN_LDSB1_CLR1_GSU0_GSUC0_GSUWGMRR0_K1_LBSPPA1024_LBSPPB128_LPA32_MIWT4_4_PLR1_SU32_SUM0_SUS256_VWA2_VWB1_WGM1_WGMXCC1_WGMXCCGn1
    SolutionIndex: 39
    SolutionNameMin: Cijk_Ailk_Bljk_BBS_BH_UserArgs_MT128x128x32_MI16x16x1_SN_LDSB1_CLR1_GSU0_GSUC0_GSUWGMRR0_K1_LBSPPA1024_LBSPPB128_LPA0_MIWT4_4_PLR1_SU32_SUM0_SUS256_VWA4_VWB1_WGM1_WGMXCC1_WGMXCCGn1
    SolutionIndex: 40
    SolutionNameMin: Cijk_Ailk_Bljk_BBS_BH_UserArgs_MT128x128x32_MI16x16x1_SN_LDSB1_CLR1_GSU0_GSUC0_GSUWGMRR0_K1_LBSPPA1024_LBSPPB128_LPA32_MIWT4_4_PLR1_SU32_SUM0_SUS256_VWA2_VWB2_WGM1_WGMXCC1_WGMXCCGn1
    SolutionIndex: 41
    SolutionNameMin: Cijk_Ailk_Bljk_BBS_BH_UserArgs_MT128x128x32_MI16x16x1_SN_LDSB1_CLR1_GSU0_GSUC0_GSUWGMRR0_K1_LBSPPA1024_LBSPPB256_LPA0_MIWT4_4_PLR1_SU32_SUM0_SUS256_VWA4_VWB4_WGM1_WGMXCC1_WGMXCCGn1
    SolutionIndex: 42
    SolutionNameMin: Cijk_Ailk_Bljk_BBS_BH_UserArgs_MT128x128x32_MI16x16x1_SN_LDSB1_CLR1_GSU0_GSUC0_GSUWGMRR0_K1_LBSPPA1024_LBSPPB128_LPA0_MIWT4_4_PLR1_SU32_SUM0_SUS256_VWA4_VWB1_WGM4_WGMXCC1_WGMXCCGn1
    SolutionIndex: 43
    SolutionNameMin: Cijk_Ailk_Bljk_BBS_BH_UserArgs_MT128x128x32_MI16x16x1_SN_LDSB1_CLR1_GSU0_GSUC0_GSUWGMRR0_K1_LBSPPA1024_LBSPPB128_LPA0_MIWT4_4_PLR1_SU32_SUM0_SUS256_VWA4_VWB2_WGM4_WGMXCC1_WGMXCCGn1
    SolutionIndex: 44
    SolutionNameMin: Cijk_Ailk_Bljk_BBS_BH_UserArgs_MT128x128x32_MI16x16x1_SN_LDSB1_CLR1_GSU0_GSUC0_GSUWGMRR0_K1_LBSPPA1024_LBSPPB256_LPA32_MIWT4_4_PLR1_SU32_SUM0_SUS256_VWA2_VWB4_WGM4_WGMXCC1_WGMXCCGn1
    SolutionIndex: 45
    SolutionNameMin: Cijk_Ailk_Bljk_BBS_BH_UserArgs_MT128x128x32_MI16x16x1_SN_LDSB1_CLR1_GSU0_GSUC0_GSUWGMRR0_K1_LBSPPA1024_LBSPPB256_LPA0_MIWT4_4_PLR1_SU32_SUM0_SUS256_VWA4_VWB4_WGM4_WGMXCC1_WGMXCCGn1
    SolutionIndex: 46
    SolutionNameMin: Cijk_Ailk_Bljk_BBS_BH_UserArgs_MT128x64x32_MI16x16x1_SN_LDSB0_CLR1_GSU0_GSUC0_GSUWGMRR0_K1_LBSPPA1024_LBSPPB128_LPA32_MIWT4_2_PLR1_SU32_SUM0_SUS256_VWA2_VWB1_WGM1_WGMXCC1_WGMXCCGn1
    SolutionIndex: 47
    SolutionNameMin: Cijk_Ailk_Bljk_BBS_BH_UserArgs_MT128x64x32_MI16x16x1_SN_LDSB0_CLR1_GSU0_GSUC0_GSUWGMRR0_K1_LBSPPA1024_LBSPPB128_LPA0_MIWT4_2_PLR1_SU32_SUM0_SUS256_VWA4_VWB1_WGM1_WGMXCC1_WGMXCCGn1
    SolutionIndex: 48
    SolutionNameMin: Cijk_Ailk_Bljk_BBS_BH_UserArgs_MT128x64x32_MI16x16x1_SN_LDSB0_CLR1_GSU0_GSUC0_GSUWGMRR0_K1_LBSPPA1024_LBSPPB128_LPA0_MIWT4_2_PLR1_SU32_SUM0_SUS256_VWA4_VWB1_WGM4_WGMXCC1_WGMXCCGn1
    SolutionIndex: 49
    SolutionNameMin: Cijk_Ailk_Bljk_BBS_BH_UserArgs_MT128x64x32_MI16x16x1_SN_LDSB0_CLR0_GSU0_GSUC0_GSUWGMRR0_K1_LBSPPA1024_LBSPPB128_LPA0_MIWT4_2_PLR0_SU32_SUM0_SUS256_VWA4_VWB2_WGM4_WGMXCC1_WGMXCCGn1
    SolutionIndex: 50
    SolutionNameMin: Cijk_Ailk_Bljk_BBS_BH_UserArgs_MT128x64x32_MI16x16x1_SN_LDSB0_CLR1_GSU0_GSUC0_GSUWGMRR0_K1_LBSPPA1024_LBSPPB128_LPA0_MIWT4_2_PLR1_SU32_SUM0_SUS256_VWA4_VWB1_WGM8_WGMXCC1_WGMXCCGn1
    SolutionIndex: 51
    SolutionNameMin: Cijk_Ailk_Bljk_BBS_BH_UserArgs_MT64x64x32_MI16x16x1_SN_LDSB0_CLR1_GSU0_GSUC0_GSUWGMRR0_K1_LBSPPA512_LBSPPB128_LPA32_MIWT2_2_PLR1_SU32_SUM0_SUS256_VWA2_VWB2_WGM1_WGMXCC1_WGMXCCGn1
    SolutionIndex: 52
    SolutionNameMin: Cijk_Ailk_Bljk_BBS_BH_UserArgs_MT32x32x32_MI16x16x1_SN_LDSB0_CLR1_GSU0_GSUC0_GSUWGMRR0_K1_LBSPPA256_LBSPPB128_LPA16_MIWT1_1_PLR1_SU32_SUM0_SUS256_VWA1_VWB1_WGM1_WGMXCC1_WGMXCCGn1
    SolutionIndex: 53
    SolutionNameMin: Cijk_Ailk_Bljk_BBS_BH_UserArgs_MT128x256x64_MI16x16x1_SN_LDSB1_CLR1_GSU0_GSUC0_GSUWGMRR0_K1_LBSPPA2048_LBSPPB256_LPA0_MIWT4_8_PLR1_SU32_SUM0_SUS256_VWA4_VWB2_WGM1_WGMXCC1_WGMXCCGn1
    SolutionIndex: 54
    SolutionNameMin: Cijk_Ailk_Bljk_BBS_BH_UserArgs_MT128x256x64_MI16x16x1_SN_LDSB1_CLR1_GSU0_GSUC0_GSUWGMRR0_K1_LBSPPA2048_LBSPPB512_LPA0_MIWT4_8_PLR1_SU32_SUM0_SUS256_VWA4_VWB4_WGM1_WGMXCC1_WGMXCCGn1
    SolutionIndex: 55
    SolutionNameMin: Cijk_Ailk_Bljk_BBS_BH_UserArgs_MT128x256x64_MI16x16x1_SN_LDSB1_CLR1_GSU0_GSUC0_GSUWGMRR0_K1_LBSPPA2048_LBSPPB1024_LPA0_MIWT4_8_PLR1_SU32_SUM0_SUS256_VWA4_VWB8_WGM1_WGMXCC1_WGMXCCGn1
    SolutionIndex: 56
    SolutionNameMin: Cijk_Ailk_Bljk_BBS_BH_UserArgs_MT128x256x64_MI16x16x1_SN_LDSB1_CLR1_GSU0_GSUC0_GSUWGMRR0_K1_LBSPPA2048_LBSPPB256_LPA0_MIWT4_8_PLR1_SU32_SUM0_SUS256_VWA4_VWB2_WGM4_WGMXCC1_WGMXCCGn1
    SolutionIndex: 57
    SolutionNameMin: Cijk_Ailk_Bljk_BBS_BH_UserArgs_MT128x256x64_MI16x16x1_SN_LDSB1_CLR1_GSU0_GSUC0_GSUWGMRR0_K1_LBSPPA2048_LBSPPB512_LPA0_MIWT4_8_PLR1_SU32_SUM0_SUS256_VWA4_VWB4_WGM4_WGMXCC1_WGMXCCGn1
    SolutionIndex: 58
    SolutionNameMin: Cijk_Ailk_Bljk_BBS_BH_UserArgs_MT128x256x64_MI16x16x1_SN_LDSB1_CLR1_GSU0_GSUC0_GSUWGMRR0_K1_LBSPPA2048_LBSPPB256_LPA32_MIWT4_8_PLR1_SU32_SUM0_SUS256_VWA2_VWB2_WGM8_WGMXCC1_WGMXCCGn1
    SolutionIndex: 59
    SolutionNameMin: Cijk_Ailk_Bljk_BBS_BH_UserArgs_MT128x256x64_MI16x16x1_SN_LDSB1_CLR1_GSU0_GSUC0_GSUWGMRR0_K1_LBSPPA2048_LBSPPB512_LPA0_MIWT4_8_PLR1_SU32_SUM0_SUS256_VWA4_VWB4_WGM8_WGMXCC1_WGMXCCGn1
    SolutionIndex: 60
    SolutionNameMin: Cijk_Ailk_Bljk_BBS_BH_UserArgs_MT256x128x64_MI16x16x1_SN_LDSB1_CLR1_GSU0_GSUC0_GSUWGMRR0_K1_LBSPPA4096_LBSPPB128_LPA0_MIWT8_4_PLR1_SU32_SUM0_SUS256_VWA4_VWB1_WGM1_WGMXCC1_WGMXCCGn1
    SolutionIndex: 61
    SolutionNameMin: Cijk_Ailk_Bljk_BBS_BH_UserArgs_MT256x128x64_MI16x16x1_SN_LDSB1_CLR1_GSU0_GSUC0_GSUWGMRR0_K1_LBSPPA4096_LBSPPB256_LPA0_MIWT8_4_PLR1_SU32_SUM0_SUS256_VWA4_VWB2_WGM1_WGMXCC1_WGMXCCGn1
    SolutionIndex: 62
    SolutionNameMin: Cijk_Ailk_Bljk_BBS_BH_UserArgs_MT256x128x64_MI16x16x1_SN_LDSB1_CLR1_GSU0_GSUC0_GSUWGMRR0_K1_LBSPPA4096_LBSPPB512_LPA0_MIWT8_4_PLR1_SU32_SUM0_SUS256_VWA4_VWB4_WGM1_WGMXCC1_WGMXCCGn1
    SolutionIndex: 63
    SolutionNameMin: Cijk_Ailk_Bljk_BBS_BH_UserArgs_MT256x128x64_MI16x16x1_SN_LDSB1_CLR1_GSU0_GSUC0_GSUWGMRR0_K1_LBSPPA4096_LBSPPB512_LPA0_MIWT8_4_PLR1_SU32_SUM0_SUS256_VWA4_VWB4_WGM4_WGMXCC1_WGMXCCGn1
    SolutionIndex: 64
    SolutionNameMin: Cijk_Ailk_Bljk_BBS_BH_UserArgs_MT256x128x64_MI16x16x1_SN_LDSB1_CLR1_GSU0_GSUC0_GSUWGMRR0_K1_LBSPPA4096_LBSPPB128_LPA32_MIWT8_4_PLR1_SU32_SUM0_SUS256_VWA2_VWB1_WGM8_WGMXCC1_WGMXCCGn1
    SolutionIndex: 65
    SolutionNameMin: Cijk_Ailk_Bljk_BBS_BH_UserArgs_MT256x128x64_MI16x16x1_SN_LDSB1_CLR1_GSU0_GSUC0_GSUWGMRR0_K1_LBSPPA4096_LBSPPB128_LPA0_MIWT8_4_PLR1_SU32_SUM0_SUS256_VWA4_VWB1_WGM8_WGMXCC1_WGMXCCGn1
    SolutionIndex: 66
    SolutionNameMin: Cijk_Ailk_Bljk_BBS_BH_UserArgs_MT128x128x64_MI16x16x1_SN_LDSB1_CLR1_GSU0_GSUC0_GSUWGMRR0_K1_LBSPPA2048_LBSPPB128_LPA0_MIWT4_4_PLR1_SU32_SUM0_SUS256_VWA4_VWB1_WGM1_WGMXCC1_WGMXCCGn1
    SolutionIndex: 67
    SolutionNameMin: Cijk_Ailk_Bljk_BBS_BH_UserArgs_MT128x128x64_MI16x16x1_SN_LDSB1_CLR1_GSU0_GSUC0_GSUWGMRR0_K1_LBSPPA2048_LBSPPB256_LPA0_MIWT4_4_PLR1_SU32_SUM0_SUS256_VWA4_VWB2_WGM1_WGMXCC1_WGMXCCGn1
    SolutionIndex: 68
    SolutionNameMin: Cijk_Ailk_Bljk_BBS_BH_UserArgs_MT128x128x64_MI16x16x1_SN_LDSB1_CLR1_GSU0_GSUC0_GSUWGMRR0_K1_LBSPPA2048_LBSPPB512_LPA0_MIWT4_4_PLR1_SU32_SUM0_SUS256_VWA4_VWB4_WGM1_WGMXCC1_WGMXCCGn1
    SolutionIndex: 69
    SolutionNameMin: Cijk_Ailk_Bljk_BBS_BH_UserArgs_MT128x128x64_MI16x16x1_SN_LDSB1_CLR1_GSU0_GSUC0_GSUWGMRR0_K1_LBSPPA2048_LBSPPB128_LPA0_MIWT4_4_PLR1_SU32_SUM0_SUS256_VWA4_VWB1_WGM4_WGMXCC1_WGMXCCGn1
    SolutionIndex: 70
    SolutionNameMin: Cijk_Ailk_Bljk_BBS_BH_UserArgs_MT128x128x64_MI16x16x1_SN_LDSB1_CLR1_GSU0_GSUC0_GSUWGMRR0_K1_LBSPPA2048_LBSPPB256_LPA0_MIWT4_4_PLR1_SU32_SUM0_SUS256_VWA4_VWB2_WGM4_WGMXCC1_WGMXCCGn1
    SolutionIndex: 71
    SolutionNameMin: Cijk_Ailk_Bljk_BBS_BH_UserArgs_MT128x128x64_MI16x16x1_SN_LDSB1_CLR1_GSU0_GSUC0_GSUWGMRR0_K1_LBSPPA2048_LBSPPB512_LPA0_MIWT4_4_PLR1_SU32_SUM0_SUS256_VWA4_VWB4_WGM4_WGMXCC1_WGMXCCGn1
    SolutionIndex: 72
    SolutionNameMin: Cijk_Ailk_Bljk_BBS_BH_UserArgs_MT128x128x64_MI16x16x1_SN_LDSB1_CLR1_GSU0_GSUC0_GSUWGMRR0_K1_LBSPPA2048_LBSPPB256_LPA0_MIWT4_4_PLR1_SU32_SUM0_SUS256_VWA4_VWB2_WGM8_WGMXCC1_WGMXCCGn1
    SolutionIndex: 73
    SolutionNameMin: Cijk_Ailk_Bljk_BBS_BH_UserArgs_MT128x128x64_MI16x16x1_SN_LDSB1_CLR1_GSU0_GSUC0_GSUWGMRR0_K1_LBSPPA2048_LBSPPB512_LPA0_MIWT4_4_PLR1_SU32_SUM0_SUS256_VWA4_VWB4_WGM8_WGMXCC1_WGMXCCGn1
    SolutionIndex: 74
    SolutionNameMin: Cijk_Ailk_Bljk_BBS_BH_UserArgs_MT64x128x64_MI16x16x1_SN_LDSB1_CLR1_GSU0_GSUC0_GSUWGMRR0_K1_LBSPPA1024_LBSPPB128_LPA32_MIWT2_4_PLR1_SU32_SUM0_SUS256_VWA2_VWB1_WGM1_WGMXCC1_WGMXCCGn1
    SolutionIndex: 75
    SolutionNameMin: Cijk_Ailk_Bljk_BBS_BH_UserArgs_MT64x128x64_MI16x16x1_SN_LDSB1_CLR1_GSU0_GSUC0_GSUWGMRR0_K1_LBSPPA1024_LBSPPB256_LPA32_MIWT2_4_PLR1_SU32_SUM0_SUS256_VWA2_VWB2_WGM1_WGMXCC1_WGMXCCGn1
    SolutionIndex: 76
    SolutionNameMin: Cijk_Ailk_Bljk_BBS_BH_UserArgs_MT64x128x64_MI16x16x1_SN_LDSB1_CLR1_GSU0_GSUC0_GSUWGMRR0_K1_LBSPPA1024_LBSPPB512_LPA32_MIWT2_4_PLR1_SU32_SUM0_SUS256_VWA2_VWB4_WGM1_WGMXCC1_WGMXCCGn1
    SolutionIndex: 77
    SolutionNameMin: Cijk_Ailk_Bljk_BBS_BH_UserArgs_MT128x64x64_MI16x16x1_SN_LDSB1_CLR1_GSU0_GSUC0_GSUWGMRR0_K1_LBSPPA2048_LBSPPB128_LPA0_MIWT4_2_PLR1_SU32_SUM0_SUS256_VWA4_VWB1_WGM1_WGMXCC1_WGMXCCGn1
    SolutionIndex: 78
    SolutionNameMin: Cijk_Ailk_Bljk_BBS_BH_UserArgs_MT128x64x64_MI16x16x1_SN_LDSB1_CLR1_GSU0_GSUC0_GSUWGMRR0_K1_LBSPPA2048_LBSPPB256_LPA0_MIWT4_2_PLR1_SU32_SUM0_SUS256_VWA4_VWB2_WGM1_WGMXCC1_WGMXCCGn1
    SolutionIndex: 79
    SolutionNameMin: Cijk_Ailk_Bljk_BBS_BH_UserArgs_MT128x64x64_MI16x16x1_SN_LDSB1_CLR1_GSU0_GSUC0_GSUWGMRR0_K1_LBSPPA2048_LBSPPB128_LPA0_MIWT4_2_PLR1_SU32_SUM0_SUS256_VWA4_VWB1_WGM4_WGMXCC1_WGMXCCGn1
    SolutionIndex: 80
    SolutionNameMin: Cijk_Ailk_Bljk_BBS_BH_UserArgs_MT128x64x64_MI16x16x1_SN_LDSB1_CLR1_GSU0_GSUC0_GSUWGMRR0_K1_LBSPPA2048_LBSPPB256_LPA0_MIWT4_2_PLR1_SU32_SUM0_SUS256_VWA4_VWB2_WGM4_WGMXCC1_WGMXCCGn1
    SolutionIndex: 81
    SolutionNameMin: Cijk_Ailk_Bljk_BBS_BH_UserArgs_MT128x64x64_MI16x16x1_SN_LDSB1_CLR1_GSU0_GSUC0_GSUWGMRR0_K1_LBSPPA2048_LBSPPB128_LPA0_MIWT4_2_PLR1_SU32_SUM0_SUS256_VWA4_VWB1_WGM8_WGMXCC1_WGMXCCGn1
    SolutionIndex: 82
    SolutionNameMin: Cijk_Ailk_Bljk_BBS_BH_UserArgs_MT128x64x64_MI16x16x1_SN_LDSB1_CLR1_GSU0_GSUC0_GSUWGMRR0_K1_LBSPPA2048_LBSPPB256_LPA0_MIWT4_2_PLR1_SU32_SUM0_SUS256_VWA4_VWB2_WGM8_WGMXCC1_WGMXCCGn1
    SolutionIndex: 83
    SolutionNameMin: Cijk_Ailk_Bljk_BBS_BH_UserArgs_MT64x64x64_MI16x16x1_SN_LDSB1_CLR1_GSU0_GSUC0_GSUWGMRR0_K1_LBSPPA1024_LBSPPB128_LPA32_MIWT2_2_PLR1_SU32_SUM0_SUS256_VWA2_VWB1_WGM1_WGMXCC1_WGMXCCGn1
    SolutionIndex: 84
    SolutionNameMin: Cijk_Ailk_Bljk_BBS_BH_UserArgs_MT64x64x64_MI16x16x1_SN_LDSB1_CLR1_GSU0_GSUC0_GSUWGMRR0_K1_LBSPPA1024_LBSPPB256_LPA32_MIWT2_2_PLR1_SU32_SUM0_SUS256_VWA2_VWB2_WGM1_WGMXCC1_WGMXCCGn1
    SolutionIndex: 85
    SolutionNameMin: Cijk_Ailk_Bljk_BBS_BH_UserArgs_MT64x64x64_MI16x16x1_SN_LDSB1_CLR1_GSU0_GSUC0_GSUWGMRR0_K1_LBSPPA1024_LBSPPB128_LPA32_MIWT2_2_PLR1_SU32_SUM0_SUS256_VWA2_VWB1_WGM4_WGMXCC1_WGMXCCGn1
    SolutionIndex: 86
    SolutionNameMin: Cijk_Ailk_Bljk_BBS_BH_UserArgs_MT64x64x64_MI16x16x1_SN_LDSB1_CLR1_GSU0_GSUC0_GSUWGMRR0_K1_LBSPPA1024_LBSPPB128_LPA32_MIWT2_2_PLR1_SU32_SUM0_SUS256_VWA2_VWB1_WGM8_WGMXCC1_WGMXCCGn1
    SolutionIndex: 87
    SolutionNameMin: Cijk_Ailk_Bljk_BBS_BH_UserArgs_MT64x64x64_MI16x16x1_SN_LDSB1_CLR1_GSU0_GSUC0_GSUWGMRR0_K1_LBSPPA1024_LBSPPB256_LPA32_MIWT2_2_PLR1_SU32_SUM0_SUS256_VWA2_VWB2_WGM8_WGMXCC1_WGMXCCGn1
    SolutionIndex: 88
    SolutionNameMin: Cijk_Ailk_Bljk_BBS_BH_UserArgs_MT64x32x64_MI16x16x1_SN_LDSB0_CLR1_GSU0_GSUC0_GSUWGMRR0_K1_LBSPPA1024_LBSPPB128_LPA32_MIWT2_1_PLR1_SU32_SUM0_SUS256_VWA2_VWB1_WGM1_WGMXCC1_WGMXCCGn1
    SolutionIndex: 89
    SolutionNameMin: Cijk_Ailk_Bljk_BBS_BH_UserArgs_MT64x32x64_MI16x16x1_SN_LDSB0_CLR1_GSU0_GSUC0_GSUWGMRR0_K1_LBSPPA1024_LBSPPB128_LPA32_MIWT2_1_PLR1_SU32_SUM0_SUS256_VWA2_VWB1_WGM4_WGMXCC1_WGMXCCGn1
    SolutionIndex: 90
    SolutionNameMin: Cijk_Ailk_Bljk_BBS_BH_UserArgs_MT128x64x128_MI16x16x1_SN_LDSB1_CLR1_GSU0_GSUC0_GSUWGMRR0_K1_LBSPPA2048_LBSPPB256_LPA0_MIWT4_2_PLR2_SU32_SUM0_SUS256_VWA4_VWB1_WGM1_WGMXCC1_WGMXCCGn1
    SolutionIndex: 91
    SolutionNameMin: Cijk_Ailk_Bljk_BBS_BH_UserArgs_MT128x64x128_MI16x16x1_SN_LDSB1_CLR1_GSU0_GSUC0_GSUWGMRR0_K1_LBSPPA2048_LBSPPB512_LPA0_MIWT4_2_PLR2_SU32_SUM0_SUS256_VWA4_VWB2_WGM1_WGMXCC1_WGMXCCGn1
    SolutionIndex: 92
    SolutionNameMin: Cijk_Ailk_Bljk_BBS_BH_UserArgs_MT128x64x128_MI16x16x1_SN_LDSB1_CLR1_GSU0_GSUC0_GSUWGMRR0_K1_LBSPPA2048_LBSPPB256_LPA0_MIWT4_2_PLR1_SU32_SUM0_SUS256_VWA4_VWB1_WGM4_WGMXCC1_WGMXCCGn1
    SolutionIndex: 93
    SolutionNameMin: Cijk_Ailk_Bljk_BBS_BH_UserArgs_MT128x64x128_MI16x16x1_SN_LDSB1_CLR1_GSU0_GSUC0_GSUWGMRR0_K1_LBSPPA2048_LBSPPB256_LPA0_MIWT4_2_PLR2_SU32_SUM0_SUS256_VWA4_VWB1_WGM8_WGMXCC1_WGMXCCGn1
    SolutionIndex: 94
    SolutionNameMin: Cijk_Ailk_Bljk_BBS_BH_UserArgs_MT64x64x128_MI16x16x1_SN_LDSB1_CLR1_GSU0_GSUC0_GSUWGMRR0_K1_LBSPPA1024_LBSPPB256_LPA32_MIWT2_2_PLR2_SU32_SUM0_SUS256_VWA2_VWB1_WGM1_WGMXCC1_WGMXCCGn1
    SolutionIndex: 95
    SolutionNameMin: Cijk_Ailk_Bljk_BBS_BH_UserArgs_MT64x64x128_MI16x16x1_SN_LDSB1_CLR1_GSU0_GSUC0_GSUWGMRR0_K1_LBSPPA1024_LBSPPB512_LPA32_MIWT2_2_PLR2_SU32_SUM0_SUS256_VWA2_VWB2_WGM1_WGMXCC1_WGMXCCGn1
    SolutionIndex: 96
    SolutionNameMin: Cijk_Ailk_Bljk_BBS_BH_UserArgs_MT64x32x128_MI16x16x1_SN_LDSB1_CLR1_GSU0_GSUC0_GSUWGMRR0_K1_LBSPPA1024_LBSPPB256_LPA32_MIWT2_1_PLR1_SU32_SUM0_SUS256_VWA2_VWB1_WGM1_WGMXCC1_WGMXCCGn1
    SolutionIndex: 97
    SolutionNameMin: Cijk_Ailk_Bljk_BBS_BH_UserArgs_MT64x32x128_MI16x16x1_SN_LDSB1_CLR1_GSU0_GSUC0_GSUWGMRR0_K1_LBSPPA1024_LBSPPB256_LPA16_MIWT2_1_PLR2_SU32_SUM0_SUS256_VWA1_VWB1_WGM1_WGMXCC1_WGMXCCGn1
    SolutionIndex: 98
    SolutionNameMin: Cijk_Ailk_Bljk_BBS_BH_UserArgs_MT64x32x128_MI16x16x1_SN_LDSB1_CLR1_GSU0_GSUC0_GSUWGMRR0_K1_LBSPPA1024_LBSPPB256_LPA32_MIWT2_1_PLR2_SU32_SUM0_SUS256_VWA2_VWB1_WGM1_WGMXCC1_WGMXCCGn1
    SolutionIndex: 99
    SolutionNameMin: Cijk_Ailk_Bljk_BBS_BH_UserArgs_MT64x32x128_MI16x16x1_SN_LDSB1_CLR1_GSU0_GSUC0_GSUWGMRR0_K1_LBSPPA1024_LBSPPB256_LPA16_MIWT2_1_PLR1_SU32_SUM0_SUS256_VWA1_VWB1_WGM4_WGMXCC1_WGMXCCGn1
    SolutionIndex: 100
    SolutionNameMin: Cijk_Ailk_Bljk_BBS_BH_UserArgs_MT32x32x128_MI16x16x1_SN_LDSB1_CLR1_GSU0_GSUC0_GSUWGMRR0_K1_LBSPPA512_LBSPPB256_LPA16_MIWT1_1_PLR1_SU32_SUM0_SUS256_VWA1_VWB1_WGM1_WGMXCC1_WGMXCCGn1
    SolutionIndex: 101
    SolutionNameMin: Cijk_Ailk_Bljk_BBS_BH_UserArgs_MT32x32x128_MI16x16x1_SN_LDSB1_CLR1_GSU0_GSUC0_GSUWGMRR0_K1_LBSPPA512_LBSPPB256_LPA16_MIWT1_1_PLR2_SU32_SUM0_SUS256_VWA1_VWB1_WGM1_WGMXCC1_WGMXCCGn1
    SolutionIndex: 102
    SolutionNameMin: Cijk_Ailk_Bljk_BBS_BH_UserArgs_MT32x32x32_MI16x16x1_SN_LDSB0_CLR0_GSU0_GSUC0_GSUWGMRR0_K1_LBSPPA256_LBSPPB128_LPA16_MIWT1_1_PLR0_SU32_SUM0_SUS256_VWA1_VWB1_WGM8_WGMXCC1_WGMXCCGn1
- - - [128, 128, 1, 128, 128, 128, 128, 128]
    - [101, 0.098]
  - - [128, 128, 1, 256, 128, 128, 128, 256]
    - [100, 0.109]
  - - [128, 128, 1, 512, 128, 128, 128, 512]
    - [100, 0.181]
  - - [128, 128, 1, 1024, 128, 128, 128, 1024]
    - [100, 0.313]
  - - [128, 128, 1, 2048, 128, 128, 128, 2048]
    - [100, 0.533]
  - - [128, 128, 1, 4096, 128, 128, 128, 4096]
    - [88, 0.827]
  - - [128, 128, 1, 8192, 128, 128, 128, 8192]
    - [98, 1.299]
  - - [128, 256, 1, 128, 128, 128, 128, 128]
    - [98, 0.184]
  - - [128, 256, 1, 256, 128, 128, 128, 256]
    - [101, 0.259]
  - - [128, 256, 1, 512, 128, 128, 128, 512]
    - [101, 0.352]
  - - [128, 256, 1, 1024, 128, 128, 128, 1024]
    - [100, 0.603]
  - - [128, 256, 1, 2048, 128, 128, 128, 2048]
    - [98, 0.891]
  - - [128, 256, 1, 4096, 128, 128, 128, 4096]
    - [89, 1.454]
  - - [128, 256, 1, 8192, 128, 128, 128, 8192]
    - [98, 1.987]
  - - [128, 512, 1, 128, 128, 128, 128, 128]
    - [97, 0.302]
  - - [128, 512, 1, 256, 128, 128, 128, 256]
    - [100, 0.513]
  - - [128, 512, 1, 512, 128, 128, 128, 512]
    - [101, 0.769]
  - - [128, 512, 1, 1024, 128, 128, 128, 1024]
    - [100, 1.11]
  - - [128, 512, 1, 2048, 128, 128, 128, 2048]
    - [96, 1.544]
  - - [128, 512, 1, 4096, 128, 128, 128, 4096]
    - [84, 2.24]
  - - [128, 512, 1, 8192, 128, 128, 128, 8192]
    - [77, 2.782]
  - - [128, 1024, 1, 128, 128, 128, 128, 128]
    - [95, 0.578]
  - - [128, 1024, 1, 256, 128, 128, 128, 256]
    - [88, 0.939]
  - - [128, 1024, 1, 512, 128, 128, 128, 512]
    - [98, 1.407]
  - - [128, 1024, 1, 1024, 128, 128, 128, 1024]
    - [98, 1.984]
  - - [128, 1024, 1, 2048, 128, 128, 128, 2048]
    - [48, 2.276]
  - - [128, 1024, 1, 4096, 128, 128, 128, 4096]
    - [82, 3.463]
  - - [128, 1024, 1, 8192, 128, 128, 128, 8192]
    - [69, 3.488]
  - - [128, 2048, 1, 128, 128, 128, 128, 128]
    - [85, 0.966]
  - - [128, 2048, 1, 256, 128, 128, 128, 256]
    - [84, 1.596]
  - - [128, 2048, 1, 512, 128, 128, 128, 512]
    - [84, 2.369]
  - - [128, 2048, 1, 1024, 128, 128, 128, 1024]
    - [78, 2.536]
  - - [128, 2048, 1, 2048, 128, 128, 128, 2048]
    - [90, 2.78]
  - - [128, 2048, 1, 4096, 128, 128, 128, 4096]
    - [77, 3.879]
  - - [128, 2048, 1, 8192, 128, 128, 128, 8192]
    - [78, 4.483]
  - - [128, 4096, 1, 128, 128, 128, 128, 128]
    - [76, 1.577]
  - - [128, 4096, 1, 256, 128, 128, 128, 256]
    - [79, 2.315]
  - - [128, 4096, 1, 512, 128, 128, 128, 512]
    - [78, 3.314]
  - - [128, 4096, 1, 1024, 128, 128, 128, 1024]
    - [92, 3.575]
  - - [128, 4096, 1, 2048, 128, 128, 128, 2048]
    - [86, 3.6]
  - - [128, 4096, 1, 4096, 128, 128, 128, 4096]
    - [79, 4.629]
  - - [128, 4096, 1, 8192, 128, 128, 128, 8192]
    - [80, 5.496]
  - - [128, 8192, 1, 128, 128, 128, 128, 128]
    - [45, 1.666]
  - - [128, 8192, 1, 256, 128, 128, 128, 256]
    - [39, 2.823]
  - - [128, 8192, 1, 512, 128, 128, 128, 512]
    - [67, 3.713]
  - - [128, 8192, 1, 1024, 128, 128, 128, 1024]
    - [87, 4.245]
  - - [128, 8192, 1, 2048, 128, 128, 128, 2048]
    - [78, 4.818]
  - - [128, 8192, 1, 4096, 128, 128, 128, 4096]
    - [79, 5.395]
  - - [128, 8192, 1, 8192, 128, 128, 128, 8192]
    - [58, 5.259]
  - - [256, 128, 1, 128, 256, 256, 256, 128]
    - [100, 0.172]
  - - [256, 128, 1, 256, 256, 256, 256, 256]
    - [100, 0.246]
  - - [256, 128, 1, 512, 256, 256, 256, 512]
    - [101, 0.338]
  - - [256, 128, 1, 1024, 256, 256, 256, 1024]
    - [100, 0.583]
  - - [256, 128, 1, 2048, 256, 256, 256, 2048]
    - [98, 0.902]
  - - [256, 128, 1, 4096, 256, 256, 256, 4096]
    - [88, 1.433]
  - - [256, 128, 1, 8192, 256, 256, 256, 8192]
    - [96, 1.924]
  - - [256, 256, 1, 128, 256, 256, 256, 128]
    - [99, 0.323]
  - - [256, 256, 1, 256, 256, 256, 256, 256]
    - [100, 0.504]
  - - [256, 256, 1, 512, 256, 256, 256, 512]
    - [101, 0.79]
  - - [256, 256, 1, 1024, 256, 256, 256, 1024]
    - [101, 1.118]
  - - [256, 256, 1, 2048, 256, 256, 256, 2048]
    - [96, 1.504]
  - - [256, 256, 1, 4096, 256, 256, 256, 4096]
    - [84, 2.253]
  - - [256, 256, 1, 8192, 256, 256, 256, 8192]
    - [47, 2.824]
  - - [256, 512, 1, 128, 256, 256, 256, 128]
    - [95, 0.583]
  - - [256, 512, 1, 256, 256, 256, 256, 256]
    - [88, 0.94]
  - - [256, 512, 1, 512, 256, 256, 256, 512]
    - [88, 1.405]
  - - [256, 512, 1, 1024, 256, 256, 256, 1024]
    - [98, 1.954]
  - - [256, 512, 1, 2048, 256, 256, 256, 2048]
    - [47, 2.324]
  - - [256, 512, 1, 4096, 256, 256, 256, 4096]
    - [79, 3.445]
  - - [256, 512, 1, 8192, 256, 256, 256, 8192]
    - [30, 3.573]
  - - [256, 1024, 1, 128, 256, 256, 256, 128]
    - [83, 0.988]
  - - [256, 1024, 1, 256, 256, 256, 256, 256]
    - [84, 1.537]
  - - [256, 1024, 1, 512, 256, 256, 256, 512]
    - [84, 2.39]
  - - [256, 1024, 1, 1024, 256, 256, 256, 1024]
    - [81, 2.578]
  - - [256, 1024, 1, 2048, 256, 256, 256, 2048]
    - [32, 2.993]
  - - [256, 1024, 1, 4096, 256, 256, 256, 4096]
    - [78, 3.929]
  - - [256, 1024, 1, 8192, 256, 256, 256, 8192]
    - [18, 4.738]
  - - [256, 2048, 1, 128, 256, 256, 256, 128]
    - [76, 1.576]
  - - [256, 2048, 1, 256, 256, 256, 256, 256]
    - [76, 2.426]
  - - [256, 2048, 1, 512, 256, 256, 256, 512]
    - [78, 3.399]
  - - [256, 2048, 1, 1024, 256, 256, 256, 1024]
    - [90, 3.619]
  - - [256, 2048, 1, 2048, 256, 256, 256, 2048]
    - [12, 3.897]
  - - [256, 2048, 1, 4096, 256, 256, 256, 4096]
    - [78, 4.689]
  - - [256, 2048, 1, 8192, 256, 256, 256, 8192]
    - [22, 5.242]
  - - [256, 4096, 1, 128, 256, 256, 256, 128]
    - [33, 2.087]
  - - [256, 4096, 1, 256, 256, 256, 256, 256]
    - [31, 3.013]
  - - [256, 4096, 1, 512, 256, 256, 256, 512]
    - [70, 3.846]
  - - [256, 4096, 1, 1024, 256, 256, 256, 1024]
    - [84, 4.323]
  - - [256, 4096, 1, 2048, 256, 256, 256, 2048]
    - [83, 4.828]
  - - [256, 4096, 1, 4096, 256, 256, 256, 4096]
    - [14, 5.343]
  - - [256, 4096, 1, 8192, 256, 256, 256, 8192]
    - [63, 5.886]
  - - [256, 8192, 1, 128, 256, 256, 256, 128]
    - [17, 2.821]
  - - [256, 8192, 1, 256, 256, 256, 256, 256]
    - [13, 4.103]
  - - [256, 8192, 1, 512, 256, 256, 256, 512]
    - [77, 4.553]
  - - [256, 8192, 1, 1024, 256, 256, 256, 1024]
    - [77, 5.465]
  - - [256, 8192, 1, 2048, 256, 256, 256, 2048]
    - [77, 6.205]
  - - [256, 8192, 1, 4096, 256, 256, 256, 4096]
    - [26, 6.235]
  - - [256, 8192, 1, 8192, 256, 256, 256, 8192]
    - [32, 6.398]
  - - [512, 128, 1, 128, 512, 512, 512, 128]
    - [98, 0.315]
  - - [512, 128, 1, 256, 512, 512, 512, 256]
    - [52, 0.491]
  - - [512, 128, 1, 512, 512, 512, 512, 512]
    - [100, 0.792]
  - - [512, 128, 1, 1024, 512, 512, 512, 1024]
    - [101, 1.11]
  - - [512, 128, 1, 2048, 512, 512, 512, 2048]
    - [96, 1.523]
  - - [512, 128, 1, 4096, 512, 512, 512, 4096]
    - [84, 2.334]
  - - [512, 128, 1, 8192, 512, 512, 512, 8192]
    - [50, 2.768]
  - - [512, 256, 1, 128, 512, 512, 512, 128]
    - [95, 0.577]
  - - [512, 256, 1, 256, 512, 512, 512, 256]
    - [88, 0.952]
  - - [512, 256, 1, 512, 512, 512, 512, 512]
    - [88, 1.388]
  - - [512, 256, 1, 1024, 512, 512, 512, 1024]
    - [98, 1.964]
  - - [512, 256, 1, 2048, 512, 512, 512, 2048]
    - [47, 2.405]
  - - [512, 256, 1, 4096, 512, 512, 512, 4096]
    - [77, 3.531]
  - - [512, 256, 1, 8192, 512, 512, 512, 8192]
    - [71, 3.536]
  - - [512, 512, 1, 128, 512, 512, 512, 128]
    - [51, 0.991]
  - - [512, 512, 1, 256, 512, 512, 512, 256]
    - [83, 1.594]
  - - [512, 512, 1, 512, 512, 512, 512, 512]
    - [83, 2.39]
  - - [512, 512, 1, 1024, 512, 512, 512, 1024]
    - [79, 2.547]
  - - [512, 512, 1, 2048, 512, 512, 512, 2048]
    - [41, 2.997]
  - - [512, 512, 1, 4096, 512, 512, 512, 4096]
    - [82, 3.772]
  - - [512, 512, 1, 8192, 512, 512, 512, 8192]
    - [14, 4.808]
  - - [512, 1024, 1, 128, 512, 512, 512, 128]
    - [74, 1.579]
  - - [512, 1024, 1, 256, 512, 512, 512, 256]
    - [75, 2.401]
  - - [512, 1024, 1, 512, 512, 512, 512, 512]
    - [78, 3.476]
  - - [512, 1024, 1, 1024, 512, 512, 512, 1024]
    - [93, 3.695]
  - - [512, 1024, 1, 2048, 512, 512, 512, 2048]
    - [24, 3.918]
  - - [512, 1024, 1, 4096, 512, 512, 512, 4096]
    - [81, 4.545]
  - - [512, 1024, 1, 8192, 512, 512, 512, 8192]
    - [20, 5.261]
  - - [512, 2048, 1, 128, 512, 512, 512, 128]
    - [37, 2.064]
  - - [512, 2048, 1, 256, 512, 512, 512, 256]
    - [31, 3.151]
  - - [512, 2048, 1, 512, 512, 512, 512, 512]
    - [67, 3.868]
  - - [512, 2048, 1, 1024, 512, 512, 512, 1024]
    - [84, 4.405]
  - - [512, 2048, 1, 2048, 512, 512, 512, 2048]
    - [77, 4.942]
  - - [512, 2048, 1, 4096, 512, 512, 512, 4096]
    - [82, 4.714]
  - - [512, 2048, 1, 8192, 512, 512, 512, 8192]
    - [65, 6.064]
  - - [512, 4096, 1, 128, 512, 512, 512, 128]
    - [13, 2.905]
  - - [512, 4096, 1, 256, 512, 512, 512, 256]
    - [19, 4.164]
  - - [512, 4096, 1, 512, 512, 512, 512, 512]
    - [60, 4.581]
  - - [512, 4096, 1, 1024, 512, 512, 512, 1024]
    - [82, 5.592]
  - - [512, 4096, 1, 2048, 512, 512, 512, 2048]
    - [77, 6.303]
  - - [512, 4096, 1, 4096, 512, 512, 512, 4096]
    - [32, 5.769]
  - - [512, 4096, 1, 8192, 512, 512, 512, 8192]
    - [56, 5.583]
  - - [512, 8192, 1, 128, 512, 512, 512, 128]
    - [45, 3.175]
  - - [512, 8192, 1, 256, 512, 512, 512, 256]
    - [31, 4.481]
  - - [512, 8192, 1, 512, 512, 512, 512, 512]
    - [44, 5.844]
  - - [512, 8192, 1, 1024, 512, 512, 512, 1024]
    - [37, 6.862]
  - - [512, 8192, 1, 2048, 512, 512, 512, 2048]
    - [66, 6.665]
  - - [512, 8192, 1, 4096, 512, 512, 512, 4096]
    - [62, 6.433]
  - - [512, 8192, 1, 8192, 512, 512, 512, 8192]
    - [28, 7.283]
  - - [1024, 128, 1, 128, 1024, 1024, 1024, 128]
    - [94, 0.577]
  - - [1024, 128, 1, 256, 1024, 1024, 1024, 256]
    - [88, 0.953]
  - - [1024, 128, 1, 512, 1024, 1024, 1024, 512]
    - [98, 1.419]
  - - [1024, 128, 1, 1024, 1024, 1024, 1024, 1024]
    - [98, 1.954]
  - - [1024, 128, 1, 2048, 1024, 1024, 1024, 2048]
    - [49, 2.225]
  - - [1024, 128, 1, 4096, 1024, 1024, 1024, 4096]
    - [78, 3.467]
  - - [1024, 128, 1, 8192, 1024, 1024, 1024, 8192]
    - [66, 3.39]
  - - [1024, 256, 1, 128, 1024, 1024, 1024, 128]
    - [83, 1.0]
  - - [1024, 256, 1, 256, 1024, 1024, 1024, 256]
    - [83, 1.596]
  - - [1024, 256, 1, 512, 1024, 1024, 1024, 512]
    - [84, 2.362]
  - - [1024, 256, 1, 1024, 1024, 1024, 1024, 1024]
    - [77, 2.601]
  - - [1024, 256, 1, 2048, 1024, 1024, 1024, 2048]
    - [79, 3.04]
  - - [1024, 256, 1, 4096, 1024, 1024, 1024, 4096]
    - [79, 3.89]
  - - [1024, 256, 1, 8192, 1024, 1024, 1024, 8192]
    - [14, 4.806]
  - - [1024, 512, 1, 128, 1024, 1024, 1024, 128]
    - [75, 1.585]
  - - [1024, 512, 1, 256, 1024, 1024, 1024, 256]
    - [75, 2.465]
  - - [1024, 512, 1, 512, 1024, 1024, 1024, 512]
    - [77, 3.507]
  - - [1024, 512, 1, 1024, 1024, 1024, 1024, 1024]
    - [90, 3.641]
  - - [1024, 512, 1, 2048, 1024, 1024, 1024, 2048]
    - [26, 3.826]
  - - [1024, 512, 1, 4096, 1024, 1024, 1024, 4096]
    - [16, 4.482]
  - - [1024, 512, 1, 8192, 1024, 1024, 1024, 8192]
    - [68, 5.37]
  - - [1024, 1024, 1, 128, 1024, 1024, 1024, 128]
    - [37, 2.108]
  - - [1024, 1024, 1, 256, 1024, 1024, 1024, 256]
    - [36, 3.052]
  - - [1024, 1024, 1, 512, 1024, 1024, 1024, 512]
    - [66, 3.893]
  - - [1024, 1024, 1, 1024, 1024, 1024, 1024, 1024]
    - [84, 4.406]
  - - [1024, 1024, 1, 2048, 1024, 1024, 1024, 2048]
    - [81, 4.846]
  - - [1024, 1024, 1, 4096, 1024, 1024, 1024, 4096]
    - [16, 5.625]
  - - [1024, 1024, 1, 8192, 1024, 1024, 1024, 8192]
    - [55, 6.118]
  - - [1024, 2048, 1, 128, 1024, 1024, 1024, 128]
    - [19, 2.814]
  - - [1024, 2048, 1, 256, 1024, 1024, 1024, 256]
    - [23, 4.176]
  - - [1024, 2048, 1, 512, 1024, 1024, 1024, 512]
    - [77, 4.658]
  - - [1024, 2048, 1, 1024, 1024, 1024, 1024, 1024]
    - [78, 5.677]
  - - [1024, 2048, 1, 2048, 1024, 1024, 1024, 2048]
    - [80, 6.128]
  - - [1024, 2048, 1, 4096, 1024, 1024, 1024, 4096]
    - [18, 5.992]
  - - [1024, 2048, 1, 8192, 1024, 1024, 1024, 8192]
    - [14, 6.982]
  - - [1024, 4096, 1, 128, 1024, 1024, 1024, 128]
    - [17, 3.18]
  - - [1024, 4096, 1, 256, 1024, 1024, 1024, 256]
    - [37, 4.649]
  - - [1024, 4096, 1, 512, 1024, 1024, 1024, 512]
    - [37, 6.068]
  - - [1024, 4096, 1, 1024, 1024, 1024, 1024, 1024]
    - [36, 6.85]
  - - [1024, 4096, 1, 2048, 1024, 1024, 1024, 2048]
    - [67, 6.965]
  - - [1024, 4096, 1, 4096, 1024, 1024, 1024, 4096]
    - [22, 7.059]
  - - [1024, 4096, 1, 8192, 1024, 1024, 1024, 8192]
    - [18, 6.954]
  - - [1024, 8192, 1, 128, 1024, 1024, 1024, 128]
    - [18, 3.426]
  - - [1024, 8192, 1, 256, 1024, 1024, 1024, 256]
    - [17, 5.526]
  - - [1024, 8192, 1, 512, 1024, 1024, 1024, 512]
    - [19, 7.057]
  - - [1024, 8192, 1, 1024, 1024, 1024, 1024, 1024]
    - [12, 7.913]
  - - [1024, 8192, 1, 2048, 1024, 1024, 1024, 2048]
    - [54, 7.558]
  - - [1024, 8192, 1, 4096, 1024, 1024, 1024, 4096]
    - [19, 7.228]
  - - [1024, 8192, 1, 8192, 1024, 1024, 1024, 8192]
    - [64, 7.503]
  - - [2048, 128, 1, 128, 2048, 2048, 2048, 128]
    - [87, 0.996]
  - - [2048, 128, 1, 256, 2048, 2048, 2048, 256]
    - [83, 1.584]
  - - [2048, 128, 1, 512, 2048, 2048, 2048, 512]
    - [83, 2.376]
  - - [2048, 128, 1, 1024, 2048, 2048, 2048, 1024]
    - [78, 2.567]
  - - [2048, 128, 1, 2048, 2048, 2048, 2048, 2048]
    - [32, 2.957]
  - - [2048, 128, 1, 4096, 2048, 2048, 2048, 4096]
    - [80, 3.713]
  - - [2048, 128, 1, 8192, 2048, 2048, 2048, 8192]
    - [12, 4.497]
  - - [2048, 256, 1, 128, 2048, 2048, 2048, 128]
    - [46, 1.581]
  - - [2048, 256, 1, 256, 2048, 2048, 2048, 256]
    - [77, 2.44]
  - - [2048, 256, 1, 512, 2048, 2048, 2048, 512]
    - [78, 3.296]
  - - [2048, 256, 1, 1024, 2048, 2048, 2048, 1024]
    - [91, 3.43]
  - - [2048, 256, 1, 2048, 2048, 2048, 2048, 2048]
    - [26, 3.885]
  - - [2048, 256, 1, 4096, 2048, 2048, 2048, 4096]
    - [81, 4.293]
  - - [2048, 256, 1, 8192, 2048, 2048, 2048, 8192]
    - [28, 5.404]
  - - [2048, 512, 1, 128, 2048, 2048, 2048, 128]
    - [33, 2.103]
  - - [2048, 512, 1, 256, 2048, 2048, 2048, 256]
    - [35, 3.069]
  - - [2048, 512, 1, 512, 2048, 2048, 2048, 512]
    - [78, 3.733]
  - - [2048, 512, 1, 1024, 2048, 2048, 2048, 1024]
    - [83, 4.305]
  - - [2048, 512, 1, 2048, 2048, 2048, 2048, 2048]
    - [81, 4.593]
  - - [2048, 512, 1, 4096, 2048, 2048, 2048, 4096]
    - [24, 5.433]
  - - [2048, 512, 1, 8192, 2048, 2048, 2048, 8192]
    - [57, 5.941]
  - - [2048, 1024, 1, 128, 2048, 2048, 2048, 128]
    - [23, 2.822]
  - - [2048, 1024, 1, 256, 2048, 2048, 2048, 256]
    - [21, 4.064]
  - - [2048, 1024, 1, 512, 2048, 2048, 2048, 512]
    - [79, 4.554]
  - - [2048, 1024, 1, 1024, 2048, 2048, 2048, 1024]
    - [77, 5.549]
  - - [2048, 1024, 1, 2048, 2048, 2048, 2048, 2048]
    - [77, 5.996]
  - - [2048, 1024, 1, 4096, 2048, 2048, 2048, 4096]
    - [66, 5.656]
  - - [2048, 1024, 1, 8192, 2048, 2048, 2048, 8192]
    - [12, 6.928]
  - - [2048, 2048, 1, 128, 2048, 2048, 2048, 128]
    - [35, 3.266]
  - - [2048, 2048, 1, 256, 2048, 2048, 2048, 256]
    - [35, 4.667]
  - - [2048, 2048, 1, 512, 2048, 2048, 2048, 512]
    - [34, 5.911]
  - - [2048, 2048, 1, 1024, 2048, 2048, 2048, 1024]
    - [40, 6.566]
  - - [2048, 2048, 1, 2048, 2048, 2048, 2048, 2048]
    - [68, 6.855]
  - - [2048, 2048, 1, 4096, 2048, 2048, 2048, 4096]
    - [16, 6.659]
  - - [2048, 2048, 1, 8192, 2048, 2048, 2048, 8192]
    - [53, 7.415]
  - - [2048, 4096, 1, 128, 2048, 2048, 2048, 128]
    - [23, 3.656]
  - - [2048, 4096, 1, 256, 2048, 2048, 2048, 256]
    - [23, 5.586]
  - - [2048, 4096, 1, 512, 2048, 2048, 2048, 512]
    - [23, 7.0]
  - - [2048, 4096, 1, 1024, 2048, 2048, 2048, 1024]
    - [15, 8.188]
  - - [2048, 4096, 1, 2048, 2048, 2048, 2048, 2048]
    - [54, 7.826]
  - - [2048, 4096, 1, 4096, 2048, 2048, 2048, 4096]
    - [28, 7.606]
  - - [2048, 4096, 1, 8192, 2048, 2048, 2048, 8192]
    - [0, 8.056]
  - - [2048, 8192, 1, 128, 2048, 2048, 2048, 128]
    - [3, 2.953]
  - - [2048, 8192, 1, 256, 2048, 2048, 2048, 256]
    - [9, 4.534]
  - - [2048, 8192, 1, 512, 2048, 2048, 2048, 512]
    - [5, 6.011]
  - - [2048, 8192, 1, 1024, 2048, 2048, 2048, 1024]
    - [5, 7.29]
  - - [2048, 8192, 1, 2048, 2048, 2048, 2048, 2048]
    - [16, 7.937]
  - - [2048, 8192, 1, 4096, 2048, 2048, 2048, 4096]
    - [63, 7.726]
  - - [2048, 8192, 1, 8192, 2048, 2048, 2048, 8192]
    - [53, 8.171]
  - - [4096, 128, 1, 128, 4096, 4096, 4096, 128]
    - [74, 1.629]
  - - [4096, 128, 1, 256, 4096, 4096, 4096, 256]
    - [80, 2.423]
  - - [4096, 128, 1, 512, 4096, 4096, 4096, 512]
    - [77, 3.259]
  - - [4096, 128, 1, 1024, 4096, 4096, 4096, 1024]
    - [90, 3.393]
  - - [4096, 128, 1, 2048, 4096, 4096, 4096, 2048]
    - [24, 3.999]
  - - [4096, 128, 1, 4096, 4096, 4096, 4096, 4096]
    - [82, 4.646]
  - - [4096, 128, 1, 8192, 4096, 4096, 4096, 8192]
    - [16, 5.605]
  - - [4096, 256, 1, 128, 4096, 4096, 4096, 128]
    - [31, 2.111]
  - - [4096, 256, 1, 256, 4096, 4096, 4096, 256]
    - [31, 2.982]
  - - [4096, 256, 1, 512, 4096, 4096, 4096, 512]
    - [72, 3.705]
  - - [4096, 256, 1, 1024, 4096, 4096, 4096, 1024]
    - [85, 4.186]
  - - [4096, 256, 1, 2048, 4096, 4096, 4096, 2048]
    - [80, 4.943]
  - - [4096, 256, 1, 4096, 4096, 4096, 4096, 4096]
    - [16, 5.479]
  - - [4096, 256, 1, 8192, 4096, 4096, 4096, 8192]
    - [54, 6.077]
  - - [4096, 512, 1, 128, 4096, 4096, 4096, 128]
    - [17, 2.885]
  - - [4096, 512, 1, 256, 4096, 4096, 4096, 256]
    - [15, 4.17]
  - - [4096, 512, 1, 512, 4096, 4096, 4096, 512]
    - [81, 4.579]
  - - [4096, 512, 1, 1024, 4096, 4096, 4096, 1024]
    - [82, 5.393]
  - - [4096, 512, 1, 2048, 4096, 4096, 4096, 2048]
    - [81, 6.132]
  - - [4096, 512, 1, 4096, 4096, 4096, 4096, 4096]
    - [22, 5.938]
  - - [4096, 512, 1, 8192, 4096, 4096, 4096, 8192]
    - [24, 7.217]
  - - [4096, 1024, 1, 128, 4096, 4096, 4096, 128]
    - [31, 3.314]
  - - [4096, 1024, 1, 256, 4096, 4096, 4096, 256]
    - [33, 4.715]
  - - [4096, 1024, 1, 512, 4096, 4096, 4096, 512]
    - [38, 5.766]
  - - [4096, 1024, 1, 1024, 4096, 4096, 4096, 1024]
    - [33, 6.564]
  - - [4096, 1024, 1, 2048, 4096, 4096, 4096, 2048]
    - [73, 6.924]
  - - [4096, 1024, 1, 4096, 4096, 4096, 4096, 4096]
    - [14, 7.476]
  - - [4096, 1024, 1, 8192, 4096, 4096, 4096, 8192]
    - [12, 7.692]
  - - [4096, 2048, 1, 128, 4096, 4096, 4096, 128]
    - [25, 3.741]
  - - [4096, 2048, 1, 256, 4096, 4096, 4096, 256]
    - [21, 5.493]
  - - [4096, 2048, 1, 512, 4096, 4096, 4096, 512]
    - [29, 6.972]
  - - [4096, 2048, 1, 1024, 4096, 4096, 4096, 1024]
    - [19, 8.098]
  - - [4096, 2048, 1, 2048, 4096, 4096, 4096, 2048]
    - [59, 7.779]
  - - [4096, 2048, 1, 4096, 4096, 4096, 4096, 4096]
    - [16, 8.261]
  - - [4096, 2048, 1, 8192, 4096, 4096, 4096, 8192]
    - [11, 7.906]
  - - [4096, 4096, 1, 128, 4096, 4096, 4096, 128]
    - [5, 3.218]
  - - [4096, 4096, 1, 256, 4096, 4096, 4096, 256]
    - [8, 4.731]
  - - [4096, 4096, 1, 512, 4096, 4096, 4096, 512]
    - [4, 6.424]
  - - [4096, 4096, 1, 1024, 4096, 4096, 4096, 1024]
    - [6, 7.656]
  - - [4096, 4096, 1, 2048, 4096, 4096, 4096, 2048]
    - [16, 8.33]
  - - [4096, 4096, 1, 4096, 4096, 4096, 4096, 4096]
    - [12, 8.683]
  - - [4096, 4096, 1, 8192, 4096, 4096, 4096, 8192]
    - [55, 8.317]
  - - [4096, 8192, 1, 128, 4096, 4096, 4096, 128]
    - [14, 3.383]
  - - [4096, 8192, 1, 256, 4096, 4096, 4096, 256]
    - [30, 4.71]
  - - [4096, 8192, 1, 512, 4096, 4096, 4096, 512]
    - [20, 6.377]
  - - [4096, 8192, 1, 1024, 4096, 4096, 4096, 1024]
    - [22, 7.536]
  - - [4096, 8192, 1, 2048, 4096, 4096, 4096, 2048]
    - [16, 8.198]
  - - [4096, 8192, 1, 4096, 4096, 4096, 4096, 4096]
    - [12, 8.527]
  - - [4096, 8192, 1, 8192, 4096, 4096, 4096, 8192]
    - [7, 8.593]
  - - [8192, 128, 1, 128, 8192, 8192, 8192, 128]
    - [31, 2.165]
  - - [8192, 128, 1, 256, 8192, 8192, 8192, 256]
    - [33, 2.913]
  - - [8192, 128, 1, 512, 8192, 8192, 8192, 512]
    - [79, 3.6]
  - - [8192, 128, 1, 1024, 8192, 8192, 8192, 1024]
    - [87, 4.21]
  - - [8192, 128, 1, 2048, 8192, 8192, 8192, 2048]
    - [80, 4.932]
  - - [8192, 128, 1, 4096, 8192, 8192, 8192, 4096]
    - [14, 5.67]
  - - [8192, 128, 1, 8192, 8192, 8192, 8192, 8192]
    - [24, 6.217]
  - - [8192, 256, 1, 128, 8192, 8192, 8192, 128]
    - [25, 2.848]
  - - [8192, 256, 1, 256, 8192, 8192, 8192, 256]
    - [15, 4.109]
  - - [8192, 256, 1, 512, 8192, 8192, 8192, 512]
    - [82, 4.513]
  - - [8192, 256, 1, 1024, 8192, 8192, 8192, 1024]
    - [82, 5.468]
  - - [8192, 256, 1, 2048, 8192, 8192, 8192, 2048]
    - [81, 6.087]
  - - [8192, 256, 1, 4096, 8192, 8192, 8192, 4096]
    - [28, 6.304]
  - - [8192, 256, 1, 8192, 8192, 8192, 8192, 8192]
    - [17, 7.112]
  - - [8192, 512, 1, 128, 8192, 8192, 8192, 128]
    - [34, 3.287]
  - - [8192, 512, 1, 256, 8192, 8192, 8192, 256]
    - [37, 4.611]
  - - [8192, 512, 1, 512, 8192, 8192, 8192, 512]
    - [36, 5.898]
  - - [8192, 512, 1, 1024, 8192, 8192, 8192, 1024]
    - [42, 6.519]
  - - [8192, 512, 1, 2048, 8192, 8192, 8192, 2048]
    - [69, 6.78]
  - - [8192, 512, 1, 4096, 8192, 8192, 8192, 4096]
    - [28, 7.266]
  - - [8192, 512, 1, 8192, 8192, 8192, 8192, 8192]
    - [12, 8.351]
  - - [8192, 1024, 1, 128, 8192, 8192, 8192, 128]
    - [27, 3.758]
  - - [8192, 1024, 1, 256, 8192, 8192, 8192, 256]
    - [23, 5.502]
  - - [8192, 1024, 1, 512, 8192, 8192, 8192, 512]
    - [24, 6.965]
  - - [8192, 1024, 1, 1024, 8192, 8192, 8192, 1024]
    - [24, 8.067]
  - - [8192, 1024, 1, 2048, 8192, 8192, 8192, 2048]
    - [61, 7.733]
  - - [8192, 1024, 1, 4096, 8192, 8192, 8192, 4096]
    - [14, 8.229]
  - - [8192, 1024, 1, 8192, 8192, 8192, 8192, 8192]
    - [16, 8.14]
  - - [8192, 2048, 1, 128, 8192, 8192, 8192, 128]
    - [4, 3.157]
  - - [8192, 2048, 1, 256, 8192, 8192, 8192, 256]
    - [2, 4.735]
  - - [8192, 2048, 1, 512, 8192, 8192, 8192, 512]
    - [10, 6.242]
  - - [8192, 2048, 1, 1024, 8192, 8192, 8192, 1024]
    - [5, 7.611]
  - - [8192, 2048, 1, 2048, 8192, 8192, 8192, 2048]
    - [16, 8.31]
  - - [8192, 2048, 1, 4096, 8192, 8192, 8192, 4096]
    - [12, 9.019]
  - - [8192, 2048, 1, 8192, 8192, 8192, 8192, 8192]
    - [28, 8.522]
  - - [8192, 4096, 1, 128, 8192, 8192, 8192, 128]
    - [43, 3.315]
  - - [8192, 4096, 1, 256, 8192, 8192, 8192, 256]
    - [33, 4.592]
  - - [8192, 4096, 1, 512, 8192, 8192, 8192, 512]
    - [28, 6.367]
  - - [8192, 4096, 1, 1024, 8192, 8192, 8192, 1024]
    - [20, 7.625]
  - - [8192, 4096, 1, 2048, 8192, 8192, 8192, 2048]
    - [20, 8.086]
  - - [8192, 4096, 1, 4096, 8192, 8192, 8192, 4096]
    - [12, 8.589]
  - - [8192, 4096, 1, 8192, 8192, 8192, 8192, 8192]
    - [1, 8.739]
  - - [8192, 8192, 1, 128, 8192, 8192, 8192, 128]
    - [18, 3.305]
  - - [8192, 8192, 1, 256, 8192, 8192, 8192, 256]
    - [26, 4.922]
  - - [8192, 8192, 1, 512, 8192, 8192, 8192, 512]
    - [14, 6.595]
  - - [8192, 8192, 1, 1024, 8192, 8192, 8192, 1024]
    - [18, 7.801]
  - - [8192, 8192, 1, 2048, 8192, 8192, 8192, 2048]
    - [26, 8.25]
  - - [8192, 8192, 1, 4096, 8192, 8192, 8192, 4096]
    - [27, 8.606]
  - - [8192, 8192, 1, 8192, 8192, 8192, 8192, 8192]
    - [16, 8.317]
  - - [1, 1, 1, 32, 1, 1, 1, 32]
    - [102, 0.0]
- null
- null
- DeviceEfficiency
- GridBased
