library/src/amd_detail/rocblaslt/src/Tensile/Logic/streamk/gfx942_38cu/aquavanjaram942_Cijk_Ailk_Bljk_HSS_BH_UserArgs.yaml
- {MinimumRequiredVersion: 4.33.0}
- aquavanjaram942
- {Architecture: gfx942, CUCount: 38}
- [Device 0049, Device 0050]
    SolutionIndex: 0
    SolutionNameMin: Cijk_Ailk_Bljk_HSS_BH_UserArgs_MT256x256x32_MI16x16x1_SN_LDSB1_CLR1_GSU0_GSUC0_GSUWGMRR0_K1_LBSPPA2048_LBSPPB128_LPA32_MIWT8_8_PLR1_SU32_SUM0_SUS256_VWA2_VWB2_WGM1_WGMXCC1_WGMXCCGn1
    SolutionIndex: 1
    SolutionNameMin: Cijk_Ailk_Bljk_HSS_BH_UserArgs_MT256x256x32_MI16x16x1_SN_LDSB1_CLR1_GSU0_GSUC0_GSUWGMRR0_K1_LBSPPA2048_LBSPPB128_LPA0_MIWT8_8_PLR1_SU32_SUM0_SUS256_VWA4_VWB2_WGM1_WGMXCC1_WGMXCCGn1
    SolutionIndex: 2
    SolutionNameMin: Cijk_Ailk_Bljk_HSS_BH_UserArgs_MT256x256x32_MI16x16x1_SN_LDSB1_CLR1_GSU0_GSUC0_GSUWGMRR0_K1_LBSPPA2048_LBSPPB256_LPA0_MIWT8_8_PLR1_SU32_SUM0_SUS256_VWA4_VWB4_WGM1_WGMXCC1_WGMXCCGn1
    SolutionIndex: 3
    SolutionNameMin: Cijk_Ailk_Bljk_HSS_BH_UserArgs_MT256x256x32_MI16x16x1_SN_LDSB1_CLR1_GSU0_GSUC0_GSUWGMRR0_K1_LBSPPA2048_LBSPPB512_LPA32_MIWT8_8_PLR1_SU32_SUM0_SUS256_VWA2_VWB8_WGM1_WGMXCC1_WGMXCCGn1
    SolutionIndex: 4
    SolutionNameMin: Cijk_Ailk_Bljk_HSS_BH_UserArgs_MT256x256x32_MI16x16x1_SN_LDSB1_CLR1_GSU0_GSUC0_GSUWGMRR0_K1_LBSPPA2048_LBSPPB512_LPA0_MIWT8_8_PLR1_SU32_SUM0_SUS256_VWA4_VWB8_WGM1_WGMXCC1_WGMXCCGn1
    SolutionIndex: 5
    SolutionNameMin: Cijk_Ailk_Bljk_HSS_BH_UserArgs_MT256x256x32_MI16x16x1_SN_LDSB1_CLR1_GSU0_GSUC0_GSUWGMRR0_K1_LBSPPA2048_LBSPPB256_LPA0_MIWT8_8_PLR1_SU32_SUM0_SUS256_VWA4_VWB4_WGM4_WGMXCC1_WGMXCCGn1
    SolutionIndex: 6
    SolutionNameMin: Cijk_Ailk_Bljk_HSS_BH_UserArgs_MT256x256x32_MI16x16x1_SN_LDSB1_CLR1_GSU0_GSUC0_GSUWGMRR0_K1_LBSPPA2048_LBSPPB128_LPA0_MIWT8_8_PLR1_SU32_SUM0_SUS256_VWA4_VWB1_WGM8_WGMXCC1_WGMXCCGn1
    SolutionIndex: 7
    SolutionNameMin: Cijk_Ailk_Bljk_HSS_BH_UserArgs_MT256x256x32_MI16x16x1_SN_LDSB1_CLR1_GSU0_GSUC0_GSUWGMRR0_K1_LBSPPA2048_LBSPPB128_LPA32_MIWT8_8_PLR1_SU32_SUM0_SUS256_VWA2_VWB2_WGM8_WGMXCC1_WGMXCCGn1
    SolutionIndex: 8
    SolutionNameMin: Cijk_Ailk_Bljk_HSS_BH_UserArgs_MT128x256x32_MI16x16x1_SN_LDSB1_CLR1_GSU0_GSUC0_GSUWGMRR0_K1_LBSPPA1024_LBSPPB128_LPA0_MIWT4_8_PLR1_SU32_SUM0_SUS256_VWA4_VWB2_WGM4_WGMXCC1_WGMXCCGn1
    SolutionIndex: 9
    SolutionNameMin: Cijk_Ailk_Bljk_HSS_BH_UserArgs_MT256x128x32_MI16x16x1_SN_LDSB1_CLR1_GSU0_GSUC0_GSUWGMRR0_K1_LBSPPA2048_LBSPPB128_LPA0_MIWT8_4_PLR1_SU32_SUM0_SUS256_VWA4_VWB1_WGM1_WGMXCC1_WGMXCCGn1
    SolutionIndex: 10
    SolutionNameMin: Cijk_Ailk_Bljk_HSS_BH_UserArgs_MT256x128x32_MI16x16x1_SN_LDSB1_CLR1_GSU0_GSUC0_GSUWGMRR0_K1_LBSPPA2048_LBSPPB128_LPA0_MIWT8_4_PLR1_SU32_SUM0_SUS256_VWA4_VWB2_WGM1_WGMXCC1_WGMXCCGn1
    SolutionIndex: 11
    SolutionNameMin: Cijk_Ailk_Bljk_HSS_BH_UserArgs_MT256x128x32_MI16x16x1_SN_LDSB1_CLR1_GSU0_GSUC0_GSUWGMRR0_K1_LBSPPA2048_LBSPPB256_LPA16_MIWT8_4_PLR1_SU32_SUM0_SUS256_VWA1_VWB4_WGM1_WGMXCC1_WGMXCCGn1
    SolutionIndex: 12
    SolutionNameMin: Cijk_Ailk_Bljk_HSS_BH_UserArgs_MT256x128x32_MI16x16x1_SN_LDSB1_CLR1_GSU0_GSUC0_GSUWGMRR0_K1_LBSPPA2048_LBSPPB256_LPA0_MIWT8_4_PLR1_SU32_SUM0_SUS256_VWA4_VWB4_WGM1_WGMXCC1_WGMXCCGn1
    SolutionIndex: 13
    SolutionNameMin: Cijk_Ailk_Bljk_HSS_BH_UserArgs_MT256x128x32_MI16x16x1_SN_LDSB1_CLR1_GSU0_GSUC0_GSUWGMRR0_K1_LBSPPA2048_LBSPPB128_LPA0_MIWT8_4_PLR1_SU32_SUM0_SUS256_VWA4_VWB1_WGM4_WGMXCC1_WGMXCCGn1
    SolutionIndex: 14
    SolutionNameMin: Cijk_Ailk_Bljk_HSS_BH_UserArgs_MT256x128x32_MI16x16x1_SN_LDSB1_CLR1_GSU0_GSUC0_GSUWGMRR0_K1_LBSPPA2048_LBSPPB128_LPA0_MIWT8_4_PLR1_SU32_SUM0_SUS256_VWA8_VWB1_WGM4_WGMXCC1_WGMXCCGn1
    SolutionIndex: 15
    SolutionNameMin: Cijk_Ailk_Bljk_HSS_BH_UserArgs_MT256x128x32_MI16x16x1_SN_LDSB1_CLR1_GSU0_GSUC0_GSUWGMRR0_K1_LBSPPA2048_LBSPPB128_LPA0_MIWT8_4_PLR1_SU32_SUM0_SUS256_VWA4_VWB2_WGM4_WGMXCC1_WGMXCCGn1
    SolutionIndex: 16
    SolutionNameMin: Cijk_Ailk_Bljk_HSS_BH_UserArgs_MT256x128x32_MI16x16x1_SN_LDSB1_CLR1_GSU0_GSUC0_GSUWGMRR0_K1_LBSPPA2048_LBSPPB256_LPA0_MIWT8_4_PLR1_SU32_SUM0_SUS256_VWA4_VWB4_WGM4_WGMXCC1_WGMXCCGn1
    SolutionIndex: 17
    SolutionNameMin: Cijk_Ailk_Bljk_HSS_BH_UserArgs_MT256x128x32_MI16x16x1_SN_LDSB1_CLR1_GSU0_GSUC0_GSUWGMRR0_K1_LBSPPA2048_LBSPPB128_LPA0_MIWT8_4_PLR1_SU32_SUM0_SUS256_VWA4_VWB1_WGM8_WGMXCC1_WGMXCCGn1
    SolutionIndex: 18
    SolutionNameMin: Cijk_Ailk_Bljk_HSS_BH_UserArgs_MT256x128x32_MI16x16x1_SN_LDSB1_CLR1_GSU0_GSUC0_GSUWGMRR0_K1_LBSPPA2048_LBSPPB128_LPA16_MIWT8_4_PLR1_SU32_SUM0_SUS256_VWA1_VWB2_WGM8_WGMXCC1_WGMXCCGn1
    SolutionIndex: 19
    SolutionNameMin: Cijk_Ailk_Bljk_HSS_BH_UserArgs_MT256x128x32_MI16x16x1_SN_LDSB1_CLR1_GSU0_GSUC0_GSUWGMRR0_K1_LBSPPA2048_LBSPPB128_LPA0_MIWT8_4_PLR1_SU32_SUM0_SUS256_VWA4_VWB2_WGM8_WGMXCC1_WGMXCCGn1
    SolutionIndex: 20
    SolutionNameMin: Cijk_Ailk_Bljk_HSS_BH_UserArgs_MT256x128x32_MI16x16x1_SN_LDSB1_CLR1_GSU0_GSUC0_GSUWGMRR0_K1_LBSPPA2048_LBSPPB256_LPA0_MIWT8_4_PLR1_SU32_SUM0_SUS256_VWA4_VWB4_WGM8_WGMXCC1_WGMXCCGn1
    SolutionIndex: 21
    SolutionNameMin: Cijk_Ailk_Bljk_HSS_BH_UserArgs_MT256x64x32_MI16x16x1_SN_LDSB1_CLR1_GSU0_GSUC0_GSUWGMRR0_K1_LBSPPA2048_LBSPPB128_LPA0_MIWT8_2_PLR1_SU32_SUM0_SUS256_VWA4_VWB1_WGM1_WGMXCC1_WGMXCCGn1
    SolutionIndex: 22
    SolutionNameMin: Cijk_Ailk_Bljk_HSS_BH_UserArgs_MT256x64x32_MI16x16x1_SN_LDSB1_CLR1_GSU0_GSUC0_GSUWGMRR0_K1_LBSPPA2048_LBSPPB128_LPA0_MIWT8_2_PLR1_SU32_SUM0_SUS256_VWA4_VWB2_WGM1_WGMXCC1_WGMXCCGn1
    SolutionIndex: 23
    SolutionNameMin: Cijk_Ailk_Bljk_HSS_BH_UserArgs_MT256x64x32_MI16x16x1_SN_LDSB1_CLR1_GSU0_GSUC0_GSUWGMRR0_K1_LBSPPA2048_LBSPPB128_LPA0_MIWT8_2_PLR1_SU32_SUM0_SUS256_VWA4_VWB1_WGM4_WGMXCC1_WGMXCCGn1
    SolutionIndex: 24
    SolutionNameMin: Cijk_Ailk_Bljk_HSS_BH_UserArgs_MT256x64x32_MI16x16x1_SN_LDSB1_CLR1_GSU0_GSUC0_GSUWGMRR0_K1_LBSPPA2048_LBSPPB128_LPA0_MIWT8_2_PLR1_SU32_SUM0_SUS256_VWA4_VWB1_WGM8_WGMXCC1_WGMXCCGn1
    SolutionIndex: 25
    SolutionNameMin: Cijk_Ailk_Bljk_HSS_BH_UserArgs_MT256x64x32_MI16x16x1_SN_LDSB1_CLR1_GSU0_GSUC0_GSUWGMRR0_K1_LBSPPA2048_LBSPPB128_LPA0_MIWT8_2_PLR1_SU32_SUM0_SUS256_VWA4_VWB2_WGM8_WGMXCC1_WGMXCCGn1
    SolutionIndex: 26
    SolutionNameMin: Cijk_Ailk_Bljk_HSS_BH_UserArgs_MT256x32x32_MI16x16x1_SN_LDSB1_CLR1_GSU0_GSUC0_GSUWGMRR0_K1_LBSPPA2048_LBSPPB128_LPA0_MIWT8_1_PLR1_SU32_SUM0_SUS256_VWA4_VWB1_WGM1_WGMXCC1_WGMXCCGn1
    SolutionIndex: 27
    SolutionNameMin: Cijk_Ailk_Bljk_HSS_BH_UserArgs_MT128x128x32_MI16x16x1_SN_LDSB1_CLR1_GSU0_GSUC0_GSUWGMRR0_K1_LBSPPA1024_LBSPPB128_LPA16_MIWT4_4_PLR1_SU32_SUM0_SUS256_VWA1_VWB1_WGM1_WGMXCC1_WGMXCCGn1
    SolutionIndex: 28
    SolutionNameMin: Cijk_Ailk_Bljk_HSS_BH_UserArgs_MT128x128x32_MI16x16x1_SN_LDSB1_CLR1_GSU0_GSUC0_GSUWGMRR0_K1_LBSPPA1024_LBSPPB128_LPA0_MIWT4_4_PLR1_SU32_SUM0_SUS256_VWA4_VWB1_WGM1_WGMXCC1_WGMXCCGn1
    SolutionIndex: 29
    SolutionNameMin: Cijk_Ailk_Bljk_HSS_BH_UserArgs_MT128x128x32_MI16x16x1_SN_LDSB1_CLR1_GSU0_GSUC0_GSUWGMRR0_K1_LBSPPA1024_LBSPPB128_LPA16_MIWT4_4_PLR1_SU32_SUM0_SUS256_VWA1_VWB2_WGM1_WGMXCC1_WGMXCCGn1
    SolutionIndex: 30
    SolutionNameMin: Cijk_Ailk_Bljk_HSS_BH_UserArgs_MT128x128x32_MI16x16x1_SN_LDSB1_CLR1_GSU0_GSUC0_GSUWGMRR0_K1_LBSPPA1024_LBSPPB128_LPA0_MIWT4_4_PLR1_SU32_SUM0_SUS256_VWA4_VWB2_WGM1_WGMXCC1_WGMXCCGn1
    SolutionIndex: 31
    SolutionNameMin: Cijk_Ailk_Bljk_HSS_BH_UserArgs_MT128x128x32_MI16x16x1_SN_LDSB1_CLR1_GSU0_GSUC0_GSUWGMRR0_K1_LBSPPA1024_LBSPPB256_LPA0_MIWT4_4_PLR1_SU32_SUM0_SUS256_VWA4_VWB4_WGM1_WGMXCC1_WGMXCCGn1
    SolutionIndex: 32
    SolutionNameMin: Cijk_Ailk_Bljk_HSS_BH_UserArgs_MT128x128x32_MI16x16x1_SN_LDSB1_CLR1_GSU0_GSUC0_GSUWGMRR0_K1_LBSPPA1024_LBSPPB128_LPA0_MIWT4_4_PLR1_SU32_SUM0_SUS256_VWA4_VWB1_WGM4_WGMXCC1_WGMXCCGn1
    SolutionIndex: 33
    SolutionNameMin: Cijk_Ailk_Bljk_HSS_BH_UserArgs_MT128x128x32_MI16x16x1_SN_LDSB1_CLR1_GSU0_GSUC0_GSUWGMRR0_K1_LBSPPA1024_LBSPPB128_LPA0_MIWT4_4_PLR1_SU32_SUM0_SUS256_VWA4_VWB2_WGM4_WGMXCC1_WGMXCCGn1
    SolutionIndex: 34
    SolutionNameMin: Cijk_Ailk_Bljk_HSS_BH_UserArgs_MT128x128x32_MI16x16x1_SN_LDSB1_CLR1_GSU0_GSUC0_GSUWGMRR0_K1_LBSPPA1024_LBSPPB128_LPA0_MIWT4_4_PLR1_SU32_SUM0_SUS256_VWA4_VWB1_WGM8_WGMXCC1_WGMXCCGn1
    SolutionIndex: 35
    SolutionNameMin: Cijk_Ailk_Bljk_HSS_BH_UserArgs_MT128x128x32_MI16x16x1_SN_LDSB1_CLR1_GSU0_GSUC0_GSUWGMRR0_K1_LBSPPA1024_LBSPPB128_LPA0_MIWT4_4_PLR1_SU32_SUM0_SUS256_VWA4_VWB2_WGM8_WGMXCC1_WGMXCCGn1
    SolutionIndex: 36
    SolutionNameMin: Cijk_Ailk_Bljk_HSS_BH_UserArgs_MT128x128x32_MI16x16x1_SN_LDSB1_CLR1_GSU0_GSUC0_GSUWGMRR0_K1_LBSPPA1024_LBSPPB256_LPA0_MIWT4_4_PLR1_SU32_SUM0_SUS256_VWA4_VWB4_WGM8_WGMXCC1_WGMXCCGn1
    SolutionIndex: 37
    SolutionNameMin: Cijk_Ailk_Bljk_HSS_BH_UserArgs_MT128x64x32_MI16x16x1_SN_LDSB0_CLR1_GSU0_GSUC0_GSUWGMRR0_K1_LBSPPA1024_LBSPPB128_LPA0_MIWT4_2_PLR1_SU32_SUM0_SUS256_VWA4_VWB1_WGM1_WGMXCC1_WGMXCCGn1
    SolutionIndex: 38
    SolutionNameMin: Cijk_Ailk_Bljk_HSS_BH_UserArgs_MT128x64x32_MI16x16x1_SN_LDSB0_CLR1_GSU0_GSUC0_GSUWGMRR0_K1_LBSPPA1024_LBSPPB128_LPA0_MIWT4_2_PLR1_SU32_SUM0_SUS256_VWA4_VWB2_WGM1_WGMXCC1_WGMXCCGn1
    SolutionIndex: 39
    SolutionNameMin: Cijk_Ailk_Bljk_HSS_BH_UserArgs_MT128x64x32_MI16x16x1_SN_LDSB0_CLR0_GSU0_GSUC0_GSUWGMRR0_K1_LBSPPA1024_LBSPPB128_LPA0_MIWT4_2_PLR0_SU32_SUM0_SUS256_VWA4_VWB1_WGM1_WGMXCC1_WGMXCCGn1
    SolutionIndex: 40
    SolutionNameMin: Cijk_Ailk_Bljk_HSS_BH_UserArgs_MT128x64x32_MI16x16x1_SN_LDSB0_CLR1_GSU0_GSUC0_GSUWGMRR0_K1_LBSPPA1024_LBSPPB128_LPA0_MIWT4_2_PLR1_SU32_SUM0_SUS256_VWA4_VWB1_WGM8_WGMXCC1_WGMXCCGn1
    SolutionIndex: 41
    SolutionNameMin: Cijk_Ailk_Bljk_HSS_BH_UserArgs_MT128x64x32_MI16x16x1_SN_LDSB0_CLR0_GSU0_GSUC0_GSUWGMRR0_K1_LBSPPA1024_LBSPPB128_LPA0_MIWT4_2_PLR0_SU32_SUM0_SUS256_VWA4_VWB1_WGM8_WGMXCC1_WGMXCCGn1
    SolutionIndex: 42
    SolutionNameMin: Cijk_Ailk_Bljk_HSS_BH_UserArgs_MT64x64x32_MI16x16x1_SN_LDSB0_CLR1_GSU0_GSUC0_GSUWGMRR0_K1_LBSPPA512_LBSPPB128_LPA32_MIWT2_2_PLR1_SU32_SUM0_SUS256_VWA2_VWB2_WGM1_WGMXCC1_WGMXCCGn1
    SolutionIndex: 43
    SolutionNameMin: Cijk_Ailk_Bljk_HSS_BH_UserArgs_MT64x64x32_MI16x16x1_SN_LDSB0_CLR0_GSU0_GSUC0_GSUWGMRR0_K1_LBSPPA512_LBSPPB128_LPA32_MIWT2_2_PLR0_SU32_SUM0_SUS256_VWA2_VWB1_WGM1_WGMXCC1_WGMXCCGn1
    SolutionIndex: 44
    SolutionNameMin: Cijk_Ailk_Bljk_HSS_BH_UserArgs_MT128x256x64_MI16x16x1_SN_LDSB1_CLR1_GSU0_GSUC0_GSUWGMRR0_K1_LBSPPA2048_LBSPPB256_LPA32_MIWT4_8_PLR1_SU32_SUM0_SUS256_VWA2_VWB2_WGM1_WGMXCC1_WGMXCCGn1
    SolutionIndex: 45
    SolutionNameMin: Cijk_Ailk_Bljk_HSS_BH_UserArgs_MT128x256x64_MI16x16x1_SN_LDSB1_CLR1_GSU0_GSUC0_GSUWGMRR0_K1_LBSPPA2048_LBSPPB256_LPA0_MIWT4_8_PLR1_SU32_SUM0_SUS256_VWA4_VWB2_WGM1_WGMXCC1_WGMXCCGn1
    SolutionIndex: 46
    SolutionNameMin: Cijk_Ailk_Bljk_HSS_BH_UserArgs_MT128x256x64_MI16x16x1_SN_LDSB1_CLR1_GSU0_GSUC0_GSUWGMRR0_K1_LBSPPA2048_LBSPPB1024_LPA0_MIWT4_8_PLR1_SU32_SUM0_SUS256_VWA4_VWB8_WGM4_WGMXCC1_WGMXCCGn1
    SolutionIndex: 47
    SolutionNameMin: Cijk_Ailk_Bljk_HSS_BH_UserArgs_MT128x256x64_MI16x16x1_SN_LDSB1_CLR1_GSU0_GSUC0_GSUWGMRR0_K1_LBSPPA2048_LBSPPB128_LPA0_MIWT4_8_PLR1_SU32_SUM0_SUS256_VWA4_VWB1_WGM8_WGMXCC1_WGMXCCGn1
    SolutionIndex: 48
    SolutionNameMin: Cijk_Ailk_Bljk_HSS_BH_UserArgs_MT256x128x64_MI16x16x1_SN_LDSB1_CLR1_GSU0_GSUC0_GSUWGMRR0_K1_LBSPPA4096_LBSPPB128_LPA0_MIWT8_4_PLR1_SU32_SUM0_SUS256_VWA4_VWB1_WGM1_WGMXCC1_WGMXCCGn1
    SolutionIndex: 49
    SolutionNameMin: Cijk_Ailk_Bljk_HSS_BH_UserArgs_MT256x128x64_MI16x16x1_SN_LDSB1_CLR1_GSU0_GSUC0_GSUWGMRR0_K1_LBSPPA4096_LBSPPB256_LPA0_MIWT8_4_PLR1_SU32_SUM0_SUS256_VWA4_VWB2_WGM1_WGMXCC1_WGMXCCGn1
    SolutionIndex: 50
    SolutionNameMin: Cijk_Ailk_Bljk_HSS_BH_UserArgs_MT256x128x64_MI16x16x1_SN_LDSB1_CLR1_GSU0_GSUC0_GSUWGMRR0_K1_LBSPPA4096_LBSPPB256_LPA32_MIWT8_4_PLR1_SU32_SUM0_SUS256_VWA2_VWB2_WGM4_WGMXCC1_WGMXCCGn1
    SolutionIndex: 51
    SolutionNameMin: Cijk_Ailk_Bljk_HSS_BH_UserArgs_MT256x128x64_MI16x16x1_SN_LDSB1_CLR1_GSU0_GSUC0_GSUWGMRR0_K1_LBSPPA4096_LBSPPB256_LPA0_MIWT8_4_PLR1_SU32_SUM0_SUS256_VWA4_VWB2_WGM4_WGMXCC1_WGMXCCGn1
    SolutionIndex: 52
    SolutionNameMin: Cijk_Ailk_Bljk_HSS_BH_UserArgs_MT256x128x64_MI16x16x1_SN_LDSB1_CLR1_GSU0_GSUC0_GSUWGMRR0_K1_LBSPPA4096_LBSPPB256_LPA0_MIWT8_4_PLR1_SU32_SUM0_SUS256_VWA4_VWB2_WGM8_WGMXCC1_WGMXCCGn1
    SolutionIndex: 53
    SolutionNameMin: Cijk_Ailk_Bljk_HSS_BH_UserArgs_MT256x128x64_MI16x16x1_SN_LDSB1_CLR1_GSU0_GSUC0_GSUWGMRR0_K1_LBSPPA4096_LBSPPB512_LPA0_MIWT8_4_PLR1_SU32_SUM0_SUS256_VWA4_VWB4_WGM8_WGMXCC1_WGMXCCGn1
    SolutionIndex: 54
    SolutionNameMin: Cijk_Ailk_Bljk_HSS_BH_UserArgs_MT128x128x64_MI16x16x1_SN_LDSB1_CLR1_GSU0_GSUC0_GSUWGMRR0_K1_LBSPPA2048_LBSPPB256_LPA0_MIWT4_4_PLR1_SU32_SUM0_SUS256_VWA4_VWB2_WGM1_WGMXCC1_WGMXCCGn1
    SolutionIndex: 55
    SolutionNameMin: Cijk_Ailk_Bljk_HSS_BH_UserArgs_MT128x128x64_MI16x16x1_SN_LDSB1_CLR1_GSU0_GSUC0_GSUWGMRR0_K1_LBSPPA2048_LBSPPB512_LPA0_MIWT4_4_PLR1_SU32_SUM0_SUS256_VWA4_VWB4_WGM1_WGMXCC1_WGMXCCGn1
    SolutionIndex: 56
    SolutionNameMin: Cijk_Ailk_Bljk_HSS_BH_UserArgs_MT128x128x64_MI16x16x1_SN_LDSB1_CLR1_GSU0_GSUC0_GSUWGMRR0_K1_LBSPPA2048_LBSPPB256_LPA0_MIWT4_4_PLR1_SU32_SUM0_SUS256_VWA4_VWB2_WGM4_WGMXCC1_WGMXCCGn1
    SolutionIndex: 57
    SolutionNameMin: Cijk_Ailk_Bljk_HSS_BH_UserArgs_MT128x64x64_MI16x16x1_SN_LDSB1_CLR1_GSU0_GSUC0_GSUWGMRR0_K1_LBSPPA2048_LBSPPB128_LPA16_MIWT4_2_PLR1_SU32_SUM0_SUS256_VWA1_VWB1_WGM1_WGMXCC1_WGMXCCGn1
    SolutionIndex: 58
    SolutionNameMin: Cijk_Ailk_Bljk_HSS_BH_UserArgs_MT128x64x64_MI16x16x1_SN_LDSB1_CLR1_GSU0_GSUC0_GSUWGMRR0_K1_LBSPPA2048_LBSPPB128_LPA32_MIWT4_2_PLR1_SU32_SUM0_SUS256_VWA2_VWB1_WGM1_WGMXCC1_WGMXCCGn1
    SolutionIndex: 59
    SolutionNameMin: Cijk_Ailk_Bljk_HSS_BH_UserArgs_MT128x64x64_MI16x16x1_SN_LDSB1_CLR1_GSU0_GSUC0_GSUWGMRR0_K1_LBSPPA2048_LBSPPB128_LPA0_MIWT4_2_PLR1_SU32_SUM0_SUS256_VWA4_VWB1_WGM1_WGMXCC1_WGMXCCGn1
    SolutionIndex: 60
    SolutionNameMin: Cijk_Ailk_Bljk_HSS_BH_UserArgs_MT128x64x64_MI16x16x1_SN_LDSB1_CLR1_GSU0_GSUC0_GSUWGMRR0_K1_LBSPPA2048_LBSPPB256_LPA0_MIWT4_2_PLR1_SU32_SUM0_SUS256_VWA4_VWB2_WGM1_WGMXCC1_WGMXCCGn1
    SolutionIndex: 61
    SolutionNameMin: Cijk_Ailk_Bljk_HSS_BH_UserArgs_MT128x64x64_MI16x16x1_SN_LDSB1_CLR1_GSU0_GSUC0_GSUWGMRR0_K1_LBSPPA2048_LBSPPB256_LPA0_MIWT4_2_PLR2_SU32_SUM0_SUS256_VWA4_VWB2_WGM1_WGMXCC1_WGMXCCGn1
    SolutionIndex: 62
    SolutionNameMin: Cijk_Ailk_Bljk_HSS_BH_UserArgs_MT128x64x64_MI16x16x1_SN_LDSB1_CLR1_GSU0_GSUC0_GSUWGMRR0_K1_LBSPPA2048_LBSPPB128_LPA32_MIWT4_2_PLR1_SU32_SUM0_SUS256_VWA2_VWB1_WGM4_WGMXCC1_WGMXCCGn1
    SolutionIndex: 63
    SolutionNameMin: Cijk_Ailk_Bljk_HSS_BH_UserArgs_MT128x64x64_MI16x16x1_SN_LDSB1_CLR1_GSU0_GSUC0_GSUWGMRR0_K1_LBSPPA2048_LBSPPB128_LPA0_MIWT4_2_PLR1_SU32_SUM0_SUS256_VWA4_VWB1_WGM4_WGMXCC1_WGMXCCGn1
    SolutionIndex: 64
    SolutionNameMin: Cijk_Ailk_Bljk_HSS_BH_UserArgs_MT128x64x64_MI16x16x1_SN_LDSB1_CLR1_GSU0_GSUC0_GSUWGMRR0_K1_LBSPPA2048_LBSPPB256_LPA0_MIWT4_2_PLR1_SU32_SUM0_SUS256_VWA4_VWB2_WGM4_WGMXCC1_WGMXCCGn1
    SolutionIndex: 65
    SolutionNameMin: Cijk_Ailk_Bljk_HSS_BH_UserArgs_MT128x64x64_MI16x16x1_SN_LDSB1_CLR1_GSU0_GSUC0_GSUWGMRR0_K1_LBSPPA2048_LBSPPB256_LPA0_MIWT4_2_PLR2_SU32_SUM0_SUS256_VWA4_VWB2_WGM4_WGMXCC1_WGMXCCGn1
    SolutionIndex: 66
    SolutionNameMin: Cijk_Ailk_Bljk_HSS_BH_UserArgs_MT128x64x64_MI16x16x1_SN_LDSB1_CLR1_GSU0_GSUC0_GSUWGMRR0_K1_LBSPPA2048_LBSPPB128_LPA0_MIWT4_2_PLR1_SU32_SUM0_SUS256_VWA4_VWB1_WGM8_WGMXCC1_WGMXCCGn1
    SolutionIndex: 67
    SolutionNameMin: Cijk_Ailk_Bljk_HSS_BH_UserArgs_MT128x64x64_MI16x16x1_SN_LDSB1_CLR1_GSU0_GSUC0_GSUWGMRR0_K1_LBSPPA2048_LBSPPB256_LPA0_MIWT4_2_PLR1_SU32_SUM0_SUS256_VWA4_VWB2_WGM8_WGMXCC1_WGMXCCGn1
    SolutionIndex: 68
    SolutionNameMin: Cijk_Ailk_Bljk_HSS_BH_UserArgs_MT128x32x64_MI16x16x1_SN_LDSB1_CLR1_GSU0_GSUC0_GSUWGMRR0_K1_LBSPPA2048_LBSPPB128_LPA0_MIWT4_1_PLR1_SU32_SUM0_SUS256_VWA4_VWB1_WGM1_WGMXCC1_WGMXCCGn1
    SolutionIndex: 69
    SolutionNameMin: Cijk_Ailk_Bljk_HSS_BH_UserArgs_MT64x64x64_MI16x16x1_SN_LDSB1_CLR1_GSU0_GSUC0_GSUWGMRR0_K1_LBSPPA1024_LBSPPB128_LPA16_MIWT2_2_PLR1_SU32_SUM0_SUS256_VWA1_VWB1_WGM1_WGMXCC1_WGMXCCGn1
    SolutionIndex: 70
    SolutionNameMin: Cijk_Ailk_Bljk_HSS_BH_UserArgs_MT64x64x64_MI16x16x1_SN_LDSB1_CLR1_GSU0_GSUC0_GSUWGMRR0_K1_LBSPPA1024_LBSPPB128_LPA32_MIWT2_2_PLR1_SU32_SUM0_SUS256_VWA2_VWB1_WGM1_WGMXCC1_WGMXCCGn1
    SolutionIndex: 71
    SolutionNameMin: Cijk_Ailk_Bljk_HSS_BH_UserArgs_MT64x64x64_MI16x16x1_SN_LDSB1_CLR1_GSU0_GSUC0_GSUWGMRR0_K1_LBSPPA1024_LBSPPB256_LPA32_MIWT2_2_PLR1_SU32_SUM0_SUS256_VWA2_VWB2_WGM1_WGMXCC1_WGMXCCGn1
    SolutionIndex: 72
    SolutionNameMin: Cijk_Ailk_Bljk_HSS_BH_UserArgs_MT64x64x64_MI16x16x1_SN_LDSB1_CLR1_GSU0_GSUC0_GSUWGMRR0_K1_LBSPPA1024_LBSPPB128_LPA32_MIWT2_2_PLR1_SU32_SUM0_SUS256_VWA2_VWB1_WGM4_WGMXCC1_WGMXCCGn1
    SolutionIndex: 73
    SolutionNameMin: Cijk_Ailk_Bljk_HSS_BH_UserArgs_MT64x64x64_MI16x16x1_SN_LDSB1_CLR1_GSU0_GSUC0_GSUWGMRR0_K1_LBSPPA1024_LBSPPB256_LPA32_MIWT2_2_PLR1_SU32_SUM0_SUS256_VWA2_VWB2_WGM4_WGMXCC1_WGMXCCGn1
    SolutionIndex: 74
    SolutionNameMin: Cijk_Ailk_Bljk_HSS_BH_UserArgs_MT64x64x64_MI16x16x1_SN_LDSB1_CLR1_GSU0_GSUC0_GSUWGMRR0_K1_LBSPPA1024_LBSPPB128_LPA32_MIWT2_2_PLR2_SU32_SUM0_SUS256_VWA2_VWB1_WGM4_WGMXCC1_WGMXCCGn1
    SolutionIndex: 75
    SolutionNameMin: Cijk_Ailk_Bljk_HSS_BH_UserArgs_MT64x64x64_MI16x16x1_SN_LDSB1_CLR1_GSU0_GSUC0_GSUWGMRR0_K1_LBSPPA1024_LBSPPB128_LPA32_MIWT2_2_PLR1_SU32_SUM0_SUS256_VWA2_VWB1_WGM8_WGMXCC1_WGMXCCGn1
    SolutionIndex: 76
    SolutionNameMin: Cijk_Ailk_Bljk_HSS_BH_UserArgs_MT64x64x64_MI16x16x1_SN_LDSB1_CLR1_GSU0_GSUC0_GSUWGMRR0_K1_LBSPPA1024_LBSPPB256_LPA32_MIWT2_2_PLR1_SU32_SUM0_SUS256_VWA2_VWB2_WGM8_WGMXCC1_WGMXCCGn1
    SolutionIndex: 77
    SolutionNameMin: Cijk_Ailk_Bljk_HSS_BH_UserArgs_MT64x64x64_MI16x16x1_SN_LDSB1_CLR1_GSU0_GSUC0_GSUWGMRR0_K1_LBSPPA1024_LBSPPB256_LPA32_MIWT2_2_PLR2_SU32_SUM0_SUS256_VWA2_VWB2_WGM8_WGMXCC1_WGMXCCGn1
    SolutionIndex: 78
    SolutionNameMin: Cijk_Ailk_Bljk_HSS_BH_UserArgs_MT32x64x64_MI16x16x1_SN_LDSB0_CLR1_GSU0_GSUC0_GSUWGMRR0_K1_LBSPPA512_LBSPPB128_LPA16_MIWT1_2_PLR1_SU32_SUM0_SUS256_VWA1_VWB1_WGM1_WGMXCC1_WGMXCCGn1
    SolutionIndex: 79
    SolutionNameMin: Cijk_Ailk_Bljk_HSS_BH_UserArgs_MT64x32x64_MI16x16x1_SN_LDSB0_CLR1_GSU0_GSUC0_GSUWGMRR0_K1_LBSPPA1024_LBSPPB128_LPA32_MIWT2_1_PLR1_SU32_SUM0_SUS256_VWA2_VWB1_WGM1_WGMXCC1_WGMXCCGn1
    SolutionIndex: 80
    SolutionNameMin: Cijk_Ailk_Bljk_HSS_BH_UserArgs_MT64x32x64_MI16x16x1_SN_LDSB0_CLR1_GSU0_GSUC0_GSUWGMRR0_K1_LBSPPA1024_LBSPPB128_LPA32_MIWT2_1_PLR1_SU32_SUM0_SUS256_VWA2_VWB1_WGM8_WGMXCC1_WGMXCCGn1
    SolutionIndex: 81
    SolutionNameMin: Cijk_Ailk_Bljk_HSS_BH_UserArgs_MT128x64x128_MI16x16x1_SN_LDSB1_CLR1_GSU0_GSUC0_GSUWGMRR0_K1_LBSPPA2048_LBSPPB256_LPA0_MIWT4_2_PLR1_SU32_SUM0_SUS256_VWA4_VWB1_WGM1_WGMXCC1_WGMXCCGn1
    SolutionIndex: 82
    SolutionNameMin: Cijk_Ailk_Bljk_HSS_BH_UserArgs_MT128x64x128_MI16x16x1_SN_LDSB1_CLR1_GSU0_GSUC0_GSUWGMRR0_K1_LBSPPA2048_LBSPPB512_LPA0_MIWT4_2_PLR1_SU32_SUM0_SUS256_VWA4_VWB2_WGM1_WGMXCC1_WGMXCCGn1
    SolutionIndex: 83
    SolutionNameMin: Cijk_Ailk_Bljk_HSS_BH_UserArgs_MT128x64x128_MI16x16x1_SN_LDSB1_CLR1_GSU0_GSUC0_GSUWGMRR0_K1_LBSPPA2048_LBSPPB256_LPA0_MIWT4_2_PLR2_SU32_SUM0_SUS256_VWA4_VWB1_WGM1_WGMXCC1_WGMXCCGn1
    SolutionIndex: 84
    SolutionNameMin: Cijk_Ailk_Bljk_HSS_BH_UserArgs_MT128x64x128_MI16x16x1_SN_LDSB1_CLR1_GSU0_GSUC0_GSUWGMRR0_K1_LBSPPA2048_LBSPPB256_LPA0_MIWT4_2_PLR2_SU32_SUM0_SUS256_VWA4_VWB1_WGM4_WGMXCC1_WGMXCCGn1
    SolutionIndex: 85
    SolutionNameMin: Cijk_Ailk_Bljk_HSS_BH_UserArgs_MT64x64x128_MI16x16x1_SN_LDSB1_CLR1_GSU0_GSUC0_GSUWGMRR0_K1_LBSPPA1024_LBSPPB256_LPA32_MIWT2_2_PLR2_SU32_SUM0_SUS256_VWA2_VWB1_WGM8_WGMXCC1_WGMXCCGn1
    SolutionIndex: 86
    SolutionNameMin: Cijk_Ailk_Bljk_HSS_BH_UserArgs_MT32x64x128_MI16x16x1_SN_LDSB1_CLR1_GSU0_GSUC0_GSUWGMRR0_K1_LBSPPA512_LBSPPB256_LPA16_MIWT1_2_PLR2_SU32_SUM0_SUS256_VWA1_VWB1_WGM1_WGMXCC1_WGMXCCGn1
    SolutionIndex: 87
    SolutionNameMin: Cijk_Ailk_Bljk_HSS_BH_UserArgs_MT32x64x128_MI16x16x1_SN_LDSB1_CLR1_GSU0_GSUC0_GSUWGMRR0_K1_LBSPPA512_LBSPPB512_LPA16_MIWT1_2_PLR2_SU32_SUM0_SUS256_VWA1_VWB2_WGM1_WGMXCC1_WGMXCCGn1
    SolutionIndex: 88
    SolutionNameMin: Cijk_Ailk_Bljk_HSS_BH_UserArgs_MT32x64x128_MI16x16x1_SN_LDSB1_CLR1_GSU0_GSUC0_GSUWGMRR0_K1_LBSPPA512_LBSPPB512_LPA16_MIWT1_2_PLR1_SU32_SUM0_SUS256_VWA1_VWB2_WGM4_WGMXCC1_WGMXCCGn1
    SolutionIndex: 89
    SolutionNameMin: Cijk_Ailk_Bljk_HSS_BH_UserArgs_MT64x32x128_MI16x16x1_SN_LDSB1_CLR1_GSU0_GSUC0_GSUWGMRR0_K1_LBSPPA1024_LBSPPB256_LPA32_MIWT2_1_PLR1_SU32_SUM0_SUS256_VWA2_VWB1_WGM1_WGMXCC1_WGMXCCGn1
    SolutionIndex: 90
    SolutionNameMin: Cijk_Ailk_Bljk_HSS_BH_UserArgs_MT64x32x128_MI16x16x1_SN_LDSB1_CLR1_GSU0_GSUC0_GSUWGMRR0_K1_LBSPPA1024_LBSPPB256_LPA32_MIWT2_1_PLR2_SU32_SUM0_SUS256_VWA2_VWB1_WGM1_WGMXCC1_WGMXCCGn1
    SolutionIndex: 91
    SolutionNameMin: Cijk_Ailk_Bljk_HSS_BH_UserArgs_MT64x32x128_MI16x16x1_SN_LDSB1_CLR1_GSU0_GSUC0_GSUWGMRR0_K1_LBSPPA1024_LBSPPB256_LPA32_MIWT2_1_PLR2_SU32_SUM0_SUS256_VWA2_VWB1_WGM4_WGMXCC1_WGMXCCGn1
    SolutionIndex: 92
    SolutionNameMin: Cijk_Ailk_Bljk_HSS_BH_UserArgs_MT64x32x128_MI16x16x1_SN_LDSB1_CLR1_GSU0_GSUC0_GSUWGMRR0_K1_LBSPPA1024_LBSPPB256_LPA32_MIWT2_1_PLR1_SU32_SUM0_SUS256_VWA2_VWB1_WGM8_WGMXCC1_WGMXCCGn1
    SolutionIndex: 93
    SolutionNameMin: Cijk_Ailk_Bljk_HSS_BH_UserArgs_MT64x32x128_MI16x16x1_SN_LDSB1_CLR1_GSU0_GSUC0_GSUWGMRR0_K1_LBSPPA1024_LBSPPB256_LPA16_MIWT2_1_PLR2_SU32_SUM0_SUS256_VWA1_VWB1_WGM8_WGMXCC1_WGMXCCGn1
    SolutionIndex: 94
    SolutionNameMin: Cijk_Ailk_Bljk_HSS_BH_UserArgs_MT32x32x128_MI16x16x1_SN_LDSB1_CLR1_GSU0_GSUC0_GSUWGMRR0_K1_LBSPPA512_LBSPPB256_LPA16_MIWT1_1_PLR1_SU32_SUM0_SUS256_VWA1_VWB1_WGM1_WGMXCC1_WGMXCCGn1
    SolutionIndex: 95
    SolutionNameMin: Cijk_Ailk_Bljk_HSS_BH_UserArgs_MT32x32x128_MI16x16x1_SN_LDSB1_CLR1_GSU0_GSUC0_GSUWGMRR0_K1_LBSPPA512_LBSPPB256_LPA16_MIWT1_1_PLR2_SU32_SUM0_SUS256_VWA1_VWB1_WGM1_WGMXCC1_WGMXCCGn1
    SolutionIndex: 96
    SolutionNameMin: Cijk_Ailk_Bljk_HSS_BH_UserArgs_MT32x32x128_MI16x16x1_SN_LDSB1_CLR1_GSU0_GSUC0_GSUWGMRR0_K1_LBSPPA512_LBSPPB256_LPA16_MIWT1_1_PLR1_SU32_SUM0_SUS256_VWA1_VWB1_WGM4_WGMXCC1_WGMXCCGn1
    SolutionIndex: 97
    SolutionNameMin: Cijk_Ailk_Bljk_HSS_BH_UserArgs_MT32x32x128_MI16x16x1_SN_LDSB1_CLR1_GSU0_GSUC0_GSUWGMRR0_K1_LBSPPA512_LBSPPB256_LPA16_MIWT1_1_PLR2_SU32_SUM0_SUS256_VWA1_VWB1_WGM8_WGMXCC1_WGMXCCGn1
    SolutionIndex: 98
    SolutionNameMin: Cijk_Ailk_Bljk_HSS_BH_UserArgs_MT32x32x32_MI16x16x1_SN_LDSB0_CLR0_GSU0_GSUC0_GSUWGMRR0_K1_LBSPPA256_LBSPPB128_LPA16_MIWT1_1_PLR0_SU32_SUM0_SUS256_VWA1_VWB1_WGM4_WGMXCC1_WGMXCCGn1
- - - [128, 128, 1, 128, 128, 128, 128, 128]
    - [88, 0.077]
  - - [128, 128, 1, 256, 128, 128, 128, 256]
    - [94, 0.099]
  - - [128, 128, 1, 512, 128, 128, 128, 512]
    - [95, 0.166]
  - - [128, 128, 1, 1024, 128, 128, 128, 1024]
    - [94, 0.295]
  - - [128, 128, 1, 2048, 128, 128, 128, 2048]
    - [95, 0.487]
  - - [128, 128, 1, 4096, 128, 128, 128, 4096]
    - [79, 0.786]
  - - [128, 128, 1, 8192, 128, 128, 128, 8192]
    - [86, 1.155]
  - - [128, 256, 1, 128, 128, 128, 128, 128]
    - [96, 0.155]
  - - [128, 256, 1, 256, 128, 128, 128, 256]
    - [97, 0.222]
  - - [128, 256, 1, 512, 128, 128, 128, 512]
    - [94, 0.326]
  - - [128, 256, 1, 1024, 128, 128, 128, 1024]
    - [94, 0.576]
  - - [128, 256, 1, 2048, 128, 128, 128, 2048]
    - [90, 0.888]
  - - [128, 256, 1, 4096, 128, 128, 128, 4096]
    - [79, 1.379]
  - - [128, 256, 1, 8192, 128, 128, 128, 8192]
    - [91, 1.891]
  - - [128, 512, 1, 128, 128, 128, 128, 128]
    - [87, 0.293]
  - - [128, 512, 1, 256, 128, 128, 128, 256]
    - [97, 0.478]
  - - [128, 512, 1, 512, 128, 128, 128, 512]
    - [94, 0.743]
  - - [128, 512, 1, 1024, 128, 128, 128, 1024]
    - [94, 1.079]
  - - [128, 512, 1, 2048, 128, 128, 128, 2048]
    - [92, 1.455]
  - - [128, 512, 1, 4096, 128, 128, 128, 4096]
    - [72, 2.175]
  - - [128, 512, 1, 8192, 128, 128, 128, 8192]
    - [60, 2.816]
  - - [128, 1024, 1, 128, 128, 128, 128, 128]
    - [78, 0.539]
  - - [128, 1024, 1, 256, 128, 128, 128, 256]
    - [79, 0.904]
  - - [128, 1024, 1, 512, 128, 128, 128, 512]
    - [80, 1.331]
  - - [128, 1024, 1, 1024, 128, 128, 128, 1024]
    - [90, 1.848]
  - - [128, 1024, 1, 2048, 128, 128, 128, 2048]
    - [38, 2.267]
  - - [128, 1024, 1, 4096, 128, 128, 128, 4096]
    - [64, 3.453]
  - - [128, 1024, 1, 8192, 128, 128, 128, 8192]
    - [59, 3.73]
  - - [128, 2048, 1, 128, 128, 128, 128, 128]
    - [74, 0.904]
  - - [128, 2048, 1, 256, 128, 128, 128, 256]
    - [69, 1.506]
  - - [128, 2048, 1, 512, 128, 128, 128, 512]
    - [70, 2.128]
  - - [128, 2048, 1, 1024, 128, 128, 128, 1024]
    - [60, 2.48]
  - - [128, 2048, 1, 2048, 128, 128, 128, 2048]
    - [59, 3.013]
  - - [128, 2048, 1, 4096, 128, 128, 128, 4096]
    - [64, 3.825]
  - - [128, 2048, 1, 8192, 128, 128, 128, 8192]
    - [54, 4.381]
  - - [128, 4096, 1, 128, 128, 128, 128, 128]
    - [57, 1.269]
  - - [128, 4096, 1, 256, 128, 128, 128, 256]
    - [58, 2.118]
  - - [128, 4096, 1, 512, 128, 128, 128, 512]
    - [59, 3.069]
  - - [128, 4096, 1, 1024, 128, 128, 128, 1024]
    - [81, 3.459]
  - - [128, 4096, 1, 2048, 128, 128, 128, 2048]
    - [60, 3.59]
  - - [128, 4096, 1, 4096, 128, 128, 128, 4096]
    - [63, 4.609]
  - - [128, 4096, 1, 8192, 128, 128, 128, 8192]
    - [64, 5.424]
  - - [128, 8192, 1, 128, 128, 128, 128, 128]
    - [33, 1.645]
  - - [128, 8192, 1, 256, 128, 128, 128, 256]
    - [27, 2.612]
  - - [128, 8192, 1, 512, 128, 128, 128, 512]
    - [66, 3.428]
  - - [128, 8192, 1, 1024, 128, 128, 128, 1024]
    - [77, 3.759]
  - - [128, 8192, 1, 2048, 128, 128, 128, 2048]
    - [60, 4.847]
  - - [128, 8192, 1, 4096, 128, 128, 128, 4096]
    - [67, 5.04]
  - - [128, 8192, 1, 8192, 128, 128, 128, 8192]
    - [44, 5.709]
  - - [256, 128, 1, 128, 256, 256, 256, 128]
    - [95, 0.16]
  - - [256, 128, 1, 256, 256, 256, 256, 256]
    - [95, 0.232]
  - - [256, 128, 1, 512, 256, 256, 256, 512]
    - [94, 0.325]
  - - [256, 128, 1, 1024, 256, 256, 256, 1024]
    - [96, 0.537]
  - - [256, 128, 1, 2048, 256, 256, 256, 2048]
    - [90, 0.857]
  - - [256, 128, 1, 4096, 256, 256, 256, 4096]
    - [80, 1.358]
  - - [256, 128, 1, 8192, 256, 256, 256, 8192]
    - [89, 1.913]
  - - [256, 256, 1, 128, 256, 256, 256, 128]
    - [89, 0.319]
  - - [256, 256, 1, 256, 256, 256, 256, 256]
    - [96, 0.476]
  - - [256, 256, 1, 512, 256, 256, 256, 512]
    - [94, 0.776]
  - - [256, 256, 1, 1024, 256, 256, 256, 1024]
    - [96, 1.106]
  - - [256, 256, 1, 2048, 256, 256, 256, 2048]
    - [89, 1.471]
  - - [256, 256, 1, 4096, 256, 256, 256, 4096]
    - [70, 2.227]
  - - [256, 256, 1, 8192, 256, 256, 256, 8192]
    - [37, 2.807]
  - - [256, 512, 1, 128, 256, 256, 256, 128]
    - [85, 0.543]
  - - [256, 512, 1, 256, 256, 256, 256, 256]
    - [79, 0.923]
  - - [256, 512, 1, 512, 256, 256, 256, 512]
    - [90, 1.338]
  - - [256, 512, 1, 1024, 256, 256, 256, 1024]
    - [92, 1.868]
  - - [256, 512, 1, 2048, 256, 256, 256, 2048]
    - [37, 2.37]
  - - [256, 512, 1, 4096, 256, 256, 256, 4096]
    - [64, 3.513]
  - - [256, 512, 1, 8192, 256, 256, 256, 8192]
    - [63, 3.613]
  - - [256, 1024, 1, 128, 256, 256, 256, 128]
    - [70, 0.986]
  - - [256, 1024, 1, 256, 256, 256, 256, 256]
    - [68, 1.51]
  - - [256, 1024, 1, 512, 256, 256, 256, 512]
    - [76, 2.3]
  - - [256, 1024, 1, 1024, 256, 256, 256, 1024]
    - [67, 2.545]
  - - [256, 1024, 1, 2048, 256, 256, 256, 2048]
    - [24, 3.049]
  - - [256, 1024, 1, 4096, 256, 256, 256, 4096]
    - [59, 3.886]
  - - [256, 1024, 1, 8192, 256, 256, 256, 8192]
    - [9, 4.78]
  - - [256, 2048, 1, 128, 256, 256, 256, 128]
    - [40, 1.319]
  - - [256, 2048, 1, 256, 256, 256, 256, 256]
    - [60, 2.263]
  - - [256, 2048, 1, 512, 256, 256, 256, 512]
    - [60, 3.165]
  - - [256, 2048, 1, 1024, 256, 256, 256, 1024]
    - [83, 3.491]
  - - [256, 2048, 1, 2048, 256, 256, 256, 2048]
    - [9, 4.036]
  - - [256, 2048, 1, 4096, 256, 256, 256, 4096]
    - [60, 4.697]
  - - [256, 2048, 1, 8192, 256, 256, 256, 8192]
    - [55, 5.326]
  - - [256, 4096, 1, 128, 256, 256, 256, 128]
    - [30, 1.68]
  - - [256, 4096, 1, 256, 256, 256, 256, 256]
    - [29, 2.604]
  - - [256, 4096, 1, 512, 256, 256, 256, 512]
    - [67, 3.502]
  - - [256, 4096, 1, 1024, 256, 256, 256, 1024]
    - [70, 3.863]
  - - [256, 4096, 1, 2048, 256, 256, 256, 2048]
    - [63, 4.863]
  - - [256, 4096, 1, 4096, 256, 256, 256, 4096]
    - [12, 5.648]
  - - [256, 4096, 1, 8192, 256, 256, 256, 8192]
    - [46, 6.093]
  - - [256, 8192, 1, 128, 256, 256, 256, 128]
    - [8, 2.04]
  - - [256, 8192, 1, 256, 256, 256, 256, 256]
    - [19, 3.187]
  - - [256, 8192, 1, 512, 256, 256, 256, 512]
    - [67, 4.279]
  - - [256, 8192, 1, 1024, 256, 256, 256, 1024]
    - [60, 5.364]
  - - [256, 8192, 1, 2048, 256, 256, 256, 2048]
    - [67, 5.858]
  - - [256, 8192, 1, 4096, 256, 256, 256, 4096]
    - [19, 6.189]
  - - [256, 8192, 1, 8192, 256, 256, 256, 8192]
    - [9, 7.583]
  - - [512, 128, 1, 128, 512, 512, 512, 128]
    - [93, 0.31]
  - - [512, 128, 1, 256, 512, 512, 512, 256]
    - [95, 0.486]
  - - [512, 128, 1, 512, 512, 512, 512, 512]
    - [94, 0.766]
  - - [512, 128, 1, 1024, 512, 512, 512, 1024]
    - [94, 1.118]
  - - [512, 128, 1, 2048, 512, 512, 512, 2048]
    - [90, 1.509]
  - - [512, 128, 1, 4096, 512, 512, 512, 4096]
    - [71, 2.287]
  - - [512, 128, 1, 8192, 512, 512, 512, 8192]
    - [37, 2.867]
  - - [512, 256, 1, 128, 512, 512, 512, 128]
    - [79, 0.607]
  - - [512, 256, 1, 256, 512, 512, 512, 256]
    - [79, 0.928]
  - - [512, 256, 1, 512, 512, 512, 512, 512]
    - [90, 1.414]
  - - [512, 256, 1, 1024, 512, 512, 512, 1024]
    - [90, 1.91]
  - - [512, 256, 1, 2048, 512, 512, 512, 2048]
    - [38, 2.387]
  - - [512, 256, 1, 4096, 512, 512, 512, 4096]
    - [63, 3.472]
  - - [512, 256, 1, 8192, 512, 512, 512, 8192]
    - [21, 3.651]
  - - [512, 512, 1, 128, 512, 512, 512, 128]
    - [43, 0.939]
  - - [512, 512, 1, 256, 512, 512, 512, 256]
    - [72, 1.591]
  - - [512, 512, 1, 512, 512, 512, 512, 512]
    - [75, 2.231]
  - - [512, 512, 1, 1024, 512, 512, 512, 1024]
    - [64, 2.581]
  - - [512, 512, 1, 2048, 512, 512, 512, 2048]
    - [31, 3.085]
  - - [512, 512, 1, 4096, 512, 512, 512, 4096]
    - [60, 3.91]
  - - [512, 512, 1, 8192, 512, 512, 512, 8192]
    - [9, 4.817]
  - - [512, 1024, 1, 128, 512, 512, 512, 128]
    - [59, 1.333]
  - - [512, 1024, 1, 256, 512, 512, 512, 256]
    - [65, 2.248]
  - - [512, 1024, 1, 512, 512, 512, 512, 512]
    - [64, 3.211]
  - - [512, 1024, 1, 1024, 512, 512, 512, 1024]
    - [83, 3.555]
  - - [512, 1024, 1, 2048, 512, 512, 512, 2048]
    - [10, 4.087]
  - - [512, 1024, 1, 4096, 512, 512, 512, 4096]
    - [59, 4.652]
  - - [512, 1024, 1, 8192, 512, 512, 512, 8192]
    - [9, 5.65]
  - - [512, 2048, 1, 128, 512, 512, 512, 128]
    - [24, 1.67]
  - - [512, 2048, 1, 256, 512, 512, 512, 256]
    - [21, 2.646]
  - - [512, 2048, 1, 512, 512, 512, 512, 512]
    - [67, 3.538]
  - - [512, 2048, 1, 1024, 512, 512, 512, 1024]
    - [75, 4.123]
  - - [512, 2048, 1, 2048, 512, 512, 512, 2048]
    - [60, 4.948]
  - - [512, 2048, 1, 4096, 512, 512, 512, 4096]
    - [15, 5.476]
  - - [512, 2048, 1, 8192, 512, 512, 512, 8192]
    - [12, 6.245]
  - - [512, 4096, 1, 128, 512, 512, 512, 128]
    - [36, 2.009]
  - - [512, 4096, 1, 256, 512, 512, 512, 256]
    - [13, 3.19]
  - - [512, 4096, 1, 512, 512, 512, 512, 512]
    - [60, 4.344]
  - - [512, 4096, 1, 1024, 512, 512, 512, 1024]
    - [59, 5.436]
  - - [512, 4096, 1, 2048, 512, 512, 512, 2048]
    - [59, 6.156]
  - - [512, 4096, 1, 4096, 512, 512, 512, 4096]
    - [16, 6.164]
  - - [512, 4096, 1, 8192, 512, 512, 512, 8192]
    - [17, 7.096]
  - - [512, 8192, 1, 128, 512, 512, 512, 128]
    - [21, 2.473]
  - - [512, 8192, 1, 256, 512, 512, 512, 256]
    - [36, 3.78]
  - - [512, 8192, 1, 512, 512, 512, 512, 512]
    - [33, 5.179]
  - - [512, 8192, 1, 1024, 512, 512, 512, 1024]
    - [31, 6.224]
  - - [512, 8192, 1, 2048, 512, 512, 512, 2048]
    - [55, 6.848]
  - - [512, 8192, 1, 4096, 512, 512, 512, 4096]
    - [12, 7.527]
  - - [512, 8192, 1, 8192, 512, 512, 512, 8192]
    - [16, 8.06]
  - - [1024, 128, 1, 128, 1024, 1024, 1024, 128]
    - [79, 0.537]
  - - [1024, 128, 1, 256, 1024, 1024, 1024, 256]
    - [90, 0.889]
  - - [1024, 128, 1, 512, 1024, 1024, 1024, 512]
    - [90, 1.385]
  - - [1024, 128, 1, 1024, 1024, 1024, 1024, 1024]
    - [90, 1.864]
  - - [1024, 128, 1, 2048, 1024, 1024, 1024, 2048]
    - [39, 2.316]
  - - [1024, 128, 1, 4096, 1024, 1024, 1024, 4096]
    - [60, 3.474]
  - - [1024, 128, 1, 8192, 1024, 1024, 1024, 8192]
    - [23, 3.568]
  - - [1024, 256, 1, 128, 1024, 1024, 1024, 128]
    - [71, 0.946]
  - - [1024, 256, 1, 256, 1024, 1024, 1024, 256]
    - [70, 1.588]
  - - [1024, 256, 1, 512, 1024, 1024, 1024, 512]
    - [76, 2.228]
  - - [1024, 256, 1, 1024, 1024, 1024, 1024, 1024]
    - [63, 2.547]
  - - [1024, 256, 1, 2048, 1024, 1024, 1024, 2048]
    - [22, 3.053]
  - - [1024, 256, 1, 4096, 1024, 1024, 1024, 4096]
    - [67, 3.862]
  - - [1024, 256, 1, 8192, 1024, 1024, 1024, 8192]
    - [12, 4.809]
  - - [1024, 512, 1, 128, 1024, 1024, 1024, 128]
    - [62, 1.365]
  - - [1024, 512, 1, 256, 1024, 1024, 1024, 256]
    - [61, 2.316]
  - - [1024, 512, 1, 512, 1024, 1024, 1024, 512]
    - [63, 3.109]
  - - [1024, 512, 1, 1024, 1024, 1024, 1024, 1024]
    - [82, 3.467]
  - - [1024, 512, 1, 2048, 1024, 1024, 1024, 2048]
    - [19, 4.046]
  - - [1024, 512, 1, 4096, 1024, 1024, 1024, 4096]
    - [64, 4.577]
  - - [1024, 512, 1, 8192, 1024, 1024, 1024, 8192]
    - [12, 5.603]
  - - [1024, 1024, 1, 128, 1024, 1024, 1024, 128]
    - [25, 1.715]
  - - [1024, 1024, 1, 256, 1024, 1024, 1024, 256]
    - [31, 2.722]
  - - [1024, 1024, 1, 512, 1024, 1024, 1024, 512]
    - [64, 3.591]
  - - [1024, 1024, 1, 1024, 1024, 1024, 1024, 1024]
    - [73, 4.105]
  - - [1024, 1024, 1, 2048, 1024, 1024, 1024, 2048]
    - [66, 4.812]
  - - [1024, 1024, 1, 4096, 1024, 1024, 1024, 4096]
    - [9, 5.473]
  - - [1024, 1024, 1, 8192, 1024, 1024, 1024, 8192]
    - [49, 6.122]
  - - [1024, 2048, 1, 128, 1024, 1024, 1024, 128]
    - [36, 2.045]
  - - [1024, 2048, 1, 256, 1024, 1024, 1024, 256]
    - [19, 3.336]
  - - [1024, 2048, 1, 512, 1024, 1024, 1024, 512]
    - [60, 4.469]
  - - [1024, 2048, 1, 1024, 1024, 1024, 1024, 1024]
    - [60, 5.507]
  - - [1024, 2048, 1, 2048, 1024, 1024, 1024, 2048]
    - [64, 6.122]
  - - [1024, 2048, 1, 4096, 1024, 1024, 1024, 4096]
    - [20, 5.853]
  - - [1024, 2048, 1, 8192, 1024, 1024, 1024, 8192]
    - [12, 7.027]
  - - [1024, 4096, 1, 128, 1024, 1024, 1024, 128]
    - [31, 2.515]
  - - [1024, 4096, 1, 256, 1024, 1024, 1024, 256]
    - [22, 3.819]
  - - [1024, 4096, 1, 512, 1024, 1024, 1024, 512]
    - [31, 5.204]
  - - [1024, 4096, 1, 1024, 1024, 1024, 1024, 1024]
    - [28, 6.226]
  - - [1024, 4096, 1, 2048, 1024, 1024, 1024, 2048]
    - [54, 6.768]
  - - [1024, 4096, 1, 4096, 1024, 1024, 1024, 4096]
    - [10, 7.037]
  - - [1024, 4096, 1, 8192, 1024, 1024, 1024, 8192]
    - [53, 7.303]
  - - [1024, 8192, 1, 128, 1024, 1024, 1024, 128]
    - [11, 2.548]
  - - [1024, 8192, 1, 256, 1024, 1024, 1024, 256]
    - [16, 4.155]
  - - [1024, 8192, 1, 512, 1024, 1024, 1024, 512]
    - [13, 5.764]
  - - [1024, 8192, 1, 1024, 1024, 1024, 1024, 1024]
    - [10, 7.295]
  - - [1024, 8192, 1, 2048, 1024, 1024, 1024, 2048]
    - [50, 7.066]
  - - [1024, 8192, 1, 4096, 1024, 1024, 1024, 4096]
    - [10, 7.509]
  - - [1024, 8192, 1, 8192, 1024, 1024, 1024, 8192]
    - [47, 7.626]
  - - [2048, 128, 1, 128, 2048, 2048, 2048, 128]
    - [42, 0.997]
  - - [2048, 128, 1, 256, 2048, 2048, 2048, 256]
    - [70, 1.594]
  - - [2048, 128, 1, 512, 2048, 2048, 2048, 512]
    - [75, 2.144]
  - - [2048, 128, 1, 1024, 2048, 2048, 2048, 1024]
    - [59, 2.554]
  - - [2048, 128, 1, 2048, 2048, 2048, 2048, 2048]
    - [22, 3.018]
  - - [2048, 128, 1, 4096, 2048, 2048, 2048, 4096]
    - [63, 3.781]
  - - [2048, 128, 1, 8192, 2048, 2048, 2048, 8192]
    - [12, 4.629]
  - - [2048, 256, 1, 128, 2048, 2048, 2048, 128]
    - [64, 1.353]
  - - [2048, 256, 1, 256, 2048, 2048, 2048, 256]
    - [61, 2.268]
  - - [2048, 256, 1, 512, 2048, 2048, 2048, 512]
    - [59, 3.127]
  - - [2048, 256, 1, 1024, 2048, 2048, 2048, 1024]
    - [83, 3.374]
  - - [2048, 256, 1, 2048, 2048, 2048, 2048, 2048]
    - [17, 4.016]
  - - [2048, 256, 1, 4096, 2048, 2048, 2048, 4096]
    - [63, 4.599]
  - - [2048, 256, 1, 8192, 2048, 2048, 2048, 8192]
    - [20, 5.537]
  - - [2048, 512, 1, 128, 2048, 2048, 2048, 128]
    - [33, 1.782]
  - - [2048, 512, 1, 256, 2048, 2048, 2048, 256]
    - [30, 2.757]
  - - [2048, 512, 1, 512, 2048, 2048, 2048, 512]
    - [59, 3.629]
  - - [2048, 512, 1, 1024, 2048, 2048, 2048, 1024]
    - [76, 3.972]
  - - [2048, 512, 1, 2048, 2048, 2048, 2048, 2048]
    - [67, 4.862]
  - - [2048, 512, 1, 4096, 2048, 2048, 2048, 4096]
    - [15, 5.431]
  - - [2048, 512, 1, 8192, 2048, 2048, 2048, 8192]
    - [45, 6.093]
  - - [2048, 1024, 1, 128, 2048, 2048, 2048, 128]
    - [20, 2.1]
  - - [2048, 1024, 1, 256, 2048, 2048, 2048, 256]
    - [15, 3.336]
  - - [2048, 1024, 1, 512, 2048, 2048, 2048, 512]
    - [60, 4.39]
  - - [2048, 1024, 1, 1024, 2048, 2048, 2048, 1024]
    - [60, 5.371]
  - - [2048, 1024, 1, 2048, 2048, 2048, 2048, 2048]
    - [67, 5.947]
  - - [2048, 1024, 1, 4096, 2048, 2048, 2048, 4096]
    - [55, 5.666]
  - - [2048, 1024, 1, 8192, 2048, 2048, 2048, 8192]
    - [12, 6.877]
  - - [2048, 2048, 1, 128, 2048, 2048, 2048, 128]
    - [35, 2.509]
  - - [2048, 2048, 1, 256, 2048, 2048, 2048, 256]
    - [21, 3.762]
  - - [2048, 2048, 1, 512, 2048, 2048, 2048, 512]
    - [27, 5.043]
  - - [2048, 2048, 1, 1024, 2048, 2048, 2048, 1024]
    - [31, 6.211]
  - - [2048, 2048, 1, 2048, 2048, 2048, 2048, 2048]
    - [56, 6.65]
  - - [2048, 2048, 1, 4096, 2048, 2048, 2048, 4096]
    - [9, 6.884]
  - - [2048, 2048, 1, 8192, 2048, 2048, 2048, 8192]
    - [12, 7.427]
  - - [2048, 4096, 1, 128, 2048, 2048, 2048, 128]
    - [9, 2.577]
  - - [2048, 4096, 1, 256, 2048, 2048, 2048, 256]
    - [12, 4.178]
  - - [2048, 4096, 1, 512, 2048, 2048, 2048, 512]
    - [12, 5.766]
  - - [2048, 4096, 1, 1024, 2048, 2048, 2048, 1024]
    - [10, 7.318]
  - - [2048, 4096, 1, 2048, 2048, 2048, 2048, 2048]
    - [45, 7.579]
  - - [2048, 4096, 1, 4096, 2048, 2048, 2048, 4096]
    - [15, 7.466]
  - - [2048, 4096, 1, 8192, 2048, 2048, 2048, 8192]
    - [0, 7.837]
  - - [2048, 8192, 1, 128, 2048, 2048, 2048, 128]
    - [28, 2.475]
  - - [2048, 8192, 1, 256, 2048, 2048, 2048, 256]
    - [4, 3.712]
  - - [2048, 8192, 1, 512, 2048, 2048, 2048, 512]
    - [7, 5.176]
  - - [2048, 8192, 1, 1024, 2048, 2048, 2048, 1024]
    - [5, 6.78]
  - - [2048, 8192, 1, 2048, 2048, 2048, 2048, 2048]
    - [19, 7.63]
  - - [2048, 8192, 1, 4096, 2048, 2048, 2048, 4096]
    - [48, 7.69]
  - - [2048, 8192, 1, 8192, 2048, 2048, 2048, 8192]
    - [51, 8.209]
  - - [4096, 128, 1, 128, 4096, 4096, 4096, 128]
    - [41, 1.305]
  - - [4096, 128, 1, 256, 4096, 4096, 4096, 256]
    - [59, 2.226]
  - - [4096, 128, 1, 512, 4096, 4096, 4096, 512]
    - [60, 3.171]
  - - [4096, 128, 1, 1024, 4096, 4096, 4096, 1024]
    - [84, 3.312]
  - - [4096, 128, 1, 2048, 4096, 4096, 4096, 2048]
    - [20, 4.003]
  - - [4096, 128, 1, 4096, 4096, 4096, 4096, 4096]
    - [64, 4.609]
  - - [4096, 128, 1, 8192, 4096, 4096, 4096, 8192]
    - [15, 5.58]
  - - [4096, 256, 1, 128, 4096, 4096, 4096, 128]
    - [30, 1.78]
  - - [4096, 256, 1, 256, 4096, 4096, 4096, 256]
    - [30, 2.735]
  - - [4096, 256, 1, 512, 4096, 4096, 4096, 512]
    - [63, 3.459]
  - - [4096, 256, 1, 1024, 4096, 4096, 4096, 1024]
    - [75, 3.998]
  - - [4096, 256, 1, 2048, 4096, 4096, 4096, 2048]
    - [67, 4.93]
  - - [4096, 256, 1, 4096, 4096, 4096, 4096, 4096]
    - [17, 5.525]
  - - [4096, 256, 1, 8192, 4096, 4096, 4096, 8192]
    - [12, 6.262]
  - - [4096, 512, 1, 128, 4096, 4096, 4096, 128]
    - [19, 2.093]
  - - [4096, 512, 1, 256, 4096, 4096, 4096, 256]
    - [10, 3.383]
  - - [4096, 512, 1, 512, 4096, 4096, 4096, 512]
    - [66, 4.226]
  - - [4096, 512, 1, 1024, 4096, 4096, 4096, 1024]
    - [66, 5.353]
  - - [4096, 512, 1, 2048, 4096, 4096, 4096, 2048]
    - [67, 5.855]
  - - [4096, 512, 1, 4096, 4096, 4096, 4096, 4096]
    - [12, 6.157]
  - - [4096, 512, 1, 8192, 4096, 4096, 4096, 8192]
    - [10, 7.183]
  - - [4096, 1024, 1, 128, 4096, 4096, 4096, 128]
    - [34, 2.471]
  - - [4096, 1024, 1, 256, 4096, 4096, 4096, 256]
    - [30, 3.649]
  - - [4096, 1024, 1, 512, 4096, 4096, 4096, 512]
    - [27, 5.077]
  - - [4096, 1024, 1, 1024, 4096, 4096, 4096, 1024]
    - [28, 6.063]
  - - [4096, 1024, 1, 2048, 4096, 4096, 4096, 2048]
    - [56, 6.761]
  - - [4096, 1024, 1, 4096, 4096, 4096, 4096, 4096]
    - [9, 7.282]
  - - [4096, 1024, 1, 8192, 4096, 4096, 4096, 8192]
    - [10, 7.965]
  - - [4096, 2048, 1, 128, 4096, 4096, 4096, 128]
    - [18, 2.544]
  - - [4096, 2048, 1, 256, 4096, 4096, 4096, 256]
    - [12, 4.19]
  - - [4096, 2048, 1, 512, 4096, 4096, 4096, 512]
    - [19, 5.755]
  - - [4096, 2048, 1, 1024, 4096, 4096, 4096, 1024]
    - [9, 7.315]
  - - [4096, 2048, 1, 2048, 4096, 4096, 4096, 2048]
    - [49, 7.449]
  - - [4096, 2048, 1, 4096, 4096, 4096, 4096, 4096]
    - [13, 7.85]
  - - [4096, 2048, 1, 8192, 4096, 4096, 4096, 8192]
    - [9, 8.044]
  - - [4096, 4096, 1, 128, 4096, 4096, 4096, 128]
    - [32, 2.444]
  - - [4096, 4096, 1, 256, 4096, 4096, 4096, 256]
    - [4, 3.724]
  - - [4096, 4096, 1, 512, 4096, 4096, 4096, 512]
    - [3, 5.272]
  - - [4096, 4096, 1, 1024, 4096, 4096, 4096, 1024]
    - [2, 6.897]
  - - [4096, 4096, 1, 2048, 4096, 4096, 4096, 2048]
    - [19, 7.632]
  - - [4096, 4096, 1, 4096, 4096, 4096, 4096, 4096]
    - [9, 8.286]
  - - [4096, 4096, 1, 8192, 4096, 4096, 4096, 8192]
    - [52, 8.289]
  - - [4096, 8192, 1, 128, 4096, 4096, 4096, 128]
    - [25, 2.308]
  - - [4096, 8192, 1, 256, 4096, 4096, 4096, 256]
    - [60, 3.438]
  - - [4096, 8192, 1, 512, 4096, 4096, 4096, 512]
    - [19, 4.88]
  - - [4096, 8192, 1, 1024, 4096, 4096, 4096, 1024]
    - [9, 6.624]
  - - [4096, 8192, 1, 2048, 4096, 4096, 4096, 2048]
    - [12, 7.701]
  - - [4096, 8192, 1, 4096, 4096, 4096, 4096, 4096]
    - [6, 8.407]
  - - [4096, 8192, 1, 8192, 4096, 4096, 4096, 8192]
    - [4, 8.841]
  - - [8192, 128, 1, 128, 8192, 8192, 8192, 128]
    - [21, 1.84]
  - - [8192, 128, 1, 256, 8192, 8192, 8192, 256]
    - [28, 2.662]
  - - [8192, 128, 1, 512, 8192, 8192, 8192, 512]
    - [66, 3.341]
  - - [8192, 128, 1, 1024, 8192, 8192, 8192, 1024]
    - [75, 3.835]
  - - [8192, 128, 1, 2048, 8192, 8192, 8192, 2048]
    - [66, 4.897]
  - - [8192, 128, 1, 4096, 8192, 8192, 8192, 4096]
    - [17, 5.567]
  - - [8192, 128, 1, 8192, 8192, 8192, 8192, 8192]
    - [15, 6.124]
  - - [8192, 256, 1, 128, 8192, 8192, 8192, 128]
    - [9, 2.126]
  - - [8192, 256, 1, 256, 8192, 8192, 8192, 256]
    - [17, 3.269]
  - - [8192, 256, 1, 512, 8192, 8192, 8192, 512]
    - [66, 4.214]
  - - [8192, 256, 1, 1024, 8192, 8192, 8192, 1024]
    - [67, 5.278]
  - - [8192, 256, 1, 2048, 8192, 8192, 8192, 2048]
    - [64, 6.023]
  - - [8192, 256, 1, 4096, 8192, 8192, 8192, 4096]
    - [13, 6.139]
  - - [8192, 256, 1, 8192, 8192, 8192, 8192, 8192]
    - [10, 7.37]
  - - [8192, 512, 1, 128, 8192, 8192, 8192, 128]
    - [25, 2.399]
  - - [8192, 512, 1, 256, 8192, 8192, 8192, 256]
    - [32, 3.647]
  - - [8192, 512, 1, 512, 8192, 8192, 8192, 512]
    - [34, 5.073]
  - - [8192, 512, 1, 1024, 8192, 8192, 8192, 1024]
    - [34, 6.149]
  - - [8192, 512, 1, 2048, 8192, 8192, 8192, 2048]
    - [56, 6.724]
  - - [8192, 512, 1, 4096, 8192, 8192, 8192, 4096]
    - [10, 7.611]
  - - [8192, 512, 1, 8192, 8192, 8192, 8192, 8192]
    - [16, 7.576]
  - - [8192, 1024, 1, 128, 8192, 8192, 8192, 128]
    - [16, 2.532]
  - - [8192, 1024, 1, 256, 8192, 8192, 8192, 256]
    - [9, 4.156]
  - - [8192, 1024, 1, 512, 8192, 8192, 8192, 512]
    - [19, 5.742]
  - - [8192, 1024, 1, 1024, 8192, 8192, 8192, 1024]
    - [20, 7.204]
  - - [8192, 1024, 1, 2048, 8192, 8192, 8192, 2048]
    - [49, 7.424]
  - - [8192, 1024, 1, 4096, 8192, 8192, 8192, 4096]
    - [15, 7.731]
  - - [8192, 1024, 1, 8192, 8192, 8192, 8192, 8192]
    - [19, 8.368]
  - - [8192, 2048, 1, 128, 8192, 8192, 8192, 128]
    - [35, 2.384]
  - - [8192, 2048, 1, 256, 8192, 8192, 8192, 256]
    - [4, 3.689]
  - - [8192, 2048, 1, 512, 8192, 8192, 8192, 512]
    - [2, 5.351]
  - - [8192, 2048, 1, 1024, 8192, 8192, 8192, 1024]
    - [1, 6.884]
  - - [8192, 2048, 1, 2048, 8192, 8192, 8192, 2048]
    - [10, 8.054]
  - - [8192, 2048, 1, 4096, 8192, 8192, 8192, 4096]
    - [10, 8.201]
  - - [8192, 2048, 1, 8192, 8192, 8192, 8192, 8192]
    - [9, 8.438]
  - - [8192, 4096, 1, 128, 8192, 8192, 8192, 128]
    - [26, 2.232]
  - - [8192, 4096, 1, 256, 8192, 8192, 8192, 256]
    - [66, 3.515]
  - - [8192, 4096, 1, 512, 8192, 8192, 8192, 512]
    - [13, 5.058]
  - - [8192, 4096, 1, 1024, 8192, 8192, 8192, 1024]
    - [13, 6.657]
  - - [8192, 4096, 1, 2048, 8192, 8192, 8192, 2048]
    - [10, 7.833]
  - - [8192, 4096, 1, 4096, 8192, 8192, 8192, 4096]
    - [9, 8.56]
  - - [8192, 4096, 1, 8192, 8192, 8192, 8192, 8192]
    - [6, 8.846]
  - - [8192, 8192, 1, 128, 8192, 8192, 8192, 128]
    - [28, 2.165]
  - - [8192, 8192, 1, 256, 8192, 8192, 8192, 256]
    - [13, 3.635]
  - - [8192, 8192, 1, 512, 8192, 8192, 8192, 512]
    - [17, 5.397]
  - - [8192, 8192, 1, 1024, 8192, 8192, 8192, 1024]
    - [9, 6.869]
  - - [8192, 8192, 1, 2048, 8192, 8192, 8192, 2048]
    - [17, 7.953]
  - - [8192, 8192, 1, 4096, 8192, 8192, 8192, 4096]
    - [14, 8.403]
  - - [8192, 8192, 1, 8192, 8192, 8192, 8192, 8192]
    - [4, 8.499]
  - - [1, 1, 1, 32, 1, 1, 1, 32]
    - [98, 0.0]
- null
- null
- DeviceEfficiency
- GridBased
