library/src/amd_detail/rocblaslt/src/Tensile/Logic/streamk/gfx942_38cu/aquavanjaram942_Cijk_Ailk_Bjlk_HHS_BH_UserArgs.yaml
- {MinimumRequiredVersion: 4.33.0}
- aquavanjaram942
- {Architecture: gfx942, CUCount: 38}
- [Device 0049, Device 0050]
    SolutionIndex: 0
    SolutionNameMin: Cijk_Ailk_Bjlk_HHS_BH_UserArgs_MT256x256x32_MI16x16x1_SN_LDSB1_CLR1_GSU0_GSUC0_GSUWGMRR0_K1_LBSPPA2048_LBSPPB2048_LPA32_LPB0_MIWT8_8_PLR1_SU32_SUM0_SUS256_VWA2_VWB4_WGM1_WGMXCC1_WGMXCCGn1
    SolutionIndex: 1
    SolutionNameMin: Cijk_Ailk_Bjlk_HHS_BH_UserArgs_MT256x256x32_MI16x16x1_SN_LDSB1_CLR1_GSU0_GSUC0_GSUWGMRR0_K1_LBSPPA2048_LBSPPB2048_LPA32_LPB0_MIWT8_8_PLR1_SU32_SUM0_SUS256_VWA2_VWB8_WGM1_WGMXCC1_WGMXCCGn1
    SolutionIndex: 2
    SolutionNameMin: Cijk_Ailk_Bjlk_HHS_BH_UserArgs_MT256x256x32_MI16x16x1_SN_LDSB0_CLR1_GSU0_GSUC0_GSUWGMRR0_K1_LBSPPA2048_LBSPPB2048_LPA0_LPB0_MIWT8_8_PLR1_SU32_SUM0_SUS256_VWA4_VWB8_WGM1_WGMXCC1_WGMXCCGn1
    SolutionIndex: 3
    SolutionNameMin: Cijk_Ailk_Bjlk_HHS_BH_UserArgs_MT256x256x32_MI16x16x1_SN_LDSB0_CLR1_GSU0_GSUC0_GSUWGMRR0_K1_LBSPPA2048_LBSPPB2048_LPA0_LPB0_MIWT8_8_PLR1_SU32_SUM0_SUS256_VWA8_VWB8_WGM1_WGMXCC1_WGMXCCGn1
    SolutionIndex: 4
    SolutionNameMin: Cijk_Ailk_Bjlk_HHS_BH_UserArgs_MT256x256x32_MI16x16x1_SN_LDSB1_CLR1_GSU0_GSUC0_GSUWGMRR0_K1_LBSPPA2048_LBSPPB2048_LPA32_LPB0_MIWT8_8_PLR1_SU32_SUM0_SUS256_VWA2_VWB8_WGM4_WGMXCC1_WGMXCCGn1
    SolutionIndex: 5
    SolutionNameMin: Cijk_Ailk_Bjlk_HHS_BH_UserArgs_MT256x256x32_MI16x16x1_SN_LDSB0_CLR1_GSU0_GSUC0_GSUWGMRR0_K1_LBSPPA2048_LBSPPB2048_LPA0_LPB0_MIWT8_8_PLR1_SU32_SUM0_SUS256_VWA8_VWB8_WGM4_WGMXCC1_WGMXCCGn1
    SolutionIndex: 6
    SolutionNameMin: Cijk_Ailk_Bjlk_HHS_BH_UserArgs_MT256x256x32_MI16x16x1_SN_LDSB1_CLR1_GSU0_GSUC0_GSUWGMRR0_K1_LBSPPA2048_LBSPPB2048_LPA32_LPB32_MIWT8_8_PLR1_SU32_SUM0_SUS256_VWA2_VWB2_WGM8_WGMXCC1_WGMXCCGn1
    SolutionIndex: 7
    SolutionNameMin: Cijk_Ailk_Bjlk_HHS_BH_UserArgs_MT256x256x32_MI16x16x1_SN_LDSB0_CLR1_GSU0_GSUC0_GSUWGMRR0_K1_LBSPPA2048_LBSPPB2048_LPA0_LPB0_MIWT8_8_PLR1_SU32_SUM0_SUS256_VWA8_VWB4_WGM8_WGMXCC1_WGMXCCGn1
    SolutionIndex: 8
    SolutionNameMin: Cijk_Ailk_Bjlk_HHS_BH_UserArgs_MT128x256x32_MI16x16x1_SN_LDSB1_CLR1_GSU0_GSUC0_GSUWGMRR0_K1_LBSPPA1024_LBSPPB2048_LPA0_LPB32_MIWT4_8_PLR1_SU32_SUM0_SUS256_VWA4_VWB2_WGM1_WGMXCC1_WGMXCCGn1
    SolutionIndex: 9
    SolutionNameMin: Cijk_Ailk_Bjlk_HHS_BH_UserArgs_MT128x256x32_MI16x16x1_SN_LDSB1_CLR1_GSU0_GSUC0_GSUWGMRR0_K1_LBSPPA1024_LBSPPB2048_LPA0_LPB0_MIWT4_8_PLR1_SU32_SUM0_SUS256_VWA4_VWB4_WGM1_WGMXCC1_WGMXCCGn1
    SolutionIndex: 10
    SolutionNameMin: Cijk_Ailk_Bjlk_HHS_BH_UserArgs_MT128x256x32_MI16x16x1_SN_LDSB1_CLR1_GSU0_GSUC0_GSUWGMRR0_K1_LBSPPA1024_LBSPPB2048_LPA0_LPB0_MIWT4_8_PLR1_SU32_SUM0_SUS256_VWA4_VWB8_WGM1_WGMXCC1_WGMXCCGn1
    SolutionIndex: 11
    SolutionNameMin: Cijk_Ailk_Bjlk_HHS_BH_UserArgs_MT128x256x32_MI16x16x1_SN_LDSB1_CLR1_GSU0_GSUC0_GSUWGMRR0_K1_LBSPPA1024_LBSPPB2048_LPA0_LPB32_MIWT4_8_PLR1_SU32_SUM0_SUS256_VWA4_VWB2_WGM4_WGMXCC1_WGMXCCGn1
    SolutionIndex: 12
    SolutionNameMin: Cijk_Ailk_Bjlk_HHS_BH_UserArgs_MT128x256x32_MI16x16x1_SN_LDSB1_CLR1_GSU0_GSUC0_GSUWGMRR0_K1_LBSPPA1024_LBSPPB2048_LPA32_LPB0_MIWT4_8_PLR1_SU32_SUM0_SUS256_VWA2_VWB4_WGM4_WGMXCC1_WGMXCCGn1
    SolutionIndex: 13
    SolutionNameMin: Cijk_Ailk_Bjlk_HHS_BH_UserArgs_MT128x256x32_MI16x16x1_SN_LDSB1_CLR1_GSU0_GSUC0_GSUWGMRR0_K1_LBSPPA1024_LBSPPB2048_LPA0_LPB0_MIWT4_8_PLR1_SU32_SUM0_SUS256_VWA4_VWB8_WGM4_WGMXCC1_WGMXCCGn1
    SolutionIndex: 14
    SolutionNameMin: Cijk_Ailk_Bjlk_HHS_BH_UserArgs_MT128x256x32_MI16x16x1_SN_LDSB1_CLR1_GSU0_GSUC0_GSUWGMRR0_K1_LBSPPA1024_LBSPPB2048_LPA32_LPB0_MIWT4_8_PLR1_SU32_SUM0_SUS256_VWA2_VWB4_WGM8_WGMXCC1_WGMXCCGn1
    SolutionIndex: 15
    SolutionNameMin: Cijk_Ailk_Bjlk_HHS_BH_UserArgs_MT128x256x32_MI16x16x1_SN_LDSB1_CLR1_GSU0_GSUC0_GSUWGMRR0_K1_LBSPPA1024_LBSPPB2048_LPA0_LPB0_MIWT4_8_PLR1_SU32_SUM0_SUS256_VWA4_VWB4_WGM8_WGMXCC1_WGMXCCGn1
    SolutionIndex: 16
    SolutionNameMin: Cijk_Ailk_Bjlk_HHS_BH_UserArgs_MT128x256x32_MI16x16x1_SN_LDSB1_CLR1_GSU0_GSUC0_GSUWGMRR0_K1_LBSPPA1024_LBSPPB2048_LPA0_LPB0_MIWT4_8_PLR1_SU32_SUM0_SUS256_VWA4_VWB8_WGM8_WGMXCC1_WGMXCCGn1
    SolutionIndex: 17
    SolutionNameMin: Cijk_Ailk_Bjlk_HHS_BH_UserArgs_MT256x128x32_MI16x16x1_SN_LDSB1_CLR1_GSU0_GSUC0_GSUWGMRR0_K1_LBSPPA2048_LBSPPB1024_LPA0_LPB16_MIWT8_4_PLR1_SU32_SUM0_SUS256_VWA8_VWB1_WGM1_WGMXCC1_WGMXCCGn1
    SolutionIndex: 18
    SolutionNameMin: Cijk_Ailk_Bjlk_HHS_BH_UserArgs_MT256x128x32_MI16x16x1_SN_LDSB1_CLR1_GSU0_GSUC0_GSUWGMRR0_K1_LBSPPA2048_LBSPPB1024_LPA0_LPB32_MIWT8_4_PLR1_SU32_SUM0_SUS256_VWA4_VWB2_WGM1_WGMXCC1_WGMXCCGn1
    SolutionIndex: 19
    SolutionNameMin: Cijk_Ailk_Bjlk_HHS_BH_UserArgs_MT256x128x32_MI16x16x1_SN_LDSB1_CLR1_GSU0_GSUC0_GSUWGMRR0_K1_LBSPPA2048_LBSPPB1024_LPA0_LPB32_MIWT8_4_PLR1_SU32_SUM0_SUS256_VWA8_VWB2_WGM1_WGMXCC1_WGMXCCGn1
    SolutionIndex: 20
    SolutionNameMin: Cijk_Ailk_Bjlk_HHS_BH_UserArgs_MT256x128x32_MI16x16x1_SN_LDSB1_CLR1_GSU0_GSUC0_GSUWGMRR0_K1_LBSPPA2048_LBSPPB1024_LPA32_LPB0_MIWT8_4_PLR1_SU32_SUM0_SUS256_VWA2_VWB4_WGM1_WGMXCC1_WGMXCCGn1
    SolutionIndex: 21
    SolutionNameMin: Cijk_Ailk_Bjlk_HHS_BH_UserArgs_MT256x128x32_MI16x16x1_SN_LDSB1_CLR1_GSU0_GSUC0_GSUWGMRR0_K1_LBSPPA2048_LBSPPB1024_LPA0_LPB0_MIWT8_4_PLR1_SU32_SUM0_SUS256_VWA4_VWB4_WGM1_WGMXCC1_WGMXCCGn1
    SolutionIndex: 22
    SolutionNameMin: Cijk_Ailk_Bjlk_HHS_BH_UserArgs_MT256x128x32_MI16x16x1_SN_LDSB1_CLR1_GSU0_GSUC0_GSUWGMRR0_K1_LBSPPA2048_LBSPPB1024_LPA0_LPB0_MIWT8_4_PLR1_SU32_SUM0_SUS256_VWA8_VWB4_WGM1_WGMXCC1_WGMXCCGn1
    SolutionIndex: 23
    SolutionNameMin: Cijk_Ailk_Bjlk_HHS_BH_UserArgs_MT256x128x32_MI16x16x1_SN_LDSB1_CLR1_GSU0_GSUC0_GSUWGMRR0_K1_LBSPPA2048_LBSPPB1024_LPA0_LPB16_MIWT8_4_PLR1_SU32_SUM0_SUS256_VWA8_VWB1_WGM4_WGMXCC1_WGMXCCGn1
    SolutionIndex: 24
    SolutionNameMin: Cijk_Ailk_Bjlk_HHS_BH_UserArgs_MT256x128x32_MI16x16x1_SN_LDSB1_CLR1_GSU0_GSUC0_GSUWGMRR0_K1_LBSPPA2048_LBSPPB1024_LPA0_LPB32_MIWT8_4_PLR1_SU32_SUM0_SUS256_VWA4_VWB2_WGM4_WGMXCC1_WGMXCCGn1
    SolutionIndex: 25
    SolutionNameMin: Cijk_Ailk_Bjlk_HHS_BH_UserArgs_MT256x128x32_MI16x16x1_SN_LDSB1_CLR1_GSU0_GSUC0_GSUWGMRR0_K1_LBSPPA2048_LBSPPB1024_LPA0_LPB32_MIWT8_4_PLR1_SU32_SUM0_SUS256_VWA8_VWB2_WGM4_WGMXCC1_WGMXCCGn1
    SolutionIndex: 26
    SolutionNameMin: Cijk_Ailk_Bjlk_HHS_BH_UserArgs_MT256x128x32_MI16x16x1_SN_LDSB1_CLR1_GSU0_GSUC0_GSUWGMRR0_K1_LBSPPA2048_LBSPPB1024_LPA0_LPB0_MIWT8_4_PLR1_SU32_SUM0_SUS256_VWA4_VWB4_WGM4_WGMXCC1_WGMXCCGn1
    SolutionIndex: 27
    SolutionNameMin: Cijk_Ailk_Bjlk_HHS_BH_UserArgs_MT256x128x32_MI16x16x1_SN_LDSB1_CLR1_GSU0_GSUC0_GSUWGMRR0_K1_LBSPPA2048_LBSPPB1024_LPA0_LPB0_MIWT8_4_PLR1_SU32_SUM0_SUS256_VWA8_VWB4_WGM4_WGMXCC1_WGMXCCGn1
    SolutionIndex: 28
    SolutionNameMin: Cijk_Ailk_Bjlk_HHS_BH_UserArgs_MT256x128x32_MI16x16x1_SN_LDSB1_CLR1_GSU0_GSUC0_GSUWGMRR0_K1_LBSPPA2048_LBSPPB1024_LPA0_LPB16_MIWT8_4_PLR1_SU32_SUM0_SUS256_VWA8_VWB1_WGM8_WGMXCC1_WGMXCCGn1
    SolutionIndex: 29
    SolutionNameMin: Cijk_Ailk_Bjlk_HHS_BH_UserArgs_MT256x128x32_MI16x16x1_SN_LDSB1_CLR1_GSU0_GSUC0_GSUWGMRR0_K1_LBSPPA2048_LBSPPB1024_LPA32_LPB32_MIWT8_4_PLR1_SU32_SUM0_SUS256_VWA2_VWB2_WGM8_WGMXCC1_WGMXCCGn1
    SolutionIndex: 30
    SolutionNameMin: Cijk_Ailk_Bjlk_HHS_BH_UserArgs_MT256x128x32_MI16x16x1_SN_LDSB1_CLR1_GSU0_GSUC0_GSUWGMRR0_K1_LBSPPA2048_LBSPPB1024_LPA0_LPB32_MIWT8_4_PLR1_SU32_SUM0_SUS256_VWA4_VWB2_WGM8_WGMXCC1_WGMXCCGn1
    SolutionIndex: 31
    SolutionNameMin: Cijk_Ailk_Bjlk_HHS_BH_UserArgs_MT256x128x32_MI16x16x1_SN_LDSB1_CLR1_GSU0_GSUC0_GSUWGMRR0_K1_LBSPPA2048_LBSPPB1024_LPA0_LPB32_MIWT8_4_PLR1_SU32_SUM0_SUS256_VWA8_VWB2_WGM8_WGMXCC1_WGMXCCGn1
    SolutionIndex: 32
    SolutionNameMin: Cijk_Ailk_Bjlk_HHS_BH_UserArgs_MT256x128x32_MI16x16x1_SN_LDSB1_CLR1_GSU0_GSUC0_GSUWGMRR0_K1_LBSPPA2048_LBSPPB1024_LPA0_LPB0_MIWT8_4_PLR1_SU32_SUM0_SUS256_VWA4_VWB4_WGM8_WGMXCC1_WGMXCCGn1
    SolutionIndex: 33
    SolutionNameMin: Cijk_Ailk_Bjlk_HHS_BH_UserArgs_MT256x128x32_MI16x16x1_SN_LDSB1_CLR1_GSU0_GSUC0_GSUWGMRR0_K1_LBSPPA2048_LBSPPB1024_LPA0_LPB0_MIWT8_4_PLR1_SU32_SUM0_SUS256_VWA8_VWB4_WGM8_WGMXCC1_WGMXCCGn1
    SolutionIndex: 34
    SolutionNameMin: Cijk_Ailk_Bjlk_HHS_BH_UserArgs_MT256x64x32_MI16x16x1_SN_LDSB1_CLR1_GSU0_GSUC0_GSUWGMRR0_K1_LBSPPA2048_LBSPPB512_LPA0_LPB16_MIWT8_2_PLR1_SU32_SUM0_SUS256_VWA4_VWB1_WGM1_WGMXCC1_WGMXCCGn1
    SolutionIndex: 35
    SolutionNameMin: Cijk_Ailk_Bjlk_HHS_BH_UserArgs_MT256x64x32_MI16x16x1_SN_LDSB1_CLR1_GSU0_GSUC0_GSUWGMRR0_K1_LBSPPA2048_LBSPPB512_LPA0_LPB16_MIWT8_2_PLR1_SU32_SUM0_SUS256_VWA8_VWB1_WGM1_WGMXCC1_WGMXCCGn1
    SolutionIndex: 36
    SolutionNameMin: Cijk_Ailk_Bjlk_HHS_BH_UserArgs_MT256x64x32_MI16x16x1_SN_LDSB1_CLR1_GSU0_GSUC0_GSUWGMRR0_K1_LBSPPA2048_LBSPPB512_LPA0_LPB32_MIWT8_2_PLR1_SU32_SUM0_SUS256_VWA8_VWB2_WGM1_WGMXCC1_WGMXCCGn1
    SolutionIndex: 37
    SolutionNameMin: Cijk_Ailk_Bjlk_HHS_BH_UserArgs_MT256x64x32_MI16x16x1_SN_LDSB1_CLR1_GSU0_GSUC0_GSUWGMRR0_K1_LBSPPA2048_LBSPPB512_LPA0_LPB16_MIWT8_2_PLR1_SU32_SUM0_SUS256_VWA8_VWB1_WGM8_WGMXCC1_WGMXCCGn1
    SolutionIndex: 38
    SolutionNameMin: Cijk_Ailk_Bjlk_HHS_BH_UserArgs_MT256x64x32_MI16x16x1_SN_LDSB1_CLR1_GSU0_GSUC0_GSUWGMRR0_K1_LBSPPA2048_LBSPPB512_LPA0_LPB32_MIWT8_2_PLR1_SU32_SUM0_SUS256_VWA8_VWB2_WGM8_WGMXCC1_WGMXCCGn1
    SolutionIndex: 39
    SolutionNameMin: Cijk_Ailk_Bjlk_HHS_BH_UserArgs_MT128x128x32_MI16x16x1_SN_LDSB1_CLR1_GSU0_GSUC0_GSUWGMRR0_K1_LBSPPA1024_LBSPPB1024_LPA0_LPB16_MIWT4_4_PLR1_SU32_SUM0_SUS256_VWA4_VWB1_WGM1_WGMXCC1_WGMXCCGn1
    SolutionIndex: 40
    SolutionNameMin: Cijk_Ailk_Bjlk_HHS_BH_UserArgs_MT128x128x32_MI16x16x1_SN_LDSB1_CLR1_GSU0_GSUC0_GSUWGMRR0_K1_LBSPPA1024_LBSPPB1024_LPA32_LPB32_MIWT4_4_PLR1_SU32_SUM0_SUS256_VWA2_VWB2_WGM1_WGMXCC1_WGMXCCGn1
    SolutionIndex: 41
    SolutionNameMin: Cijk_Ailk_Bjlk_HHS_BH_UserArgs_MT128x128x32_MI16x16x1_SN_LDSB1_CLR1_GSU0_GSUC0_GSUWGMRR0_K1_LBSPPA1024_LBSPPB1024_LPA0_LPB32_MIWT4_4_PLR1_SU32_SUM0_SUS256_VWA4_VWB2_WGM1_WGMXCC1_WGMXCCGn1
    SolutionIndex: 42
    SolutionNameMin: Cijk_Ailk_Bjlk_HHS_BH_UserArgs_MT128x128x32_MI16x16x1_SN_LDSB0_CLR1_GSU0_GSUC0_GSUWGMRR0_K1_LBSPPA1024_LBSPPB1024_LPA0_LPB0_MIWT4_4_PLR1_SU32_SUM0_SUS256_VWA4_VWB4_WGM1_WGMXCC1_WGMXCCGn1
    SolutionIndex: 43
    SolutionNameMin: Cijk_Ailk_Bjlk_HHS_BH_UserArgs_MT128x128x32_MI16x16x1_SN_LDSB0_CLR0_GSU0_GSUC0_GSUWGMRR0_K1_LBSPPA1024_LBSPPB1024_LPA0_LPB0_MIWT4_4_PLR0_SU32_SUM0_SUS256_VWA4_VWB4_WGM1_WGMXCC1_WGMXCCGn1
    SolutionIndex: 44
    SolutionNameMin: Cijk_Ailk_Bjlk_HHS_BH_UserArgs_MT128x128x32_MI16x16x1_SN_LDSB1_CLR1_GSU0_GSUC0_GSUWGMRR0_K1_LBSPPA1024_LBSPPB1024_LPA32_LPB16_MIWT4_4_PLR1_SU32_SUM0_SUS256_VWA2_VWB1_WGM4_WGMXCC1_WGMXCCGn1
    SolutionIndex: 45
    SolutionNameMin: Cijk_Ailk_Bjlk_HHS_BH_UserArgs_MT128x128x32_MI16x16x1_SN_LDSB1_CLR1_GSU0_GSUC0_GSUWGMRR0_K1_LBSPPA1024_LBSPPB1024_LPA0_LPB16_MIWT4_4_PLR1_SU32_SUM0_SUS256_VWA4_VWB1_WGM4_WGMXCC1_WGMXCCGn1
    SolutionIndex: 46
    SolutionNameMin: Cijk_Ailk_Bjlk_HHS_BH_UserArgs_MT128x128x32_MI16x16x1_SN_LDSB1_CLR1_GSU0_GSUC0_GSUWGMRR0_K1_LBSPPA1024_LBSPPB1024_LPA0_LPB32_MIWT4_4_PLR1_SU32_SUM0_SUS256_VWA4_VWB2_WGM4_WGMXCC1_WGMXCCGn1
    SolutionIndex: 47
    SolutionNameMin: Cijk_Ailk_Bjlk_HHS_BH_UserArgs_MT128x128x32_MI16x16x1_SN_LDSB1_CLR1_GSU0_GSUC0_GSUWGMRR0_K1_LBSPPA1024_LBSPPB1024_LPA32_LPB0_MIWT4_4_PLR1_SU32_SUM0_SUS256_VWA2_VWB4_WGM4_WGMXCC1_WGMXCCGn1
    SolutionIndex: 48
    SolutionNameMin: Cijk_Ailk_Bjlk_HHS_BH_UserArgs_MT128x128x32_MI16x16x1_SN_LDSB0_CLR1_GSU0_GSUC0_GSUWGMRR0_K1_LBSPPA1024_LBSPPB1024_LPA0_LPB0_MIWT4_4_PLR1_SU32_SUM0_SUS256_VWA4_VWB4_WGM4_WGMXCC1_WGMXCCGn1
    SolutionIndex: 49
    SolutionNameMin: Cijk_Ailk_Bjlk_HHS_BH_UserArgs_MT128x128x32_MI16x16x1_SN_LDSB1_CLR1_GSU0_GSUC0_GSUWGMRR0_K1_LBSPPA1024_LBSPPB1024_LPA0_LPB32_MIWT4_4_PLR1_SU32_SUM0_SUS256_VWA4_VWB2_WGM8_WGMXCC1_WGMXCCGn1
    SolutionIndex: 50
    SolutionNameMin: Cijk_Ailk_Bjlk_HHS_BH_UserArgs_MT128x128x32_MI16x16x1_SN_LDSB1_CLR1_GSU0_GSUC0_GSUWGMRR0_K1_LBSPPA1024_LBSPPB1024_LPA16_LPB0_MIWT4_4_PLR1_SU32_SUM0_SUS256_VWA1_VWB4_WGM8_WGMXCC1_WGMXCCGn1
    SolutionIndex: 51
    SolutionNameMin: Cijk_Ailk_Bjlk_HHS_BH_UserArgs_MT128x128x32_MI16x16x1_SN_LDSB1_CLR1_GSU0_GSUC0_GSUWGMRR0_K1_LBSPPA1024_LBSPPB1024_LPA32_LPB0_MIWT4_4_PLR1_SU32_SUM0_SUS256_VWA2_VWB4_WGM8_WGMXCC1_WGMXCCGn1
    SolutionIndex: 52
    SolutionNameMin: Cijk_Ailk_Bjlk_HHS_BH_UserArgs_MT128x128x32_MI16x16x1_SN_LDSB0_CLR1_GSU0_GSUC0_GSUWGMRR0_K1_LBSPPA1024_LBSPPB1024_LPA0_LPB0_MIWT4_4_PLR1_SU32_SUM0_SUS256_VWA4_VWB4_WGM8_WGMXCC1_WGMXCCGn1
    SolutionIndex: 53
    SolutionNameMin: Cijk_Ailk_Bjlk_HHS_BH_UserArgs_MT128x128x32_MI16x16x1_SN_LDSB0_CLR0_GSU0_GSUC0_GSUWGMRR0_K1_LBSPPA1024_LBSPPB1024_LPA0_LPB0_MIWT4_4_PLR0_SU32_SUM0_SUS256_VWA4_VWB4_WGM8_WGMXCC1_WGMXCCGn1
    SolutionIndex: 54
    SolutionNameMin: Cijk_Ailk_Bjlk_HHS_BH_UserArgs_MT64x128x32_MI16x16x1_SN_LDSB0_CLR1_GSU0_GSUC0_GSUWGMRR0_K1_LBSPPA512_LBSPPB1024_LPA32_LPB32_MIWT2_4_PLR1_SU32_SUM0_SUS256_VWA2_VWB2_WGM1_WGMXCC1_WGMXCCGn1
    SolutionIndex: 55
    SolutionNameMin: Cijk_Ailk_Bjlk_HHS_BH_UserArgs_MT64x128x32_MI16x16x1_SN_LDSB0_CLR1_GSU0_GSUC0_GSUWGMRR0_K1_LBSPPA512_LBSPPB1024_LPA32_LPB0_MIWT2_4_PLR1_SU32_SUM0_SUS256_VWA2_VWB4_WGM1_WGMXCC1_WGMXCCGn1
    SolutionIndex: 56
    SolutionNameMin: Cijk_Ailk_Bjlk_HHS_BH_UserArgs_MT128x64x32_MI16x16x1_SN_LDSB0_CLR1_GSU0_GSUC0_GSUWGMRR0_K1_LBSPPA1024_LBSPPB512_LPA0_LPB16_MIWT4_2_PLR1_SU32_SUM0_SUS256_VWA4_VWB1_WGM1_WGMXCC1_WGMXCCGn1
    SolutionIndex: 57
    SolutionNameMin: Cijk_Ailk_Bjlk_HHS_BH_UserArgs_MT128x64x32_MI16x16x1_SN_LDSB0_CLR1_GSU0_GSUC0_GSUWGMRR0_K1_LBSPPA1024_LBSPPB512_LPA0_LPB32_MIWT4_2_PLR1_SU32_SUM0_SUS256_VWA4_VWB2_WGM1_WGMXCC1_WGMXCCGn1
    SolutionIndex: 58
    SolutionNameMin: Cijk_Ailk_Bjlk_HHS_BH_UserArgs_MT128x64x32_MI16x16x1_SN_LDSB0_CLR1_GSU0_GSUC0_GSUWGMRR0_K1_LBSPPA1024_LBSPPB512_LPA32_LPB32_MIWT4_2_PLR1_SU32_SUM0_SUS256_VWA2_VWB2_WGM4_WGMXCC1_WGMXCCGn1
    SolutionIndex: 59
    SolutionNameMin: Cijk_Ailk_Bjlk_HHS_BH_UserArgs_MT128x64x32_MI16x16x1_SN_LDSB0_CLR1_GSU0_GSUC0_GSUWGMRR0_K1_LBSPPA1024_LBSPPB512_LPA0_LPB16_MIWT4_2_PLR1_SU32_SUM0_SUS256_VWA4_VWB1_WGM8_WGMXCC1_WGMXCCGn1
    SolutionIndex: 60
    SolutionNameMin: Cijk_Ailk_Bjlk_HHS_BH_UserArgs_MT128x64x32_MI16x16x1_SN_LDSB0_CLR1_GSU0_GSUC0_GSUWGMRR0_K1_LBSPPA1024_LBSPPB512_LPA0_LPB32_MIWT4_2_PLR1_SU32_SUM0_SUS256_VWA4_VWB2_WGM8_WGMXCC1_WGMXCCGn1
    SolutionIndex: 61
    SolutionNameMin: Cijk_Ailk_Bjlk_HHS_BH_UserArgs_MT64x64x32_MI16x16x1_SN_LDSB0_CLR1_GSU0_GSUC0_GSUWGMRR0_K1_LBSPPA512_LBSPPB512_LPA32_LPB32_MIWT2_2_PLR1_SU32_SUM0_SUS256_VWA2_VWB2_WGM1_WGMXCC1_WGMXCCGn1
    SolutionIndex: 62
    SolutionNameMin: Cijk_Ailk_Bjlk_HHS_BH_UserArgs_MT64x64x32_MI16x16x1_SN_LDSB0_CLR1_GSU0_GSUC0_GSUWGMRR0_K1_LBSPPA512_LBSPPB512_LPA32_LPB32_MIWT2_2_PLR1_SU32_SUM0_SUS256_VWA2_VWB2_WGM4_WGMXCC1_WGMXCCGn1
    SolutionIndex: 63
    SolutionNameMin: Cijk_Ailk_Bjlk_HHS_BH_UserArgs_MT32x64x32_MI16x16x1_SN_LDSB0_CLR1_GSU0_GSUC0_GSUWGMRR0_K1_LBSPPA256_LBSPPB512_LPA16_LPB32_MIWT1_2_PLR1_SU32_SUM0_SUS256_VWA1_VWB2_WGM1_WGMXCC1_WGMXCCGn1
    SolutionIndex: 64
    SolutionNameMin: Cijk_Ailk_Bjlk_HHS_BH_UserArgs_MT32x32x32_MI16x16x1_SN_LDSB0_CLR1_GSU0_GSUC0_GSUWGMRR0_K1_LBSPPA256_LBSPPB256_LPA16_LPB16_MIWT1_1_PLR1_SU32_SUM0_SUS256_VWA1_VWB1_WGM1_WGMXCC1_WGMXCCGn1
    SolutionIndex: 65
    SolutionNameMin: Cijk_Ailk_Bjlk_HHS_BH_UserArgs_MT32x32x32_MI16x16x1_SN_LDSB0_CLR1_GSU0_GSUC0_GSUWGMRR0_K1_LBSPPA256_LBSPPB256_LPA16_LPB16_MIWT1_1_PLR1_SU32_SUM0_SUS256_VWA1_VWB1_WGM4_WGMXCC1_WGMXCCGn1
    SolutionIndex: 66
    SolutionNameMin: Cijk_Ailk_Bjlk_HHS_BH_UserArgs_MT256x256x64_MI16x16x1_SN_LDSB1_CLR1_GSU0_GSUC0_GSUWGMRR0_K1_LBSPPA2048_LBSPPB2048_LPA0_LPB0_MIWT8_8_PLR1_SU32_SUM0_SUS256_VWA4_VWB4_WGM1_WGMXCC1_WGMXCCGn1
    SolutionIndex: 67
    SolutionNameMin: Cijk_Ailk_Bjlk_HHS_BH_UserArgs_MT256x256x64_MI16x16x1_SN_LDSB1_CLR1_GSU0_GSUC0_GSUWGMRR0_K1_LBSPPA2048_LBSPPB2048_LPA0_LPB0_MIWT8_8_PLR1_SU32_SUM0_SUS256_VWA4_VWB4_WGM4_WGMXCC1_WGMXCCGn1
    SolutionIndex: 68
    SolutionNameMin: Cijk_Ailk_Bjlk_HHS_BH_UserArgs_MT128x256x64_MI16x16x1_SN_LDSB1_CLR1_GSU0_GSUC0_GSUWGMRR0_K1_LBSPPA1024_LBSPPB2048_LPA0_LPB32_MIWT4_8_PLR1_SU32_SUM0_SUS256_VWA4_VWB2_WGM1_WGMXCC1_WGMXCCGn1
    SolutionIndex: 69
    SolutionNameMin: Cijk_Ailk_Bjlk_HHS_BH_UserArgs_MT128x256x64_MI16x16x1_SN_LDSB1_CLR1_GSU0_GSUC0_GSUWGMRR0_K1_LBSPPA1024_LBSPPB2048_LPA0_LPB0_MIWT4_8_PLR1_SU32_SUM0_SUS256_VWA4_VWB4_WGM8_WGMXCC1_WGMXCCGn1
    SolutionIndex: 70
    SolutionNameMin: Cijk_Ailk_Bjlk_HHS_BH_UserArgs_MT256x128x64_MI16x16x1_SN_LDSB1_CLR1_GSU0_GSUC0_GSUWGMRR0_K1_LBSPPA2048_LBSPPB1024_LPA0_LPB32_MIWT8_4_PLR1_SU32_SUM0_SUS256_VWA4_VWB2_WGM1_WGMXCC1_WGMXCCGn1
    SolutionIndex: 71
    SolutionNameMin: Cijk_Ailk_Bjlk_HHS_BH_UserArgs_MT128x128x64_MI16x16x1_SN_LDSB1_CLR1_GSU0_GSUC0_GSUWGMRR0_K1_LBSPPA1024_LBSPPB1024_LPA0_LPB0_MIWT4_4_PLR1_SU32_SUM0_SUS256_VWA4_VWB4_WGM1_WGMXCC1_WGMXCCGn1
    SolutionIndex: 72
    SolutionNameMin: Cijk_Ailk_Bjlk_HHS_BH_UserArgs_MT128x128x64_MI16x16x1_SN_LDSB1_CLR1_GSU0_GSUC0_GSUWGMRR0_K1_LBSPPA1024_LBSPPB1024_LPA0_LPB0_MIWT4_4_PLR2_SU32_SUM0_SUS256_VWA4_VWB4_WGM1_WGMXCC1_WGMXCCGn1
    SolutionIndex: 73
    SolutionNameMin: Cijk_Ailk_Bjlk_HHS_BH_UserArgs_MT128x128x64_MI16x16x1_SN_LDSB1_CLR1_GSU0_GSUC0_GSUWGMRR0_K1_LBSPPA1024_LBSPPB1024_LPA0_LPB0_MIWT4_4_PLR1_SU32_SUM0_SUS256_VWA4_VWB4_WGM4_WGMXCC1_WGMXCCGn1
    SolutionIndex: 74
    SolutionNameMin: Cijk_Ailk_Bjlk_HHS_BH_UserArgs_MT128x128x64_MI16x16x1_SN_LDSB1_CLR1_GSU0_GSUC0_GSUWGMRR0_K1_LBSPPA1024_LBSPPB1024_LPA0_LPB0_MIWT4_4_PLR2_SU32_SUM0_SUS256_VWA4_VWB4_WGM4_WGMXCC1_WGMXCCGn1
    SolutionIndex: 75
    SolutionNameMin: Cijk_Ailk_Bjlk_HHS_BH_UserArgs_MT128x128x64_MI16x16x1_SN_LDSB1_CLR1_GSU0_GSUC0_GSUWGMRR0_K1_LBSPPA1024_LBSPPB1024_LPA0_LPB0_MIWT4_4_PLR1_SU32_SUM0_SUS256_VWA4_VWB4_WGM8_WGMXCC1_WGMXCCGn1
    SolutionIndex: 76
    SolutionNameMin: Cijk_Ailk_Bjlk_HHS_BH_UserArgs_MT64x128x64_MI16x16x1_SN_LDSB1_CLR1_GSU0_GSUC0_GSUWGMRR0_K1_LBSPPA512_LBSPPB1024_LPA32_LPB0_MIWT2_4_PLR2_SU32_SUM0_SUS256_VWA2_VWB4_WGM1_WGMXCC1_WGMXCCGn1
    SolutionIndex: 77
    SolutionNameMin: Cijk_Ailk_Bjlk_HHS_BH_UserArgs_MT128x64x64_MI16x16x1_SN_LDSB1_CLR1_GSU0_GSUC0_GSUWGMRR0_K1_LBSPPA1024_LBSPPB512_LPA0_LPB16_MIWT4_2_PLR1_SU32_SUM0_SUS256_VWA4_VWB1_WGM1_WGMXCC1_WGMXCCGn1
    SolutionIndex: 78
    SolutionNameMin: Cijk_Ailk_Bjlk_HHS_BH_UserArgs_MT128x64x64_MI16x16x1_SN_LDSB1_CLR1_GSU0_GSUC0_GSUWGMRR0_K1_LBSPPA1024_LBSPPB512_LPA32_LPB32_MIWT4_2_PLR1_SU32_SUM0_SUS256_VWA2_VWB2_WGM1_WGMXCC1_WGMXCCGn1
    SolutionIndex: 79
    SolutionNameMin: Cijk_Ailk_Bjlk_HHS_BH_UserArgs_MT128x64x64_MI16x16x1_SN_LDSB1_CLR1_GSU0_GSUC0_GSUWGMRR0_K1_LBSPPA1024_LBSPPB512_LPA0_LPB32_MIWT4_2_PLR1_SU32_SUM0_SUS256_VWA4_VWB2_WGM1_WGMXCC1_WGMXCCGn1
    SolutionIndex: 80
    SolutionNameMin: Cijk_Ailk_Bjlk_HHS_BH_UserArgs_MT128x64x64_MI16x16x1_SN_LDSB1_CLR1_GSU0_GSUC0_GSUWGMRR0_K1_LBSPPA1024_LBSPPB512_LPA0_LPB32_MIWT4_2_PLR2_SU32_SUM0_SUS256_VWA4_VWB2_WGM1_WGMXCC1_WGMXCCGn1
    SolutionIndex: 81
    SolutionNameMin: Cijk_Ailk_Bjlk_HHS_BH_UserArgs_MT128x64x64_MI16x16x1_SN_LDSB1_CLR1_GSU0_GSUC0_GSUWGMRR0_K1_LBSPPA1024_LBSPPB512_LPA0_LPB32_MIWT4_2_PLR1_SU32_SUM0_SUS256_VWA4_VWB2_WGM4_WGMXCC1_WGMXCCGn1
    SolutionIndex: 82
    SolutionNameMin: Cijk_Ailk_Bjlk_HHS_BH_UserArgs_MT128x64x64_MI16x16x1_SN_LDSB1_CLR1_GSU0_GSUC0_GSUWGMRR0_K1_LBSPPA1024_LBSPPB512_LPA0_LPB32_MIWT4_2_PLR2_SU32_SUM0_SUS256_VWA4_VWB2_WGM4_WGMXCC1_WGMXCCGn1
    SolutionIndex: 83
    SolutionNameMin: Cijk_Ailk_Bjlk_HHS_BH_UserArgs_MT128x64x64_MI16x16x1_SN_LDSB1_CLR1_GSU0_GSUC0_GSUWGMRR0_K1_LBSPPA1024_LBSPPB512_LPA0_LPB32_MIWT4_2_PLR2_SU32_SUM0_SUS256_VWA4_VWB2_WGM8_WGMXCC1_WGMXCCGn1
    SolutionIndex: 84
    SolutionNameMin: Cijk_Ailk_Bjlk_HHS_BH_UserArgs_MT64x64x64_MI16x16x1_SN_LDSB1_CLR1_GSU0_GSUC0_GSUWGMRR0_K1_LBSPPA512_LBSPPB512_LPA32_LPB32_MIWT2_2_PLR1_SU32_SUM0_SUS256_VWA2_VWB2_WGM1_WGMXCC1_WGMXCCGn1
    SolutionIndex: 85
    SolutionNameMin: Cijk_Ailk_Bjlk_HHS_BH_UserArgs_MT64x64x64_MI16x16x1_SN_LDSB1_CLR1_GSU0_GSUC0_GSUWGMRR0_K1_LBSPPA512_LBSPPB512_LPA32_LPB32_MIWT2_2_PLR2_SU32_SUM0_SUS256_VWA2_VWB2_WGM1_WGMXCC1_WGMXCCGn1
    SolutionIndex: 86
    SolutionNameMin: Cijk_Ailk_Bjlk_HHS_BH_UserArgs_MT64x64x64_MI16x16x1_SN_LDSB1_CLR1_GSU0_GSUC0_GSUWGMRR0_K1_LBSPPA512_LBSPPB512_LPA32_LPB32_MIWT2_2_PLR1_SU32_SUM0_SUS256_VWA2_VWB2_WGM4_WGMXCC1_WGMXCCGn1
    SolutionIndex: 87
    SolutionNameMin: Cijk_Ailk_Bjlk_HHS_BH_UserArgs_MT64x64x64_MI16x16x1_SN_LDSB1_CLR1_GSU0_GSUC0_GSUWGMRR0_K1_LBSPPA512_LBSPPB512_LPA32_LPB32_MIWT2_2_PLR1_SU32_SUM0_SUS256_VWA2_VWB2_WGM8_WGMXCC1_WGMXCCGn1
    SolutionIndex: 88
    SolutionNameMin: Cijk_Ailk_Bjlk_HHS_BH_UserArgs_MT32x64x64_MI16x16x1_SN_LDSB0_CLR1_GSU0_GSUC0_GSUWGMRR0_K1_LBSPPA256_LBSPPB512_LPA16_LPB32_MIWT1_2_PLR2_SU32_SUM0_SUS256_VWA1_VWB2_WGM1_WGMXCC1_WGMXCCGn1
    SolutionIndex: 89
    SolutionNameMin: Cijk_Ailk_Bjlk_HHS_BH_UserArgs_MT32x64x64_MI16x16x1_SN_LDSB0_CLR1_GSU0_GSUC0_GSUWGMRR0_K1_LBSPPA256_LBSPPB512_LPA16_LPB32_MIWT1_2_PLR2_SU32_SUM0_SUS256_VWA1_VWB2_WGM8_WGMXCC1_WGMXCCGn1
    SolutionIndex: 90
    SolutionNameMin: Cijk_Ailk_Bjlk_HHS_BH_UserArgs_MT64x32x64_MI16x16x1_SN_LDSB0_CLR1_GSU0_GSUC0_GSUWGMRR0_K1_LBSPPA512_LBSPPB256_LPA32_LPB16_MIWT2_1_PLR1_SU32_SUM0_SUS256_VWA2_VWB1_WGM1_WGMXCC1_WGMXCCGn1
    SolutionIndex: 91
    SolutionNameMin: Cijk_Ailk_Bjlk_HHS_BH_UserArgs_MT64x32x64_MI16x16x1_SN_LDSB0_CLR1_GSU0_GSUC0_GSUWGMRR0_K1_LBSPPA512_LBSPPB256_LPA32_LPB16_MIWT2_1_PLR2_SU32_SUM0_SUS256_VWA2_VWB1_WGM1_WGMXCC1_WGMXCCGn1
    SolutionIndex: 92
    SolutionNameMin: Cijk_Ailk_Bjlk_HHS_BH_UserArgs_MT64x32x64_MI16x16x1_SN_LDSB0_CLR1_GSU0_GSUC0_GSUWGMRR0_K1_LBSPPA512_LBSPPB256_LPA32_LPB16_MIWT2_1_PLR2_SU32_SUM0_SUS256_VWA2_VWB1_WGM8_WGMXCC1_WGMXCCGn1
    SolutionIndex: 93
    SolutionNameMin: Cijk_Ailk_Bjlk_HHS_BH_UserArgs_MT128x128x128_MI16x16x1_SN_LDSB1_CLR1_GSU0_GSUC0_GSUWGMRR0_K1_LBSPPA1024_LBSPPB1024_LPA0_LPB0_MIWT4_4_PLR1_SU32_SUM0_SUS256_VWA4_VWB4_WGM1_WGMXCC1_WGMXCCGn1
    SolutionIndex: 94
    SolutionNameMin: Cijk_Ailk_Bjlk_HHS_BH_UserArgs_MT128x128x128_MI16x16x1_SN_LDSB1_CLR1_GSU0_GSUC0_GSUWGMRR0_K1_LBSPPA1024_LBSPPB1024_LPA0_LPB0_MIWT4_4_PLR2_SU32_SUM0_SUS256_VWA4_VWB4_WGM1_WGMXCC1_WGMXCCGn1
    SolutionIndex: 95
    SolutionNameMin: Cijk_Ailk_Bjlk_HHS_BH_UserArgs_MT128x128x128_MI16x16x1_SN_LDSB1_CLR1_GSU0_GSUC0_GSUWGMRR0_K1_LBSPPA1024_LBSPPB1024_LPA0_LPB0_MIWT4_4_PLR1_SU32_SUM0_SUS256_VWA4_VWB4_WGM4_WGMXCC1_WGMXCCGn1
    SolutionIndex: 96
    SolutionNameMin: Cijk_Ailk_Bjlk_HHS_BH_UserArgs_MT128x128x128_MI16x16x1_SN_LDSB1_CLR1_GSU0_GSUC0_GSUWGMRR0_K1_LBSPPA1024_LBSPPB1024_LPA0_LPB0_MIWT4_4_PLR1_SU32_SUM0_SUS256_VWA4_VWB4_WGM8_WGMXCC1_WGMXCCGn1
    SolutionIndex: 97
    SolutionNameMin: Cijk_Ailk_Bjlk_HHS_BH_UserArgs_MT128x64x128_MI16x16x1_SN_LDSB1_CLR1_GSU0_GSUC0_GSUWGMRR0_K1_LBSPPA1024_LBSPPB512_LPA32_LPB32_MIWT4_2_PLR2_SU32_SUM0_SUS256_VWA2_VWB2_WGM1_WGMXCC1_WGMXCCGn1
    SolutionIndex: 98
    SolutionNameMin: Cijk_Ailk_Bjlk_HHS_BH_UserArgs_MT64x64x128_MI16x16x1_SN_LDSB1_CLR1_GSU0_GSUC0_GSUWGMRR0_K1_LBSPPA512_LBSPPB512_LPA32_LPB16_MIWT2_2_PLR1_SU32_SUM0_SUS256_VWA2_VWB1_WGM1_WGMXCC1_WGMXCCGn1
    SolutionIndex: 99
    SolutionNameMin: Cijk_Ailk_Bjlk_HHS_BH_UserArgs_MT64x64x128_MI16x16x1_SN_LDSB1_CLR1_GSU0_GSUC0_GSUWGMRR0_K1_LBSPPA512_LBSPPB512_LPA32_LPB32_MIWT2_2_PLR1_SU32_SUM0_SUS256_VWA2_VWB2_WGM1_WGMXCC1_WGMXCCGn1
    SolutionIndex: 100
    SolutionNameMin: Cijk_Ailk_Bjlk_HHS_BH_UserArgs_MT64x64x128_MI16x16x1_SN_LDSB1_CLR1_GSU0_GSUC0_GSUWGMRR0_K1_LBSPPA512_LBSPPB512_LPA32_LPB16_MIWT2_2_PLR2_SU32_SUM0_SUS256_VWA2_VWB1_WGM1_WGMXCC1_WGMXCCGn1
    SolutionIndex: 101
    SolutionNameMin: Cijk_Ailk_Bjlk_HHS_BH_UserArgs_MT64x64x128_MI16x16x1_SN_LDSB1_CLR1_GSU0_GSUC0_GSUWGMRR0_K1_LBSPPA512_LBSPPB512_LPA32_LPB32_MIWT2_2_PLR2_SU32_SUM0_SUS256_VWA2_VWB2_WGM1_WGMXCC1_WGMXCCGn1
    SolutionIndex: 102
    SolutionNameMin: Cijk_Ailk_Bjlk_HHS_BH_UserArgs_MT32x64x128_MI16x16x1_SN_LDSB1_CLR1_GSU0_GSUC0_GSUWGMRR0_K1_LBSPPA256_LBSPPB512_LPA16_LPB32_MIWT1_2_PLR1_SU32_SUM0_SUS256_VWA1_VWB2_WGM1_WGMXCC1_WGMXCCGn1
    SolutionIndex: 103
    SolutionNameMin: Cijk_Ailk_Bjlk_HHS_BH_UserArgs_MT32x64x128_MI16x16x1_SN_LDSB1_CLR1_GSU0_GSUC0_GSUWGMRR0_K1_LBSPPA256_LBSPPB512_LPA16_LPB32_MIWT1_2_PLR2_SU32_SUM0_SUS256_VWA1_VWB2_WGM1_WGMXCC1_WGMXCCGn1
    SolutionIndex: 104
    SolutionNameMin: Cijk_Ailk_Bjlk_HHS_BH_UserArgs_MT64x32x128_MI16x16x1_SN_LDSB1_CLR1_GSU0_GSUC0_GSUWGMRR0_K1_LBSPPA512_LBSPPB256_LPA32_LPB16_MIWT2_1_PLR1_SU32_SUM0_SUS256_VWA2_VWB1_WGM1_WGMXCC1_WGMXCCGn1
    SolutionIndex: 105
    SolutionNameMin: Cijk_Ailk_Bjlk_HHS_BH_UserArgs_MT64x32x128_MI16x16x1_SN_LDSB1_CLR1_GSU0_GSUC0_GSUWGMRR0_K1_LBSPPA512_LBSPPB256_LPA32_LPB16_MIWT2_1_PLR2_SU32_SUM0_SUS256_VWA2_VWB1_WGM1_WGMXCC1_WGMXCCGn1
    SolutionIndex: 106
    SolutionNameMin: Cijk_Ailk_Bjlk_HHS_BH_UserArgs_MT64x32x128_MI16x16x1_SN_LDSB1_CLR1_GSU0_GSUC0_GSUWGMRR0_K1_LBSPPA512_LBSPPB256_LPA32_LPB16_MIWT2_1_PLR2_SU32_SUM0_SUS256_VWA2_VWB1_WGM4_WGMXCC1_WGMXCCGn1
    SolutionIndex: 107
    SolutionNameMin: Cijk_Ailk_Bjlk_HHS_BH_UserArgs_MT32x32x128_MI16x16x1_SN_LDSB1_CLR1_GSU0_GSUC0_GSUWGMRR0_K1_LBSPPA256_LBSPPB256_LPA16_LPB16_MIWT1_1_PLR1_SU32_SUM0_SUS256_VWA1_VWB1_WGM1_WGMXCC1_WGMXCCGn1
    SolutionIndex: 108
    SolutionNameMin: Cijk_Ailk_Bjlk_HHS_BH_UserArgs_MT32x32x128_MI16x16x1_SN_LDSB1_CLR1_GSU0_GSUC0_GSUWGMRR0_K1_LBSPPA256_LBSPPB256_LPA16_LPB16_MIWT1_1_PLR2_SU32_SUM0_SUS256_VWA1_VWB1_WGM1_WGMXCC1_WGMXCCGn1
    SolutionIndex: 109
    SolutionNameMin: Cijk_Ailk_Bjlk_HHS_BH_UserArgs_MT32x32x128_MI16x16x1_SN_LDSB1_CLR1_GSU0_GSUC0_GSUWGMRR0_K1_LBSPPA256_LBSPPB256_LPA16_LPB16_MIWT1_1_PLR1_SU32_SUM0_SUS256_VWA1_VWB1_WGM4_WGMXCC1_WGMXCCGn1
    SolutionIndex: 110
    SolutionNameMin: Cijk_Ailk_Bjlk_HHS_BH_UserArgs_MT32x32x128_MI16x16x1_SN_LDSB1_CLR1_GSU0_GSUC0_GSUWGMRR0_K1_LBSPPA256_LBSPPB256_LPA16_LPB16_MIWT1_1_PLR2_SU32_SUM0_SUS256_VWA1_VWB1_WGM8_WGMXCC1_WGMXCCGn1
    SolutionIndex: 111
    SolutionNameMin: Cijk_Ailk_Bjlk_HHS_BH_UserArgs_MT32x32x32_MI16x16x1_SN_LDSB0_CLR1_GSU0_GSUC0_GSUWGMRR0_K1_LBSPPA256_LBSPPB256_LPA16_LPB16_MIWT1_1_PLR1_SU32_SUM0_SUS256_VWA1_VWB1_WGM8_WGMXCC1_WGMXCCGn1
- - - [128, 128, 1, 128, 128, 128, 128, 128]
    - [110, 0.079]
  - - [128, 128, 1, 256, 128, 128, 128, 128]
    - [101, 0.105]
  - - [128, 128, 1, 512, 128, 128, 128, 128]
    - [109, 0.173]
  - - [128, 128, 1, 1024, 128, 128, 128, 128]
    - [107, 0.273]
  - - [128, 128, 1, 2048, 128, 128, 128, 128]
    - [65, 0.489]
  - - [128, 128, 1, 4096, 128, 128, 128, 128]
    - [103, 0.741]
  - - [128, 128, 1, 8192, 128, 128, 128, 128]
    - [103, 1.126]
  - - [128, 256, 1, 128, 128, 128, 128, 256]
    - [108, 0.148]
  - - [128, 256, 1, 256, 128, 128, 128, 256]
    - [107, 0.223]
  - - [128, 256, 1, 512, 128, 128, 128, 256]
    - [64, 0.321]
  - - [128, 256, 1, 1024, 128, 128, 128, 256]
    - [107, 0.533]
  - - [128, 256, 1, 2048, 128, 128, 128, 256]
    - [63, 0.83]
  - - [128, 256, 1, 4096, 128, 128, 128, 256]
    - [89, 1.287]
  - - [128, 256, 1, 8192, 128, 128, 128, 256]
    - [85, 1.814]
  - - [128, 512, 1, 128, 128, 128, 128, 512]
    - [104, 0.296]
  - - [128, 512, 1, 256, 128, 128, 128, 512]
    - [107, 0.455]
  - - [128, 512, 1, 512, 128, 128, 128, 512]
    - [107, 0.695]
  - - [128, 512, 1, 1024, 128, 128, 128, 512]
    - [102, 0.966]
  - - [128, 512, 1, 2048, 128, 128, 128, 512]
    - [62, 1.415]
  - - [128, 512, 1, 4096, 128, 128, 128, 512]
    - [86, 2.196]
  - - [128, 512, 1, 8192, 128, 128, 128, 512]
    - [59, 2.673]
  - - [128, 1024, 1, 128, 128, 128, 128, 1024]
    - [99, 0.557]
  - - [128, 1024, 1, 256, 128, 128, 128, 1024]
    - [91, 0.843]
  - - [128, 1024, 1, 512, 128, 128, 128, 1024]
    - [103, 1.273]
  - - [128, 1024, 1, 1024, 128, 128, 128, 1024]
    - [105, 1.697]
  - - [128, 1024, 1, 2048, 128, 128, 128, 1024]
    - [55, 2.174]
  - - [128, 1024, 1, 4096, 128, 128, 128, 1024]
    - [77, 3.212]
  - - [128, 1024, 1, 8192, 128, 128, 128, 1024]
    - [71, 3.579]
  - - [128, 2048, 1, 128, 128, 128, 128, 2048]
    - [84, 0.968]
  - - [128, 2048, 1, 256, 128, 128, 128, 2048]
    - [85, 1.541]
  - - [128, 2048, 1, 512, 128, 128, 128, 2048]
    - [84, 2.21]
  - - [128, 2048, 1, 1024, 128, 128, 128, 2048]
    - [79, 2.457]
  - - [128, 2048, 1, 2048, 128, 128, 128, 2048]
    - [50, 2.878]
  - - [128, 2048, 1, 4096, 128, 128, 128, 2048]
    - [71, 4.58]
  - - [128, 2048, 1, 8192, 128, 128, 128, 2048]
    - [16, 4.846]
  - - [128, 4096, 1, 128, 128, 128, 128, 4096]
    - [55, 1.571]
  - - [128, 4096, 1, 256, 128, 128, 128, 4096]
    - [79, 2.374]
  - - [128, 4096, 1, 512, 128, 128, 128, 4096]
    - [76, 3.186]
  - - [128, 4096, 1, 1024, 128, 128, 128, 4096]
    - [73, 3.404]
  - - [128, 4096, 1, 2048, 128, 128, 128, 4096]
    - [73, 4.297]
  - - [128, 4096, 1, 4096, 128, 128, 128, 4096]
    - [73, 5.192]
  - - [128, 4096, 1, 8192, 128, 128, 128, 4096]
    - [9, 5.83]
  - - [128, 8192, 1, 128, 128, 128, 128, 8192]
    - [75, 2.17]
  - - [128, 8192, 1, 256, 128, 128, 128, 8192]
    - [73, 3.256]
  - - [128, 8192, 1, 512, 128, 128, 128, 8192]
    - [74, 3.612]
  - - [128, 8192, 1, 1024, 128, 128, 128, 8192]
    - [93, 4.546]
  - - [128, 8192, 1, 2048, 128, 128, 128, 8192]
    - [85, 4.648]
  - - [128, 8192, 1, 4096, 128, 128, 128, 8192]
    - [74, 5.206]
  - - [128, 8192, 1, 8192, 128, 128, 128, 8192]
    - [52, 5.944]
  - - [256, 128, 1, 128, 256, 256, 256, 128]
    - [107, 0.158]
  - - [256, 128, 1, 256, 256, 256, 256, 128]
    - [108, 0.227]
  - - [256, 128, 1, 512, 256, 256, 256, 128]
    - [107, 0.315]
  - - [256, 128, 1, 1024, 256, 256, 256, 128]
    - [107, 0.535]
  - - [256, 128, 1, 2048, 256, 256, 256, 128]
    - [105, 0.824]
  - - [256, 128, 1, 4096, 256, 256, 256, 128]
    - [88, 1.296]
  - - [256, 128, 1, 8192, 256, 256, 256, 128]
    - [87, 1.832]
  - - [256, 256, 1, 128, 256, 256, 256, 256]
    - [106, 0.297]
  - - [256, 256, 1, 256, 256, 256, 256, 256]
    - [64, 0.462]
  - - [256, 256, 1, 512, 256, 256, 256, 256]
    - [107, 0.682]
  - - [256, 256, 1, 1024, 256, 256, 256, 256]
    - [103, 0.976]
  - - [256, 256, 1, 2048, 256, 256, 256, 256]
    - [61, 1.404]
  - - [256, 256, 1, 4096, 256, 256, 256, 256]
    - [85, 2.177]
  - - [256, 256, 1, 8192, 256, 256, 256, 256]
    - [60, 2.747]
  - - [256, 512, 1, 128, 256, 256, 256, 512]
    - [100, 0.545]
  - - [256, 512, 1, 256, 256, 256, 256, 512]
    - [90, 0.838]
  - - [256, 512, 1, 512, 256, 256, 256, 512]
    - [91, 1.279]
  - - [256, 512, 1, 1024, 256, 256, 256, 512]
    - [105, 1.726]
  - - [256, 512, 1, 2048, 256, 256, 256, 512]
    - [59, 2.303]
  - - [256, 512, 1, 4096, 256, 256, 256, 512]
    - [83, 3.311]
  - - [256, 512, 1, 8192, 256, 256, 256, 512]
    - [52, 3.787]
  - - [256, 1024, 1, 128, 256, 256, 256, 1024]
    - [61, 0.947]
  - - [256, 1024, 1, 256, 256, 256, 256, 1024]
    - [85, 1.533]
  - - [256, 1024, 1, 512, 256, 256, 256, 1024]
    - [85, 2.213]
  - - [256, 1024, 1, 1024, 256, 256, 256, 1024]
    - [83, 2.469]
  - - [256, 1024, 1, 2048, 256, 256, 256, 1024]
    - [48, 3.251]
  - - [256, 1024, 1, 4096, 256, 256, 256, 1024]
    - [72, 4.544]
  - - [256, 1024, 1, 8192, 256, 256, 256, 1024]
    - [93, 4.875]
  - - [256, 2048, 1, 128, 256, 256, 256, 2048]
    - [56, 1.613]
  - - [256, 2048, 1, 256, 256, 256, 256, 2048]
    - [57, 2.44]
  - - [256, 2048, 1, 512, 256, 256, 256, 2048]
    - [78, 3.14]
  - - [256, 2048, 1, 1024, 256, 256, 256, 2048]
    - [73, 3.368]
  - - [256, 2048, 1, 2048, 256, 256, 256, 2048]
    - [30, 4.19]
  - - [256, 2048, 1, 4096, 256, 256, 256, 2048]
    - [72, 5.061]
  - - [256, 2048, 1, 8192, 256, 256, 256, 2048]
    - [26, 5.674]
  - - [256, 4096, 1, 128, 256, 256, 256, 4096]
    - [75, 2.157]
  - - [256, 4096, 1, 256, 256, 256, 256, 4096]
    - [73, 3.508]
  - - [256, 4096, 1, 512, 256, 256, 256, 4096]
    - [71, 4.171]
  - - [256, 4096, 1, 1024, 256, 256, 256, 4096]
    - [96, 4.84]
  - - [256, 4096, 1, 2048, 256, 256, 256, 4096]
    - [85, 4.668]
  - - [256, 4096, 1, 4096, 256, 256, 256, 4096]
    - [72, 5.668]
  - - [256, 4096, 1, 8192, 256, 256, 256, 4096]
    - [69, 5.817]
  - - [256, 8192, 1, 128, 256, 256, 256, 8192]
    - [32, 3.083]
  - - [256, 8192, 1, 256, 256, 256, 256, 8192]
    - [25, 4.433]
  - - [256, 8192, 1, 512, 256, 256, 256, 8192]
    - [72, 4.866]
  - - [256, 8192, 1, 1024, 256, 256, 256, 8192]
    - [83, 5.202]
  - - [256, 8192, 1, 2048, 256, 256, 256, 8192]
    - [71, 5.864]
  - - [256, 8192, 1, 4096, 256, 256, 256, 8192]
    - [34, 6.423]
  - - [256, 8192, 1, 8192, 256, 256, 256, 8192]
    - [21, 7.094]
  - - [512, 128, 1, 128, 512, 512, 512, 128]
    - [105, 0.303]
  - - [512, 128, 1, 256, 512, 512, 512, 128]
    - [107, 0.457]
  - - [512, 128, 1, 512, 512, 512, 512, 128]
    - [108, 0.698]
  - - [512, 128, 1, 1024, 512, 512, 512, 128]
    - [105, 0.996]
  - - [512, 128, 1, 2048, 512, 512, 512, 128]
    - [61, 1.402]
  - - [512, 128, 1, 4096, 512, 512, 512, 128]
    - [85, 2.276]
  - - [512, 128, 1, 8192, 512, 512, 512, 128]
    - [60, 2.861]
  - - [512, 256, 1, 128, 512, 512, 512, 256]
    - [99, 0.557]
  - - [512, 256, 1, 256, 512, 512, 512, 256]
    - [88, 0.849]
  - - [512, 256, 1, 512, 512, 512, 512, 256]
    - [105, 1.275]
  - - [512, 256, 1, 1024, 512, 512, 512, 256]
    - [105, 1.709]
  - - [512, 256, 1, 2048, 512, 512, 512, 256]
    - [60, 2.333]
  - - [512, 256, 1, 4096, 512, 512, 512, 256]
    - [82, 3.329]
  - - [512, 256, 1, 8192, 512, 512, 512, 256]
    - [53, 3.745]
  - - [512, 512, 1, 128, 512, 512, 512, 512]
    - [85, 0.96]
  - - [512, 512, 1, 256, 512, 512, 512, 512]
    - [85, 1.527]
  - - [512, 512, 1, 512, 512, 512, 512, 512]
    - [84, 2.205]
  - - [512, 512, 1, 1024, 512, 512, 512, 512]
    - [80, 2.42]
  - - [512, 512, 1, 2048, 512, 512, 512, 512]
    - [53, 3.316]
  - - [512, 512, 1, 4096, 512, 512, 512, 512]
    - [73, 4.856]
  - - [512, 512, 1, 8192, 512, 512, 512, 512]
    - [24, 4.883]
  - - [512, 1024, 1, 128, 512, 512, 512, 1024]
    - [58, 1.595]
  - - [512, 1024, 1, 256, 512, 512, 512, 1024]
    - [57, 2.41]
  - - [512, 1024, 1, 512, 512, 512, 512, 1024]
    - [82, 3.303]
  - - [512, 1024, 1, 1024, 512, 512, 512, 1024]
    - [72, 3.52]
  - - [512, 1024, 1, 2048, 512, 512, 512, 1024]
    - [71, 4.27]
  - - [512, 1024, 1, 4096, 512, 512, 512, 1024]
    - [72, 5.302]
  - - [512, 1024, 1, 8192, 512, 512, 512, 1024]
    - [73, 5.869]
  - - [512, 2048, 1, 128, 512, 512, 512, 2048]
    - [75, 2.212]
  - - [512, 2048, 1, 256, 512, 512, 512, 2048]
    - [75, 3.292]
  - - [512, 2048, 1, 512, 512, 512, 512, 2048]
    - [71, 4.806]
  - - [512, 2048, 1, 1024, 512, 512, 512, 2048]
    - [93, 4.846]
  - - [512, 2048, 1, 2048, 512, 512, 512, 2048]
    - [39, 4.715]
  - - [512, 2048, 1, 4096, 512, 512, 512, 2048]
    - [73, 6.139]
  - - [512, 2048, 1, 8192, 512, 512, 512, 2048]
    - [8, 6.13]
  - - [512, 4096, 1, 128, 512, 512, 512, 4096]
    - [17, 3.129]
  - - [512, 4096, 1, 256, 512, 512, 512, 4096]
    - [23, 4.361]
  - - [512, 4096, 1, 512, 512, 512, 512, 4096]
    - [75, 4.715]
  - - [512, 4096, 1, 1024, 512, 512, 512, 4096]
    - [82, 5.213]
  - - [512, 4096, 1, 2048, 512, 512, 512, 4096]
    - [71, 5.94]
  - - [512, 4096, 1, 4096, 512, 512, 512, 4096]
    - [93, 5.769]
  - - [512, 4096, 1, 8192, 512, 512, 512, 4096]
    - [13, 7.643]
  - - [512, 8192, 1, 128, 512, 512, 512, 8192]
    - [51, 3.467]
  - - [512, 8192, 1, 256, 512, 512, 512, 8192]
    - [19, 4.914]
  - - [512, 8192, 1, 512, 512, 512, 512, 8192]
    - [46, 6.396]
  - - [512, 8192, 1, 1024, 512, 512, 512, 8192]
    - [71, 7.399]
  - - [512, 8192, 1, 2048, 512, 512, 512, 8192]
    - [71, 8.025]
  - - [512, 8192, 1, 4096, 512, 512, 512, 8192]
    - [95, 7.463]
  - - [512, 8192, 1, 8192, 512, 512, 512, 8192]
    - [26, 8.752]
  - - [1024, 128, 1, 128, 1024, 1024, 1024, 128]
    - [98, 0.548]
  - - [1024, 128, 1, 256, 1024, 1024, 1024, 128]
    - [91, 0.866]
  - - [1024, 128, 1, 512, 1024, 1024, 1024, 128]
    - [92, 1.277]
  - - [1024, 128, 1, 1024, 1024, 1024, 1024, 128]
    - [104, 1.684]
  - - [1024, 128, 1, 2048, 1024, 1024, 1024, 128]
    - [60, 2.323]
  - - [1024, 128, 1, 4096, 1024, 1024, 1024, 128]
    - [80, 3.263]
  - - [1024, 128, 1, 8192, 1024, 1024, 1024, 128]
    - [53, 3.895]
  - - [1024, 256, 1, 128, 1024, 1024, 1024, 256]
    - [85, 0.936]
  - - [1024, 256, 1, 256, 1024, 1024, 1024, 256]
    - [84, 1.517]
  - - [1024, 256, 1, 512, 1024, 1024, 1024, 256]
    - [85, 2.201]
  - - [1024, 256, 1, 1024, 1024, 1024, 1024, 256]
    - [77, 2.461]
  - - [1024, 256, 1, 2048, 1024, 1024, 1024, 256]
    - [43, 3.228]
  - - [1024, 256, 1, 4096, 1024, 1024, 1024, 256]
    - [75, 4.817]
  - - [1024, 256, 1, 8192, 1024, 1024, 1024, 256]
    - [73, 4.955]
  - - [1024, 512, 1, 128, 1024, 1024, 1024, 512]
    - [54, 1.615]
  - - [1024, 512, 1, 256, 1024, 1024, 1024, 512]
    - [58, 2.482]
  - - [1024, 512, 1, 512, 1024, 1024, 1024, 512]
    - [79, 3.35]
  - - [1024, 512, 1, 1024, 1024, 1024, 1024, 512]
    - [71, 3.493]
  - - [1024, 512, 1, 2048, 1024, 1024, 1024, 512]
    - [18, 4.26]
  - - [1024, 512, 1, 4096, 1024, 1024, 1024, 512]
    - [73, 5.224]
  - - [1024, 512, 1, 8192, 1024, 1024, 1024, 512]
    - [75, 5.96]
  - - [1024, 1024, 1, 128, 1024, 1024, 1024, 1024]
    - [43, 2.266]
  - - [1024, 1024, 1, 256, 1024, 1024, 1024, 1024]
    - [71, 3.351]
  - - [1024, 1024, 1, 512, 1024, 1024, 1024, 1024]
    - [73, 4.555]
  - - [1024, 1024, 1, 1024, 1024, 1024, 1024, 1024]
    - [93, 4.897]
  - - [1024, 1024, 1, 2048, 1024, 1024, 1024, 1024]
    - [73, 4.969]
  - - [1024, 1024, 1, 4096, 1024, 1024, 1024, 1024]
    - [75, 6.453]
  - - [1024, 1024, 1, 8192, 1024, 1024, 1024, 1024]
    - [8, 6.261]
  - - [1024, 2048, 1, 128, 1024, 1024, 1024, 2048]
    - [22, 3.158]
  - - [1024, 2048, 1, 256, 1024, 1024, 1024, 2048]
    - [33, 4.542]
  - - [1024, 2048, 1, 512, 1024, 1024, 1024, 2048]
    - [73, 5.196]
  - - [1024, 2048, 1, 1024, 1024, 1024, 1024, 2048]
    - [82, 5.142]
  - - [1024, 2048, 1, 2048, 1024, 1024, 1024, 2048]
    - [75, 6.731]
  - - [1024, 2048, 1, 4096, 1024, 1024, 1024, 2048]
    - [9, 6.441]
  - - [1024, 2048, 1, 8192, 1024, 1024, 1024, 2048]
    - [18, 7.705]
  - - [1024, 4096, 1, 128, 1024, 1024, 1024, 4096]
    - [36, 3.552]
  - - [1024, 4096, 1, 256, 1024, 1024, 1024, 4096]
    - [51, 5.024]
  - - [1024, 4096, 1, 512, 1024, 1024, 1024, 4096]
    - [47, 6.345]
  - - [1024, 4096, 1, 1024, 1024, 1024, 1024, 4096]
    - [71, 7.191]
  - - [1024, 4096, 1, 2048, 1024, 1024, 1024, 4096]
    - [71, 8.17]
  - - [1024, 4096, 1, 4096, 1024, 1024, 1024, 4096]
    - [93, 7.401]
  - - [1024, 4096, 1, 8192, 1024, 1024, 1024, 4096]
    - [12, 6.581]
  - - [1024, 8192, 1, 128, 1024, 1024, 1024, 8192]
    - [27, 3.931]
  - - [1024, 8192, 1, 256, 1024, 1024, 1024, 8192]
    - [22, 6.172]
  - - [1024, 8192, 1, 512, 1024, 1024, 1024, 8192]
    - [25, 7.775]
  - - [1024, 8192, 1, 1024, 1024, 1024, 1024, 8192]
    - [19, 8.45]
  - - [1024, 8192, 1, 2048, 1024, 1024, 1024, 8192]
    - [68, 7.526]
  - - [1024, 8192, 1, 4096, 1024, 1024, 1024, 8192]
    - [18, 8.072]
  - - [1024, 8192, 1, 8192, 1024, 1024, 1024, 8192]
    - [66, 8.134]
  - - [2048, 128, 1, 128, 2048, 2048, 2048, 128]
    - [97, 0.986]
  - - [2048, 128, 1, 256, 2048, 2048, 2048, 128]
    - [84, 1.554]
  - - [2048, 128, 1, 512, 2048, 2048, 2048, 128]
    - [84, 2.247]
  - - [2048, 128, 1, 1024, 2048, 2048, 2048, 128]
    - [81, 2.477]
  - - [2048, 128, 1, 2048, 2048, 2048, 2048, 128]
    - [52, 3.06]
  - - [2048, 128, 1, 4096, 2048, 2048, 2048, 128]
    - [75, 4.705]
  - - [2048, 128, 1, 8192, 2048, 2048, 2048, 128]
    - [75, 4.902]
  - - [2048, 256, 1, 128, 2048, 2048, 2048, 256]
    - [79, 1.6]
  - - [2048, 256, 1, 256, 2048, 2048, 2048, 256]
    - [79, 2.456]
  - - [2048, 256, 1, 512, 2048, 2048, 2048, 256]
    - [83, 3.133]
  - - [2048, 256, 1, 1024, 2048, 2048, 2048, 256]
    - [71, 3.543]
  - - [2048, 256, 1, 2048, 2048, 2048, 2048, 256]
    - [24, 4.149]
  - - [2048, 256, 1, 4096, 2048, 2048, 2048, 256]
    - [73, 5.221]
  - - [2048, 256, 1, 8192, 2048, 2048, 2048, 256]
    - [30, 5.832]
  - - [2048, 512, 1, 128, 2048, 2048, 2048, 512]
    - [42, 2.332]
  - - [2048, 512, 1, 256, 2048, 2048, 2048, 512]
    - [40, 3.195]
  - - [2048, 512, 1, 512, 2048, 2048, 2048, 512]
    - [71, 4.621]
  - - [2048, 512, 1, 1024, 2048, 2048, 2048, 512]
    - [94, 4.673]
  - - [2048, 512, 1, 2048, 2048, 2048, 2048, 512]
    - [74, 4.919]
  - - [2048, 512, 1, 4096, 2048, 2048, 2048, 512]
    - [75, 6.423]
  - - [2048, 512, 1, 8192, 2048, 2048, 2048, 512]
    - [10, 6.624]
  - - [2048, 1024, 1, 128, 2048, 2048, 2048, 1024]
    - [22, 3.189]
  - - [2048, 1024, 1, 256, 2048, 2048, 2048, 1024]
    - [33, 4.468]
  - - [2048, 1024, 1, 512, 2048, 2048, 2048, 1024]
    - [71, 5.31]
  - - [2048, 1024, 1, 1024, 2048, 2048, 2048, 1024]
    - [80, 5.124]
  - - [2048, 1024, 1, 2048, 2048, 2048, 2048, 1024]
    - [75, 6.784]
  - - [2048, 1024, 1, 4096, 2048, 2048, 2048, 1024]
    - [30, 6.493]
  - - [2048, 1024, 1, 8192, 2048, 2048, 2048, 1024]
    - [8, 7.58]
  - - [2048, 2048, 1, 128, 2048, 2048, 2048, 2048]
    - [35, 3.362]
  - - [2048, 2048, 1, 256, 2048, 2048, 2048, 2048]
    - [22, 4.965]
  - - [2048, 2048, 1, 512, 2048, 2048, 2048, 2048]
    - [71, 6.391]
  - - [2048, 2048, 1, 1024, 2048, 2048, 2048, 2048]
    - [71, 7.503]
  - - [2048, 2048, 1, 2048, 2048, 2048, 2048, 2048]
    - [71, 8.249]
  - - [2048, 2048, 1, 4096, 2048, 2048, 2048, 2048]
    - [10, 7.805]
  - - [2048, 2048, 1, 8192, 2048, 2048, 2048, 2048]
    - [9, 8.143]
  - - [2048, 4096, 1, 128, 2048, 2048, 2048, 4096]
    - [20, 3.998]
  - - [2048, 4096, 1, 256, 2048, 2048, 2048, 4096]
    - [20, 6.177]
  - - [2048, 4096, 1, 512, 2048, 2048, 2048, 4096]
    - [33, 7.464]
  - - [2048, 4096, 1, 1024, 2048, 2048, 2048, 4096]
    - [22, 8.663]
  - - [2048, 4096, 1, 2048, 2048, 2048, 2048, 4096]
    - [10, 8.004]
  - - [2048, 4096, 1, 4096, 2048, 2048, 2048, 4096]
    - [8, 8.022]
  - - [2048, 4096, 1, 8192, 2048, 2048, 2048, 4096]
    - [15, 8.098]
  - - [2048, 8192, 1, 128, 2048, 2048, 2048, 8192]
    - [45, 3.273]
  - - [2048, 8192, 1, 256, 2048, 2048, 2048, 8192]
    - [4, 4.851]
  - - [2048, 8192, 1, 512, 2048, 2048, 2048, 8192]
    - [6, 6.464]
  - - [2048, 8192, 1, 1024, 2048, 2048, 2048, 8192]
    - [26, 7.791]
  - - [2048, 8192, 1, 2048, 2048, 2048, 2048, 8192]
    - [9, 8.728]
  - - [2048, 8192, 1, 4096, 2048, 2048, 2048, 8192]
    - [11, 8.74]
  - - [2048, 8192, 1, 8192, 2048, 2048, 2048, 8192]
    - [16, 8.618]
  - - [4096, 128, 1, 128, 4096, 4096, 4096, 128]
    - [56, 1.66]
  - - [4096, 128, 1, 256, 4096, 4096, 4096, 128]
    - [82, 2.435]
  - - [4096, 128, 1, 512, 4096, 4096, 4096, 128]
    - [80, 3.176]
  - - [4096, 128, 1, 1024, 4096, 4096, 4096, 128]
    - [71, 3.514]
  - - [4096, 128, 1, 2048, 4096, 4096, 4096, 128]
    - [21, 4.255]
  - - [4096, 128, 1, 4096, 4096, 4096, 4096, 128]
    - [75, 5.186]
  - - [4096, 128, 1, 8192, 4096, 4096, 4096, 128]
    - [21, 5.847]
  - - [4096, 256, 1, 128, 4096, 4096, 4096, 256]
    - [41, 2.27]
  - - [4096, 256, 1, 256, 4096, 4096, 4096, 256]
    - [42, 3.321]
  - - [4096, 256, 1, 512, 4096, 4096, 4096, 256]
    - [71, 4.671]
  - - [4096, 256, 1, 1024, 4096, 4096, 4096, 256]
    - [95, 4.669]
  - - [4096, 256, 1, 2048, 4096, 4096, 4096, 256]
    - [71, 4.97]
  - - [4096, 256, 1, 4096, 4096, 4096, 4096, 256]
    - [75, 6.382]
  - - [4096, 256, 1, 8192, 4096, 4096, 4096, 256]
    - [16, 6.8]
  - - [4096, 512, 1, 128, 4096, 4096, 4096, 512]
    - [25, 3.187]
  - - [4096, 512, 1, 256, 4096, 4096, 4096, 512]
    - [22, 4.485]
  - - [4096, 512, 1, 512, 4096, 4096, 4096, 512]
    - [71, 5.181]
  - - [4096, 512, 1, 1024, 4096, 4096, 4096, 512]
    - [73, 5.043]
  - - [4096, 512, 1, 2048, 4096, 4096, 4096, 512]
    - [75, 6.67]
  - - [4096, 512, 1, 4096, 4096, 4096, 4096, 512]
    - [15, 6.782]
  - - [4096, 512, 1, 8192, 4096, 4096, 4096, 512]
    - [30, 7.671]
  - - [4096, 1024, 1, 128, 4096, 4096, 4096, 1024]
    - [17, 3.501]
  - - [4096, 1024, 1, 256, 4096, 4096, 4096, 1024]
    - [46, 4.869]
  - - [4096, 1024, 1, 512, 4096, 4096, 4096, 1024]
    - [49, 6.378]
  - - [4096, 1024, 1, 1024, 4096, 4096, 4096, 1024]
    - [71, 7.199]
  - - [4096, 1024, 1, 2048, 4096, 4096, 4096, 1024]
    - [75, 8.17]
  - - [4096, 1024, 1, 4096, 4096, 4096, 4096, 1024]
    - [9, 7.947]
  - - [4096, 1024, 1, 8192, 4096, 4096, 4096, 1024]
    - [11, 8.318]
  - - [4096, 2048, 1, 128, 4096, 4096, 4096, 2048]
    - [17, 4.01]
  - - [4096, 2048, 1, 256, 4096, 4096, 4096, 2048]
    - [22, 6.047]
  - - [4096, 2048, 1, 512, 4096, 4096, 4096, 2048]
    - [14, 7.453]
  - - [4096, 2048, 1, 1024, 4096, 4096, 4096, 2048]
    - [9, 8.598]
  - - [4096, 2048, 1, 2048, 4096, 4096, 4096, 2048]
    - [10, 8.115]
  - - [4096, 2048, 1, 4096, 4096, 4096, 4096, 2048]
    - [32, 8.55]
  - - [4096, 2048, 1, 8192, 4096, 4096, 4096, 2048]
    - [26, 8.45]
  - - [4096, 4096, 1, 128, 4096, 4096, 4096, 4096]
    - [1, 3.315]
  - - [4096, 4096, 1, 256, 4096, 4096, 4096, 4096]
    - [3, 5.134]
  - - [4096, 4096, 1, 512, 4096, 4096, 4096, 4096]
    - [5, 6.682]
  - - [4096, 4096, 1, 1024, 4096, 4096, 4096, 4096]
    - [2, 7.724]
  - - [4096, 4096, 1, 2048, 4096, 4096, 4096, 4096]
    - [10, 8.634]
  - - [4096, 4096, 1, 4096, 4096, 4096, 4096, 4096]
    - [19, 8.767]
  - - [4096, 4096, 1, 8192, 4096, 4096, 4096, 4096]
    - [9, 8.696]
  - - [4096, 8192, 1, 128, 4096, 4096, 4096, 8192]
    - [36, 3.594]
  - - [4096, 8192, 1, 256, 4096, 4096, 4096, 8192]
    - [49, 5.29]
  - - [4096, 8192, 1, 512, 4096, 4096, 4096, 8192]
    - [31, 6.881]
  - - [4096, 8192, 1, 1024, 4096, 4096, 4096, 8192]
    - [17, 8.003]
  - - [4096, 8192, 1, 2048, 4096, 4096, 4096, 8192]
    - [9, 8.534]
  - - [4096, 8192, 1, 4096, 4096, 4096, 4096, 8192]
    - [13, 8.827]
  - - [4096, 8192, 1, 8192, 4096, 4096, 4096, 8192]
    - [21, 8.888]
  - - [8192, 128, 1, 128, 8192, 8192, 8192, 128]
    - [36, 2.376]
  - - [8192, 128, 1, 256, 8192, 8192, 8192, 128]
    - [71, 3.241]
  - - [8192, 128, 1, 512, 8192, 8192, 8192, 128]
    - [73, 4.342]
  - - [8192, 128, 1, 1024, 8192, 8192, 8192, 128]
    - [93, 4.583]
  - - [8192, 128, 1, 2048, 8192, 8192, 8192, 128]
    - [73, 5.093]
  - - [8192, 128, 1, 4096, 8192, 8192, 8192, 128]
    - [71, 6.387]
  - - [8192, 128, 1, 8192, 8192, 8192, 8192, 128]
    - [73, 7.124]
  - - [8192, 256, 1, 128, 8192, 8192, 8192, 256]
    - [27, 3.177]
  - - [8192, 256, 1, 256, 8192, 8192, 8192, 256]
    - [25, 4.404]
  - - [8192, 256, 1, 512, 8192, 8192, 8192, 256]
    - [70, 4.605]
  - - [8192, 256, 1, 1024, 8192, 8192, 8192, 256]
    - [82, 5.141]
  - - [8192, 256, 1, 2048, 8192, 8192, 8192, 256]
    - [71, 6.687]
  - - [8192, 256, 1, 4096, 8192, 8192, 8192, 256]
    - [72, 6.884]
  - - [8192, 256, 1, 8192, 8192, 8192, 8192, 256]
    - [15, 8.042]
  - - [8192, 512, 1, 128, 8192, 8192, 8192, 512]
    - [38, 3.547]
  - - [8192, 512, 1, 256, 8192, 8192, 8192, 512]
    - [37, 5.052]
  - - [8192, 512, 1, 512, 8192, 8192, 8192, 512]
    - [46, 6.352]
  - - [8192, 512, 1, 1024, 8192, 8192, 8192, 512]
    - [73, 7.556]
  - - [8192, 512, 1, 2048, 8192, 8192, 8192, 512]
    - [74, 7.881]
  - - [8192, 512, 1, 4096, 8192, 8192, 8192, 512]
    - [9, 8.01]
  - - [8192, 512, 1, 8192, 8192, 8192, 8192, 512]
    - [13, 8.629]
  - - [8192, 1024, 1, 128, 8192, 8192, 8192, 1024]
    - [29, 3.992]
  - - [8192, 1024, 1, 256, 8192, 8192, 8192, 1024]
    - [29, 6.041]
  - - [8192, 1024, 1, 512, 8192, 8192, 8192, 1024]
    - [33, 7.546]
  - - [8192, 1024, 1, 1024, 8192, 8192, 8192, 1024]
    - [10, 8.526]
  - - [8192, 1024, 1, 2048, 8192, 8192, 8192, 1024]
    - [32, 7.895]
  - - [8192, 1024, 1, 4096, 8192, 8192, 8192, 1024]
    - [9, 8.718]
  - - [8192, 1024, 1, 8192, 8192, 8192, 8192, 1024]
    - [32, 8.439]
  - - [8192, 2048, 1, 128, 8192, 8192, 8192, 2048]
    - [3, 3.414]
  - - [8192, 2048, 1, 256, 8192, 8192, 8192, 2048]
    - [7, 4.797]
  - - [8192, 2048, 1, 512, 8192, 8192, 8192, 2048]
    - [0, 6.558]
  - - [8192, 2048, 1, 1024, 8192, 8192, 8192, 2048]
    - [21, 7.902]
  - - [8192, 2048, 1, 2048, 8192, 8192, 8192, 2048]
    - [21, 8.761]
  - - [8192, 2048, 1, 4096, 8192, 8192, 8192, 2048]
    - [18, 9.183]
  - - [8192, 2048, 1, 8192, 8192, 8192, 8192, 2048]
    - [30, 8.93]
  - - [8192, 4096, 1, 128, 8192, 8192, 8192, 4096]
    - [44, 3.587]
  - - [8192, 4096, 1, 256, 8192, 8192, 8192, 4096]
    - [45, 5.16]
  - - [8192, 4096, 1, 512, 8192, 8192, 8192, 4096]
    - [32, 6.906]
  - - [8192, 4096, 1, 1024, 8192, 8192, 8192, 4096]
    - [30, 8.201]
  - - [8192, 4096, 1, 2048, 8192, 8192, 8192, 4096]
    - [13, 8.996]
  - - [8192, 4096, 1, 4096, 8192, 8192, 8192, 4096]
    - [16, 8.761]
  - - [8192, 4096, 1, 8192, 8192, 8192, 8192, 4096]
    - [24, 8.887]
  - - [8192, 8192, 1, 128, 8192, 8192, 8192, 8192]
    - [38, 3.815]
  - - [8192, 8192, 1, 256, 8192, 8192, 8192, 8192]
    - [28, 5.496]
  - - [8192, 8192, 1, 512, 8192, 8192, 8192, 8192]
    - [24, 7.179]
  - - [8192, 8192, 1, 1024, 8192, 8192, 8192, 8192]
    - [27, 8.203]
  - - [8192, 8192, 1, 2048, 8192, 8192, 8192, 8192]
    - [18, 8.632]
  - - [8192, 8192, 1, 4096, 8192, 8192, 8192, 8192]
    - [15, 8.728]
  - - [8192, 8192, 1, 8192, 8192, 8192, 8192, 8192]
    - [67, 8.653]
  - - [1, 1, 1, 32, 1, 1, 1, 1]
    - [111, 0.0]
- null
- null
- DeviceEfficiency
- GridBased
