library/src/amd_detail/rocblaslt/src/Tensile/Logic/streamk/gfx942_80cu/aquavanjaram942_Cijk_Alik_Bljk_BSS_BH_UserArgs.yaml
- {MinimumRequiredVersion: 4.33.0}
- aquavanjaram942
- {Architecture: gfx942, CUCount: 80}
- [Device 0049, Device 0050]
    SolutionIndex: 0
    SolutionNameMin: Cijk_Alik_Bljk_BSS_BH_UserArgs_MT128x128x32_MI16x16x1_SN_LDSB1_CLR1_GSU0_GSUC0_GSUWGMRR0_K1_LBSPPA256_LBSPPB128_MIWT4_4_PLR1_SU32_SUM0_SUS256_SKXCCM0_VWA4_VWB1_WGM1_WGMXCC1_WGMXCCGn1
    SolutionIndex: 1
    SolutionNameMin: Cijk_Alik_Bljk_BSS_BH_UserArgs_MT128x128x32_MI16x16x1_SN_LDSB1_CLR1_GSU0_GSUC0_GSUWGMRR0_K1_LBSPPA256_LBSPPB128_MIWT4_4_PLR1_SU32_SUM0_SUS256_SKXCCM0_VWA4_VWB2_WGM1_WGMXCC1_WGMXCCGn1
    SolutionIndex: 2
    SolutionNameMin: Cijk_Alik_Bljk_BSS_BH_UserArgs_MT128x128x32_MI16x16x1_SN_LDSB1_CLR1_GSU0_GSUC0_GSUWGMRR0_K1_LBSPPA256_LBSPPB256_MIWT4_4_PLR1_SU32_SUM0_SUS256_SKXCCM0_VWA4_VWB4_WGM1_WGMXCC1_WGMXCCGn1
    SolutionIndex: 3
    SolutionNameMin: Cijk_Alik_Bljk_BSS_BH_UserArgs_MT128x128x32_MI16x16x1_SN_LDSB1_CLR1_GSU0_GSUC0_GSUWGMRR0_K1_LBSPPA256_LBSPPB128_MIWT4_4_PLR1_SU32_SUM0_SUS256_SKXCCM0_VWA4_VWB1_WGM2_WGMXCC1_WGMXCCGn1
    SolutionIndex: 4
    SolutionNameMin: Cijk_Alik_Bljk_BSS_BH_UserArgs_MT128x128x32_MI16x16x1_SN_LDSB1_CLR1_GSU0_GSUC0_GSUWGMRR0_K1_LBSPPA256_LBSPPB256_MIWT4_4_PLR1_SU32_SUM0_SUS256_SKXCCM0_VWA4_VWB4_WGM2_WGMXCC1_WGMXCCGn1
    SolutionIndex: 5
    SolutionNameMin: Cijk_Alik_Bljk_BSS_BH_UserArgs_MT128x128x64_MI16x16x1_SN_LDSB1_CLR1_GSU0_GSUC0_GSUWGMRR0_K1_LBSPPA128_LBSPPB128_MIWT4_4_PLR1_SU32_SUM0_SUS256_SKXCCM0_VWA1_VWB1_WGM1_WGMXCC1_WGMXCCGn1
    SolutionIndex: 6
    SolutionNameMin: Cijk_Alik_Bljk_BSS_BH_UserArgs_MT128x128x64_MI16x16x1_SN_LDSB1_CLR1_GSU0_GSUC0_GSUWGMRR0_K1_LBSPPA512_LBSPPB128_MIWT4_4_PLR1_SU32_SUM0_SUS256_SKXCCM0_VWA4_VWB1_WGM1_WGMXCC1_WGMXCCGn1
    SolutionIndex: 7
    SolutionNameMin: Cijk_Alik_Bljk_BSS_BH_UserArgs_MT128x128x64_MI16x16x1_SN_LDSB1_CLR1_GSU0_GSUC0_GSUWGMRR0_K1_LBSPPA512_LBSPPB256_MIWT4_4_PLR1_SU32_SUM0_SUS256_SKXCCM0_VWA4_VWB2_WGM1_WGMXCC1_WGMXCCGn1
    SolutionIndex: 8
    SolutionNameMin: Cijk_Alik_Bljk_BSS_BH_UserArgs_MT128x128x64_MI16x16x1_SN_LDSB1_CLR1_GSU0_GSUC0_GSUWGMRR0_K1_LBSPPA128_LBSPPB512_MIWT4_4_PLR1_SU32_SUM0_SUS256_SKXCCM0_VWA1_VWB4_WGM1_WGMXCC1_WGMXCCGn1
    SolutionIndex: 9
    SolutionNameMin: Cijk_Alik_Bljk_BSS_BH_UserArgs_MT128x128x64_MI16x16x1_SN_LDSB1_CLR1_GSU0_GSUC0_GSUWGMRR0_K1_LBSPPA512_LBSPPB512_MIWT4_4_PLR1_SU32_SUM0_SUS256_SKXCCM0_VWA4_VWB4_WGM1_WGMXCC1_WGMXCCGn1
    SolutionIndex: 10
    SolutionNameMin: Cijk_Alik_Bljk_BSS_BH_UserArgs_MT128x128x64_MI16x16x1_SN_LDSB1_CLR1_GSU0_GSUC0_GSUWGMRR0_K1_LBSPPA512_LBSPPB128_MIWT4_4_PLR1_SU32_SUM0_SUS256_SKXCCM0_VWA4_VWB1_WGM2_WGMXCC1_WGMXCCGn1
    SolutionIndex: 11
    SolutionNameMin: Cijk_Alik_Bljk_BSS_BH_UserArgs_MT128x128x64_MI16x16x1_SN_LDSB1_CLR1_GSU0_GSUC0_GSUWGMRR0_K1_LBSPPA512_LBSPPB256_MIWT4_4_PLR1_SU32_SUM0_SUS256_SKXCCM0_VWA4_VWB2_WGM2_WGMXCC1_WGMXCCGn1
    SolutionIndex: 12
    SolutionNameMin: Cijk_Alik_Bljk_BSS_BH_UserArgs_MT128x128x64_MI16x16x1_SN_LDSB1_CLR1_GSU0_GSUC0_GSUWGMRR0_K1_LBSPPA512_LBSPPB512_MIWT4_4_PLR1_SU32_SUM0_SUS256_SKXCCM0_VWA4_VWB4_WGM2_WGMXCC1_WGMXCCGn1
    SolutionIndex: 13
    SolutionNameMin: Cijk_Alik_Bljk_BSS_BH_UserArgs_MT128x128x64_MI16x16x1_SN_LDSB1_CLR1_GSU0_GSUC0_GSUWGMRR0_K1_LBSPPA512_LBSPPB512_MIWT4_4_PLR1_SU32_SUM0_SUS256_SKXCCM0_VWA4_VWB4_WGM4_WGMXCC1_WGMXCCGn1
    SolutionIndex: 14
    SolutionNameMin: Cijk_Alik_Bljk_BSS_BH_UserArgs_MT64x128x64_MI16x16x1_SN_LDSB1_CLR1_GSU0_GSUC0_GSUWGMRR0_K1_LBSPPA128_LBSPPB256_MIWT2_4_PLR1_SU32_SUM0_SUS256_SKXCCM0_VWA1_VWB2_WGM1_WGMXCC1_WGMXCCGn1
    SolutionIndex: 15
    SolutionNameMin: Cijk_Alik_Bljk_BSS_BH_UserArgs_MT64x128x64_MI16x16x1_SN_LDSB1_CLR1_GSU0_GSUC0_GSUWGMRR0_K1_LBSPPA128_LBSPPB128_MIWT2_4_PLR1_SU32_SUM0_SUS256_SKXCCM0_VWA1_VWB1_WGM4_WGMXCC1_WGMXCCGn1
    SolutionIndex: 16
    SolutionNameMin: Cijk_Alik_Bljk_BSS_BH_UserArgs_MT128x64x64_MI16x16x1_SN_LDSB1_CLR1_GSU0_GSUC0_GSUWGMRR0_K1_LBSPPA512_LBSPPB128_MIWT4_2_PLR1_SU32_SUM0_SUS256_SKXCCM0_VWA4_VWB1_WGM1_WGMXCC1_WGMXCCGn1
    SolutionIndex: 17
    SolutionNameMin: Cijk_Alik_Bljk_BSS_BH_UserArgs_MT128x64x64_MI16x16x1_SN_LDSB1_CLR1_GSU0_GSUC0_GSUWGMRR0_K1_LBSPPA512_LBSPPB256_MIWT4_2_PLR1_SU32_SUM0_SUS256_SKXCCM0_VWA4_VWB2_WGM1_WGMXCC1_WGMXCCGn1
    SolutionIndex: 18
    SolutionNameMin: Cijk_Alik_Bljk_BSS_BH_UserArgs_MT128x64x64_MI16x16x1_SN_LDSB1_CLR1_GSU0_GSUC0_GSUWGMRR0_K1_LBSPPA512_LBSPPB128_MIWT4_2_PLR2_SU32_SUM0_SUS256_SKXCCM0_VWA4_VWB1_WGM1_WGMXCC1_WGMXCCGn1
    SolutionIndex: 19
    SolutionNameMin: Cijk_Alik_Bljk_BSS_BH_UserArgs_MT128x64x64_MI16x16x1_SN_LDSB1_CLR1_GSU0_GSUC0_GSUWGMRR0_K1_LBSPPA512_LBSPPB256_MIWT4_2_PLR1_SU32_SUM0_SUS256_SKXCCM0_VWA4_VWB2_WGM2_WGMXCC1_WGMXCCGn1
    SolutionIndex: 20
    SolutionNameMin: Cijk_Alik_Bljk_BSS_BH_UserArgs_MT64x64x64_MI16x16x1_SN_LDSB1_CLR1_GSU0_GSUC0_GSUWGMRR0_K1_LBSPPA128_LBSPPB128_MIWT2_2_PLR1_SU32_SUM0_SUS256_SKXCCM0_VWA1_VWB1_WGM1_WGMXCC1_WGMXCCGn1
    SolutionIndex: 21
    SolutionNameMin: Cijk_Alik_Bljk_BSS_BH_UserArgs_MT64x64x64_MI16x16x1_SN_LDSB1_CLR1_GSU0_GSUC0_GSUWGMRR0_K1_LBSPPA128_LBSPPB256_MIWT2_2_PLR1_SU32_SUM0_SUS256_SKXCCM0_VWA1_VWB2_WGM2_WGMXCC1_WGMXCCGn1
    SolutionIndex: 22
    SolutionNameMin: Cijk_Alik_Bljk_BSS_BH_UserArgs_MT64x64x64_MI16x16x1_SN_LDSB1_CLR1_GSU0_GSUC0_GSUWGMRR0_K1_LBSPPA128_LBSPPB256_MIWT2_2_PLR1_SU32_SUM0_SUS256_SKXCCM0_VWA1_VWB2_WGM4_WGMXCC1_WGMXCCGn1
    SolutionIndex: 23
    SolutionNameMin: Cijk_Alik_Bljk_BSS_BH_UserArgs_MT32x64x64_MI16x16x1_SN_LDSB0_CLR1_GSU0_GSUC0_GSUWGMRR0_K1_LBSPPA128_LBSPPB128_MIWT1_2_PLR1_SU32_SUM0_SUS256_SKXCCM0_VWA1_VWB1_WGM1_WGMXCC1_WGMXCCGn1
    SolutionIndex: 24
    SolutionNameMin: Cijk_Alik_Bljk_BSS_BH_UserArgs_MT32x64x64_MI16x16x1_SN_LDSB0_CLR1_GSU0_GSUC0_GSUWGMRR0_K1_LBSPPA128_LBSPPB256_MIWT1_2_PLR1_SU32_SUM0_SUS256_SKXCCM0_VWA1_VWB2_WGM1_WGMXCC1_WGMXCCGn1
    SolutionIndex: 25
    SolutionNameMin: Cijk_Alik_Bljk_BSS_BH_UserArgs_MT64x64x128_MI16x16x1_SN_LDSB1_CLR1_GSU0_GSUC0_GSUWGMRR0_K1_LBSPPA256_LBSPPB512_MIWT2_2_PLR1_SU32_SUM0_SUS256_SKXCCM0_VWA1_VWB2_WGM1_WGMXCC1_WGMXCCGn1
    SolutionIndex: 26
    SolutionNameMin: Cijk_Alik_Bljk_BSS_BH_UserArgs_MT32x64x128_MI16x16x1_SN_LDSB1_CLR1_GSU0_GSUC0_GSUWGMRR0_K1_LBSPPA256_LBSPPB256_MIWT1_2_PLR1_SU32_SUM0_SUS256_SKXCCM0_VWA1_VWB1_WGM1_WGMXCC1_WGMXCCGn1
    SolutionIndex: 27
    SolutionNameMin: Cijk_Alik_Bljk_BSS_BH_UserArgs_MT32x64x128_MI16x16x1_SN_LDSB1_CLR1_GSU0_GSUC0_GSUWGMRR0_K1_LBSPPA256_LBSPPB512_MIWT1_2_PLR1_SU32_SUM0_SUS256_SKXCCM0_VWA1_VWB2_WGM1_WGMXCC1_WGMXCCGn1
    SolutionIndex: 28
    SolutionNameMin: Cijk_Alik_Bljk_BSS_BH_UserArgs_MT64x32x128_MI16x16x1_SN_LDSB1_CLR1_GSU0_GSUC0_GSUWGMRR0_K1_LBSPPA512_LBSPPB256_MIWT2_1_PLR1_SU32_SUM0_SUS256_SKXCCM0_VWA2_VWB1_WGM1_WGMXCC1_WGMXCCGn1
    SolutionIndex: 29
    SolutionNameMin: Cijk_Alik_Bljk_BSS_BH_UserArgs_MT32x32x128_MI16x16x1_SN_LDSB1_CLR1_GSU0_GSUC0_GSUWGMRR0_K1_LBSPPA256_LBSPPB256_MIWT1_1_PLR1_SU32_SUM0_SUS256_SKXCCM0_VWA1_VWB1_WGM1_WGMXCC1_WGMXCCGn1
    SolutionIndex: 30
    SolutionNameMin: Cijk_Alik_Bljk_BSS_BH_UserArgs_MT32x32x128_MI16x16x1_SN_LDSB1_CLR1_GSU0_GSUC0_GSUWGMRR0_K1_LBSPPA256_LBSPPB256_MIWT1_1_PLR2_SU32_SUM0_SUS256_SKXCCM0_VWA1_VWB1_WGM1_WGMXCC1_WGMXCCGn1
    SolutionIndex: 31
    SolutionNameMin: Cijk_Alik_Bljk_BSS_BH_UserArgs_MT128x128x32_MI16x16x1_SN_LDSB1_CLR1_GSU0_GSUC0_GSUWGMRR0_K1_LBSPPA256_LBSPPB128_MIWT4_4_PLR1_SU32_SUM0_SUS256_SKXCCM4_VWA4_VWB2_WGM1_WGMXCC1_WGMXCCGn1
    SolutionIndex: 32
    SolutionNameMin: Cijk_Alik_Bljk_BSS_BH_UserArgs_MT128x128x32_MI16x16x1_SN_LDSB1_CLR1_GSU0_GSUC0_GSUWGMRR0_K1_LBSPPA128_LBSPPB256_MIWT4_4_PLR1_SU32_SUM0_SUS256_SKXCCM4_VWA1_VWB4_WGM1_WGMXCC1_WGMXCCGn1
    SolutionIndex: 33
    SolutionNameMin: Cijk_Alik_Bljk_BSS_BH_UserArgs_MT128x128x32_MI16x16x1_SN_LDSB1_CLR1_GSU0_GSUC0_GSUWGMRR0_K1_LBSPPA256_LBSPPB256_MIWT4_4_PLR1_SU32_SUM0_SUS256_SKXCCM4_VWA4_VWB4_WGM1_WGMXCC1_WGMXCCGn1
    SolutionIndex: 34
    SolutionNameMin: Cijk_Alik_Bljk_BSS_BH_UserArgs_MT128x128x32_MI16x16x1_SN_LDSB1_CLR1_GSU0_GSUC0_GSUWGMRR0_K1_LBSPPA256_LBSPPB128_MIWT4_4_PLR1_SU32_SUM0_SUS256_SKXCCM4_VWA4_VWB2_WGM2_WGMXCC1_WGMXCCGn1
    SolutionIndex: 35
    SolutionNameMin: Cijk_Alik_Bljk_BSS_BH_UserArgs_MT128x128x32_MI16x16x1_SN_LDSB1_CLR1_GSU0_GSUC0_GSUWGMRR0_K1_LBSPPA256_LBSPPB256_MIWT4_4_PLR1_SU32_SUM0_SUS256_SKXCCM4_VWA4_VWB4_WGM2_WGMXCC1_WGMXCCGn1
    SolutionIndex: 36
    SolutionNameMin: Cijk_Alik_Bljk_BSS_BH_UserArgs_MT128x128x32_MI16x16x1_SN_LDSB1_CLR1_GSU0_GSUC0_GSUWGMRR0_K1_LBSPPA128_LBSPPB128_MIWT4_4_PLR1_SU32_SUM0_SUS256_SKXCCM4_VWA1_VWB1_WGM4_WGMXCC1_WGMXCCGn1
    SolutionIndex: 37
    SolutionNameMin: Cijk_Alik_Bljk_BSS_BH_UserArgs_MT128x128x32_MI16x16x1_SN_LDSB1_CLR1_GSU0_GSUC0_GSUWGMRR0_K1_LBSPPA256_LBSPPB128_MIWT4_4_PLR1_SU32_SUM0_SUS256_SKXCCM4_VWA4_VWB1_WGM4_WGMXCC1_WGMXCCGn1
    SolutionIndex: 38
    SolutionNameMin: Cijk_Alik_Bljk_BSS_BH_UserArgs_MT128x128x32_MI16x16x1_SN_LDSB1_CLR1_GSU0_GSUC0_GSUWGMRR0_K1_LBSPPA256_LBSPPB128_MIWT4_4_PLR1_SU32_SUM0_SUS256_SKXCCM4_VWA4_VWB2_WGM4_WGMXCC1_WGMXCCGn1
    SolutionIndex: 39
    SolutionNameMin: Cijk_Alik_Bljk_BSS_BH_UserArgs_MT128x128x32_MI16x16x1_SN_LDSB1_CLR1_GSU0_GSUC0_GSUWGMRR0_K1_LBSPPA128_LBSPPB256_MIWT4_4_PLR1_SU32_SUM0_SUS256_SKXCCM4_VWA1_VWB4_WGM4_WGMXCC1_WGMXCCGn1
    SolutionIndex: 40
    SolutionNameMin: Cijk_Alik_Bljk_BSS_BH_UserArgs_MT128x128x32_MI16x16x1_SN_LDSB1_CLR1_GSU0_GSUC0_GSUWGMRR0_K1_LBSPPA256_LBSPPB256_MIWT4_4_PLR1_SU32_SUM0_SUS256_SKXCCM4_VWA4_VWB4_WGM4_WGMXCC1_WGMXCCGn1
    SolutionIndex: 41
    SolutionNameMin: Cijk_Alik_Bljk_BSS_BH_UserArgs_MT128x64x32_MI16x16x1_SN_LDSB0_CLR1_GSU0_GSUC0_GSUWGMRR0_K1_LBSPPA256_LBSPPB128_MIWT4_2_PLR1_SU32_SUM0_SUS256_SKXCCM4_VWA4_VWB2_WGM1_WGMXCC1_WGMXCCGn1
    SolutionIndex: 42
    SolutionNameMin: Cijk_Alik_Bljk_BSS_BH_UserArgs_MT128x64x32_MI16x16x1_SN_LDSB0_CLR1_GSU0_GSUC0_GSUWGMRR0_K1_LBSPPA256_LBSPPB128_MIWT4_2_PLR1_SU32_SUM0_SUS256_SKXCCM4_VWA4_VWB2_WGM4_WGMXCC1_WGMXCCGn1
    SolutionIndex: 43
    SolutionNameMin: Cijk_Alik_Bljk_BSS_BH_UserArgs_MT32x32x32_MI16x16x1_SN_LDSB0_CLR1_GSU0_GSUC0_GSUWGMRR0_K1_LBSPPA128_LBSPPB128_MIWT1_1_PLR1_SU32_SUM0_SUS256_SKXCCM4_VWA1_VWB1_WGM1_WGMXCC1_WGMXCCGn1
    SolutionIndex: 44
    SolutionNameMin: Cijk_Alik_Bljk_BSS_BH_UserArgs_MT128x128x64_MI16x16x1_SN_LDSB1_CLR1_GSU0_GSUC0_GSUWGMRR0_K1_LBSPPA512_LBSPPB128_MIWT4_4_PLR1_SU32_SUM0_SUS256_SKXCCM4_VWA4_VWB1_WGM1_WGMXCC1_WGMXCCGn1
    SolutionIndex: 45
    SolutionNameMin: Cijk_Alik_Bljk_BSS_BH_UserArgs_MT128x128x64_MI16x16x1_SN_LDSB1_CLR1_GSU0_GSUC0_GSUWGMRR0_K1_LBSPPA512_LBSPPB256_MIWT4_4_PLR1_SU32_SUM0_SUS256_SKXCCM4_VWA4_VWB2_WGM1_WGMXCC1_WGMXCCGn1
    SolutionIndex: 46
    SolutionNameMin: Cijk_Alik_Bljk_BSS_BH_UserArgs_MT128x128x64_MI16x16x1_SN_LDSB1_CLR1_GSU0_GSUC0_GSUWGMRR0_K1_LBSPPA512_LBSPPB512_MIWT4_4_PLR1_SU32_SUM0_SUS256_SKXCCM4_VWA4_VWB4_WGM1_WGMXCC1_WGMXCCGn1
    SolutionIndex: 47
    SolutionNameMin: Cijk_Alik_Bljk_BSS_BH_UserArgs_MT128x128x64_MI16x16x1_SN_LDSB1_CLR1_GSU0_GSUC0_GSUWGMRR0_K1_LBSPPA512_LBSPPB128_MIWT4_4_PLR1_SU32_SUM0_SUS256_SKXCCM4_VWA4_VWB1_WGM2_WGMXCC1_WGMXCCGn1
    SolutionIndex: 48
    SolutionNameMin: Cijk_Alik_Bljk_BSS_BH_UserArgs_MT128x128x64_MI16x16x1_SN_LDSB1_CLR1_GSU0_GSUC0_GSUWGMRR0_K1_LBSPPA512_LBSPPB256_MIWT4_4_PLR1_SU32_SUM0_SUS256_SKXCCM4_VWA4_VWB2_WGM2_WGMXCC1_WGMXCCGn1
    SolutionIndex: 49
    SolutionNameMin: Cijk_Alik_Bljk_BSS_BH_UserArgs_MT128x128x64_MI16x16x1_SN_LDSB1_CLR1_GSU0_GSUC0_GSUWGMRR0_K1_LBSPPA512_LBSPPB512_MIWT4_4_PLR1_SU32_SUM0_SUS256_SKXCCM4_VWA4_VWB4_WGM2_WGMXCC1_WGMXCCGn1
    SolutionIndex: 50
    SolutionNameMin: Cijk_Alik_Bljk_BSS_BH_UserArgs_MT128x128x64_MI16x16x1_SN_LDSB1_CLR1_GSU0_GSUC0_GSUWGMRR0_K1_LBSPPA512_LBSPPB128_MIWT4_4_PLR1_SU32_SUM0_SUS256_SKXCCM4_VWA4_VWB1_WGM4_WGMXCC1_WGMXCCGn1
    SolutionIndex: 51
    SolutionNameMin: Cijk_Alik_Bljk_BSS_BH_UserArgs_MT128x128x64_MI16x16x1_SN_LDSB1_CLR1_GSU0_GSUC0_GSUWGMRR0_K1_LBSPPA128_LBSPPB256_MIWT4_4_PLR1_SU32_SUM0_SUS256_SKXCCM4_VWA1_VWB2_WGM4_WGMXCC1_WGMXCCGn1
    SolutionIndex: 52
    SolutionNameMin: Cijk_Alik_Bljk_BSS_BH_UserArgs_MT128x128x64_MI16x16x1_SN_LDSB1_CLR1_GSU0_GSUC0_GSUWGMRR0_K1_LBSPPA512_LBSPPB256_MIWT4_4_PLR1_SU32_SUM0_SUS256_SKXCCM4_VWA4_VWB2_WGM4_WGMXCC1_WGMXCCGn1
    SolutionIndex: 53
    SolutionNameMin: Cijk_Alik_Bljk_BSS_BH_UserArgs_MT64x128x64_MI16x16x1_SN_LDSB1_CLR1_GSU0_GSUC0_GSUWGMRR0_K1_LBSPPA128_LBSPPB128_MIWT2_4_PLR1_SU32_SUM0_SUS256_SKXCCM4_VWA1_VWB1_WGM1_WGMXCC1_WGMXCCGn1
    SolutionIndex: 54
    SolutionNameMin: Cijk_Alik_Bljk_BSS_BH_UserArgs_MT64x128x64_MI16x16x1_SN_LDSB1_CLR1_GSU0_GSUC0_GSUWGMRR0_K1_LBSPPA128_LBSPPB256_MIWT2_4_PLR1_SU32_SUM0_SUS256_SKXCCM4_VWA1_VWB2_WGM1_WGMXCC1_WGMXCCGn1
    SolutionIndex: 55
    SolutionNameMin: Cijk_Alik_Bljk_BSS_BH_UserArgs_MT64x128x64_MI16x16x1_SN_LDSB1_CLR1_GSU0_GSUC0_GSUWGMRR0_K1_LBSPPA128_LBSPPB512_MIWT2_4_PLR1_SU32_SUM0_SUS256_SKXCCM4_VWA1_VWB4_WGM1_WGMXCC1_WGMXCCGn1
    SolutionIndex: 56
    SolutionNameMin: Cijk_Alik_Bljk_BSS_BH_UserArgs_MT64x128x64_MI16x16x1_SN_LDSB1_CLR1_GSU0_GSUC0_GSUWGMRR0_K1_LBSPPA128_LBSPPB128_MIWT2_4_PLR1_SU32_SUM0_SUS256_SKXCCM4_VWA1_VWB1_WGM4_WGMXCC1_WGMXCCGn1
    SolutionIndex: 57
    SolutionNameMin: Cijk_Alik_Bljk_BSS_BH_UserArgs_MT128x64x64_MI16x16x1_SN_LDSB1_CLR1_GSU0_GSUC0_GSUWGMRR0_K1_LBSPPA128_LBSPPB128_MIWT4_2_PLR1_SU32_SUM0_SUS256_SKXCCM4_VWA1_VWB1_WGM1_WGMXCC1_WGMXCCGn1
    SolutionIndex: 58
    SolutionNameMin: Cijk_Alik_Bljk_BSS_BH_UserArgs_MT128x64x64_MI16x16x1_SN_LDSB1_CLR1_GSU0_GSUC0_GSUWGMRR0_K1_LBSPPA512_LBSPPB128_MIWT4_2_PLR1_SU32_SUM0_SUS256_SKXCCM4_VWA4_VWB1_WGM1_WGMXCC1_WGMXCCGn1
    SolutionIndex: 59
    SolutionNameMin: Cijk_Alik_Bljk_BSS_BH_UserArgs_MT128x64x64_MI16x16x1_SN_LDSB1_CLR1_GSU0_GSUC0_GSUWGMRR0_K1_LBSPPA128_LBSPPB256_MIWT4_2_PLR1_SU32_SUM0_SUS256_SKXCCM4_VWA1_VWB2_WGM1_WGMXCC1_WGMXCCGn1
    SolutionIndex: 60
    SolutionNameMin: Cijk_Alik_Bljk_BSS_BH_UserArgs_MT128x64x64_MI16x16x1_SN_LDSB1_CLR1_GSU0_GSUC0_GSUWGMRR0_K1_LBSPPA512_LBSPPB256_MIWT4_2_PLR1_SU32_SUM0_SUS256_SKXCCM4_VWA4_VWB2_WGM1_WGMXCC1_WGMXCCGn1
    SolutionIndex: 61
    SolutionNameMin: Cijk_Alik_Bljk_BSS_BH_UserArgs_MT128x64x64_MI16x16x1_SN_LDSB1_CLR1_GSU0_GSUC0_GSUWGMRR0_K1_LBSPPA512_LBSPPB128_MIWT4_2_PLR1_SU32_SUM0_SUS256_SKXCCM4_VWA4_VWB1_WGM2_WGMXCC1_WGMXCCGn1
    SolutionIndex: 62
    SolutionNameMin: Cijk_Alik_Bljk_BSS_BH_UserArgs_MT128x64x64_MI16x16x1_SN_LDSB1_CLR1_GSU0_GSUC0_GSUWGMRR0_K1_LBSPPA512_LBSPPB256_MIWT4_2_PLR1_SU32_SUM0_SUS256_SKXCCM4_VWA4_VWB2_WGM2_WGMXCC1_WGMXCCGn1
    SolutionIndex: 63
    SolutionNameMin: Cijk_Alik_Bljk_BSS_BH_UserArgs_MT128x64x64_MI16x16x1_SN_LDSB1_CLR1_GSU0_GSUC0_GSUWGMRR0_K1_LBSPPA512_LBSPPB128_MIWT4_2_PLR1_SU32_SUM0_SUS256_SKXCCM4_VWA4_VWB1_WGM4_WGMXCC1_WGMXCCGn1
    SolutionIndex: 64
    SolutionNameMin: Cijk_Alik_Bljk_BSS_BH_UserArgs_MT128x64x64_MI16x16x1_SN_LDSB1_CLR1_GSU0_GSUC0_GSUWGMRR0_K1_LBSPPA512_LBSPPB256_MIWT4_2_PLR1_SU32_SUM0_SUS256_SKXCCM4_VWA4_VWB2_WGM4_WGMXCC1_WGMXCCGn1
    SolutionIndex: 65
    SolutionNameMin: Cijk_Alik_Bljk_BSS_BH_UserArgs_MT64x64x64_MI16x16x1_SN_LDSB1_CLR1_GSU0_GSUC0_GSUWGMRR0_K1_LBSPPA128_LBSPPB128_MIWT2_2_PLR1_SU32_SUM0_SUS256_SKXCCM4_VWA1_VWB1_WGM1_WGMXCC1_WGMXCCGn1
    SolutionIndex: 66
    SolutionNameMin: Cijk_Alik_Bljk_BSS_BH_UserArgs_MT64x64x64_MI16x16x1_SN_LDSB1_CLR1_GSU0_GSUC0_GSUWGMRR0_K1_LBSPPA128_LBSPPB256_MIWT2_2_PLR1_SU32_SUM0_SUS256_SKXCCM4_VWA1_VWB2_WGM1_WGMXCC1_WGMXCCGn1
    SolutionIndex: 67
    SolutionNameMin: Cijk_Alik_Bljk_BSS_BH_UserArgs_MT64x64x64_MI16x16x1_SN_LDSB1_CLR1_GSU0_GSUC0_GSUWGMRR0_K1_LBSPPA128_LBSPPB128_MIWT2_2_PLR1_SU32_SUM0_SUS256_SKXCCM4_VWA1_VWB1_WGM2_WGMXCC1_WGMXCCGn1
    SolutionIndex: 68
    SolutionNameMin: Cijk_Alik_Bljk_BSS_BH_UserArgs_MT64x64x64_MI16x16x1_SN_LDSB1_CLR1_GSU0_GSUC0_GSUWGMRR0_K1_LBSPPA128_LBSPPB256_MIWT2_2_PLR1_SU32_SUM0_SUS256_SKXCCM4_VWA1_VWB2_WGM2_WGMXCC1_WGMXCCGn1
    SolutionIndex: 69
    SolutionNameMin: Cijk_Alik_Bljk_BSS_BH_UserArgs_MT64x64x64_MI16x16x1_SN_LDSB1_CLR1_GSU0_GSUC0_GSUWGMRR0_K1_LBSPPA128_LBSPPB128_MIWT2_2_PLR1_SU32_SUM0_SUS256_SKXCCM4_VWA1_VWB1_WGM4_WGMXCC1_WGMXCCGn1
    SolutionIndex: 70
    SolutionNameMin: Cijk_Alik_Bljk_BSS_BH_UserArgs_MT64x64x64_MI16x16x1_SN_LDSB1_CLR1_GSU0_GSUC0_GSUWGMRR0_K1_LBSPPA128_LBSPPB256_MIWT2_2_PLR1_SU32_SUM0_SUS256_SKXCCM4_VWA1_VWB2_WGM4_WGMXCC1_WGMXCCGn1
    SolutionIndex: 71
    SolutionNameMin: Cijk_Alik_Bljk_BSS_BH_UserArgs_MT32x64x64_MI16x16x1_SN_LDSB0_CLR1_GSU0_GSUC0_GSUWGMRR0_K1_LBSPPA128_LBSPPB256_MIWT1_2_PLR1_SU32_SUM0_SUS256_SKXCCM4_VWA1_VWB2_WGM1_WGMXCC1_WGMXCCGn1
    SolutionIndex: 72
    SolutionNameMin: Cijk_Alik_Bljk_BSS_BH_UserArgs_MT64x32x64_MI16x16x1_SN_LDSB0_CLR1_GSU0_GSUC0_GSUWGMRR0_K1_LBSPPA128_LBSPPB128_MIWT2_1_PLR1_SU32_SUM0_SUS256_SKXCCM4_VWA1_VWB1_WGM1_WGMXCC1_WGMXCCGn1
    SolutionIndex: 73
    SolutionNameMin: Cijk_Alik_Bljk_BSS_BH_UserArgs_MT64x32x64_MI16x16x1_SN_LDSB0_CLR1_GSU0_GSUC0_GSUWGMRR0_K1_LBSPPA256_LBSPPB128_MIWT2_1_PLR1_SU32_SUM0_SUS256_SKXCCM4_VWA2_VWB1_WGM1_WGMXCC1_WGMXCCGn1
    SolutionIndex: 74
    SolutionNameMin: Cijk_Alik_Bljk_BSS_BH_UserArgs_MT32x32x64_MI16x16x1_SN_LDSB0_CLR1_GSU0_GSUC0_GSUWGMRR0_K1_LBSPPA128_LBSPPB128_MIWT1_1_PLR1_SU32_SUM0_SUS256_SKXCCM4_VWA1_VWB1_WGM1_WGMXCC1_WGMXCCGn1
    SolutionIndex: 75
    SolutionNameMin: Cijk_Alik_Bljk_BSS_BH_UserArgs_MT64x64x128_MI16x16x1_SN_LDSB1_CLR1_GSU0_GSUC0_GSUWGMRR0_K1_LBSPPA256_LBSPPB256_MIWT2_2_PLR1_SU32_SUM0_SUS256_SKXCCM4_VWA1_VWB1_WGM1_WGMXCC1_WGMXCCGn1
    SolutionIndex: 76
    SolutionNameMin: Cijk_Alik_Bljk_BSS_BH_UserArgs_MT32x64x128_MI16x16x1_SN_LDSB1_CLR1_GSU0_GSUC0_GSUWGMRR0_K1_LBSPPA256_LBSPPB256_MIWT1_2_PLR1_SU32_SUM0_SUS256_SKXCCM4_VWA1_VWB1_WGM1_WGMXCC1_WGMXCCGn1
    SolutionIndex: 77
    SolutionNameMin: Cijk_Alik_Bljk_BSS_BH_UserArgs_MT32x64x128_MI16x16x1_SN_LDSB1_CLR1_GSU0_GSUC0_GSUWGMRR0_K1_LBSPPA256_LBSPPB512_MIWT1_2_PLR1_SU32_SUM0_SUS256_SKXCCM4_VWA1_VWB2_WGM1_WGMXCC1_WGMXCCGn1
    SolutionIndex: 78
    SolutionNameMin: Cijk_Alik_Bljk_BSS_BH_UserArgs_MT64x32x128_MI16x16x1_SN_LDSB1_CLR1_GSU0_GSUC0_GSUWGMRR0_K1_LBSPPA256_LBSPPB256_MIWT2_1_PLR1_SU32_SUM0_SUS256_SKXCCM4_VWA1_VWB1_WGM1_WGMXCC1_WGMXCCGn1
    SolutionIndex: 79
    SolutionNameMin: Cijk_Alik_Bljk_BSS_BH_UserArgs_MT64x32x128_MI16x16x1_SN_LDSB1_CLR1_GSU0_GSUC0_GSUWGMRR0_K1_LBSPPA512_LBSPPB256_MIWT2_1_PLR1_SU32_SUM0_SUS256_SKXCCM4_VWA2_VWB1_WGM1_WGMXCC1_WGMXCCGn1
    SolutionIndex: 80
    SolutionNameMin: Cijk_Alik_Bljk_BSS_BH_UserArgs_MT32x32x128_MI16x16x1_SN_LDSB1_CLR1_GSU0_GSUC0_GSUWGMRR0_K1_LBSPPA256_LBSPPB256_MIWT1_1_PLR1_SU32_SUM0_SUS256_SKXCCM4_VWA1_VWB1_WGM1_WGMXCC1_WGMXCCGn1
    SolutionIndex: 81
    SolutionNameMin: Cijk_Alik_Bljk_BSS_BH_UserArgs_MT32x32x128_MI16x16x1_SN_LDSB1_CLR1_GSU0_GSUC0_GSUWGMRR0_K1_LBSPPA256_LBSPPB256_MIWT1_1_PLR2_SU32_SUM0_SUS256_SKXCCM4_VWA1_VWB1_WGM1_WGMXCC1_WGMXCCGn1
    SolutionIndex: 82
    SolutionNameMin: Cijk_Alik_Bljk_BSS_BH_UserArgs_MT32x32x128_MI16x16x1_SN_LDSB1_CLR1_GSU0_GSUC0_GSUWGMRR0_K1_LBSPPA256_LBSPPB256_MIWT1_1_PLR1_SU32_SUM0_SUS256_SKXCCM4_VWA1_VWB1_WGM4_WGMXCC1_WGMXCCGn1
    SolutionIndex: 83
    SolutionNameMin: Cijk_Alik_Bljk_BSS_BH_UserArgs_MT32x32x128_MI16x16x1_SN_LDSB1_CLR1_GSU0_GSUC0_GSUWGMRR0_K1_LBSPPA256_LBSPPB256_MIWT1_1_PLR2_SU32_SUM0_SUS256_SKXCCM4_VWA1_VWB1_WGM4_WGMXCC1_WGMXCCGn1
    SolutionIndex: 84
    SolutionNameMin: Cijk_Alik_Bljk_BSS_BH_UserArgs_MT32x32x32_MI16x16x1_SN_LDSB0_CLR1_GSU0_GSUC0_GSUWGMRR0_K1_LBSPPA128_LBSPPB128_MIWT1_1_PLR1_SU32_SUM0_SUS256_SKXCCM4_VWA1_VWB1_WGM4_WGMXCC1_WGMXCCGn1
- - - [128, 128, 1, 128, 128, 128, 128, 128]
    - [81, 0.094]
  - - [128, 128, 1, 256, 128, 128, 256, 256]
    - [29, 0.112]
  - - [128, 128, 1, 512, 128, 128, 512, 512]
    - [80, 0.186]
  - - [128, 128, 1, 1024, 128, 128, 1024, 1024]
    - [74, 0.297]
  - - [128, 128, 1, 2048, 128, 128, 2048, 2048]
    - [81, 0.565]
  - - [128, 128, 1, 4096, 128, 128, 4096, 4096]
    - [81, 1.032]
  - - [128, 128, 1, 8192, 128, 128, 8192, 8192]
    - [80, 1.712]
  - - [128, 256, 1, 128, 128, 128, 128, 128]
    - [80, 0.187]
  - - [128, 256, 1, 256, 128, 128, 256, 256]
    - [29, 0.218]
  - - [128, 256, 1, 512, 128, 128, 512, 512]
    - [80, 0.376]
  - - [128, 256, 1, 1024, 128, 128, 1024, 1024]
    - [80, 0.661]
  - - [128, 256, 1, 2048, 128, 128, 2048, 2048]
    - [81, 1.077]
  - - [128, 256, 1, 4096, 128, 128, 4096, 4096]
    - [23, 1.78]
  - - [128, 256, 1, 8192, 128, 128, 8192, 8192]
    - [80, 2.907]
  - - [128, 512, 1, 128, 128, 128, 128, 128]
    - [80, 0.363]
  - - [128, 512, 1, 256, 128, 128, 256, 256]
    - [29, 0.446]
  - - [128, 512, 1, 512, 128, 128, 512, 512]
    - [83, 0.717]
  - - [128, 512, 1, 1024, 128, 128, 1024, 1024]
    - [29, 1.342]
  - - [128, 512, 1, 2048, 128, 128, 2048, 2048]
    - [80, 2.204]
  - - [128, 512, 1, 4096, 128, 128, 4096, 4096]
    - [71, 3.212]
  - - [128, 512, 1, 8192, 128, 128, 8192, 8192]
    - [75, 4.608]
  - - [128, 1024, 1, 128, 128, 128, 128, 128]
    - [79, 0.66]
  - - [128, 1024, 1, 256, 128, 128, 256, 256]
    - [29, 1.186]
  - - [128, 1024, 1, 512, 128, 128, 512, 512]
    - [81, 1.902]
  - - [128, 1024, 1, 1024, 128, 128, 1024, 1024]
    - [29, 2.867]
  - - [128, 1024, 1, 2048, 128, 128, 2048, 2048]
    - [77, 3.525]
  - - [128, 1024, 1, 4096, 128, 128, 4096, 4096]
    - [65, 4.98]
  - - [128, 1024, 1, 8192, 128, 128, 8192, 8192]
    - [17, 6.442]
  - - [128, 2048, 1, 128, 128, 128, 128, 128]
    - [23, 1.201]
  - - [128, 2048, 1, 256, 128, 128, 256, 256]
    - [71, 2.07]
  - - [128, 2048, 1, 512, 128, 128, 512, 512]
    - [71, 3.173]
  - - [128, 2048, 1, 1024, 128, 128, 1024, 1024]
    - [76, 4.302]
  - - [128, 2048, 1, 2048, 128, 128, 2048, 2048]
    - [41, 4.724]
  - - [128, 2048, 1, 4096, 128, 128, 4096, 4096]
    - [58, 7.047]
  - - [128, 2048, 1, 8192, 128, 128, 8192, 8192]
    - [44, 9.9]
  - - [128, 4096, 1, 128, 128, 128, 128, 128]
    - [65, 2.041]
  - - [128, 4096, 1, 256, 128, 128, 256, 256]
    - [66, 3.356]
  - - [128, 4096, 1, 512, 128, 128, 512, 512]
    - [65, 5.007]
  - - [128, 4096, 1, 1024, 128, 128, 1024, 1024]
    - [58, 5.797]
  - - [128, 4096, 1, 2048, 128, 128, 2048, 2048]
    - [69, 6.31]
  - - [128, 4096, 1, 4096, 128, 128, 4096, 4096]
    - [58, 7.671]
  - - [128, 4096, 1, 8192, 128, 128, 8192, 8192]
    - [7, 9.97]
  - - [128, 8192, 1, 128, 128, 128, 128, 128]
    - [57, 3.027]
  - - [128, 8192, 1, 256, 128, 128, 256, 256]
    - [59, 4.788]
  - - [128, 8192, 1, 512, 128, 128, 512, 512]
    - [58, 7.014]
  - - [128, 8192, 1, 1024, 128, 128, 1024, 1024]
    - [69, 6.728]
  - - [128, 8192, 1, 2048, 128, 128, 2048, 2048]
    - [58, 8.29]
  - - [128, 8192, 1, 4096, 128, 128, 4096, 4096]
    - [17, 10.193]
  - - [128, 8192, 1, 8192, 128, 128, 8192, 8192]
    - [17, 11.614]
  - - [256, 128, 1, 128, 256, 256, 128, 128]
    - [80, 0.183]
  - - [256, 128, 1, 256, 256, 256, 256, 256]
    - [30, 0.218]
  - - [256, 128, 1, 512, 256, 256, 512, 512]
    - [80, 0.373]
  - - [256, 128, 1, 1024, 256, 256, 1024, 1024]
    - [81, 0.65]
  - - [256, 128, 1, 2048, 256, 256, 2048, 2048]
    - [43, 1.073]
  - - [256, 128, 1, 4096, 256, 256, 4096, 4096]
    - [77, 1.766]
  - - [256, 128, 1, 8192, 256, 256, 8192, 8192]
    - [82, 2.866]
  - - [256, 256, 1, 128, 256, 256, 128, 128]
    - [80, 0.357]
  - - [256, 256, 1, 256, 256, 256, 256, 256]
    - [81, 0.443]
  - - [256, 256, 1, 512, 256, 256, 512, 512]
    - [80, 0.73]
  - - [256, 256, 1, 1024, 256, 256, 1024, 1024]
    - [29, 1.324]
  - - [256, 256, 1, 2048, 256, 256, 2048, 2048]
    - [81, 2.165]
  - - [256, 256, 1, 4096, 256, 256, 4096, 4096]
    - [71, 3.208]
  - - [256, 256, 1, 8192, 256, 256, 8192, 8192]
    - [25, 4.596]
  - - [256, 512, 1, 128, 256, 256, 128, 128]
    - [27, 0.672]
  - - [256, 512, 1, 256, 256, 256, 256, 256]
    - [29, 1.177]
  - - [256, 512, 1, 512, 256, 256, 512, 512]
    - [81, 1.885]
  - - [256, 512, 1, 1024, 256, 256, 1024, 1024]
    - [29, 2.851]
  - - [256, 512, 1, 2048, 256, 256, 2048, 2048]
    - [77, 3.521]
  - - [256, 512, 1, 4096, 256, 256, 4096, 4096]
    - [66, 4.983]
  - - [256, 512, 1, 8192, 256, 256, 8192, 8192]
    - [64, 6.416]
  - - [256, 1024, 1, 128, 256, 256, 128, 128]
    - [23, 1.186]
  - - [256, 1024, 1, 256, 256, 256, 256, 256]
    - [72, 2.038]
  - - [256, 1024, 1, 512, 256, 256, 512, 512]
    - [24, 3.17]
  - - [256, 1024, 1, 1024, 256, 256, 1024, 1024]
    - [78, 4.317]
  - - [256, 1024, 1, 2048, 256, 256, 2048, 2048]
    - [41, 4.699]
  - - [256, 1024, 1, 4096, 256, 256, 4096, 4096]
    - [19, 7.238]
  - - [256, 1024, 1, 8192, 256, 256, 8192, 8192]
    - [50, 9.675]
  - - [256, 2048, 1, 128, 256, 256, 128, 128]
    - [65, 2.049]
  - - [256, 2048, 1, 256, 256, 256, 256, 256]
    - [65, 3.377]
  - - [256, 2048, 1, 512, 256, 256, 512, 512]
    - [66, 5.03]
  - - [256, 2048, 1, 1024, 256, 256, 1024, 1024]
    - [58, 5.857]
  - - [256, 2048, 1, 2048, 256, 256, 2048, 2048]
    - [65, 6.95]
  - - [256, 2048, 1, 4096, 256, 256, 4096, 4096]
    - [12, 8.013]
  - - [256, 2048, 1, 8192, 256, 256, 8192, 8192]
    - [12, 9.841]
  - - [256, 4096, 1, 128, 256, 256, 128, 128]
    - [63, 2.947]
  - - [256, 4096, 1, 256, 256, 256, 256, 256]
    - [57, 4.78]
  - - [256, 4096, 1, 512, 256, 256, 512, 512]
    - [63, 7.046]
  - - [256, 4096, 1, 1024, 256, 256, 1024, 1024]
    - [65, 7.703]
  - - [256, 4096, 1, 2048, 256, 256, 2048, 2048]
    - [60, 8.771]
  - - [256, 4096, 1, 4096, 256, 256, 4096, 4096]
    - [61, 9.699]
  - - [256, 4096, 1, 8192, 256, 256, 8192, 8192]
    - [50, 10.982]
  - - [256, 8192, 1, 128, 256, 256, 128, 128]
    - [2, 3.972]
  - - [256, 8192, 1, 256, 256, 256, 256, 256]
    - [37, 5.615]
  - - [256, 8192, 1, 512, 256, 256, 512, 512]
    - [44, 7.731]
  - - [256, 8192, 1, 1024, 256, 256, 1024, 1024]
    - [60, 9.519]
  - - [256, 8192, 1, 2048, 256, 256, 2048, 2048]
    - [60, 11.044]
  - - [256, 8192, 1, 4096, 256, 256, 4096, 4096]
    - [49, 11.142]
  - - [256, 8192, 1, 8192, 256, 256, 8192, 8192]
    - [10, 13.012]
  - - [512, 128, 1, 128, 512, 512, 128, 128]
    - [80, 0.36]
  - - [512, 128, 1, 256, 512, 512, 256, 256]
    - [80, 0.45]
  - - [512, 128, 1, 512, 512, 512, 512, 512]
    - [81, 0.735]
  - - [512, 128, 1, 1024, 512, 512, 1024, 1024]
    - [30, 1.326]
  - - [512, 128, 1, 2048, 512, 512, 2048, 2048]
    - [80, 2.185]
  - - [512, 128, 1, 4096, 512, 512, 4096, 4096]
    - [71, 3.19]
  - - [512, 128, 1, 8192, 512, 512, 8192, 8192]
    - [25, 4.616]
  - - [512, 256, 1, 128, 512, 512, 128, 128]
    - [28, 0.669]
  - - [512, 256, 1, 256, 512, 512, 256, 256]
    - [80, 1.183]
  - - [512, 256, 1, 512, 512, 512, 512, 512]
    - [80, 1.889]
  - - [512, 256, 1, 1024, 512, 512, 1024, 1024]
    - [30, 2.813]
  - - [512, 256, 1, 2048, 512, 512, 2048, 2048]
    - [76, 3.511]
  - - [512, 256, 1, 4096, 512, 512, 4096, 4096]
    - [67, 4.951]
  - - [512, 256, 1, 8192, 512, 512, 8192, 8192]
    - [64, 6.452]
  - - [512, 512, 1, 128, 512, 512, 128, 128]
    - [24, 1.193]
  - - [512, 512, 1, 256, 512, 512, 256, 256]
    - [71, 2.049]
  - - [512, 512, 1, 512, 512, 512, 512, 512]
    - [71, 3.183]
  - - [512, 512, 1, 1024, 512, 512, 1024, 1024]
    - [77, 4.287]
  - - [512, 512, 1, 2048, 512, 512, 2048, 2048]
    - [41, 4.721]
  - - [512, 512, 1, 4096, 512, 512, 4096, 4096]
    - [16, 7.114]
  - - [512, 512, 1, 8192, 512, 512, 8192, 8192]
    - [50, 9.737]
  - - [512, 1024, 1, 128, 512, 512, 128, 128]
    - [65, 2.04]
  - - [512, 1024, 1, 256, 512, 512, 256, 256]
    - [65, 3.4]
  - - [512, 1024, 1, 512, 512, 512, 512, 512]
    - [65, 5.004]
  - - [512, 1024, 1, 1024, 512, 512, 1024, 1024]
    - [60, 5.895]
  - - [512, 1024, 1, 2048, 512, 512, 2048, 2048]
    - [69, 6.866]
  - - [512, 1024, 1, 4096, 512, 512, 4096, 4096]
    - [9, 8.046]
  - - [512, 1024, 1, 8192, 512, 512, 8192, 8192]
    - [11, 9.765]
  - - [512, 2048, 1, 128, 512, 512, 128, 128]
    - [58, 3.05]
  - - [512, 2048, 1, 256, 512, 512, 256, 256]
    - [15, 4.824]
  - - [512, 2048, 1, 512, 512, 512, 512, 512]
    - [58, 7.14]
  - - [512, 2048, 1, 1024, 512, 512, 1024, 1024]
    - [66, 8.19]
  - - [512, 2048, 1, 2048, 512, 512, 2048, 2048]
    - [66, 8.878]
  - - [512, 2048, 1, 4096, 512, 512, 4096, 4096]
    - [55, 9.322]
  - - [512, 2048, 1, 8192, 512, 512, 8192, 8192]
    - [52, 10.921]
  - - [512, 4096, 1, 128, 512, 512, 128, 128]
    - [33, 3.817]
  - - [512, 4096, 1, 256, 512, 512, 256, 256]
    - [39, 5.718]
  - - [512, 4096, 1, 512, 512, 512, 512, 512]
    - [44, 7.867]
  - - [512, 4096, 1, 1024, 512, 512, 1024, 1024]
    - [64, 9.725]
  - - [512, 4096, 1, 2048, 512, 512, 2048, 2048]
    - [62, 11.07]
  - - [512, 4096, 1, 4096, 512, 512, 4096, 4096]
    - [50, 10.66]
  - - [512, 4096, 1, 8192, 512, 512, 8192, 8192]
    - [47, 12.735]
  - - [512, 8192, 1, 128, 512, 512, 128, 128]
    - [4, 4.542]
  - - [512, 8192, 1, 256, 512, 512, 256, 256]
    - [35, 6.436]
  - - [512, 8192, 1, 512, 512, 512, 512, 512]
    - [31, 8.902]
  - - [512, 8192, 1, 1024, 512, 512, 1024, 1024]
    - [44, 11.229]
  - - [512, 8192, 1, 2048, 512, 512, 2048, 2048]
    - [12, 12.772]
  - - [512, 8192, 1, 4096, 512, 512, 4096, 4096]
    - [49, 12.329]
  - - [512, 8192, 1, 8192, 512, 512, 8192, 8192]
    - [9, 14.449]
  - - [1024, 128, 1, 128, 1024, 1024, 128, 128]
    - [26, 0.655]
  - - [1024, 128, 1, 256, 1024, 1024, 256, 256]
    - [80, 1.182]
  - - [1024, 128, 1, 512, 1024, 1024, 512, 512]
    - [81, 1.882]
  - - [1024, 128, 1, 1024, 1024, 1024, 1024, 1024]
    - [29, 2.795]
  - - [1024, 128, 1, 2048, 1024, 1024, 2048, 2048]
    - [76, 3.488]
  - - [1024, 128, 1, 4096, 1024, 1024, 4096, 4096]
    - [70, 4.951]
  - - [1024, 128, 1, 8192, 1024, 1024, 8192, 8192]
    - [63, 6.182]
  - - [1024, 256, 1, 128, 1024, 1024, 128, 128]
    - [73, 1.202]
  - - [1024, 256, 1, 256, 1024, 1024, 256, 256]
    - [23, 2.051]
  - - [1024, 256, 1, 512, 1024, 1024, 512, 512]
    - [23, 3.17]
  - - [1024, 256, 1, 1024, 1024, 1024, 1024, 1024]
    - [27, 4.298]
  - - [1024, 256, 1, 2048, 1024, 1024, 2048, 2048]
    - [42, 4.643]
  - - [1024, 256, 1, 4096, 1024, 1024, 4096, 4096]
    - [64, 7.078]
  - - [1024, 256, 1, 8192, 1024, 1024, 8192, 8192]
    - [46, 9.57]
  - - [1024, 512, 1, 128, 1024, 1024, 128, 128]
    - [65, 2.059]
  - - [1024, 512, 1, 256, 1024, 1024, 256, 256]
    - [65, 3.358]
  - - [1024, 512, 1, 512, 1024, 1024, 512, 512]
    - [66, 5.05]
  - - [1024, 512, 1, 1024, 1024, 1024, 1024, 1024]
    - [60, 5.844]
  - - [1024, 512, 1, 2048, 1024, 1024, 2048, 2048]
    - [69, 6.82]
  - - [1024, 512, 1, 4096, 1024, 1024, 4096, 4096]
    - [13, 8.031]
  - - [1024, 512, 1, 8192, 1024, 1024, 8192, 8192]
    - [10, 9.769]
  - - [1024, 1024, 1, 128, 1024, 1024, 128, 128]
    - [64, 3.004]
  - - [1024, 1024, 1, 256, 1024, 1024, 256, 256]
    - [15, 4.867]
  - - [1024, 1024, 1, 512, 1024, 1024, 512, 512]
    - [58, 7.068]
  - - [1024, 1024, 1, 1024, 1024, 1024, 1024, 1024]
    - [65, 7.812]
  - - [1024, 1024, 1, 2048, 1024, 1024, 2048, 2048]
    - [21, 8.89]
  - - [1024, 1024, 1, 4096, 1024, 1024, 4096, 4096]
    - [54, 9.645]
  - - [1024, 1024, 1, 8192, 1024, 1024, 8192, 8192]
    - [9, 11.071]
  - - [1024, 2048, 1, 128, 1024, 1024, 128, 128]
    - [2, 3.968]
  - - [1024, 2048, 1, 256, 1024, 1024, 256, 256]
    - [32, 5.799]
  - - [1024, 2048, 1, 512, 1024, 1024, 512, 512]
    - [7, 8.222]
  - - [1024, 2048, 1, 1024, 1024, 1024, 1024, 1024]
    - [60, 9.771]
  - - [1024, 2048, 1, 2048, 1024, 1024, 2048, 2048]
    - [19, 10.961]
  - - [1024, 2048, 1, 4096, 1024, 1024, 4096, 4096]
    - [54, 10.881]
  - - [1024, 2048, 1, 8192, 1024, 1024, 8192, 8192]
    - [44, 12.837]
  - - [1024, 4096, 1, 128, 1024, 1024, 128, 128]
    - [4, 4.631]
  - - [1024, 4096, 1, 256, 1024, 1024, 256, 256]
    - [35, 6.603]
  - - [1024, 4096, 1, 512, 1024, 1024, 512, 512]
    - [33, 9.117]
  - - [1024, 4096, 1, 1024, 1024, 1024, 1024, 1024]
    - [9, 11.008]
  - - [1024, 4096, 1, 2048, 1024, 1024, 2048, 2048]
    - [8, 13.144]
  - - [1024, 4096, 1, 4096, 1024, 1024, 4096, 4096]
    - [44, 12.638]
  - - [1024, 4096, 1, 8192, 1024, 1024, 8192, 8192]
    - [44, 14.57]
  - - [1024, 8192, 1, 128, 1024, 1024, 128, 128]
    - [60, 4.468]
  - - [1024, 8192, 1, 256, 1024, 1024, 256, 256]
    - [60, 6.777]
  - - [1024, 8192, 1, 512, 1024, 1024, 512, 512]
    - [62, 8.865]
  - - [1024, 8192, 1, 1024, 1024, 1024, 1024, 1024]
    - [44, 10.726]
  - - [1024, 8192, 1, 2048, 1024, 1024, 2048, 2048]
    - [48, 12.342]
  - - [1024, 8192, 1, 4096, 1024, 1024, 4096, 4096]
    - [48, 13.758]
  - - [1024, 8192, 1, 8192, 1024, 1024, 8192, 8192]
    - [48, 15.513]
  - - [2048, 128, 1, 128, 2048, 2048, 128, 128]
    - [23, 1.196]
  - - [2048, 128, 1, 256, 2048, 2048, 256, 256]
    - [71, 2.063]
  - - [2048, 128, 1, 512, 2048, 2048, 512, 512]
    - [23, 3.208]
  - - [2048, 128, 1, 1024, 2048, 2048, 1024, 1024]
    - [76, 4.281]
  - - [2048, 128, 1, 2048, 2048, 2048, 2048, 2048]
    - [42, 4.555]
  - - [2048, 128, 1, 4096, 2048, 2048, 4096, 4096]
    - [55, 6.727]
  - - [2048, 128, 1, 8192, 2048, 2048, 8192, 8192]
    - [45, 9.715]
  - - [2048, 256, 1, 128, 2048, 2048, 128, 128]
    - [65, 2.022]
  - - [2048, 256, 1, 256, 2048, 2048, 256, 256]
    - [65, 3.374]
  - - [2048, 256, 1, 512, 2048, 2048, 512, 512]
    - [66, 5.025]
  - - [2048, 256, 1, 1024, 2048, 2048, 1024, 1024]
    - [64, 5.814]
  - - [2048, 256, 1, 2048, 2048, 2048, 2048, 2048]
    - [70, 6.866]
  - - [2048, 256, 1, 4096, 2048, 2048, 4096, 4096]
    - [11, 8.031]
  - - [2048, 256, 1, 8192, 2048, 2048, 8192, 8192]
    - [7, 9.93]
  - - [2048, 512, 1, 128, 2048, 2048, 128, 128]
    - [60, 3.059]
  - - [2048, 512, 1, 256, 2048, 2048, 256, 256]
    - [15, 4.89]
  - - [2048, 512, 1, 512, 2048, 2048, 512, 512]
    - [64, 6.984]
  - - [2048, 512, 1, 1024, 2048, 2048, 1024, 1024]
    - [69, 7.801]
  - - [2048, 512, 1, 2048, 2048, 2048, 2048, 2048]
    - [20, 8.941]
  - - [2048, 512, 1, 4096, 2048, 2048, 4096, 4096]
    - [53, 9.627]
  - - [2048, 512, 1, 8192, 2048, 2048, 8192, 8192]
    - [6, 11.361]
  - - [2048, 1024, 1, 128, 2048, 2048, 128, 128]
    - [0, 3.892]
  - - [2048, 1024, 1, 256, 2048, 2048, 256, 256]
    - [40, 5.648]
  - - [2048, 1024, 1, 512, 2048, 2048, 512, 512]
    - [6, 8.116]
  - - [2048, 1024, 1, 1024, 2048, 2048, 1024, 1024]
    - [16, 9.767]
  - - [2048, 1024, 1, 2048, 2048, 2048, 2048, 2048]
    - [16, 10.992]
  - - [2048, 1024, 1, 4096, 2048, 2048, 4096, 4096]
    - [54, 11.55]
  - - [2048, 1024, 1, 8192, 2048, 2048, 8192, 8192]
    - [9, 12.949]
  - - [2048, 2048, 1, 128, 2048, 2048, 128, 128]
    - [3, 4.596]
  - - [2048, 2048, 1, 256, 2048, 2048, 256, 256]
    - [34, 6.504]
  - - [2048, 2048, 1, 512, 2048, 2048, 512, 512]
    - [1, 8.991]
  - - [2048, 2048, 1, 1024, 2048, 2048, 1024, 1024]
    - [12, 11.198]
  - - [2048, 2048, 1, 2048, 2048, 2048, 2048, 2048]
    - [7, 13.287]
  - - [2048, 2048, 1, 4096, 2048, 2048, 4096, 4096]
    - [44, 13.493]
  - - [2048, 2048, 1, 8192, 2048, 2048, 8192, 8192]
    - [45, 15.103]
  - - [2048, 4096, 1, 128, 2048, 2048, 128, 128]
    - [60, 4.487]
  - - [2048, 4096, 1, 256, 2048, 2048, 256, 256]
    - [58, 6.69]
  - - [2048, 4096, 1, 512, 2048, 2048, 512, 512]
    - [64, 8.445]
  - - [2048, 4096, 1, 1024, 2048, 2048, 1024, 1024]
    - [50, 10.495]
  - - [2048, 4096, 1, 2048, 2048, 2048, 2048, 2048]
    - [46, 12.38]
  - - [2048, 4096, 1, 4096, 2048, 2048, 4096, 4096]
    - [44, 14.206]
  - - [2048, 4096, 1, 8192, 2048, 2048, 8192, 8192]
    - [44, 15.79]
  - - [2048, 8192, 1, 128, 2048, 2048, 128, 128]
    - [60, 5.437]
  - - [2048, 8192, 1, 256, 2048, 2048, 256, 256]
    - [60, 7.163]
  - - [2048, 8192, 1, 512, 2048, 2048, 512, 512]
    - [37, 9.292]
  - - [2048, 8192, 1, 1024, 2048, 2048, 1024, 1024]
    - [50, 11.801]
  - - [2048, 8192, 1, 2048, 2048, 2048, 2048, 2048]
    - [50, 13.634]
  - - [2048, 8192, 1, 4096, 2048, 2048, 4096, 4096]
    - [52, 15.549]
  - - [2048, 8192, 1, 8192, 2048, 2048, 8192, 8192]
    - [50, 17.119]
  - - [4096, 128, 1, 128, 4096, 4096, 128, 128]
    - [21, 2.016]
  - - [4096, 128, 1, 256, 4096, 4096, 256, 256]
    - [22, 3.256]
  - - [4096, 128, 1, 512, 4096, 4096, 512, 512]
    - [65, 4.878]
  - - [4096, 128, 1, 1024, 4096, 4096, 1024, 1024]
    - [64, 5.381]
  - - [4096, 128, 1, 2048, 4096, 4096, 2048, 2048]
    - [68, 5.944]
  - - [4096, 128, 1, 4096, 4096, 4096, 4096, 4096]
    - [64, 7.515]
  - - [4096, 128, 1, 8192, 4096, 4096, 8192, 8192]
    - [6, 9.92]
  - - [4096, 256, 1, 128, 4096, 4096, 128, 128]
    - [60, 3.078]
  - - [4096, 256, 1, 256, 4096, 4096, 256, 256]
    - [55, 4.855]
  - - [4096, 256, 1, 512, 4096, 4096, 512, 512]
    - [63, 6.974]
  - - [4096, 256, 1, 1024, 4096, 4096, 1024, 1024]
    - [69, 7.838]
  - - [4096, 256, 1, 2048, 4096, 4096, 2048, 2048]
    - [64, 8.474]
  - - [4096, 256, 1, 4096, 4096, 4096, 4096, 4096]
    - [54, 9.821]
  - - [4096, 256, 1, 8192, 4096, 4096, 8192, 8192]
    - [7, 11.333]
  - - [4096, 512, 1, 128, 4096, 4096, 128, 128]
    - [3, 3.867]
  - - [4096, 512, 1, 256, 4096, 4096, 256, 256]
    - [36, 5.631]
  - - [4096, 512, 1, 512, 4096, 4096, 512, 512]
    - [7, 7.824]
  - - [4096, 512, 1, 1024, 4096, 4096, 1024, 1024]
    - [16, 9.599]
  - - [4096, 512, 1, 2048, 4096, 4096, 2048, 2048]
    - [17, 10.473]
  - - [4096, 512, 1, 4096, 4096, 4096, 4096, 4096]
    - [53, 11.596]
  - - [4096, 512, 1, 8192, 4096, 4096, 8192, 8192]
    - [45, 12.936]
  - - [4096, 1024, 1, 128, 4096, 4096, 128, 128]
    - [3, 4.508]
  - - [4096, 1024, 1, 256, 4096, 4096, 256, 256]
    - [37, 6.331]
  - - [4096, 1024, 1, 512, 4096, 4096, 512, 512]
    - [0, 8.972]
  - - [4096, 1024, 1, 1024, 4096, 4096, 1024, 1024]
    - [6, 11.602]
  - - [4096, 1024, 1, 2048, 4096, 4096, 2048, 2048]
    - [5, 11.85]
  - - [4096, 1024, 1, 4096, 4096, 4096, 4096, 4096]
    - [45, 13.578]
  - - [4096, 1024, 1, 8192, 4096, 4096, 8192, 8192]
    - [44, 15.118]
  - - [4096, 2048, 1, 128, 4096, 4096, 128, 128]
    - [63, 4.367]
  - - [4096, 2048, 1, 256, 4096, 4096, 256, 256]
    - [64, 6.378]
  - - [4096, 2048, 1, 512, 4096, 4096, 512, 512]
    - [64, 8.461]
  - - [4096, 2048, 1, 1024, 4096, 4096, 1024, 1024]
    - [50, 10.704]
  - - [4096, 2048, 1, 2048, 4096, 4096, 2048, 2048]
    - [44, 12.586]
  - - [4096, 2048, 1, 4096, 4096, 4096, 4096, 4096]
    - [44, 14.453]
  - - [4096, 2048, 1, 8192, 4096, 4096, 8192, 8192]
    - [45, 16.202]
  - - [4096, 4096, 1, 128, 4096, 4096, 128, 128]
    - [58, 5.269]
  - - [4096, 4096, 1, 256, 4096, 4096, 256, 256]
    - [37, 7.121]
  - - [4096, 4096, 1, 512, 4096, 4096, 512, 512]
    - [38, 9.21]
  - - [4096, 4096, 1, 1024, 4096, 4096, 1024, 1024]
    - [50, 11.873]
  - - [4096, 4096, 1, 2048, 4096, 4096, 2048, 2048]
    - [52, 13.582]
  - - [4096, 4096, 1, 4096, 4096, 4096, 4096, 4096]
    - [50, 15.811]
  - - [4096, 4096, 1, 8192, 4096, 4096, 8192, 8192]
    - [50, 16.914]
  - - [4096, 8192, 1, 128, 4096, 4096, 128, 128]
    - [18, 4.861]
  - - [4096, 8192, 1, 256, 4096, 4096, 256, 256]
    - [63, 6.73]
  - - [4096, 8192, 1, 512, 4096, 4096, 512, 512]
    - [52, 9.246]
  - - [4096, 8192, 1, 1024, 4096, 4096, 1024, 1024]
    - [6, 12.031]
  - - [4096, 8192, 1, 2048, 4096, 4096, 2048, 2048]
    - [52, 13.23]
  - - [4096, 8192, 1, 4096, 4096, 4096, 4096, 4096]
    - [50, 15.853]
  - - [4096, 8192, 1, 8192, 4096, 4096, 8192, 8192]
    - [50, 17.339]
  - - [8192, 128, 1, 128, 8192, 8192, 128, 128]
    - [58, 3.035]
  - - [8192, 128, 1, 256, 8192, 8192, 256, 256]
    - [54, 4.781]
  - - [8192, 128, 1, 512, 8192, 8192, 512, 512]
    - [54, 6.897]
  - - [8192, 128, 1, 1024, 8192, 8192, 1024, 1024]
    - [69, 6.628]
  - - [8192, 128, 1, 2048, 8192, 8192, 2048, 2048]
    - [53, 7.863]
  - - [8192, 128, 1, 4096, 8192, 8192, 4096, 4096]
    - [14, 9.893]
  - - [8192, 128, 1, 8192, 8192, 8192, 8192, 8192]
    - [6, 11.325]
  - - [8192, 256, 1, 128, 8192, 8192, 128, 128]
    - [0, 3.799]
  - - [8192, 256, 1, 256, 8192, 8192, 256, 256]
    - [36, 5.66]
  - - [8192, 256, 1, 512, 8192, 8192, 512, 512]
    - [6, 7.464]
  - - [8192, 256, 1, 1024, 8192, 8192, 1024, 1024]
    - [16, 8.935]
  - - [8192, 256, 1, 2048, 8192, 8192, 2048, 2048]
    - [56, 9.985]
  - - [8192, 256, 1, 4096, 8192, 8192, 4096, 4096]
    - [54, 11.726]
  - - [8192, 256, 1, 8192, 8192, 8192, 8192, 8192]
    - [6, 13.353]
  - - [8192, 512, 1, 128, 8192, 8192, 128, 128]
    - [3, 4.446]
  - - [8192, 512, 1, 256, 8192, 8192, 256, 256]
    - [36, 6.314]
  - - [8192, 512, 1, 512, 8192, 8192, 512, 512]
    - [0, 8.374]
  - - [8192, 512, 1, 1024, 8192, 8192, 1024, 1024]
    - [7, 10.828]
  - - [8192, 512, 1, 2048, 8192, 8192, 2048, 2048]
    - [52, 11.084]
  - - [8192, 512, 1, 4096, 8192, 8192, 4096, 4096]
    - [45, 13.522]
  - - [8192, 512, 1, 8192, 8192, 8192, 8192, 8192]
    - [46, 15.274]
  - - [8192, 1024, 1, 128, 8192, 8192, 128, 128]
    - [64, 4.301]
  - - [8192, 1024, 1, 256, 8192, 8192, 256, 256]
    - [63, 6.296]
  - - [8192, 1024, 1, 512, 8192, 8192, 512, 512]
    - [63, 8.431]
  - - [8192, 1024, 1, 1024, 8192, 8192, 1024, 1024]
    - [50, 10.728]
  - - [8192, 1024, 1, 2048, 8192, 8192, 2048, 2048]
    - [46, 12.605]
  - - [8192, 1024, 1, 4096, 8192, 8192, 4096, 4096]
    - [44, 14.381]
  - - [8192, 1024, 1, 8192, 8192, 8192, 8192, 8192]
    - [44, 16.31]
  - - [8192, 2048, 1, 128, 8192, 8192, 128, 128]
    - [38, 5.176]
  - - [8192, 2048, 1, 256, 8192, 8192, 256, 256]
    - [37, 6.994]
  - - [8192, 2048, 1, 512, 8192, 8192, 512, 512]
    - [37, 9.334]
  - - [8192, 2048, 1, 1024, 8192, 8192, 1024, 1024]
    - [50, 11.876]
  - - [8192, 2048, 1, 2048, 8192, 8192, 2048, 2048]
    - [50, 13.62]
  - - [8192, 2048, 1, 4096, 8192, 8192, 4096, 4096]
    - [50, 15.483]
  - - [8192, 2048, 1, 8192, 8192, 8192, 8192, 8192]
    - [50, 17.13]
  - - [8192, 4096, 1, 128, 8192, 8192, 128, 128]
    - [18, 4.717]
  - - [8192, 4096, 1, 256, 8192, 8192, 256, 256]
    - [63, 6.663]
  - - [8192, 4096, 1, 512, 8192, 8192, 512, 512]
    - [50, 9.245]
  - - [8192, 4096, 1, 1024, 8192, 8192, 1024, 1024]
    - [6, 11.723]
  - - [8192, 4096, 1, 2048, 8192, 8192, 2048, 2048]
    - [50, 13.093]
  - - [8192, 4096, 1, 4096, 8192, 8192, 4096, 4096]
    - [50, 15.78]
  - - [8192, 4096, 1, 8192, 8192, 8192, 8192, 8192]
    - [50, 16.933]
  - - [8192, 8192, 1, 128, 8192, 8192, 128, 128]
    - [18, 4.524]
  - - [8192, 8192, 1, 256, 8192, 8192, 256, 256]
    - [50, 6.618]
  - - [8192, 8192, 1, 512, 8192, 8192, 512, 512]
    - [50, 9.667]
  - - [8192, 8192, 1, 1024, 8192, 8192, 1024, 1024]
    - [6, 11.754]
  - - [8192, 8192, 1, 2048, 8192, 8192, 2048, 2048]
    - [50, 13.063]
  - - [8192, 8192, 1, 4096, 8192, 8192, 4096, 4096]
    - [50, 16.242]
  - - [8192, 8192, 1, 8192, 8192, 8192, 8192, 8192]
    - [51, 16.254]
  - - [1, 1, 1, 32, 1, 1, 32, 32]
    - [84, 0.0]
- null
- null
- DeviceEfficiency
- GridBased
