library/src/amd_detail/rocblaslt/src/Tensile/Logic/streamk/gfx942_80cu/aquavanjaram942_Cijk_Alik_Bljk_HSS_BH_UserArgs.yaml
- {MinimumRequiredVersion: 4.33.0}
- aquavanjaram942
- {Architecture: gfx942, CUCount: 80}
- [Device 0049, Device 0050]
    SolutionIndex: 0
    SolutionNameMin: Cijk_Alik_Bljk_HSS_BH_UserArgs_MT256x256x32_MI16x16x1_SN_LDSB1_CLR1_GSU0_GSUC0_GSUWGMRR0_K1_LBSPPA256_LBSPPB128_MIWT8_8_PLR1_SU32_SUM0_SUS256_USFGRO0_VWA4_VWB1_WGM1_WGMXCC1_WGMXCCGn1
    SolutionIndex: 1
    SolutionNameMin: Cijk_Alik_Bljk_HSS_BH_UserArgs_MT256x256x32_MI16x16x1_SN_LDSB1_CLR1_GSU0_GSUC0_GSUWGMRR0_K1_LBSPPA256_LBSPPB128_MIWT8_8_PLR1_SU32_SUM0_SUS256_USFGRO0_VWA4_VWB2_WGM1_WGMXCC1_WGMXCCGn1
    SolutionIndex: 2
    SolutionNameMin: Cijk_Alik_Bljk_HSS_BH_UserArgs_MT256x256x32_MI16x16x1_SN_LDSB1_CLR1_GSU0_GSUC0_GSUWGMRR0_K1_LBSPPA256_LBSPPB512_MIWT8_8_PLR1_SU32_SUM0_SUS256_USFGRO0_VWA4_VWB8_WGM1_WGMXCC1_WGMXCCGn1
    SolutionIndex: 3
    SolutionNameMin: Cijk_Alik_Bljk_HSS_BH_UserArgs_MT256x256x32_MI16x16x1_SN_LDSB1_CLR1_GSU0_GSUC0_GSUWGMRR0_K1_LBSPPA256_LBSPPB128_MIWT8_8_PLR1_SU32_SUM0_SUS256_USFGRO0_VWA4_VWB2_WGM2_WGMXCC1_WGMXCCGn1
    SolutionIndex: 4
    SolutionNameMin: Cijk_Alik_Bljk_HSS_BH_UserArgs_MT256x256x32_MI16x16x1_SN_LDSB1_CLR1_GSU0_GSUC0_GSUWGMRR0_K1_LBSPPA256_LBSPPB256_MIWT8_8_PLR1_SU32_SUM0_SUS256_USFGRO0_VWA4_VWB4_WGM2_WGMXCC1_WGMXCCGn1
    SolutionIndex: 5
    SolutionNameMin: Cijk_Alik_Bljk_HSS_BH_UserArgs_MT256x256x32_MI16x16x1_SN_LDSB1_CLR1_GSU0_GSUC0_GSUWGMRR0_K1_LBSPPA256_LBSPPB512_MIWT8_8_PLR1_SU32_SUM0_SUS256_USFGRO0_VWA4_VWB8_WGM2_WGMXCC1_WGMXCCGn1
    SolutionIndex: 6
    SolutionNameMin: Cijk_Alik_Bljk_HSS_BH_UserArgs_MT256x256x32_MI16x16x1_SN_LDSB1_CLR1_GSU0_GSUC0_GSUWGMRR0_K1_LBSPPA256_LBSPPB128_MIWT8_8_PLR1_SU32_SUM0_SUS256_USFGRO0_VWA4_VWB1_WGM4_WGMXCC1_WGMXCCGn1
    SolutionIndex: 7
    SolutionNameMin: Cijk_Alik_Bljk_HSS_BH_UserArgs_MT256x256x32_MI16x16x1_SN_LDSB1_CLR1_GSU0_GSUC0_GSUWGMRR0_K1_LBSPPA256_LBSPPB128_MIWT8_8_PLR1_SU32_SUM0_SUS256_USFGRO0_VWA4_VWB2_WGM4_WGMXCC1_WGMXCCGn1
    SolutionIndex: 8
    SolutionNameMin: Cijk_Alik_Bljk_HSS_BH_UserArgs_MT256x256x32_MI16x16x1_SN_LDSB1_CLR1_GSU0_GSUC0_GSUWGMRR0_K1_LBSPPA256_LBSPPB256_MIWT8_8_PLR1_SU32_SUM0_SUS256_USFGRO0_VWA4_VWB4_WGM4_WGMXCC1_WGMXCCGn1
    SolutionIndex: 9
    SolutionNameMin: Cijk_Alik_Bljk_HSS_BH_UserArgs_MT256x256x32_MI16x16x1_SN_LDSB1_CLR1_GSU0_GSUC0_GSUWGMRR0_K1_LBSPPA256_LBSPPB512_MIWT8_8_PLR1_SU32_SUM0_SUS256_USFGRO0_VWA4_VWB8_WGM4_WGMXCC1_WGMXCCGn1
    SolutionIndex: 10
    SolutionNameMin: Cijk_Alik_Bljk_HSS_BH_UserArgs_MT128x256x32_MI16x16x1_SN_LDSB1_CLR1_GSU0_GSUC0_GSUWGMRR0_K1_LBSPPA256_LBSPPB256_MIWT4_8_PLR1_SU32_SUM0_SUS256_USFGRO0_VWA4_VWB4_WGM1_WGMXCC1_WGMXCCGn1
    SolutionIndex: 11
    SolutionNameMin: Cijk_Alik_Bljk_HSS_BH_UserArgs_MT128x256x32_MI16x16x1_SN_LDSB1_CLR1_GSU0_GSUC0_GSUWGMRR0_K1_LBSPPA256_LBSPPB128_MIWT4_8_PLR1_SU32_SUM0_SUS256_USFGRO0_VWA4_VWB2_WGM2_WGMXCC1_WGMXCCGn1
    SolutionIndex: 12
    SolutionNameMin: Cijk_Alik_Bljk_HSS_BH_UserArgs_MT256x128x32_MI16x16x1_SN_LDSB1_CLR1_GSU0_GSUC0_GSUWGMRR0_K1_LBSPPA256_LBSPPB128_MIWT8_4_PLR1_SU32_SUM0_SUS256_USFGRO0_VWA4_VWB1_WGM1_WGMXCC1_WGMXCCGn1
    SolutionIndex: 13
    SolutionNameMin: Cijk_Alik_Bljk_HSS_BH_UserArgs_MT256x128x32_MI16x16x1_SN_LDSB1_CLR1_GSU0_GSUC0_GSUWGMRR0_K1_LBSPPA256_LBSPPB128_MIWT8_4_PLR1_SU32_SUM0_SUS256_USFGRO0_VWA4_VWB2_WGM1_WGMXCC1_WGMXCCGn1
    SolutionIndex: 14
    SolutionNameMin: Cijk_Alik_Bljk_HSS_BH_UserArgs_MT256x128x32_MI16x16x1_SN_LDSB1_CLR1_GSU0_GSUC0_GSUWGMRR0_K1_LBSPPA256_LBSPPB256_MIWT8_4_PLR1_SU32_SUM0_SUS256_USFGRO0_VWA4_VWB4_WGM1_WGMXCC1_WGMXCCGn1
    SolutionIndex: 15
    SolutionNameMin: Cijk_Alik_Bljk_HSS_BH_UserArgs_MT256x128x32_MI16x16x1_SN_LDSB1_CLR1_GSU0_GSUC0_GSUWGMRR0_K1_LBSPPA256_LBSPPB128_MIWT8_4_PLR1_SU32_SUM0_SUS256_USFGRO0_VWA4_VWB2_WGM2_WGMXCC1_WGMXCCGn1
    SolutionIndex: 16
    SolutionNameMin: Cijk_Alik_Bljk_HSS_BH_UserArgs_MT256x128x32_MI16x16x1_SN_LDSB1_CLR1_GSU0_GSUC0_GSUWGMRR0_K1_LBSPPA256_LBSPPB256_MIWT8_4_PLR1_SU32_SUM0_SUS256_USFGRO0_VWA4_VWB4_WGM2_WGMXCC1_WGMXCCGn1
    SolutionIndex: 17
    SolutionNameMin: Cijk_Alik_Bljk_HSS_BH_UserArgs_MT256x128x32_MI16x16x1_SN_LDSB1_CLR1_GSU0_GSUC0_GSUWGMRR0_K1_LBSPPA256_LBSPPB128_MIWT8_4_PLR1_SU32_SUM0_SUS256_USFGRO0_VWA4_VWB1_WGM4_WGMXCC1_WGMXCCGn1
    SolutionIndex: 18
    SolutionNameMin: Cijk_Alik_Bljk_HSS_BH_UserArgs_MT256x128x32_MI16x16x1_SN_LDSB1_CLR1_GSU0_GSUC0_GSUWGMRR0_K1_LBSPPA256_LBSPPB128_MIWT8_4_PLR1_SU32_SUM0_SUS256_USFGRO0_VWA4_VWB2_WGM4_WGMXCC1_WGMXCCGn1
    SolutionIndex: 19
    SolutionNameMin: Cijk_Alik_Bljk_HSS_BH_UserArgs_MT256x128x32_MI16x16x1_SN_LDSB1_CLR1_GSU0_GSUC0_GSUWGMRR0_K1_LBSPPA256_LBSPPB256_MIWT8_4_PLR1_SU32_SUM0_SUS256_USFGRO0_VWA4_VWB4_WGM4_WGMXCC1_WGMXCCGn1
    SolutionIndex: 20
    SolutionNameMin: Cijk_Alik_Bljk_HSS_BH_UserArgs_MT128x256x64_MI16x16x1_SN_LDSB1_CLR1_GSU0_GSUC0_GSUWGMRR0_K1_LBSPPA512_LBSPPB128_MIWT4_8_PLR1_SU32_SUM0_SUS256_USFGRO0_VWA4_VWB1_WGM1_WGMXCC1_WGMXCCGn1
    SolutionIndex: 21
    SolutionNameMin: Cijk_Alik_Bljk_HSS_BH_UserArgs_MT128x256x64_MI16x16x1_SN_LDSB1_CLR1_GSU0_GSUC0_GSUWGMRR0_K1_LBSPPA512_LBSPPB256_MIWT4_8_PLR1_SU32_SUM0_SUS256_USFGRO0_VWA4_VWB2_WGM1_WGMXCC1_WGMXCCGn1
    SolutionIndex: 22
    SolutionNameMin: Cijk_Alik_Bljk_HSS_BH_UserArgs_MT128x256x64_MI16x16x1_SN_LDSB1_CLR1_GSU0_GSUC0_GSUWGMRR0_K1_LBSPPA512_LBSPPB512_MIWT4_8_PLR1_SU32_SUM0_SUS256_USFGRO0_VWA4_VWB4_WGM1_WGMXCC1_WGMXCCGn1
    SolutionIndex: 23
    SolutionNameMin: Cijk_Alik_Bljk_HSS_BH_UserArgs_MT128x256x64_MI16x16x1_SN_LDSB1_CLR1_GSU0_GSUC0_GSUWGMRR0_K1_LBSPPA512_LBSPPB1024_MIWT4_8_PLR1_SU32_SUM0_SUS256_USFGRO0_VWA4_VWB8_WGM1_WGMXCC1_WGMXCCGn1
    SolutionIndex: 24
    SolutionNameMin: Cijk_Alik_Bljk_HSS_BH_UserArgs_MT128x256x64_MI16x16x1_SN_LDSB1_CLR1_GSU0_GSUC0_GSUWGMRR0_K1_LBSPPA512_LBSPPB128_MIWT4_8_PLR1_SU32_SUM0_SUS256_USFGRO0_VWA4_VWB1_WGM2_WGMXCC1_WGMXCCGn1
    SolutionIndex: 25
    SolutionNameMin: Cijk_Alik_Bljk_HSS_BH_UserArgs_MT128x256x64_MI16x16x1_SN_LDSB1_CLR1_GSU0_GSUC0_GSUWGMRR0_K1_LBSPPA512_LBSPPB256_MIWT4_8_PLR1_SU32_SUM0_SUS256_USFGRO0_VWA4_VWB2_WGM2_WGMXCC1_WGMXCCGn1
    SolutionIndex: 26
    SolutionNameMin: Cijk_Alik_Bljk_HSS_BH_UserArgs_MT128x256x64_MI16x16x1_SN_LDSB1_CLR1_GSU0_GSUC0_GSUWGMRR0_K1_LBSPPA512_LBSPPB512_MIWT4_8_PLR1_SU32_SUM0_SUS256_USFGRO0_VWA4_VWB4_WGM2_WGMXCC1_WGMXCCGn1
    SolutionIndex: 27
    SolutionNameMin: Cijk_Alik_Bljk_HSS_BH_UserArgs_MT128x256x64_MI16x16x1_SN_LDSB1_CLR1_GSU0_GSUC0_GSUWGMRR0_K1_LBSPPA512_LBSPPB1024_MIWT4_8_PLR1_SU32_SUM0_SUS256_USFGRO0_VWA4_VWB8_WGM2_WGMXCC1_WGMXCCGn1
    SolutionIndex: 28
    SolutionNameMin: Cijk_Alik_Bljk_HSS_BH_UserArgs_MT128x256x64_MI16x16x1_SN_LDSB1_CLR1_GSU0_GSUC0_GSUWGMRR0_K1_LBSPPA512_LBSPPB128_MIWT4_8_PLR1_SU32_SUM0_SUS256_USFGRO0_VWA4_VWB1_WGM4_WGMXCC1_WGMXCCGn1
    SolutionIndex: 29
    SolutionNameMin: Cijk_Alik_Bljk_HSS_BH_UserArgs_MT128x256x64_MI16x16x1_SN_LDSB1_CLR1_GSU0_GSUC0_GSUWGMRR0_K1_LBSPPA512_LBSPPB256_MIWT4_8_PLR1_SU32_SUM0_SUS256_USFGRO0_VWA4_VWB2_WGM4_WGMXCC1_WGMXCCGn1
    SolutionIndex: 30
    SolutionNameMin: Cijk_Alik_Bljk_HSS_BH_UserArgs_MT128x256x64_MI16x16x1_SN_LDSB1_CLR1_GSU0_GSUC0_GSUWGMRR0_K1_LBSPPA512_LBSPPB512_MIWT4_8_PLR1_SU32_SUM0_SUS256_USFGRO0_VWA4_VWB4_WGM4_WGMXCC1_WGMXCCGn1
    SolutionIndex: 31
    SolutionNameMin: Cijk_Alik_Bljk_HSS_BH_UserArgs_MT128x256x64_MI16x16x1_SN_LDSB1_CLR1_GSU0_GSUC0_GSUWGMRR0_K1_LBSPPA128_LBSPPB1024_MIWT4_8_PLR1_SU32_SUM0_SUS256_USFGRO0_VWA1_VWB8_WGM4_WGMXCC1_WGMXCCGn1
    SolutionIndex: 32
    SolutionNameMin: Cijk_Alik_Bljk_HSS_BH_UserArgs_MT128x256x64_MI16x16x1_SN_LDSB1_CLR1_GSU0_GSUC0_GSUWGMRR0_K1_LBSPPA512_LBSPPB1024_MIWT4_8_PLR1_SU32_SUM0_SUS256_USFGRO0_VWA4_VWB8_WGM4_WGMXCC1_WGMXCCGn1
    SolutionIndex: 33
    SolutionNameMin: Cijk_Alik_Bljk_HSS_BH_UserArgs_MT256x128x64_MI16x16x1_SN_LDSB1_CLR1_GSU0_GSUC0_GSUWGMRR0_K1_LBSPPA512_LBSPPB128_MIWT8_4_PLR1_SU32_SUM0_SUS256_USFGRO0_VWA4_VWB1_WGM1_WGMXCC1_WGMXCCGn1
    SolutionIndex: 34
    SolutionNameMin: Cijk_Alik_Bljk_HSS_BH_UserArgs_MT256x128x64_MI16x16x1_SN_LDSB1_CLR1_GSU0_GSUC0_GSUWGMRR0_K1_LBSPPA512_LBSPPB256_MIWT8_4_PLR1_SU32_SUM0_SUS256_USFGRO0_VWA4_VWB2_WGM1_WGMXCC1_WGMXCCGn1
    SolutionIndex: 35
    SolutionNameMin: Cijk_Alik_Bljk_HSS_BH_UserArgs_MT256x128x64_MI16x16x1_SN_LDSB1_CLR1_GSU0_GSUC0_GSUWGMRR0_K1_LBSPPA512_LBSPPB512_MIWT8_4_PLR1_SU32_SUM0_SUS256_USFGRO0_VWA4_VWB4_WGM1_WGMXCC1_WGMXCCGn1
    SolutionIndex: 36
    SolutionNameMin: Cijk_Alik_Bljk_HSS_BH_UserArgs_MT256x128x64_MI16x16x1_SN_LDSB1_CLR1_GSU0_GSUC0_GSUWGMRR0_K1_LBSPPA512_LBSPPB128_MIWT8_4_PLR1_SU32_SUM0_SUS256_USFGRO0_VWA4_VWB1_WGM2_WGMXCC1_WGMXCCGn1
    SolutionIndex: 37
    SolutionNameMin: Cijk_Alik_Bljk_HSS_BH_UserArgs_MT256x128x64_MI16x16x1_SN_LDSB1_CLR1_GSU0_GSUC0_GSUWGMRR0_K1_LBSPPA512_LBSPPB256_MIWT8_4_PLR1_SU32_SUM0_SUS256_USFGRO0_VWA4_VWB2_WGM2_WGMXCC1_WGMXCCGn1
    SolutionIndex: 38
    SolutionNameMin: Cijk_Alik_Bljk_HSS_BH_UserArgs_MT256x128x64_MI16x16x1_SN_LDSB1_CLR1_GSU0_GSUC0_GSUWGMRR0_K1_LBSPPA512_LBSPPB512_MIWT8_4_PLR1_SU32_SUM0_SUS256_USFGRO0_VWA4_VWB4_WGM2_WGMXCC1_WGMXCCGn1
    SolutionIndex: 39
    SolutionNameMin: Cijk_Alik_Bljk_HSS_BH_UserArgs_MT256x128x64_MI16x16x1_SN_LDSB1_CLR1_GSU0_GSUC0_GSUWGMRR0_K1_LBSPPA128_LBSPPB128_MIWT8_4_PLR1_SU32_SUM0_SUS256_USFGRO0_VWA1_VWB1_WGM4_WGMXCC1_WGMXCCGn1
    SolutionIndex: 40
    SolutionNameMin: Cijk_Alik_Bljk_HSS_BH_UserArgs_MT256x128x64_MI16x16x1_SN_LDSB1_CLR1_GSU0_GSUC0_GSUWGMRR0_K1_LBSPPA512_LBSPPB128_MIWT8_4_PLR1_SU32_SUM0_SUS256_USFGRO0_VWA4_VWB1_WGM4_WGMXCC1_WGMXCCGn1
    SolutionIndex: 41
    SolutionNameMin: Cijk_Alik_Bljk_HSS_BH_UserArgs_MT256x128x64_MI16x16x1_SN_LDSB1_CLR1_GSU0_GSUC0_GSUWGMRR0_K1_LBSPPA128_LBSPPB256_MIWT8_4_PLR1_SU32_SUM0_SUS256_USFGRO0_VWA1_VWB2_WGM4_WGMXCC1_WGMXCCGn1
    SolutionIndex: 42
    SolutionNameMin: Cijk_Alik_Bljk_HSS_BH_UserArgs_MT256x128x64_MI16x16x1_SN_LDSB1_CLR1_GSU0_GSUC0_GSUWGMRR0_K1_LBSPPA512_LBSPPB256_MIWT8_4_PLR1_SU32_SUM0_SUS256_USFGRO0_VWA4_VWB2_WGM4_WGMXCC1_WGMXCCGn1
    SolutionIndex: 43
    SolutionNameMin: Cijk_Alik_Bljk_HSS_BH_UserArgs_MT256x128x64_MI16x16x1_SN_LDSB1_CLR1_GSU0_GSUC0_GSUWGMRR0_K1_LBSPPA512_LBSPPB512_MIWT8_4_PLR1_SU32_SUM0_SUS256_USFGRO0_VWA4_VWB4_WGM4_WGMXCC1_WGMXCCGn1
    SolutionIndex: 44
    SolutionNameMin: Cijk_Alik_Bljk_HSS_BH_UserArgs_MT128x128x64_MI16x16x1_SN_LDSB1_CLR1_GSU0_GSUC0_GSUWGMRR0_K1_LBSPPA512_LBSPPB128_MIWT4_4_PLR1_SU32_SUM0_SUS256_USFGRO0_VWA4_VWB1_WGM1_WGMXCC1_WGMXCCGn1
    SolutionIndex: 45
    SolutionNameMin: Cijk_Alik_Bljk_HSS_BH_UserArgs_MT128x128x64_MI16x16x1_SN_LDSB1_CLR1_GSU0_GSUC0_GSUWGMRR0_K1_LBSPPA512_LBSPPB512_MIWT4_4_PLR1_SU32_SUM0_SUS256_USFGRO0_VWA4_VWB4_WGM1_WGMXCC1_WGMXCCGn1
    SolutionIndex: 46
    SolutionNameMin: Cijk_Alik_Bljk_HSS_BH_UserArgs_MT128x128x64_MI16x16x1_SN_LDSB1_CLR1_GSU0_GSUC0_GSUWGMRR0_K1_LBSPPA512_LBSPPB256_MIWT4_4_PLR2_SU32_SUM0_SUS256_USFGRO0_VWA4_VWB2_WGM1_WGMXCC1_WGMXCCGn1
    SolutionIndex: 47
    SolutionNameMin: Cijk_Alik_Bljk_HSS_BH_UserArgs_MT128x128x64_MI16x16x1_SN_LDSB1_CLR1_GSU0_GSUC0_GSUWGMRR0_K1_LBSPPA512_LBSPPB512_MIWT4_4_PLR2_SU32_SUM0_SUS256_USFGRO0_VWA4_VWB4_WGM1_WGMXCC1_WGMXCCGn1
    SolutionIndex: 48
    SolutionNameMin: Cijk_Alik_Bljk_HSS_BH_UserArgs_MT128x128x64_MI16x16x1_SN_LDSB1_CLR1_GSU0_GSUC0_GSUWGMRR0_K1_LBSPPA128_LBSPPB128_MIWT4_4_PLR1_SU32_SUM0_SUS256_USFGRO1_VWA1_VWB1_WGM1_WGMXCC1_WGMXCCGn1
    SolutionIndex: 49
    SolutionNameMin: Cijk_Alik_Bljk_HSS_BH_UserArgs_MT128x128x64_MI16x16x1_SN_LDSB1_CLR1_GSU0_GSUC0_GSUWGMRR0_K1_LBSPPA512_LBSPPB128_MIWT4_4_PLR1_SU32_SUM0_SUS256_USFGRO1_VWA4_VWB1_WGM1_WGMXCC1_WGMXCCGn1
    SolutionIndex: 50
    SolutionNameMin: Cijk_Alik_Bljk_HSS_BH_UserArgs_MT128x128x64_MI16x16x1_SN_LDSB1_CLR1_GSU0_GSUC0_GSUWGMRR0_K1_LBSPPA128_LBSPPB256_MIWT4_4_PLR1_SU32_SUM0_SUS256_USFGRO1_VWA1_VWB2_WGM1_WGMXCC1_WGMXCCGn1
    SolutionIndex: 51
    SolutionNameMin: Cijk_Alik_Bljk_HSS_BH_UserArgs_MT128x128x64_MI16x16x1_SN_LDSB1_CLR1_GSU0_GSUC0_GSUWGMRR0_K1_LBSPPA512_LBSPPB256_MIWT4_4_PLR1_SU32_SUM0_SUS256_USFGRO1_VWA4_VWB2_WGM1_WGMXCC1_WGMXCCGn1
    SolutionIndex: 52
    SolutionNameMin: Cijk_Alik_Bljk_HSS_BH_UserArgs_MT128x128x64_MI16x16x1_SN_LDSB1_CLR1_GSU0_GSUC0_GSUWGMRR0_K1_LBSPPA128_LBSPPB512_MIWT4_4_PLR1_SU32_SUM0_SUS256_USFGRO1_VWA1_VWB4_WGM1_WGMXCC1_WGMXCCGn1
    SolutionIndex: 53
    SolutionNameMin: Cijk_Alik_Bljk_HSS_BH_UserArgs_MT128x128x64_MI16x16x1_SN_LDSB1_CLR1_GSU0_GSUC0_GSUWGMRR0_K1_LBSPPA512_LBSPPB512_MIWT4_4_PLR1_SU32_SUM0_SUS256_USFGRO1_VWA4_VWB4_WGM1_WGMXCC1_WGMXCCGn1
    SolutionIndex: 54
    SolutionNameMin: Cijk_Alik_Bljk_HSS_BH_UserArgs_MT128x128x64_MI16x16x1_SN_LDSB1_CLR1_GSU0_GSUC0_GSUWGMRR0_K1_LBSPPA512_LBSPPB512_MIWT4_4_PLR2_SU32_SUM0_SUS256_USFGRO1_VWA4_VWB4_WGM1_WGMXCC1_WGMXCCGn1
    SolutionIndex: 55
    SolutionNameMin: Cijk_Alik_Bljk_HSS_BH_UserArgs_MT128x128x64_MI16x16x1_SN_LDSB1_CLR1_GSU0_GSUC0_GSUWGMRR0_K1_LBSPPA128_LBSPPB128_MIWT4_4_PLR1_SU32_SUM0_SUS256_USFGRO0_VWA1_VWB1_WGM2_WGMXCC1_WGMXCCGn1
    SolutionIndex: 56
    SolutionNameMin: Cijk_Alik_Bljk_HSS_BH_UserArgs_MT128x128x64_MI16x16x1_SN_LDSB1_CLR1_GSU0_GSUC0_GSUWGMRR0_K1_LBSPPA512_LBSPPB128_MIWT4_4_PLR1_SU32_SUM0_SUS256_USFGRO0_VWA4_VWB1_WGM2_WGMXCC1_WGMXCCGn1
    SolutionIndex: 57
    SolutionNameMin: Cijk_Alik_Bljk_HSS_BH_UserArgs_MT128x128x64_MI16x16x1_SN_LDSB1_CLR1_GSU0_GSUC0_GSUWGMRR0_K1_LBSPPA512_LBSPPB128_MIWT4_4_PLR1_SU32_SUM0_SUS256_USFGRO1_VWA4_VWB1_WGM2_WGMXCC1_WGMXCCGn1
    SolutionIndex: 58
    SolutionNameMin: Cijk_Alik_Bljk_HSS_BH_UserArgs_MT128x128x64_MI16x16x1_SN_LDSB1_CLR1_GSU0_GSUC0_GSUWGMRR0_K1_LBSPPA512_LBSPPB128_MIWT4_4_PLR1_SU32_SUM0_SUS256_USFGRO0_VWA4_VWB1_WGM4_WGMXCC1_WGMXCCGn1
    SolutionIndex: 59
    SolutionNameMin: Cijk_Alik_Bljk_HSS_BH_UserArgs_MT128x128x64_MI16x16x1_SN_LDSB1_CLR1_GSU0_GSUC0_GSUWGMRR0_K1_LBSPPA512_LBSPPB512_MIWT4_4_PLR1_SU32_SUM0_SUS256_USFGRO0_VWA4_VWB4_WGM4_WGMXCC1_WGMXCCGn1
    SolutionIndex: 60
    SolutionNameMin: Cijk_Alik_Bljk_HSS_BH_UserArgs_MT128x128x64_MI16x16x1_SN_LDSB1_CLR1_GSU0_GSUC0_GSUWGMRR0_K1_LBSPPA512_LBSPPB512_MIWT4_4_PLR2_SU32_SUM0_SUS256_USFGRO0_VWA4_VWB4_WGM4_WGMXCC1_WGMXCCGn1
    SolutionIndex: 61
    SolutionNameMin: Cijk_Alik_Bljk_HSS_BH_UserArgs_MT128x128x64_MI16x16x1_SN_LDSB1_CLR1_GSU0_GSUC0_GSUWGMRR0_K1_LBSPPA512_LBSPPB128_MIWT4_4_PLR1_SU32_SUM0_SUS256_USFGRO1_VWA4_VWB1_WGM4_WGMXCC1_WGMXCCGn1
    SolutionIndex: 62
    SolutionNameMin: Cijk_Alik_Bljk_HSS_BH_UserArgs_MT128x128x64_MI16x16x1_SN_LDSB1_CLR1_GSU0_GSUC0_GSUWGMRR0_K1_LBSPPA512_LBSPPB256_MIWT4_4_PLR1_SU32_SUM0_SUS256_USFGRO1_VWA4_VWB2_WGM4_WGMXCC1_WGMXCCGn1
    SolutionIndex: 63
    SolutionNameMin: Cijk_Alik_Bljk_HSS_BH_UserArgs_MT128x128x64_MI16x16x1_SN_LDSB1_CLR1_GSU0_GSUC0_GSUWGMRR0_K1_LBSPPA512_LBSPPB512_MIWT4_4_PLR1_SU32_SUM0_SUS256_USFGRO1_VWA4_VWB4_WGM4_WGMXCC1_WGMXCCGn1
    SolutionIndex: 64
    SolutionNameMin: Cijk_Alik_Bljk_HSS_BH_UserArgs_MT64x128x64_MI16x16x1_SN_LDSB1_CLR1_GSU0_GSUC0_GSUWGMRR0_K1_LBSPPA128_LBSPPB256_MIWT2_4_PLR1_SU32_SUM0_SUS256_USFGRO1_VWA1_VWB2_WGM1_WGMXCC1_WGMXCCGn1
    SolutionIndex: 65
    SolutionNameMin: Cijk_Alik_Bljk_HSS_BH_UserArgs_MT128x64x64_MI16x16x1_SN_LDSB1_CLR1_GSU0_GSUC0_GSUWGMRR0_K1_LBSPPA512_LBSPPB128_MIWT4_2_PLR1_SU32_SUM0_SUS256_USFGRO0_VWA4_VWB1_WGM1_WGMXCC1_WGMXCCGn1
    SolutionIndex: 66
    SolutionNameMin: Cijk_Alik_Bljk_HSS_BH_UserArgs_MT128x64x64_MI16x16x1_SN_LDSB1_CLR1_GSU0_GSUC0_GSUWGMRR0_K1_LBSPPA512_LBSPPB256_MIWT4_2_PLR1_SU32_SUM0_SUS256_USFGRO0_VWA4_VWB2_WGM1_WGMXCC1_WGMXCCGn1
    SolutionIndex: 67
    SolutionNameMin: Cijk_Alik_Bljk_HSS_BH_UserArgs_MT128x64x64_MI16x16x1_SN_LDSB1_CLR1_GSU0_GSUC0_GSUWGMRR0_K1_LBSPPA512_LBSPPB128_MIWT4_2_PLR1_SU32_SUM0_SUS256_USFGRO1_VWA4_VWB1_WGM1_WGMXCC1_WGMXCCGn1
    SolutionIndex: 68
    SolutionNameMin: Cijk_Alik_Bljk_HSS_BH_UserArgs_MT128x64x64_MI16x16x1_SN_LDSB1_CLR1_GSU0_GSUC0_GSUWGMRR0_K1_LBSPPA512_LBSPPB256_MIWT4_2_PLR1_SU32_SUM0_SUS256_USFGRO1_VWA4_VWB2_WGM1_WGMXCC1_WGMXCCGn1
    SolutionIndex: 69
    SolutionNameMin: Cijk_Alik_Bljk_HSS_BH_UserArgs_MT128x64x64_MI16x16x1_SN_LDSB1_CLR1_GSU0_GSUC0_GSUWGMRR0_K1_LBSPPA512_LBSPPB256_MIWT4_2_PLR2_SU32_SUM0_SUS256_USFGRO1_VWA4_VWB2_WGM1_WGMXCC1_WGMXCCGn1
    SolutionIndex: 70
    SolutionNameMin: Cijk_Alik_Bljk_HSS_BH_UserArgs_MT128x64x64_MI16x16x1_SN_LDSB1_CLR1_GSU0_GSUC0_GSUWGMRR0_K1_LBSPPA512_LBSPPB256_MIWT4_2_PLR1_SU32_SUM0_SUS256_USFGRO1_VWA4_VWB2_WGM4_WGMXCC1_WGMXCCGn1
    SolutionIndex: 71
    SolutionNameMin: Cijk_Alik_Bljk_HSS_BH_UserArgs_MT64x64x64_MI16x16x1_SN_LDSB1_CLR1_GSU0_GSUC0_GSUWGMRR0_K1_LBSPPA128_LBSPPB128_MIWT2_2_PLR1_SU32_SUM0_SUS256_USFGRO0_VWA1_VWB1_WGM1_WGMXCC1_WGMXCCGn1
    SolutionIndex: 72
    SolutionNameMin: Cijk_Alik_Bljk_HSS_BH_UserArgs_MT64x64x64_MI16x16x1_SN_LDSB1_CLR1_GSU0_GSUC0_GSUWGMRR0_K1_LBSPPA128_LBSPPB256_MIWT2_2_PLR1_SU32_SUM0_SUS256_USFGRO0_VWA1_VWB2_WGM1_WGMXCC1_WGMXCCGn1
    SolutionIndex: 73
    SolutionNameMin: Cijk_Alik_Bljk_HSS_BH_UserArgs_MT64x64x64_MI16x16x1_SN_LDSB1_CLR1_GSU0_GSUC0_GSUWGMRR0_K1_LBSPPA128_LBSPPB128_MIWT2_2_PLR1_SU32_SUM0_SUS256_USFGRO1_VWA1_VWB1_WGM1_WGMXCC1_WGMXCCGn1
    SolutionIndex: 74
    SolutionNameMin: Cijk_Alik_Bljk_HSS_BH_UserArgs_MT32x64x64_MI16x16x1_SN_LDSB0_CLR1_GSU0_GSUC0_GSUWGMRR0_K1_LBSPPA128_LBSPPB128_MIWT1_2_PLR1_SU32_SUM0_SUS256_USFGRO0_VWA1_VWB1_WGM1_WGMXCC1_WGMXCCGn1
    SolutionIndex: 75
    SolutionNameMin: Cijk_Alik_Bljk_HSS_BH_UserArgs_MT32x64x64_MI16x16x1_SN_LDSB0_CLR1_GSU0_GSUC0_GSUWGMRR0_K1_LBSPPA128_LBSPPB256_MIWT1_2_PLR1_SU32_SUM0_SUS256_USFGRO0_VWA1_VWB2_WGM1_WGMXCC1_WGMXCCGn1
    SolutionIndex: 76
    SolutionNameMin: Cijk_Alik_Bljk_HSS_BH_UserArgs_MT32x64x64_MI16x16x1_SN_LDSB0_CLR1_GSU0_GSUC0_GSUWGMRR0_K1_LBSPPA128_LBSPPB128_MIWT1_2_PLR1_SU32_SUM0_SUS256_USFGRO1_VWA1_VWB1_WGM1_WGMXCC1_WGMXCCGn1
    SolutionIndex: 77
    SolutionNameMin: Cijk_Alik_Bljk_HSS_BH_UserArgs_MT32x64x64_MI16x16x1_SN_LDSB0_CLR1_GSU0_GSUC0_GSUWGMRR0_K1_LBSPPA128_LBSPPB256_MIWT1_2_PLR1_SU32_SUM0_SUS256_USFGRO1_VWA1_VWB2_WGM1_WGMXCC1_WGMXCCGn1
    SolutionIndex: 78
    SolutionNameMin: Cijk_Alik_Bljk_HSS_BH_UserArgs_MT64x32x64_MI16x16x1_SN_LDSB0_CLR1_GSU0_GSUC0_GSUWGMRR0_K1_LBSPPA128_LBSPPB128_MIWT2_1_PLR1_SU32_SUM0_SUS256_USFGRO0_VWA1_VWB1_WGM1_WGMXCC1_WGMXCCGn1
    SolutionIndex: 79
    SolutionNameMin: Cijk_Alik_Bljk_HSS_BH_UserArgs_MT64x32x64_MI16x16x1_SN_LDSB0_CLR1_GSU0_GSUC0_GSUWGMRR0_K1_LBSPPA256_LBSPPB128_MIWT2_1_PLR1_SU32_SUM0_SUS256_USFGRO0_VWA2_VWB1_WGM1_WGMXCC1_WGMXCCGn1
    SolutionIndex: 80
    SolutionNameMin: Cijk_Alik_Bljk_HSS_BH_UserArgs_MT64x32x64_MI16x16x1_SN_LDSB0_CLR1_GSU0_GSUC0_GSUWGMRR0_K1_LBSPPA128_LBSPPB128_MIWT2_1_PLR1_SU32_SUM0_SUS256_USFGRO1_VWA1_VWB1_WGM1_WGMXCC1_WGMXCCGn1
    SolutionIndex: 81
    SolutionNameMin: Cijk_Alik_Bljk_HSS_BH_UserArgs_MT64x32x64_MI16x16x1_SN_LDSB0_CLR1_GSU0_GSUC0_GSUWGMRR0_K1_LBSPPA256_LBSPPB128_MIWT2_1_PLR1_SU32_SUM0_SUS256_USFGRO1_VWA2_VWB1_WGM1_WGMXCC1_WGMXCCGn1
    SolutionIndex: 82
    SolutionNameMin: Cijk_Alik_Bljk_HSS_BH_UserArgs_MT32x32x64_MI16x16x1_SN_LDSB0_CLR1_GSU0_GSUC0_GSUWGMRR0_K1_LBSPPA128_LBSPPB128_MIWT1_1_PLR1_SU32_SUM0_SUS256_USFGRO0_VWA1_VWB1_WGM1_WGMXCC1_WGMXCCGn1
    SolutionIndex: 83
    SolutionNameMin: Cijk_Alik_Bljk_HSS_BH_UserArgs_MT32x32x64_MI16x16x1_SN_LDSB0_CLR1_GSU0_GSUC0_GSUWGMRR0_K1_LBSPPA128_LBSPPB128_MIWT1_1_PLR2_SU32_SUM0_SUS256_USFGRO0_VWA1_VWB1_WGM1_WGMXCC1_WGMXCCGn1
    SolutionIndex: 84
    SolutionNameMin: Cijk_Alik_Bljk_HSS_BH_UserArgs_MT32x32x64_MI16x16x1_SN_LDSB0_CLR1_GSU0_GSUC0_GSUWGMRR0_K1_LBSPPA128_LBSPPB128_MIWT1_1_PLR1_SU32_SUM0_SUS256_USFGRO1_VWA1_VWB1_WGM1_WGMXCC1_WGMXCCGn1
    SolutionIndex: 85
    SolutionNameMin: Cijk_Alik_Bljk_HSS_BH_UserArgs_MT32x32x64_MI16x16x1_SN_LDSB0_CLR1_GSU0_GSUC0_GSUWGMRR0_K1_LBSPPA128_LBSPPB128_MIWT1_1_PLR2_SU32_SUM0_SUS256_USFGRO1_VWA1_VWB1_WGM1_WGMXCC1_WGMXCCGn1
    SolutionIndex: 86
    SolutionNameMin: Cijk_Alik_Bljk_HSS_BH_UserArgs_MT64x128x128_MI16x16x1_SN_LDSB1_CLR1_GSU0_GSUC0_GSUWGMRR0_K1_LBSPPA256_LBSPPB256_MIWT2_4_PLR2_SU32_SUM0_SUS256_USFGRO0_VWA1_VWB1_WGM1_WGMXCC1_WGMXCCGn1
    SolutionIndex: 87
    SolutionNameMin: Cijk_Alik_Bljk_HSS_BH_UserArgs_MT64x128x128_MI16x16x1_SN_LDSB1_CLR1_GSU0_GSUC0_GSUWGMRR0_K1_LBSPPA256_LBSPPB512_MIWT2_4_PLR2_SU32_SUM0_SUS256_USFGRO0_VWA1_VWB2_WGM1_WGMXCC1_WGMXCCGn1
    SolutionIndex: 88
    SolutionNameMin: Cijk_Alik_Bljk_HSS_BH_UserArgs_MT128x64x128_MI16x16x1_SN_LDSB1_CLR1_GSU0_GSUC0_GSUWGMRR0_K1_LBSPPA1024_LBSPPB256_MIWT4_2_PLR2_SU32_SUM0_SUS256_USFGRO0_VWA4_VWB1_WGM1_WGMXCC1_WGMXCCGn1
    SolutionIndex: 89
    SolutionNameMin: Cijk_Alik_Bljk_HSS_BH_UserArgs_MT128x64x128_MI16x16x1_SN_LDSB1_CLR1_GSU0_GSUC0_GSUWGMRR0_K1_LBSPPA1024_LBSPPB512_MIWT4_2_PLR2_SU32_SUM0_SUS256_USFGRO0_VWA4_VWB2_WGM1_WGMXCC1_WGMXCCGn1
    SolutionIndex: 90
    SolutionNameMin: Cijk_Alik_Bljk_HSS_BH_UserArgs_MT128x64x128_MI16x16x1_SN_LDSB1_CLR1_GSU0_GSUC0_GSUWGMRR0_K1_LBSPPA1024_LBSPPB256_MIWT4_2_PLR2_SU32_SUM0_SUS256_USFGRO0_VWA4_VWB1_WGM2_WGMXCC1_WGMXCCGn1
    SolutionIndex: 91
    SolutionNameMin: Cijk_Alik_Bljk_HSS_BH_UserArgs_MT128x64x128_MI16x16x1_SN_LDSB1_CLR1_GSU0_GSUC0_GSUWGMRR0_K1_LBSPPA1024_LBSPPB256_MIWT4_2_PLR2_SU32_SUM0_SUS256_USFGRO0_VWA4_VWB1_WGM4_WGMXCC1_WGMXCCGn1
    SolutionIndex: 92
    SolutionNameMin: Cijk_Alik_Bljk_HSS_BH_UserArgs_MT128x64x128_MI16x16x1_SN_LDSB1_CLR1_GSU0_GSUC0_GSUWGMRR0_K1_LBSPPA256_LBSPPB512_MIWT4_2_PLR2_SU32_SUM0_SUS256_USFGRO0_VWA1_VWB2_WGM4_WGMXCC1_WGMXCCGn1
    SolutionIndex: 93
    SolutionNameMin: Cijk_Alik_Bljk_HSS_BH_UserArgs_MT128x64x128_MI16x16x1_SN_LDSB1_CLR1_GSU0_GSUC0_GSUWGMRR0_K1_LBSPPA1024_LBSPPB512_MIWT4_2_PLR2_SU32_SUM0_SUS256_USFGRO0_VWA4_VWB2_WGM4_WGMXCC1_WGMXCCGn1
    SolutionIndex: 94
    SolutionNameMin: Cijk_Alik_Bljk_HSS_BH_UserArgs_MT64x64x128_MI16x16x1_SN_LDSB1_CLR1_GSU0_GSUC0_GSUWGMRR0_K1_LBSPPA256_LBSPPB256_MIWT2_2_PLR1_SU32_SUM0_SUS256_USFGRO1_VWA1_VWB1_WGM1_WGMXCC1_WGMXCCGn1
    SolutionIndex: 95
    SolutionNameMin: Cijk_Alik_Bljk_HSS_BH_UserArgs_MT64x64x128_MI16x16x1_SN_LDSB1_CLR1_GSU0_GSUC0_GSUWGMRR0_K1_LBSPPA256_LBSPPB512_MIWT2_2_PLR1_SU32_SUM0_SUS256_USFGRO1_VWA1_VWB2_WGM1_WGMXCC1_WGMXCCGn1
    SolutionIndex: 96
    SolutionNameMin: Cijk_Alik_Bljk_HSS_BH_UserArgs_MT64x64x128_MI16x16x1_SN_LDSB1_CLR1_GSU0_GSUC0_GSUWGMRR0_K1_LBSPPA256_LBSPPB256_MIWT2_2_PLR2_SU32_SUM0_SUS256_USFGRO1_VWA1_VWB1_WGM1_WGMXCC1_WGMXCCGn1
    SolutionIndex: 97
    SolutionNameMin: Cijk_Alik_Bljk_HSS_BH_UserArgs_MT64x64x128_MI16x16x1_SN_LDSB1_CLR1_GSU0_GSUC0_GSUWGMRR0_K1_LBSPPA256_LBSPPB512_MIWT2_2_PLR2_SU32_SUM0_SUS256_USFGRO1_VWA1_VWB2_WGM1_WGMXCC1_WGMXCCGn1
    SolutionIndex: 98
    SolutionNameMin: Cijk_Alik_Bljk_HSS_BH_UserArgs_MT64x64x128_MI16x16x1_SN_LDSB1_CLR1_GSU0_GSUC0_GSUWGMRR0_K1_LBSPPA512_LBSPPB512_MIWT2_2_PLR2_SU32_SUM0_SUS256_USFGRO1_VWA2_VWB2_WGM1_WGMXCC1_WGMXCCGn1
    SolutionIndex: 99
    SolutionNameMin: Cijk_Alik_Bljk_HSS_BH_UserArgs_MT64x64x128_MI16x16x1_SN_LDSB1_CLR1_GSU0_GSUC0_GSUWGMRR0_K1_LBSPPA512_LBSPPB256_MIWT2_2_PLR1_SU32_SUM0_SUS256_USFGRO1_VWA2_VWB1_WGM2_WGMXCC1_WGMXCCGn1
    SolutionIndex: 100
    SolutionNameMin: Cijk_Alik_Bljk_HSS_BH_UserArgs_MT64x64x128_MI16x16x1_SN_LDSB1_CLR1_GSU0_GSUC0_GSUWGMRR0_K1_LBSPPA256_LBSPPB256_MIWT2_2_PLR2_SU32_SUM0_SUS256_USFGRO1_VWA1_VWB1_WGM2_WGMXCC1_WGMXCCGn1
    SolutionIndex: 101
    SolutionNameMin: Cijk_Alik_Bljk_HSS_BH_UserArgs_MT64x64x128_MI16x16x1_SN_LDSB1_CLR1_GSU0_GSUC0_GSUWGMRR0_K1_LBSPPA256_LBSPPB512_MIWT2_2_PLR2_SU32_SUM0_SUS256_USFGRO1_VWA1_VWB2_WGM2_WGMXCC1_WGMXCCGn1
    SolutionIndex: 102
    SolutionNameMin: Cijk_Alik_Bljk_HSS_BH_UserArgs_MT64x64x128_MI16x16x1_SN_LDSB1_CLR1_GSU0_GSUC0_GSUWGMRR0_K1_LBSPPA256_LBSPPB512_MIWT2_2_PLR2_SU32_SUM0_SUS256_USFGRO1_VWA1_VWB2_WGM4_WGMXCC1_WGMXCCGn1
    SolutionIndex: 103
    SolutionNameMin: Cijk_Alik_Bljk_HSS_BH_UserArgs_MT32x64x128_MI16x16x1_SN_LDSB1_CLR1_GSU0_GSUC0_GSUWGMRR0_K1_LBSPPA256_LBSPPB256_MIWT1_2_PLR1_SU32_SUM0_SUS256_USFGRO0_VWA1_VWB1_WGM1_WGMXCC1_WGMXCCGn1
    SolutionIndex: 104
    SolutionNameMin: Cijk_Alik_Bljk_HSS_BH_UserArgs_MT32x64x128_MI16x16x1_SN_LDSB1_CLR1_GSU0_GSUC0_GSUWGMRR0_K1_LBSPPA256_LBSPPB256_MIWT1_2_PLR2_SU32_SUM0_SUS256_USFGRO0_VWA1_VWB1_WGM1_WGMXCC1_WGMXCCGn1
    SolutionIndex: 105
    SolutionNameMin: Cijk_Alik_Bljk_HSS_BH_UserArgs_MT32x64x128_MI16x16x1_SN_LDSB1_CLR1_GSU0_GSUC0_GSUWGMRR0_K1_LBSPPA256_LBSPPB512_MIWT1_2_PLR2_SU32_SUM0_SUS256_USFGRO0_VWA1_VWB2_WGM1_WGMXCC1_WGMXCCGn1
    SolutionIndex: 106
    SolutionNameMin: Cijk_Alik_Bljk_HSS_BH_UserArgs_MT32x64x128_MI16x16x1_SN_LDSB1_CLR1_GSU0_GSUC0_GSUWGMRR0_K1_LBSPPA256_LBSPPB256_MIWT1_2_PLR1_SU32_SUM0_SUS256_USFGRO1_VWA1_VWB1_WGM1_WGMXCC1_WGMXCCGn1
    SolutionIndex: 107
    SolutionNameMin: Cijk_Alik_Bljk_HSS_BH_UserArgs_MT32x64x128_MI16x16x1_SN_LDSB1_CLR1_GSU0_GSUC0_GSUWGMRR0_K1_LBSPPA256_LBSPPB256_MIWT1_2_PLR2_SU32_SUM0_SUS256_USFGRO1_VWA1_VWB1_WGM1_WGMXCC1_WGMXCCGn1
    SolutionIndex: 108
    SolutionNameMin: Cijk_Alik_Bljk_HSS_BH_UserArgs_MT32x64x128_MI16x16x1_SN_LDSB1_CLR1_GSU0_GSUC0_GSUWGMRR0_K1_LBSPPA256_LBSPPB512_MIWT1_2_PLR2_SU32_SUM0_SUS256_USFGRO1_VWA1_VWB2_WGM2_WGMXCC1_WGMXCCGn1
    SolutionIndex: 109
    SolutionNameMin: Cijk_Alik_Bljk_HSS_BH_UserArgs_MT64x32x128_MI16x16x1_SN_LDSB1_CLR1_GSU0_GSUC0_GSUWGMRR0_K1_LBSPPA256_LBSPPB256_MIWT2_1_PLR2_SU32_SUM0_SUS256_USFGRO0_VWA1_VWB1_WGM1_WGMXCC1_WGMXCCGn1
    SolutionIndex: 110
    SolutionNameMin: Cijk_Alik_Bljk_HSS_BH_UserArgs_MT64x32x128_MI16x16x1_SN_LDSB1_CLR1_GSU0_GSUC0_GSUWGMRR0_K1_LBSPPA256_LBSPPB256_MIWT2_1_PLR2_SU32_SUM0_SUS256_USFGRO1_VWA1_VWB1_WGM1_WGMXCC1_WGMXCCGn1
    SolutionIndex: 111
    SolutionNameMin: Cijk_Alik_Bljk_HSS_BH_UserArgs_MT32x32x128_MI16x16x1_SN_LDSB1_CLR1_GSU0_GSUC0_GSUWGMRR0_K1_LBSPPA256_LBSPPB256_MIWT1_1_PLR1_SU32_SUM0_SUS256_USFGRO0_VWA1_VWB1_WGM1_WGMXCC1_WGMXCCGn1
    SolutionIndex: 112
    SolutionNameMin: Cijk_Alik_Bljk_HSS_BH_UserArgs_MT32x32x128_MI16x16x1_SN_LDSB1_CLR1_GSU0_GSUC0_GSUWGMRR0_K1_LBSPPA256_LBSPPB256_MIWT1_1_PLR2_SU32_SUM0_SUS256_USFGRO0_VWA1_VWB1_WGM1_WGMXCC1_WGMXCCGn1
    SolutionIndex: 113
    SolutionNameMin: Cijk_Alik_Bljk_HSS_BH_UserArgs_MT32x32x128_MI16x16x1_SN_LDSB1_CLR1_GSU0_GSUC0_GSUWGMRR0_K1_LBSPPA256_LBSPPB256_MIWT1_1_PLR1_SU32_SUM0_SUS256_USFGRO1_VWA1_VWB1_WGM1_WGMXCC1_WGMXCCGn1
    SolutionIndex: 114
    SolutionNameMin: Cijk_Alik_Bljk_HSS_BH_UserArgs_MT32x32x128_MI16x16x1_SN_LDSB1_CLR1_GSU0_GSUC0_GSUWGMRR0_K1_LBSPPA256_LBSPPB256_MIWT1_1_PLR2_SU32_SUM0_SUS256_USFGRO1_VWA1_VWB1_WGM1_WGMXCC1_WGMXCCGn1
    SolutionIndex: 115
    SolutionNameMin: Cijk_Alik_Bljk_HSS_BH_UserArgs_MT32x32x32_MI16x16x1_SN_LDSB0_CLR0_GSU0_GSUC0_GSUWGMRR0_K1_LBSPPA128_LBSPPB128_MIWT1_1_PLR0_SU32_SUM0_SUS256_USFGRO1_VWA1_VWB1_WGM1_WGMXCC1_WGMXCCGn1
- - - [128, 128, 1, 128, 128, 128, 128, 128]
    - [84, 0.0]
  - - [128, 128, 1, 256, 128, 128, 256, 256]
    - [114, 0.0]
  - - [128, 128, 1, 512, 128, 128, 512, 512]
    - [113, 0.0]
  - - [128, 128, 1, 1024, 128, 128, 1024, 1024]
    - [111, 0.0]
  - - [128, 128, 1, 2048, 128, 128, 2048, 2048]
    - [111, 0.0]
  - - [128, 128, 1, 4096, 128, 128, 4096, 4096]
    - [84, 0.001]
  - - [128, 128, 1, 8192, 128, 128, 8192, 8192]
    - [114, 0.001]
  - - [128, 256, 1, 128, 128, 128, 128, 128]
    - [85, 0.0]
  - - [128, 256, 1, 256, 128, 128, 256, 256]
    - [84, 0.0]
  - - [128, 256, 1, 512, 128, 128, 512, 512]
    - [84, 0.0]
  - - [128, 256, 1, 1024, 128, 128, 1024, 1024]
    - [111, 0.0]
  - - [128, 256, 1, 2048, 128, 128, 2048, 2048]
    - [114, 0.001]
  - - [128, 256, 1, 4096, 128, 128, 4096, 4096]
    - [111, 0.001]
  - - [128, 256, 1, 8192, 128, 128, 8192, 8192]
    - [109, 0.001]
  - - [128, 512, 1, 128, 128, 128, 128, 128]
    - [84, 0.0]
  - - [128, 512, 1, 256, 128, 128, 256, 256]
    - [82, 0.0]
  - - [128, 512, 1, 512, 128, 128, 512, 512]
    - [84, 0.001]
  - - [128, 512, 1, 1024, 128, 128, 1024, 1024]
    - [114, 0.001]
  - - [128, 512, 1, 2048, 128, 128, 2048, 2048]
    - [112, 0.001]
  - - [128, 512, 1, 4096, 128, 128, 4096, 4096]
    - [103, 0.002]
  - - [128, 512, 1, 8192, 128, 128, 8192, 8192]
    - [95, 0.002]
  - - [128, 1024, 1, 128, 128, 128, 128, 128]
    - [75, 0.0]
  - - [128, 1024, 1, 256, 128, 128, 256, 256]
    - [74, 0.001]
  - - [128, 1024, 1, 512, 128, 128, 512, 512]
    - [77, 0.001]
  - - [128, 1024, 1, 1024, 128, 128, 1024, 1024]
    - [106, 0.001]
  - - [128, 1024, 1, 2048, 128, 128, 2048, 2048]
    - [110, 0.002]
  - - [128, 1024, 1, 4096, 128, 128, 4096, 4096]
    - [95, 0.003]
  - - [128, 1024, 1, 8192, 128, 128, 8192, 8192]
    - [88, 0.004]
  - - [128, 2048, 1, 128, 128, 128, 128, 128]
    - [73, 0.001]
  - - [128, 2048, 1, 256, 128, 128, 256, 256]
    - [73, 0.001]
  - - [128, 2048, 1, 512, 128, 128, 512, 512]
    - [73, 0.002]
  - - [128, 2048, 1, 1024, 128, 128, 1024, 1024]
    - [94, 0.002]
  - - [128, 2048, 1, 2048, 128, 128, 2048, 2048]
    - [97, 0.003]
  - - [128, 2048, 1, 4096, 128, 128, 4096, 4096]
    - [88, 0.004]
  - - [128, 2048, 1, 8192, 128, 128, 8192, 8192]
    - [88, 0.005]
  - - [128, 4096, 1, 128, 128, 128, 128, 128]
    - [66, 0.001]
  - - [128, 4096, 1, 256, 128, 128, 256, 256]
    - [67, 0.002]
  - - [128, 4096, 1, 512, 128, 128, 512, 512]
    - [65, 0.003]
  - - [128, 4096, 1, 1024, 128, 128, 1024, 1024]
    - [89, 0.004]
  - - [128, 4096, 1, 2048, 128, 128, 2048, 2048]
    - [89, 0.004]
  - - [128, 4096, 1, 4096, 128, 128, 4096, 4096]
    - [88, 0.005]
  - - [128, 4096, 1, 8192, 128, 128, 8192, 8192]
    - [88, 0.006]
  - - [128, 8192, 1, 128, 128, 128, 128, 128]
    - [51, 0.001]
  - - [128, 8192, 1, 256, 128, 128, 256, 256]
    - [52, 0.002]
  - - [128, 8192, 1, 512, 128, 128, 512, 512]
    - [48, 0.004]
  - - [128, 8192, 1, 1024, 128, 128, 1024, 1024]
    - [44, 0.005]
  - - [128, 8192, 1, 2048, 128, 128, 2048, 2048]
    - [44, 0.005]
  - - [128, 8192, 1, 4096, 128, 128, 4096, 4096]
    - [47, 0.006]
  - - [128, 8192, 1, 8192, 128, 128, 8192, 8192]
    - [27, 0.007]
  - - [256, 128, 1, 128, 256, 256, 128, 128]
    - [83, 0.0]
  - - [256, 128, 1, 256, 256, 256, 256, 256]
    - [84, 0.0]
  - - [256, 128, 1, 512, 256, 256, 512, 512]
    - [84, 0.0]
  - - [256, 128, 1, 1024, 256, 256, 1024, 1024]
    - [113, 0.0]
  - - [256, 128, 1, 2048, 256, 256, 2048, 2048]
    - [114, 0.001]
  - - [256, 128, 1, 4096, 256, 256, 4096, 4096]
    - [114, 0.001]
  - - [256, 128, 1, 8192, 256, 256, 8192, 8192]
    - [107, 0.001]
  - - [256, 256, 1, 128, 256, 256, 128, 128]
    - [85, 0.0]
  - - [256, 256, 1, 256, 256, 256, 256, 256]
    - [84, 0.0]
  - - [256, 256, 1, 512, 256, 256, 512, 512]
    - [84, 0.001]
  - - [256, 256, 1, 1024, 256, 256, 1024, 1024]
    - [112, 0.001]
  - - [256, 256, 1, 2048, 256, 256, 2048, 2048]
    - [114, 0.001]
  - - [256, 256, 1, 4096, 256, 256, 4096, 4096]
    - [105, 0.002]
  - - [256, 256, 1, 8192, 256, 256, 8192, 8192]
    - [95, 0.002]
  - - [256, 512, 1, 128, 256, 256, 128, 128]
    - [81, 0.0]
  - - [256, 512, 1, 256, 256, 256, 256, 256]
    - [81, 0.001]
  - - [256, 512, 1, 512, 256, 256, 512, 512]
    - [75, 0.001]
  - - [256, 512, 1, 1024, 256, 256, 1024, 1024]
    - [75, 0.001]
  - - [256, 512, 1, 2048, 256, 256, 2048, 2048]
    - [107, 0.002]
  - - [256, 512, 1, 4096, 256, 256, 4096, 4096]
    - [95, 0.003]
  - - [256, 512, 1, 8192, 256, 256, 8192, 8192]
    - [91, 0.003]
  - - [256, 1024, 1, 128, 256, 256, 128, 128]
    - [73, 0.001]
  - - [256, 1024, 1, 256, 256, 256, 256, 256]
    - [73, 0.001]
  - - [256, 1024, 1, 512, 256, 256, 512, 512]
    - [72, 0.002]
  - - [256, 1024, 1, 1024, 256, 256, 1024, 1024]
    - [94, 0.002]
  - - [256, 1024, 1, 2048, 256, 256, 2048, 2048]
    - [95, 0.003]
  - - [256, 1024, 1, 4096, 256, 256, 4096, 4096]
    - [88, 0.004]
  - - [256, 1024, 1, 8192, 256, 256, 8192, 8192]
    - [88, 0.005]
  - - [256, 2048, 1, 128, 256, 256, 128, 128]
    - [64, 0.001]
  - - [256, 2048, 1, 256, 256, 256, 256, 256]
    - [70, 0.002]
  - - [256, 2048, 1, 512, 256, 256, 512, 512]
    - [68, 0.002]
  - - [256, 2048, 1, 1024, 256, 256, 1024, 1024]
    - [87, 0.004]
  - - [256, 2048, 1, 2048, 256, 256, 2048, 2048]
    - [89, 0.005]
  - - [256, 2048, 1, 4096, 256, 256, 4096, 4096]
    - [93, 0.005]
  - - [256, 2048, 1, 8192, 256, 256, 8192, 8192]
    - [45, 0.006]
  - - [256, 4096, 1, 128, 256, 256, 128, 128]
    - [48, 0.001]
  - - [256, 4096, 1, 256, 256, 256, 256, 256]
    - [48, 0.002]
  - - [256, 4096, 1, 512, 256, 256, 512, 512]
    - [48, 0.004]
  - - [256, 4096, 1, 1024, 256, 256, 1024, 1024]
    - [50, 0.005]
  - - [256, 4096, 1, 2048, 256, 256, 2048, 2048]
    - [58, 0.005]
  - - [256, 4096, 1, 4096, 256, 256, 4096, 4096]
    - [59, 0.006]
  - - [256, 4096, 1, 8192, 256, 256, 8192, 8192]
    - [62, 0.007]
  - - [256, 8192, 1, 128, 256, 256, 128, 128]
    - [13, 0.002]
  - - [256, 8192, 1, 256, 256, 256, 256, 256]
    - [23, 0.003]
  - - [256, 8192, 1, 512, 256, 256, 512, 512]
    - [22, 0.004]
  - - [256, 8192, 1, 1024, 256, 256, 1024, 1024]
    - [34, 0.005]
  - - [256, 8192, 1, 2048, 256, 256, 2048, 2048]
    - [30, 0.006]
  - - [256, 8192, 1, 4096, 256, 256, 4096, 4096]
    - [34, 0.008]
  - - [256, 8192, 1, 8192, 256, 256, 8192, 8192]
    - [32, 0.008]
  - - [512, 128, 1, 128, 512, 512, 128, 128]
    - [84, 0.0]
  - - [512, 128, 1, 256, 512, 512, 256, 256]
    - [114, 0.0]
  - - [512, 128, 1, 512, 512, 512, 512, 512]
    - [114, 0.001]
  - - [512, 128, 1, 1024, 512, 512, 1024, 1024]
    - [84, 0.001]
  - - [512, 128, 1, 2048, 512, 512, 2048, 2048]
    - [114, 0.001]
  - - [512, 128, 1, 4096, 512, 512, 4096, 4096]
    - [104, 0.002]
  - - [512, 128, 1, 8192, 512, 512, 8192, 8192]
    - [95, 0.002]
  - - [512, 256, 1, 128, 512, 512, 128, 128]
    - [78, 0.0]
  - - [512, 256, 1, 256, 512, 512, 256, 256]
    - [76, 0.001]
  - - [512, 256, 1, 512, 512, 512, 512, 512]
    - [77, 0.001]
  - - [512, 256, 1, 1024, 512, 512, 1024, 1024]
    - [109, 0.001]
  - - [512, 256, 1, 2048, 512, 512, 2048, 2048]
    - [110, 0.002]
  - - [512, 256, 1, 4096, 512, 512, 4096, 4096]
    - [100, 0.003]
  - - [512, 256, 1, 8192, 512, 512, 8192, 8192]
    - [91, 0.003]
  - - [512, 512, 1, 128, 512, 512, 128, 128]
    - [73, 0.001]
  - - [512, 512, 1, 256, 512, 512, 256, 256]
    - [73, 0.001]
  - - [512, 512, 1, 512, 512, 512, 512, 512]
    - [71, 0.002]
  - - [512, 512, 1, 1024, 512, 512, 1024, 1024]
    - [95, 0.002]
  - - [512, 512, 1, 2048, 512, 512, 2048, 2048]
    - [95, 0.003]
  - - [512, 512, 1, 4096, 512, 512, 4096, 4096]
    - [91, 0.004]
  - - [512, 512, 1, 8192, 512, 512, 8192, 8192]
    - [88, 0.005]
  - - [512, 1024, 1, 128, 512, 512, 128, 128]
    - [66, 0.001]
  - - [512, 1024, 1, 256, 512, 512, 256, 256]
    - [68, 0.002]
  - - [512, 1024, 1, 512, 512, 512, 512, 512]
    - [68, 0.003]
  - - [512, 1024, 1, 1024, 512, 512, 1024, 1024]
    - [89, 0.004]
  - - [512, 1024, 1, 2048, 512, 512, 2048, 2048]
    - [89, 0.005]
  - - [512, 1024, 1, 4096, 512, 512, 4096, 4096]
    - [90, 0.005]
  - - [512, 1024, 1, 8192, 512, 512, 8192, 8192]
    - [88, 0.006]
  - - [512, 2048, 1, 128, 512, 512, 128, 128]
    - [53, 0.001]
  - - [512, 2048, 1, 256, 512, 512, 256, 256]
    - [53, 0.002]
  - - [512, 2048, 1, 512, 512, 512, 512, 512]
    - [53, 0.004]
  - - [512, 2048, 1, 1024, 512, 512, 1024, 1024]
    - [53, 0.005]
  - - [512, 2048, 1, 2048, 512, 512, 2048, 2048]
    - [58, 0.005]
  - - [512, 2048, 1, 4096, 512, 512, 4096, 4096]
    - [63, 0.006]
  - - [512, 2048, 1, 8192, 512, 512, 8192, 8192]
    - [33, 0.007]
  - - [512, 4096, 1, 128, 512, 512, 128, 128]
    - [11, 0.002]
  - - [512, 4096, 1, 256, 512, 512, 256, 256]
    - [17, 0.003]
  - - [512, 4096, 1, 512, 512, 512, 512, 512]
    - [23, 0.004]
  - - [512, 4096, 1, 1024, 512, 512, 1024, 1024]
    - [33, 0.005]
  - - [512, 4096, 1, 2048, 512, 512, 2048, 2048]
    - [43, 0.006]
  - - [512, 4096, 1, 4096, 512, 512, 4096, 4096]
    - [38, 0.007]
  - - [512, 4096, 1, 8192, 512, 512, 8192, 8192]
    - [30, 0.008]
  - - [512, 8192, 1, 128, 512, 512, 128, 128]
    - [2, 0.002]
  - - [512, 8192, 1, 256, 512, 512, 256, 256]
    - [2, 0.003]
  - - [512, 8192, 1, 512, 512, 512, 512, 512]
    - [2, 0.005]
  - - [512, 8192, 1, 1024, 512, 512, 1024, 1024]
    - [49, 0.006]
  - - [512, 8192, 1, 2048, 512, 512, 2048, 2048]
    - [37, 0.007]
  - - [512, 8192, 1, 4096, 512, 512, 4096, 4096]
    - [38, 0.008]
  - - [512, 8192, 1, 8192, 512, 512, 8192, 8192]
    - [35, 0.009]
  - - [1024, 128, 1, 128, 1024, 1024, 128, 128]
    - [79, 0.0]
  - - [1024, 128, 1, 256, 1024, 1024, 256, 256]
    - [80, 0.001]
  - - [1024, 128, 1, 512, 1024, 1024, 512, 512]
    - [81, 0.001]
  - - [1024, 128, 1, 1024, 1024, 1024, 1024, 1024]
    - [109, 0.001]
  - - [1024, 128, 1, 2048, 1024, 1024, 2048, 2048]
    - [108, 0.002]
  - - [1024, 128, 1, 4096, 1024, 1024, 4096, 4096]
    - [101, 0.003]
  - - [1024, 128, 1, 8192, 1024, 1024, 8192, 8192]
    - [91, 0.003]
  - - [1024, 256, 1, 128, 1024, 1024, 128, 128]
    - [72, 0.001]
  - - [1024, 256, 1, 256, 1024, 1024, 256, 256]
    - [73, 0.001]
  - - [1024, 256, 1, 512, 1024, 1024, 512, 512]
    - [72, 0.002]
  - - [1024, 256, 1, 1024, 1024, 1024, 1024, 1024]
    - [98, 0.002]
  - - [1024, 256, 1, 2048, 1024, 1024, 2048, 2048]
    - [102, 0.003]
  - - [1024, 256, 1, 4096, 1024, 1024, 4096, 4096]
    - [91, 0.004]
  - - [1024, 256, 1, 8192, 1024, 1024, 8192, 8192]
    - [88, 0.005]
  - - [1024, 512, 1, 128, 1024, 1024, 128, 128]
    - [69, 0.001]
  - - [1024, 512, 1, 256, 1024, 1024, 256, 256]
    - [68, 0.002]
  - - [1024, 512, 1, 512, 1024, 1024, 512, 512]
    - [68, 0.003]
  - - [1024, 512, 1, 1024, 1024, 1024, 1024, 1024]
    - [89, 0.004]
  - - [1024, 512, 1, 2048, 1024, 1024, 2048, 2048]
    - [93, 0.004]
  - - [1024, 512, 1, 4096, 1024, 1024, 4096, 4096]
    - [89, 0.005]
  - - [1024, 512, 1, 8192, 1024, 1024, 8192, 8192]
    - [60, 0.006]
  - - [1024, 1024, 1, 128, 1024, 1024, 128, 128]
    - [51, 0.001]
  - - [1024, 1024, 1, 256, 1024, 1024, 256, 256]
    - [52, 0.002]
  - - [1024, 1024, 1, 512, 1024, 1024, 512, 512]
    - [51, 0.004]
  - - [1024, 1024, 1, 1024, 1024, 1024, 1024, 1024]
    - [63, 0.005]
  - - [1024, 1024, 1, 2048, 1024, 1024, 2048, 2048]
    - [45, 0.005]
  - - [1024, 1024, 1, 4096, 1024, 1024, 4096, 4096]
    - [23, 0.006]
  - - [1024, 1024, 1, 8192, 1024, 1024, 8192, 8192]
    - [40, 0.007]
  - - [1024, 2048, 1, 128, 1024, 1024, 128, 128]
    - [10, 0.002]
  - - [1024, 2048, 1, 256, 1024, 1024, 256, 256]
    - [32, 0.003]
  - - [1024, 2048, 1, 512, 1024, 1024, 512, 512]
    - [32, 0.004]
  - - [1024, 2048, 1, 1024, 1024, 1024, 1024, 1024]
    - [31, 0.005]
  - - [1024, 2048, 1, 2048, 1024, 1024, 2048, 2048]
    - [23, 0.006]
  - - [1024, 2048, 1, 4096, 1024, 1024, 4096, 4096]
    - [33, 0.007]
  - - [1024, 2048, 1, 8192, 1024, 1024, 8192, 8192]
    - [23, 0.008]
  - - [1024, 4096, 1, 128, 1024, 1024, 128, 128]
    - [2, 0.002]
  - - [1024, 4096, 1, 256, 1024, 1024, 256, 256]
    - [2, 0.003]
  - - [1024, 4096, 1, 512, 1024, 1024, 512, 512]
    - [2, 0.005]
  - - [1024, 4096, 1, 1024, 1024, 1024, 1024, 1024]
    - [43, 0.006]
  - - [1024, 4096, 1, 2048, 1024, 1024, 2048, 2048]
    - [42, 0.007]
  - - [1024, 4096, 1, 4096, 1024, 1024, 4096, 4096]
    - [34, 0.008]
  - - [1024, 4096, 1, 8192, 1024, 1024, 8192, 8192]
    - [34, 0.009]
  - - [1024, 8192, 1, 128, 1024, 1024, 128, 128]
    - [53, 0.002]
  - - [1024, 8192, 1, 256, 1024, 1024, 256, 256]
    - [53, 0.003]
  - - [1024, 8192, 1, 512, 1024, 1024, 512, 512]
    - [23, 0.005]
  - - [1024, 8192, 1, 1024, 1024, 1024, 1024, 1024]
    - [34, 0.006]
  - - [1024, 8192, 1, 2048, 1024, 1024, 2048, 2048]
    - [34, 0.007]
  - - [1024, 8192, 1, 4096, 1024, 1024, 4096, 4096]
    - [26, 0.008]
  - - [1024, 8192, 1, 8192, 1024, 1024, 8192, 8192]
    - [23, 0.009]
  - - [2048, 128, 1, 128, 2048, 2048, 128, 128]
    - [73, 0.001]
  - - [2048, 128, 1, 256, 2048, 2048, 256, 256]
    - [71, 0.001]
  - - [2048, 128, 1, 512, 2048, 2048, 512, 512]
    - [72, 0.002]
  - - [2048, 128, 1, 1024, 2048, 2048, 1024, 1024]
    - [96, 0.002]
  - - [2048, 128, 1, 2048, 2048, 2048, 2048, 2048]
    - [99, 0.003]
  - - [2048, 128, 1, 4096, 2048, 2048, 4096, 4096]
    - [90, 0.004]
  - - [2048, 128, 1, 8192, 2048, 2048, 8192, 8192]
    - [88, 0.005]
  - - [2048, 256, 1, 128, 2048, 2048, 128, 128]
    - [67, 0.001]
  - - [2048, 256, 1, 256, 2048, 2048, 256, 256]
    - [67, 0.002]
  - - [2048, 256, 1, 512, 2048, 2048, 512, 512]
    - [64, 0.003]
  - - [2048, 256, 1, 1024, 2048, 2048, 1024, 1024]
    - [87, 0.004]
  - - [2048, 256, 1, 2048, 2048, 2048, 2048, 2048]
    - [92, 0.004]
  - - [2048, 256, 1, 4096, 2048, 2048, 4096, 4096]
    - [88, 0.005]
  - - [2048, 256, 1, 8192, 2048, 2048, 8192, 8192]
    - [56, 0.006]
  - - [2048, 512, 1, 128, 2048, 2048, 128, 128]
    - [53, 0.001]
  - - [2048, 512, 1, 256, 2048, 2048, 256, 256]
    - [51, 0.002]
  - - [2048, 512, 1, 512, 2048, 2048, 512, 512]
    - [55, 0.004]
  - - [2048, 512, 1, 1024, 2048, 2048, 1024, 1024]
    - [62, 0.005]
  - - [2048, 512, 1, 2048, 2048, 2048, 2048, 2048]
    - [58, 0.005]
  - - [2048, 512, 1, 4096, 2048, 2048, 4096, 4096]
    - [21, 0.006]
  - - [2048, 512, 1, 8192, 2048, 2048, 8192, 8192]
    - [58, 0.007]
  - - [2048, 1024, 1, 128, 2048, 2048, 128, 128]
    - [13, 0.002]
  - - [2048, 1024, 1, 256, 2048, 2048, 256, 256]
    - [18, 0.003]
  - - [2048, 1024, 1, 512, 2048, 2048, 512, 512]
    - [25, 0.004]
  - - [2048, 1024, 1, 1024, 2048, 2048, 1024, 1024]
    - [41, 0.005]
  - - [2048, 1024, 1, 2048, 2048, 2048, 2048, 2048]
    - [30, 0.006]
  - - [2048, 1024, 1, 4096, 2048, 2048, 4096, 4096]
    - [21, 0.007]
  - - [2048, 1024, 1, 8192, 2048, 2048, 8192, 8192]
    - [29, 0.008]
  - - [2048, 2048, 1, 128, 2048, 2048, 128, 128]
    - [9, 0.002]
  - - [2048, 2048, 1, 256, 2048, 2048, 256, 256]
    - [9, 0.003]
  - - [2048, 2048, 1, 512, 2048, 2048, 512, 512]
    - [9, 0.005]
  - - [2048, 2048, 1, 1024, 2048, 2048, 1024, 1024]
    - [29, 0.006]
  - - [2048, 2048, 1, 2048, 2048, 2048, 2048, 2048]
    - [33, 0.007]
  - - [2048, 2048, 1, 4096, 2048, 2048, 4096, 4096]
    - [33, 0.008]
  - - [2048, 2048, 1, 8192, 2048, 2048, 8192, 8192]
    - [33, 0.009]
  - - [2048, 4096, 1, 128, 2048, 2048, 128, 128]
    - [14, 0.002]
  - - [2048, 4096, 1, 256, 2048, 2048, 256, 256]
    - [51, 0.003]
  - - [2048, 4096, 1, 512, 2048, 2048, 512, 512]
    - [34, 0.005]
  - - [2048, 4096, 1, 1024, 2048, 2048, 1024, 1024]
    - [25, 0.006]
  - - [2048, 4096, 1, 2048, 2048, 2048, 2048, 2048]
    - [22, 0.007]
  - - [2048, 4096, 1, 4096, 2048, 2048, 4096, 4096]
    - [29, 0.008]
  - - [2048, 4096, 1, 8192, 2048, 2048, 8192, 8192]
    - [27, 0.009]
  - - [2048, 8192, 1, 128, 2048, 2048, 128, 128]
    - [14, 0.003]
  - - [2048, 8192, 1, 256, 2048, 2048, 256, 256]
    - [5, 0.004]
  - - [2048, 8192, 1, 512, 2048, 2048, 512, 512]
    - [0, 0.005]
  - - [2048, 8192, 1, 1024, 2048, 2048, 1024, 1024]
    - [28, 0.007]
  - - [2048, 8192, 1, 2048, 2048, 2048, 2048, 2048]
    - [43, 0.008]
  - - [2048, 8192, 1, 4096, 2048, 2048, 4096, 4096]
    - [21, 0.009]
  - - [2048, 8192, 1, 8192, 2048, 2048, 8192, 8192]
    - [36, 0.009]
  - - [4096, 128, 1, 128, 4096, 4096, 128, 128]
    - [68, 0.001]
  - - [4096, 128, 1, 256, 4096, 4096, 256, 256]
    - [66, 0.002]
  - - [4096, 128, 1, 512, 4096, 4096, 512, 512]
    - [68, 0.002]
  - - [4096, 128, 1, 1024, 4096, 4096, 1024, 1024]
    - [86, 0.003]
  - - [4096, 128, 1, 2048, 4096, 4096, 2048, 2048]
    - [90, 0.004]
  - - [4096, 128, 1, 4096, 4096, 4096, 4096, 4096]
    - [88, 0.005]
  - - [4096, 128, 1, 8192, 4096, 4096, 8192, 8192]
    - [46, 0.006]
  - - [4096, 256, 1, 128, 4096, 4096, 128, 128]
    - [50, 0.001]
  - - [4096, 256, 1, 256, 4096, 4096, 256, 256]
    - [48, 0.002]
  - - [4096, 256, 1, 512, 4096, 4096, 512, 512]
    - [57, 0.004]
  - - [4096, 256, 1, 1024, 4096, 4096, 1024, 1024]
    - [56, 0.005]
  - - [4096, 256, 1, 2048, 4096, 4096, 2048, 2048]
    - [58, 0.005]
  - - [4096, 256, 1, 4096, 4096, 4096, 4096, 4096]
    - [44, 0.006]
  - - [4096, 256, 1, 8192, 4096, 4096, 8192, 8192]
    - [38, 0.007]
  - - [4096, 512, 1, 128, 4096, 4096, 128, 128]
    - [18, 0.002]
  - - [4096, 512, 1, 256, 4096, 4096, 256, 256]
    - [15, 0.003]
  - - [4096, 512, 1, 512, 4096, 4096, 512, 512]
    - [28, 0.004]
  - - [4096, 512, 1, 1024, 4096, 4096, 1024, 1024]
    - [39, 0.005]
  - - [4096, 512, 1, 2048, 4096, 4096, 2048, 2048]
    - [29, 0.006]
  - - [4096, 512, 1, 4096, 4096, 4096, 4096, 4096]
    - [21, 0.007]
  - - [4096, 512, 1, 8192, 4096, 4096, 8192, 8192]
    - [29, 0.008]
  - - [4096, 1024, 1, 128, 4096, 4096, 128, 128]
    - [1, 0.002]
  - - [4096, 1024, 1, 256, 4096, 4096, 256, 256]
    - [9, 0.003]
  - - [4096, 1024, 1, 512, 4096, 4096, 512, 512]
    - [9, 0.005]
  - - [4096, 1024, 1, 1024, 4096, 4096, 1024, 1024]
    - [24, 0.006]
  - - [4096, 1024, 1, 2048, 4096, 4096, 2048, 2048]
    - [20, 0.007]
  - - [4096, 1024, 1, 4096, 4096, 4096, 4096, 4096]
    - [20, 0.008]
  - - [4096, 1024, 1, 8192, 4096, 4096, 8192, 8192]
    - [33, 0.009]
  - - [4096, 2048, 1, 128, 4096, 4096, 128, 128]
    - [19, 0.002]
  - - [4096, 2048, 1, 256, 4096, 4096, 256, 256]
    - [19, 0.003]
  - - [4096, 2048, 1, 512, 4096, 4096, 512, 512]
    - [42, 0.005]
  - - [4096, 2048, 1, 1024, 4096, 4096, 1024, 1024]
    - [24, 0.006]
  - - [4096, 2048, 1, 2048, 4096, 4096, 2048, 2048]
    - [29, 0.007]
  - - [4096, 2048, 1, 4096, 4096, 4096, 4096, 4096]
    - [26, 0.008]
  - - [4096, 2048, 1, 8192, 4096, 4096, 8192, 8192]
    - [27, 0.009]
  - - [4096, 4096, 1, 128, 4096, 4096, 128, 128]
    - [13, 0.003]
  - - [4096, 4096, 1, 256, 4096, 4096, 256, 256]
    - [37, 0.004]
  - - [4096, 4096, 1, 512, 4096, 4096, 512, 512]
    - [42, 0.005]
  - - [4096, 4096, 1, 1024, 4096, 4096, 1024, 1024]
    - [43, 0.007]
  - - [4096, 4096, 1, 2048, 4096, 4096, 2048, 2048]
    - [28, 0.008]
  - - [4096, 4096, 1, 4096, 4096, 4096, 4096, 4096]
    - [30, 0.009]
  - - [4096, 4096, 1, 8192, 4096, 4096, 8192, 8192]
    - [40, 0.009]
  - - [4096, 8192, 1, 128, 4096, 4096, 128, 128]
    - [15, 0.003]
  - - [4096, 8192, 1, 256, 4096, 4096, 256, 256]
    - [40, 0.004]
  - - [4096, 8192, 1, 512, 4096, 4096, 512, 512]
    - [26, 0.005]
  - - [4096, 8192, 1, 1024, 4096, 4096, 1024, 1024]
    - [40, 0.007]
  - - [4096, 8192, 1, 2048, 4096, 4096, 2048, 2048]
    - [40, 0.008]
  - - [4096, 8192, 1, 4096, 4096, 4096, 4096, 4096]
    - [29, 0.009]
  - - [4096, 8192, 1, 8192, 4096, 4096, 8192, 8192]
    - [40, 0.009]
  - - [8192, 128, 1, 128, 8192, 8192, 128, 128]
    - [48, 0.001]
  - - [8192, 128, 1, 256, 8192, 8192, 256, 256]
    - [48, 0.002]
  - - [8192, 128, 1, 512, 8192, 8192, 512, 512]
    - [49, 0.004]
  - - [8192, 128, 1, 1024, 8192, 8192, 1024, 1024]
    - [45, 0.004]
  - - [8192, 128, 1, 2048, 8192, 8192, 2048, 2048]
    - [44, 0.005]
  - - [8192, 128, 1, 4096, 8192, 8192, 4096, 4096]
    - [54, 0.006]
  - - [8192, 128, 1, 8192, 8192, 8192, 8192, 8192]
    - [38, 0.007]
  - - [8192, 256, 1, 128, 8192, 8192, 128, 128]
    - [16, 0.002]
  - - [8192, 256, 1, 256, 8192, 8192, 256, 256]
    - [19, 0.003]
  - - [8192, 256, 1, 512, 8192, 8192, 512, 512]
    - [40, 0.004]
  - - [8192, 256, 1, 1024, 8192, 8192, 1024, 1024]
    - [40, 0.005]
  - - [8192, 256, 1, 2048, 8192, 8192, 2048, 2048]
    - [23, 0.006]
  - - [8192, 256, 1, 4096, 8192, 8192, 4096, 4096]
    - [22, 0.008]
  - - [8192, 256, 1, 8192, 8192, 8192, 8192, 8192]
    - [23, 0.008]
  - - [8192, 512, 1, 128, 8192, 8192, 128, 128]
    - [2, 0.002]
  - - [8192, 512, 1, 256, 8192, 8192, 256, 256]
    - [8, 0.003]
  - - [8192, 512, 1, 512, 8192, 8192, 512, 512]
    - [4, 0.005]
  - - [8192, 512, 1, 1024, 8192, 8192, 1024, 1024]
    - [20, 0.006]
  - - [8192, 512, 1, 2048, 8192, 8192, 2048, 2048]
    - [23, 0.007]
  - - [8192, 512, 1, 4096, 8192, 8192, 4096, 4096]
    - [23, 0.008]
  - - [8192, 512, 1, 8192, 8192, 8192, 8192, 8192]
    - [21, 0.009]
  - - [8192, 1024, 1, 128, 8192, 8192, 128, 128]
    - [13, 0.002]
  - - [8192, 1024, 1, 256, 8192, 8192, 256, 256]
    - [61, 0.003]
  - - [8192, 1024, 1, 512, 8192, 8192, 512, 512]
    - [36, 0.005]
  - - [8192, 1024, 1, 1024, 8192, 8192, 1024, 1024]
    - [24, 0.006]
  - - [8192, 1024, 1, 2048, 8192, 8192, 2048, 2048]
    - [26, 0.007]
  - - [8192, 1024, 1, 4096, 8192, 8192, 4096, 4096]
    - [25, 0.008]
  - - [8192, 1024, 1, 8192, 8192, 8192, 8192, 8192]
    - [27, 0.009]
  - - [8192, 2048, 1, 128, 8192, 8192, 128, 128]
    - [13, 0.003]
  - - [8192, 2048, 1, 256, 8192, 8192, 256, 256]
    - [19, 0.004]
  - - [8192, 2048, 1, 512, 8192, 8192, 512, 512]
    - [7, 0.005]
  - - [8192, 2048, 1, 1024, 8192, 8192, 1024, 1024]
    - [28, 0.007]
  - - [8192, 2048, 1, 2048, 8192, 8192, 2048, 2048]
    - [43, 0.008]
  - - [8192, 2048, 1, 4096, 8192, 8192, 4096, 4096]
    - [25, 0.009]
  - - [8192, 2048, 1, 8192, 8192, 8192, 8192, 8192]
    - [40, 0.009]
  - - [8192, 4096, 1, 128, 8192, 8192, 128, 128]
    - [12, 0.003]
  - - [8192, 4096, 1, 256, 8192, 8192, 256, 256]
    - [36, 0.004]
  - - [8192, 4096, 1, 512, 8192, 8192, 512, 512]
    - [28, 0.005]
  - - [8192, 4096, 1, 1024, 8192, 8192, 1024, 1024]
    - [28, 0.007]
  - - [8192, 4096, 1, 2048, 8192, 8192, 2048, 2048]
    - [40, 0.008]
  - - [8192, 4096, 1, 4096, 8192, 8192, 4096, 4096]
    - [29, 0.009]
  - - [8192, 4096, 1, 8192, 8192, 8192, 8192, 8192]
    - [42, 0.009]
  - - [8192, 8192, 1, 128, 8192, 8192, 128, 128]
    - [3, 0.002]
  - - [8192, 8192, 1, 256, 8192, 8192, 256, 256]
    - [6, 0.004]
  - - [8192, 8192, 1, 512, 8192, 8192, 512, 512]
    - [7, 0.005]
  - - [8192, 8192, 1, 1024, 8192, 8192, 1024, 1024]
    - [40, 0.007]
  - - [8192, 8192, 1, 2048, 8192, 8192, 2048, 2048]
    - [40, 0.008]
  - - [8192, 8192, 1, 4096, 8192, 8192, 4096, 4096]
    - [42, 0.009]
  - - [8192, 8192, 1, 8192, 8192, 8192, 8192, 8192]
    - [40, 0.01]
  - - [1, 1, 1, 32, 1, 1, 32, 32]
    - [115, 0.0]
- null
- null
- DeviceEfficiency
- GridBased
