library/src/amd_detail/rocblaslt/src/Tensile/Logic/streamk/gfx942_80cu/aquavanjaram942_Cijk_Alik_Bljk_HHS_BH_UserArgs.yaml
- {MinimumRequiredVersion: 4.33.0}
- aquavanjaram942
- {Architecture: gfx942, CUCount: 80}
- [Device 0049, Device 0050]
    SolutionIndex: 0
    SolutionNameMin: Cijk_Alik_Bljk_HHS_BH_UserArgs_MT256x64x32_MI16x16x1_SN_LDSB1_CLR1_GSU0_GSUC0_GSUWGMRR0_K1_LBSPPA512_LBSPPB128_MIWT8_2_PLR1_SU32_SUM0_SUS256_SKXCCM0_VWA8_VWB1_WGM1_WGMXCC1_WGMXCCGn1
    SolutionIndex: 1
    SolutionNameMin: Cijk_Alik_Bljk_HHS_BH_UserArgs_MT256x64x32_MI16x16x1_SN_LDSB1_CLR1_GSU0_GSUC0_GSUWGMRR0_K1_LBSPPA512_LBSPPB128_MIWT8_2_PLR1_SU32_SUM0_SUS256_SKXCCM0_VWA8_VWB2_WGM1_WGMXCC1_WGMXCCGn1
    SolutionIndex: 2
    SolutionNameMin: Cijk_Alik_Bljk_HHS_BH_UserArgs_MT128x128x32_MI16x16x1_SN_LDSB1_CLR1_GSU0_GSUC0_GSUWGMRR0_K1_LBSPPA256_LBSPPB128_MIWT4_4_PLR1_SU32_SUM0_SUS256_SKXCCM0_VWA4_VWB1_WGM1_WGMXCC1_WGMXCCGn1
    SolutionIndex: 3
    SolutionNameMin: Cijk_Alik_Bljk_HHS_BH_UserArgs_MT128x128x32_MI16x16x1_SN_LDSB1_CLR1_GSU0_GSUC0_GSUWGMRR0_K1_LBSPPA128_LBSPPB128_MIWT4_4_PLR1_SU32_SUM0_SUS256_SKXCCM0_VWA2_VWB2_WGM1_WGMXCC1_WGMXCCGn1
    SolutionIndex: 4
    SolutionNameMin: Cijk_Alik_Bljk_HHS_BH_UserArgs_MT128x128x32_MI16x16x1_SN_LDSB1_CLR1_GSU0_GSUC0_GSUWGMRR0_K1_LBSPPA128_LBSPPB128_MIWT4_4_PLR1_SU32_SUM0_SUS256_SKXCCM0_VWA2_VWB2_WGM2_WGMXCC1_WGMXCCGn1
    SolutionIndex: 5
    SolutionNameMin: Cijk_Alik_Bljk_HHS_BH_UserArgs_MT128x128x64_MI16x16x1_SN_LDSB1_CLR1_GSU0_GSUC0_GSUWGMRR0_K1_LBSPPA256_LBSPPB128_MIWT4_4_PLR1_SU32_SUM0_SUS256_SKXCCM0_VWA2_VWB1_WGM1_WGMXCC1_WGMXCCGn1
    SolutionIndex: 6
    SolutionNameMin: Cijk_Alik_Bljk_HHS_BH_UserArgs_MT128x128x64_MI16x16x1_SN_LDSB1_CLR1_GSU0_GSUC0_GSUWGMRR0_K1_LBSPPA512_LBSPPB128_MIWT4_4_PLR1_SU32_SUM0_SUS256_SKXCCM0_VWA4_VWB1_WGM1_WGMXCC1_WGMXCCGn1
    SolutionIndex: 7
    SolutionNameMin: Cijk_Alik_Bljk_HHS_BH_UserArgs_MT128x128x64_MI16x16x1_SN_LDSB1_CLR1_GSU0_GSUC0_GSUWGMRR0_K1_LBSPPA512_LBSPPB256_MIWT4_4_PLR1_SU32_SUM0_SUS256_SKXCCM0_VWA4_VWB2_WGM1_WGMXCC1_WGMXCCGn1
    SolutionIndex: 8
    SolutionNameMin: Cijk_Alik_Bljk_HHS_BH_UserArgs_MT128x128x64_MI16x16x1_SN_LDSB1_CLR1_GSU0_GSUC0_GSUWGMRR0_K1_LBSPPA512_LBSPPB512_MIWT4_4_PLR1_SU32_SUM0_SUS256_SKXCCM0_VWA4_VWB4_WGM1_WGMXCC1_WGMXCCGn1
    SolutionIndex: 9
    SolutionNameMin: Cijk_Alik_Bljk_HHS_BH_UserArgs_MT128x128x64_MI16x16x1_SN_LDSB1_CLR1_GSU0_GSUC0_GSUWGMRR0_K1_LBSPPA256_LBSPPB128_MIWT4_4_PLR1_SU32_SUM0_SUS256_SKXCCM0_VWA2_VWB1_WGM2_WGMXCC1_WGMXCCGn1
    SolutionIndex: 10
    SolutionNameMin: Cijk_Alik_Bljk_HHS_BH_UserArgs_MT128x128x64_MI16x16x1_SN_LDSB1_CLR1_GSU0_GSUC0_GSUWGMRR0_K1_LBSPPA512_LBSPPB128_MIWT4_4_PLR1_SU32_SUM0_SUS256_SKXCCM0_VWA4_VWB1_WGM2_WGMXCC1_WGMXCCGn1
    SolutionIndex: 11
    SolutionNameMin: Cijk_Alik_Bljk_HHS_BH_UserArgs_MT128x128x64_MI16x16x1_SN_LDSB1_CLR1_GSU0_GSUC0_GSUWGMRR0_K1_LBSPPA512_LBSPPB256_MIWT4_4_PLR1_SU32_SUM0_SUS256_SKXCCM0_VWA4_VWB2_WGM2_WGMXCC1_WGMXCCGn1
    SolutionIndex: 12
    SolutionNameMin: Cijk_Alik_Bljk_HHS_BH_UserArgs_MT128x128x64_MI16x16x1_SN_LDSB1_CLR1_GSU0_GSUC0_GSUWGMRR0_K1_LBSPPA512_LBSPPB512_MIWT4_4_PLR1_SU32_SUM0_SUS256_SKXCCM0_VWA4_VWB4_WGM2_WGMXCC1_WGMXCCGn1
    SolutionIndex: 13
    SolutionNameMin: Cijk_Alik_Bljk_HHS_BH_UserArgs_MT128x128x64_MI16x16x1_SN_LDSB1_CLR1_GSU0_GSUC0_GSUWGMRR0_K1_LBSPPA512_LBSPPB128_MIWT4_4_PLR1_SU32_SUM0_SUS256_SKXCCM0_VWA4_VWB1_WGM4_WGMXCC1_WGMXCCGn1
    SolutionIndex: 14
    SolutionNameMin: Cijk_Alik_Bljk_HHS_BH_UserArgs_MT128x128x64_MI16x16x1_SN_LDSB1_CLR1_GSU0_GSUC0_GSUWGMRR0_K1_LBSPPA512_LBSPPB256_MIWT4_4_PLR1_SU32_SUM0_SUS256_SKXCCM0_VWA4_VWB2_WGM4_WGMXCC1_WGMXCCGn1
    SolutionIndex: 15
    SolutionNameMin: Cijk_Alik_Bljk_HHS_BH_UserArgs_MT128x128x64_MI16x16x1_SN_LDSB1_CLR1_GSU0_GSUC0_GSUWGMRR0_K1_LBSPPA256_LBSPPB512_MIWT4_4_PLR1_SU32_SUM0_SUS256_SKXCCM0_VWA2_VWB4_WGM4_WGMXCC1_WGMXCCGn1
    SolutionIndex: 16
    SolutionNameMin: Cijk_Alik_Bljk_HHS_BH_UserArgs_MT128x128x64_MI16x16x1_SN_LDSB1_CLR1_GSU0_GSUC0_GSUWGMRR0_K1_LBSPPA512_LBSPPB512_MIWT4_4_PLR1_SU32_SUM0_SUS256_SKXCCM0_VWA4_VWB4_WGM4_WGMXCC1_WGMXCCGn1
    SolutionIndex: 17
    SolutionNameMin: Cijk_Alik_Bljk_HHS_BH_UserArgs_MT64x128x64_MI16x16x1_SN_LDSB1_CLR1_GSU0_GSUC0_GSUWGMRR0_K1_LBSPPA256_LBSPPB256_MIWT2_4_PLR1_SU32_SUM0_SUS256_SKXCCM0_VWA2_VWB2_WGM1_WGMXCC1_WGMXCCGn1
    SolutionIndex: 18
    SolutionNameMin: Cijk_Alik_Bljk_HHS_BH_UserArgs_MT64x128x64_MI16x16x1_SN_LDSB1_CLR1_GSU0_GSUC0_GSUWGMRR0_K1_LBSPPA256_LBSPPB512_MIWT2_4_PLR1_SU32_SUM0_SUS256_SKXCCM0_VWA2_VWB4_WGM1_WGMXCC1_WGMXCCGn1
    SolutionIndex: 19
    SolutionNameMin: Cijk_Alik_Bljk_HHS_BH_UserArgs_MT128x64x64_MI16x16x1_SN_LDSB1_CLR1_GSU0_GSUC0_GSUWGMRR0_K1_LBSPPA256_LBSPPB128_MIWT4_2_PLR1_SU32_SUM0_SUS256_SKXCCM0_VWA2_VWB1_WGM1_WGMXCC1_WGMXCCGn1
    SolutionIndex: 20
    SolutionNameMin: Cijk_Alik_Bljk_HHS_BH_UserArgs_MT128x64x64_MI16x16x1_SN_LDSB1_CLR1_GSU0_GSUC0_GSUWGMRR0_K1_LBSPPA512_LBSPPB128_MIWT4_2_PLR1_SU32_SUM0_SUS256_SKXCCM0_VWA4_VWB1_WGM1_WGMXCC1_WGMXCCGn1
    SolutionIndex: 21
    SolutionNameMin: Cijk_Alik_Bljk_HHS_BH_UserArgs_MT128x64x64_MI16x16x1_SN_LDSB1_CLR1_GSU0_GSUC0_GSUWGMRR0_K1_LBSPPA256_LBSPPB256_MIWT4_2_PLR1_SU32_SUM0_SUS256_SKXCCM0_VWA2_VWB2_WGM1_WGMXCC1_WGMXCCGn1
    SolutionIndex: 22
    SolutionNameMin: Cijk_Alik_Bljk_HHS_BH_UserArgs_MT128x64x64_MI16x16x1_SN_LDSB1_CLR1_GSU0_GSUC0_GSUWGMRR0_K1_LBSPPA512_LBSPPB256_MIWT4_2_PLR1_SU32_SUM0_SUS256_SKXCCM0_VWA4_VWB2_WGM1_WGMXCC1_WGMXCCGn1
    SolutionIndex: 23
    SolutionNameMin: Cijk_Alik_Bljk_HHS_BH_UserArgs_MT128x64x64_MI16x16x1_SN_LDSB1_CLR1_GSU0_GSUC0_GSUWGMRR0_K1_LBSPPA512_LBSPPB128_MIWT4_2_PLR2_SU32_SUM0_SUS256_SKXCCM0_VWA4_VWB1_WGM1_WGMXCC1_WGMXCCGn1
    SolutionIndex: 24
    SolutionNameMin: Cijk_Alik_Bljk_HHS_BH_UserArgs_MT128x64x64_MI16x16x1_SN_LDSB1_CLR1_GSU0_GSUC0_GSUWGMRR0_K1_LBSPPA512_LBSPPB256_MIWT4_2_PLR2_SU32_SUM0_SUS256_SKXCCM0_VWA4_VWB2_WGM1_WGMXCC1_WGMXCCGn1
    SolutionIndex: 25
    SolutionNameMin: Cijk_Alik_Bljk_HHS_BH_UserArgs_MT128x64x64_MI16x16x1_SN_LDSB1_CLR1_GSU0_GSUC0_GSUWGMRR0_K1_LBSPPA512_LBSPPB128_MIWT4_2_PLR1_SU32_SUM0_SUS256_SKXCCM0_VWA4_VWB1_WGM2_WGMXCC1_WGMXCCGn1
    SolutionIndex: 26
    SolutionNameMin: Cijk_Alik_Bljk_HHS_BH_UserArgs_MT128x64x64_MI16x16x1_SN_LDSB1_CLR1_GSU0_GSUC0_GSUWGMRR0_K1_LBSPPA512_LBSPPB256_MIWT4_2_PLR1_SU32_SUM0_SUS256_SKXCCM0_VWA4_VWB2_WGM4_WGMXCC1_WGMXCCGn1
    SolutionIndex: 27
    SolutionNameMin: Cijk_Alik_Bljk_HHS_BH_UserArgs_MT64x64x64_MI16x16x1_SN_LDSB1_CLR1_GSU0_GSUC0_GSUWGMRR0_K1_LBSPPA256_LBSPPB128_MIWT2_2_PLR1_SU32_SUM0_SUS256_SKXCCM0_VWA2_VWB1_WGM1_WGMXCC1_WGMXCCGn1
    SolutionIndex: 28
    SolutionNameMin: Cijk_Alik_Bljk_HHS_BH_UserArgs_MT64x64x64_MI16x16x1_SN_LDSB1_CLR1_GSU0_GSUC0_GSUWGMRR0_K1_LBSPPA256_LBSPPB256_MIWT2_2_PLR1_SU32_SUM0_SUS256_SKXCCM0_VWA2_VWB2_WGM1_WGMXCC1_WGMXCCGn1
    SolutionIndex: 29
    SolutionNameMin: Cijk_Alik_Bljk_HHS_BH_UserArgs_MT64x64x64_MI16x16x1_SN_LDSB1_CLR1_GSU0_GSUC0_GSUWGMRR0_K1_LBSPPA256_LBSPPB256_MIWT2_2_PLR1_SU32_SUM0_SUS256_SKXCCM0_VWA2_VWB2_WGM2_WGMXCC1_WGMXCCGn1
    SolutionIndex: 30
    SolutionNameMin: Cijk_Alik_Bljk_HHS_BH_UserArgs_MT32x64x64_MI16x16x1_SN_LDSB0_CLR1_GSU0_GSUC0_GSUWGMRR0_K1_LBSPPA128_LBSPPB128_MIWT1_2_PLR1_SU32_SUM0_SUS256_SKXCCM0_VWA1_VWB1_WGM1_WGMXCC1_WGMXCCGn1
    SolutionIndex: 31
    SolutionNameMin: Cijk_Alik_Bljk_HHS_BH_UserArgs_MT64x32x64_MI16x16x1_SN_LDSB0_CLR1_GSU0_GSUC0_GSUWGMRR0_K1_LBSPPA256_LBSPPB128_MIWT2_1_PLR1_SU32_SUM0_SUS256_SKXCCM0_VWA2_VWB1_WGM1_WGMXCC1_WGMXCCGn1
    SolutionIndex: 32
    SolutionNameMin: Cijk_Alik_Bljk_HHS_BH_UserArgs_MT64x32x64_MI16x16x1_SN_LDSB0_CLR1_GSU0_GSUC0_GSUWGMRR0_K1_LBSPPA256_LBSPPB128_MIWT2_1_PLR2_SU32_SUM0_SUS256_SKXCCM0_VWA2_VWB1_WGM1_WGMXCC1_WGMXCCGn1
    SolutionIndex: 33
    SolutionNameMin: Cijk_Alik_Bljk_HHS_BH_UserArgs_MT64x64x128_MI16x16x1_SN_LDSB1_CLR1_GSU0_GSUC0_GSUWGMRR0_K1_LBSPPA256_LBSPPB256_MIWT2_2_PLR1_SU32_SUM0_SUS256_SKXCCM0_VWA1_VWB1_WGM1_WGMXCC1_WGMXCCGn1
    SolutionIndex: 34
    SolutionNameMin: Cijk_Alik_Bljk_HHS_BH_UserArgs_MT64x64x128_MI16x16x1_SN_LDSB1_CLR1_GSU0_GSUC0_GSUWGMRR0_K1_LBSPPA512_LBSPPB256_MIWT2_2_PLR1_SU32_SUM0_SUS256_SKXCCM0_VWA2_VWB1_WGM1_WGMXCC1_WGMXCCGn1
    SolutionIndex: 35
    SolutionNameMin: Cijk_Alik_Bljk_HHS_BH_UserArgs_MT64x64x128_MI16x16x1_SN_LDSB1_CLR1_GSU0_GSUC0_GSUWGMRR0_K1_LBSPPA512_LBSPPB256_MIWT2_2_PLR2_SU32_SUM0_SUS256_SKXCCM0_VWA2_VWB1_WGM1_WGMXCC1_WGMXCCGn1
    SolutionIndex: 36
    SolutionNameMin: Cijk_Alik_Bljk_HHS_BH_UserArgs_MT32x64x128_MI16x16x1_SN_LDSB1_CLR1_GSU0_GSUC0_GSUWGMRR0_K1_LBSPPA256_LBSPPB512_MIWT1_2_PLR2_SU32_SUM0_SUS256_SKXCCM0_VWA1_VWB2_WGM1_WGMXCC1_WGMXCCGn1
    SolutionIndex: 37
    SolutionNameMin: Cijk_Alik_Bljk_HHS_BH_UserArgs_MT64x32x128_MI16x16x1_SN_LDSB1_CLR1_GSU0_GSUC0_GSUWGMRR0_K1_LBSPPA512_LBSPPB256_MIWT2_1_PLR1_SU32_SUM0_SUS256_SKXCCM0_VWA2_VWB1_WGM1_WGMXCC1_WGMXCCGn1
    SolutionIndex: 38
    SolutionNameMin: Cijk_Alik_Bljk_HHS_BH_UserArgs_MT64x32x128_MI16x16x1_SN_LDSB1_CLR1_GSU0_GSUC0_GSUWGMRR0_K1_LBSPPA512_LBSPPB256_MIWT2_1_PLR2_SU32_SUM0_SUS256_SKXCCM0_VWA2_VWB1_WGM1_WGMXCC1_WGMXCCGn1
    SolutionIndex: 39
    SolutionNameMin: Cijk_Alik_Bljk_HHS_BH_UserArgs_MT32x32x128_MI16x16x1_SN_LDSB1_CLR1_GSU0_GSUC0_GSUWGMRR0_K1_LBSPPA256_LBSPPB256_MIWT1_1_PLR1_SU32_SUM0_SUS256_SKXCCM0_VWA1_VWB1_WGM1_WGMXCC1_WGMXCCGn1
    SolutionIndex: 40
    SolutionNameMin: Cijk_Alik_Bljk_HHS_BH_UserArgs_MT32x32x128_MI16x16x1_SN_LDSB1_CLR1_GSU0_GSUC0_GSUWGMRR0_K1_LBSPPA256_LBSPPB256_MIWT1_1_PLR2_SU32_SUM0_SUS256_SKXCCM0_VWA1_VWB1_WGM1_WGMXCC1_WGMXCCGn1
    SolutionIndex: 41
    SolutionNameMin: Cijk_Alik_Bljk_HHS_BH_UserArgs_MT256x64x32_MI16x16x1_SN_LDSB1_CLR1_GSU0_GSUC0_GSUWGMRR0_K1_LBSPPA512_LBSPPB128_MIWT8_2_PLR1_SU32_SUM0_SUS256_SKXCCM4_VWA8_VWB2_WGM1_WGMXCC1_WGMXCCGn1
    SolutionIndex: 42
    SolutionNameMin: Cijk_Alik_Bljk_HHS_BH_UserArgs_MT128x128x32_MI16x16x1_SN_LDSB1_CLR1_GSU0_GSUC0_GSUWGMRR0_K1_LBSPPA128_LBSPPB128_MIWT4_4_PLR1_SU32_SUM0_SUS256_SKXCCM4_VWA2_VWB2_WGM1_WGMXCC1_WGMXCCGn1
    SolutionIndex: 43
    SolutionNameMin: Cijk_Alik_Bljk_HHS_BH_UserArgs_MT128x128x32_MI16x16x1_SN_LDSB1_CLR1_GSU0_GSUC0_GSUWGMRR0_K1_LBSPPA128_LBSPPB256_MIWT4_4_PLR1_SU32_SUM0_SUS256_SKXCCM4_VWA2_VWB4_WGM1_WGMXCC1_WGMXCCGn1
    SolutionIndex: 44
    SolutionNameMin: Cijk_Alik_Bljk_HHS_BH_UserArgs_MT128x128x32_MI16x16x1_SN_LDSB1_CLR1_GSU0_GSUC0_GSUWGMRR0_K1_LBSPPA256_LBSPPB256_MIWT4_4_PLR1_SU32_SUM0_SUS256_SKXCCM4_VWA4_VWB4_WGM1_WGMXCC1_WGMXCCGn1
    SolutionIndex: 45
    SolutionNameMin: Cijk_Alik_Bljk_HHS_BH_UserArgs_MT128x128x32_MI16x16x1_SN_LDSB1_CLR1_GSU0_GSUC0_GSUWGMRR0_K1_LBSPPA128_LBSPPB128_MIWT4_4_PLR1_SU32_SUM0_SUS256_SKXCCM4_VWA2_VWB2_WGM2_WGMXCC1_WGMXCCGn1
    SolutionIndex: 46
    SolutionNameMin: Cijk_Alik_Bljk_HHS_BH_UserArgs_MT128x128x32_MI16x16x1_SN_LDSB1_CLR1_GSU0_GSUC0_GSUWGMRR0_K1_LBSPPA256_LBSPPB128_MIWT4_4_PLR1_SU32_SUM0_SUS256_SKXCCM4_VWA4_VWB2_WGM2_WGMXCC1_WGMXCCGn1
    SolutionIndex: 47
    SolutionNameMin: Cijk_Alik_Bljk_HHS_BH_UserArgs_MT128x128x32_MI16x16x1_SN_LDSB1_CLR1_GSU0_GSUC0_GSUWGMRR0_K1_LBSPPA128_LBSPPB128_MIWT4_4_PLR1_SU32_SUM0_SUS256_SKXCCM4_VWA2_VWB1_WGM4_WGMXCC1_WGMXCCGn1
    SolutionIndex: 48
    SolutionNameMin: Cijk_Alik_Bljk_HHS_BH_UserArgs_MT128x128x32_MI16x16x1_SN_LDSB1_CLR1_GSU0_GSUC0_GSUWGMRR0_K1_LBSPPA256_LBSPPB128_MIWT4_4_PLR1_SU32_SUM0_SUS256_SKXCCM4_VWA4_VWB1_WGM4_WGMXCC1_WGMXCCGn1
    SolutionIndex: 49
    SolutionNameMin: Cijk_Alik_Bljk_HHS_BH_UserArgs_MT128x128x32_MI16x16x1_SN_LDSB1_CLR1_GSU0_GSUC0_GSUWGMRR0_K1_LBSPPA128_LBSPPB128_MIWT4_4_PLR1_SU32_SUM0_SUS256_SKXCCM4_VWA2_VWB2_WGM4_WGMXCC1_WGMXCCGn1
    SolutionIndex: 50
    SolutionNameMin: Cijk_Alik_Bljk_HHS_BH_UserArgs_MT128x128x32_MI16x16x1_SN_LDSB1_CLR1_GSU0_GSUC0_GSUWGMRR0_K1_LBSPPA256_LBSPPB128_MIWT4_4_PLR1_SU32_SUM0_SUS256_SKXCCM4_VWA4_VWB2_WGM4_WGMXCC1_WGMXCCGn1
    SolutionIndex: 51
    SolutionNameMin: Cijk_Alik_Bljk_HHS_BH_UserArgs_MT128x128x32_MI16x16x1_SN_LDSB1_CLR1_GSU0_GSUC0_GSUWGMRR0_K1_LBSPPA128_LBSPPB256_MIWT4_4_PLR1_SU32_SUM0_SUS256_SKXCCM4_VWA2_VWB4_WGM4_WGMXCC1_WGMXCCGn1
    SolutionIndex: 52
    SolutionNameMin: Cijk_Alik_Bljk_HHS_BH_UserArgs_MT128x128x32_MI16x16x1_SN_LDSB1_CLR1_GSU0_GSUC0_GSUWGMRR0_K1_LBSPPA256_LBSPPB256_MIWT4_4_PLR1_SU32_SUM0_SUS256_SKXCCM4_VWA4_VWB4_WGM4_WGMXCC1_WGMXCCGn1
    SolutionIndex: 53
    SolutionNameMin: Cijk_Alik_Bljk_HHS_BH_UserArgs_MT128x64x32_MI16x16x1_SN_LDSB0_CLR1_GSU0_GSUC0_GSUWGMRR0_K1_LBSPPA256_LBSPPB128_MIWT4_2_PLR1_SU32_SUM0_SUS256_SKXCCM4_VWA4_VWB2_WGM1_WGMXCC1_WGMXCCGn1
    SolutionIndex: 54
    SolutionNameMin: Cijk_Alik_Bljk_HHS_BH_UserArgs_MT128x64x32_MI16x16x1_SN_LDSB0_CLR1_GSU0_GSUC0_GSUWGMRR0_K1_LBSPPA256_LBSPPB128_MIWT4_2_PLR1_SU32_SUM0_SUS256_SKXCCM4_VWA4_VWB2_WGM2_WGMXCC1_WGMXCCGn1
    SolutionIndex: 55
    SolutionNameMin: Cijk_Alik_Bljk_HHS_BH_UserArgs_MT128x64x32_MI16x16x1_SN_LDSB0_CLR1_GSU0_GSUC0_GSUWGMRR0_K1_LBSPPA256_LBSPPB128_MIWT4_2_PLR1_SU32_SUM0_SUS256_SKXCCM4_VWA4_VWB2_WGM4_WGMXCC1_WGMXCCGn1
    SolutionIndex: 56
    SolutionNameMin: Cijk_Alik_Bljk_HHS_BH_UserArgs_MT32x32x32_MI16x16x1_SN_LDSB0_CLR0_GSU0_GSUC0_GSUWGMRR0_K1_LBSPPA128_LBSPPB128_MIWT1_1_PLR0_SU32_SUM0_SUS256_SKXCCM4_VWA1_VWB1_WGM1_WGMXCC1_WGMXCCGn1
    SolutionIndex: 57
    SolutionNameMin: Cijk_Alik_Bljk_HHS_BH_UserArgs_MT128x128x64_MI16x16x1_SN_LDSB1_CLR1_GSU0_GSUC0_GSUWGMRR0_K1_LBSPPA512_LBSPPB128_MIWT4_4_PLR1_SU32_SUM0_SUS256_SKXCCM4_VWA4_VWB1_WGM1_WGMXCC1_WGMXCCGn1
    SolutionIndex: 58
    SolutionNameMin: Cijk_Alik_Bljk_HHS_BH_UserArgs_MT128x128x64_MI16x16x1_SN_LDSB1_CLR1_GSU0_GSUC0_GSUWGMRR0_K1_LBSPPA256_LBSPPB256_MIWT4_4_PLR1_SU32_SUM0_SUS256_SKXCCM4_VWA2_VWB2_WGM1_WGMXCC1_WGMXCCGn1
    SolutionIndex: 59
    SolutionNameMin: Cijk_Alik_Bljk_HHS_BH_UserArgs_MT128x128x64_MI16x16x1_SN_LDSB1_CLR1_GSU0_GSUC0_GSUWGMRR0_K1_LBSPPA512_LBSPPB256_MIWT4_4_PLR1_SU32_SUM0_SUS256_SKXCCM4_VWA4_VWB2_WGM1_WGMXCC1_WGMXCCGn1
    SolutionIndex: 60
    SolutionNameMin: Cijk_Alik_Bljk_HHS_BH_UserArgs_MT128x128x64_MI16x16x1_SN_LDSB1_CLR1_GSU0_GSUC0_GSUWGMRR0_K1_LBSPPA256_LBSPPB512_MIWT4_4_PLR1_SU32_SUM0_SUS256_SKXCCM4_VWA2_VWB4_WGM1_WGMXCC1_WGMXCCGn1
    SolutionIndex: 61
    SolutionNameMin: Cijk_Alik_Bljk_HHS_BH_UserArgs_MT128x128x64_MI16x16x1_SN_LDSB1_CLR1_GSU0_GSUC0_GSUWGMRR0_K1_LBSPPA512_LBSPPB512_MIWT4_4_PLR1_SU32_SUM0_SUS256_SKXCCM4_VWA4_VWB4_WGM1_WGMXCC1_WGMXCCGn1
    SolutionIndex: 62
    SolutionNameMin: Cijk_Alik_Bljk_HHS_BH_UserArgs_MT128x128x64_MI16x16x1_SN_LDSB1_CLR1_GSU0_GSUC0_GSUWGMRR0_K1_LBSPPA512_LBSPPB128_MIWT4_4_PLR1_SU32_SUM0_SUS256_SKXCCM4_VWA4_VWB1_WGM2_WGMXCC1_WGMXCCGn1
    SolutionIndex: 63
    SolutionNameMin: Cijk_Alik_Bljk_HHS_BH_UserArgs_MT128x128x64_MI16x16x1_SN_LDSB1_CLR1_GSU0_GSUC0_GSUWGMRR0_K1_LBSPPA256_LBSPPB256_MIWT4_4_PLR1_SU32_SUM0_SUS256_SKXCCM4_VWA2_VWB2_WGM2_WGMXCC1_WGMXCCGn1
    SolutionIndex: 64
    SolutionNameMin: Cijk_Alik_Bljk_HHS_BH_UserArgs_MT128x128x64_MI16x16x1_SN_LDSB1_CLR1_GSU0_GSUC0_GSUWGMRR0_K1_LBSPPA512_LBSPPB256_MIWT4_4_PLR1_SU32_SUM0_SUS256_SKXCCM4_VWA4_VWB2_WGM2_WGMXCC1_WGMXCCGn1
    SolutionIndex: 65
    SolutionNameMin: Cijk_Alik_Bljk_HHS_BH_UserArgs_MT128x128x64_MI16x16x1_SN_LDSB1_CLR1_GSU0_GSUC0_GSUWGMRR0_K1_LBSPPA512_LBSPPB512_MIWT4_4_PLR1_SU32_SUM0_SUS256_SKXCCM4_VWA4_VWB4_WGM2_WGMXCC1_WGMXCCGn1
    SolutionIndex: 66
    SolutionNameMin: Cijk_Alik_Bljk_HHS_BH_UserArgs_MT128x128x64_MI16x16x1_SN_LDSB1_CLR1_GSU0_GSUC0_GSUWGMRR0_K1_LBSPPA256_LBSPPB128_MIWT4_4_PLR1_SU32_SUM0_SUS256_SKXCCM4_VWA2_VWB1_WGM4_WGMXCC1_WGMXCCGn1
    SolutionIndex: 67
    SolutionNameMin: Cijk_Alik_Bljk_HHS_BH_UserArgs_MT128x128x64_MI16x16x1_SN_LDSB1_CLR1_GSU0_GSUC0_GSUWGMRR0_K1_LBSPPA512_LBSPPB128_MIWT4_4_PLR1_SU32_SUM0_SUS256_SKXCCM4_VWA4_VWB1_WGM4_WGMXCC1_WGMXCCGn1
    SolutionIndex: 68
    SolutionNameMin: Cijk_Alik_Bljk_HHS_BH_UserArgs_MT128x128x64_MI16x16x1_SN_LDSB1_CLR1_GSU0_GSUC0_GSUWGMRR0_K1_LBSPPA256_LBSPPB256_MIWT4_4_PLR1_SU32_SUM0_SUS256_SKXCCM4_VWA2_VWB2_WGM4_WGMXCC1_WGMXCCGn1
    SolutionIndex: 69
    SolutionNameMin: Cijk_Alik_Bljk_HHS_BH_UserArgs_MT128x128x64_MI16x16x1_SN_LDSB1_CLR1_GSU0_GSUC0_GSUWGMRR0_K1_LBSPPA512_LBSPPB256_MIWT4_4_PLR1_SU32_SUM0_SUS256_SKXCCM4_VWA4_VWB2_WGM4_WGMXCC1_WGMXCCGn1
    SolutionIndex: 70
    SolutionNameMin: Cijk_Alik_Bljk_HHS_BH_UserArgs_MT128x128x64_MI16x16x1_SN_LDSB1_CLR1_GSU0_GSUC0_GSUWGMRR0_K1_LBSPPA512_LBSPPB512_MIWT4_4_PLR1_SU32_SUM0_SUS256_SKXCCM4_VWA4_VWB4_WGM4_WGMXCC1_WGMXCCGn1
    SolutionIndex: 71
    SolutionNameMin: Cijk_Alik_Bljk_HHS_BH_UserArgs_MT64x128x64_MI16x16x1_SN_LDSB1_CLR1_GSU0_GSUC0_GSUWGMRR0_K1_LBSPPA128_LBSPPB128_MIWT2_4_PLR1_SU32_SUM0_SUS256_SKXCCM4_VWA1_VWB1_WGM1_WGMXCC1_WGMXCCGn1
    SolutionIndex: 72
    SolutionNameMin: Cijk_Alik_Bljk_HHS_BH_UserArgs_MT64x128x64_MI16x16x1_SN_LDSB1_CLR1_GSU0_GSUC0_GSUWGMRR0_K1_LBSPPA256_LBSPPB128_MIWT2_4_PLR1_SU32_SUM0_SUS256_SKXCCM4_VWA2_VWB1_WGM1_WGMXCC1_WGMXCCGn1
    SolutionIndex: 73
    SolutionNameMin: Cijk_Alik_Bljk_HHS_BH_UserArgs_MT64x128x64_MI16x16x1_SN_LDSB1_CLR1_GSU0_GSUC0_GSUWGMRR0_K1_LBSPPA256_LBSPPB256_MIWT2_4_PLR1_SU32_SUM0_SUS256_SKXCCM4_VWA2_VWB2_WGM1_WGMXCC1_WGMXCCGn1
    SolutionIndex: 74
    SolutionNameMin: Cijk_Alik_Bljk_HHS_BH_UserArgs_MT64x128x64_MI16x16x1_SN_LDSB1_CLR1_GSU0_GSUC0_GSUWGMRR0_K1_LBSPPA256_LBSPPB512_MIWT2_4_PLR1_SU32_SUM0_SUS256_SKXCCM4_VWA2_VWB4_WGM1_WGMXCC1_WGMXCCGn1
    SolutionIndex: 75
    SolutionNameMin: Cijk_Alik_Bljk_HHS_BH_UserArgs_MT64x128x64_MI16x16x1_SN_LDSB1_CLR1_GSU0_GSUC0_GSUWGMRR0_K1_LBSPPA256_LBSPPB128_MIWT2_4_PLR1_SU32_SUM0_SUS256_SKXCCM4_VWA2_VWB1_WGM4_WGMXCC1_WGMXCCGn1
    SolutionIndex: 76
    SolutionNameMin: Cijk_Alik_Bljk_HHS_BH_UserArgs_MT64x128x64_MI16x16x1_SN_LDSB1_CLR1_GSU0_GSUC0_GSUWGMRR0_K1_LBSPPA256_LBSPPB256_MIWT2_4_PLR1_SU32_SUM0_SUS256_SKXCCM4_VWA2_VWB2_WGM4_WGMXCC1_WGMXCCGn1
    SolutionIndex: 77
    SolutionNameMin: Cijk_Alik_Bljk_HHS_BH_UserArgs_MT128x64x64_MI16x16x1_SN_LDSB1_CLR1_GSU0_GSUC0_GSUWGMRR0_K1_LBSPPA256_LBSPPB128_MIWT4_2_PLR1_SU32_SUM0_SUS256_SKXCCM4_VWA2_VWB1_WGM1_WGMXCC1_WGMXCCGn1
    SolutionIndex: 78
    SolutionNameMin: Cijk_Alik_Bljk_HHS_BH_UserArgs_MT128x64x64_MI16x16x1_SN_LDSB1_CLR1_GSU0_GSUC0_GSUWGMRR0_K1_LBSPPA512_LBSPPB128_MIWT4_2_PLR1_SU32_SUM0_SUS256_SKXCCM4_VWA4_VWB1_WGM1_WGMXCC1_WGMXCCGn1
    SolutionIndex: 79
    SolutionNameMin: Cijk_Alik_Bljk_HHS_BH_UserArgs_MT128x64x64_MI16x16x1_SN_LDSB1_CLR1_GSU0_GSUC0_GSUWGMRR0_K1_LBSPPA256_LBSPPB256_MIWT4_2_PLR1_SU32_SUM0_SUS256_SKXCCM4_VWA2_VWB2_WGM1_WGMXCC1_WGMXCCGn1
    SolutionIndex: 80
    SolutionNameMin: Cijk_Alik_Bljk_HHS_BH_UserArgs_MT128x64x64_MI16x16x1_SN_LDSB1_CLR1_GSU0_GSUC0_GSUWGMRR0_K1_LBSPPA512_LBSPPB256_MIWT4_2_PLR1_SU32_SUM0_SUS256_SKXCCM4_VWA4_VWB2_WGM1_WGMXCC1_WGMXCCGn1
    SolutionIndex: 81
    SolutionNameMin: Cijk_Alik_Bljk_HHS_BH_UserArgs_MT128x64x64_MI16x16x1_SN_LDSB1_CLR1_GSU0_GSUC0_GSUWGMRR0_K1_LBSPPA256_LBSPPB128_MIWT4_2_PLR2_SU32_SUM0_SUS256_SKXCCM4_VWA2_VWB1_WGM1_WGMXCC1_WGMXCCGn1
    SolutionIndex: 82
    SolutionNameMin: Cijk_Alik_Bljk_HHS_BH_UserArgs_MT128x64x64_MI16x16x1_SN_LDSB1_CLR1_GSU0_GSUC0_GSUWGMRR0_K1_LBSPPA512_LBSPPB128_MIWT4_2_PLR1_SU32_SUM0_SUS256_SKXCCM4_VWA4_VWB1_WGM2_WGMXCC1_WGMXCCGn1
    SolutionIndex: 83
    SolutionNameMin: Cijk_Alik_Bljk_HHS_BH_UserArgs_MT128x64x64_MI16x16x1_SN_LDSB1_CLR1_GSU0_GSUC0_GSUWGMRR0_K1_LBSPPA256_LBSPPB128_MIWT4_2_PLR1_SU32_SUM0_SUS256_SKXCCM4_VWA2_VWB1_WGM4_WGMXCC1_WGMXCCGn1
    SolutionIndex: 84
    SolutionNameMin: Cijk_Alik_Bljk_HHS_BH_UserArgs_MT128x64x64_MI16x16x1_SN_LDSB1_CLR1_GSU0_GSUC0_GSUWGMRR0_K1_LBSPPA512_LBSPPB128_MIWT4_2_PLR1_SU32_SUM0_SUS256_SKXCCM4_VWA4_VWB1_WGM4_WGMXCC1_WGMXCCGn1
    SolutionIndex: 85
    SolutionNameMin: Cijk_Alik_Bljk_HHS_BH_UserArgs_MT128x64x64_MI16x16x1_SN_LDSB1_CLR1_GSU0_GSUC0_GSUWGMRR0_K1_LBSPPA256_LBSPPB256_MIWT4_2_PLR1_SU32_SUM0_SUS256_SKXCCM4_VWA2_VWB2_WGM4_WGMXCC1_WGMXCCGn1
    SolutionIndex: 86
    SolutionNameMin: Cijk_Alik_Bljk_HHS_BH_UserArgs_MT128x64x64_MI16x16x1_SN_LDSB1_CLR1_GSU0_GSUC0_GSUWGMRR0_K1_LBSPPA512_LBSPPB256_MIWT4_2_PLR1_SU32_SUM0_SUS256_SKXCCM4_VWA4_VWB2_WGM4_WGMXCC1_WGMXCCGn1
    SolutionIndex: 87
    SolutionNameMin: Cijk_Alik_Bljk_HHS_BH_UserArgs_MT64x64x64_MI16x16x1_SN_LDSB1_CLR1_GSU0_GSUC0_GSUWGMRR0_K1_LBSPPA128_LBSPPB128_MIWT2_2_PLR1_SU32_SUM0_SUS256_SKXCCM4_VWA1_VWB1_WGM1_WGMXCC1_WGMXCCGn1
    SolutionIndex: 88
    SolutionNameMin: Cijk_Alik_Bljk_HHS_BH_UserArgs_MT64x64x64_MI16x16x1_SN_LDSB1_CLR1_GSU0_GSUC0_GSUWGMRR0_K1_LBSPPA256_LBSPPB128_MIWT2_2_PLR1_SU32_SUM0_SUS256_SKXCCM4_VWA2_VWB1_WGM1_WGMXCC1_WGMXCCGn1
    SolutionIndex: 89
    SolutionNameMin: Cijk_Alik_Bljk_HHS_BH_UserArgs_MT64x64x64_MI16x16x1_SN_LDSB1_CLR1_GSU0_GSUC0_GSUWGMRR0_K1_LBSPPA256_LBSPPB256_MIWT2_2_PLR1_SU32_SUM0_SUS256_SKXCCM4_VWA2_VWB2_WGM1_WGMXCC1_WGMXCCGn1
    SolutionIndex: 90
    SolutionNameMin: Cijk_Alik_Bljk_HHS_BH_UserArgs_MT64x64x64_MI16x16x1_SN_LDSB1_CLR1_GSU0_GSUC0_GSUWGMRR0_K1_LBSPPA256_LBSPPB128_MIWT2_2_PLR1_SU32_SUM0_SUS256_SKXCCM4_VWA2_VWB1_WGM2_WGMXCC1_WGMXCCGn1
    SolutionIndex: 91
    SolutionNameMin: Cijk_Alik_Bljk_HHS_BH_UserArgs_MT64x64x64_MI16x16x1_SN_LDSB1_CLR1_GSU0_GSUC0_GSUWGMRR0_K1_LBSPPA256_LBSPPB256_MIWT2_2_PLR1_SU32_SUM0_SUS256_SKXCCM4_VWA2_VWB2_WGM2_WGMXCC1_WGMXCCGn1
    SolutionIndex: 92
    SolutionNameMin: Cijk_Alik_Bljk_HHS_BH_UserArgs_MT64x64x64_MI16x16x1_SN_LDSB1_CLR1_GSU0_GSUC0_GSUWGMRR0_K1_LBSPPA128_LBSPPB128_MIWT2_2_PLR1_SU32_SUM0_SUS256_SKXCCM4_VWA1_VWB1_WGM4_WGMXCC1_WGMXCCGn1
    SolutionIndex: 93
    SolutionNameMin: Cijk_Alik_Bljk_HHS_BH_UserArgs_MT64x64x64_MI16x16x1_SN_LDSB1_CLR1_GSU0_GSUC0_GSUWGMRR0_K1_LBSPPA256_LBSPPB128_MIWT2_2_PLR1_SU32_SUM0_SUS256_SKXCCM4_VWA2_VWB1_WGM4_WGMXCC1_WGMXCCGn1
    SolutionIndex: 94
    SolutionNameMin: Cijk_Alik_Bljk_HHS_BH_UserArgs_MT64x64x64_MI16x16x1_SN_LDSB1_CLR1_GSU0_GSUC0_GSUWGMRR0_K1_LBSPPA128_LBSPPB256_MIWT2_2_PLR1_SU32_SUM0_SUS256_SKXCCM4_VWA1_VWB2_WGM4_WGMXCC1_WGMXCCGn1
    SolutionIndex: 95
    SolutionNameMin: Cijk_Alik_Bljk_HHS_BH_UserArgs_MT32x64x64_MI16x16x1_SN_LDSB0_CLR1_GSU0_GSUC0_GSUWGMRR0_K1_LBSPPA128_LBSPPB128_MIWT1_2_PLR1_SU32_SUM0_SUS256_SKXCCM4_VWA1_VWB1_WGM1_WGMXCC1_WGMXCCGn1
    SolutionIndex: 96
    SolutionNameMin: Cijk_Alik_Bljk_HHS_BH_UserArgs_MT32x64x64_MI16x16x1_SN_LDSB0_CLR1_GSU0_GSUC0_GSUWGMRR0_K1_LBSPPA128_LBSPPB256_MIWT1_2_PLR1_SU32_SUM0_SUS256_SKXCCM4_VWA1_VWB2_WGM1_WGMXCC1_WGMXCCGn1
    SolutionIndex: 97
    SolutionNameMin: Cijk_Alik_Bljk_HHS_BH_UserArgs_MT64x32x64_MI16x16x1_SN_LDSB0_CLR1_GSU0_GSUC0_GSUWGMRR0_K1_LBSPPA256_LBSPPB128_MIWT2_1_PLR1_SU32_SUM0_SUS256_SKXCCM4_VWA2_VWB1_WGM1_WGMXCC1_WGMXCCGn1
    SolutionIndex: 98
    SolutionNameMin: Cijk_Alik_Bljk_HHS_BH_UserArgs_MT32x32x64_MI16x16x1_SN_LDSB0_CLR1_GSU0_GSUC0_GSUWGMRR0_K1_LBSPPA128_LBSPPB128_MIWT1_1_PLR1_SU32_SUM0_SUS256_SKXCCM4_VWA1_VWB1_WGM1_WGMXCC1_WGMXCCGn1
    SolutionIndex: 99
    SolutionNameMin: Cijk_Alik_Bljk_HHS_BH_UserArgs_MT64x64x128_MI16x16x1_SN_LDSB1_CLR1_GSU0_GSUC0_GSUWGMRR0_K1_LBSPPA512_LBSPPB512_MIWT2_2_PLR2_SU32_SUM0_SUS256_SKXCCM4_VWA2_VWB2_WGM1_WGMXCC1_WGMXCCGn1
    SolutionIndex: 100
    SolutionNameMin: Cijk_Alik_Bljk_HHS_BH_UserArgs_MT32x64x128_MI16x16x1_SN_LDSB1_CLR1_GSU0_GSUC0_GSUWGMRR0_K1_LBSPPA256_LBSPPB256_MIWT1_2_PLR1_SU32_SUM0_SUS256_SKXCCM4_VWA1_VWB1_WGM1_WGMXCC1_WGMXCCGn1
    SolutionIndex: 101
    SolutionNameMin: Cijk_Alik_Bljk_HHS_BH_UserArgs_MT32x64x128_MI16x16x1_SN_LDSB1_CLR1_GSU0_GSUC0_GSUWGMRR0_K1_LBSPPA256_LBSPPB512_MIWT1_2_PLR1_SU32_SUM0_SUS256_SKXCCM4_VWA1_VWB2_WGM1_WGMXCC1_WGMXCCGn1
    SolutionIndex: 102
    SolutionNameMin: Cijk_Alik_Bljk_HHS_BH_UserArgs_MT64x32x128_MI16x16x1_SN_LDSB1_CLR1_GSU0_GSUC0_GSUWGMRR0_K1_LBSPPA512_LBSPPB256_MIWT2_1_PLR1_SU32_SUM0_SUS256_SKXCCM4_VWA2_VWB1_WGM1_WGMXCC1_WGMXCCGn1
    SolutionIndex: 103
    SolutionNameMin: Cijk_Alik_Bljk_HHS_BH_UserArgs_MT32x32x128_MI16x16x1_SN_LDSB1_CLR1_GSU0_GSUC0_GSUWGMRR0_K1_LBSPPA256_LBSPPB256_MIWT1_1_PLR1_SU32_SUM0_SUS256_SKXCCM4_VWA1_VWB1_WGM1_WGMXCC1_WGMXCCGn1
    SolutionIndex: 104
    SolutionNameMin: Cijk_Alik_Bljk_HHS_BH_UserArgs_MT32x32x128_MI16x16x1_SN_LDSB1_CLR1_GSU0_GSUC0_GSUWGMRR0_K1_LBSPPA256_LBSPPB256_MIWT1_1_PLR2_SU32_SUM0_SUS256_SKXCCM4_VWA1_VWB1_WGM1_WGMXCC1_WGMXCCGn1
    SolutionIndex: 105
    SolutionNameMin: Cijk_Alik_Bljk_HHS_BH_UserArgs_MT32x32x128_MI16x16x1_SN_LDSB1_CLR1_GSU0_GSUC0_GSUWGMRR0_K1_LBSPPA256_LBSPPB256_MIWT1_1_PLR1_SU32_SUM0_SUS256_SKXCCM4_VWA1_VWB1_WGM4_WGMXCC1_WGMXCCGn1
    SolutionIndex: 106
    SolutionNameMin: Cijk_Alik_Bljk_HHS_BH_UserArgs_MT32x32x32_MI16x16x1_SN_LDSB0_CLR1_GSU0_GSUC0_GSUWGMRR0_K1_LBSPPA128_LBSPPB128_MIWT1_1_PLR1_SU32_SUM0_SUS256_SKXCCM0_VWA1_VWB1_WGM1_WGMXCC1_WGMXCCGn1
- - - [128, 128, 1, 128, 128, 128, 128, 128]
    - [103, 0.097]
  - - [128, 128, 1, 256, 128, 128, 256, 256]
    - [39, 0.114]
  - - [128, 128, 1, 512, 128, 128, 512, 512]
    - [39, 0.189]
  - - [128, 128, 1, 1024, 128, 128, 1024, 1024]
    - [98, 0.302]
  - - [128, 128, 1, 2048, 128, 128, 2048, 2048]
    - [103, 0.57]
  - - [128, 128, 1, 4096, 128, 128, 4096, 4096]
    - [98, 1.031]
  - - [128, 128, 1, 8192, 128, 128, 8192, 8192]
    - [104, 1.744]
  - - [128, 256, 1, 128, 128, 128, 128, 128]
    - [39, 0.189]
  - - [128, 256, 1, 256, 128, 128, 256, 256]
    - [39, 0.22]
  - - [128, 256, 1, 512, 128, 128, 512, 512]
    - [104, 0.378]
  - - [128, 256, 1, 1024, 128, 128, 1024, 1024]
    - [103, 0.653]
  - - [128, 256, 1, 2048, 128, 128, 2048, 2048]
    - [56, 1.113]
  - - [128, 256, 1, 4096, 128, 128, 4096, 4096]
    - [30, 1.82]
  - - [128, 256, 1, 8192, 128, 128, 8192, 8192]
    - [103, 2.964]
  - - [128, 512, 1, 128, 128, 128, 128, 128]
    - [39, 0.377]
  - - [128, 512, 1, 256, 128, 128, 256, 256]
    - [103, 0.453]
  - - [128, 512, 1, 512, 128, 128, 512, 512]
    - [103, 0.751]
  - - [128, 512, 1, 1024, 128, 128, 1024, 1024]
    - [39, 1.337]
  - - [128, 512, 1, 2048, 128, 128, 2048, 2048]
    - [103, 2.201]
  - - [128, 512, 1, 4096, 128, 128, 4096, 4096]
    - [96, 3.217]
  - - [128, 512, 1, 8192, 128, 128, 8192, 8192]
    - [33, 4.575]
  - - [128, 1024, 1, 128, 128, 128, 128, 128]
    - [37, 0.711]
  - - [128, 1024, 1, 256, 128, 128, 256, 256]
    - [39, 1.216]
  - - [128, 1024, 1, 512, 128, 128, 512, 512]
    - [39, 1.92]
  - - [128, 1024, 1, 1024, 128, 128, 1024, 1024]
    - [39, 2.881]
  - - [128, 1024, 1, 2048, 128, 128, 2048, 2048]
    - [101, 3.506]
  - - [128, 1024, 1, 4096, 128, 128, 4096, 4096]
    - [87, 4.993]
  - - [128, 1024, 1, 8192, 128, 128, 8192, 8192]
    - [78, 6.686]
  - - [128, 2048, 1, 128, 128, 128, 128, 128]
    - [34, 1.276]
  - - [128, 2048, 1, 256, 128, 128, 256, 256]
    - [96, 2.113]
  - - [128, 2048, 1, 512, 128, 128, 512, 512]
    - [32, 3.238]
  - - [128, 2048, 1, 1024, 128, 128, 1024, 1024]
    - [102, 4.412]
  - - [128, 2048, 1, 2048, 128, 128, 2048, 2048]
    - [53, 4.798]
  - - [128, 2048, 1, 4096, 128, 128, 4096, 4096]
    - [22, 7.137]
  - - [128, 2048, 1, 8192, 128, 128, 8192, 8192]
    - [57, 9.878]
  - - [128, 4096, 1, 128, 128, 128, 128, 128]
    - [28, 2.252]
  - - [128, 4096, 1, 256, 128, 128, 256, 256]
    - [28, 3.628]
  - - [128, 4096, 1, 512, 128, 128, 512, 512]
    - [89, 5.32]
  - - [128, 4096, 1, 1024, 128, 128, 1024, 1024]
    - [78, 6.0]
  - - [128, 4096, 1, 2048, 128, 128, 2048, 2048]
    - [92, 6.501]
  - - [128, 4096, 1, 4096, 128, 128, 4096, 4096]
    - [8, 8.047]
  - - [128, 4096, 1, 8192, 128, 128, 8192, 8192]
    - [6, 10.172]
  - - [128, 8192, 1, 128, 128, 128, 128, 128]
    - [77, 3.476]
  - - [128, 8192, 1, 256, 128, 128, 256, 256]
    - [79, 5.401]
  - - [128, 8192, 1, 512, 128, 128, 512, 512]
    - [79, 7.599]
  - - [128, 8192, 1, 1024, 128, 128, 1024, 1024]
    - [93, 7.104]
  - - [128, 8192, 1, 2048, 128, 128, 2048, 2048]
    - [78, 8.444]
  - - [128, 8192, 1, 4096, 128, 128, 4096, 4096]
    - [22, 10.467]
  - - [128, 8192, 1, 8192, 128, 128, 8192, 8192]
    - [25, 11.425]
  - - [256, 128, 1, 128, 256, 256, 128, 128]
    - [40, 0.189]
  - - [256, 128, 1, 256, 256, 256, 256, 256]
    - [40, 0.222]
  - - [256, 128, 1, 512, 256, 256, 512, 512]
    - [103, 0.391]
  - - [256, 128, 1, 1024, 256, 256, 1024, 1024]
    - [103, 0.671]
  - - [256, 128, 1, 2048, 256, 256, 2048, 2048]
    - [56, 1.109]
  - - [256, 128, 1, 4096, 256, 256, 4096, 4096]
    - [30, 1.812]
  - - [256, 128, 1, 8192, 256, 256, 8192, 8192]
    - [105, 2.928]
  - - [256, 256, 1, 128, 256, 256, 128, 128]
    - [39, 0.376]
  - - [256, 256, 1, 256, 256, 256, 256, 256]
    - [104, 0.452]
  - - [256, 256, 1, 512, 256, 256, 512, 512]
    - [104, 0.749]
  - - [256, 256, 1, 1024, 256, 256, 1024, 1024]
    - [103, 1.336]
  - - [256, 256, 1, 2048, 256, 256, 2048, 2048]
    - [103, 2.197]
  - - [256, 256, 1, 4096, 256, 256, 4096, 4096]
    - [96, 3.183]
  - - [256, 256, 1, 8192, 256, 256, 8192, 8192]
    - [34, 4.561]
  - - [256, 512, 1, 128, 256, 256, 128, 128]
    - [37, 0.699]
  - - [256, 512, 1, 256, 256, 256, 256, 256]
    - [39, 1.217]
  - - [256, 512, 1, 512, 256, 256, 512, 512]
    - [104, 1.926]
  - - [256, 512, 1, 1024, 256, 256, 1024, 1024]
    - [39, 2.89]
  - - [256, 512, 1, 2048, 256, 256, 2048, 2048]
    - [101, 3.491]
  - - [256, 512, 1, 4096, 256, 256, 4096, 4096]
    - [91, 4.953]
  - - [256, 512, 1, 8192, 256, 256, 8192, 8192]
    - [84, 6.397]
  - - [256, 1024, 1, 128, 256, 256, 128, 128]
    - [31, 1.269]
  - - [256, 1024, 1, 256, 256, 256, 256, 256]
    - [31, 2.121]
  - - [256, 1024, 1, 512, 256, 256, 512, 512]
    - [95, 3.227]
  - - [256, 1024, 1, 1024, 256, 256, 1024, 1024]
    - [37, 4.408]
  - - [256, 1024, 1, 2048, 256, 256, 2048, 2048]
    - [53, 4.777]
  - - [256, 1024, 1, 4096, 256, 256, 4096, 4096]
    - [20, 7.438]
  - - [256, 1024, 1, 8192, 256, 256, 8192, 8192]
    - [57, 9.795]
  - - [256, 2048, 1, 128, 256, 256, 128, 128]
    - [27, 2.224]
  - - [256, 2048, 1, 256, 256, 256, 256, 256]
    - [88, 3.604]
  - - [256, 2048, 1, 512, 256, 256, 512, 512]
    - [28, 5.338]
  - - [256, 2048, 1, 1024, 256, 256, 1024, 1024]
    - [78, 5.977]
  - - [256, 2048, 1, 2048, 256, 256, 2048, 2048]
    - [88, 7.068]
  - - [256, 2048, 1, 4096, 256, 256, 4096, 4096]
    - [6, 8.266]
  - - [256, 2048, 1, 8192, 256, 256, 8192, 8192]
    - [14, 9.904]
  - - [256, 4096, 1, 128, 256, 256, 128, 128]
    - [77, 3.48]
  - - [256, 4096, 1, 256, 256, 256, 256, 256]
    - [79, 5.419]
  - - [256, 4096, 1, 512, 256, 256, 512, 512]
    - [79, 7.588]
  - - [256, 4096, 1, 1024, 256, 256, 1024, 1024]
    - [89, 8.422]
  - - [256, 4096, 1, 2048, 256, 256, 2048, 2048]
    - [82, 9.005]
  - - [256, 4096, 1, 4096, 256, 256, 4096, 4096]
    - [82, 9.836]
  - - [256, 4096, 1, 8192, 256, 256, 8192, 8192]
    - [65, 10.967]
  - - [256, 8192, 1, 128, 256, 256, 128, 128]
    - [51, 4.588]
  - - [256, 8192, 1, 256, 256, 256, 256, 256]
    - [43, 6.842]
  - - [256, 8192, 1, 512, 256, 256, 512, 512]
    - [58, 9.167]
  - - [256, 8192, 1, 1024, 256, 256, 1024, 1024]
    - [77, 9.852]
  - - [256, 8192, 1, 2048, 256, 256, 2048, 2048]
    - [83, 11.275]
  - - [256, 8192, 1, 4096, 256, 256, 4096, 4096]
    - [64, 11.103]
  - - [256, 8192, 1, 8192, 256, 256, 8192, 8192]
    - [12, 12.825]
  - - [512, 128, 1, 128, 512, 512, 128, 128]
    - [39, 0.371]
  - - [512, 128, 1, 256, 512, 512, 256, 256]
    - [104, 0.456]
  - - [512, 128, 1, 512, 512, 512, 512, 512]
    - [103, 0.749]
  - - [512, 128, 1, 1024, 512, 512, 1024, 1024]
    - [103, 1.334]
  - - [512, 128, 1, 2048, 512, 512, 2048, 2048]
    - [103, 2.209]
  - - [512, 128, 1, 4096, 512, 512, 4096, 4096]
    - [96, 3.204]
  - - [512, 128, 1, 8192, 512, 512, 8192, 8192]
    - [99, 4.548]
  - - [512, 256, 1, 128, 512, 512, 128, 128]
    - [38, 0.699]
  - - [512, 256, 1, 256, 512, 512, 256, 256]
    - [40, 1.205]
  - - [512, 256, 1, 512, 512, 512, 512, 512]
    - [40, 1.93]
  - - [512, 256, 1, 1024, 512, 512, 1024, 1024]
    - [39, 2.89]
  - - [512, 256, 1, 2048, 512, 512, 2048, 2048]
    - [100, 3.507]
  - - [512, 256, 1, 4096, 512, 512, 4096, 4096]
    - [91, 4.954]
  - - [512, 256, 1, 8192, 512, 512, 8192, 8192]
    - [86, 6.411]
  - - [512, 512, 1, 128, 512, 512, 128, 128]
    - [97, 1.247]
  - - [512, 512, 1, 256, 512, 512, 256, 256]
    - [31, 2.141]
  - - [512, 512, 1, 512, 512, 512, 512, 512]
    - [31, 3.26]
  - - [512, 512, 1, 1024, 512, 512, 1024, 1024]
    - [37, 4.417]
  - - [512, 512, 1, 2048, 512, 512, 2048, 2048]
    - [53, 4.768]
  - - [512, 512, 1, 4096, 512, 512, 4096, 4096]
    - [26, 7.304]
  - - [512, 512, 1, 8192, 512, 512, 8192, 8192]
    - [67, 9.518]
  - - [512, 1024, 1, 128, 512, 512, 128, 128]
    - [27, 2.227]
  - - [512, 1024, 1, 256, 512, 512, 256, 256]
    - [28, 3.631]
  - - [512, 1024, 1, 512, 512, 512, 512, 512]
    - [88, 5.282]
  - - [512, 1024, 1, 1024, 512, 512, 1024, 1024]
    - [78, 5.98]
  - - [512, 1024, 1, 2048, 512, 512, 2048, 2048]
    - [88, 7.061]
  - - [512, 1024, 1, 4096, 512, 512, 4096, 4096]
    - [6, 8.323]
  - - [512, 1024, 1, 8192, 512, 512, 8192, 8192]
    - [7, 9.868]
  - - [512, 2048, 1, 128, 512, 512, 128, 128]
    - [79, 3.495]
  - - [512, 2048, 1, 256, 512, 512, 256, 256]
    - [79, 5.44]
  - - [512, 2048, 1, 512, 512, 512, 512, 512]
    - [77, 7.608]
  - - [512, 2048, 1, 1024, 512, 512, 1024, 1024]
    - [89, 8.407]
  - - [512, 2048, 1, 2048, 512, 512, 2048, 2048]
    - [88, 9.072]
  - - [512, 2048, 1, 4096, 512, 512, 4096, 4096]
    - [74, 9.334]
  - - [512, 2048, 1, 8192, 512, 512, 8192, 8192]
    - [65, 10.887]
  - - [512, 4096, 1, 128, 512, 512, 128, 128]
    - [51, 4.604]
  - - [512, 4096, 1, 256, 512, 512, 256, 256]
    - [42, 6.843]
  - - [512, 4096, 1, 512, 512, 512, 512, 512]
    - [60, 9.305]
  - - [512, 4096, 1, 1024, 512, 512, 1024, 1024]
    - [85, 10.245]
  - - [512, 4096, 1, 2048, 512, 512, 2048, 2048]
    - [79, 11.382]
  - - [512, 4096, 1, 4096, 512, 512, 4096, 4096]
    - [61, 10.69]
  - - [512, 4096, 1, 8192, 512, 512, 8192, 8192]
    - [64, 12.446]
  - - [512, 8192, 1, 128, 512, 512, 128, 128]
    - [43, 5.314]
  - - [512, 8192, 1, 256, 512, 512, 256, 256]
    - [51, 7.437]
  - - [512, 8192, 1, 512, 512, 512, 512, 512]
    - [52, 9.719]
  - - [512, 8192, 1, 1024, 512, 512, 1024, 1024]
    - [65, 11.921]
  - - [512, 8192, 1, 2048, 512, 512, 2048, 2048]
    - [9, 13.058]
  - - [512, 8192, 1, 4096, 512, 512, 4096, 4096]
    - [64, 12.196]
  - - [512, 8192, 1, 8192, 512, 512, 8192, 8192]
    - [6, 14.146]
  - - [1024, 128, 1, 128, 1024, 1024, 128, 128]
    - [37, 0.706]
  - - [1024, 128, 1, 256, 1024, 1024, 256, 256]
    - [39, 1.213]
  - - [1024, 128, 1, 512, 1024, 1024, 512, 512]
    - [39, 1.921]
  - - [1024, 128, 1, 1024, 1024, 1024, 1024, 1024]
    - [40, 2.819]
  - - [1024, 128, 1, 2048, 1024, 1024, 2048, 2048]
    - [36, 3.5]
  - - [1024, 128, 1, 4096, 1024, 1024, 4096, 4096]
    - [90, 4.944]
  - - [1024, 128, 1, 8192, 1024, 1024, 8192, 8192]
    - [86, 6.195]
  - - [1024, 256, 1, 128, 1024, 1024, 128, 128]
    - [35, 1.25]
  - - [1024, 256, 1, 256, 1024, 1024, 256, 256]
    - [31, 2.145]
  - - [1024, 256, 1, 512, 1024, 1024, 512, 512]
    - [97, 3.243]
  - - [1024, 256, 1, 1024, 1024, 1024, 1024, 1024]
    - [37, 4.371]
  - - [1024, 256, 1, 2048, 1024, 1024, 2048, 2048]
    - [55, 4.725]
  - - [1024, 256, 1, 4096, 1024, 1024, 4096, 4096]
    - [26, 7.152]
  - - [1024, 256, 1, 8192, 1024, 1024, 8192, 8192]
    - [57, 9.622]
  - - [1024, 512, 1, 128, 1024, 1024, 128, 128]
    - [27, 2.22]
  - - [1024, 512, 1, 256, 1024, 1024, 256, 256]
    - [27, 3.624]
  - - [1024, 512, 1, 512, 1024, 1024, 512, 512]
    - [28, 5.343]
  - - [1024, 512, 1, 1024, 1024, 1024, 1024, 1024]
    - [80, 5.958]
  - - [1024, 512, 1, 2048, 1024, 1024, 2048, 2048]
    - [94, 6.895]
  - - [1024, 512, 1, 4096, 1024, 1024, 4096, 4096]
    - [16, 8.266]
  - - [1024, 512, 1, 8192, 1024, 1024, 8192, 8192]
    - [13, 9.845]
  - - [1024, 1024, 1, 128, 1024, 1024, 128, 128]
    - [79, 3.471]
  - - [1024, 1024, 1, 256, 1024, 1024, 256, 256]
    - [77, 5.404]
  - - [1024, 1024, 1, 512, 1024, 1024, 512, 512]
    - [79, 7.607]
  - - [1024, 1024, 1, 1024, 1024, 1024, 1024, 1024]
    - [88, 8.453]
  - - [1024, 1024, 1, 2048, 1024, 1024, 2048, 2048]
    - [29, 8.957]
  - - [1024, 1024, 1, 4096, 1024, 1024, 4096, 4096]
    - [73, 9.522]
  - - [1024, 1024, 1, 8192, 1024, 1024, 8192, 8192]
    - [62, 10.842]
  - - [1024, 2048, 1, 128, 1024, 1024, 128, 128]
    - [42, 4.605]
  - - [1024, 2048, 1, 256, 1024, 1024, 256, 256]
    - [43, 6.846]
  - - [1024, 2048, 1, 512, 1024, 1024, 512, 512]
    - [58, 9.332]
  - - [1024, 2048, 1, 1024, 1024, 1024, 1024, 1024]
    - [79, 10.257]
  - - [1024, 2048, 1, 2048, 1024, 1024, 2048, 2048]
    - [19, 11.165]
  - - [1024, 2048, 1, 4096, 1024, 1024, 4096, 4096]
    - [61, 10.883]
  - - [1024, 2048, 1, 8192, 1024, 1024, 8192, 8192]
    - [6, 12.458]
  - - [1024, 4096, 1, 128, 1024, 1024, 128, 128]
    - [43, 5.376]
  - - [1024, 4096, 1, 256, 1024, 1024, 256, 256]
    - [44, 7.533]
  - - [1024, 4096, 1, 512, 1024, 1024, 512, 512]
    - [43, 9.854]
  - - [1024, 4096, 1, 1024, 1024, 1024, 1024, 1024]
    - [15, 12.002]
  - - [1024, 4096, 1, 2048, 1024, 1024, 2048, 2048]
    - [8, 13.318]
  - - [1024, 4096, 1, 4096, 1024, 1024, 4096, 4096]
    - [64, 12.513]
  - - [1024, 4096, 1, 8192, 1024, 1024, 8192, 8192]
    - [59, 14.026]
  - - [1024, 8192, 1, 128, 1024, 1024, 128, 128]
    - [24, 4.802]
  - - [1024, 8192, 1, 256, 1024, 1024, 256, 256]
    - [80, 7.102]
  - - [1024, 8192, 1, 512, 1024, 1024, 512, 512]
    - [80, 9.312]
  - - [1024, 8192, 1, 1024, 1024, 1024, 1024, 1024]
    - [78, 11.204]
  - - [1024, 8192, 1, 2048, 1024, 1024, 2048, 2048]
    - [62, 12.443]
  - - [1024, 8192, 1, 4096, 1024, 1024, 4096, 4096]
    - [64, 13.478]
  - - [1024, 8192, 1, 8192, 1024, 1024, 8192, 8192]
    - [59, 15.193]
  - - [2048, 128, 1, 128, 2048, 2048, 128, 128]
    - [34, 1.271]
  - - [2048, 128, 1, 256, 2048, 2048, 256, 256]
    - [31, 2.143]
  - - [2048, 128, 1, 512, 2048, 2048, 512, 512]
    - [31, 3.257]
  - - [2048, 128, 1, 1024, 2048, 2048, 1024, 1024]
    - [37, 4.369]
  - - [2048, 128, 1, 2048, 2048, 2048, 2048, 2048]
    - [54, 4.747]
  - - [2048, 128, 1, 4096, 2048, 2048, 4096, 4096]
    - [74, 6.707]
  - - [2048, 128, 1, 8192, 2048, 2048, 8192, 8192]
    - [57, 9.667]
  - - [2048, 256, 1, 128, 2048, 2048, 128, 128]
    - [27, 2.242]
  - - [2048, 256, 1, 256, 2048, 2048, 256, 256]
    - [88, 3.605]
  - - [2048, 256, 1, 512, 2048, 2048, 512, 512]
    - [88, 5.294]
  - - [2048, 256, 1, 1024, 2048, 2048, 1024, 1024]
    - [82, 5.924]
  - - [2048, 256, 1, 2048, 2048, 2048, 2048, 2048]
    - [94, 6.95]
  - - [2048, 256, 1, 4096, 2048, 2048, 4096, 4096]
    - [11, 8.274]
  - - [2048, 256, 1, 8192, 2048, 2048, 8192, 8192]
    - [7, 9.741]
  - - [2048, 512, 1, 128, 2048, 2048, 128, 128]
    - [79, 3.519]
  - - [2048, 512, 1, 256, 2048, 2048, 256, 256]
    - [77, 5.422]
  - - [2048, 512, 1, 512, 2048, 2048, 512, 512]
    - [77, 7.634]
  - - [2048, 512, 1, 1024, 2048, 2048, 1024, 1024]
    - [93, 8.371]
  - - [2048, 512, 1, 2048, 2048, 2048, 2048, 2048]
    - [28, 9.229]
  - - [2048, 512, 1, 4096, 2048, 2048, 4096, 4096]
    - [73, 9.585]
  - - [2048, 512, 1, 8192, 2048, 2048, 8192, 8192]
    - [6, 11.024]
  - - [2048, 1024, 1, 128, 2048, 2048, 128, 128]
    - [42, 4.612]
  - - [2048, 1024, 1, 256, 2048, 2048, 256, 256]
    - [42, 6.876]
  - - [2048, 1024, 1, 512, 2048, 2048, 512, 512]
    - [58, 9.135]
  - - [2048, 1024, 1, 1024, 2048, 2048, 1024, 1024]
    - [19, 10.331]
  - - [2048, 1024, 1, 2048, 2048, 2048, 2048, 2048]
    - [21, 11.222]
  - - [2048, 1024, 1, 4096, 2048, 2048, 4096, 4096]
    - [73, 11.337]
  - - [2048, 1024, 1, 8192, 2048, 2048, 8192, 8192]
    - [8, 12.601]
  - - [2048, 2048, 1, 128, 2048, 2048, 128, 128]
    - [43, 5.353]
  - - [2048, 2048, 1, 256, 2048, 2048, 256, 256]
    - [46, 7.496]
  - - [2048, 2048, 1, 512, 2048, 2048, 512, 512]
    - [3, 9.846]
  - - [2048, 2048, 1, 1024, 2048, 2048, 1024, 1024]
    - [10, 11.753]
  - - [2048, 2048, 1, 2048, 2048, 2048, 2048, 2048]
    - [5, 13.383]
  - - [2048, 2048, 1, 4096, 2048, 2048, 4096, 4096]
    - [61, 13.255]
  - - [2048, 2048, 1, 8192, 2048, 2048, 8192, 8192]
    - [57, 14.705]
  - - [2048, 4096, 1, 128, 2048, 2048, 128, 128]
    - [23, 4.837]
  - - [2048, 4096, 1, 256, 2048, 2048, 256, 256]
    - [77, 7.193]
  - - [2048, 4096, 1, 512, 2048, 2048, 512, 512]
    - [77, 8.999]
  - - [2048, 4096, 1, 1024, 2048, 2048, 1024, 1024]
    - [67, 10.749]
  - - [2048, 4096, 1, 2048, 2048, 2048, 2048, 2048]
    - [57, 12.286]
  - - [2048, 4096, 1, 4096, 2048, 2048, 4096, 4096]
    - [59, 13.97]
  - - [2048, 4096, 1, 8192, 2048, 2048, 8192, 8192]
    - [57, 15.57]
  - - [2048, 8192, 1, 128, 2048, 2048, 128, 128]
    - [41, 5.994]
  - - [2048, 8192, 1, 256, 2048, 2048, 256, 256]
    - [77, 7.774]
  - - [2048, 8192, 1, 512, 2048, 2048, 512, 512]
    - [77, 10.017]
  - - [2048, 8192, 1, 1024, 2048, 2048, 1024, 1024]
    - [67, 12.017]
  - - [2048, 8192, 1, 2048, 2048, 2048, 2048, 2048]
    - [70, 13.706]
  - - [2048, 8192, 1, 4096, 2048, 2048, 4096, 4096]
    - [67, 15.469]
  - - [2048, 8192, 1, 8192, 2048, 2048, 8192, 8192]
    - [66, 17.015]
  - - [4096, 128, 1, 128, 4096, 4096, 128, 128]
    - [27, 2.221]
  - - [4096, 128, 1, 256, 4096, 4096, 256, 256]
    - [27, 3.625]
  - - [4096, 128, 1, 512, 4096, 4096, 512, 512]
    - [88, 5.333]
  - - [4096, 128, 1, 1024, 4096, 4096, 1024, 1024]
    - [84, 5.852]
  - - [4096, 128, 1, 2048, 4096, 4096, 2048, 2048]
    - [91, 5.947]
  - - [4096, 128, 1, 4096, 4096, 4096, 4096, 4096]
    - [6, 7.74]
  - - [4096, 128, 1, 8192, 4096, 4096, 8192, 8192]
    - [14, 9.743]
  - - [4096, 256, 1, 128, 4096, 4096, 128, 128]
    - [79, 3.495]
  - - [4096, 256, 1, 256, 4096, 4096, 256, 256]
    - [77, 5.436]
  - - [4096, 256, 1, 512, 4096, 4096, 512, 512]
    - [72, 7.591]
  - - [4096, 256, 1, 1024, 4096, 4096, 1024, 1024]
    - [93, 8.366]
  - - [4096, 256, 1, 2048, 4096, 4096, 2048, 2048]
    - [28, 8.632]
  - - [4096, 256, 1, 4096, 4096, 4096, 4096, 4096]
    - [17, 9.732]
  - - [4096, 256, 1, 8192, 4096, 4096, 8192, 8192]
    - [74, 11.098]
  - - [4096, 512, 1, 128, 4096, 4096, 128, 128]
    - [42, 4.622]
  - - [4096, 512, 1, 256, 4096, 4096, 256, 256]
    - [45, 6.701]
  - - [4096, 512, 1, 512, 4096, 4096, 512, 512]
    - [68, 9.072]
  - - [4096, 512, 1, 1024, 4096, 4096, 1024, 1024]
    - [19, 10.13]
  - - [4096, 512, 1, 2048, 4096, 4096, 2048, 2048]
    - [19, 10.589]
  - - [4096, 512, 1, 4096, 4096, 4096, 4096, 4096]
    - [71, 11.518]
  - - [4096, 512, 1, 8192, 4096, 4096, 8192, 8192]
    - [6, 12.889]
  - - [4096, 1024, 1, 128, 4096, 4096, 128, 128]
    - [41, 5.304]
  - - [4096, 1024, 1, 256, 4096, 4096, 256, 256]
    - [4, 7.275]
  - - [4096, 1024, 1, 512, 4096, 4096, 512, 512]
    - [2, 9.824]
  - - [4096, 1024, 1, 1024, 4096, 4096, 1024, 1024]
    - [5, 12.055]
  - - [4096, 1024, 1, 2048, 4096, 4096, 2048, 2048]
    - [6, 12.056]
  - - [4096, 1024, 1, 4096, 4096, 4096, 4096, 4096]
    - [59, 13.423]
  - - [4096, 1024, 1, 8192, 4096, 4096, 8192, 8192]
    - [57, 14.829]
  - - [4096, 2048, 1, 128, 4096, 4096, 128, 128]
    - [23, 4.837]
  - - [4096, 2048, 1, 256, 4096, 4096, 256, 256]
    - [77, 7.01]
  - - [4096, 2048, 1, 512, 4096, 4096, 512, 512]
    - [84, 8.706]
  - - [4096, 2048, 1, 1024, 4096, 4096, 1024, 1024]
    - [69, 10.948]
  - - [4096, 2048, 1, 2048, 4096, 4096, 2048, 2048]
    - [57, 12.511]
  - - [4096, 2048, 1, 4096, 4096, 4096, 4096, 4096]
    - [61, 14.266]
  - - [4096, 2048, 1, 8192, 4096, 4096, 8192, 8192]
    - [57, 15.853]
  - - [4096, 4096, 1, 128, 4096, 4096, 128, 128]
    - [81, 6.022]
  - - [4096, 4096, 1, 256, 4096, 4096, 256, 256]
    - [48, 7.577]
  - - [4096, 4096, 1, 512, 4096, 4096, 512, 512]
    - [48, 9.815]
  - - [4096, 4096, 1, 1024, 4096, 4096, 1024, 1024]
    - [67, 11.967]
  - - [4096, 4096, 1, 2048, 4096, 4096, 2048, 2048]
    - [67, 13.69]
  - - [4096, 4096, 1, 4096, 4096, 4096, 4096, 4096]
    - [67, 15.74]
  - - [4096, 4096, 1, 8192, 4096, 4096, 8192, 8192]
    - [67, 17.035]
  - - [4096, 8192, 1, 128, 4096, 4096, 128, 128]
    - [41, 6.403]
  - - [4096, 8192, 1, 256, 4096, 4096, 256, 256]
    - [50, 8.295]
  - - [4096, 8192, 1, 512, 4096, 4096, 512, 512]
    - [6, 10.365]
  - - [4096, 8192, 1, 1024, 4096, 4096, 1024, 1024]
    - [6, 12.549]
  - - [4096, 8192, 1, 2048, 4096, 4096, 2048, 2048]
    - [67, 13.409]
  - - [4096, 8192, 1, 4096, 4096, 4096, 4096, 4096]
    - [67, 15.962]
  - - [4096, 8192, 1, 8192, 4096, 4096, 8192, 8192]
    - [67, 17.364]
  - - [8192, 128, 1, 128, 8192, 8192, 128, 128]
    - [79, 3.334]
  - - [8192, 128, 1, 256, 8192, 8192, 256, 256]
    - [79, 5.19]
  - - [8192, 128, 1, 512, 8192, 8192, 512, 512]
    - [72, 7.245]
  - - [8192, 128, 1, 1024, 8192, 8192, 1024, 1024]
    - [91, 6.845]
  - - [8192, 128, 1, 2048, 8192, 8192, 2048, 2048]
    - [73, 7.957]
  - - [8192, 128, 1, 4096, 8192, 8192, 4096, 4096]
    - [17, 9.815]
  - - [8192, 128, 1, 8192, 8192, 8192, 8192, 8192]
    - [18, 11.363]
  - - [8192, 256, 1, 128, 8192, 8192, 128, 128]
    - [45, 4.582]
  - - [8192, 256, 1, 256, 8192, 8192, 256, 256]
    - [51, 6.745]
  - - [8192, 256, 1, 512, 8192, 8192, 512, 512]
    - [63, 8.628]
  - - [8192, 256, 1, 1024, 8192, 8192, 1024, 1024]
    - [75, 9.341]
  - - [8192, 256, 1, 2048, 8192, 8192, 2048, 2048]
    - [76, 10.437]
  - - [8192, 256, 1, 4096, 8192, 8192, 4096, 4096]
    - [74, 11.587]
  - - [8192, 256, 1, 8192, 8192, 8192, 8192, 8192]
    - [7, 13.111]
  - - [8192, 512, 1, 128, 8192, 8192, 128, 128]
    - [0, 5.214]
  - - [8192, 512, 1, 256, 8192, 8192, 256, 256]
    - [49, 7.162]
  - - [8192, 512, 1, 512, 8192, 8192, 512, 512]
    - [47, 9.306]
  - - [8192, 512, 1, 1024, 8192, 8192, 1024, 1024]
    - [8, 11.195]
  - - [8192, 512, 1, 2048, 8192, 8192, 2048, 2048]
    - [69, 11.408]
  - - [8192, 512, 1, 4096, 8192, 8192, 4096, 4096]
    - [59, 13.392]
  - - [8192, 512, 1, 8192, 8192, 8192, 8192, 8192]
    - [7, 14.839]
  - - [8192, 1024, 1, 128, 8192, 8192, 128, 128]
    - [23, 4.819]
  - - [8192, 1024, 1, 256, 8192, 8192, 256, 256]
    - [83, 6.545]
  - - [8192, 1024, 1, 512, 8192, 8192, 512, 512]
    - [86, 8.658]
  - - [8192, 1024, 1, 1024, 8192, 8192, 1024, 1024]
    - [70, 10.889]
  - - [8192, 1024, 1, 2048, 8192, 8192, 2048, 2048]
    - [57, 12.562]
  - - [8192, 1024, 1, 4096, 8192, 8192, 4096, 4096]
    - [59, 14.293]
  - - [8192, 1024, 1, 8192, 8192, 8192, 8192, 8192]
    - [57, 16.066]
  - - [8192, 2048, 1, 128, 8192, 8192, 128, 128]
    - [23, 5.889]
  - - [8192, 2048, 1, 256, 8192, 8192, 256, 256]
    - [52, 7.59]
  - - [8192, 2048, 1, 512, 8192, 8192, 512, 512]
    - [48, 9.804]
  - - [8192, 2048, 1, 1024, 8192, 8192, 1024, 1024]
    - [67, 11.996]
  - - [8192, 2048, 1, 2048, 8192, 8192, 2048, 2048]
    - [67, 13.711]
  - - [8192, 2048, 1, 4096, 8192, 8192, 4096, 4096]
    - [62, 15.483]
  - - [8192, 2048, 1, 8192, 8192, 8192, 8192, 8192]
    - [67, 17.067]
  - - [8192, 4096, 1, 128, 8192, 8192, 128, 128]
    - [50, 6.185]
  - - [8192, 4096, 1, 256, 8192, 8192, 256, 256]
    - [47, 8.27]
  - - [8192, 4096, 1, 512, 8192, 8192, 512, 512]
    - [50, 10.212]
  - - [8192, 4096, 1, 1024, 8192, 8192, 1024, 1024]
    - [6, 12.327]
  - - [8192, 4096, 1, 2048, 8192, 8192, 2048, 2048]
    - [69, 13.435]
  - - [8192, 4096, 1, 4096, 8192, 8192, 4096, 4096]
    - [69, 15.981]
  - - [8192, 4096, 1, 8192, 8192, 8192, 8192, 8192]
    - [66, 17.357]
  - - [8192, 8192, 1, 128, 8192, 8192, 128, 128]
    - [1, 6.02]
  - - [8192, 8192, 1, 256, 8192, 8192, 256, 256]
    - [49, 7.896]
  - - [8192, 8192, 1, 512, 8192, 8192, 512, 512]
    - [7, 10.594]
  - - [8192, 8192, 1, 1024, 8192, 8192, 1024, 1024]
    - [8, 12.909]
  - - [8192, 8192, 1, 2048, 8192, 8192, 2048, 2048]
    - [69, 13.337]
  - - [8192, 8192, 1, 4096, 8192, 8192, 4096, 4096]
    - [64, 16.091]
  - - [8192, 8192, 1, 8192, 8192, 8192, 8192, 8192]
    - [67, 16.315]
  - - [1, 1, 1, 32, 1, 1, 32, 32]
    - [106, 0.0]
- null
- null
- DeviceEfficiency
- GridBased
