library/src/amd_detail/rocblaslt/src/Tensile/Logic/streamk/gfx942_80cu/aquavanjaram942_Cijk_Ailk_Bjlk_BBS_BH_UserArgs.yaml
- {MinimumRequiredVersion: 4.33.0}
- aquavanjaram942
- {Architecture: gfx942, CUCount: 80}
- [Device 0049, Device 0050]
    SolutionIndex: 0
    SolutionNameMin: Cijk_Ailk_Bjlk_BBS_BH_UserArgs_MT256x256x32_MI16x16x1_SN_LDSB1_CLR1_GSU0_GSUC0_GSUWGMRR0_K1_LBSPPA2048_LBSPPB2048_LPA0_LPB32_MIWT8_8_PLR1_SU32_SUM0_SUS256_SKXCCM0_VWA8_VWB2_WGM1_WGMXCC1_WGMXCCGn1
    SolutionIndex: 1
    SolutionNameMin: Cijk_Ailk_Bjlk_BBS_BH_UserArgs_MT256x256x32_MI16x16x1_SN_LDSB0_CLR1_GSU0_GSUC0_GSUWGMRR0_K1_LBSPPA2048_LBSPPB2048_LPA0_LPB0_MIWT8_8_PLR1_SU32_SUM0_SUS256_SKXCCM0_VWA8_VWB4_WGM1_WGMXCC1_WGMXCCGn1
    SolutionIndex: 2
    SolutionNameMin: Cijk_Ailk_Bjlk_BBS_BH_UserArgs_MT256x256x32_MI16x16x1_SN_LDSB0_CLR1_GSU0_GSUC0_GSUWGMRR0_K1_LBSPPA2048_LBSPPB2048_LPA0_LPB0_MIWT8_8_PLR1_SU32_SUM0_SUS256_SKXCCM0_VWA8_VWB8_WGM1_WGMXCC1_WGMXCCGn1
    SolutionIndex: 3
    SolutionNameMin: Cijk_Ailk_Bjlk_BBS_BH_UserArgs_MT256x256x32_MI16x16x1_SN_LDSB0_CLR1_GSU0_GSUC0_GSUWGMRR0_K1_LBSPPA2048_LBSPPB2048_LPA0_LPB0_MIWT8_8_PLR1_SU32_SUM0_SUS256_SKXCCM0_VWA8_VWB8_WGM2_WGMXCC1_WGMXCCGn1
    SolutionIndex: 4
    SolutionNameMin: Cijk_Ailk_Bjlk_BBS_BH_UserArgs_MT128x256x32_MI16x16x1_SN_LDSB1_CLR1_GSU0_GSUC0_GSUWGMRR0_K1_LBSPPA1024_LBSPPB2048_LPA0_LPB32_MIWT4_8_PLR1_SU32_SUM0_SUS256_SKXCCM0_VWA4_VWB2_WGM1_WGMXCC1_WGMXCCGn1
    SolutionIndex: 5
    SolutionNameMin: Cijk_Ailk_Bjlk_BBS_BH_UserArgs_MT128x256x32_MI16x16x1_SN_LDSB1_CLR1_GSU0_GSUC0_GSUWGMRR0_K1_LBSPPA1024_LBSPPB2048_LPA32_LPB0_MIWT4_8_PLR1_SU32_SUM0_SUS256_SKXCCM0_VWA2_VWB4_WGM1_WGMXCC1_WGMXCCGn1
    SolutionIndex: 6
    SolutionNameMin: Cijk_Ailk_Bjlk_BBS_BH_UserArgs_MT128x256x32_MI16x16x1_SN_LDSB1_CLR1_GSU0_GSUC0_GSUWGMRR0_K1_LBSPPA1024_LBSPPB2048_LPA0_LPB32_MIWT4_8_PLR1_SU32_SUM0_SUS256_SKXCCM0_VWA4_VWB2_WGM2_WGMXCC1_WGMXCCGn1
    SolutionIndex: 7
    SolutionNameMin: Cijk_Ailk_Bjlk_BBS_BH_UserArgs_MT128x256x32_MI16x16x1_SN_LDSB1_CLR1_GSU0_GSUC0_GSUWGMRR0_K1_LBSPPA1024_LBSPPB2048_LPA0_LPB32_MIWT4_8_PLR1_SU32_SUM0_SUS256_SKXCCM0_VWA4_VWB2_WGM4_WGMXCC1_WGMXCCGn1
    SolutionIndex: 8
    SolutionNameMin: Cijk_Ailk_Bjlk_BBS_BH_UserArgs_MT256x128x32_MI16x16x1_SN_LDSB1_CLR1_GSU0_GSUC0_GSUWGMRR0_K1_LBSPPA2048_LBSPPB1024_LPA0_LPB16_MIWT8_4_PLR1_SU32_SUM0_SUS256_SKXCCM0_VWA8_VWB1_WGM1_WGMXCC1_WGMXCCGn1
    SolutionIndex: 9
    SolutionNameMin: Cijk_Ailk_Bjlk_BBS_BH_UserArgs_MT256x128x32_MI16x16x1_SN_LDSB1_CLR1_GSU0_GSUC0_GSUWGMRR0_K1_LBSPPA2048_LBSPPB1024_LPA0_LPB32_MIWT8_4_PLR1_SU32_SUM0_SUS256_SKXCCM0_VWA8_VWB2_WGM1_WGMXCC1_WGMXCCGn1
    SolutionIndex: 10
    SolutionNameMin: Cijk_Ailk_Bjlk_BBS_BH_UserArgs_MT256x128x32_MI16x16x1_SN_LDSB1_CLR1_GSU0_GSUC0_GSUWGMRR0_K1_LBSPPA2048_LBSPPB1024_LPA0_LPB0_MIWT8_4_PLR1_SU32_SUM0_SUS256_SKXCCM0_VWA4_VWB4_WGM1_WGMXCC1_WGMXCCGn1
    SolutionIndex: 11
    SolutionNameMin: Cijk_Ailk_Bjlk_BBS_BH_UserArgs_MT256x128x32_MI16x16x1_SN_LDSB1_CLR1_GSU0_GSUC0_GSUWGMRR0_K1_LBSPPA2048_LBSPPB1024_LPA0_LPB0_MIWT8_4_PLR1_SU32_SUM0_SUS256_SKXCCM0_VWA8_VWB4_WGM1_WGMXCC1_WGMXCCGn1
    SolutionIndex: 12
    SolutionNameMin: Cijk_Ailk_Bjlk_BBS_BH_UserArgs_MT256x128x32_MI16x16x1_SN_LDSB1_CLR1_GSU0_GSUC0_GSUWGMRR0_K1_LBSPPA2048_LBSPPB1024_LPA0_LPB16_MIWT8_4_PLR1_SU32_SUM0_SUS256_SKXCCM0_VWA8_VWB1_WGM2_WGMXCC1_WGMXCCGn1
    SolutionIndex: 13
    SolutionNameMin: Cijk_Ailk_Bjlk_BBS_BH_UserArgs_MT256x128x32_MI16x16x1_SN_LDSB1_CLR1_GSU0_GSUC0_GSUWGMRR0_K1_LBSPPA2048_LBSPPB1024_LPA0_LPB16_MIWT8_4_PLR1_SU32_SUM0_SUS256_SKXCCM0_VWA4_VWB1_WGM4_WGMXCC1_WGMXCCGn1
    SolutionIndex: 14
    SolutionNameMin: Cijk_Ailk_Bjlk_BBS_BH_UserArgs_MT128x128x32_MI16x16x1_SN_LDSB0_CLR0_GSU0_GSUC0_GSUWGMRR0_K1_LBSPPA1024_LBSPPB1024_LPA0_LPB0_MIWT4_4_PLR0_SU32_SUM0_SUS256_SKXCCM0_VWA4_VWB4_WGM1_WGMXCC1_WGMXCCGn1
    SolutionIndex: 15
    SolutionNameMin: Cijk_Ailk_Bjlk_BBS_BH_UserArgs_MT128x128x32_MI16x16x1_SN_LDSB0_CLR0_GSU0_GSUC0_GSUWGMRR0_K1_LBSPPA1024_LBSPPB1024_LPA0_LPB0_MIWT4_4_PLR0_SU32_SUM0_SUS256_SKXCCM0_VWA4_VWB4_WGM2_WGMXCC1_WGMXCCGn1
    SolutionIndex: 16
    SolutionNameMin: Cijk_Ailk_Bjlk_BBS_BH_UserArgs_MT64x128x32_MI16x16x1_SN_LDSB0_CLR1_GSU0_GSUC0_GSUWGMRR0_K1_LBSPPA512_LBSPPB1024_LPA32_LPB0_MIWT2_4_PLR1_SU32_SUM0_SUS256_SKXCCM0_VWA2_VWB4_WGM1_WGMXCC1_WGMXCCGn1
    SolutionIndex: 17
    SolutionNameMin: Cijk_Ailk_Bjlk_BBS_BH_UserArgs_MT64x128x32_MI16x16x1_SN_LDSB0_CLR0_GSU0_GSUC0_GSUWGMRR0_K1_LBSPPA512_LBSPPB1024_LPA32_LPB0_MIWT2_4_PLR0_SU32_SUM0_SUS256_SKXCCM0_VWA2_VWB4_WGM4_WGMXCC1_WGMXCCGn1
    SolutionIndex: 18
    SolutionNameMin: Cijk_Ailk_Bjlk_BBS_BH_UserArgs_MT128x64x32_MI16x16x1_SN_LDSB0_CLR1_GSU0_GSUC0_GSUWGMRR0_K1_LBSPPA1024_LBSPPB512_LPA0_LPB32_MIWT4_2_PLR1_SU32_SUM0_SUS256_SKXCCM0_VWA4_VWB2_WGM1_WGMXCC1_WGMXCCGn1
    SolutionIndex: 19
    SolutionNameMin: Cijk_Ailk_Bjlk_BBS_BH_UserArgs_MT32x32x32_MI16x16x1_SN_LDSB0_CLR1_GSU0_GSUC0_GSUWGMRR0_K1_LBSPPA256_LBSPPB256_LPA16_LPB16_MIWT1_1_PLR1_SU32_SUM0_SUS256_SKXCCM0_VWA1_VWB1_WGM1_WGMXCC1_WGMXCCGn1
    SolutionIndex: 20
    SolutionNameMin: Cijk_Ailk_Bjlk_BBS_BH_UserArgs_MT32x32x32_MI16x16x1_SN_LDSB0_CLR0_GSU0_GSUC0_GSUWGMRR0_K1_LBSPPA256_LBSPPB256_LPA16_LPB16_MIWT1_1_PLR0_SU32_SUM0_SUS256_SKXCCM0_VWA1_VWB1_WGM1_WGMXCC1_WGMXCCGn1
    SolutionIndex: 21
    SolutionNameMin: Cijk_Ailk_Bjlk_BBS_BH_UserArgs_MT256x256x64_MI16x16x1_SN_LDSB1_CLR1_GSU0_GSUC0_GSUWGMRR0_K1_LBSPPA2048_LBSPPB2048_LPA0_LPB0_MIWT8_8_PLR1_SU32_SUM0_SUS256_SKXCCM0_VWA4_VWB4_WGM1_WGMXCC1_WGMXCCGn1
    SolutionIndex: 22
    SolutionNameMin: Cijk_Ailk_Bjlk_BBS_BH_UserArgs_MT128x128x64_MI16x16x1_SN_LDSB1_CLR1_GSU0_GSUC0_GSUWGMRR0_K1_LBSPPA1024_LBSPPB1024_LPA0_LPB0_MIWT4_4_PLR1_SU32_SUM0_SUS256_SKXCCM0_VWA4_VWB4_WGM1_WGMXCC1_WGMXCCGn1
    SolutionIndex: 23
    SolutionNameMin: Cijk_Ailk_Bjlk_BBS_BH_UserArgs_MT128x128x64_MI16x16x1_SN_LDSB1_CLR1_GSU0_GSUC0_GSUWGMRR0_K1_LBSPPA1024_LBSPPB1024_LPA0_LPB0_MIWT4_4_PLR1_SU32_SUM0_SUS256_SKXCCM0_VWA4_VWB4_WGM2_WGMXCC1_WGMXCCGn1
    SolutionIndex: 24
    SolutionNameMin: Cijk_Ailk_Bjlk_BBS_BH_UserArgs_MT128x128x64_MI16x16x1_SN_LDSB1_CLR1_GSU0_GSUC0_GSUWGMRR0_K1_LBSPPA1024_LBSPPB1024_LPA0_LPB0_MIWT4_4_PLR1_SU32_SUM0_SUS256_SKXCCM0_VWA4_VWB4_WGM4_WGMXCC1_WGMXCCGn1
    SolutionIndex: 25
    SolutionNameMin: Cijk_Ailk_Bjlk_BBS_BH_UserArgs_MT128x64x64_MI16x16x1_SN_LDSB1_CLR1_GSU0_GSUC0_GSUWGMRR0_K1_LBSPPA1024_LBSPPB512_LPA0_LPB32_MIWT4_2_PLR2_SU32_SUM0_SUS256_SKXCCM0_VWA4_VWB2_WGM1_WGMXCC1_WGMXCCGn1
    SolutionIndex: 26
    SolutionNameMin: Cijk_Ailk_Bjlk_BBS_BH_UserArgs_MT64x64x64_MI16x16x1_SN_LDSB1_CLR1_GSU0_GSUC0_GSUWGMRR0_K1_LBSPPA512_LBSPPB512_LPA32_LPB32_MIWT2_2_PLR1_SU32_SUM0_SUS256_SKXCCM0_VWA2_VWB2_WGM1_WGMXCC1_WGMXCCGn1
    SolutionIndex: 27
    SolutionNameMin: Cijk_Ailk_Bjlk_BBS_BH_UserArgs_MT32x64x64_MI16x16x1_SN_LDSB0_CLR1_GSU0_GSUC0_GSUWGMRR0_K1_LBSPPA256_LBSPPB512_LPA16_LPB32_MIWT1_2_PLR2_SU32_SUM0_SUS256_SKXCCM0_VWA1_VWB2_WGM1_WGMXCC1_WGMXCCGn1
    SolutionIndex: 28
    SolutionNameMin: Cijk_Ailk_Bjlk_BBS_BH_UserArgs_MT64x32x64_MI16x16x1_SN_LDSB0_CLR1_GSU0_GSUC0_GSUWGMRR0_K1_LBSPPA512_LBSPPB256_LPA32_LPB16_MIWT2_1_PLR2_SU32_SUM0_SUS256_SKXCCM0_VWA2_VWB1_WGM1_WGMXCC1_WGMXCCGn1
    SolutionIndex: 29
    SolutionNameMin: Cijk_Ailk_Bjlk_BBS_BH_UserArgs_MT32x32x64_MI16x16x1_SN_LDSB0_CLR1_GSU0_GSUC0_GSUWGMRR0_K1_LBSPPA256_LBSPPB256_LPA16_LPB16_MIWT1_1_PLR2_SU32_SUM0_SUS256_SKXCCM0_VWA1_VWB1_WGM1_WGMXCC1_WGMXCCGn1
    SolutionIndex: 30
    SolutionNameMin: Cijk_Ailk_Bjlk_BBS_BH_UserArgs_MT128x128x128_MI16x16x1_SN_LDSB1_CLR1_GSU0_GSUC0_GSUWGMRR0_K1_LBSPPA1024_LBSPPB1024_LPA0_LPB0_MIWT4_4_PLR1_SU32_SUM0_SUS256_SKXCCM0_VWA4_VWB4_WGM1_WGMXCC1_WGMXCCGn1
    SolutionIndex: 31
    SolutionNameMin: Cijk_Ailk_Bjlk_BBS_BH_UserArgs_MT64x64x128_MI16x16x1_SN_LDSB1_CLR1_GSU0_GSUC0_GSUWGMRR0_K1_LBSPPA512_LBSPPB512_LPA32_LPB32_MIWT2_2_PLR2_SU32_SUM0_SUS256_SKXCCM0_VWA2_VWB2_WGM1_WGMXCC1_WGMXCCGn1
    SolutionIndex: 32
    SolutionNameMin: Cijk_Ailk_Bjlk_BBS_BH_UserArgs_MT64x32x128_MI16x16x1_SN_LDSB1_CLR1_GSU0_GSUC0_GSUWGMRR0_K1_LBSPPA512_LBSPPB256_LPA32_LPB16_MIWT2_1_PLR2_SU32_SUM0_SUS256_SKXCCM0_VWA2_VWB1_WGM1_WGMXCC1_WGMXCCGn1
    SolutionIndex: 33
    SolutionNameMin: Cijk_Ailk_Bjlk_BBS_BH_UserArgs_MT32x32x128_MI16x16x1_SN_LDSB1_CLR1_GSU0_GSUC0_GSUWGMRR0_K1_LBSPPA256_LBSPPB256_LPA16_LPB16_MIWT1_1_PLR1_SU32_SUM0_SUS256_SKXCCM0_VWA1_VWB1_WGM1_WGMXCC1_WGMXCCGn1
    SolutionIndex: 34
    SolutionNameMin: Cijk_Ailk_Bjlk_BBS_BH_UserArgs_MT32x32x128_MI16x16x1_SN_LDSB1_CLR1_GSU0_GSUC0_GSUWGMRR0_K1_LBSPPA256_LBSPPB256_LPA16_LPB16_MIWT1_1_PLR2_SU32_SUM0_SUS256_SKXCCM0_VWA1_VWB1_WGM1_WGMXCC1_WGMXCCGn1
    SolutionIndex: 35
    SolutionNameMin: Cijk_Ailk_Bjlk_BBS_BH_UserArgs_MT256x256x32_MI16x16x1_SN_LDSB0_CLR1_GSU0_GSUC0_GSUWGMRR0_K1_LBSPPA2048_LBSPPB2048_LPA0_LPB0_MIWT8_8_PLR1_SU32_SUM0_SUS256_SKXCCM4_VWA8_VWB4_WGM1_WGMXCC1_WGMXCCGn1
    SolutionIndex: 36
    SolutionNameMin: Cijk_Ailk_Bjlk_BBS_BH_UserArgs_MT256x256x32_MI16x16x1_SN_LDSB0_CLR1_GSU0_GSUC0_GSUWGMRR0_K1_LBSPPA2048_LBSPPB2048_LPA0_LPB0_MIWT8_8_PLR1_SU32_SUM0_SUS256_SKXCCM4_VWA8_VWB8_WGM1_WGMXCC1_WGMXCCGn1
    SolutionIndex: 37
    SolutionNameMin: Cijk_Ailk_Bjlk_BBS_BH_UserArgs_MT128x256x32_MI16x16x1_SN_LDSB1_CLR1_GSU0_GSUC0_GSUWGMRR0_K1_LBSPPA1024_LBSPPB2048_LPA0_LPB32_MIWT4_8_PLR1_SU32_SUM0_SUS256_SKXCCM4_VWA4_VWB2_WGM1_WGMXCC1_WGMXCCGn1
    SolutionIndex: 38
    SolutionNameMin: Cijk_Ailk_Bjlk_BBS_BH_UserArgs_MT128x256x32_MI16x16x1_SN_LDSB1_CLR1_GSU0_GSUC0_GSUWGMRR0_K1_LBSPPA1024_LBSPPB2048_LPA32_LPB0_MIWT4_8_PLR1_SU32_SUM0_SUS256_SKXCCM4_VWA2_VWB4_WGM1_WGMXCC1_WGMXCCGn1
    SolutionIndex: 39
    SolutionNameMin: Cijk_Ailk_Bjlk_BBS_BH_UserArgs_MT128x256x32_MI16x16x1_SN_LDSB1_CLR1_GSU0_GSUC0_GSUWGMRR0_K1_LBSPPA1024_LBSPPB2048_LPA32_LPB0_MIWT4_8_PLR1_SU32_SUM0_SUS256_SKXCCM4_VWA2_VWB8_WGM1_WGMXCC1_WGMXCCGn1
    SolutionIndex: 40
    SolutionNameMin: Cijk_Ailk_Bjlk_BBS_BH_UserArgs_MT128x256x32_MI16x16x1_SN_LDSB1_CLR1_GSU0_GSUC0_GSUWGMRR0_K1_LBSPPA1024_LBSPPB2048_LPA0_LPB0_MIWT4_8_PLR1_SU32_SUM0_SUS256_SKXCCM4_VWA4_VWB8_WGM1_WGMXCC1_WGMXCCGn1
    SolutionIndex: 41
    SolutionNameMin: Cijk_Ailk_Bjlk_BBS_BH_UserArgs_MT128x256x32_MI16x16x1_SN_LDSB1_CLR1_GSU0_GSUC0_GSUWGMRR0_K1_LBSPPA1024_LBSPPB2048_LPA0_LPB32_MIWT4_8_PLR1_SU32_SUM0_SUS256_SKXCCM4_VWA4_VWB2_WGM2_WGMXCC1_WGMXCCGn1
    SolutionIndex: 42
    SolutionNameMin: Cijk_Ailk_Bjlk_BBS_BH_UserArgs_MT128x256x32_MI16x16x1_SN_LDSB1_CLR1_GSU0_GSUC0_GSUWGMRR0_K1_LBSPPA1024_LBSPPB2048_LPA32_LPB0_MIWT4_8_PLR1_SU32_SUM0_SUS256_SKXCCM4_VWA2_VWB8_WGM2_WGMXCC1_WGMXCCGn1
    SolutionIndex: 43
    SolutionNameMin: Cijk_Ailk_Bjlk_BBS_BH_UserArgs_MT128x256x32_MI16x16x1_SN_LDSB1_CLR1_GSU0_GSUC0_GSUWGMRR0_K1_LBSPPA1024_LBSPPB2048_LPA0_LPB32_MIWT4_8_PLR1_SU32_SUM0_SUS256_SKXCCM4_VWA4_VWB2_WGM4_WGMXCC1_WGMXCCGn1
    SolutionIndex: 44
    SolutionNameMin: Cijk_Ailk_Bjlk_BBS_BH_UserArgs_MT128x256x32_MI16x16x1_SN_LDSB1_CLR1_GSU0_GSUC0_GSUWGMRR0_K1_LBSPPA1024_LBSPPB2048_LPA0_LPB0_MIWT4_8_PLR1_SU32_SUM0_SUS256_SKXCCM4_VWA4_VWB8_WGM4_WGMXCC1_WGMXCCGn1
    SolutionIndex: 45
    SolutionNameMin: Cijk_Ailk_Bjlk_BBS_BH_UserArgs_MT256x128x32_MI16x16x1_SN_LDSB1_CLR1_GSU0_GSUC0_GSUWGMRR0_K1_LBSPPA2048_LBSPPB1024_LPA0_LPB16_MIWT8_4_PLR1_SU32_SUM0_SUS256_SKXCCM4_VWA4_VWB1_WGM1_WGMXCC1_WGMXCCGn1
    SolutionIndex: 46
    SolutionNameMin: Cijk_Ailk_Bjlk_BBS_BH_UserArgs_MT256x128x32_MI16x16x1_SN_LDSB1_CLR1_GSU0_GSUC0_GSUWGMRR0_K1_LBSPPA2048_LBSPPB1024_LPA0_LPB16_MIWT8_4_PLR1_SU32_SUM0_SUS256_SKXCCM4_VWA8_VWB1_WGM1_WGMXCC1_WGMXCCGn1
    SolutionIndex: 47
    SolutionNameMin: Cijk_Ailk_Bjlk_BBS_BH_UserArgs_MT256x128x32_MI16x16x1_SN_LDSB1_CLR1_GSU0_GSUC0_GSUWGMRR0_K1_LBSPPA2048_LBSPPB1024_LPA0_LPB0_MIWT8_4_PLR1_SU32_SUM0_SUS256_SKXCCM4_VWA4_VWB4_WGM1_WGMXCC1_WGMXCCGn1
    SolutionIndex: 48
    SolutionNameMin: Cijk_Ailk_Bjlk_BBS_BH_UserArgs_MT256x128x32_MI16x16x1_SN_LDSB1_CLR1_GSU0_GSUC0_GSUWGMRR0_K1_LBSPPA2048_LBSPPB1024_LPA0_LPB0_MIWT8_4_PLR1_SU32_SUM0_SUS256_SKXCCM4_VWA8_VWB4_WGM1_WGMXCC1_WGMXCCGn1
    SolutionIndex: 49
    SolutionNameMin: Cijk_Ailk_Bjlk_BBS_BH_UserArgs_MT256x128x32_MI16x16x1_SN_LDSB1_CLR1_GSU0_GSUC0_GSUWGMRR0_K1_LBSPPA2048_LBSPPB1024_LPA0_LPB16_MIWT8_4_PLR1_SU32_SUM0_SUS256_SKXCCM4_VWA4_VWB1_WGM4_WGMXCC1_WGMXCCGn1
    SolutionIndex: 50
    SolutionNameMin: Cijk_Ailk_Bjlk_BBS_BH_UserArgs_MT256x128x32_MI16x16x1_SN_LDSB1_CLR1_GSU0_GSUC0_GSUWGMRR0_K1_LBSPPA2048_LBSPPB1024_LPA0_LPB16_MIWT8_4_PLR1_SU32_SUM0_SUS256_SKXCCM4_VWA8_VWB1_WGM4_WGMXCC1_WGMXCCGn1
    SolutionIndex: 51
    SolutionNameMin: Cijk_Ailk_Bjlk_BBS_BH_UserArgs_MT256x128x32_MI16x16x1_SN_LDSB1_CLR1_GSU0_GSUC0_GSUWGMRR0_K1_LBSPPA2048_LBSPPB1024_LPA0_LPB0_MIWT8_4_PLR1_SU32_SUM0_SUS256_SKXCCM4_VWA4_VWB4_WGM4_WGMXCC1_WGMXCCGn1
    SolutionIndex: 52
    SolutionNameMin: Cijk_Ailk_Bjlk_BBS_BH_UserArgs_MT256x128x32_MI16x16x1_SN_LDSB1_CLR1_GSU0_GSUC0_GSUWGMRR0_K1_LBSPPA2048_LBSPPB1024_LPA0_LPB0_MIWT8_4_PLR1_SU32_SUM0_SUS256_SKXCCM4_VWA8_VWB4_WGM4_WGMXCC1_WGMXCCGn1
    SolutionIndex: 53
    SolutionNameMin: Cijk_Ailk_Bjlk_BBS_BH_UserArgs_MT128x128x32_MI16x16x1_SN_LDSB1_CLR1_GSU0_GSUC0_GSUWGMRR0_K1_LBSPPA1024_LBSPPB1024_LPA32_LPB16_MIWT4_4_PLR1_SU32_SUM0_SUS256_SKXCCM4_VWA2_VWB1_WGM1_WGMXCC1_WGMXCCGn1
    SolutionIndex: 54
    SolutionNameMin: Cijk_Ailk_Bjlk_BBS_BH_UserArgs_MT128x128x32_MI16x16x1_SN_LDSB0_CLR1_GSU0_GSUC0_GSUWGMRR0_K1_LBSPPA1024_LBSPPB1024_LPA0_LPB0_MIWT4_4_PLR1_SU32_SUM0_SUS256_SKXCCM4_VWA4_VWB4_WGM1_WGMXCC1_WGMXCCGn1
    SolutionIndex: 55
    SolutionNameMin: Cijk_Ailk_Bjlk_BBS_BH_UserArgs_MT64x128x32_MI16x16x1_SN_LDSB0_CLR0_GSU0_GSUC0_GSUWGMRR0_K1_LBSPPA512_LBSPPB1024_LPA32_LPB0_MIWT2_4_PLR0_SU32_SUM0_SUS256_SKXCCM4_VWA2_VWB4_WGM1_WGMXCC1_WGMXCCGn1
    SolutionIndex: 56
    SolutionNameMin: Cijk_Ailk_Bjlk_BBS_BH_UserArgs_MT64x128x32_MI16x16x1_SN_LDSB0_CLR0_GSU0_GSUC0_GSUWGMRR0_K1_LBSPPA512_LBSPPB1024_LPA32_LPB0_MIWT2_4_PLR0_SU32_SUM0_SUS256_SKXCCM4_VWA2_VWB4_WGM2_WGMXCC1_WGMXCCGn1
    SolutionIndex: 57
    SolutionNameMin: Cijk_Ailk_Bjlk_BBS_BH_UserArgs_MT64x128x32_MI16x16x1_SN_LDSB0_CLR0_GSU0_GSUC0_GSUWGMRR0_K1_LBSPPA512_LBSPPB1024_LPA32_LPB0_MIWT2_4_PLR0_SU32_SUM0_SUS256_SKXCCM4_VWA2_VWB4_WGM4_WGMXCC1_WGMXCCGn1
    SolutionIndex: 58
    SolutionNameMin: Cijk_Ailk_Bjlk_BBS_BH_UserArgs_MT128x64x32_MI16x16x1_SN_LDSB0_CLR1_GSU0_GSUC0_GSUWGMRR0_K1_LBSPPA1024_LBSPPB512_LPA0_LPB32_MIWT4_2_PLR1_SU32_SUM0_SUS256_SKXCCM4_VWA4_VWB2_WGM1_WGMXCC1_WGMXCCGn1
    SolutionIndex: 59
    SolutionNameMin: Cijk_Ailk_Bjlk_BBS_BH_UserArgs_MT128x64x32_MI16x16x1_SN_LDSB0_CLR0_GSU0_GSUC0_GSUWGMRR0_K1_LBSPPA1024_LBSPPB512_LPA0_LPB32_MIWT4_2_PLR0_SU32_SUM0_SUS256_SKXCCM4_VWA4_VWB2_WGM1_WGMXCC1_WGMXCCGn1
    SolutionIndex: 60
    SolutionNameMin: Cijk_Ailk_Bjlk_BBS_BH_UserArgs_MT64x64x32_MI16x16x1_SN_LDSB0_CLR1_GSU0_GSUC0_GSUWGMRR0_K1_LBSPPA512_LBSPPB512_LPA32_LPB32_MIWT2_2_PLR1_SU32_SUM0_SUS256_SKXCCM4_VWA2_VWB2_WGM4_WGMXCC1_WGMXCCGn1
    SolutionIndex: 61
    SolutionNameMin: Cijk_Ailk_Bjlk_BBS_BH_UserArgs_MT32x64x32_MI16x16x1_SN_LDSB0_CLR1_GSU0_GSUC0_GSUWGMRR0_K1_LBSPPA256_LBSPPB512_LPA16_LPB32_MIWT1_2_PLR1_SU32_SUM0_SUS256_SKXCCM4_VWA1_VWB2_WGM1_WGMXCC1_WGMXCCGn1
    SolutionIndex: 62
    SolutionNameMin: Cijk_Ailk_Bjlk_BBS_BH_UserArgs_MT32x64x32_MI16x16x1_SN_LDSB0_CLR0_GSU0_GSUC0_GSUWGMRR0_K1_LBSPPA256_LBSPPB512_LPA16_LPB32_MIWT1_2_PLR0_SU32_SUM0_SUS256_SKXCCM4_VWA1_VWB2_WGM1_WGMXCC1_WGMXCCGn1
    SolutionIndex: 63
    SolutionNameMin: Cijk_Ailk_Bjlk_BBS_BH_UserArgs_MT256x256x64_MI16x16x1_SN_LDSB1_CLR1_GSU0_GSUC0_GSUWGMRR0_K1_LBSPPA2048_LBSPPB2048_LPA0_LPB0_MIWT8_8_PLR1_SU32_SUM0_SUS256_SKXCCM4_VWA4_VWB4_WGM1_WGMXCC1_WGMXCCGn1
    SolutionIndex: 64
    SolutionNameMin: Cijk_Ailk_Bjlk_BBS_BH_UserArgs_MT256x256x64_MI16x16x1_SN_LDSB1_CLR1_GSU0_GSUC0_GSUWGMRR0_K1_LBSPPA2048_LBSPPB2048_LPA0_LPB0_MIWT8_8_PLR2_SU32_SUM0_SUS256_SKXCCM4_VWA4_VWB4_WGM2_WGMXCC1_WGMXCCGn1
    SolutionIndex: 65
    SolutionNameMin: Cijk_Ailk_Bjlk_BBS_BH_UserArgs_MT128x128x64_MI16x16x1_SN_LDSB1_CLR1_GSU0_GSUC0_GSUWGMRR0_K1_LBSPPA1024_LBSPPB1024_LPA0_LPB0_MIWT4_4_PLR1_SU32_SUM0_SUS256_SKXCCM4_VWA4_VWB4_WGM1_WGMXCC1_WGMXCCGn1
    SolutionIndex: 66
    SolutionNameMin: Cijk_Ailk_Bjlk_BBS_BH_UserArgs_MT128x128x64_MI16x16x1_SN_LDSB1_CLR1_GSU0_GSUC0_GSUWGMRR0_K1_LBSPPA1024_LBSPPB1024_LPA0_LPB0_MIWT4_4_PLR1_SU32_SUM0_SUS256_SKXCCM4_VWA4_VWB4_WGM2_WGMXCC1_WGMXCCGn1
    SolutionIndex: 67
    SolutionNameMin: Cijk_Ailk_Bjlk_BBS_BH_UserArgs_MT128x128x64_MI16x16x1_SN_LDSB1_CLR1_GSU0_GSUC0_GSUWGMRR0_K1_LBSPPA1024_LBSPPB1024_LPA0_LPB0_MIWT4_4_PLR1_SU32_SUM0_SUS256_SKXCCM4_VWA4_VWB4_WGM4_WGMXCC1_WGMXCCGn1
    SolutionIndex: 68
    SolutionNameMin: Cijk_Ailk_Bjlk_BBS_BH_UserArgs_MT64x128x64_MI16x16x1_SN_LDSB1_CLR1_GSU0_GSUC0_GSUWGMRR0_K1_LBSPPA512_LBSPPB1024_LPA32_LPB0_MIWT2_4_PLR1_SU32_SUM0_SUS256_SKXCCM4_VWA2_VWB4_WGM1_WGMXCC1_WGMXCCGn1
    SolutionIndex: 69
    SolutionNameMin: Cijk_Ailk_Bjlk_BBS_BH_UserArgs_MT128x64x64_MI16x16x1_SN_LDSB1_CLR1_GSU0_GSUC0_GSUWGMRR0_K1_LBSPPA1024_LBSPPB512_LPA0_LPB32_MIWT4_2_PLR1_SU32_SUM0_SUS256_SKXCCM4_VWA4_VWB2_WGM1_WGMXCC1_WGMXCCGn1
    SolutionIndex: 70
    SolutionNameMin: Cijk_Ailk_Bjlk_BBS_BH_UserArgs_MT128x64x64_MI16x16x1_SN_LDSB1_CLR1_GSU0_GSUC0_GSUWGMRR0_K1_LBSPPA1024_LBSPPB512_LPA0_LPB32_MIWT4_2_PLR2_SU32_SUM0_SUS256_SKXCCM4_VWA4_VWB2_WGM1_WGMXCC1_WGMXCCGn1
    SolutionIndex: 71
    SolutionNameMin: Cijk_Ailk_Bjlk_BBS_BH_UserArgs_MT128x64x64_MI16x16x1_SN_LDSB1_CLR1_GSU0_GSUC0_GSUWGMRR0_K1_LBSPPA1024_LBSPPB512_LPA0_LPB32_MIWT4_2_PLR2_SU32_SUM0_SUS256_SKXCCM4_VWA4_VWB2_WGM2_WGMXCC1_WGMXCCGn1
    SolutionIndex: 72
    SolutionNameMin: Cijk_Ailk_Bjlk_BBS_BH_UserArgs_MT64x64x64_MI16x16x1_SN_LDSB1_CLR1_GSU0_GSUC0_GSUWGMRR0_K1_LBSPPA512_LBSPPB512_LPA32_LPB32_MIWT2_2_PLR1_SU32_SUM0_SUS256_SKXCCM4_VWA2_VWB2_WGM1_WGMXCC1_WGMXCCGn1
    SolutionIndex: 73
    SolutionNameMin: Cijk_Ailk_Bjlk_BBS_BH_UserArgs_MT64x64x64_MI16x16x1_SN_LDSB1_CLR1_GSU0_GSUC0_GSUWGMRR0_K1_LBSPPA512_LBSPPB512_LPA32_LPB32_MIWT2_2_PLR1_SU32_SUM0_SUS256_SKXCCM4_VWA2_VWB2_WGM2_WGMXCC1_WGMXCCGn1
    SolutionIndex: 74
    SolutionNameMin: Cijk_Ailk_Bjlk_BBS_BH_UserArgs_MT64x64x64_MI16x16x1_SN_LDSB1_CLR1_GSU0_GSUC0_GSUWGMRR0_K1_LBSPPA512_LBSPPB512_LPA32_LPB32_MIWT2_2_PLR1_SU32_SUM0_SUS256_SKXCCM4_VWA2_VWB2_WGM4_WGMXCC1_WGMXCCGn1
    SolutionIndex: 75
    SolutionNameMin: Cijk_Ailk_Bjlk_BBS_BH_UserArgs_MT32x64x64_MI16x16x1_SN_LDSB0_CLR1_GSU0_GSUC0_GSUWGMRR0_K1_LBSPPA256_LBSPPB512_LPA16_LPB32_MIWT1_2_PLR2_SU32_SUM0_SUS256_SKXCCM4_VWA1_VWB2_WGM1_WGMXCC1_WGMXCCGn1
    SolutionIndex: 76
    SolutionNameMin: Cijk_Ailk_Bjlk_BBS_BH_UserArgs_MT64x32x64_MI16x16x1_SN_LDSB0_CLR1_GSU0_GSUC0_GSUWGMRR0_K1_LBSPPA512_LBSPPB256_LPA32_LPB16_MIWT2_1_PLR1_SU32_SUM0_SUS256_SKXCCM4_VWA2_VWB1_WGM1_WGMXCC1_WGMXCCGn1
    SolutionIndex: 77
    SolutionNameMin: Cijk_Ailk_Bjlk_BBS_BH_UserArgs_MT64x32x64_MI16x16x1_SN_LDSB0_CLR1_GSU0_GSUC0_GSUWGMRR0_K1_LBSPPA512_LBSPPB256_LPA32_LPB16_MIWT2_1_PLR2_SU32_SUM0_SUS256_SKXCCM4_VWA2_VWB1_WGM1_WGMXCC1_WGMXCCGn1
    SolutionIndex: 78
    SolutionNameMin: Cijk_Ailk_Bjlk_BBS_BH_UserArgs_MT32x32x64_MI16x16x1_SN_LDSB0_CLR1_GSU0_GSUC0_GSUWGMRR0_K1_LBSPPA256_LBSPPB256_LPA16_LPB16_MIWT1_1_PLR1_SU32_SUM0_SUS256_SKXCCM4_VWA1_VWB1_WGM1_WGMXCC1_WGMXCCGn1
    SolutionIndex: 79
    SolutionNameMin: Cijk_Ailk_Bjlk_BBS_BH_UserArgs_MT128x128x128_MI16x16x1_SN_LDSB1_CLR1_GSU0_GSUC0_GSUWGMRR0_K1_LBSPPA1024_LBSPPB1024_LPA0_LPB0_MIWT4_4_PLR1_SU32_SUM0_SUS256_SKXCCM4_VWA4_VWB4_WGM1_WGMXCC1_WGMXCCGn1
    SolutionIndex: 80
    SolutionNameMin: Cijk_Ailk_Bjlk_BBS_BH_UserArgs_MT128x128x128_MI16x16x1_SN_LDSB1_CLR1_GSU0_GSUC0_GSUWGMRR0_K1_LBSPPA1024_LBSPPB1024_LPA0_LPB0_MIWT4_4_PLR1_SU32_SUM0_SUS256_SKXCCM4_VWA4_VWB4_WGM4_WGMXCC1_WGMXCCGn1
    SolutionIndex: 81
    SolutionNameMin: Cijk_Ailk_Bjlk_BBS_BH_UserArgs_MT64x64x128_MI16x16x1_SN_LDSB1_CLR1_GSU0_GSUC0_GSUWGMRR0_K1_LBSPPA512_LBSPPB512_LPA32_LPB32_MIWT2_2_PLR2_SU32_SUM0_SUS256_SKXCCM4_VWA2_VWB2_WGM1_WGMXCC1_WGMXCCGn1
    SolutionIndex: 82
    SolutionNameMin: Cijk_Ailk_Bjlk_BBS_BH_UserArgs_MT64x64x128_MI16x16x1_SN_LDSB1_CLR1_GSU0_GSUC0_GSUWGMRR0_K1_LBSPPA512_LBSPPB512_LPA32_LPB32_MIWT2_2_PLR2_SU32_SUM0_SUS256_SKXCCM4_VWA2_VWB2_WGM2_WGMXCC1_WGMXCCGn1
    SolutionIndex: 83
    SolutionNameMin: Cijk_Ailk_Bjlk_BBS_BH_UserArgs_MT32x64x128_MI16x16x1_SN_LDSB1_CLR1_GSU0_GSUC0_GSUWGMRR0_K1_LBSPPA256_LBSPPB512_LPA16_LPB32_MIWT1_2_PLR2_SU32_SUM0_SUS256_SKXCCM4_VWA1_VWB2_WGM1_WGMXCC1_WGMXCCGn1
    SolutionIndex: 84
    SolutionNameMin: Cijk_Ailk_Bjlk_BBS_BH_UserArgs_MT64x32x128_MI16x16x1_SN_LDSB1_CLR1_GSU0_GSUC0_GSUWGMRR0_K1_LBSPPA512_LBSPPB256_LPA32_LPB16_MIWT2_1_PLR1_SU32_SUM0_SUS256_SKXCCM4_VWA2_VWB1_WGM1_WGMXCC1_WGMXCCGn1
    SolutionIndex: 85
    SolutionNameMin: Cijk_Ailk_Bjlk_BBS_BH_UserArgs_MT64x32x128_MI16x16x1_SN_LDSB1_CLR1_GSU0_GSUC0_GSUWGMRR0_K1_LBSPPA512_LBSPPB256_LPA32_LPB16_MIWT2_1_PLR2_SU32_SUM0_SUS256_SKXCCM4_VWA2_VWB1_WGM1_WGMXCC1_WGMXCCGn1
    SolutionIndex: 86
    SolutionNameMin: Cijk_Ailk_Bjlk_BBS_BH_UserArgs_MT32x32x128_MI16x16x1_SN_LDSB1_CLR1_GSU0_GSUC0_GSUWGMRR0_K1_LBSPPA256_LBSPPB256_LPA16_LPB16_MIWT1_1_PLR1_SU32_SUM0_SUS256_SKXCCM4_VWA1_VWB1_WGM1_WGMXCC1_WGMXCCGn1
    SolutionIndex: 87
    SolutionNameMin: Cijk_Ailk_Bjlk_BBS_BH_UserArgs_MT32x32x32_MI16x16x1_SN_LDSB0_CLR1_GSU0_GSUC0_GSUWGMRR0_K1_LBSPPA256_LBSPPB256_LPA16_LPB16_MIWT1_1_PLR1_SU32_SUM0_SUS256_SKXCCM0_VWA1_VWB1_WGM2_WGMXCC1_WGMXCCGn1
- - - [128, 128, 1, 128, 128, 128, 128, 128]
    - [86, 0.08]
  - - [128, 128, 1, 256, 128, 128, 128, 128]
    - [34, 0.106]
  - - [128, 128, 1, 512, 128, 128, 128, 128]
    - [33, 0.179]
  - - [128, 128, 1, 1024, 128, 128, 128, 128]
    - [29, 0.278]
  - - [128, 128, 1, 2048, 128, 128, 128, 128]
    - [34, 0.51]
  - - [128, 128, 1, 4096, 128, 128, 128, 128]
    - [78, 0.841]
  - - [128, 128, 1, 8192, 128, 128, 128, 128]
    - [19, 1.358]
  - - [128, 256, 1, 128, 128, 128, 128, 256]
    - [86, 0.158]
  - - [128, 256, 1, 256, 128, 128, 128, 256]
    - [33, 0.209]
  - - [128, 256, 1, 512, 128, 128, 128, 256]
    - [33, 0.347]
  - - [128, 256, 1, 1024, 128, 128, 128, 256]
    - [33, 0.567]
  - - [128, 256, 1, 2048, 128, 128, 128, 256]
    - [19, 1.013]
  - - [128, 256, 1, 4096, 128, 128, 128, 256]
    - [75, 1.529]
  - - [128, 256, 1, 8192, 128, 128, 128, 256]
    - [83, 2.329]
  - - [128, 512, 1, 128, 128, 128, 128, 512]
    - [86, 0.31]
  - - [128, 512, 1, 256, 128, 128, 128, 512]
    - [34, 0.401]
  - - [128, 512, 1, 512, 128, 128, 128, 512]
    - [20, 0.669]
  - - [128, 512, 1, 1024, 128, 128, 128, 512]
    - [33, 1.103]
  - - [128, 512, 1, 2048, 128, 128, 128, 512]
    - [61, 1.699]
  - - [128, 512, 1, 4096, 128, 128, 128, 512]
    - [75, 2.63]
  - - [128, 512, 1, 8192, 128, 128, 128, 512]
    - [81, 3.889]
  - - [128, 1024, 1, 128, 128, 128, 128, 1024]
    - [32, 0.594]
  - - [128, 1024, 1, 256, 128, 128, 128, 1024]
    - [19, 0.93]
  - - [128, 1024, 1, 512, 128, 128, 128, 1024]
    - [86, 1.381]
  - - [128, 1024, 1, 1024, 128, 128, 128, 1024]
    - [77, 1.999]
  - - [128, 1024, 1, 2048, 128, 128, 128, 1024]
    - [60, 2.871]
  - - [128, 1024, 1, 4096, 128, 128, 128, 1024]
    - [72, 4.349]
  - - [128, 1024, 1, 8192, 128, 128, 128, 1024]
    - [70, 6.065]
  - - [128, 2048, 1, 128, 128, 128, 128, 2048]
    - [81, 1.058]
  - - [128, 2048, 1, 256, 128, 128, 128, 2048]
    - [77, 1.69]
  - - [128, 2048, 1, 512, 128, 128, 128, 2048]
    - [27, 2.551]
  - - [128, 2048, 1, 1024, 128, 128, 128, 2048]
    - [72, 3.416]
  - - [128, 2048, 1, 2048, 128, 128, 128, 2048]
    - [59, 4.559]
  - - [128, 2048, 1, 4096, 128, 128, 128, 2048]
    - [65, 6.516]
  - - [128, 2048, 1, 8192, 128, 128, 128, 2048]
    - [22, 9.521]
  - - [128, 4096, 1, 128, 128, 128, 128, 4096]
    - [72, 1.792]
  - - [128, 4096, 1, 256, 128, 128, 128, 4096]
    - [26, 2.972]
  - - [128, 4096, 1, 512, 128, 128, 128, 4096]
    - [72, 4.361]
  - - [128, 4096, 1, 1024, 128, 128, 128, 4096]
    - [70, 5.134]
  - - [128, 4096, 1, 2048, 128, 128, 128, 4096]
    - [54, 6.389]
  - - [128, 4096, 1, 4096, 128, 128, 128, 4096]
    - [65, 9.461]
  - - [128, 4096, 1, 8192, 128, 128, 128, 4096]
    - [23, 12.012]
  - - [128, 8192, 1, 128, 128, 128, 128, 8192]
    - [58, 2.89]
  - - [128, 8192, 1, 256, 128, 128, 128, 8192]
    - [55, 4.612]
  - - [128, 8192, 1, 512, 128, 128, 128, 8192]
    - [71, 6.116]
  - - [128, 8192, 1, 1024, 128, 128, 128, 8192]
    - [65, 7.717]
  - - [128, 8192, 1, 2048, 128, 128, 128, 8192]
    - [30, 8.126]
  - - [128, 8192, 1, 4096, 128, 128, 128, 8192]
    - [7, 10.954]
  - - [128, 8192, 1, 8192, 128, 128, 128, 8192]
    - [24, 13.059]
  - - [256, 128, 1, 128, 256, 256, 256, 128]
    - [33, 0.162]
  - - [256, 128, 1, 256, 256, 256, 256, 128]
    - [34, 0.209]
  - - [256, 128, 1, 512, 256, 256, 256, 128]
    - [33, 0.348]
  - - [256, 128, 1, 1024, 256, 256, 256, 128]
    - [33, 0.568]
  - - [256, 128, 1, 2048, 256, 256, 256, 128]
    - [19, 1.01]
  - - [256, 128, 1, 4096, 256, 256, 256, 128]
    - [75, 1.536]
  - - [256, 128, 1, 8192, 256, 256, 256, 128]
    - [32, 2.323]
  - - [256, 256, 1, 128, 256, 256, 256, 256]
    - [33, 0.316]
  - - [256, 256, 1, 256, 256, 256, 256, 256]
    - [33, 0.407]
  - - [256, 256, 1, 512, 256, 256, 256, 256]
    - [19, 0.677]
  - - [256, 256, 1, 1024, 256, 256, 256, 256]
    - [33, 1.104]
  - - [256, 256, 1, 2048, 256, 256, 256, 256]
    - [62, 1.731]
  - - [256, 256, 1, 4096, 256, 256, 256, 256]
    - [76, 2.657]
  - - [256, 256, 1, 8192, 256, 256, 256, 256]
    - [31, 3.778]
  - - [256, 512, 1, 128, 256, 256, 256, 512]
    - [32, 0.6]
  - - [256, 512, 1, 256, 256, 256, 256, 512]
    - [19, 0.942]
  - - [256, 512, 1, 512, 256, 256, 256, 512]
    - [34, 1.41]
  - - [256, 512, 1, 1024, 256, 256, 256, 512]
    - [84, 1.985]
  - - [256, 512, 1, 2048, 256, 256, 256, 512]
    - [84, 2.903]
  - - [256, 512, 1, 4096, 256, 256, 256, 512]
    - [72, 4.384]
  - - [256, 512, 1, 8192, 256, 256, 256, 512]
    - [70, 6.153]
  - - [256, 1024, 1, 128, 256, 256, 256, 1024]
    - [31, 1.092]
  - - [256, 1024, 1, 256, 256, 256, 256, 1024]
    - [77, 1.693]
  - - [256, 1024, 1, 512, 256, 256, 256, 1024]
    - [77, 2.561]
  - - [256, 1024, 1, 1024, 256, 256, 256, 1024]
    - [72, 3.436]
  - - [256, 1024, 1, 2048, 256, 256, 256, 1024]
    - [59, 4.532]
  - - [256, 1024, 1, 4096, 256, 256, 256, 1024]
    - [22, 6.522]
  - - [256, 1024, 1, 8192, 256, 256, 256, 1024]
    - [65, 9.52]
  - - [256, 2048, 1, 128, 256, 256, 256, 2048]
    - [72, 1.821]
  - - [256, 2048, 1, 256, 256, 256, 256, 2048]
    - [72, 2.975]
  - - [256, 2048, 1, 512, 256, 256, 256, 2048]
    - [72, 4.367]
  - - [256, 2048, 1, 1024, 256, 256, 256, 2048]
    - [70, 5.11]
  - - [256, 2048, 1, 2048, 256, 256, 256, 2048]
    - [14, 6.4]
  - - [256, 2048, 1, 4096, 256, 256, 256, 2048]
    - [65, 9.44]
  - - [256, 2048, 1, 8192, 256, 256, 256, 2048]
    - [22, 11.872]
  - - [256, 4096, 1, 128, 256, 256, 256, 4096]
    - [16, 2.91]
  - - [256, 4096, 1, 256, 256, 256, 256, 4096]
    - [56, 4.576]
  - - [256, 4096, 1, 512, 256, 256, 256, 4096]
    - [70, 6.176]
  - - [256, 4096, 1, 1024, 256, 256, 256, 4096]
    - [65, 7.74]
  - - [256, 4096, 1, 2048, 256, 256, 256, 4096]
    - [30, 8.184]
  - - [256, 4096, 1, 4096, 256, 256, 256, 4096]
    - [6, 10.889]
  - - [256, 4096, 1, 8192, 256, 256, 256, 4096]
    - [22, 13.173]
  - - [256, 8192, 1, 128, 256, 256, 256, 8192]
    - [53, 4.17]
  - - [256, 8192, 1, 256, 256, 256, 256, 8192]
    - [65, 6.284]
  - - [256, 8192, 1, 512, 256, 256, 256, 8192]
    - [65, 8.8]
  - - [256, 8192, 1, 1024, 256, 256, 256, 8192]
    - [79, 9.546]
  - - [256, 8192, 1, 2048, 256, 256, 256, 8192]
    - [65, 11.038]
  - - [256, 8192, 1, 4096, 256, 256, 256, 8192]
    - [67, 13.162]
  - - [256, 8192, 1, 8192, 256, 256, 256, 8192]
    - [66, 13.935]
  - - [512, 128, 1, 128, 512, 512, 512, 128]
    - [34, 0.313]
  - - [512, 128, 1, 256, 512, 512, 512, 128]
    - [34, 0.407]
  - - [512, 128, 1, 512, 512, 512, 512, 128]
    - [19, 0.677]
  - - [512, 128, 1, 1024, 512, 512, 512, 128]
    - [33, 1.11]
  - - [512, 128, 1, 2048, 512, 512, 512, 128]
    - [61, 1.697]
  - - [512, 128, 1, 4096, 512, 512, 512, 128]
    - [75, 2.615]
  - - [512, 128, 1, 8192, 512, 512, 512, 128]
    - [82, 3.716]
  - - [512, 256, 1, 128, 512, 512, 512, 256]
    - [32, 0.605]
  - - [512, 256, 1, 256, 512, 512, 512, 256]
    - [19, 0.945]
  - - [512, 256, 1, 512, 512, 512, 512, 256]
    - [33, 1.409]
  - - [512, 256, 1, 1024, 512, 512, 512, 256]
    - [84, 2.005]
  - - [512, 256, 1, 2048, 512, 512, 512, 256]
    - [84, 2.915]
  - - [512, 256, 1, 4096, 512, 512, 512, 256]
    - [74, 4.337]
  - - [512, 256, 1, 8192, 512, 512, 512, 256]
    - [70, 6.14]
  - - [512, 512, 1, 128, 512, 512, 512, 512]
    - [31, 1.1]
  - - [512, 512, 1, 256, 512, 512, 512, 512]
    - [28, 1.71]
  - - [512, 512, 1, 512, 512, 512, 512, 512]
    - [77, 2.574]
  - - [512, 512, 1, 1024, 512, 512, 512, 512]
    - [72, 3.438]
  - - [512, 512, 1, 2048, 512, 512, 512, 512]
    - [59, 4.514]
  - - [512, 512, 1, 4096, 512, 512, 512, 512]
    - [65, 6.567]
  - - [512, 512, 1, 8192, 512, 512, 512, 512]
    - [22, 9.526]
  - - [512, 1024, 1, 128, 512, 512, 512, 1024]
    - [26, 1.839]
  - - [512, 1024, 1, 256, 512, 512, 512, 1024]
    - [72, 2.975]
  - - [512, 1024, 1, 512, 512, 512, 512, 1024]
    - [26, 4.35]
  - - [512, 1024, 1, 1024, 512, 512, 512, 1024]
    - [69, 5.182]
  - - [512, 1024, 1, 2048, 512, 512, 512, 1024]
    - [15, 6.396]
  - - [512, 1024, 1, 4096, 512, 512, 512, 1024]
    - [65, 9.494]
  - - [512, 1024, 1, 8192, 512, 512, 512, 1024]
    - [22, 11.766]
  - - [512, 2048, 1, 128, 512, 512, 512, 2048]
    - [16, 2.892]
  - - [512, 2048, 1, 256, 512, 512, 512, 2048]
    - [17, 4.424]
  - - [512, 2048, 1, 512, 512, 512, 512, 2048]
    - [71, 6.12]
  - - [512, 2048, 1, 1024, 512, 512, 512, 2048]
    - [65, 7.656]
  - - [512, 2048, 1, 2048, 512, 512, 512, 2048]
    - [30, 8.236]
  - - [512, 2048, 1, 4096, 512, 512, 512, 2048]
    - [10, 10.806]
  - - [512, 2048, 1, 8192, 512, 512, 512, 2048]
    - [67, 13.134]
  - - [512, 4096, 1, 128, 512, 512, 512, 4096]
    - [53, 4.167]
  - - [512, 4096, 1, 256, 512, 512, 512, 4096]
    - [65, 6.231]
  - - [512, 4096, 1, 512, 512, 512, 512, 4096]
    - [66, 8.78]
  - - [512, 4096, 1, 1024, 512, 512, 512, 4096]
    - [79, 9.566]
  - - [512, 4096, 1, 2048, 512, 512, 512, 4096]
    - [65, 10.984]
  - - [512, 4096, 1, 4096, 512, 512, 512, 4096]
    - [24, 12.535]
  - - [512, 4096, 1, 8192, 512, 512, 512, 4096]
    - [4, 13.976]
  - - [512, 8192, 1, 128, 512, 512, 512, 8192]
    - [46, 5.619]
  - - [512, 8192, 1, 256, 512, 512, 512, 8192]
    - [8, 8.199]
  - - [512, 8192, 1, 512, 512, 512, 512, 8192]
    - [67, 9.68]
  - - [512, 8192, 1, 1024, 512, 512, 512, 8192]
    - [65, 12.025]
  - - [512, 8192, 1, 2048, 512, 512, 512, 8192]
    - [67, 13.455]
  - - [512, 8192, 1, 4096, 512, 512, 512, 8192]
    - [43, 14.037]
  - - [512, 8192, 1, 8192, 512, 512, 512, 8192]
    - [6, 15.833]
  - - [1024, 128, 1, 128, 1024, 1024, 1024, 128]
    - [32, 0.597]
  - - [1024, 128, 1, 256, 1024, 1024, 1024, 128]
    - [33, 0.93]
  - - [1024, 128, 1, 512, 1024, 1024, 1024, 128]
    - [33, 1.422]
  - - [1024, 128, 1, 1024, 1024, 1024, 1024, 128]
    - [85, 2.007]
  - - [1024, 128, 1, 2048, 1024, 1024, 1024, 128]
    - [32, 2.864]
  - - [1024, 128, 1, 4096, 1024, 1024, 1024, 128]
    - [73, 4.277]
  - - [1024, 128, 1, 8192, 1024, 1024, 1024, 128]
    - [25, 6.083]
  - - [1024, 256, 1, 128, 1024, 1024, 1024, 256]
    - [31, 1.097]
  - - [1024, 256, 1, 256, 1024, 1024, 1024, 256]
    - [77, 1.713]
  - - [1024, 256, 1, 512, 1024, 1024, 1024, 256]
    - [77, 2.575]
  - - [1024, 256, 1, 1024, 1024, 1024, 1024, 256]
    - [72, 3.409]
  - - [1024, 256, 1, 2048, 1024, 1024, 1024, 256]
    - [59, 4.596]
  - - [1024, 256, 1, 4096, 1024, 1024, 1024, 256]
    - [22, 6.535]
  - - [1024, 256, 1, 8192, 1024, 1024, 1024, 256]
    - [22, 9.543]
  - - [1024, 512, 1, 128, 1024, 1024, 1024, 512]
    - [26, 1.833]
  - - [1024, 512, 1, 256, 1024, 1024, 1024, 512]
    - [72, 2.985]
  - - [1024, 512, 1, 512, 1024, 1024, 1024, 512]
    - [26, 4.371]
  - - [1024, 512, 1, 1024, 1024, 1024, 1024, 512]
    - [69, 5.197]
  - - [1024, 512, 1, 2048, 1024, 1024, 1024, 512]
    - [54, 6.464]
  - - [1024, 512, 1, 4096, 1024, 1024, 1024, 512]
    - [65, 9.472]
  - - [1024, 512, 1, 8192, 1024, 1024, 1024, 512]
    - [22, 11.754]
  - - [1024, 1024, 1, 128, 1024, 1024, 1024, 1024]
    - [16, 2.888]
  - - [1024, 1024, 1, 256, 1024, 1024, 1024, 1024]
    - [57, 4.557]
  - - [1024, 1024, 1, 512, 1024, 1024, 1024, 1024]
    - [70, 6.157]
  - - [1024, 1024, 1, 1024, 1024, 1024, 1024, 1024]
    - [65, 7.649]
  - - [1024, 1024, 1, 2048, 1024, 1024, 1024, 1024]
    - [30, 8.284]
  - - [1024, 1024, 1, 4096, 1024, 1024, 1024, 1024]
    - [6, 10.813]
  - - [1024, 1024, 1, 8192, 1024, 1024, 1024, 1024]
    - [63, 13.092]
  - - [1024, 2048, 1, 128, 1024, 1024, 1024, 2048]
    - [65, 4.153]
  - - [1024, 2048, 1, 256, 1024, 1024, 1024, 2048]
    - [65, 6.234]
  - - [1024, 2048, 1, 512, 1024, 1024, 1024, 2048]
    - [65, 8.798]
  - - [1024, 2048, 1, 1024, 1024, 1024, 1024, 2048]
    - [79, 9.54]
  - - [1024, 2048, 1, 2048, 1024, 1024, 1024, 2048]
    - [66, 10.926]
  - - [1024, 2048, 1, 4096, 1024, 1024, 1024, 2048]
    - [65, 13.099]
  - - [1024, 2048, 1, 8192, 1024, 1024, 1024, 2048]
    - [7, 13.974]
  - - [1024, 4096, 1, 128, 1024, 1024, 1024, 4096]
    - [46, 5.642]
  - - [1024, 4096, 1, 256, 1024, 1024, 1024, 4096]
    - [46, 8.125]
  - - [1024, 4096, 1, 512, 1024, 1024, 1024, 4096]
    - [66, 9.674]
  - - [1024, 4096, 1, 1024, 1024, 1024, 1024, 4096]
    - [65, 11.991]
  - - [1024, 4096, 1, 2048, 1024, 1024, 1024, 4096]
    - [22, 13.378]
  - - [1024, 4096, 1, 4096, 1024, 1024, 1024, 4096]
    - [43, 13.956]
  - - [1024, 4096, 1, 8192, 1024, 1024, 1024, 4096]
    - [4, 15.808]
  - - [1024, 8192, 1, 128, 1024, 1024, 1024, 8192]
    - [11, 6.152]
  - - [1024, 8192, 1, 256, 1024, 1024, 1024, 8192]
    - [46, 8.984]
  - - [1024, 8192, 1, 512, 1024, 1024, 1024, 8192]
    - [46, 11.639]
  - - [1024, 8192, 1, 1024, 1024, 1024, 1024, 8192]
    - [12, 13.647]
  - - [1024, 8192, 1, 2048, 1024, 1024, 1024, 8192]
    - [37, 14.089]
  - - [1024, 8192, 1, 4096, 1024, 1024, 1024, 8192]
    - [37, 15.906]
  - - [1024, 8192, 1, 8192, 1024, 1024, 1024, 8192]
    - [42, 17.261]
  - - [2048, 128, 1, 128, 2048, 2048, 2048, 128]
    - [31, 1.096]
  - - [2048, 128, 1, 256, 2048, 2048, 2048, 128]
    - [77, 1.714]
  - - [2048, 128, 1, 512, 2048, 2048, 2048, 128]
    - [77, 2.582]
  - - [2048, 128, 1, 1024, 2048, 2048, 2048, 128]
    - [32, 3.405]
  - - [2048, 128, 1, 2048, 2048, 2048, 2048, 128]
    - [18, 4.549]
  - - [2048, 128, 1, 4096, 2048, 2048, 2048, 128]
    - [65, 6.532]
  - - [2048, 128, 1, 8192, 2048, 2048, 2048, 128]
    - [65, 9.489]
  - - [2048, 256, 1, 128, 2048, 2048, 2048, 256]
    - [26, 1.832]
  - - [2048, 256, 1, 256, 2048, 2048, 2048, 256]
    - [26, 2.974]
  - - [2048, 256, 1, 512, 2048, 2048, 2048, 256]
    - [26, 4.362]
  - - [2048, 256, 1, 1024, 2048, 2048, 2048, 256]
    - [69, 5.145]
  - - [2048, 256, 1, 2048, 2048, 2048, 2048, 256]
    - [14, 6.416]
  - - [2048, 256, 1, 4096, 2048, 2048, 2048, 256]
    - [65, 9.344]
  - - [2048, 256, 1, 8192, 2048, 2048, 2048, 256]
    - [22, 11.867]
  - - [2048, 512, 1, 128, 2048, 2048, 2048, 512]
    - [16, 2.889]
  - - [2048, 512, 1, 256, 2048, 2048, 2048, 512]
    - [56, 4.543]
  - - [2048, 512, 1, 512, 2048, 2048, 2048, 512]
    - [70, 6.145]
  - - [2048, 512, 1, 1024, 2048, 2048, 2048, 512]
    - [65, 7.627]
  - - [2048, 512, 1, 2048, 2048, 2048, 2048, 512]
    - [30, 8.119]
  - - [2048, 512, 1, 4096, 2048, 2048, 2048, 512]
    - [7, 10.884]
  - - [2048, 512, 1, 8192, 2048, 2048, 2048, 512]
    - [64, 12.988]
  - - [2048, 1024, 1, 128, 2048, 2048, 2048, 1024]
    - [65, 4.137]
  - - [2048, 1024, 1, 256, 2048, 2048, 2048, 1024]
    - [65, 6.244]
  - - [2048, 1024, 1, 512, 2048, 2048, 2048, 1024]
    - [22, 8.795]
  - - [2048, 1024, 1, 1024, 2048, 2048, 2048, 1024]
    - [80, 9.331]
  - - [2048, 1024, 1, 2048, 2048, 2048, 2048, 1024]
    - [67, 10.924]
  - - [2048, 1024, 1, 4096, 2048, 2048, 2048, 1024]
    - [66, 12.575]
  - - [2048, 1024, 1, 8192, 2048, 2048, 2048, 1024]
    - [7, 14.079]
  - - [2048, 2048, 1, 128, 2048, 2048, 2048, 2048]
    - [9, 5.645]
  - - [2048, 2048, 1, 256, 2048, 2048, 2048, 2048]
    - [8, 8.199]
  - - [2048, 2048, 1, 512, 2048, 2048, 2048, 2048]
    - [65, 9.66]
  - - [2048, 2048, 1, 1024, 2048, 2048, 2048, 2048]
    - [22, 11.993]
  - - [2048, 2048, 1, 2048, 2048, 2048, 2048, 2048]
    - [22, 13.415]
  - - [2048, 2048, 1, 4096, 2048, 2048, 2048, 2048]
    - [41, 13.899]
  - - [2048, 2048, 1, 8192, 2048, 2048, 2048, 2048]
    - [4, 15.86]
  - - [2048, 4096, 1, 128, 2048, 2048, 2048, 4096]
    - [48, 6.178]
  - - [2048, 4096, 1, 256, 2048, 2048, 2048, 4096]
    - [8, 9.057]
  - - [2048, 4096, 1, 512, 2048, 2048, 2048, 4096]
    - [48, 11.606]
  - - [2048, 4096, 1, 1024, 2048, 2048, 2048, 4096]
    - [12, 13.63]
  - - [2048, 4096, 1, 2048, 2048, 2048, 2048, 4096]
    - [41, 13.999]
  - - [2048, 4096, 1, 4096, 2048, 2048, 2048, 4096]
    - [37, 15.777]
  - - [2048, 4096, 1, 8192, 2048, 2048, 2048, 4096]
    - [4, 17.211]
  - - [2048, 8192, 1, 128, 2048, 2048, 2048, 8192]
    - [2, 5.692]
  - - [2048, 8192, 1, 256, 2048, 2048, 2048, 8192]
    - [2, 8.61]
  - - [2048, 8192, 1, 512, 2048, 2048, 2048, 8192]
    - [36, 11.529]
  - - [2048, 8192, 1, 1024, 2048, 2048, 2048, 8192]
    - [36, 13.888]
  - - [2048, 8192, 1, 2048, 2048, 2048, 2048, 8192]
    - [37, 15.639]
  - - [2048, 8192, 1, 4096, 2048, 2048, 2048, 8192]
    - [63, 17.179]
  - - [2048, 8192, 1, 8192, 2048, 2048, 2048, 8192]
    - [63, 18.661]
  - - [4096, 128, 1, 128, 4096, 4096, 4096, 128]
    - [72, 1.855]
  - - [4096, 128, 1, 256, 4096, 4096, 4096, 128]
    - [72, 2.993]
  - - [4096, 128, 1, 512, 4096, 4096, 4096, 128]
    - [26, 4.349]
  - - [4096, 128, 1, 1024, 4096, 4096, 4096, 128]
    - [69, 5.215]
  - - [4096, 128, 1, 2048, 4096, 4096, 4096, 128]
    - [54, 6.461]
  - - [4096, 128, 1, 4096, 4096, 4096, 4096, 128]
    - [65, 9.456]
  - - [4096, 128, 1, 8192, 4096, 4096, 4096, 128]
    - [23, 11.811]
  - - [4096, 256, 1, 128, 4096, 4096, 4096, 256]
    - [58, 2.869]
  - - [4096, 256, 1, 256, 4096, 4096, 4096, 256]
    - [56, 4.599]
  - - [4096, 256, 1, 512, 4096, 4096, 4096, 256]
    - [71, 6.136]
  - - [4096, 256, 1, 1024, 4096, 4096, 4096, 256]
    - [65, 7.722]
  - - [4096, 256, 1, 2048, 4096, 4096, 4096, 256]
    - [30, 8.093]
  - - [4096, 256, 1, 4096, 4096, 4096, 4096, 256]
    - [4, 10.961]
  - - [4096, 256, 1, 8192, 4096, 4096, 4096, 256]
    - [63, 13.158]
  - - [4096, 512, 1, 128, 4096, 4096, 4096, 512]
    - [65, 4.143]
  - - [4096, 512, 1, 256, 4096, 4096, 4096, 512]
    - [65, 6.198]
  - - [4096, 512, 1, 512, 4096, 4096, 4096, 512]
    - [67, 8.741]
  - - [4096, 512, 1, 1024, 4096, 4096, 4096, 512]
    - [80, 9.342]
  - - [4096, 512, 1, 2048, 4096, 4096, 4096, 512]
    - [67, 10.999]
  - - [4096, 512, 1, 4096, 4096, 4096, 4096, 512]
    - [22, 13.11]
  - - [4096, 512, 1, 8192, 4096, 4096, 4096, 512]
    - [7, 14.063]
  - - [4096, 1024, 1, 128, 4096, 4096, 4096, 1024]
    - [9, 5.624]
  - - [4096, 1024, 1, 256, 4096, 4096, 4096, 1024]
    - [8, 8.23]
  - - [4096, 1024, 1, 512, 4096, 4096, 4096, 1024]
    - [22, 9.519]
  - - [4096, 1024, 1, 1024, 4096, 4096, 4096, 1024]
    - [22, 11.911]
  - - [4096, 1024, 1, 2048, 4096, 4096, 4096, 1024]
    - [67, 13.288]
  - - [4096, 1024, 1, 4096, 4096, 4096, 4096, 1024]
    - [43, 14.031]
  - - [4096, 1024, 1, 8192, 4096, 4096, 4096, 1024]
    - [4, 15.887]
  - - [4096, 2048, 1, 128, 4096, 4096, 4096, 2048]
    - [46, 6.118]
  - - [4096, 2048, 1, 256, 4096, 4096, 4096, 2048]
    - [8, 9.123]
  - - [4096, 2048, 1, 512, 4096, 4096, 4096, 2048]
    - [8, 11.693]
  - - [4096, 2048, 1, 1024, 4096, 4096, 4096, 2048]
    - [8, 13.596]
  - - [4096, 2048, 1, 2048, 4096, 4096, 4096, 2048]
    - [37, 14.11]
  - - [4096, 2048, 1, 4096, 4096, 4096, 4096, 2048]
    - [4, 15.824]
  - - [4096, 2048, 1, 8192, 4096, 4096, 4096, 2048]
    - [4, 17.223]
  - - [4096, 4096, 1, 128, 4096, 4096, 4096, 4096]
    - [1, 5.721]
  - - [4096, 4096, 1, 256, 4096, 4096, 4096, 4096]
    - [1, 8.613]
  - - [4096, 4096, 1, 512, 4096, 4096, 4096, 4096]
    - [36, 11.538]
  - - [4096, 4096, 1, 1024, 4096, 4096, 4096, 4096]
    - [36, 13.893]
  - - [4096, 4096, 1, 2048, 4096, 4096, 4096, 4096]
    - [39, 15.551]
  - - [4096, 4096, 1, 4096, 4096, 4096, 4096, 4096]
    - [63, 17.212]
  - - [4096, 4096, 1, 8192, 4096, 4096, 4096, 4096]
    - [63, 18.637]
  - - [4096, 8192, 1, 128, 4096, 4096, 4096, 8192]
    - [46, 6.375]
  - - [4096, 8192, 1, 256, 4096, 4096, 4096, 8192]
    - [45, 8.684]
  - - [4096, 8192, 1, 512, 4096, 4096, 4096, 8192]
    - [43, 11.96]
  - - [4096, 8192, 1, 1024, 4096, 4096, 4096, 8192]
    - [41, 14.785]
  - - [4096, 8192, 1, 2048, 4096, 4096, 4096, 8192]
    - [37, 16.591]
  - - [4096, 8192, 1, 4096, 4096, 4096, 4096, 8192]
    - [21, 18.013]
  - - [4096, 8192, 1, 8192, 4096, 4096, 4096, 8192]
    - [63, 19.265]
  - - [8192, 128, 1, 128, 8192, 8192, 8192, 128]
    - [16, 2.895]
  - - [8192, 128, 1, 256, 8192, 8192, 8192, 128]
    - [55, 4.415]
  - - [8192, 128, 1, 512, 8192, 8192, 8192, 128]
    - [68, 5.909]
  - - [8192, 128, 1, 1024, 8192, 8192, 8192, 128]
    - [65, 7.595]
  - - [8192, 128, 1, 2048, 8192, 8192, 8192, 128]
    - [30, 7.971]
  - - [8192, 128, 1, 4096, 8192, 8192, 8192, 128]
    - [13, 10.736]
  - - [8192, 128, 1, 8192, 8192, 8192, 8192, 128]
    - [23, 13.112]
  - - [8192, 256, 1, 128, 8192, 8192, 8192, 256]
    - [65, 4.183]
  - - [8192, 256, 1, 256, 8192, 8192, 8192, 256]
    - [65, 6.207]
  - - [8192, 256, 1, 512, 8192, 8192, 8192, 256]
    - [65, 8.666]
  - - [8192, 256, 1, 1024, 8192, 8192, 8192, 256]
    - [30, 9.309]
  - - [8192, 256, 1, 2048, 8192, 8192, 8192, 256]
    - [67, 10.979]
  - - [8192, 256, 1, 4096, 8192, 8192, 8192, 256]
    - [22, 12.707]
  - - [8192, 256, 1, 8192, 8192, 8192, 8192, 256]
    - [6, 14.055]
  - - [8192, 512, 1, 128, 8192, 8192, 8192, 512]
    - [52, 5.585]
  - - [8192, 512, 1, 256, 8192, 8192, 8192, 512]
    - [8, 8.229]
  - - [8192, 512, 1, 512, 8192, 8192, 8192, 512]
    - [67, 9.548]
  - - [8192, 512, 1, 1024, 8192, 8192, 8192, 512]
    - [22, 11.91]
  - - [8192, 512, 1, 2048, 8192, 8192, 8192, 512]
    - [67, 13.398]
  - - [8192, 512, 1, 4096, 8192, 8192, 8192, 512]
    - [37, 14.209]
  - - [8192, 512, 1, 8192, 8192, 8192, 8192, 512]
    - [4, 16.059]
  - - [8192, 1024, 1, 128, 8192, 8192, 8192, 1024]
    - [52, 6.008]
  - - [8192, 1024, 1, 256, 8192, 8192, 8192, 1024]
    - [8, 9.009]
  - - [8192, 1024, 1, 512, 8192, 8192, 8192, 1024]
    - [8, 11.589]
  - - [8192, 1024, 1, 1024, 8192, 8192, 8192, 1024]
    - [5, 13.638]
  - - [8192, 1024, 1, 2048, 8192, 8192, 8192, 1024]
    - [40, 14.184]
  - - [8192, 1024, 1, 4096, 8192, 8192, 8192, 1024]
    - [4, 16.2]
  - - [8192, 1024, 1, 8192, 8192, 8192, 8192, 1024]
    - [4, 17.53]
  - - [8192, 2048, 1, 128, 8192, 8192, 8192, 2048]
    - [0, 5.674]
  - - [8192, 2048, 1, 256, 8192, 8192, 8192, 2048]
    - [35, 8.596]
  - - [8192, 2048, 1, 512, 8192, 8192, 8192, 2048]
    - [36, 11.521]
  - - [8192, 2048, 1, 1024, 8192, 8192, 8192, 2048]
    - [3, 13.843]
  - - [8192, 2048, 1, 2048, 8192, 8192, 8192, 2048]
    - [37, 15.662]
  - - [8192, 2048, 1, 4096, 8192, 8192, 8192, 2048]
    - [63, 17.258]
  - - [8192, 2048, 1, 8192, 8192, 8192, 8192, 2048]
    - [63, 18.665]
  - - [8192, 4096, 1, 128, 8192, 8192, 8192, 4096]
    - [47, 6.245]
  - - [8192, 4096, 1, 256, 8192, 8192, 8192, 4096]
    - [49, 8.667]
  - - [8192, 4096, 1, 512, 8192, 8192, 8192, 4096]
    - [44, 11.854]
  - - [8192, 4096, 1, 1024, 8192, 8192, 8192, 4096]
    - [37, 14.752]
  - - [8192, 4096, 1, 2048, 8192, 8192, 8192, 4096]
    - [38, 16.59]
  - - [8192, 4096, 1, 4096, 8192, 8192, 8192, 4096]
    - [63, 18.11]
  - - [8192, 4096, 1, 8192, 8192, 8192, 8192, 4096]
    - [63, 19.309]
  - - [8192, 8192, 1, 128, 8192, 8192, 8192, 8192]
    - [48, 5.993]
  - - [8192, 8192, 1, 256, 8192, 8192, 8192, 8192]
    - [50, 9.138]
  - - [8192, 8192, 1, 512, 8192, 8192, 8192, 8192]
    - [51, 12.352]
  - - [8192, 8192, 1, 1024, 8192, 8192, 8192, 8192]
    - [50, 15.129]
  - - [8192, 8192, 1, 2048, 8192, 8192, 8192, 8192]
    - [63, 17.079]
  - - [8192, 8192, 1, 4096, 8192, 8192, 8192, 8192]
    - [63, 18.736]
  - - [8192, 8192, 1, 8192, 8192, 8192, 8192, 8192]
    - [21, 19.735]
  - - [1, 1, 1, 32, 1, 1, 1, 1]
    - [87, 0.0]
- null
- null
- DeviceEfficiency
- GridBased
