library/src/amd_detail/rocblaslt/src/Tensile/Logic/streamk/gfx942_80cu/aquavanjaram942_Cijk_Alik_Bjlk_BBS_BH_UserArgs.yaml
- {MinimumRequiredVersion: 4.33.0}
- aquavanjaram942
- {Architecture: gfx942, CUCount: 80}
- [Device 0049, Device 0050]
    SolutionIndex: 0
    SolutionNameMin: Cijk_Alik_Bjlk_BBS_BH_UserArgs_MT256x256x32_MI16x16x1_SN_LDSB1_CLR1_GSU0_GSUC0_GSUWGMRR0_K1_LBSPPA256_LBSPPB2048_LPB0_MIWT8_8_PLR1_SU32_SUM0_SUS256_SKXCCM0_VWA4_VWB4_WGM1_WGMXCC1_WGMXCCGn1
    SolutionIndex: 1
    SolutionNameMin: Cijk_Alik_Bjlk_BBS_BH_UserArgs_MT256x256x32_MI16x16x1_SN_LDSB1_CLR1_GSU0_GSUC0_GSUWGMRR0_K1_LBSPPA512_LBSPPB2048_LPB0_MIWT8_8_PLR1_SU32_SUM0_SUS256_SKXCCM0_VWA8_VWB4_WGM1_WGMXCC1_WGMXCCGn1
    SolutionIndex: 2
    SolutionNameMin: Cijk_Alik_Bjlk_BBS_BH_UserArgs_MT256x256x32_MI16x16x1_SN_LDSB1_CLR1_GSU0_GSUC0_GSUWGMRR0_K1_LBSPPA256_LBSPPB2048_LPB0_MIWT8_8_PLR1_SU32_SUM0_SUS256_SKXCCM0_VWA4_VWB8_WGM1_WGMXCC1_WGMXCCGn1
    SolutionIndex: 3
    SolutionNameMin: Cijk_Alik_Bjlk_BBS_BH_UserArgs_MT256x256x32_MI16x16x1_SN_LDSB1_CLR1_GSU0_GSUC0_GSUWGMRR0_K1_LBSPPA512_LBSPPB2048_LPB0_MIWT8_8_PLR1_SU32_SUM0_SUS256_SKXCCM0_VWA8_VWB8_WGM1_WGMXCC1_WGMXCCGn1
    SolutionIndex: 4
    SolutionNameMin: Cijk_Alik_Bjlk_BBS_BH_UserArgs_MT256x256x32_MI16x16x1_SN_LDSB1_CLR1_GSU0_GSUC0_GSUWGMRR0_K1_LBSPPA256_LBSPPB2048_LPB0_MIWT8_8_PLR1_SU32_SUM0_SUS256_SKXCCM0_VWA4_VWB4_WGM2_WGMXCC1_WGMXCCGn1
    SolutionIndex: 5
    SolutionNameMin: Cijk_Alik_Bjlk_BBS_BH_UserArgs_MT256x256x32_MI16x16x1_SN_LDSB1_CLR1_GSU0_GSUC0_GSUWGMRR0_K1_LBSPPA512_LBSPPB2048_LPB0_MIWT8_8_PLR1_SU32_SUM0_SUS256_SKXCCM0_VWA8_VWB4_WGM2_WGMXCC1_WGMXCCGn1
    SolutionIndex: 6
    SolutionNameMin: Cijk_Alik_Bjlk_BBS_BH_UserArgs_MT128x256x32_MI16x16x1_SN_LDSB1_CLR1_GSU0_GSUC0_GSUWGMRR0_K1_LBSPPA256_LBSPPB2048_LPB0_MIWT4_8_PLR1_SU32_SUM0_SUS256_SKXCCM0_VWA4_VWB4_WGM1_WGMXCC1_WGMXCCGn1
    SolutionIndex: 7
    SolutionNameMin: Cijk_Alik_Bjlk_BBS_BH_UserArgs_MT128x256x32_MI16x16x1_SN_LDSB1_CLR1_GSU0_GSUC0_GSUWGMRR0_K1_LBSPPA256_LBSPPB2048_LPB0_MIWT4_8_PLR1_SU32_SUM0_SUS256_SKXCCM0_VWA4_VWB8_WGM1_WGMXCC1_WGMXCCGn1
    SolutionIndex: 8
    SolutionNameMin: Cijk_Alik_Bjlk_BBS_BH_UserArgs_MT128x256x32_MI16x16x1_SN_LDSB1_CLR1_GSU0_GSUC0_GSUWGMRR0_K1_LBSPPA256_LBSPPB2048_LPB0_MIWT4_8_PLR1_SU32_SUM0_SUS256_SKXCCM0_VWA4_VWB4_WGM2_WGMXCC1_WGMXCCGn1
    SolutionIndex: 9
    SolutionNameMin: Cijk_Alik_Bjlk_BBS_BH_UserArgs_MT128x256x32_MI16x16x1_SN_LDSB1_CLR1_GSU0_GSUC0_GSUWGMRR0_K1_LBSPPA256_LBSPPB2048_LPB0_MIWT4_8_PLR1_SU32_SUM0_SUS256_SKXCCM0_VWA4_VWB4_WGM4_WGMXCC1_WGMXCCGn1
    SolutionIndex: 10
    SolutionNameMin: Cijk_Alik_Bjlk_BBS_BH_UserArgs_MT128x256x32_MI16x16x1_SN_LDSB1_CLR1_GSU0_GSUC0_GSUWGMRR0_K1_LBSPPA256_LBSPPB2048_LPB0_MIWT4_8_PLR1_SU32_SUM0_SUS256_SKXCCM0_VWA4_VWB8_WGM4_WGMXCC1_WGMXCCGn1
    SolutionIndex: 11
    SolutionNameMin: Cijk_Alik_Bjlk_BBS_BH_UserArgs_MT256x128x32_MI16x16x1_SN_LDSB1_CLR1_GSU0_GSUC0_GSUWGMRR0_K1_LBSPPA512_LBSPPB1024_LPB16_MIWT8_4_PLR1_SU32_SUM0_SUS256_SKXCCM0_VWA8_VWB1_WGM1_WGMXCC1_WGMXCCGn1
    SolutionIndex: 12
    SolutionNameMin: Cijk_Alik_Bjlk_BBS_BH_UserArgs_MT256x128x32_MI16x16x1_SN_LDSB1_CLR1_GSU0_GSUC0_GSUWGMRR0_K1_LBSPPA256_LBSPPB1024_LPB32_MIWT8_4_PLR1_SU32_SUM0_SUS256_SKXCCM0_VWA4_VWB2_WGM1_WGMXCC1_WGMXCCGn1
    SolutionIndex: 13
    SolutionNameMin: Cijk_Alik_Bjlk_BBS_BH_UserArgs_MT256x128x32_MI16x16x1_SN_LDSB1_CLR1_GSU0_GSUC0_GSUWGMRR0_K1_LBSPPA512_LBSPPB1024_LPB32_MIWT8_4_PLR1_SU32_SUM0_SUS256_SKXCCM0_VWA8_VWB2_WGM1_WGMXCC1_WGMXCCGn1
    SolutionIndex: 14
    SolutionNameMin: Cijk_Alik_Bjlk_BBS_BH_UserArgs_MT256x128x32_MI16x16x1_SN_LDSB1_CLR1_GSU0_GSUC0_GSUWGMRR0_K1_LBSPPA256_LBSPPB1024_LPB0_MIWT8_4_PLR1_SU32_SUM0_SUS256_SKXCCM0_VWA4_VWB4_WGM1_WGMXCC1_WGMXCCGn1
    SolutionIndex: 15
    SolutionNameMin: Cijk_Alik_Bjlk_BBS_BH_UserArgs_MT256x128x32_MI16x16x1_SN_LDSB1_CLR1_GSU0_GSUC0_GSUWGMRR0_K1_LBSPPA512_LBSPPB1024_LPB0_MIWT8_4_PLR1_SU32_SUM0_SUS256_SKXCCM0_VWA8_VWB4_WGM1_WGMXCC1_WGMXCCGn1
    SolutionIndex: 16
    SolutionNameMin: Cijk_Alik_Bjlk_BBS_BH_UserArgs_MT256x128x32_MI16x16x1_SN_LDSB1_CLR1_GSU0_GSUC0_GSUWGMRR0_K1_LBSPPA512_LBSPPB1024_LPB16_MIWT8_4_PLR1_SU32_SUM0_SUS256_SKXCCM0_VWA8_VWB1_WGM2_WGMXCC1_WGMXCCGn1
    SolutionIndex: 17
    SolutionNameMin: Cijk_Alik_Bjlk_BBS_BH_UserArgs_MT256x128x32_MI16x16x1_SN_LDSB1_CLR1_GSU0_GSUC0_GSUWGMRR0_K1_LBSPPA512_LBSPPB1024_LPB32_MIWT8_4_PLR1_SU32_SUM0_SUS256_SKXCCM0_VWA8_VWB2_WGM2_WGMXCC1_WGMXCCGn1
    SolutionIndex: 18
    SolutionNameMin: Cijk_Alik_Bjlk_BBS_BH_UserArgs_MT128x128x32_MI16x16x1_SN_LDSB1_CLR1_GSU0_GSUC0_GSUWGMRR0_K1_LBSPPA256_LBSPPB1024_LPB32_MIWT4_4_PLR1_SU32_SUM0_SUS256_SKXCCM0_VWA4_VWB2_WGM1_WGMXCC1_WGMXCCGn1
    SolutionIndex: 19
    SolutionNameMin: Cijk_Alik_Bjlk_BBS_BH_UserArgs_MT128x128x32_MI16x16x1_SN_LDSB1_CLR1_GSU0_GSUC0_GSUWGMRR0_K1_LBSPPA128_LBSPPB1024_LPB0_MIWT4_4_PLR1_SU32_SUM0_SUS256_SKXCCM0_VWA2_VWB4_WGM1_WGMXCC1_WGMXCCGn1
    SolutionIndex: 20
    SolutionNameMin: Cijk_Alik_Bjlk_BBS_BH_UserArgs_MT128x128x32_MI16x16x1_SN_LDSB1_CLR1_GSU0_GSUC0_GSUWGMRR0_K1_LBSPPA256_LBSPPB1024_LPB32_MIWT4_4_PLR1_SU32_SUM0_SUS256_SKXCCM0_VWA4_VWB2_WGM2_WGMXCC1_WGMXCCGn1
    SolutionIndex: 21
    SolutionNameMin: Cijk_Alik_Bjlk_BBS_BH_UserArgs_MT128x128x32_MI16x16x1_SN_LDSB1_CLR1_GSU0_GSUC0_GSUWGMRR0_K1_LBSPPA128_LBSPPB1024_LPB32_MIWT4_4_PLR1_SU32_SUM0_SUS256_SKXCCM0_VWA2_VWB2_WGM4_WGMXCC1_WGMXCCGn1
    SolutionIndex: 22
    SolutionNameMin: Cijk_Alik_Bjlk_BBS_BH_UserArgs_MT128x128x32_MI16x16x1_SN_LDSB1_CLR1_GSU0_GSUC0_GSUWGMRR0_K1_LBSPPA256_LBSPPB1024_LPB32_MIWT4_4_PLR1_SU32_SUM0_SUS256_SKXCCM0_VWA4_VWB2_WGM4_WGMXCC1_WGMXCCGn1
    SolutionIndex: 23
    SolutionNameMin: Cijk_Alik_Bjlk_BBS_BH_UserArgs_MT64x128x32_MI16x16x1_SN_LDSB0_CLR1_GSU0_GSUC0_GSUWGMRR0_K1_LBSPPA128_LBSPPB1024_LPB0_MIWT2_4_PLR1_SU32_SUM0_SUS256_SKXCCM0_VWA2_VWB4_WGM1_WGMXCC1_WGMXCCGn1
    SolutionIndex: 24
    SolutionNameMin: Cijk_Alik_Bjlk_BBS_BH_UserArgs_MT64x64x32_MI16x16x1_SN_LDSB0_CLR1_GSU0_GSUC0_GSUWGMRR0_K1_LBSPPA128_LBSPPB512_LPB32_MIWT2_2_PLR1_SU32_SUM0_SUS256_SKXCCM0_VWA2_VWB2_WGM1_WGMXCC1_WGMXCCGn1
    SolutionIndex: 25
    SolutionNameMin: Cijk_Alik_Bjlk_BBS_BH_UserArgs_MT32x32x32_MI16x16x1_SN_LDSB0_CLR1_GSU0_GSUC0_GSUWGMRR0_K1_LBSPPA128_LBSPPB256_LPB16_MIWT1_1_PLR1_SU32_SUM0_SUS256_SKXCCM0_VWA1_VWB1_WGM1_WGMXCC1_WGMXCCGn1
    SolutionIndex: 26
    SolutionNameMin: Cijk_Alik_Bjlk_BBS_BH_UserArgs_MT128x256x64_MI16x16x1_SN_LDSB1_CLR1_GSU0_GSUC0_GSUWGMRR0_K1_LBSPPA512_LBSPPB4096_LPB0_MIWT4_8_PLR1_SU32_SUM0_SUS256_SKXCCM0_VWA4_VWB4_WGM2_WGMXCC1_WGMXCCGn1
    SolutionIndex: 27
    SolutionNameMin: Cijk_Alik_Bjlk_BBS_BH_UserArgs_MT128x256x64_MI16x16x1_SN_LDSB1_CLR1_GSU0_GSUC0_GSUWGMRR0_K1_LBSPPA512_LBSPPB4096_LPB0_MIWT4_8_PLR1_SU32_SUM0_SUS256_SKXCCM0_VWA4_VWB4_WGM4_WGMXCC1_WGMXCCGn1
    SolutionIndex: 28
    SolutionNameMin: Cijk_Alik_Bjlk_BBS_BH_UserArgs_MT256x128x64_MI16x16x1_SN_LDSB1_CLR1_GSU0_GSUC0_GSUWGMRR0_K1_LBSPPA512_LBSPPB2048_LPB0_MIWT8_4_PLR1_SU32_SUM0_SUS256_SKXCCM0_VWA4_VWB4_WGM1_WGMXCC1_WGMXCCGn1
    SolutionIndex: 29
    SolutionNameMin: Cijk_Alik_Bjlk_BBS_BH_UserArgs_MT256x128x64_MI16x16x1_SN_LDSB1_CLR1_GSU0_GSUC0_GSUWGMRR0_K1_LBSPPA1024_LBSPPB2048_LPB0_MIWT8_4_PLR1_SU32_SUM0_SUS256_SKXCCM0_VWA8_VWB4_WGM1_WGMXCC1_WGMXCCGn1
    SolutionIndex: 30
    SolutionNameMin: Cijk_Alik_Bjlk_BBS_BH_UserArgs_MT256x128x64_MI16x16x1_SN_LDSB1_CLR1_GSU0_GSUC0_GSUWGMRR0_K1_LBSPPA512_LBSPPB2048_LPB0_MIWT8_4_PLR1_SU32_SUM0_SUS256_SKXCCM0_VWA4_VWB4_WGM4_WGMXCC1_WGMXCCGn1
    SolutionIndex: 31
    SolutionNameMin: Cijk_Alik_Bjlk_BBS_BH_UserArgs_MT128x128x64_MI16x16x1_SN_LDSB1_CLR1_GSU0_GSUC0_GSUWGMRR0_K1_LBSPPA512_LBSPPB2048_LPB0_MIWT4_4_PLR1_SU32_SUM0_SUS256_SKXCCM0_VWA4_VWB4_WGM1_WGMXCC1_WGMXCCGn1
    SolutionIndex: 32
    SolutionNameMin: Cijk_Alik_Bjlk_BBS_BH_UserArgs_MT64x128x64_MI16x16x1_SN_LDSB1_CLR1_GSU0_GSUC0_GSUWGMRR0_K1_LBSPPA256_LBSPPB2048_LPB0_MIWT2_4_PLR1_SU32_SUM0_SUS256_SKXCCM0_VWA2_VWB4_WGM1_WGMXCC1_WGMXCCGn1
    SolutionIndex: 33
    SolutionNameMin: Cijk_Alik_Bjlk_BBS_BH_UserArgs_MT128x64x64_MI16x16x1_SN_LDSB1_CLR1_GSU0_GSUC0_GSUWGMRR0_K1_LBSPPA256_LBSPPB1024_LPB32_MIWT4_2_PLR1_SU32_SUM0_SUS256_SKXCCM0_VWA2_VWB2_WGM1_WGMXCC1_WGMXCCGn1
    SolutionIndex: 34
    SolutionNameMin: Cijk_Alik_Bjlk_BBS_BH_UserArgs_MT128x64x64_MI16x16x1_SN_LDSB1_CLR1_GSU0_GSUC0_GSUWGMRR0_K1_LBSPPA512_LBSPPB1024_LPB32_MIWT4_2_PLR1_SU32_SUM0_SUS256_SKXCCM0_VWA4_VWB2_WGM1_WGMXCC1_WGMXCCGn1
    SolutionIndex: 35
    SolutionNameMin: Cijk_Alik_Bjlk_BBS_BH_UserArgs_MT128x64x64_MI16x16x1_SN_LDSB1_CLR1_GSU0_GSUC0_GSUWGMRR0_K1_LBSPPA256_LBSPPB1024_LPB32_MIWT4_2_PLR1_SU32_SUM0_SUS256_SKXCCM0_VWA2_VWB2_WGM4_WGMXCC1_WGMXCCGn1
    SolutionIndex: 36
    SolutionNameMin: Cijk_Alik_Bjlk_BBS_BH_UserArgs_MT128x64x64_MI16x16x1_SN_LDSB1_CLR1_GSU0_GSUC0_GSUWGMRR0_K1_LBSPPA512_LBSPPB1024_LPB32_MIWT4_2_PLR1_SU32_SUM0_SUS256_SKXCCM0_VWA4_VWB2_WGM4_WGMXCC1_WGMXCCGn1
    SolutionIndex: 37
    SolutionNameMin: Cijk_Alik_Bjlk_BBS_BH_UserArgs_MT64x64x64_MI16x16x1_SN_LDSB1_CLR1_GSU0_GSUC0_GSUWGMRR0_K1_LBSPPA256_LBSPPB1024_LPB32_MIWT2_2_PLR1_SU32_SUM0_SUS256_SKXCCM0_VWA2_VWB2_WGM1_WGMXCC1_WGMXCCGn1
    SolutionIndex: 38
    SolutionNameMin: Cijk_Alik_Bjlk_BBS_BH_UserArgs_MT64x64x64_MI16x16x1_SN_LDSB1_CLR1_GSU0_GSUC0_GSUWGMRR0_K1_LBSPPA256_LBSPPB1024_LPB32_MIWT2_2_PLR1_SU32_SUM0_SUS256_SKXCCM0_VWA2_VWB2_WGM2_WGMXCC1_WGMXCCGn1
    SolutionIndex: 39
    SolutionNameMin: Cijk_Alik_Bjlk_BBS_BH_UserArgs_MT64x64x64_MI16x16x1_SN_LDSB1_CLR1_GSU0_GSUC0_GSUWGMRR0_K1_LBSPPA256_LBSPPB1024_LPB32_MIWT2_2_PLR1_SU32_SUM0_SUS256_SKXCCM0_VWA2_VWB2_WGM4_WGMXCC1_WGMXCCGn1
    SolutionIndex: 40
    SolutionNameMin: Cijk_Alik_Bjlk_BBS_BH_UserArgs_MT64x32x64_MI16x16x1_SN_LDSB0_CLR1_GSU0_GSUC0_GSUWGMRR0_K1_LBSPPA256_LBSPPB512_LPB16_MIWT2_1_PLR1_SU32_SUM0_SUS256_SKXCCM0_VWA2_VWB1_WGM1_WGMXCC1_WGMXCCGn1
    SolutionIndex: 41
    SolutionNameMin: Cijk_Alik_Bjlk_BBS_BH_UserArgs_MT32x32x64_MI16x16x1_SN_LDSB0_CLR1_GSU0_GSUC0_GSUWGMRR0_K1_LBSPPA128_LBSPPB512_LPB16_MIWT1_1_PLR1_SU32_SUM0_SUS256_SKXCCM0_VWA1_VWB1_WGM1_WGMXCC1_WGMXCCGn1
    SolutionIndex: 42
    SolutionNameMin: Cijk_Alik_Bjlk_BBS_BH_UserArgs_MT128x64x128_MI16x16x1_SN_LDSB1_CLR1_GSU0_GSUC0_GSUWGMRR0_K1_LBSPPA1024_LBSPPB1024_LPB32_MIWT4_2_PLR2_SU32_SUM0_SUS256_SKXCCM0_VWA4_VWB2_WGM1_WGMXCC1_WGMXCCGn1
    SolutionIndex: 43
    SolutionNameMin: Cijk_Alik_Bjlk_BBS_BH_UserArgs_MT64x64x128_MI16x16x1_SN_LDSB1_CLR1_GSU0_GSUC0_GSUWGMRR0_K1_LBSPPA512_LBSPPB1024_LPB32_MIWT2_2_PLR2_SU32_SUM0_SUS256_SKXCCM0_VWA2_VWB2_WGM1_WGMXCC1_WGMXCCGn1
    SolutionIndex: 44
    SolutionNameMin: Cijk_Alik_Bjlk_BBS_BH_UserArgs_MT32x64x128_MI16x16x1_SN_LDSB1_CLR1_GSU0_GSUC0_GSUWGMRR0_K1_LBSPPA256_LBSPPB1024_LPB32_MIWT1_2_PLR2_SU32_SUM0_SUS256_SKXCCM0_VWA1_VWB2_WGM1_WGMXCC1_WGMXCCGn1
    SolutionIndex: 45
    SolutionNameMin: Cijk_Alik_Bjlk_BBS_BH_UserArgs_MT32x64x128_MI16x16x1_SN_LDSB1_CLR1_GSU0_GSUC0_GSUWGMRR0_K1_LBSPPA256_LBSPPB1024_LPB32_MIWT1_2_PLR2_SU32_SUM0_SUS256_SKXCCM0_VWA1_VWB2_WGM4_WGMXCC1_WGMXCCGn1
    SolutionIndex: 46
    SolutionNameMin: Cijk_Alik_Bjlk_BBS_BH_UserArgs_MT64x32x128_MI16x16x1_SN_LDSB1_CLR1_GSU0_GSUC0_GSUWGMRR0_K1_LBSPPA512_LBSPPB512_LPB16_MIWT2_1_PLR2_SU32_SUM0_SUS256_SKXCCM0_VWA2_VWB1_WGM1_WGMXCC1_WGMXCCGn1
    SolutionIndex: 47
    SolutionNameMin: Cijk_Alik_Bjlk_BBS_BH_UserArgs_MT32x32x128_MI16x16x1_SN_LDSB1_CLR1_GSU0_GSUC0_GSUWGMRR0_K1_LBSPPA256_LBSPPB512_LPB16_MIWT1_1_PLR1_SU32_SUM0_SUS256_SKXCCM0_VWA1_VWB1_WGM1_WGMXCC1_WGMXCCGn1
    SolutionIndex: 48
    SolutionNameMin: Cijk_Alik_Bjlk_BBS_BH_UserArgs_MT32x32x128_MI16x16x1_SN_LDSB1_CLR1_GSU0_GSUC0_GSUWGMRR0_K1_LBSPPA256_LBSPPB512_LPB16_MIWT1_1_PLR2_SU32_SUM0_SUS256_SKXCCM0_VWA1_VWB1_WGM1_WGMXCC1_WGMXCCGn1
    SolutionIndex: 49
    SolutionNameMin: Cijk_Alik_Bjlk_BBS_BH_UserArgs_MT32x32x128_MI16x16x1_SN_LDSB1_CLR1_GSU0_GSUC0_GSUWGMRR0_K1_LBSPPA256_LBSPPB512_LPB16_MIWT1_1_PLR1_SU32_SUM0_SUS256_SKXCCM0_VWA1_VWB1_WGM2_WGMXCC1_WGMXCCGn1
    SolutionIndex: 50
    SolutionNameMin: Cijk_Alik_Bjlk_BBS_BH_UserArgs_MT256x256x32_MI16x16x1_SN_LDSB1_CLR1_GSU0_GSUC0_GSUWGMRR0_K1_LBSPPA256_LBSPPB2048_LPB0_MIWT8_8_PLR1_SU32_SUM0_SUS256_SKXCCM4_VWA4_VWB4_WGM1_WGMXCC1_WGMXCCGn1
    SolutionIndex: 51
    SolutionNameMin: Cijk_Alik_Bjlk_BBS_BH_UserArgs_MT256x256x32_MI16x16x1_SN_LDSB1_CLR1_GSU0_GSUC0_GSUWGMRR0_K1_LBSPPA512_LBSPPB2048_LPB0_MIWT8_8_PLR1_SU32_SUM0_SUS256_SKXCCM4_VWA8_VWB4_WGM1_WGMXCC1_WGMXCCGn1
    SolutionIndex: 52
    SolutionNameMin: Cijk_Alik_Bjlk_BBS_BH_UserArgs_MT256x256x32_MI16x16x1_SN_LDSB1_CLR1_GSU0_GSUC0_GSUWGMRR0_K1_LBSPPA256_LBSPPB2048_LPB0_MIWT8_8_PLR1_SU32_SUM0_SUS256_SKXCCM4_VWA4_VWB8_WGM1_WGMXCC1_WGMXCCGn1
    SolutionIndex: 53
    SolutionNameMin: Cijk_Alik_Bjlk_BBS_BH_UserArgs_MT256x256x32_MI16x16x1_SN_LDSB1_CLR1_GSU0_GSUC0_GSUWGMRR0_K1_LBSPPA256_LBSPPB2048_LPB0_MIWT8_8_PLR1_SU32_SUM0_SUS256_SKXCCM4_VWA4_VWB4_WGM4_WGMXCC1_WGMXCCGn1
    SolutionIndex: 54
    SolutionNameMin: Cijk_Alik_Bjlk_BBS_BH_UserArgs_MT256x256x32_MI16x16x1_SN_LDSB1_CLR1_GSU0_GSUC0_GSUWGMRR0_K1_LBSPPA512_LBSPPB2048_LPB0_MIWT8_8_PLR1_SU32_SUM0_SUS256_SKXCCM4_VWA8_VWB4_WGM4_WGMXCC1_WGMXCCGn1
    SolutionIndex: 55
    SolutionNameMin: Cijk_Alik_Bjlk_BBS_BH_UserArgs_MT128x256x32_MI16x16x1_SN_LDSB1_CLR1_GSU0_GSUC0_GSUWGMRR0_K1_LBSPPA256_LBSPPB2048_LPB0_MIWT4_8_PLR1_SU32_SUM0_SUS256_SKXCCM4_VWA4_VWB4_WGM1_WGMXCC1_WGMXCCGn1
    SolutionIndex: 56
    SolutionNameMin: Cijk_Alik_Bjlk_BBS_BH_UserArgs_MT128x256x32_MI16x16x1_SN_LDSB1_CLR1_GSU0_GSUC0_GSUWGMRR0_K1_LBSPPA256_LBSPPB2048_LPB0_MIWT4_8_PLR1_SU32_SUM0_SUS256_SKXCCM4_VWA4_VWB8_WGM1_WGMXCC1_WGMXCCGn1
    SolutionIndex: 57
    SolutionNameMin: Cijk_Alik_Bjlk_BBS_BH_UserArgs_MT128x256x32_MI16x16x1_SN_LDSB1_CLR1_GSU0_GSUC0_GSUWGMRR0_K1_LBSPPA256_LBSPPB2048_LPB0_MIWT4_8_PLR1_SU32_SUM0_SUS256_SKXCCM4_VWA4_VWB4_WGM2_WGMXCC1_WGMXCCGn1
    SolutionIndex: 58
    SolutionNameMin: Cijk_Alik_Bjlk_BBS_BH_UserArgs_MT128x256x32_MI16x16x1_SN_LDSB1_CLR1_GSU0_GSUC0_GSUWGMRR0_K1_LBSPPA256_LBSPPB2048_LPB0_MIWT4_8_PLR1_SU32_SUM0_SUS256_SKXCCM4_VWA4_VWB8_WGM2_WGMXCC1_WGMXCCGn1
    SolutionIndex: 59
    SolutionNameMin: Cijk_Alik_Bjlk_BBS_BH_UserArgs_MT128x256x32_MI16x16x1_SN_LDSB1_CLR1_GSU0_GSUC0_GSUWGMRR0_K1_LBSPPA256_LBSPPB2048_LPB32_MIWT4_8_PLR1_SU32_SUM0_SUS256_SKXCCM4_VWA4_VWB2_WGM4_WGMXCC1_WGMXCCGn1
    SolutionIndex: 60
    SolutionNameMin: Cijk_Alik_Bjlk_BBS_BH_UserArgs_MT128x256x32_MI16x16x1_SN_LDSB1_CLR1_GSU0_GSUC0_GSUWGMRR0_K1_LBSPPA256_LBSPPB2048_LPB0_MIWT4_8_PLR1_SU32_SUM0_SUS256_SKXCCM4_VWA4_VWB4_WGM4_WGMXCC1_WGMXCCGn1
    SolutionIndex: 61
    SolutionNameMin: Cijk_Alik_Bjlk_BBS_BH_UserArgs_MT128x256x32_MI16x16x1_SN_LDSB1_CLR1_GSU0_GSUC0_GSUWGMRR0_K1_LBSPPA256_LBSPPB2048_LPB0_MIWT4_8_PLR1_SU32_SUM0_SUS256_SKXCCM4_VWA4_VWB8_WGM4_WGMXCC1_WGMXCCGn1
    SolutionIndex: 62
    SolutionNameMin: Cijk_Alik_Bjlk_BBS_BH_UserArgs_MT256x128x32_MI16x16x1_SN_LDSB1_CLR1_GSU0_GSUC0_GSUWGMRR0_K1_LBSPPA512_LBSPPB1024_LPB16_MIWT8_4_PLR1_SU32_SUM0_SUS256_SKXCCM4_VWA8_VWB1_WGM1_WGMXCC1_WGMXCCGn1
    SolutionIndex: 63
    SolutionNameMin: Cijk_Alik_Bjlk_BBS_BH_UserArgs_MT256x128x32_MI16x16x1_SN_LDSB1_CLR1_GSU0_GSUC0_GSUWGMRR0_K1_LBSPPA512_LBSPPB1024_LPB32_MIWT8_4_PLR1_SU32_SUM0_SUS256_SKXCCM4_VWA8_VWB2_WGM1_WGMXCC1_WGMXCCGn1
    SolutionIndex: 64
    SolutionNameMin: Cijk_Alik_Bjlk_BBS_BH_UserArgs_MT256x128x32_MI16x16x1_SN_LDSB1_CLR1_GSU0_GSUC0_GSUWGMRR0_K1_LBSPPA512_LBSPPB1024_LPB0_MIWT8_4_PLR1_SU32_SUM0_SUS256_SKXCCM4_VWA8_VWB4_WGM1_WGMXCC1_WGMXCCGn1
    SolutionIndex: 65
    SolutionNameMin: Cijk_Alik_Bjlk_BBS_BH_UserArgs_MT256x128x32_MI16x16x1_SN_LDSB1_CLR1_GSU0_GSUC0_GSUWGMRR0_K1_LBSPPA512_LBSPPB1024_LPB32_MIWT8_4_PLR1_SU32_SUM0_SUS256_SKXCCM4_VWA8_VWB2_WGM2_WGMXCC1_WGMXCCGn1
    SolutionIndex: 66
    SolutionNameMin: Cijk_Alik_Bjlk_BBS_BH_UserArgs_MT256x128x32_MI16x16x1_SN_LDSB1_CLR1_GSU0_GSUC0_GSUWGMRR0_K1_LBSPPA512_LBSPPB1024_LPB0_MIWT8_4_PLR1_SU32_SUM0_SUS256_SKXCCM4_VWA8_VWB4_WGM2_WGMXCC1_WGMXCCGn1
    SolutionIndex: 67
    SolutionNameMin: Cijk_Alik_Bjlk_BBS_BH_UserArgs_MT256x128x32_MI16x16x1_SN_LDSB1_CLR1_GSU0_GSUC0_GSUWGMRR0_K1_LBSPPA512_LBSPPB1024_LPB32_MIWT8_4_PLR1_SU32_SUM0_SUS256_SKXCCM4_VWA8_VWB2_WGM4_WGMXCC1_WGMXCCGn1
    SolutionIndex: 68
    SolutionNameMin: Cijk_Alik_Bjlk_BBS_BH_UserArgs_MT256x128x32_MI16x16x1_SN_LDSB1_CLR1_GSU0_GSUC0_GSUWGMRR0_K1_LBSPPA512_LBSPPB1024_LPB0_MIWT8_4_PLR1_SU32_SUM0_SUS256_SKXCCM4_VWA8_VWB4_WGM4_WGMXCC1_WGMXCCGn1
    SolutionIndex: 69
    SolutionNameMin: Cijk_Alik_Bjlk_BBS_BH_UserArgs_MT256x64x32_MI16x16x1_SN_LDSB1_CLR1_GSU0_GSUC0_GSUWGMRR0_K1_LBSPPA512_LBSPPB512_LPB16_MIWT8_2_PLR1_SU32_SUM0_SUS256_SKXCCM4_VWA8_VWB1_WGM1_WGMXCC1_WGMXCCGn1
    SolutionIndex: 70
    SolutionNameMin: Cijk_Alik_Bjlk_BBS_BH_UserArgs_MT128x128x32_MI16x16x1_SN_LDSB1_CLR1_GSU0_GSUC0_GSUWGMRR0_K1_LBSPPA128_LBSPPB1024_LPB16_MIWT4_4_PLR1_SU32_SUM0_SUS256_SKXCCM4_VWA2_VWB1_WGM1_WGMXCC1_WGMXCCGn1
    SolutionIndex: 71
    SolutionNameMin: Cijk_Alik_Bjlk_BBS_BH_UserArgs_MT128x128x32_MI16x16x1_SN_LDSB1_CLR1_GSU0_GSUC0_GSUWGMRR0_K1_LBSPPA128_LBSPPB1024_LPB0_MIWT4_4_PLR1_SU32_SUM0_SUS256_SKXCCM4_VWA2_VWB4_WGM1_WGMXCC1_WGMXCCGn1
    SolutionIndex: 72
    SolutionNameMin: Cijk_Alik_Bjlk_BBS_BH_UserArgs_MT128x128x32_MI16x16x1_SN_LDSB1_CLR1_GSU0_GSUC0_GSUWGMRR0_K1_LBSPPA128_LBSPPB1024_LPB32_MIWT4_4_PLR1_SU32_SUM0_SUS256_SKXCCM4_VWA2_VWB2_WGM4_WGMXCC1_WGMXCCGn1
    SolutionIndex: 73
    SolutionNameMin: Cijk_Alik_Bjlk_BBS_BH_UserArgs_MT128x128x32_MI16x16x1_SN_LDSB1_CLR1_GSU0_GSUC0_GSUWGMRR0_K1_LBSPPA256_LBSPPB1024_LPB32_MIWT4_4_PLR1_SU32_SUM0_SUS256_SKXCCM4_VWA4_VWB2_WGM4_WGMXCC1_WGMXCCGn1
    SolutionIndex: 74
    SolutionNameMin: Cijk_Alik_Bjlk_BBS_BH_UserArgs_MT128x128x32_MI16x16x1_SN_LDSB1_CLR1_GSU0_GSUC0_GSUWGMRR0_K1_LBSPPA128_LBSPPB1024_LPB0_MIWT4_4_PLR1_SU32_SUM0_SUS256_SKXCCM4_VWA2_VWB4_WGM4_WGMXCC1_WGMXCCGn1
    SolutionIndex: 75
    SolutionNameMin: Cijk_Alik_Bjlk_BBS_BH_UserArgs_MT64x128x32_MI16x16x1_SN_LDSB0_CLR0_GSU0_GSUC0_GSUWGMRR0_K1_LBSPPA128_LBSPPB1024_LPB0_MIWT2_4_PLR0_SU32_SUM0_SUS256_SKXCCM4_VWA2_VWB4_WGM1_WGMXCC1_WGMXCCGn1
    SolutionIndex: 76
    SolutionNameMin: Cijk_Alik_Bjlk_BBS_BH_UserArgs_MT128x64x32_MI16x16x1_SN_LDSB0_CLR0_GSU0_GSUC0_GSUWGMRR0_K1_LBSPPA256_LBSPPB512_LPB32_MIWT4_2_PLR0_SU32_SUM0_SUS256_SKXCCM4_VWA4_VWB2_WGM2_WGMXCC1_WGMXCCGn1
    SolutionIndex: 77
    SolutionNameMin: Cijk_Alik_Bjlk_BBS_BH_UserArgs_MT128x64x32_MI16x16x1_SN_LDSB0_CLR1_GSU0_GSUC0_GSUWGMRR0_K1_LBSPPA256_LBSPPB512_LPB32_MIWT4_2_PLR1_SU32_SUM0_SUS256_SKXCCM4_VWA4_VWB2_WGM4_WGMXCC1_WGMXCCGn1
    SolutionIndex: 78
    SolutionNameMin: Cijk_Alik_Bjlk_BBS_BH_UserArgs_MT128x64x32_MI16x16x1_SN_LDSB0_CLR0_GSU0_GSUC0_GSUWGMRR0_K1_LBSPPA256_LBSPPB512_LPB32_MIWT4_2_PLR0_SU32_SUM0_SUS256_SKXCCM4_VWA4_VWB2_WGM4_WGMXCC1_WGMXCCGn1
    SolutionIndex: 79
    SolutionNameMin: Cijk_Alik_Bjlk_BBS_BH_UserArgs_MT128x256x64_MI16x16x1_SN_LDSB1_CLR1_GSU0_GSUC0_GSUWGMRR0_K1_LBSPPA512_LBSPPB4096_LPB0_MIWT4_8_PLR1_SU32_SUM0_SUS256_SKXCCM4_VWA4_VWB4_WGM1_WGMXCC1_WGMXCCGn1
    SolutionIndex: 80
    SolutionNameMin: Cijk_Alik_Bjlk_BBS_BH_UserArgs_MT256x128x64_MI16x16x1_SN_LDSB1_CLR1_GSU0_GSUC0_GSUWGMRR0_K1_LBSPPA512_LBSPPB2048_LPB0_MIWT8_4_PLR1_SU32_SUM0_SUS256_SKXCCM4_VWA4_VWB4_WGM1_WGMXCC1_WGMXCCGn1
    SolutionIndex: 81
    SolutionNameMin: Cijk_Alik_Bjlk_BBS_BH_UserArgs_MT256x128x64_MI16x16x1_SN_LDSB1_CLR1_GSU0_GSUC0_GSUWGMRR0_K1_LBSPPA512_LBSPPB2048_LPB0_MIWT8_4_PLR1_SU32_SUM0_SUS256_SKXCCM4_VWA4_VWB4_WGM4_WGMXCC1_WGMXCCGn1
    SolutionIndex: 82
    SolutionNameMin: Cijk_Alik_Bjlk_BBS_BH_UserArgs_MT128x128x64_MI16x16x1_SN_LDSB1_CLR1_GSU0_GSUC0_GSUWGMRR0_K1_LBSPPA256_LBSPPB2048_LPB0_MIWT4_4_PLR1_SU32_SUM0_SUS256_SKXCCM4_VWA2_VWB4_WGM1_WGMXCC1_WGMXCCGn1
    SolutionIndex: 83
    SolutionNameMin: Cijk_Alik_Bjlk_BBS_BH_UserArgs_MT128x128x64_MI16x16x1_SN_LDSB1_CLR1_GSU0_GSUC0_GSUWGMRR0_K1_LBSPPA512_LBSPPB2048_LPB0_MIWT4_4_PLR1_SU32_SUM0_SUS256_SKXCCM4_VWA4_VWB4_WGM1_WGMXCC1_WGMXCCGn1
    SolutionIndex: 84
    SolutionNameMin: Cijk_Alik_Bjlk_BBS_BH_UserArgs_MT128x128x64_MI16x16x1_SN_LDSB1_CLR1_GSU0_GSUC0_GSUWGMRR0_K1_LBSPPA256_LBSPPB2048_LPB0_MIWT4_4_PLR1_SU32_SUM0_SUS256_SKXCCM4_VWA2_VWB4_WGM4_WGMXCC1_WGMXCCGn1
    SolutionIndex: 85
    SolutionNameMin: Cijk_Alik_Bjlk_BBS_BH_UserArgs_MT128x128x64_MI16x16x1_SN_LDSB1_CLR1_GSU0_GSUC0_GSUWGMRR0_K1_LBSPPA512_LBSPPB2048_LPB0_MIWT4_4_PLR1_SU32_SUM0_SUS256_SKXCCM4_VWA4_VWB4_WGM4_WGMXCC1_WGMXCCGn1
    SolutionIndex: 86
    SolutionNameMin: Cijk_Alik_Bjlk_BBS_BH_UserArgs_MT128x64x64_MI16x16x1_SN_LDSB1_CLR1_GSU0_GSUC0_GSUWGMRR0_K1_LBSPPA256_LBSPPB1024_LPB32_MIWT4_2_PLR1_SU32_SUM0_SUS256_SKXCCM4_VWA2_VWB2_WGM1_WGMXCC1_WGMXCCGn1
    SolutionIndex: 87
    SolutionNameMin: Cijk_Alik_Bjlk_BBS_BH_UserArgs_MT128x64x64_MI16x16x1_SN_LDSB1_CLR1_GSU0_GSUC0_GSUWGMRR0_K1_LBSPPA512_LBSPPB1024_LPB32_MIWT4_2_PLR1_SU32_SUM0_SUS256_SKXCCM4_VWA4_VWB2_WGM1_WGMXCC1_WGMXCCGn1
    SolutionIndex: 88
    SolutionNameMin: Cijk_Alik_Bjlk_BBS_BH_UserArgs_MT128x64x64_MI16x16x1_SN_LDSB1_CLR1_GSU0_GSUC0_GSUWGMRR0_K1_LBSPPA256_LBSPPB1024_LPB32_MIWT4_2_PLR1_SU32_SUM0_SUS256_SKXCCM4_VWA2_VWB2_WGM2_WGMXCC1_WGMXCCGn1
    SolutionIndex: 89
    SolutionNameMin: Cijk_Alik_Bjlk_BBS_BH_UserArgs_MT128x64x64_MI16x16x1_SN_LDSB1_CLR1_GSU0_GSUC0_GSUWGMRR0_K1_LBSPPA512_LBSPPB1024_LPB32_MIWT4_2_PLR1_SU32_SUM0_SUS256_SKXCCM4_VWA4_VWB2_WGM2_WGMXCC1_WGMXCCGn1
    SolutionIndex: 90
    SolutionNameMin: Cijk_Alik_Bjlk_BBS_BH_UserArgs_MT128x64x64_MI16x16x1_SN_LDSB1_CLR1_GSU0_GSUC0_GSUWGMRR0_K1_LBSPPA256_LBSPPB1024_LPB32_MIWT4_2_PLR1_SU32_SUM0_SUS256_SKXCCM4_VWA2_VWB2_WGM4_WGMXCC1_WGMXCCGn1
    SolutionIndex: 91
    SolutionNameMin: Cijk_Alik_Bjlk_BBS_BH_UserArgs_MT128x64x64_MI16x16x1_SN_LDSB1_CLR1_GSU0_GSUC0_GSUWGMRR0_K1_LBSPPA512_LBSPPB1024_LPB32_MIWT4_2_PLR1_SU32_SUM0_SUS256_SKXCCM4_VWA4_VWB2_WGM4_WGMXCC1_WGMXCCGn1
    SolutionIndex: 92
    SolutionNameMin: Cijk_Alik_Bjlk_BBS_BH_UserArgs_MT64x64x64_MI16x16x1_SN_LDSB1_CLR1_GSU0_GSUC0_GSUWGMRR0_K1_LBSPPA128_LBSPPB1024_LPB32_MIWT2_2_PLR1_SU32_SUM0_SUS256_SKXCCM4_VWA1_VWB2_WGM1_WGMXCC1_WGMXCCGn1
    SolutionIndex: 93
    SolutionNameMin: Cijk_Alik_Bjlk_BBS_BH_UserArgs_MT64x64x64_MI16x16x1_SN_LDSB1_CLR1_GSU0_GSUC0_GSUWGMRR0_K1_LBSPPA256_LBSPPB1024_LPB32_MIWT2_2_PLR1_SU32_SUM0_SUS256_SKXCCM4_VWA2_VWB2_WGM1_WGMXCC1_WGMXCCGn1
    SolutionIndex: 94
    SolutionNameMin: Cijk_Alik_Bjlk_BBS_BH_UserArgs_MT64x64x64_MI16x16x1_SN_LDSB1_CLR1_GSU0_GSUC0_GSUWGMRR0_K1_LBSPPA256_LBSPPB1024_LPB32_MIWT2_2_PLR1_SU32_SUM0_SUS256_SKXCCM4_VWA2_VWB2_WGM2_WGMXCC1_WGMXCCGn1
    SolutionIndex: 95
    SolutionNameMin: Cijk_Alik_Bjlk_BBS_BH_UserArgs_MT64x64x64_MI16x16x1_SN_LDSB1_CLR1_GSU0_GSUC0_GSUWGMRR0_K1_LBSPPA128_LBSPPB1024_LPB32_MIWT2_2_PLR1_SU32_SUM0_SUS256_SKXCCM4_VWA1_VWB2_WGM4_WGMXCC1_WGMXCCGn1
    SolutionIndex: 96
    SolutionNameMin: Cijk_Alik_Bjlk_BBS_BH_UserArgs_MT64x64x64_MI16x16x1_SN_LDSB1_CLR1_GSU0_GSUC0_GSUWGMRR0_K1_LBSPPA256_LBSPPB1024_LPB32_MIWT2_2_PLR1_SU32_SUM0_SUS256_SKXCCM4_VWA2_VWB2_WGM4_WGMXCC1_WGMXCCGn1
    SolutionIndex: 97
    SolutionNameMin: Cijk_Alik_Bjlk_BBS_BH_UserArgs_MT32x64x64_MI16x16x1_SN_LDSB0_CLR1_GSU0_GSUC0_GSUWGMRR0_K1_LBSPPA128_LBSPPB1024_LPB32_MIWT1_2_PLR1_SU32_SUM0_SUS256_SKXCCM4_VWA1_VWB2_WGM1_WGMXCC1_WGMXCCGn1
    SolutionIndex: 98
    SolutionNameMin: Cijk_Alik_Bjlk_BBS_BH_UserArgs_MT128x64x128_MI16x16x1_SN_LDSB1_CLR1_GSU0_GSUC0_GSUWGMRR0_K1_LBSPPA1024_LBSPPB1024_LPB32_MIWT4_2_PLR2_SU32_SUM0_SUS256_SKXCCM4_VWA4_VWB2_WGM1_WGMXCC1_WGMXCCGn1
    SolutionIndex: 99
    SolutionNameMin: Cijk_Alik_Bjlk_BBS_BH_UserArgs_MT128x64x128_MI16x16x1_SN_LDSB1_CLR1_GSU0_GSUC0_GSUWGMRR0_K1_LBSPPA1024_LBSPPB1024_LPB32_MIWT4_2_PLR2_SU32_SUM0_SUS256_SKXCCM4_VWA4_VWB2_WGM4_WGMXCC1_WGMXCCGn1
    SolutionIndex: 100
    SolutionNameMin: Cijk_Alik_Bjlk_BBS_BH_UserArgs_MT64x64x128_MI16x16x1_SN_LDSB1_CLR1_GSU0_GSUC0_GSUWGMRR0_K1_LBSPPA256_LBSPPB1024_LPB32_MIWT2_2_PLR2_SU32_SUM0_SUS256_SKXCCM4_VWA1_VWB2_WGM1_WGMXCC1_WGMXCCGn1
    SolutionIndex: 101
    SolutionNameMin: Cijk_Alik_Bjlk_BBS_BH_UserArgs_MT64x64x128_MI16x16x1_SN_LDSB1_CLR1_GSU0_GSUC0_GSUWGMRR0_K1_LBSPPA512_LBSPPB1024_LPB32_MIWT2_2_PLR2_SU32_SUM0_SUS256_SKXCCM4_VWA2_VWB2_WGM1_WGMXCC1_WGMXCCGn1
    SolutionIndex: 102
    SolutionNameMin: Cijk_Alik_Bjlk_BBS_BH_UserArgs_MT32x64x128_MI16x16x1_SN_LDSB1_CLR1_GSU0_GSUC0_GSUWGMRR0_K1_LBSPPA256_LBSPPB1024_LPB32_MIWT1_2_PLR1_SU32_SUM0_SUS256_SKXCCM4_VWA1_VWB2_WGM1_WGMXCC1_WGMXCCGn1
    SolutionIndex: 103
    SolutionNameMin: Cijk_Alik_Bjlk_BBS_BH_UserArgs_MT32x64x128_MI16x16x1_SN_LDSB1_CLR1_GSU0_GSUC0_GSUWGMRR0_K1_LBSPPA256_LBSPPB1024_LPB32_MIWT1_2_PLR2_SU32_SUM0_SUS256_SKXCCM4_VWA1_VWB2_WGM1_WGMXCC1_WGMXCCGn1
    SolutionIndex: 104
    SolutionNameMin: Cijk_Alik_Bjlk_BBS_BH_UserArgs_MT32x64x128_MI16x16x1_SN_LDSB1_CLR1_GSU0_GSUC0_GSUWGMRR0_K1_LBSPPA256_LBSPPB1024_LPB32_MIWT1_2_PLR2_SU32_SUM0_SUS256_SKXCCM4_VWA1_VWB2_WGM4_WGMXCC1_WGMXCCGn1
    SolutionIndex: 105
    SolutionNameMin: Cijk_Alik_Bjlk_BBS_BH_UserArgs_MT32x32x128_MI16x16x1_SN_LDSB1_CLR1_GSU0_GSUC0_GSUWGMRR0_K1_LBSPPA256_LBSPPB512_LPB16_MIWT1_1_PLR1_SU32_SUM0_SUS256_SKXCCM4_VWA1_VWB1_WGM1_WGMXCC1_WGMXCCGn1
    SolutionIndex: 106
    SolutionNameMin: Cijk_Alik_Bjlk_BBS_BH_UserArgs_MT32x32x128_MI16x16x1_SN_LDSB1_CLR1_GSU0_GSUC0_GSUWGMRR0_K1_LBSPPA256_LBSPPB512_LPB16_MIWT1_1_PLR2_SU32_SUM0_SUS256_SKXCCM4_VWA1_VWB1_WGM1_WGMXCC1_WGMXCCGn1
    SolutionIndex: 107
    SolutionNameMin: Cijk_Alik_Bjlk_BBS_BH_UserArgs_MT32x32x32_MI16x16x1_SN_LDSB0_CLR0_GSU0_GSUC0_GSUWGMRR0_K1_LBSPPA128_LBSPPB256_LPB16_MIWT1_1_PLR0_SU32_SUM0_SUS256_SKXCCM4_VWA1_VWB1_WGM2_WGMXCC1_WGMXCCGn1
- - - [128, 128, 1, 128, 128, 128, 128, 128]
    - [105, 0.088]
  - - [128, 128, 1, 256, 128, 128, 256, 128]
    - [48, 0.112]
  - - [128, 128, 1, 512, 128, 128, 512, 128]
    - [47, 0.188]
  - - [128, 128, 1, 1024, 128, 128, 1024, 128]
    - [41, 0.29]
  - - [128, 128, 1, 2048, 128, 128, 2048, 128]
    - [47, 0.536]
  - - [128, 128, 1, 4096, 128, 128, 4096, 128]
    - [105, 0.936]
  - - [128, 128, 1, 8192, 128, 128, 8192, 128]
    - [48, 1.493]
  - - [128, 256, 1, 128, 128, 128, 128, 256]
    - [47, 0.168]
  - - [128, 256, 1, 256, 128, 128, 256, 256]
    - [47, 0.222]
  - - [128, 256, 1, 512, 128, 128, 512, 256]
    - [47, 0.364]
  - - [128, 256, 1, 1024, 128, 128, 1024, 256]
    - [105, 0.598]
  - - [128, 256, 1, 2048, 128, 128, 2048, 256]
    - [25, 1.042]
  - - [128, 256, 1, 4096, 128, 128, 4096, 256]
    - [103, 1.655]
  - - [128, 256, 1, 8192, 128, 128, 8192, 256]
    - [45, 2.536]
  - - [128, 512, 1, 128, 128, 128, 128, 512]
    - [105, 0.333]
  - - [128, 512, 1, 256, 128, 128, 256, 512]
    - [47, 0.431]
  - - [128, 512, 1, 512, 128, 128, 512, 512]
    - [25, 0.706]
  - - [128, 512, 1, 1024, 128, 128, 1024, 512]
    - [49, 1.247]
  - - [128, 512, 1, 2048, 128, 128, 2048, 512]
    - [47, 1.879]
  - - [128, 512, 1, 4096, 128, 128, 4096, 512]
    - [97, 2.825]
  - - [128, 512, 1, 8192, 128, 128, 8192, 512]
    - [100, 4.239]
  - - [128, 1024, 1, 128, 128, 128, 128, 1024]
    - [44, 0.625]
  - - [128, 1024, 1, 256, 128, 128, 256, 1024]
    - [48, 1.027]
  - - [128, 1024, 1, 512, 128, 128, 512, 1024]
    - [47, 1.637]
  - - [128, 1024, 1, 1024, 128, 128, 1024, 1024]
    - [48, 2.283]
  - - [128, 1024, 1, 2048, 128, 128, 2048, 1024]
    - [44, 3.168]
  - - [128, 1024, 1, 4096, 128, 128, 4096, 1024]
    - [92, 4.728]
  - - [128, 1024, 1, 8192, 128, 128, 8192, 1024]
    - [98, 6.738]
  - - [128, 2048, 1, 128, 128, 128, 128, 2048]
    - [101, 1.117]
  - - [128, 2048, 1, 256, 128, 128, 256, 2048]
    - [97, 1.822]
  - - [128, 2048, 1, 512, 128, 128, 512, 2048]
    - [103, 2.813]
  - - [128, 2048, 1, 1024, 128, 128, 1024, 2048]
    - [104, 3.873]
  - - [128, 2048, 1, 2048, 128, 128, 2048, 2048]
    - [75, 4.495]
  - - [128, 2048, 1, 4096, 128, 128, 4096, 2048]
    - [34, 6.836]
  - - [128, 2048, 1, 8192, 128, 128, 8192, 2048]
    - [83, 9.824]
  - - [128, 4096, 1, 128, 128, 128, 128, 4096]
    - [37, 1.923]
  - - [128, 4096, 1, 256, 128, 128, 256, 4096]
    - [93, 3.208]
  - - [128, 4096, 1, 512, 128, 128, 512, 4096]
    - [93, 4.845]
  - - [128, 4096, 1, 1024, 128, 128, 1024, 4096]
    - [87, 5.591]
  - - [128, 4096, 1, 2048, 128, 128, 2048, 4096]
    - [96, 6.177]
  - - [128, 4096, 1, 4096, 128, 128, 4096, 4096]
    - [18, 8.382]
  - - [128, 4096, 1, 8192, 128, 128, 8192, 4096]
    - [79, 11.406]
  - - [128, 8192, 1, 128, 128, 128, 128, 8192]
    - [86, 3.052]
  - - [128, 8192, 1, 256, 128, 128, 256, 8192]
    - [86, 4.933]
  - - [128, 8192, 1, 512, 128, 128, 512, 8192]
    - [86, 7.074]
  - - [128, 8192, 1, 1024, 128, 128, 1024, 8192]
    - [42, 7.346]
  - - [128, 8192, 1, 2048, 128, 128, 2048, 8192]
    - [87, 8.287]
  - - [128, 8192, 1, 4096, 128, 128, 4096, 8192]
    - [9, 10.838]
  - - [128, 8192, 1, 8192, 128, 128, 8192, 8192]
    - [26, 11.453]
  - - [256, 128, 1, 128, 256, 256, 128, 128]
    - [48, 0.17]
  - - [256, 128, 1, 256, 256, 256, 256, 128]
    - [48, 0.222]
  - - [256, 128, 1, 512, 256, 256, 512, 128]
    - [48, 0.362]
  - - [256, 128, 1, 1024, 256, 256, 1024, 128]
    - [105, 0.598]
  - - [256, 128, 1, 2048, 256, 256, 2048, 128]
    - [25, 1.034]
  - - [256, 128, 1, 4096, 256, 256, 4096, 128]
    - [103, 1.667]
  - - [256, 128, 1, 8192, 256, 256, 8192, 128]
    - [103, 2.634]
  - - [256, 256, 1, 128, 256, 256, 128, 256]
    - [106, 0.335]
  - - [256, 256, 1, 256, 256, 256, 256, 256]
    - [48, 0.431]
  - - [256, 256, 1, 512, 256, 256, 512, 256]
    - [25, 0.708]
  - - [256, 256, 1, 1024, 256, 256, 1024, 256]
    - [47, 1.256]
  - - [256, 256, 1, 2048, 256, 256, 2048, 256]
    - [106, 1.867]
  - - [256, 256, 1, 4096, 256, 256, 4096, 256]
    - [97, 2.88]
  - - [256, 256, 1, 8192, 256, 256, 8192, 256]
    - [100, 4.172]
  - - [256, 512, 1, 128, 256, 256, 128, 512]
    - [46, 0.627]
  - - [256, 512, 1, 256, 256, 256, 256, 512]
    - [105, 1.034]
  - - [256, 512, 1, 512, 256, 256, 512, 512]
    - [105, 1.631]
  - - [256, 512, 1, 1024, 256, 256, 1024, 512]
    - [106, 2.274]
  - - [256, 512, 1, 2048, 256, 256, 2048, 512]
    - [102, 3.227]
  - - [256, 512, 1, 4096, 256, 256, 4096, 512]
    - [93, 4.754]
  - - [256, 512, 1, 8192, 256, 256, 8192, 512]
    - [99, 6.669]
  - - [256, 1024, 1, 128, 256, 256, 128, 1024]
    - [43, 1.131]
  - - [256, 1024, 1, 256, 256, 256, 256, 1024]
    - [40, 1.831]
  - - [256, 1024, 1, 512, 256, 256, 512, 1024]
    - [44, 2.809]
  - - [256, 1024, 1, 1024, 256, 256, 1024, 1024]
    - [44, 3.908]
  - - [256, 1024, 1, 2048, 256, 256, 2048, 1024]
    - [78, 4.489]
  - - [256, 1024, 1, 4096, 256, 256, 4096, 1024]
    - [34, 7.068]
  - - [256, 1024, 1, 8192, 256, 256, 8192, 1024]
    - [85, 9.796]
  - - [256, 2048, 1, 128, 256, 256, 128, 2048]
    - [37, 1.912]
  - - [256, 2048, 1, 256, 256, 256, 256, 2048]
    - [93, 3.216]
  - - [256, 2048, 1, 512, 256, 256, 512, 2048]
    - [93, 4.794]
  - - [256, 2048, 1, 1024, 256, 256, 1024, 2048]
    - [87, 5.551]
  - - [256, 2048, 1, 2048, 256, 256, 2048, 2048]
    - [39, 6.357]
  - - [256, 2048, 1, 4096, 256, 256, 4096, 2048]
    - [20, 7.901]
  - - [256, 2048, 1, 8192, 256, 256, 8192, 2048]
    - [28, 11.294]
  - - [256, 4096, 1, 128, 256, 256, 128, 4096]
    - [86, 3.051]
  - - [256, 4096, 1, 256, 256, 256, 256, 4096]
    - [86, 4.899]
  - - [256, 4096, 1, 512, 256, 256, 512, 4096]
    - [87, 7.056]
  - - [256, 4096, 1, 1024, 256, 256, 1024, 4096]
    - [98, 7.588]
  - - [256, 4096, 1, 2048, 256, 256, 2048, 4096]
    - [87, 8.336]
  - - [256, 4096, 1, 4096, 256, 256, 4096, 4096]
    - [14, 10.557]
  - - [256, 4096, 1, 8192, 256, 256, 8192, 4096]
    - [28, 11.573]
  - - [256, 8192, 1, 128, 256, 256, 128, 8192]
    - [69, 4.271]
  - - [256, 8192, 1, 256, 256, 256, 256, 8192]
    - [71, 6.392]
  - - [256, 8192, 1, 512, 256, 256, 512, 8192]
    - [82, 8.005]
  - - [256, 8192, 1, 1024, 256, 256, 1024, 8192]
    - [90, 9.366]
  - - [256, 8192, 1, 2048, 256, 256, 2048, 8192]
    - [90, 10.674]
  - - [256, 8192, 1, 4096, 256, 256, 4096, 8192]
    - [73, 11.31]
  - - [256, 8192, 1, 8192, 256, 256, 8192, 8192]
    - [55, 13.992]
  - - [512, 128, 1, 128, 512, 512, 128, 128]
    - [47, 0.336]
  - - [512, 128, 1, 256, 512, 512, 256, 128]
    - [47, 0.429]
  - - [512, 128, 1, 512, 512, 512, 512, 128]
    - [25, 0.708]
  - - [512, 128, 1, 1024, 512, 512, 1024, 128]
    - [47, 1.257]
  - - [512, 128, 1, 2048, 512, 512, 2048, 128]
    - [47, 1.88]
  - - [512, 128, 1, 4096, 512, 512, 4096, 128]
    - [97, 2.861]
  - - [512, 128, 1, 8192, 512, 512, 8192, 128]
    - [100, 4.285]
  - - [512, 256, 1, 128, 512, 512, 128, 256]
    - [44, 0.623]
  - - [512, 256, 1, 256, 512, 512, 256, 256]
    - [47, 1.042]
  - - [512, 256, 1, 512, 512, 512, 512, 256]
    - [105, 1.634]
  - - [512, 256, 1, 1024, 512, 512, 1024, 256]
    - [106, 2.296]
  - - [512, 256, 1, 2048, 512, 512, 2048, 256]
    - [102, 3.232]
  - - [512, 256, 1, 4096, 512, 512, 4096, 256]
    - [95, 4.694]
  - - [512, 256, 1, 8192, 512, 512, 8192, 256]
    - [99, 6.623]
  - - [512, 512, 1, 128, 512, 512, 128, 512]
    - [43, 1.126]
  - - [512, 512, 1, 256, 512, 512, 256, 512]
    - [40, 1.83]
  - - [512, 512, 1, 512, 512, 512, 512, 512]
    - [44, 2.845]
  - - [512, 512, 1, 1024, 512, 512, 1024, 512]
    - [103, 3.937]
  - - [512, 512, 1, 2048, 512, 512, 2048, 512]
    - [77, 4.652]
  - - [512, 512, 1, 4096, 512, 512, 4096, 512]
    - [34, 7.058]
  - - [512, 512, 1, 8192, 512, 512, 8192, 512]
    - [85, 9.667]
  - - [512, 1024, 1, 128, 512, 512, 128, 1024]
    - [37, 1.913]
  - - [512, 1024, 1, 256, 512, 512, 256, 1024]
    - [37, 3.211]
  - - [512, 1024, 1, 512, 512, 512, 512, 1024]
    - [92, 4.759]
  - - [512, 1024, 1, 1024, 512, 512, 1024, 1024]
    - [87, 5.566]
  - - [512, 1024, 1, 2048, 512, 512, 2048, 1024]
    - [39, 6.316]
  - - [512, 1024, 1, 4096, 512, 512, 4096, 1024]
    - [22, 7.962]
  - - [512, 1024, 1, 8192, 512, 512, 8192, 1024]
    - [80, 11.384]
  - - [512, 2048, 1, 128, 512, 512, 128, 2048]
    - [86, 3.012]
  - - [512, 2048, 1, 256, 512, 512, 256, 2048]
    - [86, 4.88]
  - - [512, 2048, 1, 512, 512, 512, 512, 2048]
    - [87, 7.042]
  - - [512, 2048, 1, 1024, 512, 512, 1024, 2048]
    - [98, 7.563]
  - - [512, 2048, 1, 2048, 512, 512, 2048, 2048]
    - [87, 8.404]
  - - [512, 2048, 1, 4096, 512, 512, 4096, 2048]
    - [9, 10.4]
  - - [512, 2048, 1, 8192, 512, 512, 8192, 2048]
    - [28, 11.502]
  - - [512, 4096, 1, 128, 512, 512, 128, 4096]
    - [69, 4.237]
  - - [512, 4096, 1, 256, 512, 512, 256, 4096]
    - [70, 6.316]
  - - [512, 4096, 1, 512, 512, 512, 512, 4096]
    - [82, 8.071]
  - - [512, 4096, 1, 1024, 512, 512, 1024, 4096]
    - [91, 9.454]
  - - [512, 4096, 1, 2048, 512, 512, 2048, 4096]
    - [86, 10.765]
  - - [512, 4096, 1, 4096, 512, 512, 4096, 4096]
    - [10, 11.405]
  - - [512, 4096, 1, 8192, 512, 512, 8192, 4096]
    - [58, 14.001]
  - - [512, 8192, 1, 128, 512, 512, 128, 8192]
    - [63, 5.578]
  - - [512, 8192, 1, 256, 512, 512, 256, 8192]
    - [15, 8.078]
  - - [512, 8192, 1, 512, 512, 512, 512, 8192]
    - [71, 9.795]
  - - [512, 8192, 1, 1024, 512, 512, 1024, 8192]
    - [71, 11.706]
  - - [512, 8192, 1, 2048, 512, 512, 2048, 8192]
    - [83, 12.754]
  - - [512, 8192, 1, 4096, 512, 512, 4096, 8192]
    - [61, 13.966]
  - - [512, 8192, 1, 8192, 512, 512, 8192, 8192]
    - [61, 15.83]
  - - [1024, 128, 1, 128, 1024, 1024, 128, 128]
    - [46, 0.63]
  - - [1024, 128, 1, 256, 1024, 1024, 256, 128]
    - [105, 1.041]
  - - [1024, 128, 1, 512, 1024, 1024, 512, 128]
    - [105, 1.642]
  - - [1024, 128, 1, 1024, 1024, 1024, 1024, 128]
    - [106, 2.303]
  - - [1024, 128, 1, 2048, 1024, 1024, 2048, 128]
    - [103, 3.226]
  - - [1024, 128, 1, 4096, 1024, 1024, 4096, 128]
    - [94, 4.73]
  - - [1024, 128, 1, 8192, 1024, 1024, 8192, 128]
    - [99, 6.62]
  - - [1024, 256, 1, 128, 1024, 1024, 128, 256]
    - [43, 1.14]
  - - [1024, 256, 1, 256, 1024, 1024, 256, 256]
    - [103, 1.826]
  - - [1024, 256, 1, 512, 1024, 1024, 512, 256]
    - [103, 2.827]
  - - [1024, 256, 1, 1024, 1024, 1024, 1024, 256]
    - [103, 3.912]
  - - [1024, 256, 1, 2048, 1024, 1024, 2048, 256]
    - [77, 4.634]
  - - [1024, 256, 1, 4096, 1024, 1024, 4096, 256]
    - [34, 7.055]
  - - [1024, 256, 1, 8192, 1024, 1024, 8192, 256]
    - [83, 9.704]
  - - [1024, 512, 1, 128, 1024, 1024, 128, 512]
    - [24, 1.911]
  - - [1024, 512, 1, 256, 1024, 1024, 256, 512]
    - [93, 3.207]
  - - [1024, 512, 1, 512, 1024, 1024, 512, 512]
    - [37, 4.854]
  - - [1024, 512, 1, 1024, 1024, 1024, 1024, 512]
    - [87, 5.55]
  - - [1024, 512, 1, 2048, 1024, 1024, 2048, 512]
    - [38, 6.327]
  - - [1024, 512, 1, 4096, 1024, 1024, 4096, 512]
    - [55, 7.911]
  - - [1024, 512, 1, 8192, 1024, 1024, 8192, 512]
    - [81, 11.368]
  - - [1024, 1024, 1, 128, 1024, 1024, 128, 1024]
    - [86, 3.023]
  - - [1024, 1024, 1, 256, 1024, 1024, 256, 1024]
    - [86, 4.871]
  - - [1024, 1024, 1, 512, 1024, 1024, 512, 1024]
    - [86, 7.0]
  - - [1024, 1024, 1, 1024, 1024, 1024, 1024, 1024]
    - [98, 7.418]
  - - [1024, 1024, 1, 2048, 1024, 1024, 2048, 1024]
    - [38, 8.329]
  - - [1024, 1024, 1, 4096, 1024, 1024, 4096, 1024]
    - [9, 10.436]
  - - [1024, 1024, 1, 8192, 1024, 1024, 8192, 1024]
    - [28, 11.465]
  - - [1024, 2048, 1, 128, 1024, 1024, 128, 2048]
    - [21, 4.208]
  - - [1024, 2048, 1, 256, 1024, 1024, 256, 2048]
    - [70, 6.321]
  - - [1024, 2048, 1, 512, 1024, 1024, 512, 2048]
    - [82, 8.1]
  - - [1024, 2048, 1, 1024, 1024, 1024, 1024, 2048]
    - [87, 9.461]
  - - [1024, 2048, 1, 2048, 1024, 1024, 2048, 2048]
    - [33, 10.617]
  - - [1024, 2048, 1, 4096, 1024, 1024, 4096, 2048]
    - [10, 11.179]
  - - [1024, 2048, 1, 8192, 1024, 1024, 8192, 2048]
    - [55, 13.919]
  - - [1024, 4096, 1, 128, 1024, 1024, 128, 4096]
    - [63, 5.647]
  - - [1024, 4096, 1, 256, 1024, 1024, 256, 4096]
    - [68, 8.137]
  - - [1024, 4096, 1, 512, 1024, 1024, 512, 4096]
    - [74, 9.711]
  - - [1024, 4096, 1, 1024, 1024, 1024, 1024, 4096]
    - [71, 11.612]
  - - [1024, 4096, 1, 2048, 1024, 1024, 2048, 4096]
    - [31, 12.614]
  - - [1024, 4096, 1, 4096, 1024, 1024, 4096, 4096]
    - [61, 13.811]
  - - [1024, 4096, 1, 8192, 1024, 1024, 8192, 4096]
    - [57, 15.796]
  - - [1024, 8192, 1, 128, 1024, 1024, 128, 8192]
    - [62, 6.205]
  - - [1024, 8192, 1, 256, 1024, 1024, 256, 8192]
    - [64, 8.979]
  - - [1024, 8192, 1, 512, 1024, 1024, 512, 8192]
    - [64, 12.202]
  - - [1024, 8192, 1, 1024, 1024, 1024, 1024, 8192]
    - [15, 14.064]
  - - [1024, 8192, 1, 2048, 1024, 1024, 2048, 8192]
    - [29, 14.416]
  - - [1024, 8192, 1, 4096, 1024, 1024, 4096, 8192]
    - [55, 15.783]
  - - [1024, 8192, 1, 8192, 1024, 1024, 8192, 8192]
    - [61, 17.347]
  - - [2048, 128, 1, 128, 2048, 2048, 128, 128]
    - [43, 1.139]
  - - [2048, 128, 1, 256, 2048, 2048, 256, 128]
    - [40, 1.837]
  - - [2048, 128, 1, 512, 2048, 2048, 512, 128]
    - [103, 2.8]
  - - [2048, 128, 1, 1024, 2048, 2048, 1024, 128]
    - [103, 3.903]
  - - [2048, 128, 1, 2048, 2048, 2048, 2048, 128]
    - [76, 4.576]
  - - [2048, 128, 1, 4096, 2048, 2048, 4096, 128]
    - [36, 6.801]
  - - [2048, 128, 1, 8192, 2048, 2048, 8192, 128]
    - [83, 9.758]
  - - [2048, 256, 1, 128, 2048, 2048, 128, 256]
    - [37, 1.924]
  - - [2048, 256, 1, 256, 2048, 2048, 256, 256]
    - [37, 3.237]
  - - [2048, 256, 1, 512, 2048, 2048, 512, 256]
    - [37, 4.789]
  - - [2048, 256, 1, 1024, 2048, 2048, 1024, 256]
    - [89, 5.517]
  - - [2048, 256, 1, 2048, 2048, 2048, 2048, 256]
    - [96, 6.346]
  - - [2048, 256, 1, 4096, 2048, 2048, 4096, 256]
    - [55, 7.929]
  - - [2048, 256, 1, 8192, 2048, 2048, 8192, 256]
    - [79, 11.348]
  - - [2048, 512, 1, 128, 2048, 2048, 128, 512]
    - [86, 3.039]
  - - [2048, 512, 1, 256, 2048, 2048, 256, 512]
    - [86, 4.922]
  - - [2048, 512, 1, 512, 2048, 2048, 512, 512]
    - [35, 7.042]
  - - [2048, 512, 1, 1024, 2048, 2048, 1024, 512]
    - [42, 7.524]
  - - [2048, 512, 1, 2048, 2048, 2048, 2048, 512]
    - [37, 8.422]
  - - [2048, 512, 1, 4096, 2048, 2048, 4096, 512]
    - [9, 10.333]
  - - [2048, 512, 1, 8192, 2048, 2048, 8192, 512]
    - [27, 11.46]
  - - [2048, 1024, 1, 128, 2048, 2048, 128, 1024]
    - [69, 4.228]
  - - [2048, 1024, 1, 256, 2048, 2048, 256, 1024]
    - [70, 6.319]
  - - [2048, 1024, 1, 512, 2048, 2048, 512, 1024]
    - [84, 7.925]
  - - [2048, 1024, 1, 1024, 2048, 2048, 1024, 1024]
    - [33, 9.571]
  - - [2048, 1024, 1, 2048, 2048, 2048, 2048, 1024]
    - [33, 10.59]
  - - [2048, 1024, 1, 4096, 2048, 2048, 4096, 1024]
    - [55, 11.3]
  - - [2048, 1024, 1, 8192, 2048, 2048, 8192, 1024]
    - [61, 14.074]
  - - [2048, 2048, 1, 128, 2048, 2048, 128, 2048]
    - [13, 5.696]
  - - [2048, 2048, 1, 256, 2048, 2048, 256, 2048]
    - [66, 8.218]
  - - [2048, 2048, 1, 512, 2048, 2048, 512, 2048]
    - [19, 9.703]
  - - [2048, 2048, 1, 1024, 2048, 2048, 1024, 2048]
    - [19, 11.351]
  - - [2048, 2048, 1, 2048, 2048, 2048, 2048, 2048]
    - [31, 12.673]
  - - [2048, 2048, 1, 4096, 2048, 2048, 4096, 2048]
    - [61, 13.826]
  - - [2048, 2048, 1, 8192, 2048, 2048, 8192, 2048]
    - [60, 15.873]
  - - [2048, 4096, 1, 128, 2048, 2048, 128, 4096]
    - [11, 6.275]
  - - [2048, 4096, 1, 256, 2048, 2048, 256, 4096]
    - [64, 9.06]
  - - [2048, 4096, 1, 512, 2048, 2048, 512, 4096]
    - [15, 11.759]
  - - [2048, 4096, 1, 1024, 2048, 2048, 1024, 4096]
    - [14, 14.017]
  - - [2048, 4096, 1, 2048, 2048, 2048, 2048, 4096]
    - [29, 14.422]
  - - [2048, 4096, 1, 4096, 2048, 2048, 4096, 4096]
    - [55, 15.732]
  - - [2048, 4096, 1, 8192, 2048, 2048, 8192, 4096]
    - [4, 17.354]
  - - [2048, 8192, 1, 128, 2048, 2048, 128, 8192]
    - [3, 5.79]
  - - [2048, 8192, 1, 256, 2048, 2048, 256, 8192]
    - [51, 8.652]
  - - [2048, 8192, 1, 512, 2048, 2048, 512, 8192]
    - [1, 11.697]
  - - [2048, 8192, 1, 1024, 2048, 2048, 1024, 8192]
    - [1, 14.207]
  - - [2048, 8192, 1, 2048, 2048, 2048, 2048, 8192]
    - [56, 15.351]
  - - [2048, 8192, 1, 4096, 2048, 2048, 4096, 8192]
    - [50, 17.213]
  - - [2048, 8192, 1, 8192, 2048, 2048, 8192, 8192]
    - [50, 19.009]
  - - [4096, 128, 1, 128, 4096, 4096, 128, 128]
    - [93, 1.932]
  - - [4096, 128, 1, 256, 4096, 4096, 256, 128]
    - [37, 3.215]
  - - [4096, 128, 1, 512, 4096, 4096, 512, 128]
    - [93, 4.785]
  - - [4096, 128, 1, 1024, 4096, 4096, 1024, 128]
    - [89, 5.488]
  - - [4096, 128, 1, 2048, 4096, 4096, 2048, 128]
    - [42, 6.063]
  - - [4096, 128, 1, 4096, 4096, 4096, 4096, 128]
    - [18, 7.831]
  - - [4096, 128, 1, 8192, 4096, 4096, 8192, 128]
    - [80, 11.402]
  - - [4096, 256, 1, 128, 4096, 4096, 128, 256]
    - [86, 3.052]
  - - [4096, 256, 1, 256, 4096, 4096, 256, 256]
    - [86, 4.922]
  - - [4096, 256, 1, 512, 4096, 4096, 512, 256]
    - [88, 7.023]
  - - [4096, 256, 1, 1024, 4096, 4096, 1024, 256]
    - [99, 7.482]
  - - [4096, 256, 1, 2048, 4096, 4096, 2048, 256]
    - [37, 8.207]
  - - [4096, 256, 1, 4096, 4096, 4096, 4096, 256]
    - [8, 10.567]
  - - [4096, 256, 1, 8192, 4096, 4096, 8192, 256]
    - [26, 11.477]
  - - [4096, 512, 1, 128, 4096, 4096, 128, 512]
    - [69, 4.215]
  - - [4096, 512, 1, 256, 4096, 4096, 256, 512]
    - [74, 6.314]
  - - [4096, 512, 1, 512, 4096, 4096, 512, 512]
    - [84, 7.932]
  - - [4096, 512, 1, 1024, 4096, 4096, 1024, 512]
    - [33, 9.518]
  - - [4096, 512, 1, 2048, 4096, 4096, 2048, 512]
    - [34, 10.49]
  - - [4096, 512, 1, 4096, 4096, 4096, 4096, 512]
    - [6, 11.344]
  - - [4096, 512, 1, 8192, 4096, 4096, 8192, 512]
    - [56, 14.264]
  - - [4096, 1024, 1, 128, 4096, 4096, 128, 1024]
    - [17, 5.722]
  - - [4096, 1024, 1, 256, 4096, 4096, 256, 1024]
    - [13, 8.157]
  - - [4096, 1024, 1, 512, 4096, 4096, 512, 1024]
    - [19, 9.67]
  - - [4096, 1024, 1, 1024, 4096, 4096, 1024, 1024]
    - [19, 11.626]
  - - [4096, 1024, 1, 2048, 4096, 4096, 2048, 1024]
    - [31, 12.545]
  - - [4096, 1024, 1, 4096, 4096, 4096, 4096, 1024]
    - [55, 13.897]
  - - [4096, 1024, 1, 8192, 4096, 4096, 8192, 1024]
    - [6, 15.809]
  - - [4096, 2048, 1, 128, 4096, 4096, 128, 2048]
    - [11, 6.231]
  - - [4096, 2048, 1, 256, 4096, 4096, 256, 2048]
    - [15, 8.932]
  - - [4096, 2048, 1, 512, 4096, 4096, 512, 2048]
    - [15, 12.034]
  - - [4096, 2048, 1, 1024, 4096, 4096, 1024, 2048]
    - [15, 14.085]
  - - [4096, 2048, 1, 2048, 4096, 4096, 2048, 2048]
    - [29, 14.251]
  - - [4096, 2048, 1, 4096, 4096, 4096, 4096, 2048]
    - [58, 15.682]
  - - [4096, 2048, 1, 8192, 4096, 4096, 8192, 2048]
    - [0, 17.398]
  - - [4096, 4096, 1, 128, 4096, 4096, 128, 4096]
    - [1, 5.839]
  - - [4096, 4096, 1, 256, 4096, 4096, 256, 4096]
    - [51, 8.643]
  - - [4096, 4096, 1, 512, 4096, 4096, 512, 4096]
    - [1, 11.74]
  - - [4096, 4096, 1, 1024, 4096, 4096, 1024, 4096]
    - [1, 14.232]
  - - [4096, 4096, 1, 2048, 4096, 4096, 2048, 4096]
    - [55, 15.307]
  - - [4096, 4096, 1, 4096, 4096, 4096, 4096, 4096]
    - [52, 17.283]
  - - [4096, 4096, 1, 8192, 4096, 4096, 8192, 4096]
    - [50, 19.096]
  - - [4096, 8192, 1, 128, 4096, 4096, 128, 8192]
    - [65, 6.408]
  - - [4096, 8192, 1, 256, 4096, 4096, 256, 8192]
    - [56, 8.614]
  - - [4096, 8192, 1, 512, 4096, 4096, 512, 8192]
    - [60, 11.952]
  - - [4096, 8192, 1, 1024, 4096, 4096, 1024, 8192]
    - [60, 15.001]
  - - [4096, 8192, 1, 2048, 4096, 4096, 2048, 8192]
    - [60, 17.002]
  - - [4096, 8192, 1, 4096, 4096, 4096, 4096, 8192]
    - [60, 18.205]
  - - [4096, 8192, 1, 8192, 4096, 4096, 8192, 8192]
    - [50, 19.586]
  - - [8192, 128, 1, 128, 8192, 8192, 128, 128]
    - [23, 2.946]
  - - [8192, 128, 1, 256, 8192, 8192, 256, 128]
    - [86, 4.764]
  - - [8192, 128, 1, 512, 8192, 8192, 512, 128]
    - [89, 6.718]
  - - [8192, 128, 1, 1024, 8192, 8192, 1024, 128]
    - [42, 7.111]
  - - [8192, 128, 1, 2048, 8192, 8192, 2048, 128]
    - [37, 7.916]
  - - [8192, 128, 1, 4096, 8192, 8192, 4096, 128]
    - [32, 9.573]
  - - [8192, 128, 1, 8192, 8192, 8192, 8192, 128]
    - [30, 11.42]
  - - [8192, 256, 1, 128, 8192, 8192, 128, 256]
    - [71, 4.235]
  - - [8192, 256, 1, 256, 8192, 8192, 256, 256]
    - [74, 6.312]
  - - [8192, 256, 1, 512, 8192, 8192, 512, 256]
    - [84, 7.71]
  - - [8192, 256, 1, 1024, 8192, 8192, 1024, 256]
    - [34, 8.885]
  - - [8192, 256, 1, 2048, 8192, 8192, 2048, 256]
    - [32, 9.96]
  - - [8192, 256, 1, 4096, 8192, 8192, 4096, 256]
    - [55, 11.473]
  - - [8192, 256, 1, 8192, 8192, 8192, 8192, 256]
    - [55, 14.124]
  - - [8192, 512, 1, 128, 8192, 8192, 128, 512]
    - [13, 5.557]
  - - [8192, 512, 1, 256, 8192, 8192, 256, 512]
    - [66, 7.959]
  - - [8192, 512, 1, 512, 8192, 8192, 512, 512]
    - [72, 9.417]
  - - [8192, 512, 1, 1024, 8192, 8192, 1024, 512]
    - [19, 11.029]
  - - [8192, 512, 1, 2048, 8192, 8192, 2048, 512]
    - [31, 12.044]
  - - [8192, 512, 1, 4096, 8192, 8192, 4096, 512]
    - [56, 14.04]
  - - [8192, 512, 1, 8192, 8192, 8192, 8192, 512]
    - [7, 16.143]
  - - [8192, 1024, 1, 128, 8192, 8192, 128, 1024]
    - [16, 6.199]
  - - [8192, 1024, 1, 256, 8192, 8192, 256, 1024]
    - [13, 8.652]
  - - [8192, 1024, 1, 512, 8192, 8192, 512, 1024]
    - [15, 11.679]
  - - [8192, 1024, 1, 1024, 8192, 8192, 1024, 1024]
    - [6, 13.622]
  - - [8192, 1024, 1, 2048, 8192, 8192, 2048, 1024]
    - [58, 14.024]
  - - [8192, 1024, 1, 4096, 8192, 8192, 4096, 1024]
    - [7, 16.086]
  - - [8192, 1024, 1, 8192, 8192, 8192, 8192, 1024]
    - [7, 17.501]
  - - [8192, 2048, 1, 128, 8192, 8192, 128, 2048]
    - [5, 5.728]
  - - [8192, 2048, 1, 256, 8192, 8192, 256, 2048]
    - [1, 8.505]
  - - [8192, 2048, 1, 512, 8192, 8192, 512, 2048]
    - [1, 11.697]
  - - [8192, 2048, 1, 1024, 8192, 8192, 1024, 2048]
    - [1, 14.076]
  - - [8192, 2048, 1, 2048, 8192, 8192, 2048, 2048]
    - [55, 15.346]
  - - [8192, 2048, 1, 4096, 8192, 8192, 4096, 2048]
    - [50, 17.297]
  - - [8192, 2048, 1, 8192, 8192, 8192, 8192, 2048]
    - [0, 19.054]
  - - [8192, 4096, 1, 128, 8192, 8192, 128, 4096]
    - [67, 6.388]
  - - [8192, 4096, 1, 256, 8192, 8192, 256, 4096]
    - [59, 8.607]
  - - [8192, 4096, 1, 512, 8192, 8192, 512, 4096]
    - [60, 11.833]
  - - [8192, 4096, 1, 1024, 8192, 8192, 1024, 4096]
    - [60, 14.942]
  - - [8192, 4096, 1, 2048, 8192, 8192, 2048, 4096]
    - [60, 16.966]
  - - [8192, 4096, 1, 4096, 8192, 8192, 4096, 4096]
    - [60, 18.178]
  - - [8192, 4096, 1, 8192, 8192, 8192, 8192, 4096]
    - [2, 19.535]
  - - [8192, 8192, 1, 128, 8192, 8192, 128, 8192]
    - [12, 5.89]
  - - [8192, 8192, 1, 256, 8192, 8192, 256, 8192]
    - [68, 8.863]
  - - [8192, 8192, 1, 512, 8192, 8192, 512, 8192]
    - [60, 12.147]
  - - [8192, 8192, 1, 1024, 8192, 8192, 1024, 8192]
    - [60, 15.149]
  - - [8192, 8192, 1, 2048, 8192, 8192, 2048, 8192]
    - [54, 17.206]
  - - [8192, 8192, 1, 4096, 8192, 8192, 4096, 8192]
    - [53, 18.97]
  - - [8192, 8192, 1, 8192, 8192, 8192, 8192, 8192]
    - [0, 20.055]
  - - [1, 1, 1, 32, 1, 1, 32, 1]
    - [107, 0.0]
- null
- null
- DeviceEfficiency
- GridBased
