library/src/amd_detail/rocblaslt/src/Tensile/Logic/streamk/gfx942_80cu/aquavanjaram942_Cijk_Alik_Bjlk_HHS_BH_UserArgs.yaml
- {MinimumRequiredVersion: 4.33.0}
- aquavanjaram942
- {Architecture: gfx942, CUCount: 80}
- [Device 0049, Device 0050]
    SolutionIndex: 0
    SolutionNameMin: Cijk_Alik_Bjlk_HHS_BH_UserArgs_MT256x256x32_MI16x16x1_SN_LDSB1_CLR1_GSU0_GSUC0_GSUWGMRR0_K1_LBSPPA512_LBSPPB2048_LPB32_MIWT8_8_PLR1_SU32_SUM0_SUS256_SKXCCM0_VWA8_VWB2_WGM1_WGMXCC1_WGMXCCGn1
    SolutionIndex: 1
    SolutionNameMin: Cijk_Alik_Bjlk_HHS_BH_UserArgs_MT256x256x32_MI16x16x1_SN_LDSB1_CLR1_GSU0_GSUC0_GSUWGMRR0_K1_LBSPPA256_LBSPPB2048_LPB0_MIWT8_8_PLR1_SU32_SUM0_SUS256_SKXCCM0_VWA4_VWB4_WGM1_WGMXCC1_WGMXCCGn1
    SolutionIndex: 2
    SolutionNameMin: Cijk_Alik_Bjlk_HHS_BH_UserArgs_MT256x256x32_MI16x16x1_SN_LDSB1_CLR1_GSU0_GSUC0_GSUWGMRR0_K1_LBSPPA512_LBSPPB2048_LPB0_MIWT8_8_PLR1_SU32_SUM0_SUS256_SKXCCM0_VWA8_VWB4_WGM1_WGMXCC1_WGMXCCGn1
    SolutionIndex: 3
    SolutionNameMin: Cijk_Alik_Bjlk_HHS_BH_UserArgs_MT256x256x32_MI16x16x1_SN_LDSB1_CLR1_GSU0_GSUC0_GSUWGMRR0_K1_LBSPPA256_LBSPPB2048_LPB0_MIWT8_8_PLR1_SU32_SUM0_SUS256_SKXCCM0_VWA4_VWB8_WGM1_WGMXCC1_WGMXCCGn1
    SolutionIndex: 4
    SolutionNameMin: Cijk_Alik_Bjlk_HHS_BH_UserArgs_MT256x256x32_MI16x16x1_SN_LDSB1_CLR1_GSU0_GSUC0_GSUWGMRR0_K1_LBSPPA512_LBSPPB2048_LPB0_MIWT8_8_PLR1_SU32_SUM0_SUS256_SKXCCM0_VWA8_VWB8_WGM1_WGMXCC1_WGMXCCGn1
    SolutionIndex: 5
    SolutionNameMin: Cijk_Alik_Bjlk_HHS_BH_UserArgs_MT256x256x32_MI16x16x1_SN_LDSB1_CLR1_GSU0_GSUC0_GSUWGMRR0_K1_LBSPPA256_LBSPPB2048_LPB0_MIWT8_8_PLR1_SU32_SUM0_SUS256_SKXCCM0_VWA4_VWB4_WGM2_WGMXCC1_WGMXCCGn1
    SolutionIndex: 6
    SolutionNameMin: Cijk_Alik_Bjlk_HHS_BH_UserArgs_MT256x256x32_MI16x16x1_SN_LDSB1_CLR1_GSU0_GSUC0_GSUWGMRR0_K1_LBSPPA512_LBSPPB2048_LPB0_MIWT8_8_PLR1_SU32_SUM0_SUS256_SKXCCM0_VWA8_VWB8_WGM2_WGMXCC1_WGMXCCGn1
    SolutionIndex: 7
    SolutionNameMin: Cijk_Alik_Bjlk_HHS_BH_UserArgs_MT256x256x32_MI16x16x1_SN_LDSB1_CLR1_GSU0_GSUC0_GSUWGMRR0_K1_LBSPPA256_LBSPPB2048_LPB0_MIWT8_8_PLR1_SU32_SUM0_SUS256_SKXCCM0_VWA4_VWB8_WGM4_WGMXCC1_WGMXCCGn1
    SolutionIndex: 8
    SolutionNameMin: Cijk_Alik_Bjlk_HHS_BH_UserArgs_MT128x256x32_MI16x16x1_SN_LDSB1_CLR1_GSU0_GSUC0_GSUWGMRR0_K1_LBSPPA128_LBSPPB2048_LPB0_MIWT4_8_PLR1_SU32_SUM0_SUS256_SKXCCM0_VWA2_VWB4_WGM1_WGMXCC1_WGMXCCGn1
    SolutionIndex: 9
    SolutionNameMin: Cijk_Alik_Bjlk_HHS_BH_UserArgs_MT128x256x32_MI16x16x1_SN_LDSB1_CLR1_GSU0_GSUC0_GSUWGMRR0_K1_LBSPPA256_LBSPPB2048_LPB0_MIWT4_8_PLR1_SU32_SUM0_SUS256_SKXCCM0_VWA4_VWB4_WGM1_WGMXCC1_WGMXCCGn1
    SolutionIndex: 10
    SolutionNameMin: Cijk_Alik_Bjlk_HHS_BH_UserArgs_MT128x256x32_MI16x16x1_SN_LDSB1_CLR1_GSU0_GSUC0_GSUWGMRR0_K1_LBSPPA256_LBSPPB2048_LPB0_MIWT4_8_PLR1_SU32_SUM0_SUS256_SKXCCM0_VWA4_VWB8_WGM1_WGMXCC1_WGMXCCGn1
    SolutionIndex: 11
    SolutionNameMin: Cijk_Alik_Bjlk_HHS_BH_UserArgs_MT128x256x32_MI16x16x1_SN_LDSB1_CLR1_GSU0_GSUC0_GSUWGMRR0_K1_LBSPPA256_LBSPPB2048_LPB0_MIWT4_8_PLR1_SU32_SUM0_SUS256_SKXCCM0_VWA4_VWB4_WGM2_WGMXCC1_WGMXCCGn1
    SolutionIndex: 12
    SolutionNameMin: Cijk_Alik_Bjlk_HHS_BH_UserArgs_MT128x256x32_MI16x16x1_SN_LDSB1_CLR1_GSU0_GSUC0_GSUWGMRR0_K1_LBSPPA256_LBSPPB2048_LPB0_MIWT4_8_PLR1_SU32_SUM0_SUS256_SKXCCM0_VWA4_VWB8_WGM2_WGMXCC1_WGMXCCGn1
    SolutionIndex: 13
    SolutionNameMin: Cijk_Alik_Bjlk_HHS_BH_UserArgs_MT128x256x32_MI16x16x1_SN_LDSB1_CLR1_GSU0_GSUC0_GSUWGMRR0_K1_LBSPPA256_LBSPPB2048_LPB0_MIWT4_8_PLR1_SU32_SUM0_SUS256_SKXCCM0_VWA4_VWB4_WGM4_WGMXCC1_WGMXCCGn1
    SolutionIndex: 14
    SolutionNameMin: Cijk_Alik_Bjlk_HHS_BH_UserArgs_MT128x256x32_MI16x16x1_SN_LDSB1_CLR1_GSU0_GSUC0_GSUWGMRR0_K1_LBSPPA256_LBSPPB2048_LPB0_MIWT4_8_PLR1_SU32_SUM0_SUS256_SKXCCM0_VWA4_VWB8_WGM4_WGMXCC1_WGMXCCGn1
    SolutionIndex: 15
    SolutionNameMin: Cijk_Alik_Bjlk_HHS_BH_UserArgs_MT256x128x32_MI16x16x1_SN_LDSB1_CLR1_GSU0_GSUC0_GSUWGMRR0_K1_LBSPPA512_LBSPPB1024_LPB32_MIWT8_4_PLR1_SU32_SUM0_SUS256_SKXCCM0_VWA8_VWB2_WGM1_WGMXCC1_WGMXCCGn1
    SolutionIndex: 16
    SolutionNameMin: Cijk_Alik_Bjlk_HHS_BH_UserArgs_MT256x128x32_MI16x16x1_SN_LDSB1_CLR1_GSU0_GSUC0_GSUWGMRR0_K1_LBSPPA256_LBSPPB1024_LPB0_MIWT8_4_PLR1_SU32_SUM0_SUS256_SKXCCM0_VWA4_VWB4_WGM1_WGMXCC1_WGMXCCGn1
    SolutionIndex: 17
    SolutionNameMin: Cijk_Alik_Bjlk_HHS_BH_UserArgs_MT256x128x32_MI16x16x1_SN_LDSB1_CLR1_GSU0_GSUC0_GSUWGMRR0_K1_LBSPPA512_LBSPPB1024_LPB0_MIWT8_4_PLR1_SU32_SUM0_SUS256_SKXCCM0_VWA8_VWB4_WGM1_WGMXCC1_WGMXCCGn1
    SolutionIndex: 18
    SolutionNameMin: Cijk_Alik_Bjlk_HHS_BH_UserArgs_MT256x128x32_MI16x16x1_SN_LDSB1_CLR1_GSU0_GSUC0_GSUWGMRR0_K1_LBSPPA512_LBSPPB1024_LPB32_MIWT8_4_PLR1_SU32_SUM0_SUS256_SKXCCM0_VWA8_VWB2_WGM2_WGMXCC1_WGMXCCGn1
    SolutionIndex: 19
    SolutionNameMin: Cijk_Alik_Bjlk_HHS_BH_UserArgs_MT256x128x32_MI16x16x1_SN_LDSB1_CLR1_GSU0_GSUC0_GSUWGMRR0_K1_LBSPPA512_LBSPPB1024_LPB0_MIWT8_4_PLR1_SU32_SUM0_SUS256_SKXCCM0_VWA8_VWB4_WGM2_WGMXCC1_WGMXCCGn1
    SolutionIndex: 20
    SolutionNameMin: Cijk_Alik_Bjlk_HHS_BH_UserArgs_MT256x128x32_MI16x16x1_SN_LDSB1_CLR1_GSU0_GSUC0_GSUWGMRR0_K1_LBSPPA512_LBSPPB1024_LPB0_MIWT8_4_PLR1_SU32_SUM0_SUS256_SKXCCM0_VWA8_VWB4_WGM4_WGMXCC1_WGMXCCGn1
    SolutionIndex: 21
    SolutionNameMin: Cijk_Alik_Bjlk_HHS_BH_UserArgs_MT128x128x32_MI16x16x1_SN_LDSB1_CLR1_GSU0_GSUC0_GSUWGMRR0_K1_LBSPPA256_LBSPPB1024_LPB32_MIWT4_4_PLR1_SU32_SUM0_SUS256_SKXCCM0_VWA4_VWB2_WGM1_WGMXCC1_WGMXCCGn1
    SolutionIndex: 22
    SolutionNameMin: Cijk_Alik_Bjlk_HHS_BH_UserArgs_MT128x128x32_MI16x16x1_SN_LDSB1_CLR1_GSU0_GSUC0_GSUWGMRR0_K1_LBSPPA128_LBSPPB1024_LPB0_MIWT4_4_PLR1_SU32_SUM0_SUS256_SKXCCM0_VWA2_VWB4_WGM1_WGMXCC1_WGMXCCGn1
    SolutionIndex: 23
    SolutionNameMin: Cijk_Alik_Bjlk_HHS_BH_UserArgs_MT64x128x32_MI16x16x1_SN_LDSB0_CLR1_GSU0_GSUC0_GSUWGMRR0_K1_LBSPPA128_LBSPPB1024_LPB0_MIWT2_4_PLR1_SU32_SUM0_SUS256_SKXCCM0_VWA2_VWB4_WGM1_WGMXCC1_WGMXCCGn1
    SolutionIndex: 24
    SolutionNameMin: Cijk_Alik_Bjlk_HHS_BH_UserArgs_MT64x64x32_MI16x16x1_SN_LDSB0_CLR1_GSU0_GSUC0_GSUWGMRR0_K1_LBSPPA128_LBSPPB512_LPB32_MIWT2_2_PLR1_SU32_SUM0_SUS256_SKXCCM0_VWA2_VWB2_WGM1_WGMXCC1_WGMXCCGn1
    SolutionIndex: 25
    SolutionNameMin: Cijk_Alik_Bjlk_HHS_BH_UserArgs_MT128x256x64_MI16x16x1_SN_LDSB1_CLR1_GSU0_GSUC0_GSUWGMRR0_K1_LBSPPA512_LBSPPB4096_LPB0_MIWT4_8_PLR1_SU32_SUM0_SUS256_SKXCCM0_VWA4_VWB4_WGM1_WGMXCC1_WGMXCCGn1
    SolutionIndex: 26
    SolutionNameMin: Cijk_Alik_Bjlk_HHS_BH_UserArgs_MT128x256x64_MI16x16x1_SN_LDSB1_CLR1_GSU0_GSUC0_GSUWGMRR0_K1_LBSPPA512_LBSPPB4096_LPB0_MIWT4_8_PLR1_SU32_SUM0_SUS256_SKXCCM0_VWA4_VWB4_WGM2_WGMXCC1_WGMXCCGn1
    SolutionIndex: 27
    SolutionNameMin: Cijk_Alik_Bjlk_HHS_BH_UserArgs_MT256x128x64_MI16x16x1_SN_LDSB1_CLR1_GSU0_GSUC0_GSUWGMRR0_K1_LBSPPA1024_LBSPPB2048_LPB16_MIWT8_4_PLR1_SU32_SUM0_SUS256_SKXCCM0_VWA8_VWB1_WGM1_WGMXCC1_WGMXCCGn1
    SolutionIndex: 28
    SolutionNameMin: Cijk_Alik_Bjlk_HHS_BH_UserArgs_MT256x128x64_MI16x16x1_SN_LDSB1_CLR1_GSU0_GSUC0_GSUWGMRR0_K1_LBSPPA512_LBSPPB2048_LPB0_MIWT8_4_PLR1_SU32_SUM0_SUS256_SKXCCM0_VWA4_VWB4_WGM1_WGMXCC1_WGMXCCGn1
    SolutionIndex: 29
    SolutionNameMin: Cijk_Alik_Bjlk_HHS_BH_UserArgs_MT256x128x64_MI16x16x1_SN_LDSB1_CLR1_GSU0_GSUC0_GSUWGMRR0_K1_LBSPPA1024_LBSPPB2048_LPB0_MIWT8_4_PLR1_SU32_SUM0_SUS256_SKXCCM0_VWA8_VWB4_WGM1_WGMXCC1_WGMXCCGn1
    SolutionIndex: 30
    SolutionNameMin: Cijk_Alik_Bjlk_HHS_BH_UserArgs_MT256x128x64_MI16x16x1_SN_LDSB1_CLR1_GSU0_GSUC0_GSUWGMRR0_K1_LBSPPA512_LBSPPB2048_LPB0_MIWT8_4_PLR1_SU32_SUM0_SUS256_SKXCCM0_VWA4_VWB4_WGM2_WGMXCC1_WGMXCCGn1
    SolutionIndex: 31
    SolutionNameMin: Cijk_Alik_Bjlk_HHS_BH_UserArgs_MT128x128x64_MI16x16x1_SN_LDSB1_CLR1_GSU0_GSUC0_GSUWGMRR0_K1_LBSPPA256_LBSPPB2048_LPB0_MIWT4_4_PLR1_SU32_SUM0_SUS256_SKXCCM0_VWA2_VWB4_WGM1_WGMXCC1_WGMXCCGn1
    SolutionIndex: 32
    SolutionNameMin: Cijk_Alik_Bjlk_HHS_BH_UserArgs_MT128x128x64_MI16x16x1_SN_LDSB1_CLR1_GSU0_GSUC0_GSUWGMRR0_K1_LBSPPA512_LBSPPB2048_LPB0_MIWT4_4_PLR1_SU32_SUM0_SUS256_SKXCCM0_VWA4_VWB4_WGM1_WGMXCC1_WGMXCCGn1
    SolutionIndex: 33
    SolutionNameMin: Cijk_Alik_Bjlk_HHS_BH_UserArgs_MT64x128x64_MI16x16x1_SN_LDSB1_CLR1_GSU0_GSUC0_GSUWGMRR0_K1_LBSPPA256_LBSPPB2048_LPB0_MIWT2_4_PLR1_SU32_SUM0_SUS256_SKXCCM0_VWA2_VWB4_WGM1_WGMXCC1_WGMXCCGn1
    SolutionIndex: 34
    SolutionNameMin: Cijk_Alik_Bjlk_HHS_BH_UserArgs_MT128x64x64_MI16x16x1_SN_LDSB1_CLR1_GSU0_GSUC0_GSUWGMRR0_K1_LBSPPA256_LBSPPB1024_LPB32_MIWT4_2_PLR1_SU32_SUM0_SUS256_SKXCCM0_VWA2_VWB2_WGM1_WGMXCC1_WGMXCCGn1
    SolutionIndex: 35
    SolutionNameMin: Cijk_Alik_Bjlk_HHS_BH_UserArgs_MT128x64x64_MI16x16x1_SN_LDSB1_CLR1_GSU0_GSUC0_GSUWGMRR0_K1_LBSPPA512_LBSPPB1024_LPB32_MIWT4_2_PLR1_SU32_SUM0_SUS256_SKXCCM0_VWA4_VWB2_WGM1_WGMXCC1_WGMXCCGn1
    SolutionIndex: 36
    SolutionNameMin: Cijk_Alik_Bjlk_HHS_BH_UserArgs_MT128x64x64_MI16x16x1_SN_LDSB1_CLR1_GSU0_GSUC0_GSUWGMRR0_K1_LBSPPA512_LBSPPB1024_LPB32_MIWT4_2_PLR1_SU32_SUM0_SUS256_SKXCCM0_VWA4_VWB2_WGM2_WGMXCC1_WGMXCCGn1
    SolutionIndex: 37
    SolutionNameMin: Cijk_Alik_Bjlk_HHS_BH_UserArgs_MT128x64x64_MI16x16x1_SN_LDSB1_CLR1_GSU0_GSUC0_GSUWGMRR0_K1_LBSPPA256_LBSPPB1024_LPB32_MIWT4_2_PLR1_SU32_SUM0_SUS256_SKXCCM0_VWA2_VWB2_WGM4_WGMXCC1_WGMXCCGn1
    SolutionIndex: 38
    SolutionNameMin: Cijk_Alik_Bjlk_HHS_BH_UserArgs_MT64x64x64_MI16x16x1_SN_LDSB1_CLR1_GSU0_GSUC0_GSUWGMRR0_K1_LBSPPA256_LBSPPB1024_LPB32_MIWT2_2_PLR1_SU32_SUM0_SUS256_SKXCCM0_VWA2_VWB2_WGM1_WGMXCC1_WGMXCCGn1
    SolutionIndex: 39
    SolutionNameMin: Cijk_Alik_Bjlk_HHS_BH_UserArgs_MT64x64x64_MI16x16x1_SN_LDSB1_CLR1_GSU0_GSUC0_GSUWGMRR0_K1_LBSPPA256_LBSPPB1024_LPB32_MIWT2_2_PLR1_SU32_SUM0_SUS256_SKXCCM0_VWA2_VWB2_WGM2_WGMXCC1_WGMXCCGn1
    SolutionIndex: 40
    SolutionNameMin: Cijk_Alik_Bjlk_HHS_BH_UserArgs_MT64x64x64_MI16x16x1_SN_LDSB1_CLR1_GSU0_GSUC0_GSUWGMRR0_K1_LBSPPA256_LBSPPB1024_LPB32_MIWT2_2_PLR1_SU32_SUM0_SUS256_SKXCCM0_VWA2_VWB2_WGM4_WGMXCC1_WGMXCCGn1
    SolutionIndex: 41
    SolutionNameMin: Cijk_Alik_Bjlk_HHS_BH_UserArgs_MT64x32x64_MI16x16x1_SN_LDSB0_CLR1_GSU0_GSUC0_GSUWGMRR0_K1_LBSPPA256_LBSPPB512_LPB16_MIWT2_1_PLR1_SU32_SUM0_SUS256_SKXCCM0_VWA2_VWB1_WGM1_WGMXCC1_WGMXCCGn1
    SolutionIndex: 42
    SolutionNameMin: Cijk_Alik_Bjlk_HHS_BH_UserArgs_MT128x64x128_MI16x16x1_SN_LDSB1_CLR1_GSU0_GSUC0_GSUWGMRR0_K1_LBSPPA512_LBSPPB1024_LPB32_MIWT4_2_PLR2_SU32_SUM0_SUS256_SKXCCM0_VWA2_VWB2_WGM1_WGMXCC1_WGMXCCGn1
    SolutionIndex: 43
    SolutionNameMin: Cijk_Alik_Bjlk_HHS_BH_UserArgs_MT128x64x128_MI16x16x1_SN_LDSB1_CLR1_GSU0_GSUC0_GSUWGMRR0_K1_LBSPPA1024_LBSPPB1024_LPB32_MIWT4_2_PLR2_SU32_SUM0_SUS256_SKXCCM0_VWA4_VWB2_WGM1_WGMXCC1_WGMXCCGn1
    SolutionIndex: 44
    SolutionNameMin: Cijk_Alik_Bjlk_HHS_BH_UserArgs_MT64x64x128_MI16x16x1_SN_LDSB1_CLR1_GSU0_GSUC0_GSUWGMRR0_K1_LBSPPA256_LBSPPB1024_LPB32_MIWT2_2_PLR2_SU32_SUM0_SUS256_SKXCCM0_VWA1_VWB2_WGM1_WGMXCC1_WGMXCCGn1
    SolutionIndex: 45
    SolutionNameMin: Cijk_Alik_Bjlk_HHS_BH_UserArgs_MT64x64x128_MI16x16x1_SN_LDSB1_CLR1_GSU0_GSUC0_GSUWGMRR0_K1_LBSPPA512_LBSPPB1024_LPB32_MIWT2_2_PLR2_SU32_SUM0_SUS256_SKXCCM0_VWA2_VWB2_WGM1_WGMXCC1_WGMXCCGn1
    SolutionIndex: 46
    SolutionNameMin: Cijk_Alik_Bjlk_HHS_BH_UserArgs_MT32x64x128_MI16x16x1_SN_LDSB1_CLR1_GSU0_GSUC0_GSUWGMRR0_K1_LBSPPA256_LBSPPB1024_LPB32_MIWT1_2_PLR2_SU32_SUM0_SUS256_SKXCCM0_VWA1_VWB2_WGM1_WGMXCC1_WGMXCCGn1
    SolutionIndex: 47
    SolutionNameMin: Cijk_Alik_Bjlk_HHS_BH_UserArgs_MT32x64x128_MI16x16x1_SN_LDSB1_CLR1_GSU0_GSUC0_GSUWGMRR0_K1_LBSPPA256_LBSPPB1024_LPB32_MIWT1_2_PLR2_SU32_SUM0_SUS256_SKXCCM0_VWA1_VWB2_WGM4_WGMXCC1_WGMXCCGn1
    SolutionIndex: 48
    SolutionNameMin: Cijk_Alik_Bjlk_HHS_BH_UserArgs_MT64x32x128_MI16x16x1_SN_LDSB1_CLR1_GSU0_GSUC0_GSUWGMRR0_K1_LBSPPA512_LBSPPB512_LPB16_MIWT2_1_PLR1_SU32_SUM0_SUS256_SKXCCM0_VWA2_VWB1_WGM1_WGMXCC1_WGMXCCGn1
    SolutionIndex: 49
    SolutionNameMin: Cijk_Alik_Bjlk_HHS_BH_UserArgs_MT64x32x128_MI16x16x1_SN_LDSB1_CLR1_GSU0_GSUC0_GSUWGMRR0_K1_LBSPPA512_LBSPPB512_LPB16_MIWT2_1_PLR2_SU32_SUM0_SUS256_SKXCCM0_VWA2_VWB1_WGM1_WGMXCC1_WGMXCCGn1
    SolutionIndex: 50
    SolutionNameMin: Cijk_Alik_Bjlk_HHS_BH_UserArgs_MT32x32x128_MI16x16x1_SN_LDSB1_CLR1_GSU0_GSUC0_GSUWGMRR0_K1_LBSPPA256_LBSPPB512_LPB16_MIWT1_1_PLR1_SU32_SUM0_SUS256_SKXCCM0_VWA1_VWB1_WGM1_WGMXCC1_WGMXCCGn1
    SolutionIndex: 51
    SolutionNameMin: Cijk_Alik_Bjlk_HHS_BH_UserArgs_MT32x32x128_MI16x16x1_SN_LDSB1_CLR1_GSU0_GSUC0_GSUWGMRR0_K1_LBSPPA256_LBSPPB512_LPB16_MIWT1_1_PLR2_SU32_SUM0_SUS256_SKXCCM0_VWA1_VWB1_WGM1_WGMXCC1_WGMXCCGn1
    SolutionIndex: 52
    SolutionNameMin: Cijk_Alik_Bjlk_HHS_BH_UserArgs_MT256x256x32_MI16x16x1_SN_LDSB1_CLR1_GSU0_GSUC0_GSUWGMRR0_K1_LBSPPA512_LBSPPB2048_LPB32_MIWT8_8_PLR1_SU32_SUM0_SUS256_SKXCCM4_VWA8_VWB2_WGM1_WGMXCC1_WGMXCCGn1
    SolutionIndex: 53
    SolutionNameMin: Cijk_Alik_Bjlk_HHS_BH_UserArgs_MT256x256x32_MI16x16x1_SN_LDSB1_CLR1_GSU0_GSUC0_GSUWGMRR0_K1_LBSPPA256_LBSPPB2048_LPB0_MIWT8_8_PLR1_SU32_SUM0_SUS256_SKXCCM4_VWA4_VWB4_WGM1_WGMXCC1_WGMXCCGn1
    SolutionIndex: 54
    SolutionNameMin: Cijk_Alik_Bjlk_HHS_BH_UserArgs_MT256x256x32_MI16x16x1_SN_LDSB1_CLR1_GSU0_GSUC0_GSUWGMRR0_K1_LBSPPA512_LBSPPB2048_LPB0_MIWT8_8_PLR1_SU32_SUM0_SUS256_SKXCCM4_VWA8_VWB4_WGM1_WGMXCC1_WGMXCCGn1
    SolutionIndex: 55
    SolutionNameMin: Cijk_Alik_Bjlk_HHS_BH_UserArgs_MT256x256x32_MI16x16x1_SN_LDSB1_CLR1_GSU0_GSUC0_GSUWGMRR0_K1_LBSPPA256_LBSPPB2048_LPB0_MIWT8_8_PLR1_SU32_SUM0_SUS256_SKXCCM4_VWA4_VWB8_WGM1_WGMXCC1_WGMXCCGn1
    SolutionIndex: 56
    SolutionNameMin: Cijk_Alik_Bjlk_HHS_BH_UserArgs_MT256x256x32_MI16x16x1_SN_LDSB1_CLR1_GSU0_GSUC0_GSUWGMRR0_K1_LBSPPA512_LBSPPB2048_LPB0_MIWT8_8_PLR1_SU32_SUM0_SUS256_SKXCCM4_VWA8_VWB8_WGM1_WGMXCC1_WGMXCCGn1
    SolutionIndex: 57
    SolutionNameMin: Cijk_Alik_Bjlk_HHS_BH_UserArgs_MT256x256x32_MI16x16x1_SN_LDSB1_CLR1_GSU0_GSUC0_GSUWGMRR0_K1_LBSPPA256_LBSPPB2048_LPB0_MIWT8_8_PLR1_SU32_SUM0_SUS256_SKXCCM4_VWA4_VWB4_WGM4_WGMXCC1_WGMXCCGn1
    SolutionIndex: 58
    SolutionNameMin: Cijk_Alik_Bjlk_HHS_BH_UserArgs_MT128x256x32_MI16x16x1_SN_LDSB1_CLR1_GSU0_GSUC0_GSUWGMRR0_K1_LBSPPA256_LBSPPB2048_LPB0_MIWT4_8_PLR1_SU32_SUM0_SUS256_SKXCCM4_VWA4_VWB4_WGM1_WGMXCC1_WGMXCCGn1
    SolutionIndex: 59
    SolutionNameMin: Cijk_Alik_Bjlk_HHS_BH_UserArgs_MT128x256x32_MI16x16x1_SN_LDSB1_CLR1_GSU0_GSUC0_GSUWGMRR0_K1_LBSPPA256_LBSPPB2048_LPB0_MIWT4_8_PLR1_SU32_SUM0_SUS256_SKXCCM4_VWA4_VWB8_WGM1_WGMXCC1_WGMXCCGn1
    SolutionIndex: 60
    SolutionNameMin: Cijk_Alik_Bjlk_HHS_BH_UserArgs_MT128x256x32_MI16x16x1_SN_LDSB1_CLR1_GSU0_GSUC0_GSUWGMRR0_K1_LBSPPA256_LBSPPB2048_LPB0_MIWT4_8_PLR1_SU32_SUM0_SUS256_SKXCCM4_VWA4_VWB4_WGM2_WGMXCC1_WGMXCCGn1
    SolutionIndex: 61
    SolutionNameMin: Cijk_Alik_Bjlk_HHS_BH_UserArgs_MT128x256x32_MI16x16x1_SN_LDSB1_CLR1_GSU0_GSUC0_GSUWGMRR0_K1_LBSPPA256_LBSPPB2048_LPB0_MIWT4_8_PLR1_SU32_SUM0_SUS256_SKXCCM4_VWA4_VWB8_WGM2_WGMXCC1_WGMXCCGn1
    SolutionIndex: 62
    SolutionNameMin: Cijk_Alik_Bjlk_HHS_BH_UserArgs_MT128x256x32_MI16x16x1_SN_LDSB1_CLR1_GSU0_GSUC0_GSUWGMRR0_K1_LBSPPA256_LBSPPB2048_LPB0_MIWT4_8_PLR1_SU32_SUM0_SUS256_SKXCCM4_VWA4_VWB4_WGM4_WGMXCC1_WGMXCCGn1
    SolutionIndex: 63
    SolutionNameMin: Cijk_Alik_Bjlk_HHS_BH_UserArgs_MT128x256x32_MI16x16x1_SN_LDSB1_CLR1_GSU0_GSUC0_GSUWGMRR0_K1_LBSPPA256_LBSPPB2048_LPB0_MIWT4_8_PLR1_SU32_SUM0_SUS256_SKXCCM4_VWA4_VWB8_WGM4_WGMXCC1_WGMXCCGn1
    SolutionIndex: 64
    SolutionNameMin: Cijk_Alik_Bjlk_HHS_BH_UserArgs_MT256x128x32_MI16x16x1_SN_LDSB1_CLR1_GSU0_GSUC0_GSUWGMRR0_K1_LBSPPA512_LBSPPB1024_LPB0_MIWT8_4_PLR1_SU32_SUM0_SUS256_SKXCCM4_VWA8_VWB4_WGM1_WGMXCC1_WGMXCCGn1
    SolutionIndex: 65
    SolutionNameMin: Cijk_Alik_Bjlk_HHS_BH_UserArgs_MT256x128x32_MI16x16x1_SN_LDSB1_CLR1_GSU0_GSUC0_GSUWGMRR0_K1_LBSPPA512_LBSPPB1024_LPB16_MIWT8_4_PLR1_SU32_SUM0_SUS256_SKXCCM4_VWA8_VWB1_WGM2_WGMXCC1_WGMXCCGn1
    SolutionIndex: 66
    SolutionNameMin: Cijk_Alik_Bjlk_HHS_BH_UserArgs_MT256x128x32_MI16x16x1_SN_LDSB1_CLR1_GSU0_GSUC0_GSUWGMRR0_K1_LBSPPA512_LBSPPB1024_LPB32_MIWT8_4_PLR1_SU32_SUM0_SUS256_SKXCCM4_VWA8_VWB2_WGM2_WGMXCC1_WGMXCCGn1
    SolutionIndex: 67
    SolutionNameMin: Cijk_Alik_Bjlk_HHS_BH_UserArgs_MT256x128x32_MI16x16x1_SN_LDSB1_CLR1_GSU0_GSUC0_GSUWGMRR0_K1_LBSPPA512_LBSPPB1024_LPB0_MIWT8_4_PLR1_SU32_SUM0_SUS256_SKXCCM4_VWA8_VWB4_WGM2_WGMXCC1_WGMXCCGn1
    SolutionIndex: 68
    SolutionNameMin: Cijk_Alik_Bjlk_HHS_BH_UserArgs_MT256x128x32_MI16x16x1_SN_LDSB1_CLR1_GSU0_GSUC0_GSUWGMRR0_K1_LBSPPA512_LBSPPB1024_LPB32_MIWT8_4_PLR1_SU32_SUM0_SUS256_SKXCCM4_VWA8_VWB2_WGM4_WGMXCC1_WGMXCCGn1
    SolutionIndex: 69
    SolutionNameMin: Cijk_Alik_Bjlk_HHS_BH_UserArgs_MT256x128x32_MI16x16x1_SN_LDSB1_CLR1_GSU0_GSUC0_GSUWGMRR0_K1_LBSPPA512_LBSPPB1024_LPB0_MIWT8_4_PLR1_SU32_SUM0_SUS256_SKXCCM4_VWA8_VWB4_WGM4_WGMXCC1_WGMXCCGn1
    SolutionIndex: 70
    SolutionNameMin: Cijk_Alik_Bjlk_HHS_BH_UserArgs_MT128x128x32_MI16x16x1_SN_LDSB1_CLR1_GSU0_GSUC0_GSUWGMRR0_K1_LBSPPA128_LBSPPB1024_LPB32_MIWT4_4_PLR1_SU32_SUM0_SUS256_SKXCCM4_VWA2_VWB2_WGM1_WGMXCC1_WGMXCCGn1
    SolutionIndex: 71
    SolutionNameMin: Cijk_Alik_Bjlk_HHS_BH_UserArgs_MT128x128x32_MI16x16x1_SN_LDSB1_CLR1_GSU0_GSUC0_GSUWGMRR0_K1_LBSPPA256_LBSPPB1024_LPB32_MIWT4_4_PLR1_SU32_SUM0_SUS256_SKXCCM4_VWA4_VWB2_WGM1_WGMXCC1_WGMXCCGn1
    SolutionIndex: 72
    SolutionNameMin: Cijk_Alik_Bjlk_HHS_BH_UserArgs_MT128x128x32_MI16x16x1_SN_LDSB1_CLR1_GSU0_GSUC0_GSUWGMRR0_K1_LBSPPA128_LBSPPB1024_LPB0_MIWT4_4_PLR1_SU32_SUM0_SUS256_SKXCCM4_VWA2_VWB4_WGM1_WGMXCC1_WGMXCCGn1
    SolutionIndex: 73
    SolutionNameMin: Cijk_Alik_Bjlk_HHS_BH_UserArgs_MT128x128x32_MI16x16x1_SN_LDSB1_CLR1_GSU0_GSUC0_GSUWGMRR0_K1_LBSPPA128_LBSPPB1024_LPB32_MIWT4_4_PLR1_SU32_SUM0_SUS256_SKXCCM4_VWA2_VWB2_WGM2_WGMXCC1_WGMXCCGn1
    SolutionIndex: 74
    SolutionNameMin: Cijk_Alik_Bjlk_HHS_BH_UserArgs_MT128x128x32_MI16x16x1_SN_LDSB1_CLR1_GSU0_GSUC0_GSUWGMRR0_K1_LBSPPA128_LBSPPB1024_LPB0_MIWT4_4_PLR1_SU32_SUM0_SUS256_SKXCCM4_VWA2_VWB4_WGM2_WGMXCC1_WGMXCCGn1
    SolutionIndex: 75
    SolutionNameMin: Cijk_Alik_Bjlk_HHS_BH_UserArgs_MT64x128x32_MI16x16x1_SN_LDSB0_CLR0_GSU0_GSUC0_GSUWGMRR0_K1_LBSPPA128_LBSPPB1024_LPB0_MIWT2_4_PLR0_SU32_SUM0_SUS256_SKXCCM4_VWA2_VWB4_WGM2_WGMXCC1_WGMXCCGn1
    SolutionIndex: 76
    SolutionNameMin: Cijk_Alik_Bjlk_HHS_BH_UserArgs_MT64x128x32_MI16x16x1_SN_LDSB0_CLR0_GSU0_GSUC0_GSUWGMRR0_K1_LBSPPA128_LBSPPB1024_LPB0_MIWT2_4_PLR0_SU32_SUM0_SUS256_SKXCCM4_VWA2_VWB4_WGM4_WGMXCC1_WGMXCCGn1
    SolutionIndex: 77
    SolutionNameMin: Cijk_Alik_Bjlk_HHS_BH_UserArgs_MT128x64x32_MI16x16x1_SN_LDSB0_CLR1_GSU0_GSUC0_GSUWGMRR0_K1_LBSPPA128_LBSPPB512_LPB32_MIWT4_2_PLR1_SU32_SUM0_SUS256_SKXCCM4_VWA2_VWB2_WGM1_WGMXCC1_WGMXCCGn1
    SolutionIndex: 78
    SolutionNameMin: Cijk_Alik_Bjlk_HHS_BH_UserArgs_MT128x64x32_MI16x16x1_SN_LDSB0_CLR1_GSU0_GSUC0_GSUWGMRR0_K1_LBSPPA256_LBSPPB512_LPB32_MIWT4_2_PLR1_SU32_SUM0_SUS256_SKXCCM4_VWA4_VWB2_WGM4_WGMXCC1_WGMXCCGn1
    SolutionIndex: 79
    SolutionNameMin: Cijk_Alik_Bjlk_HHS_BH_UserArgs_MT32x32x32_MI16x16x1_SN_LDSB0_CLR1_GSU0_GSUC0_GSUWGMRR0_K1_LBSPPA128_LBSPPB256_LPB16_MIWT1_1_PLR1_SU32_SUM0_SUS256_SKXCCM4_VWA1_VWB1_WGM1_WGMXCC1_WGMXCCGn1
    SolutionIndex: 80
    SolutionNameMin: Cijk_Alik_Bjlk_HHS_BH_UserArgs_MT128x256x64_MI16x16x1_SN_LDSB1_CLR1_GSU0_GSUC0_GSUWGMRR0_K1_LBSPPA512_LBSPPB4096_LPB0_MIWT4_8_PLR1_SU32_SUM0_SUS256_SKXCCM4_VWA4_VWB4_WGM1_WGMXCC1_WGMXCCGn1
    SolutionIndex: 81
    SolutionNameMin: Cijk_Alik_Bjlk_HHS_BH_UserArgs_MT128x256x64_MI16x16x1_SN_LDSB1_CLR1_GSU0_GSUC0_GSUWGMRR0_K1_LBSPPA512_LBSPPB4096_LPB0_MIWT4_8_PLR1_SU32_SUM0_SUS256_SKXCCM4_VWA4_VWB4_WGM4_WGMXCC1_WGMXCCGn1
    SolutionIndex: 82
    SolutionNameMin: Cijk_Alik_Bjlk_HHS_BH_UserArgs_MT256x128x64_MI16x16x1_SN_LDSB1_CLR1_GSU0_GSUC0_GSUWGMRR0_K1_LBSPPA512_LBSPPB2048_LPB0_MIWT8_4_PLR1_SU32_SUM0_SUS256_SKXCCM4_VWA4_VWB4_WGM1_WGMXCC1_WGMXCCGn1
    SolutionIndex: 83
    SolutionNameMin: Cijk_Alik_Bjlk_HHS_BH_UserArgs_MT256x128x64_MI16x16x1_SN_LDSB1_CLR1_GSU0_GSUC0_GSUWGMRR0_K1_LBSPPA512_LBSPPB2048_LPB0_MIWT8_4_PLR1_SU32_SUM0_SUS256_SKXCCM4_VWA4_VWB4_WGM2_WGMXCC1_WGMXCCGn1
    SolutionIndex: 84
    SolutionNameMin: Cijk_Alik_Bjlk_HHS_BH_UserArgs_MT128x128x64_MI16x16x1_SN_LDSB1_CLR1_GSU0_GSUC0_GSUWGMRR0_K1_LBSPPA256_LBSPPB2048_LPB0_MIWT4_4_PLR1_SU32_SUM0_SUS256_SKXCCM4_VWA2_VWB4_WGM1_WGMXCC1_WGMXCCGn1
    SolutionIndex: 85
    SolutionNameMin: Cijk_Alik_Bjlk_HHS_BH_UserArgs_MT128x128x64_MI16x16x1_SN_LDSB1_CLR1_GSU0_GSUC0_GSUWGMRR0_K1_LBSPPA512_LBSPPB2048_LPB0_MIWT4_4_PLR1_SU32_SUM0_SUS256_SKXCCM4_VWA4_VWB4_WGM1_WGMXCC1_WGMXCCGn1
    SolutionIndex: 86
    SolutionNameMin: Cijk_Alik_Bjlk_HHS_BH_UserArgs_MT128x128x64_MI16x16x1_SN_LDSB1_CLR1_GSU0_GSUC0_GSUWGMRR0_K1_LBSPPA512_LBSPPB2048_LPB0_MIWT4_4_PLR1_SU32_SUM0_SUS256_SKXCCM4_VWA4_VWB4_WGM2_WGMXCC1_WGMXCCGn1
    SolutionIndex: 87
    SolutionNameMin: Cijk_Alik_Bjlk_HHS_BH_UserArgs_MT128x128x64_MI16x16x1_SN_LDSB1_CLR1_GSU0_GSUC0_GSUWGMRR0_K1_LBSPPA256_LBSPPB2048_LPB0_MIWT4_4_PLR1_SU32_SUM0_SUS256_SKXCCM4_VWA2_VWB4_WGM4_WGMXCC1_WGMXCCGn1
    SolutionIndex: 88
    SolutionNameMin: Cijk_Alik_Bjlk_HHS_BH_UserArgs_MT128x128x64_MI16x16x1_SN_LDSB1_CLR1_GSU0_GSUC0_GSUWGMRR0_K1_LBSPPA512_LBSPPB2048_LPB0_MIWT4_4_PLR1_SU32_SUM0_SUS256_SKXCCM4_VWA4_VWB4_WGM4_WGMXCC1_WGMXCCGn1
    SolutionIndex: 89
    SolutionNameMin: Cijk_Alik_Bjlk_HHS_BH_UserArgs_MT64x128x64_MI16x16x1_SN_LDSB1_CLR1_GSU0_GSUC0_GSUWGMRR0_K1_LBSPPA256_LBSPPB2048_LPB0_MIWT2_4_PLR1_SU32_SUM0_SUS256_SKXCCM4_VWA2_VWB4_WGM1_WGMXCC1_WGMXCCGn1
    SolutionIndex: 90
    SolutionNameMin: Cijk_Alik_Bjlk_HHS_BH_UserArgs_MT128x64x64_MI16x16x1_SN_LDSB1_CLR1_GSU0_GSUC0_GSUWGMRR0_K1_LBSPPA256_LBSPPB1024_LPB32_MIWT4_2_PLR1_SU32_SUM0_SUS256_SKXCCM4_VWA2_VWB2_WGM1_WGMXCC1_WGMXCCGn1
    SolutionIndex: 91
    SolutionNameMin: Cijk_Alik_Bjlk_HHS_BH_UserArgs_MT128x64x64_MI16x16x1_SN_LDSB1_CLR1_GSU0_GSUC0_GSUWGMRR0_K1_LBSPPA512_LBSPPB1024_LPB32_MIWT4_2_PLR1_SU32_SUM0_SUS256_SKXCCM4_VWA4_VWB2_WGM1_WGMXCC1_WGMXCCGn1
    SolutionIndex: 92
    SolutionNameMin: Cijk_Alik_Bjlk_HHS_BH_UserArgs_MT128x64x64_MI16x16x1_SN_LDSB1_CLR1_GSU0_GSUC0_GSUWGMRR0_K1_LBSPPA512_LBSPPB1024_LPB32_MIWT4_2_PLR1_SU32_SUM0_SUS256_SKXCCM4_VWA4_VWB2_WGM2_WGMXCC1_WGMXCCGn1
    SolutionIndex: 93
    SolutionNameMin: Cijk_Alik_Bjlk_HHS_BH_UserArgs_MT128x64x64_MI16x16x1_SN_LDSB1_CLR1_GSU0_GSUC0_GSUWGMRR0_K1_LBSPPA256_LBSPPB1024_LPB32_MIWT4_2_PLR1_SU32_SUM0_SUS256_SKXCCM4_VWA2_VWB2_WGM4_WGMXCC1_WGMXCCGn1
    SolutionIndex: 94
    SolutionNameMin: Cijk_Alik_Bjlk_HHS_BH_UserArgs_MT128x64x64_MI16x16x1_SN_LDSB1_CLR1_GSU0_GSUC0_GSUWGMRR0_K1_LBSPPA512_LBSPPB1024_LPB32_MIWT4_2_PLR1_SU32_SUM0_SUS256_SKXCCM4_VWA4_VWB2_WGM4_WGMXCC1_WGMXCCGn1
    SolutionIndex: 95
    SolutionNameMin: Cijk_Alik_Bjlk_HHS_BH_UserArgs_MT64x64x64_MI16x16x1_SN_LDSB1_CLR1_GSU0_GSUC0_GSUWGMRR0_K1_LBSPPA128_LBSPPB1024_LPB32_MIWT2_2_PLR1_SU32_SUM0_SUS256_SKXCCM4_VWA1_VWB2_WGM1_WGMXCC1_WGMXCCGn1
    SolutionIndex: 96
    SolutionNameMin: Cijk_Alik_Bjlk_HHS_BH_UserArgs_MT64x64x64_MI16x16x1_SN_LDSB1_CLR1_GSU0_GSUC0_GSUWGMRR0_K1_LBSPPA256_LBSPPB1024_LPB32_MIWT2_2_PLR1_SU32_SUM0_SUS256_SKXCCM4_VWA2_VWB2_WGM1_WGMXCC1_WGMXCCGn1
    SolutionIndex: 97
    SolutionNameMin: Cijk_Alik_Bjlk_HHS_BH_UserArgs_MT64x64x64_MI16x16x1_SN_LDSB1_CLR1_GSU0_GSUC0_GSUWGMRR0_K1_LBSPPA256_LBSPPB1024_LPB32_MIWT2_2_PLR1_SU32_SUM0_SUS256_SKXCCM4_VWA2_VWB2_WGM4_WGMXCC1_WGMXCCGn1
    SolutionIndex: 98
    SolutionNameMin: Cijk_Alik_Bjlk_HHS_BH_UserArgs_MT32x64x64_MI16x16x1_SN_LDSB0_CLR1_GSU0_GSUC0_GSUWGMRR0_K1_LBSPPA128_LBSPPB1024_LPB32_MIWT1_2_PLR1_SU32_SUM0_SUS256_SKXCCM4_VWA1_VWB2_WGM1_WGMXCC1_WGMXCCGn1
    SolutionIndex: 99
    SolutionNameMin: Cijk_Alik_Bjlk_HHS_BH_UserArgs_MT64x32x64_MI16x16x1_SN_LDSB0_CLR1_GSU0_GSUC0_GSUWGMRR0_K1_LBSPPA256_LBSPPB512_LPB16_MIWT2_1_PLR1_SU32_SUM0_SUS256_SKXCCM4_VWA2_VWB1_WGM1_WGMXCC1_WGMXCCGn1
    SolutionIndex: 100
    SolutionNameMin: Cijk_Alik_Bjlk_HHS_BH_UserArgs_MT128x64x128_MI16x16x1_SN_LDSB1_CLR1_GSU0_GSUC0_GSUWGMRR0_K1_LBSPPA512_LBSPPB1024_LPB32_MIWT4_2_PLR2_SU32_SUM0_SUS256_SKXCCM4_VWA2_VWB2_WGM1_WGMXCC1_WGMXCCGn1
    SolutionIndex: 101
    SolutionNameMin: Cijk_Alik_Bjlk_HHS_BH_UserArgs_MT128x64x128_MI16x16x1_SN_LDSB1_CLR1_GSU0_GSUC0_GSUWGMRR0_K1_LBSPPA1024_LBSPPB1024_LPB32_MIWT4_2_PLR2_SU32_SUM0_SUS256_SKXCCM4_VWA4_VWB2_WGM1_WGMXCC1_WGMXCCGn1
    SolutionIndex: 102
    SolutionNameMin: Cijk_Alik_Bjlk_HHS_BH_UserArgs_MT128x64x128_MI16x16x1_SN_LDSB1_CLR1_GSU0_GSUC0_GSUWGMRR0_K1_LBSPPA512_LBSPPB1024_LPB32_MIWT4_2_PLR2_SU32_SUM0_SUS256_SKXCCM4_VWA2_VWB2_WGM4_WGMXCC1_WGMXCCGn1
    SolutionIndex: 103
    SolutionNameMin: Cijk_Alik_Bjlk_HHS_BH_UserArgs_MT128x64x128_MI16x16x1_SN_LDSB1_CLR1_GSU0_GSUC0_GSUWGMRR0_K1_LBSPPA1024_LBSPPB1024_LPB32_MIWT4_2_PLR2_SU32_SUM0_SUS256_SKXCCM4_VWA4_VWB2_WGM4_WGMXCC1_WGMXCCGn1
    SolutionIndex: 104
    SolutionNameMin: Cijk_Alik_Bjlk_HHS_BH_UserArgs_MT64x64x128_MI16x16x1_SN_LDSB1_CLR1_GSU0_GSUC0_GSUWGMRR0_K1_LBSPPA256_LBSPPB1024_LPB32_MIWT2_2_PLR2_SU32_SUM0_SUS256_SKXCCM4_VWA1_VWB2_WGM1_WGMXCC1_WGMXCCGn1
    SolutionIndex: 105
    SolutionNameMin: Cijk_Alik_Bjlk_HHS_BH_UserArgs_MT64x64x128_MI16x16x1_SN_LDSB1_CLR1_GSU0_GSUC0_GSUWGMRR0_K1_LBSPPA256_LBSPPB1024_LPB32_MIWT2_2_PLR2_SU32_SUM0_SUS256_SKXCCM4_VWA1_VWB2_WGM2_WGMXCC1_WGMXCCGn1
    SolutionIndex: 106
    SolutionNameMin: Cijk_Alik_Bjlk_HHS_BH_UserArgs_MT32x64x128_MI16x16x1_SN_LDSB1_CLR1_GSU0_GSUC0_GSUWGMRR0_K1_LBSPPA256_LBSPPB1024_LPB32_MIWT1_2_PLR1_SU32_SUM0_SUS256_SKXCCM4_VWA1_VWB2_WGM1_WGMXCC1_WGMXCCGn1
    SolutionIndex: 107
    SolutionNameMin: Cijk_Alik_Bjlk_HHS_BH_UserArgs_MT32x64x128_MI16x16x1_SN_LDSB1_CLR1_GSU0_GSUC0_GSUWGMRR0_K1_LBSPPA256_LBSPPB1024_LPB32_MIWT1_2_PLR2_SU32_SUM0_SUS256_SKXCCM4_VWA1_VWB2_WGM1_WGMXCC1_WGMXCCGn1
    SolutionIndex: 108
    SolutionNameMin: Cijk_Alik_Bjlk_HHS_BH_UserArgs_MT32x32x128_MI16x16x1_SN_LDSB1_CLR1_GSU0_GSUC0_GSUWGMRR0_K1_LBSPPA256_LBSPPB512_LPB16_MIWT1_1_PLR1_SU32_SUM0_SUS256_SKXCCM4_VWA1_VWB1_WGM1_WGMXCC1_WGMXCCGn1
    SolutionIndex: 109
    SolutionNameMin: Cijk_Alik_Bjlk_HHS_BH_UserArgs_MT32x32x128_MI16x16x1_SN_LDSB1_CLR1_GSU0_GSUC0_GSUWGMRR0_K1_LBSPPA256_LBSPPB512_LPB16_MIWT1_1_PLR2_SU32_SUM0_SUS256_SKXCCM4_VWA1_VWB1_WGM1_WGMXCC1_WGMXCCGn1
    SolutionIndex: 110
    SolutionNameMin: Cijk_Alik_Bjlk_HHS_BH_UserArgs_MT32x32x32_MI16x16x1_SN_LDSB0_CLR0_GSU0_GSUC0_GSUWGMRR0_K1_LBSPPA128_LBSPPB256_LPB16_MIWT1_1_PLR0_SU32_SUM0_SUS256_SKXCCM0_VWA1_VWB1_WGM1_WGMXCC1_WGMXCCGn1
- - - [128, 128, 1, 128, 128, 128, 128, 128]
    - [109, 0.088]
  - - [128, 128, 1, 256, 128, 128, 256, 128]
    - [50, 0.109]
  - - [128, 128, 1, 512, 128, 128, 512, 128]
    - [108, 0.177]
  - - [128, 128, 1, 1024, 128, 128, 1024, 128]
    - [108, 0.286]
  - - [128, 128, 1, 2048, 128, 128, 2048, 128]
    - [50, 0.515]
  - - [128, 128, 1, 4096, 128, 128, 4096, 128]
    - [50, 0.918]
  - - [128, 128, 1, 8192, 128, 128, 8192, 128]
    - [51, 1.465]
  - - [128, 256, 1, 128, 128, 128, 128, 256]
    - [50, 0.173]
  - - [128, 256, 1, 256, 128, 128, 256, 256]
    - [51, 0.212]
  - - [128, 256, 1, 512, 128, 128, 512, 256]
    - [109, 0.362]
  - - [128, 256, 1, 1024, 128, 128, 1024, 256]
    - [50, 0.601]
  - - [128, 256, 1, 2048, 128, 128, 2048, 256]
    - [79, 1.027]
  - - [128, 256, 1, 4096, 128, 128, 4096, 256]
    - [46, 1.615]
  - - [128, 256, 1, 8192, 128, 128, 8192, 256]
    - [47, 2.524]
  - - [128, 512, 1, 128, 128, 128, 128, 512]
    - [51, 0.339]
  - - [128, 512, 1, 256, 128, 128, 256, 512]
    - [109, 0.424]
  - - [128, 512, 1, 512, 128, 128, 512, 512]
    - [108, 0.678]
  - - [128, 512, 1, 1024, 128, 128, 1024, 512]
    - [50, 1.215]
  - - [128, 512, 1, 2048, 128, 128, 2048, 512]
    - [109, 1.862]
  - - [128, 512, 1, 4096, 128, 128, 4096, 512]
    - [98, 2.806]
  - - [128, 512, 1, 8192, 128, 128, 8192, 512]
    - [104, 4.214]
  - - [128, 1024, 1, 128, 128, 128, 128, 1024]
    - [49, 0.643]
  - - [128, 1024, 1, 256, 128, 128, 256, 1024]
    - [50, 1.05]
  - - [128, 1024, 1, 512, 128, 128, 512, 1024]
    - [50, 1.646]
  - - [128, 1024, 1, 1024, 128, 128, 1024, 1024]
    - [50, 2.293]
  - - [128, 1024, 1, 2048, 128, 128, 2048, 1024]
    - [46, 3.198]
  - - [128, 1024, 1, 4096, 128, 128, 4096, 1024]
    - [95, 4.722]
  - - [128, 1024, 1, 8192, 128, 128, 8192, 1024]
    - [43, 6.705]
  - - [128, 2048, 1, 128, 128, 128, 128, 2048]
    - [45, 1.176]
  - - [128, 2048, 1, 256, 128, 128, 256, 2048]
    - [98, 1.855]
  - - [128, 2048, 1, 512, 128, 128, 512, 2048]
    - [46, 2.825]
  - - [128, 2048, 1, 1024, 128, 128, 1024, 2048]
    - [107, 3.919]
  - - [128, 2048, 1, 2048, 128, 128, 2048, 2048]
    - [76, 4.567]
  - - [128, 2048, 1, 4096, 128, 128, 4096, 2048]
    - [91, 6.848]
  - - [128, 2048, 1, 8192, 128, 128, 8192, 2048]
    - [85, 9.83]
  - - [128, 4096, 1, 128, 128, 128, 128, 4096]
    - [38, 2.012]
  - - [128, 4096, 1, 256, 128, 128, 256, 4096]
    - [96, 3.339]
  - - [128, 4096, 1, 512, 128, 128, 512, 4096]
    - [96, 4.953]
  - - [128, 4096, 1, 1024, 128, 128, 1024, 4096]
    - [91, 5.734]
  - - [128, 4096, 1, 2048, 128, 128, 2048, 4096]
    - [71, 6.29]
  - - [128, 4096, 1, 4096, 128, 128, 4096, 4096]
    - [21, 8.497]
  - - [128, 4096, 1, 8192, 128, 128, 8192, 4096]
    - [80, 11.442]
  - - [128, 8192, 1, 128, 128, 128, 128, 8192]
    - [90, 3.25]
  - - [128, 8192, 1, 256, 128, 128, 256, 8192]
    - [35, 5.207]
  - - [128, 8192, 1, 512, 128, 128, 512, 8192]
    - [91, 7.255]
  - - [128, 8192, 1, 1024, 128, 128, 1024, 8192]
    - [42, 7.513]
  - - [128, 8192, 1, 2048, 128, 128, 2048, 8192]
    - [96, 8.331]
  - - [128, 8192, 1, 4096, 128, 128, 4096, 8192]
    - [13, 10.785]
  - - [128, 8192, 1, 8192, 128, 128, 8192, 8192]
    - [25, 11.468]
  - - [256, 128, 1, 128, 256, 256, 128, 128]
    - [108, 0.173]
  - - [256, 128, 1, 256, 256, 256, 256, 128]
    - [51, 0.21]
  - - [256, 128, 1, 512, 256, 256, 512, 128]
    - [108, 0.365]
  - - [256, 128, 1, 1024, 256, 256, 1024, 128]
    - [108, 0.599]
  - - [256, 128, 1, 2048, 256, 256, 2048, 128]
    - [79, 1.035]
  - - [256, 128, 1, 4096, 256, 256, 4096, 128]
    - [46, 1.608]
  - - [256, 128, 1, 8192, 256, 256, 8192, 128]
    - [107, 2.621]
  - - [256, 256, 1, 128, 256, 256, 128, 256]
    - [51, 0.341]
  - - [256, 256, 1, 256, 256, 256, 256, 256]
    - [108, 0.423]
  - - [256, 256, 1, 512, 256, 256, 512, 256]
    - [106, 0.669]
  - - [256, 256, 1, 1024, 256, 256, 1024, 256]
    - [50, 1.212]
  - - [256, 256, 1, 2048, 256, 256, 2048, 256]
    - [109, 1.852]
  - - [256, 256, 1, 4096, 256, 256, 4096, 256]
    - [98, 2.811]
  - - [256, 256, 1, 8192, 256, 256, 8192, 256]
    - [105, 4.138]
  - - [256, 512, 1, 128, 256, 256, 128, 512]
    - [48, 0.628]
  - - [256, 512, 1, 256, 256, 256, 256, 512]
    - [108, 1.035]
  - - [256, 512, 1, 512, 256, 256, 512, 512]
    - [109, 1.637]
  - - [256, 512, 1, 1024, 256, 256, 1024, 512]
    - [51, 2.302]
  - - [256, 512, 1, 2048, 256, 256, 2048, 512]
    - [106, 3.222]
  - - [256, 512, 1, 4096, 256, 256, 4096, 512]
    - [96, 4.741]
  - - [256, 512, 1, 8192, 256, 256, 8192, 512]
    - [103, 6.633]
  - - [256, 1024, 1, 128, 256, 256, 128, 1024]
    - [45, 1.176]
  - - [256, 1024, 1, 256, 256, 256, 256, 1024]
    - [41, 1.863]
  - - [256, 1024, 1, 512, 256, 256, 512, 1024]
    - [107, 2.822]
  - - [256, 1024, 1, 1024, 256, 256, 1024, 1024]
    - [46, 3.925]
  - - [256, 1024, 1, 2048, 256, 256, 2048, 1024]
    - [75, 4.498]
  - - [256, 1024, 1, 4096, 256, 256, 4096, 1024]
    - [35, 7.062]
  - - [256, 1024, 1, 8192, 256, 256, 8192, 1024]
    - [88, 9.772]
  - - [256, 2048, 1, 128, 256, 256, 128, 2048]
    - [96, 1.992]
  - - [256, 2048, 1, 256, 256, 256, 256, 2048]
    - [96, 3.315]
  - - [256, 2048, 1, 512, 256, 256, 512, 2048]
    - [38, 4.865]
  - - [256, 2048, 1, 1024, 256, 256, 1024, 2048]
    - [91, 5.68]
  - - [256, 2048, 1, 2048, 256, 256, 2048, 2048]
    - [40, 6.34]
  - - [256, 2048, 1, 4096, 256, 256, 4096, 2048]
    - [58, 8.003]
  - - [256, 2048, 1, 8192, 256, 256, 8192, 2048]
    - [28, 11.455]
  - - [256, 4096, 1, 128, 256, 256, 128, 4096]
    - [90, 3.237]
  - - [256, 4096, 1, 256, 256, 256, 256, 4096]
    - [90, 5.156]
  - - [256, 4096, 1, 512, 256, 256, 512, 4096]
    - [91, 7.232]
  - - [256, 4096, 1, 1024, 256, 256, 1024, 4096]
    - [100, 7.791]
  - - [256, 4096, 1, 2048, 256, 256, 2048, 4096]
    - [91, 8.418]
  - - [256, 4096, 1, 4096, 256, 256, 4096, 4096]
    - [16, 10.633]
  - - [256, 4096, 1, 8192, 256, 256, 8192, 4096]
    - [30, 11.617]
  - - [256, 8192, 1, 128, 256, 256, 128, 8192]
    - [70, 4.67]
  - - [256, 8192, 1, 256, 256, 256, 256, 8192]
    - [72, 6.75]
  - - [256, 8192, 1, 512, 256, 256, 512, 8192]
    - [84, 8.459]
  - - [256, 8192, 1, 1024, 256, 256, 1024, 8192]
    - [93, 9.535]
  - - [256, 8192, 1, 2048, 256, 256, 2048, 8192]
    - [90, 10.824]
  - - [256, 8192, 1, 4096, 256, 256, 4096, 8192]
    - [71, 11.354]
  - - [256, 8192, 1, 8192, 256, 256, 8192, 8192]
    - [59, 14.033]
  - - [512, 128, 1, 128, 512, 512, 128, 128]
    - [50, 0.342]
  - - [512, 128, 1, 256, 512, 512, 256, 128]
    - [108, 0.424]
  - - [512, 128, 1, 512, 512, 512, 512, 128]
    - [108, 0.671]
  - - [512, 128, 1, 1024, 512, 512, 1024, 128]
    - [108, 1.213]
  - - [512, 128, 1, 2048, 512, 512, 2048, 128]
    - [109, 1.881]
  - - [512, 128, 1, 4096, 512, 512, 4096, 128]
    - [98, 2.791]
  - - [512, 128, 1, 8192, 512, 512, 8192, 128]
    - [44, 4.22]
  - - [512, 256, 1, 128, 512, 512, 128, 256]
    - [49, 0.638]
  - - [512, 256, 1, 256, 512, 512, 256, 256]
    - [51, 1.05]
  - - [512, 256, 1, 512, 512, 512, 512, 256]
    - [50, 1.646]
  - - [512, 256, 1, 1024, 512, 512, 1024, 256]
    - [109, 2.29]
  - - [512, 256, 1, 2048, 512, 512, 2048, 256]
    - [107, 3.226]
  - - [512, 256, 1, 4096, 512, 512, 4096, 256]
    - [97, 4.698]
  - - [512, 256, 1, 8192, 512, 512, 8192, 256]
    - [43, 6.574]
  - - [512, 512, 1, 128, 512, 512, 128, 512]
    - [45, 1.174]
  - - [512, 512, 1, 256, 512, 512, 256, 512]
    - [41, 1.87]
  - - [512, 512, 1, 512, 512, 512, 512, 512]
    - [46, 2.828]
  - - [512, 512, 1, 1024, 512, 512, 1024, 512]
    - [107, 3.906]
  - - [512, 512, 1, 2048, 512, 512, 2048, 512]
    - [78, 4.654]
  - - [512, 512, 1, 4096, 512, 512, 4096, 512]
    - [36, 7.029]
  - - [512, 512, 1, 8192, 512, 512, 8192, 512]
    - [88, 9.803]
  - - [512, 1024, 1, 128, 512, 512, 128, 1024]
    - [96, 1.995]
  - - [512, 1024, 1, 256, 512, 512, 256, 1024]
    - [38, 3.336]
  - - [512, 1024, 1, 512, 512, 512, 512, 1024]
    - [38, 4.899]
  - - [512, 1024, 1, 1024, 512, 512, 1024, 1024]
    - [91, 5.642]
  - - [512, 1024, 1, 2048, 512, 512, 2048, 1024]
    - [40, 6.451]
  - - [512, 1024, 1, 4096, 512, 512, 4096, 1024]
    - [13, 8.056]
  - - [512, 1024, 1, 8192, 512, 512, 8192, 1024]
    - [81, 11.494]
  - - [512, 2048, 1, 128, 512, 512, 128, 2048]
    - [77, 3.207]
  - - [512, 2048, 1, 256, 512, 512, 256, 2048]
    - [90, 5.121]
  - - [512, 2048, 1, 512, 512, 512, 512, 2048]
    - [91, 7.21]
  - - [512, 2048, 1, 1024, 512, 512, 1024, 2048]
    - [101, 7.79]
  - - [512, 2048, 1, 2048, 512, 512, 2048, 2048]
    - [91, 8.487]
  - - [512, 2048, 1, 4096, 512, 512, 4096, 2048]
    - [14, 10.451]
  - - [512, 2048, 1, 8192, 512, 512, 8192, 2048]
    - [30, 11.547]
  - - [512, 4096, 1, 128, 512, 512, 128, 4096]
    - [70, 4.671]
  - - [512, 4096, 1, 256, 512, 512, 256, 4096]
    - [72, 6.727]
  - - [512, 4096, 1, 512, 512, 512, 512, 4096]
    - [84, 8.556]
  - - [512, 4096, 1, 1024, 512, 512, 1024, 4096]
    - [93, 9.624]
  - - [512, 4096, 1, 2048, 512, 512, 2048, 4096]
    - [90, 10.822]
  - - [512, 4096, 1, 4096, 512, 512, 4096, 4096]
    - [60, 11.263]
  - - [512, 4096, 1, 8192, 512, 512, 8192, 4096]
    - [63, 13.642]
  - - [512, 8192, 1, 128, 512, 512, 128, 8192]
    - [17, 6.263]
  - - [512, 8192, 1, 256, 512, 512, 256, 8192]
    - [17, 8.917]
  - - [512, 8192, 1, 512, 512, 512, 512, 8192]
    - [72, 10.233]
  - - [512, 8192, 1, 1024, 512, 512, 1024, 8192]
    - [72, 11.994]
  - - [512, 8192, 1, 2048, 512, 512, 2048, 8192]
    - [84, 13.008]
  - - [512, 8192, 1, 4096, 512, 512, 4096, 8192]
    - [12, 13.758]
  - - [512, 8192, 1, 8192, 512, 512, 8192, 8192]
    - [62, 15.449]
  - - [1024, 128, 1, 128, 1024, 1024, 128, 128]
    - [49, 0.637]
  - - [1024, 128, 1, 256, 1024, 1024, 256, 128]
    - [50, 1.05]
  - - [1024, 128, 1, 512, 1024, 1024, 512, 128]
    - [108, 1.66]
  - - [1024, 128, 1, 1024, 1024, 1024, 1024, 128]
    - [109, 2.298]
  - - [1024, 128, 1, 2048, 1024, 1024, 2048, 128]
    - [106, 3.209]
  - - [1024, 128, 1, 4096, 1024, 1024, 4096, 128]
    - [97, 4.719]
  - - [1024, 128, 1, 8192, 1024, 1024, 8192, 128]
    - [43, 6.612]
  - - [1024, 256, 1, 128, 1024, 1024, 128, 256]
    - [45, 1.155]
  - - [1024, 256, 1, 256, 1024, 1024, 256, 256]
    - [99, 1.86]
  - - [1024, 256, 1, 512, 1024, 1024, 512, 256]
    - [107, 2.837]
  - - [1024, 256, 1, 1024, 1024, 1024, 1024, 256]
    - [107, 3.934]
  - - [1024, 256, 1, 2048, 1024, 1024, 2048, 256]
    - [78, 4.693]
  - - [1024, 256, 1, 4096, 1024, 1024, 4096, 256]
    - [94, 7.036]
  - - [1024, 256, 1, 8192, 1024, 1024, 8192, 256]
    - [86, 9.723]
  - - [1024, 512, 1, 128, 1024, 1024, 128, 512]
    - [96, 1.996]
  - - [1024, 512, 1, 256, 1024, 1024, 256, 512]
    - [96, 3.317]
  - - [1024, 512, 1, 512, 1024, 1024, 512, 512]
    - [96, 4.892]
  - - [1024, 512, 1, 1024, 1024, 1024, 1024, 512]
    - [94, 5.671]
  - - [1024, 512, 1, 2048, 1024, 1024, 2048, 512]
    - [39, 6.382]
  - - [1024, 512, 1, 4096, 1024, 1024, 4096, 512]
    - [13, 8.024]
  - - [1024, 512, 1, 8192, 1024, 1024, 8192, 512]
    - [83, 11.477]
  - - [1024, 1024, 1, 128, 1024, 1024, 128, 1024]
    - [90, 3.205]
  - - [1024, 1024, 1, 256, 1024, 1024, 256, 1024]
    - [91, 5.129]
  - - [1024, 1024, 1, 512, 1024, 1024, 512, 1024]
    - [91, 7.258]
  - - [1024, 1024, 1, 1024, 1024, 1024, 1024, 1024]
    - [100, 7.586]
  - - [1024, 1024, 1, 2048, 1024, 1024, 2048, 1024]
    - [35, 8.365]
  - - [1024, 1024, 1, 4096, 1024, 1024, 4096, 1024]
    - [14, 10.494]
  - - [1024, 1024, 1, 8192, 1024, 1024, 8192, 1024]
    - [28, 11.474]
  - - [1024, 2048, 1, 128, 1024, 1024, 128, 2048]
    - [70, 4.577]
  - - [1024, 2048, 1, 256, 1024, 1024, 256, 2048]
    - [70, 6.738]
  - - [1024, 2048, 1, 512, 1024, 1024, 512, 2048]
    - [84, 8.571]
  - - [1024, 2048, 1, 1024, 1024, 1024, 1024, 2048]
    - [90, 9.604]
  - - [1024, 2048, 1, 2048, 1024, 1024, 2048, 2048]
    - [34, 10.633]
  - - [1024, 2048, 1, 4096, 1024, 1024, 4096, 2048]
    - [61, 11.197]
  - - [1024, 2048, 1, 8192, 1024, 1024, 8192, 2048]
    - [63, 13.742]
  - - [1024, 4096, 1, 128, 1024, 1024, 128, 4096]
    - [64, 6.329]
  - - [1024, 4096, 1, 256, 1024, 1024, 256, 4096]
    - [69, 8.963]
  - - [1024, 4096, 1, 512, 1024, 1024, 512, 4096]
    - [72, 10.125]
  - - [1024, 4096, 1, 1024, 1024, 1024, 1024, 4096]
    - [72, 11.937]
  - - [1024, 4096, 1, 2048, 1024, 1024, 2048, 4096]
    - [32, 12.949]
  - - [1024, 4096, 1, 4096, 1024, 1024, 4096, 4096]
    - [62, 13.599]
  - - [1024, 4096, 1, 8192, 1024, 1024, 8192, 4096]
    - [63, 15.435]
  - - [1024, 8192, 1, 128, 1024, 1024, 128, 8192]
    - [65, 6.867]
  - - [1024, 8192, 1, 256, 1024, 1024, 256, 8192]
    - [64, 9.886]
  - - [1024, 8192, 1, 512, 1024, 1024, 512, 8192]
    - [64, 12.984]
  - - [1024, 8192, 1, 1024, 1024, 1024, 1024, 8192]
    - [19, 14.561]
  - - [1024, 8192, 1, 2048, 1024, 1024, 2048, 8192]
    - [29, 14.559]
  - - [1024, 8192, 1, 4096, 1024, 1024, 4096, 8192]
    - [59, 15.47]
  - - [1024, 8192, 1, 8192, 1024, 1024, 8192, 8192]
    - [1, 17.247]
  - - [2048, 128, 1, 128, 2048, 2048, 128, 128]
    - [45, 1.174]
  - - [2048, 128, 1, 256, 2048, 2048, 256, 128]
    - [41, 1.856]
  - - [2048, 128, 1, 512, 2048, 2048, 512, 128]
    - [107, 2.826]
  - - [2048, 128, 1, 1024, 2048, 2048, 1024, 128]
    - [107, 3.933]
  - - [2048, 128, 1, 2048, 2048, 2048, 2048, 128]
    - [78, 4.71]
  - - [2048, 128, 1, 4096, 2048, 2048, 4096, 128]
    - [36, 6.804]
  - - [2048, 128, 1, 8192, 2048, 2048, 8192, 128]
    - [32, 9.803]
  - - [2048, 256, 1, 128, 2048, 2048, 128, 256]
    - [24, 1.973]
  - - [2048, 256, 1, 256, 2048, 2048, 256, 256]
    - [38, 3.338]
  - - [2048, 256, 1, 512, 2048, 2048, 512, 256]
    - [96, 4.942]
  - - [2048, 256, 1, 1024, 2048, 2048, 1024, 256]
    - [94, 5.666]
  - - [2048, 256, 1, 2048, 2048, 2048, 2048, 256]
    - [97, 6.354]
  - - [2048, 256, 1, 4096, 2048, 2048, 4096, 256]
    - [58, 8.08]
  - - [2048, 256, 1, 8192, 2048, 2048, 8192, 256]
    - [83, 11.488]
  - - [2048, 512, 1, 128, 2048, 2048, 128, 512]
    - [90, 3.256]
  - - [2048, 512, 1, 256, 2048, 2048, 256, 512]
    - [91, 5.17]
  - - [2048, 512, 1, 512, 2048, 2048, 512, 512]
    - [37, 7.231]
  - - [2048, 512, 1, 1024, 2048, 2048, 1024, 512]
    - [102, 7.696]
  - - [2048, 512, 1, 2048, 2048, 2048, 2048, 512]
    - [38, 8.428]
  - - [2048, 512, 1, 4096, 2048, 2048, 4096, 512]
    - [12, 10.452]
  - - [2048, 512, 1, 8192, 2048, 2048, 8192, 512]
    - [25, 11.592]
  - - [2048, 1024, 1, 128, 2048, 2048, 128, 1024]
    - [70, 4.6]
  - - [2048, 1024, 1, 256, 2048, 2048, 256, 1024]
    - [70, 6.74]
  - - [2048, 1024, 1, 512, 2048, 2048, 512, 1024]
    - [87, 8.375]
  - - [2048, 1024, 1, 1024, 2048, 2048, 1024, 1024]
    - [34, 9.729]
  - - [2048, 1024, 1, 2048, 2048, 2048, 2048, 1024]
    - [35, 10.61]
  - - [2048, 1024, 1, 4096, 2048, 2048, 4096, 1024]
    - [58, 11.387]
  - - [2048, 1024, 1, 8192, 2048, 2048, 8192, 1024]
    - [61, 13.837]
  - - [2048, 2048, 1, 128, 2048, 2048, 128, 2048]
    - [67, 6.367]
  - - [2048, 2048, 1, 256, 2048, 2048, 256, 2048]
    - [67, 8.994]
  - - [2048, 2048, 1, 512, 2048, 2048, 512, 2048]
    - [29, 10.274]
  - - [2048, 2048, 1, 1024, 2048, 2048, 1024, 2048]
    - [22, 11.632]
  - - [2048, 2048, 1, 2048, 2048, 2048, 2048, 2048]
    - [31, 12.897]
  - - [2048, 2048, 1, 4096, 2048, 2048, 4096, 2048]
    - [58, 13.693]
  - - [2048, 2048, 1, 8192, 2048, 2048, 8192, 2048]
    - [62, 15.439]
  - - [2048, 4096, 1, 128, 2048, 2048, 128, 4096]
    - [64, 6.95]
  - - [2048, 4096, 1, 256, 2048, 2048, 256, 4096]
    - [64, 9.88]
  - - [2048, 4096, 1, 512, 2048, 2048, 512, 4096]
    - [19, 12.468]
  - - [2048, 4096, 1, 1024, 2048, 2048, 1024, 4096]
    - [17, 14.788]
  - - [2048, 4096, 1, 2048, 2048, 2048, 2048, 4096]
    - [29, 14.617]
  - - [2048, 4096, 1, 4096, 2048, 2048, 4096, 4096]
    - [58, 15.481]
  - - [2048, 4096, 1, 8192, 2048, 2048, 8192, 4096]
    - [7, 17.205]
  - - [2048, 8192, 1, 128, 2048, 2048, 128, 8192]
    - [4, 6.532]
  - - [2048, 8192, 1, 256, 2048, 2048, 256, 8192]
    - [56, 9.534]
  - - [2048, 8192, 1, 512, 2048, 2048, 512, 8192]
    - [2, 12.488]
  - - [2048, 8192, 1, 1024, 2048, 2048, 1024, 8192]
    - [2, 14.676]
  - - [2048, 8192, 1, 2048, 2048, 2048, 2048, 8192]
    - [59, 15.141]
  - - [2048, 8192, 1, 4096, 2048, 2048, 4096, 8192]
    - [53, 17.102]
  - - [2048, 8192, 1, 8192, 2048, 2048, 8192, 8192]
    - [57, 18.624]
  - - [4096, 128, 1, 128, 4096, 4096, 128, 128]
    - [38, 2.019]
  - - [4096, 128, 1, 256, 4096, 4096, 256, 128]
    - [96, 3.324]
  - - [4096, 128, 1, 512, 4096, 4096, 512, 128]
    - [96, 4.961]
  - - [4096, 128, 1, 1024, 4096, 4096, 1024, 128]
    - [94, 5.653]
  - - [4096, 128, 1, 2048, 4096, 4096, 2048, 128]
    - [43, 6.144]
  - - [4096, 128, 1, 4096, 4096, 4096, 4096, 128]
    - [21, 7.91]
  - - [4096, 128, 1, 8192, 4096, 4096, 8192, 128]
    - [82, 11.482]
  - - [4096, 256, 1, 128, 4096, 4096, 128, 256]
    - [91, 3.251]
  - - [4096, 256, 1, 256, 4096, 4096, 256, 256]
    - [91, 5.191]
  - - [4096, 256, 1, 512, 4096, 4096, 512, 256]
    - [94, 7.21]
  - - [4096, 256, 1, 1024, 4096, 4096, 1024, 256]
    - [102, 7.668]
  - - [4096, 256, 1, 2048, 4096, 4096, 2048, 256]
    - [94, 8.272]
  - - [4096, 256, 1, 4096, 4096, 4096, 4096, 256]
    - [10, 10.524]
  - - [4096, 256, 1, 8192, 4096, 4096, 8192, 256]
    - [26, 11.58]
  - - [4096, 512, 1, 128, 4096, 4096, 128, 512]
    - [73, 4.588]
  - - [4096, 512, 1, 256, 4096, 4096, 256, 512]
    - [72, 6.774]
  - - [4096, 512, 1, 512, 4096, 4096, 512, 512]
    - [87, 8.313]
  - - [4096, 512, 1, 1024, 4096, 4096, 1024, 512]
    - [34, 9.654]
  - - [4096, 512, 1, 2048, 4096, 4096, 2048, 512]
    - [34, 10.534]
  - - [4096, 512, 1, 4096, 4096, 4096, 4096, 512]
    - [10, 11.326]
  - - [4096, 512, 1, 8192, 4096, 4096, 8192, 512]
    - [58, 13.826]
  - - [4096, 1024, 1, 128, 4096, 4096, 128, 1024]
    - [18, 6.279]
  - - [4096, 1024, 1, 256, 4096, 4096, 256, 1024]
    - [69, 8.758]
  - - [4096, 1024, 1, 512, 4096, 4096, 512, 1024]
    - [22, 10.07]
  - - [4096, 1024, 1, 1024, 4096, 4096, 1024, 1024]
    - [22, 11.842]
  - - [4096, 1024, 1, 2048, 4096, 4096, 2048, 1024]
    - [31, 12.793]
  - - [4096, 1024, 1, 4096, 4096, 4096, 4096, 1024]
    - [63, 13.727]
  - - [4096, 1024, 1, 8192, 4096, 4096, 8192, 1024]
    - [10, 15.51]
  - - [4096, 2048, 1, 128, 4096, 4096, 128, 2048]
    - [20, 6.886]
  - - [4096, 2048, 1, 256, 4096, 4096, 256, 2048]
    - [15, 9.613]
  - - [4096, 2048, 1, 512, 4096, 4096, 512, 2048]
    - [17, 12.721]
  - - [4096, 2048, 1, 1024, 4096, 4096, 1024, 2048]
    - [17, 14.457]
  - - [4096, 2048, 1, 2048, 4096, 4096, 2048, 2048]
    - [29, 14.46]
  - - [4096, 2048, 1, 4096, 4096, 4096, 4096, 2048]
    - [9, 15.41]
  - - [4096, 2048, 1, 8192, 4096, 4096, 8192, 2048]
    - [1, 17.248]
  - - [4096, 4096, 1, 128, 4096, 4096, 128, 4096]
    - [54, 6.6]
  - - [4096, 4096, 1, 256, 4096, 4096, 256, 4096]
    - [52, 9.515]
  - - [4096, 4096, 1, 512, 4096, 4096, 512, 4096]
    - [2, 12.51]
  - - [4096, 4096, 1, 1024, 4096, 4096, 1024, 4096]
    - [2, 14.692]
  - - [4096, 4096, 1, 2048, 4096, 4096, 2048, 4096]
    - [59, 15.137]
  - - [4096, 4096, 1, 4096, 4096, 4096, 4096, 4096]
    - [53, 17.146]
  - - [4096, 4096, 1, 8192, 4096, 4096, 8192, 4096]
    - [55, 18.707]
  - - [4096, 8192, 1, 128, 4096, 4096, 128, 8192]
    - [66, 6.85]
  - - [4096, 8192, 1, 256, 4096, 4096, 256, 8192]
    - [62, 9.006]
  - - [4096, 8192, 1, 512, 4096, 4096, 512, 8192]
    - [63, 12.186]
  - - [4096, 8192, 1, 1024, 4096, 4096, 1024, 8192]
    - [63, 15.005]
  - - [4096, 8192, 1, 2048, 4096, 4096, 2048, 8192]
    - [62, 16.971]
  - - [4096, 8192, 1, 4096, 4096, 4096, 4096, 8192]
    - [55, 18.062]
  - - [4096, 8192, 1, 8192, 4096, 4096, 8192, 8192]
    - [55, 19.116]
  - - [8192, 128, 1, 128, 8192, 8192, 128, 128]
    - [23, 3.171]
  - - [8192, 128, 1, 256, 8192, 8192, 256, 128]
    - [91, 5.009]
  - - [8192, 128, 1, 512, 8192, 8192, 512, 128]
    - [94, 6.957]
  - - [8192, 128, 1, 1024, 8192, 8192, 1024, 128]
    - [42, 7.262]
  - - [8192, 128, 1, 2048, 8192, 8192, 2048, 128]
    - [92, 7.982]
  - - [8192, 128, 1, 4096, 8192, 8192, 4096, 128]
    - [33, 9.643]
  - - [8192, 128, 1, 8192, 8192, 8192, 8192, 128]
    - [32, 11.354]
  - - [8192, 256, 1, 128, 8192, 8192, 128, 256]
    - [73, 4.606]
  - - [8192, 256, 1, 256, 8192, 8192, 256, 256]
    - [74, 6.714]
  - - [8192, 256, 1, 512, 8192, 8192, 512, 256]
    - [87, 8.137]
  - - [8192, 256, 1, 1024, 8192, 8192, 1024, 256]
    - [35, 9.02]
  - - [8192, 256, 1, 2048, 8192, 8192, 2048, 256]
    - [89, 10.005]
  - - [8192, 256, 1, 4096, 8192, 8192, 4096, 256]
    - [11, 11.494]
  - - [8192, 256, 1, 8192, 8192, 8192, 8192, 256]
    - [61, 13.865]
  - - [8192, 512, 1, 128, 8192, 8192, 128, 512]
    - [68, 6.208]
  - - [8192, 512, 1, 256, 8192, 8192, 256, 512]
    - [68, 8.71]
  - - [8192, 512, 1, 512, 8192, 8192, 512, 512]
    - [29, 9.821]
  - - [8192, 512, 1, 1024, 8192, 8192, 1024, 512]
    - [22, 11.277]
  - - [8192, 512, 1, 2048, 8192, 8192, 2048, 512]
    - [87, 12.14]
  - - [8192, 512, 1, 4096, 8192, 8192, 4096, 512]
    - [10, 13.981]
  - - [8192, 512, 1, 8192, 8192, 8192, 8192, 512]
    - [10, 15.644]
  - - [8192, 1024, 1, 128, 8192, 8192, 128, 1024]
    - [69, 6.743]
  - - [8192, 1024, 1, 256, 8192, 8192, 256, 1024]
    - [8, 9.33]
  - - [8192, 1024, 1, 512, 8192, 8192, 512, 1024]
    - [17, 12.319]
  - - [8192, 1024, 1, 1024, 8192, 8192, 1024, 1024]
    - [17, 13.995]
  - - [8192, 1024, 1, 2048, 8192, 8192, 2048, 1024]
    - [25, 13.916]
  - - [8192, 1024, 1, 4096, 8192, 8192, 4096, 1024]
    - [10, 15.641]
  - - [8192, 1024, 1, 8192, 8192, 8192, 8192, 1024]
    - [1, 17.264]
  - - [8192, 2048, 1, 128, 8192, 8192, 128, 2048]
    - [56, 6.59]
  - - [8192, 2048, 1, 256, 8192, 8192, 256, 2048]
    - [6, 9.366]
  - - [8192, 2048, 1, 512, 8192, 8192, 512, 2048]
    - [0, 12.349]
  - - [8192, 2048, 1, 1024, 8192, 8192, 1024, 2048]
    - [4, 14.44]
  - - [8192, 2048, 1, 2048, 8192, 8192, 2048, 2048]
    - [58, 15.236]
  - - [8192, 2048, 1, 4096, 8192, 8192, 4096, 2048]
    - [53, 17.175]
  - - [8192, 2048, 1, 8192, 8192, 8192, 8192, 2048]
    - [5, 18.724]
  - - [8192, 4096, 1, 128, 8192, 8192, 128, 4096]
    - [67, 6.738]
  - - [8192, 4096, 1, 256, 8192, 8192, 256, 4096]
    - [62, 8.962]
  - - [8192, 4096, 1, 512, 8192, 8192, 512, 4096]
    - [62, 12.25]
  - - [8192, 4096, 1, 1024, 8192, 8192, 1024, 4096]
    - [63, 14.999]
  - - [8192, 4096, 1, 2048, 8192, 8192, 2048, 4096]
    - [62, 16.893]
  - - [8192, 4096, 1, 4096, 8192, 8192, 4096, 4096]
    - [55, 18.085]
  - - [8192, 4096, 1, 8192, 8192, 8192, 8192, 4096]
    - [3, 19.079]
  - - [8192, 8192, 1, 128, 8192, 8192, 128, 8192]
    - [27, 6.428]
  - - [8192, 8192, 1, 256, 8192, 8192, 256, 8192]
    - [69, 9.133]
  - - [8192, 8192, 1, 512, 8192, 8192, 512, 8192]
    - [63, 12.291]
  - - [8192, 8192, 1, 1024, 8192, 8192, 1024, 8192]
    - [62, 15.215]
  - - [8192, 8192, 1, 2048, 8192, 8192, 2048, 8192]
    - [57, 17.445]
  - - [8192, 8192, 1, 4096, 8192, 8192, 4096, 8192]
    - [57, 18.981]
  - - [8192, 8192, 1, 8192, 8192, 8192, 8192, 8192]
    - [1, 19.821]
  - - [1, 1, 1, 32, 1, 1, 32, 1]
    - [110, 0.0]
- null
- null
- DeviceEfficiency
- GridBased
