library/src/amd_detail/rocblaslt/src/Tensile/Logic/streamk/gfx942_80cu/aquavanjaram942_Cijk_Ailk_Bjlk_BSS_BH_UserArgs.yaml
- {MinimumRequiredVersion: 4.33.0}
- aquavanjaram942
- {Architecture: gfx942, CUCount: 80}
- [Device 0049, Device 0050]
    SolutionIndex: 0
    SolutionNameMin: Cijk_Ailk_Bjlk_BSS_BH_UserArgs_MT256x256x32_MI16x16x1_SN_LDSB0_CLR1_GSU0_GSUC0_GSUWGMRR0_K1_LBSPPA2048_LBSPPB2048_LPA0_LPB0_MIWT8_8_PLR1_SU32_SUM0_SUS256_SKXCCM0_VWA4_VWB8_WGM1_WGMXCC1_WGMXCCGn1
    SolutionIndex: 1
    SolutionNameMin: Cijk_Ailk_Bjlk_BSS_BH_UserArgs_MT256x256x32_MI16x16x1_SN_LDSB0_CLR1_GSU0_GSUC0_GSUWGMRR0_K1_LBSPPA2048_LBSPPB2048_LPA0_LPB0_MIWT8_8_PLR1_SU32_SUM0_SUS256_SKXCCM0_VWA4_VWB8_WGM2_WGMXCC1_WGMXCCGn1
    SolutionIndex: 2
    SolutionNameMin: Cijk_Ailk_Bjlk_BSS_BH_UserArgs_MT256x256x32_MI16x16x1_SN_LDSB0_CLR1_GSU0_GSUC0_GSUWGMRR0_K1_LBSPPA2048_LBSPPB2048_LPA0_LPB0_MIWT8_8_PLR1_SU32_SUM0_SUS256_SKXCCM0_VWA4_VWB8_WGM4_WGMXCC1_WGMXCCGn1
    SolutionIndex: 3
    SolutionNameMin: Cijk_Ailk_Bjlk_BSS_BH_UserArgs_MT128x256x32_MI16x16x1_SN_LDSB1_CLR1_GSU0_GSUC0_GSUWGMRR0_K1_LBSPPA1024_LBSPPB2048_LPA0_LPB32_MIWT4_8_PLR1_SU32_SUM0_SUS256_SKXCCM0_VWA4_VWB2_WGM1_WGMXCC1_WGMXCCGn1
    SolutionIndex: 4
    SolutionNameMin: Cijk_Ailk_Bjlk_BSS_BH_UserArgs_MT128x256x32_MI16x16x1_SN_LDSB1_CLR1_GSU0_GSUC0_GSUWGMRR0_K1_LBSPPA1024_LBSPPB2048_LPA0_LPB0_MIWT4_8_PLR1_SU32_SUM0_SUS256_SKXCCM0_VWA4_VWB8_WGM1_WGMXCC1_WGMXCCGn1
    SolutionIndex: 5
    SolutionNameMin: Cijk_Ailk_Bjlk_BSS_BH_UserArgs_MT128x256x32_MI16x16x1_SN_LDSB1_CLR1_GSU0_GSUC0_GSUWGMRR0_K1_LBSPPA1024_LBSPPB2048_LPA0_LPB32_MIWT4_8_PLR1_SU32_SUM0_SUS256_SKXCCM0_VWA4_VWB2_WGM2_WGMXCC1_WGMXCCGn1
    SolutionIndex: 6
    SolutionNameMin: Cijk_Ailk_Bjlk_BSS_BH_UserArgs_MT128x256x32_MI16x16x1_SN_LDSB1_CLR1_GSU0_GSUC0_GSUWGMRR0_K1_LBSPPA1024_LBSPPB2048_LPA0_LPB0_MIWT4_8_PLR1_SU32_SUM0_SUS256_SKXCCM0_VWA4_VWB4_WGM2_WGMXCC1_WGMXCCGn1
    SolutionIndex: 7
    SolutionNameMin: Cijk_Ailk_Bjlk_BSS_BH_UserArgs_MT128x256x32_MI16x16x1_SN_LDSB1_CLR1_GSU0_GSUC0_GSUWGMRR0_K1_LBSPPA1024_LBSPPB2048_LPA0_LPB32_MIWT4_8_PLR1_SU32_SUM0_SUS256_SKXCCM0_VWA4_VWB2_WGM4_WGMXCC1_WGMXCCGn1
    SolutionIndex: 8
    SolutionNameMin: Cijk_Ailk_Bjlk_BSS_BH_UserArgs_MT256x128x32_MI16x16x1_SN_LDSB1_CLR1_GSU0_GSUC0_GSUWGMRR0_K1_LBSPPA2048_LBSPPB1024_LPA0_LPB16_MIWT8_4_PLR1_SU32_SUM0_SUS256_SKXCCM0_VWA4_VWB1_WGM1_WGMXCC1_WGMXCCGn1
    SolutionIndex: 9
    SolutionNameMin: Cijk_Ailk_Bjlk_BSS_BH_UserArgs_MT256x128x32_MI16x16x1_SN_LDSB1_CLR1_GSU0_GSUC0_GSUWGMRR0_K1_LBSPPA2048_LBSPPB1024_LPA0_LPB32_MIWT8_4_PLR1_SU32_SUM0_SUS256_SKXCCM0_VWA4_VWB2_WGM1_WGMXCC1_WGMXCCGn1
    SolutionIndex: 10
    SolutionNameMin: Cijk_Ailk_Bjlk_BSS_BH_UserArgs_MT256x128x32_MI16x16x1_SN_LDSB1_CLR1_GSU0_GSUC0_GSUWGMRR0_K1_LBSPPA2048_LBSPPB1024_LPA0_LPB0_MIWT8_4_PLR1_SU32_SUM0_SUS256_SKXCCM0_VWA4_VWB4_WGM1_WGMXCC1_WGMXCCGn1
    SolutionIndex: 11
    SolutionNameMin: Cijk_Ailk_Bjlk_BSS_BH_UserArgs_MT256x128x32_MI16x16x1_SN_LDSB1_CLR1_GSU0_GSUC0_GSUWGMRR0_K1_LBSPPA2048_LBSPPB1024_LPA0_LPB16_MIWT8_4_PLR1_SU32_SUM0_SUS256_SKXCCM0_VWA4_VWB1_WGM4_WGMXCC1_WGMXCCGn1
    SolutionIndex: 12
    SolutionNameMin: Cijk_Ailk_Bjlk_BSS_BH_UserArgs_MT256x128x32_MI16x16x1_SN_LDSB1_CLR1_GSU0_GSUC0_GSUWGMRR0_K1_LBSPPA2048_LBSPPB1024_LPA0_LPB0_MIWT8_4_PLR1_SU32_SUM0_SUS256_SKXCCM0_VWA4_VWB4_WGM4_WGMXCC1_WGMXCCGn1
    SolutionIndex: 13
    SolutionNameMin: Cijk_Ailk_Bjlk_BSS_BH_UserArgs_MT256x64x32_MI16x16x1_SN_LDSB1_CLR1_GSU0_GSUC0_GSUWGMRR0_K1_LBSPPA2048_LBSPPB512_LPA0_LPB32_MIWT8_2_PLR1_SU32_SUM0_SUS256_SKXCCM0_VWA4_VWB2_WGM1_WGMXCC1_WGMXCCGn1
    SolutionIndex: 14
    SolutionNameMin: Cijk_Ailk_Bjlk_BSS_BH_UserArgs_MT128x128x32_MI16x16x1_SN_LDSB1_CLR1_GSU0_GSUC0_GSUWGMRR0_K1_LBSPPA1024_LBSPPB1024_LPA0_LPB32_MIWT4_4_PLR1_SU32_SUM0_SUS256_SKXCCM0_VWA4_VWB2_WGM1_WGMXCC1_WGMXCCGn1
    SolutionIndex: 15
    SolutionNameMin: Cijk_Ailk_Bjlk_BSS_BH_UserArgs_MT128x128x32_MI16x16x1_SN_LDSB1_CLR1_GSU0_GSUC0_GSUWGMRR0_K1_LBSPPA1024_LBSPPB1024_LPA0_LPB32_MIWT4_4_PLR1_SU32_SUM0_SUS256_SKXCCM0_VWA4_VWB2_WGM2_WGMXCC1_WGMXCCGn1
    SolutionIndex: 16
    SolutionNameMin: Cijk_Ailk_Bjlk_BSS_BH_UserArgs_MT128x128x32_MI16x16x1_SN_LDSB1_CLR1_GSU0_GSUC0_GSUWGMRR0_K1_LBSPPA1024_LBSPPB1024_LPA0_LPB32_MIWT4_4_PLR1_SU32_SUM0_SUS256_SKXCCM0_VWA4_VWB2_WGM4_WGMXCC1_WGMXCCGn1
    SolutionIndex: 17
    SolutionNameMin: Cijk_Ailk_Bjlk_BSS_BH_UserArgs_MT128x64x32_MI16x16x1_SN_LDSB0_CLR1_GSU0_GSUC0_GSUWGMRR0_K1_LBSPPA1024_LBSPPB512_LPA0_LPB32_MIWT4_2_PLR1_SU32_SUM0_SUS256_SKXCCM0_VWA4_VWB2_WGM4_WGMXCC1_WGMXCCGn1
    SolutionIndex: 18
    SolutionNameMin: Cijk_Ailk_Bjlk_BSS_BH_UserArgs_MT32x32x32_MI16x16x1_SN_LDSB0_CLR1_GSU0_GSUC0_GSUWGMRR0_K1_LBSPPA256_LBSPPB256_LPA16_LPB16_MIWT1_1_PLR1_SU32_SUM0_SUS256_SKXCCM0_VWA1_VWB1_WGM1_WGMXCC1_WGMXCCGn1
    SolutionIndex: 19
    SolutionNameMin: Cijk_Ailk_Bjlk_BSS_BH_UserArgs_MT256x256x64_MI16x16x1_SN_LDSB1_CLR1_GSU0_GSUC0_GSUWGMRR0_K1_LBSPPA2048_LBSPPB2048_LPA0_LPB0_MIWT8_8_PLR1_SU32_SUM0_SUS256_SKXCCM0_VWA4_VWB4_WGM1_WGMXCC1_WGMXCCGn1
    SolutionIndex: 20
    SolutionNameMin: Cijk_Ailk_Bjlk_BSS_BH_UserArgs_MT256x256x64_MI16x16x1_SN_LDSB1_CLR1_GSU0_GSUC0_GSUWGMRR0_K1_LBSPPA2048_LBSPPB2048_LPA0_LPB0_MIWT8_8_PLR2_SU32_SUM0_SUS256_SKXCCM0_VWA4_VWB4_WGM1_WGMXCC1_WGMXCCGn1
    SolutionIndex: 21
    SolutionNameMin: Cijk_Ailk_Bjlk_BSS_BH_UserArgs_MT256x256x64_MI16x16x1_SN_LDSB1_CLR1_GSU0_GSUC0_GSUWGMRR0_K1_LBSPPA2048_LBSPPB2048_LPA0_LPB0_MIWT8_8_PLR1_SU32_SUM0_SUS256_SKXCCM0_VWA4_VWB4_WGM2_WGMXCC1_WGMXCCGn1
    SolutionIndex: 22
    SolutionNameMin: Cijk_Ailk_Bjlk_BSS_BH_UserArgs_MT128x128x64_MI16x16x1_SN_LDSB1_CLR1_GSU0_GSUC0_GSUWGMRR0_K1_LBSPPA1024_LBSPPB1024_LPA0_LPB0_MIWT4_4_PLR1_SU32_SUM0_SUS256_SKXCCM0_VWA4_VWB4_WGM1_WGMXCC1_WGMXCCGn1
    SolutionIndex: 23
    SolutionNameMin: Cijk_Ailk_Bjlk_BSS_BH_UserArgs_MT128x128x64_MI16x16x1_SN_LDSB1_CLR1_GSU0_GSUC0_GSUWGMRR0_K1_LBSPPA1024_LBSPPB1024_LPA0_LPB0_MIWT4_4_PLR1_SU32_SUM0_SUS256_SKXCCM0_VWA4_VWB4_WGM2_WGMXCC1_WGMXCCGn1
    SolutionIndex: 24
    SolutionNameMin: Cijk_Ailk_Bjlk_BSS_BH_UserArgs_MT128x128x64_MI16x16x1_SN_LDSB1_CLR1_GSU0_GSUC0_GSUWGMRR0_K1_LBSPPA1024_LBSPPB1024_LPA0_LPB0_MIWT4_4_PLR1_SU32_SUM0_SUS256_SKXCCM0_VWA4_VWB4_WGM4_WGMXCC1_WGMXCCGn1
    SolutionIndex: 25
    SolutionNameMin: Cijk_Ailk_Bjlk_BSS_BH_UserArgs_MT128x64x64_MI16x16x1_SN_LDSB1_CLR1_GSU0_GSUC0_GSUWGMRR0_K1_LBSPPA1024_LBSPPB512_LPA0_LPB32_MIWT4_2_PLR2_SU32_SUM0_SUS256_SKXCCM0_VWA4_VWB2_WGM1_WGMXCC1_WGMXCCGn1
    SolutionIndex: 26
    SolutionNameMin: Cijk_Ailk_Bjlk_BSS_BH_UserArgs_MT128x64x64_MI16x16x1_SN_LDSB1_CLR1_GSU0_GSUC0_GSUWGMRR0_K1_LBSPPA1024_LBSPPB512_LPA0_LPB32_MIWT4_2_PLR1_SU32_SUM0_SUS256_SKXCCM0_VWA4_VWB2_WGM4_WGMXCC1_WGMXCCGn1
    SolutionIndex: 27
    SolutionNameMin: Cijk_Ailk_Bjlk_BSS_BH_UserArgs_MT64x64x64_MI16x16x1_SN_LDSB1_CLR1_GSU0_GSUC0_GSUWGMRR0_K1_LBSPPA512_LBSPPB512_LPA32_LPB32_MIWT2_2_PLR2_SU32_SUM0_SUS256_SKXCCM0_VWA2_VWB2_WGM1_WGMXCC1_WGMXCCGn1
    SolutionIndex: 28
    SolutionNameMin: Cijk_Ailk_Bjlk_BSS_BH_UserArgs_MT64x64x64_MI16x16x1_SN_LDSB1_CLR1_GSU0_GSUC0_GSUWGMRR0_K1_LBSPPA512_LBSPPB512_LPA32_LPB32_MIWT2_2_PLR1_SU32_SUM0_SUS256_SKXCCM0_VWA2_VWB2_WGM2_WGMXCC1_WGMXCCGn1
    SolutionIndex: 29
    SolutionNameMin: Cijk_Ailk_Bjlk_BSS_BH_UserArgs_MT64x64x64_MI16x16x1_SN_LDSB1_CLR1_GSU0_GSUC0_GSUWGMRR0_K1_LBSPPA512_LBSPPB512_LPA32_LPB32_MIWT2_2_PLR1_SU32_SUM0_SUS256_SKXCCM0_VWA2_VWB2_WGM4_WGMXCC1_WGMXCCGn1
    SolutionIndex: 30
    SolutionNameMin: Cijk_Ailk_Bjlk_BSS_BH_UserArgs_MT128x128x128_MI16x16x1_SN_LDSB1_CLR1_GSU0_GSUC0_GSUWGMRR0_K1_LBSPPA1024_LBSPPB1024_LPA0_LPB0_MIWT4_4_PLR1_SU32_SUM0_SUS256_SKXCCM0_VWA4_VWB4_WGM1_WGMXCC1_WGMXCCGn1
    SolutionIndex: 31
    SolutionNameMin: Cijk_Ailk_Bjlk_BSS_BH_UserArgs_MT128x128x128_MI16x16x1_SN_LDSB1_CLR1_GSU0_GSUC0_GSUWGMRR0_K1_LBSPPA1024_LBSPPB1024_LPA0_LPB0_MIWT4_4_PLR1_SU32_SUM0_SUS256_SKXCCM0_VWA4_VWB4_WGM2_WGMXCC1_WGMXCCGn1
    SolutionIndex: 32
    SolutionNameMin: Cijk_Ailk_Bjlk_BSS_BH_UserArgs_MT64x64x128_MI16x16x1_SN_LDSB1_CLR1_GSU0_GSUC0_GSUWGMRR0_K1_LBSPPA512_LBSPPB512_LPA32_LPB32_MIWT2_2_PLR2_SU32_SUM0_SUS256_SKXCCM0_VWA2_VWB2_WGM1_WGMXCC1_WGMXCCGn1
    SolutionIndex: 33
    SolutionNameMin: Cijk_Ailk_Bjlk_BSS_BH_UserArgs_MT32x64x128_MI16x16x1_SN_LDSB1_CLR1_GSU0_GSUC0_GSUWGMRR0_K1_LBSPPA256_LBSPPB512_LPA16_LPB32_MIWT1_2_PLR1_SU32_SUM0_SUS256_SKXCCM0_VWA1_VWB2_WGM1_WGMXCC1_WGMXCCGn1
    SolutionIndex: 34
    SolutionNameMin: Cijk_Ailk_Bjlk_BSS_BH_UserArgs_MT32x64x128_MI16x16x1_SN_LDSB1_CLR1_GSU0_GSUC0_GSUWGMRR0_K1_LBSPPA256_LBSPPB512_LPA16_LPB32_MIWT1_2_PLR2_SU32_SUM0_SUS256_SKXCCM0_VWA1_VWB2_WGM1_WGMXCC1_WGMXCCGn1
    SolutionIndex: 35
    SolutionNameMin: Cijk_Ailk_Bjlk_BSS_BH_UserArgs_MT64x32x128_MI16x16x1_SN_LDSB1_CLR1_GSU0_GSUC0_GSUWGMRR0_K1_LBSPPA512_LBSPPB256_LPA32_LPB16_MIWT2_1_PLR2_SU32_SUM0_SUS256_SKXCCM0_VWA2_VWB1_WGM1_WGMXCC1_WGMXCCGn1
    SolutionIndex: 36
    SolutionNameMin: Cijk_Ailk_Bjlk_BSS_BH_UserArgs_MT32x32x128_MI16x16x1_SN_LDSB1_CLR1_GSU0_GSUC0_GSUWGMRR0_K1_LBSPPA256_LBSPPB256_LPA16_LPB16_MIWT1_1_PLR1_SU32_SUM0_SUS256_SKXCCM0_VWA1_VWB1_WGM1_WGMXCC1_WGMXCCGn1
    SolutionIndex: 37
    SolutionNameMin: Cijk_Ailk_Bjlk_BSS_BH_UserArgs_MT32x32x128_MI16x16x1_SN_LDSB1_CLR1_GSU0_GSUC0_GSUWGMRR0_K1_LBSPPA256_LBSPPB256_LPA16_LPB16_MIWT1_1_PLR2_SU32_SUM0_SUS256_SKXCCM0_VWA1_VWB1_WGM1_WGMXCC1_WGMXCCGn1
    SolutionIndex: 38
    SolutionNameMin: Cijk_Ailk_Bjlk_BSS_BH_UserArgs_MT256x256x32_MI16x16x1_SN_LDSB0_CLR1_GSU0_GSUC0_GSUWGMRR0_K1_LBSPPA2048_LBSPPB2048_LPA0_LPB0_MIWT8_8_PLR1_SU32_SUM0_SUS256_SKXCCM4_VWA4_VWB8_WGM1_WGMXCC1_WGMXCCGn1
    SolutionIndex: 39
    SolutionNameMin: Cijk_Ailk_Bjlk_BSS_BH_UserArgs_MT256x256x32_MI16x16x1_SN_LDSB0_CLR1_GSU0_GSUC0_GSUWGMRR0_K1_LBSPPA2048_LBSPPB2048_LPA0_LPB0_MIWT8_8_PLR1_SU32_SUM0_SUS256_SKXCCM4_VWA4_VWB4_WGM2_WGMXCC1_WGMXCCGn1
    SolutionIndex: 40
    SolutionNameMin: Cijk_Ailk_Bjlk_BSS_BH_UserArgs_MT256x256x32_MI16x16x1_SN_LDSB0_CLR1_GSU0_GSUC0_GSUWGMRR0_K1_LBSPPA2048_LBSPPB2048_LPA0_LPB0_MIWT8_8_PLR1_SU32_SUM0_SUS256_SKXCCM4_VWA4_VWB8_WGM2_WGMXCC1_WGMXCCGn1
    SolutionIndex: 41
    SolutionNameMin: Cijk_Ailk_Bjlk_BSS_BH_UserArgs_MT256x256x32_MI16x16x1_SN_LDSB0_CLR1_GSU0_GSUC0_GSUWGMRR0_K1_LBSPPA2048_LBSPPB2048_LPA0_LPB0_MIWT8_8_PLR1_SU32_SUM0_SUS256_SKXCCM4_VWA4_VWB4_WGM4_WGMXCC1_WGMXCCGn1
    SolutionIndex: 42
    SolutionNameMin: Cijk_Ailk_Bjlk_BSS_BH_UserArgs_MT128x256x32_MI16x16x1_SN_LDSB1_CLR1_GSU0_GSUC0_GSUWGMRR0_K1_LBSPPA1024_LBSPPB2048_LPA0_LPB32_MIWT4_8_PLR1_SU32_SUM0_SUS256_SKXCCM4_VWA4_VWB2_WGM1_WGMXCC1_WGMXCCGn1
    SolutionIndex: 43
    SolutionNameMin: Cijk_Ailk_Bjlk_BSS_BH_UserArgs_MT128x256x32_MI16x16x1_SN_LDSB1_CLR1_GSU0_GSUC0_GSUWGMRR0_K1_LBSPPA1024_LBSPPB2048_LPA0_LPB0_MIWT4_8_PLR1_SU32_SUM0_SUS256_SKXCCM4_VWA4_VWB4_WGM1_WGMXCC1_WGMXCCGn1
    SolutionIndex: 44
    SolutionNameMin: Cijk_Ailk_Bjlk_BSS_BH_UserArgs_MT128x256x32_MI16x16x1_SN_LDSB1_CLR1_GSU0_GSUC0_GSUWGMRR0_K1_LBSPPA1024_LBSPPB2048_LPA0_LPB0_MIWT4_8_PLR1_SU32_SUM0_SUS256_SKXCCM4_VWA4_VWB8_WGM1_WGMXCC1_WGMXCCGn1
    SolutionIndex: 45
    SolutionNameMin: Cijk_Ailk_Bjlk_BSS_BH_UserArgs_MT128x256x32_MI16x16x1_SN_LDSB1_CLR1_GSU0_GSUC0_GSUWGMRR0_K1_LBSPPA1024_LBSPPB2048_LPA0_LPB32_MIWT4_8_PLR1_SU32_SUM0_SUS256_SKXCCM4_VWA4_VWB2_WGM2_WGMXCC1_WGMXCCGn1
    SolutionIndex: 46
    SolutionNameMin: Cijk_Ailk_Bjlk_BSS_BH_UserArgs_MT128x256x32_MI16x16x1_SN_LDSB1_CLR1_GSU0_GSUC0_GSUWGMRR0_K1_LBSPPA1024_LBSPPB2048_LPA0_LPB0_MIWT4_8_PLR1_SU32_SUM0_SUS256_SKXCCM4_VWA4_VWB4_WGM2_WGMXCC1_WGMXCCGn1
    SolutionIndex: 47
    SolutionNameMin: Cijk_Ailk_Bjlk_BSS_BH_UserArgs_MT128x256x32_MI16x16x1_SN_LDSB1_CLR1_GSU0_GSUC0_GSUWGMRR0_K1_LBSPPA1024_LBSPPB2048_LPA0_LPB32_MIWT4_8_PLR1_SU32_SUM0_SUS256_SKXCCM4_VWA4_VWB2_WGM4_WGMXCC1_WGMXCCGn1
    SolutionIndex: 48
    SolutionNameMin: Cijk_Ailk_Bjlk_BSS_BH_UserArgs_MT128x256x32_MI16x16x1_SN_LDSB1_CLR1_GSU0_GSUC0_GSUWGMRR0_K1_LBSPPA1024_LBSPPB2048_LPA0_LPB0_MIWT4_8_PLR1_SU32_SUM0_SUS256_SKXCCM4_VWA4_VWB8_WGM4_WGMXCC1_WGMXCCGn1
    SolutionIndex: 49
    SolutionNameMin: Cijk_Ailk_Bjlk_BSS_BH_UserArgs_MT256x128x32_MI16x16x1_SN_LDSB1_CLR1_GSU0_GSUC0_GSUWGMRR0_K1_LBSPPA2048_LBSPPB1024_LPA0_LPB0_MIWT8_4_PLR1_SU32_SUM0_SUS256_SKXCCM4_VWA4_VWB4_WGM1_WGMXCC1_WGMXCCGn1
    SolutionIndex: 50
    SolutionNameMin: Cijk_Ailk_Bjlk_BSS_BH_UserArgs_MT256x128x32_MI16x16x1_SN_LDSB1_CLR1_GSU0_GSUC0_GSUWGMRR0_K1_LBSPPA2048_LBSPPB1024_LPA0_LPB16_MIWT8_4_PLR1_SU32_SUM0_SUS256_SKXCCM4_VWA4_VWB1_WGM4_WGMXCC1_WGMXCCGn1
    SolutionIndex: 51
    SolutionNameMin: Cijk_Ailk_Bjlk_BSS_BH_UserArgs_MT128x128x32_MI16x16x1_SN_LDSB1_CLR1_GSU0_GSUC0_GSUWGMRR0_K1_LBSPPA1024_LBSPPB1024_LPA0_LPB32_MIWT4_4_PLR1_SU32_SUM0_SUS256_SKXCCM4_VWA4_VWB2_WGM1_WGMXCC1_WGMXCCGn1
    SolutionIndex: 52
    SolutionNameMin: Cijk_Ailk_Bjlk_BSS_BH_UserArgs_MT128x128x32_MI16x16x1_SN_LDSB0_CLR1_GSU0_GSUC0_GSUWGMRR0_K1_LBSPPA1024_LBSPPB1024_LPA0_LPB0_MIWT4_4_PLR1_SU32_SUM0_SUS256_SKXCCM4_VWA4_VWB4_WGM1_WGMXCC1_WGMXCCGn1
    SolutionIndex: 53
    SolutionNameMin: Cijk_Ailk_Bjlk_BSS_BH_UserArgs_MT128x128x32_MI16x16x1_SN_LDSB0_CLR0_GSU0_GSUC0_GSUWGMRR0_K1_LBSPPA1024_LBSPPB1024_LPA0_LPB0_MIWT4_4_PLR0_SU32_SUM0_SUS256_SKXCCM4_VWA4_VWB4_WGM1_WGMXCC1_WGMXCCGn1
    SolutionIndex: 54
    SolutionNameMin: Cijk_Ailk_Bjlk_BSS_BH_UserArgs_MT128x128x32_MI16x16x1_SN_LDSB1_CLR1_GSU0_GSUC0_GSUWGMRR0_K1_LBSPPA1024_LBSPPB1024_LPA0_LPB16_MIWT4_4_PLR1_SU32_SUM0_SUS256_SKXCCM4_VWA4_VWB1_WGM4_WGMXCC1_WGMXCCGn1
    SolutionIndex: 55
    SolutionNameMin: Cijk_Ailk_Bjlk_BSS_BH_UserArgs_MT128x64x32_MI16x16x1_SN_LDSB0_CLR1_GSU0_GSUC0_GSUWGMRR0_K1_LBSPPA1024_LBSPPB512_LPA0_LPB16_MIWT4_2_PLR1_SU32_SUM0_SUS256_SKXCCM4_VWA4_VWB1_WGM1_WGMXCC1_WGMXCCGn1
    SolutionIndex: 56
    SolutionNameMin: Cijk_Ailk_Bjlk_BSS_BH_UserArgs_MT128x64x32_MI16x16x1_SN_LDSB0_CLR1_GSU0_GSUC0_GSUWGMRR0_K1_LBSPPA1024_LBSPPB512_LPA0_LPB32_MIWT4_2_PLR1_SU32_SUM0_SUS256_SKXCCM4_VWA4_VWB2_WGM1_WGMXCC1_WGMXCCGn1
    SolutionIndex: 57
    SolutionNameMin: Cijk_Ailk_Bjlk_BSS_BH_UserArgs_MT128x64x32_MI16x16x1_SN_LDSB0_CLR0_GSU0_GSUC0_GSUWGMRR0_K1_LBSPPA1024_LBSPPB512_LPA0_LPB32_MIWT4_2_PLR0_SU32_SUM0_SUS256_SKXCCM4_VWA4_VWB2_WGM1_WGMXCC1_WGMXCCGn1
    SolutionIndex: 58
    SolutionNameMin: Cijk_Ailk_Bjlk_BSS_BH_UserArgs_MT128x64x32_MI16x16x1_SN_LDSB0_CLR1_GSU0_GSUC0_GSUWGMRR0_K1_LBSPPA1024_LBSPPB512_LPA0_LPB32_MIWT4_2_PLR1_SU32_SUM0_SUS256_SKXCCM4_VWA4_VWB2_WGM2_WGMXCC1_WGMXCCGn1
    SolutionIndex: 59
    SolutionNameMin: Cijk_Ailk_Bjlk_BSS_BH_UserArgs_MT128x64x32_MI16x16x1_SN_LDSB0_CLR0_GSU0_GSUC0_GSUWGMRR0_K1_LBSPPA1024_LBSPPB512_LPA0_LPB32_MIWT4_2_PLR0_SU32_SUM0_SUS256_SKXCCM4_VWA4_VWB2_WGM2_WGMXCC1_WGMXCCGn1
    SolutionIndex: 60
    SolutionNameMin: Cijk_Ailk_Bjlk_BSS_BH_UserArgs_MT64x64x32_MI16x16x1_SN_LDSB0_CLR1_GSU0_GSUC0_GSUWGMRR0_K1_LBSPPA512_LBSPPB512_LPA32_LPB32_MIWT2_2_PLR1_SU32_SUM0_SUS256_SKXCCM4_VWA2_VWB2_WGM1_WGMXCC1_WGMXCCGn1
    SolutionIndex: 61
    SolutionNameMin: Cijk_Ailk_Bjlk_BSS_BH_UserArgs_MT32x64x32_MI16x16x1_SN_LDSB0_CLR1_GSU0_GSUC0_GSUWGMRR0_K1_LBSPPA256_LBSPPB512_LPA16_LPB32_MIWT1_2_PLR1_SU32_SUM0_SUS256_SKXCCM4_VWA1_VWB2_WGM1_WGMXCC1_WGMXCCGn1
    SolutionIndex: 62
    SolutionNameMin: Cijk_Ailk_Bjlk_BSS_BH_UserArgs_MT32x64x32_MI16x16x1_SN_LDSB0_CLR0_GSU0_GSUC0_GSUWGMRR0_K1_LBSPPA256_LBSPPB512_LPA16_LPB32_MIWT1_2_PLR0_SU32_SUM0_SUS256_SKXCCM4_VWA1_VWB2_WGM1_WGMXCC1_WGMXCCGn1
    SolutionIndex: 63
    SolutionNameMin: Cijk_Ailk_Bjlk_BSS_BH_UserArgs_MT32x64x32_MI16x16x1_SN_LDSB0_CLR0_GSU0_GSUC0_GSUWGMRR0_K1_LBSPPA256_LBSPPB512_LPA16_LPB32_MIWT1_2_PLR0_SU32_SUM0_SUS256_SKXCCM4_VWA1_VWB2_WGM4_WGMXCC1_WGMXCCGn1
    SolutionIndex: 64
    SolutionNameMin: Cijk_Ailk_Bjlk_BSS_BH_UserArgs_MT32x32x32_MI16x16x1_SN_LDSB0_CLR1_GSU0_GSUC0_GSUWGMRR0_K1_LBSPPA256_LBSPPB256_LPA16_LPB16_MIWT1_1_PLR1_SU32_SUM0_SUS256_SKXCCM4_VWA1_VWB1_WGM1_WGMXCC1_WGMXCCGn1
    SolutionIndex: 65
    SolutionNameMin: Cijk_Ailk_Bjlk_BSS_BH_UserArgs_MT256x256x64_MI16x16x1_SN_LDSB1_CLR1_GSU0_GSUC0_GSUWGMRR0_K1_LBSPPA2048_LBSPPB2048_LPA0_LPB0_MIWT8_8_PLR1_SU32_SUM0_SUS256_SKXCCM4_VWA4_VWB4_WGM1_WGMXCC1_WGMXCCGn1
    SolutionIndex: 66
    SolutionNameMin: Cijk_Ailk_Bjlk_BSS_BH_UserArgs_MT256x256x64_MI16x16x1_SN_LDSB1_CLR1_GSU0_GSUC0_GSUWGMRR0_K1_LBSPPA2048_LBSPPB2048_LPA0_LPB0_MIWT8_8_PLR1_SU32_SUM0_SUS256_SKXCCM4_VWA4_VWB4_WGM2_WGMXCC1_WGMXCCGn1
    SolutionIndex: 67
    SolutionNameMin: Cijk_Ailk_Bjlk_BSS_BH_UserArgs_MT128x128x64_MI16x16x1_SN_LDSB1_CLR1_GSU0_GSUC0_GSUWGMRR0_K1_LBSPPA1024_LBSPPB1024_LPA0_LPB0_MIWT4_4_PLR1_SU32_SUM0_SUS256_SKXCCM4_VWA4_VWB4_WGM1_WGMXCC1_WGMXCCGn1
    SolutionIndex: 68
    SolutionNameMin: Cijk_Ailk_Bjlk_BSS_BH_UserArgs_MT128x128x64_MI16x16x1_SN_LDSB1_CLR1_GSU0_GSUC0_GSUWGMRR0_K1_LBSPPA1024_LBSPPB1024_LPA0_LPB0_MIWT4_4_PLR1_SU32_SUM0_SUS256_SKXCCM4_VWA4_VWB4_WGM2_WGMXCC1_WGMXCCGn1
    SolutionIndex: 69
    SolutionNameMin: Cijk_Ailk_Bjlk_BSS_BH_UserArgs_MT128x128x64_MI16x16x1_SN_LDSB1_CLR1_GSU0_GSUC0_GSUWGMRR0_K1_LBSPPA1024_LBSPPB1024_LPA0_LPB0_MIWT4_4_PLR1_SU32_SUM0_SUS256_SKXCCM4_VWA4_VWB4_WGM4_WGMXCC1_WGMXCCGn1
    SolutionIndex: 70
    SolutionNameMin: Cijk_Ailk_Bjlk_BSS_BH_UserArgs_MT128x64x64_MI16x16x1_SN_LDSB1_CLR1_GSU0_GSUC0_GSUWGMRR0_K1_LBSPPA1024_LBSPPB512_LPA0_LPB16_MIWT4_2_PLR1_SU32_SUM0_SUS256_SKXCCM4_VWA4_VWB1_WGM1_WGMXCC1_WGMXCCGn1
    SolutionIndex: 71
    SolutionNameMin: Cijk_Ailk_Bjlk_BSS_BH_UserArgs_MT128x64x64_MI16x16x1_SN_LDSB1_CLR1_GSU0_GSUC0_GSUWGMRR0_K1_LBSPPA1024_LBSPPB512_LPA0_LPB32_MIWT4_2_PLR1_SU32_SUM0_SUS256_SKXCCM4_VWA4_VWB2_WGM1_WGMXCC1_WGMXCCGn1
    SolutionIndex: 72
    SolutionNameMin: Cijk_Ailk_Bjlk_BSS_BH_UserArgs_MT128x64x64_MI16x16x1_SN_LDSB1_CLR1_GSU0_GSUC0_GSUWGMRR0_K1_LBSPPA1024_LBSPPB512_LPA0_LPB32_MIWT4_2_PLR2_SU32_SUM0_SUS256_SKXCCM4_VWA4_VWB2_WGM1_WGMXCC1_WGMXCCGn1
    SolutionIndex: 73
    SolutionNameMin: Cijk_Ailk_Bjlk_BSS_BH_UserArgs_MT128x64x64_MI16x16x1_SN_LDSB1_CLR1_GSU0_GSUC0_GSUWGMRR0_K1_LBSPPA1024_LBSPPB512_LPA0_LPB32_MIWT4_2_PLR2_SU32_SUM0_SUS256_SKXCCM4_VWA4_VWB2_WGM2_WGMXCC1_WGMXCCGn1
    SolutionIndex: 74
    SolutionNameMin: Cijk_Ailk_Bjlk_BSS_BH_UserArgs_MT128x64x64_MI16x16x1_SN_LDSB1_CLR1_GSU0_GSUC0_GSUWGMRR0_K1_LBSPPA1024_LBSPPB512_LPA0_LPB32_MIWT4_2_PLR2_SU32_SUM0_SUS256_SKXCCM4_VWA4_VWB2_WGM4_WGMXCC1_WGMXCCGn1
    SolutionIndex: 75
    SolutionNameMin: Cijk_Ailk_Bjlk_BSS_BH_UserArgs_MT64x64x64_MI16x16x1_SN_LDSB1_CLR1_GSU0_GSUC0_GSUWGMRR0_K1_LBSPPA512_LBSPPB512_LPA32_LPB32_MIWT2_2_PLR1_SU32_SUM0_SUS256_SKXCCM4_VWA2_VWB2_WGM1_WGMXCC1_WGMXCCGn1
    SolutionIndex: 76
    SolutionNameMin: Cijk_Ailk_Bjlk_BSS_BH_UserArgs_MT64x64x64_MI16x16x1_SN_LDSB1_CLR1_GSU0_GSUC0_GSUWGMRR0_K1_LBSPPA512_LBSPPB512_LPA32_LPB32_MIWT2_2_PLR2_SU32_SUM0_SUS256_SKXCCM4_VWA2_VWB2_WGM1_WGMXCC1_WGMXCCGn1
    SolutionIndex: 77
    SolutionNameMin: Cijk_Ailk_Bjlk_BSS_BH_UserArgs_MT64x64x64_MI16x16x1_SN_LDSB1_CLR1_GSU0_GSUC0_GSUWGMRR0_K1_LBSPPA512_LBSPPB512_LPA32_LPB32_MIWT2_2_PLR2_SU32_SUM0_SUS256_SKXCCM4_VWA2_VWB2_WGM2_WGMXCC1_WGMXCCGn1
    SolutionIndex: 78
    SolutionNameMin: Cijk_Ailk_Bjlk_BSS_BH_UserArgs_MT64x64x64_MI16x16x1_SN_LDSB1_CLR1_GSU0_GSUC0_GSUWGMRR0_K1_LBSPPA512_LBSPPB512_LPA32_LPB32_MIWT2_2_PLR1_SU32_SUM0_SUS256_SKXCCM4_VWA2_VWB2_WGM4_WGMXCC1_WGMXCCGn1
    SolutionIndex: 79
    SolutionNameMin: Cijk_Ailk_Bjlk_BSS_BH_UserArgs_MT32x64x64_MI16x16x1_SN_LDSB0_CLR1_GSU0_GSUC0_GSUWGMRR0_K1_LBSPPA256_LBSPPB512_LPA16_LPB32_MIWT1_2_PLR2_SU32_SUM0_SUS256_SKXCCM4_VWA1_VWB2_WGM1_WGMXCC1_WGMXCCGn1
    SolutionIndex: 80
    SolutionNameMin: Cijk_Ailk_Bjlk_BSS_BH_UserArgs_MT64x32x64_MI16x16x1_SN_LDSB0_CLR1_GSU0_GSUC0_GSUWGMRR0_K1_LBSPPA512_LBSPPB256_LPA32_LPB16_MIWT2_1_PLR1_SU32_SUM0_SUS256_SKXCCM4_VWA2_VWB1_WGM1_WGMXCC1_WGMXCCGn1
    SolutionIndex: 81
    SolutionNameMin: Cijk_Ailk_Bjlk_BSS_BH_UserArgs_MT64x32x64_MI16x16x1_SN_LDSB0_CLR1_GSU0_GSUC0_GSUWGMRR0_K1_LBSPPA512_LBSPPB256_LPA32_LPB16_MIWT2_1_PLR2_SU32_SUM0_SUS256_SKXCCM4_VWA2_VWB1_WGM1_WGMXCC1_WGMXCCGn1
    SolutionIndex: 82
    SolutionNameMin: Cijk_Ailk_Bjlk_BSS_BH_UserArgs_MT32x32x64_MI16x16x1_SN_LDSB0_CLR1_GSU0_GSUC0_GSUWGMRR0_K1_LBSPPA256_LBSPPB256_LPA16_LPB16_MIWT1_1_PLR1_SU32_SUM0_SUS256_SKXCCM4_VWA1_VWB1_WGM1_WGMXCC1_WGMXCCGn1
    SolutionIndex: 83
    SolutionNameMin: Cijk_Ailk_Bjlk_BSS_BH_UserArgs_MT128x128x128_MI16x16x1_SN_LDSB1_CLR1_GSU0_GSUC0_GSUWGMRR0_K1_LBSPPA1024_LBSPPB1024_LPA0_LPB0_MIWT4_4_PLR1_SU32_SUM0_SUS256_SKXCCM4_VWA4_VWB4_WGM1_WGMXCC1_WGMXCCGn1
    SolutionIndex: 84
    SolutionNameMin: Cijk_Ailk_Bjlk_BSS_BH_UserArgs_MT64x64x128_MI16x16x1_SN_LDSB1_CLR1_GSU0_GSUC0_GSUWGMRR0_K1_LBSPPA512_LBSPPB512_LPA32_LPB32_MIWT2_2_PLR2_SU32_SUM0_SUS256_SKXCCM4_VWA2_VWB2_WGM1_WGMXCC1_WGMXCCGn1
    SolutionIndex: 85
    SolutionNameMin: Cijk_Ailk_Bjlk_BSS_BH_UserArgs_MT32x64x128_MI16x16x1_SN_LDSB1_CLR1_GSU0_GSUC0_GSUWGMRR0_K1_LBSPPA256_LBSPPB512_LPA16_LPB32_MIWT1_2_PLR1_SU32_SUM0_SUS256_SKXCCM4_VWA1_VWB2_WGM1_WGMXCC1_WGMXCCGn1
    SolutionIndex: 86
    SolutionNameMin: Cijk_Ailk_Bjlk_BSS_BH_UserArgs_MT32x64x128_MI16x16x1_SN_LDSB1_CLR1_GSU0_GSUC0_GSUWGMRR0_K1_LBSPPA256_LBSPPB512_LPA16_LPB32_MIWT1_2_PLR2_SU32_SUM0_SUS256_SKXCCM4_VWA1_VWB2_WGM1_WGMXCC1_WGMXCCGn1
    SolutionIndex: 87
    SolutionNameMin: Cijk_Ailk_Bjlk_BSS_BH_UserArgs_MT64x32x128_MI16x16x1_SN_LDSB1_CLR1_GSU0_GSUC0_GSUWGMRR0_K1_LBSPPA512_LBSPPB256_LPA32_LPB16_MIWT2_1_PLR1_SU32_SUM0_SUS256_SKXCCM4_VWA2_VWB1_WGM1_WGMXCC1_WGMXCCGn1
    SolutionIndex: 88
    SolutionNameMin: Cijk_Ailk_Bjlk_BSS_BH_UserArgs_MT32x32x128_MI16x16x1_SN_LDSB1_CLR1_GSU0_GSUC0_GSUWGMRR0_K1_LBSPPA256_LBSPPB256_LPA16_LPB16_MIWT1_1_PLR1_SU32_SUM0_SUS256_SKXCCM4_VWA1_VWB1_WGM1_WGMXCC1_WGMXCCGn1
    SolutionIndex: 89
    SolutionNameMin: Cijk_Ailk_Bjlk_BSS_BH_UserArgs_MT32x32x128_MI16x16x1_SN_LDSB1_CLR1_GSU0_GSUC0_GSUWGMRR0_K1_LBSPPA256_LBSPPB256_LPA16_LPB16_MIWT1_1_PLR2_SU32_SUM0_SUS256_SKXCCM4_VWA1_VWB1_WGM1_WGMXCC1_WGMXCCGn1
    SolutionIndex: 90
    SolutionNameMin: Cijk_Ailk_Bjlk_BSS_BH_UserArgs_MT32x32x32_MI16x16x1_SN_LDSB0_CLR1_GSU0_GSUC0_GSUWGMRR0_K1_LBSPPA256_LBSPPB256_LPA16_LPB16_MIWT1_1_PLR1_SU32_SUM0_SUS256_SKXCCM0_VWA1_VWB1_WGM1_WGMXCC1_WGMXCCGn1
- - - [128, 128, 1, 128, 128, 128, 128, 128]
    - [89, 0.081]
  - - [128, 128, 1, 256, 128, 128, 128, 128]
    - [36, 0.102]
  - - [128, 128, 1, 512, 128, 128, 128, 128]
    - [88, 0.173]
  - - [128, 128, 1, 1024, 128, 128, 128, 128]
    - [37, 0.274]
  - - [128, 128, 1, 2048, 128, 128, 128, 128]
    - [82, 0.486]
  - - [128, 128, 1, 4096, 128, 128, 128, 128]
    - [89, 0.827]
  - - [128, 128, 1, 8192, 128, 128, 128, 128]
    - [64, 1.323]
  - - [128, 256, 1, 128, 128, 128, 128, 256]
    - [36, 0.16]
  - - [128, 256, 1, 256, 128, 128, 128, 256]
    - [36, 0.198]
  - - [128, 256, 1, 512, 128, 128, 128, 256]
    - [88, 0.345]
  - - [128, 256, 1, 1024, 128, 128, 128, 256]
    - [89, 0.554]
  - - [128, 256, 1, 2048, 128, 128, 128, 256]
    - [64, 0.998]
  - - [128, 256, 1, 4096, 128, 128, 128, 256]
    - [86, 1.517]
  - - [128, 256, 1, 8192, 128, 128, 128, 256]
    - [86, 2.283]
  - - [128, 512, 1, 128, 128, 128, 128, 512]
    - [36, 0.313]
  - - [128, 512, 1, 256, 128, 128, 128, 512]
    - [89, 0.403]
  - - [128, 512, 1, 512, 128, 128, 128, 512]
    - [64, 0.631]
  - - [128, 512, 1, 1024, 128, 128, 128, 512]
    - [88, 1.104]
  - - [128, 512, 1, 2048, 128, 128, 128, 512]
    - [63, 1.67]
  - - [128, 512, 1, 4096, 128, 128, 128, 512]
    - [79, 2.569]
  - - [128, 512, 1, 8192, 128, 128, 128, 512]
    - [84, 3.836]
  - - [128, 1024, 1, 128, 128, 128, 128, 1024]
    - [34, 0.589]
  - - [128, 1024, 1, 256, 128, 128, 128, 1024]
    - [18, 0.929]
  - - [128, 1024, 1, 512, 128, 128, 128, 1024]
    - [88, 1.392]
  - - [128, 1024, 1, 1024, 128, 128, 128, 1024]
    - [85, 1.973]
  - - [128, 1024, 1, 2048, 128, 128, 128, 1024]
    - [34, 2.847]
  - - [128, 1024, 1, 4096, 128, 128, 128, 1024]
    - [76, 4.239]
  - - [128, 1024, 1, 8192, 128, 128, 128, 1024]
    - [25, 6.069]
  - - [128, 2048, 1, 128, 128, 128, 128, 2048]
    - [79, 1.029]
  - - [128, 2048, 1, 256, 128, 128, 128, 2048]
    - [81, 1.697]
  - - [128, 2048, 1, 512, 128, 128, 128, 2048]
    - [81, 2.558]
  - - [128, 2048, 1, 1024, 128, 128, 128, 2048]
    - [75, 3.395]
  - - [128, 2048, 1, 2048, 128, 128, 128, 2048]
    - [57, 4.483]
  - - [128, 2048, 1, 4096, 128, 128, 128, 2048]
    - [67, 6.56]
  - - [128, 2048, 1, 8192, 128, 128, 128, 2048]
    - [22, 9.562]
  - - [128, 4096, 1, 128, 128, 128, 128, 4096]
    - [75, 1.771]
  - - [128, 4096, 1, 256, 128, 128, 128, 4096]
    - [75, 2.907]
  - - [128, 4096, 1, 512, 128, 128, 128, 4096]
    - [75, 4.202]
  - - [128, 4096, 1, 1024, 128, 128, 128, 4096]
    - [71, 5.13]
  - - [128, 4096, 1, 2048, 128, 128, 128, 4096]
    - [53, 6.428]
  - - [128, 4096, 1, 4096, 128, 128, 128, 4096]
    - [67, 9.548]
  - - [128, 4096, 1, 8192, 128, 128, 128, 4096]
    - [23, 12.182]
  - - [128, 8192, 1, 128, 128, 128, 128, 8192]
    - [55, 2.779]
  - - [128, 8192, 1, 256, 128, 128, 128, 8192]
    - [56, 4.38]
  - - [128, 8192, 1, 512, 128, 128, 128, 8192]
    - [71, 5.976]
  - - [128, 8192, 1, 1024, 128, 128, 128, 8192]
    - [67, 7.573]
  - - [128, 8192, 1, 2048, 128, 128, 128, 8192]
    - [30, 8.018]
  - - [128, 8192, 1, 4096, 128, 128, 128, 8192]
    - [3, 10.946]
  - - [128, 8192, 1, 8192, 128, 128, 128, 8192]
    - [69, 12.976]
  - - [256, 128, 1, 128, 256, 256, 256, 128]
    - [36, 0.16]
  - - [256, 128, 1, 256, 256, 256, 256, 128]
    - [37, 0.199]
  - - [256, 128, 1, 512, 256, 256, 256, 128]
    - [36, 0.339]
  - - [256, 128, 1, 1024, 256, 256, 256, 128]
    - [88, 0.554]
  - - [256, 128, 1, 2048, 256, 256, 256, 128]
    - [64, 0.989]
  - - [256, 128, 1, 4096, 256, 256, 256, 128]
    - [86, 1.52]
  - - [256, 128, 1, 8192, 256, 256, 256, 128]
    - [35, 2.274]
  - - [256, 256, 1, 128, 256, 256, 256, 256]
    - [36, 0.311]
  - - [256, 256, 1, 256, 256, 256, 256, 256]
    - [88, 0.402]
  - - [256, 256, 1, 512, 256, 256, 256, 256]
    - [64, 0.632]
  - - [256, 256, 1, 1024, 256, 256, 256, 256]
    - [88, 1.106]
  - - [256, 256, 1, 2048, 256, 256, 256, 256]
    - [62, 1.706]
  - - [256, 256, 1, 4096, 256, 256, 256, 256]
    - [80, 2.619]
  - - [256, 256, 1, 8192, 256, 256, 256, 256]
    - [27, 3.701]
  - - [256, 512, 1, 128, 256, 256, 256, 512]
    - [33, 0.583]
  - - [256, 512, 1, 256, 256, 256, 256, 512]
    - [18, 0.937]
  - - [256, 512, 1, 512, 256, 256, 256, 512]
    - [37, 1.394]
  - - [256, 512, 1, 1024, 256, 256, 256, 512]
    - [85, 1.97]
  - - [256, 512, 1, 2048, 256, 256, 256, 512]
    - [87, 2.881]
  - - [256, 512, 1, 4096, 256, 256, 256, 512]
    - [75, 4.314]
  - - [256, 512, 1, 8192, 256, 256, 256, 512]
    - [72, 6.086]
  - - [256, 1024, 1, 128, 256, 256, 256, 1024]
    - [32, 1.034]
  - - [256, 1024, 1, 256, 256, 256, 256, 1024]
    - [81, 1.697]
  - - [256, 1024, 1, 512, 256, 256, 256, 1024]
    - [81, 2.548]
  - - [256, 1024, 1, 1024, 256, 256, 256, 1024]
    - [75, 3.415]
  - - [256, 1024, 1, 2048, 256, 256, 256, 1024]
    - [57, 4.572]
  - - [256, 1024, 1, 4096, 256, 256, 256, 1024]
    - [22, 6.527]
  - - [256, 1024, 1, 8192, 256, 256, 256, 1024]
    - [22, 9.574]
  - - [256, 2048, 1, 128, 256, 256, 256, 2048]
    - [75, 1.77]
  - - [256, 2048, 1, 256, 256, 256, 256, 2048]
    - [75, 2.899]
  - - [256, 2048, 1, 512, 256, 256, 256, 2048]
    - [75, 4.219]
  - - [256, 2048, 1, 1024, 256, 256, 256, 2048]
    - [71, 5.091]
  - - [256, 2048, 1, 2048, 256, 256, 256, 2048]
    - [52, 6.369]
  - - [256, 2048, 1, 4096, 256, 256, 256, 2048]
    - [67, 9.496]
  - - [256, 2048, 1, 8192, 256, 256, 256, 2048]
    - [23, 11.982]
  - - [256, 4096, 1, 128, 256, 256, 256, 4096]
    - [56, 2.788]
  - - [256, 4096, 1, 256, 256, 256, 256, 4096]
    - [56, 4.385]
  - - [256, 4096, 1, 512, 256, 256, 256, 4096]
    - [72, 6.064]
  - - [256, 4096, 1, 1024, 256, 256, 256, 4096]
    - [67, 7.684]
  - - [256, 4096, 1, 2048, 256, 256, 256, 4096]
    - [30, 8.156]
  - - [256, 4096, 1, 4096, 256, 256, 256, 4096]
    - [7, 10.952]
  - - [256, 4096, 1, 8192, 256, 256, 256, 4096]
    - [66, 13.297]
  - - [256, 8192, 1, 128, 256, 256, 256, 8192]
    - [16, 3.921]
  - - [256, 8192, 1, 256, 256, 256, 256, 8192]
    - [67, 6.273]
  - - [256, 8192, 1, 512, 256, 256, 256, 8192]
    - [67, 8.649]
  - - [256, 8192, 1, 1024, 256, 256, 256, 8192]
    - [83, 9.246]
  - - [256, 8192, 1, 2048, 256, 256, 256, 8192]
    - [67, 11.296]
  - - [256, 8192, 1, 4096, 256, 256, 256, 8192]
    - [69, 13.037]
  - - [256, 8192, 1, 8192, 256, 256, 256, 8192]
    - [10, 14.199]
  - - [512, 128, 1, 128, 512, 512, 512, 128]
    - [37, 0.313]
  - - [512, 128, 1, 256, 512, 512, 512, 128]
    - [89, 0.403]
  - - [512, 128, 1, 512, 512, 512, 512, 128]
    - [87, 0.638]
  - - [512, 128, 1, 1024, 512, 512, 512, 128]
    - [88, 1.105]
  - - [512, 128, 1, 2048, 512, 512, 512, 128]
    - [61, 1.656]
  - - [512, 128, 1, 4096, 512, 512, 512, 128]
    - [27, 2.554]
  - - [512, 128, 1, 8192, 512, 512, 512, 128]
    - [32, 3.64]
  - - [512, 256, 1, 128, 512, 512, 512, 256]
    - [34, 0.586]
  - - [512, 256, 1, 256, 512, 512, 512, 256]
    - [18, 0.934]
  - - [512, 256, 1, 512, 512, 512, 512, 256]
    - [36, 1.398]
  - - [512, 256, 1, 1024, 512, 512, 512, 256]
    - [87, 1.967]
  - - [512, 256, 1, 2048, 512, 512, 512, 256]
    - [87, 2.872]
  - - [512, 256, 1, 4096, 512, 512, 512, 256]
    - [78, 4.277]
  - - [512, 256, 1, 8192, 512, 512, 512, 256]
    - [25, 6.101]
  - - [512, 512, 1, 128, 512, 512, 512, 512]
    - [32, 1.034]
  - - [512, 512, 1, 256, 512, 512, 512, 512]
    - [79, 1.701]
  - - [512, 512, 1, 512, 512, 512, 512, 512]
    - [81, 2.548]
  - - [512, 512, 1, 1024, 512, 512, 512, 512]
    - [75, 3.4]
  - - [512, 512, 1, 2048, 512, 512, 512, 512]
    - [57, 4.536]
  - - [512, 512, 1, 4096, 512, 512, 512, 512]
    - [67, 6.578]
  - - [512, 512, 1, 8192, 512, 512, 512, 512]
    - [67, 9.576]
  - - [512, 1024, 1, 128, 512, 512, 512, 1024]
    - [75, 1.77]
  - - [512, 1024, 1, 256, 512, 512, 512, 1024]
    - [75, 2.903]
  - - [512, 1024, 1, 512, 512, 512, 512, 1024]
    - [75, 4.199]
  - - [512, 1024, 1, 1024, 512, 512, 512, 1024]
    - [71, 5.142]
  - - [512, 1024, 1, 2048, 512, 512, 512, 1024]
    - [52, 6.384]
  - - [512, 1024, 1, 4096, 512, 512, 512, 1024]
    - [67, 9.544]
  - - [512, 1024, 1, 8192, 512, 512, 512, 1024]
    - [22, 11.921]
  - - [512, 2048, 1, 128, 512, 512, 512, 2048]
    - [56, 2.793]
  - - [512, 2048, 1, 256, 512, 512, 512, 2048]
    - [56, 4.328]
  - - [512, 2048, 1, 512, 512, 512, 512, 2048]
    - [72, 6.089]
  - - [512, 2048, 1, 1024, 512, 512, 512, 2048]
    - [67, 7.598]
  - - [512, 2048, 1, 2048, 512, 512, 512, 2048]
    - [83, 8.128]
  - - [512, 2048, 1, 4096, 512, 512, 512, 2048]
    - [3, 10.938]
  - - [512, 2048, 1, 8192, 512, 512, 512, 2048]
    - [19, 13.199]
  - - [512, 4096, 1, 128, 512, 512, 512, 4096]
    - [15, 3.921]
  - - [512, 4096, 1, 256, 512, 512, 512, 4096]
    - [67, 6.312]
  - - [512, 4096, 1, 512, 512, 512, 512, 4096]
    - [67, 8.722]
  - - [512, 4096, 1, 1024, 512, 512, 512, 4096]
    - [30, 9.315]
  - - [512, 4096, 1, 2048, 512, 512, 512, 4096]
    - [67, 11.337]
  - - [512, 4096, 1, 4096, 512, 512, 512, 4096]
    - [23, 13.031]
  - - [512, 4096, 1, 8192, 512, 512, 512, 4096]
    - [3, 14.311]
  - - [512, 8192, 1, 128, 512, 512, 512, 8192]
    - [4, 5.176]
  - - [512, 8192, 1, 256, 512, 512, 512, 8192]
    - [46, 7.633]
  - - [512, 8192, 1, 512, 512, 512, 512, 8192]
    - [51, 9.442]
  - - [512, 8192, 1, 1024, 512, 512, 512, 8192]
    - [68, 12.041]
  - - [512, 8192, 1, 2048, 512, 512, 512, 8192]
    - [67, 13.652]
  - - [512, 8192, 1, 4096, 512, 512, 512, 8192]
    - [5, 14.133]
  - - [512, 8192, 1, 8192, 512, 512, 512, 8192]
    - [7, 15.998]
  - - [1024, 128, 1, 128, 1024, 1024, 1024, 128]
    - [34, 0.586]
  - - [1024, 128, 1, 256, 1024, 1024, 1024, 128]
    - [18, 0.936]
  - - [1024, 128, 1, 512, 1024, 1024, 1024, 128]
    - [36, 1.407]
  - - [1024, 128, 1, 1024, 1024, 1024, 1024, 128]
    - [87, 1.971]
  - - [1024, 128, 1, 2048, 1024, 1024, 1024, 128]
    - [35, 2.839]
  - - [1024, 128, 1, 4096, 1024, 1024, 1024, 128]
    - [77, 4.202]
  - - [1024, 128, 1, 8192, 1024, 1024, 1024, 128]
    - [25, 6.07]
  - - [1024, 256, 1, 128, 1024, 1024, 1024, 256]
    - [32, 1.039]
  - - [1024, 256, 1, 256, 1024, 1024, 1024, 256]
    - [81, 1.692]
  - - [1024, 256, 1, 512, 1024, 1024, 1024, 256]
    - [81, 2.562]
  - - [1024, 256, 1, 1024, 1024, 1024, 1024, 256]
    - [87, 3.355]
  - - [1024, 256, 1, 2048, 1024, 1024, 1024, 256]
    - [57, 4.549]
  - - [1024, 256, 1, 4096, 1024, 1024, 1024, 256]
    - [67, 6.584]
  - - [1024, 256, 1, 8192, 1024, 1024, 1024, 256]
    - [67, 9.532]
  - - [1024, 512, 1, 128, 1024, 1024, 1024, 512]
    - [75, 1.775]
  - - [1024, 512, 1, 256, 1024, 1024, 1024, 512]
    - [75, 2.889]
  - - [1024, 512, 1, 512, 1024, 1024, 1024, 512]
    - [75, 4.196]
  - - [1024, 512, 1, 1024, 1024, 1024, 1024, 512]
    - [71, 5.122]
  - - [1024, 512, 1, 2048, 1024, 1024, 1024, 512]
    - [53, 6.445]
  - - [1024, 512, 1, 4096, 1024, 1024, 1024, 512]
    - [69, 9.512]
  - - [1024, 512, 1, 8192, 1024, 1024, 1024, 512]
    - [22, 11.957]
  - - [1024, 1024, 1, 128, 1024, 1024, 1024, 1024]
    - [56, 2.775]
  - - [1024, 1024, 1, 256, 1024, 1024, 1024, 1024]
    - [58, 4.366]
  - - [1024, 1024, 1, 512, 1024, 1024, 1024, 1024]
    - [73, 6.059]
  - - [1024, 1024, 1, 1024, 1024, 1024, 1024, 1024]
    - [67, 7.659]
  - - [1024, 1024, 1, 2048, 1024, 1024, 1024, 1024]
    - [30, 8.113]
  - - [1024, 1024, 1, 4096, 1024, 1024, 1024, 1024]
    - [7, 10.915]
  - - [1024, 1024, 1, 8192, 1024, 1024, 1024, 1024]
    - [20, 13.083]
  - - [1024, 2048, 1, 128, 1024, 1024, 1024, 2048]
    - [14, 3.97]
  - - [1024, 2048, 1, 256, 1024, 1024, 1024, 2048]
    - [22, 6.281]
  - - [1024, 2048, 1, 512, 1024, 1024, 1024, 2048]
    - [67, 8.695]
  - - [1024, 2048, 1, 1024, 1024, 1024, 1024, 2048]
    - [30, 9.287]
  - - [1024, 2048, 1, 2048, 1024, 1024, 1024, 2048]
    - [67, 11.198]
  - - [1024, 2048, 1, 4096, 1024, 1024, 1024, 2048]
    - [68, 12.733]
  - - [1024, 2048, 1, 8192, 1024, 1024, 1024, 2048]
    - [43, 14.023]
  - - [1024, 4096, 1, 128, 1024, 1024, 1024, 4096]
    - [44, 5.147]
  - - [1024, 4096, 1, 256, 1024, 1024, 1024, 4096]
    - [44, 7.566]
  - - [1024, 4096, 1, 512, 1024, 1024, 1024, 4096]
    - [14, 9.569]
  - - [1024, 4096, 1, 1024, 1024, 1024, 1024, 4096]
    - [22, 12.056]
  - - [1024, 4096, 1, 2048, 1024, 1024, 1024, 4096]
    - [67, 13.551]
  - - [1024, 4096, 1, 4096, 1024, 1024, 1024, 4096]
    - [7, 14.215]
  - - [1024, 4096, 1, 8192, 1024, 1024, 1024, 4096]
    - [7, 16.024]
  - - [1024, 8192, 1, 128, 1024, 1024, 1024, 8192]
    - [48, 5.403]
  - - [1024, 8192, 1, 256, 1024, 1024, 1024, 8192]
    - [4, 8.215]
  - - [1024, 8192, 1, 512, 1024, 1024, 1024, 8192]
    - [43, 11.281]
  - - [1024, 8192, 1, 1024, 1024, 1024, 1024, 8192]
    - [7, 13.529]
  - - [1024, 8192, 1, 2048, 1024, 1024, 1024, 8192]
    - [42, 14.17]
  - - [1024, 8192, 1, 4096, 1024, 1024, 1024, 8192]
    - [42, 15.981]
  - - [1024, 8192, 1, 8192, 1024, 1024, 1024, 8192]
    - [7, 17.434]
  - - [2048, 128, 1, 128, 2048, 2048, 2048, 128]
    - [81, 1.02]
  - - [2048, 128, 1, 256, 2048, 2048, 2048, 128]
    - [81, 1.694]
  - - [2048, 128, 1, 512, 2048, 2048, 2048, 128]
    - [79, 2.551]
  - - [2048, 128, 1, 1024, 2048, 2048, 2048, 128]
    - [75, 3.377]
  - - [2048, 128, 1, 2048, 2048, 2048, 2048, 128]
    - [59, 4.541]
  - - [2048, 128, 1, 4096, 2048, 2048, 2048, 128]
    - [67, 6.593]
  - - [2048, 128, 1, 8192, 2048, 2048, 2048, 128]
    - [22, 9.571]
  - - [2048, 256, 1, 128, 2048, 2048, 2048, 256]
    - [60, 1.745]
  - - [2048, 256, 1, 256, 2048, 2048, 2048, 256]
    - [75, 2.908]
  - - [2048, 256, 1, 512, 2048, 2048, 2048, 256]
    - [75, 4.212]
  - - [2048, 256, 1, 1024, 2048, 2048, 2048, 256]
    - [71, 5.104]
  - - [2048, 256, 1, 2048, 2048, 2048, 2048, 256]
    - [53, 6.446]
  - - [2048, 256, 1, 4096, 2048, 2048, 2048, 256]
    - [68, 9.459]
  - - [2048, 256, 1, 8192, 2048, 2048, 2048, 256]
    - [22, 11.938]
  - - [2048, 512, 1, 128, 2048, 2048, 2048, 512]
    - [56, 2.768]
  - - [2048, 512, 1, 256, 2048, 2048, 2048, 512]
    - [26, 4.345]
  - - [2048, 512, 1, 512, 2048, 2048, 2048, 512]
    - [71, 6.011]
  - - [2048, 512, 1, 1024, 2048, 2048, 2048, 512]
    - [68, 7.565]
  - - [2048, 512, 1, 2048, 2048, 2048, 2048, 512]
    - [31, 8.023]
  - - [2048, 512, 1, 4096, 2048, 2048, 2048, 512]
    - [5, 10.978]
  - - [2048, 512, 1, 8192, 2048, 2048, 2048, 512]
    - [19, 13.234]
  - - [2048, 1024, 1, 128, 2048, 2048, 2048, 1024]
    - [13, 3.954]
  - - [2048, 1024, 1, 256, 2048, 2048, 2048, 1024]
    - [67, 6.307]
  - - [2048, 1024, 1, 512, 2048, 2048, 2048, 1024]
    - [24, 8.498]
  - - [2048, 1024, 1, 1024, 2048, 2048, 2048, 1024]
    - [30, 9.302]
  - - [2048, 1024, 1, 2048, 2048, 2048, 2048, 1024]
    - [69, 11.195]
  - - [2048, 1024, 1, 4096, 2048, 2048, 2048, 1024]
    - [69, 12.854]
  - - [2048, 1024, 1, 8192, 2048, 2048, 2048, 1024]
    - [7, 13.989]
  - - [2048, 2048, 1, 128, 2048, 2048, 2048, 2048]
    - [10, 5.163]
  - - [2048, 2048, 1, 256, 2048, 2048, 2048, 2048]
    - [7, 7.625]
  - - [2048, 2048, 1, 512, 2048, 2048, 2048, 2048]
    - [14, 9.606]
  - - [2048, 2048, 1, 1024, 2048, 2048, 2048, 2048]
    - [67, 11.958]
  - - [2048, 2048, 1, 2048, 2048, 2048, 2048, 2048]
    - [69, 13.401]
  - - [2048, 2048, 1, 4096, 2048, 2048, 2048, 2048]
    - [42, 14.212]
  - - [2048, 2048, 1, 8192, 2048, 2048, 2048, 2048]
    - [5, 16.065]
  - - [2048, 4096, 1, 128, 2048, 2048, 2048, 4096]
    - [49, 5.464]
  - - [2048, 4096, 1, 256, 2048, 2048, 2048, 4096]
    - [43, 8.365]
  - - [2048, 4096, 1, 512, 2048, 2048, 2048, 4096]
    - [49, 11.456]
  - - [2048, 4096, 1, 1024, 2048, 2048, 2048, 4096]
    - [3, 13.622]
  - - [2048, 4096, 1, 2048, 2048, 2048, 2048, 4096]
    - [42, 14.274]
  - - [2048, 4096, 1, 4096, 2048, 2048, 2048, 4096]
    - [45, 15.954]
  - - [2048, 4096, 1, 8192, 2048, 2048, 2048, 4096]
    - [3, 17.397]
  - - [2048, 8192, 1, 128, 2048, 2048, 2048, 8192]
    - [51, 5.552]
  - - [2048, 8192, 1, 256, 2048, 2048, 2048, 8192]
    - [1, 8.142]
  - - [2048, 8192, 1, 512, 2048, 2048, 2048, 8192]
    - [41, 11.23]
  - - [2048, 8192, 1, 1024, 2048, 2048, 2048, 8192]
    - [0, 13.62]
  - - [2048, 8192, 1, 2048, 2048, 2048, 2048, 8192]
    - [45, 15.7]
  - - [2048, 8192, 1, 4096, 2048, 2048, 2048, 8192]
    - [45, 17.15]
  - - [2048, 8192, 1, 8192, 2048, 2048, 2048, 8192]
    - [65, 18.688]
  - - [4096, 128, 1, 128, 4096, 4096, 4096, 128]
    - [28, 1.723]
  - - [4096, 128, 1, 256, 4096, 4096, 4096, 128]
    - [29, 2.833]
  - - [4096, 128, 1, 512, 4096, 4096, 4096, 128]
    - [75, 4.111]
  - - [4096, 128, 1, 1024, 4096, 4096, 4096, 128]
    - [71, 5.07]
  - - [4096, 128, 1, 2048, 4096, 4096, 4096, 128]
    - [53, 6.407]
  - - [4096, 128, 1, 4096, 4096, 4096, 4096, 128]
    - [67, 9.501]
  - - [4096, 128, 1, 8192, 4096, 4096, 4096, 128]
    - [22, 12.091]
  - - [4096, 256, 1, 128, 4096, 4096, 4096, 256]
    - [17, 2.787]
  - - [4096, 256, 1, 256, 4096, 4096, 4096, 256]
    - [58, 4.344]
  - - [4096, 256, 1, 512, 4096, 4096, 4096, 256]
    - [74, 6.052]
  - - [4096, 256, 1, 1024, 4096, 4096, 4096, 256]
    - [67, 7.625]
  - - [4096, 256, 1, 2048, 4096, 4096, 4096, 256]
    - [67, 8.065]
  - - [4096, 256, 1, 4096, 4096, 4096, 4096, 256]
    - [7, 11.042]
  - - [4096, 256, 1, 8192, 4096, 4096, 4096, 256]
    - [21, 13.281]
  - - [4096, 512, 1, 128, 4096, 4096, 4096, 512]
    - [13, 3.936]
  - - [4096, 512, 1, 256, 4096, 4096, 4096, 512]
    - [69, 6.121]
  - - [4096, 512, 1, 512, 4096, 4096, 4096, 512]
    - [69, 8.512]
  - - [4096, 512, 1, 1024, 4096, 4096, 4096, 512]
    - [30, 9.08]
  - - [4096, 512, 1, 2048, 4096, 4096, 4096, 512]
    - [69, 11.247]
  - - [4096, 512, 1, 4096, 4096, 4096, 4096, 512]
    - [22, 13.001]
  - - [4096, 512, 1, 8192, 4096, 4096, 4096, 512]
    - [5, 14.213]
  - - [4096, 1024, 1, 128, 4096, 4096, 4096, 1024]
    - [9, 5.298]
  - - [4096, 1024, 1, 256, 4096, 4096, 4096, 1024]
    - [8, 7.528]
  - - [4096, 1024, 1, 512, 4096, 4096, 4096, 1024]
    - [14, 9.436]
  - - [4096, 1024, 1, 1024, 4096, 4096, 4096, 1024]
    - [69, 11.833]
  - - [4096, 1024, 1, 2048, 4096, 4096, 4096, 1024]
    - [69, 13.297]
  - - [4096, 1024, 1, 4096, 4096, 4096, 4096, 1024]
    - [50, 14.23]
  - - [4096, 1024, 1, 8192, 4096, 4096, 4096, 1024]
    - [5, 16.096]
  - - [4096, 2048, 1, 128, 4096, 4096, 4096, 2048]
    - [9, 5.425]
  - - [4096, 2048, 1, 256, 4096, 4096, 4096, 2048]
    - [3, 8.189]
  - - [4096, 2048, 1, 512, 4096, 4096, 4096, 2048]
    - [12, 11.152]
  - - [4096, 2048, 1, 1024, 4096, 4096, 4096, 2048]
    - [3, 13.371]
  - - [4096, 2048, 1, 2048, 4096, 4096, 4096, 2048]
    - [42, 14.257]
  - - [4096, 2048, 1, 4096, 4096, 4096, 4096, 2048]
    - [42, 16.01]
  - - [4096, 2048, 1, 8192, 4096, 4096, 4096, 2048]
    - [5, 17.497]
  - - [4096, 4096, 1, 128, 4096, 4096, 4096, 4096]
    - [54, 5.423]
  - - [4096, 4096, 1, 256, 4096, 4096, 4096, 4096]
    - [40, 7.704]
  - - [4096, 4096, 1, 512, 4096, 4096, 4096, 4096]
    - [39, 10.914]
  - - [4096, 4096, 1, 1024, 4096, 4096, 4096, 4096]
    - [42, 13.495]
  - - [4096, 4096, 1, 2048, 4096, 4096, 4096, 4096]
    - [42, 15.692]
  - - [4096, 4096, 1, 4096, 4096, 4096, 4096, 4096]
    - [42, 17.174]
  - - [4096, 4096, 1, 8192, 4096, 4096, 4096, 4096]
    - [65, 18.694]
  - - [4096, 8192, 1, 128, 4096, 4096, 4096, 8192]
    - [22, 5.342]
  - - [4096, 8192, 1, 256, 4096, 4096, 4096, 8192]
    - [14, 7.269]
  - - [4096, 8192, 1, 512, 4096, 4096, 4096, 8192]
    - [42, 10.316]
  - - [4096, 8192, 1, 1024, 4096, 4096, 4096, 8192]
    - [47, 13.621]
  - - [4096, 8192, 1, 2048, 4096, 4096, 4096, 8192]
    - [3, 16.222]
  - - [4096, 8192, 1, 4096, 4096, 4096, 4096, 8192]
    - [65, 18.22]
  - - [4096, 8192, 1, 8192, 4096, 4096, 4096, 8192]
    - [65, 19.419]
  - - [8192, 128, 1, 128, 8192, 8192, 8192, 128]
    - [58, 2.757]
  - - [8192, 128, 1, 256, 8192, 8192, 8192, 128]
    - [70, 4.341]
  - - [8192, 128, 1, 512, 8192, 8192, 8192, 128]
    - [73, 5.93]
  - - [8192, 128, 1, 1024, 8192, 8192, 8192, 128]
    - [67, 7.481]
  - - [8192, 128, 1, 2048, 8192, 8192, 8192, 128]
    - [67, 8.031]
  - - [8192, 128, 1, 4096, 8192, 8192, 8192, 128]
    - [11, 10.785]
  - - [8192, 128, 1, 8192, 8192, 8192, 8192, 128]
    - [23, 13.089]
  - - [8192, 256, 1, 128, 8192, 8192, 8192, 256]
    - [15, 3.881]
  - - [8192, 256, 1, 256, 8192, 8192, 8192, 256]
    - [22, 6.204]
  - - [8192, 256, 1, 512, 8192, 8192, 8192, 256]
    - [67, 8.48]
  - - [8192, 256, 1, 1024, 8192, 8192, 8192, 256]
    - [83, 9.202]
  - - [8192, 256, 1, 2048, 8192, 8192, 8192, 256]
    - [69, 11.254]
  - - [8192, 256, 1, 4096, 8192, 8192, 8192, 256]
    - [22, 12.924]
  - - [8192, 256, 1, 8192, 8192, 8192, 8192, 256]
    - [42, 14.18]
  - - [8192, 512, 1, 128, 8192, 8192, 8192, 512]
    - [6, 5.075]
  - - [8192, 512, 1, 256, 8192, 8192, 8192, 512]
    - [5, 7.571]
  - - [8192, 512, 1, 512, 8192, 8192, 8192, 512]
    - [14, 9.387]
  - - [8192, 512, 1, 1024, 8192, 8192, 8192, 512]
    - [67, 11.844]
  - - [8192, 512, 1, 2048, 8192, 8192, 8192, 512]
    - [24, 13.268]
  - - [8192, 512, 1, 4096, 8192, 8192, 8192, 512]
    - [3, 14.445]
  - - [8192, 512, 1, 8192, 8192, 8192, 8192, 512]
    - [5, 16.186]
  - - [8192, 1024, 1, 128, 8192, 8192, 8192, 1024]
    - [6, 5.354]
  - - [8192, 1024, 1, 256, 8192, 8192, 8192, 1024]
    - [43, 8.249]
  - - [8192, 1024, 1, 512, 8192, 8192, 8192, 1024]
    - [43, 11.181]
  - - [8192, 1024, 1, 1024, 8192, 8192, 8192, 1024]
    - [3, 13.582]
  - - [8192, 1024, 1, 2048, 8192, 8192, 8192, 1024]
    - [42, 14.297]
  - - [8192, 1024, 1, 4096, 8192, 8192, 8192, 1024]
    - [3, 16.248]
  - - [8192, 1024, 1, 8192, 8192, 8192, 8192, 1024]
    - [3, 17.744]
  - - [8192, 2048, 1, 128, 8192, 8192, 8192, 2048]
    - [51, 5.336]
  - - [8192, 2048, 1, 256, 8192, 8192, 8192, 2048]
    - [38, 7.817]
  - - [8192, 2048, 1, 512, 8192, 8192, 8192, 2048]
    - [2, 10.871]
  - - [8192, 2048, 1, 1024, 8192, 8192, 8192, 2048]
    - [42, 13.578]
  - - [8192, 2048, 1, 2048, 8192, 8192, 8192, 2048]
    - [42, 15.789]
  - - [8192, 2048, 1, 4096, 8192, 8192, 8192, 2048]
    - [5, 17.432]
  - - [8192, 2048, 1, 8192, 8192, 8192, 8192, 2048]
    - [65, 18.7]
  - - [8192, 4096, 1, 128, 8192, 8192, 8192, 4096]
    - [67, 5.276]
  - - [8192, 4096, 1, 256, 8192, 8192, 8192, 4096]
    - [14, 7.188]
  - - [8192, 4096, 1, 512, 8192, 8192, 8192, 4096]
    - [42, 10.368]
  - - [8192, 4096, 1, 1024, 8192, 8192, 8192, 4096]
    - [42, 13.594]
  - - [8192, 4096, 1, 2048, 8192, 8192, 8192, 4096]
    - [42, 16.26]
  - - [8192, 4096, 1, 4096, 8192, 8192, 8192, 4096]
    - [65, 18.179]
  - - [8192, 4096, 1, 8192, 8192, 8192, 8192, 4096]
    - [19, 19.39]
  - - [8192, 8192, 1, 128, 8192, 8192, 8192, 8192]
    - [3, 4.745]
  - - [8192, 8192, 1, 256, 8192, 8192, 8192, 8192]
    - [42, 7.71]
  - - [8192, 8192, 1, 512, 8192, 8192, 8192, 8192]
    - [45, 11.278]
  - - [8192, 8192, 1, 1024, 8192, 8192, 8192, 8192]
    - [45, 14.586]
  - - [8192, 8192, 1, 2048, 8192, 8192, 8192, 8192]
    - [45, 16.873]
  - - [8192, 8192, 1, 4096, 8192, 8192, 8192, 8192]
    - [65, 18.703]
  - - [8192, 8192, 1, 8192, 8192, 8192, 8192, 8192]
    - [19, 19.732]
  - - [1, 1, 1, 32, 1, 1, 1, 1]
    - [90, 0.0]
- null
- null
- DeviceEfficiency
- GridBased
