library/src/amd_detail/rocblaslt/src/Tensile/Logic/streamk/gfx942_80cu/aquavanjaram942_Cijk_Ailk_Bljk_BBS_BH_UserArgs.yaml
- {MinimumRequiredVersion: 4.33.0}
- aquavanjaram942
- {Architecture: gfx942, CUCount: 80}
- [Device 0049, Device 0050]
    SolutionIndex: 0
    SolutionNameMin: Cijk_Ailk_Bljk_BBS_BH_UserArgs_MT256x256x32_MI16x16x1_SN_LDSB1_CLR1_GSU0_GSUC0_GSUWGMRR0_K1_LBSPPA2048_LBSPPB128_LPA0_MIWT8_8_PLR1_SU32_SUM0_SUS256_SKXCCM0_VWA8_VWB1_WGM1_WGMXCC1_WGMXCCGn1
    SolutionIndex: 1
    SolutionNameMin: Cijk_Ailk_Bljk_BBS_BH_UserArgs_MT256x256x32_MI16x16x1_SN_LDSB1_CLR1_GSU0_GSUC0_GSUWGMRR0_K1_LBSPPA2048_LBSPPB512_LPA0_MIWT8_8_PLR1_SU32_SUM0_SUS256_SKXCCM0_VWA8_VWB8_WGM1_WGMXCC1_WGMXCCGn1
    SolutionIndex: 2
    SolutionNameMin: Cijk_Ailk_Bljk_BBS_BH_UserArgs_MT256x256x32_MI16x16x1_SN_LDSB1_CLR1_GSU0_GSUC0_GSUWGMRR0_K1_LBSPPA2048_LBSPPB256_LPA0_MIWT8_8_PLR1_SU32_SUM0_SUS256_SKXCCM0_VWA8_VWB4_WGM2_WGMXCC1_WGMXCCGn1
    SolutionIndex: 3
    SolutionNameMin: Cijk_Ailk_Bljk_BBS_BH_UserArgs_MT256x256x32_MI16x16x1_SN_LDSB1_CLR1_GSU0_GSUC0_GSUWGMRR0_K1_LBSPPA2048_LBSPPB512_LPA0_MIWT8_8_PLR1_SU32_SUM0_SUS256_SKXCCM0_VWA4_VWB8_WGM2_WGMXCC1_WGMXCCGn1
    SolutionIndex: 4
    SolutionNameMin: Cijk_Ailk_Bljk_BBS_BH_UserArgs_MT256x128x32_MI16x16x1_SN_LDSB1_CLR1_GSU0_GSUC0_GSUWGMRR0_K1_LBSPPA2048_LBSPPB128_LPA0_MIWT8_4_PLR1_SU32_SUM0_SUS256_SKXCCM0_VWA4_VWB1_WGM1_WGMXCC1_WGMXCCGn1
    SolutionIndex: 5
    SolutionNameMin: Cijk_Ailk_Bljk_BBS_BH_UserArgs_MT256x128x32_MI16x16x1_SN_LDSB1_CLR1_GSU0_GSUC0_GSUWGMRR0_K1_LBSPPA2048_LBSPPB128_LPA0_MIWT8_4_PLR1_SU32_SUM0_SUS256_SKXCCM0_VWA8_VWB1_WGM1_WGMXCC1_WGMXCCGn1
    SolutionIndex: 6
    SolutionNameMin: Cijk_Ailk_Bljk_BBS_BH_UserArgs_MT256x128x32_MI16x16x1_SN_LDSB1_CLR1_GSU0_GSUC0_GSUWGMRR0_K1_LBSPPA2048_LBSPPB128_LPA0_MIWT8_4_PLR1_SU32_SUM0_SUS256_SKXCCM0_VWA4_VWB2_WGM1_WGMXCC1_WGMXCCGn1
    SolutionIndex: 7
    SolutionNameMin: Cijk_Ailk_Bljk_BBS_BH_UserArgs_MT256x128x32_MI16x16x1_SN_LDSB1_CLR1_GSU0_GSUC0_GSUWGMRR0_K1_LBSPPA2048_LBSPPB128_LPA0_MIWT8_4_PLR1_SU32_SUM0_SUS256_SKXCCM0_VWA8_VWB2_WGM1_WGMXCC1_WGMXCCGn1
    SolutionIndex: 8
    SolutionNameMin: Cijk_Ailk_Bljk_BBS_BH_UserArgs_MT256x128x32_MI16x16x1_SN_LDSB1_CLR1_GSU0_GSUC0_GSUWGMRR0_K1_LBSPPA2048_LBSPPB256_LPA0_MIWT8_4_PLR1_SU32_SUM0_SUS256_SKXCCM0_VWA4_VWB4_WGM1_WGMXCC1_WGMXCCGn1
    SolutionIndex: 9
    SolutionNameMin: Cijk_Ailk_Bljk_BBS_BH_UserArgs_MT256x128x32_MI16x16x1_SN_LDSB1_CLR1_GSU0_GSUC0_GSUWGMRR0_K1_LBSPPA2048_LBSPPB256_LPA0_MIWT8_4_PLR1_SU32_SUM0_SUS256_SKXCCM0_VWA8_VWB4_WGM1_WGMXCC1_WGMXCCGn1
    SolutionIndex: 10
    SolutionNameMin: Cijk_Ailk_Bljk_BBS_BH_UserArgs_MT256x128x32_MI16x16x1_SN_LDSB1_CLR1_GSU0_GSUC0_GSUWGMRR0_K1_LBSPPA2048_LBSPPB128_LPA0_MIWT8_4_PLR1_SU32_SUM0_SUS256_SKXCCM0_VWA4_VWB1_WGM2_WGMXCC1_WGMXCCGn1
    SolutionIndex: 11
    SolutionNameMin: Cijk_Ailk_Bljk_BBS_BH_UserArgs_MT256x128x32_MI16x16x1_SN_LDSB1_CLR1_GSU0_GSUC0_GSUWGMRR0_K1_LBSPPA2048_LBSPPB128_LPA0_MIWT8_4_PLR1_SU32_SUM0_SUS256_SKXCCM0_VWA8_VWB1_WGM2_WGMXCC1_WGMXCCGn1
    SolutionIndex: 12
    SolutionNameMin: Cijk_Ailk_Bljk_BBS_BH_UserArgs_MT256x128x32_MI16x16x1_SN_LDSB1_CLR1_GSU0_GSUC0_GSUWGMRR0_K1_LBSPPA2048_LBSPPB128_LPA0_MIWT8_4_PLR1_SU32_SUM0_SUS256_SKXCCM0_VWA4_VWB2_WGM2_WGMXCC1_WGMXCCGn1
    SolutionIndex: 13
    SolutionNameMin: Cijk_Ailk_Bljk_BBS_BH_UserArgs_MT256x128x32_MI16x16x1_SN_LDSB1_CLR1_GSU0_GSUC0_GSUWGMRR0_K1_LBSPPA2048_LBSPPB256_LPA0_MIWT8_4_PLR1_SU32_SUM0_SUS256_SKXCCM0_VWA4_VWB4_WGM2_WGMXCC1_WGMXCCGn1
    SolutionIndex: 14
    SolutionNameMin: Cijk_Ailk_Bljk_BBS_BH_UserArgs_MT256x128x32_MI16x16x1_SN_LDSB1_CLR1_GSU0_GSUC0_GSUWGMRR0_K1_LBSPPA2048_LBSPPB256_LPA0_MIWT8_4_PLR1_SU32_SUM0_SUS256_SKXCCM0_VWA8_VWB4_WGM2_WGMXCC1_WGMXCCGn1
    SolutionIndex: 15
    SolutionNameMin: Cijk_Ailk_Bljk_BBS_BH_UserArgs_MT256x128x32_MI16x16x1_SN_LDSB1_CLR1_GSU0_GSUC0_GSUWGMRR0_K1_LBSPPA2048_LBSPPB128_LPA0_MIWT8_4_PLR1_SU32_SUM0_SUS256_SKXCCM0_VWA4_VWB1_WGM4_WGMXCC1_WGMXCCGn1
    SolutionIndex: 16
    SolutionNameMin: Cijk_Ailk_Bljk_BBS_BH_UserArgs_MT256x128x32_MI16x16x1_SN_LDSB1_CLR1_GSU0_GSUC0_GSUWGMRR0_K1_LBSPPA2048_LBSPPB256_LPA0_MIWT8_4_PLR1_SU32_SUM0_SUS256_SKXCCM0_VWA8_VWB4_WGM4_WGMXCC1_WGMXCCGn1
    SolutionIndex: 17
    SolutionNameMin: Cijk_Ailk_Bljk_BBS_BH_UserArgs_MT256x64x32_MI16x16x1_SN_LDSB1_CLR1_GSU0_GSUC0_GSUWGMRR0_K1_LBSPPA2048_LBSPPB128_LPA0_MIWT8_2_PLR1_SU32_SUM0_SUS256_SKXCCM0_VWA4_VWB1_WGM1_WGMXCC1_WGMXCCGn1
    SolutionIndex: 18
    SolutionNameMin: Cijk_Ailk_Bljk_BBS_BH_UserArgs_MT256x64x32_MI16x16x1_SN_LDSB1_CLR1_GSU0_GSUC0_GSUWGMRR0_K1_LBSPPA2048_LBSPPB128_LPA0_MIWT8_2_PLR1_SU32_SUM0_SUS256_SKXCCM0_VWA8_VWB1_WGM1_WGMXCC1_WGMXCCGn1
    SolutionIndex: 19
    SolutionNameMin: Cijk_Ailk_Bljk_BBS_BH_UserArgs_MT256x64x32_MI16x16x1_SN_LDSB1_CLR1_GSU0_GSUC0_GSUWGMRR0_K1_LBSPPA2048_LBSPPB128_LPA0_MIWT8_2_PLR1_SU32_SUM0_SUS256_SKXCCM0_VWA8_VWB2_WGM1_WGMXCC1_WGMXCCGn1
    SolutionIndex: 20
    SolutionNameMin: Cijk_Ailk_Bljk_BBS_BH_UserArgs_MT128x128x32_MI16x16x1_SN_LDSB1_CLR1_GSU0_GSUC0_GSUWGMRR0_K1_LBSPPA1024_LBSPPB128_LPA0_MIWT4_4_PLR1_SU32_SUM0_SUS256_SKXCCM0_VWA4_VWB1_WGM1_WGMXCC1_WGMXCCGn1
    SolutionIndex: 21
    SolutionNameMin: Cijk_Ailk_Bljk_BBS_BH_UserArgs_MT128x128x32_MI16x16x1_SN_LDSB1_CLR1_GSU0_GSUC0_GSUWGMRR0_K1_LBSPPA1024_LBSPPB256_LPA0_MIWT4_4_PLR1_SU32_SUM0_SUS256_SKXCCM0_VWA4_VWB4_WGM1_WGMXCC1_WGMXCCGn1
    SolutionIndex: 22
    SolutionNameMin: Cijk_Ailk_Bljk_BBS_BH_UserArgs_MT128x256x64_MI16x16x1_SN_LDSB1_CLR1_GSU0_GSUC0_GSUWGMRR0_K1_LBSPPA2048_LBSPPB1024_LPA0_MIWT4_8_PLR1_SU32_SUM0_SUS256_SKXCCM0_VWA4_VWB8_WGM1_WGMXCC1_WGMXCCGn1
    SolutionIndex: 23
    SolutionNameMin: Cijk_Ailk_Bljk_BBS_BH_UserArgs_MT256x128x64_MI16x16x1_SN_LDSB1_CLR1_GSU0_GSUC0_GSUWGMRR0_K1_LBSPPA4096_LBSPPB256_LPA0_MIWT8_4_PLR1_SU32_SUM0_SUS256_SKXCCM0_VWA4_VWB2_WGM1_WGMXCC1_WGMXCCGn1
    SolutionIndex: 24
    SolutionNameMin: Cijk_Ailk_Bljk_BBS_BH_UserArgs_MT256x128x64_MI16x16x1_SN_LDSB1_CLR1_GSU0_GSUC0_GSUWGMRR0_K1_LBSPPA4096_LBSPPB512_LPA0_MIWT8_4_PLR1_SU32_SUM0_SUS256_SKXCCM0_VWA4_VWB4_WGM1_WGMXCC1_WGMXCCGn1
    SolutionIndex: 25
    SolutionNameMin: Cijk_Ailk_Bljk_BBS_BH_UserArgs_MT256x128x64_MI16x16x1_SN_LDSB1_CLR1_GSU0_GSUC0_GSUWGMRR0_K1_LBSPPA4096_LBSPPB128_LPA0_MIWT8_4_PLR1_SU32_SUM0_SUS256_SKXCCM0_VWA4_VWB1_WGM2_WGMXCC1_WGMXCCGn1
    SolutionIndex: 26
    SolutionNameMin: Cijk_Ailk_Bljk_BBS_BH_UserArgs_MT256x128x64_MI16x16x1_SN_LDSB1_CLR1_GSU0_GSUC0_GSUWGMRR0_K1_LBSPPA4096_LBSPPB512_LPA0_MIWT8_4_PLR1_SU32_SUM0_SUS256_SKXCCM0_VWA4_VWB4_WGM2_WGMXCC1_WGMXCCGn1
    SolutionIndex: 27
    SolutionNameMin: Cijk_Ailk_Bljk_BBS_BH_UserArgs_MT256x128x64_MI16x16x1_SN_LDSB1_CLR1_GSU0_GSUC0_GSUWGMRR0_K1_LBSPPA4096_LBSPPB128_LPA0_MIWT8_4_PLR1_SU32_SUM0_SUS256_SKXCCM0_VWA4_VWB1_WGM4_WGMXCC1_WGMXCCGn1
    SolutionIndex: 28
    SolutionNameMin: Cijk_Ailk_Bljk_BBS_BH_UserArgs_MT128x128x64_MI16x16x1_SN_LDSB1_CLR1_GSU0_GSUC0_GSUWGMRR0_K1_LBSPPA2048_LBSPPB128_LPA0_MIWT4_4_PLR1_SU32_SUM0_SUS256_SKXCCM0_VWA4_VWB1_WGM1_WGMXCC1_WGMXCCGn1
    SolutionIndex: 29
    SolutionNameMin: Cijk_Ailk_Bljk_BBS_BH_UserArgs_MT128x128x64_MI16x16x1_SN_LDSB1_CLR1_GSU0_GSUC0_GSUWGMRR0_K1_LBSPPA2048_LBSPPB512_LPA0_MIWT4_4_PLR1_SU32_SUM0_SUS256_SKXCCM0_VWA4_VWB4_WGM1_WGMXCC1_WGMXCCGn1
    SolutionIndex: 30
    SolutionNameMin: Cijk_Ailk_Bljk_BBS_BH_UserArgs_MT64x128x64_MI16x16x1_SN_LDSB1_CLR1_GSU0_GSUC0_GSUWGMRR0_K1_LBSPPA1024_LBSPPB128_LPA32_MIWT2_4_PLR1_SU32_SUM0_SUS256_SKXCCM0_VWA2_VWB1_WGM1_WGMXCC1_WGMXCCGn1
    SolutionIndex: 31
    SolutionNameMin: Cijk_Ailk_Bljk_BBS_BH_UserArgs_MT64x128x64_MI16x16x1_SN_LDSB1_CLR1_GSU0_GSUC0_GSUWGMRR0_K1_LBSPPA1024_LBSPPB256_LPA32_MIWT2_4_PLR1_SU32_SUM0_SUS256_SKXCCM0_VWA2_VWB2_WGM1_WGMXCC1_WGMXCCGn1
    SolutionIndex: 32
    SolutionNameMin: Cijk_Ailk_Bljk_BBS_BH_UserArgs_MT64x128x64_MI16x16x1_SN_LDSB1_CLR1_GSU0_GSUC0_GSUWGMRR0_K1_LBSPPA1024_LBSPPB512_LPA32_MIWT2_4_PLR1_SU32_SUM0_SUS256_SKXCCM0_VWA2_VWB4_WGM1_WGMXCC1_WGMXCCGn1
    SolutionIndex: 33
    SolutionNameMin: Cijk_Ailk_Bljk_BBS_BH_UserArgs_MT64x128x64_MI16x16x1_SN_LDSB1_CLR1_GSU0_GSUC0_GSUWGMRR0_K1_LBSPPA1024_LBSPPB512_LPA32_MIWT2_4_PLR1_SU32_SUM0_SUS256_SKXCCM0_VWA2_VWB4_WGM2_WGMXCC1_WGMXCCGn1
    SolutionIndex: 34
    SolutionNameMin: Cijk_Ailk_Bljk_BBS_BH_UserArgs_MT64x128x64_MI16x16x1_SN_LDSB1_CLR1_GSU0_GSUC0_GSUWGMRR0_K1_LBSPPA1024_LBSPPB512_LPA32_MIWT2_4_PLR1_SU32_SUM0_SUS256_SKXCCM0_VWA2_VWB4_WGM4_WGMXCC1_WGMXCCGn1
    SolutionIndex: 35
    SolutionNameMin: Cijk_Ailk_Bljk_BBS_BH_UserArgs_MT128x64x64_MI16x16x1_SN_LDSB1_CLR1_GSU0_GSUC0_GSUWGMRR0_K1_LBSPPA2048_LBSPPB128_LPA0_MIWT4_2_PLR1_SU32_SUM0_SUS256_SKXCCM0_VWA4_VWB1_WGM1_WGMXCC1_WGMXCCGn1
    SolutionIndex: 36
    SolutionNameMin: Cijk_Ailk_Bljk_BBS_BH_UserArgs_MT128x64x64_MI16x16x1_SN_LDSB1_CLR1_GSU0_GSUC0_GSUWGMRR0_K1_LBSPPA2048_LBSPPB256_LPA0_MIWT4_2_PLR1_SU32_SUM0_SUS256_SKXCCM0_VWA4_VWB2_WGM1_WGMXCC1_WGMXCCGn1
    SolutionIndex: 37
    SolutionNameMin: Cijk_Ailk_Bljk_BBS_BH_UserArgs_MT128x64x64_MI16x16x1_SN_LDSB1_CLR1_GSU0_GSUC0_GSUWGMRR0_K1_LBSPPA2048_LBSPPB128_LPA0_MIWT4_2_PLR1_SU32_SUM0_SUS256_SKXCCM0_VWA4_VWB1_WGM4_WGMXCC1_WGMXCCGn1
    SolutionIndex: 38
    SolutionNameMin: Cijk_Ailk_Bljk_BBS_BH_UserArgs_MT64x64x64_MI16x16x1_SN_LDSB1_CLR1_GSU0_GSUC0_GSUWGMRR0_K1_LBSPPA1024_LBSPPB128_LPA32_MIWT2_2_PLR1_SU32_SUM0_SUS256_SKXCCM0_VWA2_VWB1_WGM1_WGMXCC1_WGMXCCGn1
    SolutionIndex: 39
    SolutionNameMin: Cijk_Ailk_Bljk_BBS_BH_UserArgs_MT64x64x64_MI16x16x1_SN_LDSB1_CLR1_GSU0_GSUC0_GSUWGMRR0_K1_LBSPPA1024_LBSPPB256_LPA32_MIWT2_2_PLR1_SU32_SUM0_SUS256_SKXCCM0_VWA2_VWB2_WGM1_WGMXCC1_WGMXCCGn1
    SolutionIndex: 40
    SolutionNameMin: Cijk_Ailk_Bljk_BBS_BH_UserArgs_MT64x32x64_MI16x16x1_SN_LDSB0_CLR1_GSU0_GSUC0_GSUWGMRR0_K1_LBSPPA1024_LBSPPB128_LPA32_MIWT2_1_PLR1_SU32_SUM0_SUS256_SKXCCM0_VWA2_VWB1_WGM1_WGMXCC1_WGMXCCGn1
    SolutionIndex: 41
    SolutionNameMin: Cijk_Ailk_Bljk_BBS_BH_UserArgs_MT32x32x64_MI16x16x1_SN_LDSB0_CLR1_GSU0_GSUC0_GSUWGMRR0_K1_LBSPPA512_LBSPPB128_LPA16_MIWT1_1_PLR1_SU32_SUM0_SUS256_SKXCCM0_VWA1_VWB1_WGM1_WGMXCC1_WGMXCCGn1
    SolutionIndex: 42
    SolutionNameMin: Cijk_Ailk_Bljk_BBS_BH_UserArgs_MT64x128x128_MI16x16x1_SN_LDSB1_CLR1_GSU0_GSUC0_GSUWGMRR0_K1_LBSPPA1024_LBSPPB512_LPA32_MIWT2_4_PLR2_SU32_SUM0_SUS256_SKXCCM0_VWA2_VWB2_WGM2_WGMXCC1_WGMXCCGn1
    SolutionIndex: 43
    SolutionNameMin: Cijk_Ailk_Bljk_BBS_BH_UserArgs_MT128x64x128_MI16x16x1_SN_LDSB1_CLR1_GSU0_GSUC0_GSUWGMRR0_K1_LBSPPA2048_LBSPPB256_LPA0_MIWT4_2_PLR2_SU32_SUM0_SUS256_SKXCCM0_VWA4_VWB1_WGM1_WGMXCC1_WGMXCCGn1
    SolutionIndex: 44
    SolutionNameMin: Cijk_Ailk_Bljk_BBS_BH_UserArgs_MT64x64x128_MI16x16x1_SN_LDSB1_CLR1_GSU0_GSUC0_GSUWGMRR0_K1_LBSPPA1024_LBSPPB256_LPA32_MIWT2_2_PLR2_SU32_SUM0_SUS256_SKXCCM0_VWA2_VWB1_WGM1_WGMXCC1_WGMXCCGn1
    SolutionIndex: 45
    SolutionNameMin: Cijk_Ailk_Bljk_BBS_BH_UserArgs_MT64x64x128_MI16x16x1_SN_LDSB1_CLR1_GSU0_GSUC0_GSUWGMRR0_K1_LBSPPA1024_LBSPPB512_LPA32_MIWT2_2_PLR2_SU32_SUM0_SUS256_SKXCCM0_VWA2_VWB2_WGM1_WGMXCC1_WGMXCCGn1
    SolutionIndex: 46
    SolutionNameMin: Cijk_Ailk_Bljk_BBS_BH_UserArgs_MT64x32x128_MI16x16x1_SN_LDSB1_CLR1_GSU0_GSUC0_GSUWGMRR0_K1_LBSPPA1024_LBSPPB256_LPA32_MIWT2_1_PLR1_SU32_SUM0_SUS256_SKXCCM0_VWA2_VWB1_WGM1_WGMXCC1_WGMXCCGn1
    SolutionIndex: 47
    SolutionNameMin: Cijk_Ailk_Bljk_BBS_BH_UserArgs_MT64x32x128_MI16x16x1_SN_LDSB1_CLR1_GSU0_GSUC0_GSUWGMRR0_K1_LBSPPA1024_LBSPPB256_LPA32_MIWT2_1_PLR2_SU32_SUM0_SUS256_SKXCCM0_VWA2_VWB1_WGM1_WGMXCC1_WGMXCCGn1
    SolutionIndex: 48
    SolutionNameMin: Cijk_Ailk_Bljk_BBS_BH_UserArgs_MT32x32x128_MI16x16x1_SN_LDSB1_CLR1_GSU0_GSUC0_GSUWGMRR0_K1_LBSPPA512_LBSPPB256_LPA16_MIWT1_1_PLR1_SU32_SUM0_SUS256_SKXCCM0_VWA1_VWB1_WGM1_WGMXCC1_WGMXCCGn1
    SolutionIndex: 49
    SolutionNameMin: Cijk_Ailk_Bljk_BBS_BH_UserArgs_MT32x32x128_MI16x16x1_SN_LDSB1_CLR1_GSU0_GSUC0_GSUWGMRR0_K1_LBSPPA512_LBSPPB256_LPA16_MIWT1_1_PLR2_SU32_SUM0_SUS256_SKXCCM0_VWA1_VWB1_WGM1_WGMXCC1_WGMXCCGn1
    SolutionIndex: 50
    SolutionNameMin: Cijk_Ailk_Bljk_BBS_BH_UserArgs_MT256x256x32_MI16x16x1_SN_LDSB1_CLR1_GSU0_GSUC0_GSUWGMRR0_K1_LBSPPA2048_LBSPPB128_LPA0_MIWT8_8_PLR1_SU32_SUM0_SUS256_SKXCCM4_VWA4_VWB1_WGM1_WGMXCC1_WGMXCCGn1
    SolutionIndex: 51
    SolutionNameMin: Cijk_Ailk_Bljk_BBS_BH_UserArgs_MT256x256x32_MI16x16x1_SN_LDSB1_CLR1_GSU0_GSUC0_GSUWGMRR0_K1_LBSPPA2048_LBSPPB128_LPA0_MIWT8_8_PLR1_SU32_SUM0_SUS256_SKXCCM4_VWA8_VWB1_WGM1_WGMXCC1_WGMXCCGn1
    SolutionIndex: 52
    SolutionNameMin: Cijk_Ailk_Bljk_BBS_BH_UserArgs_MT256x256x32_MI16x16x1_SN_LDSB1_CLR1_GSU0_GSUC0_GSUWGMRR0_K1_LBSPPA2048_LBSPPB128_LPA0_MIWT8_8_PLR1_SU32_SUM0_SUS256_SKXCCM4_VWA4_VWB2_WGM1_WGMXCC1_WGMXCCGn1
    SolutionIndex: 53
    SolutionNameMin: Cijk_Ailk_Bljk_BBS_BH_UserArgs_MT256x256x32_MI16x16x1_SN_LDSB1_CLR1_GSU0_GSUC0_GSUWGMRR0_K1_LBSPPA2048_LBSPPB128_LPA0_MIWT8_8_PLR1_SU32_SUM0_SUS256_SKXCCM4_VWA8_VWB2_WGM1_WGMXCC1_WGMXCCGn1
    SolutionIndex: 54
    SolutionNameMin: Cijk_Ailk_Bljk_BBS_BH_UserArgs_MT256x256x32_MI16x16x1_SN_LDSB1_CLR1_GSU0_GSUC0_GSUWGMRR0_K1_LBSPPA2048_LBSPPB256_LPA0_MIWT8_8_PLR1_SU32_SUM0_SUS256_SKXCCM4_VWA8_VWB4_WGM1_WGMXCC1_WGMXCCGn1
    SolutionIndex: 55
    SolutionNameMin: Cijk_Ailk_Bljk_BBS_BH_UserArgs_MT256x256x32_MI16x16x1_SN_LDSB1_CLR1_GSU0_GSUC0_GSUWGMRR0_K1_LBSPPA2048_LBSPPB512_LPA0_MIWT8_8_PLR1_SU32_SUM0_SUS256_SKXCCM4_VWA4_VWB8_WGM1_WGMXCC1_WGMXCCGn1
    SolutionIndex: 56
    SolutionNameMin: Cijk_Ailk_Bljk_BBS_BH_UserArgs_MT256x256x32_MI16x16x1_SN_LDSB1_CLR1_GSU0_GSUC0_GSUWGMRR0_K1_LBSPPA2048_LBSPPB512_LPA0_MIWT8_8_PLR1_SU32_SUM0_SUS256_SKXCCM4_VWA8_VWB8_WGM1_WGMXCC1_WGMXCCGn1
    SolutionIndex: 57
    SolutionNameMin: Cijk_Ailk_Bljk_BBS_BH_UserArgs_MT256x256x32_MI16x16x1_SN_LDSB1_CLR1_GSU0_GSUC0_GSUWGMRR0_K1_LBSPPA2048_LBSPPB128_LPA0_MIWT8_8_PLR1_SU32_SUM0_SUS256_SKXCCM4_VWA4_VWB1_WGM2_WGMXCC1_WGMXCCGn1
    SolutionIndex: 58
    SolutionNameMin: Cijk_Ailk_Bljk_BBS_BH_UserArgs_MT256x256x32_MI16x16x1_SN_LDSB1_CLR1_GSU0_GSUC0_GSUWGMRR0_K1_LBSPPA2048_LBSPPB128_LPA0_MIWT8_8_PLR1_SU32_SUM0_SUS256_SKXCCM4_VWA4_VWB2_WGM2_WGMXCC1_WGMXCCGn1
    SolutionIndex: 59
    SolutionNameMin: Cijk_Ailk_Bljk_BBS_BH_UserArgs_MT256x256x32_MI16x16x1_SN_LDSB1_CLR1_GSU0_GSUC0_GSUWGMRR0_K1_LBSPPA2048_LBSPPB128_LPA0_MIWT8_8_PLR1_SU32_SUM0_SUS256_SKXCCM4_VWA4_VWB1_WGM4_WGMXCC1_WGMXCCGn1
    SolutionIndex: 60
    SolutionNameMin: Cijk_Ailk_Bljk_BBS_BH_UserArgs_MT256x128x32_MI16x16x1_SN_LDSB1_CLR1_GSU0_GSUC0_GSUWGMRR0_K1_LBSPPA2048_LBSPPB128_LPA0_MIWT8_4_PLR1_SU32_SUM0_SUS256_SKXCCM4_VWA4_VWB1_WGM1_WGMXCC1_WGMXCCGn1
    SolutionIndex: 61
    SolutionNameMin: Cijk_Ailk_Bljk_BBS_BH_UserArgs_MT256x128x32_MI16x16x1_SN_LDSB1_CLR1_GSU0_GSUC0_GSUWGMRR0_K1_LBSPPA2048_LBSPPB128_LPA0_MIWT8_4_PLR1_SU32_SUM0_SUS256_SKXCCM4_VWA8_VWB1_WGM1_WGMXCC1_WGMXCCGn1
    SolutionIndex: 62
    SolutionNameMin: Cijk_Ailk_Bljk_BBS_BH_UserArgs_MT256x128x32_MI16x16x1_SN_LDSB1_CLR1_GSU0_GSUC0_GSUWGMRR0_K1_LBSPPA2048_LBSPPB128_LPA0_MIWT8_4_PLR1_SU32_SUM0_SUS256_SKXCCM4_VWA4_VWB2_WGM1_WGMXCC1_WGMXCCGn1
    SolutionIndex: 63
    SolutionNameMin: Cijk_Ailk_Bljk_BBS_BH_UserArgs_MT256x128x32_MI16x16x1_SN_LDSB1_CLR1_GSU0_GSUC0_GSUWGMRR0_K1_LBSPPA2048_LBSPPB128_LPA0_MIWT8_4_PLR1_SU32_SUM0_SUS256_SKXCCM4_VWA8_VWB2_WGM1_WGMXCC1_WGMXCCGn1
    SolutionIndex: 64
    SolutionNameMin: Cijk_Ailk_Bljk_BBS_BH_UserArgs_MT256x128x32_MI16x16x1_SN_LDSB1_CLR1_GSU0_GSUC0_GSUWGMRR0_K1_LBSPPA2048_LBSPPB256_LPA0_MIWT8_4_PLR1_SU32_SUM0_SUS256_SKXCCM4_VWA4_VWB4_WGM1_WGMXCC1_WGMXCCGn1
    SolutionIndex: 65
    SolutionNameMin: Cijk_Ailk_Bljk_BBS_BH_UserArgs_MT256x128x32_MI16x16x1_SN_LDSB1_CLR1_GSU0_GSUC0_GSUWGMRR0_K1_LBSPPA2048_LBSPPB256_LPA0_MIWT8_4_PLR1_SU32_SUM0_SUS256_SKXCCM4_VWA8_VWB4_WGM1_WGMXCC1_WGMXCCGn1
    SolutionIndex: 66
    SolutionNameMin: Cijk_Ailk_Bljk_BBS_BH_UserArgs_MT256x128x32_MI16x16x1_SN_LDSB1_CLR1_GSU0_GSUC0_GSUWGMRR0_K1_LBSPPA2048_LBSPPB128_LPA0_MIWT8_4_PLR1_SU32_SUM0_SUS256_SKXCCM4_VWA4_VWB1_WGM2_WGMXCC1_WGMXCCGn1
    SolutionIndex: 67
    SolutionNameMin: Cijk_Ailk_Bljk_BBS_BH_UserArgs_MT256x128x32_MI16x16x1_SN_LDSB1_CLR1_GSU0_GSUC0_GSUWGMRR0_K1_LBSPPA2048_LBSPPB128_LPA0_MIWT8_4_PLR1_SU32_SUM0_SUS256_SKXCCM4_VWA8_VWB2_WGM2_WGMXCC1_WGMXCCGn1
    SolutionIndex: 68
    SolutionNameMin: Cijk_Ailk_Bljk_BBS_BH_UserArgs_MT256x128x32_MI16x16x1_SN_LDSB1_CLR1_GSU0_GSUC0_GSUWGMRR0_K1_LBSPPA2048_LBSPPB256_LPA0_MIWT8_4_PLR1_SU32_SUM0_SUS256_SKXCCM4_VWA4_VWB4_WGM2_WGMXCC1_WGMXCCGn1
    SolutionIndex: 69
    SolutionNameMin: Cijk_Ailk_Bljk_BBS_BH_UserArgs_MT256x128x32_MI16x16x1_SN_LDSB1_CLR1_GSU0_GSUC0_GSUWGMRR0_K1_LBSPPA2048_LBSPPB128_LPA0_MIWT8_4_PLR1_SU32_SUM0_SUS256_SKXCCM4_VWA4_VWB1_WGM4_WGMXCC1_WGMXCCGn1
    SolutionIndex: 70
    SolutionNameMin: Cijk_Ailk_Bljk_BBS_BH_UserArgs_MT256x128x32_MI16x16x1_SN_LDSB1_CLR1_GSU0_GSUC0_GSUWGMRR0_K1_LBSPPA2048_LBSPPB128_LPA0_MIWT8_4_PLR1_SU32_SUM0_SUS256_SKXCCM4_VWA4_VWB2_WGM4_WGMXCC1_WGMXCCGn1
    SolutionIndex: 71
    SolutionNameMin: Cijk_Ailk_Bljk_BBS_BH_UserArgs_MT256x128x32_MI16x16x1_SN_LDSB1_CLR1_GSU0_GSUC0_GSUWGMRR0_K1_LBSPPA2048_LBSPPB128_LPA0_MIWT8_4_PLR1_SU32_SUM0_SUS256_SKXCCM4_VWA8_VWB2_WGM4_WGMXCC1_WGMXCCGn1
    SolutionIndex: 72
    SolutionNameMin: Cijk_Ailk_Bljk_BBS_BH_UserArgs_MT256x128x32_MI16x16x1_SN_LDSB1_CLR1_GSU0_GSUC0_GSUWGMRR0_K1_LBSPPA2048_LBSPPB256_LPA0_MIWT8_4_PLR1_SU32_SUM0_SUS256_SKXCCM4_VWA4_VWB4_WGM4_WGMXCC1_WGMXCCGn1
    SolutionIndex: 73
    SolutionNameMin: Cijk_Ailk_Bljk_BBS_BH_UserArgs_MT128x128x32_MI16x16x1_SN_LDSB1_CLR1_GSU0_GSUC0_GSUWGMRR0_K1_LBSPPA1024_LBSPPB128_LPA32_MIWT4_4_PLR1_SU32_SUM0_SUS256_SKXCCM4_VWA2_VWB1_WGM1_WGMXCC1_WGMXCCGn1
    SolutionIndex: 74
    SolutionNameMin: Cijk_Ailk_Bljk_BBS_BH_UserArgs_MT128x128x32_MI16x16x1_SN_LDSB1_CLR1_GSU0_GSUC0_GSUWGMRR0_K1_LBSPPA1024_LBSPPB128_LPA0_MIWT4_4_PLR1_SU32_SUM0_SUS256_SKXCCM4_VWA4_VWB1_WGM1_WGMXCC1_WGMXCCGn1
    SolutionIndex: 75
    SolutionNameMin: Cijk_Ailk_Bljk_BBS_BH_UserArgs_MT128x128x32_MI16x16x1_SN_LDSB1_CLR1_GSU0_GSUC0_GSUWGMRR0_K1_LBSPPA1024_LBSPPB128_LPA32_MIWT4_4_PLR1_SU32_SUM0_SUS256_SKXCCM4_VWA2_VWB2_WGM1_WGMXCC1_WGMXCCGn1
    SolutionIndex: 76
    SolutionNameMin: Cijk_Ailk_Bljk_BBS_BH_UserArgs_MT128x128x32_MI16x16x1_SN_LDSB1_CLR1_GSU0_GSUC0_GSUWGMRR0_K1_LBSPPA1024_LBSPPB128_LPA0_MIWT4_4_PLR1_SU32_SUM0_SUS256_SKXCCM4_VWA4_VWB2_WGM1_WGMXCC1_WGMXCCGn1
    SolutionIndex: 77
    SolutionNameMin: Cijk_Ailk_Bljk_BBS_BH_UserArgs_MT128x128x32_MI16x16x1_SN_LDSB1_CLR1_GSU0_GSUC0_GSUWGMRR0_K1_LBSPPA1024_LBSPPB256_LPA0_MIWT4_4_PLR1_SU32_SUM0_SUS256_SKXCCM4_VWA4_VWB4_WGM1_WGMXCC1_WGMXCCGn1
    SolutionIndex: 78
    SolutionNameMin: Cijk_Ailk_Bljk_BBS_BH_UserArgs_MT128x128x32_MI16x16x1_SN_LDSB1_CLR1_GSU0_GSUC0_GSUWGMRR0_K1_LBSPPA1024_LBSPPB128_LPA32_MIWT4_4_PLR1_SU32_SUM0_SUS256_SKXCCM4_VWA2_VWB1_WGM2_WGMXCC1_WGMXCCGn1
    SolutionIndex: 79
    SolutionNameMin: Cijk_Ailk_Bljk_BBS_BH_UserArgs_MT128x128x32_MI16x16x1_SN_LDSB1_CLR1_GSU0_GSUC0_GSUWGMRR0_K1_LBSPPA1024_LBSPPB128_LPA32_MIWT4_4_PLR1_SU32_SUM0_SUS256_SKXCCM4_VWA2_VWB2_WGM2_WGMXCC1_WGMXCCGn1
    SolutionIndex: 80
    SolutionNameMin: Cijk_Ailk_Bljk_BBS_BH_UserArgs_MT128x128x32_MI16x16x1_SN_LDSB1_CLR1_GSU0_GSUC0_GSUWGMRR0_K1_LBSPPA1024_LBSPPB256_LPA0_MIWT4_4_PLR1_SU32_SUM0_SUS256_SKXCCM4_VWA4_VWB4_WGM2_WGMXCC1_WGMXCCGn1
    SolutionIndex: 81
    SolutionNameMin: Cijk_Ailk_Bljk_BBS_BH_UserArgs_MT128x128x32_MI16x16x1_SN_LDSB1_CLR1_GSU0_GSUC0_GSUWGMRR0_K1_LBSPPA1024_LBSPPB128_LPA32_MIWT4_4_PLR1_SU32_SUM0_SUS256_SKXCCM4_VWA2_VWB1_WGM4_WGMXCC1_WGMXCCGn1
    SolutionIndex: 82
    SolutionNameMin: Cijk_Ailk_Bljk_BBS_BH_UserArgs_MT128x128x32_MI16x16x1_SN_LDSB1_CLR1_GSU0_GSUC0_GSUWGMRR0_K1_LBSPPA1024_LBSPPB256_LPA0_MIWT4_4_PLR1_SU32_SUM0_SUS256_SKXCCM4_VWA4_VWB4_WGM4_WGMXCC1_WGMXCCGn1
    SolutionIndex: 83
    SolutionNameMin: Cijk_Ailk_Bljk_BBS_BH_UserArgs_MT128x64x32_MI16x16x1_SN_LDSB0_CLR0_GSU0_GSUC0_GSUWGMRR0_K1_LBSPPA1024_LBSPPB128_LPA0_MIWT4_2_PLR0_SU32_SUM0_SUS256_SKXCCM4_VWA4_VWB2_WGM1_WGMXCC1_WGMXCCGn1
    SolutionIndex: 84
    SolutionNameMin: Cijk_Ailk_Bljk_BBS_BH_UserArgs_MT128x64x32_MI16x16x1_SN_LDSB0_CLR0_GSU0_GSUC0_GSUWGMRR0_K1_LBSPPA1024_LBSPPB128_LPA0_MIWT4_2_PLR0_SU32_SUM0_SUS256_SKXCCM4_VWA4_VWB1_WGM2_WGMXCC1_WGMXCCGn1
    SolutionIndex: 85
    SolutionNameMin: Cijk_Ailk_Bljk_BBS_BH_UserArgs_MT128x64x32_MI16x16x1_SN_LDSB0_CLR0_GSU0_GSUC0_GSUWGMRR0_K1_LBSPPA1024_LBSPPB128_LPA0_MIWT4_2_PLR0_SU32_SUM0_SUS256_SKXCCM4_VWA4_VWB1_WGM4_WGMXCC1_WGMXCCGn1
    SolutionIndex: 86
    SolutionNameMin: Cijk_Ailk_Bljk_BBS_BH_UserArgs_MT32x32x32_MI16x16x1_SN_LDSB0_CLR1_GSU0_GSUC0_GSUWGMRR0_K1_LBSPPA256_LBSPPB128_LPA16_MIWT1_1_PLR1_SU32_SUM0_SUS256_SKXCCM4_VWA1_VWB1_WGM1_WGMXCC1_WGMXCCGn1
    SolutionIndex: 87
    SolutionNameMin: Cijk_Ailk_Bljk_BBS_BH_UserArgs_MT256x128x64_MI16x16x1_SN_LDSB1_CLR1_GSU0_GSUC0_GSUWGMRR0_K1_LBSPPA4096_LBSPPB128_LPA0_MIWT8_4_PLR1_SU32_SUM0_SUS256_SKXCCM4_VWA4_VWB1_WGM1_WGMXCC1_WGMXCCGn1
    SolutionIndex: 88
    SolutionNameMin: Cijk_Ailk_Bljk_BBS_BH_UserArgs_MT128x128x64_MI16x16x1_SN_LDSB1_CLR1_GSU0_GSUC0_GSUWGMRR0_K1_LBSPPA2048_LBSPPB128_LPA32_MIWT4_4_PLR1_SU32_SUM0_SUS256_SKXCCM4_VWA2_VWB1_WGM1_WGMXCC1_WGMXCCGn1
    SolutionIndex: 89
    SolutionNameMin: Cijk_Ailk_Bljk_BBS_BH_UserArgs_MT128x128x64_MI16x16x1_SN_LDSB1_CLR1_GSU0_GSUC0_GSUWGMRR0_K1_LBSPPA2048_LBSPPB128_LPA0_MIWT4_4_PLR1_SU32_SUM0_SUS256_SKXCCM4_VWA4_VWB1_WGM1_WGMXCC1_WGMXCCGn1
    SolutionIndex: 90
    SolutionNameMin: Cijk_Ailk_Bljk_BBS_BH_UserArgs_MT128x128x64_MI16x16x1_SN_LDSB1_CLR1_GSU0_GSUC0_GSUWGMRR0_K1_LBSPPA2048_LBSPPB512_LPA0_MIWT4_4_PLR1_SU32_SUM0_SUS256_SKXCCM4_VWA4_VWB4_WGM1_WGMXCC1_WGMXCCGn1
    SolutionIndex: 91
    SolutionNameMin: Cijk_Ailk_Bljk_BBS_BH_UserArgs_MT128x128x64_MI16x16x1_SN_LDSB1_CLR1_GSU0_GSUC0_GSUWGMRR0_K1_LBSPPA2048_LBSPPB128_LPA0_MIWT4_4_PLR1_SU32_SUM0_SUS256_SKXCCM4_VWA4_VWB1_WGM2_WGMXCC1_WGMXCCGn1
    SolutionIndex: 92
    SolutionNameMin: Cijk_Ailk_Bljk_BBS_BH_UserArgs_MT128x128x64_MI16x16x1_SN_LDSB1_CLR1_GSU0_GSUC0_GSUWGMRR0_K1_LBSPPA2048_LBSPPB128_LPA0_MIWT4_4_PLR1_SU32_SUM0_SUS256_SKXCCM4_VWA4_VWB1_WGM4_WGMXCC1_WGMXCCGn1
    SolutionIndex: 93
    SolutionNameMin: Cijk_Ailk_Bljk_BBS_BH_UserArgs_MT64x128x64_MI16x16x1_SN_LDSB1_CLR1_GSU0_GSUC0_GSUWGMRR0_K1_LBSPPA1024_LBSPPB128_LPA32_MIWT2_4_PLR1_SU32_SUM0_SUS256_SKXCCM4_VWA2_VWB1_WGM1_WGMXCC1_WGMXCCGn1
    SolutionIndex: 94
    SolutionNameMin: Cijk_Ailk_Bljk_BBS_BH_UserArgs_MT64x128x64_MI16x16x1_SN_LDSB1_CLR1_GSU0_GSUC0_GSUWGMRR0_K1_LBSPPA1024_LBSPPB512_LPA32_MIWT2_4_PLR1_SU32_SUM0_SUS256_SKXCCM4_VWA2_VWB4_WGM1_WGMXCC1_WGMXCCGn1
    SolutionIndex: 95
    SolutionNameMin: Cijk_Ailk_Bljk_BBS_BH_UserArgs_MT128x64x64_MI16x16x1_SN_LDSB1_CLR1_GSU0_GSUC0_GSUWGMRR0_K1_LBSPPA2048_LBSPPB128_LPA0_MIWT4_2_PLR1_SU32_SUM0_SUS256_SKXCCM4_VWA4_VWB1_WGM1_WGMXCC1_WGMXCCGn1
    SolutionIndex: 96
    SolutionNameMin: Cijk_Ailk_Bljk_BBS_BH_UserArgs_MT128x64x64_MI16x16x1_SN_LDSB1_CLR1_GSU0_GSUC0_GSUWGMRR0_K1_LBSPPA2048_LBSPPB256_LPA0_MIWT4_2_PLR1_SU32_SUM0_SUS256_SKXCCM4_VWA4_VWB2_WGM1_WGMXCC1_WGMXCCGn1
    SolutionIndex: 97
    SolutionNameMin: Cijk_Ailk_Bljk_BBS_BH_UserArgs_MT128x64x64_MI16x16x1_SN_LDSB1_CLR1_GSU0_GSUC0_GSUWGMRR0_K1_LBSPPA2048_LBSPPB128_LPA0_MIWT4_2_PLR1_SU32_SUM0_SUS256_SKXCCM4_VWA4_VWB1_WGM2_WGMXCC1_WGMXCCGn1
    SolutionIndex: 98
    SolutionNameMin: Cijk_Ailk_Bljk_BBS_BH_UserArgs_MT128x64x64_MI16x16x1_SN_LDSB1_CLR1_GSU0_GSUC0_GSUWGMRR0_K1_LBSPPA2048_LBSPPB128_LPA0_MIWT4_2_PLR1_SU32_SUM0_SUS256_SKXCCM4_VWA4_VWB1_WGM4_WGMXCC1_WGMXCCGn1
    SolutionIndex: 99
    SolutionNameMin: Cijk_Ailk_Bljk_BBS_BH_UserArgs_MT128x64x64_MI16x16x1_SN_LDSB1_CLR1_GSU0_GSUC0_GSUWGMRR0_K1_LBSPPA2048_LBSPPB256_LPA0_MIWT4_2_PLR1_SU32_SUM0_SUS256_SKXCCM4_VWA4_VWB2_WGM4_WGMXCC1_WGMXCCGn1
    SolutionIndex: 100
    SolutionNameMin: Cijk_Ailk_Bljk_BBS_BH_UserArgs_MT64x64x64_MI16x16x1_SN_LDSB1_CLR1_GSU0_GSUC0_GSUWGMRR0_K1_LBSPPA1024_LBSPPB128_LPA32_MIWT2_2_PLR1_SU32_SUM0_SUS256_SKXCCM4_VWA2_VWB1_WGM1_WGMXCC1_WGMXCCGn1
    SolutionIndex: 101
    SolutionNameMin: Cijk_Ailk_Bljk_BBS_BH_UserArgs_MT64x64x64_MI16x16x1_SN_LDSB1_CLR1_GSU0_GSUC0_GSUWGMRR0_K1_LBSPPA1024_LBSPPB256_LPA32_MIWT2_2_PLR1_SU32_SUM0_SUS256_SKXCCM4_VWA2_VWB2_WGM1_WGMXCC1_WGMXCCGn1
    SolutionIndex: 102
    SolutionNameMin: Cijk_Ailk_Bljk_BBS_BH_UserArgs_MT64x64x64_MI16x16x1_SN_LDSB1_CLR1_GSU0_GSUC0_GSUWGMRR0_K1_LBSPPA1024_LBSPPB128_LPA32_MIWT2_2_PLR1_SU32_SUM0_SUS256_SKXCCM4_VWA2_VWB1_WGM2_WGMXCC1_WGMXCCGn1
    SolutionIndex: 103
    SolutionNameMin: Cijk_Ailk_Bljk_BBS_BH_UserArgs_MT64x64x64_MI16x16x1_SN_LDSB1_CLR1_GSU0_GSUC0_GSUWGMRR0_K1_LBSPPA1024_LBSPPB256_LPA32_MIWT2_2_PLR1_SU32_SUM0_SUS256_SKXCCM4_VWA2_VWB2_WGM2_WGMXCC1_WGMXCCGn1
    SolutionIndex: 104
    SolutionNameMin: Cijk_Ailk_Bljk_BBS_BH_UserArgs_MT64x64x64_MI16x16x1_SN_LDSB1_CLR1_GSU0_GSUC0_GSUWGMRR0_K1_LBSPPA1024_LBSPPB128_LPA32_MIWT2_2_PLR1_SU32_SUM0_SUS256_SKXCCM4_VWA2_VWB1_WGM4_WGMXCC1_WGMXCCGn1
    SolutionIndex: 105
    SolutionNameMin: Cijk_Ailk_Bljk_BBS_BH_UserArgs_MT64x32x64_MI16x16x1_SN_LDSB0_CLR1_GSU0_GSUC0_GSUWGMRR0_K1_LBSPPA1024_LBSPPB128_LPA32_MIWT2_1_PLR1_SU32_SUM0_SUS256_SKXCCM4_VWA2_VWB1_WGM1_WGMXCC1_WGMXCCGn1
    SolutionIndex: 106
    SolutionNameMin: Cijk_Ailk_Bljk_BBS_BH_UserArgs_MT128x64x128_MI16x16x1_SN_LDSB1_CLR1_GSU0_GSUC0_GSUWGMRR0_K1_LBSPPA2048_LBSPPB256_LPA0_MIWT4_2_PLR2_SU32_SUM0_SUS256_SKXCCM4_VWA4_VWB1_WGM1_WGMXCC1_WGMXCCGn1
    SolutionIndex: 107
    SolutionNameMin: Cijk_Ailk_Bljk_BBS_BH_UserArgs_MT128x64x128_MI16x16x1_SN_LDSB1_CLR1_GSU0_GSUC0_GSUWGMRR0_K1_LBSPPA2048_LBSPPB512_LPA0_MIWT4_2_PLR2_SU32_SUM0_SUS256_SKXCCM4_VWA4_VWB2_WGM1_WGMXCC1_WGMXCCGn1
    SolutionIndex: 108
    SolutionNameMin: Cijk_Ailk_Bljk_BBS_BH_UserArgs_MT128x64x128_MI16x16x1_SN_LDSB1_CLR1_GSU0_GSUC0_GSUWGMRR0_K1_LBSPPA2048_LBSPPB256_LPA0_MIWT4_2_PLR2_SU32_SUM0_SUS256_SKXCCM4_VWA4_VWB1_WGM4_WGMXCC1_WGMXCCGn1
    SolutionIndex: 109
    SolutionNameMin: Cijk_Ailk_Bljk_BBS_BH_UserArgs_MT64x64x128_MI16x16x1_SN_LDSB1_CLR1_GSU0_GSUC0_GSUWGMRR0_K1_LBSPPA1024_LBSPPB512_LPA32_MIWT2_2_PLR2_SU32_SUM0_SUS256_SKXCCM4_VWA2_VWB2_WGM1_WGMXCC1_WGMXCCGn1
    SolutionIndex: 110
    SolutionNameMin: Cijk_Ailk_Bljk_BBS_BH_UserArgs_MT64x64x128_MI16x16x1_SN_LDSB1_CLR1_GSU0_GSUC0_GSUWGMRR0_K1_LBSPPA1024_LBSPPB512_LPA32_MIWT2_2_PLR2_SU32_SUM0_SUS256_SKXCCM4_VWA2_VWB2_WGM2_WGMXCC1_WGMXCCGn1
    SolutionIndex: 111
    SolutionNameMin: Cijk_Ailk_Bljk_BBS_BH_UserArgs_MT64x32x128_MI16x16x1_SN_LDSB1_CLR1_GSU0_GSUC0_GSUWGMRR0_K1_LBSPPA1024_LBSPPB256_LPA32_MIWT2_1_PLR2_SU32_SUM0_SUS256_SKXCCM4_VWA2_VWB1_WGM1_WGMXCC1_WGMXCCGn1
    SolutionIndex: 112
    SolutionNameMin: Cijk_Ailk_Bljk_BBS_BH_UserArgs_MT64x32x128_MI16x16x1_SN_LDSB1_CLR1_GSU0_GSUC0_GSUWGMRR0_K1_LBSPPA1024_LBSPPB256_LPA32_MIWT2_1_PLR2_SU32_SUM0_SUS256_SKXCCM4_VWA2_VWB1_WGM4_WGMXCC1_WGMXCCGn1
    SolutionIndex: 113
    SolutionNameMin: Cijk_Ailk_Bljk_BBS_BH_UserArgs_MT32x32x128_MI16x16x1_SN_LDSB1_CLR1_GSU0_GSUC0_GSUWGMRR0_K1_LBSPPA512_LBSPPB256_LPA16_MIWT1_1_PLR1_SU32_SUM0_SUS256_SKXCCM4_VWA1_VWB1_WGM1_WGMXCC1_WGMXCCGn1
    SolutionIndex: 114
    SolutionNameMin: Cijk_Ailk_Bljk_BBS_BH_UserArgs_MT32x32x128_MI16x16x1_SN_LDSB1_CLR1_GSU0_GSUC0_GSUWGMRR0_K1_LBSPPA512_LBSPPB256_LPA16_MIWT1_1_PLR2_SU32_SUM0_SUS256_SKXCCM4_VWA1_VWB1_WGM1_WGMXCC1_WGMXCCGn1
    SolutionIndex: 115
    SolutionNameMin: Cijk_Ailk_Bljk_BBS_BH_UserArgs_MT32x32x32_MI16x16x1_SN_LDSB0_CLR1_GSU0_GSUC0_GSUWGMRR0_K1_LBSPPA256_LBSPPB128_LPA16_MIWT1_1_PLR1_SU32_SUM0_SUS256_SKXCCM4_VWA1_VWB1_WGM1_WGMXCC1_WGMXCCGn1
- - - [128, 128, 1, 128, 128, 128, 128, 128]
    - [48, 0.086]
  - - [128, 128, 1, 256, 128, 128, 128, 256]
    - [48, 0.107]
  - - [128, 128, 1, 512, 128, 128, 128, 512]
    - [113, 0.175]
  - - [128, 128, 1, 1024, 128, 128, 128, 1024]
    - [113, 0.296]
  - - [128, 128, 1, 2048, 128, 128, 128, 2048]
    - [48, 0.541]
  - - [128, 128, 1, 4096, 128, 128, 128, 4096]
    - [41, 0.911]
  - - [128, 128, 1, 8192, 128, 128, 128, 8192]
    - [114, 1.48]
  - - [128, 256, 1, 128, 128, 128, 128, 128]
    - [48, 0.171]
  - - [128, 256, 1, 256, 128, 128, 128, 256]
    - [49, 0.208]
  - - [128, 256, 1, 512, 128, 128, 128, 512]
    - [113, 0.376]
  - - [128, 256, 1, 1024, 128, 128, 128, 1024]
    - [48, 0.611]
  - - [128, 256, 1, 2048, 128, 128, 128, 2048]
    - [86, 1.046]
  - - [128, 256, 1, 4096, 128, 128, 128, 4096]
    - [47, 1.634]
  - - [128, 256, 1, 8192, 128, 128, 128, 8192]
    - [111, 2.643]
  - - [128, 512, 1, 128, 128, 128, 128, 128]
    - [114, 0.335]
  - - [128, 512, 1, 256, 128, 128, 128, 256]
    - [114, 0.428]
  - - [128, 512, 1, 512, 128, 128, 128, 512]
    - [111, 0.685]
  - - [128, 512, 1, 1024, 128, 128, 128, 1024]
    - [113, 1.216]
  - - [128, 512, 1, 2048, 128, 128, 128, 2048]
    - [114, 1.875]
  - - [128, 512, 1, 4096, 128, 128, 128, 4096]
    - [105, 2.934]
  - - [128, 512, 1, 8192, 128, 128, 128, 8192]
    - [109, 4.272]
  - - [128, 1024, 1, 128, 128, 128, 128, 128]
    - [46, 0.635]
  - - [128, 1024, 1, 256, 128, 128, 128, 256]
    - [114, 1.041]
  - - [128, 1024, 1, 512, 128, 128, 128, 512]
    - [49, 1.622]
  - - [128, 1024, 1, 1024, 128, 128, 128, 1024]
    - [49, 2.304]
  - - [128, 1024, 1, 2048, 128, 128, 128, 2048]
    - [111, 3.264]
  - - [128, 1024, 1, 4096, 128, 128, 128, 4096]
    - [104, 4.713]
  - - [128, 1024, 1, 8192, 128, 128, 128, 8192]
    - [107, 6.871]
  - - [128, 2048, 1, 128, 128, 128, 128, 128]
    - [109, 1.133]
  - - [128, 2048, 1, 256, 128, 128, 128, 256]
    - [40, 1.858]
  - - [128, 2048, 1, 512, 128, 128, 128, 512]
    - [105, 2.839]
  - - [128, 2048, 1, 1024, 128, 128, 128, 1024]
    - [111, 4.002]
  - - [128, 2048, 1, 2048, 128, 128, 128, 2048]
    - [83, 4.615]
  - - [128, 2048, 1, 4096, 128, 128, 128, 4096]
    - [95, 7.109]
  - - [128, 2048, 1, 8192, 128, 128, 128, 8192]
    - [89, 9.905]
  - - [128, 4096, 1, 128, 128, 128, 128, 128]
    - [101, 1.93]
  - - [128, 4096, 1, 256, 128, 128, 128, 256]
    - [38, 3.231]
  - - [128, 4096, 1, 512, 128, 128, 128, 512]
    - [101, 4.875]
  - - [128, 4096, 1, 1024, 128, 128, 128, 1024]
    - [96, 5.541]
  - - [128, 4096, 1, 2048, 128, 128, 128, 2048]
    - [102, 6.166]
  - - [128, 4096, 1, 4096, 128, 128, 128, 4096]
    - [20, 7.995]
  - - [128, 4096, 1, 8192, 128, 128, 128, 8192]
    - [22, 11.308]
  - - [128, 8192, 1, 128, 128, 128, 128, 128]
    - [32, 3.06]
  - - [128, 8192, 1, 256, 128, 128, 128, 256]
    - [93, 4.902]
  - - [128, 8192, 1, 512, 128, 128, 128, 512]
    - [93, 6.97]
  - - [128, 8192, 1, 1024, 128, 128, 128, 1024]
    - [43, 7.427]
  - - [128, 8192, 1, 2048, 128, 128, 128, 2048]
    - [96, 8.467]
  - - [128, 8192, 1, 4096, 128, 128, 128, 4096]
    - [35, 10.354]
  - - [128, 8192, 1, 8192, 128, 128, 128, 8192]
    - [36, 11.564]
  - - [256, 128, 1, 128, 256, 256, 256, 128]
    - [48, 0.169]
  - - [256, 128, 1, 256, 256, 256, 256, 256]
    - [48, 0.208]
  - - [256, 128, 1, 512, 256, 256, 256, 512]
    - [114, 0.367]
  - - [256, 128, 1, 1024, 256, 256, 256, 1024]
    - [48, 0.62]
  - - [256, 128, 1, 2048, 256, 256, 256, 2048]
    - [86, 1.036]
  - - [256, 128, 1, 4096, 256, 256, 256, 4096]
    - [47, 1.616]
  - - [256, 128, 1, 8192, 256, 256, 256, 8192]
    - [47, 2.541]
  - - [256, 256, 1, 128, 256, 256, 256, 128]
    - [48, 0.34]
  - - [256, 256, 1, 256, 256, 256, 256, 256]
    - [113, 0.422]
  - - [256, 256, 1, 512, 256, 256, 256, 512]
    - [113, 0.681]
  - - [256, 256, 1, 1024, 256, 256, 256, 1024]
    - [114, 1.199]
  - - [256, 256, 1, 2048, 256, 256, 256, 2048]
    - [114, 1.871]
  - - [256, 256, 1, 4096, 256, 256, 256, 4096]
    - [105, 2.934]
  - - [256, 256, 1, 8192, 256, 256, 256, 8192]
    - [112, 4.037]
  - - [256, 512, 1, 128, 256, 256, 256, 128]
    - [111, 0.638]
  - - [256, 512, 1, 256, 256, 256, 256, 256]
    - [113, 1.042]
  - - [256, 512, 1, 512, 256, 256, 256, 512]
    - [48, 1.613]
  - - [256, 512, 1, 1024, 256, 256, 256, 1024]
    - [49, 2.299]
  - - [256, 512, 1, 2048, 256, 256, 256, 2048]
    - [111, 3.268]
  - - [256, 512, 1, 4096, 256, 256, 256, 4096]
    - [101, 4.731]
  - - [256, 512, 1, 8192, 256, 256, 256, 8192]
    - [36, 6.677]
  - - [256, 1024, 1, 128, 256, 256, 256, 128]
    - [45, 1.151]
  - - [256, 1024, 1, 256, 256, 256, 256, 256]
    - [40, 1.874]
  - - [256, 1024, 1, 512, 256, 256, 256, 512]
    - [47, 2.847]
  - - [256, 1024, 1, 1024, 256, 256, 256, 1024]
    - [47, 4.013]
  - - [256, 1024, 1, 2048, 256, 256, 256, 2048]
    - [83, 4.499]
  - - [256, 1024, 1, 4096, 256, 256, 256, 4096]
    - [95, 7.157]
  - - [256, 1024, 1, 8192, 256, 256, 256, 8192]
    - [89, 9.888]
  - - [256, 2048, 1, 128, 256, 256, 256, 128]
    - [100, 1.935]
  - - [256, 2048, 1, 256, 256, 256, 256, 256]
    - [100, 3.244]
  - - [256, 2048, 1, 512, 256, 256, 256, 512]
    - [101, 4.858]
  - - [256, 2048, 1, 1024, 256, 256, 256, 1024]
    - [95, 5.576]
  - - [256, 2048, 1, 2048, 256, 256, 256, 2048]
    - [100, 6.488]
  - - [256, 2048, 1, 4096, 256, 256, 256, 4096]
    - [60, 8.045]
  - - [256, 2048, 1, 8192, 256, 256, 256, 8192]
    - [87, 11.548]
  - - [256, 4096, 1, 128, 256, 256, 256, 128]
    - [32, 3.055]
  - - [256, 4096, 1, 256, 256, 256, 256, 256]
    - [94, 4.927]
  - - [256, 4096, 1, 512, 256, 256, 256, 512]
    - [94, 6.97]
  - - [256, 4096, 1, 1024, 256, 256, 256, 1024]
    - [106, 7.555]
  - - [256, 4096, 1, 2048, 256, 256, 256, 2048]
    - [95, 8.568]
  - - [256, 4096, 1, 4096, 256, 256, 256, 4096]
    - [15, 11.257]
  - - [256, 4096, 1, 8192, 256, 256, 256, 8192]
    - [23, 11.629]
  - - [256, 8192, 1, 128, 256, 256, 256, 128]
    - [75, 4.249]
  - - [256, 8192, 1, 256, 256, 256, 256, 256]
    - [77, 6.277]
  - - [256, 8192, 1, 512, 256, 256, 256, 512]
    - [89, 7.96]
  - - [256, 8192, 1, 1024, 256, 256, 256, 1024]
    - [95, 9.351]
  - - [256, 8192, 1, 2048, 256, 256, 256, 2048]
    - [96, 10.603]
  - - [256, 8192, 1, 4096, 256, 256, 256, 4096]
    - [60, 11.866]
  - - [256, 8192, 1, 8192, 256, 256, 256, 8192]
    - [69, 14.345]
  - - [512, 128, 1, 128, 512, 512, 512, 128]
    - [48, 0.338]
  - - [512, 128, 1, 256, 512, 512, 512, 256]
    - [114, 0.427]
  - - [512, 128, 1, 512, 512, 512, 512, 512]
    - [113, 0.682]
  - - [512, 128, 1, 1024, 512, 512, 512, 1024]
    - [113, 1.2]
  - - [512, 128, 1, 2048, 512, 512, 512, 2048]
    - [114, 1.858]
  - - [512, 128, 1, 4096, 512, 512, 512, 4096]
    - [105, 2.817]
  - - [512, 128, 1, 8192, 512, 512, 512, 8192]
    - [110, 4.022]
  - - [512, 256, 1, 128, 512, 512, 512, 128]
    - [111, 0.64]
  - - [512, 256, 1, 256, 512, 512, 512, 256]
    - [48, 1.039]
  - - [512, 256, 1, 512, 512, 512, 512, 512]
    - [114, 1.617]
  - - [512, 256, 1, 1024, 512, 512, 512, 1024]
    - [49, 2.308]
  - - [512, 256, 1, 2048, 512, 512, 512, 2048]
    - [111, 3.27]
  - - [512, 256, 1, 4096, 512, 512, 512, 4096]
    - [103, 4.64]
  - - [512, 256, 1, 8192, 512, 512, 512, 8192]
    - [95, 6.657]
  - - [512, 512, 1, 128, 512, 512, 512, 128]
    - [40, 1.119]
  - - [512, 512, 1, 256, 512, 512, 512, 256]
    - [40, 1.877]
  - - [512, 512, 1, 512, 512, 512, 512, 512]
    - [47, 2.852]
  - - [512, 512, 1, 1024, 512, 512, 512, 1024]
    - [47, 4.032]
  - - [512, 512, 1, 2048, 512, 512, 512, 2048]
    - [84, 4.59]
  - - [512, 512, 1, 4096, 512, 512, 512, 4096]
    - [96, 7.08]
  - - [512, 512, 1, 8192, 512, 512, 512, 8192]
    - [29, 9.853]
  - - [512, 1024, 1, 128, 512, 512, 512, 128]
    - [100, 1.945]
  - - [512, 1024, 1, 256, 512, 512, 512, 256]
    - [100, 3.244]
  - - [512, 1024, 1, 512, 512, 512, 512, 512]
    - [101, 4.87]
  - - [512, 1024, 1, 1024, 512, 512, 512, 1024]
    - [95, 5.555]
  - - [512, 1024, 1, 2048, 512, 512, 512, 2048]
    - [100, 6.508]
  - - [512, 1024, 1, 4096, 512, 512, 512, 4096]
    - [17, 8.075]
  - - [512, 1024, 1, 8192, 512, 512, 512, 8192]
    - [87, 11.585]
  - - [512, 2048, 1, 128, 512, 512, 512, 128]
    - [30, 3.059]
  - - [512, 2048, 1, 256, 512, 512, 512, 256]
    - [93, 4.917]
  - - [512, 2048, 1, 512, 512, 512, 512, 512]
    - [33, 6.96]
  - - [512, 2048, 1, 1024, 512, 512, 512, 1024]
    - [107, 7.569]
  - - [512, 2048, 1, 2048, 512, 512, 512, 2048]
    - [96, 8.672]
  - - [512, 2048, 1, 4096, 512, 512, 512, 4096]
    - [12, 11.121]
  - - [512, 2048, 1, 8192, 512, 512, 512, 8192]
    - [24, 11.695]
  - - [512, 4096, 1, 128, 512, 512, 512, 128]
    - [75, 4.247]
  - - [512, 4096, 1, 256, 512, 512, 512, 256]
    - [73, 6.294]
  - - [512, 4096, 1, 512, 512, 512, 512, 512]
    - [90, 8.036]
  - - [512, 4096, 1, 1024, 512, 512, 512, 1024]
    - [95, 9.411]
  - - [512, 4096, 1, 2048, 512, 512, 512, 2048]
    - [96, 10.646]
  - - [512, 4096, 1, 4096, 512, 512, 512, 4096]
    - [64, 11.685]
  - - [512, 4096, 1, 8192, 512, 512, 512, 8192]
    - [68, 14.298]
  - - [512, 8192, 1, 128, 512, 512, 512, 128]
    - [61, 5.648]
  - - [512, 8192, 1, 256, 512, 512, 512, 256]
    - [16, 8.045]
  - - [512, 8192, 1, 512, 512, 512, 512, 512]
    - [82, 9.594]
  - - [512, 8192, 1, 1024, 512, 512, 512, 1024]
    - [80, 11.481]
  - - [512, 8192, 1, 2048, 512, 512, 512, 2048]
    - [90, 12.636]
  - - [512, 8192, 1, 4096, 512, 512, 512, 4096]
    - [72, 14.316]
  - - [512, 8192, 1, 8192, 512, 512, 512, 8192]
    - [15, 16.301]
  - - [1024, 128, 1, 128, 1024, 1024, 1024, 128]
    - [111, 0.631]
  - - [1024, 128, 1, 256, 1024, 1024, 1024, 256]
    - [113, 1.038]
  - - [1024, 128, 1, 512, 1024, 1024, 1024, 512]
    - [48, 1.606]
  - - [1024, 128, 1, 1024, 1024, 1024, 1024, 1024]
    - [49, 2.296]
  - - [1024, 128, 1, 2048, 1024, 1024, 1024, 2048]
    - [47, 3.194]
  - - [1024, 128, 1, 4096, 1024, 1024, 1024, 4096]
    - [103, 4.628]
  - - [1024, 128, 1, 8192, 1024, 1024, 1024, 8192]
    - [36, 6.643]
  - - [1024, 256, 1, 128, 1024, 1024, 1024, 128]
    - [44, 1.145]
  - - [1024, 256, 1, 256, 1024, 1024, 1024, 256]
    - [105, 1.856]
  - - [1024, 256, 1, 512, 1024, 1024, 1024, 512]
    - [40, 2.854]
  - - [1024, 256, 1, 1024, 1024, 1024, 1024, 1024]
    - [47, 3.985]
  - - [1024, 256, 1, 2048, 1024, 1024, 1024, 2048]
    - [85, 4.845]
  - - [1024, 256, 1, 4096, 1024, 1024, 1024, 4096]
    - [35, 7.037]
  - - [1024, 256, 1, 8192, 1024, 1024, 1024, 8192]
    - [29, 9.809]
  - - [1024, 512, 1, 128, 1024, 1024, 1024, 128]
    - [101, 1.933]
  - - [1024, 512, 1, 256, 1024, 1024, 1024, 256]
    - [100, 3.228]
  - - [1024, 512, 1, 512, 1024, 1024, 1024, 512]
    - [38, 4.854]
  - - [1024, 512, 1, 1024, 1024, 1024, 1024, 1024]
    - [96, 5.596]
  - - [1024, 512, 1, 2048, 1024, 1024, 1024, 2048]
    - [38, 6.322]
  - - [1024, 512, 1, 4096, 1024, 1024, 1024, 4096]
    - [60, 8.077]
  - - [1024, 512, 1, 8192, 1024, 1024, 1024, 8192]
    - [23, 11.531]
  - - [1024, 1024, 1, 128, 1024, 1024, 1024, 128]
    - [32, 3.038]
  - - [1024, 1024, 1, 256, 1024, 1024, 1024, 256]
    - [93, 4.891]
  - - [1024, 1024, 1, 512, 1024, 1024, 1024, 512]
    - [31, 7.009]
  - - [1024, 1024, 1, 1024, 1024, 1024, 1024, 1024]
    - [107, 7.587]
  - - [1024, 1024, 1, 2048, 1024, 1024, 1024, 2048]
    - [96, 8.567]
  - - [1024, 1024, 1, 4096, 1024, 1024, 1024, 4096]
    - [10, 11.043]
  - - [1024, 1024, 1, 8192, 1024, 1024, 1024, 8192]
    - [27, 11.567]
  - - [1024, 2048, 1, 128, 1024, 1024, 1024, 128]
    - [75, 4.289]
  - - [1024, 2048, 1, 256, 1024, 1024, 1024, 256]
    - [77, 6.305]
  - - [1024, 2048, 1, 512, 1024, 1024, 1024, 512]
    - [88, 8.021]
  - - [1024, 2048, 1, 1024, 1024, 1024, 1024, 1024]
    - [37, 9.52]
  - - [1024, 2048, 1, 2048, 1024, 1024, 1024, 2048]
    - [95, 10.587]
  - - [1024, 2048, 1, 4096, 1024, 1024, 1024, 4096]
    - [8, 11.556]
  - - [1024, 2048, 1, 8192, 1024, 1024, 1024, 8192]
    - [6, 14.247]
  - - [1024, 4096, 1, 128, 1024, 1024, 1024, 128]
    - [61, 5.66]
  - - [1024, 4096, 1, 256, 1024, 1024, 1024, 256]
    - [65, 8.109]
  - - [1024, 4096, 1, 512, 1024, 1024, 1024, 512]
    - [77, 9.705]
  - - [1024, 4096, 1, 1024, 1024, 1024, 1024, 1024]
    - [77, 11.548]
  - - [1024, 4096, 1, 2048, 1024, 1024, 1024, 2048]
    - [89, 12.644]
  - - [1024, 4096, 1, 4096, 1024, 1024, 1024, 4096]
    - [68, 14.373]
  - - [1024, 4096, 1, 8192, 1024, 1024, 1024, 8192]
    - [10, 16.293]
  - - [1024, 8192, 1, 128, 1024, 1024, 1024, 128]
    - [9, 6.101]
  - - [1024, 8192, 1, 256, 1024, 1024, 1024, 256]
    - [65, 8.943]
  - - [1024, 8192, 1, 512, 1024, 1024, 1024, 512]
    - [64, 11.63]
  - - [1024, 8192, 1, 1024, 1024, 1024, 1024, 1024]
    - [60, 14.078]
  - - [1024, 8192, 1, 2048, 1024, 1024, 1024, 2048]
    - [64, 14.293]
  - - [1024, 8192, 1, 4096, 1024, 1024, 1024, 4096]
    - [68, 16.195]
  - - [1024, 8192, 1, 8192, 1024, 1024, 1024, 8192]
    - [69, 17.777]
  - - [2048, 128, 1, 128, 2048, 2048, 2048, 128]
    - [45, 1.128]
  - - [2048, 128, 1, 256, 2048, 2048, 2048, 256]
    - [105, 1.853]
  - - [2048, 128, 1, 512, 2048, 2048, 2048, 512]
    - [47, 2.851]
  - - [2048, 128, 1, 1024, 2048, 2048, 2048, 1024]
    - [47, 3.967]
  - - [2048, 128, 1, 2048, 2048, 2048, 2048, 2048]
    - [85, 4.727]
  - - [2048, 128, 1, 4096, 2048, 2048, 2048, 4096]
    - [35, 7.031]
  - - [2048, 128, 1, 8192, 2048, 2048, 2048, 8192]
    - [29, 9.77]
  - - [2048, 256, 1, 128, 2048, 2048, 2048, 128]
    - [100, 1.925]
  - - [2048, 256, 1, 256, 2048, 2048, 2048, 256]
    - [100, 3.214]
  - - [2048, 256, 1, 512, 2048, 2048, 2048, 512]
    - [101, 4.817]
  - - [2048, 256, 1, 1024, 2048, 2048, 2048, 1024]
    - [97, 5.51]
  - - [2048, 256, 1, 2048, 2048, 2048, 2048, 2048]
    - [39, 6.279]
  - - [2048, 256, 1, 4096, 2048, 2048, 2048, 4096]
    - [60, 8.058]
  - - [2048, 256, 1, 8192, 2048, 2048, 2048, 8192]
    - [24, 11.487]
  - - [2048, 512, 1, 128, 2048, 2048, 2048, 128]
    - [31, 3.04]
  - - [2048, 512, 1, 256, 2048, 2048, 2048, 256]
    - [93, 4.862]
  - - [2048, 512, 1, 512, 2048, 2048, 2048, 512]
    - [32, 6.956]
  - - [2048, 512, 1, 1024, 2048, 2048, 2048, 1024]
    - [42, 7.486]
  - - [2048, 512, 1, 2048, 2048, 2048, 2048, 2048]
    - [99, 8.474]
  - - [2048, 512, 1, 4096, 2048, 2048, 2048, 4096]
    - [12, 11.034]
  - - [2048, 512, 1, 8192, 2048, 2048, 2048, 8192]
    - [24, 11.635]
  - - [2048, 1024, 1, 128, 2048, 2048, 2048, 128]
    - [75, 4.268]
  - - [2048, 1024, 1, 256, 2048, 2048, 2048, 256]
    - [73, 6.286]
  - - [2048, 1024, 1, 512, 2048, 2048, 2048, 512]
    - [89, 7.987]
  - - [2048, 1024, 1, 1024, 2048, 2048, 2048, 1024]
    - [36, 9.391]
  - - [2048, 1024, 1, 2048, 2048, 2048, 2048, 2048]
    - [35, 10.542]
  - - [2048, 1024, 1, 4096, 2048, 2048, 2048, 4096]
    - [13, 11.488]
  - - [2048, 1024, 1, 8192, 2048, 2048, 2048, 8192]
    - [64, 14.168]
  - - [2048, 2048, 1, 128, 2048, 2048, 2048, 128]
    - [61, 5.663]
  - - [2048, 2048, 1, 256, 2048, 2048, 2048, 256]
    - [14, 8.106]
  - - [2048, 2048, 1, 512, 2048, 2048, 2048, 512]
    - [19, 9.655]
  - - [2048, 2048, 1, 1024, 2048, 2048, 2048, 1024]
    - [76, 11.348]
  - - [2048, 2048, 1, 2048, 2048, 2048, 2048, 2048]
    - [89, 12.531]
  - - [2048, 2048, 1, 4096, 2048, 2048, 2048, 4096]
    - [62, 14.246]
  - - [2048, 2048, 1, 8192, 2048, 2048, 2048, 8192]
    - [10, 16.115]
  - - [2048, 4096, 1, 128, 2048, 2048, 2048, 128]
    - [65, 6.182]
  - - [2048, 4096, 1, 256, 2048, 2048, 2048, 256]
    - [63, 8.934]
  - - [2048, 4096, 1, 512, 2048, 2048, 2048, 512]
    - [65, 11.666]
  - - [2048, 4096, 1, 1024, 2048, 2048, 2048, 1024]
    - [64, 14.037]
  - - [2048, 4096, 1, 2048, 2048, 2048, 2048, 2048]
    - [66, 14.212]
  - - [2048, 4096, 1, 4096, 2048, 2048, 2048, 4096]
    - [60, 16.136]
  - - [2048, 4096, 1, 8192, 2048, 2048, 2048, 8192]
    - [10, 17.765]
  - - [2048, 8192, 1, 128, 2048, 2048, 2048, 128]
    - [53, 5.772]
  - - [2048, 8192, 1, 256, 2048, 2048, 2048, 256]
    - [54, 8.708]
  - - [2048, 8192, 1, 512, 2048, 2048, 2048, 512]
    - [53, 11.808]
  - - [2048, 8192, 1, 1024, 2048, 2048, 2048, 1024]
    - [51, 14.32]
  - - [2048, 8192, 1, 2048, 2048, 2048, 2048, 2048]
    - [68, 15.795]
  - - [2048, 8192, 1, 4096, 2048, 2048, 2048, 4096]
    - [58, 17.517]
  - - [2048, 8192, 1, 8192, 2048, 2048, 2048, 8192]
    - [59, 18.942]
  - - [4096, 128, 1, 128, 4096, 4096, 4096, 128]
    - [101, 1.932]
  - - [4096, 128, 1, 256, 4096, 4096, 4096, 256]
    - [38, 3.223]
  - - [4096, 128, 1, 512, 4096, 4096, 4096, 512]
    - [101, 4.835]
  - - [4096, 128, 1, 1024, 4096, 4096, 4096, 1024]
    - [96, 5.63]
  - - [4096, 128, 1, 2048, 4096, 4096, 4096, 2048]
    - [103, 6.13]
  - - [4096, 128, 1, 4096, 4096, 4096, 4096, 4096]
    - [21, 8.151]
  - - [4096, 128, 1, 8192, 4096, 4096, 4096, 8192]
    - [87, 11.545]
  - - [4096, 256, 1, 128, 4096, 4096, 4096, 128]
    - [30, 3.05]
  - - [4096, 256, 1, 256, 4096, 4096, 4096, 256]
    - [31, 4.905]
  - - [4096, 256, 1, 512, 4096, 4096, 4096, 512]
    - [93, 6.96]
  - - [4096, 256, 1, 1024, 4096, 4096, 4096, 1024]
    - [108, 7.444]
  - - [4096, 256, 1, 2048, 4096, 4096, 4096, 2048]
    - [98, 8.521]
  - - [4096, 256, 1, 4096, 4096, 4096, 4096, 4096]
    - [15, 10.966]
  - - [4096, 256, 1, 8192, 4096, 4096, 4096, 8192]
    - [25, 11.6]
  - - [4096, 512, 1, 128, 4096, 4096, 4096, 128]
    - [75, 4.256]
  - - [4096, 512, 1, 256, 4096, 4096, 4096, 256]
    - [81, 6.251]
  - - [4096, 512, 1, 512, 4096, 4096, 4096, 512]
    - [92, 7.848]
  - - [4096, 512, 1, 1024, 4096, 4096, 4096, 1024]
    - [35, 9.249]
  - - [4096, 512, 1, 2048, 4096, 4096, 4096, 2048]
    - [35, 10.509]
  - - [4096, 512, 1, 4096, 4096, 4096, 4096, 4096]
    - [74, 11.557]
  - - [4096, 512, 1, 8192, 4096, 4096, 4096, 8192]
    - [68, 14.159]
  - - [4096, 1024, 1, 128, 4096, 4096, 4096, 128]
    - [7, 5.701]
  - - [4096, 1024, 1, 256, 4096, 4096, 4096, 256]
    - [11, 8.08]
  - - [4096, 1024, 1, 512, 4096, 4096, 4096, 512]
    - [19, 9.646]
  - - [4096, 1024, 1, 1024, 4096, 4096, 4096, 1024]
    - [19, 11.208]
  - - [4096, 1024, 1, 2048, 4096, 4096, 4096, 2048]
    - [29, 12.63]
  - - [4096, 1024, 1, 4096, 4096, 4096, 4096, 4096]
    - [12, 14.288]
  - - [4096, 1024, 1, 8192, 4096, 4096, 4096, 8192]
    - [60, 16.129]
  - - [4096, 2048, 1, 128, 4096, 4096, 4096, 128]
    - [7, 6.147]
  - - [4096, 2048, 1, 256, 4096, 4096, 4096, 256]
    - [9, 8.959]
  - - [4096, 2048, 1, 512, 4096, 4096, 4096, 512]
    - [4, 11.683]
  - - [4096, 2048, 1, 1024, 4096, 4096, 4096, 1024]
    - [72, 13.828]
  - - [4096, 2048, 1, 2048, 4096, 4096, 4096, 2048]
    - [64, 14.283]
  - - [4096, 2048, 1, 4096, 4096, 4096, 4096, 4096]
    - [62, 16.19]
  - - [4096, 2048, 1, 8192, 4096, 4096, 4096, 8192]
    - [64, 17.729]
  - - [4096, 4096, 1, 128, 4096, 4096, 4096, 128]
    - [54, 5.8]
  - - [4096, 4096, 1, 256, 4096, 4096, 4096, 256]
    - [56, 8.732]
  - - [4096, 4096, 1, 512, 4096, 4096, 4096, 512]
    - [53, 11.802]
  - - [4096, 4096, 1, 1024, 4096, 4096, 4096, 1024]
    - [51, 14.305]
  - - [4096, 4096, 1, 2048, 4096, 4096, 4096, 2048]
    - [68, 15.687]
  - - [4096, 4096, 1, 4096, 4096, 4096, 4096, 4096]
    - [52, 17.622]
  - - [4096, 4096, 1, 8192, 4096, 4096, 4096, 8192]
    - [55, 19.029]
  - - [4096, 8192, 1, 128, 4096, 4096, 4096, 128]
    - [71, 6.505]
  - - [4096, 8192, 1, 256, 4096, 4096, 4096, 256]
    - [60, 8.699]
  - - [4096, 8192, 1, 512, 4096, 4096, 4096, 512]
    - [69, 11.971]
  - - [4096, 8192, 1, 1024, 4096, 4096, 4096, 1024]
    - [70, 14.985]
  - - [4096, 8192, 1, 2048, 4096, 4096, 4096, 2048]
    - [70, 17.249]
  - - [4096, 8192, 1, 4096, 4096, 4096, 4096, 4096]
    - [52, 18.589]
  - - [4096, 8192, 1, 8192, 4096, 4096, 4096, 8192]
    - [50, 19.401]
  - - [8192, 128, 1, 128, 8192, 8192, 8192, 128]
    - [34, 3.009]
  - - [8192, 128, 1, 256, 8192, 8192, 8192, 256]
    - [32, 4.693]
  - - [8192, 128, 1, 512, 8192, 8192, 8192, 512]
    - [93, 6.705]
  - - [8192, 128, 1, 1024, 8192, 8192, 8192, 1024]
    - [43, 7.138]
  - - [8192, 128, 1, 2048, 8192, 8192, 8192, 2048]
    - [97, 8.457]
  - - [8192, 128, 1, 4096, 8192, 8192, 8192, 4096]
    - [8, 11.093]
  - - [8192, 128, 1, 8192, 8192, 8192, 8192, 8192]
    - [26, 11.428]
  - - [8192, 256, 1, 128, 8192, 8192, 8192, 128]
    - [79, 4.125]
  - - [8192, 256, 1, 256, 8192, 8192, 8192, 256]
    - [78, 6.279]
  - - [8192, 256, 1, 512, 8192, 8192, 8192, 512]
    - [91, 7.823]
  - - [8192, 256, 1, 1024, 8192, 8192, 8192, 1024]
    - [35, 9.183]
  - - [8192, 256, 1, 2048, 8192, 8192, 8192, 2048]
    - [99, 10.47]
  - - [8192, 256, 1, 4096, 8192, 8192, 8192, 4096]
    - [74, 11.979]
  - - [8192, 256, 1, 8192, 8192, 8192, 8192, 8192]
    - [6, 14.248]
  - - [8192, 512, 1, 128, 8192, 8192, 8192, 128]
    - [5, 5.595]
  - - [8192, 512, 1, 256, 8192, 8192, 8192, 256]
    - [11, 8.042]
  - - [8192, 512, 1, 512, 8192, 8192, 8192, 512]
    - [18, 9.537]
  - - [8192, 512, 1, 1024, 8192, 8192, 8192, 1024]
    - [20, 11.267]
  - - [8192, 512, 1, 2048, 8192, 8192, 8192, 2048]
    - [28, 12.669]
  - - [8192, 512, 1, 4096, 8192, 8192, 8192, 4096]
    - [60, 14.196]
  - - [8192, 512, 1, 8192, 8192, 8192, 8192, 8192]
    - [8, 16.124]
  - - [8192, 1024, 1, 128, 8192, 8192, 8192, 128]
    - [5, 6.071]
  - - [8192, 1024, 1, 256, 8192, 8192, 8192, 256]
    - [5, 8.839]
  - - [8192, 1024, 1, 512, 8192, 8192, 8192, 512]
    - [4, 11.623]
  - - [8192, 1024, 1, 1024, 8192, 8192, 8192, 1024]
    - [10, 13.817]
  - - [8192, 1024, 1, 2048, 8192, 8192, 8192, 2048]
    - [64, 14.323]
  - - [8192, 1024, 1, 4096, 8192, 8192, 8192, 4096]
    - [60, 16.266]
  - - [8192, 1024, 1, 8192, 8192, 8192, 8192, 8192]
    - [60, 17.731]
  - - [8192, 2048, 1, 128, 8192, 8192, 8192, 128]
    - [56, 5.758]
  - - [8192, 2048, 1, 256, 8192, 8192, 8192, 256]
    - [1, 8.663]
  - - [8192, 2048, 1, 512, 8192, 8192, 8192, 512]
    - [2, 11.731]
  - - [8192, 2048, 1, 1024, 8192, 8192, 8192, 1024]
    - [0, 14.239]
  - - [8192, 2048, 1, 2048, 8192, 8192, 8192, 2048]
    - [60, 15.767]
  - - [8192, 2048, 1, 4096, 8192, 8192, 8192, 4096]
    - [50, 17.647]
  - - [8192, 2048, 1, 8192, 8192, 8192, 8192, 8192]
    - [50, 19.064]
  - - [8192, 4096, 1, 128, 8192, 8192, 8192, 128]
    - [67, 6.426]
  - - [8192, 4096, 1, 256, 8192, 8192, 8192, 256]
    - [70, 8.68]
  - - [8192, 4096, 1, 512, 8192, 8192, 8192, 512]
    - [69, 11.955]
  - - [8192, 4096, 1, 1024, 8192, 8192, 8192, 1024]
    - [69, 14.916]
  - - [8192, 4096, 1, 2048, 8192, 8192, 8192, 2048]
    - [70, 17.282]
  - - [8192, 4096, 1, 4096, 8192, 8192, 8192, 4096]
    - [50, 18.655]
  - - [8192, 4096, 1, 8192, 8192, 8192, 8192, 8192]
    - [55, 19.532]
  - - [8192, 8192, 1, 128, 8192, 8192, 8192, 128]
    - [19, 6.069]
  - - [8192, 8192, 1, 256, 8192, 8192, 8192, 256]
    - [4, 9.007]
  - - [8192, 8192, 1, 512, 8192, 8192, 8192, 512]
    - [69, 12.511]
  - - [8192, 8192, 1, 1024, 8192, 8192, 8192, 1024]
    - [70, 15.57]
  - - [8192, 8192, 1, 2048, 8192, 8192, 8192, 2048]
    - [72, 17.651]
  - - [8192, 8192, 1, 4096, 8192, 8192, 8192, 4096]
    - [57, 19.282]
  - - [8192, 8192, 1, 8192, 8192, 8192, 8192, 8192]
    - [3, 19.784]
  - - [1, 1, 1, 32, 1, 1, 1, 32]
    - [115, 0.0]
- null
- null
- DeviceEfficiency
- GridBased
