library/src/amd_detail/rocblaslt/src/Tensile/Logic/streamk/gfx942_80cu/aquavanjaram942_Cijk_Alik_Bljk_BBS_BH_UserArgs.yaml
- {MinimumRequiredVersion: 4.33.0}
- aquavanjaram942
- {Architecture: gfx942, CUCount: 80}
- [Device 0049, Device 0050]
    SolutionIndex: 0
    SolutionNameMin: Cijk_Alik_Bljk_BBS_BH_UserArgs_MT256x64x32_MI16x16x1_SN_LDSB1_CLR1_GSU0_GSUC0_GSUWGMRR0_K1_LBSPPA512_LBSPPB128_MIWT8_2_PLR1_SU32_SUM0_SUS256_SKXCCM0_VWA8_VWB2_WGM1_WGMXCC1_WGMXCCGn1
    SolutionIndex: 1
    SolutionNameMin: Cijk_Alik_Bljk_BBS_BH_UserArgs_MT128x128x32_MI16x16x1_SN_LDSB1_CLR1_GSU0_GSUC0_GSUWGMRR0_K1_LBSPPA128_LBSPPB128_MIWT4_4_PLR1_SU32_SUM0_SUS256_SKXCCM0_VWA2_VWB1_WGM1_WGMXCC1_WGMXCCGn1
    SolutionIndex: 2
    SolutionNameMin: Cijk_Alik_Bljk_BBS_BH_UserArgs_MT128x128x32_MI16x16x1_SN_LDSB1_CLR1_GSU0_GSUC0_GSUWGMRR0_K1_LBSPPA256_LBSPPB128_MIWT4_4_PLR1_SU32_SUM0_SUS256_SKXCCM0_VWA4_VWB1_WGM1_WGMXCC1_WGMXCCGn1
    SolutionIndex: 3
    SolutionNameMin: Cijk_Alik_Bljk_BBS_BH_UserArgs_MT128x128x32_MI16x16x1_SN_LDSB1_CLR1_GSU0_GSUC0_GSUWGMRR0_K1_LBSPPA128_LBSPPB128_MIWT4_4_PLR1_SU32_SUM0_SUS256_SKXCCM0_VWA2_VWB2_WGM1_WGMXCC1_WGMXCCGn1
    SolutionIndex: 4
    SolutionNameMin: Cijk_Alik_Bljk_BBS_BH_UserArgs_MT128x128x32_MI16x16x1_SN_LDSB1_CLR1_GSU0_GSUC0_GSUWGMRR0_K1_LBSPPA256_LBSPPB256_MIWT4_4_PLR1_SU32_SUM0_SUS256_SKXCCM0_VWA4_VWB4_WGM1_WGMXCC1_WGMXCCGn1
    SolutionIndex: 5
    SolutionNameMin: Cijk_Alik_Bljk_BBS_BH_UserArgs_MT128x128x32_MI16x16x1_SN_LDSB1_CLR1_GSU0_GSUC0_GSUWGMRR0_K1_LBSPPA128_LBSPPB128_MIWT4_4_PLR1_SU32_SUM0_SUS256_SKXCCM0_VWA2_VWB1_WGM2_WGMXCC1_WGMXCCGn1
    SolutionIndex: 6
    SolutionNameMin: Cijk_Alik_Bljk_BBS_BH_UserArgs_MT128x128x64_MI16x16x1_SN_LDSB1_CLR1_GSU0_GSUC0_GSUWGMRR0_K1_LBSPPA512_LBSPPB128_MIWT4_4_PLR1_SU32_SUM0_SUS256_SKXCCM0_VWA4_VWB1_WGM1_WGMXCC1_WGMXCCGn1
    SolutionIndex: 7
    SolutionNameMin: Cijk_Alik_Bljk_BBS_BH_UserArgs_MT128x128x64_MI16x16x1_SN_LDSB1_CLR1_GSU0_GSUC0_GSUWGMRR0_K1_LBSPPA256_LBSPPB256_MIWT4_4_PLR1_SU32_SUM0_SUS256_SKXCCM0_VWA2_VWB2_WGM1_WGMXCC1_WGMXCCGn1
    SolutionIndex: 8
    SolutionNameMin: Cijk_Alik_Bljk_BBS_BH_UserArgs_MT128x128x64_MI16x16x1_SN_LDSB1_CLR1_GSU0_GSUC0_GSUWGMRR0_K1_LBSPPA512_LBSPPB256_MIWT4_4_PLR1_SU32_SUM0_SUS256_SKXCCM0_VWA4_VWB2_WGM1_WGMXCC1_WGMXCCGn1
    SolutionIndex: 9
    SolutionNameMin: Cijk_Alik_Bljk_BBS_BH_UserArgs_MT128x128x64_MI16x16x1_SN_LDSB1_CLR1_GSU0_GSUC0_GSUWGMRR0_K1_LBSPPA512_LBSPPB512_MIWT4_4_PLR1_SU32_SUM0_SUS256_SKXCCM0_VWA4_VWB4_WGM1_WGMXCC1_WGMXCCGn1
    SolutionIndex: 10
    SolutionNameMin: Cijk_Alik_Bljk_BBS_BH_UserArgs_MT128x128x64_MI16x16x1_SN_LDSB1_CLR1_GSU0_GSUC0_GSUWGMRR0_K1_LBSPPA512_LBSPPB128_MIWT4_4_PLR1_SU32_SUM0_SUS256_SKXCCM0_VWA4_VWB1_WGM2_WGMXCC1_WGMXCCGn1
    SolutionIndex: 11
    SolutionNameMin: Cijk_Alik_Bljk_BBS_BH_UserArgs_MT128x128x64_MI16x16x1_SN_LDSB1_CLR1_GSU0_GSUC0_GSUWGMRR0_K1_LBSPPA512_LBSPPB256_MIWT4_4_PLR1_SU32_SUM0_SUS256_SKXCCM0_VWA4_VWB2_WGM2_WGMXCC1_WGMXCCGn1
    SolutionIndex: 12
    SolutionNameMin: Cijk_Alik_Bljk_BBS_BH_UserArgs_MT128x128x64_MI16x16x1_SN_LDSB1_CLR1_GSU0_GSUC0_GSUWGMRR0_K1_LBSPPA256_LBSPPB256_MIWT4_4_PLR1_SU32_SUM0_SUS256_SKXCCM0_VWA2_VWB2_WGM4_WGMXCC1_WGMXCCGn1
    SolutionIndex: 13
    SolutionNameMin: Cijk_Alik_Bljk_BBS_BH_UserArgs_MT128x128x64_MI16x16x1_SN_LDSB1_CLR1_GSU0_GSUC0_GSUWGMRR0_K1_LBSPPA512_LBSPPB256_MIWT4_4_PLR1_SU32_SUM0_SUS256_SKXCCM0_VWA4_VWB2_WGM4_WGMXCC1_WGMXCCGn1
    SolutionIndex: 14
    SolutionNameMin: Cijk_Alik_Bljk_BBS_BH_UserArgs_MT128x128x64_MI16x16x1_SN_LDSB1_CLR1_GSU0_GSUC0_GSUWGMRR0_K1_LBSPPA512_LBSPPB512_MIWT4_4_PLR1_SU32_SUM0_SUS256_SKXCCM0_VWA4_VWB4_WGM4_WGMXCC1_WGMXCCGn1
    SolutionIndex: 15
    SolutionNameMin: Cijk_Alik_Bljk_BBS_BH_UserArgs_MT64x128x64_MI16x16x1_SN_LDSB1_CLR1_GSU0_GSUC0_GSUWGMRR0_K1_LBSPPA256_LBSPPB256_MIWT2_4_PLR1_SU32_SUM0_SUS256_SKXCCM0_VWA2_VWB2_WGM1_WGMXCC1_WGMXCCGn1
    SolutionIndex: 16
    SolutionNameMin: Cijk_Alik_Bljk_BBS_BH_UserArgs_MT64x128x64_MI16x16x1_SN_LDSB1_CLR1_GSU0_GSUC0_GSUWGMRR0_K1_LBSPPA256_LBSPPB512_MIWT2_4_PLR1_SU32_SUM0_SUS256_SKXCCM0_VWA2_VWB4_WGM1_WGMXCC1_WGMXCCGn1
    SolutionIndex: 17
    SolutionNameMin: Cijk_Alik_Bljk_BBS_BH_UserArgs_MT64x128x64_MI16x16x1_SN_LDSB1_CLR1_GSU0_GSUC0_GSUWGMRR0_K1_LBSPPA256_LBSPPB256_MIWT2_4_PLR1_SU32_SUM0_SUS256_SKXCCM0_VWA2_VWB2_WGM4_WGMXCC1_WGMXCCGn1
    SolutionIndex: 18
    SolutionNameMin: Cijk_Alik_Bljk_BBS_BH_UserArgs_MT128x64x64_MI16x16x1_SN_LDSB1_CLR1_GSU0_GSUC0_GSUWGMRR0_K1_LBSPPA256_LBSPPB128_MIWT4_2_PLR1_SU32_SUM0_SUS256_SKXCCM0_VWA2_VWB1_WGM1_WGMXCC1_WGMXCCGn1
    SolutionIndex: 19
    SolutionNameMin: Cijk_Alik_Bljk_BBS_BH_UserArgs_MT128x64x64_MI16x16x1_SN_LDSB1_CLR1_GSU0_GSUC0_GSUWGMRR0_K1_LBSPPA512_LBSPPB128_MIWT4_2_PLR1_SU32_SUM0_SUS256_SKXCCM0_VWA4_VWB1_WGM1_WGMXCC1_WGMXCCGn1
    SolutionIndex: 20
    SolutionNameMin: Cijk_Alik_Bljk_BBS_BH_UserArgs_MT128x64x64_MI16x16x1_SN_LDSB1_CLR1_GSU0_GSUC0_GSUWGMRR0_K1_LBSPPA512_LBSPPB256_MIWT4_2_PLR1_SU32_SUM0_SUS256_SKXCCM0_VWA4_VWB2_WGM1_WGMXCC1_WGMXCCGn1
    SolutionIndex: 21
    SolutionNameMin: Cijk_Alik_Bljk_BBS_BH_UserArgs_MT128x64x64_MI16x16x1_SN_LDSB1_CLR1_GSU0_GSUC0_GSUWGMRR0_K1_LBSPPA512_LBSPPB256_MIWT4_2_PLR1_SU32_SUM0_SUS256_SKXCCM0_VWA4_VWB2_WGM2_WGMXCC1_WGMXCCGn1
    SolutionIndex: 22
    SolutionNameMin: Cijk_Alik_Bljk_BBS_BH_UserArgs_MT64x64x64_MI16x16x1_SN_LDSB1_CLR1_GSU0_GSUC0_GSUWGMRR0_K1_LBSPPA256_LBSPPB128_MIWT2_2_PLR1_SU32_SUM0_SUS256_SKXCCM0_VWA2_VWB1_WGM1_WGMXCC1_WGMXCCGn1
    SolutionIndex: 23
    SolutionNameMin: Cijk_Alik_Bljk_BBS_BH_UserArgs_MT64x64x64_MI16x16x1_SN_LDSB1_CLR1_GSU0_GSUC0_GSUWGMRR0_K1_LBSPPA256_LBSPPB256_MIWT2_2_PLR1_SU32_SUM0_SUS256_SKXCCM0_VWA2_VWB2_WGM1_WGMXCC1_WGMXCCGn1
    SolutionIndex: 24
    SolutionNameMin: Cijk_Alik_Bljk_BBS_BH_UserArgs_MT64x64x64_MI16x16x1_SN_LDSB1_CLR1_GSU0_GSUC0_GSUWGMRR0_K1_LBSPPA256_LBSPPB256_MIWT2_2_PLR1_SU32_SUM0_SUS256_SKXCCM0_VWA2_VWB2_WGM2_WGMXCC1_WGMXCCGn1
    SolutionIndex: 25
    SolutionNameMin: Cijk_Alik_Bljk_BBS_BH_UserArgs_MT64x64x64_MI16x16x1_SN_LDSB1_CLR1_GSU0_GSUC0_GSUWGMRR0_K1_LBSPPA256_LBSPPB256_MIWT2_2_PLR1_SU32_SUM0_SUS256_SKXCCM0_VWA2_VWB2_WGM4_WGMXCC1_WGMXCCGn1
    SolutionIndex: 26
    SolutionNameMin: Cijk_Alik_Bljk_BBS_BH_UserArgs_MT32x64x64_MI16x16x1_SN_LDSB0_CLR1_GSU0_GSUC0_GSUWGMRR0_K1_LBSPPA128_LBSPPB128_MIWT1_2_PLR1_SU32_SUM0_SUS256_SKXCCM0_VWA1_VWB1_WGM1_WGMXCC1_WGMXCCGn1
    SolutionIndex: 27
    SolutionNameMin: Cijk_Alik_Bljk_BBS_BH_UserArgs_MT32x64x64_MI16x16x1_SN_LDSB0_CLR1_GSU0_GSUC0_GSUWGMRR0_K1_LBSPPA128_LBSPPB256_MIWT1_2_PLR1_SU32_SUM0_SUS256_SKXCCM0_VWA1_VWB2_WGM1_WGMXCC1_WGMXCCGn1
    SolutionIndex: 28
    SolutionNameMin: Cijk_Alik_Bljk_BBS_BH_UserArgs_MT64x32x64_MI16x16x1_SN_LDSB0_CLR1_GSU0_GSUC0_GSUWGMRR0_K1_LBSPPA256_LBSPPB128_MIWT2_1_PLR1_SU32_SUM0_SUS256_SKXCCM0_VWA2_VWB1_WGM1_WGMXCC1_WGMXCCGn1
    SolutionIndex: 29
    SolutionNameMin: Cijk_Alik_Bljk_BBS_BH_UserArgs_MT64x32x64_MI16x16x1_SN_LDSB0_CLR1_GSU0_GSUC0_GSUWGMRR0_K1_LBSPPA256_LBSPPB128_MIWT2_1_PLR2_SU32_SUM0_SUS256_SKXCCM0_VWA2_VWB1_WGM1_WGMXCC1_WGMXCCGn1
    SolutionIndex: 30
    SolutionNameMin: Cijk_Alik_Bljk_BBS_BH_UserArgs_MT32x32x64_MI16x16x1_SN_LDSB0_CLR1_GSU0_GSUC0_GSUWGMRR0_K1_LBSPPA128_LBSPPB128_MIWT1_1_PLR1_SU32_SUM0_SUS256_SKXCCM0_VWA1_VWB1_WGM1_WGMXCC1_WGMXCCGn1
    SolutionIndex: 31
    SolutionNameMin: Cijk_Alik_Bljk_BBS_BH_UserArgs_MT64x64x128_MI16x16x1_SN_LDSB1_CLR1_GSU0_GSUC0_GSUWGMRR0_K1_LBSPPA512_LBSPPB512_MIWT2_2_PLR1_SU32_SUM0_SUS256_SKXCCM0_VWA2_VWB2_WGM1_WGMXCC1_WGMXCCGn1
    SolutionIndex: 32
    SolutionNameMin: Cijk_Alik_Bljk_BBS_BH_UserArgs_MT32x64x128_MI16x16x1_SN_LDSB1_CLR1_GSU0_GSUC0_GSUWGMRR0_K1_LBSPPA256_LBSPPB512_MIWT1_2_PLR2_SU32_SUM0_SUS256_SKXCCM0_VWA1_VWB2_WGM1_WGMXCC1_WGMXCCGn1
    SolutionIndex: 33
    SolutionNameMin: Cijk_Alik_Bljk_BBS_BH_UserArgs_MT64x32x128_MI16x16x1_SN_LDSB1_CLR1_GSU0_GSUC0_GSUWGMRR0_K1_LBSPPA512_LBSPPB256_MIWT2_1_PLR1_SU32_SUM0_SUS256_SKXCCM0_VWA2_VWB1_WGM1_WGMXCC1_WGMXCCGn1
    SolutionIndex: 34
    SolutionNameMin: Cijk_Alik_Bljk_BBS_BH_UserArgs_MT64x32x128_MI16x16x1_SN_LDSB1_CLR1_GSU0_GSUC0_GSUWGMRR0_K1_LBSPPA512_LBSPPB256_MIWT2_1_PLR2_SU32_SUM0_SUS256_SKXCCM0_VWA2_VWB1_WGM1_WGMXCC1_WGMXCCGn1
    SolutionIndex: 35
    SolutionNameMin: Cijk_Alik_Bljk_BBS_BH_UserArgs_MT64x32x128_MI16x16x1_SN_LDSB1_CLR1_GSU0_GSUC0_GSUWGMRR0_K1_LBSPPA512_LBSPPB256_MIWT2_1_PLR1_SU32_SUM0_SUS256_SKXCCM0_VWA2_VWB1_WGM2_WGMXCC1_WGMXCCGn1
    SolutionIndex: 36
    SolutionNameMin: Cijk_Alik_Bljk_BBS_BH_UserArgs_MT32x32x128_MI16x16x1_SN_LDSB1_CLR1_GSU0_GSUC0_GSUWGMRR0_K1_LBSPPA256_LBSPPB256_MIWT1_1_PLR1_SU32_SUM0_SUS256_SKXCCM0_VWA1_VWB1_WGM1_WGMXCC1_WGMXCCGn1
    SolutionIndex: 37
    SolutionNameMin: Cijk_Alik_Bljk_BBS_BH_UserArgs_MT32x32x128_MI16x16x1_SN_LDSB1_CLR1_GSU0_GSUC0_GSUWGMRR0_K1_LBSPPA256_LBSPPB256_MIWT1_1_PLR2_SU32_SUM0_SUS256_SKXCCM0_VWA1_VWB1_WGM1_WGMXCC1_WGMXCCGn1
    SolutionIndex: 38
    SolutionNameMin: Cijk_Alik_Bljk_BBS_BH_UserArgs_MT128x128x32_MI16x16x1_SN_LDSB1_CLR1_GSU0_GSUC0_GSUWGMRR0_K1_LBSPPA128_LBSPPB128_MIWT4_4_PLR1_SU32_SUM0_SUS256_SKXCCM4_VWA2_VWB1_WGM1_WGMXCC1_WGMXCCGn1
    SolutionIndex: 39
    SolutionNameMin: Cijk_Alik_Bljk_BBS_BH_UserArgs_MT128x128x32_MI16x16x1_SN_LDSB1_CLR1_GSU0_GSUC0_GSUWGMRR0_K1_LBSPPA128_LBSPPB128_MIWT4_4_PLR1_SU32_SUM0_SUS256_SKXCCM4_VWA2_VWB2_WGM1_WGMXCC1_WGMXCCGn1
    SolutionIndex: 40
    SolutionNameMin: Cijk_Alik_Bljk_BBS_BH_UserArgs_MT128x128x32_MI16x16x1_SN_LDSB1_CLR1_GSU0_GSUC0_GSUWGMRR0_K1_LBSPPA256_LBSPPB128_MIWT4_4_PLR1_SU32_SUM0_SUS256_SKXCCM4_VWA4_VWB2_WGM1_WGMXCC1_WGMXCCGn1
    SolutionIndex: 41
    SolutionNameMin: Cijk_Alik_Bljk_BBS_BH_UserArgs_MT128x128x32_MI16x16x1_SN_LDSB1_CLR1_GSU0_GSUC0_GSUWGMRR0_K1_LBSPPA128_LBSPPB256_MIWT4_4_PLR1_SU32_SUM0_SUS256_SKXCCM4_VWA2_VWB4_WGM1_WGMXCC1_WGMXCCGn1
    SolutionIndex: 42
    SolutionNameMin: Cijk_Alik_Bljk_BBS_BH_UserArgs_MT128x128x32_MI16x16x1_SN_LDSB1_CLR1_GSU0_GSUC0_GSUWGMRR0_K1_LBSPPA128_LBSPPB128_MIWT4_4_PLR1_SU32_SUM0_SUS256_SKXCCM4_VWA2_VWB2_WGM2_WGMXCC1_WGMXCCGn1
    SolutionIndex: 43
    SolutionNameMin: Cijk_Alik_Bljk_BBS_BH_UserArgs_MT128x128x32_MI16x16x1_SN_LDSB1_CLR1_GSU0_GSUC0_GSUWGMRR0_K1_LBSPPA128_LBSPPB128_MIWT4_4_PLR1_SU32_SUM0_SUS256_SKXCCM4_VWA2_VWB1_WGM4_WGMXCC1_WGMXCCGn1
    SolutionIndex: 44
    SolutionNameMin: Cijk_Alik_Bljk_BBS_BH_UserArgs_MT128x128x32_MI16x16x1_SN_LDSB1_CLR1_GSU0_GSUC0_GSUWGMRR0_K1_LBSPPA256_LBSPPB128_MIWT4_4_PLR1_SU32_SUM0_SUS256_SKXCCM4_VWA4_VWB1_WGM4_WGMXCC1_WGMXCCGn1
    SolutionIndex: 45
    SolutionNameMin: Cijk_Alik_Bljk_BBS_BH_UserArgs_MT128x128x32_MI16x16x1_SN_LDSB1_CLR1_GSU0_GSUC0_GSUWGMRR0_K1_LBSPPA256_LBSPPB128_MIWT4_4_PLR1_SU32_SUM0_SUS256_SKXCCM4_VWA4_VWB2_WGM4_WGMXCC1_WGMXCCGn1
    SolutionIndex: 46
    SolutionNameMin: Cijk_Alik_Bljk_BBS_BH_UserArgs_MT128x128x32_MI16x16x1_SN_LDSB1_CLR1_GSU0_GSUC0_GSUWGMRR0_K1_LBSPPA128_LBSPPB256_MIWT4_4_PLR1_SU32_SUM0_SUS256_SKXCCM4_VWA2_VWB4_WGM4_WGMXCC1_WGMXCCGn1
    SolutionIndex: 47
    SolutionNameMin: Cijk_Alik_Bljk_BBS_BH_UserArgs_MT128x128x32_MI16x16x1_SN_LDSB1_CLR1_GSU0_GSUC0_GSUWGMRR0_K1_LBSPPA256_LBSPPB256_MIWT4_4_PLR1_SU32_SUM0_SUS256_SKXCCM4_VWA4_VWB4_WGM4_WGMXCC1_WGMXCCGn1
    SolutionIndex: 48
    SolutionNameMin: Cijk_Alik_Bljk_BBS_BH_UserArgs_MT128x64x32_MI16x16x1_SN_LDSB0_CLR1_GSU0_GSUC0_GSUWGMRR0_K1_LBSPPA256_LBSPPB128_MIWT4_2_PLR1_SU32_SUM0_SUS256_SKXCCM4_VWA4_VWB1_WGM1_WGMXCC1_WGMXCCGn1
    SolutionIndex: 49
    SolutionNameMin: Cijk_Alik_Bljk_BBS_BH_UserArgs_MT128x64x32_MI16x16x1_SN_LDSB0_CLR1_GSU0_GSUC0_GSUWGMRR0_K1_LBSPPA256_LBSPPB128_MIWT4_2_PLR1_SU32_SUM0_SUS256_SKXCCM4_VWA4_VWB2_WGM1_WGMXCC1_WGMXCCGn1
    SolutionIndex: 50
    SolutionNameMin: Cijk_Alik_Bljk_BBS_BH_UserArgs_MT128x64x32_MI16x16x1_SN_LDSB0_CLR1_GSU0_GSUC0_GSUWGMRR0_K1_LBSPPA256_LBSPPB128_MIWT4_2_PLR1_SU32_SUM0_SUS256_SKXCCM4_VWA4_VWB1_WGM2_WGMXCC1_WGMXCCGn1
    SolutionIndex: 51
    SolutionNameMin: Cijk_Alik_Bljk_BBS_BH_UserArgs_MT128x64x32_MI16x16x1_SN_LDSB0_CLR1_GSU0_GSUC0_GSUWGMRR0_K1_LBSPPA256_LBSPPB128_MIWT4_2_PLR1_SU32_SUM0_SUS256_SKXCCM4_VWA4_VWB2_WGM2_WGMXCC1_WGMXCCGn1
    SolutionIndex: 52
    SolutionNameMin: Cijk_Alik_Bljk_BBS_BH_UserArgs_MT128x128x64_MI16x16x1_SN_LDSB1_CLR1_GSU0_GSUC0_GSUWGMRR0_K1_LBSPPA256_LBSPPB128_MIWT4_4_PLR1_SU32_SUM0_SUS256_SKXCCM4_VWA2_VWB1_WGM1_WGMXCC1_WGMXCCGn1
    SolutionIndex: 53
    SolutionNameMin: Cijk_Alik_Bljk_BBS_BH_UserArgs_MT128x128x64_MI16x16x1_SN_LDSB1_CLR1_GSU0_GSUC0_GSUWGMRR0_K1_LBSPPA512_LBSPPB128_MIWT4_4_PLR1_SU32_SUM0_SUS256_SKXCCM4_VWA4_VWB1_WGM1_WGMXCC1_WGMXCCGn1
    SolutionIndex: 54
    SolutionNameMin: Cijk_Alik_Bljk_BBS_BH_UserArgs_MT128x128x64_MI16x16x1_SN_LDSB1_CLR1_GSU0_GSUC0_GSUWGMRR0_K1_LBSPPA256_LBSPPB256_MIWT4_4_PLR1_SU32_SUM0_SUS256_SKXCCM4_VWA2_VWB2_WGM1_WGMXCC1_WGMXCCGn1
    SolutionIndex: 55
    SolutionNameMin: Cijk_Alik_Bljk_BBS_BH_UserArgs_MT128x128x64_MI16x16x1_SN_LDSB1_CLR1_GSU0_GSUC0_GSUWGMRR0_K1_LBSPPA512_LBSPPB256_MIWT4_4_PLR1_SU32_SUM0_SUS256_SKXCCM4_VWA4_VWB2_WGM1_WGMXCC1_WGMXCCGn1
    SolutionIndex: 56
    SolutionNameMin: Cijk_Alik_Bljk_BBS_BH_UserArgs_MT128x128x64_MI16x16x1_SN_LDSB1_CLR1_GSU0_GSUC0_GSUWGMRR0_K1_LBSPPA512_LBSPPB512_MIWT4_4_PLR1_SU32_SUM0_SUS256_SKXCCM4_VWA4_VWB4_WGM1_WGMXCC1_WGMXCCGn1
    SolutionIndex: 57
    SolutionNameMin: Cijk_Alik_Bljk_BBS_BH_UserArgs_MT128x128x64_MI16x16x1_SN_LDSB1_CLR1_GSU0_GSUC0_GSUWGMRR0_K1_LBSPPA512_LBSPPB128_MIWT4_4_PLR1_SU32_SUM0_SUS256_SKXCCM4_VWA4_VWB1_WGM2_WGMXCC1_WGMXCCGn1
    SolutionIndex: 58
    SolutionNameMin: Cijk_Alik_Bljk_BBS_BH_UserArgs_MT128x128x64_MI16x16x1_SN_LDSB1_CLR1_GSU0_GSUC0_GSUWGMRR0_K1_LBSPPA256_LBSPPB256_MIWT4_4_PLR1_SU32_SUM0_SUS256_SKXCCM4_VWA2_VWB2_WGM2_WGMXCC1_WGMXCCGn1
    SolutionIndex: 59
    SolutionNameMin: Cijk_Alik_Bljk_BBS_BH_UserArgs_MT128x128x64_MI16x16x1_SN_LDSB1_CLR1_GSU0_GSUC0_GSUWGMRR0_K1_LBSPPA512_LBSPPB256_MIWT4_4_PLR1_SU32_SUM0_SUS256_SKXCCM4_VWA4_VWB2_WGM2_WGMXCC1_WGMXCCGn1
    SolutionIndex: 60
    SolutionNameMin: Cijk_Alik_Bljk_BBS_BH_UserArgs_MT128x128x64_MI16x16x1_SN_LDSB1_CLR1_GSU0_GSUC0_GSUWGMRR0_K1_LBSPPA512_LBSPPB512_MIWT4_4_PLR1_SU32_SUM0_SUS256_SKXCCM4_VWA4_VWB4_WGM2_WGMXCC1_WGMXCCGn1
    SolutionIndex: 61
    SolutionNameMin: Cijk_Alik_Bljk_BBS_BH_UserArgs_MT128x128x64_MI16x16x1_SN_LDSB1_CLR1_GSU0_GSUC0_GSUWGMRR0_K1_LBSPPA512_LBSPPB128_MIWT4_4_PLR1_SU32_SUM0_SUS256_SKXCCM4_VWA4_VWB1_WGM4_WGMXCC1_WGMXCCGn1
    SolutionIndex: 62
    SolutionNameMin: Cijk_Alik_Bljk_BBS_BH_UserArgs_MT128x128x64_MI16x16x1_SN_LDSB1_CLR1_GSU0_GSUC0_GSUWGMRR0_K1_LBSPPA512_LBSPPB256_MIWT4_4_PLR1_SU32_SUM0_SUS256_SKXCCM4_VWA4_VWB2_WGM4_WGMXCC1_WGMXCCGn1
    SolutionIndex: 63
    SolutionNameMin: Cijk_Alik_Bljk_BBS_BH_UserArgs_MT128x128x64_MI16x16x1_SN_LDSB1_CLR1_GSU0_GSUC0_GSUWGMRR0_K1_LBSPPA256_LBSPPB512_MIWT4_4_PLR1_SU32_SUM0_SUS256_SKXCCM4_VWA2_VWB4_WGM4_WGMXCC1_WGMXCCGn1
    SolutionIndex: 64
    SolutionNameMin: Cijk_Alik_Bljk_BBS_BH_UserArgs_MT128x128x64_MI16x16x1_SN_LDSB1_CLR1_GSU0_GSUC0_GSUWGMRR0_K1_LBSPPA512_LBSPPB512_MIWT4_4_PLR1_SU32_SUM0_SUS256_SKXCCM4_VWA4_VWB4_WGM4_WGMXCC1_WGMXCCGn1
    SolutionIndex: 65
    SolutionNameMin: Cijk_Alik_Bljk_BBS_BH_UserArgs_MT64x128x64_MI16x16x1_SN_LDSB1_CLR1_GSU0_GSUC0_GSUWGMRR0_K1_LBSPPA128_LBSPPB128_MIWT2_4_PLR1_SU32_SUM0_SUS256_SKXCCM4_VWA1_VWB1_WGM1_WGMXCC1_WGMXCCGn1
    SolutionIndex: 66
    SolutionNameMin: Cijk_Alik_Bljk_BBS_BH_UserArgs_MT64x128x64_MI16x16x1_SN_LDSB1_CLR1_GSU0_GSUC0_GSUWGMRR0_K1_LBSPPA256_LBSPPB128_MIWT2_4_PLR1_SU32_SUM0_SUS256_SKXCCM4_VWA2_VWB1_WGM1_WGMXCC1_WGMXCCGn1
    SolutionIndex: 67
    SolutionNameMin: Cijk_Alik_Bljk_BBS_BH_UserArgs_MT64x128x64_MI16x16x1_SN_LDSB1_CLR1_GSU0_GSUC0_GSUWGMRR0_K1_LBSPPA128_LBSPPB256_MIWT2_4_PLR1_SU32_SUM0_SUS256_SKXCCM4_VWA1_VWB2_WGM1_WGMXCC1_WGMXCCGn1
    SolutionIndex: 68
    SolutionNameMin: Cijk_Alik_Bljk_BBS_BH_UserArgs_MT64x128x64_MI16x16x1_SN_LDSB1_CLR1_GSU0_GSUC0_GSUWGMRR0_K1_LBSPPA256_LBSPPB256_MIWT2_4_PLR1_SU32_SUM0_SUS256_SKXCCM4_VWA2_VWB2_WGM1_WGMXCC1_WGMXCCGn1
    SolutionIndex: 69
    SolutionNameMin: Cijk_Alik_Bljk_BBS_BH_UserArgs_MT64x128x64_MI16x16x1_SN_LDSB1_CLR1_GSU0_GSUC0_GSUWGMRR0_K1_LBSPPA256_LBSPPB512_MIWT2_4_PLR1_SU32_SUM0_SUS256_SKXCCM4_VWA2_VWB4_WGM1_WGMXCC1_WGMXCCGn1
    SolutionIndex: 70
    SolutionNameMin: Cijk_Alik_Bljk_BBS_BH_UserArgs_MT64x128x64_MI16x16x1_SN_LDSB1_CLR1_GSU0_GSUC0_GSUWGMRR0_K1_LBSPPA256_LBSPPB128_MIWT2_4_PLR1_SU32_SUM0_SUS256_SKXCCM4_VWA2_VWB1_WGM2_WGMXCC1_WGMXCCGn1
    SolutionIndex: 71
    SolutionNameMin: Cijk_Alik_Bljk_BBS_BH_UserArgs_MT64x128x64_MI16x16x1_SN_LDSB1_CLR1_GSU0_GSUC0_GSUWGMRR0_K1_LBSPPA256_LBSPPB128_MIWT2_4_PLR1_SU32_SUM0_SUS256_SKXCCM4_VWA2_VWB1_WGM4_WGMXCC1_WGMXCCGn1
    SolutionIndex: 72
    SolutionNameMin: Cijk_Alik_Bljk_BBS_BH_UserArgs_MT128x64x64_MI16x16x1_SN_LDSB1_CLR1_GSU0_GSUC0_GSUWGMRR0_K1_LBSPPA256_LBSPPB128_MIWT4_2_PLR1_SU32_SUM0_SUS256_SKXCCM4_VWA2_VWB1_WGM1_WGMXCC1_WGMXCCGn1
    SolutionIndex: 73
    SolutionNameMin: Cijk_Alik_Bljk_BBS_BH_UserArgs_MT128x64x64_MI16x16x1_SN_LDSB1_CLR1_GSU0_GSUC0_GSUWGMRR0_K1_LBSPPA512_LBSPPB128_MIWT4_2_PLR1_SU32_SUM0_SUS256_SKXCCM4_VWA4_VWB1_WGM1_WGMXCC1_WGMXCCGn1
    SolutionIndex: 74
    SolutionNameMin: Cijk_Alik_Bljk_BBS_BH_UserArgs_MT128x64x64_MI16x16x1_SN_LDSB1_CLR1_GSU0_GSUC0_GSUWGMRR0_K1_LBSPPA256_LBSPPB256_MIWT4_2_PLR1_SU32_SUM0_SUS256_SKXCCM4_VWA2_VWB2_WGM1_WGMXCC1_WGMXCCGn1
    SolutionIndex: 75
    SolutionNameMin: Cijk_Alik_Bljk_BBS_BH_UserArgs_MT128x64x64_MI16x16x1_SN_LDSB1_CLR1_GSU0_GSUC0_GSUWGMRR0_K1_LBSPPA512_LBSPPB256_MIWT4_2_PLR1_SU32_SUM0_SUS256_SKXCCM4_VWA4_VWB2_WGM1_WGMXCC1_WGMXCCGn1
    SolutionIndex: 76
    SolutionNameMin: Cijk_Alik_Bljk_BBS_BH_UserArgs_MT128x64x64_MI16x16x1_SN_LDSB1_CLR1_GSU0_GSUC0_GSUWGMRR0_K1_LBSPPA512_LBSPPB256_MIWT4_2_PLR2_SU32_SUM0_SUS256_SKXCCM4_VWA4_VWB2_WGM1_WGMXCC1_WGMXCCGn1
    SolutionIndex: 77
    SolutionNameMin: Cijk_Alik_Bljk_BBS_BH_UserArgs_MT128x64x64_MI16x16x1_SN_LDSB1_CLR1_GSU0_GSUC0_GSUWGMRR0_K1_LBSPPA512_LBSPPB128_MIWT4_2_PLR1_SU32_SUM0_SUS256_SKXCCM4_VWA4_VWB1_WGM2_WGMXCC1_WGMXCCGn1
    SolutionIndex: 78
    SolutionNameMin: Cijk_Alik_Bljk_BBS_BH_UserArgs_MT128x64x64_MI16x16x1_SN_LDSB1_CLR1_GSU0_GSUC0_GSUWGMRR0_K1_LBSPPA256_LBSPPB256_MIWT4_2_PLR1_SU32_SUM0_SUS256_SKXCCM4_VWA2_VWB2_WGM2_WGMXCC1_WGMXCCGn1
    SolutionIndex: 79
    SolutionNameMin: Cijk_Alik_Bljk_BBS_BH_UserArgs_MT128x64x64_MI16x16x1_SN_LDSB1_CLR1_GSU0_GSUC0_GSUWGMRR0_K1_LBSPPA512_LBSPPB256_MIWT4_2_PLR1_SU32_SUM0_SUS256_SKXCCM4_VWA4_VWB2_WGM2_WGMXCC1_WGMXCCGn1
    SolutionIndex: 80
    SolutionNameMin: Cijk_Alik_Bljk_BBS_BH_UserArgs_MT128x64x64_MI16x16x1_SN_LDSB1_CLR1_GSU0_GSUC0_GSUWGMRR0_K1_LBSPPA512_LBSPPB128_MIWT4_2_PLR1_SU32_SUM0_SUS256_SKXCCM4_VWA4_VWB1_WGM4_WGMXCC1_WGMXCCGn1
    SolutionIndex: 81
    SolutionNameMin: Cijk_Alik_Bljk_BBS_BH_UserArgs_MT128x64x64_MI16x16x1_SN_LDSB1_CLR1_GSU0_GSUC0_GSUWGMRR0_K1_LBSPPA256_LBSPPB256_MIWT4_2_PLR1_SU32_SUM0_SUS256_SKXCCM4_VWA2_VWB2_WGM4_WGMXCC1_WGMXCCGn1
    SolutionIndex: 82
    SolutionNameMin: Cijk_Alik_Bljk_BBS_BH_UserArgs_MT128x64x64_MI16x16x1_SN_LDSB1_CLR1_GSU0_GSUC0_GSUWGMRR0_K1_LBSPPA512_LBSPPB256_MIWT4_2_PLR1_SU32_SUM0_SUS256_SKXCCM4_VWA4_VWB2_WGM4_WGMXCC1_WGMXCCGn1
    SolutionIndex: 83
    SolutionNameMin: Cijk_Alik_Bljk_BBS_BH_UserArgs_MT64x64x64_MI16x16x1_SN_LDSB1_CLR1_GSU0_GSUC0_GSUWGMRR0_K1_LBSPPA256_LBSPPB128_MIWT2_2_PLR1_SU32_SUM0_SUS256_SKXCCM4_VWA2_VWB1_WGM1_WGMXCC1_WGMXCCGn1
    SolutionIndex: 84
    SolutionNameMin: Cijk_Alik_Bljk_BBS_BH_UserArgs_MT64x64x64_MI16x16x1_SN_LDSB1_CLR1_GSU0_GSUC0_GSUWGMRR0_K1_LBSPPA128_LBSPPB256_MIWT2_2_PLR1_SU32_SUM0_SUS256_SKXCCM4_VWA1_VWB2_WGM1_WGMXCC1_WGMXCCGn1
    SolutionIndex: 85
    SolutionNameMin: Cijk_Alik_Bljk_BBS_BH_UserArgs_MT64x64x64_MI16x16x1_SN_LDSB1_CLR1_GSU0_GSUC0_GSUWGMRR0_K1_LBSPPA256_LBSPPB256_MIWT2_2_PLR1_SU32_SUM0_SUS256_SKXCCM4_VWA2_VWB2_WGM1_WGMXCC1_WGMXCCGn1
    SolutionIndex: 86
    SolutionNameMin: Cijk_Alik_Bljk_BBS_BH_UserArgs_MT64x64x64_MI16x16x1_SN_LDSB1_CLR1_GSU0_GSUC0_GSUWGMRR0_K1_LBSPPA256_LBSPPB128_MIWT2_2_PLR1_SU32_SUM0_SUS256_SKXCCM4_VWA2_VWB1_WGM4_WGMXCC1_WGMXCCGn1
    SolutionIndex: 87
    SolutionNameMin: Cijk_Alik_Bljk_BBS_BH_UserArgs_MT64x64x64_MI16x16x1_SN_LDSB1_CLR1_GSU0_GSUC0_GSUWGMRR0_K1_LBSPPA128_LBSPPB256_MIWT2_2_PLR1_SU32_SUM0_SUS256_SKXCCM4_VWA1_VWB2_WGM4_WGMXCC1_WGMXCCGn1
    SolutionIndex: 88
    SolutionNameMin: Cijk_Alik_Bljk_BBS_BH_UserArgs_MT64x64x64_MI16x16x1_SN_LDSB1_CLR1_GSU0_GSUC0_GSUWGMRR0_K1_LBSPPA256_LBSPPB256_MIWT2_2_PLR1_SU32_SUM0_SUS256_SKXCCM4_VWA2_VWB2_WGM4_WGMXCC1_WGMXCCGn1
    SolutionIndex: 89
    SolutionNameMin: Cijk_Alik_Bljk_BBS_BH_UserArgs_MT32x64x64_MI16x16x1_SN_LDSB0_CLR1_GSU0_GSUC0_GSUWGMRR0_K1_LBSPPA128_LBSPPB256_MIWT1_2_PLR1_SU32_SUM0_SUS256_SKXCCM4_VWA1_VWB2_WGM1_WGMXCC1_WGMXCCGn1
    SolutionIndex: 90
    SolutionNameMin: Cijk_Alik_Bljk_BBS_BH_UserArgs_MT64x32x64_MI16x16x1_SN_LDSB0_CLR1_GSU0_GSUC0_GSUWGMRR0_K1_LBSPPA256_LBSPPB128_MIWT2_1_PLR1_SU32_SUM0_SUS256_SKXCCM4_VWA2_VWB1_WGM1_WGMXCC1_WGMXCCGn1
    SolutionIndex: 91
    SolutionNameMin: Cijk_Alik_Bljk_BBS_BH_UserArgs_MT64x64x128_MI16x16x1_SN_LDSB1_CLR1_GSU0_GSUC0_GSUWGMRR0_K1_LBSPPA512_LBSPPB256_MIWT2_2_PLR2_SU32_SUM0_SUS256_SKXCCM4_VWA2_VWB1_WGM1_WGMXCC1_WGMXCCGn1
    SolutionIndex: 92
    SolutionNameMin: Cijk_Alik_Bljk_BBS_BH_UserArgs_MT32x64x128_MI16x16x1_SN_LDSB1_CLR1_GSU0_GSUC0_GSUWGMRR0_K1_LBSPPA256_LBSPPB512_MIWT1_2_PLR1_SU32_SUM0_SUS256_SKXCCM4_VWA1_VWB2_WGM1_WGMXCC1_WGMXCCGn1
    SolutionIndex: 93
    SolutionNameMin: Cijk_Alik_Bljk_BBS_BH_UserArgs_MT64x32x128_MI16x16x1_SN_LDSB1_CLR1_GSU0_GSUC0_GSUWGMRR0_K1_LBSPPA512_LBSPPB256_MIWT2_1_PLR1_SU32_SUM0_SUS256_SKXCCM4_VWA2_VWB1_WGM1_WGMXCC1_WGMXCCGn1
    SolutionIndex: 94
    SolutionNameMin: Cijk_Alik_Bljk_BBS_BH_UserArgs_MT32x32x128_MI16x16x1_SN_LDSB1_CLR1_GSU0_GSUC0_GSUWGMRR0_K1_LBSPPA256_LBSPPB256_MIWT1_1_PLR1_SU32_SUM0_SUS256_SKXCCM4_VWA1_VWB1_WGM1_WGMXCC1_WGMXCCGn1
    SolutionIndex: 95
    SolutionNameMin: Cijk_Alik_Bljk_BBS_BH_UserArgs_MT32x32x128_MI16x16x1_SN_LDSB1_CLR1_GSU0_GSUC0_GSUWGMRR0_K1_LBSPPA256_LBSPPB256_MIWT1_1_PLR2_SU32_SUM0_SUS256_SKXCCM4_VWA1_VWB1_WGM1_WGMXCC1_WGMXCCGn1
    SolutionIndex: 96
    SolutionNameMin: Cijk_Alik_Bljk_BBS_BH_UserArgs_MT32x32x128_MI16x16x1_SN_LDSB1_CLR1_GSU0_GSUC0_GSUWGMRR0_K1_LBSPPA256_LBSPPB256_MIWT1_1_PLR1_SU32_SUM0_SUS256_SKXCCM4_VWA1_VWB1_WGM2_WGMXCC1_WGMXCCGn1
    SolutionIndex: 97
    SolutionNameMin: Cijk_Alik_Bljk_BBS_BH_UserArgs_MT32x32x32_MI16x16x1_SN_LDSB0_CLR0_GSU0_GSUC0_GSUWGMRR0_K1_LBSPPA128_LBSPPB128_MIWT1_1_PLR0_SU32_SUM0_SUS256_SKXCCM4_VWA1_VWB1_WGM1_WGMXCC1_WGMXCCGn1
- - - [128, 128, 1, 128, 128, 128, 128, 128]
    - [37, 0.093]
  - - [128, 128, 1, 256, 128, 128, 256, 256]
    - [36, 0.117]
  - - [128, 128, 1, 512, 128, 128, 512, 512]
    - [95, 0.195]
  - - [128, 128, 1, 1024, 128, 128, 1024, 1024]
    - [30, 0.316]
  - - [128, 128, 1, 2048, 128, 128, 2048, 2048]
    - [36, 0.599]
  - - [128, 128, 1, 4096, 128, 128, 4096, 4096]
    - [36, 1.035]
  - - [128, 128, 1, 8192, 128, 128, 8192, 8192]
    - [36, 1.755]
  - - [128, 256, 1, 128, 128, 128, 128, 128]
    - [94, 0.187]
  - - [128, 256, 1, 256, 128, 128, 256, 256]
    - [36, 0.234]
  - - [128, 256, 1, 512, 128, 128, 512, 512]
    - [94, 0.39]
  - - [128, 256, 1, 1024, 128, 128, 1024, 1024]
    - [36, 0.681]
  - - [128, 256, 1, 2048, 128, 128, 2048, 2048]
    - [36, 1.137]
  - - [128, 256, 1, 4096, 128, 128, 4096, 4096]
    - [27, 1.806]
  - - [128, 256, 1, 8192, 128, 128, 8192, 8192]
    - [94, 2.952]
  - - [128, 512, 1, 128, 128, 128, 128, 128]
    - [94, 0.361]
  - - [128, 512, 1, 256, 128, 128, 256, 256]
    - [37, 0.449]
  - - [128, 512, 1, 512, 128, 128, 512, 512]
    - [37, 0.768]
  - - [128, 512, 1, 1024, 128, 128, 1024, 1024]
    - [37, 1.407]
  - - [128, 512, 1, 2048, 128, 128, 2048, 2048]
    - [36, 2.225]
  - - [128, 512, 1, 4096, 128, 128, 4096, 4096]
    - [90, 3.14]
  - - [128, 512, 1, 8192, 128, 128, 8192, 8192]
    - [91, 4.556]
  - - [128, 1024, 1, 128, 128, 128, 128, 128]
    - [33, 0.678]
  - - [128, 1024, 1, 256, 128, 128, 256, 256]
    - [95, 1.174]
  - - [128, 1024, 1, 512, 128, 128, 512, 512]
    - [37, 1.9]
  - - [128, 1024, 1, 1024, 128, 128, 1024, 1024]
    - [36, 2.856]
  - - [128, 1024, 1, 2048, 128, 128, 2048, 2048]
    - [92, 3.484]
  - - [128, 1024, 1, 4096, 128, 128, 4096, 4096]
    - [83, 4.976]
  - - [128, 1024, 1, 8192, 128, 128, 8192, 8192]
    - [20, 6.811]
  - - [128, 2048, 1, 128, 128, 128, 128, 128]
    - [90, 1.215]
  - - [128, 2048, 1, 256, 128, 128, 256, 256]
    - [90, 2.064]
  - - [128, 2048, 1, 512, 128, 128, 512, 512]
    - [90, 3.203]
  - - [128, 2048, 1, 1024, 128, 128, 1024, 1024]
    - [93, 4.366]
  - - [128, 2048, 1, 2048, 128, 128, 2048, 2048]
    - [48, 4.717]
  - - [128, 2048, 1, 4096, 128, 128, 4096, 4096]
    - [75, 7.072]
  - - [128, 2048, 1, 8192, 128, 128, 8192, 8192]
    - [55, 9.429]
  - - [128, 4096, 1, 128, 128, 128, 128, 128]
    - [22, 2.133]
  - - [128, 4096, 1, 256, 128, 128, 256, 256]
    - [22, 3.53]
  - - [128, 4096, 1, 512, 128, 128, 512, 512]
    - [83, 5.189]
  - - [128, 4096, 1, 1024, 128, 128, 1024, 1024]
    - [75, 5.846]
  - - [128, 4096, 1, 2048, 128, 128, 2048, 2048]
    - [87, 6.309]
  - - [128, 4096, 1, 4096, 128, 128, 4096, 4096]
    - [6, 7.791]
  - - [128, 4096, 1, 8192, 128, 128, 8192, 8192]
    - [21, 9.879]
  - - [128, 8192, 1, 128, 128, 128, 128, 128]
    - [75, 3.26]
  - - [128, 8192, 1, 256, 128, 128, 256, 256]
    - [74, 5.144]
  - - [128, 8192, 1, 512, 128, 128, 512, 512]
    - [74, 7.415]
  - - [128, 8192, 1, 1024, 128, 128, 1024, 1024]
    - [86, 7.016]
  - - [128, 8192, 1, 2048, 128, 128, 2048, 2048]
    - [75, 8.294]
  - - [128, 8192, 1, 4096, 128, 128, 4096, 4096]
    - [19, 10.464]
  - - [128, 8192, 1, 8192, 128, 128, 8192, 8192]
    - [20, 11.764]
  - - [256, 128, 1, 128, 256, 256, 128, 128]
    - [95, 0.182]
  - - [256, 128, 1, 256, 256, 256, 256, 256]
    - [36, 0.234]
  - - [256, 128, 1, 512, 256, 256, 512, 512]
    - [94, 0.385]
  - - [256, 128, 1, 1024, 256, 256, 1024, 1024]
    - [36, 0.668]
  - - [256, 128, 1, 2048, 256, 256, 2048, 2048]
    - [37, 1.137]
  - - [256, 128, 1, 4096, 256, 256, 4096, 4096]
    - [26, 1.788]
  - - [256, 128, 1, 8192, 256, 256, 8192, 8192]
    - [96, 2.918]
  - - [256, 256, 1, 128, 256, 256, 128, 128]
    - [94, 0.365]
  - - [256, 256, 1, 256, 256, 256, 256, 256]
    - [37, 0.455]
  - - [256, 256, 1, 512, 256, 256, 512, 512]
    - [36, 0.769]
  - - [256, 256, 1, 1024, 256, 256, 1024, 1024]
    - [36, 1.385]
  - - [256, 256, 1, 2048, 256, 256, 2048, 2048]
    - [95, 2.182]
  - - [256, 256, 1, 4096, 256, 256, 4096, 4096]
    - [89, 3.165]
  - - [256, 256, 1, 8192, 256, 256, 8192, 8192]
    - [31, 4.54]
  - - [256, 512, 1, 128, 256, 256, 128, 128]
    - [34, 0.686]
  - - [256, 512, 1, 256, 256, 256, 256, 256]
    - [37, 1.185]
  - - [256, 512, 1, 512, 256, 256, 512, 512]
    - [36, 1.895]
  - - [256, 512, 1, 1024, 256, 256, 1024, 1024]
    - [36, 2.854]
  - - [256, 512, 1, 2048, 256, 256, 2048, 2048]
    - [92, 3.452]
  - - [256, 512, 1, 4096, 256, 256, 4096, 4096]
    - [85, 4.967]
  - - [256, 512, 1, 8192, 256, 256, 8192, 8192]
    - [21, 6.58]
  - - [256, 1024, 1, 128, 256, 256, 128, 128]
    - [34, 1.226]
  - - [256, 1024, 1, 256, 256, 256, 256, 256]
    - [28, 2.08]
  - - [256, 1024, 1, 512, 256, 256, 512, 512]
    - [28, 3.213]
  - - [256, 1024, 1, 1024, 256, 256, 1024, 1024]
    - [33, 4.372]
  - - [256, 1024, 1, 2048, 256, 256, 2048, 2048]
    - [48, 4.704]
  - - [256, 1024, 1, 4096, 256, 256, 4096, 4096]
    - [20, 7.319]
  - - [256, 1024, 1, 8192, 256, 256, 8192, 8192]
    - [57, 9.5]
  - - [256, 2048, 1, 128, 256, 256, 128, 128]
    - [83, 2.13]
  - - [256, 2048, 1, 256, 256, 256, 256, 256]
    - [83, 3.508]
  - - [256, 2048, 1, 512, 256, 256, 512, 512]
    - [22, 5.27]
  - - [256, 2048, 1, 1024, 256, 256, 1024, 1024]
    - [73, 5.833]
  - - [256, 2048, 1, 2048, 256, 256, 2048, 2048]
    - [84, 6.997]
  - - [256, 2048, 1, 4096, 256, 256, 4096, 4096]
    - [8, 8.041]
  - - [256, 2048, 1, 8192, 256, 256, 8192, 8192]
    - [9, 9.476]
  - - [256, 4096, 1, 128, 256, 256, 128, 128]
    - [75, 3.286]
  - - [256, 4096, 1, 256, 256, 256, 256, 256]
    - [72, 5.19]
  - - [256, 4096, 1, 512, 256, 256, 512, 512]
    - [74, 7.401]
  - - [256, 4096, 1, 1024, 256, 256, 1024, 1024]
    - [85, 8.367]
  - - [256, 4096, 1, 2048, 256, 256, 2048, 2048]
    - [77, 8.891]
  - - [256, 4096, 1, 4096, 256, 256, 4096, 4096]
    - [79, 9.814]
  - - [256, 4096, 1, 8192, 256, 256, 8192, 8192]
    - [55, 10.929]
  - - [256, 8192, 1, 128, 256, 256, 128, 128]
    - [41, 4.257]
  - - [256, 8192, 1, 256, 256, 256, 256, 256]
    - [39, 6.633]
  - - [256, 8192, 1, 512, 256, 256, 512, 512]
    - [52, 8.604]
  - - [256, 8192, 1, 1024, 256, 256, 1024, 1024]
    - [74, 9.739]
  - - [256, 8192, 1, 2048, 256, 256, 2048, 2048]
    - [74, 11.208]
  - - [256, 8192, 1, 4096, 256, 256, 4096, 4096]
    - [75, 11.155]
  - - [256, 8192, 1, 8192, 256, 256, 8192, 8192]
    - [57, 12.716]
  - - [512, 128, 1, 128, 512, 512, 128, 128]
    - [36, 0.366]
  - - [512, 128, 1, 256, 512, 512, 256, 256]
    - [36, 0.452]
  - - [512, 128, 1, 512, 512, 512, 512, 512]
    - [36, 0.764]
  - - [512, 128, 1, 1024, 512, 512, 1024, 1024]
    - [36, 1.405]
  - - [512, 128, 1, 2048, 512, 512, 2048, 2048]
    - [36, 2.213]
  - - [512, 128, 1, 4096, 512, 512, 4096, 4096]
    - [89, 3.165]
  - - [512, 128, 1, 8192, 512, 512, 8192, 8192]
    - [31, 4.549]
  - - [512, 256, 1, 128, 512, 512, 128, 128]
    - [33, 0.691]
  - - [512, 256, 1, 256, 512, 512, 256, 256]
    - [94, 1.169]
  - - [512, 256, 1, 512, 512, 512, 512, 512]
    - [37, 1.905]
  - - [512, 256, 1, 1024, 512, 512, 1024, 1024]
    - [36, 2.866]
  - - [512, 256, 1, 2048, 512, 512, 2048, 2048]
    - [93, 3.486]
  - - [512, 256, 1, 4096, 512, 512, 4096, 4096]
    - [88, 4.935]
  - - [512, 256, 1, 8192, 512, 512, 8192, 8192]
    - [19, 6.115]
  - - [512, 512, 1, 128, 512, 512, 128, 128]
    - [33, 1.222]
  - - [512, 512, 1, 256, 512, 512, 256, 256]
    - [90, 2.079]
  - - [512, 512, 1, 512, 512, 512, 512, 512]
    - [28, 3.222]
  - - [512, 512, 1, 1024, 512, 512, 1024, 1024]
    - [35, 4.337]
  - - [512, 512, 1, 2048, 512, 512, 2048, 2048]
    - [49, 4.683]
  - - [512, 512, 1, 4096, 512, 512, 4096, 4096]
    - [20, 7.158]
  - - [512, 512, 1, 8192, 512, 512, 8192, 8192]
    - [59, 9.506]
  - - [512, 1024, 1, 128, 512, 512, 128, 128]
    - [83, 2.121]
  - - [512, 1024, 1, 256, 512, 512, 256, 256]
    - [23, 3.535]
  - - [512, 1024, 1, 512, 512, 512, 512, 512]
    - [23, 5.209]
  - - [512, 1024, 1, 1024, 512, 512, 1024, 1024]
    - [73, 5.865]
  - - [512, 1024, 1, 2048, 512, 512, 2048, 2048]
    - [83, 7.005]
  - - [512, 1024, 1, 4096, 512, 512, 4096, 4096]
    - [9, 8.094]
  - - [512, 1024, 1, 8192, 512, 512, 8192, 8192]
    - [6, 9.866]
  - - [512, 2048, 1, 128, 512, 512, 128, 128]
    - [74, 3.281]
  - - [512, 2048, 1, 256, 512, 512, 256, 256]
    - [74, 5.187]
  - - [512, 2048, 1, 512, 512, 512, 512, 512]
    - [74, 7.415]
  - - [512, 2048, 1, 1024, 512, 512, 1024, 1024]
    - [85, 8.384]
  - - [512, 2048, 1, 2048, 512, 512, 2048, 2048]
    - [25, 9.052]
  - - [512, 2048, 1, 4096, 512, 512, 4096, 4096]
    - [67, 9.404]
  - - [512, 2048, 1, 8192, 512, 512, 8192, 8192]
    - [59, 10.823]
  - - [512, 4096, 1, 128, 512, 512, 128, 128]
    - [39, 4.247]
  - - [512, 4096, 1, 256, 512, 512, 256, 256]
    - [39, 6.599]
  - - [512, 4096, 1, 512, 512, 512, 512, 512]
    - [54, 8.748]
  - - [512, 4096, 1, 1024, 512, 512, 1024, 1024]
    - [81, 10.11]
  - - [512, 4096, 1, 2048, 512, 512, 2048, 2048]
    - [78, 11.352]
  - - [512, 4096, 1, 4096, 512, 512, 4096, 4096]
    - [56, 10.637]
  - - [512, 4096, 1, 8192, 512, 512, 8192, 8192]
    - [60, 12.571]
  - - [512, 8192, 1, 128, 512, 512, 128, 128]
    - [39, 4.838]
  - - [512, 8192, 1, 256, 512, 512, 256, 256]
    - [46, 7.005]
  - - [512, 8192, 1, 512, 512, 512, 512, 512]
    - [46, 9.246]
  - - [512, 8192, 1, 1024, 512, 512, 1024, 1024]
    - [59, 11.471]
  - - [512, 8192, 1, 2048, 512, 512, 2048, 2048]
    - [10, 12.763]
  - - [512, 8192, 1, 4096, 512, 512, 4096, 4096]
    - [57, 12.189]
  - - [512, 8192, 1, 8192, 512, 512, 8192, 8192]
    - [14, 14.149]
  - - [1024, 128, 1, 128, 1024, 1024, 128, 128]
    - [33, 0.687]
  - - [1024, 128, 1, 256, 1024, 1024, 256, 256]
    - [36, 1.186]
  - - [1024, 128, 1, 512, 1024, 1024, 512, 512]
    - [36, 1.904]
  - - [1024, 128, 1, 1024, 1024, 1024, 1024, 1024]
    - [36, 2.827]
  - - [1024, 128, 1, 2048, 1024, 1024, 2048, 2048]
    - [32, 3.468]
  - - [1024, 128, 1, 4096, 1024, 1024, 4096, 4096]
    - [88, 4.93]
  - - [1024, 128, 1, 8192, 1024, 1024, 8192, 8192]
    - [15, 6.12]
  - - [1024, 256, 1, 128, 1024, 1024, 128, 128]
    - [34, 1.224]
  - - [1024, 256, 1, 256, 1024, 1024, 256, 256]
    - [90, 2.074]
  - - [1024, 256, 1, 512, 1024, 1024, 512, 512]
    - [28, 3.204]
  - - [1024, 256, 1, 1024, 1024, 1024, 1024, 1024]
    - [33, 4.36]
  - - [1024, 256, 1, 2048, 1024, 1024, 2048, 2048]
    - [51, 4.675]
  - - [1024, 256, 1, 4096, 1024, 1024, 4096, 4096]
    - [80, 6.956]
  - - [1024, 256, 1, 8192, 1024, 1024, 8192, 8192]
    - [57, 9.59]
  - - [1024, 512, 1, 128, 1024, 1024, 128, 128]
    - [23, 2.144]
  - - [1024, 512, 1, 256, 1024, 1024, 256, 256]
    - [23, 3.529]
  - - [1024, 512, 1, 512, 1024, 1024, 512, 512]
    - [23, 5.266]
  - - [1024, 512, 1, 1024, 1024, 1024, 1024, 1024]
    - [75, 5.831]
  - - [1024, 512, 1, 2048, 1024, 1024, 2048, 2048]
    - [86, 6.836]
  - - [1024, 512, 1, 4096, 1024, 1024, 4096, 4096]
    - [14, 7.995]
  - - [1024, 512, 1, 8192, 1024, 1024, 8192, 8192]
    - [11, 9.631]
  - - [1024, 1024, 1, 128, 1024, 1024, 128, 128]
    - [75, 3.288]
  - - [1024, 1024, 1, 256, 1024, 1024, 256, 256]
    - [74, 5.21]
  - - [1024, 1024, 1, 512, 1024, 1024, 512, 512]
    - [74, 7.435]
  - - [1024, 1024, 1, 1024, 1024, 1024, 1024, 1024]
    - [85, 8.421]
  - - [1024, 1024, 1, 2048, 1024, 1024, 2048, 2048]
    - [24, 9.012]
  - - [1024, 1024, 1, 4096, 1024, 1024, 4096, 4096]
    - [68, 9.688]
  - - [1024, 1024, 1, 8192, 1024, 1024, 8192, 8192]
    - [57, 10.844]
  - - [1024, 2048, 1, 128, 1024, 1024, 128, 128]
    - [39, 4.245]
  - - [1024, 2048, 1, 256, 1024, 1024, 256, 256]
    - [41, 6.624]
  - - [1024, 2048, 1, 512, 1024, 1024, 512, 512]
    - [54, 8.766]
  - - [1024, 2048, 1, 1024, 1024, 1024, 1024, 1024]
    - [74, 10.246]
  - - [1024, 2048, 1, 2048, 1024, 1024, 2048, 2048]
    - [19, 11.092]
  - - [1024, 2048, 1, 4096, 1024, 1024, 4096, 4096]
    - [68, 10.916]
  - - [1024, 2048, 1, 8192, 1024, 1024, 8192, 8192]
    - [53, 12.922]
  - - [1024, 4096, 1, 128, 1024, 1024, 128, 128]
    - [41, 4.939]
  - - [1024, 4096, 1, 256, 1024, 1024, 256, 256]
    - [41, 7.119]
  - - [1024, 4096, 1, 512, 1024, 1024, 512, 512]
    - [41, 9.442]
  - - [1024, 4096, 1, 1024, 1024, 1024, 1024, 1024]
    - [12, 11.5]
  - - [1024, 4096, 1, 2048, 1024, 1024, 2048, 2048]
    - [9, 13.052]
  - - [1024, 4096, 1, 4096, 1024, 1024, 4096, 4096]
    - [59, 12.632]
  - - [1024, 4096, 1, 8192, 1024, 1024, 8192, 8192]
    - [53, 14.232]
  - - [1024, 8192, 1, 128, 1024, 1024, 128, 128]
    - [73, 4.671]
  - - [1024, 8192, 1, 256, 1024, 1024, 256, 256]
    - [75, 7.207]
  - - [1024, 8192, 1, 512, 1024, 1024, 512, 512]
    - [73, 9.167]
  - - [1024, 8192, 1, 1024, 1024, 1024, 1024, 1024]
    - [74, 11.129]
  - - [1024, 8192, 1, 2048, 1024, 1024, 2048, 2048]
    - [59, 12.402]
  - - [1024, 8192, 1, 4096, 1024, 1024, 4096, 4096]
    - [59, 13.811]
  - - [1024, 8192, 1, 8192, 1024, 1024, 8192, 8192]
    - [53, 15.471]
  - - [2048, 128, 1, 128, 2048, 2048, 128, 128]
    - [90, 1.217]
  - - [2048, 128, 1, 256, 2048, 2048, 256, 256]
    - [28, 2.099]
  - - [2048, 128, 1, 512, 2048, 2048, 512, 512]
    - [29, 3.193]
  - - [2048, 128, 1, 1024, 2048, 2048, 1024, 1024]
    - [33, 4.335]
  - - [2048, 128, 1, 2048, 2048, 2048, 2048, 2048]
    - [50, 4.652]
  - - [2048, 128, 1, 4096, 2048, 2048, 4096, 4096]
    - [68, 6.726]
  - - [2048, 128, 1, 8192, 2048, 2048, 8192, 8192]
    - [53, 9.545]
  - - [2048, 256, 1, 128, 2048, 2048, 128, 128]
    - [22, 2.145]
  - - [2048, 256, 1, 256, 2048, 2048, 256, 256]
    - [83, 3.502]
  - - [2048, 256, 1, 512, 2048, 2048, 512, 512]
    - [23, 5.263]
  - - [2048, 256, 1, 1024, 2048, 2048, 1024, 1024]
    - [82, 5.772]
  - - [2048, 256, 1, 2048, 2048, 2048, 2048, 2048]
    - [88, 6.853]
  - - [2048, 256, 1, 4096, 2048, 2048, 4096, 4096]
    - [10, 7.909]
  - - [2048, 256, 1, 8192, 2048, 2048, 8192, 8192]
    - [13, 9.633]
  - - [2048, 512, 1, 128, 2048, 2048, 128, 128]
    - [74, 3.293]
  - - [2048, 512, 1, 256, 2048, 2048, 256, 256]
    - [74, 5.183]
  - - [2048, 512, 1, 512, 2048, 2048, 512, 512]
    - [72, 7.417]
  - - [2048, 512, 1, 1024, 2048, 2048, 1024, 1024]
    - [88, 8.293]
  - - [2048, 512, 1, 2048, 2048, 2048, 2048, 2048]
    - [23, 9.229]
  - - [2048, 512, 1, 4096, 2048, 2048, 4096, 4096]
    - [66, 9.689]
  - - [2048, 512, 1, 8192, 2048, 2048, 8192, 8192]
    - [66, 11.093]
  - - [2048, 1024, 1, 128, 2048, 2048, 128, 128]
    - [39, 4.252]
  - - [2048, 1024, 1, 256, 2048, 2048, 256, 256]
    - [39, 6.631]
  - - [2048, 1024, 1, 512, 2048, 2048, 512, 512]
    - [54, 8.621]
  - - [2048, 1024, 1, 1024, 2048, 2048, 1024, 1024]
    - [18, 10.248]
  - - [2048, 1024, 1, 2048, 2048, 2048, 2048, 2048]
    - [19, 11.187]
  - - [2048, 1024, 1, 4096, 2048, 2048, 4096, 4096]
    - [65, 11.238]
  - - [2048, 1024, 1, 8192, 2048, 2048, 8192, 8192]
    - [55, 12.89]
  - - [2048, 2048, 1, 128, 2048, 2048, 128, 128]
    - [40, 4.904]
  - - [2048, 2048, 1, 256, 2048, 2048, 256, 256]
    - [38, 7.056]
  - - [2048, 2048, 1, 512, 2048, 2048, 512, 512]
    - [3, 9.592]
  - - [2048, 2048, 1, 1024, 2048, 2048, 1024, 1024]
    - [10, 11.314]
  - - [2048, 2048, 1, 2048, 2048, 2048, 2048, 2048]
    - [8, 13.163]
  - - [2048, 2048, 1, 4096, 2048, 2048, 4096, 4096]
    - [55, 13.41]
  - - [2048, 2048, 1, 8192, 2048, 2048, 8192, 8192]
    - [53, 15.03]
  - - [2048, 4096, 1, 128, 2048, 2048, 128, 128]
    - [75, 4.71]
  - - [2048, 4096, 1, 256, 2048, 2048, 256, 256]
    - [73, 7.259]
  - - [2048, 4096, 1, 512, 2048, 2048, 512, 512]
    - [75, 8.942]
  - - [2048, 4096, 1, 1024, 2048, 2048, 1024, 1024]
    - [62, 10.42]
  - - [2048, 4096, 1, 2048, 2048, 2048, 2048, 2048]
    - [53, 12.39]
  - - [2048, 4096, 1, 4096, 2048, 2048, 4096, 4096]
    - [55, 13.916]
  - - [2048, 4096, 1, 8192, 2048, 2048, 8192, 8192]
    - [56, 15.708]
  - - [2048, 8192, 1, 128, 2048, 2048, 128, 128]
    - [74, 5.771]
  - - [2048, 8192, 1, 256, 2048, 2048, 256, 256]
    - [73, 7.652]
  - - [2048, 8192, 1, 512, 2048, 2048, 512, 512]
    - [75, 10.009]
  - - [2048, 8192, 1, 1024, 2048, 2048, 1024, 1024]
    - [61, 11.623]
  - - [2048, 8192, 1, 2048, 2048, 2048, 2048, 2048]
    - [64, 13.491]
  - - [2048, 8192, 1, 4096, 2048, 2048, 4096, 4096]
    - [61, 15.363]
  - - [2048, 8192, 1, 8192, 2048, 2048, 8192, 8192]
    - [61, 17.127]
  - - [4096, 128, 1, 128, 4096, 4096, 128, 128]
    - [23, 2.156]
  - - [4096, 128, 1, 256, 4096, 4096, 256, 256]
    - [83, 3.497]
  - - [4096, 128, 1, 512, 4096, 4096, 512, 512]
    - [83, 5.201]
  - - [4096, 128, 1, 1024, 4096, 4096, 1024, 1024]
    - [82, 5.759]
  - - [4096, 128, 1, 2048, 4096, 4096, 2048, 2048]
    - [88, 5.917]
  - - [4096, 128, 1, 4096, 4096, 4096, 4096, 4096]
    - [9, 7.516]
  - - [4096, 128, 1, 8192, 4096, 4096, 8192, 8192]
    - [6, 9.787]
  - - [4096, 256, 1, 128, 4096, 4096, 128, 128]
    - [74, 3.288]
  - - [4096, 256, 1, 256, 4096, 4096, 256, 256]
    - [74, 5.165]
  - - [4096, 256, 1, 512, 4096, 4096, 512, 512]
    - [66, 7.395]
  - - [4096, 256, 1, 1024, 4096, 4096, 1024, 1024]
    - [86, 8.316]
  - - [4096, 256, 1, 2048, 4096, 4096, 2048, 2048]
    - [22, 8.595]
  - - [4096, 256, 1, 4096, 4096, 4096, 4096, 4096]
    - [66, 9.64]
  - - [4096, 256, 1, 8192, 4096, 4096, 8192, 8192]
    - [66, 11.089]
  - - [4096, 512, 1, 128, 4096, 4096, 128, 128]
    - [39, 4.248]
  - - [4096, 512, 1, 256, 4096, 4096, 256, 256]
    - [42, 6.472]
  - - [4096, 512, 1, 512, 4096, 4096, 512, 512]
    - [63, 8.532]
  - - [4096, 512, 1, 1024, 4096, 4096, 1024, 1024]
    - [18, 10.073]
  - - [4096, 512, 1, 2048, 4096, 4096, 2048, 2048]
    - [18, 10.526]
  - - [4096, 512, 1, 4096, 4096, 4096, 4096, 4096]
    - [68, 11.699]
  - - [4096, 512, 1, 8192, 4096, 4096, 8192, 8192]
    - [9, 13.134]
  - - [4096, 1024, 1, 128, 4096, 4096, 128, 128]
    - [2, 4.839]
  - - [4096, 1024, 1, 256, 4096, 4096, 256, 256]
    - [1, 6.947]
  - - [4096, 1024, 1, 512, 4096, 4096, 512, 512]
    - [3, 9.418]
  - - [4096, 1024, 1, 1024, 4096, 4096, 1024, 1024]
    - [6, 11.627]
  - - [4096, 1024, 1, 2048, 4096, 4096, 2048, 2048]
    - [6, 11.851]
  - - [4096, 1024, 1, 4096, 4096, 4096, 4096, 4096]
    - [55, 13.309]
  - - [4096, 1024, 1, 8192, 4096, 4096, 8192, 8192]
    - [53, 15.14]
  - - [4096, 2048, 1, 128, 4096, 4096, 128, 128]
    - [75, 4.661]
  - - [4096, 2048, 1, 256, 4096, 4096, 256, 256]
    - [73, 7.032]
  - - [4096, 2048, 1, 512, 4096, 4096, 512, 512]
    - [82, 8.488]
  - - [4096, 2048, 1, 1024, 4096, 4096, 1024, 1024]
    - [61, 10.569]
  - - [4096, 2048, 1, 2048, 4096, 4096, 2048, 2048]
    - [53, 12.559]
  - - [4096, 2048, 1, 4096, 4096, 4096, 4096, 4096]
    - [53, 14.428]
  - - [4096, 2048, 1, 8192, 4096, 4096, 8192, 8192]
    - [53, 16.136]
  - - [4096, 4096, 1, 128, 4096, 4096, 128, 128]
    - [75, 5.776]
  - - [4096, 4096, 1, 256, 4096, 4096, 256, 256]
    - [20, 7.315]
  - - [4096, 4096, 1, 512, 4096, 4096, 512, 512]
    - [44, 9.524]
  - - [4096, 4096, 1, 1024, 4096, 4096, 1024, 1024]
    - [61, 11.572]
  - - [4096, 4096, 1, 2048, 4096, 4096, 2048, 2048]
    - [61, 13.52]
  - - [4096, 4096, 1, 4096, 4096, 4096, 4096, 4096]
    - [61, 15.595]
  - - [4096, 4096, 1, 8192, 4096, 4096, 8192, 8192]
    - [61, 17.083]
  - - [4096, 8192, 1, 128, 4096, 4096, 128, 128]
    - [40, 5.878]
  - - [4096, 8192, 1, 256, 4096, 4096, 256, 256]
    - [47, 8.064]
  - - [4096, 8192, 1, 512, 4096, 4096, 512, 512]
    - [4, 10.226]
  - - [4096, 8192, 1, 1024, 4096, 4096, 1024, 1024]
    - [6, 12.118]
  - - [4096, 8192, 1, 2048, 4096, 4096, 2048, 2048]
    - [62, 13.187]
  - - [4096, 8192, 1, 4096, 4096, 4096, 4096, 4096]
    - [61, 15.792]
  - - [4096, 8192, 1, 8192, 4096, 4096, 8192, 8192]
    - [61, 17.613]
  - - [8192, 128, 1, 128, 8192, 8192, 128, 128]
    - [16, 3.212]
  - - [8192, 128, 1, 256, 8192, 8192, 256, 256]
    - [74, 4.989]
  - - [8192, 128, 1, 512, 8192, 8192, 512, 512]
    - [66, 7.108]
  - - [8192, 128, 1, 1024, 8192, 8192, 1024, 1024]
    - [86, 6.851]
  - - [8192, 128, 1, 2048, 8192, 8192, 2048, 2048]
    - [68, 7.947]
  - - [8192, 128, 1, 4096, 8192, 8192, 4096, 4096]
    - [69, 9.707]
  - - [8192, 128, 1, 8192, 8192, 8192, 8192, 8192]
    - [17, 11.384]
  - - [8192, 256, 1, 128, 8192, 8192, 128, 128]
    - [41, 4.298]
  - - [8192, 256, 1, 256, 8192, 8192, 256, 256]
    - [42, 6.497]
  - - [8192, 256, 1, 512, 8192, 8192, 512, 512]
    - [58, 8.142]
  - - [8192, 256, 1, 1024, 8192, 8192, 1024, 1024]
    - [71, 9.156]
  - - [8192, 256, 1, 2048, 8192, 8192, 2048, 2048]
    - [70, 10.338]
  - - [8192, 256, 1, 4096, 8192, 8192, 4096, 4096]
    - [66, 11.797]
  - - [8192, 256, 1, 8192, 8192, 8192, 8192, 8192]
    - [8, 13.355]
  - - [8192, 512, 1, 128, 8192, 8192, 128, 128]
    - [2, 4.817]
  - - [8192, 512, 1, 256, 8192, 8192, 256, 256]
    - [5, 6.864]
  - - [8192, 512, 1, 512, 8192, 8192, 512, 512]
    - [43, 8.967]
  - - [8192, 512, 1, 1024, 8192, 8192, 1024, 1024]
    - [7, 10.75]
  - - [8192, 512, 1, 2048, 8192, 8192, 2048, 2048]
    - [61, 11.173]
  - - [8192, 512, 1, 4096, 8192, 8192, 4096, 4096]
    - [55, 13.562]
  - - [8192, 512, 1, 8192, 8192, 8192, 8192, 8192]
    - [53, 14.989]
  - - [8192, 1024, 1, 128, 8192, 8192, 128, 128]
    - [76, 4.575]
  - - [8192, 1024, 1, 256, 8192, 8192, 256, 256]
    - [82, 6.541]
  - - [8192, 1024, 1, 512, 8192, 8192, 512, 512]
    - [82, 8.545]
  - - [8192, 1024, 1, 1024, 8192, 8192, 1024, 1024]
    - [62, 10.571]
  - - [8192, 1024, 1, 2048, 8192, 8192, 2048, 2048]
    - [55, 12.488]
  - - [8192, 1024, 1, 4096, 8192, 8192, 4096, 4096]
    - [53, 14.197]
  - - [8192, 1024, 1, 8192, 8192, 8192, 8192, 8192]
    - [53, 16.253]
  - - [8192, 2048, 1, 128, 8192, 8192, 128, 128]
    - [19, 5.606]
  - - [8192, 2048, 1, 256, 8192, 8192, 256, 256]
    - [45, 7.321]
  - - [8192, 2048, 1, 512, 8192, 8192, 512, 512]
    - [44, 9.542]
  - - [8192, 2048, 1, 1024, 8192, 8192, 1024, 1024]
    - [61, 11.556]
  - - [8192, 2048, 1, 2048, 8192, 8192, 2048, 2048]
    - [61, 13.54]
  - - [8192, 2048, 1, 4096, 8192, 8192, 4096, 4096]
    - [61, 15.357]
  - - [8192, 2048, 1, 8192, 8192, 8192, 8192, 8192]
    - [61, 17.131]
  - - [8192, 4096, 1, 128, 8192, 8192, 128, 128]
    - [47, 5.779]
  - - [8192, 4096, 1, 256, 8192, 8192, 256, 256]
    - [44, 8.121]
  - - [8192, 4096, 1, 512, 8192, 8192, 512, 512]
    - [44, 10.162]
  - - [8192, 4096, 1, 1024, 8192, 8192, 1024, 1024]
    - [6, 11.846]
  - - [8192, 4096, 1, 2048, 8192, 8192, 2048, 2048]
    - [61, 13.223]
  - - [8192, 4096, 1, 4096, 8192, 8192, 4096, 4096]
    - [61, 15.84]
  - - [8192, 4096, 1, 8192, 8192, 8192, 8192, 8192]
    - [61, 17.562]
  - - [8192, 8192, 1, 128, 8192, 8192, 128, 128]
    - [0, 5.772]
  - - [8192, 8192, 1, 256, 8192, 8192, 256, 256]
    - [82, 7.642]
  - - [8192, 8192, 1, 512, 8192, 8192, 512, 512]
    - [8, 10.117]
  - - [8192, 8192, 1, 1024, 8192, 8192, 1024, 1024]
    - [6, 12.534]
  - - [8192, 8192, 1, 2048, 8192, 8192, 2048, 2048]
    - [62, 13.166]
  - - [8192, 8192, 1, 4096, 8192, 8192, 4096, 4096]
    - [57, 15.864]
  - - [8192, 8192, 1, 8192, 8192, 8192, 8192, 8192]
    - [61, 16.319]
  - - [1, 1, 1, 32, 1, 1, 32, 32]
    - [97, 0.0]
- null
- null
- DeviceEfficiency
- GridBased
