library/src/amd_detail/rocblaslt/src/Tensile/Logic/streamk/gfx942_80cu/aquavanjaram942_Cijk_Alik_Bjlk_BSS_BH_UserArgs.yaml
- {MinimumRequiredVersion: 4.33.0}
- aquavanjaram942
- {Architecture: gfx942, CUCount: 80}
- [Device 0049, Device 0050]
    SolutionIndex: 0
    SolutionNameMin: Cijk_Alik_Bjlk_BSS_BH_UserArgs_MT256x256x32_MI16x16x1_SN_LDSB1_CLR1_GSU0_GSUC0_GSUWGMRR0_K1_LBSPPA256_LBSPPB2048_LPB32_MIWT8_8_PLR1_SU32_SUM0_SUS256_SKXCCM0_VWA4_VWB2_WGM1_WGMXCC1_WGMXCCGn1
    SolutionIndex: 1
    SolutionNameMin: Cijk_Alik_Bjlk_BSS_BH_UserArgs_MT256x256x32_MI16x16x1_SN_LDSB1_CLR1_GSU0_GSUC0_GSUWGMRR0_K1_LBSPPA256_LBSPPB2048_LPB0_MIWT8_8_PLR1_SU32_SUM0_SUS256_SKXCCM0_VWA4_VWB4_WGM1_WGMXCC1_WGMXCCGn1
    SolutionIndex: 2
    SolutionNameMin: Cijk_Alik_Bjlk_BSS_BH_UserArgs_MT256x256x32_MI16x16x1_SN_LDSB1_CLR1_GSU0_GSUC0_GSUWGMRR0_K1_LBSPPA256_LBSPPB2048_LPB0_MIWT8_8_PLR1_SU32_SUM0_SUS256_SKXCCM0_VWA4_VWB8_WGM1_WGMXCC1_WGMXCCGn1
    SolutionIndex: 3
    SolutionNameMin: Cijk_Alik_Bjlk_BSS_BH_UserArgs_MT256x256x32_MI16x16x1_SN_LDSB1_CLR1_GSU0_GSUC0_GSUWGMRR0_K1_LBSPPA256_LBSPPB2048_LPB0_MIWT8_8_PLR1_SU32_SUM0_SUS256_SKXCCM0_VWA4_VWB8_WGM2_WGMXCC1_WGMXCCGn1
    SolutionIndex: 4
    SolutionNameMin: Cijk_Alik_Bjlk_BSS_BH_UserArgs_MT128x256x32_MI16x16x1_SN_LDSB1_CLR1_GSU0_GSUC0_GSUWGMRR0_K1_LBSPPA256_LBSPPB2048_LPB32_MIWT4_8_PLR1_SU32_SUM0_SUS256_SKXCCM0_VWA4_VWB2_WGM1_WGMXCC1_WGMXCCGn1
    SolutionIndex: 5
    SolutionNameMin: Cijk_Alik_Bjlk_BSS_BH_UserArgs_MT128x256x32_MI16x16x1_SN_LDSB1_CLR1_GSU0_GSUC0_GSUWGMRR0_K1_LBSPPA128_LBSPPB2048_LPB0_MIWT4_8_PLR1_SU32_SUM0_SUS256_SKXCCM0_VWA1_VWB4_WGM1_WGMXCC1_WGMXCCGn1
    SolutionIndex: 6
    SolutionNameMin: Cijk_Alik_Bjlk_BSS_BH_UserArgs_MT128x256x32_MI16x16x1_SN_LDSB1_CLR1_GSU0_GSUC0_GSUWGMRR0_K1_LBSPPA256_LBSPPB2048_LPB0_MIWT4_8_PLR1_SU32_SUM0_SUS256_SKXCCM0_VWA4_VWB4_WGM1_WGMXCC1_WGMXCCGn1
    SolutionIndex: 7
    SolutionNameMin: Cijk_Alik_Bjlk_BSS_BH_UserArgs_MT128x256x32_MI16x16x1_SN_LDSB1_CLR1_GSU0_GSUC0_GSUWGMRR0_K1_LBSPPA256_LBSPPB2048_LPB0_MIWT4_8_PLR1_SU32_SUM0_SUS256_SKXCCM0_VWA4_VWB8_WGM1_WGMXCC1_WGMXCCGn1
    SolutionIndex: 8
    SolutionNameMin: Cijk_Alik_Bjlk_BSS_BH_UserArgs_MT128x256x32_MI16x16x1_SN_LDSB1_CLR1_GSU0_GSUC0_GSUWGMRR0_K1_LBSPPA256_LBSPPB2048_LPB32_MIWT4_8_PLR1_SU32_SUM0_SUS256_SKXCCM0_VWA4_VWB2_WGM2_WGMXCC1_WGMXCCGn1
    SolutionIndex: 9
    SolutionNameMin: Cijk_Alik_Bjlk_BSS_BH_UserArgs_MT128x256x32_MI16x16x1_SN_LDSB1_CLR1_GSU0_GSUC0_GSUWGMRR0_K1_LBSPPA256_LBSPPB2048_LPB0_MIWT4_8_PLR1_SU32_SUM0_SUS256_SKXCCM0_VWA4_VWB4_WGM2_WGMXCC1_WGMXCCGn1
    SolutionIndex: 10
    SolutionNameMin: Cijk_Alik_Bjlk_BSS_BH_UserArgs_MT128x256x32_MI16x16x1_SN_LDSB1_CLR1_GSU0_GSUC0_GSUWGMRR0_K1_LBSPPA256_LBSPPB2048_LPB0_MIWT4_8_PLR1_SU32_SUM0_SUS256_SKXCCM0_VWA4_VWB8_WGM2_WGMXCC1_WGMXCCGn1
    SolutionIndex: 11
    SolutionNameMin: Cijk_Alik_Bjlk_BSS_BH_UserArgs_MT128x256x32_MI16x16x1_SN_LDSB1_CLR1_GSU0_GSUC0_GSUWGMRR0_K1_LBSPPA256_LBSPPB2048_LPB0_MIWT4_8_PLR1_SU32_SUM0_SUS256_SKXCCM0_VWA4_VWB4_WGM4_WGMXCC1_WGMXCCGn1
    SolutionIndex: 12
    SolutionNameMin: Cijk_Alik_Bjlk_BSS_BH_UserArgs_MT128x256x32_MI16x16x1_SN_LDSB1_CLR1_GSU0_GSUC0_GSUWGMRR0_K1_LBSPPA128_LBSPPB2048_LPB0_MIWT4_8_PLR1_SU32_SUM0_SUS256_SKXCCM0_VWA1_VWB8_WGM4_WGMXCC1_WGMXCCGn1
    SolutionIndex: 13
    SolutionNameMin: Cijk_Alik_Bjlk_BSS_BH_UserArgs_MT128x256x32_MI16x16x1_SN_LDSB1_CLR1_GSU0_GSUC0_GSUWGMRR0_K1_LBSPPA256_LBSPPB2048_LPB0_MIWT4_8_PLR1_SU32_SUM0_SUS256_SKXCCM0_VWA4_VWB8_WGM4_WGMXCC1_WGMXCCGn1
    SolutionIndex: 14
    SolutionNameMin: Cijk_Alik_Bjlk_BSS_BH_UserArgs_MT256x128x32_MI16x16x1_SN_LDSB1_CLR1_GSU0_GSUC0_GSUWGMRR0_K1_LBSPPA256_LBSPPB1024_LPB32_MIWT8_4_PLR1_SU32_SUM0_SUS256_SKXCCM0_VWA4_VWB2_WGM1_WGMXCC1_WGMXCCGn1
    SolutionIndex: 15
    SolutionNameMin: Cijk_Alik_Bjlk_BSS_BH_UserArgs_MT128x128x32_MI16x16x1_SN_LDSB1_CLR1_GSU0_GSUC0_GSUWGMRR0_K1_LBSPPA128_LBSPPB1024_LPB32_MIWT4_4_PLR1_SU32_SUM0_SUS256_SKXCCM0_VWA1_VWB2_WGM1_WGMXCC1_WGMXCCGn1
    SolutionIndex: 16
    SolutionNameMin: Cijk_Alik_Bjlk_BSS_BH_UserArgs_MT128x128x32_MI16x16x1_SN_LDSB1_CLR1_GSU0_GSUC0_GSUWGMRR0_K1_LBSPPA256_LBSPPB1024_LPB32_MIWT4_4_PLR1_SU32_SUM0_SUS256_SKXCCM0_VWA4_VWB2_WGM1_WGMXCC1_WGMXCCGn1
    SolutionIndex: 17
    SolutionNameMin: Cijk_Alik_Bjlk_BSS_BH_UserArgs_MT128x128x32_MI16x16x1_SN_LDSB1_CLR1_GSU0_GSUC0_GSUWGMRR0_K1_LBSPPA128_LBSPPB1024_LPB0_MIWT4_4_PLR1_SU32_SUM0_SUS256_SKXCCM0_VWA1_VWB4_WGM1_WGMXCC1_WGMXCCGn1
    SolutionIndex: 18
    SolutionNameMin: Cijk_Alik_Bjlk_BSS_BH_UserArgs_MT128x128x32_MI16x16x1_SN_LDSB1_CLR1_GSU0_GSUC0_GSUWGMRR0_K1_LBSPPA256_LBSPPB1024_LPB0_MIWT4_4_PLR1_SU32_SUM0_SUS256_SKXCCM0_VWA4_VWB4_WGM1_WGMXCC1_WGMXCCGn1
    SolutionIndex: 19
    SolutionNameMin: Cijk_Alik_Bjlk_BSS_BH_UserArgs_MT128x128x32_MI16x16x1_SN_LDSB1_CLR1_GSU0_GSUC0_GSUWGMRR0_K1_LBSPPA128_LBSPPB1024_LPB32_MIWT4_4_PLR1_SU32_SUM0_SUS256_SKXCCM0_VWA1_VWB2_WGM2_WGMXCC1_WGMXCCGn1
    SolutionIndex: 20
    SolutionNameMin: Cijk_Alik_Bjlk_BSS_BH_UserArgs_MT128x128x32_MI16x16x1_SN_LDSB1_CLR1_GSU0_GSUC0_GSUWGMRR0_K1_LBSPPA256_LBSPPB1024_LPB32_MIWT4_4_PLR1_SU32_SUM0_SUS256_SKXCCM0_VWA4_VWB2_WGM2_WGMXCC1_WGMXCCGn1
    SolutionIndex: 21
    SolutionNameMin: Cijk_Alik_Bjlk_BSS_BH_UserArgs_MT128x128x32_MI16x16x1_SN_LDSB1_CLR1_GSU0_GSUC0_GSUWGMRR0_K1_LBSPPA256_LBSPPB1024_LPB32_MIWT4_4_PLR1_SU32_SUM0_SUS256_SKXCCM0_VWA4_VWB2_WGM4_WGMXCC1_WGMXCCGn1
    SolutionIndex: 22
    SolutionNameMin: Cijk_Alik_Bjlk_BSS_BH_UserArgs_MT32x32x32_MI16x16x1_SN_LDSB0_CLR1_GSU0_GSUC0_GSUWGMRR0_K1_LBSPPA128_LBSPPB256_LPB16_MIWT1_1_PLR1_SU32_SUM0_SUS256_SKXCCM0_VWA1_VWB1_WGM1_WGMXCC1_WGMXCCGn1
    SolutionIndex: 23
    SolutionNameMin: Cijk_Alik_Bjlk_BSS_BH_UserArgs_MT32x32x32_MI16x16x1_SN_LDSB0_CLR0_GSU0_GSUC0_GSUWGMRR0_K1_LBSPPA128_LBSPPB256_LPB16_MIWT1_1_PLR0_SU32_SUM0_SUS256_SKXCCM0_VWA1_VWB1_WGM1_WGMXCC1_WGMXCCGn1
    SolutionIndex: 24
    SolutionNameMin: Cijk_Alik_Bjlk_BSS_BH_UserArgs_MT128x256x64_MI16x16x1_SN_LDSB1_CLR1_GSU0_GSUC0_GSUWGMRR0_K1_LBSPPA512_LBSPPB4096_LPB0_MIWT4_8_PLR1_SU32_SUM0_SUS256_SKXCCM0_VWA4_VWB4_WGM1_WGMXCC1_WGMXCCGn1
    SolutionIndex: 25
    SolutionNameMin: Cijk_Alik_Bjlk_BSS_BH_UserArgs_MT128x256x64_MI16x16x1_SN_LDSB1_CLR1_GSU0_GSUC0_GSUWGMRR0_K1_LBSPPA512_LBSPPB4096_LPB0_MIWT4_8_PLR1_SU32_SUM0_SUS256_SKXCCM0_VWA4_VWB4_WGM4_WGMXCC1_WGMXCCGn1
    SolutionIndex: 26
    SolutionNameMin: Cijk_Alik_Bjlk_BSS_BH_UserArgs_MT256x128x64_MI16x16x1_SN_LDSB1_CLR1_GSU0_GSUC0_GSUWGMRR0_K1_LBSPPA512_LBSPPB2048_LPB0_MIWT8_4_PLR1_SU32_SUM0_SUS256_SKXCCM0_VWA4_VWB4_WGM1_WGMXCC1_WGMXCCGn1
    SolutionIndex: 27
    SolutionNameMin: Cijk_Alik_Bjlk_BSS_BH_UserArgs_MT256x128x64_MI16x16x1_SN_LDSB1_CLR1_GSU0_GSUC0_GSUWGMRR0_K1_LBSPPA512_LBSPPB2048_LPB0_MIWT8_4_PLR1_SU32_SUM0_SUS256_SKXCCM0_VWA4_VWB4_WGM2_WGMXCC1_WGMXCCGn1
    SolutionIndex: 28
    SolutionNameMin: Cijk_Alik_Bjlk_BSS_BH_UserArgs_MT256x128x64_MI16x16x1_SN_LDSB1_CLR1_GSU0_GSUC0_GSUWGMRR0_K1_LBSPPA512_LBSPPB2048_LPB0_MIWT8_4_PLR1_SU32_SUM0_SUS256_SKXCCM0_VWA4_VWB4_WGM4_WGMXCC1_WGMXCCGn1
    SolutionIndex: 29
    SolutionNameMin: Cijk_Alik_Bjlk_BSS_BH_UserArgs_MT128x128x64_MI16x16x1_SN_LDSB1_CLR1_GSU0_GSUC0_GSUWGMRR0_K1_LBSPPA128_LBSPPB2048_LPB0_MIWT4_4_PLR1_SU32_SUM0_SUS256_SKXCCM0_VWA1_VWB4_WGM1_WGMXCC1_WGMXCCGn1
    SolutionIndex: 30
    SolutionNameMin: Cijk_Alik_Bjlk_BSS_BH_UserArgs_MT128x128x64_MI16x16x1_SN_LDSB1_CLR1_GSU0_GSUC0_GSUWGMRR0_K1_LBSPPA512_LBSPPB2048_LPB0_MIWT4_4_PLR1_SU32_SUM0_SUS256_SKXCCM0_VWA4_VWB4_WGM1_WGMXCC1_WGMXCCGn1
    SolutionIndex: 31
    SolutionNameMin: Cijk_Alik_Bjlk_BSS_BH_UserArgs_MT128x128x64_MI16x16x1_SN_LDSB1_CLR1_GSU0_GSUC0_GSUWGMRR0_K1_LBSPPA512_LBSPPB2048_LPB0_MIWT4_4_PLR1_SU32_SUM0_SUS256_SKXCCM0_VWA4_VWB4_WGM2_WGMXCC1_WGMXCCGn1
    SolutionIndex: 32
    SolutionNameMin: Cijk_Alik_Bjlk_BSS_BH_UserArgs_MT64x128x64_MI16x16x1_SN_LDSB1_CLR1_GSU0_GSUC0_GSUWGMRR0_K1_LBSPPA256_LBSPPB2048_LPB0_MIWT2_4_PLR1_SU32_SUM0_SUS256_SKXCCM0_VWA2_VWB4_WGM1_WGMXCC1_WGMXCCGn1
    SolutionIndex: 33
    SolutionNameMin: Cijk_Alik_Bjlk_BSS_BH_UserArgs_MT128x64x64_MI16x16x1_SN_LDSB1_CLR1_GSU0_GSUC0_GSUWGMRR0_K1_LBSPPA512_LBSPPB1024_LPB32_MIWT4_2_PLR1_SU32_SUM0_SUS256_SKXCCM0_VWA4_VWB2_WGM1_WGMXCC1_WGMXCCGn1
    SolutionIndex: 34
    SolutionNameMin: Cijk_Alik_Bjlk_BSS_BH_UserArgs_MT128x64x64_MI16x16x1_SN_LDSB1_CLR1_GSU0_GSUC0_GSUWGMRR0_K1_LBSPPA512_LBSPPB1024_LPB32_MIWT4_2_PLR1_SU32_SUM0_SUS256_SKXCCM0_VWA4_VWB2_WGM2_WGMXCC1_WGMXCCGn1
    SolutionIndex: 35
    SolutionNameMin: Cijk_Alik_Bjlk_BSS_BH_UserArgs_MT128x64x64_MI16x16x1_SN_LDSB1_CLR1_GSU0_GSUC0_GSUWGMRR0_K1_LBSPPA512_LBSPPB1024_LPB32_MIWT4_2_PLR1_SU32_SUM0_SUS256_SKXCCM0_VWA4_VWB2_WGM4_WGMXCC1_WGMXCCGn1
    SolutionIndex: 36
    SolutionNameMin: Cijk_Alik_Bjlk_BSS_BH_UserArgs_MT64x64x64_MI16x16x1_SN_LDSB1_CLR1_GSU0_GSUC0_GSUWGMRR0_K1_LBSPPA128_LBSPPB1024_LPB32_MIWT2_2_PLR1_SU32_SUM0_SUS256_SKXCCM0_VWA1_VWB2_WGM1_WGMXCC1_WGMXCCGn1
    SolutionIndex: 37
    SolutionNameMin: Cijk_Alik_Bjlk_BSS_BH_UserArgs_MT64x64x64_MI16x16x1_SN_LDSB1_CLR1_GSU0_GSUC0_GSUWGMRR0_K1_LBSPPA128_LBSPPB1024_LPB32_MIWT2_2_PLR1_SU32_SUM0_SUS256_SKXCCM0_VWA1_VWB2_WGM4_WGMXCC1_WGMXCCGn1
    SolutionIndex: 38
    SolutionNameMin: Cijk_Alik_Bjlk_BSS_BH_UserArgs_MT128x64x128_MI16x16x1_SN_LDSB1_CLR1_GSU0_GSUC0_GSUWGMRR0_K1_LBSPPA256_LBSPPB1024_LPB32_MIWT4_2_PLR2_SU32_SUM0_SUS256_SKXCCM0_VWA1_VWB2_WGM1_WGMXCC1_WGMXCCGn1
    SolutionIndex: 39
    SolutionNameMin: Cijk_Alik_Bjlk_BSS_BH_UserArgs_MT128x64x128_MI16x16x1_SN_LDSB1_CLR1_GSU0_GSUC0_GSUWGMRR0_K1_LBSPPA1024_LBSPPB1024_LPB32_MIWT4_2_PLR2_SU32_SUM0_SUS256_SKXCCM0_VWA4_VWB2_WGM1_WGMXCC1_WGMXCCGn1
    SolutionIndex: 40
    SolutionNameMin: Cijk_Alik_Bjlk_BSS_BH_UserArgs_MT128x64x128_MI16x16x1_SN_LDSB1_CLR1_GSU0_GSUC0_GSUWGMRR0_K1_LBSPPA1024_LBSPPB1024_LPB32_MIWT4_2_PLR2_SU32_SUM0_SUS256_SKXCCM0_VWA4_VWB2_WGM2_WGMXCC1_WGMXCCGn1
    SolutionIndex: 41
    SolutionNameMin: Cijk_Alik_Bjlk_BSS_BH_UserArgs_MT64x64x128_MI16x16x1_SN_LDSB1_CLR1_GSU0_GSUC0_GSUWGMRR0_K1_LBSPPA256_LBSPPB1024_LPB32_MIWT2_2_PLR2_SU32_SUM0_SUS256_SKXCCM0_VWA1_VWB2_WGM1_WGMXCC1_WGMXCCGn1
    SolutionIndex: 42
    SolutionNameMin: Cijk_Alik_Bjlk_BSS_BH_UserArgs_MT32x64x128_MI16x16x1_SN_LDSB1_CLR1_GSU0_GSUC0_GSUWGMRR0_K1_LBSPPA256_LBSPPB1024_LPB32_MIWT1_2_PLR2_SU32_SUM0_SUS256_SKXCCM0_VWA1_VWB2_WGM1_WGMXCC1_WGMXCCGn1
    SolutionIndex: 43
    SolutionNameMin: Cijk_Alik_Bjlk_BSS_BH_UserArgs_MT32x64x128_MI16x16x1_SN_LDSB1_CLR1_GSU0_GSUC0_GSUWGMRR0_K1_LBSPPA256_LBSPPB1024_LPB32_MIWT1_2_PLR2_SU32_SUM0_SUS256_SKXCCM0_VWA1_VWB2_WGM4_WGMXCC1_WGMXCCGn1
    SolutionIndex: 44
    SolutionNameMin: Cijk_Alik_Bjlk_BSS_BH_UserArgs_MT64x32x128_MI16x16x1_SN_LDSB1_CLR1_GSU0_GSUC0_GSUWGMRR0_K1_LBSPPA256_LBSPPB512_LPB16_MIWT2_1_PLR2_SU32_SUM0_SUS256_SKXCCM0_VWA1_VWB1_WGM1_WGMXCC1_WGMXCCGn1
    SolutionIndex: 45
    SolutionNameMin: Cijk_Alik_Bjlk_BSS_BH_UserArgs_MT32x32x128_MI16x16x1_SN_LDSB1_CLR1_GSU0_GSUC0_GSUWGMRR0_K1_LBSPPA256_LBSPPB512_LPB16_MIWT1_1_PLR1_SU32_SUM0_SUS256_SKXCCM0_VWA1_VWB1_WGM1_WGMXCC1_WGMXCCGn1
    SolutionIndex: 46
    SolutionNameMin: Cijk_Alik_Bjlk_BSS_BH_UserArgs_MT32x32x128_MI16x16x1_SN_LDSB1_CLR1_GSU0_GSUC0_GSUWGMRR0_K1_LBSPPA256_LBSPPB512_LPB16_MIWT1_1_PLR2_SU32_SUM0_SUS256_SKXCCM0_VWA1_VWB1_WGM1_WGMXCC1_WGMXCCGn1
    SolutionIndex: 47
    SolutionNameMin: Cijk_Alik_Bjlk_BSS_BH_UserArgs_MT32x32x128_MI16x16x1_SN_LDSB1_CLR1_GSU0_GSUC0_GSUWGMRR0_K1_LBSPPA256_LBSPPB512_LPB16_MIWT1_1_PLR1_SU32_SUM0_SUS256_SKXCCM0_VWA1_VWB1_WGM2_WGMXCC1_WGMXCCGn1
    SolutionIndex: 48
    SolutionNameMin: Cijk_Alik_Bjlk_BSS_BH_UserArgs_MT32x32x128_MI16x16x1_SN_LDSB1_CLR1_GSU0_GSUC0_GSUWGMRR0_K1_LBSPPA256_LBSPPB512_LPB16_MIWT1_1_PLR1_SU32_SUM0_SUS256_SKXCCM0_VWA1_VWB1_WGM4_WGMXCC1_WGMXCCGn1
    SolutionIndex: 49
    SolutionNameMin: Cijk_Alik_Bjlk_BSS_BH_UserArgs_MT256x256x32_MI16x16x1_SN_LDSB1_CLR1_GSU0_GSUC0_GSUWGMRR0_K1_LBSPPA128_LBSPPB2048_LPB0_MIWT8_8_PLR1_SU32_SUM0_SUS256_SKXCCM4_VWA1_VWB4_WGM1_WGMXCC1_WGMXCCGn1
    SolutionIndex: 50
    SolutionNameMin: Cijk_Alik_Bjlk_BSS_BH_UserArgs_MT256x256x32_MI16x16x1_SN_LDSB1_CLR1_GSU0_GSUC0_GSUWGMRR0_K1_LBSPPA256_LBSPPB2048_LPB0_MIWT8_8_PLR1_SU32_SUM0_SUS256_SKXCCM4_VWA4_VWB4_WGM1_WGMXCC1_WGMXCCGn1
    SolutionIndex: 51
    SolutionNameMin: Cijk_Alik_Bjlk_BSS_BH_UserArgs_MT256x256x32_MI16x16x1_SN_LDSB1_CLR1_GSU0_GSUC0_GSUWGMRR0_K1_LBSPPA256_LBSPPB2048_LPB0_MIWT8_8_PLR1_SU32_SUM0_SUS256_SKXCCM4_VWA4_VWB8_WGM1_WGMXCC1_WGMXCCGn1
    SolutionIndex: 52
    SolutionNameMin: Cijk_Alik_Bjlk_BSS_BH_UserArgs_MT256x256x32_MI16x16x1_SN_LDSB1_CLR1_GSU0_GSUC0_GSUWGMRR0_K1_LBSPPA256_LBSPPB2048_LPB0_MIWT8_8_PLR1_SU32_SUM0_SUS256_SKXCCM4_VWA4_VWB4_WGM2_WGMXCC1_WGMXCCGn1
    SolutionIndex: 53
    SolutionNameMin: Cijk_Alik_Bjlk_BSS_BH_UserArgs_MT256x256x32_MI16x16x1_SN_LDSB1_CLR1_GSU0_GSUC0_GSUWGMRR0_K1_LBSPPA256_LBSPPB2048_LPB0_MIWT8_8_PLR1_SU32_SUM0_SUS256_SKXCCM4_VWA4_VWB8_WGM2_WGMXCC1_WGMXCCGn1
    SolutionIndex: 54
    SolutionNameMin: Cijk_Alik_Bjlk_BSS_BH_UserArgs_MT256x256x32_MI16x16x1_SN_LDSB1_CLR1_GSU0_GSUC0_GSUWGMRR0_K1_LBSPPA256_LBSPPB2048_LPB0_MIWT8_8_PLR1_SU32_SUM0_SUS256_SKXCCM4_VWA4_VWB4_WGM4_WGMXCC1_WGMXCCGn1
    SolutionIndex: 55
    SolutionNameMin: Cijk_Alik_Bjlk_BSS_BH_UserArgs_MT128x256x32_MI16x16x1_SN_LDSB1_CLR1_GSU0_GSUC0_GSUWGMRR0_K1_LBSPPA256_LBSPPB2048_LPB32_MIWT4_8_PLR1_SU32_SUM0_SUS256_SKXCCM4_VWA4_VWB2_WGM1_WGMXCC1_WGMXCCGn1
    SolutionIndex: 56
    SolutionNameMin: Cijk_Alik_Bjlk_BSS_BH_UserArgs_MT128x256x32_MI16x16x1_SN_LDSB1_CLR1_GSU0_GSUC0_GSUWGMRR0_K1_LBSPPA256_LBSPPB2048_LPB0_MIWT4_8_PLR1_SU32_SUM0_SUS256_SKXCCM4_VWA4_VWB4_WGM1_WGMXCC1_WGMXCCGn1
    SolutionIndex: 57
    SolutionNameMin: Cijk_Alik_Bjlk_BSS_BH_UserArgs_MT128x256x32_MI16x16x1_SN_LDSB1_CLR1_GSU0_GSUC0_GSUWGMRR0_K1_LBSPPA256_LBSPPB2048_LPB0_MIWT4_8_PLR1_SU32_SUM0_SUS256_SKXCCM4_VWA4_VWB8_WGM1_WGMXCC1_WGMXCCGn1
    SolutionIndex: 58
    SolutionNameMin: Cijk_Alik_Bjlk_BSS_BH_UserArgs_MT128x256x32_MI16x16x1_SN_LDSB1_CLR1_GSU0_GSUC0_GSUWGMRR0_K1_LBSPPA256_LBSPPB2048_LPB32_MIWT4_8_PLR1_SU32_SUM0_SUS256_SKXCCM4_VWA4_VWB2_WGM2_WGMXCC1_WGMXCCGn1
    SolutionIndex: 59
    SolutionNameMin: Cijk_Alik_Bjlk_BSS_BH_UserArgs_MT128x256x32_MI16x16x1_SN_LDSB1_CLR1_GSU0_GSUC0_GSUWGMRR0_K1_LBSPPA256_LBSPPB2048_LPB0_MIWT4_8_PLR1_SU32_SUM0_SUS256_SKXCCM4_VWA4_VWB4_WGM2_WGMXCC1_WGMXCCGn1
    SolutionIndex: 60
    SolutionNameMin: Cijk_Alik_Bjlk_BSS_BH_UserArgs_MT128x256x32_MI16x16x1_SN_LDSB1_CLR1_GSU0_GSUC0_GSUWGMRR0_K1_LBSPPA128_LBSPPB2048_LPB32_MIWT4_8_PLR1_SU32_SUM0_SUS256_SKXCCM4_VWA1_VWB2_WGM4_WGMXCC1_WGMXCCGn1
    SolutionIndex: 61
    SolutionNameMin: Cijk_Alik_Bjlk_BSS_BH_UserArgs_MT128x256x32_MI16x16x1_SN_LDSB1_CLR1_GSU0_GSUC0_GSUWGMRR0_K1_LBSPPA256_LBSPPB2048_LPB0_MIWT4_8_PLR1_SU32_SUM0_SUS256_SKXCCM4_VWA4_VWB4_WGM4_WGMXCC1_WGMXCCGn1
    SolutionIndex: 62
    SolutionNameMin: Cijk_Alik_Bjlk_BSS_BH_UserArgs_MT128x256x32_MI16x16x1_SN_LDSB1_CLR1_GSU0_GSUC0_GSUWGMRR0_K1_LBSPPA256_LBSPPB2048_LPB0_MIWT4_8_PLR1_SU32_SUM0_SUS256_SKXCCM4_VWA4_VWB8_WGM4_WGMXCC1_WGMXCCGn1
    SolutionIndex: 63
    SolutionNameMin: Cijk_Alik_Bjlk_BSS_BH_UserArgs_MT256x128x32_MI16x16x1_SN_LDSB1_CLR1_GSU0_GSUC0_GSUWGMRR0_K1_LBSPPA256_LBSPPB1024_LPB0_MIWT8_4_PLR1_SU32_SUM0_SUS256_SKXCCM4_VWA4_VWB4_WGM2_WGMXCC1_WGMXCCGn1
    SolutionIndex: 64
    SolutionNameMin: Cijk_Alik_Bjlk_BSS_BH_UserArgs_MT128x128x32_MI16x16x1_SN_LDSB1_CLR1_GSU0_GSUC0_GSUWGMRR0_K1_LBSPPA256_LBSPPB1024_LPB32_MIWT4_4_PLR1_SU32_SUM0_SUS256_SKXCCM4_VWA4_VWB2_WGM1_WGMXCC1_WGMXCCGn1
    SolutionIndex: 65
    SolutionNameMin: Cijk_Alik_Bjlk_BSS_BH_UserArgs_MT128x128x32_MI16x16x1_SN_LDSB1_CLR1_GSU0_GSUC0_GSUWGMRR0_K1_LBSPPA128_LBSPPB1024_LPB0_MIWT4_4_PLR1_SU32_SUM0_SUS256_SKXCCM4_VWA1_VWB4_WGM1_WGMXCC1_WGMXCCGn1
    SolutionIndex: 66
    SolutionNameMin: Cijk_Alik_Bjlk_BSS_BH_UserArgs_MT128x128x32_MI16x16x1_SN_LDSB1_CLR1_GSU0_GSUC0_GSUWGMRR0_K1_LBSPPA256_LBSPPB1024_LPB0_MIWT4_4_PLR1_SU32_SUM0_SUS256_SKXCCM4_VWA4_VWB4_WGM1_WGMXCC1_WGMXCCGn1
    SolutionIndex: 67
    SolutionNameMin: Cijk_Alik_Bjlk_BSS_BH_UserArgs_MT128x128x32_MI16x16x1_SN_LDSB1_CLR1_GSU0_GSUC0_GSUWGMRR0_K1_LBSPPA128_LBSPPB1024_LPB32_MIWT4_4_PLR1_SU32_SUM0_SUS256_SKXCCM4_VWA1_VWB2_WGM2_WGMXCC1_WGMXCCGn1
    SolutionIndex: 68
    SolutionNameMin: Cijk_Alik_Bjlk_BSS_BH_UserArgs_MT128x128x32_MI16x16x1_SN_LDSB1_CLR1_GSU0_GSUC0_GSUWGMRR0_K1_LBSPPA256_LBSPPB1024_LPB32_MIWT4_4_PLR1_SU32_SUM0_SUS256_SKXCCM4_VWA4_VWB2_WGM2_WGMXCC1_WGMXCCGn1
    SolutionIndex: 69
    SolutionNameMin: Cijk_Alik_Bjlk_BSS_BH_UserArgs_MT128x128x32_MI16x16x1_SN_LDSB1_CLR1_GSU0_GSUC0_GSUWGMRR0_K1_LBSPPA128_LBSPPB1024_LPB0_MIWT4_4_PLR1_SU32_SUM0_SUS256_SKXCCM4_VWA1_VWB4_WGM2_WGMXCC1_WGMXCCGn1
    SolutionIndex: 70
    SolutionNameMin: Cijk_Alik_Bjlk_BSS_BH_UserArgs_MT128x128x32_MI16x16x1_SN_LDSB1_CLR1_GSU0_GSUC0_GSUWGMRR0_K1_LBSPPA128_LBSPPB1024_LPB0_MIWT4_4_PLR1_SU32_SUM0_SUS256_SKXCCM4_VWA1_VWB4_WGM4_WGMXCC1_WGMXCCGn1
    SolutionIndex: 71
    SolutionNameMin: Cijk_Alik_Bjlk_BSS_BH_UserArgs_MT128x128x32_MI16x16x1_SN_LDSB1_CLR1_GSU0_GSUC0_GSUWGMRR0_K1_LBSPPA256_LBSPPB1024_LPB0_MIWT4_4_PLR1_SU32_SUM0_SUS256_SKXCCM4_VWA4_VWB4_WGM4_WGMXCC1_WGMXCCGn1
    SolutionIndex: 72
    SolutionNameMin: Cijk_Alik_Bjlk_BSS_BH_UserArgs_MT64x128x32_MI16x16x1_SN_LDSB0_CLR0_GSU0_GSUC0_GSUWGMRR0_K1_LBSPPA128_LBSPPB1024_LPB0_MIWT2_4_PLR0_SU32_SUM0_SUS256_SKXCCM4_VWA1_VWB4_WGM1_WGMXCC1_WGMXCCGn1
    SolutionIndex: 73
    SolutionNameMin: Cijk_Alik_Bjlk_BSS_BH_UserArgs_MT128x64x32_MI16x16x1_SN_LDSB0_CLR1_GSU0_GSUC0_GSUWGMRR0_K1_LBSPPA256_LBSPPB512_LPB32_MIWT4_2_PLR1_SU32_SUM0_SUS256_SKXCCM4_VWA4_VWB2_WGM1_WGMXCC1_WGMXCCGn1
    SolutionIndex: 74
    SolutionNameMin: Cijk_Alik_Bjlk_BSS_BH_UserArgs_MT128x64x32_MI16x16x1_SN_LDSB0_CLR1_GSU0_GSUC0_GSUWGMRR0_K1_LBSPPA256_LBSPPB512_LPB32_MIWT4_2_PLR1_SU32_SUM0_SUS256_SKXCCM4_VWA4_VWB2_WGM2_WGMXCC1_WGMXCCGn1
    SolutionIndex: 75
    SolutionNameMin: Cijk_Alik_Bjlk_BSS_BH_UserArgs_MT128x64x32_MI16x16x1_SN_LDSB0_CLR1_GSU0_GSUC0_GSUWGMRR0_K1_LBSPPA256_LBSPPB512_LPB32_MIWT4_2_PLR1_SU32_SUM0_SUS256_SKXCCM4_VWA4_VWB2_WGM4_WGMXCC1_WGMXCCGn1
    SolutionIndex: 76
    SolutionNameMin: Cijk_Alik_Bjlk_BSS_BH_UserArgs_MT128x64x32_MI16x16x1_SN_LDSB0_CLR0_GSU0_GSUC0_GSUWGMRR0_K1_LBSPPA256_LBSPPB512_LPB32_MIWT4_2_PLR0_SU32_SUM0_SUS256_SKXCCM4_VWA4_VWB2_WGM4_WGMXCC1_WGMXCCGn1
    SolutionIndex: 77
    SolutionNameMin: Cijk_Alik_Bjlk_BSS_BH_UserArgs_MT128x256x64_MI16x16x1_SN_LDSB1_CLR1_GSU0_GSUC0_GSUWGMRR0_K1_LBSPPA512_LBSPPB4096_LPB0_MIWT4_8_PLR1_SU32_SUM0_SUS256_SKXCCM4_VWA4_VWB4_WGM1_WGMXCC1_WGMXCCGn1
    SolutionIndex: 78
    SolutionNameMin: Cijk_Alik_Bjlk_BSS_BH_UserArgs_MT256x128x64_MI16x16x1_SN_LDSB1_CLR1_GSU0_GSUC0_GSUWGMRR0_K1_LBSPPA512_LBSPPB2048_LPB0_MIWT8_4_PLR1_SU32_SUM0_SUS256_SKXCCM4_VWA4_VWB4_WGM1_WGMXCC1_WGMXCCGn1
    SolutionIndex: 79
    SolutionNameMin: Cijk_Alik_Bjlk_BSS_BH_UserArgs_MT256x128x64_MI16x16x1_SN_LDSB1_CLR1_GSU0_GSUC0_GSUWGMRR0_K1_LBSPPA512_LBSPPB2048_LPB0_MIWT8_4_PLR1_SU32_SUM0_SUS256_SKXCCM4_VWA4_VWB4_WGM4_WGMXCC1_WGMXCCGn1
    SolutionIndex: 80
    SolutionNameMin: Cijk_Alik_Bjlk_BSS_BH_UserArgs_MT128x128x64_MI16x16x1_SN_LDSB1_CLR1_GSU0_GSUC0_GSUWGMRR0_K1_LBSPPA512_LBSPPB2048_LPB0_MIWT4_4_PLR1_SU32_SUM0_SUS256_SKXCCM4_VWA4_VWB4_WGM1_WGMXCC1_WGMXCCGn1
    SolutionIndex: 81
    SolutionNameMin: Cijk_Alik_Bjlk_BSS_BH_UserArgs_MT128x128x64_MI16x16x1_SN_LDSB1_CLR1_GSU0_GSUC0_GSUWGMRR0_K1_LBSPPA512_LBSPPB2048_LPB0_MIWT4_4_PLR1_SU32_SUM0_SUS256_SKXCCM4_VWA4_VWB4_WGM2_WGMXCC1_WGMXCCGn1
    SolutionIndex: 82
    SolutionNameMin: Cijk_Alik_Bjlk_BSS_BH_UserArgs_MT128x128x64_MI16x16x1_SN_LDSB1_CLR1_GSU0_GSUC0_GSUWGMRR0_K1_LBSPPA512_LBSPPB2048_LPB0_MIWT4_4_PLR1_SU32_SUM0_SUS256_SKXCCM4_VWA4_VWB4_WGM4_WGMXCC1_WGMXCCGn1
    SolutionIndex: 83
    SolutionNameMin: Cijk_Alik_Bjlk_BSS_BH_UserArgs_MT128x64x64_MI16x16x1_SN_LDSB1_CLR1_GSU0_GSUC0_GSUWGMRR0_K1_LBSPPA128_LBSPPB1024_LPB32_MIWT4_2_PLR1_SU32_SUM0_SUS256_SKXCCM4_VWA1_VWB2_WGM1_WGMXCC1_WGMXCCGn1
    SolutionIndex: 84
    SolutionNameMin: Cijk_Alik_Bjlk_BSS_BH_UserArgs_MT128x64x64_MI16x16x1_SN_LDSB1_CLR1_GSU0_GSUC0_GSUWGMRR0_K1_LBSPPA512_LBSPPB1024_LPB32_MIWT4_2_PLR1_SU32_SUM0_SUS256_SKXCCM4_VWA4_VWB2_WGM1_WGMXCC1_WGMXCCGn1
    SolutionIndex: 85
    SolutionNameMin: Cijk_Alik_Bjlk_BSS_BH_UserArgs_MT128x64x64_MI16x16x1_SN_LDSB1_CLR1_GSU0_GSUC0_GSUWGMRR0_K1_LBSPPA128_LBSPPB1024_LPB32_MIWT4_2_PLR1_SU32_SUM0_SUS256_SKXCCM4_VWA1_VWB2_WGM2_WGMXCC1_WGMXCCGn1
    SolutionIndex: 86
    SolutionNameMin: Cijk_Alik_Bjlk_BSS_BH_UserArgs_MT128x64x64_MI16x16x1_SN_LDSB1_CLR1_GSU0_GSUC0_GSUWGMRR0_K1_LBSPPA512_LBSPPB1024_LPB32_MIWT4_2_PLR1_SU32_SUM0_SUS256_SKXCCM4_VWA4_VWB2_WGM2_WGMXCC1_WGMXCCGn1
    SolutionIndex: 87
    SolutionNameMin: Cijk_Alik_Bjlk_BSS_BH_UserArgs_MT128x64x64_MI16x16x1_SN_LDSB1_CLR1_GSU0_GSUC0_GSUWGMRR0_K1_LBSPPA128_LBSPPB1024_LPB32_MIWT4_2_PLR1_SU32_SUM0_SUS256_SKXCCM4_VWA1_VWB2_WGM4_WGMXCC1_WGMXCCGn1
    SolutionIndex: 88
    SolutionNameMin: Cijk_Alik_Bjlk_BSS_BH_UserArgs_MT128x64x64_MI16x16x1_SN_LDSB1_CLR1_GSU0_GSUC0_GSUWGMRR0_K1_LBSPPA512_LBSPPB1024_LPB32_MIWT4_2_PLR1_SU32_SUM0_SUS256_SKXCCM4_VWA4_VWB2_WGM4_WGMXCC1_WGMXCCGn1
    SolutionIndex: 89
    SolutionNameMin: Cijk_Alik_Bjlk_BSS_BH_UserArgs_MT64x64x64_MI16x16x1_SN_LDSB1_CLR1_GSU0_GSUC0_GSUWGMRR0_K1_LBSPPA128_LBSPPB1024_LPB32_MIWT2_2_PLR1_SU32_SUM0_SUS256_SKXCCM4_VWA1_VWB2_WGM1_WGMXCC1_WGMXCCGn1
    SolutionIndex: 90
    SolutionNameMin: Cijk_Alik_Bjlk_BSS_BH_UserArgs_MT64x64x64_MI16x16x1_SN_LDSB1_CLR1_GSU0_GSUC0_GSUWGMRR0_K1_LBSPPA128_LBSPPB1024_LPB32_MIWT2_2_PLR1_SU32_SUM0_SUS256_SKXCCM4_VWA1_VWB2_WGM2_WGMXCC1_WGMXCCGn1
    SolutionIndex: 91
    SolutionNameMin: Cijk_Alik_Bjlk_BSS_BH_UserArgs_MT64x64x64_MI16x16x1_SN_LDSB1_CLR1_GSU0_GSUC0_GSUWGMRR0_K1_LBSPPA128_LBSPPB1024_LPB32_MIWT2_2_PLR1_SU32_SUM0_SUS256_SKXCCM4_VWA1_VWB2_WGM4_WGMXCC1_WGMXCCGn1
    SolutionIndex: 92
    SolutionNameMin: Cijk_Alik_Bjlk_BSS_BH_UserArgs_MT32x64x64_MI16x16x1_SN_LDSB0_CLR1_GSU0_GSUC0_GSUWGMRR0_K1_LBSPPA128_LBSPPB1024_LPB32_MIWT1_2_PLR1_SU32_SUM0_SUS256_SKXCCM4_VWA1_VWB2_WGM1_WGMXCC1_WGMXCCGn1
    SolutionIndex: 93
    SolutionNameMin: Cijk_Alik_Bjlk_BSS_BH_UserArgs_MT64x32x64_MI16x16x1_SN_LDSB0_CLR1_GSU0_GSUC0_GSUWGMRR0_K1_LBSPPA128_LBSPPB512_LPB16_MIWT2_1_PLR1_SU32_SUM0_SUS256_SKXCCM4_VWA1_VWB1_WGM1_WGMXCC1_WGMXCCGn1
    SolutionIndex: 94
    SolutionNameMin: Cijk_Alik_Bjlk_BSS_BH_UserArgs_MT128x64x128_MI16x16x1_SN_LDSB1_CLR1_GSU0_GSUC0_GSUWGMRR0_K1_LBSPPA1024_LBSPPB1024_LPB32_MIWT4_2_PLR2_SU32_SUM0_SUS256_SKXCCM4_VWA4_VWB2_WGM1_WGMXCC1_WGMXCCGn1
    SolutionIndex: 95
    SolutionNameMin: Cijk_Alik_Bjlk_BSS_BH_UserArgs_MT128x64x128_MI16x16x1_SN_LDSB1_CLR1_GSU0_GSUC0_GSUWGMRR0_K1_LBSPPA1024_LBSPPB1024_LPB32_MIWT4_2_PLR2_SU32_SUM0_SUS256_SKXCCM4_VWA4_VWB2_WGM4_WGMXCC1_WGMXCCGn1
    SolutionIndex: 96
    SolutionNameMin: Cijk_Alik_Bjlk_BSS_BH_UserArgs_MT64x64x128_MI16x16x1_SN_LDSB1_CLR1_GSU0_GSUC0_GSUWGMRR0_K1_LBSPPA256_LBSPPB1024_LPB32_MIWT2_2_PLR2_SU32_SUM0_SUS256_SKXCCM4_VWA1_VWB2_WGM1_WGMXCC1_WGMXCCGn1
    SolutionIndex: 97
    SolutionNameMin: Cijk_Alik_Bjlk_BSS_BH_UserArgs_MT32x64x128_MI16x16x1_SN_LDSB1_CLR1_GSU0_GSUC0_GSUWGMRR0_K1_LBSPPA256_LBSPPB1024_LPB32_MIWT1_2_PLR1_SU32_SUM0_SUS256_SKXCCM4_VWA1_VWB2_WGM1_WGMXCC1_WGMXCCGn1
    SolutionIndex: 98
    SolutionNameMin: Cijk_Alik_Bjlk_BSS_BH_UserArgs_MT32x64x128_MI16x16x1_SN_LDSB1_CLR1_GSU0_GSUC0_GSUWGMRR0_K1_LBSPPA256_LBSPPB1024_LPB32_MIWT1_2_PLR2_SU32_SUM0_SUS256_SKXCCM4_VWA1_VWB2_WGM1_WGMXCC1_WGMXCCGn1
    SolutionIndex: 99
    SolutionNameMin: Cijk_Alik_Bjlk_BSS_BH_UserArgs_MT32x32x128_MI16x16x1_SN_LDSB1_CLR1_GSU0_GSUC0_GSUWGMRR0_K1_LBSPPA256_LBSPPB512_LPB16_MIWT1_1_PLR1_SU32_SUM0_SUS256_SKXCCM4_VWA1_VWB1_WGM1_WGMXCC1_WGMXCCGn1
    SolutionIndex: 100
    SolutionNameMin: Cijk_Alik_Bjlk_BSS_BH_UserArgs_MT32x32x128_MI16x16x1_SN_LDSB1_CLR1_GSU0_GSUC0_GSUWGMRR0_K1_LBSPPA256_LBSPPB512_LPB16_MIWT1_1_PLR2_SU32_SUM0_SUS256_SKXCCM4_VWA1_VWB1_WGM1_WGMXCC1_WGMXCCGn1
    SolutionIndex: 101
    SolutionNameMin: Cijk_Alik_Bjlk_BSS_BH_UserArgs_MT32x32x32_MI16x16x1_SN_LDSB0_CLR1_GSU0_GSUC0_GSUWGMRR0_K1_LBSPPA128_LBSPPB256_LPB16_MIWT1_1_PLR1_SU32_SUM0_SUS256_SKXCCM0_VWA1_VWB1_WGM1_WGMXCC1_WGMXCCGn1
- - - [128, 128, 1, 128, 128, 128, 128, 128]
    - [100, 0.088]
  - - [128, 128, 1, 256, 128, 128, 256, 128]
    - [46, 0.111]
  - - [128, 128, 1, 512, 128, 128, 512, 128]
    - [45, 0.187]
  - - [128, 128, 1, 1024, 128, 128, 1024, 128]
    - [45, 0.284]
  - - [128, 128, 1, 2048, 128, 128, 2048, 128]
    - [45, 0.529]
  - - [128, 128, 1, 4096, 128, 128, 4096, 128]
    - [99, 0.928]
  - - [128, 128, 1, 8192, 128, 128, 8192, 128]
    - [45, 1.485]
  - - [128, 256, 1, 128, 128, 128, 128, 256]
    - [46, 0.17]
  - - [128, 256, 1, 256, 128, 128, 256, 256]
    - [46, 0.22]
  - - [128, 256, 1, 512, 128, 128, 512, 256]
    - [46, 0.363]
  - - [128, 256, 1, 1024, 128, 128, 1024, 256]
    - [100, 0.594]
  - - [128, 256, 1, 2048, 128, 128, 2048, 256]
    - [22, 1.036]
  - - [128, 256, 1, 4096, 128, 128, 4096, 256]
    - [98, 1.646]
  - - [128, 256, 1, 8192, 128, 128, 8192, 256]
    - [43, 2.498]
  - - [128, 512, 1, 128, 128, 128, 128, 512]
    - [46, 0.334]
  - - [128, 512, 1, 256, 128, 128, 256, 512]
    - [45, 0.429]
  - - [128, 512, 1, 512, 128, 128, 512, 512]
    - [23, 0.702]
  - - [128, 512, 1, 1024, 128, 128, 1024, 512]
    - [45, 1.254]
  - - [128, 512, 1, 2048, 128, 128, 2048, 512]
    - [48, 1.878]
  - - [128, 512, 1, 4096, 128, 128, 4096, 512]
    - [92, 2.824]
  - - [128, 512, 1, 8192, 128, 128, 8192, 512]
    - [96, 4.272]
  - - [128, 1024, 1, 128, 128, 128, 128, 1024]
    - [42, 0.622]
  - - [128, 1024, 1, 256, 128, 128, 256, 1024]
    - [45, 1.039]
  - - [128, 1024, 1, 512, 128, 128, 512, 1024]
    - [100, 1.613]
  - - [128, 1024, 1, 1024, 128, 128, 1024, 1024]
    - [45, 2.289]
  - - [128, 1024, 1, 2048, 128, 128, 2048, 1024]
    - [42, 3.183]
  - - [128, 1024, 1, 4096, 128, 128, 4096, 1024]
    - [89, 4.729]
  - - [128, 1024, 1, 8192, 128, 128, 8192, 1024]
    - [94, 6.734]
  - - [128, 2048, 1, 128, 128, 128, 128, 2048]
    - [44, 1.107]
  - - [128, 2048, 1, 256, 128, 128, 256, 2048]
    - [92, 1.836]
  - - [128, 2048, 1, 512, 128, 128, 512, 2048]
    - [98, 2.796]
  - - [128, 2048, 1, 1024, 128, 128, 1024, 2048]
    - [98, 3.891]
  - - [128, 2048, 1, 2048, 128, 128, 2048, 2048]
    - [72, 4.352]
  - - [128, 2048, 1, 4096, 128, 128, 4096, 2048]
    - [84, 6.778]
  - - [128, 2048, 1, 8192, 128, 128, 8192, 2048]
    - [30, 9.858]
  - - [128, 4096, 1, 128, 128, 128, 128, 4096]
    - [89, 1.877]
  - - [128, 4096, 1, 256, 128, 128, 256, 4096]
    - [89, 3.199]
  - - [128, 4096, 1, 512, 128, 128, 512, 4096]
    - [89, 4.76]
  - - [128, 4096, 1, 1024, 128, 128, 1024, 4096]
    - [84, 5.501]
  - - [128, 4096, 1, 2048, 128, 128, 2048, 4096]
    - [89, 6.129]
  - - [128, 4096, 1, 4096, 128, 128, 4096, 4096]
    - [18, 8.478]
  - - [128, 4096, 1, 8192, 128, 128, 8192, 4096]
    - [77, 11.473]
  - - [128, 8192, 1, 128, 128, 128, 128, 8192]
    - [73, 2.851]
  - - [128, 8192, 1, 256, 128, 128, 256, 8192]
    - [84, 4.728]
  - - [128, 8192, 1, 512, 128, 128, 512, 8192]
    - [84, 6.606]
  - - [128, 8192, 1, 1024, 128, 128, 1024, 8192]
    - [94, 7.256]
  - - [128, 8192, 1, 2048, 128, 128, 2048, 8192]
    - [84, 8.188]
  - - [128, 8192, 1, 4096, 128, 128, 4096, 8192]
    - [9, 10.741]
  - - [128, 8192, 1, 8192, 128, 128, 8192, 8192]
    - [25, 11.498]
  - - [256, 128, 1, 128, 256, 256, 128, 128]
    - [99, 0.167]
  - - [256, 128, 1, 256, 256, 256, 256, 128]
    - [45, 0.219]
  - - [256, 128, 1, 512, 256, 256, 512, 128]
    - [45, 0.365]
  - - [256, 128, 1, 1024, 256, 256, 1024, 128]
    - [45, 0.592]
  - - [256, 128, 1, 2048, 256, 256, 2048, 128]
    - [22, 1.037]
  - - [256, 128, 1, 4096, 256, 256, 4096, 128]
    - [98, 1.632]
  - - [256, 128, 1, 8192, 256, 256, 8192, 128]
    - [98, 2.594]
  - - [256, 256, 1, 128, 256, 256, 128, 256]
    - [45, 0.339]
  - - [256, 256, 1, 256, 256, 256, 256, 256]
    - [45, 0.434]
  - - [256, 256, 1, 512, 256, 256, 512, 256]
    - [23, 0.705]
  - - [256, 256, 1, 1024, 256, 256, 1024, 256]
    - [45, 1.246]
  - - [256, 256, 1, 2048, 256, 256, 2048, 256]
    - [47, 1.874]
  - - [256, 256, 1, 4096, 256, 256, 4096, 256]
    - [92, 2.876]
  - - [256, 256, 1, 8192, 256, 256, 8192, 256]
    - [41, 4.176]
  - - [256, 512, 1, 128, 256, 256, 128, 512]
    - [98, 0.621]
  - - [256, 512, 1, 256, 256, 256, 256, 512]
    - [99, 1.035]
  - - [256, 512, 1, 512, 256, 256, 512, 512]
    - [99, 1.631]
  - - [256, 512, 1, 1024, 256, 256, 1024, 512]
    - [100, 2.281]
  - - [256, 512, 1, 2048, 256, 256, 2048, 512]
    - [97, 3.262]
  - - [256, 512, 1, 4096, 256, 256, 4096, 512]
    - [89, 4.807]
  - - [256, 512, 1, 8192, 256, 256, 8192, 512]
    - [95, 6.664]
  - - [256, 1024, 1, 128, 256, 256, 128, 1024]
    - [98, 1.106]
  - - [256, 1024, 1, 256, 256, 256, 256, 1024]
    - [42, 1.819]
  - - [256, 1024, 1, 512, 256, 256, 512, 1024]
    - [98, 2.8]
  - - [256, 1024, 1, 1024, 256, 256, 1024, 1024]
    - [98, 3.895]
  - - [256, 1024, 1, 2048, 256, 256, 2048, 1024]
    - [76, 4.44]
  - - [256, 1024, 1, 4096, 256, 256, 4096, 1024]
    - [33, 6.94]
  - - [256, 1024, 1, 8192, 256, 256, 8192, 1024]
    - [80, 9.676]
  - - [256, 2048, 1, 128, 256, 256, 128, 2048]
    - [89, 1.862]
  - - [256, 2048, 1, 256, 256, 256, 256, 2048]
    - [89, 3.174]
  - - [256, 2048, 1, 512, 256, 256, 512, 2048]
    - [89, 4.758]
  - - [256, 2048, 1, 1024, 256, 256, 1024, 2048]
    - [84, 5.495]
  - - [256, 2048, 1, 2048, 256, 256, 2048, 2048]
    - [18, 6.192]
  - - [256, 2048, 1, 4096, 256, 256, 4096, 2048]
    - [20, 8.019]
  - - [256, 2048, 1, 8192, 256, 256, 8192, 2048]
    - [26, 11.447]
  - - [256, 4096, 1, 128, 256, 256, 128, 4096]
    - [75, 2.826]
  - - [256, 4096, 1, 256, 256, 256, 256, 4096]
    - [84, 4.811]
  - - [256, 4096, 1, 512, 256, 256, 512, 4096]
    - [87, 6.863]
  - - [256, 4096, 1, 1024, 256, 256, 1024, 4096]
    - [95, 7.308]
  - - [256, 4096, 1, 2048, 256, 256, 2048, 4096]
    - [84, 8.282]
  - - [256, 4096, 1, 4096, 256, 256, 4096, 4096]
    - [9, 10.642]
  - - [256, 4096, 1, 8192, 256, 256, 8192, 4096]
    - [28, 11.673]
  - - [256, 8192, 1, 128, 256, 256, 128, 8192]
    - [21, 3.946]
  - - [256, 8192, 1, 256, 256, 256, 256, 8192]
    - [17, 5.908]
  - - [256, 8192, 1, 512, 256, 256, 512, 8192]
    - [82, 7.422]
  - - [256, 8192, 1, 1024, 256, 256, 1024, 8192]
    - [84, 9.305]
  - - [256, 8192, 1, 2048, 256, 256, 2048, 8192]
    - [84, 10.608]
  - - [256, 8192, 1, 4096, 256, 256, 4096, 8192]
    - [21, 11.393]
  - - [256, 8192, 1, 8192, 256, 256, 8192, 8192]
    - [57, 14.098]
  - - [512, 128, 1, 128, 512, 512, 128, 128]
    - [45, 0.336]
  - - [512, 128, 1, 256, 512, 512, 256, 128]
    - [46, 0.429]
  - - [512, 128, 1, 512, 512, 512, 512, 128]
    - [22, 0.714]
  - - [512, 128, 1, 1024, 512, 512, 1024, 128]
    - [45, 1.254]
  - - [512, 128, 1, 2048, 512, 512, 2048, 128]
    - [45, 1.877]
  - - [512, 128, 1, 4096, 512, 512, 4096, 128]
    - [92, 2.865]
  - - [512, 128, 1, 8192, 512, 512, 8192, 128]
    - [41, 4.302]
  - - [512, 256, 1, 128, 512, 512, 128, 256]
    - [42, 0.629]
  - - [512, 256, 1, 256, 512, 512, 256, 256]
    - [99, 1.044]
  - - [512, 256, 1, 512, 512, 512, 512, 256]
    - [46, 1.64]
  - - [512, 256, 1, 1024, 512, 512, 1024, 256]
    - [100, 2.298]
  - - [512, 256, 1, 2048, 512, 512, 2048, 256]
    - [97, 3.253]
  - - [512, 256, 1, 4096, 512, 512, 4096, 256]
    - [91, 4.712]
  - - [512, 256, 1, 8192, 512, 512, 8192, 256]
    - [94, 6.512]
  - - [512, 512, 1, 128, 512, 512, 128, 512]
    - [93, 1.096]
  - - [512, 512, 1, 256, 512, 512, 256, 512]
    - [98, 1.824]
  - - [512, 512, 1, 512, 512, 512, 512, 512]
    - [42, 2.823]
  - - [512, 512, 1, 1024, 512, 512, 1024, 512]
    - [98, 3.926]
  - - [512, 512, 1, 2048, 512, 512, 2048, 512]
    - [76, 4.613]
  - - [512, 512, 1, 4096, 512, 512, 4096, 512]
    - [33, 7.016]
  - - [512, 512, 1, 8192, 512, 512, 8192, 512]
    - [30, 9.724]
  - - [512, 1024, 1, 128, 512, 512, 128, 1024]
    - [89, 1.879]
  - - [512, 1024, 1, 256, 512, 512, 256, 1024]
    - [89, 3.19]
  - - [512, 1024, 1, 512, 512, 512, 512, 1024]
    - [89, 4.755]
  - - [512, 1024, 1, 1024, 512, 512, 1024, 1024]
    - [84, 5.536]
  - - [512, 1024, 1, 2048, 512, 512, 2048, 1024]
    - [89, 6.271]
  - - [512, 1024, 1, 4096, 512, 512, 4096, 1024]
    - [56, 7.951]
  - - [512, 1024, 1, 8192, 512, 512, 8192, 1024]
    - [26, 11.487]
  - - [512, 2048, 1, 128, 512, 512, 128, 2048]
    - [84, 2.842]
  - - [512, 2048, 1, 256, 512, 512, 256, 2048]
    - [84, 4.794]
  - - [512, 2048, 1, 512, 512, 512, 512, 2048]
    - [83, 6.796]
  - - [512, 2048, 1, 1024, 512, 512, 1024, 2048]
    - [94, 7.268]
  - - [512, 2048, 1, 2048, 512, 512, 2048, 2048]
    - [84, 8.37]
  - - [512, 2048, 1, 4096, 512, 512, 4096, 2048]
    - [13, 10.454]
  - - [512, 2048, 1, 8192, 512, 512, 8192, 2048]
    - [26, 11.709]
  - - [512, 4096, 1, 128, 512, 512, 128, 4096]
    - [66, 3.94]
  - - [512, 4096, 1, 256, 512, 512, 256, 4096]
    - [70, 5.978]
  - - [512, 4096, 1, 512, 512, 512, 512, 4096]
    - [81, 7.486]
  - - [512, 4096, 1, 1024, 512, 512, 1024, 4096]
    - [84, 9.288]
  - - [512, 4096, 1, 2048, 512, 512, 2048, 4096]
    - [84, 10.615]
  - - [512, 4096, 1, 4096, 512, 512, 4096, 4096]
    - [7, 11.195]
  - - [512, 4096, 1, 8192, 512, 512, 8192, 4096]
    - [59, 13.854]
  - - [512, 8192, 1, 128, 512, 512, 128, 8192]
    - [6, 5.126]
  - - [512, 8192, 1, 256, 512, 512, 256, 8192]
    - [59, 7.696]
  - - [512, 8192, 1, 512, 512, 512, 512, 8192]
    - [66, 9.495]
  - - [512, 8192, 1, 1024, 512, 512, 1024, 8192]
    - [66, 11.595]
  - - [512, 8192, 1, 2048, 512, 512, 2048, 8192]
    - [29, 12.658]
  - - [512, 8192, 1, 4096, 512, 512, 4096, 8192]
    - [57, 13.729]
  - - [512, 8192, 1, 8192, 512, 512, 8192, 8192]
    - [7, 15.756]
  - - [1024, 128, 1, 128, 1024, 1024, 128, 128]
    - [42, 0.621]
  - - [1024, 128, 1, 256, 1024, 1024, 256, 128]
    - [99, 1.048]
  - - [1024, 128, 1, 512, 1024, 1024, 512, 128]
    - [99, 1.644]
  - - [1024, 128, 1, 1024, 1024, 1024, 1024, 128]
    - [99, 2.29]
  - - [1024, 128, 1, 2048, 1024, 1024, 2048, 128]
    - [97, 3.239]
  - - [1024, 128, 1, 4096, 1024, 1024, 4096, 128]
    - [90, 4.73]
  - - [1024, 128, 1, 8192, 1024, 1024, 8192, 128]
    - [40, 6.56]
  - - [1024, 256, 1, 128, 1024, 1024, 128, 256]
    - [98, 1.112]
  - - [1024, 256, 1, 256, 1024, 1024, 256, 256]
    - [98, 1.853]
  - - [1024, 256, 1, 512, 1024, 1024, 512, 256]
    - [98, 2.83]
  - - [1024, 256, 1, 1024, 1024, 1024, 1024, 256]
    - [98, 3.931]
  - - [1024, 256, 1, 2048, 1024, 1024, 2048, 256]
    - [76, 4.591]
  - - [1024, 256, 1, 4096, 1024, 1024, 4096, 256]
    - [88, 7.005]
  - - [1024, 256, 1, 8192, 1024, 1024, 8192, 256]
    - [31, 9.709]
  - - [1024, 512, 1, 128, 1024, 1024, 128, 512]
    - [89, 1.898]
  - - [1024, 512, 1, 256, 1024, 1024, 256, 512]
    - [89, 3.188]
  - - [1024, 512, 1, 512, 1024, 1024, 512, 512]
    - [89, 4.756]
  - - [1024, 512, 1, 1024, 1024, 1024, 1024, 512]
    - [88, 5.551]
  - - [1024, 512, 1, 2048, 1024, 1024, 2048, 512]
    - [91, 6.24]
  - - [1024, 512, 1, 4096, 1024, 1024, 4096, 512]
    - [9, 7.955]
  - - [1024, 512, 1, 8192, 1024, 1024, 8192, 512]
    - [79, 11.495]
  - - [1024, 1024, 1, 128, 1024, 1024, 128, 1024]
    - [84, 2.895]
  - - [1024, 1024, 1, 256, 1024, 1024, 256, 1024]
    - [86, 4.775]
  - - [1024, 1024, 1, 512, 1024, 1024, 512, 1024]
    - [85, 6.881]
  - - [1024, 1024, 1, 1024, 1024, 1024, 1024, 1024]
    - [39, 7.382]
  - - [1024, 1024, 1, 2048, 1024, 1024, 2048, 1024]
    - [33, 8.267]
  - - [1024, 1024, 1, 4096, 1024, 1024, 4096, 1024]
    - [11, 10.497]
  - - [1024, 1024, 1, 8192, 1024, 1024, 8192, 1024]
    - [24, 11.6]
  - - [1024, 2048, 1, 128, 1024, 1024, 128, 2048]
    - [66, 3.917]
  - - [1024, 2048, 1, 256, 1024, 1024, 256, 2048]
    - [65, 5.994]
  - - [1024, 2048, 1, 512, 1024, 1024, 512, 2048]
    - [30, 7.648]
  - - [1024, 2048, 1, 1024, 1024, 1024, 1024, 2048]
    - [34, 9.379]
  - - [1024, 2048, 1, 2048, 1024, 1024, 2048, 2048]
    - [33, 10.457]
  - - [1024, 2048, 1, 4096, 1024, 1024, 4096, 2048]
    - [61, 11.139]
  - - [1024, 2048, 1, 8192, 1024, 1024, 8192, 2048]
    - [56, 13.927]
  - - [1024, 4096, 1, 128, 1024, 1024, 128, 4096]
    - [13, 5.079]
  - - [1024, 4096, 1, 256, 1024, 1024, 256, 4096]
    - [12, 7.702]
  - - [1024, 4096, 1, 512, 1024, 1024, 512, 4096]
    - [66, 9.408]
  - - [1024, 4096, 1, 1024, 1024, 1024, 1024, 4096]
    - [69, 11.261]
  - - [1024, 4096, 1, 2048, 1024, 1024, 2048, 4096]
    - [31, 12.618]
  - - [1024, 4096, 1, 4096, 1024, 1024, 4096, 4096]
    - [61, 13.716]
  - - [1024, 4096, 1, 8192, 1024, 1024, 8192, 4096]
    - [10, 15.701]
  - - [1024, 8192, 1, 128, 1024, 1024, 128, 8192]
    - [13, 5.415]
  - - [1024, 8192, 1, 256, 1024, 1024, 256, 8192]
    - [12, 8.064]
  - - [1024, 8192, 1, 512, 1024, 1024, 512, 8192]
    - [56, 11.171]
  - - [1024, 8192, 1, 1024, 1024, 1024, 1024, 8192]
    - [57, 13.702]
  - - [1024, 8192, 1, 2048, 1024, 1024, 2048, 8192]
    - [26, 14.051]
  - - [1024, 8192, 1, 4096, 1024, 1024, 4096, 8192]
    - [57, 15.565]
  - - [1024, 8192, 1, 8192, 1024, 1024, 8192, 8192]
    - [62, 17.181]
  - - [2048, 128, 1, 128, 2048, 2048, 128, 128]
    - [98, 1.107]
  - - [2048, 128, 1, 256, 2048, 2048, 256, 128]
    - [98, 1.845]
  - - [2048, 128, 1, 512, 2048, 2048, 512, 128]
    - [98, 2.837]
  - - [2048, 128, 1, 1024, 2048, 2048, 1024, 128]
    - [98, 3.928]
  - - [2048, 128, 1, 2048, 2048, 2048, 2048, 128]
    - [74, 4.57]
  - - [2048, 128, 1, 4096, 2048, 2048, 4096, 128]
    - [35, 6.774]
  - - [2048, 128, 1, 8192, 2048, 2048, 8192, 128]
    - [30, 9.709]
  - - [2048, 256, 1, 128, 2048, 2048, 128, 256]
    - [89, 1.905]
  - - [2048, 256, 1, 256, 2048, 2048, 256, 256]
    - [89, 3.236]
  - - [2048, 256, 1, 512, 2048, 2048, 512, 256]
    - [89, 4.778]
  - - [2048, 256, 1, 1024, 2048, 2048, 1024, 256]
    - [88, 5.567]
  - - [2048, 256, 1, 2048, 2048, 2048, 2048, 256]
    - [91, 6.313]
  - - [2048, 256, 1, 4096, 2048, 2048, 4096, 256]
    - [56, 8.003]
  - - [2048, 256, 1, 8192, 2048, 2048, 8192, 256]
    - [78, 11.519]
  - - [2048, 512, 1, 128, 2048, 2048, 128, 512]
    - [73, 2.864]
  - - [2048, 512, 1, 256, 2048, 2048, 256, 512]
    - [84, 4.843]
  - - [2048, 512, 1, 512, 2048, 2048, 512, 512]
    - [87, 6.85]
  - - [2048, 512, 1, 1024, 2048, 2048, 1024, 512]
    - [38, 7.344]
  - - [2048, 512, 1, 2048, 2048, 2048, 2048, 512]
    - [36, 8.298]
  - - [2048, 512, 1, 4096, 2048, 2048, 4096, 512]
    - [11, 10.422]
  - - [2048, 512, 1, 8192, 2048, 2048, 8192, 512]
    - [26, 11.618]
  - - [2048, 1024, 1, 128, 2048, 2048, 128, 1024]
    - [66, 3.934]
  - - [2048, 1024, 1, 256, 2048, 2048, 256, 1024]
    - [19, 5.997]
  - - [2048, 1024, 1, 512, 2048, 2048, 512, 1024]
    - [30, 7.567]
  - - [2048, 1024, 1, 1024, 2048, 2048, 1024, 1024]
    - [33, 9.367]
  - - [2048, 1024, 1, 2048, 2048, 2048, 2048, 1024]
    - [33, 10.483]
  - - [2048, 1024, 1, 4096, 2048, 2048, 4096, 1024]
    - [57, 11.284]
  - - [2048, 1024, 1, 8192, 2048, 2048, 8192, 1024]
    - [6, 13.925]
  - - [2048, 2048, 1, 128, 2048, 2048, 128, 2048]
    - [8, 5.188]
  - - [2048, 2048, 1, 256, 2048, 2048, 256, 2048]
    - [11, 7.68]
  - - [2048, 2048, 1, 512, 2048, 2048, 512, 2048]
    - [16, 9.462]
  - - [2048, 2048, 1, 1024, 2048, 2048, 1024, 2048]
    - [15, 11.282]
  - - [2048, 2048, 1, 2048, 2048, 2048, 2048, 2048]
    - [30, 12.741]
  - - [2048, 2048, 1, 4096, 2048, 2048, 4096, 2048]
    - [61, 13.881]
  - - [2048, 2048, 1, 8192, 2048, 2048, 8192, 2048]
    - [6, 15.724]
  - - [2048, 4096, 1, 128, 2048, 2048, 128, 4096]
    - [56, 5.399]
  - - [2048, 4096, 1, 256, 2048, 2048, 256, 4096]
    - [55, 8.189]
  - - [2048, 4096, 1, 512, 2048, 2048, 512, 4096]
    - [4, 11.299]
  - - [2048, 4096, 1, 1024, 2048, 2048, 1024, 4096]
    - [6, 13.781]
  - - [2048, 4096, 1, 2048, 2048, 2048, 2048, 4096]
    - [26, 14.035]
  - - [2048, 4096, 1, 4096, 2048, 2048, 4096, 4096]
    - [56, 15.54]
  - - [2048, 4096, 1, 8192, 2048, 2048, 8192, 4096]
    - [1, 17.351]
  - - [2048, 8192, 1, 128, 2048, 2048, 128, 8192]
    - [66, 5.529]
  - - [2048, 8192, 1, 256, 2048, 2048, 256, 8192]
    - [49, 7.855]
  - - [2048, 8192, 1, 512, 2048, 2048, 512, 8192]
    - [53, 10.956]
  - - [2048, 8192, 1, 1024, 2048, 2048, 1024, 8192]
    - [52, 13.566]
  - - [2048, 8192, 1, 2048, 2048, 2048, 2048, 8192]
    - [56, 15.197]
  - - [2048, 8192, 1, 4096, 2048, 2048, 4096, 8192]
    - [57, 16.835]
  - - [2048, 8192, 1, 8192, 2048, 2048, 8192, 8192]
    - [51, 18.571]
  - - [4096, 128, 1, 128, 4096, 4096, 128, 128]
    - [37, 1.843]
  - - [4096, 128, 1, 256, 4096, 4096, 256, 128]
    - [89, 3.074]
  - - [4096, 128, 1, 512, 4096, 4096, 512, 128]
    - [89, 4.602]
  - - [4096, 128, 1, 1024, 4096, 4096, 1024, 128]
    - [86, 5.363]
  - - [4096, 128, 1, 2048, 4096, 4096, 2048, 128]
    - [39, 6.028]
  - - [4096, 128, 1, 4096, 4096, 4096, 4096, 128]
    - [20, 7.866]
  - - [4096, 128, 1, 8192, 4096, 4096, 8192, 128]
    - [26, 11.491]
  - - [4096, 256, 1, 128, 4096, 4096, 128, 256]
    - [73, 2.887]
  - - [4096, 256, 1, 256, 4096, 4096, 256, 256]
    - [88, 4.8]
  - - [4096, 256, 1, 512, 4096, 4096, 512, 256]
    - [87, 6.876]
  - - [4096, 256, 1, 1024, 4096, 4096, 1024, 256]
    - [95, 7.268]
  - - [4096, 256, 1, 2048, 4096, 4096, 2048, 256]
    - [88, 8.171]
  - - [4096, 256, 1, 4096, 4096, 4096, 4096, 256]
    - [11, 10.638]
  - - [4096, 256, 1, 8192, 4096, 4096, 8192, 256]
    - [28, 11.557]
  - - [4096, 512, 1, 128, 4096, 4096, 128, 512]
    - [71, 3.88]
  - - [4096, 512, 1, 256, 4096, 4096, 256, 512]
    - [67, 5.9]
  - - [4096, 512, 1, 512, 4096, 4096, 512, 512]
    - [33, 7.231]
  - - [4096, 512, 1, 1024, 4096, 4096, 1024, 512]
    - [33, 9.283]
  - - [4096, 512, 1, 2048, 4096, 4096, 2048, 512]
    - [33, 10.403]
  - - [4096, 512, 1, 4096, 4096, 4096, 4096, 512]
    - [6, 11.394]
  - - [4096, 512, 1, 8192, 4096, 4096, 8192, 512]
    - [61, 14.025]
  - - [4096, 1024, 1, 128, 4096, 4096, 128, 1024]
    - [14, 4.891]
  - - [4096, 1024, 1, 256, 4096, 4096, 256, 1024]
    - [14, 7.429]
  - - [4096, 1024, 1, 512, 4096, 4096, 512, 1024]
    - [16, 9.308]
  - - [4096, 1024, 1, 1024, 4096, 4096, 1024, 1024]
    - [16, 11.494]
  - - [4096, 1024, 1, 2048, 4096, 4096, 2048, 1024]
    - [30, 12.537]
  - - [4096, 1024, 1, 4096, 4096, 4096, 4096, 1024]
    - [62, 13.785]
  - - [4096, 1024, 1, 8192, 4096, 4096, 8192, 1024]
    - [6, 15.782]
  - - [4096, 2048, 1, 128, 4096, 4096, 128, 2048]
    - [63, 5.232]
  - - [4096, 2048, 1, 256, 4096, 4096, 256, 2048]
    - [14, 7.909]
  - - [4096, 2048, 1, 512, 4096, 4096, 512, 2048]
    - [4, 11.029]
  - - [4096, 2048, 1, 1024, 4096, 4096, 1024, 2048]
    - [5, 13.483]
  - - [4096, 2048, 1, 2048, 4096, 4096, 2048, 2048]
    - [26, 13.931]
  - - [4096, 2048, 1, 4096, 4096, 4096, 4096, 2048]
    - [61, 15.454]
  - - [4096, 2048, 1, 8192, 4096, 4096, 8192, 2048]
    - [1, 17.341]
  - - [4096, 4096, 1, 128, 4096, 4096, 128, 4096]
    - [68, 5.344]
  - - [4096, 4096, 1, 256, 4096, 4096, 256, 4096]
    - [51, 7.716]
  - - [4096, 4096, 1, 512, 4096, 4096, 512, 4096]
    - [51, 10.634]
  - - [4096, 4096, 1, 1024, 4096, 4096, 1024, 4096]
    - [0, 13.322]
  - - [4096, 4096, 1, 2048, 4096, 4096, 2048, 4096]
    - [56, 15.173]
  - - [4096, 4096, 1, 4096, 4096, 4096, 4096, 4096]
    - [57, 16.733]
  - - [4096, 4096, 1, 8192, 4096, 4096, 8192, 4096]
    - [53, 18.656]
  - - [4096, 8192, 1, 128, 4096, 4096, 128, 8192]
    - [6, 4.576]
  - - [4096, 8192, 1, 256, 4096, 4096, 256, 8192]
    - [61, 6.77]
  - - [4096, 8192, 1, 512, 4096, 4096, 512, 8192]
    - [59, 9.967]
  - - [4096, 8192, 1, 1024, 4096, 4096, 1024, 8192]
    - [62, 13.316]
  - - [4096, 8192, 1, 2048, 4096, 4096, 2048, 8192]
    - [61, 16.002]
  - - [4096, 8192, 1, 4096, 4096, 4096, 4096, 8192]
    - [50, 17.694]
  - - [4096, 8192, 1, 8192, 4096, 4096, 8192, 8192]
    - [51, 19.18]
  - - [8192, 128, 1, 128, 8192, 8192, 128, 128]
    - [84, 2.891]
  - - [8192, 128, 1, 256, 8192, 8192, 256, 128]
    - [88, 4.764]
  - - [8192, 128, 1, 512, 8192, 8192, 512, 128]
    - [88, 6.699]
  - - [8192, 128, 1, 1024, 8192, 8192, 1024, 128]
    - [39, 7.045]
  - - [8192, 128, 1, 2048, 8192, 8192, 2048, 128]
    - [88, 7.9]
  - - [8192, 128, 1, 4096, 8192, 8192, 4096, 128]
    - [32, 9.564]
  - - [8192, 128, 1, 8192, 8192, 8192, 8192, 128]
    - [27, 11.556]
  - - [8192, 256, 1, 128, 8192, 8192, 128, 256]
    - [66, 3.847]
  - - [8192, 256, 1, 256, 8192, 8192, 256, 256]
    - [67, 5.79]
  - - [8192, 256, 1, 512, 8192, 8192, 512, 256]
    - [30, 7.215]
  - - [8192, 256, 1, 1024, 8192, 8192, 1024, 256]
    - [33, 8.893]
  - - [8192, 256, 1, 2048, 8192, 8192, 2048, 256]
    - [87, 9.874]
  - - [8192, 256, 1, 4096, 8192, 8192, 4096, 256]
    - [56, 11.364]
  - - [8192, 256, 1, 8192, 8192, 8192, 8192, 256]
    - [7, 14.102]
  - - [8192, 512, 1, 128, 8192, 8192, 128, 512]
    - [11, 5.035]
  - - [8192, 512, 1, 256, 8192, 8192, 256, 512]
    - [60, 7.474]
  - - [8192, 512, 1, 512, 8192, 8192, 512, 512]
    - [16, 8.939]
  - - [8192, 512, 1, 1024, 8192, 8192, 1024, 512]
    - [16, 10.901]
  - - [8192, 512, 1, 2048, 8192, 8192, 2048, 512]
    - [30, 12.005]
  - - [8192, 512, 1, 4096, 8192, 8192, 4096, 512]
    - [7, 13.994]
  - - [8192, 512, 1, 8192, 8192, 8192, 8192, 512]
    - [7, 15.887]
  - - [8192, 1024, 1, 128, 8192, 8192, 128, 1024]
    - [59, 5.396]
  - - [8192, 1024, 1, 256, 8192, 8192, 256, 1024]
    - [61, 7.978]
  - - [8192, 1024, 1, 512, 8192, 8192, 512, 1024]
    - [4, 11.011]
  - - [8192, 1024, 1, 1024, 8192, 8192, 1024, 1024]
    - [7, 13.39]
  - - [8192, 1024, 1, 2048, 8192, 8192, 2048, 1024]
    - [57, 13.799]
  - - [8192, 1024, 1, 4096, 8192, 8192, 4096, 1024]
    - [7, 15.874]
  - - [8192, 1024, 1, 8192, 8192, 8192, 8192, 1024]
    - [6, 17.227]
  - - [8192, 2048, 1, 128, 8192, 8192, 128, 2048]
    - [64, 5.31]
  - - [8192, 2048, 1, 256, 8192, 8192, 256, 2048]
    - [50, 7.586]
  - - [8192, 2048, 1, 512, 8192, 8192, 512, 2048]
    - [52, 10.589]
  - - [8192, 2048, 1, 1024, 8192, 8192, 1024, 2048]
    - [0, 13.348]
  - - [8192, 2048, 1, 2048, 8192, 8192, 2048, 2048]
    - [57, 15.083]
  - - [8192, 2048, 1, 4096, 8192, 8192, 4096, 2048]
    - [6, 16.715]
  - - [8192, 2048, 1, 8192, 8192, 8192, 8192, 2048]
    - [2, 18.595]
  - - [8192, 4096, 1, 128, 8192, 8192, 128, 4096]
    - [4, 4.531]
  - - [8192, 4096, 1, 256, 8192, 8192, 256, 4096]
    - [62, 6.778]
  - - [8192, 4096, 1, 512, 8192, 8192, 512, 4096]
    - [62, 10.011]
  - - [8192, 4096, 1, 1024, 8192, 8192, 1024, 4096]
    - [61, 13.291]
  - - [8192, 4096, 1, 2048, 8192, 8192, 2048, 4096]
    - [62, 15.967]
  - - [8192, 4096, 1, 4096, 8192, 8192, 4096, 4096]
    - [51, 17.827]
  - - [8192, 4096, 1, 8192, 8192, 8192, 8192, 4096]
    - [3, 19.069]
  - - [8192, 8192, 1, 128, 8192, 8192, 128, 8192]
    - [58, 4.61]
  - - [8192, 8192, 1, 256, 8192, 8192, 256, 8192]
    - [61, 7.384]
  - - [8192, 8192, 1, 512, 8192, 8192, 512, 8192]
    - [61, 10.889]
  - - [8192, 8192, 1, 1024, 8192, 8192, 1024, 8192]
    - [61, 14.224]
  - - [8192, 8192, 1, 2048, 8192, 8192, 2048, 8192]
    - [54, 16.803]
  - - [8192, 8192, 1, 4096, 8192, 8192, 4096, 8192]
    - [54, 18.521]
  - - [8192, 8192, 1, 8192, 8192, 8192, 8192, 8192]
    - [1, 19.737]
  - - [1, 1, 1, 32, 1, 1, 32, 1]
    - [101, 0.0]
- null
- null
- DeviceEfficiency
- GridBased
