library/src/amd_detail/rocblaslt/src/Tensile/Logic/streamk/gfx942_80cu/aquavanjaram942_Cijk_Alik_Bljk_HSS_BH_UserArgs.yaml
- {MinimumRequiredVersion: 4.33.0}
- aquavanjaram942
- {Architecture: gfx942, CUCount: 80}
- [Device 0049, Device 0050]
    SolutionIndex: 0
    SolutionNameMin: Cijk_Alik_Bljk_HSS_BH_UserArgs_MT128x128x32_MI16x16x1_SN_LDSB1_CLR1_GSU0_GSUC0_GSUWGMRR0_K1_LBSPPA256_LBSPPB128_MIWT4_4_PLR1_SU32_SUM0_SUS256_SKXCCM0_VWA4_VWB1_WGM1_WGMXCC1_WGMXCCGn1
    SolutionIndex: 1
    SolutionNameMin: Cijk_Alik_Bljk_HSS_BH_UserArgs_MT128x128x32_MI16x16x1_SN_LDSB1_CLR1_GSU0_GSUC0_GSUWGMRR0_K1_LBSPPA256_LBSPPB128_MIWT4_4_PLR1_SU32_SUM0_SUS256_SKXCCM0_VWA4_VWB2_WGM1_WGMXCC1_WGMXCCGn1
    SolutionIndex: 2
    SolutionNameMin: Cijk_Alik_Bljk_HSS_BH_UserArgs_MT128x128x32_MI16x16x1_SN_LDSB1_CLR1_GSU0_GSUC0_GSUWGMRR0_K1_LBSPPA256_LBSPPB256_MIWT4_4_PLR1_SU32_SUM0_SUS256_SKXCCM0_VWA4_VWB4_WGM1_WGMXCC1_WGMXCCGn1
    SolutionIndex: 3
    SolutionNameMin: Cijk_Alik_Bljk_HSS_BH_UserArgs_MT128x128x32_MI16x16x1_SN_LDSB1_CLR1_GSU0_GSUC0_GSUWGMRR0_K1_LBSPPA256_LBSPPB128_MIWT4_4_PLR1_SU32_SUM0_SUS256_SKXCCM0_VWA4_VWB1_WGM2_WGMXCC1_WGMXCCGn1
    SolutionIndex: 4
    SolutionNameMin: Cijk_Alik_Bljk_HSS_BH_UserArgs_MT128x128x32_MI16x16x1_SN_LDSB1_CLR1_GSU0_GSUC0_GSUWGMRR0_K1_LBSPPA256_LBSPPB128_MIWT4_4_PLR1_SU32_SUM0_SUS256_SKXCCM0_VWA4_VWB2_WGM2_WGMXCC1_WGMXCCGn1
    SolutionIndex: 5
    SolutionNameMin: Cijk_Alik_Bljk_HSS_BH_UserArgs_MT128x128x32_MI16x16x1_SN_LDSB1_CLR1_GSU0_GSUC0_GSUWGMRR0_K1_LBSPPA256_LBSPPB256_MIWT4_4_PLR1_SU32_SUM0_SUS256_SKXCCM0_VWA4_VWB4_WGM2_WGMXCC1_WGMXCCGn1
    SolutionIndex: 6
    SolutionNameMin: Cijk_Alik_Bljk_HSS_BH_UserArgs_MT32x32x32_MI16x16x1_SN_LDSB0_CLR1_GSU0_GSUC0_GSUWGMRR0_K1_LBSPPA128_LBSPPB128_MIWT1_1_PLR1_SU32_SUM0_SUS256_SKXCCM0_VWA1_VWB1_WGM1_WGMXCC1_WGMXCCGn1
    SolutionIndex: 7
    SolutionNameMin: Cijk_Alik_Bljk_HSS_BH_UserArgs_MT32x32x32_MI16x16x1_SN_LDSB0_CLR0_GSU0_GSUC0_GSUWGMRR0_K1_LBSPPA128_LBSPPB128_MIWT1_1_PLR0_SU32_SUM0_SUS256_SKXCCM0_VWA1_VWB1_WGM1_WGMXCC1_WGMXCCGn1
    SolutionIndex: 8
    SolutionNameMin: Cijk_Alik_Bljk_HSS_BH_UserArgs_MT128x128x64_MI16x16x1_SN_LDSB1_CLR1_GSU0_GSUC0_GSUWGMRR0_K1_LBSPPA512_LBSPPB128_MIWT4_4_PLR1_SU32_SUM0_SUS256_SKXCCM0_VWA4_VWB1_WGM1_WGMXCC1_WGMXCCGn1
    SolutionIndex: 9
    SolutionNameMin: Cijk_Alik_Bljk_HSS_BH_UserArgs_MT128x128x64_MI16x16x1_SN_LDSB1_CLR1_GSU0_GSUC0_GSUWGMRR0_K1_LBSPPA512_LBSPPB256_MIWT4_4_PLR1_SU32_SUM0_SUS256_SKXCCM0_VWA4_VWB2_WGM1_WGMXCC1_WGMXCCGn1
    SolutionIndex: 10
    SolutionNameMin: Cijk_Alik_Bljk_HSS_BH_UserArgs_MT128x128x64_MI16x16x1_SN_LDSB1_CLR1_GSU0_GSUC0_GSUWGMRR0_K1_LBSPPA512_LBSPPB512_MIWT4_4_PLR1_SU32_SUM0_SUS256_SKXCCM0_VWA4_VWB4_WGM1_WGMXCC1_WGMXCCGn1
    SolutionIndex: 11
    SolutionNameMin: Cijk_Alik_Bljk_HSS_BH_UserArgs_MT128x128x64_MI16x16x1_SN_LDSB1_CLR1_GSU0_GSUC0_GSUWGMRR0_K1_LBSPPA128_LBSPPB512_MIWT4_4_PLR1_SU32_SUM0_SUS256_SKXCCM0_VWA1_VWB4_WGM2_WGMXCC1_WGMXCCGn1
    SolutionIndex: 12
    SolutionNameMin: Cijk_Alik_Bljk_HSS_BH_UserArgs_MT128x128x64_MI16x16x1_SN_LDSB1_CLR1_GSU0_GSUC0_GSUWGMRR0_K1_LBSPPA512_LBSPPB512_MIWT4_4_PLR1_SU32_SUM0_SUS256_SKXCCM0_VWA4_VWB4_WGM2_WGMXCC1_WGMXCCGn1
    SolutionIndex: 13
    SolutionNameMin: Cijk_Alik_Bljk_HSS_BH_UserArgs_MT128x128x64_MI16x16x1_SN_LDSB1_CLR1_GSU0_GSUC0_GSUWGMRR0_K1_LBSPPA512_LBSPPB128_MIWT4_4_PLR1_SU32_SUM0_SUS256_SKXCCM0_VWA4_VWB1_WGM4_WGMXCC1_WGMXCCGn1
    SolutionIndex: 14
    SolutionNameMin: Cijk_Alik_Bljk_HSS_BH_UserArgs_MT128x128x64_MI16x16x1_SN_LDSB1_CLR1_GSU0_GSUC0_GSUWGMRR0_K1_LBSPPA512_LBSPPB256_MIWT4_4_PLR1_SU32_SUM0_SUS256_SKXCCM0_VWA4_VWB2_WGM4_WGMXCC1_WGMXCCGn1
    SolutionIndex: 15
    SolutionNameMin: Cijk_Alik_Bljk_HSS_BH_UserArgs_MT128x128x64_MI16x16x1_SN_LDSB1_CLR1_GSU0_GSUC0_GSUWGMRR0_K1_LBSPPA512_LBSPPB512_MIWT4_4_PLR1_SU32_SUM0_SUS256_SKXCCM0_VWA4_VWB4_WGM4_WGMXCC1_WGMXCCGn1
    SolutionIndex: 16
    SolutionNameMin: Cijk_Alik_Bljk_HSS_BH_UserArgs_MT64x128x64_MI16x16x1_SN_LDSB1_CLR1_GSU0_GSUC0_GSUWGMRR0_K1_LBSPPA128_LBSPPB128_MIWT2_4_PLR1_SU32_SUM0_SUS256_SKXCCM0_VWA1_VWB1_WGM1_WGMXCC1_WGMXCCGn1
    SolutionIndex: 17
    SolutionNameMin: Cijk_Alik_Bljk_HSS_BH_UserArgs_MT64x128x64_MI16x16x1_SN_LDSB1_CLR1_GSU0_GSUC0_GSUWGMRR0_K1_LBSPPA128_LBSPPB256_MIWT2_4_PLR1_SU32_SUM0_SUS256_SKXCCM0_VWA1_VWB2_WGM1_WGMXCC1_WGMXCCGn1
    SolutionIndex: 18
    SolutionNameMin: Cijk_Alik_Bljk_HSS_BH_UserArgs_MT64x128x64_MI16x16x1_SN_LDSB1_CLR1_GSU0_GSUC0_GSUWGMRR0_K1_LBSPPA128_LBSPPB128_MIWT2_4_PLR1_SU32_SUM0_SUS256_SKXCCM0_VWA1_VWB1_WGM4_WGMXCC1_WGMXCCGn1
    SolutionIndex: 19
    SolutionNameMin: Cijk_Alik_Bljk_HSS_BH_UserArgs_MT128x64x64_MI16x16x1_SN_LDSB1_CLR1_GSU0_GSUC0_GSUWGMRR0_K1_LBSPPA512_LBSPPB128_MIWT4_2_PLR1_SU32_SUM0_SUS256_SKXCCM0_VWA4_VWB1_WGM1_WGMXCC1_WGMXCCGn1
    SolutionIndex: 20
    SolutionNameMin: Cijk_Alik_Bljk_HSS_BH_UserArgs_MT128x64x64_MI16x16x1_SN_LDSB1_CLR1_GSU0_GSUC0_GSUWGMRR0_K1_LBSPPA512_LBSPPB256_MIWT4_2_PLR1_SU32_SUM0_SUS256_SKXCCM0_VWA4_VWB2_WGM1_WGMXCC1_WGMXCCGn1
    SolutionIndex: 21
    SolutionNameMin: Cijk_Alik_Bljk_HSS_BH_UserArgs_MT128x64x64_MI16x16x1_SN_LDSB1_CLR1_GSU0_GSUC0_GSUWGMRR0_K1_LBSPPA512_LBSPPB128_MIWT4_2_PLR2_SU32_SUM0_SUS256_SKXCCM0_VWA4_VWB1_WGM1_WGMXCC1_WGMXCCGn1
    SolutionIndex: 22
    SolutionNameMin: Cijk_Alik_Bljk_HSS_BH_UserArgs_MT128x64x64_MI16x16x1_SN_LDSB1_CLR1_GSU0_GSUC0_GSUWGMRR0_K1_LBSPPA512_LBSPPB128_MIWT4_2_PLR1_SU32_SUM0_SUS256_SKXCCM0_VWA4_VWB1_WGM2_WGMXCC1_WGMXCCGn1
    SolutionIndex: 23
    SolutionNameMin: Cijk_Alik_Bljk_HSS_BH_UserArgs_MT128x64x64_MI16x16x1_SN_LDSB1_CLR1_GSU0_GSUC0_GSUWGMRR0_K1_LBSPPA512_LBSPPB256_MIWT4_2_PLR1_SU32_SUM0_SUS256_SKXCCM0_VWA4_VWB2_WGM2_WGMXCC1_WGMXCCGn1
    SolutionIndex: 24
    SolutionNameMin: Cijk_Alik_Bljk_HSS_BH_UserArgs_MT64x64x64_MI16x16x1_SN_LDSB1_CLR1_GSU0_GSUC0_GSUWGMRR0_K1_LBSPPA128_LBSPPB128_MIWT2_2_PLR1_SU32_SUM0_SUS256_SKXCCM0_VWA1_VWB1_WGM1_WGMXCC1_WGMXCCGn1
    SolutionIndex: 25
    SolutionNameMin: Cijk_Alik_Bljk_HSS_BH_UserArgs_MT64x64x64_MI16x16x1_SN_LDSB1_CLR1_GSU0_GSUC0_GSUWGMRR0_K1_LBSPPA128_LBSPPB256_MIWT2_2_PLR1_SU32_SUM0_SUS256_SKXCCM0_VWA1_VWB2_WGM2_WGMXCC1_WGMXCCGn1
    SolutionIndex: 26
    SolutionNameMin: Cijk_Alik_Bljk_HSS_BH_UserArgs_MT64x64x64_MI16x16x1_SN_LDSB1_CLR1_GSU0_GSUC0_GSUWGMRR0_K1_LBSPPA128_LBSPPB256_MIWT2_2_PLR1_SU32_SUM0_SUS256_SKXCCM0_VWA1_VWB2_WGM4_WGMXCC1_WGMXCCGn1
    SolutionIndex: 27
    SolutionNameMin: Cijk_Alik_Bljk_HSS_BH_UserArgs_MT32x64x64_MI16x16x1_SN_LDSB0_CLR1_GSU0_GSUC0_GSUWGMRR0_K1_LBSPPA128_LBSPPB128_MIWT1_2_PLR1_SU32_SUM0_SUS256_SKXCCM0_VWA1_VWB1_WGM1_WGMXCC1_WGMXCCGn1
    SolutionIndex: 28
    SolutionNameMin: Cijk_Alik_Bljk_HSS_BH_UserArgs_MT32x64x64_MI16x16x1_SN_LDSB0_CLR1_GSU0_GSUC0_GSUWGMRR0_K1_LBSPPA128_LBSPPB256_MIWT1_2_PLR1_SU32_SUM0_SUS256_SKXCCM0_VWA1_VWB2_WGM1_WGMXCC1_WGMXCCGn1
    SolutionIndex: 29
    SolutionNameMin: Cijk_Alik_Bljk_HSS_BH_UserArgs_MT32x64x128_MI16x16x1_SN_LDSB1_CLR1_GSU0_GSUC0_GSUWGMRR0_K1_LBSPPA256_LBSPPB256_MIWT1_2_PLR1_SU32_SUM0_SUS256_SKXCCM0_VWA1_VWB1_WGM1_WGMXCC1_WGMXCCGn1
    SolutionIndex: 30
    SolutionNameMin: Cijk_Alik_Bljk_HSS_BH_UserArgs_MT32x64x128_MI16x16x1_SN_LDSB1_CLR1_GSU0_GSUC0_GSUWGMRR0_K1_LBSPPA256_LBSPPB512_MIWT1_2_PLR1_SU32_SUM0_SUS256_SKXCCM0_VWA1_VWB2_WGM1_WGMXCC1_WGMXCCGn1
    SolutionIndex: 31
    SolutionNameMin: Cijk_Alik_Bljk_HSS_BH_UserArgs_MT32x64x128_MI16x16x1_SN_LDSB1_CLR1_GSU0_GSUC0_GSUWGMRR0_K1_LBSPPA256_LBSPPB256_MIWT1_2_PLR2_SU32_SUM0_SUS256_SKXCCM0_VWA1_VWB1_WGM1_WGMXCC1_WGMXCCGn1
    SolutionIndex: 32
    SolutionNameMin: Cijk_Alik_Bljk_HSS_BH_UserArgs_MT32x64x128_MI16x16x1_SN_LDSB1_CLR1_GSU0_GSUC0_GSUWGMRR0_K1_LBSPPA256_LBSPPB512_MIWT1_2_PLR2_SU32_SUM0_SUS256_SKXCCM0_VWA1_VWB2_WGM1_WGMXCC1_WGMXCCGn1
    SolutionIndex: 33
    SolutionNameMin: Cijk_Alik_Bljk_HSS_BH_UserArgs_MT64x32x128_MI16x16x1_SN_LDSB1_CLR1_GSU0_GSUC0_GSUWGMRR0_K1_LBSPPA256_LBSPPB256_MIWT2_1_PLR1_SU32_SUM0_SUS256_SKXCCM0_VWA1_VWB1_WGM1_WGMXCC1_WGMXCCGn1
    SolutionIndex: 34
    SolutionNameMin: Cijk_Alik_Bljk_HSS_BH_UserArgs_MT32x32x128_MI16x16x1_SN_LDSB1_CLR1_GSU0_GSUC0_GSUWGMRR0_K1_LBSPPA256_LBSPPB256_MIWT1_1_PLR1_SU32_SUM0_SUS256_SKXCCM0_VWA1_VWB1_WGM1_WGMXCC1_WGMXCCGn1
    SolutionIndex: 35
    SolutionNameMin: Cijk_Alik_Bljk_HSS_BH_UserArgs_MT32x32x128_MI16x16x1_SN_LDSB1_CLR1_GSU0_GSUC0_GSUWGMRR0_K1_LBSPPA256_LBSPPB256_MIWT1_1_PLR2_SU32_SUM0_SUS256_SKXCCM0_VWA1_VWB1_WGM1_WGMXCC1_WGMXCCGn1
    SolutionIndex: 36
    SolutionNameMin: Cijk_Alik_Bljk_HSS_BH_UserArgs_MT256x64x32_MI16x16x1_SN_LDSB1_CLR1_GSU0_GSUC0_GSUWGMRR0_K1_LBSPPA256_LBSPPB128_MIWT8_2_PLR1_SU32_SUM0_SUS256_SKXCCM4_VWA4_VWB1_WGM1_WGMXCC1_WGMXCCGn1
    SolutionIndex: 37
    SolutionNameMin: Cijk_Alik_Bljk_HSS_BH_UserArgs_MT128x128x32_MI16x16x1_SN_LDSB1_CLR1_GSU0_GSUC0_GSUWGMRR0_K1_LBSPPA256_LBSPPB128_MIWT4_4_PLR1_SU32_SUM0_SUS256_SKXCCM4_VWA4_VWB1_WGM1_WGMXCC1_WGMXCCGn1
    SolutionIndex: 38
    SolutionNameMin: Cijk_Alik_Bljk_HSS_BH_UserArgs_MT128x128x32_MI16x16x1_SN_LDSB1_CLR1_GSU0_GSUC0_GSUWGMRR0_K1_LBSPPA256_LBSPPB128_MIWT4_4_PLR1_SU32_SUM0_SUS256_SKXCCM4_VWA4_VWB2_WGM1_WGMXCC1_WGMXCCGn1
    SolutionIndex: 39
    SolutionNameMin: Cijk_Alik_Bljk_HSS_BH_UserArgs_MT128x128x32_MI16x16x1_SN_LDSB1_CLR1_GSU0_GSUC0_GSUWGMRR0_K1_LBSPPA256_LBSPPB256_MIWT4_4_PLR1_SU32_SUM0_SUS256_SKXCCM4_VWA4_VWB4_WGM1_WGMXCC1_WGMXCCGn1
    SolutionIndex: 40
    SolutionNameMin: Cijk_Alik_Bljk_HSS_BH_UserArgs_MT128x128x32_MI16x16x1_SN_LDSB1_CLR1_GSU0_GSUC0_GSUWGMRR0_K1_LBSPPA256_LBSPPB128_MIWT4_4_PLR1_SU32_SUM0_SUS256_SKXCCM4_VWA4_VWB1_WGM2_WGMXCC1_WGMXCCGn1
    SolutionIndex: 41
    SolutionNameMin: Cijk_Alik_Bljk_HSS_BH_UserArgs_MT128x128x32_MI16x16x1_SN_LDSB1_CLR1_GSU0_GSUC0_GSUWGMRR0_K1_LBSPPA256_LBSPPB128_MIWT4_4_PLR1_SU32_SUM0_SUS256_SKXCCM4_VWA4_VWB2_WGM2_WGMXCC1_WGMXCCGn1
    SolutionIndex: 42
    SolutionNameMin: Cijk_Alik_Bljk_HSS_BH_UserArgs_MT128x128x32_MI16x16x1_SN_LDSB1_CLR1_GSU0_GSUC0_GSUWGMRR0_K1_LBSPPA256_LBSPPB256_MIWT4_4_PLR1_SU32_SUM0_SUS256_SKXCCM4_VWA4_VWB4_WGM2_WGMXCC1_WGMXCCGn1
    SolutionIndex: 43
    SolutionNameMin: Cijk_Alik_Bljk_HSS_BH_UserArgs_MT128x128x32_MI16x16x1_SN_LDSB1_CLR1_GSU0_GSUC0_GSUWGMRR0_K1_LBSPPA128_LBSPPB128_MIWT4_4_PLR1_SU32_SUM0_SUS256_SKXCCM4_VWA1_VWB1_WGM4_WGMXCC1_WGMXCCGn1
    SolutionIndex: 44
    SolutionNameMin: Cijk_Alik_Bljk_HSS_BH_UserArgs_MT128x128x32_MI16x16x1_SN_LDSB1_CLR1_GSU0_GSUC0_GSUWGMRR0_K1_LBSPPA256_LBSPPB128_MIWT4_4_PLR1_SU32_SUM0_SUS256_SKXCCM4_VWA4_VWB1_WGM4_WGMXCC1_WGMXCCGn1
    SolutionIndex: 45
    SolutionNameMin: Cijk_Alik_Bljk_HSS_BH_UserArgs_MT128x128x32_MI16x16x1_SN_LDSB1_CLR1_GSU0_GSUC0_GSUWGMRR0_K1_LBSPPA256_LBSPPB128_MIWT4_4_PLR1_SU32_SUM0_SUS256_SKXCCM4_VWA4_VWB2_WGM4_WGMXCC1_WGMXCCGn1
    SolutionIndex: 46
    SolutionNameMin: Cijk_Alik_Bljk_HSS_BH_UserArgs_MT128x128x32_MI16x16x1_SN_LDSB1_CLR1_GSU0_GSUC0_GSUWGMRR0_K1_LBSPPA256_LBSPPB256_MIWT4_4_PLR1_SU32_SUM0_SUS256_SKXCCM4_VWA4_VWB4_WGM4_WGMXCC1_WGMXCCGn1
    SolutionIndex: 47
    SolutionNameMin: Cijk_Alik_Bljk_HSS_BH_UserArgs_MT128x64x32_MI16x16x1_SN_LDSB0_CLR1_GSU0_GSUC0_GSUWGMRR0_K1_LBSPPA256_LBSPPB128_MIWT4_2_PLR1_SU32_SUM0_SUS256_SKXCCM4_VWA4_VWB2_WGM1_WGMXCC1_WGMXCCGn1
    SolutionIndex: 48
    SolutionNameMin: Cijk_Alik_Bljk_HSS_BH_UserArgs_MT128x64x32_MI16x16x1_SN_LDSB0_CLR1_GSU0_GSUC0_GSUWGMRR0_K1_LBSPPA256_LBSPPB128_MIWT4_2_PLR1_SU32_SUM0_SUS256_SKXCCM4_VWA4_VWB2_WGM2_WGMXCC1_WGMXCCGn1
    SolutionIndex: 49
    SolutionNameMin: Cijk_Alik_Bljk_HSS_BH_UserArgs_MT128x128x64_MI16x16x1_SN_LDSB1_CLR1_GSU0_GSUC0_GSUWGMRR0_K1_LBSPPA512_LBSPPB128_MIWT4_4_PLR1_SU32_SUM0_SUS256_SKXCCM4_VWA4_VWB1_WGM1_WGMXCC1_WGMXCCGn1
    SolutionIndex: 50
    SolutionNameMin: Cijk_Alik_Bljk_HSS_BH_UserArgs_MT128x128x64_MI16x16x1_SN_LDSB1_CLR1_GSU0_GSUC0_GSUWGMRR0_K1_LBSPPA512_LBSPPB256_MIWT4_4_PLR1_SU32_SUM0_SUS256_SKXCCM4_VWA4_VWB2_WGM1_WGMXCC1_WGMXCCGn1
    SolutionIndex: 51
    SolutionNameMin: Cijk_Alik_Bljk_HSS_BH_UserArgs_MT128x128x64_MI16x16x1_SN_LDSB1_CLR1_GSU0_GSUC0_GSUWGMRR0_K1_LBSPPA512_LBSPPB512_MIWT4_4_PLR1_SU32_SUM0_SUS256_SKXCCM4_VWA4_VWB4_WGM1_WGMXCC1_WGMXCCGn1
    SolutionIndex: 52
    SolutionNameMin: Cijk_Alik_Bljk_HSS_BH_UserArgs_MT128x128x64_MI16x16x1_SN_LDSB1_CLR1_GSU0_GSUC0_GSUWGMRR0_K1_LBSPPA512_LBSPPB128_MIWT4_4_PLR1_SU32_SUM0_SUS256_SKXCCM4_VWA4_VWB1_WGM2_WGMXCC1_WGMXCCGn1
    SolutionIndex: 53
    SolutionNameMin: Cijk_Alik_Bljk_HSS_BH_UserArgs_MT128x128x64_MI16x16x1_SN_LDSB1_CLR1_GSU0_GSUC0_GSUWGMRR0_K1_LBSPPA512_LBSPPB256_MIWT4_4_PLR1_SU32_SUM0_SUS256_SKXCCM4_VWA4_VWB2_WGM2_WGMXCC1_WGMXCCGn1
    SolutionIndex: 54
    SolutionNameMin: Cijk_Alik_Bljk_HSS_BH_UserArgs_MT128x128x64_MI16x16x1_SN_LDSB1_CLR1_GSU0_GSUC0_GSUWGMRR0_K1_LBSPPA512_LBSPPB512_MIWT4_4_PLR1_SU32_SUM0_SUS256_SKXCCM4_VWA4_VWB4_WGM2_WGMXCC1_WGMXCCGn1
    SolutionIndex: 55
    SolutionNameMin: Cijk_Alik_Bljk_HSS_BH_UserArgs_MT128x128x64_MI16x16x1_SN_LDSB1_CLR1_GSU0_GSUC0_GSUWGMRR0_K1_LBSPPA512_LBSPPB128_MIWT4_4_PLR1_SU32_SUM0_SUS256_SKXCCM4_VWA4_VWB1_WGM4_WGMXCC1_WGMXCCGn1
    SolutionIndex: 56
    SolutionNameMin: Cijk_Alik_Bljk_HSS_BH_UserArgs_MT128x128x64_MI16x16x1_SN_LDSB1_CLR1_GSU0_GSUC0_GSUWGMRR0_K1_LBSPPA512_LBSPPB256_MIWT4_4_PLR1_SU32_SUM0_SUS256_SKXCCM4_VWA4_VWB2_WGM4_WGMXCC1_WGMXCCGn1
    SolutionIndex: 57
    SolutionNameMin: Cijk_Alik_Bljk_HSS_BH_UserArgs_MT128x128x64_MI16x16x1_SN_LDSB1_CLR1_GSU0_GSUC0_GSUWGMRR0_K1_LBSPPA512_LBSPPB512_MIWT4_4_PLR1_SU32_SUM0_SUS256_SKXCCM4_VWA4_VWB4_WGM4_WGMXCC1_WGMXCCGn1
    SolutionIndex: 58
    SolutionNameMin: Cijk_Alik_Bljk_HSS_BH_UserArgs_MT64x128x64_MI16x16x1_SN_LDSB1_CLR1_GSU0_GSUC0_GSUWGMRR0_K1_LBSPPA128_LBSPPB128_MIWT2_4_PLR1_SU32_SUM0_SUS256_SKXCCM4_VWA1_VWB1_WGM1_WGMXCC1_WGMXCCGn1
    SolutionIndex: 59
    SolutionNameMin: Cijk_Alik_Bljk_HSS_BH_UserArgs_MT64x128x64_MI16x16x1_SN_LDSB1_CLR1_GSU0_GSUC0_GSUWGMRR0_K1_LBSPPA128_LBSPPB256_MIWT2_4_PLR1_SU32_SUM0_SUS256_SKXCCM4_VWA1_VWB2_WGM1_WGMXCC1_WGMXCCGn1
    SolutionIndex: 60
    SolutionNameMin: Cijk_Alik_Bljk_HSS_BH_UserArgs_MT64x128x64_MI16x16x1_SN_LDSB1_CLR1_GSU0_GSUC0_GSUWGMRR0_K1_LBSPPA128_LBSPPB512_MIWT2_4_PLR1_SU32_SUM0_SUS256_SKXCCM4_VWA1_VWB4_WGM1_WGMXCC1_WGMXCCGn1
    SolutionIndex: 61
    SolutionNameMin: Cijk_Alik_Bljk_HSS_BH_UserArgs_MT64x128x64_MI16x16x1_SN_LDSB1_CLR1_GSU0_GSUC0_GSUWGMRR0_K1_LBSPPA256_LBSPPB512_MIWT2_4_PLR1_SU32_SUM0_SUS256_SKXCCM4_VWA2_VWB4_WGM1_WGMXCC1_WGMXCCGn1
    SolutionIndex: 62
    SolutionNameMin: Cijk_Alik_Bljk_HSS_BH_UserArgs_MT64x128x64_MI16x16x1_SN_LDSB1_CLR1_GSU0_GSUC0_GSUWGMRR0_K1_LBSPPA128_LBSPPB128_MIWT2_4_PLR1_SU32_SUM0_SUS256_SKXCCM4_VWA1_VWB1_WGM4_WGMXCC1_WGMXCCGn1
    SolutionIndex: 63
    SolutionNameMin: Cijk_Alik_Bljk_HSS_BH_UserArgs_MT64x128x64_MI16x16x1_SN_LDSB1_CLR1_GSU0_GSUC0_GSUWGMRR0_K1_LBSPPA128_LBSPPB512_MIWT2_4_PLR1_SU32_SUM0_SUS256_SKXCCM4_VWA1_VWB4_WGM4_WGMXCC1_WGMXCCGn1
    SolutionIndex: 64
    SolutionNameMin: Cijk_Alik_Bljk_HSS_BH_UserArgs_MT128x64x64_MI16x16x1_SN_LDSB1_CLR1_GSU0_GSUC0_GSUWGMRR0_K1_LBSPPA128_LBSPPB128_MIWT4_2_PLR1_SU32_SUM0_SUS256_SKXCCM4_VWA1_VWB1_WGM1_WGMXCC1_WGMXCCGn1
    SolutionIndex: 65
    SolutionNameMin: Cijk_Alik_Bljk_HSS_BH_UserArgs_MT128x64x64_MI16x16x1_SN_LDSB1_CLR1_GSU0_GSUC0_GSUWGMRR0_K1_LBSPPA512_LBSPPB128_MIWT4_2_PLR1_SU32_SUM0_SUS256_SKXCCM4_VWA4_VWB1_WGM1_WGMXCC1_WGMXCCGn1
    SolutionIndex: 66
    SolutionNameMin: Cijk_Alik_Bljk_HSS_BH_UserArgs_MT128x64x64_MI16x16x1_SN_LDSB1_CLR1_GSU0_GSUC0_GSUWGMRR0_K1_LBSPPA128_LBSPPB256_MIWT4_2_PLR1_SU32_SUM0_SUS256_SKXCCM4_VWA1_VWB2_WGM1_WGMXCC1_WGMXCCGn1
    SolutionIndex: 67
    SolutionNameMin: Cijk_Alik_Bljk_HSS_BH_UserArgs_MT128x64x64_MI16x16x1_SN_LDSB1_CLR1_GSU0_GSUC0_GSUWGMRR0_K1_LBSPPA512_LBSPPB256_MIWT4_2_PLR1_SU32_SUM0_SUS256_SKXCCM4_VWA4_VWB2_WGM1_WGMXCC1_WGMXCCGn1
    SolutionIndex: 68
    SolutionNameMin: Cijk_Alik_Bljk_HSS_BH_UserArgs_MT128x64x64_MI16x16x1_SN_LDSB1_CLR1_GSU0_GSUC0_GSUWGMRR0_K1_LBSPPA512_LBSPPB256_MIWT4_2_PLR2_SU32_SUM0_SUS256_SKXCCM4_VWA4_VWB2_WGM1_WGMXCC1_WGMXCCGn1
    SolutionIndex: 69
    SolutionNameMin: Cijk_Alik_Bljk_HSS_BH_UserArgs_MT128x64x64_MI16x16x1_SN_LDSB1_CLR1_GSU0_GSUC0_GSUWGMRR0_K1_LBSPPA512_LBSPPB128_MIWT4_2_PLR1_SU32_SUM0_SUS256_SKXCCM4_VWA4_VWB1_WGM2_WGMXCC1_WGMXCCGn1
    SolutionIndex: 70
    SolutionNameMin: Cijk_Alik_Bljk_HSS_BH_UserArgs_MT128x64x64_MI16x16x1_SN_LDSB1_CLR1_GSU0_GSUC0_GSUWGMRR0_K1_LBSPPA512_LBSPPB256_MIWT4_2_PLR1_SU32_SUM0_SUS256_SKXCCM4_VWA4_VWB2_WGM2_WGMXCC1_WGMXCCGn1
    SolutionIndex: 71
    SolutionNameMin: Cijk_Alik_Bljk_HSS_BH_UserArgs_MT128x64x64_MI16x16x1_SN_LDSB1_CLR1_GSU0_GSUC0_GSUWGMRR0_K1_LBSPPA512_LBSPPB128_MIWT4_2_PLR1_SU32_SUM0_SUS256_SKXCCM4_VWA4_VWB1_WGM4_WGMXCC1_WGMXCCGn1
    SolutionIndex: 72
    SolutionNameMin: Cijk_Alik_Bljk_HSS_BH_UserArgs_MT128x64x64_MI16x16x1_SN_LDSB1_CLR1_GSU0_GSUC0_GSUWGMRR0_K1_LBSPPA512_LBSPPB256_MIWT4_2_PLR1_SU32_SUM0_SUS256_SKXCCM4_VWA4_VWB2_WGM4_WGMXCC1_WGMXCCGn1
    SolutionIndex: 73
    SolutionNameMin: Cijk_Alik_Bljk_HSS_BH_UserArgs_MT64x64x64_MI16x16x1_SN_LDSB1_CLR1_GSU0_GSUC0_GSUWGMRR0_K1_LBSPPA128_LBSPPB128_MIWT2_2_PLR1_SU32_SUM0_SUS256_SKXCCM4_VWA1_VWB1_WGM1_WGMXCC1_WGMXCCGn1
    SolutionIndex: 74
    SolutionNameMin: Cijk_Alik_Bljk_HSS_BH_UserArgs_MT64x64x64_MI16x16x1_SN_LDSB1_CLR1_GSU0_GSUC0_GSUWGMRR0_K1_LBSPPA128_LBSPPB256_MIWT2_2_PLR1_SU32_SUM0_SUS256_SKXCCM4_VWA1_VWB2_WGM1_WGMXCC1_WGMXCCGn1
    SolutionIndex: 75
    SolutionNameMin: Cijk_Alik_Bljk_HSS_BH_UserArgs_MT64x64x64_MI16x16x1_SN_LDSB1_CLR1_GSU0_GSUC0_GSUWGMRR0_K1_LBSPPA128_LBSPPB128_MIWT2_2_PLR1_SU32_SUM0_SUS256_SKXCCM4_VWA1_VWB1_WGM2_WGMXCC1_WGMXCCGn1
    SolutionIndex: 76
    SolutionNameMin: Cijk_Alik_Bljk_HSS_BH_UserArgs_MT64x64x64_MI16x16x1_SN_LDSB1_CLR1_GSU0_GSUC0_GSUWGMRR0_K1_LBSPPA128_LBSPPB128_MIWT2_2_PLR1_SU32_SUM0_SUS256_SKXCCM4_VWA1_VWB1_WGM4_WGMXCC1_WGMXCCGn1
    SolutionIndex: 77
    SolutionNameMin: Cijk_Alik_Bljk_HSS_BH_UserArgs_MT64x64x64_MI16x16x1_SN_LDSB1_CLR1_GSU0_GSUC0_GSUWGMRR0_K1_LBSPPA128_LBSPPB256_MIWT2_2_PLR1_SU32_SUM0_SUS256_SKXCCM4_VWA1_VWB2_WGM4_WGMXCC1_WGMXCCGn1
    SolutionIndex: 78
    SolutionNameMin: Cijk_Alik_Bljk_HSS_BH_UserArgs_MT32x64x64_MI16x16x1_SN_LDSB0_CLR1_GSU0_GSUC0_GSUWGMRR0_K1_LBSPPA128_LBSPPB128_MIWT1_2_PLR1_SU32_SUM0_SUS256_SKXCCM4_VWA1_VWB1_WGM1_WGMXCC1_WGMXCCGn1
    SolutionIndex: 79
    SolutionNameMin: Cijk_Alik_Bljk_HSS_BH_UserArgs_MT32x64x64_MI16x16x1_SN_LDSB0_CLR1_GSU0_GSUC0_GSUWGMRR0_K1_LBSPPA128_LBSPPB256_MIWT1_2_PLR1_SU32_SUM0_SUS256_SKXCCM4_VWA1_VWB2_WGM1_WGMXCC1_WGMXCCGn1
    SolutionIndex: 80
    SolutionNameMin: Cijk_Alik_Bljk_HSS_BH_UserArgs_MT32x64x64_MI16x16x1_SN_LDSB0_CLR1_GSU0_GSUC0_GSUWGMRR0_K1_LBSPPA128_LBSPPB256_MIWT1_2_PLR1_SU32_SUM0_SUS256_SKXCCM4_VWA1_VWB2_WGM2_WGMXCC1_WGMXCCGn1
    SolutionIndex: 81
    SolutionNameMin: Cijk_Alik_Bljk_HSS_BH_UserArgs_MT64x32x64_MI16x16x1_SN_LDSB0_CLR1_GSU0_GSUC0_GSUWGMRR0_K1_LBSPPA128_LBSPPB128_MIWT2_1_PLR1_SU32_SUM0_SUS256_SKXCCM4_VWA1_VWB1_WGM1_WGMXCC1_WGMXCCGn1
    SolutionIndex: 82
    SolutionNameMin: Cijk_Alik_Bljk_HSS_BH_UserArgs_MT32x32x64_MI16x16x1_SN_LDSB0_CLR1_GSU0_GSUC0_GSUWGMRR0_K1_LBSPPA128_LBSPPB128_MIWT1_1_PLR1_SU32_SUM0_SUS256_SKXCCM4_VWA1_VWB1_WGM1_WGMXCC1_WGMXCCGn1
    SolutionIndex: 83
    SolutionNameMin: Cijk_Alik_Bljk_HSS_BH_UserArgs_MT64x64x128_MI16x16x1_SN_LDSB1_CLR1_GSU0_GSUC0_GSUWGMRR0_K1_LBSPPA256_LBSPPB256_MIWT2_2_PLR1_SU32_SUM0_SUS256_SKXCCM4_VWA1_VWB1_WGM1_WGMXCC1_WGMXCCGn1
    SolutionIndex: 84
    SolutionNameMin: Cijk_Alik_Bljk_HSS_BH_UserArgs_MT64x64x128_MI16x16x1_SN_LDSB1_CLR1_GSU0_GSUC0_GSUWGMRR0_K1_LBSPPA256_LBSPPB512_MIWT2_2_PLR1_SU32_SUM0_SUS256_SKXCCM4_VWA1_VWB2_WGM1_WGMXCC1_WGMXCCGn1
    SolutionIndex: 85
    SolutionNameMin: Cijk_Alik_Bljk_HSS_BH_UserArgs_MT32x64x128_MI16x16x1_SN_LDSB1_CLR1_GSU0_GSUC0_GSUWGMRR0_K1_LBSPPA256_LBSPPB256_MIWT1_2_PLR1_SU32_SUM0_SUS256_SKXCCM4_VWA1_VWB1_WGM1_WGMXCC1_WGMXCCGn1
    SolutionIndex: 86
    SolutionNameMin: Cijk_Alik_Bljk_HSS_BH_UserArgs_MT32x64x128_MI16x16x1_SN_LDSB1_CLR1_GSU0_GSUC0_GSUWGMRR0_K1_LBSPPA256_LBSPPB512_MIWT1_2_PLR1_SU32_SUM0_SUS256_SKXCCM4_VWA1_VWB2_WGM1_WGMXCC1_WGMXCCGn1
    SolutionIndex: 87
    SolutionNameMin: Cijk_Alik_Bljk_HSS_BH_UserArgs_MT64x32x128_MI16x16x1_SN_LDSB1_CLR1_GSU0_GSUC0_GSUWGMRR0_K1_LBSPPA256_LBSPPB256_MIWT2_1_PLR1_SU32_SUM0_SUS256_SKXCCM4_VWA1_VWB1_WGM1_WGMXCC1_WGMXCCGn1
    SolutionIndex: 88
    SolutionNameMin: Cijk_Alik_Bljk_HSS_BH_UserArgs_MT32x32x128_MI16x16x1_SN_LDSB1_CLR1_GSU0_GSUC0_GSUWGMRR0_K1_LBSPPA256_LBSPPB256_MIWT1_1_PLR1_SU32_SUM0_SUS256_SKXCCM4_VWA1_VWB1_WGM1_WGMXCC1_WGMXCCGn1
    SolutionIndex: 89
    SolutionNameMin: Cijk_Alik_Bljk_HSS_BH_UserArgs_MT32x32x128_MI16x16x1_SN_LDSB1_CLR1_GSU0_GSUC0_GSUWGMRR0_K1_LBSPPA256_LBSPPB256_MIWT1_1_PLR2_SU32_SUM0_SUS256_SKXCCM4_VWA1_VWB1_WGM1_WGMXCC1_WGMXCCGn1
    SolutionIndex: 90
    SolutionNameMin: Cijk_Alik_Bljk_HSS_BH_UserArgs_MT32x32x32_MI16x16x1_SN_LDSB0_CLR1_GSU0_GSUC0_GSUWGMRR0_K1_LBSPPA128_LBSPPB128_MIWT1_1_PLR1_SU32_SUM0_SUS256_SKXCCM0_VWA1_VWB1_WGM1_WGMXCC1_WGMXCCGn1
- - - [128, 128, 1, 128, 128, 128, 128, 128]
    - [88, 0.097]
  - - [128, 128, 1, 256, 128, 128, 256, 256]
    - [34, 0.118]
  - - [128, 128, 1, 512, 128, 128, 512, 512]
    - [34, 0.196]
  - - [128, 128, 1, 1024, 128, 128, 1024, 1024]
    - [34, 0.295]
  - - [128, 128, 1, 2048, 128, 128, 2048, 2048]
    - [82, 0.56]
  - - [128, 128, 1, 4096, 128, 128, 4096, 4096]
    - [89, 1.023]
  - - [128, 128, 1, 8192, 128, 128, 8192, 8192]
    - [35, 1.721]
  - - [128, 256, 1, 128, 128, 128, 128, 128]
    - [88, 0.189]
  - - [128, 256, 1, 256, 128, 128, 256, 256]
    - [34, 0.232]
  - - [128, 256, 1, 512, 128, 128, 512, 512]
    - [34, 0.384]
  - - [128, 256, 1, 1024, 128, 128, 1024, 1024]
    - [88, 0.653]
  - - [128, 256, 1, 2048, 128, 128, 2048, 2048]
    - [6, 1.086]
  - - [128, 256, 1, 4096, 128, 128, 4096, 4096]
    - [28, 1.785]
  - - [128, 256, 1, 8192, 128, 128, 8192, 8192]
    - [34, 2.926]
  - - [128, 512, 1, 128, 128, 128, 128, 128]
    - [88, 0.367]
  - - [128, 512, 1, 256, 128, 128, 256, 256]
    - [34, 0.446]
  - - [128, 512, 1, 512, 128, 128, 512, 512]
    - [6, 0.748]
  - - [128, 512, 1, 1024, 128, 128, 1024, 1024]
    - [35, 1.397]
  - - [128, 512, 1, 2048, 128, 128, 2048, 2048]
    - [34, 2.189]
  - - [128, 512, 1, 4096, 128, 128, 4096, 4096]
    - [78, 3.212]
  - - [128, 512, 1, 8192, 128, 128, 8192, 8192]
    - [83, 4.587]
  - - [128, 1024, 1, 128, 128, 128, 128, 128]
    - [85, 0.665]
  - - [128, 1024, 1, 256, 128, 128, 256, 256]
    - [89, 1.188]
  - - [128, 1024, 1, 512, 128, 128, 512, 512]
    - [35, 1.882]
  - - [128, 1024, 1, 1024, 128, 128, 1024, 1024]
    - [34, 2.873]
  - - [128, 1024, 1, 2048, 128, 128, 2048, 2048]
    - [86, 3.511]
  - - [128, 1024, 1, 4096, 128, 128, 4096, 4096]
    - [73, 5.046]
  - - [128, 1024, 1, 8192, 128, 128, 8192, 8192]
    - [65, 6.65]
  - - [128, 2048, 1, 128, 128, 128, 128, 128]
    - [33, 1.208]
  - - [128, 2048, 1, 256, 128, 128, 256, 256]
    - [81, 2.049]
  - - [128, 2048, 1, 512, 128, 128, 512, 512]
    - [79, 3.197]
  - - [128, 2048, 1, 1024, 128, 128, 1024, 1024]
    - [87, 4.321]
  - - [128, 2048, 1, 2048, 128, 128, 2048, 2048]
    - [47, 4.672]
  - - [128, 2048, 1, 4096, 128, 128, 4096, 4096]
    - [67, 7.055]
  - - [128, 2048, 1, 8192, 128, 128, 8192, 8192]
    - [49, 9.841]
  - - [128, 4096, 1, 128, 128, 128, 128, 128]
    - [73, 2.024]
  - - [128, 4096, 1, 256, 128, 128, 256, 256]
    - [73, 3.388]
  - - [128, 4096, 1, 512, 128, 128, 512, 512]
    - [73, 5.016]
  - - [128, 4096, 1, 1024, 128, 128, 1024, 1024]
    - [67, 5.762]
  - - [128, 4096, 1, 2048, 128, 128, 2048, 2048]
    - [77, 6.356]
  - - [128, 4096, 1, 4096, 128, 128, 4096, 4096]
    - [8, 7.815]
  - - [128, 4096, 1, 8192, 128, 128, 8192, 8192]
    - [8, 10.246]
  - - [128, 8192, 1, 128, 128, 128, 128, 128]
    - [64, 3.022]
  - - [128, 8192, 1, 256, 128, 128, 256, 256]
    - [59, 4.813]
  - - [128, 8192, 1, 512, 128, 128, 512, 512]
    - [65, 6.99]
  - - [128, 8192, 1, 1024, 128, 128, 1024, 1024]
    - [76, 6.766]
  - - [128, 8192, 1, 2048, 128, 128, 2048, 2048]
    - [65, 8.241]
  - - [128, 8192, 1, 4096, 128, 128, 4096, 4096]
    - [20, 10.372]
  - - [128, 8192, 1, 8192, 128, 128, 8192, 8192]
    - [23, 11.465]
  - - [256, 128, 1, 128, 256, 256, 128, 128]
    - [34, 0.185]
  - - [256, 128, 1, 256, 256, 256, 256, 256]
    - [35, 0.232]
  - - [256, 128, 1, 512, 256, 256, 512, 512]
    - [34, 0.388]
  - - [256, 128, 1, 1024, 256, 256, 1024, 1024]
    - [88, 0.651]
  - - [256, 128, 1, 2048, 256, 256, 2048, 2048]
    - [6, 1.095]
  - - [256, 128, 1, 4096, 256, 256, 4096, 4096]
    - [78, 1.775]
  - - [256, 128, 1, 8192, 256, 256, 8192, 8192]
    - [34, 2.946]
  - - [256, 256, 1, 128, 256, 256, 128, 128]
    - [88, 0.364]
  - - [256, 256, 1, 256, 256, 256, 256, 256]
    - [34, 0.444]
  - - [256, 256, 1, 512, 256, 256, 512, 512]
    - [7, 0.742]
  - - [256, 256, 1, 1024, 256, 256, 1024, 1024]
    - [34, 1.392]
  - - [256, 256, 1, 2048, 256, 256, 2048, 2048]
    - [34, 2.185]
  - - [256, 256, 1, 4096, 256, 256, 4096, 4096]
    - [79, 3.203]
  - - [256, 256, 1, 8192, 256, 256, 8192, 8192]
    - [84, 4.564]
  - - [256, 512, 1, 128, 256, 256, 128, 128]
    - [32, 0.666]
  - - [256, 512, 1, 256, 256, 256, 256, 256]
    - [88, 1.187]
  - - [256, 512, 1, 512, 256, 256, 512, 512]
    - [88, 1.898]
  - - [256, 512, 1, 1024, 256, 256, 1024, 1024]
    - [89, 2.781]
  - - [256, 512, 1, 2048, 256, 256, 2048, 2048]
    - [86, 3.517]
  - - [256, 512, 1, 4096, 256, 256, 4096, 4096]
    - [73, 5.019]
  - - [256, 512, 1, 8192, 256, 256, 8192, 8192]
    - [72, 6.425]
  - - [256, 1024, 1, 128, 256, 256, 128, 128]
    - [28, 1.193]
  - - [256, 1024, 1, 256, 256, 256, 256, 256]
    - [79, 2.062]
  - - [256, 1024, 1, 512, 256, 256, 512, 512]
    - [79, 3.181]
  - - [256, 1024, 1, 1024, 256, 256, 1024, 1024]
    - [30, 4.318]
  - - [256, 1024, 1, 2048, 256, 256, 2048, 2048]
    - [47, 4.727]
  - - [256, 1024, 1, 4096, 256, 256, 4096, 4096]
    - [20, 7.278]
  - - [256, 1024, 1, 8192, 256, 256, 8192, 8192]
    - [49, 9.743]
  - - [256, 2048, 1, 128, 256, 256, 128, 128]
    - [73, 2.065]
  - - [256, 2048, 1, 256, 256, 256, 256, 256]
    - [73, 3.317]
  - - [256, 2048, 1, 512, 256, 256, 512, 512]
    - [74, 5.031]
  - - [256, 2048, 1, 1024, 256, 256, 1024, 1024]
    - [65, 5.832]
  - - [256, 2048, 1, 2048, 256, 256, 2048, 2048]
    - [74, 6.976]
  - - [256, 2048, 1, 4096, 256, 256, 4096, 4096]
    - [10, 8.044]
  - - [256, 2048, 1, 8192, 256, 256, 8192, 8192]
    - [8, 9.959]
  - - [256, 4096, 1, 128, 256, 256, 128, 128]
    - [72, 2.992]
  - - [256, 4096, 1, 256, 256, 256, 256, 256]
    - [59, 4.769]
  - - [256, 4096, 1, 512, 256, 256, 512, 512]
    - [71, 7.063]
  - - [256, 4096, 1, 1024, 256, 256, 1024, 1024]
    - [73, 7.585]
  - - [256, 4096, 1, 2048, 256, 256, 2048, 2048]
    - [67, 8.794]
  - - [256, 4096, 1, 4096, 256, 256, 4096, 4096]
    - [70, 9.806]
  - - [256, 4096, 1, 8192, 256, 256, 8192, 8192]
    - [52, 11.002]
  - - [256, 8192, 1, 128, 256, 256, 128, 128]
    - [38, 3.905]
  - - [256, 8192, 1, 256, 256, 256, 256, 256]
    - [45, 5.637]
  - - [256, 8192, 1, 512, 256, 256, 512, 512]
    - [13, 7.799]
  - - [256, 8192, 1, 1024, 256, 256, 1024, 1024]
    - [67, 9.46]
  - - [256, 8192, 1, 2048, 256, 256, 2048, 2048]
    - [67, 10.968]
  - - [256, 8192, 1, 4096, 256, 256, 4096, 4096]
    - [65, 10.934]
  - - [256, 8192, 1, 8192, 256, 256, 8192, 8192]
    - [12, 12.912]
  - - [512, 128, 1, 128, 512, 512, 128, 128]
    - [34, 0.363]
  - - [512, 128, 1, 256, 512, 512, 256, 256]
    - [89, 0.448]
  - - [512, 128, 1, 512, 512, 512, 512, 512]
    - [6, 0.732]
  - - [512, 128, 1, 1024, 512, 512, 1024, 1024]
    - [35, 1.403]
  - - [512, 128, 1, 2048, 512, 512, 2048, 2048]
    - [88, 2.188]
  - - [512, 128, 1, 4096, 512, 512, 4096, 4096]
    - [80, 3.163]
  - - [512, 128, 1, 8192, 512, 512, 8192, 8192]
    - [83, 4.578]
  - - [512, 256, 1, 128, 512, 512, 128, 128]
    - [29, 0.669]
  - - [512, 256, 1, 256, 512, 512, 256, 256]
    - [88, 1.181]
  - - [512, 256, 1, 512, 512, 512, 512, 512]
    - [35, 1.895]
  - - [512, 256, 1, 1024, 512, 512, 1024, 1024]
    - [34, 2.854]
  - - [512, 256, 1, 2048, 512, 512, 2048, 2048]
    - [86, 3.516]
  - - [512, 256, 1, 4096, 512, 512, 4096, 4096]
    - [75, 4.983]
  - - [512, 256, 1, 8192, 512, 512, 8192, 8192]
    - [72, 6.442]
  - - [512, 512, 1, 128, 512, 512, 128, 128]
    - [27, 1.202]
  - - [512, 512, 1, 256, 512, 512, 256, 256]
    - [27, 2.06]
  - - [512, 512, 1, 512, 512, 512, 512, 512]
    - [27, 3.194]
  - - [512, 512, 1, 1024, 512, 512, 1024, 1024]
    - [87, 4.318]
  - - [512, 512, 1, 2048, 512, 512, 2048, 2048]
    - [47, 4.734]
  - - [512, 512, 1, 4096, 512, 512, 4096, 4096]
    - [19, 7.168]
  - - [512, 512, 1, 8192, 512, 512, 8192, 8192]
    - [55, 9.547]
  - - [512, 1024, 1, 128, 512, 512, 128, 128]
    - [73, 2.047]
  - - [512, 1024, 1, 256, 512, 512, 256, 256]
    - [73, 3.365]
  - - [512, 1024, 1, 512, 512, 512, 512, 512]
    - [73, 5.039]
  - - [512, 1024, 1, 1024, 512, 512, 1024, 1024]
    - [67, 5.839]
  - - [512, 1024, 1, 2048, 512, 512, 2048, 2048]
    - [76, 6.871]
  - - [512, 1024, 1, 4096, 512, 512, 4096, 4096]
    - [9, 8.015]
  - - [512, 1024, 1, 8192, 512, 512, 8192, 8192]
    - [8, 9.888]
  - - [512, 2048, 1, 128, 512, 512, 128, 128]
    - [68, 3.094]
  - - [512, 2048, 1, 256, 512, 512, 256, 256]
    - [67, 4.858]
  - - [512, 2048, 1, 512, 512, 512, 512, 512]
    - [65, 7.153]
  - - [512, 2048, 1, 1024, 512, 512, 1024, 1024]
    - [75, 8.094]
  - - [512, 2048, 1, 2048, 512, 512, 2048, 2048]
    - [73, 8.849]
  - - [512, 2048, 1, 4096, 512, 512, 4096, 4096]
    - [58, 9.259]
  - - [512, 2048, 1, 8192, 512, 512, 8192, 8192]
    - [53, 10.954]
  - - [512, 4096, 1, 128, 512, 512, 128, 128]
    - [36, 3.909]
  - - [512, 4096, 1, 256, 512, 512, 256, 256]
    - [44, 5.713]
  - - [512, 4096, 1, 512, 512, 512, 512, 512]
    - [49, 7.814]
  - - [512, 4096, 1, 1024, 512, 512, 1024, 1024]
    - [72, 9.708]
  - - [512, 4096, 1, 2048, 512, 512, 2048, 2048]
    - [67, 11.026]
  - - [512, 4096, 1, 4096, 512, 512, 4096, 4096]
    - [51, 10.674]
  - - [512, 4096, 1, 8192, 512, 512, 8192, 8192]
    - [8, 12.684]
  - - [512, 8192, 1, 128, 512, 512, 128, 128]
    - [46, 4.54]
  - - [512, 8192, 1, 256, 512, 512, 256, 256]
    - [38, 6.428]
  - - [512, 8192, 1, 512, 512, 512, 512, 512]
    - [41, 8.906]
  - - [512, 8192, 1, 1024, 512, 512, 1024, 1024]
    - [49, 11.231]
  - - [512, 8192, 1, 2048, 512, 512, 2048, 2048]
    - [11, 12.625]
  - - [512, 8192, 1, 4096, 512, 512, 4096, 4096]
    - [53, 12.168]
  - - [512, 8192, 1, 8192, 512, 512, 8192, 8192]
    - [9, 14.436]
  - - [1024, 128, 1, 128, 1024, 1024, 128, 128]
    - [33, 0.669]
  - - [1024, 128, 1, 256, 1024, 1024, 256, 256]
    - [35, 1.186]
  - - [1024, 128, 1, 512, 1024, 1024, 512, 512]
    - [34, 1.878]
  - - [1024, 128, 1, 1024, 1024, 1024, 1024, 1024]
    - [35, 2.8]
  - - [1024, 128, 1, 2048, 1024, 1024, 2048, 2048]
    - [86, 3.506]
  - - [1024, 128, 1, 4096, 1024, 1024, 4096, 4096]
    - [75, 4.985]
  - - [1024, 128, 1, 8192, 1024, 1024, 8192, 8192]
    - [70, 6.217]
  - - [1024, 256, 1, 128, 1024, 1024, 128, 128]
    - [27, 1.205]
  - - [1024, 256, 1, 256, 1024, 1024, 256, 256]
    - [79, 2.077]
  - - [1024, 256, 1, 512, 1024, 1024, 512, 512]
    - [79, 3.171]
  - - [1024, 256, 1, 1024, 1024, 1024, 1024, 1024]
    - [86, 4.288]
  - - [1024, 256, 1, 2048, 1024, 1024, 2048, 2048]
    - [48, 4.637]
  - - [1024, 256, 1, 4096, 1024, 1024, 4096, 4096]
    - [72, 6.987]
  - - [1024, 256, 1, 8192, 1024, 1024, 8192, 8192]
    - [50, 9.697]
  - - [1024, 512, 1, 128, 1024, 1024, 128, 128]
    - [73, 2.057]
  - - [1024, 512, 1, 256, 1024, 1024, 256, 256]
    - [73, 3.4]
  - - [1024, 512, 1, 512, 1024, 1024, 512, 512]
    - [73, 5.051]
  - - [1024, 512, 1, 1024, 1024, 1024, 1024, 1024]
    - [67, 5.787]
  - - [1024, 512, 1, 2048, 1024, 1024, 2048, 2048]
    - [77, 6.805]
  - - [1024, 512, 1, 4096, 1024, 1024, 4096, 4096]
    - [15, 7.971]
  - - [1024, 512, 1, 8192, 1024, 1024, 8192, 8192]
    - [14, 9.87]
  - - [1024, 1024, 1, 128, 1024, 1024, 128, 128]
    - [67, 3.026]
  - - [1024, 1024, 1, 256, 1024, 1024, 256, 256]
    - [18, 4.876]
  - - [1024, 1024, 1, 512, 1024, 1024, 512, 512]
    - [65, 7.049]
  - - [1024, 1024, 1, 1024, 1024, 1024, 1024, 1024]
    - [74, 7.787]
  - - [1024, 1024, 1, 2048, 1024, 1024, 2048, 2048]
    - [25, 8.865]
  - - [1024, 1024, 1, 4096, 1024, 1024, 4096, 4096]
    - [58, 9.548]
  - - [1024, 1024, 1, 8192, 1024, 1024, 8192, 8192]
    - [52, 11.023]
  - - [1024, 2048, 1, 128, 1024, 1024, 128, 128]
    - [39, 3.927]
  - - [1024, 2048, 1, 256, 1024, 1024, 256, 256]
    - [38, 5.795]
  - - [1024, 2048, 1, 512, 1024, 1024, 512, 512]
    - [10, 8.216]
  - - [1024, 2048, 1, 1024, 1024, 1024, 1024, 1024]
    - [67, 9.778]
  - - [1024, 2048, 1, 2048, 1024, 1024, 2048, 2048]
    - [22, 10.883]
  - - [1024, 2048, 1, 4096, 1024, 1024, 4096, 4096]
    - [50, 10.83]
  - - [1024, 2048, 1, 8192, 1024, 1024, 8192, 8192]
    - [10, 12.803]
  - - [1024, 4096, 1, 128, 1024, 1024, 128, 128]
    - [5, 4.663]
  - - [1024, 4096, 1, 256, 1024, 1024, 256, 256]
    - [42, 6.609]
  - - [1024, 4096, 1, 512, 1024, 1024, 512, 512]
    - [39, 9.119]
  - - [1024, 4096, 1, 1024, 1024, 1024, 1024, 1024]
    - [9, 10.939]
  - - [1024, 4096, 1, 2048, 1024, 1024, 2048, 2048]
    - [10, 13.159]
  - - [1024, 4096, 1, 4096, 1024, 1024, 4096, 4096]
    - [50, 12.471]
  - - [1024, 4096, 1, 8192, 1024, 1024, 8192, 8192]
    - [51, 14.486]
  - - [1024, 8192, 1, 128, 1024, 1024, 128, 128]
    - [67, 4.465]
  - - [1024, 8192, 1, 256, 1024, 1024, 256, 256]
    - [67, 6.78]
  - - [1024, 8192, 1, 512, 1024, 1024, 512, 512]
    - [65, 8.828]
  - - [1024, 8192, 1, 1024, 1024, 1024, 1024, 1024]
    - [54, 10.646]
  - - [1024, 8192, 1, 2048, 1024, 1024, 2048, 2048]
    - [54, 12.222]
  - - [1024, 8192, 1, 4096, 1024, 1024, 4096, 4096]
    - [53, 13.48]
  - - [1024, 8192, 1, 8192, 1024, 1024, 8192, 8192]
    - [49, 15.476]
  - - [2048, 128, 1, 128, 2048, 2048, 128, 128]
    - [31, 1.212]
  - - [2048, 128, 1, 256, 2048, 2048, 256, 256]
    - [79, 2.059]
  - - [2048, 128, 1, 512, 2048, 2048, 512, 512]
    - [27, 3.19]
  - - [2048, 128, 1, 1024, 2048, 2048, 1024, 1024]
    - [85, 4.274]
  - - [2048, 128, 1, 2048, 2048, 2048, 2048, 2048]
    - [48, 4.567]
  - - [2048, 128, 1, 4096, 2048, 2048, 4096, 4096]
    - [63, 6.731]
  - - [2048, 128, 1, 8192, 2048, 2048, 8192, 8192]
    - [49, 9.729]
  - - [2048, 256, 1, 128, 2048, 2048, 128, 128]
    - [73, 2.045]
  - - [2048, 256, 1, 256, 2048, 2048, 256, 256]
    - [73, 3.391]
  - - [2048, 256, 1, 512, 2048, 2048, 512, 512]
    - [73, 5.057]
  - - [2048, 256, 1, 1024, 2048, 2048, 1024, 1024]
    - [72, 5.773]
  - - [2048, 256, 1, 2048, 2048, 2048, 2048, 2048]
    - [76, 6.818]
  - - [2048, 256, 1, 4096, 2048, 2048, 4096, 4096]
    - [9, 7.956]
  - - [2048, 256, 1, 8192, 2048, 2048, 8192, 8192]
    - [10, 9.791]
  - - [2048, 512, 1, 128, 2048, 2048, 128, 128]
    - [67, 3.038]
  - - [2048, 512, 1, 256, 2048, 2048, 256, 256]
    - [64, 4.804]
  - - [2048, 512, 1, 512, 2048, 2048, 512, 512]
    - [71, 6.937]
  - - [2048, 512, 1, 1024, 2048, 2048, 1024, 1024]
    - [77, 7.795]
  - - [2048, 512, 1, 2048, 2048, 2048, 2048, 2048]
    - [24, 8.92]
  - - [2048, 512, 1, 4096, 2048, 2048, 4096, 4096]
    - [59, 9.553]
  - - [2048, 512, 1, 8192, 2048, 2048, 8192, 8192]
    - [60, 11.236]
  - - [2048, 1024, 1, 128, 2048, 2048, 128, 128]
    - [39, 3.864]
  - - [2048, 1024, 1, 256, 2048, 2048, 256, 256]
    - [46, 5.665]
  - - [2048, 1024, 1, 512, 2048, 2048, 512, 512]
    - [9, 8.097]
  - - [2048, 1024, 1, 1024, 2048, 2048, 1024, 1024]
    - [19, 9.776]
  - - [2048, 1024, 1, 2048, 2048, 2048, 2048, 2048]
    - [19, 10.913]
  - - [2048, 1024, 1, 4096, 2048, 2048, 4096, 4096]
    - [61, 11.202]
  - - [2048, 1024, 1, 8192, 2048, 2048, 8192, 8192]
    - [10, 13.217]
  - - [2048, 2048, 1, 128, 2048, 2048, 128, 128]
    - [4, 4.638]
  - - [2048, 2048, 1, 256, 2048, 2048, 256, 256]
    - [40, 6.439]
  - - [2048, 2048, 1, 512, 2048, 2048, 512, 512]
    - [1, 8.999]
  - - [2048, 2048, 1, 1024, 2048, 2048, 1024, 1024]
    - [9, 11.108]
  - - [2048, 2048, 1, 2048, 2048, 2048, 2048, 2048]
    - [10, 13.097]
  - - [2048, 2048, 1, 4096, 2048, 2048, 4096, 4096]
    - [50, 13.244]
  - - [2048, 2048, 1, 8192, 2048, 2048, 8192, 8192]
    - [49, 14.985]
  - - [2048, 4096, 1, 128, 2048, 2048, 128, 128]
    - [67, 4.479]
  - - [2048, 4096, 1, 256, 2048, 2048, 256, 256]
    - [67, 6.713]
  - - [2048, 4096, 1, 512, 2048, 2048, 512, 512]
    - [72, 8.402]
  - - [2048, 4096, 1, 1024, 2048, 2048, 1024, 1024]
    - [57, 10.379]
  - - [2048, 4096, 1, 2048, 2048, 2048, 2048, 2048]
    - [51, 12.234]
  - - [2048, 4096, 1, 4096, 2048, 2048, 4096, 4096]
    - [49, 13.902]
  - - [2048, 4096, 1, 8192, 2048, 2048, 8192, 8192]
    - [49, 15.917]
  - - [2048, 8192, 1, 128, 2048, 2048, 128, 128]
    - [38, 5.439]
  - - [2048, 8192, 1, 256, 2048, 2048, 256, 256]
    - [67, 7.231]
  - - [2048, 8192, 1, 512, 2048, 2048, 512, 512]
    - [44, 9.202]
  - - [2048, 8192, 1, 1024, 2048, 2048, 1024, 1024]
    - [55, 11.631]
  - - [2048, 8192, 1, 2048, 2048, 2048, 2048, 2048]
    - [57, 13.532]
  - - [2048, 8192, 1, 4096, 2048, 2048, 4096, 4096]
    - [56, 15.376]
  - - [2048, 8192, 1, 8192, 2048, 2048, 8192, 8192]
    - [55, 16.938]
  - - [4096, 128, 1, 128, 4096, 4096, 128, 128]
    - [26, 2.025]
  - - [4096, 128, 1, 256, 4096, 4096, 256, 256]
    - [26, 3.27]
  - - [4096, 128, 1, 512, 4096, 4096, 512, 512]
    - [73, 4.781]
  - - [4096, 128, 1, 1024, 4096, 4096, 1024, 1024]
    - [69, 5.407]
  - - [4096, 128, 1, 2048, 4096, 4096, 2048, 2048]
    - [77, 5.961]
  - - [4096, 128, 1, 4096, 4096, 4096, 4096, 4096]
    - [70, 7.557]
  - - [4096, 128, 1, 8192, 4096, 4096, 8192, 8192]
    - [10, 9.825]
  - - [4096, 256, 1, 128, 4096, 4096, 128, 128]
    - [65, 3.044]
  - - [4096, 256, 1, 256, 4096, 4096, 256, 256]
    - [66, 4.773]
  - - [4096, 256, 1, 512, 4096, 4096, 512, 512]
    - [71, 6.999]
  - - [4096, 256, 1, 1024, 4096, 4096, 1024, 1024]
    - [77, 7.797]
  - - [4096, 256, 1, 2048, 4096, 4096, 2048, 2048]
    - [71, 8.474]
  - - [4096, 256, 1, 4096, 4096, 4096, 4096, 4096]
    - [17, 9.658]
  - - [4096, 256, 1, 8192, 4096, 4096, 8192, 8192]
    - [60, 11.189]
  - - [4096, 512, 1, 128, 4096, 4096, 128, 128]
    - [3, 3.912]
  - - [4096, 512, 1, 256, 4096, 4096, 256, 256]
    - [43, 5.706]
  - - [4096, 512, 1, 512, 4096, 4096, 512, 512]
    - [8, 7.909]
  - - [4096, 512, 1, 1024, 4096, 4096, 1024, 1024]
    - [19, 9.556]
  - - [4096, 512, 1, 2048, 4096, 4096, 2048, 2048]
    - [19, 10.386]
  - - [4096, 512, 1, 4096, 4096, 4096, 4096, 4096]
    - [60, 11.557]
  - - [4096, 512, 1, 8192, 4096, 4096, 8192, 8192]
    - [9, 13.285]
  - - [4096, 1024, 1, 128, 4096, 4096, 128, 128]
    - [3, 4.514]
  - - [4096, 1024, 1, 256, 4096, 4096, 256, 256]
    - [43, 6.298]
  - - [4096, 1024, 1, 512, 4096, 4096, 512, 512]
    - [0, 8.98]
  - - [4096, 1024, 1, 1024, 4096, 4096, 1024, 1024]
    - [8, 11.527]
  - - [4096, 1024, 1, 2048, 4096, 4096, 2048, 2048]
    - [8, 11.836]
  - - [4096, 1024, 1, 4096, 4096, 4096, 4096, 4096]
    - [49, 13.394]
  - - [4096, 1024, 1, 8192, 4096, 4096, 8192, 8192]
    - [51, 15.118]
  - - [4096, 2048, 1, 128, 4096, 4096, 128, 128]
    - [65, 4.408]
  - - [4096, 2048, 1, 256, 4096, 4096, 256, 256]
    - [71, 6.373]
  - - [4096, 2048, 1, 512, 4096, 4096, 512, 512]
    - [71, 8.401]
  - - [4096, 2048, 1, 1024, 4096, 4096, 1024, 1024]
    - [55, 10.624]
  - - [4096, 2048, 1, 2048, 4096, 4096, 2048, 2048]
    - [50, 12.406]
  - - [4096, 2048, 1, 4096, 4096, 4096, 4096, 4096]
    - [49, 14.307]
  - - [4096, 2048, 1, 8192, 4096, 4096, 8192, 8192]
    - [49, 16.181]
  - - [4096, 4096, 1, 128, 4096, 4096, 128, 128]
    - [65, 5.3]
  - - [4096, 4096, 1, 256, 4096, 4096, 256, 256]
    - [44, 6.942]
  - - [4096, 4096, 1, 512, 4096, 4096, 512, 512]
    - [44, 9.177]
  - - [4096, 4096, 1, 1024, 4096, 4096, 1024, 1024]
    - [55, 11.735]
  - - [4096, 4096, 1, 2048, 4096, 4096, 2048, 2048]
    - [55, 13.567]
  - - [4096, 4096, 1, 4096, 4096, 4096, 4096, 4096]
    - [55, 15.633]
  - - [4096, 4096, 1, 8192, 4096, 4096, 8192, 8192]
    - [55, 17.035]
  - - [4096, 8192, 1, 128, 4096, 4096, 128, 128]
    - [21, 4.89]
  - - [4096, 8192, 1, 256, 4096, 4096, 256, 256]
    - [72, 6.668]
  - - [4096, 8192, 1, 512, 4096, 4096, 512, 512]
    - [8, 9.261]
  - - [4096, 8192, 1, 1024, 4096, 4096, 1024, 1024]
    - [8, 11.963]
  - - [4096, 8192, 1, 2048, 4096, 4096, 2048, 2048]
    - [55, 13.116]
  - - [4096, 8192, 1, 4096, 4096, 4096, 4096, 4096]
    - [56, 15.749]
  - - [4096, 8192, 1, 8192, 4096, 4096, 8192, 8192]
    - [55, 17.093]
  - - [8192, 128, 1, 128, 8192, 8192, 128, 128]
    - [64, 3.03]
  - - [8192, 128, 1, 256, 8192, 8192, 256, 256]
    - [59, 4.823]
  - - [8192, 128, 1, 512, 8192, 8192, 512, 512]
    - [59, 6.911]
  - - [8192, 128, 1, 1024, 8192, 8192, 1024, 1024]
    - [76, 6.611]
  - - [8192, 128, 1, 2048, 8192, 8192, 2048, 2048]
    - [58, 7.83]
  - - [8192, 128, 1, 4096, 8192, 8192, 4096, 4096]
    - [16, 9.614]
  - - [8192, 128, 1, 8192, 8192, 8192, 8192, 8192]
    - [10, 11.359]
  - - [8192, 256, 1, 128, 8192, 8192, 128, 128]
    - [2, 3.789]
  - - [8192, 256, 1, 256, 8192, 8192, 256, 256]
    - [43, 5.601]
  - - [8192, 256, 1, 512, 8192, 8192, 512, 512]
    - [8, 7.438]
  - - [8192, 256, 1, 1024, 8192, 8192, 1024, 1024]
    - [19, 8.871]
  - - [8192, 256, 1, 2048, 8192, 8192, 2048, 2048]
    - [62, 10.046]
  - - [8192, 256, 1, 4096, 8192, 8192, 4096, 4096]
    - [58, 11.57]
  - - [8192, 256, 1, 8192, 8192, 8192, 8192, 8192]
    - [8, 13.17]
  - - [8192, 512, 1, 128, 8192, 8192, 128, 128]
    - [44, 4.369]
  - - [8192, 512, 1, 256, 8192, 8192, 256, 256]
    - [43, 6.294]
  - - [8192, 512, 1, 512, 8192, 8192, 512, 512]
    - [0, 8.356]
  - - [8192, 512, 1, 1024, 8192, 8192, 1024, 1024]
    - [8, 10.84]
  - - [8192, 512, 1, 2048, 8192, 8192, 2048, 2048]
    - [56, 11.042]
  - - [8192, 512, 1, 4096, 8192, 8192, 4096, 4096]
    - [49, 13.436]
  - - [8192, 512, 1, 8192, 8192, 8192, 8192, 8192]
    - [49, 15.08]
  - - [8192, 1024, 1, 128, 8192, 8192, 128, 128]
    - [72, 4.313]
  - - [8192, 1024, 1, 256, 8192, 8192, 256, 256]
    - [71, 6.303]
  - - [8192, 1024, 1, 512, 8192, 8192, 512, 512]
    - [72, 8.26]
  - - [8192, 1024, 1, 1024, 8192, 8192, 1024, 1024]
    - [55, 10.638]
  - - [8192, 1024, 1, 2048, 8192, 8192, 2048, 2048]
    - [49, 12.472]
  - - [8192, 1024, 1, 4096, 8192, 8192, 4096, 4096]
    - [49, 14.342]
  - - [8192, 1024, 1, 8192, 8192, 8192, 8192, 8192]
    - [49, 16.227]
  - - [8192, 2048, 1, 128, 8192, 8192, 128, 128]
    - [37, 5.177]
  - - [8192, 2048, 1, 256, 8192, 8192, 256, 256]
    - [45, 6.938]
  - - [8192, 2048, 1, 512, 8192, 8192, 512, 512]
    - [44, 9.148]
  - - [8192, 2048, 1, 1024, 8192, 8192, 1024, 1024]
    - [55, 11.686]
  - - [8192, 2048, 1, 2048, 8192, 8192, 2048, 2048]
    - [55, 13.583]
  - - [8192, 2048, 1, 4096, 8192, 8192, 4096, 4096]
    - [55, 15.373]
  - - [8192, 2048, 1, 8192, 8192, 8192, 8192, 8192]
    - [55, 16.926]
  - - [8192, 4096, 1, 128, 8192, 8192, 128, 128]
    - [21, 4.783]
  - - [8192, 4096, 1, 256, 8192, 8192, 256, 256]
    - [71, 6.649]
  - - [8192, 4096, 1, 512, 8192, 8192, 512, 512]
    - [55, 9.126]
  - - [8192, 4096, 1, 1024, 8192, 8192, 1024, 1024]
    - [8, 11.669]
  - - [8192, 4096, 1, 2048, 8192, 8192, 2048, 2048]
    - [55, 13.062]
  - - [8192, 4096, 1, 4096, 8192, 8192, 4096, 4096]
    - [55, 15.733]
  - - [8192, 4096, 1, 8192, 8192, 8192, 8192, 8192]
    - [52, 16.8]
  - - [8192, 8192, 1, 128, 8192, 8192, 128, 128]
    - [21, 4.49]
  - - [8192, 8192, 1, 256, 8192, 8192, 256, 256]
    - [55, 6.609]
  - - [8192, 8192, 1, 512, 8192, 8192, 512, 512]
    - [55, 9.61]
  - - [8192, 8192, 1, 1024, 8192, 8192, 1024, 1024]
    - [8, 11.758]
  - - [8192, 8192, 1, 2048, 8192, 8192, 2048, 2048]
    - [55, 13.094]
  - - [8192, 8192, 1, 4096, 8192, 8192, 4096, 4096]
    - [56, 15.582]
  - - [8192, 8192, 1, 8192, 8192, 8192, 8192, 8192]
    - [55, 16.047]
  - - [1, 1, 1, 32, 1, 1, 32, 32]
    - [90, 0.0]
- null
- null
- DeviceEfficiency
- GridBased
