library/src/amd_detail/rocblaslt/src/Tensile/Logic/streamk/gfx942_80cu/aquavanjaram942_Cijk_Ailk_Bljk_HSS_BH_UserArgs.yaml
- {MinimumRequiredVersion: 4.33.0}
- aquavanjaram942
- {Architecture: gfx942, CUCount: 80}
- [Device 0049, Device 0050]
    SolutionIndex: 0
    SolutionNameMin: Cijk_Ailk_Bljk_HSS_BH_UserArgs_MT256x256x32_MI16x16x1_SN_LDSB1_CLR1_GSU0_GSUC0_GSUWGMRR0_K1_LBSPPA2048_LBSPPB128_LPA0_MIWT8_8_PLR1_SU32_SUM0_SUS256_SKXCCM0_VWA4_VWB2_WGM2_WGMXCC1_WGMXCCGn1
    SolutionIndex: 1
    SolutionNameMin: Cijk_Ailk_Bljk_HSS_BH_UserArgs_MT256x256x32_MI16x16x1_SN_LDSB1_CLR1_GSU0_GSUC0_GSUWGMRR0_K1_LBSPPA2048_LBSPPB512_LPA0_MIWT8_8_PLR1_SU32_SUM0_SUS256_SKXCCM0_VWA4_VWB8_WGM2_WGMXCC1_WGMXCCGn1
    SolutionIndex: 2
    SolutionNameMin: Cijk_Ailk_Bljk_HSS_BH_UserArgs_MT128x256x32_MI16x16x1_SN_LDSB1_CLR1_GSU0_GSUC0_GSUWGMRR0_K1_LBSPPA1024_LBSPPB128_LPA0_MIWT4_8_PLR1_SU32_SUM0_SUS256_SKXCCM0_VWA4_VWB2_WGM1_WGMXCC1_WGMXCCGn1
    SolutionIndex: 3
    SolutionNameMin: Cijk_Ailk_Bljk_HSS_BH_UserArgs_MT256x128x32_MI16x16x1_SN_LDSB1_CLR1_GSU0_GSUC0_GSUWGMRR0_K1_LBSPPA2048_LBSPPB128_LPA0_MIWT8_4_PLR1_SU32_SUM0_SUS256_SKXCCM0_VWA4_VWB1_WGM1_WGMXCC1_WGMXCCGn1
    SolutionIndex: 4
    SolutionNameMin: Cijk_Ailk_Bljk_HSS_BH_UserArgs_MT256x128x32_MI16x16x1_SN_LDSB1_CLR1_GSU0_GSUC0_GSUWGMRR0_K1_LBSPPA2048_LBSPPB128_LPA0_MIWT8_4_PLR1_SU32_SUM0_SUS256_SKXCCM0_VWA4_VWB2_WGM1_WGMXCC1_WGMXCCGn1
    SolutionIndex: 5
    SolutionNameMin: Cijk_Ailk_Bljk_HSS_BH_UserArgs_MT256x128x32_MI16x16x1_SN_LDSB1_CLR1_GSU0_GSUC0_GSUWGMRR0_K1_LBSPPA2048_LBSPPB256_LPA0_MIWT8_4_PLR1_SU32_SUM0_SUS256_SKXCCM0_VWA4_VWB4_WGM1_WGMXCC1_WGMXCCGn1
    SolutionIndex: 6
    SolutionNameMin: Cijk_Ailk_Bljk_HSS_BH_UserArgs_MT256x128x32_MI16x16x1_SN_LDSB1_CLR1_GSU0_GSUC0_GSUWGMRR0_K1_LBSPPA2048_LBSPPB128_LPA0_MIWT8_4_PLR1_SU32_SUM0_SUS256_SKXCCM0_VWA4_VWB1_WGM2_WGMXCC1_WGMXCCGn1
    SolutionIndex: 7
    SolutionNameMin: Cijk_Ailk_Bljk_HSS_BH_UserArgs_MT256x128x32_MI16x16x1_SN_LDSB1_CLR1_GSU0_GSUC0_GSUWGMRR0_K1_LBSPPA2048_LBSPPB128_LPA0_MIWT8_4_PLR1_SU32_SUM0_SUS256_SKXCCM0_VWA4_VWB2_WGM2_WGMXCC1_WGMXCCGn1
    SolutionIndex: 8
    SolutionNameMin: Cijk_Ailk_Bljk_HSS_BH_UserArgs_MT256x128x32_MI16x16x1_SN_LDSB1_CLR1_GSU0_GSUC0_GSUWGMRR0_K1_LBSPPA2048_LBSPPB256_LPA0_MIWT8_4_PLR1_SU32_SUM0_SUS256_SKXCCM0_VWA4_VWB4_WGM2_WGMXCC1_WGMXCCGn1
    SolutionIndex: 9
    SolutionNameMin: Cijk_Ailk_Bljk_HSS_BH_UserArgs_MT256x128x32_MI16x16x1_SN_LDSB1_CLR1_GSU0_GSUC0_GSUWGMRR0_K1_LBSPPA2048_LBSPPB128_LPA0_MIWT8_4_PLR1_SU32_SUM0_SUS256_SKXCCM0_VWA4_VWB1_WGM4_WGMXCC1_WGMXCCGn1
    SolutionIndex: 10
    SolutionNameMin: Cijk_Ailk_Bljk_HSS_BH_UserArgs_MT256x128x32_MI16x16x1_SN_LDSB1_CLR1_GSU0_GSUC0_GSUWGMRR0_K1_LBSPPA2048_LBSPPB128_LPA0_MIWT8_4_PLR1_SU32_SUM0_SUS256_SKXCCM0_VWA4_VWB2_WGM4_WGMXCC1_WGMXCCGn1
    SolutionIndex: 11
    SolutionNameMin: Cijk_Ailk_Bljk_HSS_BH_UserArgs_MT256x128x32_MI16x16x1_SN_LDSB1_CLR1_GSU0_GSUC0_GSUWGMRR0_K1_LBSPPA2048_LBSPPB256_LPA0_MIWT8_4_PLR1_SU32_SUM0_SUS256_SKXCCM0_VWA4_VWB4_WGM4_WGMXCC1_WGMXCCGn1
    SolutionIndex: 12
    SolutionNameMin: Cijk_Ailk_Bljk_HSS_BH_UserArgs_MT128x128x32_MI16x16x1_SN_LDSB1_CLR1_GSU0_GSUC0_GSUWGMRR0_K1_LBSPPA1024_LBSPPB128_LPA0_MIWT4_4_PLR1_SU32_SUM0_SUS256_SKXCCM0_VWA4_VWB1_WGM1_WGMXCC1_WGMXCCGn1
    SolutionIndex: 13
    SolutionNameMin: Cijk_Ailk_Bljk_HSS_BH_UserArgs_MT128x128x32_MI16x16x1_SN_LDSB1_CLR1_GSU0_GSUC0_GSUWGMRR0_K1_LBSPPA1024_LBSPPB128_LPA0_MIWT4_4_PLR1_SU32_SUM0_SUS256_SKXCCM0_VWA4_VWB2_WGM1_WGMXCC1_WGMXCCGn1
    SolutionIndex: 14
    SolutionNameMin: Cijk_Ailk_Bljk_HSS_BH_UserArgs_MT128x128x32_MI16x16x1_SN_LDSB1_CLR1_GSU0_GSUC0_GSUWGMRR0_K1_LBSPPA1024_LBSPPB256_LPA0_MIWT4_4_PLR1_SU32_SUM0_SUS256_SKXCCM0_VWA4_VWB4_WGM1_WGMXCC1_WGMXCCGn1
    SolutionIndex: 15
    SolutionNameMin: Cijk_Ailk_Bljk_HSS_BH_UserArgs_MT128x128x32_MI16x16x1_SN_LDSB1_CLR1_GSU0_GSUC0_GSUWGMRR0_K1_LBSPPA1024_LBSPPB128_LPA16_MIWT4_4_PLR1_SU32_SUM0_SUS256_SKXCCM0_VWA1_VWB1_WGM2_WGMXCC1_WGMXCCGn1
    SolutionIndex: 16
    SolutionNameMin: Cijk_Ailk_Bljk_HSS_BH_UserArgs_MT128x128x32_MI16x16x1_SN_LDSB1_CLR1_GSU0_GSUC0_GSUWGMRR0_K1_LBSPPA1024_LBSPPB128_LPA0_MIWT4_4_PLR1_SU32_SUM0_SUS256_SKXCCM0_VWA4_VWB1_WGM2_WGMXCC1_WGMXCCGn1
    SolutionIndex: 17
    SolutionNameMin: Cijk_Ailk_Bljk_HSS_BH_UserArgs_MT32x32x32_MI16x16x1_SN_LDSB0_CLR1_GSU0_GSUC0_GSUWGMRR0_K1_LBSPPA256_LBSPPB128_LPA16_MIWT1_1_PLR1_SU32_SUM0_SUS256_SKXCCM0_VWA1_VWB1_WGM1_WGMXCC1_WGMXCCGn1
    SolutionIndex: 18
    SolutionNameMin: Cijk_Ailk_Bljk_HSS_BH_UserArgs_MT128x256x64_MI16x16x1_SN_LDSB1_CLR1_GSU0_GSUC0_GSUWGMRR0_K1_LBSPPA2048_LBSPPB256_LPA0_MIWT4_8_PLR1_SU32_SUM0_SUS256_SKXCCM0_VWA4_VWB2_WGM1_WGMXCC1_WGMXCCGn1
    SolutionIndex: 19
    SolutionNameMin: Cijk_Ailk_Bljk_HSS_BH_UserArgs_MT128x256x64_MI16x16x1_SN_LDSB1_CLR1_GSU0_GSUC0_GSUWGMRR0_K1_LBSPPA2048_LBSPPB1024_LPA0_MIWT4_8_PLR1_SU32_SUM0_SUS256_SKXCCM0_VWA4_VWB8_WGM1_WGMXCC1_WGMXCCGn1
    SolutionIndex: 20
    SolutionNameMin: Cijk_Ailk_Bljk_HSS_BH_UserArgs_MT256x128x64_MI16x16x1_SN_LDSB1_CLR1_GSU0_GSUC0_GSUWGMRR0_K1_LBSPPA4096_LBSPPB128_LPA0_MIWT8_4_PLR1_SU32_SUM0_SUS256_SKXCCM0_VWA4_VWB1_WGM1_WGMXCC1_WGMXCCGn1
    SolutionIndex: 21
    SolutionNameMin: Cijk_Ailk_Bljk_HSS_BH_UserArgs_MT256x128x64_MI16x16x1_SN_LDSB1_CLR1_GSU0_GSUC0_GSUWGMRR0_K1_LBSPPA4096_LBSPPB256_LPA0_MIWT8_4_PLR1_SU32_SUM0_SUS256_SKXCCM0_VWA4_VWB2_WGM1_WGMXCC1_WGMXCCGn1
    SolutionIndex: 22
    SolutionNameMin: Cijk_Ailk_Bljk_HSS_BH_UserArgs_MT256x128x64_MI16x16x1_SN_LDSB1_CLR1_GSU0_GSUC0_GSUWGMRR0_K1_LBSPPA4096_LBSPPB512_LPA0_MIWT8_4_PLR1_SU32_SUM0_SUS256_SKXCCM0_VWA4_VWB4_WGM1_WGMXCC1_WGMXCCGn1
    SolutionIndex: 23
    SolutionNameMin: Cijk_Ailk_Bljk_HSS_BH_UserArgs_MT256x128x64_MI16x16x1_SN_LDSB1_CLR1_GSU0_GSUC0_GSUWGMRR0_K1_LBSPPA4096_LBSPPB512_LPA0_MIWT8_4_PLR1_SU32_SUM0_SUS256_SKXCCM0_VWA4_VWB4_WGM2_WGMXCC1_WGMXCCGn1
    SolutionIndex: 24
    SolutionNameMin: Cijk_Ailk_Bljk_HSS_BH_UserArgs_MT256x128x64_MI16x16x1_SN_LDSB1_CLR1_GSU0_GSUC0_GSUWGMRR0_K1_LBSPPA4096_LBSPPB256_LPA0_MIWT8_4_PLR1_SU32_SUM0_SUS256_SKXCCM0_VWA4_VWB2_WGM4_WGMXCC1_WGMXCCGn1
    SolutionIndex: 25
    SolutionNameMin: Cijk_Ailk_Bljk_HSS_BH_UserArgs_MT128x128x64_MI16x16x1_SN_LDSB1_CLR1_GSU0_GSUC0_GSUWGMRR0_K1_LBSPPA2048_LBSPPB128_LPA0_MIWT4_4_PLR1_SU32_SUM0_SUS256_SKXCCM0_VWA4_VWB1_WGM1_WGMXCC1_WGMXCCGn1
    SolutionIndex: 26
    SolutionNameMin: Cijk_Ailk_Bljk_HSS_BH_UserArgs_MT128x128x64_MI16x16x1_SN_LDSB1_CLR1_GSU0_GSUC0_GSUWGMRR0_K1_LBSPPA2048_LBSPPB256_LPA0_MIWT4_4_PLR1_SU32_SUM0_SUS256_SKXCCM0_VWA4_VWB2_WGM1_WGMXCC1_WGMXCCGn1
    SolutionIndex: 27
    SolutionNameMin: Cijk_Ailk_Bljk_HSS_BH_UserArgs_MT128x128x64_MI16x16x1_SN_LDSB1_CLR1_GSU0_GSUC0_GSUWGMRR0_K1_LBSPPA2048_LBSPPB512_LPA0_MIWT4_4_PLR1_SU32_SUM0_SUS256_SKXCCM0_VWA4_VWB4_WGM1_WGMXCC1_WGMXCCGn1
    SolutionIndex: 28
    SolutionNameMin: Cijk_Ailk_Bljk_HSS_BH_UserArgs_MT128x128x64_MI16x16x1_SN_LDSB1_CLR1_GSU0_GSUC0_GSUWGMRR0_K1_LBSPPA2048_LBSPPB128_LPA0_MIWT4_4_PLR1_SU32_SUM0_SUS256_SKXCCM0_VWA4_VWB1_WGM4_WGMXCC1_WGMXCCGn1
    SolutionIndex: 29
    SolutionNameMin: Cijk_Ailk_Bljk_HSS_BH_UserArgs_MT128x64x64_MI16x16x1_SN_LDSB1_CLR1_GSU0_GSUC0_GSUWGMRR0_K1_LBSPPA2048_LBSPPB128_LPA0_MIWT4_2_PLR1_SU32_SUM0_SUS256_SKXCCM0_VWA4_VWB1_WGM1_WGMXCC1_WGMXCCGn1
    SolutionIndex: 30
    SolutionNameMin: Cijk_Ailk_Bljk_HSS_BH_UserArgs_MT128x64x64_MI16x16x1_SN_LDSB1_CLR1_GSU0_GSUC0_GSUWGMRR0_K1_LBSPPA2048_LBSPPB256_LPA0_MIWT4_2_PLR1_SU32_SUM0_SUS256_SKXCCM0_VWA4_VWB2_WGM1_WGMXCC1_WGMXCCGn1
    SolutionIndex: 31
    SolutionNameMin: Cijk_Ailk_Bljk_HSS_BH_UserArgs_MT128x64x64_MI16x16x1_SN_LDSB1_CLR1_GSU0_GSUC0_GSUWGMRR0_K1_LBSPPA2048_LBSPPB256_LPA0_MIWT4_2_PLR1_SU32_SUM0_SUS256_SKXCCM0_VWA4_VWB2_WGM2_WGMXCC1_WGMXCCGn1
    SolutionIndex: 32
    SolutionNameMin: Cijk_Ailk_Bljk_HSS_BH_UserArgs_MT128x64x64_MI16x16x1_SN_LDSB1_CLR1_GSU0_GSUC0_GSUWGMRR0_K1_LBSPPA2048_LBSPPB128_LPA0_MIWT4_2_PLR1_SU32_SUM0_SUS256_SKXCCM0_VWA4_VWB1_WGM4_WGMXCC1_WGMXCCGn1
    SolutionIndex: 33
    SolutionNameMin: Cijk_Ailk_Bljk_HSS_BH_UserArgs_MT64x64x64_MI16x16x1_SN_LDSB1_CLR1_GSU0_GSUC0_GSUWGMRR0_K1_LBSPPA1024_LBSPPB256_LPA32_MIWT2_2_PLR1_SU32_SUM0_SUS256_SKXCCM0_VWA2_VWB2_WGM2_WGMXCC1_WGMXCCGn1
    SolutionIndex: 34
    SolutionNameMin: Cijk_Ailk_Bljk_HSS_BH_UserArgs_MT64x64x64_MI16x16x1_SN_LDSB1_CLR1_GSU0_GSUC0_GSUWGMRR0_K1_LBSPPA1024_LBSPPB256_LPA16_MIWT2_2_PLR1_SU32_SUM0_SUS256_SKXCCM0_VWA1_VWB2_WGM4_WGMXCC1_WGMXCCGn1
    SolutionIndex: 35
    SolutionNameMin: Cijk_Ailk_Bljk_HSS_BH_UserArgs_MT64x32x64_MI16x16x1_SN_LDSB0_CLR1_GSU0_GSUC0_GSUWGMRR0_K1_LBSPPA1024_LBSPPB128_LPA32_MIWT2_1_PLR1_SU32_SUM0_SUS256_SKXCCM0_VWA2_VWB1_WGM1_WGMXCC1_WGMXCCGn1
    SolutionIndex: 36
    SolutionNameMin: Cijk_Ailk_Bljk_HSS_BH_UserArgs_MT64x32x128_MI16x16x1_SN_LDSB1_CLR1_GSU0_GSUC0_GSUWGMRR0_K1_LBSPPA1024_LBSPPB256_LPA32_MIWT2_1_PLR2_SU32_SUM0_SUS256_SKXCCM0_VWA2_VWB1_WGM1_WGMXCC1_WGMXCCGn1
    SolutionIndex: 37
    SolutionNameMin: Cijk_Ailk_Bljk_HSS_BH_UserArgs_MT32x32x128_MI16x16x1_SN_LDSB1_CLR1_GSU0_GSUC0_GSUWGMRR0_K1_LBSPPA512_LBSPPB256_LPA16_MIWT1_1_PLR1_SU32_SUM0_SUS256_SKXCCM0_VWA1_VWB1_WGM1_WGMXCC1_WGMXCCGn1
    SolutionIndex: 38
    SolutionNameMin: Cijk_Ailk_Bljk_HSS_BH_UserArgs_MT32x32x128_MI16x16x1_SN_LDSB1_CLR1_GSU0_GSUC0_GSUWGMRR0_K1_LBSPPA512_LBSPPB256_LPA16_MIWT1_1_PLR2_SU32_SUM0_SUS256_SKXCCM0_VWA1_VWB1_WGM1_WGMXCC1_WGMXCCGn1
    SolutionIndex: 39
    SolutionNameMin: Cijk_Ailk_Bljk_HSS_BH_UserArgs_MT256x256x32_MI16x16x1_SN_LDSB1_CLR1_GSU0_GSUC0_GSUWGMRR0_K1_LBSPPA2048_LBSPPB128_LPA0_MIWT8_8_PLR1_SU32_SUM0_SUS256_SKXCCM4_VWA4_VWB1_WGM1_WGMXCC1_WGMXCCGn1
    SolutionIndex: 40
    SolutionNameMin: Cijk_Ailk_Bljk_HSS_BH_UserArgs_MT256x256x32_MI16x16x1_SN_LDSB1_CLR1_GSU0_GSUC0_GSUWGMRR0_K1_LBSPPA2048_LBSPPB128_LPA0_MIWT8_8_PLR1_SU32_SUM0_SUS256_SKXCCM4_VWA4_VWB2_WGM1_WGMXCC1_WGMXCCGn1
    SolutionIndex: 41
    SolutionNameMin: Cijk_Ailk_Bljk_HSS_BH_UserArgs_MT256x256x32_MI16x16x1_SN_LDSB1_CLR1_GSU0_GSUC0_GSUWGMRR0_K1_LBSPPA2048_LBSPPB256_LPA0_MIWT8_8_PLR1_SU32_SUM0_SUS256_SKXCCM4_VWA4_VWB4_WGM1_WGMXCC1_WGMXCCGn1
    SolutionIndex: 42
    SolutionNameMin: Cijk_Ailk_Bljk_HSS_BH_UserArgs_MT256x256x32_MI16x16x1_SN_LDSB1_CLR1_GSU0_GSUC0_GSUWGMRR0_K1_LBSPPA2048_LBSPPB512_LPA0_MIWT8_8_PLR1_SU32_SUM0_SUS256_SKXCCM4_VWA4_VWB8_WGM1_WGMXCC1_WGMXCCGn1
    SolutionIndex: 43
    SolutionNameMin: Cijk_Ailk_Bljk_HSS_BH_UserArgs_MT256x256x32_MI16x16x1_SN_LDSB1_CLR1_GSU0_GSUC0_GSUWGMRR0_K1_LBSPPA2048_LBSPPB512_LPA0_MIWT8_8_PLR1_SU32_SUM0_SUS256_SKXCCM4_VWA4_VWB8_WGM2_WGMXCC1_WGMXCCGn1
    SolutionIndex: 44
    SolutionNameMin: Cijk_Ailk_Bljk_HSS_BH_UserArgs_MT256x256x32_MI16x16x1_SN_LDSB1_CLR1_GSU0_GSUC0_GSUWGMRR0_K1_LBSPPA2048_LBSPPB128_LPA0_MIWT8_8_PLR1_SU32_SUM0_SUS256_SKXCCM4_VWA4_VWB1_WGM4_WGMXCC1_WGMXCCGn1
    SolutionIndex: 45
    SolutionNameMin: Cijk_Ailk_Bljk_HSS_BH_UserArgs_MT256x256x32_MI16x16x1_SN_LDSB1_CLR1_GSU0_GSUC0_GSUWGMRR0_K1_LBSPPA2048_LBSPPB128_LPA0_MIWT8_8_PLR1_SU32_SUM0_SUS256_SKXCCM4_VWA4_VWB2_WGM4_WGMXCC1_WGMXCCGn1
    SolutionIndex: 46
    SolutionNameMin: Cijk_Ailk_Bljk_HSS_BH_UserArgs_MT256x256x32_MI16x16x1_SN_LDSB1_CLR1_GSU0_GSUC0_GSUWGMRR0_K1_LBSPPA2048_LBSPPB512_LPA0_MIWT8_8_PLR1_SU32_SUM0_SUS256_SKXCCM4_VWA4_VWB8_WGM4_WGMXCC1_WGMXCCGn1
    SolutionIndex: 47
    SolutionNameMin: Cijk_Ailk_Bljk_HSS_BH_UserArgs_MT128x256x32_MI16x16x1_SN_LDSB1_CLR1_GSU0_GSUC0_GSUWGMRR0_K1_LBSPPA1024_LBSPPB512_LPA0_MIWT4_8_PLR1_SU32_SUM0_SUS256_SKXCCM4_VWA4_VWB8_WGM1_WGMXCC1_WGMXCCGn1
    SolutionIndex: 48
    SolutionNameMin: Cijk_Ailk_Bljk_HSS_BH_UserArgs_MT256x128x32_MI16x16x1_SN_LDSB1_CLR1_GSU0_GSUC0_GSUWGMRR0_K1_LBSPPA2048_LBSPPB128_LPA0_MIWT8_4_PLR1_SU32_SUM0_SUS256_SKXCCM4_VWA4_VWB1_WGM1_WGMXCC1_WGMXCCGn1
    SolutionIndex: 49
    SolutionNameMin: Cijk_Ailk_Bljk_HSS_BH_UserArgs_MT256x128x32_MI16x16x1_SN_LDSB1_CLR1_GSU0_GSUC0_GSUWGMRR0_K1_LBSPPA2048_LBSPPB128_LPA0_MIWT8_4_PLR1_SU32_SUM0_SUS256_SKXCCM4_VWA4_VWB2_WGM1_WGMXCC1_WGMXCCGn1
    SolutionIndex: 50
    SolutionNameMin: Cijk_Ailk_Bljk_HSS_BH_UserArgs_MT256x128x32_MI16x16x1_SN_LDSB1_CLR1_GSU0_GSUC0_GSUWGMRR0_K1_LBSPPA2048_LBSPPB256_LPA0_MIWT8_4_PLR1_SU32_SUM0_SUS256_SKXCCM4_VWA4_VWB4_WGM1_WGMXCC1_WGMXCCGn1
    SolutionIndex: 51
    SolutionNameMin: Cijk_Ailk_Bljk_HSS_BH_UserArgs_MT256x128x32_MI16x16x1_SN_LDSB1_CLR1_GSU0_GSUC0_GSUWGMRR0_K1_LBSPPA2048_LBSPPB128_LPA0_MIWT8_4_PLR1_SU32_SUM0_SUS256_SKXCCM4_VWA4_VWB1_WGM2_WGMXCC1_WGMXCCGn1
    SolutionIndex: 52
    SolutionNameMin: Cijk_Ailk_Bljk_HSS_BH_UserArgs_MT256x128x32_MI16x16x1_SN_LDSB1_CLR1_GSU0_GSUC0_GSUWGMRR0_K1_LBSPPA2048_LBSPPB128_LPA0_MIWT8_4_PLR1_SU32_SUM0_SUS256_SKXCCM4_VWA4_VWB2_WGM2_WGMXCC1_WGMXCCGn1
    SolutionIndex: 53
    SolutionNameMin: Cijk_Ailk_Bljk_HSS_BH_UserArgs_MT256x128x32_MI16x16x1_SN_LDSB1_CLR1_GSU0_GSUC0_GSUWGMRR0_K1_LBSPPA2048_LBSPPB256_LPA0_MIWT8_4_PLR1_SU32_SUM0_SUS256_SKXCCM4_VWA4_VWB4_WGM2_WGMXCC1_WGMXCCGn1
    SolutionIndex: 54
    SolutionNameMin: Cijk_Ailk_Bljk_HSS_BH_UserArgs_MT256x128x32_MI16x16x1_SN_LDSB1_CLR1_GSU0_GSUC0_GSUWGMRR0_K1_LBSPPA2048_LBSPPB128_LPA0_MIWT8_4_PLR1_SU32_SUM0_SUS256_SKXCCM4_VWA4_VWB1_WGM4_WGMXCC1_WGMXCCGn1
    SolutionIndex: 55
    SolutionNameMin: Cijk_Ailk_Bljk_HSS_BH_UserArgs_MT256x128x32_MI16x16x1_SN_LDSB1_CLR1_GSU0_GSUC0_GSUWGMRR0_K1_LBSPPA2048_LBSPPB128_LPA0_MIWT8_4_PLR1_SU32_SUM0_SUS256_SKXCCM4_VWA4_VWB2_WGM4_WGMXCC1_WGMXCCGn1
    SolutionIndex: 56
    SolutionNameMin: Cijk_Ailk_Bljk_HSS_BH_UserArgs_MT256x128x32_MI16x16x1_SN_LDSB1_CLR1_GSU0_GSUC0_GSUWGMRR0_K1_LBSPPA2048_LBSPPB256_LPA0_MIWT8_4_PLR1_SU32_SUM0_SUS256_SKXCCM4_VWA4_VWB4_WGM4_WGMXCC1_WGMXCCGn1
    SolutionIndex: 57
    SolutionNameMin: Cijk_Ailk_Bljk_HSS_BH_UserArgs_MT256x64x32_MI16x16x1_SN_LDSB1_CLR1_GSU0_GSUC0_GSUWGMRR0_K1_LBSPPA2048_LBSPPB128_LPA0_MIWT8_2_PLR1_SU32_SUM0_SUS256_SKXCCM4_VWA4_VWB1_WGM1_WGMXCC1_WGMXCCGn1
    SolutionIndex: 58
    SolutionNameMin: Cijk_Ailk_Bljk_HSS_BH_UserArgs_MT128x128x32_MI16x16x1_SN_LDSB1_CLR1_GSU0_GSUC0_GSUWGMRR0_K1_LBSPPA1024_LBSPPB128_LPA0_MIWT4_4_PLR1_SU32_SUM0_SUS256_SKXCCM4_VWA4_VWB1_WGM1_WGMXCC1_WGMXCCGn1
    SolutionIndex: 59
    SolutionNameMin: Cijk_Ailk_Bljk_HSS_BH_UserArgs_MT128x128x32_MI16x16x1_SN_LDSB1_CLR1_GSU0_GSUC0_GSUWGMRR0_K1_LBSPPA1024_LBSPPB128_LPA16_MIWT4_4_PLR1_SU32_SUM0_SUS256_SKXCCM4_VWA1_VWB2_WGM1_WGMXCC1_WGMXCCGn1
    SolutionIndex: 60
    SolutionNameMin: Cijk_Ailk_Bljk_HSS_BH_UserArgs_MT128x128x32_MI16x16x1_SN_LDSB1_CLR1_GSU0_GSUC0_GSUWGMRR0_K1_LBSPPA1024_LBSPPB128_LPA0_MIWT4_4_PLR1_SU32_SUM0_SUS256_SKXCCM4_VWA4_VWB2_WGM1_WGMXCC1_WGMXCCGn1
    SolutionIndex: 61
    SolutionNameMin: Cijk_Ailk_Bljk_HSS_BH_UserArgs_MT128x128x32_MI16x16x1_SN_LDSB1_CLR1_GSU0_GSUC0_GSUWGMRR0_K1_LBSPPA1024_LBSPPB256_LPA16_MIWT4_4_PLR1_SU32_SUM0_SUS256_SKXCCM4_VWA1_VWB4_WGM1_WGMXCC1_WGMXCCGn1
    SolutionIndex: 62
    SolutionNameMin: Cijk_Ailk_Bljk_HSS_BH_UserArgs_MT128x128x32_MI16x16x1_SN_LDSB1_CLR1_GSU0_GSUC0_GSUWGMRR0_K1_LBSPPA1024_LBSPPB256_LPA0_MIWT4_4_PLR1_SU32_SUM0_SUS256_SKXCCM4_VWA4_VWB4_WGM1_WGMXCC1_WGMXCCGn1
    SolutionIndex: 63
    SolutionNameMin: Cijk_Ailk_Bljk_HSS_BH_UserArgs_MT128x128x32_MI16x16x1_SN_LDSB1_CLR1_GSU0_GSUC0_GSUWGMRR0_K1_LBSPPA1024_LBSPPB128_LPA0_MIWT4_4_PLR1_SU32_SUM0_SUS256_SKXCCM4_VWA4_VWB1_WGM2_WGMXCC1_WGMXCCGn1
    SolutionIndex: 64
    SolutionNameMin: Cijk_Ailk_Bljk_HSS_BH_UserArgs_MT128x128x32_MI16x16x1_SN_LDSB1_CLR1_GSU0_GSUC0_GSUWGMRR0_K1_LBSPPA1024_LBSPPB128_LPA0_MIWT4_4_PLR1_SU32_SUM0_SUS256_SKXCCM4_VWA4_VWB1_WGM4_WGMXCC1_WGMXCCGn1
    SolutionIndex: 65
    SolutionNameMin: Cijk_Ailk_Bljk_HSS_BH_UserArgs_MT128x128x32_MI16x16x1_SN_LDSB1_CLR1_GSU0_GSUC0_GSUWGMRR0_K1_LBSPPA1024_LBSPPB128_LPA0_MIWT4_4_PLR1_SU32_SUM0_SUS256_SKXCCM4_VWA4_VWB2_WGM4_WGMXCC1_WGMXCCGn1
    SolutionIndex: 66
    SolutionNameMin: Cijk_Ailk_Bljk_HSS_BH_UserArgs_MT128x64x32_MI16x16x1_SN_LDSB0_CLR1_GSU0_GSUC0_GSUWGMRR0_K1_LBSPPA1024_LBSPPB128_LPA0_MIWT4_2_PLR1_SU32_SUM0_SUS256_SKXCCM4_VWA4_VWB1_WGM1_WGMXCC1_WGMXCCGn1
    SolutionIndex: 67
    SolutionNameMin: Cijk_Ailk_Bljk_HSS_BH_UserArgs_MT128x64x32_MI16x16x1_SN_LDSB0_CLR1_GSU0_GSUC0_GSUWGMRR0_K1_LBSPPA1024_LBSPPB128_LPA0_MIWT4_2_PLR1_SU32_SUM0_SUS256_SKXCCM4_VWA4_VWB2_WGM1_WGMXCC1_WGMXCCGn1
    SolutionIndex: 68
    SolutionNameMin: Cijk_Ailk_Bljk_HSS_BH_UserArgs_MT128x64x32_MI16x16x1_SN_LDSB0_CLR0_GSU0_GSUC0_GSUWGMRR0_K1_LBSPPA1024_LBSPPB128_LPA0_MIWT4_2_PLR0_SU32_SUM0_SUS256_SKXCCM4_VWA4_VWB2_WGM1_WGMXCC1_WGMXCCGn1
    SolutionIndex: 69
    SolutionNameMin: Cijk_Ailk_Bljk_HSS_BH_UserArgs_MT128x64x32_MI16x16x1_SN_LDSB0_CLR0_GSU0_GSUC0_GSUWGMRR0_K1_LBSPPA1024_LBSPPB128_LPA0_MIWT4_2_PLR0_SU32_SUM0_SUS256_SKXCCM4_VWA4_VWB1_WGM4_WGMXCC1_WGMXCCGn1
    SolutionIndex: 70
    SolutionNameMin: Cijk_Ailk_Bljk_HSS_BH_UserArgs_MT32x32x32_MI16x16x1_SN_LDSB0_CLR1_GSU0_GSUC0_GSUWGMRR0_K1_LBSPPA256_LBSPPB128_LPA16_MIWT1_1_PLR1_SU32_SUM0_SUS256_SKXCCM4_VWA1_VWB1_WGM1_WGMXCC1_WGMXCCGn1
    SolutionIndex: 71
    SolutionNameMin: Cijk_Ailk_Bljk_HSS_BH_UserArgs_MT256x128x64_MI16x16x1_SN_LDSB1_CLR1_GSU0_GSUC0_GSUWGMRR0_K1_LBSPPA4096_LBSPPB128_LPA0_MIWT8_4_PLR1_SU32_SUM0_SUS256_SKXCCM4_VWA4_VWB1_WGM1_WGMXCC1_WGMXCCGn1
    SolutionIndex: 72
    SolutionNameMin: Cijk_Ailk_Bljk_HSS_BH_UserArgs_MT128x128x64_MI16x16x1_SN_LDSB1_CLR1_GSU0_GSUC0_GSUWGMRR0_K1_LBSPPA2048_LBSPPB128_LPA0_MIWT4_4_PLR1_SU32_SUM0_SUS256_SKXCCM4_VWA4_VWB1_WGM1_WGMXCC1_WGMXCCGn1
    SolutionIndex: 73
    SolutionNameMin: Cijk_Ailk_Bljk_HSS_BH_UserArgs_MT128x128x64_MI16x16x1_SN_LDSB1_CLR1_GSU0_GSUC0_GSUWGMRR0_K1_LBSPPA2048_LBSPPB512_LPA0_MIWT4_4_PLR1_SU32_SUM0_SUS256_SKXCCM4_VWA4_VWB4_WGM1_WGMXCC1_WGMXCCGn1
    SolutionIndex: 74
    SolutionNameMin: Cijk_Ailk_Bljk_HSS_BH_UserArgs_MT64x128x64_MI16x16x1_SN_LDSB1_CLR1_GSU0_GSUC0_GSUWGMRR0_K1_LBSPPA1024_LBSPPB256_LPA32_MIWT2_4_PLR1_SU32_SUM0_SUS256_SKXCCM4_VWA2_VWB2_WGM1_WGMXCC1_WGMXCCGn1
    SolutionIndex: 75
    SolutionNameMin: Cijk_Ailk_Bljk_HSS_BH_UserArgs_MT64x128x64_MI16x16x1_SN_LDSB1_CLR1_GSU0_GSUC0_GSUWGMRR0_K1_LBSPPA1024_LBSPPB512_LPA32_MIWT2_4_PLR1_SU32_SUM0_SUS256_SKXCCM4_VWA2_VWB4_WGM1_WGMXCC1_WGMXCCGn1
    SolutionIndex: 76
    SolutionNameMin: Cijk_Ailk_Bljk_HSS_BH_UserArgs_MT64x128x64_MI16x16x1_SN_LDSB1_CLR1_GSU0_GSUC0_GSUWGMRR0_K1_LBSPPA1024_LBSPPB128_LPA32_MIWT2_4_PLR1_SU32_SUM0_SUS256_SKXCCM4_VWA2_VWB1_WGM2_WGMXCC1_WGMXCCGn1
    SolutionIndex: 77
    SolutionNameMin: Cijk_Ailk_Bljk_HSS_BH_UserArgs_MT128x64x64_MI16x16x1_SN_LDSB1_CLR1_GSU0_GSUC0_GSUWGMRR0_K1_LBSPPA2048_LBSPPB128_LPA0_MIWT4_2_PLR1_SU32_SUM0_SUS256_SKXCCM4_VWA4_VWB1_WGM1_WGMXCC1_WGMXCCGn1
    SolutionIndex: 78
    SolutionNameMin: Cijk_Ailk_Bljk_HSS_BH_UserArgs_MT128x64x64_MI16x16x1_SN_LDSB1_CLR1_GSU0_GSUC0_GSUWGMRR0_K1_LBSPPA2048_LBSPPB256_LPA0_MIWT4_2_PLR1_SU32_SUM0_SUS256_SKXCCM4_VWA4_VWB2_WGM1_WGMXCC1_WGMXCCGn1
    SolutionIndex: 79
    SolutionNameMin: Cijk_Ailk_Bljk_HSS_BH_UserArgs_MT128x64x64_MI16x16x1_SN_LDSB1_CLR1_GSU0_GSUC0_GSUWGMRR0_K1_LBSPPA2048_LBSPPB128_LPA0_MIWT4_2_PLR1_SU32_SUM0_SUS256_SKXCCM4_VWA4_VWB1_WGM2_WGMXCC1_WGMXCCGn1
    SolutionIndex: 80
    SolutionNameMin: Cijk_Ailk_Bljk_HSS_BH_UserArgs_MT128x64x64_MI16x16x1_SN_LDSB1_CLR1_GSU0_GSUC0_GSUWGMRR0_K1_LBSPPA2048_LBSPPB256_LPA0_MIWT4_2_PLR1_SU32_SUM0_SUS256_SKXCCM4_VWA4_VWB2_WGM2_WGMXCC1_WGMXCCGn1
    SolutionIndex: 81
    SolutionNameMin: Cijk_Ailk_Bljk_HSS_BH_UserArgs_MT128x64x64_MI16x16x1_SN_LDSB1_CLR1_GSU0_GSUC0_GSUWGMRR0_K1_LBSPPA2048_LBSPPB128_LPA0_MIWT4_2_PLR1_SU32_SUM0_SUS256_SKXCCM4_VWA4_VWB1_WGM4_WGMXCC1_WGMXCCGn1
    SolutionIndex: 82
    SolutionNameMin: Cijk_Ailk_Bljk_HSS_BH_UserArgs_MT128x64x64_MI16x16x1_SN_LDSB1_CLR1_GSU0_GSUC0_GSUWGMRR0_K1_LBSPPA2048_LBSPPB256_LPA0_MIWT4_2_PLR1_SU32_SUM0_SUS256_SKXCCM4_VWA4_VWB2_WGM4_WGMXCC1_WGMXCCGn1
    SolutionIndex: 83
    SolutionNameMin: Cijk_Ailk_Bljk_HSS_BH_UserArgs_MT64x64x64_MI16x16x1_SN_LDSB1_CLR1_GSU0_GSUC0_GSUWGMRR0_K1_LBSPPA1024_LBSPPB128_LPA32_MIWT2_2_PLR1_SU32_SUM0_SUS256_SKXCCM4_VWA2_VWB1_WGM1_WGMXCC1_WGMXCCGn1
    SolutionIndex: 84
    SolutionNameMin: Cijk_Ailk_Bljk_HSS_BH_UserArgs_MT64x64x64_MI16x16x1_SN_LDSB1_CLR1_GSU0_GSUC0_GSUWGMRR0_K1_LBSPPA1024_LBSPPB256_LPA32_MIWT2_2_PLR1_SU32_SUM0_SUS256_SKXCCM4_VWA2_VWB2_WGM1_WGMXCC1_WGMXCCGn1
    SolutionIndex: 85
    SolutionNameMin: Cijk_Ailk_Bljk_HSS_BH_UserArgs_MT64x64x64_MI16x16x1_SN_LDSB1_CLR1_GSU0_GSUC0_GSUWGMRR0_K1_LBSPPA1024_LBSPPB256_LPA32_MIWT2_2_PLR1_SU32_SUM0_SUS256_SKXCCM4_VWA2_VWB2_WGM2_WGMXCC1_WGMXCCGn1
    SolutionIndex: 86
    SolutionNameMin: Cijk_Ailk_Bljk_HSS_BH_UserArgs_MT64x64x64_MI16x16x1_SN_LDSB1_CLR1_GSU0_GSUC0_GSUWGMRR0_K1_LBSPPA1024_LBSPPB256_LPA32_MIWT2_2_PLR1_SU32_SUM0_SUS256_SKXCCM4_VWA2_VWB2_WGM4_WGMXCC1_WGMXCCGn1
    SolutionIndex: 87
    SolutionNameMin: Cijk_Ailk_Bljk_HSS_BH_UserArgs_MT64x32x64_MI16x16x1_SN_LDSB0_CLR1_GSU0_GSUC0_GSUWGMRR0_K1_LBSPPA1024_LBSPPB128_LPA32_MIWT2_1_PLR1_SU32_SUM0_SUS256_SKXCCM4_VWA2_VWB1_WGM1_WGMXCC1_WGMXCCGn1
    SolutionIndex: 88
    SolutionNameMin: Cijk_Ailk_Bljk_HSS_BH_UserArgs_MT64x32x64_MI16x16x1_SN_LDSB0_CLR1_GSU0_GSUC0_GSUWGMRR0_K1_LBSPPA1024_LBSPPB128_LPA32_MIWT2_1_PLR2_SU32_SUM0_SUS256_SKXCCM4_VWA2_VWB1_WGM1_WGMXCC1_WGMXCCGn1
    SolutionIndex: 89
    SolutionNameMin: Cijk_Ailk_Bljk_HSS_BH_UserArgs_MT64x32x64_MI16x16x1_SN_LDSB0_CLR1_GSU0_GSUC0_GSUWGMRR0_K1_LBSPPA1024_LBSPPB128_LPA32_MIWT2_1_PLR1_SU32_SUM0_SUS256_SKXCCM4_VWA2_VWB1_WGM4_WGMXCC1_WGMXCCGn1
    SolutionIndex: 90
    SolutionNameMin: Cijk_Ailk_Bljk_HSS_BH_UserArgs_MT32x32x64_MI16x16x1_SN_LDSB0_CLR1_GSU0_GSUC0_GSUWGMRR0_K1_LBSPPA512_LBSPPB128_LPA16_MIWT1_1_PLR1_SU32_SUM0_SUS256_SKXCCM4_VWA1_VWB1_WGM1_WGMXCC1_WGMXCCGn1
    SolutionIndex: 91
    SolutionNameMin: Cijk_Ailk_Bljk_HSS_BH_UserArgs_MT128x64x128_MI16x16x1_SN_LDSB1_CLR1_GSU0_GSUC0_GSUWGMRR0_K1_LBSPPA2048_LBSPPB512_LPA0_MIWT4_2_PLR2_SU32_SUM0_SUS256_SKXCCM4_VWA4_VWB2_WGM1_WGMXCC1_WGMXCCGn1
    SolutionIndex: 92
    SolutionNameMin: Cijk_Ailk_Bljk_HSS_BH_UserArgs_MT128x64x128_MI16x16x1_SN_LDSB1_CLR1_GSU0_GSUC0_GSUWGMRR0_K1_LBSPPA2048_LBSPPB512_LPA0_MIWT4_2_PLR2_SU32_SUM0_SUS256_SKXCCM4_VWA4_VWB2_WGM2_WGMXCC1_WGMXCCGn1
    SolutionIndex: 93
    SolutionNameMin: Cijk_Ailk_Bljk_HSS_BH_UserArgs_MT128x64x128_MI16x16x1_SN_LDSB1_CLR1_GSU0_GSUC0_GSUWGMRR0_K1_LBSPPA2048_LBSPPB256_LPA0_MIWT4_2_PLR1_SU32_SUM0_SUS256_SKXCCM4_VWA4_VWB1_WGM4_WGMXCC1_WGMXCCGn1
    SolutionIndex: 94
    SolutionNameMin: Cijk_Ailk_Bljk_HSS_BH_UserArgs_MT128x64x128_MI16x16x1_SN_LDSB1_CLR1_GSU0_GSUC0_GSUWGMRR0_K1_LBSPPA2048_LBSPPB512_LPA0_MIWT4_2_PLR2_SU32_SUM0_SUS256_SKXCCM4_VWA4_VWB2_WGM4_WGMXCC1_WGMXCCGn1
    SolutionIndex: 95
    SolutionNameMin: Cijk_Ailk_Bljk_HSS_BH_UserArgs_MT64x64x128_MI16x16x1_SN_LDSB1_CLR1_GSU0_GSUC0_GSUWGMRR0_K1_LBSPPA1024_LBSPPB512_LPA32_MIWT2_2_PLR2_SU32_SUM0_SUS256_SKXCCM4_VWA2_VWB2_WGM1_WGMXCC1_WGMXCCGn1
    SolutionIndex: 96
    SolutionNameMin: Cijk_Ailk_Bljk_HSS_BH_UserArgs_MT64x64x128_MI16x16x1_SN_LDSB1_CLR1_GSU0_GSUC0_GSUWGMRR0_K1_LBSPPA1024_LBSPPB512_LPA32_MIWT2_2_PLR2_SU32_SUM0_SUS256_SKXCCM4_VWA2_VWB2_WGM2_WGMXCC1_WGMXCCGn1
    SolutionIndex: 97
    SolutionNameMin: Cijk_Ailk_Bljk_HSS_BH_UserArgs_MT64x32x128_MI16x16x1_SN_LDSB1_CLR1_GSU0_GSUC0_GSUWGMRR0_K1_LBSPPA1024_LBSPPB256_LPA32_MIWT2_1_PLR2_SU32_SUM0_SUS256_SKXCCM4_VWA2_VWB1_WGM1_WGMXCC1_WGMXCCGn1
    SolutionIndex: 98
    SolutionNameMin: Cijk_Ailk_Bljk_HSS_BH_UserArgs_MT64x32x128_MI16x16x1_SN_LDSB1_CLR1_GSU0_GSUC0_GSUWGMRR0_K1_LBSPPA1024_LBSPPB256_LPA32_MIWT2_1_PLR2_SU32_SUM0_SUS256_SKXCCM4_VWA2_VWB1_WGM2_WGMXCC1_WGMXCCGn1
    SolutionIndex: 99
    SolutionNameMin: Cijk_Ailk_Bljk_HSS_BH_UserArgs_MT64x32x128_MI16x16x1_SN_LDSB1_CLR1_GSU0_GSUC0_GSUWGMRR0_K1_LBSPPA1024_LBSPPB256_LPA32_MIWT2_1_PLR2_SU32_SUM0_SUS256_SKXCCM4_VWA2_VWB1_WGM4_WGMXCC1_WGMXCCGn1
    SolutionIndex: 100
    SolutionNameMin: Cijk_Ailk_Bljk_HSS_BH_UserArgs_MT32x32x128_MI16x16x1_SN_LDSB1_CLR1_GSU0_GSUC0_GSUWGMRR0_K1_LBSPPA512_LBSPPB256_LPA16_MIWT1_1_PLR1_SU32_SUM0_SUS256_SKXCCM4_VWA1_VWB1_WGM1_WGMXCC1_WGMXCCGn1
    SolutionIndex: 101
    SolutionNameMin: Cijk_Ailk_Bljk_HSS_BH_UserArgs_MT32x32x128_MI16x16x1_SN_LDSB1_CLR1_GSU0_GSUC0_GSUWGMRR0_K1_LBSPPA512_LBSPPB256_LPA16_MIWT1_1_PLR2_SU32_SUM0_SUS256_SKXCCM4_VWA1_VWB1_WGM1_WGMXCC1_WGMXCCGn1
    SolutionIndex: 102
    SolutionNameMin: Cijk_Ailk_Bljk_HSS_BH_UserArgs_MT32x32x32_MI16x16x1_SN_LDSB0_CLR0_GSU0_GSUC0_GSUWGMRR0_K1_LBSPPA256_LBSPPB128_LPA16_MIWT1_1_PLR0_SU32_SUM0_SUS256_SKXCCM0_VWA1_VWB1_WGM1_WGMXCC1_WGMXCCGn1
- - - [128, 128, 1, 128, 128, 128, 128, 128]
    - [101, 0.088]
  - - [128, 128, 1, 256, 128, 128, 128, 256]
    - [37, 0.111]
  - - [128, 128, 1, 512, 128, 128, 128, 512]
    - [38, 0.187]
  - - [128, 128, 1, 1024, 128, 128, 128, 1024]
    - [90, 0.287]
  - - [128, 128, 1, 2048, 128, 128, 128, 2048]
    - [90, 0.539]
  - - [128, 128, 1, 4096, 128, 128, 128, 4096]
    - [101, 0.91]
  - - [128, 128, 1, 8192, 128, 128, 128, 8192]
    - [38, 1.492]
  - - [128, 256, 1, 128, 128, 128, 128, 128]
    - [37, 0.171]
  - - [128, 256, 1, 256, 128, 128, 128, 256]
    - [38, 0.221]
  - - [128, 256, 1, 512, 128, 128, 128, 512]
    - [37, 0.363]
  - - [128, 256, 1, 1024, 128, 128, 128, 1024]
    - [100, 0.606]
  - - [128, 256, 1, 2048, 128, 128, 128, 2048]
    - [17, 1.04]
  - - [128, 256, 1, 4096, 128, 128, 128, 4096]
    - [97, 1.636]
  - - [128, 256, 1, 8192, 128, 128, 128, 8192]
    - [97, 2.606]
  - - [128, 512, 1, 128, 128, 128, 128, 128]
    - [38, 0.339]
  - - [128, 512, 1, 256, 128, 128, 128, 256]
    - [37, 0.428]
  - - [128, 512, 1, 512, 128, 128, 128, 512]
    - [17, 0.701]
  - - [128, 512, 1, 1024, 128, 128, 128, 1024]
    - [37, 1.256]
  - - [128, 512, 1, 2048, 128, 128, 128, 2048]
    - [101, 1.893]
  - - [128, 512, 1, 4096, 128, 128, 128, 4096]
    - [87, 2.91]
  - - [128, 512, 1, 8192, 128, 128, 128, 8192]
    - [95, 4.274]
  - - [128, 1024, 1, 128, 128, 128, 128, 128]
    - [97, 0.63]
  - - [128, 1024, 1, 256, 128, 128, 128, 256]
    - [101, 1.044]
  - - [128, 1024, 1, 512, 128, 128, 128, 512]
    - [100, 1.621]
  - - [128, 1024, 1, 1024, 128, 128, 128, 1024]
    - [101, 2.307]
  - - [128, 1024, 1, 2048, 128, 128, 128, 2048]
    - [97, 3.255]
  - - [128, 1024, 1, 4096, 128, 128, 128, 4096]
    - [84, 4.724]
  - - [128, 1024, 1, 8192, 128, 128, 128, 8192]
    - [91, 6.88]
  - - [128, 2048, 1, 128, 128, 128, 128, 128]
    - [97, 1.12]
  - - [128, 2048, 1, 256, 128, 128, 128, 256]
    - [87, 1.859]
  - - [128, 2048, 1, 512, 128, 128, 128, 512]
    - [35, 2.83]
  - - [128, 2048, 1, 1024, 128, 128, 128, 1024]
    - [97, 3.905]
  - - [128, 2048, 1, 2048, 128, 128, 128, 2048]
    - [68, 4.588]
  - - [128, 2048, 1, 4096, 128, 128, 128, 4096]
    - [77, 7.066]
  - - [128, 2048, 1, 8192, 128, 128, 128, 8192]
    - [72, 10.026]
  - - [128, 4096, 1, 128, 128, 128, 128, 128]
    - [83, 1.882]
  - - [128, 4096, 1, 256, 128, 128, 128, 256]
    - [84, 3.161]
  - - [128, 4096, 1, 512, 128, 128, 128, 512]
    - [84, 4.645]
  - - [128, 4096, 1, 1024, 128, 128, 128, 1024]
    - [78, 5.489]
  - - [128, 4096, 1, 2048, 128, 128, 128, 2048]
    - [83, 6.108]
  - - [128, 4096, 1, 4096, 128, 128, 128, 4096]
    - [12, 8.154]
  - - [128, 4096, 1, 8192, 128, 128, 128, 8192]
    - [19, 11.436]
  - - [128, 8192, 1, 128, 128, 128, 128, 128]
    - [66, 2.889]
  - - [128, 8192, 1, 256, 128, 128, 128, 256]
    - [75, 4.676]
  - - [128, 8192, 1, 512, 128, 128, 128, 512]
    - [77, 6.648]
  - - [128, 8192, 1, 1024, 128, 128, 128, 1024]
    - [91, 7.252]
  - - [128, 8192, 1, 2048, 128, 128, 128, 2048]
    - [77, 8.49]
  - - [128, 8192, 1, 4096, 128, 128, 128, 4096]
    - [29, 10.432]
  - - [128, 8192, 1, 8192, 128, 128, 128, 8192]
    - [32, 11.604]
  - - [256, 128, 1, 128, 256, 256, 256, 128]
    - [37, 0.169]
  - - [256, 128, 1, 256, 256, 256, 256, 256]
    - [37, 0.224]
  - - [256, 128, 1, 512, 256, 256, 256, 512]
    - [38, 0.36]
  - - [256, 128, 1, 1024, 256, 256, 256, 1024]
    - [37, 0.593]
  - - [256, 128, 1, 2048, 256, 256, 256, 2048]
    - [70, 1.038]
  - - [256, 128, 1, 4096, 256, 256, 256, 4096]
    - [97, 1.648]
  - - [256, 128, 1, 8192, 256, 256, 256, 8192]
    - [36, 2.509]
  - - [256, 256, 1, 128, 256, 256, 256, 128]
    - [100, 0.336]
  - - [256, 256, 1, 256, 256, 256, 256, 256]
    - [100, 0.431]
  - - [256, 256, 1, 512, 256, 256, 256, 512]
    - [17, 0.708]
  - - [256, 256, 1, 1024, 256, 256, 256, 1024]
    - [37, 1.266]
  - - [256, 256, 1, 2048, 256, 256, 256, 2048]
    - [38, 1.876]
  - - [256, 256, 1, 4096, 256, 256, 256, 4096]
    - [87, 2.902]
  - - [256, 256, 1, 8192, 256, 256, 256, 8192]
    - [99, 4.008]
  - - [256, 512, 1, 128, 256, 256, 256, 128]
    - [97, 0.619]
  - - [256, 512, 1, 256, 256, 256, 256, 256]
    - [101, 1.046]
  - - [256, 512, 1, 512, 256, 256, 256, 512]
    - [100, 1.623]
  - - [256, 512, 1, 1024, 256, 256, 256, 1024]
    - [38, 2.312]
  - - [256, 512, 1, 2048, 256, 256, 256, 2048]
    - [97, 3.246]
  - - [256, 512, 1, 4096, 256, 256, 256, 4096]
    - [83, 4.705]
  - - [256, 512, 1, 8192, 256, 256, 256, 8192]
    - [30, 6.699]
  - - [256, 1024, 1, 128, 256, 256, 256, 128]
    - [97, 1.118]
  - - [256, 1024, 1, 256, 256, 256, 256, 256]
    - [88, 1.854]
  - - [256, 1024, 1, 512, 256, 256, 256, 512]
    - [87, 2.831]
  - - [256, 1024, 1, 1024, 256, 256, 256, 1024]
    - [97, 3.886]
  - - [256, 1024, 1, 2048, 256, 256, 256, 2048]
    - [68, 4.572]
  - - [256, 1024, 1, 4096, 256, 256, 256, 4096]
    - [78, 7.106]
  - - [256, 1024, 1, 8192, 256, 256, 256, 8192]
    - [72, 9.954]
  - - [256, 2048, 1, 128, 256, 256, 256, 128]
    - [83, 1.913]
  - - [256, 2048, 1, 256, 256, 256, 256, 256]
    - [84, 3.18]
  - - [256, 2048, 1, 512, 256, 256, 256, 512]
    - [84, 4.653]
  - - [256, 2048, 1, 1024, 256, 256, 256, 1024]
    - [78, 5.566]
  - - [256, 2048, 1, 2048, 256, 256, 256, 2048]
    - [84, 6.333]
  - - [256, 2048, 1, 4096, 256, 256, 256, 4096]
    - [20, 8.208]
  - - [256, 2048, 1, 8192, 256, 256, 256, 8192]
    - [22, 11.646]
  - - [256, 4096, 1, 128, 256, 256, 256, 128]
    - [67, 2.925]
  - - [256, 4096, 1, 256, 256, 256, 256, 256]
    - [75, 4.705]
  - - [256, 4096, 1, 512, 256, 256, 256, 512]
    - [78, 6.736]
  - - [256, 4096, 1, 1024, 256, 256, 256, 1024]
    - [91, 7.287]
  - - [256, 4096, 1, 2048, 256, 256, 256, 2048]
    - [77, 8.654]
  - - [256, 4096, 1, 4096, 256, 256, 256, 4096]
    - [5, 11.289]
  - - [256, 4096, 1, 8192, 256, 256, 256, 8192]
    - [24, 11.722]
  - - [256, 8192, 1, 128, 256, 256, 256, 128]
    - [58, 4.037]
  - - [256, 8192, 1, 256, 256, 256, 256, 256]
    - [59, 5.832]
  - - [256, 8192, 1, 512, 256, 256, 256, 512]
    - [72, 7.451]
  - - [256, 8192, 1, 1024, 256, 256, 256, 1024]
    - [77, 9.281]
  - - [256, 8192, 1, 2048, 256, 256, 256, 2048]
    - [78, 10.571]
  - - [256, 8192, 1, 4096, 256, 256, 256, 4096]
    - [10, 11.618]
  - - [256, 8192, 1, 8192, 256, 256, 256, 8192]
    - [50, 14.299]
  - - [512, 128, 1, 128, 512, 512, 512, 128]
    - [37, 0.338]
  - - [512, 128, 1, 256, 512, 512, 512, 256]
    - [100, 0.43]
  - - [512, 128, 1, 512, 512, 512, 512, 512]
    - [17, 0.705]
  - - [512, 128, 1, 1024, 512, 512, 512, 1024]
    - [37, 1.265]
  - - [512, 128, 1, 2048, 512, 512, 512, 2048]
    - [101, 1.881]
  - - [512, 128, 1, 4096, 512, 512, 512, 4096]
    - [89, 2.804]
  - - [512, 128, 1, 8192, 512, 512, 512, 8192]
    - [96, 3.972]
  - - [512, 256, 1, 128, 512, 512, 512, 128]
    - [36, 0.618]
  - - [512, 256, 1, 256, 512, 512, 512, 256]
    - [37, 1.035]
  - - [512, 256, 1, 512, 512, 512, 512, 512]
    - [101, 1.625]
  - - [512, 256, 1, 1024, 512, 512, 512, 1024]
    - [38, 2.319]
  - - [512, 256, 1, 2048, 512, 512, 512, 2048]
    - [36, 3.198]
  - - [512, 256, 1, 4096, 512, 512, 512, 4096]
    - [86, 4.627]
  - - [512, 256, 1, 8192, 512, 512, 512, 8192]
    - [30, 6.714]
  - - [512, 512, 1, 128, 512, 512, 512, 128]
    - [97, 1.117]
  - - [512, 512, 1, 256, 512, 512, 512, 256]
    - [87, 1.842]
  - - [512, 512, 1, 512, 512, 512, 512, 512]
    - [87, 2.821]
  - - [512, 512, 1, 1024, 512, 512, 512, 1024]
    - [36, 3.903]
  - - [512, 512, 1, 2048, 512, 512, 512, 2048]
    - [69, 4.753]
  - - [512, 512, 1, 4096, 512, 512, 512, 4096]
    - [29, 7.041]
  - - [512, 512, 1, 8192, 512, 512, 512, 8192]
    - [73, 9.944]
  - - [512, 1024, 1, 128, 512, 512, 512, 128]
    - [83, 1.899]
  - - [512, 1024, 1, 256, 512, 512, 512, 256]
    - [83, 3.155]
  - - [512, 1024, 1, 512, 512, 512, 512, 512]
    - [84, 4.588]
  - - [512, 1024, 1, 1024, 512, 512, 512, 1024]
    - [77, 5.564]
  - - [512, 1024, 1, 2048, 512, 512, 512, 2048]
    - [84, 6.341]
  - - [512, 1024, 1, 4096, 512, 512, 512, 4096]
    - [22, 8.138]
  - - [512, 1024, 1, 8192, 512, 512, 512, 8192]
    - [71, 11.685]
  - - [512, 2048, 1, 128, 512, 512, 512, 128]
    - [78, 2.936]
  - - [512, 2048, 1, 256, 512, 512, 512, 256]
    - [75, 4.697]
  - - [512, 2048, 1, 512, 512, 512, 512, 512]
    - [78, 6.794]
  - - [512, 2048, 1, 1024, 512, 512, 512, 1024]
    - [91, 7.526]
  - - [512, 2048, 1, 2048, 512, 512, 512, 2048]
    - [78, 8.748]
  - - [512, 2048, 1, 4096, 512, 512, 512, 4096]
    - [10, 11.092]
  - - [512, 2048, 1, 8192, 512, 512, 512, 8192]
    - [22, 11.695]
  - - [512, 4096, 1, 128, 512, 512, 512, 128]
    - [58, 4.052]
  - - [512, 4096, 1, 256, 512, 512, 512, 256]
    - [61, 5.943]
  - - [512, 4096, 1, 512, 512, 512, 512, 512]
    - [27, 7.541]
  - - [512, 4096, 1, 1024, 512, 512, 512, 1024]
    - [78, 9.359]
  - - [512, 4096, 1, 2048, 512, 512, 512, 2048]
    - [32, 10.61]
  - - [512, 4096, 1, 4096, 512, 512, 512, 4096]
    - [8, 11.441]
  - - [512, 4096, 1, 8192, 512, 512, 512, 8192]
    - [49, 14.043]
  - - [512, 8192, 1, 128, 512, 512, 512, 128]
    - [48, 5.155]
  - - [512, 8192, 1, 256, 512, 512, 512, 256]
    - [48, 7.598]
  - - [512, 8192, 1, 512, 512, 512, 512, 512]
    - [60, 9.323]
  - - [512, 8192, 1, 1024, 512, 512, 512, 1024]
    - [60, 11.268]
  - - [512, 8192, 1, 2048, 512, 512, 512, 2048]
    - [28, 12.418]
  - - [512, 8192, 1, 4096, 512, 512, 512, 4096]
    - [6, 14.176]
  - - [512, 8192, 1, 8192, 512, 512, 512, 8192]
    - [8, 16.03]
  - - [1024, 128, 1, 128, 1024, 1024, 1024, 128]
    - [97, 0.622]
  - - [1024, 128, 1, 256, 1024, 1024, 1024, 256]
    - [100, 1.039]
  - - [1024, 128, 1, 512, 1024, 1024, 1024, 512]
    - [38, 1.623]
  - - [1024, 128, 1, 1024, 1024, 1024, 1024, 1024]
    - [38, 2.295]
  - - [1024, 128, 1, 2048, 1024, 1024, 1024, 2048]
    - [36, 3.174]
  - - [1024, 128, 1, 4096, 1024, 1024, 1024, 4096]
    - [85, 4.586]
  - - [1024, 128, 1, 8192, 1024, 1024, 1024, 8192]
    - [31, 6.686]
  - - [1024, 256, 1, 128, 1024, 1024, 1024, 128]
    - [97, 1.103]
  - - [1024, 256, 1, 256, 1024, 1024, 1024, 256]
    - [35, 1.844]
  - - [1024, 256, 1, 512, 1024, 1024, 1024, 512]
    - [87, 2.834]
  - - [1024, 256, 1, 1024, 1024, 1024, 1024, 1024]
    - [97, 3.873]
  - - [1024, 256, 1, 2048, 1024, 1024, 1024, 2048]
    - [69, 4.829]
  - - [1024, 256, 1, 4096, 1024, 1024, 1024, 4096]
    - [82, 7.022]
  - - [1024, 256, 1, 8192, 1024, 1024, 1024, 8192]
    - [72, 9.885]
  - - [1024, 512, 1, 128, 1024, 1024, 1024, 128]
    - [84, 1.901]
  - - [1024, 512, 1, 256, 1024, 1024, 1024, 256]
    - [83, 3.161]
  - - [1024, 512, 1, 512, 1024, 1024, 1024, 512]
    - [84, 4.585]
  - - [1024, 512, 1, 1024, 1024, 1024, 1024, 1024]
    - [78, 5.514]
  - - [1024, 512, 1, 2048, 1024, 1024, 1024, 2048]
    - [12, 6.122]
  - - [1024, 512, 1, 4096, 1024, 1024, 1024, 4096]
    - [21, 8.15]
  - - [1024, 512, 1, 8192, 1024, 1024, 1024, 8192]
    - [22, 11.698]
  - - [1024, 1024, 1, 128, 1024, 1024, 1024, 128]
    - [77, 2.93]
  - - [1024, 1024, 1, 256, 1024, 1024, 1024, 256]
    - [68, 4.677]
  - - [1024, 1024, 1, 512, 1024, 1024, 1024, 512]
    - [80, 6.752]
  - - [1024, 1024, 1, 1024, 1024, 1024, 1024, 1024]
    - [91, 7.357]
  - - [1024, 1024, 1, 2048, 1024, 1024, 1024, 2048]
    - [78, 8.542]
  - - [1024, 1024, 1, 4096, 1024, 1024, 1024, 4096]
    - [11, 11.16]
  - - [1024, 1024, 1, 8192, 1024, 1024, 1024, 8192]
    - [23, 11.613]
  - - [1024, 2048, 1, 128, 1024, 1024, 1024, 128]
    - [14, 3.966]
  - - [1024, 2048, 1, 256, 1024, 1024, 1024, 256]
    - [59, 5.922]
  - - [1024, 2048, 1, 512, 1024, 1024, 1024, 512]
    - [27, 7.587]
  - - [1024, 2048, 1, 1024, 1024, 1024, 1024, 1024]
    - [78, 9.452]
  - - [1024, 2048, 1, 2048, 1024, 1024, 1024, 2048]
    - [77, 10.498]
  - - [1024, 2048, 1, 4096, 1024, 1024, 1024, 4096]
    - [5, 11.409]
  - - [1024, 2048, 1, 8192, 1024, 1024, 1024, 8192]
    - [53, 13.947]
  - - [1024, 4096, 1, 128, 1024, 1024, 1024, 128]
    - [5, 5.157]
  - - [1024, 4096, 1, 256, 1024, 1024, 1024, 256]
    - [10, 7.608]
  - - [1024, 4096, 1, 512, 1024, 1024, 1024, 512]
    - [62, 9.505]
  - - [1024, 4096, 1, 1024, 1024, 1024, 1024, 1024]
    - [60, 11.308]
  - - [1024, 4096, 1, 2048, 1024, 1024, 1024, 2048]
    - [72, 12.495]
  - - [1024, 4096, 1, 4096, 1024, 1024, 1024, 4096]
    - [4, 14.093]
  - - [1024, 4096, 1, 8192, 1024, 1024, 1024, 8192]
    - [9, 15.824]
  - - [1024, 8192, 1, 128, 1024, 1024, 1024, 128]
    - [56, 5.407]
  - - [1024, 8192, 1, 256, 1024, 1024, 1024, 256]
    - [47, 7.989]
  - - [1024, 8192, 1, 512, 1024, 1024, 1024, 512]
    - [50, 11.201]
  - - [1024, 8192, 1, 1024, 1024, 1024, 1024, 1024]
    - [49, 13.667]
  - - [1024, 8192, 1, 2048, 1024, 1024, 1024, 2048]
    - [6, 14.02]
  - - [1024, 8192, 1, 4096, 1024, 1024, 1024, 4096]
    - [49, 15.739]
  - - [1024, 8192, 1, 8192, 1024, 1024, 1024, 8192]
    - [56, 17.345]
  - - [2048, 128, 1, 128, 2048, 2048, 2048, 128]
    - [97, 1.12]
  - - [2048, 128, 1, 256, 2048, 2048, 2048, 256]
    - [87, 1.846]
  - - [2048, 128, 1, 512, 2048, 2048, 2048, 512]
    - [87, 2.814]
  - - [2048, 128, 1, 1024, 2048, 2048, 2048, 1024]
    - [98, 3.866]
  - - [2048, 128, 1, 2048, 2048, 2048, 2048, 2048]
    - [69, 4.734]
  - - [2048, 128, 1, 4096, 2048, 2048, 2048, 4096]
    - [29, 7.043]
  - - [2048, 128, 1, 8192, 2048, 2048, 2048, 8192]
    - [27, 9.857]
  - - [2048, 256, 1, 128, 2048, 2048, 2048, 128]
    - [83, 1.903]
  - - [2048, 256, 1, 256, 2048, 2048, 2048, 256]
    - [84, 3.166]
  - - [2048, 256, 1, 512, 2048, 2048, 2048, 512]
    - [84, 4.567]
  - - [2048, 256, 1, 1024, 2048, 2048, 2048, 1024]
    - [80, 5.469]
  - - [2048, 256, 1, 2048, 2048, 2048, 2048, 2048]
    - [12, 6.162]
  - - [2048, 256, 1, 4096, 2048, 2048, 2048, 4096]
    - [20, 8.107]
  - - [2048, 256, 1, 8192, 2048, 2048, 2048, 8192]
    - [21, 11.642]
  - - [2048, 512, 1, 128, 2048, 2048, 2048, 128]
    - [67, 2.939]
  - - [2048, 512, 1, 256, 2048, 2048, 2048, 256]
    - [77, 4.643]
  - - [2048, 512, 1, 512, 2048, 2048, 2048, 512]
    - [82, 6.623]
  - - [2048, 512, 1, 1024, 2048, 2048, 2048, 1024]
    - [94, 7.228]
  - - [2048, 512, 1, 2048, 2048, 2048, 2048, 2048]
    - [81, 8.521]
  - - [2048, 512, 1, 4096, 2048, 2048, 2048, 4096]
    - [7, 11.015]
  - - [2048, 512, 1, 8192, 2048, 2048, 2048, 8192]
    - [18, 11.583]
  - - [2048, 1024, 1, 128, 2048, 2048, 2048, 128]
    - [58, 3.991]
  - - [2048, 1024, 1, 256, 2048, 2048, 2048, 256]
    - [15, 5.903]
  - - [2048, 1024, 1, 512, 2048, 2048, 2048, 512]
    - [26, 7.592]
  - - [2048, 1024, 1, 1024, 2048, 2048, 2048, 1024]
    - [29, 9.338]
  - - [2048, 1024, 1, 2048, 2048, 2048, 2048, 2048]
    - [29, 10.423]
  - - [2048, 1024, 1, 4096, 2048, 2048, 2048, 4096]
    - [4, 11.41]
  - - [2048, 1024, 1, 8192, 2048, 2048, 2048, 8192]
    - [50, 13.998]
  - - [2048, 2048, 1, 128, 2048, 2048, 2048, 128]
    - [5, 5.236]
  - - [2048, 2048, 1, 256, 2048, 2048, 2048, 256]
    - [56, 7.686]
  - - [2048, 2048, 1, 512, 2048, 2048, 2048, 512]
    - [12, 9.508]
  - - [2048, 2048, 1, 1024, 2048, 2048, 2048, 1024]
    - [12, 11.214]
  - - [2048, 2048, 1, 2048, 2048, 2048, 2048, 2048]
    - [27, 12.399]
  - - [2048, 2048, 1, 4096, 2048, 2048, 2048, 4096]
    - [49, 14.06]
  - - [2048, 2048, 1, 8192, 2048, 2048, 2048, 8192]
    - [3, 15.77]
  - - [2048, 4096, 1, 128, 2048, 2048, 2048, 128]
    - [53, 5.518]
  - - [2048, 4096, 1, 256, 2048, 2048, 2048, 256]
    - [50, 8.087]
  - - [2048, 4096, 1, 512, 2048, 2048, 2048, 512]
    - [50, 11.203]
  - - [2048, 4096, 1, 1024, 2048, 2048, 2048, 1024]
    - [52, 13.596]
  - - [2048, 4096, 1, 2048, 2048, 2048, 2048, 2048]
    - [51, 14.109]
  - - [2048, 4096, 1, 4096, 2048, 2048, 2048, 4096]
    - [10, 15.797]
  - - [2048, 4096, 1, 8192, 2048, 2048, 2048, 8192]
    - [51, 17.289]
  - - [2048, 8192, 1, 128, 2048, 2048, 2048, 128]
    - [57, 5.593]
  - - [2048, 8192, 1, 256, 2048, 2048, 2048, 256]
    - [46, 7.798]
  - - [2048, 8192, 1, 512, 2048, 2048, 2048, 512]
    - [43, 10.912]
  - - [2048, 8192, 1, 1024, 2048, 2048, 2048, 1024]
    - [41, 13.572]
  - - [2048, 8192, 1, 2048, 2048, 2048, 2048, 2048]
    - [49, 15.336]
  - - [2048, 8192, 1, 4096, 2048, 2048, 2048, 4096]
    - [55, 17.011]
  - - [2048, 8192, 1, 8192, 2048, 2048, 2048, 8192]
    - [44, 18.191]
  - - [4096, 128, 1, 128, 4096, 4096, 4096, 128]
    - [34, 1.846]
  - - [4096, 128, 1, 256, 4096, 4096, 4096, 256]
    - [33, 3.082]
  - - [4096, 128, 1, 512, 4096, 4096, 4096, 512]
    - [84, 4.447]
  - - [4096, 128, 1, 1024, 4096, 4096, 4096, 1024]
    - [78, 5.492]
  - - [4096, 128, 1, 2048, 4096, 4096, 4096, 2048]
    - [82, 6.055]
  - - [4096, 128, 1, 4096, 4096, 4096, 4096, 4096]
    - [14, 8.216]
  - - [4096, 128, 1, 8192, 4096, 4096, 4096, 8192]
    - [22, 11.581]
  - - [4096, 256, 1, 128, 4096, 4096, 4096, 128]
    - [67, 2.907]
  - - [4096, 256, 1, 256, 4096, 4096, 4096, 256]
    - [76, 4.602]
  - - [4096, 256, 1, 512, 4096, 4096, 4096, 512]
    - [82, 6.703]
  - - [4096, 256, 1, 1024, 4096, 4096, 4096, 1024]
    - [93, 7.263]
  - - [4096, 256, 1, 2048, 4096, 4096, 4096, 2048]
    - [81, 8.624]
  - - [4096, 256, 1, 4096, 4096, 4096, 4096, 4096]
    - [7, 11.075]
  - - [4096, 256, 1, 8192, 4096, 4096, 4096, 8192]
    - [24, 11.663]
  - - [4096, 512, 1, 128, 4096, 4096, 4096, 128]
    - [16, 3.918]
  - - [4096, 512, 1, 256, 4096, 4096, 4096, 256]
    - [16, 5.858]
  - - [4096, 512, 1, 512, 4096, 4096, 4096, 512]
    - [25, 7.451]
  - - [4096, 512, 1, 1024, 4096, 4096, 4096, 1024]
    - [29, 9.207]
  - - [4096, 512, 1, 2048, 4096, 4096, 4096, 2048]
    - [30, 10.405]
  - - [4096, 512, 1, 4096, 4096, 4096, 4096, 4096]
    - [48, 11.58]
  - - [4096, 512, 1, 8192, 4096, 4096, 4096, 8192]
    - [55, 13.934]
  - - [4096, 1024, 1, 128, 4096, 4096, 4096, 128]
    - [4, 5.245]
  - - [4096, 1024, 1, 256, 4096, 4096, 4096, 256]
    - [6, 7.747]
  - - [4096, 1024, 1, 512, 4096, 4096, 4096, 512]
    - [12, 9.416]
  - - [4096, 1024, 1, 1024, 4096, 4096, 4096, 1024]
    - [12, 11.148]
  - - [4096, 1024, 1, 2048, 4096, 4096, 4096, 2048]
    - [27, 12.313]
  - - [4096, 1024, 1, 4096, 4096, 4096, 4096, 4096]
    - [48, 13.973]
  - - [4096, 1024, 1, 8192, 4096, 4096, 4096, 8192]
    - [8, 15.8]
  - - [4096, 2048, 1, 128, 4096, 4096, 4096, 128]
    - [52, 5.482]
  - - [4096, 2048, 1, 256, 4096, 4096, 4096, 256]
    - [52, 8.178]
  - - [4096, 2048, 1, 512, 4096, 4096, 4096, 512]
    - [9, 11.23]
  - - [4096, 2048, 1, 1024, 4096, 4096, 4096, 1024]
    - [54, 13.657]
  - - [4096, 2048, 1, 2048, 4096, 4096, 4096, 2048]
    - [49, 14.138]
  - - [4096, 2048, 1, 4096, 4096, 4096, 4096, 4096]
    - [48, 15.738]
  - - [4096, 2048, 1, 8192, 4096, 4096, 4096, 8192]
    - [48, 17.302]
  - - [4096, 4096, 1, 128, 4096, 4096, 4096, 128]
    - [64, 5.435]
  - - [4096, 4096, 1, 256, 4096, 4096, 4096, 256]
    - [42, 7.675]
  - - [4096, 4096, 1, 512, 4096, 4096, 4096, 512]
    - [0, 10.782]
  - - [4096, 4096, 1, 1024, 4096, 4096, 4096, 1024]
    - [41, 13.409]
  - - [4096, 4096, 1, 2048, 4096, 4096, 4096, 2048]
    - [49, 15.29]
  - - [4096, 4096, 1, 4096, 4096, 4096, 4096, 4096]
    - [49, 17.006]
  - - [4096, 4096, 1, 8192, 4096, 4096, 4096, 8192]
    - [39, 18.415]
  - - [4096, 8192, 1, 128, 4096, 4096, 4096, 128]
    - [29, 4.615]
  - - [4096, 8192, 1, 256, 4096, 4096, 4096, 256]
    - [54, 6.854]
  - - [4096, 8192, 1, 512, 4096, 4096, 4096, 512]
    - [51, 10.057]
  - - [4096, 8192, 1, 1024, 4096, 4096, 4096, 1024]
    - [54, 13.276]
  - - [4096, 8192, 1, 2048, 4096, 4096, 4096, 2048]
    - [54, 15.968]
  - - [4096, 8192, 1, 4096, 4096, 4096, 4096, 4096]
    - [39, 17.639]
  - - [4096, 8192, 1, 8192, 4096, 4096, 4096, 8192]
    - [39, 18.763]
  - - [8192, 128, 1, 128, 8192, 8192, 8192, 128]
    - [81, 2.854]
  - - [8192, 128, 1, 256, 8192, 8192, 8192, 256]
    - [74, 4.656]
  - - [8192, 128, 1, 512, 8192, 8192, 8192, 512]
    - [79, 6.58]
  - - [8192, 128, 1, 1024, 8192, 8192, 8192, 1024]
    - [92, 7.026]
  - - [8192, 128, 1, 2048, 8192, 8192, 8192, 2048]
    - [81, 8.571]
  - - [8192, 128, 1, 4096, 8192, 8192, 8192, 4096]
    - [10, 11.134]
  - - [8192, 128, 1, 8192, 8192, 8192, 8192, 8192]
    - [20, 11.587]
  - - [8192, 256, 1, 128, 8192, 8192, 8192, 128]
    - [65, 3.908]
  - - [8192, 256, 1, 256, 8192, 8192, 8192, 256]
    - [63, 5.821]
  - - [8192, 256, 1, 512, 8192, 8192, 8192, 512]
    - [25, 7.357]
  - - [8192, 256, 1, 1024, 8192, 8192, 8192, 1024]
    - [81, 9.174]
  - - [8192, 256, 1, 2048, 8192, 8192, 8192, 2048]
    - [81, 10.432]
  - - [8192, 256, 1, 4096, 8192, 8192, 8192, 4096]
    - [58, 11.721]
  - - [8192, 256, 1, 8192, 8192, 8192, 8192, 8192]
    - [49, 13.787]
  - - [8192, 512, 1, 128, 8192, 8192, 8192, 128]
    - [3, 5.203]
  - - [8192, 512, 1, 256, 8192, 8192, 8192, 256]
    - [3, 7.562]
  - - [8192, 512, 1, 512, 8192, 8192, 8192, 512]
    - [12, 9.319]
  - - [8192, 512, 1, 1024, 8192, 8192, 8192, 1024]
    - [12, 11.094]
  - - [8192, 512, 1, 2048, 8192, 8192, 8192, 2048]
    - [27, 12.392]
  - - [8192, 512, 1, 4096, 8192, 8192, 8192, 4096]
    - [4, 14.02]
  - - [8192, 512, 1, 8192, 8192, 8192, 8192, 8192]
    - [50, 15.831]
  - - [8192, 1024, 1, 128, 8192, 8192, 8192, 128]
    - [48, 5.35]
  - - [8192, 1024, 1, 256, 8192, 8192, 8192, 256]
    - [9, 8.118]
  - - [8192, 1024, 1, 512, 8192, 8192, 8192, 512]
    - [9, 11.141]
  - - [8192, 1024, 1, 1024, 8192, 8192, 8192, 1024]
    - [9, 13.424]
  - - [8192, 1024, 1, 2048, 8192, 8192, 8192, 2048]
    - [52, 13.891]
  - - [8192, 1024, 1, 4096, 8192, 8192, 8192, 4096]
    - [48, 16.051]
  - - [8192, 1024, 1, 8192, 8192, 8192, 8192, 8192]
    - [48, 17.292]
  - - [8192, 2048, 1, 128, 8192, 8192, 8192, 128]
    - [58, 5.434]
  - - [8192, 2048, 1, 256, 8192, 8192, 8192, 256]
    - [41, 7.672]
  - - [8192, 2048, 1, 512, 8192, 8192, 8192, 512]
    - [41, 10.709]
  - - [8192, 2048, 1, 1024, 8192, 8192, 8192, 1024]
    - [42, 13.388]
  - - [8192, 2048, 1, 2048, 8192, 8192, 8192, 2048]
    - [48, 15.344]
  - - [8192, 2048, 1, 4096, 8192, 8192, 8192, 4096]
    - [48, 16.936]
  - - [8192, 2048, 1, 8192, 8192, 8192, 8192, 8192]
    - [42, 18.395]
  - - [8192, 4096, 1, 128, 8192, 8192, 8192, 128]
    - [55, 4.538]
  - - [8192, 4096, 1, 256, 8192, 8192, 8192, 256]
    - [13, 6.739]
  - - [8192, 4096, 1, 512, 8192, 8192, 8192, 512]
    - [54, 9.962]
  - - [8192, 4096, 1, 1024, 8192, 8192, 8192, 1024]
    - [54, 13.196]
  - - [8192, 4096, 1, 2048, 8192, 8192, 8192, 2048]
    - [55, 15.835]
  - - [8192, 4096, 1, 4096, 8192, 8192, 8192, 4096]
    - [40, 17.787]
  - - [8192, 4096, 1, 8192, 8192, 8192, 8192, 8192]
    - [39, 18.777]
  - - [8192, 8192, 1, 128, 8192, 8192, 8192, 128]
    - [2, 4.559]
  - - [8192, 8192, 1, 256, 8192, 8192, 8192, 256]
    - [55, 7.38]
  - - [8192, 8192, 1, 512, 8192, 8192, 8192, 512]
    - [54, 10.83]
  - - [8192, 8192, 1, 1024, 8192, 8192, 8192, 1024]
    - [54, 14.097]
  - - [8192, 8192, 1, 2048, 8192, 8192, 8192, 2048]
    - [45, 16.922]
  - - [8192, 8192, 1, 4096, 8192, 8192, 8192, 4096]
    - [44, 18.554]
  - - [8192, 8192, 1, 8192, 8192, 8192, 8192, 8192]
    - [1, 19.198]
  - - [1, 1, 1, 32, 1, 1, 1, 32]
    - [102, 0.0]
- null
- null
- DeviceEfficiency
- GridBased
