library/src/amd_detail/rocblaslt/src/Tensile/Logic/streamk/gfx942_80cu/aquavanjaram942_Cijk_Ailk_Bljk_BSS_BH_UserArgs.yaml
- {MinimumRequiredVersion: 4.33.0}
- aquavanjaram942
- {Architecture: gfx942, CUCount: 80}
- [Device 0049, Device 0050]
    SolutionIndex: 0
    SolutionNameMin: Cijk_Ailk_Bljk_BSS_BH_UserArgs_MT256x256x32_MI16x16x1_SN_LDSB1_CLR1_GSU0_GSUC0_GSUWGMRR0_K1_LBSPPA2048_LBSPPB128_LPA0_MIWT8_8_PLR1_SU32_SUM0_SUS256_SKXCCM0_VWA4_VWB1_WGM2_WGMXCC1_WGMXCCGn1
    SolutionIndex: 1
    SolutionNameMin: Cijk_Ailk_Bljk_BSS_BH_UserArgs_MT256x256x32_MI16x16x1_SN_LDSB1_CLR1_GSU0_GSUC0_GSUWGMRR0_K1_LBSPPA2048_LBSPPB128_LPA0_MIWT8_8_PLR1_SU32_SUM0_SUS256_SKXCCM0_VWA4_VWB2_WGM2_WGMXCC1_WGMXCCGn1
    SolutionIndex: 2
    SolutionNameMin: Cijk_Ailk_Bljk_BSS_BH_UserArgs_MT256x128x32_MI16x16x1_SN_LDSB1_CLR1_GSU0_GSUC0_GSUWGMRR0_K1_LBSPPA2048_LBSPPB128_LPA0_MIWT8_4_PLR1_SU32_SUM0_SUS256_SKXCCM0_VWA4_VWB1_WGM1_WGMXCC1_WGMXCCGn1
    SolutionIndex: 3
    SolutionNameMin: Cijk_Ailk_Bljk_BSS_BH_UserArgs_MT256x128x32_MI16x16x1_SN_LDSB1_CLR1_GSU0_GSUC0_GSUWGMRR0_K1_LBSPPA2048_LBSPPB128_LPA0_MIWT8_4_PLR1_SU32_SUM0_SUS256_SKXCCM0_VWA4_VWB2_WGM1_WGMXCC1_WGMXCCGn1
    SolutionIndex: 4
    SolutionNameMin: Cijk_Ailk_Bljk_BSS_BH_UserArgs_MT256x128x32_MI16x16x1_SN_LDSB1_CLR1_GSU0_GSUC0_GSUWGMRR0_K1_LBSPPA2048_LBSPPB256_LPA0_MIWT8_4_PLR1_SU32_SUM0_SUS256_SKXCCM0_VWA4_VWB4_WGM1_WGMXCC1_WGMXCCGn1
    SolutionIndex: 5
    SolutionNameMin: Cijk_Ailk_Bljk_BSS_BH_UserArgs_MT256x128x32_MI16x16x1_SN_LDSB1_CLR1_GSU0_GSUC0_GSUWGMRR0_K1_LBSPPA2048_LBSPPB128_LPA0_MIWT8_4_PLR1_SU32_SUM0_SUS256_SKXCCM0_VWA4_VWB1_WGM2_WGMXCC1_WGMXCCGn1
    SolutionIndex: 6
    SolutionNameMin: Cijk_Ailk_Bljk_BSS_BH_UserArgs_MT256x128x32_MI16x16x1_SN_LDSB1_CLR1_GSU0_GSUC0_GSUWGMRR0_K1_LBSPPA2048_LBSPPB128_LPA0_MIWT8_4_PLR1_SU32_SUM0_SUS256_SKXCCM0_VWA4_VWB2_WGM2_WGMXCC1_WGMXCCGn1
    SolutionIndex: 7
    SolutionNameMin: Cijk_Ailk_Bljk_BSS_BH_UserArgs_MT256x128x32_MI16x16x1_SN_LDSB1_CLR1_GSU0_GSUC0_GSUWGMRR0_K1_LBSPPA2048_LBSPPB128_LPA0_MIWT8_4_PLR1_SU32_SUM0_SUS256_SKXCCM0_VWA4_VWB1_WGM4_WGMXCC1_WGMXCCGn1
    SolutionIndex: 8
    SolutionNameMin: Cijk_Ailk_Bljk_BSS_BH_UserArgs_MT256x128x32_MI16x16x1_SN_LDSB1_CLR1_GSU0_GSUC0_GSUWGMRR0_K1_LBSPPA2048_LBSPPB128_LPA0_MIWT8_4_PLR1_SU32_SUM0_SUS256_SKXCCM0_VWA4_VWB2_WGM4_WGMXCC1_WGMXCCGn1
    SolutionIndex: 9
    SolutionNameMin: Cijk_Ailk_Bljk_BSS_BH_UserArgs_MT256x64x32_MI16x16x1_SN_LDSB1_CLR1_GSU0_GSUC0_GSUWGMRR0_K1_LBSPPA2048_LBSPPB128_LPA0_MIWT8_2_PLR1_SU32_SUM0_SUS256_SKXCCM0_VWA4_VWB1_WGM1_WGMXCC1_WGMXCCGn1
    SolutionIndex: 10
    SolutionNameMin: Cijk_Ailk_Bljk_BSS_BH_UserArgs_MT256x64x32_MI16x16x1_SN_LDSB1_CLR1_GSU0_GSUC0_GSUWGMRR0_K1_LBSPPA2048_LBSPPB128_LPA0_MIWT8_2_PLR1_SU32_SUM0_SUS256_SKXCCM0_VWA4_VWB2_WGM4_WGMXCC1_WGMXCCGn1
    SolutionIndex: 11
    SolutionNameMin: Cijk_Ailk_Bljk_BSS_BH_UserArgs_MT128x128x32_MI16x16x1_SN_LDSB1_CLR1_GSU0_GSUC0_GSUWGMRR0_K1_LBSPPA1024_LBSPPB128_LPA0_MIWT4_4_PLR1_SU32_SUM0_SUS256_SKXCCM0_VWA4_VWB1_WGM1_WGMXCC1_WGMXCCGn1
    SolutionIndex: 12
    SolutionNameMin: Cijk_Ailk_Bljk_BSS_BH_UserArgs_MT128x128x32_MI16x16x1_SN_LDSB1_CLR1_GSU0_GSUC0_GSUWGMRR0_K1_LBSPPA1024_LBSPPB128_LPA0_MIWT4_4_PLR1_SU32_SUM0_SUS256_SKXCCM0_VWA4_VWB2_WGM1_WGMXCC1_WGMXCCGn1
    SolutionIndex: 13
    SolutionNameMin: Cijk_Ailk_Bljk_BSS_BH_UserArgs_MT128x128x32_MI16x16x1_SN_LDSB1_CLR1_GSU0_GSUC0_GSUWGMRR0_K1_LBSPPA1024_LBSPPB128_LPA0_MIWT4_4_PLR1_SU32_SUM0_SUS256_SKXCCM0_VWA4_VWB1_WGM2_WGMXCC1_WGMXCCGn1
    SolutionIndex: 14
    SolutionNameMin: Cijk_Ailk_Bljk_BSS_BH_UserArgs_MT128x128x32_MI16x16x1_SN_LDSB1_CLR1_GSU0_GSUC0_GSUWGMRR0_K1_LBSPPA1024_LBSPPB128_LPA16_MIWT4_4_PLR1_SU32_SUM0_SUS256_SKXCCM0_VWA1_VWB2_WGM2_WGMXCC1_WGMXCCGn1
    SolutionIndex: 15
    SolutionNameMin: Cijk_Ailk_Bljk_BSS_BH_UserArgs_MT32x32x32_MI16x16x1_SN_LDSB0_CLR1_GSU0_GSUC0_GSUWGMRR0_K1_LBSPPA256_LBSPPB128_LPA16_MIWT1_1_PLR1_SU32_SUM0_SUS256_SKXCCM0_VWA1_VWB1_WGM1_WGMXCC1_WGMXCCGn1
    SolutionIndex: 16
    SolutionNameMin: Cijk_Ailk_Bljk_BSS_BH_UserArgs_MT32x32x32_MI16x16x1_SN_LDSB0_CLR0_GSU0_GSUC0_GSUWGMRR0_K1_LBSPPA256_LBSPPB128_LPA16_MIWT1_1_PLR0_SU32_SUM0_SUS256_SKXCCM0_VWA1_VWB1_WGM1_WGMXCC1_WGMXCCGn1
    SolutionIndex: 17
    SolutionNameMin: Cijk_Ailk_Bljk_BSS_BH_UserArgs_MT128x256x64_MI16x16x1_SN_LDSB1_CLR1_GSU0_GSUC0_GSUWGMRR0_K1_LBSPPA2048_LBSPPB1024_LPA0_MIWT4_8_PLR1_SU32_SUM0_SUS256_SKXCCM0_VWA4_VWB8_WGM1_WGMXCC1_WGMXCCGn1
    SolutionIndex: 18
    SolutionNameMin: Cijk_Ailk_Bljk_BSS_BH_UserArgs_MT256x128x64_MI16x16x1_SN_LDSB1_CLR1_GSU0_GSUC0_GSUWGMRR0_K1_LBSPPA4096_LBSPPB128_LPA0_MIWT8_4_PLR1_SU32_SUM0_SUS256_SKXCCM0_VWA4_VWB1_WGM1_WGMXCC1_WGMXCCGn1
    SolutionIndex: 19
    SolutionNameMin: Cijk_Ailk_Bljk_BSS_BH_UserArgs_MT256x128x64_MI16x16x1_SN_LDSB1_CLR1_GSU0_GSUC0_GSUWGMRR0_K1_LBSPPA4096_LBSPPB256_LPA0_MIWT8_4_PLR1_SU32_SUM0_SUS256_SKXCCM0_VWA4_VWB2_WGM1_WGMXCC1_WGMXCCGn1
    SolutionIndex: 20
    SolutionNameMin: Cijk_Ailk_Bljk_BSS_BH_UserArgs_MT256x128x64_MI16x16x1_SN_LDSB1_CLR1_GSU0_GSUC0_GSUWGMRR0_K1_LBSPPA4096_LBSPPB512_LPA0_MIWT8_4_PLR1_SU32_SUM0_SUS256_SKXCCM0_VWA4_VWB4_WGM1_WGMXCC1_WGMXCCGn1
    SolutionIndex: 21
    SolutionNameMin: Cijk_Ailk_Bljk_BSS_BH_UserArgs_MT256x128x64_MI16x16x1_SN_LDSB1_CLR1_GSU0_GSUC0_GSUWGMRR0_K1_LBSPPA4096_LBSPPB256_LPA0_MIWT8_4_PLR1_SU32_SUM0_SUS256_SKXCCM0_VWA4_VWB2_WGM2_WGMXCC1_WGMXCCGn1
    SolutionIndex: 22
    SolutionNameMin: Cijk_Ailk_Bljk_BSS_BH_UserArgs_MT256x128x64_MI16x16x1_SN_LDSB1_CLR1_GSU0_GSUC0_GSUWGMRR0_K1_LBSPPA4096_LBSPPB128_LPA0_MIWT8_4_PLR1_SU32_SUM0_SUS256_SKXCCM0_VWA4_VWB1_WGM4_WGMXCC1_WGMXCCGn1
    SolutionIndex: 23
    SolutionNameMin: Cijk_Ailk_Bljk_BSS_BH_UserArgs_MT256x128x64_MI16x16x1_SN_LDSB1_CLR1_GSU0_GSUC0_GSUWGMRR0_K1_LBSPPA4096_LBSPPB512_LPA0_MIWT8_4_PLR1_SU32_SUM0_SUS256_SKXCCM0_VWA4_VWB4_WGM4_WGMXCC1_WGMXCCGn1
    SolutionIndex: 24
    SolutionNameMin: Cijk_Ailk_Bljk_BSS_BH_UserArgs_MT128x128x64_MI16x16x1_SN_LDSB1_CLR1_GSU0_GSUC0_GSUWGMRR0_K1_LBSPPA2048_LBSPPB128_LPA0_MIWT4_4_PLR1_SU32_SUM0_SUS256_SKXCCM0_VWA4_VWB1_WGM1_WGMXCC1_WGMXCCGn1
    SolutionIndex: 25
    SolutionNameMin: Cijk_Ailk_Bljk_BSS_BH_UserArgs_MT128x128x64_MI16x16x1_SN_LDSB1_CLR1_GSU0_GSUC0_GSUWGMRR0_K1_LBSPPA2048_LBSPPB256_LPA0_MIWT4_4_PLR1_SU32_SUM0_SUS256_SKXCCM0_VWA4_VWB2_WGM1_WGMXCC1_WGMXCCGn1
    SolutionIndex: 26
    SolutionNameMin: Cijk_Ailk_Bljk_BSS_BH_UserArgs_MT128x128x64_MI16x16x1_SN_LDSB1_CLR1_GSU0_GSUC0_GSUWGMRR0_K1_LBSPPA2048_LBSPPB512_LPA0_MIWT4_4_PLR1_SU32_SUM0_SUS256_SKXCCM0_VWA4_VWB4_WGM1_WGMXCC1_WGMXCCGn1
    SolutionIndex: 27
    SolutionNameMin: Cijk_Ailk_Bljk_BSS_BH_UserArgs_MT128x128x64_MI16x16x1_SN_LDSB1_CLR1_GSU0_GSUC0_GSUWGMRR0_K1_LBSPPA2048_LBSPPB512_LPA0_MIWT4_4_PLR1_SU32_SUM0_SUS256_SKXCCM0_VWA4_VWB4_WGM2_WGMXCC1_WGMXCCGn1
    SolutionIndex: 28
    SolutionNameMin: Cijk_Ailk_Bljk_BSS_BH_UserArgs_MT128x64x64_MI16x16x1_SN_LDSB1_CLR1_GSU0_GSUC0_GSUWGMRR0_K1_LBSPPA2048_LBSPPB128_LPA0_MIWT4_2_PLR1_SU32_SUM0_SUS256_SKXCCM0_VWA4_VWB1_WGM1_WGMXCC1_WGMXCCGn1
    SolutionIndex: 29
    SolutionNameMin: Cijk_Ailk_Bljk_BSS_BH_UserArgs_MT128x64x64_MI16x16x1_SN_LDSB1_CLR1_GSU0_GSUC0_GSUWGMRR0_K1_LBSPPA2048_LBSPPB256_LPA0_MIWT4_2_PLR1_SU32_SUM0_SUS256_SKXCCM0_VWA4_VWB2_WGM1_WGMXCC1_WGMXCCGn1
    SolutionIndex: 30
    SolutionNameMin: Cijk_Ailk_Bljk_BSS_BH_UserArgs_MT128x64x64_MI16x16x1_SN_LDSB1_CLR1_GSU0_GSUC0_GSUWGMRR0_K1_LBSPPA2048_LBSPPB128_LPA0_MIWT4_2_PLR1_SU32_SUM0_SUS256_SKXCCM0_VWA4_VWB1_WGM4_WGMXCC1_WGMXCCGn1
    SolutionIndex: 31
    SolutionNameMin: Cijk_Ailk_Bljk_BSS_BH_UserArgs_MT64x64x64_MI16x16x1_SN_LDSB1_CLR1_GSU0_GSUC0_GSUWGMRR0_K1_LBSPPA1024_LBSPPB256_LPA32_MIWT2_2_PLR1_SU32_SUM0_SUS256_SKXCCM0_VWA2_VWB2_WGM2_WGMXCC1_WGMXCCGn1
    SolutionIndex: 32
    SolutionNameMin: Cijk_Ailk_Bljk_BSS_BH_UserArgs_MT64x64x64_MI16x16x1_SN_LDSB1_CLR1_GSU0_GSUC0_GSUWGMRR0_K1_LBSPPA1024_LBSPPB256_LPA16_MIWT2_2_PLR1_SU32_SUM0_SUS256_SKXCCM0_VWA1_VWB2_WGM4_WGMXCC1_WGMXCCGn1
    SolutionIndex: 33
    SolutionNameMin: Cijk_Ailk_Bljk_BSS_BH_UserArgs_MT64x32x64_MI16x16x1_SN_LDSB0_CLR1_GSU0_GSUC0_GSUWGMRR0_K1_LBSPPA1024_LBSPPB128_LPA32_MIWT2_1_PLR1_SU32_SUM0_SUS256_SKXCCM0_VWA2_VWB1_WGM1_WGMXCC1_WGMXCCGn1
    SolutionIndex: 34
    SolutionNameMin: Cijk_Ailk_Bljk_BSS_BH_UserArgs_MT128x64x128_MI16x16x1_SN_LDSB1_CLR1_GSU0_GSUC0_GSUWGMRR0_K1_LBSPPA2048_LBSPPB256_LPA0_MIWT4_2_PLR2_SU32_SUM0_SUS256_SKXCCM0_VWA4_VWB1_WGM1_WGMXCC1_WGMXCCGn1
    SolutionIndex: 35
    SolutionNameMin: Cijk_Ailk_Bljk_BSS_BH_UserArgs_MT32x64x128_MI16x16x1_SN_LDSB1_CLR1_GSU0_GSUC0_GSUWGMRR0_K1_LBSPPA512_LBSPPB512_LPA16_MIWT1_2_PLR2_SU32_SUM0_SUS256_SKXCCM0_VWA1_VWB2_WGM1_WGMXCC1_WGMXCCGn1
    SolutionIndex: 36
    SolutionNameMin: Cijk_Ailk_Bljk_BSS_BH_UserArgs_MT64x32x128_MI16x16x1_SN_LDSB1_CLR1_GSU0_GSUC0_GSUWGMRR0_K1_LBSPPA1024_LBSPPB256_LPA32_MIWT2_1_PLR2_SU32_SUM0_SUS256_SKXCCM0_VWA2_VWB1_WGM1_WGMXCC1_WGMXCCGn1
    SolutionIndex: 37
    SolutionNameMin: Cijk_Ailk_Bljk_BSS_BH_UserArgs_MT32x32x128_MI16x16x1_SN_LDSB1_CLR1_GSU0_GSUC0_GSUWGMRR0_K1_LBSPPA512_LBSPPB256_LPA16_MIWT1_1_PLR1_SU32_SUM0_SUS256_SKXCCM0_VWA1_VWB1_WGM1_WGMXCC1_WGMXCCGn1
    SolutionIndex: 38
    SolutionNameMin: Cijk_Ailk_Bljk_BSS_BH_UserArgs_MT32x32x128_MI16x16x1_SN_LDSB1_CLR1_GSU0_GSUC0_GSUWGMRR0_K1_LBSPPA512_LBSPPB256_LPA16_MIWT1_1_PLR2_SU32_SUM0_SUS256_SKXCCM0_VWA1_VWB1_WGM1_WGMXCC1_WGMXCCGn1
    SolutionIndex: 39
    SolutionNameMin: Cijk_Ailk_Bljk_BSS_BH_UserArgs_MT256x256x32_MI16x16x1_SN_LDSB1_CLR1_GSU0_GSUC0_GSUWGMRR0_K1_LBSPPA2048_LBSPPB128_LPA0_MIWT8_8_PLR1_SU32_SUM0_SUS256_SKXCCM4_VWA4_VWB1_WGM1_WGMXCC1_WGMXCCGn1
    SolutionIndex: 40
    SolutionNameMin: Cijk_Ailk_Bljk_BSS_BH_UserArgs_MT256x256x32_MI16x16x1_SN_LDSB1_CLR1_GSU0_GSUC0_GSUWGMRR0_K1_LBSPPA2048_LBSPPB128_LPA0_MIWT8_8_PLR1_SU32_SUM0_SUS256_SKXCCM4_VWA4_VWB2_WGM1_WGMXCC1_WGMXCCGn1
    SolutionIndex: 41
    SolutionNameMin: Cijk_Ailk_Bljk_BSS_BH_UserArgs_MT256x256x32_MI16x16x1_SN_LDSB1_CLR1_GSU0_GSUC0_GSUWGMRR0_K1_LBSPPA2048_LBSPPB256_LPA0_MIWT8_8_PLR1_SU32_SUM0_SUS256_SKXCCM4_VWA4_VWB4_WGM1_WGMXCC1_WGMXCCGn1
    SolutionIndex: 42
    SolutionNameMin: Cijk_Ailk_Bljk_BSS_BH_UserArgs_MT256x256x32_MI16x16x1_SN_LDSB1_CLR1_GSU0_GSUC0_GSUWGMRR0_K1_LBSPPA2048_LBSPPB512_LPA0_MIWT8_8_PLR1_SU32_SUM0_SUS256_SKXCCM4_VWA4_VWB8_WGM1_WGMXCC1_WGMXCCGn1
    SolutionIndex: 43
    SolutionNameMin: Cijk_Ailk_Bljk_BSS_BH_UserArgs_MT256x256x32_MI16x16x1_SN_LDSB1_CLR1_GSU0_GSUC0_GSUWGMRR0_K1_LBSPPA2048_LBSPPB128_LPA0_MIWT8_8_PLR1_SU32_SUM0_SUS256_SKXCCM4_VWA4_VWB1_WGM2_WGMXCC1_WGMXCCGn1
    SolutionIndex: 44
    SolutionNameMin: Cijk_Ailk_Bljk_BSS_BH_UserArgs_MT256x256x32_MI16x16x1_SN_LDSB1_CLR1_GSU0_GSUC0_GSUWGMRR0_K1_LBSPPA2048_LBSPPB128_LPA0_MIWT8_8_PLR1_SU32_SUM0_SUS256_SKXCCM4_VWA4_VWB1_WGM4_WGMXCC1_WGMXCCGn1
    SolutionIndex: 45
    SolutionNameMin: Cijk_Ailk_Bljk_BSS_BH_UserArgs_MT256x256x32_MI16x16x1_SN_LDSB1_CLR1_GSU0_GSUC0_GSUWGMRR0_K1_LBSPPA2048_LBSPPB512_LPA0_MIWT8_8_PLR1_SU32_SUM0_SUS256_SKXCCM4_VWA4_VWB8_WGM4_WGMXCC1_WGMXCCGn1
    SolutionIndex: 46
    SolutionNameMin: Cijk_Ailk_Bljk_BSS_BH_UserArgs_MT256x128x32_MI16x16x1_SN_LDSB1_CLR1_GSU0_GSUC0_GSUWGMRR0_K1_LBSPPA2048_LBSPPB128_LPA0_MIWT8_4_PLR1_SU32_SUM0_SUS256_SKXCCM4_VWA4_VWB1_WGM1_WGMXCC1_WGMXCCGn1
    SolutionIndex: 47
    SolutionNameMin: Cijk_Ailk_Bljk_BSS_BH_UserArgs_MT256x128x32_MI16x16x1_SN_LDSB1_CLR1_GSU0_GSUC0_GSUWGMRR0_K1_LBSPPA2048_LBSPPB128_LPA0_MIWT8_4_PLR1_SU32_SUM0_SUS256_SKXCCM4_VWA4_VWB2_WGM1_WGMXCC1_WGMXCCGn1
    SolutionIndex: 48
    SolutionNameMin: Cijk_Ailk_Bljk_BSS_BH_UserArgs_MT256x128x32_MI16x16x1_SN_LDSB1_CLR1_GSU0_GSUC0_GSUWGMRR0_K1_LBSPPA2048_LBSPPB256_LPA0_MIWT8_4_PLR1_SU32_SUM0_SUS256_SKXCCM4_VWA4_VWB4_WGM1_WGMXCC1_WGMXCCGn1
    SolutionIndex: 49
    SolutionNameMin: Cijk_Ailk_Bljk_BSS_BH_UserArgs_MT256x128x32_MI16x16x1_SN_LDSB1_CLR1_GSU0_GSUC0_GSUWGMRR0_K1_LBSPPA2048_LBSPPB128_LPA0_MIWT8_4_PLR1_SU32_SUM0_SUS256_SKXCCM4_VWA4_VWB1_WGM2_WGMXCC1_WGMXCCGn1
    SolutionIndex: 50
    SolutionNameMin: Cijk_Ailk_Bljk_BSS_BH_UserArgs_MT256x128x32_MI16x16x1_SN_LDSB1_CLR1_GSU0_GSUC0_GSUWGMRR0_K1_LBSPPA2048_LBSPPB128_LPA0_MIWT8_4_PLR1_SU32_SUM0_SUS256_SKXCCM4_VWA4_VWB2_WGM2_WGMXCC1_WGMXCCGn1
    SolutionIndex: 51
    SolutionNameMin: Cijk_Ailk_Bljk_BSS_BH_UserArgs_MT256x128x32_MI16x16x1_SN_LDSB1_CLR1_GSU0_GSUC0_GSUWGMRR0_K1_LBSPPA2048_LBSPPB256_LPA0_MIWT8_4_PLR1_SU32_SUM0_SUS256_SKXCCM4_VWA4_VWB4_WGM2_WGMXCC1_WGMXCCGn1
    SolutionIndex: 52
    SolutionNameMin: Cijk_Ailk_Bljk_BSS_BH_UserArgs_MT256x128x32_MI16x16x1_SN_LDSB1_CLR1_GSU0_GSUC0_GSUWGMRR0_K1_LBSPPA2048_LBSPPB128_LPA0_MIWT8_4_PLR1_SU32_SUM0_SUS256_SKXCCM4_VWA4_VWB1_WGM4_WGMXCC1_WGMXCCGn1
    SolutionIndex: 53
    SolutionNameMin: Cijk_Ailk_Bljk_BSS_BH_UserArgs_MT256x128x32_MI16x16x1_SN_LDSB1_CLR1_GSU0_GSUC0_GSUWGMRR0_K1_LBSPPA2048_LBSPPB128_LPA0_MIWT8_4_PLR1_SU32_SUM0_SUS256_SKXCCM4_VWA4_VWB2_WGM4_WGMXCC1_WGMXCCGn1
    SolutionIndex: 54
    SolutionNameMin: Cijk_Ailk_Bljk_BSS_BH_UserArgs_MT256x128x32_MI16x16x1_SN_LDSB1_CLR1_GSU0_GSUC0_GSUWGMRR0_K1_LBSPPA2048_LBSPPB256_LPA0_MIWT8_4_PLR1_SU32_SUM0_SUS256_SKXCCM4_VWA4_VWB4_WGM4_WGMXCC1_WGMXCCGn1
    SolutionIndex: 55
    SolutionNameMin: Cijk_Ailk_Bljk_BSS_BH_UserArgs_MT128x128x32_MI16x16x1_SN_LDSB1_CLR1_GSU0_GSUC0_GSUWGMRR0_K1_LBSPPA1024_LBSPPB128_LPA16_MIWT4_4_PLR1_SU32_SUM0_SUS256_SKXCCM4_VWA1_VWB1_WGM1_WGMXCC1_WGMXCCGn1
    SolutionIndex: 56
    SolutionNameMin: Cijk_Ailk_Bljk_BSS_BH_UserArgs_MT128x128x32_MI16x16x1_SN_LDSB1_CLR1_GSU0_GSUC0_GSUWGMRR0_K1_LBSPPA1024_LBSPPB128_LPA0_MIWT4_4_PLR1_SU32_SUM0_SUS256_SKXCCM4_VWA4_VWB1_WGM1_WGMXCC1_WGMXCCGn1
    SolutionIndex: 57
    SolutionNameMin: Cijk_Ailk_Bljk_BSS_BH_UserArgs_MT128x128x32_MI16x16x1_SN_LDSB1_CLR1_GSU0_GSUC0_GSUWGMRR0_K1_LBSPPA1024_LBSPPB128_LPA16_MIWT4_4_PLR1_SU32_SUM0_SUS256_SKXCCM4_VWA1_VWB2_WGM1_WGMXCC1_WGMXCCGn1
    SolutionIndex: 58
    SolutionNameMin: Cijk_Ailk_Bljk_BSS_BH_UserArgs_MT128x128x32_MI16x16x1_SN_LDSB1_CLR1_GSU0_GSUC0_GSUWGMRR0_K1_LBSPPA1024_LBSPPB128_LPA0_MIWT4_4_PLR1_SU32_SUM0_SUS256_SKXCCM4_VWA4_VWB2_WGM1_WGMXCC1_WGMXCCGn1
    SolutionIndex: 59
    SolutionNameMin: Cijk_Ailk_Bljk_BSS_BH_UserArgs_MT128x128x32_MI16x16x1_SN_LDSB1_CLR1_GSU0_GSUC0_GSUWGMRR0_K1_LBSPPA1024_LBSPPB256_LPA0_MIWT4_4_PLR1_SU32_SUM0_SUS256_SKXCCM4_VWA4_VWB4_WGM1_WGMXCC1_WGMXCCGn1
    SolutionIndex: 60
    SolutionNameMin: Cijk_Ailk_Bljk_BSS_BH_UserArgs_MT128x128x32_MI16x16x1_SN_LDSB1_CLR1_GSU0_GSUC0_GSUWGMRR0_K1_LBSPPA1024_LBSPPB128_LPA0_MIWT4_4_PLR1_SU32_SUM0_SUS256_SKXCCM4_VWA4_VWB1_WGM2_WGMXCC1_WGMXCCGn1
    SolutionIndex: 61
    SolutionNameMin: Cijk_Ailk_Bljk_BSS_BH_UserArgs_MT128x128x32_MI16x16x1_SN_LDSB1_CLR1_GSU0_GSUC0_GSUWGMRR0_K1_LBSPPA1024_LBSPPB256_LPA0_MIWT4_4_PLR1_SU32_SUM0_SUS256_SKXCCM4_VWA4_VWB4_WGM2_WGMXCC1_WGMXCCGn1
    SolutionIndex: 62
    SolutionNameMin: Cijk_Ailk_Bljk_BSS_BH_UserArgs_MT128x128x32_MI16x16x1_SN_LDSB1_CLR1_GSU0_GSUC0_GSUWGMRR0_K1_LBSPPA1024_LBSPPB128_LPA0_MIWT4_4_PLR1_SU32_SUM0_SUS256_SKXCCM4_VWA4_VWB1_WGM4_WGMXCC1_WGMXCCGn1
    SolutionIndex: 63
    SolutionNameMin: Cijk_Ailk_Bljk_BSS_BH_UserArgs_MT128x128x32_MI16x16x1_SN_LDSB1_CLR1_GSU0_GSUC0_GSUWGMRR0_K1_LBSPPA1024_LBSPPB128_LPA0_MIWT4_4_PLR1_SU32_SUM0_SUS256_SKXCCM4_VWA4_VWB2_WGM4_WGMXCC1_WGMXCCGn1
    SolutionIndex: 64
    SolutionNameMin: Cijk_Ailk_Bljk_BSS_BH_UserArgs_MT128x128x32_MI16x16x1_SN_LDSB1_CLR1_GSU0_GSUC0_GSUWGMRR0_K1_LBSPPA1024_LBSPPB256_LPA16_MIWT4_4_PLR1_SU32_SUM0_SUS256_SKXCCM4_VWA1_VWB4_WGM4_WGMXCC1_WGMXCCGn1
    SolutionIndex: 65
    SolutionNameMin: Cijk_Ailk_Bljk_BSS_BH_UserArgs_MT128x64x32_MI16x16x1_SN_LDSB0_CLR1_GSU0_GSUC0_GSUWGMRR0_K1_LBSPPA1024_LBSPPB128_LPA0_MIWT4_2_PLR1_SU32_SUM0_SUS256_SKXCCM4_VWA4_VWB2_WGM1_WGMXCC1_WGMXCCGn1
    SolutionIndex: 66
    SolutionNameMin: Cijk_Ailk_Bljk_BSS_BH_UserArgs_MT128x64x32_MI16x16x1_SN_LDSB0_CLR0_GSU0_GSUC0_GSUWGMRR0_K1_LBSPPA1024_LBSPPB128_LPA0_MIWT4_2_PLR0_SU32_SUM0_SUS256_SKXCCM4_VWA4_VWB2_WGM1_WGMXCC1_WGMXCCGn1
    SolutionIndex: 67
    SolutionNameMin: Cijk_Ailk_Bljk_BSS_BH_UserArgs_MT128x64x32_MI16x16x1_SN_LDSB0_CLR1_GSU0_GSUC0_GSUWGMRR0_K1_LBSPPA1024_LBSPPB128_LPA0_MIWT4_2_PLR1_SU32_SUM0_SUS256_SKXCCM4_VWA4_VWB1_WGM2_WGMXCC1_WGMXCCGn1
    SolutionIndex: 68
    SolutionNameMin: Cijk_Ailk_Bljk_BSS_BH_UserArgs_MT128x64x32_MI16x16x1_SN_LDSB0_CLR0_GSU0_GSUC0_GSUWGMRR0_K1_LBSPPA1024_LBSPPB128_LPA0_MIWT4_2_PLR0_SU32_SUM0_SUS256_SKXCCM4_VWA4_VWB1_WGM2_WGMXCC1_WGMXCCGn1
    SolutionIndex: 69
    SolutionNameMin: Cijk_Ailk_Bljk_BSS_BH_UserArgs_MT128x64x32_MI16x16x1_SN_LDSB0_CLR1_GSU0_GSUC0_GSUWGMRR0_K1_LBSPPA1024_LBSPPB128_LPA0_MIWT4_2_PLR1_SU32_SUM0_SUS256_SKXCCM4_VWA4_VWB1_WGM4_WGMXCC1_WGMXCCGn1
    SolutionIndex: 70
    SolutionNameMin: Cijk_Ailk_Bljk_BSS_BH_UserArgs_MT128x64x32_MI16x16x1_SN_LDSB0_CLR0_GSU0_GSUC0_GSUWGMRR0_K1_LBSPPA1024_LBSPPB128_LPA0_MIWT4_2_PLR0_SU32_SUM0_SUS256_SKXCCM4_VWA4_VWB2_WGM4_WGMXCC1_WGMXCCGn1
    SolutionIndex: 71
    SolutionNameMin: Cijk_Ailk_Bljk_BSS_BH_UserArgs_MT256x128x64_MI16x16x1_SN_LDSB1_CLR1_GSU0_GSUC0_GSUWGMRR0_K1_LBSPPA4096_LBSPPB128_LPA0_MIWT8_4_PLR1_SU32_SUM0_SUS256_SKXCCM4_VWA4_VWB1_WGM1_WGMXCC1_WGMXCCGn1
    SolutionIndex: 72
    SolutionNameMin: Cijk_Ailk_Bljk_BSS_BH_UserArgs_MT256x128x64_MI16x16x1_SN_LDSB1_CLR1_GSU0_GSUC0_GSUWGMRR0_K1_LBSPPA4096_LBSPPB256_LPA0_MIWT8_4_PLR1_SU32_SUM0_SUS256_SKXCCM4_VWA4_VWB2_WGM1_WGMXCC1_WGMXCCGn1
    SolutionIndex: 73
    SolutionNameMin: Cijk_Ailk_Bljk_BSS_BH_UserArgs_MT256x128x64_MI16x16x1_SN_LDSB1_CLR1_GSU0_GSUC0_GSUWGMRR0_K1_LBSPPA4096_LBSPPB512_LPA0_MIWT8_4_PLR1_SU32_SUM0_SUS256_SKXCCM4_VWA4_VWB4_WGM1_WGMXCC1_WGMXCCGn1
    SolutionIndex: 74
    SolutionNameMin: Cijk_Ailk_Bljk_BSS_BH_UserArgs_MT128x128x64_MI16x16x1_SN_LDSB1_CLR1_GSU0_GSUC0_GSUWGMRR0_K1_LBSPPA2048_LBSPPB128_LPA0_MIWT4_4_PLR1_SU32_SUM0_SUS256_SKXCCM4_VWA4_VWB1_WGM1_WGMXCC1_WGMXCCGn1
    SolutionIndex: 75
    SolutionNameMin: Cijk_Ailk_Bljk_BSS_BH_UserArgs_MT128x128x64_MI16x16x1_SN_LDSB1_CLR1_GSU0_GSUC0_GSUWGMRR0_K1_LBSPPA2048_LBSPPB512_LPA0_MIWT4_4_PLR1_SU32_SUM0_SUS256_SKXCCM4_VWA4_VWB4_WGM1_WGMXCC1_WGMXCCGn1
    SolutionIndex: 76
    SolutionNameMin: Cijk_Ailk_Bljk_BSS_BH_UserArgs_MT64x128x64_MI16x16x1_SN_LDSB1_CLR1_GSU0_GSUC0_GSUWGMRR0_K1_LBSPPA1024_LBSPPB128_LPA32_MIWT2_4_PLR1_SU32_SUM0_SUS256_SKXCCM4_VWA2_VWB1_WGM1_WGMXCC1_WGMXCCGn1
    SolutionIndex: 77
    SolutionNameMin: Cijk_Ailk_Bljk_BSS_BH_UserArgs_MT64x128x64_MI16x16x1_SN_LDSB1_CLR1_GSU0_GSUC0_GSUWGMRR0_K1_LBSPPA1024_LBSPPB256_LPA32_MIWT2_4_PLR1_SU32_SUM0_SUS256_SKXCCM4_VWA2_VWB2_WGM1_WGMXCC1_WGMXCCGn1
    SolutionIndex: 78
    SolutionNameMin: Cijk_Ailk_Bljk_BSS_BH_UserArgs_MT64x128x64_MI16x16x1_SN_LDSB1_CLR1_GSU0_GSUC0_GSUWGMRR0_K1_LBSPPA1024_LBSPPB512_LPA32_MIWT2_4_PLR1_SU32_SUM0_SUS256_SKXCCM4_VWA2_VWB4_WGM2_WGMXCC1_WGMXCCGn1
    SolutionIndex: 79
    SolutionNameMin: Cijk_Ailk_Bljk_BSS_BH_UserArgs_MT128x64x64_MI16x16x1_SN_LDSB1_CLR1_GSU0_GSUC0_GSUWGMRR0_K1_LBSPPA2048_LBSPPB128_LPA0_MIWT4_2_PLR1_SU32_SUM0_SUS256_SKXCCM4_VWA4_VWB1_WGM1_WGMXCC1_WGMXCCGn1
    SolutionIndex: 80
    SolutionNameMin: Cijk_Ailk_Bljk_BSS_BH_UserArgs_MT128x64x64_MI16x16x1_SN_LDSB1_CLR1_GSU0_GSUC0_GSUWGMRR0_K1_LBSPPA2048_LBSPPB256_LPA0_MIWT4_2_PLR1_SU32_SUM0_SUS256_SKXCCM4_VWA4_VWB2_WGM1_WGMXCC1_WGMXCCGn1
    SolutionIndex: 81
    SolutionNameMin: Cijk_Ailk_Bljk_BSS_BH_UserArgs_MT128x64x64_MI16x16x1_SN_LDSB1_CLR1_GSU0_GSUC0_GSUWGMRR0_K1_LBSPPA2048_LBSPPB128_LPA0_MIWT4_2_PLR1_SU32_SUM0_SUS256_SKXCCM4_VWA4_VWB1_WGM2_WGMXCC1_WGMXCCGn1
    SolutionIndex: 82
    SolutionNameMin: Cijk_Ailk_Bljk_BSS_BH_UserArgs_MT128x64x64_MI16x16x1_SN_LDSB1_CLR1_GSU0_GSUC0_GSUWGMRR0_K1_LBSPPA2048_LBSPPB256_LPA0_MIWT4_2_PLR1_SU32_SUM0_SUS256_SKXCCM4_VWA4_VWB2_WGM2_WGMXCC1_WGMXCCGn1
    SolutionIndex: 83
    SolutionNameMin: Cijk_Ailk_Bljk_BSS_BH_UserArgs_MT128x64x64_MI16x16x1_SN_LDSB1_CLR1_GSU0_GSUC0_GSUWGMRR0_K1_LBSPPA2048_LBSPPB128_LPA0_MIWT4_2_PLR1_SU32_SUM0_SUS256_SKXCCM4_VWA4_VWB1_WGM4_WGMXCC1_WGMXCCGn1
    SolutionIndex: 84
    SolutionNameMin: Cijk_Ailk_Bljk_BSS_BH_UserArgs_MT128x64x64_MI16x16x1_SN_LDSB1_CLR1_GSU0_GSUC0_GSUWGMRR0_K1_LBSPPA2048_LBSPPB256_LPA0_MIWT4_2_PLR1_SU32_SUM0_SUS256_SKXCCM4_VWA4_VWB2_WGM4_WGMXCC1_WGMXCCGn1
    SolutionIndex: 85
    SolutionNameMin: Cijk_Ailk_Bljk_BSS_BH_UserArgs_MT64x64x64_MI16x16x1_SN_LDSB1_CLR1_GSU0_GSUC0_GSUWGMRR0_K1_LBSPPA1024_LBSPPB128_LPA32_MIWT2_2_PLR1_SU32_SUM0_SUS256_SKXCCM4_VWA2_VWB1_WGM1_WGMXCC1_WGMXCCGn1
    SolutionIndex: 86
    SolutionNameMin: Cijk_Ailk_Bljk_BSS_BH_UserArgs_MT64x64x64_MI16x16x1_SN_LDSB1_CLR1_GSU0_GSUC0_GSUWGMRR0_K1_LBSPPA1024_LBSPPB256_LPA32_MIWT2_2_PLR1_SU32_SUM0_SUS256_SKXCCM4_VWA2_VWB2_WGM1_WGMXCC1_WGMXCCGn1
    SolutionIndex: 87
    SolutionNameMin: Cijk_Ailk_Bljk_BSS_BH_UserArgs_MT64x64x64_MI16x16x1_SN_LDSB1_CLR1_GSU0_GSUC0_GSUWGMRR0_K1_LBSPPA1024_LBSPPB256_LPA32_MIWT2_2_PLR1_SU32_SUM0_SUS256_SKXCCM4_VWA2_VWB2_WGM2_WGMXCC1_WGMXCCGn1
    SolutionIndex: 88
    SolutionNameMin: Cijk_Ailk_Bljk_BSS_BH_UserArgs_MT64x64x64_MI16x16x1_SN_LDSB1_CLR1_GSU0_GSUC0_GSUWGMRR0_K1_LBSPPA1024_LBSPPB128_LPA32_MIWT2_2_PLR1_SU32_SUM0_SUS256_SKXCCM4_VWA2_VWB1_WGM4_WGMXCC1_WGMXCCGn1
    SolutionIndex: 89
    SolutionNameMin: Cijk_Ailk_Bljk_BSS_BH_UserArgs_MT64x64x64_MI16x16x1_SN_LDSB1_CLR1_GSU0_GSUC0_GSUWGMRR0_K1_LBSPPA1024_LBSPPB256_LPA32_MIWT2_2_PLR1_SU32_SUM0_SUS256_SKXCCM4_VWA2_VWB2_WGM4_WGMXCC1_WGMXCCGn1
    SolutionIndex: 90
    SolutionNameMin: Cijk_Ailk_Bljk_BSS_BH_UserArgs_MT32x64x64_MI16x16x1_SN_LDSB0_CLR1_GSU0_GSUC0_GSUWGMRR0_K1_LBSPPA512_LBSPPB128_LPA16_MIWT1_2_PLR1_SU32_SUM0_SUS256_SKXCCM4_VWA1_VWB1_WGM1_WGMXCC1_WGMXCCGn1
    SolutionIndex: 91
    SolutionNameMin: Cijk_Ailk_Bljk_BSS_BH_UserArgs_MT64x32x64_MI16x16x1_SN_LDSB0_CLR1_GSU0_GSUC0_GSUWGMRR0_K1_LBSPPA1024_LBSPPB128_LPA32_MIWT2_1_PLR1_SU32_SUM0_SUS256_SKXCCM4_VWA2_VWB1_WGM1_WGMXCC1_WGMXCCGn1
    SolutionIndex: 92
    SolutionNameMin: Cijk_Ailk_Bljk_BSS_BH_UserArgs_MT32x32x64_MI16x16x1_SN_LDSB0_CLR1_GSU0_GSUC0_GSUWGMRR0_K1_LBSPPA512_LBSPPB128_LPA16_MIWT1_1_PLR1_SU32_SUM0_SUS256_SKXCCM4_VWA1_VWB1_WGM1_WGMXCC1_WGMXCCGn1
    SolutionIndex: 93
    SolutionNameMin: Cijk_Ailk_Bljk_BSS_BH_UserArgs_MT128x64x128_MI16x16x1_SN_LDSB1_CLR1_GSU0_GSUC0_GSUWGMRR0_K1_LBSPPA2048_LBSPPB256_LPA0_MIWT4_2_PLR2_SU32_SUM0_SUS256_SKXCCM4_VWA4_VWB1_WGM1_WGMXCC1_WGMXCCGn1
    SolutionIndex: 94
    SolutionNameMin: Cijk_Ailk_Bljk_BSS_BH_UserArgs_MT128x64x128_MI16x16x1_SN_LDSB1_CLR1_GSU0_GSUC0_GSUWGMRR0_K1_LBSPPA2048_LBSPPB512_LPA0_MIWT4_2_PLR2_SU32_SUM0_SUS256_SKXCCM4_VWA4_VWB2_WGM1_WGMXCC1_WGMXCCGn1
    SolutionIndex: 95
    SolutionNameMin: Cijk_Ailk_Bljk_BSS_BH_UserArgs_MT128x64x128_MI16x16x1_SN_LDSB1_CLR1_GSU0_GSUC0_GSUWGMRR0_K1_LBSPPA2048_LBSPPB512_LPA0_MIWT4_2_PLR2_SU32_SUM0_SUS256_SKXCCM4_VWA4_VWB2_WGM4_WGMXCC1_WGMXCCGn1
    SolutionIndex: 96
    SolutionNameMin: Cijk_Ailk_Bljk_BSS_BH_UserArgs_MT64x64x128_MI16x16x1_SN_LDSB1_CLR1_GSU0_GSUC0_GSUWGMRR0_K1_LBSPPA1024_LBSPPB512_LPA32_MIWT2_2_PLR2_SU32_SUM0_SUS256_SKXCCM4_VWA2_VWB2_WGM1_WGMXCC1_WGMXCCGn1
    SolutionIndex: 97
    SolutionNameMin: Cijk_Ailk_Bljk_BSS_BH_UserArgs_MT64x64x128_MI16x16x1_SN_LDSB1_CLR1_GSU0_GSUC0_GSUWGMRR0_K1_LBSPPA1024_LBSPPB512_LPA32_MIWT2_2_PLR2_SU32_SUM0_SUS256_SKXCCM4_VWA2_VWB2_WGM4_WGMXCC1_WGMXCCGn1
    SolutionIndex: 98
    SolutionNameMin: Cijk_Ailk_Bljk_BSS_BH_UserArgs_MT64x32x128_MI16x16x1_SN_LDSB1_CLR1_GSU0_GSUC0_GSUWGMRR0_K1_LBSPPA1024_LBSPPB256_LPA32_MIWT2_1_PLR1_SU32_SUM0_SUS256_SKXCCM4_VWA2_VWB1_WGM1_WGMXCC1_WGMXCCGn1
    SolutionIndex: 99
    SolutionNameMin: Cijk_Ailk_Bljk_BSS_BH_UserArgs_MT64x32x128_MI16x16x1_SN_LDSB1_CLR1_GSU0_GSUC0_GSUWGMRR0_K1_LBSPPA1024_LBSPPB256_LPA32_MIWT2_1_PLR2_SU32_SUM0_SUS256_SKXCCM4_VWA2_VWB1_WGM1_WGMXCC1_WGMXCCGn1
    SolutionIndex: 100
    SolutionNameMin: Cijk_Ailk_Bljk_BSS_BH_UserArgs_MT64x32x128_MI16x16x1_SN_LDSB1_CLR1_GSU0_GSUC0_GSUWGMRR0_K1_LBSPPA1024_LBSPPB256_LPA32_MIWT2_1_PLR2_SU32_SUM0_SUS256_SKXCCM4_VWA2_VWB1_WGM2_WGMXCC1_WGMXCCGn1
    SolutionIndex: 101
    SolutionNameMin: Cijk_Ailk_Bljk_BSS_BH_UserArgs_MT64x32x128_MI16x16x1_SN_LDSB1_CLR1_GSU0_GSUC0_GSUWGMRR0_K1_LBSPPA1024_LBSPPB256_LPA32_MIWT2_1_PLR2_SU32_SUM0_SUS256_SKXCCM4_VWA2_VWB1_WGM4_WGMXCC1_WGMXCCGn1
    SolutionIndex: 102
    SolutionNameMin: Cijk_Ailk_Bljk_BSS_BH_UserArgs_MT32x32x128_MI16x16x1_SN_LDSB1_CLR1_GSU0_GSUC0_GSUWGMRR0_K1_LBSPPA512_LBSPPB256_LPA16_MIWT1_1_PLR1_SU32_SUM0_SUS256_SKXCCM4_VWA1_VWB1_WGM1_WGMXCC1_WGMXCCGn1
    SolutionIndex: 103
    SolutionNameMin: Cijk_Ailk_Bljk_BSS_BH_UserArgs_MT32x32x128_MI16x16x1_SN_LDSB1_CLR1_GSU0_GSUC0_GSUWGMRR0_K1_LBSPPA512_LBSPPB256_LPA16_MIWT1_1_PLR2_SU32_SUM0_SUS256_SKXCCM4_VWA1_VWB1_WGM1_WGMXCC1_WGMXCCGn1
    SolutionIndex: 104
    SolutionNameMin: Cijk_Ailk_Bljk_BSS_BH_UserArgs_MT32x32x32_MI16x16x1_SN_LDSB0_CLR1_GSU0_GSUC0_GSUWGMRR0_K1_LBSPPA256_LBSPPB128_LPA16_MIWT1_1_PLR1_SU32_SUM0_SUS256_SKXCCM0_VWA1_VWB1_WGM4_WGMXCC1_WGMXCCGn1
- - - [128, 128, 1, 128, 128, 128, 128, 128]
    - [102, 0.09]
  - - [128, 128, 1, 256, 128, 128, 128, 256]
    - [38, 0.111]
  - - [128, 128, 1, 512, 128, 128, 128, 512]
    - [37, 0.189]
  - - [128, 128, 1, 1024, 128, 128, 128, 1024]
    - [37, 0.286]
  - - [128, 128, 1, 2048, 128, 128, 128, 2048]
    - [92, 0.535]
  - - [128, 128, 1, 4096, 128, 128, 128, 4096]
    - [103, 0.934]
  - - [128, 128, 1, 8192, 128, 128, 128, 8192]
    - [37, 1.484]
  - - [128, 256, 1, 128, 128, 128, 128, 128]
    - [102, 0.174]
  - - [128, 256, 1, 256, 128, 128, 128, 256]
    - [37, 0.217]
  - - [128, 256, 1, 512, 128, 128, 128, 512]
    - [38, 0.367]
  - - [128, 256, 1, 1024, 128, 128, 128, 1024]
    - [102, 0.603]
  - - [128, 256, 1, 2048, 128, 128, 128, 2048]
    - [15, 1.071]
  - - [128, 256, 1, 4096, 128, 128, 128, 4096]
    - [99, 1.647]
  - - [128, 256, 1, 8192, 128, 128, 128, 8192]
    - [99, 2.64]
  - - [128, 512, 1, 128, 128, 128, 128, 128]
    - [103, 0.336]
  - - [128, 512, 1, 256, 128, 128, 128, 256]
    - [37, 0.425]
  - - [128, 512, 1, 512, 128, 128, 128, 512]
    - [16, 0.701]
  - - [128, 512, 1, 1024, 128, 128, 128, 1024]
    - [38, 1.235]
  - - [128, 512, 1, 2048, 128, 128, 128, 2048]
    - [103, 1.889]
  - - [128, 512, 1, 4096, 128, 128, 128, 4096]
    - [91, 2.874]
  - - [128, 512, 1, 8192, 128, 128, 128, 8192]
    - [96, 4.252]
  - - [128, 1024, 1, 128, 128, 128, 128, 128]
    - [98, 0.624]
  - - [128, 1024, 1, 256, 128, 128, 128, 256]
    - [102, 1.059]
  - - [128, 1024, 1, 512, 128, 128, 128, 512]
    - [38, 1.627]
  - - [128, 1024, 1, 1024, 128, 128, 128, 1024]
    - [38, 2.322]
  - - [128, 1024, 1, 2048, 128, 128, 128, 2048]
    - [99, 3.246]
  - - [128, 1024, 1, 4096, 128, 128, 128, 4096]
    - [85, 4.702]
  - - [128, 1024, 1, 8192, 128, 128, 128, 8192]
    - [94, 6.891]
  - - [128, 2048, 1, 128, 128, 128, 128, 128]
    - [99, 1.112]
  - - [128, 2048, 1, 256, 128, 128, 128, 256]
    - [91, 1.864]
  - - [128, 2048, 1, 512, 128, 128, 128, 512]
    - [33, 2.829]
  - - [128, 2048, 1, 1024, 128, 128, 128, 1024]
    - [99, 3.918]
  - - [128, 2048, 1, 2048, 128, 128, 128, 2048]
    - [69, 4.538]
  - - [128, 2048, 1, 4096, 128, 128, 128, 4096]
    - [79, 7.086]
  - - [128, 2048, 1, 8192, 128, 128, 128, 8192]
    - [75, 10.057]
  - - [128, 4096, 1, 128, 128, 128, 128, 128]
    - [86, 1.899]
  - - [128, 4096, 1, 256, 128, 128, 128, 256]
    - [85, 3.151]
  - - [128, 4096, 1, 512, 128, 128, 128, 512]
    - [86, 4.652]
  - - [128, 4096, 1, 1024, 128, 128, 128, 1024]
    - [80, 5.503]
  - - [128, 4096, 1, 2048, 128, 128, 128, 2048]
    - [88, 6.186]
  - - [128, 4096, 1, 4096, 128, 128, 128, 4096]
    - [11, 8.006]
  - - [128, 4096, 1, 8192, 128, 128, 128, 8192]
    - [17, 11.517]
  - - [128, 8192, 1, 128, 128, 128, 128, 128]
    - [65, 2.922]
  - - [128, 8192, 1, 256, 128, 128, 128, 256]
    - [77, 4.668]
  - - [128, 8192, 1, 512, 128, 128, 128, 512]
    - [79, 6.696]
  - - [128, 8192, 1, 1024, 128, 128, 128, 1024]
    - [93, 7.245]
  - - [128, 8192, 1, 2048, 128, 128, 128, 2048]
    - [79, 8.554]
  - - [128, 8192, 1, 4096, 128, 128, 128, 4096]
    - [29, 10.512]
  - - [128, 8192, 1, 8192, 128, 128, 128, 8192]
    - [29, 11.784]
  - - [256, 128, 1, 128, 256, 256, 256, 128]
    - [38, 0.172]
  - - [256, 128, 1, 256, 256, 256, 256, 256]
    - [38, 0.218]
  - - [256, 128, 1, 512, 256, 256, 256, 512]
    - [37, 0.368]
  - - [256, 128, 1, 1024, 256, 256, 256, 1024]
    - [102, 0.603]
  - - [256, 128, 1, 2048, 256, 256, 256, 2048]
    - [15, 1.055]
  - - [256, 128, 1, 4096, 256, 256, 256, 4096]
    - [99, 1.665]
  - - [256, 128, 1, 8192, 256, 256, 256, 8192]
    - [36, 2.551]
  - - [256, 256, 1, 128, 256, 256, 256, 128]
    - [102, 0.335]
  - - [256, 256, 1, 256, 256, 256, 256, 256]
    - [38, 0.421]
  - - [256, 256, 1, 512, 256, 256, 256, 512]
    - [15, 0.703]
  - - [256, 256, 1, 1024, 256, 256, 256, 1024]
    - [37, 1.228]
  - - [256, 256, 1, 2048, 256, 256, 256, 2048]
    - [38, 1.873]
  - - [256, 256, 1, 4096, 256, 256, 256, 4096]
    - [91, 2.89]
  - - [256, 256, 1, 8192, 256, 256, 256, 8192]
    - [101, 3.983]
  - - [256, 512, 1, 128, 256, 256, 256, 128]
    - [99, 0.628]
  - - [256, 512, 1, 256, 256, 256, 256, 256]
    - [102, 1.04]
  - - [256, 512, 1, 512, 256, 256, 256, 512]
    - [37, 1.619]
  - - [256, 512, 1, 1024, 256, 256, 256, 1024]
    - [37, 2.304]
  - - [256, 512, 1, 2048, 256, 256, 256, 2048]
    - [98, 3.228]
  - - [256, 512, 1, 4096, 256, 256, 256, 4096]
    - [85, 4.71]
  - - [256, 512, 1, 8192, 256, 256, 256, 8192]
    - [29, 6.695]
  - - [256, 1024, 1, 128, 256, 256, 256, 128]
    - [90, 1.108]
  - - [256, 1024, 1, 256, 256, 256, 256, 256]
    - [91, 1.848]
  - - [256, 1024, 1, 512, 256, 256, 256, 512]
    - [91, 2.816]
  - - [256, 1024, 1, 1024, 256, 256, 256, 1024]
    - [99, 3.931]
  - - [256, 1024, 1, 2048, 256, 256, 256, 2048]
    - [67, 4.57]
  - - [256, 1024, 1, 4096, 256, 256, 256, 4096]
    - [79, 7.129]
  - - [256, 1024, 1, 8192, 256, 256, 256, 8192]
    - [75, 9.993]
  - - [256, 2048, 1, 128, 256, 256, 256, 128]
    - [86, 1.889]
  - - [256, 2048, 1, 256, 256, 256, 256, 256]
    - [86, 3.159]
  - - [256, 2048, 1, 512, 256, 256, 256, 512]
    - [86, 4.655]
  - - [256, 2048, 1, 1024, 256, 256, 256, 1024]
    - [80, 5.595]
  - - [256, 2048, 1, 2048, 256, 256, 256, 2048]
    - [86, 6.369]
  - - [256, 2048, 1, 4096, 256, 256, 256, 4096]
    - [73, 8.186]
  - - [256, 2048, 1, 8192, 256, 256, 256, 8192]
    - [71, 11.721]
  - - [256, 4096, 1, 128, 256, 256, 256, 128]
    - [65, 2.828]
  - - [256, 4096, 1, 256, 256, 256, 256, 256]
    - [77, 4.618]
  - - [256, 4096, 1, 512, 256, 256, 256, 512]
    - [84, 6.737]
  - - [256, 4096, 1, 1024, 256, 256, 256, 1024]
    - [94, 7.328]
  - - [256, 4096, 1, 2048, 256, 256, 256, 2048]
    - [79, 8.673]
  - - [256, 4096, 1, 4096, 256, 256, 256, 4096]
    - [6, 11.075]
  - - [256, 4096, 1, 8192, 256, 256, 256, 8192]
    - [18, 11.938]
  - - [256, 8192, 1, 128, 256, 256, 256, 128]
    - [56, 3.999]
  - - [256, 8192, 1, 256, 256, 256, 256, 256]
    - [55, 5.807]
  - - [256, 8192, 1, 512, 256, 256, 256, 512]
    - [74, 7.473]
  - - [256, 8192, 1, 1024, 256, 256, 256, 1024]
    - [79, 9.303]
  - - [256, 8192, 1, 2048, 256, 256, 256, 2048]
    - [80, 10.638]
  - - [256, 8192, 1, 4096, 256, 256, 256, 4096]
    - [10, 11.888]
  - - [256, 8192, 1, 8192, 256, 256, 256, 8192]
    - [2, 14.367]
  - - [512, 128, 1, 128, 512, 512, 512, 128]
    - [37, 0.334]
  - - [512, 128, 1, 256, 512, 512, 512, 256]
    - [102, 0.43]
  - - [512, 128, 1, 512, 512, 512, 512, 512]
    - [15, 0.706]
  - - [512, 128, 1, 1024, 512, 512, 512, 1024]
    - [37, 1.248]
  - - [512, 128, 1, 2048, 512, 512, 512, 2048]
    - [38, 1.876]
  - - [512, 128, 1, 4096, 512, 512, 512, 4096]
    - [33, 2.805]
  - - [512, 128, 1, 8192, 512, 512, 512, 8192]
    - [97, 4.024]
  - - [512, 256, 1, 128, 512, 512, 512, 128]
    - [35, 0.623]
  - - [512, 256, 1, 256, 512, 512, 512, 256]
    - [37, 1.035]
  - - [512, 256, 1, 512, 512, 512, 512, 512]
    - [102, 1.615]
  - - [512, 256, 1, 1024, 512, 512, 512, 1024]
    - [38, 2.315]
  - - [512, 256, 1, 2048, 512, 512, 512, 2048]
    - [99, 3.265]
  - - [512, 256, 1, 4096, 512, 512, 512, 4096]
    - [89, 4.622]
  - - [512, 256, 1, 8192, 512, 512, 512, 8192]
    - [80, 6.685]
  - - [512, 512, 1, 128, 512, 512, 512, 128]
    - [99, 1.111]
  - - [512, 512, 1, 256, 512, 512, 512, 256]
    - [99, 1.859]
  - - [512, 512, 1, 512, 512, 512, 512, 512]
    - [91, 2.824]
  - - [512, 512, 1, 1024, 512, 512, 512, 1024]
    - [99, 3.91]
  - - [512, 512, 1, 2048, 512, 512, 512, 2048]
    - [70, 4.779]
  - - [512, 512, 1, 4096, 512, 512, 512, 4096]
    - [28, 7.072]
  - - [512, 512, 1, 8192, 512, 512, 512, 8192]
    - [26, 9.999]
  - - [512, 1024, 1, 128, 512, 512, 512, 128]
    - [86, 1.905]
  - - [512, 1024, 1, 256, 512, 512, 512, 256]
    - [86, 3.179]
  - - [512, 1024, 1, 512, 512, 512, 512, 512]
    - [86, 4.633]
  - - [512, 1024, 1, 1024, 512, 512, 512, 1024]
    - [80, 5.587]
  - - [512, 1024, 1, 2048, 512, 512, 512, 2048]
    - [85, 6.331]
  - - [512, 1024, 1, 4096, 512, 512, 512, 4096]
    - [19, 8.203]
  - - [512, 1024, 1, 8192, 512, 512, 512, 8192]
    - [20, 11.74]
  - - [512, 2048, 1, 128, 512, 512, 512, 128]
    - [65, 2.945]
  - - [512, 2048, 1, 256, 512, 512, 512, 256]
    - [66, 4.732]
  - - [512, 2048, 1, 512, 512, 512, 512, 512]
    - [80, 6.811]
  - - [512, 2048, 1, 1024, 512, 512, 512, 1024]
    - [94, 7.516]
  - - [512, 2048, 1, 2048, 512, 512, 512, 2048]
    - [80, 8.781]
  - - [512, 2048, 1, 4096, 512, 512, 512, 4096]
    - [3, 11.102]
  - - [512, 2048, 1, 8192, 512, 512, 512, 8192]
    - [22, 11.859]
  - - [512, 4096, 1, 128, 512, 512, 512, 128]
    - [59, 3.976]
  - - [512, 4096, 1, 256, 512, 512, 512, 256]
    - [64, 5.907]
  - - [512, 4096, 1, 512, 512, 512, 512, 512]
    - [26, 7.531]
  - - [512, 4096, 1, 1024, 512, 512, 512, 1024]
    - [80, 9.378]
  - - [512, 4096, 1, 2048, 512, 512, 512, 2048]
    - [80, 10.71]
  - - [512, 4096, 1, 4096, 512, 512, 512, 4096]
    - [3, 11.715]
  - - [512, 4096, 1, 8192, 512, 512, 512, 8192]
    - [48, 14.32]
  - - [512, 8192, 1, 128, 512, 512, 512, 128]
    - [4, 5.219]
  - - [512, 8192, 1, 256, 512, 512, 512, 256]
    - [46, 7.638]
  - - [512, 8192, 1, 512, 512, 512, 512, 512]
    - [61, 9.326]
  - - [512, 8192, 1, 1024, 512, 512, 512, 1024]
    - [58, 11.328]
  - - [512, 8192, 1, 2048, 512, 512, 512, 2048]
    - [74, 12.656]
  - - [512, 8192, 1, 4096, 512, 512, 512, 4096]
    - [7, 14.49]
  - - [512, 8192, 1, 8192, 512, 512, 512, 8192]
    - [5, 16.446]
  - - [1024, 128, 1, 128, 1024, 1024, 1024, 128]
    - [35, 0.621]
  - - [1024, 128, 1, 256, 1024, 1024, 1024, 256]
    - [102, 1.038]
  - - [1024, 128, 1, 512, 1024, 1024, 1024, 512]
    - [37, 1.611]
  - - [1024, 128, 1, 1024, 1024, 1024, 1024, 1024]
    - [38, 2.294]
  - - [1024, 128, 1, 2048, 1024, 1024, 1024, 2048]
    - [36, 3.196]
  - - [1024, 128, 1, 4096, 1024, 1024, 1024, 4096]
    - [87, 4.607]
  - - [1024, 128, 1, 8192, 1024, 1024, 1024, 8192]
    - [29, 6.663]
  - - [1024, 256, 1, 128, 1024, 1024, 1024, 128]
    - [99, 1.122]
  - - [1024, 256, 1, 256, 1024, 1024, 1024, 256]
    - [91, 1.852]
  - - [1024, 256, 1, 512, 1024, 1024, 1024, 512]
    - [91, 2.834]
  - - [1024, 256, 1, 1024, 1024, 1024, 1024, 1024]
    - [99, 3.895]
  - - [1024, 256, 1, 2048, 1024, 1024, 1024, 2048]
    - [70, 4.811]
  - - [1024, 256, 1, 4096, 1024, 1024, 1024, 4096]
    - [84, 7.017]
  - - [1024, 256, 1, 8192, 1024, 1024, 1024, 8192]
    - [27, 9.916]
  - - [1024, 512, 1, 128, 1024, 1024, 1024, 128]
    - [85, 1.899]
  - - [1024, 512, 1, 256, 1024, 1024, 1024, 256]
    - [86, 3.149]
  - - [1024, 512, 1, 512, 1024, 1024, 1024, 512]
    - [86, 4.573]
  - - [1024, 512, 1, 1024, 1024, 1024, 1024, 1024]
    - [80, 5.521]
  - - [1024, 512, 1, 2048, 1024, 1024, 1024, 2048]
    - [11, 6.164]
  - - [1024, 512, 1, 4096, 1024, 1024, 1024, 4096]
    - [72, 8.19]
  - - [1024, 512, 1, 8192, 1024, 1024, 1024, 8192]
    - [19, 11.763]
  - - [1024, 1024, 1, 128, 1024, 1024, 1024, 128]
    - [65, 2.935]
  - - [1024, 1024, 1, 256, 1024, 1024, 1024, 256]
    - [76, 4.662]
  - - [1024, 1024, 1, 512, 1024, 1024, 1024, 512]
    - [82, 6.775]
  - - [1024, 1024, 1, 1024, 1024, 1024, 1024, 1024]
    - [94, 7.387]
  - - [1024, 1024, 1, 2048, 1024, 1024, 1024, 2048]
    - [84, 8.628]
  - - [1024, 1024, 1, 4096, 1024, 1024, 1024, 4096]
    - [8, 11.088]
  - - [1024, 1024, 1, 8192, 1024, 1024, 1024, 8192]
    - [23, 11.836]
  - - [1024, 2048, 1, 128, 1024, 1024, 1024, 128]
    - [61, 3.954]
  - - [1024, 2048, 1, 256, 1024, 1024, 1024, 256]
    - [57, 5.9]
  - - [1024, 2048, 1, 512, 1024, 1024, 1024, 512]
    - [26, 7.6]
  - - [1024, 2048, 1, 1024, 1024, 1024, 1024, 1024]
    - [80, 9.463]
  - - [1024, 2048, 1, 2048, 1024, 1024, 1024, 2048]
    - [79, 10.566]
  - - [1024, 2048, 1, 4096, 1024, 1024, 1024, 4096]
    - [7, 11.651]
  - - [1024, 2048, 1, 8192, 1024, 1024, 1024, 8192]
    - [50, 14.393]
  - - [1024, 4096, 1, 128, 1024, 1024, 1024, 128]
    - [4, 5.192]
  - - [1024, 4096, 1, 256, 1024, 1024, 1024, 256]
    - [53, 7.623]
  - - [1024, 4096, 1, 512, 1024, 1024, 1024, 512]
    - [59, 9.514]
  - - [1024, 4096, 1, 1024, 1024, 1024, 1024, 1024]
    - [56, 11.389]
  - - [1024, 4096, 1, 2048, 1024, 1024, 1024, 2048]
    - [26, 12.507]
  - - [1024, 4096, 1, 4096, 1024, 1024, 1024, 4096]
    - [47, 14.385]
  - - [1024, 4096, 1, 8192, 1024, 1024, 1024, 8192]
    - [51, 16.319]
  - - [1024, 8192, 1, 128, 1024, 1024, 1024, 128]
    - [51, 5.418]
  - - [1024, 8192, 1, 256, 1024, 1024, 1024, 256]
    - [47, 8.012]
  - - [1024, 8192, 1, 512, 1024, 1024, 1024, 512]
    - [47, 11.335]
  - - [1024, 8192, 1, 1024, 1024, 1024, 1024, 1024]
    - [46, 13.944]
  - - [1024, 8192, 1, 2048, 1024, 1024, 1024, 2048]
    - [54, 14.523]
  - - [1024, 8192, 1, 4096, 1024, 1024, 1024, 4096]
    - [47, 16.219]
  - - [1024, 8192, 1, 8192, 1024, 1024, 1024, 8192]
    - [46, 17.926]
  - - [2048, 128, 1, 128, 2048, 2048, 2048, 128]
    - [99, 1.109]
  - - [2048, 128, 1, 256, 2048, 2048, 2048, 256]
    - [91, 1.854]
  - - [2048, 128, 1, 512, 2048, 2048, 2048, 512]
    - [91, 2.828]
  - - [2048, 128, 1, 1024, 2048, 2048, 2048, 1024]
    - [100, 3.841]
  - - [2048, 128, 1, 2048, 2048, 2048, 2048, 2048]
    - [68, 4.73]
  - - [2048, 128, 1, 4096, 2048, 2048, 2048, 4096]
    - [28, 7.073]
  - - [2048, 128, 1, 8192, 2048, 2048, 2048, 8192]
    - [24, 9.915]
  - - [2048, 256, 1, 128, 2048, 2048, 2048, 128]
    - [85, 1.88]
  - - [2048, 256, 1, 256, 2048, 2048, 2048, 256]
    - [86, 3.152]
  - - [2048, 256, 1, 512, 2048, 2048, 2048, 512]
    - [86, 4.578]
  - - [2048, 256, 1, 1024, 2048, 2048, 2048, 1024]
    - [84, 5.455]
  - - [2048, 256, 1, 2048, 2048, 2048, 2048, 2048]
    - [11, 6.211]
  - - [2048, 256, 1, 4096, 2048, 2048, 2048, 4096]
    - [18, 8.122]
  - - [2048, 256, 1, 8192, 2048, 2048, 2048, 8192]
    - [20, 11.602]
  - - [2048, 512, 1, 128, 2048, 2048, 2048, 128]
    - [30, 2.91]
  - - [2048, 512, 1, 256, 2048, 2048, 2048, 256]
    - [77, 4.636]
  - - [2048, 512, 1, 512, 2048, 2048, 2048, 512]
    - [84, 6.64]
  - - [2048, 512, 1, 1024, 2048, 2048, 2048, 1024]
    - [95, 7.265]
  - - [2048, 512, 1, 2048, 2048, 2048, 2048, 2048]
    - [84, 8.588]
  - - [2048, 512, 1, 4096, 2048, 2048, 2048, 4096]
    - [3, 11.013]
  - - [2048, 512, 1, 8192, 2048, 2048, 2048, 8192]
    - [19, 11.88]
  - - [2048, 1024, 1, 128, 2048, 2048, 2048, 128]
    - [56, 3.967]
  - - [2048, 1024, 1, 256, 2048, 2048, 2048, 256]
    - [14, 5.881]
  - - [2048, 1024, 1, 512, 2048, 2048, 2048, 512]
    - [25, 7.61]
  - - [2048, 1024, 1, 1024, 2048, 2048, 2048, 1024]
    - [28, 9.385]
  - - [2048, 1024, 1, 2048, 2048, 2048, 2048, 2048]
    - [28, 10.509]
  - - [2048, 1024, 1, 4096, 2048, 2048, 2048, 4096]
    - [4, 11.692]
  - - [2048, 1024, 1, 8192, 2048, 2048, 2048, 8192]
    - [49, 14.318]
  - - [2048, 2048, 1, 128, 2048, 2048, 2048, 128]
    - [4, 5.239]
  - - [2048, 2048, 1, 256, 2048, 2048, 2048, 256]
    - [54, 7.769]
  - - [2048, 2048, 1, 512, 2048, 2048, 2048, 512]
    - [11, 9.512]
  - - [2048, 2048, 1, 1024, 2048, 2048, 2048, 1024]
    - [11, 11.243]
  - - [2048, 2048, 1, 2048, 2048, 2048, 2048, 2048]
    - [25, 12.527]
  - - [2048, 2048, 1, 4096, 2048, 2048, 2048, 4096]
    - [46, 14.363]
  - - [2048, 2048, 1, 8192, 2048, 2048, 2048, 8192]
    - [46, 16.282]
  - - [2048, 4096, 1, 128, 2048, 2048, 2048, 128]
    - [51, 5.531]
  - - [2048, 4096, 1, 256, 2048, 2048, 2048, 256]
    - [48, 8.125]
  - - [2048, 4096, 1, 512, 2048, 2048, 2048, 512]
    - [48, 11.253]
  - - [2048, 4096, 1, 1024, 2048, 2048, 2048, 1024]
    - [5, 13.824]
  - - [2048, 4096, 1, 2048, 2048, 2048, 2048, 2048]
    - [51, 14.364]
  - - [2048, 4096, 1, 4096, 2048, 2048, 2048, 4096]
    - [50, 16.198]
  - - [2048, 4096, 1, 8192, 2048, 2048, 2048, 8192]
    - [46, 17.919]
  - - [2048, 8192, 1, 128, 2048, 2048, 2048, 128]
    - [56, 5.569]
  - - [2048, 8192, 1, 256, 2048, 2048, 2048, 256]
    - [45, 7.856]
  - - [2048, 8192, 1, 512, 2048, 2048, 2048, 512]
    - [41, 10.977]
  - - [2048, 8192, 1, 1024, 2048, 2048, 2048, 1024]
    - [42, 13.652]
  - - [2048, 8192, 1, 2048, 2048, 2048, 2048, 2048]
    - [46, 15.81]
  - - [2048, 8192, 1, 4096, 2048, 2048, 2048, 4096]
    - [50, 17.5]
  - - [2048, 8192, 1, 8192, 2048, 2048, 2048, 8192]
    - [44, 18.773]
  - - [4096, 128, 1, 128, 4096, 4096, 4096, 128]
    - [32, 1.828]
  - - [4096, 128, 1, 256, 4096, 4096, 4096, 256]
    - [31, 3.04]
  - - [4096, 128, 1, 512, 4096, 4096, 4096, 512]
    - [86, 4.383]
  - - [4096, 128, 1, 1024, 4096, 4096, 4096, 1024]
    - [79, 5.435]
  - - [4096, 128, 1, 2048, 4096, 4096, 4096, 2048]
    - [89, 6.035]
  - - [4096, 128, 1, 4096, 4096, 4096, 4096, 4096]
    - [12, 8.262]
  - - [4096, 128, 1, 8192, 4096, 4096, 4096, 8192]
    - [19, 11.711]
  - - [4096, 256, 1, 128, 4096, 4096, 4096, 128]
    - [65, 2.916]
  - - [4096, 256, 1, 256, 4096, 4096, 4096, 256]
    - [78, 4.616]
  - - [4096, 256, 1, 512, 4096, 4096, 4096, 512]
    - [84, 6.739]
  - - [4096, 256, 1, 1024, 4096, 4096, 4096, 1024]
    - [95, 7.289]
  - - [4096, 256, 1, 2048, 4096, 4096, 4096, 2048]
    - [84, 8.652]
  - - [4096, 256, 1, 4096, 4096, 4096, 4096, 4096]
    - [4, 11.135]
  - - [4096, 256, 1, 8192, 4096, 4096, 4096, 8192]
    - [21, 11.898]
  - - [4096, 512, 1, 128, 4096, 4096, 4096, 128]
    - [13, 3.908]
  - - [4096, 512, 1, 256, 4096, 4096, 4096, 256]
    - [13, 5.84]
  - - [4096, 512, 1, 512, 4096, 4096, 4096, 512]
    - [24, 7.409]
  - - [4096, 512, 1, 1024, 4096, 4096, 4096, 1024]
    - [28, 9.277]
  - - [4096, 512, 1, 2048, 4096, 4096, 4096, 2048]
    - [28, 10.505]
  - - [4096, 512, 1, 4096, 4096, 4096, 4096, 4096]
    - [2, 11.623]
  - - [4096, 512, 1, 8192, 4096, 4096, 4096, 8192]
    - [47, 14.37]
  - - [4096, 1024, 1, 128, 4096, 4096, 4096, 128]
    - [3, 5.265]
  - - [4096, 1024, 1, 256, 4096, 4096, 4096, 256]
    - [5, 7.716]
  - - [4096, 1024, 1, 512, 4096, 4096, 4096, 512]
    - [11, 9.407]
  - - [4096, 1024, 1, 1024, 4096, 4096, 4096, 1024]
    - [11, 11.183]
  - - [4096, 1024, 1, 2048, 4096, 4096, 4096, 2048]
    - [74, 12.628]
  - - [4096, 1024, 1, 4096, 4096, 4096, 4096, 4096]
    - [53, 14.297]
  - - [4096, 1024, 1, 8192, 4096, 4096, 4096, 8192]
    - [47, 16.357]
  - - [4096, 2048, 1, 128, 4096, 4096, 4096, 128]
    - [50, 5.508]
  - - [4096, 2048, 1, 256, 4096, 4096, 4096, 256]
    - [50, 8.215]
  - - [4096, 2048, 1, 512, 4096, 4096, 4096, 512]
    - [50, 11.302]
  - - [4096, 2048, 1, 1024, 4096, 4096, 4096, 1024]
    - [49, 13.778]
  - - [4096, 2048, 1, 2048, 4096, 4096, 4096, 2048]
    - [48, 14.386]
  - - [4096, 2048, 1, 4096, 4096, 4096, 4096, 4096]
    - [46, 16.344]
  - - [4096, 2048, 1, 8192, 4096, 4096, 4096, 8192]
    - [47, 17.829]
  - - [4096, 4096, 1, 128, 4096, 4096, 4096, 128]
    - [62, 5.489]
  - - [4096, 4096, 1, 256, 4096, 4096, 4096, 256]
    - [42, 7.747]
  - - [4096, 4096, 1, 512, 4096, 4096, 4096, 512]
    - [1, 10.854]
  - - [4096, 4096, 1, 1024, 4096, 4096, 4096, 1024]
    - [42, 13.605]
  - - [4096, 4096, 1, 2048, 4096, 4096, 4096, 2048]
    - [47, 15.792]
  - - [4096, 4096, 1, 4096, 4096, 4096, 4096, 4096]
    - [47, 17.544]
  - - [4096, 4096, 1, 8192, 4096, 4096, 4096, 8192]
    - [39, 18.89]
  - - [4096, 8192, 1, 128, 4096, 4096, 4096, 128]
    - [28, 4.635]
  - - [4096, 8192, 1, 256, 4096, 4096, 4096, 256]
    - [9, 6.923]
  - - [4096, 8192, 1, 512, 4096, 4096, 4096, 512]
    - [52, 10.224]
  - - [4096, 8192, 1, 1024, 4096, 4096, 4096, 1024]
    - [52, 13.625]
  - - [4096, 8192, 1, 2048, 4096, 4096, 4096, 2048]
    - [52, 16.322]
  - - [4096, 8192, 1, 4096, 4096, 4096, 4096, 4096]
    - [44, 18.13]
  - - [4096, 8192, 1, 8192, 4096, 4096, 4096, 8192]
    - [39, 19.37]
  - - [8192, 128, 1, 128, 8192, 8192, 8192, 128]
    - [81, 2.852]
  - - [8192, 128, 1, 256, 8192, 8192, 8192, 256]
    - [76, 4.676]
  - - [8192, 128, 1, 512, 8192, 8192, 8192, 512]
    - [83, 6.583]
  - - [8192, 128, 1, 1024, 8192, 8192, 8192, 1024]
    - [34, 7.002]
  - - [8192, 128, 1, 2048, 8192, 8192, 8192, 2048]
    - [84, 8.559]
  - - [8192, 128, 1, 4096, 8192, 8192, 8192, 4096]
    - [5, 11.194]
  - - [8192, 128, 1, 8192, 8192, 8192, 8192, 8192]
    - [22, 11.757]
  - - [8192, 256, 1, 128, 8192, 8192, 8192, 128]
    - [63, 3.861]
  - - [8192, 256, 1, 256, 8192, 8192, 8192, 256]
    - [60, 5.81]
  - - [8192, 256, 1, 512, 8192, 8192, 8192, 512]
    - [24, 7.403]
  - - [8192, 256, 1, 1024, 8192, 8192, 8192, 1024]
    - [83, 9.187]
  - - [8192, 256, 1, 2048, 8192, 8192, 8192, 2048]
    - [83, 10.469]
  - - [8192, 256, 1, 4096, 8192, 8192, 8192, 4096]
    - [58, 11.883]
  - - [8192, 256, 1, 8192, 8192, 8192, 8192, 8192]
    - [46, 14.336]
  - - [8192, 512, 1, 128, 8192, 8192, 8192, 128]
    - [2, 5.255]
  - - [8192, 512, 1, 256, 8192, 8192, 8192, 256]
    - [52, 7.67]
  - - [8192, 512, 1, 512, 8192, 8192, 8192, 512]
    - [11, 9.314]
  - - [8192, 512, 1, 1024, 8192, 8192, 8192, 1024]
    - [11, 11.168]
  - - [8192, 512, 1, 2048, 8192, 8192, 8192, 2048]
    - [25, 12.582]
  - - [8192, 512, 1, 4096, 8192, 8192, 8192, 4096]
    - [48, 14.54]
  - - [8192, 512, 1, 8192, 8192, 8192, 8192, 8192]
    - [5, 16.268]
  - - [8192, 1024, 1, 128, 8192, 8192, 8192, 128]
    - [46, 5.37]
  - - [8192, 1024, 1, 256, 8192, 8192, 8192, 256]
    - [48, 8.125]
  - - [8192, 1024, 1, 512, 8192, 8192, 8192, 512]
    - [46, 11.207]
  - - [8192, 1024, 1, 1024, 8192, 8192, 8192, 1024]
    - [50, 13.719]
  - - [8192, 1024, 1, 2048, 8192, 8192, 8192, 2048]
    - [47, 14.329]
  - - [8192, 1024, 1, 4096, 8192, 8192, 8192, 4096]
    - [47, 16.374]
  - - [8192, 1024, 1, 8192, 8192, 8192, 8192, 8192]
    - [48, 17.881]
  - - [8192, 2048, 1, 128, 8192, 8192, 8192, 128]
    - [56, 5.347]
  - - [8192, 2048, 1, 256, 8192, 8192, 8192, 256]
    - [41, 7.747]
  - - [8192, 2048, 1, 512, 8192, 8192, 8192, 512]
    - [41, 10.848]
  - - [8192, 2048, 1, 1024, 8192, 8192, 8192, 1024]
    - [49, 13.58]
  - - [8192, 2048, 1, 2048, 8192, 8192, 8192, 2048]
    - [47, 15.784]
  - - [8192, 2048, 1, 4096, 8192, 8192, 8192, 4096]
    - [46, 17.557]
  - - [8192, 2048, 1, 8192, 8192, 8192, 8192, 8192]
    - [42, 18.9]
  - - [8192, 4096, 1, 128, 8192, 8192, 8192, 128]
    - [28, 4.561]
  - - [8192, 4096, 1, 256, 8192, 8192, 8192, 256]
    - [11, 6.877]
  - - [8192, 4096, 1, 512, 8192, 8192, 8192, 512]
    - [53, 10.04]
  - - [8192, 4096, 1, 1024, 8192, 8192, 8192, 1024]
    - [53, 13.479]
  - - [8192, 4096, 1, 2048, 8192, 8192, 8192, 2048]
    - [54, 16.322]
  - - [8192, 4096, 1, 4096, 8192, 8192, 8192, 4096]
    - [40, 18.365]
  - - [8192, 4096, 1, 8192, 8192, 8192, 8192, 8192]
    - [39, 19.381]
  - - [8192, 8192, 1, 128, 8192, 8192, 8192, 128]
    - [3, 4.625]
  - - [8192, 8192, 1, 256, 8192, 8192, 8192, 256]
    - [52, 7.456]
  - - [8192, 8192, 1, 512, 8192, 8192, 8192, 512]
    - [52, 11.017]
  - - [8192, 8192, 1, 1024, 8192, 8192, 8192, 1024]
    - [52, 14.448]
  - - [8192, 8192, 1, 2048, 8192, 8192, 8192, 2048]
    - [43, 17.229]
  - - [8192, 8192, 1, 4096, 8192, 8192, 8192, 4096]
    - [44, 18.904]
  - - [8192, 8192, 1, 8192, 8192, 8192, 8192, 8192]
    - [0, 19.618]
  - - [1, 1, 1, 32, 1, 1, 1, 32]
    - [104, 0.0]
- null
- null
- DeviceEfficiency
- GridBased
