library/src/amd_detail/rocblaslt/src/Tensile/Logic/streamk/gfx942_80cu/aquavanjaram942_Cijk_Ailk_Bjlk_HHS_BH_UserArgs.yaml
- {MinimumRequiredVersion: 4.33.0}
- aquavanjaram942
- {Architecture: gfx942, CUCount: 80}
- [Device 0049, Device 0050]
    SolutionIndex: 0
    SolutionNameMin: Cijk_Ailk_Bjlk_HHS_BH_UserArgs_MT256x256x32_MI16x16x1_SN_LDSB0_CLR1_GSU0_GSUC0_GSUWGMRR0_K1_LBSPPA2048_LBSPPB2048_LPA0_LPB0_MIWT8_8_PLR1_SU32_SUM0_SUS256_SKXCCM0_VWA8_VWB8_WGM1_WGMXCC1_WGMXCCGn1
    SolutionIndex: 1
    SolutionNameMin: Cijk_Ailk_Bjlk_HHS_BH_UserArgs_MT128x256x32_MI16x16x1_SN_LDSB1_CLR1_GSU0_GSUC0_GSUWGMRR0_K1_LBSPPA1024_LBSPPB2048_LPA0_LPB32_MIWT4_8_PLR1_SU32_SUM0_SUS256_SKXCCM0_VWA4_VWB2_WGM1_WGMXCC1_WGMXCCGn1
    SolutionIndex: 2
    SolutionNameMin: Cijk_Ailk_Bjlk_HHS_BH_UserArgs_MT128x256x32_MI16x16x1_SN_LDSB1_CLR1_GSU0_GSUC0_GSUWGMRR0_K1_LBSPPA1024_LBSPPB2048_LPA32_LPB0_MIWT4_8_PLR1_SU32_SUM0_SUS256_SKXCCM0_VWA2_VWB4_WGM1_WGMXCC1_WGMXCCGn1
    SolutionIndex: 3
    SolutionNameMin: Cijk_Ailk_Bjlk_HHS_BH_UserArgs_MT128x256x32_MI16x16x1_SN_LDSB1_CLR1_GSU0_GSUC0_GSUWGMRR0_K1_LBSPPA1024_LBSPPB2048_LPA32_LPB0_MIWT4_8_PLR1_SU32_SUM0_SUS256_SKXCCM0_VWA2_VWB8_WGM1_WGMXCC1_WGMXCCGn1
    SolutionIndex: 4
    SolutionNameMin: Cijk_Ailk_Bjlk_HHS_BH_UserArgs_MT128x256x32_MI16x16x1_SN_LDSB1_CLR1_GSU0_GSUC0_GSUWGMRR0_K1_LBSPPA1024_LBSPPB2048_LPA0_LPB32_MIWT4_8_PLR1_SU32_SUM0_SUS256_SKXCCM0_VWA4_VWB2_WGM2_WGMXCC1_WGMXCCGn1
    SolutionIndex: 5
    SolutionNameMin: Cijk_Ailk_Bjlk_HHS_BH_UserArgs_MT128x256x32_MI16x16x1_SN_LDSB1_CLR1_GSU0_GSUC0_GSUWGMRR0_K1_LBSPPA1024_LBSPPB2048_LPA32_LPB0_MIWT4_8_PLR1_SU32_SUM0_SUS256_SKXCCM0_VWA2_VWB4_WGM2_WGMXCC1_WGMXCCGn1
    SolutionIndex: 6
    SolutionNameMin: Cijk_Ailk_Bjlk_HHS_BH_UserArgs_MT128x256x32_MI16x16x1_SN_LDSB1_CLR1_GSU0_GSUC0_GSUWGMRR0_K1_LBSPPA1024_LBSPPB2048_LPA0_LPB32_MIWT4_8_PLR1_SU32_SUM0_SUS256_SKXCCM0_VWA4_VWB2_WGM4_WGMXCC1_WGMXCCGn1
    SolutionIndex: 7
    SolutionNameMin: Cijk_Ailk_Bjlk_HHS_BH_UserArgs_MT256x128x32_MI16x16x1_SN_LDSB1_CLR1_GSU0_GSUC0_GSUWGMRR0_K1_LBSPPA2048_LBSPPB1024_LPA0_LPB16_MIWT8_4_PLR1_SU32_SUM0_SUS256_SKXCCM0_VWA8_VWB1_WGM1_WGMXCC1_WGMXCCGn1
    SolutionIndex: 8
    SolutionNameMin: Cijk_Ailk_Bjlk_HHS_BH_UserArgs_MT256x128x32_MI16x16x1_SN_LDSB1_CLR1_GSU0_GSUC0_GSUWGMRR0_K1_LBSPPA2048_LBSPPB1024_LPA0_LPB32_MIWT8_4_PLR1_SU32_SUM0_SUS256_SKXCCM0_VWA8_VWB2_WGM1_WGMXCC1_WGMXCCGn1
    SolutionIndex: 9
    SolutionNameMin: Cijk_Ailk_Bjlk_HHS_BH_UserArgs_MT256x128x32_MI16x16x1_SN_LDSB1_CLR1_GSU0_GSUC0_GSUWGMRR0_K1_LBSPPA2048_LBSPPB1024_LPA0_LPB0_MIWT8_4_PLR1_SU32_SUM0_SUS256_SKXCCM0_VWA8_VWB4_WGM1_WGMXCC1_WGMXCCGn1
    SolutionIndex: 10
    SolutionNameMin: Cijk_Ailk_Bjlk_HHS_BH_UserArgs_MT256x128x32_MI16x16x1_SN_LDSB1_CLR1_GSU0_GSUC0_GSUWGMRR0_K1_LBSPPA2048_LBSPPB1024_LPA0_LPB16_MIWT8_4_PLR1_SU32_SUM0_SUS256_SKXCCM0_VWA8_VWB1_WGM2_WGMXCC1_WGMXCCGn1
    SolutionIndex: 11
    SolutionNameMin: Cijk_Ailk_Bjlk_HHS_BH_UserArgs_MT256x128x32_MI16x16x1_SN_LDSB1_CLR1_GSU0_GSUC0_GSUWGMRR0_K1_LBSPPA2048_LBSPPB1024_LPA0_LPB16_MIWT8_4_PLR1_SU32_SUM0_SUS256_SKXCCM0_VWA4_VWB1_WGM4_WGMXCC1_WGMXCCGn1
    SolutionIndex: 12
    SolutionNameMin: Cijk_Ailk_Bjlk_HHS_BH_UserArgs_MT256x128x32_MI16x16x1_SN_LDSB1_CLR1_GSU0_GSUC0_GSUWGMRR0_K1_LBSPPA2048_LBSPPB1024_LPA0_LPB0_MIWT8_4_PLR1_SU32_SUM0_SUS256_SKXCCM0_VWA4_VWB4_WGM4_WGMXCC1_WGMXCCGn1
    SolutionIndex: 13
    SolutionNameMin: Cijk_Ailk_Bjlk_HHS_BH_UserArgs_MT128x128x32_MI16x16x1_SN_LDSB0_CLR0_GSU0_GSUC0_GSUWGMRR0_K1_LBSPPA1024_LBSPPB1024_LPA0_LPB0_MIWT4_4_PLR0_SU32_SUM0_SUS256_SKXCCM0_VWA4_VWB4_WGM1_WGMXCC1_WGMXCCGn1
    SolutionIndex: 14
    SolutionNameMin: Cijk_Ailk_Bjlk_HHS_BH_UserArgs_MT64x128x32_MI16x16x1_SN_LDSB0_CLR1_GSU0_GSUC0_GSUWGMRR0_K1_LBSPPA512_LBSPPB1024_LPA32_LPB0_MIWT2_4_PLR1_SU32_SUM0_SUS256_SKXCCM0_VWA2_VWB4_WGM1_WGMXCC1_WGMXCCGn1
    SolutionIndex: 15
    SolutionNameMin: Cijk_Ailk_Bjlk_HHS_BH_UserArgs_MT128x64x32_MI16x16x1_SN_LDSB0_CLR1_GSU0_GSUC0_GSUWGMRR0_K1_LBSPPA1024_LBSPPB512_LPA0_LPB32_MIWT4_2_PLR1_SU32_SUM0_SUS256_SKXCCM0_VWA4_VWB2_WGM1_WGMXCC1_WGMXCCGn1
    SolutionIndex: 16
    SolutionNameMin: Cijk_Ailk_Bjlk_HHS_BH_UserArgs_MT64x64x32_MI16x16x1_SN_LDSB0_CLR1_GSU0_GSUC0_GSUWGMRR0_K1_LBSPPA512_LBSPPB512_LPA32_LPB32_MIWT2_2_PLR1_SU32_SUM0_SUS256_SKXCCM0_VWA2_VWB2_WGM1_WGMXCC1_WGMXCCGn1
    SolutionIndex: 17
    SolutionNameMin: Cijk_Ailk_Bjlk_HHS_BH_UserArgs_MT32x32x32_MI16x16x1_SN_LDSB0_CLR1_GSU0_GSUC0_GSUWGMRR0_K1_LBSPPA256_LBSPPB256_LPA16_LPB16_MIWT1_1_PLR1_SU32_SUM0_SUS256_SKXCCM0_VWA1_VWB1_WGM1_WGMXCC1_WGMXCCGn1
    SolutionIndex: 18
    SolutionNameMin: Cijk_Ailk_Bjlk_HHS_BH_UserArgs_MT256x256x64_MI16x16x1_SN_LDSB1_CLR1_GSU0_GSUC0_GSUWGMRR0_K1_LBSPPA2048_LBSPPB2048_LPA0_LPB0_MIWT8_8_PLR1_SU32_SUM0_SUS256_SKXCCM0_VWA4_VWB4_WGM1_WGMXCC1_WGMXCCGn1
    SolutionIndex: 19
    SolutionNameMin: Cijk_Ailk_Bjlk_HHS_BH_UserArgs_MT128x128x64_MI16x16x1_SN_LDSB1_CLR1_GSU0_GSUC0_GSUWGMRR0_K1_LBSPPA1024_LBSPPB1024_LPA0_LPB0_MIWT4_4_PLR1_SU32_SUM0_SUS256_SKXCCM0_VWA4_VWB4_WGM1_WGMXCC1_WGMXCCGn1
    SolutionIndex: 20
    SolutionNameMin: Cijk_Ailk_Bjlk_HHS_BH_UserArgs_MT128x128x64_MI16x16x1_SN_LDSB1_CLR1_GSU0_GSUC0_GSUWGMRR0_K1_LBSPPA1024_LBSPPB1024_LPA0_LPB0_MIWT4_4_PLR1_SU32_SUM0_SUS256_SKXCCM0_VWA4_VWB4_WGM2_WGMXCC1_WGMXCCGn1
    SolutionIndex: 21
    SolutionNameMin: Cijk_Ailk_Bjlk_HHS_BH_UserArgs_MT128x128x64_MI16x16x1_SN_LDSB1_CLR1_GSU0_GSUC0_GSUWGMRR0_K1_LBSPPA1024_LBSPPB1024_LPA0_LPB0_MIWT4_4_PLR1_SU32_SUM0_SUS256_SKXCCM0_VWA4_VWB4_WGM4_WGMXCC1_WGMXCCGn1
    SolutionIndex: 22
    SolutionNameMin: Cijk_Ailk_Bjlk_HHS_BH_UserArgs_MT128x64x64_MI16x16x1_SN_LDSB1_CLR1_GSU0_GSUC0_GSUWGMRR0_K1_LBSPPA1024_LBSPPB512_LPA0_LPB32_MIWT4_2_PLR2_SU32_SUM0_SUS256_SKXCCM0_VWA4_VWB2_WGM1_WGMXCC1_WGMXCCGn1
    SolutionIndex: 23
    SolutionNameMin: Cijk_Ailk_Bjlk_HHS_BH_UserArgs_MT64x64x64_MI16x16x1_SN_LDSB1_CLR1_GSU0_GSUC0_GSUWGMRR0_K1_LBSPPA512_LBSPPB512_LPA32_LPB32_MIWT2_2_PLR1_SU32_SUM0_SUS256_SKXCCM0_VWA2_VWB2_WGM1_WGMXCC1_WGMXCCGn1
    SolutionIndex: 24
    SolutionNameMin: Cijk_Ailk_Bjlk_HHS_BH_UserArgs_MT64x64x64_MI16x16x1_SN_LDSB1_CLR1_GSU0_GSUC0_GSUWGMRR0_K1_LBSPPA512_LBSPPB512_LPA32_LPB32_MIWT2_2_PLR2_SU32_SUM0_SUS256_SKXCCM0_VWA2_VWB2_WGM1_WGMXCC1_WGMXCCGn1
    SolutionIndex: 25
    SolutionNameMin: Cijk_Ailk_Bjlk_HHS_BH_UserArgs_MT64x32x64_MI16x16x1_SN_LDSB0_CLR1_GSU0_GSUC0_GSUWGMRR0_K1_LBSPPA512_LBSPPB256_LPA32_LPB16_MIWT2_1_PLR2_SU32_SUM0_SUS256_SKXCCM0_VWA2_VWB1_WGM1_WGMXCC1_WGMXCCGn1
    SolutionIndex: 26
    SolutionNameMin: Cijk_Ailk_Bjlk_HHS_BH_UserArgs_MT32x32x64_MI16x16x1_SN_LDSB0_CLR1_GSU0_GSUC0_GSUWGMRR0_K1_LBSPPA256_LBSPPB256_LPA16_LPB16_MIWT1_1_PLR2_SU32_SUM0_SUS256_SKXCCM0_VWA1_VWB1_WGM1_WGMXCC1_WGMXCCGn1
    SolutionIndex: 27
    SolutionNameMin: Cijk_Ailk_Bjlk_HHS_BH_UserArgs_MT128x128x128_MI16x16x1_SN_LDSB1_CLR1_GSU0_GSUC0_GSUWGMRR0_K1_LBSPPA1024_LBSPPB1024_LPA0_LPB0_MIWT4_4_PLR1_SU32_SUM0_SUS256_SKXCCM0_VWA4_VWB4_WGM1_WGMXCC1_WGMXCCGn1
    SolutionIndex: 28
    SolutionNameMin: Cijk_Ailk_Bjlk_HHS_BH_UserArgs_MT128x128x128_MI16x16x1_SN_LDSB1_CLR1_GSU0_GSUC0_GSUWGMRR0_K1_LBSPPA1024_LBSPPB1024_LPA0_LPB0_MIWT4_4_PLR1_SU32_SUM0_SUS256_SKXCCM0_VWA4_VWB4_WGM2_WGMXCC1_WGMXCCGn1
    SolutionIndex: 29
    SolutionNameMin: Cijk_Ailk_Bjlk_HHS_BH_UserArgs_MT64x64x128_MI16x16x1_SN_LDSB1_CLR1_GSU0_GSUC0_GSUWGMRR0_K1_LBSPPA512_LBSPPB512_LPA32_LPB32_MIWT2_2_PLR2_SU32_SUM0_SUS256_SKXCCM0_VWA2_VWB2_WGM1_WGMXCC1_WGMXCCGn1
    SolutionIndex: 30
    SolutionNameMin: Cijk_Ailk_Bjlk_HHS_BH_UserArgs_MT64x32x128_MI16x16x1_SN_LDSB1_CLR1_GSU0_GSUC0_GSUWGMRR0_K1_LBSPPA512_LBSPPB256_LPA32_LPB16_MIWT2_1_PLR2_SU32_SUM0_SUS256_SKXCCM0_VWA2_VWB1_WGM1_WGMXCC1_WGMXCCGn1
    SolutionIndex: 31
    SolutionNameMin: Cijk_Ailk_Bjlk_HHS_BH_UserArgs_MT32x32x128_MI16x16x1_SN_LDSB1_CLR1_GSU0_GSUC0_GSUWGMRR0_K1_LBSPPA256_LBSPPB256_LPA16_LPB16_MIWT1_1_PLR1_SU32_SUM0_SUS256_SKXCCM0_VWA1_VWB1_WGM1_WGMXCC1_WGMXCCGn1
    SolutionIndex: 32
    SolutionNameMin: Cijk_Ailk_Bjlk_HHS_BH_UserArgs_MT32x32x128_MI16x16x1_SN_LDSB1_CLR1_GSU0_GSUC0_GSUWGMRR0_K1_LBSPPA256_LBSPPB256_LPA16_LPB16_MIWT1_1_PLR2_SU32_SUM0_SUS256_SKXCCM0_VWA1_VWB1_WGM1_WGMXCC1_WGMXCCGn1
    SolutionIndex: 33
    SolutionNameMin: Cijk_Ailk_Bjlk_HHS_BH_UserArgs_MT256x256x32_MI16x16x1_SN_LDSB0_CLR1_GSU0_GSUC0_GSUWGMRR0_K1_LBSPPA2048_LBSPPB2048_LPA0_LPB0_MIWT8_8_PLR1_SU32_SUM0_SUS256_SKXCCM4_VWA8_VWB4_WGM1_WGMXCC1_WGMXCCGn1
    SolutionIndex: 34
    SolutionNameMin: Cijk_Ailk_Bjlk_HHS_BH_UserArgs_MT256x256x32_MI16x16x1_SN_LDSB0_CLR1_GSU0_GSUC0_GSUWGMRR0_K1_LBSPPA2048_LBSPPB2048_LPA0_LPB0_MIWT8_8_PLR1_SU32_SUM0_SUS256_SKXCCM4_VWA8_VWB8_WGM1_WGMXCC1_WGMXCCGn1
    SolutionIndex: 35
    SolutionNameMin: Cijk_Ailk_Bjlk_HHS_BH_UserArgs_MT256x256x32_MI16x16x1_SN_LDSB0_CLR1_GSU0_GSUC0_GSUWGMRR0_K1_LBSPPA2048_LBSPPB2048_LPA0_LPB0_MIWT8_8_PLR1_SU32_SUM0_SUS256_SKXCCM4_VWA8_VWB8_WGM4_WGMXCC1_WGMXCCGn1
    SolutionIndex: 36
    SolutionNameMin: Cijk_Ailk_Bjlk_HHS_BH_UserArgs_MT128x256x32_MI16x16x1_SN_LDSB1_CLR1_GSU0_GSUC0_GSUWGMRR0_K1_LBSPPA1024_LBSPPB2048_LPA0_LPB32_MIWT4_8_PLR1_SU32_SUM0_SUS256_SKXCCM4_VWA4_VWB2_WGM1_WGMXCC1_WGMXCCGn1
    SolutionIndex: 37
    SolutionNameMin: Cijk_Ailk_Bjlk_HHS_BH_UserArgs_MT128x256x32_MI16x16x1_SN_LDSB1_CLR1_GSU0_GSUC0_GSUWGMRR0_K1_LBSPPA1024_LBSPPB2048_LPA0_LPB0_MIWT4_8_PLR1_SU32_SUM0_SUS256_SKXCCM4_VWA4_VWB4_WGM1_WGMXCC1_WGMXCCGn1
    SolutionIndex: 38
    SolutionNameMin: Cijk_Ailk_Bjlk_HHS_BH_UserArgs_MT128x256x32_MI16x16x1_SN_LDSB1_CLR1_GSU0_GSUC0_GSUWGMRR0_K1_LBSPPA1024_LBSPPB2048_LPA32_LPB0_MIWT4_8_PLR1_SU32_SUM0_SUS256_SKXCCM4_VWA2_VWB8_WGM1_WGMXCC1_WGMXCCGn1
    SolutionIndex: 39
    SolutionNameMin: Cijk_Ailk_Bjlk_HHS_BH_UserArgs_MT128x256x32_MI16x16x1_SN_LDSB1_CLR1_GSU0_GSUC0_GSUWGMRR0_K1_LBSPPA1024_LBSPPB2048_LPA0_LPB0_MIWT4_8_PLR1_SU32_SUM0_SUS256_SKXCCM4_VWA4_VWB8_WGM1_WGMXCC1_WGMXCCGn1
    SolutionIndex: 40
    SolutionNameMin: Cijk_Ailk_Bjlk_HHS_BH_UserArgs_MT128x256x32_MI16x16x1_SN_LDSB1_CLR1_GSU0_GSUC0_GSUWGMRR0_K1_LBSPPA1024_LBSPPB2048_LPA0_LPB32_MIWT4_8_PLR1_SU32_SUM0_SUS256_SKXCCM4_VWA4_VWB2_WGM2_WGMXCC1_WGMXCCGn1
    SolutionIndex: 41
    SolutionNameMin: Cijk_Ailk_Bjlk_HHS_BH_UserArgs_MT128x256x32_MI16x16x1_SN_LDSB1_CLR1_GSU0_GSUC0_GSUWGMRR0_K1_LBSPPA1024_LBSPPB2048_LPA0_LPB32_MIWT4_8_PLR1_SU32_SUM0_SUS256_SKXCCM4_VWA4_VWB2_WGM4_WGMXCC1_WGMXCCGn1
    SolutionIndex: 42
    SolutionNameMin: Cijk_Ailk_Bjlk_HHS_BH_UserArgs_MT256x128x32_MI16x16x1_SN_LDSB1_CLR1_GSU0_GSUC0_GSUWGMRR0_K1_LBSPPA2048_LBSPPB1024_LPA0_LPB16_MIWT8_4_PLR1_SU32_SUM0_SUS256_SKXCCM4_VWA8_VWB1_WGM1_WGMXCC1_WGMXCCGn1
    SolutionIndex: 43
    SolutionNameMin: Cijk_Ailk_Bjlk_HHS_BH_UserArgs_MT256x128x32_MI16x16x1_SN_LDSB1_CLR1_GSU0_GSUC0_GSUWGMRR0_K1_LBSPPA2048_LBSPPB1024_LPA0_LPB32_MIWT8_4_PLR1_SU32_SUM0_SUS256_SKXCCM4_VWA8_VWB2_WGM1_WGMXCC1_WGMXCCGn1
    SolutionIndex: 44
    SolutionNameMin: Cijk_Ailk_Bjlk_HHS_BH_UserArgs_MT256x128x32_MI16x16x1_SN_LDSB1_CLR1_GSU0_GSUC0_GSUWGMRR0_K1_LBSPPA2048_LBSPPB1024_LPA0_LPB0_MIWT8_4_PLR1_SU32_SUM0_SUS256_SKXCCM4_VWA4_VWB4_WGM1_WGMXCC1_WGMXCCGn1
    SolutionIndex: 45
    SolutionNameMin: Cijk_Ailk_Bjlk_HHS_BH_UserArgs_MT256x128x32_MI16x16x1_SN_LDSB1_CLR1_GSU0_GSUC0_GSUWGMRR0_K1_LBSPPA2048_LBSPPB1024_LPA0_LPB0_MIWT8_4_PLR1_SU32_SUM0_SUS256_SKXCCM4_VWA4_VWB4_WGM2_WGMXCC1_WGMXCCGn1
    SolutionIndex: 46
    SolutionNameMin: Cijk_Ailk_Bjlk_HHS_BH_UserArgs_MT256x128x32_MI16x16x1_SN_LDSB1_CLR1_GSU0_GSUC0_GSUWGMRR0_K1_LBSPPA2048_LBSPPB1024_LPA0_LPB16_MIWT8_4_PLR1_SU32_SUM0_SUS256_SKXCCM4_VWA8_VWB1_WGM4_WGMXCC1_WGMXCCGn1
    SolutionIndex: 47
    SolutionNameMin: Cijk_Ailk_Bjlk_HHS_BH_UserArgs_MT256x128x32_MI16x16x1_SN_LDSB1_CLR1_GSU0_GSUC0_GSUWGMRR0_K1_LBSPPA2048_LBSPPB1024_LPA0_LPB32_MIWT8_4_PLR1_SU32_SUM0_SUS256_SKXCCM4_VWA4_VWB2_WGM4_WGMXCC1_WGMXCCGn1
    SolutionIndex: 48
    SolutionNameMin: Cijk_Ailk_Bjlk_HHS_BH_UserArgs_MT256x128x32_MI16x16x1_SN_LDSB1_CLR1_GSU0_GSUC0_GSUWGMRR0_K1_LBSPPA2048_LBSPPB1024_LPA0_LPB0_MIWT8_4_PLR1_SU32_SUM0_SUS256_SKXCCM4_VWA4_VWB4_WGM4_WGMXCC1_WGMXCCGn1
    SolutionIndex: 49
    SolutionNameMin: Cijk_Ailk_Bjlk_HHS_BH_UserArgs_MT256x128x32_MI16x16x1_SN_LDSB1_CLR1_GSU0_GSUC0_GSUWGMRR0_K1_LBSPPA2048_LBSPPB1024_LPA0_LPB0_MIWT8_4_PLR1_SU32_SUM0_SUS256_SKXCCM4_VWA8_VWB4_WGM4_WGMXCC1_WGMXCCGn1
    SolutionIndex: 50
    SolutionNameMin: Cijk_Ailk_Bjlk_HHS_BH_UserArgs_MT128x128x32_MI16x16x1_SN_LDSB0_CLR1_GSU0_GSUC0_GSUWGMRR0_K1_LBSPPA1024_LBSPPB1024_LPA0_LPB0_MIWT4_4_PLR1_SU32_SUM0_SUS256_SKXCCM4_VWA4_VWB4_WGM1_WGMXCC1_WGMXCCGn1
    SolutionIndex: 51
    SolutionNameMin: Cijk_Ailk_Bjlk_HHS_BH_UserArgs_MT128x128x32_MI16x16x1_SN_LDSB0_CLR0_GSU0_GSUC0_GSUWGMRR0_K1_LBSPPA1024_LBSPPB1024_LPA0_LPB0_MIWT4_4_PLR0_SU32_SUM0_SUS256_SKXCCM4_VWA4_VWB4_WGM1_WGMXCC1_WGMXCCGn1
    SolutionIndex: 52
    SolutionNameMin: Cijk_Ailk_Bjlk_HHS_BH_UserArgs_MT128x128x32_MI16x16x1_SN_LDSB0_CLR1_GSU0_GSUC0_GSUWGMRR0_K1_LBSPPA1024_LBSPPB1024_LPA0_LPB0_MIWT4_4_PLR1_SU32_SUM0_SUS256_SKXCCM4_VWA4_VWB4_WGM2_WGMXCC1_WGMXCCGn1
    SolutionIndex: 53
    SolutionNameMin: Cijk_Ailk_Bjlk_HHS_BH_UserArgs_MT64x128x32_MI16x16x1_SN_LDSB0_CLR0_GSU0_GSUC0_GSUWGMRR0_K1_LBSPPA512_LBSPPB1024_LPA32_LPB0_MIWT2_4_PLR0_SU32_SUM0_SUS256_SKXCCM4_VWA2_VWB4_WGM1_WGMXCC1_WGMXCCGn1
    SolutionIndex: 54
    SolutionNameMin: Cijk_Ailk_Bjlk_HHS_BH_UserArgs_MT64x128x32_MI16x16x1_SN_LDSB0_CLR0_GSU0_GSUC0_GSUWGMRR0_K1_LBSPPA512_LBSPPB1024_LPA32_LPB0_MIWT2_4_PLR0_SU32_SUM0_SUS256_SKXCCM4_VWA2_VWB4_WGM2_WGMXCC1_WGMXCCGn1
    SolutionIndex: 55
    SolutionNameMin: Cijk_Ailk_Bjlk_HHS_BH_UserArgs_MT64x128x32_MI16x16x1_SN_LDSB0_CLR0_GSU0_GSUC0_GSUWGMRR0_K1_LBSPPA512_LBSPPB1024_LPA32_LPB0_MIWT2_4_PLR0_SU32_SUM0_SUS256_SKXCCM4_VWA2_VWB4_WGM4_WGMXCC1_WGMXCCGn1
    SolutionIndex: 56
    SolutionNameMin: Cijk_Ailk_Bjlk_HHS_BH_UserArgs_MT128x64x32_MI16x16x1_SN_LDSB0_CLR1_GSU0_GSUC0_GSUWGMRR0_K1_LBSPPA1024_LBSPPB512_LPA0_LPB32_MIWT4_2_PLR1_SU32_SUM0_SUS256_SKXCCM4_VWA4_VWB2_WGM1_WGMXCC1_WGMXCCGn1
    SolutionIndex: 57
    SolutionNameMin: Cijk_Ailk_Bjlk_HHS_BH_UserArgs_MT128x64x32_MI16x16x1_SN_LDSB0_CLR0_GSU0_GSUC0_GSUWGMRR0_K1_LBSPPA1024_LBSPPB512_LPA0_LPB32_MIWT4_2_PLR0_SU32_SUM0_SUS256_SKXCCM4_VWA4_VWB2_WGM1_WGMXCC1_WGMXCCGn1
    SolutionIndex: 58
    SolutionNameMin: Cijk_Ailk_Bjlk_HHS_BH_UserArgs_MT64x64x32_MI16x16x1_SN_LDSB0_CLR1_GSU0_GSUC0_GSUWGMRR0_K1_LBSPPA512_LBSPPB512_LPA32_LPB32_MIWT2_2_PLR1_SU32_SUM0_SUS256_SKXCCM4_VWA2_VWB2_WGM4_WGMXCC1_WGMXCCGn1
    SolutionIndex: 59
    SolutionNameMin: Cijk_Ailk_Bjlk_HHS_BH_UserArgs_MT32x64x32_MI16x16x1_SN_LDSB0_CLR1_GSU0_GSUC0_GSUWGMRR0_K1_LBSPPA256_LBSPPB512_LPA16_LPB32_MIWT1_2_PLR1_SU32_SUM0_SUS256_SKXCCM4_VWA1_VWB2_WGM1_WGMXCC1_WGMXCCGn1
    SolutionIndex: 60
    SolutionNameMin: Cijk_Ailk_Bjlk_HHS_BH_UserArgs_MT32x64x32_MI16x16x1_SN_LDSB0_CLR0_GSU0_GSUC0_GSUWGMRR0_K1_LBSPPA256_LBSPPB512_LPA16_LPB32_MIWT1_2_PLR0_SU32_SUM0_SUS256_SKXCCM4_VWA1_VWB2_WGM1_WGMXCC1_WGMXCCGn1
    SolutionIndex: 61
    SolutionNameMin: Cijk_Ailk_Bjlk_HHS_BH_UserArgs_MT32x32x32_MI16x16x1_SN_LDSB0_CLR1_GSU0_GSUC0_GSUWGMRR0_K1_LBSPPA256_LBSPPB256_LPA16_LPB16_MIWT1_1_PLR1_SU32_SUM0_SUS256_SKXCCM4_VWA1_VWB1_WGM1_WGMXCC1_WGMXCCGn1
    SolutionIndex: 62
    SolutionNameMin: Cijk_Ailk_Bjlk_HHS_BH_UserArgs_MT32x32x32_MI16x16x1_SN_LDSB0_CLR1_GSU0_GSUC0_GSUWGMRR0_K1_LBSPPA256_LBSPPB256_LPA16_LPB16_MIWT1_1_PLR1_SU32_SUM0_SUS256_SKXCCM4_VWA1_VWB1_WGM2_WGMXCC1_WGMXCCGn1
    SolutionIndex: 63
    SolutionNameMin: Cijk_Ailk_Bjlk_HHS_BH_UserArgs_MT256x256x64_MI16x16x1_SN_LDSB1_CLR1_GSU0_GSUC0_GSUWGMRR0_K1_LBSPPA2048_LBSPPB2048_LPA0_LPB0_MIWT8_8_PLR1_SU32_SUM0_SUS256_SKXCCM4_VWA4_VWB4_WGM1_WGMXCC1_WGMXCCGn1
    SolutionIndex: 64
    SolutionNameMin: Cijk_Ailk_Bjlk_HHS_BH_UserArgs_MT256x256x64_MI16x16x1_SN_LDSB1_CLR1_GSU0_GSUC0_GSUWGMRR0_K1_LBSPPA2048_LBSPPB2048_LPA0_LPB0_MIWT8_8_PLR2_SU32_SUM0_SUS256_SKXCCM4_VWA4_VWB4_WGM1_WGMXCC1_WGMXCCGn1
    SolutionIndex: 65
    SolutionNameMin: Cijk_Ailk_Bjlk_HHS_BH_UserArgs_MT256x256x64_MI16x16x1_SN_LDSB1_CLR1_GSU0_GSUC0_GSUWGMRR0_K1_LBSPPA2048_LBSPPB2048_LPA0_LPB0_MIWT8_8_PLR1_SU32_SUM0_SUS256_SKXCCM4_VWA4_VWB4_WGM4_WGMXCC1_WGMXCCGn1
    SolutionIndex: 66
    SolutionNameMin: Cijk_Ailk_Bjlk_HHS_BH_UserArgs_MT128x128x64_MI16x16x1_SN_LDSB1_CLR1_GSU0_GSUC0_GSUWGMRR0_K1_LBSPPA1024_LBSPPB1024_LPA0_LPB0_MIWT4_4_PLR1_SU32_SUM0_SUS256_SKXCCM4_VWA4_VWB4_WGM1_WGMXCC1_WGMXCCGn1
    SolutionIndex: 67
    SolutionNameMin: Cijk_Ailk_Bjlk_HHS_BH_UserArgs_MT128x128x64_MI16x16x1_SN_LDSB1_CLR1_GSU0_GSUC0_GSUWGMRR0_K1_LBSPPA1024_LBSPPB1024_LPA0_LPB0_MIWT4_4_PLR1_SU32_SUM0_SUS256_SKXCCM4_VWA4_VWB4_WGM2_WGMXCC1_WGMXCCGn1
    SolutionIndex: 68
    SolutionNameMin: Cijk_Ailk_Bjlk_HHS_BH_UserArgs_MT128x128x64_MI16x16x1_SN_LDSB1_CLR1_GSU0_GSUC0_GSUWGMRR0_K1_LBSPPA1024_LBSPPB1024_LPA0_LPB0_MIWT4_4_PLR1_SU32_SUM0_SUS256_SKXCCM4_VWA4_VWB4_WGM4_WGMXCC1_WGMXCCGn1
    SolutionIndex: 69
    SolutionNameMin: Cijk_Ailk_Bjlk_HHS_BH_UserArgs_MT64x128x64_MI16x16x1_SN_LDSB1_CLR1_GSU0_GSUC0_GSUWGMRR0_K1_LBSPPA512_LBSPPB1024_LPA32_LPB0_MIWT2_4_PLR1_SU32_SUM0_SUS256_SKXCCM4_VWA2_VWB4_WGM1_WGMXCC1_WGMXCCGn1
    SolutionIndex: 70
    SolutionNameMin: Cijk_Ailk_Bjlk_HHS_BH_UserArgs_MT128x64x64_MI16x16x1_SN_LDSB1_CLR1_GSU0_GSUC0_GSUWGMRR0_K1_LBSPPA1024_LBSPPB512_LPA0_LPB32_MIWT4_2_PLR1_SU32_SUM0_SUS256_SKXCCM4_VWA4_VWB2_WGM1_WGMXCC1_WGMXCCGn1
    SolutionIndex: 71
    SolutionNameMin: Cijk_Ailk_Bjlk_HHS_BH_UserArgs_MT128x64x64_MI16x16x1_SN_LDSB1_CLR1_GSU0_GSUC0_GSUWGMRR0_K1_LBSPPA1024_LBSPPB512_LPA0_LPB32_MIWT4_2_PLR2_SU32_SUM0_SUS256_SKXCCM4_VWA4_VWB2_WGM1_WGMXCC1_WGMXCCGn1
    SolutionIndex: 72
    SolutionNameMin: Cijk_Ailk_Bjlk_HHS_BH_UserArgs_MT128x64x64_MI16x16x1_SN_LDSB1_CLR1_GSU0_GSUC0_GSUWGMRR0_K1_LBSPPA1024_LBSPPB512_LPA0_LPB32_MIWT4_2_PLR2_SU32_SUM0_SUS256_SKXCCM4_VWA4_VWB2_WGM2_WGMXCC1_WGMXCCGn1
    SolutionIndex: 73
    SolutionNameMin: Cijk_Ailk_Bjlk_HHS_BH_UserArgs_MT64x64x64_MI16x16x1_SN_LDSB1_CLR1_GSU0_GSUC0_GSUWGMRR0_K1_LBSPPA512_LBSPPB512_LPA32_LPB32_MIWT2_2_PLR1_SU32_SUM0_SUS256_SKXCCM4_VWA2_VWB2_WGM1_WGMXCC1_WGMXCCGn1
    SolutionIndex: 74
    SolutionNameMin: Cijk_Ailk_Bjlk_HHS_BH_UserArgs_MT64x64x64_MI16x16x1_SN_LDSB1_CLR1_GSU0_GSUC0_GSUWGMRR0_K1_LBSPPA512_LBSPPB512_LPA32_LPB32_MIWT2_2_PLR2_SU32_SUM0_SUS256_SKXCCM4_VWA2_VWB2_WGM1_WGMXCC1_WGMXCCGn1
    SolutionIndex: 75
    SolutionNameMin: Cijk_Ailk_Bjlk_HHS_BH_UserArgs_MT64x64x64_MI16x16x1_SN_LDSB1_CLR1_GSU0_GSUC0_GSUWGMRR0_K1_LBSPPA512_LBSPPB512_LPA32_LPB32_MIWT2_2_PLR1_SU32_SUM0_SUS256_SKXCCM4_VWA2_VWB2_WGM4_WGMXCC1_WGMXCCGn1
    SolutionIndex: 76
    SolutionNameMin: Cijk_Ailk_Bjlk_HHS_BH_UserArgs_MT32x64x64_MI16x16x1_SN_LDSB0_CLR1_GSU0_GSUC0_GSUWGMRR0_K1_LBSPPA256_LBSPPB512_LPA16_LPB32_MIWT1_2_PLR2_SU32_SUM0_SUS256_SKXCCM4_VWA1_VWB2_WGM1_WGMXCC1_WGMXCCGn1
    SolutionIndex: 77
    SolutionNameMin: Cijk_Ailk_Bjlk_HHS_BH_UserArgs_MT64x32x64_MI16x16x1_SN_LDSB0_CLR1_GSU0_GSUC0_GSUWGMRR0_K1_LBSPPA512_LBSPPB256_LPA32_LPB16_MIWT2_1_PLR1_SU32_SUM0_SUS256_SKXCCM4_VWA2_VWB1_WGM1_WGMXCC1_WGMXCCGn1
    SolutionIndex: 78
    SolutionNameMin: Cijk_Ailk_Bjlk_HHS_BH_UserArgs_MT64x32x64_MI16x16x1_SN_LDSB0_CLR1_GSU0_GSUC0_GSUWGMRR0_K1_LBSPPA512_LBSPPB256_LPA32_LPB16_MIWT2_1_PLR2_SU32_SUM0_SUS256_SKXCCM4_VWA2_VWB1_WGM1_WGMXCC1_WGMXCCGn1
    SolutionIndex: 79
    SolutionNameMin: Cijk_Ailk_Bjlk_HHS_BH_UserArgs_MT32x32x64_MI16x16x1_SN_LDSB0_CLR1_GSU0_GSUC0_GSUWGMRR0_K1_LBSPPA256_LBSPPB256_LPA16_LPB16_MIWT1_1_PLR1_SU32_SUM0_SUS256_SKXCCM4_VWA1_VWB1_WGM1_WGMXCC1_WGMXCCGn1
    SolutionIndex: 80
    SolutionNameMin: Cijk_Ailk_Bjlk_HHS_BH_UserArgs_MT128x128x128_MI16x16x1_SN_LDSB1_CLR1_GSU0_GSUC0_GSUWGMRR0_K1_LBSPPA1024_LBSPPB1024_LPA0_LPB0_MIWT4_4_PLR1_SU32_SUM0_SUS256_SKXCCM4_VWA4_VWB4_WGM1_WGMXCC1_WGMXCCGn1
    SolutionIndex: 81
    SolutionNameMin: Cijk_Ailk_Bjlk_HHS_BH_UserArgs_MT128x128x128_MI16x16x1_SN_LDSB1_CLR1_GSU0_GSUC0_GSUWGMRR0_K1_LBSPPA1024_LBSPPB1024_LPA0_LPB0_MIWT4_4_PLR1_SU32_SUM0_SUS256_SKXCCM4_VWA4_VWB4_WGM4_WGMXCC1_WGMXCCGn1
    SolutionIndex: 82
    SolutionNameMin: Cijk_Ailk_Bjlk_HHS_BH_UserArgs_MT64x64x128_MI16x16x1_SN_LDSB1_CLR1_GSU0_GSUC0_GSUWGMRR0_K1_LBSPPA512_LBSPPB512_LPA32_LPB32_MIWT2_2_PLR2_SU32_SUM0_SUS256_SKXCCM4_VWA2_VWB2_WGM1_WGMXCC1_WGMXCCGn1
    SolutionIndex: 83
    SolutionNameMin: Cijk_Ailk_Bjlk_HHS_BH_UserArgs_MT32x64x128_MI16x16x1_SN_LDSB1_CLR1_GSU0_GSUC0_GSUWGMRR0_K1_LBSPPA256_LBSPPB512_LPA16_LPB32_MIWT1_2_PLR2_SU32_SUM0_SUS256_SKXCCM4_VWA1_VWB2_WGM1_WGMXCC1_WGMXCCGn1
    SolutionIndex: 84
    SolutionNameMin: Cijk_Ailk_Bjlk_HHS_BH_UserArgs_MT64x32x128_MI16x16x1_SN_LDSB1_CLR1_GSU0_GSUC0_GSUWGMRR0_K1_LBSPPA512_LBSPPB256_LPA32_LPB16_MIWT2_1_PLR1_SU32_SUM0_SUS256_SKXCCM4_VWA2_VWB1_WGM1_WGMXCC1_WGMXCCGn1
    SolutionIndex: 85
    SolutionNameMin: Cijk_Ailk_Bjlk_HHS_BH_UserArgs_MT64x32x128_MI16x16x1_SN_LDSB1_CLR1_GSU0_GSUC0_GSUWGMRR0_K1_LBSPPA512_LBSPPB256_LPA32_LPB16_MIWT2_1_PLR2_SU32_SUM0_SUS256_SKXCCM4_VWA2_VWB1_WGM1_WGMXCC1_WGMXCCGn1
    SolutionIndex: 86
    SolutionNameMin: Cijk_Ailk_Bjlk_HHS_BH_UserArgs_MT32x32x128_MI16x16x1_SN_LDSB1_CLR1_GSU0_GSUC0_GSUWGMRR0_K1_LBSPPA256_LBSPPB256_LPA16_LPB16_MIWT1_1_PLR1_SU32_SUM0_SUS256_SKXCCM4_VWA1_VWB1_WGM1_WGMXCC1_WGMXCCGn1
    SolutionIndex: 87
    SolutionNameMin: Cijk_Ailk_Bjlk_HHS_BH_UserArgs_MT32x32x128_MI16x16x1_SN_LDSB1_CLR1_GSU0_GSUC0_GSUWGMRR0_K1_LBSPPA256_LBSPPB256_LPA16_LPB16_MIWT1_1_PLR2_SU32_SUM0_SUS256_SKXCCM4_VWA1_VWB1_WGM1_WGMXCC1_WGMXCCGn1
    SolutionIndex: 88
    SolutionNameMin: Cijk_Ailk_Bjlk_HHS_BH_UserArgs_MT32x32x32_MI16x16x1_SN_LDSB0_CLR0_GSU0_GSUC0_GSUWGMRR0_K1_LBSPPA256_LBSPPB256_LPA16_LPB16_MIWT1_1_PLR0_SU32_SUM0_SUS256_SKXCCM4_VWA1_VWB1_WGM1_WGMXCC1_WGMXCCGn1
- - - [128, 128, 1, 128, 128, 128, 128, 128]
    - [31, 0.08]
  - - [128, 128, 1, 256, 128, 128, 128, 128]
    - [32, 0.105]
  - - [128, 128, 1, 512, 128, 128, 128, 128]
    - [86, 0.177]
  - - [128, 128, 1, 1024, 128, 128, 128, 128]
    - [26, 0.281]
  - - [128, 128, 1, 2048, 128, 128, 128, 128]
    - [31, 0.512]
  - - [128, 128, 1, 4096, 128, 128, 128, 128]
    - [79, 0.852]
  - - [128, 128, 1, 8192, 128, 128, 128, 128]
    - [62, 1.326]
  - - [128, 256, 1, 128, 128, 128, 128, 256]
    - [31, 0.162]
  - - [128, 256, 1, 256, 128, 128, 128, 256]
    - [31, 0.204]
  - - [128, 256, 1, 512, 128, 128, 128, 256]
    - [86, 0.353]
  - - [128, 256, 1, 1024, 128, 128, 128, 256]
    - [86, 0.562]
  - - [128, 256, 1, 2048, 128, 128, 128, 256]
    - [61, 1.006]
  - - [128, 256, 1, 4096, 128, 128, 128, 256]
    - [76, 1.542]
  - - [128, 256, 1, 8192, 128, 128, 128, 256]
    - [83, 2.335]
  - - [128, 512, 1, 128, 128, 128, 128, 512]
    - [31, 0.319]
  - - [128, 512, 1, 256, 128, 128, 128, 512]
    - [31, 0.401]
  - - [128, 512, 1, 512, 128, 128, 128, 512]
    - [61, 0.637]
  - - [128, 512, 1, 1024, 128, 128, 128, 512]
    - [86, 1.107]
  - - [128, 512, 1, 2048, 128, 128, 128, 512]
    - [59, 1.681]
  - - [128, 512, 1, 4096, 128, 128, 128, 512]
    - [24, 2.621]
  - - [128, 512, 1, 8192, 128, 128, 128, 512]
    - [82, 3.915]
  - - [128, 1024, 1, 128, 128, 128, 128, 1024]
    - [30, 0.607]
  - - [128, 1024, 1, 256, 128, 128, 128, 1024]
    - [17, 0.947]
  - - [128, 1024, 1, 512, 128, 128, 128, 1024]
    - [31, 1.416]
  - - [128, 1024, 1, 1024, 128, 128, 128, 1024]
    - [76, 2.011]
  - - [128, 1024, 1, 2048, 128, 128, 128, 1024]
    - [58, 2.894]
  - - [128, 1024, 1, 4096, 128, 128, 128, 1024]
    - [73, 4.372]
  - - [128, 1024, 1, 8192, 128, 128, 128, 1024]
    - [22, 6.14]
  - - [128, 2048, 1, 128, 128, 128, 128, 2048]
    - [29, 1.125]
  - - [128, 2048, 1, 256, 128, 128, 128, 2048]
    - [78, 1.741]
  - - [128, 2048, 1, 512, 128, 128, 128, 2048]
    - [25, 2.605]
  - - [128, 2048, 1, 1024, 128, 128, 128, 2048]
    - [73, 3.504]
  - - [128, 2048, 1, 2048, 128, 128, 128, 2048]
    - [57, 4.619]
  - - [128, 2048, 1, 4096, 128, 128, 128, 2048]
    - [19, 6.676]
  - - [128, 2048, 1, 8192, 128, 128, 128, 2048]
    - [19, 9.672]
  - - [128, 4096, 1, 128, 128, 128, 128, 4096]
    - [73, 1.909]
  - - [128, 4096, 1, 256, 128, 128, 128, 4096]
    - [73, 3.111]
  - - [128, 4096, 1, 512, 128, 128, 128, 4096]
    - [73, 4.464]
  - - [128, 4096, 1, 1024, 128, 128, 128, 4096]
    - [71, 5.242]
  - - [128, 4096, 1, 2048, 128, 128, 128, 4096]
    - [51, 6.533]
  - - [128, 4096, 1, 4096, 128, 128, 128, 4096]
    - [66, 9.61]
  - - [128, 4096, 1, 8192, 128, 128, 128, 4096]
    - [19, 12.159]
  - - [128, 8192, 1, 128, 128, 128, 128, 8192]
    - [56, 3.099]
  - - [128, 8192, 1, 256, 128, 128, 128, 8192]
    - [53, 4.86]
  - - [128, 8192, 1, 512, 128, 128, 128, 8192]
    - [71, 6.351]
  - - [128, 8192, 1, 1024, 128, 128, 128, 8192]
    - [66, 7.878]
  - - [128, 8192, 1, 2048, 128, 128, 128, 8192]
    - [27, 8.33]
  - - [128, 8192, 1, 4096, 128, 128, 128, 8192]
    - [1, 11.072]
  - - [128, 8192, 1, 8192, 128, 128, 128, 8192]
    - [66, 13.102]
  - - [256, 128, 1, 128, 256, 256, 256, 128]
    - [32, 0.161]
  - - [256, 128, 1, 256, 256, 256, 256, 128]
    - [31, 0.203]
  - - [256, 128, 1, 512, 256, 256, 256, 128]
    - [87, 0.357]
  - - [256, 128, 1, 1024, 256, 256, 256, 128]
    - [31, 0.56]
  - - [256, 128, 1, 2048, 256, 256, 256, 128]
    - [61, 0.999]
  - - [256, 128, 1, 4096, 256, 256, 256, 128]
    - [76, 1.543]
  - - [256, 128, 1, 8192, 256, 256, 256, 128]
    - [30, 2.3]
  - - [256, 256, 1, 128, 256, 256, 256, 256]
    - [31, 0.313]
  - - [256, 256, 1, 256, 256, 256, 256, 256]
    - [31, 0.4]
  - - [256, 256, 1, 512, 256, 256, 256, 256]
    - [85, 0.649]
  - - [256, 256, 1, 1024, 256, 256, 256, 256]
    - [87, 1.103]
  - - [256, 256, 1, 2048, 256, 256, 256, 256]
    - [60, 1.732]
  - - [256, 256, 1, 4096, 256, 256, 256, 256]
    - [77, 2.644]
  - - [256, 256, 1, 8192, 256, 256, 256, 256]
    - [24, 3.783]
  - - [256, 512, 1, 128, 256, 256, 256, 512]
    - [85, 0.606]
  - - [256, 512, 1, 256, 256, 256, 256, 512]
    - [61, 0.93]
  - - [256, 512, 1, 512, 256, 256, 256, 512]
    - [31, 1.415]
  - - [256, 512, 1, 1024, 256, 256, 256, 512]
    - [84, 1.992]
  - - [256, 512, 1, 2048, 256, 256, 256, 512]
    - [84, 2.919]
  - - [256, 512, 1, 4096, 256, 256, 256, 512]
    - [73, 4.407]
  - - [256, 512, 1, 8192, 256, 256, 256, 512]
    - [71, 6.17]
  - - [256, 1024, 1, 128, 256, 256, 256, 1024]
    - [29, 1.114]
  - - [256, 1024, 1, 256, 256, 256, 256, 1024]
    - [25, 1.726]
  - - [256, 1024, 1, 512, 256, 256, 256, 1024]
    - [78, 2.59]
  - - [256, 1024, 1, 1024, 256, 256, 256, 1024]
    - [73, 3.473]
  - - [256, 1024, 1, 2048, 256, 256, 256, 1024]
    - [57, 4.566]
  - - [256, 1024, 1, 4096, 256, 256, 256, 1024]
    - [19, 6.655]
  - - [256, 1024, 1, 8192, 256, 256, 256, 1024]
    - [66, 9.67]
  - - [256, 2048, 1, 128, 256, 256, 256, 2048]
    - [16, 1.895]
  - - [256, 2048, 1, 256, 256, 256, 256, 2048]
    - [73, 3.073]
  - - [256, 2048, 1, 512, 256, 256, 256, 2048]
    - [73, 4.438]
  - - [256, 2048, 1, 1024, 256, 256, 256, 2048]
    - [71, 5.223]
  - - [256, 2048, 1, 2048, 256, 256, 256, 2048]
    - [50, 6.513]
  - - [256, 2048, 1, 4096, 256, 256, 256, 2048]
    - [66, 9.581]
  - - [256, 2048, 1, 8192, 256, 256, 256, 2048]
    - [20, 11.937]
  - - [256, 4096, 1, 128, 256, 256, 256, 4096]
    - [14, 3.084]
  - - [256, 4096, 1, 256, 256, 256, 256, 4096]
    - [54, 4.783]
  - - [256, 4096, 1, 512, 256, 256, 256, 4096]
    - [71, 6.343]
  - - [256, 4096, 1, 1024, 256, 256, 256, 4096]
    - [66, 7.795]
  - - [256, 4096, 1, 2048, 256, 256, 256, 4096]
    - [27, 8.373]
  - - [256, 4096, 1, 4096, 256, 256, 256, 4096]
    - [6, 11.033]
  - - [256, 4096, 1, 8192, 256, 256, 256, 4096]
    - [64, 13.332]
  - - [256, 8192, 1, 128, 256, 256, 256, 8192]
    - [50, 4.528]
  - - [256, 8192, 1, 256, 256, 256, 256, 8192]
    - [66, 6.807]
  - - [256, 8192, 1, 512, 256, 256, 256, 8192]
    - [66, 9.338]
  - - [256, 8192, 1, 1024, 256, 256, 256, 8192]
    - [80, 9.81]
  - - [256, 8192, 1, 2048, 256, 256, 256, 8192]
    - [67, 11.352]
  - - [256, 8192, 1, 4096, 256, 256, 256, 8192]
    - [67, 12.795]
  - - [256, 8192, 1, 8192, 256, 256, 256, 8192]
    - [48, 13.73]
  - - [512, 128, 1, 128, 512, 512, 512, 128]
    - [31, 0.317]
  - - [512, 128, 1, 256, 512, 512, 512, 128]
    - [87, 0.407]
  - - [512, 128, 1, 512, 512, 512, 512, 128]
    - [61, 0.637]
  - - [512, 128, 1, 1024, 512, 512, 512, 128]
    - [87, 1.106]
  - - [512, 128, 1, 2048, 512, 512, 512, 128]
    - [60, 1.697]
  - - [512, 128, 1, 4096, 512, 512, 512, 128]
    - [24, 2.609]
  - - [512, 128, 1, 8192, 512, 512, 512, 128]
    - [74, 3.725]
  - - [512, 256, 1, 128, 512, 512, 512, 256]
    - [85, 0.603]
  - - [512, 256, 1, 256, 512, 512, 512, 256]
    - [17, 0.952]
  - - [512, 256, 1, 512, 512, 512, 512, 256]
    - [31, 1.419]
  - - [512, 256, 1, 1024, 512, 512, 512, 256]
    - [84, 2.009]
  - - [512, 256, 1, 2048, 512, 512, 512, 256]
    - [84, 2.923]
  - - [512, 256, 1, 4096, 512, 512, 512, 256]
    - [75, 4.352]
  - - [512, 256, 1, 8192, 512, 512, 512, 256]
    - [22, 6.179]
  - - [512, 512, 1, 128, 512, 512, 512, 512]
    - [29, 1.126]
  - - [512, 512, 1, 256, 512, 512, 512, 512]
    - [25, 1.724]
  - - [512, 512, 1, 512, 512, 512, 512, 512]
    - [78, 2.613]
  - - [512, 512, 1, 1024, 512, 512, 512, 512]
    - [73, 3.497]
  - - [512, 512, 1, 2048, 512, 512, 512, 512]
    - [57, 4.605]
  - - [512, 512, 1, 4096, 512, 512, 512, 512]
    - [19, 6.693]
  - - [512, 512, 1, 8192, 512, 512, 512, 512]
    - [66, 9.614]
  - - [512, 1024, 1, 128, 512, 512, 512, 1024]
    - [73, 1.904]
  - - [512, 1024, 1, 256, 512, 512, 512, 1024]
    - [73, 3.04]
  - - [512, 1024, 1, 512, 512, 512, 512, 1024]
    - [23, 4.466]
  - - [512, 1024, 1, 1024, 512, 512, 512, 1024]
    - [70, 5.257]
  - - [512, 1024, 1, 2048, 512, 512, 512, 1024]
    - [50, 6.516]
  - - [512, 1024, 1, 4096, 512, 512, 512, 1024]
    - [66, 9.637]
  - - [512, 1024, 1, 8192, 512, 512, 512, 1024]
    - [19, 11.916]
  - - [512, 2048, 1, 128, 512, 512, 512, 2048]
    - [56, 3.062]
  - - [512, 2048, 1, 256, 512, 512, 512, 2048]
    - [56, 4.652]
  - - [512, 2048, 1, 512, 512, 512, 512, 2048]
    - [71, 6.335]
  - - [512, 2048, 1, 1024, 512, 512, 512, 2048]
    - [66, 7.807]
  - - [512, 2048, 1, 2048, 512, 512, 512, 2048]
    - [27, 8.428]
  - - [512, 2048, 1, 4096, 512, 512, 512, 2048]
    - [1, 10.954]
  - - [512, 2048, 1, 8192, 512, 512, 512, 2048]
    - [64, 13.291]
  - - [512, 4096, 1, 128, 512, 512, 512, 4096]
    - [50, 4.541]
  - - [512, 4096, 1, 256, 512, 512, 512, 4096]
    - [66, 6.764]
  - - [512, 4096, 1, 512, 512, 512, 512, 4096]
    - [66, 9.292]
  - - [512, 4096, 1, 1024, 512, 512, 512, 4096]
    - [81, 9.839]
  - - [512, 4096, 1, 2048, 512, 512, 512, 4096]
    - [68, 11.312]
  - - [512, 4096, 1, 4096, 512, 512, 512, 4096]
    - [66, 13.079]
  - - [512, 4096, 1, 8192, 512, 512, 512, 4096]
    - [39, 14.093]
  - - [512, 8192, 1, 128, 512, 512, 512, 8192]
    - [42, 6.427]
  - - [512, 8192, 1, 256, 512, 512, 512, 8192]
    - [42, 9.07]
  - - [512, 8192, 1, 512, 512, 512, 512, 8192]
    - [66, 10.153]
  - - [512, 8192, 1, 1024, 512, 512, 512, 8192]
    - [67, 12.426]
  - - [512, 8192, 1, 2048, 512, 512, 512, 8192]
    - [66, 13.507]
  - - [512, 8192, 1, 4096, 512, 512, 512, 8192]
    - [12, 13.802]
  - - [512, 8192, 1, 8192, 512, 512, 512, 8192]
    - [1, 15.413]
  - - [1024, 128, 1, 128, 1024, 1024, 1024, 128]
    - [30, 0.61]
  - - [1024, 128, 1, 256, 1024, 1024, 1024, 128]
    - [17, 0.95]
  - - [1024, 128, 1, 512, 1024, 1024, 1024, 128]
    - [31, 1.414]
  - - [1024, 128, 1, 1024, 1024, 1024, 1024, 128]
    - [84, 2.004]
  - - [1024, 128, 1, 2048, 1024, 1024, 1024, 128]
    - [30, 2.877]
  - - [1024, 128, 1, 4096, 1024, 1024, 1024, 128]
    - [22, 4.259]
  - - [1024, 128, 1, 8192, 1024, 1024, 1024, 128]
    - [22, 6.13]
  - - [1024, 256, 1, 128, 1024, 1024, 1024, 256]
    - [29, 1.119]
  - - [1024, 256, 1, 256, 1024, 1024, 1024, 256]
    - [78, 1.753]
  - - [1024, 256, 1, 512, 1024, 1024, 1024, 256]
    - [25, 2.587]
  - - [1024, 256, 1, 1024, 1024, 1024, 1024, 256]
    - [73, 3.46]
  - - [1024, 256, 1, 2048, 1024, 1024, 1024, 256]
    - [57, 4.617]
  - - [1024, 256, 1, 4096, 1024, 1024, 1024, 256]
    - [66, 6.672]
  - - [1024, 256, 1, 8192, 1024, 1024, 1024, 256]
    - [19, 9.658]
  - - [1024, 512, 1, 128, 1024, 1024, 1024, 512]
    - [23, 1.91]
  - - [1024, 512, 1, 256, 1024, 1024, 1024, 512]
    - [23, 3.092]
  - - [1024, 512, 1, 512, 1024, 1024, 1024, 512]
    - [23, 4.465]
  - - [1024, 512, 1, 1024, 1024, 1024, 1024, 512]
    - [70, 5.257]
  - - [1024, 512, 1, 2048, 1024, 1024, 1024, 512]
    - [51, 6.568]
  - - [1024, 512, 1, 4096, 1024, 1024, 1024, 512]
    - [68, 9.579]
  - - [1024, 512, 1, 8192, 1024, 1024, 1024, 512]
    - [19, 11.842]
  - - [1024, 1024, 1, 128, 1024, 1024, 1024, 1024]
    - [56, 3.091]
  - - [1024, 1024, 1, 256, 1024, 1024, 1024, 1024]
    - [55, 4.744]
  - - [1024, 1024, 1, 512, 1024, 1024, 1024, 1024]
    - [71, 6.319]
  - - [1024, 1024, 1, 1024, 1024, 1024, 1024, 1024]
    - [66, 7.818]
  - - [1024, 1024, 1, 2048, 1024, 1024, 1024, 1024]
    - [27, 8.498]
  - - [1024, 1024, 1, 4096, 1024, 1024, 1024, 1024]
    - [6, 10.969]
  - - [1024, 1024, 1, 8192, 1024, 1024, 1024, 1024]
    - [64, 13.322]
  - - [1024, 2048, 1, 128, 1024, 1024, 1024, 2048]
    - [50, 4.525]
  - - [1024, 2048, 1, 256, 1024, 1024, 1024, 2048]
    - [66, 6.774]
  - - [1024, 2048, 1, 512, 1024, 1024, 1024, 2048]
    - [66, 9.325]
  - - [1024, 2048, 1, 1024, 1024, 1024, 1024, 2048]
    - [80, 9.805]
  - - [1024, 2048, 1, 2048, 1024, 1024, 1024, 2048]
    - [67, 11.27]
  - - [1024, 2048, 1, 4096, 1024, 1024, 1024, 2048]
    - [21, 12.206]
  - - [1024, 2048, 1, 8192, 1024, 1024, 1024, 2048]
    - [36, 13.726]
  - - [1024, 4096, 1, 128, 1024, 1024, 1024, 4096]
    - [9, 6.469]
  - - [1024, 4096, 1, 256, 1024, 1024, 1024, 4096]
    - [9, 9.051]
  - - [1024, 4096, 1, 512, 1024, 1024, 1024, 4096]
    - [66, 10.163]
  - - [1024, 4096, 1, 1024, 1024, 1024, 1024, 4096]
    - [66, 12.378]
  - - [1024, 4096, 1, 2048, 1024, 1024, 1024, 4096]
    - [19, 13.43]
  - - [1024, 4096, 1, 4096, 1024, 1024, 1024, 4096]
    - [6, 13.755]
  - - [1024, 4096, 1, 8192, 1024, 1024, 1024, 4096]
    - [1, 15.509]
  - - [1024, 8192, 1, 128, 1024, 1024, 1024, 8192]
    - [9, 7.059]
  - - [1024, 8192, 1, 256, 1024, 1024, 1024, 8192]
    - [43, 9.863]
  - - [1024, 8192, 1, 512, 1024, 1024, 1024, 8192]
    - [43, 12.527]
  - - [1024, 8192, 1, 1024, 1024, 1024, 1024, 8192]
    - [42, 14.239]
  - - [1024, 8192, 1, 2048, 1024, 1024, 1024, 8192]
    - [36, 13.807]
  - - [1024, 8192, 1, 4096, 1024, 1024, 1024, 8192]
    - [4, 15.433]
  - - [1024, 8192, 1, 8192, 1024, 1024, 1024, 8192]
    - [18, 16.927]
  - - [2048, 128, 1, 128, 2048, 2048, 2048, 128]
    - [29, 1.117]
  - - [2048, 128, 1, 256, 2048, 2048, 2048, 128]
    - [78, 1.751]
  - - [2048, 128, 1, 512, 2048, 2048, 2048, 128]
    - [78, 2.622]
  - - [2048, 128, 1, 1024, 2048, 2048, 2048, 128]
    - [73, 3.463]
  - - [2048, 128, 1, 2048, 2048, 2048, 2048, 128]
    - [15, 4.586]
  - - [2048, 128, 1, 4096, 2048, 2048, 2048, 128]
    - [66, 6.696]
  - - [2048, 128, 1, 8192, 2048, 2048, 2048, 128]
    - [66, 9.632]
  - - [2048, 256, 1, 128, 2048, 2048, 2048, 256]
    - [23, 1.901]
  - - [2048, 256, 1, 256, 2048, 2048, 2048, 256]
    - [23, 3.081]
  - - [2048, 256, 1, 512, 2048, 2048, 2048, 256]
    - [23, 4.46]
  - - [2048, 256, 1, 1024, 2048, 2048, 2048, 256]
    - [70, 5.225]
  - - [2048, 256, 1, 2048, 2048, 2048, 2048, 256]
    - [13, 6.505]
  - - [2048, 256, 1, 4096, 2048, 2048, 2048, 256]
    - [66, 9.493]
  - - [2048, 256, 1, 8192, 2048, 2048, 2048, 256]
    - [20, 11.804]
  - - [2048, 512, 1, 128, 2048, 2048, 2048, 512]
    - [14, 3.081]
  - - [2048, 512, 1, 256, 2048, 2048, 2048, 512]
    - [54, 4.727]
  - - [2048, 512, 1, 512, 2048, 2048, 2048, 512]
    - [71, 6.311]
  - - [2048, 512, 1, 1024, 2048, 2048, 2048, 512]
    - [66, 7.744]
  - - [2048, 512, 1, 2048, 2048, 2048, 2048, 512]
    - [28, 8.299]
  - - [2048, 512, 1, 4096, 2048, 2048, 2048, 512]
    - [4, 10.993]
  - - [2048, 512, 1, 8192, 2048, 2048, 2048, 512]
    - [65, 13.295]
  - - [2048, 1024, 1, 128, 2048, 2048, 2048, 1024]
    - [66, 4.525]
  - - [2048, 1024, 1, 256, 2048, 2048, 2048, 1024]
    - [66, 6.783]
  - - [2048, 1024, 1, 512, 2048, 2048, 2048, 1024]
    - [19, 9.175]
  - - [2048, 1024, 1, 1024, 2048, 2048, 2048, 1024]
    - [81, 9.596]
  - - [2048, 1024, 1, 2048, 2048, 2048, 2048, 1024]
    - [68, 11.134]
  - - [2048, 1024, 1, 4096, 2048, 2048, 2048, 1024]
    - [68, 12.151]
  - - [2048, 1024, 1, 8192, 2048, 2048, 2048, 1024]
    - [41, 13.661]
  - - [2048, 2048, 1, 128, 2048, 2048, 2048, 2048]
    - [8, 6.457]
  - - [2048, 2048, 1, 256, 2048, 2048, 2048, 2048]
    - [7, 9.141]
  - - [2048, 2048, 1, 512, 2048, 2048, 2048, 2048]
    - [66, 10.187]
  - - [2048, 2048, 1, 1024, 2048, 2048, 2048, 2048]
    - [19, 12.367]
  - - [2048, 2048, 1, 2048, 2048, 2048, 2048, 2048]
    - [66, 13.395]
  - - [2048, 2048, 1, 4096, 2048, 2048, 2048, 2048]
    - [1, 13.82]
  - - [2048, 2048, 1, 8192, 2048, 2048, 2048, 2048]
    - [1, 15.47]
  - - [2048, 4096, 1, 128, 2048, 2048, 2048, 4096]
    - [8, 7.135]
  - - [2048, 4096, 1, 256, 2048, 2048, 2048, 4096]
    - [7, 9.978]
  - - [2048, 4096, 1, 512, 2048, 2048, 2048, 4096]
    - [9, 12.492]
  - - [2048, 4096, 1, 1024, 2048, 2048, 2048, 4096]
    - [2, 13.895]
  - - [2048, 4096, 1, 2048, 2048, 2048, 2048, 4096]
    - [40, 13.916]
  - - [2048, 4096, 1, 4096, 2048, 2048, 2048, 4096]
    - [38, 15.424]
  - - [2048, 4096, 1, 8192, 2048, 2048, 2048, 4096]
    - [18, 16.935]
  - - [2048, 8192, 1, 128, 2048, 2048, 2048, 8192]
    - [0, 6.44]
  - - [2048, 8192, 1, 256, 2048, 2048, 2048, 8192]
    - [35, 9.438]
  - - [2048, 8192, 1, 512, 2048, 2048, 2048, 8192]
    - [34, 12.221]
  - - [2048, 8192, 1, 1024, 2048, 2048, 2048, 8192]
    - [35, 14.344]
  - - [2048, 8192, 1, 2048, 2048, 2048, 2048, 8192]
    - [63, 15.648]
  - - [2048, 8192, 1, 4096, 2048, 2048, 2048, 8192]
    - [63, 17.059]
  - - [2048, 8192, 1, 8192, 2048, 2048, 2048, 8192]
    - [63, 18.397]
  - - [4096, 128, 1, 128, 4096, 4096, 4096, 128]
    - [73, 1.94]
  - - [4096, 128, 1, 256, 4096, 4096, 4096, 128]
    - [73, 3.118]
  - - [4096, 128, 1, 512, 4096, 4096, 4096, 128]
    - [73, 4.498]
  - - [4096, 128, 1, 1024, 4096, 4096, 4096, 128]
    - [70, 5.244]
  - - [4096, 128, 1, 2048, 4096, 4096, 4096, 128]
    - [51, 6.514]
  - - [4096, 128, 1, 4096, 4096, 4096, 4096, 128]
    - [66, 9.582]
  - - [4096, 128, 1, 8192, 4096, 4096, 4096, 128]
    - [19, 12.078]
  - - [4096, 256, 1, 128, 4096, 4096, 4096, 256]
    - [56, 3.119]
  - - [4096, 256, 1, 256, 4096, 4096, 4096, 256]
    - [54, 4.776]
  - - [4096, 256, 1, 512, 4096, 4096, 4096, 256]
    - [72, 6.284]
  - - [4096, 256, 1, 1024, 4096, 4096, 4096, 256]
    - [66, 7.86]
  - - [4096, 256, 1, 2048, 4096, 4096, 4096, 256]
    - [27, 8.306]
  - - [4096, 256, 1, 4096, 4096, 4096, 4096, 256]
    - [6, 11.132]
  - - [4096, 256, 1, 8192, 4096, 4096, 4096, 256]
    - [64, 13.343]
  - - [4096, 512, 1, 128, 4096, 4096, 4096, 512]
    - [66, 4.507]
  - - [4096, 512, 1, 256, 4096, 4096, 4096, 512]
    - [66, 6.733]
  - - [4096, 512, 1, 512, 4096, 4096, 4096, 512]
    - [68, 9.227]
  - - [4096, 512, 1, 1024, 4096, 4096, 4096, 512]
    - [81, 9.62]
  - - [4096, 512, 1, 2048, 4096, 4096, 4096, 512]
    - [68, 11.272]
  - - [4096, 512, 1, 4096, 4096, 4096, 4096, 512]
    - [68, 12.867]
  - - [4096, 512, 1, 8192, 4096, 4096, 4096, 512]
    - [36, 13.768]
  - - [4096, 1024, 1, 128, 4096, 4096, 4096, 1024]
    - [7, 6.534]
  - - [4096, 1024, 1, 256, 4096, 4096, 4096, 1024]
    - [7, 9.173]
  - - [4096, 1024, 1, 512, 4096, 4096, 4096, 1024]
    - [19, 10.102]
  - - [4096, 1024, 1, 1024, 4096, 4096, 4096, 1024]
    - [68, 12.301]
  - - [4096, 1024, 1, 2048, 4096, 4096, 4096, 1024]
    - [19, 13.402]
  - - [4096, 1024, 1, 4096, 4096, 4096, 4096, 1024]
    - [1, 14.095]
  - - [4096, 1024, 1, 8192, 4096, 4096, 4096, 1024]
    - [1, 15.558]
  - - [4096, 2048, 1, 128, 4096, 4096, 4096, 2048]
    - [8, 7.059]
  - - [4096, 2048, 1, 256, 4096, 4096, 4096, 2048]
    - [7, 10.055]
  - - [4096, 2048, 1, 512, 4096, 4096, 4096, 2048]
    - [8, 12.382]
  - - [4096, 2048, 1, 1024, 4096, 4096, 4096, 2048]
    - [3, 13.91]
  - - [4096, 2048, 1, 2048, 4096, 4096, 4096, 2048]
    - [36, 13.978]
  - - [4096, 2048, 1, 4096, 4096, 4096, 4096, 2048]
    - [1, 15.549]
  - - [4096, 2048, 1, 8192, 4096, 4096, 4096, 2048]
    - [18, 16.972]
  - - [4096, 4096, 1, 128, 4096, 4096, 4096, 4096]
    - [33, 6.494]
  - - [4096, 4096, 1, 256, 4096, 4096, 4096, 4096]
    - [34, 9.44]
  - - [4096, 4096, 1, 512, 4096, 4096, 4096, 4096]
    - [34, 12.248]
  - - [4096, 4096, 1, 1024, 4096, 4096, 4096, 4096]
    - [34, 14.31]
  - - [4096, 4096, 1, 2048, 4096, 4096, 4096, 4096]
    - [63, 15.591]
  - - [4096, 4096, 1, 4096, 4096, 4096, 4096, 4096]
    - [64, 17.055]
  - - [4096, 4096, 1, 8192, 4096, 4096, 4096, 4096]
    - [63, 18.497]
  - - [4096, 8192, 1, 128, 4096, 4096, 4096, 8192]
    - [44, 6.893]
  - - [4096, 8192, 1, 256, 4096, 4096, 4096, 8192]
    - [45, 9.334]
  - - [4096, 8192, 1, 512, 4096, 4096, 4096, 8192]
    - [40, 12.119]
  - - [4096, 8192, 1, 1024, 4096, 4096, 4096, 8192]
    - [41, 14.791]
  - - [4096, 8192, 1, 2048, 4096, 4096, 4096, 8192]
    - [1, 16.631]
  - - [4096, 8192, 1, 4096, 4096, 4096, 4096, 8192]
    - [63, 18.069]
  - - [4096, 8192, 1, 8192, 4096, 4096, 4096, 8192]
    - [18, 18.934]
  - - [8192, 128, 1, 128, 8192, 8192, 8192, 128]
    - [14, 3.086]
  - - [8192, 128, 1, 256, 8192, 8192, 8192, 128]
    - [53, 4.62]
  - - [8192, 128, 1, 512, 8192, 8192, 8192, 128]
    - [69, 6.098]
  - - [8192, 128, 1, 1024, 8192, 8192, 8192, 128]
    - [66, 7.735]
  - - [8192, 128, 1, 2048, 8192, 8192, 8192, 128]
    - [27, 8.179]
  - - [8192, 128, 1, 4096, 8192, 8192, 8192, 128]
    - [11, 10.88]
  - - [8192, 128, 1, 8192, 8192, 8192, 8192, 128]
    - [21, 12.963]
  - - [8192, 256, 1, 128, 8192, 8192, 8192, 256]
    - [52, 4.458]
  - - [8192, 256, 1, 256, 8192, 8192, 8192, 256]
    - [68, 6.571]
  - - [8192, 256, 1, 512, 8192, 8192, 8192, 256]
    - [67, 9.113]
  - - [8192, 256, 1, 1024, 8192, 8192, 8192, 256]
    - [81, 9.596]
  - - [8192, 256, 1, 2048, 8192, 8192, 8192, 256]
    - [68, 11.206]
  - - [8192, 256, 1, 4096, 8192, 8192, 8192, 256]
    - [20, 12.802]
  - - [8192, 256, 1, 8192, 8192, 8192, 8192, 256]
    - [6, 13.911]
  - - [8192, 512, 1, 128, 8192, 8192, 8192, 512]
    - [10, 6.434]
  - - [8192, 512, 1, 256, 8192, 8192, 8192, 512]
    - [10, 9.076]
  - - [8192, 512, 1, 512, 8192, 8192, 8192, 512]
    - [19, 9.973]
  - - [8192, 512, 1, 1024, 8192, 8192, 8192, 512]
    - [68, 12.254]
  - - [8192, 512, 1, 2048, 8192, 8192, 8192, 512]
    - [20, 13.227]
  - - [8192, 512, 1, 4096, 8192, 8192, 8192, 512]
    - [1, 14.117]
  - - [8192, 512, 1, 8192, 8192, 8192, 8192, 512]
    - [1, 15.731]
  - - [8192, 1024, 1, 128, 8192, 8192, 8192, 1024]
    - [7, 6.937]
  - - [8192, 1024, 1, 256, 8192, 8192, 8192, 1024]
    - [7, 9.845]
  - - [8192, 1024, 1, 512, 8192, 8192, 8192, 1024]
    - [7, 12.411]
  - - [8192, 1024, 1, 1024, 8192, 8192, 8192, 1024]
    - [5, 13.991]
  - - [8192, 1024, 1, 2048, 8192, 8192, 8192, 1024]
    - [39, 13.986]
  - - [8192, 1024, 1, 4096, 8192, 8192, 8192, 1024]
    - [1, 15.811]
  - - [8192, 1024, 1, 8192, 8192, 8192, 8192, 1024]
    - [3, 17.119]
  - - [8192, 2048, 1, 128, 8192, 8192, 8192, 2048]
    - [34, 6.448]
  - - [8192, 2048, 1, 256, 8192, 8192, 8192, 2048]
    - [33, 9.425]
  - - [8192, 2048, 1, 512, 8192, 8192, 8192, 2048]
    - [34, 12.305]
  - - [8192, 2048, 1, 1024, 8192, 8192, 8192, 2048]
    - [34, 14.299]
  - - [8192, 2048, 1, 2048, 8192, 8192, 8192, 2048]
    - [63, 15.552]
  - - [8192, 2048, 1, 4096, 8192, 8192, 8192, 2048]
    - [63, 17.1]
  - - [8192, 2048, 1, 8192, 8192, 8192, 8192, 2048]
    - [63, 18.491]
  - - [8192, 4096, 1, 128, 8192, 8192, 8192, 4096]
    - [49, 6.799]
  - - [8192, 4096, 1, 256, 8192, 8192, 8192, 4096]
    - [47, 9.134]
  - - [8192, 4096, 1, 512, 8192, 8192, 8192, 4096]
    - [37, 12.077]
  - - [8192, 4096, 1, 1024, 8192, 8192, 8192, 4096]
    - [41, 14.822]
  - - [8192, 4096, 1, 2048, 8192, 8192, 8192, 4096]
    - [1, 16.596]
  - - [8192, 4096, 1, 4096, 8192, 8192, 8192, 4096]
    - [63, 18.079]
  - - [8192, 4096, 1, 8192, 8192, 8192, 8192, 4096]
    - [18, 18.997]
  - - [8192, 8192, 1, 128, 8192, 8192, 8192, 8192]
    - [46, 6.333]
  - - [8192, 8192, 1, 256, 8192, 8192, 8192, 8192]
    - [49, 9.449]
  - - [8192, 8192, 1, 512, 8192, 8192, 8192, 8192]
    - [46, 12.697]
  - - [8192, 8192, 1, 1024, 8192, 8192, 8192, 8192]
    - [49, 15.27]
  - - [8192, 8192, 1, 2048, 8192, 8192, 8192, 8192]
    - [63, 17.272]
  - - [8192, 8192, 1, 4096, 8192, 8192, 8192, 8192]
    - [63, 18.648]
  - - [8192, 8192, 1, 8192, 8192, 8192, 8192, 8192]
    - [18, 19.521]
  - - [1, 1, 1, 32, 1, 1, 1, 1]
    - [88, 0.0]
- null
- null
- DeviceEfficiency
- GridBased
