library/src/amd_detail/rocblaslt/src/Tensile/Logic/streamk/gfx942_80cu/aquavanjaram942_Cijk_Alik_Bjlk_HSS_BH_UserArgs.yaml
- {MinimumRequiredVersion: 4.33.0}
- aquavanjaram942
- {Architecture: gfx942, CUCount: 80}
- [Device 0049, Device 0050]
    SolutionIndex: 0
    SolutionNameMin: Cijk_Alik_Bjlk_HSS_BH_UserArgs_MT256x256x32_MI16x16x1_SN_LDSB1_CLR1_GSU0_GSUC0_GSUWGMRR0_K1_LBSPPA256_LBSPPB2048_LPB32_MIWT8_8_PLR1_SU32_SUM0_SUS256_SKXCCM0_VWA4_VWB2_WGM1_WGMXCC1_WGMXCCGn1
    SolutionIndex: 1
    SolutionNameMin: Cijk_Alik_Bjlk_HSS_BH_UserArgs_MT256x256x32_MI16x16x1_SN_LDSB1_CLR1_GSU0_GSUC0_GSUWGMRR0_K1_LBSPPA256_LBSPPB2048_LPB0_MIWT8_8_PLR1_SU32_SUM0_SUS256_SKXCCM0_VWA4_VWB4_WGM1_WGMXCC1_WGMXCCGn1
    SolutionIndex: 2
    SolutionNameMin: Cijk_Alik_Bjlk_HSS_BH_UserArgs_MT256x256x32_MI16x16x1_SN_LDSB1_CLR1_GSU0_GSUC0_GSUWGMRR0_K1_LBSPPA256_LBSPPB2048_LPB0_MIWT8_8_PLR1_SU32_SUM0_SUS256_SKXCCM0_VWA4_VWB4_WGM2_WGMXCC1_WGMXCCGn1
    SolutionIndex: 3
    SolutionNameMin: Cijk_Alik_Bjlk_HSS_BH_UserArgs_MT128x256x32_MI16x16x1_SN_LDSB1_CLR1_GSU0_GSUC0_GSUWGMRR0_K1_LBSPPA128_LBSPPB2048_LPB32_MIWT4_8_PLR1_SU32_SUM0_SUS256_SKXCCM0_VWA1_VWB2_WGM1_WGMXCC1_WGMXCCGn1
    SolutionIndex: 4
    SolutionNameMin: Cijk_Alik_Bjlk_HSS_BH_UserArgs_MT128x256x32_MI16x16x1_SN_LDSB1_CLR1_GSU0_GSUC0_GSUWGMRR0_K1_LBSPPA256_LBSPPB2048_LPB32_MIWT4_8_PLR1_SU32_SUM0_SUS256_SKXCCM0_VWA4_VWB2_WGM1_WGMXCC1_WGMXCCGn1
    SolutionIndex: 5
    SolutionNameMin: Cijk_Alik_Bjlk_HSS_BH_UserArgs_MT128x256x32_MI16x16x1_SN_LDSB1_CLR1_GSU0_GSUC0_GSUWGMRR0_K1_LBSPPA256_LBSPPB2048_LPB0_MIWT4_8_PLR1_SU32_SUM0_SUS256_SKXCCM0_VWA4_VWB4_WGM1_WGMXCC1_WGMXCCGn1
    SolutionIndex: 6
    SolutionNameMin: Cijk_Alik_Bjlk_HSS_BH_UserArgs_MT128x256x32_MI16x16x1_SN_LDSB1_CLR1_GSU0_GSUC0_GSUWGMRR0_K1_LBSPPA256_LBSPPB2048_LPB0_MIWT4_8_PLR1_SU32_SUM0_SUS256_SKXCCM0_VWA4_VWB8_WGM1_WGMXCC1_WGMXCCGn1
    SolutionIndex: 7
    SolutionNameMin: Cijk_Alik_Bjlk_HSS_BH_UserArgs_MT128x256x32_MI16x16x1_SN_LDSB1_CLR1_GSU0_GSUC0_GSUWGMRR0_K1_LBSPPA256_LBSPPB2048_LPB0_MIWT4_8_PLR1_SU32_SUM0_SUS256_SKXCCM0_VWA4_VWB4_WGM2_WGMXCC1_WGMXCCGn1
    SolutionIndex: 8
    SolutionNameMin: Cijk_Alik_Bjlk_HSS_BH_UserArgs_MT128x256x32_MI16x16x1_SN_LDSB1_CLR1_GSU0_GSUC0_GSUWGMRR0_K1_LBSPPA256_LBSPPB2048_LPB0_MIWT4_8_PLR1_SU32_SUM0_SUS256_SKXCCM0_VWA4_VWB8_WGM2_WGMXCC1_WGMXCCGn1
    SolutionIndex: 9
    SolutionNameMin: Cijk_Alik_Bjlk_HSS_BH_UserArgs_MT128x256x32_MI16x16x1_SN_LDSB1_CLR1_GSU0_GSUC0_GSUWGMRR0_K1_LBSPPA128_LBSPPB2048_LPB0_MIWT4_8_PLR1_SU32_SUM0_SUS256_SKXCCM0_VWA1_VWB4_WGM4_WGMXCC1_WGMXCCGn1
    SolutionIndex: 10
    SolutionNameMin: Cijk_Alik_Bjlk_HSS_BH_UserArgs_MT128x256x32_MI16x16x1_SN_LDSB1_CLR1_GSU0_GSUC0_GSUWGMRR0_K1_LBSPPA256_LBSPPB2048_LPB0_MIWT4_8_PLR1_SU32_SUM0_SUS256_SKXCCM0_VWA4_VWB4_WGM4_WGMXCC1_WGMXCCGn1
    SolutionIndex: 11
    SolutionNameMin: Cijk_Alik_Bjlk_HSS_BH_UserArgs_MT128x256x32_MI16x16x1_SN_LDSB1_CLR1_GSU0_GSUC0_GSUWGMRR0_K1_LBSPPA128_LBSPPB2048_LPB0_MIWT4_8_PLR1_SU32_SUM0_SUS256_SKXCCM0_VWA1_VWB8_WGM4_WGMXCC1_WGMXCCGn1
    SolutionIndex: 12
    SolutionNameMin: Cijk_Alik_Bjlk_HSS_BH_UserArgs_MT128x256x32_MI16x16x1_SN_LDSB1_CLR1_GSU0_GSUC0_GSUWGMRR0_K1_LBSPPA256_LBSPPB2048_LPB0_MIWT4_8_PLR1_SU32_SUM0_SUS256_SKXCCM0_VWA4_VWB8_WGM4_WGMXCC1_WGMXCCGn1
    SolutionIndex: 13
    SolutionNameMin: Cijk_Alik_Bjlk_HSS_BH_UserArgs_MT256x128x32_MI16x16x1_SN_LDSB1_CLR1_GSU0_GSUC0_GSUWGMRR0_K1_LBSPPA256_LBSPPB1024_LPB32_MIWT8_4_PLR1_SU32_SUM0_SUS256_SKXCCM0_VWA4_VWB2_WGM1_WGMXCC1_WGMXCCGn1
    SolutionIndex: 14
    SolutionNameMin: Cijk_Alik_Bjlk_HSS_BH_UserArgs_MT256x128x32_MI16x16x1_SN_LDSB1_CLR1_GSU0_GSUC0_GSUWGMRR0_K1_LBSPPA256_LBSPPB1024_LPB0_MIWT8_4_PLR1_SU32_SUM0_SUS256_SKXCCM0_VWA4_VWB4_WGM1_WGMXCC1_WGMXCCGn1
    SolutionIndex: 15
    SolutionNameMin: Cijk_Alik_Bjlk_HSS_BH_UserArgs_MT256x128x32_MI16x16x1_SN_LDSB1_CLR1_GSU0_GSUC0_GSUWGMRR0_K1_LBSPPA256_LBSPPB1024_LPB0_MIWT8_4_PLR1_SU32_SUM0_SUS256_SKXCCM0_VWA4_VWB4_WGM4_WGMXCC1_WGMXCCGn1
    SolutionIndex: 16
    SolutionNameMin: Cijk_Alik_Bjlk_HSS_BH_UserArgs_MT128x128x32_MI16x16x1_SN_LDSB1_CLR1_GSU0_GSUC0_GSUWGMRR0_K1_LBSPPA256_LBSPPB1024_LPB32_MIWT4_4_PLR1_SU32_SUM0_SUS256_SKXCCM0_VWA4_VWB2_WGM1_WGMXCC1_WGMXCCGn1
    SolutionIndex: 17
    SolutionNameMin: Cijk_Alik_Bjlk_HSS_BH_UserArgs_MT128x128x32_MI16x16x1_SN_LDSB1_CLR1_GSU0_GSUC0_GSUWGMRR0_K1_LBSPPA128_LBSPPB1024_LPB0_MIWT4_4_PLR1_SU32_SUM0_SUS256_SKXCCM0_VWA1_VWB4_WGM1_WGMXCC1_WGMXCCGn1
    SolutionIndex: 18
    SolutionNameMin: Cijk_Alik_Bjlk_HSS_BH_UserArgs_MT128x128x32_MI16x16x1_SN_LDSB1_CLR1_GSU0_GSUC0_GSUWGMRR0_K1_LBSPPA256_LBSPPB1024_LPB0_MIWT4_4_PLR1_SU32_SUM0_SUS256_SKXCCM0_VWA4_VWB4_WGM1_WGMXCC1_WGMXCCGn1
    SolutionIndex: 19
    SolutionNameMin: Cijk_Alik_Bjlk_HSS_BH_UserArgs_MT128x128x32_MI16x16x1_SN_LDSB1_CLR1_GSU0_GSUC0_GSUWGMRR0_K1_LBSPPA128_LBSPPB1024_LPB32_MIWT4_4_PLR1_SU32_SUM0_SUS256_SKXCCM0_VWA1_VWB2_WGM2_WGMXCC1_WGMXCCGn1
    SolutionIndex: 20
    SolutionNameMin: Cijk_Alik_Bjlk_HSS_BH_UserArgs_MT128x128x32_MI16x16x1_SN_LDSB1_CLR1_GSU0_GSUC0_GSUWGMRR0_K1_LBSPPA256_LBSPPB1024_LPB0_MIWT4_4_PLR1_SU32_SUM0_SUS256_SKXCCM0_VWA4_VWB4_WGM2_WGMXCC1_WGMXCCGn1
    SolutionIndex: 21
    SolutionNameMin: Cijk_Alik_Bjlk_HSS_BH_UserArgs_MT32x32x32_MI16x16x1_SN_LDSB0_CLR1_GSU0_GSUC0_GSUWGMRR0_K1_LBSPPA128_LBSPPB256_LPB16_MIWT1_1_PLR1_SU32_SUM0_SUS256_SKXCCM0_VWA1_VWB1_WGM1_WGMXCC1_WGMXCCGn1
    SolutionIndex: 22
    SolutionNameMin: Cijk_Alik_Bjlk_HSS_BH_UserArgs_MT32x32x32_MI16x16x1_SN_LDSB0_CLR0_GSU0_GSUC0_GSUWGMRR0_K1_LBSPPA128_LBSPPB256_LPB16_MIWT1_1_PLR0_SU32_SUM0_SUS256_SKXCCM0_VWA1_VWB1_WGM1_WGMXCC1_WGMXCCGn1
    SolutionIndex: 23
    SolutionNameMin: Cijk_Alik_Bjlk_HSS_BH_UserArgs_MT128x256x64_MI16x16x1_SN_LDSB1_CLR1_GSU0_GSUC0_GSUWGMRR0_K1_LBSPPA512_LBSPPB4096_LPB32_MIWT4_8_PLR1_SU32_SUM0_SUS256_SKXCCM0_VWA4_VWB2_WGM1_WGMXCC1_WGMXCCGn1
    SolutionIndex: 24
    SolutionNameMin: Cijk_Alik_Bjlk_HSS_BH_UserArgs_MT128x256x64_MI16x16x1_SN_LDSB1_CLR1_GSU0_GSUC0_GSUWGMRR0_K1_LBSPPA512_LBSPPB4096_LPB0_MIWT4_8_PLR1_SU32_SUM0_SUS256_SKXCCM0_VWA4_VWB4_WGM1_WGMXCC1_WGMXCCGn1
    SolutionIndex: 25
    SolutionNameMin: Cijk_Alik_Bjlk_HSS_BH_UserArgs_MT128x256x64_MI16x16x1_SN_LDSB1_CLR1_GSU0_GSUC0_GSUWGMRR0_K1_LBSPPA512_LBSPPB4096_LPB0_MIWT4_8_PLR1_SU32_SUM0_SUS256_SKXCCM0_VWA4_VWB4_WGM4_WGMXCC1_WGMXCCGn1
    SolutionIndex: 26
    SolutionNameMin: Cijk_Alik_Bjlk_HSS_BH_UserArgs_MT256x128x64_MI16x16x1_SN_LDSB1_CLR1_GSU0_GSUC0_GSUWGMRR0_K1_LBSPPA512_LBSPPB2048_LPB0_MIWT8_4_PLR1_SU32_SUM0_SUS256_SKXCCM0_VWA4_VWB4_WGM1_WGMXCC1_WGMXCCGn1
    SolutionIndex: 27
    SolutionNameMin: Cijk_Alik_Bjlk_HSS_BH_UserArgs_MT256x128x64_MI16x16x1_SN_LDSB1_CLR1_GSU0_GSUC0_GSUWGMRR0_K1_LBSPPA512_LBSPPB2048_LPB0_MIWT8_4_PLR1_SU32_SUM0_SUS256_SKXCCM0_VWA4_VWB4_WGM4_WGMXCC1_WGMXCCGn1
    SolutionIndex: 28
    SolutionNameMin: Cijk_Alik_Bjlk_HSS_BH_UserArgs_MT128x128x64_MI16x16x1_SN_LDSB1_CLR1_GSU0_GSUC0_GSUWGMRR0_K1_LBSPPA128_LBSPPB2048_LPB0_MIWT4_4_PLR1_SU32_SUM0_SUS256_SKXCCM0_VWA1_VWB4_WGM1_WGMXCC1_WGMXCCGn1
    SolutionIndex: 29
    SolutionNameMin: Cijk_Alik_Bjlk_HSS_BH_UserArgs_MT128x128x64_MI16x16x1_SN_LDSB1_CLR1_GSU0_GSUC0_GSUWGMRR0_K1_LBSPPA512_LBSPPB2048_LPB0_MIWT4_4_PLR1_SU32_SUM0_SUS256_SKXCCM0_VWA4_VWB4_WGM1_WGMXCC1_WGMXCCGn1
    SolutionIndex: 30
    SolutionNameMin: Cijk_Alik_Bjlk_HSS_BH_UserArgs_MT64x128x64_MI16x16x1_SN_LDSB1_CLR1_GSU0_GSUC0_GSUWGMRR0_K1_LBSPPA128_LBSPPB2048_LPB0_MIWT2_4_PLR1_SU32_SUM0_SUS256_SKXCCM0_VWA1_VWB4_WGM1_WGMXCC1_WGMXCCGn1
    SolutionIndex: 31
    SolutionNameMin: Cijk_Alik_Bjlk_HSS_BH_UserArgs_MT128x64x64_MI16x16x1_SN_LDSB1_CLR1_GSU0_GSUC0_GSUWGMRR0_K1_LBSPPA512_LBSPPB1024_LPB32_MIWT4_2_PLR1_SU32_SUM0_SUS256_SKXCCM0_VWA4_VWB2_WGM1_WGMXCC1_WGMXCCGn1
    SolutionIndex: 32
    SolutionNameMin: Cijk_Alik_Bjlk_HSS_BH_UserArgs_MT128x64x64_MI16x16x1_SN_LDSB1_CLR1_GSU0_GSUC0_GSUWGMRR0_K1_LBSPPA512_LBSPPB1024_LPB32_MIWT4_2_PLR1_SU32_SUM0_SUS256_SKXCCM0_VWA4_VWB2_WGM2_WGMXCC1_WGMXCCGn1
    SolutionIndex: 33
    SolutionNameMin: Cijk_Alik_Bjlk_HSS_BH_UserArgs_MT64x64x64_MI16x16x1_SN_LDSB1_CLR1_GSU0_GSUC0_GSUWGMRR0_K1_LBSPPA128_LBSPPB1024_LPB32_MIWT2_2_PLR1_SU32_SUM0_SUS256_SKXCCM0_VWA1_VWB2_WGM1_WGMXCC1_WGMXCCGn1
    SolutionIndex: 34
    SolutionNameMin: Cijk_Alik_Bjlk_HSS_BH_UserArgs_MT64x64x64_MI16x16x1_SN_LDSB1_CLR1_GSU0_GSUC0_GSUWGMRR0_K1_LBSPPA128_LBSPPB1024_LPB32_MIWT2_2_PLR1_SU32_SUM0_SUS256_SKXCCM0_VWA1_VWB2_WGM2_WGMXCC1_WGMXCCGn1
    SolutionIndex: 35
    SolutionNameMin: Cijk_Alik_Bjlk_HSS_BH_UserArgs_MT64x64x64_MI16x16x1_SN_LDSB1_CLR1_GSU0_GSUC0_GSUWGMRR0_K1_LBSPPA128_LBSPPB1024_LPB32_MIWT2_2_PLR1_SU32_SUM0_SUS256_SKXCCM0_VWA1_VWB2_WGM4_WGMXCC1_WGMXCCGn1
    SolutionIndex: 36
    SolutionNameMin: Cijk_Alik_Bjlk_HSS_BH_UserArgs_MT32x64x64_MI16x16x1_SN_LDSB0_CLR1_GSU0_GSUC0_GSUWGMRR0_K1_LBSPPA128_LBSPPB1024_LPB32_MIWT1_2_PLR1_SU32_SUM0_SUS256_SKXCCM0_VWA1_VWB2_WGM1_WGMXCC1_WGMXCCGn1
    SolutionIndex: 37
    SolutionNameMin: Cijk_Alik_Bjlk_HSS_BH_UserArgs_MT64x32x64_MI16x16x1_SN_LDSB0_CLR1_GSU0_GSUC0_GSUWGMRR0_K1_LBSPPA256_LBSPPB512_LPB16_MIWT2_1_PLR1_SU32_SUM0_SUS256_SKXCCM0_VWA2_VWB1_WGM1_WGMXCC1_WGMXCCGn1
    SolutionIndex: 38
    SolutionNameMin: Cijk_Alik_Bjlk_HSS_BH_UserArgs_MT32x32x64_MI16x16x1_SN_LDSB0_CLR1_GSU0_GSUC0_GSUWGMRR0_K1_LBSPPA128_LBSPPB512_LPB16_MIWT1_1_PLR1_SU32_SUM0_SUS256_SKXCCM0_VWA1_VWB1_WGM1_WGMXCC1_WGMXCCGn1
    SolutionIndex: 39
    SolutionNameMin: Cijk_Alik_Bjlk_HSS_BH_UserArgs_MT128x64x128_MI16x16x1_SN_LDSB1_CLR1_GSU0_GSUC0_GSUWGMRR0_K1_LBSPPA256_LBSPPB1024_LPB32_MIWT4_2_PLR2_SU32_SUM0_SUS256_SKXCCM0_VWA1_VWB2_WGM1_WGMXCC1_WGMXCCGn1
    SolutionIndex: 40
    SolutionNameMin: Cijk_Alik_Bjlk_HSS_BH_UserArgs_MT128x64x128_MI16x16x1_SN_LDSB1_CLR1_GSU0_GSUC0_GSUWGMRR0_K1_LBSPPA1024_LBSPPB1024_LPB32_MIWT4_2_PLR2_SU32_SUM0_SUS256_SKXCCM0_VWA4_VWB2_WGM1_WGMXCC1_WGMXCCGn1
    SolutionIndex: 41
    SolutionNameMin: Cijk_Alik_Bjlk_HSS_BH_UserArgs_MT32x64x128_MI16x16x1_SN_LDSB1_CLR1_GSU0_GSUC0_GSUWGMRR0_K1_LBSPPA256_LBSPPB1024_LPB32_MIWT1_2_PLR2_SU32_SUM0_SUS256_SKXCCM0_VWA1_VWB2_WGM1_WGMXCC1_WGMXCCGn1
    SolutionIndex: 42
    SolutionNameMin: Cijk_Alik_Bjlk_HSS_BH_UserArgs_MT64x32x128_MI16x16x1_SN_LDSB1_CLR1_GSU0_GSUC0_GSUWGMRR0_K1_LBSPPA256_LBSPPB512_LPB16_MIWT2_1_PLR2_SU32_SUM0_SUS256_SKXCCM0_VWA1_VWB1_WGM1_WGMXCC1_WGMXCCGn1
    SolutionIndex: 43
    SolutionNameMin: Cijk_Alik_Bjlk_HSS_BH_UserArgs_MT32x32x128_MI16x16x1_SN_LDSB1_CLR1_GSU0_GSUC0_GSUWGMRR0_K1_LBSPPA256_LBSPPB512_LPB16_MIWT1_1_PLR1_SU32_SUM0_SUS256_SKXCCM0_VWA1_VWB1_WGM1_WGMXCC1_WGMXCCGn1
    SolutionIndex: 44
    SolutionNameMin: Cijk_Alik_Bjlk_HSS_BH_UserArgs_MT32x32x128_MI16x16x1_SN_LDSB1_CLR1_GSU0_GSUC0_GSUWGMRR0_K1_LBSPPA256_LBSPPB512_LPB16_MIWT1_1_PLR2_SU32_SUM0_SUS256_SKXCCM0_VWA1_VWB1_WGM1_WGMXCC1_WGMXCCGn1
    SolutionIndex: 45
    SolutionNameMin: Cijk_Alik_Bjlk_HSS_BH_UserArgs_MT256x256x32_MI16x16x1_SN_LDSB1_CLR1_GSU0_GSUC0_GSUWGMRR0_K1_LBSPPA256_LBSPPB2048_LPB0_MIWT8_8_PLR1_SU32_SUM0_SUS256_SKXCCM4_VWA4_VWB4_WGM1_WGMXCC1_WGMXCCGn1
    SolutionIndex: 46
    SolutionNameMin: Cijk_Alik_Bjlk_HSS_BH_UserArgs_MT256x256x32_MI16x16x1_SN_LDSB1_CLR1_GSU0_GSUC0_GSUWGMRR0_K1_LBSPPA256_LBSPPB2048_LPB0_MIWT8_8_PLR1_SU32_SUM0_SUS256_SKXCCM4_VWA4_VWB8_WGM1_WGMXCC1_WGMXCCGn1
    SolutionIndex: 47
    SolutionNameMin: Cijk_Alik_Bjlk_HSS_BH_UserArgs_MT256x256x32_MI16x16x1_SN_LDSB1_CLR1_GSU0_GSUC0_GSUWGMRR0_K1_LBSPPA128_LBSPPB2048_LPB0_MIWT8_8_PLR1_SU32_SUM0_SUS256_SKXCCM4_VWA1_VWB4_WGM2_WGMXCC1_WGMXCCGn1
    SolutionIndex: 48
    SolutionNameMin: Cijk_Alik_Bjlk_HSS_BH_UserArgs_MT256x256x32_MI16x16x1_SN_LDSB1_CLR1_GSU0_GSUC0_GSUWGMRR0_K1_LBSPPA128_LBSPPB2048_LPB0_MIWT8_8_PLR1_SU32_SUM0_SUS256_SKXCCM4_VWA1_VWB8_WGM2_WGMXCC1_WGMXCCGn1
    SolutionIndex: 49
    SolutionNameMin: Cijk_Alik_Bjlk_HSS_BH_UserArgs_MT256x256x32_MI16x16x1_SN_LDSB1_CLR1_GSU0_GSUC0_GSUWGMRR0_K1_LBSPPA256_LBSPPB2048_LPB0_MIWT8_8_PLR1_SU32_SUM0_SUS256_SKXCCM4_VWA4_VWB4_WGM4_WGMXCC1_WGMXCCGn1
    SolutionIndex: 50
    SolutionNameMin: Cijk_Alik_Bjlk_HSS_BH_UserArgs_MT256x256x32_MI16x16x1_SN_LDSB1_CLR1_GSU0_GSUC0_GSUWGMRR0_K1_LBSPPA256_LBSPPB2048_LPB0_MIWT8_8_PLR1_SU32_SUM0_SUS256_SKXCCM4_VWA4_VWB8_WGM4_WGMXCC1_WGMXCCGn1
    SolutionIndex: 51
    SolutionNameMin: Cijk_Alik_Bjlk_HSS_BH_UserArgs_MT128x256x32_MI16x16x1_SN_LDSB1_CLR1_GSU0_GSUC0_GSUWGMRR0_K1_LBSPPA256_LBSPPB2048_LPB32_MIWT4_8_PLR1_SU32_SUM0_SUS256_SKXCCM4_VWA4_VWB2_WGM1_WGMXCC1_WGMXCCGn1
    SolutionIndex: 52
    SolutionNameMin: Cijk_Alik_Bjlk_HSS_BH_UserArgs_MT128x256x32_MI16x16x1_SN_LDSB1_CLR1_GSU0_GSUC0_GSUWGMRR0_K1_LBSPPA256_LBSPPB2048_LPB0_MIWT4_8_PLR1_SU32_SUM0_SUS256_SKXCCM4_VWA4_VWB4_WGM1_WGMXCC1_WGMXCCGn1
    SolutionIndex: 53
    SolutionNameMin: Cijk_Alik_Bjlk_HSS_BH_UserArgs_MT128x256x32_MI16x16x1_SN_LDSB1_CLR1_GSU0_GSUC0_GSUWGMRR0_K1_LBSPPA256_LBSPPB2048_LPB0_MIWT4_8_PLR1_SU32_SUM0_SUS256_SKXCCM4_VWA4_VWB8_WGM1_WGMXCC1_WGMXCCGn1
    SolutionIndex: 54
    SolutionNameMin: Cijk_Alik_Bjlk_HSS_BH_UserArgs_MT128x256x32_MI16x16x1_SN_LDSB1_CLR1_GSU0_GSUC0_GSUWGMRR0_K1_LBSPPA256_LBSPPB2048_LPB32_MIWT4_8_PLR1_SU32_SUM0_SUS256_SKXCCM4_VWA4_VWB2_WGM2_WGMXCC1_WGMXCCGn1
    SolutionIndex: 55
    SolutionNameMin: Cijk_Alik_Bjlk_HSS_BH_UserArgs_MT128x256x32_MI16x16x1_SN_LDSB1_CLR1_GSU0_GSUC0_GSUWGMRR0_K1_LBSPPA256_LBSPPB2048_LPB0_MIWT4_8_PLR1_SU32_SUM0_SUS256_SKXCCM4_VWA4_VWB4_WGM2_WGMXCC1_WGMXCCGn1
    SolutionIndex: 56
    SolutionNameMin: Cijk_Alik_Bjlk_HSS_BH_UserArgs_MT128x256x32_MI16x16x1_SN_LDSB1_CLR1_GSU0_GSUC0_GSUWGMRR0_K1_LBSPPA256_LBSPPB2048_LPB0_MIWT4_8_PLR1_SU32_SUM0_SUS256_SKXCCM4_VWA4_VWB8_WGM2_WGMXCC1_WGMXCCGn1
    SolutionIndex: 57
    SolutionNameMin: Cijk_Alik_Bjlk_HSS_BH_UserArgs_MT128x256x32_MI16x16x1_SN_LDSB1_CLR1_GSU0_GSUC0_GSUWGMRR0_K1_LBSPPA128_LBSPPB2048_LPB32_MIWT4_8_PLR1_SU32_SUM0_SUS256_SKXCCM4_VWA1_VWB2_WGM4_WGMXCC1_WGMXCCGn1
    SolutionIndex: 58
    SolutionNameMin: Cijk_Alik_Bjlk_HSS_BH_UserArgs_MT128x256x32_MI16x16x1_SN_LDSB1_CLR1_GSU0_GSUC0_GSUWGMRR0_K1_LBSPPA256_LBSPPB2048_LPB32_MIWT4_8_PLR1_SU32_SUM0_SUS256_SKXCCM4_VWA4_VWB2_WGM4_WGMXCC1_WGMXCCGn1
    SolutionIndex: 59
    SolutionNameMin: Cijk_Alik_Bjlk_HSS_BH_UserArgs_MT128x256x32_MI16x16x1_SN_LDSB1_CLR1_GSU0_GSUC0_GSUWGMRR0_K1_LBSPPA128_LBSPPB2048_LPB0_MIWT4_8_PLR1_SU32_SUM0_SUS256_SKXCCM4_VWA1_VWB4_WGM4_WGMXCC1_WGMXCCGn1
    SolutionIndex: 60
    SolutionNameMin: Cijk_Alik_Bjlk_HSS_BH_UserArgs_MT128x256x32_MI16x16x1_SN_LDSB1_CLR1_GSU0_GSUC0_GSUWGMRR0_K1_LBSPPA256_LBSPPB2048_LPB0_MIWT4_8_PLR1_SU32_SUM0_SUS256_SKXCCM4_VWA4_VWB4_WGM4_WGMXCC1_WGMXCCGn1
    SolutionIndex: 61
    SolutionNameMin: Cijk_Alik_Bjlk_HSS_BH_UserArgs_MT128x256x32_MI16x16x1_SN_LDSB1_CLR1_GSU0_GSUC0_GSUWGMRR0_K1_LBSPPA256_LBSPPB2048_LPB0_MIWT4_8_PLR1_SU32_SUM0_SUS256_SKXCCM4_VWA4_VWB8_WGM4_WGMXCC1_WGMXCCGn1
    SolutionIndex: 62
    SolutionNameMin: Cijk_Alik_Bjlk_HSS_BH_UserArgs_MT256x128x32_MI16x16x1_SN_LDSB1_CLR1_GSU0_GSUC0_GSUWGMRR0_K1_LBSPPA256_LBSPPB1024_LPB0_MIWT8_4_PLR1_SU32_SUM0_SUS256_SKXCCM4_VWA4_VWB4_WGM2_WGMXCC1_WGMXCCGn1
    SolutionIndex: 63
    SolutionNameMin: Cijk_Alik_Bjlk_HSS_BH_UserArgs_MT128x128x32_MI16x16x1_SN_LDSB1_CLR1_GSU0_GSUC0_GSUWGMRR0_K1_LBSPPA256_LBSPPB1024_LPB32_MIWT4_4_PLR1_SU32_SUM0_SUS256_SKXCCM4_VWA4_VWB2_WGM1_WGMXCC1_WGMXCCGn1
    SolutionIndex: 64
    SolutionNameMin: Cijk_Alik_Bjlk_HSS_BH_UserArgs_MT128x128x32_MI16x16x1_SN_LDSB1_CLR1_GSU0_GSUC0_GSUWGMRR0_K1_LBSPPA128_LBSPPB1024_LPB0_MIWT4_4_PLR1_SU32_SUM0_SUS256_SKXCCM4_VWA1_VWB4_WGM1_WGMXCC1_WGMXCCGn1
    SolutionIndex: 65
    SolutionNameMin: Cijk_Alik_Bjlk_HSS_BH_UserArgs_MT128x128x32_MI16x16x1_SN_LDSB1_CLR1_GSU0_GSUC0_GSUWGMRR0_K1_LBSPPA256_LBSPPB1024_LPB0_MIWT4_4_PLR1_SU32_SUM0_SUS256_SKXCCM4_VWA4_VWB4_WGM1_WGMXCC1_WGMXCCGn1
    SolutionIndex: 66
    SolutionNameMin: Cijk_Alik_Bjlk_HSS_BH_UserArgs_MT128x128x32_MI16x16x1_SN_LDSB1_CLR1_GSU0_GSUC0_GSUWGMRR0_K1_LBSPPA256_LBSPPB1024_LPB32_MIWT4_4_PLR1_SU32_SUM0_SUS256_SKXCCM4_VWA4_VWB2_WGM2_WGMXCC1_WGMXCCGn1
    SolutionIndex: 67
    SolutionNameMin: Cijk_Alik_Bjlk_HSS_BH_UserArgs_MT128x128x32_MI16x16x1_SN_LDSB1_CLR1_GSU0_GSUC0_GSUWGMRR0_K1_LBSPPA128_LBSPPB1024_LPB0_MIWT4_4_PLR1_SU32_SUM0_SUS256_SKXCCM4_VWA1_VWB4_WGM2_WGMXCC1_WGMXCCGn1
    SolutionIndex: 68
    SolutionNameMin: Cijk_Alik_Bjlk_HSS_BH_UserArgs_MT128x128x32_MI16x16x1_SN_LDSB1_CLR1_GSU0_GSUC0_GSUWGMRR0_K1_LBSPPA256_LBSPPB1024_LPB0_MIWT4_4_PLR1_SU32_SUM0_SUS256_SKXCCM4_VWA4_VWB4_WGM2_WGMXCC1_WGMXCCGn1
    SolutionIndex: 69
    SolutionNameMin: Cijk_Alik_Bjlk_HSS_BH_UserArgs_MT128x128x32_MI16x16x1_SN_LDSB1_CLR1_GSU0_GSUC0_GSUWGMRR0_K1_LBSPPA128_LBSPPB1024_LPB32_MIWT4_4_PLR1_SU32_SUM0_SUS256_SKXCCM4_VWA1_VWB2_WGM4_WGMXCC1_WGMXCCGn1
    SolutionIndex: 70
    SolutionNameMin: Cijk_Alik_Bjlk_HSS_BH_UserArgs_MT128x128x32_MI16x16x1_SN_LDSB1_CLR1_GSU0_GSUC0_GSUWGMRR0_K1_LBSPPA128_LBSPPB1024_LPB0_MIWT4_4_PLR1_SU32_SUM0_SUS256_SKXCCM4_VWA1_VWB4_WGM4_WGMXCC1_WGMXCCGn1
    SolutionIndex: 71
    SolutionNameMin: Cijk_Alik_Bjlk_HSS_BH_UserArgs_MT128x128x32_MI16x16x1_SN_LDSB1_CLR1_GSU0_GSUC0_GSUWGMRR0_K1_LBSPPA256_LBSPPB1024_LPB0_MIWT4_4_PLR1_SU32_SUM0_SUS256_SKXCCM4_VWA4_VWB4_WGM4_WGMXCC1_WGMXCCGn1
    SolutionIndex: 72
    SolutionNameMin: Cijk_Alik_Bjlk_HSS_BH_UserArgs_MT64x128x32_MI16x16x1_SN_LDSB0_CLR0_GSU0_GSUC0_GSUWGMRR0_K1_LBSPPA128_LBSPPB1024_LPB0_MIWT2_4_PLR0_SU32_SUM0_SUS256_SKXCCM4_VWA1_VWB4_WGM1_WGMXCC1_WGMXCCGn1
    SolutionIndex: 73
    SolutionNameMin: Cijk_Alik_Bjlk_HSS_BH_UserArgs_MT128x64x32_MI16x16x1_SN_LDSB0_CLR1_GSU0_GSUC0_GSUWGMRR0_K1_LBSPPA256_LBSPPB512_LPB32_MIWT4_2_PLR1_SU32_SUM0_SUS256_SKXCCM4_VWA4_VWB2_WGM1_WGMXCC1_WGMXCCGn1
    SolutionIndex: 74
    SolutionNameMin: Cijk_Alik_Bjlk_HSS_BH_UserArgs_MT128x64x32_MI16x16x1_SN_LDSB0_CLR1_GSU0_GSUC0_GSUWGMRR0_K1_LBSPPA256_LBSPPB512_LPB32_MIWT4_2_PLR1_SU32_SUM0_SUS256_SKXCCM4_VWA4_VWB2_WGM2_WGMXCC1_WGMXCCGn1
    SolutionIndex: 75
    SolutionNameMin: Cijk_Alik_Bjlk_HSS_BH_UserArgs_MT128x64x32_MI16x16x1_SN_LDSB0_CLR1_GSU0_GSUC0_GSUWGMRR0_K1_LBSPPA256_LBSPPB512_LPB32_MIWT4_2_PLR1_SU32_SUM0_SUS256_SKXCCM4_VWA4_VWB2_WGM4_WGMXCC1_WGMXCCGn1
    SolutionIndex: 76
    SolutionNameMin: Cijk_Alik_Bjlk_HSS_BH_UserArgs_MT128x64x32_MI16x16x1_SN_LDSB0_CLR0_GSU0_GSUC0_GSUWGMRR0_K1_LBSPPA256_LBSPPB512_LPB32_MIWT4_2_PLR0_SU32_SUM0_SUS256_SKXCCM4_VWA4_VWB2_WGM4_WGMXCC1_WGMXCCGn1
    SolutionIndex: 77
    SolutionNameMin: Cijk_Alik_Bjlk_HSS_BH_UserArgs_MT64x64x32_MI16x16x1_SN_LDSB0_CLR1_GSU0_GSUC0_GSUWGMRR0_K1_LBSPPA128_LBSPPB512_LPB32_MIWT2_2_PLR1_SU32_SUM0_SUS256_SKXCCM4_VWA1_VWB2_WGM1_WGMXCC1_WGMXCCGn1
    SolutionIndex: 78
    SolutionNameMin: Cijk_Alik_Bjlk_HSS_BH_UserArgs_MT32x32x32_MI16x16x1_SN_LDSB0_CLR1_GSU0_GSUC0_GSUWGMRR0_K1_LBSPPA128_LBSPPB256_LPB16_MIWT1_1_PLR1_SU32_SUM0_SUS256_SKXCCM4_VWA1_VWB1_WGM1_WGMXCC1_WGMXCCGn1
    SolutionIndex: 79
    SolutionNameMin: Cijk_Alik_Bjlk_HSS_BH_UserArgs_MT128x256x64_MI16x16x1_SN_LDSB1_CLR1_GSU0_GSUC0_GSUWGMRR0_K1_LBSPPA512_LBSPPB4096_LPB0_MIWT4_8_PLR1_SU32_SUM0_SUS256_SKXCCM4_VWA4_VWB4_WGM1_WGMXCC1_WGMXCCGn1
    SolutionIndex: 80
    SolutionNameMin: Cijk_Alik_Bjlk_HSS_BH_UserArgs_MT256x128x64_MI16x16x1_SN_LDSB1_CLR1_GSU0_GSUC0_GSUWGMRR0_K1_LBSPPA512_LBSPPB2048_LPB0_MIWT8_4_PLR1_SU32_SUM0_SUS256_SKXCCM4_VWA4_VWB4_WGM1_WGMXCC1_WGMXCCGn1
    SolutionIndex: 81
    SolutionNameMin: Cijk_Alik_Bjlk_HSS_BH_UserArgs_MT256x128x64_MI16x16x1_SN_LDSB1_CLR1_GSU0_GSUC0_GSUWGMRR0_K1_LBSPPA512_LBSPPB2048_LPB0_MIWT8_4_PLR1_SU32_SUM0_SUS256_SKXCCM4_VWA4_VWB4_WGM2_WGMXCC1_WGMXCCGn1
    SolutionIndex: 82
    SolutionNameMin: Cijk_Alik_Bjlk_HSS_BH_UserArgs_MT128x128x64_MI16x16x1_SN_LDSB1_CLR1_GSU0_GSUC0_GSUWGMRR0_K1_LBSPPA128_LBSPPB2048_LPB0_MIWT4_4_PLR1_SU32_SUM0_SUS256_SKXCCM4_VWA1_VWB4_WGM1_WGMXCC1_WGMXCCGn1
    SolutionIndex: 83
    SolutionNameMin: Cijk_Alik_Bjlk_HSS_BH_UserArgs_MT128x128x64_MI16x16x1_SN_LDSB1_CLR1_GSU0_GSUC0_GSUWGMRR0_K1_LBSPPA512_LBSPPB2048_LPB0_MIWT4_4_PLR1_SU32_SUM0_SUS256_SKXCCM4_VWA4_VWB4_WGM1_WGMXCC1_WGMXCCGn1
    SolutionIndex: 84
    SolutionNameMin: Cijk_Alik_Bjlk_HSS_BH_UserArgs_MT128x128x64_MI16x16x1_SN_LDSB1_CLR1_GSU0_GSUC0_GSUWGMRR0_K1_LBSPPA512_LBSPPB2048_LPB0_MIWT4_4_PLR1_SU32_SUM0_SUS256_SKXCCM4_VWA4_VWB4_WGM2_WGMXCC1_WGMXCCGn1
    SolutionIndex: 85
    SolutionNameMin: Cijk_Alik_Bjlk_HSS_BH_UserArgs_MT128x128x64_MI16x16x1_SN_LDSB1_CLR1_GSU0_GSUC0_GSUWGMRR0_K1_LBSPPA512_LBSPPB2048_LPB0_MIWT4_4_PLR1_SU32_SUM0_SUS256_SKXCCM4_VWA4_VWB4_WGM4_WGMXCC1_WGMXCCGn1
    SolutionIndex: 86
    SolutionNameMin: Cijk_Alik_Bjlk_HSS_BH_UserArgs_MT128x64x64_MI16x16x1_SN_LDSB1_CLR1_GSU0_GSUC0_GSUWGMRR0_K1_LBSPPA128_LBSPPB1024_LPB32_MIWT4_2_PLR1_SU32_SUM0_SUS256_SKXCCM4_VWA1_VWB2_WGM1_WGMXCC1_WGMXCCGn1
    SolutionIndex: 87
    SolutionNameMin: Cijk_Alik_Bjlk_HSS_BH_UserArgs_MT128x64x64_MI16x16x1_SN_LDSB1_CLR1_GSU0_GSUC0_GSUWGMRR0_K1_LBSPPA512_LBSPPB1024_LPB32_MIWT4_2_PLR1_SU32_SUM0_SUS256_SKXCCM4_VWA4_VWB2_WGM1_WGMXCC1_WGMXCCGn1
    SolutionIndex: 88
    SolutionNameMin: Cijk_Alik_Bjlk_HSS_BH_UserArgs_MT128x64x64_MI16x16x1_SN_LDSB1_CLR1_GSU0_GSUC0_GSUWGMRR0_K1_LBSPPA512_LBSPPB1024_LPB32_MIWT4_2_PLR1_SU32_SUM0_SUS256_SKXCCM4_VWA4_VWB2_WGM2_WGMXCC1_WGMXCCGn1
    SolutionIndex: 89
    SolutionNameMin: Cijk_Alik_Bjlk_HSS_BH_UserArgs_MT128x64x64_MI16x16x1_SN_LDSB1_CLR1_GSU0_GSUC0_GSUWGMRR0_K1_LBSPPA128_LBSPPB1024_LPB32_MIWT4_2_PLR1_SU32_SUM0_SUS256_SKXCCM4_VWA1_VWB2_WGM4_WGMXCC1_WGMXCCGn1
    SolutionIndex: 90
    SolutionNameMin: Cijk_Alik_Bjlk_HSS_BH_UserArgs_MT128x64x64_MI16x16x1_SN_LDSB1_CLR1_GSU0_GSUC0_GSUWGMRR0_K1_LBSPPA512_LBSPPB1024_LPB32_MIWT4_2_PLR1_SU32_SUM0_SUS256_SKXCCM4_VWA4_VWB2_WGM4_WGMXCC1_WGMXCCGn1
    SolutionIndex: 91
    SolutionNameMin: Cijk_Alik_Bjlk_HSS_BH_UserArgs_MT64x64x64_MI16x16x1_SN_LDSB1_CLR1_GSU0_GSUC0_GSUWGMRR0_K1_LBSPPA128_LBSPPB1024_LPB32_MIWT2_2_PLR1_SU32_SUM0_SUS256_SKXCCM4_VWA1_VWB2_WGM1_WGMXCC1_WGMXCCGn1
    SolutionIndex: 92
    SolutionNameMin: Cijk_Alik_Bjlk_HSS_BH_UserArgs_MT64x64x64_MI16x16x1_SN_LDSB1_CLR1_GSU0_GSUC0_GSUWGMRR0_K1_LBSPPA128_LBSPPB1024_LPB32_MIWT2_2_PLR1_SU32_SUM0_SUS256_SKXCCM4_VWA1_VWB2_WGM2_WGMXCC1_WGMXCCGn1
    SolutionIndex: 93
    SolutionNameMin: Cijk_Alik_Bjlk_HSS_BH_UserArgs_MT64x64x64_MI16x16x1_SN_LDSB1_CLR1_GSU0_GSUC0_GSUWGMRR0_K1_LBSPPA128_LBSPPB1024_LPB32_MIWT2_2_PLR1_SU32_SUM0_SUS256_SKXCCM4_VWA1_VWB2_WGM4_WGMXCC1_WGMXCCGn1
    SolutionIndex: 94
    SolutionNameMin: Cijk_Alik_Bjlk_HSS_BH_UserArgs_MT32x64x64_MI16x16x1_SN_LDSB0_CLR1_GSU0_GSUC0_GSUWGMRR0_K1_LBSPPA128_LBSPPB1024_LPB32_MIWT1_2_PLR1_SU32_SUM0_SUS256_SKXCCM4_VWA1_VWB2_WGM1_WGMXCC1_WGMXCCGn1
    SolutionIndex: 95
    SolutionNameMin: Cijk_Alik_Bjlk_HSS_BH_UserArgs_MT128x64x128_MI16x16x1_SN_LDSB1_CLR1_GSU0_GSUC0_GSUWGMRR0_K1_LBSPPA1024_LBSPPB1024_LPB32_MIWT4_2_PLR2_SU32_SUM0_SUS256_SKXCCM4_VWA4_VWB2_WGM1_WGMXCC1_WGMXCCGn1
    SolutionIndex: 96
    SolutionNameMin: Cijk_Alik_Bjlk_HSS_BH_UserArgs_MT128x64x128_MI16x16x1_SN_LDSB1_CLR1_GSU0_GSUC0_GSUWGMRR0_K1_LBSPPA1024_LBSPPB1024_LPB32_MIWT4_2_PLR2_SU32_SUM0_SUS256_SKXCCM4_VWA4_VWB2_WGM4_WGMXCC1_WGMXCCGn1
    SolutionIndex: 97
    SolutionNameMin: Cijk_Alik_Bjlk_HSS_BH_UserArgs_MT64x64x128_MI16x16x1_SN_LDSB1_CLR1_GSU0_GSUC0_GSUWGMRR0_K1_LBSPPA256_LBSPPB1024_LPB32_MIWT2_2_PLR2_SU32_SUM0_SUS256_SKXCCM4_VWA1_VWB2_WGM1_WGMXCC1_WGMXCCGn1
    SolutionIndex: 98
    SolutionNameMin: Cijk_Alik_Bjlk_HSS_BH_UserArgs_MT64x64x128_MI16x16x1_SN_LDSB1_CLR1_GSU0_GSUC0_GSUWGMRR0_K1_LBSPPA256_LBSPPB1024_LPB32_MIWT2_2_PLR2_SU32_SUM0_SUS256_SKXCCM4_VWA1_VWB2_WGM2_WGMXCC1_WGMXCCGn1
    SolutionIndex: 99
    SolutionNameMin: Cijk_Alik_Bjlk_HSS_BH_UserArgs_MT32x64x128_MI16x16x1_SN_LDSB1_CLR1_GSU0_GSUC0_GSUWGMRR0_K1_LBSPPA256_LBSPPB1024_LPB32_MIWT1_2_PLR2_SU32_SUM0_SUS256_SKXCCM4_VWA1_VWB2_WGM1_WGMXCC1_WGMXCCGn1
    SolutionIndex: 100
    SolutionNameMin: Cijk_Alik_Bjlk_HSS_BH_UserArgs_MT32x64x128_MI16x16x1_SN_LDSB1_CLR1_GSU0_GSUC0_GSUWGMRR0_K1_LBSPPA256_LBSPPB1024_LPB32_MIWT1_2_PLR2_SU32_SUM0_SUS256_SKXCCM4_VWA1_VWB2_WGM2_WGMXCC1_WGMXCCGn1
    SolutionIndex: 101
    SolutionNameMin: Cijk_Alik_Bjlk_HSS_BH_UserArgs_MT32x64x128_MI16x16x1_SN_LDSB1_CLR1_GSU0_GSUC0_GSUWGMRR0_K1_LBSPPA256_LBSPPB1024_LPB32_MIWT1_2_PLR1_SU32_SUM0_SUS256_SKXCCM4_VWA1_VWB2_WGM4_WGMXCC1_WGMXCCGn1
    SolutionIndex: 102
    SolutionNameMin: Cijk_Alik_Bjlk_HSS_BH_UserArgs_MT32x32x128_MI16x16x1_SN_LDSB1_CLR1_GSU0_GSUC0_GSUWGMRR0_K1_LBSPPA256_LBSPPB512_LPB16_MIWT1_1_PLR1_SU32_SUM0_SUS256_SKXCCM4_VWA1_VWB1_WGM1_WGMXCC1_WGMXCCGn1
    SolutionIndex: 103
    SolutionNameMin: Cijk_Alik_Bjlk_HSS_BH_UserArgs_MT32x32x128_MI16x16x1_SN_LDSB1_CLR1_GSU0_GSUC0_GSUWGMRR0_K1_LBSPPA256_LBSPPB512_LPB16_MIWT1_1_PLR2_SU32_SUM0_SUS256_SKXCCM4_VWA1_VWB1_WGM1_WGMXCC1_WGMXCCGn1
    SolutionIndex: 104
    SolutionNameMin: Cijk_Alik_Bjlk_HSS_BH_UserArgs_MT32x32x32_MI16x16x1_SN_LDSB0_CLR0_GSU0_GSUC0_GSUWGMRR0_K1_LBSPPA128_LBSPPB256_LPB16_MIWT1_1_PLR0_SU32_SUM0_SUS256_SKXCCM0_VWA1_VWB1_WGM1_WGMXCC1_WGMXCCGn1
- - - [128, 128, 1, 128, 128, 128, 128, 128]
    - [103, 0.088]
  - - [128, 128, 1, 256, 128, 128, 256, 128]
    - [44, 0.11]
  - - [128, 128, 1, 512, 128, 128, 512, 128]
    - [43, 0.185]
  - - [128, 128, 1, 1024, 128, 128, 1024, 128]
    - [102, 0.29]
  - - [128, 128, 1, 2048, 128, 128, 2048, 128]
    - [43, 0.534]
  - - [128, 128, 1, 4096, 128, 128, 4096, 128]
    - [38, 0.928]
  - - [128, 128, 1, 8192, 128, 128, 8192, 128]
    - [43, 1.487]
  - - [128, 256, 1, 128, 128, 128, 128, 256]
    - [103, 0.17]
  - - [128, 256, 1, 256, 128, 128, 256, 256]
    - [43, 0.221]
  - - [128, 256, 1, 512, 128, 128, 512, 256]
    - [102, 0.372]
  - - [128, 256, 1, 1024, 128, 128, 1024, 256]
    - [43, 0.615]
  - - [128, 256, 1, 2048, 128, 128, 2048, 256]
    - [78, 1.04]
  - - [128, 256, 1, 4096, 128, 128, 4096, 256]
    - [41, 1.618]
  - - [128, 256, 1, 8192, 128, 128, 8192, 256]
    - [99, 2.508]
  - - [128, 512, 1, 128, 128, 128, 128, 512]
    - [44, 0.332]
  - - [128, 512, 1, 256, 128, 128, 256, 512]
    - [43, 0.427]
  - - [128, 512, 1, 512, 128, 128, 512, 512]
    - [21, 0.707]
  - - [128, 512, 1, 1024, 128, 128, 1024, 512]
    - [43, 1.252]
  - - [128, 512, 1, 2048, 128, 128, 2048, 512]
    - [103, 1.862]
  - - [128, 512, 1, 4096, 128, 128, 4096, 512]
    - [94, 2.807]
  - - [128, 512, 1, 8192, 128, 128, 8192, 512]
    - [97, 4.242]
  - - [128, 1024, 1, 128, 128, 128, 128, 1024]
    - [41, 0.617]
  - - [128, 1024, 1, 256, 128, 128, 256, 1024]
    - [43, 1.034]
  - - [128, 1024, 1, 512, 128, 128, 512, 1024]
    - [43, 1.644]
  - - [128, 1024, 1, 1024, 128, 128, 1024, 1024]
    - [44, 2.282]
  - - [128, 1024, 1, 2048, 128, 128, 2048, 1024]
    - [41, 3.155]
  - - [128, 1024, 1, 4096, 128, 128, 4096, 1024]
    - [91, 4.701]
  - - [128, 1024, 1, 8192, 128, 128, 8192, 1024]
    - [40, 6.67]
  - - [128, 2048, 1, 128, 128, 128, 128, 2048]
    - [37, 1.088]
  - - [128, 2048, 1, 256, 128, 128, 256, 2048]
    - [36, 1.817]
  - - [128, 2048, 1, 512, 128, 128, 512, 2048]
    - [99, 2.762]
  - - [128, 2048, 1, 1024, 128, 128, 1024, 2048]
    - [99, 3.872]
  - - [128, 2048, 1, 2048, 128, 128, 2048, 2048]
    - [72, 4.38]
  - - [128, 2048, 1, 4096, 128, 128, 4096, 2048]
    - [87, 6.779]
  - - [128, 2048, 1, 8192, 128, 128, 8192, 2048]
    - [29, 9.764]
  - - [128, 4096, 1, 128, 128, 128, 128, 4096]
    - [91, 1.848]
  - - [128, 4096, 1, 256, 128, 128, 256, 4096]
    - [91, 3.185]
  - - [128, 4096, 1, 512, 128, 128, 512, 4096]
    - [91, 4.72]
  - - [128, 4096, 1, 1024, 128, 128, 1024, 4096]
    - [90, 5.445]
  - - [128, 4096, 1, 2048, 128, 128, 2048, 4096]
    - [91, 6.151]
  - - [128, 4096, 1, 4096, 128, 128, 4096, 4096]
    - [16, 8.454]
  - - [128, 4096, 1, 8192, 128, 128, 8192, 4096]
    - [79, 11.428]
  - - [128, 8192, 1, 128, 128, 128, 128, 8192]
    - [87, 2.863]
  - - [128, 8192, 1, 256, 128, 128, 256, 8192]
    - [87, 4.786]
  - - [128, 8192, 1, 512, 128, 128, 512, 8192]
    - [86, 6.602]
  - - [128, 8192, 1, 1024, 128, 128, 1024, 8192]
    - [95, 7.212]
  - - [128, 8192, 1, 2048, 128, 128, 2048, 8192]
    - [87, 8.164]
  - - [128, 8192, 1, 4096, 128, 128, 4096, 8192]
    - [5, 10.772]
  - - [128, 8192, 1, 8192, 128, 128, 8192, 8192]
    - [24, 11.361]
  - - [256, 128, 1, 128, 256, 256, 128, 128]
    - [102, 0.17]
  - - [256, 128, 1, 256, 256, 256, 256, 128]
    - [44, 0.22]
  - - [256, 128, 1, 512, 256, 256, 512, 128]
    - [102, 0.363]
  - - [256, 128, 1, 1024, 256, 256, 1024, 128]
    - [103, 0.604]
  - - [256, 128, 1, 2048, 256, 256, 2048, 128]
    - [78, 1.058]
  - - [256, 128, 1, 4096, 256, 256, 4096, 128]
    - [99, 1.618]
  - - [256, 128, 1, 8192, 256, 256, 8192, 128]
    - [99, 2.623]
  - - [256, 256, 1, 128, 256, 256, 128, 256]
    - [102, 0.333]
  - - [256, 256, 1, 256, 256, 256, 256, 256]
    - [44, 0.428]
  - - [256, 256, 1, 512, 256, 256, 512, 256]
    - [22, 0.711]
  - - [256, 256, 1, 1024, 256, 256, 1024, 256]
    - [43, 1.252]
  - - [256, 256, 1, 2048, 256, 256, 2048, 256]
    - [43, 1.887]
  - - [256, 256, 1, 4096, 256, 256, 4096, 256]
    - [94, 2.857]
  - - [256, 256, 1, 8192, 256, 256, 8192, 256]
    - [98, 4.167]
  - - [256, 512, 1, 128, 256, 256, 128, 512]
    - [99, 0.615]
  - - [256, 512, 1, 256, 256, 256, 256, 512]
    - [102, 1.023]
  - - [256, 512, 1, 512, 256, 256, 512, 512]
    - [43, 1.646]
  - - [256, 512, 1, 1024, 256, 256, 1024, 512]
    - [44, 2.283]
  - - [256, 512, 1, 2048, 256, 256, 2048, 512]
    - [101, 3.218]
  - - [256, 512, 1, 4096, 256, 256, 4096, 512]
    - [91, 4.786]
  - - [256, 512, 1, 8192, 256, 256, 8192, 512]
    - [96, 6.652]
  - - [256, 1024, 1, 128, 256, 256, 128, 1024]
    - [94, 1.08]
  - - [256, 1024, 1, 256, 256, 256, 256, 1024]
    - [36, 1.814]
  - - [256, 1024, 1, 512, 256, 256, 512, 1024]
    - [99, 2.799]
  - - [256, 1024, 1, 1024, 256, 256, 1024, 1024]
    - [100, 3.855]
  - - [256, 1024, 1, 2048, 256, 256, 2048, 1024]
    - [76, 4.46]
  - - [256, 1024, 1, 4096, 256, 256, 4096, 1024]
    - [87, 6.934]
  - - [256, 1024, 1, 8192, 256, 256, 8192, 1024]
    - [85, 9.758]
  - - [256, 2048, 1, 128, 256, 256, 128, 2048]
    - [91, 1.885]
  - - [256, 2048, 1, 256, 256, 256, 256, 2048]
    - [91, 3.151]
  - - [256, 2048, 1, 512, 256, 256, 512, 2048]
    - [91, 4.697]
  - - [256, 2048, 1, 1024, 256, 256, 1024, 2048]
    - [87, 5.488]
  - - [256, 2048, 1, 2048, 256, 256, 2048, 2048]
    - [34, 6.167]
  - - [256, 2048, 1, 4096, 256, 256, 4096, 2048]
    - [20, 7.989]
  - - [256, 2048, 1, 8192, 256, 256, 8192, 2048]
    - [27, 11.389]
  - - [256, 4096, 1, 128, 256, 256, 128, 4096]
    - [75, 2.801]
  - - [256, 4096, 1, 256, 256, 256, 256, 4096]
    - [87, 4.774]
  - - [256, 4096, 1, 512, 256, 256, 512, 4096]
    - [89, 6.872]
  - - [256, 4096, 1, 1024, 256, 256, 1024, 4096]
    - [95, 7.205]
  - - [256, 4096, 1, 2048, 256, 256, 2048, 4096]
    - [87, 8.297]
  - - [256, 4096, 1, 4096, 256, 256, 4096, 4096]
    - [15, 10.544]
  - - [256, 4096, 1, 8192, 256, 256, 8192, 4096]
    - [26, 11.489]
  - - [256, 8192, 1, 128, 256, 256, 128, 8192]
    - [18, 3.901]
  - - [256, 8192, 1, 256, 256, 256, 256, 8192]
    - [70, 5.913]
  - - [256, 8192, 1, 512, 256, 256, 512, 8192]
    - [83, 7.406]
  - - [256, 8192, 1, 1024, 256, 256, 1024, 8192]
    - [87, 9.273]
  - - [256, 8192, 1, 2048, 256, 256, 2048, 8192]
    - [88, 10.58]
  - - [256, 8192, 1, 4096, 256, 256, 4096, 8192]
    - [20, 11.295]
  - - [256, 8192, 1, 8192, 256, 256, 8192, 8192]
    - [7, 13.56]
  - - [512, 128, 1, 128, 512, 512, 128, 128]
    - [44, 0.334]
  - - [512, 128, 1, 256, 512, 512, 256, 128]
    - [44, 0.433]
  - - [512, 128, 1, 512, 512, 512, 512, 128]
    - [22, 0.715]
  - - [512, 128, 1, 1024, 512, 512, 1024, 128]
    - [43, 1.257]
  - - [512, 128, 1, 2048, 512, 512, 2048, 128]
    - [44, 1.888]
  - - [512, 128, 1, 4096, 512, 512, 4096, 128]
    - [94, 2.861]
  - - [512, 128, 1, 8192, 512, 512, 8192, 128]
    - [97, 4.25]
  - - [512, 256, 1, 128, 512, 512, 128, 256]
    - [41, 0.622]
  - - [512, 256, 1, 256, 512, 512, 256, 256]
    - [43, 1.03]
  - - [512, 256, 1, 512, 512, 512, 512, 256]
    - [102, 1.645]
  - - [512, 256, 1, 1024, 512, 512, 1024, 256]
    - [103, 2.279]
  - - [512, 256, 1, 2048, 512, 512, 2048, 256]
    - [99, 3.233]
  - - [512, 256, 1, 4096, 512, 512, 4096, 256]
    - [92, 4.708]
  - - [512, 256, 1, 8192, 512, 512, 8192, 256]
    - [40, 6.597]
  - - [512, 512, 1, 128, 512, 512, 128, 512]
    - [99, 1.096]
  - - [512, 512, 1, 256, 512, 512, 256, 512]
    - [99, 1.841]
  - - [512, 512, 1, 512, 512, 512, 512, 512]
    - [99, 2.823]
  - - [512, 512, 1, 1024, 512, 512, 1024, 512]
    - [99, 3.906]
  - - [512, 512, 1, 2048, 512, 512, 2048, 512]
    - [76, 4.643]
  - - [512, 512, 1, 4096, 512, 512, 4096, 512]
    - [90, 6.948]
  - - [512, 512, 1, 8192, 512, 512, 8192, 512]
    - [85, 9.747]
  - - [512, 1024, 1, 128, 512, 512, 128, 1024]
    - [91, 1.857]
  - - [512, 1024, 1, 256, 512, 512, 256, 1024]
    - [91, 3.165]
  - - [512, 1024, 1, 512, 512, 512, 512, 1024]
    - [91, 4.728]
  - - [512, 1024, 1, 1024, 512, 512, 1024, 1024]
    - [87, 5.56]
  - - [512, 1024, 1, 2048, 512, 512, 2048, 1024]
    - [91, 6.252]
  - - [512, 1024, 1, 4096, 512, 512, 4096, 1024]
    - [5, 7.943]
  - - [512, 1024, 1, 8192, 512, 512, 8192, 1024]
    - [80, 11.459]
  - - [512, 2048, 1, 128, 512, 512, 128, 2048]
    - [87, 2.886]
  - - [512, 2048, 1, 256, 512, 512, 256, 2048]
    - [87, 4.761]
  - - [512, 2048, 1, 512, 512, 512, 512, 2048]
    - [86, 6.842]
  - - [512, 2048, 1, 1024, 512, 512, 1024, 2048]
    - [95, 7.272]
  - - [512, 2048, 1, 2048, 512, 512, 2048, 2048]
    - [87, 8.343]
  - - [512, 2048, 1, 4096, 512, 512, 4096, 2048]
    - [10, 10.506]
  - - [512, 2048, 1, 8192, 512, 512, 8192, 2048]
    - [23, 11.309]
  - - [512, 4096, 1, 128, 512, 512, 128, 4096]
    - [65, 3.968]
  - - [512, 4096, 1, 256, 512, 512, 256, 4096]
    - [64, 6.035]
  - - [512, 4096, 1, 512, 512, 512, 512, 4096]
    - [84, 7.52]
  - - [512, 4096, 1, 1024, 512, 512, 1024, 4096]
    - [87, 9.307]
  - - [512, 4096, 1, 2048, 512, 512, 2048, 4096]
    - [86, 10.589]
  - - [512, 4096, 1, 4096, 512, 512, 4096, 4096]
    - [8, 11.069]
  - - [512, 4096, 1, 8192, 512, 512, 8192, 4096]
    - [56, 13.493]
  - - [512, 8192, 1, 128, 512, 512, 128, 8192]
    - [5, 5.172]
  - - [512, 8192, 1, 256, 512, 512, 256, 8192]
    - [55, 7.749]
  - - [512, 8192, 1, 512, 512, 512, 512, 8192]
    - [68, 9.462]
  - - [512, 8192, 1, 1024, 512, 512, 1024, 8192]
    - [65, 11.456]
  - - [512, 8192, 1, 2048, 512, 512, 2048, 8192]
    - [82, 12.512]
  - - [512, 8192, 1, 4096, 512, 512, 4096, 8192]
    - [6, 13.434]
  - - [512, 8192, 1, 8192, 512, 512, 8192, 8192]
    - [53, 15.318]
  - - [1024, 128, 1, 128, 1024, 1024, 128, 128]
    - [42, 0.617]
  - - [1024, 128, 1, 256, 1024, 1024, 256, 128]
    - [43, 1.042]
  - - [1024, 128, 1, 512, 1024, 1024, 512, 128]
    - [44, 1.645]
  - - [1024, 128, 1, 1024, 1024, 1024, 1024, 128]
    - [103, 2.294]
  - - [1024, 128, 1, 2048, 1024, 1024, 2048, 128]
    - [99, 3.247]
  - - [1024, 128, 1, 4096, 1024, 1024, 4096, 128]
    - [93, 4.735]
  - - [1024, 128, 1, 8192, 1024, 1024, 8192, 128]
    - [40, 6.578]
  - - [1024, 256, 1, 128, 1024, 1024, 128, 256]
    - [99, 1.101]
  - - [1024, 256, 1, 256, 1024, 1024, 256, 256]
    - [41, 1.833]
  - - [1024, 256, 1, 512, 1024, 1024, 512, 256]
    - [99, 2.839]
  - - [1024, 256, 1, 1024, 1024, 1024, 1024, 256]
    - [99, 3.911]
  - - [1024, 256, 1, 2048, 1024, 1024, 2048, 256]
    - [75, 4.612]
  - - [1024, 256, 1, 4096, 1024, 1024, 4096, 256]
    - [31, 6.939]
  - - [1024, 256, 1, 8192, 1024, 1024, 8192, 256]
    - [84, 9.692]
  - - [1024, 512, 1, 128, 1024, 1024, 128, 512]
    - [91, 1.9]
  - - [1024, 512, 1, 256, 1024, 1024, 256, 512]
    - [91, 3.199]
  - - [1024, 512, 1, 512, 1024, 1024, 512, 512]
    - [91, 4.742]
  - - [1024, 512, 1, 1024, 1024, 1024, 1024, 512]
    - [87, 5.585]
  - - [1024, 512, 1, 2048, 1024, 1024, 2048, 512]
    - [34, 6.234]
  - - [1024, 512, 1, 4096, 1024, 1024, 4096, 512]
    - [60, 7.969]
  - - [1024, 512, 1, 8192, 1024, 1024, 8192, 512]
    - [25, 11.39]
  - - [1024, 1024, 1, 128, 1024, 1024, 128, 1024]
    - [73, 2.88]
  - - [1024, 1024, 1, 256, 1024, 1024, 256, 1024]
    - [88, 4.744]
  - - [1024, 1024, 1, 512, 1024, 1024, 512, 1024]
    - [89, 6.847]
  - - [1024, 1024, 1, 1024, 1024, 1024, 1024, 1024]
    - [40, 7.33]
  - - [1024, 1024, 1, 2048, 1024, 1024, 2048, 1024]
    - [31, 8.231]
  - - [1024, 1024, 1, 4096, 1024, 1024, 4096, 1024]
    - [12, 10.413]
  - - [1024, 1024, 1, 8192, 1024, 1024, 8192, 1024]
    - [26, 11.499]
  - - [1024, 2048, 1, 128, 1024, 1024, 128, 2048]
    - [65, 3.954]
  - - [1024, 2048, 1, 256, 1024, 1024, 256, 2048]
    - [64, 5.989]
  - - [1024, 2048, 1, 512, 1024, 1024, 512, 2048]
    - [29, 7.647]
  - - [1024, 2048, 1, 1024, 1024, 1024, 1024, 2048]
    - [32, 9.373]
  - - [1024, 2048, 1, 2048, 1024, 1024, 2048, 2048]
    - [31, 10.461]
  - - [1024, 2048, 1, 4096, 1024, 1024, 4096, 2048]
    - [53, 11.171]
  - - [1024, 2048, 1, 8192, 1024, 1024, 8192, 2048]
    - [60, 13.469]
  - - [1024, 4096, 1, 128, 1024, 1024, 128, 4096]
    - [12, 5.109]
  - - [1024, 4096, 1, 256, 1024, 1024, 256, 4096]
    - [11, 7.685]
  - - [1024, 4096, 1, 512, 1024, 1024, 512, 4096]
    - [65, 9.371]
  - - [1024, 4096, 1, 1024, 1024, 1024, 1024, 4096]
    - [18, 11.21]
  - - [1024, 4096, 1, 2048, 1024, 1024, 2048, 4096]
    - [29, 12.628]
  - - [1024, 4096, 1, 4096, 1024, 1024, 4096, 4096]
    - [56, 13.435]
  - - [1024, 4096, 1, 8192, 1024, 1024, 8192, 4096]
    - [56, 15.334]
  - - [1024, 8192, 1, 128, 1024, 1024, 128, 8192]
    - [12, 5.391]
  - - [1024, 8192, 1, 256, 1024, 1024, 256, 8192]
    - [11, 8.009]
  - - [1024, 8192, 1, 512, 1024, 1024, 512, 8192]
    - [52, 11.086]
  - - [1024, 8192, 1, 1024, 1024, 1024, 1024, 8192]
    - [7, 13.56]
  - - [1024, 8192, 1, 2048, 1024, 1024, 2048, 8192]
    - [26, 13.893]
  - - [1024, 8192, 1, 4096, 1024, 1024, 4096, 8192]
    - [53, 15.115]
  - - [1024, 8192, 1, 8192, 1024, 1024, 8192, 8192]
    - [61, 16.742]
  - - [2048, 128, 1, 128, 2048, 2048, 128, 128]
    - [99, 1.096]
  - - [2048, 128, 1, 256, 2048, 2048, 256, 128]
    - [99, 1.834]
  - - [2048, 128, 1, 512, 2048, 2048, 512, 128]
    - [99, 2.829]
  - - [2048, 128, 1, 1024, 2048, 2048, 1024, 128]
    - [99, 3.914]
  - - [2048, 128, 1, 2048, 2048, 2048, 2048, 128]
    - [74, 4.575]
  - - [2048, 128, 1, 4096, 2048, 2048, 4096, 128]
    - [90, 6.735]
  - - [2048, 128, 1, 8192, 2048, 2048, 8192, 128]
    - [29, 9.76]
  - - [2048, 256, 1, 128, 2048, 2048, 128, 256]
    - [77, 1.865]
  - - [2048, 256, 1, 256, 2048, 2048, 256, 256]
    - [91, 3.204]
  - - [2048, 256, 1, 512, 2048, 2048, 512, 256]
    - [91, 4.762]
  - - [2048, 256, 1, 1024, 2048, 2048, 1024, 256]
    - [90, 5.542]
  - - [2048, 256, 1, 2048, 2048, 2048, 2048, 256]
    - [93, 6.298]
  - - [2048, 256, 1, 4096, 2048, 2048, 4096, 256]
    - [52, 7.951]
  - - [2048, 256, 1, 8192, 2048, 2048, 8192, 256]
    - [81, 11.481]
  - - [2048, 512, 1, 128, 2048, 2048, 128, 512]
    - [87, 2.893]
  - - [2048, 512, 1, 256, 2048, 2048, 256, 512]
    - [87, 4.789]
  - - [2048, 512, 1, 512, 2048, 2048, 512, 512]
    - [89, 6.849]
  - - [2048, 512, 1, 1024, 2048, 2048, 1024, 512]
    - [40, 7.35]
  - - [2048, 512, 1, 2048, 2048, 2048, 2048, 512]
    - [33, 8.273]
  - - [2048, 512, 1, 4096, 2048, 2048, 4096, 512]
    - [10, 10.338]
  - - [2048, 512, 1, 8192, 2048, 2048, 8192, 512]
    - [24, 11.4]
  - - [2048, 1024, 1, 128, 2048, 2048, 128, 1024]
    - [65, 3.954]
  - - [2048, 1024, 1, 256, 2048, 2048, 256, 1024]
    - [19, 5.953]
  - - [2048, 1024, 1, 512, 2048, 2048, 512, 1024]
    - [29, 7.555]
  - - [2048, 1024, 1, 1024, 2048, 2048, 1024, 1024]
    - [31, 9.355]
  - - [2048, 1024, 1, 2048, 2048, 2048, 2048, 1024]
    - [31, 10.48]
  - - [2048, 1024, 1, 4096, 2048, 2048, 4096, 1024]
    - [52, 11.1]
  - - [2048, 1024, 1, 8192, 2048, 2048, 8192, 1024]
    - [60, 13.425]
  - - [2048, 2048, 1, 128, 2048, 2048, 128, 2048]
    - [52, 5.133]
  - - [2048, 2048, 1, 256, 2048, 2048, 256, 2048]
    - [9, 7.691]
  - - [2048, 2048, 1, 512, 2048, 2048, 512, 2048]
    - [18, 9.44]
  - - [2048, 2048, 1, 1024, 2048, 2048, 1024, 2048]
    - [17, 11.273]
  - - [2048, 2048, 1, 2048, 2048, 2048, 2048, 2048]
    - [28, 12.659]
  - - [2048, 2048, 1, 4096, 2048, 2048, 4096, 2048]
    - [60, 13.475]
  - - [2048, 2048, 1, 8192, 2048, 2048, 8192, 2048]
    - [55, 15.408]
  - - [2048, 4096, 1, 128, 2048, 2048, 128, 4096]
    - [55, 5.37]
  - - [2048, 4096, 1, 256, 2048, 2048, 256, 4096]
    - [51, 8.183]
  - - [2048, 4096, 1, 512, 2048, 2048, 512, 4096]
    - [4, 11.184]
  - - [2048, 4096, 1, 1024, 2048, 2048, 1024, 4096]
    - [14, 13.45]
  - - [2048, 4096, 1, 2048, 2048, 2048, 2048, 4096]
    - [26, 13.853]
  - - [2048, 4096, 1, 4096, 2048, 2048, 4096, 4096]
    - [52, 15.174]
  - - [2048, 4096, 1, 8192, 2048, 2048, 8192, 4096]
    - [2, 16.881]
  - - [2048, 8192, 1, 128, 2048, 2048, 128, 8192]
    - [63, 5.483]
  - - [2048, 8192, 1, 256, 2048, 2048, 256, 8192]
    - [47, 7.707]
  - - [2048, 8192, 1, 512, 2048, 2048, 512, 8192]
    - [48, 10.79]
  - - [2048, 8192, 1, 1024, 2048, 2048, 1024, 8192]
    - [46, 13.406]
  - - [2048, 8192, 1, 2048, 2048, 2048, 2048, 8192]
    - [53, 14.824]
  - - [2048, 8192, 1, 4096, 2048, 2048, 4096, 8192]
    - [53, 16.401]
  - - [2048, 8192, 1, 8192, 2048, 2048, 8192, 8192]
    - [46, 18.006]
  - - [4096, 128, 1, 128, 4096, 4096, 128, 128]
    - [35, 1.853]
  - - [4096, 128, 1, 256, 4096, 4096, 256, 128]
    - [34, 3.095]
  - - [4096, 128, 1, 512, 4096, 4096, 512, 128]
    - [91, 4.605]
  - - [4096, 128, 1, 1024, 4096, 4096, 1024, 128]
    - [90, 5.384]
  - - [4096, 128, 1, 2048, 4096, 4096, 2048, 128]
    - [40, 6.041]
  - - [4096, 128, 1, 4096, 4096, 4096, 4096, 128]
    - [16, 7.858]
  - - [4096, 128, 1, 8192, 4096, 4096, 8192, 128]
    - [80, 11.324]
  - - [4096, 256, 1, 128, 4096, 4096, 128, 256]
    - [73, 2.863]
  - - [4096, 256, 1, 256, 4096, 4096, 256, 256]
    - [90, 4.771]
  - - [4096, 256, 1, 512, 4096, 4096, 512, 256]
    - [89, 6.861]
  - - [4096, 256, 1, 1024, 4096, 4096, 1024, 256]
    - [96, 7.236]
  - - [4096, 256, 1, 2048, 4096, 4096, 2048, 256]
    - [90, 8.116]
  - - [4096, 256, 1, 4096, 4096, 4096, 4096, 256]
    - [7, 10.631]
  - - [4096, 256, 1, 8192, 4096, 4096, 8192, 256]
    - [24, 11.418]
  - - [4096, 512, 1, 128, 4096, 4096, 128, 512]
    - [71, 3.899]
  - - [4096, 512, 1, 256, 4096, 4096, 256, 512]
    - [67, 5.91]
  - - [4096, 512, 1, 512, 4096, 4096, 512, 512]
    - [31, 7.239]
  - - [4096, 512, 1, 1024, 4096, 4096, 1024, 512]
    - [31, 9.284]
  - - [4096, 512, 1, 2048, 4096, 4096, 2048, 512]
    - [31, 10.369]
  - - [4096, 512, 1, 4096, 4096, 4096, 4096, 512]
    - [5, 11.189]
  - - [4096, 512, 1, 8192, 4096, 4096, 8192, 512]
    - [56, 13.542]
  - - [4096, 1024, 1, 128, 4096, 4096, 128, 1024]
    - [13, 4.957]
  - - [4096, 1024, 1, 256, 4096, 4096, 256, 1024]
    - [13, 7.435]
  - - [4096, 1024, 1, 512, 4096, 4096, 512, 1024]
    - [16, 9.205]
  - - [4096, 1024, 1, 1024, 4096, 4096, 1024, 1024]
    - [18, 11.464]
  - - [4096, 1024, 1, 2048, 4096, 4096, 2048, 1024]
    - [29, 12.23]
  - - [4096, 1024, 1, 4096, 4096, 4096, 4096, 1024]
    - [60, 13.504]
  - - [4096, 1024, 1, 8192, 4096, 4096, 8192, 1024]
    - [6, 15.497]
  - - [4096, 2048, 1, 128, 4096, 4096, 128, 2048]
    - [62, 5.235]
  - - [4096, 2048, 1, 256, 4096, 4096, 256, 2048]
    - [13, 7.875]
  - - [4096, 2048, 1, 512, 4096, 4096, 512, 2048]
    - [3, 10.914]
  - - [4096, 2048, 1, 1024, 4096, 4096, 1024, 2048]
    - [6, 13.378]
  - - [4096, 2048, 1, 2048, 4096, 4096, 2048, 2048]
    - [26, 13.749]
  - - [4096, 2048, 1, 4096, 4096, 4096, 4096, 2048]
    - [52, 15.103]
  - - [4096, 2048, 1, 8192, 4096, 4096, 8192, 2048]
    - [1, 16.939]
  - - [4096, 4096, 1, 128, 4096, 4096, 128, 4096]
    - [66, 5.334]
  - - [4096, 4096, 1, 256, 4096, 4096, 256, 4096]
    - [46, 7.635]
  - - [4096, 4096, 1, 512, 4096, 4096, 512, 4096]
    - [50, 10.506]
  - - [4096, 4096, 1, 1024, 4096, 4096, 1024, 4096]
    - [0, 13.242]
  - - [4096, 4096, 1, 2048, 4096, 4096, 2048, 4096]
    - [52, 14.87]
  - - [4096, 4096, 1, 4096, 4096, 4096, 4096, 4096]
    - [45, 16.382]
  - - [4096, 4096, 1, 8192, 4096, 4096, 8192, 4096]
    - [46, 18.098]
  - - [4096, 8192, 1, 128, 4096, 4096, 128, 8192]
    - [52, 4.556]
  - - [4096, 8192, 1, 256, 4096, 4096, 256, 8192]
    - [58, 6.662]
  - - [4096, 8192, 1, 512, 4096, 4096, 512, 8192]
    - [60, 9.857]
  - - [4096, 8192, 1, 1024, 4096, 4096, 1024, 8192]
    - [60, 13.112]
  - - [4096, 8192, 1, 2048, 4096, 4096, 2048, 8192]
    - [60, 15.652]
  - - [4096, 8192, 1, 4096, 4096, 4096, 4096, 8192]
    - [45, 17.239]
  - - [4096, 8192, 1, 8192, 4096, 4096, 8192, 8192]
    - [45, 18.577]
  - - [8192, 128, 1, 128, 8192, 8192, 128, 128]
    - [73, 2.918]
  - - [8192, 128, 1, 256, 8192, 8192, 256, 128]
    - [90, 4.761]
  - - [8192, 128, 1, 512, 8192, 8192, 512, 128]
    - [88, 6.687]
  - - [8192, 128, 1, 1024, 8192, 8192, 1024, 128]
    - [39, 7.061]
  - - [8192, 128, 1, 2048, 8192, 8192, 2048, 128]
    - [88, 7.915]
  - - [8192, 128, 1, 4096, 8192, 8192, 4096, 128]
    - [30, 9.496]
  - - [8192, 128, 1, 8192, 8192, 8192, 8192, 128]
    - [27, 11.243]
  - - [8192, 256, 1, 128, 8192, 8192, 128, 256]
    - [65, 3.837]
  - - [8192, 256, 1, 256, 8192, 8192, 256, 256]
    - [69, 5.848]
  - - [8192, 256, 1, 512, 8192, 8192, 512, 256]
    - [29, 7.19]
  - - [8192, 256, 1, 1024, 8192, 8192, 1024, 256]
    - [31, 8.878]
  - - [8192, 256, 1, 2048, 8192, 8192, 2048, 256]
    - [90, 9.881]
  - - [8192, 256, 1, 4096, 8192, 8192, 4096, 256]
    - [5, 11.398]
  - - [8192, 256, 1, 8192, 8192, 8192, 8192, 256]
    - [52, 13.698]
  - - [8192, 512, 1, 128, 8192, 8192, 128, 512]
    - [52, 5.045]
  - - [8192, 512, 1, 256, 8192, 8192, 256, 512]
    - [57, 7.436]
  - - [8192, 512, 1, 512, 8192, 8192, 512, 512]
    - [16, 8.866]
  - - [8192, 512, 1, 1024, 8192, 8192, 1024, 512]
    - [16, 10.833]
  - - [8192, 512, 1, 2048, 8192, 8192, 2048, 512]
    - [29, 11.927]
  - - [8192, 512, 1, 4096, 8192, 8192, 4096, 512]
    - [5, 13.512]
  - - [8192, 512, 1, 8192, 8192, 8192, 8192, 512]
    - [12, 15.417]
  - - [8192, 1024, 1, 128, 8192, 8192, 128, 1024]
    - [55, 5.386]
  - - [8192, 1024, 1, 256, 8192, 8192, 256, 1024]
    - [58, 7.926]
  - - [8192, 1024, 1, 512, 8192, 8192, 512, 1024]
    - [6, 10.936]
  - - [8192, 1024, 1, 1024, 8192, 8192, 1024, 1024]
    - [59, 13.114]
  - - [8192, 1024, 1, 2048, 8192, 8192, 2048, 1024]
    - [56, 13.335]
  - - [8192, 1024, 1, 4096, 8192, 8192, 4096, 1024]
    - [5, 15.313]
  - - [8192, 1024, 1, 8192, 8192, 8192, 8192, 1024]
    - [5, 16.742]
  - - [8192, 2048, 1, 128, 8192, 8192, 128, 2048]
    - [63, 5.261]
  - - [8192, 2048, 1, 256, 8192, 8192, 256, 2048]
    - [45, 7.614]
  - - [8192, 2048, 1, 512, 8192, 8192, 512, 2048]
    - [50, 10.505]
  - - [8192, 2048, 1, 1024, 8192, 8192, 1024, 2048]
    - [1, 13.213]
  - - [8192, 2048, 1, 2048, 8192, 8192, 2048, 2048]
    - [52, 14.785]
  - - [8192, 2048, 1, 4096, 8192, 8192, 4096, 2048]
    - [5, 16.325]
  - - [8192, 2048, 1, 8192, 8192, 8192, 8192, 2048]
    - [1, 18.03]
  - - [8192, 4096, 1, 128, 8192, 8192, 128, 4096]
    - [51, 4.52]
  - - [8192, 4096, 1, 256, 8192, 8192, 256, 4096]
    - [60, 6.683]
  - - [8192, 4096, 1, 512, 8192, 8192, 512, 4096]
    - [61, 9.85]
  - - [8192, 4096, 1, 1024, 8192, 8192, 1024, 4096]
    - [61, 13.04]
  - - [8192, 4096, 1, 2048, 8192, 8192, 2048, 4096]
    - [61, 15.543]
  - - [8192, 4096, 1, 4096, 8192, 8192, 4096, 4096]
    - [46, 17.369]
  - - [8192, 4096, 1, 8192, 8192, 8192, 8192, 4096]
    - [2, 18.487]
  - - [8192, 8192, 1, 128, 8192, 8192, 128, 8192]
    - [54, 4.573]
  - - [8192, 8192, 1, 256, 8192, 8192, 256, 8192]
    - [56, 7.305]
  - - [8192, 8192, 1, 512, 8192, 8192, 512, 8192]
    - [60, 10.74]
  - - [8192, 8192, 1, 1024, 8192, 8192, 1024, 8192]
    - [60, 13.92]
  - - [8192, 8192, 1, 2048, 8192, 8192, 2048, 8192]
    - [50, 16.472]
  - - [8192, 8192, 1, 4096, 8192, 8192, 4096, 8192]
    - [49, 18.12]
  - - [8192, 8192, 1, 8192, 8192, 8192, 8192, 8192]
    - [1, 19.204]
  - - [1, 1, 1, 32, 1, 1, 32, 1]
    - [104, 0.0]
- null
- null
- DeviceEfficiency
- GridBased
