library/src/amd_detail/rocblaslt/src/Tensile/Logic/streamk/gfx942_80cu/aquavanjaram942_Cijk_Ailk_Bjlk_HSS_BH_UserArgs.yaml
- {MinimumRequiredVersion: 4.33.0}
- aquavanjaram942
- {Architecture: gfx942, CUCount: 80}
- [Device 0049, Device 0050]
    SolutionIndex: 0
    SolutionNameMin: Cijk_Ailk_Bjlk_HSS_BH_UserArgs_MT256x256x32_MI16x16x1_SN_LDSB0_CLR1_GSU0_GSUC0_GSUWGMRR0_K1_LBSPPA2048_LBSPPB2048_LPA0_LPB0_MIWT8_8_PLR1_SU32_SUM0_SUS256_SKXCCM0_VWA4_VWB8_WGM1_WGMXCC1_WGMXCCGn1
    SolutionIndex: 1
    SolutionNameMin: Cijk_Ailk_Bjlk_HSS_BH_UserArgs_MT256x256x32_MI16x16x1_SN_LDSB0_CLR1_GSU0_GSUC0_GSUWGMRR0_K1_LBSPPA2048_LBSPPB2048_LPA0_LPB0_MIWT8_8_PLR1_SU32_SUM0_SUS256_SKXCCM0_VWA4_VWB8_WGM2_WGMXCC1_WGMXCCGn1
    SolutionIndex: 2
    SolutionNameMin: Cijk_Ailk_Bjlk_HSS_BH_UserArgs_MT128x256x32_MI16x16x1_SN_LDSB1_CLR1_GSU0_GSUC0_GSUWGMRR0_K1_LBSPPA1024_LBSPPB2048_LPA0_LPB32_MIWT4_8_PLR1_SU32_SUM0_SUS256_SKXCCM0_VWA4_VWB2_WGM1_WGMXCC1_WGMXCCGn1
    SolutionIndex: 3
    SolutionNameMin: Cijk_Ailk_Bjlk_HSS_BH_UserArgs_MT128x256x32_MI16x16x1_SN_LDSB1_CLR1_GSU0_GSUC0_GSUWGMRR0_K1_LBSPPA1024_LBSPPB2048_LPA0_LPB0_MIWT4_8_PLR1_SU32_SUM0_SUS256_SKXCCM0_VWA4_VWB8_WGM1_WGMXCC1_WGMXCCGn1
    SolutionIndex: 4
    SolutionNameMin: Cijk_Ailk_Bjlk_HSS_BH_UserArgs_MT128x256x32_MI16x16x1_SN_LDSB1_CLR1_GSU0_GSUC0_GSUWGMRR0_K1_LBSPPA1024_LBSPPB2048_LPA0_LPB32_MIWT4_8_PLR1_SU32_SUM0_SUS256_SKXCCM0_VWA4_VWB2_WGM2_WGMXCC1_WGMXCCGn1
    SolutionIndex: 5
    SolutionNameMin: Cijk_Ailk_Bjlk_HSS_BH_UserArgs_MT128x256x32_MI16x16x1_SN_LDSB1_CLR1_GSU0_GSUC0_GSUWGMRR0_K1_LBSPPA1024_LBSPPB2048_LPA0_LPB32_MIWT4_8_PLR1_SU32_SUM0_SUS256_SKXCCM0_VWA4_VWB2_WGM4_WGMXCC1_WGMXCCGn1
    SolutionIndex: 6
    SolutionNameMin: Cijk_Ailk_Bjlk_HSS_BH_UserArgs_MT128x256x32_MI16x16x1_SN_LDSB1_CLR1_GSU0_GSUC0_GSUWGMRR0_K1_LBSPPA1024_LBSPPB2048_LPA0_LPB0_MIWT4_8_PLR1_SU32_SUM0_SUS256_SKXCCM0_VWA4_VWB4_WGM4_WGMXCC1_WGMXCCGn1
    SolutionIndex: 7
    SolutionNameMin: Cijk_Ailk_Bjlk_HSS_BH_UserArgs_MT256x128x32_MI16x16x1_SN_LDSB1_CLR1_GSU0_GSUC0_GSUWGMRR0_K1_LBSPPA2048_LBSPPB1024_LPA0_LPB16_MIWT8_4_PLR1_SU32_SUM0_SUS256_SKXCCM0_VWA4_VWB1_WGM1_WGMXCC1_WGMXCCGn1
    SolutionIndex: 8
    SolutionNameMin: Cijk_Ailk_Bjlk_HSS_BH_UserArgs_MT256x128x32_MI16x16x1_SN_LDSB1_CLR1_GSU0_GSUC0_GSUWGMRR0_K1_LBSPPA2048_LBSPPB1024_LPA0_LPB32_MIWT8_4_PLR1_SU32_SUM0_SUS256_SKXCCM0_VWA4_VWB2_WGM1_WGMXCC1_WGMXCCGn1
    SolutionIndex: 9
    SolutionNameMin: Cijk_Ailk_Bjlk_HSS_BH_UserArgs_MT256x128x32_MI16x16x1_SN_LDSB1_CLR1_GSU0_GSUC0_GSUWGMRR0_K1_LBSPPA2048_LBSPPB1024_LPA0_LPB0_MIWT8_4_PLR1_SU32_SUM0_SUS256_SKXCCM0_VWA4_VWB4_WGM1_WGMXCC1_WGMXCCGn1
    SolutionIndex: 10
    SolutionNameMin: Cijk_Ailk_Bjlk_HSS_BH_UserArgs_MT256x128x32_MI16x16x1_SN_LDSB1_CLR1_GSU0_GSUC0_GSUWGMRR0_K1_LBSPPA2048_LBSPPB1024_LPA0_LPB0_MIWT8_4_PLR1_SU32_SUM0_SUS256_SKXCCM0_VWA4_VWB4_WGM2_WGMXCC1_WGMXCCGn1
    SolutionIndex: 11
    SolutionNameMin: Cijk_Ailk_Bjlk_HSS_BH_UserArgs_MT256x128x32_MI16x16x1_SN_LDSB1_CLR1_GSU0_GSUC0_GSUWGMRR0_K1_LBSPPA2048_LBSPPB1024_LPA0_LPB0_MIWT8_4_PLR1_SU32_SUM0_SUS256_SKXCCM0_VWA4_VWB4_WGM4_WGMXCC1_WGMXCCGn1
    SolutionIndex: 12
    SolutionNameMin: Cijk_Ailk_Bjlk_HSS_BH_UserArgs_MT256x64x32_MI16x16x1_SN_LDSB1_CLR1_GSU0_GSUC0_GSUWGMRR0_K1_LBSPPA2048_LBSPPB512_LPA0_LPB16_MIWT8_2_PLR1_SU32_SUM0_SUS256_SKXCCM0_VWA4_VWB1_WGM1_WGMXCC1_WGMXCCGn1
    SolutionIndex: 13
    SolutionNameMin: Cijk_Ailk_Bjlk_HSS_BH_UserArgs_MT256x64x32_MI16x16x1_SN_LDSB1_CLR1_GSU0_GSUC0_GSUWGMRR0_K1_LBSPPA2048_LBSPPB512_LPA0_LPB32_MIWT8_2_PLR1_SU32_SUM0_SUS256_SKXCCM0_VWA4_VWB2_WGM1_WGMXCC1_WGMXCCGn1
    SolutionIndex: 14
    SolutionNameMin: Cijk_Ailk_Bjlk_HSS_BH_UserArgs_MT128x128x32_MI16x16x1_SN_LDSB1_CLR1_GSU0_GSUC0_GSUWGMRR0_K1_LBSPPA1024_LBSPPB1024_LPA0_LPB16_MIWT4_4_PLR1_SU32_SUM0_SUS256_SKXCCM0_VWA4_VWB1_WGM1_WGMXCC1_WGMXCCGn1
    SolutionIndex: 15
    SolutionNameMin: Cijk_Ailk_Bjlk_HSS_BH_UserArgs_MT128x128x32_MI16x16x1_SN_LDSB1_CLR1_GSU0_GSUC0_GSUWGMRR0_K1_LBSPPA1024_LBSPPB1024_LPA0_LPB32_MIWT4_4_PLR1_SU32_SUM0_SUS256_SKXCCM0_VWA4_VWB2_WGM1_WGMXCC1_WGMXCCGn1
    SolutionIndex: 16
    SolutionNameMin: Cijk_Ailk_Bjlk_HSS_BH_UserArgs_MT128x128x32_MI16x16x1_SN_LDSB1_CLR1_GSU0_GSUC0_GSUWGMRR0_K1_LBSPPA1024_LBSPPB1024_LPA0_LPB32_MIWT4_4_PLR1_SU32_SUM0_SUS256_SKXCCM0_VWA4_VWB2_WGM2_WGMXCC1_WGMXCCGn1
    SolutionIndex: 17
    SolutionNameMin: Cijk_Ailk_Bjlk_HSS_BH_UserArgs_MT32x32x32_MI16x16x1_SN_LDSB0_CLR1_GSU0_GSUC0_GSUWGMRR0_K1_LBSPPA256_LBSPPB256_LPA16_LPB16_MIWT1_1_PLR1_SU32_SUM0_SUS256_SKXCCM0_VWA1_VWB1_WGM1_WGMXCC1_WGMXCCGn1
    SolutionIndex: 18
    SolutionNameMin: Cijk_Ailk_Bjlk_HSS_BH_UserArgs_MT32x32x32_MI16x16x1_SN_LDSB0_CLR0_GSU0_GSUC0_GSUWGMRR0_K1_LBSPPA256_LBSPPB256_LPA16_LPB16_MIWT1_1_PLR0_SU32_SUM0_SUS256_SKXCCM0_VWA1_VWB1_WGM1_WGMXCC1_WGMXCCGn1
    SolutionIndex: 19
    SolutionNameMin: Cijk_Ailk_Bjlk_HSS_BH_UserArgs_MT256x256x64_MI16x16x1_SN_LDSB1_CLR1_GSU0_GSUC0_GSUWGMRR0_K1_LBSPPA2048_LBSPPB2048_LPA0_LPB0_MIWT8_8_PLR1_SU32_SUM0_SUS256_SKXCCM0_VWA4_VWB4_WGM1_WGMXCC1_WGMXCCGn1
    SolutionIndex: 20
    SolutionNameMin: Cijk_Ailk_Bjlk_HSS_BH_UserArgs_MT256x256x64_MI16x16x1_SN_LDSB1_CLR1_GSU0_GSUC0_GSUWGMRR0_K1_LBSPPA2048_LBSPPB2048_LPA0_LPB0_MIWT8_8_PLR2_SU32_SUM0_SUS256_SKXCCM0_VWA4_VWB4_WGM1_WGMXCC1_WGMXCCGn1
    SolutionIndex: 21
    SolutionNameMin: Cijk_Ailk_Bjlk_HSS_BH_UserArgs_MT256x256x64_MI16x16x1_SN_LDSB1_CLR1_GSU0_GSUC0_GSUWGMRR0_K1_LBSPPA2048_LBSPPB2048_LPA0_LPB0_MIWT8_8_PLR1_SU32_SUM0_SUS256_SKXCCM0_VWA4_VWB4_WGM2_WGMXCC1_WGMXCCGn1
    SolutionIndex: 22
    SolutionNameMin: Cijk_Ailk_Bjlk_HSS_BH_UserArgs_MT256x256x64_MI16x16x1_SN_LDSB1_CLR1_GSU0_GSUC0_GSUWGMRR0_K1_LBSPPA2048_LBSPPB2048_LPA0_LPB0_MIWT8_8_PLR2_SU32_SUM0_SUS256_SKXCCM0_VWA4_VWB4_WGM2_WGMXCC1_WGMXCCGn1
    SolutionIndex: 23
    SolutionNameMin: Cijk_Ailk_Bjlk_HSS_BH_UserArgs_MT128x128x64_MI16x16x1_SN_LDSB1_CLR1_GSU0_GSUC0_GSUWGMRR0_K1_LBSPPA1024_LBSPPB1024_LPA0_LPB0_MIWT4_4_PLR1_SU32_SUM0_SUS256_SKXCCM0_VWA4_VWB4_WGM1_WGMXCC1_WGMXCCGn1
    SolutionIndex: 24
    SolutionNameMin: Cijk_Ailk_Bjlk_HSS_BH_UserArgs_MT128x128x64_MI16x16x1_SN_LDSB1_CLR1_GSU0_GSUC0_GSUWGMRR0_K1_LBSPPA1024_LBSPPB1024_LPA0_LPB0_MIWT4_4_PLR2_SU32_SUM0_SUS256_SKXCCM0_VWA4_VWB4_WGM1_WGMXCC1_WGMXCCGn1
    SolutionIndex: 25
    SolutionNameMin: Cijk_Ailk_Bjlk_HSS_BH_UserArgs_MT128x128x64_MI16x16x1_SN_LDSB1_CLR1_GSU0_GSUC0_GSUWGMRR0_K1_LBSPPA1024_LBSPPB1024_LPA0_LPB0_MIWT4_4_PLR1_SU32_SUM0_SUS256_SKXCCM0_VWA4_VWB4_WGM2_WGMXCC1_WGMXCCGn1
    SolutionIndex: 26
    SolutionNameMin: Cijk_Ailk_Bjlk_HSS_BH_UserArgs_MT128x128x64_MI16x16x1_SN_LDSB1_CLR1_GSU0_GSUC0_GSUWGMRR0_K1_LBSPPA1024_LBSPPB1024_LPA0_LPB0_MIWT4_4_PLR1_SU32_SUM0_SUS256_SKXCCM0_VWA4_VWB4_WGM4_WGMXCC1_WGMXCCGn1
    SolutionIndex: 27
    SolutionNameMin: Cijk_Ailk_Bjlk_HSS_BH_UserArgs_MT128x64x64_MI16x16x1_SN_LDSB1_CLR1_GSU0_GSUC0_GSUWGMRR0_K1_LBSPPA1024_LBSPPB512_LPA0_LPB32_MIWT4_2_PLR2_SU32_SUM0_SUS256_SKXCCM0_VWA4_VWB2_WGM1_WGMXCC1_WGMXCCGn1
    SolutionIndex: 28
    SolutionNameMin: Cijk_Ailk_Bjlk_HSS_BH_UserArgs_MT128x64x64_MI16x16x1_SN_LDSB1_CLR1_GSU0_GSUC0_GSUWGMRR0_K1_LBSPPA1024_LBSPPB512_LPA0_LPB32_MIWT4_2_PLR1_SU32_SUM0_SUS256_SKXCCM0_VWA4_VWB2_WGM4_WGMXCC1_WGMXCCGn1
    SolutionIndex: 29
    SolutionNameMin: Cijk_Ailk_Bjlk_HSS_BH_UserArgs_MT64x64x64_MI16x16x1_SN_LDSB1_CLR1_GSU0_GSUC0_GSUWGMRR0_K1_LBSPPA512_LBSPPB512_LPA32_LPB32_MIWT2_2_PLR1_SU32_SUM0_SUS256_SKXCCM0_VWA2_VWB2_WGM1_WGMXCC1_WGMXCCGn1
    SolutionIndex: 30
    SolutionNameMin: Cijk_Ailk_Bjlk_HSS_BH_UserArgs_MT64x64x64_MI16x16x1_SN_LDSB1_CLR1_GSU0_GSUC0_GSUWGMRR0_K1_LBSPPA512_LBSPPB512_LPA32_LPB32_MIWT2_2_PLR1_SU32_SUM0_SUS256_SKXCCM0_VWA2_VWB2_WGM4_WGMXCC1_WGMXCCGn1
    SolutionIndex: 31
    SolutionNameMin: Cijk_Ailk_Bjlk_HSS_BH_UserArgs_MT32x64x64_MI16x16x1_SN_LDSB0_CLR1_GSU0_GSUC0_GSUWGMRR0_K1_LBSPPA256_LBSPPB512_LPA16_LPB32_MIWT1_2_PLR2_SU32_SUM0_SUS256_SKXCCM0_VWA1_VWB2_WGM1_WGMXCC1_WGMXCCGn1
    SolutionIndex: 32
    SolutionNameMin: Cijk_Ailk_Bjlk_HSS_BH_UserArgs_MT128x128x128_MI16x16x1_SN_LDSB1_CLR1_GSU0_GSUC0_GSUWGMRR0_K1_LBSPPA1024_LBSPPB1024_LPA0_LPB0_MIWT4_4_PLR1_SU32_SUM0_SUS256_SKXCCM0_VWA4_VWB4_WGM1_WGMXCC1_WGMXCCGn1
    SolutionIndex: 33
    SolutionNameMin: Cijk_Ailk_Bjlk_HSS_BH_UserArgs_MT128x128x128_MI16x16x1_SN_LDSB1_CLR1_GSU0_GSUC0_GSUWGMRR0_K1_LBSPPA1024_LBSPPB1024_LPA0_LPB0_MIWT4_4_PLR1_SU32_SUM0_SUS256_SKXCCM0_VWA4_VWB4_WGM2_WGMXCC1_WGMXCCGn1
    SolutionIndex: 34
    SolutionNameMin: Cijk_Ailk_Bjlk_HSS_BH_UserArgs_MT64x64x128_MI16x16x1_SN_LDSB1_CLR1_GSU0_GSUC0_GSUWGMRR0_K1_LBSPPA512_LBSPPB512_LPA16_LPB32_MIWT2_2_PLR2_SU32_SUM0_SUS256_SKXCCM0_VWA1_VWB2_WGM1_WGMXCC1_WGMXCCGn1
    SolutionIndex: 35
    SolutionNameMin: Cijk_Ailk_Bjlk_HSS_BH_UserArgs_MT64x64x128_MI16x16x1_SN_LDSB1_CLR1_GSU0_GSUC0_GSUWGMRR0_K1_LBSPPA512_LBSPPB512_LPA32_LPB32_MIWT2_2_PLR2_SU32_SUM0_SUS256_SKXCCM0_VWA2_VWB2_WGM1_WGMXCC1_WGMXCCGn1
    SolutionIndex: 36
    SolutionNameMin: Cijk_Ailk_Bjlk_HSS_BH_UserArgs_MT32x64x128_MI16x16x1_SN_LDSB1_CLR1_GSU0_GSUC0_GSUWGMRR0_K1_LBSPPA256_LBSPPB512_LPA16_LPB32_MIWT1_2_PLR1_SU32_SUM0_SUS256_SKXCCM0_VWA1_VWB2_WGM1_WGMXCC1_WGMXCCGn1
    SolutionIndex: 37
    SolutionNameMin: Cijk_Ailk_Bjlk_HSS_BH_UserArgs_MT32x64x128_MI16x16x1_SN_LDSB1_CLR1_GSU0_GSUC0_GSUWGMRR0_K1_LBSPPA256_LBSPPB512_LPA16_LPB32_MIWT1_2_PLR2_SU32_SUM0_SUS256_SKXCCM0_VWA1_VWB2_WGM1_WGMXCC1_WGMXCCGn1
    SolutionIndex: 38
    SolutionNameMin: Cijk_Ailk_Bjlk_HSS_BH_UserArgs_MT64x32x128_MI16x16x1_SN_LDSB1_CLR1_GSU0_GSUC0_GSUWGMRR0_K1_LBSPPA512_LBSPPB256_LPA32_LPB16_MIWT2_1_PLR2_SU32_SUM0_SUS256_SKXCCM0_VWA2_VWB1_WGM1_WGMXCC1_WGMXCCGn1
    SolutionIndex: 39
    SolutionNameMin: Cijk_Ailk_Bjlk_HSS_BH_UserArgs_MT32x32x128_MI16x16x1_SN_LDSB1_CLR1_GSU0_GSUC0_GSUWGMRR0_K1_LBSPPA256_LBSPPB256_LPA16_LPB16_MIWT1_1_PLR1_SU32_SUM0_SUS256_SKXCCM0_VWA1_VWB1_WGM1_WGMXCC1_WGMXCCGn1
    SolutionIndex: 40
    SolutionNameMin: Cijk_Ailk_Bjlk_HSS_BH_UserArgs_MT32x32x128_MI16x16x1_SN_LDSB1_CLR1_GSU0_GSUC0_GSUWGMRR0_K1_LBSPPA256_LBSPPB256_LPA16_LPB16_MIWT1_1_PLR2_SU32_SUM0_SUS256_SKXCCM0_VWA1_VWB1_WGM1_WGMXCC1_WGMXCCGn1
    SolutionIndex: 41
    SolutionNameMin: Cijk_Ailk_Bjlk_HSS_BH_UserArgs_MT32x32x128_MI16x16x1_SN_LDSB1_CLR1_GSU0_GSUC0_GSUWGMRR0_K1_LBSPPA256_LBSPPB256_LPA16_LPB16_MIWT1_1_PLR1_SU32_SUM0_SUS256_SKXCCM0_VWA1_VWB1_WGM2_WGMXCC1_WGMXCCGn1
    SolutionIndex: 42
    SolutionNameMin: Cijk_Ailk_Bjlk_HSS_BH_UserArgs_MT256x256x32_MI16x16x1_SN_LDSB0_CLR1_GSU0_GSUC0_GSUWGMRR0_K1_LBSPPA2048_LBSPPB2048_LPA0_LPB0_MIWT8_8_PLR1_SU32_SUM0_SUS256_SKXCCM4_VWA4_VWB8_WGM1_WGMXCC1_WGMXCCGn1
    SolutionIndex: 43
    SolutionNameMin: Cijk_Ailk_Bjlk_HSS_BH_UserArgs_MT256x256x32_MI16x16x1_SN_LDSB0_CLR1_GSU0_GSUC0_GSUWGMRR0_K1_LBSPPA2048_LBSPPB2048_LPA0_LPB0_MIWT8_8_PLR1_SU32_SUM0_SUS256_SKXCCM4_VWA4_VWB4_WGM2_WGMXCC1_WGMXCCGn1
    SolutionIndex: 44
    SolutionNameMin: Cijk_Ailk_Bjlk_HSS_BH_UserArgs_MT128x256x32_MI16x16x1_SN_LDSB1_CLR1_GSU0_GSUC0_GSUWGMRR0_K1_LBSPPA1024_LBSPPB2048_LPA0_LPB32_MIWT4_8_PLR1_SU32_SUM0_SUS256_SKXCCM4_VWA4_VWB2_WGM1_WGMXCC1_WGMXCCGn1
    SolutionIndex: 45
    SolutionNameMin: Cijk_Ailk_Bjlk_HSS_BH_UserArgs_MT128x256x32_MI16x16x1_SN_LDSB1_CLR1_GSU0_GSUC0_GSUWGMRR0_K1_LBSPPA1024_LBSPPB2048_LPA0_LPB0_MIWT4_8_PLR1_SU32_SUM0_SUS256_SKXCCM4_VWA4_VWB4_WGM1_WGMXCC1_WGMXCCGn1
    SolutionIndex: 46
    SolutionNameMin: Cijk_Ailk_Bjlk_HSS_BH_UserArgs_MT128x256x32_MI16x16x1_SN_LDSB1_CLR1_GSU0_GSUC0_GSUWGMRR0_K1_LBSPPA1024_LBSPPB2048_LPA0_LPB0_MIWT4_8_PLR1_SU32_SUM0_SUS256_SKXCCM4_VWA4_VWB8_WGM1_WGMXCC1_WGMXCCGn1
    SolutionIndex: 47
    SolutionNameMin: Cijk_Ailk_Bjlk_HSS_BH_UserArgs_MT128x256x32_MI16x16x1_SN_LDSB1_CLR1_GSU0_GSUC0_GSUWGMRR0_K1_LBSPPA1024_LBSPPB2048_LPA0_LPB32_MIWT4_8_PLR1_SU32_SUM0_SUS256_SKXCCM4_VWA4_VWB2_WGM2_WGMXCC1_WGMXCCGn1
    SolutionIndex: 48
    SolutionNameMin: Cijk_Ailk_Bjlk_HSS_BH_UserArgs_MT128x256x32_MI16x16x1_SN_LDSB1_CLR1_GSU0_GSUC0_GSUWGMRR0_K1_LBSPPA1024_LBSPPB2048_LPA0_LPB0_MIWT4_8_PLR1_SU32_SUM0_SUS256_SKXCCM4_VWA4_VWB4_WGM2_WGMXCC1_WGMXCCGn1
    SolutionIndex: 49
    SolutionNameMin: Cijk_Ailk_Bjlk_HSS_BH_UserArgs_MT128x256x32_MI16x16x1_SN_LDSB1_CLR1_GSU0_GSUC0_GSUWGMRR0_K1_LBSPPA1024_LBSPPB2048_LPA0_LPB0_MIWT4_8_PLR1_SU32_SUM0_SUS256_SKXCCM4_VWA4_VWB8_WGM2_WGMXCC1_WGMXCCGn1
    SolutionIndex: 50
    SolutionNameMin: Cijk_Ailk_Bjlk_HSS_BH_UserArgs_MT128x256x32_MI16x16x1_SN_LDSB1_CLR1_GSU0_GSUC0_GSUWGMRR0_K1_LBSPPA1024_LBSPPB2048_LPA0_LPB32_MIWT4_8_PLR1_SU32_SUM0_SUS256_SKXCCM4_VWA4_VWB2_WGM4_WGMXCC1_WGMXCCGn1
    SolutionIndex: 51
    SolutionNameMin: Cijk_Ailk_Bjlk_HSS_BH_UserArgs_MT128x256x32_MI16x16x1_SN_LDSB1_CLR1_GSU0_GSUC0_GSUWGMRR0_K1_LBSPPA1024_LBSPPB2048_LPA0_LPB0_MIWT4_8_PLR1_SU32_SUM0_SUS256_SKXCCM4_VWA4_VWB4_WGM4_WGMXCC1_WGMXCCGn1
    SolutionIndex: 52
    SolutionNameMin: Cijk_Ailk_Bjlk_HSS_BH_UserArgs_MT256x128x32_MI16x16x1_SN_LDSB1_CLR1_GSU0_GSUC0_GSUWGMRR0_K1_LBSPPA2048_LBSPPB1024_LPA0_LPB0_MIWT8_4_PLR1_SU32_SUM0_SUS256_SKXCCM4_VWA4_VWB4_WGM1_WGMXCC1_WGMXCCGn1
    SolutionIndex: 53
    SolutionNameMin: Cijk_Ailk_Bjlk_HSS_BH_UserArgs_MT256x128x32_MI16x16x1_SN_LDSB1_CLR1_GSU0_GSUC0_GSUWGMRR0_K1_LBSPPA2048_LBSPPB1024_LPA0_LPB0_MIWT8_4_PLR1_SU32_SUM0_SUS256_SKXCCM4_VWA4_VWB4_WGM2_WGMXCC1_WGMXCCGn1
    SolutionIndex: 54
    SolutionNameMin: Cijk_Ailk_Bjlk_HSS_BH_UserArgs_MT128x128x32_MI16x16x1_SN_LDSB1_CLR1_GSU0_GSUC0_GSUWGMRR0_K1_LBSPPA1024_LBSPPB1024_LPA0_LPB32_MIWT4_4_PLR1_SU32_SUM0_SUS256_SKXCCM4_VWA4_VWB2_WGM1_WGMXCC1_WGMXCCGn1
    SolutionIndex: 55
    SolutionNameMin: Cijk_Ailk_Bjlk_HSS_BH_UserArgs_MT128x128x32_MI16x16x1_SN_LDSB0_CLR1_GSU0_GSUC0_GSUWGMRR0_K1_LBSPPA1024_LBSPPB1024_LPA0_LPB0_MIWT4_4_PLR1_SU32_SUM0_SUS256_SKXCCM4_VWA4_VWB4_WGM1_WGMXCC1_WGMXCCGn1
    SolutionIndex: 56
    SolutionNameMin: Cijk_Ailk_Bjlk_HSS_BH_UserArgs_MT128x128x32_MI16x16x1_SN_LDSB0_CLR0_GSU0_GSUC0_GSUWGMRR0_K1_LBSPPA1024_LBSPPB1024_LPA0_LPB0_MIWT4_4_PLR0_SU32_SUM0_SUS256_SKXCCM4_VWA4_VWB4_WGM1_WGMXCC1_WGMXCCGn1
    SolutionIndex: 57
    SolutionNameMin: Cijk_Ailk_Bjlk_HSS_BH_UserArgs_MT128x128x32_MI16x16x1_SN_LDSB1_CLR1_GSU0_GSUC0_GSUWGMRR0_K1_LBSPPA1024_LBSPPB1024_LPA0_LPB32_MIWT4_4_PLR1_SU32_SUM0_SUS256_SKXCCM4_VWA4_VWB2_WGM2_WGMXCC1_WGMXCCGn1
    SolutionIndex: 58
    SolutionNameMin: Cijk_Ailk_Bjlk_HSS_BH_UserArgs_MT128x64x32_MI16x16x1_SN_LDSB0_CLR1_GSU0_GSUC0_GSUWGMRR0_K1_LBSPPA1024_LBSPPB512_LPA0_LPB32_MIWT4_2_PLR1_SU32_SUM0_SUS256_SKXCCM4_VWA4_VWB2_WGM1_WGMXCC1_WGMXCCGn1
    SolutionIndex: 59
    SolutionNameMin: Cijk_Ailk_Bjlk_HSS_BH_UserArgs_MT128x64x32_MI16x16x1_SN_LDSB0_CLR0_GSU0_GSUC0_GSUWGMRR0_K1_LBSPPA1024_LBSPPB512_LPA0_LPB32_MIWT4_2_PLR0_SU32_SUM0_SUS256_SKXCCM4_VWA4_VWB2_WGM1_WGMXCC1_WGMXCCGn1
    SolutionIndex: 60
    SolutionNameMin: Cijk_Ailk_Bjlk_HSS_BH_UserArgs_MT128x64x32_MI16x16x1_SN_LDSB0_CLR1_GSU0_GSUC0_GSUWGMRR0_K1_LBSPPA1024_LBSPPB512_LPA0_LPB32_MIWT4_2_PLR1_SU32_SUM0_SUS256_SKXCCM4_VWA4_VWB2_WGM2_WGMXCC1_WGMXCCGn1
    SolutionIndex: 61
    SolutionNameMin: Cijk_Ailk_Bjlk_HSS_BH_UserArgs_MT128x64x32_MI16x16x1_SN_LDSB0_CLR0_GSU0_GSUC0_GSUWGMRR0_K1_LBSPPA1024_LBSPPB512_LPA0_LPB32_MIWT4_2_PLR0_SU32_SUM0_SUS256_SKXCCM4_VWA4_VWB2_WGM2_WGMXCC1_WGMXCCGn1
    SolutionIndex: 62
    SolutionNameMin: Cijk_Ailk_Bjlk_HSS_BH_UserArgs_MT128x64x32_MI16x16x1_SN_LDSB0_CLR1_GSU0_GSUC0_GSUWGMRR0_K1_LBSPPA1024_LBSPPB512_LPA0_LPB32_MIWT4_2_PLR1_SU32_SUM0_SUS256_SKXCCM4_VWA4_VWB2_WGM4_WGMXCC1_WGMXCCGn1
    SolutionIndex: 63
    SolutionNameMin: Cijk_Ailk_Bjlk_HSS_BH_UserArgs_MT128x32x32_MI16x16x1_SN_LDSB0_CLR1_GSU0_GSUC0_GSUWGMRR0_K1_LBSPPA1024_LBSPPB256_LPA0_LPB16_MIWT4_1_PLR1_SU32_SUM0_SUS256_SKXCCM4_VWA4_VWB1_WGM1_WGMXCC1_WGMXCCGn1
    SolutionIndex: 64
    SolutionNameMin: Cijk_Ailk_Bjlk_HSS_BH_UserArgs_MT32x64x32_MI16x16x1_SN_LDSB0_CLR1_GSU0_GSUC0_GSUWGMRR0_K1_LBSPPA256_LBSPPB512_LPA16_LPB32_MIWT1_2_PLR1_SU32_SUM0_SUS256_SKXCCM4_VWA1_VWB2_WGM1_WGMXCC1_WGMXCCGn1
    SolutionIndex: 65
    SolutionNameMin: Cijk_Ailk_Bjlk_HSS_BH_UserArgs_MT32x64x32_MI16x16x1_SN_LDSB0_CLR0_GSU0_GSUC0_GSUWGMRR0_K1_LBSPPA256_LBSPPB512_LPA16_LPB32_MIWT1_2_PLR0_SU32_SUM0_SUS256_SKXCCM4_VWA1_VWB2_WGM1_WGMXCC1_WGMXCCGn1
    SolutionIndex: 66
    SolutionNameMin: Cijk_Ailk_Bjlk_HSS_BH_UserArgs_MT32x64x32_MI16x16x1_SN_LDSB0_CLR0_GSU0_GSUC0_GSUWGMRR0_K1_LBSPPA256_LBSPPB512_LPA16_LPB32_MIWT1_2_PLR0_SU32_SUM0_SUS256_SKXCCM4_VWA1_VWB2_WGM4_WGMXCC1_WGMXCCGn1
    SolutionIndex: 67
    SolutionNameMin: Cijk_Ailk_Bjlk_HSS_BH_UserArgs_MT256x256x64_MI16x16x1_SN_LDSB1_CLR1_GSU0_GSUC0_GSUWGMRR0_K1_LBSPPA2048_LBSPPB2048_LPA0_LPB0_MIWT8_8_PLR1_SU32_SUM0_SUS256_SKXCCM4_VWA4_VWB4_WGM1_WGMXCC1_WGMXCCGn1
    SolutionIndex: 68
    SolutionNameMin: Cijk_Ailk_Bjlk_HSS_BH_UserArgs_MT256x256x64_MI16x16x1_SN_LDSB1_CLR1_GSU0_GSUC0_GSUWGMRR0_K1_LBSPPA2048_LBSPPB2048_LPA0_LPB0_MIWT8_8_PLR1_SU32_SUM0_SUS256_SKXCCM4_VWA4_VWB4_WGM2_WGMXCC1_WGMXCCGn1
    SolutionIndex: 69
    SolutionNameMin: Cijk_Ailk_Bjlk_HSS_BH_UserArgs_MT256x256x64_MI16x16x1_SN_LDSB1_CLR1_GSU0_GSUC0_GSUWGMRR0_K1_LBSPPA2048_LBSPPB2048_LPA0_LPB0_MIWT8_8_PLR2_SU32_SUM0_SUS256_SKXCCM4_VWA4_VWB4_WGM2_WGMXCC1_WGMXCCGn1
    SolutionIndex: 70
    SolutionNameMin: Cijk_Ailk_Bjlk_HSS_BH_UserArgs_MT128x128x64_MI16x16x1_SN_LDSB1_CLR1_GSU0_GSUC0_GSUWGMRR0_K1_LBSPPA1024_LBSPPB1024_LPA0_LPB0_MIWT4_4_PLR1_SU32_SUM0_SUS256_SKXCCM4_VWA4_VWB4_WGM1_WGMXCC1_WGMXCCGn1
    SolutionIndex: 71
    SolutionNameMin: Cijk_Ailk_Bjlk_HSS_BH_UserArgs_MT128x128x64_MI16x16x1_SN_LDSB1_CLR1_GSU0_GSUC0_GSUWGMRR0_K1_LBSPPA1024_LBSPPB1024_LPA0_LPB0_MIWT4_4_PLR1_SU32_SUM0_SUS256_SKXCCM4_VWA4_VWB4_WGM2_WGMXCC1_WGMXCCGn1
    SolutionIndex: 72
    SolutionNameMin: Cijk_Ailk_Bjlk_HSS_BH_UserArgs_MT128x128x64_MI16x16x1_SN_LDSB1_CLR1_GSU0_GSUC0_GSUWGMRR0_K1_LBSPPA1024_LBSPPB1024_LPA0_LPB0_MIWT4_4_PLR1_SU32_SUM0_SUS256_SKXCCM4_VWA4_VWB4_WGM4_WGMXCC1_WGMXCCGn1
    SolutionIndex: 73
    SolutionNameMin: Cijk_Ailk_Bjlk_HSS_BH_UserArgs_MT128x64x64_MI16x16x1_SN_LDSB1_CLR1_GSU0_GSUC0_GSUWGMRR0_K1_LBSPPA1024_LBSPPB512_LPA0_LPB32_MIWT4_2_PLR1_SU32_SUM0_SUS256_SKXCCM4_VWA4_VWB2_WGM1_WGMXCC1_WGMXCCGn1
    SolutionIndex: 74
    SolutionNameMin: Cijk_Ailk_Bjlk_HSS_BH_UserArgs_MT128x64x64_MI16x16x1_SN_LDSB1_CLR1_GSU0_GSUC0_GSUWGMRR0_K1_LBSPPA1024_LBSPPB512_LPA0_LPB32_MIWT4_2_PLR2_SU32_SUM0_SUS256_SKXCCM4_VWA4_VWB2_WGM1_WGMXCC1_WGMXCCGn1
    SolutionIndex: 75
    SolutionNameMin: Cijk_Ailk_Bjlk_HSS_BH_UserArgs_MT128x64x64_MI16x16x1_SN_LDSB1_CLR1_GSU0_GSUC0_GSUWGMRR0_K1_LBSPPA1024_LBSPPB512_LPA0_LPB32_MIWT4_2_PLR2_SU32_SUM0_SUS256_SKXCCM4_VWA4_VWB2_WGM2_WGMXCC1_WGMXCCGn1
    SolutionIndex: 76
    SolutionNameMin: Cijk_Ailk_Bjlk_HSS_BH_UserArgs_MT128x64x64_MI16x16x1_SN_LDSB1_CLR1_GSU0_GSUC0_GSUWGMRR0_K1_LBSPPA1024_LBSPPB512_LPA0_LPB32_MIWT4_2_PLR2_SU32_SUM0_SUS256_SKXCCM4_VWA4_VWB2_WGM4_WGMXCC1_WGMXCCGn1
    SolutionIndex: 77
    SolutionNameMin: Cijk_Ailk_Bjlk_HSS_BH_UserArgs_MT64x64x64_MI16x16x1_SN_LDSB1_CLR1_GSU0_GSUC0_GSUWGMRR0_K1_LBSPPA512_LBSPPB512_LPA32_LPB32_MIWT2_2_PLR1_SU32_SUM0_SUS256_SKXCCM4_VWA2_VWB2_WGM1_WGMXCC1_WGMXCCGn1
    SolutionIndex: 78
    SolutionNameMin: Cijk_Ailk_Bjlk_HSS_BH_UserArgs_MT64x64x64_MI16x16x1_SN_LDSB1_CLR1_GSU0_GSUC0_GSUWGMRR0_K1_LBSPPA512_LBSPPB512_LPA32_LPB32_MIWT2_2_PLR2_SU32_SUM0_SUS256_SKXCCM4_VWA2_VWB2_WGM1_WGMXCC1_WGMXCCGn1
    SolutionIndex: 79
    SolutionNameMin: Cijk_Ailk_Bjlk_HSS_BH_UserArgs_MT64x64x64_MI16x16x1_SN_LDSB1_CLR1_GSU0_GSUC0_GSUWGMRR0_K1_LBSPPA512_LBSPPB512_LPA32_LPB32_MIWT2_2_PLR1_SU32_SUM0_SUS256_SKXCCM4_VWA2_VWB2_WGM2_WGMXCC1_WGMXCCGn1
    SolutionIndex: 80
    SolutionNameMin: Cijk_Ailk_Bjlk_HSS_BH_UserArgs_MT64x64x64_MI16x16x1_SN_LDSB1_CLR1_GSU0_GSUC0_GSUWGMRR0_K1_LBSPPA512_LBSPPB512_LPA32_LPB32_MIWT2_2_PLR1_SU32_SUM0_SUS256_SKXCCM4_VWA2_VWB2_WGM4_WGMXCC1_WGMXCCGn1
    SolutionIndex: 81
    SolutionNameMin: Cijk_Ailk_Bjlk_HSS_BH_UserArgs_MT32x64x64_MI16x16x1_SN_LDSB0_CLR1_GSU0_GSUC0_GSUWGMRR0_K1_LBSPPA256_LBSPPB512_LPA16_LPB32_MIWT1_2_PLR2_SU32_SUM0_SUS256_SKXCCM4_VWA1_VWB2_WGM1_WGMXCC1_WGMXCCGn1
    SolutionIndex: 82
    SolutionNameMin: Cijk_Ailk_Bjlk_HSS_BH_UserArgs_MT32x64x64_MI16x16x1_SN_LDSB0_CLR1_GSU0_GSUC0_GSUWGMRR0_K1_LBSPPA256_LBSPPB512_LPA16_LPB32_MIWT1_2_PLR2_SU32_SUM0_SUS256_SKXCCM4_VWA1_VWB2_WGM2_WGMXCC1_WGMXCCGn1
    SolutionIndex: 83
    SolutionNameMin: Cijk_Ailk_Bjlk_HSS_BH_UserArgs_MT64x32x64_MI16x16x1_SN_LDSB0_CLR1_GSU0_GSUC0_GSUWGMRR0_K1_LBSPPA512_LBSPPB256_LPA32_LPB16_MIWT2_1_PLR1_SU32_SUM0_SUS256_SKXCCM4_VWA2_VWB1_WGM1_WGMXCC1_WGMXCCGn1
    SolutionIndex: 84
    SolutionNameMin: Cijk_Ailk_Bjlk_HSS_BH_UserArgs_MT64x32x64_MI16x16x1_SN_LDSB0_CLR1_GSU0_GSUC0_GSUWGMRR0_K1_LBSPPA512_LBSPPB256_LPA32_LPB16_MIWT2_1_PLR2_SU32_SUM0_SUS256_SKXCCM4_VWA2_VWB1_WGM1_WGMXCC1_WGMXCCGn1
    SolutionIndex: 85
    SolutionNameMin: Cijk_Ailk_Bjlk_HSS_BH_UserArgs_MT128x128x128_MI16x16x1_SN_LDSB1_CLR1_GSU0_GSUC0_GSUWGMRR0_K1_LBSPPA1024_LBSPPB1024_LPA0_LPB0_MIWT4_4_PLR1_SU32_SUM0_SUS256_SKXCCM4_VWA4_VWB4_WGM1_WGMXCC1_WGMXCCGn1
    SolutionIndex: 86
    SolutionNameMin: Cijk_Ailk_Bjlk_HSS_BH_UserArgs_MT128x128x128_MI16x16x1_SN_LDSB1_CLR1_GSU0_GSUC0_GSUWGMRR0_K1_LBSPPA1024_LBSPPB1024_LPA0_LPB0_MIWT4_4_PLR1_SU32_SUM0_SUS256_SKXCCM4_VWA4_VWB4_WGM2_WGMXCC1_WGMXCCGn1
    SolutionIndex: 87
    SolutionNameMin: Cijk_Ailk_Bjlk_HSS_BH_UserArgs_MT128x128x128_MI16x16x1_SN_LDSB1_CLR1_GSU0_GSUC0_GSUWGMRR0_K1_LBSPPA1024_LBSPPB1024_LPA0_LPB0_MIWT4_4_PLR1_SU32_SUM0_SUS256_SKXCCM4_VWA4_VWB4_WGM4_WGMXCC1_WGMXCCGn1
    SolutionIndex: 88
    SolutionNameMin: Cijk_Ailk_Bjlk_HSS_BH_UserArgs_MT64x64x128_MI16x16x1_SN_LDSB1_CLR1_GSU0_GSUC0_GSUWGMRR0_K1_LBSPPA512_LBSPPB512_LPA32_LPB32_MIWT2_2_PLR2_SU32_SUM0_SUS256_SKXCCM4_VWA2_VWB2_WGM1_WGMXCC1_WGMXCCGn1
    SolutionIndex: 89
    SolutionNameMin: Cijk_Ailk_Bjlk_HSS_BH_UserArgs_MT32x64x128_MI16x16x1_SN_LDSB1_CLR1_GSU0_GSUC0_GSUWGMRR0_K1_LBSPPA256_LBSPPB512_LPA16_LPB32_MIWT1_2_PLR2_SU32_SUM0_SUS256_SKXCCM4_VWA1_VWB2_WGM1_WGMXCC1_WGMXCCGn1
    SolutionIndex: 90
    SolutionNameMin: Cijk_Ailk_Bjlk_HSS_BH_UserArgs_MT64x32x128_MI16x16x1_SN_LDSB1_CLR1_GSU0_GSUC0_GSUWGMRR0_K1_LBSPPA512_LBSPPB256_LPA32_LPB16_MIWT2_1_PLR1_SU32_SUM0_SUS256_SKXCCM4_VWA2_VWB1_WGM1_WGMXCC1_WGMXCCGn1
    SolutionIndex: 91
    SolutionNameMin: Cijk_Ailk_Bjlk_HSS_BH_UserArgs_MT64x32x128_MI16x16x1_SN_LDSB1_CLR1_GSU0_GSUC0_GSUWGMRR0_K1_LBSPPA512_LBSPPB256_LPA32_LPB16_MIWT2_1_PLR2_SU32_SUM0_SUS256_SKXCCM4_VWA2_VWB1_WGM1_WGMXCC1_WGMXCCGn1
    SolutionIndex: 92
    SolutionNameMin: Cijk_Ailk_Bjlk_HSS_BH_UserArgs_MT32x32x128_MI16x16x1_SN_LDSB1_CLR1_GSU0_GSUC0_GSUWGMRR0_K1_LBSPPA256_LBSPPB256_LPA16_LPB16_MIWT1_1_PLR1_SU32_SUM0_SUS256_SKXCCM4_VWA1_VWB1_WGM1_WGMXCC1_WGMXCCGn1
    SolutionIndex: 93
    SolutionNameMin: Cijk_Ailk_Bjlk_HSS_BH_UserArgs_MT32x32x32_MI16x16x1_SN_LDSB0_CLR1_GSU0_GSUC0_GSUWGMRR0_K1_LBSPPA256_LBSPPB256_LPA16_LPB16_MIWT1_1_PLR1_SU32_SUM0_SUS256_SKXCCM0_VWA1_VWB1_WGM2_WGMXCC1_WGMXCCGn1
- - - [128, 128, 1, 128, 128, 128, 128, 128]
    - [39, 0.081]
  - - [128, 128, 1, 256, 128, 128, 128, 128]
    - [39, 0.107]
  - - [128, 128, 1, 512, 128, 128, 128, 128]
    - [40, 0.18]
  - - [128, 128, 1, 1024, 128, 128, 128, 128]
    - [39, 0.275]
  - - [128, 128, 1, 2048, 128, 128, 128, 128]
    - [39, 0.496]
  - - [128, 128, 1, 4096, 128, 128, 128, 128]
    - [92, 0.844]
  - - [128, 128, 1, 8192, 128, 128, 128, 128]
    - [17, 1.371]
  - - [128, 256, 1, 128, 128, 128, 128, 256]
    - [40, 0.161]
  - - [128, 256, 1, 256, 128, 128, 128, 256]
    - [39, 0.209]
  - - [128, 256, 1, 512, 128, 128, 128, 256]
    - [40, 0.348]
  - - [128, 256, 1, 1024, 128, 128, 128, 256]
    - [92, 0.555]
  - - [128, 256, 1, 2048, 128, 128, 128, 256]
    - [17, 1.001]
  - - [128, 256, 1, 4096, 128, 128, 128, 256]
    - [89, 1.527]
  - - [128, 256, 1, 8192, 128, 128, 128, 256]
    - [89, 2.294]
  - - [128, 512, 1, 128, 128, 128, 128, 512]
    - [41, 0.306]
  - - [128, 512, 1, 256, 128, 128, 128, 512]
    - [39, 0.411]
  - - [128, 512, 1, 512, 128, 128, 128, 512]
    - [18, 0.679]
  - - [128, 512, 1, 1024, 128, 128, 128, 512]
    - [39, 1.102]
  - - [128, 512, 1, 2048, 128, 128, 128, 512]
    - [66, 1.679]
  - - [128, 512, 1, 4096, 128, 128, 128, 512]
    - [83, 2.574]
  - - [128, 512, 1, 8192, 128, 128, 128, 512]
    - [88, 3.853]
  - - [128, 1024, 1, 128, 128, 128, 128, 1024]
    - [37, 0.596]
  - - [128, 1024, 1, 256, 128, 128, 128, 1024]
    - [17, 0.936]
  - - [128, 1024, 1, 512, 128, 128, 128, 1024]
    - [40, 1.394]
  - - [128, 1024, 1, 1024, 128, 128, 128, 1024]
    - [84, 1.996]
  - - [128, 1024, 1, 2048, 128, 128, 128, 1024]
    - [37, 2.852]
  - - [128, 1024, 1, 4096, 128, 128, 128, 1024]
    - [77, 4.274]
  - - [128, 1024, 1, 8192, 128, 128, 128, 1024]
    - [27, 6.051]
  - - [128, 2048, 1, 128, 128, 128, 128, 2048]
    - [84, 1.028]
  - - [128, 2048, 1, 256, 128, 128, 128, 2048]
    - [84, 1.679]
  - - [128, 2048, 1, 512, 128, 128, 128, 2048]
    - [31, 2.549]
  - - [128, 2048, 1, 1024, 128, 128, 128, 2048]
    - [77, 3.406]
  - - [128, 2048, 1, 2048, 128, 128, 128, 2048]
    - [59, 4.479]
  - - [128, 2048, 1, 4096, 128, 128, 128, 2048]
    - [23, 6.533]
  - - [128, 2048, 1, 8192, 128, 128, 128, 2048]
    - [23, 9.526]
  - - [128, 4096, 1, 128, 128, 128, 128, 4096]
    - [77, 1.741]
  - - [128, 4096, 1, 256, 128, 128, 128, 4096]
    - [77, 2.902]
  - - [128, 4096, 1, 512, 128, 128, 128, 4096]
    - [77, 4.209]
  - - [128, 4096, 1, 1024, 128, 128, 128, 4096]
    - [73, 5.115]
  - - [128, 4096, 1, 2048, 128, 128, 128, 4096]
    - [56, 6.455]
  - - [128, 4096, 1, 4096, 128, 128, 128, 4096]
    - [70, 9.56]
  - - [128, 4096, 1, 8192, 128, 128, 128, 4096]
    - [23, 12.198]
  - - [128, 8192, 1, 128, 128, 128, 128, 8192]
    - [58, 2.775]
  - - [128, 8192, 1, 256, 128, 128, 128, 8192]
    - [58, 4.393]
  - - [128, 8192, 1, 512, 128, 128, 128, 8192]
    - [74, 5.985]
  - - [128, 8192, 1, 1024, 128, 128, 128, 8192]
    - [70, 7.516]
  - - [128, 8192, 1, 2048, 128, 128, 128, 8192]
    - [70, 8.095]
  - - [128, 8192, 1, 4096, 128, 128, 128, 8192]
    - [2, 10.954]
  - - [128, 8192, 1, 8192, 128, 128, 128, 8192]
    - [26, 12.847]
  - - [256, 128, 1, 128, 256, 256, 256, 128]
    - [39, 0.161]
  - - [256, 128, 1, 256, 256, 256, 256, 128]
    - [39, 0.212]
  - - [256, 128, 1, 512, 256, 256, 256, 128]
    - [39, 0.348]
  - - [256, 128, 1, 1024, 256, 256, 256, 128]
    - [92, 0.556]
  - - [256, 128, 1, 2048, 256, 256, 256, 128]
    - [17, 0.987]
  - - [256, 128, 1, 4096, 256, 256, 256, 128]
    - [91, 1.51]
  - - [256, 128, 1, 8192, 256, 256, 256, 128]
    - [38, 2.265]
  - - [256, 256, 1, 128, 256, 256, 256, 256]
    - [39, 0.313]
  - - [256, 256, 1, 256, 256, 256, 256, 256]
    - [40, 0.401]
  - - [256, 256, 1, 512, 256, 256, 256, 256]
    - [17, 0.684]
  - - [256, 256, 1, 1024, 256, 256, 256, 256]
    - [39, 1.104]
  - - [256, 256, 1, 2048, 256, 256, 256, 256]
    - [65, 1.692]
  - - [256, 256, 1, 4096, 256, 256, 256, 256]
    - [81, 2.635]
  - - [256, 256, 1, 8192, 256, 256, 256, 256]
    - [29, 3.683]
  - - [256, 512, 1, 128, 256, 256, 256, 512]
    - [36, 0.586]
  - - [256, 512, 1, 256, 256, 256, 256, 512]
    - [17, 0.935]
  - - [256, 512, 1, 512, 256, 256, 256, 512]
    - [39, 1.4]
  - - [256, 512, 1, 1024, 256, 256, 256, 512]
    - [90, 1.988]
  - - [256, 512, 1, 2048, 256, 256, 256, 512]
    - [90, 2.894]
  - - [256, 512, 1, 4096, 256, 256, 256, 512]
    - [78, 4.33]
  - - [256, 512, 1, 8192, 256, 256, 256, 512]
    - [74, 6.066]
  - - [256, 1024, 1, 128, 256, 256, 256, 1024]
    - [35, 1.038]
  - - [256, 1024, 1, 256, 256, 256, 256, 1024]
    - [81, 1.679]
  - - [256, 1024, 1, 512, 256, 256, 256, 1024]
    - [81, 2.546]
  - - [256, 1024, 1, 1024, 256, 256, 256, 1024]
    - [77, 3.363]
  - - [256, 1024, 1, 2048, 256, 256, 256, 1024]
    - [59, 4.51]
  - - [256, 1024, 1, 4096, 256, 256, 256, 1024]
    - [23, 6.574]
  - - [256, 1024, 1, 8192, 256, 256, 256, 1024]
    - [23, 9.509]
  - - [256, 2048, 1, 128, 256, 256, 256, 2048]
    - [77, 1.771]
  - - [256, 2048, 1, 256, 256, 256, 256, 2048]
    - [77, 2.9]
  - - [256, 2048, 1, 512, 256, 256, 256, 2048]
    - [77, 4.221]
  - - [256, 2048, 1, 1024, 256, 256, 256, 2048]
    - [73, 5.087]
  - - [256, 2048, 1, 2048, 256, 256, 256, 2048]
    - [55, 6.354]
  - - [256, 2048, 1, 4096, 256, 256, 256, 2048]
    - [70, 9.535]
  - - [256, 2048, 1, 8192, 256, 256, 256, 2048]
    - [25, 11.903]
  - - [256, 4096, 1, 128, 256, 256, 256, 4096]
    - [62, 2.771]
  - - [256, 4096, 1, 256, 256, 256, 256, 4096]
    - [58, 4.364]
  - - [256, 4096, 1, 512, 256, 256, 256, 4096]
    - [76, 6.025]
  - - [256, 4096, 1, 1024, 256, 256, 256, 4096]
    - [70, 7.647]
  - - [256, 4096, 1, 2048, 256, 256, 256, 4096]
    - [33, 8.115]
  - - [256, 4096, 1, 4096, 256, 256, 256, 4096]
    - [2, 10.911]
  - - [256, 4096, 1, 8192, 256, 256, 256, 4096]
    - [20, 13.181]
  - - [256, 8192, 1, 128, 256, 256, 256, 8192]
    - [54, 3.917]
  - - [256, 8192, 1, 256, 256, 256, 256, 8192]
    - [23, 6.256]
  - - [256, 8192, 1, 512, 256, 256, 256, 8192]
    - [70, 8.608]
  - - [256, 8192, 1, 1024, 256, 256, 256, 8192]
    - [85, 9.214]
  - - [256, 8192, 1, 2048, 256, 256, 256, 8192]
    - [70, 11.259]
  - - [256, 8192, 1, 4096, 256, 256, 256, 8192]
    - [70, 12.834]
  - - [256, 8192, 1, 8192, 256, 256, 256, 8192]
    - [52, 13.748]
  - - [512, 128, 1, 128, 512, 512, 512, 128]
    - [39, 0.315]
  - - [512, 128, 1, 256, 512, 512, 512, 128]
    - [40, 0.406]
  - - [512, 128, 1, 512, 512, 512, 512, 128]
    - [18, 0.671]
  - - [512, 128, 1, 1024, 512, 512, 512, 128]
    - [92, 1.103]
  - - [512, 128, 1, 2048, 512, 512, 512, 128]
    - [64, 1.672]
  - - [512, 128, 1, 4096, 512, 512, 512, 128]
    - [82, 2.564]
  - - [512, 128, 1, 8192, 512, 512, 512, 128]
    - [78, 3.683]
  - - [512, 256, 1, 128, 512, 512, 512, 256]
    - [91, 0.582]
  - - [512, 256, 1, 256, 512, 512, 512, 256]
    - [17, 0.936]
  - - [512, 256, 1, 512, 512, 512, 512, 256]
    - [39, 1.407]
  - - [512, 256, 1, 1024, 512, 512, 512, 256]
    - [90, 1.983]
  - - [512, 256, 1, 2048, 512, 512, 512, 256]
    - [90, 2.897]
  - - [512, 256, 1, 4096, 512, 512, 512, 256]
    - [80, 4.271]
  - - [512, 256, 1, 8192, 512, 512, 512, 256]
    - [74, 6.074]
  - - [512, 512, 1, 128, 512, 512, 512, 512]
    - [81, 1.032]
  - - [512, 512, 1, 256, 512, 512, 512, 512]
    - [84, 1.69]
  - - [512, 512, 1, 512, 512, 512, 512, 512]
    - [84, 2.549]
  - - [512, 512, 1, 1024, 512, 512, 512, 512]
    - [77, 3.379]
  - - [512, 512, 1, 2048, 512, 512, 512, 512]
    - [59, 4.534]
  - - [512, 512, 1, 4096, 512, 512, 512, 512]
    - [70, 6.575]
  - - [512, 512, 1, 8192, 512, 512, 512, 512]
    - [70, 9.586]
  - - [512, 1024, 1, 128, 512, 512, 512, 1024]
    - [77, 1.767]
  - - [512, 1024, 1, 256, 512, 512, 512, 1024]
    - [77, 2.85]
  - - [512, 1024, 1, 512, 512, 512, 512, 1024]
    - [77, 4.19]
  - - [512, 1024, 1, 1024, 512, 512, 512, 1024]
    - [73, 5.152]
  - - [512, 1024, 1, 2048, 512, 512, 512, 1024]
    - [55, 6.4]
  - - [512, 1024, 1, 4096, 512, 512, 512, 1024]
    - [70, 9.485]
  - - [512, 1024, 1, 8192, 512, 512, 512, 1024]
    - [23, 11.939]
  - - [512, 2048, 1, 128, 512, 512, 512, 2048]
    - [58, 2.814]
  - - [512, 2048, 1, 256, 512, 512, 512, 2048]
    - [58, 4.356]
  - - [512, 2048, 1, 512, 512, 512, 512, 2048]
    - [74, 6.063]
  - - [512, 2048, 1, 1024, 512, 512, 512, 2048]
    - [70, 7.608]
  - - [512, 2048, 1, 2048, 512, 512, 512, 2048]
    - [33, 8.106]
  - - [512, 2048, 1, 4096, 512, 512, 512, 2048]
    - [2, 10.809]
  - - [512, 2048, 1, 8192, 512, 512, 512, 2048]
    - [19, 13.176]
  - - [512, 4096, 1, 128, 512, 512, 512, 4096]
    - [16, 3.951]
  - - [512, 4096, 1, 256, 512, 512, 512, 4096]
    - [70, 6.305]
  - - [512, 4096, 1, 512, 512, 512, 512, 4096]
    - [70, 8.728]
  - - [512, 4096, 1, 1024, 512, 512, 512, 4096]
    - [32, 9.296]
  - - [512, 4096, 1, 2048, 512, 512, 512, 4096]
    - [70, 11.308]
  - - [512, 4096, 1, 4096, 512, 512, 512, 4096]
    - [24, 12.601]
  - - [512, 4096, 1, 8192, 512, 512, 512, 4096]
    - [2, 13.798]
  - - [512, 8192, 1, 128, 512, 512, 512, 8192]
    - [9, 5.171]
  - - [512, 8192, 1, 256, 512, 512, 512, 8192]
    - [48, 7.586]
  - - [512, 8192, 1, 512, 512, 512, 512, 8192]
    - [54, 9.444]
  - - [512, 8192, 1, 1024, 512, 512, 512, 8192]
    - [72, 11.963]
  - - [512, 8192, 1, 2048, 512, 512, 512, 8192]
    - [26, 13.309]
  - - [512, 8192, 1, 4096, 512, 512, 512, 8192]
    - [44, 13.712]
  - - [512, 8192, 1, 8192, 512, 512, 512, 8192]
    - [44, 15.623]
  - - [1024, 128, 1, 128, 1024, 1024, 1024, 128]
    - [91, 0.576]
  - - [1024, 128, 1, 256, 1024, 1024, 1024, 128]
    - [17, 0.934]
  - - [1024, 128, 1, 512, 1024, 1024, 1024, 128]
    - [39, 1.412]
  - - [1024, 128, 1, 1024, 1024, 1024, 1024, 128]
    - [90, 1.991]
  - - [1024, 128, 1, 2048, 1024, 1024, 1024, 128]
    - [38, 2.854]
  - - [1024, 128, 1, 4096, 1024, 1024, 1024, 128]
    - [79, 4.208]
  - - [1024, 128, 1, 8192, 1024, 1024, 1024, 128]
    - [27, 6.08]
  - - [1024, 256, 1, 128, 1024, 1024, 1024, 256]
    - [34, 1.037]
  - - [1024, 256, 1, 256, 1024, 1024, 1024, 256]
    - [84, 1.708]
  - - [1024, 256, 1, 512, 1024, 1024, 1024, 256]
    - [31, 2.54]
  - - [1024, 256, 1, 1024, 1024, 1024, 1024, 256]
    - [77, 3.375]
  - - [1024, 256, 1, 2048, 1024, 1024, 1024, 256]
    - [59, 4.553]
  - - [1024, 256, 1, 4096, 1024, 1024, 1024, 256]
    - [23, 6.558]
  - - [1024, 256, 1, 8192, 1024, 1024, 1024, 256]
    - [23, 9.528]
  - - [1024, 512, 1, 128, 1024, 1024, 1024, 512]
    - [77, 1.753]
  - - [1024, 512, 1, 256, 1024, 1024, 1024, 512]
    - [77, 2.892]
  - - [1024, 512, 1, 512, 1024, 1024, 1024, 512]
    - [77, 4.182]
  - - [1024, 512, 1, 1024, 1024, 1024, 1024, 512]
    - [73, 5.133]
  - - [1024, 512, 1, 2048, 1024, 1024, 1024, 512]
    - [56, 6.406]
  - - [1024, 512, 1, 4096, 1024, 1024, 1024, 512]
    - [72, 9.507]
  - - [1024, 512, 1, 8192, 1024, 1024, 1024, 512]
    - [25, 11.782]
  - - [1024, 1024, 1, 128, 1024, 1024, 1024, 1024]
    - [58, 2.831]
  - - [1024, 1024, 1, 256, 1024, 1024, 1024, 1024]
    - [60, 4.353]
  - - [1024, 1024, 1, 512, 1024, 1024, 1024, 1024]
    - [76, 6.006]
  - - [1024, 1024, 1, 1024, 1024, 1024, 1024, 1024]
    - [70, 7.655]
  - - [1024, 1024, 1, 2048, 1024, 1024, 1024, 1024]
    - [32, 8.15]
  - - [1024, 1024, 1, 4096, 1024, 1024, 1024, 1024]
    - [2, 10.854]
  - - [1024, 1024, 1, 8192, 1024, 1024, 1024, 1024]
    - [22, 13.065]
  - - [1024, 2048, 1, 128, 1024, 1024, 1024, 2048]
    - [15, 4.044]
  - - [1024, 2048, 1, 256, 1024, 1024, 1024, 2048]
    - [23, 6.316]
  - - [1024, 2048, 1, 512, 1024, 1024, 1024, 2048]
    - [70, 8.654]
  - - [1024, 2048, 1, 1024, 1024, 1024, 1024, 2048]
    - [32, 9.328]
  - - [1024, 2048, 1, 2048, 1024, 1024, 1024, 2048]
    - [71, 11.114]
  - - [1024, 2048, 1, 4096, 1024, 1024, 1024, 2048]
    - [70, 12.394]
  - - [1024, 2048, 1, 8192, 1024, 1024, 1024, 2048]
    - [4, 13.619]
  - - [1024, 4096, 1, 128, 1024, 1024, 1024, 4096]
    - [49, 5.161]
  - - [1024, 4096, 1, 256, 1024, 1024, 1024, 4096]
    - [49, 7.594]
  - - [1024, 4096, 1, 512, 1024, 1024, 1024, 4096]
    - [15, 9.523]
  - - [1024, 4096, 1, 1024, 1024, 1024, 1024, 4096]
    - [70, 11.987]
  - - [1024, 4096, 1, 2048, 1024, 1024, 1024, 4096]
    - [71, 13.321]
  - - [1024, 4096, 1, 4096, 1024, 1024, 1024, 4096]
    - [4, 13.864]
  - - [1024, 4096, 1, 8192, 1024, 1024, 1024, 4096]
    - [50, 15.629]
  - - [1024, 8192, 1, 128, 1024, 1024, 1024, 8192]
    - [46, 5.355]
  - - [1024, 8192, 1, 256, 1024, 1024, 1024, 8192]
    - [3, 8.306]
  - - [1024, 8192, 1, 512, 1024, 1024, 1024, 8192]
    - [52, 11.246]
  - - [1024, 8192, 1, 1024, 1024, 1024, 1024, 8192]
    - [44, 13.373]
  - - [1024, 8192, 1, 2048, 1024, 1024, 1024, 8192]
    - [44, 13.793]
  - - [1024, 8192, 1, 4096, 1024, 1024, 1024, 8192]
    - [4, 15.473]
  - - [1024, 8192, 1, 8192, 1024, 1024, 1024, 8192]
    - [5, 16.962]
  - - [2048, 128, 1, 128, 2048, 2048, 2048, 128]
    - [84, 1.029]
  - - [2048, 128, 1, 256, 2048, 2048, 2048, 128]
    - [84, 1.708]
  - - [2048, 128, 1, 512, 2048, 2048, 2048, 128]
    - [84, 2.571]
  - - [2048, 128, 1, 1024, 2048, 2048, 2048, 128]
    - [77, 3.395]
  - - [2048, 128, 1, 2048, 2048, 2048, 2048, 128]
    - [61, 4.523]
  - - [2048, 128, 1, 4096, 2048, 2048, 2048, 128]
    - [70, 6.609]
  - - [2048, 128, 1, 8192, 2048, 2048, 2048, 128]
    - [23, 9.55]
  - - [2048, 256, 1, 128, 2048, 2048, 2048, 256]
    - [77, 1.751]
  - - [2048, 256, 1, 256, 2048, 2048, 2048, 256]
    - [77, 2.899]
  - - [2048, 256, 1, 512, 2048, 2048, 2048, 256]
    - [77, 4.211]
  - - [2048, 256, 1, 1024, 2048, 2048, 2048, 256]
    - [73, 5.092]
  - - [2048, 256, 1, 2048, 2048, 2048, 2048, 256]
    - [56, 6.417]
  - - [2048, 256, 1, 4096, 2048, 2048, 2048, 256]
    - [70, 9.431]
  - - [2048, 256, 1, 8192, 2048, 2048, 2048, 256]
    - [26, 11.793]
  - - [2048, 512, 1, 128, 2048, 2048, 2048, 512]
    - [58, 2.757]
  - - [2048, 512, 1, 256, 2048, 2048, 2048, 512]
    - [28, 4.334]
  - - [2048, 512, 1, 512, 2048, 2048, 2048, 512]
    - [73, 6.0]
  - - [2048, 512, 1, 1024, 2048, 2048, 2048, 512]
    - [70, 7.555]
  - - [2048, 512, 1, 2048, 2048, 2048, 2048, 512]
    - [33, 8.011]
  - - [2048, 512, 1, 4096, 2048, 2048, 2048, 512]
    - [4, 10.919]
  - - [2048, 512, 1, 8192, 2048, 2048, 2048, 512]
    - [68, 13.159]
  - - [2048, 1024, 1, 128, 2048, 2048, 2048, 1024]
    - [15, 3.936]
  - - [2048, 1024, 1, 256, 2048, 2048, 2048, 1024]
    - [70, 6.285]
  - - [2048, 1024, 1, 512, 2048, 2048, 2048, 1024]
    - [25, 8.52]
  - - [2048, 1024, 1, 1024, 2048, 2048, 2048, 1024]
    - [32, 9.278]
  - - [2048, 1024, 1, 2048, 2048, 2048, 2048, 1024]
    - [71, 11.037]
  - - [2048, 1024, 1, 4096, 2048, 2048, 2048, 1024]
    - [26, 12.669]
  - - [2048, 1024, 1, 8192, 2048, 2048, 2048, 1024]
    - [2, 13.761]
  - - [2048, 2048, 1, 128, 2048, 2048, 2048, 2048]
    - [9, 5.236]
  - - [2048, 2048, 1, 256, 2048, 2048, 2048, 2048]
    - [6, 7.673]
  - - [2048, 2048, 1, 512, 2048, 2048, 2048, 2048]
    - [15, 9.627]
  - - [2048, 2048, 1, 1024, 2048, 2048, 2048, 2048]
    - [70, 11.928]
  - - [2048, 2048, 1, 2048, 2048, 2048, 2048, 2048]
    - [72, 13.182]
  - - [2048, 2048, 1, 4096, 2048, 2048, 2048, 2048]
    - [5, 13.823]
  - - [2048, 2048, 1, 8192, 2048, 2048, 2048, 2048]
    - [2, 15.53]
  - - [2048, 4096, 1, 128, 2048, 2048, 2048, 4096]
    - [52, 5.504]
  - - [2048, 4096, 1, 256, 2048, 2048, 2048, 4096]
    - [45, 8.414]
  - - [2048, 4096, 1, 512, 2048, 2048, 2048, 4096]
    - [52, 11.324]
  - - [2048, 4096, 1, 1024, 2048, 2048, 2048, 4096]
    - [2, 13.343]
  - - [2048, 4096, 1, 2048, 2048, 2048, 2048, 4096]
    - [44, 13.793]
  - - [2048, 4096, 1, 4096, 2048, 2048, 2048, 4096]
    - [47, 15.447]
  - - [2048, 4096, 1, 8192, 2048, 2048, 2048, 4096]
    - [21, 16.915]
  - - [2048, 8192, 1, 128, 2048, 2048, 2048, 8192]
    - [54, 5.499]
  - - [2048, 8192, 1, 256, 2048, 2048, 2048, 8192]
    - [1, 8.124]
  - - [2048, 8192, 1, 512, 2048, 2048, 2048, 8192]
    - [1, 10.846]
  - - [2048, 8192, 1, 1024, 2048, 2048, 2048, 8192]
    - [0, 13.514]
  - - [2048, 8192, 1, 2048, 2048, 2048, 2048, 8192]
    - [44, 15.238]
  - - [2048, 8192, 1, 4096, 2048, 2048, 2048, 8192]
    - [44, 16.707]
  - - [2048, 8192, 1, 8192, 2048, 2048, 2048, 8192]
    - [67, 18.289]
  - - [4096, 128, 1, 128, 4096, 4096, 4096, 128]
    - [63, 1.728]
  - - [4096, 128, 1, 256, 4096, 4096, 4096, 128]
    - [30, 2.855]
  - - [4096, 128, 1, 512, 4096, 4096, 4096, 128]
    - [77, 4.091]
  - - [4096, 128, 1, 1024, 4096, 4096, 4096, 128]
    - [73, 5.053]
  - - [4096, 128, 1, 2048, 4096, 4096, 4096, 128]
    - [56, 6.368]
  - - [4096, 128, 1, 4096, 4096, 4096, 4096, 128]
    - [70, 9.368]
  - - [4096, 128, 1, 8192, 4096, 4096, 4096, 128]
    - [26, 11.915]
  - - [4096, 256, 1, 128, 4096, 4096, 4096, 256]
    - [58, 2.797]
  - - [4096, 256, 1, 256, 4096, 4096, 4096, 256]
    - [62, 4.338]
  - - [4096, 256, 1, 512, 4096, 4096, 4096, 256]
    - [76, 6.05]
  - - [4096, 256, 1, 1024, 4096, 4096, 4096, 256]
    - [71, 7.576]
  - - [4096, 256, 1, 2048, 4096, 4096, 4096, 256]
    - [70, 7.961]
  - - [4096, 256, 1, 4096, 4096, 4096, 4096, 256]
    - [2, 10.989]
  - - [4096, 256, 1, 8192, 4096, 4096, 4096, 256]
    - [69, 13.174]
  - - [4096, 512, 1, 128, 4096, 4096, 4096, 512]
    - [13, 3.956]
  - - [4096, 512, 1, 256, 4096, 4096, 4096, 512]
    - [72, 6.092]
  - - [4096, 512, 1, 512, 4096, 4096, 4096, 512]
    - [72, 8.507]
  - - [4096, 512, 1, 1024, 4096, 4096, 4096, 512]
    - [86, 9.076]
  - - [4096, 512, 1, 2048, 4096, 4096, 4096, 512]
    - [72, 11.226]
  - - [4096, 512, 1, 4096, 4096, 4096, 4096, 512]
    - [72, 12.458]
  - - [4096, 512, 1, 8192, 4096, 4096, 4096, 512]
    - [49, 13.785]
  - - [4096, 1024, 1, 128, 4096, 4096, 4096, 1024]
    - [8, 5.24]
  - - [4096, 1024, 1, 256, 4096, 4096, 4096, 1024]
    - [7, 7.591]
  - - [4096, 1024, 1, 512, 4096, 4096, 4096, 1024]
    - [14, 9.383]
  - - [4096, 1024, 1, 1024, 4096, 4096, 4096, 1024]
    - [71, 11.835]
  - - [4096, 1024, 1, 2048, 4096, 4096, 4096, 1024]
    - [23, 13.232]
  - - [4096, 1024, 1, 4096, 4096, 4096, 4096, 1024]
    - [2, 13.849]
  - - [4096, 1024, 1, 8192, 4096, 4096, 4096, 1024]
    - [2, 15.636]
  - - [4096, 2048, 1, 128, 4096, 4096, 4096, 2048]
    - [8, 5.426]
  - - [4096, 2048, 1, 256, 4096, 4096, 4096, 2048]
    - [11, 8.202]
  - - [4096, 2048, 1, 512, 4096, 4096, 4096, 2048]
    - [53, 11.168]
  - - [4096, 2048, 1, 1024, 4096, 4096, 4096, 2048]
    - [5, 13.22]
  - - [4096, 2048, 1, 2048, 4096, 4096, 4096, 2048]
    - [46, 13.765]
  - - [4096, 2048, 1, 4096, 4096, 4096, 4096, 2048]
    - [44, 15.484]
  - - [4096, 2048, 1, 8192, 4096, 4096, 4096, 2048]
    - [21, 16.944]
  - - [4096, 4096, 1, 128, 4096, 4096, 4096, 4096]
    - [57, 5.363]
  - - [4096, 4096, 1, 256, 4096, 4096, 4096, 4096]
    - [43, 7.817]
  - - [4096, 4096, 1, 512, 4096, 4096, 4096, 4096]
    - [43, 10.818]
  - - [4096, 4096, 1, 1024, 4096, 4096, 4096, 4096]
    - [68, 13.232]
  - - [4096, 4096, 1, 2048, 4096, 4096, 4096, 4096]
    - [44, 15.239]
  - - [4096, 4096, 1, 4096, 4096, 4096, 4096, 4096]
    - [42, 16.711]
  - - [4096, 4096, 1, 8192, 4096, 4096, 4096, 4096]
    - [67, 18.391]
  - - [4096, 8192, 1, 128, 4096, 4096, 4096, 8192]
    - [23, 5.268]
  - - [4096, 8192, 1, 256, 4096, 4096, 4096, 8192]
    - [15, 7.162]
  - - [4096, 8192, 1, 512, 4096, 4096, 4096, 8192]
    - [51, 10.08]
  - - [4096, 8192, 1, 1024, 4096, 4096, 4096, 8192]
    - [47, 13.279]
  - - [4096, 8192, 1, 2048, 4096, 4096, 4096, 8192]
    - [2, 15.87]
  - - [4096, 8192, 1, 4096, 4096, 4096, 4096, 8192]
    - [67, 17.844]
  - - [4096, 8192, 1, 8192, 4096, 4096, 4096, 8192]
    - [67, 18.913]
  - - [8192, 128, 1, 128, 8192, 8192, 8192, 128]
    - [60, 2.733]
  - - [8192, 128, 1, 256, 8192, 8192, 8192, 128]
    - [75, 4.326]
  - - [8192, 128, 1, 512, 8192, 8192, 8192, 128]
    - [76, 5.922]
  - - [8192, 128, 1, 1024, 8192, 8192, 8192, 128]
    - [70, 7.477]
  - - [8192, 128, 1, 2048, 8192, 8192, 8192, 128]
    - [23, 7.972]
  - - [8192, 128, 1, 4096, 8192, 8192, 8192, 128]
    - [10, 10.734]
  - - [8192, 128, 1, 8192, 8192, 8192, 8192, 128]
    - [26, 12.361]
  - - [8192, 256, 1, 128, 8192, 8192, 8192, 256]
    - [12, 3.905]
  - - [8192, 256, 1, 256, 8192, 8192, 8192, 256]
    - [23, 6.138]
  - - [8192, 256, 1, 512, 8192, 8192, 8192, 256]
    - [70, 8.383]
  - - [8192, 256, 1, 1024, 8192, 8192, 8192, 256]
    - [87, 9.13]
  - - [8192, 256, 1, 2048, 8192, 8192, 8192, 256]
    - [71, 11.183]
  - - [8192, 256, 1, 4096, 8192, 8192, 8192, 256]
    - [23, 12.9]
  - - [8192, 256, 1, 8192, 8192, 8192, 8192, 256]
    - [2, 13.886]
  - - [8192, 512, 1, 128, 8192, 8192, 8192, 512]
    - [8, 5.08]
  - - [8192, 512, 1, 256, 8192, 8192, 8192, 512]
    - [5, 7.6]
  - - [8192, 512, 1, 512, 8192, 8192, 8192, 512]
    - [15, 9.331]
  - - [8192, 512, 1, 1024, 8192, 8192, 8192, 512]
    - [70, 11.787]
  - - [8192, 512, 1, 2048, 8192, 8192, 8192, 512]
    - [72, 13.166]
  - - [8192, 512, 1, 4096, 8192, 8192, 8192, 512]
    - [2, 13.957]
  - - [8192, 512, 1, 8192, 8192, 8192, 8192, 512]
    - [2, 15.759]
  - - [8192, 1024, 1, 128, 8192, 8192, 8192, 1024]
    - [3, 5.322]
  - - [8192, 1024, 1, 256, 8192, 8192, 8192, 1024]
    - [45, 8.281]
  - - [8192, 1024, 1, 512, 8192, 8192, 8192, 1024]
    - [52, 11.082]
  - - [8192, 1024, 1, 1024, 8192, 8192, 8192, 1024]
    - [2, 13.259]
  - - [8192, 1024, 1, 2048, 8192, 8192, 8192, 1024]
    - [44, 13.989]
  - - [8192, 1024, 1, 4096, 8192, 8192, 8192, 1024]
    - [4, 15.653]
  - - [8192, 1024, 1, 8192, 8192, 8192, 8192, 1024]
    - [2, 17.096]
  - - [8192, 2048, 1, 128, 8192, 8192, 8192, 2048]
    - [54, 5.416]
  - - [8192, 2048, 1, 256, 8192, 8192, 8192, 2048]
    - [42, 7.786]
  - - [8192, 2048, 1, 512, 8192, 8192, 8192, 2048]
    - [42, 10.808]
  - - [8192, 2048, 1, 1024, 8192, 8192, 8192, 2048]
    - [47, 13.238]
  - - [8192, 2048, 1, 2048, 8192, 8192, 8192, 2048]
    - [44, 15.317]
  - - [8192, 2048, 1, 4096, 8192, 8192, 8192, 2048]
    - [2, 16.898]
  - - [8192, 2048, 1, 8192, 8192, 8192, 8192, 2048]
    - [19, 18.353]
  - - [8192, 4096, 1, 128, 8192, 8192, 8192, 4096]
    - [23, 5.213]
  - - [8192, 4096, 1, 256, 8192, 8192, 8192, 4096]
    - [15, 7.164]
  - - [8192, 4096, 1, 512, 8192, 8192, 8192, 4096]
    - [47, 10.122]
  - - [8192, 4096, 1, 1024, 8192, 8192, 8192, 4096]
    - [44, 13.279]
  - - [8192, 4096, 1, 2048, 8192, 8192, 8192, 4096]
    - [50, 15.817]
  - - [8192, 4096, 1, 4096, 8192, 8192, 8192, 4096]
    - [67, 17.839]
  - - [8192, 4096, 1, 8192, 8192, 8192, 8192, 4096]
    - [67, 18.924]
  - - [8192, 8192, 1, 128, 8192, 8192, 8192, 8192]
    - [15, 4.71]
  - - [8192, 8192, 1, 256, 8192, 8192, 8192, 8192]
    - [2, 7.658]
  - - [8192, 8192, 1, 512, 8192, 8192, 8192, 8192]
    - [47, 11.101]
  - - [8192, 8192, 1, 1024, 8192, 8192, 8192, 8192]
    - [47, 14.278]
  - - [8192, 8192, 1, 2048, 8192, 8192, 8192, 8192]
    - [67, 16.665]
  - - [8192, 8192, 1, 4096, 8192, 8192, 8192, 8192]
    - [67, 18.439]
  - - [8192, 8192, 1, 8192, 8192, 8192, 8192, 8192]
    - [19, 19.432]
  - - [1, 1, 1, 32, 1, 1, 1, 1]
    - [93, 0.0]
- null
- null
- DeviceEfficiency
- GridBased
