library/src/amd_detail/rocblaslt/src/Tensile/Logic/streamk/gfx942_80cu/aquavanjaram942_Cijk_Ailk_Bljk_HHS_BH_UserArgs.yaml
- {MinimumRequiredVersion: 4.33.0}
- aquavanjaram942
- {Architecture: gfx942, CUCount: 80}
- [Device 0049, Device 0050]
    SolutionIndex: 0
    SolutionNameMin: Cijk_Ailk_Bljk_HHS_BH_UserArgs_MT256x256x32_MI16x16x1_SN_LDSB1_CLR1_GSU0_GSUC0_GSUWGMRR0_K1_LBSPPA2048_LBSPPB128_LPA0_MIWT8_8_PLR1_SU32_SUM0_SUS256_SKXCCM0_VWA8_VWB1_WGM2_WGMXCC1_WGMXCCGn1
    SolutionIndex: 1
    SolutionNameMin: Cijk_Ailk_Bljk_HHS_BH_UserArgs_MT256x256x32_MI16x16x1_SN_LDSB1_CLR1_GSU0_GSUC0_GSUWGMRR0_K1_LBSPPA2048_LBSPPB512_LPA0_MIWT8_8_PLR1_SU32_SUM0_SUS256_SKXCCM0_VWA4_VWB8_WGM2_WGMXCC1_WGMXCCGn1
    SolutionIndex: 2
    SolutionNameMin: Cijk_Ailk_Bljk_HHS_BH_UserArgs_MT256x256x32_MI16x16x1_SN_LDSB1_CLR1_GSU0_GSUC0_GSUWGMRR0_K1_LBSPPA2048_LBSPPB512_LPA0_MIWT8_8_PLR1_SU32_SUM0_SUS256_SKXCCM0_VWA8_VWB8_WGM2_WGMXCC1_WGMXCCGn1
    SolutionIndex: 3
    SolutionNameMin: Cijk_Ailk_Bljk_HHS_BH_UserArgs_MT256x128x32_MI16x16x1_SN_LDSB1_CLR1_GSU0_GSUC0_GSUWGMRR0_K1_LBSPPA2048_LBSPPB128_LPA0_MIWT8_4_PLR1_SU32_SUM0_SUS256_SKXCCM0_VWA4_VWB1_WGM1_WGMXCC1_WGMXCCGn1
    SolutionIndex: 4
    SolutionNameMin: Cijk_Ailk_Bljk_HHS_BH_UserArgs_MT256x128x32_MI16x16x1_SN_LDSB1_CLR1_GSU0_GSUC0_GSUWGMRR0_K1_LBSPPA2048_LBSPPB128_LPA0_MIWT8_4_PLR1_SU32_SUM0_SUS256_SKXCCM0_VWA8_VWB1_WGM1_WGMXCC1_WGMXCCGn1
    SolutionIndex: 5
    SolutionNameMin: Cijk_Ailk_Bljk_HHS_BH_UserArgs_MT256x128x32_MI16x16x1_SN_LDSB1_CLR1_GSU0_GSUC0_GSUWGMRR0_K1_LBSPPA2048_LBSPPB128_LPA0_MIWT8_4_PLR1_SU32_SUM0_SUS256_SKXCCM0_VWA4_VWB2_WGM1_WGMXCC1_WGMXCCGn1
    SolutionIndex: 6
    SolutionNameMin: Cijk_Ailk_Bljk_HHS_BH_UserArgs_MT256x128x32_MI16x16x1_SN_LDSB1_CLR1_GSU0_GSUC0_GSUWGMRR0_K1_LBSPPA2048_LBSPPB128_LPA0_MIWT8_4_PLR1_SU32_SUM0_SUS256_SKXCCM0_VWA8_VWB2_WGM1_WGMXCC1_WGMXCCGn1
    SolutionIndex: 7
    SolutionNameMin: Cijk_Ailk_Bljk_HHS_BH_UserArgs_MT256x128x32_MI16x16x1_SN_LDSB1_CLR1_GSU0_GSUC0_GSUWGMRR0_K1_LBSPPA2048_LBSPPB256_LPA0_MIWT8_4_PLR1_SU32_SUM0_SUS256_SKXCCM0_VWA4_VWB4_WGM1_WGMXCC1_WGMXCCGn1
    SolutionIndex: 8
    SolutionNameMin: Cijk_Ailk_Bljk_HHS_BH_UserArgs_MT256x128x32_MI16x16x1_SN_LDSB1_CLR1_GSU0_GSUC0_GSUWGMRR0_K1_LBSPPA2048_LBSPPB256_LPA0_MIWT8_4_PLR1_SU32_SUM0_SUS256_SKXCCM0_VWA8_VWB4_WGM1_WGMXCC1_WGMXCCGn1
    SolutionIndex: 9
    SolutionNameMin: Cijk_Ailk_Bljk_HHS_BH_UserArgs_MT256x128x32_MI16x16x1_SN_LDSB1_CLR1_GSU0_GSUC0_GSUWGMRR0_K1_LBSPPA2048_LBSPPB128_LPA0_MIWT8_4_PLR1_SU32_SUM0_SUS256_SKXCCM0_VWA4_VWB1_WGM2_WGMXCC1_WGMXCCGn1
    SolutionIndex: 10
    SolutionNameMin: Cijk_Ailk_Bljk_HHS_BH_UserArgs_MT256x128x32_MI16x16x1_SN_LDSB1_CLR1_GSU0_GSUC0_GSUWGMRR0_K1_LBSPPA2048_LBSPPB128_LPA0_MIWT8_4_PLR1_SU32_SUM0_SUS256_SKXCCM0_VWA8_VWB1_WGM2_WGMXCC1_WGMXCCGn1
    SolutionIndex: 11
    SolutionNameMin: Cijk_Ailk_Bljk_HHS_BH_UserArgs_MT256x128x32_MI16x16x1_SN_LDSB1_CLR1_GSU0_GSUC0_GSUWGMRR0_K1_LBSPPA2048_LBSPPB256_LPA0_MIWT8_4_PLR1_SU32_SUM0_SUS256_SKXCCM0_VWA4_VWB4_WGM2_WGMXCC1_WGMXCCGn1
    SolutionIndex: 12
    SolutionNameMin: Cijk_Ailk_Bljk_HHS_BH_UserArgs_MT256x128x32_MI16x16x1_SN_LDSB1_CLR1_GSU0_GSUC0_GSUWGMRR0_K1_LBSPPA2048_LBSPPB128_LPA0_MIWT8_4_PLR1_SU32_SUM0_SUS256_SKXCCM0_VWA4_VWB1_WGM4_WGMXCC1_WGMXCCGn1
    SolutionIndex: 13
    SolutionNameMin: Cijk_Ailk_Bljk_HHS_BH_UserArgs_MT256x128x32_MI16x16x1_SN_LDSB1_CLR1_GSU0_GSUC0_GSUWGMRR0_K1_LBSPPA2048_LBSPPB256_LPA0_MIWT8_4_PLR1_SU32_SUM0_SUS256_SKXCCM0_VWA4_VWB4_WGM4_WGMXCC1_WGMXCCGn1
    SolutionIndex: 14
    SolutionNameMin: Cijk_Ailk_Bljk_HHS_BH_UserArgs_MT256x128x32_MI16x16x1_SN_LDSB1_CLR1_GSU0_GSUC0_GSUWGMRR0_K1_LBSPPA2048_LBSPPB256_LPA0_MIWT8_4_PLR1_SU32_SUM0_SUS256_SKXCCM0_VWA8_VWB4_WGM4_WGMXCC1_WGMXCCGn1
    SolutionIndex: 15
    SolutionNameMin: Cijk_Ailk_Bljk_HHS_BH_UserArgs_MT256x64x32_MI16x16x1_SN_LDSB1_CLR1_GSU0_GSUC0_GSUWGMRR0_K1_LBSPPA2048_LBSPPB128_LPA0_MIWT8_2_PLR1_SU32_SUM0_SUS256_SKXCCM0_VWA8_VWB1_WGM1_WGMXCC1_WGMXCCGn1
    SolutionIndex: 16
    SolutionNameMin: Cijk_Ailk_Bljk_HHS_BH_UserArgs_MT256x64x32_MI16x16x1_SN_LDSB1_CLR1_GSU0_GSUC0_GSUWGMRR0_K1_LBSPPA2048_LBSPPB128_LPA0_MIWT8_2_PLR1_SU32_SUM0_SUS256_SKXCCM0_VWA8_VWB2_WGM1_WGMXCC1_WGMXCCGn1
    SolutionIndex: 17
    SolutionNameMin: Cijk_Ailk_Bljk_HHS_BH_UserArgs_MT128x128x32_MI16x16x1_SN_LDSB1_CLR1_GSU0_GSUC0_GSUWGMRR0_K1_LBSPPA1024_LBSPPB128_LPA32_MIWT4_4_PLR1_SU32_SUM0_SUS256_SKXCCM0_VWA2_VWB1_WGM1_WGMXCC1_WGMXCCGn1
    SolutionIndex: 18
    SolutionNameMin: Cijk_Ailk_Bljk_HHS_BH_UserArgs_MT128x128x32_MI16x16x1_SN_LDSB1_CLR1_GSU0_GSUC0_GSUWGMRR0_K1_LBSPPA1024_LBSPPB128_LPA0_MIWT4_4_PLR1_SU32_SUM0_SUS256_SKXCCM0_VWA4_VWB1_WGM1_WGMXCC1_WGMXCCGn1
    SolutionIndex: 19
    SolutionNameMin: Cijk_Ailk_Bljk_HHS_BH_UserArgs_MT128x128x32_MI16x16x1_SN_LDSB1_CLR1_GSU0_GSUC0_GSUWGMRR0_K1_LBSPPA1024_LBSPPB128_LPA0_MIWT4_4_PLR1_SU32_SUM0_SUS256_SKXCCM0_VWA4_VWB2_WGM1_WGMXCC1_WGMXCCGn1
    SolutionIndex: 20
    SolutionNameMin: Cijk_Ailk_Bljk_HHS_BH_UserArgs_MT128x128x32_MI16x16x1_SN_LDSB1_CLR1_GSU0_GSUC0_GSUWGMRR0_K1_LBSPPA1024_LBSPPB256_LPA32_MIWT4_4_PLR1_SU32_SUM0_SUS256_SKXCCM0_VWA2_VWB4_WGM4_WGMXCC1_WGMXCCGn1
    SolutionIndex: 21
    SolutionNameMin: Cijk_Ailk_Bljk_HHS_BH_UserArgs_MT128x256x64_MI16x16x1_SN_LDSB1_CLR1_GSU0_GSUC0_GSUWGMRR0_K1_LBSPPA2048_LBSPPB1024_LPA0_MIWT4_8_PLR1_SU32_SUM0_SUS256_SKXCCM0_VWA4_VWB8_WGM1_WGMXCC1_WGMXCCGn1
    SolutionIndex: 22
    SolutionNameMin: Cijk_Ailk_Bljk_HHS_BH_UserArgs_MT256x128x64_MI16x16x1_SN_LDSB1_CLR1_GSU0_GSUC0_GSUWGMRR0_K1_LBSPPA4096_LBSPPB128_LPA0_MIWT8_4_PLR1_SU32_SUM0_SUS256_SKXCCM0_VWA4_VWB1_WGM1_WGMXCC1_WGMXCCGn1
    SolutionIndex: 23
    SolutionNameMin: Cijk_Ailk_Bljk_HHS_BH_UserArgs_MT256x128x64_MI16x16x1_SN_LDSB1_CLR1_GSU0_GSUC0_GSUWGMRR0_K1_LBSPPA4096_LBSPPB512_LPA0_MIWT8_4_PLR1_SU32_SUM0_SUS256_SKXCCM0_VWA4_VWB4_WGM2_WGMXCC1_WGMXCCGn1
    SolutionIndex: 24
    SolutionNameMin: Cijk_Ailk_Bljk_HHS_BH_UserArgs_MT256x128x64_MI16x16x1_SN_LDSB1_CLR1_GSU0_GSUC0_GSUWGMRR0_K1_LBSPPA4096_LBSPPB128_LPA0_MIWT8_4_PLR1_SU32_SUM0_SUS256_SKXCCM0_VWA4_VWB1_WGM4_WGMXCC1_WGMXCCGn1
    SolutionIndex: 25
    SolutionNameMin: Cijk_Ailk_Bljk_HHS_BH_UserArgs_MT128x128x64_MI16x16x1_SN_LDSB1_CLR1_GSU0_GSUC0_GSUWGMRR0_K1_LBSPPA2048_LBSPPB256_LPA0_MIWT4_4_PLR1_SU32_SUM0_SUS256_SKXCCM0_VWA4_VWB2_WGM1_WGMXCC1_WGMXCCGn1
    SolutionIndex: 26
    SolutionNameMin: Cijk_Ailk_Bljk_HHS_BH_UserArgs_MT128x128x64_MI16x16x1_SN_LDSB1_CLR1_GSU0_GSUC0_GSUWGMRR0_K1_LBSPPA2048_LBSPPB512_LPA0_MIWT4_4_PLR1_SU32_SUM0_SUS256_SKXCCM0_VWA4_VWB4_WGM1_WGMXCC1_WGMXCCGn1
    SolutionIndex: 27
    SolutionNameMin: Cijk_Ailk_Bljk_HHS_BH_UserArgs_MT64x128x64_MI16x16x1_SN_LDSB1_CLR1_GSU0_GSUC0_GSUWGMRR0_K1_LBSPPA1024_LBSPPB128_LPA32_MIWT2_4_PLR1_SU32_SUM0_SUS256_SKXCCM0_VWA2_VWB1_WGM1_WGMXCC1_WGMXCCGn1
    SolutionIndex: 28
    SolutionNameMin: Cijk_Ailk_Bljk_HHS_BH_UserArgs_MT64x128x64_MI16x16x1_SN_LDSB1_CLR1_GSU0_GSUC0_GSUWGMRR0_K1_LBSPPA1024_LBSPPB256_LPA32_MIWT2_4_PLR1_SU32_SUM0_SUS256_SKXCCM0_VWA2_VWB2_WGM1_WGMXCC1_WGMXCCGn1
    SolutionIndex: 29
    SolutionNameMin: Cijk_Ailk_Bljk_HHS_BH_UserArgs_MT128x64x64_MI16x16x1_SN_LDSB1_CLR1_GSU0_GSUC0_GSUWGMRR0_K1_LBSPPA2048_LBSPPB128_LPA0_MIWT4_2_PLR1_SU32_SUM0_SUS256_SKXCCM0_VWA4_VWB1_WGM1_WGMXCC1_WGMXCCGn1
    SolutionIndex: 30
    SolutionNameMin: Cijk_Ailk_Bljk_HHS_BH_UserArgs_MT128x64x64_MI16x16x1_SN_LDSB1_CLR1_GSU0_GSUC0_GSUWGMRR0_K1_LBSPPA2048_LBSPPB256_LPA0_MIWT4_2_PLR1_SU32_SUM0_SUS256_SKXCCM0_VWA4_VWB2_WGM1_WGMXCC1_WGMXCCGn1
    SolutionIndex: 31
    SolutionNameMin: Cijk_Ailk_Bljk_HHS_BH_UserArgs_MT128x64x64_MI16x16x1_SN_LDSB1_CLR1_GSU0_GSUC0_GSUWGMRR0_K1_LBSPPA2048_LBSPPB256_LPA0_MIWT4_2_PLR1_SU32_SUM0_SUS256_SKXCCM0_VWA4_VWB2_WGM4_WGMXCC1_WGMXCCGn1
    SolutionIndex: 32
    SolutionNameMin: Cijk_Ailk_Bljk_HHS_BH_UserArgs_MT64x64x64_MI16x16x1_SN_LDSB1_CLR1_GSU0_GSUC0_GSUWGMRR0_K1_LBSPPA1024_LBSPPB128_LPA32_MIWT2_2_PLR1_SU32_SUM0_SUS256_SKXCCM0_VWA2_VWB1_WGM1_WGMXCC1_WGMXCCGn1
    SolutionIndex: 33
    SolutionNameMin: Cijk_Ailk_Bljk_HHS_BH_UserArgs_MT64x64x64_MI16x16x1_SN_LDSB1_CLR1_GSU0_GSUC0_GSUWGMRR0_K1_LBSPPA1024_LBSPPB256_LPA32_MIWT2_2_PLR1_SU32_SUM0_SUS256_SKXCCM0_VWA2_VWB2_WGM1_WGMXCC1_WGMXCCGn1
    SolutionIndex: 34
    SolutionNameMin: Cijk_Ailk_Bljk_HHS_BH_UserArgs_MT64x32x64_MI16x16x1_SN_LDSB0_CLR1_GSU0_GSUC0_GSUWGMRR0_K1_LBSPPA1024_LBSPPB128_LPA32_MIWT2_1_PLR1_SU32_SUM0_SUS256_SKXCCM0_VWA2_VWB1_WGM1_WGMXCC1_WGMXCCGn1
    SolutionIndex: 35
    SolutionNameMin: Cijk_Ailk_Bljk_HHS_BH_UserArgs_MT32x32x64_MI16x16x1_SN_LDSB0_CLR1_GSU0_GSUC0_GSUWGMRR0_K1_LBSPPA512_LBSPPB128_LPA16_MIWT1_1_PLR1_SU32_SUM0_SUS256_SKXCCM0_VWA1_VWB1_WGM1_WGMXCC1_WGMXCCGn1
    SolutionIndex: 36
    SolutionNameMin: Cijk_Ailk_Bljk_HHS_BH_UserArgs_MT64x128x128_MI16x16x1_SN_LDSB1_CLR1_GSU0_GSUC0_GSUWGMRR0_K1_LBSPPA1024_LBSPPB512_LPA32_MIWT2_4_PLR2_SU32_SUM0_SUS256_SKXCCM0_VWA2_VWB2_WGM2_WGMXCC1_WGMXCCGn1
    SolutionIndex: 37
    SolutionNameMin: Cijk_Ailk_Bljk_HHS_BH_UserArgs_MT128x64x128_MI16x16x1_SN_LDSB1_CLR1_GSU0_GSUC0_GSUWGMRR0_K1_LBSPPA2048_LBSPPB256_LPA0_MIWT4_2_PLR2_SU32_SUM0_SUS256_SKXCCM0_VWA4_VWB1_WGM1_WGMXCC1_WGMXCCGn1
    SolutionIndex: 38
    SolutionNameMin: Cijk_Ailk_Bljk_HHS_BH_UserArgs_MT64x64x128_MI16x16x1_SN_LDSB1_CLR1_GSU0_GSUC0_GSUWGMRR0_K1_LBSPPA1024_LBSPPB512_LPA32_MIWT2_2_PLR1_SU32_SUM0_SUS256_SKXCCM0_VWA2_VWB2_WGM1_WGMXCC1_WGMXCCGn1
    SolutionIndex: 39
    SolutionNameMin: Cijk_Ailk_Bljk_HHS_BH_UserArgs_MT64x64x128_MI16x16x1_SN_LDSB1_CLR1_GSU0_GSUC0_GSUWGMRR0_K1_LBSPPA1024_LBSPPB256_LPA32_MIWT2_2_PLR2_SU32_SUM0_SUS256_SKXCCM0_VWA2_VWB1_WGM1_WGMXCC1_WGMXCCGn1
    SolutionIndex: 40
    SolutionNameMin: Cijk_Ailk_Bljk_HHS_BH_UserArgs_MT64x64x128_MI16x16x1_SN_LDSB1_CLR1_GSU0_GSUC0_GSUWGMRR0_K1_LBSPPA1024_LBSPPB512_LPA32_MIWT2_2_PLR2_SU32_SUM0_SUS256_SKXCCM0_VWA2_VWB2_WGM1_WGMXCC1_WGMXCCGn1
    SolutionIndex: 41
    SolutionNameMin: Cijk_Ailk_Bljk_HHS_BH_UserArgs_MT64x32x128_MI16x16x1_SN_LDSB1_CLR1_GSU0_GSUC0_GSUWGMRR0_K1_LBSPPA1024_LBSPPB256_LPA32_MIWT2_1_PLR2_SU32_SUM0_SUS256_SKXCCM0_VWA2_VWB1_WGM1_WGMXCC1_WGMXCCGn1
    SolutionIndex: 42
    SolutionNameMin: Cijk_Ailk_Bljk_HHS_BH_UserArgs_MT32x32x128_MI16x16x1_SN_LDSB1_CLR1_GSU0_GSUC0_GSUWGMRR0_K1_LBSPPA512_LBSPPB256_LPA16_MIWT1_1_PLR1_SU32_SUM0_SUS256_SKXCCM0_VWA1_VWB1_WGM1_WGMXCC1_WGMXCCGn1
    SolutionIndex: 43
    SolutionNameMin: Cijk_Ailk_Bljk_HHS_BH_UserArgs_MT32x32x128_MI16x16x1_SN_LDSB1_CLR1_GSU0_GSUC0_GSUWGMRR0_K1_LBSPPA512_LBSPPB256_LPA16_MIWT1_1_PLR2_SU32_SUM0_SUS256_SKXCCM0_VWA1_VWB1_WGM1_WGMXCC1_WGMXCCGn1
    SolutionIndex: 44
    SolutionNameMin: Cijk_Ailk_Bljk_HHS_BH_UserArgs_MT256x256x32_MI16x16x1_SN_LDSB1_CLR1_GSU0_GSUC0_GSUWGMRR0_K1_LBSPPA2048_LBSPPB128_LPA0_MIWT8_8_PLR1_SU32_SUM0_SUS256_SKXCCM4_VWA4_VWB1_WGM1_WGMXCC1_WGMXCCGn1
    SolutionIndex: 45
    SolutionNameMin: Cijk_Ailk_Bljk_HHS_BH_UserArgs_MT256x256x32_MI16x16x1_SN_LDSB1_CLR1_GSU0_GSUC0_GSUWGMRR0_K1_LBSPPA2048_LBSPPB128_LPA0_MIWT8_8_PLR1_SU32_SUM0_SUS256_SKXCCM4_VWA8_VWB1_WGM1_WGMXCC1_WGMXCCGn1
    SolutionIndex: 46
    SolutionNameMin: Cijk_Ailk_Bljk_HHS_BH_UserArgs_MT256x256x32_MI16x16x1_SN_LDSB1_CLR1_GSU0_GSUC0_GSUWGMRR0_K1_LBSPPA2048_LBSPPB128_LPA0_MIWT8_8_PLR1_SU32_SUM0_SUS256_SKXCCM4_VWA4_VWB2_WGM1_WGMXCC1_WGMXCCGn1
    SolutionIndex: 47
    SolutionNameMin: Cijk_Ailk_Bljk_HHS_BH_UserArgs_MT256x256x32_MI16x16x1_SN_LDSB1_CLR1_GSU0_GSUC0_GSUWGMRR0_K1_LBSPPA2048_LBSPPB256_LPA0_MIWT8_8_PLR1_SU32_SUM0_SUS256_SKXCCM4_VWA8_VWB4_WGM1_WGMXCC1_WGMXCCGn1
    SolutionIndex: 48
    SolutionNameMin: Cijk_Ailk_Bljk_HHS_BH_UserArgs_MT256x256x32_MI16x16x1_SN_LDSB1_CLR1_GSU0_GSUC0_GSUWGMRR0_K1_LBSPPA2048_LBSPPB512_LPA0_MIWT8_8_PLR1_SU32_SUM0_SUS256_SKXCCM4_VWA4_VWB8_WGM1_WGMXCC1_WGMXCCGn1
    SolutionIndex: 49
    SolutionNameMin: Cijk_Ailk_Bljk_HHS_BH_UserArgs_MT256x256x32_MI16x16x1_SN_LDSB1_CLR1_GSU0_GSUC0_GSUWGMRR0_K1_LBSPPA2048_LBSPPB512_LPA0_MIWT8_8_PLR1_SU32_SUM0_SUS256_SKXCCM4_VWA8_VWB8_WGM1_WGMXCC1_WGMXCCGn1
    SolutionIndex: 50
    SolutionNameMin: Cijk_Ailk_Bljk_HHS_BH_UserArgs_MT256x256x32_MI16x16x1_SN_LDSB1_CLR1_GSU0_GSUC0_GSUWGMRR0_K1_LBSPPA2048_LBSPPB128_LPA0_MIWT8_8_PLR1_SU32_SUM0_SUS256_SKXCCM4_VWA4_VWB1_WGM2_WGMXCC1_WGMXCCGn1
    SolutionIndex: 51
    SolutionNameMin: Cijk_Ailk_Bljk_HHS_BH_UserArgs_MT256x256x32_MI16x16x1_SN_LDSB1_CLR1_GSU0_GSUC0_GSUWGMRR0_K1_LBSPPA2048_LBSPPB256_LPA0_MIWT8_8_PLR1_SU32_SUM0_SUS256_SKXCCM4_VWA4_VWB4_WGM4_WGMXCC1_WGMXCCGn1
    SolutionIndex: 52
    SolutionNameMin: Cijk_Ailk_Bljk_HHS_BH_UserArgs_MT256x256x32_MI16x16x1_SN_LDSB1_CLR1_GSU0_GSUC0_GSUWGMRR0_K1_LBSPPA2048_LBSPPB512_LPA0_MIWT8_8_PLR1_SU32_SUM0_SUS256_SKXCCM4_VWA4_VWB8_WGM4_WGMXCC1_WGMXCCGn1
    SolutionIndex: 53
    SolutionNameMin: Cijk_Ailk_Bljk_HHS_BH_UserArgs_MT256x256x32_MI16x16x1_SN_LDSB1_CLR1_GSU0_GSUC0_GSUWGMRR0_K1_LBSPPA2048_LBSPPB512_LPA0_MIWT8_8_PLR1_SU32_SUM0_SUS256_SKXCCM4_VWA8_VWB8_WGM4_WGMXCC1_WGMXCCGn1
    SolutionIndex: 54
    SolutionNameMin: Cijk_Ailk_Bljk_HHS_BH_UserArgs_MT256x128x32_MI16x16x1_SN_LDSB1_CLR1_GSU0_GSUC0_GSUWGMRR0_K1_LBSPPA2048_LBSPPB128_LPA0_MIWT8_4_PLR1_SU32_SUM0_SUS256_SKXCCM4_VWA4_VWB1_WGM1_WGMXCC1_WGMXCCGn1
    SolutionIndex: 55
    SolutionNameMin: Cijk_Ailk_Bljk_HHS_BH_UserArgs_MT256x128x32_MI16x16x1_SN_LDSB1_CLR1_GSU0_GSUC0_GSUWGMRR0_K1_LBSPPA2048_LBSPPB128_LPA0_MIWT8_4_PLR1_SU32_SUM0_SUS256_SKXCCM4_VWA4_VWB2_WGM1_WGMXCC1_WGMXCCGn1
    SolutionIndex: 56
    SolutionNameMin: Cijk_Ailk_Bljk_HHS_BH_UserArgs_MT256x128x32_MI16x16x1_SN_LDSB1_CLR1_GSU0_GSUC0_GSUWGMRR0_K1_LBSPPA2048_LBSPPB128_LPA0_MIWT8_4_PLR1_SU32_SUM0_SUS256_SKXCCM4_VWA8_VWB2_WGM1_WGMXCC1_WGMXCCGn1
    SolutionIndex: 57
    SolutionNameMin: Cijk_Ailk_Bljk_HHS_BH_UserArgs_MT256x128x32_MI16x16x1_SN_LDSB1_CLR1_GSU0_GSUC0_GSUWGMRR0_K1_LBSPPA2048_LBSPPB256_LPA0_MIWT8_4_PLR1_SU32_SUM0_SUS256_SKXCCM4_VWA4_VWB4_WGM1_WGMXCC1_WGMXCCGn1
    SolutionIndex: 58
    SolutionNameMin: Cijk_Ailk_Bljk_HHS_BH_UserArgs_MT256x128x32_MI16x16x1_SN_LDSB1_CLR1_GSU0_GSUC0_GSUWGMRR0_K1_LBSPPA2048_LBSPPB256_LPA0_MIWT8_4_PLR1_SU32_SUM0_SUS256_SKXCCM4_VWA8_VWB4_WGM1_WGMXCC1_WGMXCCGn1
    SolutionIndex: 59
    SolutionNameMin: Cijk_Ailk_Bljk_HHS_BH_UserArgs_MT256x128x32_MI16x16x1_SN_LDSB1_CLR1_GSU0_GSUC0_GSUWGMRR0_K1_LBSPPA2048_LBSPPB128_LPA0_MIWT8_4_PLR1_SU32_SUM0_SUS256_SKXCCM4_VWA4_VWB1_WGM2_WGMXCC1_WGMXCCGn1
    SolutionIndex: 60
    SolutionNameMin: Cijk_Ailk_Bljk_HHS_BH_UserArgs_MT256x128x32_MI16x16x1_SN_LDSB1_CLR1_GSU0_GSUC0_GSUWGMRR0_K1_LBSPPA2048_LBSPPB128_LPA0_MIWT8_4_PLR1_SU32_SUM0_SUS256_SKXCCM4_VWA8_VWB1_WGM2_WGMXCC1_WGMXCCGn1
    SolutionIndex: 61
    SolutionNameMin: Cijk_Ailk_Bljk_HHS_BH_UserArgs_MT256x128x32_MI16x16x1_SN_LDSB1_CLR1_GSU0_GSUC0_GSUWGMRR0_K1_LBSPPA2048_LBSPPB128_LPA0_MIWT8_4_PLR1_SU32_SUM0_SUS256_SKXCCM4_VWA4_VWB2_WGM2_WGMXCC1_WGMXCCGn1
    SolutionIndex: 62
    SolutionNameMin: Cijk_Ailk_Bljk_HHS_BH_UserArgs_MT256x128x32_MI16x16x1_SN_LDSB1_CLR1_GSU0_GSUC0_GSUWGMRR0_K1_LBSPPA2048_LBSPPB128_LPA0_MIWT8_4_PLR1_SU32_SUM0_SUS256_SKXCCM4_VWA8_VWB2_WGM2_WGMXCC1_WGMXCCGn1
    SolutionIndex: 63
    SolutionNameMin: Cijk_Ailk_Bljk_HHS_BH_UserArgs_MT256x128x32_MI16x16x1_SN_LDSB1_CLR1_GSU0_GSUC0_GSUWGMRR0_K1_LBSPPA2048_LBSPPB256_LPA0_MIWT8_4_PLR1_SU32_SUM0_SUS256_SKXCCM4_VWA4_VWB4_WGM2_WGMXCC1_WGMXCCGn1
    SolutionIndex: 64
    SolutionNameMin: Cijk_Ailk_Bljk_HHS_BH_UserArgs_MT256x128x32_MI16x16x1_SN_LDSB1_CLR1_GSU0_GSUC0_GSUWGMRR0_K1_LBSPPA2048_LBSPPB256_LPA0_MIWT8_4_PLR1_SU32_SUM0_SUS256_SKXCCM4_VWA8_VWB4_WGM2_WGMXCC1_WGMXCCGn1
    SolutionIndex: 65
    SolutionNameMin: Cijk_Ailk_Bljk_HHS_BH_UserArgs_MT256x128x32_MI16x16x1_SN_LDSB1_CLR1_GSU0_GSUC0_GSUWGMRR0_K1_LBSPPA2048_LBSPPB128_LPA0_MIWT8_4_PLR1_SU32_SUM0_SUS256_SKXCCM4_VWA4_VWB1_WGM4_WGMXCC1_WGMXCCGn1
    SolutionIndex: 66
    SolutionNameMin: Cijk_Ailk_Bljk_HHS_BH_UserArgs_MT256x128x32_MI16x16x1_SN_LDSB1_CLR1_GSU0_GSUC0_GSUWGMRR0_K1_LBSPPA2048_LBSPPB128_LPA0_MIWT8_4_PLR1_SU32_SUM0_SUS256_SKXCCM4_VWA4_VWB2_WGM4_WGMXCC1_WGMXCCGn1
    SolutionIndex: 67
    SolutionNameMin: Cijk_Ailk_Bljk_HHS_BH_UserArgs_MT256x128x32_MI16x16x1_SN_LDSB1_CLR1_GSU0_GSUC0_GSUWGMRR0_K1_LBSPPA2048_LBSPPB256_LPA0_MIWT8_4_PLR1_SU32_SUM0_SUS256_SKXCCM4_VWA4_VWB4_WGM4_WGMXCC1_WGMXCCGn1
    SolutionIndex: 68
    SolutionNameMin: Cijk_Ailk_Bljk_HHS_BH_UserArgs_MT256x128x32_MI16x16x1_SN_LDSB1_CLR1_GSU0_GSUC0_GSUWGMRR0_K1_LBSPPA2048_LBSPPB256_LPA0_MIWT8_4_PLR1_SU32_SUM0_SUS256_SKXCCM4_VWA8_VWB4_WGM4_WGMXCC1_WGMXCCGn1
    SolutionIndex: 69
    SolutionNameMin: Cijk_Ailk_Bljk_HHS_BH_UserArgs_MT256x64x32_MI16x16x1_SN_LDSB1_CLR1_GSU0_GSUC0_GSUWGMRR0_K1_LBSPPA2048_LBSPPB128_LPA0_MIWT8_2_PLR1_SU32_SUM0_SUS256_SKXCCM4_VWA8_VWB1_WGM1_WGMXCC1_WGMXCCGn1
    SolutionIndex: 70
    SolutionNameMin: Cijk_Ailk_Bljk_HHS_BH_UserArgs_MT256x64x32_MI16x16x1_SN_LDSB1_CLR1_GSU0_GSUC0_GSUWGMRR0_K1_LBSPPA2048_LBSPPB128_LPA0_MIWT8_2_PLR1_SU32_SUM0_SUS256_SKXCCM4_VWA8_VWB2_WGM1_WGMXCC1_WGMXCCGn1
    SolutionIndex: 71
    SolutionNameMin: Cijk_Ailk_Bljk_HHS_BH_UserArgs_MT256x64x32_MI16x16x1_SN_LDSB1_CLR1_GSU0_GSUC0_GSUWGMRR0_K1_LBSPPA2048_LBSPPB128_LPA0_MIWT8_2_PLR1_SU32_SUM0_SUS256_SKXCCM4_VWA8_VWB2_WGM2_WGMXCC1_WGMXCCGn1
    SolutionIndex: 72
    SolutionNameMin: Cijk_Ailk_Bljk_HHS_BH_UserArgs_MT128x128x32_MI16x16x1_SN_LDSB1_CLR1_GSU0_GSUC0_GSUWGMRR0_K1_LBSPPA1024_LBSPPB128_LPA32_MIWT4_4_PLR1_SU32_SUM0_SUS256_SKXCCM4_VWA2_VWB1_WGM1_WGMXCC1_WGMXCCGn1
    SolutionIndex: 73
    SolutionNameMin: Cijk_Ailk_Bljk_HHS_BH_UserArgs_MT128x128x32_MI16x16x1_SN_LDSB1_CLR1_GSU0_GSUC0_GSUWGMRR0_K1_LBSPPA1024_LBSPPB128_LPA0_MIWT4_4_PLR1_SU32_SUM0_SUS256_SKXCCM4_VWA4_VWB2_WGM1_WGMXCC1_WGMXCCGn1
    SolutionIndex: 74
    SolutionNameMin: Cijk_Ailk_Bljk_HHS_BH_UserArgs_MT128x128x32_MI16x16x1_SN_LDSB1_CLR1_GSU0_GSUC0_GSUWGMRR0_K1_LBSPPA1024_LBSPPB256_LPA32_MIWT4_4_PLR1_SU32_SUM0_SUS256_SKXCCM4_VWA2_VWB4_WGM1_WGMXCC1_WGMXCCGn1
    SolutionIndex: 75
    SolutionNameMin: Cijk_Ailk_Bljk_HHS_BH_UserArgs_MT128x128x32_MI16x16x1_SN_LDSB1_CLR1_GSU0_GSUC0_GSUWGMRR0_K1_LBSPPA1024_LBSPPB256_LPA0_MIWT4_4_PLR1_SU32_SUM0_SUS256_SKXCCM4_VWA4_VWB4_WGM1_WGMXCC1_WGMXCCGn1
    SolutionIndex: 76
    SolutionNameMin: Cijk_Ailk_Bljk_HHS_BH_UserArgs_MT128x128x32_MI16x16x1_SN_LDSB1_CLR1_GSU0_GSUC0_GSUWGMRR0_K1_LBSPPA1024_LBSPPB128_LPA32_MIWT4_4_PLR1_SU32_SUM0_SUS256_SKXCCM4_VWA2_VWB1_WGM2_WGMXCC1_WGMXCCGn1
    SolutionIndex: 77
    SolutionNameMin: Cijk_Ailk_Bljk_HHS_BH_UserArgs_MT128x128x32_MI16x16x1_SN_LDSB1_CLR1_GSU0_GSUC0_GSUWGMRR0_K1_LBSPPA1024_LBSPPB256_LPA0_MIWT4_4_PLR1_SU32_SUM0_SUS256_SKXCCM4_VWA4_VWB4_WGM2_WGMXCC1_WGMXCCGn1
    SolutionIndex: 78
    SolutionNameMin: Cijk_Ailk_Bljk_HHS_BH_UserArgs_MT128x128x32_MI16x16x1_SN_LDSB1_CLR1_GSU0_GSUC0_GSUWGMRR0_K1_LBSPPA1024_LBSPPB128_LPA32_MIWT4_4_PLR1_SU32_SUM0_SUS256_SKXCCM4_VWA2_VWB1_WGM4_WGMXCC1_WGMXCCGn1
    SolutionIndex: 79
    SolutionNameMin: Cijk_Ailk_Bljk_HHS_BH_UserArgs_MT128x128x32_MI16x16x1_SN_LDSB1_CLR1_GSU0_GSUC0_GSUWGMRR0_K1_LBSPPA1024_LBSPPB256_LPA32_MIWT4_4_PLR1_SU32_SUM0_SUS256_SKXCCM4_VWA2_VWB4_WGM4_WGMXCC1_WGMXCCGn1
    SolutionIndex: 80
    SolutionNameMin: Cijk_Ailk_Bljk_HHS_BH_UserArgs_MT128x64x32_MI16x16x1_SN_LDSB0_CLR0_GSU0_GSUC0_GSUWGMRR0_K1_LBSPPA1024_LBSPPB128_LPA0_MIWT4_2_PLR0_SU32_SUM0_SUS256_SKXCCM4_VWA4_VWB1_WGM1_WGMXCC1_WGMXCCGn1
    SolutionIndex: 81
    SolutionNameMin: Cijk_Ailk_Bljk_HHS_BH_UserArgs_MT128x64x32_MI16x16x1_SN_LDSB0_CLR0_GSU0_GSUC0_GSUWGMRR0_K1_LBSPPA1024_LBSPPB128_LPA0_MIWT4_2_PLR0_SU32_SUM0_SUS256_SKXCCM4_VWA4_VWB2_WGM1_WGMXCC1_WGMXCCGn1
    SolutionIndex: 82
    SolutionNameMin: Cijk_Ailk_Bljk_HHS_BH_UserArgs_MT128x64x32_MI16x16x1_SN_LDSB0_CLR0_GSU0_GSUC0_GSUWGMRR0_K1_LBSPPA1024_LBSPPB128_LPA0_MIWT4_2_PLR0_SU32_SUM0_SUS256_SKXCCM4_VWA4_VWB1_WGM4_WGMXCC1_WGMXCCGn1
    SolutionIndex: 83
    SolutionNameMin: Cijk_Ailk_Bljk_HHS_BH_UserArgs_MT32x32x32_MI16x16x1_SN_LDSB0_CLR1_GSU0_GSUC0_GSUWGMRR0_K1_LBSPPA256_LBSPPB128_LPA16_MIWT1_1_PLR1_SU32_SUM0_SUS256_SKXCCM4_VWA1_VWB1_WGM1_WGMXCC1_WGMXCCGn1
    SolutionIndex: 84
    SolutionNameMin: Cijk_Ailk_Bljk_HHS_BH_UserArgs_MT256x128x64_MI16x16x1_SN_LDSB1_CLR1_GSU0_GSUC0_GSUWGMRR0_K1_LBSPPA4096_LBSPPB128_LPA0_MIWT8_4_PLR1_SU32_SUM0_SUS256_SKXCCM4_VWA4_VWB1_WGM1_WGMXCC1_WGMXCCGn1
    SolutionIndex: 85
    SolutionNameMin: Cijk_Ailk_Bljk_HHS_BH_UserArgs_MT256x128x64_MI16x16x1_SN_LDSB1_CLR1_GSU0_GSUC0_GSUWGMRR0_K1_LBSPPA4096_LBSPPB256_LPA0_MIWT8_4_PLR1_SU32_SUM0_SUS256_SKXCCM4_VWA8_VWB2_WGM1_WGMXCC1_WGMXCCGn1
    SolutionIndex: 86
    SolutionNameMin: Cijk_Ailk_Bljk_HHS_BH_UserArgs_MT256x128x64_MI16x16x1_SN_LDSB1_CLR1_GSU0_GSUC0_GSUWGMRR0_K1_LBSPPA4096_LBSPPB512_LPA0_MIWT8_4_PLR1_SU32_SUM0_SUS256_SKXCCM4_VWA4_VWB4_WGM1_WGMXCC1_WGMXCCGn1
    SolutionIndex: 87
    SolutionNameMin: Cijk_Ailk_Bljk_HHS_BH_UserArgs_MT256x128x64_MI16x16x1_SN_LDSB1_CLR1_GSU0_GSUC0_GSUWGMRR0_K1_LBSPPA4096_LBSPPB512_LPA0_MIWT8_4_PLR1_SU32_SUM0_SUS256_SKXCCM4_VWA4_VWB4_WGM2_WGMXCC1_WGMXCCGn1
    SolutionIndex: 88
    SolutionNameMin: Cijk_Ailk_Bljk_HHS_BH_UserArgs_MT128x128x64_MI16x16x1_SN_LDSB1_CLR1_GSU0_GSUC0_GSUWGMRR0_K1_LBSPPA2048_LBSPPB128_LPA32_MIWT4_4_PLR1_SU32_SUM0_SUS256_SKXCCM4_VWA2_VWB1_WGM1_WGMXCC1_WGMXCCGn1
    SolutionIndex: 89
    SolutionNameMin: Cijk_Ailk_Bljk_HHS_BH_UserArgs_MT128x128x64_MI16x16x1_SN_LDSB1_CLR1_GSU0_GSUC0_GSUWGMRR0_K1_LBSPPA2048_LBSPPB128_LPA0_MIWT4_4_PLR1_SU32_SUM0_SUS256_SKXCCM4_VWA4_VWB1_WGM1_WGMXCC1_WGMXCCGn1
    SolutionIndex: 90
    SolutionNameMin: Cijk_Ailk_Bljk_HHS_BH_UserArgs_MT128x128x64_MI16x16x1_SN_LDSB1_CLR1_GSU0_GSUC0_GSUWGMRR0_K1_LBSPPA2048_LBSPPB256_LPA0_MIWT4_4_PLR1_SU32_SUM0_SUS256_SKXCCM4_VWA4_VWB2_WGM1_WGMXCC1_WGMXCCGn1
    SolutionIndex: 91
    SolutionNameMin: Cijk_Ailk_Bljk_HHS_BH_UserArgs_MT128x128x64_MI16x16x1_SN_LDSB1_CLR1_GSU0_GSUC0_GSUWGMRR0_K1_LBSPPA2048_LBSPPB512_LPA0_MIWT4_4_PLR1_SU32_SUM0_SUS256_SKXCCM4_VWA4_VWB4_WGM1_WGMXCC1_WGMXCCGn1
    SolutionIndex: 92
    SolutionNameMin: Cijk_Ailk_Bljk_HHS_BH_UserArgs_MT128x128x64_MI16x16x1_SN_LDSB1_CLR1_GSU0_GSUC0_GSUWGMRR0_K1_LBSPPA2048_LBSPPB128_LPA0_MIWT4_4_PLR1_SU32_SUM0_SUS256_SKXCCM4_VWA4_VWB1_WGM2_WGMXCC1_WGMXCCGn1
    SolutionIndex: 93
    SolutionNameMin: Cijk_Ailk_Bljk_HHS_BH_UserArgs_MT128x128x64_MI16x16x1_SN_LDSB1_CLR1_GSU0_GSUC0_GSUWGMRR0_K1_LBSPPA2048_LBSPPB128_LPA32_MIWT4_4_PLR1_SU32_SUM0_SUS256_SKXCCM4_VWA2_VWB1_WGM4_WGMXCC1_WGMXCCGn1
    SolutionIndex: 94
    SolutionNameMin: Cijk_Ailk_Bljk_HHS_BH_UserArgs_MT128x128x64_MI16x16x1_SN_LDSB1_CLR1_GSU0_GSUC0_GSUWGMRR0_K1_LBSPPA2048_LBSPPB256_LPA0_MIWT4_4_PLR1_SU32_SUM0_SUS256_SKXCCM4_VWA4_VWB2_WGM4_WGMXCC1_WGMXCCGn1
    SolutionIndex: 95
    SolutionNameMin: Cijk_Ailk_Bljk_HHS_BH_UserArgs_MT64x128x64_MI16x16x1_SN_LDSB1_CLR1_GSU0_GSUC0_GSUWGMRR0_K1_LBSPPA1024_LBSPPB128_LPA32_MIWT2_4_PLR1_SU32_SUM0_SUS256_SKXCCM4_VWA2_VWB1_WGM1_WGMXCC1_WGMXCCGn1
    SolutionIndex: 96
    SolutionNameMin: Cijk_Ailk_Bljk_HHS_BH_UserArgs_MT64x128x64_MI16x16x1_SN_LDSB1_CLR1_GSU0_GSUC0_GSUWGMRR0_K1_LBSPPA1024_LBSPPB256_LPA32_MIWT2_4_PLR1_SU32_SUM0_SUS256_SKXCCM4_VWA2_VWB2_WGM1_WGMXCC1_WGMXCCGn1
    SolutionIndex: 97
    SolutionNameMin: Cijk_Ailk_Bljk_HHS_BH_UserArgs_MT64x128x64_MI16x16x1_SN_LDSB1_CLR1_GSU0_GSUC0_GSUWGMRR0_K1_LBSPPA1024_LBSPPB512_LPA32_MIWT2_4_PLR1_SU32_SUM0_SUS256_SKXCCM4_VWA2_VWB4_WGM1_WGMXCC1_WGMXCCGn1
    SolutionIndex: 98
    SolutionNameMin: Cijk_Ailk_Bljk_HHS_BH_UserArgs_MT128x64x64_MI16x16x1_SN_LDSB1_CLR1_GSU0_GSUC0_GSUWGMRR0_K1_LBSPPA2048_LBSPPB128_LPA0_MIWT4_2_PLR1_SU32_SUM0_SUS256_SKXCCM4_VWA4_VWB1_WGM1_WGMXCC1_WGMXCCGn1
    SolutionIndex: 99
    SolutionNameMin: Cijk_Ailk_Bljk_HHS_BH_UserArgs_MT128x64x64_MI16x16x1_SN_LDSB1_CLR1_GSU0_GSUC0_GSUWGMRR0_K1_LBSPPA2048_LBSPPB256_LPA0_MIWT4_2_PLR1_SU32_SUM0_SUS256_SKXCCM4_VWA4_VWB2_WGM1_WGMXCC1_WGMXCCGn1
    SolutionIndex: 100
    SolutionNameMin: Cijk_Ailk_Bljk_HHS_BH_UserArgs_MT128x64x64_MI16x16x1_SN_LDSB1_CLR1_GSU0_GSUC0_GSUWGMRR0_K1_LBSPPA2048_LBSPPB128_LPA0_MIWT4_2_PLR1_SU32_SUM0_SUS256_SKXCCM4_VWA4_VWB1_WGM2_WGMXCC1_WGMXCCGn1
    SolutionIndex: 101
    SolutionNameMin: Cijk_Ailk_Bljk_HHS_BH_UserArgs_MT128x64x64_MI16x16x1_SN_LDSB1_CLR1_GSU0_GSUC0_GSUWGMRR0_K1_LBSPPA2048_LBSPPB256_LPA0_MIWT4_2_PLR1_SU32_SUM0_SUS256_SKXCCM4_VWA4_VWB2_WGM2_WGMXCC1_WGMXCCGn1
    SolutionIndex: 102
    SolutionNameMin: Cijk_Ailk_Bljk_HHS_BH_UserArgs_MT128x64x64_MI16x16x1_SN_LDSB1_CLR1_GSU0_GSUC0_GSUWGMRR0_K1_LBSPPA2048_LBSPPB128_LPA0_MIWT4_2_PLR1_SU32_SUM0_SUS256_SKXCCM4_VWA4_VWB1_WGM4_WGMXCC1_WGMXCCGn1
    SolutionIndex: 103
    SolutionNameMin: Cijk_Ailk_Bljk_HHS_BH_UserArgs_MT128x64x64_MI16x16x1_SN_LDSB1_CLR1_GSU0_GSUC0_GSUWGMRR0_K1_LBSPPA2048_LBSPPB256_LPA0_MIWT4_2_PLR1_SU32_SUM0_SUS256_SKXCCM4_VWA4_VWB2_WGM4_WGMXCC1_WGMXCCGn1
    SolutionIndex: 104
    SolutionNameMin: Cijk_Ailk_Bljk_HHS_BH_UserArgs_MT64x64x64_MI16x16x1_SN_LDSB1_CLR1_GSU0_GSUC0_GSUWGMRR0_K1_LBSPPA1024_LBSPPB128_LPA32_MIWT2_2_PLR1_SU32_SUM0_SUS256_SKXCCM4_VWA2_VWB1_WGM1_WGMXCC1_WGMXCCGn1
    SolutionIndex: 105
    SolutionNameMin: Cijk_Ailk_Bljk_HHS_BH_UserArgs_MT64x64x64_MI16x16x1_SN_LDSB1_CLR1_GSU0_GSUC0_GSUWGMRR0_K1_LBSPPA1024_LBSPPB256_LPA32_MIWT2_2_PLR1_SU32_SUM0_SUS256_SKXCCM4_VWA2_VWB2_WGM1_WGMXCC1_WGMXCCGn1
    SolutionIndex: 106
    SolutionNameMin: Cijk_Ailk_Bljk_HHS_BH_UserArgs_MT64x64x64_MI16x16x1_SN_LDSB1_CLR1_GSU0_GSUC0_GSUWGMRR0_K1_LBSPPA1024_LBSPPB256_LPA32_MIWT2_2_PLR1_SU32_SUM0_SUS256_SKXCCM4_VWA2_VWB2_WGM2_WGMXCC1_WGMXCCGn1
    SolutionIndex: 107
    SolutionNameMin: Cijk_Ailk_Bljk_HHS_BH_UserArgs_MT64x64x64_MI16x16x1_SN_LDSB1_CLR1_GSU0_GSUC0_GSUWGMRR0_K1_LBSPPA1024_LBSPPB128_LPA32_MIWT2_2_PLR1_SU32_SUM0_SUS256_SKXCCM4_VWA2_VWB1_WGM4_WGMXCC1_WGMXCCGn1
    SolutionIndex: 108
    SolutionNameMin: Cijk_Ailk_Bljk_HHS_BH_UserArgs_MT64x64x64_MI16x16x1_SN_LDSB1_CLR1_GSU0_GSUC0_GSUWGMRR0_K1_LBSPPA1024_LBSPPB256_LPA32_MIWT2_2_PLR1_SU32_SUM0_SUS256_SKXCCM4_VWA2_VWB2_WGM4_WGMXCC1_WGMXCCGn1
    SolutionIndex: 109
    SolutionNameMin: Cijk_Ailk_Bljk_HHS_BH_UserArgs_MT64x32x64_MI16x16x1_SN_LDSB0_CLR1_GSU0_GSUC0_GSUWGMRR0_K1_LBSPPA1024_LBSPPB128_LPA32_MIWT2_1_PLR1_SU32_SUM0_SUS256_SKXCCM4_VWA2_VWB1_WGM1_WGMXCC1_WGMXCCGn1
    SolutionIndex: 110
    SolutionNameMin: Cijk_Ailk_Bljk_HHS_BH_UserArgs_MT64x32x64_MI16x16x1_SN_LDSB0_CLR1_GSU0_GSUC0_GSUWGMRR0_K1_LBSPPA1024_LBSPPB128_LPA32_MIWT2_1_PLR1_SU32_SUM0_SUS256_SKXCCM4_VWA2_VWB1_WGM4_WGMXCC1_WGMXCCGn1
    SolutionIndex: 111
    SolutionNameMin: Cijk_Ailk_Bljk_HHS_BH_UserArgs_MT128x64x128_MI16x16x1_SN_LDSB1_CLR1_GSU0_GSUC0_GSUWGMRR0_K1_LBSPPA2048_LBSPPB256_LPA0_MIWT4_2_PLR2_SU32_SUM0_SUS256_SKXCCM4_VWA4_VWB1_WGM1_WGMXCC1_WGMXCCGn1
    SolutionIndex: 112
    SolutionNameMin: Cijk_Ailk_Bljk_HHS_BH_UserArgs_MT128x64x128_MI16x16x1_SN_LDSB1_CLR1_GSU0_GSUC0_GSUWGMRR0_K1_LBSPPA2048_LBSPPB512_LPA0_MIWT4_2_PLR2_SU32_SUM0_SUS256_SKXCCM4_VWA4_VWB2_WGM1_WGMXCC1_WGMXCCGn1
    SolutionIndex: 113
    SolutionNameMin: Cijk_Ailk_Bljk_HHS_BH_UserArgs_MT128x64x128_MI16x16x1_SN_LDSB1_CLR1_GSU0_GSUC0_GSUWGMRR0_K1_LBSPPA2048_LBSPPB512_LPA0_MIWT4_2_PLR2_SU32_SUM0_SUS256_SKXCCM4_VWA4_VWB2_WGM4_WGMXCC1_WGMXCCGn1
    SolutionIndex: 114
    SolutionNameMin: Cijk_Ailk_Bljk_HHS_BH_UserArgs_MT64x64x128_MI16x16x1_SN_LDSB1_CLR1_GSU0_GSUC0_GSUWGMRR0_K1_LBSPPA1024_LBSPPB512_LPA32_MIWT2_2_PLR2_SU32_SUM0_SUS256_SKXCCM4_VWA2_VWB2_WGM1_WGMXCC1_WGMXCCGn1
    SolutionIndex: 115
    SolutionNameMin: Cijk_Ailk_Bljk_HHS_BH_UserArgs_MT64x64x128_MI16x16x1_SN_LDSB1_CLR1_GSU0_GSUC0_GSUWGMRR0_K1_LBSPPA1024_LBSPPB512_LPA32_MIWT2_2_PLR2_SU32_SUM0_SUS256_SKXCCM4_VWA2_VWB2_WGM4_WGMXCC1_WGMXCCGn1
    SolutionIndex: 116
    SolutionNameMin: Cijk_Ailk_Bljk_HHS_BH_UserArgs_MT64x32x128_MI16x16x1_SN_LDSB1_CLR1_GSU0_GSUC0_GSUWGMRR0_K1_LBSPPA1024_LBSPPB256_LPA32_MIWT2_1_PLR2_SU32_SUM0_SUS256_SKXCCM4_VWA2_VWB1_WGM1_WGMXCC1_WGMXCCGn1
    SolutionIndex: 117
    SolutionNameMin: Cijk_Ailk_Bljk_HHS_BH_UserArgs_MT32x32x128_MI16x16x1_SN_LDSB1_CLR1_GSU0_GSUC0_GSUWGMRR0_K1_LBSPPA512_LBSPPB256_LPA16_MIWT1_1_PLR1_SU32_SUM0_SUS256_SKXCCM4_VWA1_VWB1_WGM1_WGMXCC1_WGMXCCGn1
    SolutionIndex: 118
    SolutionNameMin: Cijk_Ailk_Bljk_HHS_BH_UserArgs_MT32x32x128_MI16x16x1_SN_LDSB1_CLR1_GSU0_GSUC0_GSUWGMRR0_K1_LBSPPA512_LBSPPB256_LPA16_MIWT1_1_PLR2_SU32_SUM0_SUS256_SKXCCM4_VWA1_VWB1_WGM1_WGMXCC1_WGMXCCGn1
    SolutionIndex: 119
    SolutionNameMin: Cijk_Ailk_Bljk_HHS_BH_UserArgs_MT32x32x32_MI16x16x1_SN_LDSB0_CLR0_GSU0_GSUC0_GSUWGMRR0_K1_LBSPPA256_LBSPPB128_LPA16_MIWT1_1_PLR0_SU32_SUM0_SUS256_SKXCCM0_VWA1_VWB1_WGM1_WGMXCC1_WGMXCCGn1
- - - [128, 128, 1, 128, 128, 128, 128, 128]
    - [117, 0.088]
  - - [128, 128, 1, 256, 128, 128, 128, 256]
    - [42, 0.108]
  - - [128, 128, 1, 512, 128, 128, 128, 512]
    - [117, 0.181]
  - - [128, 128, 1, 1024, 128, 128, 128, 1024]
    - [117, 0.298]
  - - [128, 128, 1, 2048, 128, 128, 128, 2048]
    - [42, 0.554]
  - - [128, 128, 1, 4096, 128, 128, 128, 4096]
    - [35, 0.922]
  - - [128, 128, 1, 8192, 128, 128, 128, 8192]
    - [117, 1.487]
  - - [128, 256, 1, 128, 128, 128, 128, 128]
    - [42, 0.173]
  - - [128, 256, 1, 256, 128, 128, 128, 256]
    - [117, 0.211]
  - - [128, 256, 1, 512, 128, 128, 128, 512]
    - [117, 0.383]
  - - [128, 256, 1, 1024, 128, 128, 128, 1024]
    - [43, 0.607]
  - - [128, 256, 1, 2048, 128, 128, 128, 2048]
    - [83, 1.059]
  - - [128, 256, 1, 4096, 128, 128, 128, 4096]
    - [41, 1.629]
  - - [128, 256, 1, 8192, 128, 128, 128, 8192]
    - [116, 2.641]
  - - [128, 512, 1, 128, 128, 128, 128, 128]
    - [43, 0.343]
  - - [128, 512, 1, 256, 128, 128, 128, 256]
    - [117, 0.421]
  - - [128, 512, 1, 512, 128, 128, 128, 512]
    - [117, 0.678]
  - - [128, 512, 1, 1024, 128, 128, 128, 1024]
    - [43, 1.223]
  - - [128, 512, 1, 2048, 128, 128, 128, 2048]
    - [118, 1.885]
  - - [128, 512, 1, 4096, 128, 128, 128, 4096]
    - [109, 2.887]
  - - [128, 512, 1, 8192, 128, 128, 128, 8192]
    - [114, 4.308]
  - - [128, 1024, 1, 128, 128, 128, 128, 128]
    - [116, 0.653]
  - - [128, 1024, 1, 256, 128, 128, 128, 256]
    - [117, 1.054]
  - - [128, 1024, 1, 512, 128, 128, 128, 512]
    - [42, 1.634]
  - - [128, 1024, 1, 1024, 128, 128, 128, 1024]
    - [43, 2.32]
  - - [128, 1024, 1, 2048, 128, 128, 128, 2048]
    - [116, 3.299]
  - - [128, 1024, 1, 4096, 128, 128, 128, 4096]
    - [104, 4.807]
  - - [128, 1024, 1, 8192, 128, 128, 128, 8192]
    - [111, 6.918]
  - - [128, 2048, 1, 128, 128, 128, 128, 128]
    - [40, 1.186]
  - - [128, 2048, 1, 256, 128, 128, 128, 256]
    - [34, 1.894]
  - - [128, 2048, 1, 512, 128, 128, 128, 512]
    - [116, 2.886]
  - - [128, 2048, 1, 1024, 128, 128, 128, 1024]
    - [116, 4.027]
  - - [128, 2048, 1, 2048, 128, 128, 128, 2048]
    - [80, 4.606]
  - - [128, 2048, 1, 4096, 128, 128, 128, 4096]
    - [99, 7.159]
  - - [128, 2048, 1, 8192, 128, 128, 128, 8192]
    - [89, 10.043]
  - - [128, 4096, 1, 128, 128, 128, 128, 128]
    - [105, 2.028]
  - - [128, 4096, 1, 256, 128, 128, 128, 256]
    - [105, 3.326]
  - - [128, 4096, 1, 512, 128, 128, 128, 512]
    - [105, 4.985]
  - - [128, 4096, 1, 1024, 128, 128, 128, 1024]
    - [99, 5.662]
  - - [128, 4096, 1, 2048, 128, 128, 128, 2048]
    - [108, 6.266]
  - - [128, 4096, 1, 4096, 128, 128, 128, 4096]
    - [18, 8.095]
  - - [128, 4096, 1, 8192, 128, 128, 128, 8192]
    - [21, 11.457]
  - - [128, 8192, 1, 128, 128, 128, 128, 128]
    - [95, 3.244]
  - - [128, 8192, 1, 256, 128, 128, 128, 256]
    - [97, 5.159]
  - - [128, 8192, 1, 512, 128, 128, 128, 512]
    - [95, 7.187]
  - - [128, 8192, 1, 1024, 128, 128, 128, 1024]
    - [112, 7.562]
  - - [128, 8192, 1, 2048, 128, 128, 128, 2048]
    - [98, 8.615]
  - - [128, 8192, 1, 4096, 128, 128, 128, 4096]
    - [29, 10.41]
  - - [128, 8192, 1, 8192, 128, 128, 128, 8192]
    - [31, 11.428]
  - - [256, 128, 1, 128, 256, 256, 256, 128]
    - [42, 0.172]
  - - [256, 128, 1, 256, 256, 256, 256, 256]
    - [118, 0.211]
  - - [256, 128, 1, 512, 256, 256, 256, 512]
    - [117, 0.385]
  - - [256, 128, 1, 1024, 256, 256, 256, 1024]
    - [42, 0.623]
  - - [256, 128, 1, 2048, 256, 256, 256, 2048]
    - [83, 1.065]
  - - [256, 128, 1, 4096, 256, 256, 256, 4096]
    - [116, 1.625]
  - - [256, 128, 1, 8192, 256, 256, 256, 8192]
    - [41, 2.535]
  - - [256, 256, 1, 128, 256, 256, 256, 128]
    - [117, 0.34]
  - - [256, 256, 1, 256, 256, 256, 256, 256]
    - [117, 0.421]
  - - [256, 256, 1, 512, 256, 256, 256, 512]
    - [116, 0.681]
  - - [256, 256, 1, 1024, 256, 256, 256, 1024]
    - [43, 1.218]
  - - [256, 256, 1, 2048, 256, 256, 256, 2048]
    - [118, 1.885]
  - - [256, 256, 1, 4096, 256, 256, 256, 4096]
    - [109, 2.9]
  - - [256, 256, 1, 8192, 256, 256, 256, 8192]
    - [40, 4.096]
  - - [256, 512, 1, 128, 256, 256, 256, 128]
    - [41, 0.653]
  - - [256, 512, 1, 256, 256, 256, 256, 256]
    - [43, 1.052]
  - - [256, 512, 1, 512, 256, 256, 256, 512]
    - [117, 1.626]
  - - [256, 512, 1, 1024, 256, 256, 256, 1024]
    - [43, 2.326]
  - - [256, 512, 1, 2048, 256, 256, 256, 2048]
    - [116, 3.273]
  - - [256, 512, 1, 4096, 256, 256, 256, 4096]
    - [104, 4.807]
  - - [256, 512, 1, 8192, 256, 256, 256, 8192]
    - [30, 6.7]
  - - [256, 1024, 1, 128, 256, 256, 256, 128]
    - [39, 1.187]
  - - [256, 1024, 1, 256, 256, 256, 256, 256]
    - [41, 1.908]
  - - [256, 1024, 1, 512, 256, 256, 256, 512]
    - [116, 2.891]
  - - [256, 1024, 1, 1024, 256, 256, 256, 1024]
    - [116, 4.028]
  - - [256, 1024, 1, 2048, 256, 256, 256, 2048]
    - [81, 4.645]
  - - [256, 1024, 1, 4096, 256, 256, 256, 4096]
    - [98, 7.198]
  - - [256, 1024, 1, 8192, 256, 256, 256, 8192]
    - [25, 10.002]
  - - [256, 2048, 1, 128, 256, 256, 256, 128]
    - [105, 2.031]
  - - [256, 2048, 1, 256, 256, 256, 256, 256]
    - [105, 3.367]
  - - [256, 2048, 1, 512, 256, 256, 256, 512]
    - [105, 4.972]
  - - [256, 2048, 1, 1024, 256, 256, 256, 1024]
    - [99, 5.659]
  - - [256, 2048, 1, 2048, 256, 256, 256, 2048]
    - [104, 6.561]
  - - [256, 2048, 1, 4096, 256, 256, 256, 4096]
    - [54, 8.269]
  - - [256, 2048, 1, 8192, 256, 256, 256, 8192]
    - [84, 11.703]
  - - [256, 4096, 1, 128, 256, 256, 256, 128]
    - [95, 3.249]
  - - [256, 4096, 1, 256, 256, 256, 256, 256]
    - [81, 5.12]
  - - [256, 4096, 1, 512, 256, 256, 256, 512]
    - [99, 7.15]
  - - [256, 4096, 1, 1024, 256, 256, 256, 1024]
    - [112, 7.693]
  - - [256, 4096, 1, 2048, 256, 256, 256, 2048]
    - [98, 8.746]
  - - [256, 4096, 1, 4096, 256, 256, 256, 4096]
    - [7, 11.29]
  - - [256, 4096, 1, 8192, 256, 256, 256, 8192]
    - [22, 11.706]
  - - [256, 8192, 1, 128, 256, 256, 256, 128]
    - [74, 4.617]
  - - [256, 8192, 1, 256, 256, 256, 256, 256]
    - [72, 6.732]
  - - [256, 8192, 1, 512, 256, 256, 256, 512]
    - [88, 8.383]
  - - [256, 8192, 1, 1024, 256, 256, 256, 1024]
    - [98, 9.497]
  - - [256, 8192, 1, 2048, 256, 256, 256, 2048]
    - [98, 10.692]
  - - [256, 8192, 1, 4096, 256, 256, 256, 4096]
    - [55, 11.841]
  - - [256, 8192, 1, 8192, 256, 256, 256, 8192]
    - [65, 14.289]
  - - [512, 128, 1, 128, 512, 512, 512, 128]
    - [43, 0.337]
  - - [512, 128, 1, 256, 512, 512, 512, 256]
    - [117, 0.425]
  - - [512, 128, 1, 512, 512, 512, 512, 512]
    - [116, 0.676]
  - - [512, 128, 1, 1024, 512, 512, 512, 1024]
    - [42, 1.204]
  - - [512, 128, 1, 2048, 512, 512, 512, 2048]
    - [118, 1.87]
  - - [512, 128, 1, 4096, 512, 512, 512, 4096]
    - [110, 2.778]
  - - [512, 128, 1, 8192, 512, 512, 512, 8192]
    - [115, 4.052]
  - - [512, 256, 1, 128, 512, 512, 512, 128]
    - [116, 0.648]
  - - [512, 256, 1, 256, 512, 512, 512, 256]
    - [43, 1.038]
  - - [512, 256, 1, 512, 512, 512, 512, 512]
    - [42, 1.614]
  - - [512, 256, 1, 1024, 512, 512, 512, 1024]
    - [43, 2.307]
  - - [512, 256, 1, 2048, 512, 512, 512, 2048]
    - [116, 3.276]
  - - [512, 256, 1, 4096, 512, 512, 512, 4096]
    - [108, 4.705]
  - - [512, 256, 1, 8192, 512, 512, 512, 8192]
    - [101, 6.689]
  - - [512, 512, 1, 128, 512, 512, 512, 128]
    - [40, 1.195]
  - - [512, 512, 1, 256, 512, 512, 512, 256]
    - [109, 1.899]
  - - [512, 512, 1, 512, 512, 512, 512, 512]
    - [41, 2.888]
  - - [512, 512, 1, 1024, 512, 512, 512, 1024]
    - [41, 4.053]
  - - [512, 512, 1, 2048, 512, 512, 512, 2048]
    - [81, 4.648]
  - - [512, 512, 1, 4096, 512, 512, 512, 4096]
    - [99, 7.148]
  - - [512, 512, 1, 8192, 512, 512, 512, 8192]
    - [26, 9.966]
  - - [512, 1024, 1, 128, 512, 512, 512, 128]
    - [104, 2.012]
  - - [512, 1024, 1, 256, 512, 512, 512, 256]
    - [104, 3.337]
  - - [512, 1024, 1, 512, 512, 512, 512, 512]
    - [105, 4.96]
  - - [512, 1024, 1, 1024, 512, 512, 512, 1024]
    - [98, 5.669]
  - - [512, 1024, 1, 2048, 512, 512, 512, 2048]
    - [104, 6.567]
  - - [512, 1024, 1, 4096, 512, 512, 512, 4096]
    - [54, 8.257]
  - - [512, 1024, 1, 8192, 512, 512, 512, 8192]
    - [86, 11.735]
  - - [512, 2048, 1, 128, 512, 512, 512, 128]
    - [95, 3.237]
  - - [512, 2048, 1, 256, 512, 512, 512, 256]
    - [96, 5.161]
  - - [512, 2048, 1, 512, 512, 512, 512, 512]
    - [95, 7.159]
  - - [512, 2048, 1, 1024, 512, 512, 512, 1024]
    - [112, 7.771]
  - - [512, 2048, 1, 2048, 512, 512, 512, 2048]
    - [99, 8.832]
  - - [512, 2048, 1, 4096, 512, 512, 512, 4096]
    - [5, 11.113]
  - - [512, 2048, 1, 8192, 512, 512, 512, 8192]
    - [23, 11.598]
  - - [512, 4096, 1, 128, 512, 512, 512, 128]
    - [74, 4.637]
  - - [512, 4096, 1, 256, 512, 512, 512, 256]
    - [78, 6.719]
  - - [512, 4096, 1, 512, 512, 512, 512, 512]
    - [91, 8.422]
  - - [512, 4096, 1, 1024, 512, 512, 512, 1024]
    - [98, 9.57]
  - - [512, 4096, 1, 2048, 512, 512, 512, 2048]
    - [98, 10.742]
  - - [512, 4096, 1, 4096, 512, 512, 512, 4096]
    - [7, 11.644]
  - - [512, 4096, 1, 8192, 512, 512, 512, 8192]
    - [11, 14.012]
  - - [512, 8192, 1, 128, 512, 512, 512, 128]
    - [58, 6.365]
  - - [512, 8192, 1, 256, 512, 512, 512, 256]
    - [14, 8.979]
  - - [512, 8192, 1, 512, 512, 512, 512, 512]
    - [70, 10.162]
  - - [512, 8192, 1, 1024, 512, 512, 512, 1024]
    - [77, 11.703]
  - - [512, 8192, 1, 2048, 512, 512, 512, 2048]
    - [90, 12.822]
  - - [512, 8192, 1, 4096, 512, 512, 512, 4096]
    - [13, 14.144]
  - - [512, 8192, 1, 8192, 512, 512, 512, 8192]
    - [3, 15.786]
  - - [1024, 128, 1, 128, 1024, 1024, 1024, 128]
    - [116, 0.65]
  - - [1024, 128, 1, 256, 1024, 1024, 1024, 256]
    - [42, 1.044]
  - - [1024, 128, 1, 512, 1024, 1024, 1024, 512]
    - [43, 1.619]
  - - [1024, 128, 1, 1024, 1024, 1024, 1024, 1024]
    - [43, 2.301]
  - - [1024, 128, 1, 2048, 1024, 1024, 1024, 2048]
    - [41, 3.211]
  - - [1024, 128, 1, 4096, 1024, 1024, 1024, 4096]
    - [106, 4.622]
  - - [1024, 128, 1, 8192, 1024, 1024, 1024, 8192]
    - [30, 6.693]
  - - [1024, 256, 1, 128, 1024, 1024, 1024, 128]
    - [39, 1.169]
  - - [1024, 256, 1, 256, 1024, 1024, 1024, 256]
    - [109, 1.894]
  - - [1024, 256, 1, 512, 1024, 1024, 1024, 512]
    - [109, 2.882]
  - - [1024, 256, 1, 1024, 1024, 1024, 1024, 1024]
    - [41, 4.013]
  - - [1024, 256, 1, 2048, 1024, 1024, 1024, 2048]
    - [82, 4.891]
  - - [1024, 256, 1, 4096, 1024, 1024, 1024, 4096]
    - [29, 7.072]
  - - [1024, 256, 1, 8192, 1024, 1024, 1024, 8192]
    - [26, 9.928]
  - - [1024, 512, 1, 128, 1024, 1024, 1024, 128]
    - [105, 2.021]
  - - [1024, 512, 1, 256, 1024, 1024, 1024, 256]
    - [104, 3.352]
  - - [1024, 512, 1, 512, 1024, 1024, 1024, 512]
    - [104, 4.925]
  - - [1024, 512, 1, 1024, 1024, 1024, 1024, 1024]
    - [99, 5.651]
  - - [1024, 512, 1, 2048, 1024, 1024, 1024, 2048]
    - [33, 6.363]
  - - [1024, 512, 1, 4096, 1024, 1024, 1024, 4096]
    - [22, 8.225]
  - - [1024, 512, 1, 8192, 1024, 1024, 1024, 8192]
    - [22, 11.675]
  - - [1024, 1024, 1, 128, 1024, 1024, 1024, 128]
    - [97, 3.21]
  - - [1024, 1024, 1, 256, 1024, 1024, 1024, 256]
    - [28, 5.131]
  - - [1024, 1024, 1, 512, 1024, 1024, 1024, 512]
    - [27, 7.167]
  - - [1024, 1024, 1, 1024, 1024, 1024, 1024, 1024]
    - [112, 7.772]
  - - [1024, 1024, 1, 2048, 1024, 1024, 1024, 2048]
    - [98, 8.691]
  - - [1024, 1024, 1, 4096, 1024, 1024, 1024, 4096]
    - [5, 11.012]
  - - [1024, 1024, 1, 8192, 1024, 1024, 1024, 8192]
    - [22, 11.642]
  - - [1024, 2048, 1, 128, 1024, 1024, 1024, 128]
    - [74, 4.653]
  - - [1024, 2048, 1, 256, 1024, 1024, 1024, 256]
    - [20, 6.758]
  - - [1024, 2048, 1, 512, 1024, 1024, 1024, 512]
    - [91, 8.472]
  - - [1024, 2048, 1, 1024, 1024, 1024, 1024, 1024]
    - [98, 9.66]
  - - [1024, 2048, 1, 2048, 1024, 1024, 1024, 2048]
    - [99, 10.641]
  - - [1024, 2048, 1, 4096, 1024, 1024, 1024, 4096]
    - [67, 11.635]
  - - [1024, 2048, 1, 8192, 1024, 1024, 1024, 8192]
    - [54, 13.866]
  - - [1024, 4096, 1, 128, 1024, 1024, 1024, 128]
    - [58, 6.431]
  - - [1024, 4096, 1, 256, 1024, 1024, 1024, 256]
    - [58, 9.023]
  - - [1024, 4096, 1, 512, 1024, 1024, 1024, 512]
    - [69, 10.181]
  - - [1024, 4096, 1, 1024, 1024, 1024, 1024, 1024]
    - [75, 11.8]
  - - [1024, 4096, 1, 2048, 1024, 1024, 1024, 2048]
    - [91, 12.708]
  - - [1024, 4096, 1, 4096, 1024, 1024, 1024, 4096]
    - [61, 14.026]
  - - [1024, 4096, 1, 8192, 1024, 1024, 1024, 8192]
    - [54, 15.736]
  - - [1024, 8192, 1, 128, 1024, 1024, 1024, 128]
    - [8, 6.99]
  - - [1024, 8192, 1, 256, 1024, 1024, 1024, 256]
    - [68, 9.791]
  - - [1024, 8192, 1, 512, 1024, 1024, 1024, 512]
    - [64, 12.494]
  - - [1024, 8192, 1, 1024, 1024, 1024, 1024, 1024]
    - [12, 14.297]
  - - [1024, 8192, 1, 2048, 1024, 1024, 1024, 2048]
    - [86, 14.311]
  - - [1024, 8192, 1, 4096, 1024, 1024, 1024, 4096]
    - [61, 15.751]
  - - [1024, 8192, 1, 8192, 1024, 1024, 1024, 8192]
    - [54, 17.292]
  - - [2048, 128, 1, 128, 2048, 2048, 2048, 128]
    - [38, 1.173]
  - - [2048, 128, 1, 256, 2048, 2048, 2048, 256]
    - [34, 1.891]
  - - [2048, 128, 1, 512, 2048, 2048, 2048, 512]
    - [41, 2.894]
  - - [2048, 128, 1, 1024, 2048, 2048, 2048, 1024]
    - [41, 3.986]
  - - [2048, 128, 1, 2048, 2048, 2048, 2048, 2048]
    - [82, 4.788]
  - - [2048, 128, 1, 4096, 2048, 2048, 2048, 4096]
    - [30, 7.025]
  - - [2048, 128, 1, 8192, 2048, 2048, 2048, 8192]
    - [26, 9.982]
  - - [2048, 256, 1, 128, 2048, 2048, 2048, 128]
    - [105, 2.03]
  - - [2048, 256, 1, 256, 2048, 2048, 2048, 256]
    - [104, 3.333]
  - - [2048, 256, 1, 512, 2048, 2048, 2048, 512]
    - [32, 4.949]
  - - [2048, 256, 1, 1024, 2048, 2048, 2048, 1024]
    - [101, 5.609]
  - - [2048, 256, 1, 2048, 2048, 2048, 2048, 2048]
    - [33, 6.332]
  - - [2048, 256, 1, 4096, 2048, 2048, 2048, 4096]
    - [54, 8.197]
  - - [2048, 256, 1, 8192, 2048, 2048, 2048, 8192]
    - [24, 11.602]
  - - [2048, 512, 1, 128, 2048, 2048, 2048, 128]
    - [95, 3.234]
  - - [2048, 512, 1, 256, 2048, 2048, 2048, 256]
    - [28, 5.119]
  - - [2048, 512, 1, 512, 2048, 2048, 2048, 512]
    - [28, 7.164]
  - - [2048, 512, 1, 1024, 2048, 2048, 2048, 1024]
    - [36, 7.658]
  - - [2048, 512, 1, 2048, 2048, 2048, 2048, 2048]
    - [102, 8.62]
  - - [2048, 512, 1, 4096, 2048, 2048, 2048, 4096]
    - [7, 11.033]
  - - [2048, 512, 1, 8192, 2048, 2048, 2048, 8192]
    - [22, 11.547]
  - - [2048, 1024, 1, 128, 2048, 2048, 2048, 128]
    - [74, 4.654]
  - - [2048, 1024, 1, 256, 2048, 2048, 2048, 256]
    - [71, 6.757]
  - - [2048, 1024, 1, 512, 2048, 2048, 2048, 512]
    - [90, 8.407]
  - - [2048, 1024, 1, 1024, 2048, 2048, 2048, 1024]
    - [29, 9.582]
  - - [2048, 1024, 1, 2048, 2048, 2048, 2048, 2048]
    - [29, 10.593]
  - - [2048, 1024, 1, 4096, 2048, 2048, 2048, 4096]
    - [55, 11.624]
  - - [2048, 1024, 1, 8192, 2048, 2048, 2048, 8192]
    - [55, 13.777]
  - - [2048, 2048, 1, 128, 2048, 2048, 2048, 128]
    - [6, 6.482]
  - - [2048, 2048, 1, 256, 2048, 2048, 2048, 256]
    - [6, 8.986]
  - - [2048, 2048, 1, 512, 2048, 2048, 2048, 512]
    - [16, 10.225]
  - - [2048, 2048, 1, 1024, 2048, 2048, 2048, 1024]
    - [16, 11.609]
  - - [2048, 2048, 1, 2048, 2048, 2048, 2048, 2048]
    - [89, 12.766]
  - - [2048, 2048, 1, 4096, 2048, 2048, 2048, 4096]
    - [57, 14.012]
  - - [2048, 2048, 1, 8192, 2048, 2048, 2048, 8192]
    - [13, 15.682]
  - - [2048, 4096, 1, 128, 2048, 2048, 2048, 128]
    - [6, 7.029]
  - - [2048, 4096, 1, 256, 2048, 2048, 2048, 256]
    - [58, 9.941]
  - - [2048, 4096, 1, 512, 2048, 2048, 2048, 512]
    - [58, 12.49]
  - - [2048, 4096, 1, 1024, 2048, 2048, 2048, 1024]
    - [54, 14.239]
  - - [2048, 4096, 1, 2048, 2048, 2048, 2048, 2048]
    - [86, 14.135]
  - - [2048, 4096, 1, 4096, 2048, 2048, 2048, 4096]
    - [9, 15.921]
  - - [2048, 4096, 1, 8192, 2048, 2048, 2048, 8192]
    - [54, 17.28]
  - - [2048, 8192, 1, 128, 2048, 2048, 2048, 128]
    - [53, 6.526]
  - - [2048, 8192, 1, 256, 2048, 2048, 2048, 256]
    - [47, 9.617]
  - - [2048, 8192, 1, 512, 2048, 2048, 2048, 512]
    - [49, 12.596]
  - - [2048, 8192, 1, 1024, 2048, 2048, 2048, 1024]
    - [49, 14.726]
  - - [2048, 8192, 1, 2048, 2048, 2048, 2048, 2048]
    - [55, 15.483]
  - - [2048, 8192, 1, 4096, 2048, 2048, 2048, 4096]
    - [44, 17.225]
  - - [2048, 8192, 1, 8192, 2048, 2048, 2048, 8192]
    - [52, 18.386]
  - - [4096, 128, 1, 128, 4096, 4096, 4096, 128]
    - [104, 2.059]
  - - [4096, 128, 1, 256, 4096, 4096, 4096, 256]
    - [104, 3.393]
  - - [4096, 128, 1, 512, 4096, 4096, 4096, 512]
    - [105, 4.972]
  - - [4096, 128, 1, 1024, 4096, 4096, 4096, 1024]
    - [98, 5.631]
  - - [4096, 128, 1, 2048, 4096, 4096, 4096, 2048]
    - [107, 6.196]
  - - [4096, 128, 1, 4096, 4096, 4096, 4096, 4096]
    - [19, 8.265]
  - - [4096, 128, 1, 8192, 4096, 4096, 4096, 8192]
    - [23, 11.604]
  - - [4096, 256, 1, 128, 4096, 4096, 4096, 128]
    - [95, 3.251]
  - - [4096, 256, 1, 256, 4096, 4096, 4096, 256]
    - [95, 5.182]
  - - [4096, 256, 1, 512, 4096, 4096, 4096, 512]
    - [95, 7.163]
  - - [4096, 256, 1, 1024, 4096, 4096, 4096, 1024]
    - [113, 7.615]
  - - [4096, 256, 1, 2048, 4096, 4096, 4096, 2048]
    - [103, 8.668]
  - - [4096, 256, 1, 4096, 4096, 4096, 4096, 4096]
    - [7, 11.187]
  - - [4096, 256, 1, 8192, 4096, 4096, 4096, 8192]
    - [22, 11.696]
  - - [4096, 512, 1, 128, 4096, 4096, 4096, 128]
    - [74, 4.647]
  - - [4096, 512, 1, 256, 4096, 4096, 4096, 256]
    - [76, 6.708]
  - - [4096, 512, 1, 512, 4096, 4096, 4096, 512]
    - [94, 8.233]
  - - [4096, 512, 1, 1024, 4096, 4096, 4096, 1024]
    - [29, 9.452]
  - - [4096, 512, 1, 2048, 4096, 4096, 4096, 2048]
    - [29, 10.614]
  - - [4096, 512, 1, 4096, 4096, 4096, 4096, 4096]
    - [55, 11.839]
  - - [4096, 512, 1, 8192, 4096, 4096, 4096, 8192]
    - [9, 13.886]
  - - [4096, 1024, 1, 128, 4096, 4096, 4096, 128]
    - [6, 6.476]
  - - [4096, 1024, 1, 256, 4096, 4096, 4096, 256]
    - [4, 8.986]
  - - [4096, 1024, 1, 512, 4096, 4096, 4096, 512]
    - [16, 10.237]
  - - [4096, 1024, 1, 1024, 4096, 4096, 4096, 1024]
    - [69, 11.471]
  - - [4096, 1024, 1, 2048, 4096, 4096, 4096, 2048]
    - [92, 12.741]
  - - [4096, 1024, 1, 4096, 4096, 4096, 4096, 4096]
    - [54, 14.049]
  - - [4096, 1024, 1, 8192, 4096, 4096, 4096, 8192]
    - [54, 15.822]
  - - [4096, 2048, 1, 128, 4096, 4096, 4096, 128]
    - [4, 7.044]
  - - [4096, 2048, 1, 256, 4096, 4096, 4096, 256]
    - [6, 9.88]
  - - [4096, 2048, 1, 512, 4096, 4096, 4096, 512]
    - [4, 12.492]
  - - [4096, 2048, 1, 1024, 4096, 4096, 4096, 1024]
    - [65, 14.087]
  - - [4096, 2048, 1, 2048, 4096, 4096, 4096, 2048]
    - [55, 14.222]
  - - [4096, 2048, 1, 4096, 4096, 4096, 4096, 4096]
    - [55, 15.724]
  - - [4096, 2048, 1, 8192, 4096, 4096, 4096, 8192]
    - [59, 17.131]
  - - [4096, 4096, 1, 128, 4096, 4096, 4096, 128]
    - [47, 6.645]
  - - [4096, 4096, 1, 256, 4096, 4096, 4096, 256]
    - [49, 9.52]
  - - [4096, 4096, 1, 512, 4096, 4096, 4096, 512]
    - [49, 12.459]
  - - [4096, 4096, 1, 1024, 4096, 4096, 4096, 1024]
    - [45, 14.649]
  - - [4096, 4096, 1, 2048, 4096, 4096, 4096, 2048]
    - [57, 15.424]
  - - [4096, 4096, 1, 4096, 4096, 4096, 4096, 4096]
    - [48, 17.352]
  - - [4096, 4096, 1, 8192, 4096, 4096, 4096, 8192]
    - [48, 18.603]
  - - [4096, 8192, 1, 128, 4096, 4096, 4096, 128]
    - [56, 6.89]
  - - [4096, 8192, 1, 256, 4096, 4096, 4096, 256]
    - [55, 9.139]
  - - [4096, 8192, 1, 512, 4096, 4096, 4096, 512]
    - [65, 12.264]
  - - [4096, 8192, 1, 1024, 4096, 4096, 4096, 1024]
    - [54, 14.958]
  - - [4096, 8192, 1, 2048, 4096, 4096, 4096, 2048]
    - [67, 17.013]
  - - [4096, 8192, 1, 4096, 4096, 4096, 4096, 4096]
    - [44, 18.271]
  - - [4096, 8192, 1, 8192, 4096, 4096, 4096, 8192]
    - [48, 18.881]
  - - [8192, 128, 1, 128, 8192, 8192, 8192, 128]
    - [28, 3.251]
  - - [8192, 128, 1, 256, 8192, 8192, 8192, 256]
    - [95, 4.891]
  - - [8192, 128, 1, 512, 8192, 8192, 8192, 512]
    - [95, 6.75]
  - - [8192, 128, 1, 1024, 8192, 8192, 8192, 1024]
    - [37, 7.266]
  - - [8192, 128, 1, 2048, 8192, 8192, 8192, 2048]
    - [100, 8.606]
  - - [8192, 128, 1, 4096, 8192, 8192, 8192, 4096]
    - [13, 11.184]
  - - [8192, 128, 1, 8192, 8192, 8192, 8192, 8192]
    - [22, 11.599]
  - - [8192, 256, 1, 128, 8192, 8192, 8192, 128]
    - [79, 4.528]
  - - [8192, 256, 1, 256, 8192, 8192, 8192, 256]
    - [78, 6.738]
  - - [8192, 256, 1, 512, 8192, 8192, 8192, 512]
    - [93, 8.216]
  - - [8192, 256, 1, 1024, 8192, 8192, 8192, 1024]
    - [29, 9.377]
  - - [8192, 256, 1, 2048, 8192, 8192, 8192, 2048]
    - [103, 10.54]
  - - [8192, 256, 1, 4096, 8192, 8192, 8192, 4096]
    - [73, 11.702]
  - - [8192, 256, 1, 8192, 8192, 8192, 8192, 8192]
    - [63, 13.887]
  - - [8192, 512, 1, 128, 8192, 8192, 8192, 128]
    - [10, 6.323]
  - - [8192, 512, 1, 256, 8192, 8192, 8192, 256]
    - [10, 8.937]
  - - [8192, 512, 1, 512, 8192, 8192, 8192, 512]
    - [15, 10.073]
  - - [8192, 512, 1, 1024, 8192, 8192, 8192, 1024]
    - [17, 11.468]
  - - [8192, 512, 1, 2048, 8192, 8192, 8192, 2048]
    - [25, 12.801]
  - - [8192, 512, 1, 4096, 8192, 8192, 8192, 4096]
    - [54, 13.951]
  - - [8192, 512, 1, 8192, 8192, 8192, 8192, 8192]
    - [3, 15.732]
  - - [8192, 1024, 1, 128, 8192, 8192, 8192, 128]
    - [4, 6.972]
  - - [8192, 1024, 1, 256, 8192, 8192, 8192, 256]
    - [10, 9.675]
  - - [8192, 1024, 1, 512, 8192, 8192, 8192, 512]
    - [62, 12.262]
  - - [8192, 1024, 1, 1024, 8192, 8192, 8192, 1024]
    - [65, 14.059]
  - - [8192, 1024, 1, 2048, 8192, 8192, 8192, 2048]
    - [87, 14.112]
  - - [8192, 1024, 1, 4096, 8192, 8192, 8192, 4096]
    - [54, 15.899]
  - - [8192, 1024, 1, 8192, 8192, 8192, 8192, 8192]
    - [57, 17.272]
  - - [8192, 2048, 1, 128, 8192, 8192, 8192, 128]
    - [2, 6.54]
  - - [8192, 2048, 1, 256, 8192, 8192, 8192, 256]
    - [49, 9.545]
  - - [8192, 2048, 1, 512, 8192, 8192, 8192, 512]
    - [49, 12.488]
  - - [8192, 2048, 1, 1024, 8192, 8192, 8192, 1024]
    - [0, 14.68]
  - - [8192, 2048, 1, 2048, 8192, 8192, 8192, 2048]
    - [57, 15.564]
  - - [8192, 2048, 1, 4096, 8192, 8192, 8192, 4096]
    - [46, 17.29]
  - - [8192, 2048, 1, 8192, 8192, 8192, 8192, 8192]
    - [48, 18.557]
  - - [8192, 4096, 1, 128, 8192, 8192, 8192, 128]
    - [60, 6.822]
  - - [8192, 4096, 1, 256, 8192, 8192, 8192, 256]
    - [65, 9.128]
  - - [8192, 4096, 1, 512, 8192, 8192, 8192, 512]
    - [65, 12.198]
  - - [8192, 4096, 1, 1024, 8192, 8192, 8192, 1024]
    - [66, 14.962]
  - - [8192, 4096, 1, 2048, 8192, 8192, 8192, 2048]
    - [67, 16.936]
  - - [8192, 4096, 1, 4096, 8192, 8192, 8192, 4096]
    - [48, 18.337]
  - - [8192, 4096, 1, 8192, 8192, 8192, 8192, 8192]
    - [48, 18.93]
  - - [8192, 8192, 1, 128, 8192, 8192, 8192, 128]
    - [85, 6.462]
  - - [8192, 8192, 1, 256, 8192, 8192, 8192, 256]
    - [4, 9.252]
  - - [8192, 8192, 1, 512, 8192, 8192, 8192, 512]
    - [65, 12.634]
  - - [8192, 8192, 1, 1024, 8192, 8192, 8192, 1024]
    - [65, 15.48]
  - - [8192, 8192, 1, 2048, 8192, 8192, 8192, 2048]
    - [51, 17.713]
  - - [8192, 8192, 1, 4096, 8192, 8192, 8192, 4096]
    - [50, 19.103]
  - - [8192, 8192, 1, 8192, 8192, 8192, 8192, 8192]
    - [1, 19.352]
  - - [1, 1, 1, 32, 1, 1, 1, 32]
    - [119, 0.0]
- null
- null
- DeviceEfficiency
- GridBased
