library/src/amd_detail/rocblaslt/src/Tensile/Logic/streamk/aquavanjaram/aquavanjaram942_Cijk_Ailk_Bjlk_HHS_BH_UserArgs.yaml
- {MinimumRequiredVersion: 4.33.0}
- aquavanjaram942
- gfx942
- [Device 0049, Device 0050]
    SolutionIndex: 0
    SolutionNameMin: Cijk_Ailk_Bjlk_HHS_BH_UserArgs_MT128x128x64_MI16x16x1_SN_LDSB0_CLR1_GSU0_GSUC0_GSUWGMRR0_K1_LBSPPA1024_LBSPPB1024_MIWT4_4_NLCA1_NLCB2_PLR1_SU32_SUM0_SUS256_SPO1_SVW4_SKXCCM0_VWA4_VWB4_WSGRA1_WSGRB1_WGM1_WGMXCC1_WGMXCCGn1
    SolutionIndex: 1
    SolutionNameMin: Cijk_Ailk_Bjlk_HHS_BH_UserArgs_MT128x64x64_MI16x16x1_SN_LDSB0_CLR1_GSU0_GSUC0_GSUWGMRR0_K1_LBSPPA1024_LBSPPB512_MIWT4_2_NLCA1_NLCB1_PLR2_SU32_SUM0_SUS256_SPO1_SVW2_SKXCCM0_VWA2_VWB2_WSGRA0_WSGRB0_WGM1_WGMXCC1_WGMXCCGn1
    SolutionIndex: 2
    SolutionNameMin: Cijk_Ailk_Bjlk_HHS_BH_UserArgs_MT128x64x64_MI16x16x1_SN_LDSB0_CLR1_GSU0_GSUC0_GSUWGMRR0_K1_LBSPPA1024_LBSPPB512_MIWT4_2_NLCA1_NLCB1_PLR2_SU32_SUM0_SUS256_SPO0_SVW2_SKXCCM8_VWA2_VWB2_WSGRA0_WSGRB1_WGM1_WGMXCC1_WGMXCCGn1
    SolutionIndex: 3
    SolutionNameMin: Cijk_Ailk_Bjlk_HHS_BH_UserArgs_MT128x64x64_MI16x16x1_SN_LDSB0_CLR1_GSU0_GSUC0_GSUWGMRR0_K1_LBSPPA1024_LBSPPB512_MIWT4_2_NLCA2_NLCB1_PLR2_SU32_SUM0_SUS256_SPO0_SVW2_SKXCCM8_VWA2_VWB2_WSGRA1_WSGRB0_WGM1_WGMXCC1_WGMXCCGn1
    SolutionIndex: 4
    SolutionNameMin: Cijk_Ailk_Bjlk_HHS_BH_UserArgs_MT64x64x64_MI16x16x1_SN_LDSB0_CLR1_GSU0_GSUC0_GSUWGMRR0_K1_LBSPPA512_LBSPPB512_MIWT2_2_NLCA1_NLCB1_PLR2_SU32_SUM0_SUS256_SPO0_SVW2_SKXCCM0_VWA2_VWB2_WSGRA1_WSGRB1_WGM1_WGMXCC1_WGMXCCGn1
    SolutionIndex: 5
    SolutionNameMin: Cijk_Ailk_Bjlk_HHS_BH_UserArgs_MT64x64x32_MI16x16x1_SN_LDSB0_CLR1_GSU0_GSUC0_GSUWGMRR0_K1_LBSPPA512_LBSPPB512_MIWT2_2_NLCA1_NLCB1_PLR1_SU32_SUM0_SUS256_SPO0_SVW2_SKXCCM8_VWA2_VWB2_WSGRA1_WSGRB0_WGM1_WGMXCC1_WGMXCCGn1
    SolutionIndex: 6
    SolutionNameMin: Cijk_Ailk_Bjlk_HHS_BH_UserArgs_MT64x64x64_MI16x16x1_SN_LDSB0_CLR1_GSU0_GSUC0_GSUWGMRR0_K1_LBSPPA512_LBSPPB512_MIWT2_2_NLCA1_NLCB1_PLR1_SU32_SUM0_SUS256_SPO0_SVW2_SKXCCM8_VWA2_VWB2_WSGRA0_WSGRB0_WGM1_WGMXCC1_WGMXCCGn1
    SolutionIndex: 7
    SolutionNameMin: Cijk_Ailk_Bjlk_HHS_BH_UserArgs_MT64x64x64_MI16x16x1_SN_LDSB0_CLR1_GSU0_GSUC0_GSUWGMRR0_K1_LBSPPA512_LBSPPB512_MIWT2_2_NLCA1_NLCB1_PLR2_SU32_SUM0_SUS256_SPO0_SVW2_SKXCCM8_VWA2_VWB2_WSGRA0_WSGRB0_WGM1_WGMXCC1_WGMXCCGn1
    SolutionIndex: 8
    SolutionNameMin: Cijk_Ailk_Bjlk_HHS_BH_UserArgs_MT64x64x64_MI16x16x1_SN_LDSB0_CLR1_GSU0_GSUC0_GSUWGMRR0_K1_LBSPPA512_LBSPPB512_MIWT2_2_NLCA2_NLCB1_PLR3_SU32_SUM0_SUS256_SPO0_SVW2_SKXCCM8_VWA2_VWB2_WSGRA1_WSGRB0_WGM1_WGMXCC1_WGMXCCGn1
    SolutionIndex: 9
    SolutionNameMin: Cijk_Ailk_Bjlk_HHS_BH_UserArgs_MT64x64x64_MI16x16x1_SN_LDSB0_CLR1_GSU0_GSUC0_GSUWGMRR0_K1_LBSPPA512_LBSPPB512_MIWT2_2_NLCA1_NLCB2_PLR2_SU32_SUM0_SUS256_SPO0_SVW2_SKXCCM8_VWA2_VWB2_WSGRA1_WSGRB0_WGM1_WGMXCC1_WGMXCCGn1
    SolutionIndex: 10
    SolutionNameMin: Cijk_Ailk_Bjlk_HHS_BH_UserArgs_MT64x64x64_MI16x16x1_SN_LDSB0_CLR1_GSU0_GSUC0_GSUWGMRR0_K1_LBSPPA512_LBSPPB512_MIWT2_2_NLCA1_NLCB2_PLR2_SU32_SUM0_SUS256_SPO0_SVW2_SKXCCM8_VWA2_VWB2_WSGRA0_WSGRB0_WGM8_WGMXCC1_WGMXCCGn1
    SolutionIndex: 11
    SolutionNameMin: Cijk_Ailk_Bjlk_HHS_BH_UserArgs_MT64x64x64_MI16x16x1_SN_LDSB0_CLR1_GSU0_GSUC0_GSUWGMRR0_K1_LBSPPA512_LBSPPB512_MIWT2_2_NLCA1_NLCB1_PLR2_SU32_SUM0_SUS256_SPO1_SVW2_SKXCCM8_VWA2_VWB2_WSGRA0_WSGRB0_WGM1_WGMXCC1_WGMXCCGn1
    SolutionIndex: 12
    SolutionNameMin: Cijk_Ailk_Bjlk_HHS_BH_UserArgs_MT64x64x64_MI16x16x1_SN_LDSB0_CLR1_GSU0_GSUC0_GSUWGMRR0_K1_LBSPPA512_LBSPPB512_MIWT2_2_NLCA1_NLCB1_PLR2_SU32_SUM0_SUS256_SPO1_SVW2_SKXCCM8_VWA2_VWB2_WSGRA0_WSGRB1_WGM1_WGMXCC1_WGMXCCGn1
    SolutionIndex: 13
    SolutionNameMin: Cijk_Ailk_Bjlk_HHS_BH_UserArgs_MT32x64x64_MI16x16x1_SN_LDSB0_CLR1_GSU0_GSUC0_GSUWGMRR0_K1_LBSPPA256_LBSPPB512_MIWT1_2_NLCA1_NLCB1_PLR2_SU32_SUM0_SUS256_SPO0_SVW1_SKXCCM8_VWA1_VWB1_WSGRA0_WSGRB0_WGM1_WGMXCC1_WGMXCCGn1
    SolutionIndex: 14
    SolutionNameMin: Cijk_Ailk_Bjlk_HHS_BH_UserArgs_MT64x32x64_MI16x16x1_SN_LDSB0_CLR1_GSU0_GSUC0_GSUWGMRR0_K1_LBSPPA512_LBSPPB256_MIWT2_1_NLCA2_NLCB1_PLR3_SU32_SUM0_SUS256_SPO1_SVW1_SKXCCM0_VWA1_VWB1_WSGRA0_WSGRB0_WGM1_WGMXCC1_WGMXCCGn1
    SolutionIndex: 15
    SolutionNameMin: Cijk_Ailk_Bjlk_HHS_BH_UserArgs_MT64x32x64_MI16x16x1_SN_LDSB0_CLR1_GSU0_GSUC0_GSUWGMRR0_K1_LBSPPA512_LBSPPB256_MIWT2_1_NLCA1_NLCB1_PLR2_SU32_SUM0_SUS256_SPO0_SVW1_SKXCCM8_VWA1_VWB1_WSGRA0_WSGRB0_WGM1_WGMXCC1_WGMXCCGn1
    SolutionIndex: 16
    SolutionNameMin: Cijk_Ailk_Bjlk_HHS_BH_UserArgs_MT32x32x64_MI16x16x1_SN_LDSB0_CLR1_GSU0_GSUC0_GSUWGMRR0_K1_LBSPPA256_LBSPPB256_MIWT1_1_NLCA1_NLCB1_PLR1_SU32_SUM0_SUS256_SPO0_SVW1_SKXCCM0_VWA1_VWB1_WSGRA1_WSGRB0_WGM1_WGMXCC1_WGMXCCGn1
    SolutionIndex: 17
    SolutionNameMin: Cijk_Ailk_Bjlk_HHS_BH_UserArgs_MT32x32x64_MI16x16x1_SN_LDSB0_CLR1_GSU0_GSUC0_GSUWGMRR0_K1_LBSPPA256_LBSPPB256_MIWT1_1_NLCA1_NLCB1_PLR1_SU32_SUM0_SUS256_SPO0_SVW1_SKXCCM0_VWA1_VWB1_WSGRA0_WSGRB1_WGM1_WGMXCC1_WGMXCCGn1
    SolutionIndex: 18
    SolutionNameMin: Cijk_Ailk_Bjlk_HHS_BH_UserArgs_MT32x32x64_MI16x16x1_SN_LDSB0_CLR1_GSU0_GSUC0_GSUWGMRR0_K1_LBSPPA256_LBSPPB256_MIWT1_1_NLCA1_NLCB1_PLR2_SU32_SUM0_SUS256_SPO0_SVW1_SKXCCM0_VWA1_VWB1_WSGRA1_WSGRB0_WGM1_WGMXCC1_WGMXCCGn1
    SolutionIndex: 19
    SolutionNameMin: Cijk_Ailk_Bjlk_HHS_BH_UserArgs_MT32x32x64_MI16x16x1_SN_LDSB0_CLR1_GSU0_GSUC0_GSUWGMRR0_K1_LBSPPA256_LBSPPB256_MIWT1_1_NLCA1_NLCB1_PLR2_SU32_SUM0_SUS256_SPO0_SVW1_SKXCCM0_VWA1_VWB1_WSGRA0_WSGRB1_WGM1_WGMXCC1_WGMXCCGn1
    SolutionIndex: 20
    SolutionNameMin: Cijk_Ailk_Bjlk_HHS_BH_UserArgs_MT32x32x64_MI16x16x1_SN_LDSB0_CLR1_GSU0_GSUC0_GSUWGMRR0_K1_LBSPPA256_LBSPPB256_MIWT1_1_NLCA1_NLCB1_PLR1_SU32_SUM0_SUS256_SPO1_SVW1_SKXCCM0_VWA1_VWB1_WSGRA1_WSGRB0_WGM1_WGMXCC1_WGMXCCGn1
    SolutionIndex: 21
    SolutionNameMin: Cijk_Ailk_Bjlk_HHS_BH_UserArgs_MT32x32x64_MI16x16x1_SN_LDSB0_CLR1_GSU0_GSUC0_GSUWGMRR0_K1_LBSPPA256_LBSPPB256_MIWT1_1_NLCA1_NLCB1_PLR3_SU32_SUM0_SUS256_SPO1_SVW1_SKXCCM0_VWA1_VWB1_WSGRA0_WSGRB0_WGM1_WGMXCC1_WGMXCCGn1
    SolutionIndex: 22
    SolutionNameMin: Cijk_Ailk_Bjlk_HHS_BH_UserArgs_MT32x32x64_MI16x16x1_SN_LDSB0_CLR1_GSU0_GSUC0_GSUWGMRR0_K1_LBSPPA256_LBSPPB256_MIWT1_1_NLCA1_NLCB1_PLR1_SU32_SUM0_SUS256_SPO0_SVW1_SKXCCM8_VWA1_VWB1_WSGRA0_WSGRB0_WGM1_WGMXCC1_WGMXCCGn1
    SolutionIndex: 23
    SolutionNameMin: Cijk_Ailk_Bjlk_HHS_BH_UserArgs_MT32x32x64_MI16x16x1_SN_LDSB0_CLR1_GSU0_GSUC0_GSUWGMRR0_K1_LBSPPA256_LBSPPB256_MIWT1_1_NLCA1_NLCB1_PLR1_SU32_SUM0_SUS256_SPO0_SVW1_SKXCCM8_VWA1_VWB1_WSGRA1_WSGRB1_WGM1_WGMXCC1_WGMXCCGn1
    SolutionIndex: 24
    SolutionNameMin: Cijk_Ailk_Bjlk_HHS_BH_UserArgs_MT32x32x64_MI16x16x1_SN_LDSB0_CLR1_GSU0_GSUC0_GSUWGMRR0_K1_LBSPPA256_LBSPPB256_MIWT1_1_NLCA1_NLCB1_PLR2_SU32_SUM0_SUS256_SPO0_SVW1_SKXCCM8_VWA1_VWB1_WSGRA0_WSGRB0_WGM1_WGMXCC1_WGMXCCGn1
    SolutionIndex: 25
    SolutionNameMin: Cijk_Ailk_Bjlk_HHS_BH_UserArgs_MT32x32x64_MI16x16x1_SN_LDSB0_CLR1_GSU0_GSUC0_GSUWGMRR0_K1_LBSPPA256_LBSPPB256_MIWT1_1_NLCA1_NLCB1_PLR3_SU32_SUM0_SUS256_SPO0_SVW1_SKXCCM8_VWA1_VWB1_WSGRA0_WSGRB0_WGM1_WGMXCC1_WGMXCCGn1
    SolutionIndex: 26
    SolutionNameMin: Cijk_Ailk_Bjlk_HHS_BH_UserArgs_MT32x32x64_MI16x16x1_SN_LDSB0_CLR1_GSU0_GSUC0_GSUWGMRR0_K1_LBSPPA256_LBSPPB256_MIWT1_1_NLCA1_NLCB1_PLR3_SU32_SUM0_SUS256_SPO0_SVW1_SKXCCM8_VWA1_VWB1_WSGRA1_WSGRB1_WGM1_WGMXCC1_WGMXCCGn1
    SolutionIndex: 27
    SolutionNameMin: Cijk_Ailk_Bjlk_HHS_BH_UserArgs_MT32x32x64_MI16x16x1_SN_LDSB0_CLR1_GSU0_GSUC0_GSUWGMRR0_K1_LBSPPA256_LBSPPB256_MIWT1_1_NLCA1_NLCB1_PLR1_SU32_SUM0_SUS256_SPO1_SVW1_SKXCCM8_VWA1_VWB1_WSGRA0_WSGRB0_WGM1_WGMXCC1_WGMXCCGn1
    SolutionIndex: 28
    SolutionNameMin: Cijk_Ailk_Bjlk_HHS_BH_UserArgs_MT32x32x64_MI16x16x1_SN_LDSB0_CLR1_GSU0_GSUC0_GSUWGMRR0_K1_LBSPPA256_LBSPPB256_MIWT1_1_NLCA1_NLCB1_PLR2_SU32_SUM0_SUS256_SPO1_SVW1_SKXCCM8_VWA1_VWB1_WSGRA0_WSGRB0_WGM1_WGMXCC1_WGMXCCGn1
    SolutionIndex: 29
    SolutionNameMin: Cijk_Ailk_Bjlk_HHS_BH_UserArgs_MT32x32x64_MI16x16x1_SN_LDSB0_CLR1_GSU0_GSUC0_GSUWGMRR0_K1_LBSPPA256_LBSPPB256_MIWT1_1_NLCA1_NLCB1_PLR2_SU32_SUM0_SUS256_SPO1_SVW1_SKXCCM8_VWA1_VWB1_WSGRA1_WSGRB0_WGM1_WGMXCC1_WGMXCCGn1
    SolutionIndex: 30
    SolutionNameMin: Cijk_Ailk_Bjlk_HHS_BH_UserArgs_MT32x32x64_MI16x16x1_SN_LDSB0_CLR1_GSU0_GSUC0_GSUWGMRR0_K1_LBSPPA256_LBSPPB256_MIWT1_1_NLCA1_NLCB1_PLR2_SU32_SUM0_SUS256_SPO1_SVW1_SKXCCM8_VWA1_VWB1_WSGRA0_WSGRB1_WGM1_WGMXCC1_WGMXCCGn1
    SolutionIndex: 31
    SolutionNameMin: Cijk_Ailk_Bjlk_HHS_BH_UserArgs_MT32x32x64_MI16x16x1_SN_LDSB0_CLR1_GSU0_GSUC0_GSUWGMRR0_K1_LBSPPA256_LBSPPB256_MIWT1_1_NLCA1_NLCB1_PLR3_SU32_SUM0_SUS256_SPO1_SVW1_SKXCCM8_VWA1_VWB1_WSGRA0_WSGRB0_WGM1_WGMXCC1_WGMXCCGn1
    SolutionIndex: 32
    SolutionNameMin: Cijk_Ailk_Bjlk_HHS_BH_UserArgs_MT32x32x64_MI16x16x1_SN_LDSB0_CLR1_GSU0_GSUC0_GSUWGMRR0_K1_LBSPPA256_LBSPPB256_MIWT1_1_NLCA1_NLCB1_PLR3_SU32_SUM0_SUS256_SPO1_SVW1_SKXCCM8_VWA1_VWB1_WSGRA1_WSGRB0_WGM1_WGMXCC1_WGMXCCGn1
    SolutionIndex: 33
    SolutionNameMin: Cijk_Ailk_Bjlk_HHS_BH_UserArgs_MT32x32x64_MI16x16x1_SN_LDSB0_CLR1_GSU0_GSUC0_GSUWGMRR0_K1_LBSPPA256_LBSPPB256_MIWT1_1_NLCA1_NLCB1_PLR3_SU32_SUM0_SUS256_SPO1_SVW1_SKXCCM8_VWA1_VWB1_WSGRA0_WSGRB1_WGM1_WGMXCC1_WGMXCCGn1
    SolutionIndex: 34
    SolutionNameMin: Cijk_Ailk_Bjlk_HHS_BH_UserArgs_MT32x32x64_MI16x16x1_SN_LDSB0_CLR1_GSU0_GSUC0_GSUWGMRR0_K1_LBSPPA256_LBSPPB256_MIWT1_1_NLCA1_NLCB1_PLR2_SU32_SUM0_SUS256_SPO1_SVW1_SKXCCM0_VWA1_VWB1_WSGRA0_WSGRB0_WGM1_WGMXCC1_WGMXCCGn1
    SolutionIndex: 35
    SolutionNameMin: Cijk_Ailk_Bjlk_HHS_BH_UserArgs_MT32x32x64_MI16x16x1_SN_LDSB0_CLR1_GSU0_GSUC0_GSUWGMRR0_K1_LBSPPA256_LBSPPB256_MIWT1_1_NLCA1_NLCB1_PLR3_SU32_SUM0_SUS256_SPO0_SVW1_SKXCCM8_VWA1_VWB1_WSGRA1_WSGRB1_WGM8_WGMXCC1_WGMXCCGn1
    SolutionIndex: 36
    SolutionNameMin: Cijk_Ailk_Bjlk_HHS_BH_UserArgs_MT64x64x64_MI16x16x1_SN_LDSB0_CLR1_GSU0_GSUC0_GSUWGMRR0_K1_LBSPPA512_LBSPPB512_MIWT2_2_NLCA1_NLCB1_PLR2_SU32_SUM0_SUS256_SPO1_SVW2_SKXCCM8_VWA2_VWB2_WSGRA1_WSGRB0_WGM8_WGMXCC1_WGMXCCGn1
    SolutionIndex: 37
    SolutionNameMin: Cijk_Ailk_Bjlk_HHS_BH_UserArgs_MT32x32x64_MI16x16x1_SN_LDSB0_CLR1_GSU0_GSUC0_GSUWGMRR0_K1_LBSPPA256_LBSPPB256_MIWT1_1_NLCA1_NLCB1_PLR3_SU32_SUM0_SUS256_SPO0_SVW1_SKXCCM0_VWA1_VWB1_WSGRA1_WSGRB0_WGM1_WGMXCC1_WGMXCCGn1
    SolutionIndex: 38
    SolutionNameMin: Cijk_Ailk_Bjlk_HHS_BH_UserArgs_MT64x64x64_MI16x16x1_SN_LDSB0_CLR1_GSU0_GSUC0_GSUWGMRR0_K1_LBSPPA512_LBSPPB512_MIWT2_2_NLCA2_NLCB1_PLR2_SU32_SUM0_SUS256_SPO1_SVW2_SKXCCM8_VWA2_VWB2_WSGRA1_WSGRB0_WGM1_WGMXCC1_WGMXCCGn1
    SolutionIndex: 39
    SolutionNameMin: Cijk_Ailk_Bjlk_HHS_BH_UserArgs_MT64x32x64_MI16x16x1_SN_LDSB0_CLR1_GSU0_GSUC0_GSUWGMRR0_K1_LBSPPA512_LBSPPB256_MIWT2_1_NLCA1_NLCB1_PLR2_SU32_SUM0_SUS256_SPO1_SVW1_SKXCCM8_VWA1_VWB1_WSGRA0_WSGRB0_WGM1_WGMXCC1_WGMXCCGn1
    SolutionIndex: 40
    SolutionNameMin: Cijk_Ailk_Bjlk_HHS_BH_UserArgs_MT64x64x64_MI16x16x1_SN_LDSB0_CLR1_GSU0_GSUC0_GSUWGMRR0_K1_LBSPPA512_LBSPPB512_MIWT2_2_NLCA1_NLCB2_PLR2_SU32_SUM0_SUS256_SPO1_SVW2_SKXCCM0_VWA2_VWB2_WSGRA0_WSGRB0_WGM1_WGMXCC1_WGMXCCGn1
    SolutionIndex: 41
    SolutionNameMin: Cijk_Ailk_Bjlk_HHS_BH_UserArgs_MT64x64x64_MI16x16x1_SN_LDSB0_CLR1_GSU0_GSUC0_GSUWGMRR0_K1_LBSPPA512_LBSPPB512_MIWT2_2_NLCA1_NLCB1_PLR3_SU32_SUM0_SUS256_SPO0_SVW2_SKXCCM8_VWA2_VWB2_WSGRA0_WSGRB0_WGM8_WGMXCC1_WGMXCCGn1
    SolutionIndex: 42
    SolutionNameMin: Cijk_Ailk_Bjlk_HHS_BH_UserArgs_MT128x64x64_MI16x16x1_SN_LDSB0_CLR1_GSU0_GSUC0_GSUWGMRR0_K1_LBSPPA1024_LBSPPB512_MIWT4_2_NLCA2_NLCB1_PLR2_SU32_SUM0_SUS256_SPO0_SVW2_SKXCCM8_VWA2_VWB2_WSGRA0_WSGRB1_WGM1_WGMXCC1_WGMXCCGn1
    SolutionIndex: 43
    SolutionNameMin: Cijk_Ailk_Bjlk_HHS_BH_UserArgs_MT64x64x64_MI16x16x1_SN_LDSB0_CLR1_GSU0_GSUC0_GSUWGMRR0_K1_LBSPPA512_LBSPPB512_MIWT2_2_NLCA2_NLCB1_PLR2_SU32_SUM0_SUS256_SPO1_SVW2_SKXCCM0_VWA2_VWB2_WSGRA0_WSGRB0_WGM1_WGMXCC1_WGMXCCGn1
    SolutionIndex: 44
    SolutionNameMin: Cijk_Ailk_Bjlk_HHS_BH_UserArgs_MT64x64x64_MI16x16x1_SN_LDSB0_CLR1_GSU0_GSUC0_GSUWGMRR0_K1_LBSPPA512_LBSPPB512_MIWT2_2_NLCA2_NLCB1_PLR2_SU32_SUM0_SUS256_SPO0_SVW2_SKXCCM8_VWA2_VWB2_WSGRA0_WSGRB0_WGM1_WGMXCC1_WGMXCCGn1
    SolutionIndex: 45
    SolutionNameMin: Cijk_Ailk_Bjlk_HHS_BH_UserArgs_MT128x64x64_MI16x16x1_SN_LDSB0_CLR1_GSU0_GSUC0_GSUWGMRR0_K1_LBSPPA1024_LBSPPB512_MIWT4_2_NLCA1_NLCB1_PLR2_SU32_SUM0_SUS256_SPO0_SVW2_SKXCCM8_VWA2_VWB2_WSGRA1_WSGRB1_WGM8_WGMXCC1_WGMXCCGn1
    SolutionIndex: 46
    SolutionNameMin: Cijk_Ailk_Bjlk_HHS_BH_UserArgs_MT128x128x64_MI16x16x1_SN_LDSB0_CLR1_GSU0_GSUC0_GSUWGMRR0_K1_LBSPPA1024_LBSPPB1024_MIWT4_4_NLCA1_NLCB1_PLR1_SU32_SUM0_SUS256_SPO0_SVW4_SKXCCM8_VWA4_VWB4_WSGRA0_WSGRB1_WGM1_WGMXCC1_WGMXCCGn1
    SolutionIndex: 47
    SolutionNameMin: Cijk_Ailk_Bjlk_HHS_BH_UserArgs_MT64x64x64_MI16x16x1_SN_LDSB0_CLR1_GSU0_GSUC0_GSUWGMRR0_K1_LBSPPA512_LBSPPB512_MIWT2_2_NLCA1_NLCB1_PLR2_SU32_SUM0_SUS256_SPO0_SVW2_SKXCCM0_VWA2_VWB2_WSGRA0_WSGRB0_WGM1_WGMXCC1_WGMXCCGn1
    SolutionIndex: 48
    SolutionNameMin: Cijk_Ailk_Bjlk_HHS_BH_UserArgs_MT128x64x64_MI16x16x1_SN_LDSB0_CLR1_GSU0_GSUC0_GSUWGMRR0_K1_LBSPPA1024_LBSPPB512_MIWT4_2_NLCA1_NLCB1_PLR2_SU32_SUM0_SUS256_SPO1_SVW2_SKXCCM8_VWA2_VWB2_WSGRA0_WSGRB0_WGM1_WGMXCC1_WGMXCCGn1
    SolutionIndex: 49
    SolutionNameMin: Cijk_Ailk_Bjlk_HHS_BH_UserArgs_MT128x64x64_MI16x16x1_SN_LDSB0_CLR1_GSU0_GSUC0_GSUWGMRR0_K1_LBSPPA1024_LBSPPB512_MIWT4_2_NLCA2_NLCB1_PLR2_SU32_SUM0_SUS256_SPO0_SVW2_SKXCCM8_VWA2_VWB2_WSGRA0_WSGRB0_WGM1_WGMXCC1_WGMXCCGn1
    SolutionIndex: 50
    SolutionNameMin: Cijk_Ailk_Bjlk_HHS_BH_UserArgs_MT128x128x64_MI16x16x1_SN_LDSB1_CLR1_GSU0_GSUC0_GSUWGMRR0_K1_LBSPPA1024_LBSPPB1024_MIWT4_4_NLCA2_NLCB2_PLR1_SU32_SUM0_SUS256_SPO0_SVW4_SKXCCM8_VWA4_VWB4_WSGRA0_WSGRB0_WGM1_WGMXCC1_WGMXCCGn1
    SolutionIndex: 51
    SolutionNameMin: Cijk_Ailk_Bjlk_HHS_BH_UserArgs_MT128x128x64_MI16x16x1_SN_LDSB1_CLR1_GSU0_GSUC0_GSUWGMRR0_K1_LBSPPA1024_LBSPPB1024_MIWT4_4_NLCA2_NLCB2_PLR1_SU32_SUM0_SUS256_SPO0_SVW4_SKXCCM8_VWA4_VWB4_WSGRA1_WSGRB0_WGM8_WGMXCC1_WGMXCCGn1
    SolutionIndex: 52
    SolutionNameMin: Cijk_Ailk_Bjlk_HHS_BH_UserArgs_MT256x128x64_MI16x16x1_SN_LDSB1_CLR1_GSU0_GSUC0_GSUWGMRR0_K1_LBSPPA2048_LBSPPB1024_MIWT8_4_NLCA1_NLCB1_PLR1_SU32_SUM0_SUS256_SPO0_SVW4_SKXCCM0_VWA4_VWB4_WSGRA0_WSGRB0_WGM1_WGMXCC1_WGMXCCGn1
    SolutionIndex: 53
    SolutionNameMin: Cijk_Ailk_Bjlk_HHS_BH_UserArgs_MT32x32x64_MI16x16x1_SN_LDSB0_CLR1_GSU0_GSUC0_GSUWGMRR0_K1_LBSPPA256_LBSPPB256_MIWT1_1_NLCA1_NLCB1_PLR2_SU32_SUM0_SUS256_SPO0_SVW1_SKXCCM0_VWA1_VWB1_WSGRA1_WSGRB1_WGM1_WGMXCC1_WGMXCCGn1
    SolutionIndex: 54
    SolutionNameMin: Cijk_Ailk_Bjlk_HHS_BH_UserArgs_MT32x32x64_MI16x16x1_SN_LDSB0_CLR1_GSU0_GSUC0_GSUWGMRR0_K1_LBSPPA256_LBSPPB256_MIWT1_1_NLCA1_NLCB1_PLR3_SU32_SUM0_SUS256_SPO0_SVW1_SKXCCM8_VWA1_VWB1_WSGRA0_WSGRB0_WGM8_WGMXCC1_WGMXCCGn1
    SolutionIndex: 55
    SolutionNameMin: Cijk_Ailk_Bjlk_HHS_BH_UserArgs_MT32x64x64_MI16x16x1_SN_LDSB0_CLR1_GSU0_GSUC0_GSUWGMRR0_K1_LBSPPA256_LBSPPB512_MIWT1_2_NLCA1_NLCB1_PLR2_SU32_SUM0_SUS256_SPO0_SVW1_SKXCCM8_VWA1_VWB1_WSGRA0_WSGRB1_WGM1_WGMXCC1_WGMXCCGn1
    SolutionIndex: 56
    SolutionNameMin: Cijk_Ailk_Bjlk_HHS_BH_UserArgs_MT32x32x64_MI16x16x1_SN_LDSB0_CLR1_GSU0_GSUC0_GSUWGMRR0_K1_LBSPPA256_LBSPPB256_MIWT1_1_NLCA1_NLCB1_PLR1_SU32_SUM0_SUS256_SPO1_SVW1_SKXCCM0_VWA1_VWB1_WSGRA0_WSGRB1_WGM1_WGMXCC1_WGMXCCGn1
    SolutionIndex: 57
    SolutionNameMin: Cijk_Ailk_Bjlk_HHS_BH_UserArgs_MT32x64x64_MI16x16x1_SN_LDSB0_CLR1_GSU0_GSUC0_GSUWGMRR0_K1_LBSPPA256_LBSPPB512_MIWT1_2_NLCA1_NLCB1_PLR2_SU32_SUM0_SUS256_SPO0_SVW1_SKXCCM8_VWA1_VWB1_WSGRA0_WSGRB0_WGM8_WGMXCC1_WGMXCCGn1
    SolutionIndex: 58
    SolutionNameMin: Cijk_Ailk_Bjlk_HHS_BH_UserArgs_MT64x64x64_MI16x16x1_SN_LDSB0_CLR1_GSU0_GSUC0_GSUWGMRR0_K1_LBSPPA512_LBSPPB512_MIWT2_2_NLCA1_NLCB2_PLR2_SU32_SUM0_SUS256_SPO1_SVW2_SKXCCM8_VWA2_VWB2_WSGRA0_WSGRB1_WGM1_WGMXCC1_WGMXCCGn1
    SolutionIndex: 59
    SolutionNameMin: Cijk_Ailk_Bjlk_HHS_BH_UserArgs_MT64x64x64_MI16x16x1_SN_LDSB0_CLR1_GSU0_GSUC0_GSUWGMRR0_K1_LBSPPA512_LBSPPB512_MIWT2_2_NLCA1_NLCB1_PLR2_SU32_SUM0_SUS256_SPO1_SVW2_SKXCCM8_VWA2_VWB2_WSGRA1_WSGRB0_WGM1_WGMXCC1_WGMXCCGn1
    SolutionIndex: 60
    SolutionNameMin: Cijk_Ailk_Bjlk_HHS_BH_UserArgs_MT64x64x64_MI16x16x1_SN_LDSB0_CLR1_GSU0_GSUC0_GSUWGMRR0_K1_LBSPPA512_LBSPPB512_MIWT2_2_NLCA1_NLCB1_PLR3_SU32_SUM0_SUS256_SPO1_SVW2_SKXCCM8_VWA2_VWB2_WSGRA1_WSGRB1_WGM1_WGMXCC1_WGMXCCGn1
    SolutionIndex: 61
    SolutionNameMin: Cijk_Ailk_Bjlk_HHS_BH_UserArgs_MT64x64x64_MI16x16x1_SN_LDSB0_CLR1_GSU0_GSUC0_GSUWGMRR0_K1_LBSPPA512_LBSPPB512_MIWT2_2_NLCA1_NLCB1_PLR2_SU32_SUM0_SUS256_SPO1_SVW2_SKXCCM8_VWA2_VWB2_WSGRA0_WSGRB1_WGM8_WGMXCC1_WGMXCCGn1
    SolutionIndex: 62
    SolutionNameMin: Cijk_Ailk_Bjlk_HHS_BH_UserArgs_MT128x64x64_MI16x16x1_SN_LDSB0_CLR1_GSU0_GSUC0_GSUWGMRR0_K1_LBSPPA1024_LBSPPB512_MIWT4_2_NLCA2_NLCB2_PLR3_SU32_SUM0_SUS256_SPO0_SVW2_SKXCCM8_VWA2_VWB2_WSGRA1_WSGRB0_WGM1_WGMXCC1_WGMXCCGn1
    SolutionIndex: 63
    SolutionNameMin: Cijk_Ailk_Bjlk_HHS_BH_UserArgs_MT64x64x64_MI16x16x1_SN_LDSB0_CLR1_GSU0_GSUC0_GSUWGMRR0_K1_LBSPPA512_LBSPPB512_MIWT2_2_NLCA1_NLCB1_PLR1_SU32_SUM0_SUS256_SPO0_SVW2_SKXCCM0_VWA2_VWB2_WSGRA0_WSGRB0_WGM1_WGMXCC1_WGMXCCGn1
    SolutionIndex: 64
    SolutionNameMin: Cijk_Ailk_Bjlk_HHS_BH_UserArgs_MT64x64x64_MI16x16x1_SN_LDSB0_CLR1_GSU0_GSUC0_GSUWGMRR0_K1_LBSPPA512_LBSPPB512_MIWT2_2_NLCA1_NLCB2_PLR1_SU32_SUM0_SUS256_SPO0_SVW2_SKXCCM8_VWA2_VWB2_WSGRA0_WSGRB1_WGM1_WGMXCC1_WGMXCCGn1
    SolutionIndex: 65
    SolutionNameMin: Cijk_Ailk_Bjlk_HHS_BH_UserArgs_MT128x64x64_MI16x16x1_SN_LDSB0_CLR1_GSU0_GSUC0_GSUWGMRR0_K1_LBSPPA1024_LBSPPB512_MIWT4_2_NLCA2_NLCB2_PLR2_SU32_SUM0_SUS256_SPO0_SVW2_SKXCCM8_VWA2_VWB2_WSGRA0_WSGRB1_WGM1_WGMXCC1_WGMXCCGn1
    SolutionIndex: 66
    SolutionNameMin: Cijk_Ailk_Bjlk_HHS_BH_UserArgs_MT128x64x64_MI16x16x1_SN_LDSB0_CLR1_GSU0_GSUC0_GSUWGMRR0_K1_LBSPPA1024_LBSPPB512_MIWT4_2_NLCA1_NLCB2_PLR2_SU32_SUM0_SUS256_SPO1_SVW2_SKXCCM8_VWA2_VWB2_WSGRA1_WSGRB0_WGM8_WGMXCC1_WGMXCCGn1
    SolutionIndex: 67
    SolutionNameMin: Cijk_Ailk_Bjlk_HHS_BH_UserArgs_MT128x128x64_MI16x16x1_SN_LDSB0_CLR1_GSU0_GSUC0_GSUWGMRR0_K1_LBSPPA1024_LBSPPB1024_MIWT4_4_NLCA1_NLCB2_PLR1_SU32_SUM0_SUS256_SPO1_SVW4_SKXCCM8_VWA4_VWB4_WSGRA1_WSGRB1_WGM1_WGMXCC1_WGMXCCGn1
    SolutionIndex: 68
    SolutionNameMin: Cijk_Ailk_Bjlk_HHS_BH_UserArgs_MT64x64x64_MI16x16x1_SN_LDSB0_CLR1_GSU0_GSUC0_GSUWGMRR0_K1_LBSPPA512_LBSPPB512_MIWT2_2_NLCA1_NLCB1_PLR2_SU32_SUM0_SUS256_SPO0_SVW2_SKXCCM0_VWA2_VWB2_WSGRA0_WSGRB0_WGM8_WGMXCC1_WGMXCCGn1
    SolutionIndex: 69
    SolutionNameMin: Cijk_Ailk_Bjlk_HHS_BH_UserArgs_MT128x64x64_MI16x16x1_SN_LDSB0_CLR1_GSU0_GSUC0_GSUWGMRR0_K1_LBSPPA1024_LBSPPB512_MIWT4_2_NLCA2_NLCB1_PLR2_SU32_SUM0_SUS256_SPO1_SVW2_SKXCCM8_VWA2_VWB2_WSGRA0_WSGRB0_WGM1_WGMXCC1_WGMXCCGn1
    SolutionIndex: 70
    SolutionNameMin: Cijk_Ailk_Bjlk_HHS_BH_UserArgs_MT128x64x64_MI16x16x1_SN_LDSB0_CLR1_GSU0_GSUC0_GSUWGMRR0_K1_LBSPPA1024_LBSPPB512_MIWT4_2_NLCA1_NLCB2_PLR2_SU32_SUM0_SUS256_SPO0_SVW2_SKXCCM8_VWA2_VWB2_WSGRA1_WSGRB0_WGM1_WGMXCC1_WGMXCCGn1
    SolutionIndex: 71
    SolutionNameMin: Cijk_Ailk_Bjlk_HHS_BH_UserArgs_MT128x128x32_MI16x16x1_SN_LDSB0_CLR1_GSU0_GSUC0_GSUWGMRR0_K1_LBSPPA1024_LBSPPB1024_MIWT4_4_NLCA2_NLCB1_PLR1_SU32_SUM0_SUS256_SPO0_SVW4_SKXCCM8_VWA4_VWB4_WSGRA0_WSGRB0_WGM8_WGMXCC1_WGMXCCGn1
    SolutionIndex: 72
    SolutionNameMin: Cijk_Ailk_Bjlk_HHS_BH_UserArgs_MT128x128x64_MI16x16x1_SN_LDSB1_CLR1_GSU0_GSUC0_GSUWGMRR0_K1_LBSPPA1024_LBSPPB1024_MIWT4_4_NLCA2_NLCB1_PLR1_SU32_SUM0_SUS256_SPO0_SVW4_SKXCCM8_VWA4_VWB4_WSGRA0_WSGRB1_WGM1_WGMXCC1_WGMXCCGn1
    SolutionIndex: 73
    SolutionNameMin: Cijk_Ailk_Bjlk_HHS_BH_UserArgs_MT256x128x32_MI16x16x1_SN_LDSB0_CLR1_GSU0_GSUC0_GSUWGMRR0_K1_LBSPPA2048_LBSPPB1024_MIWT8_4_NLCA2_NLCB2_PLR1_SU32_SUM0_SUS256_SPO1_SVW4_SKXCCM8_VWA4_VWB4_WSGRA0_WSGRB1_WGM8_WGMXCC1_WGMXCCGn1
    SolutionIndex: 74
    SolutionNameMin: Cijk_Ailk_Bjlk_HHS_BH_UserArgs_MT128x128x64_MI16x16x1_SN_LDSB0_CLR1_GSU0_GSUC0_GSUWGMRR0_K1_LBSPPA1024_LBSPPB1024_MIWT4_4_NLCA2_NLCB2_PLR3_SU32_SUM0_SUS256_SPO1_SVW4_SKXCCM0_VWA4_VWB4_WSGRA0_WSGRB0_WGM8_WGMXCC1_WGMXCCGn1
    SolutionIndex: 75
    SolutionNameMin: Cijk_Ailk_Bjlk_HHS_BH_UserArgs_MT128x128x64_MI16x16x1_SN_LDSB1_CLR1_GSU0_GSUC0_GSUWGMRR0_K1_LBSPPA1024_LBSPPB1024_MIWT4_4_NLCA2_NLCB2_PLR3_SU32_SUM0_SUS256_SPO0_SVW4_SKXCCM0_VWA4_VWB4_WSGRA0_WSGRB0_WGM1_WGMXCC1_WGMXCCGn1
    SolutionIndex: 76
    SolutionNameMin: Cijk_Ailk_Bjlk_HHS_BH_UserArgs_MT128x128x64_MI16x16x1_SN_LDSB1_CLR1_GSU0_GSUC0_GSUWGMRR0_K1_LBSPPA1024_LBSPPB1024_MIWT4_4_NLCA2_NLCB1_PLR1_SU32_SUM0_SUS256_SPO1_SVW4_SKXCCM8_VWA4_VWB4_WSGRA1_WSGRB0_WGM1_WGMXCC1_WGMXCCGn1
    SolutionIndex: 77
    SolutionNameMin: Cijk_Ailk_Bjlk_HHS_BH_UserArgs_MT128x128x64_MI16x16x1_SN_LDSB1_CLR1_GSU0_GSUC0_GSUWGMRR0_K1_LBSPPA1024_LBSPPB1024_MIWT4_4_NLCA1_NLCB2_PLR1_SU32_SUM0_SUS256_SPO1_SVW4_SKXCCM8_VWA4_VWB4_WSGRA1_WSGRB0_WGM8_WGMXCC1_WGMXCCGn1
    SolutionIndex: 78
    SolutionNameMin: Cijk_Ailk_Bjlk_HHS_BH_UserArgs_MT256x128x64_MI16x16x1_SN_LDSB1_CLR1_GSU0_GSUC0_GSUWGMRR0_K1_LBSPPA2048_LBSPPB1024_MIWT8_4_NLCA1_NLCB2_PLR3_SU32_SUM0_SUS256_SPO1_SVW4_SKXCCM8_VWA4_VWB4_WSGRA1_WSGRB0_WGM8_WGMXCC1_WGMXCCGn1
    SolutionIndex: 79
    SolutionNameMin: Cijk_Ailk_Bjlk_HHS_BH_UserArgs_MT32x32x64_MI16x16x1_SN_LDSB0_CLR1_GSU0_GSUC0_GSUWGMRR0_K1_LBSPPA256_LBSPPB256_MIWT1_1_NLCA1_NLCB1_PLR2_SU32_SUM0_SUS256_SPO0_SVW1_SKXCCM8_VWA1_VWB1_WSGRA1_WSGRB1_WGM1_WGMXCC1_WGMXCCGn1
    SolutionIndex: 80
    SolutionNameMin: Cijk_Ailk_Bjlk_HHS_BH_UserArgs_MT32x64x64_MI16x16x1_SN_LDSB0_CLR1_GSU0_GSUC0_GSUWGMRR0_K1_LBSPPA256_LBSPPB512_MIWT1_2_NLCA1_NLCB1_PLR2_SU32_SUM0_SUS256_SPO0_SVW1_SKXCCM0_VWA1_VWB1_WSGRA1_WSGRB1_WGM1_WGMXCC1_WGMXCCGn1
    SolutionIndex: 81
    SolutionNameMin: Cijk_Ailk_Bjlk_HHS_BH_UserArgs_MT64x64x64_MI16x16x1_SN_LDSB0_CLR1_GSU0_GSUC0_GSUWGMRR0_K1_LBSPPA512_LBSPPB512_MIWT2_2_NLCA2_NLCB1_PLR2_SU32_SUM0_SUS256_SPO1_SVW2_SKXCCM8_VWA2_VWB2_WSGRA0_WSGRB1_WGM8_WGMXCC1_WGMXCCGn1
    SolutionIndex: 82
    SolutionNameMin: Cijk_Ailk_Bjlk_HHS_BH_UserArgs_MT64x32x64_MI16x16x1_SN_LDSB0_CLR1_GSU0_GSUC0_GSUWGMRR0_K1_LBSPPA512_LBSPPB256_MIWT2_1_NLCA1_NLCB1_PLR2_SU32_SUM0_SUS256_SPO1_SVW1_SKXCCM8_VWA1_VWB1_WSGRA1_WSGRB0_WGM1_WGMXCC1_WGMXCCGn1
    SolutionIndex: 83
    SolutionNameMin: Cijk_Ailk_Bjlk_HHS_BH_UserArgs_MT64x64x64_MI16x16x1_SN_LDSB0_CLR1_GSU0_GSUC0_GSUWGMRR0_K1_LBSPPA512_LBSPPB512_MIWT2_2_NLCA1_NLCB1_PLR3_SU32_SUM0_SUS256_SPO0_SVW2_SKXCCM8_VWA2_VWB2_WSGRA0_WSGRB1_WGM1_WGMXCC1_WGMXCCGn1
    SolutionIndex: 84
    SolutionNameMin: Cijk_Ailk_Bjlk_HHS_BH_UserArgs_MT64x128x64_MI16x16x1_SN_LDSB0_CLR1_GSU0_GSUC0_GSUWGMRR0_K1_LBSPPA512_LBSPPB1024_MIWT2_4_NLCA1_NLCB2_PLR2_SU32_SUM0_SUS256_SPO0_SVW2_SKXCCM8_VWA2_VWB2_WSGRA1_WSGRB0_WGM1_WGMXCC1_WGMXCCGn1
    SolutionIndex: 85
    SolutionNameMin: Cijk_Ailk_Bjlk_HHS_BH_UserArgs_MT64x64x64_MI16x16x1_SN_LDSB0_CLR1_GSU0_GSUC0_GSUWGMRR0_K1_LBSPPA512_LBSPPB512_MIWT2_2_NLCA1_NLCB1_PLR2_SU32_SUM0_SUS256_SPO1_SVW2_SKXCCM0_VWA2_VWB2_WSGRA0_WSGRB0_WGM1_WGMXCC1_WGMXCCGn1
    SolutionIndex: 86
    SolutionNameMin: Cijk_Ailk_Bjlk_HHS_BH_UserArgs_MT128x128x32_MI16x16x1_SN_LDSB0_CLR1_GSU0_GSUC0_GSUWGMRR0_K1_LBSPPA1024_LBSPPB1024_MIWT4_4_NLCA1_NLCB1_PLR1_SU32_SUM0_SUS256_SPO1_SVW4_SKXCCM8_VWA4_VWB4_WSGRA0_WSGRB0_WGM1_WGMXCC1_WGMXCCGn1
    SolutionIndex: 87
    SolutionNameMin: Cijk_Ailk_Bjlk_HHS_BH_UserArgs_MT128x128x64_MI16x16x1_SN_LDSB1_CLR1_GSU0_GSUC0_GSUWGMRR0_K1_LBSPPA1024_LBSPPB1024_MIWT4_4_NLCA2_NLCB1_PLR1_SU32_SUM0_SUS256_SPO0_SVW4_SKXCCM8_VWA4_VWB4_WSGRA1_WSGRB1_WGM8_WGMXCC1_WGMXCCGn1
    SolutionIndex: 88
    SolutionNameMin: Cijk_Ailk_Bjlk_HHS_BH_UserArgs_MT64x64x64_MI16x16x1_SN_LDSB0_CLR1_GSU0_GSUC0_GSUWGMRR0_K1_LBSPPA512_LBSPPB512_MIWT2_2_NLCA1_NLCB2_PLR2_SU32_SUM0_SUS256_SPO1_SVW2_SKXCCM0_VWA2_VWB2_WSGRA0_WSGRB0_WGM8_WGMXCC1_WGMXCCGn1
    SolutionIndex: 89
    SolutionNameMin: Cijk_Ailk_Bjlk_HHS_BH_UserArgs_MT64x64x32_MI16x16x1_SN_LDSB0_CLR1_GSU0_GSUC0_GSUWGMRR0_K1_LBSPPA512_LBSPPB512_MIWT2_2_NLCA1_NLCB1_PLR1_SU32_SUM0_SUS256_SPO0_SVW2_SKXCCM8_VWA2_VWB2_WSGRA0_WSGRB1_WGM1_WGMXCC1_WGMXCCGn1
    SolutionIndex: 90
    SolutionNameMin: Cijk_Ailk_Bjlk_HHS_BH_UserArgs_MT128x64x64_MI16x16x1_SN_LDSB0_CLR1_GSU0_GSUC0_GSUWGMRR0_K1_LBSPPA1024_LBSPPB512_MIWT4_2_NLCA1_NLCB1_PLR2_SU32_SUM0_SUS256_SPO0_SVW2_SKXCCM8_VWA2_VWB2_WSGRA0_WSGRB0_WGM1_WGMXCC1_WGMXCCGn1
    SolutionIndex: 91
    SolutionNameMin: Cijk_Ailk_Bjlk_HHS_BH_UserArgs_MT128x128x32_MI16x16x1_SN_LDSB0_CLR1_GSU0_GSUC0_GSUWGMRR0_K1_LBSPPA1024_LBSPPB1024_MIWT4_4_NLCA2_NLCB2_PLR1_SU32_SUM0_SUS256_SPO0_SVW4_SKXCCM8_VWA4_VWB4_WSGRA0_WSGRB0_WGM1_WGMXCC1_WGMXCCGn1
    SolutionIndex: 92
    SolutionNameMin: Cijk_Ailk_Bjlk_HHS_BH_UserArgs_MT128x128x64_MI16x16x1_SN_LDSB0_CLR1_GSU0_GSUC0_GSUWGMRR0_K1_LBSPPA1024_LBSPPB1024_MIWT4_4_NLCA1_NLCB1_PLR2_SU32_SUM0_SUS256_SPO1_SVW4_SKXCCM8_VWA4_VWB4_WSGRA0_WSGRB0_WGM1_WGMXCC1_WGMXCCGn1
    SolutionIndex: 93
    SolutionNameMin: Cijk_Ailk_Bjlk_HHS_BH_UserArgs_MT256x128x64_MI16x16x1_SN_LDSB1_CLR1_GSU0_GSUC0_GSUWGMRR0_K1_LBSPPA2048_LBSPPB1024_MIWT8_4_NLCA2_NLCB1_PLR1_SU32_SUM0_SUS256_SPO1_SVW4_SKXCCM8_VWA4_VWB4_WSGRA0_WSGRB1_WGM1_WGMXCC1_WGMXCCGn1
    SolutionIndex: 94
    SolutionNameMin: Cijk_Ailk_Bjlk_HHS_BH_UserArgs_MT128x64x64_MI16x16x1_SN_LDSB0_CLR1_GSU0_GSUC0_GSUWGMRR0_K1_LBSPPA1024_LBSPPB512_MIWT4_2_NLCA2_NLCB1_PLR2_SU32_SUM0_SUS256_SPO0_SVW2_SKXCCM0_VWA2_VWB2_WSGRA0_WSGRB1_WGM8_WGMXCC1_WGMXCCGn1
    SolutionIndex: 95
    SolutionNameMin: Cijk_Ailk_Bjlk_HHS_BH_UserArgs_MT128x128x64_MI16x16x1_SN_LDSB0_CLR1_GSU0_GSUC0_GSUWGMRR0_K1_LBSPPA1024_LBSPPB1024_MIWT4_4_NLCA1_NLCB2_PLR2_SU32_SUM0_SUS256_SPO0_SVW4_SKXCCM0_VWA4_VWB4_WSGRA1_WSGRB1_WGM1_WGMXCC1_WGMXCCGn1
    SolutionIndex: 96
    SolutionNameMin: Cijk_Ailk_Bjlk_HHS_BH_UserArgs_MT128x128x64_MI16x16x1_SN_LDSB1_CLR1_GSU0_GSUC0_GSUWGMRR0_K1_LBSPPA1024_LBSPPB1024_MIWT4_4_NLCA1_NLCB1_PLR1_SU32_SUM0_SUS256_SPO0_SVW4_SKXCCM8_VWA4_VWB4_WSGRA1_WSGRB1_WGM1_WGMXCC1_WGMXCCGn1
    SolutionIndex: 97
    SolutionNameMin: Cijk_Ailk_Bjlk_HHS_BH_UserArgs_MT128x128x64_MI16x16x1_SN_LDSB1_CLR1_GSU0_GSUC0_GSUWGMRR0_K1_LBSPPA1024_LBSPPB1024_MIWT4_4_NLCA2_NLCB2_PLR1_SU32_SUM0_SUS256_SPO0_SVW4_SKXCCM8_VWA4_VWB4_WSGRA1_WSGRB1_WGM1_WGMXCC1_WGMXCCGn1
    SolutionIndex: 98
    SolutionNameMin: Cijk_Ailk_Bjlk_HHS_BH_UserArgs_MT128x128x64_MI16x16x1_SN_LDSB1_CLR1_GSU0_GSUC0_GSUWGMRR0_K1_LBSPPA1024_LBSPPB1024_MIWT4_4_NLCA2_NLCB1_PLR1_SU32_SUM0_SUS256_SPO1_SVW4_SKXCCM8_VWA4_VWB4_WSGRA1_WSGRB0_WGM8_WGMXCC1_WGMXCCGn1
    SolutionIndex: 99
    SolutionNameMin: Cijk_Ailk_Bjlk_HHS_BH_UserArgs_MT256x128x64_MI16x16x1_SN_LDSB1_CLR1_GSU0_GSUC0_GSUWGMRR0_K1_LBSPPA2048_LBSPPB1024_MIWT8_4_NLCA2_NLCB2_PLR1_SU32_SUM0_SUS256_SPO0_SVW4_SKXCCM8_VWA4_VWB4_WSGRA0_WSGRB1_WGM1_WGMXCC1_WGMXCCGn1
    SolutionIndex: 100
    SolutionNameMin: Cijk_Ailk_Bjlk_HHS_BH_UserArgs_MT256x128x64_MI16x16x1_SN_LDSB1_CLR1_GSU0_GSUC0_GSUWGMRR0_K1_LBSPPA2048_LBSPPB1024_MIWT8_4_NLCA2_NLCB1_PLR2_SU32_SUM0_SUS256_SPO1_SVW4_SKXCCM0_VWA4_VWB4_WSGRA0_WSGRB1_WGM8_WGMXCC1_WGMXCCGn1
    SolutionIndex: 101
    SolutionNameMin: Cijk_Ailk_Bjlk_HHS_BH_UserArgs_MT128x128x64_MI16x16x1_SN_LDSB1_CLR1_GSU0_GSUC0_GSUWGMRR0_K1_LBSPPA1024_LBSPPB1024_MIWT4_4_NLCA1_NLCB2_PLR1_SU32_SUM0_SUS256_SPO0_SVW4_SKXCCM0_VWA4_VWB4_WSGRA0_WSGRB0_WGM1_WGMXCC1_WGMXCCGn1
    SolutionIndex: 102
    SolutionNameMin: Cijk_Ailk_Bjlk_HHS_BH_UserArgs_MT128x64x64_MI16x16x1_SN_LDSB0_CLR1_GSU0_GSUC0_GSUWGMRR0_K1_LBSPPA1024_LBSPPB512_MIWT4_2_NLCA2_NLCB1_PLR2_SU32_SUM0_SUS256_SPO1_SVW2_SKXCCM8_VWA2_VWB2_WSGRA1_WSGRB0_WGM1_WGMXCC1_WGMXCCGn1
    SolutionIndex: 103
    SolutionNameMin: Cijk_Ailk_Bjlk_HHS_BH_UserArgs_MT128x128x64_MI16x16x1_SN_LDSB1_CLR1_GSU0_GSUC0_GSUWGMRR0_K1_LBSPPA1024_LBSPPB1024_MIWT4_4_NLCA1_NLCB2_PLR1_SU32_SUM0_SUS256_SPO1_SVW4_SKXCCM8_VWA4_VWB4_WSGRA1_WSGRB0_WGM1_WGMXCC1_WGMXCCGn1
    SolutionIndex: 104
    SolutionNameMin: Cijk_Ailk_Bjlk_HHS_BH_UserArgs_MT128x128x64_MI16x16x1_SN_LDSB0_CLR1_GSU0_GSUC0_GSUWGMRR0_K1_LBSPPA1024_LBSPPB1024_MIWT4_4_NLCA1_NLCB2_PLR2_SU32_SUM0_SUS256_SPO1_SVW4_SKXCCM8_VWA4_VWB4_WSGRA0_WSGRB1_WGM1_WGMXCC1_WGMXCCGn1
    SolutionIndex: 105
    SolutionNameMin: Cijk_Ailk_Bjlk_HHS_BH_UserArgs_MT128x256x32_MI16x16x1_SN_LDSB1_CLR1_GSU0_GSUC0_GSUWGMRR0_K1_LBSPPA1024_LBSPPB2048_MIWT4_8_NLCA2_NLCB2_PLR1_SU32_SUM0_SUS256_SPO1_SVW4_SKXCCM8_VWA4_VWB4_WSGRA1_WSGRB1_WGM1_WGMXCC1_WGMXCCGn1
    SolutionIndex: 106
    SolutionNameMin: Cijk_Ailk_Bjlk_HHS_BH_UserArgs_MT256x128x64_MI16x16x1_SN_LDSB1_CLR1_GSU0_GSUC0_GSUWGMRR0_K1_LBSPPA2048_LBSPPB1024_MIWT8_4_NLCA2_NLCB2_PLR1_SU32_SUM0_SUS256_SPO0_SVW4_SKXCCM0_VWA4_VWB4_WSGRA0_WSGRB1_WGM1_WGMXCC1_WGMXCCGn1
    SolutionIndex: 107
    SolutionNameMin: Cijk_Ailk_Bjlk_HHS_BH_UserArgs_MT256x256x32_MI16x16x1_SN_LDSB1_CLR1_GSU0_GSUC0_GSUWGMRR0_K1_LBSPPA2048_LBSPPB2048_MIWT8_8_NLCA2_NLCB2_PLR1_SU32_SUM0_SUS256_SPO1_SVW4_SKXCCM0_VWA4_VWB4_WSGRA0_WSGRB1_WGM8_WGMXCC1_WGMXCCGn1
    SolutionIndex: 108
    SolutionNameMin: Cijk_Ailk_Bjlk_HHS_BH_UserArgs_MT32x64x64_MI16x16x1_SN_LDSB0_CLR1_GSU0_GSUC0_GSUWGMRR0_K1_LBSPPA256_LBSPPB512_MIWT1_2_NLCA1_NLCB1_PLR2_SU32_SUM0_SUS256_SPO1_SVW1_SKXCCM0_VWA1_VWB1_WSGRA1_WSGRB0_WGM1_WGMXCC1_WGMXCCGn1
    SolutionIndex: 109
    SolutionNameMin: Cijk_Ailk_Bjlk_HHS_BH_UserArgs_MT64x64x64_MI16x16x1_SN_LDSB0_CLR1_GSU0_GSUC0_GSUWGMRR0_K1_LBSPPA512_LBSPPB512_MIWT2_2_NLCA2_NLCB1_PLR2_SU32_SUM0_SUS256_SPO0_SVW2_SKXCCM8_VWA2_VWB2_WSGRA0_WSGRB1_WGM1_WGMXCC1_WGMXCCGn1
    SolutionIndex: 110
    SolutionNameMin: Cijk_Ailk_Bjlk_HHS_BH_UserArgs_MT64x64x64_MI16x16x1_SN_LDSB0_CLR1_GSU0_GSUC0_GSUWGMRR0_K1_LBSPPA512_LBSPPB512_MIWT2_2_NLCA1_NLCB1_PLR2_SU32_SUM0_SUS256_SPO1_SVW2_SKXCCM0_VWA2_VWB2_WSGRA1_WSGRB1_WGM1_WGMXCC1_WGMXCCGn1
    SolutionIndex: 111
    SolutionNameMin: Cijk_Ailk_Bjlk_HHS_BH_UserArgs_MT64x32x64_MI16x16x1_SN_LDSB0_CLR1_GSU0_GSUC0_GSUWGMRR0_K1_LBSPPA512_LBSPPB256_MIWT2_1_NLCA2_NLCB1_PLR2_SU32_SUM0_SUS256_SPO1_SVW1_SKXCCM0_VWA1_VWB1_WSGRA0_WSGRB0_WGM1_WGMXCC1_WGMXCCGn1
    SolutionIndex: 112
    SolutionNameMin: Cijk_Ailk_Bjlk_HHS_BH_UserArgs_MT64x32x64_MI16x16x1_SN_LDSB0_CLR1_GSU0_GSUC0_GSUWGMRR0_K1_LBSPPA512_LBSPPB256_MIWT2_1_NLCA1_NLCB1_PLR2_SU32_SUM0_SUS256_SPO0_SVW1_SKXCCM0_VWA1_VWB1_WSGRA0_WSGRB0_WGM1_WGMXCC1_WGMXCCGn1
    SolutionIndex: 113
    SolutionNameMin: Cijk_Ailk_Bjlk_HHS_BH_UserArgs_MT64x64x64_MI16x16x1_SN_LDSB0_CLR1_GSU0_GSUC0_GSUWGMRR0_K1_LBSPPA512_LBSPPB512_MIWT2_2_NLCA1_NLCB2_PLR1_SU32_SUM0_SUS256_SPO1_SVW2_SKXCCM0_VWA2_VWB2_WSGRA0_WSGRB0_WGM1_WGMXCC1_WGMXCCGn1
    SolutionIndex: 114
    SolutionNameMin: Cijk_Ailk_Bjlk_HHS_BH_UserArgs_MT64x64x64_MI16x16x1_SN_LDSB0_CLR1_GSU0_GSUC0_GSUWGMRR0_K1_LBSPPA512_LBSPPB512_MIWT2_2_NLCA1_NLCB1_PLR3_SU32_SUM0_SUS256_SPO1_SVW2_SKXCCM8_VWA2_VWB2_WSGRA0_WSGRB1_WGM8_WGMXCC1_WGMXCCGn1
    SolutionIndex: 115
    SolutionNameMin: Cijk_Ailk_Bjlk_HHS_BH_UserArgs_MT64x64x64_MI16x16x1_SN_LDSB0_CLR1_GSU0_GSUC0_GSUWGMRR0_K1_LBSPPA512_LBSPPB512_MIWT2_2_NLCA1_NLCB1_PLR2_SU32_SUM0_SUS256_SPO0_SVW2_SKXCCM8_VWA2_VWB2_WSGRA1_WSGRB1_WGM8_WGMXCC1_WGMXCCGn1
    SolutionIndex: 116
    SolutionNameMin: Cijk_Ailk_Bjlk_HHS_BH_UserArgs_MT64x64x64_MI16x16x1_SN_LDSB0_CLR1_GSU0_GSUC0_GSUWGMRR0_K1_LBSPPA512_LBSPPB512_MIWT2_2_NLCA1_NLCB2_PLR1_SU32_SUM0_SUS256_SPO0_SVW2_SKXCCM8_VWA2_VWB2_WSGRA1_WSGRB0_WGM1_WGMXCC1_WGMXCCGn1
    SolutionIndex: 117
    SolutionNameMin: Cijk_Ailk_Bjlk_HHS_BH_UserArgs_MT64x128x64_MI16x16x1_SN_LDSB0_CLR1_GSU0_GSUC0_GSUWGMRR0_K1_LBSPPA512_LBSPPB1024_MIWT2_4_NLCA1_NLCB2_PLR2_SU32_SUM0_SUS256_SPO1_SVW2_SKXCCM8_VWA2_VWB2_WSGRA0_WSGRB1_WGM8_WGMXCC1_WGMXCCGn1
    SolutionIndex: 118
    SolutionNameMin: Cijk_Ailk_Bjlk_HHS_BH_UserArgs_MT64x128x64_MI16x16x1_SN_LDSB0_CLR1_GSU0_GSUC0_GSUWGMRR0_K1_LBSPPA512_LBSPPB1024_MIWT2_4_NLCA1_NLCB2_PLR2_SU32_SUM0_SUS256_SPO1_SVW2_SKXCCM8_VWA2_VWB2_WSGRA0_WSGRB0_WGM8_WGMXCC1_WGMXCCGn1
    SolutionIndex: 119
    SolutionNameMin: Cijk_Ailk_Bjlk_HHS_BH_UserArgs_MT128x128x64_MI16x16x1_SN_LDSB1_CLR1_GSU0_GSUC0_GSUWGMRR0_K1_LBSPPA1024_LBSPPB1024_MIWT4_4_NLCA2_NLCB1_PLR1_SU32_SUM0_SUS256_SPO1_SVW4_SKXCCM8_VWA4_VWB4_WSGRA0_WSGRB0_WGM1_WGMXCC1_WGMXCCGn1
    SolutionIndex: 120
    SolutionNameMin: Cijk_Ailk_Bjlk_HHS_BH_UserArgs_MT128x64x64_MI16x16x1_SN_LDSB0_CLR1_GSU0_GSUC0_GSUWGMRR0_K1_LBSPPA1024_LBSPPB512_MIWT4_2_NLCA2_NLCB1_PLR2_SU32_SUM0_SUS256_SPO1_SVW2_SKXCCM8_VWA2_VWB2_WSGRA1_WSGRB0_WGM8_WGMXCC1_WGMXCCGn1
    SolutionIndex: 121
    SolutionNameMin: Cijk_Ailk_Bjlk_HHS_BH_UserArgs_MT128x128x32_MI16x16x1_SN_LDSB0_CLR1_GSU0_GSUC0_GSUWGMRR0_K1_LBSPPA1024_LBSPPB1024_MIWT4_4_NLCA1_NLCB1_PLR1_SU32_SUM0_SUS256_SPO0_SVW4_SKXCCM8_VWA4_VWB4_WSGRA1_WSGRB1_WGM8_WGMXCC1_WGMXCCGn1
    SolutionIndex: 122
    SolutionNameMin: Cijk_Ailk_Bjlk_HHS_BH_UserArgs_MT128x128x64_MI16x16x1_SN_LDSB1_CLR1_GSU0_GSUC0_GSUWGMRR0_K1_LBSPPA1024_LBSPPB1024_MIWT4_4_NLCA1_NLCB1_PLR2_SU32_SUM0_SUS256_SPO1_SVW4_SKXCCM8_VWA4_VWB4_WSGRA1_WSGRB0_WGM8_WGMXCC1_WGMXCCGn1
    SolutionIndex: 123
    SolutionNameMin: Cijk_Ailk_Bjlk_HHS_BH_UserArgs_MT128x256x32_MI16x16x1_SN_LDSB1_CLR1_GSU0_GSUC0_GSUWGMRR0_K1_LBSPPA1024_LBSPPB2048_MIWT4_8_NLCA1_NLCB1_PLR1_SU32_SUM0_SUS256_SPO0_SVW4_SKXCCM8_VWA4_VWB4_WSGRA0_WSGRB0_WGM8_WGMXCC1_WGMXCCGn1
    SolutionIndex: 124
    SolutionNameMin: Cijk_Ailk_Bjlk_HHS_BH_UserArgs_MT128x64x64_MI16x16x1_SN_LDSB0_CLR1_GSU0_GSUC0_GSUWGMRR0_K1_LBSPPA1024_LBSPPB512_MIWT4_2_NLCA2_NLCB1_PLR2_SU32_SUM0_SUS256_SPO1_SVW2_SKXCCM0_VWA2_VWB2_WSGRA1_WSGRB0_WGM8_WGMXCC1_WGMXCCGn1
    SolutionIndex: 125
    SolutionNameMin: Cijk_Ailk_Bjlk_HHS_BH_UserArgs_MT128x128x64_MI16x16x1_SN_LDSB0_CLR1_GSU0_GSUC0_GSUWGMRR0_K1_LBSPPA1024_LBSPPB1024_MIWT4_4_NLCA1_NLCB2_PLR1_SU32_SUM0_SUS256_SPO0_SVW4_SKXCCM0_VWA4_VWB4_WSGRA1_WSGRB1_WGM8_WGMXCC1_WGMXCCGn1
    SolutionIndex: 126
    SolutionNameMin: Cijk_Ailk_Bjlk_HHS_BH_UserArgs_MT128x128x64_MI16x16x1_SN_LDSB1_CLR1_GSU0_GSUC0_GSUWGMRR0_K1_LBSPPA1024_LBSPPB1024_MIWT4_4_NLCA1_NLCB2_PLR1_SU32_SUM0_SUS256_SPO1_SVW4_SKXCCM8_VWA4_VWB4_WSGRA0_WSGRB0_WGM8_WGMXCC1_WGMXCCGn1
    SolutionIndex: 127
    SolutionNameMin: Cijk_Ailk_Bjlk_HHS_BH_UserArgs_MT128x128x64_MI16x16x1_SN_LDSB0_CLR1_GSU0_GSUC0_GSUWGMRR0_K1_LBSPPA1024_LBSPPB1024_MIWT4_4_NLCA2_NLCB1_PLR1_SU32_SUM0_SUS256_SPO0_SVW4_SKXCCM8_VWA4_VWB4_WSGRA0_WSGRB0_WGM1_WGMXCC1_WGMXCCGn1
    SolutionIndex: 128
    SolutionNameMin: Cijk_Ailk_Bjlk_HHS_BH_UserArgs_MT256x128x64_MI16x16x1_SN_LDSB1_CLR1_GSU0_GSUC0_GSUWGMRR0_K1_LBSPPA2048_LBSPPB1024_MIWT8_4_NLCA2_NLCB2_PLR1_SU32_SUM0_SUS256_SPO0_SVW4_SKXCCM8_VWA4_VWB4_WSGRA0_WSGRB0_WGM1_WGMXCC1_WGMXCCGn1
    SolutionIndex: 129
    SolutionNameMin: Cijk_Ailk_Bjlk_HHS_BH_UserArgs_MT128x256x64_MI16x16x1_SN_LDSB1_CLR1_GSU0_GSUC0_GSUWGMRR0_K1_LBSPPA1024_LBSPPB2048_MIWT4_8_NLCA2_NLCB1_PLR2_SU32_SUM0_SUS256_SPO1_SVW4_SKXCCM8_VWA4_VWB4_WSGRA1_WSGRB1_WGM8_WGMXCC1_WGMXCCGn1
    SolutionIndex: 130
    SolutionNameMin: Cijk_Ailk_Bjlk_HHS_BH_UserArgs_MT128x128x64_MI16x16x1_SN_LDSB1_CLR1_GSU0_GSUC0_GSUWGMRR0_K1_LBSPPA1024_LBSPPB1024_MIWT4_4_NLCA1_NLCB2_PLR1_SU32_SUM0_SUS256_SPO0_SVW4_SKXCCM0_VWA4_VWB4_WSGRA0_WSGRB1_WGM1_WGMXCC1_WGMXCCGn1
    SolutionIndex: 131
    SolutionNameMin: Cijk_Ailk_Bjlk_HHS_BH_UserArgs_MT128x64x64_MI16x16x1_SN_LDSB0_CLR1_GSU0_GSUC0_GSUWGMRR0_K1_LBSPPA1024_LBSPPB512_MIWT4_2_NLCA1_NLCB2_PLR2_SU32_SUM0_SUS256_SPO1_SVW2_SKXCCM8_VWA2_VWB2_WSGRA0_WSGRB0_WGM1_WGMXCC1_WGMXCCGn1
    SolutionIndex: 132
    SolutionNameMin: Cijk_Ailk_Bjlk_HHS_BH_UserArgs_MT128x128x64_MI16x16x1_SN_LDSB1_CLR1_GSU0_GSUC0_GSUWGMRR0_K1_LBSPPA1024_LBSPPB1024_MIWT4_4_NLCA1_NLCB2_PLR1_SU32_SUM0_SUS256_SPO1_SVW4_SKXCCM8_VWA4_VWB4_WSGRA0_WSGRB1_WGM1_WGMXCC1_WGMXCCGn1
    SolutionIndex: 133
    SolutionNameMin: Cijk_Ailk_Bjlk_HHS_BH_UserArgs_MT128x128x64_MI16x16x1_SN_LDSB1_CLR1_GSU0_GSUC0_GSUWGMRR0_K1_LBSPPA1024_LBSPPB1024_MIWT4_4_NLCA2_NLCB2_PLR1_SU32_SUM0_SUS256_SPO0_SVW4_SKXCCM8_VWA4_VWB4_WSGRA0_WSGRB1_WGM8_WGMXCC1_WGMXCCGn1
    SolutionIndex: 134
    SolutionNameMin: Cijk_Ailk_Bjlk_HHS_BH_UserArgs_MT256x128x32_MI16x16x1_SN_LDSB0_CLR1_GSU0_GSUC0_GSUWGMRR0_K1_LBSPPA2048_LBSPPB1024_MIWT8_4_NLCA1_NLCB1_PLR1_SU32_SUM0_SUS256_SPO1_SVW4_SKXCCM8_VWA4_VWB4_WSGRA1_WSGRB1_WGM1_WGMXCC1_WGMXCCGn1
    SolutionIndex: 135
    SolutionNameMin: Cijk_Ailk_Bjlk_HHS_BH_UserArgs_MT256x256x64_MI16x16x1_SN_LDSB1_CLR1_GSU0_GSUC0_GSUWGMRR0_K1_LBSPPA2048_LBSPPB2048_MIWT8_8_NLCA2_NLCB1_PLR3_SU32_SUM0_SUS256_SPO0_SVW4_SKXCCM8_VWA4_VWB4_WSGRA0_WSGRB0_WGM8_WGMXCC1_WGMXCCGn1
    SolutionIndex: 136
    SolutionNameMin: Cijk_Ailk_Bjlk_HHS_BH_UserArgs_MT256x256x64_MI16x16x1_SN_LDSB1_CLR1_GSU0_GSUC0_GSUWGMRR0_K1_LBSPPA2048_LBSPPB2048_MIWT8_8_NLCA2_NLCB1_PLR1_SU32_SUM0_SUS256_SPO0_SVW4_SKXCCM8_VWA4_VWB4_WSGRA1_WSGRB0_WGM1_WGMXCC1_WGMXCCGn1
    SolutionIndex: 137
    SolutionNameMin: Cijk_Ailk_Bjlk_HHS_BH_UserArgs_MT256x128x64_MI16x16x1_SN_LDSB1_CLR1_GSU0_GSUC0_GSUWGMRR0_K1_LBSPPA2048_LBSPPB1024_MIWT8_4_NLCA2_NLCB2_PLR1_SU32_SUM0_SUS256_SPO0_SVW4_SKXCCM0_VWA4_VWB4_WSGRA1_WSGRB1_WGM1_WGMXCC1_WGMXCCGn1
    SolutionIndex: 138
    SolutionNameMin: Cijk_Ailk_Bjlk_HHS_BH_UserArgs_MT128x128x64_MI16x16x1_SN_LDSB1_CLR1_GSU0_GSUC0_GSUWGMRR0_K1_LBSPPA1024_LBSPPB1024_MIWT4_4_NLCA2_NLCB1_PLR1_SU32_SUM0_SUS256_SPO0_SVW4_SKXCCM8_VWA4_VWB4_WSGRA1_WSGRB0_WGM1_WGMXCC1_WGMXCCGn1
    SolutionIndex: 139
    SolutionNameMin: Cijk_Ailk_Bjlk_HHS_BH_UserArgs_MT128x256x32_MI16x16x1_SN_LDSB0_CLR1_GSU0_GSUC0_GSUWGMRR0_K1_LBSPPA1024_LBSPPB2048_MIWT4_8_NLCA1_NLCB1_PLR1_SU32_SUM0_SUS256_SPO0_SVW4_SKXCCM8_VWA4_VWB4_WSGRA1_WSGRB1_WGM1_WGMXCC1_WGMXCCGn1
    SolutionIndex: 140
    SolutionNameMin: Cijk_Ailk_Bjlk_HHS_BH_UserArgs_MT128x256x32_MI16x16x1_SN_LDSB1_CLR1_GSU0_GSUC0_GSUWGMRR0_K1_LBSPPA1024_LBSPPB2048_MIWT4_8_NLCA1_NLCB1_PLR1_SU32_SUM0_SUS256_SPO1_SVW4_SKXCCM8_VWA4_VWB4_WSGRA0_WSGRB0_WGM1_WGMXCC1_WGMXCCGn1
    SolutionIndex: 141
    SolutionNameMin: Cijk_Ailk_Bjlk_HHS_BH_UserArgs_MT256x256x32_MI16x16x1_SN_LDSB1_CLR1_GSU0_GSUC0_GSUWGMRR0_K1_LBSPPA2048_LBSPPB2048_MIWT8_8_NLCA2_NLCB2_PLR1_SU32_SUM0_SUS256_SPO0_SVW4_SKXCCM8_VWA4_VWB4_WSGRA0_WSGRB1_WGM1_WGMXCC1_WGMXCCGn1
    SolutionIndex: 142
    SolutionNameMin: Cijk_Ailk_Bjlk_HHS_BH_UserArgs_MT256x256x64_MI16x16x1_SN_LDSB1_CLR1_GSU0_GSUC0_GSUWGMRR0_K1_LBSPPA2048_LBSPPB2048_MIWT8_8_NLCA2_NLCB1_PLR1_SU32_SUM0_SUS256_SPO1_SVW4_SKXCCM0_VWA4_VWB4_WSGRA1_WSGRB0_WGM8_WGMXCC1_WGMXCCGn1
    SolutionIndex: 143
    SolutionNameMin: Cijk_Ailk_Bjlk_HHS_BH_UserArgs_MT32x64x64_MI16x16x1_SN_LDSB0_CLR1_GSU0_GSUC0_GSUWGMRR0_K1_LBSPPA256_LBSPPB512_MIWT1_2_NLCA1_NLCB1_PLR2_SU32_SUM0_SUS256_SPO1_SVW1_SKXCCM8_VWA1_VWB1_WSGRA0_WSGRB0_WGM1_WGMXCC1_WGMXCCGn1
    SolutionIndex: 144
    SolutionNameMin: Cijk_Ailk_Bjlk_HHS_BH_UserArgs_MT64x128x64_MI16x16x1_SN_LDSB0_CLR1_GSU0_GSUC0_GSUWGMRR0_K1_LBSPPA512_LBSPPB1024_MIWT2_4_NLCA1_NLCB2_PLR2_SU32_SUM0_SUS256_SPO1_SVW2_SKXCCM0_VWA2_VWB2_WSGRA0_WSGRB0_WGM1_WGMXCC1_WGMXCCGn1
    SolutionIndex: 145
    SolutionNameMin: Cijk_Ailk_Bjlk_HHS_BH_UserArgs_MT64x64x64_MI16x16x1_SN_LDSB0_CLR1_GSU0_GSUC0_GSUWGMRR0_K1_LBSPPA512_LBSPPB512_MIWT2_2_NLCA2_NLCB1_PLR1_SU32_SUM0_SUS256_SPO0_SVW2_SKXCCM8_VWA2_VWB2_WSGRA1_WSGRB0_WGM1_WGMXCC1_WGMXCCGn1
    SolutionIndex: 146
    SolutionNameMin: Cijk_Ailk_Bjlk_HHS_BH_UserArgs_MT64x64x64_MI16x16x1_SN_LDSB0_CLR1_GSU0_GSUC0_GSUWGMRR0_K1_LBSPPA512_LBSPPB512_MIWT2_2_NLCA1_NLCB1_PLR2_SU32_SUM0_SUS256_SPO0_SVW2_SKXCCM8_VWA2_VWB2_WSGRA0_WSGRB0_WGM8_WGMXCC1_WGMXCCGn1
    SolutionIndex: 147
    SolutionNameMin: Cijk_Ailk_Bjlk_HHS_BH_UserArgs_MT64x128x64_MI16x16x1_SN_LDSB0_CLR1_GSU0_GSUC0_GSUWGMRR0_K1_LBSPPA512_LBSPPB1024_MIWT2_4_NLCA1_NLCB2_PLR2_SU32_SUM0_SUS256_SPO0_SVW2_SKXCCM8_VWA2_VWB2_WSGRA0_WSGRB0_WGM8_WGMXCC1_WGMXCCGn1
    SolutionIndex: 148
    SolutionNameMin: Cijk_Ailk_Bjlk_HHS_BH_UserArgs_MT128x128x64_MI16x16x1_SN_LDSB1_CLR1_GSU0_GSUC0_GSUWGMRR0_K1_LBSPPA1024_LBSPPB1024_MIWT4_4_NLCA1_NLCB1_PLR1_SU32_SUM0_SUS256_SPO1_SVW4_SKXCCM0_VWA4_VWB4_WSGRA1_WSGRB1_WGM1_WGMXCC1_WGMXCCGn1
    SolutionIndex: 149
    SolutionNameMin: Cijk_Ailk_Bjlk_HHS_BH_UserArgs_MT128x128x64_MI16x16x1_SN_LDSB1_CLR1_GSU0_GSUC0_GSUWGMRR0_K1_LBSPPA1024_LBSPPB1024_MIWT4_4_NLCA2_NLCB1_PLR1_SU32_SUM0_SUS256_SPO0_SVW4_SKXCCM8_VWA4_VWB4_WSGRA0_WSGRB0_WGM8_WGMXCC1_WGMXCCGn1
    SolutionIndex: 150
    SolutionNameMin: Cijk_Ailk_Bjlk_HHS_BH_UserArgs_MT64x64x32_MI16x16x1_SN_LDSB0_CLR1_GSU0_GSUC0_GSUWGMRR0_K1_LBSPPA512_LBSPPB512_MIWT2_2_NLCA1_NLCB1_PLR1_SU32_SUM0_SUS256_SPO0_SVW2_SKXCCM8_VWA2_VWB2_WSGRA0_WSGRB0_WGM1_WGMXCC1_WGMXCCGn1
    SolutionIndex: 151
    SolutionNameMin: Cijk_Ailk_Bjlk_HHS_BH_UserArgs_MT128x64x64_MI16x16x1_SN_LDSB0_CLR1_GSU0_GSUC0_GSUWGMRR0_K1_LBSPPA1024_LBSPPB512_MIWT4_2_NLCA1_NLCB1_PLR2_SU32_SUM0_SUS256_SPO1_SVW2_SKXCCM8_VWA2_VWB2_WSGRA0_WSGRB0_WGM8_WGMXCC1_WGMXCCGn1
    SolutionIndex: 152
    SolutionNameMin: Cijk_Ailk_Bjlk_HHS_BH_UserArgs_MT128x128x64_MI16x16x1_SN_LDSB1_CLR1_GSU0_GSUC0_GSUWGMRR0_K1_LBSPPA1024_LBSPPB1024_MIWT4_4_NLCA1_NLCB2_PLR1_SU32_SUM0_SUS256_SPO1_SVW4_SKXCCM8_VWA4_VWB4_WSGRA0_WSGRB1_WGM8_WGMXCC1_WGMXCCGn1
    SolutionIndex: 153
    SolutionNameMin: Cijk_Ailk_Bjlk_HHS_BH_UserArgs_MT128x128x64_MI16x16x1_SN_LDSB1_CLR1_GSU0_GSUC0_GSUWGMRR0_K1_LBSPPA1024_LBSPPB1024_MIWT4_4_NLCA2_NLCB2_PLR1_SU32_SUM0_SUS256_SPO0_SVW4_SKXCCM8_VWA4_VWB4_WSGRA1_WSGRB1_WGM8_WGMXCC1_WGMXCCGn1
    SolutionIndex: 154
    SolutionNameMin: Cijk_Ailk_Bjlk_HHS_BH_UserArgs_MT128x256x32_MI16x16x1_SN_LDSB1_CLR1_GSU0_GSUC0_GSUWGMRR0_K1_LBSPPA1024_LBSPPB2048_MIWT4_8_NLCA1_NLCB2_PLR1_SU32_SUM0_SUS256_SPO0_SVW4_SKXCCM8_VWA4_VWB4_WSGRA0_WSGRB0_WGM1_WGMXCC1_WGMXCCGn1
    SolutionIndex: 155
    SolutionNameMin: Cijk_Ailk_Bjlk_HHS_BH_UserArgs_MT128x64x64_MI16x16x1_SN_LDSB0_CLR1_GSU0_GSUC0_GSUWGMRR0_K1_LBSPPA1024_LBSPPB512_MIWT4_2_NLCA1_NLCB1_PLR2_SU32_SUM0_SUS256_SPO0_SVW2_SKXCCM0_VWA2_VWB2_WSGRA1_WSGRB0_WGM8_WGMXCC1_WGMXCCGn1
    SolutionIndex: 156
    SolutionNameMin: Cijk_Ailk_Bjlk_HHS_BH_UserArgs_MT128x128x64_MI16x16x1_SN_LDSB0_CLR1_GSU0_GSUC0_GSUWGMRR0_K1_LBSPPA1024_LBSPPB1024_MIWT4_4_NLCA2_NLCB2_PLR1_SU32_SUM0_SUS256_SPO0_SVW4_SKXCCM0_VWA4_VWB4_WSGRA0_WSGRB0_WGM8_WGMXCC1_WGMXCCGn1
    SolutionIndex: 157
    SolutionNameMin: Cijk_Ailk_Bjlk_HHS_BH_UserArgs_MT128x64x64_MI16x16x1_SN_LDSB0_CLR1_GSU0_GSUC0_GSUWGMRR0_K1_LBSPPA1024_LBSPPB512_MIWT4_2_NLCA1_NLCB1_PLR2_SU32_SUM0_SUS256_SPO0_SVW2_SKXCCM8_VWA2_VWB2_WSGRA1_WSGRB0_WGM8_WGMXCC1_WGMXCCGn1
    SolutionIndex: 158
    SolutionNameMin: Cijk_Ailk_Bjlk_HHS_BH_UserArgs_MT128x128x64_MI16x16x1_SN_LDSB1_CLR1_GSU0_GSUC0_GSUWGMRR0_K1_LBSPPA1024_LBSPPB1024_MIWT4_4_NLCA1_NLCB1_PLR1_SU32_SUM0_SUS256_SPO1_SVW4_SKXCCM8_VWA4_VWB4_WSGRA0_WSGRB0_WGM8_WGMXCC1_WGMXCCGn1
    SolutionIndex: 159
    SolutionNameMin: Cijk_Ailk_Bjlk_HHS_BH_UserArgs_MT128x128x64_MI16x16x1_SN_LDSB1_CLR1_GSU0_GSUC0_GSUWGMRR0_K1_LBSPPA1024_LBSPPB1024_MIWT4_4_NLCA1_NLCB2_PLR1_SU32_SUM0_SUS256_SPO0_SVW4_SKXCCM8_VWA4_VWB4_WSGRA1_WSGRB0_WGM8_WGMXCC1_WGMXCCGn1
    SolutionIndex: 160
    SolutionNameMin: Cijk_Ailk_Bjlk_HHS_BH_UserArgs_MT128x256x32_MI16x16x1_SN_LDSB1_CLR1_GSU0_GSUC0_GSUWGMRR0_K1_LBSPPA1024_LBSPPB2048_MIWT4_8_NLCA1_NLCB2_PLR1_SU32_SUM0_SUS256_SPO1_SVW4_SKXCCM8_VWA4_VWB4_WSGRA0_WSGRB1_WGM8_WGMXCC1_WGMXCCGn1
    SolutionIndex: 161
    SolutionNameMin: Cijk_Ailk_Bjlk_HHS_BH_UserArgs_MT256x256x64_MI16x16x1_SN_LDSB1_CLR1_GSU0_GSUC0_GSUWGMRR0_K1_LBSPPA2048_LBSPPB2048_MIWT8_8_NLCA2_NLCB2_PLR1_SU32_SUM0_SUS256_SPO0_SVW4_SKXCCM8_VWA4_VWB4_WSGRA1_WSGRB0_WGM1_WGMXCC1_WGMXCCGn1
    SolutionIndex: 162
    SolutionNameMin: Cijk_Ailk_Bjlk_HHS_BH_UserArgs_MT128x128x64_MI16x16x1_SN_LDSB1_CLR1_GSU0_GSUC0_GSUWGMRR0_K1_LBSPPA1024_LBSPPB1024_MIWT4_4_NLCA1_NLCB1_PLR1_SU32_SUM0_SUS256_SPO1_SVW4_SKXCCM0_VWA4_VWB4_WSGRA0_WSGRB0_WGM8_WGMXCC1_WGMXCCGn1
    SolutionIndex: 163
    SolutionNameMin: Cijk_Ailk_Bjlk_HHS_BH_UserArgs_MT128x128x64_MI16x16x1_SN_LDSB0_CLR1_GSU0_GSUC0_GSUWGMRR0_K1_LBSPPA1024_LBSPPB1024_MIWT4_4_NLCA2_NLCB2_PLR1_SU32_SUM0_SUS256_SPO0_SVW4_SKXCCM8_VWA4_VWB4_WSGRA0_WSGRB1_WGM1_WGMXCC1_WGMXCCGn1
    SolutionIndex: 164
    SolutionNameMin: Cijk_Ailk_Bjlk_HHS_BH_UserArgs_MT128x128x64_MI16x16x1_SN_LDSB1_CLR1_GSU0_GSUC0_GSUWGMRR0_K1_LBSPPA1024_LBSPPB1024_MIWT4_4_NLCA1_NLCB1_PLR1_SU32_SUM0_SUS256_SPO1_SVW4_SKXCCM8_VWA4_VWB4_WSGRA1_WSGRB0_WGM8_WGMXCC1_WGMXCCGn1
    SolutionIndex: 165
    SolutionNameMin: Cijk_Ailk_Bjlk_HHS_BH_UserArgs_MT128x128x64_MI16x16x1_SN_LDSB1_CLR1_GSU0_GSUC0_GSUWGMRR0_K1_LBSPPA1024_LBSPPB1024_MIWT4_4_NLCA2_NLCB1_PLR1_SU32_SUM0_SUS256_SPO1_SVW4_SKXCCM8_VWA4_VWB4_WSGRA0_WSGRB1_WGM8_WGMXCC1_WGMXCCGn1
    SolutionIndex: 166
    SolutionNameMin: Cijk_Ailk_Bjlk_HHS_BH_UserArgs_MT256x256x64_MI16x16x1_SN_LDSB1_CLR1_GSU0_GSUC0_GSUWGMRR0_K1_LBSPPA2048_LBSPPB2048_MIWT8_8_NLCA2_NLCB1_PLR2_SU32_SUM0_SUS256_SPO0_SVW4_SKXCCM8_VWA4_VWB4_WSGRA0_WSGRB0_WGM8_WGMXCC1_WGMXCCGn1
    SolutionIndex: 167
    SolutionNameMin: Cijk_Ailk_Bjlk_HHS_BH_UserArgs_MT256x256x64_MI16x16x1_SN_LDSB1_CLR1_GSU0_GSUC0_GSUWGMRR0_K1_LBSPPA2048_LBSPPB2048_MIWT8_8_NLCA2_NLCB2_PLR1_SU32_SUM0_SUS256_SPO0_SVW4_SKXCCM8_VWA4_VWB4_WSGRA1_WSGRB1_WGM8_WGMXCC1_WGMXCCGn1
    SolutionIndex: 168
    SolutionNameMin: Cijk_Ailk_Bjlk_HHS_BH_UserArgs_MT128x256x64_MI16x16x1_SN_LDSB1_CLR1_GSU0_GSUC0_GSUWGMRR0_K1_LBSPPA1024_LBSPPB2048_MIWT4_8_NLCA1_NLCB2_PLR1_SU32_SUM0_SUS256_SPO1_SVW4_SKXCCM0_VWA4_VWB4_WSGRA1_WSGRB1_WGM8_WGMXCC1_WGMXCCGn1
    SolutionIndex: 169
    SolutionNameMin: Cijk_Ailk_Bjlk_HHS_BH_UserArgs_MT128x128x64_MI16x16x1_SN_LDSB1_CLR1_GSU0_GSUC0_GSUWGMRR0_K1_LBSPPA1024_LBSPPB1024_MIWT4_4_NLCA1_NLCB1_PLR1_SU32_SUM0_SUS256_SPO1_SVW4_SKXCCM8_VWA4_VWB4_WSGRA1_WSGRB0_WGM1_WGMXCC1_WGMXCCGn1
    SolutionIndex: 170
    SolutionNameMin: Cijk_Ailk_Bjlk_HHS_BH_UserArgs_MT128x256x32_MI16x16x1_SN_LDSB1_CLR1_GSU0_GSUC0_GSUWGMRR0_K1_LBSPPA1024_LBSPPB2048_MIWT4_8_NLCA2_NLCB1_PLR1_SU32_SUM0_SUS256_SPO0_SVW4_SKXCCM8_VWA4_VWB4_WSGRA1_WSGRB0_WGM8_WGMXCC1_WGMXCCGn1
    SolutionIndex: 171
    SolutionNameMin: Cijk_Ailk_Bjlk_HHS_BH_UserArgs_MT128x256x64_MI16x16x1_SN_LDSB1_CLR1_GSU0_GSUC0_GSUWGMRR0_K1_LBSPPA1024_LBSPPB2048_MIWT4_8_NLCA2_NLCB1_PLR2_SU32_SUM0_SUS256_SPO0_SVW4_SKXCCM8_VWA4_VWB4_WSGRA0_WSGRB0_WGM8_WGMXCC1_WGMXCCGn1
    SolutionIndex: 172
    SolutionNameMin: Cijk_Ailk_Bjlk_HHS_BH_UserArgs_MT128x256x64_MI16x16x1_SN_LDSB1_CLR1_GSU0_GSUC0_GSUWGMRR0_K1_LBSPPA1024_LBSPPB2048_MIWT4_8_NLCA2_NLCB1_PLR2_SU32_SUM0_SUS256_SPO1_SVW4_SKXCCM8_VWA4_VWB4_WSGRA1_WSGRB1_WGM1_WGMXCC1_WGMXCCGn1
    SolutionIndex: 173
    SolutionNameMin: Cijk_Ailk_Bjlk_HHS_BH_UserArgs_MT256x256x64_MI16x16x1_SN_LDSB1_CLR1_GSU0_GSUC0_GSUWGMRR0_K1_LBSPPA2048_LBSPPB2048_MIWT8_8_NLCA1_NLCB2_PLR1_SU32_SUM0_SUS256_SPO0_SVW4_SKXCCM8_VWA4_VWB4_WSGRA1_WSGRB1_WGM1_WGMXCC1_WGMXCCGn1
    SolutionIndex: 174
    SolutionNameMin: Cijk_Ailk_Bjlk_HHS_BH_UserArgs_MT256x256x64_MI16x16x1_SN_LDSB1_CLR1_GSU0_GSUC0_GSUWGMRR0_K1_LBSPPA2048_LBSPPB2048_MIWT8_8_NLCA1_NLCB2_PLR3_SU32_SUM0_SUS256_SPO1_SVW4_SKXCCM8_VWA4_VWB4_WSGRA0_WSGRB0_WGM1_WGMXCC1_WGMXCCGn1
    SolutionIndex: 175
    SolutionNameMin: Cijk_Ailk_Bjlk_HHS_BH_UserArgs_MT256x128x64_MI16x16x1_SN_LDSB1_CLR1_GSU0_GSUC0_GSUWGMRR0_K1_LBSPPA2048_LBSPPB1024_MIWT8_4_NLCA1_NLCB1_PLR3_SU32_SUM0_SUS256_SPO1_SVW4_SKXCCM8_VWA4_VWB4_WSGRA0_WSGRB1_WGM8_WGMXCC1_WGMXCCGn1
    SolutionIndex: 176
    SolutionNameMin: Cijk_Ailk_Bjlk_HHS_BH_UserArgs_MT128x256x32_MI16x16x1_SN_LDSB0_CLR1_GSU0_GSUC0_GSUWGMRR0_K1_LBSPPA1024_LBSPPB2048_MIWT4_8_NLCA1_NLCB2_PLR1_SU32_SUM0_SUS256_SPO1_SVW4_SKXCCM8_VWA4_VWB4_WSGRA1_WSGRB1_WGM1_WGMXCC1_WGMXCCGn1
    SolutionIndex: 177
    SolutionNameMin: Cijk_Ailk_Bjlk_HHS_BH_UserArgs_MT256x256x32_MI16x16x1_SN_LDSB1_CLR1_GSU0_GSUC0_GSUWGMRR0_K1_LBSPPA2048_LBSPPB2048_MIWT8_8_NLCA1_NLCB1_PLR1_SU32_SUM0_SUS256_SPO1_SVW4_SKXCCM8_VWA4_VWB4_WSGRA0_WSGRB0_WGM1_WGMXCC1_WGMXCCGn1
    SolutionIndex: 178
    SolutionNameMin: Cijk_Ailk_Bjlk_HHS_BH_UserArgs_MT256x256x32_MI16x16x1_SN_LDSB1_CLR1_GSU0_GSUC0_GSUWGMRR0_K1_LBSPPA2048_LBSPPB2048_MIWT8_8_NLCA2_NLCB1_PLR1_SU32_SUM0_SUS256_SPO0_SVW4_SKXCCM8_VWA4_VWB4_WSGRA1_WSGRB1_WGM1_WGMXCC1_WGMXCCGn1
    SolutionIndex: 179
    SolutionNameMin: Cijk_Ailk_Bjlk_HHS_BH_UserArgs_MT256x256x64_MI16x16x1_SN_LDSB1_CLR1_GSU0_GSUC0_GSUWGMRR0_K1_LBSPPA2048_LBSPPB2048_MIWT8_8_NLCA2_NLCB1_PLR3_SU32_SUM0_SUS256_SPO0_SVW4_SKXCCM8_VWA4_VWB4_WSGRA0_WSGRB1_WGM1_WGMXCC1_WGMXCCGn1
    SolutionIndex: 180
    SolutionNameMin: Cijk_Ailk_Bjlk_HHS_BH_UserArgs_MT256x256x32_MI16x16x1_SN_LDSB1_CLR1_GSU0_GSUC0_GSUWGMRR0_K1_LBSPPA2048_LBSPPB2048_MIWT8_8_NLCA2_NLCB2_PLR1_SU32_SUM0_SUS256_SPO1_SVW8_SKXCCM8_VWA8_VWB8_WSGRA1_WSGRB1_WGM1_WGMXCC1_WGMXCCGn1
    SolutionIndex: 181
    SolutionNameMin: Cijk_Ailk_Bjlk_HHS_BH_UserArgs_MT64x128x64_MI16x16x1_SN_LDSB0_CLR1_GSU0_GSUC0_GSUWGMRR0_K1_LBSPPA512_LBSPPB1024_MIWT2_4_NLCA1_NLCB1_PLR2_SU32_SUM0_SUS256_SPO0_SVW2_SKXCCM0_VWA2_VWB2_WSGRA0_WSGRB1_WGM1_WGMXCC1_WGMXCCGn1
    SolutionIndex: 182
    SolutionNameMin: Cijk_Ailk_Bjlk_HHS_BH_UserArgs_MT128x128x32_MI16x16x1_SN_LDSB0_CLR1_GSU0_GSUC0_GSUWGMRR0_K1_LBSPPA1024_LBSPPB1024_MIWT4_4_NLCA1_NLCB1_PLR1_SU32_SUM0_SUS256_SPO1_SVW4_SKXCCM0_VWA4_VWB4_WSGRA0_WSGRB0_WGM1_WGMXCC1_WGMXCCGn1
    SolutionIndex: 183
    SolutionNameMin: Cijk_Ailk_Bjlk_HHS_BH_UserArgs_MT128x128x64_MI16x16x1_SN_LDSB1_CLR1_GSU0_GSUC0_GSUWGMRR0_K1_LBSPPA1024_LBSPPB1024_MIWT4_4_NLCA2_NLCB1_PLR1_SU32_SUM0_SUS256_SPO0_SVW4_SKXCCM8_VWA4_VWB4_WSGRA1_WSGRB1_WGM1_WGMXCC1_WGMXCCGn1
    SolutionIndex: 184
    SolutionNameMin: Cijk_Ailk_Bjlk_HHS_BH_UserArgs_MT64x64x32_MI16x16x1_SN_LDSB0_CLR1_GSU0_GSUC0_GSUWGMRR0_K1_LBSPPA512_LBSPPB512_MIWT2_2_NLCA1_NLCB1_PLR1_SU32_SUM0_SUS256_SPO0_SVW2_SKXCCM8_VWA2_VWB2_WSGRA1_WSGRB1_WGM1_WGMXCC1_WGMXCCGn1
    SolutionIndex: 185
    SolutionNameMin: Cijk_Ailk_Bjlk_HHS_BH_UserArgs_MT128x64x64_MI16x16x1_SN_LDSB0_CLR1_GSU0_GSUC0_GSUWGMRR0_K1_LBSPPA1024_LBSPPB512_MIWT4_2_NLCA2_NLCB1_PLR2_SU32_SUM0_SUS256_SPO1_SVW2_SKXCCM8_VWA2_VWB2_WSGRA0_WSGRB1_WGM8_WGMXCC1_WGMXCCGn1
    SolutionIndex: 186
    SolutionNameMin: Cijk_Ailk_Bjlk_HHS_BH_UserArgs_MT128x128x32_MI16x16x1_SN_LDSB0_CLR1_GSU0_GSUC0_GSUWGMRR0_K1_LBSPPA1024_LBSPPB1024_MIWT4_4_NLCA1_NLCB2_PLR1_SU32_SUM0_SUS256_SPO1_SVW4_SKXCCM0_VWA4_VWB4_WSGRA1_WSGRB0_WGM1_WGMXCC1_WGMXCCGn1
    SolutionIndex: 187
    SolutionNameMin: Cijk_Ailk_Bjlk_HHS_BH_UserArgs_MT128x128x64_MI16x16x1_SN_LDSB0_CLR1_GSU0_GSUC0_GSUWGMRR0_K1_LBSPPA1024_LBSPPB1024_MIWT4_4_NLCA2_NLCB1_PLR2_SU32_SUM0_SUS256_SPO1_SVW4_SKXCCM8_VWA4_VWB4_WSGRA1_WSGRB1_WGM1_WGMXCC1_WGMXCCGn1
    SolutionIndex: 188
    SolutionNameMin: Cijk_Ailk_Bjlk_HHS_BH_UserArgs_MT128x256x32_MI16x16x1_SN_LDSB1_CLR1_GSU0_GSUC0_GSUWGMRR0_K1_LBSPPA1024_LBSPPB2048_MIWT4_8_NLCA1_NLCB1_PLR1_SU32_SUM0_SUS256_SPO1_SVW4_SKXCCM0_VWA4_VWB4_WSGRA0_WSGRB0_WGM1_WGMXCC1_WGMXCCGn1
    SolutionIndex: 189
    SolutionNameMin: Cijk_Ailk_Bjlk_HHS_BH_UserArgs_MT64x128x64_MI16x16x1_SN_LDSB0_CLR1_GSU0_GSUC0_GSUWGMRR0_K1_LBSPPA512_LBSPPB1024_MIWT2_4_NLCA1_NLCB2_PLR2_SU32_SUM0_SUS256_SPO0_SVW2_SKXCCM0_VWA2_VWB2_WSGRA1_WSGRB0_WGM8_WGMXCC1_WGMXCCGn1
    SolutionIndex: 190
    SolutionNameMin: Cijk_Ailk_Bjlk_HHS_BH_UserArgs_MT128x128x64_MI16x16x1_SN_LDSB1_CLR1_GSU0_GSUC0_GSUWGMRR0_K1_LBSPPA1024_LBSPPB1024_MIWT4_4_NLCA1_NLCB2_PLR1_SU32_SUM0_SUS256_SPO1_SVW4_SKXCCM0_VWA4_VWB4_WSGRA0_WSGRB0_WGM1_WGMXCC1_WGMXCCGn1
    SolutionIndex: 191
    SolutionNameMin: Cijk_Ailk_Bjlk_HHS_BH_UserArgs_MT128x128x64_MI16x16x1_SN_LDSB1_CLR1_GSU0_GSUC0_GSUWGMRR0_K1_LBSPPA1024_LBSPPB1024_MIWT4_4_NLCA2_NLCB2_PLR1_SU32_SUM0_SUS256_SPO0_SVW4_SKXCCM8_VWA4_VWB4_WSGRA0_WSGRB0_WGM8_WGMXCC1_WGMXCCGn1
    SolutionIndex: 192
    SolutionNameMin: Cijk_Ailk_Bjlk_HHS_BH_UserArgs_MT128x128x64_MI16x16x1_SN_LDSB1_CLR1_GSU0_GSUC0_GSUWGMRR0_K1_LBSPPA1024_LBSPPB1024_MIWT4_4_NLCA1_NLCB1_PLR1_SU32_SUM0_SUS256_SPO0_SVW4_SKXCCM8_VWA4_VWB4_WSGRA0_WSGRB1_WGM8_WGMXCC1_WGMXCCGn1
    SolutionIndex: 193
    SolutionNameMin: Cijk_Ailk_Bjlk_HHS_BH_UserArgs_MT128x128x64_MI16x16x1_SN_LDSB1_CLR1_GSU0_GSUC0_GSUWGMRR0_K1_LBSPPA1024_LBSPPB1024_MIWT4_4_NLCA1_NLCB2_PLR1_SU32_SUM0_SUS256_SPO0_SVW4_SKXCCM8_VWA4_VWB4_WSGRA1_WSGRB1_WGM1_WGMXCC1_WGMXCCGn1
    SolutionIndex: 194
    SolutionNameMin: Cijk_Ailk_Bjlk_HHS_BH_UserArgs_MT128x256x64_MI16x16x1_SN_LDSB1_CLR1_GSU0_GSUC0_GSUWGMRR0_K1_LBSPPA1024_LBSPPB2048_MIWT4_8_NLCA1_NLCB2_PLR3_SU32_SUM0_SUS256_SPO0_SVW4_SKXCCM0_VWA4_VWB4_WSGRA1_WSGRB1_WGM8_WGMXCC1_WGMXCCGn1
    SolutionIndex: 195
    SolutionNameMin: Cijk_Ailk_Bjlk_HHS_BH_UserArgs_MT128x256x64_MI16x16x1_SN_LDSB1_CLR1_GSU0_GSUC0_GSUWGMRR0_K1_LBSPPA1024_LBSPPB2048_MIWT4_8_NLCA1_NLCB1_PLR1_SU32_SUM0_SUS256_SPO0_SVW4_SKXCCM0_VWA4_VWB4_WSGRA0_WSGRB0_WGM1_WGMXCC1_WGMXCCGn1
    SolutionIndex: 196
    SolutionNameMin: Cijk_Ailk_Bjlk_HHS_BH_UserArgs_MT128x128x64_MI16x16x1_SN_LDSB0_CLR1_GSU0_GSUC0_GSUWGMRR0_K1_LBSPPA1024_LBSPPB1024_MIWT4_4_NLCA2_NLCB2_PLR2_SU32_SUM0_SUS256_SPO0_SVW4_SKXCCM0_VWA4_VWB4_WSGRA0_WSGRB0_WGM1_WGMXCC1_WGMXCCGn1
    SolutionIndex: 197
    SolutionNameMin: Cijk_Ailk_Bjlk_HHS_BH_UserArgs_MT128x128x64_MI16x16x1_SN_LDSB1_CLR1_GSU0_GSUC0_GSUWGMRR0_K1_LBSPPA1024_LBSPPB1024_MIWT4_4_NLCA2_NLCB2_PLR1_SU32_SUM0_SUS256_SPO0_SVW4_SKXCCM8_VWA4_VWB4_WSGRA0_WSGRB1_WGM1_WGMXCC1_WGMXCCGn1
    SolutionIndex: 198
    SolutionNameMin: Cijk_Ailk_Bjlk_HHS_BH_UserArgs_MT128x128x64_MI16x16x1_SN_LDSB1_CLR1_GSU0_GSUC0_GSUWGMRR0_K1_LBSPPA1024_LBSPPB1024_MIWT4_4_NLCA1_NLCB1_PLR1_SU32_SUM0_SUS256_SPO1_SVW4_SKXCCM8_VWA4_VWB4_WSGRA0_WSGRB1_WGM8_WGMXCC1_WGMXCCGn1
    SolutionIndex: 199
    SolutionNameMin: Cijk_Ailk_Bjlk_HHS_BH_UserArgs_MT128x128x64_MI16x16x1_SN_LDSB0_CLR1_GSU0_GSUC0_GSUWGMRR0_K1_LBSPPA1024_LBSPPB1024_MIWT4_4_NLCA1_NLCB2_PLR1_SU32_SUM0_SUS256_SPO1_SVW4_SKXCCM8_VWA4_VWB4_WSGRA1_WSGRB0_WGM8_WGMXCC1_WGMXCCGn1
    SolutionIndex: 200
    SolutionNameMin: Cijk_Ailk_Bjlk_HHS_BH_UserArgs_MT256x128x32_MI16x16x1_SN_LDSB1_CLR1_GSU0_GSUC0_GSUWGMRR0_K1_LBSPPA2048_LBSPPB1024_MIWT8_4_NLCA1_NLCB2_PLR1_SU32_SUM0_SUS256_SPO0_SVW4_SKXCCM8_VWA4_VWB4_WSGRA0_WSGRB0_WGM8_WGMXCC1_WGMXCCGn1
    SolutionIndex: 201
    SolutionNameMin: Cijk_Ailk_Bjlk_HHS_BH_UserArgs_MT128x256x64_MI16x16x1_SN_LDSB1_CLR1_GSU0_GSUC0_GSUWGMRR0_K1_LBSPPA1024_LBSPPB2048_MIWT4_8_NLCA2_NLCB2_PLR1_SU32_SUM0_SUS256_SPO1_SVW4_SKXCCM0_VWA4_VWB4_WSGRA1_WSGRB0_WGM1_WGMXCC1_WGMXCCGn1
    SolutionIndex: 202
    SolutionNameMin: Cijk_Ailk_Bjlk_HHS_BH_UserArgs_MT256x256x32_MI16x16x1_SN_LDSB1_CLR1_GSU0_GSUC0_GSUWGMRR0_K1_LBSPPA2048_LBSPPB2048_MIWT8_8_NLCA2_NLCB2_PLR1_SU32_SUM0_SUS256_SPO0_SVW4_SKXCCM0_VWA4_VWB4_WSGRA1_WSGRB0_WGM1_WGMXCC1_WGMXCCGn1
    SolutionIndex: 203
    SolutionNameMin: Cijk_Ailk_Bjlk_HHS_BH_UserArgs_MT128x256x64_MI16x16x1_SN_LDSB1_CLR1_GSU0_GSUC0_GSUWGMRR0_K1_LBSPPA1024_LBSPPB2048_MIWT4_8_NLCA1_NLCB1_PLR1_SU32_SUM0_SUS256_SPO0_SVW4_SKXCCM0_VWA4_VWB4_WSGRA1_WSGRB0_WGM8_WGMXCC1_WGMXCCGn1
    SolutionIndex: 204
    SolutionNameMin: Cijk_Ailk_Bjlk_HHS_BH_UserArgs_MT128x256x32_MI16x16x1_SN_LDSB0_CLR1_GSU0_GSUC0_GSUWGMRR0_K1_LBSPPA1024_LBSPPB2048_MIWT4_8_NLCA1_NLCB2_PLR1_SU32_SUM0_SUS256_SPO0_SVW4_SKXCCM8_VWA4_VWB4_WSGRA0_WSGRB0_WGM8_WGMXCC1_WGMXCCGn1
    SolutionIndex: 205
    SolutionNameMin: Cijk_Ailk_Bjlk_HHS_BH_UserArgs_MT128x256x64_MI16x16x1_SN_LDSB1_CLR1_GSU0_GSUC0_GSUWGMRR0_K1_LBSPPA1024_LBSPPB2048_MIWT4_8_NLCA1_NLCB2_PLR1_SU32_SUM0_SUS256_SPO0_SVW4_SKXCCM8_VWA4_VWB4_WSGRA1_WSGRB0_WGM1_WGMXCC1_WGMXCCGn1
    SolutionIndex: 206
    SolutionNameMin: Cijk_Ailk_Bjlk_HHS_BH_UserArgs_MT128x256x64_MI16x16x1_SN_LDSB1_CLR1_GSU0_GSUC0_GSUWGMRR0_K1_LBSPPA1024_LBSPPB2048_MIWT4_8_NLCA1_NLCB2_PLR1_SU32_SUM0_SUS256_SPO0_SVW4_SKXCCM8_VWA4_VWB4_WSGRA1_WSGRB1_WGM1_WGMXCC1_WGMXCCGn1
    SolutionIndex: 207
    SolutionNameMin: Cijk_Ailk_Bjlk_HHS_BH_UserArgs_MT256x256x32_MI16x16x1_SN_LDSB1_CLR1_GSU0_GSUC0_GSUWGMRR0_K1_LBSPPA2048_LBSPPB2048_MIWT8_8_NLCA1_NLCB1_PLR1_SU32_SUM0_SUS256_SPO1_SVW4_SKXCCM8_VWA4_VWB4_WSGRA1_WSGRB1_WGM8_WGMXCC1_WGMXCCGn1
    SolutionIndex: 208
    SolutionNameMin: Cijk_Ailk_Bjlk_HHS_BH_UserArgs_MT256x256x32_MI16x16x1_SN_LDSB0_CLR1_GSU0_GSUC0_GSUWGMRR0_K1_LBSPPA2048_LBSPPB2048_MIWT8_8_NLCA2_NLCB1_PLR1_SU32_SUM0_SUS256_SPO0_SVW4_SKXCCM8_VWA4_VWB4_WSGRA1_WSGRB1_WGM1_WGMXCC1_WGMXCCGn1
    SolutionIndex: 209
    SolutionNameMin: Cijk_Ailk_Bjlk_HHS_BH_UserArgs_MT128x128x64_MI16x16x1_SN_LDSB1_CLR1_GSU0_GSUC0_GSUWGMRR0_K1_LBSPPA1024_LBSPPB1024_MIWT4_4_NLCA1_NLCB1_PLR1_SU32_SUM0_SUS256_SPO0_SVW4_SKXCCM0_VWA4_VWB4_WSGRA0_WSGRB1_WGM1_WGMXCC1_WGMXCCGn1
    SolutionIndex: 210
    SolutionNameMin: Cijk_Ailk_Bjlk_HHS_BH_UserArgs_MT256x128x64_MI16x16x1_SN_LDSB1_CLR1_GSU0_GSUC0_GSUWGMRR0_K1_LBSPPA2048_LBSPPB1024_MIWT8_4_NLCA2_NLCB2_PLR2_SU32_SUM0_SUS256_SPO0_SVW4_SKXCCM8_VWA4_VWB4_WSGRA0_WSGRB0_WGM8_WGMXCC1_WGMXCCGn1
    SolutionIndex: 211
    SolutionNameMin: Cijk_Ailk_Bjlk_HHS_BH_UserArgs_MT128x256x32_MI16x16x1_SN_LDSB0_CLR1_GSU0_GSUC0_GSUWGMRR0_K1_LBSPPA1024_LBSPPB2048_MIWT4_8_NLCA2_NLCB2_PLR1_SU32_SUM0_SUS256_SPO0_SVW4_SKXCCM8_VWA4_VWB4_WSGRA1_WSGRB1_WGM1_WGMXCC1_WGMXCCGn1
    SolutionIndex: 212
    SolutionNameMin: Cijk_Ailk_Bjlk_HHS_BH_UserArgs_MT256x256x32_MI16x16x1_SN_LDSB0_CLR1_GSU0_GSUC0_GSUWGMRR0_K1_LBSPPA2048_LBSPPB2048_MIWT8_8_NLCA2_NLCB2_PLR1_SU32_SUM0_SUS256_SPO1_SVW4_SKXCCM8_VWA4_VWB4_WSGRA0_WSGRB1_WGM1_WGMXCC1_WGMXCCGn1
    SolutionIndex: 213
    SolutionNameMin: Cijk_Ailk_Bjlk_HHS_BH_UserArgs_MT256x256x32_MI16x16x1_SN_LDSB1_CLR1_GSU0_GSUC0_GSUWGMRR0_K1_LBSPPA2048_LBSPPB2048_MIWT8_8_NLCA1_NLCB2_PLR1_SU32_SUM0_SUS256_SPO0_SVW4_SKXCCM8_VWA4_VWB4_WSGRA1_WSGRB1_WGM1_WGMXCC1_WGMXCCGn1
    SolutionIndex: 214
    SolutionNameMin: Cijk_Ailk_Bjlk_HHS_BH_UserArgs_MT256x256x64_MI16x16x1_SN_LDSB1_CLR1_GSU0_GSUC0_GSUWGMRR0_K1_LBSPPA2048_LBSPPB2048_MIWT8_8_NLCA2_NLCB2_PLR1_SU32_SUM0_SUS256_SPO0_SVW4_SKXCCM8_VWA4_VWB4_WSGRA1_WSGRB1_WGM1_WGMXCC1_WGMXCCGn1
    SolutionIndex: 215
    SolutionNameMin: Cijk_Ailk_Bjlk_HHS_BH_UserArgs_MT256x256x32_MI16x16x1_SN_LDSB0_CLR1_GSU0_GSUC0_GSUWGMRR0_K1_LBSPPA2048_LBSPPB2048_MIWT8_8_NLCA2_NLCB2_PLR1_SU32_SUM0_SUS256_SPO0_SVW8_SKXCCM8_VWA8_VWB8_WSGRA0_WSGRB1_WGM1_WGMXCC1_WGMXCCGn1
    SolutionIndex: 216
    SolutionNameMin: Cijk_Ailk_Bjlk_HHS_BH_UserArgs_MT256x128x64_MI16x16x1_SN_LDSB1_CLR1_GSU0_GSUC0_GSUWGMRR0_K1_LBSPPA2048_LBSPPB1024_MIWT8_4_NLCA2_NLCB2_PLR1_SU32_SUM0_SUS256_SPO1_SVW4_SKXCCM0_VWA4_VWB4_WSGRA0_WSGRB1_WGM1_WGMXCC1_WGMXCCGn1
    SolutionIndex: 217
    SolutionNameMin: Cijk_Ailk_Bjlk_HHS_BH_UserArgs_MT256x128x32_MI16x16x1_SN_LDSB1_CLR1_GSU0_GSUC0_GSUWGMRR0_K1_LBSPPA2048_LBSPPB1024_MIWT8_4_NLCA2_NLCB2_PLR1_SU32_SUM0_SUS256_SPO0_SVW4_SKXCCM8_VWA4_VWB4_WSGRA1_WSGRB1_WGM8_WGMXCC1_WGMXCCGn1
    SolutionIndex: 218
    SolutionNameMin: Cijk_Ailk_Bjlk_HHS_BH_UserArgs_MT256x128x32_MI16x16x1_SN_LDSB0_CLR1_GSU0_GSUC0_GSUWGMRR0_K1_LBSPPA2048_LBSPPB1024_MIWT8_4_NLCA1_NLCB2_PLR1_SU32_SUM0_SUS256_SPO1_SVW4_SKXCCM8_VWA4_VWB4_WSGRA0_WSGRB0_WGM8_WGMXCC1_WGMXCCGn1
    SolutionIndex: 219
    SolutionNameMin: Cijk_Ailk_Bjlk_HHS_BH_UserArgs_MT256x256x64_MI16x16x1_SN_LDSB1_CLR1_GSU0_GSUC0_GSUWGMRR0_K1_LBSPPA2048_LBSPPB2048_MIWT8_8_NLCA1_NLCB2_PLR2_SU32_SUM0_SUS256_SPO1_SVW4_SKXCCM8_VWA4_VWB4_WSGRA1_WSGRB1_WGM1_WGMXCC1_WGMXCCGn1
    SolutionIndex: 220
    SolutionNameMin: Cijk_Ailk_Bjlk_HHS_BH_UserArgs_MT256x256x32_MI16x16x1_SN_LDSB0_CLR1_GSU0_GSUC0_GSUWGMRR0_K1_LBSPPA2048_LBSPPB2048_MIWT8_8_NLCA2_NLCB2_PLR1_SU32_SUM0_SUS256_SPO1_SVW4_SKXCCM8_VWA4_VWB4_WSGRA0_WSGRB0_WGM1_WGMXCC1_WGMXCCGn1
    SolutionIndex: 221
    SolutionNameMin: Cijk_Ailk_Bjlk_HHS_BH_UserArgs_MT256x256x64_MI16x16x1_SN_LDSB1_CLR1_GSU0_GSUC0_GSUWGMRR0_K1_LBSPPA2048_LBSPPB2048_MIWT8_8_NLCA2_NLCB2_PLR2_SU32_SUM0_SUS256_SPO0_SVW4_SKXCCM8_VWA4_VWB4_WSGRA0_WSGRB1_WGM1_WGMXCC1_WGMXCCGn1
    SolutionIndex: 222
    SolutionNameMin: Cijk_Ailk_Bjlk_HHS_BH_UserArgs_MT256x256x64_MI16x16x1_SN_LDSB1_CLR1_GSU0_GSUC0_GSUWGMRR0_K1_LBSPPA2048_LBSPPB2048_MIWT8_8_NLCA1_NLCB2_PLR3_SU32_SUM0_SUS256_SPO0_SVW4_SKXCCM8_VWA4_VWB4_WSGRA0_WSGRB0_WGM1_WGMXCC1_WGMXCCGn1
- - - [128, 128, 1, 128]
    - [19, 0.054]
  - - [128, 128, 1, 256]
    - [18, 0.091]
  - - [128, 128, 1, 512]
    - [30, 0.137]
  - - [128, 128, 1, 1024]
    - [28, 0.162]
  - - [128, 128, 1, 2048]
    - [27, 0.207]
  - - [128, 128, 1, 4096]
    - [27, 0.498]
  - - [128, 128, 1, 8192]
    - [29, 0.948]
  - - [128, 256, 1, 128]
    - [18, 0.105]
  - - [128, 256, 1, 256]
    - [21, 0.171]
  - - [128, 256, 1, 512]
    - [27, 0.259]
  - - [128, 256, 1, 1024]
    - [32, 0.343]
  - - [128, 256, 1, 2048]
    - [16, 0.746]
  - - [128, 256, 1, 4096]
    - [21, 1.441]
  - - [128, 256, 1, 8192]
    - [26, 2.451]
  - - [128, 512, 1, 128]
    - [19, 0.206]
  - - [128, 512, 1, 256]
    - [24, 0.348]
  - - [128, 512, 1, 512]
    - [30, 0.538]
  - - [128, 512, 1, 1024]
    - [27, 1.027]
  - - [128, 512, 1, 2048]
    - [25, 1.818]
  - - [128, 512, 1, 4096]
    - [26, 3.017]
  - - [128, 512, 1, 8192]
    - [30, 4.078]
  - - [128, 1024, 1, 128]
    - [17, 0.391]
  - - [128, 1024, 1, 256]
    - [23, 0.685]
  - - [128, 1024, 1, 512]
    - [27, 1.205]
  - - [128, 1024, 1, 1024]
    - [33, 1.973]
  - - [128, 1024, 1, 2048]
    - [26, 3.249]
  - - [128, 1024, 1, 4096]
    - [13, 4.708]
  - - [128, 1024, 1, 8192]
    - [9, 6.687]
  - - [128, 2048, 1, 128]
    - [20, 0.83]
  - - [128, 2048, 1, 256]
    - [22, 1.305]
  - - [128, 2048, 1, 512]
    - [24, 2.195]
  - - [128, 2048, 1, 1024]
    - [31, 3.432]
  - - [128, 2048, 1, 2048]
    - [11, 5.415]
  - - [128, 2048, 1, 4096]
    - [9, 7.979]
  - - [128, 2048, 1, 8192]
    - [12, 10.745]
  - - [128, 4096, 1, 128]
    - [14, 1.502]
  - - [128, 4096, 1, 256]
    - [15, 2.371]
  - - [128, 4096, 1, 512]
    - [13, 3.75]
  - - [128, 4096, 1, 1024]
    - [5, 6.086]
  - - [128, 4096, 1, 2048]
    - [8, 9.324]
  - - [128, 4096, 1, 4096]
    - [10, 12.06]
  - - [128, 4096, 1, 8192]
    - [1, 15.176]
  - - [128, 8192, 1, 128]
    - [4, 2.769]
  - - [128, 8192, 1, 256]
    - [6, 4.443]
  - - [128, 8192, 1, 512]
    - [7, 7.372]
  - - [128, 8192, 1, 1024]
    - [7, 10.406]
  - - [128, 8192, 1, 2048]
    - [3, 12.799]
  - - [128, 8192, 1, 4096]
    - [2, 16.63]
  - - [128, 8192, 1, 8192]
    - [0, 21.071]
  - - [256, 128, 1, 128]
    - [20, 0.105]
  - - [256, 128, 1, 256]
    - [28, 0.174]
  - - [256, 128, 1, 512]
    - [27, 0.272]
  - - [256, 128, 1, 1024]
    - [27, 0.355]
  - - [256, 128, 1, 2048]
    - [27, 0.742]
  - - [256, 128, 1, 4096]
    - [34, 1.459]
  - - [256, 128, 1, 8192]
    - [35, 2.407]
  - - [256, 256, 1, 128]
    - [17, 0.207]
  - - [256, 256, 1, 256]
    - [27, 0.343]
  - - [256, 256, 1, 512]
    - [27, 0.56]
  - - [256, 256, 1, 1024]
    - [29, 1.031]
  - - [256, 256, 1, 2048]
    - [17, 1.777]
  - - [256, 256, 1, 4096]
    - [31, 2.959]
  - - [256, 256, 1, 8192]
    - [27, 4.018]
  - - [256, 512, 1, 128]
    - [16, 0.385]
  - - [256, 512, 1, 256]
    - [28, 0.734]
  - - [256, 512, 1, 512]
    - [17, 1.159]
  - - [256, 512, 1, 1024]
    - [24, 2.024]
  - - [256, 512, 1, 2048]
    - [32, 3.312]
  - - [256, 512, 1, 4096]
    - [13, 4.851]
  - - [256, 512, 1, 8192]
    - [36, 6.595]
  - - [256, 1024, 1, 128]
    - [19, 0.829]
  - - [256, 1024, 1, 256]
    - [22, 1.349]
  - - [256, 1024, 1, 512]
    - [18, 2.143]
  - - [256, 1024, 1, 1024]
    - [37, 3.504]
  - - [256, 1024, 1, 2048]
    - [7, 5.259]
  - - [256, 1024, 1, 4096]
    - [38, 8.076]
  - - [256, 1024, 1, 8192]
    - [36, 10.415]
  - - [256, 2048, 1, 128]
    - [13, 1.467]
  - - [256, 2048, 1, 256]
    - [39, 2.394]
  - - [256, 2048, 1, 512]
    - [13, 3.73]
  - - [256, 2048, 1, 1024]
    - [40, 6.117]
  - - [256, 2048, 1, 2048]
    - [12, 9.252]
  - - [256, 2048, 1, 4096]
    - [41, 11.959]
  - - [256, 2048, 1, 8192]
    - [42, 14.728]
  - - [256, 4096, 1, 128]
    - [43, 2.696]
  - - [256, 4096, 1, 256]
    - [6, 4.466]
  - - [256, 4096, 1, 512]
    - [44, 7.243]
  - - [256, 4096, 1, 1024]
    - [11, 10.543]
  - - [256, 4096, 1, 2048]
    - [42, 12.775]
  - - [256, 4096, 1, 4096]
    - [45, 16.65]
  - - [256, 4096, 1, 8192]
    - [46, 20.943]
  - - [256, 8192, 1, 128]
    - [47, 4.567]
  - - [256, 8192, 1, 256]
    - [7, 6.091]
  - - [256, 8192, 1, 512]
    - [48, 10.192]
  - - [256, 8192, 1, 1024]
    - [49, 13.844]
  - - [256, 8192, 1, 2048]
    - [50, 17.638]
  - - [256, 8192, 1, 4096]
    - [51, 22.812]
  - - [256, 8192, 1, 8192]
    - [52, 25.411]
  - - [512, 128, 1, 128]
    - [20, 0.212]
  - - [512, 128, 1, 256]
    - [27, 0.35]
  - - [512, 128, 1, 512]
    - [29, 0.559]
  - - [512, 128, 1, 1024]
    - [23, 1.062]
  - - [512, 128, 1, 2048]
    - [53, 1.814]
  - - [512, 128, 1, 4096]
    - [54, 2.949]
  - - [512, 128, 1, 8192]
    - [55, 4.062]
  - - [512, 256, 1, 128]
    - [27, 0.406]
  - - [512, 256, 1, 256]
    - [56, 0.685]
  - - [512, 256, 1, 512]
    - [18, 1.186]
  - - [512, 256, 1, 1024]
    - [25, 1.983]
  - - [512, 256, 1, 2048]
    - [25, 3.281]
  - - [512, 256, 1, 4096]
    - [57, 4.873]
  - - [512, 256, 1, 8192]
    - [58, 6.568]
  - - [512, 512, 1, 128]
    - [18, 0.809]
  - - [512, 512, 1, 256]
    - [27, 1.321]
  - - [512, 512, 1, 512]
    - [29, 2.218]
  - - [512, 512, 1, 1024]
    - [25, 3.501]
  - - [512, 512, 1, 2048]
    - [13, 5.454]
  - - [512, 512, 1, 4096]
    - [59, 7.851]
  - - [512, 512, 1, 8192]
    - [11, 9.895]
  - - [512, 1024, 1, 128]
    - [13, 1.526]
  - - [512, 1024, 1, 256]
    - [15, 2.363]
  - - [512, 1024, 1, 512]
    - [13, 3.765]
  - - [512, 1024, 1, 1024]
    - [47, 6.023]
  - - [512, 1024, 1, 2048]
    - [60, 9.293]
  - - [512, 1024, 1, 4096]
    - [61, 11.427]
  - - [512, 1024, 1, 8192]
    - [62, 14.0]
  - - [512, 2048, 1, 128]
    - [63, 2.695]
  - - [512, 2048, 1, 256]
    - [64, 4.307]
  - - [512, 2048, 1, 512]
    - [11, 7.239]
  - - [512, 2048, 1, 1024]
    - [12, 10.358]
  - - [512, 2048, 1, 2048]
    - [65, 12.739]
  - - [512, 2048, 1, 4096]
    - [66, 15.517]
  - - [512, 2048, 1, 8192]
    - [67, 20.231]
  - - [512, 4096, 1, 128]
    - [68, 4.544]
  - - [512, 4096, 1, 256]
    - [5, 6.116]
  - - [512, 4096, 1, 512]
    - [69, 10.15]
  - - [512, 4096, 1, 1024]
    - [70, 13.799]
  - - [512, 4096, 1, 2048]
    - [71, 17.393]
  - - [512, 4096, 1, 4096]
    - [72, 21.7]
  - - [512, 4096, 1, 8192]
    - [73, 23.932]
  - - [512, 8192, 1, 128]
    - [74, 6.574]
  - - [512, 8192, 1, 256]
    - [75, 8.72]
  - - [512, 8192, 1, 512]
    - [48, 13.157]
  - - [512, 8192, 1, 1024]
    - [76, 18.171]
  - - [512, 8192, 1, 2048]
    - [77, 22.89]
  - - [512, 8192, 1, 4096]
    - [78, 25.396]
  - - [512, 8192, 1, 8192]
    - [52, 28.07]
  - - [1024, 128, 1, 128]
    - [27, 0.403]
  - - [1024, 128, 1, 256]
    - [29, 0.734]
  - - [1024, 128, 1, 512]
    - [56, 1.174]
  - - [1024, 128, 1, 1024]
    - [21, 2.004]
  - - [1024, 128, 1, 2048]
    - [79, 3.178]
  - - [1024, 128, 1, 4096]
    - [80, 4.538]
  - - [1024, 128, 1, 8192]
    - [59, 6.606]
  - - [1024, 256, 1, 128]
    - [28, 0.827]
  - - [1024, 256, 1, 256]
    - [22, 1.323]
  - - [1024, 256, 1, 512]
    - [25, 2.216]
  - - [1024, 256, 1, 1024]
    - [25, 3.506]
  - - [1024, 256, 1, 2048]
    - [9, 5.344]
  - - [1024, 256, 1, 4096]
    - [81, 7.617]
  - - [1024, 256, 1, 8192]
    - [7, 10.24]
  - - [1024, 512, 1, 128]
    - [82, 1.515]
  - - [1024, 512, 1, 256]
    - [13, 2.39]
  - - [1024, 512, 1, 512]
    - [15, 3.757]
  - - [1024, 512, 1, 1024]
    - [4, 5.89]
  - - [1024, 512, 1, 2048]
    - [11, 8.84]
  - - [1024, 512, 1, 4096]
    - [83, 11.169]
  - - [1024, 512, 1, 8192]
    - [84, 13.639]
  - - [1024, 1024, 1, 128]
    - [85, 2.687]
  - - [1024, 1024, 1, 256]
    - [6, 4.407]
  - - [1024, 1024, 1, 512]
    - [7, 7.304]
  - - [1024, 1024, 1, 1024]
    - [7, 10.039]
  - - [1024, 1024, 1, 2048]
    - [59, 11.95]
  - - [1024, 1024, 1, 4096]
    - [86, 15.018]
  - - [1024, 1024, 1, 8192]
    - [87, 19.455]
  - - [1024, 2048, 1, 128]
    - [88, 4.542]
  - - [1024, 2048, 1, 256]
    - [89, 6.034]
  - - [1024, 2048, 1, 512]
    - [48, 9.985]
  - - [1024, 2048, 1, 1024]
    - [90, 13.412]
  - - [1024, 2048, 1, 2048]
    - [91, 16.843]
  - - [1024, 2048, 1, 4096]
    - [92, 21.049]
  - - [1024, 2048, 1, 8192]
    - [93, 24.112]
  - - [1024, 4096, 1, 128]
    - [94, 6.758]
  - - [1024, 4096, 1, 256]
    - [95, 8.999]
  - - [1024, 4096, 1, 512]
    - [96, 13.022]
  - - [1024, 4096, 1, 1024]
    - [97, 17.88]
  - - [1024, 4096, 1, 2048]
    - [98, 22.435]
  - - [1024, 4096, 1, 4096]
    - [99, 25.732]
  - - [1024, 4096, 1, 8192]
    - [100, 27.443]
  - - [1024, 8192, 1, 128]
    - [101, 8.97]
  - - [1024, 8192, 1, 256]
    - [102, 11.286]
  - - [1024, 8192, 1, 512]
    - [103, 17.078]
  - - [1024, 8192, 1, 1024]
    - [104, 22.624]
  - - [1024, 8192, 1, 2048]
    - [105, 25.24]
  - - [1024, 8192, 1, 4096]
    - [106, 27.869]
  - - [1024, 8192, 1, 8192]
    - [107, 31.81]
  - - [2048, 128, 1, 128]
    - [18, 0.841]
  - - [2048, 128, 1, 256]
    - [27, 1.326]
  - - [2048, 128, 1, 512]
    - [34, 2.213]
  - - [2048, 128, 1, 1024]
    - [108, 3.433]
  - - [2048, 128, 1, 2048]
    - [109, 5.382]
  - - [2048, 128, 1, 4096]
    - [110, 8.037]
  - - [2048, 128, 1, 8192]
    - [61, 10.557]
  - - [2048, 256, 1, 128]
    - [111, 1.522]
  - - [2048, 256, 1, 256]
    - [15, 2.388]
  - - [2048, 256, 1, 512]
    - [112, 3.702]
  - - [2048, 256, 1, 1024]
    - [113, 6.096]
  - - [2048, 256, 1, 2048]
    - [114, 9.132]
  - - [2048, 256, 1, 4096]
    - [115, 11.427]
  - - [2048, 256, 1, 8192]
    - [84, 14.627]
  - - [2048, 512, 1, 128]
    - [47, 2.759]
  - - [2048, 512, 1, 256]
    - [116, 4.393]
  - - [2048, 512, 1, 512]
    - [11, 7.256]
  - - [2048, 512, 1, 1024]
    - [36, 10.204]
  - - [2048, 512, 1, 2048]
    - [117, 12.435]
  - - [2048, 512, 1, 4096]
    - [118, 15.732]
  - - [2048, 512, 1, 8192]
    - [119, 20.506]
  - - [2048, 1024, 1, 128]
    - [88, 4.539]
  - - [2048, 1024, 1, 256]
    - [7, 6.101]
  - - [2048, 1024, 1, 512]
    - [48, 10.11]
  - - [2048, 1024, 1, 1024]
    - [120, 13.371]
  - - [2048, 1024, 1, 2048]
    - [121, 17.131]
  - - [2048, 1024, 1, 4096]
    - [122, 21.076]
  - - [2048, 1024, 1, 8192]
    - [123, 23.308]
  - - [2048, 2048, 1, 128]
    - [124, 6.771]
  - - [2048, 2048, 1, 256]
    - [125, 8.865]
  - - [2048, 2048, 1, 512]
    - [98, 13.113]
  - - [2048, 2048, 1, 1024]
    - [126, 18.278]
  - - [2048, 2048, 1, 2048]
    - [127, 22.65]
  - - [2048, 2048, 1, 4096]
    - [128, 25.995]
  - - [2048, 2048, 1, 8192]
    - [129, 27.119]
  - - [2048, 4096, 1, 128]
    - [130, 9.022]
  - - [2048, 4096, 1, 256]
    - [131, 11.528]
  - - [2048, 4096, 1, 512]
    - [132, 17.524]
  - - [2048, 4096, 1, 1024]
    - [133, 22.96]
  - - [2048, 4096, 1, 2048]
    - [134, 24.922]
  - - [2048, 4096, 1, 4096]
    - [135, 27.559]
  - - [2048, 4096, 1, 8192]
    - [136, 31.882]
  - - [2048, 8192, 1, 128]
    - [137, 10.15]
  - - [2048, 8192, 1, 256]
    - [138, 15.087]
  - - [2048, 8192, 1, 512]
    - [139, 19.922]
  - - [2048, 8192, 1, 1024]
    - [140, 24.651]
  - - [2048, 8192, 1, 2048]
    - [105, 27.894]
  - - [2048, 8192, 1, 4096]
    - [141, 31.574]
  - - [2048, 8192, 1, 8192]
    - [142, 32.576]
  - - [4096, 128, 1, 128]
    - [112, 1.521]
  - - [4096, 128, 1, 256]
    - [143, 2.387]
  - - [4096, 128, 1, 512]
    - [13, 3.776]
  - - [4096, 128, 1, 1024]
    - [47, 5.959]
  - - [4096, 128, 1, 2048]
    - [36, 8.962]
  - - [4096, 128, 1, 4096]
    - [7, 11.621]
  - - [4096, 128, 1, 8192]
    - [144, 14.743]
  - - [4096, 256, 1, 128]
    - [47, 2.699]
  - - [4096, 256, 1, 256]
    - [145, 4.281]
  - - [4096, 256, 1, 512]
    - [11, 7.343]
  - - [4096, 256, 1, 1024]
    - [146, 10.368]
  - - [4096, 256, 1, 2048]
    - [147, 12.623]
  - - [4096, 256, 1, 4096]
    - [148, 16.272]
  - - [4096, 256, 1, 8192]
    - [149, 20.676]
  - - [4096, 512, 1, 128]
    - [47, 4.523]
  - - [4096, 512, 1, 256]
    - [150, 6.072]
  - - [4096, 512, 1, 512]
    - [151, 9.906]
  - - [4096, 512, 1, 1024]
    - [45, 13.449]
  - - [4096, 512, 1, 2048]
    - [152, 17.389]
  - - [4096, 512, 1, 4096]
    - [153, 21.847]
  - - [4096, 512, 1, 8192]
    - [154, 23.996]
  - - [4096, 1024, 1, 128]
    - [155, 6.784]
  - - [4096, 1024, 1, 256]
    - [156, 8.755]
  - - [4096, 1024, 1, 512]
    - [157, 13.116]
  - - [4096, 1024, 1, 1024]
    - [158, 17.957]
  - - [4096, 1024, 1, 2048]
    - [159, 22.241]
  - - [4096, 1024, 1, 4096]
    - [160, 24.428]
  - - [4096, 1024, 1, 8192]
    - [161, 26.781]
  - - [4096, 2048, 1, 128]
    - [162, 8.829]
  - - [4096, 2048, 1, 256]
    - [163, 11.503]
  - - [4096, 2048, 1, 512]
    - [164, 17.145]
  - - [4096, 2048, 1, 1024]
    - [165, 22.326]
  - - [4096, 2048, 1, 2048]
    - [73, 24.682]
  - - [4096, 2048, 1, 4096]
    - [166, 27.215]
  - - [4096, 2048, 1, 8192]
    - [167, 31.72]
  - - [4096, 4096, 1, 128]
    - [168, 10.173]
  - - [4096, 4096, 1, 256]
    - [169, 14.944]
  - - [4096, 4096, 1, 512]
    - [170, 19.615]
  - - [4096, 4096, 1, 1024]
    - [171, 24.758]
  - - [4096, 4096, 1, 2048]
    - [172, 27.625]
  - - [4096, 4096, 1, 4096]
    - [173, 31.675]
  - - [4096, 4096, 1, 8192]
    - [174, 33.685]
  - - [4096, 8192, 1, 128]
    - [103, 11.365]
  - - [4096, 8192, 1, 256]
    - [175, 15.992]
  - - [4096, 8192, 1, 512]
    - [176, 21.213]
  - - [4096, 8192, 1, 1024]
    - [177, 26.68]
  - - [4096, 8192, 1, 2048]
    - [178, 31.242]
  - - [4096, 8192, 1, 4096]
    - [179, 32.497]
  - - [4096, 8192, 1, 8192]
    - [180, 35.349]
  - - [8192, 128, 1, 128]
    - [4, 2.682]
  - - [8192, 128, 1, 256]
    - [6, 4.347]
  - - [8192, 128, 1, 512]
    - [7, 7.374]
  - - [8192, 128, 1, 1024]
    - [36, 10.042]
  - - [8192, 128, 1, 2048]
    - [181, 12.598]
  - - [8192, 128, 1, 4096]
    - [182, 16.186]
  - - [8192, 128, 1, 8192]
    - [183, 20.573]
  - - [8192, 256, 1, 128]
    - [63, 4.564]
  - - [8192, 256, 1, 256]
    - [184, 5.982]
  - - [8192, 256, 1, 512]
    - [45, 9.856]
  - - [8192, 256, 1, 1024]
    - [185, 13.669]
  - - [8192, 256, 1, 2048]
    - [186, 17.283]
  - - [8192, 256, 1, 4096]
    - [187, 22.077]
  - - [8192, 256, 1, 8192]
    - [188, 25.56]
  - - [8192, 512, 1, 128]
    - [189, 6.632]
  - - [8192, 512, 1, 256]
    - [190, 8.621]
  - - [8192, 512, 1, 512]
    - [191, 13.146]
  - - [8192, 512, 1, 1024]
    - [192, 18.139]
  - - [8192, 512, 1, 2048]
    - [193, 21.946]
  - - [8192, 512, 1, 4096]
    - [194, 26.238]
  - - [8192, 512, 1, 8192]
    - [195, 27.916]
  - - [8192, 1024, 1, 128]
    - [196, 8.788]
  - - [8192, 1024, 1, 256]
    - [197, 11.182]
  - - [8192, 1024, 1, 512]
    - [198, 17.087]
  - - [8192, 1024, 1, 1024]
    - [199, 22.702]
  - - [8192, 1024, 1, 2048]
    - [200, 25.785]
  - - [8192, 1024, 1, 4096]
    - [201, 27.587]
  - - [8192, 1024, 1, 8192]
    - [202, 31.226]
  - - [8192, 2048, 1, 128]
    - [203, 9.937]
  - - [8192, 2048, 1, 256]
    - [198, 14.594]
  - - [8192, 2048, 1, 512]
    - [204, 19.539]
  - - [8192, 2048, 1, 1024]
    - [205, 24.478]
  - - [8192, 2048, 1, 2048]
    - [206, 27.957]
  - - [8192, 2048, 1, 4096]
    - [207, 31.414]
  - - [8192, 2048, 1, 8192]
    - [208, 33.76]
  - - [8192, 4096, 1, 128]
    - [209, 10.997]
  - - [8192, 4096, 1, 256]
    - [210, 16.013]
  - - [8192, 4096, 1, 512]
    - [211, 21.295]
  - - [8192, 4096, 1, 1024]
    - [212, 27.593]
  - - [8192, 4096, 1, 2048]
    - [213, 31.721]
  - - [8192, 4096, 1, 4096]
    - [214, 34.012]
  - - [8192, 4096, 1, 8192]
    - [215, 35.611]
  - - [8192, 8192, 1, 128]
    - [216, 11.847]
  - - [8192, 8192, 1, 256]
    - [217, 16.292]
  - - [8192, 8192, 1, 512]
    - [218, 23.055]
  - - [8192, 8192, 1, 1024]
    - [219, 28.693]
  - - [8192, 8192, 1, 2048]
    - [220, 33.188]
  - - [8192, 8192, 1, 4096]
    - [221, 35.796]
  - - [8192, 8192, 1, 8192]
    - [222, 36.22]
- null
- null
- DeviceEfficiency
- GridBased
