library/src/amd_detail/rocblaslt/src/Tensile/Logic/streamk/aquavanjaram/aquavanjaram942_Cijk_Ailk_Bjlk_BBS_BH_UserArgs.yaml
- {MinimumRequiredVersion: 4.33.0}
- aquavanjaram942
- gfx942
- [Device 0049, Device 0050]
    SolutionIndex: 0
    SolutionNameMin: Cijk_Ailk_Bjlk_BBS_BH_UserArgs_MT128x128x64_MI16x16x1_SN_LDSB1_CLR1_GSU0_GSUC0_GSUWGMRR0_K1_LBSPPA1024_LBSPPB1024_MIWT4_4_NLCA1_NLCB2_PLR1_SU32_SUM0_SUS256_SPO1_SVW4_SKXCCM0_VWA4_VWB4_WSGRA0_WSGRB0_WGM8_WGMXCC1_WGMXCCGn1
    SolutionIndex: 1
    SolutionNameMin: Cijk_Ailk_Bjlk_BBS_BH_UserArgs_MT128x64x64_MI16x16x1_SN_LDSB0_CLR1_GSU0_GSUC0_GSUWGMRR0_K1_LBSPPA1024_LBSPPB512_MIWT4_2_NLCA2_NLCB1_PLR2_SU32_SUM0_SUS256_SPO0_SVW2_SKXCCM0_VWA2_VWB2_WSGRA1_WSGRB0_WGM1_WGMXCC1_WGMXCCGn1
    SolutionIndex: 2
    SolutionNameMin: Cijk_Ailk_Bjlk_BBS_BH_UserArgs_MT128x64x64_MI16x16x1_SN_LDSB0_CLR1_GSU0_GSUC0_GSUWGMRR0_K1_LBSPPA1024_LBSPPB512_MIWT4_2_NLCA2_NLCB1_PLR2_SU32_SUM0_SUS256_SPO0_SVW2_SKXCCM0_VWA2_VWB2_WSGRA1_WSGRB1_WGM1_WGMXCC1_WGMXCCGn1
    SolutionIndex: 3
    SolutionNameMin: Cijk_Ailk_Bjlk_BBS_BH_UserArgs_MT128x64x64_MI16x16x1_SN_LDSB0_CLR1_GSU0_GSUC0_GSUWGMRR0_K1_LBSPPA1024_LBSPPB512_MIWT4_2_NLCA2_NLCB1_PLR2_SU32_SUM0_SUS256_SPO0_SVW2_SKXCCM8_VWA2_VWB2_WSGRA0_WSGRB0_WGM1_WGMXCC1_WGMXCCGn1
    SolutionIndex: 4
    SolutionNameMin: Cijk_Ailk_Bjlk_BBS_BH_UserArgs_MT64x64x64_MI16x16x1_SN_LDSB0_CLR1_GSU0_GSUC0_GSUWGMRR0_K1_LBSPPA512_LBSPPB512_MIWT2_2_NLCA1_NLCB1_PLR2_SU32_SUM0_SUS256_SPO0_SVW2_SKXCCM0_VWA2_VWB2_WSGRA0_WSGRB0_WGM8_WGMXCC1_WGMXCCGn1
    SolutionIndex: 5
    SolutionNameMin: Cijk_Ailk_Bjlk_BBS_BH_UserArgs_MT64x64x64_MI16x16x1_SN_LDSB0_CLR1_GSU0_GSUC0_GSUWGMRR0_K1_LBSPPA512_LBSPPB512_MIWT2_2_NLCA2_NLCB2_PLR2_SU32_SUM0_SUS256_SPO1_SVW2_SKXCCM0_VWA2_VWB2_WSGRA1_WSGRB1_WGM1_WGMXCC1_WGMXCCGn1
    SolutionIndex: 6
    SolutionNameMin: Cijk_Ailk_Bjlk_BBS_BH_UserArgs_MT64x64x64_MI16x16x1_SN_LDSB0_CLR1_GSU0_GSUC0_GSUWGMRR0_K1_LBSPPA512_LBSPPB512_MIWT2_2_NLCA1_NLCB2_PLR2_SU32_SUM0_SUS256_SPO1_SVW2_SKXCCM0_VWA2_VWB2_WSGRA0_WSGRB0_WGM8_WGMXCC1_WGMXCCGn1
    SolutionIndex: 7
    SolutionNameMin: Cijk_Ailk_Bjlk_BBS_BH_UserArgs_MT64x64x64_MI16x16x1_SN_LDSB0_CLR1_GSU0_GSUC0_GSUWGMRR0_K1_LBSPPA512_LBSPPB512_MIWT2_2_NLCA1_NLCB1_PLR2_SU32_SUM0_SUS256_SPO0_SVW2_SKXCCM8_VWA2_VWB2_WSGRA0_WSGRB0_WGM1_WGMXCC1_WGMXCCGn1
    SolutionIndex: 8
    SolutionNameMin: Cijk_Ailk_Bjlk_BBS_BH_UserArgs_MT64x64x64_MI16x16x1_SN_LDSB0_CLR1_GSU0_GSUC0_GSUWGMRR0_K1_LBSPPA512_LBSPPB512_MIWT2_2_NLCA2_NLCB1_PLR1_SU32_SUM0_SUS256_SPO0_SVW2_SKXCCM8_VWA2_VWB2_WSGRA0_WSGRB1_WGM1_WGMXCC1_WGMXCCGn1
    SolutionIndex: 9
    SolutionNameMin: Cijk_Ailk_Bjlk_BBS_BH_UserArgs_MT64x64x64_MI16x16x1_SN_LDSB0_CLR1_GSU0_GSUC0_GSUWGMRR0_K1_LBSPPA512_LBSPPB512_MIWT2_2_NLCA2_NLCB1_PLR2_SU32_SUM0_SUS256_SPO0_SVW2_SKXCCM8_VWA2_VWB2_WSGRA0_WSGRB1_WGM1_WGMXCC1_WGMXCCGn1
    SolutionIndex: 10
    SolutionNameMin: Cijk_Ailk_Bjlk_BBS_BH_UserArgs_MT64x64x64_MI16x16x1_SN_LDSB0_CLR1_GSU0_GSUC0_GSUWGMRR0_K1_LBSPPA512_LBSPPB512_MIWT2_2_NLCA1_NLCB1_PLR2_SU32_SUM0_SUS256_SPO0_SVW2_SKXCCM8_VWA2_VWB2_WSGRA1_WSGRB1_WGM8_WGMXCC1_WGMXCCGn1
    SolutionIndex: 11
    SolutionNameMin: Cijk_Ailk_Bjlk_BBS_BH_UserArgs_MT64x64x64_MI16x16x1_SN_LDSB0_CLR1_GSU0_GSUC0_GSUWGMRR0_K1_LBSPPA512_LBSPPB512_MIWT2_2_NLCA1_NLCB1_PLR2_SU32_SUM0_SUS256_SPO1_SVW2_SKXCCM8_VWA2_VWB2_WSGRA1_WSGRB0_WGM1_WGMXCC1_WGMXCCGn1
    SolutionIndex: 12
    SolutionNameMin: Cijk_Ailk_Bjlk_BBS_BH_UserArgs_MT64x64x64_MI16x16x1_SN_LDSB0_CLR1_GSU0_GSUC0_GSUWGMRR0_K1_LBSPPA512_LBSPPB512_MIWT2_2_NLCA1_NLCB1_PLR2_SU32_SUM0_SUS256_SPO1_SVW2_SKXCCM8_VWA2_VWB2_WSGRA0_WSGRB1_WGM1_WGMXCC1_WGMXCCGn1
    SolutionIndex: 13
    SolutionNameMin: Cijk_Ailk_Bjlk_BBS_BH_UserArgs_MT64x64x64_MI16x16x1_SN_LDSB0_CLR1_GSU0_GSUC0_GSUWGMRR0_K1_LBSPPA512_LBSPPB512_MIWT2_2_NLCA2_NLCB1_PLR2_SU32_SUM0_SUS256_SPO1_SVW2_SKXCCM8_VWA2_VWB2_WSGRA0_WSGRB0_WGM1_WGMXCC1_WGMXCCGn1
    SolutionIndex: 14
    SolutionNameMin: Cijk_Ailk_Bjlk_BBS_BH_UserArgs_MT64x64x64_MI16x16x1_SN_LDSB0_CLR1_GSU0_GSUC0_GSUWGMRR0_K1_LBSPPA512_LBSPPB512_MIWT2_2_NLCA2_NLCB1_PLR2_SU32_SUM0_SUS256_SPO1_SVW2_SKXCCM8_VWA2_VWB2_WSGRA1_WSGRB0_WGM1_WGMXCC1_WGMXCCGn1
    SolutionIndex: 15
    SolutionNameMin: Cijk_Ailk_Bjlk_BBS_BH_UserArgs_MT32x64x64_MI16x16x1_SN_LDSB0_CLR1_GSU0_GSUC0_GSUWGMRR0_K1_LBSPPA256_LBSPPB512_MIWT1_2_NLCA1_NLCB1_PLR2_SU32_SUM0_SUS256_SPO0_SVW1_SKXCCM0_VWA1_VWB1_WSGRA1_WSGRB0_WGM1_WGMXCC1_WGMXCCGn1
    SolutionIndex: 16
    SolutionNameMin: Cijk_Ailk_Bjlk_BBS_BH_UserArgs_MT32x64x64_MI16x16x1_SN_LDSB0_CLR1_GSU0_GSUC0_GSUWGMRR0_K1_LBSPPA256_LBSPPB512_MIWT1_2_NLCA1_NLCB1_PLR2_SU32_SUM0_SUS256_SPO0_SVW1_SKXCCM8_VWA1_VWB1_WSGRA0_WSGRB0_WGM1_WGMXCC1_WGMXCCGn1
    SolutionIndex: 17
    SolutionNameMin: Cijk_Ailk_Bjlk_BBS_BH_UserArgs_MT64x32x64_MI16x16x1_SN_LDSB0_CLR1_GSU0_GSUC0_GSUWGMRR0_K1_LBSPPA512_LBSPPB256_MIWT2_1_NLCA1_NLCB1_PLR2_SU32_SUM0_SUS256_SPO0_SVW1_SKXCCM0_VWA1_VWB1_WSGRA0_WSGRB0_WGM1_WGMXCC1_WGMXCCGn1
    SolutionIndex: 18
    SolutionNameMin: Cijk_Ailk_Bjlk_BBS_BH_UserArgs_MT64x32x64_MI16x16x1_SN_LDSB0_CLR1_GSU0_GSUC0_GSUWGMRR0_K1_LBSPPA512_LBSPPB256_MIWT2_1_NLCA1_NLCB1_PLR2_SU32_SUM0_SUS256_SPO0_SVW1_SKXCCM0_VWA1_VWB1_WSGRA1_WSGRB0_WGM8_WGMXCC1_WGMXCCGn1
    SolutionIndex: 19
    SolutionNameMin: Cijk_Ailk_Bjlk_BBS_BH_UserArgs_MT32x32x64_MI16x16x1_SN_LDSB0_CLR1_GSU0_GSUC0_GSUWGMRR0_K1_LBSPPA256_LBSPPB256_MIWT1_1_NLCA1_NLCB1_PLR1_SU32_SUM0_SUS256_SPO0_SVW1_SKXCCM0_VWA1_VWB1_WSGRA1_WSGRB0_WGM1_WGMXCC1_WGMXCCGn1
    SolutionIndex: 20
    SolutionNameMin: Cijk_Ailk_Bjlk_BBS_BH_UserArgs_MT32x32x64_MI16x16x1_SN_LDSB0_CLR1_GSU0_GSUC0_GSUWGMRR0_K1_LBSPPA256_LBSPPB256_MIWT1_1_NLCA1_NLCB1_PLR1_SU32_SUM0_SUS256_SPO0_SVW1_SKXCCM0_VWA1_VWB1_WSGRA0_WSGRB1_WGM1_WGMXCC1_WGMXCCGn1
    SolutionIndex: 21
    SolutionNameMin: Cijk_Ailk_Bjlk_BBS_BH_UserArgs_MT32x32x64_MI16x16x1_SN_LDSB0_CLR1_GSU0_GSUC0_GSUWGMRR0_K1_LBSPPA256_LBSPPB256_MIWT1_1_NLCA1_NLCB1_PLR2_SU32_SUM0_SUS256_SPO0_SVW1_SKXCCM0_VWA1_VWB1_WSGRA1_WSGRB0_WGM1_WGMXCC1_WGMXCCGn1
    SolutionIndex: 22
    SolutionNameMin: Cijk_Ailk_Bjlk_BBS_BH_UserArgs_MT32x32x64_MI16x16x1_SN_LDSB0_CLR1_GSU0_GSUC0_GSUWGMRR0_K1_LBSPPA256_LBSPPB256_MIWT1_1_NLCA1_NLCB1_PLR2_SU32_SUM0_SUS256_SPO0_SVW1_SKXCCM0_VWA1_VWB1_WSGRA0_WSGRB1_WGM1_WGMXCC1_WGMXCCGn1
    SolutionIndex: 23
    SolutionNameMin: Cijk_Ailk_Bjlk_BBS_BH_UserArgs_MT32x32x64_MI16x16x1_SN_LDSB0_CLR1_GSU0_GSUC0_GSUWGMRR0_K1_LBSPPA256_LBSPPB256_MIWT1_1_NLCA1_NLCB1_PLR3_SU32_SUM0_SUS256_SPO0_SVW1_SKXCCM0_VWA1_VWB1_WSGRA1_WSGRB0_WGM1_WGMXCC1_WGMXCCGn1
    SolutionIndex: 24
    SolutionNameMin: Cijk_Ailk_Bjlk_BBS_BH_UserArgs_MT32x32x64_MI16x16x1_SN_LDSB0_CLR1_GSU0_GSUC0_GSUWGMRR0_K1_LBSPPA256_LBSPPB256_MIWT1_1_NLCA1_NLCB1_PLR3_SU32_SUM0_SUS256_SPO0_SVW1_SKXCCM0_VWA1_VWB1_WSGRA0_WSGRB1_WGM1_WGMXCC1_WGMXCCGn1
    SolutionIndex: 25
    SolutionNameMin: Cijk_Ailk_Bjlk_BBS_BH_UserArgs_MT32x32x64_MI16x16x1_SN_LDSB0_CLR1_GSU0_GSUC0_GSUWGMRR0_K1_LBSPPA256_LBSPPB256_MIWT1_1_NLCA1_NLCB1_PLR2_SU32_SUM0_SUS256_SPO1_SVW1_SKXCCM0_VWA1_VWB1_WSGRA0_WSGRB0_WGM1_WGMXCC1_WGMXCCGn1
    SolutionIndex: 26
    SolutionNameMin: Cijk_Ailk_Bjlk_BBS_BH_UserArgs_MT32x32x64_MI16x16x1_SN_LDSB0_CLR1_GSU0_GSUC0_GSUWGMRR0_K1_LBSPPA256_LBSPPB256_MIWT1_1_NLCA1_NLCB1_PLR1_SU32_SUM0_SUS256_SPO0_SVW1_SKXCCM8_VWA1_VWB1_WSGRA1_WSGRB1_WGM1_WGMXCC1_WGMXCCGn1
    SolutionIndex: 27
    SolutionNameMin: Cijk_Ailk_Bjlk_BBS_BH_UserArgs_MT32x32x64_MI16x16x1_SN_LDSB0_CLR1_GSU0_GSUC0_GSUWGMRR0_K1_LBSPPA256_LBSPPB256_MIWT1_1_NLCA1_NLCB1_PLR2_SU32_SUM0_SUS256_SPO0_SVW1_SKXCCM8_VWA1_VWB1_WSGRA1_WSGRB1_WGM1_WGMXCC1_WGMXCCGn1
    SolutionIndex: 28
    SolutionNameMin: Cijk_Ailk_Bjlk_BBS_BH_UserArgs_MT32x32x64_MI16x16x1_SN_LDSB0_CLR1_GSU0_GSUC0_GSUWGMRR0_K1_LBSPPA256_LBSPPB256_MIWT1_1_NLCA1_NLCB1_PLR3_SU32_SUM0_SUS256_SPO0_SVW1_SKXCCM8_VWA1_VWB1_WSGRA0_WSGRB0_WGM1_WGMXCC1_WGMXCCGn1
    SolutionIndex: 29
    SolutionNameMin: Cijk_Ailk_Bjlk_BBS_BH_UserArgs_MT32x32x64_MI16x16x1_SN_LDSB0_CLR1_GSU0_GSUC0_GSUWGMRR0_K1_LBSPPA256_LBSPPB256_MIWT1_1_NLCA1_NLCB1_PLR3_SU32_SUM0_SUS256_SPO0_SVW1_SKXCCM8_VWA1_VWB1_WSGRA1_WSGRB1_WGM1_WGMXCC1_WGMXCCGn1
    SolutionIndex: 30
    SolutionNameMin: Cijk_Ailk_Bjlk_BBS_BH_UserArgs_MT32x32x64_MI16x16x1_SN_LDSB0_CLR1_GSU0_GSUC0_GSUWGMRR0_K1_LBSPPA256_LBSPPB256_MIWT1_1_NLCA1_NLCB1_PLR1_SU32_SUM0_SUS256_SPO1_SVW1_SKXCCM8_VWA1_VWB1_WSGRA0_WSGRB0_WGM1_WGMXCC1_WGMXCCGn1
    SolutionIndex: 31
    SolutionNameMin: Cijk_Ailk_Bjlk_BBS_BH_UserArgs_MT32x32x64_MI16x16x1_SN_LDSB0_CLR1_GSU0_GSUC0_GSUWGMRR0_K1_LBSPPA256_LBSPPB256_MIWT1_1_NLCA1_NLCB1_PLR2_SU32_SUM0_SUS256_SPO1_SVW1_SKXCCM8_VWA1_VWB1_WSGRA0_WSGRB0_WGM1_WGMXCC1_WGMXCCGn1
    SolutionIndex: 32
    SolutionNameMin: Cijk_Ailk_Bjlk_BBS_BH_UserArgs_MT32x32x64_MI16x16x1_SN_LDSB0_CLR1_GSU0_GSUC0_GSUWGMRR0_K1_LBSPPA256_LBSPPB256_MIWT1_1_NLCA1_NLCB1_PLR2_SU32_SUM0_SUS256_SPO1_SVW1_SKXCCM8_VWA1_VWB1_WSGRA1_WSGRB0_WGM1_WGMXCC1_WGMXCCGn1
    SolutionIndex: 33
    SolutionNameMin: Cijk_Ailk_Bjlk_BBS_BH_UserArgs_MT32x32x64_MI16x16x1_SN_LDSB0_CLR1_GSU0_GSUC0_GSUWGMRR0_K1_LBSPPA256_LBSPPB256_MIWT1_1_NLCA1_NLCB1_PLR2_SU32_SUM0_SUS256_SPO1_SVW1_SKXCCM8_VWA1_VWB1_WSGRA0_WSGRB1_WGM1_WGMXCC1_WGMXCCGn1
    SolutionIndex: 34
    SolutionNameMin: Cijk_Ailk_Bjlk_BBS_BH_UserArgs_MT32x32x64_MI16x16x1_SN_LDSB0_CLR1_GSU0_GSUC0_GSUWGMRR0_K1_LBSPPA256_LBSPPB256_MIWT1_1_NLCA1_NLCB1_PLR3_SU32_SUM0_SUS256_SPO1_SVW1_SKXCCM8_VWA1_VWB1_WSGRA0_WSGRB0_WGM1_WGMXCC1_WGMXCCGn1
    SolutionIndex: 35
    SolutionNameMin: Cijk_Ailk_Bjlk_BBS_BH_UserArgs_MT32x32x64_MI16x16x1_SN_LDSB0_CLR1_GSU0_GSUC0_GSUWGMRR0_K1_LBSPPA256_LBSPPB256_MIWT1_1_NLCA1_NLCB1_PLR3_SU32_SUM0_SUS256_SPO1_SVW1_SKXCCM8_VWA1_VWB1_WSGRA0_WSGRB1_WGM1_WGMXCC1_WGMXCCGn1
    SolutionIndex: 36
    SolutionNameMin: Cijk_Ailk_Bjlk_BBS_BH_UserArgs_MT32x32x64_MI16x16x1_SN_LDSB0_CLR1_GSU0_GSUC0_GSUWGMRR0_K1_LBSPPA256_LBSPPB256_MIWT1_1_NLCA1_NLCB1_PLR3_SU32_SUM0_SUS256_SPO1_SVW1_SKXCCM8_VWA1_VWB1_WSGRA1_WSGRB0_WGM1_WGMXCC1_WGMXCCGn1
    SolutionIndex: 37
    SolutionNameMin: Cijk_Ailk_Bjlk_BBS_BH_UserArgs_MT32x32x64_MI16x16x1_SN_LDSB0_CLR1_GSU0_GSUC0_GSUWGMRR0_K1_LBSPPA256_LBSPPB256_MIWT1_1_NLCA1_NLCB1_PLR3_SU32_SUM0_SUS256_SPO0_SVW1_SKXCCM8_VWA1_VWB1_WSGRA1_WSGRB0_WGM8_WGMXCC1_WGMXCCGn1
    SolutionIndex: 38
    SolutionNameMin: Cijk_Ailk_Bjlk_BBS_BH_UserArgs_MT32x32x64_MI16x16x1_SN_LDSB0_CLR1_GSU0_GSUC0_GSUWGMRR0_K1_LBSPPA256_LBSPPB256_MIWT1_1_NLCA1_NLCB1_PLR1_SU32_SUM0_SUS256_SPO0_SVW1_SKXCCM8_VWA1_VWB1_WSGRA0_WSGRB0_WGM1_WGMXCC1_WGMXCCGn1
    SolutionIndex: 39
    SolutionNameMin: Cijk_Ailk_Bjlk_BBS_BH_UserArgs_MT32x32x64_MI16x16x1_SN_LDSB0_CLR1_GSU0_GSUC0_GSUWGMRR0_K1_LBSPPA256_LBSPPB256_MIWT1_1_NLCA1_NLCB1_PLR1_SU32_SUM0_SUS256_SPO0_SVW1_SKXCCM8_VWA1_VWB1_WSGRA0_WSGRB0_WGM8_WGMXCC1_WGMXCCGn1
    SolutionIndex: 40
    SolutionNameMin: Cijk_Ailk_Bjlk_BBS_BH_UserArgs_MT64x64x64_MI16x16x1_SN_LDSB0_CLR1_GSU0_GSUC0_GSUWGMRR0_K1_LBSPPA512_LBSPPB512_MIWT2_2_NLCA1_NLCB1_PLR2_SU32_SUM0_SUS256_SPO1_SVW2_SKXCCM8_VWA2_VWB2_WSGRA0_WSGRB1_WGM8_WGMXCC1_WGMXCCGn1
    SolutionIndex: 41
    SolutionNameMin: Cijk_Ailk_Bjlk_BBS_BH_UserArgs_MT64x64x64_MI16x16x1_SN_LDSB0_CLR1_GSU0_GSUC0_GSUWGMRR0_K1_LBSPPA512_LBSPPB512_MIWT2_2_NLCA2_NLCB1_PLR2_SU32_SUM0_SUS256_SPO1_SVW2_SKXCCM8_VWA2_VWB2_WSGRA0_WSGRB1_WGM1_WGMXCC1_WGMXCCGn1
    SolutionIndex: 42
    SolutionNameMin: Cijk_Ailk_Bjlk_BBS_BH_UserArgs_MT64x64x64_MI16x16x1_SN_LDSB0_CLR1_GSU0_GSUC0_GSUWGMRR0_K1_LBSPPA512_LBSPPB512_MIWT2_2_NLCA1_NLCB1_PLR2_SU32_SUM0_SUS256_SPO1_SVW2_SKXCCM8_VWA2_VWB2_WSGRA1_WSGRB0_WGM8_WGMXCC1_WGMXCCGn1
    SolutionIndex: 43
    SolutionNameMin: Cijk_Ailk_Bjlk_BBS_BH_UserArgs_MT64x32x64_MI16x16x1_SN_LDSB0_CLR1_GSU0_GSUC0_GSUWGMRR0_K1_LBSPPA512_LBSPPB256_MIWT2_1_NLCA1_NLCB1_PLR2_SU32_SUM0_SUS256_SPO1_SVW1_SKXCCM0_VWA1_VWB1_WSGRA1_WSGRB1_WGM1_WGMXCC1_WGMXCCGn1
    SolutionIndex: 44
    SolutionNameMin: Cijk_Ailk_Bjlk_BBS_BH_UserArgs_MT64x32x64_MI16x16x1_SN_LDSB0_CLR1_GSU0_GSUC0_GSUWGMRR0_K1_LBSPPA512_LBSPPB256_MIWT2_1_NLCA1_NLCB1_PLR2_SU32_SUM0_SUS256_SPO1_SVW1_SKXCCM8_VWA1_VWB1_WSGRA0_WSGRB1_WGM1_WGMXCC1_WGMXCCGn1
    SolutionIndex: 45
    SolutionNameMin: Cijk_Ailk_Bjlk_BBS_BH_UserArgs_MT64x64x64_MI16x16x1_SN_LDSB0_CLR1_GSU0_GSUC0_GSUWGMRR0_K1_LBSPPA512_LBSPPB512_MIWT2_2_NLCA1_NLCB1_PLR2_SU32_SUM0_SUS256_SPO0_SVW2_SKXCCM0_VWA2_VWB2_WSGRA1_WSGRB1_WGM1_WGMXCC1_WGMXCCGn1
    SolutionIndex: 46
    SolutionNameMin: Cijk_Ailk_Bjlk_BBS_BH_UserArgs_MT64x64x64_MI16x16x1_SN_LDSB0_CLR1_GSU0_GSUC0_GSUWGMRR0_K1_LBSPPA512_LBSPPB512_MIWT2_2_NLCA1_NLCB1_PLR2_SU32_SUM0_SUS256_SPO0_SVW2_SKXCCM8_VWA2_VWB2_WSGRA0_WSGRB0_WGM8_WGMXCC1_WGMXCCGn1
    SolutionIndex: 47
    SolutionNameMin: Cijk_Ailk_Bjlk_BBS_BH_UserArgs_MT128x64x64_MI16x16x1_SN_LDSB0_CLR1_GSU0_GSUC0_GSUWGMRR0_K1_LBSPPA1024_LBSPPB512_MIWT4_2_NLCA2_NLCB1_PLR3_SU32_SUM0_SUS256_SPO1_SVW2_SKXCCM8_VWA2_VWB2_WSGRA0_WSGRB0_WGM1_WGMXCC1_WGMXCCGn1
    SolutionIndex: 48
    SolutionNameMin: Cijk_Ailk_Bjlk_BBS_BH_UserArgs_MT64x64x64_MI16x16x1_SN_LDSB0_CLR1_GSU0_GSUC0_GSUWGMRR0_K1_LBSPPA512_LBSPPB512_MIWT2_2_NLCA1_NLCB1_PLR2_SU32_SUM0_SUS256_SPO0_SVW2_SKXCCM0_VWA2_VWB2_WSGRA0_WSGRB0_WGM1_WGMXCC1_WGMXCCGn1
    SolutionIndex: 49
    SolutionNameMin: Cijk_Ailk_Bjlk_BBS_BH_UserArgs_MT64x64x64_MI16x16x1_SN_LDSB0_CLR1_GSU0_GSUC0_GSUWGMRR0_K1_LBSPPA512_LBSPPB512_MIWT2_2_NLCA2_NLCB1_PLR1_SU32_SUM0_SUS256_SPO0_SVW2_SKXCCM8_VWA2_VWB2_WSGRA1_WSGRB0_WGM1_WGMXCC1_WGMXCCGn1
    SolutionIndex: 50
    SolutionNameMin: Cijk_Ailk_Bjlk_BBS_BH_UserArgs_MT128x64x64_MI16x16x1_SN_LDSB0_CLR1_GSU0_GSUC0_GSUWGMRR0_K1_LBSPPA1024_LBSPPB512_MIWT4_2_NLCA1_NLCB2_PLR2_SU32_SUM0_SUS256_SPO0_SVW2_SKXCCM0_VWA2_VWB2_WSGRA1_WSGRB0_WGM1_WGMXCC1_WGMXCCGn1
    SolutionIndex: 51
    SolutionNameMin: Cijk_Ailk_Bjlk_BBS_BH_UserArgs_MT128x64x64_MI16x16x1_SN_LDSB0_CLR1_GSU0_GSUC0_GSUWGMRR0_K1_LBSPPA1024_LBSPPB512_MIWT4_2_NLCA2_NLCB2_PLR2_SU32_SUM0_SUS256_SPO0_SVW2_SKXCCM8_VWA2_VWB2_WSGRA0_WSGRB0_WGM8_WGMXCC1_WGMXCCGn1
    SolutionIndex: 52
    SolutionNameMin: Cijk_Ailk_Bjlk_BBS_BH_UserArgs_MT128x128x64_MI16x16x1_SN_LDSB1_CLR1_GSU0_GSUC0_GSUWGMRR0_K1_LBSPPA1024_LBSPPB1024_MIWT4_4_NLCA2_NLCB1_PLR2_SU32_SUM0_SUS256_SPO0_SVW4_SKXCCM8_VWA4_VWB4_WSGRA0_WSGRB0_WGM1_WGMXCC1_WGMXCCGn1
    SolutionIndex: 53
    SolutionNameMin: Cijk_Ailk_Bjlk_BBS_BH_UserArgs_MT128x64x64_MI16x16x1_SN_LDSB0_CLR1_GSU0_GSUC0_GSUWGMRR0_K1_LBSPPA1024_LBSPPB512_MIWT4_2_NLCA1_NLCB1_PLR2_SU32_SUM0_SUS256_SPO0_SVW2_SKXCCM8_VWA2_VWB2_WSGRA0_WSGRB0_WGM1_WGMXCC1_WGMXCCGn1
    SolutionIndex: 54
    SolutionNameMin: Cijk_Ailk_Bjlk_BBS_BH_UserArgs_MT128x64x64_MI16x16x1_SN_LDSB0_CLR1_GSU0_GSUC0_GSUWGMRR0_K1_LBSPPA1024_LBSPPB512_MIWT4_2_NLCA2_NLCB1_PLR2_SU32_SUM0_SUS256_SPO0_SVW2_SKXCCM8_VWA2_VWB2_WSGRA1_WSGRB1_WGM1_WGMXCC1_WGMXCCGn1
    SolutionIndex: 55
    SolutionNameMin: Cijk_Ailk_Bjlk_BBS_BH_UserArgs_MT128x128x64_MI16x16x1_SN_LDSB1_CLR1_GSU0_GSUC0_GSUWGMRR0_K1_LBSPPA1024_LBSPPB1024_MIWT4_4_NLCA1_NLCB1_PLR1_SU32_SUM0_SUS256_SPO0_SVW4_SKXCCM8_VWA4_VWB4_WSGRA1_WSGRB0_WGM8_WGMXCC1_WGMXCCGn1
    SolutionIndex: 56
    SolutionNameMin: Cijk_Ailk_Bjlk_BBS_BH_UserArgs_MT128x128x64_MI16x16x1_SN_LDSB1_CLR1_GSU0_GSUC0_GSUWGMRR0_K1_LBSPPA1024_LBSPPB1024_MIWT4_4_NLCA1_NLCB2_PLR1_SU32_SUM0_SUS256_SPO1_SVW4_SKXCCM8_VWA4_VWB4_WSGRA0_WSGRB0_WGM8_WGMXCC1_WGMXCCGn1
    SolutionIndex: 57
    SolutionNameMin: Cijk_Ailk_Bjlk_BBS_BH_UserArgs_MT256x128x64_MI16x16x1_SN_LDSB1_CLR1_GSU0_GSUC0_GSUWGMRR0_K1_LBSPPA2048_LBSPPB1024_MIWT8_4_NLCA2_NLCB2_PLR1_SU32_SUM0_SUS256_SPO0_SVW4_SKXCCM0_VWA4_VWB4_WSGRA1_WSGRB1_WGM1_WGMXCC1_WGMXCCGn1
    SolutionIndex: 58
    SolutionNameMin: Cijk_Ailk_Bjlk_BBS_BH_UserArgs_MT32x32x64_MI16x16x1_SN_LDSB0_CLR1_GSU0_GSUC0_GSUWGMRR0_K1_LBSPPA256_LBSPPB256_MIWT1_1_NLCA1_NLCB1_PLR2_SU32_SUM0_SUS256_SPO0_SVW1_SKXCCM8_VWA1_VWB1_WSGRA0_WSGRB0_WGM1_WGMXCC1_WGMXCCGn1
    SolutionIndex: 59
    SolutionNameMin: Cijk_Ailk_Bjlk_BBS_BH_UserArgs_MT32x32x64_MI16x16x1_SN_LDSB0_CLR1_GSU0_GSUC0_GSUWGMRR0_K1_LBSPPA256_LBSPPB256_MIWT1_1_NLCA1_NLCB1_PLR3_SU32_SUM0_SUS256_SPO0_SVW1_SKXCCM8_VWA1_VWB1_WSGRA0_WSGRB0_WGM8_WGMXCC1_WGMXCCGn1
    SolutionIndex: 60
    SolutionNameMin: Cijk_Ailk_Bjlk_BBS_BH_UserArgs_MT32x32x64_MI16x16x1_SN_LDSB0_CLR1_GSU0_GSUC0_GSUWGMRR0_K1_LBSPPA256_LBSPPB256_MIWT1_1_NLCA1_NLCB1_PLR2_SU32_SUM0_SUS256_SPO0_SVW1_SKXCCM8_VWA1_VWB1_WSGRA0_WSGRB0_WGM8_WGMXCC1_WGMXCCGn1
    SolutionIndex: 61
    SolutionNameMin: Cijk_Ailk_Bjlk_BBS_BH_UserArgs_MT64x32x64_MI16x16x1_SN_LDSB0_CLR1_GSU0_GSUC0_GSUWGMRR0_K1_LBSPPA512_LBSPPB256_MIWT2_1_NLCA1_NLCB1_PLR2_SU32_SUM0_SUS256_SPO0_SVW1_SKXCCM8_VWA1_VWB1_WSGRA0_WSGRB0_WGM8_WGMXCC1_WGMXCCGn1
    SolutionIndex: 62
    SolutionNameMin: Cijk_Ailk_Bjlk_BBS_BH_UserArgs_MT64x64x64_MI16x16x1_SN_LDSB0_CLR1_GSU0_GSUC0_GSUWGMRR0_K1_LBSPPA512_LBSPPB512_MIWT2_2_NLCA1_NLCB1_PLR2_SU32_SUM0_SUS256_SPO1_SVW2_SKXCCM8_VWA2_VWB2_WSGRA0_WSGRB0_WGM1_WGMXCC1_WGMXCCGn1
    SolutionIndex: 63
    SolutionNameMin: Cijk_Ailk_Bjlk_BBS_BH_UserArgs_MT64x64x64_MI16x16x1_SN_LDSB0_CLR1_GSU0_GSUC0_GSUWGMRR0_K1_LBSPPA512_LBSPPB512_MIWT2_2_NLCA1_NLCB1_PLR2_SU32_SUM0_SUS256_SPO1_SVW2_SKXCCM0_VWA2_VWB2_WSGRA0_WSGRB0_WGM1_WGMXCC1_WGMXCCGn1
    SolutionIndex: 64
    SolutionNameMin: Cijk_Ailk_Bjlk_BBS_BH_UserArgs_MT64x64x64_MI16x16x1_SN_LDSB0_CLR1_GSU0_GSUC0_GSUWGMRR0_K1_LBSPPA512_LBSPPB512_MIWT2_2_NLCA1_NLCB1_PLR2_SU32_SUM0_SUS256_SPO0_SVW2_SKXCCM8_VWA2_VWB2_WSGRA1_WSGRB0_WGM1_WGMXCC1_WGMXCCGn1
    SolutionIndex: 65
    SolutionNameMin: Cijk_Ailk_Bjlk_BBS_BH_UserArgs_MT64x32x64_MI16x16x1_SN_LDSB0_CLR1_GSU0_GSUC0_GSUWGMRR0_K1_LBSPPA512_LBSPPB256_MIWT2_1_NLCA2_NLCB1_PLR2_SU32_SUM0_SUS256_SPO1_SVW1_SKXCCM0_VWA1_VWB1_WSGRA0_WSGRB0_WGM1_WGMXCC1_WGMXCCGn1
    SolutionIndex: 66
    SolutionNameMin: Cijk_Ailk_Bjlk_BBS_BH_UserArgs_MT64x32x64_MI16x16x1_SN_LDSB0_CLR1_GSU0_GSUC0_GSUWGMRR0_K1_LBSPPA512_LBSPPB256_MIWT2_1_NLCA1_NLCB1_PLR2_SU32_SUM0_SUS256_SPO0_SVW1_SKXCCM8_VWA1_VWB1_WSGRA0_WSGRB0_WGM1_WGMXCC1_WGMXCCGn1
    SolutionIndex: 67
    SolutionNameMin: Cijk_Ailk_Bjlk_BBS_BH_UserArgs_MT64x64x32_MI16x16x1_SN_LDSB0_CLR1_GSU0_GSUC0_GSUWGMRR0_K1_LBSPPA512_LBSPPB512_MIWT2_2_NLCA1_NLCB1_PLR1_SU32_SUM0_SUS256_SPO1_SVW2_SKXCCM0_VWA2_VWB2_WSGRA0_WSGRB0_WGM1_WGMXCC1_WGMXCCGn1
    SolutionIndex: 68
    SolutionNameMin: Cijk_Ailk_Bjlk_BBS_BH_UserArgs_MT64x64x64_MI16x16x1_SN_LDSB0_CLR1_GSU0_GSUC0_GSUWGMRR0_K1_LBSPPA512_LBSPPB512_MIWT2_2_NLCA1_NLCB1_PLR2_SU32_SUM0_SUS256_SPO0_SVW2_SKXCCM8_VWA2_VWB2_WSGRA1_WSGRB0_WGM8_WGMXCC1_WGMXCCGn1
    SolutionIndex: 69
    SolutionNameMin: Cijk_Ailk_Bjlk_BBS_BH_UserArgs_MT64x64x64_MI16x16x1_SN_LDSB0_CLR1_GSU0_GSUC0_GSUWGMRR0_K1_LBSPPA512_LBSPPB512_MIWT2_2_NLCA1_NLCB1_PLR1_SU32_SUM0_SUS256_SPO0_SVW2_SKXCCM0_VWA2_VWB2_WSGRA0_WSGRB0_WGM1_WGMXCC1_WGMXCCGn1
    SolutionIndex: 70
    SolutionNameMin: Cijk_Ailk_Bjlk_BBS_BH_UserArgs_MT64x64x64_MI16x16x1_SN_LDSB0_CLR1_GSU0_GSUC0_GSUWGMRR0_K1_LBSPPA512_LBSPPB512_MIWT2_2_NLCA2_NLCB2_PLR1_SU32_SUM0_SUS256_SPO1_SVW2_SKXCCM8_VWA2_VWB2_WSGRA1_WSGRB0_WGM1_WGMXCC1_WGMXCCGn1
    SolutionIndex: 71
    SolutionNameMin: Cijk_Ailk_Bjlk_BBS_BH_UserArgs_MT128x64x64_MI16x16x1_SN_LDSB0_CLR1_GSU0_GSUC0_GSUWGMRR0_K1_LBSPPA1024_LBSPPB512_MIWT4_2_NLCA2_NLCB2_PLR2_SU32_SUM0_SUS256_SPO0_SVW2_SKXCCM8_VWA2_VWB2_WSGRA1_WSGRB0_WGM1_WGMXCC1_WGMXCCGn1
    SolutionIndex: 72
    SolutionNameMin: Cijk_Ailk_Bjlk_BBS_BH_UserArgs_MT128x128x64_MI16x16x1_SN_LDSB1_CLR1_GSU0_GSUC0_GSUWGMRR0_K1_LBSPPA1024_LBSPPB1024_MIWT4_4_NLCA2_NLCB1_PLR1_SU32_SUM0_SUS256_SPO0_SVW4_SKXCCM8_VWA4_VWB4_WSGRA0_WSGRB0_WGM1_WGMXCC1_WGMXCCGn1
    SolutionIndex: 73
    SolutionNameMin: Cijk_Ailk_Bjlk_BBS_BH_UserArgs_MT64x64x32_MI16x16x1_SN_LDSB0_CLR1_GSU0_GSUC0_GSUWGMRR0_K1_LBSPPA512_LBSPPB512_MIWT2_2_NLCA1_NLCB1_PLR1_SU32_SUM0_SUS256_SPO0_SVW2_SKXCCM8_VWA2_VWB2_WSGRA1_WSGRB1_WGM1_WGMXCC1_WGMXCCGn1
    SolutionIndex: 74
    SolutionNameMin: Cijk_Ailk_Bjlk_BBS_BH_UserArgs_MT64x128x64_MI16x16x1_SN_LDSB0_CLR1_GSU0_GSUC0_GSUWGMRR0_K1_LBSPPA512_LBSPPB1024_MIWT2_4_NLCA1_NLCB2_PLR2_SU32_SUM0_SUS256_SPO0_SVW2_SKXCCM8_VWA2_VWB2_WSGRA1_WSGRB0_WGM1_WGMXCC1_WGMXCCGn1
    SolutionIndex: 75
    SolutionNameMin: Cijk_Ailk_Bjlk_BBS_BH_UserArgs_MT128x128x64_MI16x16x1_SN_LDSB1_CLR1_GSU0_GSUC0_GSUWGMRR0_K1_LBSPPA1024_LBSPPB1024_MIWT4_4_NLCA1_NLCB2_PLR1_SU32_SUM0_SUS256_SPO0_SVW4_SKXCCM8_VWA4_VWB4_WSGRA0_WSGRB0_WGM1_WGMXCC1_WGMXCCGn1
    SolutionIndex: 76
    SolutionNameMin: Cijk_Ailk_Bjlk_BBS_BH_UserArgs_MT128x128x64_MI16x16x1_SN_LDSB1_CLR1_GSU0_GSUC0_GSUWGMRR0_K1_LBSPPA1024_LBSPPB1024_MIWT4_4_NLCA2_NLCB2_PLR1_SU32_SUM0_SUS256_SPO1_SVW4_SKXCCM8_VWA4_VWB4_WSGRA1_WSGRB1_WGM8_WGMXCC1_WGMXCCGn1
    SolutionIndex: 77
    SolutionNameMin: Cijk_Ailk_Bjlk_BBS_BH_UserArgs_MT256x128x32_MI16x16x1_SN_LDSB1_CLR1_GSU0_GSUC0_GSUWGMRR0_K1_LBSPPA2048_LBSPPB1024_MIWT8_4_NLCA2_NLCB2_PLR1_SU32_SUM0_SUS256_SPO0_SVW4_SKXCCM8_VWA4_VWB4_WSGRA0_WSGRB1_WGM1_WGMXCC1_WGMXCCGn1
    SolutionIndex: 78
    SolutionNameMin: Cijk_Ailk_Bjlk_BBS_BH_UserArgs_MT64x128x64_MI16x16x1_SN_LDSB0_CLR1_GSU0_GSUC0_GSUWGMRR0_K1_LBSPPA512_LBSPPB1024_MIWT2_4_NLCA1_NLCB2_PLR2_SU32_SUM0_SUS256_SPO0_SVW2_SKXCCM0_VWA2_VWB2_WSGRA1_WSGRB0_WGM8_WGMXCC1_WGMXCCGn1
    SolutionIndex: 79
    SolutionNameMin: Cijk_Ailk_Bjlk_BBS_BH_UserArgs_MT128x128x64_MI16x16x1_SN_LDSB1_CLR1_GSU0_GSUC0_GSUWGMRR0_K1_LBSPPA1024_LBSPPB1024_MIWT4_4_NLCA2_NLCB2_PLR1_SU32_SUM0_SUS256_SPO1_SVW4_SKXCCM0_VWA4_VWB4_WSGRA0_WSGRB1_WGM1_WGMXCC1_WGMXCCGn1
    SolutionIndex: 80
    SolutionNameMin: Cijk_Ailk_Bjlk_BBS_BH_UserArgs_MT128x128x64_MI16x16x1_SN_LDSB0_CLR1_GSU0_GSUC0_GSUWGMRR0_K1_LBSPPA1024_LBSPPB1024_MIWT4_4_NLCA2_NLCB1_PLR1_SU32_SUM0_SUS256_SPO0_SVW4_SKXCCM8_VWA4_VWB4_WSGRA0_WSGRB0_WGM1_WGMXCC1_WGMXCCGn1
    SolutionIndex: 81
    SolutionNameMin: Cijk_Ailk_Bjlk_BBS_BH_UserArgs_MT128x128x64_MI16x16x1_SN_LDSB1_CLR1_GSU0_GSUC0_GSUWGMRR0_K1_LBSPPA1024_LBSPPB1024_MIWT4_4_NLCA1_NLCB2_PLR1_SU32_SUM0_SUS256_SPO0_SVW4_SKXCCM8_VWA4_VWB4_WSGRA0_WSGRB1_WGM1_WGMXCC1_WGMXCCGn1
    SolutionIndex: 82
    SolutionNameMin: Cijk_Ailk_Bjlk_BBS_BH_UserArgs_MT256x128x32_MI16x16x1_SN_LDSB0_CLR1_GSU0_GSUC0_GSUWGMRR0_K1_LBSPPA2048_LBSPPB1024_MIWT8_4_NLCA1_NLCB1_PLR1_SU32_SUM0_SUS256_SPO1_SVW4_SKXCCM8_VWA4_VWB4_WSGRA0_WSGRB0_WGM8_WGMXCC1_WGMXCCGn1
    SolutionIndex: 83
    SolutionNameMin: Cijk_Ailk_Bjlk_BBS_BH_UserArgs_MT256x128x64_MI16x16x1_SN_LDSB1_CLR1_GSU0_GSUC0_GSUWGMRR0_K1_LBSPPA2048_LBSPPB1024_MIWT8_4_NLCA1_NLCB2_PLR1_SU32_SUM0_SUS256_SPO1_SVW4_SKXCCM0_VWA4_VWB4_WSGRA1_WSGRB1_WGM1_WGMXCC1_WGMXCCGn1
    SolutionIndex: 84
    SolutionNameMin: Cijk_Ailk_Bjlk_BBS_BH_UserArgs_MT32x32x64_MI16x16x1_SN_LDSB0_CLR1_GSU0_GSUC0_GSUWGMRR0_K1_LBSPPA256_LBSPPB256_MIWT1_1_NLCA1_NLCB1_PLR3_SU32_SUM0_SUS256_SPO1_SVW1_SKXCCM0_VWA1_VWB1_WSGRA0_WSGRB1_WGM1_WGMXCC1_WGMXCCGn1
    SolutionIndex: 85
    SolutionNameMin: Cijk_Ailk_Bjlk_BBS_BH_UserArgs_MT32x64x64_MI16x16x1_SN_LDSB0_CLR1_GSU0_GSUC0_GSUWGMRR0_K1_LBSPPA256_LBSPPB512_MIWT1_2_NLCA1_NLCB1_PLR2_SU32_SUM0_SUS256_SPO0_SVW1_SKXCCM0_VWA1_VWB1_WSGRA0_WSGRB0_WGM1_WGMXCC1_WGMXCCGn1
    SolutionIndex: 86
    SolutionNameMin: Cijk_Ailk_Bjlk_BBS_BH_UserArgs_MT64x64x64_MI16x16x1_SN_LDSB0_CLR1_GSU0_GSUC0_GSUWGMRR0_K1_LBSPPA512_LBSPPB512_MIWT2_2_NLCA1_NLCB1_PLR2_SU32_SUM0_SUS256_SPO1_SVW2_SKXCCM8_VWA2_VWB2_WSGRA0_WSGRB0_WGM8_WGMXCC1_WGMXCCGn1
    SolutionIndex: 87
    SolutionNameMin: Cijk_Ailk_Bjlk_BBS_BH_UserArgs_MT64x64x64_MI16x16x1_SN_LDSB0_CLR1_GSU0_GSUC0_GSUWGMRR0_K1_LBSPPA512_LBSPPB512_MIWT2_2_NLCA1_NLCB1_PLR2_SU32_SUM0_SUS256_SPO0_SVW2_SKXCCM8_VWA2_VWB2_WSGRA1_WSGRB1_WGM1_WGMXCC1_WGMXCCGn1
    SolutionIndex: 88
    SolutionNameMin: Cijk_Ailk_Bjlk_BBS_BH_UserArgs_MT64x64x64_MI16x16x1_SN_LDSB0_CLR1_GSU0_GSUC0_GSUWGMRR0_K1_LBSPPA512_LBSPPB512_MIWT2_2_NLCA1_NLCB1_PLR3_SU32_SUM0_SUS256_SPO0_SVW2_SKXCCM8_VWA2_VWB2_WSGRA0_WSGRB1_WGM1_WGMXCC1_WGMXCCGn1
    SolutionIndex: 89
    SolutionNameMin: Cijk_Ailk_Bjlk_BBS_BH_UserArgs_MT64x128x64_MI16x16x1_SN_LDSB0_CLR1_GSU0_GSUC0_GSUWGMRR0_K1_LBSPPA512_LBSPPB1024_MIWT2_4_NLCA1_NLCB1_PLR2_SU32_SUM0_SUS256_SPO0_SVW2_SKXCCM8_VWA2_VWB2_WSGRA1_WSGRB0_WGM1_WGMXCC1_WGMXCCGn1
    SolutionIndex: 90
    SolutionNameMin: Cijk_Ailk_Bjlk_BBS_BH_UserArgs_MT64x64x64_MI16x16x1_SN_LDSB0_CLR1_GSU0_GSUC0_GSUWGMRR0_K1_LBSPPA512_LBSPPB512_MIWT2_2_NLCA1_NLCB2_PLR2_SU32_SUM0_SUS256_SPO1_SVW2_SKXCCM0_VWA2_VWB2_WSGRA0_WSGRB0_WGM1_WGMXCC1_WGMXCCGn1
    SolutionIndex: 91
    SolutionNameMin: Cijk_Ailk_Bjlk_BBS_BH_UserArgs_MT64x64x64_MI16x16x1_SN_LDSB0_CLR1_GSU0_GSUC0_GSUWGMRR0_K1_LBSPPA512_LBSPPB512_MIWT2_2_NLCA2_NLCB1_PLR2_SU32_SUM0_SUS256_SPO0_SVW2_SKXCCM8_VWA2_VWB2_WSGRA1_WSGRB0_WGM1_WGMXCC1_WGMXCCGn1
    SolutionIndex: 92
    SolutionNameMin: Cijk_Ailk_Bjlk_BBS_BH_UserArgs_MT128x128x32_MI16x16x1_SN_LDSB0_CLR1_GSU0_GSUC0_GSUWGMRR0_K1_LBSPPA1024_LBSPPB1024_MIWT4_4_NLCA1_NLCB1_PLR1_SU32_SUM0_SUS256_SPO1_SVW4_SKXCCM8_VWA4_VWB4_WSGRA1_WSGRB1_WGM1_WGMXCC1_WGMXCCGn1
    SolutionIndex: 93
    SolutionNameMin: Cijk_Ailk_Bjlk_BBS_BH_UserArgs_MT128x128x64_MI16x16x1_SN_LDSB1_CLR1_GSU0_GSUC0_GSUWGMRR0_K1_LBSPPA1024_LBSPPB1024_MIWT4_4_NLCA2_NLCB2_PLR1_SU32_SUM0_SUS256_SPO1_SVW4_SKXCCM8_VWA4_VWB4_WSGRA1_WSGRB0_WGM8_WGMXCC1_WGMXCCGn1
    SolutionIndex: 94
    SolutionNameMin: Cijk_Ailk_Bjlk_BBS_BH_UserArgs_MT64x64x64_MI16x16x1_SN_LDSB0_CLR1_GSU0_GSUC0_GSUWGMRR0_K1_LBSPPA512_LBSPPB512_MIWT2_2_NLCA2_NLCB1_PLR2_SU32_SUM0_SUS256_SPO1_SVW2_SKXCCM0_VWA2_VWB2_WSGRA0_WSGRB0_WGM8_WGMXCC1_WGMXCCGn1
    SolutionIndex: 95
    SolutionNameMin: Cijk_Ailk_Bjlk_BBS_BH_UserArgs_MT128x64x64_MI16x16x1_SN_LDSB0_CLR1_GSU0_GSUC0_GSUWGMRR0_K1_LBSPPA1024_LBSPPB512_MIWT4_2_NLCA1_NLCB1_PLR2_SU32_SUM0_SUS256_SPO1_SVW2_SKXCCM8_VWA2_VWB2_WSGRA0_WSGRB0_WGM1_WGMXCC1_WGMXCCGn1
    SolutionIndex: 96
    SolutionNameMin: Cijk_Ailk_Bjlk_BBS_BH_UserArgs_MT128x128x32_MI16x16x1_SN_LDSB0_CLR1_GSU0_GSUC0_GSUWGMRR0_K1_LBSPPA1024_LBSPPB1024_MIWT4_4_NLCA1_NLCB1_PLR1_SU32_SUM0_SUS256_SPO0_SVW4_SKXCCM8_VWA4_VWB4_WSGRA0_WSGRB1_WGM1_WGMXCC1_WGMXCCGn1
    SolutionIndex: 97
    SolutionNameMin: Cijk_Ailk_Bjlk_BBS_BH_UserArgs_MT128x128x64_MI16x16x1_SN_LDSB1_CLR1_GSU0_GSUC0_GSUWGMRR0_K1_LBSPPA1024_LBSPPB1024_MIWT4_4_NLCA1_NLCB2_PLR1_SU32_SUM0_SUS256_SPO0_SVW4_SKXCCM8_VWA4_VWB4_WSGRA0_WSGRB1_WGM8_WGMXCC1_WGMXCCGn1
    SolutionIndex: 98
    SolutionNameMin: Cijk_Ailk_Bjlk_BBS_BH_UserArgs_MT256x128x32_MI16x16x1_SN_LDSB1_CLR1_GSU0_GSUC0_GSUWGMRR0_K1_LBSPPA2048_LBSPPB1024_MIWT8_4_NLCA2_NLCB2_PLR1_SU32_SUM0_SUS256_SPO1_SVW4_SKXCCM8_VWA4_VWB4_WSGRA0_WSGRB1_WGM1_WGMXCC1_WGMXCCGn1
    SolutionIndex: 99
    SolutionNameMin: Cijk_Ailk_Bjlk_BBS_BH_UserArgs_MT128x64x64_MI16x16x1_SN_LDSB0_CLR1_GSU0_GSUC0_GSUWGMRR0_K1_LBSPPA1024_LBSPPB512_MIWT4_2_NLCA1_NLCB1_PLR2_SU32_SUM0_SUS256_SPO0_SVW2_SKXCCM0_VWA2_VWB2_WSGRA1_WSGRB0_WGM8_WGMXCC1_WGMXCCGn1
    SolutionIndex: 100
    SolutionNameMin: Cijk_Ailk_Bjlk_BBS_BH_UserArgs_MT128x128x64_MI16x16x1_SN_LDSB0_CLR1_GSU0_GSUC0_GSUWGMRR0_K1_LBSPPA1024_LBSPPB1024_MIWT4_4_NLCA1_NLCB1_PLR1_SU32_SUM0_SUS256_SPO1_SVW4_SKXCCM0_VWA4_VWB4_WSGRA0_WSGRB0_WGM1_WGMXCC1_WGMXCCGn1
    SolutionIndex: 101
    SolutionNameMin: Cijk_Ailk_Bjlk_BBS_BH_UserArgs_MT128x128x64_MI16x16x1_SN_LDSB1_CLR1_GSU0_GSUC0_GSUWGMRR0_K1_LBSPPA1024_LBSPPB1024_MIWT4_4_NLCA1_NLCB2_PLR1_SU32_SUM0_SUS256_SPO0_SVW4_SKXCCM8_VWA4_VWB4_WSGRA1_WSGRB0_WGM1_WGMXCC1_WGMXCCGn1
    SolutionIndex: 102
    SolutionNameMin: Cijk_Ailk_Bjlk_BBS_BH_UserArgs_MT128x128x64_MI16x16x1_SN_LDSB1_CLR1_GSU0_GSUC0_GSUWGMRR0_K1_LBSPPA1024_LBSPPB1024_MIWT4_4_NLCA1_NLCB1_PLR1_SU32_SUM0_SUS256_SPO1_SVW4_SKXCCM8_VWA4_VWB4_WSGRA0_WSGRB1_WGM8_WGMXCC1_WGMXCCGn1
    SolutionIndex: 103
    SolutionNameMin: Cijk_Ailk_Bjlk_BBS_BH_UserArgs_MT256x128x32_MI16x16x1_SN_LDSB0_CLR1_GSU0_GSUC0_GSUWGMRR0_K1_LBSPPA2048_LBSPPB1024_MIWT8_4_NLCA2_NLCB2_PLR1_SU32_SUM0_SUS256_SPO0_SVW4_SKXCCM8_VWA4_VWB4_WSGRA0_WSGRB0_WGM1_WGMXCC1_WGMXCCGn1
    SolutionIndex: 104
    SolutionNameMin: Cijk_Ailk_Bjlk_BBS_BH_UserArgs_MT256x256x64_MI16x16x1_SN_LDSB1_CLR1_GSU0_GSUC0_GSUWGMRR0_K1_LBSPPA2048_LBSPPB2048_MIWT8_8_NLCA1_NLCB2_PLR3_SU32_SUM0_SUS256_SPO1_SVW4_SKXCCM8_VWA4_VWB4_WSGRA0_WSGRB1_WGM1_WGMXCC1_WGMXCCGn1
    SolutionIndex: 105
    SolutionNameMin: Cijk_Ailk_Bjlk_BBS_BH_UserArgs_MT128x128x64_MI16x16x1_SN_LDSB0_CLR1_GSU0_GSUC0_GSUWGMRR0_K1_LBSPPA1024_LBSPPB1024_MIWT4_4_NLCA2_NLCB1_PLR1_SU32_SUM0_SUS256_SPO1_SVW4_SKXCCM0_VWA4_VWB4_WSGRA0_WSGRB0_WGM1_WGMXCC1_WGMXCCGn1
    SolutionIndex: 106
    SolutionNameMin: Cijk_Ailk_Bjlk_BBS_BH_UserArgs_MT64x128x64_MI16x16x1_SN_LDSB0_CLR1_GSU0_GSUC0_GSUWGMRR0_K1_LBSPPA512_LBSPPB1024_MIWT2_4_NLCA1_NLCB1_PLR3_SU32_SUM0_SUS256_SPO0_SVW2_SKXCCM8_VWA2_VWB2_WSGRA0_WSGRB0_WGM1_WGMXCC1_WGMXCCGn1
    SolutionIndex: 107
    SolutionNameMin: Cijk_Ailk_Bjlk_BBS_BH_UserArgs_MT128x128x64_MI16x16x1_SN_LDSB0_CLR1_GSU0_GSUC0_GSUWGMRR0_K1_LBSPPA1024_LBSPPB1024_MIWT4_4_NLCA2_NLCB2_PLR1_SU32_SUM0_SUS256_SPO0_SVW4_SKXCCM8_VWA4_VWB4_WSGRA0_WSGRB0_WGM1_WGMXCC1_WGMXCCGn1
    SolutionIndex: 108
    SolutionNameMin: Cijk_Ailk_Bjlk_BBS_BH_UserArgs_MT256x128x64_MI16x16x1_SN_LDSB1_CLR1_GSU0_GSUC0_GSUWGMRR0_K1_LBSPPA2048_LBSPPB1024_MIWT8_4_NLCA1_NLCB2_PLR2_SU32_SUM0_SUS256_SPO1_SVW4_SKXCCM0_VWA4_VWB4_WSGRA1_WSGRB0_WGM8_WGMXCC1_WGMXCCGn1
    SolutionIndex: 109
    SolutionNameMin: Cijk_Ailk_Bjlk_BBS_BH_UserArgs_MT256x128x64_MI16x16x1_SN_LDSB1_CLR1_GSU0_GSUC0_GSUWGMRR0_K1_LBSPPA2048_LBSPPB1024_MIWT8_4_NLCA2_NLCB1_PLR1_SU32_SUM0_SUS256_SPO1_SVW4_SKXCCM0_VWA4_VWB4_WSGRA0_WSGRB0_WGM1_WGMXCC1_WGMXCCGn1
    SolutionIndex: 110
    SolutionNameMin: Cijk_Ailk_Bjlk_BBS_BH_UserArgs_MT256x256x64_MI16x16x1_SN_LDSB1_CLR1_GSU0_GSUC0_GSUWGMRR0_K1_LBSPPA2048_LBSPPB2048_MIWT8_8_NLCA2_NLCB1_PLR1_SU32_SUM0_SUS256_SPO1_SVW4_SKXCCM0_VWA4_VWB4_WSGRA0_WSGRB0_WGM8_WGMXCC1_WGMXCCGn1
    SolutionIndex: 111
    SolutionNameMin: Cijk_Ailk_Bjlk_BBS_BH_UserArgs_MT64x64x64_MI16x16x1_SN_LDSB0_CLR1_GSU0_GSUC0_GSUWGMRR0_K1_LBSPPA512_LBSPPB512_MIWT2_2_NLCA1_NLCB1_PLR2_SU32_SUM0_SUS256_SPO0_SVW2_SKXCCM8_VWA2_VWB2_WSGRA0_WSGRB1_WGM8_WGMXCC1_WGMXCCGn1
    SolutionIndex: 112
    SolutionNameMin: Cijk_Ailk_Bjlk_BBS_BH_UserArgs_MT64x32x64_MI16x16x1_SN_LDSB0_CLR1_GSU0_GSUC0_GSUWGMRR0_K1_LBSPPA512_LBSPPB256_MIWT2_1_NLCA1_NLCB1_PLR1_SU32_SUM0_SUS256_SPO1_SVW1_SKXCCM8_VWA1_VWB1_WSGRA0_WSGRB0_WGM1_WGMXCC1_WGMXCCGn1
    SolutionIndex: 113
    SolutionNameMin: Cijk_Ailk_Bjlk_BBS_BH_UserArgs_MT64x32x64_MI16x16x1_SN_LDSB0_CLR1_GSU0_GSUC0_GSUWGMRR0_K1_LBSPPA512_LBSPPB256_MIWT2_1_NLCA1_NLCB1_PLR2_SU32_SUM0_SUS256_SPO1_SVW1_SKXCCM8_VWA1_VWB1_WSGRA0_WSGRB0_WGM1_WGMXCC1_WGMXCCGn1
    SolutionIndex: 114
    SolutionNameMin: Cijk_Ailk_Bjlk_BBS_BH_UserArgs_MT64x128x64_MI16x16x1_SN_LDSB0_CLR1_GSU0_GSUC0_GSUWGMRR0_K1_LBSPPA512_LBSPPB1024_MIWT2_4_NLCA1_NLCB1_PLR2_SU32_SUM0_SUS256_SPO1_SVW2_SKXCCM8_VWA2_VWB2_WSGRA0_WSGRB0_WGM1_WGMXCC1_WGMXCCGn1
    SolutionIndex: 115
    SolutionNameMin: Cijk_Ailk_Bjlk_BBS_BH_UserArgs_MT64x128x64_MI16x16x1_SN_LDSB0_CLR1_GSU0_GSUC0_GSUWGMRR0_K1_LBSPPA512_LBSPPB1024_MIWT2_4_NLCA1_NLCB1_PLR2_SU32_SUM0_SUS256_SPO1_SVW2_SKXCCM8_VWA2_VWB2_WSGRA1_WSGRB1_WGM8_WGMXCC1_WGMXCCGn1
    SolutionIndex: 116
    SolutionNameMin: Cijk_Ailk_Bjlk_BBS_BH_UserArgs_MT64x128x64_MI16x16x1_SN_LDSB0_CLR1_GSU0_GSUC0_GSUWGMRR0_K1_LBSPPA512_LBSPPB1024_MIWT2_4_NLCA1_NLCB1_PLR2_SU32_SUM0_SUS256_SPO0_SVW2_SKXCCM8_VWA2_VWB2_WSGRA0_WSGRB0_WGM1_WGMXCC1_WGMXCCGn1
    SolutionIndex: 117
    SolutionNameMin: Cijk_Ailk_Bjlk_BBS_BH_UserArgs_MT128x128x64_MI16x16x1_SN_LDSB1_CLR1_GSU0_GSUC0_GSUWGMRR0_K1_LBSPPA1024_LBSPPB1024_MIWT4_4_NLCA2_NLCB1_PLR1_SU32_SUM0_SUS256_SPO0_SVW4_SKXCCM8_VWA4_VWB4_WSGRA0_WSGRB1_WGM1_WGMXCC1_WGMXCCGn1
    SolutionIndex: 118
    SolutionNameMin: Cijk_Ailk_Bjlk_BBS_BH_UserArgs_MT64x64x64_MI16x16x1_SN_LDSB0_CLR1_GSU0_GSUC0_GSUWGMRR0_K1_LBSPPA512_LBSPPB512_MIWT2_2_NLCA2_NLCB1_PLR2_SU32_SUM0_SUS256_SPO1_SVW2_SKXCCM0_VWA2_VWB2_WSGRA0_WSGRB0_WGM1_WGMXCC1_WGMXCCGn1
    SolutionIndex: 119
    SolutionNameMin: Cijk_Ailk_Bjlk_BBS_BH_UserArgs_MT128x64x64_MI16x16x1_SN_LDSB0_CLR1_GSU0_GSUC0_GSUWGMRR0_K1_LBSPPA1024_LBSPPB512_MIWT4_2_NLCA1_NLCB2_PLR2_SU32_SUM0_SUS256_SPO0_SVW2_SKXCCM8_VWA2_VWB2_WSGRA1_WSGRB0_WGM8_WGMXCC1_WGMXCCGn1
    SolutionIndex: 120
    SolutionNameMin: Cijk_Ailk_Bjlk_BBS_BH_UserArgs_MT128x128x32_MI16x16x1_SN_LDSB0_CLR1_GSU0_GSUC0_GSUWGMRR0_K1_LBSPPA1024_LBSPPB1024_MIWT4_4_NLCA1_NLCB2_PLR1_SU32_SUM0_SUS256_SPO0_SVW4_SKXCCM8_VWA4_VWB4_WSGRA1_WSGRB0_WGM8_WGMXCC1_WGMXCCGn1
    SolutionIndex: 121
    SolutionNameMin: Cijk_Ailk_Bjlk_BBS_BH_UserArgs_MT128x128x64_MI16x16x1_SN_LDSB1_CLR1_GSU0_GSUC0_GSUWGMRR0_K1_LBSPPA1024_LBSPPB1024_MIWT4_4_NLCA2_NLCB1_PLR2_SU32_SUM0_SUS256_SPO1_SVW4_SKXCCM8_VWA4_VWB4_WSGRA0_WSGRB0_WGM8_WGMXCC1_WGMXCCGn1
    SolutionIndex: 122
    SolutionNameMin: Cijk_Ailk_Bjlk_BBS_BH_UserArgs_MT128x256x64_MI16x16x1_SN_LDSB1_CLR1_GSU0_GSUC0_GSUWGMRR0_K1_LBSPPA1024_LBSPPB2048_MIWT4_8_NLCA2_NLCB1_PLR1_SU32_SUM0_SUS256_SPO0_SVW4_SKXCCM8_VWA4_VWB4_WSGRA1_WSGRB0_WGM8_WGMXCC1_WGMXCCGn1
    SolutionIndex: 123
    SolutionNameMin: Cijk_Ailk_Bjlk_BBS_BH_UserArgs_MT128x64x64_MI16x16x1_SN_LDSB0_CLR1_GSU0_GSUC0_GSUWGMRR0_K1_LBSPPA1024_LBSPPB512_MIWT4_2_NLCA1_NLCB2_PLR2_SU32_SUM0_SUS256_SPO0_SVW2_SKXCCM0_VWA2_VWB2_WSGRA0_WSGRB1_WGM8_WGMXCC1_WGMXCCGn1
    SolutionIndex: 124
    SolutionNameMin: Cijk_Ailk_Bjlk_BBS_BH_UserArgs_MT128x128x64_MI16x16x1_SN_LDSB1_CLR1_GSU0_GSUC0_GSUWGMRR0_K1_LBSPPA1024_LBSPPB1024_MIWT4_4_NLCA1_NLCB1_PLR1_SU32_SUM0_SUS256_SPO1_SVW4_SKXCCM8_VWA4_VWB4_WSGRA0_WSGRB0_WGM8_WGMXCC1_WGMXCCGn1
    SolutionIndex: 125
    SolutionNameMin: Cijk_Ailk_Bjlk_BBS_BH_UserArgs_MT128x128x64_MI16x16x1_SN_LDSB1_CLR1_GSU0_GSUC0_GSUWGMRR0_K1_LBSPPA1024_LBSPPB1024_MIWT4_4_NLCA2_NLCB2_PLR1_SU32_SUM0_SUS256_SPO0_SVW4_SKXCCM8_VWA4_VWB4_WSGRA1_WSGRB1_WGM1_WGMXCC1_WGMXCCGn1
    SolutionIndex: 126
    SolutionNameMin: Cijk_Ailk_Bjlk_BBS_BH_UserArgs_MT256x128x32_MI16x16x1_SN_LDSB0_CLR1_GSU0_GSUC0_GSUWGMRR0_K1_LBSPPA2048_LBSPPB1024_MIWT8_4_NLCA2_NLCB2_PLR1_SU32_SUM0_SUS256_SPO0_SVW2_SKXCCM8_VWA2_VWB2_WSGRA0_WSGRB0_WGM1_WGMXCC1_WGMXCCGn1
    SolutionIndex: 127
    SolutionNameMin: Cijk_Ailk_Bjlk_BBS_BH_UserArgs_MT128x256x64_MI16x16x1_SN_LDSB1_CLR1_GSU0_GSUC0_GSUWGMRR0_K1_LBSPPA1024_LBSPPB2048_MIWT4_8_NLCA1_NLCB1_PLR2_SU32_SUM0_SUS256_SPO0_SVW4_SKXCCM8_VWA4_VWB4_WSGRA1_WSGRB1_WGM8_WGMXCC1_WGMXCCGn1
    SolutionIndex: 128
    SolutionNameMin: Cijk_Ailk_Bjlk_BBS_BH_UserArgs_MT128x128x64_MI16x16x1_SN_LDSB1_CLR1_GSU0_GSUC0_GSUWGMRR0_K1_LBSPPA1024_LBSPPB1024_MIWT4_4_NLCA1_NLCB1_PLR1_SU32_SUM0_SUS256_SPO0_SVW4_SKXCCM0_VWA4_VWB4_WSGRA0_WSGRB0_WGM1_WGMXCC1_WGMXCCGn1
    SolutionIndex: 129
    SolutionNameMin: Cijk_Ailk_Bjlk_BBS_BH_UserArgs_MT128x128x64_MI16x16x1_SN_LDSB1_CLR1_GSU0_GSUC0_GSUWGMRR0_K1_LBSPPA1024_LBSPPB1024_MIWT4_4_NLCA1_NLCB2_PLR1_SU32_SUM0_SUS256_SPO0_SVW4_SKXCCM8_VWA4_VWB4_WSGRA1_WSGRB1_WGM1_WGMXCC1_WGMXCCGn1
    SolutionIndex: 130
    SolutionNameMin: Cijk_Ailk_Bjlk_BBS_BH_UserArgs_MT128x128x64_MI16x16x1_SN_LDSB0_CLR1_GSU0_GSUC0_GSUWGMRR0_K1_LBSPPA1024_LBSPPB1024_MIWT4_4_NLCA2_NLCB1_PLR2_SU32_SUM0_SUS256_SPO0_SVW4_SKXCCM8_VWA4_VWB4_WSGRA0_WSGRB0_WGM1_WGMXCC1_WGMXCCGn1
    SolutionIndex: 131
    SolutionNameMin: Cijk_Ailk_Bjlk_BBS_BH_UserArgs_MT128x256x32_MI16x16x1_SN_LDSB0_CLR1_GSU0_GSUC0_GSUWGMRR0_K1_LBSPPA1024_LBSPPB2048_MIWT4_8_NLCA1_NLCB2_PLR1_SU32_SUM0_SUS256_SPO1_SVW4_SKXCCM8_VWA4_VWB4_WSGRA1_WSGRB0_WGM1_WGMXCC1_WGMXCCGn1
    SolutionIndex: 132
    SolutionNameMin: Cijk_Ailk_Bjlk_BBS_BH_UserArgs_MT256x256x64_MI16x16x1_SN_LDSB1_CLR1_GSU0_GSUC0_GSUWGMRR0_K1_LBSPPA2048_LBSPPB2048_MIWT8_8_NLCA2_NLCB1_PLR3_SU32_SUM0_SUS256_SPO0_SVW4_SKXCCM8_VWA4_VWB4_WSGRA0_WSGRB0_WGM1_WGMXCC1_WGMXCCGn1
    SolutionIndex: 133
    SolutionNameMin: Cijk_Ailk_Bjlk_BBS_BH_UserArgs_MT256x256x64_MI16x16x1_SN_LDSB1_CLR1_GSU0_GSUC0_GSUWGMRR0_K1_LBSPPA2048_LBSPPB2048_MIWT8_8_NLCA1_NLCB1_PLR3_SU32_SUM0_SUS256_SPO0_SVW4_SKXCCM8_VWA4_VWB4_WSGRA1_WSGRB1_WGM1_WGMXCC1_WGMXCCGn1
    SolutionIndex: 134
    SolutionNameMin: Cijk_Ailk_Bjlk_BBS_BH_UserArgs_MT256x128x64_MI16x16x1_SN_LDSB1_CLR1_GSU0_GSUC0_GSUWGMRR0_K1_LBSPPA2048_LBSPPB1024_MIWT8_4_NLCA1_NLCB1_PLR1_SU32_SUM0_SUS256_SPO1_SVW4_SKXCCM0_VWA4_VWB4_WSGRA1_WSGRB0_WGM1_WGMXCC1_WGMXCCGn1
    SolutionIndex: 135
    SolutionNameMin: Cijk_Ailk_Bjlk_BBS_BH_UserArgs_MT128x128x64_MI16x16x1_SN_LDSB1_CLR1_GSU0_GSUC0_GSUWGMRR0_K1_LBSPPA1024_LBSPPB1024_MIWT4_4_NLCA1_NLCB1_PLR1_SU32_SUM0_SUS256_SPO0_SVW4_SKXCCM8_VWA4_VWB4_WSGRA1_WSGRB1_WGM1_WGMXCC1_WGMXCCGn1
    SolutionIndex: 136
    SolutionNameMin: Cijk_Ailk_Bjlk_BBS_BH_UserArgs_MT256x128x64_MI16x16x1_SN_LDSB1_CLR1_GSU0_GSUC0_GSUWGMRR0_K1_LBSPPA2048_LBSPPB1024_MIWT8_4_NLCA1_NLCB2_PLR1_SU32_SUM0_SUS256_SPO1_SVW4_SKXCCM8_VWA4_VWB4_WSGRA0_WSGRB0_WGM1_WGMXCC1_WGMXCCGn1
    SolutionIndex: 137
    SolutionNameMin: Cijk_Ailk_Bjlk_BBS_BH_UserArgs_MT128x256x32_MI16x16x1_SN_LDSB1_CLR1_GSU0_GSUC0_GSUWGMRR0_K1_LBSPPA1024_LBSPPB2048_MIWT4_8_NLCA1_NLCB1_PLR1_SU32_SUM0_SUS256_SPO0_SVW4_SKXCCM8_VWA4_VWB4_WSGRA0_WSGRB0_WGM1_WGMXCC1_WGMXCCGn1
    SolutionIndex: 138
    SolutionNameMin: Cijk_Ailk_Bjlk_BBS_BH_UserArgs_MT128x256x32_MI16x16x1_SN_LDSB1_CLR1_GSU0_GSUC0_GSUWGMRR0_K1_LBSPPA1024_LBSPPB2048_MIWT4_8_NLCA2_NLCB2_PLR1_SU32_SUM0_SUS256_SPO0_SVW4_SKXCCM8_VWA4_VWB4_WSGRA0_WSGRB1_WGM1_WGMXCC1_WGMXCCGn1
    SolutionIndex: 139
    SolutionNameMin: Cijk_Ailk_Bjlk_BBS_BH_UserArgs_MT256x256x64_MI16x16x1_SN_LDSB1_CLR1_GSU0_GSUC0_GSUWGMRR0_K1_LBSPPA2048_LBSPPB2048_MIWT8_8_NLCA1_NLCB2_PLR1_SU32_SUM0_SUS256_SPO1_SVW4_SKXCCM0_VWA4_VWB4_WSGRA0_WSGRB0_WGM8_WGMXCC1_WGMXCCGn1
    SolutionIndex: 140
    SolutionNameMin: Cijk_Ailk_Bjlk_BBS_BH_UserArgs_MT256x256x64_MI16x16x1_SN_LDSB1_CLR1_GSU0_GSUC0_GSUWGMRR0_K1_LBSPPA2048_LBSPPB2048_MIWT8_8_NLCA1_NLCB2_PLR1_SU32_SUM0_SUS256_SPO0_SVW4_SKXCCM0_VWA4_VWB4_WSGRA1_WSGRB1_WGM8_WGMXCC1_WGMXCCGn1
    SolutionIndex: 141
    SolutionNameMin: Cijk_Ailk_Bjlk_BBS_BH_UserArgs_MT32x64x64_MI16x16x1_SN_LDSB0_CLR1_GSU0_GSUC0_GSUWGMRR0_K1_LBSPPA256_LBSPPB512_MIWT1_2_NLCA1_NLCB1_PLR2_SU32_SUM0_SUS256_SPO1_SVW1_SKXCCM8_VWA1_VWB1_WSGRA0_WSGRB0_WGM1_WGMXCC1_WGMXCCGn1
    SolutionIndex: 142
    SolutionNameMin: Cijk_Ailk_Bjlk_BBS_BH_UserArgs_MT64x64x64_MI16x16x1_SN_LDSB0_CLR1_GSU0_GSUC0_GSUWGMRR0_K1_LBSPPA512_LBSPPB512_MIWT2_2_NLCA1_NLCB1_PLR3_SU32_SUM0_SUS256_SPO1_SVW2_SKXCCM8_VWA2_VWB2_WSGRA0_WSGRB0_WGM8_WGMXCC1_WGMXCCGn1
    SolutionIndex: 143
    SolutionNameMin: Cijk_Ailk_Bjlk_BBS_BH_UserArgs_MT64x64x64_MI16x16x1_SN_LDSB0_CLR1_GSU0_GSUC0_GSUWGMRR0_K1_LBSPPA512_LBSPPB512_MIWT2_2_NLCA1_NLCB1_PLR2_SU32_SUM0_SUS256_SPO0_SVW2_SKXCCM8_VWA2_VWB2_WSGRA0_WSGRB1_WGM1_WGMXCC1_WGMXCCGn1
    SolutionIndex: 144
    SolutionNameMin: Cijk_Ailk_Bjlk_BBS_BH_UserArgs_MT64x128x64_MI16x16x1_SN_LDSB0_CLR1_GSU0_GSUC0_GSUWGMRR0_K1_LBSPPA512_LBSPPB1024_MIWT2_4_NLCA1_NLCB2_PLR2_SU32_SUM0_SUS256_SPO0_SVW2_SKXCCM0_VWA2_VWB2_WSGRA1_WSGRB0_WGM1_WGMXCC1_WGMXCCGn1
    SolutionIndex: 145
    SolutionNameMin: Cijk_Ailk_Bjlk_BBS_BH_UserArgs_MT64x128x64_MI16x16x1_SN_LDSB0_CLR1_GSU0_GSUC0_GSUWGMRR0_K1_LBSPPA512_LBSPPB1024_MIWT2_4_NLCA1_NLCB2_PLR2_SU32_SUM0_SUS256_SPO0_SVW2_SKXCCM8_VWA2_VWB2_WSGRA0_WSGRB1_WGM1_WGMXCC1_WGMXCCGn1
    SolutionIndex: 146
    SolutionNameMin: Cijk_Ailk_Bjlk_BBS_BH_UserArgs_MT128x64x64_MI16x16x1_SN_LDSB0_CLR1_GSU0_GSUC0_GSUWGMRR0_K1_LBSPPA1024_LBSPPB512_MIWT4_2_NLCA2_NLCB1_PLR2_SU32_SUM0_SUS256_SPO0_SVW2_SKXCCM8_VWA2_VWB2_WSGRA0_WSGRB0_WGM8_WGMXCC1_WGMXCCGn1
    SolutionIndex: 147
    SolutionNameMin: Cijk_Ailk_Bjlk_BBS_BH_UserArgs_MT64x128x64_MI16x16x1_SN_LDSB0_CLR1_GSU0_GSUC0_GSUWGMRR0_K1_LBSPPA512_LBSPPB1024_MIWT2_4_NLCA1_NLCB1_PLR2_SU32_SUM0_SUS256_SPO0_SVW2_SKXCCM8_VWA2_VWB2_WSGRA0_WSGRB0_WGM8_WGMXCC1_WGMXCCGn1
    SolutionIndex: 148
    SolutionNameMin: Cijk_Ailk_Bjlk_BBS_BH_UserArgs_MT128x128x64_MI16x16x1_SN_LDSB1_CLR1_GSU0_GSUC0_GSUWGMRR0_K1_LBSPPA1024_LBSPPB1024_MIWT4_4_NLCA1_NLCB1_PLR1_SU32_SUM0_SUS256_SPO1_SVW4_SKXCCM8_VWA4_VWB4_WSGRA1_WSGRB0_WGM8_WGMXCC1_WGMXCCGn1
    SolutionIndex: 149
    SolutionNameMin: Cijk_Ailk_Bjlk_BBS_BH_UserArgs_MT128x128x64_MI16x16x1_SN_LDSB0_CLR1_GSU0_GSUC0_GSUWGMRR0_K1_LBSPPA1024_LBSPPB1024_MIWT4_4_NLCA2_NLCB2_PLR2_SU32_SUM0_SUS256_SPO1_SVW4_SKXCCM8_VWA4_VWB4_WSGRA1_WSGRB0_WGM1_WGMXCC1_WGMXCCGn1
    SolutionIndex: 150
    SolutionNameMin: Cijk_Ailk_Bjlk_BBS_BH_UserArgs_MT128x256x32_MI16x16x1_SN_LDSB1_CLR1_GSU0_GSUC0_GSUWGMRR0_K1_LBSPPA1024_LBSPPB2048_MIWT4_8_NLCA2_NLCB1_PLR1_SU32_SUM0_SUS256_SPO1_SVW4_SKXCCM8_VWA4_VWB4_WSGRA0_WSGRB1_WGM8_WGMXCC1_WGMXCCGn1
    SolutionIndex: 151
    SolutionNameMin: Cijk_Ailk_Bjlk_BBS_BH_UserArgs_MT128x64x64_MI16x16x1_SN_LDSB0_CLR1_GSU0_GSUC0_GSUWGMRR0_K1_LBSPPA1024_LBSPPB512_MIWT4_2_NLCA1_NLCB1_PLR2_SU32_SUM0_SUS256_SPO1_SVW2_SKXCCM0_VWA2_VWB2_WSGRA1_WSGRB0_WGM8_WGMXCC1_WGMXCCGn1
    SolutionIndex: 152
    SolutionNameMin: Cijk_Ailk_Bjlk_BBS_BH_UserArgs_MT64x64x64_MI16x16x1_SN_LDSB0_CLR1_GSU0_GSUC0_GSUWGMRR0_K1_LBSPPA512_LBSPPB512_MIWT2_2_NLCA1_NLCB2_PLR2_SU32_SUM0_SUS256_SPO0_SVW2_SKXCCM8_VWA2_VWB2_WSGRA1_WSGRB0_WGM1_WGMXCC1_WGMXCCGn1
    SolutionIndex: 153
    SolutionNameMin: Cijk_Ailk_Bjlk_BBS_BH_UserArgs_MT128x64x64_MI16x16x1_SN_LDSB0_CLR1_GSU0_GSUC0_GSUWGMRR0_K1_LBSPPA1024_LBSPPB512_MIWT4_2_NLCA2_NLCB2_PLR2_SU32_SUM0_SUS256_SPO1_SVW2_SKXCCM8_VWA2_VWB2_WSGRA0_WSGRB1_WGM8_WGMXCC1_WGMXCCGn1
    SolutionIndex: 154
    SolutionNameMin: Cijk_Ailk_Bjlk_BBS_BH_UserArgs_MT128x128x64_MI16x16x1_SN_LDSB1_CLR1_GSU0_GSUC0_GSUWGMRR0_K1_LBSPPA1024_LBSPPB1024_MIWT4_4_NLCA2_NLCB2_PLR1_SU32_SUM0_SUS256_SPO0_SVW4_SKXCCM8_VWA4_VWB4_WSGRA0_WSGRB1_WGM8_WGMXCC1_WGMXCCGn1
    SolutionIndex: 155
    SolutionNameMin: Cijk_Ailk_Bjlk_BBS_BH_UserArgs_MT128x128x64_MI16x16x1_SN_LDSB0_CLR1_GSU0_GSUC0_GSUWGMRR0_K1_LBSPPA1024_LBSPPB1024_MIWT4_4_NLCA2_NLCB1_PLR1_SU32_SUM0_SUS256_SPO0_SVW4_SKXCCM8_VWA4_VWB4_WSGRA0_WSGRB0_WGM8_WGMXCC1_WGMXCCGn1
    SolutionIndex: 156
    SolutionNameMin: Cijk_Ailk_Bjlk_BBS_BH_UserArgs_MT128x256x32_MI16x16x1_SN_LDSB0_CLR1_GSU0_GSUC0_GSUWGMRR0_K1_LBSPPA1024_LBSPPB2048_MIWT4_8_NLCA2_NLCB2_PLR1_SU32_SUM0_SUS256_SPO1_SVW4_SKXCCM8_VWA4_VWB4_WSGRA1_WSGRB1_WGM8_WGMXCC1_WGMXCCGn1
    SolutionIndex: 157
    SolutionNameMin: Cijk_Ailk_Bjlk_BBS_BH_UserArgs_MT128x256x64_MI16x16x1_SN_LDSB1_CLR1_GSU0_GSUC0_GSUWGMRR0_K1_LBSPPA1024_LBSPPB2048_MIWT4_8_NLCA2_NLCB2_PLR2_SU32_SUM0_SUS256_SPO1_SVW4_SKXCCM8_VWA4_VWB4_WSGRA1_WSGRB0_WGM8_WGMXCC1_WGMXCCGn1
    SolutionIndex: 158
    SolutionNameMin: Cijk_Ailk_Bjlk_BBS_BH_UserArgs_MT128x128x64_MI16x16x1_SN_LDSB1_CLR1_GSU0_GSUC0_GSUWGMRR0_K1_LBSPPA1024_LBSPPB1024_MIWT4_4_NLCA2_NLCB1_PLR1_SU32_SUM0_SUS256_SPO1_SVW4_SKXCCM0_VWA4_VWB4_WSGRA1_WSGRB0_WGM8_WGMXCC1_WGMXCCGn1
    SolutionIndex: 159
    SolutionNameMin: Cijk_Ailk_Bjlk_BBS_BH_UserArgs_MT128x128x64_MI16x16x1_SN_LDSB1_CLR1_GSU0_GSUC0_GSUWGMRR0_K1_LBSPPA1024_LBSPPB1024_MIWT4_4_NLCA2_NLCB2_PLR1_SU32_SUM0_SUS256_SPO0_SVW4_SKXCCM8_VWA4_VWB4_WSGRA1_WSGRB0_WGM8_WGMXCC1_WGMXCCGn1
    SolutionIndex: 160
    SolutionNameMin: Cijk_Ailk_Bjlk_BBS_BH_UserArgs_MT128x128x64_MI16x16x1_SN_LDSB1_CLR1_GSU0_GSUC0_GSUWGMRR0_K1_LBSPPA1024_LBSPPB1024_MIWT4_4_NLCA1_NLCB2_PLR1_SU32_SUM0_SUS256_SPO1_SVW4_SKXCCM8_VWA4_VWB4_WSGRA0_WSGRB1_WGM8_WGMXCC1_WGMXCCGn1
    SolutionIndex: 161
    SolutionNameMin: Cijk_Ailk_Bjlk_BBS_BH_UserArgs_MT128x256x32_MI16x16x1_SN_LDSB1_CLR1_GSU0_GSUC0_GSUWGMRR0_K1_LBSPPA1024_LBSPPB2048_MIWT4_8_NLCA1_NLCB1_PLR1_SU32_SUM0_SUS256_SPO1_SVW4_SKXCCM8_VWA4_VWB4_WSGRA1_WSGRB1_WGM1_WGMXCC1_WGMXCCGn1
    SolutionIndex: 162
    SolutionNameMin: Cijk_Ailk_Bjlk_BBS_BH_UserArgs_MT256x256x32_MI16x16x1_SN_LDSB0_CLR1_GSU0_GSUC0_GSUWGMRR0_K1_LBSPPA2048_LBSPPB2048_MIWT8_8_NLCA1_NLCB1_PLR1_SU32_SUM0_SUS256_SPO0_SVW4_SKXCCM8_VWA4_VWB4_WSGRA0_WSGRB0_WGM8_WGMXCC1_WGMXCCGn1
    SolutionIndex: 163
    SolutionNameMin: Cijk_Ailk_Bjlk_BBS_BH_UserArgs_MT256x256x32_MI16x16x1_SN_LDSB0_CLR1_GSU0_GSUC0_GSUWGMRR0_K1_LBSPPA2048_LBSPPB2048_MIWT8_8_NLCA2_NLCB1_PLR1_SU32_SUM0_SUS256_SPO0_SVW4_SKXCCM8_VWA4_VWB4_WSGRA0_WSGRB0_WGM8_WGMXCC1_WGMXCCGn1
    SolutionIndex: 164
    SolutionNameMin: Cijk_Ailk_Bjlk_BBS_BH_UserArgs_MT256x128x64_MI16x16x1_SN_LDSB1_CLR1_GSU0_GSUC0_GSUWGMRR0_K1_LBSPPA2048_LBSPPB1024_MIWT8_4_NLCA1_NLCB1_PLR2_SU32_SUM0_SUS256_SPO1_SVW4_SKXCCM0_VWA4_VWB4_WSGRA1_WSGRB0_WGM1_WGMXCC1_WGMXCCGn1
    SolutionIndex: 165
    SolutionNameMin: Cijk_Ailk_Bjlk_BBS_BH_UserArgs_MT128x256x32_MI16x16x1_SN_LDSB1_CLR1_GSU0_GSUC0_GSUWGMRR0_K1_LBSPPA1024_LBSPPB2048_MIWT4_8_NLCA1_NLCB2_PLR1_SU32_SUM0_SUS256_SPO0_SVW4_SKXCCM8_VWA4_VWB4_WSGRA0_WSGRB0_WGM1_WGMXCC1_WGMXCCGn1
    SolutionIndex: 166
    SolutionNameMin: Cijk_Ailk_Bjlk_BBS_BH_UserArgs_MT128x256x32_MI16x16x1_SN_LDSB1_CLR1_GSU0_GSUC0_GSUWGMRR0_K1_LBSPPA1024_LBSPPB2048_MIWT4_8_NLCA2_NLCB2_PLR1_SU32_SUM0_SUS256_SPO1_SVW4_SKXCCM8_VWA4_VWB4_WSGRA1_WSGRB0_WGM1_WGMXCC1_WGMXCCGn1
    SolutionIndex: 167
    SolutionNameMin: Cijk_Ailk_Bjlk_BBS_BH_UserArgs_MT128x256x64_MI16x16x1_SN_LDSB1_CLR1_GSU0_GSUC0_GSUWGMRR0_K1_LBSPPA1024_LBSPPB2048_MIWT4_8_NLCA1_NLCB1_PLR2_SU32_SUM0_SUS256_SPO1_SVW4_SKXCCM8_VWA4_VWB4_WSGRA1_WSGRB0_WGM1_WGMXCC1_WGMXCCGn1
    SolutionIndex: 168
    SolutionNameMin: Cijk_Ailk_Bjlk_BBS_BH_UserArgs_MT256x256x32_MI16x16x1_SN_LDSB1_CLR1_GSU0_GSUC0_GSUWGMRR0_K1_LBSPPA2048_LBSPPB2048_MIWT8_8_NLCA2_NLCB2_PLR1_SU32_SUM0_SUS256_SPO1_SVW4_SKXCCM8_VWA4_VWB4_WSGRA1_WSGRB1_WGM1_WGMXCC1_WGMXCCGn1
    SolutionIndex: 169
    SolutionNameMin: Cijk_Ailk_Bjlk_BBS_BH_UserArgs_MT256x256x64_MI16x16x1_SN_LDSB1_CLR1_GSU0_GSUC0_GSUWGMRR0_K1_LBSPPA2048_LBSPPB2048_MIWT8_8_NLCA2_NLCB1_PLR1_SU32_SUM0_SUS256_SPO0_SVW4_SKXCCM0_VWA4_VWB4_WSGRA1_WSGRB0_WGM1_WGMXCC1_WGMXCCGn1
    SolutionIndex: 170
    SolutionNameMin: Cijk_Ailk_Bjlk_BBS_BH_UserArgs_MT128x128x64_MI16x16x1_SN_LDSB1_CLR1_GSU0_GSUC0_GSUWGMRR0_K1_LBSPPA1024_LBSPPB1024_MIWT4_4_NLCA2_NLCB2_PLR1_SU32_SUM0_SUS256_SPO1_SVW4_SKXCCM8_VWA4_VWB4_WSGRA0_WSGRB0_WGM1_WGMXCC1_WGMXCCGn1
    SolutionIndex: 171
    SolutionNameMin: Cijk_Ailk_Bjlk_BBS_BH_UserArgs_MT256x128x64_MI16x16x1_SN_LDSB1_CLR1_GSU0_GSUC0_GSUWGMRR0_K1_LBSPPA2048_LBSPPB1024_MIWT8_4_NLCA1_NLCB1_PLR2_SU32_SUM0_SUS256_SPO1_SVW4_SKXCCM8_VWA4_VWB4_WSGRA1_WSGRB1_WGM8_WGMXCC1_WGMXCCGn1
    SolutionIndex: 172
    SolutionNameMin: Cijk_Ailk_Bjlk_BBS_BH_UserArgs_MT128x256x32_MI16x16x1_SN_LDSB0_CLR1_GSU0_GSUC0_GSUWGMRR0_K1_LBSPPA1024_LBSPPB2048_MIWT4_8_NLCA1_NLCB2_PLR1_SU32_SUM0_SUS256_SPO0_SVW4_SKXCCM8_VWA4_VWB4_WSGRA1_WSGRB1_WGM1_WGMXCC1_WGMXCCGn1
    SolutionIndex: 173
    SolutionNameMin: Cijk_Ailk_Bjlk_BBS_BH_UserArgs_MT256x256x32_MI16x16x1_SN_LDSB1_CLR1_GSU0_GSUC0_GSUWGMRR0_K1_LBSPPA2048_LBSPPB2048_MIWT8_8_NLCA2_NLCB2_PLR1_SU32_SUM0_SUS256_SPO0_SVW4_SKXCCM8_VWA4_VWB4_WSGRA0_WSGRB1_WGM1_WGMXCC1_WGMXCCGn1
    SolutionIndex: 174
    SolutionNameMin: Cijk_Ailk_Bjlk_BBS_BH_UserArgs_MT128x256x32_MI16x16x1_SN_LDSB1_CLR1_GSU0_GSUC0_GSUWGMRR0_K1_LBSPPA1024_LBSPPB2048_MIWT4_8_NLCA1_NLCB2_PLR1_SU32_SUM0_SUS256_SPO0_SVW4_SKXCCM8_VWA4_VWB4_WSGRA1_WSGRB1_WGM1_WGMXCC1_WGMXCCGn1
    SolutionIndex: 175
    SolutionNameMin: Cijk_Ailk_Bjlk_BBS_BH_UserArgs_MT256x256x64_MI16x16x1_SN_LDSB1_CLR1_GSU0_GSUC0_GSUWGMRR0_K1_LBSPPA2048_LBSPPB2048_MIWT8_8_NLCA1_NLCB2_PLR1_SU32_SUM0_SUS256_SPO0_SVW4_SKXCCM8_VWA4_VWB4_WSGRA0_WSGRB0_WGM1_WGMXCC1_WGMXCCGn1
    SolutionIndex: 176
    SolutionNameMin: Cijk_Ailk_Bjlk_BBS_BH_UserArgs_MT256x256x32_MI16x16x1_SN_LDSB0_CLR1_GSU0_GSUC0_GSUWGMRR0_K1_LBSPPA2048_LBSPPB2048_MIWT8_8_NLCA1_NLCB1_PLR1_SU32_SUM0_SUS256_SPO0_SVW4_SKXCCM8_VWA4_VWB4_WSGRA0_WSGRB1_WGM8_WGMXCC1_WGMXCCGn1
    SolutionIndex: 177
    SolutionNameMin: Cijk_Ailk_Bjlk_BBS_BH_UserArgs_MT64x64x64_MI16x16x1_SN_LDSB0_CLR1_GSU0_GSUC0_GSUWGMRR0_K1_LBSPPA512_LBSPPB512_MIWT2_2_NLCA2_NLCB1_PLR1_SU32_SUM0_SUS256_SPO1_SVW2_SKXCCM0_VWA2_VWB2_WSGRA0_WSGRB0_WGM1_WGMXCC1_WGMXCCGn1
    SolutionIndex: 178
    SolutionNameMin: Cijk_Ailk_Bjlk_BBS_BH_UserArgs_MT64x64x64_MI16x16x1_SN_LDSB0_CLR1_GSU0_GSUC0_GSUWGMRR0_K1_LBSPPA512_LBSPPB512_MIWT2_2_NLCA1_NLCB1_PLR1_SU32_SUM0_SUS256_SPO1_SVW2_SKXCCM8_VWA2_VWB2_WSGRA1_WSGRB0_WGM1_WGMXCC1_WGMXCCGn1
    SolutionIndex: 179
    SolutionNameMin: Cijk_Ailk_Bjlk_BBS_BH_UserArgs_MT64x128x64_MI16x16x1_SN_LDSB0_CLR1_GSU0_GSUC0_GSUWGMRR0_K1_LBSPPA512_LBSPPB1024_MIWT2_4_NLCA1_NLCB2_PLR2_SU32_SUM0_SUS256_SPO0_SVW2_SKXCCM8_VWA2_VWB2_WSGRA1_WSGRB1_WGM1_WGMXCC1_WGMXCCGn1
    SolutionIndex: 180
    SolutionNameMin: Cijk_Ailk_Bjlk_BBS_BH_UserArgs_MT128x128x64_MI16x16x1_SN_LDSB0_CLR1_GSU0_GSUC0_GSUWGMRR0_K1_LBSPPA1024_LBSPPB1024_MIWT4_4_NLCA2_NLCB2_PLR2_SU32_SUM0_SUS256_SPO1_SVW4_SKXCCM0_VWA4_VWB4_WSGRA0_WSGRB0_WGM1_WGMXCC1_WGMXCCGn1
    SolutionIndex: 181
    SolutionNameMin: Cijk_Ailk_Bjlk_BBS_BH_UserArgs_MT64x128x64_MI16x16x1_SN_LDSB0_CLR1_GSU0_GSUC0_GSUWGMRR0_K1_LBSPPA512_LBSPPB1024_MIWT2_4_NLCA1_NLCB2_PLR2_SU32_SUM0_SUS256_SPO1_SVW2_SKXCCM0_VWA2_VWB2_WSGRA0_WSGRB1_WGM1_WGMXCC1_WGMXCCGn1
    SolutionIndex: 182
    SolutionNameMin: Cijk_Ailk_Bjlk_BBS_BH_UserArgs_MT128x64x64_MI16x16x1_SN_LDSB0_CLR1_GSU0_GSUC0_GSUWGMRR0_K1_LBSPPA1024_LBSPPB512_MIWT4_2_NLCA1_NLCB1_PLR3_SU32_SUM0_SUS256_SPO1_SVW2_SKXCCM8_VWA2_VWB2_WSGRA0_WSGRB0_WGM8_WGMXCC1_WGMXCCGn1
    SolutionIndex: 183
    SolutionNameMin: Cijk_Ailk_Bjlk_BBS_BH_UserArgs_MT128x64x64_MI16x16x1_SN_LDSB0_CLR1_GSU0_GSUC0_GSUWGMRR0_K1_LBSPPA1024_LBSPPB512_MIWT4_2_NLCA1_NLCB1_PLR2_SU32_SUM0_SUS256_SPO1_SVW2_SKXCCM8_VWA2_VWB2_WSGRA1_WSGRB0_WGM8_WGMXCC1_WGMXCCGn1
    SolutionIndex: 184
    SolutionNameMin: Cijk_Ailk_Bjlk_BBS_BH_UserArgs_MT128x128x32_MI16x16x1_SN_LDSB0_CLR1_GSU0_GSUC0_GSUWGMRR0_K1_LBSPPA1024_LBSPPB1024_MIWT4_4_NLCA1_NLCB2_PLR1_SU32_SUM0_SUS256_SPO1_SVW4_SKXCCM0_VWA4_VWB4_WSGRA1_WSGRB1_WGM1_WGMXCC1_WGMXCCGn1
    SolutionIndex: 185
    SolutionNameMin: Cijk_Ailk_Bjlk_BBS_BH_UserArgs_MT128x128x64_MI16x16x1_SN_LDSB0_CLR1_GSU0_GSUC0_GSUWGMRR0_K1_LBSPPA1024_LBSPPB1024_MIWT4_4_NLCA2_NLCB2_PLR1_SU32_SUM0_SUS256_SPO1_SVW4_SKXCCM8_VWA4_VWB4_WSGRA0_WSGRB1_WGM1_WGMXCC1_WGMXCCGn1
    SolutionIndex: 186
    SolutionNameMin: Cijk_Ailk_Bjlk_BBS_BH_UserArgs_MT128x256x64_MI16x16x1_SN_LDSB1_CLR1_GSU0_GSUC0_GSUWGMRR0_K1_LBSPPA1024_LBSPPB2048_MIWT4_8_NLCA1_NLCB1_PLR1_SU32_SUM0_SUS256_SPO1_SVW4_SKXCCM0_VWA4_VWB4_WSGRA1_WSGRB1_WGM8_WGMXCC1_WGMXCCGn1
    SolutionIndex: 187
    SolutionNameMin: Cijk_Ailk_Bjlk_BBS_BH_UserArgs_MT64x128x64_MI16x16x1_SN_LDSB0_CLR1_GSU0_GSUC0_GSUWGMRR0_K1_LBSPPA512_LBSPPB1024_MIWT2_4_NLCA1_NLCB1_PLR2_SU32_SUM0_SUS256_SPO1_SVW2_SKXCCM0_VWA2_VWB2_WSGRA1_WSGRB0_WGM8_WGMXCC1_WGMXCCGn1
    SolutionIndex: 188
    SolutionNameMin: Cijk_Ailk_Bjlk_BBS_BH_UserArgs_MT128x128x64_MI16x16x1_SN_LDSB1_CLR1_GSU0_GSUC0_GSUWGMRR0_K1_LBSPPA1024_LBSPPB1024_MIWT4_4_NLCA1_NLCB1_PLR1_SU32_SUM0_SUS256_SPO0_SVW4_SKXCCM0_VWA4_VWB4_WSGRA0_WSGRB1_WGM8_WGMXCC1_WGMXCCGn1
    SolutionIndex: 189
    SolutionNameMin: Cijk_Ailk_Bjlk_BBS_BH_UserArgs_MT128x128x64_MI16x16x1_SN_LDSB1_CLR1_GSU0_GSUC0_GSUWGMRR0_K1_LBSPPA1024_LBSPPB1024_MIWT4_4_NLCA2_NLCB1_PLR1_SU32_SUM0_SUS256_SPO0_SVW4_SKXCCM8_VWA4_VWB4_WSGRA0_WSGRB0_WGM8_WGMXCC1_WGMXCCGn1
    SolutionIndex: 190
    SolutionNameMin: Cijk_Ailk_Bjlk_BBS_BH_UserArgs_MT128x128x64_MI16x16x1_SN_LDSB0_CLR1_GSU0_GSUC0_GSUWGMRR0_K1_LBSPPA1024_LBSPPB1024_MIWT4_4_NLCA1_NLCB2_PLR1_SU32_SUM0_SUS256_SPO0_SVW4_SKXCCM8_VWA4_VWB4_WSGRA0_WSGRB0_WGM8_WGMXCC1_WGMXCCGn1
    SolutionIndex: 191
    SolutionNameMin: Cijk_Ailk_Bjlk_BBS_BH_UserArgs_MT128x256x64_MI16x16x1_SN_LDSB1_CLR1_GSU0_GSUC0_GSUWGMRR0_K1_LBSPPA1024_LBSPPB2048_MIWT4_8_NLCA2_NLCB2_PLR1_SU32_SUM0_SUS256_SPO1_SVW4_SKXCCM8_VWA4_VWB4_WSGRA1_WSGRB0_WGM8_WGMXCC1_WGMXCCGn1
    SolutionIndex: 192
    SolutionNameMin: Cijk_Ailk_Bjlk_BBS_BH_UserArgs_MT128x256x64_MI16x16x1_SN_LDSB1_CLR1_GSU0_GSUC0_GSUWGMRR0_K1_LBSPPA1024_LBSPPB2048_MIWT4_8_NLCA1_NLCB1_PLR1_SU32_SUM0_SUS256_SPO1_SVW4_SKXCCM0_VWA4_VWB4_WSGRA1_WSGRB1_WGM1_WGMXCC1_WGMXCCGn1
    SolutionIndex: 193
    SolutionNameMin: Cijk_Ailk_Bjlk_BBS_BH_UserArgs_MT128x128x64_MI16x16x1_SN_LDSB1_CLR1_GSU0_GSUC0_GSUWGMRR0_K1_LBSPPA1024_LBSPPB1024_MIWT4_4_NLCA1_NLCB1_PLR1_SU32_SUM0_SUS256_SPO1_SVW4_SKXCCM0_VWA4_VWB4_WSGRA1_WSGRB0_WGM8_WGMXCC1_WGMXCCGn1
    SolutionIndex: 194
    SolutionNameMin: Cijk_Ailk_Bjlk_BBS_BH_UserArgs_MT128x64x64_MI16x16x1_SN_LDSB0_CLR1_GSU0_GSUC0_GSUWGMRR0_K1_LBSPPA1024_LBSPPB512_MIWT4_2_NLCA2_NLCB1_PLR3_SU32_SUM0_SUS256_SPO1_SVW2_SKXCCM8_VWA2_VWB2_WSGRA0_WSGRB1_WGM8_WGMXCC1_WGMXCCGn1
    SolutionIndex: 195
    SolutionNameMin: Cijk_Ailk_Bjlk_BBS_BH_UserArgs_MT128x128x64_MI16x16x1_SN_LDSB1_CLR1_GSU0_GSUC0_GSUWGMRR0_K1_LBSPPA1024_LBSPPB1024_MIWT4_4_NLCA2_NLCB1_PLR1_SU32_SUM0_SUS256_SPO0_SVW4_SKXCCM8_VWA4_VWB4_WSGRA0_WSGRB1_WGM8_WGMXCC1_WGMXCCGn1
    SolutionIndex: 196
    SolutionNameMin: Cijk_Ailk_Bjlk_BBS_BH_UserArgs_MT128x128x64_MI16x16x1_SN_LDSB1_CLR1_GSU0_GSUC0_GSUWGMRR0_K1_LBSPPA1024_LBSPPB1024_MIWT4_4_NLCA1_NLCB2_PLR1_SU32_SUM0_SUS256_SPO1_SVW4_SKXCCM8_VWA4_VWB4_WSGRA1_WSGRB0_WGM8_WGMXCC1_WGMXCCGn1
    SolutionIndex: 197
    SolutionNameMin: Cijk_Ailk_Bjlk_BBS_BH_UserArgs_MT256x128x32_MI16x16x1_SN_LDSB1_CLR1_GSU0_GSUC0_GSUWGMRR0_K1_LBSPPA2048_LBSPPB1024_MIWT8_4_NLCA1_NLCB1_PLR1_SU32_SUM0_SUS256_SPO1_SVW2_SKXCCM8_VWA2_VWB2_WSGRA0_WSGRB1_WGM8_WGMXCC1_WGMXCCGn1
    SolutionIndex: 198
    SolutionNameMin: Cijk_Ailk_Bjlk_BBS_BH_UserArgs_MT128x256x64_MI16x16x1_SN_LDSB1_CLR1_GSU0_GSUC0_GSUWGMRR0_K1_LBSPPA1024_LBSPPB2048_MIWT4_8_NLCA1_NLCB2_PLR1_SU32_SUM0_SUS256_SPO0_SVW4_SKXCCM0_VWA4_VWB4_WSGRA0_WSGRB1_WGM1_WGMXCC1_WGMXCCGn1
    SolutionIndex: 199
    SolutionNameMin: Cijk_Ailk_Bjlk_BBS_BH_UserArgs_MT256x256x64_MI16x16x1_SN_LDSB1_CLR1_GSU0_GSUC0_GSUWGMRR0_K1_LBSPPA2048_LBSPPB2048_MIWT8_8_NLCA2_NLCB1_PLR2_SU32_SUM0_SUS256_SPO0_SVW4_SKXCCM0_VWA4_VWB4_WSGRA0_WSGRB0_WGM1_WGMXCC1_WGMXCCGn1
    SolutionIndex: 200
    SolutionNameMin: Cijk_Ailk_Bjlk_BBS_BH_UserArgs_MT128x256x64_MI16x16x1_SN_LDSB1_CLR1_GSU0_GSUC0_GSUWGMRR0_K1_LBSPPA1024_LBSPPB2048_MIWT4_8_NLCA2_NLCB2_PLR1_SU32_SUM0_SUS256_SPO1_SVW4_SKXCCM0_VWA4_VWB4_WSGRA0_WSGRB1_WGM1_WGMXCC1_WGMXCCGn1
    SolutionIndex: 201
    SolutionNameMin: Cijk_Ailk_Bjlk_BBS_BH_UserArgs_MT128x128x64_MI16x16x1_SN_LDSB1_CLR1_GSU0_GSUC0_GSUWGMRR0_K1_LBSPPA1024_LBSPPB1024_MIWT4_4_NLCA1_NLCB1_PLR1_SU32_SUM0_SUS256_SPO0_SVW4_SKXCCM8_VWA4_VWB4_WSGRA1_WSGRB1_WGM8_WGMXCC1_WGMXCCGn1
    SolutionIndex: 202
    SolutionNameMin: Cijk_Ailk_Bjlk_BBS_BH_UserArgs_MT256x128x32_MI16x16x1_SN_LDSB1_CLR1_GSU0_GSUC0_GSUWGMRR0_K1_LBSPPA2048_LBSPPB1024_MIWT8_4_NLCA1_NLCB2_PLR1_SU32_SUM0_SUS256_SPO1_SVW4_SKXCCM8_VWA4_VWB4_WSGRA1_WSGRB1_WGM8_WGMXCC1_WGMXCCGn1
    SolutionIndex: 203
    SolutionNameMin: Cijk_Ailk_Bjlk_BBS_BH_UserArgs_MT256x128x32_MI16x16x1_SN_LDSB1_CLR1_GSU0_GSUC0_GSUWGMRR0_K1_LBSPPA2048_LBSPPB1024_MIWT8_4_NLCA2_NLCB2_PLR1_SU32_SUM0_SUS256_SPO0_SVW4_SKXCCM8_VWA4_VWB4_WSGRA0_WSGRB0_WGM1_WGMXCC1_WGMXCCGn1
    SolutionIndex: 204
    SolutionNameMin: Cijk_Ailk_Bjlk_BBS_BH_UserArgs_MT128x256x64_MI16x16x1_SN_LDSB1_CLR1_GSU0_GSUC0_GSUWGMRR0_K1_LBSPPA1024_LBSPPB2048_MIWT4_8_NLCA1_NLCB1_PLR1_SU32_SUM0_SUS256_SPO0_SVW4_SKXCCM8_VWA4_VWB4_WSGRA1_WSGRB0_WGM1_WGMXCC1_WGMXCCGn1
    SolutionIndex: 205
    SolutionNameMin: Cijk_Ailk_Bjlk_BBS_BH_UserArgs_MT256x256x64_MI16x16x1_SN_LDSB1_CLR1_GSU0_GSUC0_GSUWGMRR0_K1_LBSPPA2048_LBSPPB2048_MIWT8_8_NLCA2_NLCB2_PLR3_SU32_SUM0_SUS256_SPO0_SVW4_SKXCCM8_VWA4_VWB4_WSGRA1_WSGRB0_WGM8_WGMXCC1_WGMXCCGn1
    SolutionIndex: 206
    SolutionNameMin: Cijk_Ailk_Bjlk_BBS_BH_UserArgs_MT256x256x64_MI16x16x1_SN_LDSB1_CLR1_GSU0_GSUC0_GSUWGMRR0_K1_LBSPPA2048_LBSPPB2048_MIWT8_8_NLCA1_NLCB2_PLR1_SU32_SUM0_SUS256_SPO0_SVW4_SKXCCM0_VWA4_VWB4_WSGRA0_WSGRB1_WGM1_WGMXCC1_WGMXCCGn1
    SolutionIndex: 207
    SolutionNameMin: Cijk_Ailk_Bjlk_BBS_BH_UserArgs_MT256x128x64_MI16x16x1_SN_LDSB1_CLR1_GSU0_GSUC0_GSUWGMRR0_K1_LBSPPA2048_LBSPPB1024_MIWT8_4_NLCA1_NLCB2_PLR2_SU32_SUM0_SUS256_SPO0_SVW4_SKXCCM8_VWA4_VWB4_WSGRA0_WSGRB1_WGM8_WGMXCC1_WGMXCCGn1
    SolutionIndex: 208
    SolutionNameMin: Cijk_Ailk_Bjlk_BBS_BH_UserArgs_MT256x256x32_MI16x16x1_SN_LDSB0_CLR1_GSU0_GSUC0_GSUWGMRR0_K1_LBSPPA2048_LBSPPB2048_MIWT8_8_NLCA2_NLCB2_PLR1_SU32_SUM0_SUS256_SPO0_SVW4_SKXCCM8_VWA4_VWB4_WSGRA1_WSGRB0_WGM1_WGMXCC1_WGMXCCGn1
    SolutionIndex: 209
    SolutionNameMin: Cijk_Ailk_Bjlk_BBS_BH_UserArgs_MT256x256x64_MI16x16x1_SN_LDSB1_CLR1_GSU0_GSUC0_GSUWGMRR0_K1_LBSPPA2048_LBSPPB2048_MIWT8_8_NLCA2_NLCB2_PLR2_SU32_SUM0_SUS256_SPO0_SVW4_SKXCCM8_VWA4_VWB4_WSGRA1_WSGRB0_WGM1_WGMXCC1_WGMXCCGn1
    SolutionIndex: 210
    SolutionNameMin: Cijk_Ailk_Bjlk_BBS_BH_UserArgs_MT256x256x64_MI16x16x1_SN_LDSB1_CLR1_GSU0_GSUC0_GSUWGMRR0_K1_LBSPPA2048_LBSPPB2048_MIWT8_8_NLCA1_NLCB2_PLR1_SU32_SUM0_SUS256_SPO1_SVW4_SKXCCM8_VWA4_VWB4_WSGRA1_WSGRB1_WGM1_WGMXCC1_WGMXCCGn1
    SolutionIndex: 211
    SolutionNameMin: Cijk_Ailk_Bjlk_BBS_BH_UserArgs_MT256x256x32_MI16x16x1_SN_LDSB0_CLR1_GSU0_GSUC0_GSUWGMRR0_K1_LBSPPA2048_LBSPPB2048_MIWT8_8_NLCA1_NLCB2_PLR1_SU32_SUM0_SUS256_SPO0_SVW4_SKXCCM8_VWA4_VWB4_WSGRA0_WSGRB0_WGM1_WGMXCC1_WGMXCCGn1
    SolutionIndex: 212
    SolutionNameMin: Cijk_Ailk_Bjlk_BBS_BH_UserArgs_MT256x128x32_MI16x16x1_SN_LDSB1_CLR1_GSU0_GSUC0_GSUWGMRR0_K1_LBSPPA2048_LBSPPB1024_MIWT8_4_NLCA2_NLCB1_PLR1_SU32_SUM0_SUS256_SPO0_SVW4_SKXCCM8_VWA4_VWB4_WSGRA0_WSGRB1_WGM8_WGMXCC1_WGMXCCGn1
    SolutionIndex: 213
    SolutionNameMin: Cijk_Ailk_Bjlk_BBS_BH_UserArgs_MT256x256x32_MI16x16x1_SN_LDSB1_CLR1_GSU0_GSUC0_GSUWGMRR0_K1_LBSPPA2048_LBSPPB2048_MIWT8_8_NLCA1_NLCB2_PLR1_SU32_SUM0_SUS256_SPO1_SVW4_SKXCCM8_VWA4_VWB4_WSGRA1_WSGRB0_WGM8_WGMXCC1_WGMXCCGn1
    SolutionIndex: 214
    SolutionNameMin: Cijk_Ailk_Bjlk_BBS_BH_UserArgs_MT256x256x64_MI16x16x1_SN_LDSB1_CLR1_GSU0_GSUC0_GSUWGMRR0_K1_LBSPPA2048_LBSPPB2048_MIWT8_8_NLCA1_NLCB1_PLR1_SU32_SUM0_SUS256_SPO1_SVW4_SKXCCM8_VWA4_VWB4_WSGRA0_WSGRB0_WGM8_WGMXCC1_WGMXCCGn1
    SolutionIndex: 215
    SolutionNameMin: Cijk_Ailk_Bjlk_BBS_BH_UserArgs_MT256x256x64_MI16x16x1_SN_LDSB1_CLR1_GSU0_GSUC0_GSUWGMRR0_K1_LBSPPA2048_LBSPPB2048_MIWT8_8_NLCA1_NLCB1_PLR3_SU32_SUM0_SUS256_SPO0_SVW8_SKXCCM8_VWA8_VWB8_WSGRA1_WSGRB0_WGM8_WGMXCC1_WGMXCCGn1
- - - [128, 128, 1, 128]
    - [20, 0.055]
  - - [128, 128, 1, 256]
    - [30, 0.091]
  - - [128, 128, 1, 512]
    - [33, 0.139]
  - - [128, 128, 1, 1024]
    - [32, 0.159]
  - - [128, 128, 1, 2048]
    - [33, 0.206]
  - - [128, 128, 1, 4096]
    - [30, 0.504]
  - - [128, 128, 1, 8192]
    - [25, 1.002]
  - - [128, 256, 1, 128]
    - [23, 0.11]
  - - [128, 256, 1, 256]
    - [21, 0.177]
  - - [128, 256, 1, 512]
    - [30, 0.271]
  - - [128, 256, 1, 1024]
    - [30, 0.35]
  - - [128, 256, 1, 2048]
    - [32, 0.742]
  - - [128, 256, 1, 4096]
    - [19, 1.475]
  - - [128, 256, 1, 8192]
    - [29, 2.456]
  - - [128, 512, 1, 128]
    - [21, 0.213]
  - - [128, 512, 1, 256]
    - [30, 0.351]
  - - [128, 512, 1, 512]
    - [26, 0.53]
  - - [128, 512, 1, 1024]
    - [28, 1.03]
  - - [128, 512, 1, 2048]
    - [22, 1.817]
  - - [128, 512, 1, 4096]
    - [28, 2.888]
  - - [128, 512, 1, 8192]
    - [27, 4.141]
  - - [128, 1024, 1, 128]
    - [31, 0.4]
  - - [128, 1024, 1, 256]
    - [34, 0.686]
  - - [128, 1024, 1, 512]
    - [28, 1.199]
  - - [128, 1024, 1, 1024]
    - [24, 2.013]
  - - [128, 1024, 1, 2048]
    - [28, 3.136]
  - - [128, 1024, 1, 4096]
    - [18, 4.637]
  - - [128, 1024, 1, 8192]
    - [11, 6.827]
  - - [128, 2048, 1, 128]
    - [24, 0.807]
  - - [128, 2048, 1, 256]
    - [21, 1.293]
  - - [128, 2048, 1, 512]
    - [31, 2.175]
  - - [128, 2048, 1, 1024]
    - [17, 3.4]
  - - [128, 2048, 1, 2048]
    - [14, 5.303]
  - - [128, 2048, 1, 4096]
    - [6, 8.099]
  - - [128, 2048, 1, 8192]
    - [9, 10.768]
  - - [128, 4096, 1, 128]
    - [15, 1.486]
  - - [128, 4096, 1, 256]
    - [16, 2.366]
  - - [128, 4096, 1, 512]
    - [16, 3.667]
  - - [128, 4096, 1, 1024]
    - [4, 6.03]
  - - [128, 4096, 1, 2048]
    - [12, 9.634]
  - - [128, 4096, 1, 4096]
    - [10, 12.506]
  - - [128, 4096, 1, 8192]
    - [2, 15.405]
  - - [128, 8192, 1, 128]
    - [5, 2.645]
  - - [128, 8192, 1, 256]
    - [8, 4.219]
  - - [128, 8192, 1, 512]
    - [7, 7.02]
  - - [128, 8192, 1, 1024]
    - [13, 10.378]
  - - [128, 8192, 1, 2048]
    - [1, 13.008]
  - - [128, 8192, 1, 4096]
    - [3, 16.879]
  - - [128, 8192, 1, 8192]
    - [0, 21.439]
  - - [256, 128, 1, 128]
    - [22, 0.106]
  - - [256, 128, 1, 256]
    - [35, 0.173]
  - - [256, 128, 1, 512]
    - [30, 0.269]
  - - [256, 128, 1, 1024]
    - [36, 0.376]
  - - [256, 128, 1, 2048]
    - [30, 0.76]
  - - [256, 128, 1, 4096]
    - [27, 1.445]
  - - [256, 128, 1, 8192]
    - [37, 2.407]
  - - [256, 256, 1, 128]
    - [20, 0.213]
  - - [256, 256, 1, 256]
    - [31, 0.352]
  - - [256, 256, 1, 512]
    - [36, 0.557]
  - - [256, 256, 1, 1024]
    - [38, 1.043]
  - - [256, 256, 1, 2048]
    - [28, 1.785]
  - - [256, 256, 1, 4096]
    - [28, 2.978]
  - - [256, 256, 1, 8192]
    - [26, 4.094]
  - - [256, 512, 1, 128]
    - [39, 0.376]
  - - [256, 512, 1, 256]
    - [38, 0.702]
  - - [256, 512, 1, 512]
    - [31, 1.195]
  - - [256, 512, 1, 1024]
    - [24, 2.042]
  - - [256, 512, 1, 2048]
    - [24, 3.257]
  - - [256, 512, 1, 4096]
    - [16, 4.751]
  - - [256, 512, 1, 8192]
    - [40, 6.599]
  - - [256, 1024, 1, 128]
    - [21, 0.822]
  - - [256, 1024, 1, 256]
    - [38, 1.335]
  - - [256, 1024, 1, 512]
    - [28, 2.161]
  - - [256, 1024, 1, 1024]
    - [17, 3.585]
  - - [256, 1024, 1, 2048]
    - [18, 5.307]
  - - [256, 1024, 1, 4096]
    - [41, 8.066]
  - - [256, 1024, 1, 8192]
    - [42, 10.762]
  - - [256, 2048, 1, 128]
    - [43, 1.519]
  - - [256, 2048, 1, 256]
    - [44, 2.408]
  - - [256, 2048, 1, 512]
    - [16, 3.753]
  - - [256, 2048, 1, 1024]
    - [45, 6.143]
  - - [256, 2048, 1, 2048]
    - [7, 9.39]
  - - [256, 2048, 1, 4096]
    - [46, 12.274]
  - - [256, 2048, 1, 8192]
    - [47, 15.146]
  - - [256, 4096, 1, 128]
    - [48, 2.611]
  - - [256, 4096, 1, 256]
    - [49, 4.423]
  - - [256, 4096, 1, 512]
    - [7, 7.198]
  - - [256, 4096, 1, 1024]
    - [42, 10.468]
  - - [256, 4096, 1, 2048]
    - [50, 13.083]
  - - [256, 4096, 1, 4096]
    - [51, 17.116]
  - - [256, 4096, 1, 8192]
    - [52, 21.408]
  - - [256, 8192, 1, 128]
    - [48, 4.406]
  - - [256, 8192, 1, 256]
    - [7, 5.979]
  - - [256, 8192, 1, 512]
    - [53, 10.168]
  - - [256, 8192, 1, 1024]
    - [54, 14.15]
  - - [256, 8192, 1, 2048]
    - [55, 17.861]
  - - [256, 8192, 1, 4096]
    - [56, 23.38]
  - - [256, 8192, 1, 8192]
    - [57, 25.793]
  - - [512, 128, 1, 128]
    - [19, 0.21]
  - - [512, 128, 1, 256]
    - [34, 0.344]
  - - [512, 128, 1, 512]
    - [30, 0.539]
  - - [512, 128, 1, 1024]
    - [30, 1.021]
  - - [512, 128, 1, 2048]
    - [58, 1.784]
  - - [512, 128, 1, 4096]
    - [59, 2.932]
  - - [512, 128, 1, 8192]
    - [60, 4.05]
  - - [512, 256, 1, 128]
    - [22, 0.403]
  - - [512, 256, 1, 256]
    - [20, 0.694]
  - - [512, 256, 1, 512]
    - [21, 1.193]
  - - [512, 256, 1, 1024]
    - [58, 2.055]
  - - [512, 256, 1, 2048]
    - [58, 3.27]
  - - [512, 256, 1, 4096]
    - [61, 4.794]
  - - [512, 256, 1, 8192]
    - [62, 6.75]
  - - [512, 512, 1, 128]
    - [19, 0.83]
  - - [512, 512, 1, 256]
    - [20, 1.292]
  - - [512, 512, 1, 512]
    - [58, 2.188]
  - - [512, 512, 1, 1024]
    - [23, 3.454]
  - - [512, 512, 1, 2048]
    - [63, 5.257]
  - - [512, 512, 1, 4096]
    - [62, 8.114]
  - - [512, 512, 1, 8192]
    - [64, 10.147]
  - - [512, 1024, 1, 128]
    - [65, 1.503]
  - - [512, 1024, 1, 256]
    - [66, 2.363]
  - - [512, 1024, 1, 512]
    - [16, 3.739]
  - - [512, 1024, 1, 1024]
    - [67, 5.953]
  - - [512, 1024, 1, 2048]
    - [12, 9.507]
  - - [512, 1024, 1, 4096]
    - [68, 11.778]
  - - [512, 1024, 1, 8192]
    - [3, 14.435]
  - - [512, 2048, 1, 128]
    - [69, 2.629]
  - - [512, 2048, 1, 256]
    - [70, 4.212]
  - - [512, 2048, 1, 512]
    - [7, 7.184]
  - - [512, 2048, 1, 1024]
    - [7, 10.402]
  - - [512, 2048, 1, 2048]
    - [71, 13.0]
  - - [512, 2048, 1, 4096]
    - [54, 16.036]
  - - [512, 2048, 1, 8192]
    - [72, 20.594]
  - - [512, 4096, 1, 128]
    - [6, 4.447]
  - - [512, 4096, 1, 256]
    - [73, 6.027]
  - - [512, 4096, 1, 512]
    - [3, 10.208]
  - - [512, 4096, 1, 1024]
    - [74, 13.975]
  - - [512, 4096, 1, 2048]
    - [75, 17.701]
  - - [512, 4096, 1, 4096]
    - [76, 22.725]
  - - [512, 4096, 1, 8192]
    - [77, 25.132]
  - - [512, 8192, 1, 128]
    - [78, 6.589]
  - - [512, 8192, 1, 256]
    - [79, 8.573]
  - - [512, 8192, 1, 512]
    - [80, 13.152]
  - - [512, 8192, 1, 1024]
    - [81, 18.415]
  - - [512, 8192, 1, 2048]
    - [56, 23.162]
  - - [512, 8192, 1, 4096]
    - [82, 25.92]
  - - [512, 8192, 1, 8192]
    - [83, 29.42]
  - - [1024, 128, 1, 128]
    - [31, 0.401]
  - - [1024, 128, 1, 256]
    - [34, 0.704]
  - - [1024, 128, 1, 512]
    - [58, 1.211]
  - - [1024, 128, 1, 1024]
    - [58, 2.048]
  - - [1024, 128, 1, 2048]
    - [84, 3.185]
  - - [1024, 128, 1, 4096]
    - [85, 4.742]
  - - [1024, 128, 1, 8192]
    - [7, 6.842]
  - - [1024, 256, 1, 128]
    - [38, 0.837]
  - - [1024, 256, 1, 256]
    - [38, 1.327]
  - - [1024, 256, 1, 512]
    - [28, 2.216]
  - - [1024, 256, 1, 1024]
    - [23, 3.454]
  - - [1024, 256, 1, 2048]
    - [7, 5.373]
  - - [1024, 256, 1, 4096]
    - [86, 7.957]
  - - [1024, 256, 1, 8192]
    - [87, 10.436]
  - - [1024, 512, 1, 128]
    - [65, 1.508]
  - - [1024, 512, 1, 256]
    - [66, 2.414]
  - - [1024, 512, 1, 512]
    - [16, 3.748]
  - - [1024, 512, 1, 1024]
    - [12, 6.109]
  - - [1024, 512, 1, 2048]
    - [46, 9.226]
  - - [1024, 512, 1, 4096]
    - [88, 11.448]
  - - [1024, 512, 1, 8192]
    - [89, 14.054]
  - - [1024, 1024, 1, 128]
    - [90, 2.648]
  - - [1024, 1024, 1, 256]
    - [9, 4.426]
  - - [1024, 1024, 1, 512]
    - [7, 7.284]
  - - [1024, 1024, 1, 1024]
    - [7, 10.554]
  - - [1024, 1024, 1, 2048]
    - [91, 12.418]
  - - [1024, 1024, 1, 4096]
    - [92, 15.287]
  - - [1024, 1024, 1, 8192]
    - [93, 19.585]
  - - [1024, 2048, 1, 128]
    - [94, 4.354]
  - - [1024, 2048, 1, 256]
    - [73, 5.916]
  - - [1024, 2048, 1, 512]
    - [95, 10.046]
  - - [1024, 2048, 1, 1024]
    - [54, 13.867]
  - - [1024, 2048, 1, 2048]
    - [96, 16.98]
  - - [1024, 2048, 1, 4096]
    - [97, 21.585]
  - - [1024, 2048, 1, 8192]
    - [98, 25.216]
  - - [1024, 4096, 1, 128]
    - [99, 6.588]
  - - [1024, 4096, 1, 256]
    - [100, 8.647]
  - - [1024, 4096, 1, 512]
    - [72, 13.166]
  - - [1024, 4096, 1, 1024]
    - [101, 18.122]
  - - [1024, 4096, 1, 2048]
    - [102, 22.986]
  - - [1024, 4096, 1, 4096]
    - [103, 25.503]
  - - [1024, 4096, 1, 8192]
    - [104, 28.248]
  - - [1024, 8192, 1, 128]
    - [105, 8.373]
  - - [1024, 8192, 1, 256]
    - [106, 11.158]
  - - [1024, 8192, 1, 512]
    - [107, 17.081]
  - - [1024, 8192, 1, 1024]
    - [55, 22.827]
  - - [1024, 8192, 1, 2048]
    - [108, 25.543]
  - - [1024, 8192, 1, 4096]
    - [109, 29.04]
  - - [1024, 8192, 1, 8192]
    - [110, 33.636]
  - - [2048, 128, 1, 128]
    - [20, 0.825]
  - - [2048, 128, 1, 256]
    - [58, 1.348]
  - - [2048, 128, 1, 512]
    - [28, 2.206]
  - - [2048, 128, 1, 1024]
    - [31, 3.387]
  - - [2048, 128, 1, 2048]
    - [62, 5.479]
  - - [2048, 128, 1, 4096]
    - [48, 8.327]
  - - [2048, 128, 1, 8192]
    - [111, 10.903]
  - - [2048, 256, 1, 128]
    - [112, 1.51]
  - - [2048, 256, 1, 256]
    - [113, 2.305]
  - - [2048, 256, 1, 512]
    - [16, 3.736]
  - - [2048, 256, 1, 1024]
    - [48, 6.07]
  - - [2048, 256, 1, 2048]
    - [86, 9.05]
  - - [2048, 256, 1, 4096]
    - [114, 11.761]
  - - [2048, 256, 1, 8192]
    - [115, 15.099]
  - - [2048, 512, 1, 128]
    - [48, 2.672]
  - - [2048, 512, 1, 256]
    - [9, 4.269]
  - - [2048, 512, 1, 512]
    - [7, 7.153]
  - - [2048, 512, 1, 1024]
    - [46, 10.208]
  - - [2048, 512, 1, 2048]
    - [46, 12.758]
  - - [2048, 512, 1, 4096]
    - [116, 16.231]
  - - [2048, 512, 1, 8192]
    - [117, 20.939]
  - - [2048, 1024, 1, 128]
    - [118, 4.442]
  - - [2048, 1024, 1, 256]
    - [91, 6.021]
  - - [2048, 1024, 1, 512]
    - [95, 10.083]
  - - [2048, 1024, 1, 1024]
    - [119, 13.785]
  - - [2048, 1024, 1, 2048]
    - [120, 17.406]
  - - [2048, 1024, 1, 4096]
    - [121, 21.736]
  - - [2048, 1024, 1, 8192]
    - [122, 23.996]
  - - [2048, 2048, 1, 128]
    - [123, 6.564]
  - - [2048, 2048, 1, 256]
    - [62, 8.556]
  - - [2048, 2048, 1, 512]
    - [75, 13.149]
  - - [2048, 2048, 1, 1024]
    - [124, 18.571]
  - - [2048, 2048, 1, 2048]
    - [125, 23.179]
  - - [2048, 2048, 1, 4096]
    - [126, 25.918]
  - - [2048, 2048, 1, 8192]
    - [127, 27.888]
  - - [2048, 4096, 1, 128]
    - [128, 8.47]
  - - [2048, 4096, 1, 256]
    - [3, 11.417]
  - - [2048, 4096, 1, 512]
    - [129, 17.31]
  - - [2048, 4096, 1, 1024]
    - [130, 22.744]
  - - [2048, 4096, 1, 2048]
    - [131, 25.446]
  - - [2048, 4096, 1, 4096]
    - [132, 28.399]
  - - [2048, 4096, 1, 8192]
    - [133, 33.229]
  - - [2048, 8192, 1, 128]
    - [134, 9.935]
  - - [2048, 8192, 1, 256]
    - [135, 14.813]
  - - [2048, 8192, 1, 512]
    - [136, 19.731]
  - - [2048, 8192, 1, 1024]
    - [137, 24.549]
  - - [2048, 8192, 1, 2048]
    - [138, 28.406]
  - - [2048, 8192, 1, 4096]
    - [139, 32.763]
  - - [2048, 8192, 1, 8192]
    - [140, 34.65]
  - - [4096, 128, 1, 128]
    - [113, 1.503]
  - - [4096, 128, 1, 256]
    - [16, 2.365]
  - - [4096, 128, 1, 512]
    - [141, 3.736]
  - - [4096, 128, 1, 1024]
    - [48, 6.005]
  - - [4096, 128, 1, 2048]
    - [142, 9.403]
  - - [4096, 128, 1, 4096]
    - [143, 11.824]
  - - [4096, 128, 1, 8192]
    - [144, 15.34]
  - - [4096, 256, 1, 128]
    - [118, 2.67]
  - - [4096, 256, 1, 256]
    - [8, 4.266]
  - - [4096, 256, 1, 512]
    - [7, 7.26]
  - - [4096, 256, 1, 1024]
    - [46, 10.373]
  - - [4096, 256, 1, 2048]
    - [145, 12.92]
  - - [4096, 256, 1, 4096]
    - [74, 16.772]
  - - [4096, 256, 1, 8192]
    - [56, 21.185]
  - - [4096, 512, 1, 128]
    - [90, 4.493]
  - - [4096, 512, 1, 256]
    - [73, 5.96]
  - - [4096, 512, 1, 512]
    - [146, 9.996]
  - - [4096, 512, 1, 1024]
    - [147, 13.847]
  - - [4096, 512, 1, 2048]
    - [148, 17.728]
  - - [4096, 512, 1, 4096]
    - [149, 22.341]
  - - [4096, 512, 1, 8192]
    - [150, 25.03]
  - - [4096, 1024, 1, 128]
    - [151, 6.597]
  - - [4096, 1024, 1, 256]
    - [152, 8.288]
  - - [4096, 1024, 1, 512]
    - [153, 12.994]
  - - [4096, 1024, 1, 1024]
    - [154, 18.554]
  - - [4096, 1024, 1, 2048]
    - [155, 23.016]
  - - [4096, 1024, 1, 4096]
    - [156, 25.137]
  - - [4096, 1024, 1, 8192]
    - [157, 27.941]
  - - [4096, 2048, 1, 128]
    - [158, 8.415]
  - - [4096, 2048, 1, 256]
    - [95, 11.331]
  - - [4096, 2048, 1, 512]
    - [159, 16.977]
  - - [4096, 2048, 1, 1024]
    - [160, 22.574]
  - - [4096, 2048, 1, 2048]
    - [161, 25.359]
  - - [4096, 2048, 1, 4096]
    - [162, 28.483]
  - - [4096, 2048, 1, 8192]
    - [163, 32.944]
  - - [4096, 4096, 1, 128]
    - [164, 9.838]
  - - [4096, 4096, 1, 256]
    - [72, 14.691]
  - - [4096, 4096, 1, 512]
    - [165, 19.726]
  - - [4096, 4096, 1, 1024]
    - [166, 24.622]
  - - [4096, 4096, 1, 2048]
    - [167, 28.34]
  - - [4096, 4096, 1, 4096]
    - [168, 32.486]
  - - [4096, 4096, 1, 8192]
    - [169, 34.324]
  - - [4096, 8192, 1, 128]
    - [170, 10.681]
  - - [4096, 8192, 1, 256]
    - [171, 15.657]
  - - [4096, 8192, 1, 512]
    - [172, 21.078]
  - - [4096, 8192, 1, 1024]
    - [173, 27.094]
  - - [4096, 8192, 1, 2048]
    - [174, 32.49]
  - - [4096, 8192, 1, 4096]
    - [175, 33.654]
  - - [4096, 8192, 1, 8192]
    - [176, 36.461]
  - - [8192, 128, 1, 128]
    - [177, 2.64]
  - - [8192, 128, 1, 256]
    - [178, 4.243]
  - - [8192, 128, 1, 512]
    - [62, 7.017]
  - - [8192, 128, 1, 1024]
    - [86, 10.211]
  - - [8192, 128, 1, 2048]
    - [179, 12.973]
  - - [8192, 128, 1, 4096]
    - [74, 16.693]
  - - [8192, 128, 1, 8192]
    - [180, 21.388]
  - - [8192, 256, 1, 128]
    - [48, 4.485]
  - - [8192, 256, 1, 256]
    - [181, 5.83]
  - - [8192, 256, 1, 512]
    - [182, 9.934]
  - - [8192, 256, 1, 1024]
    - [183, 13.763]
  - - [8192, 256, 1, 2048]
    - [184, 17.591]
  - - [8192, 256, 1, 4096]
    - [185, 22.776]
  - - [8192, 256, 1, 8192]
    - [186, 25.907]
  - - [8192, 512, 1, 128]
    - [187, 6.5]
  - - [8192, 512, 1, 256]
    - [188, 8.369]
  - - [8192, 512, 1, 512]
    - [189, 13.059]
  - - [8192, 512, 1, 1024]
    - [190, 18.318]
  - - [8192, 512, 1, 2048]
    - [148, 22.648]
  - - [8192, 512, 1, 4096]
    - [191, 25.749]
  - - [8192, 512, 1, 8192]
    - [192, 28.863]
  - - [8192, 1024, 1, 128]
    - [193, 8.344]
  - - [8192, 1024, 1, 256]
    - [194, 11.016]
  - - [8192, 1024, 1, 512]
    - [195, 17.098]
  - - [8192, 1024, 1, 1024]
    - [196, 22.799]
  - - [8192, 1024, 1, 2048]
    - [197, 25.871]
  - - [8192, 1024, 1, 4096]
    - [198, 28.444]
  - - [8192, 1024, 1, 8192]
    - [199, 33.17]
  - - [8192, 2048, 1, 128]
    - [200, 9.623]
  - - [8192, 2048, 1, 256]
    - [201, 14.356]
  - - [8192, 2048, 1, 512]
    - [202, 19.424]
  - - [8192, 2048, 1, 1024]
    - [203, 24.352]
  - - [8192, 2048, 1, 2048]
    - [204, 28.675]
  - - [8192, 2048, 1, 4096]
    - [205, 32.766]
  - - [8192, 2048, 1, 8192]
    - [206, 34.749]
  - - [8192, 4096, 1, 128]
    - [170, 10.527]
  - - [8192, 4096, 1, 256]
    - [207, 15.659]
  - - [8192, 4096, 1, 512]
    - [138, 21.24]
  - - [8192, 4096, 1, 1024]
    - [208, 27.639]
  - - [8192, 4096, 1, 2048]
    - [209, 32.581]
  - - [8192, 4096, 1, 4096]
    - [210, 34.448]
  - - [8192, 4096, 1, 8192]
    - [211, 36.461]
  - - [8192, 8192, 1, 128]
    - [109, 11.366]
  - - [8192, 8192, 1, 256]
    - [212, 16.107]
  - - [8192, 8192, 1, 512]
    - [212, 22.995]
  - - [8192, 8192, 1, 1024]
    - [175, 29.48]
  - - [8192, 8192, 1, 2048]
    - [213, 34.055]
  - - [8192, 8192, 1, 4096]
    - [214, 37.136]
  - - [8192, 8192, 1, 8192]
    - [215, 38.265]
- null
- null
- DeviceEfficiency
- GridBased
