library/src/amd_detail/rocblaslt/src/Tensile/Logic/streamk/aquavanjaram/aquavanjaram942_Cijk_Ailk_Bjlk_BBS_BH_UserArgs.yaml
- {MinimumRequiredVersion: 4.33.0}
- aquavanjaram942
- gfx942
- [Device 0049, Device 0050]
    SolutionIndex: 0
    SolutionNameMin: Cijk_Ailk_Bjlk_BBS_BH_UserArgs_MT32x64x32_MI16x16x1_SN_LDSB0_CLR1_GRVWA4_GRVWB4_GSU0_GSUC0_GSUWGMRR0_K1_LBSPPA256_LBSPPB512_LPA16_LPB32_MIWT1_2_NLCA1_NLCB1_PLR1_SU4_SUM1_SUS64_SVW1_SK1_ULSGRO1_VWA1_VWB2_WG32_8_1_WGM1_WGMXCC8_WGMXCCG304
    SolutionIndex: 1
    SolutionNameMin: Cijk_Ailk_Bjlk_BBS_BH_UserArgs_MT32x32x32_MI16x16x1_SN_LDSB0_CLR1_GRVWA4_GRVWB4_GSU0_GSUC0_GSUWGMRR0_K1_LBSPPA256_LBSPPB256_LPA16_LPB16_MIWT1_1_NLCA1_NLCB1_PLR1_SU4_SUM1_SUS64_SVW1_SK1_ULSGRO0_VWA1_VWB1_WG32_8_1_WGM1_WGMXCC8_WGMXCCG304
    SolutionIndex: 2
    SolutionNameMin: Cijk_Ailk_Bjlk_BBS_BH_UserArgs_MT32x32x32_MI16x16x1_SN_LDSB0_CLR1_GRVWA4_GRVWB4_GSU0_GSUC0_GSUWGMRR0_K1_LBSPPA256_LBSPPB256_LPA16_LPB16_MIWT1_1_NLCA1_NLCB1_PLR1_SU4_SUM1_SUS64_SVW1_SK1_ULSGRO1_VWA1_VWB1_WG32_8_1_WGM1_WGMXCC16_WGMXCCG304
    SolutionIndex: 3
    SolutionNameMin: Cijk_Ailk_Bjlk_BBS_BH_UserArgs_MT128x128x64_MI16x16x1_SN_LDSB1_CLR1_GRVWA8_GRVWB8_GSU0_GSUC0_GSUWGMRR0_K1_LBSPPA1024_LBSPPB1024_LPA0_LPB0_MIWT4_4_NLCA1_NLCB1_PLR1_SU0_SUM0_SUS0_SVW4_SK1_ULSGRO0_VWA4_VWB4_WG32_8_1_WGM1_WGMXCC1_WGMXCCG304
    SolutionIndex: 4
    SolutionNameMin: Cijk_Ailk_Bjlk_BBS_BH_UserArgs_MT128x64x64_MI16x16x1_SN_LDSB1_CLR1_GRVWA8_GRVWB8_GSU0_GSUC0_GSUWGMRR0_K1_LBSPPA1024_LBSPPB512_LPA0_LPB32_MIWT4_2_NLCA1_NLCB1_PLR2_SU4_SUM0_SUS128_SVW4_SK1_ULSGRO0_VWA4_VWB2_WG32_8_1_WGM1_WGMXCC1_WGMXCCG304
    SolutionIndex: 5
    SolutionNameMin: Cijk_Ailk_Bjlk_BBS_BH_UserArgs_MT64x64x64_MI16x16x1_SN_LDSB1_CLR1_GRVWA8_GRVWB8_GSU0_GSUC0_GSUWGMRR0_K1_LBSPPA512_LBSPPB512_LPA32_LPB32_MIWT2_2_NLCA1_NLCB1_PLR2_SU4_SUM0_SUS128_SVW2_SK1_ULSGRO0_VWA2_VWB2_WG32_8_1_WGM4_WGMXCC1_WGMXCCG304
    SolutionIndex: 6
    SolutionNameMin: Cijk_Ailk_Bjlk_BBS_BH_UserArgs_MT64x64x64_MI16x16x1_SN_LDSB1_CLR1_GRVWA8_GRVWB8_GSU0_GSUC0_GSUWGMRR0_K1_LBSPPA512_LBSPPB512_LPA32_LPB32_MIWT2_2_NLCA1_NLCB1_PLR1_SU4_SUM0_SUS128_SVW2_SK1_ULSGRO0_VWA2_VWB2_WG32_8_1_WGM1_WGMXCC16_WGMXCCG304
    SolutionIndex: 7
    SolutionNameMin: Cijk_Ailk_Bjlk_BBS_BH_UserArgs_MT64x64x64_MI16x16x1_SN_LDSB1_CLR1_GRVWA8_GRVWB8_GSU0_GSUC0_GSUWGMRR0_K1_LBSPPA512_LBSPPB512_LPA32_LPB32_MIWT2_2_NLCA1_NLCB1_PLR1_SU4_SUM0_SUS128_SVW2_SK1_ULSGRO1_VWA2_VWB2_WG32_8_1_WGM1_WGMXCC16_WGMXCCG304
    SolutionIndex: 8
    SolutionNameMin: Cijk_Ailk_Bjlk_BBS_BH_UserArgs_MT64x32x64_MI16x16x1_SN_LDSB0_CLR1_GRVWA8_GRVWB8_GSU0_GSUC0_GSUWGMRR0_K1_LBSPPA512_LBSPPB256_LPA32_LPB16_MIWT2_1_NLCA1_NLCB1_PLR2_SU4_SUM0_SUS128_SVW2_SK1_ULSGRO0_VWA2_VWB1_WG32_8_1_WGM8_WGMXCC1_WGMXCCG304
    SolutionIndex: 9
    SolutionNameMin: Cijk_Ailk_Bjlk_BBS_BH_UserArgs_MT64x32x64_MI16x16x1_SN_LDSB0_CLR1_GRVWA8_GRVWB8_GSU0_GSUC0_GSUWGMRR0_K1_LBSPPA512_LBSPPB256_LPA32_LPB16_MIWT2_1_NLCA1_NLCB1_PLR2_SU4_SUM0_SUS128_SVW2_SK1_ULSGRO0_VWA2_VWB1_WG32_8_1_WGM1_WGMXCC8_WGMXCCG304
    SolutionIndex: 10
    SolutionNameMin: Cijk_Ailk_Bjlk_BBS_BH_UserArgs_MT32x32x64_MI16x16x1_SN_LDSB0_CLR1_GRVWA8_GRVWB8_GSU0_GSUC0_GSUWGMRR0_K1_LBSPPA256_LBSPPB256_LPA16_LPB16_MIWT1_1_NLCA1_NLCB1_PLR1_SU0_SUM0_SUS0_SVW1_SK1_ULSGRO1_VWA1_VWB1_WG32_8_1_WGM1_WGMXCC8_WGMXCCG304
    SolutionIndex: 11
    SolutionNameMin: Cijk_Ailk_Bjlk_BBS_BH_UserArgs_MT32x32x64_MI16x16x1_SN_LDSB0_CLR1_GRVWA8_GRVWB8_GSU0_GSUC0_GSUWGMRR0_K1_LBSPPA256_LBSPPB256_LPA16_LPB16_MIWT1_1_NLCA1_NLCB1_PLR2_SU4_SUM1_SUS128_SVW1_SK1_ULSGRO0_VWA1_VWB1_WG32_8_1_WGM1_WGMXCC8_WGMXCCG304
    SolutionIndex: 12
    SolutionNameMin: Cijk_Ailk_Bjlk_BBS_BH_UserArgs_MT32x32x64_MI16x16x1_SN_LDSB0_CLR1_GRVWA8_GRVWB8_GSU0_GSUC0_GSUWGMRR0_K1_LBSPPA256_LBSPPB256_LPA16_LPB16_MIWT1_1_NLCA1_NLCB1_PLR2_SU0_SUM0_SUS0_SVW1_SK1_ULSGRO0_VWA1_VWB1_WG32_8_1_WGM1_WGMXCC16_WGMXCCG304
    SolutionIndex: 13
    SolutionNameMin: Cijk_Ailk_Bjlk_BBS_BH_UserArgs_MT32x32x64_MI16x16x1_SN_LDSB0_CLR1_GRVWA8_GRVWB8_GSU0_GSUC0_GSUWGMRR0_K1_LBSPPA256_LBSPPB256_LPA16_LPB16_MIWT1_1_NLCA1_NLCB1_PLR2_SU4_SUM1_SUS128_SVW1_SK1_ULSGRO1_VWA1_VWB1_WG32_8_1_WGM1_WGMXCC16_WGMXCCG304
    SolutionIndex: 14
    SolutionNameMin: Cijk_Ailk_Bjlk_BBS_BH_UserArgs_MT128x128x128_MI16x16x1_SN_LDSB1_CLR1_GRVWA8_GRVWB8_GSU0_GSUC0_GSUWGMRR0_K1_LBSPPA1024_LBSPPB1024_LPA0_LPB0_MIWT4_4_NLCA1_NLCB1_PLR1_SU4_SUM1_SUS256_SVW4_SK1_ULSGRO0_VWA4_VWB4_WG32_8_1_WGM1_WGMXCC16_WGMXCCG304
    SolutionIndex: 15
    SolutionNameMin: Cijk_Ailk_Bjlk_BBS_BH_UserArgs_MT128x64x128_MI16x16x1_SN_LDSB1_CLR1_GRVWA8_GRVWB8_GSU0_GSUC0_GSUWGMRR0_K1_LBSPPA1024_LBSPPB512_LPA0_LPB32_MIWT4_2_NLCA1_NLCB1_PLR2_SU4_SUM0_SUS256_SVW4_SK1_ULSGRO0_VWA4_VWB2_WG32_8_1_WGM1_WGMXCC1_WGMXCCG304
    SolutionIndex: 16
    SolutionNameMin: Cijk_Ailk_Bjlk_BBS_BH_UserArgs_MT128x64x128_MI16x16x1_SN_LDSB1_CLR1_GRVWA8_GRVWB8_GSU0_GSUC0_GSUWGMRR0_K1_LBSPPA1024_LBSPPB512_LPA0_LPB32_MIWT4_2_NLCA1_NLCB1_PLR2_SU4_SUM1_SUS256_SVW4_SK1_ULSGRO0_VWA4_VWB2_WG32_8_1_WGM1_WGMXCC1_WGMXCCG304
    SolutionIndex: 17
    SolutionNameMin: Cijk_Ailk_Bjlk_BBS_BH_UserArgs_MT128x64x128_MI16x16x1_SN_LDSB1_CLR1_GRVWA8_GRVWB8_GSU0_GSUC0_GSUWGMRR0_K1_LBSPPA1024_LBSPPB512_LPA0_LPB32_MIWT4_2_NLCA1_NLCB1_PLR2_SU4_SUM0_SUS256_SVW4_SK1_ULSGRO0_VWA4_VWB2_WG32_8_1_WGM1_WGMXCC8_WGMXCCG304
    SolutionIndex: 18
    SolutionNameMin: Cijk_Ailk_Bjlk_BBS_BH_UserArgs_MT64x64x128_MI16x16x1_SN_LDSB1_CLR1_GRVWA8_GRVWB8_GSU0_GSUC0_GSUWGMRR0_K1_LBSPPA512_LBSPPB512_LPA32_LPB32_MIWT2_2_NLCA1_NLCB1_PLR2_SU4_SUM0_SUS256_SVW2_SK1_ULSGRO0_VWA2_VWB2_WG32_8_1_WGM1_WGMXCC1_WGMXCCG304
    SolutionIndex: 19
    SolutionNameMin: Cijk_Ailk_Bjlk_BBS_BH_UserArgs_MT64x64x128_MI16x16x1_SN_LDSB1_CLR1_GRVWA8_GRVWB8_GSU0_GSUC0_GSUWGMRR0_K1_LBSPPA512_LBSPPB512_LPA32_LPB32_MIWT2_2_NLCA1_NLCB1_PLR2_SU0_SUM0_SUS0_SVW2_SK1_ULSGRO0_VWA2_VWB2_WG32_8_1_WGM4_WGMXCC8_WGMXCCG304
    SolutionIndex: 20
    SolutionNameMin: Cijk_Ailk_Bjlk_BBS_BH_UserArgs_MT64x64x128_MI16x16x1_SN_LDSB1_CLR1_GRVWA8_GRVWB8_GSU0_GSUC0_GSUWGMRR0_K1_LBSPPA512_LBSPPB512_LPA32_LPB32_MIWT2_2_NLCA1_NLCB1_PLR2_SU0_SUM0_SUS0_SVW2_SK1_ULSGRO0_VWA2_VWB2_WG32_8_1_WGM1_WGMXCC16_WGMXCCG304
    SolutionIndex: 21
    SolutionNameMin: Cijk_Ailk_Bjlk_BBS_BH_UserArgs_MT64x64x128_MI16x16x1_SN_LDSB1_CLR1_GRVWA8_GRVWB8_GSU0_GSUC0_GSUWGMRR0_K1_LBSPPA512_LBSPPB512_LPA32_LPB32_MIWT2_2_NLCA1_NLCB1_PLR2_SU4_SUM1_SUS256_SVW2_SK1_ULSGRO0_VWA2_VWB2_WG32_8_1_WGM1_WGMXCC16_WGMXCCG304
    SolutionIndex: 22
    SolutionNameMin: Cijk_Ailk_Bjlk_BBS_BH_UserArgs_MT32x64x128_MI16x16x1_SN_LDSB1_CLR1_GRVWA8_GRVWB8_GSU0_GSUC0_GSUWGMRR0_K1_LBSPPA256_LBSPPB512_LPA16_LPB32_MIWT1_2_NLCA1_NLCB1_PLR2_SU4_SUM1_SUS256_SVW1_SK1_ULSGRO0_VWA1_VWB2_WG32_8_1_WGM1_WGMXCC8_WGMXCCG304
    SolutionIndex: 23
    SolutionNameMin: Cijk_Ailk_Bjlk_BBS_BH_UserArgs_MT32x64x128_MI16x16x1_SN_LDSB1_CLR1_GRVWA8_GRVWB8_GSU0_GSUC0_GSUWGMRR0_K1_LBSPPA256_LBSPPB512_LPA16_LPB32_MIWT1_2_NLCA1_NLCB1_PLR2_SU4_SUM1_SUS256_SVW1_SK1_ULSGRO0_VWA1_VWB2_WG32_8_1_WGM1_WGMXCC16_WGMXCCG304
    SolutionIndex: 24
    SolutionNameMin: Cijk_Ailk_Bjlk_BBS_BH_UserArgs_MT64x32x128_MI16x16x1_SN_LDSB1_CLR1_GRVWA8_GRVWB8_GSU0_GSUC0_GSUWGMRR0_K1_LBSPPA512_LBSPPB256_LPA32_LPB16_MIWT2_1_NLCA1_NLCB1_PLR2_SU0_SUM0_SUS0_SVW2_SK1_ULSGRO0_VWA2_VWB1_WG32_8_1_WGM1_WGMXCC8_WGMXCCG304
    SolutionIndex: 25
    SolutionNameMin: Cijk_Ailk_Bjlk_BBS_BH_UserArgs_MT32x32x128_MI16x16x1_SN_LDSB1_CLR1_GRVWA8_GRVWB8_GSU0_GSUC0_GSUWGMRR0_K1_LBSPPA256_LBSPPB256_LPA16_LPB16_MIWT1_1_NLCA1_NLCB1_PLR2_SU0_SUM0_SUS0_SVW1_SK1_ULSGRO1_VWA1_VWB1_WG32_8_1_WGM1_WGMXCC1_WGMXCCG304
    SolutionIndex: 26
    SolutionNameMin: Cijk_Ailk_Bjlk_BBS_BH_UserArgs_MT32x32x128_MI16x16x1_SN_LDSB1_CLR1_GRVWA8_GRVWB8_GSU0_GSUC0_GSUWGMRR0_K1_LBSPPA256_LBSPPB256_LPA16_LPB16_MIWT1_1_NLCA1_NLCB1_PLR2_SU0_SUM0_SUS0_SVW1_SK1_ULSGRO0_VWA1_VWB1_WG32_8_1_WGM8_WGMXCC1_WGMXCCG304
    SolutionIndex: 27
    SolutionNameMin: Cijk_Ailk_Bjlk_BBS_BH_UserArgs_MT32x32x128_MI16x16x1_SN_LDSB1_CLR1_GRVWA8_GRVWB8_GSU0_GSUC0_GSUWGMRR0_K1_LBSPPA256_LBSPPB256_LPA16_LPB16_MIWT1_1_NLCA1_NLCB1_PLR2_SU0_SUM0_SUS0_SVW1_SK1_ULSGRO1_VWA1_VWB1_WG32_8_1_WGM8_WGMXCC1_WGMXCCG304
    SolutionIndex: 28
    SolutionNameMin: Cijk_Ailk_Bjlk_BBS_BH_UserArgs_MT32x32x128_MI16x16x1_SN_LDSB1_CLR1_GRVWA8_GRVWB8_GSU0_GSUC0_GSUWGMRR0_K1_LBSPPA256_LBSPPB256_LPA16_LPB16_MIWT1_1_NLCA1_NLCB1_PLR1_SU0_SUM0_SUS0_SVW1_SK1_ULSGRO0_VWA1_VWB1_WG32_8_1_WGM1_WGMXCC8_WGMXCCG304
    SolutionIndex: 29
    SolutionNameMin: Cijk_Ailk_Bjlk_BBS_BH_UserArgs_MT32x32x128_MI16x16x1_SN_LDSB1_CLR1_GRVWA8_GRVWB8_GSU0_GSUC0_GSUWGMRR0_K1_LBSPPA256_LBSPPB256_LPA16_LPB16_MIWT1_1_NLCA1_NLCB1_PLR2_SU0_SUM0_SUS0_SVW1_SK1_ULSGRO1_VWA1_VWB1_WG32_8_1_WGM1_WGMXCC8_WGMXCCG304
    SolutionIndex: 30
    SolutionNameMin: Cijk_Ailk_Bjlk_BBS_BH_UserArgs_MT32x32x128_MI16x16x1_SN_LDSB1_CLR1_GRVWA8_GRVWB8_GSU0_GSUC0_GSUWGMRR0_K1_LBSPPA256_LBSPPB256_LPA16_LPB16_MIWT1_1_NLCA1_NLCB1_PLR1_SU4_SUM1_SUS256_SVW1_SK1_ULSGRO1_VWA1_VWB1_WG32_8_1_WGM1_WGMXCC8_WGMXCCG304
    SolutionIndex: 31
    SolutionNameMin: Cijk_Ailk_Bjlk_BBS_BH_UserArgs_MT32x32x128_MI16x16x1_SN_LDSB1_CLR1_GRVWA8_GRVWB8_GSU0_GSUC0_GSUWGMRR0_K1_LBSPPA256_LBSPPB256_LPA16_LPB16_MIWT1_1_NLCA1_NLCB1_PLR1_SU0_SUM0_SUS0_SVW1_SK1_ULSGRO0_VWA1_VWB1_WG32_8_1_WGM1_WGMXCC16_WGMXCCG304
    SolutionIndex: 32
    SolutionNameMin: Cijk_Ailk_Bjlk_BBS_BH_UserArgs_MT32x32x128_MI16x16x1_SN_LDSB1_CLR1_GRVWA8_GRVWB8_GSU0_GSUC0_GSUWGMRR0_K1_LBSPPA256_LBSPPB256_LPA16_LPB16_MIWT1_1_NLCA1_NLCB1_PLR1_SU0_SUM0_SUS0_SVW1_SK1_ULSGRO1_VWA1_VWB1_WG32_8_1_WGM1_WGMXCC16_WGMXCCG304
    SolutionIndex: 33
    SolutionNameMin: Cijk_Ailk_Bjlk_BBS_BH_UserArgs_MT32x32x128_MI16x16x1_SN_LDSB1_CLR1_GRVWA8_GRVWB8_GSU0_GSUC0_GSUWGMRR0_K1_LBSPPA256_LBSPPB256_LPA16_LPB16_MIWT1_1_NLCA1_NLCB1_PLR2_SU0_SUM0_SUS0_SVW1_SK1_ULSGRO0_VWA1_VWB1_WG32_8_1_WGM1_WGMXCC16_WGMXCCG304
    SolutionIndex: 34
    SolutionNameMin: Cijk_Ailk_Bjlk_BBS_BH_UserArgs_MT32x32x128_MI16x16x1_SN_LDSB1_CLR1_GRVWA8_GRVWB8_GSU0_GSUC0_GSUWGMRR0_K1_LBSPPA256_LBSPPB256_LPA16_LPB16_MIWT1_1_NLCA1_NLCB1_PLR1_SU4_SUM1_SUS256_SVW1_SK1_ULSGRO0_VWA1_VWB1_WG32_8_1_WGM1_WGMXCC16_WGMXCCG304
    SolutionIndex: 35
    SolutionNameMin: Cijk_Ailk_Bjlk_BBS_BH_UserArgs_MT32x32x128_MI16x16x1_SN_LDSB1_CLR1_GRVWA8_GRVWB8_GSU0_GSUC0_GSUWGMRR0_K1_LBSPPA256_LBSPPB256_LPA16_LPB16_MIWT1_1_NLCA1_NLCB1_PLR1_SU4_SUM1_SUS256_SVW1_SK1_ULSGRO1_VWA1_VWB1_WG32_8_1_WGM1_WGMXCC16_WGMXCCG304
    SolutionIndex: 36
    SolutionNameMin: Cijk_Ailk_Bjlk_BBS_BH_UserArgs_MT32x32x128_MI16x16x1_SN_LDSB1_CLR1_GRVWA8_GRVWB8_GSU0_GSUC0_GSUWGMRR0_K1_LBSPPA256_LBSPPB256_LPA16_LPB16_MIWT1_1_NLCA1_NLCB1_PLR1_SU0_SUM0_SUS0_SVW1_SK1_ULSGRO1_VWA1_VWB1_WG32_8_1_WGM6_WGMXCC16_WGMXCCG304
    SolutionIndex: 37
    SolutionNameMin: Cijk_Ailk_Bjlk_BBS_BH_UserArgs_MT128x128x64_MI16x16x1_SN_LDSB1_CLR1_GRVWA8_GRVWB8_GSU0_GSUC0_GSUWGMRR0_K1_LBSPPA1024_LBSPPB1024_LPA0_LPB0_MIWT4_4_NLCA1_NLCB1_PLR1_SU4_SUM0_SUS128_SVW4_SK3_ULSGRO1_VWA4_VWB4_WG32_8_1_WGM4_WGMXCC1_WGMXCCG304
    SolutionIndex: 38
    SolutionNameMin: Cijk_Ailk_Bjlk_BBS_BH_UserArgs_MT64x64x64_MI16x16x1_SN_LDSB1_CLR1_GRVWA8_GRVWB8_GSU0_GSUC0_GSUWGMRR0_K1_LBSPPA512_LBSPPB512_LPA32_LPB32_MIWT2_2_NLCA1_NLCB1_PLR2_SU4_SUM1_SUS128_SVW2_SK3_ULSGRO0_VWA2_VWB2_WG32_8_1_WGM1_WGMXCC16_WGMXCCG304
    SolutionIndex: 39
    SolutionNameMin: Cijk_Ailk_Bjlk_BBS_BH_UserArgs_MT32x32x128_MI16x16x1_SN_LDSB1_CLR1_GRVWA8_GRVWB8_GSU0_GSUC0_GSUWGMRR0_K1_LBSPPA256_LBSPPB256_LPA16_LPB16_MIWT1_1_NLCA1_NLCB1_PLR1_SU0_SUM0_SUS0_SVW1_SK1_ULSGRO1_VWA1_VWB1_WG32_8_1_WGM1_WGMXCC8_WGMXCCG304
    SolutionIndex: 40
    SolutionNameMin: Cijk_Ailk_Bjlk_BBS_BH_UserArgs_MT32x32x128_MI16x16x1_SN_LDSB1_CLR1_GRVWA8_GRVWB8_GSU0_GSUC0_GSUWGMRR0_K1_LBSPPA256_LBSPPB256_LPA16_LPB16_MIWT1_1_NLCA1_NLCB1_PLR1_SU0_SUM0_SUS0_SVW1_SK1_ULSGRO1_VWA1_VWB1_WG32_8_1_WGM1_WGMXCC1_WGMXCCG304
    SolutionIndex: 41
    SolutionNameMin: Cijk_Ailk_Bjlk_BBS_BH_UserArgs_MT32x32x64_MI16x16x1_SN_LDSB0_CLR1_GRVWA8_GRVWB8_GSU0_GSUC0_GSUWGMRR0_K1_LBSPPA256_LBSPPB256_LPA16_LPB16_MIWT1_1_NLCA1_NLCB1_PLR2_SU0_SUM0_SUS0_SVW1_SK1_ULSGRO0_VWA1_VWB1_WG32_8_1_WGM1_WGMXCC8_WGMXCCG304
    SolutionIndex: 42
    SolutionNameMin: Cijk_Ailk_Bjlk_BBS_BH_UserArgs_MT32x32x128_MI16x16x1_SN_LDSB1_CLR1_GRVWA8_GRVWB8_GSU0_GSUC0_GSUWGMRR0_K1_LBSPPA256_LBSPPB256_LPA16_LPB16_MIWT1_1_NLCA1_NLCB1_PLR1_SU4_SUM0_SUS256_SVW1_SK1_ULSGRO1_VWA1_VWB1_WG32_8_1_WGM1_WGMXCC16_WGMXCCG304
    SolutionIndex: 43
    SolutionNameMin: Cijk_Ailk_Bjlk_BBS_BH_UserArgs_MT32x32x128_MI16x16x1_SN_LDSB1_CLR1_GRVWA8_GRVWB8_GSU0_GSUC0_GSUWGMRR0_K1_LBSPPA256_LBSPPB256_LPA16_LPB16_MIWT1_1_NLCA1_NLCB1_PLR1_SU4_SUM1_SUS256_SVW1_SK1_ULSGRO0_VWA1_VWB1_WG32_8_1_WGM8_WGMXCC8_WGMXCCG304
    SolutionIndex: 44
    SolutionNameMin: Cijk_Ailk_Bjlk_BBS_BH_UserArgs_MT32x32x64_MI16x16x1_SN_LDSB0_CLR1_GRVWA8_GRVWB8_GSU0_GSUC0_GSUWGMRR0_K1_LBSPPA256_LBSPPB256_LPA16_LPB16_MIWT1_1_NLCA1_NLCB1_PLR2_SU4_SUM1_SUS128_SVW1_SK1_ULSGRO0_VWA1_VWB1_WG32_8_1_WGM1_WGMXCC1_WGMXCCG304
    SolutionIndex: 45
    SolutionNameMin: Cijk_Ailk_Bjlk_BBS_BH_UserArgs_MT32x32x128_MI16x16x1_SN_LDSB1_CLR1_GRVWA8_GRVWB8_GSU0_GSUC0_GSUWGMRR0_K1_LBSPPA256_LBSPPB256_LPA16_LPB16_MIWT1_1_NLCA1_NLCB1_PLR2_SU0_SUM0_SUS0_SVW1_SK1_ULSGRO1_VWA1_VWB1_WG32_8_1_WGM1_WGMXCC16_WGMXCCG304
    SolutionIndex: 46
    SolutionNameMin: Cijk_Ailk_Bjlk_BBS_BH_UserArgs_MT32x32x128_MI16x16x1_SN_LDSB1_CLR1_GRVWA8_GRVWB8_GSU0_GSUC0_GSUWGMRR0_K1_LBSPPA256_LBSPPB256_LPA16_LPB16_MIWT1_1_NLCA1_NLCB1_PLR2_SU0_SUM0_SUS0_SVW1_SK1_ULSGRO0_VWA1_VWB1_WG32_8_1_WGM1_WGMXCC8_WGMXCCG304
    SolutionIndex: 47
    SolutionNameMin: Cijk_Ailk_Bjlk_BBS_BH_UserArgs_MT32x32x128_MI16x16x1_SN_LDSB1_CLR1_GRVWA8_GRVWB8_GSU0_GSUC0_GSUWGMRR0_K1_LBSPPA256_LBSPPB256_LPA16_LPB16_MIWT1_1_NLCA1_NLCB1_PLR1_SU4_SUM1_SUS256_SVW1_SK1_ULSGRO0_VWA1_VWB1_WG32_8_1_WGM1_WGMXCC8_WGMXCCG304
    SolutionIndex: 48
    SolutionNameMin: Cijk_Ailk_Bjlk_BBS_BH_UserArgs_MT32x32x128_MI16x16x1_SN_LDSB1_CLR1_GRVWA8_GRVWB8_GSU0_GSUC0_GSUWGMRR0_K1_LBSPPA256_LBSPPB256_LPA16_LPB16_MIWT1_1_NLCA1_NLCB1_PLR1_SU4_SUM0_SUS256_SVW1_SK1_ULSGRO0_VWA1_VWB1_WG32_8_1_WGM1_WGMXCC8_WGMXCCG304
    SolutionIndex: 49
    SolutionNameMin: Cijk_Ailk_Bjlk_BBS_BH_UserArgs_MT32x64x128_MI16x16x1_SN_LDSB1_CLR1_GRVWA8_GRVWB8_GSU0_GSUC0_GSUWGMRR0_K1_LBSPPA256_LBSPPB512_LPA16_LPB32_MIWT1_2_NLCA1_NLCB1_PLR2_SU0_SUM0_SUS0_SVW1_SK1_ULSGRO0_VWA1_VWB2_WG32_8_1_WGM1_WGMXCC8_WGMXCCG304
    SolutionIndex: 50
    SolutionNameMin: Cijk_Ailk_Bjlk_BBS_BH_UserArgs_MT32x64x64_MI16x16x1_SN_LDSB0_CLR1_GRVWA8_GRVWB8_GSU0_GSUC0_GSUWGMRR0_K1_LBSPPA256_LBSPPB512_LPA16_LPB32_MIWT1_2_NLCA1_NLCB1_PLR1_SU0_SUM0_SUS0_SVW1_SK1_ULSGRO0_VWA1_VWB2_WG32_8_1_WGM1_WGMXCC8_WGMXCCG304
    SolutionIndex: 51
    SolutionNameMin: Cijk_Ailk_Bjlk_BBS_BH_UserArgs_MT32x64x128_MI16x16x1_SN_LDSB1_CLR1_GRVWA8_GRVWB8_GSU0_GSUC0_GSUWGMRR0_K1_LBSPPA256_LBSPPB512_LPA16_LPB32_MIWT1_2_NLCA1_NLCB1_PLR2_SU4_SUM1_SUS256_SVW1_SK1_ULSGRO1_VWA1_VWB2_WG32_8_1_WGM1_WGMXCC16_WGMXCCG304
    SolutionIndex: 52
    SolutionNameMin: Cijk_Ailk_Bjlk_BBS_BH_UserArgs_MT32x64x64_MI16x16x1_SN_LDSB0_CLR1_GRVWA8_GRVWB8_GSU0_GSUC0_GSUWGMRR0_K1_LBSPPA256_LBSPPB512_LPA16_LPB32_MIWT1_2_NLCA1_NLCB1_PLR2_SU4_SUM1_SUS128_SVW1_SK3_ULSGRO1_VWA1_VWB2_WG32_8_1_WGM1_WGMXCC16_WGMXCCG304
    SolutionIndex: 53
    SolutionNameMin: Cijk_Ailk_Bjlk_BBS_BH_UserArgs_MT32x64x64_MI16x16x1_SN_LDSB0_CLR1_GRVWA8_GRVWB8_GSU0_GSUC0_GSUWGMRR0_K1_LBSPPA256_LBSPPB512_LPA16_LPB32_MIWT1_2_NLCA1_NLCB1_PLR2_SU4_SUM1_SUS128_SVW1_SK1_ULSGRO1_VWA1_VWB2_WG32_8_1_WGM4_WGMXCC8_WGMXCCG304
    SolutionIndex: 54
    SolutionNameMin: Cijk_Ailk_Bjlk_BBS_BH_UserArgs_MT32x32x32_MI16x16x1_SN_LDSB0_CLR1_GRVWA4_GRVWB4_GSU0_GSUC0_GSUWGMRR0_K1_LBSPPA256_LBSPPB256_LPA16_LPB16_MIWT1_1_NLCA1_NLCB1_PLR1_SU4_SUM1_SUS64_SVW1_SK1_ULSGRO1_VWA1_VWB1_WG32_8_1_WGM1_WGMXCC8_WGMXCCG304
    SolutionIndex: 55
    SolutionNameMin: Cijk_Ailk_Bjlk_BBS_BH_UserArgs_MT32x32x128_MI16x16x1_SN_LDSB1_CLR1_GRVWA8_GRVWB8_GSU0_GSUC0_GSUWGMRR0_K1_LBSPPA256_LBSPPB256_LPA16_LPB16_MIWT1_1_NLCA1_NLCB1_PLR1_SU4_SUM0_SUS256_SVW1_SK1_ULSGRO1_VWA1_VWB1_WG32_8_1_WGM4_WGMXCC1_WGMXCCG304
    SolutionIndex: 56
    SolutionNameMin: Cijk_Ailk_Bjlk_BBS_BH_UserArgs_MT32x64x128_MI16x16x1_SN_LDSB1_CLR1_GRVWA8_GRVWB8_GSU0_GSUC0_GSUWGMRR0_K1_LBSPPA256_LBSPPB512_LPA16_LPB32_MIWT1_2_NLCA1_NLCB1_PLR2_SU4_SUM1_SUS256_SVW1_SK1_ULSGRO0_VWA1_VWB2_WG32_8_1_WGM4_WGMXCC1_WGMXCCG304
    SolutionIndex: 57
    SolutionNameMin: Cijk_Ailk_Bjlk_BBS_BH_UserArgs_MT64x64x128_MI16x16x1_SN_LDSB1_CLR1_GRVWA8_GRVWB8_GSU0_GSUC0_GSUWGMRR0_K1_LBSPPA512_LBSPPB512_LPA32_LPB32_MIWT2_2_NLCA1_NLCB1_PLR2_SU0_SUM0_SUS0_SVW2_SK1_ULSGRO0_VWA2_VWB2_WG32_8_1_WGM8_WGMXCC8_WGMXCCG304
    SolutionIndex: 58
    SolutionNameMin: Cijk_Ailk_Bjlk_BBS_BH_UserArgs_MT64x64x64_MI16x16x1_SN_LDSB1_CLR1_GRVWA8_GRVWB8_GSU0_GSUC0_GSUWGMRR0_K1_LBSPPA512_LBSPPB512_LPA32_LPB32_MIWT2_2_NLCA1_NLCB1_PLR1_SU4_SUM0_SUS128_SVW2_SK3_ULSGRO0_VWA2_VWB2_WG32_8_1_WGM1_WGMXCC16_WGMXCCG304
    SolutionIndex: 59
    SolutionNameMin: Cijk_Ailk_Bjlk_BBS_BH_UserArgs_MT64x64x64_MI16x16x1_SN_LDSB1_CLR1_GRVWA8_GRVWB8_GSU0_GSUC0_GSUWGMRR0_K1_LBSPPA512_LBSPPB512_LPA32_LPB32_MIWT2_2_NLCA1_NLCB1_PLR2_SU0_SUM0_SUS0_SVW2_SK1_ULSGRO0_VWA2_VWB2_WG32_8_1_WGM4_WGMXCC8_WGMXCCG304
    SolutionIndex: 60
    SolutionNameMin: Cijk_Ailk_Bjlk_BBS_BH_UserArgs_MT32x64x64_MI16x16x1_SN_LDSB0_CLR1_GRVWA8_GRVWB8_GSU0_GSUC0_GSUWGMRR0_K1_LBSPPA256_LBSPPB512_LPA16_LPB32_MIWT1_2_NLCA1_NLCB1_PLR2_SU4_SUM1_SUS128_SVW1_SK1_ULSGRO0_VWA1_VWB2_WG32_8_1_WGM1_WGMXCC16_WGMXCCG304
    SolutionIndex: 61
    SolutionNameMin: Cijk_Ailk_Bjlk_BBS_BH_UserArgs_MT64x32x128_MI16x16x1_SN_LDSB1_CLR1_GRVWA8_GRVWB8_GSU0_GSUC0_GSUWGMRR0_K1_LBSPPA512_LBSPPB256_LPA32_LPB16_MIWT2_1_NLCA1_NLCB1_PLR2_SU4_SUM1_SUS256_SVW2_SK1_ULSGRO0_VWA2_VWB1_WG32_8_1_WGM1_WGMXCC8_WGMXCCG304
    SolutionIndex: 62
    SolutionNameMin: Cijk_Ailk_Bjlk_BBS_BH_UserArgs_MT64x32x128_MI16x16x1_SN_LDSB1_CLR1_GRVWA8_GRVWB8_GSU0_GSUC0_GSUWGMRR0_K1_LBSPPA512_LBSPPB256_LPA32_LPB16_MIWT2_1_NLCA1_NLCB1_PLR2_SU4_SUM0_SUS256_SVW2_SK1_ULSGRO0_VWA2_VWB1_WG32_8_1_WGM8_WGMXCC1_WGMXCCG304
    SolutionIndex: 63
    SolutionNameMin: Cijk_Ailk_Bjlk_BBS_BH_UserArgs_MT64x64x128_MI16x16x1_SN_LDSB1_CLR1_GRVWA8_GRVWB8_GSU0_GSUC0_GSUWGMRR0_K1_LBSPPA512_LBSPPB512_LPA32_LPB32_MIWT2_2_NLCA1_NLCB1_PLR2_SU4_SUM0_SUS256_SVW2_SK1_ULSGRO0_VWA2_VWB2_WG32_8_1_WGM1_WGMXCC16_WGMXCCG304
    SolutionIndex: 64
    SolutionNameMin: Cijk_Ailk_Bjlk_BBS_BH_UserArgs_MT128x64x128_MI16x16x1_SN_LDSB1_CLR1_GRVWA8_GRVWB8_GSU0_GSUC0_GSUWGMRR0_K1_LBSPPA1024_LBSPPB512_LPA0_LPB32_MIWT4_2_NLCA1_NLCB1_PLR2_SU4_SUM0_SUS256_SVW4_SK1_ULSGRO0_VWA4_VWB2_WG32_8_1_WGM8_WGMXCC8_WGMXCCG304
    SolutionIndex: 65
    SolutionNameMin: Cijk_Ailk_Bjlk_BBS_BH_UserArgs_MT128x64x64_MI16x16x1_SN_LDSB1_CLR1_GRVWA8_GRVWB8_GSU0_GSUC0_GSUWGMRR0_K1_LBSPPA1024_LBSPPB512_LPA0_LPB32_MIWT4_2_NLCA1_NLCB1_PLR2_SU4_SUM1_SUS128_SVW4_SK1_ULSGRO0_VWA4_VWB2_WG32_8_1_WGM1_WGMXCC1_WGMXCCG304
    SolutionIndex: 66
    SolutionNameMin: Cijk_Ailk_Bjlk_BBS_BH_UserArgs_MT64x64x64_MI16x16x1_SN_LDSB1_CLR1_GRVWA8_GRVWB8_GSU0_GSUC0_GSUWGMRR0_K1_LBSPPA512_LBSPPB512_LPA32_LPB32_MIWT2_2_NLCA1_NLCB1_PLR2_SU4_SUM1_SUS128_SVW2_SK1_ULSGRO1_VWA2_VWB2_WG32_8_1_WGM1_WGMXCC16_WGMXCCG304
    SolutionIndex: 67
    SolutionNameMin: Cijk_Ailk_Bjlk_BBS_BH_UserArgs_MT64x64x64_MI16x16x1_SN_LDSB1_CLR1_GRVWA8_GRVWB8_GSU0_GSUC0_GSUWGMRR0_K1_LBSPPA512_LBSPPB512_LPA32_LPB32_MIWT2_2_NLCA1_NLCB1_PLR2_SU4_SUM1_SUS128_SVW2_SK1_ULSGRO0_VWA2_VWB2_WG32_8_1_WGM1_WGMXCC16_WGMXCCG304
    SolutionIndex: 68
    SolutionNameMin: Cijk_Ailk_Bjlk_BBS_BH_UserArgs_MT64x64x128_MI16x16x1_SN_LDSB1_CLR1_GRVWA8_GRVWB8_GSU0_GSUC0_GSUWGMRR0_K1_LBSPPA512_LBSPPB512_LPA32_LPB32_MIWT2_2_NLCA1_NLCB1_PLR2_SU4_SUM0_SUS256_SVW2_SK1_ULSGRO0_VWA2_VWB2_WG32_8_1_WGM8_WGMXCC1_WGMXCCG304
    SolutionIndex: 69
    SolutionNameMin: Cijk_Ailk_Bjlk_BBS_BH_UserArgs_MT128x64x128_MI16x16x1_SN_LDSB1_CLR1_GRVWA8_GRVWB8_GSU0_GSUC0_GSUWGMRR0_K1_LBSPPA1024_LBSPPB512_LPA0_LPB32_MIWT4_2_NLCA1_NLCB1_PLR2_SU4_SUM1_SUS256_SVW4_SK1_ULSGRO0_VWA4_VWB2_WG32_8_1_WGM4_WGMXCC1_WGMXCCG304
    SolutionIndex: 70
    SolutionNameMin: Cijk_Ailk_Bjlk_BBS_BH_UserArgs_MT128x128x64_MI16x16x1_SN_LDSB1_CLR1_GRVWA8_GRVWB8_GSU0_GSUC0_GSUWGMRR0_K1_LBSPPA1024_LBSPPB1024_LPA0_LPB0_MIWT4_4_NLCA1_NLCB1_PLR1_SU4_SUM0_SUS128_SVW4_SK3_ULSGRO1_VWA4_VWB4_WG32_8_1_WGM1_WGMXCC16_WGMXCCG304
    SolutionIndex: 71
    SolutionNameMin: Cijk_Ailk_Bjlk_BBS_BH_UserArgs_MT128x128x64_MI16x16x1_SN_LDSB1_CLR1_GRVWA8_GRVWB8_GSU0_GSUC0_GSUWGMRR0_K1_LBSPPA1024_LBSPPB1024_LPA0_LPB0_MIWT4_4_NLCA1_NLCB1_PLR1_SU4_SUM1_SUS128_SVW4_SK1_ULSGRO1_VWA4_VWB4_WG32_8_1_WGM1_WGMXCC8_WGMXCCG304
    SolutionIndex: 72
    SolutionNameMin: Cijk_Ailk_Bjlk_BBS_BH_UserArgs_MT64x128x32_MI16x16x1_SN_LDSB0_CLR1_GRVWA8_GRVWB8_GSU0_GSUC0_GSUWGMRR0_K1_LBSPPA512_LBSPPB1024_LPA32_LPB0_MIWT2_4_NLCA1_NLCB1_PLR1_SU4_SUM0_SUS64_SVW2_SK1_ULSGRO1_VWA2_VWB4_WG32_8_1_WGM8_WGMXCC1_WGMXCCG304
    SolutionIndex: 73
    SolutionNameMin: Cijk_Ailk_Bjlk_BBS_BH_UserArgs_MT64x128x64_MI16x16x1_SN_LDSB1_CLR1_GRVWA8_GRVWB8_GSU0_GSUC0_GSUWGMRR0_K1_LBSPPA512_LBSPPB1024_LPA32_LPB0_MIWT2_4_NLCA1_NLCB1_PLR2_SU4_SUM0_SUS128_SVW2_SK1_ULSGRO1_VWA2_VWB4_WG32_8_1_WGM8_WGMXCC1_WGMXCCG304
    SolutionIndex: 74
    SolutionNameMin: Cijk_Ailk_Bjlk_BBS_BH_UserArgs_MT128x64x128_MI16x16x1_SN_LDSB1_CLR1_GRVWA8_GRVWB8_GSU0_GSUC0_GSUWGMRR0_K1_LBSPPA1024_LBSPPB512_LPA0_LPB32_MIWT4_2_NLCA1_NLCB1_PLR2_SU0_SUM0_SUS0_SVW4_SK1_ULSGRO0_VWA4_VWB2_WG32_8_1_WGM8_WGMXCC1_WGMXCCG304
    SolutionIndex: 75
    SolutionNameMin: Cijk_Ailk_Bjlk_BBS_BH_UserArgs_MT128x128x128_MI16x16x1_SN_LDSB1_CLR1_GRVWA8_GRVWB8_GSU0_GSUC0_GSUWGMRR0_K1_LBSPPA1024_LBSPPB1024_LPA0_LPB0_MIWT4_4_NLCA1_NLCB1_PLR1_SU4_SUM0_SUS256_SVW4_SK1_ULSGRO0_VWA4_VWB4_WG32_8_1_WGM1_WGMXCC16_WGMXCCG304
    SolutionIndex: 76
    SolutionNameMin: Cijk_Ailk_Bjlk_BBS_BH_UserArgs_MT128x128x64_MI16x16x1_SN_LDSB1_CLR1_GRVWA8_GRVWB8_GSU0_GSUC0_GSUWGMRR0_K1_LBSPPA1024_LBSPPB1024_LPA0_LPB0_MIWT4_4_NLCA1_NLCB1_PLR1_SU4_SUM0_SUS128_SVW4_SK1_ULSGRO0_VWA4_VWB4_WG32_8_1_WGM4_WGMXCC8_WGMXCCG304
    SolutionIndex: 77
    SolutionNameMin: Cijk_Ailk_Bjlk_BBS_BH_UserArgs_MT128x128x64_MI16x16x1_SN_LDSB1_CLR1_GRVWA8_GRVWB8_GSU0_GSUC0_GSUWGMRR0_K1_LBSPPA1024_LBSPPB1024_LPA0_LPB0_MIWT4_4_NLCA1_NLCB1_PLR1_SU4_SUM1_SUS128_SVW4_SK3_ULSGRO0_VWA4_VWB4_WG32_8_1_WGM8_WGMXCC8_WGMXCCG304
    SolutionIndex: 78
    SolutionNameMin: Cijk_Ailk_Bjlk_BBS_BH_UserArgs_MT128x128x64_MI16x16x1_SN_LDSB1_CLR1_GRVWA8_GRVWB8_GSU0_GSUC0_GSUWGMRR0_K1_LBSPPA1024_LBSPPB1024_LPA0_LPB0_MIWT4_4_NLCA1_NLCB1_PLR1_SU4_SUM1_SUS128_SVW4_SK1_ULSGRO0_VWA4_VWB4_WG32_8_1_WGM6_WGMXCC1_WGMXCCG304
    SolutionIndex: 79
    SolutionNameMin: Cijk_Ailk_Bjlk_BBS_BH_UserArgs_MT32x32x128_MI16x16x1_SN_LDSB1_CLR1_GRVWA8_GRVWB8_GSU0_GSUC0_GSUWGMRR0_K1_LBSPPA256_LBSPPB256_LPA16_LPB16_MIWT1_1_NLCA1_NLCB1_PLR1_SU0_SUM0_SUS0_SVW1_SK3_ULSGRO0_VWA1_VWB1_WG32_8_1_WGM1_WGMXCC1_WGMXCCG304
    SolutionIndex: 80
    SolutionNameMin: Cijk_Ailk_Bjlk_BBS_BH_UserArgs_MT32x32x128_MI16x16x1_SN_LDSB1_CLR1_GRVWA8_GRVWB8_GSU0_GSUC0_GSUWGMRR0_K1_LBSPPA256_LBSPPB256_LPA16_LPB16_MIWT1_1_NLCA1_NLCB1_PLR2_SU0_SUM0_SUS0_SVW1_SK1_ULSGRO1_VWA1_VWB1_WG32_8_1_WGM4_WGMXCC16_WGMXCCG304
    SolutionIndex: 81
    SolutionNameMin: Cijk_Ailk_Bjlk_BBS_BH_UserArgs_MT32x64x128_MI16x16x1_SN_LDSB1_CLR1_GRVWA8_GRVWB8_GSU0_GSUC0_GSUWGMRR0_K1_LBSPPA256_LBSPPB512_LPA16_LPB32_MIWT1_2_NLCA1_NLCB1_PLR1_SU0_SUM0_SUS0_SVW1_SK1_ULSGRO1_VWA1_VWB2_WG32_8_1_WGM1_WGMXCC8_WGMXCCG304
    SolutionIndex: 82
    SolutionNameMin: Cijk_Ailk_Bjlk_BBS_BH_UserArgs_MT32x64x128_MI16x16x1_SN_LDSB1_CLR1_GRVWA8_GRVWB8_GSU0_GSUC0_GSUWGMRR0_K1_LBSPPA256_LBSPPB512_LPA16_LPB32_MIWT1_2_NLCA1_NLCB1_PLR2_SU4_SUM1_SUS256_SVW1_SK1_ULSGRO1_VWA1_VWB2_WG32_8_1_WGM1_WGMXCC8_WGMXCCG304
    SolutionIndex: 83
    SolutionNameMin: Cijk_Ailk_Bjlk_BBS_BH_UserArgs_MT32x32x128_MI16x16x1_SN_LDSB1_CLR1_GRVWA8_GRVWB8_GSU0_GSUC0_GSUWGMRR0_K1_LBSPPA256_LBSPPB256_LPA16_LPB16_MIWT1_1_NLCA1_NLCB1_PLR2_SU0_SUM0_SUS0_SVW1_SK1_ULSGRO0_VWA1_VWB1_WG32_8_1_WGM4_WGMXCC1_WGMXCCG304
    SolutionIndex: 84
    SolutionNameMin: Cijk_Ailk_Bjlk_BBS_BH_UserArgs_MT32x64x64_MI16x16x1_SN_LDSB0_CLR1_GRVWA8_GRVWB8_GSU0_GSUC0_GSUWGMRR0_K1_LBSPPA256_LBSPPB512_LPA16_LPB32_MIWT1_2_NLCA1_NLCB1_PLR2_SU0_SUM0_SUS0_SVW1_SK1_ULSGRO1_VWA1_VWB2_WG32_8_1_WGM1_WGMXCC16_WGMXCCG304
    SolutionIndex: 85
    SolutionNameMin: Cijk_Ailk_Bjlk_BBS_BH_UserArgs_MT64x64x64_MI16x16x1_SN_LDSB1_CLR1_GRVWA8_GRVWB8_GSU0_GSUC0_GSUWGMRR0_K1_LBSPPA512_LBSPPB512_LPA32_LPB32_MIWT2_2_NLCA1_NLCB1_PLR2_SU4_SUM0_SUS128_SVW2_SK1_ULSGRO0_VWA2_VWB2_WG32_8_1_WGM1_WGMXCC8_WGMXCCG304
    SolutionIndex: 86
    SolutionNameMin: Cijk_Ailk_Bjlk_BBS_BH_UserArgs_MT32x32x64_MI16x16x1_SN_LDSB0_CLR1_GRVWA8_GRVWB8_GSU0_GSUC0_GSUWGMRR0_K1_LBSPPA256_LBSPPB256_LPA16_LPB16_MIWT1_1_NLCA1_NLCB1_PLR2_SU4_SUM1_SUS128_SVW1_SK1_ULSGRO1_VWA1_VWB1_WG32_8_1_WGM1_WGMXCC8_WGMXCCG304
    SolutionIndex: 87
    SolutionNameMin: Cijk_Ailk_Bjlk_BBS_BH_UserArgs_MT32x32x128_MI16x16x1_SN_LDSB1_CLR1_GRVWA8_GRVWB8_GSU0_GSUC0_GSUWGMRR0_K1_LBSPPA256_LBSPPB256_LPA16_LPB16_MIWT1_1_NLCA1_NLCB1_PLR1_SU4_SUM0_SUS256_SVW1_SK1_ULSGRO0_VWA1_VWB1_WG32_8_1_WGM4_WGMXCC1_WGMXCCG304
    SolutionIndex: 88
    SolutionNameMin: Cijk_Ailk_Bjlk_BBS_BH_UserArgs_MT64x32x128_MI16x16x1_SN_LDSB1_CLR1_GRVWA8_GRVWB8_GSU0_GSUC0_GSUWGMRR0_K1_LBSPPA512_LBSPPB256_LPA32_LPB16_MIWT2_1_NLCA1_NLCB1_PLR2_SU4_SUM1_SUS256_SVW2_SK1_ULSGRO0_VWA2_VWB1_WG32_8_1_WGM1_WGMXCC16_WGMXCCG304
    SolutionIndex: 89
    SolutionNameMin: Cijk_Ailk_Bjlk_BBS_BH_UserArgs_MT64x64x128_MI16x16x1_SN_LDSB1_CLR1_GRVWA8_GRVWB8_GSU0_GSUC0_GSUWGMRR0_K1_LBSPPA512_LBSPPB512_LPA32_LPB32_MIWT2_2_NLCA1_NLCB1_PLR2_SU4_SUM1_SUS256_SVW2_SK1_ULSGRO0_VWA2_VWB2_WG32_8_1_WGM4_WGMXCC16_WGMXCCG304
    SolutionIndex: 90
    SolutionNameMin: Cijk_Ailk_Bjlk_BBS_BH_UserArgs_MT64x64x64_MI16x16x1_SN_LDSB1_CLR1_GRVWA8_GRVWB8_GSU0_GSUC0_GSUWGMRR0_K1_LBSPPA512_LBSPPB512_LPA32_LPB32_MIWT2_2_NLCA1_NLCB1_PLR1_SU4_SUM0_SUS128_SVW2_SK3_ULSGRO1_VWA2_VWB2_WG32_8_1_WGM1_WGMXCC16_WGMXCCG304
    SolutionIndex: 91
    SolutionNameMin: Cijk_Ailk_Bjlk_BBS_BH_UserArgs_MT64x64x64_MI16x16x1_SN_LDSB1_CLR1_GRVWA8_GRVWB8_GSU0_GSUC0_GSUWGMRR0_K1_LBSPPA512_LBSPPB512_LPA32_LPB32_MIWT2_2_NLCA1_NLCB1_PLR2_SU0_SUM0_SUS0_SVW2_SK1_ULSGRO1_VWA2_VWB2_WG32_8_1_WGM1_WGMXCC8_WGMXCCG304
    SolutionIndex: 92
    SolutionNameMin: Cijk_Ailk_Bjlk_BBS_BH_UserArgs_MT32x64x64_MI16x16x1_SN_LDSB0_CLR1_GRVWA8_GRVWB8_GSU0_GSUC0_GSUWGMRR0_K1_LBSPPA256_LBSPPB512_LPA16_LPB32_MIWT1_2_NLCA1_NLCB1_PLR2_SU4_SUM1_SUS128_SVW1_SK1_ULSGRO0_VWA1_VWB2_WG32_8_1_WGM1_WGMXCC8_WGMXCCG304
    SolutionIndex: 93
    SolutionNameMin: Cijk_Ailk_Bjlk_BBS_BH_UserArgs_MT64x32x128_MI16x16x1_SN_LDSB1_CLR1_GRVWA8_GRVWB8_GSU0_GSUC0_GSUWGMRR0_K1_LBSPPA512_LBSPPB256_LPA32_LPB16_MIWT2_1_NLCA1_NLCB1_PLR2_SU4_SUM0_SUS256_SVW2_SK1_ULSGRO0_VWA2_VWB1_WG32_8_1_WGM4_WGMXCC1_WGMXCCG304
    SolutionIndex: 94
    SolutionNameMin: Cijk_Ailk_Bjlk_BBS_BH_UserArgs_MT64x64x128_MI16x16x1_SN_LDSB1_CLR1_GRVWA8_GRVWB8_GSU0_GSUC0_GSUWGMRR0_K1_LBSPPA512_LBSPPB512_LPA32_LPB32_MIWT2_2_NLCA1_NLCB1_PLR2_SU0_SUM0_SUS0_SVW2_SK1_ULSGRO0_VWA2_VWB2_WG32_8_1_WGM1_WGMXCC1_WGMXCCG304
    SolutionIndex: 95
    SolutionNameMin: Cijk_Ailk_Bjlk_BBS_BH_UserArgs_MT64x64x64_MI16x16x1_SN_LDSB1_CLR1_GRVWA8_GRVWB8_GSU0_GSUC0_GSUWGMRR0_K1_LBSPPA512_LBSPPB512_LPA32_LPB32_MIWT2_2_NLCA1_NLCB1_PLR1_SU4_SUM1_SUS128_SVW2_SK1_ULSGRO0_VWA2_VWB2_WG32_8_1_WGM1_WGMXCC8_WGMXCCG304
    SolutionIndex: 96
    SolutionNameMin: Cijk_Ailk_Bjlk_BBS_BH_UserArgs_MT64x64x64_MI16x16x1_SN_LDSB1_CLR1_GRVWA8_GRVWB8_GSU0_GSUC0_GSUWGMRR0_K1_LBSPPA512_LBSPPB512_LPA32_LPB32_MIWT2_2_NLCA1_NLCB1_PLR1_SU4_SUM1_SUS128_SVW2_SK1_ULSGRO1_VWA2_VWB2_WG32_8_1_WGM8_WGMXCC1_WGMXCCG304
    SolutionIndex: 97
    SolutionNameMin: Cijk_Ailk_Bjlk_BBS_BH_UserArgs_MT64x64x128_MI16x16x1_SN_LDSB1_CLR1_GRVWA8_GRVWB8_GSU0_GSUC0_GSUWGMRR0_K1_LBSPPA512_LBSPPB512_LPA32_LPB32_MIWT2_2_NLCA1_NLCB1_PLR1_SU4_SUM1_SUS256_SVW2_SK1_ULSGRO0_VWA2_VWB2_WG32_8_1_WGM4_WGMXCC1_WGMXCCG304
    SolutionIndex: 98
    SolutionNameMin: Cijk_Ailk_Bjlk_BBS_BH_UserArgs_MT128x64x128_MI16x16x1_SN_LDSB1_CLR1_GRVWA8_GRVWB8_GSU0_GSUC0_GSUWGMRR0_K1_LBSPPA1024_LBSPPB512_LPA0_LPB32_MIWT4_2_NLCA1_NLCB1_PLR2_SU4_SUM1_SUS256_SVW4_SK1_ULSGRO0_VWA4_VWB2_WG32_8_1_WGM6_WGMXCC1_WGMXCCG304
    SolutionIndex: 99
    SolutionNameMin: Cijk_Ailk_Bjlk_BBS_BH_UserArgs_MT128x128x128_MI16x16x1_SN_LDSB1_CLR1_GRVWA8_GRVWB8_GSU0_GSUC0_GSUWGMRR0_K1_LBSPPA1024_LBSPPB1024_LPA0_LPB0_MIWT4_4_NLCA1_NLCB1_PLR1_SU4_SUM1_SUS256_SVW4_SK1_ULSGRO0_VWA4_VWB4_WG32_8_1_WGM4_WGMXCC8_WGMXCCG304
    SolutionIndex: 100
    SolutionNameMin: Cijk_Ailk_Bjlk_BBS_BH_UserArgs_MT128x64x128_MI16x16x1_SN_LDSB1_CLR1_GRVWA8_GRVWB8_GSU0_GSUC0_GSUWGMRR0_K1_LBSPPA1024_LBSPPB512_LPA0_LPB32_MIWT4_2_NLCA1_NLCB1_PLR2_SU0_SUM0_SUS0_SVW4_SK1_ULSGRO0_VWA4_VWB2_WG32_8_1_WGM1_WGMXCC1_WGMXCCG304
    SolutionIndex: 101
    SolutionNameMin: Cijk_Ailk_Bjlk_BBS_BH_UserArgs_MT128x128x64_MI16x16x1_SN_LDSB1_CLR1_GRVWA8_GRVWB8_GSU0_GSUC0_GSUWGMRR0_K1_LBSPPA1024_LBSPPB1024_LPA0_LPB0_MIWT4_4_NLCA1_NLCB1_PLR1_SU4_SUM0_SUS128_SVW4_SK1_ULSGRO1_VWA4_VWB4_WG32_8_1_WGM1_WGMXCC8_WGMXCCG304
    SolutionIndex: 102
    SolutionNameMin: Cijk_Ailk_Bjlk_BBS_BH_UserArgs_MT128x64x64_MI16x16x1_SN_LDSB1_CLR1_GRVWA8_GRVWB8_GSU0_GSUC0_GSUWGMRR0_K1_LBSPPA1024_LBSPPB512_LPA0_LPB32_MIWT4_2_NLCA1_NLCB1_PLR1_SU0_SUM0_SUS0_SVW4_SK1_ULSGRO0_VWA4_VWB2_WG32_8_1_WGM8_WGMXCC1_WGMXCCG304
    SolutionIndex: 103
    SolutionNameMin: Cijk_Ailk_Bjlk_BBS_BH_UserArgs_MT128x64x64_MI16x16x1_SN_LDSB1_CLR1_GRVWA8_GRVWB8_GSU0_GSUC0_GSUWGMRR0_K1_LBSPPA1024_LBSPPB512_LPA0_LPB32_MIWT4_2_NLCA1_NLCB1_PLR2_SU4_SUM0_SUS128_SVW4_SK1_ULSGRO0_VWA4_VWB2_WG32_8_1_WGM8_WGMXCC1_WGMXCCG304
    SolutionIndex: 104
    SolutionNameMin: Cijk_Ailk_Bjlk_BBS_BH_UserArgs_MT128x64x128_MI16x16x1_SN_LDSB1_CLR1_GRVWA8_GRVWB8_GSU0_GSUC0_GSUWGMRR0_K1_LBSPPA1024_LBSPPB512_LPA0_LPB32_MIWT4_2_NLCA1_NLCB1_PLR2_SU4_SUM0_SUS256_SVW4_SK1_ULSGRO0_VWA4_VWB2_WG32_8_1_WGM8_WGMXCC1_WGMXCCG304
    SolutionIndex: 105
    SolutionNameMin: Cijk_Ailk_Bjlk_BBS_BH_UserArgs_MT128x128x128_MI16x16x1_SN_LDSB1_CLR1_GRVWA8_GRVWB8_GSU0_GSUC0_GSUWGMRR0_K1_LBSPPA1024_LBSPPB1024_LPA0_LPB0_MIWT4_4_NLCA1_NLCB1_PLR1_SU0_SUM0_SUS0_SVW4_SK1_ULSGRO0_VWA4_VWB4_WG32_8_1_WGM1_WGMXCC16_WGMXCCG304
    SolutionIndex: 106
    SolutionNameMin: Cijk_Ailk_Bjlk_BBS_BH_UserArgs_MT128x128x64_MI16x16x1_SN_LDSB1_CLR1_GRVWA8_GRVWB8_GSU0_GSUC0_GSUWGMRR0_K1_LBSPPA1024_LBSPPB1024_LPA0_LPB0_MIWT4_4_NLCA1_NLCB1_PLR1_SU4_SUM1_SUS128_SVW4_SK3_ULSGRO0_VWA4_VWB4_WG32_8_1_WGM1_WGMXCC8_WGMXCCG304
    SolutionIndex: 107
    SolutionNameMin: Cijk_Ailk_Bjlk_BBS_BH_UserArgs_MT128x128x64_MI16x16x1_SN_LDSB1_CLR1_GRVWA8_GRVWB8_GSU0_GSUC0_GSUWGMRR0_K1_LBSPPA1024_LBSPPB1024_LPA0_LPB0_MIWT4_4_NLCA1_NLCB1_PLR1_SU4_SUM1_SUS128_SVW4_SK3_ULSGRO1_VWA4_VWB4_WG32_8_1_WGM4_WGMXCC8_WGMXCCG304
    SolutionIndex: 108
    SolutionNameMin: Cijk_Ailk_Bjlk_BBS_BH_UserArgs_MT128x128x64_MI16x16x1_SN_LDSB1_CLR1_GRVWA8_GRVWB8_GSU0_GSUC0_GSUWGMRR0_K1_LBSPPA1024_LBSPPB1024_LPA0_LPB0_MIWT4_4_NLCA1_NLCB1_PLR2_SU0_SUM0_SUS0_SVW4_SK1_ULSGRO1_VWA4_VWB4_WG32_8_1_WGM4_WGMXCC8_WGMXCCG304
    SolutionIndex: 109
    SolutionNameMin: Cijk_Ailk_Bjlk_BBS_BH_UserArgs_MT128x128x64_MI16x16x1_SN_LDSB1_CLR1_GRVWA8_GRVWB8_GSU0_GSUC0_GSUWGMRR0_K1_LBSPPA1024_LBSPPB1024_LPA0_LPB32_MIWT8_2_NLCA1_NLCB1_PLR2_SU4_SUM1_SUS128_SVW8_SK1_ULSGRO0_VWA8_VWB2_WG16_16_1_WGM8_WGMXCC1_WGMXCCG304
    SolutionIndex: 110
    SolutionNameMin: Cijk_Ailk_Bjlk_BBS_BH_UserArgs_MT128x128x64_MI16x16x1_SN_LDSB1_CLR1_GRVWA8_GRVWB8_GSU0_GSUC0_GSUWGMRR0_K1_LBSPPA1024_LBSPPB1024_LPA0_LPB32_MIWT8_2_NLCA1_NLCB1_PLR1_SU0_SUM0_SUS0_SVW8_SK1_ULSGRO1_VWA8_VWB2_WG16_16_1_WGM8_WGMXCC1_WGMXCCG304
    SolutionIndex: 111
    SolutionNameMin: Cijk_Ailk_Bjlk_BBS_BH_UserArgs_MT128x128x128_MI16x16x1_SN_LDSB1_CLR1_GRVWA8_GRVWB8_GSU0_GSUC0_GSUWGMRR0_K1_LBSPPA1024_LBSPPB1024_LPA0_LPB0_MIWT4_4_NLCA1_NLCB1_PLR2_SU0_SUM0_SUS0_SVW4_SK1_ULSGRO0_VWA4_VWB4_WG32_8_1_WGM8_WGMXCC1_WGMXCCG304
    SolutionIndex: 112
    SolutionNameMin: Cijk_Ailk_Bjlk_BBS_BH_UserArgs_MT128x128x64_MI16x16x1_SN_LDSB1_CLR1_GRVWA8_GRVWB8_GSU0_GSUC0_GSUWGMRR0_K1_LBSPPA1024_LBSPPB1024_LPA0_LPB0_MIWT4_4_NLCA1_NLCB1_PLR1_SU4_SUM1_SUS128_SVW4_SK3_ULSGRO1_VWA4_VWB4_WG32_8_1_WGM1_WGMXCC8_WGMXCCG304
    SolutionIndex: 113
    SolutionNameMin: Cijk_Ailk_Bjlk_BBS_BH_UserArgs_MT128x128x64_MI16x16x1_SN_LDSB1_CLR1_GRVWA8_GRVWB8_GSU0_GSUC0_GSUWGMRR0_K1_LBSPPA1024_LBSPPB1024_LPA0_LPB0_MIWT4_4_NLCA1_NLCB1_PLR1_SU4_SUM0_SUS128_SVW4_SK1_ULSGRO1_VWA4_VWB4_WG32_8_1_WGM8_WGMXCC8_WGMXCCG304
    SolutionIndex: 114
    SolutionNameMin: Cijk_Ailk_Bjlk_BBS_BH_UserArgs_MT128x256x32_MI16x16x1_SN_LDSB1_CLR1_GRVWA8_GRVWB8_GSU0_GSUC0_GSUWGMRR0_K1_LBSPPA1024_LBSPPB2048_LPA0_LPB0_MIWT4_8_NLCA1_NLCB1_PLR1_SU4_SUM1_SUS64_SVW4_SK1_ULSGRO0_VWA4_VWB8_WG32_8_1_WGM8_WGMXCC8_WGMXCCG304
    SolutionIndex: 115
    SolutionNameMin: Cijk_Ailk_Bjlk_BBS_BH_UserArgs_MT128x256x32_MI16x16x1_SN_LDSB1_CLR1_GRVWA8_GRVWB8_GSU0_GSUC0_GSUWGMRR0_K1_LBSPPA1024_LBSPPB2048_LPA0_LPB0_MIWT4_8_NLCA1_NLCB1_PLR1_SU0_SUM0_SUS0_SVW4_SK1_ULSGRO0_VWA4_VWB8_WG32_8_1_WGM4_WGMXCC8_WGMXCCG304
    SolutionIndex: 116
    SolutionNameMin: Cijk_Ailk_Bjlk_BBS_BH_UserArgs_MT32x32x128_MI16x16x1_SN_LDSB1_CLR1_GRVWA8_GRVWB8_GSU0_GSUC0_GSUWGMRR0_K1_LBSPPA256_LBSPPB256_LPA16_LPB16_MIWT1_1_NLCA1_NLCB1_PLR2_SU0_SUM0_SUS0_SVW1_SK3_ULSGRO0_VWA1_VWB1_WG32_8_1_WGM1_WGMXCC1_WGMXCCG304
    SolutionIndex: 117
    SolutionNameMin: Cijk_Ailk_Bjlk_BBS_BH_UserArgs_MT32x32x128_MI16x16x1_SN_LDSB1_CLR1_GRVWA8_GRVWB8_GSU0_GSUC0_GSUWGMRR0_K1_LBSPPA256_LBSPPB256_LPA16_LPB16_MIWT1_1_NLCA1_NLCB1_PLR1_SU4_SUM1_SUS256_SVW1_SK1_ULSGRO1_VWA1_VWB1_WG32_8_1_WGM4_WGMXCC16_WGMXCCG304
    SolutionIndex: 118
    SolutionNameMin: Cijk_Ailk_Bjlk_BBS_BH_UserArgs_MT64x64x128_MI16x16x1_SN_LDSB1_CLR1_GRVWA8_GRVWB8_GSU0_GSUC0_GSUWGMRR0_K1_LBSPPA512_LBSPPB512_LPA32_LPB32_MIWT2_2_NLCA1_NLCB1_PLR2_SU4_SUM0_SUS256_SVW2_SK1_ULSGRO0_VWA2_VWB2_WG32_8_1_WGM1_WGMXCC8_WGMXCCG304
    SolutionIndex: 119
    SolutionNameMin: Cijk_Ailk_Bjlk_BBS_BH_UserArgs_MT64x64x64_MI16x16x1_SN_LDSB1_CLR1_GRVWA8_GRVWB8_GSU0_GSUC0_GSUWGMRR0_K1_LBSPPA512_LBSPPB512_LPA32_LPB32_MIWT2_2_NLCA1_NLCB1_PLR1_SU0_SUM0_SUS0_SVW2_SK1_ULSGRO1_VWA2_VWB2_WG32_8_1_WGM1_WGMXCC1_WGMXCCG304
    SolutionIndex: 120
    SolutionNameMin: Cijk_Ailk_Bjlk_BBS_BH_UserArgs_MT32x32x64_MI16x16x1_SN_LDSB0_CLR1_GRVWA8_GRVWB8_GSU0_GSUC0_GSUWGMRR0_K1_LBSPPA256_LBSPPB256_LPA16_LPB16_MIWT1_1_NLCA1_NLCB1_PLR2_SU4_SUM0_SUS128_SVW1_SK1_ULSGRO0_VWA1_VWB1_WG32_8_1_WGM1_WGMXCC1_WGMXCCG304
    SolutionIndex: 121
    SolutionNameMin: Cijk_Ailk_Bjlk_BBS_BH_UserArgs_MT32x32x128_MI16x16x1_SN_LDSB1_CLR1_GRVWA8_GRVWB8_GSU0_GSUC0_GSUWGMRR0_K1_LBSPPA256_LBSPPB256_LPA16_LPB16_MIWT1_1_NLCA1_NLCB1_PLR1_SU4_SUM1_SUS256_SVW1_SK1_ULSGRO1_VWA1_VWB1_WG32_8_1_WGM1_WGMXCC1_WGMXCCG304
    SolutionIndex: 122
    SolutionNameMin: Cijk_Ailk_Bjlk_BBS_BH_UserArgs_MT32x64x128_MI16x16x1_SN_LDSB1_CLR1_GRVWA8_GRVWB8_GSU0_GSUC0_GSUWGMRR0_K1_LBSPPA256_LBSPPB512_LPA16_LPB32_MIWT1_2_NLCA1_NLCB1_PLR1_SU4_SUM1_SUS256_SVW1_SK1_ULSGRO0_VWA1_VWB2_WG32_8_1_WGM1_WGMXCC16_WGMXCCG304
    SolutionIndex: 123
    SolutionNameMin: Cijk_Ailk_Bjlk_BBS_BH_UserArgs_MT64x64x64_MI16x16x1_SN_LDSB1_CLR1_GRVWA8_GRVWB8_GSU0_GSUC0_GSUWGMRR0_K1_LBSPPA512_LBSPPB512_LPA32_LPB32_MIWT2_2_NLCA1_NLCB1_PLR1_SU0_SUM0_SUS0_SVW2_SK3_ULSGRO0_VWA2_VWB2_WG32_8_1_WGM1_WGMXCC16_WGMXCCG304
    SolutionIndex: 124
    SolutionNameMin: Cijk_Ailk_Bjlk_BBS_BH_UserArgs_MT64x64x64_MI16x16x1_SN_LDSB1_CLR1_GRVWA8_GRVWB8_GSU0_GSUC0_GSUWGMRR0_K1_LBSPPA512_LBSPPB512_LPA32_LPB32_MIWT2_2_NLCA1_NLCB1_PLR1_SU4_SUM0_SUS128_SVW2_SK1_ULSGRO1_VWA2_VWB2_WG32_8_1_WGM1_WGMXCC8_WGMXCCG304
    SolutionIndex: 125
    SolutionNameMin: Cijk_Ailk_Bjlk_BBS_BH_UserArgs_MT64x32x64_MI16x16x1_SN_LDSB0_CLR1_GRVWA8_GRVWB8_GSU0_GSUC0_GSUWGMRR0_K1_LBSPPA512_LBSPPB256_LPA32_LPB16_MIWT2_1_NLCA1_NLCB1_PLR2_SU4_SUM0_SUS128_SVW2_SK1_ULSGRO0_VWA2_VWB1_WG32_8_1_WGM1_WGMXCC1_WGMXCCG304
    SolutionIndex: 126
    SolutionNameMin: Cijk_Ailk_Bjlk_BBS_BH_UserArgs_MT32x64x64_MI16x16x1_SN_LDSB0_CLR1_GRVWA8_GRVWB8_GSU0_GSUC0_GSUWGMRR0_K1_LBSPPA256_LBSPPB512_LPA16_LPB32_MIWT1_2_NLCA1_NLCB1_PLR2_SU4_SUM1_SUS128_SVW1_SK1_ULSGRO0_VWA1_VWB2_WG32_8_1_WGM1_WGMXCC1_WGMXCCG304
    SolutionIndex: 127
    SolutionNameMin: Cijk_Ailk_Bjlk_BBS_BH_UserArgs_MT64x64x128_MI16x16x1_SN_LDSB1_CLR1_GRVWA8_GRVWB8_GSU0_GSUC0_GSUWGMRR0_K1_LBSPPA512_LBSPPB512_LPA32_LPB32_MIWT2_2_NLCA1_NLCB1_PLR2_SU4_SUM1_SUS256_SVW2_SK1_ULSGRO0_VWA2_VWB2_WG32_8_1_WGM6_WGMXCC16_WGMXCCG304
    SolutionIndex: 128
    SolutionNameMin: Cijk_Ailk_Bjlk_BBS_BH_UserArgs_MT128x64x128_MI16x16x1_SN_LDSB1_CLR1_GRVWA8_GRVWB8_GSU0_GSUC0_GSUWGMRR0_K1_LBSPPA1024_LBSPPB512_LPA0_LPB32_MIWT4_2_NLCA1_NLCB1_PLR2_SU4_SUM1_SUS256_SVW4_SK1_ULSGRO0_VWA4_VWB2_WG32_8_1_WGM1_WGMXCC16_WGMXCCG304
    SolutionIndex: 129
    SolutionNameMin: Cijk_Ailk_Bjlk_BBS_BH_UserArgs_MT64x64x128_MI16x16x1_SN_LDSB1_CLR1_GRVWA8_GRVWB8_GSU0_GSUC0_GSUWGMRR0_K1_LBSPPA512_LBSPPB512_LPA32_LPB32_MIWT2_2_NLCA1_NLCB1_PLR2_SU4_SUM0_SUS256_SVW2_SK1_ULSGRO1_VWA2_VWB2_WG32_8_1_WGM4_WGMXCC1_WGMXCCG304
    SolutionIndex: 130
    SolutionNameMin: Cijk_Ailk_Bjlk_BBS_BH_UserArgs_MT128x64x64_MI16x16x1_SN_LDSB1_CLR1_GRVWA8_GRVWB8_GSU0_GSUC0_GSUWGMRR0_K1_LBSPPA1024_LBSPPB512_LPA0_LPB32_MIWT4_2_NLCA1_NLCB1_PLR2_SU0_SUM0_SUS0_SVW4_SK1_ULSGRO1_VWA4_VWB2_WG32_8_1_WGM8_WGMXCC8_WGMXCCG304
    SolutionIndex: 131
    SolutionNameMin: Cijk_Ailk_Bjlk_BBS_BH_UserArgs_MT64x64x128_MI16x16x1_SN_LDSB1_CLR1_GRVWA8_GRVWB8_GSU0_GSUC0_GSUWGMRR0_K1_LBSPPA512_LBSPPB512_LPA32_LPB32_MIWT2_2_NLCA1_NLCB1_PLR2_SU0_SUM0_SUS0_SVW2_SK1_ULSGRO1_VWA2_VWB2_WG32_8_1_WGM1_WGMXCC1_WGMXCCG304
    SolutionIndex: 132
    SolutionNameMin: Cijk_Ailk_Bjlk_BBS_BH_UserArgs_MT64x64x64_MI16x16x1_SN_LDSB1_CLR1_GRVWA8_GRVWB8_GSU0_GSUC0_GSUWGMRR0_K1_LBSPPA512_LBSPPB512_LPA32_LPB32_MIWT2_2_NLCA1_NLCB1_PLR1_SU0_SUM0_SUS0_SVW2_SK1_ULSGRO0_VWA2_VWB2_WG32_8_1_WGM4_WGMXCC1_WGMXCCG304
    SolutionIndex: 133
    SolutionNameMin: Cijk_Ailk_Bjlk_BBS_BH_UserArgs_MT128x64x128_MI16x16x1_SN_LDSB1_CLR1_GRVWA8_GRVWB8_GSU0_GSUC0_GSUWGMRR0_K1_LBSPPA1024_LBSPPB512_LPA0_LPB32_MIWT4_2_NLCA1_NLCB1_PLR2_SU0_SUM0_SUS0_SVW4_SK1_ULSGRO0_VWA4_VWB2_WG32_8_1_WGM4_WGMXCC1_WGMXCCG304
    SolutionIndex: 134
    SolutionNameMin: Cijk_Ailk_Bjlk_BBS_BH_UserArgs_MT128x128x128_MI16x16x1_SN_LDSB1_CLR1_GRVWA8_GRVWB8_GSU0_GSUC0_GSUWGMRR0_K1_LBSPPA1024_LBSPPB1024_LPA0_LPB0_MIWT4_4_NLCA1_NLCB1_PLR1_SU4_SUM1_SUS256_SVW4_SK1_ULSGRO0_VWA4_VWB4_WG32_8_1_WGM6_WGMXCC8_WGMXCCG304
    SolutionIndex: 135
    SolutionNameMin: Cijk_Ailk_Bjlk_BBS_BH_UserArgs_MT128x64x32_MI16x16x1_SN_LDSB0_CLR1_GRVWA8_GRVWB8_GSU0_GSUC0_GSUWGMRR0_K1_LBSPPA1024_LBSPPB512_LPA0_LPB32_MIWT4_2_NLCA1_NLCB1_PLR1_SU4_SUM1_SUS64_SVW4_SK1_ULSGRO0_VWA4_VWB2_WG32_8_1_WGM4_WGMXCC1_WGMXCCG304
    SolutionIndex: 136
    SolutionNameMin: Cijk_Ailk_Bjlk_BBS_BH_UserArgs_MT128x64x64_MI16x16x1_SN_LDSB1_CLR1_GRVWA8_GRVWB8_GSU0_GSUC0_GSUWGMRR0_K1_LBSPPA1024_LBSPPB512_LPA0_LPB32_MIWT4_2_NLCA1_NLCB1_PLR1_SU0_SUM0_SUS0_SVW4_SK1_ULSGRO0_VWA4_VWB2_WG32_8_1_WGM4_WGMXCC1_WGMXCCG304
    SolutionIndex: 137
    SolutionNameMin: Cijk_Ailk_Bjlk_BBS_BH_UserArgs_MT128x128x128_MI16x16x1_SN_LDSB1_CLR1_GRVWA8_GRVWB8_GSU0_GSUC0_GSUWGMRR0_K1_LBSPPA1024_LBSPPB1024_LPA0_LPB0_MIWT4_4_NLCA1_NLCB1_PLR1_SU4_SUM1_SUS256_SVW4_SK1_ULSGRO1_VWA4_VWB4_WG32_8_1_WGM1_WGMXCC8_WGMXCCG304
    SolutionIndex: 138
    SolutionNameMin: Cijk_Ailk_Bjlk_BBS_BH_UserArgs_MT128x128x64_MI16x16x1_SN_LDSB1_CLR1_GRVWA8_GRVWB8_GSU0_GSUC0_GSUWGMRR0_K1_LBSPPA1024_LBSPPB1024_LPA0_LPB0_MIWT4_4_NLCA1_NLCB1_PLR1_SU0_SUM0_SUS0_SVW4_SK1_ULSGRO0_VWA4_VWB4_WG32_8_1_WGM4_WGMXCC16_WGMXCCG304
    SolutionIndex: 139
    SolutionNameMin: Cijk_Ailk_Bjlk_BBS_BH_UserArgs_MT128x128x64_MI16x16x1_SN_LDSB1_CLR1_GRVWA8_GRVWB8_GSU0_GSUC0_GSUWGMRR0_K1_LBSPPA1024_LBSPPB1024_LPA0_LPB0_MIWT4_4_NLCA1_NLCB1_PLR1_SU4_SUM1_SUS128_SVW4_SK1_ULSGRO0_VWA4_VWB4_WG32_8_1_WGM1_WGMXCC8_WGMXCCG304
    SolutionIndex: 140
    SolutionNameMin: Cijk_Ailk_Bjlk_BBS_BH_UserArgs_MT128x128x32_MI16x16x1_SN_LDSB0_CLR1_GRVWA8_GRVWB8_GSU0_GSUC0_GSUWGMRR0_K1_LBSPPA1024_LBSPPB1024_LPA0_LPB0_MIWT4_4_NLCA1_NLCB1_PLR1_SU4_SUM1_SUS64_SVW4_SK1_ULSGRO1_VWA4_VWB4_WG32_8_1_WGM4_WGMXCC1_WGMXCCG304
    SolutionIndex: 141
    SolutionNameMin: Cijk_Ailk_Bjlk_BBS_BH_UserArgs_MT128x128x64_MI16x16x1_SN_LDSB1_CLR1_GRVWA8_GRVWB8_GSU0_GSUC0_GSUWGMRR0_K1_LBSPPA1024_LBSPPB1024_LPA0_LPB0_MIWT4_4_NLCA1_NLCB1_PLR1_SU0_SUM0_SUS0_SVW4_SK1_ULSGRO1_VWA4_VWB4_WG32_8_1_WGM4_WGMXCC1_WGMXCCG304
    SolutionIndex: 142
    SolutionNameMin: Cijk_Ailk_Bjlk_BBS_BH_UserArgs_MT128x128x128_MI16x16x1_SN_LDSB1_CLR1_GRVWA8_GRVWB8_GSU0_GSUC0_GSUWGMRR0_K1_LBSPPA1024_LBSPPB1024_LPA0_LPB0_MIWT4_4_NLCA1_NLCB1_PLR1_SU0_SUM0_SUS0_SVW4_SK1_ULSGRO0_VWA4_VWB4_WG32_8_1_WGM4_WGMXCC1_WGMXCCG304
    SolutionIndex: 143
    SolutionNameMin: Cijk_Ailk_Bjlk_BBS_BH_UserArgs_MT128x256x32_MI16x16x1_SN_LDSB1_CLR1_GRVWA8_GRVWB8_GSU0_GSUC0_GSUWGMRR0_K1_LBSPPA1024_LBSPPB2048_LPA0_LPB0_MIWT4_8_NLCA1_NLCB1_PLR1_SU4_SUM0_SUS64_SVW4_SK3_ULSGRO1_VWA4_VWB8_WG32_8_1_WGM8_WGMXCC8_WGMXCCG304
    SolutionIndex: 144
    SolutionNameMin: Cijk_Ailk_Bjlk_BBS_BH_UserArgs_MT128x256x32_MI16x16x1_SN_LDSB1_CLR1_GRVWA8_GRVWB8_GSU0_GSUC0_GSUWGMRR0_K1_LBSPPA1024_LBSPPB2048_LPA0_LPB0_MIWT4_8_NLCA1_NLCB1_PLR1_SU4_SUM1_SUS64_SVW4_SK1_ULSGRO1_VWA4_VWB8_WG32_8_1_WGM8_WGMXCC8_WGMXCCG304
    SolutionIndex: 145
    SolutionNameMin: Cijk_Ailk_Bjlk_BBS_BH_UserArgs_MT256x128x32_MI16x16x1_SN_LDSB1_CLR1_GRVWA8_GRVWB8_GSU0_GSUC0_GSUWGMRR0_K1_LBSPPA2048_LBSPPB1024_LPA0_LPB0_MIWT8_4_NLCA1_NLCB1_PLR1_SU0_SUM0_SUS0_SVW8_SK1_ULSGRO0_VWA8_VWB4_WG32_8_1_WGM8_WGMXCC16_WGMXCCG304
    SolutionIndex: 146
    SolutionNameMin: Cijk_Ailk_Bjlk_BBS_BH_UserArgs_MT128x256x64_MI16x16x1_SN_LDSB1_CLR1_GRVWA8_GRVWB8_GSU0_GSUC0_GSUWGMRR0_K1_LBSPPA1024_LBSPPB2048_LPA0_LPB0_MIWT4_8_NLCA1_NLCB1_PLR1_SU4_SUM0_SUS128_SVW4_SK1_ULSGRO1_VWA4_VWB8_WG32_8_1_WGM8_WGMXCC1_WGMXCCG304
    SolutionIndex: 147
    SolutionNameMin: Cijk_Ailk_Bjlk_BBS_BH_UserArgs_MT128x128x64_MI16x16x1_SN_LDSB1_CLR1_GRVWA8_GRVWB8_GSU0_GSUC0_GSUWGMRR0_K1_LBSPPA1024_LBSPPB1024_LPA0_LPB0_MIWT4_4_NLCA1_NLCB1_PLR1_SU4_SUM0_SUS128_SVW4_SK3_ULSGRO0_VWA4_VWB4_WG32_8_1_WGM1_WGMXCC8_WGMXCCG304
    SolutionIndex: 148
    SolutionNameMin: Cijk_Ailk_Bjlk_BBS_BH_UserArgs_MT128x128x64_MI16x16x1_SN_LDSB1_CLR1_GRVWA8_GRVWB8_GSU0_GSUC0_GSUWGMRR0_K1_LBSPPA1024_LBSPPB1024_LPA0_LPB0_MIWT4_4_NLCA1_NLCB1_PLR1_SU0_SUM0_SUS0_SVW4_SK1_ULSGRO1_VWA4_VWB4_WG32_8_1_WGM1_WGMXCC8_WGMXCCG304
    SolutionIndex: 149
    SolutionNameMin: Cijk_Ailk_Bjlk_BBS_BH_UserArgs_MT128x256x32_MI16x16x1_SN_LDSB1_CLR1_GRVWA8_GRVWB8_GSU0_GSUC0_GSUWGMRR0_K1_LBSPPA1024_LBSPPB2048_LPA0_LPB0_MIWT4_8_NLCA1_NLCB1_PLR1_SU0_SUM0_SUS0_SVW4_SK3_ULSGRO1_VWA4_VWB8_WG32_8_1_WGM1_WGMXCC8_WGMXCCG304
    SolutionIndex: 150
    SolutionNameMin: Cijk_Ailk_Bjlk_BBS_BH_UserArgs_MT256x256x32_MI16x16x1_SN_LDSB0_CLR1_GRVWA8_GRVWB8_GSU0_GSUC0_GSUWGMRR0_K1_LBSPPA2048_LBSPPB2048_LPA0_LPB0_MIWT8_8_NLCA1_NLCB1_PLR1_SU4_SUM0_SUS64_SVW8_SK3_ULSGRO0_VWA8_VWB8_WG32_8_1_WGM6_WGMXCC1_WGMXCCG304
    SolutionIndex: 151
    SolutionNameMin: Cijk_Ailk_Bjlk_BBS_BH_UserArgs_MT32x32x64_MI16x16x1_SN_LDSB0_CLR1_GRVWA8_GRVWB8_GSU0_GSUC0_GSUWGMRR0_K1_LBSPPA256_LBSPPB256_LPA16_LPB16_MIWT1_1_NLCA1_NLCB1_PLR2_SU4_SUM1_SUS128_SVW1_SK1_ULSGRO1_VWA1_VWB1_WG32_8_1_WGM1_WGMXCC1_WGMXCCG304
    SolutionIndex: 152
    SolutionNameMin: Cijk_Ailk_Bjlk_BBS_BH_UserArgs_MT64x64x128_MI16x16x1_SN_LDSB1_CLR1_GRVWA8_GRVWB8_GSU0_GSUC0_GSUWGMRR0_K1_LBSPPA512_LBSPPB512_LPA32_LPB32_MIWT2_2_NLCA1_NLCB1_PLR2_SU0_SUM0_SUS0_SVW2_SK1_ULSGRO0_VWA2_VWB2_WG32_8_1_WGM1_WGMXCC8_WGMXCCG304
    SolutionIndex: 153
    SolutionNameMin: Cijk_Ailk_Bjlk_BBS_BH_UserArgs_MT64x64x64_MI16x16x1_SN_LDSB1_CLR1_GRVWA8_GRVWB8_GSU0_GSUC0_GSUWGMRR0_K1_LBSPPA512_LBSPPB512_LPA32_LPB32_MIWT2_2_NLCA1_NLCB1_PLR1_SU4_SUM1_SUS128_SVW2_SK1_ULSGRO1_VWA2_VWB2_WG32_8_1_WGM1_WGMXCC1_WGMXCCG304
    SolutionIndex: 154
    SolutionNameMin: Cijk_Ailk_Bjlk_BBS_BH_UserArgs_MT64x32x32_MI16x16x1_SN_LDSB0_CLR0_GRVWA4_GRVWB4_GSU0_GSUC0_GSUWGMRR0_K1_LBSPPA512_LBSPPB256_LPA32_LPB16_MIWT2_1_NLCA1_NLCB1_PLR0_SU4_SUM0_SUS64_SVW2_SK1_ULSGRO1_VWA2_VWB1_WG32_8_1_WGM1_WGMXCC1_WGMXCCG304
    SolutionIndex: 155
    SolutionNameMin: Cijk_Ailk_Bjlk_BBS_BH_UserArgs_MT64x32x64_MI16x16x1_SN_LDSB0_CLR1_GRVWA8_GRVWB8_GSU0_GSUC0_GSUWGMRR0_K1_LBSPPA512_LBSPPB256_LPA32_LPB16_MIWT2_1_NLCA1_NLCB1_PLR2_SU4_SUM0_SUS128_SVW2_SK1_ULSGRO1_VWA2_VWB1_WG32_8_1_WGM1_WGMXCC1_WGMXCCG304
    SolutionIndex: 156
    SolutionNameMin: Cijk_Ailk_Bjlk_BBS_BH_UserArgs_MT64x32x128_MI16x16x1_SN_LDSB1_CLR1_GRVWA8_GRVWB8_GSU0_GSUC0_GSUWGMRR0_K1_LBSPPA512_LBSPPB256_LPA32_LPB16_MIWT2_1_NLCA1_NLCB1_PLR2_SU0_SUM0_SUS0_SVW2_SK1_ULSGRO0_VWA2_VWB1_WG32_8_1_WGM1_WGMXCC1_WGMXCCG304
    SolutionIndex: 157
    SolutionNameMin: Cijk_Ailk_Bjlk_BBS_BH_UserArgs_MT128x64x128_MI16x16x1_SN_LDSB1_CLR1_GRVWA8_GRVWB8_GSU0_GSUC0_GSUWGMRR0_K1_LBSPPA1024_LBSPPB512_LPA0_LPB32_MIWT4_2_NLCA1_NLCB1_PLR2_SU4_SUM0_SUS256_SVW4_SK1_ULSGRO0_VWA4_VWB2_WG32_8_1_WGM4_WGMXCC1_WGMXCCG304
    SolutionIndex: 158
    SolutionNameMin: Cijk_Ailk_Bjlk_BBS_BH_UserArgs_MT64x128x64_MI16x16x1_SN_LDSB1_CLR1_GRVWA8_GRVWB8_GSU0_GSUC0_GSUWGMRR0_K1_LBSPPA512_LBSPPB1024_LPA32_LPB0_MIWT2_4_NLCA1_NLCB1_PLR1_SU4_SUM0_SUS128_SVW2_SK1_ULSGRO1_VWA2_VWB4_WG32_8_1_WGM1_WGMXCC1_WGMXCCG304
    SolutionIndex: 159
    SolutionNameMin: Cijk_Ailk_Bjlk_BBS_BH_UserArgs_MT64x128x64_MI16x16x1_SN_LDSB1_CLR1_GRVWA8_GRVWB8_GSU0_GSUC0_GSUWGMRR0_K1_LBSPPA512_LBSPPB1024_LPA32_LPB0_MIWT2_4_NLCA1_NLCB1_PLR2_SU4_SUM1_SUS128_SVW2_SK1_ULSGRO1_VWA2_VWB4_WG32_8_1_WGM6_WGMXCC8_WGMXCCG304
    SolutionIndex: 160
    SolutionNameMin: Cijk_Ailk_Bjlk_BBS_BH_UserArgs_MT64x64x64_MI16x16x1_SN_LDSB1_CLR1_GRVWA8_GRVWB8_GSU0_GSUC0_GSUWGMRR0_K1_LBSPPA512_LBSPPB512_LPA32_LPB32_MIWT2_2_NLCA1_NLCB1_PLR1_SU4_SUM0_SUS128_SVW2_SK1_ULSGRO1_VWA2_VWB2_WG32_8_1_WGM1_WGMXCC1_WGMXCCG304
    SolutionIndex: 161
    SolutionNameMin: Cijk_Ailk_Bjlk_BBS_BH_UserArgs_MT64x64x64_MI16x16x1_SN_LDSB1_CLR1_GRVWA8_GRVWB8_GSU0_GSUC0_GSUWGMRR0_K1_LBSPPA512_LBSPPB512_LPA32_LPB32_MIWT2_2_NLCA1_NLCB1_PLR2_SU4_SUM0_SUS128_SVW2_SK1_ULSGRO1_VWA2_VWB2_WG32_8_1_WGM1_WGMXCC1_WGMXCCG304
    SolutionIndex: 162
    SolutionNameMin: Cijk_Ailk_Bjlk_BBS_BH_UserArgs_MT64x64x128_MI16x16x1_SN_LDSB1_CLR1_GRVWA8_GRVWB8_GSU0_GSUC0_GSUWGMRR0_K1_LBSPPA512_LBSPPB512_LPA32_LPB32_MIWT2_2_NLCA1_NLCB1_PLR1_SU4_SUM1_SUS256_SVW2_SK1_ULSGRO0_VWA2_VWB2_WG32_8_1_WGM1_WGMXCC1_WGMXCCG304
    SolutionIndex: 163
    SolutionNameMin: Cijk_Ailk_Bjlk_BBS_BH_UserArgs_MT128x128x128_MI16x16x1_SN_LDSB1_CLR1_GRVWA8_GRVWB8_GSU0_GSUC0_GSUWGMRR0_K1_LBSPPA1024_LBSPPB1024_LPA0_LPB0_MIWT4_4_NLCA1_NLCB1_PLR1_SU0_SUM0_SUS0_SVW4_SK1_ULSGRO1_VWA4_VWB4_WG32_8_1_WGM1_WGMXCC8_WGMXCCG304
    SolutionIndex: 164
    SolutionNameMin: Cijk_Ailk_Bjlk_BBS_BH_UserArgs_MT128x128x64_MI16x16x1_SN_LDSB1_CLR1_GRVWA8_GRVWB8_GSU0_GSUC0_GSUWGMRR0_K1_LBSPPA1024_LBSPPB1024_LPA0_LPB0_MIWT4_4_NLCA1_NLCB1_PLR1_SU4_SUM0_SUS128_SVW4_SK1_ULSGRO1_VWA4_VWB4_WG32_8_1_WGM1_WGMXCC1_WGMXCCG304
    SolutionIndex: 165
    SolutionNameMin: Cijk_Ailk_Bjlk_BBS_BH_UserArgs_MT64x128x64_MI16x16x1_SN_LDSB1_CLR1_GRVWA8_GRVWB8_GSU0_GSUC0_GSUWGMRR0_K1_LBSPPA512_LBSPPB1024_LPA32_LPB0_MIWT2_4_NLCA1_NLCB1_PLR2_SU4_SUM1_SUS128_SVW2_SK1_ULSGRO1_VWA2_VWB4_WG32_8_1_WGM1_WGMXCC1_WGMXCCG304
    SolutionIndex: 166
    SolutionNameMin: Cijk_Ailk_Bjlk_BBS_BH_UserArgs_MT64x128x64_MI16x16x1_SN_LDSB1_CLR1_GRVWA8_GRVWB8_GSU0_GSUC0_GSUWGMRR0_K1_LBSPPA512_LBSPPB1024_LPA32_LPB0_MIWT2_4_NLCA1_NLCB1_PLR2_SU4_SUM1_SUS128_SVW2_SK1_ULSGRO0_VWA2_VWB4_WG32_8_1_WGM1_WGMXCC1_WGMXCCG304
    SolutionIndex: 167
    SolutionNameMin: Cijk_Ailk_Bjlk_BBS_BH_UserArgs_MT64x128x128_MI16x16x1_SN_LDSB1_CLR1_GRVWA8_GRVWB8_GSU0_GSUC0_GSUWGMRR0_K1_LBSPPA512_LBSPPB1024_LPA32_LPB0_MIWT2_4_NLCA1_NLCB1_PLR2_SU4_SUM0_SUS256_SVW2_SK1_ULSGRO0_VWA2_VWB4_WG32_8_1_WGM1_WGMXCC1_WGMXCCG304
    SolutionIndex: 168
    SolutionNameMin: Cijk_Ailk_Bjlk_BBS_BH_UserArgs_MT128x128x128_MI16x16x1_SN_LDSB1_CLR1_GRVWA8_GRVWB8_GSU0_GSUC0_GSUWGMRR0_K1_LBSPPA1024_LBSPPB1024_LPA0_LPB0_MIWT4_4_NLCA1_NLCB1_PLR1_SU0_SUM0_SUS0_SVW4_SK1_ULSGRO0_VWA4_VWB4_WG32_8_1_WGM4_WGMXCC8_WGMXCCG304
    SolutionIndex: 169
    SolutionNameMin: Cijk_Ailk_Bjlk_BBS_BH_UserArgs_MT128x128x64_MI16x16x1_SN_LDSB1_CLR1_GRVWA8_GRVWB8_GSU0_GSUC0_GSUWGMRR0_K1_LBSPPA1024_LBSPPB1024_LPA0_LPB0_MIWT4_4_NLCA1_NLCB1_PLR1_SU4_SUM0_SUS128_SVW4_SK1_ULSGRO0_VWA4_VWB4_WG32_8_1_WGM4_WGMXCC1_WGMXCCG304
    SolutionIndex: 170
    SolutionNameMin: Cijk_Ailk_Bjlk_BBS_BH_UserArgs_MT128x128x128_MI16x16x1_SN_LDSB1_CLR1_GRVWA8_GRVWB8_GSU0_GSUC0_GSUWGMRR0_K1_LBSPPA1024_LBSPPB1024_LPA0_LPB0_MIWT4_4_NLCA1_NLCB1_PLR1_SU0_SUM0_SUS0_SVW4_SK1_ULSGRO1_VWA4_VWB4_WG32_8_1_WGM4_WGMXCC1_WGMXCCG304
    SolutionIndex: 171
    SolutionNameMin: Cijk_Ailk_Bjlk_BBS_BH_UserArgs_MT128x128x64_MI16x16x1_SN_LDSB1_CLR1_GRVWA8_GRVWB8_GSU0_GSUC0_GSUWGMRR0_K1_LBSPPA1024_LBSPPB1024_LPA0_LPB0_MIWT4_4_NLCA1_NLCB1_PLR1_SU4_SUM0_SUS128_SVW4_SK1_ULSGRO0_VWA4_VWB4_WG32_8_1_WGM1_WGMXCC8_WGMXCCG304
    SolutionIndex: 172
    SolutionNameMin: Cijk_Ailk_Bjlk_BBS_BH_UserArgs_MT128x256x32_MI16x16x1_SN_LDSB1_CLR1_GRVWA8_GRVWB8_GSU0_GSUC0_GSUWGMRR0_K1_LBSPPA1024_LBSPPB2048_LPA0_LPB0_MIWT4_8_NLCA1_NLCB1_PLR1_SU4_SUM0_SUS64_SVW4_SK3_ULSGRO0_VWA4_VWB8_WG32_8_1_WGM8_WGMXCC8_WGMXCCG304
    SolutionIndex: 173
    SolutionNameMin: Cijk_Ailk_Bjlk_BBS_BH_UserArgs_MT256x128x32_MI16x16x1_SN_LDSB1_CLR1_GRVWA8_GRVWB8_GSU0_GSUC0_GSUWGMRR0_K1_LBSPPA2048_LBSPPB1024_LPA0_LPB0_MIWT8_4_NLCA1_NLCB1_PLR1_SU4_SUM0_SUS64_SVW8_SK1_ULSGRO0_VWA8_VWB4_WG32_8_1_WGM4_WGMXCC1_WGMXCCG304
    SolutionIndex: 174
    SolutionNameMin: Cijk_Ailk_Bjlk_BBS_BH_UserArgs_MT128x256x64_MI16x16x1_SN_LDSB1_CLR1_GRVWA8_GRVWB8_GSU0_GSUC0_GSUWGMRR0_K1_LBSPPA1024_LBSPPB2048_LPA0_LPB0_MIWT4_8_NLCA1_NLCB1_PLR1_SU0_SUM0_SUS0_SVW4_SK1_ULSGRO1_VWA4_VWB8_WG32_8_1_WGM4_WGMXCC1_WGMXCCG304
    SolutionIndex: 175
    SolutionNameMin: Cijk_Ailk_Bjlk_BBS_BH_UserArgs_MT128x128x64_MI16x16x1_SN_LDSB1_CLR1_GRVWA8_GRVWB8_GSU0_GSUC0_GSUWGMRR0_K1_LBSPPA1024_LBSPPB1024_LPA0_LPB0_MIWT4_4_NLCA1_NLCB1_PLR1_SU0_SUM0_SUS0_SVW4_SK1_ULSGRO0_VWA4_VWB4_WG32_8_1_WGM1_WGMXCC8_WGMXCCG304
    SolutionIndex: 176
    SolutionNameMin: Cijk_Ailk_Bjlk_BBS_BH_UserArgs_MT128x256x32_MI16x16x1_SN_LDSB1_CLR1_GRVWA8_GRVWB8_GSU0_GSUC0_GSUWGMRR0_K1_LBSPPA1024_LBSPPB2048_LPA0_LPB0_MIWT4_8_NLCA1_NLCB1_PLR1_SU4_SUM0_SUS64_SVW4_SK1_ULSGRO0_VWA4_VWB8_WG32_8_1_WGM4_WGMXCC8_WGMXCCG304
    SolutionIndex: 177
    SolutionNameMin: Cijk_Ailk_Bjlk_BBS_BH_UserArgs_MT256x256x32_MI16x16x1_SN_LDSB0_CLR1_GRVWA8_GRVWB8_GSU0_GSUC0_GSUWGMRR0_K1_LBSPPA2048_LBSPPB2048_LPA0_LPB0_MIWT8_8_NLCA1_NLCB1_PLR1_SU0_SUM0_SUS0_SVW8_SK3_ULSGRO0_VWA8_VWB8_WG32_8_1_WGM8_WGMXCC8_WGMXCCG304
    SolutionIndex: 178
    SolutionNameMin: Cijk_Ailk_Bjlk_BBS_BH_UserArgs_MT256x256x32_MI16x16x1_SN_LDSB0_CLR1_GRVWA8_GRVWB8_GSU0_GSUC0_GSUWGMRR0_K1_LBSPPA2048_LBSPPB2048_LPA0_LPB0_MIWT8_8_NLCA1_NLCB1_PLR1_SU4_SUM1_SUS64_SVW8_SK1_ULSGRO1_VWA8_VWB8_WG32_8_1_WGM1_WGMXCC1_WGMXCCG304
    SolutionIndex: 179
    SolutionNameMin: Cijk_Ailk_Bjlk_BBS_BH_UserArgs_MT256x256x64_MI16x16x1_SN_LDSB1_CLR1_GRVWA8_GRVWB8_GSU0_GSUC0_GSUWGMRR0_K1_LBSPPA2048_LBSPPB2048_LPA0_LPB0_MIWT8_8_NLCA1_NLCB1_PLR2_SU4_SUM1_SUS128_SVW8_SK1_ULSGRO1_VWA8_VWB8_WG32_8_1_WGM4_WGMXCC1_WGMXCCG304
    SolutionIndex: 180
    SolutionNameMin: Cijk_Ailk_Bjlk_BBS_BH_UserArgs_MT128x256x32_MI16x16x1_SN_LDSB1_CLR1_GRVWA8_GRVWB8_GSU0_GSUC0_GSUWGMRR0_K1_LBSPPA1024_LBSPPB2048_LPA0_LPB0_MIWT4_8_NLCA1_NLCB1_PLR1_SU0_SUM0_SUS0_SVW4_SK3_ULSGRO0_VWA4_VWB8_WG32_8_1_WGM4_WGMXCC8_WGMXCCG304
    SolutionIndex: 181
    SolutionNameMin: Cijk_Ailk_Bjlk_BBS_BH_UserArgs_MT128x256x32_MI16x16x1_SN_LDSB1_CLR1_GRVWA8_GRVWB8_GSU0_GSUC0_GSUWGMRR0_K1_LBSPPA1024_LBSPPB2048_LPA0_LPB0_MIWT4_8_NLCA1_NLCB1_PLR1_SU4_SUM0_SUS64_SVW4_SK1_ULSGRO0_VWA4_VWB8_WG32_8_1_WGM1_WGMXCC8_WGMXCCG304
    SolutionIndex: 182
    SolutionNameMin: Cijk_Ailk_Bjlk_BBS_BH_UserArgs_MT128x256x32_MI16x16x1_SN_LDSB1_CLR1_GRVWA8_GRVWB8_GSU0_GSUC0_GSUWGMRR0_K1_LBSPPA1024_LBSPPB2048_LPA0_LPB0_MIWT4_8_NLCA1_NLCB1_PLR1_SU4_SUM0_SUS64_SVW4_SK3_ULSGRO0_VWA4_VWB8_WG32_8_1_WGM1_WGMXCC8_WGMXCCG304
    SolutionIndex: 183
    SolutionNameMin: Cijk_Ailk_Bjlk_BBS_BH_UserArgs_MT128x256x32_MI16x16x1_SN_LDSB1_CLR1_GRVWA8_GRVWB8_GSU0_GSUC0_GSUWGMRR0_K1_LBSPPA1024_LBSPPB2048_LPA0_LPB0_MIWT4_8_NLCA1_NLCB1_PLR1_SU4_SUM0_SUS64_SVW4_SK1_ULSGRO1_VWA4_VWB8_WG32_8_1_WGM6_WGMXCC1_WGMXCCG304
    SolutionIndex: 184
    SolutionNameMin: Cijk_Ailk_Bjlk_BBS_BH_UserArgs_MT64x32x64_MI16x16x1_SN_LDSB0_CLR1_GRVWA8_GRVWB8_GSU0_GSUC0_GSUWGMRR0_K1_LBSPPA512_LBSPPB256_LPA32_LPB16_MIWT2_1_NLCA1_NLCB1_PLR2_SU4_SUM1_SUS128_SVW2_SK1_ULSGRO0_VWA2_VWB1_WG32_8_1_WGM1_WGMXCC1_WGMXCCG304
    SolutionIndex: 185
    SolutionNameMin: Cijk_Ailk_Bjlk_BBS_BH_UserArgs_MT64x32x128_MI16x16x1_SN_LDSB1_CLR1_GRVWA8_GRVWB8_GSU0_GSUC0_GSUWGMRR0_K1_LBSPPA512_LBSPPB256_LPA32_LPB16_MIWT2_1_NLCA1_NLCB1_PLR2_SU4_SUM1_SUS256_SVW2_SK1_ULSGRO0_VWA2_VWB1_WG32_8_1_WGM1_WGMXCC1_WGMXCCG304
    SolutionIndex: 186
    SolutionNameMin: Cijk_Ailk_Bjlk_BBS_BH_UserArgs_MT64x64x128_MI16x16x1_SN_LDSB1_CLR1_GRVWA8_GRVWB8_GSU0_GSUC0_GSUWGMRR0_K1_LBSPPA512_LBSPPB512_LPA32_LPB32_MIWT2_2_NLCA1_NLCB1_PLR2_SU4_SUM1_SUS256_SVW2_SK1_ULSGRO0_VWA2_VWB2_WG32_8_1_WGM1_WGMXCC1_WGMXCCG304
    SolutionIndex: 187
    SolutionNameMin: Cijk_Ailk_Bjlk_BBS_BH_UserArgs_MT128x64x128_MI16x16x1_SN_LDSB1_CLR1_GRVWA8_GRVWB8_GSU0_GSUC0_GSUWGMRR0_K1_LBSPPA1024_LBSPPB512_LPA0_LPB32_MIWT4_2_NLCA1_NLCB1_PLR2_SU4_SUM1_SUS256_SVW4_SK1_ULSGRO1_VWA4_VWB2_WG32_8_1_WGM8_WGMXCC16_WGMXCCG304
    SolutionIndex: 188
    SolutionNameMin: Cijk_Ailk_Bjlk_BBS_BH_UserArgs_MT128x64x32_MI16x16x1_SN_LDSB0_CLR1_GRVWA8_GRVWB8_GSU0_GSUC0_GSUWGMRR0_K1_LBSPPA1024_LBSPPB512_LPA0_LPB32_MIWT4_2_NLCA1_NLCB1_PLR1_SU4_SUM0_SUS64_SVW4_SK1_ULSGRO1_VWA4_VWB2_WG32_8_1_WGM1_WGMXCC1_WGMXCCG304
    SolutionIndex: 189
    SolutionNameMin: Cijk_Ailk_Bjlk_BBS_BH_UserArgs_MT128x128x64_MI16x16x1_SN_LDSB1_CLR1_GRVWA8_GRVWB8_GSU0_GSUC0_GSUWGMRR0_K1_LBSPPA1024_LBSPPB1024_LPA0_LPB0_MIWT4_4_NLCA1_NLCB1_PLR1_SU0_SUM0_SUS0_SVW4_SK1_ULSGRO1_VWA4_VWB4_WG32_8_1_WGM1_WGMXCC1_WGMXCCG304
    SolutionIndex: 190
    SolutionNameMin: Cijk_Ailk_Bjlk_BBS_BH_UserArgs_MT64x64x64_MI16x16x1_SN_LDSB1_CLR1_GRVWA8_GRVWB8_GSU0_GSUC0_GSUWGMRR0_K1_LBSPPA512_LBSPPB512_LPA32_LPB32_MIWT2_2_NLCA1_NLCB1_PLR2_SU4_SUM1_SUS128_SVW2_SK1_ULSGRO0_VWA2_VWB2_WG32_8_1_WGM1_WGMXCC1_WGMXCCG304
    SolutionIndex: 191
    SolutionNameMin: Cijk_Ailk_Bjlk_BBS_BH_UserArgs_MT64x64x128_MI16x16x1_SN_LDSB1_CLR1_GRVWA8_GRVWB8_GSU0_GSUC0_GSUWGMRR0_K1_LBSPPA512_LBSPPB512_LPA32_LPB32_MIWT2_2_NLCA1_NLCB1_PLR2_SU4_SUM0_SUS256_SVW2_SK1_ULSGRO1_VWA2_VWB2_WG32_8_1_WGM1_WGMXCC1_WGMXCCG304
    SolutionIndex: 192
    SolutionNameMin: Cijk_Ailk_Bjlk_BBS_BH_UserArgs_MT64x128x128_MI16x16x1_SN_LDSB1_CLR1_GRVWA8_GRVWB8_GSU0_GSUC0_GSUWGMRR0_K1_LBSPPA512_LBSPPB1024_LPA32_LPB0_MIWT2_4_NLCA1_NLCB1_PLR2_SU4_SUM0_SUS256_SVW2_SK1_ULSGRO1_VWA2_VWB4_WG32_8_1_WGM6_WGMXCC1_WGMXCCG304
    SolutionIndex: 193
    SolutionNameMin: Cijk_Ailk_Bjlk_BBS_BH_UserArgs_MT128x128x128_MI16x16x1_SN_LDSB1_CLR1_GRVWA8_GRVWB8_GSU0_GSUC0_GSUWGMRR0_K1_LBSPPA1024_LBSPPB1024_LPA0_LPB0_MIWT4_4_NLCA1_NLCB1_PLR1_SU4_SUM0_SUS256_SVW4_SK1_ULSGRO1_VWA4_VWB4_WG32_8_1_WGM8_WGMXCC16_WGMXCCG304
    SolutionIndex: 194
    SolutionNameMin: Cijk_Ailk_Bjlk_BBS_BH_UserArgs_MT128x128x64_MI16x16x1_SN_LDSB1_CLR1_GRVWA8_GRVWB8_GSU0_GSUC0_GSUWGMRR0_K1_LBSPPA1024_LBSPPB1024_LPA0_LPB0_MIWT4_4_NLCA1_NLCB1_PLR1_SU4_SUM1_SUS128_SVW4_SK1_ULSGRO1_VWA4_VWB4_WG32_8_1_WGM1_WGMXCC1_WGMXCCG304
    SolutionIndex: 195
    SolutionNameMin: Cijk_Ailk_Bjlk_BBS_BH_UserArgs_MT64x128x32_MI16x16x1_SN_LDSB0_CLR1_GRVWA8_GRVWB8_GSU0_GSUC0_GSUWGMRR0_K1_LBSPPA512_LBSPPB1024_LPA32_LPB0_MIWT2_4_NLCA1_NLCB1_PLR1_SU4_SUM1_SUS64_SVW2_SK1_ULSGRO0_VWA2_VWB4_WG32_8_1_WGM1_WGMXCC1_WGMXCCG304
    SolutionIndex: 196
    SolutionNameMin: Cijk_Ailk_Bjlk_BBS_BH_UserArgs_MT64x128x128_MI16x16x1_SN_LDSB1_CLR1_GRVWA8_GRVWB8_GSU0_GSUC0_GSUWGMRR0_K1_LBSPPA512_LBSPPB1024_LPA32_LPB0_MIWT2_4_NLCA1_NLCB1_PLR2_SU4_SUM1_SUS256_SVW2_SK1_ULSGRO1_VWA2_VWB4_WG32_8_1_WGM1_WGMXCC1_WGMXCCG304
    SolutionIndex: 197
    SolutionNameMin: Cijk_Ailk_Bjlk_BBS_BH_UserArgs_MT128x128x128_MI16x16x1_SN_LDSB1_CLR1_GRVWA8_GRVWB8_GSU0_GSUC0_GSUWGMRR0_K1_LBSPPA1024_LBSPPB1024_LPA0_LPB0_MIWT4_4_NLCA1_NLCB1_PLR1_SU0_SUM0_SUS0_SVW4_SK1_ULSGRO1_VWA4_VWB4_WG32_8_1_WGM6_WGMXCC16_WGMXCCG304
    SolutionIndex: 198
    SolutionNameMin: Cijk_Ailk_Bjlk_BBS_BH_UserArgs_MT128x128x64_MI16x16x1_SN_LDSB1_CLR1_GRVWA8_GRVWB8_GSU0_GSUC0_GSUWGMRR0_K1_LBSPPA1024_LBSPPB1024_LPA0_LPB0_MIWT4_4_NLCA1_NLCB1_PLR1_SU4_SUM0_SUS128_SVW4_SK3_ULSGRO0_VWA4_VWB4_WG32_8_1_WGM1_WGMXCC16_WGMXCCG304
    SolutionIndex: 199
    SolutionNameMin: Cijk_Ailk_Bjlk_BBS_BH_UserArgs_MT128x256x32_MI16x16x1_SN_LDSB1_CLR1_GRVWA8_GRVWB8_GSU0_GSUC0_GSUWGMRR0_K1_LBSPPA1024_LBSPPB2048_LPA0_LPB0_MIWT4_8_NLCA1_NLCB1_PLR1_SU0_SUM0_SUS0_SVW4_SK1_ULSGRO0_VWA4_VWB8_WG32_8_1_WGM1_WGMXCC8_WGMXCCG304
    SolutionIndex: 200
    SolutionNameMin: Cijk_Ailk_Bjlk_BBS_BH_UserArgs_MT128x128x32_MI16x16x1_SN_LDSB0_CLR1_GRVWA8_GRVWB8_GSU0_GSUC0_GSUWGMRR0_K1_LBSPPA1024_LBSPPB1024_LPA0_LPB0_MIWT4_4_NLCA1_NLCB1_PLR1_SU4_SUM0_SUS64_SVW4_SK1_ULSGRO0_VWA4_VWB4_WG32_8_1_WGM4_WGMXCC1_WGMXCCG304
    SolutionIndex: 201
    SolutionNameMin: Cijk_Ailk_Bjlk_BBS_BH_UserArgs_MT128x128x64_MI16x16x1_SN_LDSB1_CLR1_GRVWA8_GRVWB8_GSU0_GSUC0_GSUWGMRR0_K1_LBSPPA1024_LBSPPB1024_LPA0_LPB0_MIWT4_4_NLCA1_NLCB1_PLR1_SU0_SUM0_SUS0_SVW4_SK3_ULSGRO0_VWA4_VWB4_WG32_8_1_WGM4_WGMXCC16_WGMXCCG304
    SolutionIndex: 202
    SolutionNameMin: Cijk_Ailk_Bjlk_BBS_BH_UserArgs_MT128x128x64_MI16x16x1_SN_LDSB1_CLR1_GRVWA8_GRVWB8_GSU0_GSUC0_GSUWGMRR0_K1_LBSPPA1024_LBSPPB1024_LPA0_LPB0_MIWT4_4_NLCA1_NLCB1_PLR1_SU4_SUM1_SUS128_SVW4_SK1_ULSGRO1_VWA4_VWB4_WG32_8_1_WGM8_WGMXCC8_WGMXCCG304
    SolutionIndex: 203
    SolutionNameMin: Cijk_Ailk_Bjlk_BBS_BH_UserArgs_MT128x256x32_MI16x16x1_SN_LDSB1_CLR1_GRVWA8_GRVWB8_GSU0_GSUC0_GSUWGMRR0_K1_LBSPPA1024_LBSPPB2048_LPA0_LPB0_MIWT4_8_NLCA1_NLCB1_PLR1_SU0_SUM0_SUS0_SVW4_SK3_ULSGRO0_VWA4_VWB8_WG32_8_1_WGM6_WGMXCC8_WGMXCCG304
    SolutionIndex: 204
    SolutionNameMin: Cijk_Ailk_Bjlk_BBS_BH_UserArgs_MT128x256x32_MI16x16x1_SN_LDSB1_CLR1_GRVWA8_GRVWB8_GSU0_GSUC0_GSUWGMRR0_K1_LBSPPA1024_LBSPPB2048_LPA0_LPB0_MIWT4_8_NLCA1_NLCB1_PLR1_SU0_SUM0_SUS0_SVW4_SK1_ULSGRO0_VWA4_VWB8_WG32_8_1_WGM8_WGMXCC8_WGMXCCG304
    SolutionIndex: 205
    SolutionNameMin: Cijk_Ailk_Bjlk_BBS_BH_UserArgs_MT256x128x32_MI16x16x1_SN_LDSB1_CLR1_GRVWA8_GRVWB8_GSU0_GSUC0_GSUWGMRR0_K1_LBSPPA2048_LBSPPB1024_LPA0_LPB0_MIWT8_4_NLCA1_NLCB1_PLR1_SU0_SUM0_SUS0_SVW8_SK1_ULSGRO0_VWA8_VWB4_WG32_8_1_WGM1_WGMXCC1_WGMXCCG304
    SolutionIndex: 206
    SolutionNameMin: Cijk_Ailk_Bjlk_BBS_BH_UserArgs_MT128x256x64_MI16x16x1_SN_LDSB1_CLR1_GRVWA8_GRVWB8_GSU0_GSUC0_GSUWGMRR0_K1_LBSPPA1024_LBSPPB2048_LPA0_LPB0_MIWT4_8_NLCA1_NLCB1_PLR1_SU4_SUM1_SUS128_SVW4_SK1_ULSGRO1_VWA4_VWB8_WG32_8_1_WGM4_WGMXCC1_WGMXCCG304
    SolutionIndex: 207
    SolutionNameMin: Cijk_Ailk_Bjlk_BBS_BH_UserArgs_MT128x128x64_MI16x16x1_SN_LDSB1_CLR1_GRVWA8_GRVWB8_GSU0_GSUC0_GSUWGMRR0_K1_LBSPPA1024_LBSPPB1024_LPA0_LPB0_MIWT4_4_NLCA1_NLCB1_PLR1_SU4_SUM0_SUS128_SVW4_SK1_ULSGRO0_VWA4_VWB4_WG32_8_1_WGM6_WGMXCC8_WGMXCCG304
    SolutionIndex: 208
    SolutionNameMin: Cijk_Ailk_Bjlk_BBS_BH_UserArgs_MT128x128x64_MI16x16x1_SN_LDSB1_CLR1_GRVWA8_GRVWB8_GSU0_GSUC0_GSUWGMRR0_K1_LBSPPA1024_LBSPPB1024_LPA0_LPB0_MIWT4_4_NLCA1_NLCB1_PLR1_SU4_SUM1_SUS128_SVW4_SK3_ULSGRO1_VWA4_VWB4_WG32_8_1_WGM8_WGMXCC8_WGMXCCG304
    SolutionIndex: 209
    SolutionNameMin: Cijk_Ailk_Bjlk_BBS_BH_UserArgs_MT128x256x32_MI16x16x1_SN_LDSB1_CLR1_GRVWA8_GRVWB8_GSU0_GSUC0_GSUWGMRR0_K1_LBSPPA1024_LBSPPB2048_LPA0_LPB0_MIWT4_8_NLCA1_NLCB1_PLR1_SU0_SUM0_SUS0_SVW4_SK3_ULSGRO1_VWA4_VWB8_WG32_8_1_WGM6_WGMXCC1_WGMXCCG304
    SolutionIndex: 210
    SolutionNameMin: Cijk_Ailk_Bjlk_BBS_BH_UserArgs_MT128x256x32_MI16x16x1_SN_LDSB1_CLR1_GRVWA8_GRVWB8_GSU0_GSUC0_GSUWGMRR0_K1_LBSPPA1024_LBSPPB2048_LPA0_LPB0_MIWT4_8_NLCA1_NLCB1_PLR1_SU0_SUM0_SUS0_SVW4_SK1_ULSGRO0_VWA4_VWB8_WG32_8_1_WGM6_WGMXCC1_WGMXCCG304
    SolutionIndex: 211
    SolutionNameMin: Cijk_Ailk_Bjlk_BBS_BH_UserArgs_MT256x256x32_MI16x16x1_SN_LDSB0_CLR1_GRVWA8_GRVWB8_GSU0_GSUC0_GSUWGMRR0_K1_LBSPPA2048_LBSPPB2048_LPA0_LPB0_MIWT8_8_NLCA1_NLCB1_PLR1_SU4_SUM0_SUS64_SVW8_SK1_ULSGRO1_VWA8_VWB8_WG32_8_1_WGM4_WGMXCC1_WGMXCCG304
    SolutionIndex: 212
    SolutionNameMin: Cijk_Ailk_Bjlk_BBS_BH_UserArgs_MT256x256x64_MI16x16x1_SN_LDSB1_CLR1_GRVWA8_GRVWB8_GSU0_GSUC0_GSUWGMRR0_K1_LBSPPA2048_LBSPPB2048_LPA0_LPB0_MIWT8_8_NLCA1_NLCB1_PLR2_SU4_SUM1_SUS128_SVW8_SK1_ULSGRO0_VWA8_VWB8_WG32_8_1_WGM4_WGMXCC1_WGMXCCG304
    SolutionIndex: 213
    SolutionNameMin: Cijk_Ailk_Bjlk_BBS_BH_UserArgs_MT128x256x32_MI16x16x1_SN_LDSB1_CLR1_GRVWA8_GRVWB8_GSU0_GSUC0_GSUWGMRR0_K1_LBSPPA1024_LBSPPB2048_LPA0_LPB0_MIWT4_8_NLCA1_NLCB1_PLR1_SU0_SUM0_SUS0_SVW4_SK3_ULSGRO1_VWA4_VWB8_WG32_8_1_WGM8_WGMXCC8_WGMXCCG304
    SolutionIndex: 214
    SolutionNameMin: Cijk_Ailk_Bjlk_BBS_BH_UserArgs_MT128x256x64_MI16x16x1_SN_LDSB1_CLR1_GRVWA8_GRVWB8_GSU0_GSUC0_GSUWGMRR0_K1_LBSPPA1024_LBSPPB2048_LPA0_LPB0_MIWT4_8_NLCA1_NLCB1_PLR1_SU0_SUM0_SUS0_SVW4_SK1_ULSGRO1_VWA4_VWB8_WG32_8_1_WGM1_WGMXCC8_WGMXCCG304
    SolutionIndex: 215
    SolutionNameMin: Cijk_Ailk_Bjlk_BBS_BH_UserArgs_MT128x256x32_MI16x16x1_SN_LDSB1_CLR1_GRVWA8_GRVWB8_GSU0_GSUC0_GSUWGMRR0_K1_LBSPPA1024_LBSPPB2048_LPA0_LPB0_MIWT4_8_NLCA1_NLCB1_PLR1_SU0_SUM0_SUS0_SVW4_SK3_ULSGRO0_VWA4_VWB8_WG32_8_1_WGM6_WGMXCC1_WGMXCCG304
    SolutionIndex: 216
    SolutionNameMin: Cijk_Ailk_Bjlk_BBS_BH_UserArgs_MT128x256x32_MI16x16x1_SN_LDSB1_CLR1_GRVWA8_GRVWB8_GSU0_GSUC0_GSUWGMRR0_K1_LBSPPA1024_LBSPPB2048_LPA0_LPB0_MIWT4_8_NLCA1_NLCB1_PLR1_SU0_SUM0_SUS0_SVW4_SK1_ULSGRO1_VWA4_VWB8_WG32_8_1_WGM6_WGMXCC1_WGMXCCG304
    SolutionIndex: 217
    SolutionNameMin: Cijk_Ailk_Bjlk_BBS_BH_UserArgs_MT256x256x64_MI16x16x1_SN_LDSB1_CLR1_GRVWA8_GRVWB8_GSU0_GSUC0_GSUWGMRR0_K1_LBSPPA2048_LBSPPB2048_LPA0_LPB0_MIWT8_8_NLCA1_NLCB1_PLR2_SU4_SUM1_SUS128_SVW8_SK1_ULSGRO1_VWA8_VWB8_WG32_8_1_WGM6_WGMXCC1_WGMXCCG304
    SolutionIndex: 218
    SolutionNameMin: Cijk_Ailk_Bjlk_BBS_BH_UserArgs_MT256x144x32_MI16x16x1_SN_LDSB0_CLR1_GRVWA8_GRVWB2_GSU0_GSUC0_GSUWGMRR0_K1_LBSPPA2048_LBSPPB1152_LPA0_LPB16_MIWT4_9_NLCA1_NLCB9_PLR1_SU0_SUM0_SUS0_SVW4_SK1_ULSGRO0_VWA4_VWB1_WG64_4_1_WGM1_WGMXCC16_WGMXCCG304
    SolutionIndex: 219
    SolutionNameMin: Cijk_Ailk_Bjlk_BBS_BH_UserArgs_MT256x144x32_MI16x16x1_SN_LDSB0_CLR1_GRVWA8_GRVWB2_GSU0_GSUC0_GSUWGMRR0_K1_LBSPPA2048_LBSPPB1152_LPA0_LPB16_MIWT4_9_NLCA1_NLCB9_PLR1_SU0_SUM0_SUS0_SVW4_SK3_ULSGRO0_VWA4_VWB1_WG64_4_1_WGM6_WGMXCC8_WGMXCCG304
    SolutionIndex: 220
    SolutionNameMin: Cijk_Ailk_Bjlk_BBS_BH_UserArgs_MT128x256x32_MI16x16x1_SN_LDSB1_CLR1_GRVWA8_GRVWB8_GSU0_GSUC0_GSUWGMRR0_K1_LBSPPA1024_LBSPPB2048_LPA0_LPB0_MIWT4_8_NLCA1_NLCB1_PLR1_SU4_SUM1_SUS64_SVW4_SK1_ULSGRO0_VWA4_VWB8_WG32_8_1_WGM6_WGMXCC1_WGMXCCG304
    SolutionIndex: 221
    SolutionNameMin: Cijk_Ailk_Bjlk_BBS_BH_UserArgs_MT128x256x32_MI16x16x1_SN_LDSB1_CLR1_GRVWA8_GRVWB8_GSU0_GSUC0_GSUWGMRR0_K1_LBSPPA1024_LBSPPB2048_LPA0_LPB0_MIWT4_8_NLCA1_NLCB1_PLR1_SU4_SUM1_SUS64_SVW4_SK1_ULSGRO1_VWA4_VWB8_WG32_8_1_WGM6_WGMXCC1_WGMXCCG304
    SolutionIndex: 222
    SolutionNameMin: Cijk_Ailk_Bjlk_BBS_BH_UserArgs_MT256x256x32_MI16x16x1_SN_LDSB0_CLR1_GRVWA8_GRVWB8_GSU0_GSUC0_GSUWGMRR0_K1_LBSPPA2048_LBSPPB2048_LPA0_LPB0_MIWT8_8_NLCA1_NLCB1_PLR1_SU0_SUM0_SUS0_SVW8_SK1_ULSGRO1_VWA8_VWB8_WG32_8_1_WGM6_WGMXCC1_WGMXCCG304
    SolutionIndex: 223
    SolutionNameMin: Cijk_Ailk_Bjlk_BBS_BH_UserArgs_MT64x64x64_MI16x16x1_SN_LDSB1_CLR1_GRVWA8_GRVWB8_GSU0_GSUC0_GSUWGMRR0_K1_LBSPPA512_LBSPPB512_LPA32_LPB32_MIWT2_2_NLCA1_NLCB1_PLR1_SU4_SUM1_SUS128_SVW2_SK1_ULSGRO0_VWA2_VWB2_WG32_8_1_WGM1_WGMXCC1_WGMXCCG304
    SolutionIndex: 224
    SolutionNameMin: Cijk_Ailk_Bjlk_BBS_BH_UserArgs_MT64x64x64_MI16x16x1_SN_LDSB1_CLR1_GRVWA8_GRVWB8_GSU0_GSUC0_GSUWGMRR0_K1_LBSPPA512_LBSPPB512_LPA32_LPB32_MIWT2_2_NLCA1_NLCB1_PLR2_SU4_SUM1_SUS128_SVW2_SK1_ULSGRO1_VWA2_VWB2_WG32_8_1_WGM1_WGMXCC1_WGMXCCG304
    SolutionIndex: 225
    SolutionNameMin: Cijk_Ailk_Bjlk_BBS_BH_UserArgs_MT128x64x128_MI16x16x1_SN_LDSB1_CLR1_GRVWA8_GRVWB8_GSU0_GSUC0_GSUWGMRR0_K1_LBSPPA1024_LBSPPB512_LPA0_LPB32_MIWT4_2_NLCA1_NLCB1_PLR2_SU4_SUM0_SUS256_SVW4_SK1_ULSGRO1_VWA4_VWB2_WG32_8_1_WGM4_WGMXCC16_WGMXCCG304
    SolutionIndex: 226
    SolutionNameMin: Cijk_Ailk_Bjlk_BBS_BH_UserArgs_MT128x128x128_MI16x16x1_SN_LDSB1_CLR1_GRVWA8_GRVWB8_GSU0_GSUC0_GSUWGMRR0_K1_LBSPPA1024_LBSPPB1024_LPA0_LPB0_MIWT4_4_NLCA1_NLCB1_PLR1_SU0_SUM0_SUS0_SVW4_SK1_ULSGRO1_VWA4_VWB4_WG32_8_1_WGM1_WGMXCC16_WGMXCCG304
    SolutionIndex: 227
    SolutionNameMin: Cijk_Ailk_Bjlk_BBS_BH_UserArgs_MT128x128x64_MI16x16x1_SN_LDSB1_CLR1_GRVWA8_GRVWB8_GSU0_GSUC0_GSUWGMRR0_K1_LBSPPA1024_LBSPPB1024_LPA0_LPB0_MIWT4_4_NLCA1_NLCB1_PLR1_SU4_SUM0_SUS128_SVW4_SK3_ULSGRO1_VWA4_VWB4_WG32_8_1_WGM1_WGMXCC1_WGMXCCG304
    SolutionIndex: 228
    SolutionNameMin: Cijk_Ailk_Bjlk_BBS_BH_UserArgs_MT128x128x128_MI16x16x1_SN_LDSB1_CLR1_GRVWA8_GRVWB8_GSU0_GSUC0_GSUWGMRR0_K1_LBSPPA1024_LBSPPB1024_LPA0_LPB0_MIWT4_4_NLCA1_NLCB1_PLR1_SU0_SUM0_SUS0_SVW4_SK1_ULSGRO1_VWA4_VWB4_WG32_8_1_WGM4_WGMXCC8_WGMXCCG304
    SolutionIndex: 229
    SolutionNameMin: Cijk_Ailk_Bjlk_BBS_BH_UserArgs_MT128x256x32_MI16x16x1_SN_LDSB1_CLR1_GRVWA8_GRVWB8_GSU0_GSUC0_GSUWGMRR0_K1_LBSPPA1024_LBSPPB2048_LPA0_LPB0_MIWT4_8_NLCA1_NLCB1_PLR1_SU4_SUM1_SUS64_SVW4_SK1_ULSGRO1_VWA4_VWB8_WG32_8_1_WGM1_WGMXCC16_WGMXCCG304
    SolutionIndex: 230
    SolutionNameMin: Cijk_Ailk_Bjlk_BBS_BH_UserArgs_MT128x128x32_MI16x16x1_SN_LDSB0_CLR1_GRVWA8_GRVWB8_GSU0_GSUC0_GSUWGMRR0_K1_LBSPPA1024_LBSPPB1024_LPA0_LPB0_MIWT4_4_NLCA1_NLCB1_PLR1_SU4_SUM0_SUS64_SVW4_SK1_ULSGRO1_VWA4_VWB4_WG32_8_1_WGM4_WGMXCC1_WGMXCCG304
    SolutionIndex: 231
    SolutionNameMin: Cijk_Ailk_Bjlk_BBS_BH_UserArgs_MT128x128x64_MI16x16x1_SN_LDSB1_CLR1_GRVWA8_GRVWB8_GSU0_GSUC0_GSUWGMRR0_K1_LBSPPA1024_LBSPPB1024_LPA0_LPB0_MIWT4_4_NLCA1_NLCB1_PLR1_SU0_SUM0_SUS0_SVW4_SK1_ULSGRO1_VWA4_VWB4_WG32_8_1_WGM6_WGMXCC8_WGMXCCG304
    SolutionIndex: 232
    SolutionNameMin: Cijk_Ailk_Bjlk_BBS_BH_UserArgs_MT128x128x64_MI16x16x1_SN_LDSB1_CLR1_GRVWA8_GRVWB8_GSU0_GSUC0_GSUWGMRR0_K1_LBSPPA1024_LBSPPB1024_LPA0_LPB0_MIWT4_4_NLCA1_NLCB1_PLR1_SU4_SUM1_SUS128_SVW4_SK1_ULSGRO1_VWA4_VWB4_WG32_8_1_WGM4_WGMXCC8_WGMXCCG304
    SolutionIndex: 233
    SolutionNameMin: Cijk_Ailk_Bjlk_BBS_BH_UserArgs_MT128x128x128_MI16x16x1_SN_LDSB1_CLR1_GRVWA8_GRVWB8_GSU0_GSUC0_GSUWGMRR0_K1_LBSPPA1024_LBSPPB1024_LPA0_LPB0_MIWT4_4_NLCA1_NLCB1_PLR2_SU0_SUM0_SUS0_SVW4_SK3_ULSGRO1_VWA4_VWB4_WG32_8_1_WGM1_WGMXCC16_WGMXCCG304
    SolutionIndex: 234
    SolutionNameMin: Cijk_Ailk_Bjlk_BBS_BH_UserArgs_MT128x256x32_MI16x16x1_SN_LDSB1_CLR1_GRVWA8_GRVWB8_GSU0_GSUC0_GSUWGMRR0_K1_LBSPPA1024_LBSPPB2048_LPA0_LPB0_MIWT4_8_NLCA1_NLCB1_PLR1_SU4_SUM0_SUS64_SVW4_SK1_ULSGRO1_VWA4_VWB8_WG32_8_1_WGM6_WGMXCC16_WGMXCCG304
    SolutionIndex: 235
    SolutionNameMin: Cijk_Ailk_Bjlk_BBS_BH_UserArgs_MT128x256x32_MI16x16x1_SN_LDSB1_CLR1_GRVWA8_GRVWB8_GSU0_GSUC0_GSUWGMRR0_K1_LBSPPA1024_LBSPPB2048_LPA0_LPB0_MIWT4_8_NLCA1_NLCB1_PLR1_SU4_SUM0_SUS64_SVW4_SK1_ULSGRO1_VWA4_VWB8_WG32_8_1_WGM1_WGMXCC1_WGMXCCG304
    SolutionIndex: 236
    SolutionNameMin: Cijk_Ailk_Bjlk_BBS_BH_UserArgs_MT256x128x32_MI16x16x1_SN_LDSB1_CLR1_GRVWA8_GRVWB8_GSU0_GSUC0_GSUWGMRR0_K1_LBSPPA2048_LBSPPB1024_LPA0_LPB0_MIWT8_4_NLCA1_NLCB1_PLR1_SU4_SUM0_SUS64_SVW8_SK1_ULSGRO1_VWA8_VWB4_WG32_8_1_WGM4_WGMXCC1_WGMXCCG304
    SolutionIndex: 237
    SolutionNameMin: Cijk_Ailk_Bjlk_BBS_BH_UserArgs_MT256x128x64_MI16x16x1_SN_LDSB1_CLR1_GRVWA8_GRVWB8_GSU0_GSUC0_GSUWGMRR0_K1_LBSPPA2048_LBSPPB1024_LPA0_LPB0_MIWT8_4_NLCA1_NLCB1_PLR2_SU0_SUM0_SUS0_SVW8_SK1_ULSGRO0_VWA8_VWB4_WG32_8_1_WGM1_WGMXCC1_WGMXCCG304
    SolutionIndex: 238
    SolutionNameMin: Cijk_Ailk_Bjlk_BBS_BH_UserArgs_MT128x128x64_MI16x16x1_SN_LDSB1_CLR1_GRVWA8_GRVWB8_GSU0_GSUC0_GSUWGMRR0_K1_LBSPPA1024_LBSPPB1024_LPA0_LPB0_MIWT4_4_NLCA1_NLCB1_PLR1_SU0_SUM0_SUS0_SVW4_SK1_ULSGRO0_VWA4_VWB4_WG32_8_1_WGM8_WGMXCC8_WGMXCCG304
    SolutionIndex: 239
    SolutionNameMin: Cijk_Ailk_Bjlk_BBS_BH_UserArgs_MT128x256x64_MI16x16x1_SN_LDSB1_CLR1_GRVWA8_GRVWB8_GSU0_GSUC0_GSUWGMRR0_K1_LBSPPA1024_LBSPPB2048_LPA0_LPB0_MIWT4_8_NLCA1_NLCB1_PLR2_SU4_SUM1_SUS128_SVW4_SK3_ULSGRO1_VWA4_VWB8_WG32_8_1_WGM1_WGMXCC8_WGMXCCG304
    SolutionIndex: 240
    SolutionNameMin: Cijk_Ailk_Bjlk_BBS_BH_UserArgs_MT256x256x32_MI16x16x1_SN_LDSB0_CLR1_GRVWA8_GRVWB8_GSU0_GSUC0_GSUWGMRR0_K1_LBSPPA2048_LBSPPB2048_LPA0_LPB0_MIWT8_8_NLCA1_NLCB1_PLR1_SU4_SUM1_SUS64_SVW8_SK1_ULSGRO0_VWA8_VWB8_WG32_8_1_WGM4_WGMXCC1_WGMXCCG304
    SolutionIndex: 241
    SolutionNameMin: Cijk_Ailk_Bjlk_BBS_BH_UserArgs_MT128x256x32_MI16x16x1_SN_LDSB1_CLR1_GRVWA8_GRVWB8_GSU0_GSUC0_GSUWGMRR0_K1_LBSPPA1024_LBSPPB2048_LPA0_LPB0_MIWT4_8_NLCA1_NLCB1_PLR1_SU4_SUM1_SUS64_SVW4_SK1_ULSGRO1_VWA4_VWB8_WG32_8_1_WGM4_WGMXCC8_WGMXCCG304
    SolutionIndex: 242
    SolutionNameMin: Cijk_Ailk_Bjlk_BBS_BH_UserArgs_MT128x256x32_MI16x16x1_SN_LDSB1_CLR1_GRVWA8_GRVWB8_GSU0_GSUC0_GSUWGMRR0_K1_LBSPPA1024_LBSPPB2048_LPA0_LPB0_MIWT4_8_NLCA1_NLCB1_PLR1_SU0_SUM0_SUS0_SVW4_SK1_ULSGRO1_VWA4_VWB8_WG32_8_1_WGM1_WGMXCC8_WGMXCCG304
    SolutionIndex: 243
    SolutionNameMin: Cijk_Ailk_Bjlk_BBS_BH_UserArgs_MT256x256x32_MI16x16x1_SN_LDSB0_CLR1_GRVWA8_GRVWB8_GSU0_GSUC0_GSUWGMRR0_K1_LBSPPA2048_LBSPPB2048_LPA0_LPB0_MIWT8_8_NLCA1_NLCB1_PLR1_SU4_SUM0_SUS64_SVW8_SK1_ULSGRO1_VWA8_VWB8_WG32_8_1_WGM6_WGMXCC1_WGMXCCG304
    SolutionIndex: 244
    SolutionNameMin: Cijk_Ailk_Bjlk_BBS_BH_UserArgs_MT256x256x64_MI16x16x1_SN_LDSB1_CLR1_GRVWA8_GRVWB8_GSU0_GSUC0_GSUWGMRR0_K1_LBSPPA2048_LBSPPB2048_LPA0_LPB0_MIWT8_8_NLCA1_NLCB1_PLR2_SU4_SUM1_SUS128_SVW8_SK1_ULSGRO1_VWA8_VWB8_WG32_8_1_WGM1_WGMXCC1_WGMXCCG304
    SolutionIndex: 245
    SolutionNameMin: Cijk_Ailk_Bjlk_BBS_BH_UserArgs_MT128x256x64_MI16x16x1_SN_LDSB1_CLR1_GRVWA8_GRVWB8_GSU0_GSUC0_GSUWGMRR0_K1_LBSPPA1024_LBSPPB2048_LPA0_LPB0_MIWT4_8_NLCA1_NLCB1_PLR1_SU4_SUM1_SUS128_SVW4_SK1_ULSGRO0_VWA4_VWB8_WG32_8_1_WGM1_WGMXCC16_WGMXCCG304
    SolutionIndex: 246
    SolutionNameMin: Cijk_Ailk_Bjlk_BBS_BH_UserArgs_MT128x256x32_MI16x16x1_SN_LDSB1_CLR1_GRVWA8_GRVWB8_GSU0_GSUC0_GSUWGMRR0_K1_LBSPPA1024_LBSPPB2048_LPA0_LPB0_MIWT4_8_NLCA1_NLCB1_PLR1_SU4_SUM0_SUS64_SVW4_SK1_ULSGRO1_VWA4_VWB8_WG32_8_1_WGM1_WGMXCC8_WGMXCCG304
    SolutionIndex: 247
    SolutionNameMin: Cijk_Ailk_Bjlk_BBS_BH_UserArgs_MT128x256x32_MI16x16x1_SN_LDSB1_CLR1_GRVWA8_GRVWB8_GSU0_GSUC0_GSUWGMRR0_K1_LBSPPA1024_LBSPPB2048_LPA0_LPB0_MIWT4_8_NLCA1_NLCB1_PLR1_SU4_SUM1_SUS64_SVW4_SK1_ULSGRO1_VWA4_VWB8_WG32_8_1_WGM1_WGMXCC8_WGMXCCG304
    SolutionIndex: 248
    SolutionNameMin: Cijk_Ailk_Bjlk_BBS_BH_UserArgs_MT128x256x64_MI16x16x1_SN_LDSB1_CLR1_GRVWA8_GRVWB8_GSU0_GSUC0_GSUWGMRR0_K1_LBSPPA1024_LBSPPB2048_LPA0_LPB0_MIWT4_8_NLCA1_NLCB1_PLR1_SU0_SUM0_SUS0_SVW4_SK3_ULSGRO0_VWA4_VWB8_WG32_8_1_WGM1_WGMXCC1_WGMXCCG304
    SolutionIndex: 249
    SolutionNameMin: Cijk_Ailk_Bjlk_BBS_BH_UserArgs_MT256x128x64_MI16x16x1_SN_LDSB1_CLR1_GRVWA8_GRVWB8_GSU0_GSUC0_GSUWGMRR0_K1_LBSPPA2048_LBSPPB1024_LPA0_LPB0_MIWT8_4_NLCA1_NLCB1_PLR1_SU0_SUM0_SUS0_SVW8_SK1_ULSGRO1_VWA8_VWB4_WG32_8_1_WGM6_WGMXCC8_WGMXCCG304
    SolutionIndex: 250
    SolutionNameMin: Cijk_Ailk_Bjlk_BBS_BH_UserArgs_MT128x256x32_MI16x16x1_SN_LDSB1_CLR1_GRVWA8_GRVWB8_GSU0_GSUC0_GSUWGMRR0_K1_LBSPPA1024_LBSPPB2048_LPA0_LPB0_MIWT4_8_NLCA1_NLCB1_PLR1_SU4_SUM1_SUS64_SVW4_SK1_ULSGRO0_VWA4_VWB8_WG32_8_1_WGM1_WGMXCC8_WGMXCCG304
    SolutionIndex: 251
    SolutionNameMin: Cijk_Ailk_Bjlk_BBS_BH_UserArgs_MT128x256x32_MI16x16x1_SN_LDSB1_CLR1_GRVWA8_GRVWB8_GSU0_GSUC0_GSUWGMRR0_K1_LBSPPA1024_LBSPPB2048_LPA0_LPB0_MIWT4_8_NLCA1_NLCB1_PLR1_SU4_SUM1_SUS64_SVW4_SK3_ULSGRO1_VWA4_VWB8_WG32_8_1_WGM4_WGMXCC8_WGMXCCG304
    SolutionIndex: 252
    SolutionNameMin: Cijk_Ailk_Bjlk_BBS_BH_UserArgs_MT256x256x64_MI16x16x1_SN_LDSB1_CLR1_GRVWA8_GRVWB8_GSU0_GSUC0_GSUWGMRR0_K1_LBSPPA2048_LBSPPB2048_LPA0_LPB0_MIWT8_8_NLCA1_NLCB1_PLR2_SU4_SUM1_SUS128_SVW8_SK1_ULSGRO0_VWA8_VWB8_WG32_8_1_WGM6_WGMXCC1_WGMXCCG304
- - - [128, 128, 1, 128]
    - [25, 0.079]
  - - [128, 128, 1, 256]
    - [32, 0.101]
  - - [128, 128, 1, 512]
    - [32, 0.176]
  - - [128, 128, 1, 1024]
    - [32, 0.258]
  - - [128, 128, 1, 2048]
    - [13, 0.336]
  - - [128, 128, 1, 4096]
    - [12, 0.615]
  - - [128, 128, 1, 8192]
    - [30, 1.105]
  - - [128, 256, 1, 128]
    - [29, 0.155]
  - - [128, 256, 1, 256]
    - [33, 0.2]
  - - [128, 256, 1, 512]
    - [31, 0.34]
  - - [128, 256, 1, 1024]
    - [2, 0.505]
  - - [128, 256, 1, 2048]
    - [12, 0.937]
  - - [128, 256, 1, 4096]
    - [36, 1.638]
  - - [128, 256, 1, 8192]
    - [10, 2.291]
  - - [128, 512, 1, 128]
    - [31, 0.306]
  - - [128, 512, 1, 256]
    - [35, 0.39]
  - - [128, 512, 1, 512]
    - [28, 0.658]
  - - [128, 512, 1, 1024]
    - [28, 1.208]
  - - [128, 512, 1, 2048]
    - [34, 2.065]
  - - [128, 512, 1, 4096]
    - [22, 2.871]
  - - [128, 512, 1, 8192]
    - [8, 3.837]
  - - [128, 1024, 1, 128]
    - [27, 0.593]
  - - [128, 1024, 1, 256]
    - [33, 0.753]
  - - [128, 1024, 1, 512]
    - [34, 1.366]
  - - [128, 1024, 1, 1024]
    - [31, 2.36]
  - - [128, 1024, 1, 2048]
    - [23, 3.627]
  - - [128, 1024, 1, 4096]
    - [21, 4.68]
  - - [128, 1024, 1, 8192]
    - [5, 6.254]
  - - [128, 2048, 1, 128]
    - [1, 1.165]
  - - [128, 2048, 1, 256]
    - [11, 1.983]
  - - [128, 2048, 1, 512]
    - [26, 3.147]
  - - [128, 2048, 1, 1024]
    - [23, 4.051]
  - - [128, 2048, 1, 2048]
    - [19, 5.933]
  - - [128, 2048, 1, 4096]
    - [38, 7.242]
  - - [128, 2048, 1, 8192]
    - [18, 9.504]
  - - [128, 4096, 1, 128]
    - [0, 2.069]
  - - [128, 4096, 1, 256]
    - [9, 3.462]
  - - [128, 4096, 1, 512]
    - [24, 5.454]
  - - [128, 4096, 1, 1024]
    - [21, 6.644]
  - - [128, 4096, 1, 2048]
    - [17, 8.653]
  - - [128, 4096, 1, 4096]
    - [4, 10.648]
  - - [128, 4096, 1, 8192]
    - [15, 13.329]
  - - [128, 8192, 1, 128]
    - [6, 3.483]
  - - [128, 8192, 1, 256]
    - [7, 5.981]
  - - [128, 8192, 1, 512]
    - [20, 8.576]
  - - [128, 8192, 1, 1024]
    - [16, 9.357]
  - - [128, 8192, 1, 2048]
    - [14, 11.446]
  - - [128, 8192, 1, 4096]
    - [3, 14.475]
  - - [128, 8192, 1, 8192]
    - [37, 17.92]
  - - [256, 128, 1, 128]
    - [39, 0.155]
  - - [256, 128, 1, 256]
    - [40, 0.202]
  - - [256, 128, 1, 512]
    - [34, 0.336]
  - - [256, 128, 1, 1024]
    - [41, 0.505]
  - - [256, 128, 1, 2048]
    - [42, 0.916]
  - - [256, 128, 1, 4096]
    - [43, 1.662]
  - - [256, 128, 1, 8192]
    - [44, 2.282]
  - - [256, 256, 1, 128]
    - [31, 0.305]
  - - [256, 256, 1, 256]
    - [45, 0.396]
  - - [256, 256, 1, 512]
    - [46, 0.653]
  - - [256, 256, 1, 1024]
    - [47, 1.209]
  - - [256, 256, 1, 2048]
    - [48, 2.086]
  - - [256, 256, 1, 4096]
    - [49, 2.783]
  - - [256, 256, 1, 8192]
    - [50, 4.007]
  - - [256, 512, 1, 128]
    - [32, 0.591]
  - - [256, 512, 1, 256]
    - [12, 0.749]
  - - [256, 512, 1, 512]
    - [32, 1.369]
  - - [256, 512, 1, 1024]
    - [42, 2.339]
  - - [256, 512, 1, 2048]
    - [51, 3.497]
  - - [256, 512, 1, 4096]
    - [52, 4.705]
  - - [256, 512, 1, 8192]
    - [53, 6.509]
  - - [256, 1024, 1, 128]
    - [54, 1.162]
  - - [256, 1024, 1, 256]
    - [11, 1.973]
  - - [256, 1024, 1, 512]
    - [55, 2.998]
  - - [256, 1024, 1, 1024]
    - [56, 4.042]
  - - [256, 1024, 1, 2048]
    - [57, 5.991]
  - - [256, 1024, 1, 4096]
    - [58, 7.541]
  - - [256, 1024, 1, 8192]
    - [59, 9.946]
  - - [256, 2048, 1, 128]
    - [60, 2.099]
  - - [256, 2048, 1, 256]
    - [61, 3.468]
  - - [256, 2048, 1, 512]
    - [62, 5.319]
  - - [256, 2048, 1, 1024]
    - [63, 6.738]
  - - [256, 2048, 1, 2048]
    - [64, 9.162]
  - - [256, 2048, 1, 4096]
    - [65, 11.392]
  - - [256, 2048, 1, 8192]
    - [16, 14.143]
  - - [256, 4096, 1, 128]
    - [66, 3.488]
  - - [256, 4096, 1, 256]
    - [67, 5.815]
  - - [256, 4096, 1, 512]
    - [68, 8.85]
  - - [256, 4096, 1, 1024]
    - [69, 9.915]
  - - [256, 4096, 1, 2048]
    - [14, 12.668]
  - - [256, 4096, 1, 4096]
    - [70, 15.184]
  - - [256, 4096, 1, 8192]
    - [71, 19.41]
  - - [256, 8192, 1, 128]
    - [72, 5.495]
  - - [256, 8192, 1, 256]
    - [73, 9.03]
  - - [256, 8192, 1, 512]
    - [74, 12.432]
  - - [256, 8192, 1, 1024]
    - [75, 13.361]
  - - [256, 8192, 1, 2048]
    - [76, 16.164]
  - - [256, 8192, 1, 4096]
    - [77, 20.832]
  - - [256, 8192, 1, 8192]
    - [78, 23.356]
  - - [512, 128, 1, 128]
    - [79, 0.299]
  - - [512, 128, 1, 256]
    - [31, 0.393]
  - - [512, 128, 1, 512]
    - [46, 0.639]
  - - [512, 128, 1, 1024]
    - [39, 1.163]
  - - [512, 128, 1, 2048]
    - [80, 2.03]
  - - [512, 128, 1, 4096]
    - [81, 2.85]
  - - [512, 128, 1, 8192]
    - [82, 3.854]
  - - [512, 256, 1, 128]
    - [83, 0.577]
  - - [512, 256, 1, 256]
    - [45, 0.756]
  - - [512, 256, 1, 512]
    - [33, 1.37]
  - - [512, 256, 1, 1024]
    - [34, 2.28]
  - - [512, 256, 1, 2048]
    - [23, 3.538]
  - - [512, 256, 1, 4096]
    - [84, 4.695]
  - - [512, 256, 1, 8192]
    - [85, 6.345]
  - - [512, 512, 1, 128]
    - [11, 1.137]
  - - [512, 512, 1, 256]
    - [86, 1.915]
  - - [512, 512, 1, 512]
    - [87, 3.05]
  - - [512, 512, 1, 1024]
    - [88, 3.969]
  - - [512, 512, 1, 2048]
    - [89, 5.738]
  - - [512, 512, 1, 4096]
    - [90, 7.497]
  - - [512, 512, 1, 8192]
    - [91, 9.69]
  - - [512, 1024, 1, 128]
    - [92, 2.101]
  - - [512, 1024, 1, 256]
    - [92, 3.584]
  - - [512, 1024, 1, 512]
    - [93, 5.372]
  - - [512, 1024, 1, 1024]
    - [94, 6.68]
  - - [512, 1024, 1, 2048]
    - [64, 9.031]
  - - [512, 1024, 1, 4096]
    - [65, 11.112]
  - - [512, 1024, 1, 8192]
    - [15, 13.749]
  - - [512, 2048, 1, 128]
    - [95, 3.463]
  - - [512, 2048, 1, 256]
    - [96, 6.022]
  - - [512, 2048, 1, 512]
    - [97, 8.828]
  - - [512, 2048, 1, 1024]
    - [98, 10.001]
  - - [512, 2048, 1, 2048]
    - [99, 12.779]
  - - [512, 2048, 1, 4096]
    - [100, 14.829]
  - - [512, 2048, 1, 8192]
    - [101, 19.45]
  - - [512, 4096, 1, 128]
    - [102, 5.593]
  - - [512, 4096, 1, 256]
    - [103, 8.926]
  - - [512, 4096, 1, 512]
    - [104, 12.605]
  - - [512, 4096, 1, 1024]
    - [105, 13.637]
  - - [512, 4096, 1, 2048]
    - [106, 16.015]
  - - [512, 4096, 1, 4096]
    - [107, 20.888]
  - - [512, 4096, 1, 8192]
    - [108, 23.803]
  - - [512, 8192, 1, 128]
    - [109, 7.651]
  - - [512, 8192, 1, 256]
    - [110, 11.738]
  - - [512, 8192, 1, 512]
    - [111, 16.262]
  - - [512, 8192, 1, 1024]
    - [112, 16.463]
  - - [512, 8192, 1, 2048]
    - [113, 21.306]
  - - [512, 8192, 1, 4096]
    - [114, 24.737]
  - - [512, 8192, 1, 8192]
    - [115, 26.802]
  - - [1024, 128, 1, 128]
    - [116, 0.551]
  - - [1024, 128, 1, 256]
    - [45, 0.739]
  - - [1024, 128, 1, 512]
    - [13, 1.325]
  - - [1024, 128, 1, 1024]
    - [117, 2.268]
  - - [1024, 128, 1, 2048]
    - [49, 3.678]
  - - [1024, 128, 1, 4096]
    - [118, 4.635]
  - - [1024, 128, 1, 8192]
    - [119, 6.259]
  - - [1024, 256, 1, 128]
    - [120, 1.127]
  - - [1024, 256, 1, 256]
    - [121, 1.94]
  - - [1024, 256, 1, 512]
    - [121, 3.075]
  - - [1024, 256, 1, 1024]
    - [122, 4.026]
  - - [1024, 256, 1, 2048]
    - [118, 5.971]
  - - [1024, 256, 1, 4096]
    - [123, 7.398]
  - - [1024, 256, 1, 8192]
    - [124, 9.462]
  - - [1024, 512, 1, 128]
    - [125, 1.986]
  - - [1024, 512, 1, 256]
    - [126, 3.475]
  - - [1024, 512, 1, 512]
    - [93, 5.448]
  - - [1024, 512, 1, 1024]
    - [127, 6.596]
  - - [1024, 512, 1, 2048]
    - [128, 8.802]
  - - [1024, 512, 1, 4096]
    - [129, 10.806]
  - - [1024, 512, 1, 8192]
    - [130, 13.337]
  - - [1024, 1024, 1, 128]
    - [131, 3.425]
  - - [1024, 1024, 1, 256]
    - [132, 5.847]
  - - [1024, 1024, 1, 512]
    - [97, 8.802]
  - - [1024, 1024, 1, 1024]
    - [133, 9.848]
  - - [1024, 1024, 1, 2048]
    - [134, 12.563]
  - - [1024, 1024, 1, 4096]
    - [70, 14.53]
  - - [1024, 1024, 1, 8192]
    - [71, 19.109]
  - - [1024, 2048, 1, 128]
    - [135, 5.604]
  - - [1024, 2048, 1, 256]
    - [136, 8.872]
  - - [1024, 2048, 1, 512]
    - [133, 12.423]
  - - [1024, 2048, 1, 1024]
    - [137, 13.677]
  - - [1024, 2048, 1, 2048]
    - [138, 15.816]
  - - [1024, 2048, 1, 4096]
    - [139, 20.426]
  - - [1024, 2048, 1, 8192]
    - [115, 23.135]
  - - [1024, 4096, 1, 128]
    - [140, 7.985]
  - - [1024, 4096, 1, 256]
    - [141, 12.127]
  - - [1024, 4096, 1, 512]
    - [142, 16.064]
  - - [1024, 4096, 1, 1024]
    - [139, 16.602]
  - - [1024, 4096, 1, 2048]
    - [101, 21.2]
  - - [1024, 4096, 1, 4096]
    - [143, 24.928]
  - - [1024, 4096, 1, 8192]
    - [144, 27.04]
  - - [1024, 8192, 1, 128]
    - [145, 8.862]
  - - [1024, 8192, 1, 256]
    - [146, 13.757]
  - - [1024, 8192, 1, 512]
    - [147, 15.236]
  - - [1024, 8192, 1, 1024]
    - [148, 21.09]
  - - [1024, 8192, 1, 2048]
    - [149, 25.48]
  - - [1024, 8192, 1, 4096]
    - [144, 27.162]
  - - [1024, 8192, 1, 8192]
    - [150, 29.378]
  - - [2048, 128, 1, 128]
    - [120, 1.125]
  - - [2048, 128, 1, 256]
    - [151, 1.887]
  - - [2048, 128, 1, 512]
    - [121, 3.053]
  - - [2048, 128, 1, 1024]
    - [51, 4.039]
  - - [2048, 128, 1, 2048]
    - [152, 5.942]
  - - [2048, 128, 1, 4096]
    - [153, 7.369]
  - - [2048, 128, 1, 8192]
    - [131, 9.529]
  - - [2048, 256, 1, 128]
    - [154, 1.987]
  - - [2048, 256, 1, 256]
    - [155, 3.424]
  - - [2048, 256, 1, 512]
    - [156, 5.544]
  - - [2048, 256, 1, 1024]
    - [152, 6.678]
  - - [2048, 256, 1, 2048]
    - [157, 8.699]
  - - [2048, 256, 1, 4096]
    - [158, 10.779]
  - - [2048, 256, 1, 8192]
    - [159, 13.468]
  - - [2048, 512, 1, 128]
    - [160, 3.586]
  - - [2048, 512, 1, 256]
    - [161, 6.04]
  - - [2048, 512, 1, 512]
    - [162, 8.999]
  - - [2048, 512, 1, 1024]
    - [98, 10.068]
  - - [2048, 512, 1, 2048]
    - [163, 12.481]
  - - [2048, 512, 1, 4096]
    - [164, 14.933]
  - - [2048, 512, 1, 8192]
    - [147, 19.503]
  - - [2048, 1024, 1, 128]
    - [165, 5.639]
  - - [2048, 1024, 1, 256]
    - [166, 9.141]
  - - [2048, 1024, 1, 512]
    - [167, 12.489]
  - - [2048, 1024, 1, 1024]
    - [168, 13.635]
  - - [2048, 1024, 1, 2048]
    - [169, 15.995]
  - - [2048, 1024, 1, 4096]
    - [142, 20.483]
  - - [2048, 1024, 1, 8192]
    - [115, 23.781]
  - - [2048, 2048, 1, 128]
    - [140, 8.055]
  - - [2048, 2048, 1, 256]
    - [141, 12.227]
  - - [2048, 2048, 1, 512]
    - [170, 16.229]
  - - [2048, 2048, 1, 1024]
    - [113, 16.786]
  - - [2048, 2048, 1, 2048]
    - [171, 21.573]
  - - [2048, 2048, 1, 4096]
    - [172, 25.021]
  - - [2048, 2048, 1, 8192]
    - [144, 27.038]
  - - [2048, 4096, 1, 128]
    - [173, 8.947]
  - - [2048, 4096, 1, 256]
    - [174, 13.794]
  - - [2048, 4096, 1, 512]
    - [71, 15.65]
  - - [2048, 4096, 1, 1024]
    - [175, 21.22]
  - - [2048, 4096, 1, 2048]
    - [171, 25.223]
  - - [2048, 4096, 1, 4096]
    - [176, 27.104]
  - - [2048, 4096, 1, 8192]
    - [177, 28.924]
  - - [2048, 8192, 1, 128]
    - [178, 10.481]
  - - [2048, 8192, 1, 256]
    - [179, 15.977]
  - - [2048, 8192, 1, 512]
    - [180, 18.926]
  - - [2048, 8192, 1, 1024]
    - [181, 24.291]
  - - [2048, 8192, 1, 2048]
    - [182, 26.698]
  - - [2048, 8192, 1, 4096]
    - [183, 29.77]
  - - [2048, 8192, 1, 8192]
    - [183, 31.93]
  - - [4096, 128, 1, 128]
    - [125, 2.052]
  - - [4096, 128, 1, 256]
    - [184, 3.446]
  - - [4096, 128, 1, 512]
    - [185, 5.463]
  - - [4096, 128, 1, 1024]
    - [186, 6.644]
  - - [4096, 128, 1, 2048]
    - [187, 8.645]
  - - [4096, 128, 1, 4096]
    - [188, 10.384]
  - - [4096, 128, 1, 8192]
    - [189, 13.06]
  - - [4096, 256, 1, 128]
    - [153, 3.513]
  - - [4096, 256, 1, 256]
    - [190, 6.092]
  - - [4096, 256, 1, 512]
    - [191, 9.025]
  - - [4096, 256, 1, 1024]
    - [192, 9.717]
  - - [4096, 256, 1, 2048]
    - [193, 12.272]
  - - [4096, 256, 1, 4096]
    - [194, 15.29]
  - - [4096, 256, 1, 8192]
    - [71, 19.439]
  - - [4096, 512, 1, 128]
    - [195, 5.433]
  - - [4096, 512, 1, 256]
    - [165, 9.171]
  - - [4096, 512, 1, 512]
    - [196, 12.514]
  - - [4096, 512, 1, 1024]
    - [197, 13.5]
  - - [4096, 512, 1, 2048]
    - [198, 16.501]
  - - [4096, 512, 1, 4096]
    - [148, 21.234]
  - - [4096, 512, 1, 8192]
    - [199, 24.274]
  - - [4096, 1024, 1, 128]
    - [200, 7.895]
  - - [4096, 1024, 1, 256]
    - [141, 12.352]
  - - [4096, 1024, 1, 512]
    - [170, 16.532]
  - - [4096, 1024, 1, 1024]
    - [201, 17.26]
  - - [4096, 1024, 1, 2048]
    - [202, 22.043]
  - - [4096, 1024, 1, 4096]
    - [203, 25.226]
  - - [4096, 1024, 1, 8192]
    - [204, 27.418]
  - - [4096, 2048, 1, 128]
    - [205, 9.007]
  - - [4096, 2048, 1, 256]
    - [206, 13.943]
  - - [4096, 2048, 1, 512]
    - [207, 15.88]
  - - [4096, 2048, 1, 1024]
    - [208, 21.827]
  - - [4096, 2048, 1, 2048]
    - [182, 25.77]
  - - [4096, 2048, 1, 4096]
    - [209, 28.034]
  - - [4096, 2048, 1, 8192]
    - [210, 31.718]
  - - [4096, 4096, 1, 128]
    - [211, 10.749]
  - - [4096, 4096, 1, 256]
    - [212, 16.629]
  - - [4096, 4096, 1, 512]
    - [213, 19.11]
  - - [4096, 4096, 1, 1024]
    - [214, 24.639]
  - - [4096, 4096, 1, 2048]
    - [215, 27.004]
  - - [4096, 4096, 1, 4096]
    - [183, 30.848]
  - - [4096, 4096, 1, 8192]
    - [216, 33.779]
  - - [4096, 8192, 1, 128]
    - [217, 11.211]
  - - [4096, 8192, 1, 256]
    - [218, 16.613]
  - - [4096, 8192, 1, 512]
    - [219, 21.667]
  - - [4096, 8192, 1, 1024]
    - [181, 25.538]
  - - [4096, 8192, 1, 2048]
    - [220, 30.434]
  - - [4096, 8192, 1, 4096]
    - [221, 33.535]
  - - [4096, 8192, 1, 8192]
    - [222, 36.419]
  - - [8192, 128, 1, 128]
    - [223, 3.513]
  - - [8192, 128, 1, 256]
    - [224, 6.015]
  - - [8192, 128, 1, 512]
    - [131, 8.447]
  - - [8192, 128, 1, 1024]
    - [225, 9.131]
  - - [8192, 128, 1, 2048]
    - [226, 11.01]
  - - [8192, 128, 1, 4096]
    - [164, 14.517]
  - - [8192, 128, 1, 8192]
    - [227, 18.173]
  - - [8192, 256, 1, 128]
    - [166, 5.54]
  - - [8192, 256, 1, 256]
    - [165, 8.974]
  - - [8192, 256, 1, 512]
    - [196, 12.014]
  - - [8192, 256, 1, 1024]
    - [228, 12.989]
  - - [8192, 256, 1, 2048]
    - [76, 15.822]
  - - [8192, 256, 1, 4096]
    - [101, 20.357]
  - - [8192, 256, 1, 8192]
    - [229, 22.714]
  - - [8192, 512, 1, 128]
    - [230, 7.433]
  - - [8192, 512, 1, 256]
    - [231, 11.352]
  - - [8192, 512, 1, 512]
    - [197, 15.977]
  - - [8192, 512, 1, 1024]
    - [232, 16.588]
  - - [8192, 512, 1, 2048]
    - [233, 21.091]
  - - [8192, 512, 1, 4096]
    - [234, 25.316]
  - - [8192, 512, 1, 8192]
    - [235, 28.015]
  - - [8192, 1024, 1, 128]
    - [236, 8.826]
  - - [8192, 1024, 1, 256]
    - [237, 13.611]
  - - [8192, 1024, 1, 512]
    - [202, 15.384]
  - - [8192, 1024, 1, 1024]
    - [238, 21.499]
  - - [8192, 1024, 1, 2048]
    - [239, 25.709]
  - - [8192, 1024, 1, 4096]
    - [216, 27.429]
  - - [8192, 1024, 1, 8192]
    - [183, 30.485]
  - - [8192, 2048, 1, 128]
    - [240, 10.236]
  - - [8192, 2048, 1, 256]
    - [179, 15.66]
  - - [8192, 2048, 1, 512]
    - [241, 19.351]
  - - [8192, 2048, 1, 1024]
    - [242, 24.425]
  - - [8192, 2048, 1, 2048]
    - [242, 27.402]
  - - [8192, 2048, 1, 4096]
    - [216, 31.295]
  - - [8192, 2048, 1, 8192]
    - [243, 33.848]
  - - [8192, 4096, 1, 128]
    - [244, 11.081]
  - - [8192, 4096, 1, 256]
    - [245, 15.26]
  - - [8192, 4096, 1, 512]
    - [246, 20.325]
  - - [8192, 4096, 1, 1024]
    - [247, 25.373]
  - - [8192, 4096, 1, 2048]
    - [248, 29.854]
  - - [8192, 4096, 1, 4096]
    - [243, 34.248]
  - - [8192, 4096, 1, 8192]
    - [222, 36.56]
  - - [8192, 8192, 1, 128]
    - [249, 11.223]
  - - [8192, 8192, 1, 256]
    - [250, 16.351]
  - - [8192, 8192, 1, 512]
    - [246, 21.678]
  - - [8192, 8192, 1, 1024]
    - [251, 27.936]
  - - [8192, 8192, 1, 2048]
    - [243, 32.733]
  - - [8192, 8192, 1, 4096]
    - [243, 35.844]
  - - [8192, 8192, 1, 8192]
    - [252, 36.667]
- null
- null
- DeviceEfficiency
- GridBased
