library/src/amd_detail/rocblaslt/src/Tensile/Logic/streamk/aquavanjaram/aquavanjaram942_Cijk_Ailk_Bjlk_BBS_BH_UserArgs.yaml
- {MinimumRequiredVersion: 4.33.0}
- aquavanjaram942
- gfx942
- [Device 0049, Device 0050]
    SolutionIndex: 0
    SolutionNameMin: Cijk_Ailk_Bjlk_BBS_BH_UserArgs_MT32x32x64_MI16x16x1_SN_CLR1_GSU0_GSUC0_GSUWGMRR0_K1_LBSPPA256_LBSPPB256_MIWT1_1_NLCA1_NLCB1_PLR1_SU32_SUM0_SUS256_SPO0_SVW1_SKXCCM0_VWA1_VWB1_WSGRA0_WSGRB0_WGM1
    SolutionIndex: 1
    SolutionNameMin: Cijk_Ailk_Bjlk_BBS_BH_UserArgs_MT32x32x64_MI16x16x1_SN_CLR1_GSU0_GSUC0_GSUWGMRR0_K1_LBSPPA256_LBSPPB256_MIWT1_1_NLCA1_NLCB1_PLR1_SU32_SUM0_SUS256_SPO0_SVW1_SKXCCM0_VWA1_VWB1_WSGRA1_WSGRB0_WGM1
    SolutionIndex: 2
    SolutionNameMin: Cijk_Ailk_Bjlk_BBS_BH_UserArgs_MT32x32x64_MI16x16x1_SN_CLR1_GSU0_GSUC0_GSUWGMRR0_K1_LBSPPA256_LBSPPB256_MIWT1_1_NLCA1_NLCB1_PLR2_SU32_SUM0_SUS256_SPO0_SVW1_SKXCCM0_VWA1_VWB1_WSGRA0_WSGRB0_WGM1
    SolutionIndex: 3
    SolutionNameMin: Cijk_Ailk_Bjlk_BBS_BH_UserArgs_MT32x32x64_MI16x16x1_SN_CLR1_GSU0_GSUC0_GSUWGMRR0_K1_LBSPPA256_LBSPPB256_MIWT1_1_NLCA1_NLCB1_PLR3_SU32_SUM0_SUS256_SPO0_SVW1_SKXCCM0_VWA1_VWB1_WSGRA0_WSGRB0_WGM1
    SolutionIndex: 4
    SolutionNameMin: Cijk_Ailk_Bjlk_BBS_BH_UserArgs_MT32x32x64_MI16x16x1_SN_CLR1_GSU0_GSUC0_GSUWGMRR0_K1_LBSPPA256_LBSPPB256_MIWT1_1_NLCA1_NLCB1_PLR3_SU32_SUM0_SUS256_SPO0_SVW1_SKXCCM0_VWA1_VWB1_WSGRA1_WSGRB0_WGM1
    SolutionIndex: 5
    SolutionNameMin: Cijk_Ailk_Bjlk_BBS_BH_UserArgs_MT32x32x64_MI16x16x1_SN_CLR1_GSU0_GSUC0_GSUWGMRR0_K1_LBSPPA256_LBSPPB256_MIWT1_1_NLCA1_NLCB1_PLR3_SU32_SUM0_SUS256_SPO0_SVW1_SKXCCM0_VWA1_VWB1_WSGRA0_WSGRB1_WGM1
    SolutionIndex: 6
    SolutionNameMin: Cijk_Ailk_Bjlk_BBS_BH_UserArgs_MT32x32x64_MI16x16x1_SN_CLR1_GSU0_GSUC0_GSUWGMRR0_K1_LBSPPA256_LBSPPB256_MIWT1_1_NLCA1_NLCB1_PLR3_SU32_SUM0_SUS256_SPO0_SVW1_SKXCCM0_VWA1_VWB1_WSGRA0_WSGRB0_WGM8
    SolutionIndex: 7
    SolutionNameMin: Cijk_Ailk_Bjlk_BBS_BH_UserArgs_MT32x32x64_MI16x16x1_SN_CLR1_GSU0_GSUC0_GSUWGMRR0_K1_LBSPPA256_LBSPPB256_MIWT1_1_NLCA1_NLCB1_PLR3_SU32_SUM0_SUS256_SPO0_SVW1_SKXCCM0_VWA1_VWB1_WSGRA1_WSGRB0_WGM8
    SolutionIndex: 8
    SolutionNameMin: Cijk_Ailk_Bjlk_BBS_BH_UserArgs_MT32x32x64_MI16x16x1_SN_CLR1_GSU0_GSUC0_GSUWGMRR0_K1_LBSPPA256_LBSPPB256_MIWT1_1_NLCA1_NLCB1_PLR3_SU32_SUM0_SUS256_SPO0_SVW1_SKXCCM0_VWA1_VWB1_WSGRA0_WSGRB1_WGM8
    SolutionIndex: 9
    SolutionNameMin: Cijk_Ailk_Bjlk_BBS_BH_UserArgs_MT32x32x64_MI16x16x1_SN_CLR1_GSU0_GSUC0_GSUWGMRR0_K1_LBSPPA256_LBSPPB256_MIWT1_1_NLCA1_NLCB1_PLR1_SU32_SUM0_SUS256_SPO1_SVW1_SKXCCM0_VWA1_VWB1_WSGRA0_WSGRB0_WGM1
    SolutionIndex: 10
    SolutionNameMin: Cijk_Ailk_Bjlk_BBS_BH_UserArgs_MT32x32x64_MI16x16x1_SN_CLR1_GSU0_GSUC0_GSUWGMRR0_K1_LBSPPA256_LBSPPB256_MIWT1_1_NLCA1_NLCB1_PLR2_SU32_SUM0_SUS256_SPO1_SVW1_SKXCCM0_VWA1_VWB1_WSGRA0_WSGRB0_WGM1
    SolutionIndex: 11
    SolutionNameMin: Cijk_Ailk_Bjlk_BBS_BH_UserArgs_MT32x32x64_MI16x16x1_SN_CLR1_GSU0_GSUC0_GSUWGMRR0_K1_LBSPPA256_LBSPPB256_MIWT1_1_NLCA1_NLCB1_PLR2_SU32_SUM0_SUS256_SPO0_SVW1_SKXCCM8_VWA1_VWB1_WSGRA0_WSGRB0_WGM1
    SolutionIndex: 12
    SolutionNameMin: Cijk_Ailk_Bjlk_BBS_BH_UserArgs_MT32x32x64_MI16x16x1_SN_CLR1_GSU0_GSUC0_GSUWGMRR0_K1_LBSPPA256_LBSPPB256_MIWT1_1_NLCA1_NLCB1_PLR2_SU32_SUM0_SUS256_SPO0_SVW1_SKXCCM8_VWA1_VWB1_WSGRA1_WSGRB0_WGM1
    SolutionIndex: 13
    SolutionNameMin: Cijk_Ailk_Bjlk_BBS_BH_UserArgs_MT32x32x64_MI16x16x1_SN_CLR1_GSU0_GSUC0_GSUWGMRR0_K1_LBSPPA256_LBSPPB256_MIWT1_1_NLCA1_NLCB1_PLR3_SU32_SUM0_SUS256_SPO0_SVW1_SKXCCM8_VWA1_VWB1_WSGRA0_WSGRB0_WGM1
    SolutionIndex: 14
    SolutionNameMin: Cijk_Ailk_Bjlk_BBS_BH_UserArgs_MT32x32x64_MI16x16x1_SN_CLR1_GSU0_GSUC0_GSUWGMRR0_K1_LBSPPA256_LBSPPB256_MIWT1_1_NLCA1_NLCB1_PLR3_SU32_SUM0_SUS256_SPO0_SVW1_SKXCCM8_VWA1_VWB1_WSGRA0_WSGRB1_WGM1
    SolutionIndex: 15
    SolutionNameMin: Cijk_Ailk_Bjlk_BBS_BH_UserArgs_MT32x32x64_MI16x16x1_SN_CLR1_GSU0_GSUC0_GSUWGMRR0_K1_LBSPPA256_LBSPPB256_MIWT1_1_NLCA1_NLCB1_PLR2_SU32_SUM0_SUS256_SPO1_SVW1_SKXCCM8_VWA1_VWB1_WSGRA0_WSGRB0_WGM1
    SolutionIndex: 16
    SolutionNameMin: Cijk_Ailk_Bjlk_BBS_BH_UserArgs_MT32x32x64_MI16x16x1_SN_CLR1_GSU0_GSUC0_GSUWGMRR0_K1_LBSPPA256_LBSPPB256_MIWT1_1_NLCA1_NLCB1_PLR3_SU32_SUM0_SUS256_SPO1_SVW1_SKXCCM8_VWA1_VWB1_WSGRA0_WSGRB0_WGM1
    SolutionIndex: 17
    SolutionNameMin: Cijk_Ailk_Bjlk_BBS_BH_UserArgs_MT32x32x64_MI16x16x1_SN_CLR1_GSU0_GSUC0_GSUWGMRR0_K1_LBSPPA256_LBSPPB256_MIWT1_1_NLCA1_NLCB1_PLR3_SU32_SUM0_SUS256_SPO1_SVW1_SKXCCM8_VWA1_VWB1_WSGRA1_WSGRB0_WGM1
    SolutionIndex: 18
    SolutionNameMin: Cijk_Ailk_Bjlk_BBS_BH_UserArgs_MT64x64x64_MI16x16x1_SN_CLR1_GSU0_GSUC0_GSUWGMRR0_K1_LBSPPA512_LBSPPB512_MIWT2_2_NLCA1_NLCB1_PLR2_SU32_SUM0_SUS256_SPO0_SVW2_SKXCCM0_VWA2_VWB2_WSGRA0_WSGRB0_WGM1
    SolutionIndex: 19
    SolutionNameMin: Cijk_Ailk_Bjlk_BBS_BH_UserArgs_MT64x64x64_MI16x16x1_SN_CLR1_GSU0_GSUC0_GSUWGMRR0_K1_LBSPPA512_LBSPPB512_MIWT2_2_NLCA1_NLCB1_PLR2_SU32_SUM0_SUS256_SPO0_SVW2_SKXCCM0_VWA2_VWB2_WSGRA1_WSGRB0_WGM1
    SolutionIndex: 20
    SolutionNameMin: Cijk_Ailk_Bjlk_BBS_BH_UserArgs_MT64x64x64_MI16x16x1_SN_CLR1_GSU0_GSUC0_GSUWGMRR0_K1_LBSPPA512_LBSPPB512_MIWT2_2_NLCA1_NLCB1_PLR2_SU32_SUM0_SUS256_SPO0_SVW2_SKXCCM0_VWA2_VWB2_WSGRA0_WSGRB0_WGM8
    SolutionIndex: 21
    SolutionNameMin: Cijk_Ailk_Bjlk_BBS_BH_UserArgs_MT64x64x64_MI16x16x1_SN_CLR1_GSU0_GSUC0_GSUWGMRR0_K1_LBSPPA512_LBSPPB512_MIWT2_2_NLCA2_NLCB1_PLR2_SU32_SUM0_SUS256_SPO0_SVW2_SKXCCM0_VWA2_VWB2_WSGRA1_WSGRB0_WGM8
    SolutionIndex: 22
    SolutionNameMin: Cijk_Ailk_Bjlk_BBS_BH_UserArgs_MT64x64x64_MI16x16x1_SN_CLR1_GSU0_GSUC0_GSUWGMRR0_K1_LBSPPA512_LBSPPB512_MIWT2_2_NLCA1_NLCB1_PLR2_SU32_SUM0_SUS256_SPO1_SVW2_SKXCCM0_VWA2_VWB2_WSGRA0_WSGRB1_WGM1
    SolutionIndex: 23
    SolutionNameMin: Cijk_Ailk_Bjlk_BBS_BH_UserArgs_MT64x64x64_MI16x16x1_SN_CLR1_GSU0_GSUC0_GSUWGMRR0_K1_LBSPPA512_LBSPPB512_MIWT2_2_NLCA1_NLCB1_PLR2_SU32_SUM0_SUS256_SPO1_SVW2_SKXCCM0_VWA2_VWB2_WSGRA0_WSGRB1_WGM8
    SolutionIndex: 24
    SolutionNameMin: Cijk_Ailk_Bjlk_BBS_BH_UserArgs_MT64x128x32_MI16x16x1_SN_CLR1_GSU0_GSUC0_GSUWGMRR0_K1_LBSPPA512_LBSPPB1024_MIWT2_4_NLCA1_NLCB2_PLR1_SU32_SUM0_SUS256_SPO0_SVW2_SKXCCM8_VWA2_VWB2_WSGRA0_WSGRB0_WGM1
    SolutionIndex: 25
    SolutionNameMin: Cijk_Ailk_Bjlk_BBS_BH_UserArgs_MT64x128x64_MI16x16x1_SN_CLR1_GSU0_GSUC0_GSUWGMRR0_K1_LBSPPA512_LBSPPB1024_MIWT2_4_NLCA1_NLCB1_PLR2_SU32_SUM0_SUS256_SPO0_SVW2_SKXCCM8_VWA2_VWB2_WSGRA0_WSGRB0_WGM1
    SolutionIndex: 26
    SolutionNameMin: Cijk_Ailk_Bjlk_BBS_BH_UserArgs_MT128x64x64_MI16x16x1_SN_CLR1_GSU0_GSUC0_GSUWGMRR0_K1_LBSPPA1024_LBSPPB512_MIWT4_2_NLCA1_NLCB1_PLR3_SU32_SUM0_SUS256_SPO0_SVW2_SKXCCM8_VWA2_VWB2_WSGRA1_WSGRB1_WGM8
    SolutionIndex: 27
    SolutionNameMin: Cijk_Ailk_Bjlk_BBS_BH_UserArgs_MT64x64x64_MI16x16x1_SN_CLR1_GSU0_GSUC0_GSUWGMRR0_K1_LBSPPA512_LBSPPB512_MIWT2_2_NLCA1_NLCB1_PLR2_SU32_SUM0_SUS256_SPO0_SVW2_SKXCCM8_VWA2_VWB2_WSGRA0_WSGRB0_WGM1
    SolutionIndex: 28
    SolutionNameMin: Cijk_Ailk_Bjlk_BBS_BH_UserArgs_MT64x64x64_MI16x16x1_SN_CLR1_GSU0_GSUC0_GSUWGMRR0_K1_LBSPPA512_LBSPPB512_MIWT2_2_NLCA1_NLCB1_PLR2_SU32_SUM0_SUS256_SPO0_SVW2_SKXCCM8_VWA2_VWB2_WSGRA1_WSGRB0_WGM1
    SolutionIndex: 29
    SolutionNameMin: Cijk_Ailk_Bjlk_BBS_BH_UserArgs_MT64x64x64_MI16x16x1_SN_CLR1_GSU0_GSUC0_GSUWGMRR0_K1_LBSPPA512_LBSPPB512_MIWT2_2_NLCA1_NLCB1_PLR2_SU32_SUM0_SUS256_SPO0_SVW2_SKXCCM8_VWA2_VWB2_WSGRA1_WSGRB1_WGM1
    SolutionIndex: 30
    SolutionNameMin: Cijk_Ailk_Bjlk_BBS_BH_UserArgs_MT64x64x64_MI16x16x1_SN_CLR1_GSU0_GSUC0_GSUWGMRR0_K1_LBSPPA512_LBSPPB512_MIWT2_2_NLCA2_NLCB2_PLR1_SU32_SUM0_SUS256_SPO0_SVW2_SKXCCM8_VWA2_VWB2_WSGRA0_WSGRB0_WGM8
    SolutionIndex: 31
    SolutionNameMin: Cijk_Ailk_Bjlk_BBS_BH_UserArgs_MT64x64x32_MI16x16x1_SN_CLR1_GSU0_GSUC0_GSUWGMRR0_K1_LBSPPA512_LBSPPB512_MIWT2_2_NLCA1_NLCB1_PLR1_SU32_SUM0_SUS256_SPO1_SVW2_SKXCCM8_VWA2_VWB2_WSGRA1_WSGRB0_WGM1
    SolutionIndex: 32
    SolutionNameMin: Cijk_Ailk_Bjlk_BBS_BH_UserArgs_MT64x128x64_MI16x16x1_SN_CLR1_GSU0_GSUC0_GSUWGMRR0_K1_LBSPPA512_LBSPPB1024_MIWT2_4_NLCA1_NLCB1_PLR1_SU32_SUM0_SUS256_SPO1_SVW2_SKXCCM8_VWA2_VWB2_WSGRA0_WSGRB0_WGM1
    SolutionIndex: 33
    SolutionNameMin: Cijk_Ailk_Bjlk_BBS_BH_UserArgs_MT64x128x64_MI16x16x1_SN_CLR1_GSU0_GSUC0_GSUWGMRR0_K1_LBSPPA512_LBSPPB1024_MIWT2_4_NLCA1_NLCB1_PLR2_SU32_SUM0_SUS256_SPO1_SVW2_SKXCCM8_VWA2_VWB2_WSGRA0_WSGRB0_WGM8
    SolutionIndex: 34
    SolutionNameMin: Cijk_Ailk_Bjlk_BBS_BH_UserArgs_MT64x64x64_MI16x16x1_SN_CLR1_GSU0_GSUC0_GSUWGMRR0_K1_LBSPPA512_LBSPPB512_MIWT2_2_NLCA1_NLCB1_PLR2_SU32_SUM0_SUS256_SPO1_SVW2_SKXCCM8_VWA2_VWB2_WSGRA0_WSGRB0_WGM1
    SolutionIndex: 35
    SolutionNameMin: Cijk_Ailk_Bjlk_BBS_BH_UserArgs_MT64x64x64_MI16x16x1_SN_CLR1_GSU0_GSUC0_GSUWGMRR0_K1_LBSPPA512_LBSPPB512_MIWT2_2_NLCA1_NLCB1_PLR2_SU32_SUM0_SUS256_SPO1_SVW2_SKXCCM8_VWA2_VWB2_WSGRA0_WSGRB1_WGM1
    SolutionIndex: 36
    SolutionNameMin: Cijk_Ailk_Bjlk_BBS_BH_UserArgs_MT64x64x64_MI16x16x1_SN_CLR1_GSU0_GSUC0_GSUWGMRR0_K1_LBSPPA512_LBSPPB512_MIWT2_2_NLCA2_NLCB1_PLR2_SU32_SUM0_SUS256_SPO1_SVW2_SKXCCM8_VWA2_VWB2_WSGRA0_WSGRB0_WGM1
    SolutionIndex: 37
    SolutionNameMin: Cijk_Ailk_Bjlk_BBS_BH_UserArgs_MT64x64x64_MI16x16x1_SN_CLR1_GSU0_GSUC0_GSUWGMRR0_K1_LBSPPA512_LBSPPB512_MIWT2_2_NLCA2_NLCB2_PLR1_SU32_SUM0_SUS256_SPO1_SVW2_SKXCCM8_VWA2_VWB2_WSGRA0_WSGRB1_WGM8
    SolutionIndex: 38
    SolutionNameMin: Cijk_Ailk_Bjlk_BBS_BH_UserArgs_MT128x128x64_MI16x16x1_SN_CLR1_GSU0_GSUC0_GSUWGMRR0_K1_LBSPPA1024_LBSPPB1024_MIWT4_4_NLCA2_NLCB1_PLR1_SU32_SUM0_SUS256_SPO0_SVW4_SKXCCM8_VWA4_VWB4_WSGRA1_WSGRB0_WGM1
    SolutionIndex: 39
    SolutionNameMin: Cijk_Ailk_Bjlk_BBS_BH_UserArgs_MT128x128x64_MI16x16x1_SN_CLR1_GSU0_GSUC0_GSUWGMRR0_K1_LBSPPA1024_LBSPPB1024_MIWT4_4_NLCA1_NLCB1_PLR1_SU32_SUM0_SUS256_SPO1_SVW4_SKXCCM8_VWA4_VWB4_WSGRA0_WSGRB0_WGM1
    SolutionIndex: 40
    SolutionNameMin: Cijk_Ailk_Bjlk_BBS_BH_UserArgs_MT128x128x64_MI16x16x1_SN_CLR1_GSU0_GSUC0_GSUWGMRR0_K1_LBSPPA1024_LBSPPB1024_MIWT4_4_NLCA1_NLCB1_PLR1_SU32_SUM0_SUS256_SPO1_SVW4_SKXCCM8_VWA4_VWB4_WSGRA0_WSGRB1_WGM1
    SolutionIndex: 41
    SolutionNameMin: Cijk_Ailk_Bjlk_BBS_BH_UserArgs_MT32x32x64_MI16x16x1_SN_CLR1_GSU0_GSUC0_GSUWGMRR0_K1_LBSPPA256_LBSPPB256_MIWT1_1_NLCA1_NLCB1_PLR3_SU32_SUM0_SUS256_SPO0_SVW1_SKXCCM8_VWA1_VWB1_WSGRA0_WSGRB0_WGM8
    SolutionIndex: 42
    SolutionNameMin: Cijk_Ailk_Bjlk_BBS_BH_UserArgs_MT32x32x64_MI16x16x1_SN_CLR1_GSU0_GSUC0_GSUWGMRR0_K1_LBSPPA256_LBSPPB256_MIWT1_1_NLCA1_NLCB1_PLR3_SU32_SUM0_SUS256_SPO1_SVW1_SKXCCM0_VWA1_VWB1_WSGRA0_WSGRB1_WGM1
    SolutionIndex: 43
    SolutionNameMin: Cijk_Ailk_Bjlk_BBS_BH_UserArgs_MT32x32x64_MI16x16x1_SN_CLR1_GSU0_GSUC0_GSUWGMRR0_K1_LBSPPA256_LBSPPB256_MIWT1_1_NLCA1_NLCB1_PLR3_SU32_SUM0_SUS256_SPO0_SVW1_SKXCCM8_VWA1_VWB1_WSGRA1_WSGRB1_WGM8
    SolutionIndex: 44
    SolutionNameMin: Cijk_Ailk_Bjlk_BBS_BH_UserArgs_MT32x32x64_MI16x16x1_SN_CLR1_GSU0_GSUC0_GSUWGMRR0_K1_LBSPPA256_LBSPPB256_MIWT1_1_NLCA1_NLCB1_PLR2_SU32_SUM0_SUS256_SPO1_SVW1_SKXCCM0_VWA1_VWB1_WSGRA1_WSGRB1_WGM1
    SolutionIndex: 45
    SolutionNameMin: Cijk_Ailk_Bjlk_BBS_BH_UserArgs_MT32x32x64_MI16x16x1_SN_CLR1_GSU0_GSUC0_GSUWGMRR0_K1_LBSPPA256_LBSPPB256_MIWT1_1_NLCA1_NLCB1_PLR2_SU32_SUM0_SUS256_SPO0_SVW1_SKXCCM8_VWA1_VWB1_WSGRA0_WSGRB0_WGM8
    SolutionIndex: 46
    SolutionNameMin: Cijk_Ailk_Bjlk_BBS_BH_UserArgs_MT32x32x64_MI16x16x1_SN_CLR1_GSU0_GSUC0_GSUWGMRR0_K1_LBSPPA256_LBSPPB256_MIWT1_1_NLCA1_NLCB1_PLR3_SU32_SUM0_SUS256_SPO0_SVW1_SKXCCM8_VWA1_VWB1_WSGRA0_WSGRB1_WGM8
    SolutionIndex: 47
    SolutionNameMin: Cijk_Ailk_Bjlk_BBS_BH_UserArgs_MT64x64x64_MI16x16x1_SN_CLR1_GSU0_GSUC0_GSUWGMRR0_K1_LBSPPA512_LBSPPB512_MIWT2_2_NLCA1_NLCB1_PLR2_SU32_SUM0_SUS256_SPO0_SVW2_SKXCCM0_VWA2_VWB2_WSGRA0_WSGRB1_WGM1
    SolutionIndex: 48
    SolutionNameMin: Cijk_Ailk_Bjlk_BBS_BH_UserArgs_MT64x64x64_MI16x16x1_SN_CLR1_GSU0_GSUC0_GSUWGMRR0_K1_LBSPPA512_LBSPPB512_MIWT2_2_NLCA1_NLCB2_PLR2_SU32_SUM0_SUS256_SPO0_SVW2_SKXCCM0_VWA2_VWB2_WSGRA0_WSGRB0_WGM1
    SolutionIndex: 49
    SolutionNameMin: Cijk_Ailk_Bjlk_BBS_BH_UserArgs_MT64x64x64_MI16x16x1_SN_CLR1_GSU0_GSUC0_GSUWGMRR0_K1_LBSPPA512_LBSPPB512_MIWT2_2_NLCA2_NLCB2_PLR1_SU32_SUM0_SUS256_SPO1_SVW2_SKXCCM8_VWA2_VWB2_WSGRA1_WSGRB0_WGM1
    SolutionIndex: 50
    SolutionNameMin: Cijk_Ailk_Bjlk_BBS_BH_UserArgs_MT64x64x64_MI16x16x1_SN_CLR1_GSU0_GSUC0_GSUWGMRR0_K1_LBSPPA512_LBSPPB512_MIWT2_2_NLCA1_NLCB2_PLR3_SU32_SUM0_SUS256_SPO0_SVW2_SKXCCM0_VWA2_VWB2_WSGRA1_WSGRB1_WGM8
    SolutionIndex: 51
    SolutionNameMin: Cijk_Ailk_Bjlk_BBS_BH_UserArgs_MT64x64x64_MI16x16x1_SN_CLR1_GSU0_GSUC0_GSUWGMRR0_K1_LBSPPA512_LBSPPB512_MIWT2_2_NLCA1_NLCB1_PLR2_SU32_SUM0_SUS256_SPO1_SVW2_SKXCCM8_VWA2_VWB2_WSGRA1_WSGRB1_WGM1
    SolutionIndex: 52
    SolutionNameMin: Cijk_Ailk_Bjlk_BBS_BH_UserArgs_MT64x64x64_MI16x16x1_SN_CLR1_GSU0_GSUC0_GSUWGMRR0_K1_LBSPPA512_LBSPPB512_MIWT2_2_NLCA1_NLCB1_PLR2_SU32_SUM0_SUS256_SPO0_SVW2_SKXCCM8_VWA2_VWB2_WSGRA0_WSGRB1_WGM8
    SolutionIndex: 53
    SolutionNameMin: Cijk_Ailk_Bjlk_BBS_BH_UserArgs_MT64x128x64_MI16x16x1_SN_CLR1_GSU0_GSUC0_GSUWGMRR0_K1_LBSPPA512_LBSPPB1024_MIWT2_4_NLCA1_NLCB2_PLR2_SU32_SUM0_SUS256_SPO1_SVW2_SKXCCM8_VWA2_VWB2_WSGRA1_WSGRB1_WGM1
    SolutionIndex: 54
    SolutionNameMin: Cijk_Ailk_Bjlk_BBS_BH_UserArgs_MT128x128x64_MI16x16x1_SN_CLR1_GSU0_GSUC0_GSUWGMRR0_K1_LBSPPA1024_LBSPPB1024_MIWT4_4_NLCA1_NLCB2_PLR1_SU32_SUM0_SUS256_SPO0_SVW4_SKXCCM0_VWA4_VWB4_WSGRA1_WSGRB0_WGM8
    SolutionIndex: 55
    SolutionNameMin: Cijk_Ailk_Bjlk_BBS_BH_UserArgs_MT128x128x64_MI16x16x1_SN_CLR1_GSU0_GSUC0_GSUWGMRR0_K1_LBSPPA1024_LBSPPB1024_MIWT4_4_NLCA1_NLCB1_PLR1_SU32_SUM0_SUS256_SPO0_SVW4_SKXCCM0_VWA4_VWB4_WSGRA1_WSGRB0_WGM8
    SolutionIndex: 56
    SolutionNameMin: Cijk_Ailk_Bjlk_BBS_BH_UserArgs_MT128x128x64_MI16x16x1_SN_CLR1_GSU0_GSUC0_GSUWGMRR0_K1_LBSPPA1024_LBSPPB1024_MIWT4_4_NLCA2_NLCB1_PLR1_SU32_SUM0_SUS256_SPO0_SVW4_SKXCCM0_VWA4_VWB4_WSGRA1_WSGRB0_WGM8
    SolutionIndex: 57
    SolutionNameMin: Cijk_Ailk_Bjlk_BBS_BH_UserArgs_MT64x128x64_MI16x16x1_SN_CLR1_GSU0_GSUC0_GSUWGMRR0_K1_LBSPPA512_LBSPPB1024_MIWT2_4_NLCA1_NLCB1_PLR2_SU32_SUM0_SUS256_SPO1_SVW2_SKXCCM8_VWA2_VWB2_WSGRA0_WSGRB1_WGM1
    SolutionIndex: 58
    SolutionNameMin: Cijk_Ailk_Bjlk_BBS_BH_UserArgs_MT64x128x64_MI16x16x1_SN_CLR1_GSU0_GSUC0_GSUWGMRR0_K1_LBSPPA512_LBSPPB1024_MIWT2_4_NLCA1_NLCB2_PLR2_SU32_SUM0_SUS256_SPO1_SVW2_SKXCCM8_VWA2_VWB2_WSGRA0_WSGRB0_WGM8
    SolutionIndex: 59
    SolutionNameMin: Cijk_Ailk_Bjlk_BBS_BH_UserArgs_MT128x128x32_MI16x16x1_SN_CLR1_GSU0_GSUC0_GSUWGMRR0_K1_LBSPPA1024_LBSPPB1024_MIWT4_4_NLCA2_NLCB2_PLR1_SU32_SUM0_SUS256_SPO1_SVW2_SKXCCM0_VWA2_VWB2_WSGRA1_WSGRB0_WGM8
    SolutionIndex: 60
    SolutionNameMin: Cijk_Ailk_Bjlk_BBS_BH_UserArgs_MT128x128x32_MI16x16x1_SN_CLR0_GSU0_GSUC0_GSUWGMRR0_K1_LBSPPA1024_LBSPPB1024_MIWT4_4_NLCA1_NLCB1_PLR0_SU32_SUM0_SUS256_SPO0_SVW2_SKXCCM8_VWA2_VWB2_WSGRA0_WSGRB0_WGM1
    SolutionIndex: 61
    SolutionNameMin: Cijk_Ailk_Bjlk_BBS_BH_UserArgs_MT128x128x64_MI16x16x1_SN_CLR1_GSU0_GSUC0_GSUWGMRR0_K1_LBSPPA1024_LBSPPB1024_MIWT4_4_NLCA1_NLCB2_PLR2_SU32_SUM0_SUS256_SPO1_SVW4_SKXCCM0_VWA4_VWB4_WSGRA0_WSGRB1_WGM8
    SolutionIndex: 62
    SolutionNameMin: Cijk_Ailk_Bjlk_BBS_BH_UserArgs_MT128x128x64_MI16x16x1_SN_CLR1_GSU0_GSUC0_GSUWGMRR0_K1_LBSPPA1024_LBSPPB1024_MIWT4_4_NLCA1_NLCB2_PLR2_SU32_SUM0_SUS256_SPO0_SVW4_SKXCCM0_VWA4_VWB4_WSGRA1_WSGRB1_WGM8
    SolutionIndex: 63
    SolutionNameMin: Cijk_Ailk_Bjlk_BBS_BH_UserArgs_MT128x128x64_MI16x16x1_SN_CLR1_GSU0_GSUC0_GSUWGMRR0_K1_LBSPPA1024_LBSPPB1024_MIWT4_4_NLCA1_NLCB1_PLR1_SU32_SUM0_SUS256_SPO0_SVW4_SKXCCM8_VWA4_VWB4_WSGRA0_WSGRB1_WGM1
    SolutionIndex: 64
    SolutionNameMin: Cijk_Ailk_Bjlk_BBS_BH_UserArgs_MT128x128x64_MI16x16x1_SN_CLR1_GSU0_GSUC0_GSUWGMRR0_K1_LBSPPA1024_LBSPPB1024_MIWT4_4_NLCA2_NLCB2_PLR1_SU32_SUM0_SUS256_SPO0_SVW4_SKXCCM0_VWA4_VWB4_WSGRA1_WSGRB0_WGM8
    SolutionIndex: 65
    SolutionNameMin: Cijk_Ailk_Bjlk_BBS_BH_UserArgs_MT32x32x64_MI16x16x1_SN_CLR1_GSU0_GSUC0_GSUWGMRR0_K1_LBSPPA256_LBSPPB256_MIWT1_1_NLCA1_NLCB1_PLR2_SU32_SUM0_SUS256_SPO1_SVW1_SKXCCM8_VWA1_VWB1_WSGRA1_WSGRB1_WGM8
    SolutionIndex: 66
    SolutionNameMin: Cijk_Ailk_Bjlk_BBS_BH_UserArgs_MT64x64x64_MI16x16x1_SN_CLR1_GSU0_GSUC0_GSUWGMRR0_K1_LBSPPA512_LBSPPB512_MIWT2_2_NLCA1_NLCB1_PLR2_SU32_SUM0_SUS256_SPO0_SVW2_SKXCCM8_VWA2_VWB2_WSGRA1_WSGRB1_WGM8
    SolutionIndex: 67
    SolutionNameMin: Cijk_Ailk_Bjlk_BBS_BH_UserArgs_MT64x64x64_MI16x16x1_SN_CLR1_GSU0_GSUC0_GSUWGMRR0_K1_LBSPPA512_LBSPPB512_MIWT2_2_NLCA1_NLCB1_PLR2_SU32_SUM0_SUS256_SPO0_SVW2_SKXCCM8_VWA2_VWB2_WSGRA0_WSGRB0_WGM8
    SolutionIndex: 68
    SolutionNameMin: Cijk_Ailk_Bjlk_BBS_BH_UserArgs_MT64x64x64_MI16x16x1_SN_CLR1_GSU0_GSUC0_GSUWGMRR0_K1_LBSPPA512_LBSPPB512_MIWT2_2_NLCA1_NLCB1_PLR2_SU32_SUM0_SUS256_SPO1_SVW2_SKXCCM0_VWA2_VWB2_WSGRA1_WSGRB0_WGM1
    SolutionIndex: 69
    SolutionNameMin: Cijk_Ailk_Bjlk_BBS_BH_UserArgs_MT64x64x64_MI16x16x1_SN_CLR1_GSU0_GSUC0_GSUWGMRR0_K1_LBSPPA512_LBSPPB512_MIWT2_2_NLCA2_NLCB1_PLR1_SU32_SUM0_SUS256_SPO1_SVW2_SKXCCM0_VWA2_VWB2_WSGRA0_WSGRB1_WGM8
    SolutionIndex: 70
    SolutionNameMin: Cijk_Ailk_Bjlk_BBS_BH_UserArgs_MT64x64x64_MI16x16x1_SN_CLR1_GSU0_GSUC0_GSUWGMRR0_K1_LBSPPA512_LBSPPB512_MIWT2_2_NLCA2_NLCB2_PLR2_SU32_SUM0_SUS256_SPO1_SVW2_SKXCCM8_VWA2_VWB2_WSGRA0_WSGRB1_WGM1
    SolutionIndex: 71
    SolutionNameMin: Cijk_Ailk_Bjlk_BBS_BH_UserArgs_MT64x128x32_MI16x16x1_SN_CLR1_GSU0_GSUC0_GSUWGMRR0_K1_LBSPPA512_LBSPPB1024_MIWT2_4_NLCA1_NLCB2_PLR1_SU32_SUM0_SUS256_SPO1_SVW2_SKXCCM0_VWA2_VWB2_WSGRA0_WSGRB0_WGM1
    SolutionIndex: 72
    SolutionNameMin: Cijk_Ailk_Bjlk_BBS_BH_UserArgs_MT128x128x64_MI16x16x1_SN_CLR1_GSU0_GSUC0_GSUWGMRR0_K1_LBSPPA1024_LBSPPB1024_MIWT4_4_NLCA1_NLCB1_PLR1_SU32_SUM0_SUS256_SPO0_SVW4_SKXCCM0_VWA4_VWB4_WSGRA0_WSGRB1_WGM8
    SolutionIndex: 73
    SolutionNameMin: Cijk_Ailk_Bjlk_BBS_BH_UserArgs_MT128x128x64_MI16x16x1_SN_CLR1_GSU0_GSUC0_GSUWGMRR0_K1_LBSPPA1024_LBSPPB1024_MIWT4_4_NLCA1_NLCB2_PLR1_SU32_SUM0_SUS256_SPO0_SVW4_SKXCCM0_VWA4_VWB4_WSGRA0_WSGRB0_WGM8
    SolutionIndex: 74
    SolutionNameMin: Cijk_Ailk_Bjlk_BBS_BH_UserArgs_MT128x64x64_MI16x16x1_SN_CLR1_GSU0_GSUC0_GSUWGMRR0_K1_LBSPPA1024_LBSPPB512_MIWT4_2_NLCA2_NLCB2_PLR2_SU32_SUM0_SUS256_SPO1_SVW2_SKXCCM8_VWA2_VWB2_WSGRA0_WSGRB1_WGM8
    SolutionIndex: 75
    SolutionNameMin: Cijk_Ailk_Bjlk_BBS_BH_UserArgs_MT128x64x64_MI16x16x1_SN_CLR1_GSU0_GSUC0_GSUWGMRR0_K1_LBSPPA1024_LBSPPB512_MIWT4_2_NLCA1_NLCB1_PLR2_SU32_SUM0_SUS256_SPO0_SVW2_SKXCCM8_VWA2_VWB2_WSGRA0_WSGRB0_WGM8
    SolutionIndex: 76
    SolutionNameMin: Cijk_Ailk_Bjlk_BBS_BH_UserArgs_MT128x128x32_MI16x16x1_SN_CLR1_GSU0_GSUC0_GSUWGMRR0_K1_LBSPPA1024_LBSPPB1024_MIWT4_4_NLCA1_NLCB1_PLR1_SU32_SUM0_SUS256_SPO1_SVW4_SKXCCM0_VWA4_VWB4_WSGRA0_WSGRB0_WGM8
    SolutionIndex: 77
    SolutionNameMin: Cijk_Ailk_Bjlk_BBS_BH_UserArgs_MT128x128x16_MI16x16x1_SN_CLR0_GSU0_GSUC0_GSUWGMRR0_K1_LBSPPA1024_LBSPPB1024_MIWT4_4_NLCA1_NLCB1_PLR0_SU32_SUM0_SUS256_SPO0_SVW4_SKXCCM0_VWA4_VWB4_WSGRA0_WSGRB1_WGM8
    SolutionIndex: 78
    SolutionNameMin: Cijk_Ailk_Bjlk_BBS_BH_UserArgs_MT128x128x64_MI16x16x1_SN_CLR1_GSU0_GSUC0_GSUWGMRR0_K1_LBSPPA1024_LBSPPB1024_MIWT4_4_NLCA2_NLCB1_PLR1_SU32_SUM0_SUS256_SPO0_SVW4_SKXCCM8_VWA4_VWB4_WSGRA1_WSGRB1_WGM1
    SolutionIndex: 79
    SolutionNameMin: Cijk_Ailk_Bjlk_BBS_BH_UserArgs_MT128x128x64_MI16x16x1_SN_CLR1_GSU0_GSUC0_GSUWGMRR0_K1_LBSPPA1024_LBSPPB1024_MIWT4_4_NLCA2_NLCB1_PLR1_SU32_SUM0_SUS256_SPO1_SVW4_SKXCCM8_VWA4_VWB4_WSGRA0_WSGRB1_WGM1
    SolutionIndex: 80
    SolutionNameMin: Cijk_Ailk_Bjlk_BBS_BH_UserArgs_MT128x128x64_MI16x16x1_SN_CLR1_GSU0_GSUC0_GSUWGMRR0_K1_LBSPPA1024_LBSPPB1024_MIWT4_4_NLCA1_NLCB2_PLR1_SU32_SUM0_SUS256_SPO1_SVW4_SKXCCM0_VWA4_VWB4_WSGRA1_WSGRB0_WGM8
    SolutionIndex: 81
    SolutionNameMin: Cijk_Ailk_Bjlk_BBS_BH_UserArgs_MT128x128x64_MI16x16x1_SN_CLR1_GSU0_GSUC0_GSUWGMRR0_K1_LBSPPA1024_LBSPPB1024_MIWT4_4_NLCA2_NLCB2_PLR1_SU32_SUM0_SUS256_SPO0_SVW4_SKXCCM8_VWA4_VWB4_WSGRA1_WSGRB0_WGM8
    SolutionIndex: 82
    SolutionNameMin: Cijk_Ailk_Bjlk_BBS_BH_UserArgs_MT128x128x64_MI16x16x1_SN_CLR1_GSU0_GSUC0_GSUWGMRR0_K1_LBSPPA1024_LBSPPB1024_MIWT4_4_NLCA1_NLCB2_PLR1_SU32_SUM0_SUS256_SPO1_SVW4_SKXCCM8_VWA4_VWB4_WSGRA0_WSGRB0_WGM8
    SolutionIndex: 83
    SolutionNameMin: Cijk_Ailk_Bjlk_BBS_BH_UserArgs_MT128x256x16_MI16x16x1_SN_CLR0_GSU0_GSUC0_GSUWGMRR0_K1_LBSPPA1024_LBSPPB2048_MIWT4_8_NLCA1_NLCB1_PLR0_SU32_SUM0_SUS256_SPO0_SVW2_SKXCCM8_VWA2_VWB2_WSGRA0_WSGRB1_WGM1
    SolutionIndex: 84
    SolutionNameMin: Cijk_Ailk_Bjlk_BBS_BH_UserArgs_MT128x256x32_MI16x16x1_SN_CLR1_GSU0_GSUC0_GSUWGMRR0_K1_LBSPPA1024_LBSPPB2048_MIWT4_8_NLCA1_NLCB2_PLR1_SU32_SUM0_SUS256_SPO1_SVW4_SKXCCM8_VWA4_VWB4_WSGRA0_WSGRB0_WGM8
    SolutionIndex: 85
    SolutionNameMin: Cijk_Ailk_Bjlk_BBS_BH_UserArgs_MT128x256x32_MI16x16x1_SN_CLR1_GSU0_GSUC0_GSUWGMRR0_K1_LBSPPA1024_LBSPPB2048_MIWT4_8_NLCA1_NLCB1_PLR1_SU32_SUM0_SUS256_SPO0_SVW4_SKXCCM8_VWA4_VWB4_WSGRA1_WSGRB1_WGM8
    SolutionIndex: 86
    SolutionNameMin: Cijk_Ailk_Bjlk_BBS_BH_UserArgs_MT256x128x32_MI16x16x1_SN_CLR1_GSU0_GSUC0_GSUWGMRR0_K1_LBSPPA2048_LBSPPB1024_MIWT8_4_NLCA2_NLCB2_PLR1_SU32_SUM0_SUS256_SPO1_SVW4_SKXCCM0_VWA4_VWB4_WSGRA0_WSGRB1_WGM8
    SolutionIndex: 87
    SolutionNameMin: Cijk_Ailk_Bjlk_BBS_BH_UserArgs_MT128x256x32_MI16x16x1_SN_CLR1_GSU0_GSUC0_GSUWGMRR0_K1_LBSPPA1024_LBSPPB2048_MIWT4_8_NLCA2_NLCB2_PLR1_SU32_SUM0_SUS256_SPO1_SVW4_SKXCCM8_VWA4_VWB4_WSGRA1_WSGRB0_WGM8
    SolutionIndex: 88
    SolutionNameMin: Cijk_Ailk_Bjlk_BBS_BH_UserArgs_MT128x256x32_MI16x16x1_SN_CLR1_GSU0_GSUC0_GSUWGMRR0_K1_LBSPPA1024_LBSPPB2048_MIWT4_8_NLCA1_NLCB2_PLR1_SU32_SUM0_SUS256_SPO1_SVW4_SKXCCM8_VWA4_VWB4_WSGRA0_WSGRB1_WGM1
    SolutionIndex: 89
    SolutionNameMin: Cijk_Ailk_Bjlk_BBS_BH_UserArgs_MT256x128x32_MI16x16x1_SN_CLR1_GSU0_GSUC0_GSUWGMRR0_K1_LBSPPA2048_LBSPPB1024_MIWT8_4_NLCA2_NLCB2_PLR1_SU32_SUM0_SUS256_SPO0_SVW4_SKXCCM8_VWA4_VWB4_WSGRA0_WSGRB0_WGM8
    SolutionIndex: 90
    SolutionNameMin: Cijk_Ailk_Bjlk_BBS_BH_UserArgs_MT32x32x64_MI16x16x1_SN_CLR1_GSU0_GSUC0_GSUWGMRR0_K1_LBSPPA256_LBSPPB256_MIWT1_1_NLCA1_NLCB1_PLR3_SU32_SUM0_SUS256_SPO1_SVW1_SKXCCM8_VWA1_VWB1_WSGRA1_WSGRB1_WGM8
    SolutionIndex: 91
    SolutionNameMin: Cijk_Ailk_Bjlk_BBS_BH_UserArgs_MT64x64x64_MI16x16x1_SN_CLR1_GSU0_GSUC0_GSUWGMRR0_K1_LBSPPA512_LBSPPB512_MIWT2_2_NLCA1_NLCB1_PLR2_SU32_SUM0_SUS256_SPO0_SVW2_SKXCCM0_VWA2_VWB2_WSGRA1_WSGRB1_WGM1
    SolutionIndex: 92
    SolutionNameMin: Cijk_Ailk_Bjlk_BBS_BH_UserArgs_MT64x64x64_MI16x16x1_SN_CLR1_GSU0_GSUC0_GSUWGMRR0_K1_LBSPPA512_LBSPPB512_MIWT2_2_NLCA2_NLCB1_PLR2_SU32_SUM0_SUS256_SPO0_SVW2_SKXCCM0_VWA2_VWB2_WSGRA0_WSGRB0_WGM8
    SolutionIndex: 93
    SolutionNameMin: Cijk_Ailk_Bjlk_BBS_BH_UserArgs_MT64x64x64_MI16x16x1_SN_CLR1_GSU0_GSUC0_GSUWGMRR0_K1_LBSPPA512_LBSPPB512_MIWT2_2_NLCA1_NLCB1_PLR2_SU32_SUM0_SUS256_SPO0_SVW2_SKXCCM8_VWA2_VWB2_WSGRA1_WSGRB0_WGM8
    SolutionIndex: 94
    SolutionNameMin: Cijk_Ailk_Bjlk_BBS_BH_UserArgs_MT64x64x64_MI16x16x1_SN_CLR1_GSU0_GSUC0_GSUWGMRR0_K1_LBSPPA512_LBSPPB512_MIWT2_2_NLCA2_NLCB1_PLR2_SU32_SUM0_SUS256_SPO0_SVW2_SKXCCM0_VWA2_VWB2_WSGRA0_WSGRB0_WGM1
    SolutionIndex: 95
    SolutionNameMin: Cijk_Ailk_Bjlk_BBS_BH_UserArgs_MT64x64x64_MI16x16x1_SN_CLR1_GSU0_GSUC0_GSUWGMRR0_K1_LBSPPA512_LBSPPB512_MIWT2_2_NLCA2_NLCB2_PLR1_SU32_SUM0_SUS256_SPO0_SVW2_SKXCCM0_VWA2_VWB2_WSGRA0_WSGRB0_WGM1
    SolutionIndex: 96
    SolutionNameMin: Cijk_Ailk_Bjlk_BBS_BH_UserArgs_MT64x128x64_MI16x16x1_SN_CLR1_GSU0_GSUC0_GSUWGMRR0_K1_LBSPPA512_LBSPPB1024_MIWT2_4_NLCA1_NLCB2_PLR2_SU32_SUM0_SUS256_SPO1_SVW2_SKXCCM0_VWA2_VWB2_WSGRA1_WSGRB1_WGM1
    SolutionIndex: 97
    SolutionNameMin: Cijk_Ailk_Bjlk_BBS_BH_UserArgs_MT64x128x64_MI16x16x1_SN_CLR1_GSU0_GSUC0_GSUWGMRR0_K1_LBSPPA512_LBSPPB1024_MIWT2_4_NLCA1_NLCB2_PLR2_SU32_SUM0_SUS256_SPO1_SVW2_SKXCCM0_VWA2_VWB2_WSGRA0_WSGRB0_WGM1
    SolutionIndex: 98
    SolutionNameMin: Cijk_Ailk_Bjlk_BBS_BH_UserArgs_MT64x128x64_MI16x16x1_SN_CLR1_GSU0_GSUC0_GSUWGMRR0_K1_LBSPPA512_LBSPPB1024_MIWT2_4_NLCA1_NLCB1_PLR1_SU32_SUM0_SUS256_SPO0_SVW2_SKXCCM8_VWA2_VWB2_WSGRA0_WSGRB0_WGM1
    SolutionIndex: 99
    SolutionNameMin: Cijk_Ailk_Bjlk_BBS_BH_UserArgs_MT128x128x64_MI16x16x1_SN_CLR1_GSU0_GSUC0_GSUWGMRR0_K1_LBSPPA1024_LBSPPB1024_MIWT4_4_NLCA2_NLCB2_PLR1_SU32_SUM0_SUS256_SPO0_SVW4_SKXCCM8_VWA4_VWB4_WSGRA1_WSGRB1_WGM1
    SolutionIndex: 100
    SolutionNameMin: Cijk_Ailk_Bjlk_BBS_BH_UserArgs_MT128x128x64_MI16x16x1_SN_CLR1_GSU0_GSUC0_GSUWGMRR0_K1_LBSPPA1024_LBSPPB1024_MIWT4_4_NLCA2_NLCB2_PLR1_SU32_SUM0_SUS256_SPO1_SVW4_SKXCCM8_VWA4_VWB4_WSGRA0_WSGRB0_WGM8
    SolutionIndex: 101
    SolutionNameMin: Cijk_Ailk_Bjlk_BBS_BH_UserArgs_MT128x128x64_MI16x16x1_SN_CLR1_GSU0_GSUC0_GSUWGMRR0_K1_LBSPPA1024_LBSPPB1024_MIWT4_4_NLCA1_NLCB1_PLR1_SU32_SUM0_SUS256_SPO1_SVW4_SKXCCM8_VWA4_VWB4_WSGRA0_WSGRB0_WGM8
    SolutionIndex: 102
    SolutionNameMin: Cijk_Ailk_Bjlk_BBS_BH_UserArgs_MT64x128x64_MI16x16x1_SN_CLR1_GSU0_GSUC0_GSUWGMRR0_K1_LBSPPA512_LBSPPB1024_MIWT2_4_NLCA1_NLCB1_PLR3_SU32_SUM0_SUS256_SPO0_SVW2_SKXCCM0_VWA2_VWB2_WSGRA0_WSGRB1_WGM1
    SolutionIndex: 103
    SolutionNameMin: Cijk_Ailk_Bjlk_BBS_BH_UserArgs_MT64x128x64_MI16x16x1_SN_CLR1_GSU0_GSUC0_GSUWGMRR0_K1_LBSPPA512_LBSPPB1024_MIWT2_4_NLCA1_NLCB2_PLR2_SU32_SUM0_SUS256_SPO0_SVW2_SKXCCM8_VWA2_VWB2_WSGRA0_WSGRB0_WGM8
    SolutionIndex: 104
    SolutionNameMin: Cijk_Ailk_Bjlk_BBS_BH_UserArgs_MT128x128x32_MI16x16x1_SN_CLR0_GSU0_GSUC0_GSUWGMRR0_K1_LBSPPA1024_LBSPPB1024_MIWT4_4_NLCA1_NLCB1_PLR0_SU32_SUM0_SUS256_SPO0_SVW4_SKXCCM0_VWA4_VWB4_WSGRA0_WSGRB0_WGM8
    SolutionIndex: 105
    SolutionNameMin: Cijk_Ailk_Bjlk_BBS_BH_UserArgs_MT128x128x32_MI16x16x1_SN_CLR0_GSU0_GSUC0_GSUWGMRR0_K1_LBSPPA1024_LBSPPB1024_MIWT4_4_NLCA1_NLCB1_PLR0_SU32_SUM0_SUS256_SPO0_SVW4_SKXCCM8_VWA4_VWB4_WSGRA1_WSGRB0_WGM1
    SolutionIndex: 106
    SolutionNameMin: Cijk_Ailk_Bjlk_BBS_BH_UserArgs_MT128x128x32_MI16x16x1_SN_CLR1_GSU0_GSUC0_GSUWGMRR0_K1_LBSPPA1024_LBSPPB1024_MIWT4_4_NLCA2_NLCB2_PLR1_SU32_SUM0_SUS256_SPO0_SVW4_SKXCCM8_VWA4_VWB4_WSGRA1_WSGRB0_WGM8
    SolutionIndex: 107
    SolutionNameMin: Cijk_Ailk_Bjlk_BBS_BH_UserArgs_MT128x128x64_MI16x16x1_SN_CLR1_GSU0_GSUC0_GSUWGMRR0_K1_LBSPPA1024_LBSPPB1024_MIWT4_4_NLCA1_NLCB2_PLR1_SU32_SUM0_SUS256_SPO1_SVW4_SKXCCM8_VWA4_VWB4_WSGRA0_WSGRB0_WGM1
    SolutionIndex: 108
    SolutionNameMin: Cijk_Ailk_Bjlk_BBS_BH_UserArgs_MT128x128x64_MI16x16x1_SN_CLR1_GSU0_GSUC0_GSUWGMRR0_K1_LBSPPA1024_LBSPPB1024_MIWT4_4_NLCA2_NLCB1_PLR1_SU32_SUM0_SUS256_SPO1_SVW4_SKXCCM8_VWA4_VWB4_WSGRA1_WSGRB1_WGM8
    SolutionIndex: 109
    SolutionNameMin: Cijk_Ailk_Bjlk_BBS_BH_UserArgs_MT128x128x64_MI16x16x1_SN_CLR1_GSU0_GSUC0_GSUWGMRR0_K1_LBSPPA1024_LBSPPB1024_MIWT4_4_NLCA2_NLCB2_PLR2_SU32_SUM0_SUS256_SPO0_SVW4_SKXCCM8_VWA4_VWB4_WSGRA1_WSGRB1_WGM8
    SolutionIndex: 110
    SolutionNameMin: Cijk_Ailk_Bjlk_BBS_BH_UserArgs_MT256x128x32_MI16x16x1_SN_CLR0_GSU0_GSUC0_GSUWGMRR0_K1_LBSPPA2048_LBSPPB1024_MIWT8_4_NLCA2_NLCB1_PLR0_SU32_SUM0_SUS256_SPO0_SVW2_SKXCCM8_VWA2_VWB2_WSGRA1_WSGRB0_WGM1
    SolutionIndex: 111
    SolutionNameMin: Cijk_Ailk_Bjlk_BBS_BH_UserArgs_MT128x256x32_MI16x16x1_SN_CLR1_GSU0_GSUC0_GSUWGMRR0_K1_LBSPPA1024_LBSPPB2048_MIWT4_8_NLCA1_NLCB2_PLR1_SU32_SUM0_SUS256_SPO1_SVW4_SKXCCM8_VWA4_VWB4_WSGRA1_WSGRB0_WGM8
    SolutionIndex: 112
    SolutionNameMin: Cijk_Ailk_Bjlk_BBS_BH_UserArgs_MT256x128x16_MI16x16x1_SN_CLR0_GSU0_GSUC0_GSUWGMRR0_K1_LBSPPA2048_LBSPPB1024_MIWT8_4_NLCA1_NLCB1_PLR0_SU32_SUM0_SUS256_SPO0_SVW4_SKXCCM8_VWA4_VWB4_WSGRA1_WSGRB0_WGM8
    SolutionIndex: 113
    SolutionNameMin: Cijk_Ailk_Bjlk_BBS_BH_UserArgs_MT256x128x32_MI16x16x1_SN_CLR1_GSU0_GSUC0_GSUWGMRR0_K1_LBSPPA2048_LBSPPB1024_MIWT8_4_NLCA2_NLCB1_PLR1_SU32_SUM0_SUS256_SPO0_SVW4_SKXCCM8_VWA4_VWB4_WSGRA0_WSGRB1_WGM8
    SolutionIndex: 114
    SolutionNameMin: Cijk_Ailk_Bjlk_BBS_BH_UserArgs_MT128x256x32_MI16x16x1_SN_CLR1_GSU0_GSUC0_GSUWGMRR0_K1_LBSPPA1024_LBSPPB2048_MIWT4_8_NLCA1_NLCB1_PLR1_SU32_SUM0_SUS256_SPO1_SVW4_SKXCCM8_VWA4_VWB4_WSGRA1_WSGRB0_WGM1
    SolutionIndex: 115
    SolutionNameMin: Cijk_Ailk_Bjlk_BBS_BH_UserArgs_MT128x256x32_MI16x16x1_SN_CLR1_GSU0_GSUC0_GSUWGMRR0_K1_LBSPPA1024_LBSPPB2048_MIWT4_8_NLCA1_NLCB2_PLR1_SU32_SUM0_SUS256_SPO1_SVW4_SKXCCM8_VWA4_VWB4_WSGRA0_WSGRB0_WGM1
    SolutionIndex: 116
    SolutionNameMin: Cijk_Ailk_Bjlk_BBS_BH_UserArgs_MT256x128x32_MI16x16x1_SN_CLR1_GSU0_GSUC0_GSUWGMRR0_K1_LBSPPA2048_LBSPPB1024_MIWT8_4_NLCA2_NLCB2_PLR1_SU32_SUM0_SUS256_SPO0_SVW4_SKXCCM8_VWA4_VWB4_WSGRA1_WSGRB1_WGM8
    SolutionIndex: 117
    SolutionNameMin: Cijk_Ailk_Bjlk_BBS_BH_UserArgs_MT256x256x16_MI16x16x1_SN_CLR0_GSU0_GSUC0_GSUWGMRR0_K1_LBSPPA2048_LBSPPB2048_MIWT8_8_NLCA2_NLCB2_PLR0_SU32_SUM0_SUS256_SPO0_SVW8_SKXCCM8_VWA8_VWB8_WSGRA1_WSGRB1_WGM8
    SolutionIndex: 118
    SolutionNameMin: Cijk_Ailk_Bjlk_BBS_BH_UserArgs_MT256x256x32_MI16x16x1_SN_CLR1_GSU0_GSUC0_GSUWGMRR0_K1_LBSPPA2048_LBSPPB2048_MIWT8_8_NLCA2_NLCB1_PLR1_SU32_SUM0_SUS256_SPO0_SVW8_SKXCCM8_VWA8_VWB8_WSGRA0_WSGRB0_WGM8
    SolutionIndex: 119
    SolutionNameMin: Cijk_Ailk_Bjlk_BBS_BH_UserArgs_MT256x256x32_MI16x16x1_SN_CLR1_GSU0_GSUC0_GSUWGMRR0_K1_LBSPPA2048_LBSPPB2048_MIWT8_8_NLCA2_NLCB1_PLR1_SU32_SUM0_SUS256_SPO1_SVW8_SKXCCM8_VWA8_VWB8_WSGRA1_WSGRB1_WGM8
    SolutionIndex: 120
    SolutionNameMin: Cijk_Ailk_Bjlk_BBS_BH_UserArgs_MT256x256x32_MI16x16x1_SN_CLR1_GSU0_GSUC0_GSUWGMRR0_K1_LBSPPA2048_LBSPPB2048_MIWT8_8_NLCA2_NLCB2_PLR1_SU32_SUM0_SUS256_SPO1_SVW8_SKXCCM8_VWA8_VWB8_WSGRA1_WSGRB1_WGM8
    SolutionIndex: 121
    SolutionNameMin: Cijk_Ailk_Bjlk_BBS_BH_UserArgs_MT256x256x32_MI16x16x1_SN_CLR1_GSU0_GSUC0_GSUWGMRR0_K1_LBSPPA2048_LBSPPB2048_MIWT8_8_NLCA1_NLCB2_PLR1_SU32_SUM0_SUS256_SPO0_SVW8_SKXCCM8_VWA8_VWB8_WSGRA1_WSGRB1_WGM1
    SolutionIndex: 122
    SolutionNameMin: Cijk_Ailk_Bjlk_BBS_BH_UserArgs_MT256x256x32_MI16x16x1_SN_CLR1_GSU0_GSUC0_GSUWGMRR0_K1_LBSPPA2048_LBSPPB2048_MIWT8_8_NLCA1_NLCB2_PLR1_SU32_SUM0_SUS256_SPO1_SVW8_SKXCCM8_VWA8_VWB8_WSGRA0_WSGRB0_WGM1
    SolutionIndex: 123
    SolutionNameMin: Cijk_Ailk_Bjlk_BBS_BH_UserArgs_MT256x256x32_MI16x16x1_SN_CLR1_GSU0_GSUC0_GSUWGMRR0_K1_LBSPPA2048_LBSPPB2048_MIWT8_8_NLCA2_NLCB2_PLR1_SU32_SUM0_SUS256_SPO0_SVW8_SKXCCM8_VWA8_VWB8_WSGRA1_WSGRB0_WGM1
    SolutionIndex: 124
    SolutionNameMin: Cijk_Ailk_Bjlk_BBS_BH_UserArgs_MT64x64x64_MI16x16x1_SN_CLR1_GSU0_GSUC0_GSUWGMRR0_K1_LBSPPA512_LBSPPB512_MIWT2_2_NLCA2_NLCB1_PLR2_SU32_SUM0_SUS256_SPO0_SVW2_SKXCCM8_VWA2_VWB2_WSGRA0_WSGRB0_WGM1
    SolutionIndex: 125
    SolutionNameMin: Cijk_Ailk_Bjlk_BBS_BH_UserArgs_MT64x64x64_MI16x16x1_SN_CLR1_GSU0_GSUC0_GSUWGMRR0_K1_LBSPPA512_LBSPPB512_MIWT2_2_NLCA1_NLCB1_PLR2_SU32_SUM0_SUS256_SPO0_SVW2_SKXCCM0_VWA2_VWB2_WSGRA0_WSGRB1_WGM8
    SolutionIndex: 126
    SolutionNameMin: Cijk_Ailk_Bjlk_BBS_BH_UserArgs_MT64x64x64_MI16x16x1_SN_CLR1_GSU0_GSUC0_GSUWGMRR0_K1_LBSPPA512_LBSPPB512_MIWT2_2_NLCA2_NLCB1_PLR2_SU32_SUM0_SUS256_SPO0_SVW2_SKXCCM8_VWA2_VWB2_WSGRA1_WSGRB1_WGM8
    SolutionIndex: 127
    SolutionNameMin: Cijk_Ailk_Bjlk_BBS_BH_UserArgs_MT64x64x64_MI16x16x1_SN_CLR1_GSU0_GSUC0_GSUWGMRR0_K1_LBSPPA512_LBSPPB512_MIWT2_2_NLCA1_NLCB2_PLR2_SU32_SUM0_SUS256_SPO1_SVW2_SKXCCM8_VWA2_VWB2_WSGRA0_WSGRB0_WGM1
    SolutionIndex: 128
    SolutionNameMin: Cijk_Ailk_Bjlk_BBS_BH_UserArgs_MT64x64x64_MI16x16x1_SN_CLR1_GSU0_GSUC0_GSUWGMRR0_K1_LBSPPA512_LBSPPB512_MIWT2_2_NLCA1_NLCB1_PLR2_SU32_SUM0_SUS256_SPO0_SVW2_SKXCCM0_VWA2_VWB2_WSGRA1_WSGRB1_WGM8
    SolutionIndex: 129
    SolutionNameMin: Cijk_Ailk_Bjlk_BBS_BH_UserArgs_MT64x64x64_MI16x16x1_SN_CLR1_GSU0_GSUC0_GSUWGMRR0_K1_LBSPPA512_LBSPPB512_MIWT2_2_NLCA2_NLCB2_PLR1_SU32_SUM0_SUS256_SPO0_SVW2_SKXCCM8_VWA2_VWB2_WSGRA1_WSGRB0_WGM8
    SolutionIndex: 130
    SolutionNameMin: Cijk_Ailk_Bjlk_BBS_BH_UserArgs_MT64x64x64_MI16x16x1_SN_CLR1_GSU0_GSUC0_GSUWGMRR0_K1_LBSPPA512_LBSPPB512_MIWT2_2_NLCA1_NLCB2_PLR1_SU32_SUM0_SUS256_SPO1_SVW2_SKXCCM0_VWA2_VWB2_WSGRA0_WSGRB0_WGM1
    SolutionIndex: 131
    SolutionNameMin: Cijk_Ailk_Bjlk_BBS_BH_UserArgs_MT64x128x32_MI16x16x1_SN_CLR1_GSU0_GSUC0_GSUWGMRR0_K1_LBSPPA512_LBSPPB1024_MIWT2_4_NLCA1_NLCB1_PLR1_SU32_SUM0_SUS256_SPO0_SVW2_SKXCCM0_VWA2_VWB2_WSGRA0_WSGRB0_WGM1
    SolutionIndex: 132
    SolutionNameMin: Cijk_Ailk_Bjlk_BBS_BH_UserArgs_MT64x128x64_MI16x16x1_SN_CLR1_GSU0_GSUC0_GSUWGMRR0_K1_LBSPPA512_LBSPPB1024_MIWT2_4_NLCA2_NLCB2_PLR3_SU32_SUM0_SUS256_SPO0_SVW2_SKXCCM0_VWA2_VWB2_WSGRA1_WSGRB0_WGM1
    SolutionIndex: 133
    SolutionNameMin: Cijk_Ailk_Bjlk_BBS_BH_UserArgs_MT128x128x64_MI16x16x1_SN_CLR1_GSU0_GSUC0_GSUWGMRR0_K1_LBSPPA1024_LBSPPB1024_MIWT4_4_NLCA1_NLCB1_PLR1_SU32_SUM0_SUS256_SPO0_SVW4_SKXCCM8_VWA4_VWB4_WSGRA1_WSGRB0_WGM1
    SolutionIndex: 134
    SolutionNameMin: Cijk_Ailk_Bjlk_BBS_BH_UserArgs_MT128x128x64_MI16x16x1_SN_CLR1_GSU0_GSUC0_GSUWGMRR0_K1_LBSPPA1024_LBSPPB1024_MIWT4_4_NLCA1_NLCB1_PLR1_SU32_SUM0_SUS256_SPO0_SVW4_SKXCCM8_VWA4_VWB4_WSGRA0_WSGRB1_WGM8
    SolutionIndex: 135
    SolutionNameMin: Cijk_Ailk_Bjlk_BBS_BH_UserArgs_MT128x128x64_MI16x16x1_SN_CLR1_GSU0_GSUC0_GSUWGMRR0_K1_LBSPPA1024_LBSPPB1024_MIWT4_4_NLCA1_NLCB1_PLR1_SU32_SUM0_SUS256_SPO0_SVW4_SKXCCM8_VWA4_VWB4_WSGRA0_WSGRB0_WGM8
    SolutionIndex: 136
    SolutionNameMin: Cijk_Ailk_Bjlk_BBS_BH_UserArgs_MT64x128x64_MI16x16x1_SN_CLR1_GSU0_GSUC0_GSUWGMRR0_K1_LBSPPA512_LBSPPB1024_MIWT2_4_NLCA1_NLCB1_PLR2_SU32_SUM0_SUS256_SPO1_SVW2_SKXCCM0_VWA2_VWB2_WSGRA1_WSGRB1_WGM1
    SolutionIndex: 137
    SolutionNameMin: Cijk_Ailk_Bjlk_BBS_BH_UserArgs_MT64x128x64_MI16x16x1_SN_CLR1_GSU0_GSUC0_GSUWGMRR0_K1_LBSPPA512_LBSPPB1024_MIWT2_4_NLCA1_NLCB2_PLR2_SU32_SUM0_SUS256_SPO0_SVW2_SKXCCM0_VWA2_VWB2_WSGRA0_WSGRB1_WGM1
    SolutionIndex: 138
    SolutionNameMin: Cijk_Ailk_Bjlk_BBS_BH_UserArgs_MT128x128x32_MI16x16x1_SN_CLR0_GSU0_GSUC0_GSUWGMRR0_K1_LBSPPA1024_LBSPPB1024_MIWT4_4_NLCA2_NLCB1_PLR0_SU32_SUM0_SUS256_SPO1_SVW4_SKXCCM8_VWA4_VWB4_WSGRA0_WSGRB0_WGM1
    SolutionIndex: 139
    SolutionNameMin: Cijk_Ailk_Bjlk_BBS_BH_UserArgs_MT128x128x16_MI16x16x1_SN_CLR0_GSU0_GSUC0_GSUWGMRR0_K1_LBSPPA1024_LBSPPB1024_MIWT4_4_NLCA1_NLCB1_PLR0_SU32_SUM0_SUS256_SPO1_SVW4_SKXCCM8_VWA4_VWB4_WSGRA1_WSGRB0_WGM8
    SolutionIndex: 140
    SolutionNameMin: Cijk_Ailk_Bjlk_BBS_BH_UserArgs_MT128x128x32_MI16x16x1_SN_CLR1_GSU0_GSUC0_GSUWGMRR0_K1_LBSPPA1024_LBSPPB1024_MIWT4_4_NLCA1_NLCB2_PLR1_SU32_SUM0_SUS256_SPO1_SVW2_SKXCCM8_VWA2_VWB2_WSGRA0_WSGRB0_WGM8
    SolutionIndex: 141
    SolutionNameMin: Cijk_Ailk_Bjlk_BBS_BH_UserArgs_MT128x128x64_MI16x16x1_SN_CLR1_GSU0_GSUC0_GSUWGMRR0_K1_LBSPPA1024_LBSPPB1024_MIWT4_4_NLCA1_NLCB2_PLR2_SU32_SUM0_SUS256_SPO0_SVW4_SKXCCM8_VWA4_VWB4_WSGRA0_WSGRB1_WGM8
    SolutionIndex: 142
    SolutionNameMin: Cijk_Ailk_Bjlk_BBS_BH_UserArgs_MT128x128x64_MI16x16x1_SN_CLR1_GSU0_GSUC0_GSUWGMRR0_K1_LBSPPA1024_LBSPPB1024_MIWT4_4_NLCA1_NLCB1_PLR1_SU32_SUM0_SUS256_SPO1_SVW4_SKXCCM8_VWA4_VWB4_WSGRA1_WSGRB1_WGM8
    SolutionIndex: 143
    SolutionNameMin: Cijk_Ailk_Bjlk_BBS_BH_UserArgs_MT128x128x64_MI16x16x1_SN_CLR1_GSU0_GSUC0_GSUWGMRR0_K1_LBSPPA1024_LBSPPB1024_MIWT4_4_NLCA2_NLCB2_PLR1_SU32_SUM0_SUS256_SPO0_SVW4_SKXCCM8_VWA4_VWB4_WSGRA1_WSGRB1_WGM8
    SolutionIndex: 144
    SolutionNameMin: Cijk_Ailk_Bjlk_BBS_BH_UserArgs_MT256x128x32_MI16x16x1_SN_CLR0_GSU0_GSUC0_GSUWGMRR0_K1_LBSPPA2048_LBSPPB1024_MIWT8_4_NLCA2_NLCB1_PLR0_SU32_SUM0_SUS256_SPO0_SVW2_SKXCCM8_VWA2_VWB2_WSGRA0_WSGRB1_WGM8
    SolutionIndex: 145
    SolutionNameMin: Cijk_Ailk_Bjlk_BBS_BH_UserArgs_MT256x128x32_MI16x16x1_SN_CLR1_GSU0_GSUC0_GSUWGMRR0_K1_LBSPPA2048_LBSPPB1024_MIWT8_4_NLCA1_NLCB1_PLR1_SU32_SUM0_SUS256_SPO0_SVW4_SKXCCM8_VWA4_VWB4_WSGRA0_WSGRB0_WGM8
    SolutionIndex: 146
    SolutionNameMin: Cijk_Ailk_Bjlk_BBS_BH_UserArgs_MT256x128x32_MI16x16x1_SN_CLR1_GSU0_GSUC0_GSUWGMRR0_K1_LBSPPA2048_LBSPPB1024_MIWT8_4_NLCA1_NLCB1_PLR1_SU32_SUM0_SUS256_SPO0_SVW4_SKXCCM0_VWA4_VWB4_WSGRA0_WSGRB1_WGM1
    SolutionIndex: 147
    SolutionNameMin: Cijk_Ailk_Bjlk_BBS_BH_UserArgs_MT128x256x32_MI16x16x1_SN_CLR1_GSU0_GSUC0_GSUWGMRR0_K1_LBSPPA1024_LBSPPB2048_MIWT4_8_NLCA1_NLCB1_PLR1_SU32_SUM0_SUS256_SPO1_SVW4_SKXCCM0_VWA4_VWB4_WSGRA0_WSGRB1_WGM1
    SolutionIndex: 148
    SolutionNameMin: Cijk_Ailk_Bjlk_BBS_BH_UserArgs_MT256x128x32_MI16x16x1_SN_CLR1_GSU0_GSUC0_GSUWGMRR0_K1_LBSPPA2048_LBSPPB1024_MIWT8_4_NLCA2_NLCB2_PLR1_SU32_SUM0_SUS256_SPO1_SVW4_SKXCCM8_VWA4_VWB4_WSGRA1_WSGRB0_WGM8
    SolutionIndex: 149
    SolutionNameMin: Cijk_Ailk_Bjlk_BBS_BH_UserArgs_MT256x128x32_MI16x16x1_SN_CLR1_GSU0_GSUC0_GSUWGMRR0_K1_LBSPPA2048_LBSPPB1024_MIWT8_4_NLCA1_NLCB2_PLR1_SU32_SUM0_SUS256_SPO0_SVW4_SKXCCM8_VWA4_VWB4_WSGRA0_WSGRB0_WGM8
    SolutionIndex: 150
    SolutionNameMin: Cijk_Ailk_Bjlk_BBS_BH_UserArgs_MT256x256x32_MI16x16x1_SN_CLR1_GSU0_GSUC0_GSUWGMRR0_K1_LBSPPA2048_LBSPPB2048_MIWT8_8_NLCA1_NLCB1_PLR1_SU32_SUM0_SUS256_SPO1_SVW8_SKXCCM8_VWA8_VWB8_WSGRA1_WSGRB0_WGM8
    SolutionIndex: 151
    SolutionNameMin: Cijk_Ailk_Bjlk_BBS_BH_UserArgs_MT256x256x32_MI16x16x1_SN_CLR1_GSU0_GSUC0_GSUWGMRR0_K1_LBSPPA2048_LBSPPB2048_MIWT8_8_NLCA1_NLCB1_PLR1_SU32_SUM0_SUS256_SPO1_SVW8_SKXCCM0_VWA8_VWB8_WSGRA0_WSGRB1_WGM1
    SolutionIndex: 152
    SolutionNameMin: Cijk_Ailk_Bjlk_BBS_BH_UserArgs_MT256x256x32_MI16x16x1_SN_CLR1_GSU0_GSUC0_GSUWGMRR0_K1_LBSPPA2048_LBSPPB2048_MIWT8_8_NLCA2_NLCB1_PLR1_SU32_SUM0_SUS256_SPO1_SVW8_SKXCCM8_VWA8_VWB8_WSGRA1_WSGRB0_WGM8
    SolutionIndex: 153
    SolutionNameMin: Cijk_Ailk_Bjlk_BBS_BH_UserArgs_MT256x256x32_MI16x16x1_SN_CLR1_GSU0_GSUC0_GSUWGMRR0_K1_LBSPPA2048_LBSPPB2048_MIWT8_8_NLCA1_NLCB2_PLR1_SU32_SUM0_SUS256_SPO0_SVW8_SKXCCM8_VWA8_VWB8_WSGRA1_WSGRB1_WGM8
    SolutionIndex: 154
    SolutionNameMin: Cijk_Ailk_Bjlk_BBS_BH_UserArgs_MT256x256x32_MI16x16x1_SN_CLR1_GSU0_GSUC0_GSUWGMRR0_K1_LBSPPA2048_LBSPPB2048_MIWT8_8_NLCA1_NLCB1_PLR1_SU32_SUM0_SUS256_SPO1_SVW8_SKXCCM8_VWA8_VWB8_WSGRA1_WSGRB1_WGM8
    SolutionIndex: 155
    SolutionNameMin: Cijk_Ailk_Bjlk_BBS_BH_UserArgs_MT256x256x32_MI16x16x1_SN_CLR1_GSU0_GSUC0_GSUWGMRR0_K1_LBSPPA2048_LBSPPB2048_MIWT8_8_NLCA1_NLCB2_PLR1_SU32_SUM0_SUS256_SPO1_SVW8_SKXCCM8_VWA8_VWB8_WSGRA1_WSGRB0_WGM8
    SolutionIndex: 156
    SolutionNameMin: Cijk_Ailk_Bjlk_BBS_BH_UserArgs_MT128x128x32_MI16x16x1_SN_CLR1_GSU0_GSUC0_GSUWGMRR0_K1_LBSPPA1024_LBSPPB1024_MIWT4_4_NLCA1_NLCB2_PLR1_SU32_SUM0_SUS256_SPO0_SVW4_SKXCCM8_VWA4_VWB4_WSGRA0_WSGRB0_WGM1
    SolutionIndex: 157
    SolutionNameMin: Cijk_Ailk_Bjlk_BBS_BH_UserArgs_MT256x128x32_MI16x16x1_SN_CLR1_GSU0_GSUC0_GSUWGMRR0_K1_LBSPPA2048_LBSPPB1024_MIWT8_4_NLCA2_NLCB2_PLR1_SU32_SUM0_SUS256_SPO0_SVW4_SKXCCM8_VWA4_VWB4_WSGRA1_WSGRB0_WGM8
    SolutionIndex: 158
    SolutionNameMin: Cijk_Ailk_Bjlk_BBS_BH_UserArgs_MT256x256x32_MI16x16x1_SN_CLR1_GSU0_GSUC0_GSUWGMRR0_K1_LBSPPA2048_LBSPPB2048_MIWT8_8_NLCA1_NLCB1_PLR1_SU32_SUM0_SUS256_SPO1_SVW4_SKXCCM8_VWA4_VWB4_WSGRA1_WSGRB1_WGM1
    SolutionIndex: 159
    SolutionNameMin: Cijk_Ailk_Bjlk_BBS_BH_UserArgs_MT128x256x32_MI16x16x1_SN_CLR1_GSU0_GSUC0_GSUWGMRR0_K1_LBSPPA1024_LBSPPB2048_MIWT4_8_NLCA2_NLCB2_PLR1_SU32_SUM0_SUS256_SPO1_SVW4_SKXCCM8_VWA4_VWB4_WSGRA0_WSGRB0_WGM1
    SolutionIndex: 160
    SolutionNameMin: Cijk_Ailk_Bjlk_BBS_BH_UserArgs_MT256x256x32_MI16x16x1_SN_CLR1_GSU0_GSUC0_GSUWGMRR0_K1_LBSPPA2048_LBSPPB2048_MIWT8_8_NLCA2_NLCB2_PLR1_SU32_SUM0_SUS256_SPO1_SVW4_SKXCCM8_VWA4_VWB4_WSGRA1_WSGRB1_WGM1
    SolutionIndex: 161
    SolutionNameMin: Cijk_Ailk_Bjlk_BBS_BH_UserArgs_MT256x256x32_MI16x16x1_SN_CLR1_GSU0_GSUC0_GSUWGMRR0_K1_LBSPPA2048_LBSPPB2048_MIWT8_8_NLCA2_NLCB2_PLR1_SU32_SUM0_SUS256_SPO1_SVW8_SKXCCM8_VWA8_VWB8_WSGRA0_WSGRB0_WGM1
    SolutionIndex: 162
    SolutionNameMin: Cijk_Ailk_Bjlk_BBS_BH_UserArgs_MT64x64x64_MI16x16x1_SN_CLR1_GSU0_GSUC0_GSUWGMRR0_K1_LBSPPA512_LBSPPB512_MIWT2_2_NLCA1_NLCB2_PLR2_SU32_SUM0_SUS256_SPO1_SVW2_SKXCCM0_VWA2_VWB2_WSGRA1_WSGRB0_WGM1
    SolutionIndex: 163
    SolutionNameMin: Cijk_Ailk_Bjlk_BBS_BH_UserArgs_MT64x64x64_MI16x16x1_SN_CLR1_GSU0_GSUC0_GSUWGMRR0_K1_LBSPPA512_LBSPPB512_MIWT2_2_NLCA1_NLCB1_PLR3_SU32_SUM0_SUS256_SPO0_SVW2_SKXCCM0_VWA2_VWB2_WSGRA0_WSGRB1_WGM1
    SolutionIndex: 164
    SolutionNameMin: Cijk_Ailk_Bjlk_BBS_BH_UserArgs_MT64x128x64_MI16x16x1_SN_CLR1_GSU0_GSUC0_GSUWGMRR0_K1_LBSPPA512_LBSPPB1024_MIWT2_4_NLCA1_NLCB1_PLR2_SU32_SUM0_SUS256_SPO0_SVW2_SKXCCM0_VWA2_VWB2_WSGRA1_WSGRB1_WGM1
    SolutionIndex: 165
    SolutionNameMin: Cijk_Ailk_Bjlk_BBS_BH_UserArgs_MT64x64x64_MI16x16x1_SN_CLR1_GSU0_GSUC0_GSUWGMRR0_K1_LBSPPA512_LBSPPB512_MIWT2_2_NLCA2_NLCB2_PLR2_SU32_SUM0_SUS256_SPO0_SVW2_SKXCCM0_VWA2_VWB2_WSGRA1_WSGRB0_WGM1
    SolutionIndex: 166
    SolutionNameMin: Cijk_Ailk_Bjlk_BBS_BH_UserArgs_MT64x128x32_MI16x16x1_SN_CLR1_GSU0_GSUC0_GSUWGMRR0_K1_LBSPPA512_LBSPPB1024_MIWT2_4_NLCA1_NLCB2_PLR1_SU32_SUM0_SUS256_SPO1_SVW2_SKXCCM0_VWA2_VWB2_WSGRA0_WSGRB0_WGM8
    SolutionIndex: 167
    SolutionNameMin: Cijk_Ailk_Bjlk_BBS_BH_UserArgs_MT64x128x32_MI16x16x1_SN_CLR1_GSU0_GSUC0_GSUWGMRR0_K1_LBSPPA512_LBSPPB1024_MIWT2_4_NLCA1_NLCB1_PLR1_SU32_SUM0_SUS256_SPO1_SVW2_SKXCCM0_VWA2_VWB2_WSGRA0_WSGRB1_WGM1
    SolutionIndex: 168
    SolutionNameMin: Cijk_Ailk_Bjlk_BBS_BH_UserArgs_MT128x128x64_MI16x16x1_SN_CLR1_GSU0_GSUC0_GSUWGMRR0_K1_LBSPPA1024_LBSPPB1024_MIWT4_4_NLCA1_NLCB1_PLR1_SU32_SUM0_SUS256_SPO1_SVW4_SKXCCM8_VWA4_VWB4_WSGRA1_WSGRB0_WGM8
    SolutionIndex: 169
    SolutionNameMin: Cijk_Ailk_Bjlk_BBS_BH_UserArgs_MT128x128x64_MI16x16x1_SN_CLR1_GSU0_GSUC0_GSUWGMRR0_K1_LBSPPA1024_LBSPPB1024_MIWT4_4_NLCA1_NLCB1_PLR2_SU32_SUM0_SUS256_SPO0_SVW4_SKXCCM8_VWA4_VWB4_WSGRA0_WSGRB0_WGM8
    SolutionIndex: 170
    SolutionNameMin: Cijk_Ailk_Bjlk_BBS_BH_UserArgs_MT64x128x64_MI16x16x1_SN_CLR1_GSU0_GSUC0_GSUWGMRR0_K1_LBSPPA512_LBSPPB1024_MIWT2_4_NLCA2_NLCB1_PLR2_SU32_SUM0_SUS256_SPO1_SVW2_SKXCCM8_VWA2_VWB2_WSGRA0_WSGRB1_WGM8
    SolutionIndex: 171
    SolutionNameMin: Cijk_Ailk_Bjlk_BBS_BH_UserArgs_MT128x128x32_MI16x16x1_SN_CLR0_GSU0_GSUC0_GSUWGMRR0_K1_LBSPPA1024_LBSPPB1024_MIWT4_4_NLCA2_NLCB2_PLR0_SU32_SUM0_SUS256_SPO0_SVW4_SKXCCM8_VWA4_VWB4_WSGRA0_WSGRB0_WGM8
    SolutionIndex: 172
    SolutionNameMin: Cijk_Ailk_Bjlk_BBS_BH_UserArgs_MT128x128x16_MI16x16x1_SN_CLR0_GSU0_GSUC0_GSUWGMRR0_K1_LBSPPA1024_LBSPPB1024_MIWT4_4_NLCA1_NLCB1_PLR0_SU32_SUM0_SUS256_SPO0_SVW4_SKXCCM8_VWA4_VWB4_WSGRA0_WSGRB0_WGM8
    SolutionIndex: 173
    SolutionNameMin: Cijk_Ailk_Bjlk_BBS_BH_UserArgs_MT128x128x64_MI16x16x1_SN_CLR1_GSU0_GSUC0_GSUWGMRR0_K1_LBSPPA1024_LBSPPB1024_MIWT4_4_NLCA2_NLCB2_PLR2_SU32_SUM0_SUS256_SPO1_SVW4_SKXCCM8_VWA4_VWB4_WSGRA1_WSGRB1_WGM8
    SolutionIndex: 174
    SolutionNameMin: Cijk_Ailk_Bjlk_BBS_BH_UserArgs_MT128x128x64_MI16x16x1_SN_CLR1_GSU0_GSUC0_GSUWGMRR0_K1_LBSPPA1024_LBSPPB1024_MIWT4_4_NLCA2_NLCB2_PLR1_SU32_SUM0_SUS256_SPO0_SVW4_SKXCCM8_VWA4_VWB4_WSGRA0_WSGRB1_WGM8
    SolutionIndex: 175
    SolutionNameMin: Cijk_Ailk_Bjlk_BBS_BH_UserArgs_MT256x128x32_MI16x16x1_SN_CLR1_GSU0_GSUC0_GSUWGMRR0_K1_LBSPPA2048_LBSPPB1024_MIWT8_4_NLCA1_NLCB2_PLR1_SU32_SUM0_SUS256_SPO1_SVW2_SKXCCM8_VWA2_VWB2_WSGRA1_WSGRB0_WGM8
    SolutionIndex: 176
    SolutionNameMin: Cijk_Ailk_Bjlk_BBS_BH_UserArgs_MT256x128x32_MI16x16x1_SN_CLR1_GSU0_GSUC0_GSUWGMRR0_K1_LBSPPA2048_LBSPPB1024_MIWT8_4_NLCA1_NLCB2_PLR1_SU32_SUM0_SUS256_SPO1_SVW4_SKXCCM8_VWA4_VWB4_WSGRA1_WSGRB0_WGM8
    SolutionIndex: 177
    SolutionNameMin: Cijk_Ailk_Bjlk_BBS_BH_UserArgs_MT128x256x32_MI16x16x1_SN_CLR1_GSU0_GSUC0_GSUWGMRR0_K1_LBSPPA1024_LBSPPB2048_MIWT4_8_NLCA2_NLCB1_PLR1_SU32_SUM0_SUS256_SPO0_SVW4_SKXCCM0_VWA4_VWB4_WSGRA1_WSGRB1_WGM1
    SolutionIndex: 178
    SolutionNameMin: Cijk_Ailk_Bjlk_BBS_BH_UserArgs_MT128x256x32_MI16x16x1_SN_CLR1_GSU0_GSUC0_GSUWGMRR0_K1_LBSPPA1024_LBSPPB2048_MIWT4_8_NLCA2_NLCB1_PLR1_SU32_SUM0_SUS256_SPO0_SVW4_SKXCCM8_VWA4_VWB4_WSGRA1_WSGRB0_WGM8
    SolutionIndex: 179
    SolutionNameMin: Cijk_Ailk_Bjlk_BBS_BH_UserArgs_MT128x256x32_MI16x16x1_SN_CLR1_GSU0_GSUC0_GSUWGMRR0_K1_LBSPPA1024_LBSPPB2048_MIWT4_8_NLCA1_NLCB1_PLR1_SU32_SUM0_SUS256_SPO0_SVW4_SKXCCM8_VWA4_VWB4_WSGRA1_WSGRB0_WGM8
    SolutionIndex: 180
    SolutionNameMin: Cijk_Ailk_Bjlk_BBS_BH_UserArgs_MT128x256x32_MI16x16x1_SN_CLR1_GSU0_GSUC0_GSUWGMRR0_K1_LBSPPA1024_LBSPPB2048_MIWT4_8_NLCA1_NLCB1_PLR1_SU32_SUM0_SUS256_SPO1_SVW4_SKXCCM8_VWA4_VWB4_WSGRA0_WSGRB0_WGM8
    SolutionIndex: 181
    SolutionNameMin: Cijk_Ailk_Bjlk_BBS_BH_UserArgs_MT256x256x32_MI16x16x1_SN_CLR0_GSU0_GSUC0_GSUWGMRR0_K1_LBSPPA2048_LBSPPB2048_MIWT8_8_NLCA1_NLCB1_PLR0_SU32_SUM0_SUS256_SPO0_SVW8_SKXCCM8_VWA8_VWB8_WSGRA1_WSGRB0_WGM8
    SolutionIndex: 182
    SolutionNameMin: Cijk_Ailk_Bjlk_BBS_BH_UserArgs_MT256x256x32_MI16x16x1_SN_CLR1_GSU0_GSUC0_GSUWGMRR0_K1_LBSPPA2048_LBSPPB2048_MIWT8_8_NLCA2_NLCB2_PLR1_SU32_SUM0_SUS256_SPO1_SVW8_SKXCCM8_VWA8_VWB8_WSGRA1_WSGRB0_WGM8
    SolutionIndex: 183
    SolutionNameMin: Cijk_Ailk_Bjlk_BBS_BH_UserArgs_MT256x256x32_MI16x16x1_SN_CLR1_GSU0_GSUC0_GSUWGMRR0_K1_LBSPPA2048_LBSPPB2048_MIWT8_8_NLCA1_NLCB1_PLR1_SU32_SUM0_SUS256_SPO0_SVW8_SKXCCM8_VWA8_VWB8_WSGRA1_WSGRB0_WGM8
    SolutionIndex: 184
    SolutionNameMin: Cijk_Ailk_Bjlk_BBS_BH_UserArgs_MT256x256x32_MI16x16x1_SN_CLR1_GSU0_GSUC0_GSUWGMRR0_K1_LBSPPA2048_LBSPPB2048_MIWT8_8_NLCA2_NLCB2_PLR1_SU32_SUM0_SUS256_SPO0_SVW8_SKXCCM8_VWA8_VWB8_WSGRA1_WSGRB0_WGM8
    SolutionIndex: 185
    SolutionNameMin: Cijk_Ailk_Bjlk_BBS_BH_UserArgs_MT128x128x64_MI16x16x1_SN_CLR1_GSU0_GSUC0_GSUWGMRR0_K1_LBSPPA1024_LBSPPB1024_MIWT4_4_NLCA1_NLCB2_PLR1_SU32_SUM0_SUS256_SPO1_SVW4_SKXCCM0_VWA4_VWB4_WSGRA1_WSGRB0_WGM1
    SolutionIndex: 186
    SolutionNameMin: Cijk_Ailk_Bjlk_BBS_BH_UserArgs_MT256x128x32_MI16x16x1_SN_CLR1_GSU0_GSUC0_GSUWGMRR0_K1_LBSPPA2048_LBSPPB1024_MIWT8_4_NLCA1_NLCB1_PLR1_SU32_SUM0_SUS256_SPO1_SVW4_SKXCCM8_VWA4_VWB4_WSGRA0_WSGRB0_WGM8
    SolutionIndex: 187
    SolutionNameMin: Cijk_Ailk_Bjlk_BBS_BH_UserArgs_MT256x256x32_MI16x16x1_SN_CLR1_GSU0_GSUC0_GSUWGMRR0_K1_LBSPPA2048_LBSPPB2048_MIWT8_8_NLCA2_NLCB2_PLR1_SU32_SUM0_SUS256_SPO1_SVW4_SKXCCM8_VWA4_VWB4_WSGRA0_WSGRB0_WGM1
    SolutionIndex: 188
    SolutionNameMin: Cijk_Ailk_Bjlk_BBS_BH_UserArgs_MT256x256x32_MI16x16x1_SN_CLR1_GSU0_GSUC0_GSUWGMRR0_K1_LBSPPA2048_LBSPPB2048_MIWT8_8_NLCA1_NLCB2_PLR1_SU32_SUM0_SUS256_SPO0_SVW4_SKXCCM8_VWA4_VWB4_WSGRA1_WSGRB1_WGM1
    SolutionIndex: 189
    SolutionNameMin: Cijk_Ailk_Bjlk_BBS_BH_UserArgs_MT256x256x32_MI16x16x1_SN_CLR1_GSU0_GSUC0_GSUWGMRR0_K1_LBSPPA2048_LBSPPB2048_MIWT8_8_NLCA1_NLCB2_PLR1_SU32_SUM0_SUS256_SPO0_SVW8_SKXCCM8_VWA8_VWB8_WSGRA0_WSGRB0_WGM1
    SolutionIndex: 190
    SolutionNameMin: Cijk_Ailk_Bjlk_BBS_BH_UserArgs_MT256x256x32_MI16x16x1_SN_CLR1_GSU0_GSUC0_GSUWGMRR0_K1_LBSPPA2048_LBSPPB2048_MIWT8_8_NLCA1_NLCB2_PLR1_SU32_SUM0_SUS256_SPO0_SVW8_SKXCCM8_VWA8_VWB8_WSGRA0_WSGRB0_WGM8
    SolutionIndex: 191
    SolutionNameMin: Cijk_Ailk_Bjlk_BBS_BH_UserArgs_MT256x128x32_MI16x16x1_SN_CLR1_GSU0_GSUC0_GSUWGMRR0_K1_LBSPPA2048_LBSPPB1024_MIWT8_4_NLCA1_NLCB2_PLR1_SU32_SUM0_SUS256_SPO0_SVW4_SKXCCM0_VWA4_VWB4_WSGRA0_WSGRB0_WGM1
    SolutionIndex: 192
    SolutionNameMin: Cijk_Ailk_Bjlk_BBS_BH_UserArgs_MT256x128x32_MI16x16x1_SN_CLR1_GSU0_GSUC0_GSUWGMRR0_K1_LBSPPA2048_LBSPPB1024_MIWT8_4_NLCA2_NLCB1_PLR1_SU32_SUM0_SUS256_SPO0_SVW4_SKXCCM8_VWA4_VWB4_WSGRA1_WSGRB1_WGM8
    SolutionIndex: 193
    SolutionNameMin: Cijk_Ailk_Bjlk_BBS_BH_UserArgs_MT256x256x32_MI16x16x1_SN_CLR1_GSU0_GSUC0_GSUWGMRR0_K1_LBSPPA2048_LBSPPB2048_MIWT8_8_NLCA1_NLCB2_PLR1_SU32_SUM0_SUS256_SPO0_SVW4_SKXCCM8_VWA4_VWB4_WSGRA1_WSGRB0_WGM1
    SolutionIndex: 194
    SolutionNameMin: Cijk_Ailk_Bjlk_BBS_BH_UserArgs_MT256x256x32_MI16x16x1_SN_CLR1_GSU0_GSUC0_GSUWGMRR0_K1_LBSPPA2048_LBSPPB2048_MIWT8_8_NLCA2_NLCB1_PLR1_SU32_SUM0_SUS256_SPO0_SVW4_SKXCCM8_VWA4_VWB4_WSGRA0_WSGRB0_WGM8
- - - [128, 128, 1, 128]
    - [2, 0.082]
  - - [128, 128, 1, 256]
    - [2, 0.141]
  - - [128, 128, 1, 512]
    - [13, 0.221]
  - - [128, 128, 1, 1024]
    - [3, 0.309]
  - - [128, 128, 1, 2048]
    - [3, 0.384]
  - - [128, 128, 1, 4096]
    - [3, 0.435]
  - - [128, 128, 1, 8192]
    - [3, 0.464]
  - - [128, 256, 1, 128]
    - [0, 0.163]
  - - [128, 256, 1, 256]
    - [2, 0.282]
  - - [128, 256, 1, 512]
    - [5, 0.439]
  - - [128, 256, 1, 1024]
    - [3, 0.602]
  - - [128, 256, 1, 2048]
    - [3, 0.765]
  - - [128, 256, 1, 4096]
    - [3, 0.869]
  - - [128, 256, 1, 8192]
    - [13, 0.922]
  - - [128, 512, 1, 128]
    - [3, 0.324]
  - - [128, 512, 1, 256]
    - [3, 0.559]
  - - [128, 512, 1, 512]
    - [16, 0.863]
  - - [128, 512, 1, 1024]
    - [3, 1.228]
  - - [128, 512, 1, 2048]
    - [16, 1.507]
  - - [128, 512, 1, 4096]
    - [6, 1.709]
  - - [128, 512, 1, 8192]
    - [6, 1.833]
  - - [128, 1024, 1, 128]
    - [3, 0.637]
  - - [128, 1024, 1, 256]
    - [15, 1.074]
  - - [128, 1024, 1, 512]
    - [3, 1.732]
  - - [128, 1024, 1, 1024]
    - [3, 2.422]
  - - [128, 1024, 1, 2048]
    - [6, 2.942]
  - - [128, 1024, 1, 4096]
    - [13, 3.355]
  - - [128, 1024, 1, 8192]
    - [13, 3.638]
  - - [128, 2048, 1, 128]
    - [11, 1.199]
  - - [128, 2048, 1, 256]
    - [3, 2.155]
  - - [128, 2048, 1, 512]
    - [13, 3.289]
  - - [128, 2048, 1, 1024]
    - [6, 4.519]
  - - [128, 2048, 1, 2048]
    - [16, 5.619]
  - - [128, 2048, 1, 4096]
    - [14, 6.42]
  - - [128, 2048, 1, 8192]
    - [17, 6.302]
  - - [128, 4096, 1, 128]
    - [22, 2.206]
  - - [128, 4096, 1, 256]
    - [18, 3.752]
  - - [128, 4096, 1, 512]
    - [27, 5.491]
  - - [128, 4096, 1, 1024]
    - [34, 7.625]
  - - [128, 4096, 1, 2048]
    - [29, 9.416]
  - - [128, 4096, 1, 4096]
    - [34, 10.601]
  - - [128, 4096, 1, 8192]
    - [20, 10.451]
  - - [128, 8192, 1, 128]
    - [19, 3.976]
  - - [128, 8192, 1, 256]
    - [34, 6.615]
  - - [128, 8192, 1, 512]
    - [21, 10.123]
  - - [128, 8192, 1, 1024]
    - [31, 11.708]
  - - [128, 8192, 1, 2048]
    - [25, 13.767]
  - - [128, 8192, 1, 4096]
    - [28, 15.753]
  - - [128, 8192, 1, 8192]
    - [29, 16.191]
  - - [256, 128, 1, 128]
    - [9, 0.161]
  - - [256, 128, 1, 256]
    - [2, 0.279]
  - - [256, 128, 1, 512]
    - [4, 0.435]
  - - [256, 128, 1, 1024]
    - [3, 0.614]
  - - [256, 128, 1, 2048]
    - [3, 0.753]
  - - [256, 128, 1, 4096]
    - [4, 0.861]
  - - [256, 128, 1, 8192]
    - [3, 0.894]
  - - [256, 256, 1, 128]
    - [3, 0.322]
  - - [256, 256, 1, 256]
    - [2, 0.556]
  - - [256, 256, 1, 512]
    - [3, 0.877]
  - - [256, 256, 1, 1024]
    - [3, 1.221]
  - - [256, 256, 1, 2048]
    - [3, 1.501]
  - - [256, 256, 1, 4096]
    - [13, 1.715]
  - - [256, 256, 1, 8192]
    - [1, 1.68]
  - - [256, 512, 1, 128]
    - [2, 0.631]
  - - [256, 512, 1, 256]
    - [2, 1.09]
  - - [256, 512, 1, 512]
    - [3, 1.725]
  - - [256, 512, 1, 1024]
    - [3, 2.415]
  - - [256, 512, 1, 2048]
    - [16, 2.985]
  - - [256, 512, 1, 4096]
    - [6, 3.365]
  - - [256, 512, 1, 8192]
    - [11, 3.483]
  - - [256, 1024, 1, 128]
    - [10, 1.221]
  - - [256, 1024, 1, 256]
    - [2, 2.114]
  - - [256, 1024, 1, 512]
    - [13, 3.298]
  - - [256, 1024, 1, 1024]
    - [3, 4.717]
  - - [256, 1024, 1, 2048]
    - [7, 5.664]
  - - [256, 1024, 1, 4096]
    - [8, 6.448]
  - - [256, 1024, 1, 8192]
    - [12, 6.265]
  - - [256, 2048, 1, 128]
    - [36, 2.165]
  - - [256, 2048, 1, 256]
    - [27, 3.734]
  - - [256, 2048, 1, 512]
    - [34, 5.748]
  - - [256, 2048, 1, 1024]
    - [28, 7.508]
  - - [256, 2048, 1, 2048]
    - [28, 9.315]
  - - [256, 2048, 1, 4096]
    - [23, 10.546]
  - - [256, 2048, 1, 8192]
    - [20, 10.668]
  - - [256, 4096, 1, 128]
    - [27, 4.171]
  - - [256, 4096, 1, 256]
    - [34, 6.707]
  - - [256, 4096, 1, 512]
    - [28, 10.452]
  - - [256, 4096, 1, 1024]
    - [37, 12.35]
  - - [256, 4096, 1, 2048]
    - [30, 14.197]
  - - [256, 4096, 1, 4096]
    - [29, 16.251]
  - - [256, 4096, 1, 8192]
    - [35, 16.366]
  - - [256, 8192, 1, 128]
    - [24, 6.073]
  - - [256, 8192, 1, 256]
    - [32, 9.876]
  - - [256, 8192, 1, 512]
    - [39, 13.447]
  - - [256, 8192, 1, 1024]
    - [38, 17.865]
  - - [256, 8192, 1, 2048]
    - [40, 20.719]
  - - [256, 8192, 1, 4096]
    - [26, 21.319]
  - - [256, 8192, 1, 8192]
    - [33, 21.379]
  - - [512, 128, 1, 128]
    - [2, 0.323]
  - - [512, 128, 1, 256]
    - [3, 0.558]
  - - [512, 128, 1, 512]
    - [3, 0.876]
  - - [512, 128, 1, 1024]
    - [5, 1.218]
  - - [512, 128, 1, 2048]
    - [3, 1.523]
  - - [512, 128, 1, 4096]
    - [41, 1.652]
  - - [512, 128, 1, 8192]
    - [3, 1.774]
  - - [512, 256, 1, 128]
    - [0, 0.633]
  - - [512, 256, 1, 256]
    - [42, 1.088]
  - - [512, 256, 1, 512]
    - [3, 1.72]
  - - [512, 256, 1, 1024]
    - [3, 2.408]
  - - [512, 256, 1, 2048]
    - [3, 2.976]
  - - [512, 256, 1, 4096]
    - [41, 3.172]
  - - [512, 256, 1, 8192]
    - [43, 3.496]
  - - [512, 512, 1, 128]
    - [2, 1.231]
  - - [512, 512, 1, 256]
    - [2, 2.148]
  - - [512, 512, 1, 512]
    - [42, 3.35]
  - - [512, 512, 1, 1024]
    - [44, 4.653]
  - - [512, 512, 1, 2048]
    - [8, 5.676]
  - - [512, 512, 1, 4096]
    - [45, 6.199]
  - - [512, 512, 1, 8192]
    - [46, 6.148]
  - - [512, 1024, 1, 128]
    - [47, 2.19]
  - - [512, 1024, 1, 256]
    - [18, 3.759]
  - - [512, 1024, 1, 512]
    - [18, 5.803]
  - - [512, 1024, 1, 1024]
    - [28, 7.761]
  - - [512, 1024, 1, 2048]
    - [20, 9.42]
  - - [512, 1024, 1, 4096]
    - [28, 10.52]
  - - [512, 1024, 1, 8192]
    - [34, 10.46]
  - - [512, 2048, 1, 128]
    - [48, 4.12]
  - - [512, 2048, 1, 256]
    - [27, 7.122]
  - - [512, 2048, 1, 512]
    - [27, 10.326]
  - - [512, 2048, 1, 1024]
    - [49, 12.925]
  - - [512, 2048, 1, 2048]
    - [50, 14.503]
  - - [512, 2048, 1, 4096]
    - [51, 16.646]
  - - [512, 2048, 1, 8192]
    - [52, 16.481]
  - - [512, 4096, 1, 128]
    - [25, 6.021]
  - - [512, 4096, 1, 256]
    - [53, 10.092]
  - - [512, 4096, 1, 512]
    - [54, 13.329]
  - - [512, 4096, 1, 1024]
    - [55, 17.863]
  - - [512, 4096, 1, 2048]
    - [56, 21.148]
  - - [512, 4096, 1, 4096]
    - [57, 21.699]
  - - [512, 4096, 1, 8192]
    - [58, 22.067]
  - - [512, 8192, 1, 128]
    - [59, 8.599]
  - - [512, 8192, 1, 256]
    - [60, 13.01]
  - - [512, 8192, 1, 512]
    - [61, 17.435]
  - - [512, 8192, 1, 1024]
    - [62, 21.873]
  - - [512, 8192, 1, 2048]
    - [63, 27.876]
  - - [512, 8192, 1, 4096]
    - [64, 30.164]
  - - [512, 8192, 1, 8192]
    - [38, 31.248]
  - - [1024, 128, 1, 128]
    - [9, 0.631]
  - - [1024, 128, 1, 256]
    - [2, 1.092]
  - - [1024, 128, 1, 512]
    - [3, 1.731]
  - - [1024, 128, 1, 1024]
    - [5, 2.406]
  - - [1024, 128, 1, 2048]
    - [0, 2.728]
  - - [1024, 128, 1, 4096]
    - [45, 3.186]
  - - [1024, 128, 1, 8192]
    - [41, 3.533]
  - - [1024, 256, 1, 128]
    - [2, 1.243]
  - - [1024, 256, 1, 256]
    - [2, 2.15]
  - - [1024, 256, 1, 512]
    - [3, 3.372]
  - - [1024, 256, 1, 1024]
    - [3, 4.72]
  - - [1024, 256, 1, 2048]
    - [45, 5.298]
  - - [1024, 256, 1, 4096]
    - [45, 6.209]
  - - [1024, 256, 1, 8192]
    - [65, 6.151]
  - - [1024, 512, 1, 128]
    - [27, 2.194]
  - - [1024, 512, 1, 256]
    - [19, 3.761]
  - - [1024, 512, 1, 512]
    - [18, 5.812]
  - - [1024, 512, 1, 1024]
    - [28, 7.579]
  - - [1024, 512, 1, 2048]
    - [52, 8.905]
  - - [1024, 512, 1, 4096]
    - [66, 10.107]
  - - [1024, 512, 1, 8192]
    - [67, 10.302]
  - - [1024, 1024, 1, 128]
    - [68, 4.168]
  - - [1024, 1024, 1, 256]
    - [68, 7.11]
  - - [1024, 1024, 1, 512]
    - [27, 10.536]
  - - [1024, 1024, 1, 1024]
    - [69, 13.351]
  - - [1024, 1024, 1, 2048]
    - [70, 13.963]
  - - [1024, 1024, 1, 4096]
    - [66, 16.054]
  - - [1024, 1024, 1, 8192]
    - [66, 16.566]
  - - [1024, 2048, 1, 128]
    - [25, 5.954]
  - - [1024, 2048, 1, 256]
    - [71, 9.956]
  - - [1024, 2048, 1, 512]
    - [55, 13.34]
  - - [1024, 2048, 1, 1024]
    - [72, 17.859]
  - - [1024, 2048, 1, 2048]
    - [73, 20.718]
  - - [1024, 2048, 1, 4096]
    - [74, 21.182]
  - - [1024, 2048, 1, 8192]
    - [75, 21.936]
  - - [1024, 4096, 1, 128]
    - [76, 8.803]
  - - [1024, 4096, 1, 256]
    - [77, 13.151]
  - - [1024, 4096, 1, 512]
    - [78, 17.79]
  - - [1024, 4096, 1, 1024]
    - [79, 22.012]
  - - [1024, 4096, 1, 2048]
    - [80, 27.451]
  - - [1024, 4096, 1, 4096]
    - [81, 30.207]
  - - [1024, 4096, 1, 8192]
    - [82, 31.228]
  - - [1024, 8192, 1, 128]
    - [83, 10.425]
  - - [1024, 8192, 1, 256]
    - [84, 15.318]
  - - [1024, 8192, 1, 512]
    - [85, 20.777]
  - - [1024, 8192, 1, 1024]
    - [86, 27.633]
  - - [1024, 8192, 1, 2048]
    - [87, 32.202]
  - - [1024, 8192, 1, 4096]
    - [88, 34.038]
  - - [1024, 8192, 1, 8192]
    - [89, 36.48]
  - - [2048, 128, 1, 128]
    - [2, 1.232]
  - - [2048, 128, 1, 256]
    - [10, 2.132]
  - - [2048, 128, 1, 512]
    - [3, 3.379]
  - - [2048, 128, 1, 1024]
    - [2, 4.278]
  - - [2048, 128, 1, 2048]
    - [90, 5.317]
  - - [2048, 128, 1, 4096]
    - [46, 6.123]
  - - [2048, 128, 1, 8192]
    - [46, 6.063]
  - - [2048, 256, 1, 128]
    - [91, 2.184]
  - - [2048, 256, 1, 256]
    - [19, 3.746]
  - - [2048, 256, 1, 512]
    - [22, 5.794]
  - - [2048, 256, 1, 1024]
    - [92, 7.469]
  - - [2048, 256, 1, 2048]
    - [68, 8.905]
  - - [2048, 256, 1, 4096]
    - [66, 10.22]
  - - [2048, 256, 1, 8192]
    - [93, 10.547]
  - - [2048, 512, 1, 128]
    - [94, 4.13]
  - - [2048, 512, 1, 256]
    - [27, 7.1]
  - - [2048, 512, 1, 512]
    - [27, 10.356]
  - - [2048, 512, 1, 1024]
    - [95, 12.558]
  - - [2048, 512, 1, 2048]
    - [96, 13.722]
  - - [2048, 512, 1, 4096]
    - [22, 16.332]
  - - [2048, 512, 1, 8192]
    - [93, 16.309]
  - - [2048, 1024, 1, 128]
    - [97, 6.07]
  - - [2048, 1024, 1, 256]
    - [98, 9.927]
  - - [2048, 1024, 1, 512]
    - [99, 13.227]
  - - [2048, 1024, 1, 1024]
    - [100, 17.004]
  - - [2048, 1024, 1, 2048]
    - [101, 19.981]
  - - [2048, 1024, 1, 4096]
    - [102, 21.029]
  - - [2048, 1024, 1, 8192]
    - [103, 21.475]
  - - [2048, 2048, 1, 128]
    - [104, 8.64]
  - - [2048, 2048, 1, 256]
    - [105, 12.893]
  - - [2048, 2048, 1, 512]
    - [64, 17.461]
  - - [2048, 2048, 1, 1024]
    - [106, 20.993]
  - - [2048, 2048, 1, 2048]
    - [107, 26.442]
  - - [2048, 2048, 1, 4096]
    - [108, 29.379]
  - - [2048, 2048, 1, 8192]
    - [109, 30.846]
  - - [2048, 4096, 1, 128]
    - [110, 10.03]
  - - [2048, 4096, 1, 256]
    - [111, 14.894]
  - - [2048, 4096, 1, 512]
    - [112, 20.625]
  - - [2048, 4096, 1, 1024]
    - [113, 26.973]
  - - [2048, 4096, 1, 2048]
    - [114, 31.492]
  - - [2048, 4096, 1, 4096]
    - [115, 33.802]
  - - [2048, 4096, 1, 8192]
    - [116, 35.845]
  - - [2048, 8192, 1, 128]
    - [117, 11.753]
  - - [2048, 8192, 1, 256]
    - [118, 18.353]
  - - [2048, 8192, 1, 512]
    - [119, 26.094]
  - - [2048, 8192, 1, 1024]
    - [120, 32.574]
  - - [2048, 8192, 1, 2048]
    - [121, 36.008]
  - - [2048, 8192, 1, 4096]
    - [122, 39.531]
  - - [2048, 8192, 1, 8192]
    - [123, 42.308]
  - - [4096, 128, 1, 128]
    - [124, 2.198]
  - - [4096, 128, 1, 256]
    - [34, 3.773]
  - - [4096, 128, 1, 512]
    - [125, 5.477]
  - - [4096, 128, 1, 1024]
    - [22, 7.313]
  - - [4096, 128, 1, 2048]
    - [126, 9.065]
  - - [4096, 128, 1, 4096]
    - [93, 10.422]
  - - [4096, 128, 1, 8192]
    - [19, 10.376]
  - - [4096, 256, 1, 128]
    - [127, 4.104]
  - - [4096, 256, 1, 256]
    - [91, 6.717]
  - - [4096, 256, 1, 512]
    - [128, 9.865]
  - - [4096, 256, 1, 1024]
    - [129, 12.214]
  - - [4096, 256, 1, 2048]
    - [130, 13.729]
  - - [4096, 256, 1, 4096]
    - [47, 16.224]
  - - [4096, 256, 1, 8192]
    - [68, 16.459]
  - - [4096, 512, 1, 128]
    - [131, 6.095]
  - - [4096, 512, 1, 256]
    - [132, 10.047]
  - - [4096, 512, 1, 512]
    - [133, 13.1]
  - - [4096, 512, 1, 1024]
    - [134, 17.392]
  - - [4096, 512, 1, 2048]
    - [135, 20.249]
  - - [4096, 512, 1, 4096]
    - [136, 22.004]
  - - [4096, 512, 1, 8192]
    - [137, 21.847]
  - - [4096, 1024, 1, 128]
    - [138, 8.723]
  - - [4096, 1024, 1, 256]
    - [139, 12.907]
  - - [4096, 1024, 1, 512]
    - [100, 16.868]
  - - [4096, 1024, 1, 1024]
    - [140, 21.097]
  - - [4096, 1024, 1, 2048]
    - [141, 26.548]
  - - [4096, 1024, 1, 4096]
    - [142, 30.074]
  - - [4096, 1024, 1, 8192]
    - [143, 30.985]
  - - [4096, 2048, 1, 128]
    - [144, 9.819]
  - - [4096, 2048, 1, 256]
    - [145, 14.519]
  - - [4096, 2048, 1, 512]
    - [146, 20.887]
  - - [4096, 2048, 1, 1024]
    - [147, 26.718]
  - - [4096, 2048, 1, 2048]
    - [148, 31.197]
  - - [4096, 2048, 1, 4096]
    - [149, 33.666]
  - - [4096, 2048, 1, 8192]
    - [113, 35.943]
  - - [4096, 4096, 1, 128]
    - [150, 11.655]
  - - [4096, 4096, 1, 256]
    - [151, 18.274]
  - - [4096, 4096, 1, 512]
    - [119, 25.971]
  - - [4096, 4096, 1, 1024]
    - [152, 32.293]
  - - [4096, 4096, 1, 2048]
    - [153, 36.148]
  - - [4096, 4096, 1, 4096]
    - [154, 39.664]
  - - [4096, 4096, 1, 8192]
    - [155, 42.154]
  - - [4096, 8192, 1, 128]
    - [99, 10.682]
  - - [4096, 8192, 1, 256]
    - [156, 15.258]
  - - [4096, 8192, 1, 512]
    - [157, 21.749]
  - - [4096, 8192, 1, 1024]
    - [158, 27.793]
  - - [4096, 8192, 1, 2048]
    - [159, 32.245]
  - - [4096, 8192, 1, 4096]
    - [160, 33.468]
  - - [4096, 8192, 1, 8192]
    - [161, 36.274]
  - - [8192, 128, 1, 128]
    - [162, 3.944]
  - - [8192, 128, 1, 256]
    - [128, 6.445]
  - - [8192, 128, 1, 512]
    - [163, 9.657]
  - - [8192, 128, 1, 1024]
    - [136, 11.396]
  - - [8192, 128, 1, 2048]
    - [164, 13.649]
  - - [8192, 128, 1, 4096]
    - [165, 15.556]
  - - [8192, 128, 1, 8192]
    - [68, 16.202]
  - - [8192, 256, 1, 128]
    - [166, 6.019]
  - - [8192, 256, 1, 256]
    - [167, 9.89]
  - - [8192, 256, 1, 512]
    - [81, 13.021]
  - - [8192, 256, 1, 1024]
    - [168, 17.451]
  - - [8192, 256, 1, 2048]
    - [169, 19.763]
  - - [8192, 256, 1, 4096]
    - [58, 21.345]
  - - [8192, 256, 1, 8192]
    - [170, 21.663]
  - - [8192, 512, 1, 128]
    - [171, 8.636]
  - - [8192, 512, 1, 256]
    - [172, 13.043]
  - - [8192, 512, 1, 512]
    - [173, 16.99]
  - - [8192, 512, 1, 1024]
    - [101, 21.023]
  - - [8192, 512, 1, 2048]
    - [81, 26.735]
  - - [8192, 512, 1, 4096]
    - [174, 30.517]
  - - [8192, 512, 1, 8192]
    - [81, 31.409]
  - - [8192, 1024, 1, 128]
    - [144, 9.956]
  - - [8192, 1024, 1, 256]
    - [175, 14.734]
  - - [8192, 1024, 1, 512]
    - [176, 20.079]
  - - [8192, 1024, 1, 1024]
    - [177, 26.354]
  - - [8192, 1024, 1, 2048]
    - [178, 32.211]
  - - [8192, 1024, 1, 4096]
    - [179, 34.402]
  - - [8192, 1024, 1, 8192]
    - [180, 36.437]
  - - [8192, 2048, 1, 128]
    - [181, 11.744]
  - - [8192, 2048, 1, 256]
    - [118, 18.003]
  - - [8192, 2048, 1, 512]
    - [182, 25.6]
  - - [8192, 2048, 1, 1024]
    - [182, 32.526]
  - - [8192, 2048, 1, 2048]
    - [183, 36.238]
  - - [8192, 2048, 1, 4096]
    - [184, 39.552]
  - - [8192, 2048, 1, 8192]
    - [183, 42.484]
  - - [8192, 4096, 1, 128]
    - [185, 10.59]
  - - [8192, 4096, 1, 256]
    - [174, 15.312]
  - - [8192, 4096, 1, 512]
    - [186, 22.152]
  - - [8192, 4096, 1, 1024]
    - [187, 28.062]
  - - [8192, 4096, 1, 2048]
    - [188, 32.435]
  - - [8192, 4096, 1, 4096]
    - [189, 34.317]
  - - [8192, 4096, 1, 8192]
    - [190, 36.734]
  - - [8192, 8192, 1, 128]
    - [191, 10.536]
  - - [8192, 8192, 1, 256]
    - [192, 16.366]
  - - [8192, 8192, 1, 512]
    - [192, 23.124]
  - - [8192, 8192, 1, 1024]
    - [193, 29.562]
  - - [8192, 8192, 1, 2048]
    - [123, 34.216]
  - - [8192, 8192, 1, 4096]
    - [194, 37.167]
  - - [8192, 8192, 1, 8192]
    - [183, 38.47]
- null
- null
- DeviceEfficiency
- GridBased
