library/src/amd_detail/rocblaslt/src/Tensile/Logic/streamk/gfx942a/aquavanjaram942_Cijk_Alik_Bljk_BBS_BH_UserArgs.yaml
- {MinimumRequiredVersion: 4.33.0}
- aquavanjaram942
- gfx942
- [Device 0049, Device 0050]
    SolutionIndex: 0
    SolutionNameMin: Cijk_Alik_Bljk_BBS_BH_UserArgs_MT128x128x32_MI16x16x1_SN_LDSB1_CLR1_GSU0_GSUC0_GSUWGMRR0_K1_LBSPPA128_LBSPPB128_MIWT4_4_PLR1_SU32_SUM0_SUS256_SKXCCM0_VWA2_VWB2_WGM4_WGMXCC1_WGMXCCGn1
    SolutionIndex: 1
    SolutionNameMin: Cijk_Alik_Bljk_BBS_BH_UserArgs_MT128x128x64_MI16x16x1_SN_LDSB1_CLR1_GSU0_GSUC0_GSUWGMRR0_K1_LBSPPA256_LBSPPB128_MIWT4_4_PLR1_SU32_SUM0_SUS256_SKXCCM0_VWA2_VWB1_WGM1_WGMXCC1_WGMXCCGn1
    SolutionIndex: 2
    SolutionNameMin: Cijk_Alik_Bljk_BBS_BH_UserArgs_MT128x128x64_MI16x16x1_SN_LDSB1_CLR1_GSU0_GSUC0_GSUWGMRR0_K1_LBSPPA512_LBSPPB128_MIWT4_4_PLR1_SU32_SUM0_SUS256_SKXCCM0_VWA4_VWB1_WGM1_WGMXCC1_WGMXCCGn1
    SolutionIndex: 3
    SolutionNameMin: Cijk_Alik_Bljk_BBS_BH_UserArgs_MT128x128x64_MI16x16x1_SN_LDSB1_CLR1_GSU0_GSUC0_GSUWGMRR0_K1_LBSPPA512_LBSPPB256_MIWT4_4_PLR1_SU32_SUM0_SUS256_SKXCCM0_VWA4_VWB2_WGM1_WGMXCC1_WGMXCCGn1
    SolutionIndex: 4
    SolutionNameMin: Cijk_Alik_Bljk_BBS_BH_UserArgs_MT128x128x64_MI16x16x1_SN_LDSB1_CLR1_GSU0_GSUC0_GSUWGMRR0_K1_LBSPPA512_LBSPPB256_MIWT4_4_PLR1_SU32_SUM0_SUS256_SKXCCM0_VWA4_VWB2_WGM4_WGMXCC1_WGMXCCGn1
    SolutionIndex: 5
    SolutionNameMin: Cijk_Alik_Bljk_BBS_BH_UserArgs_MT128x128x64_MI16x16x1_SN_LDSB1_CLR1_GSU0_GSUC0_GSUWGMRR0_K1_LBSPPA512_LBSPPB512_MIWT4_4_PLR1_SU32_SUM0_SUS256_SKXCCM0_VWA4_VWB4_WGM4_WGMXCC1_WGMXCCGn1
    SolutionIndex: 6
    SolutionNameMin: Cijk_Alik_Bljk_BBS_BH_UserArgs_MT64x128x64_MI16x16x1_SN_LDSB1_CLR1_GSU0_GSUC0_GSUWGMRR0_K1_LBSPPA256_LBSPPB128_MIWT2_4_PLR1_SU32_SUM0_SUS256_SKXCCM0_VWA2_VWB1_WGM1_WGMXCC1_WGMXCCGn1
    SolutionIndex: 7
    SolutionNameMin: Cijk_Alik_Bljk_BBS_BH_UserArgs_MT64x128x64_MI16x16x1_SN_LDSB1_CLR1_GSU0_GSUC0_GSUWGMRR0_K1_LBSPPA256_LBSPPB256_MIWT2_4_PLR1_SU32_SUM0_SUS256_SKXCCM0_VWA2_VWB2_WGM1_WGMXCC1_WGMXCCGn1
    SolutionIndex: 8
    SolutionNameMin: Cijk_Alik_Bljk_BBS_BH_UserArgs_MT64x128x64_MI16x16x1_SN_LDSB1_CLR1_GSU0_GSUC0_GSUWGMRR0_K1_LBSPPA256_LBSPPB512_MIWT2_4_PLR1_SU32_SUM0_SUS256_SKXCCM0_VWA2_VWB4_WGM1_WGMXCC1_WGMXCCGn1
    SolutionIndex: 9
    SolutionNameMin: Cijk_Alik_Bljk_BBS_BH_UserArgs_MT64x128x64_MI16x16x1_SN_LDSB1_CLR1_GSU0_GSUC0_GSUWGMRR0_K1_LBSPPA128_LBSPPB128_MIWT2_4_PLR1_SU32_SUM0_SUS256_SKXCCM0_VWA1_VWB1_WGM4_WGMXCC1_WGMXCCGn1
    SolutionIndex: 10
    SolutionNameMin: Cijk_Alik_Bljk_BBS_BH_UserArgs_MT64x128x64_MI16x16x1_SN_LDSB1_CLR1_GSU0_GSUC0_GSUWGMRR0_K1_LBSPPA256_LBSPPB128_MIWT2_4_PLR1_SU32_SUM0_SUS256_SKXCCM0_VWA2_VWB1_WGM4_WGMXCC1_WGMXCCGn1
    SolutionIndex: 11
    SolutionNameMin: Cijk_Alik_Bljk_BBS_BH_UserArgs_MT64x128x64_MI16x16x1_SN_LDSB1_CLR1_GSU0_GSUC0_GSUWGMRR0_K1_LBSPPA256_LBSPPB512_MIWT2_4_PLR1_SU32_SUM0_SUS256_SKXCCM0_VWA2_VWB4_WGM4_WGMXCC1_WGMXCCGn1
    SolutionIndex: 12
    SolutionNameMin: Cijk_Alik_Bljk_BBS_BH_UserArgs_MT64x128x64_MI16x16x1_SN_LDSB1_CLR1_GSU0_GSUC0_GSUWGMRR0_K1_LBSPPA256_LBSPPB256_MIWT2_4_PLR1_SU32_SUM0_SUS256_SKXCCM0_VWA2_VWB2_WGM8_WGMXCC1_WGMXCCGn1
    SolutionIndex: 13
    SolutionNameMin: Cijk_Alik_Bljk_BBS_BH_UserArgs_MT128x64x64_MI16x16x1_SN_LDSB1_CLR1_GSU0_GSUC0_GSUWGMRR0_K1_LBSPPA256_LBSPPB128_MIWT4_2_PLR1_SU32_SUM0_SUS256_SKXCCM0_VWA2_VWB1_WGM1_WGMXCC1_WGMXCCGn1
    SolutionIndex: 14
    SolutionNameMin: Cijk_Alik_Bljk_BBS_BH_UserArgs_MT128x64x64_MI16x16x1_SN_LDSB1_CLR1_GSU0_GSUC0_GSUWGMRR0_K1_LBSPPA512_LBSPPB128_MIWT4_2_PLR1_SU32_SUM0_SUS256_SKXCCM0_VWA4_VWB1_WGM1_WGMXCC1_WGMXCCGn1
    SolutionIndex: 15
    SolutionNameMin: Cijk_Alik_Bljk_BBS_BH_UserArgs_MT128x64x64_MI16x16x1_SN_LDSB1_CLR1_GSU0_GSUC0_GSUWGMRR0_K1_LBSPPA256_LBSPPB256_MIWT4_2_PLR1_SU32_SUM0_SUS256_SKXCCM0_VWA2_VWB2_WGM1_WGMXCC1_WGMXCCGn1
    SolutionIndex: 16
    SolutionNameMin: Cijk_Alik_Bljk_BBS_BH_UserArgs_MT128x64x64_MI16x16x1_SN_LDSB1_CLR1_GSU0_GSUC0_GSUWGMRR0_K1_LBSPPA256_LBSPPB128_MIWT4_2_PLR1_SU32_SUM0_SUS256_SKXCCM0_VWA2_VWB1_WGM8_WGMXCC1_WGMXCCGn1
    SolutionIndex: 17
    SolutionNameMin: Cijk_Alik_Bljk_BBS_BH_UserArgs_MT64x64x64_MI16x16x1_SN_LDSB1_CLR1_GSU0_GSUC0_GSUWGMRR0_K1_LBSPPA128_LBSPPB128_MIWT2_2_PLR1_SU32_SUM0_SUS256_SKXCCM0_VWA1_VWB1_WGM1_WGMXCC1_WGMXCCGn1
    SolutionIndex: 18
    SolutionNameMin: Cijk_Alik_Bljk_BBS_BH_UserArgs_MT64x64x64_MI16x16x1_SN_LDSB1_CLR1_GSU0_GSUC0_GSUWGMRR0_K1_LBSPPA256_LBSPPB128_MIWT2_2_PLR1_SU32_SUM0_SUS256_SKXCCM0_VWA2_VWB1_WGM1_WGMXCC1_WGMXCCGn1
    SolutionIndex: 19
    SolutionNameMin: Cijk_Alik_Bljk_BBS_BH_UserArgs_MT64x64x64_MI16x16x1_SN_LDSB1_CLR1_GSU0_GSUC0_GSUWGMRR0_K1_LBSPPA256_LBSPPB256_MIWT2_2_PLR1_SU32_SUM0_SUS256_SKXCCM0_VWA2_VWB2_WGM1_WGMXCC1_WGMXCCGn1
    SolutionIndex: 20
    SolutionNameMin: Cijk_Alik_Bljk_BBS_BH_UserArgs_MT64x64x64_MI16x16x1_SN_LDSB1_CLR1_GSU0_GSUC0_GSUWGMRR0_K1_LBSPPA256_LBSPPB128_MIWT2_2_PLR1_SU32_SUM0_SUS256_SKXCCM0_VWA2_VWB1_WGM4_WGMXCC1_WGMXCCGn1
    SolutionIndex: 21
    SolutionNameMin: Cijk_Alik_Bljk_BBS_BH_UserArgs_MT32x64x64_MI16x16x1_SN_LDSB0_CLR1_GSU0_GSUC0_GSUWGMRR0_K1_LBSPPA128_LBSPPB128_MIWT1_2_PLR1_SU32_SUM0_SUS256_SKXCCM0_VWA1_VWB1_WGM1_WGMXCC1_WGMXCCGn1
    SolutionIndex: 22
    SolutionNameMin: Cijk_Alik_Bljk_BBS_BH_UserArgs_MT32x64x64_MI16x16x1_SN_LDSB0_CLR1_GSU0_GSUC0_GSUWGMRR0_K1_LBSPPA128_LBSPPB256_MIWT1_2_PLR1_SU32_SUM0_SUS256_SKXCCM0_VWA1_VWB2_WGM1_WGMXCC1_WGMXCCGn1
    SolutionIndex: 23
    SolutionNameMin: Cijk_Alik_Bljk_BBS_BH_UserArgs_MT64x32x64_MI16x16x1_SN_LDSB0_CLR1_GSU0_GSUC0_GSUWGMRR0_K1_LBSPPA128_LBSPPB128_MIWT2_1_PLR1_SU32_SUM0_SUS256_SKXCCM0_VWA1_VWB1_WGM1_WGMXCC1_WGMXCCGn1
    SolutionIndex: 24
    SolutionNameMin: Cijk_Alik_Bljk_BBS_BH_UserArgs_MT64x32x64_MI16x16x1_SN_LDSB0_CLR1_GSU0_GSUC0_GSUWGMRR0_K1_LBSPPA256_LBSPPB128_MIWT2_1_PLR1_SU32_SUM0_SUS256_SKXCCM0_VWA2_VWB1_WGM1_WGMXCC1_WGMXCCGn1
    SolutionIndex: 25
    SolutionNameMin: Cijk_Alik_Bljk_BBS_BH_UserArgs_MT64x32x64_MI16x16x1_SN_LDSB0_CLR1_GSU0_GSUC0_GSUWGMRR0_K1_LBSPPA256_LBSPPB128_MIWT2_1_PLR2_SU32_SUM0_SUS256_SKXCCM0_VWA2_VWB1_WGM1_WGMXCC1_WGMXCCGn1
    SolutionIndex: 26
    SolutionNameMin: Cijk_Alik_Bljk_BBS_BH_UserArgs_MT32x64x128_MI16x16x1_SN_LDSB1_CLR1_GSU0_GSUC0_GSUWGMRR0_K1_LBSPPA256_LBSPPB512_MIWT1_2_PLR1_SU32_SUM0_SUS256_SKXCCM0_VWA1_VWB2_WGM1_WGMXCC1_WGMXCCGn1
    SolutionIndex: 27
    SolutionNameMin: Cijk_Alik_Bljk_BBS_BH_UserArgs_MT64x32x128_MI16x16x1_SN_LDSB1_CLR1_GSU0_GSUC0_GSUWGMRR0_K1_LBSPPA512_LBSPPB256_MIWT2_1_PLR2_SU32_SUM0_SUS256_SKXCCM0_VWA2_VWB1_WGM1_WGMXCC1_WGMXCCGn1
    SolutionIndex: 28
    SolutionNameMin: Cijk_Alik_Bljk_BBS_BH_UserArgs_MT32x32x128_MI16x16x1_SN_LDSB1_CLR1_GSU0_GSUC0_GSUWGMRR0_K1_LBSPPA256_LBSPPB256_MIWT1_1_PLR1_SU32_SUM0_SUS256_SKXCCM0_VWA1_VWB1_WGM1_WGMXCC1_WGMXCCGn1
    SolutionIndex: 29
    SolutionNameMin: Cijk_Alik_Bljk_BBS_BH_UserArgs_MT32x32x128_MI16x16x1_SN_LDSB1_CLR1_GSU0_GSUC0_GSUWGMRR0_K1_LBSPPA256_LBSPPB256_MIWT1_1_PLR2_SU32_SUM0_SUS256_SKXCCM0_VWA1_VWB1_WGM1_WGMXCC1_WGMXCCGn1
    SolutionIndex: 30
    SolutionNameMin: Cijk_Alik_Bljk_BBS_BH_UserArgs_MT32x32x128_MI16x16x1_SN_LDSB1_CLR1_GSU0_GSUC0_GSUWGMRR0_K1_LBSPPA256_LBSPPB256_MIWT1_1_PLR1_SU32_SUM0_SUS256_SKXCCM0_VWA1_VWB1_WGM8_WGMXCC1_WGMXCCGn1
    SolutionIndex: 31
    SolutionNameMin: Cijk_Alik_Bljk_BBS_BH_UserArgs_MT128x128x32_MI16x16x1_SN_LDSB1_CLR1_GSU0_GSUC0_GSUWGMRR0_K1_LBSPPA128_LBSPPB128_MIWT4_4_PLR1_SU32_SUM0_SUS256_SKXCCM6_VWA2_VWB2_WGM1_WGMXCC1_WGMXCCGn1
    SolutionIndex: 32
    SolutionNameMin: Cijk_Alik_Bljk_BBS_BH_UserArgs_MT128x128x32_MI16x16x1_SN_LDSB1_CLR1_GSU0_GSUC0_GSUWGMRR0_K1_LBSPPA128_LBSPPB256_MIWT4_4_PLR1_SU32_SUM0_SUS256_SKXCCM6_VWA2_VWB4_WGM1_WGMXCC1_WGMXCCGn1
    SolutionIndex: 33
    SolutionNameMin: Cijk_Alik_Bljk_BBS_BH_UserArgs_MT128x128x32_MI16x16x1_SN_LDSB1_CLR1_GSU0_GSUC0_GSUWGMRR0_K1_LBSPPA128_LBSPPB128_MIWT4_4_PLR1_SU32_SUM0_SUS256_SKXCCM6_VWA2_VWB1_WGM4_WGMXCC1_WGMXCCGn1
    SolutionIndex: 34
    SolutionNameMin: Cijk_Alik_Bljk_BBS_BH_UserArgs_MT128x128x32_MI16x16x1_SN_LDSB1_CLR1_GSU0_GSUC0_GSUWGMRR0_K1_LBSPPA128_LBSPPB128_MIWT4_4_PLR1_SU32_SUM0_SUS256_SKXCCM6_VWA2_VWB2_WGM4_WGMXCC1_WGMXCCGn1
    SolutionIndex: 35
    SolutionNameMin: Cijk_Alik_Bljk_BBS_BH_UserArgs_MT128x128x32_MI16x16x1_SN_LDSB1_CLR1_GSU0_GSUC0_GSUWGMRR0_K1_LBSPPA128_LBSPPB256_MIWT4_4_PLR1_SU32_SUM0_SUS256_SKXCCM6_VWA2_VWB4_WGM4_WGMXCC1_WGMXCCGn1
    SolutionIndex: 36
    SolutionNameMin: Cijk_Alik_Bljk_BBS_BH_UserArgs_MT128x128x32_MI16x16x1_SN_LDSB1_CLR1_GSU0_GSUC0_GSUWGMRR0_K1_LBSPPA128_LBSPPB128_MIWT4_4_PLR1_SU32_SUM0_SUS256_SKXCCM6_VWA2_VWB2_WGM8_WGMXCC1_WGMXCCGn1
    SolutionIndex: 37
    SolutionNameMin: Cijk_Alik_Bljk_BBS_BH_UserArgs_MT32x32x32_MI16x16x1_SN_LDSB0_CLR1_GSU0_GSUC0_GSUWGMRR0_K1_LBSPPA128_LBSPPB128_MIWT1_1_PLR1_SU32_SUM0_SUS256_SKXCCM6_VWA1_VWB1_WGM1_WGMXCC1_WGMXCCGn1
    SolutionIndex: 38
    SolutionNameMin: Cijk_Alik_Bljk_BBS_BH_UserArgs_MT32x32x32_MI16x16x1_SN_LDSB0_CLR0_GSU0_GSUC0_GSUWGMRR0_K1_LBSPPA128_LBSPPB128_MIWT1_1_PLR0_SU32_SUM0_SUS256_SKXCCM6_VWA1_VWB1_WGM1_WGMXCC1_WGMXCCGn1
    SolutionIndex: 39
    SolutionNameMin: Cijk_Alik_Bljk_BBS_BH_UserArgs_MT256x64x64_MI16x16x1_SN_LDSB1_CLR1_GSU0_GSUC0_GSUWGMRR0_K1_LBSPPA512_LBSPPB128_MIWT8_2_PLR1_SU32_SUM0_SUS256_SKXCCM6_VWA4_VWB1_WGM8_WGMXCC1_WGMXCCGn1
    SolutionIndex: 40
    SolutionNameMin: Cijk_Alik_Bljk_BBS_BH_UserArgs_MT128x128x64_MI16x16x1_SN_LDSB1_CLR1_GSU0_GSUC0_GSUWGMRR0_K1_LBSPPA128_LBSPPB128_MIWT4_4_PLR1_SU32_SUM0_SUS256_SKXCCM6_VWA1_VWB1_WGM1_WGMXCC1_WGMXCCGn1
    SolutionIndex: 41
    SolutionNameMin: Cijk_Alik_Bljk_BBS_BH_UserArgs_MT128x128x64_MI16x16x1_SN_LDSB1_CLR1_GSU0_GSUC0_GSUWGMRR0_K1_LBSPPA256_LBSPPB128_MIWT4_4_PLR1_SU32_SUM0_SUS256_SKXCCM6_VWA2_VWB1_WGM1_WGMXCC1_WGMXCCGn1
    SolutionIndex: 42
    SolutionNameMin: Cijk_Alik_Bljk_BBS_BH_UserArgs_MT128x128x64_MI16x16x1_SN_LDSB1_CLR1_GSU0_GSUC0_GSUWGMRR0_K1_LBSPPA512_LBSPPB128_MIWT4_4_PLR1_SU32_SUM0_SUS256_SKXCCM6_VWA4_VWB1_WGM1_WGMXCC1_WGMXCCGn1
    SolutionIndex: 43
    SolutionNameMin: Cijk_Alik_Bljk_BBS_BH_UserArgs_MT128x128x64_MI16x16x1_SN_LDSB1_CLR1_GSU0_GSUC0_GSUWGMRR0_K1_LBSPPA256_LBSPPB256_MIWT4_4_PLR1_SU32_SUM0_SUS256_SKXCCM6_VWA2_VWB2_WGM1_WGMXCC1_WGMXCCGn1
    SolutionIndex: 44
    SolutionNameMin: Cijk_Alik_Bljk_BBS_BH_UserArgs_MT128x128x64_MI16x16x1_SN_LDSB1_CLR1_GSU0_GSUC0_GSUWGMRR0_K1_LBSPPA512_LBSPPB256_MIWT4_4_PLR1_SU32_SUM0_SUS256_SKXCCM6_VWA4_VWB2_WGM1_WGMXCC1_WGMXCCGn1
    SolutionIndex: 45
    SolutionNameMin: Cijk_Alik_Bljk_BBS_BH_UserArgs_MT128x128x64_MI16x16x1_SN_LDSB1_CLR1_GSU0_GSUC0_GSUWGMRR0_K1_LBSPPA128_LBSPPB512_MIWT4_4_PLR1_SU32_SUM0_SUS256_SKXCCM6_VWA1_VWB4_WGM1_WGMXCC1_WGMXCCGn1
    SolutionIndex: 46
    SolutionNameMin: Cijk_Alik_Bljk_BBS_BH_UserArgs_MT128x128x64_MI16x16x1_SN_LDSB1_CLR1_GSU0_GSUC0_GSUWGMRR0_K1_LBSPPA512_LBSPPB512_MIWT4_4_PLR1_SU32_SUM0_SUS256_SKXCCM6_VWA4_VWB4_WGM1_WGMXCC1_WGMXCCGn1
    SolutionIndex: 47
    SolutionNameMin: Cijk_Alik_Bljk_BBS_BH_UserArgs_MT128x128x64_MI16x16x1_SN_LDSB1_CLR1_GSU0_GSUC0_GSUWGMRR0_K1_LBSPPA512_LBSPPB128_MIWT4_4_PLR1_SU32_SUM0_SUS256_SKXCCM6_VWA4_VWB1_WGM4_WGMXCC1_WGMXCCGn1
    SolutionIndex: 48
    SolutionNameMin: Cijk_Alik_Bljk_BBS_BH_UserArgs_MT128x128x64_MI16x16x1_SN_LDSB1_CLR1_GSU0_GSUC0_GSUWGMRR0_K1_LBSPPA256_LBSPPB256_MIWT4_4_PLR1_SU32_SUM0_SUS256_SKXCCM6_VWA2_VWB2_WGM4_WGMXCC1_WGMXCCGn1
    SolutionIndex: 49
    SolutionNameMin: Cijk_Alik_Bljk_BBS_BH_UserArgs_MT128x128x64_MI16x16x1_SN_LDSB1_CLR1_GSU0_GSUC0_GSUWGMRR0_K1_LBSPPA512_LBSPPB256_MIWT4_4_PLR1_SU32_SUM0_SUS256_SKXCCM6_VWA4_VWB2_WGM4_WGMXCC1_WGMXCCGn1
    SolutionIndex: 50
    SolutionNameMin: Cijk_Alik_Bljk_BBS_BH_UserArgs_MT128x128x64_MI16x16x1_SN_LDSB1_CLR1_GSU0_GSUC0_GSUWGMRR0_K1_LBSPPA128_LBSPPB512_MIWT4_4_PLR1_SU32_SUM0_SUS256_SKXCCM6_VWA1_VWB4_WGM4_WGMXCC1_WGMXCCGn1
    SolutionIndex: 51
    SolutionNameMin: Cijk_Alik_Bljk_BBS_BH_UserArgs_MT128x128x64_MI16x16x1_SN_LDSB1_CLR1_GSU0_GSUC0_GSUWGMRR0_K1_LBSPPA512_LBSPPB512_MIWT4_4_PLR1_SU32_SUM0_SUS256_SKXCCM6_VWA4_VWB4_WGM4_WGMXCC1_WGMXCCGn1
    SolutionIndex: 52
    SolutionNameMin: Cijk_Alik_Bljk_BBS_BH_UserArgs_MT128x128x64_MI16x16x1_SN_LDSB1_CLR1_GSU0_GSUC0_GSUWGMRR0_K1_LBSPPA256_LBSPPB128_MIWT4_4_PLR1_SU32_SUM0_SUS256_SKXCCM6_VWA2_VWB1_WGM8_WGMXCC1_WGMXCCGn1
    SolutionIndex: 53
    SolutionNameMin: Cijk_Alik_Bljk_BBS_BH_UserArgs_MT128x128x64_MI16x16x1_SN_LDSB1_CLR1_GSU0_GSUC0_GSUWGMRR0_K1_LBSPPA512_LBSPPB128_MIWT4_4_PLR1_SU32_SUM0_SUS256_SKXCCM6_VWA4_VWB1_WGM8_WGMXCC1_WGMXCCGn1
    SolutionIndex: 54
    SolutionNameMin: Cijk_Alik_Bljk_BBS_BH_UserArgs_MT128x128x64_MI16x16x1_SN_LDSB1_CLR1_GSU0_GSUC0_GSUWGMRR0_K1_LBSPPA512_LBSPPB256_MIWT4_4_PLR1_SU32_SUM0_SUS256_SKXCCM6_VWA4_VWB2_WGM8_WGMXCC1_WGMXCCGn1
    SolutionIndex: 55
    SolutionNameMin: Cijk_Alik_Bljk_BBS_BH_UserArgs_MT128x128x64_MI16x16x1_SN_LDSB1_CLR1_GSU0_GSUC0_GSUWGMRR0_K1_LBSPPA256_LBSPPB512_MIWT4_4_PLR1_SU32_SUM0_SUS256_SKXCCM6_VWA2_VWB4_WGM8_WGMXCC1_WGMXCCGn1
    SolutionIndex: 56
    SolutionNameMin: Cijk_Alik_Bljk_BBS_BH_UserArgs_MT128x128x64_MI16x16x1_SN_LDSB1_CLR1_GSU0_GSUC0_GSUWGMRR0_K1_LBSPPA512_LBSPPB512_MIWT4_4_PLR1_SU32_SUM0_SUS256_SKXCCM6_VWA4_VWB4_WGM8_WGMXCC1_WGMXCCGn1
    SolutionIndex: 57
    SolutionNameMin: Cijk_Alik_Bljk_BBS_BH_UserArgs_MT64x128x64_MI16x16x1_SN_LDSB1_CLR1_GSU0_GSUC0_GSUWGMRR0_K1_LBSPPA256_LBSPPB128_MIWT2_4_PLR1_SU32_SUM0_SUS256_SKXCCM6_VWA2_VWB1_WGM1_WGMXCC1_WGMXCCGn1
    SolutionIndex: 58
    SolutionNameMin: Cijk_Alik_Bljk_BBS_BH_UserArgs_MT64x128x64_MI16x16x1_SN_LDSB1_CLR1_GSU0_GSUC0_GSUWGMRR0_K1_LBSPPA256_LBSPPB256_MIWT2_4_PLR1_SU32_SUM0_SUS256_SKXCCM6_VWA2_VWB2_WGM1_WGMXCC1_WGMXCCGn1
    SolutionIndex: 59
    SolutionNameMin: Cijk_Alik_Bljk_BBS_BH_UserArgs_MT64x128x64_MI16x16x1_SN_LDSB1_CLR1_GSU0_GSUC0_GSUWGMRR0_K1_LBSPPA256_LBSPPB512_MIWT2_4_PLR1_SU32_SUM0_SUS256_SKXCCM6_VWA2_VWB4_WGM1_WGMXCC1_WGMXCCGn1
    SolutionIndex: 60
    SolutionNameMin: Cijk_Alik_Bljk_BBS_BH_UserArgs_MT64x128x64_MI16x16x1_SN_LDSB1_CLR1_GSU0_GSUC0_GSUWGMRR0_K1_LBSPPA256_LBSPPB512_MIWT2_4_PLR2_SU32_SUM0_SUS256_SKXCCM6_VWA2_VWB4_WGM1_WGMXCC1_WGMXCCGn1
    SolutionIndex: 61
    SolutionNameMin: Cijk_Alik_Bljk_BBS_BH_UserArgs_MT64x128x64_MI16x16x1_SN_LDSB1_CLR1_GSU0_GSUC0_GSUWGMRR0_K1_LBSPPA256_LBSPPB256_MIWT2_4_PLR1_SU32_SUM0_SUS256_SKXCCM6_VWA2_VWB2_WGM4_WGMXCC1_WGMXCCGn1
    SolutionIndex: 62
    SolutionNameMin: Cijk_Alik_Bljk_BBS_BH_UserArgs_MT64x128x64_MI16x16x1_SN_LDSB1_CLR1_GSU0_GSUC0_GSUWGMRR0_K1_LBSPPA256_LBSPPB128_MIWT2_4_PLR1_SU32_SUM0_SUS256_SKXCCM6_VWA2_VWB1_WGM8_WGMXCC1_WGMXCCGn1
    SolutionIndex: 63
    SolutionNameMin: Cijk_Alik_Bljk_BBS_BH_UserArgs_MT64x128x64_MI16x16x1_SN_LDSB1_CLR1_GSU0_GSUC0_GSUWGMRR0_K1_LBSPPA256_LBSPPB256_MIWT2_4_PLR1_SU32_SUM0_SUS256_SKXCCM6_VWA2_VWB2_WGM8_WGMXCC1_WGMXCCGn1
    SolutionIndex: 64
    SolutionNameMin: Cijk_Alik_Bljk_BBS_BH_UserArgs_MT64x128x64_MI16x16x1_SN_LDSB1_CLR1_GSU0_GSUC0_GSUWGMRR0_K1_LBSPPA256_LBSPPB512_MIWT2_4_PLR1_SU32_SUM0_SUS256_SKXCCM6_VWA2_VWB4_WGM8_WGMXCC1_WGMXCCGn1
    SolutionIndex: 65
    SolutionNameMin: Cijk_Alik_Bljk_BBS_BH_UserArgs_MT128x64x64_MI16x16x1_SN_LDSB1_CLR1_GSU0_GSUC0_GSUWGMRR0_K1_LBSPPA256_LBSPPB128_MIWT4_2_PLR1_SU32_SUM0_SUS256_SKXCCM6_VWA2_VWB1_WGM1_WGMXCC1_WGMXCCGn1
    SolutionIndex: 66
    SolutionNameMin: Cijk_Alik_Bljk_BBS_BH_UserArgs_MT128x64x64_MI16x16x1_SN_LDSB1_CLR1_GSU0_GSUC0_GSUWGMRR0_K1_LBSPPA512_LBSPPB128_MIWT4_2_PLR1_SU32_SUM0_SUS256_SKXCCM6_VWA4_VWB1_WGM1_WGMXCC1_WGMXCCGn1
    SolutionIndex: 67
    SolutionNameMin: Cijk_Alik_Bljk_BBS_BH_UserArgs_MT128x64x64_MI16x16x1_SN_LDSB1_CLR1_GSU0_GSUC0_GSUWGMRR0_K1_LBSPPA256_LBSPPB256_MIWT4_2_PLR1_SU32_SUM0_SUS256_SKXCCM6_VWA2_VWB2_WGM1_WGMXCC1_WGMXCCGn1
    SolutionIndex: 68
    SolutionNameMin: Cijk_Alik_Bljk_BBS_BH_UserArgs_MT128x64x64_MI16x16x1_SN_LDSB1_CLR1_GSU0_GSUC0_GSUWGMRR0_K1_LBSPPA512_LBSPPB256_MIWT4_2_PLR1_SU32_SUM0_SUS256_SKXCCM6_VWA4_VWB2_WGM1_WGMXCC1_WGMXCCGn1
    SolutionIndex: 69
    SolutionNameMin: Cijk_Alik_Bljk_BBS_BH_UserArgs_MT128x64x64_MI16x16x1_SN_LDSB1_CLR1_GSU0_GSUC0_GSUWGMRR0_K1_LBSPPA512_LBSPPB128_MIWT4_2_PLR2_SU32_SUM0_SUS256_SKXCCM6_VWA4_VWB1_WGM1_WGMXCC1_WGMXCCGn1
    SolutionIndex: 70
    SolutionNameMin: Cijk_Alik_Bljk_BBS_BH_UserArgs_MT128x64x64_MI16x16x1_SN_LDSB1_CLR1_GSU0_GSUC0_GSUWGMRR0_K1_LBSPPA256_LBSPPB128_MIWT4_2_PLR1_SU32_SUM0_SUS256_SKXCCM6_VWA2_VWB1_WGM4_WGMXCC1_WGMXCCGn1
    SolutionIndex: 71
    SolutionNameMin: Cijk_Alik_Bljk_BBS_BH_UserArgs_MT128x64x64_MI16x16x1_SN_LDSB1_CLR1_GSU0_GSUC0_GSUWGMRR0_K1_LBSPPA512_LBSPPB256_MIWT4_2_PLR1_SU32_SUM0_SUS256_SKXCCM6_VWA4_VWB2_WGM4_WGMXCC1_WGMXCCGn1
    SolutionIndex: 72
    SolutionNameMin: Cijk_Alik_Bljk_BBS_BH_UserArgs_MT128x64x64_MI16x16x1_SN_LDSB1_CLR1_GSU0_GSUC0_GSUWGMRR0_K1_LBSPPA256_LBSPPB128_MIWT4_2_PLR1_SU32_SUM0_SUS256_SKXCCM6_VWA2_VWB1_WGM8_WGMXCC1_WGMXCCGn1
    SolutionIndex: 73
    SolutionNameMin: Cijk_Alik_Bljk_BBS_BH_UserArgs_MT128x64x64_MI16x16x1_SN_LDSB1_CLR1_GSU0_GSUC0_GSUWGMRR0_K1_LBSPPA512_LBSPPB128_MIWT4_2_PLR1_SU32_SUM0_SUS256_SKXCCM6_VWA4_VWB1_WGM8_WGMXCC1_WGMXCCGn1
    SolutionIndex: 74
    SolutionNameMin: Cijk_Alik_Bljk_BBS_BH_UserArgs_MT128x64x64_MI16x16x1_SN_LDSB1_CLR1_GSU0_GSUC0_GSUWGMRR0_K1_LBSPPA256_LBSPPB256_MIWT4_2_PLR1_SU32_SUM0_SUS256_SKXCCM6_VWA2_VWB2_WGM8_WGMXCC1_WGMXCCGn1
    SolutionIndex: 75
    SolutionNameMin: Cijk_Alik_Bljk_BBS_BH_UserArgs_MT128x64x64_MI16x16x1_SN_LDSB1_CLR1_GSU0_GSUC0_GSUWGMRR0_K1_LBSPPA512_LBSPPB256_MIWT4_2_PLR1_SU32_SUM0_SUS256_SKXCCM6_VWA4_VWB2_WGM8_WGMXCC1_WGMXCCGn1
    SolutionIndex: 76
    SolutionNameMin: Cijk_Alik_Bljk_BBS_BH_UserArgs_MT64x64x64_MI16x16x1_SN_LDSB1_CLR1_GSU0_GSUC0_GSUWGMRR0_K1_LBSPPA256_LBSPPB128_MIWT2_2_PLR1_SU32_SUM0_SUS256_SKXCCM6_VWA2_VWB1_WGM1_WGMXCC1_WGMXCCGn1
    SolutionIndex: 77
    SolutionNameMin: Cijk_Alik_Bljk_BBS_BH_UserArgs_MT64x64x64_MI16x16x1_SN_LDSB1_CLR1_GSU0_GSUC0_GSUWGMRR0_K1_LBSPPA256_LBSPPB256_MIWT2_2_PLR1_SU32_SUM0_SUS256_SKXCCM6_VWA2_VWB2_WGM1_WGMXCC1_WGMXCCGn1
    SolutionIndex: 78
    SolutionNameMin: Cijk_Alik_Bljk_BBS_BH_UserArgs_MT64x64x64_MI16x16x1_SN_LDSB1_CLR1_GSU0_GSUC0_GSUWGMRR0_K1_LBSPPA256_LBSPPB128_MIWT2_2_PLR2_SU32_SUM0_SUS256_SKXCCM6_VWA2_VWB1_WGM1_WGMXCC1_WGMXCCGn1
    SolutionIndex: 79
    SolutionNameMin: Cijk_Alik_Bljk_BBS_BH_UserArgs_MT64x64x64_MI16x16x1_SN_LDSB1_CLR1_GSU0_GSUC0_GSUWGMRR0_K1_LBSPPA256_LBSPPB128_MIWT2_2_PLR1_SU32_SUM0_SUS256_SKXCCM6_VWA2_VWB1_WGM4_WGMXCC1_WGMXCCGn1
    SolutionIndex: 80
    SolutionNameMin: Cijk_Alik_Bljk_BBS_BH_UserArgs_MT64x64x64_MI16x16x1_SN_LDSB1_CLR1_GSU0_GSUC0_GSUWGMRR0_K1_LBSPPA256_LBSPPB256_MIWT2_2_PLR1_SU32_SUM0_SUS256_SKXCCM6_VWA2_VWB2_WGM4_WGMXCC1_WGMXCCGn1
    SolutionIndex: 81
    SolutionNameMin: Cijk_Alik_Bljk_BBS_BH_UserArgs_MT64x64x64_MI16x16x1_SN_LDSB1_CLR1_GSU0_GSUC0_GSUWGMRR0_K1_LBSPPA256_LBSPPB128_MIWT2_2_PLR2_SU32_SUM0_SUS256_SKXCCM6_VWA2_VWB1_WGM4_WGMXCC1_WGMXCCGn1
    SolutionIndex: 82
    SolutionNameMin: Cijk_Alik_Bljk_BBS_BH_UserArgs_MT64x64x64_MI16x16x1_SN_LDSB1_CLR1_GSU0_GSUC0_GSUWGMRR0_K1_LBSPPA256_LBSPPB128_MIWT2_2_PLR1_SU32_SUM0_SUS256_SKXCCM6_VWA2_VWB1_WGM8_WGMXCC1_WGMXCCGn1
    SolutionIndex: 83
    SolutionNameMin: Cijk_Alik_Bljk_BBS_BH_UserArgs_MT64x64x64_MI16x16x1_SN_LDSB1_CLR1_GSU0_GSUC0_GSUWGMRR0_K1_LBSPPA256_LBSPPB256_MIWT2_2_PLR2_SU32_SUM0_SUS256_SKXCCM6_VWA2_VWB2_WGM8_WGMXCC1_WGMXCCGn1
    SolutionIndex: 84
    SolutionNameMin: Cijk_Alik_Bljk_BBS_BH_UserArgs_MT32x64x64_MI16x16x1_SN_LDSB0_CLR1_GSU0_GSUC0_GSUWGMRR0_K1_LBSPPA128_LBSPPB128_MIWT1_2_PLR1_SU32_SUM0_SUS256_SKXCCM6_VWA1_VWB1_WGM1_WGMXCC1_WGMXCCGn1
    SolutionIndex: 85
    SolutionNameMin: Cijk_Alik_Bljk_BBS_BH_UserArgs_MT32x64x64_MI16x16x1_SN_LDSB0_CLR1_GSU0_GSUC0_GSUWGMRR0_K1_LBSPPA128_LBSPPB256_MIWT1_2_PLR1_SU32_SUM0_SUS256_SKXCCM6_VWA1_VWB2_WGM1_WGMXCC1_WGMXCCGn1
    SolutionIndex: 86
    SolutionNameMin: Cijk_Alik_Bljk_BBS_BH_UserArgs_MT32x64x64_MI16x16x1_SN_LDSB0_CLR1_GSU0_GSUC0_GSUWGMRR0_K1_LBSPPA128_LBSPPB128_MIWT1_2_PLR1_SU32_SUM0_SUS256_SKXCCM6_VWA1_VWB1_WGM4_WGMXCC1_WGMXCCGn1
    SolutionIndex: 87
    SolutionNameMin: Cijk_Alik_Bljk_BBS_BH_UserArgs_MT32x64x64_MI16x16x1_SN_LDSB0_CLR1_GSU0_GSUC0_GSUWGMRR0_K1_LBSPPA128_LBSPPB128_MIWT1_2_PLR1_SU32_SUM0_SUS256_SKXCCM6_VWA1_VWB1_WGM8_WGMXCC1_WGMXCCGn1
    SolutionIndex: 88
    SolutionNameMin: Cijk_Alik_Bljk_BBS_BH_UserArgs_MT32x64x64_MI16x16x1_SN_LDSB0_CLR1_GSU0_GSUC0_GSUWGMRR0_K1_LBSPPA128_LBSPPB256_MIWT1_2_PLR1_SU32_SUM0_SUS256_SKXCCM6_VWA1_VWB2_WGM8_WGMXCC1_WGMXCCGn1
    SolutionIndex: 89
    SolutionNameMin: Cijk_Alik_Bljk_BBS_BH_UserArgs_MT32x32x64_MI16x16x1_SN_LDSB0_CLR1_GSU0_GSUC0_GSUWGMRR0_K1_LBSPPA128_LBSPPB128_MIWT1_1_PLR1_SU32_SUM0_SUS256_SKXCCM6_VWA1_VWB1_WGM1_WGMXCC1_WGMXCCGn1
    SolutionIndex: 90
    SolutionNameMin: Cijk_Alik_Bljk_BBS_BH_UserArgs_MT64x64x128_MI16x16x1_SN_LDSB1_CLR1_GSU0_GSUC0_GSUWGMRR0_K1_LBSPPA256_LBSPPB256_MIWT2_2_PLR2_SU32_SUM0_SUS256_SKXCCM6_VWA1_VWB1_WGM1_WGMXCC1_WGMXCCGn1
    SolutionIndex: 91
    SolutionNameMin: Cijk_Alik_Bljk_BBS_BH_UserArgs_MT64x64x128_MI16x16x1_SN_LDSB1_CLR1_GSU0_GSUC0_GSUWGMRR0_K1_LBSPPA256_LBSPPB512_MIWT2_2_PLR1_SU32_SUM0_SUS256_SKXCCM6_VWA1_VWB2_WGM8_WGMXCC1_WGMXCCGn1
    SolutionIndex: 92
    SolutionNameMin: Cijk_Alik_Bljk_BBS_BH_UserArgs_MT32x64x128_MI16x16x1_SN_LDSB1_CLR1_GSU0_GSUC0_GSUWGMRR0_K1_LBSPPA256_LBSPPB256_MIWT1_2_PLR1_SU32_SUM0_SUS256_SKXCCM6_VWA1_VWB1_WGM1_WGMXCC1_WGMXCCGn1
    SolutionIndex: 93
    SolutionNameMin: Cijk_Alik_Bljk_BBS_BH_UserArgs_MT32x64x128_MI16x16x1_SN_LDSB1_CLR1_GSU0_GSUC0_GSUWGMRR0_K1_LBSPPA256_LBSPPB512_MIWT1_2_PLR1_SU32_SUM0_SUS256_SKXCCM6_VWA1_VWB2_WGM1_WGMXCC1_WGMXCCGn1
    SolutionIndex: 94
    SolutionNameMin: Cijk_Alik_Bljk_BBS_BH_UserArgs_MT32x64x128_MI16x16x1_SN_LDSB1_CLR1_GSU0_GSUC0_GSUWGMRR0_K1_LBSPPA256_LBSPPB512_MIWT1_2_PLR1_SU32_SUM0_SUS256_SKXCCM6_VWA1_VWB2_WGM4_WGMXCC1_WGMXCCGn1
    SolutionIndex: 95
    SolutionNameMin: Cijk_Alik_Bljk_BBS_BH_UserArgs_MT32x64x128_MI16x16x1_SN_LDSB1_CLR1_GSU0_GSUC0_GSUWGMRR0_K1_LBSPPA256_LBSPPB256_MIWT1_2_PLR1_SU32_SUM0_SUS256_SKXCCM6_VWA1_VWB1_WGM8_WGMXCC1_WGMXCCGn1
    SolutionIndex: 96
    SolutionNameMin: Cijk_Alik_Bljk_BBS_BH_UserArgs_MT64x32x128_MI16x16x1_SN_LDSB1_CLR1_GSU0_GSUC0_GSUWGMRR0_K1_LBSPPA256_LBSPPB256_MIWT2_1_PLR2_SU32_SUM0_SUS256_SKXCCM6_VWA1_VWB1_WGM1_WGMXCC1_WGMXCCGn1
    SolutionIndex: 97
    SolutionNameMin: Cijk_Alik_Bljk_BBS_BH_UserArgs_MT64x32x128_MI16x16x1_SN_LDSB1_CLR1_GSU0_GSUC0_GSUWGMRR0_K1_LBSPPA512_LBSPPB256_MIWT2_1_PLR2_SU32_SUM0_SUS256_SKXCCM6_VWA2_VWB1_WGM8_WGMXCC1_WGMXCCGn1
    SolutionIndex: 98
    SolutionNameMin: Cijk_Alik_Bljk_BBS_BH_UserArgs_MT32x32x128_MI16x16x1_SN_LDSB1_CLR1_GSU0_GSUC0_GSUWGMRR0_K1_LBSPPA256_LBSPPB256_MIWT1_1_PLR1_SU32_SUM0_SUS256_SKXCCM6_VWA1_VWB1_WGM1_WGMXCC1_WGMXCCGn1
    SolutionIndex: 99
    SolutionNameMin: Cijk_Alik_Bljk_BBS_BH_UserArgs_MT32x32x128_MI16x16x1_SN_LDSB1_CLR1_GSU0_GSUC0_GSUWGMRR0_K1_LBSPPA256_LBSPPB256_MIWT1_1_PLR2_SU32_SUM0_SUS256_SKXCCM6_VWA1_VWB1_WGM1_WGMXCC1_WGMXCCGn1
    SolutionIndex: 100
    SolutionNameMin: Cijk_Alik_Bljk_BBS_BH_UserArgs_MT32x32x128_MI16x16x1_SN_LDSB1_CLR1_GSU0_GSUC0_GSUWGMRR0_K1_LBSPPA256_LBSPPB256_MIWT1_1_PLR1_SU32_SUM0_SUS256_SKXCCM6_VWA1_VWB1_WGM4_WGMXCC1_WGMXCCGn1
    SolutionIndex: 101
    SolutionNameMin: Cijk_Alik_Bljk_BBS_BH_UserArgs_MT32x32x128_MI16x16x1_SN_LDSB1_CLR1_GSU0_GSUC0_GSUWGMRR0_K1_LBSPPA256_LBSPPB256_MIWT1_1_PLR1_SU32_SUM0_SUS256_SKXCCM6_VWA1_VWB1_WGM8_WGMXCC1_WGMXCCGn1
    SolutionIndex: 102
    SolutionNameMin: Cijk_Alik_Bljk_BBS_BH_UserArgs_MT32x32x32_MI16x16x1_SN_LDSB0_CLR1_GSU0_GSUC0_GSUWGMRR0_K1_LBSPPA128_LBSPPB128_MIWT1_1_PLR1_SU32_SUM0_SUS256_SKXCCM0_VWA1_VWB1_WGM1_WGMXCC1_WGMXCCGn1
- - - [128, 128, 1, 128, 128, 128, 128, 128]
    - [98, 0.089]
  - - [128, 128, 1, 256, 128, 128, 256, 256]
    - [29, 0.114]
  - - [128, 128, 1, 512, 128, 128, 512, 512]
    - [98, 0.196]
  - - [128, 128, 1, 1024, 128, 128, 1024, 1024]
    - [99, 0.292]
  - - [128, 128, 1, 2048, 128, 128, 2048, 2048]
    - [37, 0.386]
  - - [128, 128, 1, 4096, 128, 128, 4096, 4096]
    - [89, 0.765]
  - - [128, 128, 1, 8192, 128, 128, 8192, 8192]
    - [98, 1.431]
  - - [128, 256, 1, 128, 128, 128, 128, 128]
    - [28, 0.184]
  - - [128, 256, 1, 256, 128, 128, 256, 256]
    - [28, 0.222]
  - - [128, 256, 1, 512, 128, 128, 512, 512]
    - [98, 0.378]
  - - [128, 256, 1, 1024, 128, 128, 1024, 1024]
    - [98, 0.58]
  - - [128, 256, 1, 2048, 128, 128, 2048, 2048]
    - [99, 1.096]
  - - [128, 256, 1, 4096, 128, 128, 4096, 4096]
    - [28, 1.917]
  - - [128, 256, 1, 8192, 128, 128, 8192, 8192]
    - [98, 3.341]
  - - [128, 512, 1, 128, 128, 128, 128, 128]
    - [28, 0.359]
  - - [128, 512, 1, 256, 128, 128, 256, 256]
    - [28, 0.445]
  - - [128, 512, 1, 512, 128, 128, 512, 512]
    - [98, 0.754]
  - - [128, 512, 1, 1024, 128, 128, 1024, 1024]
    - [37, 1.309]
  - - [128, 512, 1, 2048, 128, 128, 2048, 2048]
    - [98, 2.522]
  - - [128, 512, 1, 4096, 128, 128, 4096, 4096]
    - [98, 4.062]
  - - [128, 512, 1, 8192, 128, 128, 8192, 8192]
    - [98, 5.976]
  - - [128, 1024, 1, 128, 128, 128, 128, 128]
    - [28, 0.719]
  - - [128, 1024, 1, 256, 128, 128, 256, 256]
    - [28, 0.85]
  - - [128, 1024, 1, 512, 128, 128, 512, 512]
    - [29, 1.6]
  - - [128, 1024, 1, 1024, 128, 128, 1024, 1024]
    - [99, 2.777]
  - - [128, 1024, 1, 2048, 128, 128, 2048, 2048]
    - [99, 4.537]
  - - [128, 1024, 1, 4096, 128, 128, 4096, 4096]
    - [84, 6.513]
  - - [128, 1024, 1, 8192, 128, 128, 8192, 8192]
    - [96, 8.691]
  - - [128, 2048, 1, 128, 128, 128, 128, 128]
    - [27, 1.324]
  - - [128, 2048, 1, 256, 128, 128, 256, 256]
    - [29, 2.257]
  - - [128, 2048, 1, 512, 128, 128, 512, 512]
    - [29, 3.666]
  - - [128, 2048, 1, 1024, 128, 128, 1024, 1024]
    - [28, 5.581]
  - - [128, 2048, 1, 2048, 128, 128, 2048, 2048]
    - [98, 7.288]
  - - [128, 2048, 1, 4096, 128, 128, 4096, 4096]
    - [92, 9.422]
  - - [128, 2048, 1, 8192, 128, 128, 8192, 8192]
    - [14, 11.138]
  - - [128, 4096, 1, 128, 128, 128, 128, 128]
    - [24, 2.328]
  - - [128, 4096, 1, 256, 128, 128, 256, 256]
    - [24, 3.999]
  - - [128, 4096, 1, 512, 128, 128, 512, 512]
    - [84, 6.127]
  - - [128, 4096, 1, 1024, 128, 128, 1024, 1024]
    - [23, 8.567]
  - - [128, 4096, 1, 2048, 128, 128, 2048, 2048]
    - [76, 11.003]
  - - [128, 4096, 1, 4096, 128, 128, 4096, 4096]
    - [14, 12.34]
  - - [128, 4096, 1, 8192, 128, 128, 8192, 8192]
    - [69, 13.833]
  - - [128, 8192, 1, 128, 128, 128, 128, 128]
    - [18, 3.952]
  - - [128, 8192, 1, 256, 128, 128, 256, 256]
    - [18, 6.451]
  - - [128, 8192, 1, 512, 128, 128, 512, 512]
    - [19, 9.774]
  - - [128, 8192, 1, 1024, 128, 128, 1024, 1024]
    - [77, 12.751]
  - - [128, 8192, 1, 2048, 128, 128, 2048, 2048]
    - [16, 12.712]
  - - [128, 8192, 1, 4096, 128, 128, 4096, 4096]
    - [75, 14.966]
  - - [128, 8192, 1, 8192, 128, 128, 8192, 8192]
    - [16, 16.641]
  - - [256, 128, 1, 128, 256, 256, 128, 128]
    - [29, 0.182]
  - - [256, 128, 1, 256, 256, 256, 256, 256]
    - [28, 0.226]
  - - [256, 128, 1, 512, 256, 256, 512, 512]
    - [99, 0.379]
  - - [256, 128, 1, 1024, 256, 256, 1024, 1024]
    - [89, 0.578]
  - - [256, 128, 1, 2048, 256, 256, 2048, 2048]
    - [99, 1.097]
  - - [256, 128, 1, 4096, 256, 256, 4096, 4096]
    - [28, 1.953]
  - - [256, 128, 1, 8192, 256, 256, 8192, 8192]
    - [99, 3.329]
  - - [256, 256, 1, 128, 256, 256, 128, 128]
    - [29, 0.362]
  - - [256, 256, 1, 256, 256, 256, 256, 256]
    - [28, 0.448]
  - - [256, 256, 1, 512, 256, 256, 512, 512]
    - [99, 0.751]
  - - [256, 256, 1, 1024, 256, 256, 1024, 1024]
    - [99, 1.325]
  - - [256, 256, 1, 2048, 256, 256, 2048, 2048]
    - [99, 2.511]
  - - [256, 256, 1, 4096, 256, 256, 4096, 4096]
    - [99, 4.099]
  - - [256, 256, 1, 8192, 256, 256, 8192, 8192]
    - [98, 5.893]
  - - [256, 512, 1, 128, 256, 256, 128, 128]
    - [29, 0.707]
  - - [256, 512, 1, 256, 256, 256, 256, 256]
    - [29, 0.86]
  - - [256, 512, 1, 512, 256, 256, 512, 512]
    - [29, 1.593]
  - - [256, 512, 1, 1024, 256, 256, 1024, 1024]
    - [99, 2.728]
  - - [256, 512, 1, 2048, 256, 256, 2048, 2048]
    - [98, 4.558]
  - - [256, 512, 1, 4096, 256, 256, 4096, 4096]
    - [85, 6.522]
  - - [256, 512, 1, 8192, 256, 256, 8192, 8192]
    - [93, 8.484]
  - - [256, 1024, 1, 128, 256, 256, 128, 128]
    - [27, 1.332]
  - - [256, 1024, 1, 256, 256, 256, 256, 256]
    - [29, 2.269]
  - - [256, 1024, 1, 512, 256, 256, 512, 512]
    - [99, 3.628]
  - - [256, 1024, 1, 1024, 256, 256, 1024, 1024]
    - [28, 5.536]
  - - [256, 1024, 1, 2048, 256, 256, 2048, 2048]
    - [98, 7.25]
  - - [256, 1024, 1, 4096, 256, 256, 4096, 4096]
    - [93, 9.519]
  - - [256, 1024, 1, 8192, 256, 256, 8192, 8192]
    - [78, 10.798]
  - - [256, 2048, 1, 128, 256, 256, 128, 128]
    - [24, 2.324]
  - - [256, 2048, 1, 256, 256, 256, 256, 256]
    - [24, 4.05]
  - - [256, 2048, 1, 512, 256, 256, 512, 512]
    - [22, 6.241]
  - - [256, 2048, 1, 1024, 256, 256, 1024, 1024]
    - [85, 8.522]
  - - [256, 2048, 1, 2048, 256, 256, 2048, 2048]
    - [77, 11.001]
  - - [256, 2048, 1, 4096, 256, 256, 4096, 4096]
    - [71, 12.026]
  - - [256, 2048, 1, 8192, 256, 256, 8192, 8192]
    - [66, 12.707]
  - - [256, 4096, 1, 128, 256, 256, 128, 128]
    - [19, 3.923]
  - - [256, 4096, 1, 256, 256, 256, 256, 256]
    - [18, 6.415]
  - - [256, 4096, 1, 512, 256, 256, 512, 512]
    - [18, 9.847]
  - - [256, 4096, 1, 1024, 256, 256, 1024, 1024]
    - [76, 13.128]
  - - [256, 4096, 1, 2048, 256, 256, 2048, 2048]
    - [78, 13.803]
  - - [256, 4096, 1, 4096, 256, 256, 4096, 4096]
    - [75, 14.967]
  - - [256, 4096, 1, 8192, 256, 256, 8192, 8192]
    - [44, 15.403]
  - - [256, 8192, 1, 128, 256, 256, 128, 128]
    - [13, 5.837]
  - - [256, 8192, 1, 256, 256, 256, 256, 256]
    - [13, 9.418]
  - - [256, 8192, 1, 512, 256, 256, 512, 512]
    - [65, 13.613]
  - - [256, 8192, 1, 1024, 256, 256, 1024, 1024]
    - [65, 16.452]
  - - [256, 8192, 1, 2048, 256, 256, 2048, 2048]
    - [65, 16.537]
  - - [256, 8192, 1, 4096, 256, 256, 4096, 4096]
    - [39, 17.493]
  - - [256, 8192, 1, 8192, 256, 256, 8192, 8192]
    - [46, 17.978]
  - - [512, 128, 1, 128, 512, 512, 128, 128]
    - [28, 0.36]
  - - [512, 128, 1, 256, 512, 512, 256, 256]
    - [28, 0.447]
  - - [512, 128, 1, 512, 512, 512, 512, 512]
    - [98, 0.751]
  - - [512, 128, 1, 1024, 512, 512, 1024, 1024]
    - [38, 1.309]
  - - [512, 128, 1, 2048, 512, 512, 2048, 2048]
    - [98, 2.529]
  - - [512, 128, 1, 4096, 512, 512, 4096, 4096]
    - [98, 4.009]
  - - [512, 128, 1, 8192, 512, 512, 8192, 8192]
    - [101, 5.862]
  - - [512, 256, 1, 128, 512, 512, 128, 128]
    - [28, 0.706]
  - - [512, 256, 1, 256, 512, 512, 256, 256]
    - [28, 0.86]
  - - [512, 256, 1, 512, 512, 512, 512, 512]
    - [29, 1.595]
  - - [512, 256, 1, 1024, 512, 512, 1024, 1024]
    - [98, 2.797]
  - - [512, 256, 1, 2048, 512, 512, 2048, 2048]
    - [98, 4.49]
  - - [512, 256, 1, 4096, 512, 512, 4096, 4096]
    - [86, 6.498]
  - - [512, 256, 1, 8192, 512, 512, 8192, 8192]
    - [97, 8.555]
  - - [512, 512, 1, 128, 512, 512, 128, 128]
    - [27, 1.301]
  - - [512, 512, 1, 256, 512, 512, 256, 256]
    - [29, 2.262]
  - - [512, 512, 1, 512, 512, 512, 512, 512]
    - [28, 3.672]
  - - [512, 512, 1, 1024, 512, 512, 1024, 1024]
    - [28, 5.522]
  - - [512, 512, 1, 2048, 512, 512, 2048, 2048]
    - [98, 7.168]
  - - [512, 512, 1, 4096, 512, 512, 4096, 4096]
    - [18, 9.855]
  - - [512, 512, 1, 8192, 512, 512, 8192, 8192]
    - [79, 10.222]
  - - [512, 1024, 1, 128, 512, 512, 128, 128]
    - [24, 2.332]
  - - [512, 1024, 1, 256, 512, 512, 256, 256]
    - [25, 3.966]
  - - [512, 1024, 1, 512, 512, 512, 512, 512]
    - [21, 6.247]
  - - [512, 1024, 1, 1024, 512, 512, 1024, 1024]
    - [22, 8.663]
  - - [512, 1024, 1, 2048, 512, 512, 2048, 2048]
    - [77, 11.02]
  - - [512, 1024, 1, 4096, 512, 512, 4096, 4096]
    - [77, 12.221]
  - - [512, 1024, 1, 8192, 512, 512, 8192, 8192]
    - [68, 13.025]
  - - [512, 2048, 1, 128, 512, 512, 128, 128]
    - [76, 3.839]
  - - [512, 2048, 1, 256, 512, 512, 256, 256]
    - [19, 6.466]
  - - [512, 2048, 1, 512, 512, 512, 512, 512]
    - [19, 9.917]
  - - [512, 2048, 1, 1024, 512, 512, 1024, 1024]
    - [76, 13.189]
  - - [512, 2048, 1, 2048, 512, 512, 2048, 2048]
    - [76, 14.744]
  - - [512, 2048, 1, 4096, 512, 512, 4096, 4096]
    - [90, 13.38]
  - - [512, 2048, 1, 8192, 512, 512, 8192, 8192]
    - [44, 15.67]
  - - [512, 4096, 1, 128, 512, 512, 128, 128]
    - [15, 5.859]
  - - [512, 4096, 1, 256, 512, 512, 256, 256]
    - [6, 9.346]
  - - [512, 4096, 1, 512, 512, 512, 512, 512]
    - [67, 13.65]
  - - [512, 4096, 1, 1024, 512, 512, 1024, 1024]
    - [65, 17.043]
  - - [512, 4096, 1, 2048, 512, 512, 2048, 2048]
    - [68, 17.076]
  - - [512, 4096, 1, 4096, 512, 512, 4096, 4096]
    - [54, 16.166]
  - - [512, 4096, 1, 8192, 512, 512, 8192, 8192]
    - [44, 16.725]
  - - [512, 8192, 1, 128, 512, 512, 128, 128]
    - [32, 7.42]
  - - [512, 8192, 1, 256, 512, 512, 256, 256]
    - [32, 11.328]
  - - [512, 8192, 1, 512, 512, 512, 512, 512]
    - [42, 14.838]
  - - [512, 8192, 1, 1024, 512, 512, 1024, 1024]
    - [41, 16.537]
  - - [512, 8192, 1, 2048, 512, 512, 2048, 2048]
    - [43, 18.8]
  - - [512, 8192, 1, 4096, 512, 512, 4096, 4096]
    - [46, 17.175]
  - - [512, 8192, 1, 8192, 512, 512, 8192, 8192]
    - [4, 18.832]
  - - [1024, 128, 1, 128, 1024, 1024, 128, 128]
    - [28, 0.71]
  - - [1024, 128, 1, 256, 1024, 1024, 256, 256]
    - [28, 0.864]
  - - [1024, 128, 1, 512, 1024, 1024, 512, 512]
    - [29, 1.585]
  - - [1024, 128, 1, 1024, 1024, 1024, 1024, 1024]
    - [98, 2.815]
  - - [1024, 128, 1, 2048, 1024, 1024, 2048, 2048]
    - [99, 4.493]
  - - [1024, 128, 1, 4096, 1024, 1024, 4096, 4096]
    - [86, 6.506]
  - - [1024, 128, 1, 8192, 1024, 1024, 8192, 8192]
    - [95, 8.62]
  - - [1024, 256, 1, 128, 1024, 1024, 128, 128]
    - [26, 1.259]
  - - [1024, 256, 1, 256, 1024, 1024, 256, 256]
    - [29, 2.284]
  - - [1024, 256, 1, 512, 1024, 1024, 512, 512]
    - [28, 3.661]
  - - [1024, 256, 1, 1024, 1024, 1024, 1024, 1024]
    - [28, 5.571]
  - - [1024, 256, 1, 2048, 1024, 1024, 2048, 2048]
    - [100, 7.132]
  - - [1024, 256, 1, 4096, 1024, 1024, 4096, 4096]
    - [94, 9.439]
  - - [1024, 256, 1, 8192, 1024, 1024, 8192, 8192]
    - [81, 10.394]
  - - [1024, 512, 1, 128, 1024, 1024, 128, 128]
    - [22, 2.274]
  - - [1024, 512, 1, 256, 1024, 1024, 256, 256]
    - [25, 4.001]
  - - [1024, 512, 1, 512, 1024, 1024, 512, 512]
    - [22, 6.152]
  - - [1024, 512, 1, 1024, 1024, 1024, 1024, 1024]
    - [21, 8.65]
  - - [1024, 512, 1, 2048, 1024, 1024, 2048, 2048]
    - [17, 10.841]
  - - [1024, 512, 1, 4096, 1024, 1024, 4096, 4096]
    - [83, 12.248]
  - - [1024, 512, 1, 8192, 1024, 1024, 8192, 8192]
    - [91, 12.29]
  - - [1024, 1024, 1, 128, 1024, 1024, 128, 128]
    - [18, 3.94]
  - - [1024, 1024, 1, 256, 1024, 1024, 256, 256]
    - [76, 6.337]
  - - [1024, 1024, 1, 512, 1024, 1024, 512, 512]
    - [18, 9.961]
  - - [1024, 1024, 1, 1024, 1024, 1024, 1024, 1024]
    - [77, 13.113]
  - - [1024, 1024, 1, 2048, 1024, 1024, 2048, 2048]
    - [83, 14.188]
  - - [1024, 1024, 1, 4096, 1024, 1024, 4096, 4096]
    - [57, 13.906]
  - - [1024, 1024, 1, 8192, 1024, 1024, 8192, 8192]
    - [47, 15.493]
  - - [1024, 2048, 1, 128, 1024, 1024, 128, 128]
    - [15, 5.831]
  - - [1024, 2048, 1, 256, 1024, 1024, 256, 256]
    - [8, 9.333]
  - - [1024, 2048, 1, 512, 1024, 1024, 512, 512]
    - [65, 13.522]
  - - [1024, 2048, 1, 1024, 1024, 1024, 1024, 1024]
    - [67, 17.13]
  - - [1024, 2048, 1, 2048, 1024, 1024, 2048, 2048]
    - [68, 17.137]
  - - [1024, 2048, 1, 4096, 1024, 1024, 4096, 4096]
    - [46, 18.128]
  - - [1024, 2048, 1, 8192, 1024, 1024, 8192, 8192]
    - [56, 17.842]
  - - [1024, 4096, 1, 128, 1024, 1024, 128, 128]
    - [35, 7.45]
  - - [1024, 4096, 1, 256, 1024, 1024, 256, 256]
    - [31, 11.302]
  - - [1024, 4096, 1, 512, 1024, 1024, 512, 512]
    - [43, 14.934]
  - - [1024, 4096, 1, 1024, 1024, 1024, 1024, 1024]
    - [53, 16.352]
  - - [1024, 4096, 1, 2048, 1024, 1024, 2048, 2048]
    - [44, 19.151]
  - - [1024, 4096, 1, 4096, 1024, 1024, 4096, 4096]
    - [42, 17.806]
  - - [1024, 4096, 1, 8192, 1024, 1024, 8192, 8192]
    - [45, 18.836]
  - - [1024, 8192, 1, 128, 1024, 1024, 128, 128]
    - [66, 7.517]
  - - [1024, 8192, 1, 256, 1024, 1024, 256, 256]
    - [68, 11.138]
  - - [1024, 8192, 1, 512, 1024, 1024, 512, 512]
    - [66, 14.407]
  - - [1024, 8192, 1, 1024, 1024, 1024, 1024, 1024]
    - [65, 16.198]
  - - [1024, 8192, 1, 2048, 1024, 1024, 2048, 2048]
    - [43, 17.064]
  - - [1024, 8192, 1, 4096, 1024, 1024, 4096, 4096]
    - [44, 19.039]
  - - [1024, 8192, 1, 8192, 1024, 1024, 8192, 8192]
    - [5, 18.365]
  - - [2048, 128, 1, 128, 2048, 2048, 128, 128]
    - [27, 1.346]
  - - [2048, 128, 1, 256, 2048, 2048, 256, 256]
    - [29, 2.274]
  - - [2048, 128, 1, 512, 2048, 2048, 512, 512]
    - [28, 3.663]
  - - [2048, 128, 1, 1024, 2048, 2048, 1024, 1024]
    - [30, 5.309]
  - - [2048, 128, 1, 2048, 2048, 2048, 2048, 2048]
    - [101, 7.11]
  - - [2048, 128, 1, 4096, 2048, 2048, 4096, 4096]
    - [94, 9.474]
  - - [2048, 128, 1, 8192, 2048, 2048, 8192, 8192]
    - [9, 10.793]
  - - [2048, 256, 1, 128, 2048, 2048, 128, 128]
    - [24, 2.332]
  - - [2048, 256, 1, 256, 2048, 2048, 256, 256]
    - [24, 3.994]
  - - [2048, 256, 1, 512, 2048, 2048, 512, 512]
    - [22, 6.196]
  - - [2048, 256, 1, 1024, 2048, 2048, 1024, 1024]
    - [88, 8.368]
  - - [2048, 256, 1, 2048, 2048, 2048, 2048, 2048]
    - [79, 10.969]
  - - [2048, 256, 1, 4096, 2048, 2048, 4096, 4096]
    - [63, 12.029]
  - - [2048, 256, 1, 8192, 2048, 2048, 8192, 8192]
    - [60, 12.722]
  - - [2048, 512, 1, 128, 2048, 2048, 128, 128]
    - [19, 3.949]
  - - [2048, 512, 1, 256, 2048, 2048, 256, 256]
    - [18, 6.469]
  - - [2048, 512, 1, 512, 2048, 2048, 512, 512]
    - [19, 9.919]
  - - [2048, 512, 1, 1024, 2048, 2048, 1024, 1024]
    - [79, 12.962]
  - - [2048, 512, 1, 2048, 2048, 2048, 2048, 2048]
    - [82, 14.876]
  - - [2048, 512, 1, 4096, 2048, 2048, 4096, 4096]
    - [59, 13.66]
  - - [2048, 512, 1, 8192, 2048, 2048, 8192, 8192]
    - [49, 15.465]
  - - [2048, 1024, 1, 128, 2048, 2048, 128, 128]
    - [13, 5.862]
  - - [2048, 1024, 1, 256, 2048, 2048, 256, 256]
    - [7, 9.32]
  - - [2048, 1024, 1, 512, 2048, 2048, 512, 512]
    - [57, 13.578]
  - - [2048, 1024, 1, 1024, 2048, 2048, 1024, 1024]
    - [62, 15.894]
  - - [2048, 1024, 1, 2048, 2048, 2048, 2048, 2048]
    - [64, 16.646]
  - - [2048, 1024, 1, 4096, 2048, 2048, 4096, 4096]
    - [53, 17.779]
  - - [2048, 1024, 1, 8192, 2048, 2048, 8192, 8192]
    - [56, 17.426]
  - - [2048, 2048, 1, 128, 2048, 2048, 128, 128]
    - [31, 7.437]
  - - [2048, 2048, 1, 256, 2048, 2048, 256, 256]
    - [31, 11.146]
  - - [2048, 2048, 1, 512, 2048, 2048, 512, 512]
    - [1, 15.124]
  - - [2048, 2048, 1, 1024, 2048, 2048, 1024, 1024]
    - [52, 16.988]
  - - [2048, 2048, 1, 2048, 2048, 2048, 2048, 2048]
    - [55, 18.877]
  - - [2048, 2048, 1, 4096, 2048, 2048, 4096, 4096]
    - [44, 18.606]
  - - [2048, 2048, 1, 8192, 2048, 2048, 8192, 8192]
    - [42, 19.814]
  - - [2048, 4096, 1, 128, 2048, 2048, 128, 128]
    - [68, 7.553]
  - - [2048, 4096, 1, 256, 2048, 2048, 256, 256]
    - [68, 11.234]
  - - [2048, 4096, 1, 512, 2048, 2048, 512, 512]
    - [57, 13.956]
  - - [2048, 4096, 1, 1024, 2048, 2048, 1024, 1024]
    - [46, 16.011]
  - - [2048, 4096, 1, 2048, 2048, 2048, 2048, 2048]
    - [40, 17.55]
  - - [2048, 4096, 1, 4096, 2048, 2048, 4096, 4096]
    - [46, 20.401]
  - - [2048, 4096, 1, 8192, 2048, 2048, 8192, 8192]
    - [40, 19.183]
  - - [2048, 8192, 1, 128, 2048, 2048, 128, 128]
    - [68, 9.132]
  - - [2048, 8192, 1, 256, 2048, 2048, 256, 256]
    - [68, 11.954]
  - - [2048, 8192, 1, 512, 2048, 2048, 512, 512]
    - [68, 14.723]
  - - [2048, 8192, 1, 1024, 2048, 2048, 1024, 1024]
    - [52, 17.078]
  - - [2048, 8192, 1, 2048, 2048, 2048, 2048, 2048]
    - [50, 19.019]
  - - [2048, 8192, 1, 4096, 2048, 2048, 4096, 4096]
    - [49, 20.501]
  - - [2048, 8192, 1, 8192, 2048, 2048, 8192, 8192]
    - [3, 21.426]
  - - [4096, 128, 1, 128, 4096, 4096, 128, 128]
    - [27, 2.3]
  - - [4096, 128, 1, 256, 4096, 4096, 256, 256]
    - [24, 3.941]
  - - [4096, 128, 1, 512, 4096, 4096, 512, 512]
    - [21, 6.162]
  - - [4096, 128, 1, 1024, 4096, 4096, 1024, 1024]
    - [85, 8.333]
  - - [4096, 128, 1, 2048, 4096, 4096, 2048, 2048]
    - [87, 10.515]
  - - [4096, 128, 1, 4096, 4096, 4096, 4096, 4096]
    - [6, 12.19]
  - - [4096, 128, 1, 8192, 4096, 4096, 8192, 8192]
    - [6, 13.169]
  - - [4096, 256, 1, 128, 4096, 4096, 128, 128]
    - [19, 3.882]
  - - [4096, 256, 1, 256, 4096, 4096, 256, 256]
    - [19, 6.303]
  - - [4096, 256, 1, 512, 4096, 4096, 512, 512]
    - [20, 9.603]
  - - [4096, 256, 1, 1024, 4096, 4096, 1024, 1024]
    - [82, 12.853]
  - - [4096, 256, 1, 2048, 4096, 4096, 2048, 2048]
    - [79, 14.361]
  - - [4096, 256, 1, 4096, 4096, 4096, 4096, 4096]
    - [58, 14.143]
  - - [4096, 256, 1, 8192, 4096, 4096, 8192, 8192]
    - [42, 16.401]
  - - [4096, 512, 1, 128, 4096, 4096, 128, 128]
    - [13, 5.808]
  - - [4096, 512, 1, 256, 4096, 4096, 256, 256]
    - [6, 9.279]
  - - [4096, 512, 1, 512, 4096, 4096, 512, 512]
    - [62, 13.3]
  - - [4096, 512, 1, 1024, 4096, 4096, 1024, 1024]
    - [61, 16.241]
  - - [4096, 512, 1, 2048, 4096, 4096, 2048, 2048]
    - [63, 16.671]
  - - [4096, 512, 1, 4096, 4096, 4096, 4096, 4096]
    - [42, 16.796]
  - - [4096, 512, 1, 8192, 4096, 4096, 8192, 8192]
    - [42, 16.892]
  - - [4096, 1024, 1, 128, 4096, 4096, 128, 128]
    - [65, 7.455]
  - - [4096, 1024, 1, 256, 4096, 4096, 256, 256]
    - [34, 10.682]
  - - [4096, 1024, 1, 512, 4096, 4096, 512, 512]
    - [3, 14.823]
  - - [4096, 1024, 1, 1024, 4096, 4096, 1024, 1024]
    - [53, 16.394]
  - - [4096, 1024, 1, 2048, 4096, 4096, 2048, 2048]
    - [52, 19.161]
  - - [4096, 1024, 1, 4096, 4096, 4096, 4096, 4096]
    - [53, 17.691]
  - - [4096, 1024, 1, 8192, 4096, 4096, 8192, 8192]
    - [52, 18.584]
  - - [4096, 2048, 1, 128, 4096, 4096, 128, 128]
    - [68, 7.649]
  - - [4096, 2048, 1, 256, 4096, 4096, 256, 256]
    - [66, 11.065]
  - - [4096, 2048, 1, 512, 4096, 4096, 512, 512]
    - [72, 13.653]
  - - [4096, 2048, 1, 1024, 4096, 4096, 1024, 1024]
    - [52, 16.08]
  - - [4096, 2048, 1, 2048, 4096, 4096, 2048, 2048]
    - [42, 18.17]
  - - [4096, 2048, 1, 4096, 4096, 4096, 4096, 4096]
    - [41, 19.962]
  - - [4096, 2048, 1, 8192, 4096, 4096, 8192, 8192]
    - [42, 20.814]
  - - [4096, 4096, 1, 128, 4096, 4096, 128, 128]
    - [67, 9.169]
  - - [4096, 4096, 1, 256, 4096, 4096, 256, 256]
    - [67, 11.703]
  - - [4096, 4096, 1, 512, 4096, 4096, 512, 512]
    - [73, 13.995]
  - - [4096, 4096, 1, 1024, 4096, 4096, 1024, 1024]
    - [53, 16.841]
  - - [4096, 4096, 1, 2048, 4096, 4096, 2048, 2048]
    - [55, 18.808]
  - - [4096, 4096, 1, 4096, 4096, 4096, 4096, 4096]
    - [54, 20.819]
  - - [4096, 4096, 1, 8192, 4096, 4096, 8192, 8192]
    - [44, 22.152]
  - - [4096, 8192, 1, 128, 4096, 4096, 128, 128]
    - [67, 9.041]
  - - [4096, 8192, 1, 256, 4096, 4096, 256, 256]
    - [65, 11.559]
  - - [4096, 8192, 1, 512, 4096, 4096, 512, 512]
    - [49, 14.429]
  - - [4096, 8192, 1, 1024, 4096, 4096, 1024, 1024]
    - [53, 17.909]
  - - [4096, 8192, 1, 2048, 4096, 4096, 2048, 2048]
    - [51, 20.322]
  - - [4096, 8192, 1, 4096, 4096, 4096, 4096, 4096]
    - [48, 23.103]
  - - [4096, 8192, 1, 8192, 4096, 4096, 8192, 8192]
    - [56, 24.455]
  - - [8192, 128, 1, 128, 8192, 8192, 128, 128]
    - [18, 3.954]
  - - [8192, 128, 1, 256, 8192, 8192, 256, 256]
    - [18, 6.331]
  - - [8192, 128, 1, 512, 8192, 8192, 512, 512]
    - [80, 9.425]
  - - [8192, 128, 1, 1024, 8192, 8192, 1024, 1024]
    - [82, 12.62]
  - - [8192, 128, 1, 2048, 8192, 8192, 2048, 2048]
    - [10, 12.92]
  - - [8192, 128, 1, 4096, 8192, 8192, 4096, 4096]
    - [8, 14.667]
  - - [8192, 128, 1, 8192, 8192, 8192, 8192, 8192]
    - [11, 16.564]
  - - [8192, 256, 1, 128, 8192, 8192, 128, 128]
    - [65, 5.793]
  - - [8192, 256, 1, 256, 8192, 8192, 256, 256]
    - [12, 9.052]
  - - [8192, 256, 1, 512, 8192, 8192, 512, 512]
    - [70, 13.321]
  - - [8192, 256, 1, 1024, 8192, 8192, 1024, 1024]
    - [63, 16.098]
  - - [8192, 256, 1, 2048, 8192, 8192, 2048, 2048]
    - [62, 16.697]
  - - [8192, 256, 1, 4096, 8192, 8192, 4096, 4096]
    - [42, 17.459]
  - - [8192, 256, 1, 8192, 8192, 8192, 8192, 8192]
    - [44, 18.511]
  - - [8192, 512, 1, 128, 8192, 8192, 128, 128]
    - [35, 7.282]
  - - [8192, 512, 1, 256, 8192, 8192, 256, 256]
    - [36, 10.764]
  - - [8192, 512, 1, 512, 8192, 8192, 512, 512]
    - [53, 14.288]
  - - [8192, 512, 1, 1024, 8192, 8192, 1024, 1024]
    - [2, 16.371]
  - - [8192, 512, 1, 2048, 8192, 8192, 2048, 2048]
    - [55, 17.99]
  - - [8192, 512, 1, 4096, 8192, 8192, 4096, 4096]
    - [43, 17.524]
  - - [8192, 512, 1, 8192, 8192, 8192, 8192, 8192]
    - [46, 18.369]
  - - [8192, 1024, 1, 128, 8192, 8192, 128, 128]
    - [73, 7.333]
  - - [8192, 1024, 1, 256, 8192, 8192, 256, 256]
    - [72, 10.729]
  - - [8192, 1024, 1, 512, 8192, 8192, 512, 512]
    - [62, 13.902]
  - - [8192, 1024, 1, 1024, 8192, 8192, 1024, 1024]
    - [55, 16.244]
  - - [8192, 1024, 1, 2048, 8192, 8192, 2048, 2048]
    - [44, 17.244]
  - - [8192, 1024, 1, 4096, 8192, 8192, 4096, 4096]
    - [42, 18.287]
  - - [8192, 1024, 1, 8192, 8192, 8192, 8192, 8192]
    - [46, 20.388]
  - - [8192, 2048, 1, 128, 8192, 8192, 128, 128]
    - [75, 8.866]
  - - [8192, 2048, 1, 256, 8192, 8192, 256, 256]
    - [74, 11.77]
  - - [8192, 2048, 1, 512, 8192, 8192, 512, 512]
    - [72, 13.951]
  - - [8192, 2048, 1, 1024, 8192, 8192, 1024, 1024]
    - [53, 17.56]
  - - [8192, 2048, 1, 2048, 8192, 8192, 2048, 2048]
    - [54, 19.319]
  - - [8192, 2048, 1, 4096, 8192, 8192, 4096, 4096]
    - [49, 21.234]
  - - [8192, 2048, 1, 8192, 8192, 8192, 8192, 8192]
    - [51, 22.083]
  - - [8192, 4096, 1, 128, 8192, 8192, 128, 128]
    - [14, 8.477]
  - - [8192, 4096, 1, 256, 8192, 8192, 256, 256]
    - [73, 11.112]
  - - [8192, 4096, 1, 512, 8192, 8192, 512, 512]
    - [54, 14.547]
  - - [8192, 4096, 1, 1024, 8192, 8192, 1024, 1024]
    - [54, 18.216]
  - - [8192, 4096, 1, 2048, 8192, 8192, 2048, 2048]
    - [54, 20.147]
  - - [8192, 4096, 1, 4096, 8192, 8192, 4096, 4096]
    - [47, 23.183]
  - - [8192, 4096, 1, 8192, 8192, 8192, 8192, 8192]
    - [47, 24.765]
  - - [8192, 8192, 1, 128, 8192, 8192, 128, 128]
    - [0, 7.747]
  - - [8192, 8192, 1, 256, 8192, 8192, 256, 256]
    - [33, 10.871]
  - - [8192, 8192, 1, 512, 8192, 8192, 512, 512]
    - [54, 15.329]
  - - [8192, 8192, 1, 1024, 8192, 8192, 1024, 1024]
    - [53, 19.076]
  - - [8192, 8192, 1, 2048, 8192, 8192, 2048, 2048]
    - [55, 21.22]
  - - [8192, 8192, 1, 4096, 8192, 8192, 4096, 4096]
    - [49, 25.566]
  - - [8192, 8192, 1, 8192, 8192, 8192, 8192, 8192]
    - [49, 24.113]
  - - [1, 1, 1, 32, 1, 1, 32, 32]
    - [102, 0.0]
- null
- null
- DeviceEfficiency
- GridBased
