library/src/amd_detail/rocblaslt/src/Tensile/Logic/streamk/gfx942a/aquavanjaram942_Cijk_Ailk_Bjlk_BBS_BH_UserArgs.yaml
- {MinimumRequiredVersion: 4.33.0}
- aquavanjaram942
- gfx942
- [Device 0049, Device 0050]
    SolutionIndex: 0
    SolutionNameMin: Cijk_Ailk_Bjlk_BBS_BH_UserArgs_MT256x256x32_MI16x16x1_SN_LDSB1_CLR1_GSU0_GSUC0_GSUWGMRR0_K1_LBSPPA2048_LBSPPB2048_LPA32_LPB0_MIWT8_8_PLR1_SU32_SUM0_SUS256_SKXCCM0_VWA2_VWB8_WGM1_WGMXCC1_WGMXCCGn1
    SolutionIndex: 1
    SolutionNameMin: Cijk_Ailk_Bjlk_BBS_BH_UserArgs_MT256x256x32_MI16x16x1_SN_LDSB0_CLR1_GSU0_GSUC0_GSUWGMRR0_K1_LBSPPA2048_LBSPPB2048_LPA0_LPB0_MIWT8_8_PLR1_SU32_SUM0_SUS256_SKXCCM0_VWA8_VWB8_WGM1_WGMXCC1_WGMXCCGn1
    SolutionIndex: 2
    SolutionNameMin: Cijk_Ailk_Bjlk_BBS_BH_UserArgs_MT256x256x32_MI16x16x1_SN_LDSB0_CLR1_GSU0_GSUC0_GSUWGMRR0_K1_LBSPPA2048_LBSPPB2048_LPA0_LPB0_MIWT8_8_PLR1_SU32_SUM0_SUS256_SKXCCM0_VWA4_VWB8_WGM8_WGMXCC1_WGMXCCGn1
    SolutionIndex: 3
    SolutionNameMin: Cijk_Ailk_Bjlk_BBS_BH_UserArgs_MT128x256x32_MI16x16x1_SN_LDSB1_CLR1_GSU0_GSUC0_GSUWGMRR0_K1_LBSPPA1024_LBSPPB2048_LPA0_LPB32_MIWT4_8_PLR1_SU32_SUM0_SUS256_SKXCCM0_VWA4_VWB2_WGM1_WGMXCC1_WGMXCCGn1
    SolutionIndex: 4
    SolutionNameMin: Cijk_Ailk_Bjlk_BBS_BH_UserArgs_MT256x128x32_MI16x16x1_SN_LDSB1_CLR1_GSU0_GSUC0_GSUWGMRR0_K1_LBSPPA2048_LBSPPB1024_LPA0_LPB0_MIWT8_4_PLR1_SU32_SUM0_SUS256_SKXCCM0_VWA4_VWB4_WGM1_WGMXCC1_WGMXCCGn1
    SolutionIndex: 5
    SolutionNameMin: Cijk_Ailk_Bjlk_BBS_BH_UserArgs_MT256x64x32_MI16x16x1_SN_LDSB1_CLR1_GSU0_GSUC0_GSUWGMRR0_K1_LBSPPA2048_LBSPPB512_LPA0_LPB16_MIWT8_2_PLR1_SU32_SUM0_SUS256_SKXCCM0_VWA8_VWB1_WGM1_WGMXCC1_WGMXCCGn1
    SolutionIndex: 6
    SolutionNameMin: Cijk_Ailk_Bjlk_BBS_BH_UserArgs_MT128x128x32_MI16x16x1_SN_LDSB0_CLR1_GSU0_GSUC0_GSUWGMRR0_K1_LBSPPA1024_LBSPPB1024_LPA0_LPB0_MIWT4_4_PLR1_SU32_SUM0_SUS256_SKXCCM0_VWA4_VWB4_WGM1_WGMXCC1_WGMXCCGn1
    SolutionIndex: 7
    SolutionNameMin: Cijk_Ailk_Bjlk_BBS_BH_UserArgs_MT128x128x32_MI16x16x1_SN_LDSB0_CLR1_GSU0_GSUC0_GSUWGMRR0_K1_LBSPPA1024_LBSPPB1024_LPA0_LPB0_MIWT4_4_PLR1_SU32_SUM0_SUS256_SKXCCM0_VWA4_VWB4_WGM8_WGMXCC1_WGMXCCGn1
    SolutionIndex: 8
    SolutionNameMin: Cijk_Ailk_Bjlk_BBS_BH_UserArgs_MT128x128x32_MI16x16x1_SN_LDSB0_CLR0_GSU0_GSUC0_GSUWGMRR0_K1_LBSPPA1024_LBSPPB1024_LPA0_LPB0_MIWT4_4_PLR0_SU32_SUM0_SUS256_SKXCCM0_VWA4_VWB4_WGM8_WGMXCC1_WGMXCCGn1
    SolutionIndex: 9
    SolutionNameMin: Cijk_Ailk_Bjlk_BBS_BH_UserArgs_MT64x128x32_MI16x16x1_SN_LDSB0_CLR1_GSU0_GSUC0_GSUWGMRR0_K1_LBSPPA512_LBSPPB1024_LPA32_LPB0_MIWT2_4_PLR1_SU32_SUM0_SUS256_SKXCCM0_VWA2_VWB4_WGM1_WGMXCC1_WGMXCCGn1
    SolutionIndex: 10
    SolutionNameMin: Cijk_Ailk_Bjlk_BBS_BH_UserArgs_MT128x64x32_MI16x16x1_SN_LDSB0_CLR1_GSU0_GSUC0_GSUWGMRR0_K1_LBSPPA1024_LBSPPB512_LPA0_LPB16_MIWT4_2_PLR1_SU32_SUM0_SUS256_SKXCCM0_VWA4_VWB1_WGM1_WGMXCC1_WGMXCCGn1
    SolutionIndex: 11
    SolutionNameMin: Cijk_Ailk_Bjlk_BBS_BH_UserArgs_MT128x64x32_MI16x16x1_SN_LDSB0_CLR1_GSU0_GSUC0_GSUWGMRR0_K1_LBSPPA1024_LBSPPB512_LPA0_LPB32_MIWT4_2_PLR1_SU32_SUM0_SUS256_SKXCCM0_VWA4_VWB2_WGM1_WGMXCC1_WGMXCCGn1
    SolutionIndex: 12
    SolutionNameMin: Cijk_Ailk_Bjlk_BBS_BH_UserArgs_MT128x64x32_MI16x16x1_SN_LDSB0_CLR1_GSU0_GSUC0_GSUWGMRR0_K1_LBSPPA1024_LBSPPB512_LPA0_LPB32_MIWT4_2_PLR1_SU32_SUM0_SUS256_SKXCCM0_VWA4_VWB2_WGM4_WGMXCC1_WGMXCCGn1
    SolutionIndex: 13
    SolutionNameMin: Cijk_Ailk_Bjlk_BBS_BH_UserArgs_MT128x64x32_MI16x16x1_SN_LDSB0_CLR1_GSU0_GSUC0_GSUWGMRR0_K1_LBSPPA1024_LBSPPB512_LPA0_LPB32_MIWT4_2_PLR1_SU32_SUM0_SUS256_SKXCCM0_VWA4_VWB2_WGM8_WGMXCC1_WGMXCCGn1
    SolutionIndex: 14
    SolutionNameMin: Cijk_Ailk_Bjlk_BBS_BH_UserArgs_MT64x64x32_MI16x16x1_SN_LDSB0_CLR1_GSU0_GSUC0_GSUWGMRR0_K1_LBSPPA512_LBSPPB512_LPA32_LPB32_MIWT2_2_PLR1_SU32_SUM0_SUS256_SKXCCM0_VWA2_VWB2_WGM1_WGMXCC1_WGMXCCGn1
    SolutionIndex: 15
    SolutionNameMin: Cijk_Ailk_Bjlk_BBS_BH_UserArgs_MT64x64x32_MI16x16x1_SN_LDSB0_CLR0_GSU0_GSUC0_GSUWGMRR0_K1_LBSPPA512_LBSPPB512_LPA32_LPB32_MIWT2_2_PLR0_SU32_SUM0_SUS256_SKXCCM0_VWA2_VWB2_WGM1_WGMXCC1_WGMXCCGn1
    SolutionIndex: 16
    SolutionNameMin: Cijk_Ailk_Bjlk_BBS_BH_UserArgs_MT32x32x32_MI16x16x1_SN_LDSB0_CLR1_GSU0_GSUC0_GSUWGMRR0_K1_LBSPPA256_LBSPPB256_LPA16_LPB16_MIWT1_1_PLR1_SU32_SUM0_SUS256_SKXCCM0_VWA1_VWB1_WGM1_WGMXCC1_WGMXCCGn1
    SolutionIndex: 17
    SolutionNameMin: Cijk_Ailk_Bjlk_BBS_BH_UserArgs_MT256x256x64_MI16x16x1_SN_LDSB1_CLR1_GSU0_GSUC0_GSUWGMRR0_K1_LBSPPA2048_LBSPPB2048_LPA0_LPB0_MIWT8_8_PLR2_SU32_SUM0_SUS256_SKXCCM0_VWA4_VWB8_WGM1_WGMXCC1_WGMXCCGn1
    SolutionIndex: 18
    SolutionNameMin: Cijk_Ailk_Bjlk_BBS_BH_UserArgs_MT256x256x64_MI16x16x1_SN_LDSB1_CLR1_GSU0_GSUC0_GSUWGMRR0_K1_LBSPPA2048_LBSPPB2048_LPA0_LPB0_MIWT8_8_PLR2_SU32_SUM0_SUS256_SKXCCM0_VWA4_VWB4_WGM4_WGMXCC1_WGMXCCGn1
    SolutionIndex: 19
    SolutionNameMin: Cijk_Ailk_Bjlk_BBS_BH_UserArgs_MT128x128x64_MI16x16x1_SN_LDSB1_CLR1_GSU0_GSUC0_GSUWGMRR0_K1_LBSPPA1024_LBSPPB1024_LPA0_LPB0_MIWT4_4_PLR1_SU32_SUM0_SUS256_SKXCCM0_VWA4_VWB4_WGM1_WGMXCC1_WGMXCCGn1
    SolutionIndex: 20
    SolutionNameMin: Cijk_Ailk_Bjlk_BBS_BH_UserArgs_MT128x128x64_MI16x16x1_SN_LDSB1_CLR1_GSU0_GSUC0_GSUWGMRR0_K1_LBSPPA1024_LBSPPB1024_LPA0_LPB0_MIWT4_4_PLR1_SU32_SUM0_SUS256_SKXCCM0_VWA4_VWB4_WGM4_WGMXCC1_WGMXCCGn1
    SolutionIndex: 21
    SolutionNameMin: Cijk_Ailk_Bjlk_BBS_BH_UserArgs_MT128x64x64_MI16x16x1_SN_LDSB1_CLR1_GSU0_GSUC0_GSUWGMRR0_K1_LBSPPA1024_LBSPPB512_LPA0_LPB32_MIWT4_2_PLR1_SU32_SUM0_SUS256_SKXCCM0_VWA4_VWB2_WGM1_WGMXCC1_WGMXCCGn1
    SolutionIndex: 22
    SolutionNameMin: Cijk_Ailk_Bjlk_BBS_BH_UserArgs_MT128x64x64_MI16x16x1_SN_LDSB1_CLR1_GSU0_GSUC0_GSUWGMRR0_K1_LBSPPA1024_LBSPPB512_LPA0_LPB32_MIWT4_2_PLR2_SU32_SUM0_SUS256_SKXCCM0_VWA4_VWB2_WGM4_WGMXCC1_WGMXCCGn1
    SolutionIndex: 23
    SolutionNameMin: Cijk_Ailk_Bjlk_BBS_BH_UserArgs_MT64x64x64_MI16x16x1_SN_LDSB1_CLR1_GSU0_GSUC0_GSUWGMRR0_K1_LBSPPA512_LBSPPB512_LPA32_LPB32_MIWT2_2_PLR1_SU32_SUM0_SUS256_SKXCCM0_VWA2_VWB2_WGM1_WGMXCC1_WGMXCCGn1
    SolutionIndex: 24
    SolutionNameMin: Cijk_Ailk_Bjlk_BBS_BH_UserArgs_MT64x64x64_MI16x16x1_SN_LDSB1_CLR1_GSU0_GSUC0_GSUWGMRR0_K1_LBSPPA512_LBSPPB512_LPA32_LPB32_MIWT2_2_PLR2_SU32_SUM0_SUS256_SKXCCM0_VWA2_VWB2_WGM1_WGMXCC1_WGMXCCGn1
    SolutionIndex: 25
    SolutionNameMin: Cijk_Ailk_Bjlk_BBS_BH_UserArgs_MT32x64x64_MI16x16x1_SN_LDSB0_CLR1_GSU0_GSUC0_GSUWGMRR0_K1_LBSPPA256_LBSPPB512_LPA16_LPB32_MIWT1_2_PLR2_SU32_SUM0_SUS256_SKXCCM0_VWA1_VWB2_WGM1_WGMXCC1_WGMXCCGn1
    SolutionIndex: 26
    SolutionNameMin: Cijk_Ailk_Bjlk_BBS_BH_UserArgs_MT64x32x64_MI16x16x1_SN_LDSB0_CLR1_GSU0_GSUC0_GSUWGMRR0_K1_LBSPPA512_LBSPPB256_LPA32_LPB16_MIWT2_1_PLR2_SU32_SUM0_SUS256_SKXCCM0_VWA2_VWB1_WGM1_WGMXCC1_WGMXCCGn1
    SolutionIndex: 27
    SolutionNameMin: Cijk_Ailk_Bjlk_BBS_BH_UserArgs_MT128x128x128_MI16x16x1_SN_LDSB1_CLR1_GSU0_GSUC0_GSUWGMRR0_K1_LBSPPA1024_LBSPPB1024_LPA0_LPB0_MIWT4_4_PLR1_SU32_SUM0_SUS256_SKXCCM0_VWA4_VWB4_WGM8_WGMXCC1_WGMXCCGn1
    SolutionIndex: 28
    SolutionNameMin: Cijk_Ailk_Bjlk_BBS_BH_UserArgs_MT64x64x128_MI16x16x1_SN_LDSB1_CLR1_GSU0_GSUC0_GSUWGMRR0_K1_LBSPPA512_LBSPPB512_LPA32_LPB32_MIWT2_2_PLR1_SU32_SUM0_SUS256_SKXCCM0_VWA2_VWB2_WGM1_WGMXCC1_WGMXCCGn1
    SolutionIndex: 29
    SolutionNameMin: Cijk_Ailk_Bjlk_BBS_BH_UserArgs_MT64x64x128_MI16x16x1_SN_LDSB1_CLR1_GSU0_GSUC0_GSUWGMRR0_K1_LBSPPA512_LBSPPB512_LPA32_LPB32_MIWT2_2_PLR2_SU32_SUM0_SUS256_SKXCCM0_VWA2_VWB2_WGM1_WGMXCC1_WGMXCCGn1
    SolutionIndex: 30
    SolutionNameMin: Cijk_Ailk_Bjlk_BBS_BH_UserArgs_MT64x32x128_MI16x16x1_SN_LDSB1_CLR1_GSU0_GSUC0_GSUWGMRR0_K1_LBSPPA512_LBSPPB256_LPA32_LPB16_MIWT2_1_PLR2_SU32_SUM0_SUS256_SKXCCM0_VWA2_VWB1_WGM1_WGMXCC1_WGMXCCGn1
    SolutionIndex: 31
    SolutionNameMin: Cijk_Ailk_Bjlk_BBS_BH_UserArgs_MT32x32x128_MI16x16x1_SN_LDSB1_CLR1_GSU0_GSUC0_GSUWGMRR0_K1_LBSPPA256_LBSPPB256_LPA16_LPB16_MIWT1_1_PLR1_SU32_SUM0_SUS256_SKXCCM0_VWA1_VWB1_WGM1_WGMXCC1_WGMXCCGn1
    SolutionIndex: 32
    SolutionNameMin: Cijk_Ailk_Bjlk_BBS_BH_UserArgs_MT32x32x128_MI16x16x1_SN_LDSB1_CLR1_GSU0_GSUC0_GSUWGMRR0_K1_LBSPPA256_LBSPPB256_LPA16_LPB16_MIWT1_1_PLR2_SU32_SUM0_SUS256_SKXCCM0_VWA1_VWB1_WGM1_WGMXCC1_WGMXCCGn1
    SolutionIndex: 33
    SolutionNameMin: Cijk_Ailk_Bjlk_BBS_BH_UserArgs_MT256x256x32_MI16x16x1_SN_LDSB1_CLR1_GSU0_GSUC0_GSUWGMRR0_K1_LBSPPA2048_LBSPPB2048_LPA32_LPB0_MIWT8_8_PLR1_SU32_SUM0_SUS256_SKXCCM6_VWA2_VWB8_WGM1_WGMXCC1_WGMXCCGn1
    SolutionIndex: 34
    SolutionNameMin: Cijk_Ailk_Bjlk_BBS_BH_UserArgs_MT256x256x32_MI16x16x1_SN_LDSB0_CLR1_GSU0_GSUC0_GSUWGMRR0_K1_LBSPPA2048_LBSPPB2048_LPA0_LPB0_MIWT8_8_PLR1_SU32_SUM0_SUS256_SKXCCM6_VWA4_VWB8_WGM1_WGMXCC1_WGMXCCGn1
    SolutionIndex: 35
    SolutionNameMin: Cijk_Ailk_Bjlk_BBS_BH_UserArgs_MT256x256x32_MI16x16x1_SN_LDSB0_CLR1_GSU0_GSUC0_GSUWGMRR0_K1_LBSPPA2048_LBSPPB2048_LPA0_LPB0_MIWT8_8_PLR1_SU32_SUM0_SUS256_SKXCCM6_VWA8_VWB8_WGM1_WGMXCC1_WGMXCCGn1
    SolutionIndex: 36
    SolutionNameMin: Cijk_Ailk_Bjlk_BBS_BH_UserArgs_MT256x256x32_MI16x16x1_SN_LDSB0_CLR1_GSU0_GSUC0_GSUWGMRR0_K1_LBSPPA2048_LBSPPB2048_LPA0_LPB0_MIWT8_8_PLR1_SU32_SUM0_SUS256_SKXCCM6_VWA8_VWB8_WGM4_WGMXCC1_WGMXCCGn1
    SolutionIndex: 37
    SolutionNameMin: Cijk_Ailk_Bjlk_BBS_BH_UserArgs_MT256x256x32_MI16x16x1_SN_LDSB0_CLR1_GSU0_GSUC0_GSUWGMRR0_K1_LBSPPA2048_LBSPPB2048_LPA0_LPB0_MIWT8_8_PLR1_SU32_SUM0_SUS256_SKXCCM6_VWA4_VWB4_WGM8_WGMXCC1_WGMXCCGn1
    SolutionIndex: 38
    SolutionNameMin: Cijk_Ailk_Bjlk_BBS_BH_UserArgs_MT256x256x32_MI16x16x1_SN_LDSB0_CLR1_GSU0_GSUC0_GSUWGMRR0_K1_LBSPPA2048_LBSPPB2048_LPA0_LPB0_MIWT8_8_PLR1_SU32_SUM0_SUS256_SKXCCM6_VWA4_VWB8_WGM8_WGMXCC1_WGMXCCGn1
    SolutionIndex: 39
    SolutionNameMin: Cijk_Ailk_Bjlk_BBS_BH_UserArgs_MT256x256x32_MI16x16x1_SN_LDSB0_CLR1_GSU0_GSUC0_GSUWGMRR0_K1_LBSPPA2048_LBSPPB2048_LPA0_LPB0_MIWT8_8_PLR1_SU32_SUM0_SUS256_SKXCCM6_VWA8_VWB8_WGM8_WGMXCC1_WGMXCCGn1
    SolutionIndex: 40
    SolutionNameMin: Cijk_Ailk_Bjlk_BBS_BH_UserArgs_MT128x256x32_MI16x16x1_SN_LDSB1_CLR1_GSU0_GSUC0_GSUWGMRR0_K1_LBSPPA1024_LBSPPB2048_LPA32_LPB0_MIWT4_8_PLR1_SU32_SUM0_SUS256_SKXCCM6_VWA2_VWB8_WGM1_WGMXCC1_WGMXCCGn1
    SolutionIndex: 41
    SolutionNameMin: Cijk_Ailk_Bjlk_BBS_BH_UserArgs_MT128x256x32_MI16x16x1_SN_LDSB1_CLR1_GSU0_GSUC0_GSUWGMRR0_K1_LBSPPA1024_LBSPPB2048_LPA0_LPB0_MIWT4_8_PLR1_SU32_SUM0_SUS256_SKXCCM6_VWA4_VWB8_WGM1_WGMXCC1_WGMXCCGn1
    SolutionIndex: 42
    SolutionNameMin: Cijk_Ailk_Bjlk_BBS_BH_UserArgs_MT128x256x32_MI16x16x1_SN_LDSB1_CLR1_GSU0_GSUC0_GSUWGMRR0_K1_LBSPPA1024_LBSPPB2048_LPA0_LPB32_MIWT4_8_PLR1_SU32_SUM0_SUS256_SKXCCM6_VWA4_VWB2_WGM4_WGMXCC1_WGMXCCGn1
    SolutionIndex: 43
    SolutionNameMin: Cijk_Ailk_Bjlk_BBS_BH_UserArgs_MT128x256x32_MI16x16x1_SN_LDSB1_CLR1_GSU0_GSUC0_GSUWGMRR0_K1_LBSPPA1024_LBSPPB2048_LPA32_LPB0_MIWT4_8_PLR1_SU32_SUM0_SUS256_SKXCCM6_VWA2_VWB4_WGM4_WGMXCC1_WGMXCCGn1
    SolutionIndex: 44
    SolutionNameMin: Cijk_Ailk_Bjlk_BBS_BH_UserArgs_MT128x256x32_MI16x16x1_SN_LDSB1_CLR1_GSU0_GSUC0_GSUWGMRR0_K1_LBSPPA1024_LBSPPB2048_LPA0_LPB0_MIWT4_8_PLR1_SU32_SUM0_SUS256_SKXCCM6_VWA4_VWB4_WGM4_WGMXCC1_WGMXCCGn1
    SolutionIndex: 45
    SolutionNameMin: Cijk_Ailk_Bjlk_BBS_BH_UserArgs_MT128x256x32_MI16x16x1_SN_LDSB1_CLR1_GSU0_GSUC0_GSUWGMRR0_K1_LBSPPA1024_LBSPPB2048_LPA32_LPB0_MIWT4_8_PLR1_SU32_SUM0_SUS256_SKXCCM6_VWA2_VWB8_WGM4_WGMXCC1_WGMXCCGn1
    SolutionIndex: 46
    SolutionNameMin: Cijk_Ailk_Bjlk_BBS_BH_UserArgs_MT128x256x32_MI16x16x1_SN_LDSB1_CLR1_GSU0_GSUC0_GSUWGMRR0_K1_LBSPPA1024_LBSPPB2048_LPA32_LPB0_MIWT4_8_PLR1_SU32_SUM0_SUS256_SKXCCM6_VWA2_VWB8_WGM8_WGMXCC1_WGMXCCGn1
    SolutionIndex: 47
    SolutionNameMin: Cijk_Ailk_Bjlk_BBS_BH_UserArgs_MT256x128x32_MI16x16x1_SN_LDSB1_CLR1_GSU0_GSUC0_GSUWGMRR0_K1_LBSPPA2048_LBSPPB1024_LPA0_LPB32_MIWT8_4_PLR1_SU32_SUM0_SUS256_SKXCCM6_VWA4_VWB2_WGM1_WGMXCC1_WGMXCCGn1
    SolutionIndex: 48
    SolutionNameMin: Cijk_Ailk_Bjlk_BBS_BH_UserArgs_MT256x128x32_MI16x16x1_SN_LDSB1_CLR1_GSU0_GSUC0_GSUWGMRR0_K1_LBSPPA2048_LBSPPB1024_LPA0_LPB32_MIWT8_4_PLR1_SU32_SUM0_SUS256_SKXCCM6_VWA8_VWB2_WGM1_WGMXCC1_WGMXCCGn1
    SolutionIndex: 49
    SolutionNameMin: Cijk_Ailk_Bjlk_BBS_BH_UserArgs_MT256x128x32_MI16x16x1_SN_LDSB1_CLR1_GSU0_GSUC0_GSUWGMRR0_K1_LBSPPA2048_LBSPPB1024_LPA32_LPB0_MIWT8_4_PLR1_SU32_SUM0_SUS256_SKXCCM6_VWA2_VWB4_WGM1_WGMXCC1_WGMXCCGn1
    SolutionIndex: 50
    SolutionNameMin: Cijk_Ailk_Bjlk_BBS_BH_UserArgs_MT256x128x32_MI16x16x1_SN_LDSB1_CLR1_GSU0_GSUC0_GSUWGMRR0_K1_LBSPPA2048_LBSPPB1024_LPA0_LPB0_MIWT8_4_PLR1_SU32_SUM0_SUS256_SKXCCM6_VWA4_VWB4_WGM1_WGMXCC1_WGMXCCGn1
    SolutionIndex: 51
    SolutionNameMin: Cijk_Ailk_Bjlk_BBS_BH_UserArgs_MT256x128x32_MI16x16x1_SN_LDSB1_CLR1_GSU0_GSUC0_GSUWGMRR0_K1_LBSPPA2048_LBSPPB1024_LPA32_LPB0_MIWT8_4_PLR1_SU32_SUM0_SUS256_SKXCCM6_VWA2_VWB4_WGM4_WGMXCC1_WGMXCCGn1
    SolutionIndex: 52
    SolutionNameMin: Cijk_Ailk_Bjlk_BBS_BH_UserArgs_MT256x128x32_MI16x16x1_SN_LDSB1_CLR1_GSU0_GSUC0_GSUWGMRR0_K1_LBSPPA2048_LBSPPB1024_LPA0_LPB16_MIWT8_4_PLR1_SU32_SUM0_SUS256_SKXCCM6_VWA8_VWB1_WGM8_WGMXCC1_WGMXCCGn1
    SolutionIndex: 53
    SolutionNameMin: Cijk_Ailk_Bjlk_BBS_BH_UserArgs_MT256x128x32_MI16x16x1_SN_LDSB1_CLR1_GSU0_GSUC0_GSUWGMRR0_K1_LBSPPA2048_LBSPPB1024_LPA32_LPB32_MIWT8_4_PLR1_SU32_SUM0_SUS256_SKXCCM6_VWA2_VWB2_WGM8_WGMXCC1_WGMXCCGn1
    SolutionIndex: 54
    SolutionNameMin: Cijk_Ailk_Bjlk_BBS_BH_UserArgs_MT256x128x32_MI16x16x1_SN_LDSB1_CLR1_GSU0_GSUC0_GSUWGMRR0_K1_LBSPPA2048_LBSPPB1024_LPA0_LPB32_MIWT8_4_PLR1_SU32_SUM0_SUS256_SKXCCM6_VWA4_VWB2_WGM8_WGMXCC1_WGMXCCGn1
    SolutionIndex: 55
    SolutionNameMin: Cijk_Ailk_Bjlk_BBS_BH_UserArgs_MT256x128x32_MI16x16x1_SN_LDSB1_CLR1_GSU0_GSUC0_GSUWGMRR0_K1_LBSPPA2048_LBSPPB1024_LPA32_LPB0_MIWT8_4_PLR1_SU32_SUM0_SUS256_SKXCCM6_VWA2_VWB4_WGM8_WGMXCC1_WGMXCCGn1
    SolutionIndex: 56
    SolutionNameMin: Cijk_Ailk_Bjlk_BBS_BH_UserArgs_MT256x128x32_MI16x16x1_SN_LDSB1_CLR1_GSU0_GSUC0_GSUWGMRR0_K1_LBSPPA2048_LBSPPB1024_LPA0_LPB0_MIWT8_4_PLR1_SU32_SUM0_SUS256_SKXCCM6_VWA8_VWB4_WGM8_WGMXCC1_WGMXCCGn1
    SolutionIndex: 57
    SolutionNameMin: Cijk_Ailk_Bjlk_BBS_BH_UserArgs_MT128x128x32_MI16x16x1_SN_LDSB1_CLR1_GSU0_GSUC0_GSUWGMRR0_K1_LBSPPA1024_LBSPPB1024_LPA0_LPB32_MIWT4_4_PLR1_SU32_SUM0_SUS256_SKXCCM6_VWA4_VWB2_WGM1_WGMXCC1_WGMXCCGn1
    SolutionIndex: 58
    SolutionNameMin: Cijk_Ailk_Bjlk_BBS_BH_UserArgs_MT128x128x32_MI16x16x1_SN_LDSB0_CLR1_GSU0_GSUC0_GSUWGMRR0_K1_LBSPPA1024_LBSPPB1024_LPA0_LPB0_MIWT4_4_PLR1_SU32_SUM0_SUS256_SKXCCM6_VWA4_VWB4_WGM1_WGMXCC1_WGMXCCGn1
    SolutionIndex: 59
    SolutionNameMin: Cijk_Ailk_Bjlk_BBS_BH_UserArgs_MT128x128x32_MI16x16x1_SN_LDSB0_CLR0_GSU0_GSUC0_GSUWGMRR0_K1_LBSPPA1024_LBSPPB1024_LPA0_LPB0_MIWT4_4_PLR0_SU32_SUM0_SUS256_SKXCCM6_VWA4_VWB4_WGM1_WGMXCC1_WGMXCCGn1
    SolutionIndex: 60
    SolutionNameMin: Cijk_Ailk_Bjlk_BBS_BH_UserArgs_MT128x128x32_MI16x16x1_SN_LDSB0_CLR0_GSU0_GSUC0_GSUWGMRR0_K1_LBSPPA1024_LBSPPB1024_LPA0_LPB0_MIWT4_4_PLR0_SU32_SUM0_SUS256_SKXCCM6_VWA4_VWB4_WGM4_WGMXCC1_WGMXCCGn1
    SolutionIndex: 61
    SolutionNameMin: Cijk_Ailk_Bjlk_BBS_BH_UserArgs_MT128x128x32_MI16x16x1_SN_LDSB0_CLR0_GSU0_GSUC0_GSUWGMRR0_K1_LBSPPA1024_LBSPPB1024_LPA0_LPB0_MIWT4_4_PLR0_SU32_SUM0_SUS256_SKXCCM6_VWA4_VWB4_WGM8_WGMXCC1_WGMXCCGn1
    SolutionIndex: 62
    SolutionNameMin: Cijk_Ailk_Bjlk_BBS_BH_UserArgs_MT128x64x32_MI16x16x1_SN_LDSB0_CLR1_GSU0_GSUC0_GSUWGMRR0_K1_LBSPPA1024_LBSPPB512_LPA32_LPB32_MIWT4_2_PLR1_SU32_SUM0_SUS256_SKXCCM6_VWA2_VWB2_WGM1_WGMXCC1_WGMXCCGn1
    SolutionIndex: 63
    SolutionNameMin: Cijk_Ailk_Bjlk_BBS_BH_UserArgs_MT128x64x32_MI16x16x1_SN_LDSB0_CLR1_GSU0_GSUC0_GSUWGMRR0_K1_LBSPPA1024_LBSPPB512_LPA0_LPB32_MIWT4_2_PLR1_SU32_SUM0_SUS256_SKXCCM6_VWA4_VWB2_WGM1_WGMXCC1_WGMXCCGn1
    SolutionIndex: 64
    SolutionNameMin: Cijk_Ailk_Bjlk_BBS_BH_UserArgs_MT128x64x32_MI16x16x1_SN_LDSB0_CLR1_GSU0_GSUC0_GSUWGMRR0_K1_LBSPPA1024_LBSPPB512_LPA0_LPB32_MIWT4_2_PLR1_SU32_SUM0_SUS256_SKXCCM6_VWA4_VWB2_WGM8_WGMXCC1_WGMXCCGn1
    SolutionIndex: 65
    SolutionNameMin: Cijk_Ailk_Bjlk_BBS_BH_UserArgs_MT64x64x32_MI16x16x1_SN_LDSB0_CLR0_GSU0_GSUC0_GSUWGMRR0_K1_LBSPPA512_LBSPPB512_LPA32_LPB32_MIWT2_2_PLR0_SU32_SUM0_SUS256_SKXCCM6_VWA2_VWB2_WGM1_WGMXCC1_WGMXCCGn1
    SolutionIndex: 66
    SolutionNameMin: Cijk_Ailk_Bjlk_BBS_BH_UserArgs_MT32x32x32_MI16x16x1_SN_LDSB0_CLR1_GSU0_GSUC0_GSUWGMRR0_K1_LBSPPA256_LBSPPB256_LPA16_LPB16_MIWT1_1_PLR1_SU32_SUM0_SUS256_SKXCCM6_VWA1_VWB1_WGM1_WGMXCC1_WGMXCCGn1
    SolutionIndex: 67
    SolutionNameMin: Cijk_Ailk_Bjlk_BBS_BH_UserArgs_MT32x32x32_MI16x16x1_SN_LDSB0_CLR0_GSU0_GSUC0_GSUWGMRR0_K1_LBSPPA256_LBSPPB256_LPA16_LPB16_MIWT1_1_PLR0_SU32_SUM0_SUS256_SKXCCM6_VWA1_VWB1_WGM1_WGMXCC1_WGMXCCGn1
    SolutionIndex: 68
    SolutionNameMin: Cijk_Ailk_Bjlk_BBS_BH_UserArgs_MT256x256x64_MI16x16x1_SN_LDSB1_CLR1_GSU0_GSUC0_GSUWGMRR0_K1_LBSPPA2048_LBSPPB2048_LPA0_LPB0_MIWT8_8_PLR1_SU32_SUM0_SUS256_SKXCCM6_VWA4_VWB4_WGM1_WGMXCC1_WGMXCCGn1
    SolutionIndex: 69
    SolutionNameMin: Cijk_Ailk_Bjlk_BBS_BH_UserArgs_MT256x256x64_MI16x16x1_SN_LDSB1_CLR1_GSU0_GSUC0_GSUWGMRR0_K1_LBSPPA2048_LBSPPB2048_LPA0_LPB0_MIWT8_8_PLR2_SU32_SUM0_SUS256_SKXCCM6_VWA4_VWB4_WGM1_WGMXCC1_WGMXCCGn1
    SolutionIndex: 70
    SolutionNameMin: Cijk_Ailk_Bjlk_BBS_BH_UserArgs_MT256x256x64_MI16x16x1_SN_LDSB1_CLR1_GSU0_GSUC0_GSUWGMRR0_K1_LBSPPA2048_LBSPPB2048_LPA0_LPB0_MIWT8_8_PLR2_SU32_SUM0_SUS256_SKXCCM6_VWA4_VWB8_WGM1_WGMXCC1_WGMXCCGn1
    SolutionIndex: 71
    SolutionNameMin: Cijk_Ailk_Bjlk_BBS_BH_UserArgs_MT256x256x64_MI16x16x1_SN_LDSB1_CLR1_GSU0_GSUC0_GSUWGMRR0_K1_LBSPPA2048_LBSPPB2048_LPA0_LPB0_MIWT8_8_PLR1_SU32_SUM0_SUS256_SKXCCM6_VWA4_VWB4_WGM4_WGMXCC1_WGMXCCGn1
    SolutionIndex: 72
    SolutionNameMin: Cijk_Ailk_Bjlk_BBS_BH_UserArgs_MT256x256x64_MI16x16x1_SN_LDSB1_CLR1_GSU0_GSUC0_GSUWGMRR0_K1_LBSPPA2048_LBSPPB2048_LPA0_LPB0_MIWT8_8_PLR1_SU32_SUM0_SUS256_SKXCCM6_VWA4_VWB4_WGM8_WGMXCC1_WGMXCCGn1
    SolutionIndex: 73
    SolutionNameMin: Cijk_Ailk_Bjlk_BBS_BH_UserArgs_MT256x256x64_MI16x16x1_SN_LDSB1_CLR1_GSU0_GSUC0_GSUWGMRR0_K1_LBSPPA2048_LBSPPB2048_LPA0_LPB0_MIWT8_8_PLR2_SU32_SUM0_SUS256_SKXCCM6_VWA4_VWB4_WGM8_WGMXCC1_WGMXCCGn1
    SolutionIndex: 74
    SolutionNameMin: Cijk_Ailk_Bjlk_BBS_BH_UserArgs_MT128x256x64_MI16x16x1_SN_LDSB1_CLR1_GSU0_GSUC0_GSUWGMRR0_K1_LBSPPA1024_LBSPPB2048_LPA32_LPB0_MIWT4_8_PLR2_SU32_SUM0_SUS256_SKXCCM6_VWA2_VWB4_WGM1_WGMXCC1_WGMXCCGn1
    SolutionIndex: 75
    SolutionNameMin: Cijk_Ailk_Bjlk_BBS_BH_UserArgs_MT128x256x64_MI16x16x1_SN_LDSB1_CLR1_GSU0_GSUC0_GSUWGMRR0_K1_LBSPPA1024_LBSPPB2048_LPA0_LPB32_MIWT4_8_PLR1_SU32_SUM0_SUS256_SKXCCM6_VWA4_VWB2_WGM8_WGMXCC1_WGMXCCGn1
    SolutionIndex: 76
    SolutionNameMin: Cijk_Ailk_Bjlk_BBS_BH_UserArgs_MT256x128x64_MI16x16x1_SN_LDSB1_CLR1_GSU0_GSUC0_GSUWGMRR0_K1_LBSPPA2048_LBSPPB1024_LPA32_LPB0_MIWT8_4_PLR1_SU32_SUM0_SUS256_SKXCCM6_VWA2_VWB4_WGM1_WGMXCC1_WGMXCCGn1
    SolutionIndex: 77
    SolutionNameMin: Cijk_Ailk_Bjlk_BBS_BH_UserArgs_MT256x128x64_MI16x16x1_SN_LDSB1_CLR1_GSU0_GSUC0_GSUWGMRR0_K1_LBSPPA2048_LBSPPB1024_LPA32_LPB0_MIWT8_4_PLR1_SU32_SUM0_SUS256_SKXCCM6_VWA2_VWB4_WGM8_WGMXCC1_WGMXCCGn1
    SolutionIndex: 78
    SolutionNameMin: Cijk_Ailk_Bjlk_BBS_BH_UserArgs_MT128x128x64_MI16x16x1_SN_LDSB1_CLR1_GSU0_GSUC0_GSUWGMRR0_K1_LBSPPA1024_LBSPPB1024_LPA0_LPB0_MIWT4_4_PLR1_SU32_SUM0_SUS256_SKXCCM6_VWA4_VWB4_WGM1_WGMXCC1_WGMXCCGn1
    SolutionIndex: 79
    SolutionNameMin: Cijk_Ailk_Bjlk_BBS_BH_UserArgs_MT128x128x64_MI16x16x1_SN_LDSB1_CLR1_GSU0_GSUC0_GSUWGMRR0_K1_LBSPPA1024_LBSPPB1024_LPA0_LPB0_MIWT4_4_PLR2_SU32_SUM0_SUS256_SKXCCM6_VWA4_VWB4_WGM1_WGMXCC1_WGMXCCGn1
    SolutionIndex: 80
    SolutionNameMin: Cijk_Ailk_Bjlk_BBS_BH_UserArgs_MT128x128x64_MI16x16x1_SN_LDSB1_CLR1_GSU0_GSUC0_GSUWGMRR0_K1_LBSPPA1024_LBSPPB1024_LPA0_LPB0_MIWT4_4_PLR1_SU32_SUM0_SUS256_SKXCCM6_VWA4_VWB4_WGM4_WGMXCC1_WGMXCCGn1
    SolutionIndex: 81
    SolutionNameMin: Cijk_Ailk_Bjlk_BBS_BH_UserArgs_MT128x128x64_MI16x16x1_SN_LDSB1_CLR1_GSU0_GSUC0_GSUWGMRR0_K1_LBSPPA1024_LBSPPB1024_LPA0_LPB0_MIWT4_4_PLR2_SU32_SUM0_SUS256_SKXCCM6_VWA4_VWB4_WGM4_WGMXCC1_WGMXCCGn1
    SolutionIndex: 82
    SolutionNameMin: Cijk_Ailk_Bjlk_BBS_BH_UserArgs_MT128x128x64_MI16x16x1_SN_LDSB1_CLR1_GSU0_GSUC0_GSUWGMRR0_K1_LBSPPA1024_LBSPPB1024_LPA0_LPB0_MIWT4_4_PLR1_SU32_SUM0_SUS256_SKXCCM6_VWA4_VWB4_WGM8_WGMXCC1_WGMXCCGn1
    SolutionIndex: 83
    SolutionNameMin: Cijk_Ailk_Bjlk_BBS_BH_UserArgs_MT64x128x64_MI16x16x1_SN_LDSB1_CLR1_GSU0_GSUC0_GSUWGMRR0_K1_LBSPPA512_LBSPPB1024_LPA32_LPB0_MIWT2_4_PLR2_SU32_SUM0_SUS256_SKXCCM6_VWA2_VWB4_WGM4_WGMXCC1_WGMXCCGn1
    SolutionIndex: 84
    SolutionNameMin: Cijk_Ailk_Bjlk_BBS_BH_UserArgs_MT64x128x64_MI16x16x1_SN_LDSB1_CLR1_GSU0_GSUC0_GSUWGMRR0_K1_LBSPPA512_LBSPPB1024_LPA32_LPB0_MIWT2_4_PLR2_SU32_SUM0_SUS256_SKXCCM6_VWA2_VWB4_WGM8_WGMXCC1_WGMXCCGn1
    SolutionIndex: 85
    SolutionNameMin: Cijk_Ailk_Bjlk_BBS_BH_UserArgs_MT128x64x64_MI16x16x1_SN_LDSB1_CLR1_GSU0_GSUC0_GSUWGMRR0_K1_LBSPPA1024_LBSPPB512_LPA0_LPB32_MIWT4_2_PLR1_SU32_SUM0_SUS256_SKXCCM6_VWA4_VWB2_WGM1_WGMXCC1_WGMXCCGn1
    SolutionIndex: 86
    SolutionNameMin: Cijk_Ailk_Bjlk_BBS_BH_UserArgs_MT128x64x64_MI16x16x1_SN_LDSB1_CLR1_GSU0_GSUC0_GSUWGMRR0_K1_LBSPPA1024_LBSPPB512_LPA0_LPB16_MIWT4_2_PLR2_SU32_SUM0_SUS256_SKXCCM6_VWA4_VWB1_WGM1_WGMXCC1_WGMXCCGn1
    SolutionIndex: 87
    SolutionNameMin: Cijk_Ailk_Bjlk_BBS_BH_UserArgs_MT128x64x64_MI16x16x1_SN_LDSB1_CLR1_GSU0_GSUC0_GSUWGMRR0_K1_LBSPPA1024_LBSPPB512_LPA32_LPB32_MIWT4_2_PLR2_SU32_SUM0_SUS256_SKXCCM6_VWA2_VWB2_WGM1_WGMXCC1_WGMXCCGn1
    SolutionIndex: 88
    SolutionNameMin: Cijk_Ailk_Bjlk_BBS_BH_UserArgs_MT128x64x64_MI16x16x1_SN_LDSB1_CLR1_GSU0_GSUC0_GSUWGMRR0_K1_LBSPPA1024_LBSPPB512_LPA0_LPB32_MIWT4_2_PLR2_SU32_SUM0_SUS256_SKXCCM6_VWA4_VWB2_WGM1_WGMXCC1_WGMXCCGn1
    SolutionIndex: 89
    SolutionNameMin: Cijk_Ailk_Bjlk_BBS_BH_UserArgs_MT128x64x64_MI16x16x1_SN_LDSB1_CLR1_GSU0_GSUC0_GSUWGMRR0_K1_LBSPPA1024_LBSPPB512_LPA0_LPB16_MIWT4_2_PLR1_SU32_SUM0_SUS256_SKXCCM6_VWA4_VWB1_WGM4_WGMXCC1_WGMXCCGn1
    SolutionIndex: 90
    SolutionNameMin: Cijk_Ailk_Bjlk_BBS_BH_UserArgs_MT128x64x64_MI16x16x1_SN_LDSB1_CLR1_GSU0_GSUC0_GSUWGMRR0_K1_LBSPPA1024_LBSPPB512_LPA0_LPB32_MIWT4_2_PLR2_SU32_SUM0_SUS256_SKXCCM6_VWA4_VWB2_WGM4_WGMXCC1_WGMXCCGn1
    SolutionIndex: 91
    SolutionNameMin: Cijk_Ailk_Bjlk_BBS_BH_UserArgs_MT128x64x64_MI16x16x1_SN_LDSB1_CLR1_GSU0_GSUC0_GSUWGMRR0_K1_LBSPPA1024_LBSPPB512_LPA0_LPB32_MIWT4_2_PLR1_SU32_SUM0_SUS256_SKXCCM6_VWA4_VWB2_WGM8_WGMXCC1_WGMXCCGn1
    SolutionIndex: 92
    SolutionNameMin: Cijk_Ailk_Bjlk_BBS_BH_UserArgs_MT128x64x64_MI16x16x1_SN_LDSB1_CLR1_GSU0_GSUC0_GSUWGMRR0_K1_LBSPPA1024_LBSPPB512_LPA0_LPB32_MIWT4_2_PLR2_SU32_SUM0_SUS256_SKXCCM6_VWA4_VWB2_WGM8_WGMXCC1_WGMXCCGn1
    SolutionIndex: 93
    SolutionNameMin: Cijk_Ailk_Bjlk_BBS_BH_UserArgs_MT64x64x64_MI16x16x1_SN_LDSB1_CLR1_GSU0_GSUC0_GSUWGMRR0_K1_LBSPPA512_LBSPPB512_LPA32_LPB32_MIWT2_2_PLR1_SU32_SUM0_SUS256_SKXCCM6_VWA2_VWB2_WGM1_WGMXCC1_WGMXCCGn1
    SolutionIndex: 94
    SolutionNameMin: Cijk_Ailk_Bjlk_BBS_BH_UserArgs_MT64x64x64_MI16x16x1_SN_LDSB1_CLR1_GSU0_GSUC0_GSUWGMRR0_K1_LBSPPA512_LBSPPB512_LPA32_LPB32_MIWT2_2_PLR2_SU32_SUM0_SUS256_SKXCCM6_VWA2_VWB2_WGM1_WGMXCC1_WGMXCCGn1
    SolutionIndex: 95
    SolutionNameMin: Cijk_Ailk_Bjlk_BBS_BH_UserArgs_MT64x64x64_MI16x16x1_SN_LDSB1_CLR1_GSU0_GSUC0_GSUWGMRR0_K1_LBSPPA512_LBSPPB512_LPA32_LPB32_MIWT2_2_PLR1_SU32_SUM0_SUS256_SKXCCM6_VWA2_VWB2_WGM4_WGMXCC1_WGMXCCGn1
    SolutionIndex: 96
    SolutionNameMin: Cijk_Ailk_Bjlk_BBS_BH_UserArgs_MT64x64x64_MI16x16x1_SN_LDSB1_CLR1_GSU0_GSUC0_GSUWGMRR0_K1_LBSPPA512_LBSPPB512_LPA32_LPB32_MIWT2_2_PLR2_SU32_SUM0_SUS256_SKXCCM6_VWA2_VWB2_WGM4_WGMXCC1_WGMXCCGn1
    SolutionIndex: 97
    SolutionNameMin: Cijk_Ailk_Bjlk_BBS_BH_UserArgs_MT64x64x64_MI16x16x1_SN_LDSB1_CLR1_GSU0_GSUC0_GSUWGMRR0_K1_LBSPPA512_LBSPPB512_LPA32_LPB32_MIWT2_2_PLR1_SU32_SUM0_SUS256_SKXCCM6_VWA2_VWB2_WGM8_WGMXCC1_WGMXCCGn1
    SolutionIndex: 98
    SolutionNameMin: Cijk_Ailk_Bjlk_BBS_BH_UserArgs_MT64x64x64_MI16x16x1_SN_LDSB1_CLR1_GSU0_GSUC0_GSUWGMRR0_K1_LBSPPA512_LBSPPB512_LPA32_LPB32_MIWT2_2_PLR2_SU32_SUM0_SUS256_SKXCCM6_VWA2_VWB2_WGM8_WGMXCC1_WGMXCCGn1
    SolutionIndex: 99
    SolutionNameMin: Cijk_Ailk_Bjlk_BBS_BH_UserArgs_MT32x64x64_MI16x16x1_SN_LDSB0_CLR1_GSU0_GSUC0_GSUWGMRR0_K1_LBSPPA256_LBSPPB512_LPA16_LPB32_MIWT1_2_PLR1_SU32_SUM0_SUS256_SKXCCM6_VWA1_VWB2_WGM1_WGMXCC1_WGMXCCGn1
    SolutionIndex: 100
    SolutionNameMin: Cijk_Ailk_Bjlk_BBS_BH_UserArgs_MT32x64x64_MI16x16x1_SN_LDSB0_CLR1_GSU0_GSUC0_GSUWGMRR0_K1_LBSPPA256_LBSPPB512_LPA16_LPB32_MIWT1_2_PLR2_SU32_SUM0_SUS256_SKXCCM6_VWA1_VWB2_WGM1_WGMXCC1_WGMXCCGn1
    SolutionIndex: 101
    SolutionNameMin: Cijk_Ailk_Bjlk_BBS_BH_UserArgs_MT32x64x64_MI16x16x1_SN_LDSB0_CLR1_GSU0_GSUC0_GSUWGMRR0_K1_LBSPPA256_LBSPPB512_LPA16_LPB32_MIWT1_2_PLR2_SU32_SUM0_SUS256_SKXCCM6_VWA1_VWB2_WGM4_WGMXCC1_WGMXCCGn1
    SolutionIndex: 102
    SolutionNameMin: Cijk_Ailk_Bjlk_BBS_BH_UserArgs_MT64x32x64_MI16x16x1_SN_LDSB0_CLR1_GSU0_GSUC0_GSUWGMRR0_K1_LBSPPA512_LBSPPB256_LPA32_LPB16_MIWT2_1_PLR2_SU32_SUM0_SUS256_SKXCCM6_VWA2_VWB1_WGM1_WGMXCC1_WGMXCCGn1
    SolutionIndex: 103
    SolutionNameMin: Cijk_Ailk_Bjlk_BBS_BH_UserArgs_MT32x32x64_MI16x16x1_SN_LDSB0_CLR1_GSU0_GSUC0_GSUWGMRR0_K1_LBSPPA256_LBSPPB256_LPA16_LPB16_MIWT1_1_PLR1_SU32_SUM0_SUS256_SKXCCM6_VWA1_VWB1_WGM1_WGMXCC1_WGMXCCGn1
    SolutionIndex: 104
    SolutionNameMin: Cijk_Ailk_Bjlk_BBS_BH_UserArgs_MT32x32x64_MI16x16x1_SN_LDSB0_CLR1_GSU0_GSUC0_GSUWGMRR0_K1_LBSPPA256_LBSPPB256_LPA16_LPB16_MIWT1_1_PLR2_SU32_SUM0_SUS256_SKXCCM6_VWA1_VWB1_WGM1_WGMXCC1_WGMXCCGn1
    SolutionIndex: 105
    SolutionNameMin: Cijk_Ailk_Bjlk_BBS_BH_UserArgs_MT128x128x128_MI16x16x1_SN_LDSB1_CLR1_GSU0_GSUC0_GSUWGMRR0_K1_LBSPPA1024_LBSPPB1024_LPA0_LPB0_MIWT4_4_PLR1_SU32_SUM0_SUS256_SKXCCM6_VWA4_VWB4_WGM1_WGMXCC1_WGMXCCGn1
    SolutionIndex: 106
    SolutionNameMin: Cijk_Ailk_Bjlk_BBS_BH_UserArgs_MT128x128x128_MI16x16x1_SN_LDSB1_CLR1_GSU0_GSUC0_GSUWGMRR0_K1_LBSPPA1024_LBSPPB1024_LPA0_LPB0_MIWT4_4_PLR1_SU32_SUM0_SUS256_SKXCCM6_VWA4_VWB4_WGM4_WGMXCC1_WGMXCCGn1
    SolutionIndex: 107
    SolutionNameMin: Cijk_Ailk_Bjlk_BBS_BH_UserArgs_MT128x128x128_MI16x16x1_SN_LDSB1_CLR1_GSU0_GSUC0_GSUWGMRR0_K1_LBSPPA1024_LBSPPB1024_LPA0_LPB0_MIWT4_4_PLR1_SU32_SUM0_SUS256_SKXCCM6_VWA4_VWB4_WGM8_WGMXCC1_WGMXCCGn1
    SolutionIndex: 108
    SolutionNameMin: Cijk_Ailk_Bjlk_BBS_BH_UserArgs_MT128x128x128_MI16x16x1_SN_LDSB1_CLR1_GSU0_GSUC0_GSUWGMRR0_K1_LBSPPA1024_LBSPPB1024_LPA0_LPB0_MIWT4_4_PLR2_SU32_SUM0_SUS256_SKXCCM6_VWA4_VWB4_WGM8_WGMXCC1_WGMXCCGn1
    SolutionIndex: 109
    SolutionNameMin: Cijk_Ailk_Bjlk_BBS_BH_UserArgs_MT32x64x128_MI16x16x1_SN_LDSB1_CLR1_GSU0_GSUC0_GSUWGMRR0_K1_LBSPPA256_LBSPPB512_LPA16_LPB32_MIWT1_2_PLR1_SU32_SUM0_SUS256_SKXCCM6_VWA1_VWB2_WGM1_WGMXCC1_WGMXCCGn1
    SolutionIndex: 110
    SolutionNameMin: Cijk_Ailk_Bjlk_BBS_BH_UserArgs_MT32x64x128_MI16x16x1_SN_LDSB1_CLR1_GSU0_GSUC0_GSUWGMRR0_K1_LBSPPA256_LBSPPB512_LPA16_LPB32_MIWT1_2_PLR2_SU32_SUM0_SUS256_SKXCCM6_VWA1_VWB2_WGM1_WGMXCC1_WGMXCCGn1
    SolutionIndex: 111
    SolutionNameMin: Cijk_Ailk_Bjlk_BBS_BH_UserArgs_MT64x32x128_MI16x16x1_SN_LDSB1_CLR1_GSU0_GSUC0_GSUWGMRR0_K1_LBSPPA512_LBSPPB256_LPA32_LPB16_MIWT2_1_PLR2_SU32_SUM0_SUS256_SKXCCM6_VWA2_VWB1_WGM1_WGMXCC1_WGMXCCGn1
    SolutionIndex: 112
    SolutionNameMin: Cijk_Ailk_Bjlk_BBS_BH_UserArgs_MT32x32x128_MI16x16x1_SN_LDSB1_CLR1_GSU0_GSUC0_GSUWGMRR0_K1_LBSPPA256_LBSPPB256_LPA16_LPB16_MIWT1_1_PLR1_SU32_SUM0_SUS256_SKXCCM6_VWA1_VWB1_WGM1_WGMXCC1_WGMXCCGn1
    SolutionIndex: 113
    SolutionNameMin: Cijk_Ailk_Bjlk_BBS_BH_UserArgs_MT32x32x128_MI16x16x1_SN_LDSB1_CLR1_GSU0_GSUC0_GSUWGMRR0_K1_LBSPPA256_LBSPPB256_LPA16_LPB16_MIWT1_1_PLR2_SU32_SUM0_SUS256_SKXCCM6_VWA1_VWB1_WGM1_WGMXCC1_WGMXCCGn1
    SolutionIndex: 114
    SolutionNameMin: Cijk_Ailk_Bjlk_BBS_BH_UserArgs_MT32x32x32_MI16x16x1_SN_LDSB0_CLR0_GSU0_GSUC0_GSUWGMRR0_K1_LBSPPA256_LBSPPB256_LPA16_LPB16_MIWT1_1_PLR0_SU32_SUM0_SUS256_SKXCCM0_VWA1_VWB1_WGM1_WGMXCC1_WGMXCCGn1
- - - [128, 128, 1, 128, 128, 128, 128, 128]
    - [112, 0.079]
  - - [128, 128, 1, 256, 128, 128, 128, 128]
    - [31, 0.106]
  - - [128, 128, 1, 512, 128, 128, 128, 128]
    - [32, 0.175]
  - - [128, 128, 1, 1024, 128, 128, 128, 128]
    - [113, 0.266]
  - - [128, 128, 1, 2048, 128, 128, 128, 128]
    - [16, 0.356]
  - - [128, 128, 1, 4096, 128, 128, 128, 128]
    - [104, 0.672]
  - - [128, 128, 1, 8192, 128, 128, 128, 128]
    - [113, 1.239]
  - - [128, 256, 1, 128, 128, 128, 128, 256]
    - [32, 0.157]
  - - [128, 256, 1, 256, 128, 128, 128, 256]
    - [31, 0.206]
  - - [128, 256, 1, 512, 128, 128, 128, 256]
    - [112, 0.341]
  - - [128, 256, 1, 1024, 128, 128, 128, 256]
    - [103, 0.524]
  - - [128, 256, 1, 2048, 128, 128, 128, 256]
    - [113, 0.97]
  - - [128, 256, 1, 4096, 128, 128, 128, 256]
    - [113, 1.637]
  - - [128, 256, 1, 8192, 128, 128, 128, 256]
    - [31, 2.554]
  - - [128, 512, 1, 128, 128, 128, 128, 512]
    - [32, 0.309]
  - - [128, 512, 1, 256, 128, 128, 128, 512]
    - [31, 0.404]
  - - [128, 512, 1, 512, 128, 128, 128, 512]
    - [66, 0.658]
  - - [128, 512, 1, 1024, 128, 128, 128, 512]
    - [66, 1.194]
  - - [128, 512, 1, 2048, 128, 128, 128, 512]
    - [112, 2.033]
  - - [128, 512, 1, 4096, 128, 128, 128, 512]
    - [112, 3.02]
  - - [128, 512, 1, 8192, 128, 128, 128, 512]
    - [99, 4.445]
  - - [128, 1024, 1, 128, 128, 128, 128, 1024]
    - [31, 0.609]
  - - [128, 1024, 1, 256, 128, 128, 128, 1024]
    - [16, 0.764]
  - - [128, 1024, 1, 512, 128, 128, 128, 1024]
    - [31, 1.338]
  - - [128, 1024, 1, 1024, 128, 128, 128, 1024]
    - [112, 2.245]
  - - [128, 1024, 1, 2048, 128, 128, 128, 1024]
    - [102, 3.533]
  - - [128, 1024, 1, 4096, 128, 128, 128, 1024]
    - [100, 5.225]
  - - [128, 1024, 1, 8192, 128, 128, 128, 1024]
    - [14, 7.165]
  - - [128, 2048, 1, 128, 128, 128, 128, 2048]
    - [30, 1.139]
  - - [128, 2048, 1, 256, 128, 128, 128, 2048]
    - [16, 1.822]
  - - [128, 2048, 1, 512, 128, 128, 128, 2048]
    - [16, 2.776]
  - - [128, 2048, 1, 1024, 128, 128, 128, 2048]
    - [110, 3.987]
  - - [128, 2048, 1, 2048, 128, 128, 128, 2048]
    - [93, 5.994]
  - - [128, 2048, 1, 4096, 128, 128, 128, 2048]
    - [93, 8.743]
  - - [128, 2048, 1, 8192, 128, 128, 128, 2048]
    - [12, 10.792]
  - - [128, 4096, 1, 128, 128, 128, 128, 4096]
    - [29, 2.076]
  - - [128, 4096, 1, 256, 128, 128, 128, 4096]
    - [26, 3.265]
  - - [128, 4096, 1, 512, 128, 128, 128, 4096]
    - [102, 4.887]
  - - [128, 4096, 1, 1024, 128, 128, 128, 4096]
    - [111, 6.696]
  - - [128, 4096, 1, 2048, 128, 128, 128, 4096]
    - [93, 9.465]
  - - [128, 4096, 1, 4096, 128, 128, 128, 4096]
    - [92, 12.175]
  - - [128, 4096, 1, 8192, 128, 128, 128, 4096]
    - [11, 13.893]
  - - [128, 8192, 1, 128, 128, 128, 128, 8192]
    - [24, 3.42]
  - - [128, 8192, 1, 256, 128, 128, 128, 8192]
    - [93, 5.565]
  - - [128, 8192, 1, 512, 128, 128, 128, 8192]
    - [94, 8.406]
  - - [128, 8192, 1, 1024, 128, 128, 128, 8192]
    - [94, 10.892]
  - - [128, 8192, 1, 2048, 128, 128, 128, 8192]
    - [21, 12.75]
  - - [128, 8192, 1, 4096, 128, 128, 128, 8192]
    - [13, 14.623]
  - - [128, 8192, 1, 8192, 128, 128, 128, 8192]
    - [7, 16.287]
  - - [256, 128, 1, 128, 256, 256, 256, 128]
    - [32, 0.155]
  - - [256, 128, 1, 256, 256, 256, 256, 128]
    - [32, 0.204]
  - - [256, 128, 1, 512, 256, 256, 256, 128]
    - [112, 0.339]
  - - [256, 128, 1, 1024, 256, 256, 256, 128]
    - [103, 0.526]
  - - [256, 128, 1, 2048, 256, 256, 256, 128]
    - [112, 0.971]
  - - [256, 128, 1, 4096, 256, 256, 256, 128]
    - [113, 1.635]
  - - [256, 128, 1, 8192, 256, 256, 256, 128]
    - [16, 2.561]
  - - [256, 256, 1, 128, 256, 256, 256, 256]
    - [32, 0.31]
  - - [256, 256, 1, 256, 256, 256, 256, 256]
    - [31, 0.401]
  - - [256, 256, 1, 512, 256, 256, 256, 256]
    - [67, 0.664]
  - - [256, 256, 1, 1024, 256, 256, 256, 256]
    - [66, 1.186]
  - - [256, 256, 1, 2048, 256, 256, 256, 256]
    - [113, 2.028]
  - - [256, 256, 1, 4096, 256, 256, 256, 256]
    - [112, 3.056]
  - - [256, 256, 1, 8192, 256, 256, 256, 256]
    - [30, 4.565]
  - - [256, 512, 1, 128, 256, 256, 256, 512]
    - [32, 0.604]
  - - [256, 512, 1, 256, 256, 256, 256, 512]
    - [31, 0.766]
  - - [256, 512, 1, 512, 256, 256, 256, 512]
    - [31, 1.331]
  - - [256, 512, 1, 1024, 256, 256, 256, 512]
    - [112, 2.24]
  - - [256, 512, 1, 2048, 256, 256, 256, 512]
    - [111, 3.57]
  - - [256, 512, 1, 4096, 256, 256, 256, 512]
    - [111, 5.326]
  - - [256, 512, 1, 8192, 256, 256, 256, 512]
    - [65, 7.283]
  - - [256, 1024, 1, 128, 256, 256, 256, 1024]
    - [30, 1.144]
  - - [256, 1024, 1, 256, 256, 256, 256, 1024]
    - [16, 1.843]
  - - [256, 1024, 1, 512, 256, 256, 256, 1024]
    - [31, 2.718]
  - - [256, 1024, 1, 1024, 256, 256, 256, 1024]
    - [111, 4.002]
  - - [256, 1024, 1, 2048, 256, 256, 256, 1024]
    - [97, 5.836]
  - - [256, 1024, 1, 4096, 256, 256, 256, 1024]
    - [93, 8.694]
  - - [256, 1024, 1, 8192, 256, 256, 256, 1024]
    - [63, 10.964]
  - - [256, 2048, 1, 128, 256, 256, 256, 2048]
    - [29, 2.06]
  - - [256, 2048, 1, 256, 256, 256, 256, 2048]
    - [26, 3.241]
  - - [256, 2048, 1, 512, 256, 256, 256, 2048]
    - [25, 4.917]
  - - [256, 2048, 1, 1024, 256, 256, 256, 2048]
    - [111, 6.668]
  - - [256, 2048, 1, 2048, 256, 256, 256, 2048]
    - [94, 9.425]
  - - [256, 2048, 1, 4096, 256, 256, 256, 2048]
    - [90, 12.248]
  - - [256, 2048, 1, 8192, 256, 256, 256, 2048]
    - [59, 13.624]
  - - [256, 4096, 1, 128, 256, 256, 256, 4096]
    - [24, 3.387]
  - - [256, 4096, 1, 256, 256, 256, 256, 4096]
    - [23, 5.646]
  - - [256, 4096, 1, 512, 256, 256, 256, 4096]
    - [94, 8.378]
  - - [256, 4096, 1, 1024, 256, 256, 256, 4096]
    - [94, 11.205]
  - - [256, 4096, 1, 2048, 256, 256, 256, 4096]
    - [86, 12.699]
  - - [256, 4096, 1, 4096, 256, 256, 256, 4096]
    - [79, 14.972]
  - - [256, 4096, 1, 8192, 256, 256, 256, 4096]
    - [57, 15.55]
  - - [256, 8192, 1, 128, 256, 256, 256, 8192]
    - [9, 5.177]
  - - [256, 8192, 1, 256, 256, 256, 256, 8192]
    - [62, 8.295]
  - - [256, 8192, 1, 512, 256, 256, 256, 8192]
    - [11, 11.844]
  - - [256, 8192, 1, 1024, 256, 256, 256, 8192]
    - [90, 14.811]
  - - [256, 8192, 1, 2048, 256, 256, 256, 8192]
    - [90, 15.814]
  - - [256, 8192, 1, 4096, 256, 256, 256, 8192]
    - [6, 17.171]
  - - [256, 8192, 1, 8192, 256, 256, 256, 8192]
    - [4, 18.434]
  - - [512, 128, 1, 128, 512, 512, 512, 128]
    - [32, 0.31]
  - - [512, 128, 1, 256, 512, 512, 512, 128]
    - [31, 0.398]
  - - [512, 128, 1, 512, 512, 512, 512, 128]
    - [67, 0.668]
  - - [512, 128, 1, 1024, 512, 512, 512, 128]
    - [66, 1.181]
  - - [512, 128, 1, 2048, 512, 512, 512, 128]
    - [112, 2.025]
  - - [512, 128, 1, 4096, 512, 512, 512, 128]
    - [31, 2.99]
  - - [512, 128, 1, 8192, 512, 512, 512, 128]
    - [26, 4.393]
  - - [512, 256, 1, 128, 512, 512, 512, 256]
    - [32, 0.59]
  - - [512, 256, 1, 256, 512, 512, 512, 256]
    - [32, 0.759]
  - - [512, 256, 1, 512, 512, 512, 512, 256]
    - [32, 1.317]
  - - [512, 256, 1, 1024, 512, 512, 512, 256]
    - [113, 2.194]
  - - [512, 256, 1, 2048, 512, 512, 512, 256]
    - [111, 3.528]
  - - [512, 256, 1, 4096, 512, 512, 512, 256]
    - [30, 5.288]
  - - [512, 256, 1, 8192, 512, 512, 512, 256]
    - [15, 7.295]
  - - [512, 512, 1, 128, 512, 512, 512, 512]
    - [30, 1.128]
  - - [512, 512, 1, 256, 512, 512, 512, 512]
    - [16, 1.808]
  - - [512, 512, 1, 512, 512, 512, 512, 512]
    - [16, 2.756]
  - - [512, 512, 1, 1024, 512, 512, 512, 512]
    - [111, 3.959]
  - - [512, 512, 1, 2048, 512, 512, 512, 512]
    - [30, 5.707]
  - - [512, 512, 1, 4096, 512, 512, 512, 512]
    - [24, 8.922]
  - - [512, 512, 1, 8192, 512, 512, 512, 512]
    - [63, 10.925]
  - - [512, 1024, 1, 128, 512, 512, 512, 1024]
    - [29, 2.083]
  - - [512, 1024, 1, 256, 512, 512, 512, 1024]
    - [25, 3.219]
  - - [512, 1024, 1, 512, 512, 512, 512, 1024]
    - [25, 4.912]
  - - [512, 1024, 1, 1024, 512, 512, 512, 1024]
    - [30, 6.695]
  - - [512, 1024, 1, 2048, 512, 512, 512, 1024]
    - [93, 9.586]
  - - [512, 1024, 1, 4096, 512, 512, 512, 1024]
    - [85, 12.043]
  - - [512, 1024, 1, 8192, 512, 512, 512, 1024]
    - [59, 13.748]
  - - [512, 2048, 1, 128, 512, 512, 512, 2048]
    - [14, 3.288]
  - - [512, 2048, 1, 256, 512, 512, 512, 2048]
    - [23, 5.553]
  - - [512, 2048, 1, 512, 512, 512, 512, 2048]
    - [24, 8.269]
  - - [512, 2048, 1, 1024, 512, 512, 512, 2048]
    - [94, 11.041]
  - - [512, 2048, 1, 2048, 512, 512, 512, 2048]
    - [88, 12.945]
  - - [512, 2048, 1, 4096, 512, 512, 512, 2048]
    - [78, 14.874]
  - - [512, 2048, 1, 8192, 512, 512, 512, 2048]
    - [58, 15.335]
  - - [512, 4096, 1, 128, 512, 512, 512, 4096]
    - [9, 5.2]
  - - [512, 4096, 1, 256, 512, 512, 512, 4096]
    - [9, 8.417]
  - - [512, 4096, 1, 512, 512, 512, 512, 4096]
    - [11, 11.909]
  - - [512, 4096, 1, 1024, 512, 512, 512, 4096]
    - [90, 15.084]
  - - [512, 4096, 1, 2048, 512, 512, 512, 4096]
    - [87, 16.12]
  - - [512, 4096, 1, 4096, 512, 512, 512, 4096]
    - [59, 16.163]
  - - [512, 4096, 1, 8192, 512, 512, 512, 4096]
    - [47, 17.857]
  - - [512, 8192, 1, 128, 512, 512, 512, 8192]
    - [6, 7.512]
  - - [512, 8192, 1, 256, 512, 512, 512, 8192]
    - [82, 11.322]
  - - [512, 8192, 1, 512, 512, 512, 512, 8192]
    - [78, 16.279]
  - - [512, 8192, 1, 1024, 512, 512, 512, 8192]
    - [59, 18.383]
  - - [512, 8192, 1, 2048, 512, 512, 512, 8192]
    - [78, 20.756]
  - - [512, 8192, 1, 4096, 512, 512, 512, 8192]
    - [106, 19.752]
  - - [512, 8192, 1, 8192, 512, 512, 512, 8192]
    - [68, 21.041]
  - - [1024, 128, 1, 128, 1024, 1024, 1024, 128]
    - [31, 0.605]
  - - [1024, 128, 1, 256, 1024, 1024, 1024, 128]
    - [32, 0.762]
  - - [1024, 128, 1, 512, 1024, 1024, 1024, 128]
    - [32, 1.338]
  - - [1024, 128, 1, 1024, 1024, 1024, 1024, 128]
    - [112, 2.242]
  - - [1024, 128, 1, 2048, 1024, 1024, 1024, 128]
    - [30, 3.547]
  - - [1024, 128, 1, 4096, 1024, 1024, 1024, 128]
    - [101, 5.149]
  - - [1024, 128, 1, 8192, 1024, 1024, 1024, 128]
    - [98, 7.125]
  - - [1024, 256, 1, 128, 1024, 1024, 1024, 256]
    - [30, 1.124]
  - - [1024, 256, 1, 256, 1024, 1024, 1024, 256]
    - [16, 1.824]
  - - [1024, 256, 1, 512, 1024, 1024, 1024, 256]
    - [16, 2.74]
  - - [1024, 256, 1, 1024, 1024, 1024, 1024, 256]
    - [111, 3.964]
  - - [1024, 256, 1, 2048, 1024, 1024, 1024, 256]
    - [30, 5.677]
  - - [1024, 256, 1, 4096, 1024, 1024, 1024, 256]
    - [97, 8.395]
  - - [1024, 256, 1, 8192, 1024, 1024, 1024, 256]
    - [11, 10.755]
  - - [1024, 512, 1, 128, 1024, 1024, 1024, 512]
    - [28, 2.063]
  - - [1024, 512, 1, 256, 1024, 1024, 1024, 512]
    - [25, 3.224]
  - - [1024, 512, 1, 512, 1024, 1024, 1024, 512]
    - [25, 4.892]
  - - [1024, 512, 1, 1024, 1024, 1024, 1024, 512]
    - [30, 6.697]
  - - [1024, 512, 1, 2048, 1024, 1024, 1024, 512]
    - [98, 9.45]
  - - [1024, 512, 1, 4096, 1024, 1024, 1024, 512]
    - [92, 12.169]
  - - [1024, 512, 1, 8192, 1024, 1024, 1024, 512]
    - [8, 13.658]
  - - [1024, 1024, 1, 128, 1024, 1024, 1024, 1024]
    - [24, 3.408]
  - - [1024, 1024, 1, 256, 1024, 1024, 1024, 1024]
    - [23, 5.609]
  - - [1024, 1024, 1, 512, 1024, 1024, 1024, 1024]
    - [24, 8.355]
  - - [1024, 1024, 1, 1024, 1024, 1024, 1024, 1024]
    - [24, 11.16]
  - - [1024, 1024, 1, 2048, 1024, 1024, 1024, 1024]
    - [22, 12.966]
  - - [1024, 1024, 1, 4096, 1024, 1024, 1024, 1024]
    - [19, 15.051]
  - - [1024, 1024, 1, 8192, 1024, 1024, 1024, 1024]
    - [27, 15.408]
  - - [1024, 2048, 1, 128, 1024, 1024, 1024, 2048]
    - [10, 5.202]
  - - [1024, 2048, 1, 256, 1024, 1024, 1024, 2048]
    - [9, 8.355]
  - - [1024, 2048, 1, 512, 1024, 1024, 1024, 2048]
    - [9, 12.03]
  - - [1024, 2048, 1, 1024, 1024, 1024, 1024, 2048]
    - [22, 14.88]
  - - [1024, 2048, 1, 2048, 1024, 1024, 1024, 2048]
    - [88, 15.725]
  - - [1024, 2048, 1, 4096, 1024, 1024, 1024, 2048]
    - [59, 16.492]
  - - [1024, 2048, 1, 8192, 1024, 1024, 1024, 2048]
    - [50, 17.467]
  - - [1024, 4096, 1, 128, 1024, 1024, 1024, 4096]
    - [6, 7.55]
  - - [1024, 4096, 1, 256, 1024, 1024, 1024, 4096]
    - [20, 11.413]
  - - [1024, 4096, 1, 512, 1024, 1024, 1024, 4096]
    - [78, 16.463]
  - - [1024, 4096, 1, 1024, 1024, 1024, 1024, 4096]
    - [59, 18.446]
  - - [1024, 4096, 1, 2048, 1024, 1024, 1024, 4096]
    - [78, 20.404]
  - - [1024, 4096, 1, 4096, 1024, 1024, 1024, 4096]
    - [105, 19.422]
  - - [1024, 4096, 1, 8192, 1024, 1024, 1024, 4096]
    - [68, 20.576]
  - - [1024, 8192, 1, 128, 1024, 1024, 1024, 8192]
    - [56, 9.909]
  - - [1024, 8192, 1, 256, 1024, 1024, 1024, 8192]
    - [45, 13.978]
  - - [1024, 8192, 1, 512, 1024, 1024, 1024, 8192]
    - [48, 18.3]
  - - [1024, 8192, 1, 1024, 1024, 1024, 1024, 8192]
    - [49, 21.481]
  - - [1024, 8192, 1, 2048, 1024, 1024, 1024, 8192]
    - [76, 20.571]
  - - [1024, 8192, 1, 4096, 1024, 1024, 1024, 8192]
    - [68, 21.341]
  - - [1024, 8192, 1, 8192, 1024, 1024, 1024, 8192]
    - [68, 23.721]
  - - [2048, 128, 1, 128, 2048, 2048, 2048, 128]
    - [30, 1.122]
  - - [2048, 128, 1, 256, 2048, 2048, 2048, 128]
    - [16, 1.822]
  - - [2048, 128, 1, 512, 2048, 2048, 2048, 128]
    - [16, 2.777]
  - - [2048, 128, 1, 1024, 2048, 2048, 2048, 128]
    - [109, 3.967]
  - - [2048, 128, 1, 2048, 2048, 2048, 2048, 128]
    - [97, 5.846]
  - - [2048, 128, 1, 4096, 2048, 2048, 2048, 128]
    - [97, 8.481]
  - - [2048, 128, 1, 8192, 2048, 2048, 2048, 128]
    - [64, 10.527]
  - - [2048, 256, 1, 128, 2048, 2048, 2048, 256]
    - [29, 2.067]
  - - [2048, 256, 1, 256, 2048, 2048, 2048, 256]
    - [26, 3.245]
  - - [2048, 256, 1, 512, 2048, 2048, 2048, 256]
    - [25, 4.932]
  - - [2048, 256, 1, 1024, 2048, 2048, 2048, 256]
    - [30, 6.731]
  - - [2048, 256, 1, 2048, 2048, 2048, 2048, 256]
    - [95, 9.198]
  - - [2048, 256, 1, 4096, 2048, 2048, 2048, 256]
    - [92, 12.012]
  - - [2048, 256, 1, 8192, 2048, 2048, 2048, 256]
    - [80, 13.875]
  - - [2048, 512, 1, 128, 2048, 2048, 2048, 512]
    - [24, 3.358]
  - - [2048, 512, 1, 256, 2048, 2048, 2048, 512]
    - [23, 5.615]
  - - [2048, 512, 1, 512, 2048, 2048, 2048, 512]
    - [23, 8.291]
  - - [2048, 512, 1, 1024, 2048, 2048, 2048, 512]
    - [24, 11.204]
  - - [2048, 512, 1, 2048, 2048, 2048, 2048, 512]
    - [91, 12.667]
  - - [2048, 512, 1, 4096, 2048, 2048, 2048, 512]
    - [81, 14.462]
  - - [2048, 512, 1, 8192, 2048, 2048, 2048, 512]
    - [61, 15.951]
  - - [2048, 1024, 1, 128, 2048, 2048, 2048, 1024]
    - [9, 5.216]
  - - [2048, 1024, 1, 256, 2048, 2048, 2048, 1024]
    - [9, 8.445]
  - - [2048, 1024, 1, 512, 2048, 2048, 2048, 1024]
    - [9, 11.986]
  - - [2048, 1024, 1, 1024, 2048, 2048, 2048, 1024]
    - [9, 14.482]
  - - [2048, 1024, 1, 2048, 2048, 2048, 2048, 1024]
    - [80, 15.768]
  - - [2048, 1024, 1, 4096, 2048, 2048, 2048, 1024]
    - [27, 16.243]
  - - [2048, 1024, 1, 8192, 2048, 2048, 2048, 1024]
    - [44, 17.362]
  - - [2048, 2048, 1, 128, 2048, 2048, 2048, 2048]
    - [6, 7.557]
  - - [2048, 2048, 1, 256, 2048, 2048, 2048, 2048]
    - [20, 11.598]
  - - [2048, 2048, 1, 512, 2048, 2048, 2048, 2048]
    - [80, 15.857]
  - - [2048, 2048, 1, 1024, 2048, 2048, 2048, 2048]
    - [60, 18.058]
  - - [2048, 2048, 1, 2048, 2048, 2048, 2048, 2048]
    - [78, 19.717]
  - - [2048, 2048, 1, 4096, 2048, 2048, 2048, 2048]
    - [105, 19.312]
  - - [2048, 2048, 1, 8192, 2048, 2048, 2048, 2048]
    - [71, 20.549]
  - - [2048, 4096, 1, 128, 2048, 2048, 2048, 4096]
    - [56, 9.525]
  - - [2048, 4096, 1, 256, 2048, 2048, 2048, 4096]
    - [55, 13.88]
  - - [2048, 4096, 1, 512, 2048, 2048, 2048, 4096]
    - [56, 17.789]
  - - [2048, 4096, 1, 1024, 2048, 2048, 2048, 4096]
    - [46, 21.263]
  - - [2048, 4096, 1, 2048, 2048, 2048, 2048, 4096]
    - [74, 20.693]
  - - [2048, 4096, 1, 4096, 2048, 2048, 2048, 4096]
    - [72, 21.032]
  - - [2048, 4096, 1, 8192, 2048, 2048, 2048, 4096]
    - [68, 24.094]
  - - [2048, 8192, 1, 128, 2048, 2048, 2048, 8192]
    - [35, 8.882]
  - - [2048, 8192, 1, 256, 2048, 2048, 2048, 8192]
    - [35, 13.629]
  - - [2048, 8192, 1, 512, 2048, 2048, 2048, 8192]
    - [36, 18.092]
  - - [2048, 8192, 1, 1024, 2048, 2048, 2048, 8192]
    - [35, 21.132]
  - - [2048, 8192, 1, 2048, 2048, 2048, 2048, 8192]
    - [68, 23.429]
  - - [2048, 8192, 1, 4096, 2048, 2048, 2048, 8192]
    - [68, 22.668]
  - - [2048, 8192, 1, 8192, 2048, 2048, 2048, 8192]
    - [18, 24.73]
  - - [4096, 128, 1, 128, 4096, 4096, 4096, 128]
    - [29, 2.042]
  - - [4096, 128, 1, 256, 4096, 4096, 4096, 128]
    - [26, 3.238]
  - - [4096, 128, 1, 512, 4096, 4096, 4096, 128]
    - [26, 4.908]
  - - [4096, 128, 1, 1024, 4096, 4096, 4096, 128]
    - [93, 6.586]
  - - [4096, 128, 1, 2048, 4096, 4096, 4096, 128]
    - [97, 9.225]
  - - [4096, 128, 1, 4096, 4096, 4096, 4096, 128]
    - [90, 11.857]
  - - [4096, 128, 1, 8192, 4096, 4096, 4096, 128]
    - [7, 13.525]
  - - [4096, 256, 1, 128, 4096, 4096, 4096, 256]
    - [24, 3.366]
  - - [4096, 256, 1, 256, 4096, 4096, 4096, 256]
    - [23, 5.568]
  - - [4096, 256, 1, 512, 4096, 4096, 4096, 256]
    - [23, 8.384]
  - - [4096, 256, 1, 1024, 4096, 4096, 4096, 256]
    - [96, 11.113]
  - - [4096, 256, 1, 2048, 4096, 4096, 4096, 256]
    - [89, 12.7]
  - - [4096, 256, 1, 4096, 4096, 4096, 4096, 256]
    - [81, 14.947]
  - - [4096, 256, 1, 8192, 4096, 4096, 4096, 256]
    - [60, 15.636]
  - - [4096, 512, 1, 128, 4096, 4096, 4096, 512]
    - [10, 5.208]
  - - [4096, 512, 1, 256, 4096, 4096, 4096, 512]
    - [9, 8.396]
  - - [4096, 512, 1, 512, 4096, 4096, 4096, 512]
    - [9, 11.948]
  - - [4096, 512, 1, 1024, 4096, 4096, 4096, 512]
    - [92, 15.123]
  - - [4096, 512, 1, 2048, 4096, 4096, 4096, 512]
    - [84, 15.941]
  - - [4096, 512, 1, 4096, 4096, 4096, 4096, 512]
    - [107, 16.606]
  - - [4096, 512, 1, 8192, 4096, 4096, 4096, 512]
    - [41, 17.999]
  - - [4096, 1024, 1, 128, 4096, 4096, 4096, 1024]
    - [6, 7.549]
  - - [4096, 1024, 1, 256, 4096, 4096, 4096, 1024]
    - [80, 11.245]
  - - [4096, 1024, 1, 512, 4096, 4096, 4096, 1024]
    - [80, 15.855]
  - - [4096, 1024, 1, 1024, 4096, 4096, 4096, 1024]
    - [60, 18.519]
  - - [4096, 1024, 1, 2048, 4096, 4096, 4096, 1024]
    - [82, 19.465]
  - - [4096, 1024, 1, 4096, 4096, 4096, 4096, 1024]
    - [106, 19.36]
  - - [4096, 1024, 1, 8192, 4096, 4096, 4096, 1024]
    - [71, 20.801]
  - - [4096, 2048, 1, 128, 4096, 4096, 4096, 2048]
    - [56, 9.818]
  - - [4096, 2048, 1, 256, 4096, 4096, 4096, 2048]
    - [52, 14.089]
  - - [4096, 2048, 1, 512, 4096, 4096, 4096, 2048]
    - [43, 17.803]
  - - [4096, 2048, 1, 1024, 4096, 4096, 4096, 2048]
    - [45, 21.209]
  - - [4096, 2048, 1, 2048, 4096, 4096, 4096, 2048]
    - [77, 20.59]
  - - [4096, 2048, 1, 4096, 4096, 4096, 4096, 2048]
    - [71, 21.041]
  - - [4096, 2048, 1, 8192, 4096, 4096, 4096, 2048]
    - [73, 23.996]
  - - [4096, 4096, 1, 128, 4096, 4096, 4096, 4096]
    - [35, 9.152]
  - - [4096, 4096, 1, 256, 4096, 4096, 4096, 4096]
    - [1, 13.781]
  - - [4096, 4096, 1, 512, 4096, 4096, 4096, 4096]
    - [35, 18.194]
  - - [4096, 4096, 1, 1024, 4096, 4096, 4096, 4096]
    - [35, 20.94]
  - - [4096, 4096, 1, 2048, 4096, 4096, 4096, 4096]
    - [71, 23.32]
  - - [4096, 4096, 1, 4096, 4096, 4096, 4096, 4096]
    - [34, 23.512]
  - - [4096, 4096, 1, 8192, 4096, 4096, 4096, 4096]
    - [70, 24.981]
  - - [4096, 8192, 1, 128, 4096, 4096, 4096, 8192]
    - [78, 9.686]
  - - [4096, 8192, 1, 256, 4096, 4096, 4096, 8192]
    - [53, 12.452]
  - - [4096, 8192, 1, 512, 4096, 4096, 4096, 8192]
    - [42, 16.202]
  - - [4096, 8192, 1, 1024, 4096, 4096, 4096, 8192]
    - [40, 20.752]
  - - [4096, 8192, 1, 2048, 4096, 4096, 4096, 8192]
    - [40, 24.479]
  - - [4096, 8192, 1, 4096, 4096, 4096, 4096, 8192]
    - [40, 25.62]
  - - [4096, 8192, 1, 8192, 4096, 4096, 4096, 8192]
    - [0, 26.389]
  - - [8192, 128, 1, 128, 8192, 8192, 8192, 128]
    - [24, 3.394]
  - - [8192, 128, 1, 256, 8192, 8192, 8192, 128]
    - [23, 5.677]
  - - [8192, 128, 1, 512, 8192, 8192, 8192, 128]
    - [23, 8.157]
  - - [8192, 128, 1, 1024, 8192, 8192, 8192, 128]
    - [97, 10.506]
  - - [8192, 128, 1, 2048, 8192, 8192, 8192, 128]
    - [98, 12.151]
  - - [8192, 128, 1, 4096, 8192, 8192, 8192, 128]
    - [9, 14.313]
  - - [8192, 128, 1, 8192, 8192, 8192, 8192, 128]
    - [20, 16.322]
  - - [8192, 256, 1, 128, 8192, 8192, 8192, 256]
    - [11, 5.189]
  - - [8192, 256, 1, 256, 8192, 8192, 8192, 256]
    - [9, 8.409]
  - - [8192, 256, 1, 512, 8192, 8192, 8192, 256]
    - [92, 11.717]
  - - [8192, 256, 1, 1024, 8192, 8192, 8192, 256]
    - [83, 14.646]
  - - [8192, 256, 1, 2048, 8192, 8192, 8192, 256]
    - [90, 15.641]
  - - [8192, 256, 1, 4096, 8192, 8192, 8192, 256]
    - [78, 16.77]
  - - [8192, 256, 1, 8192, 8192, 8192, 8192, 256]
    - [3, 18.593]
  - - [8192, 512, 1, 128, 8192, 8192, 8192, 512]
    - [5, 7.349]
  - - [8192, 512, 1, 256, 8192, 8192, 8192, 512]
    - [82, 11.389]
  - - [8192, 512, 1, 512, 8192, 8192, 8192, 512]
    - [82, 16.321]
  - - [8192, 512, 1, 1024, 8192, 8192, 8192, 512]
    - [60, 18.425]
  - - [8192, 512, 1, 2048, 8192, 8192, 8192, 512]
    - [80, 20.069]
  - - [8192, 512, 1, 4096, 8192, 8192, 8192, 512]
    - [108, 19.275]
  - - [8192, 512, 1, 8192, 8192, 8192, 8192, 512]
    - [72, 21.015]
  - - [8192, 1024, 1, 128, 8192, 8192, 8192, 1024]
    - [56, 9.629]
  - - [8192, 1024, 1, 256, 8192, 8192, 8192, 1024]
    - [56, 14.021]
  - - [8192, 1024, 1, 512, 8192, 8192, 8192, 1024]
    - [45, 18.2]
  - - [8192, 1024, 1, 1024, 8192, 8192, 8192, 1024]
    - [46, 21.403]
  - - [8192, 1024, 1, 2048, 8192, 8192, 8192, 1024]
    - [75, 20.315]
  - - [8192, 1024, 1, 4096, 8192, 8192, 8192, 1024]
    - [71, 21.133]
  - - [8192, 1024, 1, 8192, 8192, 8192, 8192, 1024]
    - [2, 24.083]
  - - [8192, 2048, 1, 128, 8192, 8192, 8192, 2048]
    - [1, 9.095]
  - - [8192, 2048, 1, 256, 8192, 8192, 8192, 2048]
    - [36, 13.355]
  - - [8192, 2048, 1, 512, 8192, 8192, 8192, 2048]
    - [36, 18.049]
  - - [8192, 2048, 1, 1024, 8192, 8192, 8192, 2048]
    - [39, 21.272]
  - - [8192, 2048, 1, 2048, 8192, 8192, 8192, 2048]
    - [71, 22.989]
  - - [8192, 2048, 1, 4096, 8192, 8192, 8192, 2048]
    - [38, 22.906]
  - - [8192, 2048, 1, 8192, 8192, 8192, 8192, 2048]
    - [17, 24.847]
  - - [8192, 4096, 1, 128, 8192, 8192, 8192, 4096]
    - [82, 9.097]
  - - [8192, 4096, 1, 256, 8192, 8192, 8192, 4096]
    - [51, 12.084]
  - - [8192, 4096, 1, 512, 8192, 8192, 8192, 4096]
    - [42, 16.084]
  - - [8192, 4096, 1, 1024, 8192, 8192, 8192, 4096]
    - [45, 20.391]
  - - [8192, 4096, 1, 2048, 8192, 8192, 8192, 4096]
    - [40, 24.39]
  - - [8192, 4096, 1, 4096, 8192, 8192, 8192, 4096]
    - [40, 25.343]
  - - [8192, 4096, 1, 8192, 8192, 8192, 8192, 4096]
    - [33, 26.854]
  - - [8192, 8192, 1, 128, 8192, 8192, 8192, 8192]
    - [54, 8.087]
  - - [8192, 8192, 1, 256, 8192, 8192, 8192, 8192]
    - [56, 12.432]
  - - [8192, 8192, 1, 512, 8192, 8192, 8192, 8192]
    - [41, 17.003]
  - - [8192, 8192, 1, 1024, 8192, 8192, 8192, 8192]
    - [45, 21.728]
  - - [8192, 8192, 1, 2048, 8192, 8192, 8192, 8192]
    - [34, 25.819]
  - - [8192, 8192, 1, 4096, 8192, 8192, 8192, 8192]
    - [69, 28.261]
  - - [8192, 8192, 1, 8192, 8192, 8192, 8192, 8192]
    - [37, 28.054]
  - - [1, 1, 1, 32, 1, 1, 1, 1]
    - [114, 0.0]
- null
- null
- DeviceEfficiency
- GridBased
