library/src/amd_detail/rocblaslt/src/Tensile/Logic/streamk/gfx942a/aquavanjaram942_Cijk_Ailk_Bjlk_BSS_BH_UserArgs.yaml
- {MinimumRequiredVersion: 4.33.0}
- aquavanjaram942
- gfx942
- [Device 0049, Device 0050]
    SolutionIndex: 0
    SolutionNameMin: Cijk_Ailk_Bjlk_BSS_BH_UserArgs_MT256x256x32_MI16x16x1_SN_LDSB1_CLR1_GSU0_GSUC0_GSUWGMRR0_K1_LBSPPA2048_LBSPPB2048_LPA32_LPB0_MIWT8_8_PLR1_SU32_SUM0_SUS256_SKXCCM0_VWA2_VWB8_WGM1_WGMXCC1_WGMXCCGn1
    SolutionIndex: 1
    SolutionNameMin: Cijk_Ailk_Bjlk_BSS_BH_UserArgs_MT256x256x32_MI16x16x1_SN_LDSB0_CLR1_GSU0_GSUC0_GSUWGMRR0_K1_LBSPPA2048_LBSPPB2048_LPA0_LPB0_MIWT8_8_PLR1_SU32_SUM0_SUS256_SKXCCM0_VWA4_VWB8_WGM1_WGMXCC1_WGMXCCGn1
    SolutionIndex: 2
    SolutionNameMin: Cijk_Ailk_Bjlk_BSS_BH_UserArgs_MT128x256x32_MI16x16x1_SN_LDSB1_CLR1_GSU0_GSUC0_GSUWGMRR0_K1_LBSPPA1024_LBSPPB2048_LPA0_LPB32_MIWT4_8_PLR1_SU32_SUM0_SUS256_SKXCCM0_VWA4_VWB2_WGM1_WGMXCC1_WGMXCCGn1
    SolutionIndex: 3
    SolutionNameMin: Cijk_Ailk_Bjlk_BSS_BH_UserArgs_MT128x256x32_MI16x16x1_SN_LDSB1_CLR1_GSU0_GSUC0_GSUWGMRR0_K1_LBSPPA1024_LBSPPB2048_LPA32_LPB0_MIWT4_8_PLR1_SU32_SUM0_SUS256_SKXCCM0_VWA2_VWB8_WGM1_WGMXCC1_WGMXCCGn1
    SolutionIndex: 4
    SolutionNameMin: Cijk_Ailk_Bjlk_BSS_BH_UserArgs_MT128x256x32_MI16x16x1_SN_LDSB1_CLR1_GSU0_GSUC0_GSUWGMRR0_K1_LBSPPA1024_LBSPPB2048_LPA0_LPB32_MIWT4_8_PLR1_SU32_SUM0_SUS256_SKXCCM0_VWA4_VWB2_WGM4_WGMXCC1_WGMXCCGn1
    SolutionIndex: 5
    SolutionNameMin: Cijk_Ailk_Bjlk_BSS_BH_UserArgs_MT128x256x32_MI16x16x1_SN_LDSB1_CLR1_GSU0_GSUC0_GSUWGMRR0_K1_LBSPPA1024_LBSPPB2048_LPA0_LPB32_MIWT4_8_PLR1_SU32_SUM0_SUS256_SKXCCM0_VWA4_VWB2_WGM8_WGMXCC1_WGMXCCGn1
    SolutionIndex: 6
    SolutionNameMin: Cijk_Ailk_Bjlk_BSS_BH_UserArgs_MT256x128x32_MI16x16x1_SN_LDSB1_CLR1_GSU0_GSUC0_GSUWGMRR0_K1_LBSPPA2048_LBSPPB1024_LPA0_LPB0_MIWT8_4_PLR1_SU32_SUM0_SUS256_SKXCCM0_VWA4_VWB4_WGM1_WGMXCC1_WGMXCCGn1
    SolutionIndex: 7
    SolutionNameMin: Cijk_Ailk_Bjlk_BSS_BH_UserArgs_MT256x128x32_MI16x16x1_SN_LDSB1_CLR1_GSU0_GSUC0_GSUWGMRR0_K1_LBSPPA2048_LBSPPB1024_LPA0_LPB16_MIWT8_4_PLR1_SU32_SUM0_SUS256_SKXCCM0_VWA4_VWB1_WGM8_WGMXCC1_WGMXCCGn1
    SolutionIndex: 8
    SolutionNameMin: Cijk_Ailk_Bjlk_BSS_BH_UserArgs_MT128x128x32_MI16x16x1_SN_LDSB0_CLR1_GSU0_GSUC0_GSUWGMRR0_K1_LBSPPA1024_LBSPPB1024_LPA0_LPB0_MIWT4_4_PLR1_SU32_SUM0_SUS256_SKXCCM0_VWA4_VWB4_WGM1_WGMXCC1_WGMXCCGn1
    SolutionIndex: 9
    SolutionNameMin: Cijk_Ailk_Bjlk_BSS_BH_UserArgs_MT128x128x32_MI16x16x1_SN_LDSB0_CLR0_GSU0_GSUC0_GSUWGMRR0_K1_LBSPPA1024_LBSPPB1024_LPA0_LPB0_MIWT4_4_PLR0_SU32_SUM0_SUS256_SKXCCM0_VWA4_VWB4_WGM1_WGMXCC1_WGMXCCGn1
    SolutionIndex: 10
    SolutionNameMin: Cijk_Ailk_Bjlk_BSS_BH_UserArgs_MT128x128x32_MI16x16x1_SN_LDSB0_CLR0_GSU0_GSUC0_GSUWGMRR0_K1_LBSPPA1024_LBSPPB1024_LPA0_LPB0_MIWT4_4_PLR0_SU32_SUM0_SUS256_SKXCCM0_VWA4_VWB4_WGM4_WGMXCC1_WGMXCCGn1
    SolutionIndex: 11
    SolutionNameMin: Cijk_Ailk_Bjlk_BSS_BH_UserArgs_MT64x128x32_MI16x16x1_SN_LDSB0_CLR1_GSU0_GSUC0_GSUWGMRR0_K1_LBSPPA512_LBSPPB1024_LPA32_LPB0_MIWT2_4_PLR1_SU32_SUM0_SUS256_SKXCCM0_VWA2_VWB4_WGM1_WGMXCC1_WGMXCCGn1
    SolutionIndex: 12
    SolutionNameMin: Cijk_Ailk_Bjlk_BSS_BH_UserArgs_MT128x64x32_MI16x16x1_SN_LDSB0_CLR1_GSU0_GSUC0_GSUWGMRR0_K1_LBSPPA1024_LBSPPB512_LPA0_LPB16_MIWT4_2_PLR1_SU32_SUM0_SUS256_SKXCCM0_VWA4_VWB1_WGM1_WGMXCC1_WGMXCCGn1
    SolutionIndex: 13
    SolutionNameMin: Cijk_Ailk_Bjlk_BSS_BH_UserArgs_MT128x64x32_MI16x16x1_SN_LDSB0_CLR1_GSU0_GSUC0_GSUWGMRR0_K1_LBSPPA1024_LBSPPB512_LPA0_LPB32_MIWT4_2_PLR1_SU32_SUM0_SUS256_SKXCCM0_VWA4_VWB2_WGM1_WGMXCC1_WGMXCCGn1
    SolutionIndex: 14
    SolutionNameMin: Cijk_Ailk_Bjlk_BSS_BH_UserArgs_MT64x64x32_MI16x16x1_SN_LDSB0_CLR1_GSU0_GSUC0_GSUWGMRR0_K1_LBSPPA512_LBSPPB512_LPA32_LPB32_MIWT2_2_PLR1_SU32_SUM0_SUS256_SKXCCM0_VWA2_VWB2_WGM1_WGMXCC1_WGMXCCGn1
    SolutionIndex: 15
    SolutionNameMin: Cijk_Ailk_Bjlk_BSS_BH_UserArgs_MT32x32x32_MI16x16x1_SN_LDSB0_CLR1_GSU0_GSUC0_GSUWGMRR0_K1_LBSPPA256_LBSPPB256_LPA16_LPB16_MIWT1_1_PLR1_SU32_SUM0_SUS256_SKXCCM0_VWA1_VWB1_WGM1_WGMXCC1_WGMXCCGn1
    SolutionIndex: 16
    SolutionNameMin: Cijk_Ailk_Bjlk_BSS_BH_UserArgs_MT256x256x64_MI16x16x1_SN_LDSB1_CLR1_GSU0_GSUC0_GSUWGMRR0_K1_LBSPPA2048_LBSPPB2048_LPA0_LPB0_MIWT8_8_PLR1_SU32_SUM0_SUS256_SKXCCM0_VWA4_VWB4_WGM1_WGMXCC1_WGMXCCGn1
    SolutionIndex: 17
    SolutionNameMin: Cijk_Ailk_Bjlk_BSS_BH_UserArgs_MT256x256x64_MI16x16x1_SN_LDSB1_CLR1_GSU0_GSUC0_GSUWGMRR0_K1_LBSPPA2048_LBSPPB2048_LPA0_LPB0_MIWT8_8_PLR1_SU32_SUM0_SUS256_SKXCCM0_VWA4_VWB4_WGM4_WGMXCC1_WGMXCCGn1
    SolutionIndex: 18
    SolutionNameMin: Cijk_Ailk_Bjlk_BSS_BH_UserArgs_MT128x128x64_MI16x16x1_SN_LDSB1_CLR1_GSU0_GSUC0_GSUWGMRR0_K1_LBSPPA1024_LBSPPB1024_LPA0_LPB0_MIWT4_4_PLR1_SU32_SUM0_SUS256_SKXCCM0_VWA4_VWB4_WGM1_WGMXCC1_WGMXCCGn1
    SolutionIndex: 19
    SolutionNameMin: Cijk_Ailk_Bjlk_BSS_BH_UserArgs_MT128x128x64_MI16x16x1_SN_LDSB1_CLR1_GSU0_GSUC0_GSUWGMRR0_K1_LBSPPA1024_LBSPPB1024_LPA0_LPB0_MIWT4_4_PLR1_SU32_SUM0_SUS256_SKXCCM0_VWA4_VWB4_WGM8_WGMXCC1_WGMXCCGn1
    SolutionIndex: 20
    SolutionNameMin: Cijk_Ailk_Bjlk_BSS_BH_UserArgs_MT128x128x64_MI16x16x1_SN_LDSB1_CLR1_GSU0_GSUC0_GSUWGMRR0_K1_LBSPPA1024_LBSPPB1024_LPA0_LPB0_MIWT4_4_PLR2_SU32_SUM0_SUS256_SKXCCM0_VWA4_VWB4_WGM8_WGMXCC1_WGMXCCGn1
    SolutionIndex: 21
    SolutionNameMin: Cijk_Ailk_Bjlk_BSS_BH_UserArgs_MT128x64x64_MI16x16x1_SN_LDSB1_CLR1_GSU0_GSUC0_GSUWGMRR0_K1_LBSPPA1024_LBSPPB512_LPA0_LPB32_MIWT4_2_PLR2_SU32_SUM0_SUS256_SKXCCM0_VWA4_VWB2_WGM1_WGMXCC1_WGMXCCGn1
    SolutionIndex: 22
    SolutionNameMin: Cijk_Ailk_Bjlk_BSS_BH_UserArgs_MT128x64x64_MI16x16x1_SN_LDSB1_CLR1_GSU0_GSUC0_GSUWGMRR0_K1_LBSPPA1024_LBSPPB512_LPA0_LPB32_MIWT4_2_PLR2_SU32_SUM0_SUS256_SKXCCM0_VWA4_VWB2_WGM4_WGMXCC1_WGMXCCGn1
    SolutionIndex: 23
    SolutionNameMin: Cijk_Ailk_Bjlk_BSS_BH_UserArgs_MT64x64x64_MI16x16x1_SN_LDSB1_CLR1_GSU0_GSUC0_GSUWGMRR0_K1_LBSPPA512_LBSPPB512_LPA16_LPB32_MIWT2_2_PLR1_SU32_SUM0_SUS256_SKXCCM0_VWA1_VWB2_WGM1_WGMXCC1_WGMXCCGn1
    SolutionIndex: 24
    SolutionNameMin: Cijk_Ailk_Bjlk_BSS_BH_UserArgs_MT64x64x64_MI16x16x1_SN_LDSB1_CLR1_GSU0_GSUC0_GSUWGMRR0_K1_LBSPPA512_LBSPPB512_LPA32_LPB32_MIWT2_2_PLR1_SU32_SUM0_SUS256_SKXCCM0_VWA2_VWB2_WGM1_WGMXCC1_WGMXCCGn1
    SolutionIndex: 25
    SolutionNameMin: Cijk_Ailk_Bjlk_BSS_BH_UserArgs_MT64x64x64_MI16x16x1_SN_LDSB1_CLR1_GSU0_GSUC0_GSUWGMRR0_K1_LBSPPA512_LBSPPB512_LPA16_LPB32_MIWT2_2_PLR2_SU32_SUM0_SUS256_SKXCCM0_VWA1_VWB2_WGM1_WGMXCC1_WGMXCCGn1
    SolutionIndex: 26
    SolutionNameMin: Cijk_Ailk_Bjlk_BSS_BH_UserArgs_MT64x64x64_MI16x16x1_SN_LDSB1_CLR1_GSU0_GSUC0_GSUWGMRR0_K1_LBSPPA512_LBSPPB512_LPA32_LPB32_MIWT2_2_PLR2_SU32_SUM0_SUS256_SKXCCM0_VWA2_VWB2_WGM1_WGMXCC1_WGMXCCGn1
    SolutionIndex: 27
    SolutionNameMin: Cijk_Ailk_Bjlk_BSS_BH_UserArgs_MT64x64x64_MI16x16x1_SN_LDSB1_CLR1_GSU0_GSUC0_GSUWGMRR0_K1_LBSPPA512_LBSPPB512_LPA32_LPB32_MIWT2_2_PLR1_SU32_SUM0_SUS256_SKXCCM0_VWA2_VWB2_WGM4_WGMXCC1_WGMXCCGn1
    SolutionIndex: 28
    SolutionNameMin: Cijk_Ailk_Bjlk_BSS_BH_UserArgs_MT64x64x64_MI16x16x1_SN_LDSB1_CLR1_GSU0_GSUC0_GSUWGMRR0_K1_LBSPPA512_LBSPPB512_LPA32_LPB32_MIWT2_2_PLR1_SU32_SUM0_SUS256_SKXCCM0_VWA2_VWB2_WGM8_WGMXCC1_WGMXCCGn1
    SolutionIndex: 29
    SolutionNameMin: Cijk_Ailk_Bjlk_BSS_BH_UserArgs_MT64x64x64_MI16x16x1_SN_LDSB1_CLR1_GSU0_GSUC0_GSUWGMRR0_K1_LBSPPA512_LBSPPB512_LPA32_LPB32_MIWT2_2_PLR2_SU32_SUM0_SUS256_SKXCCM0_VWA2_VWB2_WGM8_WGMXCC1_WGMXCCGn1
    SolutionIndex: 30
    SolutionNameMin: Cijk_Ailk_Bjlk_BSS_BH_UserArgs_MT32x64x64_MI16x16x1_SN_LDSB0_CLR1_GSU0_GSUC0_GSUWGMRR0_K1_LBSPPA256_LBSPPB512_LPA16_LPB32_MIWT1_2_PLR2_SU32_SUM0_SUS256_SKXCCM0_VWA1_VWB2_WGM1_WGMXCC1_WGMXCCGn1
    SolutionIndex: 31
    SolutionNameMin: Cijk_Ailk_Bjlk_BSS_BH_UserArgs_MT64x32x64_MI16x16x1_SN_LDSB0_CLR1_GSU0_GSUC0_GSUWGMRR0_K1_LBSPPA512_LBSPPB256_LPA32_LPB16_MIWT2_1_PLR2_SU32_SUM0_SUS256_SKXCCM0_VWA2_VWB1_WGM1_WGMXCC1_WGMXCCGn1
    SolutionIndex: 32
    SolutionNameMin: Cijk_Ailk_Bjlk_BSS_BH_UserArgs_MT64x64x128_MI16x16x1_SN_LDSB1_CLR1_GSU0_GSUC0_GSUWGMRR0_K1_LBSPPA512_LBSPPB512_LPA16_LPB32_MIWT2_2_PLR2_SU32_SUM0_SUS256_SKXCCM0_VWA1_VWB2_WGM1_WGMXCC1_WGMXCCGn1
    SolutionIndex: 33
    SolutionNameMin: Cijk_Ailk_Bjlk_BSS_BH_UserArgs_MT64x64x128_MI16x16x1_SN_LDSB1_CLR1_GSU0_GSUC0_GSUWGMRR0_K1_LBSPPA512_LBSPPB512_LPA32_LPB32_MIWT2_2_PLR2_SU32_SUM0_SUS256_SKXCCM0_VWA2_VWB2_WGM1_WGMXCC1_WGMXCCGn1
    SolutionIndex: 34
    SolutionNameMin: Cijk_Ailk_Bjlk_BSS_BH_UserArgs_MT64x64x128_MI16x16x1_SN_LDSB1_CLR1_GSU0_GSUC0_GSUWGMRR0_K1_LBSPPA512_LBSPPB512_LPA32_LPB32_MIWT2_2_PLR2_SU32_SUM0_SUS256_SKXCCM0_VWA2_VWB2_WGM4_WGMXCC1_WGMXCCGn1
    SolutionIndex: 35
    SolutionNameMin: Cijk_Ailk_Bjlk_BSS_BH_UserArgs_MT32x64x128_MI16x16x1_SN_LDSB1_CLR1_GSU0_GSUC0_GSUWGMRR0_K1_LBSPPA256_LBSPPB512_LPA16_LPB32_MIWT1_2_PLR1_SU32_SUM0_SUS256_SKXCCM0_VWA1_VWB2_WGM1_WGMXCC1_WGMXCCGn1
    SolutionIndex: 36
    SolutionNameMin: Cijk_Ailk_Bjlk_BSS_BH_UserArgs_MT32x64x128_MI16x16x1_SN_LDSB1_CLR1_GSU0_GSUC0_GSUWGMRR0_K1_LBSPPA256_LBSPPB512_LPA16_LPB32_MIWT1_2_PLR2_SU32_SUM0_SUS256_SKXCCM0_VWA1_VWB2_WGM1_WGMXCC1_WGMXCCGn1
    SolutionIndex: 37
    SolutionNameMin: Cijk_Ailk_Bjlk_BSS_BH_UserArgs_MT64x32x128_MI16x16x1_SN_LDSB1_CLR1_GSU0_GSUC0_GSUWGMRR0_K1_LBSPPA512_LBSPPB256_LPA32_LPB16_MIWT2_1_PLR2_SU32_SUM0_SUS256_SKXCCM0_VWA2_VWB1_WGM1_WGMXCC1_WGMXCCGn1
    SolutionIndex: 38
    SolutionNameMin: Cijk_Ailk_Bjlk_BSS_BH_UserArgs_MT32x32x128_MI16x16x1_SN_LDSB1_CLR1_GSU0_GSUC0_GSUWGMRR0_K1_LBSPPA256_LBSPPB256_LPA16_LPB16_MIWT1_1_PLR1_SU32_SUM0_SUS256_SKXCCM0_VWA1_VWB1_WGM1_WGMXCC1_WGMXCCGn1
    SolutionIndex: 39
    SolutionNameMin: Cijk_Ailk_Bjlk_BSS_BH_UserArgs_MT32x32x128_MI16x16x1_SN_LDSB1_CLR1_GSU0_GSUC0_GSUWGMRR0_K1_LBSPPA256_LBSPPB256_LPA16_LPB16_MIWT1_1_PLR2_SU32_SUM0_SUS256_SKXCCM0_VWA1_VWB1_WGM1_WGMXCC1_WGMXCCGn1
    SolutionIndex: 40
    SolutionNameMin: Cijk_Ailk_Bjlk_BSS_BH_UserArgs_MT256x256x32_MI16x16x1_SN_LDSB1_CLR1_GSU0_GSUC0_GSUWGMRR0_K1_LBSPPA2048_LBSPPB2048_LPA0_LPB32_MIWT8_8_PLR1_SU32_SUM0_SUS256_SKXCCM6_VWA4_VWB2_WGM1_WGMXCC1_WGMXCCGn1
    SolutionIndex: 41
    SolutionNameMin: Cijk_Ailk_Bjlk_BSS_BH_UserArgs_MT256x256x32_MI16x16x1_SN_LDSB0_CLR1_GSU0_GSUC0_GSUWGMRR0_K1_LBSPPA2048_LBSPPB2048_LPA0_LPB0_MIWT8_8_PLR1_SU32_SUM0_SUS256_SKXCCM6_VWA4_VWB4_WGM1_WGMXCC1_WGMXCCGn1
    SolutionIndex: 42
    SolutionNameMin: Cijk_Ailk_Bjlk_BSS_BH_UserArgs_MT256x256x32_MI16x16x1_SN_LDSB0_CLR1_GSU0_GSUC0_GSUWGMRR0_K1_LBSPPA2048_LBSPPB2048_LPA0_LPB0_MIWT8_8_PLR1_SU32_SUM0_SUS256_SKXCCM6_VWA4_VWB8_WGM1_WGMXCC1_WGMXCCGn1
    SolutionIndex: 43
    SolutionNameMin: Cijk_Ailk_Bjlk_BSS_BH_UserArgs_MT256x256x32_MI16x16x1_SN_LDSB1_CLR1_GSU0_GSUC0_GSUWGMRR0_K1_LBSPPA2048_LBSPPB2048_LPA0_LPB32_MIWT8_8_PLR1_SU32_SUM0_SUS256_SKXCCM6_VWA4_VWB2_WGM4_WGMXCC1_WGMXCCGn1
    SolutionIndex: 44
    SolutionNameMin: Cijk_Ailk_Bjlk_BSS_BH_UserArgs_MT256x256x32_MI16x16x1_SN_LDSB0_CLR1_GSU0_GSUC0_GSUWGMRR0_K1_LBSPPA2048_LBSPPB2048_LPA0_LPB0_MIWT8_8_PLR1_SU32_SUM0_SUS256_SKXCCM6_VWA4_VWB8_WGM4_WGMXCC1_WGMXCCGn1
    SolutionIndex: 45
    SolutionNameMin: Cijk_Ailk_Bjlk_BSS_BH_UserArgs_MT256x256x32_MI16x16x1_SN_LDSB0_CLR1_GSU0_GSUC0_GSUWGMRR0_K1_LBSPPA2048_LBSPPB2048_LPA0_LPB0_MIWT8_8_PLR1_SU32_SUM0_SUS256_SKXCCM6_VWA4_VWB4_WGM8_WGMXCC1_WGMXCCGn1
    SolutionIndex: 46
    SolutionNameMin: Cijk_Ailk_Bjlk_BSS_BH_UserArgs_MT256x256x32_MI16x16x1_SN_LDSB0_CLR1_GSU0_GSUC0_GSUWGMRR0_K1_LBSPPA2048_LBSPPB2048_LPA0_LPB0_MIWT8_8_PLR1_SU32_SUM0_SUS256_SKXCCM6_VWA4_VWB8_WGM8_WGMXCC1_WGMXCCGn1
    SolutionIndex: 47
    SolutionNameMin: Cijk_Ailk_Bjlk_BSS_BH_UserArgs_MT128x256x32_MI16x16x1_SN_LDSB1_CLR1_GSU0_GSUC0_GSUWGMRR0_K1_LBSPPA1024_LBSPPB2048_LPA32_LPB32_MIWT4_8_PLR1_SU32_SUM0_SUS256_SKXCCM6_VWA2_VWB2_WGM1_WGMXCC1_WGMXCCGn1
    SolutionIndex: 48
    SolutionNameMin: Cijk_Ailk_Bjlk_BSS_BH_UserArgs_MT128x256x32_MI16x16x1_SN_LDSB1_CLR1_GSU0_GSUC0_GSUWGMRR0_K1_LBSPPA1024_LBSPPB2048_LPA0_LPB32_MIWT4_8_PLR1_SU32_SUM0_SUS256_SKXCCM6_VWA4_VWB2_WGM1_WGMXCC1_WGMXCCGn1
    SolutionIndex: 49
    SolutionNameMin: Cijk_Ailk_Bjlk_BSS_BH_UserArgs_MT128x256x32_MI16x16x1_SN_LDSB1_CLR1_GSU0_GSUC0_GSUWGMRR0_K1_LBSPPA1024_LBSPPB2048_LPA0_LPB0_MIWT4_8_PLR1_SU32_SUM0_SUS256_SKXCCM6_VWA4_VWB4_WGM1_WGMXCC1_WGMXCCGn1
    SolutionIndex: 50
    SolutionNameMin: Cijk_Ailk_Bjlk_BSS_BH_UserArgs_MT128x256x32_MI16x16x1_SN_LDSB1_CLR1_GSU0_GSUC0_GSUWGMRR0_K1_LBSPPA1024_LBSPPB2048_LPA32_LPB0_MIWT4_8_PLR1_SU32_SUM0_SUS256_SKXCCM6_VWA2_VWB8_WGM1_WGMXCC1_WGMXCCGn1
    SolutionIndex: 51
    SolutionNameMin: Cijk_Ailk_Bjlk_BSS_BH_UserArgs_MT128x256x32_MI16x16x1_SN_LDSB1_CLR1_GSU0_GSUC0_GSUWGMRR0_K1_LBSPPA1024_LBSPPB2048_LPA0_LPB0_MIWT4_8_PLR1_SU32_SUM0_SUS256_SKXCCM6_VWA4_VWB8_WGM1_WGMXCC1_WGMXCCGn1
    SolutionIndex: 52
    SolutionNameMin: Cijk_Ailk_Bjlk_BSS_BH_UserArgs_MT128x256x32_MI16x16x1_SN_LDSB1_CLR1_GSU0_GSUC0_GSUWGMRR0_K1_LBSPPA1024_LBSPPB2048_LPA0_LPB32_MIWT4_8_PLR1_SU32_SUM0_SUS256_SKXCCM6_VWA4_VWB2_WGM4_WGMXCC1_WGMXCCGn1
    SolutionIndex: 53
    SolutionNameMin: Cijk_Ailk_Bjlk_BSS_BH_UserArgs_MT128x256x32_MI16x16x1_SN_LDSB1_CLR1_GSU0_GSUC0_GSUWGMRR0_K1_LBSPPA1024_LBSPPB2048_LPA0_LPB0_MIWT4_8_PLR1_SU32_SUM0_SUS256_SKXCCM6_VWA4_VWB4_WGM4_WGMXCC1_WGMXCCGn1
    SolutionIndex: 54
    SolutionNameMin: Cijk_Ailk_Bjlk_BSS_BH_UserArgs_MT128x256x32_MI16x16x1_SN_LDSB1_CLR1_GSU0_GSUC0_GSUWGMRR0_K1_LBSPPA1024_LBSPPB2048_LPA0_LPB32_MIWT4_8_PLR1_SU32_SUM0_SUS256_SKXCCM6_VWA4_VWB2_WGM8_WGMXCC1_WGMXCCGn1
    SolutionIndex: 55
    SolutionNameMin: Cijk_Ailk_Bjlk_BSS_BH_UserArgs_MT128x256x32_MI16x16x1_SN_LDSB1_CLR1_GSU0_GSUC0_GSUWGMRR0_K1_LBSPPA1024_LBSPPB2048_LPA0_LPB0_MIWT4_8_PLR1_SU32_SUM0_SUS256_SKXCCM6_VWA4_VWB4_WGM8_WGMXCC1_WGMXCCGn1
    SolutionIndex: 56
    SolutionNameMin: Cijk_Ailk_Bjlk_BSS_BH_UserArgs_MT256x128x32_MI16x16x1_SN_LDSB1_CLR1_GSU0_GSUC0_GSUWGMRR0_K1_LBSPPA2048_LBSPPB1024_LPA0_LPB0_MIWT8_4_PLR1_SU32_SUM0_SUS256_SKXCCM6_VWA4_VWB4_WGM1_WGMXCC1_WGMXCCGn1
    SolutionIndex: 57
    SolutionNameMin: Cijk_Ailk_Bjlk_BSS_BH_UserArgs_MT256x128x32_MI16x16x1_SN_LDSB1_CLR1_GSU0_GSUC0_GSUWGMRR0_K1_LBSPPA2048_LBSPPB1024_LPA0_LPB32_MIWT8_4_PLR1_SU32_SUM0_SUS256_SKXCCM6_VWA4_VWB2_WGM4_WGMXCC1_WGMXCCGn1
    SolutionIndex: 58
    SolutionNameMin: Cijk_Ailk_Bjlk_BSS_BH_UserArgs_MT256x128x32_MI16x16x1_SN_LDSB1_CLR1_GSU0_GSUC0_GSUWGMRR0_K1_LBSPPA2048_LBSPPB1024_LPA0_LPB0_MIWT8_4_PLR1_SU32_SUM0_SUS256_SKXCCM6_VWA4_VWB4_WGM8_WGMXCC1_WGMXCCGn1
    SolutionIndex: 59
    SolutionNameMin: Cijk_Ailk_Bjlk_BSS_BH_UserArgs_MT128x128x32_MI16x16x1_SN_LDSB1_CLR1_GSU0_GSUC0_GSUWGMRR0_K1_LBSPPA1024_LBSPPB1024_LPA0_LPB32_MIWT4_4_PLR1_SU32_SUM0_SUS256_SKXCCM6_VWA4_VWB2_WGM1_WGMXCC1_WGMXCCGn1
    SolutionIndex: 60
    SolutionNameMin: Cijk_Ailk_Bjlk_BSS_BH_UserArgs_MT128x128x32_MI16x16x1_SN_LDSB0_CLR1_GSU0_GSUC0_GSUWGMRR0_K1_LBSPPA1024_LBSPPB1024_LPA0_LPB0_MIWT4_4_PLR1_SU32_SUM0_SUS256_SKXCCM6_VWA4_VWB4_WGM1_WGMXCC1_WGMXCCGn1
    SolutionIndex: 61
    SolutionNameMin: Cijk_Ailk_Bjlk_BSS_BH_UserArgs_MT128x128x32_MI16x16x1_SN_LDSB0_CLR0_GSU0_GSUC0_GSUWGMRR0_K1_LBSPPA1024_LBSPPB1024_LPA0_LPB0_MIWT4_4_PLR0_SU32_SUM0_SUS256_SKXCCM6_VWA4_VWB4_WGM1_WGMXCC1_WGMXCCGn1
    SolutionIndex: 62
    SolutionNameMin: Cijk_Ailk_Bjlk_BSS_BH_UserArgs_MT128x128x32_MI16x16x1_SN_LDSB0_CLR0_GSU0_GSUC0_GSUWGMRR0_K1_LBSPPA1024_LBSPPB1024_LPA0_LPB0_MIWT4_4_PLR0_SU32_SUM0_SUS256_SKXCCM6_VWA4_VWB4_WGM4_WGMXCC1_WGMXCCGn1
    SolutionIndex: 63
    SolutionNameMin: Cijk_Ailk_Bjlk_BSS_BH_UserArgs_MT128x128x32_MI16x16x1_SN_LDSB1_CLR1_GSU0_GSUC0_GSUWGMRR0_K1_LBSPPA1024_LBSPPB1024_LPA0_LPB16_MIWT4_4_PLR1_SU32_SUM0_SUS256_SKXCCM6_VWA4_VWB1_WGM8_WGMXCC1_WGMXCCGn1
    SolutionIndex: 64
    SolutionNameMin: Cijk_Ailk_Bjlk_BSS_BH_UserArgs_MT128x128x32_MI16x16x1_SN_LDSB1_CLR1_GSU0_GSUC0_GSUWGMRR0_K1_LBSPPA1024_LBSPPB1024_LPA16_LPB32_MIWT4_4_PLR1_SU32_SUM0_SUS256_SKXCCM6_VWA1_VWB2_WGM8_WGMXCC1_WGMXCCGn1
    SolutionIndex: 65
    SolutionNameMin: Cijk_Ailk_Bjlk_BSS_BH_UserArgs_MT128x128x32_MI16x16x1_SN_LDSB1_CLR1_GSU0_GSUC0_GSUWGMRR0_K1_LBSPPA1024_LBSPPB1024_LPA0_LPB32_MIWT4_4_PLR1_SU32_SUM0_SUS256_SKXCCM6_VWA4_VWB2_WGM8_WGMXCC1_WGMXCCGn1
    SolutionIndex: 66
    SolutionNameMin: Cijk_Ailk_Bjlk_BSS_BH_UserArgs_MT128x128x32_MI16x16x1_SN_LDSB0_CLR1_GSU0_GSUC0_GSUWGMRR0_K1_LBSPPA1024_LBSPPB1024_LPA0_LPB0_MIWT4_4_PLR1_SU32_SUM0_SUS256_SKXCCM6_VWA4_VWB4_WGM8_WGMXCC1_WGMXCCGn1
    SolutionIndex: 67
    SolutionNameMin: Cijk_Ailk_Bjlk_BSS_BH_UserArgs_MT128x64x32_MI16x16x1_SN_LDSB0_CLR1_GSU0_GSUC0_GSUWGMRR0_K1_LBSPPA1024_LBSPPB512_LPA0_LPB32_MIWT4_2_PLR1_SU32_SUM0_SUS256_SKXCCM6_VWA4_VWB2_WGM1_WGMXCC1_WGMXCCGn1
    SolutionIndex: 68
    SolutionNameMin: Cijk_Ailk_Bjlk_BSS_BH_UserArgs_MT128x64x32_MI16x16x1_SN_LDSB0_CLR1_GSU0_GSUC0_GSUWGMRR0_K1_LBSPPA1024_LBSPPB512_LPA0_LPB16_MIWT4_2_PLR1_SU32_SUM0_SUS256_SKXCCM6_VWA4_VWB1_WGM4_WGMXCC1_WGMXCCGn1
    SolutionIndex: 69
    SolutionNameMin: Cijk_Ailk_Bjlk_BSS_BH_UserArgs_MT128x64x32_MI16x16x1_SN_LDSB0_CLR1_GSU0_GSUC0_GSUWGMRR0_K1_LBSPPA1024_LBSPPB512_LPA0_LPB32_MIWT4_2_PLR1_SU32_SUM0_SUS256_SKXCCM6_VWA4_VWB2_WGM4_WGMXCC1_WGMXCCGn1
    SolutionIndex: 70
    SolutionNameMin: Cijk_Ailk_Bjlk_BSS_BH_UserArgs_MT128x64x32_MI16x16x1_SN_LDSB0_CLR1_GSU0_GSUC0_GSUWGMRR0_K1_LBSPPA1024_LBSPPB512_LPA0_LPB32_MIWT4_2_PLR1_SU32_SUM0_SUS256_SKXCCM6_VWA4_VWB2_WGM8_WGMXCC1_WGMXCCGn1
    SolutionIndex: 71
    SolutionNameMin: Cijk_Ailk_Bjlk_BSS_BH_UserArgs_MT32x32x32_MI16x16x1_SN_LDSB0_CLR1_GSU0_GSUC0_GSUWGMRR0_K1_LBSPPA256_LBSPPB256_LPA16_LPB16_MIWT1_1_PLR1_SU32_SUM0_SUS256_SKXCCM6_VWA1_VWB1_WGM1_WGMXCC1_WGMXCCGn1
    SolutionIndex: 72
    SolutionNameMin: Cijk_Ailk_Bjlk_BSS_BH_UserArgs_MT32x32x32_MI16x16x1_SN_LDSB0_CLR0_GSU0_GSUC0_GSUWGMRR0_K1_LBSPPA256_LBSPPB256_LPA16_LPB16_MIWT1_1_PLR0_SU32_SUM0_SUS256_SKXCCM6_VWA1_VWB1_WGM1_WGMXCC1_WGMXCCGn1
    SolutionIndex: 73
    SolutionNameMin: Cijk_Ailk_Bjlk_BSS_BH_UserArgs_MT32x32x32_MI16x16x1_SN_LDSB0_CLR1_GSU0_GSUC0_GSUWGMRR0_K1_LBSPPA256_LBSPPB256_LPA16_LPB16_MIWT1_1_PLR1_SU32_SUM0_SUS256_SKXCCM6_VWA1_VWB1_WGM8_WGMXCC1_WGMXCCGn1
    SolutionIndex: 74
    SolutionNameMin: Cijk_Ailk_Bjlk_BSS_BH_UserArgs_MT256x256x64_MI16x16x1_SN_LDSB1_CLR1_GSU0_GSUC0_GSUWGMRR0_K1_LBSPPA2048_LBSPPB2048_LPA0_LPB0_MIWT8_8_PLR1_SU32_SUM0_SUS256_SKXCCM6_VWA4_VWB4_WGM1_WGMXCC1_WGMXCCGn1
    SolutionIndex: 75
    SolutionNameMin: Cijk_Ailk_Bjlk_BSS_BH_UserArgs_MT256x256x64_MI16x16x1_SN_LDSB1_CLR1_GSU0_GSUC0_GSUWGMRR0_K1_LBSPPA2048_LBSPPB2048_LPA0_LPB0_MIWT8_8_PLR2_SU32_SUM0_SUS256_SKXCCM6_VWA4_VWB4_WGM1_WGMXCC1_WGMXCCGn1
    SolutionIndex: 76
    SolutionNameMin: Cijk_Ailk_Bjlk_BSS_BH_UserArgs_MT256x256x64_MI16x16x1_SN_LDSB1_CLR1_GSU0_GSUC0_GSUWGMRR0_K1_LBSPPA2048_LBSPPB2048_LPA0_LPB0_MIWT8_8_PLR1_SU32_SUM0_SUS256_SKXCCM6_VWA4_VWB4_WGM4_WGMXCC1_WGMXCCGn1
    SolutionIndex: 77
    SolutionNameMin: Cijk_Ailk_Bjlk_BSS_BH_UserArgs_MT256x256x64_MI16x16x1_SN_LDSB1_CLR1_GSU0_GSUC0_GSUWGMRR0_K1_LBSPPA2048_LBSPPB2048_LPA0_LPB0_MIWT8_8_PLR1_SU32_SUM0_SUS256_SKXCCM6_VWA4_VWB4_WGM8_WGMXCC1_WGMXCCGn1
    SolutionIndex: 78
    SolutionNameMin: Cijk_Ailk_Bjlk_BSS_BH_UserArgs_MT256x256x64_MI16x16x1_SN_LDSB1_CLR1_GSU0_GSUC0_GSUWGMRR0_K1_LBSPPA2048_LBSPPB2048_LPA0_LPB0_MIWT8_8_PLR2_SU32_SUM0_SUS256_SKXCCM6_VWA4_VWB4_WGM8_WGMXCC1_WGMXCCGn1
    SolutionIndex: 79
    SolutionNameMin: Cijk_Ailk_Bjlk_BSS_BH_UserArgs_MT128x256x64_MI16x16x1_SN_LDSB1_CLR1_GSU0_GSUC0_GSUWGMRR0_K1_LBSPPA1024_LBSPPB2048_LPA0_LPB32_MIWT4_8_PLR2_SU32_SUM0_SUS256_SKXCCM6_VWA4_VWB2_WGM1_WGMXCC1_WGMXCCGn1
    SolutionIndex: 80
    SolutionNameMin: Cijk_Ailk_Bjlk_BSS_BH_UserArgs_MT128x256x64_MI16x16x1_SN_LDSB1_CLR1_GSU0_GSUC0_GSUWGMRR0_K1_LBSPPA1024_LBSPPB2048_LPA0_LPB32_MIWT4_8_PLR2_SU32_SUM0_SUS256_SKXCCM6_VWA4_VWB2_WGM4_WGMXCC1_WGMXCCGn1
    SolutionIndex: 81
    SolutionNameMin: Cijk_Ailk_Bjlk_BSS_BH_UserArgs_MT256x128x64_MI16x16x1_SN_LDSB1_CLR1_GSU0_GSUC0_GSUWGMRR0_K1_LBSPPA2048_LBSPPB1024_LPA0_LPB32_MIWT8_4_PLR2_SU32_SUM0_SUS256_SKXCCM6_VWA4_VWB2_WGM1_WGMXCC1_WGMXCCGn1
    SolutionIndex: 82
    SolutionNameMin: Cijk_Ailk_Bjlk_BSS_BH_UserArgs_MT256x128x64_MI16x16x1_SN_LDSB1_CLR1_GSU0_GSUC0_GSUWGMRR0_K1_LBSPPA2048_LBSPPB1024_LPA0_LPB32_MIWT8_4_PLR2_SU32_SUM0_SUS256_SKXCCM6_VWA4_VWB2_WGM8_WGMXCC1_WGMXCCGn1
    SolutionIndex: 83
    SolutionNameMin: Cijk_Ailk_Bjlk_BSS_BH_UserArgs_MT128x128x64_MI16x16x1_SN_LDSB1_CLR1_GSU0_GSUC0_GSUWGMRR0_K1_LBSPPA1024_LBSPPB1024_LPA0_LPB0_MIWT4_4_PLR1_SU32_SUM0_SUS256_SKXCCM6_VWA4_VWB4_WGM1_WGMXCC1_WGMXCCGn1
    SolutionIndex: 84
    SolutionNameMin: Cijk_Ailk_Bjlk_BSS_BH_UserArgs_MT128x128x64_MI16x16x1_SN_LDSB1_CLR1_GSU0_GSUC0_GSUWGMRR0_K1_LBSPPA1024_LBSPPB1024_LPA0_LPB0_MIWT4_4_PLR2_SU32_SUM0_SUS256_SKXCCM6_VWA4_VWB4_WGM1_WGMXCC1_WGMXCCGn1
    SolutionIndex: 85
    SolutionNameMin: Cijk_Ailk_Bjlk_BSS_BH_UserArgs_MT128x128x64_MI16x16x1_SN_LDSB1_CLR1_GSU0_GSUC0_GSUWGMRR0_K1_LBSPPA1024_LBSPPB1024_LPA0_LPB0_MIWT4_4_PLR1_SU32_SUM0_SUS256_SKXCCM6_VWA4_VWB4_WGM4_WGMXCC1_WGMXCCGn1
    SolutionIndex: 86
    SolutionNameMin: Cijk_Ailk_Bjlk_BSS_BH_UserArgs_MT128x128x64_MI16x16x1_SN_LDSB1_CLR1_GSU0_GSUC0_GSUWGMRR0_K1_LBSPPA1024_LBSPPB1024_LPA0_LPB0_MIWT4_4_PLR2_SU32_SUM0_SUS256_SKXCCM6_VWA4_VWB4_WGM4_WGMXCC1_WGMXCCGn1
    SolutionIndex: 87
    SolutionNameMin: Cijk_Ailk_Bjlk_BSS_BH_UserArgs_MT128x128x64_MI16x16x1_SN_LDSB1_CLR1_GSU0_GSUC0_GSUWGMRR0_K1_LBSPPA1024_LBSPPB1024_LPA0_LPB0_MIWT4_4_PLR1_SU32_SUM0_SUS256_SKXCCM6_VWA4_VWB4_WGM8_WGMXCC1_WGMXCCGn1
    SolutionIndex: 88
    SolutionNameMin: Cijk_Ailk_Bjlk_BSS_BH_UserArgs_MT128x128x64_MI16x16x1_SN_LDSB1_CLR1_GSU0_GSUC0_GSUWGMRR0_K1_LBSPPA1024_LBSPPB1024_LPA0_LPB0_MIWT4_4_PLR2_SU32_SUM0_SUS256_SKXCCM6_VWA4_VWB4_WGM8_WGMXCC1_WGMXCCGn1
    SolutionIndex: 89
    SolutionNameMin: Cijk_Ailk_Bjlk_BSS_BH_UserArgs_MT64x128x64_MI16x16x1_SN_LDSB1_CLR1_GSU0_GSUC0_GSUWGMRR0_K1_LBSPPA512_LBSPPB1024_LPA32_LPB0_MIWT2_4_PLR2_SU32_SUM0_SUS256_SKXCCM6_VWA2_VWB4_WGM4_WGMXCC1_WGMXCCGn1
    SolutionIndex: 90
    SolutionNameMin: Cijk_Ailk_Bjlk_BSS_BH_UserArgs_MT64x128x64_MI16x16x1_SN_LDSB1_CLR1_GSU0_GSUC0_GSUWGMRR0_K1_LBSPPA512_LBSPPB1024_LPA32_LPB0_MIWT2_4_PLR2_SU32_SUM0_SUS256_SKXCCM6_VWA2_VWB4_WGM8_WGMXCC1_WGMXCCGn1
    SolutionIndex: 91
    SolutionNameMin: Cijk_Ailk_Bjlk_BSS_BH_UserArgs_MT128x64x64_MI16x16x1_SN_LDSB1_CLR1_GSU0_GSUC0_GSUWGMRR0_K1_LBSPPA1024_LBSPPB512_LPA0_LPB32_MIWT4_2_PLR1_SU32_SUM0_SUS256_SKXCCM6_VWA4_VWB2_WGM1_WGMXCC1_WGMXCCGn1
    SolutionIndex: 92
    SolutionNameMin: Cijk_Ailk_Bjlk_BSS_BH_UserArgs_MT128x64x64_MI16x16x1_SN_LDSB1_CLR1_GSU0_GSUC0_GSUWGMRR0_K1_LBSPPA1024_LBSPPB512_LPA0_LPB16_MIWT4_2_PLR2_SU32_SUM0_SUS256_SKXCCM6_VWA4_VWB1_WGM1_WGMXCC1_WGMXCCGn1
    SolutionIndex: 93
    SolutionNameMin: Cijk_Ailk_Bjlk_BSS_BH_UserArgs_MT128x64x64_MI16x16x1_SN_LDSB1_CLR1_GSU0_GSUC0_GSUWGMRR0_K1_LBSPPA1024_LBSPPB512_LPA0_LPB32_MIWT4_2_PLR2_SU32_SUM0_SUS256_SKXCCM6_VWA4_VWB2_WGM1_WGMXCC1_WGMXCCGn1
    SolutionIndex: 94
    SolutionNameMin: Cijk_Ailk_Bjlk_BSS_BH_UserArgs_MT128x64x64_MI16x16x1_SN_LDSB1_CLR1_GSU0_GSUC0_GSUWGMRR0_K1_LBSPPA1024_LBSPPB512_LPA0_LPB32_MIWT4_2_PLR1_SU32_SUM0_SUS256_SKXCCM6_VWA4_VWB2_WGM4_WGMXCC1_WGMXCCGn1
    SolutionIndex: 95
    SolutionNameMin: Cijk_Ailk_Bjlk_BSS_BH_UserArgs_MT128x64x64_MI16x16x1_SN_LDSB1_CLR1_GSU0_GSUC0_GSUWGMRR0_K1_LBSPPA1024_LBSPPB512_LPA0_LPB32_MIWT4_2_PLR2_SU32_SUM0_SUS256_SKXCCM6_VWA4_VWB2_WGM4_WGMXCC1_WGMXCCGn1
    SolutionIndex: 96
    SolutionNameMin: Cijk_Ailk_Bjlk_BSS_BH_UserArgs_MT128x64x64_MI16x16x1_SN_LDSB1_CLR1_GSU0_GSUC0_GSUWGMRR0_K1_LBSPPA1024_LBSPPB512_LPA0_LPB32_MIWT4_2_PLR1_SU32_SUM0_SUS256_SKXCCM6_VWA4_VWB2_WGM8_WGMXCC1_WGMXCCGn1
    SolutionIndex: 97
    SolutionNameMin: Cijk_Ailk_Bjlk_BSS_BH_UserArgs_MT128x64x64_MI16x16x1_SN_LDSB1_CLR1_GSU0_GSUC0_GSUWGMRR0_K1_LBSPPA1024_LBSPPB512_LPA0_LPB16_MIWT4_2_PLR2_SU32_SUM0_SUS256_SKXCCM6_VWA4_VWB1_WGM8_WGMXCC1_WGMXCCGn1
    SolutionIndex: 98
    SolutionNameMin: Cijk_Ailk_Bjlk_BSS_BH_UserArgs_MT128x64x64_MI16x16x1_SN_LDSB1_CLR1_GSU0_GSUC0_GSUWGMRR0_K1_LBSPPA1024_LBSPPB512_LPA0_LPB32_MIWT4_2_PLR2_SU32_SUM0_SUS256_SKXCCM6_VWA4_VWB2_WGM8_WGMXCC1_WGMXCCGn1
    SolutionIndex: 99
    SolutionNameMin: Cijk_Ailk_Bjlk_BSS_BH_UserArgs_MT128x32x64_MI16x16x1_SN_LDSB1_CLR1_GSU0_GSUC0_GSUWGMRR0_K1_LBSPPA1024_LBSPPB256_LPA0_LPB16_MIWT4_1_PLR1_SU32_SUM0_SUS256_SKXCCM6_VWA4_VWB1_WGM1_WGMXCC1_WGMXCCGn1
    SolutionIndex: 100
    SolutionNameMin: Cijk_Ailk_Bjlk_BSS_BH_UserArgs_MT64x64x64_MI16x16x1_SN_LDSB1_CLR1_GSU0_GSUC0_GSUWGMRR0_K1_LBSPPA512_LBSPPB512_LPA32_LPB32_MIWT2_2_PLR1_SU32_SUM0_SUS256_SKXCCM6_VWA2_VWB2_WGM1_WGMXCC1_WGMXCCGn1
    SolutionIndex: 101
    SolutionNameMin: Cijk_Ailk_Bjlk_BSS_BH_UserArgs_MT64x64x64_MI16x16x1_SN_LDSB1_CLR1_GSU0_GSUC0_GSUWGMRR0_K1_LBSPPA512_LBSPPB512_LPA32_LPB32_MIWT2_2_PLR2_SU32_SUM0_SUS256_SKXCCM6_VWA2_VWB2_WGM1_WGMXCC1_WGMXCCGn1
    SolutionIndex: 102
    SolutionNameMin: Cijk_Ailk_Bjlk_BSS_BH_UserArgs_MT64x64x64_MI16x16x1_SN_LDSB1_CLR1_GSU0_GSUC0_GSUWGMRR0_K1_LBSPPA512_LBSPPB512_LPA32_LPB32_MIWT2_2_PLR1_SU32_SUM0_SUS256_SKXCCM6_VWA2_VWB2_WGM4_WGMXCC1_WGMXCCGn1
    SolutionIndex: 103
    SolutionNameMin: Cijk_Ailk_Bjlk_BSS_BH_UserArgs_MT64x64x64_MI16x16x1_SN_LDSB1_CLR1_GSU0_GSUC0_GSUWGMRR0_K1_LBSPPA512_LBSPPB512_LPA32_LPB32_MIWT2_2_PLR2_SU32_SUM0_SUS256_SKXCCM6_VWA2_VWB2_WGM4_WGMXCC1_WGMXCCGn1
    SolutionIndex: 104
    SolutionNameMin: Cijk_Ailk_Bjlk_BSS_BH_UserArgs_MT64x64x64_MI16x16x1_SN_LDSB1_CLR1_GSU0_GSUC0_GSUWGMRR0_K1_LBSPPA512_LBSPPB512_LPA32_LPB32_MIWT2_2_PLR1_SU32_SUM0_SUS256_SKXCCM6_VWA2_VWB2_WGM8_WGMXCC1_WGMXCCGn1
    SolutionIndex: 105
    SolutionNameMin: Cijk_Ailk_Bjlk_BSS_BH_UserArgs_MT64x64x64_MI16x16x1_SN_LDSB1_CLR1_GSU0_GSUC0_GSUWGMRR0_K1_LBSPPA512_LBSPPB512_LPA32_LPB32_MIWT2_2_PLR2_SU32_SUM0_SUS256_SKXCCM6_VWA2_VWB2_WGM8_WGMXCC1_WGMXCCGn1
    SolutionIndex: 106
    SolutionNameMin: Cijk_Ailk_Bjlk_BSS_BH_UserArgs_MT32x64x64_MI16x16x1_SN_LDSB0_CLR1_GSU0_GSUC0_GSUWGMRR0_K1_LBSPPA256_LBSPPB512_LPA16_LPB32_MIWT1_2_PLR2_SU32_SUM0_SUS256_SKXCCM6_VWA1_VWB2_WGM1_WGMXCC1_WGMXCCGn1
    SolutionIndex: 107
    SolutionNameMin: Cijk_Ailk_Bjlk_BSS_BH_UserArgs_MT32x64x64_MI16x16x1_SN_LDSB0_CLR1_GSU0_GSUC0_GSUWGMRR0_K1_LBSPPA256_LBSPPB512_LPA16_LPB32_MIWT1_2_PLR2_SU32_SUM0_SUS256_SKXCCM6_VWA1_VWB2_WGM4_WGMXCC1_WGMXCCGn1
    SolutionIndex: 108
    SolutionNameMin: Cijk_Ailk_Bjlk_BSS_BH_UserArgs_MT32x64x64_MI16x16x1_SN_LDSB0_CLR1_GSU0_GSUC0_GSUWGMRR0_K1_LBSPPA256_LBSPPB512_LPA16_LPB32_MIWT1_2_PLR2_SU32_SUM0_SUS256_SKXCCM6_VWA1_VWB2_WGM8_WGMXCC1_WGMXCCGn1
    SolutionIndex: 109
    SolutionNameMin: Cijk_Ailk_Bjlk_BSS_BH_UserArgs_MT64x32x64_MI16x16x1_SN_LDSB0_CLR1_GSU0_GSUC0_GSUWGMRR0_K1_LBSPPA512_LBSPPB256_LPA32_LPB16_MIWT2_1_PLR2_SU32_SUM0_SUS256_SKXCCM6_VWA2_VWB1_WGM1_WGMXCC1_WGMXCCGn1
    SolutionIndex: 110
    SolutionNameMin: Cijk_Ailk_Bjlk_BSS_BH_UserArgs_MT32x32x64_MI16x16x1_SN_LDSB0_CLR1_GSU0_GSUC0_GSUWGMRR0_K1_LBSPPA256_LBSPPB256_LPA16_LPB16_MIWT1_1_PLR2_SU32_SUM0_SUS256_SKXCCM6_VWA1_VWB1_WGM1_WGMXCC1_WGMXCCGn1
    SolutionIndex: 111
    SolutionNameMin: Cijk_Ailk_Bjlk_BSS_BH_UserArgs_MT128x128x128_MI16x16x1_SN_LDSB1_CLR1_GSU0_GSUC0_GSUWGMRR0_K1_LBSPPA1024_LBSPPB1024_LPA0_LPB0_MIWT4_4_PLR1_SU32_SUM0_SUS256_SKXCCM6_VWA4_VWB4_WGM1_WGMXCC1_WGMXCCGn1
    SolutionIndex: 112
    SolutionNameMin: Cijk_Ailk_Bjlk_BSS_BH_UserArgs_MT128x128x128_MI16x16x1_SN_LDSB1_CLR1_GSU0_GSUC0_GSUWGMRR0_K1_LBSPPA1024_LBSPPB1024_LPA0_LPB0_MIWT4_4_PLR2_SU32_SUM0_SUS256_SKXCCM6_VWA4_VWB4_WGM4_WGMXCC1_WGMXCCGn1
    SolutionIndex: 113
    SolutionNameMin: Cijk_Ailk_Bjlk_BSS_BH_UserArgs_MT128x128x128_MI16x16x1_SN_LDSB1_CLR1_GSU0_GSUC0_GSUWGMRR0_K1_LBSPPA1024_LBSPPB1024_LPA0_LPB0_MIWT4_4_PLR1_SU32_SUM0_SUS256_SKXCCM6_VWA4_VWB4_WGM8_WGMXCC1_WGMXCCGn1
    SolutionIndex: 114
    SolutionNameMin: Cijk_Ailk_Bjlk_BSS_BH_UserArgs_MT128x128x128_MI16x16x1_SN_LDSB1_CLR1_GSU0_GSUC0_GSUWGMRR0_K1_LBSPPA1024_LBSPPB1024_LPA0_LPB0_MIWT4_4_PLR2_SU32_SUM0_SUS256_SKXCCM6_VWA4_VWB4_WGM8_WGMXCC1_WGMXCCGn1
    SolutionIndex: 115
    SolutionNameMin: Cijk_Ailk_Bjlk_BSS_BH_UserArgs_MT32x64x128_MI16x16x1_SN_LDSB1_CLR1_GSU0_GSUC0_GSUWGMRR0_K1_LBSPPA256_LBSPPB512_LPA16_LPB32_MIWT1_2_PLR2_SU32_SUM0_SUS256_SKXCCM6_VWA1_VWB2_WGM1_WGMXCC1_WGMXCCGn1
    SolutionIndex: 116
    SolutionNameMin: Cijk_Ailk_Bjlk_BSS_BH_UserArgs_MT64x32x128_MI16x16x1_SN_LDSB1_CLR1_GSU0_GSUC0_GSUWGMRR0_K1_LBSPPA512_LBSPPB256_LPA32_LPB16_MIWT2_1_PLR2_SU32_SUM0_SUS256_SKXCCM6_VWA2_VWB1_WGM1_WGMXCC1_WGMXCCGn1
    SolutionIndex: 117
    SolutionNameMin: Cijk_Ailk_Bjlk_BSS_BH_UserArgs_MT32x32x128_MI16x16x1_SN_LDSB1_CLR1_GSU0_GSUC0_GSUWGMRR0_K1_LBSPPA256_LBSPPB256_LPA16_LPB16_MIWT1_1_PLR1_SU32_SUM0_SUS256_SKXCCM6_VWA1_VWB1_WGM1_WGMXCC1_WGMXCCGn1
    SolutionIndex: 118
    SolutionNameMin: Cijk_Ailk_Bjlk_BSS_BH_UserArgs_MT32x32x128_MI16x16x1_SN_LDSB1_CLR1_GSU0_GSUC0_GSUWGMRR0_K1_LBSPPA256_LBSPPB256_LPA16_LPB16_MIWT1_1_PLR2_SU32_SUM0_SUS256_SKXCCM6_VWA1_VWB1_WGM1_WGMXCC1_WGMXCCGn1
    SolutionIndex: 119
    SolutionNameMin: Cijk_Ailk_Bjlk_BSS_BH_UserArgs_MT32x32x128_MI16x16x1_SN_LDSB1_CLR1_GSU0_GSUC0_GSUWGMRR0_K1_LBSPPA256_LBSPPB256_LPA16_LPB16_MIWT1_1_PLR1_SU32_SUM0_SUS256_SKXCCM6_VWA1_VWB1_WGM8_WGMXCC1_WGMXCCGn1
    SolutionIndex: 120
    SolutionNameMin: Cijk_Ailk_Bjlk_BSS_BH_UserArgs_MT32x32x32_MI16x16x1_SN_LDSB0_CLR1_GSU0_GSUC0_GSUWGMRR0_K1_LBSPPA256_LBSPPB256_LPA16_LPB16_MIWT1_1_PLR1_SU32_SUM0_SUS256_SKXCCM0_VWA1_VWB1_WGM8_WGMXCC1_WGMXCCGn1
- - - [128, 128, 1, 128, 128, 128, 128, 128]
    - [39, 0.078]
  - - [128, 128, 1, 256, 128, 128, 128, 128]
    - [38, 0.104]
  - - [128, 128, 1, 512, 128, 128, 128, 128]
    - [39, 0.172]
  - - [128, 128, 1, 1024, 128, 128, 128, 128]
    - [118, 0.257]
  - - [128, 128, 1, 2048, 128, 128, 128, 128]
    - [110, 0.356]
  - - [128, 128, 1, 4096, 128, 128, 128, 128]
    - [110, 0.675]
  - - [128, 128, 1, 8192, 128, 128, 128, 128]
    - [118, 1.232]
  - - [128, 256, 1, 128, 128, 128, 128, 256]
    - [39, 0.155]
  - - [128, 256, 1, 256, 128, 128, 128, 256]
    - [39, 0.204]
  - - [128, 256, 1, 512, 128, 128, 128, 256]
    - [38, 0.337]
  - - [128, 256, 1, 1024, 128, 128, 128, 256]
    - [117, 0.52]
  - - [128, 256, 1, 2048, 128, 128, 128, 256]
    - [118, 0.944]
  - - [128, 256, 1, 4096, 128, 128, 128, 256]
    - [15, 1.604]
  - - [128, 256, 1, 8192, 128, 128, 128, 256]
    - [15, 2.609]
  - - [128, 512, 1, 128, 128, 128, 128, 512]
    - [39, 0.308]
  - - [128, 512, 1, 256, 128, 128, 128, 512]
    - [39, 0.394]
  - - [128, 512, 1, 512, 128, 128, 128, 512]
    - [73, 0.652]
  - - [128, 512, 1, 1024, 128, 128, 128, 512]
    - [72, 1.176]
  - - [128, 512, 1, 2048, 128, 128, 128, 512]
    - [118, 2.031]
  - - [128, 512, 1, 4096, 128, 128, 128, 512]
    - [117, 2.998]
  - - [128, 512, 1, 8192, 128, 128, 128, 512]
    - [115, 4.385]
  - - [128, 1024, 1, 128, 128, 128, 128, 1024]
    - [38, 0.588]
  - - [128, 1024, 1, 256, 128, 128, 128, 1024]
    - [38, 0.752]
  - - [128, 1024, 1, 512, 128, 128, 128, 1024]
    - [38, 1.32]
  - - [128, 1024, 1, 1024, 128, 128, 128, 1024]
    - [117, 2.238]
  - - [128, 1024, 1, 2048, 128, 128, 128, 1024]
    - [106, 3.469]
  - - [128, 1024, 1, 4096, 128, 128, 128, 1024]
    - [106, 5.136]
  - - [128, 1024, 1, 8192, 128, 128, 128, 1024]
    - [99, 6.752]
  - - [128, 2048, 1, 128, 128, 128, 128, 2048]
    - [35, 1.073]
  - - [128, 2048, 1, 256, 128, 128, 128, 2048]
    - [38, 1.743]
  - - [128, 2048, 1, 512, 128, 128, 128, 2048]
    - [15, 2.716]
  - - [128, 2048, 1, 1024, 128, 128, 128, 2048]
    - [116, 3.91]
  - - [128, 2048, 1, 2048, 128, 128, 128, 2048]
    - [116, 5.462]
  - - [128, 2048, 1, 4096, 128, 128, 128, 2048]
    - [101, 8.178]
  - - [128, 2048, 1, 8192, 128, 128, 128, 2048]
    - [91, 10.072]
  - - [128, 4096, 1, 128, 128, 128, 128, 4096]
    - [33, 1.912]
  - - [128, 4096, 1, 256, 128, 128, 128, 4096]
    - [30, 3.138]
  - - [128, 4096, 1, 512, 128, 128, 128, 4096]
    - [109, 4.712]
  - - [128, 4096, 1, 1024, 128, 128, 128, 4096]
    - [116, 6.454]
  - - [128, 4096, 1, 2048, 128, 128, 128, 4096]
    - [103, 8.965]
  - - [128, 4096, 1, 4096, 128, 128, 128, 4096]
    - [93, 11.123]
  - - [128, 4096, 1, 8192, 128, 128, 128, 4096]
    - [13, 13.724]
  - - [128, 8192, 1, 128, 128, 128, 128, 8192]
    - [24, 3.12]
  - - [128, 8192, 1, 256, 128, 128, 128, 8192]
    - [100, 5.197]
  - - [128, 8192, 1, 512, 128, 128, 128, 8192]
    - [101, 7.666]
  - - [128, 8192, 1, 1024, 128, 128, 128, 8192]
    - [101, 10.254]
  - - [128, 8192, 1, 2048, 128, 128, 128, 8192]
    - [101, 12.115]
  - - [128, 8192, 1, 4096, 128, 128, 128, 8192]
    - [22, 14.567]
  - - [128, 8192, 1, 8192, 128, 128, 128, 8192]
    - [9, 16.173]
  - - [256, 128, 1, 128, 256, 256, 256, 128]
    - [39, 0.154]
  - - [256, 128, 1, 256, 256, 256, 256, 128]
    - [39, 0.202]
  - - [256, 128, 1, 512, 256, 256, 256, 128]
    - [39, 0.339]
  - - [256, 128, 1, 1024, 256, 256, 256, 128]
    - [110, 0.526]
  - - [256, 128, 1, 2048, 256, 256, 256, 128]
    - [117, 0.944]
  - - [256, 128, 1, 4096, 256, 256, 256, 128]
    - [71, 1.629]
  - - [256, 128, 1, 8192, 256, 256, 256, 128]
    - [15, 2.615]
  - - [256, 256, 1, 128, 256, 256, 256, 256]
    - [38, 0.3]
  - - [256, 256, 1, 256, 256, 256, 256, 256]
    - [38, 0.389]
  - - [256, 256, 1, 512, 256, 256, 256, 256]
    - [71, 0.662]
  - - [256, 256, 1, 1024, 256, 256, 256, 256]
    - [71, 1.171]
  - - [256, 256, 1, 2048, 256, 256, 256, 256]
    - [117, 2.015]
  - - [256, 256, 1, 4096, 256, 256, 256, 256]
    - [117, 3.034]
  - - [256, 256, 1, 8192, 256, 256, 256, 256]
    - [36, 4.482]
  - - [256, 512, 1, 128, 256, 256, 256, 512]
    - [38, 0.576]
  - - [256, 512, 1, 256, 256, 256, 256, 512]
    - [39, 0.745]
  - - [256, 512, 1, 512, 256, 256, 256, 512]
    - [15, 1.311]
  - - [256, 512, 1, 1024, 256, 256, 256, 512]
    - [117, 2.199]
  - - [256, 512, 1, 2048, 256, 256, 256, 512]
    - [115, 3.568]
  - - [256, 512, 1, 4096, 256, 256, 256, 512]
    - [116, 5.193]
  - - [256, 512, 1, 8192, 256, 256, 256, 512]
    - [100, 6.951]
  - - [256, 1024, 1, 128, 256, 256, 256, 1024]
    - [36, 1.085]
  - - [256, 1024, 1, 256, 256, 256, 256, 1024]
    - [15, 1.77]
  - - [256, 1024, 1, 512, 256, 256, 256, 1024]
    - [15, 2.693]
  - - [256, 1024, 1, 1024, 256, 256, 256, 1024]
    - [116, 3.905]
  - - [256, 1024, 1, 2048, 256, 256, 256, 1024]
    - [37, 5.54]
  - - [256, 1024, 1, 4096, 256, 256, 256, 1024]
    - [101, 8.126]
  - - [256, 1024, 1, 8192, 256, 256, 256, 1024]
    - [67, 9.578]
  - - [256, 2048, 1, 128, 256, 256, 256, 2048]
    - [34, 1.852]
  - - [256, 2048, 1, 256, 256, 256, 256, 2048]
    - [30, 3.116]
  - - [256, 2048, 1, 512, 256, 256, 256, 2048]
    - [30, 4.707]
  - - [256, 2048, 1, 1024, 256, 256, 256, 2048]
    - [116, 6.417]
  - - [256, 2048, 1, 2048, 256, 256, 256, 2048]
    - [100, 9.163]
  - - [256, 2048, 1, 4096, 256, 256, 256, 2048]
    - [95, 11.316]
  - - [256, 2048, 1, 8192, 256, 256, 256, 2048]
    - [8, 12.891]
  - - [256, 4096, 1, 128, 256, 256, 256, 4096]
    - [25, 3.067]
  - - [256, 4096, 1, 256, 256, 256, 256, 4096]
    - [24, 5.148]
  - - [256, 4096, 1, 512, 256, 256, 256, 4096]
    - [29, 7.682]
  - - [256, 4096, 1, 1024, 256, 256, 256, 4096]
    - [101, 10.527]
  - - [256, 4096, 1, 2048, 256, 256, 256, 4096]
    - [101, 12.247]
  - - [256, 4096, 1, 4096, 256, 256, 256, 4096]
    - [20, 14.119]
  - - [256, 4096, 1, 8192, 256, 256, 256, 4096]
    - [59, 15.539]
  - - [256, 8192, 1, 128, 256, 256, 256, 8192]
    - [69, 4.525]
  - - [256, 8192, 1, 256, 256, 256, 256, 8192]
    - [93, 7.653]
  - - [256, 8192, 1, 512, 256, 256, 256, 8192]
    - [93, 10.811]
  - - [256, 8192, 1, 1024, 256, 256, 256, 8192]
    - [98, 13.963]
  - - [256, 8192, 1, 2048, 256, 256, 256, 8192]
    - [93, 15.41]
  - - [256, 8192, 1, 4096, 256, 256, 256, 8192]
    - [87, 16.869]
  - - [256, 8192, 1, 8192, 256, 256, 256, 8192]
    - [56, 17.992]
  - - [512, 128, 1, 128, 512, 512, 512, 128]
    - [38, 0.305]
  - - [512, 128, 1, 256, 512, 512, 512, 128]
    - [38, 0.391]
  - - [512, 128, 1, 512, 512, 512, 512, 128]
    - [72, 0.665]
  - - [512, 128, 1, 1024, 512, 512, 512, 128]
    - [71, 1.168]
  - - [512, 128, 1, 2048, 512, 512, 512, 128]
    - [118, 2.023]
  - - [512, 128, 1, 4096, 512, 512, 512, 128]
    - [119, 2.955]
  - - [512, 128, 1, 8192, 512, 512, 512, 128]
    - [107, 4.36]
  - - [512, 256, 1, 128, 512, 512, 512, 256]
    - [39, 0.584]
  - - [512, 256, 1, 256, 512, 512, 512, 256]
    - [38, 0.749]
  - - [512, 256, 1, 512, 512, 512, 512, 256]
    - [39, 1.31]
  - - [512, 256, 1, 1024, 512, 512, 512, 256]
    - [117, 2.184]
  - - [512, 256, 1, 2048, 512, 512, 512, 256]
    - [116, 3.539]
  - - [512, 256, 1, 4096, 512, 512, 512, 256]
    - [37, 5.211]
  - - [512, 256, 1, 8192, 512, 512, 512, 256]
    - [102, 6.9]
  - - [512, 512, 1, 128, 512, 512, 512, 512]
    - [36, 1.085]
  - - [512, 512, 1, 256, 512, 512, 512, 512]
    - [15, 1.763]
  - - [512, 512, 1, 512, 512, 512, 512, 512]
    - [15, 2.684]
  - - [512, 512, 1, 1024, 512, 512, 512, 512]
    - [116, 3.856]
  - - [512, 512, 1, 2048, 512, 512, 512, 512]
    - [37, 5.571]
  - - [512, 512, 1, 4096, 512, 512, 512, 512]
    - [102, 8.218]
  - - [512, 512, 1, 8192, 512, 512, 512, 512]
    - [67, 10.022]
  - - [512, 1024, 1, 128, 512, 512, 512, 1024]
    - [32, 1.893]
  - - [512, 1024, 1, 256, 512, 512, 512, 1024]
    - [30, 3.084]
  - - [512, 1024, 1, 512, 512, 512, 512, 1024]
    - [30, 4.755]
  - - [512, 1024, 1, 1024, 512, 512, 512, 1024]
    - [36, 6.488]
  - - [512, 1024, 1, 2048, 512, 512, 512, 1024]
    - [100, 9.211]
  - - [512, 1024, 1, 4096, 512, 512, 512, 1024]
    - [97, 11.184]
  - - [512, 1024, 1, 8192, 512, 512, 512, 1024]
    - [18, 12.891]
  - - [512, 2048, 1, 128, 512, 512, 512, 2048]
    - [14, 3.06]
  - - [512, 2048, 1, 256, 512, 512, 512, 2048]
    - [24, 5.122]
  - - [512, 2048, 1, 512, 512, 512, 512, 2048]
    - [100, 7.531]
  - - [512, 2048, 1, 1024, 512, 512, 512, 2048]
    - [28, 10.307]
  - - [512, 2048, 1, 2048, 512, 512, 512, 2048]
    - [93, 12.307]
  - - [512, 2048, 1, 4096, 512, 512, 512, 2048]
    - [18, 14.261]
  - - [512, 2048, 1, 8192, 512, 512, 512, 2048]
    - [60, 15.253]
  - - [512, 4096, 1, 128, 512, 512, 512, 4096]
    - [67, 4.571]
  - - [512, 4096, 1, 256, 512, 512, 512, 4096]
    - [93, 7.645]
  - - [512, 4096, 1, 512, 512, 512, 512, 4096]
    - [98, 10.889]
  - - [512, 4096, 1, 1024, 512, 512, 512, 4096]
    - [98, 14.193]
  - - [512, 4096, 1, 2048, 512, 512, 512, 4096]
    - [93, 15.655]
  - - [512, 4096, 1, 4096, 512, 512, 512, 4096]
    - [61, 15.941]
  - - [512, 4096, 1, 8192, 512, 512, 512, 4096]
    - [7, 17.792]
  - - [512, 8192, 1, 128, 512, 512, 512, 8192]
    - [66, 6.102]
  - - [512, 8192, 1, 256, 512, 512, 512, 8192]
    - [87, 9.914]
  - - [512, 8192, 1, 512, 512, 512, 512, 8192]
    - [86, 13.874]
  - - [512, 8192, 1, 1024, 512, 512, 512, 8192]
    - [83, 17.22]
  - - [512, 8192, 1, 2048, 512, 512, 512, 8192]
    - [84, 19.765]
  - - [512, 8192, 1, 4096, 512, 512, 512, 8192]
    - [111, 19.146]
  - - [512, 8192, 1, 8192, 512, 512, 512, 8192]
    - [75, 20.368]
  - - [1024, 128, 1, 128, 1024, 1024, 1024, 128]
    - [38, 0.589]
  - - [1024, 128, 1, 256, 1024, 1024, 1024, 128]
    - [39, 0.747]
  - - [1024, 128, 1, 512, 1024, 1024, 1024, 128]
    - [38, 1.317]
  - - [1024, 128, 1, 1024, 1024, 1024, 1024, 128]
    - [118, 2.188]
  - - [1024, 128, 1, 2048, 1024, 1024, 1024, 128]
    - [106, 3.458]
  - - [1024, 128, 1, 4096, 1024, 1024, 1024, 128]
    - [108, 5.078]
  - - [1024, 128, 1, 8192, 1024, 1024, 1024, 128]
    - [102, 6.659]
  - - [1024, 256, 1, 128, 1024, 1024, 1024, 256]
    - [36, 1.089]
  - - [1024, 256, 1, 256, 1024, 1024, 1024, 256]
    - [15, 1.759]
  - - [1024, 256, 1, 512, 1024, 1024, 1024, 256]
    - [15, 2.677]
  - - [1024, 256, 1, 1024, 1024, 1024, 1024, 256]
    - [116, 3.809]
  - - [1024, 256, 1, 2048, 1024, 1024, 1024, 256]
    - [37, 5.56]
  - - [1024, 256, 1, 4096, 1024, 1024, 1024, 256]
    - [102, 7.892]
  - - [1024, 256, 1, 8192, 1024, 1024, 1024, 256]
    - [13, 9.402]
  - - [1024, 512, 1, 128, 1024, 1024, 1024, 512]
    - [33, 1.903]
  - - [1024, 512, 1, 256, 1024, 1024, 1024, 512]
    - [30, 3.136]
  - - [1024, 512, 1, 512, 1024, 1024, 1024, 512]
    - [36, 4.76]
  - - [1024, 512, 1, 1024, 1024, 1024, 1024, 512]
    - [36, 6.541]
  - - [1024, 512, 1, 2048, 1024, 1024, 1024, 512]
    - [105, 9.169]
  - - [1024, 512, 1, 4096, 1024, 1024, 1024, 512]
    - [96, 11.158]
  - - [1024, 512, 1, 8192, 1024, 1024, 1024, 512]
    - [9, 12.737]
  - - [1024, 1024, 1, 128, 1024, 1024, 1024, 1024]
    - [24, 3.089]
  - - [1024, 1024, 1, 256, 1024, 1024, 1024, 1024]
    - [24, 5.215]
  - - [1024, 1024, 1, 512, 1024, 1024, 1024, 1024]
    - [24, 7.653]
  - - [1024, 1024, 1, 1024, 1024, 1024, 1024, 1024]
    - [24, 10.392]
  - - [1024, 1024, 1, 2048, 1024, 1024, 1024, 1024]
    - [21, 12.29]
  - - [1024, 1024, 1, 4096, 1024, 1024, 1024, 1024]
    - [19, 14.221]
  - - [1024, 1024, 1, 8192, 1024, 1024, 1024, 1024]
    - [2, 15.123]
  - - [1024, 2048, 1, 128, 1024, 1024, 1024, 2048]
    - [13, 4.662]
  - - [1024, 2048, 1, 256, 1024, 1024, 1024, 2048]
    - [22, 7.611]
  - - [1024, 2048, 1, 512, 1024, 1024, 1024, 2048]
    - [22, 10.815]
  - - [1024, 2048, 1, 1024, 1024, 1024, 1024, 2048]
    - [93, 14.015]
  - - [1024, 2048, 1, 2048, 1024, 1024, 1024, 2048]
    - [91, 15.0]
  - - [1024, 2048, 1, 4096, 1024, 1024, 1024, 2048]
    - [61, 15.923]
  - - [1024, 2048, 1, 8192, 1024, 1024, 1024, 2048]
    - [56, 17.486]
  - - [1024, 4096, 1, 128, 1024, 1024, 1024, 4096]
    - [66, 6.087]
  - - [1024, 4096, 1, 256, 1024, 1024, 1024, 4096]
    - [87, 9.886]
  - - [1024, 4096, 1, 512, 1024, 1024, 1024, 4096]
    - [83, 14.113]
  - - [1024, 4096, 1, 1024, 1024, 1024, 1024, 4096]
    - [60, 17.315]
  - - [1024, 4096, 1, 2048, 1024, 1024, 1024, 4096]
    - [83, 19.948]
  - - [1024, 4096, 1, 4096, 1024, 1024, 1024, 4096]
    - [111, 19.134]
  - - [1024, 4096, 1, 8192, 1024, 1024, 1024, 4096]
    - [74, 20.699]
  - - [1024, 8192, 1, 128, 1024, 1024, 1024, 8192]
    - [51, 6.504]
  - - [1024, 8192, 1, 256, 1024, 1024, 1024, 8192]
    - [51, 10.577]
  - - [1024, 8192, 1, 512, 1024, 1024, 1024, 8192]
    - [51, 15.357]
  - - [1024, 8192, 1, 1024, 1024, 1024, 1024, 8192]
    - [58, 19.301]
  - - [1024, 8192, 1, 2048, 1024, 1024, 1024, 8192]
    - [81, 19.399]
  - - [1024, 8192, 1, 4096, 1024, 1024, 1024, 8192]
    - [74, 20.725]
  - - [1024, 8192, 1, 8192, 1024, 1024, 1024, 8192]
    - [74, 23.252]
  - - [2048, 128, 1, 128, 2048, 2048, 2048, 128]
    - [37, 1.081]
  - - [2048, 128, 1, 256, 2048, 2048, 2048, 128]
    - [15, 1.775]
  - - [2048, 128, 1, 512, 2048, 2048, 2048, 128]
    - [15, 2.7]
  - - [2048, 128, 1, 1024, 2048, 2048, 2048, 128]
    - [115, 3.929]
  - - [2048, 128, 1, 2048, 2048, 2048, 2048, 128]
    - [108, 5.362]
  - - [2048, 128, 1, 4096, 2048, 2048, 2048, 128]
    - [102, 7.995]
  - - [2048, 128, 1, 8192, 2048, 2048, 2048, 128]
    - [70, 9.803]
  - - [2048, 256, 1, 128, 2048, 2048, 2048, 256]
    - [32, 1.89]
  - - [2048, 256, 1, 256, 2048, 2048, 2048, 256]
    - [31, 3.077]
  - - [2048, 256, 1, 512, 2048, 2048, 2048, 256]
    - [30, 4.756]
  - - [2048, 256, 1, 1024, 2048, 2048, 2048, 256]
    - [103, 6.341]
  - - [2048, 256, 1, 2048, 2048, 2048, 2048, 256]
    - [104, 8.929]
  - - [2048, 256, 1, 4096, 2048, 2048, 2048, 256]
    - [96, 11.063]
  - - [2048, 256, 1, 8192, 2048, 2048, 2048, 256]
    - [9, 12.838]
  - - [2048, 512, 1, 128, 2048, 2048, 2048, 512]
    - [23, 3.08]
  - - [2048, 512, 1, 256, 2048, 2048, 2048, 512]
    - [24, 5.182]
  - - [2048, 512, 1, 512, 2048, 2048, 2048, 512]
    - [24, 7.597]
  - - [2048, 512, 1, 1024, 2048, 2048, 2048, 512]
    - [105, 10.173]
  - - [2048, 512, 1, 2048, 2048, 2048, 2048, 512]
    - [96, 12.196]
  - - [2048, 512, 1, 4096, 2048, 2048, 2048, 512]
    - [18, 14.039]
  - - [2048, 512, 1, 8192, 2048, 2048, 2048, 512]
    - [62, 15.351]
  - - [2048, 1024, 1, 128, 2048, 2048, 2048, 1024]
    - [13, 4.758]
  - - [2048, 1024, 1, 256, 2048, 2048, 2048, 1024]
    - [21, 7.93]
  - - [2048, 1024, 1, 512, 2048, 2048, 2048, 1024]
    - [13, 10.928]
  - - [2048, 1024, 1, 1024, 2048, 2048, 2048, 1024]
    - [11, 13.47]
  - - [2048, 1024, 1, 2048, 2048, 2048, 2048, 1024]
    - [87, 15.105]
  - - [2048, 1024, 1, 4096, 2048, 2048, 2048, 1024]
    - [60, 16.111]
  - - [2048, 1024, 1, 8192, 2048, 2048, 2048, 1024]
    - [54, 17.206]
  - - [2048, 2048, 1, 128, 2048, 2048, 2048, 2048]
    - [65, 5.996]
  - - [2048, 2048, 1, 256, 2048, 2048, 2048, 2048]
    - [64, 9.728]
  - - [2048, 2048, 1, 512, 2048, 2048, 2048, 2048]
    - [87, 14.005]
  - - [2048, 2048, 1, 1024, 2048, 2048, 2048, 2048]
    - [87, 17.041]
  - - [2048, 2048, 1, 2048, 2048, 2048, 2048, 2048]
    - [87, 19.692]
  - - [2048, 2048, 1, 4096, 2048, 2048, 2048, 2048]
    - [114, 18.77]
  - - [2048, 2048, 1, 8192, 2048, 2048, 2048, 2048]
    - [1, 20.383]
  - - [2048, 4096, 1, 128, 2048, 2048, 2048, 4096]
    - [49, 6.575]
  - - [2048, 4096, 1, 256, 2048, 2048, 2048, 4096]
    - [53, 10.444]
  - - [2048, 4096, 1, 512, 2048, 2048, 2048, 4096]
    - [53, 15.252]
  - - [2048, 4096, 1, 1024, 2048, 2048, 2048, 4096]
    - [56, 19.177]
  - - [2048, 4096, 1, 2048, 2048, 2048, 2048, 4096]
    - [79, 19.461]
  - - [2048, 4096, 1, 4096, 2048, 2048, 2048, 4096]
    - [45, 20.767]
  - - [2048, 4096, 1, 8192, 2048, 2048, 2048, 4096]
    - [74, 23.7]
  - - [2048, 8192, 1, 128, 2048, 2048, 2048, 8192]
    - [93, 6.532]
  - - [2048, 8192, 1, 256, 2048, 2048, 2048, 8192]
    - [85, 10.395]
  - - [2048, 8192, 1, 512, 2048, 2048, 2048, 8192]
    - [44, 14.895]
  - - [2048, 8192, 1, 1024, 2048, 2048, 2048, 8192]
    - [44, 18.556]
  - - [2048, 8192, 1, 2048, 2048, 2048, 2048, 8192]
    - [74, 21.964]
  - - [2048, 8192, 1, 4096, 2048, 2048, 2048, 8192]
    - [0, 22.086]
  - - [2048, 8192, 1, 8192, 2048, 2048, 2048, 8192]
    - [17, 24.299]
  - - [4096, 128, 1, 128, 4096, 4096, 4096, 128]
    - [33, 1.886]
  - - [4096, 128, 1, 256, 4096, 4096, 4096, 128]
    - [30, 3.125]
  - - [4096, 128, 1, 512, 4096, 4096, 4096, 128]
    - [37, 4.716]
  - - [4096, 128, 1, 1024, 4096, 4096, 4096, 128]
    - [103, 6.32]
  - - [4096, 128, 1, 2048, 4096, 4096, 4096, 128]
    - [102, 8.686]
  - - [4096, 128, 1, 4096, 4096, 4096, 4096, 128]
    - [94, 11.041]
  - - [4096, 128, 1, 8192, 4096, 4096, 4096, 128]
    - [11, 12.715]
  - - [4096, 256, 1, 128, 4096, 4096, 4096, 256]
    - [26, 3.107]
  - - [4096, 256, 1, 256, 4096, 4096, 4096, 256]
    - [26, 5.172]
  - - [4096, 256, 1, 512, 4096, 4096, 4096, 256]
    - [105, 7.624]
  - - [4096, 256, 1, 1024, 4096, 4096, 4096, 256]
    - [103, 10.295]
  - - [4096, 256, 1, 2048, 4096, 4096, 4096, 256]
    - [96, 12.134]
  - - [4096, 256, 1, 4096, 4096, 4096, 4096, 256]
    - [87, 14.339]
  - - [4096, 256, 1, 8192, 4096, 4096, 4096, 256]
    - [60, 15.533]
  - - [4096, 512, 1, 128, 4096, 4096, 4096, 512]
    - [12, 4.649]
  - - [4096, 512, 1, 256, 4096, 4096, 4096, 512]
    - [21, 7.863]
  - - [4096, 512, 1, 512, 4096, 4096, 4096, 512]
    - [98, 10.971]
  - - [4096, 512, 1, 1024, 4096, 4096, 4096, 512]
    - [98, 14.134]
  - - [4096, 512, 1, 2048, 4096, 4096, 4096, 512]
    - [90, 15.275]
  - - [4096, 512, 1, 4096, 4096, 4096, 4096, 512]
    - [60, 16.178]
  - - [4096, 512, 1, 8192, 4096, 4096, 4096, 512]
    - [54, 17.71]
  - - [4096, 1024, 1, 128, 4096, 4096, 4096, 1024]
    - [63, 6.165]
  - - [4096, 1024, 1, 256, 4096, 4096, 4096, 1024]
    - [64, 9.921]
  - - [4096, 1024, 1, 512, 4096, 4096, 4096, 1024]
    - [87, 13.925]
  - - [4096, 1024, 1, 1024, 4096, 4096, 4096, 1024]
    - [86, 16.976]
  - - [4096, 1024, 1, 2048, 4096, 4096, 4096, 1024]
    - [85, 19.522]
  - - [4096, 1024, 1, 4096, 4096, 4096, 4096, 1024]
    - [113, 19.094]
  - - [4096, 1024, 1, 8192, 4096, 4096, 4096, 1024]
    - [76, 20.708]
  - - [4096, 2048, 1, 128, 4096, 4096, 4096, 2048]
    - [2, 6.605]
  - - [4096, 2048, 1, 256, 4096, 4096, 4096, 2048]
    - [6, 10.53]
  - - [4096, 2048, 1, 512, 4096, 4096, 4096, 2048]
    - [58, 14.971]
  - - [4096, 2048, 1, 1024, 4096, 4096, 4096, 2048]
    - [52, 19.219]
  - - [4096, 2048, 1, 2048, 4096, 4096, 4096, 2048]
    - [82, 19.365]
  - - [4096, 2048, 1, 4096, 4096, 4096, 4096, 2048]
    - [76, 20.501]
  - - [4096, 2048, 1, 8192, 4096, 4096, 4096, 2048]
    - [78, 23.601]
  - - [4096, 4096, 1, 128, 4096, 4096, 4096, 4096]
    - [92, 6.402]
  - - [4096, 4096, 1, 256, 4096, 4096, 4096, 4096]
    - [41, 10.327]
  - - [4096, 4096, 1, 512, 4096, 4096, 4096, 4096]
    - [75, 14.635]
  - - [4096, 4096, 1, 1024, 4096, 4096, 4096, 4096]
    - [46, 18.321]
  - - [4096, 4096, 1, 2048, 4096, 4096, 4096, 4096]
    - [74, 22.109]
  - - [4096, 4096, 1, 4096, 4096, 4096, 4096, 4096]
    - [42, 22.682]
  - - [4096, 4096, 1, 8192, 4096, 4096, 4096, 4096]
    - [42, 24.455]
  - - [4096, 8192, 1, 128, 4096, 4096, 4096, 8192]
    - [18, 6.349]
  - - [4096, 8192, 1, 256, 4096, 4096, 4096, 8192]
    - [86, 9.094]
  - - [4096, 8192, 1, 512, 4096, 4096, 4096, 8192]
    - [57, 13.112]
  - - [4096, 8192, 1, 1024, 4096, 4096, 4096, 8192]
    - [48, 17.981]
  - - [4096, 8192, 1, 2048, 4096, 4096, 4096, 8192]
    - [47, 21.554]
  - - [4096, 8192, 1, 4096, 4096, 4096, 4096, 8192]
    - [50, 24.321]
  - - [4096, 8192, 1, 8192, 4096, 4096, 4096, 8192]
    - [17, 26.283]
  - - [8192, 128, 1, 128, 8192, 8192, 8192, 128]
    - [26, 3.087]
  - - [8192, 128, 1, 256, 8192, 8192, 8192, 128]
    - [27, 5.136]
  - - [8192, 128, 1, 512, 8192, 8192, 8192, 128]
    - [103, 7.644]
  - - [8192, 128, 1, 1024, 8192, 8192, 8192, 128]
    - [102, 10.132]
  - - [8192, 128, 1, 2048, 8192, 8192, 8192, 128]
    - [105, 11.794]
  - - [8192, 128, 1, 4096, 8192, 8192, 8192, 128]
    - [19, 13.861]
  - - [8192, 128, 1, 8192, 8192, 8192, 8192, 128]
    - [10, 16.07]
  - - [8192, 256, 1, 128, 8192, 8192, 8192, 256]
    - [68, 4.555]
  - - [8192, 256, 1, 256, 8192, 8192, 8192, 256]
    - [95, 7.521]
  - - [8192, 256, 1, 512, 8192, 8192, 8192, 256]
    - [98, 10.746]
  - - [8192, 256, 1, 1024, 8192, 8192, 8192, 256]
    - [95, 13.756]
  - - [8192, 256, 1, 2048, 8192, 8192, 8192, 256]
    - [89, 15.038]
  - - [8192, 256, 1, 4096, 8192, 8192, 8192, 256]
    - [83, 17.219]
  - - [8192, 256, 1, 8192, 8192, 8192, 8192, 256]
    - [5, 18.309]
  - - [8192, 512, 1, 128, 8192, 8192, 8192, 512]
    - [66, 5.677]
  - - [8192, 512, 1, 256, 8192, 8192, 8192, 512]
    - [87, 9.539]
  - - [8192, 512, 1, 512, 8192, 8192, 8192, 512]
    - [87, 13.642]
  - - [8192, 512, 1, 1024, 8192, 8192, 8192, 512]
    - [62, 16.973]
  - - [8192, 512, 1, 2048, 8192, 8192, 8192, 512]
    - [88, 19.468]
  - - [8192, 512, 1, 4096, 8192, 8192, 8192, 512]
    - [112, 18.956]
  - - [8192, 512, 1, 8192, 8192, 8192, 8192, 512]
    - [4, 20.778]
  - - [8192, 1024, 1, 128, 8192, 8192, 8192, 1024]
    - [2, 6.575]
  - - [8192, 1024, 1, 256, 8192, 8192, 8192, 1024]
    - [55, 10.458]
  - - [8192, 1024, 1, 512, 8192, 8192, 8192, 1024]
    - [52, 15.291]
  - - [8192, 1024, 1, 1024, 8192, 8192, 8192, 1024]
    - [52, 19.212]
  - - [8192, 1024, 1, 2048, 8192, 8192, 8192, 1024]
    - [80, 19.401]
  - - [8192, 1024, 1, 4096, 8192, 8192, 8192, 1024]
    - [42, 20.891]
  - - [8192, 1024, 1, 8192, 8192, 8192, 8192, 1024]
    - [77, 23.299]
  - - [8192, 2048, 1, 128, 8192, 8192, 8192, 2048]
    - [40, 6.334]
  - - [8192, 2048, 1, 256, 8192, 8192, 8192, 2048]
    - [43, 10.119]
  - - [8192, 2048, 1, 512, 8192, 8192, 8192, 2048]
    - [44, 14.756]
  - - [8192, 2048, 1, 1024, 8192, 8192, 8192, 2048]
    - [43, 18.542]
  - - [8192, 2048, 1, 2048, 8192, 8192, 8192, 2048]
    - [77, 21.917]
  - - [8192, 2048, 1, 4096, 8192, 8192, 8192, 2048]
    - [48, 21.958]
  - - [8192, 2048, 1, 8192, 8192, 8192, 8192, 2048]
    - [16, 23.976]
  - - [8192, 4096, 1, 128, 8192, 8192, 8192, 4096]
    - [83, 6.399]
  - - [8192, 4096, 1, 256, 8192, 8192, 8192, 4096]
    - [18, 9.165]
  - - [8192, 4096, 1, 512, 8192, 8192, 8192, 4096]
    - [52, 13.084]
  - - [8192, 4096, 1, 1024, 8192, 8192, 8192, 4096]
    - [48, 17.896]
  - - [8192, 4096, 1, 2048, 8192, 8192, 8192, 4096]
    - [50, 22.144]
  - - [8192, 4096, 1, 4096, 8192, 8192, 8192, 4096]
    - [3, 24.083]
  - - [8192, 4096, 1, 8192, 8192, 8192, 8192, 4096]
    - [17, 26.433]
  - - [8192, 8192, 1, 128, 8192, 8192, 8192, 8192]
    - [52, 5.58]
  - - [8192, 8192, 1, 256, 8192, 8192, 8192, 8192]
    - [52, 9.214]
  - - [8192, 8192, 1, 512, 8192, 8192, 8192, 8192]
    - [48, 14.447]
  - - [8192, 8192, 1, 1024, 8192, 8192, 8192, 8192]
    - [2, 19.466]
  - - [8192, 8192, 1, 2048, 8192, 8192, 8192, 8192]
    - [52, 23.661]
  - - [8192, 8192, 1, 4096, 8192, 8192, 8192, 8192]
    - [74, 26.949]
  - - [8192, 8192, 1, 8192, 8192, 8192, 8192, 8192]
    - [76, 27.154]
  - - [1, 1, 1, 32, 1, 1, 1, 1]
    - [120, 0.0]
- null
- null
- DeviceEfficiency
- GridBased
