library/src/amd_detail/rocblaslt/src/Tensile/Logic/streamk/gfx942a/aquavanjaram942_Cijk_Ailk_Bljk_HHS_BH_UserArgs.yaml
- {MinimumRequiredVersion: 4.33.0}
- aquavanjaram942
- gfx942
- [Device 0049, Device 0050]
    SolutionIndex: 0
    SolutionNameMin: Cijk_Ailk_Bljk_HHS_BH_UserArgs_MT256x256x32_MI16x16x1_SN_LDSB1_CLR1_GSU0_GSUC0_GSUWGMRR0_K1_LBSPPA2048_LBSPPB256_LPA0_MIWT8_8_PLR1_SU32_SUM0_SUS256_SKXCCM0_VWA8_VWB4_WGM1_WGMXCC1_WGMXCCGn1
    SolutionIndex: 1
    SolutionNameMin: Cijk_Ailk_Bljk_HHS_BH_UserArgs_MT256x256x32_MI16x16x1_SN_LDSB1_CLR1_GSU0_GSUC0_GSUWGMRR0_K1_LBSPPA2048_LBSPPB512_LPA0_MIWT8_8_PLR1_SU32_SUM0_SUS256_SKXCCM0_VWA8_VWB8_WGM1_WGMXCC1_WGMXCCGn1
    SolutionIndex: 2
    SolutionNameMin: Cijk_Ailk_Bljk_HHS_BH_UserArgs_MT256x256x32_MI16x16x1_SN_LDSB1_CLR1_GSU0_GSUC0_GSUWGMRR0_K1_LBSPPA2048_LBSPPB512_LPA0_MIWT8_8_PLR1_SU32_SUM0_SUS256_SKXCCM0_VWA8_VWB8_WGM8_WGMXCC1_WGMXCCGn1
    SolutionIndex: 3
    SolutionNameMin: Cijk_Ailk_Bljk_HHS_BH_UserArgs_MT256x128x32_MI16x16x1_SN_LDSB1_CLR1_GSU0_GSUC0_GSUWGMRR0_K1_LBSPPA2048_LBSPPB128_LPA0_MIWT8_4_PLR1_SU32_SUM0_SUS256_SKXCCM0_VWA4_VWB1_WGM4_WGMXCC1_WGMXCCGn1
    SolutionIndex: 4
    SolutionNameMin: Cijk_Ailk_Bljk_HHS_BH_UserArgs_MT256x128x32_MI16x16x1_SN_LDSB1_CLR1_GSU0_GSUC0_GSUWGMRR0_K1_LBSPPA2048_LBSPPB128_LPA0_MIWT8_4_PLR1_SU32_SUM0_SUS256_SKXCCM0_VWA4_VWB1_WGM8_WGMXCC1_WGMXCCGn1
    SolutionIndex: 5
    SolutionNameMin: Cijk_Ailk_Bljk_HHS_BH_UserArgs_MT256x64x32_MI16x16x1_SN_LDSB1_CLR1_GSU0_GSUC0_GSUWGMRR0_K1_LBSPPA2048_LBSPPB128_LPA0_MIWT8_2_PLR1_SU32_SUM0_SUS256_SKXCCM0_VWA8_VWB1_WGM4_WGMXCC1_WGMXCCGn1
    SolutionIndex: 6
    SolutionNameMin: Cijk_Ailk_Bljk_HHS_BH_UserArgs_MT256x64x32_MI16x16x1_SN_LDSB1_CLR1_GSU0_GSUC0_GSUWGMRR0_K1_LBSPPA2048_LBSPPB128_LPA0_MIWT8_2_PLR1_SU32_SUM0_SUS256_SKXCCM0_VWA8_VWB2_WGM4_WGMXCC1_WGMXCCGn1
    SolutionIndex: 7
    SolutionNameMin: Cijk_Ailk_Bljk_HHS_BH_UserArgs_MT256x64x32_MI16x16x1_SN_LDSB1_CLR1_GSU0_GSUC0_GSUWGMRR0_K1_LBSPPA2048_LBSPPB128_LPA0_MIWT8_2_PLR1_SU32_SUM0_SUS256_SKXCCM0_VWA8_VWB1_WGM8_WGMXCC1_WGMXCCGn1
    SolutionIndex: 8
    SolutionNameMin: Cijk_Ailk_Bljk_HHS_BH_UserArgs_MT256x64x32_MI16x16x1_SN_LDSB1_CLR1_GSU0_GSUC0_GSUWGMRR0_K1_LBSPPA2048_LBSPPB128_LPA0_MIWT8_2_PLR1_SU32_SUM0_SUS256_SKXCCM0_VWA8_VWB2_WGM8_WGMXCC1_WGMXCCGn1
    SolutionIndex: 9
    SolutionNameMin: Cijk_Ailk_Bljk_HHS_BH_UserArgs_MT128x64x32_MI16x16x1_SN_LDSB0_CLR0_GSU0_GSUC0_GSUWGMRR0_K1_LBSPPA1024_LBSPPB128_LPA0_MIWT4_2_PLR0_SU32_SUM0_SUS256_SKXCCM0_VWA4_VWB1_WGM1_WGMXCC1_WGMXCCGn1
    SolutionIndex: 10
    SolutionNameMin: Cijk_Ailk_Bljk_HHS_BH_UserArgs_MT256x64x64_MI16x16x1_SN_LDSB1_CLR1_GSU0_GSUC0_GSUWGMRR0_K1_LBSPPA4096_LBSPPB256_LPA0_MIWT8_2_PLR1_SU32_SUM0_SUS256_SKXCCM0_VWA4_VWB2_WGM8_WGMXCC1_WGMXCCGn1
    SolutionIndex: 11
    SolutionNameMin: Cijk_Ailk_Bljk_HHS_BH_UserArgs_MT128x128x64_MI16x16x1_SN_LDSB1_CLR1_GSU0_GSUC0_GSUWGMRR0_K1_LBSPPA2048_LBSPPB128_LPA0_MIWT4_4_PLR1_SU32_SUM0_SUS256_SKXCCM0_VWA4_VWB1_WGM1_WGMXCC1_WGMXCCGn1
    SolutionIndex: 12
    SolutionNameMin: Cijk_Ailk_Bljk_HHS_BH_UserArgs_MT64x128x64_MI16x16x1_SN_LDSB1_CLR1_GSU0_GSUC0_GSUWGMRR0_K1_LBSPPA1024_LBSPPB128_LPA32_MIWT2_4_PLR1_SU32_SUM0_SUS256_SKXCCM0_VWA2_VWB1_WGM1_WGMXCC1_WGMXCCGn1
    SolutionIndex: 13
    SolutionNameMin: Cijk_Ailk_Bljk_HHS_BH_UserArgs_MT64x128x64_MI16x16x1_SN_LDSB1_CLR1_GSU0_GSUC0_GSUWGMRR0_K1_LBSPPA1024_LBSPPB256_LPA32_MIWT2_4_PLR1_SU32_SUM0_SUS256_SKXCCM0_VWA2_VWB2_WGM1_WGMXCC1_WGMXCCGn1
    SolutionIndex: 14
    SolutionNameMin: Cijk_Ailk_Bljk_HHS_BH_UserArgs_MT64x128x64_MI16x16x1_SN_LDSB1_CLR1_GSU0_GSUC0_GSUWGMRR0_K1_LBSPPA1024_LBSPPB512_LPA32_MIWT2_4_PLR1_SU32_SUM0_SUS256_SKXCCM0_VWA2_VWB4_WGM1_WGMXCC1_WGMXCCGn1
    SolutionIndex: 15
    SolutionNameMin: Cijk_Ailk_Bljk_HHS_BH_UserArgs_MT64x128x64_MI16x16x1_SN_LDSB1_CLR1_GSU0_GSUC0_GSUWGMRR0_K1_LBSPPA1024_LBSPPB256_LPA32_MIWT2_4_PLR2_SU32_SUM0_SUS256_SKXCCM0_VWA2_VWB2_WGM1_WGMXCC1_WGMXCCGn1
    SolutionIndex: 16
    SolutionNameMin: Cijk_Ailk_Bljk_HHS_BH_UserArgs_MT64x128x64_MI16x16x1_SN_LDSB1_CLR1_GSU0_GSUC0_GSUWGMRR0_K1_LBSPPA1024_LBSPPB256_LPA32_MIWT2_4_PLR2_SU32_SUM0_SUS256_SKXCCM0_VWA2_VWB2_WGM4_WGMXCC1_WGMXCCGn1
    SolutionIndex: 17
    SolutionNameMin: Cijk_Ailk_Bljk_HHS_BH_UserArgs_MT64x128x64_MI16x16x1_SN_LDSB1_CLR1_GSU0_GSUC0_GSUWGMRR0_K1_LBSPPA1024_LBSPPB512_LPA32_MIWT2_4_PLR1_SU32_SUM0_SUS256_SKXCCM0_VWA2_VWB4_WGM8_WGMXCC1_WGMXCCGn1
    SolutionIndex: 18
    SolutionNameMin: Cijk_Ailk_Bljk_HHS_BH_UserArgs_MT128x64x64_MI16x16x1_SN_LDSB1_CLR1_GSU0_GSUC0_GSUWGMRR0_K1_LBSPPA2048_LBSPPB128_LPA0_MIWT4_2_PLR1_SU32_SUM0_SUS256_SKXCCM0_VWA4_VWB1_WGM1_WGMXCC1_WGMXCCGn1
    SolutionIndex: 19
    SolutionNameMin: Cijk_Ailk_Bljk_HHS_BH_UserArgs_MT128x64x64_MI16x16x1_SN_LDSB1_CLR1_GSU0_GSUC0_GSUWGMRR0_K1_LBSPPA2048_LBSPPB256_LPA0_MIWT4_2_PLR1_SU32_SUM0_SUS256_SKXCCM0_VWA4_VWB2_WGM1_WGMXCC1_WGMXCCGn1
    SolutionIndex: 20
    SolutionNameMin: Cijk_Ailk_Bljk_HHS_BH_UserArgs_MT128x64x64_MI16x16x1_SN_LDSB1_CLR1_GSU0_GSUC0_GSUWGMRR0_K1_LBSPPA2048_LBSPPB256_LPA0_MIWT4_2_PLR2_SU32_SUM0_SUS256_SKXCCM0_VWA4_VWB2_WGM4_WGMXCC1_WGMXCCGn1
    SolutionIndex: 21
    SolutionNameMin: Cijk_Ailk_Bljk_HHS_BH_UserArgs_MT128x64x64_MI16x16x1_SN_LDSB1_CLR1_GSU0_GSUC0_GSUWGMRR0_K1_LBSPPA2048_LBSPPB128_LPA0_MIWT4_2_PLR1_SU32_SUM0_SUS256_SKXCCM0_VWA4_VWB1_WGM8_WGMXCC1_WGMXCCGn1
    SolutionIndex: 22
    SolutionNameMin: Cijk_Ailk_Bljk_HHS_BH_UserArgs_MT128x64x64_MI16x16x1_SN_LDSB1_CLR1_GSU0_GSUC0_GSUWGMRR0_K1_LBSPPA2048_LBSPPB256_LPA0_MIWT4_2_PLR1_SU32_SUM0_SUS256_SKXCCM0_VWA4_VWB2_WGM8_WGMXCC1_WGMXCCGn1
    SolutionIndex: 23
    SolutionNameMin: Cijk_Ailk_Bljk_HHS_BH_UserArgs_MT128x64x64_MI16x16x1_SN_LDSB1_CLR1_GSU0_GSUC0_GSUWGMRR0_K1_LBSPPA2048_LBSPPB256_LPA0_MIWT4_2_PLR2_SU32_SUM0_SUS256_SKXCCM0_VWA4_VWB2_WGM8_WGMXCC1_WGMXCCGn1
    SolutionIndex: 24
    SolutionNameMin: Cijk_Ailk_Bljk_HHS_BH_UserArgs_MT64x64x64_MI16x16x1_SN_LDSB1_CLR1_GSU0_GSUC0_GSUWGMRR0_K1_LBSPPA1024_LBSPPB128_LPA32_MIWT2_2_PLR1_SU32_SUM0_SUS256_SKXCCM0_VWA2_VWB1_WGM1_WGMXCC1_WGMXCCGn1
    SolutionIndex: 25
    SolutionNameMin: Cijk_Ailk_Bljk_HHS_BH_UserArgs_MT64x64x64_MI16x16x1_SN_LDSB1_CLR1_GSU0_GSUC0_GSUWGMRR0_K1_LBSPPA1024_LBSPPB256_LPA32_MIWT2_2_PLR1_SU32_SUM0_SUS256_SKXCCM0_VWA2_VWB2_WGM1_WGMXCC1_WGMXCCGn1
    SolutionIndex: 26
    SolutionNameMin: Cijk_Ailk_Bljk_HHS_BH_UserArgs_MT64x32x64_MI16x16x1_SN_LDSB0_CLR1_GSU0_GSUC0_GSUWGMRR0_K1_LBSPPA1024_LBSPPB128_LPA32_MIWT2_1_PLR1_SU32_SUM0_SUS256_SKXCCM0_VWA2_VWB1_WGM1_WGMXCC1_WGMXCCGn1
    SolutionIndex: 27
    SolutionNameMin: Cijk_Ailk_Bljk_HHS_BH_UserArgs_MT64x32x64_MI16x16x1_SN_LDSB0_CLR1_GSU0_GSUC0_GSUWGMRR0_K1_LBSPPA1024_LBSPPB128_LPA32_MIWT2_1_PLR1_SU32_SUM0_SUS256_SKXCCM0_VWA2_VWB1_WGM4_WGMXCC1_WGMXCCGn1
    SolutionIndex: 28
    SolutionNameMin: Cijk_Ailk_Bljk_HHS_BH_UserArgs_MT32x32x64_MI16x16x1_SN_LDSB0_CLR1_GSU0_GSUC0_GSUWGMRR0_K1_LBSPPA512_LBSPPB128_LPA16_MIWT1_1_PLR1_SU32_SUM0_SUS256_SKXCCM0_VWA1_VWB1_WGM1_WGMXCC1_WGMXCCGn1
    SolutionIndex: 29
    SolutionNameMin: Cijk_Ailk_Bljk_HHS_BH_UserArgs_MT64x64x128_MI16x16x1_SN_LDSB1_CLR1_GSU0_GSUC0_GSUWGMRR0_K1_LBSPPA1024_LBSPPB256_LPA32_MIWT2_2_PLR2_SU32_SUM0_SUS256_SKXCCM0_VWA2_VWB1_WGM1_WGMXCC1_WGMXCCGn1
    SolutionIndex: 30
    SolutionNameMin: Cijk_Ailk_Bljk_HHS_BH_UserArgs_MT64x64x128_MI16x16x1_SN_LDSB1_CLR1_GSU0_GSUC0_GSUWGMRR0_K1_LBSPPA1024_LBSPPB512_LPA32_MIWT2_2_PLR2_SU32_SUM0_SUS256_SKXCCM0_VWA2_VWB2_WGM1_WGMXCC1_WGMXCCGn1
    SolutionIndex: 31
    SolutionNameMin: Cijk_Ailk_Bljk_HHS_BH_UserArgs_MT64x32x128_MI16x16x1_SN_LDSB1_CLR1_GSU0_GSUC0_GSUWGMRR0_K1_LBSPPA1024_LBSPPB256_LPA32_MIWT2_1_PLR1_SU32_SUM0_SUS256_SKXCCM0_VWA2_VWB1_WGM1_WGMXCC1_WGMXCCGn1
    SolutionIndex: 32
    SolutionNameMin: Cijk_Ailk_Bljk_HHS_BH_UserArgs_MT64x32x128_MI16x16x1_SN_LDSB1_CLR1_GSU0_GSUC0_GSUWGMRR0_K1_LBSPPA1024_LBSPPB256_LPA32_MIWT2_1_PLR2_SU32_SUM0_SUS256_SKXCCM0_VWA2_VWB1_WGM1_WGMXCC1_WGMXCCGn1
    SolutionIndex: 33
    SolutionNameMin: Cijk_Ailk_Bljk_HHS_BH_UserArgs_MT32x32x128_MI16x16x1_SN_LDSB1_CLR1_GSU0_GSUC0_GSUWGMRR0_K1_LBSPPA512_LBSPPB256_LPA16_MIWT1_1_PLR1_SU32_SUM0_SUS256_SKXCCM0_VWA1_VWB1_WGM1_WGMXCC1_WGMXCCGn1
    SolutionIndex: 34
    SolutionNameMin: Cijk_Ailk_Bljk_HHS_BH_UserArgs_MT32x32x128_MI16x16x1_SN_LDSB1_CLR1_GSU0_GSUC0_GSUWGMRR0_K1_LBSPPA512_LBSPPB256_LPA16_MIWT1_1_PLR2_SU32_SUM0_SUS256_SKXCCM0_VWA1_VWB1_WGM1_WGMXCC1_WGMXCCGn1
    SolutionIndex: 35
    SolutionNameMin: Cijk_Ailk_Bljk_HHS_BH_UserArgs_MT256x256x32_MI16x16x1_SN_LDSB1_CLR1_GSU0_GSUC0_GSUWGMRR0_K1_LBSPPA2048_LBSPPB128_LPA0_MIWT8_8_PLR1_SU32_SUM0_SUS256_SKXCCM6_VWA4_VWB1_WGM1_WGMXCC1_WGMXCCGn1
    SolutionIndex: 36
    SolutionNameMin: Cijk_Ailk_Bljk_HHS_BH_UserArgs_MT256x256x32_MI16x16x1_SN_LDSB1_CLR1_GSU0_GSUC0_GSUWGMRR0_K1_LBSPPA2048_LBSPPB128_LPA0_MIWT8_8_PLR1_SU32_SUM0_SUS256_SKXCCM6_VWA8_VWB1_WGM1_WGMXCC1_WGMXCCGn1
    SolutionIndex: 37
    SolutionNameMin: Cijk_Ailk_Bljk_HHS_BH_UserArgs_MT256x256x32_MI16x16x1_SN_LDSB1_CLR1_GSU0_GSUC0_GSUWGMRR0_K1_LBSPPA2048_LBSPPB128_LPA0_MIWT8_8_PLR1_SU32_SUM0_SUS256_SKXCCM6_VWA4_VWB2_WGM1_WGMXCC1_WGMXCCGn1
    SolutionIndex: 38
    SolutionNameMin: Cijk_Ailk_Bljk_HHS_BH_UserArgs_MT256x256x32_MI16x16x1_SN_LDSB1_CLR1_GSU0_GSUC0_GSUWGMRR0_K1_LBSPPA2048_LBSPPB128_LPA0_MIWT8_8_PLR1_SU32_SUM0_SUS256_SKXCCM6_VWA8_VWB2_WGM1_WGMXCC1_WGMXCCGn1
    SolutionIndex: 39
    SolutionNameMin: Cijk_Ailk_Bljk_HHS_BH_UserArgs_MT256x256x32_MI16x16x1_SN_LDSB1_CLR1_GSU0_GSUC0_GSUWGMRR0_K1_LBSPPA2048_LBSPPB256_LPA0_MIWT8_8_PLR1_SU32_SUM0_SUS256_SKXCCM6_VWA4_VWB4_WGM1_WGMXCC1_WGMXCCGn1
    SolutionIndex: 40
    SolutionNameMin: Cijk_Ailk_Bljk_HHS_BH_UserArgs_MT256x256x32_MI16x16x1_SN_LDSB1_CLR1_GSU0_GSUC0_GSUWGMRR0_K1_LBSPPA2048_LBSPPB512_LPA0_MIWT8_8_PLR1_SU32_SUM0_SUS256_SKXCCM6_VWA4_VWB8_WGM1_WGMXCC1_WGMXCCGn1
    SolutionIndex: 41
    SolutionNameMin: Cijk_Ailk_Bljk_HHS_BH_UserArgs_MT256x256x32_MI16x16x1_SN_LDSB1_CLR1_GSU0_GSUC0_GSUWGMRR0_K1_LBSPPA2048_LBSPPB128_LPA0_MIWT8_8_PLR1_SU32_SUM0_SUS256_SKXCCM6_VWA4_VWB1_WGM4_WGMXCC1_WGMXCCGn1
    SolutionIndex: 42
    SolutionNameMin: Cijk_Ailk_Bljk_HHS_BH_UserArgs_MT256x256x32_MI16x16x1_SN_LDSB1_CLR1_GSU0_GSUC0_GSUWGMRR0_K1_LBSPPA2048_LBSPPB128_LPA0_MIWT8_8_PLR1_SU32_SUM0_SUS256_SKXCCM6_VWA8_VWB1_WGM4_WGMXCC1_WGMXCCGn1
    SolutionIndex: 43
    SolutionNameMin: Cijk_Ailk_Bljk_HHS_BH_UserArgs_MT256x256x32_MI16x16x1_SN_LDSB1_CLR1_GSU0_GSUC0_GSUWGMRR0_K1_LBSPPA2048_LBSPPB128_LPA0_MIWT8_8_PLR1_SU32_SUM0_SUS256_SKXCCM6_VWA8_VWB2_WGM4_WGMXCC1_WGMXCCGn1
    SolutionIndex: 44
    SolutionNameMin: Cijk_Ailk_Bljk_HHS_BH_UserArgs_MT256x256x32_MI16x16x1_SN_LDSB1_CLR1_GSU0_GSUC0_GSUWGMRR0_K1_LBSPPA2048_LBSPPB512_LPA0_MIWT8_8_PLR1_SU32_SUM0_SUS256_SKXCCM6_VWA4_VWB8_WGM4_WGMXCC1_WGMXCCGn1
    SolutionIndex: 45
    SolutionNameMin: Cijk_Ailk_Bljk_HHS_BH_UserArgs_MT256x256x32_MI16x16x1_SN_LDSB1_CLR1_GSU0_GSUC0_GSUWGMRR0_K1_LBSPPA2048_LBSPPB128_LPA0_MIWT8_8_PLR1_SU32_SUM0_SUS256_SKXCCM6_VWA4_VWB1_WGM8_WGMXCC1_WGMXCCGn1
    SolutionIndex: 46
    SolutionNameMin: Cijk_Ailk_Bljk_HHS_BH_UserArgs_MT256x256x32_MI16x16x1_SN_LDSB1_CLR1_GSU0_GSUC0_GSUWGMRR0_K1_LBSPPA2048_LBSPPB128_LPA0_MIWT8_8_PLR1_SU32_SUM0_SUS256_SKXCCM6_VWA8_VWB1_WGM8_WGMXCC1_WGMXCCGn1
    SolutionIndex: 47
    SolutionNameMin: Cijk_Ailk_Bljk_HHS_BH_UserArgs_MT256x256x32_MI16x16x1_SN_LDSB1_CLR1_GSU0_GSUC0_GSUWGMRR0_K1_LBSPPA2048_LBSPPB128_LPA0_MIWT8_8_PLR1_SU32_SUM0_SUS256_SKXCCM6_VWA4_VWB2_WGM8_WGMXCC1_WGMXCCGn1
    SolutionIndex: 48
    SolutionNameMin: Cijk_Ailk_Bljk_HHS_BH_UserArgs_MT256x256x32_MI16x16x1_SN_LDSB1_CLR1_GSU0_GSUC0_GSUWGMRR0_K1_LBSPPA2048_LBSPPB256_LPA0_MIWT8_8_PLR1_SU32_SUM0_SUS256_SKXCCM6_VWA4_VWB4_WGM8_WGMXCC1_WGMXCCGn1
    SolutionIndex: 49
    SolutionNameMin: Cijk_Ailk_Bljk_HHS_BH_UserArgs_MT256x128x32_MI16x16x1_SN_LDSB1_CLR1_GSU0_GSUC0_GSUWGMRR0_K1_LBSPPA2048_LBSPPB128_LPA32_MIWT8_4_PLR1_SU32_SUM0_SUS256_SKXCCM6_VWA2_VWB1_WGM1_WGMXCC1_WGMXCCGn1
    SolutionIndex: 50
    SolutionNameMin: Cijk_Ailk_Bljk_HHS_BH_UserArgs_MT256x128x32_MI16x16x1_SN_LDSB1_CLR1_GSU0_GSUC0_GSUWGMRR0_K1_LBSPPA2048_LBSPPB128_LPA0_MIWT8_4_PLR1_SU32_SUM0_SUS256_SKXCCM6_VWA4_VWB1_WGM1_WGMXCC1_WGMXCCGn1
    SolutionIndex: 51
    SolutionNameMin: Cijk_Ailk_Bljk_HHS_BH_UserArgs_MT256x128x32_MI16x16x1_SN_LDSB1_CLR1_GSU0_GSUC0_GSUWGMRR0_K1_LBSPPA2048_LBSPPB128_LPA0_MIWT8_4_PLR1_SU32_SUM0_SUS256_SKXCCM6_VWA8_VWB1_WGM1_WGMXCC1_WGMXCCGn1
    SolutionIndex: 52
    SolutionNameMin: Cijk_Ailk_Bljk_HHS_BH_UserArgs_MT256x128x32_MI16x16x1_SN_LDSB1_CLR1_GSU0_GSUC0_GSUWGMRR0_K1_LBSPPA2048_LBSPPB128_LPA32_MIWT8_4_PLR1_SU32_SUM0_SUS256_SKXCCM6_VWA2_VWB2_WGM1_WGMXCC1_WGMXCCGn1
    SolutionIndex: 53
    SolutionNameMin: Cijk_Ailk_Bljk_HHS_BH_UserArgs_MT256x128x32_MI16x16x1_SN_LDSB1_CLR1_GSU0_GSUC0_GSUWGMRR0_K1_LBSPPA2048_LBSPPB128_LPA0_MIWT8_4_PLR1_SU32_SUM0_SUS256_SKXCCM6_VWA4_VWB2_WGM1_WGMXCC1_WGMXCCGn1
    SolutionIndex: 54
    SolutionNameMin: Cijk_Ailk_Bljk_HHS_BH_UserArgs_MT256x128x32_MI16x16x1_SN_LDSB1_CLR1_GSU0_GSUC0_GSUWGMRR0_K1_LBSPPA2048_LBSPPB256_LPA0_MIWT8_4_PLR1_SU32_SUM0_SUS256_SKXCCM6_VWA8_VWB4_WGM1_WGMXCC1_WGMXCCGn1
    SolutionIndex: 55
    SolutionNameMin: Cijk_Ailk_Bljk_HHS_BH_UserArgs_MT256x128x32_MI16x16x1_SN_LDSB1_CLR1_GSU0_GSUC0_GSUWGMRR0_K1_LBSPPA2048_LBSPPB128_LPA0_MIWT8_4_PLR1_SU32_SUM0_SUS256_SKXCCM6_VWA4_VWB1_WGM4_WGMXCC1_WGMXCCGn1
    SolutionIndex: 56
    SolutionNameMin: Cijk_Ailk_Bljk_HHS_BH_UserArgs_MT256x128x32_MI16x16x1_SN_LDSB1_CLR1_GSU0_GSUC0_GSUWGMRR0_K1_LBSPPA2048_LBSPPB128_LPA0_MIWT8_4_PLR1_SU32_SUM0_SUS256_SKXCCM6_VWA8_VWB1_WGM4_WGMXCC1_WGMXCCGn1
    SolutionIndex: 57
    SolutionNameMin: Cijk_Ailk_Bljk_HHS_BH_UserArgs_MT256x128x32_MI16x16x1_SN_LDSB1_CLR1_GSU0_GSUC0_GSUWGMRR0_K1_LBSPPA2048_LBSPPB128_LPA32_MIWT8_4_PLR1_SU32_SUM0_SUS256_SKXCCM6_VWA2_VWB2_WGM4_WGMXCC1_WGMXCCGn1
    SolutionIndex: 58
    SolutionNameMin: Cijk_Ailk_Bljk_HHS_BH_UserArgs_MT256x128x32_MI16x16x1_SN_LDSB1_CLR1_GSU0_GSUC0_GSUWGMRR0_K1_LBSPPA2048_LBSPPB128_LPA0_MIWT8_4_PLR1_SU32_SUM0_SUS256_SKXCCM6_VWA4_VWB2_WGM4_WGMXCC1_WGMXCCGn1
    SolutionIndex: 59
    SolutionNameMin: Cijk_Ailk_Bljk_HHS_BH_UserArgs_MT256x128x32_MI16x16x1_SN_LDSB1_CLR1_GSU0_GSUC0_GSUWGMRR0_K1_LBSPPA2048_LBSPPB256_LPA0_MIWT8_4_PLR1_SU32_SUM0_SUS256_SKXCCM6_VWA4_VWB4_WGM4_WGMXCC1_WGMXCCGn1
    SolutionIndex: 60
    SolutionNameMin: Cijk_Ailk_Bljk_HHS_BH_UserArgs_MT256x128x32_MI16x16x1_SN_LDSB1_CLR1_GSU0_GSUC0_GSUWGMRR0_K1_LBSPPA2048_LBSPPB128_LPA32_MIWT8_4_PLR1_SU32_SUM0_SUS256_SKXCCM6_VWA2_VWB1_WGM8_WGMXCC1_WGMXCCGn1
    SolutionIndex: 61
    SolutionNameMin: Cijk_Ailk_Bljk_HHS_BH_UserArgs_MT256x128x32_MI16x16x1_SN_LDSB1_CLR1_GSU0_GSUC0_GSUWGMRR0_K1_LBSPPA2048_LBSPPB128_LPA0_MIWT8_4_PLR1_SU32_SUM0_SUS256_SKXCCM6_VWA4_VWB1_WGM8_WGMXCC1_WGMXCCGn1
    SolutionIndex: 62
    SolutionNameMin: Cijk_Ailk_Bljk_HHS_BH_UserArgs_MT256x128x32_MI16x16x1_SN_LDSB1_CLR1_GSU0_GSUC0_GSUWGMRR0_K1_LBSPPA2048_LBSPPB128_LPA0_MIWT8_4_PLR1_SU32_SUM0_SUS256_SKXCCM6_VWA8_VWB1_WGM8_WGMXCC1_WGMXCCGn1
    SolutionIndex: 63
    SolutionNameMin: Cijk_Ailk_Bljk_HHS_BH_UserArgs_MT256x128x32_MI16x16x1_SN_LDSB1_CLR1_GSU0_GSUC0_GSUWGMRR0_K1_LBSPPA2048_LBSPPB128_LPA0_MIWT8_4_PLR1_SU32_SUM0_SUS256_SKXCCM6_VWA4_VWB2_WGM8_WGMXCC1_WGMXCCGn1
    SolutionIndex: 64
    SolutionNameMin: Cijk_Ailk_Bljk_HHS_BH_UserArgs_MT256x128x32_MI16x16x1_SN_LDSB1_CLR1_GSU0_GSUC0_GSUWGMRR0_K1_LBSPPA2048_LBSPPB128_LPA0_MIWT8_4_PLR1_SU32_SUM0_SUS256_SKXCCM6_VWA8_VWB2_WGM8_WGMXCC1_WGMXCCGn1
    SolutionIndex: 65
    SolutionNameMin: Cijk_Ailk_Bljk_HHS_BH_UserArgs_MT256x128x32_MI16x16x1_SN_LDSB1_CLR1_GSU0_GSUC0_GSUWGMRR0_K1_LBSPPA2048_LBSPPB256_LPA0_MIWT8_4_PLR1_SU32_SUM0_SUS256_SKXCCM6_VWA8_VWB4_WGM8_WGMXCC1_WGMXCCGn1
    SolutionIndex: 66
    SolutionNameMin: Cijk_Ailk_Bljk_HHS_BH_UserArgs_MT256x64x32_MI16x16x1_SN_LDSB1_CLR1_GSU0_GSUC0_GSUWGMRR0_K1_LBSPPA2048_LBSPPB128_LPA0_MIWT8_2_PLR1_SU32_SUM0_SUS256_SKXCCM6_VWA8_VWB1_WGM1_WGMXCC1_WGMXCCGn1
    SolutionIndex: 67
    SolutionNameMin: Cijk_Ailk_Bljk_HHS_BH_UserArgs_MT256x64x32_MI16x16x1_SN_LDSB1_CLR1_GSU0_GSUC0_GSUWGMRR0_K1_LBSPPA2048_LBSPPB128_LPA0_MIWT8_2_PLR1_SU32_SUM0_SUS256_SKXCCM6_VWA8_VWB2_WGM1_WGMXCC1_WGMXCCGn1
    SolutionIndex: 68
    SolutionNameMin: Cijk_Ailk_Bljk_HHS_BH_UserArgs_MT256x64x32_MI16x16x1_SN_LDSB1_CLR1_GSU0_GSUC0_GSUWGMRR0_K1_LBSPPA2048_LBSPPB128_LPA0_MIWT8_2_PLR1_SU32_SUM0_SUS256_SKXCCM6_VWA8_VWB2_WGM4_WGMXCC1_WGMXCCGn1
    SolutionIndex: 69
    SolutionNameMin: Cijk_Ailk_Bljk_HHS_BH_UserArgs_MT256x64x32_MI16x16x1_SN_LDSB1_CLR1_GSU0_GSUC0_GSUWGMRR0_K1_LBSPPA2048_LBSPPB128_LPA0_MIWT8_2_PLR1_SU32_SUM0_SUS256_SKXCCM6_VWA8_VWB1_WGM8_WGMXCC1_WGMXCCGn1
    SolutionIndex: 70
    SolutionNameMin: Cijk_Ailk_Bljk_HHS_BH_UserArgs_MT128x128x32_MI16x16x1_SN_LDSB1_CLR1_GSU0_GSUC0_GSUWGMRR0_K1_LBSPPA1024_LBSPPB128_LPA32_MIWT4_4_PLR1_SU32_SUM0_SUS256_SKXCCM6_VWA2_VWB1_WGM1_WGMXCC1_WGMXCCGn1
    SolutionIndex: 71
    SolutionNameMin: Cijk_Ailk_Bljk_HHS_BH_UserArgs_MT128x128x32_MI16x16x1_SN_LDSB1_CLR1_GSU0_GSUC0_GSUWGMRR0_K1_LBSPPA1024_LBSPPB128_LPA0_MIWT4_4_PLR1_SU32_SUM0_SUS256_SKXCCM6_VWA4_VWB1_WGM1_WGMXCC1_WGMXCCGn1
    SolutionIndex: 72
    SolutionNameMin: Cijk_Ailk_Bljk_HHS_BH_UserArgs_MT128x128x32_MI16x16x1_SN_LDSB1_CLR1_GSU0_GSUC0_GSUWGMRR0_K1_LBSPPA1024_LBSPPB128_LPA32_MIWT4_4_PLR1_SU32_SUM0_SUS256_SKXCCM6_VWA2_VWB2_WGM1_WGMXCC1_WGMXCCGn1
    SolutionIndex: 73
    SolutionNameMin: Cijk_Ailk_Bljk_HHS_BH_UserArgs_MT128x128x32_MI16x16x1_SN_LDSB1_CLR1_GSU0_GSUC0_GSUWGMRR0_K1_LBSPPA1024_LBSPPB128_LPA32_MIWT4_4_PLR1_SU32_SUM0_SUS256_SKXCCM6_VWA2_VWB1_WGM8_WGMXCC1_WGMXCCGn1
    SolutionIndex: 74
    SolutionNameMin: Cijk_Ailk_Bljk_HHS_BH_UserArgs_MT128x128x32_MI16x16x1_SN_LDSB1_CLR1_GSU0_GSUC0_GSUWGMRR0_K1_LBSPPA1024_LBSPPB128_LPA0_MIWT4_4_PLR1_SU32_SUM0_SUS256_SKXCCM6_VWA4_VWB1_WGM8_WGMXCC1_WGMXCCGn1
    SolutionIndex: 75
    SolutionNameMin: Cijk_Ailk_Bljk_HHS_BH_UserArgs_MT128x64x32_MI16x16x1_SN_LDSB0_CLR1_GSU0_GSUC0_GSUWGMRR0_K1_LBSPPA1024_LBSPPB128_LPA0_MIWT4_2_PLR1_SU32_SUM0_SUS256_SKXCCM6_VWA4_VWB1_WGM1_WGMXCC1_WGMXCCGn1
    SolutionIndex: 76
    SolutionNameMin: Cijk_Ailk_Bljk_HHS_BH_UserArgs_MT128x64x32_MI16x16x1_SN_LDSB0_CLR0_GSU0_GSUC0_GSUWGMRR0_K1_LBSPPA1024_LBSPPB128_LPA0_MIWT4_2_PLR0_SU32_SUM0_SUS256_SKXCCM6_VWA4_VWB2_WGM1_WGMXCC1_WGMXCCGn1
    SolutionIndex: 77
    SolutionNameMin: Cijk_Ailk_Bljk_HHS_BH_UserArgs_MT32x32x32_MI16x16x1_SN_LDSB0_CLR1_GSU0_GSUC0_GSUWGMRR0_K1_LBSPPA256_LBSPPB128_LPA16_MIWT1_1_PLR1_SU32_SUM0_SUS256_SKXCCM6_VWA1_VWB1_WGM1_WGMXCC1_WGMXCCGn1
    SolutionIndex: 78
    SolutionNameMin: Cijk_Ailk_Bljk_HHS_BH_UserArgs_MT32x32x32_MI16x16x1_SN_LDSB0_CLR0_GSU0_GSUC0_GSUWGMRR0_K1_LBSPPA256_LBSPPB128_LPA16_MIWT1_1_PLR0_SU32_SUM0_SUS256_SKXCCM6_VWA1_VWB1_WGM1_WGMXCC1_WGMXCCGn1
    SolutionIndex: 79
    SolutionNameMin: Cijk_Ailk_Bljk_HHS_BH_UserArgs_MT128x256x64_MI16x16x1_SN_LDSB1_CLR1_GSU0_GSUC0_GSUWGMRR0_K1_LBSPPA2048_LBSPPB128_LPA0_MIWT4_8_PLR1_SU32_SUM0_SUS256_SKXCCM6_VWA4_VWB1_WGM1_WGMXCC1_WGMXCCGn1
    SolutionIndex: 80
    SolutionNameMin: Cijk_Ailk_Bljk_HHS_BH_UserArgs_MT128x256x64_MI16x16x1_SN_LDSB1_CLR1_GSU0_GSUC0_GSUWGMRR0_K1_LBSPPA2048_LBSPPB256_LPA0_MIWT4_8_PLR1_SU32_SUM0_SUS256_SKXCCM6_VWA4_VWB2_WGM1_WGMXCC1_WGMXCCGn1
    SolutionIndex: 81
    SolutionNameMin: Cijk_Ailk_Bljk_HHS_BH_UserArgs_MT128x256x64_MI16x16x1_SN_LDSB1_CLR1_GSU0_GSUC0_GSUWGMRR0_K1_LBSPPA2048_LBSPPB512_LPA0_MIWT4_8_PLR1_SU32_SUM0_SUS256_SKXCCM6_VWA4_VWB4_WGM1_WGMXCC1_WGMXCCGn1
    SolutionIndex: 82
    SolutionNameMin: Cijk_Ailk_Bljk_HHS_BH_UserArgs_MT128x256x64_MI16x16x1_SN_LDSB1_CLR1_GSU0_GSUC0_GSUWGMRR0_K1_LBSPPA2048_LBSPPB1024_LPA0_MIWT4_8_PLR1_SU32_SUM0_SUS256_SKXCCM6_VWA4_VWB8_WGM1_WGMXCC1_WGMXCCGn1
    SolutionIndex: 83
    SolutionNameMin: Cijk_Ailk_Bljk_HHS_BH_UserArgs_MT128x256x64_MI16x16x1_SN_LDSB1_CLR1_GSU0_GSUC0_GSUWGMRR0_K1_LBSPPA2048_LBSPPB512_LPA0_MIWT4_8_PLR1_SU32_SUM0_SUS256_SKXCCM6_VWA4_VWB4_WGM4_WGMXCC1_WGMXCCGn1
    SolutionIndex: 84
    SolutionNameMin: Cijk_Ailk_Bljk_HHS_BH_UserArgs_MT128x256x64_MI16x16x1_SN_LDSB1_CLR1_GSU0_GSUC0_GSUWGMRR0_K1_LBSPPA2048_LBSPPB1024_LPA0_MIWT4_8_PLR1_SU32_SUM0_SUS256_SKXCCM6_VWA4_VWB8_WGM8_WGMXCC1_WGMXCCGn1
    SolutionIndex: 85
    SolutionNameMin: Cijk_Ailk_Bljk_HHS_BH_UserArgs_MT256x128x64_MI16x16x1_SN_LDSB1_CLR1_GSU0_GSUC0_GSUWGMRR0_K1_LBSPPA4096_LBSPPB128_LPA0_MIWT8_4_PLR1_SU32_SUM0_SUS256_SKXCCM6_VWA4_VWB1_WGM1_WGMXCC1_WGMXCCGn1
    SolutionIndex: 86
    SolutionNameMin: Cijk_Ailk_Bljk_HHS_BH_UserArgs_MT256x128x64_MI16x16x1_SN_LDSB1_CLR1_GSU0_GSUC0_GSUWGMRR0_K1_LBSPPA4096_LBSPPB256_LPA0_MIWT8_4_PLR1_SU32_SUM0_SUS256_SKXCCM6_VWA4_VWB2_WGM1_WGMXCC1_WGMXCCGn1
    SolutionIndex: 87
    SolutionNameMin: Cijk_Ailk_Bljk_HHS_BH_UserArgs_MT256x128x64_MI16x16x1_SN_LDSB1_CLR1_GSU0_GSUC0_GSUWGMRR0_K1_LBSPPA4096_LBSPPB256_LPA0_MIWT8_4_PLR1_SU32_SUM0_SUS256_SKXCCM6_VWA8_VWB2_WGM1_WGMXCC1_WGMXCCGn1
    SolutionIndex: 88
    SolutionNameMin: Cijk_Ailk_Bljk_HHS_BH_UserArgs_MT256x128x64_MI16x16x1_SN_LDSB1_CLR1_GSU0_GSUC0_GSUWGMRR0_K1_LBSPPA4096_LBSPPB128_LPA0_MIWT8_4_PLR1_SU32_SUM0_SUS256_SKXCCM6_VWA4_VWB1_WGM8_WGMXCC1_WGMXCCGn1
    SolutionIndex: 89
    SolutionNameMin: Cijk_Ailk_Bljk_HHS_BH_UserArgs_MT128x128x64_MI16x16x1_SN_LDSB1_CLR1_GSU0_GSUC0_GSUWGMRR0_K1_LBSPPA2048_LBSPPB128_LPA32_MIWT4_4_PLR1_SU32_SUM0_SUS256_SKXCCM6_VWA2_VWB1_WGM1_WGMXCC1_WGMXCCGn1
    SolutionIndex: 90
    SolutionNameMin: Cijk_Ailk_Bljk_HHS_BH_UserArgs_MT128x128x64_MI16x16x1_SN_LDSB1_CLR1_GSU0_GSUC0_GSUWGMRR0_K1_LBSPPA2048_LBSPPB128_LPA0_MIWT4_4_PLR1_SU32_SUM0_SUS256_SKXCCM6_VWA4_VWB1_WGM1_WGMXCC1_WGMXCCGn1
    SolutionIndex: 91
    SolutionNameMin: Cijk_Ailk_Bljk_HHS_BH_UserArgs_MT128x128x64_MI16x16x1_SN_LDSB1_CLR1_GSU0_GSUC0_GSUWGMRR0_K1_LBSPPA2048_LBSPPB256_LPA0_MIWT4_4_PLR1_SU32_SUM0_SUS256_SKXCCM6_VWA4_VWB2_WGM1_WGMXCC1_WGMXCCGn1
    SolutionIndex: 92
    SolutionNameMin: Cijk_Ailk_Bljk_HHS_BH_UserArgs_MT128x128x64_MI16x16x1_SN_LDSB1_CLR1_GSU0_GSUC0_GSUWGMRR0_K1_LBSPPA2048_LBSPPB512_LPA0_MIWT4_4_PLR1_SU32_SUM0_SUS256_SKXCCM6_VWA4_VWB4_WGM1_WGMXCC1_WGMXCCGn1
    SolutionIndex: 93
    SolutionNameMin: Cijk_Ailk_Bljk_HHS_BH_UserArgs_MT128x128x64_MI16x16x1_SN_LDSB1_CLR1_GSU0_GSUC0_GSUWGMRR0_K1_LBSPPA2048_LBSPPB128_LPA0_MIWT4_4_PLR1_SU32_SUM0_SUS256_SKXCCM6_VWA4_VWB1_WGM4_WGMXCC1_WGMXCCGn1
    SolutionIndex: 94
    SolutionNameMin: Cijk_Ailk_Bljk_HHS_BH_UserArgs_MT128x128x64_MI16x16x1_SN_LDSB1_CLR1_GSU0_GSUC0_GSUWGMRR0_K1_LBSPPA2048_LBSPPB256_LPA0_MIWT4_4_PLR1_SU32_SUM0_SUS256_SKXCCM6_VWA4_VWB2_WGM4_WGMXCC1_WGMXCCGn1
    SolutionIndex: 95
    SolutionNameMin: Cijk_Ailk_Bljk_HHS_BH_UserArgs_MT128x128x64_MI16x16x1_SN_LDSB1_CLR1_GSU0_GSUC0_GSUWGMRR0_K1_LBSPPA2048_LBSPPB512_LPA0_MIWT4_4_PLR1_SU32_SUM0_SUS256_SKXCCM6_VWA4_VWB4_WGM4_WGMXCC1_WGMXCCGn1
    SolutionIndex: 96
    SolutionNameMin: Cijk_Ailk_Bljk_HHS_BH_UserArgs_MT128x128x64_MI16x16x1_SN_LDSB1_CLR1_GSU0_GSUC0_GSUWGMRR0_K1_LBSPPA2048_LBSPPB128_LPA0_MIWT4_4_PLR1_SU32_SUM0_SUS256_SKXCCM6_VWA4_VWB1_WGM8_WGMXCC1_WGMXCCGn1
    SolutionIndex: 97
    SolutionNameMin: Cijk_Ailk_Bljk_HHS_BH_UserArgs_MT128x128x64_MI16x16x1_SN_LDSB1_CLR1_GSU0_GSUC0_GSUWGMRR0_K1_LBSPPA2048_LBSPPB512_LPA0_MIWT4_4_PLR1_SU32_SUM0_SUS256_SKXCCM6_VWA4_VWB4_WGM8_WGMXCC1_WGMXCCGn1
    SolutionIndex: 98
    SolutionNameMin: Cijk_Ailk_Bljk_HHS_BH_UserArgs_MT64x128x64_MI16x16x1_SN_LDSB1_CLR1_GSU0_GSUC0_GSUWGMRR0_K1_LBSPPA1024_LBSPPB128_LPA32_MIWT2_4_PLR1_SU32_SUM0_SUS256_SKXCCM6_VWA2_VWB1_WGM1_WGMXCC1_WGMXCCGn1
    SolutionIndex: 99
    SolutionNameMin: Cijk_Ailk_Bljk_HHS_BH_UserArgs_MT64x128x64_MI16x16x1_SN_LDSB1_CLR1_GSU0_GSUC0_GSUWGMRR0_K1_LBSPPA1024_LBSPPB512_LPA32_MIWT2_4_PLR1_SU32_SUM0_SUS256_SKXCCM6_VWA2_VWB4_WGM1_WGMXCC1_WGMXCCGn1
    SolutionIndex: 100
    SolutionNameMin: Cijk_Ailk_Bljk_HHS_BH_UserArgs_MT64x128x64_MI16x16x1_SN_LDSB1_CLR1_GSU0_GSUC0_GSUWGMRR0_K1_LBSPPA1024_LBSPPB128_LPA32_MIWT2_4_PLR1_SU32_SUM0_SUS256_SKXCCM6_VWA2_VWB1_WGM4_WGMXCC1_WGMXCCGn1
    SolutionIndex: 101
    SolutionNameMin: Cijk_Ailk_Bljk_HHS_BH_UserArgs_MT128x64x64_MI16x16x1_SN_LDSB1_CLR1_GSU0_GSUC0_GSUWGMRR0_K1_LBSPPA2048_LBSPPB128_LPA32_MIWT4_2_PLR1_SU32_SUM0_SUS256_SKXCCM6_VWA2_VWB1_WGM1_WGMXCC1_WGMXCCGn1
    SolutionIndex: 102
    SolutionNameMin: Cijk_Ailk_Bljk_HHS_BH_UserArgs_MT128x64x64_MI16x16x1_SN_LDSB1_CLR1_GSU0_GSUC0_GSUWGMRR0_K1_LBSPPA2048_LBSPPB128_LPA0_MIWT4_2_PLR1_SU32_SUM0_SUS256_SKXCCM6_VWA4_VWB1_WGM1_WGMXCC1_WGMXCCGn1
    SolutionIndex: 103
    SolutionNameMin: Cijk_Ailk_Bljk_HHS_BH_UserArgs_MT128x64x64_MI16x16x1_SN_LDSB1_CLR1_GSU0_GSUC0_GSUWGMRR0_K1_LBSPPA2048_LBSPPB256_LPA0_MIWT4_2_PLR1_SU32_SUM0_SUS256_SKXCCM6_VWA4_VWB2_WGM1_WGMXCC1_WGMXCCGn1
    SolutionIndex: 104
    SolutionNameMin: Cijk_Ailk_Bljk_HHS_BH_UserArgs_MT128x64x64_MI16x16x1_SN_LDSB1_CLR1_GSU0_GSUC0_GSUWGMRR0_K1_LBSPPA2048_LBSPPB128_LPA0_MIWT4_2_PLR2_SU32_SUM0_SUS256_SKXCCM6_VWA4_VWB1_WGM1_WGMXCC1_WGMXCCGn1
    SolutionIndex: 105
    SolutionNameMin: Cijk_Ailk_Bljk_HHS_BH_UserArgs_MT128x64x64_MI16x16x1_SN_LDSB1_CLR1_GSU0_GSUC0_GSUWGMRR0_K1_LBSPPA2048_LBSPPB128_LPA32_MIWT4_2_PLR1_SU32_SUM0_SUS256_SKXCCM6_VWA2_VWB1_WGM4_WGMXCC1_WGMXCCGn1
    SolutionIndex: 106
    SolutionNameMin: Cijk_Ailk_Bljk_HHS_BH_UserArgs_MT128x64x64_MI16x16x1_SN_LDSB1_CLR1_GSU0_GSUC0_GSUWGMRR0_K1_LBSPPA2048_LBSPPB128_LPA0_MIWT4_2_PLR1_SU32_SUM0_SUS256_SKXCCM6_VWA4_VWB1_WGM4_WGMXCC1_WGMXCCGn1
    SolutionIndex: 107
    SolutionNameMin: Cijk_Ailk_Bljk_HHS_BH_UserArgs_MT128x64x64_MI16x16x1_SN_LDSB1_CLR1_GSU0_GSUC0_GSUWGMRR0_K1_LBSPPA2048_LBSPPB256_LPA0_MIWT4_2_PLR2_SU32_SUM0_SUS256_SKXCCM6_VWA4_VWB2_WGM4_WGMXCC1_WGMXCCGn1
    SolutionIndex: 108
    SolutionNameMin: Cijk_Ailk_Bljk_HHS_BH_UserArgs_MT128x64x64_MI16x16x1_SN_LDSB1_CLR1_GSU0_GSUC0_GSUWGMRR0_K1_LBSPPA2048_LBSPPB128_LPA0_MIWT4_2_PLR1_SU32_SUM0_SUS256_SKXCCM6_VWA4_VWB1_WGM8_WGMXCC1_WGMXCCGn1
    SolutionIndex: 109
    SolutionNameMin: Cijk_Ailk_Bljk_HHS_BH_UserArgs_MT128x64x64_MI16x16x1_SN_LDSB1_CLR1_GSU0_GSUC0_GSUWGMRR0_K1_LBSPPA2048_LBSPPB256_LPA0_MIWT4_2_PLR1_SU32_SUM0_SUS256_SKXCCM6_VWA4_VWB2_WGM8_WGMXCC1_WGMXCCGn1
    SolutionIndex: 110
    SolutionNameMin: Cijk_Ailk_Bljk_HHS_BH_UserArgs_MT128x64x64_MI16x16x1_SN_LDSB1_CLR1_GSU0_GSUC0_GSUWGMRR0_K1_LBSPPA2048_LBSPPB256_LPA0_MIWT4_2_PLR2_SU32_SUM0_SUS256_SKXCCM6_VWA4_VWB2_WGM8_WGMXCC1_WGMXCCGn1
    SolutionIndex: 111
    SolutionNameMin: Cijk_Ailk_Bljk_HHS_BH_UserArgs_MT64x64x64_MI16x16x1_SN_LDSB1_CLR1_GSU0_GSUC0_GSUWGMRR0_K1_LBSPPA1024_LBSPPB128_LPA32_MIWT2_2_PLR1_SU32_SUM0_SUS256_SKXCCM6_VWA2_VWB1_WGM1_WGMXCC1_WGMXCCGn1
    SolutionIndex: 112
    SolutionNameMin: Cijk_Ailk_Bljk_HHS_BH_UserArgs_MT64x64x64_MI16x16x1_SN_LDSB1_CLR1_GSU0_GSUC0_GSUWGMRR0_K1_LBSPPA1024_LBSPPB256_LPA32_MIWT2_2_PLR1_SU32_SUM0_SUS256_SKXCCM6_VWA2_VWB2_WGM1_WGMXCC1_WGMXCCGn1
    SolutionIndex: 113
    SolutionNameMin: Cijk_Ailk_Bljk_HHS_BH_UserArgs_MT64x64x64_MI16x16x1_SN_LDSB1_CLR1_GSU0_GSUC0_GSUWGMRR0_K1_LBSPPA1024_LBSPPB128_LPA32_MIWT2_2_PLR1_SU32_SUM0_SUS256_SKXCCM6_VWA2_VWB1_WGM4_WGMXCC1_WGMXCCGn1
    SolutionIndex: 114
    SolutionNameMin: Cijk_Ailk_Bljk_HHS_BH_UserArgs_MT64x64x64_MI16x16x1_SN_LDSB1_CLR1_GSU0_GSUC0_GSUWGMRR0_K1_LBSPPA1024_LBSPPB256_LPA32_MIWT2_2_PLR1_SU32_SUM0_SUS256_SKXCCM6_VWA2_VWB2_WGM4_WGMXCC1_WGMXCCGn1
    SolutionIndex: 115
    SolutionNameMin: Cijk_Ailk_Bljk_HHS_BH_UserArgs_MT64x64x64_MI16x16x1_SN_LDSB1_CLR1_GSU0_GSUC0_GSUWGMRR0_K1_LBSPPA1024_LBSPPB128_LPA32_MIWT2_2_PLR1_SU32_SUM0_SUS256_SKXCCM6_VWA2_VWB1_WGM8_WGMXCC1_WGMXCCGn1
    SolutionIndex: 116
    SolutionNameMin: Cijk_Ailk_Bljk_HHS_BH_UserArgs_MT64x64x64_MI16x16x1_SN_LDSB1_CLR1_GSU0_GSUC0_GSUWGMRR0_K1_LBSPPA1024_LBSPPB256_LPA32_MIWT2_2_PLR1_SU32_SUM0_SUS256_SKXCCM6_VWA2_VWB2_WGM8_WGMXCC1_WGMXCCGn1
    SolutionIndex: 117
    SolutionNameMin: Cijk_Ailk_Bljk_HHS_BH_UserArgs_MT64x32x64_MI16x16x1_SN_LDSB0_CLR1_GSU0_GSUC0_GSUWGMRR0_K1_LBSPPA1024_LBSPPB128_LPA32_MIWT2_1_PLR1_SU32_SUM0_SUS256_SKXCCM6_VWA2_VWB1_WGM8_WGMXCC1_WGMXCCGn1
    SolutionIndex: 118
    SolutionNameMin: Cijk_Ailk_Bljk_HHS_BH_UserArgs_MT32x32x64_MI16x16x1_SN_LDSB0_CLR1_GSU0_GSUC0_GSUWGMRR0_K1_LBSPPA512_LBSPPB128_LPA16_MIWT1_1_PLR1_SU32_SUM0_SUS256_SKXCCM6_VWA1_VWB1_WGM1_WGMXCC1_WGMXCCGn1
    SolutionIndex: 119
    SolutionNameMin: Cijk_Ailk_Bljk_HHS_BH_UserArgs_MT64x32x128_MI16x16x1_SN_LDSB1_CLR1_GSU0_GSUC0_GSUWGMRR0_K1_LBSPPA1024_LBSPPB256_LPA32_MIWT2_1_PLR1_SU32_SUM0_SUS256_SKXCCM6_VWA2_VWB1_WGM1_WGMXCC1_WGMXCCGn1
    SolutionIndex: 120
    SolutionNameMin: Cijk_Ailk_Bljk_HHS_BH_UserArgs_MT64x32x128_MI16x16x1_SN_LDSB1_CLR1_GSU0_GSUC0_GSUWGMRR0_K1_LBSPPA1024_LBSPPB256_LPA32_MIWT2_1_PLR2_SU32_SUM0_SUS256_SKXCCM6_VWA2_VWB1_WGM1_WGMXCC1_WGMXCCGn1
    SolutionIndex: 121
    SolutionNameMin: Cijk_Ailk_Bljk_HHS_BH_UserArgs_MT64x32x128_MI16x16x1_SN_LDSB1_CLR1_GSU0_GSUC0_GSUWGMRR0_K1_LBSPPA1024_LBSPPB256_LPA32_MIWT2_1_PLR2_SU32_SUM0_SUS256_SKXCCM6_VWA2_VWB1_WGM4_WGMXCC1_WGMXCCGn1
    SolutionIndex: 122
    SolutionNameMin: Cijk_Ailk_Bljk_HHS_BH_UserArgs_MT64x32x128_MI16x16x1_SN_LDSB1_CLR1_GSU0_GSUC0_GSUWGMRR0_K1_LBSPPA1024_LBSPPB256_LPA32_MIWT2_1_PLR2_SU32_SUM0_SUS256_SKXCCM6_VWA2_VWB1_WGM8_WGMXCC1_WGMXCCGn1
    SolutionIndex: 123
    SolutionNameMin: Cijk_Ailk_Bljk_HHS_BH_UserArgs_MT32x32x128_MI16x16x1_SN_LDSB1_CLR1_GSU0_GSUC0_GSUWGMRR0_K1_LBSPPA512_LBSPPB256_LPA16_MIWT1_1_PLR1_SU32_SUM0_SUS256_SKXCCM6_VWA1_VWB1_WGM1_WGMXCC1_WGMXCCGn1
    SolutionIndex: 124
    SolutionNameMin: Cijk_Ailk_Bljk_HHS_BH_UserArgs_MT32x32x128_MI16x16x1_SN_LDSB1_CLR1_GSU0_GSUC0_GSUWGMRR0_K1_LBSPPA512_LBSPPB256_LPA16_MIWT1_1_PLR2_SU32_SUM0_SUS256_SKXCCM6_VWA1_VWB1_WGM1_WGMXCC1_WGMXCCGn1
    SolutionIndex: 125
    SolutionNameMin: Cijk_Ailk_Bljk_HHS_BH_UserArgs_MT32x32x32_MI16x16x1_SN_LDSB0_CLR0_GSU0_GSUC0_GSUWGMRR0_K1_LBSPPA256_LBSPPB128_LPA16_MIWT1_1_PLR0_SU32_SUM0_SUS256_SKXCCM6_VWA1_VWB1_WGM8_WGMXCC1_WGMXCCGn1
- - - [128, 128, 1, 128, 128, 128, 128, 128]
    - [34, 0.084]
  - - [128, 128, 1, 256, 128, 128, 128, 256]
    - [34, 0.109]
  - - [128, 128, 1, 512, 128, 128, 128, 512]
    - [33, 0.186]
  - - [128, 128, 1, 1024, 128, 128, 128, 1024]
    - [123, 0.266]
  - - [128, 128, 1, 2048, 128, 128, 128, 2048]
    - [77, 0.356]
  - - [128, 128, 1, 4096, 128, 128, 128, 4096]
    - [28, 0.686]
  - - [128, 128, 1, 8192, 128, 128, 128, 8192]
    - [34, 1.286]
  - - [128, 256, 1, 128, 128, 128, 128, 128]
    - [33, 0.172]
  - - [128, 256, 1, 256, 128, 128, 128, 256]
    - [33, 0.215]
  - - [128, 256, 1, 512, 128, 128, 128, 512]
    - [34, 0.345]
  - - [128, 256, 1, 1024, 128, 128, 128, 1024]
    - [118, 0.514]
  - - [128, 256, 1, 2048, 128, 128, 128, 2048]
    - [123, 0.976]
  - - [128, 256, 1, 4096, 128, 128, 128, 4096]
    - [33, 1.681]
  - - [128, 256, 1, 8192, 128, 128, 128, 8192]
    - [34, 2.89]
  - - [128, 512, 1, 128, 128, 128, 128, 128]
    - [34, 0.336]
  - - [128, 512, 1, 256, 128, 128, 128, 256]
    - [33, 0.42]
  - - [128, 512, 1, 512, 128, 128, 128, 512]
    - [124, 0.689]
  - - [128, 512, 1, 1024, 128, 128, 128, 1024]
    - [77, 1.214]
  - - [128, 512, 1, 2048, 128, 128, 128, 2048]
    - [123, 2.189]
  - - [128, 512, 1, 4096, 128, 128, 128, 4096]
    - [123, 3.454]
  - - [128, 512, 1, 8192, 128, 128, 128, 8192]
    - [32, 4.996]
  - - [128, 1024, 1, 128, 128, 128, 128, 128]
    - [34, 0.648]
  - - [128, 1024, 1, 256, 128, 128, 128, 256]
    - [34, 0.805]
  - - [128, 1024, 1, 512, 128, 128, 128, 512]
    - [33, 1.457]
  - - [128, 1024, 1, 1024, 128, 128, 128, 1024]
    - [124, 2.447]
  - - [128, 1024, 1, 2048, 128, 128, 128, 2048]
    - [119, 3.913]
  - - [128, 1024, 1, 4096, 128, 128, 128, 4096]
    - [120, 6.075]
  - - [128, 1024, 1, 8192, 128, 128, 128, 8192]
    - [120, 7.917]
  - - [128, 2048, 1, 128, 128, 128, 128, 128]
    - [31, 1.228]
  - - [128, 2048, 1, 256, 128, 128, 128, 256]
    - [33, 1.981]
  - - [128, 2048, 1, 512, 128, 128, 128, 512]
    - [34, 3.147]
  - - [128, 2048, 1, 1024, 128, 128, 128, 1024]
    - [34, 4.463]
  - - [128, 2048, 1, 2048, 128, 128, 128, 2048]
    - [120, 6.71]
  - - [128, 2048, 1, 4096, 128, 128, 128, 4096]
    - [112, 9.313]
  - - [128, 2048, 1, 8192, 128, 128, 128, 8192]
    - [23, 10.606]
  - - [128, 4096, 1, 128, 128, 128, 128, 128]
    - [30, 2.232]
  - - [128, 4096, 1, 256, 128, 128, 128, 256]
    - [26, 3.602]
  - - [128, 4096, 1, 512, 128, 128, 128, 512]
    - [32, 5.635]
  - - [128, 4096, 1, 1024, 128, 128, 128, 1024]
    - [32, 7.737]
  - - [128, 4096, 1, 2048, 128, 128, 128, 2048]
    - [111, 10.011]
  - - [128, 4096, 1, 4096, 128, 128, 128, 4096]
    - [20, 11.629]
  - - [128, 4096, 1, 8192, 128, 128, 128, 8192]
    - [21, 13.227]
  - - [128, 8192, 1, 128, 128, 128, 128, 128]
    - [25, 3.657]
  - - [128, 8192, 1, 256, 128, 128, 128, 256]
    - [24, 6.127]
  - - [128, 8192, 1, 512, 128, 128, 128, 512]
    - [25, 9.109]
  - - [128, 8192, 1, 1024, 128, 128, 128, 1024]
    - [111, 12.065]
  - - [128, 8192, 1, 2048, 128, 128, 128, 2048]
    - [112, 12.539]
  - - [128, 8192, 1, 4096, 128, 128, 128, 4096]
    - [19, 14.326]
  - - [128, 8192, 1, 8192, 128, 128, 128, 8192]
    - [18, 16.293]
  - - [256, 128, 1, 128, 256, 256, 256, 128]
    - [34, 0.169]
  - - [256, 128, 1, 256, 256, 256, 256, 256]
    - [33, 0.216]
  - - [256, 128, 1, 512, 256, 256, 256, 512]
    - [34, 0.355]
  - - [256, 128, 1, 1024, 256, 256, 256, 1024]
    - [28, 0.522]
  - - [256, 128, 1, 2048, 256, 256, 256, 2048]
    - [33, 0.987]
  - - [256, 128, 1, 4096, 256, 256, 256, 4096]
    - [123, 1.679]
  - - [256, 128, 1, 8192, 256, 256, 256, 8192]
    - [33, 2.871]
  - - [256, 256, 1, 128, 256, 256, 256, 128]
    - [33, 0.334]
  - - [256, 256, 1, 256, 256, 256, 256, 256]
    - [34, 0.415]
  - - [256, 256, 1, 512, 256, 256, 256, 512]
    - [123, 0.684]
  - - [256, 256, 1, 1024, 256, 256, 256, 1024]
    - [77, 1.233]
  - - [256, 256, 1, 2048, 256, 256, 256, 2048]
    - [124, 2.207]
  - - [256, 256, 1, 4096, 256, 256, 256, 4096]
    - [124, 3.456]
  - - [256, 256, 1, 8192, 256, 256, 256, 8192]
    - [32, 4.99]
  - - [256, 512, 1, 128, 256, 256, 256, 128]
    - [33, 0.655]
  - - [256, 512, 1, 256, 256, 256, 256, 256]
    - [34, 0.799]
  - - [256, 512, 1, 512, 256, 256, 256, 512]
    - [33, 1.437]
  - - [256, 512, 1, 1024, 256, 256, 256, 1024]
    - [33, 2.41]
  - - [256, 512, 1, 2048, 256, 256, 256, 2048]
    - [119, 3.918]
  - - [256, 512, 1, 4096, 256, 256, 256, 4096]
    - [120, 6.014]
  - - [256, 512, 1, 8192, 256, 256, 256, 8192]
    - [120, 7.718]
  - - [256, 1024, 1, 128, 256, 256, 256, 128]
    - [32, 1.228]
  - - [256, 1024, 1, 256, 256, 256, 256, 256]
    - [34, 1.964]
  - - [256, 1024, 1, 512, 256, 256, 256, 512]
    - [33, 3.112]
  - - [256, 1024, 1, 1024, 256, 256, 256, 1024]
    - [34, 4.422]
  - - [256, 1024, 1, 2048, 256, 256, 256, 2048]
    - [120, 6.614]
  - - [256, 1024, 1, 4096, 256, 256, 256, 4096]
    - [112, 9.242]
  - - [256, 1024, 1, 8192, 256, 256, 256, 8192]
    - [76, 10.358]
  - - [256, 2048, 1, 128, 256, 256, 256, 128]
    - [30, 2.196]
  - - [256, 2048, 1, 256, 256, 256, 256, 256]
    - [26, 3.609]
  - - [256, 2048, 1, 512, 256, 256, 256, 512]
    - [32, 5.665]
  - - [256, 2048, 1, 1024, 256, 256, 256, 1024]
    - [32, 7.754]
  - - [256, 2048, 1, 2048, 256, 256, 256, 2048]
    - [112, 10.099]
  - - [256, 2048, 1, 4096, 256, 256, 256, 4096]
    - [104, 12.147]
  - - [256, 2048, 1, 8192, 256, 256, 256, 8192]
    - [76, 12.281]
  - - [256, 4096, 1, 128, 256, 256, 256, 128]
    - [24, 3.671]
  - - [256, 4096, 1, 256, 256, 256, 256, 256]
    - [24, 6.097]
  - - [256, 4096, 1, 512, 256, 256, 256, 512]
    - [25, 9.11]
  - - [256, 4096, 1, 1024, 256, 256, 256, 1024]
    - [112, 12.117]
  - - [256, 4096, 1, 2048, 256, 256, 256, 2048]
    - [112, 13.421]
  - - [256, 4096, 1, 4096, 256, 256, 256, 4096]
    - [18, 13.893]
  - - [256, 4096, 1, 8192, 256, 256, 256, 8192]
    - [92, 15.087]
  - - [256, 8192, 1, 128, 256, 256, 256, 128]
    - [19, 5.753]
  - - [256, 8192, 1, 256, 256, 256, 256, 256]
    - [19, 9.086]
  - - [256, 8192, 1, 512, 256, 256, 256, 512]
    - [98, 13.015]
  - - [256, 8192, 1, 1024, 256, 256, 256, 1024]
    - [102, 15.721]
  - - [256, 8192, 1, 2048, 256, 256, 256, 2048]
    - [105, 15.537]
  - - [256, 8192, 1, 4096, 256, 256, 256, 4096]
    - [10, 16.821]
  - - [256, 8192, 1, 8192, 256, 256, 256, 8192]
    - [55, 18.237]
  - - [512, 128, 1, 128, 512, 512, 512, 128]
    - [34, 0.331]
  - - [512, 128, 1, 256, 512, 512, 512, 256]
    - [34, 0.41]
  - - [512, 128, 1, 512, 512, 512, 512, 512]
    - [123, 0.684]
  - - [512, 128, 1, 1024, 512, 512, 512, 1024]
    - [78, 1.222]
  - - [512, 128, 1, 2048, 512, 512, 512, 2048]
    - [124, 2.187]
  - - [512, 128, 1, 4096, 512, 512, 512, 4096]
    - [34, 3.401]
  - - [512, 128, 1, 8192, 512, 512, 512, 8192]
    - [117, 4.763]
  - - [512, 256, 1, 128, 512, 512, 512, 128]
    - [33, 0.636]
  - - [512, 256, 1, 256, 512, 512, 512, 256]
    - [33, 0.801]
  - - [512, 256, 1, 512, 512, 512, 512, 512]
    - [33, 1.452]
  - - [512, 256, 1, 1024, 512, 512, 512, 1024]
    - [123, 2.444]
  - - [512, 256, 1, 2048, 512, 512, 512, 2048]
    - [119, 3.908]
  - - [512, 256, 1, 4096, 512, 512, 512, 4096]
    - [32, 5.869]
  - - [512, 256, 1, 8192, 512, 512, 512, 8192]
    - [32, 7.493]
  - - [512, 512, 1, 128, 512, 512, 512, 128]
    - [32, 1.199]
  - - [512, 512, 1, 256, 512, 512, 512, 256]
    - [33, 1.955]
  - - [512, 512, 1, 512, 512, 512, 512, 512]
    - [33, 3.088]
  - - [512, 512, 1, 1024, 512, 512, 512, 1024]
    - [34, 4.471]
  - - [512, 512, 1, 2048, 512, 512, 512, 2048]
    - [120, 6.593]
  - - [512, 512, 1, 4096, 512, 512, 512, 4096]
    - [25, 9.113]
  - - [512, 512, 1, 8192, 512, 512, 512, 8192]
    - [22, 10.302]
  - - [512, 1024, 1, 128, 512, 512, 512, 128]
    - [30, 2.227]
  - - [512, 1024, 1, 256, 512, 512, 512, 256]
    - [26, 3.598]
  - - [512, 1024, 1, 512, 512, 512, 512, 512]
    - [120, 5.585]
  - - [512, 1024, 1, 1024, 512, 512, 512, 1024]
    - [32, 7.741]
  - - [512, 1024, 1, 2048, 512, 512, 512, 2048]
    - [112, 10.158]
  - - [512, 1024, 1, 4096, 512, 512, 512, 4096]
    - [110, 11.891]
  - - [512, 1024, 1, 8192, 512, 512, 512, 8192]
    - [104, 11.925]
  - - [512, 2048, 1, 128, 512, 512, 512, 128]
    - [24, 3.662]
  - - [512, 2048, 1, 256, 512, 512, 512, 256]
    - [25, 6.007]
  - - [512, 2048, 1, 512, 512, 512, 512, 512]
    - [25, 9.046]
  - - [512, 2048, 1, 1024, 512, 512, 512, 1024]
    - [112, 12.06]
  - - [512, 2048, 1, 2048, 512, 512, 512, 2048]
    - [112, 13.681]
  - - [512, 2048, 1, 4096, 512, 512, 512, 4096]
    - [75, 12.897]
  - - [512, 2048, 1, 8192, 512, 512, 512, 8192]
    - [90, 15.198]
  - - [512, 4096, 1, 128, 512, 512, 512, 128]
    - [14, 5.668]
  - - [512, 4096, 1, 256, 512, 512, 512, 256]
    - [13, 9.01]
  - - [512, 4096, 1, 512, 512, 512, 512, 512]
    - [109, 12.993]
  - - [512, 4096, 1, 1024, 512, 512, 512, 1024]
    - [103, 16.518]
  - - [512, 4096, 1, 2048, 512, 512, 512, 2048]
    - [101, 15.974]
  - - [512, 4096, 1, 4096, 512, 512, 512, 4096]
    - [91, 15.897]
  - - [512, 4096, 1, 8192, 512, 512, 512, 8192]
    - [86, 17.389]
  - - [512, 8192, 1, 128, 512, 512, 512, 128]
    - [8, 7.833]
  - - [512, 8192, 1, 256, 512, 512, 512, 256]
    - [69, 12.079]
  - - [512, 8192, 1, 512, 512, 512, 512, 512]
    - [66, 16.021]
  - - [512, 8192, 1, 1024, 512, 512, 512, 1024]
    - [71, 16.197]
  - - [512, 8192, 1, 2048, 512, 512, 512, 2048]
    - [93, 18.534]
  - - [512, 8192, 1, 4096, 512, 512, 512, 4096]
    - [63, 18.573]
  - - [512, 8192, 1, 8192, 512, 512, 512, 8192]
    - [85, 20.6]
  - - [1024, 128, 1, 128, 1024, 1024, 1024, 128]
    - [33, 0.651]
  - - [1024, 128, 1, 256, 1024, 1024, 1024, 256]
    - [34, 0.799]
  - - [1024, 128, 1, 512, 1024, 1024, 1024, 512]
    - [33, 1.44]
  - - [1024, 128, 1, 1024, 1024, 1024, 1024, 1024]
    - [123, 2.408]
  - - [1024, 128, 1, 2048, 1024, 1024, 1024, 2048]
    - [31, 3.805]
  - - [1024, 128, 1, 4096, 1024, 1024, 1024, 4096]
    - [26, 5.563]
  - - [1024, 128, 1, 8192, 1024, 1024, 1024, 8192]
    - [115, 7.134]
  - - [1024, 256, 1, 128, 1024, 1024, 1024, 128]
    - [32, 1.204]
  - - [1024, 256, 1, 256, 1024, 1024, 1024, 256]
    - [33, 1.969]
  - - [1024, 256, 1, 512, 1024, 1024, 1024, 512]
    - [33, 3.06]
  - - [1024, 256, 1, 1024, 1024, 1024, 1024, 1024]
    - [34, 4.421]
  - - [1024, 256, 1, 2048, 1024, 1024, 1024, 2048]
    - [32, 6.41]
  - - [1024, 256, 1, 4096, 1024, 1024, 1024, 4096]
    - [114, 8.738]
  - - [1024, 256, 1, 8192, 1024, 1024, 1024, 8192]
    - [9, 10.358]
  - - [1024, 512, 1, 128, 1024, 1024, 1024, 128]
    - [29, 2.198]
  - - [1024, 512, 1, 256, 1024, 1024, 1024, 256]
    - [27, 3.515]
  - - [1024, 512, 1, 512, 1024, 1024, 1024, 512]
    - [32, 5.522]
  - - [1024, 512, 1, 1024, 1024, 1024, 1024, 1024]
    - [32, 7.744]
  - - [1024, 512, 1, 2048, 1024, 1024, 1024, 2048]
    - [24, 9.961]
  - - [1024, 512, 1, 4096, 1024, 1024, 1024, 4096]
    - [108, 11.554]
  - - [1024, 512, 1, 8192, 1024, 1024, 1024, 8192]
    - [97, 11.846]
  - - [1024, 1024, 1, 128, 1024, 1024, 1024, 128]
    - [24, 3.674]
  - - [1024, 1024, 1, 256, 1024, 1024, 1024, 256]
    - [24, 5.995]
  - - [1024, 1024, 1, 512, 1024, 1024, 1024, 512]
    - [24, 9.059]
  - - [1024, 1024, 1, 1024, 1024, 1024, 1024, 1024]
    - [24, 12.042]
  - - [1024, 1024, 1, 2048, 1024, 1024, 1024, 2048]
    - [17, 13.274]
  - - [1024, 1024, 1, 4096, 1024, 1024, 1024, 4096]
    - [103, 13.255]
  - - [1024, 1024, 1, 8192, 1024, 1024, 1024, 8192]
    - [95, 14.882]
  - - [1024, 2048, 1, 128, 1024, 1024, 1024, 128]
    - [19, 5.729]
  - - [1024, 2048, 1, 256, 1024, 1024, 1024, 256]
    - [13, 9.01]
  - - [1024, 2048, 1, 512, 1024, 1024, 1024, 512]
    - [13, 12.931]
  - - [1024, 2048, 1, 1024, 1024, 1024, 1024, 1024]
    - [106, 16.073]
  - - [1024, 2048, 1, 2048, 1024, 1024, 1024, 2048]
    - [99, 15.531]
  - - [1024, 2048, 1, 4096, 1024, 1024, 1024, 4096]
    - [91, 16.832]
  - - [1024, 2048, 1, 8192, 1024, 1024, 1024, 8192]
    - [85, 17.326]
  - - [1024, 4096, 1, 128, 1024, 1024, 1024, 128]
    - [68, 7.863]
  - - [1024, 4096, 1, 256, 1024, 1024, 1024, 256]
    - [67, 12.203]
  - - [1024, 4096, 1, 512, 1024, 1024, 1024, 512]
    - [71, 15.779]
  - - [1024, 4096, 1, 1024, 1024, 1024, 1024, 1024]
    - [72, 17.349]
  - - [1024, 4096, 1, 2048, 1024, 1024, 1024, 2048]
    - [89, 18.602]
  - - [1024, 4096, 1, 4096, 1024, 1024, 1024, 4096]
    - [86, 17.761]
  - - [1024, 4096, 1, 8192, 1024, 1024, 1024, 8192]
    - [40, 19.945]
  - - [1024, 8192, 1, 128, 1024, 1024, 1024, 128]
    - [51, 10.199]
  - - [1024, 8192, 1, 256, 1024, 1024, 1024, 256]
    - [62, 14.162]
  - - [1024, 8192, 1, 512, 1024, 1024, 1024, 512]
    - [62, 16.787]
  - - [1024, 8192, 1, 1024, 1024, 1024, 1024, 1024]
    - [49, 21.051]
  - - [1024, 8192, 1, 2048, 1024, 1024, 1024, 2048]
    - [85, 20.819]
  - - [1024, 8192, 1, 4096, 1024, 1024, 1024, 4096]
    - [3, 20.034]
  - - [1024, 8192, 1, 8192, 1024, 1024, 1024, 8192]
    - [47, 22.743]
  - - [2048, 128, 1, 128, 2048, 2048, 2048, 128]
    - [32, 1.22]
  - - [2048, 128, 1, 256, 2048, 2048, 2048, 256]
    - [33, 1.968]
  - - [2048, 128, 1, 512, 2048, 2048, 2048, 512]
    - [33, 3.081]
  - - [2048, 128, 1, 1024, 2048, 2048, 2048, 1024]
    - [121, 4.325]
  - - [2048, 128, 1, 2048, 2048, 2048, 2048, 2048]
    - [26, 6.157]
  - - [2048, 128, 1, 4096, 2048, 2048, 2048, 4096]
    - [115, 8.694]
  - - [2048, 128, 1, 8192, 2048, 2048, 2048, 8192]
    - [108, 9.791]
  - - [2048, 256, 1, 128, 2048, 2048, 2048, 128]
    - [29, 2.206]
  - - [2048, 256, 1, 256, 2048, 2048, 2048, 256]
    - [26, 3.603]
  - - [2048, 256, 1, 512, 2048, 2048, 2048, 512]
    - [32, 5.584]
  - - [2048, 256, 1, 1024, 2048, 2048, 2048, 1024]
    - [32, 7.773]
  - - [2048, 256, 1, 2048, 2048, 2048, 2048, 2048]
    - [116, 9.659]
  - - [2048, 256, 1, 4096, 2048, 2048, 2048, 4096]
    - [110, 11.843]
  - - [2048, 256, 1, 8192, 2048, 2048, 2048, 8192]
    - [99, 11.896]
  - - [2048, 512, 1, 128, 2048, 2048, 2048, 128]
    - [25, 3.611]
  - - [2048, 512, 1, 256, 2048, 2048, 2048, 256]
    - [24, 5.976]
  - - [2048, 512, 1, 512, 2048, 2048, 2048, 512]
    - [25, 9.086]
  - - [2048, 512, 1, 1024, 2048, 2048, 2048, 1024]
    - [24, 12.112]
  - - [2048, 512, 1, 2048, 2048, 2048, 2048, 2048]
    - [116, 13.266]
  - - [2048, 512, 1, 4096, 2048, 2048, 2048, 4096]
    - [99, 12.921]
  - - [2048, 512, 1, 8192, 2048, 2048, 2048, 8192]
    - [95, 14.789]
  - - [2048, 1024, 1, 128, 2048, 2048, 2048, 128]
    - [19, 5.757]
  - - [2048, 1024, 1, 256, 2048, 2048, 2048, 256]
    - [18, 8.967]
  - - [2048, 1024, 1, 512, 2048, 2048, 2048, 512]
    - [98, 12.916]
  - - [2048, 1024, 1, 1024, 2048, 2048, 2048, 1024]
    - [108, 15.797]
  - - [2048, 1024, 1, 2048, 2048, 2048, 2048, 2048]
    - [100, 15.657]
  - - [2048, 1024, 1, 4096, 2048, 2048, 2048, 4096]
    - [91, 15.701]
  - - [2048, 1024, 1, 8192, 2048, 2048, 2048, 8192]
    - [84, 17.2]
  - - [2048, 2048, 1, 128, 2048, 2048, 2048, 128]
    - [6, 7.839]
  - - [2048, 2048, 1, 256, 2048, 2048, 2048, 256]
    - [66, 12.053]
  - - [2048, 2048, 1, 512, 2048, 2048, 2048, 512]
    - [66, 15.433]
  - - [2048, 2048, 1, 1024, 2048, 2048, 2048, 1024]
    - [70, 16.067]
  - - [2048, 2048, 1, 2048, 2048, 2048, 2048, 2048]
    - [96, 18.272]
  - - [2048, 2048, 1, 4096, 2048, 2048, 2048, 4096]
    - [91, 17.734]
  - - [2048, 2048, 1, 8192, 2048, 2048, 2048, 8192]
    - [41, 19.914]
  - - [2048, 4096, 1, 128, 2048, 2048, 2048, 128]
    - [65, 9.966]
  - - [2048, 4096, 1, 256, 2048, 2048, 2048, 256]
    - [64, 13.923]
  - - [2048, 4096, 1, 512, 2048, 2048, 2048, 512]
    - [62, 17.22]
  - - [2048, 4096, 1, 1024, 2048, 2048, 2048, 1024]
    - [54, 20.006]
  - - [2048, 4096, 1, 2048, 2048, 2048, 2048, 2048]
    - [86, 20.186]
  - - [2048, 4096, 1, 4096, 2048, 2048, 2048, 4096]
    - [35, 20.514]
  - - [2048, 4096, 1, 8192, 2048, 2048, 2048, 8192]
    - [39, 22.778]
  - - [2048, 8192, 1, 128, 2048, 2048, 2048, 128]
    - [2, 9.511]
  - - [2048, 8192, 1, 256, 2048, 2048, 2048, 256]
    - [36, 13.407]
  - - [2048, 8192, 1, 512, 2048, 2048, 2048, 512]
    - [36, 18.026]
  - - [2048, 8192, 1, 1024, 2048, 2048, 2048, 1024]
    - [38, 20.95]
  - - [2048, 8192, 1, 2048, 2048, 2048, 2048, 2048]
    - [81, 19.994]
  - - [2048, 8192, 1, 4096, 2048, 2048, 2048, 4096]
    - [39, 22.258]
  - - [2048, 8192, 1, 8192, 2048, 2048, 2048, 8192]
    - [40, 24.114]
  - - [4096, 128, 1, 128, 4096, 4096, 4096, 128]
    - [29, 2.216]
  - - [4096, 128, 1, 256, 4096, 4096, 4096, 256]
    - [26, 3.609]
  - - [4096, 128, 1, 512, 4096, 4096, 4096, 512]
    - [32, 5.648]
  - - [4096, 128, 1, 1024, 4096, 4096, 4096, 1024]
    - [122, 7.619]
  - - [4096, 128, 1, 2048, 4096, 4096, 4096, 2048]
    - [108, 9.513]
  - - [4096, 128, 1, 4096, 4096, 4096, 4096, 4096]
    - [107, 11.232]
  - - [4096, 128, 1, 8192, 4096, 4096, 4096, 8192]
    - [16, 12.236]
  - - [4096, 256, 1, 128, 4096, 4096, 4096, 128]
    - [24, 3.694]
  - - [4096, 256, 1, 256, 4096, 4096, 4096, 256]
    - [24, 6.074]
  - - [4096, 256, 1, 512, 4096, 4096, 4096, 512]
    - [25, 9.178]
  - - [4096, 256, 1, 1024, 4096, 4096, 4096, 1024]
    - [114, 12.005]
  - - [4096, 256, 1, 2048, 4096, 4096, 4096, 2048]
    - [116, 13.148]
  - - [4096, 256, 1, 4096, 4096, 4096, 4096, 4096]
    - [99, 13.137]
  - - [4096, 256, 1, 8192, 4096, 4096, 4096, 8192]
    - [94, 15.327]
  - - [4096, 512, 1, 128, 4096, 4096, 4096, 128]
    - [18, 5.718]
  - - [4096, 512, 1, 256, 4096, 4096, 4096, 256]
    - [14, 9.062]
  - - [4096, 512, 1, 512, 4096, 4096, 4096, 512]
    - [12, 12.973]
  - - [4096, 512, 1, 1024, 4096, 4096, 4096, 1024]
    - [109, 15.671]
  - - [4096, 512, 1, 2048, 4096, 4096, 4096, 2048]
    - [13, 15.778]
  - - [4096, 512, 1, 4096, 4096, 4096, 4096, 4096]
    - [90, 15.918]
  - - [4096, 512, 1, 8192, 4096, 4096, 4096, 8192]
    - [82, 17.147]
  - - [4096, 1024, 1, 128, 4096, 4096, 4096, 128]
    - [7, 7.846]
  - - [4096, 1024, 1, 256, 4096, 4096, 4096, 256]
    - [69, 11.888]
  - - [4096, 1024, 1, 512, 4096, 4096, 4096, 512]
    - [69, 15.392]
  - - [4096, 1024, 1, 1024, 4096, 4096, 4096, 1024]
    - [73, 16.595]
  - - [4096, 1024, 1, 2048, 4096, 4096, 4096, 2048]
    - [97, 18.491]
  - - [4096, 1024, 1, 4096, 4096, 4096, 4096, 4096]
    - [63, 17.599]
  - - [4096, 1024, 1, 8192, 4096, 4096, 4096, 8192]
    - [41, 20.181]
  - - [4096, 2048, 1, 128, 4096, 4096, 4096, 128]
    - [64, 9.958]
  - - [4096, 2048, 1, 256, 4096, 4096, 4096, 256]
    - [64, 14.217]
  - - [4096, 2048, 1, 512, 4096, 4096, 4096, 512]
    - [62, 16.13]
  - - [4096, 2048, 1, 1024, 4096, 4096, 4096, 1024]
    - [61, 19.55]
  - - [4096, 2048, 1, 2048, 4096, 4096, 4096, 2048]
    - [88, 20.231]
  - - [4096, 2048, 1, 4096, 4096, 4096, 4096, 4096]
    - [82, 20.344]
  - - [4096, 2048, 1, 8192, 4096, 4096, 4096, 8192]
    - [35, 23.089]
  - - [4096, 4096, 1, 128, 4096, 4096, 4096, 128]
    - [1, 9.57]
  - - [4096, 4096, 1, 256, 4096, 4096, 4096, 256]
    - [0, 13.364]
  - - [4096, 4096, 1, 512, 4096, 4096, 4096, 512]
    - [42, 17.738]
  - - [4096, 4096, 1, 1024, 4096, 4096, 4096, 1024]
    - [46, 20.573]
  - - [4096, 4096, 1, 2048, 4096, 4096, 4096, 2048]
    - [80, 20.711]
  - - [4096, 4096, 1, 4096, 4096, 4096, 4096, 4096]
    - [48, 23.689]
  - - [4096, 4096, 1, 8192, 4096, 4096, 4096, 8192]
    - [45, 24.262]
  - - [4096, 8192, 1, 128, 4096, 4096, 4096, 128]
    - [52, 9.374]
  - - [4096, 8192, 1, 256, 4096, 4096, 4096, 256]
    - [4, 12.498]
  - - [4096, 8192, 1, 512, 4096, 4096, 4096, 512]
    - [50, 16.172]
  - - [4096, 8192, 1, 1024, 4096, 4096, 4096, 1024]
    - [50, 19.82]
  - - [4096, 8192, 1, 2048, 4096, 4096, 4096, 2048]
    - [37, 23.419]
  - - [4096, 8192, 1, 4096, 4096, 4096, 4096, 4096]
    - [79, 24.257]
  - - [4096, 8192, 1, 8192, 4096, 4096, 4096, 8192]
    - [37, 25.485]
  - - [8192, 128, 1, 128, 8192, 8192, 8192, 128]
    - [24, 3.674]
  - - [8192, 128, 1, 256, 8192, 8192, 8192, 256]
    - [24, 6.074]
  - - [8192, 128, 1, 512, 8192, 8192, 8192, 512]
    - [115, 8.933]
  - - [8192, 128, 1, 1024, 8192, 8192, 8192, 1024]
    - [116, 11.346]
  - - [8192, 128, 1, 2048, 8192, 8192, 8192, 2048]
    - [113, 12.748]
  - - [8192, 128, 1, 4096, 8192, 8192, 8192, 4096]
    - [15, 13.52]
  - - [8192, 128, 1, 8192, 8192, 8192, 8192, 8192]
    - [11, 15.411]
  - - [8192, 256, 1, 128, 8192, 8192, 8192, 128]
    - [75, 5.665]
  - - [8192, 256, 1, 256, 8192, 8192, 8192, 256]
    - [13, 8.914]
  - - [8192, 256, 1, 512, 8192, 8192, 8192, 512]
    - [109, 12.822]
  - - [8192, 256, 1, 1024, 8192, 8192, 8192, 1024]
    - [110, 14.823]
  - - [8192, 256, 1, 2048, 8192, 8192, 8192, 2048]
    - [100, 15.791]
  - - [8192, 256, 1, 4096, 8192, 8192, 8192, 4096]
    - [90, 16.585]
  - - [8192, 256, 1, 8192, 8192, 8192, 8192, 8192]
    - [91, 17.81]
  - - [8192, 512, 1, 128, 8192, 8192, 8192, 128]
    - [5, 7.816]
  - - [8192, 512, 1, 256, 8192, 8192, 8192, 256]
    - [69, 12.057]
  - - [8192, 512, 1, 512, 8192, 8192, 8192, 512]
    - [69, 15.233]
  - - [8192, 512, 1, 1024, 8192, 8192, 8192, 1024]
    - [74, 16.729]
  - - [8192, 512, 1, 2048, 8192, 8192, 8192, 2048]
    - [96, 18.076]
  - - [8192, 512, 1, 4096, 8192, 8192, 8192, 4096]
    - [80, 18.176]
  - - [8192, 512, 1, 8192, 8192, 8192, 8192, 8192]
    - [40, 20.601]
  - - [8192, 1024, 1, 128, 8192, 8192, 8192, 128]
    - [65, 9.866]
  - - [8192, 1024, 1, 256, 8192, 8192, 8192, 256]
    - [56, 13.748]
  - - [8192, 1024, 1, 512, 8192, 8192, 8192, 512]
    - [60, 16.454]
  - - [8192, 1024, 1, 1024, 8192, 8192, 8192, 1024]
    - [61, 20.19]
  - - [8192, 1024, 1, 2048, 8192, 8192, 8192, 2048]
    - [83, 20.253]
  - - [8192, 1024, 1, 4096, 8192, 8192, 8192, 4096]
    - [81, 20.376]
  - - [8192, 1024, 1, 8192, 8192, 8192, 8192, 8192]
    - [35, 23.132]
  - - [8192, 2048, 1, 128, 8192, 8192, 8192, 128]
    - [1, 9.479]
  - - [8192, 2048, 1, 256, 8192, 8192, 8192, 256]
    - [43, 13.063]
  - - [8192, 2048, 1, 512, 8192, 8192, 8192, 512]
    - [42, 17.539]
  - - [8192, 2048, 1, 1024, 8192, 8192, 8192, 1024]
    - [36, 20.392]
  - - [8192, 2048, 1, 2048, 8192, 8192, 8192, 2048]
    - [37, 20.269]
  - - [8192, 2048, 1, 4096, 8192, 8192, 8192, 4096]
    - [35, 23.787]
  - - [8192, 2048, 1, 8192, 8192, 8192, 8192, 8192]
    - [40, 24.292]
  - - [8192, 4096, 1, 128, 8192, 8192, 8192, 128]
    - [57, 9.147]
  - - [8192, 4096, 1, 256, 8192, 8192, 8192, 256]
    - [55, 11.943]
  - - [8192, 4096, 1, 512, 8192, 8192, 8192, 512]
    - [58, 15.914]
  - - [8192, 4096, 1, 1024, 8192, 8192, 8192, 1024]
    - [59, 19.786]
  - - [8192, 4096, 1, 2048, 8192, 8192, 8192, 2048]
    - [37, 23.485]
  - - [8192, 4096, 1, 4096, 8192, 8192, 8192, 4096]
    - [39, 25.037]
  - - [8192, 4096, 1, 8192, 8192, 8192, 8192, 8192]
    - [40, 26.646]
  - - [8192, 8192, 1, 128, 8192, 8192, 8192, 128]
    - [87, 8.491]
  - - [8192, 8192, 1, 256, 8192, 8192, 8192, 256]
    - [58, 12.722]
  - - [8192, 8192, 1, 512, 8192, 8192, 8192, 512]
    - [53, 16.409]
  - - [8192, 8192, 1, 1024, 8192, 8192, 8192, 1024]
    - [35, 21.284]
  - - [8192, 8192, 1, 2048, 8192, 8192, 8192, 2048]
    - [40, 24.775]
  - - [8192, 8192, 1, 4096, 8192, 8192, 8192, 4096]
    - [40, 27.037]
  - - [8192, 8192, 1, 8192, 8192, 8192, 8192, 8192]
    - [44, 27.144]
  - - [1, 1, 1, 32, 1, 1, 1, 32]
    - [125, 0.0]
- null
- null
- DeviceEfficiency
- GridBased
