library/src/amd_detail/rocblaslt/src/Tensile/Logic/streamk/gfx942a/aquavanjaram942_Cijk_Ailk_Bljk_BBS_BH_UserArgs.yaml
- {MinimumRequiredVersion: 4.33.0}
- aquavanjaram942
- gfx942
- [Device 0049, Device 0050]
    SolutionIndex: 0
    SolutionNameMin: Cijk_Ailk_Bljk_BBS_BH_UserArgs_MT256x256x32_MI16x16x1_SN_LDSB1_CLR1_GSU0_GSUC0_GSUWGMRR0_K1_LBSPPA2048_LBSPPB512_LPA0_MIWT8_8_PLR1_SU32_SUM0_SUS256_SKXCCM0_VWA8_VWB8_WGM1_WGMXCC1_WGMXCCGn1
    SolutionIndex: 1
    SolutionNameMin: Cijk_Ailk_Bljk_BBS_BH_UserArgs_MT256x256x32_MI16x16x1_SN_LDSB1_CLR1_GSU0_GSUC0_GSUWGMRR0_K1_LBSPPA2048_LBSPPB128_LPA0_MIWT8_8_PLR1_SU32_SUM0_SUS256_SKXCCM0_VWA4_VWB2_WGM4_WGMXCC1_WGMXCCGn1
    SolutionIndex: 2
    SolutionNameMin: Cijk_Ailk_Bljk_BBS_BH_UserArgs_MT256x256x32_MI16x16x1_SN_LDSB1_CLR1_GSU0_GSUC0_GSUWGMRR0_K1_LBSPPA2048_LBSPPB256_LPA0_MIWT8_8_PLR1_SU32_SUM0_SUS256_SKXCCM0_VWA4_VWB4_WGM4_WGMXCC1_WGMXCCGn1
    SolutionIndex: 3
    SolutionNameMin: Cijk_Ailk_Bljk_BBS_BH_UserArgs_MT256x256x32_MI16x16x1_SN_LDSB1_CLR1_GSU0_GSUC0_GSUWGMRR0_K1_LBSPPA2048_LBSPPB512_LPA0_MIWT8_8_PLR1_SU32_SUM0_SUS256_SKXCCM0_VWA4_VWB8_WGM4_WGMXCC1_WGMXCCGn1
    SolutionIndex: 4
    SolutionNameMin: Cijk_Ailk_Bljk_BBS_BH_UserArgs_MT256x128x32_MI16x16x1_SN_LDSB1_CLR1_GSU0_GSUC0_GSUWGMRR0_K1_LBSPPA2048_LBSPPB128_LPA0_MIWT8_4_PLR1_SU32_SUM0_SUS256_SKXCCM0_VWA4_VWB1_WGM4_WGMXCC1_WGMXCCGn1
    SolutionIndex: 5
    SolutionNameMin: Cijk_Ailk_Bljk_BBS_BH_UserArgs_MT256x128x32_MI16x16x1_SN_LDSB1_CLR1_GSU0_GSUC0_GSUWGMRR0_K1_LBSPPA2048_LBSPPB128_LPA0_MIWT8_4_PLR1_SU32_SUM0_SUS256_SKXCCM0_VWA4_VWB1_WGM8_WGMXCC1_WGMXCCGn1
    SolutionIndex: 6
    SolutionNameMin: Cijk_Ailk_Bljk_BBS_BH_UserArgs_MT256x64x32_MI16x16x1_SN_LDSB1_CLR1_GSU0_GSUC0_GSUWGMRR0_K1_LBSPPA2048_LBSPPB128_LPA0_MIWT8_2_PLR1_SU32_SUM0_SUS256_SKXCCM0_VWA4_VWB1_WGM1_WGMXCC1_WGMXCCGn1
    SolutionIndex: 7
    SolutionNameMin: Cijk_Ailk_Bljk_BBS_BH_UserArgs_MT256x64x32_MI16x16x1_SN_LDSB1_CLR1_GSU0_GSUC0_GSUWGMRR0_K1_LBSPPA2048_LBSPPB128_LPA0_MIWT8_2_PLR1_SU32_SUM0_SUS256_SKXCCM0_VWA8_VWB1_WGM1_WGMXCC1_WGMXCCGn1
    SolutionIndex: 8
    SolutionNameMin: Cijk_Ailk_Bljk_BBS_BH_UserArgs_MT256x64x32_MI16x16x1_SN_LDSB1_CLR1_GSU0_GSUC0_GSUWGMRR0_K1_LBSPPA2048_LBSPPB128_LPA0_MIWT8_2_PLR1_SU32_SUM0_SUS256_SKXCCM0_VWA8_VWB2_WGM1_WGMXCC1_WGMXCCGn1
    SolutionIndex: 9
    SolutionNameMin: Cijk_Ailk_Bljk_BBS_BH_UserArgs_MT128x64x32_MI16x16x1_SN_LDSB0_CLR1_GSU0_GSUC0_GSUWGMRR0_K1_LBSPPA1024_LBSPPB128_LPA0_MIWT4_2_PLR1_SU32_SUM0_SUS256_SKXCCM0_VWA4_VWB1_WGM1_WGMXCC1_WGMXCCGn1
    SolutionIndex: 10
    SolutionNameMin: Cijk_Ailk_Bljk_BBS_BH_UserArgs_MT32x32x32_MI16x16x1_SN_LDSB0_CLR1_GSU0_GSUC0_GSUWGMRR0_K1_LBSPPA256_LBSPPB128_LPA16_MIWT1_1_PLR1_SU32_SUM0_SUS256_SKXCCM0_VWA1_VWB1_WGM1_WGMXCC1_WGMXCCGn1
    SolutionIndex: 11
    SolutionNameMin: Cijk_Ailk_Bljk_BBS_BH_UserArgs_MT128x256x64_MI16x16x1_SN_LDSB1_CLR1_GSU0_GSUC0_GSUWGMRR0_K1_LBSPPA2048_LBSPPB1024_LPA0_MIWT4_8_PLR1_SU32_SUM0_SUS256_SKXCCM0_VWA4_VWB8_WGM8_WGMXCC1_WGMXCCGn1
    SolutionIndex: 12
    SolutionNameMin: Cijk_Ailk_Bljk_BBS_BH_UserArgs_MT256x64x64_MI16x16x1_SN_LDSB1_CLR1_GSU0_GSUC0_GSUWGMRR0_K1_LBSPPA4096_LBSPPB256_LPA0_MIWT8_2_PLR1_SU32_SUM0_SUS256_SKXCCM0_VWA4_VWB2_WGM8_WGMXCC1_WGMXCCGn1
    SolutionIndex: 13
    SolutionNameMin: Cijk_Ailk_Bljk_BBS_BH_UserArgs_MT64x128x64_MI16x16x1_SN_LDSB1_CLR1_GSU0_GSUC0_GSUWGMRR0_K1_LBSPPA1024_LBSPPB128_LPA32_MIWT2_4_PLR1_SU32_SUM0_SUS256_SKXCCM0_VWA2_VWB1_WGM1_WGMXCC1_WGMXCCGn1
    SolutionIndex: 14
    SolutionNameMin: Cijk_Ailk_Bljk_BBS_BH_UserArgs_MT64x128x64_MI16x16x1_SN_LDSB1_CLR1_GSU0_GSUC0_GSUWGMRR0_K1_LBSPPA1024_LBSPPB256_LPA32_MIWT2_4_PLR1_SU32_SUM0_SUS256_SKXCCM0_VWA2_VWB2_WGM1_WGMXCC1_WGMXCCGn1
    SolutionIndex: 15
    SolutionNameMin: Cijk_Ailk_Bljk_BBS_BH_UserArgs_MT64x128x64_MI16x16x1_SN_LDSB1_CLR1_GSU0_GSUC0_GSUWGMRR0_K1_LBSPPA1024_LBSPPB512_LPA32_MIWT2_4_PLR1_SU32_SUM0_SUS256_SKXCCM0_VWA2_VWB4_WGM1_WGMXCC1_WGMXCCGn1
    SolutionIndex: 16
    SolutionNameMin: Cijk_Ailk_Bljk_BBS_BH_UserArgs_MT64x128x64_MI16x16x1_SN_LDSB1_CLR1_GSU0_GSUC0_GSUWGMRR0_K1_LBSPPA1024_LBSPPB256_LPA32_MIWT2_4_PLR2_SU32_SUM0_SUS256_SKXCCM0_VWA2_VWB2_WGM4_WGMXCC1_WGMXCCGn1
    SolutionIndex: 17
    SolutionNameMin: Cijk_Ailk_Bljk_BBS_BH_UserArgs_MT128x64x64_MI16x16x1_SN_LDSB1_CLR1_GSU0_GSUC0_GSUWGMRR0_K1_LBSPPA2048_LBSPPB128_LPA0_MIWT4_2_PLR1_SU32_SUM0_SUS256_SKXCCM0_VWA4_VWB1_WGM1_WGMXCC1_WGMXCCGn1
    SolutionIndex: 18
    SolutionNameMin: Cijk_Ailk_Bljk_BBS_BH_UserArgs_MT128x64x64_MI16x16x1_SN_LDSB1_CLR1_GSU0_GSUC0_GSUWGMRR0_K1_LBSPPA2048_LBSPPB128_LPA0_MIWT4_2_PLR2_SU32_SUM0_SUS256_SKXCCM0_VWA4_VWB1_WGM1_WGMXCC1_WGMXCCGn1
    SolutionIndex: 19
    SolutionNameMin: Cijk_Ailk_Bljk_BBS_BH_UserArgs_MT128x64x64_MI16x16x1_SN_LDSB1_CLR1_GSU0_GSUC0_GSUWGMRR0_K1_LBSPPA2048_LBSPPB128_LPA0_MIWT4_2_PLR1_SU32_SUM0_SUS256_SKXCCM0_VWA4_VWB1_WGM4_WGMXCC1_WGMXCCGn1
    SolutionIndex: 20
    SolutionNameMin: Cijk_Ailk_Bljk_BBS_BH_UserArgs_MT64x64x64_MI16x16x1_SN_LDSB1_CLR1_GSU0_GSUC0_GSUWGMRR0_K1_LBSPPA1024_LBSPPB128_LPA32_MIWT2_2_PLR1_SU32_SUM0_SUS256_SKXCCM0_VWA2_VWB1_WGM1_WGMXCC1_WGMXCCGn1
    SolutionIndex: 21
    SolutionNameMin: Cijk_Ailk_Bljk_BBS_BH_UserArgs_MT64x64x64_MI16x16x1_SN_LDSB1_CLR1_GSU0_GSUC0_GSUWGMRR0_K1_LBSPPA1024_LBSPPB256_LPA32_MIWT2_2_PLR1_SU32_SUM0_SUS256_SKXCCM0_VWA2_VWB2_WGM1_WGMXCC1_WGMXCCGn1
    SolutionIndex: 22
    SolutionNameMin: Cijk_Ailk_Bljk_BBS_BH_UserArgs_MT64x32x64_MI16x16x1_SN_LDSB0_CLR1_GSU0_GSUC0_GSUWGMRR0_K1_LBSPPA1024_LBSPPB128_LPA32_MIWT2_1_PLR1_SU32_SUM0_SUS256_SKXCCM0_VWA2_VWB1_WGM1_WGMXCC1_WGMXCCGn1
    SolutionIndex: 23
    SolutionNameMin: Cijk_Ailk_Bljk_BBS_BH_UserArgs_MT32x32x64_MI16x16x1_SN_LDSB0_CLR1_GSU0_GSUC0_GSUWGMRR0_K1_LBSPPA512_LBSPPB128_LPA16_MIWT1_1_PLR1_SU32_SUM0_SUS256_SKXCCM0_VWA1_VWB1_WGM1_WGMXCC1_WGMXCCGn1
    SolutionIndex: 24
    SolutionNameMin: Cijk_Ailk_Bljk_BBS_BH_UserArgs_MT64x64x128_MI16x16x1_SN_LDSB1_CLR1_GSU0_GSUC0_GSUWGMRR0_K1_LBSPPA1024_LBSPPB256_LPA32_MIWT2_2_PLR2_SU32_SUM0_SUS256_SKXCCM0_VWA2_VWB1_WGM1_WGMXCC1_WGMXCCGn1
    SolutionIndex: 25
    SolutionNameMin: Cijk_Ailk_Bljk_BBS_BH_UserArgs_MT64x64x128_MI16x16x1_SN_LDSB1_CLR1_GSU0_GSUC0_GSUWGMRR0_K1_LBSPPA1024_LBSPPB512_LPA32_MIWT2_2_PLR2_SU32_SUM0_SUS256_SKXCCM0_VWA2_VWB2_WGM1_WGMXCC1_WGMXCCGn1
    SolutionIndex: 26
    SolutionNameMin: Cijk_Ailk_Bljk_BBS_BH_UserArgs_MT64x32x128_MI16x16x1_SN_LDSB1_CLR1_GSU0_GSUC0_GSUWGMRR0_K1_LBSPPA1024_LBSPPB256_LPA32_MIWT2_1_PLR1_SU32_SUM0_SUS256_SKXCCM0_VWA2_VWB1_WGM1_WGMXCC1_WGMXCCGn1
    SolutionIndex: 27
    SolutionNameMin: Cijk_Ailk_Bljk_BBS_BH_UserArgs_MT64x32x128_MI16x16x1_SN_LDSB1_CLR1_GSU0_GSUC0_GSUWGMRR0_K1_LBSPPA1024_LBSPPB256_LPA32_MIWT2_1_PLR2_SU32_SUM0_SUS256_SKXCCM0_VWA2_VWB1_WGM1_WGMXCC1_WGMXCCGn1
    SolutionIndex: 28
    SolutionNameMin: Cijk_Ailk_Bljk_BBS_BH_UserArgs_MT32x32x128_MI16x16x1_SN_LDSB1_CLR1_GSU0_GSUC0_GSUWGMRR0_K1_LBSPPA512_LBSPPB256_LPA16_MIWT1_1_PLR1_SU32_SUM0_SUS256_SKXCCM0_VWA1_VWB1_WGM1_WGMXCC1_WGMXCCGn1
    SolutionIndex: 29
    SolutionNameMin: Cijk_Ailk_Bljk_BBS_BH_UserArgs_MT32x32x128_MI16x16x1_SN_LDSB1_CLR1_GSU0_GSUC0_GSUWGMRR0_K1_LBSPPA512_LBSPPB256_LPA16_MIWT1_1_PLR2_SU32_SUM0_SUS256_SKXCCM0_VWA1_VWB1_WGM1_WGMXCC1_WGMXCCGn1
    SolutionIndex: 30
    SolutionNameMin: Cijk_Ailk_Bljk_BBS_BH_UserArgs_MT256x256x32_MI16x16x1_SN_LDSB1_CLR1_GSU0_GSUC0_GSUWGMRR0_K1_LBSPPA2048_LBSPPB128_LPA0_MIWT8_8_PLR1_SU32_SUM0_SUS256_SKXCCM6_VWA4_VWB1_WGM1_WGMXCC1_WGMXCCGn1
    SolutionIndex: 31
    SolutionNameMin: Cijk_Ailk_Bljk_BBS_BH_UserArgs_MT256x256x32_MI16x16x1_SN_LDSB1_CLR1_GSU0_GSUC0_GSUWGMRR0_K1_LBSPPA2048_LBSPPB128_LPA0_MIWT8_8_PLR1_SU32_SUM0_SUS256_SKXCCM6_VWA8_VWB1_WGM1_WGMXCC1_WGMXCCGn1
    SolutionIndex: 32
    SolutionNameMin: Cijk_Ailk_Bljk_BBS_BH_UserArgs_MT256x256x32_MI16x16x1_SN_LDSB1_CLR1_GSU0_GSUC0_GSUWGMRR0_K1_LBSPPA2048_LBSPPB128_LPA0_MIWT8_8_PLR1_SU32_SUM0_SUS256_SKXCCM6_VWA4_VWB2_WGM1_WGMXCC1_WGMXCCGn1
    SolutionIndex: 33
    SolutionNameMin: Cijk_Ailk_Bljk_BBS_BH_UserArgs_MT256x256x32_MI16x16x1_SN_LDSB1_CLR1_GSU0_GSUC0_GSUWGMRR0_K1_LBSPPA2048_LBSPPB128_LPA0_MIWT8_8_PLR1_SU32_SUM0_SUS256_SKXCCM6_VWA8_VWB2_WGM1_WGMXCC1_WGMXCCGn1
    SolutionIndex: 34
    SolutionNameMin: Cijk_Ailk_Bljk_BBS_BH_UserArgs_MT256x256x32_MI16x16x1_SN_LDSB1_CLR1_GSU0_GSUC0_GSUWGMRR0_K1_LBSPPA2048_LBSPPB256_LPA0_MIWT8_8_PLR1_SU32_SUM0_SUS256_SKXCCM6_VWA4_VWB4_WGM1_WGMXCC1_WGMXCCGn1
    SolutionIndex: 35
    SolutionNameMin: Cijk_Ailk_Bljk_BBS_BH_UserArgs_MT256x256x32_MI16x16x1_SN_LDSB1_CLR1_GSU0_GSUC0_GSUWGMRR0_K1_LBSPPA2048_LBSPPB512_LPA0_MIWT8_8_PLR1_SU32_SUM0_SUS256_SKXCCM6_VWA4_VWB8_WGM1_WGMXCC1_WGMXCCGn1
    SolutionIndex: 36
    SolutionNameMin: Cijk_Ailk_Bljk_BBS_BH_UserArgs_MT256x256x32_MI16x16x1_SN_LDSB1_CLR1_GSU0_GSUC0_GSUWGMRR0_K1_LBSPPA2048_LBSPPB512_LPA0_MIWT8_8_PLR1_SU32_SUM0_SUS256_SKXCCM6_VWA8_VWB8_WGM1_WGMXCC1_WGMXCCGn1
    SolutionIndex: 37
    SolutionNameMin: Cijk_Ailk_Bljk_BBS_BH_UserArgs_MT256x256x32_MI16x16x1_SN_LDSB1_CLR1_GSU0_GSUC0_GSUWGMRR0_K1_LBSPPA2048_LBSPPB128_LPA0_MIWT8_8_PLR1_SU32_SUM0_SUS256_SKXCCM6_VWA4_VWB1_WGM4_WGMXCC1_WGMXCCGn1
    SolutionIndex: 38
    SolutionNameMin: Cijk_Ailk_Bljk_BBS_BH_UserArgs_MT256x256x32_MI16x16x1_SN_LDSB1_CLR1_GSU0_GSUC0_GSUWGMRR0_K1_LBSPPA2048_LBSPPB128_LPA0_MIWT8_8_PLR1_SU32_SUM0_SUS256_SKXCCM6_VWA8_VWB1_WGM4_WGMXCC1_WGMXCCGn1
    SolutionIndex: 39
    SolutionNameMin: Cijk_Ailk_Bljk_BBS_BH_UserArgs_MT256x256x32_MI16x16x1_SN_LDSB1_CLR1_GSU0_GSUC0_GSUWGMRR0_K1_LBSPPA2048_LBSPPB128_LPA0_MIWT8_8_PLR1_SU32_SUM0_SUS256_SKXCCM6_VWA8_VWB2_WGM4_WGMXCC1_WGMXCCGn1
    SolutionIndex: 40
    SolutionNameMin: Cijk_Ailk_Bljk_BBS_BH_UserArgs_MT256x256x32_MI16x16x1_SN_LDSB1_CLR1_GSU0_GSUC0_GSUWGMRR0_K1_LBSPPA2048_LBSPPB256_LPA0_MIWT8_8_PLR1_SU32_SUM0_SUS256_SKXCCM6_VWA4_VWB4_WGM4_WGMXCC1_WGMXCCGn1
    SolutionIndex: 41
    SolutionNameMin: Cijk_Ailk_Bljk_BBS_BH_UserArgs_MT256x256x32_MI16x16x1_SN_LDSB1_CLR1_GSU0_GSUC0_GSUWGMRR0_K1_LBSPPA2048_LBSPPB128_LPA0_MIWT8_8_PLR1_SU32_SUM0_SUS256_SKXCCM6_VWA4_VWB1_WGM8_WGMXCC1_WGMXCCGn1
    SolutionIndex: 42
    SolutionNameMin: Cijk_Ailk_Bljk_BBS_BH_UserArgs_MT256x256x32_MI16x16x1_SN_LDSB1_CLR1_GSU0_GSUC0_GSUWGMRR0_K1_LBSPPA2048_LBSPPB256_LPA0_MIWT8_8_PLR1_SU32_SUM0_SUS256_SKXCCM6_VWA4_VWB4_WGM8_WGMXCC1_WGMXCCGn1
    SolutionIndex: 43
    SolutionNameMin: Cijk_Ailk_Bljk_BBS_BH_UserArgs_MT256x256x32_MI16x16x1_SN_LDSB1_CLR1_GSU0_GSUC0_GSUWGMRR0_K1_LBSPPA2048_LBSPPB512_LPA0_MIWT8_8_PLR1_SU32_SUM0_SUS256_SKXCCM6_VWA4_VWB8_WGM8_WGMXCC1_WGMXCCGn1
    SolutionIndex: 44
    SolutionNameMin: Cijk_Ailk_Bljk_BBS_BH_UserArgs_MT256x128x32_MI16x16x1_SN_LDSB1_CLR1_GSU0_GSUC0_GSUWGMRR0_K1_LBSPPA2048_LBSPPB128_LPA0_MIWT8_4_PLR1_SU32_SUM0_SUS256_SKXCCM6_VWA4_VWB1_WGM1_WGMXCC1_WGMXCCGn1
    SolutionIndex: 45
    SolutionNameMin: Cijk_Ailk_Bljk_BBS_BH_UserArgs_MT256x128x32_MI16x16x1_SN_LDSB1_CLR1_GSU0_GSUC0_GSUWGMRR0_K1_LBSPPA2048_LBSPPB128_LPA0_MIWT8_4_PLR1_SU32_SUM0_SUS256_SKXCCM6_VWA8_VWB1_WGM1_WGMXCC1_WGMXCCGn1
    SolutionIndex: 46
    SolutionNameMin: Cijk_Ailk_Bljk_BBS_BH_UserArgs_MT256x128x32_MI16x16x1_SN_LDSB1_CLR1_GSU0_GSUC0_GSUWGMRR0_K1_LBSPPA2048_LBSPPB128_LPA0_MIWT8_4_PLR1_SU32_SUM0_SUS256_SKXCCM6_VWA4_VWB2_WGM1_WGMXCC1_WGMXCCGn1
    SolutionIndex: 47
    SolutionNameMin: Cijk_Ailk_Bljk_BBS_BH_UserArgs_MT256x128x32_MI16x16x1_SN_LDSB1_CLR1_GSU0_GSUC0_GSUWGMRR0_K1_LBSPPA2048_LBSPPB128_LPA0_MIWT8_4_PLR1_SU32_SUM0_SUS256_SKXCCM6_VWA8_VWB2_WGM1_WGMXCC1_WGMXCCGn1
    SolutionIndex: 48
    SolutionNameMin: Cijk_Ailk_Bljk_BBS_BH_UserArgs_MT256x128x32_MI16x16x1_SN_LDSB1_CLR1_GSU0_GSUC0_GSUWGMRR0_K1_LBSPPA2048_LBSPPB256_LPA0_MIWT8_4_PLR1_SU32_SUM0_SUS256_SKXCCM6_VWA4_VWB4_WGM1_WGMXCC1_WGMXCCGn1
    SolutionIndex: 49
    SolutionNameMin: Cijk_Ailk_Bljk_BBS_BH_UserArgs_MT256x128x32_MI16x16x1_SN_LDSB1_CLR1_GSU0_GSUC0_GSUWGMRR0_K1_LBSPPA2048_LBSPPB128_LPA0_MIWT8_4_PLR1_SU32_SUM0_SUS256_SKXCCM6_VWA4_VWB1_WGM4_WGMXCC1_WGMXCCGn1
    SolutionIndex: 50
    SolutionNameMin: Cijk_Ailk_Bljk_BBS_BH_UserArgs_MT256x128x32_MI16x16x1_SN_LDSB1_CLR1_GSU0_GSUC0_GSUWGMRR0_K1_LBSPPA2048_LBSPPB128_LPA0_MIWT8_4_PLR1_SU32_SUM0_SUS256_SKXCCM6_VWA8_VWB1_WGM4_WGMXCC1_WGMXCCGn1
    SolutionIndex: 51
    SolutionNameMin: Cijk_Ailk_Bljk_BBS_BH_UserArgs_MT256x128x32_MI16x16x1_SN_LDSB1_CLR1_GSU0_GSUC0_GSUWGMRR0_K1_LBSPPA2048_LBSPPB128_LPA0_MIWT8_4_PLR1_SU32_SUM0_SUS256_SKXCCM6_VWA4_VWB2_WGM4_WGMXCC1_WGMXCCGn1
    SolutionIndex: 52
    SolutionNameMin: Cijk_Ailk_Bljk_BBS_BH_UserArgs_MT256x128x32_MI16x16x1_SN_LDSB1_CLR1_GSU0_GSUC0_GSUWGMRR0_K1_LBSPPA2048_LBSPPB128_LPA32_MIWT8_4_PLR1_SU32_SUM0_SUS256_SKXCCM6_VWA2_VWB1_WGM8_WGMXCC1_WGMXCCGn1
    SolutionIndex: 53
    SolutionNameMin: Cijk_Ailk_Bljk_BBS_BH_UserArgs_MT256x128x32_MI16x16x1_SN_LDSB1_CLR1_GSU0_GSUC0_GSUWGMRR0_K1_LBSPPA2048_LBSPPB128_LPA0_MIWT8_4_PLR1_SU32_SUM0_SUS256_SKXCCM6_VWA4_VWB1_WGM8_WGMXCC1_WGMXCCGn1
    SolutionIndex: 54
    SolutionNameMin: Cijk_Ailk_Bljk_BBS_BH_UserArgs_MT256x128x32_MI16x16x1_SN_LDSB1_CLR1_GSU0_GSUC0_GSUWGMRR0_K1_LBSPPA2048_LBSPPB128_LPA0_MIWT8_4_PLR1_SU32_SUM0_SUS256_SKXCCM6_VWA8_VWB1_WGM8_WGMXCC1_WGMXCCGn1
    SolutionIndex: 55
    SolutionNameMin: Cijk_Ailk_Bljk_BBS_BH_UserArgs_MT256x128x32_MI16x16x1_SN_LDSB1_CLR1_GSU0_GSUC0_GSUWGMRR0_K1_LBSPPA2048_LBSPPB128_LPA0_MIWT8_4_PLR1_SU32_SUM0_SUS256_SKXCCM6_VWA4_VWB2_WGM8_WGMXCC1_WGMXCCGn1
    SolutionIndex: 56
    SolutionNameMin: Cijk_Ailk_Bljk_BBS_BH_UserArgs_MT256x128x32_MI16x16x1_SN_LDSB1_CLR1_GSU0_GSUC0_GSUWGMRR0_K1_LBSPPA2048_LBSPPB128_LPA0_MIWT8_4_PLR1_SU32_SUM0_SUS256_SKXCCM6_VWA8_VWB2_WGM8_WGMXCC1_WGMXCCGn1
    SolutionIndex: 57
    SolutionNameMin: Cijk_Ailk_Bljk_BBS_BH_UserArgs_MT256x128x32_MI16x16x1_SN_LDSB1_CLR1_GSU0_GSUC0_GSUWGMRR0_K1_LBSPPA2048_LBSPPB256_LPA0_MIWT8_4_PLR1_SU32_SUM0_SUS256_SKXCCM6_VWA4_VWB4_WGM8_WGMXCC1_WGMXCCGn1
    SolutionIndex: 58
    SolutionNameMin: Cijk_Ailk_Bljk_BBS_BH_UserArgs_MT256x128x32_MI16x16x1_SN_LDSB1_CLR1_GSU0_GSUC0_GSUWGMRR0_K1_LBSPPA2048_LBSPPB256_LPA0_MIWT8_4_PLR1_SU32_SUM0_SUS256_SKXCCM6_VWA8_VWB4_WGM8_WGMXCC1_WGMXCCGn1
    SolutionIndex: 59
    SolutionNameMin: Cijk_Ailk_Bljk_BBS_BH_UserArgs_MT256x64x32_MI16x16x1_SN_LDSB1_CLR1_GSU0_GSUC0_GSUWGMRR0_K1_LBSPPA2048_LBSPPB128_LPA0_MIWT8_2_PLR1_SU32_SUM0_SUS256_SKXCCM6_VWA8_VWB1_WGM1_WGMXCC1_WGMXCCGn1
    SolutionIndex: 60
    SolutionNameMin: Cijk_Ailk_Bljk_BBS_BH_UserArgs_MT256x64x32_MI16x16x1_SN_LDSB1_CLR1_GSU0_GSUC0_GSUWGMRR0_K1_LBSPPA2048_LBSPPB128_LPA0_MIWT8_2_PLR1_SU32_SUM0_SUS256_SKXCCM6_VWA4_VWB2_WGM1_WGMXCC1_WGMXCCGn1
    SolutionIndex: 61
    SolutionNameMin: Cijk_Ailk_Bljk_BBS_BH_UserArgs_MT256x64x32_MI16x16x1_SN_LDSB1_CLR1_GSU0_GSUC0_GSUWGMRR0_K1_LBSPPA2048_LBSPPB128_LPA0_MIWT8_2_PLR1_SU32_SUM0_SUS256_SKXCCM6_VWA8_VWB2_WGM1_WGMXCC1_WGMXCCGn1
    SolutionIndex: 62
    SolutionNameMin: Cijk_Ailk_Bljk_BBS_BH_UserArgs_MT256x64x32_MI16x16x1_SN_LDSB1_CLR1_GSU0_GSUC0_GSUWGMRR0_K1_LBSPPA2048_LBSPPB128_LPA0_MIWT8_2_PLR1_SU32_SUM0_SUS256_SKXCCM6_VWA4_VWB1_WGM4_WGMXCC1_WGMXCCGn1
    SolutionIndex: 63
    SolutionNameMin: Cijk_Ailk_Bljk_BBS_BH_UserArgs_MT256x64x32_MI16x16x1_SN_LDSB1_CLR1_GSU0_GSUC0_GSUWGMRR0_K1_LBSPPA2048_LBSPPB128_LPA0_MIWT8_2_PLR1_SU32_SUM0_SUS256_SKXCCM6_VWA8_VWB1_WGM4_WGMXCC1_WGMXCCGn1
    SolutionIndex: 64
    SolutionNameMin: Cijk_Ailk_Bljk_BBS_BH_UserArgs_MT256x64x32_MI16x16x1_SN_LDSB1_CLR1_GSU0_GSUC0_GSUWGMRR0_K1_LBSPPA2048_LBSPPB128_LPA0_MIWT8_2_PLR1_SU32_SUM0_SUS256_SKXCCM6_VWA8_VWB1_WGM8_WGMXCC1_WGMXCCGn1
    SolutionIndex: 65
    SolutionNameMin: Cijk_Ailk_Bljk_BBS_BH_UserArgs_MT256x64x32_MI16x16x1_SN_LDSB1_CLR1_GSU0_GSUC0_GSUWGMRR0_K1_LBSPPA2048_LBSPPB128_LPA0_MIWT8_2_PLR1_SU32_SUM0_SUS256_SKXCCM6_VWA8_VWB2_WGM8_WGMXCC1_WGMXCCGn1
    SolutionIndex: 66
    SolutionNameMin: Cijk_Ailk_Bljk_BBS_BH_UserArgs_MT128x128x32_MI16x16x1_SN_LDSB1_CLR1_GSU0_GSUC0_GSUWGMRR0_K1_LBSPPA1024_LBSPPB128_LPA0_MIWT4_4_PLR1_SU32_SUM0_SUS256_SKXCCM6_VWA4_VWB1_WGM1_WGMXCC1_WGMXCCGn1
    SolutionIndex: 67
    SolutionNameMin: Cijk_Ailk_Bljk_BBS_BH_UserArgs_MT128x128x32_MI16x16x1_SN_LDSB1_CLR1_GSU0_GSUC0_GSUWGMRR0_K1_LBSPPA1024_LBSPPB128_LPA32_MIWT4_4_PLR1_SU32_SUM0_SUS256_SKXCCM6_VWA2_VWB2_WGM1_WGMXCC1_WGMXCCGn1
    SolutionIndex: 68
    SolutionNameMin: Cijk_Ailk_Bljk_BBS_BH_UserArgs_MT128x128x32_MI16x16x1_SN_LDSB1_CLR1_GSU0_GSUC0_GSUWGMRR0_K1_LBSPPA1024_LBSPPB128_LPA0_MIWT4_4_PLR1_SU32_SUM0_SUS256_SKXCCM6_VWA4_VWB1_WGM4_WGMXCC1_WGMXCCGn1
    SolutionIndex: 69
    SolutionNameMin: Cijk_Ailk_Bljk_BBS_BH_UserArgs_MT128x128x32_MI16x16x1_SN_LDSB1_CLR1_GSU0_GSUC0_GSUWGMRR0_K1_LBSPPA1024_LBSPPB128_LPA0_MIWT4_4_PLR1_SU32_SUM0_SUS256_SKXCCM6_VWA4_VWB1_WGM8_WGMXCC1_WGMXCCGn1
    SolutionIndex: 70
    SolutionNameMin: Cijk_Ailk_Bljk_BBS_BH_UserArgs_MT128x64x32_MI16x16x1_SN_LDSB0_CLR0_GSU0_GSUC0_GSUWGMRR0_K1_LBSPPA1024_LBSPPB128_LPA0_MIWT4_2_PLR0_SU32_SUM0_SUS256_SKXCCM6_VWA4_VWB1_WGM1_WGMXCC1_WGMXCCGn1
    SolutionIndex: 71
    SolutionNameMin: Cijk_Ailk_Bljk_BBS_BH_UserArgs_MT32x32x32_MI16x16x1_SN_LDSB0_CLR0_GSU0_GSUC0_GSUWGMRR0_K1_LBSPPA256_LBSPPB128_LPA16_MIWT1_1_PLR0_SU32_SUM0_SUS256_SKXCCM6_VWA1_VWB1_WGM1_WGMXCC1_WGMXCCGn1
    SolutionIndex: 72
    SolutionNameMin: Cijk_Ailk_Bljk_BBS_BH_UserArgs_MT128x256x64_MI16x16x1_SN_LDSB1_CLR1_GSU0_GSUC0_GSUWGMRR0_K1_LBSPPA2048_LBSPPB256_LPA0_MIWT4_8_PLR1_SU32_SUM0_SUS256_SKXCCM6_VWA4_VWB2_WGM1_WGMXCC1_WGMXCCGn1
    SolutionIndex: 73
    SolutionNameMin: Cijk_Ailk_Bljk_BBS_BH_UserArgs_MT128x256x64_MI16x16x1_SN_LDSB1_CLR1_GSU0_GSUC0_GSUWGMRR0_K1_LBSPPA2048_LBSPPB512_LPA0_MIWT4_8_PLR1_SU32_SUM0_SUS256_SKXCCM6_VWA4_VWB4_WGM1_WGMXCC1_WGMXCCGn1
    SolutionIndex: 74
    SolutionNameMin: Cijk_Ailk_Bljk_BBS_BH_UserArgs_MT128x256x64_MI16x16x1_SN_LDSB1_CLR1_GSU0_GSUC0_GSUWGMRR0_K1_LBSPPA2048_LBSPPB256_LPA0_MIWT4_8_PLR1_SU32_SUM0_SUS256_SKXCCM6_VWA4_VWB2_WGM4_WGMXCC1_WGMXCCGn1
    SolutionIndex: 75
    SolutionNameMin: Cijk_Ailk_Bljk_BBS_BH_UserArgs_MT128x256x64_MI16x16x1_SN_LDSB1_CLR1_GSU0_GSUC0_GSUWGMRR0_K1_LBSPPA2048_LBSPPB512_LPA0_MIWT4_8_PLR1_SU32_SUM0_SUS256_SKXCCM6_VWA4_VWB4_WGM4_WGMXCC1_WGMXCCGn1
    SolutionIndex: 76
    SolutionNameMin: Cijk_Ailk_Bljk_BBS_BH_UserArgs_MT128x256x64_MI16x16x1_SN_LDSB1_CLR1_GSU0_GSUC0_GSUWGMRR0_K1_LBSPPA2048_LBSPPB128_LPA0_MIWT4_8_PLR1_SU32_SUM0_SUS256_SKXCCM6_VWA4_VWB1_WGM8_WGMXCC1_WGMXCCGn1
    SolutionIndex: 77
    SolutionNameMin: Cijk_Ailk_Bljk_BBS_BH_UserArgs_MT128x256x64_MI16x16x1_SN_LDSB1_CLR1_GSU0_GSUC0_GSUWGMRR0_K1_LBSPPA2048_LBSPPB512_LPA0_MIWT4_8_PLR1_SU32_SUM0_SUS256_SKXCCM6_VWA4_VWB4_WGM8_WGMXCC1_WGMXCCGn1
    SolutionIndex: 78
    SolutionNameMin: Cijk_Ailk_Bljk_BBS_BH_UserArgs_MT128x256x64_MI16x16x1_SN_LDSB1_CLR1_GSU0_GSUC0_GSUWGMRR0_K1_LBSPPA2048_LBSPPB1024_LPA0_MIWT4_8_PLR1_SU32_SUM0_SUS256_SKXCCM6_VWA4_VWB8_WGM8_WGMXCC1_WGMXCCGn1
    SolutionIndex: 79
    SolutionNameMin: Cijk_Ailk_Bljk_BBS_BH_UserArgs_MT256x128x64_MI16x16x1_SN_LDSB1_CLR1_GSU0_GSUC0_GSUWGMRR0_K1_LBSPPA4096_LBSPPB128_LPA0_MIWT8_4_PLR1_SU32_SUM0_SUS256_SKXCCM6_VWA4_VWB1_WGM1_WGMXCC1_WGMXCCGn1
    SolutionIndex: 80
    SolutionNameMin: Cijk_Ailk_Bljk_BBS_BH_UserArgs_MT256x128x64_MI16x16x1_SN_LDSB1_CLR1_GSU0_GSUC0_GSUWGMRR0_K1_LBSPPA4096_LBSPPB256_LPA0_MIWT8_4_PLR1_SU32_SUM0_SUS256_SKXCCM6_VWA4_VWB2_WGM1_WGMXCC1_WGMXCCGn1
    SolutionIndex: 81
    SolutionNameMin: Cijk_Ailk_Bljk_BBS_BH_UserArgs_MT256x128x64_MI16x16x1_SN_LDSB1_CLR1_GSU0_GSUC0_GSUWGMRR0_K1_LBSPPA4096_LBSPPB512_LPA0_MIWT8_4_PLR1_SU32_SUM0_SUS256_SKXCCM6_VWA4_VWB4_WGM1_WGMXCC1_WGMXCCGn1
    SolutionIndex: 82
    SolutionNameMin: Cijk_Ailk_Bljk_BBS_BH_UserArgs_MT128x128x64_MI16x16x1_SN_LDSB1_CLR1_GSU0_GSUC0_GSUWGMRR0_K1_LBSPPA2048_LBSPPB128_LPA0_MIWT4_4_PLR1_SU32_SUM0_SUS256_SKXCCM6_VWA4_VWB1_WGM1_WGMXCC1_WGMXCCGn1
    SolutionIndex: 83
    SolutionNameMin: Cijk_Ailk_Bljk_BBS_BH_UserArgs_MT128x128x64_MI16x16x1_SN_LDSB1_CLR1_GSU0_GSUC0_GSUWGMRR0_K1_LBSPPA2048_LBSPPB256_LPA32_MIWT4_4_PLR1_SU32_SUM0_SUS256_SKXCCM6_VWA2_VWB2_WGM1_WGMXCC1_WGMXCCGn1
    SolutionIndex: 84
    SolutionNameMin: Cijk_Ailk_Bljk_BBS_BH_UserArgs_MT128x128x64_MI16x16x1_SN_LDSB1_CLR1_GSU0_GSUC0_GSUWGMRR0_K1_LBSPPA2048_LBSPPB256_LPA0_MIWT4_4_PLR1_SU32_SUM0_SUS256_SKXCCM6_VWA4_VWB2_WGM1_WGMXCC1_WGMXCCGn1
    SolutionIndex: 85
    SolutionNameMin: Cijk_Ailk_Bljk_BBS_BH_UserArgs_MT128x128x64_MI16x16x1_SN_LDSB1_CLR1_GSU0_GSUC0_GSUWGMRR0_K1_LBSPPA2048_LBSPPB512_LPA0_MIWT4_4_PLR1_SU32_SUM0_SUS256_SKXCCM6_VWA4_VWB4_WGM1_WGMXCC1_WGMXCCGn1
    SolutionIndex: 86
    SolutionNameMin: Cijk_Ailk_Bljk_BBS_BH_UserArgs_MT128x128x64_MI16x16x1_SN_LDSB1_CLR1_GSU0_GSUC0_GSUWGMRR0_K1_LBSPPA2048_LBSPPB128_LPA0_MIWT4_4_PLR1_SU32_SUM0_SUS256_SKXCCM6_VWA4_VWB1_WGM4_WGMXCC1_WGMXCCGn1
    SolutionIndex: 87
    SolutionNameMin: Cijk_Ailk_Bljk_BBS_BH_UserArgs_MT128x128x64_MI16x16x1_SN_LDSB1_CLR1_GSU0_GSUC0_GSUWGMRR0_K1_LBSPPA2048_LBSPPB256_LPA0_MIWT4_4_PLR1_SU32_SUM0_SUS256_SKXCCM6_VWA4_VWB2_WGM4_WGMXCC1_WGMXCCGn1
    SolutionIndex: 88
    SolutionNameMin: Cijk_Ailk_Bljk_BBS_BH_UserArgs_MT128x128x64_MI16x16x1_SN_LDSB1_CLR1_GSU0_GSUC0_GSUWGMRR0_K1_LBSPPA2048_LBSPPB128_LPA0_MIWT4_4_PLR1_SU32_SUM0_SUS256_SKXCCM6_VWA4_VWB1_WGM8_WGMXCC1_WGMXCCGn1
    SolutionIndex: 89
    SolutionNameMin: Cijk_Ailk_Bljk_BBS_BH_UserArgs_MT128x128x64_MI16x16x1_SN_LDSB1_CLR1_GSU0_GSUC0_GSUWGMRR0_K1_LBSPPA2048_LBSPPB256_LPA0_MIWT4_4_PLR1_SU32_SUM0_SUS256_SKXCCM6_VWA4_VWB2_WGM8_WGMXCC1_WGMXCCGn1
    SolutionIndex: 90
    SolutionNameMin: Cijk_Ailk_Bljk_BBS_BH_UserArgs_MT128x128x64_MI16x16x1_SN_LDSB1_CLR1_GSU0_GSUC0_GSUWGMRR0_K1_LBSPPA2048_LBSPPB512_LPA0_MIWT4_4_PLR1_SU32_SUM0_SUS256_SKXCCM6_VWA4_VWB4_WGM8_WGMXCC1_WGMXCCGn1
    SolutionIndex: 91
    SolutionNameMin: Cijk_Ailk_Bljk_BBS_BH_UserArgs_MT64x128x64_MI16x16x1_SN_LDSB1_CLR1_GSU0_GSUC0_GSUWGMRR0_K1_LBSPPA1024_LBSPPB128_LPA32_MIWT2_4_PLR1_SU32_SUM0_SUS256_SKXCCM6_VWA2_VWB1_WGM1_WGMXCC1_WGMXCCGn1
    SolutionIndex: 92
    SolutionNameMin: Cijk_Ailk_Bljk_BBS_BH_UserArgs_MT64x128x64_MI16x16x1_SN_LDSB1_CLR1_GSU0_GSUC0_GSUWGMRR0_K1_LBSPPA1024_LBSPPB256_LPA32_MIWT2_4_PLR1_SU32_SUM0_SUS256_SKXCCM6_VWA2_VWB2_WGM1_WGMXCC1_WGMXCCGn1
    SolutionIndex: 93
    SolutionNameMin: Cijk_Ailk_Bljk_BBS_BH_UserArgs_MT64x128x64_MI16x16x1_SN_LDSB1_CLR1_GSU0_GSUC0_GSUWGMRR0_K1_LBSPPA1024_LBSPPB512_LPA32_MIWT2_4_PLR1_SU32_SUM0_SUS256_SKXCCM6_VWA2_VWB4_WGM1_WGMXCC1_WGMXCCGn1
    SolutionIndex: 94
    SolutionNameMin: Cijk_Ailk_Bljk_BBS_BH_UserArgs_MT64x128x64_MI16x16x1_SN_LDSB1_CLR1_GSU0_GSUC0_GSUWGMRR0_K1_LBSPPA1024_LBSPPB256_LPA32_MIWT2_4_PLR1_SU32_SUM0_SUS256_SKXCCM6_VWA2_VWB2_WGM4_WGMXCC1_WGMXCCGn1
    SolutionIndex: 95
    SolutionNameMin: Cijk_Ailk_Bljk_BBS_BH_UserArgs_MT64x128x64_MI16x16x1_SN_LDSB1_CLR1_GSU0_GSUC0_GSUWGMRR0_K1_LBSPPA1024_LBSPPB512_LPA32_MIWT2_4_PLR1_SU32_SUM0_SUS256_SKXCCM6_VWA2_VWB4_WGM4_WGMXCC1_WGMXCCGn1
    SolutionIndex: 96
    SolutionNameMin: Cijk_Ailk_Bljk_BBS_BH_UserArgs_MT64x128x64_MI16x16x1_SN_LDSB1_CLR1_GSU0_GSUC0_GSUWGMRR0_K1_LBSPPA1024_LBSPPB256_LPA32_MIWT2_4_PLR1_SU32_SUM0_SUS256_SKXCCM6_VWA2_VWB2_WGM8_WGMXCC1_WGMXCCGn1
    SolutionIndex: 97
    SolutionNameMin: Cijk_Ailk_Bljk_BBS_BH_UserArgs_MT128x64x64_MI16x16x1_SN_LDSB1_CLR1_GSU0_GSUC0_GSUWGMRR0_K1_LBSPPA2048_LBSPPB128_LPA0_MIWT4_2_PLR1_SU32_SUM0_SUS256_SKXCCM6_VWA4_VWB1_WGM1_WGMXCC1_WGMXCCGn1
    SolutionIndex: 98
    SolutionNameMin: Cijk_Ailk_Bljk_BBS_BH_UserArgs_MT128x64x64_MI16x16x1_SN_LDSB1_CLR1_GSU0_GSUC0_GSUWGMRR0_K1_LBSPPA2048_LBSPPB256_LPA0_MIWT4_2_PLR1_SU32_SUM0_SUS256_SKXCCM6_VWA4_VWB2_WGM1_WGMXCC1_WGMXCCGn1
    SolutionIndex: 99
    SolutionNameMin: Cijk_Ailk_Bljk_BBS_BH_UserArgs_MT128x64x64_MI16x16x1_SN_LDSB1_CLR1_GSU0_GSUC0_GSUWGMRR0_K1_LBSPPA2048_LBSPPB256_LPA0_MIWT4_2_PLR2_SU32_SUM0_SUS256_SKXCCM6_VWA4_VWB2_WGM1_WGMXCC1_WGMXCCGn1
    SolutionIndex: 100
    SolutionNameMin: Cijk_Ailk_Bljk_BBS_BH_UserArgs_MT128x64x64_MI16x16x1_SN_LDSB1_CLR1_GSU0_GSUC0_GSUWGMRR0_K1_LBSPPA2048_LBSPPB128_LPA0_MIWT4_2_PLR1_SU32_SUM0_SUS256_SKXCCM6_VWA4_VWB1_WGM4_WGMXCC1_WGMXCCGn1
    SolutionIndex: 101
    SolutionNameMin: Cijk_Ailk_Bljk_BBS_BH_UserArgs_MT128x64x64_MI16x16x1_SN_LDSB1_CLR1_GSU0_GSUC0_GSUWGMRR0_K1_LBSPPA2048_LBSPPB256_LPA0_MIWT4_2_PLR1_SU32_SUM0_SUS256_SKXCCM6_VWA4_VWB2_WGM4_WGMXCC1_WGMXCCGn1
    SolutionIndex: 102
    SolutionNameMin: Cijk_Ailk_Bljk_BBS_BH_UserArgs_MT128x64x64_MI16x16x1_SN_LDSB1_CLR1_GSU0_GSUC0_GSUWGMRR0_K1_LBSPPA2048_LBSPPB128_LPA0_MIWT4_2_PLR1_SU32_SUM0_SUS256_SKXCCM6_VWA4_VWB1_WGM8_WGMXCC1_WGMXCCGn1
    SolutionIndex: 103
    SolutionNameMin: Cijk_Ailk_Bljk_BBS_BH_UserArgs_MT128x64x64_MI16x16x1_SN_LDSB1_CLR1_GSU0_GSUC0_GSUWGMRR0_K1_LBSPPA2048_LBSPPB256_LPA0_MIWT4_2_PLR1_SU32_SUM0_SUS256_SKXCCM6_VWA4_VWB2_WGM8_WGMXCC1_WGMXCCGn1
    SolutionIndex: 104
    SolutionNameMin: Cijk_Ailk_Bljk_BBS_BH_UserArgs_MT128x64x64_MI16x16x1_SN_LDSB1_CLR1_GSU0_GSUC0_GSUWGMRR0_K1_LBSPPA2048_LBSPPB256_LPA0_MIWT4_2_PLR2_SU32_SUM0_SUS256_SKXCCM6_VWA4_VWB2_WGM8_WGMXCC1_WGMXCCGn1
    SolutionIndex: 105
    SolutionNameMin: Cijk_Ailk_Bljk_BBS_BH_UserArgs_MT64x64x64_MI16x16x1_SN_LDSB1_CLR1_GSU0_GSUC0_GSUWGMRR0_K1_LBSPPA1024_LBSPPB128_LPA32_MIWT2_2_PLR1_SU32_SUM0_SUS256_SKXCCM6_VWA2_VWB1_WGM1_WGMXCC1_WGMXCCGn1
    SolutionIndex: 106
    SolutionNameMin: Cijk_Ailk_Bljk_BBS_BH_UserArgs_MT64x64x64_MI16x16x1_SN_LDSB1_CLR1_GSU0_GSUC0_GSUWGMRR0_K1_LBSPPA1024_LBSPPB256_LPA32_MIWT2_2_PLR1_SU32_SUM0_SUS256_SKXCCM6_VWA2_VWB2_WGM1_WGMXCC1_WGMXCCGn1
    SolutionIndex: 107
    SolutionNameMin: Cijk_Ailk_Bljk_BBS_BH_UserArgs_MT64x64x64_MI16x16x1_SN_LDSB1_CLR1_GSU0_GSUC0_GSUWGMRR0_K1_LBSPPA1024_LBSPPB128_LPA32_MIWT2_2_PLR1_SU32_SUM0_SUS256_SKXCCM6_VWA2_VWB1_WGM4_WGMXCC1_WGMXCCGn1
    SolutionIndex: 108
    SolutionNameMin: Cijk_Ailk_Bljk_BBS_BH_UserArgs_MT64x64x64_MI16x16x1_SN_LDSB1_CLR1_GSU0_GSUC0_GSUWGMRR0_K1_LBSPPA1024_LBSPPB256_LPA32_MIWT2_2_PLR1_SU32_SUM0_SUS256_SKXCCM6_VWA2_VWB2_WGM4_WGMXCC1_WGMXCCGn1
    SolutionIndex: 109
    SolutionNameMin: Cijk_Ailk_Bljk_BBS_BH_UserArgs_MT64x64x64_MI16x16x1_SN_LDSB1_CLR1_GSU0_GSUC0_GSUWGMRR0_K1_LBSPPA1024_LBSPPB128_LPA32_MIWT2_2_PLR1_SU32_SUM0_SUS256_SKXCCM6_VWA2_VWB1_WGM8_WGMXCC1_WGMXCCGn1
    SolutionIndex: 110
    SolutionNameMin: Cijk_Ailk_Bljk_BBS_BH_UserArgs_MT64x64x64_MI16x16x1_SN_LDSB1_CLR1_GSU0_GSUC0_GSUWGMRR0_K1_LBSPPA1024_LBSPPB256_LPA32_MIWT2_2_PLR1_SU32_SUM0_SUS256_SKXCCM6_VWA2_VWB2_WGM8_WGMXCC1_WGMXCCGn1
    SolutionIndex: 111
    SolutionNameMin: Cijk_Ailk_Bljk_BBS_BH_UserArgs_MT32x32x64_MI16x16x1_SN_LDSB0_CLR1_GSU0_GSUC0_GSUWGMRR0_K1_LBSPPA512_LBSPPB128_LPA16_MIWT1_1_PLR1_SU32_SUM0_SUS256_SKXCCM6_VWA1_VWB1_WGM1_WGMXCC1_WGMXCCGn1
    SolutionIndex: 112
    SolutionNameMin: Cijk_Ailk_Bljk_BBS_BH_UserArgs_MT64x32x128_MI16x16x1_SN_LDSB1_CLR1_GSU0_GSUC0_GSUWGMRR0_K1_LBSPPA1024_LBSPPB256_LPA32_MIWT2_1_PLR1_SU32_SUM0_SUS256_SKXCCM6_VWA2_VWB1_WGM1_WGMXCC1_WGMXCCGn1
    SolutionIndex: 113
    SolutionNameMin: Cijk_Ailk_Bljk_BBS_BH_UserArgs_MT64x32x128_MI16x16x1_SN_LDSB1_CLR1_GSU0_GSUC0_GSUWGMRR0_K1_LBSPPA1024_LBSPPB256_LPA32_MIWT2_1_PLR2_SU32_SUM0_SUS256_SKXCCM6_VWA2_VWB1_WGM1_WGMXCC1_WGMXCCGn1
    SolutionIndex: 114
    SolutionNameMin: Cijk_Ailk_Bljk_BBS_BH_UserArgs_MT64x32x128_MI16x16x1_SN_LDSB1_CLR1_GSU0_GSUC0_GSUWGMRR0_K1_LBSPPA1024_LBSPPB256_LPA32_MIWT2_1_PLR1_SU32_SUM0_SUS256_SKXCCM6_VWA2_VWB1_WGM4_WGMXCC1_WGMXCCGn1
    SolutionIndex: 115
    SolutionNameMin: Cijk_Ailk_Bljk_BBS_BH_UserArgs_MT64x32x128_MI16x16x1_SN_LDSB1_CLR1_GSU0_GSUC0_GSUWGMRR0_K1_LBSPPA1024_LBSPPB256_LPA32_MIWT2_1_PLR2_SU32_SUM0_SUS256_SKXCCM6_VWA2_VWB1_WGM4_WGMXCC1_WGMXCCGn1
    SolutionIndex: 116
    SolutionNameMin: Cijk_Ailk_Bljk_BBS_BH_UserArgs_MT64x32x128_MI16x16x1_SN_LDSB1_CLR1_GSU0_GSUC0_GSUWGMRR0_K1_LBSPPA1024_LBSPPB256_LPA32_MIWT2_1_PLR2_SU32_SUM0_SUS256_SKXCCM6_VWA2_VWB1_WGM8_WGMXCC1_WGMXCCGn1
    SolutionIndex: 117
    SolutionNameMin: Cijk_Ailk_Bljk_BBS_BH_UserArgs_MT32x32x128_MI16x16x1_SN_LDSB1_CLR1_GSU0_GSUC0_GSUWGMRR0_K1_LBSPPA512_LBSPPB256_LPA16_MIWT1_1_PLR1_SU32_SUM0_SUS256_SKXCCM6_VWA1_VWB1_WGM1_WGMXCC1_WGMXCCGn1
    SolutionIndex: 118
    SolutionNameMin: Cijk_Ailk_Bljk_BBS_BH_UserArgs_MT32x32x128_MI16x16x1_SN_LDSB1_CLR1_GSU0_GSUC0_GSUWGMRR0_K1_LBSPPA512_LBSPPB256_LPA16_MIWT1_1_PLR2_SU32_SUM0_SUS256_SKXCCM6_VWA1_VWB1_WGM1_WGMXCC1_WGMXCCGn1
    SolutionIndex: 119
    SolutionNameMin: Cijk_Ailk_Bljk_BBS_BH_UserArgs_MT32x32x32_MI16x16x1_SN_LDSB0_CLR1_GSU0_GSUC0_GSUWGMRR0_K1_LBSPPA256_LBSPPB128_LPA16_MIWT1_1_PLR1_SU32_SUM0_SUS256_SKXCCM0_VWA1_VWB1_WGM1_WGMXCC1_WGMXCCGn1
- - - [128, 128, 1, 128, 128, 128, 128, 128]
    - [118, 0.082]
  - - [128, 128, 1, 256, 128, 128, 128, 256]
    - [29, 0.108]
  - - [128, 128, 1, 512, 128, 128, 128, 512]
    - [117, 0.186]
  - - [128, 128, 1, 1024, 128, 128, 128, 1024]
    - [118, 0.283]
  - - [128, 128, 1, 2048, 128, 128, 128, 2048]
    - [10, 0.374]
  - - [128, 128, 1, 4096, 128, 128, 128, 4096]
    - [23, 0.725]
  - - [128, 128, 1, 8192, 128, 128, 128, 8192]
    - [28, 1.358]
  - - [128, 256, 1, 128, 128, 128, 128, 128]
    - [28, 0.166]
  - - [128, 256, 1, 256, 128, 128, 128, 256]
    - [28, 0.215]
  - - [128, 256, 1, 512, 128, 128, 128, 512]
    - [118, 0.357]
  - - [128, 256, 1, 1024, 128, 128, 128, 1024]
    - [23, 0.547]
  - - [128, 256, 1, 2048, 128, 128, 128, 2048]
    - [28, 1.036]
  - - [128, 256, 1, 4096, 128, 128, 128, 4096]
    - [28, 1.766]
  - - [128, 256, 1, 8192, 128, 128, 128, 8192]
    - [118, 2.969]
  - - [128, 512, 1, 128, 128, 128, 128, 128]
    - [29, 0.331]
  - - [128, 512, 1, 256, 128, 128, 128, 256]
    - [28, 0.418]
  - - [128, 512, 1, 512, 128, 128, 128, 512]
    - [118, 0.703]
  - - [128, 512, 1, 1024, 128, 128, 128, 1024]
    - [71, 1.249]
  - - [128, 512, 1, 2048, 128, 128, 128, 2048]
    - [117, 2.253]
  - - [128, 512, 1, 4096, 128, 128, 128, 4096]
    - [118, 3.533]
  - - [128, 512, 1, 8192, 128, 128, 128, 8192]
    - [113, 5.117]
  - - [128, 1024, 1, 128, 128, 128, 128, 128]
    - [28, 0.661]
  - - [128, 1024, 1, 256, 128, 128, 128, 256]
    - [29, 0.82]
  - - [128, 1024, 1, 512, 128, 128, 128, 512]
    - [117, 1.445]
  - - [128, 1024, 1, 1024, 128, 128, 128, 1024]
    - [118, 2.527]
  - - [128, 1024, 1, 2048, 128, 128, 128, 2048]
    - [112, 3.989]
  - - [128, 1024, 1, 4096, 128, 128, 128, 4096]
    - [113, 6.094]
  - - [128, 1024, 1, 8192, 128, 128, 128, 8192]
    - [113, 8.081]
  - - [128, 2048, 1, 128, 128, 128, 128, 128]
    - [27, 1.24]
  - - [128, 2048, 1, 256, 128, 128, 128, 256]
    - [29, 1.991]
  - - [128, 2048, 1, 512, 128, 128, 128, 512]
    - [29, 3.165]
  - - [128, 2048, 1, 1024, 128, 128, 128, 1024]
    - [29, 4.47]
  - - [128, 2048, 1, 2048, 128, 128, 128, 2048]
    - [113, 6.679]
  - - [128, 2048, 1, 4096, 128, 128, 128, 4096]
    - [105, 9.391]
  - - [128, 2048, 1, 8192, 128, 128, 128, 8192]
    - [101, 10.973]
  - - [128, 4096, 1, 128, 128, 128, 128, 128]
    - [25, 2.221]
  - - [128, 4096, 1, 256, 128, 128, 128, 256]
    - [22, 3.6]
  - - [128, 4096, 1, 512, 128, 128, 128, 512]
    - [113, 5.58]
  - - [128, 4096, 1, 1024, 128, 128, 128, 1024]
    - [27, 7.783]
  - - [128, 4096, 1, 2048, 128, 128, 128, 2048]
    - [106, 10.375]
  - - [128, 4096, 1, 4096, 128, 128, 128, 4096]
    - [18, 12.292]
  - - [128, 4096, 1, 8192, 128, 128, 128, 8192]
    - [100, 13.797]
  - - [128, 8192, 1, 128, 128, 128, 128, 128]
    - [20, 3.613]
  - - [128, 8192, 1, 256, 128, 128, 128, 256]
    - [20, 5.978]
  - - [128, 8192, 1, 512, 128, 128, 128, 512]
    - [106, 8.993]
  - - [128, 8192, 1, 1024, 128, 128, 128, 1024]
    - [106, 12.057]
  - - [128, 8192, 1, 2048, 128, 128, 128, 2048]
    - [106, 13.226]
  - - [128, 8192, 1, 4096, 128, 128, 128, 4096]
    - [101, 14.987]
  - - [128, 8192, 1, 8192, 128, 128, 128, 8192]
    - [19, 17.123]
  - - [256, 128, 1, 128, 256, 256, 256, 128]
    - [29, 0.171]
  - - [256, 128, 1, 256, 256, 256, 256, 256]
    - [28, 0.216]
  - - [256, 128, 1, 512, 256, 256, 256, 512]
    - [118, 0.362]
  - - [256, 128, 1, 1024, 256, 256, 256, 1024]
    - [111, 0.552]
  - - [256, 128, 1, 2048, 256, 256, 256, 2048]
    - [28, 1.041]
  - - [256, 128, 1, 4096, 256, 256, 256, 4096]
    - [117, 1.776]
  - - [256, 128, 1, 8192, 256, 256, 256, 8192]
    - [29, 2.924]
  - - [256, 256, 1, 128, 256, 256, 256, 128]
    - [28, 0.336]
  - - [256, 256, 1, 256, 256, 256, 256, 256]
    - [29, 0.424]
  - - [256, 256, 1, 512, 256, 256, 256, 512]
    - [117, 0.698]
  - - [256, 256, 1, 1024, 256, 256, 256, 1024]
    - [71, 1.265]
  - - [256, 256, 1, 2048, 256, 256, 256, 2048]
    - [118, 2.262]
  - - [256, 256, 1, 4096, 256, 256, 256, 4096]
    - [117, 3.526]
  - - [256, 256, 1, 8192, 256, 256, 256, 8192]
    - [27, 5.105]
  - - [256, 512, 1, 128, 256, 256, 256, 128]
    - [28, 0.65]
  - - [256, 512, 1, 256, 256, 256, 256, 256]
    - [29, 0.817]
  - - [256, 512, 1, 512, 256, 256, 256, 512]
    - [28, 1.461]
  - - [256, 512, 1, 1024, 256, 256, 256, 1024]
    - [117, 2.462]
  - - [256, 512, 1, 2048, 256, 256, 256, 2048]
    - [112, 3.983]
  - - [256, 512, 1, 4096, 256, 256, 256, 4096]
    - [113, 6.038]
  - - [256, 512, 1, 8192, 256, 256, 256, 8192]
    - [113, 7.912]
  - - [256, 1024, 1, 128, 256, 256, 256, 128]
    - [27, 1.247]
  - - [256, 1024, 1, 256, 256, 256, 256, 256]
    - [28, 1.984]
  - - [256, 1024, 1, 512, 256, 256, 256, 512]
    - [28, 3.126]
  - - [256, 1024, 1, 1024, 256, 256, 256, 1024]
    - [29, 4.498]
  - - [256, 1024, 1, 2048, 256, 256, 256, 2048]
    - [113, 6.583]
  - - [256, 1024, 1, 4096, 256, 256, 256, 4096]
    - [106, 9.355]
  - - [256, 1024, 1, 8192, 256, 256, 256, 8192]
    - [97, 10.653]
  - - [256, 2048, 1, 128, 256, 256, 256, 128]
    - [25, 2.221]
  - - [256, 2048, 1, 256, 256, 256, 256, 256]
    - [22, 3.639]
  - - [256, 2048, 1, 512, 256, 256, 256, 512]
    - [27, 5.637]
  - - [256, 2048, 1, 1024, 256, 256, 256, 1024]
    - [27, 7.812]
  - - [256, 2048, 1, 2048, 256, 256, 256, 2048]
    - [106, 10.38]
  - - [256, 2048, 1, 4096, 256, 256, 256, 4096]
    - [99, 12.576]
  - - [256, 2048, 1, 8192, 256, 256, 256, 8192]
    - [62, 12.565]
  - - [256, 4096, 1, 128, 256, 256, 256, 128]
    - [21, 3.573]
  - - [256, 4096, 1, 256, 256, 256, 256, 256]
    - [20, 6.025]
  - - [256, 4096, 1, 512, 256, 256, 256, 512]
    - [21, 9.095]
  - - [256, 4096, 1, 1024, 256, 256, 256, 1024]
    - [106, 11.989]
  - - [256, 4096, 1, 2048, 256, 256, 256, 2048]
    - [98, 13.516]
  - - [256, 4096, 1, 4096, 256, 256, 256, 4096]
    - [103, 14.571]
  - - [256, 4096, 1, 8192, 256, 256, 256, 8192]
    - [84, 15.712]
  - - [256, 8192, 1, 128, 256, 256, 256, 128]
    - [15, 5.484]
  - - [256, 8192, 1, 256, 256, 256, 256, 256]
    - [17, 8.804]
  - - [256, 8192, 1, 512, 256, 256, 256, 512]
    - [91, 12.754]
  - - [256, 8192, 1, 1024, 256, 256, 256, 1024]
    - [98, 16.12]
  - - [256, 8192, 1, 2048, 256, 256, 256, 2048]
    - [93, 16.641]
  - - [256, 8192, 1, 4096, 256, 256, 256, 4096]
    - [12, 17.475]
  - - [256, 8192, 1, 8192, 256, 256, 256, 8192]
    - [57, 18.122]
  - - [512, 128, 1, 128, 512, 512, 512, 128]
    - [28, 0.339]
  - - [512, 128, 1, 256, 512, 512, 512, 256]
    - [28, 0.428]
  - - [512, 128, 1, 512, 512, 512, 512, 512]
    - [117, 0.699]
  - - [512, 128, 1, 1024, 512, 512, 512, 1024]
    - [71, 1.255]
  - - [512, 128, 1, 2048, 512, 512, 512, 2048]
    - [117, 2.259]
  - - [512, 128, 1, 4096, 512, 512, 512, 4096]
    - [28, 3.408]
  - - [512, 128, 1, 8192, 512, 512, 512, 8192]
    - [114, 4.846]
  - - [512, 256, 1, 128, 512, 512, 512, 128]
    - [28, 0.588]
  - - [512, 256, 1, 256, 512, 512, 512, 256]
    - [28, 0.804]
  - - [512, 256, 1, 512, 512, 512, 512, 512]
    - [118, 1.447]
  - - [512, 256, 1, 1024, 512, 512, 512, 1024]
    - [117, 2.505]
  - - [512, 256, 1, 2048, 512, 512, 512, 2048]
    - [112, 3.99]
  - - [512, 256, 1, 4096, 512, 512, 512, 4096]
    - [116, 5.957]
  - - [512, 256, 1, 8192, 512, 512, 512, 8192]
    - [26, 7.739]
  - - [512, 512, 1, 128, 512, 512, 512, 128]
    - [27, 1.216]
  - - [512, 512, 1, 256, 512, 512, 512, 256]
    - [28, 1.983]
  - - [512, 512, 1, 512, 512, 512, 512, 512]
    - [28, 3.128]
  - - [512, 512, 1, 1024, 512, 512, 512, 1024]
    - [113, 4.459]
  - - [512, 512, 1, 2048, 512, 512, 512, 2048]
    - [113, 6.664]
  - - [512, 512, 1, 4096, 512, 512, 512, 4096]
    - [109, 9.257]
  - - [512, 512, 1, 8192, 512, 512, 512, 8192]
    - [17, 10.55]
  - - [512, 1024, 1, 128, 512, 512, 512, 128]
    - [24, 2.196]
  - - [512, 1024, 1, 256, 512, 512, 512, 256]
    - [22, 3.568]
  - - [512, 1024, 1, 512, 512, 512, 512, 512]
    - [113, 5.595]
  - - [512, 1024, 1, 1024, 512, 512, 512, 1024]
    - [113, 7.763]
  - - [512, 1024, 1, 2048, 512, 512, 512, 2048]
    - [108, 10.455]
  - - [512, 1024, 1, 4096, 512, 512, 512, 4096]
    - [102, 13.09]
  - - [512, 1024, 1, 8192, 512, 512, 512, 8192]
    - [60, 12.33]
  - - [512, 2048, 1, 128, 512, 512, 512, 128]
    - [20, 3.569]
  - - [512, 2048, 1, 256, 512, 512, 512, 256]
    - [20, 5.947]
  - - [512, 2048, 1, 512, 512, 512, 512, 512]
    - [21, 9.024]
  - - [512, 2048, 1, 1024, 512, 512, 512, 1024]
    - [106, 12.007]
  - - [512, 2048, 1, 2048, 512, 512, 512, 2048]
    - [106, 13.926]
  - - [512, 2048, 1, 4096, 512, 512, 512, 4096]
    - [70, 13.061]
  - - [512, 2048, 1, 8192, 512, 512, 512, 8192]
    - [82, 15.552]
  - - [512, 4096, 1, 128, 512, 512, 512, 128]
    - [15, 5.511]
  - - [512, 4096, 1, 256, 512, 512, 512, 256]
    - [15, 8.749]
  - - [512, 4096, 1, 512, 512, 512, 512, 512]
    - [98, 12.845]
  - - [512, 4096, 1, 1024, 512, 512, 512, 1024]
    - [98, 16.551]
  - - [512, 4096, 1, 2048, 512, 512, 512, 2048]
    - [98, 16.692]
  - - [512, 4096, 1, 4096, 512, 512, 512, 4096]
    - [82, 16.733]
  - - [512, 4096, 1, 8192, 512, 512, 512, 8192]
    - [80, 17.876]
  - - [512, 8192, 1, 128, 512, 512, 512, 128]
    - [6, 7.463]
  - - [512, 8192, 1, 256, 512, 512, 512, 256]
    - [59, 11.472]
  - - [512, 8192, 1, 512, 512, 512, 512, 512]
    - [59, 15.788]
  - - [512, 8192, 1, 1024, 512, 512, 512, 1024]
    - [67, 17.381]
  - - [512, 8192, 1, 2048, 512, 512, 512, 2048]
    - [86, 19.331]
  - - [512, 8192, 1, 4096, 512, 512, 512, 4096]
    - [5, 19.035]
  - - [512, 8192, 1, 8192, 512, 512, 512, 8192]
    - [80, 20.601]
  - - [1024, 128, 1, 128, 1024, 1024, 1024, 128]
    - [29, 0.644]
  - - [1024, 128, 1, 256, 1024, 1024, 1024, 256]
    - [28, 0.796]
  - - [1024, 128, 1, 512, 1024, 1024, 1024, 512]
    - [28, 1.433]
  - - [1024, 128, 1, 1024, 1024, 1024, 1024, 1024]
    - [118, 2.49]
  - - [1024, 128, 1, 2048, 1024, 1024, 1024, 2048]
    - [26, 3.852]
  - - [1024, 128, 1, 4096, 1024, 1024, 1024, 4096]
    - [22, 5.641]
  - - [1024, 128, 1, 8192, 1024, 1024, 1024, 8192]
    - [110, 7.306]
  - - [1024, 256, 1, 128, 1024, 1024, 1024, 128]
    - [27, 1.209]
  - - [1024, 256, 1, 256, 1024, 1024, 1024, 256]
    - [28, 1.946]
  - - [1024, 256, 1, 512, 1024, 1024, 1024, 512]
    - [29, 3.089]
  - - [1024, 256, 1, 1024, 1024, 1024, 1024, 1024]
    - [29, 4.434]
  - - [1024, 256, 1, 2048, 1024, 1024, 1024, 2048]
    - [27, 6.342]
  - - [1024, 256, 1, 4096, 1024, 1024, 1024, 4096]
    - [20, 8.83]
  - - [1024, 256, 1, 8192, 1024, 1024, 1024, 8192]
    - [9, 10.801]
  - - [1024, 512, 1, 128, 1024, 1024, 1024, 128]
    - [25, 2.147]
  - - [1024, 512, 1, 256, 1024, 1024, 1024, 256]
    - [22, 3.555]
  - - [1024, 512, 1, 512, 1024, 1024, 1024, 512]
    - [27, 5.516]
  - - [1024, 512, 1, 1024, 1024, 1024, 1024, 1024]
    - [27, 7.711]
  - - [1024, 512, 1, 2048, 1024, 1024, 1024, 2048]
    - [20, 10.035]
  - - [1024, 512, 1, 4096, 1024, 1024, 1024, 4096]
    - [103, 12.363]
  - - [1024, 512, 1, 8192, 1024, 1024, 1024, 8192]
    - [90, 12.293]
  - - [1024, 1024, 1, 128, 1024, 1024, 1024, 128]
    - [20, 3.516]
  - - [1024, 1024, 1, 256, 1024, 1024, 1024, 256]
    - [20, 5.898]
  - - [1024, 1024, 1, 512, 1024, 1024, 1024, 512]
    - [20, 8.964]
  - - [1024, 1024, 1, 1024, 1024, 1024, 1024, 1024]
    - [20, 11.973]
  - - [1024, 1024, 1, 2048, 1024, 1024, 1024, 2048]
    - [17, 13.736]
  - - [1024, 1024, 1, 4096, 1024, 1024, 1024, 4096]
    - [98, 13.79]
  - - [1024, 1024, 1, 8192, 1024, 1024, 1024, 8192]
    - [87, 15.1]
  - - [1024, 2048, 1, 128, 1024, 1024, 1024, 128]
    - [15, 5.458]
  - - [1024, 2048, 1, 256, 1024, 1024, 1024, 256]
    - [14, 8.755]
  - - [1024, 2048, 1, 512, 1024, 1024, 1024, 512]
    - [13, 12.861]
  - - [1024, 2048, 1, 1024, 1024, 1024, 1024, 1024]
    - [98, 16.549]
  - - [1024, 2048, 1, 2048, 1024, 1024, 1024, 2048]
    - [99, 16.418]
  - - [1024, 2048, 1, 4096, 1024, 1024, 1024, 4096]
    - [84, 17.493]
  - - [1024, 2048, 1, 8192, 1024, 1024, 1024, 8192]
    - [74, 17.768]
  - - [1024, 4096, 1, 128, 1024, 1024, 1024, 128]
    - [8, 7.322]
  - - [1024, 4096, 1, 256, 1024, 1024, 1024, 256]
    - [59, 11.394]
  - - [1024, 4096, 1, 512, 1024, 1024, 1024, 512]
    - [59, 15.913]
  - - [1024, 4096, 1, 1024, 1024, 1024, 1024, 1024]
    - [59, 17.544]
  - - [1024, 4096, 1, 2048, 1024, 1024, 1024, 2048]
    - [87, 19.085]
  - - [1024, 4096, 1, 4096, 1024, 1024, 1024, 4096]
    - [79, 18.09]
  - - [1024, 4096, 1, 8192, 1024, 1024, 1024, 8192]
    - [78, 20.217]
  - - [1024, 8192, 1, 128, 1024, 1024, 1024, 128]
    - [58, 9.642]
  - - [1024, 8192, 1, 256, 1024, 1024, 1024, 256]
    - [45, 13.871]
  - - [1024, 8192, 1, 512, 1024, 1024, 1024, 512]
    - [50, 17.796]
  - - [1024, 8192, 1, 1024, 1024, 1024, 1024, 1024]
    - [47, 21.086]
  - - [1024, 8192, 1, 2048, 1024, 1024, 1024, 2048]
    - [81, 21.37]
  - - [1024, 8192, 1, 4096, 1024, 1024, 1024, 4096]
    - [4, 20.488]
  - - [1024, 8192, 1, 8192, 1024, 1024, 1024, 8192]
    - [2, 23.168]
  - - [2048, 128, 1, 128, 2048, 2048, 2048, 128]
    - [27, 1.222]
  - - [2048, 128, 1, 256, 2048, 2048, 2048, 256]
    - [28, 1.949]
  - - [2048, 128, 1, 512, 2048, 2048, 2048, 512]
    - [28, 3.084]
  - - [2048, 128, 1, 1024, 2048, 2048, 2048, 1024]
    - [116, 4.297]
  - - [2048, 128, 1, 2048, 2048, 2048, 2048, 2048]
    - [22, 6.132]
  - - [2048, 128, 1, 4096, 2048, 2048, 2048, 4096]
    - [108, 8.773]
  - - [2048, 128, 1, 8192, 2048, 2048, 2048, 8192]
    - [100, 10.303]
  - - [2048, 256, 1, 128, 2048, 2048, 2048, 128]
    - [25, 2.159]
  - - [2048, 256, 1, 256, 2048, 2048, 2048, 256]
    - [22, 3.523]
  - - [2048, 256, 1, 512, 2048, 2048, 2048, 512]
    - [27, 5.505]
  - - [2048, 256, 1, 1024, 2048, 2048, 2048, 1024]
    - [27, 7.748]
  - - [2048, 256, 1, 2048, 2048, 2048, 2048, 2048]
    - [109, 9.835]
  - - [2048, 256, 1, 4096, 2048, 2048, 2048, 4096]
    - [104, 12.252]
  - - [2048, 256, 1, 8192, 2048, 2048, 2048, 8192]
    - [93, 12.571]
  - - [2048, 512, 1, 128, 2048, 2048, 2048, 128]
    - [20, 3.524]
  - - [2048, 512, 1, 256, 2048, 2048, 2048, 256]
    - [21, 5.837]
  - - [2048, 512, 1, 512, 2048, 2048, 2048, 512]
    - [20, 8.934]
  - - [2048, 512, 1, 1024, 2048, 2048, 2048, 1024]
    - [20, 12.065]
  - - [2048, 512, 1, 2048, 2048, 2048, 2048, 2048]
    - [110, 13.332]
  - - [2048, 512, 1, 4096, 2048, 2048, 2048, 4096]
    - [92, 13.084]
  - - [2048, 512, 1, 8192, 2048, 2048, 2048, 8192]
    - [88, 15.07]
  - - [2048, 1024, 1, 128, 2048, 2048, 2048, 128]
    - [15, 5.425]
  - - [2048, 1024, 1, 256, 2048, 2048, 2048, 256]
    - [14, 8.719]
  - - [2048, 1024, 1, 512, 2048, 2048, 2048, 512]
    - [13, 12.818]
  - - [2048, 1024, 1, 1024, 2048, 2048, 2048, 1024]
    - [102, 15.951]
  - - [2048, 1024, 1, 2048, 2048, 2048, 2048, 2048]
    - [94, 16.401]
  - - [2048, 1024, 1, 4096, 2048, 2048, 2048, 4096]
    - [85, 16.64]
  - - [2048, 1024, 1, 8192, 2048, 2048, 2048, 8192]
    - [76, 17.738]
  - - [2048, 2048, 1, 128, 2048, 2048, 2048, 128]
    - [8, 7.42]
  - - [2048, 2048, 1, 256, 2048, 2048, 2048, 256]
    - [61, 11.286]
  - - [2048, 2048, 1, 512, 2048, 2048, 2048, 512]
    - [61, 15.17]
  - - [2048, 2048, 1, 1024, 2048, 2048, 2048, 1024]
    - [66, 17.184]
  - - [2048, 2048, 1, 2048, 2048, 2048, 2048, 2048]
    - [89, 18.865]
  - - [2048, 2048, 1, 4096, 2048, 2048, 2048, 4096]
    - [79, 18.254]
  - - [2048, 2048, 1, 8192, 2048, 2048, 2048, 8192]
    - [40, 20.438]
  - - [2048, 4096, 1, 128, 2048, 2048, 2048, 128]
    - [58, 9.5]
  - - [2048, 4096, 1, 256, 2048, 2048, 2048, 256]
    - [54, 14.057]
  - - [2048, 4096, 1, 512, 2048, 2048, 2048, 512]
    - [44, 17.692]
  - - [2048, 4096, 1, 1024, 2048, 2048, 2048, 1024]
    - [46, 20.438]
  - - [2048, 4096, 1, 2048, 2048, 2048, 2048, 2048]
    - [81, 21.104]
  - - [2048, 4096, 1, 4096, 2048, 2048, 2048, 4096]
    - [34, 20.682]
  - - [2048, 4096, 1, 8192, 2048, 2048, 2048, 8192]
    - [2, 23.558]
  - - [2048, 8192, 1, 128, 2048, 2048, 2048, 128]
    - [36, 8.952]
  - - [2048, 8192, 1, 256, 2048, 2048, 2048, 256]
    - [36, 13.69]
  - - [2048, 8192, 1, 512, 2048, 2048, 2048, 512]
    - [31, 18.134]
  - - [2048, 8192, 1, 1024, 2048, 2048, 2048, 1024]
    - [31, 21.436]
  - - [2048, 8192, 1, 2048, 2048, 2048, 2048, 2048]
    - [73, 20.495]
  - - [2048, 8192, 1, 4096, 2048, 2048, 2048, 4096]
    - [32, 22.709]
  - - [2048, 8192, 1, 8192, 2048, 2048, 2048, 8192]
    - [42, 24.358]
  - - [4096, 128, 1, 128, 4096, 4096, 4096, 128]
    - [25, 2.168]
  - - [4096, 128, 1, 256, 4096, 4096, 4096, 256]
    - [22, 3.584]
  - - [4096, 128, 1, 512, 4096, 4096, 4096, 512]
    - [27, 5.537]
  - - [4096, 128, 1, 1024, 4096, 4096, 4096, 1024]
    - [115, 7.548]
  - - [4096, 128, 1, 2048, 4096, 4096, 4096, 2048]
    - [110, 9.697]
  - - [4096, 128, 1, 4096, 4096, 4096, 4096, 4096]
    - [104, 12.035]
  - - [4096, 128, 1, 8192, 4096, 4096, 4096, 8192]
    - [16, 12.705]
  - - [4096, 256, 1, 128, 4096, 4096, 4096, 128]
    - [20, 3.57]
  - - [4096, 256, 1, 256, 4096, 4096, 4096, 256]
    - [106, 5.907]
  - - [4096, 256, 1, 512, 4096, 4096, 4096, 512]
    - [20, 8.994]
  - - [4096, 256, 1, 1024, 4096, 4096, 4096, 1024]
    - [110, 11.914]
  - - [4096, 256, 1, 2048, 4096, 4096, 4096, 2048]
    - [109, 13.589]
  - - [4096, 256, 1, 4096, 4096, 4096, 4096, 4096]
    - [93, 13.951]
  - - [4096, 256, 1, 8192, 4096, 4096, 4096, 8192]
    - [93, 16.229]
  - - [4096, 512, 1, 128, 4096, 4096, 4096, 128]
    - [15, 5.421]
  - - [4096, 512, 1, 256, 4096, 4096, 4096, 256]
    - [14, 8.761]
  - - [4096, 512, 1, 512, 4096, 4096, 4096, 512]
    - [14, 12.74]
  - - [4096, 512, 1, 1024, 4096, 4096, 4096, 1024]
    - [102, 16.115]
  - - [4096, 512, 1, 2048, 4096, 4096, 4096, 2048]
    - [95, 17.152]
  - - [4096, 512, 1, 4096, 4096, 4096, 4096, 4096]
    - [85, 16.457]
  - - [4096, 512, 1, 8192, 4096, 4096, 4096, 8192]
    - [75, 18.037]
  - - [4096, 1024, 1, 128, 4096, 4096, 4096, 128]
    - [8, 7.411]
  - - [4096, 1024, 1, 256, 4096, 4096, 4096, 256]
    - [63, 11.346]
  - - [4096, 1024, 1, 512, 4096, 4096, 4096, 512]
    - [65, 15.183]
  - - [4096, 1024, 1, 1024, 4096, 4096, 4096, 1024]
    - [69, 17.37]
  - - [4096, 1024, 1, 2048, 4096, 4096, 4096, 2048]
    - [87, 19.118]
  - - [4096, 1024, 1, 4096, 4096, 4096, 4096, 4096]
    - [74, 18.313]
  - - [4096, 1024, 1, 8192, 4096, 4096, 4096, 8192]
    - [43, 20.519]
  - - [4096, 2048, 1, 128, 4096, 4096, 4096, 128]
    - [56, 9.818]
  - - [4096, 2048, 1, 256, 4096, 4096, 4096, 256]
    - [56, 13.785]
  - - [4096, 2048, 1, 512, 4096, 4096, 4096, 512]
    - [56, 16.88]
  - - [4096, 2048, 1, 1024, 4096, 4096, 4096, 1024]
    - [48, 19.899]
  - - [4096, 2048, 1, 2048, 4096, 4096, 4096, 2048]
    - [77, 21.12]
  - - [4096, 2048, 1, 4096, 4096, 4096, 4096, 4096]
    - [72, 20.607]
  - - [4096, 2048, 1, 8192, 4096, 4096, 4096, 8192]
    - [1, 23.827]
  - - [4096, 4096, 1, 128, 4096, 4096, 4096, 128]
    - [0, 8.923]
  - - [4096, 4096, 1, 256, 4096, 4096, 4096, 256]
    - [36, 13.178]
  - - [4096, 4096, 1, 512, 4096, 4096, 4096, 512]
    - [31, 17.605]
  - - [4096, 4096, 1, 1024, 4096, 4096, 4096, 1024]
    - [38, 21.219]
  - - [4096, 4096, 1, 2048, 4096, 4096, 4096, 2048]
    - [34, 21.051]
  - - [4096, 4096, 1, 4096, 4096, 4096, 4096, 4096]
    - [41, 24.099]
  - - [4096, 4096, 1, 8192, 4096, 4096, 4096, 8192]
    - [1, 25.014]
  - - [4096, 8192, 1, 128, 4096, 4096, 4096, 128]
    - [53, 8.856]
  - - [4096, 8192, 1, 256, 4096, 4096, 4096, 256]
    - [49, 12.091]
  - - [4096, 8192, 1, 512, 4096, 4096, 4096, 512]
    - [53, 16.509]
  - - [4096, 8192, 1, 1024, 4096, 4096, 4096, 1024]
    - [51, 20.133]
  - - [4096, 8192, 1, 2048, 4096, 4096, 4096, 2048]
    - [34, 23.855]
  - - [4096, 8192, 1, 4096, 4096, 4096, 4096, 4096]
    - [72, 24.527]
  - - [4096, 8192, 1, 8192, 4096, 4096, 4096, 8192]
    - [3, 27.035]
  - - [8192, 128, 1, 128, 8192, 8192, 8192, 128]
    - [21, 3.52]
  - - [8192, 128, 1, 256, 8192, 8192, 8192, 256]
    - [20, 5.89]
  - - [8192, 128, 1, 512, 8192, 8192, 8192, 512]
    - [20, 8.761]
  - - [8192, 128, 1, 1024, 8192, 8192, 8192, 1024]
    - [107, 11.485]
  - - [8192, 128, 1, 2048, 8192, 8192, 8192, 2048]
    - [110, 13.239]
  - - [8192, 128, 1, 4096, 8192, 8192, 8192, 4096]
    - [13, 14.651]
  - - [8192, 128, 1, 8192, 8192, 8192, 8192, 8192]
    - [96, 16.181]
  - - [8192, 256, 1, 128, 8192, 8192, 8192, 128]
    - [13, 5.396]
  - - [8192, 256, 1, 256, 8192, 8192, 8192, 256]
    - [14, 8.8]
  - - [8192, 256, 1, 512, 8192, 8192, 8192, 512]
    - [101, 12.68]
  - - [8192, 256, 1, 1024, 8192, 8192, 8192, 1024]
    - [100, 15.777]
  - - [8192, 256, 1, 2048, 8192, 8192, 8192, 2048]
    - [94, 16.754]
  - - [8192, 256, 1, 4096, 8192, 8192, 8192, 4096]
    - [83, 17.063]
  - - [8192, 256, 1, 8192, 8192, 8192, 8192, 8192]
    - [11, 18.372]
  - - [8192, 512, 1, 128, 8192, 8192, 8192, 128]
    - [7, 7.351]
  - - [8192, 512, 1, 256, 8192, 8192, 8192, 256]
    - [64, 11.403]
  - - [8192, 512, 1, 512, 8192, 8192, 8192, 512]
    - [64, 15.497]
  - - [8192, 512, 1, 1024, 8192, 8192, 8192, 1024]
    - [68, 17.637]
  - - [8192, 512, 1, 2048, 8192, 8192, 8192, 2048]
    - [90, 18.954]
  - - [8192, 512, 1, 4096, 8192, 8192, 8192, 4096]
    - [73, 18.514]
  - - [8192, 512, 1, 8192, 8192, 8192, 8192, 8192]
    - [35, 21.04]
  - - [8192, 1024, 1, 128, 8192, 8192, 8192, 128]
    - [58, 9.461]
  - - [8192, 1024, 1, 256, 8192, 8192, 8192, 256]
    - [58, 13.767]
  - - [8192, 1024, 1, 512, 8192, 8192, 8192, 512]
    - [56, 17.139]
  - - [8192, 1024, 1, 1024, 8192, 8192, 8192, 1024]
    - [55, 19.948]
  - - [8192, 1024, 1, 2048, 8192, 8192, 8192, 2048]
    - [76, 20.7]
  - - [8192, 1024, 1, 4096, 8192, 8192, 8192, 4096]
    - [44, 20.712]
  - - [8192, 1024, 1, 8192, 8192, 8192, 8192, 8192]
    - [32, 23.525]
  - - [8192, 2048, 1, 128, 8192, 8192, 8192, 128]
    - [0, 8.903]
  - - [8192, 2048, 1, 256, 8192, 8192, 8192, 256]
    - [33, 12.982]
  - - [8192, 2048, 1, 512, 8192, 8192, 8192, 512]
    - [31, 17.356]
  - - [8192, 2048, 1, 1024, 8192, 8192, 8192, 1024]
    - [39, 20.723]
  - - [8192, 2048, 1, 2048, 8192, 8192, 8192, 2048]
    - [48, 21.004]
  - - [8192, 2048, 1, 4096, 8192, 8192, 8192, 4096]
    - [42, 24.085]
  - - [8192, 2048, 1, 8192, 8192, 8192, 8192, 8192]
    - [30, 24.733]
  - - [8192, 4096, 1, 128, 8192, 8192, 8192, 128]
    - [55, 8.932]
  - - [8192, 4096, 1, 256, 8192, 8192, 8192, 256]
    - [57, 11.975]
  - - [8192, 4096, 1, 512, 8192, 8192, 8192, 512]
    - [52, 15.906]
  - - [8192, 4096, 1, 1024, 8192, 8192, 8192, 1024]
    - [51, 20.106]
  - - [8192, 4096, 1, 2048, 8192, 8192, 8192, 2048]
    - [32, 24.122]
  - - [8192, 4096, 1, 4096, 8192, 8192, 8192, 4096]
    - [30, 25.66]
  - - [8192, 4096, 1, 8192, 8192, 8192, 8192, 8192]
    - [35, 27.048]
  - - [8192, 8192, 1, 128, 8192, 8192, 8192, 128]
    - [51, 8.029]
  - - [8192, 8192, 1, 256, 8192, 8192, 8192, 256]
    - [49, 12.494]
  - - [8192, 8192, 1, 512, 8192, 8192, 8192, 512]
    - [49, 16.957]
  - - [8192, 8192, 1, 1024, 8192, 8192, 8192, 1024]
    - [57, 21.568]
  - - [8192, 8192, 1, 2048, 8192, 8192, 8192, 2048]
    - [37, 25.27]
  - - [8192, 8192, 1, 4096, 8192, 8192, 8192, 4096]
    - [30, 27.846]
  - - [8192, 8192, 1, 8192, 8192, 8192, 8192, 8192]
    - [40, 28.086]
  - - [1, 1, 1, 32, 1, 1, 1, 32]
    - [119, 0.0]
- null
- null
- DeviceEfficiency
- GridBased
