library/src/amd_detail/rocblaslt/src/Tensile/Logic/streamk/gfx942a/aquavanjaram942_Cijk_Alik_Bjlk_BSS_BH_UserArgs.yaml
- {MinimumRequiredVersion: 4.33.0}
- aquavanjaram942
- gfx942
- [Device 0049, Device 0050]
    SolutionIndex: 0
    SolutionNameMin: Cijk_Alik_Bjlk_BSS_BH_UserArgs_MT256x256x32_MI16x16x1_SN_LDSB1_CLR1_GSU0_GSUC0_GSUWGMRR0_K1_LBSPPA256_LBSPPB2048_LPB32_MIWT8_8_PLR1_SU32_SUM0_SUS256_SKXCCM0_VWA4_VWB2_WGM1_WGMXCC1_WGMXCCGn1
    SolutionIndex: 1
    SolutionNameMin: Cijk_Alik_Bjlk_BSS_BH_UserArgs_MT256x256x32_MI16x16x1_SN_LDSB1_CLR1_GSU0_GSUC0_GSUWGMRR0_K1_LBSPPA256_LBSPPB2048_LPB0_MIWT8_8_PLR1_SU32_SUM0_SUS256_SKXCCM0_VWA4_VWB8_WGM1_WGMXCC1_WGMXCCGn1
    SolutionIndex: 2
    SolutionNameMin: Cijk_Alik_Bjlk_BSS_BH_UserArgs_MT256x256x32_MI16x16x1_SN_LDSB1_CLR1_GSU0_GSUC0_GSUWGMRR0_K1_LBSPPA256_LBSPPB2048_LPB0_MIWT8_8_PLR1_SU32_SUM0_SUS256_SKXCCM0_VWA4_VWB4_WGM4_WGMXCC1_WGMXCCGn1
    SolutionIndex: 3
    SolutionNameMin: Cijk_Alik_Bjlk_BSS_BH_UserArgs_MT256x256x32_MI16x16x1_SN_LDSB1_CLR1_GSU0_GSUC0_GSUWGMRR0_K1_LBSPPA256_LBSPPB2048_LPB0_MIWT8_8_PLR1_SU32_SUM0_SUS256_SKXCCM0_VWA4_VWB8_WGM4_WGMXCC1_WGMXCCGn1
    SolutionIndex: 4
    SolutionNameMin: Cijk_Alik_Bjlk_BSS_BH_UserArgs_MT256x256x32_MI16x16x1_SN_LDSB1_CLR1_GSU0_GSUC0_GSUWGMRR0_K1_LBSPPA256_LBSPPB2048_LPB0_MIWT8_8_PLR1_SU32_SUM0_SUS256_SKXCCM0_VWA4_VWB8_WGM8_WGMXCC1_WGMXCCGn1
    SolutionIndex: 5
    SolutionNameMin: Cijk_Alik_Bjlk_BSS_BH_UserArgs_MT128x256x32_MI16x16x1_SN_LDSB1_CLR1_GSU0_GSUC0_GSUWGMRR0_K1_LBSPPA256_LBSPPB2048_LPB32_MIWT4_8_PLR1_SU32_SUM0_SUS256_SKXCCM0_VWA4_VWB2_WGM1_WGMXCC1_WGMXCCGn1
    SolutionIndex: 6
    SolutionNameMin: Cijk_Alik_Bjlk_BSS_BH_UserArgs_MT128x256x32_MI16x16x1_SN_LDSB1_CLR1_GSU0_GSUC0_GSUWGMRR0_K1_LBSPPA256_LBSPPB2048_LPB0_MIWT4_8_PLR1_SU32_SUM0_SUS256_SKXCCM0_VWA4_VWB4_WGM1_WGMXCC1_WGMXCCGn1
    SolutionIndex: 7
    SolutionNameMin: Cijk_Alik_Bjlk_BSS_BH_UserArgs_MT128x256x32_MI16x16x1_SN_LDSB1_CLR1_GSU0_GSUC0_GSUWGMRR0_K1_LBSPPA128_LBSPPB2048_LPB0_MIWT4_8_PLR1_SU32_SUM0_SUS256_SKXCCM0_VWA1_VWB8_WGM1_WGMXCC1_WGMXCCGn1
    SolutionIndex: 8
    SolutionNameMin: Cijk_Alik_Bjlk_BSS_BH_UserArgs_MT128x256x32_MI16x16x1_SN_LDSB1_CLR1_GSU0_GSUC0_GSUWGMRR0_K1_LBSPPA256_LBSPPB2048_LPB0_MIWT4_8_PLR1_SU32_SUM0_SUS256_SKXCCM0_VWA4_VWB8_WGM1_WGMXCC1_WGMXCCGn1
    SolutionIndex: 9
    SolutionNameMin: Cijk_Alik_Bjlk_BSS_BH_UserArgs_MT128x128x32_MI16x16x1_SN_LDSB1_CLR1_GSU0_GSUC0_GSUWGMRR0_K1_LBSPPA128_LBSPPB1024_LPB32_MIWT4_4_PLR1_SU32_SUM0_SUS256_SKXCCM0_VWA1_VWB2_WGM1_WGMXCC1_WGMXCCGn1
    SolutionIndex: 10
    SolutionNameMin: Cijk_Alik_Bjlk_BSS_BH_UserArgs_MT64x64x32_MI16x16x1_SN_LDSB0_CLR1_GSU0_GSUC0_GSUWGMRR0_K1_LBSPPA128_LBSPPB512_LPB32_MIWT2_2_PLR1_SU32_SUM0_SUS256_SKXCCM0_VWA1_VWB2_WGM1_WGMXCC1_WGMXCCGn1
    SolutionIndex: 11
    SolutionNameMin: Cijk_Alik_Bjlk_BSS_BH_UserArgs_MT256x128x64_MI16x16x1_SN_LDSB1_CLR1_GSU0_GSUC0_GSUWGMRR0_K1_LBSPPA512_LBSPPB2048_LPB0_MIWT8_4_PLR1_SU32_SUM0_SUS256_SKXCCM0_VWA4_VWB4_WGM8_WGMXCC1_WGMXCCGn1
    SolutionIndex: 12
    SolutionNameMin: Cijk_Alik_Bjlk_BSS_BH_UserArgs_MT128x128x64_MI16x16x1_SN_LDSB1_CLR1_GSU0_GSUC0_GSUWGMRR0_K1_LBSPPA512_LBSPPB2048_LPB0_MIWT4_4_PLR1_SU32_SUM0_SUS256_SKXCCM0_VWA4_VWB4_WGM8_WGMXCC1_WGMXCCGn1
    SolutionIndex: 13
    SolutionNameMin: Cijk_Alik_Bjlk_BSS_BH_UserArgs_MT64x128x64_MI16x16x1_SN_LDSB1_CLR1_GSU0_GSUC0_GSUWGMRR0_K1_LBSPPA128_LBSPPB2048_LPB0_MIWT2_4_PLR1_SU32_SUM0_SUS256_SKXCCM0_VWA1_VWB4_WGM1_WGMXCC1_WGMXCCGn1
    SolutionIndex: 14
    SolutionNameMin: Cijk_Alik_Bjlk_BSS_BH_UserArgs_MT64x128x64_MI16x16x1_SN_LDSB1_CLR1_GSU0_GSUC0_GSUWGMRR0_K1_LBSPPA256_LBSPPB2048_LPB0_MIWT2_4_PLR1_SU32_SUM0_SUS256_SKXCCM0_VWA2_VWB4_WGM1_WGMXCC1_WGMXCCGn1
    SolutionIndex: 15
    SolutionNameMin: Cijk_Alik_Bjlk_BSS_BH_UserArgs_MT64x128x64_MI16x16x1_SN_LDSB1_CLR1_GSU0_GSUC0_GSUWGMRR0_K1_LBSPPA128_LBSPPB2048_LPB0_MIWT2_4_PLR1_SU32_SUM0_SUS256_SKXCCM0_VWA1_VWB4_WGM4_WGMXCC1_WGMXCCGn1
    SolutionIndex: 16
    SolutionNameMin: Cijk_Alik_Bjlk_BSS_BH_UserArgs_MT64x128x64_MI16x16x1_SN_LDSB1_CLR1_GSU0_GSUC0_GSUWGMRR0_K1_LBSPPA128_LBSPPB2048_LPB0_MIWT2_4_PLR1_SU32_SUM0_SUS256_SKXCCM0_VWA1_VWB4_WGM8_WGMXCC1_WGMXCCGn1
    SolutionIndex: 17
    SolutionNameMin: Cijk_Alik_Bjlk_BSS_BH_UserArgs_MT128x64x64_MI16x16x1_SN_LDSB1_CLR1_GSU0_GSUC0_GSUWGMRR0_K1_LBSPPA512_LBSPPB1024_LPB16_MIWT4_2_PLR1_SU32_SUM0_SUS256_SKXCCM0_VWA4_VWB1_WGM1_WGMXCC1_WGMXCCGn1
    SolutionIndex: 18
    SolutionNameMin: Cijk_Alik_Bjlk_BSS_BH_UserArgs_MT128x64x64_MI16x16x1_SN_LDSB1_CLR1_GSU0_GSUC0_GSUWGMRR0_K1_LBSPPA512_LBSPPB1024_LPB32_MIWT4_2_PLR1_SU32_SUM0_SUS256_SKXCCM0_VWA4_VWB2_WGM1_WGMXCC1_WGMXCCGn1
    SolutionIndex: 19
    SolutionNameMin: Cijk_Alik_Bjlk_BSS_BH_UserArgs_MT128x64x64_MI16x16x1_SN_LDSB1_CLR1_GSU0_GSUC0_GSUWGMRR0_K1_LBSPPA512_LBSPPB1024_LPB16_MIWT4_2_PLR1_SU32_SUM0_SUS256_SKXCCM0_VWA4_VWB1_WGM4_WGMXCC1_WGMXCCGn1
    SolutionIndex: 20
    SolutionNameMin: Cijk_Alik_Bjlk_BSS_BH_UserArgs_MT128x64x64_MI16x16x1_SN_LDSB1_CLR1_GSU0_GSUC0_GSUWGMRR0_K1_LBSPPA128_LBSPPB1024_LPB32_MIWT4_2_PLR1_SU32_SUM0_SUS256_SKXCCM0_VWA1_VWB2_WGM4_WGMXCC1_WGMXCCGn1
    SolutionIndex: 21
    SolutionNameMin: Cijk_Alik_Bjlk_BSS_BH_UserArgs_MT128x64x64_MI16x16x1_SN_LDSB1_CLR1_GSU0_GSUC0_GSUWGMRR0_K1_LBSPPA512_LBSPPB1024_LPB32_MIWT4_2_PLR1_SU32_SUM0_SUS256_SKXCCM0_VWA4_VWB2_WGM8_WGMXCC1_WGMXCCGn1
    SolutionIndex: 22
    SolutionNameMin: Cijk_Alik_Bjlk_BSS_BH_UserArgs_MT64x64x64_MI16x16x1_SN_LDSB1_CLR1_GSU0_GSUC0_GSUWGMRR0_K1_LBSPPA128_LBSPPB1024_LPB32_MIWT2_2_PLR1_SU32_SUM0_SUS256_SKXCCM0_VWA1_VWB2_WGM1_WGMXCC1_WGMXCCGn1
    SolutionIndex: 23
    SolutionNameMin: Cijk_Alik_Bjlk_BSS_BH_UserArgs_MT64x64x64_MI16x16x1_SN_LDSB1_CLR1_GSU0_GSUC0_GSUWGMRR0_K1_LBSPPA128_LBSPPB1024_LPB32_MIWT2_2_PLR1_SU32_SUM0_SUS256_SKXCCM0_VWA1_VWB2_WGM4_WGMXCC1_WGMXCCGn1
    SolutionIndex: 24
    SolutionNameMin: Cijk_Alik_Bjlk_BSS_BH_UserArgs_MT64x64x64_MI16x16x1_SN_LDSB1_CLR1_GSU0_GSUC0_GSUWGMRR0_K1_LBSPPA128_LBSPPB1024_LPB32_MIWT2_2_PLR1_SU32_SUM0_SUS256_SKXCCM0_VWA1_VWB2_WGM8_WGMXCC1_WGMXCCGn1
    SolutionIndex: 25
    SolutionNameMin: Cijk_Alik_Bjlk_BSS_BH_UserArgs_MT32x64x64_MI16x16x1_SN_LDSB0_CLR1_GSU0_GSUC0_GSUWGMRR0_K1_LBSPPA128_LBSPPB1024_LPB32_MIWT1_2_PLR1_SU32_SUM0_SUS256_SKXCCM0_VWA1_VWB2_WGM1_WGMXCC1_WGMXCCGn1
    SolutionIndex: 26
    SolutionNameMin: Cijk_Alik_Bjlk_BSS_BH_UserArgs_MT32x32x64_MI16x16x1_SN_LDSB0_CLR1_GSU0_GSUC0_GSUWGMRR0_K1_LBSPPA128_LBSPPB512_LPB16_MIWT1_1_PLR1_SU32_SUM0_SUS256_SKXCCM0_VWA1_VWB1_WGM1_WGMXCC1_WGMXCCGn1
    SolutionIndex: 27
    SolutionNameMin: Cijk_Alik_Bjlk_BSS_BH_UserArgs_MT64x64x128_MI16x16x1_SN_LDSB1_CLR1_GSU0_GSUC0_GSUWGMRR0_K1_LBSPPA256_LBSPPB1024_LPB32_MIWT2_2_PLR2_SU32_SUM0_SUS256_SKXCCM0_VWA1_VWB2_WGM1_WGMXCC1_WGMXCCGn1
    SolutionIndex: 28
    SolutionNameMin: Cijk_Alik_Bjlk_BSS_BH_UserArgs_MT32x64x128_MI16x16x1_SN_LDSB1_CLR1_GSU0_GSUC0_GSUWGMRR0_K1_LBSPPA256_LBSPPB1024_LPB32_MIWT1_2_PLR2_SU32_SUM0_SUS256_SKXCCM0_VWA1_VWB2_WGM1_WGMXCC1_WGMXCCGn1
    SolutionIndex: 29
    SolutionNameMin: Cijk_Alik_Bjlk_BSS_BH_UserArgs_MT64x32x128_MI16x16x1_SN_LDSB1_CLR1_GSU0_GSUC0_GSUWGMRR0_K1_LBSPPA256_LBSPPB512_LPB16_MIWT2_1_PLR2_SU32_SUM0_SUS256_SKXCCM0_VWA1_VWB1_WGM1_WGMXCC1_WGMXCCGn1
    SolutionIndex: 30
    SolutionNameMin: Cijk_Alik_Bjlk_BSS_BH_UserArgs_MT32x32x128_MI16x16x1_SN_LDSB1_CLR1_GSU0_GSUC0_GSUWGMRR0_K1_LBSPPA256_LBSPPB512_LPB16_MIWT1_1_PLR1_SU32_SUM0_SUS256_SKXCCM0_VWA1_VWB1_WGM1_WGMXCC1_WGMXCCGn1
    SolutionIndex: 31
    SolutionNameMin: Cijk_Alik_Bjlk_BSS_BH_UserArgs_MT32x32x128_MI16x16x1_SN_LDSB1_CLR1_GSU0_GSUC0_GSUWGMRR0_K1_LBSPPA256_LBSPPB512_LPB16_MIWT1_1_PLR2_SU32_SUM0_SUS256_SKXCCM0_VWA1_VWB1_WGM1_WGMXCC1_WGMXCCGn1
    SolutionIndex: 32
    SolutionNameMin: Cijk_Alik_Bjlk_BSS_BH_UserArgs_MT256x256x32_MI16x16x1_SN_LDSB1_CLR1_GSU0_GSUC0_GSUWGMRR0_K1_LBSPPA256_LBSPPB2048_LPB32_MIWT8_8_PLR1_SU32_SUM0_SUS256_SKXCCM6_VWA4_VWB2_WGM1_WGMXCC1_WGMXCCGn1
    SolutionIndex: 33
    SolutionNameMin: Cijk_Alik_Bjlk_BSS_BH_UserArgs_MT256x256x32_MI16x16x1_SN_LDSB1_CLR1_GSU0_GSUC0_GSUWGMRR0_K1_LBSPPA256_LBSPPB2048_LPB0_MIWT8_8_PLR1_SU32_SUM0_SUS256_SKXCCM6_VWA4_VWB4_WGM1_WGMXCC1_WGMXCCGn1
    SolutionIndex: 34
    SolutionNameMin: Cijk_Alik_Bjlk_BSS_BH_UserArgs_MT256x256x32_MI16x16x1_SN_LDSB1_CLR1_GSU0_GSUC0_GSUWGMRR0_K1_LBSPPA256_LBSPPB2048_LPB0_MIWT8_8_PLR1_SU32_SUM0_SUS256_SKXCCM6_VWA4_VWB8_WGM1_WGMXCC1_WGMXCCGn1
    SolutionIndex: 35
    SolutionNameMin: Cijk_Alik_Bjlk_BSS_BH_UserArgs_MT256x256x32_MI16x16x1_SN_LDSB1_CLR1_GSU0_GSUC0_GSUWGMRR0_K1_LBSPPA256_LBSPPB2048_LPB0_MIWT8_8_PLR1_SU32_SUM0_SUS256_SKXCCM6_VWA4_VWB4_WGM4_WGMXCC1_WGMXCCGn1
    SolutionIndex: 36
    SolutionNameMin: Cijk_Alik_Bjlk_BSS_BH_UserArgs_MT256x256x32_MI16x16x1_SN_LDSB1_CLR1_GSU0_GSUC0_GSUWGMRR0_K1_LBSPPA128_LBSPPB2048_LPB0_MIWT8_8_PLR1_SU32_SUM0_SUS256_SKXCCM6_VWA1_VWB8_WGM4_WGMXCC1_WGMXCCGn1
    SolutionIndex: 37
    SolutionNameMin: Cijk_Alik_Bjlk_BSS_BH_UserArgs_MT256x256x32_MI16x16x1_SN_LDSB1_CLR1_GSU0_GSUC0_GSUWGMRR0_K1_LBSPPA128_LBSPPB2048_LPB0_MIWT8_8_PLR1_SU32_SUM0_SUS256_SKXCCM6_VWA2_VWB8_WGM4_WGMXCC1_WGMXCCGn1
    SolutionIndex: 38
    SolutionNameMin: Cijk_Alik_Bjlk_BSS_BH_UserArgs_MT256x256x32_MI16x16x1_SN_LDSB1_CLR1_GSU0_GSUC0_GSUWGMRR0_K1_LBSPPA256_LBSPPB2048_LPB0_MIWT8_8_PLR1_SU32_SUM0_SUS256_SKXCCM6_VWA4_VWB8_WGM4_WGMXCC1_WGMXCCGn1
    SolutionIndex: 39
    SolutionNameMin: Cijk_Alik_Bjlk_BSS_BH_UserArgs_MT256x256x32_MI16x16x1_SN_LDSB1_CLR1_GSU0_GSUC0_GSUWGMRR0_K1_LBSPPA256_LBSPPB2048_LPB16_MIWT8_8_PLR1_SU32_SUM0_SUS256_SKXCCM6_VWA4_VWB1_WGM8_WGMXCC1_WGMXCCGn1
    SolutionIndex: 40
    SolutionNameMin: Cijk_Alik_Bjlk_BSS_BH_UserArgs_MT256x256x32_MI16x16x1_SN_LDSB1_CLR1_GSU0_GSUC0_GSUWGMRR0_K1_LBSPPA256_LBSPPB2048_LPB32_MIWT8_8_PLR1_SU32_SUM0_SUS256_SKXCCM6_VWA4_VWB2_WGM8_WGMXCC1_WGMXCCGn1
    SolutionIndex: 41
    SolutionNameMin: Cijk_Alik_Bjlk_BSS_BH_UserArgs_MT256x256x32_MI16x16x1_SN_LDSB1_CLR1_GSU0_GSUC0_GSUWGMRR0_K1_LBSPPA256_LBSPPB2048_LPB0_MIWT8_8_PLR1_SU32_SUM0_SUS256_SKXCCM6_VWA4_VWB4_WGM8_WGMXCC1_WGMXCCGn1
    SolutionIndex: 42
    SolutionNameMin: Cijk_Alik_Bjlk_BSS_BH_UserArgs_MT256x256x32_MI16x16x1_SN_LDSB1_CLR1_GSU0_GSUC0_GSUWGMRR0_K1_LBSPPA256_LBSPPB2048_LPB0_MIWT8_8_PLR1_SU32_SUM0_SUS256_SKXCCM6_VWA4_VWB8_WGM8_WGMXCC1_WGMXCCGn1
    SolutionIndex: 43
    SolutionNameMin: Cijk_Alik_Bjlk_BSS_BH_UserArgs_MT128x256x32_MI16x16x1_SN_LDSB1_CLR1_GSU0_GSUC0_GSUWGMRR0_K1_LBSPPA256_LBSPPB2048_LPB0_MIWT4_8_PLR1_SU32_SUM0_SUS256_SKXCCM6_VWA4_VWB4_WGM1_WGMXCC1_WGMXCCGn1
    SolutionIndex: 44
    SolutionNameMin: Cijk_Alik_Bjlk_BSS_BH_UserArgs_MT128x256x32_MI16x16x1_SN_LDSB1_CLR1_GSU0_GSUC0_GSUWGMRR0_K1_LBSPPA128_LBSPPB2048_LPB0_MIWT4_8_PLR1_SU32_SUM0_SUS256_SKXCCM6_VWA1_VWB8_WGM1_WGMXCC1_WGMXCCGn1
    SolutionIndex: 45
    SolutionNameMin: Cijk_Alik_Bjlk_BSS_BH_UserArgs_MT128x256x32_MI16x16x1_SN_LDSB1_CLR1_GSU0_GSUC0_GSUWGMRR0_K1_LBSPPA256_LBSPPB2048_LPB0_MIWT4_8_PLR1_SU32_SUM0_SUS256_SKXCCM6_VWA4_VWB8_WGM1_WGMXCC1_WGMXCCGn1
    SolutionIndex: 46
    SolutionNameMin: Cijk_Alik_Bjlk_BSS_BH_UserArgs_MT128x256x32_MI16x16x1_SN_LDSB1_CLR1_GSU0_GSUC0_GSUWGMRR0_K1_LBSPPA256_LBSPPB2048_LPB32_MIWT4_8_PLR1_SU32_SUM0_SUS256_SKXCCM6_VWA4_VWB2_WGM4_WGMXCC1_WGMXCCGn1
    SolutionIndex: 47
    SolutionNameMin: Cijk_Alik_Bjlk_BSS_BH_UserArgs_MT128x256x32_MI16x16x1_SN_LDSB1_CLR1_GSU0_GSUC0_GSUWGMRR0_K1_LBSPPA128_LBSPPB2048_LPB0_MIWT4_8_PLR1_SU32_SUM0_SUS256_SKXCCM6_VWA1_VWB4_WGM4_WGMXCC1_WGMXCCGn1
    SolutionIndex: 48
    SolutionNameMin: Cijk_Alik_Bjlk_BSS_BH_UserArgs_MT128x256x32_MI16x16x1_SN_LDSB1_CLR1_GSU0_GSUC0_GSUWGMRR0_K1_LBSPPA256_LBSPPB2048_LPB0_MIWT4_8_PLR1_SU32_SUM0_SUS256_SKXCCM6_VWA4_VWB4_WGM4_WGMXCC1_WGMXCCGn1
    SolutionIndex: 49
    SolutionNameMin: Cijk_Alik_Bjlk_BSS_BH_UserArgs_MT128x256x32_MI16x16x1_SN_LDSB1_CLR1_GSU0_GSUC0_GSUWGMRR0_K1_LBSPPA128_LBSPPB2048_LPB0_MIWT4_8_PLR1_SU32_SUM0_SUS256_SKXCCM6_VWA1_VWB8_WGM4_WGMXCC1_WGMXCCGn1
    SolutionIndex: 50
    SolutionNameMin: Cijk_Alik_Bjlk_BSS_BH_UserArgs_MT128x256x32_MI16x16x1_SN_LDSB1_CLR1_GSU0_GSUC0_GSUWGMRR0_K1_LBSPPA256_LBSPPB2048_LPB0_MIWT4_8_PLR1_SU32_SUM0_SUS256_SKXCCM6_VWA4_VWB8_WGM4_WGMXCC1_WGMXCCGn1
    SolutionIndex: 51
    SolutionNameMin: Cijk_Alik_Bjlk_BSS_BH_UserArgs_MT128x256x32_MI16x16x1_SN_LDSB1_CLR1_GSU0_GSUC0_GSUWGMRR0_K1_LBSPPA256_LBSPPB2048_LPB32_MIWT4_8_PLR1_SU32_SUM0_SUS256_SKXCCM6_VWA4_VWB2_WGM8_WGMXCC1_WGMXCCGn1
    SolutionIndex: 52
    SolutionNameMin: Cijk_Alik_Bjlk_BSS_BH_UserArgs_MT128x256x32_MI16x16x1_SN_LDSB1_CLR1_GSU0_GSUC0_GSUWGMRR0_K1_LBSPPA256_LBSPPB2048_LPB0_MIWT4_8_PLR1_SU32_SUM0_SUS256_SKXCCM6_VWA4_VWB4_WGM8_WGMXCC1_WGMXCCGn1
    SolutionIndex: 53
    SolutionNameMin: Cijk_Alik_Bjlk_BSS_BH_UserArgs_MT64x256x32_MI16x16x1_SN_LDSB1_CLR1_GSU0_GSUC0_GSUWGMRR0_K1_LBSPPA128_LBSPPB2048_LPB0_MIWT2_8_PLR1_SU32_SUM0_SUS256_SKXCCM6_VWA1_VWB8_WGM4_WGMXCC1_WGMXCCGn1
    SolutionIndex: 54
    SolutionNameMin: Cijk_Alik_Bjlk_BSS_BH_UserArgs_MT128x128x32_MI16x16x1_SN_LDSB1_CLR1_GSU0_GSUC0_GSUWGMRR0_K1_LBSPPA128_LBSPPB1024_LPB32_MIWT4_4_PLR1_SU32_SUM0_SUS256_SKXCCM6_VWA1_VWB2_WGM1_WGMXCC1_WGMXCCGn1
    SolutionIndex: 55
    SolutionNameMin: Cijk_Alik_Bjlk_BSS_BH_UserArgs_MT128x128x32_MI16x16x1_SN_LDSB1_CLR1_GSU0_GSUC0_GSUWGMRR0_K1_LBSPPA128_LBSPPB1024_LPB0_MIWT4_4_PLR1_SU32_SUM0_SUS256_SKXCCM6_VWA1_VWB4_WGM1_WGMXCC1_WGMXCCGn1
    SolutionIndex: 56
    SolutionNameMin: Cijk_Alik_Bjlk_BSS_BH_UserArgs_MT128x128x32_MI16x16x1_SN_LDSB1_CLR1_GSU0_GSUC0_GSUWGMRR0_K1_LBSPPA256_LBSPPB1024_LPB0_MIWT4_4_PLR1_SU32_SUM0_SUS256_SKXCCM6_VWA4_VWB4_WGM1_WGMXCC1_WGMXCCGn1
    SolutionIndex: 57
    SolutionNameMin: Cijk_Alik_Bjlk_BSS_BH_UserArgs_MT128x128x32_MI16x16x1_SN_LDSB1_CLR1_GSU0_GSUC0_GSUWGMRR0_K1_LBSPPA128_LBSPPB1024_LPB16_MIWT4_4_PLR1_SU32_SUM0_SUS256_SKXCCM6_VWA1_VWB1_WGM4_WGMXCC1_WGMXCCGn1
    SolutionIndex: 58
    SolutionNameMin: Cijk_Alik_Bjlk_BSS_BH_UserArgs_MT128x128x32_MI16x16x1_SN_LDSB1_CLR1_GSU0_GSUC0_GSUWGMRR0_K1_LBSPPA256_LBSPPB1024_LPB16_MIWT4_4_PLR1_SU32_SUM0_SUS256_SKXCCM6_VWA4_VWB1_WGM4_WGMXCC1_WGMXCCGn1
    SolutionIndex: 59
    SolutionNameMin: Cijk_Alik_Bjlk_BSS_BH_UserArgs_MT128x128x32_MI16x16x1_SN_LDSB1_CLR1_GSU0_GSUC0_GSUWGMRR0_K1_LBSPPA256_LBSPPB1024_LPB32_MIWT4_4_PLR1_SU32_SUM0_SUS256_SKXCCM6_VWA4_VWB2_WGM4_WGMXCC1_WGMXCCGn1
    SolutionIndex: 60
    SolutionNameMin: Cijk_Alik_Bjlk_BSS_BH_UserArgs_MT128x128x32_MI16x16x1_SN_LDSB1_CLR1_GSU0_GSUC0_GSUWGMRR0_K1_LBSPPA128_LBSPPB1024_LPB16_MIWT4_4_PLR1_SU32_SUM0_SUS256_SKXCCM6_VWA1_VWB1_WGM8_WGMXCC1_WGMXCCGn1
    SolutionIndex: 61
    SolutionNameMin: Cijk_Alik_Bjlk_BSS_BH_UserArgs_MT128x128x32_MI16x16x1_SN_LDSB1_CLR1_GSU0_GSUC0_GSUWGMRR0_K1_LBSPPA256_LBSPPB1024_LPB16_MIWT4_4_PLR1_SU32_SUM0_SUS256_SKXCCM6_VWA4_VWB1_WGM8_WGMXCC1_WGMXCCGn1
    SolutionIndex: 62
    SolutionNameMin: Cijk_Alik_Bjlk_BSS_BH_UserArgs_MT128x128x32_MI16x16x1_SN_LDSB1_CLR1_GSU0_GSUC0_GSUWGMRR0_K1_LBSPPA128_LBSPPB1024_LPB32_MIWT4_4_PLR1_SU32_SUM0_SUS256_SKXCCM6_VWA1_VWB2_WGM8_WGMXCC1_WGMXCCGn1
    SolutionIndex: 63
    SolutionNameMin: Cijk_Alik_Bjlk_BSS_BH_UserArgs_MT128x128x32_MI16x16x1_SN_LDSB1_CLR1_GSU0_GSUC0_GSUWGMRR0_K1_LBSPPA256_LBSPPB1024_LPB32_MIWT4_4_PLR1_SU32_SUM0_SUS256_SKXCCM6_VWA4_VWB2_WGM8_WGMXCC1_WGMXCCGn1
    SolutionIndex: 64
    SolutionNameMin: Cijk_Alik_Bjlk_BSS_BH_UserArgs_MT128x128x32_MI16x16x1_SN_LDSB1_CLR1_GSU0_GSUC0_GSUWGMRR0_K1_LBSPPA128_LBSPPB1024_LPB0_MIWT4_4_PLR1_SU32_SUM0_SUS256_SKXCCM6_VWA1_VWB4_WGM8_WGMXCC1_WGMXCCGn1
    SolutionIndex: 65
    SolutionNameMin: Cijk_Alik_Bjlk_BSS_BH_UserArgs_MT128x128x32_MI16x16x1_SN_LDSB1_CLR1_GSU0_GSUC0_GSUWGMRR0_K1_LBSPPA256_LBSPPB1024_LPB0_MIWT4_4_PLR1_SU32_SUM0_SUS256_SKXCCM6_VWA4_VWB4_WGM8_WGMXCC1_WGMXCCGn1
    SolutionIndex: 66
    SolutionNameMin: Cijk_Alik_Bjlk_BSS_BH_UserArgs_MT64x128x32_MI16x16x1_SN_LDSB0_CLR1_GSU0_GSUC0_GSUWGMRR0_K1_LBSPPA128_LBSPPB1024_LPB32_MIWT2_4_PLR1_SU32_SUM0_SUS256_SKXCCM6_VWA1_VWB2_WGM1_WGMXCC1_WGMXCCGn1
    SolutionIndex: 67
    SolutionNameMin: Cijk_Alik_Bjlk_BSS_BH_UserArgs_MT32x32x32_MI16x16x1_SN_LDSB0_CLR1_GSU0_GSUC0_GSUWGMRR0_K1_LBSPPA128_LBSPPB256_LPB16_MIWT1_1_PLR1_SU32_SUM0_SUS256_SKXCCM6_VWA1_VWB1_WGM1_WGMXCC1_WGMXCCGn1
    SolutionIndex: 68
    SolutionNameMin: Cijk_Alik_Bjlk_BSS_BH_UserArgs_MT32x32x32_MI16x16x1_SN_LDSB0_CLR0_GSU0_GSUC0_GSUWGMRR0_K1_LBSPPA128_LBSPPB256_LPB16_MIWT1_1_PLR0_SU32_SUM0_SUS256_SKXCCM6_VWA1_VWB1_WGM1_WGMXCC1_WGMXCCGn1
    SolutionIndex: 69
    SolutionNameMin: Cijk_Alik_Bjlk_BSS_BH_UserArgs_MT128x256x64_MI16x16x1_SN_LDSB1_CLR1_GSU0_GSUC0_GSUWGMRR0_K1_LBSPPA512_LBSPPB4096_LPB32_MIWT4_8_PLR1_SU32_SUM0_SUS256_SKXCCM6_VWA4_VWB2_WGM1_WGMXCC1_WGMXCCGn1
    SolutionIndex: 70
    SolutionNameMin: Cijk_Alik_Bjlk_BSS_BH_UserArgs_MT128x256x64_MI16x16x1_SN_LDSB1_CLR1_GSU0_GSUC0_GSUWGMRR0_K1_LBSPPA128_LBSPPB4096_LPB0_MIWT4_8_PLR1_SU32_SUM0_SUS256_SKXCCM6_VWA1_VWB4_WGM1_WGMXCC1_WGMXCCGn1
    SolutionIndex: 71
    SolutionNameMin: Cijk_Alik_Bjlk_BSS_BH_UserArgs_MT128x256x64_MI16x16x1_SN_LDSB1_CLR1_GSU0_GSUC0_GSUWGMRR0_K1_LBSPPA512_LBSPPB4096_LPB0_MIWT4_8_PLR1_SU32_SUM0_SUS256_SKXCCM6_VWA4_VWB4_WGM1_WGMXCC1_WGMXCCGn1
    SolutionIndex: 72
    SolutionNameMin: Cijk_Alik_Bjlk_BSS_BH_UserArgs_MT128x256x64_MI16x16x1_SN_LDSB1_CLR1_GSU0_GSUC0_GSUWGMRR0_K1_LBSPPA512_LBSPPB4096_LPB32_MIWT4_8_PLR1_SU32_SUM0_SUS256_SKXCCM6_VWA4_VWB2_WGM4_WGMXCC1_WGMXCCGn1
    SolutionIndex: 73
    SolutionNameMin: Cijk_Alik_Bjlk_BSS_BH_UserArgs_MT128x256x64_MI16x16x1_SN_LDSB1_CLR1_GSU0_GSUC0_GSUWGMRR0_K1_LBSPPA512_LBSPPB4096_LPB0_MIWT4_8_PLR1_SU32_SUM0_SUS256_SKXCCM6_VWA4_VWB4_WGM4_WGMXCC1_WGMXCCGn1
    SolutionIndex: 74
    SolutionNameMin: Cijk_Alik_Bjlk_BSS_BH_UserArgs_MT128x256x64_MI16x16x1_SN_LDSB1_CLR1_GSU0_GSUC0_GSUWGMRR0_K1_LBSPPA128_LBSPPB4096_LPB32_MIWT4_8_PLR1_SU32_SUM0_SUS256_SKXCCM6_VWA1_VWB2_WGM8_WGMXCC1_WGMXCCGn1
    SolutionIndex: 75
    SolutionNameMin: Cijk_Alik_Bjlk_BSS_BH_UserArgs_MT128x256x64_MI16x16x1_SN_LDSB1_CLR1_GSU0_GSUC0_GSUWGMRR0_K1_LBSPPA512_LBSPPB4096_LPB32_MIWT4_8_PLR1_SU32_SUM0_SUS256_SKXCCM6_VWA4_VWB2_WGM8_WGMXCC1_WGMXCCGn1
    SolutionIndex: 76
    SolutionNameMin: Cijk_Alik_Bjlk_BSS_BH_UserArgs_MT128x256x64_MI16x16x1_SN_LDSB1_CLR1_GSU0_GSUC0_GSUWGMRR0_K1_LBSPPA512_LBSPPB4096_LPB0_MIWT4_8_PLR1_SU32_SUM0_SUS256_SKXCCM6_VWA4_VWB4_WGM8_WGMXCC1_WGMXCCGn1
    SolutionIndex: 77
    SolutionNameMin: Cijk_Alik_Bjlk_BSS_BH_UserArgs_MT256x128x64_MI16x16x1_SN_LDSB1_CLR1_GSU0_GSUC0_GSUWGMRR0_K1_LBSPPA512_LBSPPB2048_LPB0_MIWT8_4_PLR1_SU32_SUM0_SUS256_SKXCCM6_VWA4_VWB4_WGM1_WGMXCC1_WGMXCCGn1
    SolutionIndex: 78
    SolutionNameMin: Cijk_Alik_Bjlk_BSS_BH_UserArgs_MT256x128x64_MI16x16x1_SN_LDSB1_CLR1_GSU0_GSUC0_GSUWGMRR0_K1_LBSPPA512_LBSPPB2048_LPB0_MIWT8_4_PLR1_SU32_SUM0_SUS256_SKXCCM6_VWA4_VWB4_WGM8_WGMXCC1_WGMXCCGn1
    SolutionIndex: 79
    SolutionNameMin: Cijk_Alik_Bjlk_BSS_BH_UserArgs_MT128x128x64_MI16x16x1_SN_LDSB1_CLR1_GSU0_GSUC0_GSUWGMRR0_K1_LBSPPA512_LBSPPB2048_LPB0_MIWT4_4_PLR1_SU32_SUM0_SUS256_SKXCCM6_VWA4_VWB4_WGM1_WGMXCC1_WGMXCCGn1
    SolutionIndex: 80
    SolutionNameMin: Cijk_Alik_Bjlk_BSS_BH_UserArgs_MT128x128x64_MI16x16x1_SN_LDSB1_CLR1_GSU0_GSUC0_GSUWGMRR0_K1_LBSPPA512_LBSPPB2048_LPB0_MIWT4_4_PLR1_SU32_SUM0_SUS256_SKXCCM6_VWA4_VWB4_WGM4_WGMXCC1_WGMXCCGn1
    SolutionIndex: 81
    SolutionNameMin: Cijk_Alik_Bjlk_BSS_BH_UserArgs_MT128x128x64_MI16x16x1_SN_LDSB1_CLR1_GSU0_GSUC0_GSUWGMRR0_K1_LBSPPA128_LBSPPB2048_LPB0_MIWT4_4_PLR1_SU32_SUM0_SUS256_SKXCCM6_VWA1_VWB4_WGM8_WGMXCC1_WGMXCCGn1
    SolutionIndex: 82
    SolutionNameMin: Cijk_Alik_Bjlk_BSS_BH_UserArgs_MT128x128x64_MI16x16x1_SN_LDSB1_CLR1_GSU0_GSUC0_GSUWGMRR0_K1_LBSPPA256_LBSPPB2048_LPB0_MIWT4_4_PLR1_SU32_SUM0_SUS256_SKXCCM6_VWA2_VWB4_WGM8_WGMXCC1_WGMXCCGn1
    SolutionIndex: 83
    SolutionNameMin: Cijk_Alik_Bjlk_BSS_BH_UserArgs_MT128x128x64_MI16x16x1_SN_LDSB1_CLR1_GSU0_GSUC0_GSUWGMRR0_K1_LBSPPA512_LBSPPB2048_LPB0_MIWT4_4_PLR1_SU32_SUM0_SUS256_SKXCCM6_VWA4_VWB4_WGM8_WGMXCC1_WGMXCCGn1
    SolutionIndex: 84
    SolutionNameMin: Cijk_Alik_Bjlk_BSS_BH_UserArgs_MT64x128x64_MI16x16x1_SN_LDSB1_CLR1_GSU0_GSUC0_GSUWGMRR0_K1_LBSPPA128_LBSPPB2048_LPB0_MIWT2_4_PLR1_SU32_SUM0_SUS256_SKXCCM6_VWA1_VWB4_WGM1_WGMXCC1_WGMXCCGn1
    SolutionIndex: 85
    SolutionNameMin: Cijk_Alik_Bjlk_BSS_BH_UserArgs_MT64x128x64_MI16x16x1_SN_LDSB1_CLR1_GSU0_GSUC0_GSUWGMRR0_K1_LBSPPA128_LBSPPB2048_LPB0_MIWT2_4_PLR1_SU32_SUM0_SUS256_SKXCCM6_VWA1_VWB4_WGM4_WGMXCC1_WGMXCCGn1
    SolutionIndex: 86
    SolutionNameMin: Cijk_Alik_Bjlk_BSS_BH_UserArgs_MT64x128x64_MI16x16x1_SN_LDSB1_CLR1_GSU0_GSUC0_GSUWGMRR0_K1_LBSPPA256_LBSPPB2048_LPB0_MIWT2_4_PLR1_SU32_SUM0_SUS256_SKXCCM6_VWA2_VWB4_WGM4_WGMXCC1_WGMXCCGn1
    SolutionIndex: 87
    SolutionNameMin: Cijk_Alik_Bjlk_BSS_BH_UserArgs_MT64x128x64_MI16x16x1_SN_LDSB1_CLR1_GSU0_GSUC0_GSUWGMRR0_K1_LBSPPA128_LBSPPB2048_LPB0_MIWT2_4_PLR1_SU32_SUM0_SUS256_SKXCCM6_VWA1_VWB4_WGM8_WGMXCC1_WGMXCCGn1
    SolutionIndex: 88
    SolutionNameMin: Cijk_Alik_Bjlk_BSS_BH_UserArgs_MT64x128x64_MI16x16x1_SN_LDSB1_CLR1_GSU0_GSUC0_GSUWGMRR0_K1_LBSPPA256_LBSPPB2048_LPB0_MIWT2_4_PLR1_SU32_SUM0_SUS256_SKXCCM6_VWA2_VWB4_WGM8_WGMXCC1_WGMXCCGn1
    SolutionIndex: 89
    SolutionNameMin: Cijk_Alik_Bjlk_BSS_BH_UserArgs_MT128x64x64_MI16x16x1_SN_LDSB1_CLR1_GSU0_GSUC0_GSUWGMRR0_K1_LBSPPA512_LBSPPB1024_LPB16_MIWT4_2_PLR1_SU32_SUM0_SUS256_SKXCCM6_VWA4_VWB1_WGM1_WGMXCC1_WGMXCCGn1
    SolutionIndex: 90
    SolutionNameMin: Cijk_Alik_Bjlk_BSS_BH_UserArgs_MT128x64x64_MI16x16x1_SN_LDSB1_CLR1_GSU0_GSUC0_GSUWGMRR0_K1_LBSPPA128_LBSPPB1024_LPB32_MIWT4_2_PLR1_SU32_SUM0_SUS256_SKXCCM6_VWA1_VWB2_WGM1_WGMXCC1_WGMXCCGn1
    SolutionIndex: 91
    SolutionNameMin: Cijk_Alik_Bjlk_BSS_BH_UserArgs_MT128x64x64_MI16x16x1_SN_LDSB1_CLR1_GSU0_GSUC0_GSUWGMRR0_K1_LBSPPA512_LBSPPB1024_LPB32_MIWT4_2_PLR1_SU32_SUM0_SUS256_SKXCCM6_VWA4_VWB2_WGM1_WGMXCC1_WGMXCCGn1
    SolutionIndex: 92
    SolutionNameMin: Cijk_Alik_Bjlk_BSS_BH_UserArgs_MT128x64x64_MI16x16x1_SN_LDSB1_CLR1_GSU0_GSUC0_GSUWGMRR0_K1_LBSPPA512_LBSPPB1024_LPB32_MIWT4_2_PLR2_SU32_SUM0_SUS256_SKXCCM6_VWA4_VWB2_WGM1_WGMXCC1_WGMXCCGn1
    SolutionIndex: 93
    SolutionNameMin: Cijk_Alik_Bjlk_BSS_BH_UserArgs_MT128x64x64_MI16x16x1_SN_LDSB1_CLR1_GSU0_GSUC0_GSUWGMRR0_K1_LBSPPA128_LBSPPB1024_LPB32_MIWT4_2_PLR1_SU32_SUM0_SUS256_SKXCCM6_VWA1_VWB2_WGM4_WGMXCC1_WGMXCCGn1
    SolutionIndex: 94
    SolutionNameMin: Cijk_Alik_Bjlk_BSS_BH_UserArgs_MT128x64x64_MI16x16x1_SN_LDSB1_CLR1_GSU0_GSUC0_GSUWGMRR0_K1_LBSPPA512_LBSPPB1024_LPB32_MIWT4_2_PLR1_SU32_SUM0_SUS256_SKXCCM6_VWA4_VWB2_WGM4_WGMXCC1_WGMXCCGn1
    SolutionIndex: 95
    SolutionNameMin: Cijk_Alik_Bjlk_BSS_BH_UserArgs_MT128x64x64_MI16x16x1_SN_LDSB1_CLR1_GSU0_GSUC0_GSUWGMRR0_K1_LBSPPA512_LBSPPB1024_LPB32_MIWT4_2_PLR1_SU32_SUM0_SUS256_SKXCCM6_VWA4_VWB2_WGM8_WGMXCC1_WGMXCCGn1
    SolutionIndex: 96
    SolutionNameMin: Cijk_Alik_Bjlk_BSS_BH_UserArgs_MT32x128x64_MI16x16x1_SN_LDSB1_CLR1_GSU0_GSUC0_GSUWGMRR0_K1_LBSPPA128_LBSPPB2048_LPB0_MIWT1_4_PLR1_SU32_SUM0_SUS256_SKXCCM6_VWA1_VWB4_WGM1_WGMXCC1_WGMXCCGn1
    SolutionIndex: 97
    SolutionNameMin: Cijk_Alik_Bjlk_BSS_BH_UserArgs_MT64x64x64_MI16x16x1_SN_LDSB1_CLR1_GSU0_GSUC0_GSUWGMRR0_K1_LBSPPA128_LBSPPB1024_LPB32_MIWT2_2_PLR1_SU32_SUM0_SUS256_SKXCCM6_VWA1_VWB2_WGM1_WGMXCC1_WGMXCCGn1
    SolutionIndex: 98
    SolutionNameMin: Cijk_Alik_Bjlk_BSS_BH_UserArgs_MT64x64x64_MI16x16x1_SN_LDSB1_CLR1_GSU0_GSUC0_GSUWGMRR0_K1_LBSPPA256_LBSPPB1024_LPB32_MIWT2_2_PLR1_SU32_SUM0_SUS256_SKXCCM6_VWA2_VWB2_WGM1_WGMXCC1_WGMXCCGn1
    SolutionIndex: 99
    SolutionNameMin: Cijk_Alik_Bjlk_BSS_BH_UserArgs_MT64x64x64_MI16x16x1_SN_LDSB1_CLR1_GSU0_GSUC0_GSUWGMRR0_K1_LBSPPA128_LBSPPB1024_LPB32_MIWT2_2_PLR1_SU32_SUM0_SUS256_SKXCCM6_VWA1_VWB2_WGM4_WGMXCC1_WGMXCCGn1
    SolutionIndex: 100
    SolutionNameMin: Cijk_Alik_Bjlk_BSS_BH_UserArgs_MT64x64x64_MI16x16x1_SN_LDSB1_CLR1_GSU0_GSUC0_GSUWGMRR0_K1_LBSPPA256_LBSPPB1024_LPB32_MIWT2_2_PLR1_SU32_SUM0_SUS256_SKXCCM6_VWA2_VWB2_WGM4_WGMXCC1_WGMXCCGn1
    SolutionIndex: 101
    SolutionNameMin: Cijk_Alik_Bjlk_BSS_BH_UserArgs_MT64x64x64_MI16x16x1_SN_LDSB1_CLR1_GSU0_GSUC0_GSUWGMRR0_K1_LBSPPA128_LBSPPB1024_LPB32_MIWT2_2_PLR2_SU32_SUM0_SUS256_SKXCCM6_VWA1_VWB2_WGM4_WGMXCC1_WGMXCCGn1
    SolutionIndex: 102
    SolutionNameMin: Cijk_Alik_Bjlk_BSS_BH_UserArgs_MT64x64x64_MI16x16x1_SN_LDSB1_CLR1_GSU0_GSUC0_GSUWGMRR0_K1_LBSPPA128_LBSPPB1024_LPB32_MIWT2_2_PLR1_SU32_SUM0_SUS256_SKXCCM6_VWA1_VWB2_WGM8_WGMXCC1_WGMXCCGn1
    SolutionIndex: 103
    SolutionNameMin: Cijk_Alik_Bjlk_BSS_BH_UserArgs_MT32x32x64_MI16x16x1_SN_LDSB0_CLR1_GSU0_GSUC0_GSUWGMRR0_K1_LBSPPA128_LBSPPB512_LPB16_MIWT1_1_PLR1_SU32_SUM0_SUS256_SKXCCM6_VWA1_VWB1_WGM1_WGMXCC1_WGMXCCGn1
    SolutionIndex: 104
    SolutionNameMin: Cijk_Alik_Bjlk_BSS_BH_UserArgs_MT64x128x128_MI16x16x1_SN_LDSB1_CLR1_GSU0_GSUC0_GSUWGMRR0_K1_LBSPPA512_LBSPPB2048_LPB0_MIWT2_4_PLR2_SU32_SUM0_SUS256_SKXCCM6_VWA2_VWB4_WGM1_WGMXCC1_WGMXCCGn1
    SolutionIndex: 105
    SolutionNameMin: Cijk_Alik_Bjlk_BSS_BH_UserArgs_MT128x64x128_MI16x16x1_SN_LDSB1_CLR1_GSU0_GSUC0_GSUWGMRR0_K1_LBSPPA1024_LBSPPB1024_LPB32_MIWT4_2_PLR2_SU32_SUM0_SUS256_SKXCCM6_VWA4_VWB2_WGM4_WGMXCC1_WGMXCCGn1
    SolutionIndex: 106
    SolutionNameMin: Cijk_Alik_Bjlk_BSS_BH_UserArgs_MT128x64x128_MI16x16x1_SN_LDSB1_CLR1_GSU0_GSUC0_GSUWGMRR0_K1_LBSPPA1024_LBSPPB1024_LPB32_MIWT4_2_PLR2_SU32_SUM0_SUS256_SKXCCM6_VWA4_VWB2_WGM8_WGMXCC1_WGMXCCGn1
    SolutionIndex: 107
    SolutionNameMin: Cijk_Alik_Bjlk_BSS_BH_UserArgs_MT32x64x128_MI16x16x1_SN_LDSB1_CLR1_GSU0_GSUC0_GSUWGMRR0_K1_LBSPPA256_LBSPPB1024_LPB32_MIWT1_2_PLR1_SU32_SUM0_SUS256_SKXCCM6_VWA1_VWB2_WGM1_WGMXCC1_WGMXCCGn1
    SolutionIndex: 108
    SolutionNameMin: Cijk_Alik_Bjlk_BSS_BH_UserArgs_MT32x64x128_MI16x16x1_SN_LDSB1_CLR1_GSU0_GSUC0_GSUWGMRR0_K1_LBSPPA256_LBSPPB1024_LPB32_MIWT1_2_PLR2_SU32_SUM0_SUS256_SKXCCM6_VWA1_VWB2_WGM1_WGMXCC1_WGMXCCGn1
    SolutionIndex: 109
    SolutionNameMin: Cijk_Alik_Bjlk_BSS_BH_UserArgs_MT32x64x128_MI16x16x1_SN_LDSB1_CLR1_GSU0_GSUC0_GSUWGMRR0_K1_LBSPPA256_LBSPPB1024_LPB32_MIWT1_2_PLR1_SU32_SUM0_SUS256_SKXCCM6_VWA1_VWB2_WGM4_WGMXCC1_WGMXCCGn1
    SolutionIndex: 110
    SolutionNameMin: Cijk_Alik_Bjlk_BSS_BH_UserArgs_MT32x64x128_MI16x16x1_SN_LDSB1_CLR1_GSU0_GSUC0_GSUWGMRR0_K1_LBSPPA256_LBSPPB1024_LPB32_MIWT1_2_PLR2_SU32_SUM0_SUS256_SKXCCM6_VWA1_VWB2_WGM4_WGMXCC1_WGMXCCGn1
    SolutionIndex: 111
    SolutionNameMin: Cijk_Alik_Bjlk_BSS_BH_UserArgs_MT32x64x128_MI16x16x1_SN_LDSB1_CLR1_GSU0_GSUC0_GSUWGMRR0_K1_LBSPPA256_LBSPPB1024_LPB32_MIWT1_2_PLR2_SU32_SUM0_SUS256_SKXCCM6_VWA1_VWB2_WGM8_WGMXCC1_WGMXCCGn1
    SolutionIndex: 112
    SolutionNameMin: Cijk_Alik_Bjlk_BSS_BH_UserArgs_MT32x32x128_MI16x16x1_SN_LDSB1_CLR1_GSU0_GSUC0_GSUWGMRR0_K1_LBSPPA256_LBSPPB512_LPB16_MIWT1_1_PLR1_SU32_SUM0_SUS256_SKXCCM6_VWA1_VWB1_WGM1_WGMXCC1_WGMXCCGn1
    SolutionIndex: 113
    SolutionNameMin: Cijk_Alik_Bjlk_BSS_BH_UserArgs_MT32x32x128_MI16x16x1_SN_LDSB1_CLR1_GSU0_GSUC0_GSUWGMRR0_K1_LBSPPA256_LBSPPB512_LPB16_MIWT1_1_PLR2_SU32_SUM0_SUS256_SKXCCM6_VWA1_VWB1_WGM1_WGMXCC1_WGMXCCGn1
    SolutionIndex: 114
    SolutionNameMin: Cijk_Alik_Bjlk_BSS_BH_UserArgs_MT32x32x128_MI16x16x1_SN_LDSB1_CLR1_GSU0_GSUC0_GSUWGMRR0_K1_LBSPPA256_LBSPPB512_LPB16_MIWT1_1_PLR2_SU32_SUM0_SUS256_SKXCCM6_VWA1_VWB1_WGM8_WGMXCC1_WGMXCCGn1
    SolutionIndex: 115
    SolutionNameMin: Cijk_Alik_Bjlk_BSS_BH_UserArgs_MT32x32x32_MI16x16x1_SN_LDSB0_CLR0_GSU0_GSUC0_GSUWGMRR0_K1_LBSPPA128_LBSPPB256_LPB16_MIWT1_1_PLR0_SU32_SUM0_SUS256_SKXCCM0_VWA1_VWB1_WGM4_WGMXCC1_WGMXCCGn1
- - - [128, 128, 1, 128, 128, 128, 128, 128]
    - [30, 0.085]
  - - [128, 128, 1, 256, 128, 128, 256, 128]
    - [31, 0.11]
  - - [128, 128, 1, 512, 128, 128, 512, 128]
    - [31, 0.178]
  - - [128, 128, 1, 1024, 128, 128, 1024, 128]
    - [113, 0.273]
  - - [128, 128, 1, 2048, 128, 128, 2048, 128]
    - [103, 0.37]
  - - [128, 128, 1, 4096, 128, 128, 4096, 128]
    - [26, 0.693]
  - - [128, 128, 1, 8192, 128, 128, 8192, 128]
    - [30, 1.303]
  - - [128, 256, 1, 128, 128, 128, 128, 256]
    - [31, 0.162]
  - - [128, 256, 1, 256, 128, 128, 256, 256]
    - [31, 0.216]
  - - [128, 256, 1, 512, 128, 128, 512, 256]
    - [30, 0.353]
  - - [128, 256, 1, 1024, 128, 128, 1024, 256]
    - [103, 0.551]
  - - [128, 256, 1, 2048, 128, 128, 2048, 256]
    - [112, 1.012]
  - - [128, 256, 1, 4096, 128, 128, 4096, 256]
    - [30, 1.75]
  - - [128, 256, 1, 8192, 128, 128, 8192, 256]
    - [30, 2.872]
  - - [128, 512, 1, 128, 128, 128, 128, 512]
    - [31, 0.322]
  - - [128, 512, 1, 256, 128, 128, 256, 512]
    - [30, 0.415]
  - - [128, 512, 1, 512, 128, 128, 512, 512]
    - [112, 0.686]
  - - [128, 512, 1, 1024, 128, 128, 1024, 512]
    - [68, 1.21]
  - - [128, 512, 1, 2048, 128, 128, 2048, 512]
    - [112, 2.217]
  - - [128, 512, 1, 4096, 128, 128, 4096, 512]
    - [31, 3.376]
  - - [128, 512, 1, 8192, 128, 128, 8192, 512]
    - [107, 4.772]
  - - [128, 1024, 1, 128, 128, 128, 128, 1024]
    - [31, 0.651]
  - - [128, 1024, 1, 256, 128, 128, 256, 1024]
    - [30, 0.795]
  - - [128, 1024, 1, 512, 128, 128, 512, 1024]
    - [30, 1.398]
  - - [128, 1024, 1, 1024, 128, 128, 1024, 1024]
    - [112, 2.453]
  - - [128, 1024, 1, 2048, 128, 128, 2048, 1024]
    - [29, 3.725]
  - - [128, 1024, 1, 4096, 128, 128, 4096, 1024]
    - [108, 5.416]
  - - [128, 1024, 1, 8192, 128, 128, 8192, 1024]
    - [97, 6.958]
  - - [128, 2048, 1, 128, 128, 128, 128, 2048]
    - [28, 1.15]
  - - [128, 2048, 1, 256, 128, 128, 256, 2048]
    - [31, 1.929]
  - - [128, 2048, 1, 512, 128, 128, 512, 2048]
    - [31, 3.034]
  - - [128, 2048, 1, 1024, 128, 128, 1024, 2048]
    - [113, 4.343]
  - - [128, 2048, 1, 2048, 128, 128, 2048, 2048]
    - [110, 5.954]
  - - [128, 2048, 1, 4096, 128, 128, 4096, 2048]
    - [99, 8.327]
  - - [128, 2048, 1, 8192, 128, 128, 8192, 2048]
    - [21, 9.943]
  - - [128, 4096, 1, 128, 128, 128, 128, 4096]
    - [25, 2.022]
  - - [128, 4096, 1, 256, 128, 128, 256, 4096]
    - [25, 3.411]
  - - [128, 4096, 1, 512, 128, 128, 512, 4096]
    - [108, 5.194]
  - - [128, 4096, 1, 1024, 128, 128, 1024, 4096]
    - [108, 7.361]
  - - [128, 4096, 1, 2048, 128, 128, 2048, 4096]
    - [97, 9.329]
  - - [128, 4096, 1, 4096, 128, 128, 4096, 4096]
    - [94, 11.351]
  - - [128, 4096, 1, 8192, 128, 128, 8192, 4096]
    - [95, 13.608]
  - - [128, 8192, 1, 128, 128, 128, 128, 8192]
    - [22, 3.286]
  - - [128, 8192, 1, 256, 128, 128, 256, 8192]
    - [97, 5.543]
  - - [128, 8192, 1, 512, 128, 128, 512, 8192]
    - [102, 8.183]
  - - [128, 8192, 1, 1024, 128, 128, 1024, 8192]
    - [97, 10.912]
  - - [128, 8192, 1, 2048, 128, 128, 2048, 8192]
    - [97, 13.217]
  - - [128, 8192, 1, 4096, 128, 128, 4096, 8192]
    - [94, 15.143]
  - - [128, 8192, 1, 8192, 128, 128, 8192, 8192]
    - [12, 16.461]
  - - [256, 128, 1, 128, 256, 256, 128, 128]
    - [30, 0.166]
  - - [256, 128, 1, 256, 256, 256, 256, 128]
    - [30, 0.212]
  - - [256, 128, 1, 512, 256, 256, 512, 128]
    - [112, 0.352]
  - - [256, 128, 1, 1024, 256, 256, 1024, 128]
    - [103, 0.545]
  - - [256, 128, 1, 2048, 256, 256, 2048, 128]
    - [113, 0.996]
  - - [256, 128, 1, 4096, 256, 256, 4096, 128]
    - [31, 1.735]
  - - [256, 128, 1, 8192, 256, 256, 8192, 128]
    - [114, 2.873]
  - - [256, 256, 1, 128, 256, 256, 128, 256]
    - [31, 0.328]
  - - [256, 256, 1, 256, 256, 256, 256, 256]
    - [30, 0.412]
  - - [256, 256, 1, 512, 256, 256, 512, 256]
    - [112, 0.676]
  - - [256, 256, 1, 1024, 256, 256, 1024, 256]
    - [67, 1.223]
  - - [256, 256, 1, 2048, 256, 256, 2048, 256]
    - [113, 2.214]
  - - [256, 256, 1, 4096, 256, 256, 4096, 256]
    - [113, 3.442]
  - - [256, 256, 1, 8192, 256, 256, 8192, 256]
    - [28, 5.031]
  - - [256, 512, 1, 128, 256, 256, 128, 512]
    - [30, 0.627]
  - - [256, 512, 1, 256, 256, 256, 256, 512]
    - [31, 0.783]
  - - [256, 512, 1, 512, 256, 256, 512, 512]
    - [30, 1.416]
  - - [256, 512, 1, 1024, 256, 256, 1024, 512]
    - [113, 2.41]
  - - [256, 512, 1, 2048, 256, 256, 2048, 512]
    - [108, 3.837]
  - - [256, 512, 1, 4096, 256, 256, 4096, 512]
    - [108, 5.826]
  - - [256, 512, 1, 8192, 256, 256, 8192, 512]
    - [109, 7.604]
  - - [256, 1024, 1, 128, 256, 256, 128, 1024]
    - [28, 1.159]
  - - [256, 1024, 1, 256, 256, 256, 256, 1024]
    - [30, 1.911]
  - - [256, 1024, 1, 512, 256, 256, 512, 1024]
    - [30, 3.032]
  - - [256, 1024, 1, 1024, 256, 256, 1024, 1024]
    - [31, 4.331]
  - - [256, 1024, 1, 2048, 256, 256, 2048, 1024]
    - [110, 6.174]
  - - [256, 1024, 1, 4096, 256, 256, 4096, 1024]
    - [24, 8.436]
  - - [256, 1024, 1, 8192, 256, 256, 8192, 1024]
    - [89, 9.695]
  - - [256, 2048, 1, 128, 256, 256, 128, 2048]
    - [25, 1.998]
  - - [256, 2048, 1, 256, 256, 256, 256, 2048]
    - [25, 3.362]
  - - [256, 2048, 1, 512, 256, 256, 512, 2048]
    - [28, 5.189]
  - - [256, 2048, 1, 1024, 256, 256, 1024, 2048]
    - [108, 7.339]
  - - [256, 2048, 1, 2048, 256, 256, 2048, 2048]
    - [97, 9.584]
  - - [256, 2048, 1, 4096, 256, 256, 4096, 2048]
    - [91, 11.733]
  - - [256, 2048, 1, 8192, 256, 256, 8192, 2048]
    - [91, 12.698]
  - - [256, 4096, 1, 128, 256, 256, 128, 4096]
    - [97, 3.229]
  - - [256, 4096, 1, 256, 256, 256, 256, 4096]
    - [23, 5.526]
  - - [256, 4096, 1, 512, 256, 256, 512, 4096]
    - [97, 8.238]
  - - [256, 4096, 1, 1024, 256, 256, 1024, 4096]
    - [97, 11.464]
  - - [256, 4096, 1, 2048, 256, 256, 2048, 4096]
    - [98, 13.273]
  - - [256, 4096, 1, 4096, 256, 256, 4096, 4096]
    - [95, 14.688]
  - - [256, 4096, 1, 8192, 256, 256, 8192, 4096]
    - [79, 16.108]
  - - [256, 8192, 1, 128, 256, 256, 128, 8192]
    - [21, 4.684]
  - - [256, 8192, 1, 256, 256, 256, 256, 8192]
    - [20, 7.854]
  - - [256, 8192, 1, 512, 256, 256, 512, 8192]
    - [84, 11.546]
  - - [256, 8192, 1, 1024, 256, 256, 1024, 8192]
    - [84, 15.03]
  - - [256, 8192, 1, 2048, 256, 256, 2048, 8192]
    - [90, 16.446]
  - - [256, 8192, 1, 4096, 256, 256, 4096, 8192]
    - [83, 16.844]
  - - [256, 8192, 1, 8192, 256, 256, 8192, 8192]
    - [78, 18.29]
  - - [512, 128, 1, 128, 512, 512, 128, 128]
    - [30, 0.333]
  - - [512, 128, 1, 256, 512, 512, 256, 128]
    - [30, 0.413]
  - - [512, 128, 1, 512, 512, 512, 512, 128]
    - [67, 0.677]
  - - [512, 128, 1, 1024, 512, 512, 1024, 128]
    - [68, 1.224]
  - - [512, 128, 1, 2048, 512, 512, 2048, 128]
    - [113, 2.202]
  - - [512, 128, 1, 4096, 512, 512, 4096, 128]
    - [113, 3.479]
  - - [512, 128, 1, 8192, 512, 512, 8192, 128]
    - [108, 4.955]
  - - [512, 256, 1, 128, 512, 512, 128, 256]
    - [31, 0.632]
  - - [512, 256, 1, 256, 512, 512, 256, 256]
    - [31, 0.79]
  - - [512, 256, 1, 512, 512, 512, 512, 256]
    - [30, 1.408]
  - - [512, 256, 1, 1024, 512, 512, 1024, 256]
    - [112, 2.386]
  - - [512, 256, 1, 2048, 512, 512, 2048, 256]
    - [108, 3.833]
  - - [512, 256, 1, 4096, 512, 512, 4096, 256]
    - [110, 5.861]
  - - [512, 256, 1, 8192, 512, 512, 8192, 256]
    - [110, 7.681]
  - - [512, 512, 1, 128, 512, 512, 128, 512]
    - [28, 1.154]
  - - [512, 512, 1, 256, 512, 512, 256, 512]
    - [30, 1.9]
  - - [512, 512, 1, 512, 512, 512, 512, 512]
    - [31, 3.009]
  - - [512, 512, 1, 1024, 512, 512, 1024, 512]
    - [31, 4.316]
  - - [512, 512, 1, 2048, 512, 512, 2048, 512]
    - [108, 6.305]
  - - [512, 512, 1, 4096, 512, 512, 4096, 512]
    - [100, 8.659]
  - - [512, 512, 1, 8192, 512, 512, 8192, 512]
    - [101, 10.2]
  - - [512, 1024, 1, 128, 512, 512, 128, 1024]
    - [25, 2.016]
  - - [512, 1024, 1, 256, 512, 512, 256, 1024]
    - [25, 3.344]
  - - [512, 1024, 1, 512, 512, 512, 512, 1024]
    - [28, 5.214]
  - - [512, 1024, 1, 1024, 512, 512, 1024, 1024]
    - [28, 7.347]
  - - [512, 1024, 1, 2048, 512, 512, 2048, 1024]
    - [97, 9.706]
  - - [512, 1024, 1, 4096, 512, 512, 4096, 1024]
    - [91, 11.248]
  - - [512, 1024, 1, 8192, 512, 512, 8192, 1024]
    - [92, 12.364]
  - - [512, 2048, 1, 128, 512, 512, 128, 2048]
    - [22, 3.236]
  - - [512, 2048, 1, 256, 512, 512, 256, 2048]
    - [22, 5.566]
  - - [512, 2048, 1, 512, 512, 512, 512, 2048]
    - [24, 8.233]
  - - [512, 2048, 1, 1024, 512, 512, 1024, 2048]
    - [24, 11.168]
  - - [512, 2048, 1, 2048, 512, 512, 2048, 2048]
    - [98, 13.25]
  - - [512, 2048, 1, 4096, 512, 512, 4096, 2048]
    - [87, 13.562]
  - - [512, 2048, 1, 8192, 512, 512, 8192, 2048]
    - [79, 15.091]
  - - [512, 4096, 1, 128, 512, 512, 128, 4096]
    - [21, 4.849]
  - - [512, 4096, 1, 256, 512, 512, 256, 4096]
    - [20, 7.949]
  - - [512, 4096, 1, 512, 512, 512, 512, 4096]
    - [84, 11.49]
  - - [512, 4096, 1, 1024, 512, 512, 1024, 4096]
    - [84, 15.08]
  - - [512, 4096, 1, 2048, 512, 512, 2048, 4096]
    - [91, 16.177]
  - - [512, 4096, 1, 4096, 512, 512, 4096, 4096]
    - [104, 16.036]
  - - [512, 4096, 1, 8192, 512, 512, 8192, 4096]
    - [77, 17.462]
  - - [512, 8192, 1, 128, 512, 512, 128, 8192]
    - [64, 5.93]
  - - [512, 8192, 1, 256, 512, 512, 256, 8192]
    - [64, 9.449]
  - - [512, 8192, 1, 512, 512, 512, 512, 8192]
    - [54, 13.244]
  - - [512, 8192, 1, 1024, 512, 512, 1024, 8192]
    - [56, 16.395]
  - - [512, 8192, 1, 2048, 512, 512, 2048, 8192]
    - [79, 19.235]
  - - [512, 8192, 1, 4096, 512, 512, 4096, 8192]
    - [11, 18.107]
  - - [512, 8192, 1, 8192, 512, 512, 8192, 8192]
    - [77, 20.944]
  - - [1024, 128, 1, 128, 1024, 1024, 128, 128]
    - [30, 0.651]
  - - [1024, 128, 1, 256, 1024, 1024, 256, 128]
    - [30, 0.791]
  - - [1024, 128, 1, 512, 1024, 1024, 512, 128]
    - [30, 1.41]
  - - [1024, 128, 1, 1024, 1024, 1024, 1024, 128]
    - [112, 2.438]
  - - [1024, 128, 1, 2048, 1024, 1024, 2048, 128]
    - [108, 3.817]
  - - [1024, 128, 1, 4096, 1024, 1024, 4096, 128]
    - [108, 5.996]
  - - [1024, 128, 1, 8192, 1024, 1024, 8192, 128]
    - [111, 7.873]
  - - [1024, 256, 1, 128, 1024, 1024, 128, 256]
    - [28, 1.153]
  - - [1024, 256, 1, 256, 1024, 1024, 256, 256]
    - [30, 1.916]
  - - [1024, 256, 1, 512, 1024, 1024, 512, 256]
    - [30, 3.036]
  - - [1024, 256, 1, 1024, 1024, 1024, 1024, 256]
    - [30, 4.367]
  - - [1024, 256, 1, 2048, 1024, 1024, 2048, 256]
    - [111, 6.286]
  - - [1024, 256, 1, 4096, 1024, 1024, 4096, 256]
    - [22, 8.517]
  - - [1024, 256, 1, 8192, 1024, 1024, 8192, 256]
    - [99, 10.154]
  - - [1024, 512, 1, 128, 1024, 1024, 128, 512]
    - [27, 2.022]
  - - [1024, 512, 1, 256, 1024, 1024, 256, 512]
    - [25, 3.386]
  - - [1024, 512, 1, 512, 1024, 1024, 512, 512]
    - [28, 5.229]
  - - [1024, 512, 1, 1024, 1024, 1024, 1024, 512]
    - [28, 7.338]
  - - [1024, 512, 1, 2048, 1024, 1024, 2048, 512]
    - [102, 9.978]
  - - [1024, 512, 1, 4096, 1024, 1024, 4096, 512]
    - [85, 11.599]
  - - [1024, 512, 1, 8192, 1024, 1024, 8192, 512]
    - [105, 12.037]
  - - [1024, 1024, 1, 128, 1024, 1024, 128, 1024]
    - [22, 3.306]
  - - [1024, 1024, 1, 256, 1024, 1024, 256, 1024]
    - [22, 5.547]
  - - [1024, 1024, 1, 512, 1024, 1024, 512, 1024]
    - [24, 8.26]
  - - [1024, 1024, 1, 1024, 1024, 1024, 1024, 1024]
    - [23, 11.228]
  - - [1024, 1024, 1, 2048, 1024, 1024, 2048, 1024]
    - [97, 12.938]
  - - [1024, 1024, 1, 4096, 1024, 1024, 4096, 1024]
    - [88, 13.398]
  - - [1024, 1024, 1, 8192, 1024, 1024, 8192, 1024]
    - [80, 16.056]
  - - [1024, 2048, 1, 128, 1024, 1024, 128, 2048]
    - [16, 4.692]
  - - [1024, 2048, 1, 256, 1024, 1024, 256, 2048]
    - [15, 7.891]
  - - [1024, 2048, 1, 512, 1024, 1024, 512, 2048]
    - [84, 11.376]
  - - [1024, 2048, 1, 1024, 1024, 1024, 1024, 2048]
    - [84, 14.644]
  - - [1024, 2048, 1, 2048, 1024, 1024, 2048, 2048]
    - [91, 16.217]
  - - [1024, 2048, 1, 4096, 1024, 1024, 4096, 2048]
    - [83, 16.873]
  - - [1024, 2048, 1, 8192, 1024, 1024, 8192, 2048]
    - [77, 17.587]
  - - [1024, 4096, 1, 128, 1024, 1024, 128, 4096]
    - [65, 6.102]
  - - [1024, 4096, 1, 256, 1024, 1024, 256, 4096]
    - [65, 9.544]
  - - [1024, 4096, 1, 512, 1024, 1024, 512, 4096]
    - [54, 13.093]
  - - [1024, 4096, 1, 1024, 1024, 1024, 1024, 4096]
    - [55, 16.31]
  - - [1024, 4096, 1, 2048, 1024, 1024, 2048, 4096]
    - [79, 18.578]
  - - [1024, 4096, 1, 4096, 1024, 1024, 4096, 4096]
    - [77, 18.122]
  - - [1024, 4096, 1, 8192, 1024, 1024, 8192, 4096]
    - [34, 20.567]
  - - [1024, 8192, 1, 128, 1024, 1024, 128, 8192]
    - [8, 6.451]
  - - [1024, 8192, 1, 256, 1024, 1024, 256, 8192]
    - [7, 10.568]
  - - [1024, 8192, 1, 512, 1024, 1024, 512, 8192]
    - [44, 15.802]
  - - [1024, 8192, 1, 1024, 1024, 1024, 1024, 8192]
    - [45, 19.616]
  - - [1024, 8192, 1, 2048, 1024, 1024, 2048, 8192]
    - [69, 20.197]
  - - [1024, 8192, 1, 4096, 1024, 1024, 4096, 8192]
    - [3, 20.075]
  - - [1024, 8192, 1, 8192, 1024, 1024, 8192, 8192]
    - [2, 22.841]
  - - [2048, 128, 1, 128, 2048, 2048, 128, 128]
    - [28, 1.168]
  - - [2048, 128, 1, 256, 2048, 2048, 256, 128]
    - [30, 1.953]
  - - [2048, 128, 1, 512, 2048, 2048, 512, 128]
    - [30, 3.094]
  - - [2048, 128, 1, 1024, 2048, 2048, 1024, 128]
    - [113, 4.336]
  - - [2048, 128, 1, 2048, 2048, 2048, 2048, 128]
    - [108, 6.43]
  - - [2048, 128, 1, 4096, 2048, 2048, 4096, 128]
    - [99, 8.53]
  - - [2048, 128, 1, 8192, 2048, 2048, 8192, 128]
    - [96, 10.146]
  - - [2048, 256, 1, 128, 2048, 2048, 128, 256]
    - [29, 2.004]
  - - [2048, 256, 1, 256, 2048, 2048, 256, 256]
    - [25, 3.36]
  - - [2048, 256, 1, 512, 2048, 2048, 512, 256]
    - [28, 5.17]
  - - [2048, 256, 1, 1024, 2048, 2048, 1024, 256]
    - [108, 7.3]
  - - [2048, 256, 1, 2048, 2048, 2048, 2048, 256]
    - [102, 9.932]
  - - [2048, 256, 1, 4096, 2048, 2048, 4096, 256]
    - [87, 11.357]
  - - [2048, 256, 1, 8192, 2048, 2048, 8192, 256]
    - [66, 12.207]
  - - [2048, 512, 1, 128, 2048, 2048, 128, 512]
    - [10, 3.305]
  - - [2048, 512, 1, 256, 2048, 2048, 256, 512]
    - [22, 5.585]
  - - [2048, 512, 1, 512, 2048, 2048, 512, 512]
    - [102, 8.32]
  - - [2048, 512, 1, 1024, 2048, 2048, 1024, 512]
    - [102, 11.445]
  - - [2048, 512, 1, 2048, 2048, 2048, 2048, 512]
    - [102, 13.161]
  - - [2048, 512, 1, 4096, 2048, 2048, 4096, 512]
    - [95, 13.49]
  - - [2048, 512, 1, 8192, 2048, 2048, 8192, 512]
    - [80, 15.31]
  - - [2048, 1024, 1, 128, 2048, 2048, 128, 1024]
    - [18, 4.845]
  - - [2048, 1024, 1, 256, 2048, 2048, 256, 1024]
    - [85, 7.887]
  - - [2048, 1024, 1, 512, 2048, 2048, 512, 1024]
    - [85, 11.432]
  - - [2048, 1024, 1, 1024, 2048, 2048, 1024, 1024]
    - [87, 14.85]
  - - [2048, 1024, 1, 2048, 2048, 2048, 2048, 1024]
    - [86, 16.056]
  - - [2048, 1024, 1, 4096, 2048, 2048, 4096, 1024]
    - [82, 16.984]
  - - [2048, 1024, 1, 8192, 2048, 2048, 8192, 1024]
    - [73, 17.909]
  - - [2048, 2048, 1, 128, 2048, 2048, 128, 2048]
    - [63, 6.001]
  - - [2048, 2048, 1, 256, 2048, 2048, 256, 2048]
    - [62, 9.269]
  - - [2048, 2048, 1, 512, 2048, 2048, 512, 2048]
    - [9, 13.068]
  - - [2048, 2048, 1, 1024, 2048, 2048, 1024, 2048]
    - [55, 16.035]
  - - [2048, 2048, 1, 2048, 2048, 2048, 2048, 2048]
    - [79, 18.808]
  - - [2048, 2048, 1, 4096, 2048, 2048, 4096, 2048]
    - [73, 17.852]
  - - [2048, 2048, 1, 8192, 2048, 2048, 8192, 2048]
    - [77, 19.912]
  - - [2048, 4096, 1, 128, 2048, 2048, 128, 4096]
    - [6, 6.484]
  - - [2048, 4096, 1, 256, 2048, 2048, 256, 4096]
    - [8, 10.554]
  - - [2048, 4096, 1, 512, 2048, 2048, 512, 4096]
    - [48, 15.31]
  - - [2048, 4096, 1, 1024, 2048, 2048, 1024, 4096]
    - [49, 19.119]
  - - [2048, 4096, 1, 2048, 2048, 2048, 2048, 4096]
    - [74, 20.406]
  - - [2048, 4096, 1, 4096, 2048, 2048, 4096, 4096]
    - [41, 20.319]
  - - [2048, 4096, 1, 8192, 2048, 2048, 8192, 4096]
    - [34, 23.317]
  - - [2048, 8192, 1, 128, 2048, 2048, 128, 8192]
    - [91, 6.697]
  - - [2048, 8192, 1, 256, 2048, 2048, 256, 8192]
    - [4, 10.316]
  - - [2048, 8192, 1, 512, 2048, 2048, 512, 8192]
    - [34, 14.923]
  - - [2048, 8192, 1, 1024, 2048, 2048, 1024, 8192]
    - [41, 18.76]
  - - [2048, 8192, 1, 2048, 2048, 2048, 2048, 8192]
    - [43, 20.259]
  - - [2048, 8192, 1, 4096, 2048, 2048, 4096, 8192]
    - [33, 22.796]
  - - [2048, 8192, 1, 8192, 2048, 2048, 8192, 8192]
    - [33, 24.058]
  - - [4096, 128, 1, 128, 4096, 4096, 128, 128]
    - [29, 1.985]
  - - [4096, 128, 1, 256, 4096, 4096, 256, 128]
    - [25, 3.414]
  - - [4096, 128, 1, 512, 4096, 4096, 512, 128]
    - [25, 5.2]
  - - [4096, 128, 1, 1024, 4096, 4096, 1024, 128]
    - [108, 7.361]
  - - [4096, 128, 1, 2048, 4096, 4096, 2048, 128]
    - [102, 9.691]
  - - [4096, 128, 1, 4096, 4096, 4096, 4096, 128]
    - [24, 10.864]
  - - [4096, 128, 1, 8192, 4096, 4096, 8192, 128]
    - [14, 13.205]
  - - [4096, 256, 1, 128, 4096, 4096, 128, 256]
    - [22, 3.335]
  - - [4096, 256, 1, 256, 4096, 4096, 256, 256]
    - [23, 5.573]
  - - [4096, 256, 1, 512, 4096, 4096, 512, 256]
    - [99, 8.366]
  - - [4096, 256, 1, 1024, 4096, 4096, 1024, 256]
    - [102, 11.443]
  - - [4096, 256, 1, 2048, 4096, 4096, 2048, 256]
    - [102, 12.965]
  - - [4096, 256, 1, 4096, 4096, 4096, 4096, 256]
    - [84, 14.305]
  - - [4096, 256, 1, 8192, 4096, 4096, 8192, 256]
    - [79, 15.084]
  - - [4096, 512, 1, 128, 4096, 4096, 128, 512]
    - [17, 4.722]
  - - [4096, 512, 1, 256, 4096, 4096, 256, 512]
    - [93, 7.74]
  - - [4096, 512, 1, 512, 4096, 4096, 512, 512]
    - [85, 11.335]
  - - [4096, 512, 1, 1024, 4096, 4096, 1024, 512]
    - [87, 15.1]
  - - [4096, 512, 1, 2048, 4096, 4096, 2048, 512]
    - [85, 16.355]
  - - [4096, 512, 1, 4096, 4096, 4096, 4096, 512]
    - [106, 16.32]
  - - [4096, 512, 1, 8192, 4096, 4096, 8192, 512]
    - [72, 18.081]
  - - [4096, 1024, 1, 128, 4096, 4096, 128, 1024]
    - [61, 6.142]
  - - [4096, 1024, 1, 256, 4096, 4096, 256, 1024]
    - [60, 9.457]
  - - [4096, 1024, 1, 512, 4096, 4096, 512, 1024]
    - [65, 13.034]
  - - [4096, 1024, 1, 1024, 4096, 4096, 1024, 1024]
    - [64, 15.833]
  - - [4096, 1024, 1, 2048, 4096, 4096, 2048, 1024]
    - [81, 18.836]
  - - [4096, 1024, 1, 4096, 4096, 4096, 4096, 1024]
    - [76, 18.014]
  - - [4096, 1024, 1, 8192, 4096, 4096, 8192, 1024]
    - [40, 20.007]
  - - [4096, 2048, 1, 128, 4096, 4096, 128, 2048]
    - [5, 6.351]
  - - [4096, 2048, 1, 256, 4096, 4096, 256, 2048]
    - [6, 10.282]
  - - [4096, 2048, 1, 512, 4096, 4096, 512, 2048]
    - [5, 14.722]
  - - [4096, 2048, 1, 1024, 4096, 4096, 1024, 2048]
    - [47, 18.706]
  - - [4096, 2048, 1, 2048, 4096, 4096, 2048, 2048]
    - [78, 20.376]
  - - [4096, 2048, 1, 4096, 4096, 4096, 4096, 2048]
    - [42, 19.967]
  - - [4096, 2048, 1, 8192, 4096, 4096, 8192, 2048]
    - [36, 22.722]
  - - [4096, 4096, 1, 128, 4096, 4096, 128, 4096]
    - [91, 6.464]
  - - [4096, 4096, 1, 256, 4096, 4096, 256, 4096]
    - [33, 10.258]
  - - [4096, 4096, 1, 512, 4096, 4096, 512, 4096]
    - [0, 14.408]
  - - [4096, 4096, 1, 1024, 4096, 4096, 1024, 4096]
    - [42, 18.288]
  - - [4096, 4096, 1, 2048, 4096, 4096, 2048, 4096]
    - [70, 19.724]
  - - [4096, 4096, 1, 4096, 4096, 4096, 4096, 4096]
    - [34, 22.882]
  - - [4096, 4096, 1, 8192, 4096, 4096, 8192, 4096]
    - [37, 24.864]
  - - [4096, 8192, 1, 128, 4096, 4096, 128, 8192]
    - [19, 5.685]
  - - [4096, 8192, 1, 256, 4096, 4096, 256, 8192]
    - [59, 8.617]
  - - [4096, 8192, 1, 512, 4096, 4096, 512, 8192]
    - [43, 13.091]
  - - [4096, 8192, 1, 1024, 4096, 4096, 1024, 8192]
    - [48, 17.667]
  - - [4096, 8192, 1, 2048, 4096, 4096, 2048, 8192]
    - [33, 21.941]
  - - [4096, 8192, 1, 4096, 4096, 4096, 4096, 8192]
    - [71, 23.801]
  - - [4096, 8192, 1, 8192, 4096, 4096, 8192, 8192]
    - [1, 26.261]
  - - [8192, 128, 1, 128, 8192, 8192, 128, 128]
    - [10, 3.281]
  - - [8192, 128, 1, 256, 8192, 8192, 256, 128]
    - [24, 5.551]
  - - [8192, 128, 1, 512, 8192, 8192, 512, 128]
    - [102, 8.247]
  - - [8192, 128, 1, 1024, 8192, 8192, 1024, 128]
    - [99, 10.943]
  - - [8192, 128, 1, 2048, 8192, 8192, 2048, 128]
    - [99, 12.511]
  - - [8192, 128, 1, 4096, 8192, 8192, 4096, 128]
    - [13, 14.705]
  - - [8192, 128, 1, 8192, 8192, 8192, 8192, 128]
    - [15, 16.32]
  - - [8192, 256, 1, 128, 8192, 8192, 128, 256]
    - [94, 4.647]
  - - [8192, 256, 1, 256, 8192, 8192, 256, 256]
    - [85, 7.7]
  - - [8192, 256, 1, 512, 8192, 8192, 512, 256]
    - [87, 11.21]
  - - [8192, 256, 1, 1024, 8192, 8192, 1024, 256]
    - [85, 14.333]
  - - [8192, 256, 1, 2048, 8192, 8192, 2048, 256]
    - [87, 16.039]
  - - [8192, 256, 1, 4096, 8192, 8192, 4096, 256]
    - [79, 16.639]
  - - [8192, 256, 1, 8192, 8192, 8192, 8192, 256]
    - [45, 17.853]
  - - [8192, 512, 1, 128, 8192, 8192, 128, 512]
    - [58, 5.73]
  - - [8192, 512, 1, 256, 8192, 8192, 256, 512]
    - [57, 9.152]
  - - [8192, 512, 1, 512, 8192, 8192, 512, 512]
    - [53, 12.939]
  - - [8192, 512, 1, 1024, 8192, 8192, 1024, 512]
    - [53, 16.129]
  - - [8192, 512, 1, 2048, 8192, 8192, 2048, 512]
    - [80, 18.683]
  - - [8192, 512, 1, 4096, 8192, 8192, 4096, 512]
    - [45, 18.448]
  - - [8192, 512, 1, 8192, 8192, 8192, 8192, 512]
    - [72, 19.969]
  - - [8192, 1024, 1, 128, 8192, 8192, 128, 1024]
    - [5, 6.334]
  - - [8192, 1024, 1, 256, 8192, 8192, 256, 1024]
    - [52, 10.446]
  - - [8192, 1024, 1, 512, 8192, 8192, 512, 1024]
    - [52, 15.413]
  - - [8192, 1024, 1, 1024, 8192, 8192, 1024, 1024]
    - [47, 19.554]
  - - [8192, 1024, 1, 2048, 8192, 8192, 2048, 1024]
    - [75, 20.258]
  - - [8192, 1024, 1, 4096, 8192, 8192, 4096, 1024]
    - [34, 19.834]
  - - [8192, 1024, 1, 8192, 8192, 8192, 8192, 1024]
    - [42, 21.978]
  - - [8192, 2048, 1, 128, 8192, 8192, 128, 2048]
    - [32, 6.325]
  - - [8192, 2048, 1, 256, 8192, 8192, 256, 2048]
    - [35, 10.267]
  - - [8192, 2048, 1, 512, 8192, 8192, 512, 2048]
    - [39, 14.418]
  - - [8192, 2048, 1, 1024, 8192, 8192, 1024, 2048]
    - [42, 18.902]
  - - [8192, 2048, 1, 2048, 8192, 8192, 2048, 2048]
    - [45, 18.97]
  - - [8192, 2048, 1, 4096, 8192, 8192, 4096, 2048]
    - [77, 21.449]
  - - [8192, 2048, 1, 8192, 8192, 8192, 8192, 2048]
    - [42, 23.827]
  - - [8192, 4096, 1, 128, 8192, 8192, 128, 4096]
    - [17, 5.726]
  - - [8192, 4096, 1, 256, 8192, 8192, 256, 4096]
    - [46, 8.563]
  - - [8192, 4096, 1, 512, 8192, 8192, 512, 4096]
    - [48, 13.188]
  - - [8192, 4096, 1, 1024, 8192, 8192, 1024, 4096]
    - [48, 17.592]
  - - [8192, 4096, 1, 2048, 8192, 8192, 2048, 4096]
    - [34, 21.659]
  - - [8192, 4096, 1, 4096, 8192, 8192, 4096, 4096]
    - [34, 23.901]
  - - [8192, 4096, 1, 8192, 8192, 8192, 8192, 4096]
    - [42, 26.149]
  - - [8192, 8192, 1, 128, 8192, 8192, 128, 8192]
    - [6, 5.521]
  - - [8192, 8192, 1, 256, 8192, 8192, 256, 8192]
    - [50, 8.989]
  - - [8192, 8192, 1, 512, 8192, 8192, 512, 8192]
    - [51, 13.757]
  - - [8192, 8192, 1, 1024, 8192, 8192, 1024, 8192]
    - [50, 19.566]
  - - [8192, 8192, 1, 2048, 8192, 8192, 2048, 8192]
    - [41, 23.296]
  - - [8192, 8192, 1, 4096, 8192, 8192, 4096, 8192]
    - [42, 26.207]
  - - [8192, 8192, 1, 8192, 8192, 8192, 8192, 8192]
    - [38, 26.447]
  - - [1, 1, 1, 32, 1, 1, 32, 1]
    - [115, 0.0]
- null
- null
- DeviceEfficiency
- GridBased
