library/src/amd_detail/rocblaslt/src/Tensile/Logic/streamk/gfx942a/aquavanjaram942_Cijk_Ailk_Bljk_HSS_BH_UserArgs.yaml
- {MinimumRequiredVersion: 4.33.0}
- aquavanjaram942
- gfx942
- [Device 0049, Device 0050]
    SolutionIndex: 0
    SolutionNameMin: Cijk_Ailk_Bljk_HSS_BH_UserArgs_MT128x256x32_MI16x16x1_SN_LDSB1_CLR1_GSU0_GSUC0_GSUWGMRR0_K1_LBSPPA1024_LBSPPB128_LPA16_MIWT4_8_PLR1_SU32_SUM0_SUS256_SKXCCM0_VWA1_VWB1_WGM1_WGMXCC1_WGMXCCGn1
    SolutionIndex: 1
    SolutionNameMin: Cijk_Ailk_Bljk_HSS_BH_UserArgs_MT128x256x32_MI16x16x1_SN_LDSB1_CLR1_GSU0_GSUC0_GSUWGMRR0_K1_LBSPPA1024_LBSPPB128_LPA0_MIWT4_8_PLR1_SU32_SUM0_SUS256_SKXCCM0_VWA4_VWB1_WGM1_WGMXCC1_WGMXCCGn1
    SolutionIndex: 2
    SolutionNameMin: Cijk_Ailk_Bljk_HSS_BH_UserArgs_MT128x256x32_MI16x16x1_SN_LDSB1_CLR1_GSU0_GSUC0_GSUWGMRR0_K1_LBSPPA1024_LBSPPB128_LPA16_MIWT4_8_PLR1_SU32_SUM0_SUS256_SKXCCM0_VWA1_VWB2_WGM1_WGMXCC1_WGMXCCGn1
    SolutionIndex: 3
    SolutionNameMin: Cijk_Ailk_Bljk_HSS_BH_UserArgs_MT256x128x32_MI16x16x1_SN_LDSB1_CLR1_GSU0_GSUC0_GSUWGMRR0_K1_LBSPPA2048_LBSPPB128_LPA0_MIWT8_4_PLR1_SU32_SUM0_SUS256_SKXCCM0_VWA4_VWB2_WGM1_WGMXCC1_WGMXCCGn1
    SolutionIndex: 4
    SolutionNameMin: Cijk_Ailk_Bljk_HSS_BH_UserArgs_MT256x128x32_MI16x16x1_SN_LDSB1_CLR1_GSU0_GSUC0_GSUWGMRR0_K1_LBSPPA2048_LBSPPB256_LPA0_MIWT8_4_PLR1_SU32_SUM0_SUS256_SKXCCM0_VWA4_VWB4_WGM1_WGMXCC1_WGMXCCGn1
    SolutionIndex: 5
    SolutionNameMin: Cijk_Ailk_Bljk_HSS_BH_UserArgs_MT256x128x32_MI16x16x1_SN_LDSB1_CLR1_GSU0_GSUC0_GSUWGMRR0_K1_LBSPPA2048_LBSPPB128_LPA0_MIWT8_4_PLR1_SU32_SUM0_SUS256_SKXCCM0_VWA4_VWB1_WGM4_WGMXCC1_WGMXCCGn1
    SolutionIndex: 6
    SolutionNameMin: Cijk_Ailk_Bljk_HSS_BH_UserArgs_MT256x64x32_MI16x16x1_SN_LDSB1_CLR1_GSU0_GSUC0_GSUWGMRR0_K1_LBSPPA2048_LBSPPB128_LPA0_MIWT8_2_PLR1_SU32_SUM0_SUS256_SKXCCM0_VWA4_VWB1_WGM8_WGMXCC1_WGMXCCGn1
    SolutionIndex: 7
    SolutionNameMin: Cijk_Ailk_Bljk_HSS_BH_UserArgs_MT128x128x32_MI16x16x1_SN_LDSB1_CLR1_GSU0_GSUC0_GSUWGMRR0_K1_LBSPPA1024_LBSPPB128_LPA0_MIWT4_4_PLR1_SU32_SUM0_SUS256_SKXCCM0_VWA4_VWB1_WGM1_WGMXCC1_WGMXCCGn1
    SolutionIndex: 8
    SolutionNameMin: Cijk_Ailk_Bljk_HSS_BH_UserArgs_MT128x128x32_MI16x16x1_SN_LDSB1_CLR1_GSU0_GSUC0_GSUWGMRR0_K1_LBSPPA1024_LBSPPB128_LPA0_MIWT4_4_PLR1_SU32_SUM0_SUS256_SKXCCM0_VWA4_VWB1_WGM4_WGMXCC1_WGMXCCGn1
    SolutionIndex: 9
    SolutionNameMin: Cijk_Ailk_Bljk_HSS_BH_UserArgs_MT128x64x32_MI16x16x1_SN_LDSB0_CLR1_GSU0_GSUC0_GSUWGMRR0_K1_LBSPPA1024_LBSPPB128_LPA0_MIWT4_2_PLR1_SU32_SUM0_SUS256_SKXCCM0_VWA4_VWB1_WGM1_WGMXCC1_WGMXCCGn1
    SolutionIndex: 10
    SolutionNameMin: Cijk_Ailk_Bljk_HSS_BH_UserArgs_MT128x64x32_MI16x16x1_SN_LDSB0_CLR1_GSU0_GSUC0_GSUWGMRR0_K1_LBSPPA1024_LBSPPB128_LPA0_MIWT4_2_PLR1_SU32_SUM0_SUS256_SKXCCM0_VWA4_VWB2_WGM1_WGMXCC1_WGMXCCGn1
    SolutionIndex: 11
    SolutionNameMin: Cijk_Ailk_Bljk_HSS_BH_UserArgs_MT128x64x32_MI16x16x1_SN_LDSB0_CLR0_GSU0_GSUC0_GSUWGMRR0_K1_LBSPPA1024_LBSPPB128_LPA0_MIWT4_2_PLR0_SU32_SUM0_SUS256_SKXCCM0_VWA4_VWB1_WGM1_WGMXCC1_WGMXCCGn1
    SolutionIndex: 12
    SolutionNameMin: Cijk_Ailk_Bljk_HSS_BH_UserArgs_MT128x64x32_MI16x16x1_SN_LDSB0_CLR1_GSU0_GSUC0_GSUWGMRR0_K1_LBSPPA1024_LBSPPB128_LPA0_MIWT4_2_PLR1_SU32_SUM0_SUS256_SKXCCM0_VWA4_VWB1_WGM8_WGMXCC1_WGMXCCGn1
    SolutionIndex: 13
    SolutionNameMin: Cijk_Ailk_Bljk_HSS_BH_UserArgs_MT32x32x32_MI16x16x1_SN_LDSB0_CLR0_GSU0_GSUC0_GSUWGMRR0_K1_LBSPPA256_LBSPPB128_LPA16_MIWT1_1_PLR0_SU32_SUM0_SUS256_SKXCCM0_VWA1_VWB1_WGM1_WGMXCC1_WGMXCCGn1
    SolutionIndex: 14
    SolutionNameMin: Cijk_Ailk_Bljk_HSS_BH_UserArgs_MT128x128x64_MI16x16x1_SN_LDSB1_CLR1_GSU0_GSUC0_GSUWGMRR0_K1_LBSPPA2048_LBSPPB512_LPA0_MIWT4_4_PLR1_SU32_SUM0_SUS256_SKXCCM0_VWA4_VWB4_WGM1_WGMXCC1_WGMXCCGn1
    SolutionIndex: 15
    SolutionNameMin: Cijk_Ailk_Bljk_HSS_BH_UserArgs_MT64x128x64_MI16x16x1_SN_LDSB1_CLR1_GSU0_GSUC0_GSUWGMRR0_K1_LBSPPA1024_LBSPPB128_LPA32_MIWT2_4_PLR2_SU32_SUM0_SUS256_SKXCCM0_VWA2_VWB1_WGM1_WGMXCC1_WGMXCCGn1
    SolutionIndex: 16
    SolutionNameMin: Cijk_Ailk_Bljk_HSS_BH_UserArgs_MT64x128x64_MI16x16x1_SN_LDSB1_CLR1_GSU0_GSUC0_GSUWGMRR0_K1_LBSPPA1024_LBSPPB512_LPA32_MIWT2_4_PLR2_SU32_SUM0_SUS256_SKXCCM0_VWA2_VWB4_WGM4_WGMXCC1_WGMXCCGn1
    SolutionIndex: 17
    SolutionNameMin: Cijk_Ailk_Bljk_HSS_BH_UserArgs_MT128x64x64_MI16x16x1_SN_LDSB1_CLR1_GSU0_GSUC0_GSUWGMRR0_K1_LBSPPA2048_LBSPPB128_LPA0_MIWT4_2_PLR1_SU32_SUM0_SUS256_SKXCCM0_VWA4_VWB1_WGM1_WGMXCC1_WGMXCCGn1
    SolutionIndex: 18
    SolutionNameMin: Cijk_Ailk_Bljk_HSS_BH_UserArgs_MT128x64x64_MI16x16x1_SN_LDSB1_CLR1_GSU0_GSUC0_GSUWGMRR0_K1_LBSPPA2048_LBSPPB256_LPA0_MIWT4_2_PLR1_SU32_SUM0_SUS256_SKXCCM0_VWA4_VWB2_WGM1_WGMXCC1_WGMXCCGn1
    SolutionIndex: 19
    SolutionNameMin: Cijk_Ailk_Bljk_HSS_BH_UserArgs_MT128x64x64_MI16x16x1_SN_LDSB1_CLR1_GSU0_GSUC0_GSUWGMRR0_K1_LBSPPA2048_LBSPPB128_LPA0_MIWT4_2_PLR2_SU32_SUM0_SUS256_SKXCCM0_VWA4_VWB1_WGM1_WGMXCC1_WGMXCCGn1
    SolutionIndex: 20
    SolutionNameMin: Cijk_Ailk_Bljk_HSS_BH_UserArgs_MT128x64x64_MI16x16x1_SN_LDSB1_CLR1_GSU0_GSUC0_GSUWGMRR0_K1_LBSPPA2048_LBSPPB128_LPA0_MIWT4_2_PLR1_SU32_SUM0_SUS256_SKXCCM0_VWA4_VWB1_WGM4_WGMXCC1_WGMXCCGn1
    SolutionIndex: 21
    SolutionNameMin: Cijk_Ailk_Bljk_HSS_BH_UserArgs_MT128x64x64_MI16x16x1_SN_LDSB1_CLR1_GSU0_GSUC0_GSUWGMRR0_K1_LBSPPA2048_LBSPPB256_LPA0_MIWT4_2_PLR1_SU32_SUM0_SUS256_SKXCCM0_VWA4_VWB2_WGM4_WGMXCC1_WGMXCCGn1
    SolutionIndex: 22
    SolutionNameMin: Cijk_Ailk_Bljk_HSS_BH_UserArgs_MT128x64x64_MI16x16x1_SN_LDSB1_CLR1_GSU0_GSUC0_GSUWGMRR0_K1_LBSPPA2048_LBSPPB256_LPA0_MIWT4_2_PLR2_SU32_SUM0_SUS256_SKXCCM0_VWA4_VWB2_WGM4_WGMXCC1_WGMXCCGn1
    SolutionIndex: 23
    SolutionNameMin: Cijk_Ailk_Bljk_HSS_BH_UserArgs_MT128x64x64_MI16x16x1_SN_LDSB1_CLR1_GSU0_GSUC0_GSUWGMRR0_K1_LBSPPA2048_LBSPPB256_LPA0_MIWT4_2_PLR1_SU32_SUM0_SUS256_SKXCCM0_VWA4_VWB2_WGM8_WGMXCC1_WGMXCCGn1
    SolutionIndex: 24
    SolutionNameMin: Cijk_Ailk_Bljk_HSS_BH_UserArgs_MT64x64x64_MI16x16x1_SN_LDSB1_CLR1_GSU0_GSUC0_GSUWGMRR0_K1_LBSPPA1024_LBSPPB128_LPA16_MIWT2_2_PLR1_SU32_SUM0_SUS256_SKXCCM0_VWA1_VWB1_WGM1_WGMXCC1_WGMXCCGn1
    SolutionIndex: 25
    SolutionNameMin: Cijk_Ailk_Bljk_HSS_BH_UserArgs_MT64x64x64_MI16x16x1_SN_LDSB1_CLR1_GSU0_GSUC0_GSUWGMRR0_K1_LBSPPA1024_LBSPPB128_LPA32_MIWT2_2_PLR1_SU32_SUM0_SUS256_SKXCCM0_VWA2_VWB1_WGM1_WGMXCC1_WGMXCCGn1
    SolutionIndex: 26
    SolutionNameMin: Cijk_Ailk_Bljk_HSS_BH_UserArgs_MT64x64x64_MI16x16x1_SN_LDSB1_CLR1_GSU0_GSUC0_GSUWGMRR0_K1_LBSPPA1024_LBSPPB256_LPA16_MIWT2_2_PLR1_SU32_SUM0_SUS256_SKXCCM0_VWA1_VWB2_WGM1_WGMXCC1_WGMXCCGn1
    SolutionIndex: 27
    SolutionNameMin: Cijk_Ailk_Bljk_HSS_BH_UserArgs_MT64x64x64_MI16x16x1_SN_LDSB1_CLR1_GSU0_GSUC0_GSUWGMRR0_K1_LBSPPA1024_LBSPPB256_LPA32_MIWT2_2_PLR1_SU32_SUM0_SUS256_SKXCCM0_VWA2_VWB2_WGM1_WGMXCC1_WGMXCCGn1
    SolutionIndex: 28
    SolutionNameMin: Cijk_Ailk_Bljk_HSS_BH_UserArgs_MT64x64x64_MI16x16x1_SN_LDSB1_CLR1_GSU0_GSUC0_GSUWGMRR0_K1_LBSPPA1024_LBSPPB256_LPA32_MIWT2_2_PLR1_SU32_SUM0_SUS256_SKXCCM0_VWA2_VWB2_WGM4_WGMXCC1_WGMXCCGn1
    SolutionIndex: 29
    SolutionNameMin: Cijk_Ailk_Bljk_HSS_BH_UserArgs_MT64x64x64_MI16x16x1_SN_LDSB1_CLR1_GSU0_GSUC0_GSUWGMRR0_K1_LBSPPA1024_LBSPPB256_LPA16_MIWT2_2_PLR1_SU32_SUM0_SUS256_SKXCCM0_VWA1_VWB2_WGM8_WGMXCC1_WGMXCCGn1
    SolutionIndex: 30
    SolutionNameMin: Cijk_Ailk_Bljk_HSS_BH_UserArgs_MT64x32x64_MI16x16x1_SN_LDSB0_CLR1_GSU0_GSUC0_GSUWGMRR0_K1_LBSPPA1024_LBSPPB128_LPA32_MIWT2_1_PLR1_SU32_SUM0_SUS256_SKXCCM0_VWA2_VWB1_WGM1_WGMXCC1_WGMXCCGn1
    SolutionIndex: 31
    SolutionNameMin: Cijk_Ailk_Bljk_HSS_BH_UserArgs_MT32x32x64_MI16x16x1_SN_LDSB0_CLR1_GSU0_GSUC0_GSUWGMRR0_K1_LBSPPA512_LBSPPB128_LPA16_MIWT1_1_PLR1_SU32_SUM0_SUS256_SKXCCM0_VWA1_VWB1_WGM1_WGMXCC1_WGMXCCGn1
    SolutionIndex: 32
    SolutionNameMin: Cijk_Ailk_Bljk_HSS_BH_UserArgs_MT64x64x128_MI16x16x1_SN_LDSB1_CLR1_GSU0_GSUC0_GSUWGMRR0_K1_LBSPPA1024_LBSPPB256_LPA32_MIWT2_2_PLR2_SU32_SUM0_SUS256_SKXCCM0_VWA2_VWB1_WGM1_WGMXCC1_WGMXCCGn1
    SolutionIndex: 33
    SolutionNameMin: Cijk_Ailk_Bljk_HSS_BH_UserArgs_MT64x64x128_MI16x16x1_SN_LDSB1_CLR1_GSU0_GSUC0_GSUWGMRR0_K1_LBSPPA1024_LBSPPB512_LPA32_MIWT2_2_PLR2_SU32_SUM0_SUS256_SKXCCM0_VWA2_VWB2_WGM1_WGMXCC1_WGMXCCGn1
    SolutionIndex: 34
    SolutionNameMin: Cijk_Ailk_Bljk_HSS_BH_UserArgs_MT32x64x128_MI16x16x1_SN_LDSB1_CLR1_GSU0_GSUC0_GSUWGMRR0_K1_LBSPPA512_LBSPPB512_LPA16_MIWT1_2_PLR2_SU32_SUM0_SUS256_SKXCCM0_VWA1_VWB2_WGM1_WGMXCC1_WGMXCCGn1
    SolutionIndex: 35
    SolutionNameMin: Cijk_Ailk_Bljk_HSS_BH_UserArgs_MT64x32x128_MI16x16x1_SN_LDSB1_CLR1_GSU0_GSUC0_GSUWGMRR0_K1_LBSPPA1024_LBSPPB256_LPA32_MIWT2_1_PLR1_SU32_SUM0_SUS256_SKXCCM0_VWA2_VWB1_WGM1_WGMXCC1_WGMXCCGn1
    SolutionIndex: 36
    SolutionNameMin: Cijk_Ailk_Bljk_HSS_BH_UserArgs_MT64x32x128_MI16x16x1_SN_LDSB1_CLR1_GSU0_GSUC0_GSUWGMRR0_K1_LBSPPA1024_LBSPPB256_LPA32_MIWT2_1_PLR2_SU32_SUM0_SUS256_SKXCCM0_VWA2_VWB1_WGM1_WGMXCC1_WGMXCCGn1
    SolutionIndex: 37
    SolutionNameMin: Cijk_Ailk_Bljk_HSS_BH_UserArgs_MT32x32x128_MI16x16x1_SN_LDSB1_CLR1_GSU0_GSUC0_GSUWGMRR0_K1_LBSPPA512_LBSPPB256_LPA16_MIWT1_1_PLR1_SU32_SUM0_SUS256_SKXCCM0_VWA1_VWB1_WGM1_WGMXCC1_WGMXCCGn1
    SolutionIndex: 38
    SolutionNameMin: Cijk_Ailk_Bljk_HSS_BH_UserArgs_MT32x32x128_MI16x16x1_SN_LDSB1_CLR1_GSU0_GSUC0_GSUWGMRR0_K1_LBSPPA512_LBSPPB256_LPA16_MIWT1_1_PLR2_SU32_SUM0_SUS256_SKXCCM0_VWA1_VWB1_WGM1_WGMXCC1_WGMXCCGn1
    SolutionIndex: 39
    SolutionNameMin: Cijk_Ailk_Bljk_HSS_BH_UserArgs_MT32x32x128_MI16x16x1_SN_LDSB1_CLR1_GSU0_GSUC0_GSUWGMRR0_K1_LBSPPA512_LBSPPB256_LPA16_MIWT1_1_PLR1_SU32_SUM0_SUS256_SKXCCM0_VWA1_VWB1_WGM8_WGMXCC1_WGMXCCGn1
    SolutionIndex: 40
    SolutionNameMin: Cijk_Ailk_Bljk_HSS_BH_UserArgs_MT256x256x32_MI16x16x1_SN_LDSB1_CLR1_GSU0_GSUC0_GSUWGMRR0_K1_LBSPPA2048_LBSPPB128_LPA0_MIWT8_8_PLR1_SU32_SUM0_SUS256_SKXCCM6_VWA4_VWB1_WGM1_WGMXCC1_WGMXCCGn1
    SolutionIndex: 41
    SolutionNameMin: Cijk_Ailk_Bljk_HSS_BH_UserArgs_MT256x256x32_MI16x16x1_SN_LDSB1_CLR1_GSU0_GSUC0_GSUWGMRR0_K1_LBSPPA2048_LBSPPB256_LPA0_MIWT8_8_PLR1_SU32_SUM0_SUS256_SKXCCM6_VWA4_VWB4_WGM1_WGMXCC1_WGMXCCGn1
    SolutionIndex: 42
    SolutionNameMin: Cijk_Ailk_Bljk_HSS_BH_UserArgs_MT256x256x32_MI16x16x1_SN_LDSB1_CLR1_GSU0_GSUC0_GSUWGMRR0_K1_LBSPPA2048_LBSPPB512_LPA0_MIWT8_8_PLR1_SU32_SUM0_SUS256_SKXCCM6_VWA4_VWB8_WGM1_WGMXCC1_WGMXCCGn1
    SolutionIndex: 43
    SolutionNameMin: Cijk_Ailk_Bljk_HSS_BH_UserArgs_MT256x256x32_MI16x16x1_SN_LDSB1_CLR1_GSU0_GSUC0_GSUWGMRR0_K1_LBSPPA2048_LBSPPB128_LPA0_MIWT8_8_PLR1_SU32_SUM0_SUS256_SKXCCM6_VWA4_VWB1_WGM4_WGMXCC1_WGMXCCGn1
    SolutionIndex: 44
    SolutionNameMin: Cijk_Ailk_Bljk_HSS_BH_UserArgs_MT256x256x32_MI16x16x1_SN_LDSB1_CLR1_GSU0_GSUC0_GSUWGMRR0_K1_LBSPPA2048_LBSPPB256_LPA0_MIWT8_8_PLR1_SU32_SUM0_SUS256_SKXCCM6_VWA4_VWB4_WGM4_WGMXCC1_WGMXCCGn1
    SolutionIndex: 45
    SolutionNameMin: Cijk_Ailk_Bljk_HSS_BH_UserArgs_MT256x256x32_MI16x16x1_SN_LDSB1_CLR1_GSU0_GSUC0_GSUWGMRR0_K1_LBSPPA2048_LBSPPB128_LPA0_MIWT8_8_PLR1_SU32_SUM0_SUS256_SKXCCM6_VWA4_VWB1_WGM8_WGMXCC1_WGMXCCGn1
    SolutionIndex: 46
    SolutionNameMin: Cijk_Ailk_Bljk_HSS_BH_UserArgs_MT256x256x32_MI16x16x1_SN_LDSB1_CLR1_GSU0_GSUC0_GSUWGMRR0_K1_LBSPPA2048_LBSPPB128_LPA0_MIWT8_8_PLR1_SU32_SUM0_SUS256_SKXCCM6_VWA4_VWB2_WGM8_WGMXCC1_WGMXCCGn1
    SolutionIndex: 47
    SolutionNameMin: Cijk_Ailk_Bljk_HSS_BH_UserArgs_MT256x256x32_MI16x16x1_SN_LDSB1_CLR1_GSU0_GSUC0_GSUWGMRR0_K1_LBSPPA2048_LBSPPB512_LPA0_MIWT8_8_PLR1_SU32_SUM0_SUS256_SKXCCM6_VWA4_VWB8_WGM8_WGMXCC1_WGMXCCGn1
    SolutionIndex: 48
    SolutionNameMin: Cijk_Ailk_Bljk_HSS_BH_UserArgs_MT128x256x32_MI16x16x1_SN_LDSB1_CLR1_GSU0_GSUC0_GSUWGMRR0_K1_LBSPPA1024_LBSPPB128_LPA0_MIWT4_8_PLR1_SU32_SUM0_SUS256_SKXCCM6_VWA4_VWB1_WGM1_WGMXCC1_WGMXCCGn1
    SolutionIndex: 49
    SolutionNameMin: Cijk_Ailk_Bljk_HSS_BH_UserArgs_MT256x128x32_MI16x16x1_SN_LDSB1_CLR1_GSU0_GSUC0_GSUWGMRR0_K1_LBSPPA2048_LBSPPB128_LPA0_MIWT8_4_PLR1_SU32_SUM0_SUS256_SKXCCM6_VWA4_VWB1_WGM1_WGMXCC1_WGMXCCGn1
    SolutionIndex: 50
    SolutionNameMin: Cijk_Ailk_Bljk_HSS_BH_UserArgs_MT256x128x32_MI16x16x1_SN_LDSB1_CLR1_GSU0_GSUC0_GSUWGMRR0_K1_LBSPPA2048_LBSPPB128_LPA0_MIWT8_4_PLR1_SU32_SUM0_SUS256_SKXCCM6_VWA4_VWB2_WGM1_WGMXCC1_WGMXCCGn1
    SolutionIndex: 51
    SolutionNameMin: Cijk_Ailk_Bljk_HSS_BH_UserArgs_MT256x128x32_MI16x16x1_SN_LDSB1_CLR1_GSU0_GSUC0_GSUWGMRR0_K1_LBSPPA2048_LBSPPB256_LPA0_MIWT8_4_PLR1_SU32_SUM0_SUS256_SKXCCM6_VWA4_VWB4_WGM1_WGMXCC1_WGMXCCGn1
    SolutionIndex: 52
    SolutionNameMin: Cijk_Ailk_Bljk_HSS_BH_UserArgs_MT256x128x32_MI16x16x1_SN_LDSB1_CLR1_GSU0_GSUC0_GSUWGMRR0_K1_LBSPPA2048_LBSPPB128_LPA0_MIWT8_4_PLR1_SU32_SUM0_SUS256_SKXCCM6_VWA4_VWB1_WGM4_WGMXCC1_WGMXCCGn1
    SolutionIndex: 53
    SolutionNameMin: Cijk_Ailk_Bljk_HSS_BH_UserArgs_MT256x128x32_MI16x16x1_SN_LDSB1_CLR1_GSU0_GSUC0_GSUWGMRR0_K1_LBSPPA2048_LBSPPB256_LPA0_MIWT8_4_PLR1_SU32_SUM0_SUS256_SKXCCM6_VWA4_VWB4_WGM4_WGMXCC1_WGMXCCGn1
    SolutionIndex: 54
    SolutionNameMin: Cijk_Ailk_Bljk_HSS_BH_UserArgs_MT256x128x32_MI16x16x1_SN_LDSB1_CLR1_GSU0_GSUC0_GSUWGMRR0_K1_LBSPPA2048_LBSPPB128_LPA0_MIWT8_4_PLR1_SU32_SUM0_SUS256_SKXCCM6_VWA4_VWB1_WGM8_WGMXCC1_WGMXCCGn1
    SolutionIndex: 55
    SolutionNameMin: Cijk_Ailk_Bljk_HSS_BH_UserArgs_MT256x128x32_MI16x16x1_SN_LDSB1_CLR1_GSU0_GSUC0_GSUWGMRR0_K1_LBSPPA2048_LBSPPB128_LPA0_MIWT8_4_PLR1_SU32_SUM0_SUS256_SKXCCM6_VWA4_VWB2_WGM8_WGMXCC1_WGMXCCGn1
    SolutionIndex: 56
    SolutionNameMin: Cijk_Ailk_Bljk_HSS_BH_UserArgs_MT128x128x32_MI16x16x1_SN_LDSB1_CLR1_GSU0_GSUC0_GSUWGMRR0_K1_LBSPPA1024_LBSPPB128_LPA32_MIWT4_4_PLR1_SU32_SUM0_SUS256_SKXCCM6_VWA2_VWB1_WGM1_WGMXCC1_WGMXCCGn1
    SolutionIndex: 57
    SolutionNameMin: Cijk_Ailk_Bljk_HSS_BH_UserArgs_MT128x128x32_MI16x16x1_SN_LDSB1_CLR1_GSU0_GSUC0_GSUWGMRR0_K1_LBSPPA1024_LBSPPB128_LPA0_MIWT4_4_PLR1_SU32_SUM0_SUS256_SKXCCM6_VWA4_VWB1_WGM1_WGMXCC1_WGMXCCGn1
    SolutionIndex: 58
    SolutionNameMin: Cijk_Ailk_Bljk_HSS_BH_UserArgs_MT128x128x32_MI16x16x1_SN_LDSB1_CLR1_GSU0_GSUC0_GSUWGMRR0_K1_LBSPPA1024_LBSPPB256_LPA0_MIWT4_4_PLR1_SU32_SUM0_SUS256_SKXCCM6_VWA4_VWB4_WGM1_WGMXCC1_WGMXCCGn1
    SolutionIndex: 59
    SolutionNameMin: Cijk_Ailk_Bljk_HSS_BH_UserArgs_MT128x128x32_MI16x16x1_SN_LDSB1_CLR1_GSU0_GSUC0_GSUWGMRR0_K1_LBSPPA1024_LBSPPB128_LPA16_MIWT4_4_PLR1_SU32_SUM0_SUS256_SKXCCM6_VWA1_VWB1_WGM4_WGMXCC1_WGMXCCGn1
    SolutionIndex: 60
    SolutionNameMin: Cijk_Ailk_Bljk_HSS_BH_UserArgs_MT128x128x32_MI16x16x1_SN_LDSB1_CLR1_GSU0_GSUC0_GSUWGMRR0_K1_LBSPPA1024_LBSPPB128_LPA0_MIWT4_4_PLR1_SU32_SUM0_SUS256_SKXCCM6_VWA4_VWB1_WGM4_WGMXCC1_WGMXCCGn1
    SolutionIndex: 61
    SolutionNameMin: Cijk_Ailk_Bljk_HSS_BH_UserArgs_MT128x128x32_MI16x16x1_SN_LDSB1_CLR1_GSU0_GSUC0_GSUWGMRR0_K1_LBSPPA1024_LBSPPB128_LPA0_MIWT4_4_PLR1_SU32_SUM0_SUS256_SKXCCM6_VWA4_VWB2_WGM4_WGMXCC1_WGMXCCGn1
    SolutionIndex: 62
    SolutionNameMin: Cijk_Ailk_Bljk_HSS_BH_UserArgs_MT128x128x32_MI16x16x1_SN_LDSB1_CLR1_GSU0_GSUC0_GSUWGMRR0_K1_LBSPPA1024_LBSPPB128_LPA0_MIWT4_4_PLR1_SU32_SUM0_SUS256_SKXCCM6_VWA4_VWB1_WGM8_WGMXCC1_WGMXCCGn1
    SolutionIndex: 63
    SolutionNameMin: Cijk_Ailk_Bljk_HSS_BH_UserArgs_MT128x128x32_MI16x16x1_SN_LDSB1_CLR1_GSU0_GSUC0_GSUWGMRR0_K1_LBSPPA1024_LBSPPB128_LPA16_MIWT4_4_PLR1_SU32_SUM0_SUS256_SKXCCM6_VWA1_VWB2_WGM8_WGMXCC1_WGMXCCGn1
    SolutionIndex: 64
    SolutionNameMin: Cijk_Ailk_Bljk_HSS_BH_UserArgs_MT128x128x32_MI16x16x1_SN_LDSB1_CLR1_GSU0_GSUC0_GSUWGMRR0_K1_LBSPPA1024_LBSPPB128_LPA0_MIWT4_4_PLR1_SU32_SUM0_SUS256_SKXCCM6_VWA4_VWB2_WGM8_WGMXCC1_WGMXCCGn1
    SolutionIndex: 65
    SolutionNameMin: Cijk_Ailk_Bljk_HSS_BH_UserArgs_MT128x128x32_MI16x16x1_SN_LDSB1_CLR1_GSU0_GSUC0_GSUWGMRR0_K1_LBSPPA1024_LBSPPB256_LPA16_MIWT4_4_PLR1_SU32_SUM0_SUS256_SKXCCM6_VWA1_VWB4_WGM8_WGMXCC1_WGMXCCGn1
    SolutionIndex: 66
    SolutionNameMin: Cijk_Ailk_Bljk_HSS_BH_UserArgs_MT128x128x32_MI16x16x1_SN_LDSB1_CLR1_GSU0_GSUC0_GSUWGMRR0_K1_LBSPPA1024_LBSPPB256_LPA0_MIWT4_4_PLR1_SU32_SUM0_SUS256_SKXCCM6_VWA4_VWB4_WGM8_WGMXCC1_WGMXCCGn1
    SolutionIndex: 67
    SolutionNameMin: Cijk_Ailk_Bljk_HSS_BH_UserArgs_MT128x64x32_MI16x16x1_SN_LDSB0_CLR1_GSU0_GSUC0_GSUWGMRR0_K1_LBSPPA1024_LBSPPB128_LPA0_MIWT4_2_PLR1_SU32_SUM0_SUS256_SKXCCM6_VWA4_VWB1_WGM1_WGMXCC1_WGMXCCGn1
    SolutionIndex: 68
    SolutionNameMin: Cijk_Ailk_Bljk_HSS_BH_UserArgs_MT128x64x32_MI16x16x1_SN_LDSB0_CLR0_GSU0_GSUC0_GSUWGMRR0_K1_LBSPPA1024_LBSPPB128_LPA0_MIWT4_2_PLR0_SU32_SUM0_SUS256_SKXCCM6_VWA4_VWB2_WGM1_WGMXCC1_WGMXCCGn1
    SolutionIndex: 69
    SolutionNameMin: Cijk_Ailk_Bljk_HSS_BH_UserArgs_MT128x64x32_MI16x16x1_SN_LDSB0_CLR1_GSU0_GSUC0_GSUWGMRR0_K1_LBSPPA1024_LBSPPB128_LPA0_MIWT4_2_PLR1_SU32_SUM0_SUS256_SKXCCM6_VWA4_VWB1_WGM8_WGMXCC1_WGMXCCGn1
    SolutionIndex: 70
    SolutionNameMin: Cijk_Ailk_Bljk_HSS_BH_UserArgs_MT32x32x32_MI16x16x1_SN_LDSB0_CLR0_GSU0_GSUC0_GSUWGMRR0_K1_LBSPPA256_LBSPPB128_LPA16_MIWT1_1_PLR0_SU32_SUM0_SUS256_SKXCCM6_VWA1_VWB1_WGM1_WGMXCC1_WGMXCCGn1
    SolutionIndex: 71
    SolutionNameMin: Cijk_Ailk_Bljk_HSS_BH_UserArgs_MT32x32x32_MI16x16x1_SN_LDSB0_CLR0_GSU0_GSUC0_GSUWGMRR0_K1_LBSPPA256_LBSPPB128_LPA16_MIWT1_1_PLR0_SU32_SUM0_SUS256_SKXCCM6_VWA1_VWB1_WGM8_WGMXCC1_WGMXCCGn1
    SolutionIndex: 72
    SolutionNameMin: Cijk_Ailk_Bljk_HSS_BH_UserArgs_MT128x256x64_MI16x16x1_SN_LDSB1_CLR1_GSU0_GSUC0_GSUWGMRR0_K1_LBSPPA2048_LBSPPB128_LPA0_MIWT4_8_PLR1_SU32_SUM0_SUS256_SKXCCM6_VWA4_VWB1_WGM1_WGMXCC1_WGMXCCGn1
    SolutionIndex: 73
    SolutionNameMin: Cijk_Ailk_Bljk_HSS_BH_UserArgs_MT128x256x64_MI16x16x1_SN_LDSB1_CLR1_GSU0_GSUC0_GSUWGMRR0_K1_LBSPPA2048_LBSPPB256_LPA0_MIWT4_8_PLR1_SU32_SUM0_SUS256_SKXCCM6_VWA4_VWB2_WGM1_WGMXCC1_WGMXCCGn1
    SolutionIndex: 74
    SolutionNameMin: Cijk_Ailk_Bljk_HSS_BH_UserArgs_MT128x256x64_MI16x16x1_SN_LDSB1_CLR1_GSU0_GSUC0_GSUWGMRR0_K1_LBSPPA2048_LBSPPB512_LPA0_MIWT4_8_PLR1_SU32_SUM0_SUS256_SKXCCM6_VWA4_VWB4_WGM1_WGMXCC1_WGMXCCGn1
    SolutionIndex: 75
    SolutionNameMin: Cijk_Ailk_Bljk_HSS_BH_UserArgs_MT128x256x64_MI16x16x1_SN_LDSB1_CLR1_GSU0_GSUC0_GSUWGMRR0_K1_LBSPPA2048_LBSPPB128_LPA0_MIWT4_8_PLR1_SU32_SUM0_SUS256_SKXCCM6_VWA4_VWB1_WGM8_WGMXCC1_WGMXCCGn1
    SolutionIndex: 76
    SolutionNameMin: Cijk_Ailk_Bljk_HSS_BH_UserArgs_MT128x256x64_MI16x16x1_SN_LDSB1_CLR1_GSU0_GSUC0_GSUWGMRR0_K1_LBSPPA2048_LBSPPB256_LPA0_MIWT4_8_PLR1_SU32_SUM0_SUS256_SKXCCM6_VWA4_VWB2_WGM8_WGMXCC1_WGMXCCGn1
    SolutionIndex: 77
    SolutionNameMin: Cijk_Ailk_Bljk_HSS_BH_UserArgs_MT128x256x64_MI16x16x1_SN_LDSB1_CLR1_GSU0_GSUC0_GSUWGMRR0_K1_LBSPPA2048_LBSPPB1024_LPA0_MIWT4_8_PLR1_SU32_SUM0_SUS256_SKXCCM6_VWA4_VWB8_WGM8_WGMXCC1_WGMXCCGn1
    SolutionIndex: 78
    SolutionNameMin: Cijk_Ailk_Bljk_HSS_BH_UserArgs_MT256x128x64_MI16x16x1_SN_LDSB1_CLR1_GSU0_GSUC0_GSUWGMRR0_K1_LBSPPA4096_LBSPPB128_LPA0_MIWT8_4_PLR1_SU32_SUM0_SUS256_SKXCCM6_VWA4_VWB1_WGM1_WGMXCC1_WGMXCCGn1
    SolutionIndex: 79
    SolutionNameMin: Cijk_Ailk_Bljk_HSS_BH_UserArgs_MT256x128x64_MI16x16x1_SN_LDSB1_CLR1_GSU0_GSUC0_GSUWGMRR0_K1_LBSPPA4096_LBSPPB256_LPA0_MIWT8_4_PLR1_SU32_SUM0_SUS256_SKXCCM6_VWA4_VWB2_WGM1_WGMXCC1_WGMXCCGn1
    SolutionIndex: 80
    SolutionNameMin: Cijk_Ailk_Bljk_HSS_BH_UserArgs_MT256x128x64_MI16x16x1_SN_LDSB1_CLR1_GSU0_GSUC0_GSUWGMRR0_K1_LBSPPA4096_LBSPPB512_LPA0_MIWT8_4_PLR1_SU32_SUM0_SUS256_SKXCCM6_VWA4_VWB4_WGM1_WGMXCC1_WGMXCCGn1
    SolutionIndex: 81
    SolutionNameMin: Cijk_Ailk_Bljk_HSS_BH_UserArgs_MT256x128x64_MI16x16x1_SN_LDSB1_CLR1_GSU0_GSUC0_GSUWGMRR0_K1_LBSPPA4096_LBSPPB512_LPA0_MIWT8_4_PLR1_SU32_SUM0_SUS256_SKXCCM6_VWA4_VWB4_WGM4_WGMXCC1_WGMXCCGn1
    SolutionIndex: 82
    SolutionNameMin: Cijk_Ailk_Bljk_HSS_BH_UserArgs_MT128x128x64_MI16x16x1_SN_LDSB1_CLR1_GSU0_GSUC0_GSUWGMRR0_K1_LBSPPA2048_LBSPPB128_LPA0_MIWT4_4_PLR1_SU32_SUM0_SUS256_SKXCCM6_VWA4_VWB1_WGM1_WGMXCC1_WGMXCCGn1
    SolutionIndex: 83
    SolutionNameMin: Cijk_Ailk_Bljk_HSS_BH_UserArgs_MT128x128x64_MI16x16x1_SN_LDSB1_CLR1_GSU0_GSUC0_GSUWGMRR0_K1_LBSPPA2048_LBSPPB256_LPA0_MIWT4_4_PLR1_SU32_SUM0_SUS256_SKXCCM6_VWA4_VWB2_WGM1_WGMXCC1_WGMXCCGn1
    SolutionIndex: 84
    SolutionNameMin: Cijk_Ailk_Bljk_HSS_BH_UserArgs_MT128x128x64_MI16x16x1_SN_LDSB1_CLR1_GSU0_GSUC0_GSUWGMRR0_K1_LBSPPA2048_LBSPPB512_LPA0_MIWT4_4_PLR1_SU32_SUM0_SUS256_SKXCCM6_VWA4_VWB4_WGM1_WGMXCC1_WGMXCCGn1
    SolutionIndex: 85
    SolutionNameMin: Cijk_Ailk_Bljk_HSS_BH_UserArgs_MT128x128x64_MI16x16x1_SN_LDSB1_CLR1_GSU0_GSUC0_GSUWGMRR0_K1_LBSPPA2048_LBSPPB256_LPA0_MIWT4_4_PLR1_SU32_SUM0_SUS256_SKXCCM6_VWA4_VWB2_WGM4_WGMXCC1_WGMXCCGn1
    SolutionIndex: 86
    SolutionNameMin: Cijk_Ailk_Bljk_HSS_BH_UserArgs_MT128x128x64_MI16x16x1_SN_LDSB1_CLR1_GSU0_GSUC0_GSUWGMRR0_K1_LBSPPA2048_LBSPPB512_LPA0_MIWT4_4_PLR1_SU32_SUM0_SUS256_SKXCCM6_VWA4_VWB4_WGM8_WGMXCC1_WGMXCCGn1
    SolutionIndex: 87
    SolutionNameMin: Cijk_Ailk_Bljk_HSS_BH_UserArgs_MT64x128x64_MI16x16x1_SN_LDSB1_CLR1_GSU0_GSUC0_GSUWGMRR0_K1_LBSPPA1024_LBSPPB256_LPA16_MIWT2_4_PLR1_SU32_SUM0_SUS256_SKXCCM6_VWA1_VWB2_WGM1_WGMXCC1_WGMXCCGn1
    SolutionIndex: 88
    SolutionNameMin: Cijk_Ailk_Bljk_HSS_BH_UserArgs_MT64x128x64_MI16x16x1_SN_LDSB1_CLR1_GSU0_GSUC0_GSUWGMRR0_K1_LBSPPA1024_LBSPPB256_LPA32_MIWT2_4_PLR1_SU32_SUM0_SUS256_SKXCCM6_VWA2_VWB2_WGM1_WGMXCC1_WGMXCCGn1
    SolutionIndex: 89
    SolutionNameMin: Cijk_Ailk_Bljk_HSS_BH_UserArgs_MT64x128x64_MI16x16x1_SN_LDSB1_CLR1_GSU0_GSUC0_GSUWGMRR0_K1_LBSPPA1024_LBSPPB512_LPA16_MIWT2_4_PLR1_SU32_SUM0_SUS256_SKXCCM6_VWA1_VWB4_WGM1_WGMXCC1_WGMXCCGn1
    SolutionIndex: 90
    SolutionNameMin: Cijk_Ailk_Bljk_HSS_BH_UserArgs_MT64x128x64_MI16x16x1_SN_LDSB1_CLR1_GSU0_GSUC0_GSUWGMRR0_K1_LBSPPA1024_LBSPPB256_LPA32_MIWT2_4_PLR2_SU32_SUM0_SUS256_SKXCCM6_VWA2_VWB2_WGM1_WGMXCC1_WGMXCCGn1
    SolutionIndex: 91
    SolutionNameMin: Cijk_Ailk_Bljk_HSS_BH_UserArgs_MT64x128x64_MI16x16x1_SN_LDSB1_CLR1_GSU0_GSUC0_GSUWGMRR0_K1_LBSPPA1024_LBSPPB128_LPA32_MIWT2_4_PLR1_SU32_SUM0_SUS256_SKXCCM6_VWA2_VWB1_WGM8_WGMXCC1_WGMXCCGn1
    SolutionIndex: 92
    SolutionNameMin: Cijk_Ailk_Bljk_HSS_BH_UserArgs_MT64x128x64_MI16x16x1_SN_LDSB1_CLR1_GSU0_GSUC0_GSUWGMRR0_K1_LBSPPA1024_LBSPPB512_LPA32_MIWT2_4_PLR1_SU32_SUM0_SUS256_SKXCCM6_VWA2_VWB4_WGM8_WGMXCC1_WGMXCCGn1
    SolutionIndex: 93
    SolutionNameMin: Cijk_Ailk_Bljk_HSS_BH_UserArgs_MT128x64x64_MI16x16x1_SN_LDSB1_CLR1_GSU0_GSUC0_GSUWGMRR0_K1_LBSPPA2048_LBSPPB128_LPA0_MIWT4_2_PLR1_SU32_SUM0_SUS256_SKXCCM6_VWA4_VWB1_WGM1_WGMXCC1_WGMXCCGn1
    SolutionIndex: 94
    SolutionNameMin: Cijk_Ailk_Bljk_HSS_BH_UserArgs_MT128x64x64_MI16x16x1_SN_LDSB1_CLR1_GSU0_GSUC0_GSUWGMRR0_K1_LBSPPA2048_LBSPPB256_LPA0_MIWT4_2_PLR1_SU32_SUM0_SUS256_SKXCCM6_VWA4_VWB2_WGM1_WGMXCC1_WGMXCCGn1
    SolutionIndex: 95
    SolutionNameMin: Cijk_Ailk_Bljk_HSS_BH_UserArgs_MT128x64x64_MI16x16x1_SN_LDSB1_CLR1_GSU0_GSUC0_GSUWGMRR0_K1_LBSPPA2048_LBSPPB128_LPA0_MIWT4_2_PLR2_SU32_SUM0_SUS256_SKXCCM6_VWA4_VWB1_WGM1_WGMXCC1_WGMXCCGn1
    SolutionIndex: 96
    SolutionNameMin: Cijk_Ailk_Bljk_HSS_BH_UserArgs_MT128x64x64_MI16x16x1_SN_LDSB1_CLR1_GSU0_GSUC0_GSUWGMRR0_K1_LBSPPA2048_LBSPPB256_LPA0_MIWT4_2_PLR2_SU32_SUM0_SUS256_SKXCCM6_VWA4_VWB2_WGM4_WGMXCC1_WGMXCCGn1
    SolutionIndex: 97
    SolutionNameMin: Cijk_Ailk_Bljk_HSS_BH_UserArgs_MT128x64x64_MI16x16x1_SN_LDSB1_CLR1_GSU0_GSUC0_GSUWGMRR0_K1_LBSPPA2048_LBSPPB128_LPA0_MIWT4_2_PLR1_SU32_SUM0_SUS256_SKXCCM6_VWA4_VWB1_WGM8_WGMXCC1_WGMXCCGn1
    SolutionIndex: 98
    SolutionNameMin: Cijk_Ailk_Bljk_HSS_BH_UserArgs_MT128x64x64_MI16x16x1_SN_LDSB1_CLR1_GSU0_GSUC0_GSUWGMRR0_K1_LBSPPA2048_LBSPPB256_LPA0_MIWT4_2_PLR1_SU32_SUM0_SUS256_SKXCCM6_VWA4_VWB2_WGM8_WGMXCC1_WGMXCCGn1
    SolutionIndex: 99
    SolutionNameMin: Cijk_Ailk_Bljk_HSS_BH_UserArgs_MT128x64x64_MI16x16x1_SN_LDSB1_CLR1_GSU0_GSUC0_GSUWGMRR0_K1_LBSPPA2048_LBSPPB128_LPA0_MIWT4_2_PLR2_SU32_SUM0_SUS256_SKXCCM6_VWA4_VWB1_WGM8_WGMXCC1_WGMXCCGn1
    SolutionIndex: 100
    SolutionNameMin: Cijk_Ailk_Bljk_HSS_BH_UserArgs_MT128x64x64_MI16x16x1_SN_LDSB1_CLR1_GSU0_GSUC0_GSUWGMRR0_K1_LBSPPA2048_LBSPPB256_LPA0_MIWT4_2_PLR2_SU32_SUM0_SUS256_SKXCCM6_VWA4_VWB2_WGM8_WGMXCC1_WGMXCCGn1
    SolutionIndex: 101
    SolutionNameMin: Cijk_Ailk_Bljk_HSS_BH_UserArgs_MT64x64x64_MI16x16x1_SN_LDSB1_CLR1_GSU0_GSUC0_GSUWGMRR0_K1_LBSPPA1024_LBSPPB128_LPA32_MIWT2_2_PLR1_SU32_SUM0_SUS256_SKXCCM6_VWA2_VWB1_WGM1_WGMXCC1_WGMXCCGn1
    SolutionIndex: 102
    SolutionNameMin: Cijk_Ailk_Bljk_HSS_BH_UserArgs_MT64x64x64_MI16x16x1_SN_LDSB1_CLR1_GSU0_GSUC0_GSUWGMRR0_K1_LBSPPA1024_LBSPPB256_LPA32_MIWT2_2_PLR1_SU32_SUM0_SUS256_SKXCCM6_VWA2_VWB2_WGM1_WGMXCC1_WGMXCCGn1
    SolutionIndex: 103
    SolutionNameMin: Cijk_Ailk_Bljk_HSS_BH_UserArgs_MT64x64x64_MI16x16x1_SN_LDSB1_CLR1_GSU0_GSUC0_GSUWGMRR0_K1_LBSPPA1024_LBSPPB128_LPA32_MIWT2_2_PLR1_SU32_SUM0_SUS256_SKXCCM6_VWA2_VWB1_WGM4_WGMXCC1_WGMXCCGn1
    SolutionIndex: 104
    SolutionNameMin: Cijk_Ailk_Bljk_HSS_BH_UserArgs_MT64x64x64_MI16x16x1_SN_LDSB1_CLR1_GSU0_GSUC0_GSUWGMRR0_K1_LBSPPA1024_LBSPPB256_LPA32_MIWT2_2_PLR1_SU32_SUM0_SUS256_SKXCCM6_VWA2_VWB2_WGM4_WGMXCC1_WGMXCCGn1
    SolutionIndex: 105
    SolutionNameMin: Cijk_Ailk_Bljk_HSS_BH_UserArgs_MT64x64x64_MI16x16x1_SN_LDSB1_CLR1_GSU0_GSUC0_GSUWGMRR0_K1_LBSPPA1024_LBSPPB128_LPA32_MIWT2_2_PLR1_SU32_SUM0_SUS256_SKXCCM6_VWA2_VWB1_WGM8_WGMXCC1_WGMXCCGn1
    SolutionIndex: 106
    SolutionNameMin: Cijk_Ailk_Bljk_HSS_BH_UserArgs_MT64x64x64_MI16x16x1_SN_LDSB1_CLR1_GSU0_GSUC0_GSUWGMRR0_K1_LBSPPA1024_LBSPPB256_LPA32_MIWT2_2_PLR1_SU32_SUM0_SUS256_SKXCCM6_VWA2_VWB2_WGM8_WGMXCC1_WGMXCCGn1
    SolutionIndex: 107
    SolutionNameMin: Cijk_Ailk_Bljk_HSS_BH_UserArgs_MT64x32x64_MI16x16x1_SN_LDSB0_CLR1_GSU0_GSUC0_GSUWGMRR0_K1_LBSPPA1024_LBSPPB128_LPA32_MIWT2_1_PLR1_SU32_SUM0_SUS256_SKXCCM6_VWA2_VWB1_WGM4_WGMXCC1_WGMXCCGn1
    SolutionIndex: 108
    SolutionNameMin: Cijk_Ailk_Bljk_HSS_BH_UserArgs_MT64x32x128_MI16x16x1_SN_LDSB1_CLR1_GSU0_GSUC0_GSUWGMRR0_K1_LBSPPA1024_LBSPPB256_LPA32_MIWT2_1_PLR1_SU32_SUM0_SUS256_SKXCCM6_VWA2_VWB1_WGM1_WGMXCC1_WGMXCCGn1
    SolutionIndex: 109
    SolutionNameMin: Cijk_Ailk_Bljk_HSS_BH_UserArgs_MT64x32x128_MI16x16x1_SN_LDSB1_CLR1_GSU0_GSUC0_GSUWGMRR0_K1_LBSPPA1024_LBSPPB256_LPA32_MIWT2_1_PLR2_SU32_SUM0_SUS256_SKXCCM6_VWA2_VWB1_WGM1_WGMXCC1_WGMXCCGn1
    SolutionIndex: 110
    SolutionNameMin: Cijk_Ailk_Bljk_HSS_BH_UserArgs_MT64x32x128_MI16x16x1_SN_LDSB1_CLR1_GSU0_GSUC0_GSUWGMRR0_K1_LBSPPA1024_LBSPPB256_LPA32_MIWT2_1_PLR2_SU32_SUM0_SUS256_SKXCCM6_VWA2_VWB1_WGM4_WGMXCC1_WGMXCCGn1
    SolutionIndex: 111
    SolutionNameMin: Cijk_Ailk_Bljk_HSS_BH_UserArgs_MT64x32x128_MI16x16x1_SN_LDSB1_CLR1_GSU0_GSUC0_GSUWGMRR0_K1_LBSPPA1024_LBSPPB256_LPA32_MIWT2_1_PLR2_SU32_SUM0_SUS256_SKXCCM6_VWA2_VWB1_WGM8_WGMXCC1_WGMXCCGn1
    SolutionIndex: 112
    SolutionNameMin: Cijk_Ailk_Bljk_HSS_BH_UserArgs_MT32x32x128_MI16x16x1_SN_LDSB1_CLR1_GSU0_GSUC0_GSUWGMRR0_K1_LBSPPA512_LBSPPB256_LPA16_MIWT1_1_PLR1_SU32_SUM0_SUS256_SKXCCM6_VWA1_VWB1_WGM1_WGMXCC1_WGMXCCGn1
    SolutionIndex: 113
    SolutionNameMin: Cijk_Ailk_Bljk_HSS_BH_UserArgs_MT32x32x128_MI16x16x1_SN_LDSB1_CLR1_GSU0_GSUC0_GSUWGMRR0_K1_LBSPPA512_LBSPPB256_LPA16_MIWT1_1_PLR2_SU32_SUM0_SUS256_SKXCCM6_VWA1_VWB1_WGM1_WGMXCC1_WGMXCCGn1
    SolutionIndex: 114
    SolutionNameMin: Cijk_Ailk_Bljk_HSS_BH_UserArgs_MT32x32x32_MI16x16x1_SN_LDSB0_CLR1_GSU0_GSUC0_GSUWGMRR0_K1_LBSPPA256_LBSPPB128_LPA16_MIWT1_1_PLR1_SU32_SUM0_SUS256_SKXCCM0_VWA1_VWB1_WGM8_WGMXCC1_WGMXCCGn1
- - - [128, 128, 1, 128, 128, 128, 128, 128]
    - [112, 0.081]
  - - [128, 128, 1, 256, 128, 128, 128, 256]
    - [37, 0.108]
  - - [128, 128, 1, 512, 128, 128, 128, 512]
    - [37, 0.181]
  - - [128, 128, 1, 1024, 128, 128, 128, 1024]
    - [37, 0.269]
  - - [128, 128, 1, 2048, 128, 128, 128, 2048]
    - [13, 0.35]
  - - [128, 128, 1, 4096, 128, 128, 128, 4096]
    - [31, 0.685]
  - - [128, 128, 1, 8192, 128, 128, 128, 8192]
    - [38, 1.281]
  - - [128, 256, 1, 128, 128, 128, 128, 128]
    - [37, 0.167]
  - - [128, 256, 1, 256, 128, 128, 128, 256]
    - [37, 0.212]
  - - [128, 256, 1, 512, 128, 128, 128, 512]
    - [38, 0.342]
  - - [128, 256, 1, 1024, 128, 128, 128, 1024]
    - [112, 0.529]
  - - [128, 256, 1, 2048, 128, 128, 128, 2048]
    - [113, 0.968]
  - - [128, 256, 1, 4096, 128, 128, 128, 4096]
    - [38, 1.694]
  - - [128, 256, 1, 8192, 128, 128, 128, 8192]
    - [38, 2.85]
  - - [128, 512, 1, 128, 128, 128, 128, 128]
    - [38, 0.335]
  - - [128, 512, 1, 256, 128, 128, 128, 256]
    - [37, 0.405]
  - - [128, 512, 1, 512, 128, 128, 128, 512]
    - [112, 0.677]
  - - [128, 512, 1, 1024, 128, 128, 128, 1024]
    - [70, 1.206]
  - - [128, 512, 1, 2048, 128, 128, 128, 2048]
    - [113, 2.173]
  - - [128, 512, 1, 4096, 128, 128, 128, 4096]
    - [112, 3.41]
  - - [128, 512, 1, 8192, 128, 128, 128, 8192]
    - [109, 4.986]
  - - [128, 1024, 1, 128, 128, 128, 128, 128]
    - [38, 0.649]
  - - [128, 1024, 1, 256, 128, 128, 128, 256]
    - [37, 0.781]
  - - [128, 1024, 1, 512, 128, 128, 128, 512]
    - [38, 1.399]
  - - [128, 1024, 1, 1024, 128, 128, 128, 1024]
    - [112, 2.416]
  - - [128, 1024, 1, 2048, 128, 128, 128, 2048]
    - [108, 3.917]
  - - [128, 1024, 1, 4096, 128, 128, 128, 4096]
    - [109, 6.052]
  - - [128, 1024, 1, 8192, 128, 128, 128, 8192]
    - [108, 7.793]
  - - [128, 2048, 1, 128, 128, 128, 128, 128]
    - [36, 1.165]
  - - [128, 2048, 1, 256, 128, 128, 128, 256]
    - [37, 1.919]
  - - [128, 2048, 1, 512, 128, 128, 128, 512]
    - [38, 3.071]
  - - [128, 2048, 1, 1024, 128, 128, 128, 1024]
    - [38, 4.432]
  - - [128, 2048, 1, 2048, 128, 128, 128, 2048]
    - [109, 6.582]
  - - [128, 2048, 1, 4096, 128, 128, 128, 4096]
    - [101, 9.107]
  - - [128, 2048, 1, 8192, 128, 128, 128, 8192]
    - [95, 10.621]
  - - [128, 4096, 1, 128, 128, 128, 128, 128]
    - [30, 2.019]
  - - [128, 4096, 1, 256, 128, 128, 128, 256]
    - [30, 3.422]
  - - [128, 4096, 1, 512, 128, 128, 128, 512]
    - [36, 5.329]
  - - [128, 4096, 1, 1024, 128, 128, 128, 1024]
    - [109, 7.333]
  - - [128, 4096, 1, 2048, 128, 128, 128, 2048]
    - [101, 9.577]
  - - [128, 4096, 1, 4096, 128, 128, 128, 4096]
    - [96, 11.778]
  - - [128, 4096, 1, 8192, 128, 128, 128, 8192]
    - [18, 13.834]
  - - [128, 8192, 1, 128, 128, 128, 128, 128]
    - [26, 3.265]
  - - [128, 8192, 1, 256, 128, 128, 128, 256]
    - [25, 5.436]
  - - [128, 8192, 1, 512, 128, 128, 128, 512]
    - [102, 8.172]
  - - [128, 8192, 1, 1024, 128, 128, 128, 1024]
    - [102, 11.031]
  - - [128, 8192, 1, 2048, 128, 128, 128, 2048]
    - [101, 12.131]
  - - [128, 8192, 1, 4096, 128, 128, 128, 4096]
    - [21, 14.294]
  - - [128, 8192, 1, 8192, 128, 128, 128, 8192]
    - [20, 15.866]
  - - [256, 128, 1, 128, 256, 256, 256, 128]
    - [38, 0.162]
  - - [256, 128, 1, 256, 256, 256, 256, 256]
    - [37, 0.214]
  - - [256, 128, 1, 512, 256, 256, 256, 512]
    - [38, 0.344]
  - - [256, 128, 1, 1024, 256, 256, 256, 1024]
    - [112, 0.529]
  - - [256, 128, 1, 2048, 256, 256, 256, 2048]
    - [113, 0.971]
  - - [256, 128, 1, 4096, 256, 256, 256, 4096]
    - [38, 1.694]
  - - [256, 128, 1, 8192, 256, 256, 256, 8192]
    - [37, 2.836]
  - - [256, 256, 1, 128, 256, 256, 256, 128]
    - [37, 0.328]
  - - [256, 256, 1, 256, 256, 256, 256, 256]
    - [37, 0.407]
  - - [256, 256, 1, 512, 256, 256, 256, 512]
    - [112, 0.667]
  - - [256, 256, 1, 1024, 256, 256, 256, 1024]
    - [70, 1.209]
  - - [256, 256, 1, 2048, 256, 256, 256, 2048]
    - [112, 2.161]
  - - [256, 256, 1, 4096, 256, 256, 256, 4096]
    - [113, 3.416]
  - - [256, 256, 1, 8192, 256, 256, 256, 8192]
    - [36, 4.912]
  - - [256, 512, 1, 128, 256, 256, 256, 128]
    - [38, 0.622]
  - - [256, 512, 1, 256, 256, 256, 256, 256]
    - [113, 0.784]
  - - [256, 512, 1, 512, 256, 256, 256, 512]
    - [39, 1.385]
  - - [256, 512, 1, 1024, 256, 256, 256, 1024]
    - [113, 2.38]
  - - [256, 512, 1, 2048, 256, 256, 256, 2048]
    - [108, 3.894]
  - - [256, 512, 1, 4096, 256, 256, 256, 4096]
    - [109, 6.062]
  - - [256, 512, 1, 8192, 256, 256, 256, 8192]
    - [109, 7.532]
  - - [256, 1024, 1, 128, 256, 256, 256, 128]
    - [36, 1.16]
  - - [256, 1024, 1, 256, 256, 256, 256, 256]
    - [37, 1.924]
  - - [256, 1024, 1, 512, 256, 256, 256, 512]
    - [37, 3.056]
  - - [256, 1024, 1, 1024, 256, 256, 256, 1024]
    - [38, 4.36]
  - - [256, 1024, 1, 2048, 256, 256, 256, 2048]
    - [109, 6.545]
  - - [256, 1024, 1, 4096, 256, 256, 256, 4096]
    - [102, 8.969]
  - - [256, 1024, 1, 8192, 256, 256, 256, 8192]
    - [68, 10.385]
  - - [256, 2048, 1, 128, 256, 256, 256, 128]
    - [30, 1.99]
  - - [256, 2048, 1, 256, 256, 256, 256, 256]
    - [30, 3.393]
  - - [256, 2048, 1, 512, 256, 256, 256, 512]
    - [36, 5.376]
  - - [256, 2048, 1, 1024, 256, 256, 256, 1024]
    - [109, 7.329]
  - - [256, 2048, 1, 2048, 256, 256, 256, 2048]
    - [102, 9.889]
  - - [256, 2048, 1, 4096, 256, 256, 256, 4096]
    - [100, 11.581]
  - - [256, 2048, 1, 8192, 256, 256, 256, 8192]
    - [68, 12.098]
  - - [256, 4096, 1, 128, 256, 256, 256, 128]
    - [29, 3.218]
  - - [256, 4096, 1, 256, 256, 256, 256, 256]
    - [102, 5.453]
  - - [256, 4096, 1, 512, 256, 256, 256, 512]
    - [102, 8.165]
  - - [256, 4096, 1, 1024, 256, 256, 256, 1024]
    - [102, 11.206]
  - - [256, 4096, 1, 2048, 256, 256, 256, 2048]
    - [101, 12.452]
  - - [256, 4096, 1, 4096, 256, 256, 256, 4096]
    - [22, 13.836]
  - - [256, 4096, 1, 8192, 256, 256, 256, 8192]
    - [84, 14.921]
  - - [256, 8192, 1, 128, 256, 256, 256, 128]
    - [12, 4.905]
  - - [256, 8192, 1, 256, 256, 256, 256, 256]
    - [17, 7.674]
  - - [256, 8192, 1, 512, 256, 256, 256, 512]
    - [94, 11.527]
  - - [256, 8192, 1, 1024, 256, 256, 256, 1024]
    - [67, 13.404]
  - - [256, 8192, 1, 2048, 256, 256, 256, 2048]
    - [99, 15.168]
  - - [256, 8192, 1, 4096, 256, 256, 256, 4096]
    - [6, 16.499]
  - - [256, 8192, 1, 8192, 256, 256, 256, 8192]
    - [55, 17.592]
  - - [512, 128, 1, 128, 512, 512, 512, 128]
    - [38, 0.33]
  - - [512, 128, 1, 256, 512, 512, 512, 256]
    - [38, 0.411]
  - - [512, 128, 1, 512, 512, 512, 512, 512]
    - [113, 0.657]
  - - [512, 128, 1, 1024, 512, 512, 512, 1024]
    - [71, 1.197]
  - - [512, 128, 1, 2048, 512, 512, 512, 2048]
    - [112, 2.158]
  - - [512, 128, 1, 4096, 512, 512, 512, 4096]
    - [38, 3.345]
  - - [512, 128, 1, 8192, 512, 512, 512, 8192]
    - [107, 4.784]
  - - [512, 256, 1, 128, 512, 512, 512, 128]
    - [38, 0.636]
  - - [512, 256, 1, 256, 512, 512, 512, 256]
    - [38, 0.783]
  - - [512, 256, 1, 512, 512, 512, 512, 512]
    - [37, 1.387]
  - - [512, 256, 1, 1024, 512, 512, 512, 1024]
    - [112, 2.369]
  - - [512, 256, 1, 2048, 512, 512, 512, 2048]
    - [108, 3.883]
  - - [512, 256, 1, 4096, 512, 512, 512, 4096]
    - [111, 5.838]
  - - [512, 256, 1, 8192, 512, 512, 512, 8192]
    - [36, 7.521]
  - - [512, 512, 1, 128, 512, 512, 512, 128]
    - [34, 1.134]
  - - [512, 512, 1, 256, 512, 512, 512, 256]
    - [37, 1.923]
  - - [512, 512, 1, 512, 512, 512, 512, 512]
    - [37, 3.033]
  - - [512, 512, 1, 1024, 512, 512, 512, 1024]
    - [38, 4.379]
  - - [512, 512, 1, 2048, 512, 512, 512, 2048]
    - [109, 6.494]
  - - [512, 512, 1, 4096, 512, 512, 512, 4096]
    - [27, 8.911]
  - - [512, 512, 1, 8192, 512, 512, 512, 8192]
    - [22, 10.115]
  - - [512, 1024, 1, 128, 512, 512, 512, 128]
    - [32, 2.004]
  - - [512, 1024, 1, 256, 512, 512, 512, 256]
    - [30, 3.412]
  - - [512, 1024, 1, 512, 512, 512, 512, 512]
    - [36, 5.3]
  - - [512, 1024, 1, 1024, 512, 512, 512, 1024]
    - [109, 7.329]
  - - [512, 1024, 1, 2048, 512, 512, 512, 2048]
    - [101, 9.888]
  - - [512, 1024, 1, 4096, 512, 512, 512, 4096]
    - [100, 11.366]
  - - [512, 1024, 1, 8192, 512, 512, 512, 8192]
    - [94, 11.976]
  - - [512, 2048, 1, 128, 512, 512, 512, 128]
    - [26, 3.255]
  - - [512, 2048, 1, 256, 512, 512, 512, 256]
    - [25, 5.441]
  - - [512, 2048, 1, 512, 512, 512, 512, 512]
    - [102, 8.132]
  - - [512, 2048, 1, 1024, 512, 512, 512, 1024]
    - [102, 11.154]
  - - [512, 2048, 1, 2048, 512, 512, 512, 2048]
    - [101, 12.96]
  - - [512, 2048, 1, 4096, 512, 512, 512, 4096]
    - [68, 12.676]
  - - [512, 2048, 1, 8192, 512, 512, 512, 8192]
    - [82, 15.016]
  - - [512, 4096, 1, 128, 512, 512, 512, 128]
    - [18, 4.716]
  - - [512, 4096, 1, 256, 512, 512, 512, 256]
    - [18, 7.723]
  - - [512, 4096, 1, 512, 512, 512, 512, 512]
    - [94, 11.733]
  - - [512, 4096, 1, 1024, 512, 512, 512, 1024]
    - [95, 14.315]
  - - [512, 4096, 1, 2048, 512, 512, 512, 2048]
    - [97, 15.667]
  - - [512, 4096, 1, 4096, 512, 512, 512, 4096]
    - [82, 15.597]
  - - [512, 4096, 1, 8192, 512, 512, 512, 8192]
    - [78, 17.515]
  - - [512, 8192, 1, 128, 512, 512, 512, 128]
    - [66, 5.814]
  - - [512, 8192, 1, 256, 512, 512, 512, 256]
    - [65, 9.243]
  - - [512, 8192, 1, 512, 512, 512, 512, 512]
    - [57, 12.733]
  - - [512, 8192, 1, 1024, 512, 512, 512, 1024]
    - [56, 15.56]
  - - [512, 8192, 1, 2048, 512, 512, 512, 2048]
    - [83, 18.246]
  - - [512, 8192, 1, 4096, 512, 512, 512, 4096]
    - [4, 18.424]
  - - [512, 8192, 1, 8192, 512, 512, 512, 8192]
    - [78, 20.1]
  - - [1024, 128, 1, 128, 1024, 1024, 1024, 128]
    - [37, 0.638]
  - - [1024, 128, 1, 256, 1024, 1024, 1024, 256]
    - [37, 0.776]
  - - [1024, 128, 1, 512, 1024, 1024, 1024, 512]
    - [37, 1.405]
  - - [1024, 128, 1, 1024, 1024, 1024, 1024, 1024]
    - [112, 2.393]
  - - [1024, 128, 1, 2048, 1024, 1024, 1024, 2048]
    - [35, 3.713]
  - - [1024, 128, 1, 4096, 1024, 1024, 1024, 4096]
    - [30, 5.492]
  - - [1024, 128, 1, 8192, 1024, 1024, 1024, 8192]
    - [105, 7.147]
  - - [1024, 256, 1, 128, 1024, 1024, 1024, 128]
    - [34, 1.15]
  - - [1024, 256, 1, 256, 1024, 1024, 1024, 256]
    - [37, 1.922]
  - - [1024, 256, 1, 512, 1024, 1024, 1024, 512]
    - [37, 3.042]
  - - [1024, 256, 1, 1024, 1024, 1024, 1024, 1024]
    - [38, 4.379]
  - - [1024, 256, 1, 2048, 1024, 1024, 1024, 2048]
    - [36, 6.185]
  - - [1024, 256, 1, 4096, 1024, 1024, 1024, 4096]
    - [105, 8.672]
  - - [1024, 256, 1, 8192, 1024, 1024, 1024, 8192]
    - [11, 10.094]
  - - [1024, 512, 1, 128, 1024, 1024, 1024, 128]
    - [33, 2.009]
  - - [1024, 512, 1, 256, 1024, 1024, 1024, 256]
    - [30, 3.362]
  - - [1024, 512, 1, 512, 1024, 1024, 1024, 512]
    - [36, 5.309]
  - - [1024, 512, 1, 1024, 1024, 1024, 1024, 1024]
    - [36, 7.352]
  - - [1024, 512, 1, 2048, 1024, 1024, 1024, 2048]
    - [25, 9.619]
  - - [1024, 512, 1, 4096, 1024, 1024, 1024, 4096]
    - [17, 11.612]
  - - [1024, 512, 1, 8192, 1024, 1024, 1024, 8192]
    - [6, 11.592]
  - - [1024, 1024, 1, 128, 1024, 1024, 1024, 128]
    - [26, 3.273]
  - - [1024, 1024, 1, 256, 1024, 1024, 1024, 256]
    - [25, 5.461]
  - - [1024, 1024, 1, 512, 1024, 1024, 1024, 512]
    - [28, 8.115]
  - - [1024, 1024, 1, 1024, 1024, 1024, 1024, 1024]
    - [102, 11.028]
  - - [1024, 1024, 1, 2048, 1024, 1024, 1024, 2048]
    - [102, 12.508]
  - - [1024, 1024, 1, 4096, 1024, 1024, 1024, 4096]
    - [95, 12.947]
  - - [1024, 1024, 1, 8192, 1024, 1024, 1024, 8192]
    - [85, 14.798]
  - - [1024, 2048, 1, 128, 1024, 1024, 1024, 128]
    - [21, 4.766]
  - - [1024, 2048, 1, 256, 1024, 1024, 1024, 256]
    - [23, 7.801]
  - - [1024, 2048, 1, 512, 1024, 1024, 1024, 512]
    - [94, 11.589]
  - - [1024, 2048, 1, 1024, 1024, 1024, 1024, 1024]
    - [93, 14.324]
  - - [1024, 2048, 1, 2048, 1024, 1024, 1024, 2048]
    - [95, 15.457]
  - - [1024, 2048, 1, 4096, 1024, 1024, 1024, 4096]
    - [84, 16.314]
  - - [1024, 2048, 1, 8192, 1024, 1024, 1024, 8192]
    - [80, 17.068]
  - - [1024, 4096, 1, 128, 1024, 1024, 1024, 128]
    - [66, 6.087]
  - - [1024, 4096, 1, 256, 1024, 1024, 1024, 256]
    - [66, 9.343]
  - - [1024, 4096, 1, 512, 1024, 1024, 1024, 512]
    - [58, 12.721]
  - - [1024, 4096, 1, 1024, 1024, 1024, 1024, 1024]
    - [8, 15.41]
  - - [1024, 4096, 1, 2048, 1024, 1024, 1024, 2048]
    - [84, 17.795]
  - - [1024, 4096, 1, 4096, 1024, 1024, 1024, 4096]
    - [76, 17.468]
  - - [1024, 4096, 1, 8192, 1024, 1024, 1024, 8192]
    - [40, 19.887]
  - - [1024, 8192, 1, 128, 1024, 1024, 1024, 128]
    - [53, 6.321]
  - - [1024, 8192, 1, 256, 1024, 1024, 1024, 256]
    - [3, 10.244]
  - - [1024, 8192, 1, 512, 1024, 1024, 1024, 512]
    - [51, 14.42]
  - - [1024, 8192, 1, 1024, 1024, 1024, 1024, 1024]
    - [49, 19.267]
  - - [1024, 8192, 1, 2048, 1024, 1024, 1024, 2048]
    - [79, 19.483]
  - - [1024, 8192, 1, 4096, 1024, 1024, 1024, 4096]
    - [5, 19.572]
  - - [1024, 8192, 1, 8192, 1024, 1024, 1024, 8192]
    - [47, 22.336]
  - - [2048, 128, 1, 128, 2048, 2048, 2048, 128]
    - [34, 1.177]
  - - [2048, 128, 1, 256, 2048, 2048, 2048, 256]
    - [38, 1.938]
  - - [2048, 128, 1, 512, 2048, 2048, 2048, 512]
    - [37, 3.042]
  - - [2048, 128, 1, 1024, 2048, 2048, 2048, 1024]
    - [111, 4.252]
  - - [2048, 128, 1, 2048, 2048, 2048, 2048, 2048]
    - [110, 5.987]
  - - [2048, 128, 1, 4096, 2048, 2048, 2048, 4096]
    - [106, 8.619]
  - - [2048, 128, 1, 8192, 2048, 2048, 2048, 8192]
    - [99, 9.74]
  - - [2048, 256, 1, 128, 2048, 2048, 2048, 128]
    - [30, 2.021]
  - - [2048, 256, 1, 256, 2048, 2048, 2048, 256]
    - [30, 3.41]
  - - [2048, 256, 1, 512, 2048, 2048, 2048, 512]
    - [36, 5.235]
  - - [2048, 256, 1, 1024, 2048, 2048, 2048, 1024]
    - [111, 7.264]
  - - [2048, 256, 1, 2048, 2048, 2048, 2048, 2048]
    - [104, 9.388]
  - - [2048, 256, 1, 4096, 2048, 2048, 2048, 4096]
    - [96, 11.802]
  - - [2048, 256, 1, 8192, 2048, 2048, 2048, 8192]
    - [87, 11.944]
  - - [2048, 512, 1, 128, 2048, 2048, 2048, 128]
    - [24, 3.257]
  - - [2048, 512, 1, 256, 2048, 2048, 2048, 256]
    - [25, 5.447]
  - - [2048, 512, 1, 512, 2048, 2048, 2048, 512]
    - [102, 8.089]
  - - [2048, 512, 1, 1024, 2048, 2048, 2048, 1024]
    - [103, 10.862]
  - - [2048, 512, 1, 2048, 2048, 2048, 2048, 2048]
    - [105, 12.584]
  - - [2048, 512, 1, 4096, 2048, 2048, 2048, 4096]
    - [89, 12.805]
  - - [2048, 512, 1, 8192, 2048, 2048, 2048, 8192]
    - [86, 14.731]
  - - [2048, 1024, 1, 128, 2048, 2048, 2048, 128]
    - [10, 4.833]
  - - [2048, 1024, 1, 256, 2048, 2048, 2048, 256]
    - [94, 8.045]
  - - [2048, 1024, 1, 512, 2048, 2048, 2048, 512]
    - [98, 11.533]
  - - [2048, 1024, 1, 1024, 2048, 2048, 2048, 1024]
    - [98, 14.125]
  - - [2048, 1024, 1, 2048, 2048, 2048, 2048, 2048]
    - [100, 15.164]
  - - [2048, 1024, 1, 4096, 2048, 2048, 2048, 4096]
    - [84, 15.588]
  - - [2048, 1024, 1, 8192, 2048, 2048, 2048, 8192]
    - [75, 16.697]
  - - [2048, 2048, 1, 128, 2048, 2048, 2048, 128]
    - [64, 5.794]
  - - [2048, 2048, 1, 256, 2048, 2048, 2048, 256]
    - [63, 9.178]
  - - [2048, 2048, 1, 512, 2048, 2048, 2048, 512]
    - [7, 12.916]
  - - [2048, 2048, 1, 1024, 2048, 2048, 2048, 1024]
    - [62, 14.789]
  - - [2048, 2048, 1, 2048, 2048, 2048, 2048, 2048]
    - [86, 18.178]
  - - [2048, 2048, 1, 4096, 2048, 2048, 2048, 4096]
    - [79, 17.585]
  - - [2048, 2048, 1, 8192, 2048, 2048, 2048, 8192]
    - [44, 19.938]
  - - [2048, 4096, 1, 128, 2048, 2048, 2048, 128]
    - [2, 6.406]
  - - [2048, 4096, 1, 256, 2048, 2048, 2048, 256]
    - [50, 10.208]
  - - [2048, 4096, 1, 512, 2048, 2048, 2048, 512]
    - [49, 14.82]
  - - [2048, 4096, 1, 1024, 2048, 2048, 2048, 1024]
    - [49, 18.135]
  - - [2048, 4096, 1, 2048, 2048, 2048, 2048, 2048]
    - [78, 19.452]
  - - [2048, 4096, 1, 4096, 2048, 2048, 2048, 4096]
    - [40, 19.956]
  - - [2048, 4096, 1, 8192, 2048, 2048, 2048, 8192]
    - [40, 22.512]
  - - [2048, 8192, 1, 128, 2048, 2048, 2048, 128]
    - [94, 6.684]
  - - [2048, 8192, 1, 256, 2048, 2048, 2048, 256]
    - [40, 10.166]
  - - [2048, 8192, 1, 512, 2048, 2048, 2048, 512]
    - [40, 14.686]
  - - [2048, 8192, 1, 1024, 2048, 2048, 2048, 1024]
    - [42, 18.223]
  - - [2048, 8192, 1, 2048, 2048, 2048, 2048, 2048]
    - [73, 19.294]
  - - [2048, 8192, 1, 4096, 2048, 2048, 2048, 4096]
    - [41, 21.316]
  - - [2048, 8192, 1, 8192, 2048, 2048, 2048, 8192]
    - [40, 23.474]
  - - [4096, 128, 1, 128, 4096, 4096, 4096, 128]
    - [109, 2.01]
  - - [4096, 128, 1, 256, 4096, 4096, 4096, 256]
    - [30, 3.452]
  - - [4096, 128, 1, 512, 4096, 4096, 4096, 512]
    - [36, 5.252]
  - - [4096, 128, 1, 1024, 4096, 4096, 4096, 1024]
    - [110, 7.126]
  - - [4096, 128, 1, 2048, 4096, 4096, 4096, 2048]
    - [97, 9.164]
  - - [4096, 128, 1, 4096, 4096, 4096, 4096, 4096]
    - [88, 11.027]
  - - [4096, 128, 1, 8192, 4096, 4096, 4096, 8192]
    - [16, 12.137]
  - - [4096, 256, 1, 128, 4096, 4096, 4096, 128]
    - [26, 3.241]
  - - [4096, 256, 1, 256, 4096, 4096, 4096, 256]
    - [25, 5.487]
  - - [4096, 256, 1, 512, 4096, 4096, 4096, 512]
    - [27, 8.115]
  - - [4096, 256, 1, 1024, 4096, 4096, 4096, 1024]
    - [104, 10.956]
  - - [4096, 256, 1, 2048, 4096, 4096, 4096, 2048]
    - [104, 12.656]
  - - [4096, 256, 1, 4096, 4096, 4096, 4096, 4096]
    - [90, 13.182]
  - - [4096, 256, 1, 8192, 4096, 4096, 4096, 8192]
    - [85, 15.08]
  - - [4096, 512, 1, 128, 4096, 4096, 4096, 128]
    - [9, 4.89]
  - - [4096, 512, 1, 256, 4096, 4096, 4096, 256]
    - [18, 7.889]
  - - [4096, 512, 1, 512, 4096, 4096, 4096, 512]
    - [98, 11.592]
  - - [4096, 512, 1, 1024, 4096, 4096, 4096, 1024]
    - [97, 14.555]
  - - [4096, 512, 1, 2048, 4096, 4096, 4096, 2048]
    - [92, 15.654]
  - - [4096, 512, 1, 4096, 4096, 4096, 4096, 4096]
    - [83, 16.125]
  - - [4096, 512, 1, 8192, 4096, 4096, 4096, 8192]
    - [77, 17.116]
  - - [4096, 1024, 1, 128, 4096, 4096, 4096, 128]
    - [62, 6.056]
  - - [4096, 1024, 1, 256, 4096, 4096, 4096, 256]
    - [62, 9.468]
  - - [4096, 1024, 1, 512, 4096, 4096, 4096, 512]
    - [62, 12.608]
  - - [4096, 1024, 1, 1024, 4096, 4096, 4096, 1024]
    - [62, 15.315]
  - - [4096, 1024, 1, 2048, 4096, 4096, 4096, 2048]
    - [86, 17.581]
  - - [4096, 1024, 1, 4096, 4096, 4096, 4096, 4096]
    - [83, 17.436]
  - - [4096, 1024, 1, 8192, 4096, 4096, 4096, 8192]
    - [44, 20.288]
  - - [4096, 2048, 1, 128, 4096, 4096, 4096, 128]
    - [50, 6.301]
  - - [4096, 2048, 1, 256, 4096, 4096, 4096, 256]
    - [55, 10.178]
  - - [4096, 2048, 1, 512, 4096, 4096, 4096, 512]
    - [55, 14.557]
  - - [4096, 2048, 1, 1024, 4096, 4096, 4096, 1024]
    - [54, 18.215]
  - - [4096, 2048, 1, 2048, 4096, 4096, 4096, 2048]
    - [74, 19.248]
  - - [4096, 2048, 1, 4096, 4096, 4096, 4096, 4096]
    - [45, 19.993]
  - - [4096, 2048, 1, 8192, 4096, 4096, 4096, 8192]
    - [41, 22.822]
  - - [4096, 4096, 1, 128, 4096, 4096, 4096, 128]
    - [20, 6.342]
  - - [4096, 4096, 1, 256, 4096, 4096, 4096, 256]
    - [40, 10.064]
  - - [4096, 4096, 1, 512, 4096, 4096, 4096, 512]
    - [41, 14.339]
  - - [4096, 4096, 1, 1024, 4096, 4096, 4096, 1024]
    - [40, 18.055]
  - - [4096, 4096, 1, 2048, 4096, 4096, 4096, 2048]
    - [72, 19.906]
  - - [4096, 4096, 1, 4096, 4096, 4096, 4096, 4096]
    - [46, 22.74]
  - - [4096, 4096, 1, 8192, 4096, 4096, 4096, 8192]
    - [40, 23.676]
  - - [4096, 8192, 1, 128, 4096, 4096, 4096, 128]
    - [19, 5.78]
  - - [4096, 8192, 1, 256, 4096, 4096, 4096, 256]
    - [49, 8.765]
  - - [4096, 8192, 1, 512, 4096, 4096, 4096, 512]
    - [50, 12.667]
  - - [4096, 8192, 1, 1024, 4096, 4096, 4096, 1024]
    - [52, 17.009]
  - - [4096, 8192, 1, 2048, 4096, 4096, 4096, 2048]
    - [40, 21.559]
  - - [4096, 8192, 1, 4096, 4096, 4096, 4096, 4096]
    - [72, 23.19]
  - - [4096, 8192, 1, 8192, 4096, 4096, 4096, 8192]
    - [40, 25.027]
  - - [8192, 128, 1, 128, 8192, 8192, 8192, 128]
    - [24, 3.264]
  - - [8192, 128, 1, 256, 8192, 8192, 8192, 256]
    - [25, 5.407]
  - - [8192, 128, 1, 512, 8192, 8192, 8192, 512]
    - [106, 8.051]
  - - [8192, 128, 1, 1024, 8192, 8192, 8192, 1024]
    - [103, 10.523]
  - - [8192, 128, 1, 2048, 8192, 8192, 8192, 2048]
    - [106, 12.282]
  - - [8192, 128, 1, 4096, 8192, 8192, 8192, 4096]
    - [15, 13.421]
  - - [8192, 128, 1, 8192, 8192, 8192, 8192, 8192]
    - [14, 15.524]
  - - [8192, 256, 1, 128, 8192, 8192, 8192, 128]
    - [69, 4.695]
  - - [8192, 256, 1, 256, 8192, 8192, 8192, 256]
    - [18, 7.578]
  - - [8192, 256, 1, 512, 8192, 8192, 8192, 512]
    - [98, 11.414]
  - - [8192, 256, 1, 1024, 8192, 8192, 8192, 1024]
    - [99, 13.707]
  - - [8192, 256, 1, 2048, 8192, 8192, 8192, 2048]
    - [91, 15.203]
  - - [8192, 256, 1, 4096, 8192, 8192, 8192, 4096]
    - [83, 16.332]
  - - [8192, 256, 1, 8192, 8192, 8192, 8192, 8192]
    - [83, 17.486]
  - - [8192, 512, 1, 128, 8192, 8192, 8192, 128]
    - [59, 5.694]
  - - [8192, 512, 1, 256, 8192, 8192, 8192, 256]
    - [60, 8.986]
  - - [8192, 512, 1, 512, 8192, 8192, 8192, 512]
    - [61, 12.413]
  - - [8192, 512, 1, 1024, 8192, 8192, 8192, 1024]
    - [66, 15.148]
  - - [8192, 512, 1, 2048, 8192, 8192, 8192, 2048]
    - [86, 17.959]
  - - [8192, 512, 1, 4096, 8192, 8192, 8192, 4096]
    - [48, 17.573]
  - - [8192, 512, 1, 8192, 8192, 8192, 8192, 8192]
    - [42, 20.411]
  - - [8192, 1024, 1, 128, 8192, 8192, 8192, 128]
    - [0, 6.261]
  - - [8192, 1024, 1, 256, 8192, 8192, 8192, 256]
    - [55, 9.942]
  - - [8192, 1024, 1, 512, 8192, 8192, 8192, 512]
    - [52, 14.05]
  - - [8192, 1024, 1, 1024, 8192, 8192, 8192, 1024]
    - [54, 18.469]
  - - [8192, 1024, 1, 2048, 8192, 8192, 8192, 2048]
    - [81, 19.068]
  - - [8192, 1024, 1, 4096, 8192, 8192, 8192, 4096]
    - [49, 19.886]
  - - [8192, 1024, 1, 8192, 8192, 8192, 8192, 8192]
    - [40, 22.491]
  - - [8192, 2048, 1, 128, 8192, 8192, 8192, 128]
    - [41, 6.37]
  - - [8192, 2048, 1, 256, 8192, 8192, 8192, 256]
    - [46, 9.933]
  - - [8192, 2048, 1, 512, 8192, 8192, 8192, 512]
    - [46, 14.257]
  - - [8192, 2048, 1, 1024, 8192, 8192, 8192, 1024]
    - [40, 17.913]
  - - [8192, 2048, 1, 2048, 8192, 8192, 8192, 2048]
    - [73, 19.517]
  - - [8192, 2048, 1, 4096, 8192, 8192, 8192, 4096]
    - [40, 22.808]
  - - [8192, 2048, 1, 8192, 8192, 8192, 8192, 8192]
    - [42, 23.681]
  - - [8192, 4096, 1, 128, 8192, 8192, 8192, 128]
    - [17, 5.726]
  - - [8192, 4096, 1, 256, 8192, 8192, 8192, 256]
    - [57, 8.675]
  - - [8192, 4096, 1, 512, 8192, 8192, 8192, 512]
    - [54, 12.808]
  - - [8192, 4096, 1, 1024, 8192, 8192, 8192, 1024]
    - [52, 16.887]
  - - [8192, 4096, 1, 2048, 8192, 8192, 8192, 2048]
    - [40, 21.653]
  - - [8192, 4096, 1, 4096, 8192, 8192, 8192, 4096]
    - [40, 24.105]
  - - [8192, 4096, 1, 8192, 8192, 8192, 8192, 8192]
    - [42, 25.817]
  - - [8192, 8192, 1, 128, 8192, 8192, 8192, 128]
    - [1, 5.484]
  - - [8192, 8192, 1, 256, 8192, 8192, 8192, 256]
    - [54, 8.908]
  - - [8192, 8192, 1, 512, 8192, 8192, 8192, 512]
    - [52, 13.815]
  - - [8192, 8192, 1, 1024, 8192, 8192, 8192, 1024]
    - [43, 18.509]
  - - [8192, 8192, 1, 2048, 8192, 8192, 8192, 2048]
    - [43, 22.929]
  - - [8192, 8192, 1, 4096, 8192, 8192, 8192, 4096]
    - [40, 25.847]
  - - [8192, 8192, 1, 8192, 8192, 8192, 8192, 8192]
    - [43, 26.269]
  - - [1, 1, 1, 32, 1, 1, 1, 32]
    - [114, 0.0]
- null
- null
- DeviceEfficiency
- GridBased
