library/src/amd_detail/rocblaslt/src/Tensile/Logic/streamk/gfx942a/aquavanjaram942_Cijk_Alik_Bljk_HHS_BH_UserArgs.yaml
- {MinimumRequiredVersion: 4.33.0}
- aquavanjaram942
- gfx942
- [Device 0049, Device 0050]
    SolutionIndex: 0
    SolutionNameMin: Cijk_Alik_Bljk_HHS_BH_UserArgs_MT128x128x32_MI16x16x1_SN_LDSB1_CLR1_GSU0_GSUC0_GSUWGMRR0_K1_LBSPPA128_LBSPPB128_MIWT4_4_PLR1_SU32_SUM0_SUS256_SKXCCM0_VWA2_VWB2_WGM1_WGMXCC1_WGMXCCGn1
    SolutionIndex: 1
    SolutionNameMin: Cijk_Alik_Bljk_HHS_BH_UserArgs_MT256x64x64_MI16x16x1_SN_LDSB1_CLR1_GSU0_GSUC0_GSUWGMRR0_K1_LBSPPA512_LBSPPB256_MIWT8_2_PLR1_SU32_SUM0_SUS256_SKXCCM0_VWA4_VWB2_WGM8_WGMXCC1_WGMXCCGn1
    SolutionIndex: 2
    SolutionNameMin: Cijk_Alik_Bljk_HHS_BH_UserArgs_MT128x128x64_MI16x16x1_SN_LDSB1_CLR1_GSU0_GSUC0_GSUWGMRR0_K1_LBSPPA256_LBSPPB128_MIWT4_4_PLR1_SU32_SUM0_SUS256_SKXCCM0_VWA2_VWB1_WGM1_WGMXCC1_WGMXCCGn1
    SolutionIndex: 3
    SolutionNameMin: Cijk_Alik_Bljk_HHS_BH_UserArgs_MT128x128x64_MI16x16x1_SN_LDSB1_CLR1_GSU0_GSUC0_GSUWGMRR0_K1_LBSPPA512_LBSPPB128_MIWT4_4_PLR1_SU32_SUM0_SUS256_SKXCCM0_VWA4_VWB1_WGM1_WGMXCC1_WGMXCCGn1
    SolutionIndex: 4
    SolutionNameMin: Cijk_Alik_Bljk_HHS_BH_UserArgs_MT128x128x64_MI16x16x1_SN_LDSB1_CLR1_GSU0_GSUC0_GSUWGMRR0_K1_LBSPPA512_LBSPPB256_MIWT4_4_PLR1_SU32_SUM0_SUS256_SKXCCM0_VWA4_VWB2_WGM1_WGMXCC1_WGMXCCGn1
    SolutionIndex: 5
    SolutionNameMin: Cijk_Alik_Bljk_HHS_BH_UserArgs_MT128x128x64_MI16x16x1_SN_LDSB1_CLR1_GSU0_GSUC0_GSUWGMRR0_K1_LBSPPA512_LBSPPB256_MIWT4_4_PLR1_SU32_SUM0_SUS256_SKXCCM0_VWA4_VWB2_WGM4_WGMXCC1_WGMXCCGn1
    SolutionIndex: 6
    SolutionNameMin: Cijk_Alik_Bljk_HHS_BH_UserArgs_MT64x128x64_MI16x16x1_SN_LDSB1_CLR1_GSU0_GSUC0_GSUWGMRR0_K1_LBSPPA256_LBSPPB256_MIWT2_4_PLR1_SU32_SUM0_SUS256_SKXCCM0_VWA2_VWB2_WGM1_WGMXCC1_WGMXCCGn1
    SolutionIndex: 7
    SolutionNameMin: Cijk_Alik_Bljk_HHS_BH_UserArgs_MT64x128x64_MI16x16x1_SN_LDSB1_CLR1_GSU0_GSUC0_GSUWGMRR0_K1_LBSPPA256_LBSPPB512_MIWT2_4_PLR1_SU32_SUM0_SUS256_SKXCCM0_VWA2_VWB4_WGM1_WGMXCC1_WGMXCCGn1
    SolutionIndex: 8
    SolutionNameMin: Cijk_Alik_Bljk_HHS_BH_UserArgs_MT64x128x64_MI16x16x1_SN_LDSB1_CLR1_GSU0_GSUC0_GSUWGMRR0_K1_LBSPPA128_LBSPPB256_MIWT2_4_PLR1_SU32_SUM0_SUS256_SKXCCM0_VWA1_VWB2_WGM4_WGMXCC1_WGMXCCGn1
    SolutionIndex: 9
    SolutionNameMin: Cijk_Alik_Bljk_HHS_BH_UserArgs_MT64x128x64_MI16x16x1_SN_LDSB1_CLR1_GSU0_GSUC0_GSUWGMRR0_K1_LBSPPA256_LBSPPB128_MIWT2_4_PLR1_SU32_SUM0_SUS256_SKXCCM0_VWA2_VWB1_WGM8_WGMXCC1_WGMXCCGn1
    SolutionIndex: 10
    SolutionNameMin: Cijk_Alik_Bljk_HHS_BH_UserArgs_MT128x64x64_MI16x16x1_SN_LDSB1_CLR1_GSU0_GSUC0_GSUWGMRR0_K1_LBSPPA256_LBSPPB128_MIWT4_2_PLR1_SU32_SUM0_SUS256_SKXCCM0_VWA2_VWB1_WGM1_WGMXCC1_WGMXCCGn1
    SolutionIndex: 11
    SolutionNameMin: Cijk_Alik_Bljk_HHS_BH_UserArgs_MT128x64x64_MI16x16x1_SN_LDSB1_CLR1_GSU0_GSUC0_GSUWGMRR0_K1_LBSPPA512_LBSPPB128_MIWT4_2_PLR1_SU32_SUM0_SUS256_SKXCCM0_VWA4_VWB1_WGM1_WGMXCC1_WGMXCCGn1
    SolutionIndex: 12
    SolutionNameMin: Cijk_Alik_Bljk_HHS_BH_UserArgs_MT128x64x64_MI16x16x1_SN_LDSB1_CLR1_GSU0_GSUC0_GSUWGMRR0_K1_LBSPPA256_LBSPPB256_MIWT4_2_PLR1_SU32_SUM0_SUS256_SKXCCM0_VWA2_VWB2_WGM1_WGMXCC1_WGMXCCGn1
    SolutionIndex: 13
    SolutionNameMin: Cijk_Alik_Bljk_HHS_BH_UserArgs_MT128x64x64_MI16x16x1_SN_LDSB1_CLR1_GSU0_GSUC0_GSUWGMRR0_K1_LBSPPA256_LBSPPB256_MIWT4_2_PLR1_SU32_SUM0_SUS256_SKXCCM0_VWA2_VWB2_WGM4_WGMXCC1_WGMXCCGn1
    SolutionIndex: 14
    SolutionNameMin: Cijk_Alik_Bljk_HHS_BH_UserArgs_MT128x64x64_MI16x16x1_SN_LDSB1_CLR1_GSU0_GSUC0_GSUWGMRR0_K1_LBSPPA512_LBSPPB128_MIWT4_2_PLR2_SU32_SUM0_SUS256_SKXCCM0_VWA4_VWB1_WGM4_WGMXCC1_WGMXCCGn1
    SolutionIndex: 15
    SolutionNameMin: Cijk_Alik_Bljk_HHS_BH_UserArgs_MT128x64x64_MI16x16x1_SN_LDSB1_CLR1_GSU0_GSUC0_GSUWGMRR0_K1_LBSPPA512_LBSPPB128_MIWT4_2_PLR1_SU32_SUM0_SUS256_SKXCCM0_VWA4_VWB1_WGM8_WGMXCC1_WGMXCCGn1
    SolutionIndex: 16
    SolutionNameMin: Cijk_Alik_Bljk_HHS_BH_UserArgs_MT128x64x64_MI16x16x1_SN_LDSB1_CLR1_GSU0_GSUC0_GSUWGMRR0_K1_LBSPPA256_LBSPPB256_MIWT4_2_PLR1_SU32_SUM0_SUS256_SKXCCM0_VWA2_VWB2_WGM8_WGMXCC1_WGMXCCGn1
    SolutionIndex: 17
    SolutionNameMin: Cijk_Alik_Bljk_HHS_BH_UserArgs_MT128x64x64_MI16x16x1_SN_LDSB1_CLR1_GSU0_GSUC0_GSUWGMRR0_K1_LBSPPA512_LBSPPB128_MIWT4_2_PLR2_SU32_SUM0_SUS256_SKXCCM0_VWA4_VWB1_WGM8_WGMXCC1_WGMXCCGn1
    SolutionIndex: 18
    SolutionNameMin: Cijk_Alik_Bljk_HHS_BH_UserArgs_MT64x64x64_MI16x16x1_SN_LDSB1_CLR1_GSU0_GSUC0_GSUWGMRR0_K1_LBSPPA256_LBSPPB128_MIWT2_2_PLR1_SU32_SUM0_SUS256_SKXCCM0_VWA2_VWB1_WGM1_WGMXCC1_WGMXCCGn1
    SolutionIndex: 19
    SolutionNameMin: Cijk_Alik_Bljk_HHS_BH_UserArgs_MT64x64x64_MI16x16x1_SN_LDSB1_CLR1_GSU0_GSUC0_GSUWGMRR0_K1_LBSPPA256_LBSPPB256_MIWT2_2_PLR1_SU32_SUM0_SUS256_SKXCCM0_VWA2_VWB2_WGM1_WGMXCC1_WGMXCCGn1
    SolutionIndex: 20
    SolutionNameMin: Cijk_Alik_Bljk_HHS_BH_UserArgs_MT32x64x64_MI16x16x1_SN_LDSB0_CLR1_GSU0_GSUC0_GSUWGMRR0_K1_LBSPPA128_LBSPPB128_MIWT1_2_PLR1_SU32_SUM0_SUS256_SKXCCM0_VWA1_VWB1_WGM1_WGMXCC1_WGMXCCGn1
    SolutionIndex: 21
    SolutionNameMin: Cijk_Alik_Bljk_HHS_BH_UserArgs_MT32x64x64_MI16x16x1_SN_LDSB0_CLR1_GSU0_GSUC0_GSUWGMRR0_K1_LBSPPA128_LBSPPB256_MIWT1_2_PLR1_SU32_SUM0_SUS256_SKXCCM0_VWA1_VWB2_WGM1_WGMXCC1_WGMXCCGn1
    SolutionIndex: 22
    SolutionNameMin: Cijk_Alik_Bljk_HHS_BH_UserArgs_MT64x32x64_MI16x16x1_SN_LDSB0_CLR1_GSU0_GSUC0_GSUWGMRR0_K1_LBSPPA256_LBSPPB128_MIWT2_1_PLR1_SU32_SUM0_SUS256_SKXCCM0_VWA2_VWB1_WGM1_WGMXCC1_WGMXCCGn1
    SolutionIndex: 23
    SolutionNameMin: Cijk_Alik_Bljk_HHS_BH_UserArgs_MT64x32x64_MI16x16x1_SN_LDSB0_CLR1_GSU0_GSUC0_GSUWGMRR0_K1_LBSPPA256_LBSPPB128_MIWT2_1_PLR2_SU32_SUM0_SUS256_SKXCCM0_VWA2_VWB1_WGM1_WGMXCC1_WGMXCCGn1
    SolutionIndex: 24
    SolutionNameMin: Cijk_Alik_Bljk_HHS_BH_UserArgs_MT32x32x64_MI16x16x1_SN_LDSB0_CLR1_GSU0_GSUC0_GSUWGMRR0_K1_LBSPPA128_LBSPPB128_MIWT1_1_PLR1_SU32_SUM0_SUS256_SKXCCM0_VWA1_VWB1_WGM1_WGMXCC1_WGMXCCGn1
    SolutionIndex: 25
    SolutionNameMin: Cijk_Alik_Bljk_HHS_BH_UserArgs_MT64x64x128_MI16x16x1_SN_LDSB1_CLR1_GSU0_GSUC0_GSUWGMRR0_K1_LBSPPA512_LBSPPB256_MIWT2_2_PLR1_SU32_SUM0_SUS256_SKXCCM0_VWA2_VWB1_WGM1_WGMXCC1_WGMXCCGn1
    SolutionIndex: 26
    SolutionNameMin: Cijk_Alik_Bljk_HHS_BH_UserArgs_MT64x64x128_MI16x16x1_SN_LDSB1_CLR1_GSU0_GSUC0_GSUWGMRR0_K1_LBSPPA512_LBSPPB512_MIWT2_2_PLR1_SU32_SUM0_SUS256_SKXCCM0_VWA2_VWB2_WGM1_WGMXCC1_WGMXCCGn1
    SolutionIndex: 27
    SolutionNameMin: Cijk_Alik_Bljk_HHS_BH_UserArgs_MT64x32x128_MI16x16x1_SN_LDSB1_CLR1_GSU0_GSUC0_GSUWGMRR0_K1_LBSPPA512_LBSPPB256_MIWT2_1_PLR1_SU32_SUM0_SUS256_SKXCCM0_VWA2_VWB1_WGM1_WGMXCC1_WGMXCCGn1
    SolutionIndex: 28
    SolutionNameMin: Cijk_Alik_Bljk_HHS_BH_UserArgs_MT64x32x128_MI16x16x1_SN_LDSB1_CLR1_GSU0_GSUC0_GSUWGMRR0_K1_LBSPPA512_LBSPPB256_MIWT2_1_PLR2_SU32_SUM0_SUS256_SKXCCM0_VWA2_VWB1_WGM1_WGMXCC1_WGMXCCGn1
    SolutionIndex: 29
    SolutionNameMin: Cijk_Alik_Bljk_HHS_BH_UserArgs_MT32x32x128_MI16x16x1_SN_LDSB1_CLR1_GSU0_GSUC0_GSUWGMRR0_K1_LBSPPA256_LBSPPB256_MIWT1_1_PLR1_SU32_SUM0_SUS256_SKXCCM0_VWA1_VWB1_WGM1_WGMXCC1_WGMXCCGn1
    SolutionIndex: 30
    SolutionNameMin: Cijk_Alik_Bljk_HHS_BH_UserArgs_MT32x32x128_MI16x16x1_SN_LDSB1_CLR1_GSU0_GSUC0_GSUWGMRR0_K1_LBSPPA256_LBSPPB256_MIWT1_1_PLR2_SU32_SUM0_SUS256_SKXCCM0_VWA1_VWB1_WGM1_WGMXCC1_WGMXCCGn1
    SolutionIndex: 31
    SolutionNameMin: Cijk_Alik_Bljk_HHS_BH_UserArgs_MT32x32x128_MI16x16x1_SN_LDSB1_CLR1_GSU0_GSUC0_GSUWGMRR0_K1_LBSPPA256_LBSPPB256_MIWT1_1_PLR1_SU32_SUM0_SUS256_SKXCCM0_VWA1_VWB1_WGM4_WGMXCC1_WGMXCCGn1
    SolutionIndex: 32
    SolutionNameMin: Cijk_Alik_Bljk_HHS_BH_UserArgs_MT128x128x32_MI16x16x1_SN_LDSB1_CLR1_GSU0_GSUC0_GSUWGMRR0_K1_LBSPPA128_LBSPPB128_MIWT4_4_PLR1_SU32_SUM0_SUS256_SKXCCM6_VWA2_VWB1_WGM1_WGMXCC1_WGMXCCGn1
    SolutionIndex: 33
    SolutionNameMin: Cijk_Alik_Bljk_HHS_BH_UserArgs_MT128x128x32_MI16x16x1_SN_LDSB1_CLR1_GSU0_GSUC0_GSUWGMRR0_K1_LBSPPA128_LBSPPB128_MIWT4_4_PLR1_SU32_SUM0_SUS256_SKXCCM6_VWA2_VWB2_WGM1_WGMXCC1_WGMXCCGn1
    SolutionIndex: 34
    SolutionNameMin: Cijk_Alik_Bljk_HHS_BH_UserArgs_MT128x128x32_MI16x16x1_SN_LDSB1_CLR1_GSU0_GSUC0_GSUWGMRR0_K1_LBSPPA128_LBSPPB128_MIWT4_4_PLR1_SU32_SUM0_SUS256_SKXCCM6_VWA2_VWB1_WGM4_WGMXCC1_WGMXCCGn1
    SolutionIndex: 35
    SolutionNameMin: Cijk_Alik_Bljk_HHS_BH_UserArgs_MT128x128x32_MI16x16x1_SN_LDSB1_CLR1_GSU0_GSUC0_GSUWGMRR0_K1_LBSPPA128_LBSPPB128_MIWT4_4_PLR1_SU32_SUM0_SUS256_SKXCCM6_VWA2_VWB1_WGM8_WGMXCC1_WGMXCCGn1
    SolutionIndex: 36
    SolutionNameMin: Cijk_Alik_Bljk_HHS_BH_UserArgs_MT128x128x32_MI16x16x1_SN_LDSB1_CLR1_GSU0_GSUC0_GSUWGMRR0_K1_LBSPPA128_LBSPPB128_MIWT4_4_PLR1_SU32_SUM0_SUS256_SKXCCM6_VWA2_VWB2_WGM8_WGMXCC1_WGMXCCGn1
    SolutionIndex: 37
    SolutionNameMin: Cijk_Alik_Bljk_HHS_BH_UserArgs_MT128x128x32_MI16x16x1_SN_LDSB1_CLR1_GSU0_GSUC0_GSUWGMRR0_K1_LBSPPA256_LBSPPB128_MIWT4_4_PLR1_SU32_SUM0_SUS256_SKXCCM6_VWA4_VWB2_WGM8_WGMXCC1_WGMXCCGn1
    SolutionIndex: 38
    SolutionNameMin: Cijk_Alik_Bljk_HHS_BH_UserArgs_MT128x128x32_MI16x16x1_SN_LDSB1_CLR1_GSU0_GSUC0_GSUWGMRR0_K1_LBSPPA128_LBSPPB256_MIWT4_4_PLR1_SU32_SUM0_SUS256_SKXCCM6_VWA2_VWB4_WGM8_WGMXCC1_WGMXCCGn1
    SolutionIndex: 39
    SolutionNameMin: Cijk_Alik_Bljk_HHS_BH_UserArgs_MT32x32x32_MI16x16x1_SN_LDSB0_CLR0_GSU0_GSUC0_GSUWGMRR0_K1_LBSPPA128_LBSPPB128_MIWT1_1_PLR0_SU32_SUM0_SUS256_SKXCCM6_VWA1_VWB1_WGM1_WGMXCC1_WGMXCCGn1
    SolutionIndex: 40
    SolutionNameMin: Cijk_Alik_Bljk_HHS_BH_UserArgs_MT128x128x64_MI16x16x1_SN_LDSB1_CLR1_GSU0_GSUC0_GSUWGMRR0_K1_LBSPPA128_LBSPPB128_MIWT4_4_PLR1_SU32_SUM0_SUS256_SKXCCM6_VWA1_VWB1_WGM1_WGMXCC1_WGMXCCGn1
    SolutionIndex: 41
    SolutionNameMin: Cijk_Alik_Bljk_HHS_BH_UserArgs_MT128x128x64_MI16x16x1_SN_LDSB1_CLR1_GSU0_GSUC0_GSUWGMRR0_K1_LBSPPA256_LBSPPB128_MIWT4_4_PLR1_SU32_SUM0_SUS256_SKXCCM6_VWA2_VWB1_WGM1_WGMXCC1_WGMXCCGn1
    SolutionIndex: 42
    SolutionNameMin: Cijk_Alik_Bljk_HHS_BH_UserArgs_MT128x128x64_MI16x16x1_SN_LDSB1_CLR1_GSU0_GSUC0_GSUWGMRR0_K1_LBSPPA512_LBSPPB128_MIWT4_4_PLR1_SU32_SUM0_SUS256_SKXCCM6_VWA4_VWB1_WGM1_WGMXCC1_WGMXCCGn1
    SolutionIndex: 43
    SolutionNameMin: Cijk_Alik_Bljk_HHS_BH_UserArgs_MT128x128x64_MI16x16x1_SN_LDSB1_CLR1_GSU0_GSUC0_GSUWGMRR0_K1_LBSPPA128_LBSPPB256_MIWT4_4_PLR1_SU32_SUM0_SUS256_SKXCCM6_VWA1_VWB2_WGM1_WGMXCC1_WGMXCCGn1
    SolutionIndex: 44
    SolutionNameMin: Cijk_Alik_Bljk_HHS_BH_UserArgs_MT128x128x64_MI16x16x1_SN_LDSB1_CLR1_GSU0_GSUC0_GSUWGMRR0_K1_LBSPPA256_LBSPPB256_MIWT4_4_PLR1_SU32_SUM0_SUS256_SKXCCM6_VWA2_VWB2_WGM1_WGMXCC1_WGMXCCGn1
    SolutionIndex: 45
    SolutionNameMin: Cijk_Alik_Bljk_HHS_BH_UserArgs_MT128x128x64_MI16x16x1_SN_LDSB1_CLR1_GSU0_GSUC0_GSUWGMRR0_K1_LBSPPA512_LBSPPB256_MIWT4_4_PLR1_SU32_SUM0_SUS256_SKXCCM6_VWA4_VWB2_WGM1_WGMXCC1_WGMXCCGn1
    SolutionIndex: 46
    SolutionNameMin: Cijk_Alik_Bljk_HHS_BH_UserArgs_MT128x128x64_MI16x16x1_SN_LDSB1_CLR1_GSU0_GSUC0_GSUWGMRR0_K1_LBSPPA256_LBSPPB512_MIWT4_4_PLR1_SU32_SUM0_SUS256_SKXCCM6_VWA2_VWB4_WGM1_WGMXCC1_WGMXCCGn1
    SolutionIndex: 47
    SolutionNameMin: Cijk_Alik_Bljk_HHS_BH_UserArgs_MT128x128x64_MI16x16x1_SN_LDSB1_CLR1_GSU0_GSUC0_GSUWGMRR0_K1_LBSPPA512_LBSPPB512_MIWT4_4_PLR1_SU32_SUM0_SUS256_SKXCCM6_VWA4_VWB4_WGM1_WGMXCC1_WGMXCCGn1
    SolutionIndex: 48
    SolutionNameMin: Cijk_Alik_Bljk_HHS_BH_UserArgs_MT128x128x64_MI16x16x1_SN_LDSB1_CLR1_GSU0_GSUC0_GSUWGMRR0_K1_LBSPPA512_LBSPPB128_MIWT4_4_PLR2_SU32_SUM0_SUS256_SKXCCM6_VWA4_VWB1_WGM1_WGMXCC1_WGMXCCGn1
    SolutionIndex: 49
    SolutionNameMin: Cijk_Alik_Bljk_HHS_BH_UserArgs_MT128x128x64_MI16x16x1_SN_LDSB1_CLR1_GSU0_GSUC0_GSUWGMRR0_K1_LBSPPA256_LBSPPB128_MIWT4_4_PLR1_SU32_SUM0_SUS256_SKXCCM6_VWA2_VWB1_WGM4_WGMXCC1_WGMXCCGn1
    SolutionIndex: 50
    SolutionNameMin: Cijk_Alik_Bljk_HHS_BH_UserArgs_MT128x128x64_MI16x16x1_SN_LDSB1_CLR1_GSU0_GSUC0_GSUWGMRR0_K1_LBSPPA512_LBSPPB128_MIWT4_4_PLR1_SU32_SUM0_SUS256_SKXCCM6_VWA4_VWB1_WGM4_WGMXCC1_WGMXCCGn1
    SolutionIndex: 51
    SolutionNameMin: Cijk_Alik_Bljk_HHS_BH_UserArgs_MT128x128x64_MI16x16x1_SN_LDSB1_CLR1_GSU0_GSUC0_GSUWGMRR0_K1_LBSPPA256_LBSPPB256_MIWT4_4_PLR1_SU32_SUM0_SUS256_SKXCCM6_VWA2_VWB2_WGM4_WGMXCC1_WGMXCCGn1
    SolutionIndex: 52
    SolutionNameMin: Cijk_Alik_Bljk_HHS_BH_UserArgs_MT128x128x64_MI16x16x1_SN_LDSB1_CLR1_GSU0_GSUC0_GSUWGMRR0_K1_LBSPPA512_LBSPPB256_MIWT4_4_PLR1_SU32_SUM0_SUS256_SKXCCM6_VWA4_VWB2_WGM4_WGMXCC1_WGMXCCGn1
    SolutionIndex: 53
    SolutionNameMin: Cijk_Alik_Bljk_HHS_BH_UserArgs_MT128x128x64_MI16x16x1_SN_LDSB1_CLR1_GSU0_GSUC0_GSUWGMRR0_K1_LBSPPA512_LBSPPB512_MIWT4_4_PLR1_SU32_SUM0_SUS256_SKXCCM6_VWA4_VWB4_WGM4_WGMXCC1_WGMXCCGn1
    SolutionIndex: 54
    SolutionNameMin: Cijk_Alik_Bljk_HHS_BH_UserArgs_MT128x128x64_MI16x16x1_SN_LDSB1_CLR1_GSU0_GSUC0_GSUWGMRR0_K1_LBSPPA256_LBSPPB128_MIWT4_4_PLR1_SU32_SUM0_SUS256_SKXCCM6_VWA2_VWB1_WGM8_WGMXCC1_WGMXCCGn1
    SolutionIndex: 55
    SolutionNameMin: Cijk_Alik_Bljk_HHS_BH_UserArgs_MT128x128x64_MI16x16x1_SN_LDSB1_CLR1_GSU0_GSUC0_GSUWGMRR0_K1_LBSPPA512_LBSPPB128_MIWT4_4_PLR1_SU32_SUM0_SUS256_SKXCCM6_VWA4_VWB1_WGM8_WGMXCC1_WGMXCCGn1
    SolutionIndex: 56
    SolutionNameMin: Cijk_Alik_Bljk_HHS_BH_UserArgs_MT128x128x64_MI16x16x1_SN_LDSB1_CLR1_GSU0_GSUC0_GSUWGMRR0_K1_LBSPPA512_LBSPPB256_MIWT4_4_PLR1_SU32_SUM0_SUS256_SKXCCM6_VWA4_VWB2_WGM8_WGMXCC1_WGMXCCGn1
    SolutionIndex: 57
    SolutionNameMin: Cijk_Alik_Bljk_HHS_BH_UserArgs_MT128x128x64_MI16x16x1_SN_LDSB1_CLR1_GSU0_GSUC0_GSUWGMRR0_K1_LBSPPA128_LBSPPB512_MIWT4_4_PLR1_SU32_SUM0_SUS256_SKXCCM6_VWA1_VWB4_WGM8_WGMXCC1_WGMXCCGn1
    SolutionIndex: 58
    SolutionNameMin: Cijk_Alik_Bljk_HHS_BH_UserArgs_MT128x128x64_MI16x16x1_SN_LDSB1_CLR1_GSU0_GSUC0_GSUWGMRR0_K1_LBSPPA256_LBSPPB512_MIWT4_4_PLR1_SU32_SUM0_SUS256_SKXCCM6_VWA2_VWB4_WGM8_WGMXCC1_WGMXCCGn1
    SolutionIndex: 59
    SolutionNameMin: Cijk_Alik_Bljk_HHS_BH_UserArgs_MT128x128x64_MI16x16x1_SN_LDSB1_CLR1_GSU0_GSUC0_GSUWGMRR0_K1_LBSPPA512_LBSPPB512_MIWT4_4_PLR1_SU32_SUM0_SUS256_SKXCCM6_VWA4_VWB4_WGM8_WGMXCC1_WGMXCCGn1
    SolutionIndex: 60
    SolutionNameMin: Cijk_Alik_Bljk_HHS_BH_UserArgs_MT128x128x64_MI16x16x1_SN_LDSB1_CLR1_GSU0_GSUC0_GSUWGMRR0_K1_LBSPPA512_LBSPPB128_MIWT4_4_PLR2_SU32_SUM0_SUS256_SKXCCM6_VWA4_VWB1_WGM8_WGMXCC1_WGMXCCGn1
    SolutionIndex: 61
    SolutionNameMin: Cijk_Alik_Bljk_HHS_BH_UserArgs_MT64x128x64_MI16x16x1_SN_LDSB1_CLR1_GSU0_GSUC0_GSUWGMRR0_K1_LBSPPA256_LBSPPB256_MIWT2_4_PLR1_SU32_SUM0_SUS256_SKXCCM6_VWA2_VWB2_WGM1_WGMXCC1_WGMXCCGn1
    SolutionIndex: 62
    SolutionNameMin: Cijk_Alik_Bljk_HHS_BH_UserArgs_MT64x128x64_MI16x16x1_SN_LDSB1_CLR1_GSU0_GSUC0_GSUWGMRR0_K1_LBSPPA256_LBSPPB512_MIWT2_4_PLR1_SU32_SUM0_SUS256_SKXCCM6_VWA2_VWB4_WGM1_WGMXCC1_WGMXCCGn1
    SolutionIndex: 63
    SolutionNameMin: Cijk_Alik_Bljk_HHS_BH_UserArgs_MT64x128x64_MI16x16x1_SN_LDSB1_CLR1_GSU0_GSUC0_GSUWGMRR0_K1_LBSPPA256_LBSPPB128_MIWT2_4_PLR2_SU32_SUM0_SUS256_SKXCCM6_VWA2_VWB1_WGM1_WGMXCC1_WGMXCCGn1
    SolutionIndex: 64
    SolutionNameMin: Cijk_Alik_Bljk_HHS_BH_UserArgs_MT64x128x64_MI16x16x1_SN_LDSB1_CLR1_GSU0_GSUC0_GSUWGMRR0_K1_LBSPPA256_LBSPPB128_MIWT2_4_PLR1_SU32_SUM0_SUS256_SKXCCM6_VWA2_VWB1_WGM4_WGMXCC1_WGMXCCGn1
    SolutionIndex: 65
    SolutionNameMin: Cijk_Alik_Bljk_HHS_BH_UserArgs_MT64x128x64_MI16x16x1_SN_LDSB1_CLR1_GSU0_GSUC0_GSUWGMRR0_K1_LBSPPA256_LBSPPB512_MIWT2_4_PLR1_SU32_SUM0_SUS256_SKXCCM6_VWA2_VWB4_WGM4_WGMXCC1_WGMXCCGn1
    SolutionIndex: 66
    SolutionNameMin: Cijk_Alik_Bljk_HHS_BH_UserArgs_MT64x128x64_MI16x16x1_SN_LDSB1_CLR1_GSU0_GSUC0_GSUWGMRR0_K1_LBSPPA128_LBSPPB128_MIWT2_4_PLR1_SU32_SUM0_SUS256_SKXCCM6_VWA1_VWB1_WGM8_WGMXCC1_WGMXCCGn1
    SolutionIndex: 67
    SolutionNameMin: Cijk_Alik_Bljk_HHS_BH_UserArgs_MT64x128x64_MI16x16x1_SN_LDSB1_CLR1_GSU0_GSUC0_GSUWGMRR0_K1_LBSPPA256_LBSPPB128_MIWT2_4_PLR1_SU32_SUM0_SUS256_SKXCCM6_VWA2_VWB1_WGM8_WGMXCC1_WGMXCCGn1
    SolutionIndex: 68
    SolutionNameMin: Cijk_Alik_Bljk_HHS_BH_UserArgs_MT64x128x64_MI16x16x1_SN_LDSB1_CLR1_GSU0_GSUC0_GSUWGMRR0_K1_LBSPPA256_LBSPPB256_MIWT2_4_PLR1_SU32_SUM0_SUS256_SKXCCM6_VWA2_VWB2_WGM8_WGMXCC1_WGMXCCGn1
    SolutionIndex: 69
    SolutionNameMin: Cijk_Alik_Bljk_HHS_BH_UserArgs_MT64x128x64_MI16x16x1_SN_LDSB1_CLR1_GSU0_GSUC0_GSUWGMRR0_K1_LBSPPA256_LBSPPB512_MIWT2_4_PLR1_SU32_SUM0_SUS256_SKXCCM6_VWA2_VWB4_WGM8_WGMXCC1_WGMXCCGn1
    SolutionIndex: 70
    SolutionNameMin: Cijk_Alik_Bljk_HHS_BH_UserArgs_MT64x128x64_MI16x16x1_SN_LDSB1_CLR1_GSU0_GSUC0_GSUWGMRR0_K1_LBSPPA256_LBSPPB128_MIWT2_4_PLR2_SU32_SUM0_SUS256_SKXCCM6_VWA2_VWB1_WGM8_WGMXCC1_WGMXCCGn1
    SolutionIndex: 71
    SolutionNameMin: Cijk_Alik_Bljk_HHS_BH_UserArgs_MT128x64x64_MI16x16x1_SN_LDSB1_CLR1_GSU0_GSUC0_GSUWGMRR0_K1_LBSPPA256_LBSPPB128_MIWT4_2_PLR1_SU32_SUM0_SUS256_SKXCCM6_VWA2_VWB1_WGM1_WGMXCC1_WGMXCCGn1
    SolutionIndex: 72
    SolutionNameMin: Cijk_Alik_Bljk_HHS_BH_UserArgs_MT128x64x64_MI16x16x1_SN_LDSB1_CLR1_GSU0_GSUC0_GSUWGMRR0_K1_LBSPPA512_LBSPPB128_MIWT4_2_PLR1_SU32_SUM0_SUS256_SKXCCM6_VWA4_VWB1_WGM1_WGMXCC1_WGMXCCGn1
    SolutionIndex: 73
    SolutionNameMin: Cijk_Alik_Bljk_HHS_BH_UserArgs_MT128x64x64_MI16x16x1_SN_LDSB1_CLR1_GSU0_GSUC0_GSUWGMRR0_K1_LBSPPA256_LBSPPB256_MIWT4_2_PLR1_SU32_SUM0_SUS256_SKXCCM6_VWA2_VWB2_WGM1_WGMXCC1_WGMXCCGn1
    SolutionIndex: 74
    SolutionNameMin: Cijk_Alik_Bljk_HHS_BH_UserArgs_MT128x64x64_MI16x16x1_SN_LDSB1_CLR1_GSU0_GSUC0_GSUWGMRR0_K1_LBSPPA512_LBSPPB256_MIWT4_2_PLR1_SU32_SUM0_SUS256_SKXCCM6_VWA4_VWB2_WGM1_WGMXCC1_WGMXCCGn1
    SolutionIndex: 75
    SolutionNameMin: Cijk_Alik_Bljk_HHS_BH_UserArgs_MT128x64x64_MI16x16x1_SN_LDSB1_CLR1_GSU0_GSUC0_GSUWGMRR0_K1_LBSPPA512_LBSPPB128_MIWT4_2_PLR2_SU32_SUM0_SUS256_SKXCCM6_VWA4_VWB1_WGM1_WGMXCC1_WGMXCCGn1
    SolutionIndex: 76
    SolutionNameMin: Cijk_Alik_Bljk_HHS_BH_UserArgs_MT128x64x64_MI16x16x1_SN_LDSB1_CLR1_GSU0_GSUC0_GSUWGMRR0_K1_LBSPPA256_LBSPPB256_MIWT4_2_PLR2_SU32_SUM0_SUS256_SKXCCM6_VWA2_VWB2_WGM1_WGMXCC1_WGMXCCGn1
    SolutionIndex: 77
    SolutionNameMin: Cijk_Alik_Bljk_HHS_BH_UserArgs_MT128x64x64_MI16x16x1_SN_LDSB1_CLR1_GSU0_GSUC0_GSUWGMRR0_K1_LBSPPA512_LBSPPB256_MIWT4_2_PLR2_SU32_SUM0_SUS256_SKXCCM6_VWA4_VWB2_WGM1_WGMXCC1_WGMXCCGn1
    SolutionIndex: 78
    SolutionNameMin: Cijk_Alik_Bljk_HHS_BH_UserArgs_MT128x64x64_MI16x16x1_SN_LDSB1_CLR1_GSU0_GSUC0_GSUWGMRR0_K1_LBSPPA256_LBSPPB256_MIWT4_2_PLR1_SU32_SUM0_SUS256_SKXCCM6_VWA2_VWB2_WGM4_WGMXCC1_WGMXCCGn1
    SolutionIndex: 79
    SolutionNameMin: Cijk_Alik_Bljk_HHS_BH_UserArgs_MT128x64x64_MI16x16x1_SN_LDSB1_CLR1_GSU0_GSUC0_GSUWGMRR0_K1_LBSPPA256_LBSPPB128_MIWT4_2_PLR1_SU32_SUM0_SUS256_SKXCCM6_VWA2_VWB1_WGM8_WGMXCC1_WGMXCCGn1
    SolutionIndex: 80
    SolutionNameMin: Cijk_Alik_Bljk_HHS_BH_UserArgs_MT128x64x64_MI16x16x1_SN_LDSB1_CLR1_GSU0_GSUC0_GSUWGMRR0_K1_LBSPPA512_LBSPPB128_MIWT4_2_PLR1_SU32_SUM0_SUS256_SKXCCM6_VWA4_VWB1_WGM8_WGMXCC1_WGMXCCGn1
    SolutionIndex: 81
    SolutionNameMin: Cijk_Alik_Bljk_HHS_BH_UserArgs_MT128x64x64_MI16x16x1_SN_LDSB1_CLR1_GSU0_GSUC0_GSUWGMRR0_K1_LBSPPA256_LBSPPB256_MIWT4_2_PLR1_SU32_SUM0_SUS256_SKXCCM6_VWA2_VWB2_WGM8_WGMXCC1_WGMXCCGn1
    SolutionIndex: 82
    SolutionNameMin: Cijk_Alik_Bljk_HHS_BH_UserArgs_MT128x64x64_MI16x16x1_SN_LDSB1_CLR1_GSU0_GSUC0_GSUWGMRR0_K1_LBSPPA512_LBSPPB256_MIWT4_2_PLR1_SU32_SUM0_SUS256_SKXCCM6_VWA4_VWB2_WGM8_WGMXCC1_WGMXCCGn1
    SolutionIndex: 83
    SolutionNameMin: Cijk_Alik_Bljk_HHS_BH_UserArgs_MT64x64x64_MI16x16x1_SN_LDSB1_CLR1_GSU0_GSUC0_GSUWGMRR0_K1_LBSPPA128_LBSPPB128_MIWT2_2_PLR1_SU32_SUM0_SUS256_SKXCCM6_VWA1_VWB1_WGM1_WGMXCC1_WGMXCCGn1
    SolutionIndex: 84
    SolutionNameMin: Cijk_Alik_Bljk_HHS_BH_UserArgs_MT64x64x64_MI16x16x1_SN_LDSB1_CLR1_GSU0_GSUC0_GSUWGMRR0_K1_LBSPPA256_LBSPPB128_MIWT2_2_PLR1_SU32_SUM0_SUS256_SKXCCM6_VWA2_VWB1_WGM1_WGMXCC1_WGMXCCGn1
    SolutionIndex: 85
    SolutionNameMin: Cijk_Alik_Bljk_HHS_BH_UserArgs_MT64x64x64_MI16x16x1_SN_LDSB1_CLR1_GSU0_GSUC0_GSUWGMRR0_K1_LBSPPA128_LBSPPB256_MIWT2_2_PLR1_SU32_SUM0_SUS256_SKXCCM6_VWA1_VWB2_WGM1_WGMXCC1_WGMXCCGn1
    SolutionIndex: 86
    SolutionNameMin: Cijk_Alik_Bljk_HHS_BH_UserArgs_MT64x64x64_MI16x16x1_SN_LDSB1_CLR1_GSU0_GSUC0_GSUWGMRR0_K1_LBSPPA256_LBSPPB256_MIWT2_2_PLR1_SU32_SUM0_SUS256_SKXCCM6_VWA2_VWB2_WGM1_WGMXCC1_WGMXCCGn1
    SolutionIndex: 87
    SolutionNameMin: Cijk_Alik_Bljk_HHS_BH_UserArgs_MT64x64x64_MI16x16x1_SN_LDSB1_CLR1_GSU0_GSUC0_GSUWGMRR0_K1_LBSPPA128_LBSPPB128_MIWT2_2_PLR2_SU32_SUM0_SUS256_SKXCCM6_VWA1_VWB1_WGM1_WGMXCC1_WGMXCCGn1
    SolutionIndex: 88
    SolutionNameMin: Cijk_Alik_Bljk_HHS_BH_UserArgs_MT64x64x64_MI16x16x1_SN_LDSB1_CLR1_GSU0_GSUC0_GSUWGMRR0_K1_LBSPPA256_LBSPPB128_MIWT2_2_PLR2_SU32_SUM0_SUS256_SKXCCM6_VWA2_VWB1_WGM1_WGMXCC1_WGMXCCGn1
    SolutionIndex: 89
    SolutionNameMin: Cijk_Alik_Bljk_HHS_BH_UserArgs_MT64x64x64_MI16x16x1_SN_LDSB1_CLR1_GSU0_GSUC0_GSUWGMRR0_K1_LBSPPA128_LBSPPB128_MIWT2_2_PLR1_SU32_SUM0_SUS256_SKXCCM6_VWA1_VWB1_WGM4_WGMXCC1_WGMXCCGn1
    SolutionIndex: 90
    SolutionNameMin: Cijk_Alik_Bljk_HHS_BH_UserArgs_MT64x64x64_MI16x16x1_SN_LDSB1_CLR1_GSU0_GSUC0_GSUWGMRR0_K1_LBSPPA256_LBSPPB128_MIWT2_2_PLR1_SU32_SUM0_SUS256_SKXCCM6_VWA2_VWB1_WGM4_WGMXCC1_WGMXCCGn1
    SolutionIndex: 91
    SolutionNameMin: Cijk_Alik_Bljk_HHS_BH_UserArgs_MT64x64x64_MI16x16x1_SN_LDSB1_CLR1_GSU0_GSUC0_GSUWGMRR0_K1_LBSPPA128_LBSPPB128_MIWT2_2_PLR1_SU32_SUM0_SUS256_SKXCCM6_VWA1_VWB1_WGM8_WGMXCC1_WGMXCCGn1
    SolutionIndex: 92
    SolutionNameMin: Cijk_Alik_Bljk_HHS_BH_UserArgs_MT64x64x64_MI16x16x1_SN_LDSB1_CLR1_GSU0_GSUC0_GSUWGMRR0_K1_LBSPPA256_LBSPPB128_MIWT2_2_PLR1_SU32_SUM0_SUS256_SKXCCM6_VWA2_VWB1_WGM8_WGMXCC1_WGMXCCGn1
    SolutionIndex: 93
    SolutionNameMin: Cijk_Alik_Bljk_HHS_BH_UserArgs_MT64x64x64_MI16x16x1_SN_LDSB1_CLR1_GSU0_GSUC0_GSUWGMRR0_K1_LBSPPA256_LBSPPB256_MIWT2_2_PLR1_SU32_SUM0_SUS256_SKXCCM6_VWA2_VWB2_WGM8_WGMXCC1_WGMXCCGn1
    SolutionIndex: 94
    SolutionNameMin: Cijk_Alik_Bljk_HHS_BH_UserArgs_MT64x64x64_MI16x16x1_SN_LDSB1_CLR1_GSU0_GSUC0_GSUWGMRR0_K1_LBSPPA256_LBSPPB128_MIWT2_2_PLR2_SU32_SUM0_SUS256_SKXCCM6_VWA2_VWB1_WGM8_WGMXCC1_WGMXCCGn1
    SolutionIndex: 95
    SolutionNameMin: Cijk_Alik_Bljk_HHS_BH_UserArgs_MT32x64x64_MI16x16x1_SN_LDSB0_CLR1_GSU0_GSUC0_GSUWGMRR0_K1_LBSPPA128_LBSPPB128_MIWT1_2_PLR1_SU32_SUM0_SUS256_SKXCCM6_VWA1_VWB1_WGM1_WGMXCC1_WGMXCCGn1
    SolutionIndex: 96
    SolutionNameMin: Cijk_Alik_Bljk_HHS_BH_UserArgs_MT32x64x64_MI16x16x1_SN_LDSB0_CLR1_GSU0_GSUC0_GSUWGMRR0_K1_LBSPPA128_LBSPPB128_MIWT1_2_PLR1_SU32_SUM0_SUS256_SKXCCM6_VWA1_VWB1_WGM4_WGMXCC1_WGMXCCGn1
    SolutionIndex: 97
    SolutionNameMin: Cijk_Alik_Bljk_HHS_BH_UserArgs_MT32x64x64_MI16x16x1_SN_LDSB0_CLR1_GSU0_GSUC0_GSUWGMRR0_K1_LBSPPA128_LBSPPB128_MIWT1_2_PLR1_SU32_SUM0_SUS256_SKXCCM6_VWA1_VWB1_WGM8_WGMXCC1_WGMXCCGn1
    SolutionIndex: 98
    SolutionNameMin: Cijk_Alik_Bljk_HHS_BH_UserArgs_MT32x32x64_MI16x16x1_SN_LDSB0_CLR1_GSU0_GSUC0_GSUWGMRR0_K1_LBSPPA128_LBSPPB128_MIWT1_1_PLR1_SU32_SUM0_SUS256_SKXCCM6_VWA1_VWB1_WGM1_WGMXCC1_WGMXCCGn1
    SolutionIndex: 99
    SolutionNameMin: Cijk_Alik_Bljk_HHS_BH_UserArgs_MT64x64x128_MI16x16x1_SN_LDSB1_CLR1_GSU0_GSUC0_GSUWGMRR0_K1_LBSPPA512_LBSPPB512_MIWT2_2_PLR1_SU32_SUM0_SUS256_SKXCCM6_VWA2_VWB2_WGM8_WGMXCC1_WGMXCCGn1
    SolutionIndex: 100
    SolutionNameMin: Cijk_Alik_Bljk_HHS_BH_UserArgs_MT32x64x128_MI16x16x1_SN_LDSB1_CLR1_GSU0_GSUC0_GSUWGMRR0_K1_LBSPPA256_LBSPPB256_MIWT1_2_PLR1_SU32_SUM0_SUS256_SKXCCM6_VWA1_VWB1_WGM1_WGMXCC1_WGMXCCGn1
    SolutionIndex: 101
    SolutionNameMin: Cijk_Alik_Bljk_HHS_BH_UserArgs_MT32x64x128_MI16x16x1_SN_LDSB1_CLR1_GSU0_GSUC0_GSUWGMRR0_K1_LBSPPA256_LBSPPB512_MIWT1_2_PLR1_SU32_SUM0_SUS256_SKXCCM6_VWA1_VWB2_WGM4_WGMXCC1_WGMXCCGn1
    SolutionIndex: 102
    SolutionNameMin: Cijk_Alik_Bljk_HHS_BH_UserArgs_MT32x64x128_MI16x16x1_SN_LDSB1_CLR1_GSU0_GSUC0_GSUWGMRR0_K1_LBSPPA256_LBSPPB512_MIWT1_2_PLR1_SU32_SUM0_SUS256_SKXCCM6_VWA1_VWB2_WGM8_WGMXCC1_WGMXCCGn1
    SolutionIndex: 103
    SolutionNameMin: Cijk_Alik_Bljk_HHS_BH_UserArgs_MT64x32x128_MI16x16x1_SN_LDSB1_CLR1_GSU0_GSUC0_GSUWGMRR0_K1_LBSPPA256_LBSPPB256_MIWT2_1_PLR1_SU32_SUM0_SUS256_SKXCCM6_VWA1_VWB1_WGM1_WGMXCC1_WGMXCCGn1
    SolutionIndex: 104
    SolutionNameMin: Cijk_Alik_Bljk_HHS_BH_UserArgs_MT64x32x128_MI16x16x1_SN_LDSB1_CLR1_GSU0_GSUC0_GSUWGMRR0_K1_LBSPPA256_LBSPPB256_MIWT2_1_PLR2_SU32_SUM0_SUS256_SKXCCM6_VWA1_VWB1_WGM8_WGMXCC1_WGMXCCGn1
    SolutionIndex: 105
    SolutionNameMin: Cijk_Alik_Bljk_HHS_BH_UserArgs_MT32x32x128_MI16x16x1_SN_LDSB1_CLR1_GSU0_GSUC0_GSUWGMRR0_K1_LBSPPA256_LBSPPB256_MIWT1_1_PLR1_SU32_SUM0_SUS256_SKXCCM6_VWA1_VWB1_WGM1_WGMXCC1_WGMXCCGn1
    SolutionIndex: 106
    SolutionNameMin: Cijk_Alik_Bljk_HHS_BH_UserArgs_MT32x32x128_MI16x16x1_SN_LDSB1_CLR1_GSU0_GSUC0_GSUWGMRR0_K1_LBSPPA256_LBSPPB256_MIWT1_1_PLR2_SU32_SUM0_SUS256_SKXCCM6_VWA1_VWB1_WGM1_WGMXCC1_WGMXCCGn1
    SolutionIndex: 107
    SolutionNameMin: Cijk_Alik_Bljk_HHS_BH_UserArgs_MT32x32x128_MI16x16x1_SN_LDSB1_CLR1_GSU0_GSUC0_GSUWGMRR0_K1_LBSPPA256_LBSPPB256_MIWT1_1_PLR1_SU32_SUM0_SUS256_SKXCCM6_VWA1_VWB1_WGM4_WGMXCC1_WGMXCCGn1
    SolutionIndex: 108
    SolutionNameMin: Cijk_Alik_Bljk_HHS_BH_UserArgs_MT32x32x32_MI16x16x1_SN_LDSB0_CLR0_GSU0_GSUC0_GSUWGMRR0_K1_LBSPPA128_LBSPPB128_MIWT1_1_PLR0_SU32_SUM0_SUS256_SKXCCM0_VWA1_VWB1_WGM1_WGMXCC1_WGMXCCGn1
- - - [128, 128, 1, 128, 128, 128, 128, 128]
    - [105, 0.092]
  - - [128, 128, 1, 256, 128, 128, 256, 256]
    - [29, 0.114]
  - - [128, 128, 1, 512, 128, 128, 512, 512]
    - [106, 0.194]
  - - [128, 128, 1, 1024, 128, 128, 1024, 1024]
    - [105, 0.289]
  - - [128, 128, 1, 2048, 128, 128, 2048, 2048]
    - [98, 0.371]
  - - [128, 128, 1, 4096, 128, 128, 4096, 4096]
    - [30, 0.727]
  - - [128, 128, 1, 8192, 128, 128, 8192, 8192]
    - [106, 1.373]
  - - [128, 256, 1, 128, 128, 128, 128, 128]
    - [29, 0.179]
  - - [128, 256, 1, 256, 128, 128, 256, 256]
    - [29, 0.23]
  - - [128, 256, 1, 512, 128, 128, 512, 512]
    - [29, 0.384]
  - - [128, 256, 1, 1024, 128, 128, 1024, 1024]
    - [98, 0.573]
  - - [128, 256, 1, 2048, 128, 128, 2048, 2048]
    - [29, 1.093]
  - - [128, 256, 1, 4096, 128, 128, 4096, 4096]
    - [106, 1.935]
  - - [128, 256, 1, 8192, 128, 128, 8192, 8192]
    - [105, 3.3]
  - - [128, 512, 1, 128, 128, 128, 128, 128]
    - [29, 0.356]
  - - [128, 512, 1, 256, 128, 128, 256, 256]
    - [29, 0.446]
  - - [128, 512, 1, 512, 128, 128, 512, 512]
    - [105, 0.739]
  - - [128, 512, 1, 1024, 128, 128, 1024, 1024]
    - [39, 1.307]
  - - [128, 512, 1, 2048, 128, 128, 2048, 2048]
    - [106, 2.471]
  - - [128, 512, 1, 4096, 128, 128, 4096, 4096]
    - [105, 4.05]
  - - [128, 512, 1, 8192, 128, 128, 8192, 8192]
    - [105, 5.82]
  - - [128, 1024, 1, 128, 128, 128, 128, 128]
    - [29, 0.708]
  - - [128, 1024, 1, 256, 128, 128, 256, 256]
    - [30, 0.858]
  - - [128, 1024, 1, 512, 128, 128, 512, 512]
    - [30, 1.579]
  - - [128, 1024, 1, 1024, 128, 128, 1024, 1024]
    - [106, 2.757]
  - - [128, 1024, 1, 2048, 128, 128, 2048, 2048]
    - [105, 4.451]
  - - [128, 1024, 1, 4096, 128, 128, 4096, 4096]
    - [95, 6.557]
  - - [128, 1024, 1, 8192, 128, 128, 8192, 8192]
    - [103, 8.603]
  - - [128, 2048, 1, 128, 128, 128, 128, 128]
    - [27, 1.326]
  - - [128, 2048, 1, 256, 128, 128, 256, 256]
    - [30, 2.238]
  - - [128, 2048, 1, 512, 128, 128, 512, 512]
    - [29, 3.66]
  - - [128, 2048, 1, 1024, 128, 128, 1024, 1024]
    - [29, 5.514]
  - - [128, 2048, 1, 2048, 128, 128, 2048, 2048]
    - [105, 7.216]
  - - [128, 2048, 1, 4096, 128, 128, 4096, 4096]
    - [87, 9.406]
  - - [128, 2048, 1, 8192, 128, 128, 8192, 8192]
    - [17, 10.665]
  - - [128, 4096, 1, 128, 128, 128, 128, 128]
    - [26, 2.345]
  - - [128, 4096, 1, 256, 128, 128, 256, 256]
    - [22, 3.95]
  - - [128, 4096, 1, 512, 128, 128, 512, 512]
    - [95, 6.131]
  - - [128, 4096, 1, 1024, 128, 128, 1024, 1024]
    - [22, 8.572]
  - - [128, 4096, 1, 2048, 128, 128, 2048, 2048]
    - [95, 10.647]
  - - [128, 4096, 1, 4096, 128, 128, 4096, 4096]
    - [72, 11.7]
  - - [128, 4096, 1, 8192, 128, 128, 8192, 8192]
    - [80, 13.337]
  - - [128, 8192, 1, 128, 128, 128, 128, 128]
    - [19, 3.98]
  - - [128, 8192, 1, 256, 128, 128, 256, 256]
    - [18, 6.504]
  - - [128, 8192, 1, 512, 128, 128, 512, 512]
    - [18, 9.824]
  - - [128, 8192, 1, 1024, 128, 128, 1024, 1024]
    - [84, 13.131]
  - - [128, 8192, 1, 2048, 128, 128, 2048, 2048]
    - [89, 12.071]
  - - [128, 8192, 1, 4096, 128, 128, 4096, 4096]
    - [14, 14.415]
  - - [128, 8192, 1, 8192, 128, 128, 8192, 8192]
    - [11, 16.222]
  - - [256, 128, 1, 128, 256, 256, 128, 128]
    - [30, 0.179]
  - - [256, 128, 1, 256, 256, 256, 256, 256]
    - [29, 0.229]
  - - [256, 128, 1, 512, 256, 256, 512, 512]
    - [105, 0.378]
  - - [256, 128, 1, 1024, 256, 256, 1024, 1024]
    - [24, 0.573]
  - - [256, 128, 1, 2048, 256, 256, 2048, 2048]
    - [105, 1.095]
  - - [256, 128, 1, 4096, 256, 256, 4096, 4096]
    - [105, 1.93]
  - - [256, 128, 1, 8192, 256, 256, 8192, 8192]
    - [105, 3.291]
  - - [256, 256, 1, 128, 256, 256, 128, 128]
    - [30, 0.353]
  - - [256, 256, 1, 256, 256, 256, 256, 256]
    - [30, 0.436]
  - - [256, 256, 1, 512, 256, 256, 512, 512]
    - [106, 0.722]
  - - [256, 256, 1, 1024, 256, 256, 1024, 1024]
    - [106, 1.318]
  - - [256, 256, 1, 2048, 256, 256, 2048, 2048]
    - [105, 2.481]
  - - [256, 256, 1, 4096, 256, 256, 4096, 4096]
    - [106, 4.026]
  - - [256, 256, 1, 8192, 256, 256, 8192, 8192]
    - [105, 5.856]
  - - [256, 512, 1, 128, 256, 256, 128, 128]
    - [29, 0.714]
  - - [256, 512, 1, 256, 256, 256, 256, 256]
    - [29, 0.846]
  - - [256, 512, 1, 512, 256, 256, 512, 512]
    - [29, 1.586]
  - - [256, 512, 1, 1024, 256, 256, 1024, 1024]
    - [106, 2.716]
  - - [256, 512, 1, 2048, 256, 256, 2048, 2048]
    - [106, 4.449]
  - - [256, 512, 1, 4096, 256, 256, 4096, 4096]
    - [95, 6.569]
  - - [256, 512, 1, 8192, 256, 256, 8192, 8192]
    - [100, 8.33]
  - - [256, 1024, 1, 128, 256, 256, 128, 128]
    - [27, 1.313]
  - - [256, 1024, 1, 256, 256, 256, 256, 256]
    - [29, 2.257]
  - - [256, 1024, 1, 512, 256, 256, 512, 512]
    - [29, 3.665]
  - - [256, 1024, 1, 1024, 256, 256, 1024, 1024]
    - [29, 5.541]
  - - [256, 1024, 1, 2048, 256, 256, 2048, 2048]
    - [105, 7.209]
  - - [256, 1024, 1, 4096, 256, 256, 4096, 4096]
    - [83, 9.419]
  - - [256, 1024, 1, 8192, 256, 256, 8192, 8192]
    - [85, 10.215]
  - - [256, 2048, 1, 128, 256, 256, 128, 128]
    - [25, 2.327]
  - - [256, 2048, 1, 256, 256, 256, 256, 256]
    - [22, 3.946]
  - - [256, 2048, 1, 512, 256, 256, 512, 512]
    - [20, 6.153]
  - - [256, 2048, 1, 1024, 256, 256, 1024, 1024]
    - [95, 8.492]
  - - [256, 2048, 1, 2048, 256, 256, 2048, 2048]
    - [84, 10.881]
  - - [256, 2048, 1, 4096, 256, 256, 4096, 4096]
    - [77, 11.739]
  - - [256, 2048, 1, 8192, 256, 256, 8192, 8192]
    - [72, 12.365]
  - - [256, 4096, 1, 128, 256, 256, 128, 128]
    - [18, 4.016]
  - - [256, 4096, 1, 256, 256, 256, 256, 256]
    - [18, 6.491]
  - - [256, 4096, 1, 512, 256, 256, 512, 512]
    - [18, 9.901]
  - - [256, 4096, 1, 1024, 256, 256, 1024, 1024]
    - [84, 13.048]
  - - [256, 4096, 1, 2048, 256, 256, 2048, 2048]
    - [88, 13.7]
  - - [256, 4096, 1, 4096, 256, 256, 4096, 4096]
    - [82, 13.456]
  - - [256, 4096, 1, 8192, 256, 256, 8192, 8192]
    - [42, 15.06]
  - - [256, 8192, 1, 128, 256, 256, 128, 128]
    - [11, 6.091]
  - - [256, 8192, 1, 256, 256, 256, 256, 256]
    - [10, 9.531]
  - - [256, 8192, 1, 512, 256, 256, 512, 512]
    - [71, 13.773]
  - - [256, 8192, 1, 1024, 256, 256, 1024, 1024]
    - [71, 16.253]
  - - [256, 8192, 1, 2048, 256, 256, 2048, 2048]
    - [71, 15.709]
  - - [256, 8192, 1, 4096, 256, 256, 4096, 4096]
    - [1, 16.786]
  - - [256, 8192, 1, 8192, 256, 256, 8192, 8192]
    - [53, 17.426]
  - - [512, 128, 1, 128, 512, 512, 128, 128]
    - [29, 0.361]
  - - [512, 128, 1, 256, 512, 512, 256, 256]
    - [29, 0.436]
  - - [512, 128, 1, 512, 512, 512, 512, 512]
    - [106, 0.727]
  - - [512, 128, 1, 1024, 512, 512, 1024, 1024]
    - [106, 1.339]
  - - [512, 128, 1, 2048, 512, 512, 2048, 2048]
    - [105, 2.477]
  - - [512, 128, 1, 4096, 512, 512, 4096, 4096]
    - [106, 4.039]
  - - [512, 128, 1, 8192, 512, 512, 8192, 8192]
    - [107, 5.83]
  - - [512, 256, 1, 128, 512, 512, 128, 128]
    - [29, 0.709]
  - - [512, 256, 1, 256, 512, 512, 256, 256]
    - [29, 0.854]
  - - [512, 256, 1, 512, 512, 512, 512, 512]
    - [30, 1.575]
  - - [512, 256, 1, 1024, 512, 512, 1024, 1024]
    - [106, 2.733]
  - - [512, 256, 1, 2048, 512, 512, 2048, 2048]
    - [105, 4.42]
  - - [512, 256, 1, 4096, 512, 512, 4096, 4096]
    - [97, 6.486]
  - - [512, 256, 1, 8192, 512, 512, 8192, 8192]
    - [104, 8.393]
  - - [512, 512, 1, 128, 512, 512, 128, 128]
    - [27, 1.317]
  - - [512, 512, 1, 256, 512, 512, 256, 256]
    - [30, 2.259]
  - - [512, 512, 1, 512, 512, 512, 512, 512]
    - [29, 3.642]
  - - [512, 512, 1, 1024, 512, 512, 1024, 1024]
    - [29, 5.52]
  - - [512, 512, 1, 2048, 512, 512, 2048, 2048]
    - [105, 7.1]
  - - [512, 512, 1, 4096, 512, 512, 4096, 4096]
    - [18, 9.693]
  - - [512, 512, 1, 8192, 512, 512, 8192, 8192]
    - [89, 9.98]
  - - [512, 1024, 1, 128, 512, 512, 128, 128]
    - [26, 2.278]
  - - [512, 1024, 1, 256, 512, 512, 256, 256]
    - [22, 3.989]
  - - [512, 1024, 1, 512, 512, 512, 512, 512]
    - [20, 6.226]
  - - [512, 1024, 1, 1024, 512, 512, 1024, 1024]
    - [21, 8.654]
  - - [512, 1024, 1, 2048, 512, 512, 2048, 2048]
    - [84, 10.866]
  - - [512, 1024, 1, 4096, 512, 512, 4096, 4096]
    - [88, 12.03]
  - - [512, 1024, 1, 8192, 512, 512, 8192, 8192]
    - [72, 12.357]
  - - [512, 2048, 1, 128, 512, 512, 128, 128]
    - [18, 3.978]
  - - [512, 2048, 1, 256, 512, 512, 256, 256]
    - [18, 6.491]
  - - [512, 2048, 1, 512, 512, 512, 512, 512]
    - [19, 9.92]
  - - [512, 2048, 1, 1024, 512, 512, 1024, 1024]
    - [84, 13.126]
  - - [512, 2048, 1, 2048, 512, 512, 2048, 2048]
    - [86, 14.61]
  - - [512, 2048, 1, 4096, 512, 512, 4096, 4096]
    - [66, 12.974]
  - - [512, 2048, 1, 8192, 512, 512, 8192, 8192]
    - [46, 15.204]
  - - [512, 4096, 1, 128, 512, 512, 128, 128]
    - [7, 5.99]
  - - [512, 4096, 1, 256, 512, 512, 256, 256]
    - [6, 9.279]
  - - [512, 4096, 1, 512, 512, 512, 512, 512]
    - [71, 13.703]
  - - [512, 4096, 1, 1024, 512, 512, 1024, 1024]
    - [71, 17.163]
  - - [512, 4096, 1, 2048, 512, 512, 2048, 2048]
    - [73, 16.619]
  - - [512, 4096, 1, 4096, 512, 512, 4096, 4096]
    - [59, 16.154]
  - - [512, 4096, 1, 8192, 512, 512, 8192, 8192]
    - [42, 16.577]
  - - [512, 8192, 1, 128, 512, 512, 128, 128]
    - [73, 7.692]
  - - [512, 8192, 1, 256, 512, 512, 256, 256]
    - [33, 11.598]
  - - [512, 8192, 1, 512, 512, 512, 512, 512]
    - [41, 15.335]
  - - [512, 8192, 1, 1024, 512, 512, 1024, 1024]
    - [49, 16.074]
  - - [512, 8192, 1, 2048, 512, 512, 2048, 2048]
    - [41, 18.736]
  - - [512, 8192, 1, 4096, 512, 512, 4096, 4096]
    - [56, 16.954]
  - - [512, 8192, 1, 8192, 512, 512, 8192, 8192]
    - [5, 18.528]
  - - [1024, 128, 1, 128, 1024, 1024, 128, 128]
    - [29, 0.709]
  - - [1024, 128, 1, 256, 1024, 1024, 256, 256]
    - [30, 0.844]
  - - [1024, 128, 1, 512, 1024, 1024, 512, 512]
    - [30, 1.585]
  - - [1024, 128, 1, 1024, 1024, 1024, 1024, 1024]
    - [105, 2.738]
  - - [1024, 128, 1, 2048, 1024, 1024, 2048, 2048]
    - [105, 4.425]
  - - [1024, 128, 1, 4096, 1024, 1024, 4096, 4096]
    - [95, 6.525]
  - - [1024, 128, 1, 8192, 1024, 1024, 8192, 8192]
    - [102, 8.456]
  - - [1024, 256, 1, 128, 1024, 1024, 128, 128]
    - [28, 1.313]
  - - [1024, 256, 1, 256, 1024, 1024, 256, 256]
    - [30, 2.249]
  - - [1024, 256, 1, 512, 1024, 1024, 512, 512]
    - [29, 3.641]
  - - [1024, 256, 1, 1024, 1024, 1024, 1024, 1024]
    - [29, 5.503]
  - - [1024, 256, 1, 2048, 1024, 1024, 2048, 2048]
    - [107, 7.061]
  - - [1024, 256, 1, 4096, 1024, 1024, 4096, 4096]
    - [89, 9.358]
  - - [1024, 256, 1, 8192, 1024, 1024, 8192, 8192]
    - [94, 10.04]
  - - [1024, 512, 1, 128, 1024, 1024, 128, 128]
    - [22, 2.311]
  - - [1024, 512, 1, 256, 1024, 1024, 256, 256]
    - [22, 3.962]
  - - [1024, 512, 1, 512, 1024, 1024, 512, 512]
    - [20, 6.179]
  - - [1024, 512, 1, 1024, 1024, 1024, 1024, 1024]
    - [20, 8.616]
  - - [1024, 512, 1, 2048, 1024, 1024, 2048, 2048]
    - [90, 10.901]
  - - [1024, 512, 1, 4096, 1024, 1024, 4096, 4096]
    - [93, 11.927]
  - - [1024, 512, 1, 8192, 1024, 1024, 8192, 8192]
    - [99, 12.111]
  - - [1024, 1024, 1, 128, 1024, 1024, 128, 128]
    - [19, 3.966]
  - - [1024, 1024, 1, 256, 1024, 1024, 256, 256]
    - [19, 6.437]
  - - [1024, 1024, 1, 512, 1024, 1024, 512, 512]
    - [19, 9.977]
  - - [1024, 1024, 1, 1024, 1024, 1024, 1024, 1024]
    - [84, 13.13]
  - - [1024, 1024, 1, 2048, 1024, 1024, 2048, 2048]
    - [94, 13.95]
  - - [1024, 1024, 1, 4096, 1024, 1024, 4096, 4096]
    - [62, 13.402]
  - - [1024, 1024, 1, 8192, 1024, 1024, 8192, 8192]
    - [53, 15.176]
  - - [1024, 2048, 1, 128, 1024, 1024, 128, 128]
    - [12, 6.062]
  - - [1024, 2048, 1, 256, 1024, 1024, 256, 256]
    - [10, 9.453]
  - - [1024, 2048, 1, 512, 1024, 1024, 512, 512]
    - [71, 13.704]
  - - [1024, 2048, 1, 1024, 1024, 1024, 1024, 1024]
    - [71, 16.995]
  - - [1024, 2048, 1, 2048, 1024, 1024, 2048, 2048]
    - [78, 16.847]
  - - [1024, 2048, 1, 4096, 1024, 1024, 4096, 4096]
    - [42, 17.046]
  - - [1024, 2048, 1, 8192, 1024, 1024, 8192, 8192]
    - [45, 17.457]
  - - [1024, 4096, 1, 128, 1024, 1024, 128, 128]
    - [38, 7.752]
  - - [1024, 4096, 1, 256, 1024, 1024, 256, 256]
    - [32, 11.666]
  - - [1024, 4096, 1, 512, 1024, 1024, 512, 512]
    - [44, 15.39]
  - - [1024, 4096, 1, 1024, 1024, 1024, 1024, 1024]
    - [48, 16.063]
  - - [1024, 4096, 1, 2048, 1024, 1024, 2048, 2048]
    - [47, 18.229]
  - - [1024, 4096, 1, 4096, 1024, 1024, 4096, 4096]
    - [47, 17.393]
  - - [1024, 4096, 1, 8192, 1024, 1024, 8192, 8192]
    - [43, 18.349]
  - - [1024, 8192, 1, 128, 1024, 1024, 128, 128]
    - [77, 7.596]
  - - [1024, 8192, 1, 256, 1024, 1024, 256, 256]
    - [71, 11.27]
  - - [1024, 8192, 1, 512, 1024, 1024, 512, 512]
    - [71, 13.763]
  - - [1024, 8192, 1, 1024, 1024, 1024, 1024, 1024]
    - [72, 16.716]
  - - [1024, 8192, 1, 2048, 1024, 1024, 2048, 2048]
    - [47, 16.908]
  - - [1024, 8192, 1, 4096, 1024, 1024, 4096, 4096]
    - [41, 18.827]
  - - [1024, 8192, 1, 8192, 1024, 1024, 8192, 8192]
    - [42, 18.039]
  - - [2048, 128, 1, 128, 2048, 2048, 128, 128]
    - [28, 1.316]
  - - [2048, 128, 1, 256, 2048, 2048, 256, 256]
    - [30, 2.277]
  - - [2048, 128, 1, 512, 2048, 2048, 512, 512]
    - [29, 3.632]
  - - [2048, 128, 1, 1024, 2048, 2048, 1024, 1024]
    - [31, 5.299]
  - - [2048, 128, 1, 2048, 2048, 2048, 2048, 2048]
    - [107, 7.049]
  - - [2048, 128, 1, 4096, 2048, 2048, 4096, 4096]
    - [101, 9.347]
  - - [2048, 128, 1, 8192, 2048, 2048, 8192, 8192]
    - [8, 10.237]
  - - [2048, 256, 1, 128, 2048, 2048, 128, 128]
    - [26, 2.33]
  - - [2048, 256, 1, 256, 2048, 2048, 256, 256]
    - [23, 3.965]
  - - [2048, 256, 1, 512, 2048, 2048, 512, 512]
    - [20, 6.22]
  - - [2048, 256, 1, 1024, 2048, 2048, 1024, 1024]
    - [96, 8.355]
  - - [2048, 256, 1, 2048, 2048, 2048, 2048, 2048]
    - [90, 10.78]
  - - [2048, 256, 1, 4096, 2048, 2048, 4096, 4096]
    - [68, 11.409]
  - - [2048, 256, 1, 8192, 2048, 2048, 8192, 8192]
    - [63, 12.478]
  - - [2048, 512, 1, 128, 2048, 2048, 128, 128]
    - [18, 3.995]
  - - [2048, 512, 1, 256, 2048, 2048, 256, 256]
    - [19, 6.459]
  - - [2048, 512, 1, 512, 2048, 2048, 512, 512]
    - [18, 9.92]
  - - [2048, 512, 1, 1024, 2048, 2048, 1024, 1024]
    - [90, 12.988]
  - - [2048, 512, 1, 2048, 2048, 2048, 2048, 2048]
    - [93, 14.598]
  - - [2048, 512, 1, 4096, 2048, 2048, 4096, 4096]
    - [82, 13.289]
  - - [2048, 512, 1, 8192, 2048, 2048, 8192, 8192]
    - [55, 15.335]
  - - [2048, 1024, 1, 128, 2048, 2048, 128, 128]
    - [10, 6.094]
  - - [2048, 1024, 1, 256, 2048, 2048, 256, 256]
    - [12, 9.448]
  - - [2048, 1024, 1, 512, 2048, 2048, 512, 512]
    - [61, 13.612]
  - - [2048, 1024, 1, 1024, 2048, 2048, 1024, 1024]
    - [64, 15.807]
  - - [2048, 1024, 1, 2048, 2048, 2048, 2048, 2048]
    - [67, 15.833]
  - - [2048, 1024, 1, 4096, 2048, 2048, 4096, 4096]
    - [58, 17.033]
  - - [2048, 1024, 1, 8192, 2048, 2048, 8192, 8192]
    - [55, 17.171]
  - - [2048, 2048, 1, 128, 2048, 2048, 128, 128]
    - [16, 7.73]
  - - [2048, 2048, 1, 256, 2048, 2048, 256, 256]
    - [33, 11.561]
  - - [2048, 2048, 1, 512, 2048, 2048, 512, 512]
    - [3, 15.301]
  - - [2048, 2048, 1, 1024, 2048, 2048, 1024, 1024]
    - [55, 16.114]
  - - [2048, 2048, 1, 2048, 2048, 2048, 2048, 2048]
    - [59, 18.548]
  - - [2048, 2048, 1, 4096, 2048, 2048, 4096, 4096]
    - [42, 18.408]
  - - [2048, 2048, 1, 8192, 2048, 2048, 8192, 8192]
    - [40, 19.394]
  - - [2048, 4096, 1, 128, 2048, 2048, 128, 128]
    - [74, 7.665]
  - - [2048, 4096, 1, 256, 2048, 2048, 256, 256]
    - [74, 11.268]
  - - [2048, 4096, 1, 512, 2048, 2048, 512, 512]
    - [71, 13.609]
  - - [2048, 4096, 1, 1024, 2048, 2048, 1024, 1024]
    - [42, 16.08]
  - - [2048, 4096, 1, 2048, 2048, 2048, 2048, 2048]
    - [44, 17.557]
  - - [2048, 4096, 1, 4096, 2048, 2048, 4096, 4096]
    - [45, 18.851]
  - - [2048, 4096, 1, 8192, 2048, 2048, 8192, 8192]
    - [46, 18.911]
  - - [2048, 8192, 1, 128, 2048, 2048, 128, 128]
    - [73, 9.351]
  - - [2048, 8192, 1, 256, 2048, 2048, 256, 256]
    - [73, 12.011]
  - - [2048, 8192, 1, 512, 2048, 2048, 512, 512]
    - [72, 14.704]
  - - [2048, 8192, 1, 1024, 2048, 2048, 1024, 1024]
    - [56, 16.947]
  - - [2048, 8192, 1, 2048, 2048, 2048, 2048, 2048]
    - [47, 18.622]
  - - [2048, 8192, 1, 4096, 2048, 2048, 4096, 4096]
    - [45, 20.379]
  - - [2048, 8192, 1, 8192, 2048, 2048, 8192, 8192]
    - [52, 20.92]
  - - [4096, 128, 1, 128, 4096, 4096, 128, 128]
    - [26, 2.313]
  - - [4096, 128, 1, 256, 4096, 4096, 256, 256]
    - [22, 3.927]
  - - [4096, 128, 1, 512, 4096, 4096, 512, 512]
    - [20, 6.19]
  - - [4096, 128, 1, 1024, 4096, 4096, 1024, 1024]
    - [97, 8.386]
  - - [4096, 128, 1, 2048, 4096, 4096, 2048, 2048]
    - [91, 10.338]
  - - [4096, 128, 1, 4096, 4096, 4096, 4096, 4096]
    - [68, 11.336]
  - - [4096, 128, 1, 8192, 4096, 4096, 8192, 8192]
    - [9, 12.527]
  - - [4096, 256, 1, 128, 4096, 4096, 128, 128]
    - [18, 4.017]
  - - [4096, 256, 1, 256, 4096, 4096, 256, 256]
    - [18, 6.484]
  - - [4096, 256, 1, 512, 4096, 4096, 512, 512]
    - [84, 9.757]
  - - [4096, 256, 1, 1024, 4096, 4096, 1024, 1024]
    - [90, 12.959]
  - - [4096, 256, 1, 2048, 4096, 4096, 2048, 2048]
    - [90, 14.112]
  - - [4096, 256, 1, 4096, 4096, 4096, 4096, 4096]
    - [62, 13.455]
  - - [4096, 256, 1, 8192, 4096, 4096, 8192, 8192]
    - [42, 15.574]
  - - [4096, 512, 1, 128, 4096, 4096, 128, 128]
    - [11, 6.127]
  - - [4096, 512, 1, 256, 4096, 4096, 256, 256]
    - [6, 9.455]
  - - [4096, 512, 1, 512, 4096, 4096, 512, 512]
    - [78, 13.484]
  - - [4096, 512, 1, 1024, 4096, 4096, 1024, 1024]
    - [65, 16.128]
  - - [4096, 512, 1, 2048, 4096, 4096, 2048, 2048]
    - [69, 16.356]
  - - [4096, 512, 1, 4096, 4096, 4096, 4096, 4096]
    - [47, 16.182]
  - - [4096, 512, 1, 8192, 4096, 4096, 8192, 8192]
    - [50, 16.777]
  - - [4096, 1024, 1, 128, 4096, 4096, 128, 128]
    - [36, 7.756]
  - - [4096, 1024, 1, 256, 4096, 4096, 256, 256]
    - [0, 10.987]
  - - [4096, 1024, 1, 512, 4096, 4096, 512, 512]
    - [2, 14.861]
  - - [4096, 1024, 1, 1024, 4096, 4096, 1024, 1024]
    - [60, 16.159]
  - - [4096, 1024, 1, 2048, 4096, 4096, 2048, 2048]
    - [57, 18.309]
  - - [4096, 1024, 1, 4096, 4096, 4096, 4096, 4096]
    - [56, 17.542]
  - - [4096, 1024, 1, 8192, 4096, 4096, 8192, 8192]
    - [56, 18.355]
  - - [4096, 2048, 1, 128, 4096, 4096, 128, 128]
    - [76, 7.82]
  - - [4096, 2048, 1, 256, 4096, 4096, 256, 256]
    - [75, 10.809]
  - - [4096, 2048, 1, 512, 4096, 4096, 512, 512]
    - [81, 13.345]
  - - [4096, 2048, 1, 1024, 4096, 4096, 1024, 1024]
    - [47, 16.058]
  - - [4096, 2048, 1, 2048, 4096, 4096, 2048, 2048]
    - [45, 18.058]
  - - [4096, 2048, 1, 4096, 4096, 4096, 4096, 4096]
    - [42, 19.818]
  - - [4096, 2048, 1, 8192, 4096, 4096, 8192, 8192]
    - [44, 20.949]
  - - [4096, 4096, 1, 128, 4096, 4096, 128, 128]
    - [76, 9.419]
  - - [4096, 4096, 1, 256, 4096, 4096, 256, 256]
    - [81, 11.567]
  - - [4096, 4096, 1, 512, 4096, 4096, 512, 512]
    - [55, 14.353]
  - - [4096, 4096, 1, 1024, 4096, 4096, 1024, 1024]
    - [55, 17.094]
  - - [4096, 4096, 1, 2048, 4096, 4096, 2048, 2048]
    - [53, 18.457]
  - - [4096, 4096, 1, 4096, 4096, 4096, 4096, 4096]
    - [56, 20.68]
  - - [4096, 4096, 1, 8192, 4096, 4096, 8192, 8192]
    - [46, 22.568]
  - - [4096, 8192, 1, 128, 4096, 4096, 128, 128]
    - [11, 9.192]
  - - [4096, 8192, 1, 256, 4096, 4096, 256, 256]
    - [73, 11.532]
  - - [4096, 8192, 1, 512, 4096, 4096, 512, 512]
    - [52, 14.741]
  - - [4096, 8192, 1, 1024, 4096, 4096, 1024, 1024]
    - [55, 18.124]
  - - [4096, 8192, 1, 2048, 4096, 4096, 2048, 2048]
    - [51, 19.524]
  - - [4096, 8192, 1, 4096, 4096, 4096, 4096, 4096]
    - [52, 22.244]
  - - [4096, 8192, 1, 8192, 4096, 4096, 8192, 8192]
    - [51, 23.388]
  - - [8192, 128, 1, 128, 8192, 8192, 128, 128]
    - [18, 4.018]
  - - [8192, 128, 1, 256, 8192, 8192, 256, 256]
    - [18, 6.52]
  - - [8192, 128, 1, 512, 8192, 8192, 512, 512]
    - [84, 9.685]
  - - [8192, 128, 1, 1024, 8192, 8192, 1024, 1024]
    - [92, 12.763]
  - - [8192, 128, 1, 2048, 8192, 8192, 2048, 2048]
    - [94, 12.436]
  - - [8192, 128, 1, 4096, 8192, 8192, 4096, 4096]
    - [8, 14.301]
  - - [8192, 128, 1, 8192, 8192, 8192, 8192, 8192]
    - [3, 15.918]
  - - [8192, 256, 1, 128, 8192, 8192, 128, 128]
    - [15, 6.001]
  - - [8192, 256, 1, 256, 8192, 8192, 256, 256]
    - [78, 9.154]
  - - [8192, 256, 1, 512, 8192, 8192, 512, 512]
    - [78, 13.5]
  - - [8192, 256, 1, 1024, 8192, 8192, 1024, 1024]
    - [64, 15.713]
  - - [8192, 256, 1, 2048, 8192, 8192, 2048, 2048]
    - [69, 15.811]
  - - [8192, 256, 1, 4096, 8192, 8192, 4096, 4096]
    - [45, 16.95]
  - - [8192, 256, 1, 8192, 8192, 8192, 8192, 8192]
    - [42, 18.321]
  - - [8192, 512, 1, 128, 8192, 8192, 128, 128]
    - [7, 7.665]
  - - [8192, 512, 1, 256, 8192, 8192, 256, 256]
    - [35, 11.171]
  - - [8192, 512, 1, 512, 8192, 8192, 512, 512]
    - [54, 14.763]
  - - [8192, 512, 1, 1024, 8192, 8192, 1024, 1024]
    - [2, 16.027]
  - - [8192, 512, 1, 2048, 8192, 8192, 2048, 2048]
    - [53, 17.827]
  - - [8192, 512, 1, 4096, 8192, 8192, 4096, 4096]
    - [42, 17.71]
  - - [8192, 512, 1, 8192, 8192, 8192, 8192, 8192]
    - [42, 18.085]
  - - [8192, 1024, 1, 128, 8192, 8192, 128, 128]
    - [79, 7.387]
  - - [8192, 1024, 1, 256, 8192, 8192, 256, 256]
    - [70, 10.707]
  - - [8192, 1024, 1, 512, 8192, 8192, 512, 512]
    - [81, 13.645]
  - - [8192, 1024, 1, 1024, 8192, 8192, 1024, 1024]
    - [55, 16.536]
  - - [8192, 1024, 1, 2048, 8192, 8192, 2048, 2048]
    - [45, 16.871]
  - - [8192, 1024, 1, 4096, 8192, 8192, 4096, 4096]
    - [45, 17.973]
  - - [8192, 1024, 1, 8192, 8192, 8192, 8192, 8192]
    - [47, 20.0]
  - - [8192, 2048, 1, 128, 8192, 8192, 128, 128]
    - [81, 8.846]
  - - [8192, 2048, 1, 256, 8192, 8192, 256, 256]
    - [81, 11.409]
  - - [8192, 2048, 1, 512, 8192, 8192, 512, 512]
    - [55, 14.111]
  - - [8192, 2048, 1, 1024, 8192, 8192, 1024, 1024]
    - [59, 17.269]
  - - [8192, 2048, 1, 2048, 8192, 8192, 2048, 2048]
    - [56, 19.022]
  - - [8192, 2048, 1, 4096, 8192, 8192, 4096, 4096]
    - [3, 20.403]
  - - [8192, 2048, 1, 8192, 8192, 8192, 8192, 8192]
    - [4, 21.395]
  - - [8192, 4096, 1, 128, 8192, 8192, 128, 128]
    - [13, 9.05]
  - - [8192, 4096, 1, 256, 8192, 8192, 256, 256]
    - [34, 11.142]
  - - [8192, 4096, 1, 512, 8192, 8192, 512, 512]
    - [49, 14.881]
  - - [8192, 4096, 1, 1024, 8192, 8192, 1024, 1024]
    - [55, 18.299]
  - - [8192, 4096, 1, 2048, 8192, 8192, 2048, 2048]
    - [50, 19.658]
  - - [8192, 4096, 1, 4096, 8192, 8192, 4096, 4096]
    - [50, 22.217]
  - - [8192, 4096, 1, 8192, 8192, 8192, 8192, 8192]
    - [50, 23.639]
  - - [8192, 8192, 1, 128, 8192, 8192, 128, 128]
    - [37, 7.744]
  - - [8192, 8192, 1, 256, 8192, 8192, 256, 256]
    - [55, 10.957]
  - - [8192, 8192, 1, 512, 8192, 8192, 512, 512]
    - [55, 15.706]
  - - [8192, 8192, 1, 1024, 8192, 8192, 1024, 1024]
    - [54, 19.185]
  - - [8192, 8192, 1, 2048, 8192, 8192, 2048, 2048]
    - [59, 20.834]
  - - [8192, 8192, 1, 4096, 8192, 8192, 4096, 4096]
    - [52, 24.436]
  - - [8192, 8192, 1, 8192, 8192, 8192, 8192, 8192]
    - [56, 22.866]
  - - [1, 1, 1, 32, 1, 1, 32, 32]
    - [108, 0.0]
- null
- null
- DeviceEfficiency
- GridBased
