library/src/amd_detail/rocblaslt/src/Tensile/Logic/streamk/gfx942a/aquavanjaram942_Cijk_Alik_Bjlk_BBS_BH_UserArgs.yaml
- {MinimumRequiredVersion: 4.33.0}
- aquavanjaram942
- gfx942
- [Device 0049, Device 0050]
    SolutionIndex: 0
    SolutionNameMin: Cijk_Alik_Bjlk_BBS_BH_UserArgs_MT256x256x32_MI16x16x1_SN_LDSB1_CLR1_GSU0_GSUC0_GSUWGMRR0_K1_LBSPPA512_LBSPPB2048_LPB0_MIWT8_8_PLR1_SU32_SUM0_SUS256_SKXCCM0_VWA8_VWB4_WGM1_WGMXCC1_WGMXCCGn1
    SolutionIndex: 1
    SolutionNameMin: Cijk_Alik_Bjlk_BBS_BH_UserArgs_MT256x256x32_MI16x16x1_SN_LDSB1_CLR1_GSU0_GSUC0_GSUWGMRR0_K1_LBSPPA256_LBSPPB2048_LPB0_MIWT8_8_PLR1_SU32_SUM0_SUS256_SKXCCM0_VWA4_VWB8_WGM1_WGMXCC1_WGMXCCGn1
    SolutionIndex: 2
    SolutionNameMin: Cijk_Alik_Bjlk_BBS_BH_UserArgs_MT256x256x32_MI16x16x1_SN_LDSB1_CLR1_GSU0_GSUC0_GSUWGMRR0_K1_LBSPPA256_LBSPPB2048_LPB0_MIWT8_8_PLR1_SU32_SUM0_SUS256_SKXCCM0_VWA4_VWB4_WGM4_WGMXCC1_WGMXCCGn1
    SolutionIndex: 3
    SolutionNameMin: Cijk_Alik_Bjlk_BBS_BH_UserArgs_MT256x256x32_MI16x16x1_SN_LDSB1_CLR1_GSU0_GSUC0_GSUWGMRR0_K1_LBSPPA512_LBSPPB2048_LPB0_MIWT8_8_PLR1_SU32_SUM0_SUS256_SKXCCM0_VWA8_VWB8_WGM4_WGMXCC1_WGMXCCGn1
    SolutionIndex: 4
    SolutionNameMin: Cijk_Alik_Bjlk_BBS_BH_UserArgs_MT128x256x32_MI16x16x1_SN_LDSB1_CLR1_GSU0_GSUC0_GSUWGMRR0_K1_LBSPPA128_LBSPPB2048_LPB0_MIWT4_8_PLR1_SU32_SUM0_SUS256_SKXCCM0_VWA2_VWB8_WGM4_WGMXCC1_WGMXCCGn1
    SolutionIndex: 5
    SolutionNameMin: Cijk_Alik_Bjlk_BBS_BH_UserArgs_MT128x256x32_MI16x16x1_SN_LDSB1_CLR1_GSU0_GSUC0_GSUWGMRR0_K1_LBSPPA256_LBSPPB2048_LPB0_MIWT4_8_PLR1_SU32_SUM0_SUS256_SKXCCM0_VWA4_VWB8_WGM8_WGMXCC1_WGMXCCGn1
    SolutionIndex: 6
    SolutionNameMin: Cijk_Alik_Bjlk_BBS_BH_UserArgs_MT256x128x32_MI16x16x1_SN_LDSB1_CLR1_GSU0_GSUC0_GSUWGMRR0_K1_LBSPPA256_LBSPPB1024_LPB32_MIWT8_4_PLR1_SU32_SUM0_SUS256_SKXCCM0_VWA4_VWB2_WGM1_WGMXCC1_WGMXCCGn1
    SolutionIndex: 7
    SolutionNameMin: Cijk_Alik_Bjlk_BBS_BH_UserArgs_MT128x128x32_MI16x16x1_SN_LDSB1_CLR1_GSU0_GSUC0_GSUWGMRR0_K1_LBSPPA128_LBSPPB1024_LPB0_MIWT4_4_PLR1_SU32_SUM0_SUS256_SKXCCM0_VWA2_VWB4_WGM1_WGMXCC1_WGMXCCGn1
    SolutionIndex: 8
    SolutionNameMin: Cijk_Alik_Bjlk_BBS_BH_UserArgs_MT128x128x32_MI16x16x1_SN_LDSB1_CLR1_GSU0_GSUC0_GSUWGMRR0_K1_LBSPPA256_LBSPPB1024_LPB0_MIWT4_4_PLR1_SU32_SUM0_SUS256_SKXCCM0_VWA4_VWB4_WGM1_WGMXCC1_WGMXCCGn1
    SolutionIndex: 9
    SolutionNameMin: Cijk_Alik_Bjlk_BBS_BH_UserArgs_MT128x128x32_MI16x16x1_SN_LDSB1_CLR1_GSU0_GSUC0_GSUWGMRR0_K1_LBSPPA128_LBSPPB1024_LPB0_MIWT4_4_PLR1_SU32_SUM0_SUS256_SKXCCM0_VWA2_VWB4_WGM4_WGMXCC1_WGMXCCGn1
    SolutionIndex: 10
    SolutionNameMin: Cijk_Alik_Bjlk_BBS_BH_UserArgs_MT64x128x32_MI16x16x1_SN_LDSB0_CLR1_GSU0_GSUC0_GSUWGMRR0_K1_LBSPPA128_LBSPPB1024_LPB0_MIWT2_4_PLR1_SU32_SUM0_SUS256_SKXCCM0_VWA2_VWB4_WGM1_WGMXCC1_WGMXCCGn1
    SolutionIndex: 11
    SolutionNameMin: Cijk_Alik_Bjlk_BBS_BH_UserArgs_MT128x64x32_MI16x16x1_SN_LDSB0_CLR1_GSU0_GSUC0_GSUWGMRR0_K1_LBSPPA256_LBSPPB512_LPB32_MIWT4_2_PLR1_SU32_SUM0_SUS256_SKXCCM0_VWA4_VWB2_WGM1_WGMXCC1_WGMXCCGn1
    SolutionIndex: 12
    SolutionNameMin: Cijk_Alik_Bjlk_BBS_BH_UserArgs_MT64x64x32_MI16x16x1_SN_LDSB0_CLR1_GSU0_GSUC0_GSUWGMRR0_K1_LBSPPA128_LBSPPB512_LPB32_MIWT2_2_PLR1_SU32_SUM0_SUS256_SKXCCM0_VWA2_VWB2_WGM1_WGMXCC1_WGMXCCGn1
    SolutionIndex: 13
    SolutionNameMin: Cijk_Alik_Bjlk_BBS_BH_UserArgs_MT256x128x64_MI16x16x1_SN_LDSB1_CLR1_GSU0_GSUC0_GSUWGMRR0_K1_LBSPPA512_LBSPPB2048_LPB0_MIWT8_4_PLR1_SU32_SUM0_SUS256_SKXCCM0_VWA4_VWB4_WGM4_WGMXCC1_WGMXCCGn1
    SolutionIndex: 14
    SolutionNameMin: Cijk_Alik_Bjlk_BBS_BH_UserArgs_MT64x128x64_MI16x16x1_SN_LDSB1_CLR1_GSU0_GSUC0_GSUWGMRR0_K1_LBSPPA256_LBSPPB2048_LPB0_MIWT2_4_PLR1_SU32_SUM0_SUS256_SKXCCM0_VWA2_VWB4_WGM1_WGMXCC1_WGMXCCGn1
    SolutionIndex: 15
    SolutionNameMin: Cijk_Alik_Bjlk_BBS_BH_UserArgs_MT64x128x64_MI16x16x1_SN_LDSB1_CLR1_GSU0_GSUC0_GSUWGMRR0_K1_LBSPPA256_LBSPPB2048_LPB0_MIWT2_4_PLR1_SU32_SUM0_SUS256_SKXCCM0_VWA2_VWB4_WGM8_WGMXCC1_WGMXCCGn1
    SolutionIndex: 16
    SolutionNameMin: Cijk_Alik_Bjlk_BBS_BH_UserArgs_MT128x64x64_MI16x16x1_SN_LDSB1_CLR1_GSU0_GSUC0_GSUWGMRR0_K1_LBSPPA256_LBSPPB1024_LPB32_MIWT4_2_PLR1_SU32_SUM0_SUS256_SKXCCM0_VWA2_VWB2_WGM1_WGMXCC1_WGMXCCGn1
    SolutionIndex: 17
    SolutionNameMin: Cijk_Alik_Bjlk_BBS_BH_UserArgs_MT128x64x64_MI16x16x1_SN_LDSB1_CLR1_GSU0_GSUC0_GSUWGMRR0_K1_LBSPPA512_LBSPPB1024_LPB32_MIWT4_2_PLR2_SU32_SUM0_SUS256_SKXCCM0_VWA4_VWB2_WGM1_WGMXCC1_WGMXCCGn1
    SolutionIndex: 18
    SolutionNameMin: Cijk_Alik_Bjlk_BBS_BH_UserArgs_MT128x64x64_MI16x16x1_SN_LDSB1_CLR1_GSU0_GSUC0_GSUWGMRR0_K1_LBSPPA256_LBSPPB1024_LPB32_MIWT4_2_PLR1_SU32_SUM0_SUS256_SKXCCM0_VWA2_VWB2_WGM4_WGMXCC1_WGMXCCGn1
    SolutionIndex: 19
    SolutionNameMin: Cijk_Alik_Bjlk_BBS_BH_UserArgs_MT128x64x64_MI16x16x1_SN_LDSB1_CLR1_GSU0_GSUC0_GSUWGMRR0_K1_LBSPPA512_LBSPPB1024_LPB32_MIWT4_2_PLR1_SU32_SUM0_SUS256_SKXCCM0_VWA4_VWB2_WGM8_WGMXCC1_WGMXCCGn1
    SolutionIndex: 20
    SolutionNameMin: Cijk_Alik_Bjlk_BBS_BH_UserArgs_MT64x64x64_MI16x16x1_SN_LDSB1_CLR1_GSU0_GSUC0_GSUWGMRR0_K1_LBSPPA256_LBSPPB1024_LPB32_MIWT2_2_PLR1_SU32_SUM0_SUS256_SKXCCM0_VWA2_VWB2_WGM1_WGMXCC1_WGMXCCGn1
    SolutionIndex: 21
    SolutionNameMin: Cijk_Alik_Bjlk_BBS_BH_UserArgs_MT64x64x64_MI16x16x1_SN_LDSB1_CLR1_GSU0_GSUC0_GSUWGMRR0_K1_LBSPPA256_LBSPPB1024_LPB32_MIWT2_2_PLR1_SU32_SUM0_SUS256_SKXCCM0_VWA2_VWB2_WGM8_WGMXCC1_WGMXCCGn1
    SolutionIndex: 22
    SolutionNameMin: Cijk_Alik_Bjlk_BBS_BH_UserArgs_MT32x64x64_MI16x16x1_SN_LDSB0_CLR1_GSU0_GSUC0_GSUWGMRR0_K1_LBSPPA128_LBSPPB1024_LPB32_MIWT1_2_PLR1_SU32_SUM0_SUS256_SKXCCM0_VWA1_VWB2_WGM1_WGMXCC1_WGMXCCGn1
    SolutionIndex: 23
    SolutionNameMin: Cijk_Alik_Bjlk_BBS_BH_UserArgs_MT64x32x64_MI16x16x1_SN_LDSB0_CLR1_GSU0_GSUC0_GSUWGMRR0_K1_LBSPPA256_LBSPPB512_LPB16_MIWT2_1_PLR1_SU32_SUM0_SUS256_SKXCCM0_VWA2_VWB1_WGM1_WGMXCC1_WGMXCCGn1
    SolutionIndex: 24
    SolutionNameMin: Cijk_Alik_Bjlk_BBS_BH_UserArgs_MT64x64x128_MI16x16x1_SN_LDSB1_CLR1_GSU0_GSUC0_GSUWGMRR0_K1_LBSPPA512_LBSPPB1024_LPB32_MIWT2_2_PLR2_SU32_SUM0_SUS256_SKXCCM0_VWA2_VWB2_WGM1_WGMXCC1_WGMXCCGn1
    SolutionIndex: 25
    SolutionNameMin: Cijk_Alik_Bjlk_BBS_BH_UserArgs_MT32x64x128_MI16x16x1_SN_LDSB1_CLR1_GSU0_GSUC0_GSUWGMRR0_K1_LBSPPA256_LBSPPB1024_LPB32_MIWT1_2_PLR2_SU32_SUM0_SUS256_SKXCCM0_VWA1_VWB2_WGM1_WGMXCC1_WGMXCCGn1
    SolutionIndex: 26
    SolutionNameMin: Cijk_Alik_Bjlk_BBS_BH_UserArgs_MT32x64x128_MI16x16x1_SN_LDSB1_CLR1_GSU0_GSUC0_GSUWGMRR0_K1_LBSPPA256_LBSPPB1024_LPB32_MIWT1_2_PLR2_SU32_SUM0_SUS256_SKXCCM0_VWA1_VWB2_WGM4_WGMXCC1_WGMXCCGn1
    SolutionIndex: 27
    SolutionNameMin: Cijk_Alik_Bjlk_BBS_BH_UserArgs_MT64x32x128_MI16x16x1_SN_LDSB1_CLR1_GSU0_GSUC0_GSUWGMRR0_K1_LBSPPA512_LBSPPB512_LPB16_MIWT2_1_PLR2_SU32_SUM0_SUS256_SKXCCM0_VWA2_VWB1_WGM1_WGMXCC1_WGMXCCGn1
    SolutionIndex: 28
    SolutionNameMin: Cijk_Alik_Bjlk_BBS_BH_UserArgs_MT32x32x128_MI16x16x1_SN_LDSB1_CLR1_GSU0_GSUC0_GSUWGMRR0_K1_LBSPPA256_LBSPPB512_LPB16_MIWT1_1_PLR1_SU32_SUM0_SUS256_SKXCCM0_VWA1_VWB1_WGM1_WGMXCC1_WGMXCCGn1
    SolutionIndex: 29
    SolutionNameMin: Cijk_Alik_Bjlk_BBS_BH_UserArgs_MT32x32x128_MI16x16x1_SN_LDSB1_CLR1_GSU0_GSUC0_GSUWGMRR0_K1_LBSPPA256_LBSPPB512_LPB16_MIWT1_1_PLR2_SU32_SUM0_SUS256_SKXCCM0_VWA1_VWB1_WGM1_WGMXCC1_WGMXCCGn1
    SolutionIndex: 30
    SolutionNameMin: Cijk_Alik_Bjlk_BBS_BH_UserArgs_MT256x256x32_MI16x16x1_SN_LDSB1_CLR1_GSU0_GSUC0_GSUWGMRR0_K1_LBSPPA256_LBSPPB2048_LPB0_MIWT8_8_PLR1_SU32_SUM0_SUS256_SKXCCM6_VWA4_VWB4_WGM1_WGMXCC1_WGMXCCGn1
    SolutionIndex: 31
    SolutionNameMin: Cijk_Alik_Bjlk_BBS_BH_UserArgs_MT256x256x32_MI16x16x1_SN_LDSB1_CLR1_GSU0_GSUC0_GSUWGMRR0_K1_LBSPPA256_LBSPPB2048_LPB0_MIWT8_8_PLR1_SU32_SUM0_SUS256_SKXCCM6_VWA4_VWB8_WGM1_WGMXCC1_WGMXCCGn1
    SolutionIndex: 32
    SolutionNameMin: Cijk_Alik_Bjlk_BBS_BH_UserArgs_MT256x256x32_MI16x16x1_SN_LDSB1_CLR1_GSU0_GSUC0_GSUWGMRR0_K1_LBSPPA512_LBSPPB2048_LPB0_MIWT8_8_PLR1_SU32_SUM0_SUS256_SKXCCM6_VWA8_VWB8_WGM1_WGMXCC1_WGMXCCGn1
    SolutionIndex: 33
    SolutionNameMin: Cijk_Alik_Bjlk_BBS_BH_UserArgs_MT256x256x32_MI16x16x1_SN_LDSB1_CLR1_GSU0_GSUC0_GSUWGMRR0_K1_LBSPPA256_LBSPPB2048_LPB0_MIWT8_8_PLR1_SU32_SUM0_SUS256_SKXCCM6_VWA4_VWB8_WGM4_WGMXCC1_WGMXCCGn1
    SolutionIndex: 34
    SolutionNameMin: Cijk_Alik_Bjlk_BBS_BH_UserArgs_MT256x256x32_MI16x16x1_SN_LDSB1_CLR1_GSU0_GSUC0_GSUWGMRR0_K1_LBSPPA512_LBSPPB2048_LPB0_MIWT8_8_PLR1_SU32_SUM0_SUS256_SKXCCM6_VWA8_VWB8_WGM4_WGMXCC1_WGMXCCGn1
    SolutionIndex: 35
    SolutionNameMin: Cijk_Alik_Bjlk_BBS_BH_UserArgs_MT256x256x32_MI16x16x1_SN_LDSB1_CLR1_GSU0_GSUC0_GSUWGMRR0_K1_LBSPPA128_LBSPPB2048_LPB0_MIWT8_8_PLR1_SU32_SUM0_SUS256_SKXCCM6_VWA2_VWB4_WGM8_WGMXCC1_WGMXCCGn1
    SolutionIndex: 36
    SolutionNameMin: Cijk_Alik_Bjlk_BBS_BH_UserArgs_MT256x256x32_MI16x16x1_SN_LDSB1_CLR1_GSU0_GSUC0_GSUWGMRR0_K1_LBSPPA256_LBSPPB2048_LPB0_MIWT8_8_PLR1_SU32_SUM0_SUS256_SKXCCM6_VWA4_VWB4_WGM8_WGMXCC1_WGMXCCGn1
    SolutionIndex: 37
    SolutionNameMin: Cijk_Alik_Bjlk_BBS_BH_UserArgs_MT256x256x32_MI16x16x1_SN_LDSB1_CLR1_GSU0_GSUC0_GSUWGMRR0_K1_LBSPPA512_LBSPPB2048_LPB0_MIWT8_8_PLR1_SU32_SUM0_SUS256_SKXCCM6_VWA8_VWB4_WGM8_WGMXCC1_WGMXCCGn1
    SolutionIndex: 38
    SolutionNameMin: Cijk_Alik_Bjlk_BBS_BH_UserArgs_MT256x256x32_MI16x16x1_SN_LDSB1_CLR1_GSU0_GSUC0_GSUWGMRR0_K1_LBSPPA128_LBSPPB2048_LPB0_MIWT8_8_PLR1_SU32_SUM0_SUS256_SKXCCM6_VWA2_VWB8_WGM8_WGMXCC1_WGMXCCGn1
    SolutionIndex: 39
    SolutionNameMin: Cijk_Alik_Bjlk_BBS_BH_UserArgs_MT256x256x32_MI16x16x1_SN_LDSB1_CLR1_GSU0_GSUC0_GSUWGMRR0_K1_LBSPPA256_LBSPPB2048_LPB0_MIWT8_8_PLR1_SU32_SUM0_SUS256_SKXCCM6_VWA4_VWB8_WGM8_WGMXCC1_WGMXCCGn1
    SolutionIndex: 40
    SolutionNameMin: Cijk_Alik_Bjlk_BBS_BH_UserArgs_MT128x256x32_MI16x16x1_SN_LDSB1_CLR1_GSU0_GSUC0_GSUWGMRR0_K1_LBSPPA128_LBSPPB2048_LPB0_MIWT4_8_PLR1_SU32_SUM0_SUS256_SKXCCM6_VWA2_VWB4_WGM1_WGMXCC1_WGMXCCGn1
    SolutionIndex: 41
    SolutionNameMin: Cijk_Alik_Bjlk_BBS_BH_UserArgs_MT128x256x32_MI16x16x1_SN_LDSB1_CLR1_GSU0_GSUC0_GSUWGMRR0_K1_LBSPPA256_LBSPPB2048_LPB0_MIWT4_8_PLR1_SU32_SUM0_SUS256_SKXCCM6_VWA4_VWB4_WGM1_WGMXCC1_WGMXCCGn1
    SolutionIndex: 42
    SolutionNameMin: Cijk_Alik_Bjlk_BBS_BH_UserArgs_MT128x256x32_MI16x16x1_SN_LDSB1_CLR1_GSU0_GSUC0_GSUWGMRR0_K1_LBSPPA128_LBSPPB2048_LPB0_MIWT4_8_PLR1_SU32_SUM0_SUS256_SKXCCM6_VWA1_VWB8_WGM1_WGMXCC1_WGMXCCGn1
    SolutionIndex: 43
    SolutionNameMin: Cijk_Alik_Bjlk_BBS_BH_UserArgs_MT128x256x32_MI16x16x1_SN_LDSB1_CLR1_GSU0_GSUC0_GSUWGMRR0_K1_LBSPPA128_LBSPPB2048_LPB0_MIWT4_8_PLR1_SU32_SUM0_SUS256_SKXCCM6_VWA2_VWB8_WGM1_WGMXCC1_WGMXCCGn1
    SolutionIndex: 44
    SolutionNameMin: Cijk_Alik_Bjlk_BBS_BH_UserArgs_MT128x256x32_MI16x16x1_SN_LDSB1_CLR1_GSU0_GSUC0_GSUWGMRR0_K1_LBSPPA256_LBSPPB2048_LPB0_MIWT4_8_PLR1_SU32_SUM0_SUS256_SKXCCM6_VWA4_VWB8_WGM1_WGMXCC1_WGMXCCGn1
    SolutionIndex: 45
    SolutionNameMin: Cijk_Alik_Bjlk_BBS_BH_UserArgs_MT128x256x32_MI16x16x1_SN_LDSB1_CLR1_GSU0_GSUC0_GSUWGMRR0_K1_LBSPPA256_LBSPPB2048_LPB32_MIWT4_8_PLR1_SU32_SUM0_SUS256_SKXCCM6_VWA4_VWB2_WGM4_WGMXCC1_WGMXCCGn1
    SolutionIndex: 46
    SolutionNameMin: Cijk_Alik_Bjlk_BBS_BH_UserArgs_MT128x256x32_MI16x16x1_SN_LDSB1_CLR1_GSU0_GSUC0_GSUWGMRR0_K1_LBSPPA128_LBSPPB2048_LPB0_MIWT4_8_PLR1_SU32_SUM0_SUS256_SKXCCM6_VWA2_VWB4_WGM4_WGMXCC1_WGMXCCGn1
    SolutionIndex: 47
    SolutionNameMin: Cijk_Alik_Bjlk_BBS_BH_UserArgs_MT128x256x32_MI16x16x1_SN_LDSB1_CLR1_GSU0_GSUC0_GSUWGMRR0_K1_LBSPPA256_LBSPPB2048_LPB0_MIWT4_8_PLR1_SU32_SUM0_SUS256_SKXCCM6_VWA4_VWB4_WGM4_WGMXCC1_WGMXCCGn1
    SolutionIndex: 48
    SolutionNameMin: Cijk_Alik_Bjlk_BBS_BH_UserArgs_MT128x256x32_MI16x16x1_SN_LDSB1_CLR1_GSU0_GSUC0_GSUWGMRR0_K1_LBSPPA128_LBSPPB2048_LPB0_MIWT4_8_PLR1_SU32_SUM0_SUS256_SKXCCM6_VWA2_VWB8_WGM4_WGMXCC1_WGMXCCGn1
    SolutionIndex: 49
    SolutionNameMin: Cijk_Alik_Bjlk_BBS_BH_UserArgs_MT128x256x32_MI16x16x1_SN_LDSB1_CLR1_GSU0_GSUC0_GSUWGMRR0_K1_LBSPPA256_LBSPPB2048_LPB0_MIWT4_8_PLR1_SU32_SUM0_SUS256_SKXCCM6_VWA4_VWB8_WGM4_WGMXCC1_WGMXCCGn1
    SolutionIndex: 50
    SolutionNameMin: Cijk_Alik_Bjlk_BBS_BH_UserArgs_MT128x256x32_MI16x16x1_SN_LDSB1_CLR1_GSU0_GSUC0_GSUWGMRR0_K1_LBSPPA256_LBSPPB2048_LPB0_MIWT4_8_PLR1_SU32_SUM0_SUS256_SKXCCM6_VWA4_VWB4_WGM8_WGMXCC1_WGMXCCGn1
    SolutionIndex: 51
    SolutionNameMin: Cijk_Alik_Bjlk_BBS_BH_UserArgs_MT128x256x32_MI16x16x1_SN_LDSB1_CLR1_GSU0_GSUC0_GSUWGMRR0_K1_LBSPPA256_LBSPPB2048_LPB0_MIWT4_8_PLR1_SU32_SUM0_SUS256_SKXCCM6_VWA4_VWB8_WGM8_WGMXCC1_WGMXCCGn1
    SolutionIndex: 52
    SolutionNameMin: Cijk_Alik_Bjlk_BBS_BH_UserArgs_MT256x128x32_MI16x16x1_SN_LDSB1_CLR1_GSU0_GSUC0_GSUWGMRR0_K1_LBSPPA256_LBSPPB1024_LPB32_MIWT8_4_PLR1_SU32_SUM0_SUS256_SKXCCM6_VWA4_VWB2_WGM4_WGMXCC1_WGMXCCGn1
    SolutionIndex: 53
    SolutionNameMin: Cijk_Alik_Bjlk_BBS_BH_UserArgs_MT256x128x32_MI16x16x1_SN_LDSB1_CLR1_GSU0_GSUC0_GSUWGMRR0_K1_LBSPPA256_LBSPPB1024_LPB32_MIWT8_4_PLR1_SU32_SUM0_SUS256_SKXCCM6_VWA4_VWB2_WGM8_WGMXCC1_WGMXCCGn1
    SolutionIndex: 54
    SolutionNameMin: Cijk_Alik_Bjlk_BBS_BH_UserArgs_MT256x128x32_MI16x16x1_SN_LDSB1_CLR1_GSU0_GSUC0_GSUWGMRR0_K1_LBSPPA512_LBSPPB1024_LPB32_MIWT8_4_PLR1_SU32_SUM0_SUS256_SKXCCM6_VWA8_VWB2_WGM8_WGMXCC1_WGMXCCGn1
    SolutionIndex: 55
    SolutionNameMin: Cijk_Alik_Bjlk_BBS_BH_UserArgs_MT256x128x32_MI16x16x1_SN_LDSB1_CLR1_GSU0_GSUC0_GSUWGMRR0_K1_LBSPPA512_LBSPPB1024_LPB0_MIWT8_4_PLR1_SU32_SUM0_SUS256_SKXCCM6_VWA8_VWB4_WGM8_WGMXCC1_WGMXCCGn1
    SolutionIndex: 56
    SolutionNameMin: Cijk_Alik_Bjlk_BBS_BH_UserArgs_MT64x256x32_MI16x16x1_SN_LDSB1_CLR1_GSU0_GSUC0_GSUWGMRR0_K1_LBSPPA128_LBSPPB2048_LPB0_MIWT2_8_PLR1_SU32_SUM0_SUS256_SKXCCM6_VWA2_VWB4_WGM8_WGMXCC1_WGMXCCGn1
    SolutionIndex: 57
    SolutionNameMin: Cijk_Alik_Bjlk_BBS_BH_UserArgs_MT128x128x32_MI16x16x1_SN_LDSB1_CLR1_GSU0_GSUC0_GSUWGMRR0_K1_LBSPPA128_LBSPPB1024_LPB16_MIWT4_4_PLR1_SU32_SUM0_SUS256_SKXCCM6_VWA2_VWB1_WGM1_WGMXCC1_WGMXCCGn1
    SolutionIndex: 58
    SolutionNameMin: Cijk_Alik_Bjlk_BBS_BH_UserArgs_MT128x128x32_MI16x16x1_SN_LDSB1_CLR1_GSU0_GSUC0_GSUWGMRR0_K1_LBSPPA128_LBSPPB1024_LPB0_MIWT4_4_PLR1_SU32_SUM0_SUS256_SKXCCM6_VWA2_VWB4_WGM1_WGMXCC1_WGMXCCGn1
    SolutionIndex: 59
    SolutionNameMin: Cijk_Alik_Bjlk_BBS_BH_UserArgs_MT128x128x32_MI16x16x1_SN_LDSB1_CLR1_GSU0_GSUC0_GSUWGMRR0_K1_LBSPPA128_LBSPPB1024_LPB0_MIWT4_4_PLR1_SU32_SUM0_SUS256_SKXCCM6_VWA2_VWB4_WGM4_WGMXCC1_WGMXCCGn1
    SolutionIndex: 60
    SolutionNameMin: Cijk_Alik_Bjlk_BBS_BH_UserArgs_MT128x128x32_MI16x16x1_SN_LDSB1_CLR1_GSU0_GSUC0_GSUWGMRR0_K1_LBSPPA128_LBSPPB1024_LPB16_MIWT4_4_PLR1_SU32_SUM0_SUS256_SKXCCM6_VWA2_VWB1_WGM8_WGMXCC1_WGMXCCGn1
    SolutionIndex: 61
    SolutionNameMin: Cijk_Alik_Bjlk_BBS_BH_UserArgs_MT128x128x32_MI16x16x1_SN_LDSB1_CLR1_GSU0_GSUC0_GSUWGMRR0_K1_LBSPPA128_LBSPPB1024_LPB32_MIWT4_4_PLR1_SU32_SUM0_SUS256_SKXCCM6_VWA2_VWB2_WGM8_WGMXCC1_WGMXCCGn1
    SolutionIndex: 62
    SolutionNameMin: Cijk_Alik_Bjlk_BBS_BH_UserArgs_MT128x128x32_MI16x16x1_SN_LDSB1_CLR1_GSU0_GSUC0_GSUWGMRR0_K1_LBSPPA128_LBSPPB1024_LPB0_MIWT4_4_PLR1_SU32_SUM0_SUS256_SKXCCM6_VWA2_VWB4_WGM8_WGMXCC1_WGMXCCGn1
    SolutionIndex: 63
    SolutionNameMin: Cijk_Alik_Bjlk_BBS_BH_UserArgs_MT64x128x32_MI16x16x1_SN_LDSB0_CLR1_GSU0_GSUC0_GSUWGMRR0_K1_LBSPPA128_LBSPPB1024_LPB0_MIWT2_4_PLR1_SU32_SUM0_SUS256_SKXCCM6_VWA1_VWB4_WGM1_WGMXCC1_WGMXCCGn1
    SolutionIndex: 64
    SolutionNameMin: Cijk_Alik_Bjlk_BBS_BH_UserArgs_MT64x128x32_MI16x16x1_SN_LDSB0_CLR0_GSU0_GSUC0_GSUWGMRR0_K1_LBSPPA128_LBSPPB1024_LPB32_MIWT2_4_PLR0_SU32_SUM0_SUS256_SKXCCM6_VWA2_VWB2_WGM8_WGMXCC1_WGMXCCGn1
    SolutionIndex: 65
    SolutionNameMin: Cijk_Alik_Bjlk_BBS_BH_UserArgs_MT32x32x32_MI16x16x1_SN_LDSB0_CLR1_GSU0_GSUC0_GSUWGMRR0_K1_LBSPPA128_LBSPPB256_LPB16_MIWT1_1_PLR1_SU32_SUM0_SUS256_SKXCCM6_VWA1_VWB1_WGM1_WGMXCC1_WGMXCCGn1
    SolutionIndex: 66
    SolutionNameMin: Cijk_Alik_Bjlk_BBS_BH_UserArgs_MT32x32x32_MI16x16x1_SN_LDSB0_CLR0_GSU0_GSUC0_GSUWGMRR0_K1_LBSPPA128_LBSPPB256_LPB16_MIWT1_1_PLR0_SU32_SUM0_SUS256_SKXCCM6_VWA1_VWB1_WGM1_WGMXCC1_WGMXCCGn1
    SolutionIndex: 67
    SolutionNameMin: Cijk_Alik_Bjlk_BBS_BH_UserArgs_MT128x256x64_MI16x16x1_SN_LDSB1_CLR1_GSU0_GSUC0_GSUWGMRR0_K1_LBSPPA256_LBSPPB4096_LPB0_MIWT4_8_PLR1_SU32_SUM0_SUS256_SKXCCM6_VWA2_VWB4_WGM1_WGMXCC1_WGMXCCGn1
    SolutionIndex: 68
    SolutionNameMin: Cijk_Alik_Bjlk_BBS_BH_UserArgs_MT128x256x64_MI16x16x1_SN_LDSB1_CLR1_GSU0_GSUC0_GSUWGMRR0_K1_LBSPPA512_LBSPPB4096_LPB0_MIWT4_8_PLR1_SU32_SUM0_SUS256_SKXCCM6_VWA4_VWB4_WGM1_WGMXCC1_WGMXCCGn1
    SolutionIndex: 69
    SolutionNameMin: Cijk_Alik_Bjlk_BBS_BH_UserArgs_MT128x256x64_MI16x16x1_SN_LDSB1_CLR1_GSU0_GSUC0_GSUWGMRR0_K1_LBSPPA512_LBSPPB4096_LPB0_MIWT4_8_PLR1_SU32_SUM0_SUS256_SKXCCM6_VWA4_VWB4_WGM4_WGMXCC1_WGMXCCGn1
    SolutionIndex: 70
    SolutionNameMin: Cijk_Alik_Bjlk_BBS_BH_UserArgs_MT128x256x64_MI16x16x1_SN_LDSB1_CLR1_GSU0_GSUC0_GSUWGMRR0_K1_LBSPPA512_LBSPPB4096_LPB32_MIWT4_8_PLR1_SU32_SUM0_SUS256_SKXCCM6_VWA4_VWB2_WGM8_WGMXCC1_WGMXCCGn1
    SolutionIndex: 71
    SolutionNameMin: Cijk_Alik_Bjlk_BBS_BH_UserArgs_MT128x256x64_MI16x16x1_SN_LDSB1_CLR1_GSU0_GSUC0_GSUWGMRR0_K1_LBSPPA256_LBSPPB4096_LPB0_MIWT4_8_PLR1_SU32_SUM0_SUS256_SKXCCM6_VWA2_VWB4_WGM8_WGMXCC1_WGMXCCGn1
    SolutionIndex: 72
    SolutionNameMin: Cijk_Alik_Bjlk_BBS_BH_UserArgs_MT128x256x64_MI16x16x1_SN_LDSB1_CLR1_GSU0_GSUC0_GSUWGMRR0_K1_LBSPPA512_LBSPPB4096_LPB0_MIWT4_8_PLR1_SU32_SUM0_SUS256_SKXCCM6_VWA4_VWB4_WGM8_WGMXCC1_WGMXCCGn1
    SolutionIndex: 73
    SolutionNameMin: Cijk_Alik_Bjlk_BBS_BH_UserArgs_MT256x128x64_MI16x16x1_SN_LDSB1_CLR1_GSU0_GSUC0_GSUWGMRR0_K1_LBSPPA256_LBSPPB2048_LPB0_MIWT8_4_PLR1_SU32_SUM0_SUS256_SKXCCM6_VWA2_VWB4_WGM1_WGMXCC1_WGMXCCGn1
    SolutionIndex: 74
    SolutionNameMin: Cijk_Alik_Bjlk_BBS_BH_UserArgs_MT256x128x64_MI16x16x1_SN_LDSB1_CLR1_GSU0_GSUC0_GSUWGMRR0_K1_LBSPPA512_LBSPPB2048_LPB0_MIWT8_4_PLR1_SU32_SUM0_SUS256_SKXCCM6_VWA4_VWB4_WGM1_WGMXCC1_WGMXCCGn1
    SolutionIndex: 75
    SolutionNameMin: Cijk_Alik_Bjlk_BBS_BH_UserArgs_MT256x128x64_MI16x16x1_SN_LDSB1_CLR1_GSU0_GSUC0_GSUWGMRR0_K1_LBSPPA256_LBSPPB2048_LPB0_MIWT8_4_PLR1_SU32_SUM0_SUS256_SKXCCM6_VWA2_VWB4_WGM8_WGMXCC1_WGMXCCGn1
    SolutionIndex: 76
    SolutionNameMin: Cijk_Alik_Bjlk_BBS_BH_UserArgs_MT256x128x64_MI16x16x1_SN_LDSB1_CLR1_GSU0_GSUC0_GSUWGMRR0_K1_LBSPPA512_LBSPPB2048_LPB0_MIWT8_4_PLR1_SU32_SUM0_SUS256_SKXCCM6_VWA4_VWB4_WGM8_WGMXCC1_WGMXCCGn1
    SolutionIndex: 77
    SolutionNameMin: Cijk_Alik_Bjlk_BBS_BH_UserArgs_MT128x128x64_MI16x16x1_SN_LDSB1_CLR1_GSU0_GSUC0_GSUWGMRR0_K1_LBSPPA128_LBSPPB2048_LPB0_MIWT4_4_PLR1_SU32_SUM0_SUS256_SKXCCM6_VWA1_VWB4_WGM1_WGMXCC1_WGMXCCGn1
    SolutionIndex: 78
    SolutionNameMin: Cijk_Alik_Bjlk_BBS_BH_UserArgs_MT128x128x64_MI16x16x1_SN_LDSB1_CLR1_GSU0_GSUC0_GSUWGMRR0_K1_LBSPPA512_LBSPPB2048_LPB0_MIWT4_4_PLR1_SU32_SUM0_SUS256_SKXCCM6_VWA4_VWB4_WGM1_WGMXCC1_WGMXCCGn1
    SolutionIndex: 79
    SolutionNameMin: Cijk_Alik_Bjlk_BBS_BH_UserArgs_MT128x128x64_MI16x16x1_SN_LDSB1_CLR1_GSU0_GSUC0_GSUWGMRR0_K1_LBSPPA512_LBSPPB2048_LPB0_MIWT4_4_PLR1_SU32_SUM0_SUS256_SKXCCM6_VWA4_VWB4_WGM4_WGMXCC1_WGMXCCGn1
    SolutionIndex: 80
    SolutionNameMin: Cijk_Alik_Bjlk_BBS_BH_UserArgs_MT128x128x64_MI16x16x1_SN_LDSB1_CLR1_GSU0_GSUC0_GSUWGMRR0_K1_LBSPPA128_LBSPPB2048_LPB0_MIWT4_4_PLR1_SU32_SUM0_SUS256_SKXCCM6_VWA1_VWB4_WGM8_WGMXCC1_WGMXCCGn1
    SolutionIndex: 81
    SolutionNameMin: Cijk_Alik_Bjlk_BBS_BH_UserArgs_MT128x128x64_MI16x16x1_SN_LDSB1_CLR1_GSU0_GSUC0_GSUWGMRR0_K1_LBSPPA256_LBSPPB2048_LPB0_MIWT4_4_PLR1_SU32_SUM0_SUS256_SKXCCM6_VWA2_VWB4_WGM8_WGMXCC1_WGMXCCGn1
    SolutionIndex: 82
    SolutionNameMin: Cijk_Alik_Bjlk_BBS_BH_UserArgs_MT128x128x64_MI16x16x1_SN_LDSB1_CLR1_GSU0_GSUC0_GSUWGMRR0_K1_LBSPPA512_LBSPPB2048_LPB0_MIWT4_4_PLR1_SU32_SUM0_SUS256_SKXCCM6_VWA4_VWB4_WGM8_WGMXCC1_WGMXCCGn1
    SolutionIndex: 83
    SolutionNameMin: Cijk_Alik_Bjlk_BBS_BH_UserArgs_MT64x128x64_MI16x16x1_SN_LDSB1_CLR1_GSU0_GSUC0_GSUWGMRR0_K1_LBSPPA256_LBSPPB2048_LPB0_MIWT2_4_PLR1_SU32_SUM0_SUS256_SKXCCM6_VWA2_VWB4_WGM1_WGMXCC1_WGMXCCGn1
    SolutionIndex: 84
    SolutionNameMin: Cijk_Alik_Bjlk_BBS_BH_UserArgs_MT64x128x64_MI16x16x1_SN_LDSB1_CLR1_GSU0_GSUC0_GSUWGMRR0_K1_LBSPPA128_LBSPPB2048_LPB0_MIWT2_4_PLR1_SU32_SUM0_SUS256_SKXCCM6_VWA1_VWB4_WGM4_WGMXCC1_WGMXCCGn1
    SolutionIndex: 85
    SolutionNameMin: Cijk_Alik_Bjlk_BBS_BH_UserArgs_MT64x128x64_MI16x16x1_SN_LDSB1_CLR1_GSU0_GSUC0_GSUWGMRR0_K1_LBSPPA256_LBSPPB2048_LPB0_MIWT2_4_PLR1_SU32_SUM0_SUS256_SKXCCM6_VWA2_VWB4_WGM4_WGMXCC1_WGMXCCGn1
    SolutionIndex: 86
    SolutionNameMin: Cijk_Alik_Bjlk_BBS_BH_UserArgs_MT64x128x64_MI16x16x1_SN_LDSB1_CLR1_GSU0_GSUC0_GSUWGMRR0_K1_LBSPPA128_LBSPPB2048_LPB0_MIWT2_4_PLR1_SU32_SUM0_SUS256_SKXCCM6_VWA1_VWB4_WGM8_WGMXCC1_WGMXCCGn1
    SolutionIndex: 87
    SolutionNameMin: Cijk_Alik_Bjlk_BBS_BH_UserArgs_MT64x128x64_MI16x16x1_SN_LDSB1_CLR1_GSU0_GSUC0_GSUWGMRR0_K1_LBSPPA256_LBSPPB2048_LPB0_MIWT2_4_PLR1_SU32_SUM0_SUS256_SKXCCM6_VWA2_VWB4_WGM8_WGMXCC1_WGMXCCGn1
    SolutionIndex: 88
    SolutionNameMin: Cijk_Alik_Bjlk_BBS_BH_UserArgs_MT128x64x64_MI16x16x1_SN_LDSB1_CLR1_GSU0_GSUC0_GSUWGMRR0_K1_LBSPPA256_LBSPPB1024_LPB32_MIWT4_2_PLR1_SU32_SUM0_SUS256_SKXCCM6_VWA2_VWB2_WGM1_WGMXCC1_WGMXCCGn1
    SolutionIndex: 89
    SolutionNameMin: Cijk_Alik_Bjlk_BBS_BH_UserArgs_MT128x64x64_MI16x16x1_SN_LDSB1_CLR1_GSU0_GSUC0_GSUWGMRR0_K1_LBSPPA512_LBSPPB1024_LPB32_MIWT4_2_PLR1_SU32_SUM0_SUS256_SKXCCM6_VWA4_VWB2_WGM1_WGMXCC1_WGMXCCGn1
    SolutionIndex: 90
    SolutionNameMin: Cijk_Alik_Bjlk_BBS_BH_UserArgs_MT128x64x64_MI16x16x1_SN_LDSB1_CLR1_GSU0_GSUC0_GSUWGMRR0_K1_LBSPPA512_LBSPPB1024_LPB32_MIWT4_2_PLR2_SU32_SUM0_SUS256_SKXCCM6_VWA4_VWB2_WGM1_WGMXCC1_WGMXCCGn1
    SolutionIndex: 91
    SolutionNameMin: Cijk_Alik_Bjlk_BBS_BH_UserArgs_MT128x64x64_MI16x16x1_SN_LDSB1_CLR1_GSU0_GSUC0_GSUWGMRR0_K1_LBSPPA512_LBSPPB1024_LPB32_MIWT4_2_PLR1_SU32_SUM0_SUS256_SKXCCM6_VWA4_VWB2_WGM4_WGMXCC1_WGMXCCGn1
    SolutionIndex: 92
    SolutionNameMin: Cijk_Alik_Bjlk_BBS_BH_UserArgs_MT128x64x64_MI16x16x1_SN_LDSB1_CLR1_GSU0_GSUC0_GSUWGMRR0_K1_LBSPPA256_LBSPPB1024_LPB32_MIWT4_2_PLR1_SU32_SUM0_SUS256_SKXCCM6_VWA2_VWB2_WGM8_WGMXCC1_WGMXCCGn1
    SolutionIndex: 93
    SolutionNameMin: Cijk_Alik_Bjlk_BBS_BH_UserArgs_MT128x64x64_MI16x16x1_SN_LDSB1_CLR1_GSU0_GSUC0_GSUWGMRR0_K1_LBSPPA512_LBSPPB1024_LPB32_MIWT4_2_PLR1_SU32_SUM0_SUS256_SKXCCM6_VWA4_VWB2_WGM8_WGMXCC1_WGMXCCGn1
    SolutionIndex: 94
    SolutionNameMin: Cijk_Alik_Bjlk_BBS_BH_UserArgs_MT128x64x64_MI16x16x1_SN_LDSB1_CLR1_GSU0_GSUC0_GSUWGMRR0_K1_LBSPPA512_LBSPPB1024_LPB32_MIWT4_2_PLR2_SU32_SUM0_SUS256_SKXCCM6_VWA4_VWB2_WGM8_WGMXCC1_WGMXCCGn1
    SolutionIndex: 95
    SolutionNameMin: Cijk_Alik_Bjlk_BBS_BH_UserArgs_MT64x64x64_MI16x16x1_SN_LDSB1_CLR1_GSU0_GSUC0_GSUWGMRR0_K1_LBSPPA128_LBSPPB1024_LPB32_MIWT2_2_PLR1_SU32_SUM0_SUS256_SKXCCM6_VWA1_VWB2_WGM1_WGMXCC1_WGMXCCGn1
    SolutionIndex: 96
    SolutionNameMin: Cijk_Alik_Bjlk_BBS_BH_UserArgs_MT64x64x64_MI16x16x1_SN_LDSB1_CLR1_GSU0_GSUC0_GSUWGMRR0_K1_LBSPPA256_LBSPPB1024_LPB32_MIWT2_2_PLR1_SU32_SUM0_SUS256_SKXCCM6_VWA2_VWB2_WGM1_WGMXCC1_WGMXCCGn1
    SolutionIndex: 97
    SolutionNameMin: Cijk_Alik_Bjlk_BBS_BH_UserArgs_MT64x64x64_MI16x16x1_SN_LDSB1_CLR1_GSU0_GSUC0_GSUWGMRR0_K1_LBSPPA256_LBSPPB1024_LPB32_MIWT2_2_PLR1_SU32_SUM0_SUS256_SKXCCM6_VWA2_VWB2_WGM4_WGMXCC1_WGMXCCGn1
    SolutionIndex: 98
    SolutionNameMin: Cijk_Alik_Bjlk_BBS_BH_UserArgs_MT64x64x64_MI16x16x1_SN_LDSB1_CLR1_GSU0_GSUC0_GSUWGMRR0_K1_LBSPPA256_LBSPPB1024_LPB32_MIWT2_2_PLR2_SU32_SUM0_SUS256_SKXCCM6_VWA2_VWB2_WGM4_WGMXCC1_WGMXCCGn1
    SolutionIndex: 99
    SolutionNameMin: Cijk_Alik_Bjlk_BBS_BH_UserArgs_MT64x64x64_MI16x16x1_SN_LDSB1_CLR1_GSU0_GSUC0_GSUWGMRR0_K1_LBSPPA128_LBSPPB1024_LPB32_MIWT2_2_PLR1_SU32_SUM0_SUS256_SKXCCM6_VWA1_VWB2_WGM8_WGMXCC1_WGMXCCGn1
    SolutionIndex: 100
    SolutionNameMin: Cijk_Alik_Bjlk_BBS_BH_UserArgs_MT64x64x64_MI16x16x1_SN_LDSB1_CLR1_GSU0_GSUC0_GSUWGMRR0_K1_LBSPPA256_LBSPPB1024_LPB32_MIWT2_2_PLR1_SU32_SUM0_SUS256_SKXCCM6_VWA2_VWB2_WGM8_WGMXCC1_WGMXCCGn1
    SolutionIndex: 101
    SolutionNameMin: Cijk_Alik_Bjlk_BBS_BH_UserArgs_MT32x32x64_MI16x16x1_SN_LDSB0_CLR1_GSU0_GSUC0_GSUWGMRR0_K1_LBSPPA128_LBSPPB512_LPB16_MIWT1_1_PLR1_SU32_SUM0_SUS256_SKXCCM6_VWA1_VWB1_WGM1_WGMXCC1_WGMXCCGn1
    SolutionIndex: 102
    SolutionNameMin: Cijk_Alik_Bjlk_BBS_BH_UserArgs_MT128x64x128_MI16x16x1_SN_LDSB1_CLR1_GSU0_GSUC0_GSUWGMRR0_K1_LBSPPA512_LBSPPB1024_LPB32_MIWT4_2_PLR2_SU32_SUM0_SUS256_SKXCCM6_VWA2_VWB2_WGM1_WGMXCC1_WGMXCCGn1
    SolutionIndex: 103
    SolutionNameMin: Cijk_Alik_Bjlk_BBS_BH_UserArgs_MT128x64x128_MI16x16x1_SN_LDSB1_CLR1_GSU0_GSUC0_GSUWGMRR0_K1_LBSPPA512_LBSPPB1024_LPB32_MIWT4_2_PLR2_SU32_SUM0_SUS256_SKXCCM6_VWA2_VWB2_WGM8_WGMXCC1_WGMXCCGn1
    SolutionIndex: 104
    SolutionNameMin: Cijk_Alik_Bjlk_BBS_BH_UserArgs_MT32x64x128_MI16x16x1_SN_LDSB1_CLR1_GSU0_GSUC0_GSUWGMRR0_K1_LBSPPA256_LBSPPB1024_LPB32_MIWT1_2_PLR1_SU32_SUM0_SUS256_SKXCCM6_VWA1_VWB2_WGM1_WGMXCC1_WGMXCCGn1
    SolutionIndex: 105
    SolutionNameMin: Cijk_Alik_Bjlk_BBS_BH_UserArgs_MT32x64x128_MI16x16x1_SN_LDSB1_CLR1_GSU0_GSUC0_GSUWGMRR0_K1_LBSPPA256_LBSPPB1024_LPB32_MIWT1_2_PLR2_SU32_SUM0_SUS256_SKXCCM6_VWA1_VWB2_WGM1_WGMXCC1_WGMXCCGn1
    SolutionIndex: 106
    SolutionNameMin: Cijk_Alik_Bjlk_BBS_BH_UserArgs_MT32x64x128_MI16x16x1_SN_LDSB1_CLR1_GSU0_GSUC0_GSUWGMRR0_K1_LBSPPA256_LBSPPB1024_LPB32_MIWT1_2_PLR2_SU32_SUM0_SUS256_SKXCCM6_VWA1_VWB2_WGM4_WGMXCC1_WGMXCCGn1
    SolutionIndex: 107
    SolutionNameMin: Cijk_Alik_Bjlk_BBS_BH_UserArgs_MT32x64x128_MI16x16x1_SN_LDSB1_CLR1_GSU0_GSUC0_GSUWGMRR0_K1_LBSPPA256_LBSPPB1024_LPB32_MIWT1_2_PLR2_SU32_SUM0_SUS256_SKXCCM6_VWA1_VWB2_WGM8_WGMXCC1_WGMXCCGn1
    SolutionIndex: 108
    SolutionNameMin: Cijk_Alik_Bjlk_BBS_BH_UserArgs_MT64x32x128_MI16x16x1_SN_LDSB1_CLR1_GSU0_GSUC0_GSUWGMRR0_K1_LBSPPA256_LBSPPB512_LPB16_MIWT2_1_PLR1_SU32_SUM0_SUS256_SKXCCM6_VWA1_VWB1_WGM1_WGMXCC1_WGMXCCGn1
    SolutionIndex: 109
    SolutionNameMin: Cijk_Alik_Bjlk_BBS_BH_UserArgs_MT64x32x128_MI16x16x1_SN_LDSB1_CLR1_GSU0_GSUC0_GSUWGMRR0_K1_LBSPPA512_LBSPPB512_LPB16_MIWT2_1_PLR2_SU32_SUM0_SUS256_SKXCCM6_VWA2_VWB1_WGM1_WGMXCC1_WGMXCCGn1
    SolutionIndex: 110
    SolutionNameMin: Cijk_Alik_Bjlk_BBS_BH_UserArgs_MT32x32x128_MI16x16x1_SN_LDSB1_CLR1_GSU0_GSUC0_GSUWGMRR0_K1_LBSPPA256_LBSPPB512_LPB16_MIWT1_1_PLR1_SU32_SUM0_SUS256_SKXCCM6_VWA1_VWB1_WGM1_WGMXCC1_WGMXCCGn1
    SolutionIndex: 111
    SolutionNameMin: Cijk_Alik_Bjlk_BBS_BH_UserArgs_MT32x32x128_MI16x16x1_SN_LDSB1_CLR1_GSU0_GSUC0_GSUWGMRR0_K1_LBSPPA256_LBSPPB512_LPB16_MIWT1_1_PLR2_SU32_SUM0_SUS256_SKXCCM6_VWA1_VWB1_WGM1_WGMXCC1_WGMXCCGn1
    SolutionIndex: 112
    SolutionNameMin: Cijk_Alik_Bjlk_BBS_BH_UserArgs_MT32x32x32_MI16x16x1_SN_LDSB0_CLR1_GSU0_GSUC0_GSUWGMRR0_K1_LBSPPA128_LBSPPB256_LPB16_MIWT1_1_PLR1_SU32_SUM0_SUS256_SKXCCM6_VWA1_VWB1_WGM1_WGMXCC1_WGMXCCGn1
- - - [128, 128, 1, 128, 128, 128, 128, 128]
    - [29, 0.082]
  - - [128, 128, 1, 256, 128, 128, 256, 128]
    - [29, 0.108]
  - - [128, 128, 1, 512, 128, 128, 512, 128]
    - [28, 0.177]
  - - [128, 128, 1, 1024, 128, 128, 1024, 128]
    - [29, 0.262]
  - - [128, 128, 1, 2048, 128, 128, 2048, 128]
    - [101, 0.362]
  - - [128, 128, 1, 4096, 128, 128, 4096, 128]
    - [101, 0.697]
  - - [128, 128, 1, 8192, 128, 128, 8192, 128]
    - [28, 1.301]
  - - [128, 256, 1, 128, 128, 128, 128, 256]
    - [29, 0.166]
  - - [128, 256, 1, 256, 128, 128, 256, 256]
    - [29, 0.212]
  - - [128, 256, 1, 512, 128, 128, 512, 256]
    - [111, 0.343]
  - - [128, 256, 1, 1024, 128, 128, 1024, 256]
    - [101, 0.546]
  - - [128, 256, 1, 2048, 128, 128, 2048, 256]
    - [110, 1.007]
  - - [128, 256, 1, 4096, 128, 128, 4096, 256]
    - [29, 1.739]
  - - [128, 256, 1, 8192, 128, 128, 8192, 256]
    - [29, 2.849]
  - - [128, 512, 1, 128, 128, 128, 128, 512]
    - [29, 0.326]
  - - [128, 512, 1, 256, 128, 128, 256, 512]
    - [28, 0.416]
  - - [128, 512, 1, 512, 128, 128, 512, 512]
    - [111, 0.668]
  - - [128, 512, 1, 1024, 128, 128, 1024, 512]
    - [65, 1.228]
  - - [128, 512, 1, 2048, 128, 128, 2048, 512]
    - [111, 2.198]
  - - [128, 512, 1, 4096, 128, 128, 4096, 512]
    - [28, 3.39]
  - - [128, 512, 1, 8192, 128, 128, 8192, 512]
    - [105, 4.829]
  - - [128, 1024, 1, 128, 128, 128, 128, 1024]
    - [28, 0.65]
  - - [128, 1024, 1, 256, 128, 128, 256, 1024]
    - [29, 0.801]
  - - [128, 1024, 1, 512, 128, 128, 512, 1024]
    - [28, 1.444]
  - - [128, 1024, 1, 1024, 128, 128, 1024, 1024]
    - [111, 2.439]
  - - [128, 1024, 1, 2048, 128, 128, 2048, 1024]
    - [105, 3.814]
  - - [128, 1024, 1, 4096, 128, 128, 4096, 1024]
    - [105, 5.484]
  - - [128, 1024, 1, 8192, 128, 128, 8192, 1024]
    - [95, 7.118]
  - - [128, 2048, 1, 128, 128, 128, 128, 2048]
    - [27, 1.185]
  - - [128, 2048, 1, 256, 128, 128, 256, 2048]
    - [28, 1.95]
  - - [128, 2048, 1, 512, 128, 128, 512, 2048]
    - [29, 3.102]
  - - [128, 2048, 1, 1024, 128, 128, 1024, 2048]
    - [111, 4.373]
  - - [128, 2048, 1, 2048, 128, 128, 2048, 2048]
    - [105, 6.128]
  - - [128, 2048, 1, 4096, 128, 128, 4096, 2048]
    - [95, 8.528]
  - - [128, 2048, 1, 8192, 128, 128, 8192, 2048]
    - [19, 9.857]
  - - [128, 4096, 1, 128, 128, 128, 128, 4096]
    - [24, 2.131]
  - - [128, 4096, 1, 256, 128, 128, 256, 4096]
    - [23, 3.501]
  - - [128, 4096, 1, 512, 128, 128, 512, 4096]
    - [105, 5.359]
  - - [128, 4096, 1, 1024, 128, 128, 1024, 4096]
    - [105, 7.546]
  - - [128, 4096, 1, 2048, 128, 128, 2048, 4096]
    - [96, 9.598]
  - - [128, 4096, 1, 4096, 128, 128, 4096, 4096]
    - [91, 11.618]
  - - [128, 4096, 1, 8192, 128, 128, 8192, 4096]
    - [93, 13.562]
  - - [128, 8192, 1, 128, 128, 128, 128, 8192]
    - [20, 3.563]
  - - [128, 8192, 1, 256, 128, 128, 256, 8192]
    - [20, 5.963]
  - - [128, 8192, 1, 512, 128, 128, 512, 8192]
    - [96, 8.887]
  - - [128, 8192, 1, 1024, 128, 128, 1024, 8192]
    - [96, 11.633]
  - - [128, 8192, 1, 2048, 128, 128, 2048, 8192]
    - [96, 13.083]
  - - [128, 8192, 1, 4096, 128, 128, 4096, 8192]
    - [17, 14.708]
  - - [128, 8192, 1, 8192, 128, 128, 8192, 8192]
    - [19, 16.371]
  - - [256, 128, 1, 128, 256, 256, 128, 128]
    - [29, 0.165]
  - - [256, 128, 1, 256, 256, 256, 256, 128]
    - [28, 0.209]
  - - [256, 128, 1, 512, 256, 256, 512, 128]
    - [28, 0.351]
  - - [256, 128, 1, 1024, 256, 256, 1024, 128]
    - [101, 0.544]
  - - [256, 128, 1, 2048, 256, 256, 2048, 128]
    - [110, 1.018]
  - - [256, 128, 1, 4096, 256, 256, 4096, 128]
    - [28, 1.703]
  - - [256, 128, 1, 8192, 256, 256, 8192, 128]
    - [29, 2.859]
  - - [256, 256, 1, 128, 256, 256, 128, 256]
    - [29, 0.328]
  - - [256, 256, 1, 256, 256, 256, 256, 256]
    - [29, 0.413]
  - - [256, 256, 1, 512, 256, 256, 512, 256]
    - [110, 0.692]
  - - [256, 256, 1, 1024, 256, 256, 1024, 256]
    - [66, 1.239]
  - - [256, 256, 1, 2048, 256, 256, 2048, 256]
    - [111, 2.226]
  - - [256, 256, 1, 4096, 256, 256, 4096, 256]
    - [111, 3.448]
  - - [256, 256, 1, 8192, 256, 256, 8192, 256]
    - [25, 4.995]
  - - [256, 512, 1, 128, 256, 256, 128, 512]
    - [29, 0.647]
  - - [256, 512, 1, 256, 256, 256, 256, 512]
    - [28, 0.796]
  - - [256, 512, 1, 512, 256, 256, 512, 512]
    - [28, 1.442]
  - - [256, 512, 1, 1024, 256, 256, 1024, 512]
    - [111, 2.409]
  - - [256, 512, 1, 2048, 256, 256, 2048, 512]
    - [109, 3.86]
  - - [256, 512, 1, 4096, 256, 256, 4096, 512]
    - [105, 5.859]
  - - [256, 512, 1, 8192, 256, 256, 8192, 512]
    - [106, 7.736]
  - - [256, 1024, 1, 128, 256, 256, 128, 1024]
    - [25, 1.188]
  - - [256, 1024, 1, 256, 256, 256, 256, 1024]
    - [29, 1.947]
  - - [256, 1024, 1, 512, 256, 256, 512, 1024]
    - [28, 3.09]
  - - [256, 1024, 1, 1024, 256, 256, 1024, 1024]
    - [29, 4.387]
  - - [256, 1024, 1, 2048, 256, 256, 2048, 1024]
    - [107, 6.329]
  - - [256, 1024, 1, 4096, 256, 256, 4096, 1024]
    - [21, 8.599]
  - - [256, 1024, 1, 8192, 256, 256, 8192, 1024]
    - [19, 9.524]
  - - [256, 2048, 1, 128, 256, 256, 128, 2048]
    - [24, 2.156]
  - - [256, 2048, 1, 256, 256, 256, 256, 2048]
    - [22, 3.487]
  - - [256, 2048, 1, 512, 256, 256, 512, 2048]
    - [25, 5.333]
  - - [256, 2048, 1, 1024, 256, 256, 1024, 2048]
    - [105, 7.534]
  - - [256, 2048, 1, 2048, 256, 256, 2048, 2048]
    - [96, 9.846]
  - - [256, 2048, 1, 4096, 256, 256, 4096, 2048]
    - [89, 11.605]
  - - [256, 2048, 1, 8192, 256, 256, 8192, 2048]
    - [89, 12.442]
  - - [256, 4096, 1, 128, 256, 256, 128, 4096]
    - [20, 3.509]
  - - [256, 4096, 1, 256, 256, 256, 256, 4096]
    - [20, 5.886]
  - - [256, 4096, 1, 512, 256, 256, 512, 4096]
    - [96, 8.85]
  - - [256, 4096, 1, 1024, 256, 256, 1024, 4096]
    - [96, 11.977]
  - - [256, 4096, 1, 2048, 256, 256, 2048, 4096]
    - [96, 13.578]
  - - [256, 4096, 1, 4096, 256, 256, 4096, 4096]
    - [94, 14.47]
  - - [256, 4096, 1, 8192, 256, 256, 8192, 4096]
    - [78, 15.26]
  - - [256, 8192, 1, 128, 256, 256, 128, 8192]
    - [10, 5.391]
  - - [256, 8192, 1, 256, 256, 256, 256, 8192]
    - [88, 8.665]
  - - [256, 8192, 1, 512, 256, 256, 512, 8192]
    - [88, 12.743]
  - - [256, 8192, 1, 1024, 256, 256, 1024, 8192]
    - [88, 15.511]
  - - [256, 8192, 1, 2048, 256, 256, 2048, 8192]
    - [89, 16.674]
  - - [256, 8192, 1, 4096, 256, 256, 4096, 8192]
    - [80, 16.81]
  - - [256, 8192, 1, 8192, 256, 256, 8192, 8192]
    - [13, 17.643]
  - - [512, 128, 1, 128, 512, 512, 128, 128]
    - [29, 0.326]
  - - [512, 128, 1, 256, 512, 512, 256, 128]
    - [28, 0.415]
  - - [512, 128, 1, 512, 512, 512, 512, 128]
    - [65, 0.673]
  - - [512, 128, 1, 1024, 512, 512, 1024, 128]
    - [65, 1.246]
  - - [512, 128, 1, 2048, 512, 512, 2048, 128]
    - [110, 2.212]
  - - [512, 128, 1, 4096, 512, 512, 4096, 128]
    - [110, 3.466]
  - - [512, 128, 1, 8192, 512, 512, 8192, 128]
    - [105, 5.037]
  - - [512, 256, 1, 128, 512, 512, 128, 256]
    - [28, 0.642]
  - - [512, 256, 1, 256, 512, 512, 256, 256]
    - [29, 0.795]
  - - [512, 256, 1, 512, 512, 512, 512, 256]
    - [28, 1.432]
  - - [512, 256, 1, 1024, 512, 512, 1024, 256]
    - [110, 2.416]
  - - [512, 256, 1, 2048, 512, 512, 2048, 256]
    - [104, 3.799]
  - - [512, 256, 1, 4096, 512, 512, 4096, 256]
    - [106, 5.967]
  - - [512, 256, 1, 8192, 512, 512, 8192, 256]
    - [106, 7.806]
  - - [512, 512, 1, 128, 512, 512, 128, 512]
    - [25, 1.204]
  - - [512, 512, 1, 256, 512, 512, 256, 512]
    - [28, 1.948]
  - - [512, 512, 1, 512, 512, 512, 512, 512]
    - [29, 3.092]
  - - [512, 512, 1, 1024, 512, 512, 1024, 512]
    - [29, 4.413]
  - - [512, 512, 1, 2048, 512, 512, 2048, 512]
    - [105, 6.477]
  - - [512, 512, 1, 4096, 512, 512, 4096, 512]
    - [95, 8.711]
  - - [512, 512, 1, 8192, 512, 512, 8192, 512]
    - [98, 10.021]
  - - [512, 1024, 1, 128, 512, 512, 128, 1024]
    - [24, 2.118]
  - - [512, 1024, 1, 256, 512, 512, 256, 1024]
    - [22, 3.507]
  - - [512, 1024, 1, 512, 512, 512, 512, 1024]
    - [25, 5.374]
  - - [512, 1024, 1, 1024, 512, 512, 1024, 1024]
    - [25, 7.556]
  - - [512, 1024, 1, 2048, 512, 512, 2048, 1024]
    - [96, 9.815]
  - - [512, 1024, 1, 4096, 512, 512, 4096, 1024]
    - [83, 11.463]
  - - [512, 1024, 1, 8192, 512, 512, 8192, 1024]
    - [90, 12.249]
  - - [512, 2048, 1, 128, 512, 512, 128, 2048]
    - [20, 3.517]
  - - [512, 2048, 1, 256, 512, 512, 256, 2048]
    - [20, 5.916]
  - - [512, 2048, 1, 512, 512, 512, 512, 2048]
    - [20, 8.869]
  - - [512, 2048, 1, 1024, 512, 512, 1024, 2048]
    - [96, 11.909]
  - - [512, 2048, 1, 2048, 512, 512, 2048, 2048]
    - [96, 13.876]
  - - [512, 2048, 1, 4096, 512, 512, 4096, 2048]
    - [90, 13.548]
  - - [512, 2048, 1, 8192, 512, 512, 8192, 2048]
    - [78, 14.665]
  - - [512, 4096, 1, 128, 512, 512, 128, 4096]
    - [14, 5.391]
  - - [512, 4096, 1, 256, 512, 512, 256, 4096]
    - [14, 8.615]
  - - [512, 4096, 1, 512, 512, 512, 512, 4096]
    - [83, 12.701]
  - - [512, 4096, 1, 1024, 512, 512, 1024, 4096]
    - [83, 15.875]
  - - [512, 4096, 1, 2048, 512, 512, 2048, 4096]
    - [89, 16.935]
  - - [512, 4096, 1, 4096, 512, 512, 4096, 4096]
    - [102, 16.509]
  - - [512, 4096, 1, 8192, 512, 512, 8192, 4096]
    - [74, 17.373]
  - - [512, 8192, 1, 128, 512, 512, 128, 8192]
    - [58, 7.276]
  - - [512, 8192, 1, 256, 512, 512, 256, 8192]
    - [58, 11.354]
  - - [512, 8192, 1, 512, 512, 512, 512, 8192]
    - [58, 15.709]
  - - [512, 8192, 1, 1024, 512, 512, 1024, 8192]
    - [58, 17.481]
  - - [512, 8192, 1, 2048, 512, 512, 2048, 8192]
    - [78, 19.109]
  - - [512, 8192, 1, 4096, 512, 512, 4096, 8192]
    - [6, 17.812]
  - - [512, 8192, 1, 8192, 512, 512, 8192, 8192]
    - [74, 20.613]
  - - [1024, 128, 1, 128, 1024, 1024, 128, 128]
    - [29, 0.648]
  - - [1024, 128, 1, 256, 1024, 1024, 256, 128]
    - [29, 0.802]
  - - [1024, 128, 1, 512, 1024, 1024, 512, 128]
    - [28, 1.44]
  - - [1024, 128, 1, 1024, 1024, 1024, 1024, 128]
    - [110, 2.422]
  - - [1024, 128, 1, 2048, 1024, 1024, 2048, 128]
    - [108, 3.82]
  - - [1024, 128, 1, 4096, 1024, 1024, 4096, 128]
    - [105, 6.0]
  - - [1024, 128, 1, 8192, 1024, 1024, 8192, 128]
    - [106, 7.919]
  - - [1024, 256, 1, 128, 1024, 1024, 128, 256]
    - [25, 1.193]
  - - [1024, 256, 1, 256, 1024, 1024, 256, 256]
    - [29, 1.937]
  - - [1024, 256, 1, 512, 1024, 1024, 512, 256]
    - [29, 3.103]
  - - [1024, 256, 1, 1024, 1024, 1024, 1024, 256]
    - [111, 4.375]
  - - [1024, 256, 1, 2048, 1024, 1024, 2048, 256]
    - [105, 6.503]
  - - [1024, 256, 1, 4096, 1024, 1024, 4096, 256]
    - [99, 8.609]
  - - [1024, 256, 1, 8192, 1024, 1024, 8192, 256]
    - [100, 10.247]
  - - [1024, 512, 1, 128, 1024, 1024, 128, 512]
    - [24, 2.144]
  - - [1024, 512, 1, 256, 1024, 1024, 256, 512]
    - [22, 3.505]
  - - [1024, 512, 1, 512, 1024, 1024, 512, 512]
    - [25, 5.368]
  - - [1024, 512, 1, 1024, 1024, 1024, 1024, 512]
    - [25, 7.56]
  - - [1024, 512, 1, 2048, 1024, 1024, 2048, 512]
    - [100, 10.009]
  - - [1024, 512, 1, 4096, 1024, 1024, 4096, 512]
    - [99, 11.797]
  - - [1024, 512, 1, 8192, 1024, 1024, 8192, 512]
    - [85, 11.697]
  - - [1024, 1024, 1, 128, 1024, 1024, 128, 1024]
    - [12, 3.561]
  - - [1024, 1024, 1, 256, 1024, 1024, 256, 1024]
    - [20, 5.911]
  - - [1024, 1024, 1, 512, 1024, 1024, 512, 1024]
    - [20, 8.865]
  - - [1024, 1024, 1, 1024, 1024, 1024, 1024, 1024]
    - [96, 11.795]
  - - [1024, 1024, 1, 2048, 1024, 1024, 2048, 1024]
    - [96, 13.577]
  - - [1024, 1024, 1, 4096, 1024, 1024, 4096, 1024]
    - [86, 13.167]
  - - [1024, 1024, 1, 8192, 1024, 1024, 8192, 1024]
    - [79, 16.012]
  - - [1024, 2048, 1, 128, 1024, 1024, 128, 2048]
    - [11, 5.358]
  - - [1024, 2048, 1, 256, 1024, 1024, 256, 2048]
    - [14, 8.604]
  - - [1024, 2048, 1, 512, 1024, 1024, 512, 2048]
    - [83, 12.664]
  - - [1024, 2048, 1, 1024, 1024, 1024, 1024, 2048]
    - [87, 15.591]
  - - [1024, 2048, 1, 2048, 1024, 1024, 2048, 2048]
    - [88, 16.568]
  - - [1024, 2048, 1, 4096, 1024, 1024, 4096, 2048]
    - [82, 17.04]
  - - [1024, 2048, 1, 8192, 1024, 1024, 8192, 2048]
    - [73, 17.448]
  - - [1024, 4096, 1, 128, 1024, 1024, 128, 4096]
    - [58, 7.326]
  - - [1024, 4096, 1, 256, 1024, 1024, 256, 4096]
    - [58, 11.422]
  - - [1024, 4096, 1, 512, 1024, 1024, 512, 4096]
    - [58, 15.59]
  - - [1024, 4096, 1, 1024, 1024, 1024, 1024, 4096]
    - [78, 17.07]
  - - [1024, 4096, 1, 2048, 1024, 1024, 2048, 4096]
    - [77, 19.137]
  - - [1024, 4096, 1, 4096, 1024, 1024, 4096, 4096]
    - [74, 18.028]
  - - [1024, 4096, 1, 8192, 1024, 1024, 8192, 4096]
    - [30, 20.307]
  - - [1024, 8192, 1, 128, 1024, 1024, 128, 8192]
    - [55, 9.389]
  - - [1024, 8192, 1, 256, 1024, 1024, 256, 8192]
    - [48, 13.737]
  - - [1024, 8192, 1, 512, 1024, 1024, 512, 8192]
    - [42, 17.26]
  - - [1024, 8192, 1, 1024, 1024, 1024, 1024, 8192]
    - [40, 21.041]
  - - [1024, 8192, 1, 2048, 1024, 1024, 2048, 8192]
    - [68, 21.048]
  - - [1024, 8192, 1, 4096, 1024, 1024, 4096, 8192]
    - [74, 20.251]
  - - [1024, 8192, 1, 8192, 1024, 1024, 8192, 8192]
    - [2, 23.14]
  - - [2048, 128, 1, 128, 2048, 2048, 128, 128]
    - [25, 1.216]
  - - [2048, 128, 1, 256, 2048, 2048, 256, 128]
    - [28, 1.977]
  - - [2048, 128, 1, 512, 2048, 2048, 512, 128]
    - [29, 3.113]
  - - [2048, 128, 1, 1024, 2048, 2048, 1024, 128]
    - [111, 4.361]
  - - [2048, 128, 1, 2048, 2048, 2048, 2048, 128]
    - [105, 6.512]
  - - [2048, 128, 1, 4096, 2048, 2048, 4096, 128]
    - [106, 8.528]
  - - [2048, 128, 1, 8192, 2048, 2048, 8192, 128]
    - [95, 10.239]
  - - [2048, 256, 1, 128, 2048, 2048, 128, 256]
    - [24, 2.105]
  - - [2048, 256, 1, 256, 2048, 2048, 256, 256]
    - [22, 3.487]
  - - [2048, 256, 1, 512, 2048, 2048, 512, 256]
    - [25, 5.382]
  - - [2048, 256, 1, 1024, 2048, 2048, 1024, 256]
    - [26, 7.468]
  - - [2048, 256, 1, 2048, 2048, 2048, 2048, 256]
    - [100, 10.036]
  - - [2048, 256, 1, 4096, 2048, 2048, 4096, 256]
    - [85, 11.505]
  - - [2048, 256, 1, 8192, 2048, 2048, 8192, 256]
    - [64, 12.375]
  - - [2048, 512, 1, 128, 2048, 2048, 128, 512]
    - [20, 3.528]
  - - [2048, 512, 1, 256, 2048, 2048, 256, 512]
    - [20, 5.933]
  - - [2048, 512, 1, 512, 2048, 2048, 512, 512]
    - [20, 8.895]
  - - [2048, 512, 1, 1024, 2048, 2048, 1024, 512]
    - [100, 11.899]
  - - [2048, 512, 1, 2048, 2048, 2048, 2048, 512]
    - [100, 13.915]
  - - [2048, 512, 1, 4096, 2048, 2048, 4096, 512]
    - [94, 13.16]
  - - [2048, 512, 1, 8192, 2048, 2048, 8192, 512]
    - [82, 15.12]
  - - [2048, 1024, 1, 128, 2048, 2048, 128, 1024]
    - [16, 5.454]
  - - [2048, 1024, 1, 256, 2048, 2048, 256, 1024]
    - [16, 8.66]
  - - [2048, 1024, 1, 512, 2048, 2048, 512, 1024]
    - [18, 12.711]
  - - [2048, 1024, 1, 1024, 2048, 2048, 1024, 1024]
    - [87, 15.869]
  - - [2048, 1024, 1, 2048, 2048, 2048, 2048, 1024]
    - [85, 16.68]
  - - [2048, 1024, 1, 4096, 2048, 2048, 4096, 1024]
    - [82, 16.97]
  - - [2048, 1024, 1, 8192, 2048, 2048, 8192, 1024]
    - [70, 17.828]
  - - [2048, 2048, 1, 128, 2048, 2048, 128, 2048]
    - [9, 7.324]
  - - [2048, 2048, 1, 256, 2048, 2048, 256, 2048]
    - [7, 11.131]
  - - [2048, 2048, 1, 512, 2048, 2048, 512, 2048]
    - [62, 15.017]
  - - [2048, 2048, 1, 1024, 2048, 2048, 1024, 2048]
    - [61, 17.133]
  - - [2048, 2048, 1, 2048, 2048, 2048, 2048, 2048]
    - [82, 18.736]
  - - [2048, 2048, 1, 4096, 2048, 2048, 4096, 2048]
    - [76, 17.766]
  - - [2048, 2048, 1, 8192, 2048, 2048, 8192, 2048]
    - [72, 19.767]
  - - [2048, 4096, 1, 128, 2048, 2048, 128, 4096]
    - [55, 9.621]
  - - [2048, 4096, 1, 256, 2048, 2048, 256, 4096]
    - [4, 13.332]
  - - [2048, 4096, 1, 512, 2048, 2048, 512, 4096]
    - [43, 17.013]
  - - [2048, 4096, 1, 1024, 2048, 2048, 1024, 4096]
    - [43, 20.516]
  - - [2048, 4096, 1, 2048, 2048, 2048, 2048, 4096]
    - [74, 20.639]
  - - [2048, 4096, 1, 4096, 2048, 2048, 4096, 4096]
    - [36, 20.461]
  - - [2048, 4096, 1, 8192, 2048, 2048, 8192, 4096]
    - [30, 23.023]
  - - [2048, 8192, 1, 128, 2048, 2048, 128, 8192]
    - [32, 8.948]
  - - [2048, 8192, 1, 256, 2048, 2048, 256, 8192]
    - [32, 13.302]
  - - [2048, 8192, 1, 512, 2048, 2048, 512, 8192]
    - [34, 17.877]
  - - [2048, 8192, 1, 1024, 2048, 2048, 1024, 8192]
    - [31, 21.125]
  - - [2048, 8192, 1, 2048, 2048, 2048, 2048, 8192]
    - [41, 19.916]
  - - [2048, 8192, 1, 4096, 2048, 2048, 4096, 8192]
    - [30, 23.645]
  - - [2048, 8192, 1, 8192, 2048, 2048, 8192, 8192]
    - [31, 24.388]
  - - [4096, 128, 1, 128, 4096, 4096, 128, 128]
    - [24, 2.16]
  - - [4096, 128, 1, 256, 4096, 4096, 256, 128]
    - [22, 3.513]
  - - [4096, 128, 1, 512, 4096, 4096, 512, 128]
    - [105, 5.386]
  - - [4096, 128, 1, 1024, 4096, 4096, 1024, 128]
    - [105, 7.51]
  - - [4096, 128, 1, 2048, 4096, 4096, 2048, 128]
    - [100, 9.871]
  - - [4096, 128, 1, 4096, 4096, 4096, 4096, 128]
    - [85, 11.03]
  - - [4096, 128, 1, 8192, 4096, 4096, 8192, 128]
    - [15, 13.288]
  - - [4096, 256, 1, 128, 4096, 4096, 128, 256]
    - [20, 3.53]
  - - [4096, 256, 1, 256, 4096, 4096, 256, 256]
    - [20, 5.944]
  - - [4096, 256, 1, 512, 4096, 4096, 512, 256]
    - [96, 8.868]
  - - [4096, 256, 1, 1024, 4096, 4096, 1024, 256]
    - [100, 11.847]
  - - [4096, 256, 1, 2048, 4096, 4096, 2048, 256]
    - [97, 13.559]
  - - [4096, 256, 1, 4096, 4096, 4096, 4096, 256]
    - [63, 13.934]
  - - [4096, 256, 1, 8192, 4096, 4096, 8192, 256]
    - [78, 15.263]
  - - [4096, 512, 1, 128, 4096, 4096, 128, 512]
    - [16, 5.401]
  - - [4096, 512, 1, 256, 4096, 4096, 256, 512]
    - [16, 8.735]
  - - [4096, 512, 1, 512, 4096, 4096, 512, 512]
    - [92, 12.689]
  - - [4096, 512, 1, 1024, 4096, 4096, 1024, 512]
    - [85, 15.758]
  - - [4096, 512, 1, 2048, 4096, 4096, 2048, 512]
    - [84, 16.313]
  - - [4096, 512, 1, 4096, 4096, 4096, 4096, 512]
    - [103, 16.291]
  - - [4096, 512, 1, 8192, 4096, 4096, 8192, 512]
    - [70, 17.765]
  - - [4096, 1024, 1, 128, 4096, 4096, 128, 1024]
    - [57, 7.187]
  - - [4096, 1024, 1, 256, 4096, 4096, 256, 1024]
    - [8, 11.184]
  - - [4096, 1024, 1, 512, 4096, 4096, 512, 1024]
    - [62, 15.186]
  - - [4096, 1024, 1, 1024, 4096, 4096, 1024, 1024]
    - [56, 17.277]
  - - [4096, 1024, 1, 2048, 4096, 4096, 2048, 1024]
    - [81, 19.077]
  - - [4096, 1024, 1, 4096, 4096, 4096, 4096, 1024]
    - [69, 17.566]
  - - [4096, 1024, 1, 8192, 4096, 4096, 8192, 1024]
    - [33, 19.701]
  - - [4096, 2048, 1, 128, 4096, 4096, 128, 2048]
    - [54, 9.641]
  - - [4096, 2048, 1, 256, 4096, 4096, 256, 2048]
    - [48, 13.281]
  - - [4096, 2048, 1, 512, 4096, 4096, 512, 2048]
    - [51, 17.236]
  - - [4096, 2048, 1, 1024, 4096, 4096, 1024, 2048]
    - [46, 20.213]
  - - [4096, 2048, 1, 2048, 4096, 4096, 2048, 2048]
    - [71, 20.636]
  - - [4096, 2048, 1, 4096, 4096, 4096, 4096, 2048]
    - [36, 20.111]
  - - [4096, 2048, 1, 8192, 4096, 4096, 8192, 2048]
    - [36, 22.488]
  - - [4096, 4096, 1, 128, 4096, 4096, 128, 4096]
    - [32, 9.054]
  - - [4096, 4096, 1, 256, 4096, 4096, 256, 4096]
    - [34, 13.361]
  - - [4096, 4096, 1, 512, 4096, 4096, 512, 4096]
    - [0, 17.687]
  - - [4096, 4096, 1, 1024, 4096, 4096, 1024, 4096]
    - [38, 21.039]
  - - [4096, 4096, 1, 2048, 4096, 4096, 2048, 4096]
    - [67, 20.234]
  - - [4096, 4096, 1, 4096, 4096, 4096, 4096, 4096]
    - [31, 22.662]
  - - [4096, 4096, 1, 8192, 4096, 4096, 8192, 4096]
    - [31, 25.187]
  - - [4096, 8192, 1, 128, 4096, 4096, 128, 8192]
    - [41, 8.715]
  - - [4096, 8192, 1, 256, 4096, 4096, 256, 8192]
    - [50, 11.889]
  - - [4096, 8192, 1, 512, 4096, 4096, 512, 8192]
    - [46, 15.771]
  - - [4096, 8192, 1, 1024, 4096, 4096, 1024, 8192]
    - [49, 19.727]
  - - [4096, 8192, 1, 2048, 4096, 4096, 2048, 8192]
    - [44, 23.322]
  - - [4096, 8192, 1, 4096, 4096, 4096, 4096, 8192]
    - [44, 24.665]
  - - [4096, 8192, 1, 8192, 4096, 4096, 8192, 8192]
    - [1, 26.9]
  - - [8192, 128, 1, 128, 8192, 8192, 128, 128]
    - [20, 3.542]
  - - [8192, 128, 1, 256, 8192, 8192, 256, 128]
    - [96, 5.876]
  - - [8192, 128, 1, 512, 8192, 8192, 512, 128]
    - [100, 8.75]
  - - [8192, 128, 1, 1024, 8192, 8192, 1024, 128]
    - [97, 11.861]
  - - [8192, 128, 1, 2048, 8192, 8192, 2048, 128]
    - [100, 13.016]
  - - [8192, 128, 1, 4096, 8192, 8192, 4096, 128]
    - [15, 14.548]
  - - [8192, 128, 1, 8192, 8192, 8192, 8192, 128]
    - [85, 16.066]
  - - [8192, 256, 1, 128, 8192, 8192, 128, 256]
    - [10, 5.373]
  - - [8192, 256, 1, 256, 8192, 8192, 256, 256]
    - [14, 8.725]
  - - [8192, 256, 1, 512, 8192, 8192, 512, 256]
    - [92, 12.657]
  - - [8192, 256, 1, 1024, 8192, 8192, 1024, 256]
    - [87, 15.457]
  - - [8192, 256, 1, 2048, 8192, 8192, 2048, 256]
    - [86, 16.191]
  - - [8192, 256, 1, 4096, 8192, 8192, 4096, 256]
    - [78, 16.895]
  - - [8192, 256, 1, 8192, 8192, 8192, 8192, 256]
    - [70, 18.072]
  - - [8192, 512, 1, 128, 8192, 8192, 128, 512]
    - [59, 7.159]
  - - [8192, 512, 1, 256, 8192, 8192, 256, 512]
    - [60, 11.224]
  - - [8192, 512, 1, 512, 8192, 8192, 512, 512]
    - [59, 14.957]
  - - [8192, 512, 1, 1024, 8192, 8192, 1024, 512]
    - [62, 16.836]
  - - [8192, 512, 1, 2048, 8192, 8192, 2048, 512]
    - [79, 19.013]
  - - [8192, 512, 1, 4096, 8192, 8192, 4096, 512]
    - [5, 18.489]
  - - [8192, 512, 1, 8192, 8192, 8192, 8192, 512]
    - [72, 20.046]
  - - [8192, 1024, 1, 128, 8192, 8192, 128, 1024]
    - [55, 9.495]
  - - [8192, 1024, 1, 256, 8192, 8192, 256, 1024]
    - [49, 13.24]
  - - [8192, 1024, 1, 512, 8192, 8192, 512, 1024]
    - [51, 16.816]
  - - [8192, 1024, 1, 1024, 8192, 8192, 1024, 1024]
    - [51, 20.745]
  - - [8192, 1024, 1, 2048, 8192, 8192, 2048, 1024]
    - [75, 21.128]
  - - [8192, 1024, 1, 4096, 8192, 8192, 4096, 1024]
    - [33, 19.924]
  - - [8192, 1024, 1, 8192, 8192, 8192, 8192, 1024]
    - [33, 22.69]
  - - [8192, 2048, 1, 128, 8192, 8192, 128, 2048]
    - [0, 8.975]
  - - [8192, 2048, 1, 256, 8192, 8192, 256, 2048]
    - [3, 12.972]
  - - [8192, 2048, 1, 512, 8192, 8192, 512, 2048]
    - [37, 17.584]
  - - [8192, 2048, 1, 1024, 8192, 8192, 1024, 2048]
    - [36, 20.642]
  - - [8192, 2048, 1, 2048, 8192, 8192, 2048, 2048]
    - [36, 19.686]
  - - [8192, 2048, 1, 4096, 8192, 8192, 4096, 2048]
    - [36, 22.066]
  - - [8192, 2048, 1, 8192, 8192, 8192, 8192, 2048]
    - [36, 24.473]
  - - [8192, 4096, 1, 128, 8192, 8192, 128, 4096]
    - [52, 8.708]
  - - [8192, 4096, 1, 256, 8192, 8192, 256, 4096]
    - [41, 11.864]
  - - [8192, 4096, 1, 512, 8192, 8192, 512, 4096]
    - [45, 15.882]
  - - [8192, 4096, 1, 1024, 8192, 8192, 1024, 4096]
    - [47, 20.361]
  - - [8192, 4096, 1, 2048, 8192, 8192, 2048, 4096]
    - [31, 23.162]
  - - [8192, 4096, 1, 4096, 8192, 8192, 4096, 4096]
    - [31, 24.818]
  - - [8192, 4096, 1, 8192, 8192, 8192, 8192, 4096]
    - [36, 26.647]
  - - [8192, 8192, 1, 128, 8192, 8192, 128, 8192]
    - [53, 7.875]
  - - [8192, 8192, 1, 256, 8192, 8192, 256, 8192]
    - [44, 11.759]
  - - [8192, 8192, 1, 512, 8192, 8192, 512, 8192]
    - [47, 16.628]
  - - [8192, 8192, 1, 1024, 8192, 8192, 1024, 8192]
    - [48, 21.544]
  - - [8192, 8192, 1, 2048, 8192, 8192, 2048, 8192]
    - [36, 25.115]
  - - [8192, 8192, 1, 4096, 8192, 8192, 4096, 8192]
    - [35, 27.532]
  - - [8192, 8192, 1, 8192, 8192, 8192, 8192, 8192]
    - [39, 27.521]
  - - [1, 1, 1, 32, 1, 1, 32, 1]
    - [112, 0.0]
- null
- null
- DeviceEfficiency
- GridBased
