library/src/amd_detail/rocblaslt/src/Tensile/Logic/streamk/gfx942a/aquavanjaram942_Cijk_Alik_Bjlk_HSS_BH_UserArgs.yaml
- {MinimumRequiredVersion: 4.33.0}
- aquavanjaram942
- gfx942
- [Device 0049, Device 0050]
    SolutionIndex: 0
    SolutionNameMin: Cijk_Alik_Bjlk_HSS_BH_UserArgs_MT256x256x32_MI16x16x1_SN_LDSB1_CLR1_GSU0_GSUC0_GSUWGMRR0_K1_LBSPPA256_LBSPPB2048_LPB0_MIWT8_8_PLR1_SU32_SUM0_SUS256_SKXCCM0_VWA4_VWB4_WGM1_WGMXCC1_WGMXCCGn1
    SolutionIndex: 1
    SolutionNameMin: Cijk_Alik_Bjlk_HSS_BH_UserArgs_MT256x256x32_MI16x16x1_SN_LDSB1_CLR1_GSU0_GSUC0_GSUWGMRR0_K1_LBSPPA128_LBSPPB2048_LPB0_MIWT8_8_PLR1_SU32_SUM0_SUS256_SKXCCM0_VWA1_VWB8_WGM1_WGMXCC1_WGMXCCGn1
    SolutionIndex: 2
    SolutionNameMin: Cijk_Alik_Bjlk_HSS_BH_UserArgs_MT128x256x32_MI16x16x1_SN_LDSB1_CLR1_GSU0_GSUC0_GSUWGMRR0_K1_LBSPPA128_LBSPPB2048_LPB0_MIWT4_8_PLR1_SU32_SUM0_SUS256_SKXCCM0_VWA1_VWB4_WGM1_WGMXCC1_WGMXCCGn1
    SolutionIndex: 3
    SolutionNameMin: Cijk_Alik_Bjlk_HSS_BH_UserArgs_MT128x256x32_MI16x16x1_SN_LDSB1_CLR1_GSU0_GSUC0_GSUWGMRR0_K1_LBSPPA128_LBSPPB2048_LPB0_MIWT4_8_PLR1_SU32_SUM0_SUS256_SKXCCM0_VWA1_VWB8_WGM4_WGMXCC1_WGMXCCGn1
    SolutionIndex: 4
    SolutionNameMin: Cijk_Alik_Bjlk_HSS_BH_UserArgs_MT128x256x32_MI16x16x1_SN_LDSB1_CLR1_GSU0_GSUC0_GSUWGMRR0_K1_LBSPPA256_LBSPPB2048_LPB0_MIWT4_8_PLR1_SU32_SUM0_SUS256_SKXCCM0_VWA4_VWB8_WGM4_WGMXCC1_WGMXCCGn1
    SolutionIndex: 5
    SolutionNameMin: Cijk_Alik_Bjlk_HSS_BH_UserArgs_MT128x256x32_MI16x16x1_SN_LDSB1_CLR1_GSU0_GSUC0_GSUWGMRR0_K1_LBSPPA256_LBSPPB2048_LPB0_MIWT4_8_PLR1_SU32_SUM0_SUS256_SKXCCM0_VWA4_VWB8_WGM8_WGMXCC1_WGMXCCGn1
    SolutionIndex: 6
    SolutionNameMin: Cijk_Alik_Bjlk_HSS_BH_UserArgs_MT256x128x32_MI16x16x1_SN_LDSB1_CLR1_GSU0_GSUC0_GSUWGMRR0_K1_LBSPPA128_LBSPPB1024_LPB32_MIWT8_4_PLR1_SU32_SUM0_SUS256_SKXCCM0_VWA1_VWB2_WGM1_WGMXCC1_WGMXCCGn1
    SolutionIndex: 7
    SolutionNameMin: Cijk_Alik_Bjlk_HSS_BH_UserArgs_MT64x128x32_MI16x16x1_SN_LDSB0_CLR1_GSU0_GSUC0_GSUWGMRR0_K1_LBSPPA128_LBSPPB1024_LPB0_MIWT2_4_PLR1_SU32_SUM0_SUS256_SKXCCM0_VWA1_VWB4_WGM8_WGMXCC1_WGMXCCGn1
    SolutionIndex: 8
    SolutionNameMin: Cijk_Alik_Bjlk_HSS_BH_UserArgs_MT256x128x64_MI16x16x1_SN_LDSB1_CLR1_GSU0_GSUC0_GSUWGMRR0_K1_LBSPPA512_LBSPPB2048_LPB0_MIWT8_4_PLR1_SU32_SUM0_SUS256_SKXCCM0_VWA4_VWB4_WGM1_WGMXCC1_WGMXCCGn1
    SolutionIndex: 9
    SolutionNameMin: Cijk_Alik_Bjlk_HSS_BH_UserArgs_MT64x128x64_MI16x16x1_SN_LDSB1_CLR1_GSU0_GSUC0_GSUWGMRR0_K1_LBSPPA128_LBSPPB2048_LPB0_MIWT2_4_PLR1_SU32_SUM0_SUS256_SKXCCM0_VWA1_VWB4_WGM1_WGMXCC1_WGMXCCGn1
    SolutionIndex: 10
    SolutionNameMin: Cijk_Alik_Bjlk_HSS_BH_UserArgs_MT64x128x64_MI16x16x1_SN_LDSB1_CLR1_GSU0_GSUC0_GSUWGMRR0_K1_LBSPPA128_LBSPPB2048_LPB0_MIWT2_4_PLR1_SU32_SUM0_SUS256_SKXCCM0_VWA1_VWB4_WGM4_WGMXCC1_WGMXCCGn1
    SolutionIndex: 11
    SolutionNameMin: Cijk_Alik_Bjlk_HSS_BH_UserArgs_MT64x128x64_MI16x16x1_SN_LDSB1_CLR1_GSU0_GSUC0_GSUWGMRR0_K1_LBSPPA256_LBSPPB2048_LPB0_MIWT2_4_PLR1_SU32_SUM0_SUS256_SKXCCM0_VWA2_VWB4_WGM4_WGMXCC1_WGMXCCGn1
    SolutionIndex: 12
    SolutionNameMin: Cijk_Alik_Bjlk_HSS_BH_UserArgs_MT128x64x64_MI16x16x1_SN_LDSB1_CLR1_GSU0_GSUC0_GSUWGMRR0_K1_LBSPPA512_LBSPPB1024_LPB16_MIWT4_2_PLR1_SU32_SUM0_SUS256_SKXCCM0_VWA4_VWB1_WGM1_WGMXCC1_WGMXCCGn1
    SolutionIndex: 13
    SolutionNameMin: Cijk_Alik_Bjlk_HSS_BH_UserArgs_MT128x64x64_MI16x16x1_SN_LDSB1_CLR1_GSU0_GSUC0_GSUWGMRR0_K1_LBSPPA128_LBSPPB1024_LPB32_MIWT4_2_PLR1_SU32_SUM0_SUS256_SKXCCM0_VWA1_VWB2_WGM1_WGMXCC1_WGMXCCGn1
    SolutionIndex: 14
    SolutionNameMin: Cijk_Alik_Bjlk_HSS_BH_UserArgs_MT128x64x64_MI16x16x1_SN_LDSB1_CLR1_GSU0_GSUC0_GSUWGMRR0_K1_LBSPPA512_LBSPPB1024_LPB32_MIWT4_2_PLR1_SU32_SUM0_SUS256_SKXCCM0_VWA4_VWB2_WGM1_WGMXCC1_WGMXCCGn1
    SolutionIndex: 15
    SolutionNameMin: Cijk_Alik_Bjlk_HSS_BH_UserArgs_MT128x64x64_MI16x16x1_SN_LDSB1_CLR1_GSU0_GSUC0_GSUWGMRR0_K1_LBSPPA128_LBSPPB1024_LPB32_MIWT4_2_PLR1_SU32_SUM0_SUS256_SKXCCM0_VWA1_VWB2_WGM4_WGMXCC1_WGMXCCGn1
    SolutionIndex: 16
    SolutionNameMin: Cijk_Alik_Bjlk_HSS_BH_UserArgs_MT128x64x64_MI16x16x1_SN_LDSB1_CLR1_GSU0_GSUC0_GSUWGMRR0_K1_LBSPPA512_LBSPPB1024_LPB32_MIWT4_2_PLR1_SU32_SUM0_SUS256_SKXCCM0_VWA4_VWB2_WGM4_WGMXCC1_WGMXCCGn1
    SolutionIndex: 17
    SolutionNameMin: Cijk_Alik_Bjlk_HSS_BH_UserArgs_MT128x64x64_MI16x16x1_SN_LDSB1_CLR1_GSU0_GSUC0_GSUWGMRR0_K1_LBSPPA128_LBSPPB1024_LPB32_MIWT4_2_PLR1_SU32_SUM0_SUS256_SKXCCM0_VWA1_VWB2_WGM8_WGMXCC1_WGMXCCGn1
    SolutionIndex: 18
    SolutionNameMin: Cijk_Alik_Bjlk_HSS_BH_UserArgs_MT128x64x64_MI16x16x1_SN_LDSB1_CLR1_GSU0_GSUC0_GSUWGMRR0_K1_LBSPPA512_LBSPPB1024_LPB32_MIWT4_2_PLR1_SU32_SUM0_SUS256_SKXCCM0_VWA4_VWB2_WGM8_WGMXCC1_WGMXCCGn1
    SolutionIndex: 19
    SolutionNameMin: Cijk_Alik_Bjlk_HSS_BH_UserArgs_MT32x128x64_MI16x16x1_SN_LDSB1_CLR1_GSU0_GSUC0_GSUWGMRR0_K1_LBSPPA128_LBSPPB2048_LPB0_MIWT1_4_PLR1_SU32_SUM0_SUS256_SKXCCM0_VWA1_VWB4_WGM1_WGMXCC1_WGMXCCGn1
    SolutionIndex: 20
    SolutionNameMin: Cijk_Alik_Bjlk_HSS_BH_UserArgs_MT32x128x64_MI16x16x1_SN_LDSB1_CLR1_GSU0_GSUC0_GSUWGMRR0_K1_LBSPPA128_LBSPPB2048_LPB0_MIWT1_4_PLR1_SU32_SUM0_SUS256_SKXCCM0_VWA1_VWB4_WGM8_WGMXCC1_WGMXCCGn1
    SolutionIndex: 21
    SolutionNameMin: Cijk_Alik_Bjlk_HSS_BH_UserArgs_MT64x64x64_MI16x16x1_SN_LDSB1_CLR1_GSU0_GSUC0_GSUWGMRR0_K1_LBSPPA128_LBSPPB1024_LPB32_MIWT2_2_PLR1_SU32_SUM0_SUS256_SKXCCM0_VWA1_VWB2_WGM1_WGMXCC1_WGMXCCGn1
    SolutionIndex: 22
    SolutionNameMin: Cijk_Alik_Bjlk_HSS_BH_UserArgs_MT64x64x64_MI16x16x1_SN_LDSB1_CLR1_GSU0_GSUC0_GSUWGMRR0_K1_LBSPPA128_LBSPPB1024_LPB32_MIWT2_2_PLR1_SU32_SUM0_SUS256_SKXCCM0_VWA1_VWB2_WGM4_WGMXCC1_WGMXCCGn1
    SolutionIndex: 23
    SolutionNameMin: Cijk_Alik_Bjlk_HSS_BH_UserArgs_MT64x64x64_MI16x16x1_SN_LDSB1_CLR1_GSU0_GSUC0_GSUWGMRR0_K1_LBSPPA128_LBSPPB1024_LPB32_MIWT2_2_PLR1_SU32_SUM0_SUS256_SKXCCM0_VWA1_VWB2_WGM8_WGMXCC1_WGMXCCGn1
    SolutionIndex: 24
    SolutionNameMin: Cijk_Alik_Bjlk_HSS_BH_UserArgs_MT32x64x64_MI16x16x1_SN_LDSB0_CLR1_GSU0_GSUC0_GSUWGMRR0_K1_LBSPPA128_LBSPPB1024_LPB32_MIWT1_2_PLR1_SU32_SUM0_SUS256_SKXCCM0_VWA1_VWB2_WGM1_WGMXCC1_WGMXCCGn1
    SolutionIndex: 25
    SolutionNameMin: Cijk_Alik_Bjlk_HSS_BH_UserArgs_MT64x64x128_MI16x16x1_SN_LDSB1_CLR1_GSU0_GSUC0_GSUWGMRR0_K1_LBSPPA256_LBSPPB1024_LPB32_MIWT2_2_PLR2_SU32_SUM0_SUS256_SKXCCM0_VWA1_VWB2_WGM1_WGMXCC1_WGMXCCGn1
    SolutionIndex: 26
    SolutionNameMin: Cijk_Alik_Bjlk_HSS_BH_UserArgs_MT32x64x128_MI16x16x1_SN_LDSB1_CLR1_GSU0_GSUC0_GSUWGMRR0_K1_LBSPPA256_LBSPPB1024_LPB32_MIWT1_2_PLR1_SU32_SUM0_SUS256_SKXCCM0_VWA1_VWB2_WGM1_WGMXCC1_WGMXCCGn1
    SolutionIndex: 27
    SolutionNameMin: Cijk_Alik_Bjlk_HSS_BH_UserArgs_MT32x64x128_MI16x16x1_SN_LDSB1_CLR1_GSU0_GSUC0_GSUWGMRR0_K1_LBSPPA256_LBSPPB1024_LPB32_MIWT1_2_PLR2_SU32_SUM0_SUS256_SKXCCM0_VWA1_VWB2_WGM1_WGMXCC1_WGMXCCGn1
    SolutionIndex: 28
    SolutionNameMin: Cijk_Alik_Bjlk_HSS_BH_UserArgs_MT64x32x128_MI16x16x1_SN_LDSB1_CLR1_GSU0_GSUC0_GSUWGMRR0_K1_LBSPPA256_LBSPPB512_LPB16_MIWT2_1_PLR2_SU32_SUM0_SUS256_SKXCCM0_VWA1_VWB1_WGM1_WGMXCC1_WGMXCCGn1
    SolutionIndex: 29
    SolutionNameMin: Cijk_Alik_Bjlk_HSS_BH_UserArgs_MT32x32x128_MI16x16x1_SN_LDSB1_CLR1_GSU0_GSUC0_GSUWGMRR0_K1_LBSPPA256_LBSPPB512_LPB16_MIWT1_1_PLR1_SU32_SUM0_SUS256_SKXCCM0_VWA1_VWB1_WGM1_WGMXCC1_WGMXCCGn1
    SolutionIndex: 30
    SolutionNameMin: Cijk_Alik_Bjlk_HSS_BH_UserArgs_MT32x32x128_MI16x16x1_SN_LDSB1_CLR1_GSU0_GSUC0_GSUWGMRR0_K1_LBSPPA256_LBSPPB512_LPB16_MIWT1_1_PLR2_SU32_SUM0_SUS256_SKXCCM0_VWA1_VWB1_WGM1_WGMXCC1_WGMXCCGn1
    SolutionIndex: 31
    SolutionNameMin: Cijk_Alik_Bjlk_HSS_BH_UserArgs_MT32x32x128_MI16x16x1_SN_LDSB1_CLR1_GSU0_GSUC0_GSUWGMRR0_K1_LBSPPA256_LBSPPB512_LPB16_MIWT1_1_PLR2_SU32_SUM0_SUS256_SKXCCM0_VWA1_VWB1_WGM4_WGMXCC1_WGMXCCGn1
    SolutionIndex: 32
    SolutionNameMin: Cijk_Alik_Bjlk_HSS_BH_UserArgs_MT256x256x32_MI16x16x1_SN_LDSB1_CLR1_GSU0_GSUC0_GSUWGMRR0_K1_LBSPPA256_LBSPPB2048_LPB32_MIWT8_8_PLR1_SU32_SUM0_SUS256_SKXCCM6_VWA4_VWB2_WGM1_WGMXCC1_WGMXCCGn1
    SolutionIndex: 33
    SolutionNameMin: Cijk_Alik_Bjlk_HSS_BH_UserArgs_MT256x256x32_MI16x16x1_SN_LDSB1_CLR1_GSU0_GSUC0_GSUWGMRR0_K1_LBSPPA128_LBSPPB2048_LPB0_MIWT8_8_PLR1_SU32_SUM0_SUS256_SKXCCM6_VWA2_VWB4_WGM1_WGMXCC1_WGMXCCGn1
    SolutionIndex: 34
    SolutionNameMin: Cijk_Alik_Bjlk_HSS_BH_UserArgs_MT256x256x32_MI16x16x1_SN_LDSB1_CLR1_GSU0_GSUC0_GSUWGMRR0_K1_LBSPPA256_LBSPPB2048_LPB0_MIWT8_8_PLR1_SU32_SUM0_SUS256_SKXCCM6_VWA4_VWB4_WGM1_WGMXCC1_WGMXCCGn1
    SolutionIndex: 35
    SolutionNameMin: Cijk_Alik_Bjlk_HSS_BH_UserArgs_MT256x256x32_MI16x16x1_SN_LDSB1_CLR1_GSU0_GSUC0_GSUWGMRR0_K1_LBSPPA256_LBSPPB2048_LPB0_MIWT8_8_PLR1_SU32_SUM0_SUS256_SKXCCM6_VWA4_VWB8_WGM1_WGMXCC1_WGMXCCGn1
    SolutionIndex: 36
    SolutionNameMin: Cijk_Alik_Bjlk_HSS_BH_UserArgs_MT256x256x32_MI16x16x1_SN_LDSB1_CLR1_GSU0_GSUC0_GSUWGMRR0_K1_LBSPPA256_LBSPPB2048_LPB0_MIWT8_8_PLR1_SU32_SUM0_SUS256_SKXCCM6_VWA4_VWB4_WGM4_WGMXCC1_WGMXCCGn1
    SolutionIndex: 37
    SolutionNameMin: Cijk_Alik_Bjlk_HSS_BH_UserArgs_MT256x256x32_MI16x16x1_SN_LDSB1_CLR1_GSU0_GSUC0_GSUWGMRR0_K1_LBSPPA256_LBSPPB2048_LPB0_MIWT8_8_PLR1_SU32_SUM0_SUS256_SKXCCM6_VWA4_VWB8_WGM4_WGMXCC1_WGMXCCGn1
    SolutionIndex: 38
    SolutionNameMin: Cijk_Alik_Bjlk_HSS_BH_UserArgs_MT256x256x32_MI16x16x1_SN_LDSB1_CLR1_GSU0_GSUC0_GSUWGMRR0_K1_LBSPPA256_LBSPPB2048_LPB0_MIWT8_8_PLR1_SU32_SUM0_SUS256_SKXCCM6_VWA4_VWB4_WGM8_WGMXCC1_WGMXCCGn1
    SolutionIndex: 39
    SolutionNameMin: Cijk_Alik_Bjlk_HSS_BH_UserArgs_MT256x256x32_MI16x16x1_SN_LDSB1_CLR1_GSU0_GSUC0_GSUWGMRR0_K1_LBSPPA256_LBSPPB2048_LPB0_MIWT8_8_PLR1_SU32_SUM0_SUS256_SKXCCM6_VWA4_VWB8_WGM8_WGMXCC1_WGMXCCGn1
    SolutionIndex: 40
    SolutionNameMin: Cijk_Alik_Bjlk_HSS_BH_UserArgs_MT128x256x32_MI16x16x1_SN_LDSB1_CLR1_GSU0_GSUC0_GSUWGMRR0_K1_LBSPPA256_LBSPPB2048_LPB32_MIWT4_8_PLR1_SU32_SUM0_SUS256_SKXCCM6_VWA4_VWB2_WGM1_WGMXCC1_WGMXCCGn1
    SolutionIndex: 41
    SolutionNameMin: Cijk_Alik_Bjlk_HSS_BH_UserArgs_MT128x256x32_MI16x16x1_SN_LDSB1_CLR1_GSU0_GSUC0_GSUWGMRR0_K1_LBSPPA256_LBSPPB2048_LPB0_MIWT4_8_PLR1_SU32_SUM0_SUS256_SKXCCM6_VWA4_VWB4_WGM1_WGMXCC1_WGMXCCGn1
    SolutionIndex: 42
    SolutionNameMin: Cijk_Alik_Bjlk_HSS_BH_UserArgs_MT128x256x32_MI16x16x1_SN_LDSB1_CLR1_GSU0_GSUC0_GSUWGMRR0_K1_LBSPPA128_LBSPPB2048_LPB0_MIWT4_8_PLR1_SU32_SUM0_SUS256_SKXCCM6_VWA1_VWB8_WGM1_WGMXCC1_WGMXCCGn1
    SolutionIndex: 43
    SolutionNameMin: Cijk_Alik_Bjlk_HSS_BH_UserArgs_MT128x256x32_MI16x16x1_SN_LDSB1_CLR1_GSU0_GSUC0_GSUWGMRR0_K1_LBSPPA256_LBSPPB2048_LPB0_MIWT4_8_PLR1_SU32_SUM0_SUS256_SKXCCM6_VWA4_VWB8_WGM1_WGMXCC1_WGMXCCGn1
    SolutionIndex: 44
    SolutionNameMin: Cijk_Alik_Bjlk_HSS_BH_UserArgs_MT128x256x32_MI16x16x1_SN_LDSB1_CLR1_GSU0_GSUC0_GSUWGMRR0_K1_LBSPPA256_LBSPPB2048_LPB32_MIWT4_8_PLR1_SU32_SUM0_SUS256_SKXCCM6_VWA4_VWB2_WGM4_WGMXCC1_WGMXCCGn1
    SolutionIndex: 45
    SolutionNameMin: Cijk_Alik_Bjlk_HSS_BH_UserArgs_MT128x256x32_MI16x16x1_SN_LDSB1_CLR1_GSU0_GSUC0_GSUWGMRR0_K1_LBSPPA256_LBSPPB2048_LPB0_MIWT4_8_PLR1_SU32_SUM0_SUS256_SKXCCM6_VWA4_VWB4_WGM4_WGMXCC1_WGMXCCGn1
    SolutionIndex: 46
    SolutionNameMin: Cijk_Alik_Bjlk_HSS_BH_UserArgs_MT128x256x32_MI16x16x1_SN_LDSB1_CLR1_GSU0_GSUC0_GSUWGMRR0_K1_LBSPPA256_LBSPPB2048_LPB0_MIWT4_8_PLR1_SU32_SUM0_SUS256_SKXCCM6_VWA4_VWB8_WGM4_WGMXCC1_WGMXCCGn1
    SolutionIndex: 47
    SolutionNameMin: Cijk_Alik_Bjlk_HSS_BH_UserArgs_MT128x256x32_MI16x16x1_SN_LDSB1_CLR1_GSU0_GSUC0_GSUWGMRR0_K1_LBSPPA128_LBSPPB2048_LPB32_MIWT4_8_PLR1_SU32_SUM0_SUS256_SKXCCM6_VWA1_VWB2_WGM8_WGMXCC1_WGMXCCGn1
    SolutionIndex: 48
    SolutionNameMin: Cijk_Alik_Bjlk_HSS_BH_UserArgs_MT128x256x32_MI16x16x1_SN_LDSB1_CLR1_GSU0_GSUC0_GSUWGMRR0_K1_LBSPPA256_LBSPPB2048_LPB32_MIWT4_8_PLR1_SU32_SUM0_SUS256_SKXCCM6_VWA4_VWB2_WGM8_WGMXCC1_WGMXCCGn1
    SolutionIndex: 49
    SolutionNameMin: Cijk_Alik_Bjlk_HSS_BH_UserArgs_MT128x256x32_MI16x16x1_SN_LDSB1_CLR1_GSU0_GSUC0_GSUWGMRR0_K1_LBSPPA128_LBSPPB2048_LPB0_MIWT4_8_PLR1_SU32_SUM0_SUS256_SKXCCM6_VWA1_VWB4_WGM8_WGMXCC1_WGMXCCGn1
    SolutionIndex: 50
    SolutionNameMin: Cijk_Alik_Bjlk_HSS_BH_UserArgs_MT128x256x32_MI16x16x1_SN_LDSB1_CLR1_GSU0_GSUC0_GSUWGMRR0_K1_LBSPPA256_LBSPPB2048_LPB0_MIWT4_8_PLR1_SU32_SUM0_SUS256_SKXCCM6_VWA4_VWB4_WGM8_WGMXCC1_WGMXCCGn1
    SolutionIndex: 51
    SolutionNameMin: Cijk_Alik_Bjlk_HSS_BH_UserArgs_MT128x256x32_MI16x16x1_SN_LDSB1_CLR1_GSU0_GSUC0_GSUWGMRR0_K1_LBSPPA256_LBSPPB2048_LPB0_MIWT4_8_PLR1_SU32_SUM0_SUS256_SKXCCM6_VWA4_VWB8_WGM8_WGMXCC1_WGMXCCGn1
    SolutionIndex: 52
    SolutionNameMin: Cijk_Alik_Bjlk_HSS_BH_UserArgs_MT64x256x32_MI16x16x1_SN_LDSB1_CLR1_GSU0_GSUC0_GSUWGMRR0_K1_LBSPPA128_LBSPPB2048_LPB32_MIWT2_8_PLR1_SU32_SUM0_SUS256_SKXCCM6_VWA1_VWB2_WGM4_WGMXCC1_WGMXCCGn1
    SolutionIndex: 53
    SolutionNameMin: Cijk_Alik_Bjlk_HSS_BH_UserArgs_MT64x256x32_MI16x16x1_SN_LDSB1_CLR1_GSU0_GSUC0_GSUWGMRR0_K1_LBSPPA128_LBSPPB2048_LPB0_MIWT2_8_PLR1_SU32_SUM0_SUS256_SKXCCM6_VWA2_VWB4_WGM8_WGMXCC1_WGMXCCGn1
    SolutionIndex: 54
    SolutionNameMin: Cijk_Alik_Bjlk_HSS_BH_UserArgs_MT128x128x32_MI16x16x1_SN_LDSB1_CLR1_GSU0_GSUC0_GSUWGMRR0_K1_LBSPPA128_LBSPPB1024_LPB32_MIWT4_4_PLR1_SU32_SUM0_SUS256_SKXCCM6_VWA1_VWB2_WGM1_WGMXCC1_WGMXCCGn1
    SolutionIndex: 55
    SolutionNameMin: Cijk_Alik_Bjlk_HSS_BH_UserArgs_MT128x128x32_MI16x16x1_SN_LDSB1_CLR1_GSU0_GSUC0_GSUWGMRR0_K1_LBSPPA128_LBSPPB1024_LPB0_MIWT4_4_PLR1_SU32_SUM0_SUS256_SKXCCM6_VWA1_VWB4_WGM1_WGMXCC1_WGMXCCGn1
    SolutionIndex: 56
    SolutionNameMin: Cijk_Alik_Bjlk_HSS_BH_UserArgs_MT128x128x32_MI16x16x1_SN_LDSB1_CLR1_GSU0_GSUC0_GSUWGMRR0_K1_LBSPPA256_LBSPPB1024_LPB0_MIWT4_4_PLR1_SU32_SUM0_SUS256_SKXCCM6_VWA4_VWB4_WGM1_WGMXCC1_WGMXCCGn1
    SolutionIndex: 57
    SolutionNameMin: Cijk_Alik_Bjlk_HSS_BH_UserArgs_MT128x128x32_MI16x16x1_SN_LDSB1_CLR1_GSU0_GSUC0_GSUWGMRR0_K1_LBSPPA256_LBSPPB1024_LPB32_MIWT4_4_PLR1_SU32_SUM0_SUS256_SKXCCM6_VWA4_VWB2_WGM4_WGMXCC1_WGMXCCGn1
    SolutionIndex: 58
    SolutionNameMin: Cijk_Alik_Bjlk_HSS_BH_UserArgs_MT128x128x32_MI16x16x1_SN_LDSB1_CLR1_GSU0_GSUC0_GSUWGMRR0_K1_LBSPPA128_LBSPPB1024_LPB0_MIWT4_4_PLR1_SU32_SUM0_SUS256_SKXCCM6_VWA1_VWB4_WGM4_WGMXCC1_WGMXCCGn1
    SolutionIndex: 59
    SolutionNameMin: Cijk_Alik_Bjlk_HSS_BH_UserArgs_MT128x128x32_MI16x16x1_SN_LDSB1_CLR1_GSU0_GSUC0_GSUWGMRR0_K1_LBSPPA128_LBSPPB1024_LPB16_MIWT4_4_PLR1_SU32_SUM0_SUS256_SKXCCM6_VWA1_VWB1_WGM8_WGMXCC1_WGMXCCGn1
    SolutionIndex: 60
    SolutionNameMin: Cijk_Alik_Bjlk_HSS_BH_UserArgs_MT128x128x32_MI16x16x1_SN_LDSB1_CLR1_GSU0_GSUC0_GSUWGMRR0_K1_LBSPPA256_LBSPPB1024_LPB16_MIWT4_4_PLR1_SU32_SUM0_SUS256_SKXCCM6_VWA4_VWB1_WGM8_WGMXCC1_WGMXCCGn1
    SolutionIndex: 61
    SolutionNameMin: Cijk_Alik_Bjlk_HSS_BH_UserArgs_MT128x128x32_MI16x16x1_SN_LDSB1_CLR1_GSU0_GSUC0_GSUWGMRR0_K1_LBSPPA256_LBSPPB1024_LPB32_MIWT4_4_PLR1_SU32_SUM0_SUS256_SKXCCM6_VWA4_VWB2_WGM8_WGMXCC1_WGMXCCGn1
    SolutionIndex: 62
    SolutionNameMin: Cijk_Alik_Bjlk_HSS_BH_UserArgs_MT128x128x32_MI16x16x1_SN_LDSB1_CLR1_GSU0_GSUC0_GSUWGMRR0_K1_LBSPPA128_LBSPPB1024_LPB0_MIWT4_4_PLR1_SU32_SUM0_SUS256_SKXCCM6_VWA1_VWB4_WGM8_WGMXCC1_WGMXCCGn1
    SolutionIndex: 63
    SolutionNameMin: Cijk_Alik_Bjlk_HSS_BH_UserArgs_MT128x128x32_MI16x16x1_SN_LDSB1_CLR1_GSU0_GSUC0_GSUWGMRR0_K1_LBSPPA256_LBSPPB1024_LPB0_MIWT4_4_PLR1_SU32_SUM0_SUS256_SKXCCM6_VWA4_VWB4_WGM8_WGMXCC1_WGMXCCGn1
    SolutionIndex: 64
    SolutionNameMin: Cijk_Alik_Bjlk_HSS_BH_UserArgs_MT64x128x32_MI16x16x1_SN_LDSB0_CLR0_GSU0_GSUC0_GSUWGMRR0_K1_LBSPPA128_LBSPPB1024_LPB0_MIWT2_4_PLR0_SU32_SUM0_SUS256_SKXCCM6_VWA1_VWB4_WGM8_WGMXCC1_WGMXCCGn1
    SolutionIndex: 65
    SolutionNameMin: Cijk_Alik_Bjlk_HSS_BH_UserArgs_MT32x32x32_MI16x16x1_SN_LDSB0_CLR1_GSU0_GSUC0_GSUWGMRR0_K1_LBSPPA128_LBSPPB256_LPB16_MIWT1_1_PLR1_SU32_SUM0_SUS256_SKXCCM6_VWA1_VWB1_WGM1_WGMXCC1_WGMXCCGn1
    SolutionIndex: 66
    SolutionNameMin: Cijk_Alik_Bjlk_HSS_BH_UserArgs_MT128x256x64_MI16x16x1_SN_LDSB1_CLR1_GSU0_GSUC0_GSUWGMRR0_K1_LBSPPA512_LBSPPB4096_LPB0_MIWT4_8_PLR1_SU32_SUM0_SUS256_SKXCCM6_VWA4_VWB4_WGM1_WGMXCC1_WGMXCCGn1
    SolutionIndex: 67
    SolutionNameMin: Cijk_Alik_Bjlk_HSS_BH_UserArgs_MT128x256x64_MI16x16x1_SN_LDSB1_CLR1_GSU0_GSUC0_GSUWGMRR0_K1_LBSPPA128_LBSPPB4096_LPB0_MIWT4_8_PLR1_SU32_SUM0_SUS256_SKXCCM6_VWA1_VWB4_WGM4_WGMXCC1_WGMXCCGn1
    SolutionIndex: 68
    SolutionNameMin: Cijk_Alik_Bjlk_HSS_BH_UserArgs_MT128x256x64_MI16x16x1_SN_LDSB1_CLR1_GSU0_GSUC0_GSUWGMRR0_K1_LBSPPA512_LBSPPB4096_LPB0_MIWT4_8_PLR1_SU32_SUM0_SUS256_SKXCCM6_VWA4_VWB4_WGM4_WGMXCC1_WGMXCCGn1
    SolutionIndex: 69
    SolutionNameMin: Cijk_Alik_Bjlk_HSS_BH_UserArgs_MT128x256x64_MI16x16x1_SN_LDSB1_CLR1_GSU0_GSUC0_GSUWGMRR0_K1_LBSPPA128_LBSPPB4096_LPB0_MIWT4_8_PLR1_SU32_SUM0_SUS256_SKXCCM6_VWA1_VWB4_WGM8_WGMXCC1_WGMXCCGn1
    SolutionIndex: 70
    SolutionNameMin: Cijk_Alik_Bjlk_HSS_BH_UserArgs_MT256x128x64_MI16x16x1_SN_LDSB1_CLR1_GSU0_GSUC0_GSUWGMRR0_K1_LBSPPA512_LBSPPB2048_LPB0_MIWT8_4_PLR1_SU32_SUM0_SUS256_SKXCCM6_VWA4_VWB4_WGM1_WGMXCC1_WGMXCCGn1
    SolutionIndex: 71
    SolutionNameMin: Cijk_Alik_Bjlk_HSS_BH_UserArgs_MT256x128x64_MI16x16x1_SN_LDSB1_CLR1_GSU0_GSUC0_GSUWGMRR0_K1_LBSPPA512_LBSPPB2048_LPB0_MIWT8_4_PLR1_SU32_SUM0_SUS256_SKXCCM6_VWA4_VWB4_WGM4_WGMXCC1_WGMXCCGn1
    SolutionIndex: 72
    SolutionNameMin: Cijk_Alik_Bjlk_HSS_BH_UserArgs_MT256x128x64_MI16x16x1_SN_LDSB1_CLR1_GSU0_GSUC0_GSUWGMRR0_K1_LBSPPA512_LBSPPB2048_LPB0_MIWT8_4_PLR1_SU32_SUM0_SUS256_SKXCCM6_VWA4_VWB4_WGM8_WGMXCC1_WGMXCCGn1
    SolutionIndex: 73
    SolutionNameMin: Cijk_Alik_Bjlk_HSS_BH_UserArgs_MT128x128x64_MI16x16x1_SN_LDSB1_CLR1_GSU0_GSUC0_GSUWGMRR0_K1_LBSPPA128_LBSPPB2048_LPB0_MIWT4_4_PLR1_SU32_SUM0_SUS256_SKXCCM6_VWA1_VWB4_WGM1_WGMXCC1_WGMXCCGn1
    SolutionIndex: 74
    SolutionNameMin: Cijk_Alik_Bjlk_HSS_BH_UserArgs_MT128x128x64_MI16x16x1_SN_LDSB1_CLR1_GSU0_GSUC0_GSUWGMRR0_K1_LBSPPA512_LBSPPB2048_LPB0_MIWT4_4_PLR1_SU32_SUM0_SUS256_SKXCCM6_VWA4_VWB4_WGM1_WGMXCC1_WGMXCCGn1
    SolutionIndex: 75
    SolutionNameMin: Cijk_Alik_Bjlk_HSS_BH_UserArgs_MT128x128x64_MI16x16x1_SN_LDSB1_CLR1_GSU0_GSUC0_GSUWGMRR0_K1_LBSPPA512_LBSPPB2048_LPB0_MIWT4_4_PLR1_SU32_SUM0_SUS256_SKXCCM6_VWA4_VWB4_WGM4_WGMXCC1_WGMXCCGn1
    SolutionIndex: 76
    SolutionNameMin: Cijk_Alik_Bjlk_HSS_BH_UserArgs_MT128x128x64_MI16x16x1_SN_LDSB1_CLR1_GSU0_GSUC0_GSUWGMRR0_K1_LBSPPA512_LBSPPB2048_LPB0_MIWT4_4_PLR1_SU32_SUM0_SUS256_SKXCCM6_VWA4_VWB4_WGM8_WGMXCC1_WGMXCCGn1
    SolutionIndex: 77
    SolutionNameMin: Cijk_Alik_Bjlk_HSS_BH_UserArgs_MT64x128x64_MI16x16x1_SN_LDSB1_CLR1_GSU0_GSUC0_GSUWGMRR0_K1_LBSPPA128_LBSPPB2048_LPB0_MIWT2_4_PLR1_SU32_SUM0_SUS256_SKXCCM6_VWA1_VWB4_WGM1_WGMXCC1_WGMXCCGn1
    SolutionIndex: 78
    SolutionNameMin: Cijk_Alik_Bjlk_HSS_BH_UserArgs_MT64x128x64_MI16x16x1_SN_LDSB1_CLR1_GSU0_GSUC0_GSUWGMRR0_K1_LBSPPA128_LBSPPB2048_LPB0_MIWT2_4_PLR1_SU32_SUM0_SUS256_SKXCCM6_VWA1_VWB4_WGM4_WGMXCC1_WGMXCCGn1
    SolutionIndex: 79
    SolutionNameMin: Cijk_Alik_Bjlk_HSS_BH_UserArgs_MT64x128x64_MI16x16x1_SN_LDSB1_CLR1_GSU0_GSUC0_GSUWGMRR0_K1_LBSPPA128_LBSPPB2048_LPB32_MIWT2_4_PLR1_SU32_SUM0_SUS256_SKXCCM6_VWA1_VWB2_WGM8_WGMXCC1_WGMXCCGn1
    SolutionIndex: 80
    SolutionNameMin: Cijk_Alik_Bjlk_HSS_BH_UserArgs_MT64x128x64_MI16x16x1_SN_LDSB1_CLR1_GSU0_GSUC0_GSUWGMRR0_K1_LBSPPA128_LBSPPB2048_LPB0_MIWT2_4_PLR1_SU32_SUM0_SUS256_SKXCCM6_VWA1_VWB4_WGM8_WGMXCC1_WGMXCCGn1
    SolutionIndex: 81
    SolutionNameMin: Cijk_Alik_Bjlk_HSS_BH_UserArgs_MT64x128x64_MI16x16x1_SN_LDSB1_CLR1_GSU0_GSUC0_GSUWGMRR0_K1_LBSPPA256_LBSPPB2048_LPB0_MIWT2_4_PLR1_SU32_SUM0_SUS256_SKXCCM6_VWA2_VWB4_WGM8_WGMXCC1_WGMXCCGn1
    SolutionIndex: 82
    SolutionNameMin: Cijk_Alik_Bjlk_HSS_BH_UserArgs_MT64x128x64_MI16x16x1_SN_LDSB1_CLR1_GSU0_GSUC0_GSUWGMRR0_K1_LBSPPA128_LBSPPB2048_LPB0_MIWT2_4_PLR2_SU32_SUM0_SUS256_SKXCCM6_VWA1_VWB4_WGM8_WGMXCC1_WGMXCCGn1
    SolutionIndex: 83
    SolutionNameMin: Cijk_Alik_Bjlk_HSS_BH_UserArgs_MT128x64x64_MI16x16x1_SN_LDSB1_CLR1_GSU0_GSUC0_GSUWGMRR0_K1_LBSPPA128_LBSPPB1024_LPB32_MIWT4_2_PLR1_SU32_SUM0_SUS256_SKXCCM6_VWA1_VWB2_WGM1_WGMXCC1_WGMXCCGn1
    SolutionIndex: 84
    SolutionNameMin: Cijk_Alik_Bjlk_HSS_BH_UserArgs_MT128x64x64_MI16x16x1_SN_LDSB1_CLR1_GSU0_GSUC0_GSUWGMRR0_K1_LBSPPA512_LBSPPB1024_LPB32_MIWT4_2_PLR1_SU32_SUM0_SUS256_SKXCCM6_VWA4_VWB2_WGM1_WGMXCC1_WGMXCCGn1
    SolutionIndex: 85
    SolutionNameMin: Cijk_Alik_Bjlk_HSS_BH_UserArgs_MT128x64x64_MI16x16x1_SN_LDSB1_CLR1_GSU0_GSUC0_GSUWGMRR0_K1_LBSPPA128_LBSPPB1024_LPB32_MIWT4_2_PLR2_SU32_SUM0_SUS256_SKXCCM6_VWA1_VWB2_WGM1_WGMXCC1_WGMXCCGn1
    SolutionIndex: 86
    SolutionNameMin: Cijk_Alik_Bjlk_HSS_BH_UserArgs_MT128x64x64_MI16x16x1_SN_LDSB1_CLR1_GSU0_GSUC0_GSUWGMRR0_K1_LBSPPA512_LBSPPB1024_LPB32_MIWT4_2_PLR2_SU32_SUM0_SUS256_SKXCCM6_VWA4_VWB2_WGM1_WGMXCC1_WGMXCCGn1
    SolutionIndex: 87
    SolutionNameMin: Cijk_Alik_Bjlk_HSS_BH_UserArgs_MT128x64x64_MI16x16x1_SN_LDSB1_CLR1_GSU0_GSUC0_GSUWGMRR0_K1_LBSPPA512_LBSPPB1024_LPB32_MIWT4_2_PLR1_SU32_SUM0_SUS256_SKXCCM6_VWA4_VWB2_WGM4_WGMXCC1_WGMXCCGn1
    SolutionIndex: 88
    SolutionNameMin: Cijk_Alik_Bjlk_HSS_BH_UserArgs_MT128x64x64_MI16x16x1_SN_LDSB1_CLR1_GSU0_GSUC0_GSUWGMRR0_K1_LBSPPA128_LBSPPB1024_LPB32_MIWT4_2_PLR1_SU32_SUM0_SUS256_SKXCCM6_VWA1_VWB2_WGM8_WGMXCC1_WGMXCCGn1
    SolutionIndex: 89
    SolutionNameMin: Cijk_Alik_Bjlk_HSS_BH_UserArgs_MT128x64x64_MI16x16x1_SN_LDSB1_CLR1_GSU0_GSUC0_GSUWGMRR0_K1_LBSPPA512_LBSPPB1024_LPB32_MIWT4_2_PLR1_SU32_SUM0_SUS256_SKXCCM6_VWA4_VWB2_WGM8_WGMXCC1_WGMXCCGn1
    SolutionIndex: 90
    SolutionNameMin: Cijk_Alik_Bjlk_HSS_BH_UserArgs_MT128x64x64_MI16x16x1_SN_LDSB1_CLR1_GSU0_GSUC0_GSUWGMRR0_K1_LBSPPA512_LBSPPB1024_LPB32_MIWT4_2_PLR2_SU32_SUM0_SUS256_SKXCCM6_VWA4_VWB2_WGM8_WGMXCC1_WGMXCCGn1
    SolutionIndex: 91
    SolutionNameMin: Cijk_Alik_Bjlk_HSS_BH_UserArgs_MT64x64x64_MI16x16x1_SN_LDSB1_CLR1_GSU0_GSUC0_GSUWGMRR0_K1_LBSPPA128_LBSPPB1024_LPB32_MIWT2_2_PLR1_SU32_SUM0_SUS256_SKXCCM6_VWA1_VWB2_WGM1_WGMXCC1_WGMXCCGn1
    SolutionIndex: 92
    SolutionNameMin: Cijk_Alik_Bjlk_HSS_BH_UserArgs_MT64x64x64_MI16x16x1_SN_LDSB1_CLR1_GSU0_GSUC0_GSUWGMRR0_K1_LBSPPA256_LBSPPB1024_LPB32_MIWT2_2_PLR1_SU32_SUM0_SUS256_SKXCCM6_VWA2_VWB2_WGM1_WGMXCC1_WGMXCCGn1
    SolutionIndex: 93
    SolutionNameMin: Cijk_Alik_Bjlk_HSS_BH_UserArgs_MT64x64x64_MI16x16x1_SN_LDSB1_CLR1_GSU0_GSUC0_GSUWGMRR0_K1_LBSPPA128_LBSPPB1024_LPB32_MIWT2_2_PLR1_SU32_SUM0_SUS256_SKXCCM6_VWA1_VWB2_WGM4_WGMXCC1_WGMXCCGn1
    SolutionIndex: 94
    SolutionNameMin: Cijk_Alik_Bjlk_HSS_BH_UserArgs_MT64x64x64_MI16x16x1_SN_LDSB1_CLR1_GSU0_GSUC0_GSUWGMRR0_K1_LBSPPA256_LBSPPB1024_LPB32_MIWT2_2_PLR1_SU32_SUM0_SUS256_SKXCCM6_VWA2_VWB2_WGM4_WGMXCC1_WGMXCCGn1
    SolutionIndex: 95
    SolutionNameMin: Cijk_Alik_Bjlk_HSS_BH_UserArgs_MT64x64x64_MI16x16x1_SN_LDSB1_CLR1_GSU0_GSUC0_GSUWGMRR0_K1_LBSPPA128_LBSPPB1024_LPB32_MIWT2_2_PLR2_SU32_SUM0_SUS256_SKXCCM6_VWA1_VWB2_WGM4_WGMXCC1_WGMXCCGn1
    SolutionIndex: 96
    SolutionNameMin: Cijk_Alik_Bjlk_HSS_BH_UserArgs_MT64x64x64_MI16x16x1_SN_LDSB1_CLR1_GSU0_GSUC0_GSUWGMRR0_K1_LBSPPA128_LBSPPB1024_LPB32_MIWT2_2_PLR1_SU32_SUM0_SUS256_SKXCCM6_VWA1_VWB2_WGM8_WGMXCC1_WGMXCCGn1
    SolutionIndex: 97
    SolutionNameMin: Cijk_Alik_Bjlk_HSS_BH_UserArgs_MT64x64x64_MI16x16x1_SN_LDSB1_CLR1_GSU0_GSUC0_GSUWGMRR0_K1_LBSPPA256_LBSPPB1024_LPB32_MIWT2_2_PLR1_SU32_SUM0_SUS256_SKXCCM6_VWA2_VWB2_WGM8_WGMXCC1_WGMXCCGn1
    SolutionIndex: 98
    SolutionNameMin: Cijk_Alik_Bjlk_HSS_BH_UserArgs_MT32x32x64_MI16x16x1_SN_LDSB0_CLR1_GSU0_GSUC0_GSUWGMRR0_K1_LBSPPA128_LBSPPB512_LPB16_MIWT1_1_PLR1_SU32_SUM0_SUS256_SKXCCM6_VWA1_VWB1_WGM1_WGMXCC1_WGMXCCGn1
    SolutionIndex: 99
    SolutionNameMin: Cijk_Alik_Bjlk_HSS_BH_UserArgs_MT32x64x128_MI16x16x1_SN_LDSB1_CLR1_GSU0_GSUC0_GSUWGMRR0_K1_LBSPPA256_LBSPPB1024_LPB32_MIWT1_2_PLR1_SU32_SUM0_SUS256_SKXCCM6_VWA1_VWB2_WGM1_WGMXCC1_WGMXCCGn1
    SolutionIndex: 100
    SolutionNameMin: Cijk_Alik_Bjlk_HSS_BH_UserArgs_MT32x64x128_MI16x16x1_SN_LDSB1_CLR1_GSU0_GSUC0_GSUWGMRR0_K1_LBSPPA256_LBSPPB1024_LPB32_MIWT1_2_PLR2_SU32_SUM0_SUS256_SKXCCM6_VWA1_VWB2_WGM1_WGMXCC1_WGMXCCGn1
    SolutionIndex: 101
    SolutionNameMin: Cijk_Alik_Bjlk_HSS_BH_UserArgs_MT32x64x128_MI16x16x1_SN_LDSB1_CLR1_GSU0_GSUC0_GSUWGMRR0_K1_LBSPPA256_LBSPPB1024_LPB32_MIWT1_2_PLR1_SU32_SUM0_SUS256_SKXCCM6_VWA1_VWB2_WGM4_WGMXCC1_WGMXCCGn1
    SolutionIndex: 102
    SolutionNameMin: Cijk_Alik_Bjlk_HSS_BH_UserArgs_MT32x64x128_MI16x16x1_SN_LDSB1_CLR1_GSU0_GSUC0_GSUWGMRR0_K1_LBSPPA256_LBSPPB1024_LPB32_MIWT1_2_PLR2_SU32_SUM0_SUS256_SKXCCM6_VWA1_VWB2_WGM4_WGMXCC1_WGMXCCGn1
    SolutionIndex: 103
    SolutionNameMin: Cijk_Alik_Bjlk_HSS_BH_UserArgs_MT32x64x128_MI16x16x1_SN_LDSB1_CLR1_GSU0_GSUC0_GSUWGMRR0_K1_LBSPPA256_LBSPPB1024_LPB32_MIWT1_2_PLR2_SU32_SUM0_SUS256_SKXCCM6_VWA1_VWB2_WGM8_WGMXCC1_WGMXCCGn1
    SolutionIndex: 104
    SolutionNameMin: Cijk_Alik_Bjlk_HSS_BH_UserArgs_MT64x32x128_MI16x16x1_SN_LDSB1_CLR1_GSU0_GSUC0_GSUWGMRR0_K1_LBSPPA512_LBSPPB512_LPB16_MIWT2_1_PLR2_SU32_SUM0_SUS256_SKXCCM6_VWA2_VWB1_WGM1_WGMXCC1_WGMXCCGn1
    SolutionIndex: 105
    SolutionNameMin: Cijk_Alik_Bjlk_HSS_BH_UserArgs_MT32x32x128_MI16x16x1_SN_LDSB1_CLR1_GSU0_GSUC0_GSUWGMRR0_K1_LBSPPA256_LBSPPB512_LPB16_MIWT1_1_PLR1_SU32_SUM0_SUS256_SKXCCM6_VWA1_VWB1_WGM1_WGMXCC1_WGMXCCGn1
    SolutionIndex: 106
    SolutionNameMin: Cijk_Alik_Bjlk_HSS_BH_UserArgs_MT32x32x128_MI16x16x1_SN_LDSB1_CLR1_GSU0_GSUC0_GSUWGMRR0_K1_LBSPPA256_LBSPPB512_LPB16_MIWT1_1_PLR2_SU32_SUM0_SUS256_SKXCCM6_VWA1_VWB1_WGM1_WGMXCC1_WGMXCCGn1
    SolutionIndex: 107
    SolutionNameMin: Cijk_Alik_Bjlk_HSS_BH_UserArgs_MT32x32x32_MI16x16x1_SN_LDSB0_CLR0_GSU0_GSUC0_GSUWGMRR0_K1_LBSPPA128_LBSPPB256_LPB16_MIWT1_1_PLR0_SU32_SUM0_SUS256_SKXCCM6_VWA1_VWB1_WGM8_WGMXCC1_WGMXCCGn1
- - - [128, 128, 1, 128, 128, 128, 128, 128]
    - [31, 0.075]
  - - [128, 128, 1, 256, 128, 128, 256, 128]
    - [30, 0.108]
  - - [128, 128, 1, 512, 128, 128, 512, 128]
    - [30, 0.177]
  - - [128, 128, 1, 1024, 128, 128, 1024, 128]
    - [105, 0.271]
  - - [128, 128, 1, 2048, 128, 128, 2048, 128]
    - [98, 0.359]
  - - [128, 128, 1, 4096, 128, 128, 4096, 128]
    - [98, 0.689]
  - - [128, 128, 1, 8192, 128, 128, 8192, 128]
    - [106, 1.286]
  - - [128, 256, 1, 128, 128, 128, 128, 256]
    - [30, 0.165]
  - - [128, 256, 1, 256, 128, 128, 256, 256]
    - [30, 0.212]
  - - [128, 256, 1, 512, 128, 128, 512, 256]
    - [29, 0.352]
  - - [128, 256, 1, 1024, 128, 128, 1024, 256]
    - [98, 0.542]
  - - [128, 256, 1, 2048, 128, 128, 2048, 256]
    - [105, 1.006]
  - - [128, 256, 1, 4096, 128, 128, 4096, 256]
    - [30, 1.696]
  - - [128, 256, 1, 8192, 128, 128, 8192, 256]
    - [30, 2.849]
  - - [128, 512, 1, 128, 128, 128, 128, 512]
    - [30, 0.327]
  - - [128, 512, 1, 256, 128, 128, 256, 512]
    - [29, 0.414]
  - - [128, 512, 1, 512, 128, 128, 512, 512]
    - [65, 0.666]
  - - [128, 512, 1, 1024, 128, 128, 1024, 512]
    - [65, 1.224]
  - - [128, 512, 1, 2048, 128, 128, 2048, 512]
    - [106, 2.204]
  - - [128, 512, 1, 4096, 128, 128, 4096, 512]
    - [29, 3.368]
  - - [128, 512, 1, 8192, 128, 128, 8192, 512]
    - [100, 4.782]
  - - [128, 1024, 1, 128, 128, 128, 128, 1024]
    - [29, 0.641]
  - - [128, 1024, 1, 256, 128, 128, 256, 1024]
    - [29, 0.785]
  - - [128, 1024, 1, 512, 128, 128, 512, 1024]
    - [29, 1.407]
  - - [128, 1024, 1, 1024, 128, 128, 1024, 1024]
    - [106, 2.399]
  - - [128, 1024, 1, 2048, 128, 128, 2048, 1024]
    - [100, 3.743]
  - - [128, 1024, 1, 4096, 128, 128, 4096, 1024]
    - [100, 5.466]
  - - [128, 1024, 1, 8192, 128, 128, 8192, 1024]
    - [91, 7.135]
  - - [128, 2048, 1, 128, 128, 128, 128, 2048]
    - [27, 1.166]
  - - [128, 2048, 1, 256, 128, 128, 256, 2048]
    - [29, 1.922]
  - - [128, 2048, 1, 512, 128, 128, 512, 2048]
    - [29, 3.046]
  - - [128, 2048, 1, 1024, 128, 128, 1024, 2048]
    - [106, 4.282]
  - - [128, 2048, 1, 2048, 128, 128, 2048, 2048]
    - [100, 6.023]
  - - [128, 2048, 1, 4096, 128, 128, 4096, 2048]
    - [93, 8.381]
  - - [128, 2048, 1, 8192, 128, 128, 8192, 2048]
    - [18, 9.553]
  - - [128, 4096, 1, 128, 128, 128, 128, 4096]
    - [24, 1.997]
  - - [128, 4096, 1, 256, 128, 128, 256, 4096]
    - [24, 3.329]
  - - [128, 4096, 1, 512, 128, 128, 512, 4096]
    - [100, 5.101]
  - - [128, 4096, 1, 1024, 128, 128, 1024, 4096]
    - [100, 7.286]
  - - [128, 4096, 1, 2048, 128, 128, 2048, 4096]
    - [97, 9.309]
  - - [128, 4096, 1, 4096, 128, 128, 4096, 4096]
    - [89, 11.419]
  - - [128, 4096, 1, 8192, 128, 128, 8192, 4096]
    - [90, 12.737]
  - - [128, 8192, 1, 128, 128, 128, 128, 8192]
    - [21, 3.303]
  - - [128, 8192, 1, 256, 128, 128, 256, 8192]
    - [92, 5.445]
  - - [128, 8192, 1, 512, 128, 128, 512, 8192]
    - [96, 8.173]
  - - [128, 8192, 1, 1024, 128, 128, 1024, 8192]
    - [91, 10.895]
  - - [128, 8192, 1, 2048, 128, 128, 2048, 8192]
    - [92, 12.155]
  - - [128, 8192, 1, 4096, 128, 128, 4096, 8192]
    - [18, 14.165]
  - - [128, 8192, 1, 8192, 128, 128, 8192, 8192]
    - [13, 15.91]
  - - [256, 128, 1, 128, 256, 256, 128, 128]
    - [29, 0.165]
  - - [256, 128, 1, 256, 256, 256, 256, 128]
    - [30, 0.211]
  - - [256, 128, 1, 512, 256, 256, 512, 128]
    - [30, 0.353]
  - - [256, 128, 1, 1024, 256, 256, 1024, 128]
    - [98, 0.549]
  - - [256, 128, 1, 2048, 256, 256, 2048, 128]
    - [106, 1.002]
  - - [256, 128, 1, 4096, 256, 256, 4096, 128]
    - [106, 1.688]
  - - [256, 128, 1, 8192, 256, 256, 8192, 128]
    - [30, 2.851]
  - - [256, 256, 1, 128, 256, 256, 128, 256]
    - [30, 0.322]
  - - [256, 256, 1, 256, 256, 256, 256, 256]
    - [29, 0.408]
  - - [256, 256, 1, 512, 256, 256, 512, 256]
    - [105, 0.673]
  - - [256, 256, 1, 1024, 256, 256, 1024, 256]
    - [65, 1.225]
  - - [256, 256, 1, 2048, 256, 256, 2048, 256]
    - [106, 2.205]
  - - [256, 256, 1, 4096, 256, 256, 4096, 256]
    - [106, 3.392]
  - - [256, 256, 1, 8192, 256, 256, 8192, 256]
    - [27, 5.006]
  - - [256, 512, 1, 128, 256, 256, 128, 512]
    - [30, 0.623]
  - - [256, 512, 1, 256, 256, 256, 256, 512]
    - [30, 0.777]
  - - [256, 512, 1, 512, 256, 256, 512, 512]
    - [29, 1.4]
  - - [256, 512, 1, 1024, 256, 256, 1024, 512]
    - [29, 2.381]
  - - [256, 512, 1, 2048, 256, 256, 2048, 512]
    - [99, 3.82]
  - - [256, 512, 1, 4096, 256, 256, 4096, 512]
    - [100, 5.868]
  - - [256, 512, 1, 8192, 256, 256, 8192, 512]
    - [101, 7.573]
  - - [256, 1024, 1, 128, 256, 256, 128, 1024]
    - [27, 1.152]
  - - [256, 1024, 1, 256, 256, 256, 256, 1024]
    - [29, 1.89]
  - - [256, 1024, 1, 512, 256, 256, 512, 1024]
    - [30, 2.985]
  - - [256, 1024, 1, 1024, 256, 256, 1024, 1024]
    - [30, 4.317]
  - - [256, 1024, 1, 2048, 256, 256, 2048, 1024]
    - [102, 6.151]
  - - [256, 1024, 1, 4096, 256, 256, 4096, 1024]
    - [97, 8.487]
  - - [256, 1024, 1, 8192, 256, 256, 8192, 1024]
    - [14, 9.663]
  - - [256, 2048, 1, 128, 256, 256, 128, 2048]
    - [24, 1.99]
  - - [256, 2048, 1, 256, 256, 256, 256, 2048]
    - [24, 3.34]
  - - [256, 2048, 1, 512, 256, 256, 512, 2048]
    - [27, 5.136]
  - - [256, 2048, 1, 1024, 256, 256, 1024, 2048]
    - [100, 7.256]
  - - [256, 2048, 1, 2048, 256, 256, 2048, 2048]
    - [93, 9.464]
  - - [256, 2048, 1, 4096, 256, 256, 4096, 2048]
    - [84, 11.145]
  - - [256, 2048, 1, 8192, 256, 256, 8192, 2048]
    - [86, 12.278]
  - - [256, 4096, 1, 128, 256, 256, 128, 4096]
    - [22, 3.214]
  - - [256, 4096, 1, 256, 256, 256, 256, 4096]
    - [22, 5.462]
  - - [256, 4096, 1, 512, 256, 256, 512, 4096]
    - [91, 8.239]
  - - [256, 4096, 1, 1024, 256, 256, 1024, 4096]
    - [91, 11.309]
  - - [256, 4096, 1, 2048, 256, 256, 2048, 4096]
    - [91, 12.721]
  - - [256, 4096, 1, 4096, 256, 256, 4096, 4096]
    - [89, 14.115]
  - - [256, 4096, 1, 8192, 256, 256, 8192, 4096]
    - [74, 14.86]
  - - [256, 8192, 1, 128, 256, 256, 128, 8192]
    - [18, 4.683]
  - - [256, 8192, 1, 256, 256, 256, 256, 8192]
    - [17, 7.818]
  - - [256, 8192, 1, 512, 256, 256, 512, 8192]
    - [77, 11.257]
  - - [256, 8192, 1, 1024, 256, 256, 1024, 8192]
    - [83, 14.247]
  - - [256, 8192, 1, 2048, 256, 256, 2048, 8192]
    - [84, 15.224]
  - - [256, 8192, 1, 4096, 256, 256, 4096, 8192]
    - [76, 15.86]
  - - [256, 8192, 1, 8192, 256, 256, 8192, 8192]
    - [8, 17.142]
  - - [512, 128, 1, 128, 512, 512, 128, 128]
    - [29, 0.33]
  - - [512, 128, 1, 256, 512, 512, 256, 128]
    - [30, 0.409]
  - - [512, 128, 1, 512, 512, 512, 512, 128]
    - [65, 0.671]
  - - [512, 128, 1, 1024, 512, 512, 1024, 128]
    - [65, 1.23]
  - - [512, 128, 1, 2048, 512, 512, 2048, 128]
    - [106, 2.206]
  - - [512, 128, 1, 4096, 512, 512, 4096, 128]
    - [106, 3.438]
  - - [512, 128, 1, 8192, 512, 512, 8192, 128]
    - [103, 4.952]
  - - [512, 256, 1, 128, 512, 512, 128, 256]
    - [29, 0.636]
  - - [512, 256, 1, 256, 512, 512, 256, 256]
    - [29, 0.777]
  - - [512, 256, 1, 512, 512, 512, 512, 256]
    - [29, 1.42]
  - - [512, 256, 1, 1024, 512, 512, 1024, 256]
    - [106, 2.38]
  - - [512, 256, 1, 2048, 512, 512, 2048, 256]
    - [104, 3.798]
  - - [512, 256, 1, 4096, 512, 512, 4096, 256]
    - [103, 5.961]
  - - [512, 256, 1, 8192, 512, 512, 8192, 256]
    - [102, 7.603]
  - - [512, 512, 1, 128, 512, 512, 128, 512]
    - [26, 1.155]
  - - [512, 512, 1, 256, 512, 512, 256, 512]
    - [29, 1.913]
  - - [512, 512, 1, 512, 512, 512, 512, 512]
    - [30, 3.044]
  - - [512, 512, 1, 1024, 512, 512, 1024, 512]
    - [30, 4.344]
  - - [512, 512, 1, 2048, 512, 512, 2048, 512]
    - [100, 6.416]
  - - [512, 512, 1, 4096, 512, 512, 4096, 512]
    - [91, 8.546]
  - - [512, 512, 1, 8192, 512, 512, 8192, 512]
    - [95, 9.443]
  - - [512, 1024, 1, 128, 512, 512, 128, 1024]
    - [24, 1.997]
  - - [512, 1024, 1, 256, 512, 512, 256, 1024]
    - [24, 3.324]
  - - [512, 1024, 1, 512, 512, 512, 512, 1024]
    - [27, 5.171]
  - - [512, 1024, 1, 1024, 512, 512, 1024, 1024]
    - [27, 7.322]
  - - [512, 1024, 1, 2048, 512, 512, 2048, 1024]
    - [94, 9.572]
  - - [512, 1024, 1, 4096, 512, 512, 4096, 1024]
    - [89, 10.859]
  - - [512, 1024, 1, 8192, 512, 512, 8192, 1024]
    - [86, 11.88]
  - - [512, 2048, 1, 128, 512, 512, 128, 2048]
    - [21, 3.279]
  - - [512, 2048, 1, 256, 512, 512, 256, 2048]
    - [21, 5.547]
  - - [512, 2048, 1, 512, 512, 512, 512, 2048]
    - [23, 8.228]
  - - [512, 2048, 1, 1024, 512, 512, 1024, 2048]
    - [96, 11.011]
  - - [512, 2048, 1, 2048, 512, 512, 2048, 2048]
    - [91, 13.019]
  - - [512, 2048, 1, 4096, 512, 512, 4096, 2048]
    - [82, 12.727]
  - - [512, 2048, 1, 8192, 512, 512, 8192, 2048]
    - [74, 14.155]
  - - [512, 4096, 1, 128, 512, 512, 128, 4096]
    - [18, 4.749]
  - - [512, 4096, 1, 256, 512, 512, 256, 4096]
    - [17, 7.874]
  - - [512, 4096, 1, 512, 512, 512, 512, 4096]
    - [77, 11.335]
  - - [512, 4096, 1, 1024, 512, 512, 1024, 4096]
    - [84, 14.45]
  - - [512, 4096, 1, 2048, 512, 512, 2048, 4096]
    - [84, 15.647]
  - - [512, 4096, 1, 4096, 512, 512, 4096, 4096]
    - [76, 15.762]
  - - [512, 4096, 1, 8192, 512, 512, 8192, 4096]
    - [70, 16.783]
  - - [512, 8192, 1, 128, 512, 512, 128, 8192]
    - [62, 5.895]
  - - [512, 8192, 1, 256, 512, 512, 256, 8192]
    - [62, 9.277]
  - - [512, 8192, 1, 512, 512, 512, 512, 8192]
    - [54, 12.361]
  - - [512, 8192, 1, 1024, 512, 512, 1024, 8192]
    - [74, 15.018]
  - - [512, 8192, 1, 2048, 512, 512, 2048, 8192]
    - [74, 17.609]
  - - [512, 8192, 1, 4096, 512, 512, 4096, 8192]
    - [8, 16.963]
  - - [512, 8192, 1, 8192, 512, 512, 8192, 8192]
    - [35, 19.942]
  - - [1024, 128, 1, 128, 1024, 1024, 128, 128]
    - [29, 0.629]
  - - [1024, 128, 1, 256, 1024, 1024, 256, 128]
    - [29, 0.782]
  - - [1024, 128, 1, 512, 1024, 1024, 512, 128]
    - [30, 1.403]
  - - [1024, 128, 1, 1024, 1024, 1024, 1024, 128]
    - [106, 2.417]
  - - [1024, 128, 1, 2048, 1024, 1024, 2048, 128]
    - [99, 3.821]
  - - [1024, 128, 1, 4096, 1024, 1024, 4096, 128]
    - [100, 6.045]
  - - [1024, 128, 1, 8192, 1024, 1024, 8192, 128]
    - [103, 7.756]
  - - [1024, 256, 1, 128, 1024, 1024, 128, 256]
    - [27, 1.155]
  - - [1024, 256, 1, 256, 1024, 1024, 256, 256]
    - [29, 1.915]
  - - [1024, 256, 1, 512, 1024, 1024, 512, 256]
    - [29, 3.058]
  - - [1024, 256, 1, 1024, 1024, 1024, 1024, 256]
    - [29, 4.358]
  - - [1024, 256, 1, 2048, 1024, 1024, 2048, 256]
    - [100, 6.428]
  - - [1024, 256, 1, 4096, 1024, 1024, 4096, 256]
    - [96, 8.473]
  - - [1024, 256, 1, 8192, 1024, 1024, 8192, 256]
    - [93, 9.845]
  - - [1024, 512, 1, 128, 1024, 1024, 128, 512]
    - [24, 2.012]
  - - [1024, 512, 1, 256, 1024, 1024, 256, 512]
    - [24, 3.369]
  - - [1024, 512, 1, 512, 1024, 1024, 512, 512]
    - [24, 5.21]
  - - [1024, 512, 1, 1024, 1024, 1024, 1024, 512]
    - [27, 7.345]
  - - [1024, 512, 1, 2048, 1024, 1024, 2048, 512]
    - [96, 9.931]
  - - [1024, 512, 1, 4096, 1024, 1024, 4096, 512]
    - [97, 11.026]
  - - [1024, 512, 1, 8192, 1024, 1024, 8192, 512]
    - [78, 11.622]
  - - [1024, 1024, 1, 128, 1024, 1024, 128, 1024]
    - [21, 3.238]
  - - [1024, 1024, 1, 256, 1024, 1024, 256, 1024]
    - [21, 5.584]
  - - [1024, 1024, 1, 512, 1024, 1024, 512, 1024]
    - [21, 8.281]
  - - [1024, 1024, 1, 1024, 1024, 1024, 1024, 1024]
    - [23, 11.078]
  - - [1024, 1024, 1, 2048, 1024, 1024, 2048, 1024]
    - [92, 12.434]
  - - [1024, 1024, 1, 4096, 1024, 1024, 4096, 1024]
    - [80, 12.877]
  - - [1024, 1024, 1, 8192, 1024, 1024, 8192, 1024]
    - [75, 15.332]
  - - [1024, 2048, 1, 128, 1024, 1024, 128, 2048]
    - [7, 4.665]
  - - [1024, 2048, 1, 256, 1024, 1024, 256, 2048]
    - [10, 7.845]
  - - [1024, 2048, 1, 512, 1024, 1024, 512, 2048]
    - [78, 11.25]
  - - [1024, 2048, 1, 1024, 1024, 1024, 1024, 2048]
    - [77, 13.901]
  - - [1024, 2048, 1, 2048, 1024, 1024, 2048, 2048]
    - [85, 15.181]
  - - [1024, 2048, 1, 4096, 1024, 1024, 4096, 2048]
    - [76, 15.923]
  - - [1024, 2048, 1, 8192, 1024, 1024, 8192, 2048]
    - [70, 16.597]
  - - [1024, 4096, 1, 128, 1024, 1024, 128, 4096]
    - [63, 6.08]
  - - [1024, 4096, 1, 256, 1024, 1024, 256, 4096]
    - [63, 9.426]
  - - [1024, 4096, 1, 512, 1024, 1024, 512, 4096]
    - [56, 12.538]
  - - [1024, 4096, 1, 1024, 1024, 1024, 1024, 4096]
    - [56, 15.164]
  - - [1024, 4096, 1, 2048, 1024, 1024, 2048, 4096]
    - [74, 18.293]
  - - [1024, 4096, 1, 4096, 1024, 1024, 4096, 4096]
    - [51, 17.369]
  - - [1024, 4096, 1, 8192, 1024, 1024, 8192, 4096]
    - [35, 19.791]
  - - [1024, 8192, 1, 128, 1024, 1024, 128, 8192]
    - [4, 6.355]
  - - [1024, 8192, 1, 256, 1024, 1024, 256, 8192]
    - [43, 10.176]
  - - [1024, 8192, 1, 512, 1024, 1024, 512, 8192]
    - [46, 14.525]
  - - [1024, 8192, 1, 1024, 1024, 1024, 1024, 8192]
    - [42, 18.722]
  - - [1024, 8192, 1, 2048, 1024, 1024, 2048, 8192]
    - [72, 19.284]
  - - [1024, 8192, 1, 4096, 1024, 1024, 4096, 8192]
    - [34, 19.486]
  - - [1024, 8192, 1, 8192, 1024, 1024, 8192, 8192]
    - [35, 22.496]
  - - [2048, 128, 1, 128, 2048, 2048, 128, 128]
    - [27, 1.164]
  - - [2048, 128, 1, 256, 2048, 2048, 256, 128]
    - [29, 1.899]
  - - [2048, 128, 1, 512, 2048, 2048, 512, 128]
    - [29, 3.031]
  - - [2048, 128, 1, 1024, 2048, 2048, 1024, 128]
    - [106, 4.31]
  - - [2048, 128, 1, 2048, 2048, 2048, 2048, 128]
    - [100, 6.496]
  - - [2048, 128, 1, 4096, 2048, 2048, 4096, 128]
    - [93, 8.395]
  - - [2048, 128, 1, 8192, 2048, 2048, 8192, 128]
    - [19, 9.906]
  - - [2048, 256, 1, 128, 2048, 2048, 128, 256]
    - [25, 1.998]
  - - [2048, 256, 1, 256, 2048, 2048, 256, 256]
    - [24, 3.374]
  - - [2048, 256, 1, 512, 2048, 2048, 512, 256]
    - [27, 5.203]
  - - [2048, 256, 1, 1024, 2048, 2048, 1024, 256]
    - [100, 7.266]
  - - [2048, 256, 1, 2048, 2048, 2048, 2048, 256]
    - [93, 9.95]
  - - [2048, 256, 1, 4096, 2048, 2048, 4096, 256]
    - [78, 10.79]
  - - [2048, 256, 1, 8192, 2048, 2048, 8192, 256]
    - [64, 11.902]
  - - [2048, 512, 1, 128, 2048, 2048, 128, 512]
    - [23, 3.25]
  - - [2048, 512, 1, 256, 2048, 2048, 256, 512]
    - [21, 5.571]
  - - [2048, 512, 1, 512, 2048, 2048, 512, 512]
    - [96, 8.238]
  - - [2048, 512, 1, 1024, 2048, 2048, 1024, 512]
    - [96, 11.309]
  - - [2048, 512, 1, 2048, 2048, 2048, 2048, 512]
    - [96, 12.816]
  - - [2048, 512, 1, 4096, 2048, 2048, 4096, 512]
    - [89, 13.032]
  - - [2048, 512, 1, 8192, 2048, 2048, 8192, 512]
    - [76, 14.695]
  - - [2048, 1024, 1, 128, 2048, 2048, 128, 1024]
    - [14, 4.753]
  - - [2048, 1024, 1, 256, 2048, 2048, 256, 1024]
    - [15, 7.806]
  - - [2048, 1024, 1, 512, 2048, 2048, 512, 1024]
    - [78, 11.271]
  - - [2048, 1024, 1, 1024, 2048, 2048, 1024, 1024]
    - [13, 13.991]
  - - [2048, 1024, 1, 2048, 2048, 2048, 2048, 1024]
    - [80, 15.0]
  - - [2048, 1024, 1, 4096, 2048, 2048, 4096, 1024]
    - [76, 16.32]
  - - [2048, 1024, 1, 8192, 2048, 2048, 8192, 1024]
    - [76, 16.784]
  - - [2048, 2048, 1, 128, 2048, 2048, 128, 2048]
    - [61, 5.953]
  - - [2048, 2048, 1, 256, 2048, 2048, 256, 2048]
    - [52, 9.189]
  - - [2048, 2048, 1, 512, 2048, 2048, 512, 2048]
    - [63, 12.448]
  - - [2048, 2048, 1, 1024, 2048, 2048, 1024, 2048]
    - [55, 15.445]
  - - [2048, 2048, 1, 2048, 2048, 2048, 2048, 2048]
    - [73, 17.671]
  - - [2048, 2048, 1, 4096, 2048, 2048, 4096, 2048]
    - [48, 16.856]
  - - [2048, 2048, 1, 8192, 2048, 2048, 8192, 2048]
    - [36, 19.543]
  - - [2048, 4096, 1, 128, 2048, 2048, 128, 4096]
    - [41, 6.362]
  - - [2048, 4096, 1, 256, 2048, 2048, 256, 4096]
    - [2, 10.172]
  - - [2048, 4096, 1, 512, 2048, 2048, 512, 4096]
    - [3, 14.412]
  - - [2048, 4096, 1, 1024, 2048, 2048, 1024, 4096]
    - [50, 18.36]
  - - [2048, 4096, 1, 2048, 2048, 2048, 2048, 4096]
    - [67, 19.026]
  - - [2048, 4096, 1, 4096, 2048, 2048, 4096, 4096]
    - [38, 19.759]
  - - [2048, 4096, 1, 8192, 2048, 2048, 8192, 4096]
    - [35, 22.572]
  - - [2048, 8192, 1, 128, 2048, 2048, 128, 8192]
    - [84, 6.627]
  - - [2048, 8192, 1, 256, 2048, 2048, 256, 8192]
    - [34, 9.944]
  - - [2048, 8192, 1, 512, 2048, 2048, 512, 8192]
    - [35, 14.47]
  - - [2048, 8192, 1, 1024, 2048, 2048, 1024, 8192]
    - [0, 17.599]
  - - [2048, 8192, 1, 2048, 2048, 2048, 2048, 8192]
    - [66, 18.738]
  - - [2048, 8192, 1, 4096, 2048, 2048, 4096, 8192]
    - [34, 22.466]
  - - [2048, 8192, 1, 8192, 2048, 2048, 8192, 8192]
    - [34, 23.606]
  - - [4096, 128, 1, 128, 4096, 4096, 128, 128]
    - [28, 2.007]
  - - [4096, 128, 1, 256, 4096, 4096, 256, 128]
    - [24, 3.351]
  - - [4096, 128, 1, 512, 4096, 4096, 512, 128]
    - [26, 5.231]
  - - [4096, 128, 1, 1024, 4096, 4096, 1024, 128]
    - [100, 7.261]
  - - [4096, 128, 1, 2048, 4096, 4096, 2048, 128]
    - [96, 9.471]
  - - [4096, 128, 1, 4096, 4096, 4096, 4096, 128]
    - [20, 10.476]
  - - [4096, 128, 1, 8192, 4096, 4096, 8192, 128]
    - [77, 12.529]
  - - [4096, 256, 1, 128, 4096, 4096, 128, 256]
    - [22, 3.234]
  - - [4096, 256, 1, 256, 4096, 4096, 256, 256]
    - [21, 5.538]
  - - [4096, 256, 1, 512, 4096, 4096, 512, 256]
    - [96, 8.211]
  - - [4096, 256, 1, 1024, 4096, 4096, 1024, 256]
    - [96, 11.296]
  - - [4096, 256, 1, 2048, 4096, 4096, 2048, 256]
    - [96, 12.536]
  - - [4096, 256, 1, 4096, 4096, 4096, 4096, 256]
    - [11, 13.424]
  - - [4096, 256, 1, 8192, 4096, 4096, 8192, 256]
    - [76, 14.814]
  - - [4096, 512, 1, 128, 4096, 4096, 128, 512]
    - [12, 4.743]
  - - [4096, 512, 1, 256, 4096, 4096, 256, 512]
    - [78, 7.714]
  - - [4096, 512, 1, 512, 4096, 4096, 512, 512]
    - [80, 11.395]
  - - [4096, 512, 1, 1024, 4096, 4096, 1024, 512]
    - [80, 14.308]
  - - [4096, 512, 1, 2048, 4096, 4096, 2048, 512]
    - [81, 15.349]
  - - [4096, 512, 1, 4096, 4096, 4096, 4096, 512]
    - [75, 15.546]
  - - [4096, 512, 1, 8192, 4096, 4096, 8192, 512]
    - [68, 16.813]
  - - [4096, 1024, 1, 128, 4096, 4096, 128, 1024]
    - [61, 6.21]
  - - [4096, 1024, 1, 256, 4096, 4096, 256, 1024]
    - [59, 9.468]
  - - [4096, 1024, 1, 512, 4096, 4096, 512, 1024]
    - [61, 12.837]
  - - [4096, 1024, 1, 1024, 4096, 4096, 1024, 1024]
    - [53, 14.933]
  - - [4096, 1024, 1, 2048, 4096, 4096, 2048, 1024]
    - [75, 17.674]
  - - [4096, 1024, 1, 4096, 4096, 4096, 4096, 1024]
    - [71, 17.011]
  - - [4096, 1024, 1, 8192, 4096, 4096, 8192, 1024]
    - [38, 19.431]
  - - [4096, 2048, 1, 128, 4096, 4096, 128, 2048]
    - [6, 6.227]
  - - [4096, 2048, 1, 256, 4096, 4096, 256, 2048]
    - [2, 9.908]
  - - [4096, 2048, 1, 512, 4096, 4096, 512, 2048]
    - [46, 14.271]
  - - [4096, 2048, 1, 1024, 4096, 4096, 1024, 2048]
    - [51, 18.076]
  - - [4096, 2048, 1, 2048, 4096, 4096, 2048, 2048]
    - [72, 19.155]
  - - [4096, 2048, 1, 4096, 4096, 4096, 4096, 2048]
    - [38, 19.356]
  - - [4096, 2048, 1, 8192, 4096, 4096, 8192, 2048]
    - [36, 21.839]
  - - [4096, 4096, 1, 128, 4096, 4096, 128, 4096]
    - [16, 6.374]
  - - [4096, 4096, 1, 256, 4096, 4096, 256, 4096]
    - [35, 9.91]
  - - [4096, 4096, 1, 512, 4096, 4096, 512, 4096]
    - [37, 13.971]
  - - [4096, 4096, 1, 1024, 4096, 4096, 1024, 4096]
    - [38, 17.675]
  - - [4096, 4096, 1, 2048, 4096, 4096, 2048, 4096]
    - [66, 18.834]
  - - [4096, 4096, 1, 4096, 4096, 4096, 4096, 4096]
    - [34, 21.885]
  - - [4096, 4096, 1, 8192, 4096, 4096, 8192, 4096]
    - [35, 23.894]
  - - [4096, 8192, 1, 128, 4096, 4096, 128, 8192]
    - [57, 5.494]
  - - [4096, 8192, 1, 256, 4096, 4096, 256, 8192]
    - [57, 8.291]
  - - [4096, 8192, 1, 512, 4096, 4096, 512, 8192]
    - [41, 12.259]
  - - [4096, 8192, 1, 1024, 4096, 4096, 1024, 8192]
    - [48, 16.688]
  - - [4096, 8192, 1, 2048, 4096, 4096, 2048, 8192]
    - [33, 20.808]
  - - [4096, 8192, 1, 4096, 4096, 4096, 4096, 8192]
    - [45, 22.914]
  - - [4096, 8192, 1, 8192, 4096, 4096, 8192, 8192]
    - [1, 25.131]
  - - [8192, 128, 1, 128, 8192, 8192, 128, 128]
    - [21, 3.306]
  - - [8192, 128, 1, 256, 8192, 8192, 256, 128]
    - [22, 5.481]
  - - [8192, 128, 1, 512, 8192, 8192, 512, 128]
    - [93, 8.204]
  - - [8192, 128, 1, 1024, 8192, 8192, 1024, 128]
    - [93, 10.881]
  - - [8192, 128, 1, 2048, 8192, 8192, 2048, 128]
    - [96, 12.151]
  - - [8192, 128, 1, 4096, 8192, 8192, 4096, 128]
    - [9, 14.001]
  - - [8192, 128, 1, 8192, 8192, 8192, 8192, 128]
    - [11, 15.816]
  - - [8192, 256, 1, 128, 8192, 8192, 128, 256]
    - [87, 4.642]
  - - [8192, 256, 1, 256, 8192, 8192, 256, 256]
    - [88, 7.766]
  - - [8192, 256, 1, 512, 8192, 8192, 512, 256]
    - [78, 11.037]
  - - [8192, 256, 1, 1024, 8192, 8192, 1024, 256]
    - [79, 13.377]
  - - [8192, 256, 1, 2048, 8192, 8192, 2048, 256]
    - [82, 14.637]
  - - [8192, 256, 1, 4096, 8192, 8192, 4096, 256]
    - [74, 16.065]
  - - [8192, 256, 1, 8192, 8192, 8192, 8192, 256]
    - [5, 17.297]
  - - [8192, 512, 1, 128, 8192, 8192, 128, 512]
    - [60, 5.691]
  - - [8192, 512, 1, 256, 8192, 8192, 256, 512]
    - [59, 9.085]
  - - [8192, 512, 1, 512, 8192, 8192, 512, 512]
    - [62, 12.452]
  - - [8192, 512, 1, 1024, 8192, 8192, 1024, 512]
    - [58, 15.085]
  - - [8192, 512, 1, 2048, 8192, 8192, 2048, 512]
    - [76, 17.565]
  - - [8192, 512, 1, 4096, 8192, 8192, 4096, 512]
    - [4, 17.656]
  - - [8192, 512, 1, 8192, 8192, 8192, 8192, 512]
    - [39, 19.755]
  - - [8192, 1024, 1, 128, 8192, 8192, 128, 1024]
    - [47, 6.227]
  - - [8192, 1024, 1, 256, 8192, 8192, 256, 1024]
    - [49, 10.088]
  - - [8192, 1024, 1, 512, 8192, 8192, 512, 1024]
    - [50, 14.678]
  - - [8192, 1024, 1, 1024, 8192, 8192, 1024, 1024]
    - [45, 18.04]
  - - [8192, 1024, 1, 2048, 8192, 8192, 2048, 1024]
    - [69, 19.307]
  - - [8192, 1024, 1, 4096, 8192, 8192, 4096, 1024]
    - [36, 19.15]
  - - [8192, 1024, 1, 8192, 8192, 8192, 8192, 1024]
    - [36, 21.54]
  - - [8192, 2048, 1, 128, 8192, 8192, 128, 2048]
    - [32, 6.332]
  - - [8192, 2048, 1, 256, 8192, 8192, 256, 2048]
    - [37, 9.967]
  - - [8192, 2048, 1, 512, 8192, 8192, 512, 2048]
    - [37, 14.216]
  - - [8192, 2048, 1, 1024, 8192, 8192, 1024, 2048]
    - [39, 18.183]
  - - [8192, 2048, 1, 2048, 8192, 8192, 2048, 2048]
    - [66, 18.348]
  - - [8192, 2048, 1, 4096, 8192, 8192, 4096, 2048]
    - [39, 21.001]
  - - [8192, 2048, 1, 8192, 8192, 8192, 8192, 2048]
    - [39, 23.043]
  - - [8192, 4096, 1, 128, 8192, 8192, 128, 4096]
    - [12, 5.52]
  - - [8192, 4096, 1, 256, 8192, 8192, 256, 4096]
    - [44, 8.115]
  - - [8192, 4096, 1, 512, 8192, 8192, 512, 4096]
    - [44, 12.357]
  - - [8192, 4096, 1, 1024, 8192, 8192, 1024, 4096]
    - [41, 17.02]
  - - [8192, 4096, 1, 2048, 8192, 8192, 2048, 4096]
    - [34, 21.047]
  - - [8192, 4096, 1, 4096, 8192, 8192, 4096, 4096]
    - [34, 23.236]
  - - [8192, 4096, 1, 8192, 8192, 8192, 8192, 4096]
    - [35, 25.159]
  - - [8192, 8192, 1, 128, 8192, 8192, 128, 8192]
    - [40, 5.472]
  - - [8192, 8192, 1, 256, 8192, 8192, 256, 8192]
    - [44, 8.929]
  - - [8192, 8192, 1, 512, 8192, 8192, 512, 8192]
    - [50, 13.545]
  - - [8192, 8192, 1, 1024, 8192, 8192, 1024, 8192]
    - [39, 18.155]
  - - [8192, 8192, 1, 2048, 8192, 8192, 2048, 8192]
    - [39, 22.641]
  - - [8192, 8192, 1, 4096, 8192, 8192, 4096, 8192]
    - [39, 25.548]
  - - [8192, 8192, 1, 8192, 8192, 8192, 8192, 8192]
    - [39, 25.903]
  - - [1, 1, 1, 32, 1, 1, 32, 1]
    - [107, 0.0]
- null
- null
- DeviceEfficiency
- GridBased
