library/src/amd_detail/rocblaslt/src/Tensile/Logic/streamk/gfx942a/aquavanjaram942_Cijk_Alik_Bljk_HSS_BH_UserArgs.yaml
- {MinimumRequiredVersion: 4.33.0}
- aquavanjaram942
- gfx942
- [Device 0049, Device 0050]
    SolutionIndex: 0
    SolutionNameMin: Cijk_Alik_Bljk_HSS_BH_UserArgs_MT128x128x64_MI16x16x1_SN_LDSB1_CLR1_GSU0_GSUC0_GSUWGMRR0_K1_LBSPPA128_LBSPPB128_MIWT4_4_PLR1_SU32_SUM0_SUS256_SKXCCM0_VWA1_VWB1_WGM1_WGMXCC1_WGMXCCGn1
    SolutionIndex: 1
    SolutionNameMin: Cijk_Alik_Bljk_HSS_BH_UserArgs_MT128x128x64_MI16x16x1_SN_LDSB1_CLR1_GSU0_GSUC0_GSUWGMRR0_K1_LBSPPA512_LBSPPB128_MIWT4_4_PLR1_SU32_SUM0_SUS256_SKXCCM0_VWA4_VWB1_WGM1_WGMXCC1_WGMXCCGn1
    SolutionIndex: 2
    SolutionNameMin: Cijk_Alik_Bljk_HSS_BH_UserArgs_MT128x128x64_MI16x16x1_SN_LDSB1_CLR1_GSU0_GSUC0_GSUWGMRR0_K1_LBSPPA512_LBSPPB128_MIWT4_4_PLR2_SU32_SUM0_SUS256_SKXCCM0_VWA4_VWB1_WGM1_WGMXCC1_WGMXCCGn1
    SolutionIndex: 3
    SolutionNameMin: Cijk_Alik_Bljk_HSS_BH_UserArgs_MT128x128x64_MI16x16x1_SN_LDSB1_CLR1_GSU0_GSUC0_GSUWGMRR0_K1_LBSPPA512_LBSPPB128_MIWT4_4_PLR1_SU32_SUM0_SUS256_SKXCCM0_VWA4_VWB1_WGM4_WGMXCC1_WGMXCCGn1
    SolutionIndex: 4
    SolutionNameMin: Cijk_Alik_Bljk_HSS_BH_UserArgs_MT128x128x64_MI16x16x1_SN_LDSB1_CLR1_GSU0_GSUC0_GSUWGMRR0_K1_LBSPPA512_LBSPPB256_MIWT4_4_PLR1_SU32_SUM0_SUS256_SKXCCM0_VWA4_VWB2_WGM4_WGMXCC1_WGMXCCGn1
    SolutionIndex: 5
    SolutionNameMin: Cijk_Alik_Bljk_HSS_BH_UserArgs_MT64x128x64_MI16x16x1_SN_LDSB1_CLR1_GSU0_GSUC0_GSUWGMRR0_K1_LBSPPA128_LBSPPB256_MIWT2_4_PLR2_SU32_SUM0_SUS256_SKXCCM0_VWA1_VWB2_WGM1_WGMXCC1_WGMXCCGn1
    SolutionIndex: 6
    SolutionNameMin: Cijk_Alik_Bljk_HSS_BH_UserArgs_MT64x128x64_MI16x16x1_SN_LDSB1_CLR1_GSU0_GSUC0_GSUWGMRR0_K1_LBSPPA128_LBSPPB256_MIWT2_4_PLR1_SU32_SUM0_SUS256_SKXCCM0_VWA1_VWB2_WGM4_WGMXCC1_WGMXCCGn1
    SolutionIndex: 7
    SolutionNameMin: Cijk_Alik_Bljk_HSS_BH_UserArgs_MT64x128x64_MI16x16x1_SN_LDSB1_CLR1_GSU0_GSUC0_GSUWGMRR0_K1_LBSPPA128_LBSPPB512_MIWT2_4_PLR1_SU32_SUM0_SUS256_SKXCCM0_VWA1_VWB4_WGM4_WGMXCC1_WGMXCCGn1
    SolutionIndex: 8
    SolutionNameMin: Cijk_Alik_Bljk_HSS_BH_UserArgs_MT64x128x64_MI16x16x1_SN_LDSB1_CLR1_GSU0_GSUC0_GSUWGMRR0_K1_LBSPPA128_LBSPPB128_MIWT2_4_PLR1_SU32_SUM0_SUS256_SKXCCM0_VWA1_VWB1_WGM8_WGMXCC1_WGMXCCGn1
    SolutionIndex: 9
    SolutionNameMin: Cijk_Alik_Bljk_HSS_BH_UserArgs_MT64x128x64_MI16x16x1_SN_LDSB1_CLR1_GSU0_GSUC0_GSUWGMRR0_K1_LBSPPA128_LBSPPB512_MIWT2_4_PLR1_SU32_SUM0_SUS256_SKXCCM0_VWA1_VWB4_WGM8_WGMXCC1_WGMXCCGn1
    SolutionIndex: 10
    SolutionNameMin: Cijk_Alik_Bljk_HSS_BH_UserArgs_MT128x64x64_MI16x16x1_SN_LDSB1_CLR1_GSU0_GSUC0_GSUWGMRR0_K1_LBSPPA512_LBSPPB128_MIWT4_2_PLR1_SU32_SUM0_SUS256_SKXCCM0_VWA4_VWB1_WGM1_WGMXCC1_WGMXCCGn1
    SolutionIndex: 11
    SolutionNameMin: Cijk_Alik_Bljk_HSS_BH_UserArgs_MT128x64x64_MI16x16x1_SN_LDSB1_CLR1_GSU0_GSUC0_GSUWGMRR0_K1_LBSPPA512_LBSPPB128_MIWT4_2_PLR2_SU32_SUM0_SUS256_SKXCCM0_VWA4_VWB1_WGM1_WGMXCC1_WGMXCCGn1
    SolutionIndex: 12
    SolutionNameMin: Cijk_Alik_Bljk_HSS_BH_UserArgs_MT128x64x64_MI16x16x1_SN_LDSB1_CLR1_GSU0_GSUC0_GSUWGMRR0_K1_LBSPPA128_LBSPPB256_MIWT4_2_PLR1_SU32_SUM0_SUS256_SKXCCM0_VWA1_VWB2_WGM4_WGMXCC1_WGMXCCGn1
    SolutionIndex: 13
    SolutionNameMin: Cijk_Alik_Bljk_HSS_BH_UserArgs_MT128x64x64_MI16x16x1_SN_LDSB1_CLR1_GSU0_GSUC0_GSUWGMRR0_K1_LBSPPA512_LBSPPB128_MIWT4_2_PLR2_SU32_SUM0_SUS256_SKXCCM0_VWA4_VWB1_WGM4_WGMXCC1_WGMXCCGn1
    SolutionIndex: 14
    SolutionNameMin: Cijk_Alik_Bljk_HSS_BH_UserArgs_MT128x64x64_MI16x16x1_SN_LDSB1_CLR1_GSU0_GSUC0_GSUWGMRR0_K1_LBSPPA512_LBSPPB128_MIWT4_2_PLR1_SU32_SUM0_SUS256_SKXCCM0_VWA4_VWB1_WGM8_WGMXCC1_WGMXCCGn1
    SolutionIndex: 15
    SolutionNameMin: Cijk_Alik_Bljk_HSS_BH_UserArgs_MT128x64x64_MI16x16x1_SN_LDSB1_CLR1_GSU0_GSUC0_GSUWGMRR0_K1_LBSPPA128_LBSPPB256_MIWT4_2_PLR1_SU32_SUM0_SUS256_SKXCCM0_VWA1_VWB2_WGM8_WGMXCC1_WGMXCCGn1
    SolutionIndex: 16
    SolutionNameMin: Cijk_Alik_Bljk_HSS_BH_UserArgs_MT128x64x64_MI16x16x1_SN_LDSB1_CLR1_GSU0_GSUC0_GSUWGMRR0_K1_LBSPPA512_LBSPPB256_MIWT4_2_PLR1_SU32_SUM0_SUS256_SKXCCM0_VWA4_VWB2_WGM8_WGMXCC1_WGMXCCGn1
    SolutionIndex: 17
    SolutionNameMin: Cijk_Alik_Bljk_HSS_BH_UserArgs_MT64x64x64_MI16x16x1_SN_LDSB1_CLR1_GSU0_GSUC0_GSUWGMRR0_K1_LBSPPA128_LBSPPB128_MIWT2_2_PLR1_SU32_SUM0_SUS256_SKXCCM0_VWA1_VWB1_WGM1_WGMXCC1_WGMXCCGn1
    SolutionIndex: 18
    SolutionNameMin: Cijk_Alik_Bljk_HSS_BH_UserArgs_MT64x64x64_MI16x16x1_SN_LDSB1_CLR1_GSU0_GSUC0_GSUWGMRR0_K1_LBSPPA128_LBSPPB256_MIWT2_2_PLR1_SU32_SUM0_SUS256_SKXCCM0_VWA1_VWB2_WGM1_WGMXCC1_WGMXCCGn1
    SolutionIndex: 19
    SolutionNameMin: Cijk_Alik_Bljk_HSS_BH_UserArgs_MT64x64x64_MI16x16x1_SN_LDSB1_CLR1_GSU0_GSUC0_GSUWGMRR0_K1_LBSPPA128_LBSPPB256_MIWT2_2_PLR1_SU32_SUM0_SUS256_SKXCCM0_VWA1_VWB2_WGM4_WGMXCC1_WGMXCCGn1
    SolutionIndex: 20
    SolutionNameMin: Cijk_Alik_Bljk_HSS_BH_UserArgs_MT64x64x64_MI16x16x1_SN_LDSB1_CLR1_GSU0_GSUC0_GSUWGMRR0_K1_LBSPPA128_LBSPPB256_MIWT2_2_PLR1_SU32_SUM0_SUS256_SKXCCM0_VWA1_VWB2_WGM8_WGMXCC1_WGMXCCGn1
    SolutionIndex: 21
    SolutionNameMin: Cijk_Alik_Bljk_HSS_BH_UserArgs_MT32x64x64_MI16x16x1_SN_LDSB0_CLR1_GSU0_GSUC0_GSUWGMRR0_K1_LBSPPA128_LBSPPB128_MIWT1_2_PLR1_SU32_SUM0_SUS256_SKXCCM0_VWA1_VWB1_WGM1_WGMXCC1_WGMXCCGn1
    SolutionIndex: 22
    SolutionNameMin: Cijk_Alik_Bljk_HSS_BH_UserArgs_MT32x64x64_MI16x16x1_SN_LDSB0_CLR1_GSU0_GSUC0_GSUWGMRR0_K1_LBSPPA128_LBSPPB256_MIWT1_2_PLR1_SU32_SUM0_SUS256_SKXCCM0_VWA1_VWB2_WGM1_WGMXCC1_WGMXCCGn1
    SolutionIndex: 23
    SolutionNameMin: Cijk_Alik_Bljk_HSS_BH_UserArgs_MT64x32x64_MI16x16x1_SN_LDSB0_CLR1_GSU0_GSUC0_GSUWGMRR0_K1_LBSPPA128_LBSPPB128_MIWT2_1_PLR1_SU32_SUM0_SUS256_SKXCCM0_VWA1_VWB1_WGM1_WGMXCC1_WGMXCCGn1
    SolutionIndex: 24
    SolutionNameMin: Cijk_Alik_Bljk_HSS_BH_UserArgs_MT64x32x64_MI16x16x1_SN_LDSB0_CLR1_GSU0_GSUC0_GSUWGMRR0_K1_LBSPPA128_LBSPPB128_MIWT2_1_PLR2_SU32_SUM0_SUS256_SKXCCM0_VWA1_VWB1_WGM1_WGMXCC1_WGMXCCGn1
    SolutionIndex: 25
    SolutionNameMin: Cijk_Alik_Bljk_HSS_BH_UserArgs_MT64x32x64_MI16x16x1_SN_LDSB0_CLR1_GSU0_GSUC0_GSUWGMRR0_K1_LBSPPA256_LBSPPB128_MIWT2_1_PLR2_SU32_SUM0_SUS256_SKXCCM0_VWA2_VWB1_WGM1_WGMXCC1_WGMXCCGn1
    SolutionIndex: 26
    SolutionNameMin: Cijk_Alik_Bljk_HSS_BH_UserArgs_MT32x64x128_MI16x16x1_SN_LDSB1_CLR1_GSU0_GSUC0_GSUWGMRR0_K1_LBSPPA256_LBSPPB256_MIWT1_2_PLR1_SU32_SUM0_SUS256_SKXCCM0_VWA1_VWB1_WGM1_WGMXCC1_WGMXCCGn1
    SolutionIndex: 27
    SolutionNameMin: Cijk_Alik_Bljk_HSS_BH_UserArgs_MT32x64x128_MI16x16x1_SN_LDSB1_CLR1_GSU0_GSUC0_GSUWGMRR0_K1_LBSPPA256_LBSPPB512_MIWT1_2_PLR1_SU32_SUM0_SUS256_SKXCCM0_VWA1_VWB2_WGM1_WGMXCC1_WGMXCCGn1
    SolutionIndex: 28
    SolutionNameMin: Cijk_Alik_Bljk_HSS_BH_UserArgs_MT32x64x128_MI16x16x1_SN_LDSB1_CLR1_GSU0_GSUC0_GSUWGMRR0_K1_LBSPPA256_LBSPPB256_MIWT1_2_PLR2_SU32_SUM0_SUS256_SKXCCM0_VWA1_VWB1_WGM1_WGMXCC1_WGMXCCGn1
    SolutionIndex: 29
    SolutionNameMin: Cijk_Alik_Bljk_HSS_BH_UserArgs_MT64x32x128_MI16x16x1_SN_LDSB1_CLR1_GSU0_GSUC0_GSUWGMRR0_K1_LBSPPA256_LBSPPB256_MIWT2_1_PLR1_SU32_SUM0_SUS256_SKXCCM0_VWA1_VWB1_WGM1_WGMXCC1_WGMXCCGn1
    SolutionIndex: 30
    SolutionNameMin: Cijk_Alik_Bljk_HSS_BH_UserArgs_MT64x32x128_MI16x16x1_SN_LDSB1_CLR1_GSU0_GSUC0_GSUWGMRR0_K1_LBSPPA256_LBSPPB256_MIWT2_1_PLR2_SU32_SUM0_SUS256_SKXCCM0_VWA1_VWB1_WGM1_WGMXCC1_WGMXCCGn1
    SolutionIndex: 31
    SolutionNameMin: Cijk_Alik_Bljk_HSS_BH_UserArgs_MT32x32x128_MI16x16x1_SN_LDSB1_CLR1_GSU0_GSUC0_GSUWGMRR0_K1_LBSPPA256_LBSPPB256_MIWT1_1_PLR1_SU32_SUM0_SUS256_SKXCCM0_VWA1_VWB1_WGM1_WGMXCC1_WGMXCCGn1
    SolutionIndex: 32
    SolutionNameMin: Cijk_Alik_Bljk_HSS_BH_UserArgs_MT32x32x128_MI16x16x1_SN_LDSB1_CLR1_GSU0_GSUC0_GSUWGMRR0_K1_LBSPPA256_LBSPPB256_MIWT1_1_PLR2_SU32_SUM0_SUS256_SKXCCM0_VWA1_VWB1_WGM1_WGMXCC1_WGMXCCGn1
    SolutionIndex: 33
    SolutionNameMin: Cijk_Alik_Bljk_HSS_BH_UserArgs_MT128x128x32_MI16x16x1_SN_LDSB1_CLR1_GSU0_GSUC0_GSUWGMRR0_K1_LBSPPA128_LBSPPB128_MIWT4_4_PLR1_SU32_SUM0_SUS256_SKXCCM6_VWA1_VWB2_WGM1_WGMXCC1_WGMXCCGn1
    SolutionIndex: 34
    SolutionNameMin: Cijk_Alik_Bljk_HSS_BH_UserArgs_MT128x128x32_MI16x16x1_SN_LDSB1_CLR1_GSU0_GSUC0_GSUWGMRR0_K1_LBSPPA128_LBSPPB128_MIWT4_4_PLR1_SU32_SUM0_SUS256_SKXCCM6_VWA1_VWB1_WGM4_WGMXCC1_WGMXCCGn1
    SolutionIndex: 35
    SolutionNameMin: Cijk_Alik_Bljk_HSS_BH_UserArgs_MT128x128x32_MI16x16x1_SN_LDSB1_CLR1_GSU0_GSUC0_GSUWGMRR0_K1_LBSPPA256_LBSPPB128_MIWT4_4_PLR1_SU32_SUM0_SUS256_SKXCCM6_VWA4_VWB1_WGM8_WGMXCC1_WGMXCCGn1
    SolutionIndex: 36
    SolutionNameMin: Cijk_Alik_Bljk_HSS_BH_UserArgs_MT128x128x32_MI16x16x1_SN_LDSB1_CLR1_GSU0_GSUC0_GSUWGMRR0_K1_LBSPPA128_LBSPPB128_MIWT4_4_PLR1_SU32_SUM0_SUS256_SKXCCM6_VWA1_VWB2_WGM8_WGMXCC1_WGMXCCGn1
    SolutionIndex: 37
    SolutionNameMin: Cijk_Alik_Bljk_HSS_BH_UserArgs_MT128x128x32_MI16x16x1_SN_LDSB1_CLR1_GSU0_GSUC0_GSUWGMRR0_K1_LBSPPA128_LBSPPB256_MIWT4_4_PLR1_SU32_SUM0_SUS256_SKXCCM6_VWA1_VWB4_WGM8_WGMXCC1_WGMXCCGn1
    SolutionIndex: 38
    SolutionNameMin: Cijk_Alik_Bljk_HSS_BH_UserArgs_MT128x128x32_MI16x16x1_SN_LDSB1_CLR1_GSU0_GSUC0_GSUWGMRR0_K1_LBSPPA256_LBSPPB256_MIWT4_4_PLR1_SU32_SUM0_SUS256_SKXCCM6_VWA4_VWB4_WGM8_WGMXCC1_WGMXCCGn1
    SolutionIndex: 39
    SolutionNameMin: Cijk_Alik_Bljk_HSS_BH_UserArgs_MT32x32x32_MI16x16x1_SN_LDSB0_CLR0_GSU0_GSUC0_GSUWGMRR0_K1_LBSPPA128_LBSPPB128_MIWT1_1_PLR0_SU32_SUM0_SUS256_SKXCCM6_VWA1_VWB1_WGM1_WGMXCC1_WGMXCCGn1
    SolutionIndex: 40
    SolutionNameMin: Cijk_Alik_Bljk_HSS_BH_UserArgs_MT256x64x64_MI16x16x1_SN_LDSB1_CLR1_GSU0_GSUC0_GSUWGMRR0_K1_LBSPPA512_LBSPPB256_MIWT8_2_PLR1_SU32_SUM0_SUS256_SKXCCM6_VWA4_VWB2_WGM1_WGMXCC1_WGMXCCGn1
    SolutionIndex: 41
    SolutionNameMin: Cijk_Alik_Bljk_HSS_BH_UserArgs_MT128x128x64_MI16x16x1_SN_LDSB1_CLR1_GSU0_GSUC0_GSUWGMRR0_K1_LBSPPA128_LBSPPB128_MIWT4_4_PLR1_SU32_SUM0_SUS256_SKXCCM6_VWA1_VWB1_WGM1_WGMXCC1_WGMXCCGn1
    SolutionIndex: 42
    SolutionNameMin: Cijk_Alik_Bljk_HSS_BH_UserArgs_MT128x128x64_MI16x16x1_SN_LDSB1_CLR1_GSU0_GSUC0_GSUWGMRR0_K1_LBSPPA512_LBSPPB128_MIWT4_4_PLR1_SU32_SUM0_SUS256_SKXCCM6_VWA4_VWB1_WGM1_WGMXCC1_WGMXCCGn1
    SolutionIndex: 43
    SolutionNameMin: Cijk_Alik_Bljk_HSS_BH_UserArgs_MT128x128x64_MI16x16x1_SN_LDSB1_CLR1_GSU0_GSUC0_GSUWGMRR0_K1_LBSPPA512_LBSPPB256_MIWT4_4_PLR1_SU32_SUM0_SUS256_SKXCCM6_VWA4_VWB2_WGM1_WGMXCC1_WGMXCCGn1
    SolutionIndex: 44
    SolutionNameMin: Cijk_Alik_Bljk_HSS_BH_UserArgs_MT128x128x64_MI16x16x1_SN_LDSB1_CLR1_GSU0_GSUC0_GSUWGMRR0_K1_LBSPPA128_LBSPPB512_MIWT4_4_PLR1_SU32_SUM0_SUS256_SKXCCM6_VWA1_VWB4_WGM1_WGMXCC1_WGMXCCGn1
    SolutionIndex: 45
    SolutionNameMin: Cijk_Alik_Bljk_HSS_BH_UserArgs_MT128x128x64_MI16x16x1_SN_LDSB1_CLR1_GSU0_GSUC0_GSUWGMRR0_K1_LBSPPA256_LBSPPB512_MIWT4_4_PLR1_SU32_SUM0_SUS256_SKXCCM6_VWA2_VWB4_WGM1_WGMXCC1_WGMXCCGn1
    SolutionIndex: 46
    SolutionNameMin: Cijk_Alik_Bljk_HSS_BH_UserArgs_MT128x128x64_MI16x16x1_SN_LDSB1_CLR1_GSU0_GSUC0_GSUWGMRR0_K1_LBSPPA512_LBSPPB512_MIWT4_4_PLR1_SU32_SUM0_SUS256_SKXCCM6_VWA4_VWB4_WGM1_WGMXCC1_WGMXCCGn1
    SolutionIndex: 47
    SolutionNameMin: Cijk_Alik_Bljk_HSS_BH_UserArgs_MT128x128x64_MI16x16x1_SN_LDSB1_CLR1_GSU0_GSUC0_GSUWGMRR0_K1_LBSPPA512_LBSPPB128_MIWT4_4_PLR2_SU32_SUM0_SUS256_SKXCCM6_VWA4_VWB1_WGM1_WGMXCC1_WGMXCCGn1
    SolutionIndex: 48
    SolutionNameMin: Cijk_Alik_Bljk_HSS_BH_UserArgs_MT128x128x64_MI16x16x1_SN_LDSB1_CLR1_GSU0_GSUC0_GSUWGMRR0_K1_LBSPPA512_LBSPPB256_MIWT4_4_PLR2_SU32_SUM0_SUS256_SKXCCM6_VWA4_VWB2_WGM1_WGMXCC1_WGMXCCGn1
    SolutionIndex: 49
    SolutionNameMin: Cijk_Alik_Bljk_HSS_BH_UserArgs_MT128x128x64_MI16x16x1_SN_LDSB1_CLR1_GSU0_GSUC0_GSUWGMRR0_K1_LBSPPA128_LBSPPB128_MIWT4_4_PLR1_SU32_SUM0_SUS256_SKXCCM6_VWA1_VWB1_WGM4_WGMXCC1_WGMXCCGn1
    SolutionIndex: 50
    SolutionNameMin: Cijk_Alik_Bljk_HSS_BH_UserArgs_MT128x128x64_MI16x16x1_SN_LDSB1_CLR1_GSU0_GSUC0_GSUWGMRR0_K1_LBSPPA512_LBSPPB128_MIWT4_4_PLR1_SU32_SUM0_SUS256_SKXCCM6_VWA4_VWB1_WGM4_WGMXCC1_WGMXCCGn1
    SolutionIndex: 51
    SolutionNameMin: Cijk_Alik_Bljk_HSS_BH_UserArgs_MT128x128x64_MI16x16x1_SN_LDSB1_CLR1_GSU0_GSUC0_GSUWGMRR0_K1_LBSPPA512_LBSPPB256_MIWT4_4_PLR1_SU32_SUM0_SUS256_SKXCCM6_VWA4_VWB2_WGM4_WGMXCC1_WGMXCCGn1
    SolutionIndex: 52
    SolutionNameMin: Cijk_Alik_Bljk_HSS_BH_UserArgs_MT128x128x64_MI16x16x1_SN_LDSB1_CLR1_GSU0_GSUC0_GSUWGMRR0_K1_LBSPPA128_LBSPPB512_MIWT4_4_PLR1_SU32_SUM0_SUS256_SKXCCM6_VWA1_VWB4_WGM4_WGMXCC1_WGMXCCGn1
    SolutionIndex: 53
    SolutionNameMin: Cijk_Alik_Bljk_HSS_BH_UserArgs_MT128x128x64_MI16x16x1_SN_LDSB1_CLR1_GSU0_GSUC0_GSUWGMRR0_K1_LBSPPA512_LBSPPB512_MIWT4_4_PLR1_SU32_SUM0_SUS256_SKXCCM6_VWA4_VWB4_WGM4_WGMXCC1_WGMXCCGn1
    SolutionIndex: 54
    SolutionNameMin: Cijk_Alik_Bljk_HSS_BH_UserArgs_MT128x128x64_MI16x16x1_SN_LDSB1_CLR1_GSU0_GSUC0_GSUWGMRR0_K1_LBSPPA128_LBSPPB128_MIWT4_4_PLR1_SU32_SUM0_SUS256_SKXCCM6_VWA1_VWB1_WGM8_WGMXCC1_WGMXCCGn1
    SolutionIndex: 55
    SolutionNameMin: Cijk_Alik_Bljk_HSS_BH_UserArgs_MT128x128x64_MI16x16x1_SN_LDSB1_CLR1_GSU0_GSUC0_GSUWGMRR0_K1_LBSPPA256_LBSPPB128_MIWT4_4_PLR1_SU32_SUM0_SUS256_SKXCCM6_VWA2_VWB1_WGM8_WGMXCC1_WGMXCCGn1
    SolutionIndex: 56
    SolutionNameMin: Cijk_Alik_Bljk_HSS_BH_UserArgs_MT128x128x64_MI16x16x1_SN_LDSB1_CLR1_GSU0_GSUC0_GSUWGMRR0_K1_LBSPPA512_LBSPPB128_MIWT4_4_PLR1_SU32_SUM0_SUS256_SKXCCM6_VWA4_VWB1_WGM8_WGMXCC1_WGMXCCGn1
    SolutionIndex: 57
    SolutionNameMin: Cijk_Alik_Bljk_HSS_BH_UserArgs_MT128x128x64_MI16x16x1_SN_LDSB1_CLR1_GSU0_GSUC0_GSUWGMRR0_K1_LBSPPA128_LBSPPB256_MIWT4_4_PLR1_SU32_SUM0_SUS256_SKXCCM6_VWA1_VWB2_WGM8_WGMXCC1_WGMXCCGn1
    SolutionIndex: 58
    SolutionNameMin: Cijk_Alik_Bljk_HSS_BH_UserArgs_MT128x128x64_MI16x16x1_SN_LDSB1_CLR1_GSU0_GSUC0_GSUWGMRR0_K1_LBSPPA512_LBSPPB256_MIWT4_4_PLR1_SU32_SUM0_SUS256_SKXCCM6_VWA4_VWB2_WGM8_WGMXCC1_WGMXCCGn1
    SolutionIndex: 59
    SolutionNameMin: Cijk_Alik_Bljk_HSS_BH_UserArgs_MT128x128x64_MI16x16x1_SN_LDSB1_CLR1_GSU0_GSUC0_GSUWGMRR0_K1_LBSPPA128_LBSPPB512_MIWT4_4_PLR1_SU32_SUM0_SUS256_SKXCCM6_VWA1_VWB4_WGM8_WGMXCC1_WGMXCCGn1
    SolutionIndex: 60
    SolutionNameMin: Cijk_Alik_Bljk_HSS_BH_UserArgs_MT128x128x64_MI16x16x1_SN_LDSB1_CLR1_GSU0_GSUC0_GSUWGMRR0_K1_LBSPPA512_LBSPPB512_MIWT4_4_PLR1_SU32_SUM0_SUS256_SKXCCM6_VWA4_VWB4_WGM8_WGMXCC1_WGMXCCGn1
    SolutionIndex: 61
    SolutionNameMin: Cijk_Alik_Bljk_HSS_BH_UserArgs_MT128x128x64_MI16x16x1_SN_LDSB1_CLR1_GSU0_GSUC0_GSUWGMRR0_K1_LBSPPA128_LBSPPB512_MIWT4_4_PLR2_SU32_SUM0_SUS256_SKXCCM6_VWA1_VWB4_WGM8_WGMXCC1_WGMXCCGn1
    SolutionIndex: 62
    SolutionNameMin: Cijk_Alik_Bljk_HSS_BH_UserArgs_MT64x128x64_MI16x16x1_SN_LDSB1_CLR1_GSU0_GSUC0_GSUWGMRR0_K1_LBSPPA128_LBSPPB256_MIWT2_4_PLR1_SU32_SUM0_SUS256_SKXCCM6_VWA1_VWB2_WGM1_WGMXCC1_WGMXCCGn1
    SolutionIndex: 63
    SolutionNameMin: Cijk_Alik_Bljk_HSS_BH_UserArgs_MT64x128x64_MI16x16x1_SN_LDSB1_CLR1_GSU0_GSUC0_GSUWGMRR0_K1_LBSPPA128_LBSPPB512_MIWT2_4_PLR1_SU32_SUM0_SUS256_SKXCCM6_VWA1_VWB4_WGM1_WGMXCC1_WGMXCCGn1
    SolutionIndex: 64
    SolutionNameMin: Cijk_Alik_Bljk_HSS_BH_UserArgs_MT64x128x64_MI16x16x1_SN_LDSB1_CLR1_GSU0_GSUC0_GSUWGMRR0_K1_LBSPPA128_LBSPPB128_MIWT2_4_PLR2_SU32_SUM0_SUS256_SKXCCM6_VWA1_VWB1_WGM1_WGMXCC1_WGMXCCGn1
    SolutionIndex: 65
    SolutionNameMin: Cijk_Alik_Bljk_HSS_BH_UserArgs_MT64x128x64_MI16x16x1_SN_LDSB1_CLR1_GSU0_GSUC0_GSUWGMRR0_K1_LBSPPA128_LBSPPB512_MIWT2_4_PLR2_SU32_SUM0_SUS256_SKXCCM6_VWA1_VWB4_WGM1_WGMXCC1_WGMXCCGn1
    SolutionIndex: 66
    SolutionNameMin: Cijk_Alik_Bljk_HSS_BH_UserArgs_MT64x128x64_MI16x16x1_SN_LDSB1_CLR1_GSU0_GSUC0_GSUWGMRR0_K1_LBSPPA128_LBSPPB512_MIWT2_4_PLR1_SU32_SUM0_SUS256_SKXCCM6_VWA1_VWB4_WGM4_WGMXCC1_WGMXCCGn1
    SolutionIndex: 67
    SolutionNameMin: Cijk_Alik_Bljk_HSS_BH_UserArgs_MT64x128x64_MI16x16x1_SN_LDSB1_CLR1_GSU0_GSUC0_GSUWGMRR0_K1_LBSPPA128_LBSPPB512_MIWT2_4_PLR2_SU32_SUM0_SUS256_SKXCCM6_VWA1_VWB4_WGM4_WGMXCC1_WGMXCCGn1
    SolutionIndex: 68
    SolutionNameMin: Cijk_Alik_Bljk_HSS_BH_UserArgs_MT64x128x64_MI16x16x1_SN_LDSB1_CLR1_GSU0_GSUC0_GSUWGMRR0_K1_LBSPPA128_LBSPPB128_MIWT2_4_PLR1_SU32_SUM0_SUS256_SKXCCM6_VWA1_VWB1_WGM8_WGMXCC1_WGMXCCGn1
    SolutionIndex: 69
    SolutionNameMin: Cijk_Alik_Bljk_HSS_BH_UserArgs_MT64x128x64_MI16x16x1_SN_LDSB1_CLR1_GSU0_GSUC0_GSUWGMRR0_K1_LBSPPA128_LBSPPB256_MIWT2_4_PLR1_SU32_SUM0_SUS256_SKXCCM6_VWA1_VWB2_WGM8_WGMXCC1_WGMXCCGn1
    SolutionIndex: 70
    SolutionNameMin: Cijk_Alik_Bljk_HSS_BH_UserArgs_MT64x128x64_MI16x16x1_SN_LDSB1_CLR1_GSU0_GSUC0_GSUWGMRR0_K1_LBSPPA128_LBSPPB256_MIWT2_4_PLR2_SU32_SUM0_SUS256_SKXCCM6_VWA1_VWB2_WGM8_WGMXCC1_WGMXCCGn1
    SolutionIndex: 71
    SolutionNameMin: Cijk_Alik_Bljk_HSS_BH_UserArgs_MT128x64x64_MI16x16x1_SN_LDSB1_CLR1_GSU0_GSUC0_GSUWGMRR0_K1_LBSPPA128_LBSPPB128_MIWT4_2_PLR1_SU32_SUM0_SUS256_SKXCCM6_VWA1_VWB1_WGM1_WGMXCC1_WGMXCCGn1
    SolutionIndex: 72
    SolutionNameMin: Cijk_Alik_Bljk_HSS_BH_UserArgs_MT128x64x64_MI16x16x1_SN_LDSB1_CLR1_GSU0_GSUC0_GSUWGMRR0_K1_LBSPPA512_LBSPPB128_MIWT4_2_PLR1_SU32_SUM0_SUS256_SKXCCM6_VWA4_VWB1_WGM1_WGMXCC1_WGMXCCGn1
    SolutionIndex: 73
    SolutionNameMin: Cijk_Alik_Bljk_HSS_BH_UserArgs_MT128x64x64_MI16x16x1_SN_LDSB1_CLR1_GSU0_GSUC0_GSUWGMRR0_K1_LBSPPA512_LBSPPB256_MIWT4_2_PLR1_SU32_SUM0_SUS256_SKXCCM6_VWA4_VWB2_WGM1_WGMXCC1_WGMXCCGn1
    SolutionIndex: 74
    SolutionNameMin: Cijk_Alik_Bljk_HSS_BH_UserArgs_MT128x64x64_MI16x16x1_SN_LDSB1_CLR1_GSU0_GSUC0_GSUWGMRR0_K1_LBSPPA512_LBSPPB256_MIWT4_2_PLR2_SU32_SUM0_SUS256_SKXCCM6_VWA4_VWB2_WGM1_WGMXCC1_WGMXCCGn1
    SolutionIndex: 75
    SolutionNameMin: Cijk_Alik_Bljk_HSS_BH_UserArgs_MT128x64x64_MI16x16x1_SN_LDSB1_CLR1_GSU0_GSUC0_GSUWGMRR0_K1_LBSPPA512_LBSPPB128_MIWT4_2_PLR1_SU32_SUM0_SUS256_SKXCCM6_VWA4_VWB1_WGM4_WGMXCC1_WGMXCCGn1
    SolutionIndex: 76
    SolutionNameMin: Cijk_Alik_Bljk_HSS_BH_UserArgs_MT128x64x64_MI16x16x1_SN_LDSB1_CLR1_GSU0_GSUC0_GSUWGMRR0_K1_LBSPPA512_LBSPPB256_MIWT4_2_PLR1_SU32_SUM0_SUS256_SKXCCM6_VWA4_VWB2_WGM4_WGMXCC1_WGMXCCGn1
    SolutionIndex: 77
    SolutionNameMin: Cijk_Alik_Bljk_HSS_BH_UserArgs_MT128x64x64_MI16x16x1_SN_LDSB1_CLR1_GSU0_GSUC0_GSUWGMRR0_K1_LBSPPA512_LBSPPB128_MIWT4_2_PLR1_SU32_SUM0_SUS256_SKXCCM6_VWA4_VWB1_WGM8_WGMXCC1_WGMXCCGn1
    SolutionIndex: 78
    SolutionNameMin: Cijk_Alik_Bljk_HSS_BH_UserArgs_MT128x64x64_MI16x16x1_SN_LDSB1_CLR1_GSU0_GSUC0_GSUWGMRR0_K1_LBSPPA512_LBSPPB256_MIWT4_2_PLR1_SU32_SUM0_SUS256_SKXCCM6_VWA4_VWB2_WGM8_WGMXCC1_WGMXCCGn1
    SolutionIndex: 79
    SolutionNameMin: Cijk_Alik_Bljk_HSS_BH_UserArgs_MT128x64x64_MI16x16x1_SN_LDSB1_CLR1_GSU0_GSUC0_GSUWGMRR0_K1_LBSPPA512_LBSPPB256_MIWT4_2_PLR2_SU32_SUM0_SUS256_SKXCCM6_VWA4_VWB2_WGM8_WGMXCC1_WGMXCCGn1
    SolutionIndex: 80
    SolutionNameMin: Cijk_Alik_Bljk_HSS_BH_UserArgs_MT64x64x64_MI16x16x1_SN_LDSB1_CLR1_GSU0_GSUC0_GSUWGMRR0_K1_LBSPPA128_LBSPPB128_MIWT2_2_PLR1_SU32_SUM0_SUS256_SKXCCM6_VWA1_VWB1_WGM1_WGMXCC1_WGMXCCGn1
    SolutionIndex: 81
    SolutionNameMin: Cijk_Alik_Bljk_HSS_BH_UserArgs_MT64x64x64_MI16x16x1_SN_LDSB1_CLR1_GSU0_GSUC0_GSUWGMRR0_K1_LBSPPA128_LBSPPB256_MIWT2_2_PLR1_SU32_SUM0_SUS256_SKXCCM6_VWA1_VWB2_WGM1_WGMXCC1_WGMXCCGn1
    SolutionIndex: 82
    SolutionNameMin: Cijk_Alik_Bljk_HSS_BH_UserArgs_MT64x64x64_MI16x16x1_SN_LDSB1_CLR1_GSU0_GSUC0_GSUWGMRR0_K1_LBSPPA128_LBSPPB128_MIWT2_2_PLR2_SU32_SUM0_SUS256_SKXCCM6_VWA1_VWB1_WGM1_WGMXCC1_WGMXCCGn1
    SolutionIndex: 83
    SolutionNameMin: Cijk_Alik_Bljk_HSS_BH_UserArgs_MT64x64x64_MI16x16x1_SN_LDSB1_CLR1_GSU0_GSUC0_GSUWGMRR0_K1_LBSPPA128_LBSPPB256_MIWT2_2_PLR2_SU32_SUM0_SUS256_SKXCCM6_VWA1_VWB2_WGM1_WGMXCC1_WGMXCCGn1
    SolutionIndex: 84
    SolutionNameMin: Cijk_Alik_Bljk_HSS_BH_UserArgs_MT64x64x64_MI16x16x1_SN_LDSB1_CLR1_GSU0_GSUC0_GSUWGMRR0_K1_LBSPPA128_LBSPPB128_MIWT2_2_PLR1_SU32_SUM0_SUS256_SKXCCM6_VWA1_VWB1_WGM4_WGMXCC1_WGMXCCGn1
    SolutionIndex: 85
    SolutionNameMin: Cijk_Alik_Bljk_HSS_BH_UserArgs_MT64x64x64_MI16x16x1_SN_LDSB1_CLR1_GSU0_GSUC0_GSUWGMRR0_K1_LBSPPA256_LBSPPB128_MIWT2_2_PLR1_SU32_SUM0_SUS256_SKXCCM6_VWA2_VWB1_WGM4_WGMXCC1_WGMXCCGn1
    SolutionIndex: 86
    SolutionNameMin: Cijk_Alik_Bljk_HSS_BH_UserArgs_MT64x64x64_MI16x16x1_SN_LDSB1_CLR1_GSU0_GSUC0_GSUWGMRR0_K1_LBSPPA128_LBSPPB256_MIWT2_2_PLR1_SU32_SUM0_SUS256_SKXCCM6_VWA1_VWB2_WGM4_WGMXCC1_WGMXCCGn1
    SolutionIndex: 87
    SolutionNameMin: Cijk_Alik_Bljk_HSS_BH_UserArgs_MT64x64x64_MI16x16x1_SN_LDSB1_CLR1_GSU0_GSUC0_GSUWGMRR0_K1_LBSPPA128_LBSPPB128_MIWT2_2_PLR1_SU32_SUM0_SUS256_SKXCCM6_VWA1_VWB1_WGM8_WGMXCC1_WGMXCCGn1
    SolutionIndex: 88
    SolutionNameMin: Cijk_Alik_Bljk_HSS_BH_UserArgs_MT64x64x64_MI16x16x1_SN_LDSB1_CLR1_GSU0_GSUC0_GSUWGMRR0_K1_LBSPPA256_LBSPPB128_MIWT2_2_PLR1_SU32_SUM0_SUS256_SKXCCM6_VWA2_VWB1_WGM8_WGMXCC1_WGMXCCGn1
    SolutionIndex: 89
    SolutionNameMin: Cijk_Alik_Bljk_HSS_BH_UserArgs_MT64x64x64_MI16x16x1_SN_LDSB1_CLR1_GSU0_GSUC0_GSUWGMRR0_K1_LBSPPA256_LBSPPB256_MIWT2_2_PLR2_SU32_SUM0_SUS256_SKXCCM6_VWA2_VWB2_WGM8_WGMXCC1_WGMXCCGn1
    SolutionIndex: 90
    SolutionNameMin: Cijk_Alik_Bljk_HSS_BH_UserArgs_MT32x64x64_MI16x16x1_SN_LDSB0_CLR1_GSU0_GSUC0_GSUWGMRR0_K1_LBSPPA128_LBSPPB128_MIWT1_2_PLR1_SU32_SUM0_SUS256_SKXCCM6_VWA1_VWB1_WGM1_WGMXCC1_WGMXCCGn1
    SolutionIndex: 91
    SolutionNameMin: Cijk_Alik_Bljk_HSS_BH_UserArgs_MT32x64x64_MI16x16x1_SN_LDSB0_CLR1_GSU0_GSUC0_GSUWGMRR0_K1_LBSPPA128_LBSPPB256_MIWT1_2_PLR1_SU32_SUM0_SUS256_SKXCCM6_VWA1_VWB2_WGM1_WGMXCC1_WGMXCCGn1
    SolutionIndex: 92
    SolutionNameMin: Cijk_Alik_Bljk_HSS_BH_UserArgs_MT32x64x64_MI16x16x1_SN_LDSB0_CLR1_GSU0_GSUC0_GSUWGMRR0_K1_LBSPPA128_LBSPPB128_MIWT1_2_PLR1_SU32_SUM0_SUS256_SKXCCM6_VWA1_VWB1_WGM4_WGMXCC1_WGMXCCGn1
    SolutionIndex: 93
    SolutionNameMin: Cijk_Alik_Bljk_HSS_BH_UserArgs_MT64x32x64_MI16x16x1_SN_LDSB0_CLR1_GSU0_GSUC0_GSUWGMRR0_K1_LBSPPA128_LBSPPB128_MIWT2_1_PLR1_SU32_SUM0_SUS256_SKXCCM6_VWA1_VWB1_WGM1_WGMXCC1_WGMXCCGn1
    SolutionIndex: 94
    SolutionNameMin: Cijk_Alik_Bljk_HSS_BH_UserArgs_MT64x32x64_MI16x16x1_SN_LDSB0_CLR1_GSU0_GSUC0_GSUWGMRR0_K1_LBSPPA128_LBSPPB128_MIWT2_1_PLR1_SU32_SUM0_SUS256_SKXCCM6_VWA1_VWB1_WGM4_WGMXCC1_WGMXCCGn1
    SolutionIndex: 95
    SolutionNameMin: Cijk_Alik_Bljk_HSS_BH_UserArgs_MT32x32x64_MI16x16x1_SN_LDSB0_CLR1_GSU0_GSUC0_GSUWGMRR0_K1_LBSPPA128_LBSPPB128_MIWT1_1_PLR1_SU32_SUM0_SUS256_SKXCCM6_VWA1_VWB1_WGM1_WGMXCC1_WGMXCCGn1
    SolutionIndex: 96
    SolutionNameMin: Cijk_Alik_Bljk_HSS_BH_UserArgs_MT32x32x64_MI16x16x1_SN_LDSB0_CLR1_GSU0_GSUC0_GSUWGMRR0_K1_LBSPPA128_LBSPPB128_MIWT1_1_PLR2_SU32_SUM0_SUS256_SKXCCM6_VWA1_VWB1_WGM1_WGMXCC1_WGMXCCGn1
    SolutionIndex: 97
    SolutionNameMin: Cijk_Alik_Bljk_HSS_BH_UserArgs_MT64x64x128_MI16x16x1_SN_LDSB1_CLR1_GSU0_GSUC0_GSUWGMRR0_K1_LBSPPA512_LBSPPB512_MIWT2_2_PLR2_SU32_SUM0_SUS256_SKXCCM6_VWA2_VWB2_WGM8_WGMXCC1_WGMXCCGn1
    SolutionIndex: 98
    SolutionNameMin: Cijk_Alik_Bljk_HSS_BH_UserArgs_MT32x64x128_MI16x16x1_SN_LDSB1_CLR1_GSU0_GSUC0_GSUWGMRR0_K1_LBSPPA256_LBSPPB256_MIWT1_2_PLR2_SU32_SUM0_SUS256_SKXCCM6_VWA1_VWB1_WGM8_WGMXCC1_WGMXCCGn1
    SolutionIndex: 99
    SolutionNameMin: Cijk_Alik_Bljk_HSS_BH_UserArgs_MT64x32x128_MI16x16x1_SN_LDSB1_CLR1_GSU0_GSUC0_GSUWGMRR0_K1_LBSPPA256_LBSPPB256_MIWT2_1_PLR1_SU32_SUM0_SUS256_SKXCCM6_VWA1_VWB1_WGM1_WGMXCC1_WGMXCCGn1
    SolutionIndex: 100
    SolutionNameMin: Cijk_Alik_Bljk_HSS_BH_UserArgs_MT64x32x128_MI16x16x1_SN_LDSB1_CLR1_GSU0_GSUC0_GSUWGMRR0_K1_LBSPPA256_LBSPPB256_MIWT2_1_PLR2_SU32_SUM0_SUS256_SKXCCM6_VWA1_VWB1_WGM8_WGMXCC1_WGMXCCGn1
    SolutionIndex: 101
    SolutionNameMin: Cijk_Alik_Bljk_HSS_BH_UserArgs_MT32x32x128_MI16x16x1_SN_LDSB1_CLR1_GSU0_GSUC0_GSUWGMRR0_K1_LBSPPA256_LBSPPB256_MIWT1_1_PLR1_SU32_SUM0_SUS256_SKXCCM6_VWA1_VWB1_WGM1_WGMXCC1_WGMXCCGn1
    SolutionIndex: 102
    SolutionNameMin: Cijk_Alik_Bljk_HSS_BH_UserArgs_MT32x32x128_MI16x16x1_SN_LDSB1_CLR1_GSU0_GSUC0_GSUWGMRR0_K1_LBSPPA256_LBSPPB256_MIWT1_1_PLR2_SU32_SUM0_SUS256_SKXCCM6_VWA1_VWB1_WGM1_WGMXCC1_WGMXCCGn1
    SolutionIndex: 103
    SolutionNameMin: Cijk_Alik_Bljk_HSS_BH_UserArgs_MT32x32x128_MI16x16x1_SN_LDSB1_CLR1_GSU0_GSUC0_GSUWGMRR0_K1_LBSPPA256_LBSPPB256_MIWT1_1_PLR1_SU32_SUM0_SUS256_SKXCCM6_VWA1_VWB1_WGM4_WGMXCC1_WGMXCCGn1
    SolutionIndex: 104
    SolutionNameMin: Cijk_Alik_Bljk_HSS_BH_UserArgs_MT32x32x128_MI16x16x1_SN_LDSB1_CLR1_GSU0_GSUC0_GSUWGMRR0_K1_LBSPPA256_LBSPPB256_MIWT1_1_PLR2_SU32_SUM0_SUS256_SKXCCM6_VWA1_VWB1_WGM4_WGMXCC1_WGMXCCGn1
    SolutionIndex: 105
    SolutionNameMin: Cijk_Alik_Bljk_HSS_BH_UserArgs_MT32x32x128_MI16x16x1_SN_LDSB1_CLR1_GSU0_GSUC0_GSUWGMRR0_K1_LBSPPA256_LBSPPB256_MIWT1_1_PLR1_SU32_SUM0_SUS256_SKXCCM6_VWA1_VWB1_WGM8_WGMXCC1_WGMXCCGn1
    SolutionIndex: 106
    SolutionNameMin: Cijk_Alik_Bljk_HSS_BH_UserArgs_MT32x32x128_MI16x16x1_SN_LDSB1_CLR1_GSU0_GSUC0_GSUWGMRR0_K1_LBSPPA256_LBSPPB256_MIWT1_1_PLR2_SU32_SUM0_SUS256_SKXCCM6_VWA1_VWB1_WGM8_WGMXCC1_WGMXCCGn1
    SolutionIndex: 107
    SolutionNameMin: Cijk_Alik_Bljk_HSS_BH_UserArgs_MT32x64x128_MI16x16x1_SN_LDSB1_CLR1_GSU0_GSUC0_GSUWGMRR0_K1_LBSPPA256_LBSPPB512_MIWT1_2_PLR1_SU32_SUM0_SUS256_SKXCCM0_VWA1_VWB2_WGM1_WGMXCC1_WGMXCCGn1
- - - [128, 128, 1, 128, 128, 128, 128, 128]
    - [102, 0.089]
  - - [128, 128, 1, 256, 128, 128, 256, 256]
    - [32, 0.114]
  - - [128, 128, 1, 512, 128, 128, 512, 512]
    - [102, 0.189]
  - - [128, 128, 1, 1024, 128, 128, 1024, 1024]
    - [101, 0.288]
  - - [128, 128, 1, 2048, 128, 128, 2048, 2048]
    - [96, 0.368]
  - - [128, 128, 1, 4096, 128, 128, 4096, 4096]
    - [95, 0.725]
  - - [128, 128, 1, 8192, 128, 128, 8192, 8192]
    - [101, 1.379]
  - - [128, 256, 1, 128, 128, 128, 128, 128]
    - [32, 0.184]
  - - [128, 256, 1, 256, 128, 128, 256, 256]
    - [32, 0.222]
  - - [128, 256, 1, 512, 128, 128, 512, 512]
    - [101, 0.373]
  - - [128, 256, 1, 1024, 128, 128, 1024, 1024]
    - [95, 0.563]
  - - [128, 256, 1, 2048, 128, 128, 2048, 2048]
    - [101, 1.092]
  - - [128, 256, 1, 4096, 128, 128, 4096, 4096]
    - [101, 1.921]
  - - [128, 256, 1, 8192, 128, 128, 8192, 8192]
    - [102, 3.243]
  - - [128, 512, 1, 128, 128, 128, 128, 128]
    - [31, 0.36]
  - - [128, 512, 1, 256, 128, 128, 256, 256]
    - [31, 0.433]
  - - [128, 512, 1, 512, 128, 128, 512, 512]
    - [101, 0.726]
  - - [128, 512, 1, 1024, 128, 128, 1024, 1024]
    - [39, 1.296]
  - - [128, 512, 1, 2048, 128, 128, 2048, 2048]
    - [102, 2.471]
  - - [128, 512, 1, 4096, 128, 128, 4096, 4096]
    - [101, 4.019]
  - - [128, 512, 1, 8192, 128, 128, 8192, 8192]
    - [101, 5.895]
  - - [128, 1024, 1, 128, 128, 128, 128, 128]
    - [32, 0.692]
  - - [128, 1024, 1, 256, 128, 128, 256, 256]
    - [32, 0.836]
  - - [128, 1024, 1, 512, 128, 128, 512, 512]
    - [32, 1.547]
  - - [128, 1024, 1, 1024, 128, 128, 1024, 1024]
    - [101, 2.723]
  - - [128, 1024, 1, 2048, 128, 128, 2048, 2048]
    - [101, 4.455]
  - - [128, 1024, 1, 4096, 128, 128, 4096, 4096]
    - [90, 6.493]
  - - [128, 1024, 1, 8192, 128, 128, 8192, 8192]
    - [99, 8.483]
  - - [128, 2048, 1, 128, 128, 128, 128, 128]
    - [29, 1.238]
  - - [128, 2048, 1, 256, 128, 128, 256, 256]
    - [32, 2.17]
  - - [128, 2048, 1, 512, 128, 128, 512, 512]
    - [31, 3.551]
  - - [128, 2048, 1, 1024, 128, 128, 1024, 1024]
    - [102, 5.353]
  - - [128, 2048, 1, 2048, 128, 128, 2048, 2048]
    - [101, 7.151]
  - - [128, 2048, 1, 4096, 128, 128, 4096, 4096]
    - [80, 9.307]
  - - [128, 2048, 1, 8192, 128, 128, 8192, 8192]
    - [10, 10.468]
  - - [128, 4096, 1, 128, 128, 128, 128, 128]
    - [23, 2.182]
  - - [128, 4096, 1, 256, 128, 128, 256, 256]
    - [25, 3.759]
  - - [128, 4096, 1, 512, 128, 128, 512, 512]
    - [21, 5.924]
  - - [128, 4096, 1, 1024, 128, 128, 1024, 1024]
    - [90, 8.293]
  - - [128, 4096, 1, 2048, 128, 128, 2048, 2048]
    - [93, 10.297]
  - - [128, 4096, 1, 4096, 128, 128, 4096, 4096]
    - [16, 11.677]
  - - [128, 4096, 1, 8192, 128, 128, 8192, 8192]
    - [72, 13.087]
  - - [128, 8192, 1, 128, 128, 128, 128, 128]
    - [18, 3.576]
  - - [128, 8192, 1, 256, 128, 128, 256, 256]
    - [17, 5.771]
  - - [128, 8192, 1, 512, 128, 128, 512, 512]
    - [87, 8.954]
  - - [128, 8192, 1, 1024, 128, 128, 1024, 1024]
    - [80, 11.595]
  - - [128, 8192, 1, 2048, 128, 128, 2048, 2048]
    - [15, 11.791]
  - - [128, 8192, 1, 4096, 128, 128, 4096, 4096]
    - [16, 14.513]
  - - [128, 8192, 1, 8192, 128, 128, 8192, 8192]
    - [16, 16.122]
  - - [256, 128, 1, 128, 256, 256, 128, 128]
    - [31, 0.18]
  - - [256, 128, 1, 256, 256, 256, 256, 256]
    - [31, 0.225]
  - - [256, 128, 1, 512, 256, 256, 512, 512]
    - [101, 0.374]
  - - [256, 128, 1, 1024, 256, 256, 1024, 1024]
    - [95, 0.56]
  - - [256, 128, 1, 2048, 256, 256, 2048, 2048]
    - [101, 1.08]
  - - [256, 128, 1, 4096, 256, 256, 4096, 4096]
    - [101, 1.926]
  - - [256, 128, 1, 8192, 256, 256, 8192, 8192]
    - [104, 3.264]
  - - [256, 256, 1, 128, 256, 256, 128, 128]
    - [101, 0.333]
  - - [256, 256, 1, 256, 256, 256, 256, 256]
    - [32, 0.435]
  - - [256, 256, 1, 512, 256, 256, 512, 512]
    - [101, 0.711]
  - - [256, 256, 1, 1024, 256, 256, 1024, 1024]
    - [101, 1.314]
  - - [256, 256, 1, 2048, 256, 256, 2048, 2048]
    - [102, 2.485]
  - - [256, 256, 1, 4096, 256, 256, 4096, 4096]
    - [102, 3.999]
  - - [256, 256, 1, 8192, 256, 256, 8192, 8192]
    - [103, 5.798]
  - - [256, 512, 1, 128, 256, 256, 128, 128]
    - [32, 0.688]
  - - [256, 512, 1, 256, 256, 256, 256, 256]
    - [32, 0.836]
  - - [256, 512, 1, 512, 256, 256, 512, 512]
    - [31, 1.551]
  - - [256, 512, 1, 1024, 256, 256, 1024, 1024]
    - [101, 2.718]
  - - [256, 512, 1, 2048, 256, 256, 2048, 2048]
    - [105, 4.422]
  - - [256, 512, 1, 4096, 256, 256, 4096, 4096]
    - [90, 6.413]
  - - [256, 512, 1, 8192, 256, 256, 8192, 8192]
    - [99, 8.246]
  - - [256, 1024, 1, 128, 256, 256, 128, 128]
    - [26, 1.245]
  - - [256, 1024, 1, 256, 256, 256, 256, 256]
    - [32, 2.156]
  - - [256, 1024, 1, 512, 256, 256, 512, 512]
    - [31, 3.574]
  - - [256, 1024, 1, 1024, 256, 256, 1024, 1024]
    - [31, 5.362]
  - - [256, 1024, 1, 2048, 256, 256, 2048, 2048]
    - [101, 7.133]
  - - [256, 1024, 1, 4096, 256, 256, 4096, 4096]
    - [82, 9.33]
  - - [256, 1024, 1, 8192, 256, 256, 8192, 8192]
    - [82, 10.315]
  - - [256, 2048, 1, 128, 256, 256, 128, 128]
    - [21, 2.177]
  - - [256, 2048, 1, 256, 256, 256, 256, 256]
    - [24, 3.733]
  - - [256, 2048, 1, 512, 256, 256, 512, 512]
    - [21, 6.007]
  - - [256, 2048, 1, 1024, 256, 256, 1024, 1024]
    - [90, 8.206]
  - - [256, 2048, 1, 2048, 256, 256, 2048, 2048]
    - [80, 10.582]
  - - [256, 2048, 1, 4096, 256, 256, 4096, 4096]
    - [75, 11.34]
  - - [256, 2048, 1, 8192, 256, 256, 8192, 8192]
    - [72, 12.109]
  - - [256, 4096, 1, 128, 256, 256, 128, 128]
    - [80, 3.443]
  - - [256, 4096, 1, 256, 256, 256, 256, 256]
    - [80, 5.705]
  - - [256, 4096, 1, 512, 256, 256, 512, 512]
    - [81, 8.988]
  - - [256, 4096, 1, 1024, 256, 256, 1024, 1024]
    - [80, 12.336]
  - - [256, 4096, 1, 2048, 256, 256, 2048, 2048]
    - [82, 12.988]
  - - [256, 4096, 1, 4096, 256, 256, 4096, 4096]
    - [78, 14.193]
  - - [256, 4096, 1, 8192, 256, 256, 8192, 8192]
    - [42, 15.115]
  - - [256, 8192, 1, 128, 256, 256, 128, 128]
    - [14, 4.851]
  - - [256, 8192, 1, 256, 256, 256, 256, 256]
    - [65, 7.875]
  - - [256, 8192, 1, 512, 256, 256, 512, 512]
    - [73, 11.652]
  - - [256, 8192, 1, 1024, 256, 256, 1024, 1024]
    - [71, 13.536]
  - - [256, 8192, 1, 2048, 256, 256, 2048, 2048]
    - [71, 15.238]
  - - [256, 8192, 1, 4096, 256, 256, 4096, 4096]
    - [40, 16.61]
  - - [256, 8192, 1, 8192, 256, 256, 8192, 8192]
    - [42, 16.997]
  - - [512, 128, 1, 128, 512, 512, 128, 128]
    - [32, 0.359]
  - - [512, 128, 1, 256, 512, 512, 256, 256]
    - [32, 0.438]
  - - [512, 128, 1, 512, 512, 512, 512, 512]
    - [101, 0.709]
  - - [512, 128, 1, 1024, 512, 512, 1024, 1024]
    - [102, 1.289]
  - - [512, 128, 1, 2048, 512, 512, 2048, 2048]
    - [105, 2.44]
  - - [512, 128, 1, 4096, 512, 512, 4096, 4096]
    - [101, 4.02]
  - - [512, 128, 1, 8192, 512, 512, 8192, 8192]
    - [103, 5.77]
  - - [512, 256, 1, 128, 512, 512, 128, 128]
    - [31, 0.695]
  - - [512, 256, 1, 256, 512, 512, 256, 256]
    - [101, 0.842]
  - - [512, 256, 1, 512, 512, 512, 512, 512]
    - [32, 1.547]
  - - [512, 256, 1, 1024, 512, 512, 1024, 1024]
    - [102, 2.711]
  - - [512, 256, 1, 2048, 512, 512, 2048, 2048]
    - [102, 4.411]
  - - [512, 256, 1, 4096, 512, 512, 4096, 4096]
    - [94, 6.373]
  - - [512, 256, 1, 8192, 512, 512, 8192, 8192]
    - [100, 8.241]
  - - [512, 512, 1, 128, 512, 512, 128, 128]
    - [28, 1.254]
  - - [512, 512, 1, 256, 512, 512, 256, 256]
    - [31, 2.164]
  - - [512, 512, 1, 512, 512, 512, 512, 512]
    - [31, 3.561]
  - - [512, 512, 1, 1024, 512, 512, 1024, 1024]
    - [31, 5.428]
  - - [512, 512, 1, 2048, 512, 512, 2048, 2048]
    - [101, 7.055]
  - - [512, 512, 1, 4096, 512, 512, 4096, 4096]
    - [19, 9.596]
  - - [512, 512, 1, 8192, 512, 512, 8192, 8192]
    - [84, 10.058]
  - - [512, 1024, 1, 128, 512, 512, 128, 128]
    - [22, 2.177]
  - - [512, 1024, 1, 256, 512, 512, 256, 256]
    - [24, 3.735]
  - - [512, 1024, 1, 512, 512, 512, 512, 512]
    - [22, 5.983]
  - - [512, 1024, 1, 1024, 512, 512, 1024, 1024]
    - [22, 8.439]
  - - [512, 1024, 1, 2048, 512, 512, 2048, 2048]
    - [81, 10.645]
  - - [512, 1024, 1, 4096, 512, 512, 4096, 4096]
    - [81, 11.925]
  - - [512, 1024, 1, 8192, 512, 512, 8192, 8192]
    - [72, 12.582]
  - - [512, 2048, 1, 128, 512, 512, 128, 128]
    - [18, 3.545]
  - - [512, 2048, 1, 256, 512, 512, 256, 256]
    - [18, 5.879]
  - - [512, 2048, 1, 512, 512, 512, 512, 512]
    - [81, 9.024]
  - - [512, 2048, 1, 1024, 512, 512, 1024, 1024]
    - [84, 12.346]
  - - [512, 2048, 1, 2048, 512, 512, 2048, 2048]
    - [83, 13.383]
  - - [512, 2048, 1, 4096, 512, 512, 4096, 4096]
    - [68, 12.811]
  - - [512, 2048, 1, 8192, 512, 512, 8192, 8192]
    - [42, 15.221]
  - - [512, 4096, 1, 128, 512, 512, 128, 128]
    - [73, 4.857]
  - - [512, 4096, 1, 256, 512, 512, 256, 256]
    - [66, 7.979]
  - - [512, 4096, 1, 512, 512, 512, 512, 512]
    - [71, 11.948]
  - - [512, 4096, 1, 1024, 512, 512, 1024, 1024]
    - [72, 15.259]
  - - [512, 4096, 1, 2048, 512, 512, 2048, 2048]
    - [72, 15.682]
  - - [512, 4096, 1, 4096, 512, 512, 4096, 4096]
    - [58, 15.516]
  - - [512, 4096, 1, 8192, 512, 512, 8192, 8192]
    - [46, 16.335]
  - - [512, 8192, 1, 128, 512, 512, 128, 128]
    - [37, 5.749]
  - - [512, 8192, 1, 256, 512, 512, 256, 256]
    - [33, 8.719]
  - - [512, 8192, 1, 512, 512, 512, 512, 512]
    - [41, 12.156]
  - - [512, 8192, 1, 1024, 512, 512, 1024, 1024]
    - [47, 14.853]
  - - [512, 8192, 1, 2048, 512, 512, 2048, 2048]
    - [43, 18.109]
  - - [512, 8192, 1, 4096, 512, 512, 4096, 4096]
    - [51, 16.599]
  - - [512, 8192, 1, 8192, 512, 512, 8192, 8192]
    - [3, 18.345]
  - - [1024, 128, 1, 128, 1024, 1024, 128, 128]
    - [32, 0.684]
  - - [1024, 128, 1, 256, 1024, 1024, 256, 256]
    - [31, 0.834]
  - - [1024, 128, 1, 512, 1024, 1024, 512, 512]
    - [32, 1.555]
  - - [1024, 128, 1, 1024, 1024, 1024, 1024, 1024]
    - [101, 2.68]
  - - [1024, 128, 1, 2048, 1024, 1024, 2048, 2048]
    - [106, 4.406]
  - - [1024, 128, 1, 4096, 1024, 1024, 4096, 4096]
    - [90, 6.427]
  - - [1024, 128, 1, 8192, 1024, 1024, 8192, 8192]
    - [98, 8.417]
  - - [1024, 256, 1, 128, 1024, 1024, 128, 128]
    - [27, 1.257]
  - - [1024, 256, 1, 256, 1024, 1024, 256, 256]
    - [32, 2.236]
  - - [1024, 256, 1, 512, 1024, 1024, 512, 512]
    - [31, 3.571]
  - - [1024, 256, 1, 1024, 1024, 1024, 1024, 1024]
    - [31, 5.43]
  - - [1024, 256, 1, 2048, 1024, 1024, 2048, 2048]
    - [103, 7.001]
  - - [1024, 256, 1, 4096, 1024, 1024, 4096, 4096]
    - [84, 9.137]
  - - [1024, 256, 1, 8192, 1024, 1024, 8192, 8192]
    - [86, 10.093]
  - - [1024, 512, 1, 128, 1024, 1024, 128, 128]
    - [22, 2.173]
  - - [1024, 512, 1, 256, 1024, 1024, 256, 256]
    - [23, 3.735]
  - - [1024, 512, 1, 512, 1024, 1024, 512, 512]
    - [22, 5.99]
  - - [1024, 512, 1, 1024, 1024, 1024, 1024, 1024]
    - [21, 8.386]
  - - [1024, 512, 1, 2048, 1024, 1024, 2048, 2048]
    - [87, 10.534]
  - - [1024, 512, 1, 4096, 1024, 1024, 4096, 4096]
    - [87, 11.569]
  - - [1024, 512, 1, 8192, 1024, 1024, 8192, 8192]
    - [97, 12.073]
  - - [1024, 1024, 1, 128, 1024, 1024, 128, 128]
    - [18, 3.564]
  - - [1024, 1024, 1, 256, 1024, 1024, 256, 256]
    - [18, 5.933]
  - - [1024, 1024, 1, 512, 1024, 1024, 512, 512]
    - [20, 9.039]
  - - [1024, 1024, 1, 1024, 1024, 1024, 1024, 1024]
    - [87, 12.24]
  - - [1024, 1024, 1, 2048, 1024, 1024, 2048, 2048]
    - [83, 12.919]
  - - [1024, 1024, 1, 4096, 1024, 1024, 4096, 4096]
    - [62, 13.379]
  - - [1024, 1024, 1, 8192, 1024, 1024, 8192, 8192]
    - [51, 15.133]
  - - [1024, 2048, 1, 128, 1024, 1024, 128, 128]
    - [6, 4.917]
  - - [1024, 2048, 1, 256, 1024, 1024, 256, 256]
    - [9, 8.146]
  - - [1024, 2048, 1, 512, 1024, 1024, 512, 512]
    - [72, 11.807]
  - - [1024, 2048, 1, 1024, 1024, 1024, 1024, 1024]
    - [72, 14.149]
  - - [1024, 2048, 1, 2048, 1024, 1024, 2048, 2048]
    - [72, 15.591]
  - - [1024, 2048, 1, 4096, 1024, 1024, 4096, 4096]
    - [56, 16.659]
  - - [1024, 2048, 1, 8192, 1024, 1024, 8192, 8192]
    - [46, 17.433]
  - - [1024, 4096, 1, 128, 1024, 1024, 128, 128]
    - [37, 5.921]
  - - [1024, 4096, 1, 256, 1024, 1024, 256, 256]
    - [38, 8.951]
  - - [1024, 4096, 1, 512, 1024, 1024, 512, 512]
    - [42, 12.292]
  - - [1024, 4096, 1, 1024, 1024, 1024, 1024, 1024]
    - [48, 14.825]
  - - [1024, 4096, 1, 2048, 1024, 1024, 2048, 2048]
    - [46, 18.221]
  - - [1024, 4096, 1, 4096, 1024, 1024, 4096, 4096]
    - [43, 17.404]
  - - [1024, 4096, 1, 8192, 1024, 1024, 8192, 8192]
    - [42, 18.144]
  - - [1024, 8192, 1, 128, 1024, 1024, 128, 128]
    - [74, 5.779]
  - - [1024, 8192, 1, 256, 1024, 1024, 256, 256]
    - [73, 8.982]
  - - [1024, 8192, 1, 512, 1024, 1024, 512, 512]
    - [73, 12.542]
  - - [1024, 8192, 1, 1024, 1024, 1024, 1024, 1024]
    - [42, 15.067]
  - - [1024, 8192, 1, 2048, 1024, 1024, 2048, 2048]
    - [44, 16.046]
  - - [1024, 8192, 1, 4096, 1024, 1024, 4096, 4096]
    - [42, 18.468]
  - - [1024, 8192, 1, 8192, 1024, 1024, 8192, 8192]
    - [42, 18.129]
  - - [2048, 128, 1, 128, 2048, 2048, 128, 128]
    - [30, 1.271]
  - - [2048, 128, 1, 256, 2048, 2048, 256, 256]
    - [32, 2.218]
  - - [2048, 128, 1, 512, 2048, 2048, 512, 512]
    - [32, 3.591]
  - - [2048, 128, 1, 1024, 2048, 2048, 1024, 1024]
    - [31, 5.242]
  - - [2048, 128, 1, 2048, 2048, 2048, 2048, 2048]
    - [105, 6.996]
  - - [2048, 128, 1, 4096, 2048, 2048, 4096, 4096]
    - [84, 9.324]
  - - [2048, 128, 1, 8192, 2048, 2048, 8192, 8192]
    - [6, 10.199]
  - - [2048, 256, 1, 128, 2048, 2048, 128, 128]
    - [30, 2.183]
  - - [2048, 256, 1, 256, 2048, 2048, 256, 256]
    - [24, 3.794]
  - - [2048, 256, 1, 512, 2048, 2048, 512, 512]
    - [21, 5.952]
  - - [2048, 256, 1, 1024, 2048, 2048, 1024, 1024]
    - [91, 8.196]
  - - [2048, 256, 1, 2048, 2048, 2048, 2048, 2048]
    - [84, 10.688]
  - - [2048, 256, 1, 4096, 2048, 2048, 4096, 4096]
    - [67, 11.479]
  - - [2048, 256, 1, 8192, 2048, 2048, 8192, 8192]
    - [64, 12.232]
  - - [2048, 512, 1, 128, 2048, 2048, 128, 128]
    - [17, 3.536]
  - - [2048, 512, 1, 256, 2048, 2048, 256, 256]
    - [18, 5.905]
  - - [2048, 512, 1, 512, 2048, 2048, 512, 512]
    - [81, 9.064]
  - - [2048, 512, 1, 1024, 2048, 2048, 1024, 1024]
    - [87, 12.38]
  - - [2048, 512, 1, 2048, 2048, 2048, 2048, 2048]
    - [88, 13.798]
  - - [2048, 512, 1, 4096, 2048, 2048, 4096, 4096]
    - [62, 13.051]
  - - [2048, 512, 1, 8192, 2048, 2048, 8192, 8192]
    - [58, 15.515]
  - - [2048, 1024, 1, 128, 2048, 2048, 128, 128]
    - [73, 4.973]
  - - [2048, 1024, 1, 256, 2048, 2048, 256, 256]
    - [12, 8.139]
  - - [2048, 1024, 1, 512, 2048, 2048, 512, 512]
    - [78, 11.484]
  - - [2048, 1024, 1, 1024, 2048, 2048, 1024, 1024]
    - [10, 14.155]
  - - [2048, 1024, 1, 2048, 2048, 2048, 2048, 2048]
    - [69, 15.495]
  - - [2048, 1024, 1, 4096, 2048, 2048, 4096, 4096]
    - [56, 16.637]
  - - [2048, 1024, 1, 8192, 2048, 2048, 8192, 8192]
    - [58, 17.351]
  - - [2048, 2048, 1, 128, 2048, 2048, 128, 128]
    - [36, 5.817]
  - - [2048, 2048, 1, 256, 2048, 2048, 256, 256]
    - [36, 8.831]
  - - [2048, 2048, 1, 512, 2048, 2048, 512, 512]
    - [0, 12.813]
  - - [2048, 2048, 1, 1024, 2048, 2048, 1024, 1024]
    - [2, 14.674]
  - - [2048, 2048, 1, 2048, 2048, 2048, 2048, 2048]
    - [60, 17.638]
  - - [2048, 2048, 1, 4096, 2048, 2048, 4096, 4096]
    - [43, 18.191]
  - - [2048, 2048, 1, 8192, 2048, 2048, 8192, 8192]
    - [46, 19.424]
  - - [2048, 4096, 1, 128, 2048, 2048, 128, 128]
    - [74, 5.954]
  - - [2048, 4096, 1, 256, 2048, 2048, 256, 256]
    - [74, 9.035]
  - - [2048, 4096, 1, 512, 2048, 2048, 512, 512]
    - [72, 12.009]
  - - [2048, 4096, 1, 1024, 2048, 2048, 1024, 1024]
    - [43, 14.907]
  - - [2048, 4096, 1, 2048, 2048, 2048, 2048, 2048]
    - [42, 16.502]
  - - [2048, 4096, 1, 4096, 2048, 2048, 4096, 4096]
    - [42, 19.44]
  - - [2048, 4096, 1, 8192, 2048, 2048, 8192, 8192]
    - [46, 18.929]
  - - [2048, 8192, 1, 128, 2048, 2048, 128, 128]
    - [74, 6.802]
  - - [2048, 8192, 1, 256, 2048, 2048, 256, 256]
    - [73, 9.63]
  - - [2048, 8192, 1, 512, 2048, 2048, 512, 512]
    - [72, 12.442]
  - - [2048, 8192, 1, 1024, 2048, 2048, 1024, 1024]
    - [56, 15.631]
  - - [2048, 8192, 1, 2048, 2048, 2048, 2048, 2048]
    - [56, 17.723]
  - - [2048, 8192, 1, 4096, 2048, 2048, 4096, 4096]
    - [4, 19.501]
  - - [2048, 8192, 1, 8192, 2048, 2048, 8192, 8192]
    - [54, 20.844]
  - - [4096, 128, 1, 128, 4096, 4096, 128, 128]
    - [23, 2.213]
  - - [4096, 128, 1, 256, 4096, 4096, 256, 256]
    - [24, 3.786]
  - - [4096, 128, 1, 512, 4096, 4096, 512, 512]
    - [93, 5.781]
  - - [4096, 128, 1, 1024, 4096, 4096, 1024, 1024]
    - [92, 7.977]
  - - [4096, 128, 1, 2048, 4096, 4096, 2048, 2048]
    - [86, 9.931]
  - - [4096, 128, 1, 4096, 4096, 4096, 4096, 4096]
    - [8, 11.382]
  - - [4096, 128, 1, 8192, 4096, 4096, 8192, 8192]
    - [5, 12.332]
  - - [4096, 256, 1, 128, 4096, 4096, 128, 128]
    - [20, 3.463]
  - - [4096, 256, 1, 256, 4096, 4096, 256, 256]
    - [17, 5.809]
  - - [4096, 256, 1, 512, 4096, 4096, 512, 512]
    - [84, 8.984]
  - - [4096, 256, 1, 1024, 4096, 4096, 1024, 1024]
    - [84, 12.334]
  - - [4096, 256, 1, 2048, 4096, 4096, 2048, 2048]
    - [87, 12.909]
  - - [4096, 256, 1, 4096, 4096, 4096, 4096, 4096]
    - [63, 13.577]
  - - [4096, 256, 1, 8192, 4096, 4096, 8192, 8192]
    - [43, 15.584]
  - - [4096, 512, 1, 128, 4096, 4096, 128, 128]
    - [10, 4.96]
  - - [4096, 512, 1, 256, 4096, 4096, 256, 256]
    - [68, 8.029]
  - - [4096, 512, 1, 512, 4096, 4096, 512, 512]
    - [78, 11.463]
  - - [4096, 512, 1, 1024, 4096, 4096, 1024, 1024]
    - [68, 14.343]
  - - [4096, 512, 1, 2048, 4096, 4096, 2048, 2048]
    - [69, 15.392]
  - - [4096, 512, 1, 4096, 4096, 4096, 4096, 4096]
    - [42, 15.957]
  - - [4096, 512, 1, 8192, 4096, 4096, 8192, 8192]
    - [43, 16.466]
  - - [4096, 1024, 1, 128, 4096, 4096, 128, 128]
    - [35, 5.895]
  - - [4096, 1024, 1, 256, 4096, 4096, 256, 256]
    - [35, 8.996]
  - - [4096, 1024, 1, 512, 4096, 4096, 512, 512]
    - [0, 12.504]
  - - [4096, 1024, 1, 1024, 4096, 4096, 1024, 1024]
    - [56, 14.796]
  - - [4096, 1024, 1, 2048, 4096, 4096, 2048, 2048]
    - [55, 17.597]
  - - [4096, 1024, 1, 4096, 4096, 4096, 4096, 4096]
    - [46, 17.995]
  - - [4096, 1024, 1, 8192, 4096, 4096, 8192, 8192]
    - [42, 18.246]
  - - [4096, 2048, 1, 128, 4096, 4096, 128, 128]
    - [74, 5.667]
  - - [4096, 2048, 1, 256, 4096, 4096, 256, 256]
    - [76, 8.82]
  - - [4096, 2048, 1, 512, 4096, 4096, 512, 512]
    - [77, 11.753]
  - - [4096, 2048, 1, 1024, 4096, 4096, 1024, 1024]
    - [56, 15.093]
  - - [4096, 2048, 1, 2048, 4096, 4096, 2048, 2048]
    - [43, 17.407]
  - - [4096, 2048, 1, 4096, 4096, 4096, 4096, 4096]
    - [42, 19.343]
  - - [4096, 2048, 1, 8192, 4096, 4096, 8192, 8192]
    - [42, 20.306]
  - - [4096, 4096, 1, 128, 4096, 4096, 128, 128]
    - [72, 6.518]
  - - [4096, 4096, 1, 256, 4096, 4096, 256, 256]
    - [75, 9.17]
  - - [4096, 4096, 1, 512, 4096, 4096, 512, 512]
    - [50, 12.352]
  - - [4096, 4096, 1, 1024, 4096, 4096, 1024, 1024]
    - [54, 15.621]
  - - [4096, 4096, 1, 2048, 4096, 4096, 2048, 2048]
    - [60, 17.523]
  - - [4096, 4096, 1, 4096, 4096, 4096, 4096, 4096]
    - [56, 20.066]
  - - [4096, 4096, 1, 8192, 4096, 4096, 8192, 8192]
    - [60, 21.409]
  - - [4096, 8192, 1, 128, 4096, 4096, 128, 128]
    - [13, 5.898]
  - - [4096, 8192, 1, 256, 4096, 4096, 256, 256]
    - [72, 8.351]
  - - [4096, 8192, 1, 512, 4096, 4096, 512, 512]
    - [54, 11.848]
  - - [4096, 8192, 1, 1024, 4096, 4096, 1024, 1024]
    - [59, 15.76]
  - - [4096, 8192, 1, 2048, 4096, 4096, 2048, 2048]
    - [53, 18.233]
  - - [4096, 8192, 1, 4096, 4096, 4096, 4096, 4096]
    - [56, 21.362]
  - - [4096, 8192, 1, 8192, 4096, 4096, 8192, 8192]
    - [56, 22.808]
  - - [8192, 128, 1, 128, 8192, 8192, 128, 128]
    - [17, 3.532]
  - - [8192, 128, 1, 256, 8192, 8192, 256, 256]
    - [19, 5.806]
  - - [8192, 128, 1, 512, 8192, 8192, 512, 512]
    - [87, 8.918]
  - - [8192, 128, 1, 1024, 8192, 8192, 1024, 1024]
    - [85, 11.355]
  - - [8192, 128, 1, 2048, 8192, 8192, 2048, 2048]
    - [89, 11.721]
  - - [8192, 128, 1, 4096, 8192, 8192, 4096, 4096]
    - [7, 14.397]
  - - [8192, 128, 1, 8192, 8192, 8192, 8192, 8192]
    - [8, 15.971]
  - - [8192, 256, 1, 128, 8192, 8192, 128, 128]
    - [75, 4.867]
  - - [8192, 256, 1, 256, 8192, 8192, 256, 256]
    - [70, 7.854]
  - - [8192, 256, 1, 512, 8192, 8192, 512, 512]
    - [77, 11.053]
  - - [8192, 256, 1, 1024, 8192, 8192, 1024, 1024]
    - [68, 13.975]
  - - [8192, 256, 1, 2048, 8192, 8192, 2048, 2048]
    - [66, 15.59]
  - - [8192, 256, 1, 4096, 8192, 8192, 4096, 4096]
    - [42, 16.855]
  - - [8192, 256, 1, 8192, 8192, 8192, 8192, 8192]
    - [43, 18.313]
  - - [8192, 512, 1, 128, 8192, 8192, 128, 128]
    - [34, 5.615]
  - - [8192, 512, 1, 256, 8192, 8192, 256, 256]
    - [34, 8.699]
  - - [8192, 512, 1, 512, 8192, 8192, 512, 512]
    - [1, 12.217]
  - - [8192, 512, 1, 1024, 8192, 8192, 1024, 1024]
    - [61, 14.553]
  - - [8192, 512, 1, 2048, 8192, 8192, 2048, 2048]
    - [59, 17.753]
  - - [8192, 512, 1, 4096, 8192, 8192, 4096, 4096]
    - [45, 16.942]
  - - [8192, 512, 1, 8192, 8192, 8192, 8192, 8192]
    - [42, 18.127]
  - - [8192, 1024, 1, 128, 8192, 8192, 128, 128]
    - [79, 5.675]
  - - [8192, 1024, 1, 256, 8192, 8192, 256, 256]
    - [78, 8.47]
  - - [8192, 1024, 1, 512, 8192, 8192, 512, 512]
    - [69, 11.993]
  - - [8192, 1024, 1, 1024, 8192, 8192, 1024, 1024]
    - [60, 15.058]
  - - [8192, 1024, 1, 2048, 8192, 8192, 2048, 2048]
    - [42, 16.224]
  - - [8192, 1024, 1, 4096, 8192, 8192, 4096, 4096]
    - [42, 18.331]
  - - [8192, 1024, 1, 8192, 8192, 8192, 8192, 8192]
    - [42, 19.8]
  - - [8192, 2048, 1, 128, 8192, 8192, 128, 128]
    - [78, 6.385]
  - - [8192, 2048, 1, 256, 8192, 8192, 256, 256]
    - [77, 9.265]
  - - [8192, 2048, 1, 512, 8192, 8192, 512, 512]
    - [56, 12.086]
  - - [8192, 2048, 1, 1024, 8192, 8192, 1024, 1024]
    - [50, 15.719]
  - - [8192, 2048, 1, 2048, 8192, 8192, 2048, 2048]
    - [56, 18.311]
  - - [8192, 2048, 1, 4096, 8192, 8192, 4096, 4096]
    - [52, 19.009]
  - - [8192, 2048, 1, 8192, 8192, 8192, 8192, 8192]
    - [1, 20.936]
  - - [8192, 4096, 1, 128, 8192, 8192, 128, 128]
    - [11, 5.889]
  - - [8192, 4096, 1, 256, 8192, 8192, 256, 256]
    - [75, 8.342]
  - - [8192, 4096, 1, 512, 8192, 8192, 512, 512]
    - [54, 11.938]
  - - [8192, 4096, 1, 1024, 8192, 8192, 1024, 1024]
    - [57, 15.996]
  - - [8192, 4096, 1, 2048, 8192, 8192, 2048, 2048]
    - [50, 18.35]
  - - [8192, 4096, 1, 4096, 8192, 8192, 4096, 4096]
    - [51, 21.514]
  - - [8192, 4096, 1, 8192, 8192, 8192, 8192, 8192]
    - [51, 22.989]
  - - [8192, 8192, 1, 128, 8192, 8192, 128, 128]
    - [13, 5.301]
  - - [8192, 8192, 1, 256, 8192, 8192, 256, 256]
    - [50, 8.074]
  - - [8192, 8192, 1, 512, 8192, 8192, 512, 512]
    - [58, 12.803]
  - - [8192, 8192, 1, 1024, 8192, 8192, 1024, 1024]
    - [56, 17.027]
  - - [8192, 8192, 1, 2048, 8192, 8192, 2048, 2048]
    - [53, 19.589]
  - - [8192, 8192, 1, 4096, 8192, 8192, 4096, 4096]
    - [49, 21.686]
  - - [8192, 8192, 1, 8192, 8192, 8192, 8192, 8192]
    - [51, 22.54]
  - - [1, 1, 1, 32, 1, 1, 32, 32]
    - [107, 0.0]
- null
- null
- DeviceEfficiency
- GridBased
