library/src/amd_detail/rocblaslt/src/Tensile/Logic/streamk/gfx942a/aquavanjaram942_Cijk_Ailk_Bjlk_HSS_BH_UserArgs.yaml
- {MinimumRequiredVersion: 4.33.0}
- aquavanjaram942
- gfx942
- [Device 0049, Device 0050]
    SolutionIndex: 0
    SolutionNameMin: Cijk_Ailk_Bjlk_HSS_BH_UserArgs_MT256x256x32_MI16x16x1_SN_LDSB0_CLR1_GSU0_GSUC0_GSUWGMRR0_K1_LBSPPA2048_LBSPPB2048_LPA0_LPB0_MIWT8_8_PLR1_SU32_SUM0_SUS256_SKXCCM0_VWA4_VWB8_WGM8_WGMXCC1_WGMXCCGn1
    SolutionIndex: 1
    SolutionNameMin: Cijk_Ailk_Bjlk_HSS_BH_UserArgs_MT128x256x32_MI16x16x1_SN_LDSB1_CLR1_GSU0_GSUC0_GSUWGMRR0_K1_LBSPPA1024_LBSPPB2048_LPA0_LPB32_MIWT4_8_PLR1_SU32_SUM0_SUS256_SKXCCM0_VWA4_VWB2_WGM1_WGMXCC1_WGMXCCGn1
    SolutionIndex: 2
    SolutionNameMin: Cijk_Ailk_Bjlk_HSS_BH_UserArgs_MT128x256x32_MI16x16x1_SN_LDSB1_CLR1_GSU0_GSUC0_GSUWGMRR0_K1_LBSPPA1024_LBSPPB2048_LPA0_LPB0_MIWT4_8_PLR1_SU32_SUM0_SUS256_SKXCCM0_VWA4_VWB4_WGM1_WGMXCC1_WGMXCCGn1
    SolutionIndex: 3
    SolutionNameMin: Cijk_Ailk_Bjlk_HSS_BH_UserArgs_MT128x256x32_MI16x16x1_SN_LDSB1_CLR1_GSU0_GSUC0_GSUWGMRR0_K1_LBSPPA1024_LBSPPB2048_LPA0_LPB32_MIWT4_8_PLR1_SU32_SUM0_SUS256_SKXCCM0_VWA4_VWB2_WGM8_WGMXCC1_WGMXCCGn1
    SolutionIndex: 4
    SolutionNameMin: Cijk_Ailk_Bjlk_HSS_BH_UserArgs_MT128x256x32_MI16x16x1_SN_LDSB1_CLR1_GSU0_GSUC0_GSUWGMRR0_K1_LBSPPA1024_LBSPPB2048_LPA0_LPB0_MIWT4_8_PLR1_SU32_SUM0_SUS256_SKXCCM0_VWA4_VWB4_WGM8_WGMXCC1_WGMXCCGn1
    SolutionIndex: 5
    SolutionNameMin: Cijk_Ailk_Bjlk_HSS_BH_UserArgs_MT256x128x32_MI16x16x1_SN_LDSB1_CLR1_GSU0_GSUC0_GSUWGMRR0_K1_LBSPPA2048_LBSPPB1024_LPA0_LPB0_MIWT8_4_PLR1_SU32_SUM0_SUS256_SKXCCM0_VWA4_VWB4_WGM1_WGMXCC1_WGMXCCGn1
    SolutionIndex: 6
    SolutionNameMin: Cijk_Ailk_Bjlk_HSS_BH_UserArgs_MT128x128x32_MI16x16x1_SN_LDSB1_CLR1_GSU0_GSUC0_GSUWGMRR0_K1_LBSPPA1024_LBSPPB1024_LPA0_LPB16_MIWT4_4_PLR1_SU32_SUM0_SUS256_SKXCCM0_VWA4_VWB1_WGM1_WGMXCC1_WGMXCCGn1
    SolutionIndex: 7
    SolutionNameMin: Cijk_Ailk_Bjlk_HSS_BH_UserArgs_MT128x128x32_MI16x16x1_SN_LDSB0_CLR0_GSU0_GSUC0_GSUWGMRR0_K1_LBSPPA1024_LBSPPB1024_LPA0_LPB0_MIWT4_4_PLR0_SU32_SUM0_SUS256_SKXCCM0_VWA4_VWB4_WGM4_WGMXCC1_WGMXCCGn1
    SolutionIndex: 8
    SolutionNameMin: Cijk_Ailk_Bjlk_HSS_BH_UserArgs_MT64x128x32_MI16x16x1_SN_LDSB0_CLR1_GSU0_GSUC0_GSUWGMRR0_K1_LBSPPA512_LBSPPB1024_LPA32_LPB0_MIWT2_4_PLR1_SU32_SUM0_SUS256_SKXCCM0_VWA2_VWB4_WGM1_WGMXCC1_WGMXCCGn1
    SolutionIndex: 9
    SolutionNameMin: Cijk_Ailk_Bjlk_HSS_BH_UserArgs_MT128x64x32_MI16x16x1_SN_LDSB0_CLR1_GSU0_GSUC0_GSUWGMRR0_K1_LBSPPA1024_LBSPPB512_LPA0_LPB16_MIWT4_2_PLR1_SU32_SUM0_SUS256_SKXCCM0_VWA4_VWB1_WGM1_WGMXCC1_WGMXCCGn1
    SolutionIndex: 10
    SolutionNameMin: Cijk_Ailk_Bjlk_HSS_BH_UserArgs_MT128x64x32_MI16x16x1_SN_LDSB0_CLR1_GSU0_GSUC0_GSUWGMRR0_K1_LBSPPA1024_LBSPPB512_LPA0_LPB32_MIWT4_2_PLR1_SU32_SUM0_SUS256_SKXCCM0_VWA4_VWB2_WGM1_WGMXCC1_WGMXCCGn1
    SolutionIndex: 11
    SolutionNameMin: Cijk_Ailk_Bjlk_HSS_BH_UserArgs_MT128x64x32_MI16x16x1_SN_LDSB0_CLR1_GSU0_GSUC0_GSUWGMRR0_K1_LBSPPA1024_LBSPPB512_LPA0_LPB32_MIWT4_2_PLR1_SU32_SUM0_SUS256_SKXCCM0_VWA4_VWB2_WGM4_WGMXCC1_WGMXCCGn1
    SolutionIndex: 12
    SolutionNameMin: Cijk_Ailk_Bjlk_HSS_BH_UserArgs_MT128x64x32_MI16x16x1_SN_LDSB0_CLR1_GSU0_GSUC0_GSUWGMRR0_K1_LBSPPA1024_LBSPPB512_LPA0_LPB32_MIWT4_2_PLR1_SU32_SUM0_SUS256_SKXCCM0_VWA4_VWB2_WGM8_WGMXCC1_WGMXCCGn1
    SolutionIndex: 13
    SolutionNameMin: Cijk_Ailk_Bjlk_HSS_BH_UserArgs_MT64x64x32_MI16x16x1_SN_LDSB0_CLR1_GSU0_GSUC0_GSUWGMRR0_K1_LBSPPA512_LBSPPB512_LPA16_LPB32_MIWT2_2_PLR1_SU32_SUM0_SUS256_SKXCCM0_VWA1_VWB2_WGM1_WGMXCC1_WGMXCCGn1
    SolutionIndex: 14
    SolutionNameMin: Cijk_Ailk_Bjlk_HSS_BH_UserArgs_MT64x64x32_MI16x16x1_SN_LDSB0_CLR1_GSU0_GSUC0_GSUWGMRR0_K1_LBSPPA512_LBSPPB512_LPA32_LPB32_MIWT2_2_PLR1_SU32_SUM0_SUS256_SKXCCM0_VWA2_VWB2_WGM1_WGMXCC1_WGMXCCGn1
    SolutionIndex: 15
    SolutionNameMin: Cijk_Ailk_Bjlk_HSS_BH_UserArgs_MT64x64x32_MI16x16x1_SN_LDSB0_CLR0_GSU0_GSUC0_GSUWGMRR0_K1_LBSPPA512_LBSPPB512_LPA32_LPB32_MIWT2_2_PLR0_SU32_SUM0_SUS256_SKXCCM0_VWA2_VWB2_WGM8_WGMXCC1_WGMXCCGn1
    SolutionIndex: 16
    SolutionNameMin: Cijk_Ailk_Bjlk_HSS_BH_UserArgs_MT32x32x32_MI16x16x1_SN_LDSB0_CLR1_GSU0_GSUC0_GSUWGMRR0_K1_LBSPPA256_LBSPPB256_LPA16_LPB16_MIWT1_1_PLR1_SU32_SUM0_SUS256_SKXCCM0_VWA1_VWB1_WGM1_WGMXCC1_WGMXCCGn1
    SolutionIndex: 17
    SolutionNameMin: Cijk_Ailk_Bjlk_HSS_BH_UserArgs_MT128x256x64_MI16x16x1_SN_LDSB1_CLR1_GSU0_GSUC0_GSUWGMRR0_K1_LBSPPA1024_LBSPPB2048_LPA0_LPB32_MIWT4_8_PLR2_SU32_SUM0_SUS256_SKXCCM0_VWA4_VWB2_WGM4_WGMXCC1_WGMXCCGn1
    SolutionIndex: 18
    SolutionNameMin: Cijk_Ailk_Bjlk_HSS_BH_UserArgs_MT128x128x64_MI16x16x1_SN_LDSB1_CLR1_GSU0_GSUC0_GSUWGMRR0_K1_LBSPPA1024_LBSPPB1024_LPA0_LPB0_MIWT4_4_PLR2_SU32_SUM0_SUS256_SKXCCM0_VWA4_VWB4_WGM1_WGMXCC1_WGMXCCGn1
    SolutionIndex: 19
    SolutionNameMin: Cijk_Ailk_Bjlk_HSS_BH_UserArgs_MT128x64x64_MI16x16x1_SN_LDSB1_CLR1_GSU0_GSUC0_GSUWGMRR0_K1_LBSPPA1024_LBSPPB512_LPA0_LPB32_MIWT4_2_PLR2_SU32_SUM0_SUS256_SKXCCM0_VWA4_VWB2_WGM1_WGMXCC1_WGMXCCGn1
    SolutionIndex: 20
    SolutionNameMin: Cijk_Ailk_Bjlk_HSS_BH_UserArgs_MT128x64x64_MI16x16x1_SN_LDSB1_CLR1_GSU0_GSUC0_GSUWGMRR0_K1_LBSPPA1024_LBSPPB512_LPA0_LPB32_MIWT4_2_PLR1_SU32_SUM0_SUS256_SKXCCM0_VWA4_VWB2_WGM4_WGMXCC1_WGMXCCGn1
    SolutionIndex: 21
    SolutionNameMin: Cijk_Ailk_Bjlk_HSS_BH_UserArgs_MT128x64x64_MI16x16x1_SN_LDSB1_CLR1_GSU0_GSUC0_GSUWGMRR0_K1_LBSPPA1024_LBSPPB512_LPA0_LPB32_MIWT4_2_PLR2_SU32_SUM0_SUS256_SKXCCM0_VWA4_VWB2_WGM4_WGMXCC1_WGMXCCGn1
    SolutionIndex: 22
    SolutionNameMin: Cijk_Ailk_Bjlk_HSS_BH_UserArgs_MT128x64x64_MI16x16x1_SN_LDSB1_CLR1_GSU0_GSUC0_GSUWGMRR0_K1_LBSPPA1024_LBSPPB512_LPA0_LPB32_MIWT4_2_PLR2_SU32_SUM0_SUS256_SKXCCM0_VWA4_VWB2_WGM8_WGMXCC1_WGMXCCGn1
    SolutionIndex: 23
    SolutionNameMin: Cijk_Ailk_Bjlk_HSS_BH_UserArgs_MT64x64x64_MI16x16x1_SN_LDSB1_CLR1_GSU0_GSUC0_GSUWGMRR0_K1_LBSPPA512_LBSPPB512_LPA16_LPB32_MIWT2_2_PLR1_SU32_SUM0_SUS256_SKXCCM0_VWA1_VWB2_WGM1_WGMXCC1_WGMXCCGn1
    SolutionIndex: 24
    SolutionNameMin: Cijk_Ailk_Bjlk_HSS_BH_UserArgs_MT64x64x64_MI16x16x1_SN_LDSB1_CLR1_GSU0_GSUC0_GSUWGMRR0_K1_LBSPPA512_LBSPPB512_LPA32_LPB32_MIWT2_2_PLR1_SU32_SUM0_SUS256_SKXCCM0_VWA2_VWB2_WGM1_WGMXCC1_WGMXCCGn1
    SolutionIndex: 25
    SolutionNameMin: Cijk_Ailk_Bjlk_HSS_BH_UserArgs_MT64x64x64_MI16x16x1_SN_LDSB1_CLR1_GSU0_GSUC0_GSUWGMRR0_K1_LBSPPA512_LBSPPB512_LPA32_LPB32_MIWT2_2_PLR2_SU32_SUM0_SUS256_SKXCCM0_VWA2_VWB2_WGM1_WGMXCC1_WGMXCCGn1
    SolutionIndex: 26
    SolutionNameMin: Cijk_Ailk_Bjlk_HSS_BH_UserArgs_MT64x64x64_MI16x16x1_SN_LDSB1_CLR1_GSU0_GSUC0_GSUWGMRR0_K1_LBSPPA512_LBSPPB512_LPA32_LPB32_MIWT2_2_PLR1_SU32_SUM0_SUS256_SKXCCM0_VWA2_VWB2_WGM4_WGMXCC1_WGMXCCGn1
    SolutionIndex: 27
    SolutionNameMin: Cijk_Ailk_Bjlk_HSS_BH_UserArgs_MT64x64x64_MI16x16x1_SN_LDSB1_CLR1_GSU0_GSUC0_GSUWGMRR0_K1_LBSPPA512_LBSPPB512_LPA32_LPB32_MIWT2_2_PLR1_SU32_SUM0_SUS256_SKXCCM0_VWA2_VWB2_WGM8_WGMXCC1_WGMXCCGn1
    SolutionIndex: 28
    SolutionNameMin: Cijk_Ailk_Bjlk_HSS_BH_UserArgs_MT32x64x64_MI16x16x1_SN_LDSB0_CLR1_GSU0_GSUC0_GSUWGMRR0_K1_LBSPPA256_LBSPPB512_LPA16_LPB32_MIWT1_2_PLR2_SU32_SUM0_SUS256_SKXCCM0_VWA1_VWB2_WGM1_WGMXCC1_WGMXCCGn1
    SolutionIndex: 29
    SolutionNameMin: Cijk_Ailk_Bjlk_HSS_BH_UserArgs_MT64x32x64_MI16x16x1_SN_LDSB0_CLR1_GSU0_GSUC0_GSUWGMRR0_K1_LBSPPA512_LBSPPB256_LPA32_LPB16_MIWT2_1_PLR2_SU32_SUM0_SUS256_SKXCCM0_VWA2_VWB1_WGM1_WGMXCC1_WGMXCCGn1
    SolutionIndex: 30
    SolutionNameMin: Cijk_Ailk_Bjlk_HSS_BH_UserArgs_MT128x128x128_MI16x16x1_SN_LDSB1_CLR1_GSU0_GSUC0_GSUWGMRR0_K1_LBSPPA1024_LBSPPB1024_LPA0_LPB0_MIWT4_4_PLR1_SU32_SUM0_SUS256_SKXCCM0_VWA4_VWB4_WGM8_WGMXCC1_WGMXCCGn1
    SolutionIndex: 31
    SolutionNameMin: Cijk_Ailk_Bjlk_HSS_BH_UserArgs_MT64x64x128_MI16x16x1_SN_LDSB1_CLR1_GSU0_GSUC0_GSUWGMRR0_K1_LBSPPA512_LBSPPB512_LPA16_LPB32_MIWT2_2_PLR2_SU32_SUM0_SUS256_SKXCCM0_VWA1_VWB2_WGM1_WGMXCC1_WGMXCCGn1
    SolutionIndex: 32
    SolutionNameMin: Cijk_Ailk_Bjlk_HSS_BH_UserArgs_MT64x64x128_MI16x16x1_SN_LDSB1_CLR1_GSU0_GSUC0_GSUWGMRR0_K1_LBSPPA512_LBSPPB512_LPA32_LPB32_MIWT2_2_PLR2_SU32_SUM0_SUS256_SKXCCM0_VWA2_VWB2_WGM1_WGMXCC1_WGMXCCGn1
    SolutionIndex: 33
    SolutionNameMin: Cijk_Ailk_Bjlk_HSS_BH_UserArgs_MT64x64x128_MI16x16x1_SN_LDSB1_CLR1_GSU0_GSUC0_GSUWGMRR0_K1_LBSPPA512_LBSPPB512_LPA32_LPB32_MIWT2_2_PLR2_SU32_SUM0_SUS256_SKXCCM0_VWA2_VWB2_WGM4_WGMXCC1_WGMXCCGn1
    SolutionIndex: 34
    SolutionNameMin: Cijk_Ailk_Bjlk_HSS_BH_UserArgs_MT32x64x128_MI16x16x1_SN_LDSB1_CLR1_GSU0_GSUC0_GSUWGMRR0_K1_LBSPPA256_LBSPPB512_LPA16_LPB32_MIWT1_2_PLR1_SU32_SUM0_SUS256_SKXCCM0_VWA1_VWB2_WGM1_WGMXCC1_WGMXCCGn1
    SolutionIndex: 35
    SolutionNameMin: Cijk_Ailk_Bjlk_HSS_BH_UserArgs_MT32x64x128_MI16x16x1_SN_LDSB1_CLR1_GSU0_GSUC0_GSUWGMRR0_K1_LBSPPA256_LBSPPB512_LPA16_LPB32_MIWT1_2_PLR2_SU32_SUM0_SUS256_SKXCCM0_VWA1_VWB2_WGM1_WGMXCC1_WGMXCCGn1
    SolutionIndex: 36
    SolutionNameMin: Cijk_Ailk_Bjlk_HSS_BH_UserArgs_MT64x32x128_MI16x16x1_SN_LDSB1_CLR1_GSU0_GSUC0_GSUWGMRR0_K1_LBSPPA512_LBSPPB256_LPA32_LPB16_MIWT2_1_PLR2_SU32_SUM0_SUS256_SKXCCM0_VWA2_VWB1_WGM1_WGMXCC1_WGMXCCGn1
    SolutionIndex: 37
    SolutionNameMin: Cijk_Ailk_Bjlk_HSS_BH_UserArgs_MT32x32x128_MI16x16x1_SN_LDSB1_CLR1_GSU0_GSUC0_GSUWGMRR0_K1_LBSPPA256_LBSPPB256_LPA16_LPB16_MIWT1_1_PLR1_SU32_SUM0_SUS256_SKXCCM0_VWA1_VWB1_WGM1_WGMXCC1_WGMXCCGn1
    SolutionIndex: 38
    SolutionNameMin: Cijk_Ailk_Bjlk_HSS_BH_UserArgs_MT32x32x128_MI16x16x1_SN_LDSB1_CLR1_GSU0_GSUC0_GSUWGMRR0_K1_LBSPPA256_LBSPPB256_LPA16_LPB16_MIWT1_1_PLR2_SU32_SUM0_SUS256_SKXCCM0_VWA1_VWB1_WGM1_WGMXCC1_WGMXCCGn1
    SolutionIndex: 39
    SolutionNameMin: Cijk_Ailk_Bjlk_HSS_BH_UserArgs_MT256x256x32_MI16x16x1_SN_LDSB1_CLR1_GSU0_GSUC0_GSUWGMRR0_K1_LBSPPA2048_LBSPPB2048_LPA0_LPB32_MIWT8_8_PLR1_SU32_SUM0_SUS256_SKXCCM6_VWA4_VWB2_WGM1_WGMXCC1_WGMXCCGn1
    SolutionIndex: 40
    SolutionNameMin: Cijk_Ailk_Bjlk_HSS_BH_UserArgs_MT256x256x32_MI16x16x1_SN_LDSB0_CLR1_GSU0_GSUC0_GSUWGMRR0_K1_LBSPPA2048_LBSPPB2048_LPA0_LPB0_MIWT8_8_PLR1_SU32_SUM0_SUS256_SKXCCM6_VWA4_VWB4_WGM1_WGMXCC1_WGMXCCGn1
    SolutionIndex: 41
    SolutionNameMin: Cijk_Ailk_Bjlk_HSS_BH_UserArgs_MT256x256x32_MI16x16x1_SN_LDSB0_CLR1_GSU0_GSUC0_GSUWGMRR0_K1_LBSPPA2048_LBSPPB2048_LPA0_LPB0_MIWT8_8_PLR1_SU32_SUM0_SUS256_SKXCCM6_VWA4_VWB8_WGM1_WGMXCC1_WGMXCCGn1
    SolutionIndex: 42
    SolutionNameMin: Cijk_Ailk_Bjlk_HSS_BH_UserArgs_MT256x256x32_MI16x16x1_SN_LDSB0_CLR1_GSU0_GSUC0_GSUWGMRR0_K1_LBSPPA2048_LBSPPB2048_LPA0_LPB0_MIWT8_8_PLR1_SU32_SUM0_SUS256_SKXCCM6_VWA4_VWB4_WGM4_WGMXCC1_WGMXCCGn1
    SolutionIndex: 43
    SolutionNameMin: Cijk_Ailk_Bjlk_HSS_BH_UserArgs_MT256x256x32_MI16x16x1_SN_LDSB0_CLR1_GSU0_GSUC0_GSUWGMRR0_K1_LBSPPA2048_LBSPPB2048_LPA0_LPB0_MIWT8_8_PLR1_SU32_SUM0_SUS256_SKXCCM6_VWA4_VWB8_WGM8_WGMXCC1_WGMXCCGn1
    SolutionIndex: 44
    SolutionNameMin: Cijk_Ailk_Bjlk_HSS_BH_UserArgs_MT128x256x32_MI16x16x1_SN_LDSB1_CLR1_GSU0_GSUC0_GSUWGMRR0_K1_LBSPPA1024_LBSPPB2048_LPA0_LPB32_MIWT4_8_PLR1_SU32_SUM0_SUS256_SKXCCM6_VWA4_VWB2_WGM1_WGMXCC1_WGMXCCGn1
    SolutionIndex: 45
    SolutionNameMin: Cijk_Ailk_Bjlk_HSS_BH_UserArgs_MT128x256x32_MI16x16x1_SN_LDSB1_CLR1_GSU0_GSUC0_GSUWGMRR0_K1_LBSPPA1024_LBSPPB2048_LPA0_LPB0_MIWT4_8_PLR1_SU32_SUM0_SUS256_SKXCCM6_VWA4_VWB4_WGM1_WGMXCC1_WGMXCCGn1
    SolutionIndex: 46
    SolutionNameMin: Cijk_Ailk_Bjlk_HSS_BH_UserArgs_MT128x256x32_MI16x16x1_SN_LDSB1_CLR1_GSU0_GSUC0_GSUWGMRR0_K1_LBSPPA1024_LBSPPB2048_LPA32_LPB0_MIWT4_8_PLR1_SU32_SUM0_SUS256_SKXCCM6_VWA2_VWB8_WGM1_WGMXCC1_WGMXCCGn1
    SolutionIndex: 47
    SolutionNameMin: Cijk_Ailk_Bjlk_HSS_BH_UserArgs_MT128x256x32_MI16x16x1_SN_LDSB1_CLR1_GSU0_GSUC0_GSUWGMRR0_K1_LBSPPA1024_LBSPPB2048_LPA0_LPB0_MIWT4_8_PLR1_SU32_SUM0_SUS256_SKXCCM6_VWA4_VWB8_WGM1_WGMXCC1_WGMXCCGn1
    SolutionIndex: 48
    SolutionNameMin: Cijk_Ailk_Bjlk_HSS_BH_UserArgs_MT128x256x32_MI16x16x1_SN_LDSB1_CLR1_GSU0_GSUC0_GSUWGMRR0_K1_LBSPPA1024_LBSPPB2048_LPA0_LPB32_MIWT4_8_PLR1_SU32_SUM0_SUS256_SKXCCM6_VWA4_VWB2_WGM4_WGMXCC1_WGMXCCGn1
    SolutionIndex: 49
    SolutionNameMin: Cijk_Ailk_Bjlk_HSS_BH_UserArgs_MT128x256x32_MI16x16x1_SN_LDSB1_CLR1_GSU0_GSUC0_GSUWGMRR0_K1_LBSPPA1024_LBSPPB2048_LPA0_LPB0_MIWT4_8_PLR1_SU32_SUM0_SUS256_SKXCCM6_VWA4_VWB4_WGM4_WGMXCC1_WGMXCCGn1
    SolutionIndex: 50
    SolutionNameMin: Cijk_Ailk_Bjlk_HSS_BH_UserArgs_MT128x256x32_MI16x16x1_SN_LDSB1_CLR1_GSU0_GSUC0_GSUWGMRR0_K1_LBSPPA1024_LBSPPB2048_LPA0_LPB0_MIWT4_8_PLR1_SU32_SUM0_SUS256_SKXCCM6_VWA4_VWB8_WGM4_WGMXCC1_WGMXCCGn1
    SolutionIndex: 51
    SolutionNameMin: Cijk_Ailk_Bjlk_HSS_BH_UserArgs_MT128x256x32_MI16x16x1_SN_LDSB1_CLR1_GSU0_GSUC0_GSUWGMRR0_K1_LBSPPA1024_LBSPPB2048_LPA0_LPB32_MIWT4_8_PLR1_SU32_SUM0_SUS256_SKXCCM6_VWA4_VWB2_WGM8_WGMXCC1_WGMXCCGn1
    SolutionIndex: 52
    SolutionNameMin: Cijk_Ailk_Bjlk_HSS_BH_UserArgs_MT128x256x32_MI16x16x1_SN_LDSB1_CLR1_GSU0_GSUC0_GSUWGMRR0_K1_LBSPPA1024_LBSPPB2048_LPA0_LPB0_MIWT4_8_PLR1_SU32_SUM0_SUS256_SKXCCM6_VWA4_VWB4_WGM8_WGMXCC1_WGMXCCGn1
    SolutionIndex: 53
    SolutionNameMin: Cijk_Ailk_Bjlk_HSS_BH_UserArgs_MT256x128x32_MI16x16x1_SN_LDSB1_CLR1_GSU0_GSUC0_GSUWGMRR0_K1_LBSPPA2048_LBSPPB1024_LPA0_LPB0_MIWT8_4_PLR1_SU32_SUM0_SUS256_SKXCCM6_VWA4_VWB4_WGM1_WGMXCC1_WGMXCCGn1
    SolutionIndex: 54
    SolutionNameMin: Cijk_Ailk_Bjlk_HSS_BH_UserArgs_MT256x128x32_MI16x16x1_SN_LDSB1_CLR1_GSU0_GSUC0_GSUWGMRR0_K1_LBSPPA2048_LBSPPB1024_LPA0_LPB0_MIWT8_4_PLR1_SU32_SUM0_SUS256_SKXCCM6_VWA4_VWB4_WGM4_WGMXCC1_WGMXCCGn1
    SolutionIndex: 55
    SolutionNameMin: Cijk_Ailk_Bjlk_HSS_BH_UserArgs_MT256x128x32_MI16x16x1_SN_LDSB1_CLR1_GSU0_GSUC0_GSUWGMRR0_K1_LBSPPA2048_LBSPPB1024_LPA0_LPB32_MIWT8_4_PLR1_SU32_SUM0_SUS256_SKXCCM6_VWA4_VWB2_WGM8_WGMXCC1_WGMXCCGn1
    SolutionIndex: 56
    SolutionNameMin: Cijk_Ailk_Bjlk_HSS_BH_UserArgs_MT256x128x32_MI16x16x1_SN_LDSB1_CLR1_GSU0_GSUC0_GSUWGMRR0_K1_LBSPPA2048_LBSPPB1024_LPA0_LPB0_MIWT8_4_PLR1_SU32_SUM0_SUS256_SKXCCM6_VWA4_VWB4_WGM8_WGMXCC1_WGMXCCGn1
    SolutionIndex: 57
    SolutionNameMin: Cijk_Ailk_Bjlk_HSS_BH_UserArgs_MT128x128x32_MI16x16x1_SN_LDSB1_CLR1_GSU0_GSUC0_GSUWGMRR0_K1_LBSPPA1024_LBSPPB1024_LPA16_LPB32_MIWT4_4_PLR1_SU32_SUM0_SUS256_SKXCCM6_VWA1_VWB2_WGM1_WGMXCC1_WGMXCCGn1
    SolutionIndex: 58
    SolutionNameMin: Cijk_Ailk_Bjlk_HSS_BH_UserArgs_MT128x128x32_MI16x16x1_SN_LDSB1_CLR1_GSU0_GSUC0_GSUWGMRR0_K1_LBSPPA1024_LBSPPB1024_LPA0_LPB32_MIWT4_4_PLR1_SU32_SUM0_SUS256_SKXCCM6_VWA4_VWB2_WGM1_WGMXCC1_WGMXCCGn1
    SolutionIndex: 59
    SolutionNameMin: Cijk_Ailk_Bjlk_HSS_BH_UserArgs_MT128x128x32_MI16x16x1_SN_LDSB0_CLR1_GSU0_GSUC0_GSUWGMRR0_K1_LBSPPA1024_LBSPPB1024_LPA0_LPB0_MIWT4_4_PLR1_SU32_SUM0_SUS256_SKXCCM6_VWA4_VWB4_WGM1_WGMXCC1_WGMXCCGn1
    SolutionIndex: 60
    SolutionNameMin: Cijk_Ailk_Bjlk_HSS_BH_UserArgs_MT128x128x32_MI16x16x1_SN_LDSB0_CLR0_GSU0_GSUC0_GSUWGMRR0_K1_LBSPPA1024_LBSPPB1024_LPA0_LPB0_MIWT4_4_PLR0_SU32_SUM0_SUS256_SKXCCM6_VWA4_VWB4_WGM1_WGMXCC1_WGMXCCGn1
    SolutionIndex: 61
    SolutionNameMin: Cijk_Ailk_Bjlk_HSS_BH_UserArgs_MT128x128x32_MI16x16x1_SN_LDSB0_CLR1_GSU0_GSUC0_GSUWGMRR0_K1_LBSPPA1024_LBSPPB1024_LPA0_LPB0_MIWT4_4_PLR1_SU32_SUM0_SUS256_SKXCCM6_VWA4_VWB4_WGM4_WGMXCC1_WGMXCCGn1
    SolutionIndex: 62
    SolutionNameMin: Cijk_Ailk_Bjlk_HSS_BH_UserArgs_MT128x128x32_MI16x16x1_SN_LDSB0_CLR0_GSU0_GSUC0_GSUWGMRR0_K1_LBSPPA1024_LBSPPB1024_LPA0_LPB0_MIWT4_4_PLR0_SU32_SUM0_SUS256_SKXCCM6_VWA4_VWB4_WGM4_WGMXCC1_WGMXCCGn1
    SolutionIndex: 63
    SolutionNameMin: Cijk_Ailk_Bjlk_HSS_BH_UserArgs_MT128x128x32_MI16x16x1_SN_LDSB1_CLR1_GSU0_GSUC0_GSUWGMRR0_K1_LBSPPA1024_LBSPPB1024_LPA16_LPB16_MIWT4_4_PLR1_SU32_SUM0_SUS256_SKXCCM6_VWA1_VWB1_WGM8_WGMXCC1_WGMXCCGn1
    SolutionIndex: 64
    SolutionNameMin: Cijk_Ailk_Bjlk_HSS_BH_UserArgs_MT128x128x32_MI16x16x1_SN_LDSB1_CLR1_GSU0_GSUC0_GSUWGMRR0_K1_LBSPPA1024_LBSPPB1024_LPA0_LPB16_MIWT4_4_PLR1_SU32_SUM0_SUS256_SKXCCM6_VWA4_VWB1_WGM8_WGMXCC1_WGMXCCGn1
    SolutionIndex: 65
    SolutionNameMin: Cijk_Ailk_Bjlk_HSS_BH_UserArgs_MT128x128x32_MI16x16x1_SN_LDSB1_CLR1_GSU0_GSUC0_GSUWGMRR0_K1_LBSPPA1024_LBSPPB1024_LPA0_LPB32_MIWT4_4_PLR1_SU32_SUM0_SUS256_SKXCCM6_VWA4_VWB2_WGM8_WGMXCC1_WGMXCCGn1
    SolutionIndex: 66
    SolutionNameMin: Cijk_Ailk_Bjlk_HSS_BH_UserArgs_MT128x128x32_MI16x16x1_SN_LDSB1_CLR1_GSU0_GSUC0_GSUWGMRR0_K1_LBSPPA1024_LBSPPB1024_LPA16_LPB0_MIWT4_4_PLR1_SU32_SUM0_SUS256_SKXCCM6_VWA1_VWB4_WGM8_WGMXCC1_WGMXCCGn1
    SolutionIndex: 67
    SolutionNameMin: Cijk_Ailk_Bjlk_HSS_BH_UserArgs_MT128x128x32_MI16x16x1_SN_LDSB0_CLR1_GSU0_GSUC0_GSUWGMRR0_K1_LBSPPA1024_LBSPPB1024_LPA0_LPB0_MIWT4_4_PLR1_SU32_SUM0_SUS256_SKXCCM6_VWA4_VWB4_WGM8_WGMXCC1_WGMXCCGn1
    SolutionIndex: 68
    SolutionNameMin: Cijk_Ailk_Bjlk_HSS_BH_UserArgs_MT128x128x32_MI16x16x1_SN_LDSB0_CLR0_GSU0_GSUC0_GSUWGMRR0_K1_LBSPPA1024_LBSPPB1024_LPA0_LPB0_MIWT4_4_PLR0_SU32_SUM0_SUS256_SKXCCM6_VWA4_VWB4_WGM8_WGMXCC1_WGMXCCGn1
    SolutionIndex: 69
    SolutionNameMin: Cijk_Ailk_Bjlk_HSS_BH_UserArgs_MT128x64x32_MI16x16x1_SN_LDSB0_CLR1_GSU0_GSUC0_GSUWGMRR0_K1_LBSPPA1024_LBSPPB512_LPA0_LPB32_MIWT4_2_PLR1_SU32_SUM0_SUS256_SKXCCM6_VWA4_VWB2_WGM1_WGMXCC1_WGMXCCGn1
    SolutionIndex: 70
    SolutionNameMin: Cijk_Ailk_Bjlk_HSS_BH_UserArgs_MT128x64x32_MI16x16x1_SN_LDSB0_CLR1_GSU0_GSUC0_GSUWGMRR0_K1_LBSPPA1024_LBSPPB512_LPA0_LPB32_MIWT4_2_PLR1_SU32_SUM0_SUS256_SKXCCM6_VWA4_VWB2_WGM4_WGMXCC1_WGMXCCGn1
    SolutionIndex: 71
    SolutionNameMin: Cijk_Ailk_Bjlk_HSS_BH_UserArgs_MT128x64x32_MI16x16x1_SN_LDSB0_CLR1_GSU0_GSUC0_GSUWGMRR0_K1_LBSPPA1024_LBSPPB512_LPA0_LPB32_MIWT4_2_PLR1_SU32_SUM0_SUS256_SKXCCM6_VWA4_VWB2_WGM8_WGMXCC1_WGMXCCGn1
    SolutionIndex: 72
    SolutionNameMin: Cijk_Ailk_Bjlk_HSS_BH_UserArgs_MT64x64x32_MI16x16x1_SN_LDSB0_CLR0_GSU0_GSUC0_GSUWGMRR0_K1_LBSPPA512_LBSPPB512_LPA32_LPB32_MIWT2_2_PLR0_SU32_SUM0_SUS256_SKXCCM6_VWA2_VWB2_WGM8_WGMXCC1_WGMXCCGn1
    SolutionIndex: 73
    SolutionNameMin: Cijk_Ailk_Bjlk_HSS_BH_UserArgs_MT32x32x32_MI16x16x1_SN_LDSB0_CLR1_GSU0_GSUC0_GSUWGMRR0_K1_LBSPPA256_LBSPPB256_LPA16_LPB16_MIWT1_1_PLR1_SU32_SUM0_SUS256_SKXCCM6_VWA1_VWB1_WGM1_WGMXCC1_WGMXCCGn1
    SolutionIndex: 74
    SolutionNameMin: Cijk_Ailk_Bjlk_HSS_BH_UserArgs_MT32x32x32_MI16x16x1_SN_LDSB0_CLR0_GSU0_GSUC0_GSUWGMRR0_K1_LBSPPA256_LBSPPB256_LPA16_LPB16_MIWT1_1_PLR0_SU32_SUM0_SUS256_SKXCCM6_VWA1_VWB1_WGM1_WGMXCC1_WGMXCCGn1
    SolutionIndex: 75
    SolutionNameMin: Cijk_Ailk_Bjlk_HSS_BH_UserArgs_MT32x32x32_MI16x16x1_SN_LDSB0_CLR1_GSU0_GSUC0_GSUWGMRR0_K1_LBSPPA256_LBSPPB256_LPA16_LPB16_MIWT1_1_PLR1_SU32_SUM0_SUS256_SKXCCM6_VWA1_VWB1_WGM4_WGMXCC1_WGMXCCGn1
    SolutionIndex: 76
    SolutionNameMin: Cijk_Ailk_Bjlk_HSS_BH_UserArgs_MT256x256x64_MI16x16x1_SN_LDSB1_CLR1_GSU0_GSUC0_GSUWGMRR0_K1_LBSPPA2048_LBSPPB2048_LPA0_LPB0_MIWT8_8_PLR1_SU32_SUM0_SUS256_SKXCCM6_VWA4_VWB4_WGM1_WGMXCC1_WGMXCCGn1
    SolutionIndex: 77
    SolutionNameMin: Cijk_Ailk_Bjlk_HSS_BH_UserArgs_MT256x256x64_MI16x16x1_SN_LDSB1_CLR1_GSU0_GSUC0_GSUWGMRR0_K1_LBSPPA2048_LBSPPB2048_LPA0_LPB0_MIWT8_8_PLR2_SU32_SUM0_SUS256_SKXCCM6_VWA4_VWB4_WGM1_WGMXCC1_WGMXCCGn1
    SolutionIndex: 78
    SolutionNameMin: Cijk_Ailk_Bjlk_HSS_BH_UserArgs_MT256x256x64_MI16x16x1_SN_LDSB1_CLR1_GSU0_GSUC0_GSUWGMRR0_K1_LBSPPA2048_LBSPPB2048_LPA0_LPB0_MIWT8_8_PLR1_SU32_SUM0_SUS256_SKXCCM6_VWA4_VWB4_WGM4_WGMXCC1_WGMXCCGn1
    SolutionIndex: 79
    SolutionNameMin: Cijk_Ailk_Bjlk_HSS_BH_UserArgs_MT256x256x64_MI16x16x1_SN_LDSB1_CLR1_GSU0_GSUC0_GSUWGMRR0_K1_LBSPPA2048_LBSPPB2048_LPA0_LPB0_MIWT8_8_PLR2_SU32_SUM0_SUS256_SKXCCM6_VWA4_VWB4_WGM4_WGMXCC1_WGMXCCGn1
    SolutionIndex: 80
    SolutionNameMin: Cijk_Ailk_Bjlk_HSS_BH_UserArgs_MT256x256x64_MI16x16x1_SN_LDSB1_CLR1_GSU0_GSUC0_GSUWGMRR0_K1_LBSPPA2048_LBSPPB2048_LPA0_LPB0_MIWT8_8_PLR1_SU32_SUM0_SUS256_SKXCCM6_VWA4_VWB4_WGM8_WGMXCC1_WGMXCCGn1
    SolutionIndex: 81
    SolutionNameMin: Cijk_Ailk_Bjlk_HSS_BH_UserArgs_MT128x256x64_MI16x16x1_SN_LDSB1_CLR1_GSU0_GSUC0_GSUWGMRR0_K1_LBSPPA1024_LBSPPB2048_LPA0_LPB32_MIWT4_8_PLR1_SU32_SUM0_SUS256_SKXCCM6_VWA4_VWB2_WGM1_WGMXCC1_WGMXCCGn1
    SolutionIndex: 82
    SolutionNameMin: Cijk_Ailk_Bjlk_HSS_BH_UserArgs_MT128x256x64_MI16x16x1_SN_LDSB1_CLR1_GSU0_GSUC0_GSUWGMRR0_K1_LBSPPA1024_LBSPPB2048_LPA0_LPB32_MIWT4_8_PLR2_SU32_SUM0_SUS256_SKXCCM6_VWA4_VWB2_WGM8_WGMXCC1_WGMXCCGn1
    SolutionIndex: 83
    SolutionNameMin: Cijk_Ailk_Bjlk_HSS_BH_UserArgs_MT256x128x64_MI16x16x1_SN_LDSB1_CLR1_GSU0_GSUC0_GSUWGMRR0_K1_LBSPPA2048_LBSPPB1024_LPA32_LPB0_MIWT8_4_PLR1_SU32_SUM0_SUS256_SKXCCM6_VWA2_VWB4_WGM8_WGMXCC1_WGMXCCGn1
    SolutionIndex: 84
    SolutionNameMin: Cijk_Ailk_Bjlk_HSS_BH_UserArgs_MT128x128x64_MI16x16x1_SN_LDSB1_CLR1_GSU0_GSUC0_GSUWGMRR0_K1_LBSPPA1024_LBSPPB1024_LPA0_LPB0_MIWT4_4_PLR1_SU32_SUM0_SUS256_SKXCCM6_VWA4_VWB4_WGM1_WGMXCC1_WGMXCCGn1
    SolutionIndex: 85
    SolutionNameMin: Cijk_Ailk_Bjlk_HSS_BH_UserArgs_MT128x128x64_MI16x16x1_SN_LDSB1_CLR1_GSU0_GSUC0_GSUWGMRR0_K1_LBSPPA1024_LBSPPB1024_LPA0_LPB0_MIWT4_4_PLR2_SU32_SUM0_SUS256_SKXCCM6_VWA4_VWB4_WGM1_WGMXCC1_WGMXCCGn1
    SolutionIndex: 86
    SolutionNameMin: Cijk_Ailk_Bjlk_HSS_BH_UserArgs_MT128x128x64_MI16x16x1_SN_LDSB1_CLR1_GSU0_GSUC0_GSUWGMRR0_K1_LBSPPA1024_LBSPPB1024_LPA0_LPB0_MIWT4_4_PLR1_SU32_SUM0_SUS256_SKXCCM6_VWA4_VWB4_WGM4_WGMXCC1_WGMXCCGn1
    SolutionIndex: 87
    SolutionNameMin: Cijk_Ailk_Bjlk_HSS_BH_UserArgs_MT128x128x64_MI16x16x1_SN_LDSB1_CLR1_GSU0_GSUC0_GSUWGMRR0_K1_LBSPPA1024_LBSPPB1024_LPA0_LPB0_MIWT4_4_PLR1_SU32_SUM0_SUS256_SKXCCM6_VWA4_VWB4_WGM8_WGMXCC1_WGMXCCGn1
    SolutionIndex: 88
    SolutionNameMin: Cijk_Ailk_Bjlk_HSS_BH_UserArgs_MT128x128x64_MI16x16x1_SN_LDSB1_CLR1_GSU0_GSUC0_GSUWGMRR0_K1_LBSPPA1024_LBSPPB1024_LPA0_LPB0_MIWT4_4_PLR2_SU32_SUM0_SUS256_SKXCCM6_VWA4_VWB4_WGM8_WGMXCC1_WGMXCCGn1
    SolutionIndex: 89
    SolutionNameMin: Cijk_Ailk_Bjlk_HSS_BH_UserArgs_MT64x128x64_MI16x16x1_SN_LDSB1_CLR1_GSU0_GSUC0_GSUWGMRR0_K1_LBSPPA512_LBSPPB1024_LPA32_LPB0_MIWT2_4_PLR2_SU32_SUM0_SUS256_SKXCCM6_VWA2_VWB4_WGM4_WGMXCC1_WGMXCCGn1
    SolutionIndex: 90
    SolutionNameMin: Cijk_Ailk_Bjlk_HSS_BH_UserArgs_MT64x128x64_MI16x16x1_SN_LDSB1_CLR1_GSU0_GSUC0_GSUWGMRR0_K1_LBSPPA512_LBSPPB1024_LPA32_LPB0_MIWT2_4_PLR2_SU32_SUM0_SUS256_SKXCCM6_VWA2_VWB4_WGM8_WGMXCC1_WGMXCCGn1
    SolutionIndex: 91
    SolutionNameMin: Cijk_Ailk_Bjlk_HSS_BH_UserArgs_MT128x64x64_MI16x16x1_SN_LDSB1_CLR1_GSU0_GSUC0_GSUWGMRR0_K1_LBSPPA1024_LBSPPB512_LPA0_LPB32_MIWT4_2_PLR1_SU32_SUM0_SUS256_SKXCCM6_VWA4_VWB2_WGM1_WGMXCC1_WGMXCCGn1
    SolutionIndex: 92
    SolutionNameMin: Cijk_Ailk_Bjlk_HSS_BH_UserArgs_MT128x64x64_MI16x16x1_SN_LDSB1_CLR1_GSU0_GSUC0_GSUWGMRR0_K1_LBSPPA1024_LBSPPB512_LPA0_LPB16_MIWT4_2_PLR2_SU32_SUM0_SUS256_SKXCCM6_VWA4_VWB1_WGM1_WGMXCC1_WGMXCCGn1
    SolutionIndex: 93
    SolutionNameMin: Cijk_Ailk_Bjlk_HSS_BH_UserArgs_MT128x64x64_MI16x16x1_SN_LDSB1_CLR1_GSU0_GSUC0_GSUWGMRR0_K1_LBSPPA1024_LBSPPB512_LPA0_LPB32_MIWT4_2_PLR2_SU32_SUM0_SUS256_SKXCCM6_VWA4_VWB2_WGM1_WGMXCC1_WGMXCCGn1
    SolutionIndex: 94
    SolutionNameMin: Cijk_Ailk_Bjlk_HSS_BH_UserArgs_MT128x64x64_MI16x16x1_SN_LDSB1_CLR1_GSU0_GSUC0_GSUWGMRR0_K1_LBSPPA1024_LBSPPB512_LPA0_LPB16_MIWT4_2_PLR1_SU32_SUM0_SUS256_SKXCCM6_VWA4_VWB1_WGM4_WGMXCC1_WGMXCCGn1
    SolutionIndex: 95
    SolutionNameMin: Cijk_Ailk_Bjlk_HSS_BH_UserArgs_MT128x64x64_MI16x16x1_SN_LDSB1_CLR1_GSU0_GSUC0_GSUWGMRR0_K1_LBSPPA1024_LBSPPB512_LPA0_LPB32_MIWT4_2_PLR1_SU32_SUM0_SUS256_SKXCCM6_VWA4_VWB2_WGM4_WGMXCC1_WGMXCCGn1
    SolutionIndex: 96
    SolutionNameMin: Cijk_Ailk_Bjlk_HSS_BH_UserArgs_MT128x64x64_MI16x16x1_SN_LDSB1_CLR1_GSU0_GSUC0_GSUWGMRR0_K1_LBSPPA1024_LBSPPB512_LPA0_LPB32_MIWT4_2_PLR2_SU32_SUM0_SUS256_SKXCCM6_VWA4_VWB2_WGM4_WGMXCC1_WGMXCCGn1
    SolutionIndex: 97
    SolutionNameMin: Cijk_Ailk_Bjlk_HSS_BH_UserArgs_MT128x64x64_MI16x16x1_SN_LDSB1_CLR1_GSU0_GSUC0_GSUWGMRR0_K1_LBSPPA1024_LBSPPB512_LPA0_LPB16_MIWT4_2_PLR1_SU32_SUM0_SUS256_SKXCCM6_VWA4_VWB1_WGM8_WGMXCC1_WGMXCCGn1
    SolutionIndex: 98
    SolutionNameMin: Cijk_Ailk_Bjlk_HSS_BH_UserArgs_MT128x64x64_MI16x16x1_SN_LDSB1_CLR1_GSU0_GSUC0_GSUWGMRR0_K1_LBSPPA1024_LBSPPB512_LPA0_LPB32_MIWT4_2_PLR2_SU32_SUM0_SUS256_SKXCCM6_VWA4_VWB2_WGM8_WGMXCC1_WGMXCCGn1
    SolutionIndex: 99
    SolutionNameMin: Cijk_Ailk_Bjlk_HSS_BH_UserArgs_MT64x64x64_MI16x16x1_SN_LDSB1_CLR1_GSU0_GSUC0_GSUWGMRR0_K1_LBSPPA512_LBSPPB512_LPA32_LPB32_MIWT2_2_PLR1_SU32_SUM0_SUS256_SKXCCM6_VWA2_VWB2_WGM1_WGMXCC1_WGMXCCGn1
    SolutionIndex: 100
    SolutionNameMin: Cijk_Ailk_Bjlk_HSS_BH_UserArgs_MT64x64x64_MI16x16x1_SN_LDSB1_CLR1_GSU0_GSUC0_GSUWGMRR0_K1_LBSPPA512_LBSPPB512_LPA32_LPB32_MIWT2_2_PLR2_SU32_SUM0_SUS256_SKXCCM6_VWA2_VWB2_WGM1_WGMXCC1_WGMXCCGn1
    SolutionIndex: 101
    SolutionNameMin: Cijk_Ailk_Bjlk_HSS_BH_UserArgs_MT64x64x64_MI16x16x1_SN_LDSB1_CLR1_GSU0_GSUC0_GSUWGMRR0_K1_LBSPPA512_LBSPPB512_LPA32_LPB32_MIWT2_2_PLR1_SU32_SUM0_SUS256_SKXCCM6_VWA2_VWB2_WGM4_WGMXCC1_WGMXCCGn1
    SolutionIndex: 102
    SolutionNameMin: Cijk_Ailk_Bjlk_HSS_BH_UserArgs_MT64x64x64_MI16x16x1_SN_LDSB1_CLR1_GSU0_GSUC0_GSUWGMRR0_K1_LBSPPA512_LBSPPB512_LPA32_LPB32_MIWT2_2_PLR2_SU32_SUM0_SUS256_SKXCCM6_VWA2_VWB2_WGM4_WGMXCC1_WGMXCCGn1
    SolutionIndex: 103
    SolutionNameMin: Cijk_Ailk_Bjlk_HSS_BH_UserArgs_MT64x64x64_MI16x16x1_SN_LDSB1_CLR1_GSU0_GSUC0_GSUWGMRR0_K1_LBSPPA512_LBSPPB512_LPA32_LPB32_MIWT2_2_PLR1_SU32_SUM0_SUS256_SKXCCM6_VWA2_VWB2_WGM8_WGMXCC1_WGMXCCGn1
    SolutionIndex: 104
    SolutionNameMin: Cijk_Ailk_Bjlk_HSS_BH_UserArgs_MT64x64x64_MI16x16x1_SN_LDSB1_CLR1_GSU0_GSUC0_GSUWGMRR0_K1_LBSPPA512_LBSPPB512_LPA32_LPB32_MIWT2_2_PLR2_SU32_SUM0_SUS256_SKXCCM6_VWA2_VWB2_WGM8_WGMXCC1_WGMXCCGn1
    SolutionIndex: 105
    SolutionNameMin: Cijk_Ailk_Bjlk_HSS_BH_UserArgs_MT32x64x64_MI16x16x1_SN_LDSB0_CLR1_GSU0_GSUC0_GSUWGMRR0_K1_LBSPPA256_LBSPPB512_LPA16_LPB32_MIWT1_2_PLR1_SU32_SUM0_SUS256_SKXCCM6_VWA1_VWB2_WGM1_WGMXCC1_WGMXCCGn1
    SolutionIndex: 106
    SolutionNameMin: Cijk_Ailk_Bjlk_HSS_BH_UserArgs_MT32x64x64_MI16x16x1_SN_LDSB0_CLR1_GSU0_GSUC0_GSUWGMRR0_K1_LBSPPA256_LBSPPB512_LPA16_LPB32_MIWT1_2_PLR2_SU32_SUM0_SUS256_SKXCCM6_VWA1_VWB2_WGM1_WGMXCC1_WGMXCCGn1
    SolutionIndex: 107
    SolutionNameMin: Cijk_Ailk_Bjlk_HSS_BH_UserArgs_MT32x64x64_MI16x16x1_SN_LDSB0_CLR1_GSU0_GSUC0_GSUWGMRR0_K1_LBSPPA256_LBSPPB512_LPA16_LPB32_MIWT1_2_PLR1_SU32_SUM0_SUS256_SKXCCM6_VWA1_VWB2_WGM4_WGMXCC1_WGMXCCGn1
    SolutionIndex: 108
    SolutionNameMin: Cijk_Ailk_Bjlk_HSS_BH_UserArgs_MT32x64x64_MI16x16x1_SN_LDSB0_CLR1_GSU0_GSUC0_GSUWGMRR0_K1_LBSPPA256_LBSPPB512_LPA16_LPB32_MIWT1_2_PLR1_SU32_SUM0_SUS256_SKXCCM6_VWA1_VWB2_WGM8_WGMXCC1_WGMXCCGn1
    SolutionIndex: 109
    SolutionNameMin: Cijk_Ailk_Bjlk_HSS_BH_UserArgs_MT64x32x64_MI16x16x1_SN_LDSB0_CLR1_GSU0_GSUC0_GSUWGMRR0_K1_LBSPPA512_LBSPPB256_LPA32_LPB16_MIWT2_1_PLR2_SU32_SUM0_SUS256_SKXCCM6_VWA2_VWB1_WGM1_WGMXCC1_WGMXCCGn1
    SolutionIndex: 110
    SolutionNameMin: Cijk_Ailk_Bjlk_HSS_BH_UserArgs_MT32x32x64_MI16x16x1_SN_LDSB0_CLR1_GSU0_GSUC0_GSUWGMRR0_K1_LBSPPA256_LBSPPB256_LPA16_LPB16_MIWT1_1_PLR2_SU32_SUM0_SUS256_SKXCCM6_VWA1_VWB1_WGM1_WGMXCC1_WGMXCCGn1
    SolutionIndex: 111
    SolutionNameMin: Cijk_Ailk_Bjlk_HSS_BH_UserArgs_MT128x128x128_MI16x16x1_SN_LDSB1_CLR1_GSU0_GSUC0_GSUWGMRR0_K1_LBSPPA1024_LBSPPB1024_LPA0_LPB0_MIWT4_4_PLR2_SU32_SUM0_SUS256_SKXCCM6_VWA4_VWB4_WGM1_WGMXCC1_WGMXCCGn1
    SolutionIndex: 112
    SolutionNameMin: Cijk_Ailk_Bjlk_HSS_BH_UserArgs_MT128x128x128_MI16x16x1_SN_LDSB1_CLR1_GSU0_GSUC0_GSUWGMRR0_K1_LBSPPA1024_LBSPPB1024_LPA0_LPB0_MIWT4_4_PLR1_SU32_SUM0_SUS256_SKXCCM6_VWA4_VWB4_WGM4_WGMXCC1_WGMXCCGn1
    SolutionIndex: 113
    SolutionNameMin: Cijk_Ailk_Bjlk_HSS_BH_UserArgs_MT128x128x128_MI16x16x1_SN_LDSB1_CLR1_GSU0_GSUC0_GSUWGMRR0_K1_LBSPPA1024_LBSPPB1024_LPA0_LPB0_MIWT4_4_PLR2_SU32_SUM0_SUS256_SKXCCM6_VWA4_VWB4_WGM4_WGMXCC1_WGMXCCGn1
    SolutionIndex: 114
    SolutionNameMin: Cijk_Ailk_Bjlk_HSS_BH_UserArgs_MT128x128x128_MI16x16x1_SN_LDSB1_CLR1_GSU0_GSUC0_GSUWGMRR0_K1_LBSPPA1024_LBSPPB1024_LPA0_LPB0_MIWT4_4_PLR1_SU32_SUM0_SUS256_SKXCCM6_VWA4_VWB4_WGM8_WGMXCC1_WGMXCCGn1
    SolutionIndex: 115
    SolutionNameMin: Cijk_Ailk_Bjlk_HSS_BH_UserArgs_MT32x64x128_MI16x16x1_SN_LDSB1_CLR1_GSU0_GSUC0_GSUWGMRR0_K1_LBSPPA256_LBSPPB512_LPA16_LPB32_MIWT1_2_PLR2_SU32_SUM0_SUS256_SKXCCM6_VWA1_VWB2_WGM1_WGMXCC1_WGMXCCGn1
    SolutionIndex: 116
    SolutionNameMin: Cijk_Ailk_Bjlk_HSS_BH_UserArgs_MT64x32x128_MI16x16x1_SN_LDSB1_CLR1_GSU0_GSUC0_GSUWGMRR0_K1_LBSPPA512_LBSPPB256_LPA32_LPB16_MIWT2_1_PLR2_SU32_SUM0_SUS256_SKXCCM6_VWA2_VWB1_WGM1_WGMXCC1_WGMXCCGn1
    SolutionIndex: 117
    SolutionNameMin: Cijk_Ailk_Bjlk_HSS_BH_UserArgs_MT64x32x128_MI16x16x1_SN_LDSB1_CLR1_GSU0_GSUC0_GSUWGMRR0_K1_LBSPPA512_LBSPPB256_LPA32_LPB16_MIWT2_1_PLR2_SU32_SUM0_SUS256_SKXCCM6_VWA2_VWB1_WGM8_WGMXCC1_WGMXCCGn1
    SolutionIndex: 118
    SolutionNameMin: Cijk_Ailk_Bjlk_HSS_BH_UserArgs_MT32x32x128_MI16x16x1_SN_LDSB1_CLR1_GSU0_GSUC0_GSUWGMRR0_K1_LBSPPA256_LBSPPB256_LPA16_LPB16_MIWT1_1_PLR1_SU32_SUM0_SUS256_SKXCCM6_VWA1_VWB1_WGM1_WGMXCC1_WGMXCCGn1
    SolutionIndex: 119
    SolutionNameMin: Cijk_Ailk_Bjlk_HSS_BH_UserArgs_MT32x32x128_MI16x16x1_SN_LDSB1_CLR1_GSU0_GSUC0_GSUWGMRR0_K1_LBSPPA256_LBSPPB256_LPA16_LPB16_MIWT1_1_PLR2_SU32_SUM0_SUS256_SKXCCM6_VWA1_VWB1_WGM1_WGMXCC1_WGMXCCGn1
    SolutionIndex: 120
    SolutionNameMin: Cijk_Ailk_Bjlk_HSS_BH_UserArgs_MT32x32x128_MI16x16x1_SN_LDSB1_CLR1_GSU0_GSUC0_GSUWGMRR0_K1_LBSPPA256_LBSPPB256_LPA16_LPB16_MIWT1_1_PLR2_SU32_SUM0_SUS256_SKXCCM6_VWA1_VWB1_WGM8_WGMXCC1_WGMXCCGn1
    SolutionIndex: 121
    SolutionNameMin: Cijk_Ailk_Bjlk_HSS_BH_UserArgs_MT32x32x32_MI16x16x1_SN_LDSB0_CLR1_GSU0_GSUC0_GSUWGMRR0_K1_LBSPPA256_LBSPPB256_LPA16_LPB16_MIWT1_1_PLR1_SU32_SUM0_SUS256_SKXCCM0_VWA1_VWB1_WGM1_WGMXCC1_WGMXCCGn1
- - - [128, 128, 1, 128, 128, 128, 128, 128]
    - [37, 0.079]
  - - [128, 128, 1, 256, 128, 128, 128, 128]
    - [38, 0.103]
  - - [128, 128, 1, 512, 128, 128, 128, 128]
    - [38, 0.171]
  - - [128, 128, 1, 1024, 128, 128, 128, 128]
    - [37, 0.265]
  - - [128, 128, 1, 2048, 128, 128, 128, 128]
    - [73, 0.354]
  - - [128, 128, 1, 4096, 128, 128, 128, 128]
    - [110, 0.681]
  - - [128, 128, 1, 8192, 128, 128, 128, 128]
    - [38, 1.235]
  - - [128, 256, 1, 128, 128, 128, 128, 256]
    - [38, 0.155]
  - - [128, 256, 1, 256, 128, 128, 128, 256]
    - [37, 0.204]
  - - [128, 256, 1, 512, 128, 128, 128, 256]
    - [119, 0.34]
  - - [128, 256, 1, 1024, 128, 128, 128, 256]
    - [118, 0.521]
  - - [128, 256, 1, 2048, 128, 128, 128, 256]
    - [118, 0.932]
  - - [128, 256, 1, 4096, 128, 128, 128, 256]
    - [75, 1.613]
  - - [128, 256, 1, 8192, 128, 128, 128, 256]
    - [16, 2.613]
  - - [128, 512, 1, 128, 128, 128, 128, 512]
    - [38, 0.307]
  - - [128, 512, 1, 256, 128, 128, 128, 512]
    - [38, 0.396]
  - - [128, 512, 1, 512, 128, 128, 128, 512]
    - [74, 0.666]
  - - [128, 512, 1, 1024, 128, 128, 128, 512]
    - [73, 1.189]
  - - [128, 512, 1, 2048, 128, 128, 128, 512]
    - [119, 1.999]
  - - [128, 512, 1, 4096, 128, 128, 128, 512]
    - [118, 3.023]
  - - [128, 512, 1, 8192, 128, 128, 128, 512]
    - [105, 4.418]
  - - [128, 1024, 1, 128, 128, 128, 128, 1024]
    - [37, 0.598]
  - - [128, 1024, 1, 256, 128, 128, 128, 1024]
    - [37, 0.751]
  - - [128, 1024, 1, 512, 128, 128, 128, 1024]
    - [37, 1.323]
  - - [128, 1024, 1, 1024, 128, 128, 128, 1024]
    - [118, 2.255]
  - - [128, 1024, 1, 2048, 128, 128, 128, 1024]
    - [106, 3.503]
  - - [128, 1024, 1, 4096, 128, 128, 128, 1024]
    - [106, 5.162]
  - - [128, 1024, 1, 8192, 128, 128, 128, 1024]
    - [14, 6.988]
  - - [128, 2048, 1, 128, 128, 128, 128, 2048]
    - [35, 1.106]
  - - [128, 2048, 1, 256, 128, 128, 128, 2048]
    - [16, 1.778]
  - - [128, 2048, 1, 512, 128, 128, 128, 2048]
    - [16, 2.731]
  - - [128, 2048, 1, 1024, 128, 128, 128, 2048]
    - [116, 3.95]
  - - [128, 2048, 1, 2048, 128, 128, 128, 2048]
    - [100, 5.771]
  - - [128, 2048, 1, 4096, 128, 128, 128, 2048]
    - [99, 8.56]
  - - [128, 2048, 1, 8192, 128, 128, 128, 2048]
    - [11, 10.263]
  - - [128, 4096, 1, 128, 128, 128, 128, 4096]
    - [32, 1.919]
  - - [128, 4096, 1, 256, 128, 128, 128, 4096]
    - [28, 3.166]
  - - [128, 4096, 1, 512, 128, 128, 128, 4096]
    - [109, 4.73]
  - - [128, 4096, 1, 1024, 128, 128, 128, 4096]
    - [116, 6.493]
  - - [128, 4096, 1, 2048, 128, 128, 128, 4096]
    - [99, 9.067]
  - - [128, 4096, 1, 4096, 128, 128, 128, 4096]
    - [93, 11.603]
  - - [128, 4096, 1, 8192, 128, 128, 128, 4096]
    - [19, 13.135]
  - - [128, 8192, 1, 128, 128, 128, 128, 8192]
    - [25, 3.15]
  - - [128, 8192, 1, 256, 128, 128, 128, 8192]
    - [27, 5.208]
  - - [128, 8192, 1, 512, 128, 128, 128, 8192]
    - [100, 7.684]
  - - [128, 8192, 1, 1024, 128, 128, 128, 8192]
    - [100, 10.236]
  - - [128, 8192, 1, 2048, 128, 128, 128, 8192]
    - [100, 11.626]
  - - [128, 8192, 1, 4096, 128, 128, 128, 8192]
    - [12, 13.841]
  - - [128, 8192, 1, 8192, 128, 128, 128, 8192]
    - [7, 16.094]
  - - [256, 128, 1, 128, 256, 256, 256, 128]
    - [38, 0.155]
  - - [256, 128, 1, 256, 256, 256, 256, 128]
    - [37, 0.204]
  - - [256, 128, 1, 512, 256, 256, 256, 128]
    - [37, 0.34]
  - - [256, 128, 1, 1024, 256, 256, 256, 128]
    - [110, 0.52]
  - - [256, 128, 1, 2048, 256, 256, 256, 128]
    - [119, 0.947]
  - - [256, 128, 1, 4096, 256, 256, 256, 128]
    - [73, 1.612]
  - - [256, 128, 1, 8192, 256, 256, 256, 128]
    - [16, 2.59]
  - - [256, 256, 1, 128, 256, 256, 256, 256]
    - [37, 0.304]
  - - [256, 256, 1, 256, 256, 256, 256, 256]
    - [38, 0.392]
  - - [256, 256, 1, 512, 256, 256, 256, 256]
    - [73, 0.67]
  - - [256, 256, 1, 1024, 256, 256, 256, 256]
    - [73, 1.178]
  - - [256, 256, 1, 2048, 256, 256, 256, 256]
    - [119, 2.028]
  - - [256, 256, 1, 4096, 256, 256, 256, 256]
    - [118, 3.033]
  - - [256, 256, 1, 8192, 256, 256, 256, 256]
    - [35, 4.555]
  - - [256, 512, 1, 128, 256, 256, 256, 512]
    - [37, 0.592]
  - - [256, 512, 1, 256, 256, 256, 256, 512]
    - [16, 0.746]
  - - [256, 512, 1, 512, 256, 256, 256, 512]
    - [38, 1.324]
  - - [256, 512, 1, 1024, 256, 256, 256, 512]
    - [118, 2.212]
  - - [256, 512, 1, 2048, 256, 256, 256, 512]
    - [115, 3.575]
  - - [256, 512, 1, 4096, 256, 256, 256, 512]
    - [116, 5.218]
  - - [256, 512, 1, 8192, 256, 256, 256, 512]
    - [14, 7.078]
  - - [256, 1024, 1, 128, 256, 256, 256, 1024]
    - [35, 1.109]
  - - [256, 1024, 1, 256, 256, 256, 256, 1024]
    - [16, 1.776]
  - - [256, 1024, 1, 512, 256, 256, 256, 1024]
    - [16, 2.713]
  - - [256, 1024, 1, 1024, 256, 256, 256, 1024]
    - [116, 3.959]
  - - [256, 1024, 1, 2048, 256, 256, 256, 1024]
    - [103, 5.803]
  - - [256, 1024, 1, 4096, 256, 256, 256, 1024]
    - [100, 8.386]
  - - [256, 1024, 1, 8192, 256, 256, 256, 1024]
    - [12, 10.157]
  - - [256, 2048, 1, 128, 256, 256, 256, 2048]
    - [33, 1.878]
  - - [256, 2048, 1, 256, 256, 256, 256, 2048]
    - [28, 3.137]
  - - [256, 2048, 1, 512, 256, 256, 256, 2048]
    - [28, 4.775]
  - - [256, 2048, 1, 1024, 256, 256, 256, 2048]
    - [116, 6.474]
  - - [256, 2048, 1, 2048, 256, 256, 256, 2048]
    - [99, 9.132]
  - - [256, 2048, 1, 4096, 256, 256, 256, 2048]
    - [91, 11.418]
  - - [256, 2048, 1, 8192, 256, 256, 256, 2048]
    - [62, 12.88]
  - - [256, 4096, 1, 128, 256, 256, 256, 4096]
    - [23, 3.06]
  - - [256, 4096, 1, 256, 256, 256, 256, 4096]
    - [99, 5.16]
  - - [256, 4096, 1, 512, 256, 256, 256, 4096]
    - [100, 7.721]
  - - [256, 4096, 1, 1024, 256, 256, 256, 4096]
    - [100, 10.511]
  - - [256, 4096, 1, 2048, 256, 256, 256, 4096]
    - [91, 12.04]
  - - [256, 4096, 1, 4096, 256, 256, 256, 4096]
    - [87, 13.974]
  - - [256, 4096, 1, 8192, 256, 256, 256, 4096]
    - [60, 15.262]
  - - [256, 8192, 1, 128, 256, 256, 256, 8192]
    - [12, 4.549]
  - - [256, 8192, 1, 256, 256, 256, 256, 8192]
    - [93, 7.617]
  - - [256, 8192, 1, 512, 256, 256, 256, 8192]
    - [71, 10.646]
  - - [256, 8192, 1, 1024, 256, 256, 256, 8192]
    - [98, 13.354]
  - - [256, 8192, 1, 2048, 256, 256, 256, 8192]
    - [95, 14.274]
  - - [256, 8192, 1, 4096, 256, 256, 256, 8192]
    - [67, 16.115]
  - - [256, 8192, 1, 8192, 256, 256, 256, 8192]
    - [5, 17.252]
  - - [512, 128, 1, 128, 512, 512, 512, 128]
    - [38, 0.308]
  - - [512, 128, 1, 256, 512, 512, 512, 128]
    - [37, 0.396]
  - - [512, 128, 1, 512, 512, 512, 512, 128]
    - [73, 0.669]
  - - [512, 128, 1, 1024, 512, 512, 512, 128]
    - [73, 1.176]
  - - [512, 128, 1, 2048, 512, 512, 512, 128]
    - [119, 2.021]
  - - [512, 128, 1, 4096, 512, 512, 512, 128]
    - [37, 2.981]
  - - [512, 128, 1, 8192, 512, 512, 512, 128]
    - [107, 4.385]
  - - [512, 256, 1, 128, 512, 512, 512, 256]
    - [38, 0.598]
  - - [512, 256, 1, 256, 512, 512, 512, 256]
    - [37, 0.757]
  - - [512, 256, 1, 512, 512, 512, 512, 256]
    - [37, 1.315]
  - - [512, 256, 1, 1024, 512, 512, 512, 256]
    - [106, 2.185]
  - - [512, 256, 1, 2048, 512, 512, 512, 256]
    - [116, 3.526]
  - - [512, 256, 1, 4096, 512, 512, 512, 256]
    - [117, 5.179]
  - - [512, 256, 1, 8192, 512, 512, 512, 256]
    - [72, 7.098]
  - - [512, 512, 1, 128, 512, 512, 512, 512]
    - [35, 1.085]
  - - [512, 512, 1, 256, 512, 512, 512, 512]
    - [16, 1.762]
  - - [512, 512, 1, 512, 512, 512, 512, 512]
    - [16, 2.637]
  - - [512, 512, 1, 1024, 512, 512, 512, 512]
    - [116, 3.854]
  - - [512, 512, 1, 2048, 512, 512, 512, 512]
    - [116, 5.574]
  - - [512, 512, 1, 4096, 512, 512, 512, 512]
    - [103, 8.461]
  - - [512, 512, 1, 8192, 512, 512, 512, 512]
    - [69, 10.406]
  - - [512, 1024, 1, 128, 512, 512, 512, 1024]
    - [32, 1.9]
  - - [512, 1024, 1, 256, 512, 512, 512, 1024]
    - [28, 3.133]
  - - [512, 1024, 1, 512, 512, 512, 512, 1024]
    - [28, 4.723]
  - - [512, 1024, 1, 1024, 512, 512, 512, 1024]
    - [35, 6.488]
  - - [512, 1024, 1, 2048, 512, 512, 512, 1024]
    - [25, 9.249]
  - - [512, 1024, 1, 4096, 512, 512, 512, 1024]
    - [19, 11.38]
  - - [512, 1024, 1, 8192, 512, 512, 512, 1024]
    - [60, 13.144]
  - - [512, 2048, 1, 128, 512, 512, 512, 2048]
    - [25, 3.116]
  - - [512, 2048, 1, 256, 512, 512, 512, 2048]
    - [24, 5.176]
  - - [512, 2048, 1, 512, 512, 512, 512, 2048]
    - [26, 7.666]
  - - [512, 2048, 1, 1024, 512, 512, 512, 2048]
    - [27, 10.297]
  - - [512, 2048, 1, 2048, 512, 512, 512, 2048]
    - [93, 11.933]
  - - [512, 2048, 1, 4096, 512, 512, 512, 2048]
    - [86, 14.171]
  - - [512, 2048, 1, 8192, 512, 512, 512, 2048]
    - [58, 14.826]
  - - [512, 4096, 1, 128, 512, 512, 512, 4096]
    - [22, 4.659]
  - - [512, 4096, 1, 256, 512, 512, 512, 4096]
    - [20, 7.798]
  - - [512, 4096, 1, 512, 512, 512, 512, 4096]
    - [21, 10.882]
  - - [512, 4096, 1, 1024, 512, 512, 512, 4096]
    - [96, 13.549]
  - - [512, 4096, 1, 2048, 512, 512, 512, 4096]
    - [93, 15.245]
  - - [512, 4096, 1, 4096, 512, 512, 512, 4096]
    - [59, 15.522]
  - - [512, 4096, 1, 8192, 512, 512, 512, 4096]
    - [53, 16.926]
  - - [512, 8192, 1, 128, 512, 512, 512, 8192]
    - [67, 6.037]
  - - [512, 8192, 1, 256, 512, 512, 512, 8192]
    - [66, 9.663]
  - - [512, 8192, 1, 512, 512, 512, 512, 8192]
    - [60, 13.321]
  - - [512, 8192, 1, 1024, 512, 512, 512, 8192]
    - [61, 16.514]
  - - [512, 8192, 1, 2048, 512, 512, 512, 8192]
    - [86, 19.241]
  - - [512, 8192, 1, 4096, 512, 512, 512, 8192]
    - [111, 18.813]
  - - [512, 8192, 1, 8192, 512, 512, 512, 8192]
    - [76, 20.452]
  - - [1024, 128, 1, 128, 1024, 1024, 1024, 128]
    - [38, 0.609]
  - - [1024, 128, 1, 256, 1024, 1024, 1024, 128]
    - [37, 0.755]
  - - [1024, 128, 1, 512, 1024, 1024, 1024, 128]
    - [38, 1.328]
  - - [1024, 128, 1, 1024, 1024, 1024, 1024, 128]
    - [120, 2.211]
  - - [1024, 128, 1, 2048, 1024, 1024, 1024, 128]
    - [106, 3.486]
  - - [1024, 128, 1, 4096, 1024, 1024, 1024, 128]
    - [108, 5.125]
  - - [1024, 128, 1, 8192, 1024, 1024, 1024, 128]
    - [15, 6.993]
  - - [1024, 256, 1, 128, 1024, 1024, 1024, 256]
    - [35, 1.082]
  - - [1024, 256, 1, 256, 1024, 1024, 1024, 256]
    - [16, 1.765]
  - - [1024, 256, 1, 512, 1024, 1024, 1024, 256]
    - [16, 2.718]
  - - [1024, 256, 1, 1024, 1024, 1024, 1024, 256]
    - [116, 3.83]
  - - [1024, 256, 1, 2048, 1024, 1024, 1024, 256]
    - [36, 5.518]
  - - [1024, 256, 1, 4096, 1024, 1024, 1024, 256]
    - [104, 8.195]
  - - [1024, 256, 1, 8192, 1024, 1024, 1024, 256]
    - [70, 10.394]
  - - [1024, 512, 1, 128, 1024, 1024, 1024, 512]
    - [32, 1.92]
  - - [1024, 512, 1, 256, 1024, 1024, 1024, 512]
    - [28, 3.167]
  - - [1024, 512, 1, 512, 1024, 1024, 1024, 512]
    - [35, 4.758]
  - - [1024, 512, 1, 1024, 1024, 1024, 1024, 512]
    - [35, 6.536]
  - - [1024, 512, 1, 2048, 1024, 1024, 1024, 512]
    - [103, 9.233]
  - - [1024, 512, 1, 4096, 1024, 1024, 1024, 512]
    - [94, 11.307]
  - - [1024, 512, 1, 8192, 1024, 1024, 1024, 512]
    - [60, 13.172]
  - - [1024, 1024, 1, 128, 1024, 1024, 1024, 1024]
    - [25, 3.126]
  - - [1024, 1024, 1, 256, 1024, 1024, 1024, 1024]
    - [25, 5.218]
  - - [1024, 1024, 1, 512, 1024, 1024, 1024, 1024]
    - [26, 7.621]
  - - [1024, 1024, 1, 1024, 1024, 1024, 1024, 1024]
    - [26, 10.372]
  - - [1024, 1024, 1, 2048, 1024, 1024, 1024, 1024]
    - [22, 12.286]
  - - [1024, 1024, 1, 4096, 1024, 1024, 1024, 1024]
    - [87, 13.831]
  - - [1024, 1024, 1, 8192, 1024, 1024, 1024, 1024]
    - [3, 14.801]
  - - [1024, 2048, 1, 128, 1024, 1024, 1024, 2048]
    - [21, 4.59]
  - - [1024, 2048, 1, 256, 1024, 1024, 1024, 2048]
    - [20, 7.637]
  - - [1024, 2048, 1, 512, 1024, 1024, 1024, 2048]
    - [96, 10.725]
  - - [1024, 2048, 1, 1024, 1024, 1024, 1024, 2048]
    - [96, 13.629]
  - - [1024, 2048, 1, 2048, 1024, 1024, 1024, 2048]
    - [91, 14.533]
  - - [1024, 2048, 1, 4096, 1024, 1024, 1024, 2048]
    - [60, 15.522]
  - - [1024, 2048, 1, 8192, 1024, 1024, 1024, 2048]
    - [49, 16.925]
  - - [1024, 4096, 1, 128, 1024, 1024, 1024, 4096]
    - [87, 6.058]
  - - [1024, 4096, 1, 256, 1024, 1024, 1024, 4096]
    - [87, 9.688]
  - - [1024, 4096, 1, 512, 1024, 1024, 1024, 4096]
    - [60, 13.235]
  - - [1024, 4096, 1, 1024, 1024, 1024, 1024, 4096]
    - [68, 16.429]
  - - [1024, 4096, 1, 2048, 1024, 1024, 1024, 4096]
    - [84, 18.358]
  - - [1024, 4096, 1, 4096, 1024, 1024, 1024, 4096]
    - [111, 18.732]
  - - [1024, 4096, 1, 8192, 1024, 1024, 1024, 4096]
    - [76, 20.289]
  - - [1024, 8192, 1, 128, 1024, 1024, 1024, 8192]
    - [47, 6.363]
  - - [1024, 8192, 1, 256, 1024, 1024, 1024, 8192]
    - [47, 10.195]
  - - [1024, 8192, 1, 512, 1024, 1024, 1024, 8192]
    - [5, 14.467]
  - - [1024, 8192, 1, 1024, 1024, 1024, 1024, 8192]
    - [47, 18.917]
  - - [1024, 8192, 1, 2048, 1024, 1024, 1024, 8192]
    - [81, 19.123]
  - - [1024, 8192, 1, 4096, 1024, 1024, 1024, 8192]
    - [76, 20.679]
  - - [1024, 8192, 1, 8192, 1024, 1024, 1024, 8192]
    - [77, 23.323]
  - - [2048, 128, 1, 128, 2048, 2048, 2048, 128]
    - [34, 1.105]
  - - [2048, 128, 1, 256, 2048, 2048, 2048, 128]
    - [16, 1.792]
  - - [2048, 128, 1, 512, 2048, 2048, 2048, 128]
    - [38, 2.67]
  - - [2048, 128, 1, 1024, 2048, 2048, 2048, 128]
    - [115, 3.962]
  - - [2048, 128, 1, 2048, 2048, 2048, 2048, 128]
    - [100, 5.675]
  - - [2048, 128, 1, 4096, 2048, 2048, 2048, 128]
    - [101, 8.379]
  - - [2048, 128, 1, 8192, 2048, 2048, 2048, 128]
    - [95, 10.11]
  - - [2048, 256, 1, 128, 2048, 2048, 2048, 256]
    - [31, 1.901]
  - - [2048, 256, 1, 256, 2048, 2048, 2048, 256]
    - [29, 3.12]
  - - [2048, 256, 1, 512, 2048, 2048, 2048, 256]
    - [35, 4.771]
  - - [2048, 256, 1, 1024, 2048, 2048, 2048, 256]
    - [36, 6.489]
  - - [2048, 256, 1, 2048, 2048, 2048, 2048, 256]
    - [101, 9.029]
  - - [2048, 256, 1, 4096, 2048, 2048, 2048, 256]
    - [98, 11.62]
  - - [2048, 256, 1, 8192, 2048, 2048, 2048, 256]
    - [68, 13.449]
  - - [2048, 512, 1, 128, 2048, 2048, 2048, 512]
    - [13, 3.083]
  - - [2048, 512, 1, 256, 2048, 2048, 2048, 512]
    - [25, 5.191]
  - - [2048, 512, 1, 512, 2048, 2048, 2048, 512]
    - [24, 7.596]
  - - [2048, 512, 1, 1024, 2048, 2048, 2048, 512]
    - [24, 10.019]
  - - [2048, 512, 1, 2048, 2048, 2048, 2048, 512]
    - [89, 11.793]
  - - [2048, 512, 1, 4096, 2048, 2048, 2048, 512]
    - [88, 13.364]
  - - [2048, 512, 1, 8192, 2048, 2048, 2048, 512]
    - [68, 15.224]
  - - [2048, 1024, 1, 128, 2048, 2048, 2048, 1024]
    - [10, 4.735]
  - - [2048, 1024, 1, 256, 2048, 2048, 2048, 1024]
    - [93, 7.649]
  - - [2048, 1024, 1, 512, 2048, 2048, 2048, 1024]
    - [19, 10.664]
  - - [2048, 1024, 1, 1024, 2048, 2048, 2048, 1024]
    - [8, 13.455]
  - - [2048, 1024, 1, 2048, 2048, 2048, 2048, 1024]
    - [88, 14.749]
  - - [2048, 1024, 1, 4096, 2048, 2048, 2048, 1024]
    - [30, 15.81]
  - - [2048, 1024, 1, 8192, 2048, 2048, 2048, 1024]
    - [48, 17.194]
  - - [2048, 2048, 1, 128, 2048, 2048, 2048, 2048]
    - [65, 6.021]
  - - [2048, 2048, 1, 256, 2048, 2048, 2048, 2048]
    - [57, 9.631]
  - - [2048, 2048, 1, 512, 2048, 2048, 2048, 2048]
    - [67, 13.586]
  - - [2048, 2048, 1, 1024, 2048, 2048, 2048, 2048]
    - [65, 16.278]
  - - [2048, 2048, 1, 2048, 2048, 2048, 2048, 2048]
    - [87, 18.495]
  - - [2048, 2048, 1, 4096, 2048, 2048, 2048, 2048]
    - [112, 18.56]
  - - [2048, 2048, 1, 8192, 2048, 2048, 2048, 2048]
    - [78, 20.393]
  - - [2048, 4096, 1, 128, 2048, 2048, 2048, 4096]
    - [45, 6.49]
  - - [2048, 4096, 1, 256, 2048, 2048, 2048, 4096]
    - [5, 10.322]
  - - [2048, 4096, 1, 512, 2048, 2048, 2048, 4096]
    - [56, 14.599]
  - - [2048, 4096, 1, 1024, 2048, 2048, 2048, 4096]
    - [45, 18.551]
  - - [2048, 4096, 1, 2048, 2048, 2048, 2048, 4096]
    - [82, 19.042]
  - - [2048, 4096, 1, 4096, 2048, 2048, 2048, 4096]
    - [76, 21.131]
  - - [2048, 4096, 1, 8192, 2048, 2048, 2048, 4096]
    - [80, 23.705]
  - - [2048, 8192, 1, 128, 2048, 2048, 2048, 8192]
    - [91, 6.411]
  - - [2048, 8192, 1, 256, 2048, 2048, 2048, 8192]
    - [41, 10.076]
  - - [2048, 8192, 1, 512, 2048, 2048, 2048, 8192]
    - [77, 14.497]
  - - [2048, 8192, 1, 1024, 2048, 2048, 2048, 8192]
    - [40, 18.097]
  - - [2048, 8192, 1, 2048, 2048, 2048, 2048, 8192]
    - [77, 21.459]
  - - [2048, 8192, 1, 4096, 2048, 2048, 2048, 8192]
    - [77, 21.722]
  - - [2048, 8192, 1, 8192, 2048, 2048, 2048, 8192]
    - [0, 23.561]
  - - [4096, 128, 1, 128, 4096, 4096, 4096, 128]
    - [31, 1.905]
  - - [4096, 128, 1, 256, 4096, 4096, 4096, 128]
    - [29, 3.163]
  - - [4096, 128, 1, 512, 4096, 4096, 4096, 128]
    - [36, 4.783]
  - - [4096, 128, 1, 1024, 4096, 4096, 4096, 128]
    - [101, 6.398]
  - - [4096, 128, 1, 2048, 4096, 4096, 4096, 128]
    - [101, 8.891]
  - - [4096, 128, 1, 4096, 4096, 4096, 4096, 128]
    - [97, 11.048]
  - - [4096, 128, 1, 8192, 4096, 4096, 4096, 128]
    - [61, 13.078]
  - - [4096, 256, 1, 128, 4096, 4096, 4096, 256]
    - [25, 3.056]
  - - [4096, 256, 1, 256, 4096, 4096, 4096, 256]
    - [26, 5.161]
  - - [4096, 256, 1, 512, 4096, 4096, 4096, 256]
    - [102, 7.699]
  - - [4096, 256, 1, 1024, 4096, 4096, 4096, 256]
    - [103, 10.266]
  - - [4096, 256, 1, 2048, 4096, 4096, 4096, 256]
    - [104, 11.838]
  - - [4096, 256, 1, 4096, 4096, 4096, 4096, 256]
    - [86, 14.393]
  - - [4096, 256, 1, 8192, 4096, 4096, 4096, 256]
    - [62, 15.41]
  - - [4096, 512, 1, 128, 4096, 4096, 4096, 512]
    - [9, 4.735]
  - - [4096, 512, 1, 256, 4096, 4096, 4096, 512]
    - [19, 8.017]
  - - [4096, 512, 1, 512, 4096, 4096, 4096, 512]
    - [98, 10.852]
  - - [4096, 512, 1, 1024, 4096, 4096, 4096, 512]
    - [98, 13.873]
  - - [4096, 512, 1, 2048, 4096, 4096, 4096, 512]
    - [90, 14.836]
  - - [4096, 512, 1, 4096, 4096, 4096, 4096, 512]
    - [113, 15.724]
  - - [4096, 512, 1, 8192, 4096, 4096, 4096, 512]
    - [2, 16.911]
  - - [4096, 1024, 1, 128, 4096, 4096, 4096, 1024]
    - [64, 6.154]
  - - [4096, 1024, 1, 256, 4096, 4096, 4096, 1024]
    - [63, 9.91]
  - - [4096, 1024, 1, 512, 4096, 4096, 4096, 1024]
    - [87, 13.513]
  - - [4096, 1024, 1, 1024, 4096, 4096, 4096, 1024]
    - [68, 16.795]
  - - [4096, 1024, 1, 2048, 4096, 4096, 4096, 1024]
    - [87, 18.142]
  - - [4096, 1024, 1, 4096, 4096, 4096, 4096, 1024]
    - [114, 18.797]
  - - [4096, 1024, 1, 8192, 4096, 4096, 4096, 1024]
    - [78, 20.204]
  - - [4096, 2048, 1, 128, 4096, 4096, 4096, 2048]
    - [1, 6.488]
  - - [4096, 2048, 1, 256, 4096, 4096, 4096, 2048]
    - [5, 10.31]
  - - [4096, 2048, 1, 512, 4096, 4096, 4096, 2048]
    - [50, 14.458]
  - - [4096, 2048, 1, 1024, 4096, 4096, 4096, 2048]
    - [54, 18.457]
  - - [4096, 2048, 1, 2048, 4096, 4096, 4096, 2048]
    - [83, 18.767]
  - - [4096, 2048, 1, 4096, 4096, 4096, 4096, 2048]
    - [80, 20.602]
  - - [4096, 2048, 1, 8192, 4096, 4096, 4096, 2048]
    - [80, 23.842]
  - - [4096, 4096, 1, 128, 4096, 4096, 4096, 4096]
    - [92, 6.35]
  - - [4096, 4096, 1, 256, 4096, 4096, 4096, 4096]
    - [40, 10.158]
  - - [4096, 4096, 1, 512, 4096, 4096, 4096, 4096]
    - [40, 14.541]
  - - [4096, 4096, 1, 1024, 4096, 4096, 4096, 4096]
    - [76, 18.548]
  - - [4096, 4096, 1, 2048, 4096, 4096, 4096, 4096]
    - [79, 21.895]
  - - [4096, 4096, 1, 4096, 4096, 4096, 4096, 4096]
    - [39, 22.499]
  - - [4096, 4096, 1, 8192, 4096, 4096, 4096, 4096]
    - [77, 23.851]
  - - [4096, 8192, 1, 128, 4096, 4096, 4096, 8192]
    - [18, 6.024]
  - - [4096, 8192, 1, 256, 4096, 4096, 4096, 8192]
    - [86, 9.038]
  - - [4096, 8192, 1, 512, 4096, 4096, 4096, 8192]
    - [55, 12.874]
  - - [4096, 8192, 1, 1024, 4096, 4096, 4096, 8192]
    - [4, 15.718]
  - - [4096, 8192, 1, 2048, 4096, 4096, 4096, 8192]
    - [50, 19.538]
  - - [4096, 8192, 1, 4096, 4096, 4096, 4096, 8192]
    - [86, 21.885]
  - - [4096, 8192, 1, 8192, 4096, 4096, 4096, 8192]
    - [41, 24.959]
  - - [8192, 128, 1, 128, 8192, 8192, 8192, 128]
    - [14, 3.096]
  - - [8192, 128, 1, 256, 8192, 8192, 8192, 128]
    - [27, 5.176]
  - - [8192, 128, 1, 512, 8192, 8192, 8192, 128]
    - [102, 7.636]
  - - [8192, 128, 1, 1024, 8192, 8192, 8192, 128]
    - [103, 10.049]
  - - [8192, 128, 1, 2048, 8192, 8192, 8192, 128]
    - [103, 11.532]
  - - [8192, 128, 1, 4096, 8192, 8192, 8192, 128]
    - [87, 14.29]
  - - [8192, 128, 1, 8192, 8192, 8192, 8192, 128]
    - [59, 15.83]
  - - [8192, 256, 1, 128, 8192, 8192, 8192, 256]
    - [71, 4.522]
  - - [8192, 256, 1, 256, 8192, 8192, 8192, 256]
    - [98, 7.515]
  - - [8192, 256, 1, 512, 8192, 8192, 8192, 256]
    - [98, 10.74]
  - - [8192, 256, 1, 1024, 8192, 8192, 8192, 256]
    - [96, 13.515]
  - - [8192, 256, 1, 2048, 8192, 8192, 8192, 256]
    - [89, 14.44]
  - - [8192, 256, 1, 4096, 8192, 8192, 8192, 256]
    - [60, 16.366]
  - - [8192, 256, 1, 8192, 8192, 8192, 8192, 256]
    - [4, 17.68]
  - - [8192, 512, 1, 128, 8192, 8192, 8192, 512]
    - [6, 5.727]
  - - [8192, 512, 1, 256, 8192, 8192, 8192, 512]
    - [86, 9.405]
  - - [8192, 512, 1, 512, 8192, 8192, 8192, 512]
    - [88, 13.298]
  - - [8192, 512, 1, 1024, 8192, 8192, 8192, 512]
    - [65, 16.325]
  - - [8192, 512, 1, 2048, 8192, 8192, 8192, 512]
    - [86, 19.257]
  - - [8192, 512, 1, 4096, 8192, 8192, 8192, 512]
    - [114, 19.001]
  - - [8192, 512, 1, 8192, 8192, 8192, 8192, 512]
    - [51, 20.568]
  - - [8192, 1024, 1, 128, 8192, 8192, 8192, 1024]
    - [1, 6.544]
  - - [8192, 1024, 1, 256, 8192, 8192, 8192, 1024]
    - [48, 10.326]
  - - [8192, 1024, 1, 512, 8192, 8192, 8192, 1024]
    - [51, 14.857]
  - - [8192, 1024, 1, 1024, 8192, 8192, 8192, 1024]
    - [52, 18.994]
  - - [8192, 1024, 1, 2048, 8192, 8192, 8192, 1024]
    - [17, 18.708]
  - - [8192, 1024, 1, 4096, 8192, 8192, 8192, 1024]
    - [78, 20.87]
  - - [8192, 1024, 1, 8192, 8192, 8192, 8192, 1024]
    - [80, 23.354]
  - - [8192, 2048, 1, 128, 8192, 8192, 8192, 2048]
    - [40, 6.349]
  - - [8192, 2048, 1, 256, 8192, 8192, 8192, 2048]
    - [41, 10.214]
  - - [8192, 2048, 1, 512, 8192, 8192, 8192, 2048]
    - [42, 14.437]
  - - [8192, 2048, 1, 1024, 8192, 8192, 8192, 2048]
    - [43, 18.655]
  - - [8192, 2048, 1, 2048, 8192, 8192, 8192, 2048]
    - [78, 21.79]
  - - [8192, 2048, 1, 4096, 8192, 8192, 8192, 2048]
    - [43, 21.902]
  - - [8192, 2048, 1, 8192, 8192, 8192, 8192, 2048]
    - [0, 23.777]
  - - [8192, 4096, 1, 128, 8192, 8192, 8192, 4096]
    - [85, 6.06]
  - - [8192, 4096, 1, 256, 8192, 8192, 8192, 4096]
    - [65, 8.939]
  - - [8192, 4096, 1, 512, 8192, 8192, 8192, 4096]
    - [47, 13.08]
  - - [8192, 4096, 1, 1024, 8192, 8192, 8192, 4096]
    - [44, 18.036]
  - - [8192, 4096, 1, 2048, 8192, 8192, 8192, 4096]
    - [44, 22.363]
  - - [8192, 4096, 1, 4096, 8192, 8192, 8192, 4096]
    - [46, 23.906]
  - - [8192, 4096, 1, 8192, 8192, 8192, 8192, 4096]
    - [41, 25.607]
  - - [8192, 8192, 1, 128, 8192, 8192, 8192, 8192]
    - [48, 5.694]
  - - [8192, 8192, 1, 256, 8192, 8192, 8192, 8192]
    - [47, 9.249]
  - - [8192, 8192, 1, 512, 8192, 8192, 8192, 8192]
    - [44, 14.509]
  - - [8192, 8192, 1, 1024, 8192, 8192, 8192, 8192]
    - [44, 20.001]
  - - [8192, 8192, 1, 2048, 8192, 8192, 8192, 8192]
    - [41, 23.454]
  - - [8192, 8192, 1, 4096, 8192, 8192, 8192, 8192]
    - [76, 26.002]
  - - [8192, 8192, 1, 8192, 8192, 8192, 8192, 8192]
    - [43, 26.281]
  - - [1, 1, 1, 32, 1, 1, 1, 1]
    - [121, 0.0]
- null
- null
- DeviceEfficiency
- GridBased
