library/src/amd_detail/rocblaslt/src/Tensile/Logic/streamk/gfx942a/aquavanjaram942_Cijk_Alik_Bjlk_HHS_BH_UserArgs.yaml
- {MinimumRequiredVersion: 4.33.0}
- aquavanjaram942
- gfx942
- [Device 0049, Device 0050]
    SolutionIndex: 0
    SolutionNameMin: Cijk_Alik_Bjlk_HHS_BH_UserArgs_MT256x256x32_MI16x16x1_SN_LDSB1_CLR1_GSU0_GSUC0_GSUWGMRR0_K1_LBSPPA512_LBSPPB2048_LPB0_MIWT8_8_PLR1_SU32_SUM0_SUS256_SKXCCM0_VWA8_VWB4_WGM1_WGMXCC1_WGMXCCGn1
    SolutionIndex: 1
    SolutionNameMin: Cijk_Alik_Bjlk_HHS_BH_UserArgs_MT256x256x32_MI16x16x1_SN_LDSB1_CLR1_GSU0_GSUC0_GSUWGMRR0_K1_LBSPPA256_LBSPPB2048_LPB0_MIWT8_8_PLR1_SU32_SUM0_SUS256_SKXCCM0_VWA4_VWB8_WGM1_WGMXCC1_WGMXCCGn1
    SolutionIndex: 2
    SolutionNameMin: Cijk_Alik_Bjlk_HHS_BH_UserArgs_MT256x256x32_MI16x16x1_SN_LDSB1_CLR1_GSU0_GSUC0_GSUWGMRR0_K1_LBSPPA512_LBSPPB2048_LPB0_MIWT8_8_PLR1_SU32_SUM0_SUS256_SKXCCM0_VWA8_VWB8_WGM1_WGMXCC1_WGMXCCGn1
    SolutionIndex: 3
    SolutionNameMin: Cijk_Alik_Bjlk_HHS_BH_UserArgs_MT128x256x32_MI16x16x1_SN_LDSB1_CLR1_GSU0_GSUC0_GSUWGMRR0_K1_LBSPPA128_LBSPPB2048_LPB0_MIWT4_8_PLR1_SU32_SUM0_SUS256_SKXCCM0_VWA2_VWB8_WGM1_WGMXCC1_WGMXCCGn1
    SolutionIndex: 4
    SolutionNameMin: Cijk_Alik_Bjlk_HHS_BH_UserArgs_MT128x256x32_MI16x16x1_SN_LDSB1_CLR1_GSU0_GSUC0_GSUWGMRR0_K1_LBSPPA256_LBSPPB2048_LPB0_MIWT4_8_PLR1_SU32_SUM0_SUS256_SKXCCM0_VWA4_VWB8_WGM4_WGMXCC1_WGMXCCGn1
    SolutionIndex: 5
    SolutionNameMin: Cijk_Alik_Bjlk_HHS_BH_UserArgs_MT128x256x32_MI16x16x1_SN_LDSB1_CLR1_GSU0_GSUC0_GSUWGMRR0_K1_LBSPPA256_LBSPPB2048_LPB0_MIWT4_8_PLR1_SU32_SUM0_SUS256_SKXCCM0_VWA4_VWB8_WGM8_WGMXCC1_WGMXCCGn1
    SolutionIndex: 6
    SolutionNameMin: Cijk_Alik_Bjlk_HHS_BH_UserArgs_MT128x128x32_MI16x16x1_SN_LDSB1_CLR1_GSU0_GSUC0_GSUWGMRR0_K1_LBSPPA128_LBSPPB1024_LPB0_MIWT4_4_PLR1_SU32_SUM0_SUS256_SKXCCM0_VWA2_VWB4_WGM4_WGMXCC1_WGMXCCGn1
    SolutionIndex: 7
    SolutionNameMin: Cijk_Alik_Bjlk_HHS_BH_UserArgs_MT64x64x32_MI16x16x1_SN_LDSB0_CLR1_GSU0_GSUC0_GSUWGMRR0_K1_LBSPPA128_LBSPPB512_LPB32_MIWT2_2_PLR1_SU32_SUM0_SUS256_SKXCCM0_VWA2_VWB2_WGM1_WGMXCC1_WGMXCCGn1
    SolutionIndex: 8
    SolutionNameMin: Cijk_Alik_Bjlk_HHS_BH_UserArgs_MT256x128x64_MI16x16x1_SN_LDSB1_CLR1_GSU0_GSUC0_GSUWGMRR0_K1_LBSPPA512_LBSPPB2048_LPB0_MIWT8_4_PLR1_SU32_SUM0_SUS256_SKXCCM0_VWA4_VWB4_WGM8_WGMXCC1_WGMXCCGn1
    SolutionIndex: 9
    SolutionNameMin: Cijk_Alik_Bjlk_HHS_BH_UserArgs_MT128x128x64_MI16x16x1_SN_LDSB1_CLR1_GSU0_GSUC0_GSUWGMRR0_K1_LBSPPA512_LBSPPB2048_LPB0_MIWT4_4_PLR1_SU32_SUM0_SUS256_SKXCCM0_VWA4_VWB4_WGM8_WGMXCC1_WGMXCCGn1
    SolutionIndex: 10
    SolutionNameMin: Cijk_Alik_Bjlk_HHS_BH_UserArgs_MT64x128x64_MI16x16x1_SN_LDSB1_CLR1_GSU0_GSUC0_GSUWGMRR0_K1_LBSPPA256_LBSPPB2048_LPB32_MIWT2_4_PLR1_SU32_SUM0_SUS256_SKXCCM0_VWA2_VWB2_WGM1_WGMXCC1_WGMXCCGn1
    SolutionIndex: 11
    SolutionNameMin: Cijk_Alik_Bjlk_HHS_BH_UserArgs_MT64x128x64_MI16x16x1_SN_LDSB1_CLR1_GSU0_GSUC0_GSUWGMRR0_K1_LBSPPA256_LBSPPB2048_LPB0_MIWT2_4_PLR1_SU32_SUM0_SUS256_SKXCCM0_VWA2_VWB4_WGM1_WGMXCC1_WGMXCCGn1
    SolutionIndex: 12
    SolutionNameMin: Cijk_Alik_Bjlk_HHS_BH_UserArgs_MT128x64x64_MI16x16x1_SN_LDSB1_CLR1_GSU0_GSUC0_GSUWGMRR0_K1_LBSPPA256_LBSPPB1024_LPB32_MIWT4_2_PLR1_SU32_SUM0_SUS256_SKXCCM0_VWA2_VWB2_WGM1_WGMXCC1_WGMXCCGn1
    SolutionIndex: 13
    SolutionNameMin: Cijk_Alik_Bjlk_HHS_BH_UserArgs_MT128x64x64_MI16x16x1_SN_LDSB1_CLR1_GSU0_GSUC0_GSUWGMRR0_K1_LBSPPA512_LBSPPB1024_LPB32_MIWT4_2_PLR1_SU32_SUM0_SUS256_SKXCCM0_VWA4_VWB2_WGM1_WGMXCC1_WGMXCCGn1
    SolutionIndex: 14
    SolutionNameMin: Cijk_Alik_Bjlk_HHS_BH_UserArgs_MT128x64x64_MI16x16x1_SN_LDSB1_CLR1_GSU0_GSUC0_GSUWGMRR0_K1_LBSPPA256_LBSPPB1024_LPB32_MIWT4_2_PLR1_SU32_SUM0_SUS256_SKXCCM0_VWA2_VWB2_WGM4_WGMXCC1_WGMXCCGn1
    SolutionIndex: 15
    SolutionNameMin: Cijk_Alik_Bjlk_HHS_BH_UserArgs_MT128x64x64_MI16x16x1_SN_LDSB1_CLR1_GSU0_GSUC0_GSUWGMRR0_K1_LBSPPA512_LBSPPB1024_LPB32_MIWT4_2_PLR1_SU32_SUM0_SUS256_SKXCCM0_VWA4_VWB2_WGM4_WGMXCC1_WGMXCCGn1
    SolutionIndex: 16
    SolutionNameMin: Cijk_Alik_Bjlk_HHS_BH_UserArgs_MT128x64x64_MI16x16x1_SN_LDSB1_CLR1_GSU0_GSUC0_GSUWGMRR0_K1_LBSPPA256_LBSPPB1024_LPB32_MIWT4_2_PLR1_SU32_SUM0_SUS256_SKXCCM0_VWA2_VWB2_WGM8_WGMXCC1_WGMXCCGn1
    SolutionIndex: 17
    SolutionNameMin: Cijk_Alik_Bjlk_HHS_BH_UserArgs_MT128x64x64_MI16x16x1_SN_LDSB1_CLR1_GSU0_GSUC0_GSUWGMRR0_K1_LBSPPA512_LBSPPB1024_LPB32_MIWT4_2_PLR1_SU32_SUM0_SUS256_SKXCCM0_VWA4_VWB2_WGM8_WGMXCC1_WGMXCCGn1
    SolutionIndex: 18
    SolutionNameMin: Cijk_Alik_Bjlk_HHS_BH_UserArgs_MT64x64x64_MI16x16x1_SN_LDSB1_CLR1_GSU0_GSUC0_GSUWGMRR0_K1_LBSPPA256_LBSPPB1024_LPB32_MIWT2_2_PLR1_SU32_SUM0_SUS256_SKXCCM0_VWA2_VWB2_WGM1_WGMXCC1_WGMXCCGn1
    SolutionIndex: 19
    SolutionNameMin: Cijk_Alik_Bjlk_HHS_BH_UserArgs_MT64x64x64_MI16x16x1_SN_LDSB1_CLR1_GSU0_GSUC0_GSUWGMRR0_K1_LBSPPA256_LBSPPB1024_LPB32_MIWT2_2_PLR1_SU32_SUM0_SUS256_SKXCCM0_VWA2_VWB2_WGM8_WGMXCC1_WGMXCCGn1
    SolutionIndex: 20
    SolutionNameMin: Cijk_Alik_Bjlk_HHS_BH_UserArgs_MT32x64x64_MI16x16x1_SN_LDSB0_CLR1_GSU0_GSUC0_GSUWGMRR0_K1_LBSPPA128_LBSPPB1024_LPB32_MIWT1_2_PLR1_SU32_SUM0_SUS256_SKXCCM0_VWA1_VWB2_WGM1_WGMXCC1_WGMXCCGn1
    SolutionIndex: 21
    SolutionNameMin: Cijk_Alik_Bjlk_HHS_BH_UserArgs_MT64x32x64_MI16x16x1_SN_LDSB0_CLR1_GSU0_GSUC0_GSUWGMRR0_K1_LBSPPA256_LBSPPB512_LPB16_MIWT2_1_PLR1_SU32_SUM0_SUS256_SKXCCM0_VWA2_VWB1_WGM1_WGMXCC1_WGMXCCGn1
    SolutionIndex: 22
    SolutionNameMin: Cijk_Alik_Bjlk_HHS_BH_UserArgs_MT64x64x128_MI16x16x1_SN_LDSB1_CLR1_GSU0_GSUC0_GSUWGMRR0_K1_LBSPPA512_LBSPPB1024_LPB32_MIWT2_2_PLR2_SU32_SUM0_SUS256_SKXCCM0_VWA2_VWB2_WGM1_WGMXCC1_WGMXCCGn1
    SolutionIndex: 23
    SolutionNameMin: Cijk_Alik_Bjlk_HHS_BH_UserArgs_MT32x64x128_MI16x16x1_SN_LDSB1_CLR1_GSU0_GSUC0_GSUWGMRR0_K1_LBSPPA256_LBSPPB1024_LPB32_MIWT1_2_PLR2_SU32_SUM0_SUS256_SKXCCM0_VWA1_VWB2_WGM1_WGMXCC1_WGMXCCGn1
    SolutionIndex: 24
    SolutionNameMin: Cijk_Alik_Bjlk_HHS_BH_UserArgs_MT32x64x128_MI16x16x1_SN_LDSB1_CLR1_GSU0_GSUC0_GSUWGMRR0_K1_LBSPPA256_LBSPPB1024_LPB32_MIWT1_2_PLR2_SU32_SUM0_SUS256_SKXCCM0_VWA1_VWB2_WGM4_WGMXCC1_WGMXCCGn1
    SolutionIndex: 25
    SolutionNameMin: Cijk_Alik_Bjlk_HHS_BH_UserArgs_MT64x32x128_MI16x16x1_SN_LDSB1_CLR1_GSU0_GSUC0_GSUWGMRR0_K1_LBSPPA512_LBSPPB512_LPB16_MIWT2_1_PLR1_SU32_SUM0_SUS256_SKXCCM0_VWA2_VWB1_WGM1_WGMXCC1_WGMXCCGn1
    SolutionIndex: 26
    SolutionNameMin: Cijk_Alik_Bjlk_HHS_BH_UserArgs_MT64x32x128_MI16x16x1_SN_LDSB1_CLR1_GSU0_GSUC0_GSUWGMRR0_K1_LBSPPA512_LBSPPB512_LPB16_MIWT2_1_PLR2_SU32_SUM0_SUS256_SKXCCM0_VWA2_VWB1_WGM1_WGMXCC1_WGMXCCGn1
    SolutionIndex: 27
    SolutionNameMin: Cijk_Alik_Bjlk_HHS_BH_UserArgs_MT32x32x128_MI16x16x1_SN_LDSB1_CLR1_GSU0_GSUC0_GSUWGMRR0_K1_LBSPPA256_LBSPPB512_LPB16_MIWT1_1_PLR1_SU32_SUM0_SUS256_SKXCCM0_VWA1_VWB1_WGM1_WGMXCC1_WGMXCCGn1
    SolutionIndex: 28
    SolutionNameMin: Cijk_Alik_Bjlk_HHS_BH_UserArgs_MT32x32x128_MI16x16x1_SN_LDSB1_CLR1_GSU0_GSUC0_GSUWGMRR0_K1_LBSPPA256_LBSPPB512_LPB16_MIWT1_1_PLR2_SU32_SUM0_SUS256_SKXCCM0_VWA1_VWB1_WGM1_WGMXCC1_WGMXCCGn1
    SolutionIndex: 29
    SolutionNameMin: Cijk_Alik_Bjlk_HHS_BH_UserArgs_MT256x256x32_MI16x16x1_SN_LDSB1_CLR1_GSU0_GSUC0_GSUWGMRR0_K1_LBSPPA256_LBSPPB2048_LPB0_MIWT8_8_PLR1_SU32_SUM0_SUS256_SKXCCM6_VWA4_VWB4_WGM1_WGMXCC1_WGMXCCGn1
    SolutionIndex: 30
    SolutionNameMin: Cijk_Alik_Bjlk_HHS_BH_UserArgs_MT256x256x32_MI16x16x1_SN_LDSB1_CLR1_GSU0_GSUC0_GSUWGMRR0_K1_LBSPPA256_LBSPPB2048_LPB0_MIWT8_8_PLR1_SU32_SUM0_SUS256_SKXCCM6_VWA4_VWB8_WGM1_WGMXCC1_WGMXCCGn1
    SolutionIndex: 31
    SolutionNameMin: Cijk_Alik_Bjlk_HHS_BH_UserArgs_MT256x256x32_MI16x16x1_SN_LDSB1_CLR1_GSU0_GSUC0_GSUWGMRR0_K1_LBSPPA512_LBSPPB2048_LPB0_MIWT8_8_PLR1_SU32_SUM0_SUS256_SKXCCM6_VWA8_VWB8_WGM1_WGMXCC1_WGMXCCGn1
    SolutionIndex: 32
    SolutionNameMin: Cijk_Alik_Bjlk_HHS_BH_UserArgs_MT256x256x32_MI16x16x1_SN_LDSB1_CLR1_GSU0_GSUC0_GSUWGMRR0_K1_LBSPPA256_LBSPPB2048_LPB0_MIWT8_8_PLR1_SU32_SUM0_SUS256_SKXCCM6_VWA4_VWB4_WGM4_WGMXCC1_WGMXCCGn1
    SolutionIndex: 33
    SolutionNameMin: Cijk_Alik_Bjlk_HHS_BH_UserArgs_MT256x256x32_MI16x16x1_SN_LDSB1_CLR1_GSU0_GSUC0_GSUWGMRR0_K1_LBSPPA256_LBSPPB2048_LPB0_MIWT8_8_PLR1_SU32_SUM0_SUS256_SKXCCM6_VWA4_VWB8_WGM4_WGMXCC1_WGMXCCGn1
    SolutionIndex: 34
    SolutionNameMin: Cijk_Alik_Bjlk_HHS_BH_UserArgs_MT256x256x32_MI16x16x1_SN_LDSB1_CLR1_GSU0_GSUC0_GSUWGMRR0_K1_LBSPPA512_LBSPPB2048_LPB32_MIWT8_8_PLR1_SU32_SUM0_SUS256_SKXCCM6_VWA8_VWB2_WGM8_WGMXCC1_WGMXCCGn1
    SolutionIndex: 35
    SolutionNameMin: Cijk_Alik_Bjlk_HHS_BH_UserArgs_MT256x256x32_MI16x16x1_SN_LDSB1_CLR1_GSU0_GSUC0_GSUWGMRR0_K1_LBSPPA256_LBSPPB2048_LPB0_MIWT8_8_PLR1_SU32_SUM0_SUS256_SKXCCM6_VWA4_VWB4_WGM8_WGMXCC1_WGMXCCGn1
    SolutionIndex: 36
    SolutionNameMin: Cijk_Alik_Bjlk_HHS_BH_UserArgs_MT256x256x32_MI16x16x1_SN_LDSB1_CLR1_GSU0_GSUC0_GSUWGMRR0_K1_LBSPPA128_LBSPPB2048_LPB0_MIWT8_8_PLR1_SU32_SUM0_SUS256_SKXCCM6_VWA2_VWB8_WGM8_WGMXCC1_WGMXCCGn1
    SolutionIndex: 37
    SolutionNameMin: Cijk_Alik_Bjlk_HHS_BH_UserArgs_MT256x256x32_MI16x16x1_SN_LDSB1_CLR1_GSU0_GSUC0_GSUWGMRR0_K1_LBSPPA256_LBSPPB2048_LPB0_MIWT8_8_PLR1_SU32_SUM0_SUS256_SKXCCM6_VWA4_VWB8_WGM8_WGMXCC1_WGMXCCGn1
    SolutionIndex: 38
    SolutionNameMin: Cijk_Alik_Bjlk_HHS_BH_UserArgs_MT256x256x32_MI16x16x1_SN_LDSB1_CLR1_GSU0_GSUC0_GSUWGMRR0_K1_LBSPPA512_LBSPPB2048_LPB0_MIWT8_8_PLR1_SU32_SUM0_SUS256_SKXCCM6_VWA8_VWB8_WGM8_WGMXCC1_WGMXCCGn1
    SolutionIndex: 39
    SolutionNameMin: Cijk_Alik_Bjlk_HHS_BH_UserArgs_MT128x256x32_MI16x16x1_SN_LDSB1_CLR1_GSU0_GSUC0_GSUWGMRR0_K1_LBSPPA128_LBSPPB2048_LPB16_MIWT4_8_PLR1_SU32_SUM0_SUS256_SKXCCM6_VWA2_VWB1_WGM1_WGMXCC1_WGMXCCGn1
    SolutionIndex: 40
    SolutionNameMin: Cijk_Alik_Bjlk_HHS_BH_UserArgs_MT128x256x32_MI16x16x1_SN_LDSB1_CLR1_GSU0_GSUC0_GSUWGMRR0_K1_LBSPPA256_LBSPPB2048_LPB0_MIWT4_8_PLR1_SU32_SUM0_SUS256_SKXCCM6_VWA4_VWB4_WGM1_WGMXCC1_WGMXCCGn1
    SolutionIndex: 41
    SolutionNameMin: Cijk_Alik_Bjlk_HHS_BH_UserArgs_MT128x256x32_MI16x16x1_SN_LDSB1_CLR1_GSU0_GSUC0_GSUWGMRR0_K1_LBSPPA128_LBSPPB2048_LPB0_MIWT4_8_PLR1_SU32_SUM0_SUS256_SKXCCM6_VWA1_VWB8_WGM1_WGMXCC1_WGMXCCGn1
    SolutionIndex: 42
    SolutionNameMin: Cijk_Alik_Bjlk_HHS_BH_UserArgs_MT128x256x32_MI16x16x1_SN_LDSB1_CLR1_GSU0_GSUC0_GSUWGMRR0_K1_LBSPPA128_LBSPPB2048_LPB0_MIWT4_8_PLR1_SU32_SUM0_SUS256_SKXCCM6_VWA2_VWB8_WGM1_WGMXCC1_WGMXCCGn1
    SolutionIndex: 43
    SolutionNameMin: Cijk_Alik_Bjlk_HHS_BH_UserArgs_MT128x256x32_MI16x16x1_SN_LDSB1_CLR1_GSU0_GSUC0_GSUWGMRR0_K1_LBSPPA256_LBSPPB2048_LPB0_MIWT4_8_PLR1_SU32_SUM0_SUS256_SKXCCM6_VWA4_VWB8_WGM1_WGMXCC1_WGMXCCGn1
    SolutionIndex: 44
    SolutionNameMin: Cijk_Alik_Bjlk_HHS_BH_UserArgs_MT128x256x32_MI16x16x1_SN_LDSB1_CLR1_GSU0_GSUC0_GSUWGMRR0_K1_LBSPPA128_LBSPPB2048_LPB16_MIWT4_8_PLR1_SU32_SUM0_SUS256_SKXCCM6_VWA2_VWB1_WGM4_WGMXCC1_WGMXCCGn1
    SolutionIndex: 45
    SolutionNameMin: Cijk_Alik_Bjlk_HHS_BH_UserArgs_MT128x256x32_MI16x16x1_SN_LDSB1_CLR1_GSU0_GSUC0_GSUWGMRR0_K1_LBSPPA128_LBSPPB2048_LPB32_MIWT4_8_PLR1_SU32_SUM0_SUS256_SKXCCM6_VWA2_VWB2_WGM4_WGMXCC1_WGMXCCGn1
    SolutionIndex: 46
    SolutionNameMin: Cijk_Alik_Bjlk_HHS_BH_UserArgs_MT128x256x32_MI16x16x1_SN_LDSB1_CLR1_GSU0_GSUC0_GSUWGMRR0_K1_LBSPPA256_LBSPPB2048_LPB0_MIWT4_8_PLR1_SU32_SUM0_SUS256_SKXCCM6_VWA4_VWB4_WGM4_WGMXCC1_WGMXCCGn1
    SolutionIndex: 47
    SolutionNameMin: Cijk_Alik_Bjlk_HHS_BH_UserArgs_MT128x256x32_MI16x16x1_SN_LDSB1_CLR1_GSU0_GSUC0_GSUWGMRR0_K1_LBSPPA128_LBSPPB2048_LPB0_MIWT4_8_PLR1_SU32_SUM0_SUS256_SKXCCM6_VWA2_VWB8_WGM4_WGMXCC1_WGMXCCGn1
    SolutionIndex: 48
    SolutionNameMin: Cijk_Alik_Bjlk_HHS_BH_UserArgs_MT128x256x32_MI16x16x1_SN_LDSB1_CLR1_GSU0_GSUC0_GSUWGMRR0_K1_LBSPPA256_LBSPPB2048_LPB0_MIWT4_8_PLR1_SU32_SUM0_SUS256_SKXCCM6_VWA4_VWB8_WGM4_WGMXCC1_WGMXCCGn1
    SolutionIndex: 49
    SolutionNameMin: Cijk_Alik_Bjlk_HHS_BH_UserArgs_MT128x256x32_MI16x16x1_SN_LDSB1_CLR1_GSU0_GSUC0_GSUWGMRR0_K1_LBSPPA128_LBSPPB2048_LPB32_MIWT4_8_PLR1_SU32_SUM0_SUS256_SKXCCM6_VWA2_VWB2_WGM8_WGMXCC1_WGMXCCGn1
    SolutionIndex: 50
    SolutionNameMin: Cijk_Alik_Bjlk_HHS_BH_UserArgs_MT128x256x32_MI16x16x1_SN_LDSB1_CLR1_GSU0_GSUC0_GSUWGMRR0_K1_LBSPPA256_LBSPPB2048_LPB0_MIWT4_8_PLR1_SU32_SUM0_SUS256_SKXCCM6_VWA4_VWB4_WGM8_WGMXCC1_WGMXCCGn1
    SolutionIndex: 51
    SolutionNameMin: Cijk_Alik_Bjlk_HHS_BH_UserArgs_MT128x256x32_MI16x16x1_SN_LDSB1_CLR1_GSU0_GSUC0_GSUWGMRR0_K1_LBSPPA128_LBSPPB2048_LPB0_MIWT4_8_PLR1_SU32_SUM0_SUS256_SKXCCM6_VWA2_VWB8_WGM8_WGMXCC1_WGMXCCGn1
    SolutionIndex: 52
    SolutionNameMin: Cijk_Alik_Bjlk_HHS_BH_UserArgs_MT256x128x32_MI16x16x1_SN_LDSB1_CLR1_GSU0_GSUC0_GSUWGMRR0_K1_LBSPPA128_LBSPPB1024_LPB32_MIWT8_4_PLR1_SU32_SUM0_SUS256_SKXCCM6_VWA2_VWB2_WGM1_WGMXCC1_WGMXCCGn1
    SolutionIndex: 53
    SolutionNameMin: Cijk_Alik_Bjlk_HHS_BH_UserArgs_MT256x128x32_MI16x16x1_SN_LDSB1_CLR1_GSU0_GSUC0_GSUWGMRR0_K1_LBSPPA128_LBSPPB1024_LPB32_MIWT8_4_PLR1_SU32_SUM0_SUS256_SKXCCM6_VWA2_VWB2_WGM4_WGMXCC1_WGMXCCGn1
    SolutionIndex: 54
    SolutionNameMin: Cijk_Alik_Bjlk_HHS_BH_UserArgs_MT256x128x32_MI16x16x1_SN_LDSB1_CLR1_GSU0_GSUC0_GSUWGMRR0_K1_LBSPPA512_LBSPPB1024_LPB0_MIWT8_4_PLR1_SU32_SUM0_SUS256_SKXCCM6_VWA8_VWB4_WGM8_WGMXCC1_WGMXCCGn1
    SolutionIndex: 55
    SolutionNameMin: Cijk_Alik_Bjlk_HHS_BH_UserArgs_MT128x128x32_MI16x16x1_SN_LDSB1_CLR1_GSU0_GSUC0_GSUWGMRR0_K1_LBSPPA128_LBSPPB1024_LPB32_MIWT4_4_PLR1_SU32_SUM0_SUS256_SKXCCM6_VWA1_VWB2_WGM1_WGMXCC1_WGMXCCGn1
    SolutionIndex: 56
    SolutionNameMin: Cijk_Alik_Bjlk_HHS_BH_UserArgs_MT128x128x32_MI16x16x1_SN_LDSB1_CLR1_GSU0_GSUC0_GSUWGMRR0_K1_LBSPPA256_LBSPPB1024_LPB32_MIWT4_4_PLR1_SU32_SUM0_SUS256_SKXCCM6_VWA4_VWB2_WGM1_WGMXCC1_WGMXCCGn1
    SolutionIndex: 57
    SolutionNameMin: Cijk_Alik_Bjlk_HHS_BH_UserArgs_MT128x128x32_MI16x16x1_SN_LDSB1_CLR1_GSU0_GSUC0_GSUWGMRR0_K1_LBSPPA128_LBSPPB1024_LPB0_MIWT4_4_PLR1_SU32_SUM0_SUS256_SKXCCM6_VWA2_VWB4_WGM1_WGMXCC1_WGMXCCGn1
    SolutionIndex: 58
    SolutionNameMin: Cijk_Alik_Bjlk_HHS_BH_UserArgs_MT128x128x32_MI16x16x1_SN_LDSB1_CLR1_GSU0_GSUC0_GSUWGMRR0_K1_LBSPPA256_LBSPPB1024_LPB0_MIWT4_4_PLR1_SU32_SUM0_SUS256_SKXCCM6_VWA4_VWB4_WGM1_WGMXCC1_WGMXCCGn1
    SolutionIndex: 59
    SolutionNameMin: Cijk_Alik_Bjlk_HHS_BH_UserArgs_MT128x128x32_MI16x16x1_SN_LDSB1_CLR1_GSU0_GSUC0_GSUWGMRR0_K1_LBSPPA128_LBSPPB1024_LPB0_MIWT4_4_PLR1_SU32_SUM0_SUS256_SKXCCM6_VWA2_VWB4_WGM4_WGMXCC1_WGMXCCGn1
    SolutionIndex: 60
    SolutionNameMin: Cijk_Alik_Bjlk_HHS_BH_UserArgs_MT128x128x32_MI16x16x1_SN_LDSB1_CLR1_GSU0_GSUC0_GSUWGMRR0_K1_LBSPPA256_LBSPPB1024_LPB0_MIWT4_4_PLR1_SU32_SUM0_SUS256_SKXCCM6_VWA4_VWB4_WGM4_WGMXCC1_WGMXCCGn1
    SolutionIndex: 61
    SolutionNameMin: Cijk_Alik_Bjlk_HHS_BH_UserArgs_MT128x128x32_MI16x16x1_SN_LDSB1_CLR1_GSU0_GSUC0_GSUWGMRR0_K1_LBSPPA128_LBSPPB1024_LPB16_MIWT4_4_PLR1_SU32_SUM0_SUS256_SKXCCM6_VWA2_VWB1_WGM8_WGMXCC1_WGMXCCGn1
    SolutionIndex: 62
    SolutionNameMin: Cijk_Alik_Bjlk_HHS_BH_UserArgs_MT128x128x32_MI16x16x1_SN_LDSB1_CLR1_GSU0_GSUC0_GSUWGMRR0_K1_LBSPPA256_LBSPPB1024_LPB16_MIWT4_4_PLR1_SU32_SUM0_SUS256_SKXCCM6_VWA4_VWB1_WGM8_WGMXCC1_WGMXCCGn1
    SolutionIndex: 63
    SolutionNameMin: Cijk_Alik_Bjlk_HHS_BH_UserArgs_MT128x128x32_MI16x16x1_SN_LDSB1_CLR1_GSU0_GSUC0_GSUWGMRR0_K1_LBSPPA128_LBSPPB1024_LPB32_MIWT4_4_PLR1_SU32_SUM0_SUS256_SKXCCM6_VWA2_VWB2_WGM8_WGMXCC1_WGMXCCGn1
    SolutionIndex: 64
    SolutionNameMin: Cijk_Alik_Bjlk_HHS_BH_UserArgs_MT128x128x32_MI16x16x1_SN_LDSB1_CLR1_GSU0_GSUC0_GSUWGMRR0_K1_LBSPPA128_LBSPPB1024_LPB0_MIWT4_4_PLR1_SU32_SUM0_SUS256_SKXCCM6_VWA2_VWB4_WGM8_WGMXCC1_WGMXCCGn1
    SolutionIndex: 65
    SolutionNameMin: Cijk_Alik_Bjlk_HHS_BH_UserArgs_MT128x128x32_MI16x16x1_SN_LDSB1_CLR1_GSU0_GSUC0_GSUWGMRR0_K1_LBSPPA256_LBSPPB1024_LPB0_MIWT4_4_PLR1_SU32_SUM0_SUS256_SKXCCM6_VWA4_VWB4_WGM8_WGMXCC1_WGMXCCGn1
    SolutionIndex: 66
    SolutionNameMin: Cijk_Alik_Bjlk_HHS_BH_UserArgs_MT64x128x32_MI16x16x1_SN_LDSB0_CLR0_GSU0_GSUC0_GSUWGMRR0_K1_LBSPPA128_LBSPPB1024_LPB32_MIWT2_4_PLR0_SU32_SUM0_SUS256_SKXCCM6_VWA2_VWB2_WGM4_WGMXCC1_WGMXCCGn1
    SolutionIndex: 67
    SolutionNameMin: Cijk_Alik_Bjlk_HHS_BH_UserArgs_MT32x32x32_MI16x16x1_SN_LDSB0_CLR1_GSU0_GSUC0_GSUWGMRR0_K1_LBSPPA128_LBSPPB256_LPB16_MIWT1_1_PLR1_SU32_SUM0_SUS256_SKXCCM6_VWA1_VWB1_WGM1_WGMXCC1_WGMXCCGn1
    SolutionIndex: 68
    SolutionNameMin: Cijk_Alik_Bjlk_HHS_BH_UserArgs_MT128x256x64_MI16x16x1_SN_LDSB1_CLR1_GSU0_GSUC0_GSUWGMRR0_K1_LBSPPA512_LBSPPB4096_LPB0_MIWT4_8_PLR1_SU32_SUM0_SUS256_SKXCCM6_VWA4_VWB4_WGM8_WGMXCC1_WGMXCCGn1
    SolutionIndex: 69
    SolutionNameMin: Cijk_Alik_Bjlk_HHS_BH_UserArgs_MT256x128x64_MI16x16x1_SN_LDSB1_CLR1_GSU0_GSUC0_GSUWGMRR0_K1_LBSPPA512_LBSPPB2048_LPB0_MIWT8_4_PLR1_SU32_SUM0_SUS256_SKXCCM6_VWA4_VWB4_WGM1_WGMXCC1_WGMXCCGn1
    SolutionIndex: 70
    SolutionNameMin: Cijk_Alik_Bjlk_HHS_BH_UserArgs_MT256x128x64_MI16x16x1_SN_LDSB1_CLR1_GSU0_GSUC0_GSUWGMRR0_K1_LBSPPA512_LBSPPB2048_LPB0_MIWT8_4_PLR1_SU32_SUM0_SUS256_SKXCCM6_VWA4_VWB4_WGM4_WGMXCC1_WGMXCCGn1
    SolutionIndex: 71
    SolutionNameMin: Cijk_Alik_Bjlk_HHS_BH_UserArgs_MT256x128x64_MI16x16x1_SN_LDSB1_CLR1_GSU0_GSUC0_GSUWGMRR0_K1_LBSPPA1024_LBSPPB2048_LPB0_MIWT8_4_PLR1_SU32_SUM0_SUS256_SKXCCM6_VWA8_VWB4_WGM4_WGMXCC1_WGMXCCGn1
    SolutionIndex: 72
    SolutionNameMin: Cijk_Alik_Bjlk_HHS_BH_UserArgs_MT256x128x64_MI16x16x1_SN_LDSB1_CLR1_GSU0_GSUC0_GSUWGMRR0_K1_LBSPPA512_LBSPPB2048_LPB0_MIWT8_4_PLR1_SU32_SUM0_SUS256_SKXCCM6_VWA4_VWB4_WGM8_WGMXCC1_WGMXCCGn1
    SolutionIndex: 73
    SolutionNameMin: Cijk_Alik_Bjlk_HHS_BH_UserArgs_MT256x128x64_MI16x16x1_SN_LDSB1_CLR1_GSU0_GSUC0_GSUWGMRR0_K1_LBSPPA1024_LBSPPB2048_LPB0_MIWT8_4_PLR1_SU32_SUM0_SUS256_SKXCCM6_VWA8_VWB4_WGM8_WGMXCC1_WGMXCCGn1
    SolutionIndex: 74
    SolutionNameMin: Cijk_Alik_Bjlk_HHS_BH_UserArgs_MT128x128x64_MI16x16x1_SN_LDSB1_CLR1_GSU0_GSUC0_GSUWGMRR0_K1_LBSPPA256_LBSPPB2048_LPB0_MIWT4_4_PLR1_SU32_SUM0_SUS256_SKXCCM6_VWA2_VWB4_WGM1_WGMXCC1_WGMXCCGn1
    SolutionIndex: 75
    SolutionNameMin: Cijk_Alik_Bjlk_HHS_BH_UserArgs_MT128x128x64_MI16x16x1_SN_LDSB1_CLR1_GSU0_GSUC0_GSUWGMRR0_K1_LBSPPA512_LBSPPB2048_LPB0_MIWT4_4_PLR1_SU32_SUM0_SUS256_SKXCCM6_VWA4_VWB4_WGM1_WGMXCC1_WGMXCCGn1
    SolutionIndex: 76
    SolutionNameMin: Cijk_Alik_Bjlk_HHS_BH_UserArgs_MT128x128x64_MI16x16x1_SN_LDSB1_CLR1_GSU0_GSUC0_GSUWGMRR0_K1_LBSPPA512_LBSPPB2048_LPB0_MIWT4_4_PLR1_SU32_SUM0_SUS256_SKXCCM6_VWA4_VWB4_WGM4_WGMXCC1_WGMXCCGn1
    SolutionIndex: 77
    SolutionNameMin: Cijk_Alik_Bjlk_HHS_BH_UserArgs_MT128x128x64_MI16x16x1_SN_LDSB1_CLR1_GSU0_GSUC0_GSUWGMRR0_K1_LBSPPA256_LBSPPB2048_LPB0_MIWT4_4_PLR1_SU32_SUM0_SUS256_SKXCCM6_VWA2_VWB4_WGM8_WGMXCC1_WGMXCCGn1
    SolutionIndex: 78
    SolutionNameMin: Cijk_Alik_Bjlk_HHS_BH_UserArgs_MT128x128x64_MI16x16x1_SN_LDSB1_CLR1_GSU0_GSUC0_GSUWGMRR0_K1_LBSPPA512_LBSPPB2048_LPB0_MIWT4_4_PLR1_SU32_SUM0_SUS256_SKXCCM6_VWA4_VWB4_WGM8_WGMXCC1_WGMXCCGn1
    SolutionIndex: 79
    SolutionNameMin: Cijk_Alik_Bjlk_HHS_BH_UserArgs_MT64x128x64_MI16x16x1_SN_LDSB1_CLR1_GSU0_GSUC0_GSUWGMRR0_K1_LBSPPA256_LBSPPB2048_LPB0_MIWT2_4_PLR1_SU32_SUM0_SUS256_SKXCCM6_VWA2_VWB4_WGM1_WGMXCC1_WGMXCCGn1
    SolutionIndex: 80
    SolutionNameMin: Cijk_Alik_Bjlk_HHS_BH_UserArgs_MT64x128x64_MI16x16x1_SN_LDSB1_CLR1_GSU0_GSUC0_GSUWGMRR0_K1_LBSPPA256_LBSPPB2048_LPB0_MIWT2_4_PLR2_SU32_SUM0_SUS256_SKXCCM6_VWA2_VWB4_WGM1_WGMXCC1_WGMXCCGn1
    SolutionIndex: 81
    SolutionNameMin: Cijk_Alik_Bjlk_HHS_BH_UserArgs_MT64x128x64_MI16x16x1_SN_LDSB1_CLR1_GSU0_GSUC0_GSUWGMRR0_K1_LBSPPA256_LBSPPB2048_LPB0_MIWT2_4_PLR1_SU32_SUM0_SUS256_SKXCCM6_VWA2_VWB4_WGM4_WGMXCC1_WGMXCCGn1
    SolutionIndex: 82
    SolutionNameMin: Cijk_Alik_Bjlk_HHS_BH_UserArgs_MT64x128x64_MI16x16x1_SN_LDSB1_CLR1_GSU0_GSUC0_GSUWGMRR0_K1_LBSPPA256_LBSPPB2048_LPB32_MIWT2_4_PLR1_SU32_SUM0_SUS256_SKXCCM6_VWA2_VWB2_WGM8_WGMXCC1_WGMXCCGn1
    SolutionIndex: 83
    SolutionNameMin: Cijk_Alik_Bjlk_HHS_BH_UserArgs_MT64x128x64_MI16x16x1_SN_LDSB1_CLR1_GSU0_GSUC0_GSUWGMRR0_K1_LBSPPA256_LBSPPB2048_LPB0_MIWT2_4_PLR1_SU32_SUM0_SUS256_SKXCCM6_VWA2_VWB4_WGM8_WGMXCC1_WGMXCCGn1
    SolutionIndex: 84
    SolutionNameMin: Cijk_Alik_Bjlk_HHS_BH_UserArgs_MT128x64x64_MI16x16x1_SN_LDSB1_CLR1_GSU0_GSUC0_GSUWGMRR0_K1_LBSPPA512_LBSPPB1024_LPB16_MIWT4_2_PLR1_SU32_SUM0_SUS256_SKXCCM6_VWA4_VWB1_WGM1_WGMXCC1_WGMXCCGn1
    SolutionIndex: 85
    SolutionNameMin: Cijk_Alik_Bjlk_HHS_BH_UserArgs_MT128x64x64_MI16x16x1_SN_LDSB1_CLR1_GSU0_GSUC0_GSUWGMRR0_K1_LBSPPA256_LBSPPB1024_LPB32_MIWT4_2_PLR1_SU32_SUM0_SUS256_SKXCCM6_VWA2_VWB2_WGM1_WGMXCC1_WGMXCCGn1
    SolutionIndex: 86
    SolutionNameMin: Cijk_Alik_Bjlk_HHS_BH_UserArgs_MT128x64x64_MI16x16x1_SN_LDSB1_CLR1_GSU0_GSUC0_GSUWGMRR0_K1_LBSPPA512_LBSPPB1024_LPB32_MIWT4_2_PLR1_SU32_SUM0_SUS256_SKXCCM6_VWA4_VWB2_WGM1_WGMXCC1_WGMXCCGn1
    SolutionIndex: 87
    SolutionNameMin: Cijk_Alik_Bjlk_HHS_BH_UserArgs_MT128x64x64_MI16x16x1_SN_LDSB1_CLR1_GSU0_GSUC0_GSUWGMRR0_K1_LBSPPA128_LBSPPB1024_LPB32_MIWT4_2_PLR2_SU32_SUM0_SUS256_SKXCCM6_VWA1_VWB2_WGM1_WGMXCC1_WGMXCCGn1
    SolutionIndex: 88
    SolutionNameMin: Cijk_Alik_Bjlk_HHS_BH_UserArgs_MT128x64x64_MI16x16x1_SN_LDSB1_CLR1_GSU0_GSUC0_GSUWGMRR0_K1_LBSPPA512_LBSPPB1024_LPB32_MIWT4_2_PLR2_SU32_SUM0_SUS256_SKXCCM6_VWA4_VWB2_WGM1_WGMXCC1_WGMXCCGn1
    SolutionIndex: 89
    SolutionNameMin: Cijk_Alik_Bjlk_HHS_BH_UserArgs_MT128x64x64_MI16x16x1_SN_LDSB1_CLR1_GSU0_GSUC0_GSUWGMRR0_K1_LBSPPA256_LBSPPB1024_LPB32_MIWT4_2_PLR1_SU32_SUM0_SUS256_SKXCCM6_VWA2_VWB2_WGM4_WGMXCC1_WGMXCCGn1
    SolutionIndex: 90
    SolutionNameMin: Cijk_Alik_Bjlk_HHS_BH_UserArgs_MT128x64x64_MI16x16x1_SN_LDSB1_CLR1_GSU0_GSUC0_GSUWGMRR0_K1_LBSPPA512_LBSPPB1024_LPB32_MIWT4_2_PLR1_SU32_SUM0_SUS256_SKXCCM6_VWA4_VWB2_WGM4_WGMXCC1_WGMXCCGn1
    SolutionIndex: 91
    SolutionNameMin: Cijk_Alik_Bjlk_HHS_BH_UserArgs_MT128x64x64_MI16x16x1_SN_LDSB1_CLR1_GSU0_GSUC0_GSUWGMRR0_K1_LBSPPA256_LBSPPB1024_LPB32_MIWT4_2_PLR1_SU32_SUM0_SUS256_SKXCCM6_VWA2_VWB2_WGM8_WGMXCC1_WGMXCCGn1
    SolutionIndex: 92
    SolutionNameMin: Cijk_Alik_Bjlk_HHS_BH_UserArgs_MT128x64x64_MI16x16x1_SN_LDSB1_CLR1_GSU0_GSUC0_GSUWGMRR0_K1_LBSPPA512_LBSPPB1024_LPB32_MIWT4_2_PLR1_SU32_SUM0_SUS256_SKXCCM6_VWA4_VWB2_WGM8_WGMXCC1_WGMXCCGn1
    SolutionIndex: 93
    SolutionNameMin: Cijk_Alik_Bjlk_HHS_BH_UserArgs_MT128x64x64_MI16x16x1_SN_LDSB1_CLR1_GSU0_GSUC0_GSUWGMRR0_K1_LBSPPA512_LBSPPB1024_LPB32_MIWT4_2_PLR2_SU32_SUM0_SUS256_SKXCCM6_VWA4_VWB2_WGM8_WGMXCC1_WGMXCCGn1
    SolutionIndex: 94
    SolutionNameMin: Cijk_Alik_Bjlk_HHS_BH_UserArgs_MT32x128x64_MI16x16x1_SN_LDSB1_CLR1_GSU0_GSUC0_GSUWGMRR0_K1_LBSPPA128_LBSPPB2048_LPB0_MIWT1_4_PLR1_SU32_SUM0_SUS256_SKXCCM6_VWA1_VWB4_WGM4_WGMXCC1_WGMXCCGn1
    SolutionIndex: 95
    SolutionNameMin: Cijk_Alik_Bjlk_HHS_BH_UserArgs_MT64x64x64_MI16x16x1_SN_LDSB1_CLR1_GSU0_GSUC0_GSUWGMRR0_K1_LBSPPA128_LBSPPB1024_LPB32_MIWT2_2_PLR1_SU32_SUM0_SUS256_SKXCCM6_VWA1_VWB2_WGM1_WGMXCC1_WGMXCCGn1
    SolutionIndex: 96
    SolutionNameMin: Cijk_Alik_Bjlk_HHS_BH_UserArgs_MT64x64x64_MI16x16x1_SN_LDSB1_CLR1_GSU0_GSUC0_GSUWGMRR0_K1_LBSPPA256_LBSPPB1024_LPB32_MIWT2_2_PLR1_SU32_SUM0_SUS256_SKXCCM6_VWA2_VWB2_WGM1_WGMXCC1_WGMXCCGn1
    SolutionIndex: 97
    SolutionNameMin: Cijk_Alik_Bjlk_HHS_BH_UserArgs_MT64x64x64_MI16x16x1_SN_LDSB1_CLR1_GSU0_GSUC0_GSUWGMRR0_K1_LBSPPA256_LBSPPB1024_LPB32_MIWT2_2_PLR1_SU32_SUM0_SUS256_SKXCCM6_VWA2_VWB2_WGM4_WGMXCC1_WGMXCCGn1
    SolutionIndex: 98
    SolutionNameMin: Cijk_Alik_Bjlk_HHS_BH_UserArgs_MT64x64x64_MI16x16x1_SN_LDSB1_CLR1_GSU0_GSUC0_GSUWGMRR0_K1_LBSPPA128_LBSPPB1024_LPB32_MIWT2_2_PLR2_SU32_SUM0_SUS256_SKXCCM6_VWA1_VWB2_WGM4_WGMXCC1_WGMXCCGn1
    SolutionIndex: 99
    SolutionNameMin: Cijk_Alik_Bjlk_HHS_BH_UserArgs_MT64x64x64_MI16x16x1_SN_LDSB1_CLR1_GSU0_GSUC0_GSUWGMRR0_K1_LBSPPA256_LBSPPB1024_LPB32_MIWT2_2_PLR1_SU32_SUM0_SUS256_SKXCCM6_VWA2_VWB2_WGM8_WGMXCC1_WGMXCCGn1
    SolutionIndex: 100
    SolutionNameMin: Cijk_Alik_Bjlk_HHS_BH_UserArgs_MT64x64x64_MI16x16x1_SN_LDSB1_CLR1_GSU0_GSUC0_GSUWGMRR0_K1_LBSPPA128_LBSPPB1024_LPB32_MIWT2_2_PLR2_SU32_SUM0_SUS256_SKXCCM6_VWA1_VWB2_WGM8_WGMXCC1_WGMXCCGn1
    SolutionIndex: 101
    SolutionNameMin: Cijk_Alik_Bjlk_HHS_BH_UserArgs_MT32x32x64_MI16x16x1_SN_LDSB0_CLR1_GSU0_GSUC0_GSUWGMRR0_K1_LBSPPA128_LBSPPB512_LPB16_MIWT1_1_PLR1_SU32_SUM0_SUS256_SKXCCM6_VWA1_VWB1_WGM1_WGMXCC1_WGMXCCGn1
    SolutionIndex: 102
    SolutionNameMin: Cijk_Alik_Bjlk_HHS_BH_UserArgs_MT32x64x128_MI16x16x1_SN_LDSB1_CLR1_GSU0_GSUC0_GSUWGMRR0_K1_LBSPPA256_LBSPPB1024_LPB32_MIWT1_2_PLR2_SU32_SUM0_SUS256_SKXCCM6_VWA1_VWB2_WGM1_WGMXCC1_WGMXCCGn1
    SolutionIndex: 103
    SolutionNameMin: Cijk_Alik_Bjlk_HHS_BH_UserArgs_MT32x64x128_MI16x16x1_SN_LDSB1_CLR1_GSU0_GSUC0_GSUWGMRR0_K1_LBSPPA256_LBSPPB1024_LPB32_MIWT1_2_PLR2_SU32_SUM0_SUS256_SKXCCM6_VWA1_VWB2_WGM4_WGMXCC1_WGMXCCGn1
    SolutionIndex: 104
    SolutionNameMin: Cijk_Alik_Bjlk_HHS_BH_UserArgs_MT32x64x128_MI16x16x1_SN_LDSB1_CLR1_GSU0_GSUC0_GSUWGMRR0_K1_LBSPPA256_LBSPPB1024_LPB32_MIWT1_2_PLR2_SU32_SUM0_SUS256_SKXCCM6_VWA1_VWB2_WGM8_WGMXCC1_WGMXCCGn1
    SolutionIndex: 105
    SolutionNameMin: Cijk_Alik_Bjlk_HHS_BH_UserArgs_MT64x32x128_MI16x16x1_SN_LDSB1_CLR1_GSU0_GSUC0_GSUWGMRR0_K1_LBSPPA256_LBSPPB512_LPB16_MIWT2_1_PLR1_SU32_SUM0_SUS256_SKXCCM6_VWA1_VWB1_WGM1_WGMXCC1_WGMXCCGn1
    SolutionIndex: 106
    SolutionNameMin: Cijk_Alik_Bjlk_HHS_BH_UserArgs_MT64x32x128_MI16x16x1_SN_LDSB1_CLR1_GSU0_GSUC0_GSUWGMRR0_K1_LBSPPA512_LBSPPB512_LPB16_MIWT2_1_PLR2_SU32_SUM0_SUS256_SKXCCM6_VWA2_VWB1_WGM1_WGMXCC1_WGMXCCGn1
    SolutionIndex: 107
    SolutionNameMin: Cijk_Alik_Bjlk_HHS_BH_UserArgs_MT32x32x128_MI16x16x1_SN_LDSB1_CLR1_GSU0_GSUC0_GSUWGMRR0_K1_LBSPPA256_LBSPPB512_LPB16_MIWT1_1_PLR1_SU32_SUM0_SUS256_SKXCCM6_VWA1_VWB1_WGM1_WGMXCC1_WGMXCCGn1
    SolutionIndex: 108
    SolutionNameMin: Cijk_Alik_Bjlk_HHS_BH_UserArgs_MT32x32x128_MI16x16x1_SN_LDSB1_CLR1_GSU0_GSUC0_GSUWGMRR0_K1_LBSPPA256_LBSPPB512_LPB16_MIWT1_1_PLR2_SU32_SUM0_SUS256_SKXCCM6_VWA1_VWB1_WGM1_WGMXCC1_WGMXCCGn1
    SolutionIndex: 109
    SolutionNameMin: Cijk_Alik_Bjlk_HHS_BH_UserArgs_MT32x32x32_MI16x16x1_SN_LDSB0_CLR0_GSU0_GSUC0_GSUWGMRR0_K1_LBSPPA128_LBSPPB256_LPB16_MIWT1_1_PLR0_SU32_SUM0_SUS256_SKXCCM0_VWA1_VWB1_WGM4_WGMXCC1_WGMXCCGn1
- - - [128, 128, 1, 128, 128, 128, 128, 128]
    - [28, 0.084]
  - - [128, 128, 1, 256, 128, 128, 256, 128]
    - [27, 0.109]
  - - [128, 128, 1, 512, 128, 128, 512, 128]
    - [27, 0.179]
  - - [128, 128, 1, 1024, 128, 128, 1024, 128]
    - [108, 0.256]
  - - [128, 128, 1, 2048, 128, 128, 2048, 128]
    - [101, 0.36]
  - - [128, 128, 1, 4096, 128, 128, 4096, 128]
    - [101, 0.693]
  - - [128, 128, 1, 8192, 128, 128, 8192, 128]
    - [27, 1.297]
  - - [128, 256, 1, 128, 128, 128, 128, 256]
    - [27, 0.166]
  - - [128, 256, 1, 256, 128, 128, 256, 256]
    - [28, 0.214]
  - - [128, 256, 1, 512, 128, 128, 512, 256]
    - [107, 0.349]
  - - [128, 256, 1, 1024, 128, 128, 1024, 256]
    - [101, 0.541]
  - - [128, 256, 1, 2048, 128, 128, 2048, 256]
    - [27, 0.991]
  - - [128, 256, 1, 4096, 128, 128, 4096, 256]
    - [67, 1.7]
  - - [128, 256, 1, 8192, 128, 128, 8192, 256]
    - [28, 2.858]
  - - [128, 512, 1, 128, 128, 128, 128, 512]
    - [28, 0.325]
  - - [128, 512, 1, 256, 128, 128, 256, 512]
    - [28, 0.416]
  - - [128, 512, 1, 512, 128, 128, 512, 512]
    - [108, 0.684]
  - - [128, 512, 1, 1024, 128, 128, 1024, 512]
    - [67, 1.232]
  - - [128, 512, 1, 2048, 128, 128, 2048, 512]
    - [107, 2.195]
  - - [128, 512, 1, 4096, 128, 128, 4096, 512]
    - [28, 3.376]
  - - [128, 512, 1, 8192, 128, 128, 8192, 512]
    - [102, 4.864]
  - - [128, 1024, 1, 128, 128, 128, 128, 1024]
    - [27, 0.648]
  - - [128, 1024, 1, 256, 128, 128, 256, 1024]
    - [27, 0.798]
  - - [128, 1024, 1, 512, 128, 128, 512, 1024]
    - [27, 1.445]
  - - [128, 1024, 1, 1024, 128, 128, 1024, 1024]
    - [108, 2.435]
  - - [128, 1024, 1, 2048, 128, 128, 2048, 1024]
    - [102, 3.812]
  - - [128, 1024, 1, 4096, 128, 128, 4096, 1024]
    - [102, 5.53]
  - - [128, 1024, 1, 8192, 128, 128, 8192, 1024]
    - [95, 7.22]
  - - [128, 2048, 1, 128, 128, 128, 128, 2048]
    - [26, 1.193]
  - - [128, 2048, 1, 256, 128, 128, 256, 2048]
    - [27, 1.956]
  - - [128, 2048, 1, 512, 128, 128, 512, 2048]
    - [27, 3.065]
  - - [128, 2048, 1, 1024, 128, 128, 1024, 2048]
    - [108, 4.335]
  - - [128, 2048, 1, 2048, 128, 128, 2048, 2048]
    - [102, 6.179]
  - - [128, 2048, 1, 4096, 128, 128, 4096, 2048]
    - [95, 8.53]
  - - [128, 2048, 1, 8192, 128, 128, 8192, 2048]
    - [13, 9.76]
  - - [128, 4096, 1, 128, 128, 128, 128, 4096]
    - [22, 2.192]
  - - [128, 4096, 1, 256, 128, 128, 256, 4096]
    - [20, 3.53]
  - - [128, 4096, 1, 512, 128, 128, 512, 4096]
    - [102, 5.326]
  - - [128, 4096, 1, 1024, 128, 128, 1024, 4096]
    - [102, 7.549]
  - - [128, 4096, 1, 2048, 128, 128, 2048, 4096]
    - [99, 9.703]
  - - [128, 4096, 1, 4096, 128, 128, 4096, 4096]
    - [93, 11.219]
  - - [128, 4096, 1, 8192, 128, 128, 8192, 4096]
    - [17, 12.961]
  - - [128, 8192, 1, 128, 128, 128, 128, 8192]
    - [7, 3.651]
  - - [128, 8192, 1, 256, 128, 128, 256, 8192]
    - [18, 6.074]
  - - [128, 8192, 1, 512, 128, 128, 512, 8192]
    - [96, 8.932]
  - - [128, 8192, 1, 1024, 128, 128, 1024, 8192]
    - [96, 11.53]
  - - [128, 8192, 1, 2048, 128, 128, 2048, 8192]
    - [96, 12.709]
  - - [128, 8192, 1, 4096, 128, 128, 4096, 8192]
    - [90, 13.986]
  - - [128, 8192, 1, 8192, 128, 128, 8192, 8192]
    - [14, 15.785]
  - - [256, 128, 1, 128, 256, 256, 128, 128]
    - [27, 0.166]
  - - [256, 128, 1, 256, 256, 256, 256, 128]
    - [28, 0.215]
  - - [256, 128, 1, 512, 256, 256, 512, 128]
    - [28, 0.356]
  - - [256, 128, 1, 1024, 256, 256, 1024, 128]
    - [101, 0.54]
  - - [256, 128, 1, 2048, 256, 256, 2048, 128]
    - [108, 1.003]
  - - [256, 128, 1, 4096, 256, 256, 4096, 128]
    - [27, 1.696]
  - - [256, 128, 1, 8192, 256, 256, 8192, 128]
    - [28, 2.865]
  - - [256, 256, 1, 128, 256, 256, 128, 256]
    - [27, 0.325]
  - - [256, 256, 1, 256, 256, 256, 256, 256]
    - [27, 0.413]
  - - [256, 256, 1, 512, 256, 256, 512, 256]
    - [107, 0.676]
  - - [256, 256, 1, 1024, 256, 256, 1024, 256]
    - [67, 1.233]
  - - [256, 256, 1, 2048, 256, 256, 2048, 256]
    - [108, 2.217]
  - - [256, 256, 1, 4096, 256, 256, 4096, 256]
    - [108, 3.454]
  - - [256, 256, 1, 8192, 256, 256, 8192, 256]
    - [23, 5.003]
  - - [256, 512, 1, 128, 256, 256, 128, 512]
    - [27, 0.647]
  - - [256, 512, 1, 256, 256, 256, 256, 512]
    - [28, 0.799]
  - - [256, 512, 1, 512, 256, 256, 512, 512]
    - [27, 1.44]
  - - [256, 512, 1, 1024, 256, 256, 1024, 512]
    - [107, 2.405]
  - - [256, 512, 1, 2048, 256, 256, 2048, 512]
    - [106, 3.843]
  - - [256, 512, 1, 4096, 256, 256, 4096, 512]
    - [102, 5.83]
  - - [256, 512, 1, 8192, 256, 256, 8192, 512]
    - [103, 7.632]
  - - [256, 1024, 1, 128, 256, 256, 128, 1024]
    - [26, 1.198]
  - - [256, 1024, 1, 256, 256, 256, 256, 1024]
    - [27, 1.952]
  - - [256, 1024, 1, 512, 256, 256, 512, 1024]
    - [27, 3.091]
  - - [256, 1024, 1, 1024, 256, 256, 1024, 1024]
    - [28, 4.412]
  - - [256, 1024, 1, 2048, 256, 256, 2048, 1024]
    - [23, 6.358]
  - - [256, 1024, 1, 4096, 256, 256, 4096, 1024]
    - [96, 8.514]
  - - [256, 1024, 1, 8192, 256, 256, 8192, 1024]
    - [13, 9.676]
  - - [256, 2048, 1, 128, 256, 256, 128, 2048]
    - [22, 2.152]
  - - [256, 2048, 1, 256, 256, 256, 256, 2048]
    - [20, 3.487]
  - - [256, 2048, 1, 512, 256, 256, 512, 2048]
    - [20, 5.347]
  - - [256, 2048, 1, 1024, 256, 256, 1024, 2048]
    - [102, 7.485]
  - - [256, 2048, 1, 2048, 256, 256, 2048, 2048]
    - [97, 9.578]
  - - [256, 2048, 1, 4096, 256, 256, 4096, 2048]
    - [86, 11.279]
  - - [256, 2048, 1, 8192, 256, 256, 8192, 2048]
    - [88, 12.13]
  - - [256, 4096, 1, 128, 256, 256, 128, 4096]
    - [96, 3.595]
  - - [256, 4096, 1, 256, 256, 256, 256, 4096]
    - [18, 6.051]
  - - [256, 4096, 1, 512, 256, 256, 512, 4096]
    - [99, 8.887]
  - - [256, 4096, 1, 1024, 256, 256, 1024, 4096]
    - [96, 11.922]
  - - [256, 4096, 1, 2048, 256, 256, 2048, 4096]
    - [96, 13.076]
  - - [256, 4096, 1, 4096, 256, 256, 4096, 4096]
    - [92, 13.6]
  - - [256, 4096, 1, 8192, 256, 256, 8192, 4096]
    - [75, 14.979]
  - - [256, 8192, 1, 128, 256, 256, 128, 8192]
    - [12, 5.65]
  - - [256, 8192, 1, 256, 256, 256, 256, 8192]
    - [11, 8.867]
  - - [256, 8192, 1, 512, 256, 256, 512, 8192]
    - [79, 12.977]
  - - [256, 8192, 1, 1024, 256, 256, 1024, 8192]
    - [85, 14.48]
  - - [256, 8192, 1, 2048, 256, 256, 2048, 8192]
    - [87, 15.238]
  - - [256, 8192, 1, 4096, 256, 256, 4096, 8192]
    - [78, 16.433]
  - - [256, 8192, 1, 8192, 256, 256, 8192, 8192]
    - [8, 17.295]
  - - [512, 128, 1, 128, 512, 512, 128, 128]
    - [28, 0.329]
  - - [512, 128, 1, 256, 512, 512, 256, 128]
    - [27, 0.414]
  - - [512, 128, 1, 512, 512, 512, 512, 128]
    - [67, 0.68]
  - - [512, 128, 1, 1024, 512, 512, 1024, 128]
    - [67, 1.236]
  - - [512, 128, 1, 2048, 512, 512, 2048, 128]
    - [108, 2.205]
  - - [512, 128, 1, 4096, 512, 512, 4096, 128]
    - [107, 3.445]
  - - [512, 128, 1, 8192, 512, 512, 8192, 128]
    - [102, 4.985]
  - - [512, 256, 1, 128, 512, 512, 128, 256]
    - [28, 0.643]
  - - [512, 256, 1, 256, 512, 512, 256, 256]
    - [28, 0.804]
  - - [512, 256, 1, 512, 512, 512, 512, 256]
    - [28, 1.426]
  - - [512, 256, 1, 1024, 512, 512, 1024, 256]
    - [107, 2.429]
  - - [512, 256, 1, 2048, 512, 512, 2048, 256]
    - [106, 3.849]
  - - [512, 256, 1, 4096, 512, 512, 4096, 256]
    - [104, 5.991]
  - - [512, 256, 1, 8192, 512, 512, 8192, 256]
    - [103, 7.708]
  - - [512, 512, 1, 128, 512, 512, 128, 512]
    - [26, 1.178]
  - - [512, 512, 1, 256, 512, 512, 256, 512]
    - [27, 1.936]
  - - [512, 512, 1, 512, 512, 512, 512, 512]
    - [28, 3.064]
  - - [512, 512, 1, 1024, 512, 512, 1024, 512]
    - [28, 4.391]
  - - [512, 512, 1, 2048, 512, 512, 2048, 512]
    - [102, 6.483]
  - - [512, 512, 1, 4096, 512, 512, 4096, 512]
    - [18, 8.663]
  - - [512, 512, 1, 8192, 512, 512, 8192, 512]
    - [98, 9.585]
  - - [512, 1024, 1, 128, 512, 512, 128, 1024]
    - [22, 2.158]
  - - [512, 1024, 1, 256, 512, 512, 256, 1024]
    - [20, 3.471]
  - - [512, 1024, 1, 512, 512, 512, 512, 1024]
    - [20, 5.339]
  - - [512, 1024, 1, 1024, 512, 512, 1024, 1024]
    - [23, 7.562]
  - - [512, 1024, 1, 2048, 512, 512, 2048, 1024]
    - [96, 9.857]
  - - [512, 1024, 1, 4096, 512, 512, 4096, 1024]
    - [88, 10.877]
  - - [512, 1024, 1, 8192, 512, 512, 8192, 1024]
    - [88, 11.886]
  - - [512, 2048, 1, 128, 512, 512, 128, 2048]
    - [7, 3.613]
  - - [512, 2048, 1, 256, 512, 512, 256, 2048]
    - [18, 6.017]
  - - [512, 2048, 1, 512, 512, 512, 512, 2048]
    - [18, 8.969]
  - - [512, 2048, 1, 1024, 512, 512, 1024, 2048]
    - [96, 11.919]
  - - [512, 2048, 1, 2048, 512, 512, 2048, 2048]
    - [96, 13.529]
  - - [512, 2048, 1, 4096, 512, 512, 4096, 2048]
    - [84, 12.664]
  - - [512, 2048, 1, 8192, 512, 512, 8192, 2048]
    - [75, 14.523]
  - - [512, 4096, 1, 128, 512, 512, 128, 4096]
    - [12, 5.68]
  - - [512, 4096, 1, 256, 512, 512, 256, 4096]
    - [11, 8.905]
  - - [512, 4096, 1, 512, 512, 512, 512, 4096]
    - [85, 12.901]
  - - [512, 4096, 1, 1024, 512, 512, 1024, 4096]
    - [85, 15.759]
  - - [512, 4096, 1, 2048, 512, 512, 2048, 4096]
    - [86, 15.791]
  - - [512, 4096, 1, 4096, 512, 512, 4096, 4096]
    - [78, 15.973]
  - - [512, 4096, 1, 8192, 512, 512, 8192, 4096]
    - [69, 17.189]
  - - [512, 8192, 1, 128, 512, 512, 128, 8192]
    - [57, 7.823]
  - - [512, 8192, 1, 256, 512, 512, 256, 8192]
    - [57, 11.75]
  - - [512, 8192, 1, 512, 512, 512, 512, 8192]
    - [58, 15.066]
  - - [512, 8192, 1, 1024, 512, 512, 1024, 8192]
    - [56, 16.236]
  - - [512, 8192, 1, 2048, 512, 512, 2048, 8192]
    - [74, 18.208]
  - - [512, 8192, 1, 4096, 512, 512, 4096, 8192]
    - [70, 17.254]
  - - [512, 8192, 1, 8192, 512, 512, 8192, 8192]
    - [30, 20.15]
  - - [1024, 128, 1, 128, 1024, 1024, 128, 128]
    - [27, 0.64]
  - - [1024, 128, 1, 256, 1024, 1024, 256, 128]
    - [27, 0.796]
  - - [1024, 128, 1, 512, 1024, 1024, 512, 128]
    - [27, 1.436]
  - - [1024, 128, 1, 1024, 1024, 1024, 1024, 128]
    - [107, 2.451]
  - - [1024, 128, 1, 2048, 1024, 1024, 2048, 128]
    - [105, 3.815]
  - - [1024, 128, 1, 4096, 1024, 1024, 4096, 128]
    - [102, 6.075]
  - - [1024, 128, 1, 8192, 1024, 1024, 8192, 128]
    - [103, 7.859]
  - - [1024, 256, 1, 128, 1024, 1024, 128, 256]
    - [25, 1.195]
  - - [1024, 256, 1, 256, 1024, 1024, 256, 256]
    - [27, 1.958]
  - - [1024, 256, 1, 512, 1024, 1024, 512, 256]
    - [27, 3.101]
  - - [1024, 256, 1, 1024, 1024, 1024, 1024, 256]
    - [28, 4.393]
  - - [1024, 256, 1, 2048, 1024, 1024, 2048, 256]
    - [102, 6.546]
  - - [1024, 256, 1, 4096, 1024, 1024, 4096, 256]
    - [97, 8.649]
  - - [1024, 256, 1, 8192, 1024, 1024, 8192, 256]
    - [100, 9.938]
  - - [1024, 512, 1, 128, 1024, 1024, 128, 512]
    - [22, 2.174]
  - - [1024, 512, 1, 256, 1024, 1024, 256, 512]
    - [20, 3.503]
  - - [1024, 512, 1, 512, 1024, 1024, 512, 512]
    - [23, 5.366]
  - - [1024, 512, 1, 1024, 1024, 1024, 1024, 512]
    - [23, 7.523]
  - - [1024, 512, 1, 2048, 1024, 1024, 2048, 512]
    - [99, 10.03]
  - - [1024, 512, 1, 4096, 1024, 1024, 4096, 512]
    - [92, 11.178]
  - - [1024, 512, 1, 8192, 1024, 1024, 8192, 512]
    - [81, 11.461]
  - - [1024, 1024, 1, 128, 1024, 1024, 128, 1024]
    - [18, 3.625]
  - - [1024, 1024, 1, 256, 1024, 1024, 256, 1024]
    - [18, 6.069]
  - - [1024, 1024, 1, 512, 1024, 1024, 512, 1024]
    - [18, 8.986]
  - - [1024, 1024, 1, 1024, 1024, 1024, 1024, 1024]
    - [96, 11.728]
  - - [1024, 1024, 1, 2048, 1024, 1024, 2048, 1024]
    - [15, 13.181]
  - - [1024, 1024, 1, 4096, 1024, 1024, 4096, 1024]
    - [93, 12.664]
  - - [1024, 1024, 1, 8192, 1024, 1024, 8192, 1024]
    - [76, 15.041]
  - - [1024, 2048, 1, 128, 1024, 1024, 128, 2048]
    - [12, 5.632]
  - - [1024, 2048, 1, 256, 1024, 1024, 256, 2048]
    - [11, 8.916]
  - - [1024, 2048, 1, 512, 1024, 1024, 512, 2048]
    - [79, 12.884]
  - - [1024, 2048, 1, 1024, 1024, 1024, 1024, 2048]
    - [89, 14.891]
  - - [1024, 2048, 1, 2048, 1024, 1024, 2048, 2048]
    - [89, 15.475]
  - - [1024, 2048, 1, 4096, 1024, 1024, 4096, 2048]
    - [78, 16.263]
  - - [1024, 2048, 1, 8192, 1024, 1024, 8192, 2048]
    - [69, 16.941]
  - - [1024, 4096, 1, 128, 1024, 1024, 128, 4096]
    - [57, 7.822]
  - - [1024, 4096, 1, 256, 1024, 1024, 256, 4096]
    - [57, 11.733]
  - - [1024, 4096, 1, 512, 1024, 1024, 512, 4096]
    - [57, 15.368]
  - - [1024, 4096, 1, 1024, 1024, 1024, 1024, 4096]
    - [55, 15.823]
  - - [1024, 4096, 1, 2048, 1024, 1024, 2048, 4096]
    - [75, 18.431]
  - - [1024, 4096, 1, 4096, 1024, 1024, 4096, 4096]
    - [43, 17.215]
  - - [1024, 4096, 1, 8192, 1024, 1024, 8192, 4096]
    - [29, 19.895]
  - - [1024, 8192, 1, 128, 1024, 1024, 128, 8192]
    - [52, 9.667]
  - - [1024, 8192, 1, 256, 1024, 1024, 256, 8192]
    - [43, 13.254]
  - - [1024, 8192, 1, 512, 1024, 1024, 512, 8192]
    - [48, 16.285]
  - - [1024, 8192, 1, 1024, 1024, 1024, 1024, 8192]
    - [41, 20.078]
  - - [1024, 8192, 1, 2048, 1024, 1024, 2048, 8192]
    - [71, 20.362]
  - - [1024, 8192, 1, 4096, 1024, 1024, 4096, 8192]
    - [30, 19.77]
  - - [1024, 8192, 1, 8192, 1024, 1024, 8192, 8192]
    - [30, 22.874]
  - - [2048, 128, 1, 128, 2048, 2048, 128, 128]
    - [26, 1.206]
  - - [2048, 128, 1, 256, 2048, 2048, 256, 128]
    - [28, 1.948]
  - - [2048, 128, 1, 512, 2048, 2048, 512, 128]
    - [27, 3.124]
  - - [2048, 128, 1, 1024, 2048, 2048, 1024, 128]
    - [108, 4.362]
  - - [2048, 128, 1, 2048, 2048, 2048, 2048, 128]
    - [102, 6.519]
  - - [2048, 128, 1, 4096, 2048, 2048, 4096, 128]
    - [103, 8.469]
  - - [2048, 128, 1, 8192, 2048, 2048, 8192, 128]
    - [94, 9.662]
  - - [2048, 256, 1, 128, 2048, 2048, 128, 256]
    - [22, 2.187]
  - - [2048, 256, 1, 256, 2048, 2048, 256, 256]
    - [20, 3.52]
  - - [2048, 256, 1, 512, 2048, 2048, 512, 256]
    - [23, 5.327]
  - - [2048, 256, 1, 1024, 2048, 2048, 1024, 256]
    - [24, 7.459]
  - - [2048, 256, 1, 2048, 2048, 2048, 2048, 256]
    - [99, 9.981]
  - - [2048, 256, 1, 4096, 2048, 2048, 4096, 256]
    - [81, 10.604]
  - - [2048, 256, 1, 8192, 2048, 2048, 8192, 256]
    - [66, 11.842]
  - - [2048, 512, 1, 128, 2048, 2048, 128, 512]
    - [7, 3.605]
  - - [2048, 512, 1, 256, 2048, 2048, 256, 512]
    - [18, 6.055]
  - - [2048, 512, 1, 512, 2048, 2048, 512, 512]
    - [18, 8.924]
  - - [2048, 512, 1, 1024, 2048, 2048, 1024, 512]
    - [99, 11.872]
  - - [2048, 512, 1, 2048, 2048, 2048, 2048, 512]
    - [99, 13.487]
  - - [2048, 512, 1, 4096, 2048, 2048, 4096, 512]
    - [92, 12.91]
  - - [2048, 512, 1, 8192, 2048, 2048, 8192, 512]
    - [76, 14.766]
  - - [2048, 1024, 1, 128, 2048, 2048, 128, 1024]
    - [12, 5.637]
  - - [2048, 1024, 1, 256, 2048, 2048, 256, 1024]
    - [12, 8.946]
  - - [2048, 1024, 1, 512, 2048, 2048, 512, 1024]
    - [16, 12.793]
  - - [2048, 1024, 1, 1024, 2048, 2048, 1024, 1024]
    - [82, 14.99]
  - - [2048, 1024, 1, 2048, 2048, 2048, 2048, 1024]
    - [82, 15.295]
  - - [2048, 1024, 1, 4096, 2048, 2048, 4096, 1024]
    - [78, 16.339]
  - - [2048, 1024, 1, 8192, 2048, 2048, 8192, 1024]
    - [78, 16.776]
  - - [2048, 2048, 1, 128, 2048, 2048, 128, 2048]
    - [6, 7.759]
  - - [2048, 2048, 1, 256, 2048, 2048, 256, 2048]
    - [57, 11.369]
  - - [2048, 2048, 1, 512, 2048, 2048, 512, 2048]
    - [61, 14.538]
  - - [2048, 2048, 1, 1024, 2048, 2048, 1024, 2048]
    - [64, 15.97]
  - - [2048, 2048, 1, 2048, 2048, 2048, 2048, 2048]
    - [76, 17.823]
  - - [2048, 2048, 1, 4096, 2048, 2048, 4096, 2048]
    - [68, 17.126]
  - - [2048, 2048, 1, 8192, 2048, 2048, 8192, 2048]
    - [33, 19.488]
  - - [2048, 4096, 1, 128, 2048, 2048, 128, 4096]
    - [54, 9.72]
  - - [2048, 4096, 1, 256, 2048, 2048, 256, 4096]
    - [42, 13.554]
  - - [2048, 4096, 1, 512, 2048, 2048, 512, 4096]
    - [3, 15.82]
  - - [2048, 4096, 1, 1024, 2048, 2048, 1024, 4096]
    - [48, 19.849]
  - - [2048, 4096, 1, 2048, 2048, 2048, 2048, 4096]
    - [71, 20.368]
  - - [2048, 4096, 1, 4096, 2048, 2048, 4096, 4096]
    - [35, 20.204]
  - - [2048, 4096, 1, 8192, 2048, 2048, 8192, 4096]
    - [29, 22.906]
  - - [2048, 8192, 1, 128, 2048, 2048, 128, 8192]
    - [31, 9.473]
  - - [2048, 8192, 1, 256, 2048, 2048, 256, 8192]
    - [31, 13.82]
  - - [2048, 8192, 1, 512, 2048, 2048, 512, 8192]
    - [31, 17.876]
  - - [2048, 8192, 1, 1024, 2048, 2048, 1024, 8192]
    - [38, 20.526]
  - - [2048, 8192, 1, 2048, 2048, 2048, 2048, 8192]
    - [43, 19.775]
  - - [2048, 8192, 1, 4096, 2048, 2048, 4096, 8192]
    - [30, 23.458]
  - - [2048, 8192, 1, 8192, 2048, 2048, 8192, 8192]
    - [29, 24.243]
  - - [4096, 128, 1, 128, 4096, 4096, 128, 128]
    - [22, 2.211]
  - - [4096, 128, 1, 256, 4096, 4096, 256, 128]
    - [21, 3.506]
  - - [4096, 128, 1, 512, 4096, 4096, 512, 128]
    - [20, 5.337]
  - - [4096, 128, 1, 1024, 4096, 4096, 1024, 128]
    - [102, 7.506]
  - - [4096, 128, 1, 2048, 4096, 4096, 2048, 128]
    - [99, 9.837]
  - - [4096, 128, 1, 4096, 4096, 4096, 4096, 128]
    - [80, 10.483]
  - - [4096, 128, 1, 8192, 4096, 4096, 8192, 128]
    - [11, 12.724]
  - - [4096, 256, 1, 128, 4096, 4096, 128, 256]
    - [7, 3.642]
  - - [4096, 256, 1, 256, 4096, 4096, 256, 256]
    - [19, 5.99]
  - - [4096, 256, 1, 512, 4096, 4096, 512, 256]
    - [96, 8.942]
  - - [4096, 256, 1, 1024, 4096, 4096, 1024, 256]
    - [97, 11.91]
  - - [4096, 256, 1, 2048, 4096, 4096, 2048, 256]
    - [99, 13.325]
  - - [4096, 256, 1, 4096, 4096, 4096, 4096, 256]
    - [10, 13.229]
  - - [4096, 256, 1, 8192, 4096, 4096, 8192, 256]
    - [75, 14.893]
  - - [4096, 512, 1, 128, 4096, 4096, 128, 512]
    - [13, 5.697]
  - - [4096, 512, 1, 256, 4096, 4096, 256, 512]
    - [12, 9.08]
  - - [4096, 512, 1, 512, 4096, 4096, 512, 512]
    - [91, 12.799]
  - - [4096, 512, 1, 1024, 4096, 4096, 1024, 512]
    - [81, 15.408]
  - - [4096, 512, 1, 2048, 4096, 4096, 2048, 512]
    - [92, 15.563]
  - - [4096, 512, 1, 4096, 4096, 4096, 4096, 512]
    - [76, 15.836]
  - - [4096, 512, 1, 8192, 4096, 4096, 8192, 512]
    - [43, 16.935]
  - - [4096, 1024, 1, 128, 4096, 4096, 128, 1024]
    - [59, 7.675]
  - - [4096, 1024, 1, 256, 4096, 4096, 256, 1024]
    - [64, 11.414]
  - - [4096, 1024, 1, 512, 4096, 4096, 512, 1024]
    - [65, 14.924]
  - - [4096, 1024, 1, 1024, 4096, 4096, 1024, 1024]
    - [62, 16.429]
  - - [4096, 1024, 1, 2048, 4096, 4096, 2048, 1024]
    - [76, 17.638]
  - - [4096, 1024, 1, 4096, 4096, 4096, 4096, 1024]
    - [48, 16.893]
  - - [4096, 1024, 1, 8192, 4096, 4096, 8192, 1024]
    - [33, 19.62]
  - - [4096, 2048, 1, 128, 4096, 4096, 128, 2048]
    - [54, 9.793]
  - - [4096, 2048, 1, 256, 4096, 4096, 256, 2048]
    - [47, 13.304]
  - - [4096, 2048, 1, 512, 4096, 4096, 512, 2048]
    - [51, 15.947]
  - - [4096, 2048, 1, 1024, 4096, 4096, 1024, 2048]
    - [49, 19.476]
  - - [4096, 2048, 1, 2048, 4096, 4096, 2048, 2048]
    - [72, 20.268]
  - - [4096, 2048, 1, 4096, 4096, 4096, 4096, 2048]
    - [35, 19.946]
  - - [4096, 2048, 1, 8192, 4096, 4096, 8192, 2048]
    - [35, 22.432]
  - - [4096, 4096, 1, 128, 4096, 4096, 128, 4096]
    - [31, 9.477]
  - - [4096, 4096, 1, 256, 4096, 4096, 256, 4096]
    - [2, 13.745]
  - - [4096, 4096, 1, 512, 4096, 4096, 512, 4096]
    - [38, 17.767]
  - - [4096, 4096, 1, 1024, 4096, 4096, 1024, 4096]
    - [34, 20.353]
  - - [4096, 4096, 1, 2048, 4096, 4096, 2048, 4096]
    - [40, 20.22]
  - - [4096, 4096, 1, 4096, 4096, 4096, 4096, 4096]
    - [29, 23.121]
  - - [4096, 4096, 1, 8192, 4096, 4096, 8192, 4096]
    - [29, 24.486]
  - - [4096, 8192, 1, 128, 4096, 4096, 128, 8192]
    - [39, 8.933]
  - - [4096, 8192, 1, 256, 4096, 4096, 256, 8192]
    - [59, 11.861]
  - - [4096, 8192, 1, 512, 4096, 4096, 512, 8192]
    - [43, 15.078]
  - - [4096, 8192, 1, 1024, 4096, 4096, 1024, 8192]
    - [50, 19.438]
  - - [4096, 8192, 1, 2048, 4096, 4096, 2048, 8192]
    - [43, 22.879]
  - - [4096, 8192, 1, 4096, 4096, 4096, 4096, 8192]
    - [43, 24.24]
  - - [4096, 8192, 1, 8192, 4096, 4096, 8192, 8192]
    - [1, 25.761]
  - - [8192, 128, 1, 128, 8192, 8192, 128, 128]
    - [7, 3.621]
  - - [8192, 128, 1, 256, 8192, 8192, 256, 128]
    - [96, 6.092]
  - - [8192, 128, 1, 512, 8192, 8192, 512, 128]
    - [18, 8.996]
  - - [8192, 128, 1, 1024, 8192, 8192, 1024, 128]
    - [97, 11.426]
  - - [8192, 128, 1, 2048, 8192, 8192, 2048, 128]
    - [99, 12.553]
  - - [8192, 128, 1, 4096, 8192, 8192, 4096, 128]
    - [79, 13.583]
  - - [8192, 128, 1, 8192, 8192, 8192, 8192, 128]
    - [9, 15.485]
  - - [8192, 256, 1, 128, 8192, 8192, 128, 256]
    - [11, 5.68]
  - - [8192, 256, 1, 256, 8192, 8192, 256, 256]
    - [89, 8.924]
  - - [8192, 256, 1, 512, 8192, 8192, 512, 256]
    - [91, 12.828]
  - - [8192, 256, 1, 1024, 8192, 8192, 1024, 256]
    - [81, 15.05]
  - - [8192, 256, 1, 2048, 8192, 8192, 2048, 256]
    - [83, 14.93]
  - - [8192, 256, 1, 4096, 8192, 8192, 4096, 256]
    - [75, 16.103]
  - - [8192, 256, 1, 8192, 8192, 8192, 8192, 256]
    - [5, 17.241]
  - - [8192, 512, 1, 128, 8192, 8192, 128, 512]
    - [64, 7.645]
  - - [8192, 512, 1, 256, 8192, 8192, 256, 512]
    - [59, 11.469]
  - - [8192, 512, 1, 512, 8192, 8192, 512, 512]
    - [63, 15.177]
  - - [8192, 512, 1, 1024, 8192, 8192, 1024, 512]
    - [60, 16.62]
  - - [8192, 512, 1, 2048, 8192, 8192, 2048, 512]
    - [77, 17.776]
  - - [8192, 512, 1, 4096, 8192, 8192, 4096, 512]
    - [4, 17.765]
  - - [8192, 512, 1, 8192, 8192, 8192, 8192, 512]
    - [5, 19.729]
  - - [8192, 1024, 1, 128, 8192, 8192, 128, 1024]
    - [54, 9.727]
  - - [8192, 1024, 1, 256, 8192, 8192, 256, 1024]
    - [45, 13.728]
  - - [8192, 1024, 1, 512, 8192, 8192, 512, 1024]
    - [44, 15.997]
  - - [8192, 1024, 1, 1024, 8192, 8192, 1024, 1024]
    - [48, 19.688]
  - - [8192, 1024, 1, 2048, 8192, 8192, 2048, 1024]
    - [73, 20.231]
  - - [8192, 1024, 1, 4096, 8192, 8192, 4096, 1024]
    - [37, 19.464]
  - - [8192, 1024, 1, 8192, 8192, 8192, 8192, 1024]
    - [32, 22.206]
  - - [8192, 2048, 1, 128, 8192, 8192, 128, 2048]
    - [0, 9.434]
  - - [8192, 2048, 1, 256, 8192, 8192, 256, 2048]
    - [38, 13.356]
  - - [8192, 2048, 1, 512, 8192, 8192, 512, 2048]
    - [38, 17.952]
  - - [8192, 2048, 1, 1024, 8192, 8192, 1024, 2048]
    - [36, 20.39]
  - - [8192, 2048, 1, 2048, 8192, 8192, 2048, 2048]
    - [37, 19.596]
  - - [8192, 2048, 1, 4096, 8192, 8192, 4096, 2048]
    - [35, 21.861]
  - - [8192, 2048, 1, 8192, 8192, 8192, 8192, 2048]
    - [32, 23.575]
  - - [8192, 4096, 1, 128, 8192, 8192, 128, 4096]
    - [50, 8.909]
  - - [8192, 4096, 1, 256, 8192, 8192, 256, 4096]
    - [46, 12.675]
  - - [8192, 4096, 1, 512, 8192, 8192, 512, 4096]
    - [47, 15.532]
  - - [8192, 4096, 1, 1024, 8192, 8192, 1024, 4096]
    - [43, 19.515]
  - - [8192, 4096, 1, 2048, 8192, 8192, 2048, 4096]
    - [30, 22.804]
  - - [8192, 4096, 1, 4096, 8192, 8192, 4096, 4096]
    - [29, 24.365]
  - - [8192, 4096, 1, 8192, 8192, 8192, 8192, 4096]
    - [29, 25.439]
  - - [8192, 8192, 1, 128, 8192, 8192, 128, 8192]
    - [53, 8.036]
  - - [8192, 8192, 1, 256, 8192, 8192, 256, 8192]
    - [50, 12.183]
  - - [8192, 8192, 1, 512, 8192, 8192, 512, 8192]
    - [47, 16.214]
  - - [8192, 8192, 1, 1024, 8192, 8192, 1024, 8192]
    - [37, 20.935]
  - - [8192, 8192, 1, 2048, 8192, 8192, 2048, 8192]
    - [35, 24.411]
  - - [8192, 8192, 1, 4096, 8192, 8192, 4096, 8192]
    - [35, 26.384]
  - - [8192, 8192, 1, 8192, 8192, 8192, 8192, 8192]
    - [37, 25.986]
  - - [1, 1, 1, 32, 1, 1, 32, 1]
    - [109, 0.0]
- null
- null
- DeviceEfficiency
- GridBased
