library/src/amd_detail/rocblaslt/src/Tensile/Logic/streamk/gfx942a/aquavanjaram942_Cijk_Ailk_Bljk_BSS_BH_UserArgs.yaml
- {MinimumRequiredVersion: 4.33.0}
- aquavanjaram942
- gfx942
- [Device 0049, Device 0050]
    SolutionIndex: 0
    SolutionNameMin: Cijk_Ailk_Bljk_BSS_BH_UserArgs_MT256x256x32_MI16x16x1_SN_LDSB1_CLR1_GSU0_GSUC0_GSUWGMRR0_K1_LBSPPA2048_LBSPPB128_LPA0_MIWT8_8_PLR1_SU32_SUM0_SUS256_SKXCCM0_VWA4_VWB2_WGM1_WGMXCC1_WGMXCCGn1
    SolutionIndex: 1
    SolutionNameMin: Cijk_Ailk_Bljk_BSS_BH_UserArgs_MT256x256x32_MI16x16x1_SN_LDSB1_CLR1_GSU0_GSUC0_GSUWGMRR0_K1_LBSPPA2048_LBSPPB256_LPA0_MIWT8_8_PLR1_SU32_SUM0_SUS256_SKXCCM0_VWA4_VWB4_WGM1_WGMXCC1_WGMXCCGn1
    SolutionIndex: 2
    SolutionNameMin: Cijk_Ailk_Bljk_BSS_BH_UserArgs_MT256x256x32_MI16x16x1_SN_LDSB1_CLR1_GSU0_GSUC0_GSUWGMRR0_K1_LBSPPA2048_LBSPPB128_LPA0_MIWT8_8_PLR1_SU32_SUM0_SUS256_SKXCCM0_VWA4_VWB1_WGM4_WGMXCC1_WGMXCCGn1
    SolutionIndex: 3
    SolutionNameMin: Cijk_Ailk_Bljk_BSS_BH_UserArgs_MT256x256x32_MI16x16x1_SN_LDSB1_CLR1_GSU0_GSUC0_GSUWGMRR0_K1_LBSPPA2048_LBSPPB128_LPA0_MIWT8_8_PLR1_SU32_SUM0_SUS256_SKXCCM0_VWA4_VWB2_WGM4_WGMXCC1_WGMXCCGn1
    SolutionIndex: 4
    SolutionNameMin: Cijk_Ailk_Bljk_BSS_BH_UserArgs_MT256x128x32_MI16x16x1_SN_LDSB1_CLR1_GSU0_GSUC0_GSUWGMRR0_K1_LBSPPA2048_LBSPPB128_LPA0_MIWT8_4_PLR1_SU32_SUM0_SUS256_SKXCCM0_VWA4_VWB1_WGM1_WGMXCC1_WGMXCCGn1
    SolutionIndex: 5
    SolutionNameMin: Cijk_Ailk_Bljk_BSS_BH_UserArgs_MT256x128x32_MI16x16x1_SN_LDSB1_CLR1_GSU0_GSUC0_GSUWGMRR0_K1_LBSPPA2048_LBSPPB128_LPA0_MIWT8_4_PLR1_SU32_SUM0_SUS256_SKXCCM0_VWA4_VWB2_WGM1_WGMXCC1_WGMXCCGn1
    SolutionIndex: 6
    SolutionNameMin: Cijk_Ailk_Bljk_BSS_BH_UserArgs_MT256x128x32_MI16x16x1_SN_LDSB1_CLR1_GSU0_GSUC0_GSUWGMRR0_K1_LBSPPA2048_LBSPPB256_LPA0_MIWT8_4_PLR1_SU32_SUM0_SUS256_SKXCCM0_VWA4_VWB4_WGM1_WGMXCC1_WGMXCCGn1
    SolutionIndex: 7
    SolutionNameMin: Cijk_Ailk_Bljk_BSS_BH_UserArgs_MT256x64x32_MI16x16x1_SN_LDSB1_CLR1_GSU0_GSUC0_GSUWGMRR0_K1_LBSPPA2048_LBSPPB128_LPA0_MIWT8_2_PLR1_SU32_SUM0_SUS256_SKXCCM0_VWA4_VWB1_WGM1_WGMXCC1_WGMXCCGn1
    SolutionIndex: 8
    SolutionNameMin: Cijk_Ailk_Bljk_BSS_BH_UserArgs_MT256x64x32_MI16x16x1_SN_LDSB1_CLR1_GSU0_GSUC0_GSUWGMRR0_K1_LBSPPA2048_LBSPPB128_LPA0_MIWT8_2_PLR1_SU32_SUM0_SUS256_SKXCCM0_VWA4_VWB1_WGM4_WGMXCC1_WGMXCCGn1
    SolutionIndex: 9
    SolutionNameMin: Cijk_Ailk_Bljk_BSS_BH_UserArgs_MT128x64x32_MI16x16x1_SN_LDSB0_CLR1_GSU0_GSUC0_GSUWGMRR0_K1_LBSPPA1024_LBSPPB128_LPA0_MIWT4_2_PLR1_SU32_SUM0_SUS256_SKXCCM0_VWA4_VWB1_WGM1_WGMXCC1_WGMXCCGn1
    SolutionIndex: 10
    SolutionNameMin: Cijk_Ailk_Bljk_BSS_BH_UserArgs_MT128x64x32_MI16x16x1_SN_LDSB0_CLR1_GSU0_GSUC0_GSUWGMRR0_K1_LBSPPA1024_LBSPPB128_LPA0_MIWT4_2_PLR1_SU32_SUM0_SUS256_SKXCCM0_VWA4_VWB2_WGM1_WGMXCC1_WGMXCCGn1
    SolutionIndex: 11
    SolutionNameMin: Cijk_Ailk_Bljk_BSS_BH_UserArgs_MT128x256x64_MI16x16x1_SN_LDSB1_CLR1_GSU0_GSUC0_GSUWGMRR0_K1_LBSPPA2048_LBSPPB128_LPA0_MIWT4_8_PLR1_SU32_SUM0_SUS256_SKXCCM0_VWA4_VWB1_WGM4_WGMXCC1_WGMXCCGn1
    SolutionIndex: 12
    SolutionNameMin: Cijk_Ailk_Bljk_BSS_BH_UserArgs_MT256x128x64_MI16x16x1_SN_LDSB1_CLR1_GSU0_GSUC0_GSUWGMRR0_K1_LBSPPA4096_LBSPPB512_LPA0_MIWT8_4_PLR1_SU32_SUM0_SUS256_SKXCCM0_VWA4_VWB4_WGM4_WGMXCC1_WGMXCCGn1
    SolutionIndex: 13
    SolutionNameMin: Cijk_Ailk_Bljk_BSS_BH_UserArgs_MT128x128x64_MI16x16x1_SN_LDSB1_CLR1_GSU0_GSUC0_GSUWGMRR0_K1_LBSPPA2048_LBSPPB256_LPA0_MIWT4_4_PLR1_SU32_SUM0_SUS256_SKXCCM0_VWA4_VWB2_WGM1_WGMXCC1_WGMXCCGn1
    SolutionIndex: 14
    SolutionNameMin: Cijk_Ailk_Bljk_BSS_BH_UserArgs_MT64x128x64_MI16x16x1_SN_LDSB1_CLR1_GSU0_GSUC0_GSUWGMRR0_K1_LBSPPA1024_LBSPPB128_LPA32_MIWT2_4_PLR1_SU32_SUM0_SUS256_SKXCCM0_VWA2_VWB1_WGM1_WGMXCC1_WGMXCCGn1
    SolutionIndex: 15
    SolutionNameMin: Cijk_Ailk_Bljk_BSS_BH_UserArgs_MT128x64x64_MI16x16x1_SN_LDSB1_CLR1_GSU0_GSUC0_GSUWGMRR0_K1_LBSPPA2048_LBSPPB128_LPA0_MIWT4_2_PLR1_SU32_SUM0_SUS256_SKXCCM0_VWA4_VWB1_WGM1_WGMXCC1_WGMXCCGn1
    SolutionIndex: 16
    SolutionNameMin: Cijk_Ailk_Bljk_BSS_BH_UserArgs_MT128x64x64_MI16x16x1_SN_LDSB1_CLR1_GSU0_GSUC0_GSUWGMRR0_K1_LBSPPA2048_LBSPPB256_LPA0_MIWT4_2_PLR1_SU32_SUM0_SUS256_SKXCCM0_VWA4_VWB2_WGM1_WGMXCC1_WGMXCCGn1
    SolutionIndex: 17
    SolutionNameMin: Cijk_Ailk_Bljk_BSS_BH_UserArgs_MT128x64x64_MI16x16x1_SN_LDSB1_CLR1_GSU0_GSUC0_GSUWGMRR0_K1_LBSPPA2048_LBSPPB128_LPA0_MIWT4_2_PLR2_SU32_SUM0_SUS256_SKXCCM0_VWA4_VWB1_WGM1_WGMXCC1_WGMXCCGn1
    SolutionIndex: 18
    SolutionNameMin: Cijk_Ailk_Bljk_BSS_BH_UserArgs_MT128x64x64_MI16x16x1_SN_LDSB1_CLR1_GSU0_GSUC0_GSUWGMRR0_K1_LBSPPA2048_LBSPPB128_LPA0_MIWT4_2_PLR1_SU32_SUM0_SUS256_SKXCCM0_VWA4_VWB1_WGM4_WGMXCC1_WGMXCCGn1
    SolutionIndex: 19
    SolutionNameMin: Cijk_Ailk_Bljk_BSS_BH_UserArgs_MT128x64x64_MI16x16x1_SN_LDSB1_CLR1_GSU0_GSUC0_GSUWGMRR0_K1_LBSPPA2048_LBSPPB256_LPA0_MIWT4_2_PLR1_SU32_SUM0_SUS256_SKXCCM0_VWA4_VWB2_WGM4_WGMXCC1_WGMXCCGn1
    SolutionIndex: 20
    SolutionNameMin: Cijk_Ailk_Bljk_BSS_BH_UserArgs_MT128x64x64_MI16x16x1_SN_LDSB1_CLR1_GSU0_GSUC0_GSUWGMRR0_K1_LBSPPA2048_LBSPPB256_LPA0_MIWT4_2_PLR1_SU32_SUM0_SUS256_SKXCCM0_VWA4_VWB2_WGM8_WGMXCC1_WGMXCCGn1
    SolutionIndex: 21
    SolutionNameMin: Cijk_Ailk_Bljk_BSS_BH_UserArgs_MT64x64x64_MI16x16x1_SN_LDSB1_CLR1_GSU0_GSUC0_GSUWGMRR0_K1_LBSPPA1024_LBSPPB128_LPA16_MIWT2_2_PLR1_SU32_SUM0_SUS256_SKXCCM0_VWA1_VWB1_WGM1_WGMXCC1_WGMXCCGn1
    SolutionIndex: 22
    SolutionNameMin: Cijk_Ailk_Bljk_BSS_BH_UserArgs_MT64x64x64_MI16x16x1_SN_LDSB1_CLR1_GSU0_GSUC0_GSUWGMRR0_K1_LBSPPA1024_LBSPPB128_LPA32_MIWT2_2_PLR1_SU32_SUM0_SUS256_SKXCCM0_VWA2_VWB1_WGM1_WGMXCC1_WGMXCCGn1
    SolutionIndex: 23
    SolutionNameMin: Cijk_Ailk_Bljk_BSS_BH_UserArgs_MT64x64x64_MI16x16x1_SN_LDSB1_CLR1_GSU0_GSUC0_GSUWGMRR0_K1_LBSPPA1024_LBSPPB256_LPA16_MIWT2_2_PLR1_SU32_SUM0_SUS256_SKXCCM0_VWA1_VWB2_WGM1_WGMXCC1_WGMXCCGn1
    SolutionIndex: 24
    SolutionNameMin: Cijk_Ailk_Bljk_BSS_BH_UserArgs_MT64x64x64_MI16x16x1_SN_LDSB1_CLR1_GSU0_GSUC0_GSUWGMRR0_K1_LBSPPA1024_LBSPPB256_LPA32_MIWT2_2_PLR1_SU32_SUM0_SUS256_SKXCCM0_VWA2_VWB2_WGM1_WGMXCC1_WGMXCCGn1
    SolutionIndex: 25
    SolutionNameMin: Cijk_Ailk_Bljk_BSS_BH_UserArgs_MT64x64x64_MI16x16x1_SN_LDSB1_CLR1_GSU0_GSUC0_GSUWGMRR0_K1_LBSPPA1024_LBSPPB256_LPA32_MIWT2_2_PLR1_SU32_SUM0_SUS256_SKXCCM0_VWA2_VWB2_WGM8_WGMXCC1_WGMXCCGn1
    SolutionIndex: 26
    SolutionNameMin: Cijk_Ailk_Bljk_BSS_BH_UserArgs_MT64x32x64_MI16x16x1_SN_LDSB0_CLR1_GSU0_GSUC0_GSUWGMRR0_K1_LBSPPA1024_LBSPPB128_LPA32_MIWT2_1_PLR1_SU32_SUM0_SUS256_SKXCCM0_VWA2_VWB1_WGM1_WGMXCC1_WGMXCCGn1
    SolutionIndex: 27
    SolutionNameMin: Cijk_Ailk_Bljk_BSS_BH_UserArgs_MT32x32x64_MI16x16x1_SN_LDSB0_CLR1_GSU0_GSUC0_GSUWGMRR0_K1_LBSPPA512_LBSPPB128_LPA16_MIWT1_1_PLR1_SU32_SUM0_SUS256_SKXCCM0_VWA1_VWB1_WGM1_WGMXCC1_WGMXCCGn1
    SolutionIndex: 28
    SolutionNameMin: Cijk_Ailk_Bljk_BSS_BH_UserArgs_MT64x64x128_MI16x16x1_SN_LDSB1_CLR1_GSU0_GSUC0_GSUWGMRR0_K1_LBSPPA1024_LBSPPB256_LPA32_MIWT2_2_PLR2_SU32_SUM0_SUS256_SKXCCM0_VWA2_VWB1_WGM1_WGMXCC1_WGMXCCGn1
    SolutionIndex: 29
    SolutionNameMin: Cijk_Ailk_Bljk_BSS_BH_UserArgs_MT64x64x128_MI16x16x1_SN_LDSB1_CLR1_GSU0_GSUC0_GSUWGMRR0_K1_LBSPPA1024_LBSPPB512_LPA32_MIWT2_2_PLR2_SU32_SUM0_SUS256_SKXCCM0_VWA2_VWB2_WGM1_WGMXCC1_WGMXCCGn1
    SolutionIndex: 30
    SolutionNameMin: Cijk_Ailk_Bljk_BSS_BH_UserArgs_MT32x64x128_MI16x16x1_SN_LDSB1_CLR1_GSU0_GSUC0_GSUWGMRR0_K1_LBSPPA512_LBSPPB256_LPA16_MIWT1_2_PLR2_SU32_SUM0_SUS256_SKXCCM0_VWA1_VWB1_WGM1_WGMXCC1_WGMXCCGn1
    SolutionIndex: 31
    SolutionNameMin: Cijk_Ailk_Bljk_BSS_BH_UserArgs_MT32x64x128_MI16x16x1_SN_LDSB1_CLR1_GSU0_GSUC0_GSUWGMRR0_K1_LBSPPA512_LBSPPB512_LPA16_MIWT1_2_PLR2_SU32_SUM0_SUS256_SKXCCM0_VWA1_VWB2_WGM1_WGMXCC1_WGMXCCGn1
    SolutionIndex: 32
    SolutionNameMin: Cijk_Ailk_Bljk_BSS_BH_UserArgs_MT64x32x128_MI16x16x1_SN_LDSB1_CLR1_GSU0_GSUC0_GSUWGMRR0_K1_LBSPPA1024_LBSPPB256_LPA32_MIWT2_1_PLR1_SU32_SUM0_SUS256_SKXCCM0_VWA2_VWB1_WGM1_WGMXCC1_WGMXCCGn1
    SolutionIndex: 33
    SolutionNameMin: Cijk_Ailk_Bljk_BSS_BH_UserArgs_MT64x32x128_MI16x16x1_SN_LDSB1_CLR1_GSU0_GSUC0_GSUWGMRR0_K1_LBSPPA1024_LBSPPB256_LPA32_MIWT2_1_PLR2_SU32_SUM0_SUS256_SKXCCM0_VWA2_VWB1_WGM1_WGMXCC1_WGMXCCGn1
    SolutionIndex: 34
    SolutionNameMin: Cijk_Ailk_Bljk_BSS_BH_UserArgs_MT32x32x128_MI16x16x1_SN_LDSB1_CLR1_GSU0_GSUC0_GSUWGMRR0_K1_LBSPPA512_LBSPPB256_LPA16_MIWT1_1_PLR1_SU32_SUM0_SUS256_SKXCCM0_VWA1_VWB1_WGM1_WGMXCC1_WGMXCCGn1
    SolutionIndex: 35
    SolutionNameMin: Cijk_Ailk_Bljk_BSS_BH_UserArgs_MT32x32x128_MI16x16x1_SN_LDSB1_CLR1_GSU0_GSUC0_GSUWGMRR0_K1_LBSPPA512_LBSPPB256_LPA16_MIWT1_1_PLR2_SU32_SUM0_SUS256_SKXCCM0_VWA1_VWB1_WGM1_WGMXCC1_WGMXCCGn1
    SolutionIndex: 36
    SolutionNameMin: Cijk_Ailk_Bljk_BSS_BH_UserArgs_MT256x256x32_MI16x16x1_SN_LDSB1_CLR1_GSU0_GSUC0_GSUWGMRR0_K1_LBSPPA2048_LBSPPB128_LPA32_MIWT8_8_PLR1_SU32_SUM0_SUS256_SKXCCM6_VWA2_VWB1_WGM1_WGMXCC1_WGMXCCGn1
    SolutionIndex: 37
    SolutionNameMin: Cijk_Ailk_Bljk_BSS_BH_UserArgs_MT256x256x32_MI16x16x1_SN_LDSB1_CLR1_GSU0_GSUC0_GSUWGMRR0_K1_LBSPPA2048_LBSPPB128_LPA0_MIWT8_8_PLR1_SU32_SUM0_SUS256_SKXCCM6_VWA4_VWB1_WGM1_WGMXCC1_WGMXCCGn1
    SolutionIndex: 38
    SolutionNameMin: Cijk_Ailk_Bljk_BSS_BH_UserArgs_MT256x256x32_MI16x16x1_SN_LDSB1_CLR1_GSU0_GSUC0_GSUWGMRR0_K1_LBSPPA2048_LBSPPB128_LPA0_MIWT8_8_PLR1_SU32_SUM0_SUS256_SKXCCM6_VWA4_VWB2_WGM1_WGMXCC1_WGMXCCGn1
    SolutionIndex: 39
    SolutionNameMin: Cijk_Ailk_Bljk_BSS_BH_UserArgs_MT256x256x32_MI16x16x1_SN_LDSB1_CLR1_GSU0_GSUC0_GSUWGMRR0_K1_LBSPPA2048_LBSPPB256_LPA0_MIWT8_8_PLR1_SU32_SUM0_SUS256_SKXCCM6_VWA4_VWB4_WGM1_WGMXCC1_WGMXCCGn1
    SolutionIndex: 40
    SolutionNameMin: Cijk_Ailk_Bljk_BSS_BH_UserArgs_MT256x256x32_MI16x16x1_SN_LDSB1_CLR1_GSU0_GSUC0_GSUWGMRR0_K1_LBSPPA2048_LBSPPB512_LPA0_MIWT8_8_PLR1_SU32_SUM0_SUS256_SKXCCM6_VWA4_VWB8_WGM1_WGMXCC1_WGMXCCGn1
    SolutionIndex: 41
    SolutionNameMin: Cijk_Ailk_Bljk_BSS_BH_UserArgs_MT256x256x32_MI16x16x1_SN_LDSB1_CLR1_GSU0_GSUC0_GSUWGMRR0_K1_LBSPPA2048_LBSPPB128_LPA0_MIWT8_8_PLR1_SU32_SUM0_SUS256_SKXCCM6_VWA4_VWB1_WGM4_WGMXCC1_WGMXCCGn1
    SolutionIndex: 42
    SolutionNameMin: Cijk_Ailk_Bljk_BSS_BH_UserArgs_MT256x256x32_MI16x16x1_SN_LDSB1_CLR1_GSU0_GSUC0_GSUWGMRR0_K1_LBSPPA2048_LBSPPB128_LPA0_MIWT8_8_PLR1_SU32_SUM0_SUS256_SKXCCM6_VWA4_VWB2_WGM4_WGMXCC1_WGMXCCGn1
    SolutionIndex: 43
    SolutionNameMin: Cijk_Ailk_Bljk_BSS_BH_UserArgs_MT256x256x32_MI16x16x1_SN_LDSB1_CLR1_GSU0_GSUC0_GSUWGMRR0_K1_LBSPPA2048_LBSPPB512_LPA0_MIWT8_8_PLR1_SU32_SUM0_SUS256_SKXCCM6_VWA4_VWB8_WGM4_WGMXCC1_WGMXCCGn1
    SolutionIndex: 44
    SolutionNameMin: Cijk_Ailk_Bljk_BSS_BH_UserArgs_MT256x256x32_MI16x16x1_SN_LDSB1_CLR1_GSU0_GSUC0_GSUWGMRR0_K1_LBSPPA2048_LBSPPB128_LPA0_MIWT8_8_PLR1_SU32_SUM0_SUS256_SKXCCM6_VWA4_VWB1_WGM8_WGMXCC1_WGMXCCGn1
    SolutionIndex: 45
    SolutionNameMin: Cijk_Ailk_Bljk_BSS_BH_UserArgs_MT256x256x32_MI16x16x1_SN_LDSB1_CLR1_GSU0_GSUC0_GSUWGMRR0_K1_LBSPPA2048_LBSPPB128_LPA0_MIWT8_8_PLR1_SU32_SUM0_SUS256_SKXCCM6_VWA4_VWB2_WGM8_WGMXCC1_WGMXCCGn1
    SolutionIndex: 46
    SolutionNameMin: Cijk_Ailk_Bljk_BSS_BH_UserArgs_MT256x256x32_MI16x16x1_SN_LDSB1_CLR1_GSU0_GSUC0_GSUWGMRR0_K1_LBSPPA2048_LBSPPB256_LPA0_MIWT8_8_PLR1_SU32_SUM0_SUS256_SKXCCM6_VWA4_VWB4_WGM8_WGMXCC1_WGMXCCGn1
    SolutionIndex: 47
    SolutionNameMin: Cijk_Ailk_Bljk_BSS_BH_UserArgs_MT128x256x32_MI16x16x1_SN_LDSB1_CLR1_GSU0_GSUC0_GSUWGMRR0_K1_LBSPPA1024_LBSPPB128_LPA0_MIWT4_8_PLR1_SU32_SUM0_SUS256_SKXCCM6_VWA4_VWB1_WGM1_WGMXCC1_WGMXCCGn1
    SolutionIndex: 48
    SolutionNameMin: Cijk_Ailk_Bljk_BSS_BH_UserArgs_MT256x128x32_MI16x16x1_SN_LDSB1_CLR1_GSU0_GSUC0_GSUWGMRR0_K1_LBSPPA2048_LBSPPB128_LPA0_MIWT8_4_PLR1_SU32_SUM0_SUS256_SKXCCM6_VWA4_VWB1_WGM1_WGMXCC1_WGMXCCGn1
    SolutionIndex: 49
    SolutionNameMin: Cijk_Ailk_Bljk_BSS_BH_UserArgs_MT256x128x32_MI16x16x1_SN_LDSB1_CLR1_GSU0_GSUC0_GSUWGMRR0_K1_LBSPPA2048_LBSPPB128_LPA0_MIWT8_4_PLR1_SU32_SUM0_SUS256_SKXCCM6_VWA4_VWB2_WGM1_WGMXCC1_WGMXCCGn1
    SolutionIndex: 50
    SolutionNameMin: Cijk_Ailk_Bljk_BSS_BH_UserArgs_MT256x128x32_MI16x16x1_SN_LDSB1_CLR1_GSU0_GSUC0_GSUWGMRR0_K1_LBSPPA2048_LBSPPB256_LPA0_MIWT8_4_PLR1_SU32_SUM0_SUS256_SKXCCM6_VWA4_VWB4_WGM1_WGMXCC1_WGMXCCGn1
    SolutionIndex: 51
    SolutionNameMin: Cijk_Ailk_Bljk_BSS_BH_UserArgs_MT256x128x32_MI16x16x1_SN_LDSB1_CLR1_GSU0_GSUC0_GSUWGMRR0_K1_LBSPPA2048_LBSPPB128_LPA0_MIWT8_4_PLR1_SU32_SUM0_SUS256_SKXCCM6_VWA4_VWB1_WGM4_WGMXCC1_WGMXCCGn1
    SolutionIndex: 52
    SolutionNameMin: Cijk_Ailk_Bljk_BSS_BH_UserArgs_MT256x128x32_MI16x16x1_SN_LDSB1_CLR1_GSU0_GSUC0_GSUWGMRR0_K1_LBSPPA2048_LBSPPB128_LPA0_MIWT8_4_PLR1_SU32_SUM0_SUS256_SKXCCM6_VWA4_VWB2_WGM4_WGMXCC1_WGMXCCGn1
    SolutionIndex: 53
    SolutionNameMin: Cijk_Ailk_Bljk_BSS_BH_UserArgs_MT256x128x32_MI16x16x1_SN_LDSB1_CLR1_GSU0_GSUC0_GSUWGMRR0_K1_LBSPPA2048_LBSPPB256_LPA0_MIWT8_4_PLR1_SU32_SUM0_SUS256_SKXCCM6_VWA4_VWB4_WGM4_WGMXCC1_WGMXCCGn1
    SolutionIndex: 54
    SolutionNameMin: Cijk_Ailk_Bljk_BSS_BH_UserArgs_MT256x128x32_MI16x16x1_SN_LDSB1_CLR1_GSU0_GSUC0_GSUWGMRR0_K1_LBSPPA2048_LBSPPB128_LPA0_MIWT8_4_PLR1_SU32_SUM0_SUS256_SKXCCM6_VWA4_VWB1_WGM8_WGMXCC1_WGMXCCGn1
    SolutionIndex: 55
    SolutionNameMin: Cijk_Ailk_Bljk_BSS_BH_UserArgs_MT256x128x32_MI16x16x1_SN_LDSB1_CLR1_GSU0_GSUC0_GSUWGMRR0_K1_LBSPPA2048_LBSPPB128_LPA0_MIWT8_4_PLR1_SU32_SUM0_SUS256_SKXCCM6_VWA4_VWB2_WGM8_WGMXCC1_WGMXCCGn1
    SolutionIndex: 56
    SolutionNameMin: Cijk_Ailk_Bljk_BSS_BH_UserArgs_MT256x128x32_MI16x16x1_SN_LDSB1_CLR1_GSU0_GSUC0_GSUWGMRR0_K1_LBSPPA2048_LBSPPB256_LPA0_MIWT8_4_PLR1_SU32_SUM0_SUS256_SKXCCM6_VWA4_VWB4_WGM8_WGMXCC1_WGMXCCGn1
    SolutionIndex: 57
    SolutionNameMin: Cijk_Ailk_Bljk_BSS_BH_UserArgs_MT256x64x32_MI16x16x1_SN_LDSB1_CLR1_GSU0_GSUC0_GSUWGMRR0_K1_LBSPPA2048_LBSPPB128_LPA0_MIWT8_2_PLR1_SU32_SUM0_SUS256_SKXCCM6_VWA4_VWB1_WGM1_WGMXCC1_WGMXCCGn1
    SolutionIndex: 58
    SolutionNameMin: Cijk_Ailk_Bljk_BSS_BH_UserArgs_MT256x64x32_MI16x16x1_SN_LDSB1_CLR1_GSU0_GSUC0_GSUWGMRR0_K1_LBSPPA2048_LBSPPB128_LPA0_MIWT8_2_PLR1_SU32_SUM0_SUS256_SKXCCM6_VWA4_VWB2_WGM1_WGMXCC1_WGMXCCGn1
    SolutionIndex: 59
    SolutionNameMin: Cijk_Ailk_Bljk_BSS_BH_UserArgs_MT256x64x32_MI16x16x1_SN_LDSB1_CLR1_GSU0_GSUC0_GSUWGMRR0_K1_LBSPPA2048_LBSPPB128_LPA0_MIWT8_2_PLR1_SU32_SUM0_SUS256_SKXCCM6_VWA4_VWB1_WGM8_WGMXCC1_WGMXCCGn1
    SolutionIndex: 60
    SolutionNameMin: Cijk_Ailk_Bljk_BSS_BH_UserArgs_MT128x128x32_MI16x16x1_SN_LDSB1_CLR1_GSU0_GSUC0_GSUWGMRR0_K1_LBSPPA1024_LBSPPB128_LPA0_MIWT4_4_PLR1_SU32_SUM0_SUS256_SKXCCM6_VWA4_VWB1_WGM1_WGMXCC1_WGMXCCGn1
    SolutionIndex: 61
    SolutionNameMin: Cijk_Ailk_Bljk_BSS_BH_UserArgs_MT128x128x32_MI16x16x1_SN_LDSB1_CLR1_GSU0_GSUC0_GSUWGMRR0_K1_LBSPPA1024_LBSPPB128_LPA0_MIWT4_4_PLR1_SU32_SUM0_SUS256_SKXCCM6_VWA4_VWB2_WGM1_WGMXCC1_WGMXCCGn1
    SolutionIndex: 62
    SolutionNameMin: Cijk_Ailk_Bljk_BSS_BH_UserArgs_MT128x128x32_MI16x16x1_SN_LDSB1_CLR1_GSU0_GSUC0_GSUWGMRR0_K1_LBSPPA1024_LBSPPB128_LPA0_MIWT4_4_PLR1_SU32_SUM0_SUS256_SKXCCM6_VWA4_VWB1_WGM4_WGMXCC1_WGMXCCGn1
    SolutionIndex: 63
    SolutionNameMin: Cijk_Ailk_Bljk_BSS_BH_UserArgs_MT128x128x32_MI16x16x1_SN_LDSB1_CLR1_GSU0_GSUC0_GSUWGMRR0_K1_LBSPPA1024_LBSPPB128_LPA16_MIWT4_4_PLR1_SU32_SUM0_SUS256_SKXCCM6_VWA1_VWB1_WGM8_WGMXCC1_WGMXCCGn1
    SolutionIndex: 64
    SolutionNameMin: Cijk_Ailk_Bljk_BSS_BH_UserArgs_MT128x128x32_MI16x16x1_SN_LDSB1_CLR1_GSU0_GSUC0_GSUWGMRR0_K1_LBSPPA1024_LBSPPB128_LPA0_MIWT4_4_PLR1_SU32_SUM0_SUS256_SKXCCM6_VWA4_VWB1_WGM8_WGMXCC1_WGMXCCGn1
    SolutionIndex: 65
    SolutionNameMin: Cijk_Ailk_Bljk_BSS_BH_UserArgs_MT128x128x32_MI16x16x1_SN_LDSB1_CLR1_GSU0_GSUC0_GSUWGMRR0_K1_LBSPPA1024_LBSPPB128_LPA16_MIWT4_4_PLR1_SU32_SUM0_SUS256_SKXCCM6_VWA1_VWB2_WGM8_WGMXCC1_WGMXCCGn1
    SolutionIndex: 66
    SolutionNameMin: Cijk_Ailk_Bljk_BSS_BH_UserArgs_MT128x128x32_MI16x16x1_SN_LDSB1_CLR1_GSU0_GSUC0_GSUWGMRR0_K1_LBSPPA1024_LBSPPB128_LPA0_MIWT4_4_PLR1_SU32_SUM0_SUS256_SKXCCM6_VWA4_VWB2_WGM8_WGMXCC1_WGMXCCGn1
    SolutionIndex: 67
    SolutionNameMin: Cijk_Ailk_Bljk_BSS_BH_UserArgs_MT128x128x32_MI16x16x1_SN_LDSB1_CLR1_GSU0_GSUC0_GSUWGMRR0_K1_LBSPPA1024_LBSPPB256_LPA16_MIWT4_4_PLR1_SU32_SUM0_SUS256_SKXCCM6_VWA1_VWB4_WGM8_WGMXCC1_WGMXCCGn1
    SolutionIndex: 68
    SolutionNameMin: Cijk_Ailk_Bljk_BSS_BH_UserArgs_MT128x128x32_MI16x16x1_SN_LDSB1_CLR1_GSU0_GSUC0_GSUWGMRR0_K1_LBSPPA1024_LBSPPB256_LPA0_MIWT4_4_PLR1_SU32_SUM0_SUS256_SKXCCM6_VWA4_VWB4_WGM8_WGMXCC1_WGMXCCGn1
    SolutionIndex: 69
    SolutionNameMin: Cijk_Ailk_Bljk_BSS_BH_UserArgs_MT128x64x32_MI16x16x1_SN_LDSB0_CLR0_GSU0_GSUC0_GSUWGMRR0_K1_LBSPPA1024_LBSPPB128_LPA0_MIWT4_2_PLR0_SU32_SUM0_SUS256_SKXCCM6_VWA4_VWB1_WGM1_WGMXCC1_WGMXCCGn1
    SolutionIndex: 70
    SolutionNameMin: Cijk_Ailk_Bljk_BSS_BH_UserArgs_MT128x64x32_MI16x16x1_SN_LDSB0_CLR1_GSU0_GSUC0_GSUWGMRR0_K1_LBSPPA1024_LBSPPB128_LPA0_MIWT4_2_PLR1_SU32_SUM0_SUS256_SKXCCM6_VWA4_VWB1_WGM4_WGMXCC1_WGMXCCGn1
    SolutionIndex: 71
    SolutionNameMin: Cijk_Ailk_Bljk_BSS_BH_UserArgs_MT32x32x32_MI16x16x1_SN_LDSB0_CLR1_GSU0_GSUC0_GSUWGMRR0_K1_LBSPPA256_LBSPPB128_LPA16_MIWT1_1_PLR1_SU32_SUM0_SUS256_SKXCCM6_VWA1_VWB1_WGM1_WGMXCC1_WGMXCCGn1
    SolutionIndex: 72
    SolutionNameMin: Cijk_Ailk_Bljk_BSS_BH_UserArgs_MT32x32x32_MI16x16x1_SN_LDSB0_CLR0_GSU0_GSUC0_GSUWGMRR0_K1_LBSPPA256_LBSPPB128_LPA16_MIWT1_1_PLR0_SU32_SUM0_SUS256_SKXCCM6_VWA1_VWB1_WGM1_WGMXCC1_WGMXCCGn1
    SolutionIndex: 73
    SolutionNameMin: Cijk_Ailk_Bljk_BSS_BH_UserArgs_MT128x256x64_MI16x16x1_SN_LDSB1_CLR1_GSU0_GSUC0_GSUWGMRR0_K1_LBSPPA2048_LBSPPB128_LPA0_MIWT4_8_PLR1_SU32_SUM0_SUS256_SKXCCM6_VWA4_VWB1_WGM1_WGMXCC1_WGMXCCGn1
    SolutionIndex: 74
    SolutionNameMin: Cijk_Ailk_Bljk_BSS_BH_UserArgs_MT128x256x64_MI16x16x1_SN_LDSB1_CLR1_GSU0_GSUC0_GSUWGMRR0_K1_LBSPPA2048_LBSPPB256_LPA0_MIWT4_8_PLR1_SU32_SUM0_SUS256_SKXCCM6_VWA4_VWB2_WGM1_WGMXCC1_WGMXCCGn1
    SolutionIndex: 75
    SolutionNameMin: Cijk_Ailk_Bljk_BSS_BH_UserArgs_MT128x256x64_MI16x16x1_SN_LDSB1_CLR1_GSU0_GSUC0_GSUWGMRR0_K1_LBSPPA2048_LBSPPB1024_LPA0_MIWT4_8_PLR1_SU32_SUM0_SUS256_SKXCCM6_VWA4_VWB8_WGM1_WGMXCC1_WGMXCCGn1
    SolutionIndex: 76
    SolutionNameMin: Cijk_Ailk_Bljk_BSS_BH_UserArgs_MT128x256x64_MI16x16x1_SN_LDSB1_CLR1_GSU0_GSUC0_GSUWGMRR0_K1_LBSPPA2048_LBSPPB256_LPA0_MIWT4_8_PLR1_SU32_SUM0_SUS256_SKXCCM6_VWA4_VWB2_WGM4_WGMXCC1_WGMXCCGn1
    SolutionIndex: 77
    SolutionNameMin: Cijk_Ailk_Bljk_BSS_BH_UserArgs_MT128x256x64_MI16x16x1_SN_LDSB1_CLR1_GSU0_GSUC0_GSUWGMRR0_K1_LBSPPA2048_LBSPPB512_LPA0_MIWT4_8_PLR1_SU32_SUM0_SUS256_SKXCCM6_VWA4_VWB4_WGM4_WGMXCC1_WGMXCCGn1
    SolutionIndex: 78
    SolutionNameMin: Cijk_Ailk_Bljk_BSS_BH_UserArgs_MT128x256x64_MI16x16x1_SN_LDSB1_CLR1_GSU0_GSUC0_GSUWGMRR0_K1_LBSPPA2048_LBSPPB128_LPA0_MIWT4_8_PLR1_SU32_SUM0_SUS256_SKXCCM6_VWA4_VWB1_WGM8_WGMXCC1_WGMXCCGn1
    SolutionIndex: 79
    SolutionNameMin: Cijk_Ailk_Bljk_BSS_BH_UserArgs_MT128x256x64_MI16x16x1_SN_LDSB1_CLR1_GSU0_GSUC0_GSUWGMRR0_K1_LBSPPA2048_LBSPPB1024_LPA0_MIWT4_8_PLR1_SU32_SUM0_SUS256_SKXCCM6_VWA4_VWB8_WGM8_WGMXCC1_WGMXCCGn1
    SolutionIndex: 80
    SolutionNameMin: Cijk_Ailk_Bljk_BSS_BH_UserArgs_MT256x128x64_MI16x16x1_SN_LDSB1_CLR1_GSU0_GSUC0_GSUWGMRR0_K1_LBSPPA4096_LBSPPB128_LPA0_MIWT8_4_PLR1_SU32_SUM0_SUS256_SKXCCM6_VWA4_VWB1_WGM1_WGMXCC1_WGMXCCGn1
    SolutionIndex: 81
    SolutionNameMin: Cijk_Ailk_Bljk_BSS_BH_UserArgs_MT256x128x64_MI16x16x1_SN_LDSB1_CLR1_GSU0_GSUC0_GSUWGMRR0_K1_LBSPPA4096_LBSPPB512_LPA0_MIWT8_4_PLR1_SU32_SUM0_SUS256_SKXCCM6_VWA4_VWB4_WGM1_WGMXCC1_WGMXCCGn1
    SolutionIndex: 82
    SolutionNameMin: Cijk_Ailk_Bljk_BSS_BH_UserArgs_MT128x128x64_MI16x16x1_SN_LDSB1_CLR1_GSU0_GSUC0_GSUWGMRR0_K1_LBSPPA2048_LBSPPB128_LPA0_MIWT4_4_PLR1_SU32_SUM0_SUS256_SKXCCM6_VWA4_VWB1_WGM1_WGMXCC1_WGMXCCGn1
    SolutionIndex: 83
    SolutionNameMin: Cijk_Ailk_Bljk_BSS_BH_UserArgs_MT128x128x64_MI16x16x1_SN_LDSB1_CLR1_GSU0_GSUC0_GSUWGMRR0_K1_LBSPPA2048_LBSPPB256_LPA0_MIWT4_4_PLR1_SU32_SUM0_SUS256_SKXCCM6_VWA4_VWB2_WGM1_WGMXCC1_WGMXCCGn1
    SolutionIndex: 84
    SolutionNameMin: Cijk_Ailk_Bljk_BSS_BH_UserArgs_MT128x128x64_MI16x16x1_SN_LDSB1_CLR1_GSU0_GSUC0_GSUWGMRR0_K1_LBSPPA2048_LBSPPB512_LPA0_MIWT4_4_PLR1_SU32_SUM0_SUS256_SKXCCM6_VWA4_VWB4_WGM1_WGMXCC1_WGMXCCGn1
    SolutionIndex: 85
    SolutionNameMin: Cijk_Ailk_Bljk_BSS_BH_UserArgs_MT128x128x64_MI16x16x1_SN_LDSB1_CLR1_GSU0_GSUC0_GSUWGMRR0_K1_LBSPPA2048_LBSPPB256_LPA0_MIWT4_4_PLR1_SU32_SUM0_SUS256_SKXCCM6_VWA4_VWB2_WGM4_WGMXCC1_WGMXCCGn1
    SolutionIndex: 86
    SolutionNameMin: Cijk_Ailk_Bljk_BSS_BH_UserArgs_MT128x128x64_MI16x16x1_SN_LDSB1_CLR1_GSU0_GSUC0_GSUWGMRR0_K1_LBSPPA2048_LBSPPB512_LPA0_MIWT4_4_PLR1_SU32_SUM0_SUS256_SKXCCM6_VWA4_VWB4_WGM4_WGMXCC1_WGMXCCGn1
    SolutionIndex: 87
    SolutionNameMin: Cijk_Ailk_Bljk_BSS_BH_UserArgs_MT128x128x64_MI16x16x1_SN_LDSB1_CLR1_GSU0_GSUC0_GSUWGMRR0_K1_LBSPPA2048_LBSPPB128_LPA0_MIWT4_4_PLR1_SU32_SUM0_SUS256_SKXCCM6_VWA4_VWB1_WGM8_WGMXCC1_WGMXCCGn1
    SolutionIndex: 88
    SolutionNameMin: Cijk_Ailk_Bljk_BSS_BH_UserArgs_MT128x128x64_MI16x16x1_SN_LDSB1_CLR1_GSU0_GSUC0_GSUWGMRR0_K1_LBSPPA2048_LBSPPB256_LPA0_MIWT4_4_PLR1_SU32_SUM0_SUS256_SKXCCM6_VWA4_VWB2_WGM8_WGMXCC1_WGMXCCGn1
    SolutionIndex: 89
    SolutionNameMin: Cijk_Ailk_Bljk_BSS_BH_UserArgs_MT64x128x64_MI16x16x1_SN_LDSB1_CLR1_GSU0_GSUC0_GSUWGMRR0_K1_LBSPPA1024_LBSPPB128_LPA32_MIWT2_4_PLR1_SU32_SUM0_SUS256_SKXCCM6_VWA2_VWB1_WGM1_WGMXCC1_WGMXCCGn1
    SolutionIndex: 90
    SolutionNameMin: Cijk_Ailk_Bljk_BSS_BH_UserArgs_MT64x128x64_MI16x16x1_SN_LDSB1_CLR1_GSU0_GSUC0_GSUWGMRR0_K1_LBSPPA1024_LBSPPB256_LPA32_MIWT2_4_PLR1_SU32_SUM0_SUS256_SKXCCM6_VWA2_VWB2_WGM1_WGMXCC1_WGMXCCGn1
    SolutionIndex: 91
    SolutionNameMin: Cijk_Ailk_Bljk_BSS_BH_UserArgs_MT64x128x64_MI16x16x1_SN_LDSB1_CLR1_GSU0_GSUC0_GSUWGMRR0_K1_LBSPPA1024_LBSPPB512_LPA16_MIWT2_4_PLR1_SU32_SUM0_SUS256_SKXCCM6_VWA1_VWB4_WGM1_WGMXCC1_WGMXCCGn1
    SolutionIndex: 92
    SolutionNameMin: Cijk_Ailk_Bljk_BSS_BH_UserArgs_MT64x128x64_MI16x16x1_SN_LDSB1_CLR1_GSU0_GSUC0_GSUWGMRR0_K1_LBSPPA1024_LBSPPB512_LPA32_MIWT2_4_PLR1_SU32_SUM0_SUS256_SKXCCM6_VWA2_VWB4_WGM1_WGMXCC1_WGMXCCGn1
    SolutionIndex: 93
    SolutionNameMin: Cijk_Ailk_Bljk_BSS_BH_UserArgs_MT64x128x64_MI16x16x1_SN_LDSB1_CLR1_GSU0_GSUC0_GSUWGMRR0_K1_LBSPPA1024_LBSPPB256_LPA32_MIWT2_4_PLR1_SU32_SUM0_SUS256_SKXCCM6_VWA2_VWB2_WGM4_WGMXCC1_WGMXCCGn1
    SolutionIndex: 94
    SolutionNameMin: Cijk_Ailk_Bljk_BSS_BH_UserArgs_MT64x128x64_MI16x16x1_SN_LDSB1_CLR1_GSU0_GSUC0_GSUWGMRR0_K1_LBSPPA1024_LBSPPB256_LPA32_MIWT2_4_PLR1_SU32_SUM0_SUS256_SKXCCM6_VWA2_VWB2_WGM8_WGMXCC1_WGMXCCGn1
    SolutionIndex: 95
    SolutionNameMin: Cijk_Ailk_Bljk_BSS_BH_UserArgs_MT64x128x64_MI16x16x1_SN_LDSB1_CLR1_GSU0_GSUC0_GSUWGMRR0_K1_LBSPPA1024_LBSPPB512_LPA32_MIWT2_4_PLR1_SU32_SUM0_SUS256_SKXCCM6_VWA2_VWB4_WGM8_WGMXCC1_WGMXCCGn1
    SolutionIndex: 96
    SolutionNameMin: Cijk_Ailk_Bljk_BSS_BH_UserArgs_MT128x64x64_MI16x16x1_SN_LDSB1_CLR1_GSU0_GSUC0_GSUWGMRR0_K1_LBSPPA2048_LBSPPB128_LPA0_MIWT4_2_PLR1_SU32_SUM0_SUS256_SKXCCM6_VWA4_VWB1_WGM1_WGMXCC1_WGMXCCGn1
    SolutionIndex: 97
    SolutionNameMin: Cijk_Ailk_Bljk_BSS_BH_UserArgs_MT128x64x64_MI16x16x1_SN_LDSB1_CLR1_GSU0_GSUC0_GSUWGMRR0_K1_LBSPPA2048_LBSPPB256_LPA0_MIWT4_2_PLR1_SU32_SUM0_SUS256_SKXCCM6_VWA4_VWB2_WGM1_WGMXCC1_WGMXCCGn1
    SolutionIndex: 98
    SolutionNameMin: Cijk_Ailk_Bljk_BSS_BH_UserArgs_MT128x64x64_MI16x16x1_SN_LDSB1_CLR1_GSU0_GSUC0_GSUWGMRR0_K1_LBSPPA2048_LBSPPB128_LPA0_MIWT4_2_PLR2_SU32_SUM0_SUS256_SKXCCM6_VWA4_VWB1_WGM1_WGMXCC1_WGMXCCGn1
    SolutionIndex: 99
    SolutionNameMin: Cijk_Ailk_Bljk_BSS_BH_UserArgs_MT128x64x64_MI16x16x1_SN_LDSB1_CLR1_GSU0_GSUC0_GSUWGMRR0_K1_LBSPPA2048_LBSPPB256_LPA0_MIWT4_2_PLR2_SU32_SUM0_SUS256_SKXCCM6_VWA4_VWB2_WGM1_WGMXCC1_WGMXCCGn1
    SolutionIndex: 100
    SolutionNameMin: Cijk_Ailk_Bljk_BSS_BH_UserArgs_MT128x64x64_MI16x16x1_SN_LDSB1_CLR1_GSU0_GSUC0_GSUWGMRR0_K1_LBSPPA2048_LBSPPB128_LPA0_MIWT4_2_PLR1_SU32_SUM0_SUS256_SKXCCM6_VWA4_VWB1_WGM4_WGMXCC1_WGMXCCGn1
    SolutionIndex: 101
    SolutionNameMin: Cijk_Ailk_Bljk_BSS_BH_UserArgs_MT128x64x64_MI16x16x1_SN_LDSB1_CLR1_GSU0_GSUC0_GSUWGMRR0_K1_LBSPPA2048_LBSPPB256_LPA0_MIWT4_2_PLR1_SU32_SUM0_SUS256_SKXCCM6_VWA4_VWB2_WGM4_WGMXCC1_WGMXCCGn1
    SolutionIndex: 102
    SolutionNameMin: Cijk_Ailk_Bljk_BSS_BH_UserArgs_MT128x64x64_MI16x16x1_SN_LDSB1_CLR1_GSU0_GSUC0_GSUWGMRR0_K1_LBSPPA2048_LBSPPB128_LPA0_MIWT4_2_PLR2_SU32_SUM0_SUS256_SKXCCM6_VWA4_VWB1_WGM4_WGMXCC1_WGMXCCGn1
    SolutionIndex: 103
    SolutionNameMin: Cijk_Ailk_Bljk_BSS_BH_UserArgs_MT128x64x64_MI16x16x1_SN_LDSB1_CLR1_GSU0_GSUC0_GSUWGMRR0_K1_LBSPPA2048_LBSPPB128_LPA0_MIWT4_2_PLR1_SU32_SUM0_SUS256_SKXCCM6_VWA4_VWB1_WGM8_WGMXCC1_WGMXCCGn1
    SolutionIndex: 104
    SolutionNameMin: Cijk_Ailk_Bljk_BSS_BH_UserArgs_MT128x64x64_MI16x16x1_SN_LDSB1_CLR1_GSU0_GSUC0_GSUWGMRR0_K1_LBSPPA2048_LBSPPB256_LPA0_MIWT4_2_PLR1_SU32_SUM0_SUS256_SKXCCM6_VWA4_VWB2_WGM8_WGMXCC1_WGMXCCGn1
    SolutionIndex: 105
    SolutionNameMin: Cijk_Ailk_Bljk_BSS_BH_UserArgs_MT128x64x64_MI16x16x1_SN_LDSB1_CLR1_GSU0_GSUC0_GSUWGMRR0_K1_LBSPPA2048_LBSPPB128_LPA0_MIWT4_2_PLR2_SU32_SUM0_SUS256_SKXCCM6_VWA4_VWB1_WGM8_WGMXCC1_WGMXCCGn1
    SolutionIndex: 106
    SolutionNameMin: Cijk_Ailk_Bljk_BSS_BH_UserArgs_MT128x32x64_MI16x16x1_SN_LDSB1_CLR1_GSU0_GSUC0_GSUWGMRR0_K1_LBSPPA2048_LBSPPB128_LPA0_MIWT4_1_PLR1_SU32_SUM0_SUS256_SKXCCM6_VWA4_VWB1_WGM8_WGMXCC1_WGMXCCGn1
    SolutionIndex: 107
    SolutionNameMin: Cijk_Ailk_Bljk_BSS_BH_UserArgs_MT64x64x64_MI16x16x1_SN_LDSB1_CLR1_GSU0_GSUC0_GSUWGMRR0_K1_LBSPPA1024_LBSPPB128_LPA16_MIWT2_2_PLR1_SU32_SUM0_SUS256_SKXCCM6_VWA1_VWB1_WGM1_WGMXCC1_WGMXCCGn1
    SolutionIndex: 108
    SolutionNameMin: Cijk_Ailk_Bljk_BSS_BH_UserArgs_MT64x64x64_MI16x16x1_SN_LDSB1_CLR1_GSU0_GSUC0_GSUWGMRR0_K1_LBSPPA1024_LBSPPB128_LPA32_MIWT2_2_PLR1_SU32_SUM0_SUS256_SKXCCM6_VWA2_VWB1_WGM1_WGMXCC1_WGMXCCGn1
    SolutionIndex: 109
    SolutionNameMin: Cijk_Ailk_Bljk_BSS_BH_UserArgs_MT64x64x64_MI16x16x1_SN_LDSB1_CLR1_GSU0_GSUC0_GSUWGMRR0_K1_LBSPPA1024_LBSPPB256_LPA16_MIWT2_2_PLR1_SU32_SUM0_SUS256_SKXCCM6_VWA1_VWB2_WGM1_WGMXCC1_WGMXCCGn1
    SolutionIndex: 110
    SolutionNameMin: Cijk_Ailk_Bljk_BSS_BH_UserArgs_MT64x64x64_MI16x16x1_SN_LDSB1_CLR1_GSU0_GSUC0_GSUWGMRR0_K1_LBSPPA1024_LBSPPB256_LPA32_MIWT2_2_PLR1_SU32_SUM0_SUS256_SKXCCM6_VWA2_VWB2_WGM1_WGMXCC1_WGMXCCGn1
    SolutionIndex: 111
    SolutionNameMin: Cijk_Ailk_Bljk_BSS_BH_UserArgs_MT64x64x64_MI16x16x1_SN_LDSB1_CLR1_GSU0_GSUC0_GSUWGMRR0_K1_LBSPPA1024_LBSPPB128_LPA32_MIWT2_2_PLR1_SU32_SUM0_SUS256_SKXCCM6_VWA2_VWB1_WGM4_WGMXCC1_WGMXCCGn1
    SolutionIndex: 112
    SolutionNameMin: Cijk_Ailk_Bljk_BSS_BH_UserArgs_MT64x64x64_MI16x16x1_SN_LDSB1_CLR1_GSU0_GSUC0_GSUWGMRR0_K1_LBSPPA1024_LBSPPB256_LPA32_MIWT2_2_PLR1_SU32_SUM0_SUS256_SKXCCM6_VWA2_VWB2_WGM4_WGMXCC1_WGMXCCGn1
    SolutionIndex: 113
    SolutionNameMin: Cijk_Ailk_Bljk_BSS_BH_UserArgs_MT64x64x64_MI16x16x1_SN_LDSB1_CLR1_GSU0_GSUC0_GSUWGMRR0_K1_LBSPPA1024_LBSPPB128_LPA32_MIWT2_2_PLR1_SU32_SUM0_SUS256_SKXCCM6_VWA2_VWB1_WGM8_WGMXCC1_WGMXCCGn1
    SolutionIndex: 114
    SolutionNameMin: Cijk_Ailk_Bljk_BSS_BH_UserArgs_MT64x64x64_MI16x16x1_SN_LDSB1_CLR1_GSU0_GSUC0_GSUWGMRR0_K1_LBSPPA1024_LBSPPB256_LPA32_MIWT2_2_PLR1_SU32_SUM0_SUS256_SKXCCM6_VWA2_VWB2_WGM8_WGMXCC1_WGMXCCGn1
    SolutionIndex: 115
    SolutionNameMin: Cijk_Ailk_Bljk_BSS_BH_UserArgs_MT64x32x64_MI16x16x1_SN_LDSB0_CLR1_GSU0_GSUC0_GSUWGMRR0_K1_LBSPPA1024_LBSPPB128_LPA32_MIWT2_1_PLR1_SU32_SUM0_SUS256_SKXCCM6_VWA2_VWB1_WGM8_WGMXCC1_WGMXCCGn1
    SolutionIndex: 116
    SolutionNameMin: Cijk_Ailk_Bljk_BSS_BH_UserArgs_MT32x32x64_MI16x16x1_SN_LDSB0_CLR1_GSU0_GSUC0_GSUWGMRR0_K1_LBSPPA512_LBSPPB128_LPA16_MIWT1_1_PLR1_SU32_SUM0_SUS256_SKXCCM6_VWA1_VWB1_WGM1_WGMXCC1_WGMXCCGn1
    SolutionIndex: 117
    SolutionNameMin: Cijk_Ailk_Bljk_BSS_BH_UserArgs_MT32x32x64_MI16x16x1_SN_LDSB0_CLR1_GSU0_GSUC0_GSUWGMRR0_K1_LBSPPA512_LBSPPB128_LPA16_MIWT1_1_PLR1_SU32_SUM0_SUS256_SKXCCM6_VWA1_VWB1_WGM8_WGMXCC1_WGMXCCGn1
    SolutionIndex: 118
    SolutionNameMin: Cijk_Ailk_Bljk_BSS_BH_UserArgs_MT128x64x128_MI16x16x1_SN_LDSB1_CLR1_GSU0_GSUC0_GSUWGMRR0_K1_LBSPPA2048_LBSPPB512_LPA0_MIWT4_2_PLR2_SU32_SUM0_SUS256_SKXCCM6_VWA4_VWB2_WGM1_WGMXCC1_WGMXCCGn1
    SolutionIndex: 119
    SolutionNameMin: Cijk_Ailk_Bljk_BSS_BH_UserArgs_MT64x32x128_MI16x16x1_SN_LDSB1_CLR1_GSU0_GSUC0_GSUWGMRR0_K1_LBSPPA1024_LBSPPB256_LPA32_MIWT2_1_PLR1_SU32_SUM0_SUS256_SKXCCM6_VWA2_VWB1_WGM1_WGMXCC1_WGMXCCGn1
    SolutionIndex: 120
    SolutionNameMin: Cijk_Ailk_Bljk_BSS_BH_UserArgs_MT64x32x128_MI16x16x1_SN_LDSB1_CLR1_GSU0_GSUC0_GSUWGMRR0_K1_LBSPPA1024_LBSPPB256_LPA32_MIWT2_1_PLR2_SU32_SUM0_SUS256_SKXCCM6_VWA2_VWB1_WGM1_WGMXCC1_WGMXCCGn1
    SolutionIndex: 121
    SolutionNameMin: Cijk_Ailk_Bljk_BSS_BH_UserArgs_MT64x32x128_MI16x16x1_SN_LDSB1_CLR1_GSU0_GSUC0_GSUWGMRR0_K1_LBSPPA1024_LBSPPB256_LPA32_MIWT2_1_PLR2_SU32_SUM0_SUS256_SKXCCM6_VWA2_VWB1_WGM4_WGMXCC1_WGMXCCGn1
    SolutionIndex: 122
    SolutionNameMin: Cijk_Ailk_Bljk_BSS_BH_UserArgs_MT64x32x128_MI16x16x1_SN_LDSB1_CLR1_GSU0_GSUC0_GSUWGMRR0_K1_LBSPPA1024_LBSPPB256_LPA32_MIWT2_1_PLR2_SU32_SUM0_SUS256_SKXCCM6_VWA2_VWB1_WGM8_WGMXCC1_WGMXCCGn1
    SolutionIndex: 123
    SolutionNameMin: Cijk_Ailk_Bljk_BSS_BH_UserArgs_MT32x32x128_MI16x16x1_SN_LDSB1_CLR1_GSU0_GSUC0_GSUWGMRR0_K1_LBSPPA512_LBSPPB256_LPA16_MIWT1_1_PLR1_SU32_SUM0_SUS256_SKXCCM6_VWA1_VWB1_WGM1_WGMXCC1_WGMXCCGn1
    SolutionIndex: 124
    SolutionNameMin: Cijk_Ailk_Bljk_BSS_BH_UserArgs_MT32x32x128_MI16x16x1_SN_LDSB1_CLR1_GSU0_GSUC0_GSUWGMRR0_K1_LBSPPA512_LBSPPB256_LPA16_MIWT1_1_PLR2_SU32_SUM0_SUS256_SKXCCM6_VWA1_VWB1_WGM1_WGMXCC1_WGMXCCGn1
    SolutionIndex: 125
    SolutionNameMin: Cijk_Ailk_Bljk_BSS_BH_UserArgs_MT32x32x128_MI16x16x1_SN_LDSB1_CLR1_GSU0_GSUC0_GSUWGMRR0_K1_LBSPPA512_LBSPPB256_LPA16_MIWT1_1_PLR2_SU32_SUM0_SUS256_SKXCCM6_VWA1_VWB1_WGM8_WGMXCC1_WGMXCCGn1
    SolutionIndex: 126
    SolutionNameMin: Cijk_Ailk_Bljk_BSS_BH_UserArgs_MT32x32x32_MI16x16x1_SN_LDSB0_CLR1_GSU0_GSUC0_GSUWGMRR0_K1_LBSPPA256_LBSPPB128_LPA16_MIWT1_1_PLR1_SU32_SUM0_SUS256_SKXCCM0_VWA1_VWB1_WGM1_WGMXCC1_WGMXCCGn1
- - - [128, 128, 1, 128, 128, 128, 128, 128]
    - [124, 0.085]
  - - [128, 128, 1, 256, 128, 128, 128, 256]
    - [35, 0.109]
  - - [128, 128, 1, 512, 128, 128, 128, 512]
    - [124, 0.178]
  - - [128, 128, 1, 1024, 128, 128, 128, 1024]
    - [124, 0.272]
  - - [128, 128, 1, 2048, 128, 128, 128, 2048]
    - [116, 0.356]
  - - [128, 128, 1, 4096, 128, 128, 128, 4096]
    - [27, 0.692]
  - - [128, 128, 1, 8192, 128, 128, 128, 8192]
    - [124, 1.306]
  - - [128, 256, 1, 128, 128, 128, 128, 128]
    - [35, 0.169]
  - - [128, 256, 1, 256, 128, 128, 128, 256]
    - [34, 0.213]
  - - [128, 256, 1, 512, 128, 128, 128, 512]
    - [124, 0.349]
  - - [128, 256, 1, 1024, 128, 128, 128, 1024]
    - [116, 0.542]
  - - [128, 256, 1, 2048, 128, 128, 128, 2048]
    - [124, 1.012]
  - - [128, 256, 1, 4096, 128, 128, 128, 4096]
    - [123, 1.764]
  - - [128, 256, 1, 8192, 128, 128, 128, 8192]
    - [124, 2.898]
  - - [128, 512, 1, 128, 128, 128, 128, 128]
    - [35, 0.336]
  - - [128, 512, 1, 256, 128, 128, 128, 256]
    - [34, 0.419]
  - - [128, 512, 1, 512, 128, 128, 128, 512]
    - [72, 0.684]
  - - [128, 512, 1, 1024, 128, 128, 128, 1024]
    - [72, 1.238]
  - - [128, 512, 1, 2048, 128, 128, 128, 2048]
    - [124, 2.22]
  - - [128, 512, 1, 4096, 128, 128, 128, 4096]
    - [124, 3.497]
  - - [128, 512, 1, 8192, 128, 128, 128, 8192]
    - [33, 4.985]
  - - [128, 1024, 1, 128, 128, 128, 128, 128]
    - [35, 0.653]
  - - [128, 1024, 1, 256, 128, 128, 128, 256]
    - [35, 0.797]
  - - [128, 1024, 1, 512, 128, 128, 128, 512]
    - [34, 1.423]
  - - [128, 1024, 1, 1024, 128, 128, 128, 1024]
    - [124, 2.46]
  - - [128, 1024, 1, 2048, 128, 128, 128, 2048]
    - [119, 3.901]
  - - [128, 1024, 1, 4096, 128, 128, 128, 4096]
    - [120, 6.055]
  - - [128, 1024, 1, 8192, 128, 128, 128, 8192]
    - [120, 7.984]
  - - [128, 2048, 1, 128, 128, 128, 128, 128]
    - [33, 1.18]
  - - [128, 2048, 1, 256, 128, 128, 128, 256]
    - [34, 1.954]
  - - [128, 2048, 1, 512, 128, 128, 128, 512]
    - [34, 3.106]
  - - [128, 2048, 1, 1024, 128, 128, 128, 1024]
    - [35, 4.424]
  - - [128, 2048, 1, 2048, 128, 128, 128, 2048]
    - [120, 6.537]
  - - [128, 2048, 1, 4096, 128, 128, 128, 4096]
    - [110, 9.254]
  - - [128, 2048, 1, 8192, 128, 128, 128, 8192]
    - [97, 11.103]
  - - [128, 4096, 1, 128, 128, 128, 128, 128]
    - [26, 2.033]
  - - [128, 4096, 1, 256, 128, 128, 128, 256]
    - [26, 3.449]
  - - [128, 4096, 1, 512, 128, 128, 128, 512]
    - [33, 5.349]
  - - [128, 4096, 1, 1024, 128, 128, 128, 1024]
    - [120, 7.412]
  - - [128, 4096, 1, 2048, 128, 128, 128, 2048]
    - [108, 9.975]
  - - [128, 4096, 1, 4096, 128, 128, 128, 4096]
    - [98, 12.402]
  - - [128, 4096, 1, 8192, 128, 128, 128, 8192]
    - [18, 14.309]
  - - [128, 8192, 1, 128, 128, 128, 128, 128]
    - [21, 3.31]
  - - [128, 8192, 1, 256, 128, 128, 128, 256]
    - [108, 5.473]
  - - [128, 8192, 1, 512, 128, 128, 128, 512]
    - [110, 8.228]
  - - [128, 8192, 1, 1024, 128, 128, 128, 1024]
    - [110, 11.051]
  - - [128, 8192, 1, 2048, 128, 128, 128, 2048]
    - [108, 12.649]
  - - [128, 8192, 1, 4096, 128, 128, 128, 4096]
    - [19, 15.463]
  - - [128, 8192, 1, 8192, 128, 128, 128, 8192]
    - [15, 17.253]
  - - [256, 128, 1, 128, 256, 256, 256, 128]
    - [34, 0.168]
  - - [256, 128, 1, 256, 256, 256, 256, 256]
    - [35, 0.215]
  - - [256, 128, 1, 512, 256, 256, 256, 512]
    - [124, 0.354]
  - - [256, 128, 1, 1024, 256, 256, 256, 1024]
    - [117, 0.532]
  - - [256, 128, 1, 2048, 256, 256, 256, 2048]
    - [123, 1.029]
  - - [256, 128, 1, 4096, 256, 256, 256, 4096]
    - [123, 1.759]
  - - [256, 128, 1, 8192, 256, 256, 256, 8192]
    - [35, 2.863]
  - - [256, 256, 1, 128, 256, 256, 256, 128]
    - [35, 0.33]
  - - [256, 256, 1, 256, 256, 256, 256, 256]
    - [34, 0.414]
  - - [256, 256, 1, 512, 256, 256, 256, 512]
    - [71, 0.681]
  - - [256, 256, 1, 1024, 256, 256, 256, 1024]
    - [72, 1.237]
  - - [256, 256, 1, 2048, 256, 256, 256, 2048]
    - [124, 2.221]
  - - [256, 256, 1, 4096, 256, 256, 256, 4096]
    - [124, 3.503]
  - - [256, 256, 1, 8192, 256, 256, 256, 8192]
    - [33, 5.004]
  - - [256, 512, 1, 128, 256, 256, 256, 128]
    - [35, 0.627]
  - - [256, 512, 1, 256, 256, 256, 256, 256]
    - [35, 0.796]
  - - [256, 512, 1, 512, 256, 256, 256, 512]
    - [34, 1.417]
  - - [256, 512, 1, 1024, 256, 256, 256, 1024]
    - [124, 2.449]
  - - [256, 512, 1, 2048, 256, 256, 256, 2048]
    - [119, 3.908]
  - - [256, 512, 1, 4096, 256, 256, 256, 4096]
    - [120, 6.044]
  - - [256, 512, 1, 8192, 256, 256, 256, 8192]
    - [120, 7.866]
  - - [256, 1024, 1, 128, 256, 256, 256, 128]
    - [31, 1.177]
  - - [256, 1024, 1, 256, 256, 256, 256, 256]
    - [34, 1.917]
  - - [256, 1024, 1, 512, 256, 256, 256, 512]
    - [34, 3.078]
  - - [256, 1024, 1, 1024, 256, 256, 256, 1024]
    - [35, 4.426]
  - - [256, 1024, 1, 2048, 256, 256, 256, 2048]
    - [120, 6.456]
  - - [256, 1024, 1, 4096, 256, 256, 256, 4096]
    - [110, 9.101]
  - - [256, 1024, 1, 8192, 256, 256, 256, 8192]
    - [96, 10.833]
  - - [256, 2048, 1, 128, 256, 256, 256, 128]
    - [26, 1.997]
  - - [256, 2048, 1, 256, 256, 256, 256, 256]
    - [26, 3.433]
  - - [256, 2048, 1, 512, 256, 256, 256, 512]
    - [33, 5.325]
  - - [256, 2048, 1, 1024, 256, 256, 256, 1024]
    - [120, 7.418]
  - - [256, 2048, 1, 2048, 256, 256, 256, 2048]
    - [110, 10.027]
  - - [256, 2048, 1, 4096, 256, 256, 256, 4096]
    - [97, 12.59]
  - - [256, 2048, 1, 8192, 256, 256, 256, 8192]
    - [69, 12.925]
  - - [256, 4096, 1, 128, 256, 256, 256, 128]
    - [109, 3.21]
  - - [256, 4096, 1, 256, 256, 256, 256, 256]
    - [110, 5.511]
  - - [256, 4096, 1, 512, 256, 256, 256, 512]
    - [110, 8.236]
  - - [256, 4096, 1, 1024, 256, 256, 256, 1024]
    - [108, 11.325]
  - - [256, 4096, 1, 2048, 256, 256, 256, 2048]
    - [96, 12.964]
  - - [256, 4096, 1, 4096, 256, 256, 256, 4096]
    - [105, 14.661]
  - - [256, 4096, 1, 8192, 256, 256, 256, 8192]
    - [83, 15.533]
  - - [256, 8192, 1, 128, 256, 256, 256, 128]
    - [20, 4.92]
  - - [256, 8192, 1, 256, 256, 256, 256, 256]
    - [91, 7.63]
  - - [256, 8192, 1, 512, 256, 256, 256, 512]
    - [97, 11.651]
  - - [256, 8192, 1, 1024, 256, 256, 256, 1024]
    - [96, 14.365]
  - - [256, 8192, 1, 2048, 256, 256, 256, 2048]
    - [99, 15.904]
  - - [256, 8192, 1, 4096, 256, 256, 256, 4096]
    - [7, 17.584]
  - - [256, 8192, 1, 8192, 256, 256, 256, 8192]
    - [49, 17.93]
  - - [512, 128, 1, 128, 512, 512, 512, 128]
    - [34, 0.334]
  - - [512, 128, 1, 256, 512, 512, 512, 256]
    - [35, 0.419]
  - - [512, 128, 1, 512, 512, 512, 512, 512]
    - [123, 0.692]
  - - [512, 128, 1, 1024, 512, 512, 512, 1024]
    - [72, 1.236]
  - - [512, 128, 1, 2048, 512, 512, 512, 2048]
    - [124, 2.213]
  - - [512, 128, 1, 4096, 512, 512, 512, 4096]
    - [35, 3.36]
  - - [512, 128, 1, 8192, 512, 512, 512, 8192]
    - [115, 4.813]
  - - [512, 256, 1, 128, 512, 512, 512, 128]
    - [35, 0.645]
  - - [512, 256, 1, 256, 512, 512, 512, 256]
    - [35, 0.793]
  - - [512, 256, 1, 512, 512, 512, 512, 512]
    - [34, 1.43]
  - - [512, 256, 1, 1024, 512, 512, 512, 1024]
    - [124, 2.467]
  - - [512, 256, 1, 2048, 512, 512, 512, 2048]
    - [119, 3.892]
  - - [512, 256, 1, 4096, 512, 512, 512, 4096]
    - [122, 5.84]
  - - [512, 256, 1, 8192, 512, 512, 512, 8192]
    - [33, 7.653]
  - - [512, 512, 1, 128, 512, 512, 512, 128]
    - [33, 1.155]
  - - [512, 512, 1, 256, 512, 512, 512, 256]
    - [34, 1.929]
  - - [512, 512, 1, 512, 512, 512, 512, 512]
    - [34, 3.022]
  - - [512, 512, 1, 1024, 512, 512, 512, 1024]
    - [35, 4.423]
  - - [512, 512, 1, 2048, 512, 512, 512, 2048]
    - [120, 6.487]
  - - [512, 512, 1, 4096, 512, 512, 512, 4096]
    - [114, 9.154]
  - - [512, 512, 1, 8192, 512, 512, 512, 8192]
    - [16, 10.684]
  - - [512, 1024, 1, 128, 512, 512, 512, 128]
    - [28, 2.001]
  - - [512, 1024, 1, 256, 512, 512, 512, 256]
    - [26, 3.424]
  - - [512, 1024, 1, 512, 512, 512, 512, 512]
    - [33, 5.38]
  - - [512, 1024, 1, 1024, 512, 512, 512, 1024]
    - [33, 7.368]
  - - [512, 1024, 1, 2048, 512, 512, 512, 2048]
    - [108, 10.037]
  - - [512, 1024, 1, 4096, 512, 512, 512, 4096]
    - [103, 12.831]
  - - [512, 1024, 1, 8192, 512, 512, 512, 8192]
    - [57, 12.295]
  - - [512, 2048, 1, 128, 512, 512, 512, 128]
    - [23, 3.311]
  - - [512, 2048, 1, 256, 512, 512, 512, 256]
    - [24, 5.505]
  - - [512, 2048, 1, 512, 512, 512, 512, 512]
    - [110, 8.21]
  - - [512, 2048, 1, 1024, 512, 512, 512, 1024]
    - [110, 11.24]
  - - [512, 2048, 1, 2048, 512, 512, 512, 2048]
    - [104, 13.31]
  - - [512, 2048, 1, 4096, 512, 512, 512, 4096]
    - [99, 13.096]
  - - [512, 2048, 1, 8192, 512, 512, 512, 8192]
    - [84, 15.652]
  - - [512, 4096, 1, 128, 512, 512, 512, 128]
    - [101, 4.767]
  - - [512, 4096, 1, 256, 512, 512, 512, 256]
    - [16, 7.812]
  - - [512, 4096, 1, 512, 512, 512, 512, 512]
    - [97, 11.956]
  - - [512, 4096, 1, 1024, 512, 512, 512, 1024]
    - [97, 15.334]
  - - [512, 4096, 1, 2048, 512, 512, 512, 2048]
    - [99, 16.267]
  - - [512, 4096, 1, 4096, 512, 512, 512, 4096]
    - [118, 16.456]
  - - [512, 4096, 1, 8192, 512, 512, 512, 8192]
    - [81, 18.385]
  - - [512, 8192, 1, 128, 512, 512, 512, 128]
    - [67, 5.783]
  - - [512, 8192, 1, 256, 512, 512, 512, 256]
    - [67, 9.304]
  - - [512, 8192, 1, 512, 512, 512, 512, 512]
    - [60, 13.199]
  - - [512, 8192, 1, 1024, 512, 512, 512, 1024]
    - [61, 16.478]
  - - [512, 8192, 1, 2048, 512, 512, 512, 2048]
    - [82, 19.264]
  - - [512, 8192, 1, 4096, 512, 512, 512, 4096]
    - [5, 18.996]
  - - [512, 8192, 1, 8192, 512, 512, 512, 8192]
    - [81, 20.449]
  - - [1024, 128, 1, 128, 1024, 1024, 1024, 128]
    - [34, 0.641]
  - - [1024, 128, 1, 256, 1024, 1024, 1024, 256]
    - [35, 0.795]
  - - [1024, 128, 1, 512, 1024, 1024, 1024, 512]
    - [34, 1.432]
  - - [1024, 128, 1, 1024, 1024, 1024, 1024, 1024]
    - [123, 2.422]
  - - [1024, 128, 1, 2048, 1024, 1024, 1024, 2048]
    - [32, 3.763]
  - - [1024, 128, 1, 4096, 1024, 1024, 1024, 4096]
    - [26, 5.527]
  - - [1024, 128, 1, 8192, 1024, 1024, 1024, 8192]
    - [113, 7.272]
  - - [1024, 256, 1, 128, 1024, 1024, 1024, 128]
    - [30, 1.17]
  - - [1024, 256, 1, 256, 1024, 1024, 1024, 256]
    - [34, 1.934]
  - - [1024, 256, 1, 512, 1024, 1024, 1024, 512]
    - [34, 3.078]
  - - [1024, 256, 1, 1024, 1024, 1024, 1024, 1024]
    - [35, 4.391]
  - - [1024, 256, 1, 2048, 1024, 1024, 1024, 2048]
    - [33, 6.274]
  - - [1024, 256, 1, 4096, 1024, 1024, 1024, 4096]
    - [106, 8.705]
  - - [1024, 256, 1, 8192, 1024, 1024, 1024, 8192]
    - [9, 10.618]
  - - [1024, 512, 1, 128, 1024, 1024, 1024, 128]
    - [29, 2.011]
  - - [1024, 512, 1, 256, 1024, 1024, 1024, 256]
    - [26, 3.419]
  - - [1024, 512, 1, 512, 1024, 1024, 1024, 512]
    - [33, 5.407]
  - - [1024, 512, 1, 1024, 1024, 1024, 1024, 1024]
    - [33, 7.399]
  - - [1024, 512, 1, 2048, 1024, 1024, 1024, 2048]
    - [111, 9.754]
  - - [1024, 512, 1, 4096, 1024, 1024, 1024, 4096]
    - [104, 12.71]
  - - [1024, 512, 1, 8192, 1024, 1024, 1024, 8192]
    - [85, 12.373]
  - - [1024, 1024, 1, 128, 1024, 1024, 1024, 128]
    - [23, 3.294]
  - - [1024, 1024, 1, 256, 1024, 1024, 1024, 256]
    - [22, 5.495]
  - - [1024, 1024, 1, 512, 1024, 1024, 1024, 512]
    - [25, 8.136]
  - - [1024, 1024, 1, 1024, 1024, 1024, 1024, 1024]
    - [110, 11.132]
  - - [1024, 1024, 1, 2048, 1024, 1024, 1024, 2048]
    - [16, 13.396]
  - - [1024, 1024, 1, 4096, 1024, 1024, 1024, 4096]
    - [97, 13.752]
  - - [1024, 1024, 1, 8192, 1024, 1024, 1024, 8192]
    - [85, 15.097]
  - - [1024, 2048, 1, 128, 1024, 1024, 1024, 128]
    - [101, 4.779]
  - - [1024, 2048, 1, 256, 1024, 1024, 1024, 256]
    - [15, 7.813]
  - - [1024, 2048, 1, 512, 1024, 1024, 1024, 512]
    - [104, 11.762]
  - - [1024, 2048, 1, 1024, 1024, 1024, 1024, 1024]
    - [97, 15.622]
  - - [1024, 2048, 1, 2048, 1024, 1024, 1024, 2048]
    - [99, 15.997]
  - - [1024, 2048, 1, 4096, 1024, 1024, 1024, 4096]
    - [82, 17.137]
  - - [1024, 2048, 1, 8192, 1024, 1024, 1024, 8192]
    - [81, 17.982]
  - - [1024, 4096, 1, 128, 1024, 1024, 1024, 128]
    - [68, 6.095]
  - - [1024, 4096, 1, 256, 1024, 1024, 1024, 256]
    - [68, 9.492]
  - - [1024, 4096, 1, 512, 1024, 1024, 1024, 512]
    - [13, 13.073]
  - - [1024, 4096, 1, 1024, 1024, 1024, 1024, 1024]
    - [58, 16.249]
  - - [1024, 4096, 1, 2048, 1024, 1024, 1024, 2048]
    - [84, 18.986]
  - - [1024, 4096, 1, 4096, 1024, 1024, 1024, 4096]
    - [81, 17.945]
  - - [1024, 4096, 1, 8192, 1024, 1024, 1024, 8192]
    - [38, 20.241]
  - - [1024, 8192, 1, 128, 1024, 1024, 1024, 128]
    - [6, 6.389]
  - - [1024, 8192, 1, 256, 1024, 1024, 1024, 256]
    - [53, 10.524]
  - - [1024, 8192, 1, 512, 1024, 1024, 1024, 512]
    - [49, 15.023]
  - - [1024, 8192, 1, 1024, 1024, 1024, 1024, 1024]
    - [49, 19.745]
  - - [1024, 8192, 1, 2048, 1024, 1024, 1024, 2048]
    - [73, 20.032]
  - - [1024, 8192, 1, 4096, 1024, 1024, 1024, 4096]
    - [12, 20.571]
  - - [1024, 8192, 1, 8192, 1024, 1024, 1024, 8192]
    - [46, 22.437]
  - - [2048, 128, 1, 128, 2048, 2048, 2048, 128]
    - [30, 1.178]
  - - [2048, 128, 1, 256, 2048, 2048, 2048, 256]
    - [34, 1.947]
  - - [2048, 128, 1, 512, 2048, 2048, 2048, 512]
    - [34, 3.077]
  - - [2048, 128, 1, 1024, 2048, 2048, 2048, 1024]
    - [125, 4.265]
  - - [2048, 128, 1, 2048, 2048, 2048, 2048, 2048]
    - [122, 6.118]
  - - [2048, 128, 1, 4096, 2048, 2048, 2048, 4096]
    - [111, 8.7]
  - - [2048, 128, 1, 8192, 2048, 2048, 2048, 8192]
    - [101, 10.296]
  - - [2048, 256, 1, 128, 2048, 2048, 2048, 128]
    - [26, 2.031]
  - - [2048, 256, 1, 256, 2048, 2048, 2048, 256]
    - [26, 3.442]
  - - [2048, 256, 1, 512, 2048, 2048, 2048, 512]
    - [33, 5.289]
  - - [2048, 256, 1, 1024, 2048, 2048, 2048, 1024]
    - [122, 7.316]
  - - [2048, 256, 1, 2048, 2048, 2048, 2048, 2048]
    - [112, 9.687]
  - - [2048, 256, 1, 4096, 2048, 2048, 2048, 4096]
    - [102, 12.142]
  - - [2048, 256, 1, 8192, 2048, 2048, 2048, 8192]
    - [89, 12.56]
  - - [2048, 512, 1, 128, 2048, 2048, 2048, 128]
    - [107, 3.241]
  - - [2048, 512, 1, 256, 2048, 2048, 2048, 256]
    - [22, 5.495]
  - - [2048, 512, 1, 512, 2048, 2048, 2048, 512]
    - [108, 8.129]
  - - [2048, 512, 1, 1024, 2048, 2048, 2048, 1024]
    - [111, 10.976]
  - - [2048, 512, 1, 2048, 2048, 2048, 2048, 2048]
    - [114, 13.029]
  - - [2048, 512, 1, 4096, 2048, 2048, 2048, 4096]
    - [90, 13.231]
  - - [2048, 512, 1, 8192, 2048, 2048, 2048, 8192]
    - [86, 15.27]
  - - [2048, 1024, 1, 128, 2048, 2048, 2048, 128]
    - [10, 4.897]
  - - [2048, 1024, 1, 256, 2048, 2048, 2048, 256]
    - [97, 8.186]
  - - [2048, 1024, 1, 512, 2048, 2048, 2048, 512]
    - [104, 11.775]
  - - [2048, 1024, 1, 1024, 2048, 2048, 2048, 1024]
    - [103, 14.681]
  - - [2048, 1024, 1, 2048, 2048, 2048, 2048, 2048]
    - [103, 16.08]
  - - [2048, 1024, 1, 4096, 2048, 2048, 2048, 4096]
    - [84, 16.382]
  - - [2048, 1024, 1, 8192, 2048, 2048, 2048, 8192]
    - [78, 17.864]
  - - [2048, 2048, 1, 128, 2048, 2048, 2048, 128]
    - [66, 5.883]
  - - [2048, 2048, 1, 256, 2048, 2048, 2048, 256]
    - [65, 9.286]
  - - [2048, 2048, 1, 512, 2048, 2048, 2048, 512]
    - [13, 13.185]
  - - [2048, 2048, 1, 1024, 2048, 2048, 2048, 1024]
    - [60, 15.89]
  - - [2048, 2048, 1, 2048, 2048, 2048, 2048, 2048]
    - [88, 18.759]
  - - [2048, 2048, 1, 4096, 2048, 2048, 2048, 4096]
    - [84, 18.078]
  - - [2048, 2048, 1, 8192, 2048, 2048, 2048, 8192]
    - [41, 20.114]
  - - [2048, 4096, 1, 128, 2048, 2048, 2048, 128]
    - [50, 6.428]
  - - [2048, 4096, 1, 256, 2048, 2048, 2048, 256]
    - [50, 10.445]
  - - [2048, 4096, 1, 512, 2048, 2048, 2048, 512]
    - [56, 14.868]
  - - [2048, 4096, 1, 1024, 2048, 2048, 2048, 1024]
    - [49, 19.302]
  - - [2048, 4096, 1, 2048, 2048, 2048, 2048, 2048]
    - [80, 20.115]
  - - [2048, 4096, 1, 4096, 2048, 2048, 2048, 4096]
    - [37, 20.268]
  - - [2048, 4096, 1, 8192, 2048, 2048, 2048, 8192]
    - [37, 22.739]
  - - [2048, 8192, 1, 128, 2048, 2048, 2048, 128]
    - [97, 6.824]
  - - [2048, 8192, 1, 256, 2048, 2048, 2048, 256]
    - [39, 10.563]
  - - [2048, 8192, 1, 512, 2048, 2048, 2048, 512]
    - [38, 14.853]
  - - [2048, 8192, 1, 1024, 2048, 2048, 2048, 1024]
    - [40, 18.783]
  - - [2048, 8192, 1, 2048, 2048, 2048, 2048, 2048]
    - [73, 19.546]
  - - [2048, 8192, 1, 4096, 2048, 2048, 2048, 4096]
    - [38, 21.805]
  - - [2048, 8192, 1, 8192, 2048, 2048, 2048, 8192]
    - [37, 23.856]
  - - [4096, 128, 1, 128, 4096, 4096, 4096, 128]
    - [26, 2.039]
  - - [4096, 128, 1, 256, 4096, 4096, 4096, 256]
    - [26, 3.433]
  - - [4096, 128, 1, 512, 4096, 4096, 4096, 512]
    - [33, 5.303]
  - - [4096, 128, 1, 1024, 4096, 4096, 4096, 1024]
    - [121, 7.206]
  - - [4096, 128, 1, 2048, 4096, 4096, 4096, 2048]
    - [111, 9.468]
  - - [4096, 128, 1, 4096, 4096, 4096, 4096, 4096]
    - [103, 11.89]
  - - [4096, 128, 1, 8192, 4096, 4096, 4096, 8192]
    - [14, 12.762]
  - - [4096, 256, 1, 128, 4096, 4096, 4096, 128]
    - [23, 3.327]
  - - [4096, 256, 1, 256, 4096, 4096, 4096, 256]
    - [22, 5.532]
  - - [4096, 256, 1, 512, 4096, 4096, 4096, 512]
    - [113, 8.132]
  - - [4096, 256, 1, 1024, 4096, 4096, 4096, 1024]
    - [114, 11.049]
  - - [4096, 256, 1, 2048, 4096, 4096, 4096, 2048]
    - [114, 13.271]
  - - [4096, 256, 1, 4096, 4096, 4096, 4096, 4096]
    - [90, 13.969]
  - - [4096, 256, 1, 8192, 4096, 4096, 4096, 8192]
    - [92, 15.761]
  - - [4096, 512, 1, 128, 4096, 4096, 4096, 128]
    - [15, 4.864]
  - - [4096, 512, 1, 256, 4096, 4096, 4096, 256]
    - [15, 8.003]
  - - [4096, 512, 1, 512, 4096, 4096, 4096, 512]
    - [103, 11.836]
  - - [4096, 512, 1, 1024, 4096, 4096, 4096, 1024]
    - [103, 15.278]
  - - [4096, 512, 1, 2048, 4096, 4096, 4096, 2048]
    - [95, 16.403]
  - - [4096, 512, 1, 4096, 4096, 4096, 4096, 4096]
    - [83, 16.706]
  - - [4096, 512, 1, 8192, 4096, 4096, 4096, 8192]
    - [79, 17.846]
  - - [4096, 1024, 1, 128, 4096, 4096, 4096, 128]
    - [64, 6.078]
  - - [4096, 1024, 1, 256, 4096, 4096, 4096, 256]
    - [64, 9.566]
  - - [4096, 1024, 1, 512, 4096, 4096, 4096, 512]
    - [64, 13.041]
  - - [4096, 1024, 1, 1024, 4096, 4096, 4096, 1024]
    - [87, 15.713]
  - - [4096, 1024, 1, 2048, 4096, 4096, 4096, 2048]
    - [87, 18.974]
  - - [4096, 1024, 1, 4096, 4096, 4096, 4096, 4096]
    - [77, 18.162]
  - - [4096, 1024, 1, 8192, 4096, 4096, 4096, 8192]
    - [42, 20.609]
  - - [4096, 2048, 1, 128, 4096, 4096, 4096, 128]
    - [52, 6.394]
  - - [4096, 2048, 1, 256, 4096, 4096, 4096, 256]
    - [5, 10.448]
  - - [4096, 2048, 1, 512, 4096, 4096, 4096, 512]
    - [55, 14.933]
  - - [4096, 2048, 1, 1024, 4096, 4096, 4096, 1024]
    - [55, 18.813]
  - - [4096, 2048, 1, 2048, 4096, 4096, 4096, 2048]
    - [76, 20.101]
  - - [4096, 2048, 1, 4096, 4096, 4096, 4096, 4096]
    - [1, 20.178]
  - - [4096, 2048, 1, 8192, 4096, 4096, 4096, 8192]
    - [3, 23.65]
  - - [4096, 4096, 1, 128, 4096, 4096, 4096, 128]
    - [0, 6.394]
  - - [4096, 4096, 1, 256, 4096, 4096, 4096, 256]
    - [0, 10.429]
  - - [4096, 4096, 1, 512, 4096, 4096, 4096, 512]
    - [36, 14.24]
  - - [4096, 4096, 1, 1024, 4096, 4096, 4096, 1024]
    - [37, 18.362]
  - - [4096, 4096, 1, 2048, 4096, 4096, 4096, 2048]
    - [73, 20.236]
  - - [4096, 4096, 1, 4096, 4096, 4096, 4096, 4096]
    - [44, 23.303]
  - - [4096, 4096, 1, 8192, 4096, 4096, 4096, 8192]
    - [44, 24.111]
  - - [4096, 8192, 1, 128, 4096, 4096, 4096, 128]
    - [17, 5.922]
  - - [4096, 8192, 1, 256, 4096, 4096, 4096, 256]
    - [8, 8.737]
  - - [4096, 8192, 1, 512, 4096, 4096, 4096, 512]
    - [51, 12.95]
  - - [4096, 8192, 1, 1024, 4096, 4096, 4096, 1024]
    - [51, 17.224]
  - - [4096, 8192, 1, 2048, 4096, 4096, 4096, 2048]
    - [37, 21.913]
  - - [4096, 8192, 1, 4096, 4096, 4096, 4096, 4096]
    - [74, 23.769]
  - - [4096, 8192, 1, 8192, 4096, 4096, 4096, 8192]
    - [2, 25.818]
  - - [8192, 128, 1, 128, 8192, 8192, 8192, 128]
    - [21, 3.298]
  - - [8192, 128, 1, 256, 8192, 8192, 8192, 256]
    - [22, 5.457]
  - - [8192, 128, 1, 512, 8192, 8192, 8192, 512]
    - [112, 8.127]
  - - [8192, 128, 1, 1024, 8192, 8192, 8192, 1024]
    - [113, 10.672]
  - - [8192, 128, 1, 2048, 8192, 8192, 8192, 2048]
    - [113, 12.684]
  - - [8192, 128, 1, 4096, 8192, 8192, 8192, 4096]
    - [89, 14.249]
  - - [8192, 128, 1, 8192, 8192, 8192, 8192, 8192]
    - [94, 15.976]
  - - [8192, 256, 1, 128, 8192, 8192, 8192, 128]
    - [70, 4.718]
  - - [8192, 256, 1, 256, 8192, 8192, 8192, 256]
    - [15, 7.697]
  - - [8192, 256, 1, 512, 8192, 8192, 8192, 512]
    - [100, 11.593]
  - - [8192, 256, 1, 1024, 8192, 8192, 8192, 1024]
    - [100, 14.514]
  - - [8192, 256, 1, 2048, 8192, 8192, 8192, 2048]
    - [93, 15.987]
  - - [8192, 256, 1, 4096, 8192, 8192, 8192, 4096]
    - [82, 17.36]
  - - [8192, 256, 1, 8192, 8192, 8192, 8192, 8192]
    - [11, 18.019]
  - - [8192, 512, 1, 128, 8192, 8192, 8192, 128]
    - [63, 5.674]
  - - [8192, 512, 1, 256, 8192, 8192, 8192, 256]
    - [65, 9.1]
  - - [8192, 512, 1, 512, 8192, 8192, 8192, 512]
    - [59, 12.828]
  - - [8192, 512, 1, 1024, 8192, 8192, 8192, 1024]
    - [62, 15.861]
  - - [8192, 512, 1, 2048, 8192, 8192, 8192, 2048]
    - [87, 18.97]
  - - [8192, 512, 1, 4096, 8192, 8192, 8192, 4096]
    - [75, 18.018]
  - - [8192, 512, 1, 8192, 8192, 8192, 8192, 8192]
    - [75, 20.905]
  - - [8192, 1024, 1, 128, 8192, 8192, 8192, 128]
    - [4, 6.412]
  - - [8192, 1024, 1, 256, 8192, 8192, 8192, 256]
    - [51, 10.355]
  - - [8192, 1024, 1, 512, 8192, 8192, 8192, 512]
    - [51, 15.274]
  - - [8192, 1024, 1, 1024, 8192, 8192, 8192, 1024]
    - [51, 19.287]
  - - [8192, 1024, 1, 2048, 8192, 8192, 8192, 2048]
    - [79, 20.024]
  - - [8192, 1024, 1, 4096, 8192, 8192, 8192, 4096]
    - [48, 20.323]
  - - [8192, 1024, 1, 8192, 8192, 8192, 8192, 8192]
    - [40, 22.884]
  - - [8192, 2048, 1, 128, 8192, 8192, 8192, 128]
    - [3, 6.353]
  - - [8192, 2048, 1, 256, 8192, 8192, 8192, 256]
    - [45, 10.235]
  - - [8192, 2048, 1, 512, 8192, 8192, 8192, 512]
    - [44, 14.727]
  - - [8192, 2048, 1, 1024, 8192, 8192, 8192, 1024]
    - [44, 19.028]
  - - [8192, 2048, 1, 2048, 8192, 8192, 8192, 2048]
    - [48, 20.203]
  - - [8192, 2048, 1, 4096, 8192, 8192, 8192, 4096]
    - [37, 23.19]
  - - [8192, 2048, 1, 8192, 8192, 8192, 8192, 8192]
    - [37, 24.11]
  - - [8192, 4096, 1, 128, 8192, 8192, 8192, 128]
    - [17, 5.891]
  - - [8192, 4096, 1, 256, 8192, 8192, 8192, 256]
    - [7, 8.691]
  - - [8192, 4096, 1, 512, 8192, 8192, 8192, 512]
    - [49, 12.691]
  - - [8192, 4096, 1, 1024, 8192, 8192, 8192, 1024]
    - [54, 17.398]
  - - [8192, 4096, 1, 2048, 8192, 8192, 8192, 2048]
    - [38, 22.114]
  - - [8192, 4096, 1, 4096, 8192, 8192, 8192, 4096]
    - [38, 24.255]
  - - [8192, 4096, 1, 8192, 8192, 8192, 8192, 8192]
    - [39, 26.421]
  - - [8192, 8192, 1, 128, 8192, 8192, 8192, 128]
    - [47, 5.527]
  - - [8192, 8192, 1, 256, 8192, 8192, 8192, 256]
    - [48, 9.021]
  - - [8192, 8192, 1, 512, 8192, 8192, 8192, 512]
    - [51, 13.987]
  - - [8192, 8192, 1, 1024, 8192, 8192, 8192, 1024]
    - [52, 18.906]
  - - [8192, 8192, 1, 2048, 8192, 8192, 8192, 2048]
    - [41, 23.409]
  - - [8192, 8192, 1, 4096, 8192, 8192, 8192, 4096]
    - [42, 26.348]
  - - [8192, 8192, 1, 8192, 8192, 8192, 8192, 8192]
    - [43, 27.144]
  - - [1, 1, 1, 32, 1, 1, 1, 32]
    - [126, 0.0]
- null
- null
- DeviceEfficiency
- GridBased
