library/src/amd_detail/rocblaslt/src/Tensile/Logic/streamk/gfx942a/aquavanjaram942_Cijk_Alik_Bljk_BSS_BH_UserArgs.yaml
- {MinimumRequiredVersion: 4.33.0}
- aquavanjaram942
- gfx942
- [Device 0049, Device 0050]
    SolutionIndex: 0
    SolutionNameMin: Cijk_Alik_Bljk_BSS_BH_UserArgs_MT32x32x32_MI16x16x1_SN_LDSB0_CLR1_GSU0_GSUC0_GSUWGMRR0_K1_LBSPPA128_LBSPPB128_MIWT1_1_PLR1_SU32_SUM0_SUS256_SKXCCM0_VWA1_VWB1_WGM1_WGMXCC1_WGMXCCGn1
    SolutionIndex: 1
    SolutionNameMin: Cijk_Alik_Bljk_BSS_BH_UserArgs_MT128x128x64_MI16x16x1_SN_LDSB1_CLR1_GSU0_GSUC0_GSUWGMRR0_K1_LBSPPA512_LBSPPB128_MIWT4_4_PLR1_SU32_SUM0_SUS256_SKXCCM0_VWA4_VWB1_WGM1_WGMXCC1_WGMXCCGn1
    SolutionIndex: 2
    SolutionNameMin: Cijk_Alik_Bljk_BSS_BH_UserArgs_MT128x128x64_MI16x16x1_SN_LDSB1_CLR1_GSU0_GSUC0_GSUWGMRR0_K1_LBSPPA128_LBSPPB256_MIWT4_4_PLR1_SU32_SUM0_SUS256_SKXCCM0_VWA1_VWB2_WGM1_WGMXCC1_WGMXCCGn1
    SolutionIndex: 3
    SolutionNameMin: Cijk_Alik_Bljk_BSS_BH_UserArgs_MT128x128x64_MI16x16x1_SN_LDSB1_CLR1_GSU0_GSUC0_GSUWGMRR0_K1_LBSPPA512_LBSPPB512_MIWT4_4_PLR1_SU32_SUM0_SUS256_SKXCCM0_VWA4_VWB4_WGM1_WGMXCC1_WGMXCCGn1
    SolutionIndex: 4
    SolutionNameMin: Cijk_Alik_Bljk_BSS_BH_UserArgs_MT128x128x64_MI16x16x1_SN_LDSB1_CLR1_GSU0_GSUC0_GSUWGMRR0_K1_LBSPPA512_LBSPPB256_MIWT4_4_PLR1_SU32_SUM0_SUS256_SKXCCM0_VWA4_VWB2_WGM4_WGMXCC1_WGMXCCGn1
    SolutionIndex: 5
    SolutionNameMin: Cijk_Alik_Bljk_BSS_BH_UserArgs_MT128x128x64_MI16x16x1_SN_LDSB1_CLR1_GSU0_GSUC0_GSUWGMRR0_K1_LBSPPA512_LBSPPB512_MIWT4_4_PLR1_SU32_SUM0_SUS256_SKXCCM0_VWA4_VWB4_WGM4_WGMXCC1_WGMXCCGn1
    SolutionIndex: 6
    SolutionNameMin: Cijk_Alik_Bljk_BSS_BH_UserArgs_MT64x128x64_MI16x16x1_SN_LDSB1_CLR1_GSU0_GSUC0_GSUWGMRR0_K1_LBSPPA128_LBSPPB256_MIWT2_4_PLR1_SU32_SUM0_SUS256_SKXCCM0_VWA1_VWB2_WGM1_WGMXCC1_WGMXCCGn1
    SolutionIndex: 7
    SolutionNameMin: Cijk_Alik_Bljk_BSS_BH_UserArgs_MT64x128x64_MI16x16x1_SN_LDSB1_CLR1_GSU0_GSUC0_GSUWGMRR0_K1_LBSPPA256_LBSPPB256_MIWT2_4_PLR1_SU32_SUM0_SUS256_SKXCCM0_VWA2_VWB2_WGM1_WGMXCC1_WGMXCCGn1
    SolutionIndex: 8
    SolutionNameMin: Cijk_Alik_Bljk_BSS_BH_UserArgs_MT64x128x64_MI16x16x1_SN_LDSB1_CLR1_GSU0_GSUC0_GSUWGMRR0_K1_LBSPPA128_LBSPPB512_MIWT2_4_PLR1_SU32_SUM0_SUS256_SKXCCM0_VWA1_VWB4_WGM1_WGMXCC1_WGMXCCGn1
    SolutionIndex: 9
    SolutionNameMin: Cijk_Alik_Bljk_BSS_BH_UserArgs_MT64x128x64_MI16x16x1_SN_LDSB1_CLR1_GSU0_GSUC0_GSUWGMRR0_K1_LBSPPA128_LBSPPB128_MIWT2_4_PLR1_SU32_SUM0_SUS256_SKXCCM0_VWA1_VWB1_WGM4_WGMXCC1_WGMXCCGn1
    SolutionIndex: 10
    SolutionNameMin: Cijk_Alik_Bljk_BSS_BH_UserArgs_MT64x128x64_MI16x16x1_SN_LDSB1_CLR1_GSU0_GSUC0_GSUWGMRR0_K1_LBSPPA128_LBSPPB256_MIWT2_4_PLR1_SU32_SUM0_SUS256_SKXCCM0_VWA1_VWB2_WGM4_WGMXCC1_WGMXCCGn1
    SolutionIndex: 11
    SolutionNameMin: Cijk_Alik_Bljk_BSS_BH_UserArgs_MT64x128x64_MI16x16x1_SN_LDSB1_CLR1_GSU0_GSUC0_GSUWGMRR0_K1_LBSPPA128_LBSPPB128_MIWT2_4_PLR1_SU32_SUM0_SUS256_SKXCCM0_VWA1_VWB1_WGM8_WGMXCC1_WGMXCCGn1
    SolutionIndex: 12
    SolutionNameMin: Cijk_Alik_Bljk_BSS_BH_UserArgs_MT64x128x64_MI16x16x1_SN_LDSB1_CLR1_GSU0_GSUC0_GSUWGMRR0_K1_LBSPPA128_LBSPPB512_MIWT2_4_PLR1_SU32_SUM0_SUS256_SKXCCM0_VWA1_VWB4_WGM8_WGMXCC1_WGMXCCGn1
    SolutionIndex: 13
    SolutionNameMin: Cijk_Alik_Bljk_BSS_BH_UserArgs_MT128x64x64_MI16x16x1_SN_LDSB1_CLR1_GSU0_GSUC0_GSUWGMRR0_K1_LBSPPA512_LBSPPB128_MIWT4_2_PLR1_SU32_SUM0_SUS256_SKXCCM0_VWA4_VWB1_WGM1_WGMXCC1_WGMXCCGn1
    SolutionIndex: 14
    SolutionNameMin: Cijk_Alik_Bljk_BSS_BH_UserArgs_MT128x64x64_MI16x16x1_SN_LDSB1_CLR1_GSU0_GSUC0_GSUWGMRR0_K1_LBSPPA512_LBSPPB256_MIWT4_2_PLR1_SU32_SUM0_SUS256_SKXCCM0_VWA4_VWB2_WGM1_WGMXCC1_WGMXCCGn1
    SolutionIndex: 15
    SolutionNameMin: Cijk_Alik_Bljk_BSS_BH_UserArgs_MT128x64x64_MI16x16x1_SN_LDSB1_CLR1_GSU0_GSUC0_GSUWGMRR0_K1_LBSPPA512_LBSPPB128_MIWT4_2_PLR2_SU32_SUM0_SUS256_SKXCCM0_VWA4_VWB1_WGM1_WGMXCC1_WGMXCCGn1
    SolutionIndex: 16
    SolutionNameMin: Cijk_Alik_Bljk_BSS_BH_UserArgs_MT128x64x64_MI16x16x1_SN_LDSB1_CLR1_GSU0_GSUC0_GSUWGMRR0_K1_LBSPPA512_LBSPPB128_MIWT4_2_PLR1_SU32_SUM0_SUS256_SKXCCM0_VWA4_VWB1_WGM4_WGMXCC1_WGMXCCGn1
    SolutionIndex: 17
    SolutionNameMin: Cijk_Alik_Bljk_BSS_BH_UserArgs_MT128x64x64_MI16x16x1_SN_LDSB1_CLR1_GSU0_GSUC0_GSUWGMRR0_K1_LBSPPA128_LBSPPB256_MIWT4_2_PLR1_SU32_SUM0_SUS256_SKXCCM0_VWA1_VWB2_WGM4_WGMXCC1_WGMXCCGn1
    SolutionIndex: 18
    SolutionNameMin: Cijk_Alik_Bljk_BSS_BH_UserArgs_MT128x64x64_MI16x16x1_SN_LDSB1_CLR1_GSU0_GSUC0_GSUWGMRR0_K1_LBSPPA512_LBSPPB256_MIWT4_2_PLR1_SU32_SUM0_SUS256_SKXCCM0_VWA4_VWB2_WGM4_WGMXCC1_WGMXCCGn1
    SolutionIndex: 19
    SolutionNameMin: Cijk_Alik_Bljk_BSS_BH_UserArgs_MT128x64x64_MI16x16x1_SN_LDSB1_CLR1_GSU0_GSUC0_GSUWGMRR0_K1_LBSPPA512_LBSPPB128_MIWT4_2_PLR2_SU32_SUM0_SUS256_SKXCCM0_VWA4_VWB1_WGM4_WGMXCC1_WGMXCCGn1
    SolutionIndex: 20
    SolutionNameMin: Cijk_Alik_Bljk_BSS_BH_UserArgs_MT128x64x64_MI16x16x1_SN_LDSB1_CLR1_GSU0_GSUC0_GSUWGMRR0_K1_LBSPPA512_LBSPPB128_MIWT4_2_PLR1_SU32_SUM0_SUS256_SKXCCM0_VWA4_VWB1_WGM8_WGMXCC1_WGMXCCGn1
    SolutionIndex: 21
    SolutionNameMin: Cijk_Alik_Bljk_BSS_BH_UserArgs_MT128x64x64_MI16x16x1_SN_LDSB1_CLR1_GSU0_GSUC0_GSUWGMRR0_K1_LBSPPA512_LBSPPB256_MIWT4_2_PLR1_SU32_SUM0_SUS256_SKXCCM0_VWA4_VWB2_WGM8_WGMXCC1_WGMXCCGn1
    SolutionIndex: 22
    SolutionNameMin: Cijk_Alik_Bljk_BSS_BH_UserArgs_MT64x64x64_MI16x16x1_SN_LDSB1_CLR1_GSU0_GSUC0_GSUWGMRR0_K1_LBSPPA128_LBSPPB128_MIWT2_2_PLR1_SU32_SUM0_SUS256_SKXCCM0_VWA1_VWB1_WGM1_WGMXCC1_WGMXCCGn1
    SolutionIndex: 23
    SolutionNameMin: Cijk_Alik_Bljk_BSS_BH_UserArgs_MT64x64x64_MI16x16x1_SN_LDSB1_CLR1_GSU0_GSUC0_GSUWGMRR0_K1_LBSPPA128_LBSPPB256_MIWT2_2_PLR1_SU32_SUM0_SUS256_SKXCCM0_VWA1_VWB2_WGM1_WGMXCC1_WGMXCCGn1
    SolutionIndex: 24
    SolutionNameMin: Cijk_Alik_Bljk_BSS_BH_UserArgs_MT64x64x64_MI16x16x1_SN_LDSB1_CLR1_GSU0_GSUC0_GSUWGMRR0_K1_LBSPPA128_LBSPPB256_MIWT2_2_PLR1_SU32_SUM0_SUS256_SKXCCM0_VWA1_VWB2_WGM4_WGMXCC1_WGMXCCGn1
    SolutionIndex: 25
    SolutionNameMin: Cijk_Alik_Bljk_BSS_BH_UserArgs_MT64x64x64_MI16x16x1_SN_LDSB1_CLR1_GSU0_GSUC0_GSUWGMRR0_K1_LBSPPA128_LBSPPB256_MIWT2_2_PLR1_SU32_SUM0_SUS256_SKXCCM0_VWA1_VWB2_WGM8_WGMXCC1_WGMXCCGn1
    SolutionIndex: 26
    SolutionNameMin: Cijk_Alik_Bljk_BSS_BH_UserArgs_MT32x64x64_MI16x16x1_SN_LDSB0_CLR1_GSU0_GSUC0_GSUWGMRR0_K1_LBSPPA128_LBSPPB128_MIWT1_2_PLR1_SU32_SUM0_SUS256_SKXCCM0_VWA1_VWB1_WGM1_WGMXCC1_WGMXCCGn1
    SolutionIndex: 27
    SolutionNameMin: Cijk_Alik_Bljk_BSS_BH_UserArgs_MT32x64x64_MI16x16x1_SN_LDSB0_CLR1_GSU0_GSUC0_GSUWGMRR0_K1_LBSPPA128_LBSPPB256_MIWT1_2_PLR1_SU32_SUM0_SUS256_SKXCCM0_VWA1_VWB2_WGM1_WGMXCC1_WGMXCCGn1
    SolutionIndex: 28
    SolutionNameMin: Cijk_Alik_Bljk_BSS_BH_UserArgs_MT64x32x64_MI16x16x1_SN_LDSB0_CLR1_GSU0_GSUC0_GSUWGMRR0_K1_LBSPPA128_LBSPPB128_MIWT2_1_PLR1_SU32_SUM0_SUS256_SKXCCM0_VWA1_VWB1_WGM1_WGMXCC1_WGMXCCGn1
    SolutionIndex: 29
    SolutionNameMin: Cijk_Alik_Bljk_BSS_BH_UserArgs_MT64x32x64_MI16x16x1_SN_LDSB0_CLR1_GSU0_GSUC0_GSUWGMRR0_K1_LBSPPA128_LBSPPB128_MIWT2_1_PLR2_SU32_SUM0_SUS256_SKXCCM0_VWA1_VWB1_WGM1_WGMXCC1_WGMXCCGn1
    SolutionIndex: 30
    SolutionNameMin: Cijk_Alik_Bljk_BSS_BH_UserArgs_MT64x32x64_MI16x16x1_SN_LDSB0_CLR1_GSU0_GSUC0_GSUWGMRR0_K1_LBSPPA256_LBSPPB128_MIWT2_1_PLR2_SU32_SUM0_SUS256_SKXCCM0_VWA2_VWB1_WGM1_WGMXCC1_WGMXCCGn1
    SolutionIndex: 31
    SolutionNameMin: Cijk_Alik_Bljk_BSS_BH_UserArgs_MT32x32x64_MI16x16x1_SN_LDSB0_CLR1_GSU0_GSUC0_GSUWGMRR0_K1_LBSPPA128_LBSPPB128_MIWT1_1_PLR1_SU32_SUM0_SUS256_SKXCCM0_VWA1_VWB1_WGM1_WGMXCC1_WGMXCCGn1
    SolutionIndex: 32
    SolutionNameMin: Cijk_Alik_Bljk_BSS_BH_UserArgs_MT32x64x128_MI16x16x1_SN_LDSB1_CLR1_GSU0_GSUC0_GSUWGMRR0_K1_LBSPPA256_LBSPPB512_MIWT1_2_PLR1_SU32_SUM0_SUS256_SKXCCM0_VWA1_VWB2_WGM1_WGMXCC1_WGMXCCGn1
    SolutionIndex: 33
    SolutionNameMin: Cijk_Alik_Bljk_BSS_BH_UserArgs_MT32x64x128_MI16x16x1_SN_LDSB1_CLR1_GSU0_GSUC0_GSUWGMRR0_K1_LBSPPA256_LBSPPB512_MIWT1_2_PLR2_SU32_SUM0_SUS256_SKXCCM0_VWA1_VWB2_WGM1_WGMXCC1_WGMXCCGn1
    SolutionIndex: 34
    SolutionNameMin: Cijk_Alik_Bljk_BSS_BH_UserArgs_MT64x32x128_MI16x16x1_SN_LDSB1_CLR1_GSU0_GSUC0_GSUWGMRR0_K1_LBSPPA256_LBSPPB256_MIWT2_1_PLR1_SU32_SUM0_SUS256_SKXCCM0_VWA1_VWB1_WGM1_WGMXCC1_WGMXCCGn1
    SolutionIndex: 35
    SolutionNameMin: Cijk_Alik_Bljk_BSS_BH_UserArgs_MT64x32x128_MI16x16x1_SN_LDSB1_CLR1_GSU0_GSUC0_GSUWGMRR0_K1_LBSPPA256_LBSPPB256_MIWT2_1_PLR2_SU32_SUM0_SUS256_SKXCCM0_VWA1_VWB1_WGM1_WGMXCC1_WGMXCCGn1
    SolutionIndex: 36
    SolutionNameMin: Cijk_Alik_Bljk_BSS_BH_UserArgs_MT32x32x128_MI16x16x1_SN_LDSB1_CLR1_GSU0_GSUC0_GSUWGMRR0_K1_LBSPPA256_LBSPPB256_MIWT1_1_PLR1_SU32_SUM0_SUS256_SKXCCM0_VWA1_VWB1_WGM1_WGMXCC1_WGMXCCGn1
    SolutionIndex: 37
    SolutionNameMin: Cijk_Alik_Bljk_BSS_BH_UserArgs_MT32x32x128_MI16x16x1_SN_LDSB1_CLR1_GSU0_GSUC0_GSUWGMRR0_K1_LBSPPA256_LBSPPB256_MIWT1_1_PLR2_SU32_SUM0_SUS256_SKXCCM0_VWA1_VWB1_WGM1_WGMXCC1_WGMXCCGn1
    SolutionIndex: 38
    SolutionNameMin: Cijk_Alik_Bljk_BSS_BH_UserArgs_MT32x32x128_MI16x16x1_SN_LDSB1_CLR1_GSU0_GSUC0_GSUWGMRR0_K1_LBSPPA256_LBSPPB256_MIWT1_1_PLR1_SU32_SUM0_SUS256_SKXCCM0_VWA1_VWB1_WGM4_WGMXCC1_WGMXCCGn1
    SolutionIndex: 39
    SolutionNameMin: Cijk_Alik_Bljk_BSS_BH_UserArgs_MT128x128x32_MI16x16x1_SN_LDSB1_CLR1_GSU0_GSUC0_GSUWGMRR0_K1_LBSPPA256_LBSPPB128_MIWT4_4_PLR1_SU32_SUM0_SUS256_SKXCCM6_VWA4_VWB2_WGM1_WGMXCC1_WGMXCCGn1
    SolutionIndex: 40
    SolutionNameMin: Cijk_Alik_Bljk_BSS_BH_UserArgs_MT128x128x32_MI16x16x1_SN_LDSB1_CLR1_GSU0_GSUC0_GSUWGMRR0_K1_LBSPPA128_LBSPPB128_MIWT4_4_PLR1_SU32_SUM0_SUS256_SKXCCM6_VWA1_VWB1_WGM8_WGMXCC1_WGMXCCGn1
    SolutionIndex: 41
    SolutionNameMin: Cijk_Alik_Bljk_BSS_BH_UserArgs_MT128x128x32_MI16x16x1_SN_LDSB1_CLR1_GSU0_GSUC0_GSUWGMRR0_K1_LBSPPA256_LBSPPB128_MIWT4_4_PLR1_SU32_SUM0_SUS256_SKXCCM6_VWA4_VWB1_WGM8_WGMXCC1_WGMXCCGn1
    SolutionIndex: 42
    SolutionNameMin: Cijk_Alik_Bljk_BSS_BH_UserArgs_MT128x128x32_MI16x16x1_SN_LDSB1_CLR1_GSU0_GSUC0_GSUWGMRR0_K1_LBSPPA128_LBSPPB128_MIWT4_4_PLR1_SU32_SUM0_SUS256_SKXCCM6_VWA1_VWB2_WGM8_WGMXCC1_WGMXCCGn1
    SolutionIndex: 43
    SolutionNameMin: Cijk_Alik_Bljk_BSS_BH_UserArgs_MT128x128x32_MI16x16x1_SN_LDSB1_CLR1_GSU0_GSUC0_GSUWGMRR0_K1_LBSPPA256_LBSPPB128_MIWT4_4_PLR1_SU32_SUM0_SUS256_SKXCCM6_VWA4_VWB2_WGM8_WGMXCC1_WGMXCCGn1
    SolutionIndex: 44
    SolutionNameMin: Cijk_Alik_Bljk_BSS_BH_UserArgs_MT128x128x32_MI16x16x1_SN_LDSB1_CLR1_GSU0_GSUC0_GSUWGMRR0_K1_LBSPPA128_LBSPPB256_MIWT4_4_PLR1_SU32_SUM0_SUS256_SKXCCM6_VWA1_VWB4_WGM8_WGMXCC1_WGMXCCGn1
    SolutionIndex: 45
    SolutionNameMin: Cijk_Alik_Bljk_BSS_BH_UserArgs_MT128x128x32_MI16x16x1_SN_LDSB1_CLR1_GSU0_GSUC0_GSUWGMRR0_K1_LBSPPA256_LBSPPB256_MIWT4_4_PLR1_SU32_SUM0_SUS256_SKXCCM6_VWA4_VWB4_WGM8_WGMXCC1_WGMXCCGn1
    SolutionIndex: 46
    SolutionNameMin: Cijk_Alik_Bljk_BSS_BH_UserArgs_MT32x32x32_MI16x16x1_SN_LDSB0_CLR0_GSU0_GSUC0_GSUWGMRR0_K1_LBSPPA128_LBSPPB128_MIWT1_1_PLR0_SU32_SUM0_SUS256_SKXCCM6_VWA1_VWB1_WGM1_WGMXCC1_WGMXCCGn1
    SolutionIndex: 47
    SolutionNameMin: Cijk_Alik_Bljk_BSS_BH_UserArgs_MT256x64x64_MI16x16x1_SN_LDSB1_CLR1_GSU0_GSUC0_GSUWGMRR0_K1_LBSPPA512_LBSPPB256_MIWT8_2_PLR1_SU32_SUM0_SUS256_SKXCCM6_VWA4_VWB2_WGM4_WGMXCC1_WGMXCCGn1
    SolutionIndex: 48
    SolutionNameMin: Cijk_Alik_Bljk_BSS_BH_UserArgs_MT128x128x64_MI16x16x1_SN_LDSB1_CLR1_GSU0_GSUC0_GSUWGMRR0_K1_LBSPPA128_LBSPPB128_MIWT4_4_PLR1_SU32_SUM0_SUS256_SKXCCM6_VWA1_VWB1_WGM1_WGMXCC1_WGMXCCGn1
    SolutionIndex: 49
    SolutionNameMin: Cijk_Alik_Bljk_BSS_BH_UserArgs_MT128x128x64_MI16x16x1_SN_LDSB1_CLR1_GSU0_GSUC0_GSUWGMRR0_K1_LBSPPA512_LBSPPB128_MIWT4_4_PLR1_SU32_SUM0_SUS256_SKXCCM6_VWA4_VWB1_WGM1_WGMXCC1_WGMXCCGn1
    SolutionIndex: 50
    SolutionNameMin: Cijk_Alik_Bljk_BSS_BH_UserArgs_MT128x128x64_MI16x16x1_SN_LDSB1_CLR1_GSU0_GSUC0_GSUWGMRR0_K1_LBSPPA128_LBSPPB256_MIWT4_4_PLR1_SU32_SUM0_SUS256_SKXCCM6_VWA1_VWB2_WGM1_WGMXCC1_WGMXCCGn1
    SolutionIndex: 51
    SolutionNameMin: Cijk_Alik_Bljk_BSS_BH_UserArgs_MT128x128x64_MI16x16x1_SN_LDSB1_CLR1_GSU0_GSUC0_GSUWGMRR0_K1_LBSPPA512_LBSPPB256_MIWT4_4_PLR1_SU32_SUM0_SUS256_SKXCCM6_VWA4_VWB2_WGM1_WGMXCC1_WGMXCCGn1
    SolutionIndex: 52
    SolutionNameMin: Cijk_Alik_Bljk_BSS_BH_UserArgs_MT128x128x64_MI16x16x1_SN_LDSB1_CLR1_GSU0_GSUC0_GSUWGMRR0_K1_LBSPPA128_LBSPPB512_MIWT4_4_PLR1_SU32_SUM0_SUS256_SKXCCM6_VWA1_VWB4_WGM1_WGMXCC1_WGMXCCGn1
    SolutionIndex: 53
    SolutionNameMin: Cijk_Alik_Bljk_BSS_BH_UserArgs_MT128x128x64_MI16x16x1_SN_LDSB1_CLR1_GSU0_GSUC0_GSUWGMRR0_K1_LBSPPA512_LBSPPB512_MIWT4_4_PLR1_SU32_SUM0_SUS256_SKXCCM6_VWA4_VWB4_WGM1_WGMXCC1_WGMXCCGn1
    SolutionIndex: 54
    SolutionNameMin: Cijk_Alik_Bljk_BSS_BH_UserArgs_MT128x128x64_MI16x16x1_SN_LDSB1_CLR1_GSU0_GSUC0_GSUWGMRR0_K1_LBSPPA128_LBSPPB128_MIWT4_4_PLR1_SU32_SUM0_SUS256_SKXCCM6_VWA1_VWB1_WGM4_WGMXCC1_WGMXCCGn1
    SolutionIndex: 55
    SolutionNameMin: Cijk_Alik_Bljk_BSS_BH_UserArgs_MT128x128x64_MI16x16x1_SN_LDSB1_CLR1_GSU0_GSUC0_GSUWGMRR0_K1_LBSPPA256_LBSPPB128_MIWT4_4_PLR1_SU32_SUM0_SUS256_SKXCCM6_VWA2_VWB1_WGM4_WGMXCC1_WGMXCCGn1
    SolutionIndex: 56
    SolutionNameMin: Cijk_Alik_Bljk_BSS_BH_UserArgs_MT128x128x64_MI16x16x1_SN_LDSB1_CLR1_GSU0_GSUC0_GSUWGMRR0_K1_LBSPPA512_LBSPPB128_MIWT4_4_PLR1_SU32_SUM0_SUS256_SKXCCM6_VWA4_VWB1_WGM4_WGMXCC1_WGMXCCGn1
    SolutionIndex: 57
    SolutionNameMin: Cijk_Alik_Bljk_BSS_BH_UserArgs_MT128x128x64_MI16x16x1_SN_LDSB1_CLR1_GSU0_GSUC0_GSUWGMRR0_K1_LBSPPA128_LBSPPB256_MIWT4_4_PLR1_SU32_SUM0_SUS256_SKXCCM6_VWA1_VWB2_WGM4_WGMXCC1_WGMXCCGn1
    SolutionIndex: 58
    SolutionNameMin: Cijk_Alik_Bljk_BSS_BH_UserArgs_MT128x128x64_MI16x16x1_SN_LDSB1_CLR1_GSU0_GSUC0_GSUWGMRR0_K1_LBSPPA512_LBSPPB256_MIWT4_4_PLR1_SU32_SUM0_SUS256_SKXCCM6_VWA4_VWB2_WGM4_WGMXCC1_WGMXCCGn1
    SolutionIndex: 59
    SolutionNameMin: Cijk_Alik_Bljk_BSS_BH_UserArgs_MT128x128x64_MI16x16x1_SN_LDSB1_CLR1_GSU0_GSUC0_GSUWGMRR0_K1_LBSPPA128_LBSPPB512_MIWT4_4_PLR1_SU32_SUM0_SUS256_SKXCCM6_VWA1_VWB4_WGM4_WGMXCC1_WGMXCCGn1
    SolutionIndex: 60
    SolutionNameMin: Cijk_Alik_Bljk_BSS_BH_UserArgs_MT128x128x64_MI16x16x1_SN_LDSB1_CLR1_GSU0_GSUC0_GSUWGMRR0_K1_LBSPPA128_LBSPPB128_MIWT4_4_PLR1_SU32_SUM0_SUS256_SKXCCM6_VWA1_VWB1_WGM8_WGMXCC1_WGMXCCGn1
    SolutionIndex: 61
    SolutionNameMin: Cijk_Alik_Bljk_BSS_BH_UserArgs_MT128x128x64_MI16x16x1_SN_LDSB1_CLR1_GSU0_GSUC0_GSUWGMRR0_K1_LBSPPA512_LBSPPB128_MIWT4_4_PLR1_SU32_SUM0_SUS256_SKXCCM6_VWA4_VWB1_WGM8_WGMXCC1_WGMXCCGn1
    SolutionIndex: 62
    SolutionNameMin: Cijk_Alik_Bljk_BSS_BH_UserArgs_MT128x128x64_MI16x16x1_SN_LDSB1_CLR1_GSU0_GSUC0_GSUWGMRR0_K1_LBSPPA256_LBSPPB256_MIWT4_4_PLR1_SU32_SUM0_SUS256_SKXCCM6_VWA2_VWB2_WGM8_WGMXCC1_WGMXCCGn1
    SolutionIndex: 63
    SolutionNameMin: Cijk_Alik_Bljk_BSS_BH_UserArgs_MT128x128x64_MI16x16x1_SN_LDSB1_CLR1_GSU0_GSUC0_GSUWGMRR0_K1_LBSPPA512_LBSPPB256_MIWT4_4_PLR1_SU32_SUM0_SUS256_SKXCCM6_VWA4_VWB2_WGM8_WGMXCC1_WGMXCCGn1
    SolutionIndex: 64
    SolutionNameMin: Cijk_Alik_Bljk_BSS_BH_UserArgs_MT128x128x64_MI16x16x1_SN_LDSB1_CLR1_GSU0_GSUC0_GSUWGMRR0_K1_LBSPPA128_LBSPPB512_MIWT4_4_PLR1_SU32_SUM0_SUS256_SKXCCM6_VWA1_VWB4_WGM8_WGMXCC1_WGMXCCGn1
    SolutionIndex: 65
    SolutionNameMin: Cijk_Alik_Bljk_BSS_BH_UserArgs_MT128x128x64_MI16x16x1_SN_LDSB1_CLR1_GSU0_GSUC0_GSUWGMRR0_K1_LBSPPA512_LBSPPB512_MIWT4_4_PLR1_SU32_SUM0_SUS256_SKXCCM6_VWA4_VWB4_WGM8_WGMXCC1_WGMXCCGn1
    SolutionIndex: 66
    SolutionNameMin: Cijk_Alik_Bljk_BSS_BH_UserArgs_MT64x128x64_MI16x16x1_SN_LDSB1_CLR1_GSU0_GSUC0_GSUWGMRR0_K1_LBSPPA128_LBSPPB128_MIWT2_4_PLR1_SU32_SUM0_SUS256_SKXCCM6_VWA1_VWB1_WGM1_WGMXCC1_WGMXCCGn1
    SolutionIndex: 67
    SolutionNameMin: Cijk_Alik_Bljk_BSS_BH_UserArgs_MT64x128x64_MI16x16x1_SN_LDSB1_CLR1_GSU0_GSUC0_GSUWGMRR0_K1_LBSPPA128_LBSPPB256_MIWT2_4_PLR1_SU32_SUM0_SUS256_SKXCCM6_VWA1_VWB2_WGM1_WGMXCC1_WGMXCCGn1
    SolutionIndex: 68
    SolutionNameMin: Cijk_Alik_Bljk_BSS_BH_UserArgs_MT64x128x64_MI16x16x1_SN_LDSB1_CLR1_GSU0_GSUC0_GSUWGMRR0_K1_LBSPPA128_LBSPPB512_MIWT2_4_PLR1_SU32_SUM0_SUS256_SKXCCM6_VWA1_VWB4_WGM1_WGMXCC1_WGMXCCGn1
    SolutionIndex: 69
    SolutionNameMin: Cijk_Alik_Bljk_BSS_BH_UserArgs_MT64x128x64_MI16x16x1_SN_LDSB1_CLR1_GSU0_GSUC0_GSUWGMRR0_K1_LBSPPA128_LBSPPB512_MIWT2_4_PLR2_SU32_SUM0_SUS256_SKXCCM6_VWA1_VWB4_WGM1_WGMXCC1_WGMXCCGn1
    SolutionIndex: 70
    SolutionNameMin: Cijk_Alik_Bljk_BSS_BH_UserArgs_MT64x128x64_MI16x16x1_SN_LDSB1_CLR1_GSU0_GSUC0_GSUWGMRR0_K1_LBSPPA128_LBSPPB128_MIWT2_4_PLR1_SU32_SUM0_SUS256_SKXCCM6_VWA1_VWB1_WGM4_WGMXCC1_WGMXCCGn1
    SolutionIndex: 71
    SolutionNameMin: Cijk_Alik_Bljk_BSS_BH_UserArgs_MT64x128x64_MI16x16x1_SN_LDSB1_CLR1_GSU0_GSUC0_GSUWGMRR0_K1_LBSPPA128_LBSPPB512_MIWT2_4_PLR1_SU32_SUM0_SUS256_SKXCCM6_VWA1_VWB4_WGM4_WGMXCC1_WGMXCCGn1
    SolutionIndex: 72
    SolutionNameMin: Cijk_Alik_Bljk_BSS_BH_UserArgs_MT64x128x64_MI16x16x1_SN_LDSB1_CLR1_GSU0_GSUC0_GSUWGMRR0_K1_LBSPPA128_LBSPPB128_MIWT2_4_PLR1_SU32_SUM0_SUS256_SKXCCM6_VWA1_VWB1_WGM8_WGMXCC1_WGMXCCGn1
    SolutionIndex: 73
    SolutionNameMin: Cijk_Alik_Bljk_BSS_BH_UserArgs_MT64x128x64_MI16x16x1_SN_LDSB1_CLR1_GSU0_GSUC0_GSUWGMRR0_K1_LBSPPA128_LBSPPB256_MIWT2_4_PLR1_SU32_SUM0_SUS256_SKXCCM6_VWA1_VWB2_WGM8_WGMXCC1_WGMXCCGn1
    SolutionIndex: 74
    SolutionNameMin: Cijk_Alik_Bljk_BSS_BH_UserArgs_MT64x128x64_MI16x16x1_SN_LDSB1_CLR1_GSU0_GSUC0_GSUWGMRR0_K1_LBSPPA128_LBSPPB512_MIWT2_4_PLR1_SU32_SUM0_SUS256_SKXCCM6_VWA1_VWB4_WGM8_WGMXCC1_WGMXCCGn1
    SolutionIndex: 75
    SolutionNameMin: Cijk_Alik_Bljk_BSS_BH_UserArgs_MT128x64x64_MI16x16x1_SN_LDSB1_CLR1_GSU0_GSUC0_GSUWGMRR0_K1_LBSPPA128_LBSPPB128_MIWT4_2_PLR1_SU32_SUM0_SUS256_SKXCCM6_VWA1_VWB1_WGM1_WGMXCC1_WGMXCCGn1
    SolutionIndex: 76
    SolutionNameMin: Cijk_Alik_Bljk_BSS_BH_UserArgs_MT128x64x64_MI16x16x1_SN_LDSB1_CLR1_GSU0_GSUC0_GSUWGMRR0_K1_LBSPPA512_LBSPPB128_MIWT4_2_PLR1_SU32_SUM0_SUS256_SKXCCM6_VWA4_VWB1_WGM1_WGMXCC1_WGMXCCGn1
    SolutionIndex: 77
    SolutionNameMin: Cijk_Alik_Bljk_BSS_BH_UserArgs_MT128x64x64_MI16x16x1_SN_LDSB1_CLR1_GSU0_GSUC0_GSUWGMRR0_K1_LBSPPA512_LBSPPB256_MIWT4_2_PLR1_SU32_SUM0_SUS256_SKXCCM6_VWA4_VWB2_WGM1_WGMXCC1_WGMXCCGn1
    SolutionIndex: 78
    SolutionNameMin: Cijk_Alik_Bljk_BSS_BH_UserArgs_MT128x64x64_MI16x16x1_SN_LDSB1_CLR1_GSU0_GSUC0_GSUWGMRR0_K1_LBSPPA512_LBSPPB128_MIWT4_2_PLR2_SU32_SUM0_SUS256_SKXCCM6_VWA4_VWB1_WGM1_WGMXCC1_WGMXCCGn1
    SolutionIndex: 79
    SolutionNameMin: Cijk_Alik_Bljk_BSS_BH_UserArgs_MT128x64x64_MI16x16x1_SN_LDSB1_CLR1_GSU0_GSUC0_GSUWGMRR0_K1_LBSPPA512_LBSPPB256_MIWT4_2_PLR2_SU32_SUM0_SUS256_SKXCCM6_VWA4_VWB2_WGM1_WGMXCC1_WGMXCCGn1
    SolutionIndex: 80
    SolutionNameMin: Cijk_Alik_Bljk_BSS_BH_UserArgs_MT128x64x64_MI16x16x1_SN_LDSB1_CLR1_GSU0_GSUC0_GSUWGMRR0_K1_LBSPPA128_LBSPPB128_MIWT4_2_PLR1_SU32_SUM0_SUS256_SKXCCM6_VWA1_VWB1_WGM4_WGMXCC1_WGMXCCGn1
    SolutionIndex: 81
    SolutionNameMin: Cijk_Alik_Bljk_BSS_BH_UserArgs_MT128x64x64_MI16x16x1_SN_LDSB1_CLR1_GSU0_GSUC0_GSUWGMRR0_K1_LBSPPA512_LBSPPB128_MIWT4_2_PLR1_SU32_SUM0_SUS256_SKXCCM6_VWA4_VWB1_WGM4_WGMXCC1_WGMXCCGn1
    SolutionIndex: 82
    SolutionNameMin: Cijk_Alik_Bljk_BSS_BH_UserArgs_MT128x64x64_MI16x16x1_SN_LDSB1_CLR1_GSU0_GSUC0_GSUWGMRR0_K1_LBSPPA512_LBSPPB256_MIWT4_2_PLR1_SU32_SUM0_SUS256_SKXCCM6_VWA4_VWB2_WGM4_WGMXCC1_WGMXCCGn1
    SolutionIndex: 83
    SolutionNameMin: Cijk_Alik_Bljk_BSS_BH_UserArgs_MT128x64x64_MI16x16x1_SN_LDSB1_CLR1_GSU0_GSUC0_GSUWGMRR0_K1_LBSPPA512_LBSPPB128_MIWT4_2_PLR2_SU32_SUM0_SUS256_SKXCCM6_VWA4_VWB1_WGM4_WGMXCC1_WGMXCCGn1
    SolutionIndex: 84
    SolutionNameMin: Cijk_Alik_Bljk_BSS_BH_UserArgs_MT128x64x64_MI16x16x1_SN_LDSB1_CLR1_GSU0_GSUC0_GSUWGMRR0_K1_LBSPPA512_LBSPPB256_MIWT4_2_PLR2_SU32_SUM0_SUS256_SKXCCM6_VWA4_VWB2_WGM4_WGMXCC1_WGMXCCGn1
    SolutionIndex: 85
    SolutionNameMin: Cijk_Alik_Bljk_BSS_BH_UserArgs_MT128x64x64_MI16x16x1_SN_LDSB1_CLR1_GSU0_GSUC0_GSUWGMRR0_K1_LBSPPA128_LBSPPB128_MIWT4_2_PLR1_SU32_SUM0_SUS256_SKXCCM6_VWA1_VWB1_WGM8_WGMXCC1_WGMXCCGn1
    SolutionIndex: 86
    SolutionNameMin: Cijk_Alik_Bljk_BSS_BH_UserArgs_MT128x64x64_MI16x16x1_SN_LDSB1_CLR1_GSU0_GSUC0_GSUWGMRR0_K1_LBSPPA512_LBSPPB128_MIWT4_2_PLR1_SU32_SUM0_SUS256_SKXCCM6_VWA4_VWB1_WGM8_WGMXCC1_WGMXCCGn1
    SolutionIndex: 87
    SolutionNameMin: Cijk_Alik_Bljk_BSS_BH_UserArgs_MT128x64x64_MI16x16x1_SN_LDSB1_CLR1_GSU0_GSUC0_GSUWGMRR0_K1_LBSPPA512_LBSPPB256_MIWT4_2_PLR1_SU32_SUM0_SUS256_SKXCCM6_VWA4_VWB2_WGM8_WGMXCC1_WGMXCCGn1
    SolutionIndex: 88
    SolutionNameMin: Cijk_Alik_Bljk_BSS_BH_UserArgs_MT128x64x64_MI16x16x1_SN_LDSB1_CLR1_GSU0_GSUC0_GSUWGMRR0_K1_LBSPPA512_LBSPPB128_MIWT4_2_PLR2_SU32_SUM0_SUS256_SKXCCM6_VWA4_VWB1_WGM8_WGMXCC1_WGMXCCGn1
    SolutionIndex: 89
    SolutionNameMin: Cijk_Alik_Bljk_BSS_BH_UserArgs_MT128x64x64_MI16x16x1_SN_LDSB1_CLR1_GSU0_GSUC0_GSUWGMRR0_K1_LBSPPA512_LBSPPB256_MIWT4_2_PLR2_SU32_SUM0_SUS256_SKXCCM6_VWA4_VWB2_WGM8_WGMXCC1_WGMXCCGn1
    SolutionIndex: 90
    SolutionNameMin: Cijk_Alik_Bljk_BSS_BH_UserArgs_MT64x64x64_MI16x16x1_SN_LDSB1_CLR1_GSU0_GSUC0_GSUWGMRR0_K1_LBSPPA128_LBSPPB128_MIWT2_2_PLR1_SU32_SUM0_SUS256_SKXCCM6_VWA1_VWB1_WGM1_WGMXCC1_WGMXCCGn1
    SolutionIndex: 91
    SolutionNameMin: Cijk_Alik_Bljk_BSS_BH_UserArgs_MT64x64x64_MI16x16x1_SN_LDSB1_CLR1_GSU0_GSUC0_GSUWGMRR0_K1_LBSPPA128_LBSPPB256_MIWT2_2_PLR1_SU32_SUM0_SUS256_SKXCCM6_VWA1_VWB2_WGM1_WGMXCC1_WGMXCCGn1
    SolutionIndex: 92
    SolutionNameMin: Cijk_Alik_Bljk_BSS_BH_UserArgs_MT64x64x64_MI16x16x1_SN_LDSB1_CLR1_GSU0_GSUC0_GSUWGMRR0_K1_LBSPPA128_LBSPPB128_MIWT2_2_PLR2_SU32_SUM0_SUS256_SKXCCM6_VWA1_VWB1_WGM1_WGMXCC1_WGMXCCGn1
    SolutionIndex: 93
    SolutionNameMin: Cijk_Alik_Bljk_BSS_BH_UserArgs_MT64x64x64_MI16x16x1_SN_LDSB1_CLR1_GSU0_GSUC0_GSUWGMRR0_K1_LBSPPA128_LBSPPB256_MIWT2_2_PLR2_SU32_SUM0_SUS256_SKXCCM6_VWA1_VWB2_WGM1_WGMXCC1_WGMXCCGn1
    SolutionIndex: 94
    SolutionNameMin: Cijk_Alik_Bljk_BSS_BH_UserArgs_MT64x64x64_MI16x16x1_SN_LDSB1_CLR1_GSU0_GSUC0_GSUWGMRR0_K1_LBSPPA128_LBSPPB128_MIWT2_2_PLR1_SU32_SUM0_SUS256_SKXCCM6_VWA1_VWB1_WGM4_WGMXCC1_WGMXCCGn1
    SolutionIndex: 95
    SolutionNameMin: Cijk_Alik_Bljk_BSS_BH_UserArgs_MT64x64x64_MI16x16x1_SN_LDSB1_CLR1_GSU0_GSUC0_GSUWGMRR0_K1_LBSPPA128_LBSPPB256_MIWT2_2_PLR1_SU32_SUM0_SUS256_SKXCCM6_VWA1_VWB2_WGM4_WGMXCC1_WGMXCCGn1
    SolutionIndex: 96
    SolutionNameMin: Cijk_Alik_Bljk_BSS_BH_UserArgs_MT64x64x64_MI16x16x1_SN_LDSB1_CLR1_GSU0_GSUC0_GSUWGMRR0_K1_LBSPPA128_LBSPPB128_MIWT2_2_PLR2_SU32_SUM0_SUS256_SKXCCM6_VWA1_VWB1_WGM4_WGMXCC1_WGMXCCGn1
    SolutionIndex: 97
    SolutionNameMin: Cijk_Alik_Bljk_BSS_BH_UserArgs_MT64x64x64_MI16x16x1_SN_LDSB1_CLR1_GSU0_GSUC0_GSUWGMRR0_K1_LBSPPA128_LBSPPB128_MIWT2_2_PLR1_SU32_SUM0_SUS256_SKXCCM6_VWA1_VWB1_WGM8_WGMXCC1_WGMXCCGn1
    SolutionIndex: 98
    SolutionNameMin: Cijk_Alik_Bljk_BSS_BH_UserArgs_MT64x64x64_MI16x16x1_SN_LDSB1_CLR1_GSU0_GSUC0_GSUWGMRR0_K1_LBSPPA128_LBSPPB256_MIWT2_2_PLR1_SU32_SUM0_SUS256_SKXCCM6_VWA1_VWB2_WGM8_WGMXCC1_WGMXCCGn1
    SolutionIndex: 99
    SolutionNameMin: Cijk_Alik_Bljk_BSS_BH_UserArgs_MT32x64x64_MI16x16x1_SN_LDSB0_CLR1_GSU0_GSUC0_GSUWGMRR0_K1_LBSPPA128_LBSPPB128_MIWT1_2_PLR1_SU32_SUM0_SUS256_SKXCCM6_VWA1_VWB1_WGM1_WGMXCC1_WGMXCCGn1
    SolutionIndex: 100
    SolutionNameMin: Cijk_Alik_Bljk_BSS_BH_UserArgs_MT32x64x64_MI16x16x1_SN_LDSB0_CLR1_GSU0_GSUC0_GSUWGMRR0_K1_LBSPPA128_LBSPPB256_MIWT1_2_PLR1_SU32_SUM0_SUS256_SKXCCM6_VWA1_VWB2_WGM1_WGMXCC1_WGMXCCGn1
    SolutionIndex: 101
    SolutionNameMin: Cijk_Alik_Bljk_BSS_BH_UserArgs_MT32x64x64_MI16x16x1_SN_LDSB0_CLR1_GSU0_GSUC0_GSUWGMRR0_K1_LBSPPA128_LBSPPB256_MIWT1_2_PLR1_SU32_SUM0_SUS256_SKXCCM6_VWA1_VWB2_WGM4_WGMXCC1_WGMXCCGn1
    SolutionIndex: 102
    SolutionNameMin: Cijk_Alik_Bljk_BSS_BH_UserArgs_MT32x64x64_MI16x16x1_SN_LDSB0_CLR1_GSU0_GSUC0_GSUWGMRR0_K1_LBSPPA128_LBSPPB128_MIWT1_2_PLR1_SU32_SUM0_SUS256_SKXCCM6_VWA1_VWB1_WGM8_WGMXCC1_WGMXCCGn1
    SolutionIndex: 103
    SolutionNameMin: Cijk_Alik_Bljk_BSS_BH_UserArgs_MT32x32x64_MI16x16x1_SN_LDSB0_CLR1_GSU0_GSUC0_GSUWGMRR0_K1_LBSPPA128_LBSPPB128_MIWT1_1_PLR1_SU32_SUM0_SUS256_SKXCCM6_VWA1_VWB1_WGM1_WGMXCC1_WGMXCCGn1
    SolutionIndex: 104
    SolutionNameMin: Cijk_Alik_Bljk_BSS_BH_UserArgs_MT32x32x64_MI16x16x1_SN_LDSB0_CLR1_GSU0_GSUC0_GSUWGMRR0_K1_LBSPPA128_LBSPPB128_MIWT1_1_PLR2_SU32_SUM0_SUS256_SKXCCM6_VWA1_VWB1_WGM1_WGMXCC1_WGMXCCGn1
    SolutionIndex: 105
    SolutionNameMin: Cijk_Alik_Bljk_BSS_BH_UserArgs_MT64x64x128_MI16x16x1_SN_LDSB1_CLR1_GSU0_GSUC0_GSUWGMRR0_K1_LBSPPA512_LBSPPB512_MIWT2_2_PLR2_SU32_SUM0_SUS256_SKXCCM6_VWA2_VWB2_WGM1_WGMXCC1_WGMXCCGn1
    SolutionIndex: 106
    SolutionNameMin: Cijk_Alik_Bljk_BSS_BH_UserArgs_MT64x64x128_MI16x16x1_SN_LDSB1_CLR1_GSU0_GSUC0_GSUWGMRR0_K1_LBSPPA256_LBSPPB256_MIWT2_2_PLR1_SU32_SUM0_SUS256_SKXCCM6_VWA1_VWB1_WGM8_WGMXCC1_WGMXCCGn1
    SolutionIndex: 107
    SolutionNameMin: Cijk_Alik_Bljk_BSS_BH_UserArgs_MT32x64x128_MI16x16x1_SN_LDSB1_CLR1_GSU0_GSUC0_GSUWGMRR0_K1_LBSPPA256_LBSPPB512_MIWT1_2_PLR1_SU32_SUM0_SUS256_SKXCCM6_VWA1_VWB2_WGM1_WGMXCC1_WGMXCCGn1
    SolutionIndex: 108
    SolutionNameMin: Cijk_Alik_Bljk_BSS_BH_UserArgs_MT32x64x128_MI16x16x1_SN_LDSB1_CLR1_GSU0_GSUC0_GSUWGMRR0_K1_LBSPPA256_LBSPPB512_MIWT1_2_PLR1_SU32_SUM0_SUS256_SKXCCM6_VWA1_VWB2_WGM4_WGMXCC1_WGMXCCGn1
    SolutionIndex: 109
    SolutionNameMin: Cijk_Alik_Bljk_BSS_BH_UserArgs_MT32x64x128_MI16x16x1_SN_LDSB1_CLR1_GSU0_GSUC0_GSUWGMRR0_K1_LBSPPA256_LBSPPB512_MIWT1_2_PLR2_SU32_SUM0_SUS256_SKXCCM6_VWA1_VWB2_WGM4_WGMXCC1_WGMXCCGn1
    SolutionIndex: 110
    SolutionNameMin: Cijk_Alik_Bljk_BSS_BH_UserArgs_MT64x32x128_MI16x16x1_SN_LDSB1_CLR1_GSU0_GSUC0_GSUWGMRR0_K1_LBSPPA256_LBSPPB256_MIWT2_1_PLR2_SU32_SUM0_SUS256_SKXCCM6_VWA1_VWB1_WGM1_WGMXCC1_WGMXCCGn1
    SolutionIndex: 111
    SolutionNameMin: Cijk_Alik_Bljk_BSS_BH_UserArgs_MT64x32x128_MI16x16x1_SN_LDSB1_CLR1_GSU0_GSUC0_GSUWGMRR0_K1_LBSPPA256_LBSPPB256_MIWT2_1_PLR2_SU32_SUM0_SUS256_SKXCCM6_VWA1_VWB1_WGM4_WGMXCC1_WGMXCCGn1
    SolutionIndex: 112
    SolutionNameMin: Cijk_Alik_Bljk_BSS_BH_UserArgs_MT64x32x128_MI16x16x1_SN_LDSB1_CLR1_GSU0_GSUC0_GSUWGMRR0_K1_LBSPPA512_LBSPPB256_MIWT2_1_PLR2_SU32_SUM0_SUS256_SKXCCM6_VWA2_VWB1_WGM8_WGMXCC1_WGMXCCGn1
    SolutionIndex: 113
    SolutionNameMin: Cijk_Alik_Bljk_BSS_BH_UserArgs_MT32x32x128_MI16x16x1_SN_LDSB1_CLR1_GSU0_GSUC0_GSUWGMRR0_K1_LBSPPA256_LBSPPB256_MIWT1_1_PLR1_SU32_SUM0_SUS256_SKXCCM6_VWA1_VWB1_WGM1_WGMXCC1_WGMXCCGn1
    SolutionIndex: 114
    SolutionNameMin: Cijk_Alik_Bljk_BSS_BH_UserArgs_MT32x32x128_MI16x16x1_SN_LDSB1_CLR1_GSU0_GSUC0_GSUWGMRR0_K1_LBSPPA256_LBSPPB256_MIWT1_1_PLR2_SU32_SUM0_SUS256_SKXCCM6_VWA1_VWB1_WGM1_WGMXCC1_WGMXCCGn1
    SolutionIndex: 115
    SolutionNameMin: Cijk_Alik_Bljk_BSS_BH_UserArgs_MT32x32x128_MI16x16x1_SN_LDSB1_CLR1_GSU0_GSUC0_GSUWGMRR0_K1_LBSPPA256_LBSPPB256_MIWT1_1_PLR1_SU32_SUM0_SUS256_SKXCCM6_VWA1_VWB1_WGM4_WGMXCC1_WGMXCCGn1
    SolutionIndex: 116
    SolutionNameMin: Cijk_Alik_Bljk_BSS_BH_UserArgs_MT32x32x128_MI16x16x1_SN_LDSB1_CLR1_GSU0_GSUC0_GSUWGMRR0_K1_LBSPPA256_LBSPPB256_MIWT1_1_PLR1_SU32_SUM0_SUS256_SKXCCM6_VWA1_VWB1_WGM8_WGMXCC1_WGMXCCGn1
    SolutionIndex: 117
    SolutionNameMin: Cijk_Alik_Bljk_BSS_BH_UserArgs_MT32x64x128_MI16x16x1_SN_LDSB1_CLR1_GSU0_GSUC0_GSUWGMRR0_K1_LBSPPA256_LBSPPB512_MIWT1_2_PLR1_SU32_SUM0_SUS256_SKXCCM0_VWA1_VWB2_WGM1_WGMXCC1_WGMXCCGn1
- - - [128, 128, 1, 128, 128, 128, 128, 128]
    - [36, 0.093]
  - - [128, 128, 1, 256, 128, 128, 256, 256]
    - [36, 0.117]
  - - [128, 128, 1, 512, 128, 128, 512, 512]
    - [36, 0.193]
  - - [128, 128, 1, 1024, 128, 128, 1024, 1024]
    - [114, 0.289]
  - - [128, 128, 1, 2048, 128, 128, 2048, 2048]
    - [0, 0.371]
  - - [128, 128, 1, 4096, 128, 128, 4096, 4096]
    - [31, 0.738]
  - - [128, 128, 1, 8192, 128, 128, 8192, 8192]
    - [37, 1.413]
  - - [128, 256, 1, 128, 128, 128, 128, 128]
    - [36, 0.187]
  - - [128, 256, 1, 256, 128, 128, 256, 256]
    - [36, 0.232]
  - - [128, 256, 1, 512, 128, 128, 512, 512]
    - [113, 0.38]
  - - [128, 256, 1, 1024, 128, 128, 1024, 1024]
    - [104, 0.573]
  - - [128, 256, 1, 2048, 128, 128, 2048, 2048]
    - [113, 1.09]
  - - [128, 256, 1, 4096, 128, 128, 4096, 4096]
    - [114, 1.947]
  - - [128, 256, 1, 8192, 128, 128, 8192, 8192]
    - [114, 3.294]
  - - [128, 512, 1, 128, 128, 128, 128, 128]
    - [36, 0.365]
  - - [128, 512, 1, 256, 128, 128, 256, 256]
    - [37, 0.433]
  - - [128, 512, 1, 512, 128, 128, 512, 512]
    - [114, 0.723]
  - - [128, 512, 1, 1024, 128, 128, 1024, 1024]
    - [46, 1.316]
  - - [128, 512, 1, 2048, 128, 128, 2048, 2048]
    - [114, 2.505]
  - - [128, 512, 1, 4096, 128, 128, 4096, 4096]
    - [113, 4.065]
  - - [128, 512, 1, 8192, 128, 128, 8192, 8192]
    - [113, 5.936]
  - - [128, 1024, 1, 128, 128, 128, 128, 128]
    - [37, 0.708]
  - - [128, 1024, 1, 256, 128, 128, 256, 256]
    - [37, 0.844]
  - - [128, 1024, 1, 512, 128, 128, 512, 512]
    - [36, 1.568]
  - - [128, 1024, 1, 1024, 128, 128, 1024, 1024]
    - [113, 2.734]
  - - [128, 1024, 1, 2048, 128, 128, 2048, 2048]
    - [114, 4.505]
  - - [128, 1024, 1, 4096, 128, 128, 4096, 4096]
    - [99, 6.503]
  - - [128, 1024, 1, 8192, 128, 128, 8192, 8192]
    - [110, 8.693]
  - - [128, 2048, 1, 128, 128, 128, 128, 128]
    - [33, 1.29]
  - - [128, 2048, 1, 256, 128, 128, 256, 256]
    - [37, 2.229]
  - - [128, 2048, 1, 512, 128, 128, 512, 512]
    - [36, 3.653]
  - - [128, 2048, 1, 1024, 128, 128, 1024, 1024]
    - [36, 5.503]
  - - [128, 2048, 1, 2048, 128, 128, 2048, 2048]
    - [113, 7.232]
  - - [128, 2048, 1, 4096, 128, 128, 4096, 4096]
    - [92, 9.49]
  - - [128, 2048, 1, 8192, 128, 128, 8192, 8192]
    - [14, 11.056]
  - - [128, 4096, 1, 128, 128, 128, 128, 128]
    - [28, 2.24]
  - - [128, 4096, 1, 256, 128, 128, 256, 256]
    - [30, 3.8]
  - - [128, 4096, 1, 512, 128, 128, 512, 512]
    - [26, 6.067]
  - - [128, 4096, 1, 1024, 128, 128, 1024, 1024]
    - [99, 8.443]
  - - [128, 4096, 1, 2048, 128, 128, 2048, 2048]
    - [90, 10.328]
  - - [128, 4096, 1, 4096, 128, 128, 4096, 4096]
    - [18, 12.193]
  - - [128, 4096, 1, 8192, 128, 128, 8192, 8192]
    - [18, 13.845]
  - - [128, 8192, 1, 128, 128, 128, 128, 128]
    - [23, 3.629]
  - - [128, 8192, 1, 256, 128, 128, 256, 256]
    - [22, 5.935]
  - - [128, 8192, 1, 512, 128, 128, 512, 512]
    - [90, 9.02]
  - - [128, 8192, 1, 1024, 128, 128, 1024, 1024]
    - [91, 11.8]
  - - [128, 8192, 1, 2048, 128, 128, 2048, 2048]
    - [20, 12.566]
  - - [128, 8192, 1, 4096, 128, 128, 4096, 4096]
    - [15, 14.983]
  - - [128, 8192, 1, 8192, 128, 128, 8192, 8192]
    - [20, 17.242]
  - - [256, 128, 1, 128, 256, 256, 128, 128]
    - [36, 0.185]
  - - [256, 128, 1, 256, 256, 256, 256, 256]
    - [37, 0.228]
  - - [256, 128, 1, 512, 256, 256, 512, 512]
    - [113, 0.376]
  - - [256, 128, 1, 1024, 256, 256, 1024, 1024]
    - [103, 0.568]
  - - [256, 128, 1, 2048, 256, 256, 2048, 2048]
    - [114, 1.08]
  - - [256, 128, 1, 4096, 256, 256, 4096, 4096]
    - [114, 1.944]
  - - [256, 128, 1, 8192, 256, 256, 8192, 8192]
    - [113, 3.301]
  - - [256, 256, 1, 128, 256, 256, 128, 128]
    - [36, 0.363]
  - - [256, 256, 1, 256, 256, 256, 256, 256]
    - [37, 0.431]
  - - [256, 256, 1, 512, 256, 256, 512, 512]
    - [113, 0.722]
  - - [256, 256, 1, 1024, 256, 256, 1024, 1024]
    - [113, 1.343]
  - - [256, 256, 1, 2048, 256, 256, 2048, 2048]
    - [114, 2.484]
  - - [256, 256, 1, 4096, 256, 256, 4096, 4096]
    - [114, 4.042]
  - - [256, 256, 1, 8192, 256, 256, 8192, 8192]
    - [114, 5.829]
  - - [256, 512, 1, 128, 256, 256, 128, 128]
    - [37, 0.71]
  - - [256, 512, 1, 256, 256, 256, 256, 256]
    - [36, 0.847]
  - - [256, 512, 1, 512, 256, 256, 512, 512]
    - [36, 1.547]
  - - [256, 512, 1, 1024, 256, 256, 1024, 1024]
    - [114, 2.769]
  - - [256, 512, 1, 2048, 256, 256, 2048, 2048]
    - [113, 4.501]
  - - [256, 512, 1, 4096, 256, 256, 4096, 4096]
    - [100, 6.49]
  - - [256, 512, 1, 8192, 256, 256, 8192, 8192]
    - [107, 8.407]
  - - [256, 1024, 1, 128, 256, 256, 128, 128]
    - [32, 1.285]
  - - [256, 1024, 1, 256, 256, 256, 256, 256]
    - [37, 2.228]
  - - [256, 1024, 1, 512, 256, 256, 512, 512]
    - [36, 3.654]
  - - [256, 1024, 1, 1024, 256, 256, 1024, 1024]
    - [36, 5.495]
  - - [256, 1024, 1, 2048, 256, 256, 2048, 2048]
    - [113, 7.148]
  - - [256, 1024, 1, 4096, 256, 256, 4096, 4096]
    - [90, 9.526]
  - - [256, 1024, 1, 8192, 256, 256, 8192, 8192]
    - [93, 10.704]
  - - [256, 2048, 1, 128, 256, 256, 128, 128]
    - [26, 2.231]
  - - [256, 2048, 1, 256, 256, 256, 256, 256]
    - [29, 3.781]
  - - [256, 2048, 1, 512, 256, 256, 512, 512]
    - [27, 6.068]
  - - [256, 2048, 1, 1024, 256, 256, 1024, 1024]
    - [99, 8.345]
  - - [256, 2048, 1, 2048, 256, 256, 2048, 2048]
    - [90, 10.839]
  - - [256, 2048, 1, 4096, 256, 256, 4096, 4096]
    - [82, 12.037]
  - - [256, 2048, 1, 8192, 256, 256, 8192, 8192]
    - [76, 12.787]
  - - [256, 4096, 1, 128, 256, 256, 128, 128]
    - [91, 3.524]
  - - [256, 4096, 1, 256, 256, 256, 256, 256]
    - [25, 5.872]
  - - [256, 4096, 1, 512, 256, 256, 512, 512]
    - [91, 9.158]
  - - [256, 4096, 1, 1024, 256, 256, 1024, 1024]
    - [91, 12.607]
  - - [256, 4096, 1, 2048, 256, 256, 2048, 2048]
    - [77, 13.303]
  - - [256, 4096, 1, 4096, 256, 256, 4096, 4096]
    - [87, 15.249]
  - - [256, 4096, 1, 8192, 256, 256, 8192, 8192]
    - [53, 15.933]
  - - [256, 8192, 1, 128, 256, 256, 128, 128]
    - [86, 4.934]
  - - [256, 8192, 1, 256, 256, 256, 256, 256]
    - [69, 8.057]
  - - [256, 8192, 1, 512, 256, 256, 512, 512]
    - [77, 11.881]
  - - [256, 8192, 1, 1024, 256, 256, 1024, 1024]
    - [75, 14.735]
  - - [256, 8192, 1, 2048, 256, 256, 2048, 2048]
    - [77, 16.955]
  - - [256, 8192, 1, 4096, 256, 256, 4096, 4096]
    - [47, 17.513]
  - - [256, 8192, 1, 8192, 256, 256, 8192, 8192]
    - [53, 18.032]
  - - [512, 128, 1, 128, 512, 512, 128, 128]
    - [36, 0.363]
  - - [512, 128, 1, 256, 512, 512, 256, 256]
    - [37, 0.445]
  - - [512, 128, 1, 512, 512, 512, 512, 512]
    - [113, 0.722]
  - - [512, 128, 1, 1024, 512, 512, 1024, 1024]
    - [114, 1.305]
  - - [512, 128, 1, 2048, 512, 512, 2048, 2048]
    - [113, 2.507]
  - - [512, 128, 1, 4096, 512, 512, 4096, 4096]
    - [113, 4.078]
  - - [512, 128, 1, 8192, 512, 512, 8192, 8192]
    - [115, 5.875]
  - - [512, 256, 1, 128, 512, 512, 128, 128]
    - [36, 0.702]
  - - [512, 256, 1, 256, 512, 512, 256, 256]
    - [36, 0.845]
  - - [512, 256, 1, 512, 512, 512, 512, 512]
    - [37, 1.561]
  - - [512, 256, 1, 1024, 512, 512, 1024, 1024]
    - [114, 2.732]
  - - [512, 256, 1, 2048, 512, 512, 2048, 2048]
    - [113, 4.492]
  - - [512, 256, 1, 4096, 512, 512, 4096, 4096]
    - [101, 6.411]
  - - [512, 256, 1, 8192, 512, 512, 8192, 8192]
    - [112, 8.452]
  - - [512, 512, 1, 128, 512, 512, 128, 128]
    - [34, 1.266]
  - - [512, 512, 1, 256, 512, 512, 256, 256]
    - [37, 2.24]
  - - [512, 512, 1, 512, 512, 512, 512, 512]
    - [37, 3.628]
  - - [512, 512, 1, 1024, 512, 512, 1024, 1024]
    - [36, 5.51]
  - - [512, 512, 1, 2048, 512, 512, 2048, 2048]
    - [113, 7.149]
  - - [512, 512, 1, 4096, 512, 512, 4096, 4096]
    - [24, 9.742]
  - - [512, 512, 1, 8192, 512, 512, 8192, 8192]
    - [96, 10.661]
  - - [512, 1024, 1, 128, 512, 512, 128, 128]
    - [26, 2.216]
  - - [512, 1024, 1, 256, 512, 512, 256, 256]
    - [26, 3.794]
  - - [512, 1024, 1, 512, 512, 512, 512, 512]
    - [26, 6.071]
  - - [512, 1024, 1, 1024, 512, 512, 1024, 1024]
    - [27, 8.463]
  - - [512, 1024, 1, 2048, 512, 512, 2048, 2048]
    - [91, 10.864]
  - - [512, 1024, 1, 4096, 512, 512, 4096, 4096]
    - [91, 12.285]
  - - [512, 1024, 1, 8192, 512, 512, 8192, 8192]
    - [77, 12.899]
  - - [512, 2048, 1, 128, 512, 512, 128, 128]
    - [23, 3.576]
  - - [512, 2048, 1, 256, 512, 512, 256, 256]
    - [23, 5.971]
  - - [512, 2048, 1, 512, 512, 512, 512, 512]
    - [91, 9.171]
  - - [512, 2048, 1, 1024, 512, 512, 1024, 1024]
    - [90, 12.548]
  - - [512, 2048, 1, 2048, 512, 512, 2048, 2048]
    - [94, 13.776]
  - - [512, 2048, 1, 4096, 512, 512, 4096, 4096]
    - [105, 13.834]
  - - [512, 2048, 1, 8192, 512, 512, 8192, 8192]
    - [53, 16.052]
  - - [512, 4096, 1, 128, 512, 512, 128, 128]
    - [87, 4.939]
  - - [512, 4096, 1, 256, 512, 512, 256, 256]
    - [71, 8.082]
  - - [512, 4096, 1, 512, 512, 512, 512, 512]
    - [77, 12.306]
  - - [512, 4096, 1, 1024, 512, 512, 1024, 1024]
    - [76, 15.917]
  - - [512, 4096, 1, 2048, 512, 512, 2048, 2048]
    - [68, 16.475]
  - - [512, 4096, 1, 4096, 512, 512, 4096, 4096]
    - [63, 16.335]
  - - [512, 4096, 1, 8192, 512, 512, 8192, 8192]
    - [51, 17.465]
  - - [512, 8192, 1, 128, 512, 512, 128, 128]
    - [44, 5.806]
  - - [512, 8192, 1, 256, 512, 512, 256, 256]
    - [39, 8.868]
  - - [512, 8192, 1, 512, 512, 512, 512, 512]
    - [49, 12.697]
  - - [512, 8192, 1, 1024, 512, 512, 1024, 1024]
    - [51, 15.828]
  - - [512, 8192, 1, 2048, 512, 512, 2048, 2048]
    - [52, 19.025]
  - - [512, 8192, 1, 4096, 512, 512, 4096, 4096]
    - [4, 17.035]
  - - [512, 8192, 1, 8192, 512, 512, 8192, 8192]
    - [4, 19.433]
  - - [1024, 128, 1, 128, 1024, 1024, 128, 128]
    - [37, 0.712]
  - - [1024, 128, 1, 256, 1024, 1024, 256, 256]
    - [37, 0.848]
  - - [1024, 128, 1, 512, 1024, 1024, 512, 512]
    - [36, 1.563]
  - - [1024, 128, 1, 1024, 1024, 1024, 1024, 1024]
    - [114, 2.729]
  - - [1024, 128, 1, 2048, 1024, 1024, 2048, 2048]
    - [113, 4.491]
  - - [1024, 128, 1, 4096, 1024, 1024, 4096, 4096]
    - [99, 6.456]
  - - [1024, 128, 1, 8192, 1024, 1024, 8192, 8192]
    - [109, 8.633]
  - - [1024, 256, 1, 128, 1024, 1024, 128, 128]
    - [33, 1.272]
  - - [1024, 256, 1, 256, 1024, 1024, 256, 256]
    - [37, 2.251]
  - - [1024, 256, 1, 512, 1024, 1024, 512, 512]
    - [36, 3.659]
  - - [1024, 256, 1, 1024, 1024, 1024, 1024, 1024]
    - [36, 5.529]
  - - [1024, 256, 1, 2048, 1024, 1024, 2048, 2048]
    - [115, 7.108]
  - - [1024, 256, 1, 4096, 1024, 1024, 4096, 4096]
    - [108, 9.269]
  - - [1024, 256, 1, 8192, 1024, 1024, 8192, 8192]
    - [97, 10.502]
  - - [1024, 512, 1, 128, 1024, 1024, 128, 128]
    - [27, 2.233]
  - - [1024, 512, 1, 256, 1024, 1024, 256, 256]
    - [29, 3.801]
  - - [1024, 512, 1, 512, 1024, 1024, 512, 512]
    - [26, 6.083]
  - - [1024, 512, 1, 1024, 1024, 1024, 1024, 1024]
    - [26, 8.552]
  - - [1024, 512, 1, 2048, 1024, 1024, 2048, 2048]
    - [94, 10.757]
  - - [1024, 512, 1, 4096, 1024, 1024, 4096, 4096]
    - [98, 12.116]
  - - [1024, 512, 1, 8192, 1024, 1024, 8192, 8192]
    - [106, 12.839]
  - - [1024, 1024, 1, 128, 1024, 1024, 128, 128]
    - [23, 3.67]
  - - [1024, 1024, 1, 256, 1024, 1024, 256, 256]
    - [23, 5.902]
  - - [1024, 1024, 1, 512, 1024, 1024, 512, 512]
    - [24, 9.129]
  - - [1024, 1024, 1, 1024, 1024, 1024, 1024, 1024]
    - [91, 12.25]
  - - [1024, 1024, 1, 2048, 1024, 1024, 2048, 2048]
    - [92, 13.521]
  - - [1024, 1024, 1, 4096, 1024, 1024, 4096, 4096]
    - [67, 13.971]
  - - [1024, 1024, 1, 8192, 1024, 1024, 8192, 8192]
    - [56, 16.212]
  - - [1024, 2048, 1, 128, 1024, 1024, 128, 128]
    - [17, 4.945]
  - - [1024, 2048, 1, 256, 1024, 1024, 256, 256]
    - [12, 8.238]
  - - [1024, 2048, 1, 512, 1024, 1024, 512, 512]
    - [82, 11.955]
  - - [1024, 2048, 1, 1024, 1024, 1024, 1024, 1024]
    - [17, 14.782]
  - - [1024, 2048, 1, 2048, 1024, 1024, 2048, 2048]
    - [76, 16.877]
  - - [1024, 2048, 1, 4096, 1024, 1024, 4096, 4096]
    - [53, 18.124]
  - - [1024, 2048, 1, 8192, 1024, 1024, 8192, 8192]
    - [63, 17.798]
  - - [1024, 4096, 1, 128, 1024, 1024, 128, 128]
    - [44, 6.003]
  - - [1024, 4096, 1, 256, 1024, 1024, 256, 256]
    - [45, 9.071]
  - - [1024, 4096, 1, 512, 1024, 1024, 512, 512]
    - [2, 13.075]
  - - [1024, 4096, 1, 1024, 1024, 1024, 1024, 1024]
    - [49, 16.327]
  - - [1024, 4096, 1, 2048, 1024, 1024, 2048, 2048]
    - [48, 19.126]
  - - [1024, 4096, 1, 4096, 1024, 1024, 4096, 4096]
    - [53, 17.574]
  - - [1024, 4096, 1, 8192, 1024, 1024, 8192, 8192]
    - [53, 18.866]
  - - [1024, 8192, 1, 128, 1024, 1024, 128, 128]
    - [84, 5.888]
  - - [1024, 8192, 1, 256, 1024, 1024, 256, 256]
    - [77, 9.537]
  - - [1024, 8192, 1, 512, 1024, 1024, 512, 512]
    - [77, 13.048]
  - - [1024, 8192, 1, 1024, 1024, 1024, 1024, 1024]
    - [53, 15.615]
  - - [1024, 8192, 1, 2048, 1024, 1024, 2048, 2048]
    - [56, 16.678]
  - - [1024, 8192, 1, 4096, 1024, 1024, 4096, 4096]
    - [53, 18.868]
  - - [1024, 8192, 1, 8192, 1024, 1024, 8192, 8192]
    - [5, 18.394]
  - - [2048, 128, 1, 128, 2048, 2048, 128, 128]
    - [34, 1.297]
  - - [2048, 128, 1, 256, 2048, 2048, 256, 256]
    - [37, 2.274]
  - - [2048, 128, 1, 512, 2048, 2048, 512, 512]
    - [36, 3.68]
  - - [2048, 128, 1, 1024, 2048, 2048, 1024, 1024]
    - [38, 5.312]
  - - [2048, 128, 1, 2048, 2048, 2048, 2048, 2048]
    - [116, 7.105]
  - - [2048, 128, 1, 4096, 2048, 2048, 4096, 4096]
    - [94, 9.371]
  - - [2048, 128, 1, 8192, 2048, 2048, 8192, 8192]
    - [10, 10.452]
  - - [2048, 256, 1, 128, 2048, 2048, 128, 128]
    - [35, 2.222]
  - - [2048, 256, 1, 256, 2048, 2048, 256, 256]
    - [28, 3.796]
  - - [2048, 256, 1, 512, 2048, 2048, 512, 512]
    - [26, 6.107]
  - - [2048, 256, 1, 1024, 2048, 2048, 1024, 1024]
    - [102, 8.322]
  - - [2048, 256, 1, 2048, 2048, 2048, 2048, 2048]
    - [97, 10.786]
  - - [2048, 256, 1, 4096, 2048, 2048, 4096, 4096]
    - [6, 11.866]
  - - [2048, 256, 1, 8192, 2048, 2048, 8192, 8192]
    - [66, 13.186]
  - - [2048, 512, 1, 128, 2048, 2048, 128, 128]
    - [22, 3.615]
  - - [2048, 512, 1, 256, 2048, 2048, 256, 256]
    - [22, 6.034]
  - - [2048, 512, 1, 512, 2048, 2048, 512, 512]
    - [94, 9.104]
  - - [2048, 512, 1, 1024, 2048, 2048, 1024, 1024]
    - [97, 12.593]
  - - [2048, 512, 1, 2048, 2048, 2048, 2048, 2048]
    - [98, 14.049]
  - - [2048, 512, 1, 4096, 2048, 2048, 4096, 4096]
    - [66, 13.62]
  - - [2048, 512, 1, 8192, 2048, 2048, 8192, 8192]
    - [58, 15.805]
  - - [2048, 1024, 1, 128, 2048, 2048, 128, 128]
    - [76, 4.974]
  - - [2048, 1024, 1, 256, 2048, 2048, 256, 256]
    - [17, 8.197]
  - - [2048, 1024, 1, 512, 2048, 2048, 512, 512]
    - [87, 11.67]
  - - [2048, 1024, 1, 1024, 2048, 2048, 1024, 1024]
    - [13, 15.063]
  - - [2048, 1024, 1, 2048, 2048, 2048, 2048, 2048]
    - [74, 16.336]
  - - [2048, 1024, 1, 4096, 2048, 2048, 4096, 4096]
    - [61, 17.778]
  - - [2048, 1024, 1, 8192, 2048, 2048, 8192, 8192]
    - [63, 17.679]
  - - [2048, 2048, 1, 128, 2048, 2048, 128, 128]
    - [43, 5.833]
  - - [2048, 2048, 1, 256, 2048, 2048, 256, 256]
    - [42, 8.982]
  - - [2048, 2048, 1, 512, 2048, 2048, 512, 512]
    - [3, 13.502]
  - - [2048, 2048, 1, 1024, 2048, 2048, 1024, 1024]
    - [60, 15.831]
  - - [2048, 2048, 1, 2048, 2048, 2048, 2048, 2048]
    - [65, 18.943]
  - - [2048, 2048, 1, 4096, 2048, 2048, 4096, 4096]
    - [49, 18.878]
  - - [2048, 2048, 1, 8192, 2048, 2048, 8192, 8192]
    - [49, 19.379]
  - - [2048, 4096, 1, 128, 2048, 2048, 128, 128]
    - [79, 6.227]
  - - [2048, 4096, 1, 256, 2048, 2048, 256, 256]
    - [77, 9.595]
  - - [2048, 4096, 1, 512, 2048, 2048, 512, 512]
    - [77, 12.566]
  - - [2048, 4096, 1, 1024, 2048, 2048, 1024, 1024]
    - [49, 15.305]
  - - [2048, 4096, 1, 2048, 2048, 2048, 2048, 2048]
    - [48, 17.352]
  - - [2048, 4096, 1, 4096, 2048, 2048, 4096, 4096]
    - [51, 20.291]
  - - [2048, 4096, 1, 8192, 2048, 2048, 8192, 8192]
    - [51, 18.747]
  - - [2048, 8192, 1, 128, 2048, 2048, 128, 128]
    - [77, 6.845]
  - - [2048, 8192, 1, 256, 2048, 2048, 256, 256]
    - [77, 10.232]
  - - [2048, 8192, 1, 512, 2048, 2048, 512, 512]
    - [77, 12.998]
  - - [2048, 8192, 1, 1024, 2048, 2048, 1024, 1024]
    - [58, 15.926]
  - - [2048, 8192, 1, 2048, 2048, 2048, 2048, 2048]
    - [64, 19.23]
  - - [2048, 8192, 1, 4096, 2048, 2048, 4096, 4096]
    - [58, 21.265]
  - - [2048, 8192, 1, 8192, 2048, 2048, 8192, 8192]
    - [58, 22.167]
  - - [4096, 128, 1, 128, 4096, 4096, 128, 128]
    - [28, 2.248]
  - - [4096, 128, 1, 256, 4096, 4096, 256, 256]
    - [28, 3.87]
  - - [4096, 128, 1, 512, 4096, 4096, 512, 512]
    - [26, 6.112]
  - - [4096, 128, 1, 1024, 4096, 4096, 1024, 1024]
    - [26, 8.502]
  - - [4096, 128, 1, 2048, 4096, 4096, 2048, 2048]
    - [111, 10.071]
  - - [4096, 128, 1, 4096, 4096, 4096, 4096, 4096]
    - [8, 11.839]
  - - [4096, 128, 1, 8192, 4096, 4096, 8192, 8192]
    - [11, 13.152]
  - - [4096, 256, 1, 128, 4096, 4096, 128, 128]
    - [23, 3.628]
  - - [4096, 256, 1, 256, 4096, 4096, 256, 256]
    - [22, 5.95]
  - - [4096, 256, 1, 512, 4096, 4096, 512, 512]
    - [95, 9.067]
  - - [4096, 256, 1, 1024, 4096, 4096, 1024, 1024]
    - [95, 12.423]
  - - [4096, 256, 1, 2048, 4096, 4096, 2048, 2048]
    - [97, 13.27]
  - - [4096, 256, 1, 4096, 4096, 4096, 4096, 4096]
    - [66, 14.462]
  - - [4096, 256, 1, 8192, 4096, 4096, 8192, 8192]
    - [67, 15.859]
  - - [4096, 512, 1, 128, 4096, 4096, 128, 128]
    - [13, 5.05]
  - - [4096, 512, 1, 256, 4096, 4096, 256, 256]
    - [70, 8.129]
  - - [4096, 512, 1, 512, 4096, 4096, 512, 512]
    - [87, 11.767]
  - - [4096, 512, 1, 1024, 4096, 4096, 1024, 1024]
    - [70, 14.85]
  - - [4096, 512, 1, 2048, 4096, 4096, 2048, 2048]
    - [71, 16.0]
  - - [4096, 512, 1, 4096, 4096, 4096, 4096, 4096]
    - [51, 16.851]
  - - [4096, 512, 1, 8192, 4096, 4096, 8192, 8192]
    - [58, 17.165]
  - - [4096, 1024, 1, 128, 4096, 4096, 128, 128]
    - [40, 5.975]
  - - [4096, 1024, 1, 256, 4096, 4096, 256, 256]
    - [41, 9.058]
  - - [4096, 1024, 1, 512, 4096, 4096, 512, 512]
    - [1, 13.151]
  - - [4096, 1024, 1, 1024, 4096, 4096, 1024, 1024]
    - [61, 16.047]
  - - [4096, 1024, 1, 2048, 4096, 4096, 2048, 2048]
    - [61, 18.777]
  - - [4096, 1024, 1, 4096, 4096, 4096, 4096, 4096]
    - [51, 18.337]
  - - [4096, 1024, 1, 8192, 4096, 4096, 8192, 8192]
    - [61, 18.941]
  - - [4096, 2048, 1, 128, 4096, 4096, 128, 128]
    - [89, 5.756]
  - - [4096, 2048, 1, 256, 4096, 4096, 256, 256]
    - [81, 9.073]
  - - [4096, 2048, 1, 512, 4096, 4096, 512, 512]
    - [86, 12.586]
  - - [4096, 2048, 1, 1024, 4096, 4096, 1024, 1024]
    - [65, 15.647]
  - - [4096, 2048, 1, 2048, 4096, 4096, 2048, 2048]
    - [50, 17.815]
  - - [4096, 2048, 1, 4096, 4096, 4096, 4096, 4096]
    - [53, 19.524]
  - - [4096, 2048, 1, 8192, 4096, 4096, 8192, 8192]
    - [49, 21.563]
  - - [4096, 4096, 1, 128, 4096, 4096, 128, 128]
    - [19, 6.541]
  - - [4096, 4096, 1, 256, 4096, 4096, 256, 256]
    - [80, 9.479]
  - - [4096, 4096, 1, 512, 4096, 4096, 512, 512]
    - [81, 12.896]
  - - [4096, 4096, 1, 1024, 4096, 4096, 1024, 1024]
    - [60, 16.427]
  - - [4096, 4096, 1, 2048, 4096, 4096, 2048, 2048]
    - [61, 18.561]
  - - [4096, 4096, 1, 4096, 4096, 4096, 4096, 4096]
    - [55, 21.459]
  - - [4096, 4096, 1, 8192, 4096, 4096, 8192, 8192]
    - [63, 21.95]
  - - [4096, 8192, 1, 128, 4096, 4096, 128, 128]
    - [16, 6.041]
  - - [4096, 8192, 1, 256, 4096, 4096, 256, 256]
    - [21, 8.69]
  - - [4096, 8192, 1, 512, 4096, 4096, 512, 512]
    - [63, 12.605]
  - - [4096, 8192, 1, 1024, 4096, 4096, 1024, 1024]
    - [61, 16.605]
  - - [4096, 8192, 1, 2048, 4096, 4096, 2048, 2048]
    - [56, 19.64]
  - - [4096, 8192, 1, 4096, 4096, 4096, 4096, 4096]
    - [64, 22.728]
  - - [4096, 8192, 1, 8192, 4096, 4096, 8192, 8192]
    - [61, 24.097]
  - - [8192, 128, 1, 128, 8192, 8192, 128, 128]
    - [22, 3.588]
  - - [8192, 128, 1, 256, 8192, 8192, 256, 256]
    - [90, 5.915]
  - - [8192, 128, 1, 512, 8192, 8192, 512, 512]
    - [97, 9.079]
  - - [8192, 128, 1, 1024, 8192, 8192, 1024, 1024]
    - [97, 11.336]
  - - [8192, 128, 1, 2048, 8192, 8192, 2048, 2048]
    - [11, 12.343]
  - - [8192, 128, 1, 4096, 8192, 8192, 4096, 4096]
    - [11, 14.621]
  - - [8192, 128, 1, 8192, 8192, 8192, 8192, 8192]
    - [7, 16.418]
  - - [8192, 256, 1, 128, 8192, 8192, 128, 128]
    - [86, 4.945]
  - - [8192, 256, 1, 256, 8192, 8192, 256, 256]
    - [9, 7.973]
  - - [8192, 256, 1, 512, 8192, 8192, 512, 512]
    - [70, 11.511]
  - - [8192, 256, 1, 1024, 8192, 8192, 1024, 1024]
    - [70, 14.449]
  - - [8192, 256, 1, 2048, 8192, 8192, 2048, 2048]
    - [73, 16.147]
  - - [8192, 256, 1, 4096, 8192, 8192, 4096, 4096]
    - [49, 17.758]
  - - [8192, 256, 1, 8192, 8192, 8192, 8192, 8192]
    - [49, 18.261]
  - - [8192, 512, 1, 128, 8192, 8192, 128, 128]
    - [40, 5.703]
  - - [8192, 512, 1, 256, 8192, 8192, 256, 256]
    - [40, 8.794]
  - - [8192, 512, 1, 512, 8192, 8192, 512, 512]
    - [1, 12.854]
  - - [8192, 512, 1, 1024, 8192, 8192, 1024, 1024]
    - [54, 15.666]
  - - [8192, 512, 1, 2048, 8192, 8192, 2048, 2048]
    - [59, 18.099]
  - - [8192, 512, 1, 4096, 8192, 8192, 4096, 4096]
    - [51, 18.096]
  - - [8192, 512, 1, 8192, 8192, 8192, 8192, 8192]
    - [51, 18.534]
  - - [8192, 1024, 1, 128, 8192, 8192, 128, 128]
    - [86, 5.826]
  - - [8192, 1024, 1, 256, 8192, 8192, 256, 256]
    - [86, 9.304]
  - - [8192, 1024, 1, 512, 8192, 8192, 512, 512]
    - [86, 12.55]
  - - [8192, 1024, 1, 1024, 8192, 8192, 1024, 1024]
    - [73, 15.497]
  - - [8192, 1024, 1, 2048, 8192, 8192, 2048, 2048]
    - [49, 16.632]
  - - [8192, 1024, 1, 4096, 8192, 8192, 4096, 4096]
    - [49, 19.822]
  - - [8192, 1024, 1, 8192, 8192, 8192, 8192, 8192]
    - [49, 20.251]
  - - [8192, 2048, 1, 128, 8192, 8192, 128, 128]
    - [85, 6.455]
  - - [8192, 2048, 1, 256, 8192, 8192, 256, 256]
    - [83, 9.412]
  - - [8192, 2048, 1, 512, 8192, 8192, 512, 512]
    - [72, 12.208]
  - - [8192, 2048, 1, 1024, 8192, 8192, 1024, 1024]
    - [63, 16.28]
  - - [8192, 2048, 1, 2048, 8192, 8192, 2048, 2048]
    - [60, 18.411]
  - - [8192, 2048, 1, 4096, 8192, 8192, 4096, 4096]
    - [57, 20.79]
  - - [8192, 2048, 1, 8192, 8192, 8192, 8192, 8192]
    - [59, 22.395]
  - - [8192, 4096, 1, 128, 8192, 8192, 128, 128]
    - [88, 6.025]
  - - [8192, 4096, 1, 256, 8192, 8192, 256, 256]
    - [81, 8.656]
  - - [8192, 4096, 1, 512, 8192, 8192, 512, 512]
    - [61, 12.884]
  - - [8192, 4096, 1, 1024, 8192, 8192, 1024, 1024]
    - [61, 16.59]
  - - [8192, 4096, 1, 2048, 8192, 8192, 2048, 2048]
    - [57, 19.395]
  - - [8192, 4096, 1, 4096, 8192, 8192, 4096, 4096]
    - [62, 22.821]
  - - [8192, 4096, 1, 8192, 8192, 8192, 8192, 8192]
    - [55, 23.363]
  - - [8192, 8192, 1, 128, 8192, 8192, 128, 128]
    - [78, 5.403]
  - - [8192, 8192, 1, 256, 8192, 8192, 256, 256]
    - [58, 8.442]
  - - [8192, 8192, 1, 512, 8192, 8192, 512, 512]
    - [61, 13.25]
  - - [8192, 8192, 1, 1024, 8192, 8192, 1024, 1024]
    - [63, 17.728]
  - - [8192, 8192, 1, 2048, 8192, 8192, 2048, 2048]
    - [63, 20.243]
  - - [8192, 8192, 1, 4096, 8192, 8192, 4096, 4096]
    - [61, 23.965]
  - - [8192, 8192, 1, 8192, 8192, 8192, 8192, 8192]
    - [56, 23.383]
  - - [1, 1, 1, 32, 1, 1, 32, 32]
    - [117, 0.0]
- null
- null
- DeviceEfficiency
- GridBased
