library/src/amd_detail/rocblaslt/src/Tensile/Logic/streamk/gfx942/aquavanjaram942_Cijk_Ailk_Bljk_BSS_BH_UserArgs.yaml
- {MinimumRequiredVersion: 4.33.0}
- aquavanjaram942
- gfx942
- [Device 0049, Device 0050]
    SolutionIndex: 0
    SolutionNameMin: Cijk_Ailk_Bljk_BSS_BH_UserArgs_MT256x64x32_MI16x16x1_SN_LDSB1_CLR1_GSU0_GSUC0_GSUWGMRR0_K1_LBSPPA2048_LBSPPB128_LPA0_MIWT8_2_PLR1_SU32_SUM0_SUS256_SKXCCM0_VWA4_VWB2_WGM1_WGMXCC1_WGMXCCGn1
    SolutionIndex: 1
    SolutionNameMin: Cijk_Ailk_Bljk_BSS_BH_UserArgs_MT32x32x32_MI16x16x1_SN_LDSB0_CLR1_GSU0_GSUC0_GSUWGMRR0_K1_LBSPPA256_LBSPPB128_LPA16_MIWT1_1_PLR1_SU32_SUM0_SUS256_SKXCCM0_VWA1_VWB1_WGM1_WGMXCC1_WGMXCCGn1
    SolutionIndex: 2
    SolutionNameMin: Cijk_Ailk_Bljk_BSS_BH_UserArgs_MT32x32x32_MI16x16x1_SN_LDSB0_CLR0_GSU0_GSUC0_GSUWGMRR0_K1_LBSPPA256_LBSPPB128_LPA16_MIWT1_1_PLR0_SU32_SUM0_SUS256_SKXCCM0_VWA1_VWB1_WGM1_WGMXCC1_WGMXCCGn1
    SolutionIndex: 3
    SolutionNameMin: Cijk_Ailk_Bljk_BSS_BH_UserArgs_MT128x256x64_MI16x16x1_SN_LDSB1_CLR1_GSU0_GSUC0_GSUWGMRR0_K1_LBSPPA2048_LBSPPB1024_LPA0_MIWT4_8_PLR1_SU32_SUM0_SUS256_SKXCCM0_VWA4_VWB8_WGM1_WGMXCC1_WGMXCCGn1
    SolutionIndex: 4
    SolutionNameMin: Cijk_Ailk_Bljk_BSS_BH_UserArgs_MT256x128x64_MI16x16x1_SN_LDSB1_CLR1_GSU0_GSUC0_GSUWGMRR0_K1_LBSPPA4096_LBSPPB256_LPA0_MIWT8_4_PLR1_SU32_SUM0_SUS256_SKXCCM0_VWA4_VWB2_WGM1_WGMXCC1_WGMXCCGn1
    SolutionIndex: 5
    SolutionNameMin: Cijk_Ailk_Bljk_BSS_BH_UserArgs_MT256x128x64_MI16x16x1_SN_LDSB1_CLR1_GSU0_GSUC0_GSUWGMRR0_K1_LBSPPA4096_LBSPPB512_LPA0_MIWT8_4_PLR1_SU32_SUM0_SUS256_SKXCCM0_VWA4_VWB4_WGM1_WGMXCC1_WGMXCCGn1
    SolutionIndex: 6
    SolutionNameMin: Cijk_Ailk_Bljk_BSS_BH_UserArgs_MT256x128x64_MI16x16x1_SN_LDSB1_CLR1_GSU0_GSUC0_GSUWGMRR0_K1_LBSPPA4096_LBSPPB512_LPA0_MIWT8_4_PLR1_SU32_SUM0_SUS256_SKXCCM0_VWA4_VWB4_WGM8_WGMXCC1_WGMXCCGn1
    SolutionIndex: 7
    SolutionNameMin: Cijk_Ailk_Bljk_BSS_BH_UserArgs_MT128x128x64_MI16x16x1_SN_LDSB1_CLR1_GSU0_GSUC0_GSUWGMRR0_K1_LBSPPA2048_LBSPPB128_LPA0_MIWT4_4_PLR1_SU32_SUM0_SUS256_SKXCCM0_VWA4_VWB1_WGM1_WGMXCC1_WGMXCCGn1
    SolutionIndex: 8
    SolutionNameMin: Cijk_Ailk_Bljk_BSS_BH_UserArgs_MT128x128x64_MI16x16x1_SN_LDSB1_CLR1_GSU0_GSUC0_GSUWGMRR0_K1_LBSPPA2048_LBSPPB256_LPA0_MIWT4_4_PLR1_SU32_SUM0_SUS256_SKXCCM0_VWA4_VWB2_WGM1_WGMXCC1_WGMXCCGn1
    SolutionIndex: 9
    SolutionNameMin: Cijk_Ailk_Bljk_BSS_BH_UserArgs_MT128x128x64_MI16x16x1_SN_LDSB1_CLR1_GSU0_GSUC0_GSUWGMRR0_K1_LBSPPA2048_LBSPPB512_LPA0_MIWT4_4_PLR1_SU32_SUM0_SUS256_SKXCCM0_VWA4_VWB4_WGM1_WGMXCC1_WGMXCCGn1
    SolutionIndex: 10
    SolutionNameMin: Cijk_Ailk_Bljk_BSS_BH_UserArgs_MT128x128x64_MI16x16x1_SN_LDSB1_CLR1_GSU0_GSUC0_GSUWGMRR0_K1_LBSPPA2048_LBSPPB128_LPA0_MIWT4_4_PLR1_SU32_SUM0_SUS256_SKXCCM0_VWA4_VWB1_WGM4_WGMXCC1_WGMXCCGn1
    SolutionIndex: 11
    SolutionNameMin: Cijk_Ailk_Bljk_BSS_BH_UserArgs_MT128x128x64_MI16x16x1_SN_LDSB1_CLR1_GSU0_GSUC0_GSUWGMRR0_K1_LBSPPA2048_LBSPPB512_LPA0_MIWT4_4_PLR1_SU32_SUM0_SUS256_SKXCCM0_VWA4_VWB4_WGM4_WGMXCC1_WGMXCCGn1
    SolutionIndex: 12
    SolutionNameMin: Cijk_Ailk_Bljk_BSS_BH_UserArgs_MT128x64x64_MI16x16x1_SN_LDSB1_CLR1_GSU0_GSUC0_GSUWGMRR0_K1_LBSPPA2048_LBSPPB256_LPA0_MIWT4_2_PLR1_SU32_SUM0_SUS256_SKXCCM0_VWA4_VWB2_WGM1_WGMXCC1_WGMXCCGn1
    SolutionIndex: 13
    SolutionNameMin: Cijk_Ailk_Bljk_BSS_BH_UserArgs_MT64x64x64_MI16x16x1_SN_LDSB1_CLR1_GSU0_GSUC0_GSUWGMRR0_K1_LBSPPA1024_LBSPPB256_LPA16_MIWT2_2_PLR1_SU32_SUM0_SUS256_SKXCCM0_VWA1_VWB2_WGM1_WGMXCC1_WGMXCCGn1
    SolutionIndex: 14
    SolutionNameMin: Cijk_Ailk_Bljk_BSS_BH_UserArgs_MT32x32x64_MI16x16x1_SN_LDSB0_CLR1_GSU0_GSUC0_GSUWGMRR0_K1_LBSPPA512_LBSPPB128_LPA16_MIWT1_1_PLR1_SU32_SUM0_SUS256_SKXCCM0_VWA1_VWB1_WGM1_WGMXCC1_WGMXCCGn1
    SolutionIndex: 15
    SolutionNameMin: Cijk_Ailk_Bljk_BSS_BH_UserArgs_MT64x128x128_MI16x16x1_SN_LDSB1_CLR1_GSU0_GSUC0_GSUWGMRR0_K1_LBSPPA1024_LBSPPB256_LPA32_MIWT2_4_PLR2_SU32_SUM0_SUS256_SKXCCM0_VWA2_VWB1_WGM1_WGMXCC1_WGMXCCGn1
    SolutionIndex: 16
    SolutionNameMin: Cijk_Ailk_Bljk_BSS_BH_UserArgs_MT64x128x128_MI16x16x1_SN_LDSB1_CLR1_GSU0_GSUC0_GSUWGMRR0_K1_LBSPPA1024_LBSPPB256_LPA16_MIWT2_4_PLR1_SU32_SUM0_SUS256_SKXCCM0_VWA1_VWB1_WGM8_WGMXCC1_WGMXCCGn1
    SolutionIndex: 17
    SolutionNameMin: Cijk_Ailk_Bljk_BSS_BH_UserArgs_MT64x128x128_MI16x16x1_SN_LDSB1_CLR1_GSU0_GSUC0_GSUWGMRR0_K1_LBSPPA1024_LBSPPB1024_LPA32_MIWT2_4_PLR2_SU32_SUM0_SUS256_SKXCCM0_VWA2_VWB4_WGM8_WGMXCC1_WGMXCCGn1
    SolutionIndex: 18
    SolutionNameMin: Cijk_Ailk_Bljk_BSS_BH_UserArgs_MT128x64x128_MI16x16x1_SN_LDSB1_CLR1_GSU0_GSUC0_GSUWGMRR0_K1_LBSPPA2048_LBSPPB512_LPA0_MIWT4_2_PLR1_SU32_SUM0_SUS256_SKXCCM0_VWA4_VWB2_WGM1_WGMXCC1_WGMXCCGn1
    SolutionIndex: 19
    SolutionNameMin: Cijk_Ailk_Bljk_BSS_BH_UserArgs_MT128x64x128_MI16x16x1_SN_LDSB1_CLR1_GSU0_GSUC0_GSUWGMRR0_K1_LBSPPA2048_LBSPPB256_LPA0_MIWT4_2_PLR2_SU32_SUM0_SUS256_SKXCCM0_VWA4_VWB1_WGM1_WGMXCC1_WGMXCCGn1
    SolutionIndex: 20
    SolutionNameMin: Cijk_Ailk_Bljk_BSS_BH_UserArgs_MT128x64x128_MI16x16x1_SN_LDSB1_CLR1_GSU0_GSUC0_GSUWGMRR0_K1_LBSPPA2048_LBSPPB512_LPA0_MIWT4_2_PLR2_SU32_SUM0_SUS256_SKXCCM0_VWA4_VWB2_WGM1_WGMXCC1_WGMXCCGn1
    SolutionIndex: 21
    SolutionNameMin: Cijk_Ailk_Bljk_BSS_BH_UserArgs_MT128x64x128_MI16x16x1_SN_LDSB1_CLR1_GSU0_GSUC0_GSUWGMRR0_K1_LBSPPA2048_LBSPPB256_LPA0_MIWT4_2_PLR1_SU32_SUM0_SUS256_SKXCCM0_VWA4_VWB1_WGM4_WGMXCC1_WGMXCCGn1
    SolutionIndex: 22
    SolutionNameMin: Cijk_Ailk_Bljk_BSS_BH_UserArgs_MT128x64x128_MI16x16x1_SN_LDSB1_CLR1_GSU0_GSUC0_GSUWGMRR0_K1_LBSPPA2048_LBSPPB512_LPA0_MIWT4_2_PLR1_SU32_SUM0_SUS256_SKXCCM0_VWA4_VWB2_WGM4_WGMXCC1_WGMXCCGn1
    SolutionIndex: 23
    SolutionNameMin: Cijk_Ailk_Bljk_BSS_BH_UserArgs_MT128x64x128_MI16x16x1_SN_LDSB1_CLR1_GSU0_GSUC0_GSUWGMRR0_K1_LBSPPA2048_LBSPPB256_LPA0_MIWT4_2_PLR2_SU32_SUM0_SUS256_SKXCCM0_VWA4_VWB1_WGM4_WGMXCC1_WGMXCCGn1
    SolutionIndex: 24
    SolutionNameMin: Cijk_Ailk_Bljk_BSS_BH_UserArgs_MT128x64x128_MI16x16x1_SN_LDSB1_CLR1_GSU0_GSUC0_GSUWGMRR0_K1_LBSPPA2048_LBSPPB512_LPA0_MIWT4_2_PLR2_SU32_SUM0_SUS256_SKXCCM0_VWA4_VWB2_WGM4_WGMXCC1_WGMXCCGn1
    SolutionIndex: 25
    SolutionNameMin: Cijk_Ailk_Bljk_BSS_BH_UserArgs_MT128x64x128_MI16x16x1_SN_LDSB1_CLR1_GSU0_GSUC0_GSUWGMRR0_K1_LBSPPA2048_LBSPPB256_LPA0_MIWT4_2_PLR1_SU32_SUM0_SUS256_SKXCCM0_VWA4_VWB1_WGM8_WGMXCC1_WGMXCCGn1
    SolutionIndex: 26
    SolutionNameMin: Cijk_Ailk_Bljk_BSS_BH_UserArgs_MT128x64x128_MI16x16x1_SN_LDSB1_CLR1_GSU0_GSUC0_GSUWGMRR0_K1_LBSPPA2048_LBSPPB512_LPA0_MIWT4_2_PLR1_SU32_SUM0_SUS256_SKXCCM0_VWA4_VWB2_WGM8_WGMXCC1_WGMXCCGn1
    SolutionIndex: 27
    SolutionNameMin: Cijk_Ailk_Bljk_BSS_BH_UserArgs_MT128x64x128_MI16x16x1_SN_LDSB1_CLR1_GSU0_GSUC0_GSUWGMRR0_K1_LBSPPA2048_LBSPPB256_LPA0_MIWT4_2_PLR2_SU32_SUM0_SUS256_SKXCCM0_VWA4_VWB1_WGM8_WGMXCC1_WGMXCCGn1
    SolutionIndex: 28
    SolutionNameMin: Cijk_Ailk_Bljk_BSS_BH_UserArgs_MT128x32x128_MI16x16x1_SN_LDSB1_CLR1_GSU0_GSUC0_GSUWGMRR0_K1_LBSPPA2048_LBSPPB256_LPA0_MIWT4_1_PLR2_SU32_SUM0_SUS256_SKXCCM0_VWA4_VWB1_WGM4_WGMXCC1_WGMXCCGn1
    SolutionIndex: 29
    SolutionNameMin: Cijk_Ailk_Bljk_BSS_BH_UserArgs_MT128x32x128_MI16x16x1_SN_LDSB1_CLR1_GSU0_GSUC0_GSUWGMRR0_K1_LBSPPA2048_LBSPPB256_LPA0_MIWT4_1_PLR2_SU32_SUM0_SUS256_SKXCCM0_VWA4_VWB1_WGM8_WGMXCC1_WGMXCCGn1
    SolutionIndex: 30
    SolutionNameMin: Cijk_Ailk_Bljk_BSS_BH_UserArgs_MT64x64x128_MI16x16x1_SN_LDSB1_CLR1_GSU0_GSUC0_GSUWGMRR0_K1_LBSPPA1024_LBSPPB512_LPA32_MIWT2_2_PLR2_SU32_SUM0_SUS256_SKXCCM0_VWA2_VWB2_WGM4_WGMXCC1_WGMXCCGn1
    SolutionIndex: 31
    SolutionNameMin: Cijk_Ailk_Bljk_BSS_BH_UserArgs_MT64x64x128_MI16x16x1_SN_LDSB1_CLR1_GSU0_GSUC0_GSUWGMRR0_K1_LBSPPA1024_LBSPPB512_LPA32_MIWT2_2_PLR2_SU32_SUM0_SUS256_SKXCCM0_VWA2_VWB2_WGM8_WGMXCC1_WGMXCCGn1
    SolutionIndex: 32
    SolutionNameMin: Cijk_Ailk_Bljk_BSS_BH_UserArgs_MT32x64x128_MI16x16x1_SN_LDSB1_CLR1_GSU0_GSUC0_GSUWGMRR0_K1_LBSPPA512_LBSPPB256_LPA16_MIWT1_2_PLR2_SU32_SUM0_SUS256_SKXCCM0_VWA1_VWB1_WGM1_WGMXCC1_WGMXCCGn1
    SolutionIndex: 33
    SolutionNameMin: Cijk_Ailk_Bljk_BSS_BH_UserArgs_MT32x64x128_MI16x16x1_SN_LDSB1_CLR1_GSU0_GSUC0_GSUWGMRR0_K1_LBSPPA512_LBSPPB512_LPA16_MIWT1_2_PLR2_SU32_SUM0_SUS256_SKXCCM0_VWA1_VWB2_WGM1_WGMXCC1_WGMXCCGn1
    SolutionIndex: 34
    SolutionNameMin: Cijk_Ailk_Bljk_BSS_BH_UserArgs_MT64x32x128_MI16x16x1_SN_LDSB1_CLR1_GSU0_GSUC0_GSUWGMRR0_K1_LBSPPA1024_LBSPPB256_LPA32_MIWT2_1_PLR2_SU32_SUM0_SUS256_SKXCCM0_VWA2_VWB1_WGM1_WGMXCC1_WGMXCCGn1
    SolutionIndex: 35
    SolutionNameMin: Cijk_Ailk_Bljk_BSS_BH_UserArgs_MT32x32x128_MI16x16x1_SN_LDSB1_CLR1_GSU0_GSUC0_GSUWGMRR0_K1_LBSPPA512_LBSPPB256_LPA16_MIWT1_1_PLR1_SU32_SUM0_SUS256_SKXCCM0_VWA1_VWB1_WGM1_WGMXCC1_WGMXCCGn1
    SolutionIndex: 36
    SolutionNameMin: Cijk_Ailk_Bljk_BSS_BH_UserArgs_MT32x32x128_MI16x16x1_SN_LDSB1_CLR1_GSU0_GSUC0_GSUWGMRR0_K1_LBSPPA512_LBSPPB256_LPA16_MIWT1_1_PLR2_SU32_SUM0_SUS256_SKXCCM0_VWA1_VWB1_WGM1_WGMXCC1_WGMXCCGn1
    SolutionIndex: 37
    SolutionNameMin: Cijk_Ailk_Bljk_BSS_BH_UserArgs_MT32x32x128_MI16x16x1_SN_LDSB1_CLR1_GSU0_GSUC0_GSUWGMRR0_K1_LBSPPA512_LBSPPB256_LPA16_MIWT1_1_PLR2_SU32_SUM0_SUS256_SKXCCM0_VWA1_VWB1_WGM8_WGMXCC1_WGMXCCGn1
    SolutionIndex: 38
    SolutionNameMin: Cijk_Ailk_Bljk_BSS_BH_UserArgs_MT256x256x32_MI16x16x1_SN_LDSB1_CLR1_GSU0_GSUC0_GSUWGMRR0_K1_LBSPPA2048_LBSPPB128_LPA0_MIWT8_8_PLR1_SU32_SUM0_SUS256_SKXCCM8_VWA4_VWB1_WGM1_WGMXCC1_WGMXCCGn1
    SolutionIndex: 39
    SolutionNameMin: Cijk_Ailk_Bljk_BSS_BH_UserArgs_MT256x256x32_MI16x16x1_SN_LDSB1_CLR1_GSU0_GSUC0_GSUWGMRR0_K1_LBSPPA2048_LBSPPB256_LPA0_MIWT8_8_PLR1_SU32_SUM0_SUS256_SKXCCM8_VWA4_VWB4_WGM1_WGMXCC1_WGMXCCGn1
    SolutionIndex: 40
    SolutionNameMin: Cijk_Ailk_Bljk_BSS_BH_UserArgs_MT256x256x32_MI16x16x1_SN_LDSB1_CLR1_GSU0_GSUC0_GSUWGMRR0_K1_LBSPPA2048_LBSPPB512_LPA0_MIWT8_8_PLR1_SU32_SUM0_SUS256_SKXCCM8_VWA4_VWB8_WGM1_WGMXCC1_WGMXCCGn1
    SolutionIndex: 41
    SolutionNameMin: Cijk_Ailk_Bljk_BSS_BH_UserArgs_MT256x256x32_MI16x16x1_SN_LDSB1_CLR1_GSU0_GSUC0_GSUWGMRR0_K1_LBSPPA2048_LBSPPB128_LPA0_MIWT8_8_PLR1_SU32_SUM0_SUS256_SKXCCM8_VWA4_VWB1_WGM4_WGMXCC1_WGMXCCGn1
    SolutionIndex: 42
    SolutionNameMin: Cijk_Ailk_Bljk_BSS_BH_UserArgs_MT256x256x32_MI16x16x1_SN_LDSB1_CLR1_GSU0_GSUC0_GSUWGMRR0_K1_LBSPPA2048_LBSPPB256_LPA0_MIWT8_8_PLR1_SU32_SUM0_SUS256_SKXCCM8_VWA4_VWB4_WGM4_WGMXCC1_WGMXCCGn1
    SolutionIndex: 43
    SolutionNameMin: Cijk_Ailk_Bljk_BSS_BH_UserArgs_MT256x256x32_MI16x16x1_SN_LDSB1_CLR1_GSU0_GSUC0_GSUWGMRR0_K1_LBSPPA2048_LBSPPB512_LPA0_MIWT8_8_PLR1_SU32_SUM0_SUS256_SKXCCM8_VWA4_VWB8_WGM4_WGMXCC1_WGMXCCGn1
    SolutionIndex: 44
    SolutionNameMin: Cijk_Ailk_Bljk_BSS_BH_UserArgs_MT256x256x32_MI16x16x1_SN_LDSB1_CLR1_GSU0_GSUC0_GSUWGMRR0_K1_LBSPPA2048_LBSPPB128_LPA0_MIWT8_8_PLR1_SU32_SUM0_SUS256_SKXCCM8_VWA4_VWB1_WGM8_WGMXCC1_WGMXCCGn1
    SolutionIndex: 45
    SolutionNameMin: Cijk_Ailk_Bljk_BSS_BH_UserArgs_MT256x256x32_MI16x16x1_SN_LDSB1_CLR1_GSU0_GSUC0_GSUWGMRR0_K1_LBSPPA2048_LBSPPB128_LPA0_MIWT8_8_PLR1_SU32_SUM0_SUS256_SKXCCM8_VWA4_VWB2_WGM8_WGMXCC1_WGMXCCGn1
    SolutionIndex: 46
    SolutionNameMin: Cijk_Ailk_Bljk_BSS_BH_UserArgs_MT256x256x32_MI16x16x1_SN_LDSB1_CLR1_GSU0_GSUC0_GSUWGMRR0_K1_LBSPPA2048_LBSPPB512_LPA0_MIWT8_8_PLR1_SU32_SUM0_SUS256_SKXCCM8_VWA4_VWB8_WGM8_WGMXCC1_WGMXCCGn1
    SolutionIndex: 47
    SolutionNameMin: Cijk_Ailk_Bljk_BSS_BH_UserArgs_MT32x32x32_MI16x16x1_SN_LDSB0_CLR1_GSU0_GSUC0_GSUWGMRR0_K1_LBSPPA256_LBSPPB128_LPA16_MIWT1_1_PLR1_SU32_SUM0_SUS256_SKXCCM8_VWA1_VWB1_WGM1_WGMXCC1_WGMXCCGn1
    SolutionIndex: 48
    SolutionNameMin: Cijk_Ailk_Bljk_BSS_BH_UserArgs_MT128x256x64_MI16x16x1_SN_LDSB1_CLR1_GSU0_GSUC0_GSUWGMRR0_K1_LBSPPA2048_LBSPPB128_LPA0_MIWT4_8_PLR1_SU32_SUM0_SUS256_SKXCCM8_VWA4_VWB1_WGM1_WGMXCC1_WGMXCCGn1
    SolutionIndex: 49
    SolutionNameMin: Cijk_Ailk_Bljk_BSS_BH_UserArgs_MT128x256x64_MI16x16x1_SN_LDSB1_CLR1_GSU0_GSUC0_GSUWGMRR0_K1_LBSPPA2048_LBSPPB256_LPA0_MIWT4_8_PLR1_SU32_SUM0_SUS256_SKXCCM8_VWA4_VWB2_WGM1_WGMXCC1_WGMXCCGn1
    SolutionIndex: 50
    SolutionNameMin: Cijk_Ailk_Bljk_BSS_BH_UserArgs_MT128x256x64_MI16x16x1_SN_LDSB1_CLR1_GSU0_GSUC0_GSUWGMRR0_K1_LBSPPA2048_LBSPPB512_LPA0_MIWT4_8_PLR1_SU32_SUM0_SUS256_SKXCCM8_VWA4_VWB4_WGM1_WGMXCC1_WGMXCCGn1
    SolutionIndex: 51
    SolutionNameMin: Cijk_Ailk_Bljk_BSS_BH_UserArgs_MT128x256x64_MI16x16x1_SN_LDSB1_CLR1_GSU0_GSUC0_GSUWGMRR0_K1_LBSPPA2048_LBSPPB1024_LPA0_MIWT4_8_PLR1_SU32_SUM0_SUS256_SKXCCM8_VWA4_VWB8_WGM1_WGMXCC1_WGMXCCGn1
    SolutionIndex: 52
    SolutionNameMin: Cijk_Ailk_Bljk_BSS_BH_UserArgs_MT128x256x64_MI16x16x1_SN_LDSB1_CLR1_GSU0_GSUC0_GSUWGMRR0_K1_LBSPPA2048_LBSPPB128_LPA0_MIWT4_8_PLR1_SU32_SUM0_SUS256_SKXCCM8_VWA4_VWB1_WGM4_WGMXCC1_WGMXCCGn1
    SolutionIndex: 53
    SolutionNameMin: Cijk_Ailk_Bljk_BSS_BH_UserArgs_MT128x256x64_MI16x16x1_SN_LDSB1_CLR1_GSU0_GSUC0_GSUWGMRR0_K1_LBSPPA2048_LBSPPB256_LPA0_MIWT4_8_PLR1_SU32_SUM0_SUS256_SKXCCM8_VWA4_VWB2_WGM4_WGMXCC1_WGMXCCGn1
    SolutionIndex: 54
    SolutionNameMin: Cijk_Ailk_Bljk_BSS_BH_UserArgs_MT128x256x64_MI16x16x1_SN_LDSB1_CLR1_GSU0_GSUC0_GSUWGMRR0_K1_LBSPPA2048_LBSPPB1024_LPA0_MIWT4_8_PLR1_SU32_SUM0_SUS256_SKXCCM8_VWA4_VWB8_WGM4_WGMXCC1_WGMXCCGn1
    SolutionIndex: 55
    SolutionNameMin: Cijk_Ailk_Bljk_BSS_BH_UserArgs_MT128x128x64_MI16x16x1_SN_LDSB1_CLR1_GSU0_GSUC0_GSUWGMRR0_K1_LBSPPA2048_LBSPPB128_LPA0_MIWT4_4_PLR1_SU32_SUM0_SUS256_SKXCCM8_VWA4_VWB1_WGM1_WGMXCC1_WGMXCCGn1
    SolutionIndex: 56
    SolutionNameMin: Cijk_Ailk_Bljk_BSS_BH_UserArgs_MT128x128x64_MI16x16x1_SN_LDSB1_CLR1_GSU0_GSUC0_GSUWGMRR0_K1_LBSPPA2048_LBSPPB256_LPA0_MIWT4_4_PLR1_SU32_SUM0_SUS256_SKXCCM8_VWA4_VWB2_WGM1_WGMXCC1_WGMXCCGn1
    SolutionIndex: 57
    SolutionNameMin: Cijk_Ailk_Bljk_BSS_BH_UserArgs_MT128x128x64_MI16x16x1_SN_LDSB1_CLR1_GSU0_GSUC0_GSUWGMRR0_K1_LBSPPA2048_LBSPPB512_LPA0_MIWT4_4_PLR1_SU32_SUM0_SUS256_SKXCCM8_VWA4_VWB4_WGM1_WGMXCC1_WGMXCCGn1
    SolutionIndex: 58
    SolutionNameMin: Cijk_Ailk_Bljk_BSS_BH_UserArgs_MT128x128x64_MI16x16x1_SN_LDSB1_CLR1_GSU0_GSUC0_GSUWGMRR0_K1_LBSPPA2048_LBSPPB128_LPA0_MIWT4_4_PLR1_SU32_SUM0_SUS256_SKXCCM8_VWA4_VWB1_WGM4_WGMXCC1_WGMXCCGn1
    SolutionIndex: 59
    SolutionNameMin: Cijk_Ailk_Bljk_BSS_BH_UserArgs_MT128x128x64_MI16x16x1_SN_LDSB1_CLR1_GSU0_GSUC0_GSUWGMRR0_K1_LBSPPA2048_LBSPPB256_LPA0_MIWT4_4_PLR1_SU32_SUM0_SUS256_SKXCCM8_VWA4_VWB2_WGM4_WGMXCC1_WGMXCCGn1
    SolutionIndex: 60
    SolutionNameMin: Cijk_Ailk_Bljk_BSS_BH_UserArgs_MT128x128x64_MI16x16x1_SN_LDSB1_CLR1_GSU0_GSUC0_GSUWGMRR0_K1_LBSPPA2048_LBSPPB512_LPA0_MIWT4_4_PLR1_SU32_SUM0_SUS256_SKXCCM8_VWA4_VWB4_WGM4_WGMXCC1_WGMXCCGn1
    SolutionIndex: 61
    SolutionNameMin: Cijk_Ailk_Bljk_BSS_BH_UserArgs_MT128x128x64_MI16x16x1_SN_LDSB1_CLR1_GSU0_GSUC0_GSUWGMRR0_K1_LBSPPA2048_LBSPPB128_LPA0_MIWT4_4_PLR1_SU32_SUM0_SUS256_SKXCCM8_VWA4_VWB1_WGM8_WGMXCC1_WGMXCCGn1
    SolutionIndex: 62
    SolutionNameMin: Cijk_Ailk_Bljk_BSS_BH_UserArgs_MT128x128x64_MI16x16x1_SN_LDSB1_CLR1_GSU0_GSUC0_GSUWGMRR0_K1_LBSPPA2048_LBSPPB256_LPA0_MIWT4_4_PLR1_SU32_SUM0_SUS256_SKXCCM8_VWA4_VWB2_WGM8_WGMXCC1_WGMXCCGn1
    SolutionIndex: 63
    SolutionNameMin: Cijk_Ailk_Bljk_BSS_BH_UserArgs_MT128x128x64_MI16x16x1_SN_LDSB1_CLR1_GSU0_GSUC0_GSUWGMRR0_K1_LBSPPA2048_LBSPPB512_LPA0_MIWT4_4_PLR1_SU32_SUM0_SUS256_SKXCCM8_VWA4_VWB4_WGM8_WGMXCC1_WGMXCCGn1
    SolutionIndex: 64
    SolutionNameMin: Cijk_Ailk_Bljk_BSS_BH_UserArgs_MT64x128x64_MI16x16x1_SN_LDSB1_CLR1_GSU0_GSUC0_GSUWGMRR0_K1_LBSPPA1024_LBSPPB128_LPA32_MIWT2_4_PLR1_SU32_SUM0_SUS256_SKXCCM8_VWA2_VWB1_WGM1_WGMXCC1_WGMXCCGn1
    SolutionIndex: 65
    SolutionNameMin: Cijk_Ailk_Bljk_BSS_BH_UserArgs_MT64x128x64_MI16x16x1_SN_LDSB1_CLR1_GSU0_GSUC0_GSUWGMRR0_K1_LBSPPA1024_LBSPPB256_LPA32_MIWT2_4_PLR1_SU32_SUM0_SUS256_SKXCCM8_VWA2_VWB2_WGM1_WGMXCC1_WGMXCCGn1
    SolutionIndex: 66
    SolutionNameMin: Cijk_Ailk_Bljk_BSS_BH_UserArgs_MT64x128x64_MI16x16x1_SN_LDSB1_CLR1_GSU0_GSUC0_GSUWGMRR0_K1_LBSPPA1024_LBSPPB512_LPA32_MIWT2_4_PLR1_SU32_SUM0_SUS256_SKXCCM8_VWA2_VWB4_WGM1_WGMXCC1_WGMXCCGn1
    SolutionIndex: 67
    SolutionNameMin: Cijk_Ailk_Bljk_BSS_BH_UserArgs_MT64x128x64_MI16x16x1_SN_LDSB1_CLR1_GSU0_GSUC0_GSUWGMRR0_K1_LBSPPA1024_LBSPPB512_LPA32_MIWT2_4_PLR1_SU32_SUM0_SUS256_SKXCCM8_VWA2_VWB4_WGM8_WGMXCC1_WGMXCCGn1
    SolutionIndex: 68
    SolutionNameMin: Cijk_Ailk_Bljk_BSS_BH_UserArgs_MT128x64x64_MI16x16x1_SN_LDSB1_CLR1_GSU0_GSUC0_GSUWGMRR0_K1_LBSPPA2048_LBSPPB256_LPA0_MIWT4_2_PLR1_SU32_SUM0_SUS256_SKXCCM8_VWA4_VWB2_WGM1_WGMXCC1_WGMXCCGn1
    SolutionIndex: 69
    SolutionNameMin: Cijk_Ailk_Bljk_BSS_BH_UserArgs_MT128x64x64_MI16x16x1_SN_LDSB1_CLR1_GSU0_GSUC0_GSUWGMRR0_K1_LBSPPA2048_LBSPPB128_LPA0_MIWT4_2_PLR1_SU32_SUM0_SUS256_SKXCCM8_VWA4_VWB1_WGM4_WGMXCC1_WGMXCCGn1
    SolutionIndex: 70
    SolutionNameMin: Cijk_Ailk_Bljk_BSS_BH_UserArgs_MT128x64x64_MI16x16x1_SN_LDSB1_CLR1_GSU0_GSUC0_GSUWGMRR0_K1_LBSPPA2048_LBSPPB128_LPA0_MIWT4_2_PLR1_SU32_SUM0_SUS256_SKXCCM8_VWA4_VWB1_WGM8_WGMXCC1_WGMXCCGn1
    SolutionIndex: 71
    SolutionNameMin: Cijk_Ailk_Bljk_BSS_BH_UserArgs_MT128x64x64_MI16x16x1_SN_LDSB1_CLR1_GSU0_GSUC0_GSUWGMRR0_K1_LBSPPA2048_LBSPPB256_LPA0_MIWT4_2_PLR1_SU32_SUM0_SUS256_SKXCCM8_VWA4_VWB2_WGM8_WGMXCC1_WGMXCCGn1
    SolutionIndex: 72
    SolutionNameMin: Cijk_Ailk_Bljk_BSS_BH_UserArgs_MT64x64x64_MI16x16x1_SN_LDSB1_CLR1_GSU0_GSUC0_GSUWGMRR0_K1_LBSPPA1024_LBSPPB128_LPA32_MIWT2_2_PLR1_SU32_SUM0_SUS256_SKXCCM8_VWA2_VWB1_WGM1_WGMXCC1_WGMXCCGn1
    SolutionIndex: 73
    SolutionNameMin: Cijk_Ailk_Bljk_BSS_BH_UserArgs_MT64x64x64_MI16x16x1_SN_LDSB1_CLR1_GSU0_GSUC0_GSUWGMRR0_K1_LBSPPA1024_LBSPPB256_LPA32_MIWT2_2_PLR1_SU32_SUM0_SUS256_SKXCCM8_VWA2_VWB2_WGM1_WGMXCC1_WGMXCCGn1
    SolutionIndex: 74
    SolutionNameMin: Cijk_Ailk_Bljk_BSS_BH_UserArgs_MT64x64x64_MI16x16x1_SN_LDSB1_CLR1_GSU0_GSUC0_GSUWGMRR0_K1_LBSPPA1024_LBSPPB128_LPA32_MIWT2_2_PLR1_SU32_SUM0_SUS256_SKXCCM8_VWA2_VWB1_WGM4_WGMXCC1_WGMXCCGn1
    SolutionIndex: 75
    SolutionNameMin: Cijk_Ailk_Bljk_BSS_BH_UserArgs_MT64x64x64_MI16x16x1_SN_LDSB1_CLR1_GSU0_GSUC0_GSUWGMRR0_K1_LBSPPA1024_LBSPPB256_LPA32_MIWT2_2_PLR1_SU32_SUM0_SUS256_SKXCCM8_VWA2_VWB2_WGM4_WGMXCC1_WGMXCCGn1
    SolutionIndex: 76
    SolutionNameMin: Cijk_Ailk_Bljk_BSS_BH_UserArgs_MT32x32x64_MI16x16x1_SN_LDSB0_CLR1_GSU0_GSUC0_GSUWGMRR0_K1_LBSPPA512_LBSPPB128_LPA16_MIWT1_1_PLR1_SU32_SUM0_SUS256_SKXCCM8_VWA1_VWB1_WGM1_WGMXCC1_WGMXCCGn1
    SolutionIndex: 77
    SolutionNameMin: Cijk_Ailk_Bljk_BSS_BH_UserArgs_MT64x128x128_MI16x16x1_SN_LDSB1_CLR1_GSU0_GSUC0_GSUWGMRR0_K1_LBSPPA1024_LBSPPB512_LPA16_MIWT2_4_PLR2_SU32_SUM0_SUS256_SKXCCM8_VWA1_VWB2_WGM1_WGMXCC1_WGMXCCGn1
    SolutionIndex: 78
    SolutionNameMin: Cijk_Ailk_Bljk_BSS_BH_UserArgs_MT64x128x128_MI16x16x1_SN_LDSB1_CLR1_GSU0_GSUC0_GSUWGMRR0_K1_LBSPPA1024_LBSPPB256_LPA16_MIWT2_4_PLR1_SU32_SUM0_SUS256_SKXCCM8_VWA1_VWB1_WGM4_WGMXCC1_WGMXCCGn1
    SolutionIndex: 79
    SolutionNameMin: Cijk_Ailk_Bljk_BSS_BH_UserArgs_MT128x64x128_MI16x16x1_SN_LDSB1_CLR1_GSU0_GSUC0_GSUWGMRR0_K1_LBSPPA2048_LBSPPB256_LPA0_MIWT4_2_PLR1_SU32_SUM0_SUS256_SKXCCM8_VWA4_VWB1_WGM1_WGMXCC1_WGMXCCGn1
    SolutionIndex: 80
    SolutionNameMin: Cijk_Ailk_Bljk_BSS_BH_UserArgs_MT128x64x128_MI16x16x1_SN_LDSB1_CLR1_GSU0_GSUC0_GSUWGMRR0_K1_LBSPPA2048_LBSPPB512_LPA0_MIWT4_2_PLR1_SU32_SUM0_SUS256_SKXCCM8_VWA4_VWB2_WGM1_WGMXCC1_WGMXCCGn1
    SolutionIndex: 81
    SolutionNameMin: Cijk_Ailk_Bljk_BSS_BH_UserArgs_MT128x64x128_MI16x16x1_SN_LDSB1_CLR1_GSU0_GSUC0_GSUWGMRR0_K1_LBSPPA2048_LBSPPB256_LPA0_MIWT4_2_PLR2_SU32_SUM0_SUS256_SKXCCM8_VWA4_VWB1_WGM1_WGMXCC1_WGMXCCGn1
    SolutionIndex: 82
    SolutionNameMin: Cijk_Ailk_Bljk_BSS_BH_UserArgs_MT128x64x128_MI16x16x1_SN_LDSB1_CLR1_GSU0_GSUC0_GSUWGMRR0_K1_LBSPPA2048_LBSPPB512_LPA0_MIWT4_2_PLR2_SU32_SUM0_SUS256_SKXCCM8_VWA4_VWB2_WGM1_WGMXCC1_WGMXCCGn1
    SolutionIndex: 83
    SolutionNameMin: Cijk_Ailk_Bljk_BSS_BH_UserArgs_MT128x64x128_MI16x16x1_SN_LDSB1_CLR1_GSU0_GSUC0_GSUWGMRR0_K1_LBSPPA2048_LBSPPB512_LPA0_MIWT4_2_PLR2_SU32_SUM0_SUS256_SKXCCM8_VWA4_VWB2_WGM4_WGMXCC1_WGMXCCGn1
    SolutionIndex: 84
    SolutionNameMin: Cijk_Ailk_Bljk_BSS_BH_UserArgs_MT128x64x128_MI16x16x1_SN_LDSB1_CLR1_GSU0_GSUC0_GSUWGMRR0_K1_LBSPPA2048_LBSPPB256_LPA0_MIWT4_2_PLR1_SU32_SUM0_SUS256_SKXCCM8_VWA4_VWB1_WGM8_WGMXCC1_WGMXCCGn1
    SolutionIndex: 85
    SolutionNameMin: Cijk_Ailk_Bljk_BSS_BH_UserArgs_MT128x64x128_MI16x16x1_SN_LDSB1_CLR1_GSU0_GSUC0_GSUWGMRR0_K1_LBSPPA2048_LBSPPB512_LPA0_MIWT4_2_PLR1_SU32_SUM0_SUS256_SKXCCM8_VWA4_VWB2_WGM8_WGMXCC1_WGMXCCGn1
    SolutionIndex: 86
    SolutionNameMin: Cijk_Ailk_Bljk_BSS_BH_UserArgs_MT128x64x128_MI16x16x1_SN_LDSB1_CLR1_GSU0_GSUC0_GSUWGMRR0_K1_LBSPPA2048_LBSPPB256_LPA0_MIWT4_2_PLR2_SU32_SUM0_SUS256_SKXCCM8_VWA4_VWB1_WGM8_WGMXCC1_WGMXCCGn1
    SolutionIndex: 87
    SolutionNameMin: Cijk_Ailk_Bljk_BSS_BH_UserArgs_MT128x64x128_MI16x16x1_SN_LDSB1_CLR1_GSU0_GSUC0_GSUWGMRR0_K1_LBSPPA2048_LBSPPB512_LPA0_MIWT4_2_PLR2_SU32_SUM0_SUS256_SKXCCM8_VWA4_VWB2_WGM8_WGMXCC1_WGMXCCGn1
    SolutionIndex: 88
    SolutionNameMin: Cijk_Ailk_Bljk_BSS_BH_UserArgs_MT128x32x128_MI16x16x1_SN_LDSB1_CLR1_GSU0_GSUC0_GSUWGMRR0_K1_LBSPPA2048_LBSPPB256_LPA0_MIWT4_1_PLR1_SU32_SUM0_SUS256_SKXCCM8_VWA4_VWB1_WGM1_WGMXCC1_WGMXCCGn1
    SolutionIndex: 89
    SolutionNameMin: Cijk_Ailk_Bljk_BSS_BH_UserArgs_MT128x32x128_MI16x16x1_SN_LDSB1_CLR1_GSU0_GSUC0_GSUWGMRR0_K1_LBSPPA2048_LBSPPB256_LPA0_MIWT4_1_PLR2_SU32_SUM0_SUS256_SKXCCM8_VWA4_VWB1_WGM1_WGMXCC1_WGMXCCGn1
    SolutionIndex: 90
    SolutionNameMin: Cijk_Ailk_Bljk_BSS_BH_UserArgs_MT64x64x128_MI16x16x1_SN_LDSB1_CLR1_GSU0_GSUC0_GSUWGMRR0_K1_LBSPPA1024_LBSPPB256_LPA16_MIWT2_2_PLR2_SU32_SUM0_SUS256_SKXCCM8_VWA1_VWB1_WGM1_WGMXCC1_WGMXCCGn1
    SolutionIndex: 91
    SolutionNameMin: Cijk_Ailk_Bljk_BSS_BH_UserArgs_MT64x64x128_MI16x16x1_SN_LDSB1_CLR1_GSU0_GSUC0_GSUWGMRR0_K1_LBSPPA1024_LBSPPB256_LPA32_MIWT2_2_PLR2_SU32_SUM0_SUS256_SKXCCM8_VWA2_VWB1_WGM1_WGMXCC1_WGMXCCGn1
    SolutionIndex: 92
    SolutionNameMin: Cijk_Ailk_Bljk_BSS_BH_UserArgs_MT64x64x128_MI16x16x1_SN_LDSB1_CLR1_GSU0_GSUC0_GSUWGMRR0_K1_LBSPPA1024_LBSPPB512_LPA32_MIWT2_2_PLR2_SU32_SUM0_SUS256_SKXCCM8_VWA2_VWB2_WGM1_WGMXCC1_WGMXCCGn1
    SolutionIndex: 93
    SolutionNameMin: Cijk_Ailk_Bljk_BSS_BH_UserArgs_MT64x64x128_MI16x16x1_SN_LDSB1_CLR1_GSU0_GSUC0_GSUWGMRR0_K1_LBSPPA1024_LBSPPB256_LPA32_MIWT2_2_PLR2_SU32_SUM0_SUS256_SKXCCM8_VWA2_VWB1_WGM4_WGMXCC1_WGMXCCGn1
    SolutionIndex: 94
    SolutionNameMin: Cijk_Ailk_Bljk_BSS_BH_UserArgs_MT64x64x128_MI16x16x1_SN_LDSB1_CLR1_GSU0_GSUC0_GSUWGMRR0_K1_LBSPPA1024_LBSPPB512_LPA32_MIWT2_2_PLR2_SU32_SUM0_SUS256_SKXCCM8_VWA2_VWB2_WGM4_WGMXCC1_WGMXCCGn1
    SolutionIndex: 95
    SolutionNameMin: Cijk_Ailk_Bljk_BSS_BH_UserArgs_MT64x64x128_MI16x16x1_SN_LDSB1_CLR1_GSU0_GSUC0_GSUWGMRR0_K1_LBSPPA1024_LBSPPB256_LPA16_MIWT2_2_PLR2_SU32_SUM0_SUS256_SKXCCM8_VWA1_VWB1_WGM8_WGMXCC1_WGMXCCGn1
    SolutionIndex: 96
    SolutionNameMin: Cijk_Ailk_Bljk_BSS_BH_UserArgs_MT64x64x128_MI16x16x1_SN_LDSB1_CLR1_GSU0_GSUC0_GSUWGMRR0_K1_LBSPPA1024_LBSPPB256_LPA32_MIWT2_2_PLR2_SU32_SUM0_SUS256_SKXCCM8_VWA2_VWB1_WGM8_WGMXCC1_WGMXCCGn1
    SolutionIndex: 97
    SolutionNameMin: Cijk_Ailk_Bljk_BSS_BH_UserArgs_MT64x64x128_MI16x16x1_SN_LDSB1_CLR1_GSU0_GSUC0_GSUWGMRR0_K1_LBSPPA1024_LBSPPB512_LPA32_MIWT2_2_PLR2_SU32_SUM0_SUS256_SKXCCM8_VWA2_VWB2_WGM8_WGMXCC1_WGMXCCGn1
    SolutionIndex: 98
    SolutionNameMin: Cijk_Ailk_Bljk_BSS_BH_UserArgs_MT64x32x128_MI16x16x1_SN_LDSB1_CLR1_GSU0_GSUC0_GSUWGMRR0_K1_LBSPPA1024_LBSPPB256_LPA32_MIWT2_1_PLR2_SU32_SUM0_SUS256_SKXCCM8_VWA2_VWB1_WGM1_WGMXCC1_WGMXCCGn1
    SolutionIndex: 99
    SolutionNameMin: Cijk_Ailk_Bljk_BSS_BH_UserArgs_MT64x32x128_MI16x16x1_SN_LDSB1_CLR1_GSU0_GSUC0_GSUWGMRR0_K1_LBSPPA1024_LBSPPB256_LPA32_MIWT2_1_PLR2_SU32_SUM0_SUS256_SKXCCM8_VWA2_VWB1_WGM4_WGMXCC1_WGMXCCGn1
    SolutionIndex: 100
    SolutionNameMin: Cijk_Ailk_Bljk_BSS_BH_UserArgs_MT64x32x128_MI16x16x1_SN_LDSB1_CLR1_GSU0_GSUC0_GSUWGMRR0_K1_LBSPPA1024_LBSPPB256_LPA32_MIWT2_1_PLR2_SU32_SUM0_SUS256_SKXCCM8_VWA2_VWB1_WGM8_WGMXCC1_WGMXCCGn1
    SolutionIndex: 101
    SolutionNameMin: Cijk_Ailk_Bljk_BSS_BH_UserArgs_MT32x32x128_MI16x16x1_SN_LDSB1_CLR1_GSU0_GSUC0_GSUWGMRR0_K1_LBSPPA512_LBSPPB256_LPA16_MIWT1_1_PLR1_SU32_SUM0_SUS256_SKXCCM8_VWA1_VWB1_WGM1_WGMXCC1_WGMXCCGn1
    SolutionIndex: 102
    SolutionNameMin: Cijk_Ailk_Bljk_BSS_BH_UserArgs_MT32x32x128_MI16x16x1_SN_LDSB1_CLR1_GSU0_GSUC0_GSUWGMRR0_K1_LBSPPA512_LBSPPB256_LPA16_MIWT1_1_PLR2_SU32_SUM0_SUS256_SKXCCM8_VWA1_VWB1_WGM1_WGMXCC1_WGMXCCGn1
    SolutionIndex: 103
    SolutionNameMin: Cijk_Ailk_Bljk_BSS_BH_UserArgs_MT32x32x128_MI16x16x1_SN_LDSB1_CLR1_GSU0_GSUC0_GSUWGMRR0_K1_LBSPPA512_LBSPPB256_LPA16_MIWT1_1_PLR2_SU32_SUM0_SUS256_SKXCCM8_VWA1_VWB1_WGM4_WGMXCC1_WGMXCCGn1
    SolutionIndex: 104
    SolutionNameMin: Cijk_Ailk_Bljk_BSS_BH_UserArgs_MT32x32x128_MI16x16x1_SN_LDSB1_CLR1_GSU0_GSUC0_GSUWGMRR0_K1_LBSPPA512_LBSPPB256_LPA16_MIWT1_1_PLR1_SU32_SUM0_SUS256_SKXCCM8_VWA1_VWB1_WGM8_WGMXCC1_WGMXCCGn1
    SolutionIndex: 105
    SolutionNameMin: Cijk_Ailk_Bljk_BSS_BH_UserArgs_MT32x32x128_MI16x16x1_SN_LDSB1_CLR1_GSU0_GSUC0_GSUWGMRR0_K1_LBSPPA512_LBSPPB256_LPA16_MIWT1_1_PLR2_SU32_SUM0_SUS256_SKXCCM8_VWA1_VWB1_WGM8_WGMXCC1_WGMXCCGn1
    SolutionIndex: 106
    SolutionNameMin: Cijk_Ailk_Bljk_BSS_BH_UserArgs_MT32x32x32_MI16x16x1_SN_LDSB0_CLR0_GSU0_GSUC0_GSUWGMRR0_K1_LBSPPA256_LBSPPB128_LPA16_MIWT1_1_PLR0_SU32_SUM0_SUS256_SKXCCM0_VWA1_VWB1_WGM8_WGMXCC1_WGMXCCGn1
- - - [128, 128, 1, 128, 128, 128, 128, 128]
    - [101, 0.084]
  - - [128, 128, 1, 256, 128, 128, 128, 256]
    - [37, 0.103]
  - - [128, 128, 1, 512, 128, 128, 128, 512]
    - [36, 0.173]
  - - [128, 128, 1, 1024, 128, 128, 128, 1024]
    - [36, 0.246]
  - - [128, 128, 1, 2048, 128, 128, 128, 2048]
    - [101, 0.31]
  - - [128, 128, 1, 4096, 128, 128, 128, 4096]
    - [2, 0.526]
  - - [128, 128, 1, 8192, 128, 128, 128, 8192]
    - [47, 1.019]
  - - [128, 256, 1, 128, 128, 128, 128, 128]
    - [35, 0.167]
  - - [128, 256, 1, 256, 128, 128, 128, 256]
    - [35, 0.205]
  - - [128, 256, 1, 512, 128, 128, 128, 512]
    - [35, 0.333]
  - - [128, 256, 1, 1024, 128, 128, 128, 1024]
    - [102, 0.53]
  - - [128, 256, 1, 2048, 128, 128, 128, 2048]
    - [1, 0.818]
  - - [128, 256, 1, 4096, 128, 128, 128, 4096]
    - [14, 1.532]
  - - [128, 256, 1, 8192, 128, 128, 128, 8192]
    - [76, 2.724]
  - - [128, 512, 1, 128, 128, 128, 128, 128]
    - [102, 0.316]
  - - [128, 512, 1, 256, 128, 128, 128, 256]
    - [36, 0.407]
  - - [128, 512, 1, 512, 128, 128, 128, 512]
    - [101, 0.658]
  - - [128, 512, 1, 1024, 128, 128, 128, 1024]
    - [102, 1.065]
  - - [128, 512, 1, 2048, 128, 128, 128, 2048]
    - [35, 1.95]
  - - [128, 512, 1, 4096, 128, 128, 128, 4096]
    - [101, 3.412]
  - - [128, 512, 1, 8192, 128, 128, 128, 8192]
    - [102, 5.327]
  - - [128, 1024, 1, 128, 128, 128, 128, 128]
    - [36, 0.649]
  - - [128, 1024, 1, 256, 128, 128, 128, 256]
    - [101, 0.759]
  - - [128, 1024, 1, 512, 128, 128, 128, 512]
    - [102, 1.344]
  - - [128, 1024, 1, 1024, 128, 128, 128, 1024]
    - [35, 2.271]
  - - [128, 1024, 1, 2048, 128, 128, 128, 2048]
    - [35, 3.763]
  - - [128, 1024, 1, 4096, 128, 128, 128, 4096]
    - [34, 5.874]
  - - [128, 1024, 1, 8192, 128, 128, 128, 8192]
    - [98, 8.67]
  - - [128, 2048, 1, 128, 128, 128, 128, 128]
    - [101, 1.218]
  - - [128, 2048, 1, 256, 128, 128, 128, 256]
    - [35, 1.522]
  - - [128, 2048, 1, 512, 128, 128, 128, 512]
    - [35, 2.487]
  - - [128, 2048, 1, 1024, 128, 128, 128, 1024]
    - [98, 4.079]
  - - [128, 2048, 1, 2048, 128, 128, 128, 2048]
    - [34, 6.71]
  - - [128, 2048, 1, 4096, 128, 128, 128, 4096]
    - [98, 9.855]
  - - [128, 2048, 1, 8192, 128, 128, 128, 8192]
    - [74, 12.182]
  - - [128, 4096, 1, 128, 128, 128, 128, 128]
    - [98, 2.217]
  - - [128, 4096, 1, 256, 128, 128, 128, 256]
    - [98, 2.879]
  - - [128, 4096, 1, 512, 128, 128, 128, 512]
    - [98, 4.614]
  - - [128, 4096, 1, 1024, 128, 128, 128, 1024]
    - [98, 7.229]
  - - [128, 4096, 1, 2048, 128, 128, 128, 2048]
    - [98, 10.394]
  - - [128, 4096, 1, 4096, 128, 128, 128, 4096]
    - [12, 13.494]
  - - [128, 4096, 1, 8192, 128, 128, 128, 8192]
    - [82, 16.906]
  - - [128, 8192, 1, 128, 128, 128, 128, 128]
    - [92, 3.615]
  - - [128, 8192, 1, 256, 128, 128, 128, 256]
    - [89, 4.827]
  - - [128, 8192, 1, 512, 128, 128, 128, 512]
    - [92, 7.802]
  - - [128, 8192, 1, 1024, 128, 128, 128, 1024]
    - [91, 11.403]
  - - [128, 8192, 1, 2048, 128, 128, 128, 2048]
    - [92, 14.266]
  - - [128, 8192, 1, 4096, 128, 128, 128, 4096]
    - [69, 18.12]
  - - [128, 8192, 1, 8192, 128, 128, 128, 8192]
    - [21, 21.979]
  - - [256, 128, 1, 128, 256, 256, 256, 128]
    - [35, 0.163]
  - - [256, 128, 1, 256, 256, 256, 256, 256]
    - [36, 0.202]
  - - [256, 128, 1, 512, 256, 256, 256, 512]
    - [101, 0.34]
  - - [256, 128, 1, 1024, 256, 256, 256, 1024]
    - [101, 0.523]
  - - [256, 128, 1, 2048, 256, 256, 256, 2048]
    - [1, 0.8]
  - - [256, 128, 1, 4096, 256, 256, 256, 4096]
    - [14, 1.553]
  - - [256, 128, 1, 8192, 256, 256, 256, 8192]
    - [104, 2.601]
  - - [256, 256, 1, 128, 256, 256, 256, 128]
    - [36, 0.328]
  - - [256, 256, 1, 256, 256, 256, 256, 256]
    - [36, 0.407]
  - - [256, 256, 1, 512, 256, 256, 256, 512]
    - [102, 0.675]
  - - [256, 256, 1, 1024, 256, 256, 256, 1024]
    - [14, 1.047]
  - - [256, 256, 1, 2048, 256, 256, 256, 2048]
    - [36, 1.978]
  - - [256, 256, 1, 4096, 256, 256, 256, 4096]
    - [102, 3.38]
  - - [256, 256, 1, 8192, 256, 256, 256, 8192]
    - [103, 5.036]
  - - [256, 512, 1, 128, 256, 256, 256, 128]
    - [36, 0.647]
  - - [256, 512, 1, 256, 256, 256, 256, 256]
    - [102, 0.758]
  - - [256, 512, 1, 512, 256, 256, 256, 512]
    - [101, 1.317]
  - - [256, 512, 1, 1024, 256, 256, 256, 1024]
    - [102, 2.292]
  - - [256, 512, 1, 2048, 256, 256, 256, 2048]
    - [101, 3.821]
  - - [256, 512, 1, 4096, 256, 256, 256, 4096]
    - [102, 6.011]
  - - [256, 512, 1, 8192, 256, 256, 256, 8192]
    - [100, 8.004]
  - - [256, 1024, 1, 128, 256, 256, 256, 128]
    - [35, 1.231]
  - - [256, 1024, 1, 256, 256, 256, 256, 256]
    - [36, 1.578]
  - - [256, 1024, 1, 512, 256, 256, 256, 512]
    - [36, 2.51]
  - - [256, 1024, 1, 1024, 256, 256, 256, 1024]
    - [98, 4.07]
  - - [256, 1024, 1, 2048, 256, 256, 256, 2048]
    - [34, 6.738]
  - - [256, 1024, 1, 4096, 256, 256, 256, 4096]
    - [98, 9.815]
  - - [256, 1024, 1, 8192, 256, 256, 256, 8192]
    - [72, 12.288]
  - - [256, 2048, 1, 128, 256, 256, 256, 128]
    - [33, 2.21]
  - - [256, 2048, 1, 256, 256, 256, 256, 256]
    - [32, 2.868]
  - - [256, 2048, 1, 512, 256, 256, 256, 512]
    - [98, 4.648]
  - - [256, 2048, 1, 1024, 256, 256, 256, 1024]
    - [98, 7.209]
  - - [256, 2048, 1, 2048, 256, 256, 256, 2048]
    - [98, 10.26]
  - - [256, 2048, 1, 4096, 256, 256, 256, 4096]
    - [73, 13.526]
  - - [256, 2048, 1, 8192, 256, 256, 256, 8192]
    - [23, 15.981]
  - - [256, 4096, 1, 128, 256, 256, 256, 128]
    - [90, 3.57]
  - - [256, 4096, 1, 256, 256, 256, 256, 256]
    - [88, 4.781]
  - - [256, 4096, 1, 512, 256, 256, 256, 512]
    - [92, 7.712]
  - - [256, 4096, 1, 1024, 256, 256, 256, 1024]
    - [91, 11.649]
  - - [256, 4096, 1, 2048, 256, 256, 256, 2048]
    - [82, 14.992]
  - - [256, 4096, 1, 4096, 256, 256, 256, 4096]
    - [71, 18.634]
  - - [256, 4096, 1, 8192, 256, 256, 256, 8192]
    - [59, 21.837]
  - - [256, 8192, 1, 128, 256, 256, 256, 128]
    - [17, 5.347]
  - - [256, 8192, 1, 256, 256, 256, 256, 256]
    - [27, 7.58]
  - - [256, 8192, 1, 512, 256, 256, 256, 512]
    - [80, 10.854]
  - - [256, 8192, 1, 1024, 256, 256, 256, 1024]
    - [81, 14.902]
  - - [256, 8192, 1, 2048, 256, 256, 256, 2048]
    - [81, 18.513]
  - - [256, 8192, 1, 4096, 256, 256, 256, 4096]
    - [62, 23.638]
  - - [256, 8192, 1, 8192, 256, 256, 256, 8192]
    - [10, 27.8]
  - - [512, 128, 1, 128, 512, 512, 512, 128]
    - [35, 0.328]
  - - [512, 128, 1, 256, 512, 512, 512, 256]
    - [35, 0.408]
  - - [512, 128, 1, 512, 512, 512, 512, 512]
    - [101, 0.655]
  - - [512, 128, 1, 1024, 512, 512, 512, 1024]
    - [102, 1.058]
  - - [512, 128, 1, 2048, 512, 512, 512, 2048]
    - [14, 1.966]
  - - [512, 128, 1, 4096, 512, 512, 512, 4096]
    - [104, 3.197]
  - - [512, 128, 1, 8192, 512, 512, 512, 8192]
    - [105, 4.636]
  - - [512, 256, 1, 128, 512, 512, 512, 128]
    - [35, 0.645]
  - - [512, 256, 1, 256, 512, 512, 512, 256]
    - [35, 0.758]
  - - [512, 256, 1, 512, 512, 512, 512, 512]
    - [101, 1.325]
  - - [512, 256, 1, 1024, 512, 512, 512, 1024]
    - [35, 2.239]
  - - [512, 256, 1, 2048, 512, 512, 512, 2048]
    - [101, 3.751]
  - - [512, 256, 1, 4096, 512, 512, 512, 4096]
    - [100, 5.72]
  - - [512, 256, 1, 8192, 512, 512, 512, 8192]
    - [100, 7.678]
  - - [512, 512, 1, 128, 512, 512, 512, 128]
    - [35, 1.195]
  - - [512, 512, 1, 256, 512, 512, 512, 256]
    - [35, 1.58]
  - - [512, 512, 1, 512, 512, 512, 512, 512]
    - [102, 2.53]
  - - [512, 512, 1, 1024, 512, 512, 512, 1024]
    - [35, 4.052]
  - - [512, 512, 1, 2048, 512, 512, 512, 2048]
    - [98, 6.6]
  - - [512, 512, 1, 4096, 512, 512, 512, 4096]
    - [100, 8.865]
  - - [512, 512, 1, 8192, 512, 512, 512, 8192]
    - [73, 11.657]
  - - [512, 1024, 1, 128, 512, 512, 512, 128]
    - [98, 2.228]
  - - [512, 1024, 1, 256, 512, 512, 512, 256]
    - [32, 2.866]
  - - [512, 1024, 1, 512, 512, 512, 512, 512]
    - [98, 4.605]
  - - [512, 1024, 1, 1024, 512, 512, 512, 1024]
    - [98, 7.158]
  - - [512, 1024, 1, 2048, 512, 512, 512, 2048]
    - [92, 10.309]
  - - [512, 1024, 1, 4096, 512, 512, 512, 4096]
    - [73, 13.261]
  - - [512, 1024, 1, 8192, 512, 512, 512, 8192]
    - [68, 16.371]
  - - [512, 2048, 1, 128, 512, 512, 512, 128]
    - [31, 3.678]
  - - [512, 2048, 1, 256, 512, 512, 512, 256]
    - [29, 4.803]
  - - [512, 2048, 1, 512, 512, 512, 512, 512]
    - [92, 7.636]
  - - [512, 2048, 1, 1024, 512, 512, 512, 1024]
    - [91, 11.422]
  - - [512, 2048, 1, 2048, 512, 512, 512, 2048]
    - [92, 14.813]
  - - [512, 2048, 1, 4096, 512, 512, 512, 4096]
    - [66, 18.148]
  - - [512, 2048, 1, 8192, 512, 512, 512, 8192]
    - [55, 21.713]
  - - [512, 4096, 1, 128, 512, 512, 512, 128]
    - [22, 5.467]
  - - [512, 4096, 1, 256, 512, 512, 512, 256]
    - [23, 7.792]
  - - [512, 4096, 1, 512, 512, 512, 512, 512]
    - [79, 10.66]
  - - [512, 4096, 1, 1024, 512, 512, 512, 1024]
    - [82, 14.922]
  - - [512, 4096, 1, 2048, 512, 512, 512, 2048]
    - [81, 18.55]
  - - [512, 4096, 1, 4096, 512, 512, 512, 4096]
    - [61, 22.92]
  - - [512, 4096, 1, 8192, 512, 512, 512, 8192]
    - [59, 26.259]
  - - [512, 8192, 1, 128, 512, 512, 512, 128]
    - [27, 6.777]
  - - [512, 8192, 1, 256, 512, 512, 512, 256]
    - [25, 9.268]
  - - [512, 8192, 1, 512, 512, 512, 512, 512]
    - [82, 13.3]
  - - [512, 8192, 1, 1024, 512, 512, 512, 1024]
    - [82, 17.837]
  - - [512, 8192, 1, 2048, 512, 512, 512, 2048]
    - [63, 22.89]
  - - [512, 8192, 1, 4096, 512, 512, 512, 4096]
    - [6, 27.312]
  - - [512, 8192, 1, 8192, 512, 512, 512, 8192]
    - [4, 29.093]
  - - [1024, 128, 1, 128, 1024, 1024, 1024, 128]
    - [36, 0.647]
  - - [1024, 128, 1, 256, 1024, 1024, 1024, 256]
    - [35, 0.75]
  - - [1024, 128, 1, 512, 1024, 1024, 1024, 512]
    - [102, 1.339]
  - - [1024, 128, 1, 1024, 1024, 1024, 1024, 1024]
    - [35, 2.284]
  - - [1024, 128, 1, 2048, 1024, 1024, 1024, 2048]
    - [35, 3.551]
  - - [1024, 128, 1, 4096, 1024, 1024, 1024, 4096]
    - [100, 5.218]
  - - [1024, 128, 1, 8192, 1024, 1024, 1024, 8192]
    - [100, 7.097]
  - - [1024, 256, 1, 128, 1024, 1024, 1024, 128]
    - [35, 1.227]
  - - [1024, 256, 1, 256, 1024, 1024, 1024, 256]
    - [102, 1.539]
  - - [1024, 256, 1, 512, 1024, 1024, 1024, 512]
    - [102, 2.519]
  - - [1024, 256, 1, 1024, 1024, 1024, 1024, 1024]
    - [98, 4.154]
  - - [1024, 256, 1, 2048, 1024, 1024, 1024, 2048]
    - [99, 6.277]
  - - [1024, 256, 1, 4096, 1024, 1024, 1024, 4096]
    - [94, 8.401]
  - - [1024, 256, 1, 8192, 1024, 1024, 1024, 8192]
    - [72, 11.341]
  - - [1024, 512, 1, 128, 1024, 1024, 1024, 128]
    - [98, 2.192]
  - - [1024, 512, 1, 256, 1024, 1024, 1024, 256]
    - [33, 2.83]
  - - [1024, 512, 1, 512, 1024, 1024, 1024, 512]
    - [98, 4.594]
  - - [1024, 512, 1, 1024, 1024, 1024, 1024, 1024]
    - [98, 7.089]
  - - [1024, 512, 1, 2048, 1024, 1024, 1024, 2048]
    - [93, 9.997]
  - - [1024, 512, 1, 4096, 1024, 1024, 1024, 4096]
    - [75, 12.536]
  - - [1024, 512, 1, 8192, 1024, 1024, 1024, 8192]
    - [66, 15.968]
  - - [1024, 1024, 1, 128, 1024, 1024, 1024, 128]
    - [30, 3.644]
  - - [1024, 1024, 1, 256, 1024, 1024, 1024, 256]
    - [28, 4.792]
  - - [1024, 1024, 1, 512, 1024, 1024, 1024, 512]
    - [92, 7.783]
  - - [1024, 1024, 1, 1024, 1024, 1024, 1024, 1024]
    - [92, 11.246]
  - - [1024, 1024, 1, 2048, 1024, 1024, 1024, 2048]
    - [94, 13.899]
  - - [1024, 1024, 1, 4096, 1024, 1024, 1024, 4096]
    - [68, 17.626]
  - - [1024, 1024, 1, 8192, 1024, 1024, 1024, 8192]
    - [55, 21.584]
  - - [1024, 2048, 1, 128, 1024, 1024, 1024, 128]
    - [26, 5.579]
  - - [1024, 2048, 1, 256, 1024, 1024, 1024, 256]
    - [24, 7.828]
  - - [1024, 2048, 1, 512, 1024, 1024, 1024, 512]
    - [77, 10.933]
  - - [1024, 2048, 1, 1024, 1024, 1024, 1024, 1024]
    - [87, 14.606]
  - - [1024, 2048, 1, 2048, 1024, 1024, 1024, 2048]
    - [66, 18.282]
  - - [1024, 2048, 1, 4096, 1024, 1024, 1024, 4096]
    - [56, 23.689]
  - - [1024, 2048, 1, 8192, 1024, 1024, 1024, 8192]
    - [49, 25.669]
  - - [1024, 4096, 1, 128, 1024, 1024, 1024, 128]
    - [25, 7.035]
  - - [1024, 4096, 1, 256, 1024, 1024, 1024, 256]
    - [25, 9.177]
  - - [1024, 4096, 1, 512, 1024, 1024, 1024, 512]
    - [82, 13.375]
  - - [1024, 4096, 1, 1024, 1024, 1024, 1024, 1024]
    - [57, 17.42]
  - - [1024, 4096, 1, 2048, 1024, 1024, 1024, 2048]
    - [56, 22.954]
  - - [1024, 4096, 1, 4096, 1024, 1024, 1024, 4096]
    - [57, 27.013]
  - - [1024, 4096, 1, 8192, 1024, 1024, 1024, 8192]
    - [53, 28.591]
  - - [1024, 8192, 1, 128, 1024, 1024, 1024, 128]
    - [19, 6.866]
  - - [1024, 8192, 1, 256, 1024, 1024, 1024, 256]
    - [56, 10.615]
  - - [1024, 8192, 1, 512, 1024, 1024, 1024, 512]
    - [55, 15.956]
  - - [1024, 8192, 1, 1024, 1024, 1024, 1024, 1024]
    - [57, 21.393]
  - - [1024, 8192, 1, 2048, 1024, 1024, 1024, 2048]
    - [48, 25.871]
  - - [1024, 8192, 1, 4096, 1024, 1024, 1024, 4096]
    - [5, 28.677]
  - - [1024, 8192, 1, 8192, 1024, 1024, 1024, 8192]
    - [42, 31.58]
  - - [2048, 128, 1, 128, 2048, 2048, 2048, 128]
    - [36, 1.23]
  - - [2048, 128, 1, 256, 2048, 2048, 2048, 256]
    - [36, 1.574]
  - - [2048, 128, 1, 512, 2048, 2048, 2048, 512]
    - [101, 2.544]
  - - [2048, 128, 1, 1024, 2048, 2048, 2048, 1024]
    - [98, 4.112]
  - - [2048, 128, 1, 2048, 2048, 2048, 2048, 2048]
    - [33, 6.191]
  - - [2048, 128, 1, 4096, 2048, 2048, 2048, 4096]
    - [13, 8.434]
  - - [2048, 128, 1, 8192, 2048, 2048, 2048, 8192]
    - [74, 11.373]
  - - [2048, 256, 1, 128, 2048, 2048, 2048, 128]
    - [98, 2.216]
  - - [2048, 256, 1, 256, 2048, 2048, 2048, 256]
    - [32, 2.819]
  - - [2048, 256, 1, 512, 2048, 2048, 2048, 512]
    - [98, 4.631]
  - - [2048, 256, 1, 1024, 2048, 2048, 2048, 1024]
    - [100, 6.925]
  - - [2048, 256, 1, 2048, 2048, 2048, 2048, 2048]
    - [96, 9.922]
  - - [2048, 256, 1, 4096, 2048, 2048, 2048, 4096]
    - [72, 12.416]
  - - [2048, 256, 1, 8192, 2048, 2048, 2048, 8192]
    - [66, 15.863]
  - - [2048, 512, 1, 128, 2048, 2048, 2048, 128]
    - [31, 3.633]
  - - [2048, 512, 1, 256, 2048, 2048, 2048, 256]
    - [89, 4.917]
  - - [2048, 512, 1, 512, 2048, 2048, 2048, 512]
    - [92, 7.776]
  - - [2048, 512, 1, 1024, 2048, 2048, 2048, 1024]
    - [93, 11.062]
  - - [2048, 512, 1, 2048, 2048, 2048, 2048, 2048]
    - [94, 13.778]
  - - [2048, 512, 1, 4096, 2048, 2048, 2048, 4096]
    - [66, 17.306]
  - - [2048, 512, 1, 8192, 2048, 2048, 2048, 8192]
    - [57, 21.578]
  - - [2048, 1024, 1, 128, 2048, 2048, 2048, 128]
    - [26, 5.558]
  - - [2048, 1024, 1, 256, 2048, 2048, 2048, 256]
    - [23, 7.706]
  - - [2048, 1024, 1, 512, 2048, 2048, 2048, 512]
    - [82, 10.655]
  - - [2048, 1024, 1, 1024, 2048, 2048, 2048, 1024]
    - [86, 14.673]
  - - [2048, 1024, 1, 2048, 2048, 2048, 2048, 2048]
    - [56, 17.74]
  - - [2048, 1024, 1, 4096, 2048, 2048, 2048, 4096]
    - [55, 23.098]
  - - [2048, 1024, 1, 8192, 2048, 2048, 2048, 8192]
    - [57, 26.564]
  - - [2048, 2048, 1, 128, 2048, 2048, 2048, 128]
    - [26, 6.825]
  - - [2048, 2048, 1, 256, 2048, 2048, 2048, 256]
    - [27, 9.321]
  - - [2048, 2048, 1, 512, 2048, 2048, 2048, 512]
    - [80, 12.881]
  - - [2048, 2048, 1, 1024, 2048, 2048, 2048, 1024]
    - [61, 17.298]
  - - [2048, 2048, 1, 2048, 2048, 2048, 2048, 2048]
    - [55, 23.014]
  - - [2048, 2048, 1, 4096, 2048, 2048, 2048, 4096]
    - [55, 28.552]
  - - [2048, 2048, 1, 8192, 2048, 2048, 2048, 8192]
    - [49, 28.01]
  - - [2048, 4096, 1, 128, 2048, 2048, 2048, 128]
    - [19, 6.656]
  - - [2048, 4096, 1, 256, 2048, 2048, 2048, 256]
    - [23, 10.489]
  - - [2048, 4096, 1, 512, 2048, 2048, 2048, 512]
    - [61, 15.679]
  - - [2048, 4096, 1, 1024, 2048, 2048, 2048, 1024]
    - [58, 21.154]
  - - [2048, 4096, 1, 2048, 2048, 2048, 2048, 2048]
    - [48, 26.705]
  - - [2048, 4096, 1, 4096, 2048, 2048, 2048, 4096]
    - [56, 28.788]
  - - [2048, 4096, 1, 8192, 2048, 2048, 2048, 8192]
    - [46, 32.457]
  - - [2048, 8192, 1, 128, 2048, 2048, 2048, 128]
    - [19, 7.582]
  - - [2048, 8192, 1, 256, 2048, 2048, 2048, 256]
    - [79, 12.192]
  - - [2048, 8192, 1, 512, 2048, 2048, 2048, 512]
    - [58, 17.622]
  - - [2048, 8192, 1, 1024, 2048, 2048, 2048, 1024]
    - [62, 23.649]
  - - [2048, 8192, 1, 2048, 2048, 2048, 2048, 2048]
    - [51, 27.797]
  - - [2048, 8192, 1, 4096, 2048, 2048, 2048, 4096]
    - [48, 30.965]
  - - [2048, 8192, 1, 8192, 2048, 2048, 2048, 8192]
    - [44, 33.505]
  - - [4096, 128, 1, 128, 4096, 4096, 4096, 128]
    - [32, 2.197]
  - - [4096, 128, 1, 256, 4096, 4096, 4096, 256]
    - [98, 2.858]
  - - [4096, 128, 1, 512, 4096, 4096, 4096, 512]
    - [98, 4.601]
  - - [4096, 128, 1, 1024, 4096, 4096, 4096, 1024]
    - [100, 6.913]
  - - [4096, 128, 1, 2048, 4096, 4096, 4096, 2048]
    - [94, 9.867]
  - - [4096, 128, 1, 4096, 4096, 4096, 4096, 4096]
    - [73, 12.433]
  - - [4096, 128, 1, 8192, 4096, 4096, 4096, 8192]
    - [64, 16.084]
  - - [4096, 256, 1, 128, 4096, 4096, 4096, 128]
    - [31, 3.627]
  - - [4096, 256, 1, 256, 4096, 4096, 4096, 256]
    - [89, 4.872]
  - - [4096, 256, 1, 512, 4096, 4096, 4096, 512]
    - [97, 7.628]
  - - [4096, 256, 1, 1024, 4096, 4096, 4096, 1024]
    - [93, 11.279]
  - - [4096, 256, 1, 2048, 4096, 4096, 4096, 2048]
    - [97, 13.806]
  - - [4096, 256, 1, 4096, 4096, 4096, 4096, 4096]
    - [65, 17.446]
  - - [4096, 256, 1, 8192, 4096, 4096, 4096, 8192]
    - [58, 21.834]
  - - [4096, 512, 1, 128, 4096, 4096, 4096, 128]
    - [25, 5.526]
  - - [4096, 512, 1, 256, 4096, 4096, 4096, 256]
    - [21, 7.838]
  - - [4096, 512, 1, 512, 4096, 4096, 4096, 512]
    - [83, 10.376]
  - - [4096, 512, 1, 1024, 4096, 4096, 4096, 1024]
    - [86, 14.711]
  - - [4096, 512, 1, 2048, 4096, 4096, 4096, 2048]
    - [59, 17.628]
  - - [4096, 512, 1, 4096, 4096, 4096, 4096, 4096]
    - [56, 22.71]
  - - [4096, 512, 1, 8192, 4096, 4096, 4096, 8192]
    - [55, 26.705]
  - - [4096, 1024, 1, 128, 4096, 4096, 4096, 128]
    - [27, 6.036]
  - - [4096, 1024, 1, 256, 4096, 4096, 4096, 256]
    - [21, 9.271]
  - - [4096, 1024, 1, 512, 4096, 4096, 4096, 512]
    - [70, 12.855]
  - - [4096, 1024, 1, 1024, 4096, 4096, 4096, 1024]
    - [61, 17.347]
  - - [4096, 1024, 1, 2048, 4096, 4096, 4096, 2048]
    - [63, 22.366]
  - - [4096, 1024, 1, 4096, 4096, 4096, 4096, 4096]
    - [56, 27.997]
  - - [4096, 1024, 1, 8192, 4096, 4096, 4096, 8192]
    - [54, 28.789]
  - - [4096, 2048, 1, 128, 4096, 4096, 4096, 128]
    - [18, 6.633]
  - - [4096, 2048, 1, 256, 4096, 4096, 4096, 256]
    - [21, 10.598]
  - - [4096, 2048, 1, 512, 4096, 4096, 4096, 512]
    - [61, 15.624]
  - - [4096, 2048, 1, 1024, 4096, 4096, 4096, 1024]
    - [58, 21.229]
  - - [4096, 2048, 1, 2048, 4096, 4096, 4096, 2048]
    - [49, 26.572]
  - - [4096, 2048, 1, 4096, 4096, 4096, 4096, 4096]
    - [49, 30.915]
  - - [4096, 2048, 1, 8192, 4096, 4096, 4096, 8192]
    - [41, 32.316]
  - - [4096, 4096, 1, 128, 4096, 4096, 4096, 128]
    - [20, 7.511]
  - - [4096, 4096, 1, 256, 4096, 4096, 4096, 256]
    - [19, 12.096]
  - - [4096, 4096, 1, 512, 4096, 4096, 4096, 512]
    - [58, 17.447]
  - - [4096, 4096, 1, 1024, 4096, 4096, 4096, 1024]
    - [58, 24.083]
  - - [4096, 4096, 1, 2048, 4096, 4096, 4096, 2048]
    - [61, 27.723]
  - - [4096, 4096, 1, 4096, 4096, 4096, 4096, 4096]
    - [50, 31.331]
  - - [4096, 4096, 1, 8192, 4096, 4096, 4096, 8192]
    - [58, 33.871]
  - - [4096, 8192, 1, 128, 4096, 4096, 4096, 128]
    - [9, 8.136]
  - - [4096, 8192, 1, 256, 4096, 4096, 4096, 256]
    - [10, 12.744]
  - - [4096, 8192, 1, 512, 4096, 4096, 4096, 512]
    - [61, 18.224]
  - - [4096, 8192, 1, 1024, 4096, 4096, 4096, 1024]
    - [61, 23.475]
  - - [4096, 8192, 1, 2048, 4096, 4096, 4096, 2048]
    - [38, 28.382]
  - - [4096, 8192, 1, 4096, 4096, 4096, 4096, 4096]
    - [40, 34.22]
  - - [4096, 8192, 1, 8192, 4096, 4096, 4096, 8192]
    - [39, 37.361]
  - - [8192, 128, 1, 128, 8192, 8192, 8192, 128]
    - [95, 3.519]
  - - [8192, 128, 1, 256, 8192, 8192, 8192, 256]
    - [89, 4.773]
  - - [8192, 128, 1, 512, 8192, 8192, 8192, 512]
    - [92, 7.608]
  - - [8192, 128, 1, 1024, 8192, 8192, 8192, 1024]
    - [93, 10.905]
  - - [8192, 128, 1, 2048, 8192, 8192, 8192, 2048]
    - [97, 13.683]
  - - [8192, 128, 1, 4096, 8192, 8192, 8192, 4096]
    - [64, 17.605]
  - - [8192, 128, 1, 8192, 8192, 8192, 8192, 8192]
    - [8, 21.739]
  - - [8192, 256, 1, 128, 8192, 8192, 8192, 128]
    - [25, 5.324]
  - - [8192, 256, 1, 256, 8192, 8192, 8192, 256]
    - [25, 7.555]
  - - [8192, 256, 1, 512, 8192, 8192, 8192, 512]
    - [78, 10.623]
  - - [8192, 256, 1, 1024, 8192, 8192, 8192, 1024]
    - [84, 14.472]
  - - [8192, 256, 1, 2048, 8192, 8192, 8192, 2048]
    - [67, 17.993]
  - - [8192, 256, 1, 4096, 8192, 8192, 8192, 4096]
    - [56, 22.994]
  - - [8192, 256, 1, 8192, 8192, 8192, 8192, 8192]
    - [7, 26.557]
  - - [8192, 512, 1, 128, 8192, 8192, 8192, 128]
    - [85, 6.061]
  - - [8192, 512, 1, 256, 8192, 8192, 8192, 256]
    - [16, 9.02]
  - - [8192, 512, 1, 512, 8192, 8192, 8192, 512]
    - [70, 12.813]
  - - [8192, 512, 1, 1024, 8192, 8192, 8192, 1024]
    - [58, 17.586]
  - - [8192, 512, 1, 2048, 8192, 8192, 8192, 2048]
    - [57, 22.453]
  - - [8192, 512, 1, 4096, 8192, 8192, 8192, 4096]
    - [55, 28.138]
  - - [8192, 512, 1, 8192, 8192, 8192, 8192, 8192]
    - [3, 29.377]
  - - [8192, 1024, 1, 128, 8192, 8192, 8192, 128]
    - [18, 6.865]
  - - [8192, 1024, 1, 256, 8192, 8192, 8192, 256]
    - [63, 10.329]
  - - [8192, 1024, 1, 512, 8192, 8192, 8192, 512]
    - [63, 15.366]
  - - [8192, 1024, 1, 1024, 8192, 8192, 8192, 1024]
    - [60, 20.781]
  - - [8192, 1024, 1, 2048, 8192, 8192, 8192, 2048]
    - [59, 26.556]
  - - [8192, 1024, 1, 4096, 8192, 8192, 8192, 4096]
    - [48, 29.527]
  - - [8192, 1024, 1, 8192, 8192, 8192, 8192, 8192]
    - [45, 31.402]
  - - [8192, 2048, 1, 128, 8192, 8192, 8192, 128]
    - [20, 7.663]
  - - [8192, 2048, 1, 256, 8192, 8192, 8192, 256]
    - [15, 11.973]
  - - [8192, 2048, 1, 512, 8192, 8192, 8192, 512]
    - [60, 17.271]
  - - [8192, 2048, 1, 1024, 8192, 8192, 8192, 1024]
    - [52, 22.932]
  - - [8192, 2048, 1, 2048, 8192, 8192, 8192, 2048]
    - [3, 27.734]
  - - [8192, 2048, 1, 4096, 8192, 8192, 8192, 4096]
    - [39, 31.213]
  - - [8192, 2048, 1, 8192, 8192, 8192, 8192, 8192]
    - [40, 34.604]
  - - [8192, 4096, 1, 128, 8192, 8192, 8192, 128]
    - [9, 8.465]
  - - [8192, 4096, 1, 256, 8192, 8192, 8192, 256]
    - [11, 12.85]
  - - [8192, 4096, 1, 512, 8192, 8192, 8192, 512]
    - [61, 18.176]
  - - [8192, 4096, 1, 1024, 8192, 8192, 8192, 1024]
    - [63, 23.322]
  - - [8192, 4096, 1, 2048, 8192, 8192, 8192, 2048]
    - [39, 28.748]
  - - [8192, 4096, 1, 4096, 8192, 8192, 8192, 4096]
    - [52, 33.898]
  - - [8192, 4096, 1, 8192, 8192, 8192, 8192, 8192]
    - [54, 37.105]
  - - [8192, 8192, 1, 128, 8192, 8192, 8192, 128]
    - [0, 7.216]
  - - [8192, 8192, 1, 256, 8192, 8192, 8192, 256]
    - [10, 12.01]
  - - [8192, 8192, 1, 512, 8192, 8192, 8192, 512]
    - [59, 17.644]
  - - [8192, 8192, 1, 1024, 8192, 8192, 8192, 1024]
    - [52, 24.536]
  - - [8192, 8192, 1, 2048, 8192, 8192, 8192, 2048]
    - [42, 31.964]
  - - [8192, 8192, 1, 4096, 8192, 8192, 8192, 4096]
    - [43, 37.268]
  - - [8192, 8192, 1, 8192, 8192, 8192, 8192, 8192]
    - [43, 40.008]
  - - [1, 1, 1, 32, 1, 1, 1, 32]
    - [106, 0.0]
- null
- null
- DeviceEfficiency
- GridBased
