library/src/amd_detail/rocblaslt/src/Tensile/Logic/streamk/gfx942/aquavanjaram942_Cijk_Ailk_Bjlk_BBS_BH_UserArgs.yaml
- {MinimumRequiredVersion: 4.33.0}
- aquavanjaram942
- gfx942
- [Device 0049, Device 0050]
    SolutionIndex: 0
    SolutionNameMin: Cijk_Ailk_Bjlk_BBS_BH_UserArgs_MT256x256x32_MI16x16x1_SN_LDSB0_CLR1_GSU0_GSUC0_GSUWGMRR0_K1_LBSPPA2048_LBSPPB2048_LPA0_LPB0_MIWT8_8_PLR1_SU32_SUM0_SUS256_SKXCCM0_VWA4_VWB8_WGM4_WGMXCC1_WGMXCCGn1
    SolutionIndex: 1
    SolutionNameMin: Cijk_Ailk_Bjlk_BBS_BH_UserArgs_MT128x256x32_MI16x16x1_SN_LDSB1_CLR1_GSU0_GSUC0_GSUWGMRR0_K1_LBSPPA1024_LBSPPB2048_LPA0_LPB32_MIWT4_8_PLR1_SU32_SUM0_SUS256_SKXCCM0_VWA4_VWB2_WGM1_WGMXCC1_WGMXCCGn1
    SolutionIndex: 2
    SolutionNameMin: Cijk_Ailk_Bjlk_BBS_BH_UserArgs_MT128x256x32_MI16x16x1_SN_LDSB1_CLR1_GSU0_GSUC0_GSUWGMRR0_K1_LBSPPA1024_LBSPPB2048_LPA0_LPB0_MIWT4_8_PLR1_SU32_SUM0_SUS256_SKXCCM0_VWA4_VWB8_WGM8_WGMXCC1_WGMXCCGn1
    SolutionIndex: 3
    SolutionNameMin: Cijk_Ailk_Bjlk_BBS_BH_UserArgs_MT256x128x32_MI16x16x1_SN_LDSB1_CLR1_GSU0_GSUC0_GSUWGMRR0_K1_LBSPPA2048_LBSPPB1024_LPA0_LPB32_MIWT8_4_PLR1_SU32_SUM0_SUS256_SKXCCM0_VWA4_VWB2_WGM1_WGMXCC1_WGMXCCGn1
    SolutionIndex: 4
    SolutionNameMin: Cijk_Ailk_Bjlk_BBS_BH_UserArgs_MT256x128x32_MI16x16x1_SN_LDSB1_CLR1_GSU0_GSUC0_GSUWGMRR0_K1_LBSPPA2048_LBSPPB1024_LPA0_LPB0_MIWT8_4_PLR1_SU32_SUM0_SUS256_SKXCCM0_VWA4_VWB4_WGM8_WGMXCC1_WGMXCCGn1
    SolutionIndex: 5
    SolutionNameMin: Cijk_Ailk_Bjlk_BBS_BH_UserArgs_MT64x128x32_MI16x16x1_SN_LDSB0_CLR1_GSU0_GSUC0_GSUWGMRR0_K1_LBSPPA512_LBSPPB1024_LPA32_LPB32_MIWT2_4_PLR1_SU32_SUM0_SUS256_SKXCCM0_VWA2_VWB2_WGM1_WGMXCC1_WGMXCCGn1
    SolutionIndex: 6
    SolutionNameMin: Cijk_Ailk_Bjlk_BBS_BH_UserArgs_MT32x32x32_MI16x16x1_SN_LDSB0_CLR1_GSU0_GSUC0_GSUWGMRR0_K1_LBSPPA256_LBSPPB256_LPA16_LPB16_MIWT1_1_PLR1_SU32_SUM0_SUS256_SKXCCM0_VWA1_VWB1_WGM1_WGMXCC1_WGMXCCGn1
    SolutionIndex: 7
    SolutionNameMin: Cijk_Ailk_Bjlk_BBS_BH_UserArgs_MT256x256x64_MI16x16x1_SN_LDSB1_CLR1_GSU0_GSUC0_GSUWGMRR0_K1_LBSPPA2048_LBSPPB2048_LPA0_LPB0_MIWT8_8_PLR2_SU32_SUM0_SUS256_SKXCCM0_VWA4_VWB8_WGM8_WGMXCC1_WGMXCCGn1
    SolutionIndex: 8
    SolutionNameMin: Cijk_Ailk_Bjlk_BBS_BH_UserArgs_MT256x128x64_MI16x16x1_SN_LDSB1_CLR1_GSU0_GSUC0_GSUWGMRR0_K1_LBSPPA2048_LBSPPB1024_LPA0_LPB0_MIWT8_4_PLR1_SU32_SUM0_SUS256_SKXCCM0_VWA4_VWB4_WGM1_WGMXCC1_WGMXCCGn1
    SolutionIndex: 9
    SolutionNameMin: Cijk_Ailk_Bjlk_BBS_BH_UserArgs_MT256x128x64_MI16x16x1_SN_LDSB1_CLR1_GSU0_GSUC0_GSUWGMRR0_K1_LBSPPA2048_LBSPPB1024_LPA0_LPB0_MIWT8_4_PLR2_SU32_SUM0_SUS256_SKXCCM0_VWA4_VWB4_WGM1_WGMXCC1_WGMXCCGn1
    SolutionIndex: 10
    SolutionNameMin: Cijk_Ailk_Bjlk_BBS_BH_UserArgs_MT128x128x64_MI16x16x1_SN_LDSB1_CLR1_GSU0_GSUC0_GSUWGMRR0_K1_LBSPPA1024_LBSPPB1024_LPA0_LPB0_MIWT4_4_PLR1_SU32_SUM0_SUS256_SKXCCM0_VWA4_VWB4_WGM8_WGMXCC1_WGMXCCGn1
    SolutionIndex: 11
    SolutionNameMin: Cijk_Ailk_Bjlk_BBS_BH_UserArgs_MT64x128x64_MI16x16x1_SN_LDSB1_CLR1_GSU0_GSUC0_GSUWGMRR0_K1_LBSPPA512_LBSPPB1024_LPA32_LPB0_MIWT2_4_PLR2_SU32_SUM0_SUS256_SKXCCM0_VWA2_VWB4_WGM1_WGMXCC1_WGMXCCGn1
    SolutionIndex: 12
    SolutionNameMin: Cijk_Ailk_Bjlk_BBS_BH_UserArgs_MT64x128x64_MI16x16x1_SN_LDSB1_CLR1_GSU0_GSUC0_GSUWGMRR0_K1_LBSPPA512_LBSPPB1024_LPA32_LPB0_MIWT2_4_PLR2_SU32_SUM0_SUS256_SKXCCM0_VWA2_VWB4_WGM8_WGMXCC1_WGMXCCGn1
    SolutionIndex: 13
    SolutionNameMin: Cijk_Ailk_Bjlk_BBS_BH_UserArgs_MT128x64x64_MI16x16x1_SN_LDSB1_CLR1_GSU0_GSUC0_GSUWGMRR0_K1_LBSPPA1024_LBSPPB512_LPA0_LPB32_MIWT4_2_PLR1_SU32_SUM0_SUS256_SKXCCM0_VWA4_VWB2_WGM1_WGMXCC1_WGMXCCGn1
    SolutionIndex: 14
    SolutionNameMin: Cijk_Ailk_Bjlk_BBS_BH_UserArgs_MT64x64x64_MI16x16x1_SN_LDSB1_CLR1_GSU0_GSUC0_GSUWGMRR0_K1_LBSPPA512_LBSPPB512_LPA32_LPB32_MIWT2_2_PLR1_SU32_SUM0_SUS256_SKXCCM0_VWA2_VWB2_WGM1_WGMXCC1_WGMXCCGn1
    SolutionIndex: 15
    SolutionNameMin: Cijk_Ailk_Bjlk_BBS_BH_UserArgs_MT64x64x64_MI16x16x1_SN_LDSB1_CLR1_GSU0_GSUC0_GSUWGMRR0_K1_LBSPPA512_LBSPPB512_LPA32_LPB32_MIWT2_2_PLR2_SU32_SUM0_SUS256_SKXCCM0_VWA2_VWB2_WGM8_WGMXCC1_WGMXCCGn1
    SolutionIndex: 16
    SolutionNameMin: Cijk_Ailk_Bjlk_BBS_BH_UserArgs_MT32x64x64_MI16x16x1_SN_LDSB0_CLR1_GSU0_GSUC0_GSUWGMRR0_K1_LBSPPA256_LBSPPB512_LPA16_LPB32_MIWT1_2_PLR1_SU32_SUM0_SUS256_SKXCCM0_VWA1_VWB2_WGM1_WGMXCC1_WGMXCCGn1
    SolutionIndex: 17
    SolutionNameMin: Cijk_Ailk_Bjlk_BBS_BH_UserArgs_MT32x32x64_MI16x16x1_SN_LDSB0_CLR1_GSU0_GSUC0_GSUWGMRR0_K1_LBSPPA256_LBSPPB256_LPA16_LPB16_MIWT1_1_PLR2_SU32_SUM0_SUS256_SKXCCM0_VWA1_VWB1_WGM1_WGMXCC1_WGMXCCGn1
    SolutionIndex: 18
    SolutionNameMin: Cijk_Ailk_Bjlk_BBS_BH_UserArgs_MT128x128x128_MI16x16x1_SN_LDSB1_CLR1_GSU0_GSUC0_GSUWGMRR0_K1_LBSPPA1024_LBSPPB1024_LPA0_LPB0_MIWT4_4_PLR1_SU32_SUM0_SUS256_SKXCCM0_VWA4_VWB4_WGM1_WGMXCC1_WGMXCCGn1
    SolutionIndex: 19
    SolutionNameMin: Cijk_Ailk_Bjlk_BBS_BH_UserArgs_MT128x128x128_MI16x16x1_SN_LDSB1_CLR1_GSU0_GSUC0_GSUWGMRR0_K1_LBSPPA1024_LBSPPB1024_LPA0_LPB0_MIWT4_4_PLR2_SU32_SUM0_SUS256_SKXCCM0_VWA4_VWB4_WGM1_WGMXCC1_WGMXCCGn1
    SolutionIndex: 20
    SolutionNameMin: Cijk_Ailk_Bjlk_BBS_BH_UserArgs_MT128x128x128_MI16x16x1_SN_LDSB1_CLR1_GSU0_GSUC0_GSUWGMRR0_K1_LBSPPA1024_LBSPPB1024_LPA0_LPB0_MIWT4_4_PLR1_SU32_SUM0_SUS256_SKXCCM0_VWA4_VWB4_WGM4_WGMXCC1_WGMXCCGn1
    SolutionIndex: 21
    SolutionNameMin: Cijk_Ailk_Bjlk_BBS_BH_UserArgs_MT128x128x128_MI16x16x1_SN_LDSB1_CLR1_GSU0_GSUC0_GSUWGMRR0_K1_LBSPPA1024_LBSPPB1024_LPA0_LPB0_MIWT4_4_PLR1_SU32_SUM0_SUS256_SKXCCM0_VWA4_VWB4_WGM8_WGMXCC1_WGMXCCGn1
    SolutionIndex: 22
    SolutionNameMin: Cijk_Ailk_Bjlk_BBS_BH_UserArgs_MT128x128x128_MI16x16x1_SN_LDSB1_CLR1_GSU0_GSUC0_GSUWGMRR0_K1_LBSPPA1024_LBSPPB1024_LPA0_LPB0_MIWT4_4_PLR2_SU32_SUM0_SUS256_SKXCCM0_VWA4_VWB4_WGM8_WGMXCC1_WGMXCCGn1
    SolutionIndex: 23
    SolutionNameMin: Cijk_Ailk_Bjlk_BBS_BH_UserArgs_MT64x128x128_MI16x16x1_SN_LDSB1_CLR1_GSU0_GSUC0_GSUWGMRR0_K1_LBSPPA512_LBSPPB1024_LPA32_LPB0_MIWT2_4_PLR2_SU32_SUM0_SUS256_SKXCCM0_VWA2_VWB4_WGM1_WGMXCC1_WGMXCCGn1
    SolutionIndex: 24
    SolutionNameMin: Cijk_Ailk_Bjlk_BBS_BH_UserArgs_MT128x64x128_MI16x16x1_SN_LDSB1_CLR1_GSU0_GSUC0_GSUWGMRR0_K1_LBSPPA1024_LBSPPB512_LPA0_LPB16_MIWT4_2_PLR2_SU32_SUM0_SUS256_SKXCCM0_VWA4_VWB1_WGM4_WGMXCC1_WGMXCCGn1
    SolutionIndex: 25
    SolutionNameMin: Cijk_Ailk_Bjlk_BBS_BH_UserArgs_MT128x64x128_MI16x16x1_SN_LDSB1_CLR1_GSU0_GSUC0_GSUWGMRR0_K1_LBSPPA1024_LBSPPB512_LPA0_LPB32_MIWT4_2_PLR2_SU32_SUM0_SUS256_SKXCCM0_VWA4_VWB2_WGM4_WGMXCC1_WGMXCCGn1
    SolutionIndex: 26
    SolutionNameMin: Cijk_Ailk_Bjlk_BBS_BH_UserArgs_MT128x64x128_MI16x16x1_SN_LDSB1_CLR1_GSU0_GSUC0_GSUWGMRR0_K1_LBSPPA1024_LBSPPB512_LPA32_LPB32_MIWT4_2_PLR2_SU32_SUM0_SUS256_SKXCCM0_VWA2_VWB2_WGM8_WGMXCC1_WGMXCCGn1
    SolutionIndex: 27
    SolutionNameMin: Cijk_Ailk_Bjlk_BBS_BH_UserArgs_MT128x64x128_MI16x16x1_SN_LDSB1_CLR1_GSU0_GSUC0_GSUWGMRR0_K1_LBSPPA1024_LBSPPB512_LPA0_LPB32_MIWT4_2_PLR2_SU32_SUM0_SUS256_SKXCCM0_VWA4_VWB2_WGM8_WGMXCC1_WGMXCCGn1
    SolutionIndex: 28
    SolutionNameMin: Cijk_Ailk_Bjlk_BBS_BH_UserArgs_MT64x64x128_MI16x16x1_SN_LDSB1_CLR1_GSU0_GSUC0_GSUWGMRR0_K1_LBSPPA512_LBSPPB512_LPA32_LPB32_MIWT2_2_PLR1_SU32_SUM0_SUS256_SKXCCM0_VWA2_VWB2_WGM1_WGMXCC1_WGMXCCGn1
    SolutionIndex: 29
    SolutionNameMin: Cijk_Ailk_Bjlk_BBS_BH_UserArgs_MT64x64x128_MI16x16x1_SN_LDSB1_CLR1_GSU0_GSUC0_GSUWGMRR0_K1_LBSPPA512_LBSPPB512_LPA32_LPB32_MIWT2_2_PLR2_SU32_SUM0_SUS256_SKXCCM0_VWA2_VWB2_WGM1_WGMXCC1_WGMXCCGn1
    SolutionIndex: 30
    SolutionNameMin: Cijk_Ailk_Bjlk_BBS_BH_UserArgs_MT64x64x128_MI16x16x1_SN_LDSB1_CLR1_GSU0_GSUC0_GSUWGMRR0_K1_LBSPPA512_LBSPPB512_LPA32_LPB32_MIWT2_2_PLR2_SU32_SUM0_SUS256_SKXCCM0_VWA2_VWB2_WGM4_WGMXCC1_WGMXCCGn1
    SolutionIndex: 31
    SolutionNameMin: Cijk_Ailk_Bjlk_BBS_BH_UserArgs_MT32x64x128_MI16x16x1_SN_LDSB1_CLR1_GSU0_GSUC0_GSUWGMRR0_K1_LBSPPA256_LBSPPB512_LPA16_LPB32_MIWT1_2_PLR2_SU32_SUM0_SUS256_SKXCCM0_VWA1_VWB2_WGM1_WGMXCC1_WGMXCCGn1
    SolutionIndex: 32
    SolutionNameMin: Cijk_Ailk_Bjlk_BBS_BH_UserArgs_MT64x32x128_MI16x16x1_SN_LDSB1_CLR1_GSU0_GSUC0_GSUWGMRR0_K1_LBSPPA512_LBSPPB256_LPA32_LPB16_MIWT2_1_PLR1_SU32_SUM0_SUS256_SKXCCM0_VWA2_VWB1_WGM1_WGMXCC1_WGMXCCGn1
    SolutionIndex: 33
    SolutionNameMin: Cijk_Ailk_Bjlk_BBS_BH_UserArgs_MT64x32x128_MI16x16x1_SN_LDSB1_CLR1_GSU0_GSUC0_GSUWGMRR0_K1_LBSPPA512_LBSPPB256_LPA32_LPB16_MIWT2_1_PLR2_SU32_SUM0_SUS256_SKXCCM0_VWA2_VWB1_WGM1_WGMXCC1_WGMXCCGn1
    SolutionIndex: 34
    SolutionNameMin: Cijk_Ailk_Bjlk_BBS_BH_UserArgs_MT64x32x128_MI16x16x1_SN_LDSB1_CLR1_GSU0_GSUC0_GSUWGMRR0_K1_LBSPPA512_LBSPPB256_LPA32_LPB16_MIWT2_1_PLR2_SU32_SUM0_SUS256_SKXCCM0_VWA2_VWB1_WGM8_WGMXCC1_WGMXCCGn1
    SolutionIndex: 35
    SolutionNameMin: Cijk_Ailk_Bjlk_BBS_BH_UserArgs_MT32x32x128_MI16x16x1_SN_LDSB1_CLR1_GSU0_GSUC0_GSUWGMRR0_K1_LBSPPA256_LBSPPB256_LPA16_LPB16_MIWT1_1_PLR1_SU32_SUM0_SUS256_SKXCCM0_VWA1_VWB1_WGM1_WGMXCC1_WGMXCCGn1
    SolutionIndex: 36
    SolutionNameMin: Cijk_Ailk_Bjlk_BBS_BH_UserArgs_MT32x32x128_MI16x16x1_SN_LDSB1_CLR1_GSU0_GSUC0_GSUWGMRR0_K1_LBSPPA256_LBSPPB256_LPA16_LPB16_MIWT1_1_PLR2_SU32_SUM0_SUS256_SKXCCM0_VWA1_VWB1_WGM1_WGMXCC1_WGMXCCGn1
    SolutionIndex: 37
    SolutionNameMin: Cijk_Ailk_Bjlk_BBS_BH_UserArgs_MT32x32x128_MI16x16x1_SN_LDSB1_CLR1_GSU0_GSUC0_GSUWGMRR0_K1_LBSPPA256_LBSPPB256_LPA16_LPB16_MIWT1_1_PLR1_SU32_SUM0_SUS256_SKXCCM0_VWA1_VWB1_WGM8_WGMXCC1_WGMXCCGn1
    SolutionIndex: 38
    SolutionNameMin: Cijk_Ailk_Bjlk_BBS_BH_UserArgs_MT32x32x128_MI16x16x1_SN_LDSB1_CLR1_GSU0_GSUC0_GSUWGMRR0_K1_LBSPPA256_LBSPPB256_LPA16_LPB16_MIWT1_1_PLR2_SU32_SUM0_SUS256_SKXCCM0_VWA1_VWB1_WGM8_WGMXCC1_WGMXCCGn1
    SolutionIndex: 39
    SolutionNameMin: Cijk_Ailk_Bjlk_BBS_BH_UserArgs_MT256x256x32_MI16x16x1_SN_LDSB0_CLR1_GSU0_GSUC0_GSUWGMRR0_K1_LBSPPA2048_LBSPPB2048_LPA0_LPB0_MIWT8_8_PLR1_SU32_SUM0_SUS256_SKXCCM8_VWA4_VWB8_WGM1_WGMXCC1_WGMXCCGn1
    SolutionIndex: 40
    SolutionNameMin: Cijk_Ailk_Bjlk_BBS_BH_UserArgs_MT256x256x32_MI16x16x1_SN_LDSB0_CLR1_GSU0_GSUC0_GSUWGMRR0_K1_LBSPPA2048_LBSPPB2048_LPA0_LPB0_MIWT8_8_PLR1_SU32_SUM0_SUS256_SKXCCM8_VWA4_VWB4_WGM4_WGMXCC1_WGMXCCGn1
    SolutionIndex: 41
    SolutionNameMin: Cijk_Ailk_Bjlk_BBS_BH_UserArgs_MT256x256x32_MI16x16x1_SN_LDSB0_CLR1_GSU0_GSUC0_GSUWGMRR0_K1_LBSPPA2048_LBSPPB2048_LPA0_LPB0_MIWT8_8_PLR1_SU32_SUM0_SUS256_SKXCCM8_VWA4_VWB8_WGM4_WGMXCC1_WGMXCCGn1
    SolutionIndex: 42
    SolutionNameMin: Cijk_Ailk_Bjlk_BBS_BH_UserArgs_MT256x256x32_MI16x16x1_SN_LDSB0_CLR1_GSU0_GSUC0_GSUWGMRR0_K1_LBSPPA2048_LBSPPB2048_LPA0_LPB0_MIWT8_8_PLR1_SU32_SUM0_SUS256_SKXCCM8_VWA4_VWB8_WGM8_WGMXCC1_WGMXCCGn1
    SolutionIndex: 43
    SolutionNameMin: Cijk_Ailk_Bjlk_BBS_BH_UserArgs_MT128x256x32_MI16x16x1_SN_LDSB1_CLR1_GSU0_GSUC0_GSUWGMRR0_K1_LBSPPA1024_LBSPPB2048_LPA0_LPB32_MIWT4_8_PLR1_SU32_SUM0_SUS256_SKXCCM8_VWA4_VWB2_WGM1_WGMXCC1_WGMXCCGn1
    SolutionIndex: 44
    SolutionNameMin: Cijk_Ailk_Bjlk_BBS_BH_UserArgs_MT128x256x32_MI16x16x1_SN_LDSB1_CLR1_GSU0_GSUC0_GSUWGMRR0_K1_LBSPPA1024_LBSPPB2048_LPA0_LPB0_MIWT4_8_PLR1_SU32_SUM0_SUS256_SKXCCM8_VWA4_VWB4_WGM1_WGMXCC1_WGMXCCGn1
    SolutionIndex: 45
    SolutionNameMin: Cijk_Ailk_Bjlk_BBS_BH_UserArgs_MT128x256x32_MI16x16x1_SN_LDSB1_CLR1_GSU0_GSUC0_GSUWGMRR0_K1_LBSPPA1024_LBSPPB2048_LPA0_LPB0_MIWT4_8_PLR1_SU32_SUM0_SUS256_SKXCCM8_VWA4_VWB8_WGM1_WGMXCC1_WGMXCCGn1
    SolutionIndex: 46
    SolutionNameMin: Cijk_Ailk_Bjlk_BBS_BH_UserArgs_MT128x256x32_MI16x16x1_SN_LDSB1_CLR1_GSU0_GSUC0_GSUWGMRR0_K1_LBSPPA1024_LBSPPB2048_LPA32_LPB0_MIWT4_8_PLR1_SU32_SUM0_SUS256_SKXCCM8_VWA2_VWB4_WGM4_WGMXCC1_WGMXCCGn1
    SolutionIndex: 47
    SolutionNameMin: Cijk_Ailk_Bjlk_BBS_BH_UserArgs_MT128x256x32_MI16x16x1_SN_LDSB1_CLR1_GSU0_GSUC0_GSUWGMRR0_K1_LBSPPA1024_LBSPPB2048_LPA0_LPB0_MIWT4_8_PLR1_SU32_SUM0_SUS256_SKXCCM8_VWA4_VWB4_WGM4_WGMXCC1_WGMXCCGn1
    SolutionIndex: 48
    SolutionNameMin: Cijk_Ailk_Bjlk_BBS_BH_UserArgs_MT128x256x32_MI16x16x1_SN_LDSB1_CLR1_GSU0_GSUC0_GSUWGMRR0_K1_LBSPPA1024_LBSPPB2048_LPA0_LPB0_MIWT4_8_PLR1_SU32_SUM0_SUS256_SKXCCM8_VWA4_VWB8_WGM4_WGMXCC1_WGMXCCGn1
    SolutionIndex: 49
    SolutionNameMin: Cijk_Ailk_Bjlk_BBS_BH_UserArgs_MT128x256x32_MI16x16x1_SN_LDSB1_CLR1_GSU0_GSUC0_GSUWGMRR0_K1_LBSPPA1024_LBSPPB2048_LPA0_LPB32_MIWT4_8_PLR1_SU32_SUM0_SUS256_SKXCCM8_VWA4_VWB2_WGM8_WGMXCC1_WGMXCCGn1
    SolutionIndex: 50
    SolutionNameMin: Cijk_Ailk_Bjlk_BBS_BH_UserArgs_MT256x128x32_MI16x16x1_SN_LDSB1_CLR1_GSU0_GSUC0_GSUWGMRR0_K1_LBSPPA2048_LBSPPB1024_LPA0_LPB16_MIWT8_4_PLR1_SU32_SUM0_SUS256_SKXCCM8_VWA4_VWB1_WGM4_WGMXCC1_WGMXCCGn1
    SolutionIndex: 51
    SolutionNameMin: Cijk_Ailk_Bjlk_BBS_BH_UserArgs_MT256x128x32_MI16x16x1_SN_LDSB1_CLR1_GSU0_GSUC0_GSUWGMRR0_K1_LBSPPA2048_LBSPPB1024_LPA0_LPB0_MIWT8_4_PLR1_SU32_SUM0_SUS256_SKXCCM8_VWA4_VWB4_WGM8_WGMXCC1_WGMXCCGn1
    SolutionIndex: 52
    SolutionNameMin: Cijk_Ailk_Bjlk_BBS_BH_UserArgs_MT128x128x32_MI16x16x1_SN_LDSB0_CLR1_GSU0_GSUC0_GSUWGMRR0_K1_LBSPPA1024_LBSPPB1024_LPA0_LPB0_MIWT4_4_PLR1_SU32_SUM0_SUS256_SKXCCM8_VWA4_VWB4_WGM1_WGMXCC1_WGMXCCGn1
    SolutionIndex: 53
    SolutionNameMin: Cijk_Ailk_Bjlk_BBS_BH_UserArgs_MT128x128x32_MI16x16x1_SN_LDSB0_CLR1_GSU0_GSUC0_GSUWGMRR0_K1_LBSPPA1024_LBSPPB1024_LPA0_LPB0_MIWT4_4_PLR1_SU32_SUM0_SUS256_SKXCCM8_VWA4_VWB4_WGM8_WGMXCC1_WGMXCCGn1
    SolutionIndex: 54
    SolutionNameMin: Cijk_Ailk_Bjlk_BBS_BH_UserArgs_MT128x64x32_MI16x16x1_SN_LDSB0_CLR1_GSU0_GSUC0_GSUWGMRR0_K1_LBSPPA1024_LBSPPB512_LPA0_LPB32_MIWT4_2_PLR1_SU32_SUM0_SUS256_SKXCCM8_VWA4_VWB2_WGM1_WGMXCC1_WGMXCCGn1
    SolutionIndex: 55
    SolutionNameMin: Cijk_Ailk_Bjlk_BBS_BH_UserArgs_MT128x64x32_MI16x16x1_SN_LDSB0_CLR1_GSU0_GSUC0_GSUWGMRR0_K1_LBSPPA1024_LBSPPB512_LPA0_LPB32_MIWT4_2_PLR1_SU32_SUM0_SUS256_SKXCCM8_VWA4_VWB2_WGM8_WGMXCC1_WGMXCCGn1
    SolutionIndex: 56
    SolutionNameMin: Cijk_Ailk_Bjlk_BBS_BH_UserArgs_MT32x32x32_MI16x16x1_SN_LDSB0_CLR1_GSU0_GSUC0_GSUWGMRR0_K1_LBSPPA256_LBSPPB256_LPA16_LPB16_MIWT1_1_PLR1_SU32_SUM0_SUS256_SKXCCM8_VWA1_VWB1_WGM1_WGMXCC1_WGMXCCGn1
    SolutionIndex: 57
    SolutionNameMin: Cijk_Ailk_Bjlk_BBS_BH_UserArgs_MT32x32x32_MI16x16x1_SN_LDSB0_CLR0_GSU0_GSUC0_GSUWGMRR0_K1_LBSPPA256_LBSPPB256_LPA16_LPB16_MIWT1_1_PLR0_SU32_SUM0_SUS256_SKXCCM8_VWA1_VWB1_WGM1_WGMXCC1_WGMXCCGn1
    SolutionIndex: 58
    SolutionNameMin: Cijk_Ailk_Bjlk_BBS_BH_UserArgs_MT256x256x64_MI16x16x1_SN_LDSB1_CLR1_GSU0_GSUC0_GSUWGMRR0_K1_LBSPPA2048_LBSPPB2048_LPA0_LPB0_MIWT8_8_PLR1_SU32_SUM0_SUS256_SKXCCM8_VWA4_VWB4_WGM1_WGMXCC1_WGMXCCGn1
    SolutionIndex: 59
    SolutionNameMin: Cijk_Ailk_Bjlk_BBS_BH_UserArgs_MT256x256x64_MI16x16x1_SN_LDSB1_CLR1_GSU0_GSUC0_GSUWGMRR0_K1_LBSPPA2048_LBSPPB2048_LPA0_LPB0_MIWT8_8_PLR2_SU32_SUM0_SUS256_SKXCCM8_VWA4_VWB8_WGM4_WGMXCC1_WGMXCCGn1
    SolutionIndex: 60
    SolutionNameMin: Cijk_Ailk_Bjlk_BBS_BH_UserArgs_MT256x256x64_MI16x16x1_SN_LDSB1_CLR1_GSU0_GSUC0_GSUWGMRR0_K1_LBSPPA2048_LBSPPB2048_LPA0_LPB0_MIWT8_8_PLR1_SU32_SUM0_SUS256_SKXCCM8_VWA4_VWB4_WGM8_WGMXCC1_WGMXCCGn1
    SolutionIndex: 61
    SolutionNameMin: Cijk_Ailk_Bjlk_BBS_BH_UserArgs_MT256x256x64_MI16x16x1_SN_LDSB1_CLR1_GSU0_GSUC0_GSUWGMRR0_K1_LBSPPA2048_LBSPPB2048_LPA0_LPB0_MIWT8_8_PLR2_SU32_SUM0_SUS256_SKXCCM8_VWA4_VWB8_WGM8_WGMXCC1_WGMXCCGn1
    SolutionIndex: 62
    SolutionNameMin: Cijk_Ailk_Bjlk_BBS_BH_UserArgs_MT128x256x64_MI16x16x1_SN_LDSB1_CLR1_GSU0_GSUC0_GSUWGMRR0_K1_LBSPPA1024_LBSPPB2048_LPA0_LPB32_MIWT4_8_PLR1_SU32_SUM0_SUS256_SKXCCM8_VWA4_VWB2_WGM1_WGMXCC1_WGMXCCGn1
    SolutionIndex: 63
    SolutionNameMin: Cijk_Ailk_Bjlk_BBS_BH_UserArgs_MT128x256x64_MI16x16x1_SN_LDSB1_CLR1_GSU0_GSUC0_GSUWGMRR0_K1_LBSPPA1024_LBSPPB2048_LPA0_LPB32_MIWT4_8_PLR2_SU32_SUM0_SUS256_SKXCCM8_VWA4_VWB2_WGM1_WGMXCC1_WGMXCCGn1
    SolutionIndex: 64
    SolutionNameMin: Cijk_Ailk_Bjlk_BBS_BH_UserArgs_MT128x256x64_MI16x16x1_SN_LDSB1_CLR1_GSU0_GSUC0_GSUWGMRR0_K1_LBSPPA1024_LBSPPB2048_LPA0_LPB32_MIWT4_8_PLR1_SU32_SUM0_SUS256_SKXCCM8_VWA4_VWB2_WGM4_WGMXCC1_WGMXCCGn1
    SolutionIndex: 65
    SolutionNameMin: Cijk_Ailk_Bjlk_BBS_BH_UserArgs_MT128x256x64_MI16x16x1_SN_LDSB1_CLR1_GSU0_GSUC0_GSUWGMRR0_K1_LBSPPA1024_LBSPPB2048_LPA0_LPB32_MIWT4_8_PLR1_SU32_SUM0_SUS256_SKXCCM8_VWA4_VWB2_WGM8_WGMXCC1_WGMXCCGn1
    SolutionIndex: 66
    SolutionNameMin: Cijk_Ailk_Bjlk_BBS_BH_UserArgs_MT256x128x64_MI16x16x1_SN_LDSB1_CLR1_GSU0_GSUC0_GSUWGMRR0_K1_LBSPPA2048_LBSPPB1024_LPA0_LPB16_MIWT8_4_PLR1_SU32_SUM0_SUS256_SKXCCM8_VWA4_VWB1_WGM1_WGMXCC1_WGMXCCGn1
    SolutionIndex: 67
    SolutionNameMin: Cijk_Ailk_Bjlk_BBS_BH_UserArgs_MT256x128x64_MI16x16x1_SN_LDSB1_CLR1_GSU0_GSUC0_GSUWGMRR0_K1_LBSPPA2048_LBSPPB1024_LPA0_LPB32_MIWT8_4_PLR2_SU32_SUM0_SUS256_SKXCCM8_VWA4_VWB2_WGM1_WGMXCC1_WGMXCCGn1
    SolutionIndex: 68
    SolutionNameMin: Cijk_Ailk_Bjlk_BBS_BH_UserArgs_MT256x128x64_MI16x16x1_SN_LDSB1_CLR1_GSU0_GSUC0_GSUWGMRR0_K1_LBSPPA2048_LBSPPB1024_LPA0_LPB0_MIWT8_4_PLR2_SU32_SUM0_SUS256_SKXCCM8_VWA4_VWB4_WGM8_WGMXCC1_WGMXCCGn1
    SolutionIndex: 69
    SolutionNameMin: Cijk_Ailk_Bjlk_BBS_BH_UserArgs_MT128x128x64_MI16x16x1_SN_LDSB1_CLR1_GSU0_GSUC0_GSUWGMRR0_K1_LBSPPA1024_LBSPPB1024_LPA0_LPB0_MIWT4_4_PLR1_SU32_SUM0_SUS256_SKXCCM8_VWA4_VWB4_WGM1_WGMXCC1_WGMXCCGn1
    SolutionIndex: 70
    SolutionNameMin: Cijk_Ailk_Bjlk_BBS_BH_UserArgs_MT128x128x64_MI16x16x1_SN_LDSB1_CLR1_GSU0_GSUC0_GSUWGMRR0_K1_LBSPPA1024_LBSPPB1024_LPA0_LPB32_MIWT4_4_PLR1_SU32_SUM0_SUS256_SKXCCM8_VWA4_VWB2_WGM4_WGMXCC1_WGMXCCGn1
    SolutionIndex: 71
    SolutionNameMin: Cijk_Ailk_Bjlk_BBS_BH_UserArgs_MT128x128x64_MI16x16x1_SN_LDSB1_CLR1_GSU0_GSUC0_GSUWGMRR0_K1_LBSPPA1024_LBSPPB1024_LPA0_LPB0_MIWT4_4_PLR1_SU32_SUM0_SUS256_SKXCCM8_VWA4_VWB4_WGM4_WGMXCC1_WGMXCCGn1
    SolutionIndex: 72
    SolutionNameMin: Cijk_Ailk_Bjlk_BBS_BH_UserArgs_MT128x128x64_MI16x16x1_SN_LDSB1_CLR1_GSU0_GSUC0_GSUWGMRR0_K1_LBSPPA1024_LBSPPB1024_LPA0_LPB0_MIWT4_4_PLR1_SU32_SUM0_SUS256_SKXCCM8_VWA4_VWB4_WGM8_WGMXCC1_WGMXCCGn1
    SolutionIndex: 73
    SolutionNameMin: Cijk_Ailk_Bjlk_BBS_BH_UserArgs_MT128x128x64_MI16x16x1_SN_LDSB1_CLR1_GSU0_GSUC0_GSUWGMRR0_K1_LBSPPA1024_LBSPPB1024_LPA0_LPB0_MIWT4_4_PLR2_SU32_SUM0_SUS256_SKXCCM8_VWA4_VWB4_WGM8_WGMXCC1_WGMXCCGn1
    SolutionIndex: 74
    SolutionNameMin: Cijk_Ailk_Bjlk_BBS_BH_UserArgs_MT64x128x64_MI16x16x1_SN_LDSB1_CLR1_GSU0_GSUC0_GSUWGMRR0_K1_LBSPPA512_LBSPPB1024_LPA32_LPB32_MIWT2_4_PLR1_SU32_SUM0_SUS256_SKXCCM8_VWA2_VWB2_WGM1_WGMXCC1_WGMXCCGn1
    SolutionIndex: 75
    SolutionNameMin: Cijk_Ailk_Bjlk_BBS_BH_UserArgs_MT64x128x64_MI16x16x1_SN_LDSB1_CLR1_GSU0_GSUC0_GSUWGMRR0_K1_LBSPPA512_LBSPPB1024_LPA32_LPB0_MIWT2_4_PLR2_SU32_SUM0_SUS256_SKXCCM8_VWA2_VWB4_WGM1_WGMXCC1_WGMXCCGn1
    SolutionIndex: 76
    SolutionNameMin: Cijk_Ailk_Bjlk_BBS_BH_UserArgs_MT64x128x64_MI16x16x1_SN_LDSB1_CLR1_GSU0_GSUC0_GSUWGMRR0_K1_LBSPPA512_LBSPPB1024_LPA32_LPB0_MIWT2_4_PLR2_SU32_SUM0_SUS256_SKXCCM8_VWA2_VWB4_WGM8_WGMXCC1_WGMXCCGn1
    SolutionIndex: 77
    SolutionNameMin: Cijk_Ailk_Bjlk_BBS_BH_UserArgs_MT128x64x64_MI16x16x1_SN_LDSB1_CLR1_GSU0_GSUC0_GSUWGMRR0_K1_LBSPPA1024_LBSPPB512_LPA0_LPB32_MIWT4_2_PLR1_SU32_SUM0_SUS256_SKXCCM8_VWA4_VWB2_WGM1_WGMXCC1_WGMXCCGn1
    SolutionIndex: 78
    SolutionNameMin: Cijk_Ailk_Bjlk_BBS_BH_UserArgs_MT128x64x64_MI16x16x1_SN_LDSB1_CLR1_GSU0_GSUC0_GSUWGMRR0_K1_LBSPPA1024_LBSPPB512_LPA0_LPB32_MIWT4_2_PLR2_SU32_SUM0_SUS256_SKXCCM8_VWA4_VWB2_WGM1_WGMXCC1_WGMXCCGn1
    SolutionIndex: 79
    SolutionNameMin: Cijk_Ailk_Bjlk_BBS_BH_UserArgs_MT128x64x64_MI16x16x1_SN_LDSB1_CLR1_GSU0_GSUC0_GSUWGMRR0_K1_LBSPPA1024_LBSPPB512_LPA0_LPB32_MIWT4_2_PLR2_SU32_SUM0_SUS256_SKXCCM8_VWA4_VWB2_WGM4_WGMXCC1_WGMXCCGn1
    SolutionIndex: 80
    SolutionNameMin: Cijk_Ailk_Bjlk_BBS_BH_UserArgs_MT128x64x64_MI16x16x1_SN_LDSB1_CLR1_GSU0_GSUC0_GSUWGMRR0_K1_LBSPPA1024_LBSPPB512_LPA0_LPB32_MIWT4_2_PLR1_SU32_SUM0_SUS256_SKXCCM8_VWA4_VWB2_WGM8_WGMXCC1_WGMXCCGn1
    SolutionIndex: 81
    SolutionNameMin: Cijk_Ailk_Bjlk_BBS_BH_UserArgs_MT128x64x64_MI16x16x1_SN_LDSB1_CLR1_GSU0_GSUC0_GSUWGMRR0_K1_LBSPPA1024_LBSPPB512_LPA0_LPB32_MIWT4_2_PLR2_SU32_SUM0_SUS256_SKXCCM8_VWA4_VWB2_WGM8_WGMXCC1_WGMXCCGn1
    SolutionIndex: 82
    SolutionNameMin: Cijk_Ailk_Bjlk_BBS_BH_UserArgs_MT64x64x64_MI16x16x1_SN_LDSB1_CLR1_GSU0_GSUC0_GSUWGMRR0_K1_LBSPPA512_LBSPPB512_LPA32_LPB32_MIWT2_2_PLR1_SU32_SUM0_SUS256_SKXCCM8_VWA2_VWB2_WGM1_WGMXCC1_WGMXCCGn1
    SolutionIndex: 83
    SolutionNameMin: Cijk_Ailk_Bjlk_BBS_BH_UserArgs_MT64x64x64_MI16x16x1_SN_LDSB1_CLR1_GSU0_GSUC0_GSUWGMRR0_K1_LBSPPA512_LBSPPB512_LPA32_LPB32_MIWT2_2_PLR2_SU32_SUM0_SUS256_SKXCCM8_VWA2_VWB2_WGM1_WGMXCC1_WGMXCCGn1
    SolutionIndex: 84
    SolutionNameMin: Cijk_Ailk_Bjlk_BBS_BH_UserArgs_MT64x64x64_MI16x16x1_SN_LDSB1_CLR1_GSU0_GSUC0_GSUWGMRR0_K1_LBSPPA512_LBSPPB512_LPA32_LPB32_MIWT2_2_PLR1_SU32_SUM0_SUS256_SKXCCM8_VWA2_VWB2_WGM4_WGMXCC1_WGMXCCGn1
    SolutionIndex: 85
    SolutionNameMin: Cijk_Ailk_Bjlk_BBS_BH_UserArgs_MT64x64x64_MI16x16x1_SN_LDSB1_CLR1_GSU0_GSUC0_GSUWGMRR0_K1_LBSPPA512_LBSPPB512_LPA32_LPB32_MIWT2_2_PLR2_SU32_SUM0_SUS256_SKXCCM8_VWA2_VWB2_WGM4_WGMXCC1_WGMXCCGn1
    SolutionIndex: 86
    SolutionNameMin: Cijk_Ailk_Bjlk_BBS_BH_UserArgs_MT64x64x64_MI16x16x1_SN_LDSB1_CLR1_GSU0_GSUC0_GSUWGMRR0_K1_LBSPPA512_LBSPPB512_LPA32_LPB32_MIWT2_2_PLR1_SU32_SUM0_SUS256_SKXCCM8_VWA2_VWB2_WGM8_WGMXCC1_WGMXCCGn1
    SolutionIndex: 87
    SolutionNameMin: Cijk_Ailk_Bjlk_BBS_BH_UserArgs_MT64x64x64_MI16x16x1_SN_LDSB1_CLR1_GSU0_GSUC0_GSUWGMRR0_K1_LBSPPA512_LBSPPB512_LPA32_LPB32_MIWT2_2_PLR2_SU32_SUM0_SUS256_SKXCCM8_VWA2_VWB2_WGM8_WGMXCC1_WGMXCCGn1
    SolutionIndex: 88
    SolutionNameMin: Cijk_Ailk_Bjlk_BBS_BH_UserArgs_MT32x64x64_MI16x16x1_SN_LDSB0_CLR1_GSU0_GSUC0_GSUWGMRR0_K1_LBSPPA256_LBSPPB512_LPA16_LPB32_MIWT1_2_PLR2_SU32_SUM0_SUS256_SKXCCM8_VWA1_VWB2_WGM1_WGMXCC1_WGMXCCGn1
    SolutionIndex: 89
    SolutionNameMin: Cijk_Ailk_Bjlk_BBS_BH_UserArgs_MT32x64x64_MI16x16x1_SN_LDSB0_CLR1_GSU0_GSUC0_GSUWGMRR0_K1_LBSPPA256_LBSPPB512_LPA16_LPB32_MIWT1_2_PLR2_SU32_SUM0_SUS256_SKXCCM8_VWA1_VWB2_WGM4_WGMXCC1_WGMXCCGn1
    SolutionIndex: 90
    SolutionNameMin: Cijk_Ailk_Bjlk_BBS_BH_UserArgs_MT32x64x64_MI16x16x1_SN_LDSB0_CLR1_GSU0_GSUC0_GSUWGMRR0_K1_LBSPPA256_LBSPPB512_LPA16_LPB32_MIWT1_2_PLR2_SU32_SUM0_SUS256_SKXCCM8_VWA1_VWB2_WGM8_WGMXCC1_WGMXCCGn1
    SolutionIndex: 91
    SolutionNameMin: Cijk_Ailk_Bjlk_BBS_BH_UserArgs_MT64x32x64_MI16x16x1_SN_LDSB0_CLR1_GSU0_GSUC0_GSUWGMRR0_K1_LBSPPA512_LBSPPB256_LPA32_LPB16_MIWT2_1_PLR2_SU32_SUM0_SUS256_SKXCCM8_VWA2_VWB1_WGM1_WGMXCC1_WGMXCCGn1
    SolutionIndex: 92
    SolutionNameMin: Cijk_Ailk_Bjlk_BBS_BH_UserArgs_MT32x32x64_MI16x16x1_SN_LDSB0_CLR1_GSU0_GSUC0_GSUWGMRR0_K1_LBSPPA256_LBSPPB256_LPA16_LPB16_MIWT1_1_PLR1_SU32_SUM0_SUS256_SKXCCM8_VWA1_VWB1_WGM4_WGMXCC1_WGMXCCGn1
    SolutionIndex: 93
    SolutionNameMin: Cijk_Ailk_Bjlk_BBS_BH_UserArgs_MT128x128x128_MI16x16x1_SN_LDSB1_CLR1_GSU0_GSUC0_GSUWGMRR0_K1_LBSPPA1024_LBSPPB1024_LPA0_LPB0_MIWT4_4_PLR1_SU32_SUM0_SUS256_SKXCCM8_VWA4_VWB4_WGM1_WGMXCC1_WGMXCCGn1
    SolutionIndex: 94
    SolutionNameMin: Cijk_Ailk_Bjlk_BBS_BH_UserArgs_MT128x128x128_MI16x16x1_SN_LDSB1_CLR1_GSU0_GSUC0_GSUWGMRR0_K1_LBSPPA1024_LBSPPB1024_LPA0_LPB0_MIWT4_4_PLR1_SU32_SUM0_SUS256_SKXCCM8_VWA4_VWB4_WGM8_WGMXCC1_WGMXCCGn1
    SolutionIndex: 95
    SolutionNameMin: Cijk_Ailk_Bjlk_BBS_BH_UserArgs_MT64x128x128_MI16x16x1_SN_LDSB1_CLR1_GSU0_GSUC0_GSUWGMRR0_K1_LBSPPA512_LBSPPB1024_LPA32_LPB0_MIWT2_4_PLR2_SU32_SUM0_SUS256_SKXCCM8_VWA2_VWB4_WGM1_WGMXCC1_WGMXCCGn1
    SolutionIndex: 96
    SolutionNameMin: Cijk_Ailk_Bjlk_BBS_BH_UserArgs_MT128x64x128_MI16x16x1_SN_LDSB1_CLR1_GSU0_GSUC0_GSUWGMRR0_K1_LBSPPA1024_LBSPPB512_LPA0_LPB32_MIWT4_2_PLR2_SU32_SUM0_SUS256_SKXCCM8_VWA4_VWB2_WGM1_WGMXCC1_WGMXCCGn1
    SolutionIndex: 97
    SolutionNameMin: Cijk_Ailk_Bjlk_BBS_BH_UserArgs_MT128x64x128_MI16x16x1_SN_LDSB1_CLR1_GSU0_GSUC0_GSUWGMRR0_K1_LBSPPA1024_LBSPPB512_LPA0_LPB32_MIWT4_2_PLR2_SU32_SUM0_SUS256_SKXCCM8_VWA4_VWB2_WGM4_WGMXCC1_WGMXCCGn1
    SolutionIndex: 98
    SolutionNameMin: Cijk_Ailk_Bjlk_BBS_BH_UserArgs_MT128x64x128_MI16x16x1_SN_LDSB1_CLR1_GSU0_GSUC0_GSUWGMRR0_K1_LBSPPA1024_LBSPPB512_LPA0_LPB32_MIWT4_2_PLR2_SU32_SUM0_SUS256_SKXCCM8_VWA4_VWB2_WGM8_WGMXCC1_WGMXCCGn1
    SolutionIndex: 99
    SolutionNameMin: Cijk_Ailk_Bjlk_BBS_BH_UserArgs_MT64x64x128_MI16x16x1_SN_LDSB1_CLR1_GSU0_GSUC0_GSUWGMRR0_K1_LBSPPA512_LBSPPB512_LPA32_LPB32_MIWT2_2_PLR1_SU32_SUM0_SUS256_SKXCCM8_VWA2_VWB2_WGM1_WGMXCC1_WGMXCCGn1
    SolutionIndex: 100
    SolutionNameMin: Cijk_Ailk_Bjlk_BBS_BH_UserArgs_MT64x64x128_MI16x16x1_SN_LDSB1_CLR1_GSU0_GSUC0_GSUWGMRR0_K1_LBSPPA512_LBSPPB512_LPA32_LPB32_MIWT2_2_PLR2_SU32_SUM0_SUS256_SKXCCM8_VWA2_VWB2_WGM1_WGMXCC1_WGMXCCGn1
    SolutionIndex: 101
    SolutionNameMin: Cijk_Ailk_Bjlk_BBS_BH_UserArgs_MT64x64x128_MI16x16x1_SN_LDSB1_CLR1_GSU0_GSUC0_GSUWGMRR0_K1_LBSPPA512_LBSPPB512_LPA32_LPB32_MIWT2_2_PLR2_SU32_SUM0_SUS256_SKXCCM8_VWA2_VWB2_WGM4_WGMXCC1_WGMXCCGn1
    SolutionIndex: 102
    SolutionNameMin: Cijk_Ailk_Bjlk_BBS_BH_UserArgs_MT64x64x128_MI16x16x1_SN_LDSB1_CLR1_GSU0_GSUC0_GSUWGMRR0_K1_LBSPPA512_LBSPPB512_LPA32_LPB32_MIWT2_2_PLR2_SU32_SUM0_SUS256_SKXCCM8_VWA2_VWB2_WGM8_WGMXCC1_WGMXCCGn1
    SolutionIndex: 103
    SolutionNameMin: Cijk_Ailk_Bjlk_BBS_BH_UserArgs_MT32x64x128_MI16x16x1_SN_LDSB1_CLR1_GSU0_GSUC0_GSUWGMRR0_K1_LBSPPA256_LBSPPB512_LPA16_LPB32_MIWT1_2_PLR2_SU32_SUM0_SUS256_SKXCCM8_VWA1_VWB2_WGM1_WGMXCC1_WGMXCCGn1
    SolutionIndex: 104
    SolutionNameMin: Cijk_Ailk_Bjlk_BBS_BH_UserArgs_MT64x32x128_MI16x16x1_SN_LDSB1_CLR1_GSU0_GSUC0_GSUWGMRR0_K1_LBSPPA512_LBSPPB256_LPA32_LPB16_MIWT2_1_PLR2_SU32_SUM0_SUS256_SKXCCM8_VWA2_VWB1_WGM1_WGMXCC1_WGMXCCGn1
    SolutionIndex: 105
    SolutionNameMin: Cijk_Ailk_Bjlk_BBS_BH_UserArgs_MT64x32x128_MI16x16x1_SN_LDSB1_CLR1_GSU0_GSUC0_GSUWGMRR0_K1_LBSPPA512_LBSPPB256_LPA32_LPB16_MIWT2_1_PLR2_SU32_SUM0_SUS256_SKXCCM8_VWA2_VWB1_WGM4_WGMXCC1_WGMXCCGn1
    SolutionIndex: 106
    SolutionNameMin: Cijk_Ailk_Bjlk_BBS_BH_UserArgs_MT32x32x128_MI16x16x1_SN_LDSB1_CLR1_GSU0_GSUC0_GSUWGMRR0_K1_LBSPPA256_LBSPPB256_LPA16_LPB16_MIWT1_1_PLR1_SU32_SUM0_SUS256_SKXCCM8_VWA1_VWB1_WGM1_WGMXCC1_WGMXCCGn1
    SolutionIndex: 107
    SolutionNameMin: Cijk_Ailk_Bjlk_BBS_BH_UserArgs_MT32x32x128_MI16x16x1_SN_LDSB1_CLR1_GSU0_GSUC0_GSUWGMRR0_K1_LBSPPA256_LBSPPB256_LPA16_LPB16_MIWT1_1_PLR2_SU32_SUM0_SUS256_SKXCCM8_VWA1_VWB1_WGM1_WGMXCC1_WGMXCCGn1
    SolutionIndex: 108
    SolutionNameMin: Cijk_Ailk_Bjlk_BBS_BH_UserArgs_MT32x32x128_MI16x16x1_SN_LDSB1_CLR1_GSU0_GSUC0_GSUWGMRR0_K1_LBSPPA256_LBSPPB256_LPA16_LPB16_MIWT1_1_PLR1_SU32_SUM0_SUS256_SKXCCM8_VWA1_VWB1_WGM4_WGMXCC1_WGMXCCGn1
    SolutionIndex: 109
    SolutionNameMin: Cijk_Ailk_Bjlk_BBS_BH_UserArgs_MT32x32x128_MI16x16x1_SN_LDSB1_CLR1_GSU0_GSUC0_GSUWGMRR0_K1_LBSPPA256_LBSPPB256_LPA16_LPB16_MIWT1_1_PLR2_SU32_SUM0_SUS256_SKXCCM8_VWA1_VWB1_WGM4_WGMXCC1_WGMXCCGn1
    SolutionIndex: 110
    SolutionNameMin: Cijk_Ailk_Bjlk_BBS_BH_UserArgs_MT32x32x32_MI16x16x1_SN_LDSB0_CLR1_GSU0_GSUC0_GSUWGMRR0_K1_LBSPPA256_LBSPPB256_LPA16_LPB16_MIWT1_1_PLR1_SU32_SUM0_SUS256_SKXCCM8_VWA1_VWB1_WGM4_WGMXCC1_WGMXCCGn1
- - - [128, 128, 1, 128, 128, 128, 128, 128]
    - [106, 0.077]
  - - [128, 128, 1, 256, 128, 128, 128, 128]
    - [36, 0.1]
  - - [128, 128, 1, 512, 128, 128, 128, 128]
    - [36, 0.163]
  - - [128, 128, 1, 1024, 128, 128, 128, 128]
    - [107, 0.255]
  - - [128, 128, 1, 2048, 128, 128, 128, 128]
    - [107, 0.331]
  - - [128, 128, 1, 4096, 128, 128, 128, 128]
    - [6, 0.512]
  - - [128, 128, 1, 8192, 128, 128, 128, 128]
    - [56, 1.017]
  - - [128, 256, 1, 128, 128, 128, 128, 256]
    - [35, 0.157]
  - - [128, 256, 1, 256, 128, 128, 128, 256]
    - [37, 0.189]
  - - [128, 256, 1, 512, 128, 128, 128, 256]
    - [36, 0.315]
  - - [128, 256, 1, 1024, 128, 128, 128, 256]
    - [107, 0.503]
  - - [128, 256, 1, 2048, 128, 128, 128, 256]
    - [6, 0.777]
  - - [128, 256, 1, 4096, 128, 128, 128, 256]
    - [57, 1.438]
  - - [128, 256, 1, 8192, 128, 128, 128, 256]
    - [106, 2.491]
  - - [128, 512, 1, 128, 128, 128, 128, 512]
    - [35, 0.306]
  - - [128, 512, 1, 256, 128, 128, 128, 512]
    - [35, 0.382]
  - - [128, 512, 1, 512, 128, 128, 128, 512]
    - [106, 0.628]
  - - [128, 512, 1, 1024, 128, 128, 128, 512]
    - [106, 1.048]
  - - [128, 512, 1, 2048, 128, 128, 128, 512]
    - [36, 1.855]
  - - [128, 512, 1, 4096, 128, 128, 128, 512]
    - [37, 2.967]
  - - [128, 512, 1, 8192, 128, 128, 128, 512]
    - [88, 4.462]
  - - [128, 1024, 1, 128, 128, 128, 128, 1024]
    - [35, 0.602]
  - - [128, 1024, 1, 256, 128, 128, 128, 1024]
    - [106, 0.721]
  - - [128, 1024, 1, 512, 128, 128, 128, 1024]
    - [107, 1.299]
  - - [128, 1024, 1, 1024, 128, 128, 128, 1024]
    - [106, 2.093]
  - - [128, 1024, 1, 2048, 128, 128, 128, 1024]
    - [38, 3.378]
  - - [128, 1024, 1, 4096, 128, 128, 128, 1024]
    - [34, 5.053]
  - - [128, 1024, 1, 8192, 128, 128, 128, 1024]
    - [89, 7.004]
  - - [128, 2048, 1, 128, 128, 128, 128, 2048]
    - [36, 1.163]
  - - [128, 2048, 1, 256, 128, 128, 128, 2048]
    - [36, 1.499]
  - - [128, 2048, 1, 512, 128, 128, 128, 2048]
    - [35, 2.323]
  - - [128, 2048, 1, 1024, 128, 128, 128, 2048]
    - [104, 3.78]
  - - [128, 2048, 1, 2048, 128, 128, 128, 2048]
    - [104, 5.893]
  - - [128, 2048, 1, 4096, 128, 128, 128, 2048]
    - [15, 8.319]
  - - [128, 2048, 1, 8192, 128, 128, 128, 2048]
    - [85, 11.311]
  - - [128, 4096, 1, 128, 128, 128, 128, 4096]
    - [32, 2.153]
  - - [128, 4096, 1, 256, 128, 128, 128, 4096]
    - [31, 2.783]
  - - [128, 4096, 1, 512, 128, 128, 128, 4096]
    - [104, 4.279]
  - - [128, 4096, 1, 1024, 128, 128, 128, 4096]
    - [104, 6.532]
  - - [128, 4096, 1, 2048, 128, 128, 128, 4096]
    - [83, 9.642]
  - - [128, 4096, 1, 4096, 128, 128, 128, 4096]
    - [87, 12.646]
  - - [128, 4096, 1, 8192, 128, 128, 128, 4096]
    - [78, 15.92]
  - - [128, 8192, 1, 128, 128, 128, 128, 8192]
    - [29, 3.941]
  - - [128, 8192, 1, 256, 128, 128, 128, 8192]
    - [29, 4.923]
  - - [128, 8192, 1, 512, 128, 128, 128, 8192]
    - [100, 7.44]
  - - [128, 8192, 1, 1024, 128, 128, 128, 8192]
    - [100, 10.426]
  - - [128, 8192, 1, 2048, 128, 128, 128, 8192]
    - [13, 13.599]
  - - [128, 8192, 1, 4096, 128, 128, 128, 8192]
    - [80, 17.071]
  - - [128, 8192, 1, 8192, 128, 128, 128, 8192]
    - [10, 21.048]
  - - [256, 128, 1, 128, 256, 256, 256, 128]
    - [35, 0.155]
  - - [256, 128, 1, 256, 256, 256, 256, 128]
    - [36, 0.195]
  - - [256, 128, 1, 512, 256, 256, 256, 128]
    - [106, 0.322]
  - - [256, 128, 1, 1024, 256, 256, 256, 128]
    - [107, 0.463]
  - - [256, 128, 1, 2048, 256, 256, 256, 128]
    - [6, 0.782]
  - - [256, 128, 1, 4096, 256, 256, 256, 128]
    - [17, 1.443]
  - - [256, 128, 1, 8192, 256, 256, 256, 128]
    - [108, 2.395]
  - - [256, 256, 1, 128, 256, 256, 256, 256]
    - [35, 0.305]
  - - [256, 256, 1, 256, 256, 256, 256, 256]
    - [35, 0.387]
  - - [256, 256, 1, 512, 256, 256, 256, 256]
    - [109, 0.632]
  - - [256, 256, 1, 1024, 256, 256, 256, 256]
    - [107, 1.042]
  - - [256, 256, 1, 2048, 256, 256, 256, 256]
    - [36, 1.837]
  - - [256, 256, 1, 4096, 256, 256, 256, 256]
    - [107, 3.009]
  - - [256, 256, 1, 8192, 256, 256, 256, 256]
    - [88, 4.241]
  - - [256, 512, 1, 128, 256, 256, 256, 512]
    - [35, 0.594]
  - - [256, 512, 1, 256, 256, 256, 256, 512]
    - [36, 0.725]
  - - [256, 512, 1, 512, 256, 256, 256, 512]
    - [107, 1.289]
  - - [256, 512, 1, 1024, 256, 256, 256, 512]
    - [106, 2.092]
  - - [256, 512, 1, 2048, 256, 256, 256, 512]
    - [36, 3.411]
  - - [256, 512, 1, 4096, 256, 256, 256, 512]
    - [88, 5.345]
  - - [256, 512, 1, 8192, 256, 256, 256, 512]
    - [89, 6.878]
  - - [256, 1024, 1, 128, 256, 256, 256, 1024]
    - [35, 1.156]
  - - [256, 1024, 1, 256, 256, 256, 256, 1024]
    - [36, 1.465]
  - - [256, 1024, 1, 512, 256, 256, 256, 1024]
    - [36, 2.309]
  - - [256, 1024, 1, 1024, 256, 256, 256, 1024]
    - [104, 3.837]
  - - [256, 1024, 1, 2048, 256, 256, 256, 1024]
    - [34, 5.756]
  - - [256, 1024, 1, 4096, 256, 256, 256, 1024]
    - [82, 8.191]
  - - [256, 1024, 1, 8192, 256, 256, 256, 1024]
    - [85, 11.021]
  - - [256, 2048, 1, 128, 256, 256, 256, 2048]
    - [33, 2.192]
  - - [256, 2048, 1, 256, 256, 256, 256, 2048]
    - [33, 2.788]
  - - [256, 2048, 1, 512, 256, 256, 256, 2048]
    - [104, 4.243]
  - - [256, 2048, 1, 1024, 256, 256, 256, 2048]
    - [103, 6.484]
  - - [256, 2048, 1, 2048, 256, 256, 256, 2048]
    - [82, 9.494]
  - - [256, 2048, 1, 4096, 256, 256, 256, 2048]
    - [86, 12.358]
  - - [256, 2048, 1, 8192, 256, 256, 256, 2048]
    - [78, 15.394]
  - - [256, 4096, 1, 128, 256, 256, 256, 4096]
    - [30, 3.836]
  - - [256, 4096, 1, 256, 256, 256, 256, 4096]
    - [29, 4.818]
  - - [256, 4096, 1, 512, 256, 256, 256, 4096]
    - [100, 7.523]
  - - [256, 4096, 1, 1024, 256, 256, 256, 4096]
    - [100, 10.78]
  - - [256, 4096, 1, 2048, 256, 256, 256, 4096]
    - [96, 13.634]
  - - [256, 4096, 1, 4096, 256, 256, 256, 4096]
    - [81, 17.432]
  - - [256, 4096, 1, 8192, 256, 256, 256, 4096]
    - [71, 20.923]
  - - [256, 8192, 1, 128, 256, 256, 256, 8192]
    - [23, 6.116]
  - - [256, 8192, 1, 256, 256, 256, 256, 8192]
    - [23, 7.867]
  - - [256, 8192, 1, 512, 256, 256, 256, 8192]
    - [96, 10.763]
  - - [256, 8192, 1, 1024, 256, 256, 256, 8192]
    - [78, 14.294]
  - - [256, 8192, 1, 2048, 256, 256, 256, 8192]
    - [96, 17.967]
  - - [256, 8192, 1, 4096, 256, 256, 256, 8192]
    - [72, 22.415]
  - - [256, 8192, 1, 8192, 256, 256, 256, 8192]
    - [50, 25.266]
  - - [512, 128, 1, 128, 512, 512, 512, 128]
    - [36, 0.307]
  - - [512, 128, 1, 256, 512, 512, 512, 128]
    - [35, 0.378]
  - - [512, 128, 1, 512, 512, 512, 512, 128]
    - [107, 0.623]
  - - [512, 128, 1, 1024, 512, 512, 512, 128]
    - [106, 1.037]
  - - [512, 128, 1, 2048, 512, 512, 512, 128]
    - [107, 1.874]
  - - [512, 128, 1, 4096, 512, 512, 512, 128]
    - [92, 2.957]
  - - [512, 128, 1, 8192, 512, 512, 512, 128]
    - [88, 4.321]
  - - [512, 256, 1, 128, 512, 512, 512, 256]
    - [36, 0.594]
  - - [512, 256, 1, 256, 512, 512, 512, 256]
    - [35, 0.731]
  - - [512, 256, 1, 512, 512, 512, 512, 256]
    - [106, 1.294]
  - - [512, 256, 1, 1024, 512, 512, 512, 256]
    - [106, 2.123]
  - - [512, 256, 1, 2048, 512, 512, 512, 256]
    - [36, 3.443]
  - - [512, 256, 1, 4096, 512, 512, 512, 256]
    - [90, 5.305]
  - - [512, 256, 1, 8192, 512, 512, 512, 256]
    - [83, 6.724]
  - - [512, 512, 1, 128, 512, 512, 512, 512]
    - [35, 1.16]
  - - [512, 512, 1, 256, 512, 512, 512, 512]
    - [35, 1.516]
  - - [512, 512, 1, 512, 512, 512, 512, 512]
    - [35, 2.339]
  - - [512, 512, 1, 1024, 512, 512, 512, 512]
    - [104, 3.822]
  - - [512, 512, 1, 2048, 512, 512, 512, 512]
    - [91, 6.192]
  - - [512, 512, 1, 4096, 512, 512, 512, 512]
    - [83, 7.952]
  - - [512, 512, 1, 8192, 512, 512, 512, 512]
    - [83, 10.236]
  - - [512, 1024, 1, 128, 512, 512, 512, 1024]
    - [31, 2.159]
  - - [512, 1024, 1, 256, 512, 512, 512, 1024]
    - [33, 2.81]
  - - [512, 1024, 1, 512, 512, 512, 512, 1024]
    - [104, 4.308]
  - - [512, 1024, 1, 1024, 512, 512, 512, 1024]
    - [33, 6.496]
  - - [512, 1024, 1, 2048, 512, 512, 512, 1024]
    - [100, 9.38]
  - - [512, 1024, 1, 4096, 512, 512, 512, 1024]
    - [55, 11.813]
  - - [512, 1024, 1, 8192, 512, 512, 512, 1024]
    - [81, 14.657]
  - - [512, 2048, 1, 128, 512, 512, 512, 2048]
    - [29, 3.896]
  - - [512, 2048, 1, 256, 512, 512, 512, 2048]
    - [28, 4.935]
  - - [512, 2048, 1, 512, 512, 512, 512, 2048]
    - [100, 7.39]
  - - [512, 2048, 1, 1024, 512, 512, 512, 2048]
    - [100, 10.676]
  - - [512, 2048, 1, 2048, 512, 512, 512, 2048]
    - [77, 13.503]
  - - [512, 2048, 1, 4096, 512, 512, 512, 2048]
    - [78, 16.222]
  - - [512, 2048, 1, 8192, 512, 512, 512, 2048]
    - [69, 20.448]
  - - [512, 4096, 1, 128, 512, 512, 512, 4096]
    - [96, 6.079]
  - - [512, 4096, 1, 256, 512, 512, 512, 4096]
    - [27, 7.877]
  - - [512, 4096, 1, 512, 512, 512, 512, 4096]
    - [96, 10.737]
  - - [512, 4096, 1, 1024, 512, 512, 512, 4096]
    - [96, 14.661]
  - - [512, 4096, 1, 2048, 512, 512, 512, 4096]
    - [81, 17.538]
  - - [512, 4096, 1, 4096, 512, 512, 512, 4096]
    - [72, 22.006]
  - - [512, 4096, 1, 8192, 512, 512, 512, 4096]
    - [67, 25.433]
  - - [512, 8192, 1, 128, 512, 512, 512, 8192]
    - [93, 8.7]
  - - [512, 8192, 1, 256, 512, 512, 512, 8192]
    - [21, 11.439]
  - - [512, 8192, 1, 512, 512, 512, 512, 8192]
    - [93, 14.326]
  - - [512, 8192, 1, 1024, 512, 512, 512, 8192]
    - [71, 18.034]
  - - [512, 8192, 1, 2048, 512, 512, 512, 8192]
    - [73, 22.322]
  - - [512, 8192, 1, 4096, 512, 512, 512, 8192]
    - [8, 26.565]
  - - [512, 8192, 1, 8192, 512, 512, 512, 8192]
    - [67, 28.321]
  - - [1024, 128, 1, 128, 1024, 1024, 1024, 128]
    - [35, 0.602]
  - - [1024, 128, 1, 256, 1024, 1024, 1024, 128]
    - [36, 0.713]
  - - [1024, 128, 1, 512, 1024, 1024, 1024, 128]
    - [107, 1.301]
  - - [1024, 128, 1, 1024, 1024, 1024, 1024, 128]
    - [36, 2.068]
  - - [1024, 128, 1, 2048, 1024, 1024, 1024, 128]
    - [35, 3.276]
  - - [1024, 128, 1, 4096, 1024, 1024, 1024, 128]
    - [16, 4.868]
  - - [1024, 128, 1, 8192, 1024, 1024, 1024, 128]
    - [82, 6.761]
  - - [1024, 256, 1, 128, 1024, 1024, 1024, 256]
    - [36, 1.146]
  - - [1024, 256, 1, 256, 1024, 1024, 1024, 256]
    - [36, 1.504]
  - - [1024, 256, 1, 512, 1024, 1024, 1024, 256]
    - [106, 2.32]
  - - [1024, 256, 1, 1024, 1024, 1024, 1024, 256]
    - [104, 3.771]
  - - [1024, 256, 1, 2048, 1024, 1024, 1024, 256]
    - [90, 5.561]
  - - [1024, 256, 1, 4096, 1024, 1024, 1024, 256]
    - [85, 8.029]
  - - [1024, 256, 1, 8192, 1024, 1024, 1024, 256]
    - [82, 10.602]
  - - [1024, 512, 1, 128, 1024, 1024, 1024, 512]
    - [33, 2.152]
  - - [1024, 512, 1, 256, 1024, 1024, 1024, 512]
    - [33, 2.806]
  - - [1024, 512, 1, 512, 1024, 1024, 1024, 512]
    - [104, 4.265]
  - - [1024, 512, 1, 1024, 1024, 1024, 1024, 512]
    - [104, 6.497]
  - - [1024, 512, 1, 2048, 1024, 1024, 1024, 512]
    - [82, 9.113]
  - - [1024, 512, 1, 4096, 1024, 1024, 1024, 512]
    - [83, 11.723]
  - - [1024, 512, 1, 8192, 1024, 1024, 1024, 512]
    - [76, 14.11]
  - - [1024, 1024, 1, 128, 1024, 1024, 1024, 1024]
    - [29, 3.88]
  - - [1024, 1024, 1, 256, 1024, 1024, 1024, 1024]
    - [29, 4.84]
  - - [1024, 1024, 1, 512, 1024, 1024, 1024, 1024]
    - [100, 7.488]
  - - [1024, 1024, 1, 1024, 1024, 1024, 1024, 1024]
    - [99, 10.499]
  - - [1024, 1024, 1, 2048, 1024, 1024, 1024, 1024]
    - [54, 12.985]
  - - [1024, 1024, 1, 4096, 1024, 1024, 1024, 1024]
    - [78, 15.717]
  - - [1024, 1024, 1, 8192, 1024, 1024, 1024, 1024]
    - [71, 19.864]
  - - [1024, 2048, 1, 128, 1024, 1024, 1024, 2048]
    - [26, 6.072]
  - - [1024, 2048, 1, 256, 1024, 1024, 1024, 2048]
    - [25, 7.901]
  - - [1024, 2048, 1, 512, 1024, 1024, 1024, 2048]
    - [97, 10.832]
  - - [1024, 2048, 1, 1024, 1024, 1024, 1024, 2048]
    - [78, 14.344]
  - - [1024, 2048, 1, 2048, 1024, 1024, 1024, 2048]
    - [52, 17.056]
  - - [1024, 2048, 1, 4096, 1024, 1024, 1024, 2048]
    - [71, 21.304]
  - - [1024, 2048, 1, 8192, 1024, 1024, 1024, 2048]
    - [47, 24.497]
  - - [1024, 4096, 1, 128, 1024, 1024, 1024, 4096]
    - [21, 8.766]
  - - [1024, 4096, 1, 256, 1024, 1024, 1024, 4096]
    - [21, 11.373]
  - - [1024, 4096, 1, 512, 1024, 1024, 1024, 4096]
    - [93, 14.128]
  - - [1024, 4096, 1, 1024, 1024, 1024, 1024, 4096]
    - [72, 17.917]
  - - [1024, 4096, 1, 2048, 1024, 1024, 1024, 4096]
    - [73, 22.147]
  - - [1024, 4096, 1, 4096, 1024, 1024, 1024, 4096]
    - [66, 25.92]
  - - [1024, 4096, 1, 8192, 1024, 1024, 1024, 4096]
    - [4, 27.834]
  - - [1024, 8192, 1, 128, 1024, 1024, 1024, 8192]
    - [21, 9.892]
  - - [1024, 8192, 1, 256, 1024, 1024, 1024, 8192]
    - [18, 12.716]
  - - [1024, 8192, 1, 512, 1024, 1024, 1024, 8192]
    - [69, 17.266]
  - - [1024, 8192, 1, 1024, 1024, 1024, 1024, 8192]
    - [52, 22.039]
  - - [1024, 8192, 1, 2048, 1024, 1024, 1024, 8192]
    - [65, 26.598]
  - - [1024, 8192, 1, 4096, 1024, 1024, 1024, 8192]
    - [39, 28.292]
  - - [1024, 8192, 1, 8192, 1024, 1024, 1024, 8192]
    - [39, 32.622]
  - - [2048, 128, 1, 128, 2048, 2048, 2048, 128]
    - [36, 1.154]
  - - [2048, 128, 1, 256, 2048, 2048, 2048, 128]
    - [36, 1.509]
  - - [2048, 128, 1, 512, 2048, 2048, 2048, 128]
    - [35, 2.326]
  - - [2048, 128, 1, 1024, 2048, 2048, 2048, 128]
    - [103, 3.81]
  - - [2048, 128, 1, 2048, 2048, 2048, 2048, 128]
    - [88, 5.906]
  - - [2048, 128, 1, 4096, 2048, 2048, 2048, 128]
    - [14, 8.215]
  - - [2048, 128, 1, 8192, 2048, 2048, 2048, 128]
    - [101, 10.776]
  - - [2048, 256, 1, 128, 2048, 2048, 2048, 256]
    - [33, 2.152]
  - - [2048, 256, 1, 256, 2048, 2048, 2048, 256]
    - [33, 2.767]
  - - [2048, 256, 1, 512, 2048, 2048, 2048, 256]
    - [104, 4.262]
  - - [2048, 256, 1, 1024, 2048, 2048, 2048, 256]
    - [105, 6.343]
  - - [2048, 256, 1, 2048, 2048, 2048, 2048, 256]
    - [87, 9.224]
  - - [2048, 256, 1, 4096, 2048, 2048, 2048, 256]
    - [11, 11.786]
  - - [2048, 256, 1, 8192, 2048, 2048, 2048, 256]
    - [75, 14.993]
  - - [2048, 512, 1, 128, 2048, 2048, 2048, 512]
    - [29, 3.887]
  - - [2048, 512, 1, 256, 2048, 2048, 2048, 512]
    - [29, 4.895]
  - - [2048, 512, 1, 512, 2048, 2048, 2048, 512]
    - [100, 7.453]
  - - [2048, 512, 1, 1024, 2048, 2048, 2048, 512]
    - [101, 10.61]
  - - [2048, 512, 1, 2048, 2048, 2048, 2048, 512]
    - [55, 13.299]
  - - [2048, 512, 1, 4096, 2048, 2048, 2048, 512]
    - [74, 15.561]
  - - [2048, 512, 1, 8192, 2048, 2048, 2048, 512]
    - [71, 20.337]
  - - [2048, 1024, 1, 128, 2048, 2048, 2048, 1024]
    - [27, 6.081]
  - - [2048, 1024, 1, 256, 2048, 2048, 2048, 1024]
    - [25, 7.942]
  - - [2048, 1024, 1, 512, 2048, 2048, 2048, 1024]
    - [96, 10.97]
  - - [2048, 1024, 1, 1024, 2048, 2048, 2048, 1024]
    - [79, 14.198]
  - - [2048, 1024, 1, 2048, 2048, 2048, 2048, 1024]
    - [53, 16.931]
  - - [2048, 1024, 1, 4096, 2048, 2048, 2048, 1024]
    - [72, 21.227]
  - - [2048, 1024, 1, 8192, 2048, 2048, 2048, 1024]
    - [49, 24.833]
  - - [2048, 2048, 1, 128, 2048, 2048, 2048, 2048]
    - [21, 8.809]
  - - [2048, 2048, 1, 256, 2048, 2048, 2048, 2048]
    - [20, 11.558]
  - - [2048, 2048, 1, 512, 2048, 2048, 2048, 2048]
    - [94, 13.97]
  - - [2048, 2048, 1, 1024, 2048, 2048, 2048, 2048]
    - [73, 17.905]
  - - [2048, 2048, 1, 2048, 2048, 2048, 2048, 2048]
    - [69, 22.619]
  - - [2048, 2048, 1, 4096, 2048, 2048, 2048, 2048]
    - [51, 25.976]
  - - [2048, 2048, 1, 8192, 2048, 2048, 2048, 2048]
    - [40, 27.577]
  - - [2048, 4096, 1, 128, 2048, 2048, 2048, 4096]
    - [21, 10.05]
  - - [2048, 4096, 1, 256, 2048, 2048, 2048, 4096]
    - [18, 12.649]
  - - [2048, 4096, 1, 512, 2048, 2048, 2048, 4096]
    - [69, 16.769]
  - - [2048, 4096, 1, 1024, 2048, 2048, 2048, 4096]
    - [71, 21.782]
  - - [2048, 4096, 1, 2048, 2048, 2048, 2048, 4096]
    - [62, 26.086]
  - - [2048, 4096, 1, 4096, 2048, 2048, 2048, 4096]
    - [41, 28.535]
  - - [2048, 4096, 1, 8192, 2048, 2048, 2048, 4096]
    - [58, 32.393]
  - - [2048, 8192, 1, 128, 2048, 2048, 2048, 8192]
    - [19, 9.998]
  - - [2048, 8192, 1, 256, 2048, 2048, 2048, 8192]
    - [19, 14.093]
  - - [2048, 8192, 1, 512, 2048, 2048, 2048, 8192]
    - [93, 19.57]
  - - [2048, 8192, 1, 1024, 2048, 2048, 2048, 8192]
    - [43, 24.879]
  - - [2048, 8192, 1, 2048, 2048, 2048, 2048, 8192]
    - [60, 28.38]
  - - [2048, 8192, 1, 4096, 2048, 2048, 2048, 8192]
    - [41, 32.103]
  - - [2048, 8192, 1, 8192, 2048, 2048, 2048, 8192]
    - [7, 34.939]
  - - [4096, 128, 1, 128, 4096, 4096, 4096, 128]
    - [33, 2.184]
  - - [4096, 128, 1, 256, 4096, 4096, 4096, 128]
    - [31, 2.786]
  - - [4096, 128, 1, 512, 4096, 4096, 4096, 128]
    - [104, 4.28]
  - - [4096, 128, 1, 1024, 4096, 4096, 4096, 128]
    - [103, 6.486]
  - - [4096, 128, 1, 2048, 4096, 4096, 4096, 128]
    - [84, 9.502]
  - - [4096, 128, 1, 4096, 4096, 4096, 4096, 128]
    - [11, 12.147]
  - - [4096, 128, 1, 8192, 4096, 4096, 4096, 128]
    - [11, 15.293]
  - - [4096, 256, 1, 128, 4096, 4096, 4096, 256]
    - [29, 3.909]
  - - [4096, 256, 1, 256, 4096, 4096, 4096, 256]
    - [29, 4.916]
  - - [4096, 256, 1, 512, 4096, 4096, 4096, 256]
    - [100, 7.458]
  - - [4096, 256, 1, 1024, 4096, 4096, 4096, 256]
    - [101, 10.646]
  - - [4096, 256, 1, 2048, 4096, 4096, 4096, 256]
    - [5, 13.115]
  - - [4096, 256, 1, 4096, 4096, 4096, 4096, 256]
    - [75, 16.461]
  - - [4096, 256, 1, 8192, 4096, 4096, 4096, 256]
    - [72, 20.752]
  - - [4096, 512, 1, 128, 4096, 4096, 4096, 512]
    - [24, 6.035]
  - - [4096, 512, 1, 256, 4096, 4096, 4096, 512]
    - [25, 7.972]
  - - [4096, 512, 1, 512, 4096, 4096, 4096, 512]
    - [95, 10.741]
  - - [4096, 512, 1, 1024, 4096, 4096, 4096, 512]
    - [79, 14.503]
  - - [4096, 512, 1, 2048, 4096, 4096, 4096, 512]
    - [72, 17.175]
  - - [4096, 512, 1, 4096, 4096, 4096, 4096, 512]
    - [71, 21.802]
  - - [4096, 512, 1, 8192, 4096, 4096, 4096, 512]
    - [44, 25.003]
  - - [4096, 1024, 1, 128, 4096, 4096, 4096, 1024]
    - [21, 8.701]
  - - [4096, 1024, 1, 256, 4096, 4096, 4096, 1024]
    - [22, 11.284]
  - - [4096, 1024, 1, 512, 4096, 4096, 4096, 1024]
    - [94, 14.086]
  - - [4096, 1024, 1, 1024, 4096, 4096, 4096, 1024]
    - [72, 18.097]
  - - [4096, 1024, 1, 2048, 4096, 4096, 4096, 1024]
    - [72, 22.075]
  - - [4096, 1024, 1, 4096, 4096, 4096, 4096, 1024]
    - [64, 26.022]
  - - [4096, 1024, 1, 8192, 4096, 4096, 4096, 1024]
    - [41, 27.607]
  - - [4096, 2048, 1, 128, 4096, 4096, 4096, 2048]
    - [22, 9.328]
  - - [4096, 2048, 1, 256, 4096, 4096, 4096, 2048]
    - [20, 12.66]
  - - [4096, 2048, 1, 512, 4096, 4096, 4096, 2048]
    - [72, 16.514]
  - - [4096, 2048, 1, 1024, 4096, 4096, 4096, 2048]
    - [71, 21.536]
  - - [4096, 2048, 1, 2048, 4096, 4096, 4096, 2048]
    - [45, 26.713]
  - - [4096, 2048, 1, 4096, 4096, 4096, 4096, 2048]
    - [61, 28.694]
  - - [4096, 2048, 1, 8192, 4096, 4096, 4096, 2048]
    - [41, 32.464]
  - - [4096, 4096, 1, 128, 4096, 4096, 4096, 4096]
    - [18, 9.865]
  - - [4096, 4096, 1, 256, 4096, 4096, 4096, 4096]
    - [19, 13.895]
  - - [4096, 4096, 1, 512, 4096, 4096, 4096, 4096]
    - [45, 19.097]
  - - [4096, 4096, 1, 1024, 4096, 4096, 4096, 4096]
    - [51, 24.638]
  - - [4096, 4096, 1, 2048, 4096, 4096, 4096, 4096]
    - [39, 28.812]
  - - [4096, 4096, 1, 4096, 4096, 4096, 4096, 4096]
    - [39, 31.76]
  - - [4096, 4096, 1, 8192, 4096, 4096, 4096, 4096]
    - [39, 35.129]
  - - [4096, 8192, 1, 128, 4096, 4096, 4096, 8192]
    - [18, 11.247]
  - - [4096, 8192, 1, 256, 4096, 4096, 4096, 8192]
    - [18, 16.054]
  - - [4096, 8192, 1, 512, 4096, 4096, 4096, 8192]
    - [59, 21.145]
  - - [4096, 8192, 1, 1024, 4096, 4096, 4096, 8192]
    - [41, 26.726]
  - - [4096, 8192, 1, 2048, 4096, 4096, 4096, 8192]
    - [39, 32.552]
  - - [4096, 8192, 1, 4096, 4096, 4096, 4096, 8192]
    - [39, 36.441]
  - - [4096, 8192, 1, 8192, 4096, 4096, 4096, 8192]
    - [39, 38.561]
  - - [8192, 128, 1, 128, 8192, 8192, 8192, 128]
    - [29, 3.899]
  - - [8192, 128, 1, 256, 8192, 8192, 8192, 128]
    - [28, 4.923]
  - - [8192, 128, 1, 512, 8192, 8192, 8192, 128]
    - [100, 7.401]
  - - [8192, 128, 1, 1024, 8192, 8192, 8192, 128]
    - [102, 10.447]
  - - [8192, 128, 1, 2048, 8192, 8192, 8192, 128]
    - [75, 13.107]
  - - [8192, 128, 1, 4096, 8192, 8192, 8192, 128]
    - [12, 16.632]
  - - [8192, 128, 1, 8192, 8192, 8192, 8192, 128]
    - [10, 20.94]
  - - [8192, 256, 1, 128, 8192, 8192, 8192, 256]
    - [27, 6.057]
  - - [8192, 256, 1, 256, 8192, 8192, 8192, 256]
    - [27, 7.698]
  - - [8192, 256, 1, 512, 8192, 8192, 8192, 256]
    - [98, 10.651]
  - - [8192, 256, 1, 1024, 8192, 8192, 8192, 256]
    - [98, 14.41]
  - - [8192, 256, 1, 2048, 8192, 8192, 8192, 256]
    - [76, 17.493]
  - - [8192, 256, 1, 4096, 8192, 8192, 8192, 256]
    - [69, 21.769]
  - - [8192, 256, 1, 8192, 8192, 8192, 8192, 256]
    - [2, 25.29]
  - - [8192, 512, 1, 128, 8192, 8192, 8192, 512]
    - [94, 8.518]
  - - [8192, 512, 1, 256, 8192, 8192, 8192, 512]
    - [20, 10.582]
  - - [8192, 512, 1, 512, 8192, 8192, 8192, 512]
    - [94, 14.094]
  - - [8192, 512, 1, 1024, 8192, 8192, 8192, 512]
    - [70, 17.985]
  - - [8192, 512, 1, 2048, 8192, 8192, 8192, 512]
    - [18, 21.903]
  - - [8192, 512, 1, 4096, 8192, 8192, 8192, 512]
    - [63, 26.476]
  - - [8192, 512, 1, 8192, 8192, 8192, 8192, 512]
    - [1, 28.432]
  - - [8192, 1024, 1, 128, 8192, 8192, 8192, 1024]
    - [18, 9.205]
  - - [8192, 1024, 1, 256, 8192, 8192, 8192, 1024]
    - [18, 12.25]
  - - [8192, 1024, 1, 512, 8192, 8192, 8192, 1024]
    - [72, 16.816]
  - - [8192, 1024, 1, 1024, 8192, 8192, 8192, 1024]
    - [72, 21.825]
  - - [8192, 1024, 1, 2048, 8192, 8192, 8192, 1024]
    - [68, 26.296]
  - - [8192, 1024, 1, 4096, 8192, 8192, 8192, 1024]
    - [42, 28.603]
  - - [8192, 1024, 1, 8192, 8192, 8192, 8192, 1024]
    - [41, 32.484]
  - - [8192, 2048, 1, 128, 8192, 8192, 8192, 2048]
    - [18, 9.892]
  - - [8192, 2048, 1, 256, 8192, 8192, 8192, 2048]
    - [18, 13.811]
  - - [8192, 2048, 1, 512, 8192, 8192, 8192, 2048]
    - [48, 19.549]
  - - [8192, 2048, 1, 1024, 8192, 8192, 8192, 2048]
    - [48, 24.588]
  - - [8192, 2048, 1, 2048, 8192, 8192, 8192, 2048]
    - [42, 28.102]
  - - [8192, 2048, 1, 4096, 8192, 8192, 8192, 2048]
    - [60, 31.909]
  - - [8192, 2048, 1, 8192, 8192, 8192, 8192, 2048]
    - [0, 35.154]
  - - [8192, 4096, 1, 128, 8192, 8192, 8192, 4096]
    - [18, 11.143]
  - - [8192, 4096, 1, 256, 8192, 8192, 8192, 4096]
    - [18, 15.974]
  - - [8192, 4096, 1, 512, 8192, 8192, 8192, 4096]
    - [61, 20.978]
  - - [8192, 4096, 1, 1024, 8192, 8192, 8192, 4096]
    - [41, 26.856]
  - - [8192, 4096, 1, 2048, 8192, 8192, 8192, 4096]
    - [59, 32.16]
  - - [8192, 4096, 1, 4096, 8192, 8192, 8192, 4096]
    - [39, 36.31]
  - - [8192, 4096, 1, 8192, 8192, 8192, 8192, 4096]
    - [42, 38.819]
  - - [8192, 8192, 1, 128, 8192, 8192, 8192, 8192]
    - [9, 11.521]
  - - [8192, 8192, 1, 256, 8192, 8192, 8192, 8192]
    - [3, 16.014]
  - - [8192, 8192, 1, 512, 8192, 8192, 8192, 8192]
    - [46, 21.714]
  - - [8192, 8192, 1, 1024, 8192, 8192, 8192, 8192]
    - [41, 28.485]
  - - [8192, 8192, 1, 2048, 8192, 8192, 8192, 8192]
    - [41, 35.553]
  - - [8192, 8192, 1, 4096, 8192, 8192, 8192, 8192]
    - [41, 40.038]
  - - [8192, 8192, 1, 8192, 8192, 8192, 8192, 8192]
    - [41, 42.411]
  - - [1, 1, 1, 32, 1, 1, 1, 1]
    - [110, 0.0]
- null
- null
- DeviceEfficiency
- GridBased
