library/src/amd_detail/rocblaslt/src/Tensile/Logic/streamk/gfx942/aquavanjaram942_Cijk_Alik_Bljk_BBS_BH_UserArgs.yaml
- {MinimumRequiredVersion: 4.33.0}
- aquavanjaram942
- gfx942
- [Device 0049, Device 0050]
    SolutionIndex: 0
    SolutionNameMin: Cijk_Alik_Bljk_BBS_BH_UserArgs_MT32x32x32_MI16x16x1_SN_LDSB0_CLR1_GSU0_GSUC0_GSUWGMRR0_K1_LBSPPA128_LBSPPB128_MIWT1_1_PLR1_SU32_SUM0_SUS256_SKXCCM0_VWA1_VWB1_WGM1_WGMXCC1_WGMXCCGn1
    SolutionIndex: 1
    SolutionNameMin: Cijk_Alik_Bljk_BBS_BH_UserArgs_MT256x64x64_MI16x16x1_SN_LDSB1_CLR1_GSU0_GSUC0_GSUWGMRR0_K1_LBSPPA512_LBSPPB256_MIWT8_2_PLR1_SU32_SUM0_SUS256_SKXCCM0_VWA4_VWB2_WGM8_WGMXCC1_WGMXCCGn1
    SolutionIndex: 2
    SolutionNameMin: Cijk_Alik_Bljk_BBS_BH_UserArgs_MT128x128x64_MI16x16x1_SN_LDSB1_CLR1_GSU0_GSUC0_GSUWGMRR0_K1_LBSPPA256_LBSPPB128_MIWT4_4_PLR1_SU32_SUM0_SUS256_SKXCCM0_VWA2_VWB1_WGM1_WGMXCC1_WGMXCCGn1
    SolutionIndex: 3
    SolutionNameMin: Cijk_Alik_Bljk_BBS_BH_UserArgs_MT128x128x64_MI16x16x1_SN_LDSB1_CLR1_GSU0_GSUC0_GSUWGMRR0_K1_LBSPPA512_LBSPPB128_MIWT4_4_PLR1_SU32_SUM0_SUS256_SKXCCM0_VWA4_VWB1_WGM1_WGMXCC1_WGMXCCGn1
    SolutionIndex: 4
    SolutionNameMin: Cijk_Alik_Bljk_BBS_BH_UserArgs_MT128x128x64_MI16x16x1_SN_LDSB1_CLR1_GSU0_GSUC0_GSUWGMRR0_K1_LBSPPA256_LBSPPB256_MIWT4_4_PLR1_SU32_SUM0_SUS256_SKXCCM0_VWA2_VWB2_WGM1_WGMXCC1_WGMXCCGn1
    SolutionIndex: 5
    SolutionNameMin: Cijk_Alik_Bljk_BBS_BH_UserArgs_MT128x128x64_MI16x16x1_SN_LDSB1_CLR1_GSU0_GSUC0_GSUWGMRR0_K1_LBSPPA512_LBSPPB256_MIWT4_4_PLR1_SU32_SUM0_SUS256_SKXCCM0_VWA4_VWB2_WGM1_WGMXCC1_WGMXCCGn1
    SolutionIndex: 6
    SolutionNameMin: Cijk_Alik_Bljk_BBS_BH_UserArgs_MT128x128x64_MI16x16x1_SN_LDSB1_CLR1_GSU0_GSUC0_GSUWGMRR0_K1_LBSPPA256_LBSPPB512_MIWT4_4_PLR1_SU32_SUM0_SUS256_SKXCCM0_VWA2_VWB4_WGM1_WGMXCC1_WGMXCCGn1
    SolutionIndex: 7
    SolutionNameMin: Cijk_Alik_Bljk_BBS_BH_UserArgs_MT128x128x64_MI16x16x1_SN_LDSB1_CLR1_GSU0_GSUC0_GSUWGMRR0_K1_LBSPPA512_LBSPPB512_MIWT4_4_PLR1_SU32_SUM0_SUS256_SKXCCM0_VWA4_VWB4_WGM1_WGMXCC1_WGMXCCGn1
    SolutionIndex: 8
    SolutionNameMin: Cijk_Alik_Bljk_BBS_BH_UserArgs_MT128x128x64_MI16x16x1_SN_LDSB1_CLR1_GSU0_GSUC0_GSUWGMRR0_K1_LBSPPA512_LBSPPB256_MIWT4_4_PLR1_SU32_SUM0_SUS256_SKXCCM0_VWA4_VWB2_WGM4_WGMXCC1_WGMXCCGn1
    SolutionIndex: 9
    SolutionNameMin: Cijk_Alik_Bljk_BBS_BH_UserArgs_MT128x128x64_MI16x16x1_SN_LDSB1_CLR1_GSU0_GSUC0_GSUWGMRR0_K1_LBSPPA512_LBSPPB512_MIWT4_4_PLR1_SU32_SUM0_SUS256_SKXCCM0_VWA4_VWB4_WGM4_WGMXCC1_WGMXCCGn1
    SolutionIndex: 10
    SolutionNameMin: Cijk_Alik_Bljk_BBS_BH_UserArgs_MT128x128x64_MI16x16x1_SN_LDSB1_CLR1_GSU0_GSUC0_GSUWGMRR0_K1_LBSPPA512_LBSPPB256_MIWT4_4_PLR1_SU32_SUM0_SUS256_SKXCCM0_VWA4_VWB2_WGM8_WGMXCC1_WGMXCCGn1
    SolutionIndex: 11
    SolutionNameMin: Cijk_Alik_Bljk_BBS_BH_UserArgs_MT128x128x64_MI16x16x1_SN_LDSB1_CLR1_GSU0_GSUC0_GSUWGMRR0_K1_LBSPPA512_LBSPPB512_MIWT4_4_PLR1_SU32_SUM0_SUS256_SKXCCM0_VWA4_VWB4_WGM8_WGMXCC1_WGMXCCGn1
    SolutionIndex: 12
    SolutionNameMin: Cijk_Alik_Bljk_BBS_BH_UserArgs_MT64x128x64_MI16x16x1_SN_LDSB1_CLR1_GSU0_GSUC0_GSUWGMRR0_K1_LBSPPA256_LBSPPB128_MIWT2_4_PLR2_SU32_SUM0_SUS256_SKXCCM0_VWA2_VWB1_WGM1_WGMXCC1_WGMXCCGn1
    SolutionIndex: 13
    SolutionNameMin: Cijk_Alik_Bljk_BBS_BH_UserArgs_MT128x64x64_MI16x16x1_SN_LDSB1_CLR1_GSU0_GSUC0_GSUWGMRR0_K1_LBSPPA512_LBSPPB128_MIWT4_2_PLR1_SU32_SUM0_SUS256_SKXCCM0_VWA4_VWB1_WGM1_WGMXCC1_WGMXCCGn1
    SolutionIndex: 14
    SolutionNameMin: Cijk_Alik_Bljk_BBS_BH_UserArgs_MT128x64x64_MI16x16x1_SN_LDSB1_CLR1_GSU0_GSUC0_GSUWGMRR0_K1_LBSPPA512_LBSPPB128_MIWT4_2_PLR2_SU32_SUM0_SUS256_SKXCCM0_VWA4_VWB1_WGM8_WGMXCC1_WGMXCCGn1
    SolutionIndex: 15
    SolutionNameMin: Cijk_Alik_Bljk_BBS_BH_UserArgs_MT32x32x64_MI16x16x1_SN_LDSB0_CLR1_GSU0_GSUC0_GSUWGMRR0_K1_LBSPPA128_LBSPPB128_MIWT1_1_PLR1_SU32_SUM0_SUS256_SKXCCM0_VWA1_VWB1_WGM1_WGMXCC1_WGMXCCGn1
    SolutionIndex: 16
    SolutionNameMin: Cijk_Alik_Bljk_BBS_BH_UserArgs_MT32x32x64_MI16x16x1_SN_LDSB0_CLR1_GSU0_GSUC0_GSUWGMRR0_K1_LBSPPA128_LBSPPB128_MIWT1_1_PLR2_SU32_SUM0_SUS256_SKXCCM0_VWA1_VWB1_WGM1_WGMXCC1_WGMXCCGn1
    SolutionIndex: 17
    SolutionNameMin: Cijk_Alik_Bljk_BBS_BH_UserArgs_MT128x32x128_MI16x16x1_SN_LDSB1_CLR1_GSU0_GSUC0_GSUWGMRR0_K1_LBSPPA1024_LBSPPB256_MIWT4_1_PLR1_SU32_SUM0_SUS256_SKXCCM0_VWA4_VWB1_WGM1_WGMXCC1_WGMXCCGn1
    SolutionIndex: 18
    SolutionNameMin: Cijk_Alik_Bljk_BBS_BH_UserArgs_MT64x64x128_MI16x16x1_SN_LDSB1_CLR1_GSU0_GSUC0_GSUWGMRR0_K1_LBSPPA512_LBSPPB256_MIWT2_2_PLR1_SU32_SUM0_SUS256_SKXCCM0_VWA2_VWB1_WGM1_WGMXCC1_WGMXCCGn1
    SolutionIndex: 19
    SolutionNameMin: Cijk_Alik_Bljk_BBS_BH_UserArgs_MT64x64x128_MI16x16x1_SN_LDSB1_CLR1_GSU0_GSUC0_GSUWGMRR0_K1_LBSPPA512_LBSPPB512_MIWT2_2_PLR1_SU32_SUM0_SUS256_SKXCCM0_VWA2_VWB2_WGM1_WGMXCC1_WGMXCCGn1
    SolutionIndex: 20
    SolutionNameMin: Cijk_Alik_Bljk_BBS_BH_UserArgs_MT64x64x128_MI16x16x1_SN_LDSB1_CLR1_GSU0_GSUC0_GSUWGMRR0_K1_LBSPPA512_LBSPPB256_MIWT2_2_PLR2_SU32_SUM0_SUS256_SKXCCM0_VWA2_VWB1_WGM1_WGMXCC1_WGMXCCGn1
    SolutionIndex: 21
    SolutionNameMin: Cijk_Alik_Bljk_BBS_BH_UserArgs_MT64x64x128_MI16x16x1_SN_LDSB1_CLR1_GSU0_GSUC0_GSUWGMRR0_K1_LBSPPA512_LBSPPB512_MIWT2_2_PLR2_SU32_SUM0_SUS256_SKXCCM0_VWA2_VWB2_WGM1_WGMXCC1_WGMXCCGn1
    SolutionIndex: 22
    SolutionNameMin: Cijk_Alik_Bljk_BBS_BH_UserArgs_MT64x64x128_MI16x16x1_SN_LDSB1_CLR1_GSU0_GSUC0_GSUWGMRR0_K1_LBSPPA512_LBSPPB512_MIWT2_2_PLR1_SU32_SUM0_SUS256_SKXCCM0_VWA2_VWB2_WGM8_WGMXCC1_WGMXCCGn1
    SolutionIndex: 23
    SolutionNameMin: Cijk_Alik_Bljk_BBS_BH_UserArgs_MT32x64x128_MI16x16x1_SN_LDSB1_CLR1_GSU0_GSUC0_GSUWGMRR0_K1_LBSPPA256_LBSPPB256_MIWT1_2_PLR1_SU32_SUM0_SUS256_SKXCCM0_VWA1_VWB1_WGM1_WGMXCC1_WGMXCCGn1
    SolutionIndex: 24
    SolutionNameMin: Cijk_Alik_Bljk_BBS_BH_UserArgs_MT32x64x128_MI16x16x1_SN_LDSB1_CLR1_GSU0_GSUC0_GSUWGMRR0_K1_LBSPPA256_LBSPPB512_MIWT1_2_PLR1_SU32_SUM0_SUS256_SKXCCM0_VWA1_VWB2_WGM1_WGMXCC1_WGMXCCGn1
    SolutionIndex: 25
    SolutionNameMin: Cijk_Alik_Bljk_BBS_BH_UserArgs_MT32x64x128_MI16x16x1_SN_LDSB1_CLR1_GSU0_GSUC0_GSUWGMRR0_K1_LBSPPA256_LBSPPB512_MIWT1_2_PLR2_SU32_SUM0_SUS256_SKXCCM0_VWA1_VWB2_WGM1_WGMXCC1_WGMXCCGn1
    SolutionIndex: 26
    SolutionNameMin: Cijk_Alik_Bljk_BBS_BH_UserArgs_MT64x32x128_MI16x16x1_SN_LDSB1_CLR1_GSU0_GSUC0_GSUWGMRR0_K1_LBSPPA512_LBSPPB256_MIWT2_1_PLR1_SU32_SUM0_SUS256_SKXCCM0_VWA2_VWB1_WGM1_WGMXCC1_WGMXCCGn1
    SolutionIndex: 27
    SolutionNameMin: Cijk_Alik_Bljk_BBS_BH_UserArgs_MT64x32x128_MI16x16x1_SN_LDSB1_CLR1_GSU0_GSUC0_GSUWGMRR0_K1_LBSPPA512_LBSPPB256_MIWT2_1_PLR2_SU32_SUM0_SUS256_SKXCCM0_VWA2_VWB1_WGM1_WGMXCC1_WGMXCCGn1
    SolutionIndex: 28
    SolutionNameMin: Cijk_Alik_Bljk_BBS_BH_UserArgs_MT32x32x128_MI16x16x1_SN_LDSB1_CLR1_GSU0_GSUC0_GSUWGMRR0_K1_LBSPPA256_LBSPPB256_MIWT1_1_PLR1_SU32_SUM0_SUS256_SKXCCM0_VWA1_VWB1_WGM1_WGMXCC1_WGMXCCGn1
    SolutionIndex: 29
    SolutionNameMin: Cijk_Alik_Bljk_BBS_BH_UserArgs_MT32x32x128_MI16x16x1_SN_LDSB1_CLR1_GSU0_GSUC0_GSUWGMRR0_K1_LBSPPA256_LBSPPB256_MIWT1_1_PLR2_SU32_SUM0_SUS256_SKXCCM0_VWA1_VWB1_WGM1_WGMXCC1_WGMXCCGn1
    SolutionIndex: 30
    SolutionNameMin: Cijk_Alik_Bljk_BBS_BH_UserArgs_MT128x128x64_MI16x16x1_SN_LDSB1_CLR1_GSU0_GSUC0_GSUWGMRR0_K1_LBSPPA128_LBSPPB128_MIWT4_4_PLR1_SU32_SUM0_SUS256_SKXCCM8_VWA1_VWB1_WGM1_WGMXCC1_WGMXCCGn1
    SolutionIndex: 31
    SolutionNameMin: Cijk_Alik_Bljk_BBS_BH_UserArgs_MT128x128x64_MI16x16x1_SN_LDSB1_CLR1_GSU0_GSUC0_GSUWGMRR0_K1_LBSPPA512_LBSPPB128_MIWT4_4_PLR1_SU32_SUM0_SUS256_SKXCCM8_VWA4_VWB1_WGM1_WGMXCC1_WGMXCCGn1
    SolutionIndex: 32
    SolutionNameMin: Cijk_Alik_Bljk_BBS_BH_UserArgs_MT128x128x64_MI16x16x1_SN_LDSB1_CLR1_GSU0_GSUC0_GSUWGMRR0_K1_LBSPPA256_LBSPPB256_MIWT4_4_PLR1_SU32_SUM0_SUS256_SKXCCM8_VWA2_VWB2_WGM1_WGMXCC1_WGMXCCGn1
    SolutionIndex: 33
    SolutionNameMin: Cijk_Alik_Bljk_BBS_BH_UserArgs_MT128x128x64_MI16x16x1_SN_LDSB1_CLR1_GSU0_GSUC0_GSUWGMRR0_K1_LBSPPA512_LBSPPB256_MIWT4_4_PLR1_SU32_SUM0_SUS256_SKXCCM8_VWA4_VWB2_WGM1_WGMXCC1_WGMXCCGn1
    SolutionIndex: 34
    SolutionNameMin: Cijk_Alik_Bljk_BBS_BH_UserArgs_MT128x128x64_MI16x16x1_SN_LDSB1_CLR1_GSU0_GSUC0_GSUWGMRR0_K1_LBSPPA256_LBSPPB512_MIWT4_4_PLR1_SU32_SUM0_SUS256_SKXCCM8_VWA2_VWB4_WGM1_WGMXCC1_WGMXCCGn1
    SolutionIndex: 35
    SolutionNameMin: Cijk_Alik_Bljk_BBS_BH_UserArgs_MT128x128x64_MI16x16x1_SN_LDSB1_CLR1_GSU0_GSUC0_GSUWGMRR0_K1_LBSPPA512_LBSPPB512_MIWT4_4_PLR1_SU32_SUM0_SUS256_SKXCCM8_VWA4_VWB4_WGM1_WGMXCC1_WGMXCCGn1
    SolutionIndex: 36
    SolutionNameMin: Cijk_Alik_Bljk_BBS_BH_UserArgs_MT128x128x64_MI16x16x1_SN_LDSB1_CLR1_GSU0_GSUC0_GSUWGMRR0_K1_LBSPPA256_LBSPPB128_MIWT4_4_PLR1_SU32_SUM0_SUS256_SKXCCM8_VWA2_VWB1_WGM4_WGMXCC1_WGMXCCGn1
    SolutionIndex: 37
    SolutionNameMin: Cijk_Alik_Bljk_BBS_BH_UserArgs_MT128x128x64_MI16x16x1_SN_LDSB1_CLR1_GSU0_GSUC0_GSUWGMRR0_K1_LBSPPA512_LBSPPB128_MIWT4_4_PLR1_SU32_SUM0_SUS256_SKXCCM8_VWA4_VWB1_WGM4_WGMXCC1_WGMXCCGn1
    SolutionIndex: 38
    SolutionNameMin: Cijk_Alik_Bljk_BBS_BH_UserArgs_MT128x128x64_MI16x16x1_SN_LDSB1_CLR1_GSU0_GSUC0_GSUWGMRR0_K1_LBSPPA512_LBSPPB256_MIWT4_4_PLR1_SU32_SUM0_SUS256_SKXCCM8_VWA4_VWB2_WGM4_WGMXCC1_WGMXCCGn1
    SolutionIndex: 39
    SolutionNameMin: Cijk_Alik_Bljk_BBS_BH_UserArgs_MT128x128x64_MI16x16x1_SN_LDSB1_CLR1_GSU0_GSUC0_GSUWGMRR0_K1_LBSPPA256_LBSPPB512_MIWT4_4_PLR1_SU32_SUM0_SUS256_SKXCCM8_VWA2_VWB4_WGM4_WGMXCC1_WGMXCCGn1
    SolutionIndex: 40
    SolutionNameMin: Cijk_Alik_Bljk_BBS_BH_UserArgs_MT128x128x64_MI16x16x1_SN_LDSB1_CLR1_GSU0_GSUC0_GSUWGMRR0_K1_LBSPPA512_LBSPPB512_MIWT4_4_PLR1_SU32_SUM0_SUS256_SKXCCM8_VWA4_VWB4_WGM4_WGMXCC1_WGMXCCGn1
    SolutionIndex: 41
    SolutionNameMin: Cijk_Alik_Bljk_BBS_BH_UserArgs_MT128x128x64_MI16x16x1_SN_LDSB1_CLR1_GSU0_GSUC0_GSUWGMRR0_K1_LBSPPA256_LBSPPB128_MIWT4_4_PLR1_SU32_SUM0_SUS256_SKXCCM8_VWA2_VWB1_WGM8_WGMXCC1_WGMXCCGn1
    SolutionIndex: 42
    SolutionNameMin: Cijk_Alik_Bljk_BBS_BH_UserArgs_MT128x128x64_MI16x16x1_SN_LDSB1_CLR1_GSU0_GSUC0_GSUWGMRR0_K1_LBSPPA512_LBSPPB128_MIWT4_4_PLR1_SU32_SUM0_SUS256_SKXCCM8_VWA4_VWB1_WGM8_WGMXCC1_WGMXCCGn1
    SolutionIndex: 43
    SolutionNameMin: Cijk_Alik_Bljk_BBS_BH_UserArgs_MT128x128x64_MI16x16x1_SN_LDSB1_CLR1_GSU0_GSUC0_GSUWGMRR0_K1_LBSPPA512_LBSPPB256_MIWT4_4_PLR1_SU32_SUM0_SUS256_SKXCCM8_VWA4_VWB2_WGM8_WGMXCC1_WGMXCCGn1
    SolutionIndex: 44
    SolutionNameMin: Cijk_Alik_Bljk_BBS_BH_UserArgs_MT128x128x64_MI16x16x1_SN_LDSB1_CLR1_GSU0_GSUC0_GSUWGMRR0_K1_LBSPPA128_LBSPPB512_MIWT4_4_PLR1_SU32_SUM0_SUS256_SKXCCM8_VWA1_VWB4_WGM8_WGMXCC1_WGMXCCGn1
    SolutionIndex: 45
    SolutionNameMin: Cijk_Alik_Bljk_BBS_BH_UserArgs_MT128x128x64_MI16x16x1_SN_LDSB1_CLR1_GSU0_GSUC0_GSUWGMRR0_K1_LBSPPA256_LBSPPB512_MIWT4_4_PLR1_SU32_SUM0_SUS256_SKXCCM8_VWA2_VWB4_WGM8_WGMXCC1_WGMXCCGn1
    SolutionIndex: 46
    SolutionNameMin: Cijk_Alik_Bljk_BBS_BH_UserArgs_MT128x128x64_MI16x16x1_SN_LDSB1_CLR1_GSU0_GSUC0_GSUWGMRR0_K1_LBSPPA512_LBSPPB512_MIWT4_4_PLR1_SU32_SUM0_SUS256_SKXCCM8_VWA4_VWB4_WGM8_WGMXCC1_WGMXCCGn1
    SolutionIndex: 47
    SolutionNameMin: Cijk_Alik_Bljk_BBS_BH_UserArgs_MT64x128x64_MI16x16x1_SN_LDSB1_CLR1_GSU0_GSUC0_GSUWGMRR0_K1_LBSPPA256_LBSPPB128_MIWT2_4_PLR1_SU32_SUM0_SUS256_SKXCCM8_VWA2_VWB1_WGM1_WGMXCC1_WGMXCCGn1
    SolutionIndex: 48
    SolutionNameMin: Cijk_Alik_Bljk_BBS_BH_UserArgs_MT64x128x64_MI16x16x1_SN_LDSB1_CLR1_GSU0_GSUC0_GSUWGMRR0_K1_LBSPPA256_LBSPPB256_MIWT2_4_PLR1_SU32_SUM0_SUS256_SKXCCM8_VWA2_VWB2_WGM1_WGMXCC1_WGMXCCGn1
    SolutionIndex: 49
    SolutionNameMin: Cijk_Alik_Bljk_BBS_BH_UserArgs_MT64x128x64_MI16x16x1_SN_LDSB1_CLR1_GSU0_GSUC0_GSUWGMRR0_K1_LBSPPA256_LBSPPB512_MIWT2_4_PLR1_SU32_SUM0_SUS256_SKXCCM8_VWA2_VWB4_WGM1_WGMXCC1_WGMXCCGn1
    SolutionIndex: 50
    SolutionNameMin: Cijk_Alik_Bljk_BBS_BH_UserArgs_MT64x128x64_MI16x16x1_SN_LDSB1_CLR1_GSU0_GSUC0_GSUWGMRR0_K1_LBSPPA256_LBSPPB128_MIWT2_4_PLR1_SU32_SUM0_SUS256_SKXCCM8_VWA2_VWB1_WGM4_WGMXCC1_WGMXCCGn1
    SolutionIndex: 51
    SolutionNameMin: Cijk_Alik_Bljk_BBS_BH_UserArgs_MT64x128x64_MI16x16x1_SN_LDSB1_CLR1_GSU0_GSUC0_GSUWGMRR0_K1_LBSPPA256_LBSPPB256_MIWT2_4_PLR1_SU32_SUM0_SUS256_SKXCCM8_VWA2_VWB2_WGM4_WGMXCC1_WGMXCCGn1
    SolutionIndex: 52
    SolutionNameMin: Cijk_Alik_Bljk_BBS_BH_UserArgs_MT64x128x64_MI16x16x1_SN_LDSB1_CLR1_GSU0_GSUC0_GSUWGMRR0_K1_LBSPPA256_LBSPPB256_MIWT2_4_PLR1_SU32_SUM0_SUS256_SKXCCM8_VWA2_VWB2_WGM8_WGMXCC1_WGMXCCGn1
    SolutionIndex: 53
    SolutionNameMin: Cijk_Alik_Bljk_BBS_BH_UserArgs_MT128x64x64_MI16x16x1_SN_LDSB1_CLR1_GSU0_GSUC0_GSUWGMRR0_K1_LBSPPA128_LBSPPB128_MIWT4_2_PLR1_SU32_SUM0_SUS256_SKXCCM8_VWA1_VWB1_WGM1_WGMXCC1_WGMXCCGn1
    SolutionIndex: 54
    SolutionNameMin: Cijk_Alik_Bljk_BBS_BH_UserArgs_MT128x64x64_MI16x16x1_SN_LDSB1_CLR1_GSU0_GSUC0_GSUWGMRR0_K1_LBSPPA512_LBSPPB128_MIWT4_2_PLR1_SU32_SUM0_SUS256_SKXCCM8_VWA4_VWB1_WGM1_WGMXCC1_WGMXCCGn1
    SolutionIndex: 55
    SolutionNameMin: Cijk_Alik_Bljk_BBS_BH_UserArgs_MT128x64x64_MI16x16x1_SN_LDSB1_CLR1_GSU0_GSUC0_GSUWGMRR0_K1_LBSPPA256_LBSPPB256_MIWT4_2_PLR1_SU32_SUM0_SUS256_SKXCCM8_VWA2_VWB2_WGM1_WGMXCC1_WGMXCCGn1
    SolutionIndex: 56
    SolutionNameMin: Cijk_Alik_Bljk_BBS_BH_UserArgs_MT128x64x64_MI16x16x1_SN_LDSB1_CLR1_GSU0_GSUC0_GSUWGMRR0_K1_LBSPPA512_LBSPPB256_MIWT4_2_PLR1_SU32_SUM0_SUS256_SKXCCM8_VWA4_VWB2_WGM1_WGMXCC1_WGMXCCGn1
    SolutionIndex: 57
    SolutionNameMin: Cijk_Alik_Bljk_BBS_BH_UserArgs_MT128x64x64_MI16x16x1_SN_LDSB1_CLR1_GSU0_GSUC0_GSUWGMRR0_K1_LBSPPA512_LBSPPB128_MIWT4_2_PLR2_SU32_SUM0_SUS256_SKXCCM8_VWA4_VWB1_WGM1_WGMXCC1_WGMXCCGn1
    SolutionIndex: 58
    SolutionNameMin: Cijk_Alik_Bljk_BBS_BH_UserArgs_MT128x64x64_MI16x16x1_SN_LDSB1_CLR1_GSU0_GSUC0_GSUWGMRR0_K1_LBSPPA512_LBSPPB128_MIWT4_2_PLR1_SU32_SUM0_SUS256_SKXCCM8_VWA4_VWB1_WGM4_WGMXCC1_WGMXCCGn1
    SolutionIndex: 59
    SolutionNameMin: Cijk_Alik_Bljk_BBS_BH_UserArgs_MT128x64x64_MI16x16x1_SN_LDSB1_CLR1_GSU0_GSUC0_GSUWGMRR0_K1_LBSPPA256_LBSPPB256_MIWT4_2_PLR1_SU32_SUM0_SUS256_SKXCCM8_VWA2_VWB2_WGM4_WGMXCC1_WGMXCCGn1
    SolutionIndex: 60
    SolutionNameMin: Cijk_Alik_Bljk_BBS_BH_UserArgs_MT128x64x64_MI16x16x1_SN_LDSB1_CLR1_GSU0_GSUC0_GSUWGMRR0_K1_LBSPPA512_LBSPPB128_MIWT4_2_PLR1_SU32_SUM0_SUS256_SKXCCM8_VWA4_VWB1_WGM8_WGMXCC1_WGMXCCGn1
    SolutionIndex: 61
    SolutionNameMin: Cijk_Alik_Bljk_BBS_BH_UserArgs_MT128x64x64_MI16x16x1_SN_LDSB1_CLR1_GSU0_GSUC0_GSUWGMRR0_K1_LBSPPA512_LBSPPB256_MIWT4_2_PLR1_SU32_SUM0_SUS256_SKXCCM8_VWA4_VWB2_WGM8_WGMXCC1_WGMXCCGn1
    SolutionIndex: 62
    SolutionNameMin: Cijk_Alik_Bljk_BBS_BH_UserArgs_MT64x64x64_MI16x16x1_SN_LDSB1_CLR1_GSU0_GSUC0_GSUWGMRR0_K1_LBSPPA128_LBSPPB128_MIWT2_2_PLR1_SU32_SUM0_SUS256_SKXCCM8_VWA1_VWB1_WGM4_WGMXCC1_WGMXCCGn1
    SolutionIndex: 63
    SolutionNameMin: Cijk_Alik_Bljk_BBS_BH_UserArgs_MT64x64x64_MI16x16x1_SN_LDSB1_CLR1_GSU0_GSUC0_GSUWGMRR0_K1_LBSPPA256_LBSPPB128_MIWT2_2_PLR1_SU32_SUM0_SUS256_SKXCCM8_VWA2_VWB1_WGM4_WGMXCC1_WGMXCCGn1
    SolutionIndex: 64
    SolutionNameMin: Cijk_Alik_Bljk_BBS_BH_UserArgs_MT64x64x64_MI16x16x1_SN_LDSB1_CLR1_GSU0_GSUC0_GSUWGMRR0_K1_LBSPPA128_LBSPPB256_MIWT2_2_PLR1_SU32_SUM0_SUS256_SKXCCM8_VWA1_VWB2_WGM4_WGMXCC1_WGMXCCGn1
    SolutionIndex: 65
    SolutionNameMin: Cijk_Alik_Bljk_BBS_BH_UserArgs_MT32x64x64_MI16x16x1_SN_LDSB0_CLR1_GSU0_GSUC0_GSUWGMRR0_K1_LBSPPA128_LBSPPB256_MIWT1_2_PLR1_SU32_SUM0_SUS256_SKXCCM8_VWA1_VWB2_WGM1_WGMXCC1_WGMXCCGn1
    SolutionIndex: 66
    SolutionNameMin: Cijk_Alik_Bljk_BBS_BH_UserArgs_MT32x64x64_MI16x16x1_SN_LDSB0_CLR1_GSU0_GSUC0_GSUWGMRR0_K1_LBSPPA128_LBSPPB256_MIWT1_2_PLR1_SU32_SUM0_SUS256_SKXCCM8_VWA1_VWB2_WGM4_WGMXCC1_WGMXCCGn1
    SolutionIndex: 67
    SolutionNameMin: Cijk_Alik_Bljk_BBS_BH_UserArgs_MT32x32x64_MI16x16x1_SN_LDSB0_CLR1_GSU0_GSUC0_GSUWGMRR0_K1_LBSPPA128_LBSPPB128_MIWT1_1_PLR1_SU32_SUM0_SUS256_SKXCCM8_VWA1_VWB1_WGM1_WGMXCC1_WGMXCCGn1
    SolutionIndex: 68
    SolutionNameMin: Cijk_Alik_Bljk_BBS_BH_UserArgs_MT32x32x64_MI16x16x1_SN_LDSB0_CLR1_GSU0_GSUC0_GSUWGMRR0_K1_LBSPPA128_LBSPPB128_MIWT1_1_PLR1_SU32_SUM0_SUS256_SKXCCM8_VWA1_VWB1_WGM4_WGMXCC1_WGMXCCGn1
    SolutionIndex: 69
    SolutionNameMin: Cijk_Alik_Bljk_BBS_BH_UserArgs_MT32x32x64_MI16x16x1_SN_LDSB0_CLR1_GSU0_GSUC0_GSUWGMRR0_K1_LBSPPA128_LBSPPB128_MIWT1_1_PLR1_SU32_SUM0_SUS256_SKXCCM8_VWA1_VWB1_WGM8_WGMXCC1_WGMXCCGn1
    SolutionIndex: 70
    SolutionNameMin: Cijk_Alik_Bljk_BBS_BH_UserArgs_MT32x128x128_MI16x16x1_SN_LDSB1_CLR1_GSU0_GSUC0_GSUWGMRR0_K1_LBSPPA256_LBSPPB256_MIWT1_4_PLR2_SU32_SUM0_SUS256_SKXCCM8_VWA1_VWB1_WGM1_WGMXCC1_WGMXCCGn1
    SolutionIndex: 71
    SolutionNameMin: Cijk_Alik_Bljk_BBS_BH_UserArgs_MT64x64x128_MI16x16x1_SN_LDSB1_CLR1_GSU0_GSUC0_GSUWGMRR0_K1_LBSPPA512_LBSPPB256_MIWT2_2_PLR1_SU32_SUM0_SUS256_SKXCCM8_VWA2_VWB1_WGM1_WGMXCC1_WGMXCCGn1
    SolutionIndex: 72
    SolutionNameMin: Cijk_Alik_Bljk_BBS_BH_UserArgs_MT64x64x128_MI16x16x1_SN_LDSB1_CLR1_GSU0_GSUC0_GSUWGMRR0_K1_LBSPPA512_LBSPPB512_MIWT2_2_PLR1_SU32_SUM0_SUS256_SKXCCM8_VWA2_VWB2_WGM1_WGMXCC1_WGMXCCGn1
    SolutionIndex: 73
    SolutionNameMin: Cijk_Alik_Bljk_BBS_BH_UserArgs_MT64x64x128_MI16x16x1_SN_LDSB1_CLR1_GSU0_GSUC0_GSUWGMRR0_K1_LBSPPA512_LBSPPB256_MIWT2_2_PLR2_SU32_SUM0_SUS256_SKXCCM8_VWA2_VWB1_WGM1_WGMXCC1_WGMXCCGn1
    SolutionIndex: 74
    SolutionNameMin: Cijk_Alik_Bljk_BBS_BH_UserArgs_MT64x64x128_MI16x16x1_SN_LDSB1_CLR1_GSU0_GSUC0_GSUWGMRR0_K1_LBSPPA512_LBSPPB512_MIWT2_2_PLR2_SU32_SUM0_SUS256_SKXCCM8_VWA2_VWB2_WGM1_WGMXCC1_WGMXCCGn1
    SolutionIndex: 75
    SolutionNameMin: Cijk_Alik_Bljk_BBS_BH_UserArgs_MT64x64x128_MI16x16x1_SN_LDSB1_CLR1_GSU0_GSUC0_GSUWGMRR0_K1_LBSPPA256_LBSPPB256_MIWT2_2_PLR1_SU32_SUM0_SUS256_SKXCCM8_VWA1_VWB1_WGM4_WGMXCC1_WGMXCCGn1
    SolutionIndex: 76
    SolutionNameMin: Cijk_Alik_Bljk_BBS_BH_UserArgs_MT64x64x128_MI16x16x1_SN_LDSB1_CLR1_GSU0_GSUC0_GSUWGMRR0_K1_LBSPPA512_LBSPPB256_MIWT2_2_PLR1_SU32_SUM0_SUS256_SKXCCM8_VWA2_VWB1_WGM4_WGMXCC1_WGMXCCGn1
    SolutionIndex: 77
    SolutionNameMin: Cijk_Alik_Bljk_BBS_BH_UserArgs_MT64x64x128_MI16x16x1_SN_LDSB1_CLR1_GSU0_GSUC0_GSUWGMRR0_K1_LBSPPA256_LBSPPB512_MIWT2_2_PLR1_SU32_SUM0_SUS256_SKXCCM8_VWA1_VWB2_WGM4_WGMXCC1_WGMXCCGn1
    SolutionIndex: 78
    SolutionNameMin: Cijk_Alik_Bljk_BBS_BH_UserArgs_MT64x64x128_MI16x16x1_SN_LDSB1_CLR1_GSU0_GSUC0_GSUWGMRR0_K1_LBSPPA512_LBSPPB256_MIWT2_2_PLR2_SU32_SUM0_SUS256_SKXCCM8_VWA2_VWB1_WGM4_WGMXCC1_WGMXCCGn1
    SolutionIndex: 79
    SolutionNameMin: Cijk_Alik_Bljk_BBS_BH_UserArgs_MT64x64x128_MI16x16x1_SN_LDSB1_CLR1_GSU0_GSUC0_GSUWGMRR0_K1_LBSPPA256_LBSPPB256_MIWT2_2_PLR1_SU32_SUM0_SUS256_SKXCCM8_VWA1_VWB1_WGM8_WGMXCC1_WGMXCCGn1
    SolutionIndex: 80
    SolutionNameMin: Cijk_Alik_Bljk_BBS_BH_UserArgs_MT64x64x128_MI16x16x1_SN_LDSB1_CLR1_GSU0_GSUC0_GSUWGMRR0_K1_LBSPPA512_LBSPPB256_MIWT2_2_PLR1_SU32_SUM0_SUS256_SKXCCM8_VWA2_VWB1_WGM8_WGMXCC1_WGMXCCGn1
    SolutionIndex: 81
    SolutionNameMin: Cijk_Alik_Bljk_BBS_BH_UserArgs_MT64x64x128_MI16x16x1_SN_LDSB1_CLR1_GSU0_GSUC0_GSUWGMRR0_K1_LBSPPA512_LBSPPB256_MIWT2_2_PLR2_SU32_SUM0_SUS256_SKXCCM8_VWA2_VWB1_WGM8_WGMXCC1_WGMXCCGn1
    SolutionIndex: 82
    SolutionNameMin: Cijk_Alik_Bljk_BBS_BH_UserArgs_MT64x64x128_MI16x16x1_SN_LDSB1_CLR1_GSU0_GSUC0_GSUWGMRR0_K1_LBSPPA512_LBSPPB512_MIWT2_2_PLR2_SU32_SUM0_SUS256_SKXCCM8_VWA2_VWB2_WGM8_WGMXCC1_WGMXCCGn1
    SolutionIndex: 83
    SolutionNameMin: Cijk_Alik_Bljk_BBS_BH_UserArgs_MT32x64x128_MI16x16x1_SN_LDSB1_CLR1_GSU0_GSUC0_GSUWGMRR0_K1_LBSPPA256_LBSPPB512_MIWT1_2_PLR1_SU32_SUM0_SUS256_SKXCCM8_VWA1_VWB2_WGM1_WGMXCC1_WGMXCCGn1
    SolutionIndex: 84
    SolutionNameMin: Cijk_Alik_Bljk_BBS_BH_UserArgs_MT32x64x128_MI16x16x1_SN_LDSB1_CLR1_GSU0_GSUC0_GSUWGMRR0_K1_LBSPPA256_LBSPPB256_MIWT1_2_PLR2_SU32_SUM0_SUS256_SKXCCM8_VWA1_VWB1_WGM1_WGMXCC1_WGMXCCGn1
    SolutionIndex: 85
    SolutionNameMin: Cijk_Alik_Bljk_BBS_BH_UserArgs_MT32x64x128_MI16x16x1_SN_LDSB1_CLR1_GSU0_GSUC0_GSUWGMRR0_K1_LBSPPA256_LBSPPB512_MIWT1_2_PLR2_SU32_SUM0_SUS256_SKXCCM8_VWA1_VWB2_WGM1_WGMXCC1_WGMXCCGn1
    SolutionIndex: 86
    SolutionNameMin: Cijk_Alik_Bljk_BBS_BH_UserArgs_MT32x64x128_MI16x16x1_SN_LDSB1_CLR1_GSU0_GSUC0_GSUWGMRR0_K1_LBSPPA256_LBSPPB512_MIWT1_2_PLR1_SU32_SUM0_SUS256_SKXCCM8_VWA1_VWB2_WGM4_WGMXCC1_WGMXCCGn1
    SolutionIndex: 87
    SolutionNameMin: Cijk_Alik_Bljk_BBS_BH_UserArgs_MT64x32x128_MI16x16x1_SN_LDSB1_CLR1_GSU0_GSUC0_GSUWGMRR0_K1_LBSPPA512_LBSPPB256_MIWT2_1_PLR1_SU32_SUM0_SUS256_SKXCCM8_VWA2_VWB1_WGM1_WGMXCC1_WGMXCCGn1
    SolutionIndex: 88
    SolutionNameMin: Cijk_Alik_Bljk_BBS_BH_UserArgs_MT64x32x128_MI16x16x1_SN_LDSB1_CLR1_GSU0_GSUC0_GSUWGMRR0_K1_LBSPPA256_LBSPPB256_MIWT2_1_PLR2_SU32_SUM0_SUS256_SKXCCM8_VWA1_VWB1_WGM1_WGMXCC1_WGMXCCGn1
    SolutionIndex: 89
    SolutionNameMin: Cijk_Alik_Bljk_BBS_BH_UserArgs_MT64x32x128_MI16x16x1_SN_LDSB1_CLR1_GSU0_GSUC0_GSUWGMRR0_K1_LBSPPA512_LBSPPB256_MIWT2_1_PLR2_SU32_SUM0_SUS256_SKXCCM8_VWA2_VWB1_WGM1_WGMXCC1_WGMXCCGn1
    SolutionIndex: 90
    SolutionNameMin: Cijk_Alik_Bljk_BBS_BH_UserArgs_MT64x32x128_MI16x16x1_SN_LDSB1_CLR1_GSU0_GSUC0_GSUWGMRR0_K1_LBSPPA256_LBSPPB256_MIWT2_1_PLR2_SU32_SUM0_SUS256_SKXCCM8_VWA1_VWB1_WGM8_WGMXCC1_WGMXCCGn1
    SolutionIndex: 91
    SolutionNameMin: Cijk_Alik_Bljk_BBS_BH_UserArgs_MT64x32x128_MI16x16x1_SN_LDSB1_CLR1_GSU0_GSUC0_GSUWGMRR0_K1_LBSPPA512_LBSPPB256_MIWT2_1_PLR2_SU32_SUM0_SUS256_SKXCCM8_VWA2_VWB1_WGM8_WGMXCC1_WGMXCCGn1
    SolutionIndex: 92
    SolutionNameMin: Cijk_Alik_Bljk_BBS_BH_UserArgs_MT32x32x128_MI16x16x1_SN_LDSB1_CLR1_GSU0_GSUC0_GSUWGMRR0_K1_LBSPPA256_LBSPPB256_MIWT1_1_PLR1_SU32_SUM0_SUS256_SKXCCM8_VWA1_VWB1_WGM1_WGMXCC1_WGMXCCGn1
    SolutionIndex: 93
    SolutionNameMin: Cijk_Alik_Bljk_BBS_BH_UserArgs_MT32x32x128_MI16x16x1_SN_LDSB1_CLR1_GSU0_GSUC0_GSUWGMRR0_K1_LBSPPA256_LBSPPB256_MIWT1_1_PLR2_SU32_SUM0_SUS256_SKXCCM8_VWA1_VWB1_WGM1_WGMXCC1_WGMXCCGn1
    SolutionIndex: 94
    SolutionNameMin: Cijk_Alik_Bljk_BBS_BH_UserArgs_MT32x32x128_MI16x16x1_SN_LDSB1_CLR1_GSU0_GSUC0_GSUWGMRR0_K1_LBSPPA256_LBSPPB256_MIWT1_1_PLR1_SU32_SUM0_SUS256_SKXCCM8_VWA1_VWB1_WGM4_WGMXCC1_WGMXCCGn1
    SolutionIndex: 95
    SolutionNameMin: Cijk_Alik_Bljk_BBS_BH_UserArgs_MT32x32x128_MI16x16x1_SN_LDSB1_CLR1_GSU0_GSUC0_GSUWGMRR0_K1_LBSPPA256_LBSPPB256_MIWT1_1_PLR2_SU32_SUM0_SUS256_SKXCCM8_VWA1_VWB1_WGM4_WGMXCC1_WGMXCCGn1
    SolutionIndex: 96
    SolutionNameMin: Cijk_Alik_Bljk_BBS_BH_UserArgs_MT32x32x128_MI16x16x1_SN_LDSB1_CLR1_GSU0_GSUC0_GSUWGMRR0_K1_LBSPPA256_LBSPPB256_MIWT1_1_PLR1_SU32_SUM0_SUS256_SKXCCM8_VWA1_VWB1_WGM8_WGMXCC1_WGMXCCGn1
    SolutionIndex: 97
    SolutionNameMin: Cijk_Alik_Bljk_BBS_BH_UserArgs_MT32x32x128_MI16x16x1_SN_LDSB1_CLR1_GSU0_GSUC0_GSUWGMRR0_K1_LBSPPA256_LBSPPB256_MIWT1_1_PLR2_SU32_SUM0_SUS256_SKXCCM8_VWA1_VWB1_WGM8_WGMXCC1_WGMXCCGn1
    SolutionIndex: 98
    SolutionNameMin: Cijk_Alik_Bljk_BBS_BH_UserArgs_MT32x32x32_MI16x16x1_SN_LDSB0_CLR0_GSU0_GSUC0_GSUWGMRR0_K1_LBSPPA128_LBSPPB128_MIWT1_1_PLR0_SU32_SUM0_SUS256_SKXCCM8_VWA1_VWB1_WGM8_WGMXCC1_WGMXCCGn1
- - - [128, 128, 1, 128, 128, 128, 128, 128]
    - [92, 0.095]
  - - [128, 128, 1, 256, 128, 128, 256, 256]
    - [17, 0.106]
  - - [128, 128, 1, 512, 128, 128, 512, 512]
    - [93, 0.179]
  - - [128, 128, 1, 1024, 128, 128, 1024, 1024]
    - [92, 0.272]
  - - [128, 128, 1, 2048, 128, 128, 2048, 2048]
    - [92, 0.32]
  - - [128, 128, 1, 4096, 128, 128, 4096, 4096]
    - [0, 0.543]
  - - [128, 128, 1, 8192, 128, 128, 8192, 8192]
    - [15, 1.079]
  - - [128, 256, 1, 128, 128, 128, 128, 128]
    - [29, 0.185]
  - - [128, 256, 1, 256, 128, 128, 256, 256]
    - [28, 0.219]
  - - [128, 256, 1, 512, 128, 128, 512, 512]
    - [93, 0.355]
  - - [128, 256, 1, 1024, 128, 128, 1024, 1024]
    - [93, 0.549]
  - - [128, 256, 1, 2048, 128, 128, 2048, 2048]
    - [0, 0.82]
  - - [128, 256, 1, 4096, 128, 128, 4096, 4096]
    - [15, 1.599]
  - - [128, 256, 1, 8192, 128, 128, 8192, 8192]
    - [67, 3.041]
  - - [128, 512, 1, 128, 128, 128, 128, 128]
    - [29, 0.363]
  - - [128, 512, 1, 256, 128, 128, 256, 256]
    - [28, 0.424]
  - - [128, 512, 1, 512, 128, 128, 512, 512]
    - [93, 0.712]
  - - [128, 512, 1, 1024, 128, 128, 1024, 1024]
    - [67, 1.163]
  - - [128, 512, 1, 2048, 128, 128, 2048, 2048]
    - [92, 2.153]
  - - [128, 512, 1, 4096, 128, 128, 4096, 4096]
    - [67, 3.728]
  - - [128, 512, 1, 8192, 128, 128, 8192, 8192]
    - [93, 6.323]
  - - [128, 1024, 1, 128, 128, 128, 128, 128]
    - [28, 0.711]
  - - [128, 1024, 1, 256, 128, 128, 256, 256]
    - [93, 0.807]
  - - [128, 1024, 1, 512, 128, 128, 512, 512]
    - [96, 1.425]
  - - [128, 1024, 1, 1024, 128, 128, 1024, 1024]
    - [93, 2.547]
  - - [128, 1024, 1, 2048, 128, 128, 2048, 2048]
    - [93, 4.364]
  - - [128, 1024, 1, 4096, 128, 128, 4096, 4096]
    - [92, 7.113]
  - - [128, 1024, 1, 8192, 128, 128, 8192, 8192]
    - [89, 9.306]
  - - [128, 2048, 1, 128, 128, 128, 128, 128]
    - [29, 1.377]
  - - [128, 2048, 1, 256, 128, 128, 256, 256]
    - [28, 1.685]
  - - [128, 2048, 1, 512, 128, 128, 512, 512]
    - [29, 2.779]
  - - [128, 2048, 1, 1024, 128, 128, 1024, 1024]
    - [28, 4.69]
  - - [128, 2048, 1, 2048, 128, 128, 2048, 2048]
    - [93, 7.405]
  - - [128, 2048, 1, 4096, 128, 128, 4096, 4096]
    - [65, 10.863]
  - - [128, 2048, 1, 8192, 128, 128, 8192, 8192]
    - [64, 12.868]
  - - [128, 4096, 1, 128, 128, 128, 128, 128]
    - [87, 2.452]
  - - [128, 4096, 1, 256, 128, 128, 256, 256]
    - [25, 3.099]
  - - [128, 4096, 1, 512, 128, 128, 512, 512]
    - [83, 5.049]
  - - [128, 4096, 1, 1024, 128, 128, 1024, 1024]
    - [85, 7.92]
  - - [128, 4096, 1, 2048, 128, 128, 2048, 2048]
    - [88, 11.315]
  - - [128, 4096, 1, 4096, 128, 128, 4096, 4096]
    - [75, 14.18]
  - - [128, 4096, 1, 8192, 128, 128, 8192, 8192]
    - [13, 17.297]
  - - [128, 8192, 1, 128, 128, 128, 128, 128]
    - [18, 4.381]
  - - [128, 8192, 1, 256, 128, 128, 256, 256]
    - [18, 5.212]
  - - [128, 8192, 1, 512, 128, 128, 512, 512]
    - [73, 8.536]
  - - [128, 8192, 1, 1024, 128, 128, 1024, 1024]
    - [71, 12.514]
  - - [128, 8192, 1, 2048, 128, 128, 2048, 2048]
    - [71, 15.38]
  - - [128, 8192, 1, 4096, 128, 128, 4096, 4096]
    - [56, 19.093]
  - - [128, 8192, 1, 8192, 128, 128, 8192, 8192]
    - [7, 22.349]
  - - [256, 128, 1, 128, 256, 256, 128, 128]
    - [93, 0.181]
  - - [256, 128, 1, 256, 256, 256, 256, 256]
    - [28, 0.218]
  - - [256, 128, 1, 512, 256, 256, 512, 512]
    - [92, 0.358]
  - - [256, 128, 1, 1024, 256, 256, 1024, 1024]
    - [96, 0.525]
  - - [256, 128, 1, 2048, 256, 256, 2048, 2048]
    - [0, 0.829]
  - - [256, 128, 1, 4096, 256, 256, 4096, 4096]
    - [16, 1.603]
  - - [256, 128, 1, 8192, 256, 256, 8192, 8192]
    - [67, 2.971]
  - - [256, 256, 1, 128, 256, 256, 128, 128]
    - [28, 0.363]
  - - [256, 256, 1, 256, 256, 256, 256, 256]
    - [28, 0.412]
  - - [256, 256, 1, 512, 256, 256, 512, 512]
    - [93, 0.688]
  - - [256, 256, 1, 1024, 256, 256, 1024, 1024]
    - [67, 1.137]
  - - [256, 256, 1, 2048, 256, 256, 2048, 2048]
    - [93, 2.157]
  - - [256, 256, 1, 4096, 256, 256, 4096, 4096]
    - [28, 3.687]
  - - [256, 256, 1, 8192, 256, 256, 8192, 8192]
    - [95, 6.161]
  - - [256, 512, 1, 128, 256, 256, 128, 128]
    - [29, 0.71]
  - - [256, 512, 1, 256, 256, 256, 256, 256]
    - [92, 0.802]
  - - [256, 512, 1, 512, 256, 256, 512, 512]
    - [28, 1.391]
  - - [256, 512, 1, 1024, 256, 256, 1024, 1024]
    - [93, 2.547]
  - - [256, 512, 1, 2048, 256, 256, 2048, 2048]
    - [28, 4.315]
  - - [256, 512, 1, 4096, 256, 256, 4096, 4096]
    - [92, 7.039]
  - - [256, 512, 1, 8192, 256, 256, 8192, 8192]
    - [94, 9.251]
  - - [256, 1024, 1, 128, 256, 256, 128, 128]
    - [29, 1.379]
  - - [256, 1024, 1, 256, 256, 256, 256, 256]
    - [29, 1.694]
  - - [256, 1024, 1, 512, 256, 256, 512, 512]
    - [93, 2.865]
  - - [256, 1024, 1, 1024, 256, 256, 1024, 1024]
    - [29, 4.652]
  - - [256, 1024, 1, 2048, 256, 256, 2048, 2048]
    - [92, 7.446]
  - - [256, 1024, 1, 4096, 256, 256, 4096, 4096]
    - [85, 10.729]
  - - [256, 1024, 1, 8192, 256, 256, 8192, 8192]
    - [84, 12.88]
  - - [256, 2048, 1, 128, 256, 256, 128, 128]
    - [27, 2.534]
  - - [256, 2048, 1, 256, 256, 256, 256, 256]
    - [27, 3.07]
  - - [256, 2048, 1, 512, 256, 256, 512, 512]
    - [89, 4.928]
  - - [256, 2048, 1, 1024, 256, 256, 1024, 1024]
    - [85, 7.918]
  - - [256, 2048, 1, 2048, 256, 256, 2048, 2048]
    - [85, 11.373]
  - - [256, 2048, 1, 4096, 256, 256, 4096, 4096]
    - [72, 14.59]
  - - [256, 2048, 1, 8192, 256, 256, 8192, 8192]
    - [79, 17.31]
  - - [256, 4096, 1, 128, 256, 256, 128, 128]
    - [71, 4.28]
  - - [256, 4096, 1, 256, 256, 256, 256, 256]
    - [19, 5.238]
  - - [256, 4096, 1, 512, 256, 256, 512, 512]
    - [73, 8.608]
  - - [256, 4096, 1, 1024, 256, 256, 1024, 1024]
    - [71, 12.511]
  - - [256, 4096, 1, 2048, 256, 256, 2048, 2048]
    - [72, 16.073]
  - - [256, 4096, 1, 4096, 256, 256, 4096, 4096]
    - [61, 19.227]
  - - [256, 4096, 1, 8192, 256, 256, 8192, 8192]
    - [46, 21.928]
  - - [256, 8192, 1, 128, 256, 256, 128, 128]
    - [71, 5.389]
  - - [256, 8192, 1, 256, 256, 256, 256, 256]
    - [72, 7.033]
  - - [256, 8192, 1, 512, 256, 256, 512, 512]
    - [55, 11.453]
  - - [256, 8192, 1, 1024, 256, 256, 1024, 1024]
    - [56, 16.352]
  - - [256, 8192, 1, 2048, 256, 256, 2048, 2048]
    - [53, 19.669]
  - - [256, 8192, 1, 4096, 256, 256, 4096, 4096]
    - [43, 24.327]
  - - [256, 8192, 1, 8192, 256, 256, 8192, 8192]
    - [46, 26.459]
  - - [512, 128, 1, 128, 512, 512, 128, 128]
    - [29, 0.35]
  - - [512, 128, 1, 256, 512, 512, 256, 256]
    - [93, 0.419]
  - - [512, 128, 1, 512, 512, 512, 512, 512]
    - [92, 0.7]
  - - [512, 128, 1, 1024, 512, 512, 1024, 1024]
    - [67, 1.133]
  - - [512, 128, 1, 2048, 512, 512, 2048, 2048]
    - [93, 2.196]
  - - [512, 128, 1, 4096, 512, 512, 4096, 4096]
    - [67, 3.852]
  - - [512, 128, 1, 8192, 512, 512, 8192, 8192]
    - [69, 6.144]
  - - [512, 256, 1, 128, 512, 512, 128, 128]
    - [29, 0.693]
  - - [512, 256, 1, 256, 512, 512, 256, 256]
    - [92, 0.799]
  - - [512, 256, 1, 512, 512, 512, 512, 512]
    - [92, 1.457]
  - - [512, 256, 1, 1024, 512, 512, 1024, 1024]
    - [92, 2.531]
  - - [512, 256, 1, 2048, 512, 512, 2048, 2048]
    - [92, 4.32]
  - - [512, 256, 1, 4096, 512, 512, 4096, 4096]
    - [97, 6.89]
  - - [512, 256, 1, 8192, 512, 512, 8192, 8192]
    - [95, 9.076]
  - - [512, 512, 1, 128, 512, 512, 128, 128]
    - [92, 1.346]
  - - [512, 512, 1, 256, 512, 512, 256, 256]
    - [29, 1.691]
  - - [512, 512, 1, 512, 512, 512, 512, 512]
    - [92, 2.813]
  - - [512, 512, 1, 1024, 512, 512, 1024, 1024]
    - [28, 4.638]
  - - [512, 512, 1, 2048, 512, 512, 2048, 2048]
    - [93, 7.376]
  - - [512, 512, 1, 4096, 512, 512, 4096, 4096]
    - [90, 10.548]
  - - [512, 512, 1, 8192, 512, 512, 8192, 8192]
    - [62, 12.826]
  - - [512, 1024, 1, 128, 512, 512, 128, 128]
    - [27, 2.481]
  - - [512, 1024, 1, 256, 512, 512, 256, 256]
    - [27, 3.074]
  - - [512, 1024, 1, 512, 512, 512, 512, 512]
    - [89, 4.994]
  - - [512, 1024, 1, 1024, 512, 512, 1024, 1024]
    - [89, 7.921]
  - - [512, 1024, 1, 2048, 512, 512, 2048, 2048]
    - [89, 11.325]
  - - [512, 1024, 1, 4096, 512, 512, 4096, 4096]
    - [64, 14.38]
  - - [512, 1024, 1, 8192, 512, 512, 8192, 8192]
    - [71, 17.613]
  - - [512, 2048, 1, 128, 512, 512, 128, 128]
    - [19, 4.319]
  - - [512, 2048, 1, 256, 512, 512, 256, 256]
    - [18, 5.267]
  - - [512, 2048, 1, 512, 512, 512, 512, 512]
    - [71, 8.386]
  - - [512, 2048, 1, 1024, 512, 512, 1024, 1024]
    - [73, 12.492]
  - - [512, 2048, 1, 2048, 512, 512, 2048, 2048]
    - [71, 15.976]
  - - [512, 2048, 1, 4096, 512, 512, 4096, 4096]
    - [61, 19.048]
  - - [512, 2048, 1, 8192, 512, 512, 8192, 8192]
    - [31, 22.023]
  - - [512, 4096, 1, 128, 512, 512, 128, 128]
    - [71, 5.354]
  - - [512, 4096, 1, 256, 512, 512, 256, 256]
    - [71, 7.034]
  - - [512, 4096, 1, 512, 512, 512, 512, 512]
    - [47, 11.288]
  - - [512, 4096, 1, 1024, 512, 512, 1024, 1024]
    - [54, 16.507]
  - - [512, 4096, 1, 2048, 512, 512, 2048, 2048]
    - [49, 19.716]
  - - [512, 4096, 1, 4096, 512, 512, 4096, 4096]
    - [42, 24.265]
  - - [512, 4096, 1, 8192, 512, 512, 8192, 8192]
    - [41, 26.927]
  - - [512, 8192, 1, 128, 512, 512, 128, 128]
    - [11, 6.548]
  - - [512, 8192, 1, 256, 512, 512, 256, 256]
    - [57, 9.037]
  - - [512, 8192, 1, 512, 512, 512, 512, 512]
    - [56, 14.814]
  - - [512, 8192, 1, 1024, 512, 512, 1024, 1024]
    - [54, 19.22]
  - - [512, 8192, 1, 2048, 512, 512, 2048, 2048]
    - [46, 24.016]
  - - [512, 8192, 1, 4096, 512, 512, 4096, 4096]
    - [43, 28.186]
  - - [512, 8192, 1, 8192, 512, 512, 8192, 8192]
    - [1, 26.214]
  - - [1024, 128, 1, 128, 1024, 1024, 128, 128]
    - [28, 0.696]
  - - [1024, 128, 1, 256, 1024, 1024, 256, 256]
    - [92, 0.807]
  - - [1024, 128, 1, 512, 1024, 1024, 512, 512]
    - [93, 1.433]
  - - [1024, 128, 1, 1024, 1024, 1024, 1024, 1024]
    - [15, 2.437]
  - - [1024, 128, 1, 2048, 1024, 1024, 2048, 2048]
    - [28, 4.267]
  - - [1024, 128, 1, 4096, 1024, 1024, 4096, 4096]
    - [68, 6.611]
  - - [1024, 128, 1, 8192, 1024, 1024, 8192, 8192]
    - [95, 9.21]
  - - [1024, 256, 1, 128, 1024, 1024, 128, 128]
    - [93, 1.328]
  - - [1024, 256, 1, 256, 1024, 1024, 256, 256]
    - [28, 1.676]
  - - [1024, 256, 1, 512, 1024, 1024, 512, 512]
    - [93, 2.836]
  - - [1024, 256, 1, 1024, 1024, 1024, 1024, 1024]
    - [28, 4.61]
  - - [1024, 256, 1, 2048, 1024, 1024, 2048, 2048]
    - [65, 7.321]
  - - [1024, 256, 1, 4096, 1024, 1024, 4096, 4096]
    - [66, 10.591]
  - - [1024, 256, 1, 8192, 1024, 1024, 8192, 8192]
    - [91, 12.75]
  - - [1024, 512, 1, 128, 1024, 1024, 128, 128]
    - [23, 2.452]
  - - [1024, 512, 1, 256, 1024, 1024, 256, 256]
    - [27, 3.042]
  - - [1024, 512, 1, 512, 1024, 1024, 512, 512]
    - [89, 4.962]
  - - [1024, 512, 1, 1024, 1024, 1024, 1024, 1024]
    - [65, 7.887]
  - - [1024, 512, 1, 2048, 1024, 1024, 2048, 2048]
    - [91, 11.151]
  - - [1024, 512, 1, 4096, 1024, 1024, 4096, 4096]
    - [77, 14.268]
  - - [1024, 512, 1, 8192, 1024, 1024, 8192, 8192]
    - [82, 17.299]
  - - [1024, 1024, 1, 128, 1024, 1024, 128, 128]
    - [20, 4.286]
  - - [1024, 1024, 1, 256, 1024, 1024, 256, 256]
    - [19, 5.306]
  - - [1024, 1024, 1, 512, 1024, 1024, 512, 512]
    - [71, 8.515]
  - - [1024, 1024, 1, 1024, 1024, 1024, 1024, 1024]
    - [73, 12.201]
  - - [1024, 1024, 1, 2048, 1024, 1024, 2048, 2048]
    - [80, 15.881]
  - - [1024, 1024, 1, 4096, 1024, 1024, 4096, 4096]
    - [61, 19.127]
  - - [1024, 1024, 1, 8192, 1024, 1024, 8192, 8192]
    - [35, 21.954]
  - - [1024, 2048, 1, 128, 1024, 1024, 128, 128]
    - [18, 5.38]
  - - [1024, 2048, 1, 256, 1024, 1024, 256, 256]
    - [71, 6.999]
  - - [1024, 2048, 1, 512, 1024, 1024, 512, 512]
    - [55, 11.438]
  - - [1024, 2048, 1, 1024, 1024, 1024, 1024, 1024]
    - [60, 16.008]
  - - [1024, 2048, 1, 2048, 1024, 1024, 2048, 2048]
    - [47, 19.728]
  - - [1024, 2048, 1, 4096, 1024, 1024, 4096, 4096]
    - [46, 24.079]
  - - [1024, 2048, 1, 8192, 1024, 1024, 8192, 8192]
    - [42, 27.003]
  - - [1024, 4096, 1, 128, 1024, 1024, 128, 128]
    - [10, 6.688]
  - - [1024, 4096, 1, 256, 1024, 1024, 256, 256]
    - [12, 8.935]
  - - [1024, 4096, 1, 512, 1024, 1024, 512, 512]
    - [56, 14.764]
  - - [1024, 4096, 1, 1024, 1024, 1024, 1024, 1024]
    - [56, 19.274]
  - - [1024, 4096, 1, 2048, 1024, 1024, 2048, 2048]
    - [46, 24.063]
  - - [1024, 4096, 1, 4096, 1024, 1024, 4096, 4096]
    - [33, 28.439]
  - - [1024, 4096, 1, 8192, 1024, 1024, 8192, 8192]
    - [35, 26.545]
  - - [1024, 8192, 1, 128, 1024, 1024, 128, 128]
    - [8, 8.268]
  - - [1024, 8192, 1, 256, 1024, 1024, 256, 256]
    - [31, 12.509]
  - - [1024, 8192, 1, 512, 1024, 1024, 512, 512]
    - [31, 18.435]
  - - [1024, 8192, 1, 1024, 1024, 1024, 1024, 1024]
    - [31, 23.335]
  - - [1024, 8192, 1, 2048, 1024, 1024, 2048, 2048]
    - [35, 28.646]
  - - [1024, 8192, 1, 4096, 1024, 1024, 4096, 4096]
    - [30, 29.062]
  - - [1024, 8192, 1, 8192, 1024, 1024, 8192, 8192]
    - [31, 29.268]
  - - [2048, 128, 1, 128, 2048, 2048, 128, 128]
    - [29, 1.36]
  - - [2048, 128, 1, 256, 2048, 2048, 256, 256]
    - [29, 1.683]
  - - [2048, 128, 1, 512, 2048, 2048, 512, 512]
    - [93, 2.806]
  - - [2048, 128, 1, 1024, 2048, 2048, 1024, 1024]
    - [29, 4.641]
  - - [2048, 128, 1, 2048, 2048, 2048, 2048, 2048]
    - [65, 7.331]
  - - [2048, 128, 1, 4096, 2048, 2048, 4096, 4096]
    - [86, 10.661]
  - - [2048, 128, 1, 8192, 2048, 2048, 8192, 8192]
    - [70, 12.217]
  - - [2048, 256, 1, 128, 2048, 2048, 128, 128]
    - [26, 2.503]
  - - [2048, 256, 1, 256, 2048, 2048, 256, 256]
    - [26, 3.064]
  - - [2048, 256, 1, 512, 2048, 2048, 512, 512]
    - [83, 4.938]
  - - [2048, 256, 1, 1024, 2048, 2048, 1024, 1024]
    - [85, 7.783]
  - - [2048, 256, 1, 2048, 2048, 2048, 2048, 2048]
    - [90, 11.176]
  - - [2048, 256, 1, 4096, 2048, 2048, 4096, 4096]
    - [77, 14.435]
  - - [2048, 256, 1, 8192, 2048, 2048, 8192, 8192]
    - [47, 16.613]
  - - [2048, 512, 1, 128, 2048, 2048, 128, 128]
    - [21, 4.281]
  - - [2048, 512, 1, 256, 2048, 2048, 256, 256]
    - [19, 5.286]
  - - [2048, 512, 1, 512, 2048, 2048, 512, 512]
    - [74, 8.37]
  - - [2048, 512, 1, 1024, 2048, 2048, 1024, 1024]
    - [76, 12.183]
  - - [2048, 512, 1, 2048, 2048, 2048, 2048, 2048]
    - [81, 15.903]
  - - [2048, 512, 1, 4096, 2048, 2048, 4096, 4096]
    - [60, 18.855]
  - - [2048, 512, 1, 8192, 2048, 2048, 8192, 8192]
    - [42, 21.893]
  - - [2048, 1024, 1, 128, 2048, 2048, 128, 128]
    - [18, 5.452]
  - - [2048, 1024, 1, 256, 2048, 2048, 256, 256]
    - [18, 6.968]
  - - [2048, 1024, 1, 512, 2048, 2048, 512, 512]
    - [56, 11.476]
  - - [2048, 1024, 1, 1024, 2048, 2048, 1024, 1024]
    - [60, 16.042]
  - - [2048, 1024, 1, 2048, 2048, 2048, 2048, 2048]
    - [60, 19.672]
  - - [2048, 1024, 1, 4096, 2048, 2048, 4096, 4096]
    - [43, 23.912]
  - - [2048, 1024, 1, 8192, 2048, 2048, 8192, 8192]
    - [33, 27.046]
  - - [2048, 2048, 1, 128, 2048, 2048, 128, 128]
    - [11, 6.624]
  - - [2048, 2048, 1, 256, 2048, 2048, 256, 256]
    - [14, 9.062]
  - - [2048, 2048, 1, 512, 2048, 2048, 512, 512]
    - [54, 14.914]
  - - [2048, 2048, 1, 1024, 2048, 2048, 1024, 1024]
    - [46, 19.077]
  - - [2048, 2048, 1, 2048, 2048, 2048, 2048, 2048]
    - [33, 24.794]
  - - [2048, 2048, 1, 4096, 2048, 2048, 4096, 4096]
    - [34, 29.952]
  - - [2048, 2048, 1, 8192, 2048, 2048, 8192, 8192]
    - [33, 29.57]
  - - [2048, 4096, 1, 128, 2048, 2048, 128, 128]
    - [10, 8.311]
  - - [2048, 4096, 1, 256, 2048, 2048, 256, 256]
    - [33, 12.435]
  - - [2048, 4096, 1, 512, 2048, 2048, 512, 512]
    - [42, 17.713]
  - - [2048, 4096, 1, 1024, 2048, 2048, 1024, 1024]
    - [43, 23.302]
  - - [2048, 4096, 1, 2048, 2048, 2048, 2048, 2048]
    - [39, 28.213]
  - - [2048, 4096, 1, 4096, 2048, 2048, 4096, 4096]
    - [42, 29.272]
  - - [2048, 4096, 1, 8192, 2048, 2048, 8192, 8192]
    - [31, 29.689]
  - - [2048, 8192, 1, 128, 2048, 2048, 128, 128]
    - [3, 9.714]
  - - [2048, 8192, 1, 256, 2048, 2048, 256, 256]
    - [31, 15.121]
  - - [2048, 8192, 1, 512, 2048, 2048, 512, 512]
    - [38, 20.514]
  - - [2048, 8192, 1, 1024, 2048, 2048, 1024, 1024]
    - [8, 26.268]
  - - [2048, 8192, 1, 2048, 2048, 2048, 2048, 2048]
    - [6, 29.448]
  - - [2048, 8192, 1, 4096, 2048, 2048, 4096, 4096]
    - [45, 32.43]
  - - [2048, 8192, 1, 8192, 2048, 2048, 8192, 8192]
    - [44, 35.778]
  - - [4096, 128, 1, 128, 4096, 4096, 128, 128]
    - [26, 2.514]
  - - [4096, 128, 1, 256, 4096, 4096, 256, 256]
    - [26, 3.067]
  - - [4096, 128, 1, 512, 4096, 4096, 512, 512]
    - [87, 5.005]
  - - [4096, 128, 1, 1024, 4096, 4096, 1024, 1024]
    - [24, 7.823]
  - - [4096, 128, 1, 2048, 4096, 4096, 2048, 2048]
    - [63, 11.128]
  - - [4096, 128, 1, 4096, 4096, 4096, 4096, 4096]
    - [77, 14.017]
  - - [4096, 128, 1, 8192, 4096, 4096, 8192, 8192]
    - [47, 16.653]
  - - [4096, 256, 1, 128, 4096, 4096, 128, 128]
    - [18, 4.271]
  - - [4096, 256, 1, 256, 4096, 4096, 256, 256]
    - [22, 5.182]
  - - [4096, 256, 1, 512, 4096, 4096, 512, 512]
    - [71, 8.569]
  - - [4096, 256, 1, 1024, 4096, 4096, 1024, 1024]
    - [80, 12.274]
  - - [4096, 256, 1, 2048, 4096, 4096, 2048, 2048]
    - [78, 15.963]
  - - [4096, 256, 1, 4096, 4096, 4096, 4096, 4096]
    - [48, 18.442]
  - - [4096, 256, 1, 8192, 4096, 4096, 8192, 8192]
    - [35, 21.943]
  - - [4096, 512, 1, 128, 4096, 4096, 128, 128]
    - [18, 5.411]
  - - [4096, 512, 1, 256, 4096, 4096, 256, 256]
    - [72, 6.959]
  - - [4096, 512, 1, 512, 4096, 4096, 512, 512]
    - [59, 11.185]
  - - [4096, 512, 1, 1024, 4096, 4096, 1024, 1024]
    - [60, 16.032]
  - - [4096, 512, 1, 2048, 4096, 4096, 2048, 2048]
    - [60, 19.968]
  - - [4096, 512, 1, 4096, 4096, 4096, 4096, 4096]
    - [33, 23.466]
  - - [4096, 512, 1, 8192, 4096, 4096, 8192, 8192]
    - [31, 27.037]
  - - [4096, 1024, 1, 128, 4096, 4096, 128, 128]
    - [9, 6.503]
  - - [4096, 1024, 1, 256, 4096, 4096, 256, 256]
    - [57, 9.243]
  - - [4096, 1024, 1, 512, 4096, 4096, 512, 512]
    - [60, 14.281]
  - - [4096, 1024, 1, 1024, 4096, 4096, 1024, 1024]
    - [37, 19.042]
  - - [4096, 1024, 1, 2048, 4096, 4096, 2048, 2048]
    - [46, 24.505]
  - - [4096, 1024, 1, 4096, 4096, 4096, 4096, 4096]
    - [30, 28.722]
  - - [4096, 1024, 1, 8192, 4096, 4096, 8192, 8192]
    - [32, 27.466]
  - - [4096, 2048, 1, 128, 4096, 4096, 128, 128]
    - [8, 8.252]
  - - [4096, 2048, 1, 256, 4096, 4096, 256, 256]
    - [37, 12.196]
  - - [4096, 2048, 1, 512, 4096, 4096, 512, 512]
    - [42, 18.001]
  - - [4096, 2048, 1, 1024, 4096, 4096, 1024, 1024]
    - [37, 23.187]
  - - [4096, 2048, 1, 2048, 4096, 4096, 2048, 2048]
    - [36, 28.2]
  - - [4096, 2048, 1, 4096, 4096, 4096, 4096, 4096]
    - [34, 29.451]
  - - [4096, 2048, 1, 8192, 4096, 4096, 8192, 8192]
    - [4, 29.993]
  - - [4096, 4096, 1, 128, 4096, 4096, 128, 128]
    - [33, 9.78]
  - - [4096, 4096, 1, 256, 4096, 4096, 256, 256]
    - [3, 14.789]
  - - [4096, 4096, 1, 512, 4096, 4096, 512, 512]
    - [37, 20.285]
  - - [4096, 4096, 1, 1024, 4096, 4096, 1024, 1024]
    - [2, 26.724]
  - - [4096, 4096, 1, 2048, 4096, 4096, 2048, 2048]
    - [7, 29.782]
  - - [4096, 4096, 1, 4096, 4096, 4096, 4096, 4096]
    - [4, 32.654]
  - - [4096, 4096, 1, 8192, 4096, 4096, 8192, 8192]
    - [41, 36.073]
  - - [4096, 8192, 1, 128, 4096, 4096, 128, 128]
    - [10, 11.724]
  - - [4096, 8192, 1, 256, 4096, 4096, 256, 256]
    - [42, 17.13]
  - - [4096, 8192, 1, 512, 4096, 4096, 512, 512]
    - [2, 22.938]
  - - [4096, 8192, 1, 1024, 4096, 4096, 1024, 1024]
    - [3, 27.841]
  - - [4096, 8192, 1, 2048, 4096, 4096, 2048, 2048]
    - [3, 30.909]
  - - [4096, 8192, 1, 4096, 4096, 4096, 4096, 4096]
    - [41, 35.13]
  - - [4096, 8192, 1, 8192, 4096, 4096, 8192, 8192]
    - [41, 36.081]
  - - [8192, 128, 1, 128, 8192, 8192, 128, 128]
    - [20, 4.277]
  - - [8192, 128, 1, 256, 8192, 8192, 256, 256]
    - [18, 5.244]
  - - [8192, 128, 1, 512, 8192, 8192, 512, 512]
    - [72, 8.392]
  - - [8192, 128, 1, 1024, 8192, 8192, 1024, 1024]
    - [76, 12.14]
  - - [8192, 128, 1, 2048, 8192, 8192, 2048, 2048]
    - [80, 15.119]
  - - [8192, 128, 1, 4096, 8192, 8192, 4096, 4096]
    - [51, 18.233]
  - - [8192, 128, 1, 8192, 8192, 8192, 8192, 8192]
    - [3, 22.19]
  - - [8192, 256, 1, 128, 8192, 8192, 128, 128]
    - [72, 5.327]
  - - [8192, 256, 1, 256, 8192, 8192, 256, 256]
    - [72, 6.925]
  - - [8192, 256, 1, 512, 8192, 8192, 512, 512]
    - [52, 11.149]
  - - [8192, 256, 1, 1024, 8192, 8192, 1024, 1024]
    - [58, 15.509]
  - - [8192, 256, 1, 2048, 8192, 8192, 2048, 2048]
    - [50, 19.601]
  - - [8192, 256, 1, 4096, 8192, 8192, 4096, 4096]
    - [31, 23.49]
  - - [8192, 256, 1, 8192, 8192, 8192, 8192, 8192]
    - [33, 26.945]
  - - [8192, 512, 1, 128, 8192, 8192, 128, 128]
    - [1, 6.444]
  - - [8192, 512, 1, 256, 8192, 8192, 256, 256]
    - [60, 8.864]
  - - [8192, 512, 1, 512, 8192, 8192, 512, 512]
    - [61, 14.324]
  - - [8192, 512, 1, 1024, 8192, 8192, 1024, 1024]
    - [42, 18.899]
  - - [8192, 512, 1, 2048, 8192, 8192, 2048, 2048]
    - [37, 23.059]
  - - [8192, 512, 1, 4096, 8192, 8192, 4096, 4096]
    - [35, 28.956]
  - - [8192, 512, 1, 8192, 8192, 8192, 8192, 8192]
    - [31, 27.798]
  - - [8192, 1024, 1, 128, 8192, 8192, 128, 128]
    - [8, 8.088]
  - - [8192, 1024, 1, 256, 8192, 8192, 256, 256]
    - [43, 12.306]
  - - [8192, 1024, 1, 512, 8192, 8192, 512, 512]
    - [42, 18.041]
  - - [8192, 1024, 1, 1024, 8192, 8192, 1024, 1024]
    - [42, 23.568]
  - - [8192, 1024, 1, 2048, 8192, 8192, 2048, 2048]
    - [46, 28.433]
  - - [8192, 1024, 1, 4096, 8192, 8192, 4096, 4096]
    - [4, 29.599]
  - - [8192, 1024, 1, 8192, 8192, 8192, 8192, 8192]
    - [2, 30.624]
  - - [8192, 2048, 1, 128, 8192, 8192, 128, 128]
    - [3, 9.513]
  - - [8192, 2048, 1, 256, 8192, 8192, 256, 256]
    - [3, 14.52]
  - - [8192, 2048, 1, 512, 8192, 8192, 512, 512]
    - [37, 20.356]
  - - [8192, 2048, 1, 1024, 8192, 8192, 1024, 1024]
    - [42, 26.567]
  - - [8192, 2048, 1, 2048, 8192, 8192, 2048, 2048]
    - [42, 29.262]
  - - [8192, 2048, 1, 4096, 8192, 8192, 4096, 4096]
    - [43, 32.627]
  - - [8192, 2048, 1, 8192, 8192, 8192, 8192, 8192]
    - [36, 36.224]
  - - [8192, 4096, 1, 128, 8192, 8192, 128, 128]
    - [5, 11.516]
  - - [8192, 4096, 1, 256, 8192, 8192, 256, 256]
    - [42, 16.974]
  - - [8192, 4096, 1, 512, 8192, 8192, 512, 512]
    - [2, 22.726]
  - - [8192, 4096, 1, 1024, 8192, 8192, 1024, 1024]
    - [3, 28.052]
  - - [8192, 4096, 1, 2048, 8192, 8192, 2048, 2048]
    - [42, 30.854]
  - - [8192, 4096, 1, 4096, 8192, 8192, 4096, 4096]
    - [43, 35.312]
  - - [8192, 4096, 1, 8192, 8192, 8192, 8192, 8192]
    - [41, 36.433]
  - - [8192, 8192, 1, 128, 8192, 8192, 128, 128]
    - [5, 11.144]
  - - [8192, 8192, 1, 256, 8192, 8192, 256, 256]
    - [3, 16.29]
  - - [8192, 8192, 1, 512, 8192, 8192, 512, 512]
    - [3, 22.623]
  - - [8192, 8192, 1, 1024, 8192, 8192, 1024, 1024]
    - [2, 28.744]
  - - [8192, 8192, 1, 2048, 8192, 8192, 2048, 2048]
    - [40, 31.28]
  - - [8192, 8192, 1, 4096, 8192, 8192, 4096, 4096]
    - [43, 36.011]
  - - [8192, 8192, 1, 8192, 8192, 8192, 8192, 8192]
    - [41, 37.719]
  - - [1, 1, 1, 32, 1, 1, 32, 32]
    - [98, 0.0]
- null
- null
- DeviceEfficiency
- GridBased
