library/src/amd_detail/rocblaslt/src/Tensile/Logic/streamk/gfx942/aquavanjaram942_Cijk_Ailk_Bljk_BBS_BH_UserArgs.yaml
- {MinimumRequiredVersion: 4.33.0}
- aquavanjaram942
- gfx942
- [Device 0049, Device 0050]
    SolutionIndex: 0
    SolutionNameMin: Cijk_Ailk_Bljk_BBS_BH_UserArgs_MT128x128x64_MI16x16x1_SN_LDSB1_CLR1_GRVWA8_GRVWB8_GSU0_GSUC0_GSUWGMRR0_K1_LBSPPA2048_LBSPPB512_LPA0_LPB16_LRVW8_MIWT4_4_NEPBS0_PLR1_SU32_SUM0_SUS256_SVW4_SKXCCM0_ULSGRO0_VWA4_VWB4_WGM1_WGMXCC1_WGMXCCGn1
    SolutionIndex: 1
    SolutionNameMin: Cijk_Ailk_Bljk_BBS_BH_UserArgs_MT128x128x64_MI16x16x1_SN_LDSB1_CLR1_GRVWA8_GRVWB8_GSU0_GSUC0_GSUWGMRR0_K1_LBSPPA2048_LBSPPB128_LPA0_LPB16_LRVW8_MIWT4_4_NEPBS0_PLR1_SU32_SUM0_SUS256_SVW4_SKXCCM0_ULSGRO1_VWA4_VWB1_WGM1_WGMXCC1_WGMXCCGn1
    SolutionIndex: 2
    SolutionNameMin: Cijk_Ailk_Bljk_BBS_BH_UserArgs_MT32x32x64_MI16x16x1_SN_LDSB0_CLR1_GRVWA8_GRVWB8_GSU0_GSUC0_GSUWGMRR0_K1_LBSPPA512_LBSPPB128_LPA16_LPB16_LRVW8_MIWT1_1_NEPBS0_PLR1_SU32_SUM0_SUS256_SVW1_SKXCCM0_ULSGRO1_VWA1_VWB1_WGM1_WGMXCC1_WGMXCCGn1
    SolutionIndex: 3
    SolutionNameMin: Cijk_Ailk_Bljk_BBS_BH_UserArgs_MT64x64x128_MI16x16x1_SN_LDSB1_CLR1_GRVWA8_GRVWB8_GSU0_GSUC0_GSUWGMRR0_K1_LBSPPA1024_LBSPPB512_LPA32_LPB16_LRVW8_MIWT2_2_NEPBS0_PLR2_SU32_SUM0_SUS256_SVW2_SKXCCM0_ULSGRO1_VWA2_VWB2_WGM1_WGMXCC1_WGMXCCGn1
    SolutionIndex: 4
    SolutionNameMin: Cijk_Ailk_Bljk_BBS_BH_UserArgs_MT64x32x128_MI16x16x1_SN_LDSB1_CLR1_GRVWA8_GRVWB8_GSU0_GSUC0_GSUWGMRR0_K1_LBSPPA1024_LBSPPB256_LPA32_LPB16_LRVW8_MIWT2_1_NEPBS0_PLR2_SU32_SUM0_SUS256_SVW2_SKXCCM0_ULSGRO0_VWA2_VWB1_WGM1_WGMXCC1_WGMXCCGn1
    SolutionIndex: 5
    SolutionNameMin: Cijk_Ailk_Bljk_BBS_BH_UserArgs_MT64x32x128_MI16x16x1_SN_LDSB1_CLR1_GRVWA8_GRVWB8_GSU0_GSUC0_GSUWGMRR0_K1_LBSPPA1024_LBSPPB256_LPA32_LPB16_LRVW8_MIWT2_1_NEPBS0_PLR2_SU32_SUM0_SUS256_SVW2_SKXCCM0_ULSGRO1_VWA2_VWB1_WGM1_WGMXCC1_WGMXCCGn1
    SolutionIndex: 6
    SolutionNameMin: Cijk_Ailk_Bljk_BBS_BH_UserArgs_MT32x32x128_MI16x16x1_SN_LDSB1_CLR1_GRVWA8_GRVWB8_GSU0_GSUC0_GSUWGMRR0_K1_LBSPPA512_LBSPPB256_LPA16_LPB16_LRVW8_MIWT1_1_NEPBS0_PLR1_SU32_SUM0_SUS256_SVW1_SKXCCM0_ULSGRO0_VWA1_VWB1_WGM1_WGMXCC1_WGMXCCGn1
    SolutionIndex: 7
    SolutionNameMin: Cijk_Ailk_Bljk_BBS_BH_UserArgs_MT32x32x128_MI16x16x1_SN_LDSB1_CLR1_GRVWA8_GRVWB8_GSU0_GSUC0_GSUWGMRR0_K1_LBSPPA512_LBSPPB256_LPA16_LPB16_LRVW8_MIWT1_1_NEPBS0_PLR1_SU32_SUM0_SUS256_SVW1_SKXCCM0_ULSGRO1_VWA1_VWB1_WGM1_WGMXCC1_WGMXCCGn1
    SolutionIndex: 8
    SolutionNameMin: Cijk_Ailk_Bljk_BBS_BH_UserArgs_MT32x32x128_MI16x16x1_SN_LDSB1_CLR1_GRVWA8_GRVWB8_GSU0_GSUC0_GSUWGMRR0_K1_LBSPPA512_LBSPPB256_LPA16_LPB16_LRVW8_MIWT1_1_NEPBS0_PLR2_SU32_SUM0_SUS256_SVW1_SKXCCM0_ULSGRO0_VWA1_VWB1_WGM1_WGMXCC1_WGMXCCGn1
    SolutionIndex: 9
    SolutionNameMin: Cijk_Ailk_Bljk_BBS_BH_UserArgs_MT32x32x128_MI16x16x1_SN_LDSB1_CLR1_GRVWA8_GRVWB8_GSU0_GSUC0_GSUWGMRR0_K1_LBSPPA512_LBSPPB256_LPA16_LPB16_LRVW8_MIWT1_1_NEPBS0_PLR2_SU32_SUM0_SUS256_SVW1_SKXCCM0_ULSGRO1_VWA1_VWB1_WGM1_WGMXCC1_WGMXCCGn1
    SolutionIndex: 10
    SolutionNameMin: Cijk_Ailk_Bljk_BBS_BH_UserArgs_MT32x32x128_MI16x16x1_SN_LDSB1_CLR1_GRVWA8_GRVWB8_GSU0_GSUC0_GSUWGMRR0_K1_LBSPPA512_LBSPPB256_LPA16_LPB16_LRVW8_MIWT1_1_NEPBS0_PLR3_SU32_SUM0_SUS256_SVW1_SKXCCM0_ULSGRO1_VWA1_VWB1_WGM1_WGMXCC1_WGMXCCGn1
    SolutionIndex: 11
    SolutionNameMin: Cijk_Ailk_Bljk_BBS_BH_UserArgs_MT128x64x64_MI16x16x1_SN_LDSB1_CLR1_GRVWA8_GRVWB8_GSU0_GSUC0_GSUWGMRR0_K1_LBSPPA2048_LBSPPB128_LPA0_LPB16_LRVW8_MIWT4_2_NEPBS16_PLR1_SU32_SUM0_SUS256_SVW4_SKXCCM0_ULSGRO0_VWA4_VWB1_WGM4_WGMXCC1_WGMXCCGn1
    SolutionIndex: 12
    SolutionNameMin: Cijk_Ailk_Bljk_BBS_BH_UserArgs_MT32x32x64_MI16x16x1_SN_LDSB0_CLR1_GRVWA8_GRVWB8_GSU0_GSUC0_GSUWGMRR0_K1_LBSPPA512_LBSPPB128_LPA16_LPB16_LRVW8_MIWT1_1_NEPBS16_PLR1_SU32_SUM0_SUS256_SVW1_SKXCCM0_ULSGRO1_VWA1_VWB1_WGM1_WGMXCC1_WGMXCCGn1
    SolutionIndex: 13
    SolutionNameMin: Cijk_Ailk_Bljk_BBS_BH_UserArgs_MT64x128x128_MI16x16x1_SN_LDSB1_CLR1_GRVWA8_GRVWB8_GSU0_GSUC0_GSUWGMRR0_K1_LBSPPA1024_LBSPPB512_LPA32_LPB16_LRVW8_MIWT2_4_NEPBS16_PLR1_SU32_SUM0_SUS256_SVW2_SKXCCM0_ULSGRO0_VWA2_VWB2_WGM1_WGMXCC1_WGMXCCGn1
    SolutionIndex: 14
    SolutionNameMin: Cijk_Ailk_Bljk_BBS_BH_UserArgs_MT128x64x128_MI16x16x1_SN_LDSB1_CLR1_GRVWA8_GRVWB8_GSU0_GSUC0_GSUWGMRR0_K1_LBSPPA2048_LBSPPB512_LPA0_LPB16_LRVW8_MIWT4_2_NEPBS16_PLR3_SU32_SUM0_SUS256_SVW4_SKXCCM0_ULSGRO0_VWA4_VWB2_WGM1_WGMXCC1_WGMXCCGn1
    SolutionIndex: 15
    SolutionNameMin: Cijk_Ailk_Bljk_BBS_BH_UserArgs_MT64x64x128_MI16x16x1_SN_LDSB1_CLR1_GRVWA8_GRVWB8_GSU0_GSUC0_GSUWGMRR0_K1_LBSPPA1024_LBSPPB512_LPA32_LPB16_LRVW8_MIWT2_2_NEPBS16_PLR2_SU32_SUM0_SUS256_SVW2_SKXCCM0_ULSGRO1_VWA2_VWB2_WGM1_WGMXCC1_WGMXCCGn1
    SolutionIndex: 16
    SolutionNameMin: Cijk_Ailk_Bljk_BBS_BH_UserArgs_MT64x64x128_MI16x16x1_SN_LDSB1_CLR1_GRVWA8_GRVWB8_GSU0_GSUC0_GSUWGMRR0_K1_LBSPPA1024_LBSPPB512_LPA32_LPB16_LRVW8_MIWT2_2_NEPBS16_PLR2_SU32_SUM0_SUS256_SVW2_SKXCCM0_ULSGRO0_VWA2_VWB2_WGM4_WGMXCC1_WGMXCCGn1
    SolutionIndex: 17
    SolutionNameMin: Cijk_Ailk_Bljk_BBS_BH_UserArgs_MT64x32x128_MI16x16x1_SN_LDSB1_CLR1_GRVWA8_GRVWB8_GSU0_GSUC0_GSUWGMRR0_K1_LBSPPA1024_LBSPPB256_LPA32_LPB16_LRVW8_MIWT2_1_NEPBS16_PLR2_SU32_SUM0_SUS256_SVW2_SKXCCM0_ULSGRO1_VWA2_VWB1_WGM1_WGMXCC1_WGMXCCGn1
    SolutionIndex: 18
    SolutionNameMin: Cijk_Ailk_Bljk_BBS_BH_UserArgs_MT32x32x128_MI16x16x1_SN_LDSB1_CLR1_GRVWA8_GRVWB8_GSU0_GSUC0_GSUWGMRR0_K1_LBSPPA512_LBSPPB256_LPA16_LPB16_LRVW8_MIWT1_1_NEPBS16_PLR1_SU32_SUM0_SUS256_SVW1_SKXCCM0_ULSGRO1_VWA1_VWB1_WGM1_WGMXCC1_WGMXCCGn1
    SolutionIndex: 19
    SolutionNameMin: Cijk_Ailk_Bljk_BBS_BH_UserArgs_MT32x32x128_MI16x16x1_SN_LDSB1_CLR1_GRVWA8_GRVWB8_GSU0_GSUC0_GSUWGMRR0_K1_LBSPPA512_LBSPPB256_LPA16_LPB16_LRVW8_MIWT1_1_NEPBS16_PLR2_SU32_SUM0_SUS256_SVW1_SKXCCM0_ULSGRO0_VWA1_VWB1_WGM1_WGMXCC1_WGMXCCGn1
    SolutionIndex: 20
    SolutionNameMin: Cijk_Ailk_Bljk_BBS_BH_UserArgs_MT32x32x128_MI16x16x1_SN_LDSB1_CLR1_GRVWA8_GRVWB8_GSU0_GSUC0_GSUWGMRR0_K1_LBSPPA512_LBSPPB256_LPA16_LPB16_LRVW8_MIWT1_1_NEPBS16_PLR2_SU32_SUM0_SUS256_SVW1_SKXCCM0_ULSGRO1_VWA1_VWB1_WGM1_WGMXCC1_WGMXCCGn1
    SolutionIndex: 21
    SolutionNameMin: Cijk_Ailk_Bljk_BBS_BH_UserArgs_MT32x32x128_MI16x16x1_SN_LDSB1_CLR1_GRVWA8_GRVWB8_GSU0_GSUC0_GSUWGMRR0_K1_LBSPPA512_LBSPPB256_LPA16_LPB16_LRVW8_MIWT1_1_NEPBS16_PLR3_SU32_SUM0_SUS256_SVW1_SKXCCM0_ULSGRO0_VWA1_VWB1_WGM1_WGMXCC1_WGMXCCGn1
    SolutionIndex: 22
    SolutionNameMin: Cijk_Ailk_Bljk_BBS_BH_UserArgs_MT32x32x128_MI16x16x1_SN_LDSB1_CLR1_GRVWA8_GRVWB8_GSU0_GSUC0_GSUWGMRR0_K1_LBSPPA512_LBSPPB256_LPA16_LPB16_LRVW8_MIWT1_1_NEPBS16_PLR3_SU32_SUM0_SUS256_SVW1_SKXCCM0_ULSGRO1_VWA1_VWB1_WGM1_WGMXCC1_WGMXCCGn1
    SolutionIndex: 23
    SolutionNameMin: Cijk_Ailk_Bljk_BBS_BH_UserArgs_MT32x32x128_MI16x16x1_SN_LDSB1_CLR1_GRVWA8_GRVWB8_GSU0_GSUC0_GSUWGMRR0_K1_LBSPPA512_LBSPPB256_LPA16_LPB16_LRVW8_MIWT1_1_NEPBS16_PLR2_SU32_SUM0_SUS256_SVW1_SKXCCM0_ULSGRO1_VWA1_VWB1_WGM8_WGMXCC1_WGMXCCGn1
    SolutionIndex: 24
    SolutionNameMin: Cijk_Ailk_Bljk_BBS_BH_UserArgs_MT32x32x32_MI16x16x1_SN_LDSB0_CLR1_GRVWA4_GRVWB4_GSU0_GSUC0_GSUWGMRR0_K1_LBSPPA256_LBSPPB128_LPA16_LPB4_LRVW4_MIWT1_1_NEPBS0_PLR1_SU32_SUM0_SUS256_SVW1_SKXCCM8_ULSGRO0_VWA1_VWB1_WGM1_WGMXCC1_WGMXCCGn1
    SolutionIndex: 25
    SolutionNameMin: Cijk_Ailk_Bljk_BBS_BH_UserArgs_MT128x128x64_MI16x16x1_SN_LDSB1_CLR1_GRVWA8_GRVWB8_GSU0_GSUC0_GSUWGMRR0_K1_LBSPPA2048_LBSPPB512_LPA0_LPB16_LRVW8_MIWT4_4_NEPBS0_PLR1_SU32_SUM0_SUS256_SVW4_SKXCCM8_ULSGRO1_VWA4_VWB4_WGM8_WGMXCC1_WGMXCCGn1
    SolutionIndex: 26
    SolutionNameMin: Cijk_Ailk_Bljk_BBS_BH_UserArgs_MT128x64x64_MI16x16x1_SN_LDSB1_CLR1_GRVWA8_GRVWB8_GSU0_GSUC0_GSUWGMRR0_K1_LBSPPA2048_LBSPPB128_LPA0_LPB16_LRVW8_MIWT4_2_NEPBS0_PLR1_SU32_SUM0_SUS256_SVW4_SKXCCM8_ULSGRO1_VWA4_VWB1_WGM1_WGMXCC1_WGMXCCGn1
    SolutionIndex: 27
    SolutionNameMin: Cijk_Ailk_Bljk_BBS_BH_UserArgs_MT64x64x64_MI16x16x1_SN_LDSB1_CLR1_GRVWA8_GRVWB8_GSU0_GSUC0_GSUWGMRR0_K1_LBSPPA1024_LBSPPB256_LPA32_LPB16_LRVW8_MIWT2_2_NEPBS0_PLR1_SU32_SUM0_SUS256_SVW2_SKXCCM8_ULSGRO1_VWA2_VWB2_WGM1_WGMXCC1_WGMXCCGn1
    SolutionIndex: 28
    SolutionNameMin: Cijk_Ailk_Bljk_BBS_BH_UserArgs_MT64x32x64_MI16x16x1_SN_LDSB0_CLR1_GRVWA8_GRVWB8_GSU0_GSUC0_GSUWGMRR0_K1_LBSPPA1024_LBSPPB128_LPA32_LPB16_LRVW8_MIWT2_1_NEPBS0_PLR1_SU32_SUM0_SUS256_SVW2_SKXCCM8_ULSGRO0_VWA2_VWB1_WGM1_WGMXCC1_WGMXCCGn1
    SolutionIndex: 29
    SolutionNameMin: Cijk_Ailk_Bljk_BBS_BH_UserArgs_MT32x32x64_MI16x16x1_SN_LDSB0_CLR1_GRVWA8_GRVWB8_GSU0_GSUC0_GSUWGMRR0_K1_LBSPPA512_LBSPPB128_LPA16_LPB16_LRVW8_MIWT1_1_NEPBS0_PLR1_SU32_SUM0_SUS256_SVW1_SKXCCM8_ULSGRO0_VWA1_VWB1_WGM1_WGMXCC1_WGMXCCGn1
    SolutionIndex: 30
    SolutionNameMin: Cijk_Ailk_Bljk_BBS_BH_UserArgs_MT32x32x64_MI16x16x1_SN_LDSB0_CLR1_GRVWA8_GRVWB8_GSU0_GSUC0_GSUWGMRR0_K1_LBSPPA512_LBSPPB128_LPA16_LPB16_LRVW8_MIWT1_1_NEPBS0_PLR1_SU32_SUM0_SUS256_SVW1_SKXCCM8_ULSGRO1_VWA1_VWB1_WGM1_WGMXCC1_WGMXCCGn1
    SolutionIndex: 31
    SolutionNameMin: Cijk_Ailk_Bljk_BBS_BH_UserArgs_MT128x64x128_MI16x16x1_SN_LDSB1_CLR1_GRVWA8_GRVWB8_GSU0_GSUC0_GSUWGMRR0_K1_LBSPPA2048_LBSPPB256_LPA0_LPB16_LRVW8_MIWT4_2_NEPBS0_PLR1_SU32_SUM0_SUS256_SVW4_SKXCCM8_ULSGRO0_VWA4_VWB1_WGM1_WGMXCC1_WGMXCCGn1
    SolutionIndex: 32
    SolutionNameMin: Cijk_Ailk_Bljk_BBS_BH_UserArgs_MT128x64x128_MI16x16x1_SN_LDSB1_CLR1_GRVWA8_GRVWB8_GSU0_GSUC0_GSUWGMRR0_K1_LBSPPA2048_LBSPPB512_LPA32_LPB16_LRVW8_MIWT4_2_NEPBS0_PLR2_SU32_SUM0_SUS256_SVW2_SKXCCM8_ULSGRO0_VWA2_VWB2_WGM1_WGMXCC1_WGMXCCGn1
    SolutionIndex: 33
    SolutionNameMin: Cijk_Ailk_Bljk_BBS_BH_UserArgs_MT64x64x128_MI16x16x1_SN_LDSB1_CLR1_GRVWA8_GRVWB8_GSU0_GSUC0_GSUWGMRR0_K1_LBSPPA1024_LBSPPB512_LPA32_LPB16_LRVW8_MIWT2_2_NEPBS0_PLR2_SU32_SUM0_SUS256_SVW2_SKXCCM8_ULSGRO0_VWA2_VWB2_WGM1_WGMXCC1_WGMXCCGn1
    SolutionIndex: 34
    SolutionNameMin: Cijk_Ailk_Bljk_BBS_BH_UserArgs_MT64x64x128_MI16x16x1_SN_LDSB1_CLR1_GRVWA8_GRVWB8_GSU0_GSUC0_GSUWGMRR0_K1_LBSPPA1024_LBSPPB256_LPA32_LPB16_LRVW8_MIWT2_2_NEPBS0_PLR2_SU32_SUM0_SUS256_SVW2_SKXCCM8_ULSGRO1_VWA2_VWB1_WGM1_WGMXCC1_WGMXCCGn1
    SolutionIndex: 35
    SolutionNameMin: Cijk_Ailk_Bljk_BBS_BH_UserArgs_MT64x32x128_MI16x16x1_SN_LDSB1_CLR1_GRVWA8_GRVWB8_GSU0_GSUC0_GSUWGMRR0_K1_LBSPPA1024_LBSPPB256_LPA32_LPB16_LRVW8_MIWT2_1_NEPBS0_PLR2_SU32_SUM0_SUS256_SVW2_SKXCCM8_ULSGRO0_VWA2_VWB1_WGM1_WGMXCC1_WGMXCCGn1
    SolutionIndex: 36
    SolutionNameMin: Cijk_Ailk_Bljk_BBS_BH_UserArgs_MT64x32x128_MI16x16x1_SN_LDSB1_CLR1_GRVWA8_GRVWB8_GSU0_GSUC0_GSUWGMRR0_K1_LBSPPA1024_LBSPPB256_LPA32_LPB16_LRVW8_MIWT2_1_NEPBS0_PLR2_SU32_SUM0_SUS256_SVW2_SKXCCM8_ULSGRO1_VWA2_VWB1_WGM1_WGMXCC1_WGMXCCGn1
    SolutionIndex: 37
    SolutionNameMin: Cijk_Ailk_Bljk_BBS_BH_UserArgs_MT64x32x128_MI16x16x1_SN_LDSB1_CLR1_GRVWA8_GRVWB8_GSU0_GSUC0_GSUWGMRR0_K1_LBSPPA1024_LBSPPB256_LPA32_LPB16_LRVW8_MIWT2_1_NEPBS0_PLR3_SU32_SUM0_SUS256_SVW2_SKXCCM8_ULSGRO1_VWA2_VWB1_WGM1_WGMXCC1_WGMXCCGn1
    SolutionIndex: 38
    SolutionNameMin: Cijk_Ailk_Bljk_BBS_BH_UserArgs_MT32x32x128_MI16x16x1_SN_LDSB1_CLR1_GRVWA8_GRVWB8_GSU0_GSUC0_GSUWGMRR0_K1_LBSPPA512_LBSPPB256_LPA16_LPB16_LRVW8_MIWT1_1_NEPBS0_PLR1_SU32_SUM0_SUS256_SVW1_SKXCCM8_ULSGRO0_VWA1_VWB1_WGM1_WGMXCC1_WGMXCCGn1
    SolutionIndex: 39
    SolutionNameMin: Cijk_Ailk_Bljk_BBS_BH_UserArgs_MT32x32x128_MI16x16x1_SN_LDSB1_CLR1_GRVWA8_GRVWB8_GSU0_GSUC0_GSUWGMRR0_K1_LBSPPA512_LBSPPB256_LPA16_LPB16_LRVW8_MIWT1_1_NEPBS0_PLR1_SU32_SUM0_SUS256_SVW1_SKXCCM8_ULSGRO1_VWA1_VWB1_WGM1_WGMXCC1_WGMXCCGn1
    SolutionIndex: 40
    SolutionNameMin: Cijk_Ailk_Bljk_BBS_BH_UserArgs_MT32x32x128_MI16x16x1_SN_LDSB1_CLR1_GRVWA8_GRVWB8_GSU0_GSUC0_GSUWGMRR0_K1_LBSPPA512_LBSPPB256_LPA16_LPB16_LRVW8_MIWT1_1_NEPBS0_PLR2_SU32_SUM0_SUS256_SVW1_SKXCCM8_ULSGRO0_VWA1_VWB1_WGM1_WGMXCC1_WGMXCCGn1
    SolutionIndex: 41
    SolutionNameMin: Cijk_Ailk_Bljk_BBS_BH_UserArgs_MT32x32x128_MI16x16x1_SN_LDSB1_CLR1_GRVWA8_GRVWB8_GSU0_GSUC0_GSUWGMRR0_K1_LBSPPA512_LBSPPB256_LPA16_LPB16_LRVW8_MIWT1_1_NEPBS0_PLR2_SU32_SUM0_SUS256_SVW1_SKXCCM8_ULSGRO1_VWA1_VWB1_WGM4_WGMXCC1_WGMXCCGn1
    SolutionIndex: 42
    SolutionNameMin: Cijk_Ailk_Bljk_BBS_BH_UserArgs_MT32x32x32_MI16x16x1_SN_LDSB0_CLR1_GRVWA4_GRVWB4_GSU0_GSUC0_GSUWGMRR0_K1_LBSPPA256_LBSPPB128_LPA16_LPB4_LRVW4_MIWT1_1_NEPBS16_PLR1_SU32_SUM0_SUS256_SVW1_SKXCCM8_ULSGRO0_VWA1_VWB1_WGM1_WGMXCC1_WGMXCCGn1
    SolutionIndex: 43
    SolutionNameMin: Cijk_Ailk_Bljk_BBS_BH_UserArgs_MT32x32x32_MI16x16x1_SN_LDSB0_CLR1_GRVWA4_GRVWB4_GSU0_GSUC0_GSUWGMRR0_K1_LBSPPA256_LBSPPB128_LPA16_LPB4_LRVW4_MIWT1_1_NEPBS16_PLR1_SU32_SUM0_SUS256_SVW1_SKXCCM8_ULSGRO1_VWA1_VWB1_WGM1_WGMXCC1_WGMXCCGn1
    SolutionIndex: 44
    SolutionNameMin: Cijk_Ailk_Bljk_BBS_BH_UserArgs_MT128x128x64_MI16x16x1_SN_LDSB1_CLR1_GRVWA8_GRVWB8_GSU0_GSUC0_GSUWGMRR0_K1_LBSPPA2048_LBSPPB128_LPA0_LPB16_LRVW8_MIWT4_4_NEPBS16_PLR1_SU32_SUM0_SUS256_SVW4_SKXCCM8_ULSGRO0_VWA4_VWB1_WGM1_WGMXCC1_WGMXCCGn1
    SolutionIndex: 45
    SolutionNameMin: Cijk_Ailk_Bljk_BBS_BH_UserArgs_MT128x64x64_MI16x16x1_SN_LDSB1_CLR1_GRVWA8_GRVWB8_GSU0_GSUC0_GSUWGMRR0_K1_LBSPPA2048_LBSPPB256_LPA0_LPB16_LRVW8_MIWT4_2_NEPBS16_PLR1_SU32_SUM0_SUS256_SVW4_SKXCCM8_ULSGRO1_VWA4_VWB2_WGM8_WGMXCC1_WGMXCCGn1
    SolutionIndex: 46
    SolutionNameMin: Cijk_Ailk_Bljk_BBS_BH_UserArgs_MT64x64x64_MI16x16x1_SN_LDSB1_CLR1_GRVWA8_GRVWB8_GSU0_GSUC0_GSUWGMRR0_K1_LBSPPA1024_LBSPPB128_LPA32_LPB16_LRVW8_MIWT2_2_NEPBS16_PLR1_SU32_SUM0_SUS256_SVW2_SKXCCM8_ULSGRO1_VWA2_VWB1_WGM1_WGMXCC1_WGMXCCGn1
    SolutionIndex: 47
    SolutionNameMin: Cijk_Ailk_Bljk_BBS_BH_UserArgs_MT64x64x64_MI16x16x1_SN_LDSB1_CLR1_GRVWA8_GRVWB8_GSU0_GSUC0_GSUWGMRR0_K1_LBSPPA1024_LBSPPB128_LPA32_LPB16_LRVW8_MIWT2_2_NEPBS16_PLR1_SU32_SUM0_SUS256_SVW2_SKXCCM8_ULSGRO0_VWA2_VWB1_WGM4_WGMXCC1_WGMXCCGn1
    SolutionIndex: 48
    SolutionNameMin: Cijk_Ailk_Bljk_BBS_BH_UserArgs_MT32x32x64_MI16x16x1_SN_LDSB0_CLR1_GRVWA8_GRVWB8_GSU0_GSUC0_GSUWGMRR0_K1_LBSPPA512_LBSPPB128_LPA16_LPB16_LRVW8_MIWT1_1_NEPBS16_PLR1_SU32_SUM0_SUS256_SVW1_SKXCCM8_ULSGRO0_VWA1_VWB1_WGM1_WGMXCC1_WGMXCCGn1
    SolutionIndex: 49
    SolutionNameMin: Cijk_Ailk_Bljk_BBS_BH_UserArgs_MT128x64x128_MI16x16x1_SN_LDSB1_CLR1_GRVWA8_GRVWB8_GSU0_GSUC0_GSUWGMRR0_K1_LBSPPA2048_LBSPPB512_LPA0_LPB16_LRVW8_MIWT4_2_NEPBS16_PLR1_SU32_SUM0_SUS256_SVW4_SKXCCM8_ULSGRO0_VWA4_VWB2_WGM1_WGMXCC1_WGMXCCGn1
    SolutionIndex: 50
    SolutionNameMin: Cijk_Ailk_Bljk_BBS_BH_UserArgs_MT128x64x128_MI16x16x1_SN_LDSB1_CLR1_GRVWA8_GRVWB8_GSU0_GSUC0_GSUWGMRR0_K1_LBSPPA2048_LBSPPB256_LPA0_LPB16_LRVW8_MIWT4_2_NEPBS16_PLR2_SU32_SUM0_SUS256_SVW4_SKXCCM8_ULSGRO1_VWA4_VWB1_WGM1_WGMXCC1_WGMXCCGn1
    SolutionIndex: 51
    SolutionNameMin: Cijk_Ailk_Bljk_BBS_BH_UserArgs_MT64x64x128_MI16x16x1_SN_LDSB1_CLR1_GRVWA8_GRVWB8_GSU0_GSUC0_GSUWGMRR0_K1_LBSPPA1024_LBSPPB512_LPA32_LPB16_LRVW8_MIWT2_2_NEPBS16_PLR2_SU32_SUM0_SUS256_SVW2_SKXCCM8_ULSGRO0_VWA2_VWB2_WGM1_WGMXCC1_WGMXCCGn1
    SolutionIndex: 52
    SolutionNameMin: Cijk_Ailk_Bljk_BBS_BH_UserArgs_MT64x64x128_MI16x16x1_SN_LDSB1_CLR1_GRVWA8_GRVWB8_GSU0_GSUC0_GSUWGMRR0_K1_LBSPPA1024_LBSPPB256_LPA32_LPB16_LRVW8_MIWT2_2_NEPBS16_PLR2_SU32_SUM0_SUS256_SVW2_SKXCCM8_ULSGRO1_VWA2_VWB1_WGM1_WGMXCC1_WGMXCCGn1
    SolutionIndex: 53
    SolutionNameMin: Cijk_Ailk_Bljk_BBS_BH_UserArgs_MT64x64x128_MI16x16x1_SN_LDSB1_CLR1_GRVWA8_GRVWB8_GSU0_GSUC0_GSUWGMRR0_K1_LBSPPA1024_LBSPPB512_LPA32_LPB16_LRVW8_MIWT2_2_NEPBS16_PLR2_SU32_SUM0_SUS256_SVW2_SKXCCM8_ULSGRO1_VWA2_VWB2_WGM1_WGMXCC1_WGMXCCGn1
    SolutionIndex: 54
    SolutionNameMin: Cijk_Ailk_Bljk_BBS_BH_UserArgs_MT64x64x128_MI16x16x1_SN_LDSB1_CLR1_GRVWA8_GRVWB8_GSU0_GSUC0_GSUWGMRR0_K1_LBSPPA1024_LBSPPB512_LPA32_LPB16_LRVW8_MIWT2_2_NEPBS16_PLR2_SU32_SUM0_SUS256_SVW2_SKXCCM8_ULSGRO1_VWA2_VWB2_WGM4_WGMXCC1_WGMXCCGn1
    SolutionIndex: 55
    SolutionNameMin: Cijk_Ailk_Bljk_BBS_BH_UserArgs_MT64x32x128_MI16x16x1_SN_LDSB1_CLR1_GRVWA8_GRVWB8_GSU0_GSUC0_GSUWGMRR0_K1_LBSPPA1024_LBSPPB256_LPA32_LPB16_LRVW8_MIWT2_1_NEPBS16_PLR2_SU32_SUM0_SUS256_SVW2_SKXCCM8_ULSGRO0_VWA2_VWB1_WGM1_WGMXCC1_WGMXCCGn1
    SolutionIndex: 56
    SolutionNameMin: Cijk_Ailk_Bljk_BBS_BH_UserArgs_MT64x32x128_MI16x16x1_SN_LDSB1_CLR1_GRVWA8_GRVWB8_GSU0_GSUC0_GSUWGMRR0_K1_LBSPPA1024_LBSPPB256_LPA32_LPB16_LRVW8_MIWT2_1_NEPBS16_PLR2_SU32_SUM0_SUS256_SVW2_SKXCCM8_ULSGRO1_VWA2_VWB1_WGM1_WGMXCC1_WGMXCCGn1
    SolutionIndex: 57
    SolutionNameMin: Cijk_Ailk_Bljk_BBS_BH_UserArgs_MT64x32x128_MI16x16x1_SN_LDSB1_CLR1_GRVWA8_GRVWB8_GSU0_GSUC0_GSUWGMRR0_K1_LBSPPA1024_LBSPPB256_LPA32_LPB16_LRVW8_MIWT2_1_NEPBS16_PLR3_SU32_SUM0_SUS256_SVW2_SKXCCM8_ULSGRO0_VWA2_VWB1_WGM1_WGMXCC1_WGMXCCGn1
    SolutionIndex: 58
    SolutionNameMin: Cijk_Ailk_Bljk_BBS_BH_UserArgs_MT64x32x128_MI16x16x1_SN_LDSB1_CLR1_GRVWA8_GRVWB8_GSU0_GSUC0_GSUWGMRR0_K1_LBSPPA1024_LBSPPB256_LPA32_LPB16_LRVW8_MIWT2_1_NEPBS16_PLR3_SU32_SUM0_SUS256_SVW2_SKXCCM8_ULSGRO1_VWA2_VWB1_WGM1_WGMXCC1_WGMXCCGn1
    SolutionIndex: 59
    SolutionNameMin: Cijk_Ailk_Bljk_BBS_BH_UserArgs_MT32x32x128_MI16x16x1_SN_LDSB1_CLR1_GRVWA8_GRVWB8_GSU0_GSUC0_GSUWGMRR0_K1_LBSPPA512_LBSPPB256_LPA16_LPB16_LRVW8_MIWT1_1_NEPBS16_PLR1_SU32_SUM0_SUS256_SVW1_SKXCCM8_ULSGRO0_VWA1_VWB1_WGM1_WGMXCC1_WGMXCCGn1
    SolutionIndex: 60
    SolutionNameMin: Cijk_Ailk_Bljk_BBS_BH_UserArgs_MT32x32x128_MI16x16x1_SN_LDSB1_CLR1_GRVWA8_GRVWB8_GSU0_GSUC0_GSUWGMRR0_K1_LBSPPA512_LBSPPB256_LPA16_LPB16_LRVW8_MIWT1_1_NEPBS16_PLR1_SU32_SUM0_SUS256_SVW1_SKXCCM8_ULSGRO1_VWA1_VWB1_WGM1_WGMXCC1_WGMXCCGn1
    SolutionIndex: 61
    SolutionNameMin: Cijk_Ailk_Bljk_BBS_BH_UserArgs_MT32x32x128_MI16x16x1_SN_LDSB1_CLR1_GRVWA8_GRVWB8_GSU0_GSUC0_GSUWGMRR0_K1_LBSPPA512_LBSPPB256_LPA16_LPB16_LRVW8_MIWT1_1_NEPBS16_PLR2_SU32_SUM0_SUS256_SVW1_SKXCCM8_ULSGRO0_VWA1_VWB1_WGM1_WGMXCC1_WGMXCCGn1
    SolutionIndex: 62
    SolutionNameMin: Cijk_Ailk_Bljk_BBS_BH_UserArgs_MT32x32x128_MI16x16x1_SN_LDSB1_CLR1_GRVWA8_GRVWB8_GSU0_GSUC0_GSUWGMRR0_K1_LBSPPA512_LBSPPB256_LPA16_LPB16_LRVW8_MIWT1_1_NEPBS16_PLR2_SU32_SUM0_SUS256_SVW1_SKXCCM8_ULSGRO1_VWA1_VWB1_WGM1_WGMXCC1_WGMXCCGn1
    SolutionIndex: 63
    SolutionNameMin: Cijk_Ailk_Bljk_BBS_BH_UserArgs_MT32x32x128_MI16x16x1_SN_LDSB1_CLR1_GRVWA8_GRVWB8_GSU0_GSUC0_GSUWGMRR0_K1_LBSPPA512_LBSPPB256_LPA16_LPB16_LRVW8_MIWT1_1_NEPBS16_PLR3_SU32_SUM0_SUS256_SVW1_SKXCCM8_ULSGRO0_VWA1_VWB1_WGM1_WGMXCC1_WGMXCCGn1
    SolutionIndex: 64
    SolutionNameMin: Cijk_Ailk_Bljk_BBS_BH_UserArgs_MT32x32x128_MI16x16x1_SN_LDSB1_CLR1_GRVWA8_GRVWB8_GSU0_GSUC0_GSUWGMRR0_K1_LBSPPA512_LBSPPB256_LPA16_LPB16_LRVW8_MIWT1_1_NEPBS16_PLR3_SU32_SUM0_SUS256_SVW1_SKXCCM8_ULSGRO1_VWA1_VWB1_WGM1_WGMXCC1_WGMXCCGn1
    SolutionIndex: 65
    SolutionNameMin: Cijk_Ailk_Bljk_BBS_BH_UserArgs_MT32x32x128_MI16x16x1_SN_LDSB1_CLR1_GRVWA8_GRVWB8_GSU0_GSUC0_GSUWGMRR0_K1_LBSPPA512_LBSPPB256_LPA16_LPB16_LRVW8_MIWT1_1_NEPBS16_PLR3_SU32_SUM0_SUS256_SVW1_SKXCCM8_ULSGRO0_VWA1_VWB1_WGM8_WGMXCC1_WGMXCCGn1
    SolutionIndex: 66
    SolutionNameMin: Cijk_Ailk_Bljk_BBS_BH_UserArgs_MT32x32x128_MI16x16x1_SN_LDSB1_CLR1_GRVWA8_GRVWB8_GSU0_GSUC0_GSUWGMRR0_K1_LBSPPA512_LBSPPB256_LPA16_LPB16_LRVW8_MIWT1_1_NEPBS16_PLR1_SU32_SUM0_SUS256_SVW1_SKXCCM8_ULSGRO1_VWA1_VWB1_WGM8_WGMXCC1_WGMXCCGn1
    SolutionIndex: 67
    SolutionNameMin: Cijk_Ailk_Bljk_BBS_BH_UserArgs_MT32x32x128_MI16x16x1_SN_LDSB1_CLR1_GRVWA8_GRVWB8_GSU0_GSUC0_GSUWGMRR0_K1_LBSPPA512_LBSPPB256_LPA16_LPB16_LRVW8_MIWT1_1_NEPBS0_PLR3_SU32_SUM0_SUS256_SVW1_SKXCCM0_ULSGRO0_VWA1_VWB1_WGM1_WGMXCC1_WGMXCCGn1
    SolutionIndex: 68
    SolutionNameMin: Cijk_Ailk_Bljk_BBS_BH_UserArgs_MT64x32x128_MI16x16x1_SN_LDSB1_CLR1_GRVWA8_GRVWB8_GSU0_GSUC0_GSUWGMRR0_K1_LBSPPA1024_LBSPPB256_LPA32_LPB16_LRVW8_MIWT2_1_NEPBS0_PLR2_SU32_SUM0_SUS256_SVW2_SKXCCM8_ULSGRO1_VWA2_VWB1_WGM8_WGMXCC1_WGMXCCGn1
    SolutionIndex: 69
    SolutionNameMin: Cijk_Ailk_Bljk_BBS_BH_UserArgs_MT64x32x128_MI16x16x1_SN_LDSB1_CLR1_GRVWA8_GRVWB8_GSU0_GSUC0_GSUWGMRR0_K1_LBSPPA1024_LBSPPB256_LPA32_LPB16_LRVW8_MIWT2_1_NEPBS0_PLR2_SU32_SUM0_SUS256_SVW2_SKXCCM8_ULSGRO1_VWA2_VWB1_WGM4_WGMXCC1_WGMXCCGn1
    SolutionIndex: 70
    SolutionNameMin: Cijk_Ailk_Bljk_BBS_BH_UserArgs_MT64x64x64_MI16x16x1_SN_LDSB1_CLR1_GRVWA8_GRVWB8_GSU0_GSUC0_GSUWGMRR0_K1_LBSPPA1024_LBSPPB256_LPA32_LPB16_LRVW8_MIWT2_2_NEPBS0_PLR1_SU32_SUM0_SUS256_SVW2_SKXCCM8_ULSGRO0_VWA2_VWB2_WGM1_WGMXCC1_WGMXCCGn1
    SolutionIndex: 71
    SolutionNameMin: Cijk_Ailk_Bljk_BBS_BH_UserArgs_MT64x64x64_MI16x16x1_SN_LDSB1_CLR1_GRVWA8_GRVWB8_GSU0_GSUC0_GSUWGMRR0_K1_LBSPPA1024_LBSPPB256_LPA32_LPB16_LRVW8_MIWT2_2_NEPBS16_PLR1_SU32_SUM0_SUS256_SVW2_SKXCCM8_ULSGRO0_VWA2_VWB2_WGM1_WGMXCC1_WGMXCCGn1
    SolutionIndex: 72
    SolutionNameMin: Cijk_Ailk_Bljk_BBS_BH_UserArgs_MT128x64x64_MI16x16x1_SN_LDSB1_CLR1_GRVWA8_GRVWB8_GSU0_GSUC0_GSUWGMRR0_K1_LBSPPA2048_LBSPPB128_LPA0_LPB16_LRVW8_MIWT4_2_NEPBS16_PLR1_SU32_SUM0_SUS256_SVW4_SKXCCM8_ULSGRO1_VWA4_VWB1_WGM1_WGMXCC1_WGMXCCGn1
    SolutionIndex: 73
    SolutionNameMin: Cijk_Ailk_Bljk_BBS_BH_UserArgs_MT64x64x128_MI16x16x1_SN_LDSB1_CLR1_GRVWA8_GRVWB8_GSU0_GSUC0_GSUWGMRR0_K1_LBSPPA1024_LBSPPB256_LPA32_LPB16_LRVW8_MIWT2_2_NEPBS0_PLR2_SU32_SUM0_SUS256_SVW2_SKXCCM8_ULSGRO0_VWA2_VWB1_WGM1_WGMXCC1_WGMXCCGn1
    SolutionIndex: 74
    SolutionNameMin: Cijk_Ailk_Bljk_BBS_BH_UserArgs_MT64x128x64_MI16x16x1_SN_LDSB1_CLR1_GRVWA8_GRVWB8_GSU0_GSUC0_GSUWGMRR0_K1_LBSPPA1024_LBSPPB256_LPA32_LPB16_LRVW8_MIWT2_4_NEPBS16_PLR1_SU32_SUM0_SUS256_SVW2_SKXCCM8_ULSGRO1_VWA2_VWB2_WGM1_WGMXCC1_WGMXCCGn1
    SolutionIndex: 75
    SolutionNameMin: Cijk_Ailk_Bljk_BBS_BH_UserArgs_MT128x64x128_MI16x16x1_SN_LDSB1_CLR1_GRVWA8_GRVWB8_GSU0_GSUC0_GSUWGMRR0_K1_LBSPPA2048_LBSPPB512_LPA0_LPB16_LRVW8_MIWT4_2_NEPBS0_PLR1_SU32_SUM0_SUS256_SVW4_SKXCCM8_ULSGRO1_VWA4_VWB2_WGM1_WGMXCC1_WGMXCCGn1
    SolutionIndex: 76
    SolutionNameMin: Cijk_Ailk_Bljk_BBS_BH_UserArgs_MT128x64x128_MI16x16x1_SN_LDSB1_CLR1_GRVWA8_GRVWB8_GSU0_GSUC0_GSUWGMRR0_K1_LBSPPA2048_LBSPPB256_LPA0_LPB16_LRVW8_MIWT4_2_NEPBS16_PLR2_SU32_SUM0_SUS256_SVW4_SKXCCM0_ULSGRO1_VWA4_VWB1_WGM8_WGMXCC1_WGMXCCGn1
    SolutionIndex: 77
    SolutionNameMin: Cijk_Ailk_Bljk_BBS_BH_UserArgs_MT128x64x128_MI16x16x1_SN_LDSB1_CLR1_GRVWA8_GRVWB8_GSU0_GSUC0_GSUWGMRR0_K1_LBSPPA2048_LBSPPB512_LPA32_LPB16_LRVW8_MIWT4_2_NEPBS0_PLR2_SU32_SUM0_SUS256_SVW2_SKXCCM8_ULSGRO1_VWA2_VWB2_WGM1_WGMXCC1_WGMXCCGn1
    SolutionIndex: 78
    SolutionNameMin: Cijk_Ailk_Bljk_BBS_BH_UserArgs_MT128x64x128_MI16x16x1_SN_LDSB1_CLR1_GRVWA8_GRVWB8_GSU0_GSUC0_GSUWGMRR0_K1_LBSPPA2048_LBSPPB256_LPA0_LPB16_LRVW8_MIWT4_2_NEPBS0_PLR2_SU32_SUM0_SUS256_SVW4_SKXCCM8_ULSGRO1_VWA4_VWB1_WGM1_WGMXCC1_WGMXCCGn1
    SolutionIndex: 79
    SolutionNameMin: Cijk_Ailk_Bljk_BBS_BH_UserArgs_MT128x64x128_MI16x16x1_SN_LDSB1_CLR1_GRVWA8_GRVWB8_GSU0_GSUC0_GSUWGMRR0_K1_LBSPPA2048_LBSPPB512_LPA0_LPB16_LRVW8_MIWT4_2_NEPBS16_PLR2_SU32_SUM0_SUS256_SVW4_SKXCCM8_ULSGRO0_VWA4_VWB2_WGM1_WGMXCC1_WGMXCCGn1
    SolutionIndex: 80
    SolutionNameMin: Cijk_Ailk_Bljk_BBS_BH_UserArgs_MT128x128x64_MI16x16x1_SN_LDSB1_CLR1_GRVWA8_GRVWB8_GSU0_GSUC0_GSUWGMRR0_K1_LBSPPA2048_LBSPPB512_LPA0_LPB16_LRVW8_MIWT4_4_NEPBS16_PLR1_SU32_SUM0_SUS256_SVW4_SKXCCM8_ULSGRO0_VWA4_VWB4_WGM1_WGMXCC1_WGMXCCGn1
    SolutionIndex: 81
    SolutionNameMin: Cijk_Ailk_Bljk_BBS_BH_UserArgs_MT128x128x64_MI16x16x1_SN_LDSB1_CLR1_GRVWA8_GRVWB8_GSU0_GSUC0_GSUWGMRR0_K1_LBSPPA2048_LBSPPB512_LPA0_LPB16_LRVW8_MIWT4_4_NEPBS0_PLR1_SU32_SUM0_SUS256_SVW4_SKXCCM8_ULSGRO0_VWA4_VWB4_WGM4_WGMXCC1_WGMXCCGn1
    SolutionIndex: 82
    SolutionNameMin: Cijk_Ailk_Bljk_BBS_BH_UserArgs_MT128x64x128_MI16x16x1_SN_LDSB1_CLR1_GRVWA8_GRVWB8_GSU0_GSUC0_GSUWGMRR0_K1_LBSPPA2048_LBSPPB256_LPA0_LPB16_LRVW8_MIWT4_2_NEPBS16_PLR2_SU32_SUM0_SUS256_SVW4_SKXCCM0_ULSGRO0_VWA4_VWB1_WGM8_WGMXCC1_WGMXCCGn1
    SolutionIndex: 83
    SolutionNameMin: Cijk_Ailk_Bljk_BBS_BH_UserArgs_MT64x128x128_MI16x16x1_SN_LDSB1_CLR1_GRVWA8_GRVWB8_GSU0_GSUC0_GSUWGMRR0_K1_LBSPPA1024_LBSPPB1024_LPA32_LPB16_LRVW8_MIWT2_4_NEPBS0_PLR2_SU32_SUM0_SUS256_SVW2_SKXCCM0_ULSGRO0_VWA2_VWB4_WGM1_WGMXCC1_WGMXCCGn1
    SolutionIndex: 84
    SolutionNameMin: Cijk_Ailk_Bljk_BBS_BH_UserArgs_MT128x128x64_MI16x16x1_SN_LDSB1_CLR1_GRVWA8_GRVWB8_GSU0_GSUC0_GSUWGMRR0_K1_LBSPPA2048_LBSPPB256_LPA0_LPB16_LRVW8_MIWT4_4_NEPBS16_PLR1_SU32_SUM0_SUS256_SVW4_SKXCCM8_ULSGRO0_VWA4_VWB2_WGM1_WGMXCC1_WGMXCCGn1
    SolutionIndex: 85
    SolutionNameMin: Cijk_Ailk_Bljk_BBS_BH_UserArgs_MT128x128x64_MI16x16x1_SN_LDSB1_CLR1_GRVWA8_GRVWB8_GSU0_GSUC0_GSUWGMRR0_K1_LBSPPA2048_LBSPPB256_LPA0_LPB16_LRVW8_MIWT4_4_NEPBS16_PLR1_SU32_SUM0_SUS256_SVW4_SKXCCM8_ULSGRO1_VWA4_VWB2_WGM8_WGMXCC1_WGMXCCGn1
    SolutionIndex: 86
    SolutionNameMin: Cijk_Ailk_Bljk_BBS_BH_UserArgs_MT256x128x64_MI16x16x1_SN_LDSB1_CLR1_GRVWA8_GRVWB8_GSU0_GSUC0_GSUWGMRR0_K1_LBSPPA4096_LBSPPB512_LPA0_LPB16_LRVW8_MIWT8_4_NEPBS16_PLR1_SU32_SUM0_SUS256_SVW4_SKXCCM0_ULSGRO0_VWA4_VWB4_WGM1_WGMXCC1_WGMXCCGn1
    SolutionIndex: 87
    SolutionNameMin: Cijk_Ailk_Bljk_BBS_BH_UserArgs_MT64x32x128_MI16x16x1_SN_LDSB1_CLR1_GRVWA8_GRVWB8_GSU0_GSUC0_GSUWGMRR0_K1_LBSPPA1024_LBSPPB256_LPA32_LPB16_LRVW8_MIWT2_1_NEPBS16_PLR2_SU32_SUM0_SUS256_SVW2_SKXCCM8_ULSGRO0_VWA2_VWB1_WGM8_WGMXCC1_WGMXCCGn1
    SolutionIndex: 88
    SolutionNameMin: Cijk_Ailk_Bljk_BBS_BH_UserArgs_MT64x64x64_MI16x16x1_SN_LDSB1_CLR1_GRVWA8_GRVWB8_GSU0_GSUC0_GSUWGMRR0_K1_LBSPPA1024_LBSPPB256_LPA32_LPB16_LRVW8_MIWT2_2_NEPBS0_PLR1_SU32_SUM0_SUS256_SVW2_SKXCCM8_ULSGRO0_VWA2_VWB2_WGM4_WGMXCC1_WGMXCCGn1
    SolutionIndex: 89
    SolutionNameMin: Cijk_Ailk_Bljk_BBS_BH_UserArgs_MT64x32x128_MI16x16x1_SN_LDSB1_CLR1_GRVWA8_GRVWB8_GSU0_GSUC0_GSUWGMRR0_K1_LBSPPA1024_LBSPPB256_LPA32_LPB16_LRVW8_MIWT2_1_NEPBS16_PLR2_SU32_SUM0_SUS256_SVW2_SKXCCM8_ULSGRO1_VWA2_VWB1_WGM4_WGMXCC1_WGMXCCGn1
    SolutionIndex: 90
    SolutionNameMin: Cijk_Ailk_Bljk_BBS_BH_UserArgs_MT64x64x64_MI16x16x1_SN_LDSB1_CLR1_GRVWA8_GRVWB8_GSU0_GSUC0_GSUWGMRR0_K1_LBSPPA1024_LBSPPB128_LPA32_LPB16_LRVW8_MIWT2_2_NEPBS16_PLR1_SU32_SUM0_SUS256_SVW2_SKXCCM8_ULSGRO1_VWA2_VWB1_WGM4_WGMXCC1_WGMXCCGn1
    SolutionIndex: 91
    SolutionNameMin: Cijk_Ailk_Bljk_BBS_BH_UserArgs_MT64x64x128_MI16x16x1_SN_LDSB1_CLR1_GRVWA8_GRVWB8_GSU0_GSUC0_GSUWGMRR0_K1_LBSPPA1024_LBSPPB512_LPA32_LPB16_LRVW8_MIWT2_2_NEPBS0_PLR2_SU32_SUM0_SUS256_SVW2_SKXCCM8_ULSGRO1_VWA2_VWB2_WGM4_WGMXCC1_WGMXCCGn1
    SolutionIndex: 92
    SolutionNameMin: Cijk_Ailk_Bljk_BBS_BH_UserArgs_MT64x128x64_MI16x16x1_SN_LDSB1_CLR1_GRVWA8_GRVWB8_GSU0_GSUC0_GSUWGMRR0_K1_LBSPPA1024_LBSPPB512_LPA32_LPB16_LRVW8_MIWT2_4_NEPBS0_PLR1_SU32_SUM0_SUS256_SVW2_SKXCCM8_ULSGRO1_VWA2_VWB4_WGM1_WGMXCC1_WGMXCCGn1
    SolutionIndex: 93
    SolutionNameMin: Cijk_Ailk_Bljk_BBS_BH_UserArgs_MT64x64x128_MI16x16x1_SN_LDSB1_CLR1_GRVWA8_GRVWB8_GSU0_GSUC0_GSUWGMRR0_K1_LBSPPA1024_LBSPPB256_LPA32_LPB16_LRVW8_MIWT2_2_NEPBS0_PLR2_SU32_SUM0_SUS256_SVW2_SKXCCM0_ULSGRO1_VWA2_VWB1_WGM1_WGMXCC1_WGMXCCGn1
    SolutionIndex: 94
    SolutionNameMin: Cijk_Ailk_Bljk_BBS_BH_UserArgs_MT64x64x128_MI16x16x1_SN_LDSB1_CLR1_GRVWA8_GRVWB8_GSU0_GSUC0_GSUWGMRR0_K1_LBSPPA1024_LBSPPB512_LPA32_LPB16_LRVW8_MIWT2_2_NEPBS16_PLR2_SU32_SUM0_SUS256_SVW2_SKXCCM0_ULSGRO0_VWA2_VWB2_WGM1_WGMXCC1_WGMXCCGn1
    SolutionIndex: 95
    SolutionNameMin: Cijk_Ailk_Bljk_BBS_BH_UserArgs_MT64x64x128_MI16x16x1_SN_LDSB1_CLR1_GRVWA8_GRVWB8_GSU0_GSUC0_GSUWGMRR0_K1_LBSPPA1024_LBSPPB512_LPA32_LPB16_LRVW8_MIWT2_2_NEPBS16_PLR3_SU32_SUM0_SUS256_SVW2_SKXCCM8_ULSGRO0_VWA2_VWB2_WGM1_WGMXCC1_WGMXCCGn1
    SolutionIndex: 96
    SolutionNameMin: Cijk_Ailk_Bljk_BBS_BH_UserArgs_MT64x128x64_MI16x16x1_SN_LDSB1_CLR1_GRVWA8_GRVWB8_GSU0_GSUC0_GSUWGMRR0_K1_LBSPPA1024_LBSPPB512_LPA32_LPB16_LRVW8_MIWT2_4_NEPBS16_PLR1_SU32_SUM0_SUS256_SVW2_SKXCCM8_ULSGRO0_VWA2_VWB4_WGM1_WGMXCC1_WGMXCCGn1
    SolutionIndex: 97
    SolutionNameMin: Cijk_Ailk_Bljk_BBS_BH_UserArgs_MT128x64x128_MI16x16x1_SN_LDSB1_CLR1_GRVWA8_GRVWB8_GSU0_GSUC0_GSUWGMRR0_K1_LBSPPA2048_LBSPPB256_LPA0_LPB16_LRVW8_MIWT4_2_NEPBS0_PLR1_SU32_SUM0_SUS256_SVW4_SKXCCM0_ULSGRO0_VWA4_VWB1_WGM4_WGMXCC1_WGMXCCGn1
    SolutionIndex: 98
    SolutionNameMin: Cijk_Ailk_Bljk_BBS_BH_UserArgs_MT128x64x128_MI16x16x1_SN_LDSB1_CLR1_GRVWA8_GRVWB8_GSU0_GSUC0_GSUWGMRR0_K1_LBSPPA2048_LBSPPB256_LPA0_LPB16_LRVW8_MIWT4_2_NEPBS0_PLR1_SU32_SUM0_SUS256_SVW4_SKXCCM0_ULSGRO1_VWA4_VWB1_WGM8_WGMXCC1_WGMXCCGn1
    SolutionIndex: 99
    SolutionNameMin: Cijk_Ailk_Bljk_BBS_BH_UserArgs_MT64x128x128_MI16x16x1_SN_LDSB1_CLR1_GRVWA8_GRVWB8_GSU0_GSUC0_GSUWGMRR0_K1_LBSPPA1024_LBSPPB1024_LPA32_LPB16_LRVW8_MIWT2_4_NEPBS0_PLR1_SU32_SUM0_SUS256_SVW2_SKXCCM8_ULSGRO0_VWA2_VWB4_WGM1_WGMXCC1_WGMXCCGn1
    SolutionIndex: 100
    SolutionNameMin: Cijk_Ailk_Bljk_BBS_BH_UserArgs_MT128x64x128_MI16x16x1_SN_LDSB1_CLR1_GRVWA8_GRVWB8_GSU0_GSUC0_GSUWGMRR0_K1_LBSPPA2048_LBSPPB256_LPA0_LPB16_LRVW8_MIWT4_2_NEPBS16_PLR3_SU32_SUM0_SUS256_SVW4_SKXCCM8_ULSGRO1_VWA4_VWB1_WGM1_WGMXCC1_WGMXCCGn1
    SolutionIndex: 101
    SolutionNameMin: Cijk_Ailk_Bljk_BBS_BH_UserArgs_MT64x128x64_MI16x16x1_SN_LDSB1_CLR1_GRVWA8_GRVWB8_GSU0_GSUC0_GSUWGMRR0_K1_LBSPPA1024_LBSPPB128_LPA32_LPB16_LRVW8_MIWT2_4_NEPBS0_PLR1_SU32_SUM0_SUS256_SVW2_SKXCCM8_ULSGRO1_VWA2_VWB1_WGM1_WGMXCC1_WGMXCCGn1
    SolutionIndex: 102
    SolutionNameMin: Cijk_Ailk_Bljk_BBS_BH_UserArgs_MT128x128x64_MI16x16x1_SN_LDSB1_CLR1_GRVWA8_GRVWB8_GSU0_GSUC0_GSUWGMRR0_K1_LBSPPA2048_LBSPPB128_LPA0_LPB16_LRVW8_MIWT4_4_NEPBS0_PLR1_SU32_SUM0_SUS256_SVW4_SKXCCM8_ULSGRO1_VWA4_VWB1_WGM1_WGMXCC1_WGMXCCGn1
    SolutionIndex: 103
    SolutionNameMin: Cijk_Ailk_Bljk_BBS_BH_UserArgs_MT128x128x64_MI16x16x1_SN_LDSB1_CLR1_GRVWA8_GRVWB8_GSU0_GSUC0_GSUWGMRR0_K1_LBSPPA2048_LBSPPB128_LPA0_LPB16_LRVW8_MIWT4_4_NEPBS16_PLR1_SU32_SUM0_SUS256_SVW4_SKXCCM8_ULSGRO1_VWA4_VWB1_WGM1_WGMXCC1_WGMXCCGn1
    SolutionIndex: 104
    SolutionNameMin: Cijk_Ailk_Bljk_BBS_BH_UserArgs_MT128x64x128_MI16x16x1_SN_LDSB1_CLR1_GRVWA8_GRVWB8_GSU0_GSUC0_GSUWGMRR0_K1_LBSPPA2048_LBSPPB256_LPA0_LPB16_LRVW8_MIWT4_2_NEPBS0_PLR2_SU32_SUM0_SUS256_SVW4_SKXCCM0_ULSGRO0_VWA4_VWB1_WGM8_WGMXCC1_WGMXCCGn1
    SolutionIndex: 105
    SolutionNameMin: Cijk_Ailk_Bljk_BBS_BH_UserArgs_MT128x64x128_MI16x16x1_SN_LDSB1_CLR1_GRVWA8_GRVWB8_GSU0_GSUC0_GSUWGMRR0_K1_LBSPPA2048_LBSPPB256_LPA0_LPB16_LRVW8_MIWT4_2_NEPBS0_PLR2_SU32_SUM0_SUS256_SVW4_SKXCCM0_ULSGRO0_VWA4_VWB1_WGM1_WGMXCC1_WGMXCCGn1
    SolutionIndex: 106
    SolutionNameMin: Cijk_Ailk_Bljk_BBS_BH_UserArgs_MT128x64x64_MI16x16x1_SN_LDSB1_CLR1_GRVWA8_GRVWB8_GSU0_GSUC0_GSUWGMRR0_K1_LBSPPA2048_LBSPPB128_LPA0_LPB16_LRVW8_MIWT4_2_NEPBS16_PLR1_SU32_SUM0_SUS256_SVW4_SKXCCM8_ULSGRO0_VWA4_VWB1_WGM1_WGMXCC1_WGMXCCGn1
    SolutionIndex: 107
    SolutionNameMin: Cijk_Ailk_Bljk_BBS_BH_UserArgs_MT128x128x64_MI16x16x1_SN_LDSB1_CLR1_GRVWA8_GRVWB8_GSU0_GSUC0_GSUWGMRR0_K1_LBSPPA2048_LBSPPB256_LPA0_LPB16_LRVW8_MIWT4_4_NEPBS0_PLR1_SU32_SUM0_SUS256_SVW4_SKXCCM8_ULSGRO0_VWA4_VWB2_WGM1_WGMXCC1_WGMXCCGn1
    SolutionIndex: 108
    SolutionNameMin: Cijk_Ailk_Bljk_BBS_BH_UserArgs_MT128x128x64_MI16x16x1_SN_LDSB1_CLR1_GRVWA8_GRVWB8_GSU0_GSUC0_GSUWGMRR0_K1_LBSPPA2048_LBSPPB512_LPA0_LPB16_LRVW8_MIWT4_4_NEPBS16_PLR1_SU32_SUM0_SUS256_SVW4_SKXCCM8_ULSGRO1_VWA4_VWB4_WGM1_WGMXCC1_WGMXCCGn1
    SolutionIndex: 109
    SolutionNameMin: Cijk_Ailk_Bljk_BBS_BH_UserArgs_MT128x256x64_MI16x16x1_SN_LDSB1_CLR1_GRVWA8_GRVWB8_GSU0_GSUC0_GSUWGMRR0_K1_LBSPPA2048_LBSPPB256_LPA0_LPB16_LRVW8_MIWT4_8_NEPBS0_PLR1_SU32_SUM0_SUS256_SVW4_SKXCCM8_ULSGRO0_VWA4_VWB2_WGM8_WGMXCC1_WGMXCCGn1
    SolutionIndex: 110
    SolutionNameMin: Cijk_Ailk_Bljk_BBS_BH_UserArgs_MT64x128x128_MI16x16x1_SN_LDSB1_CLR1_GRVWA8_GRVWB8_GSU0_GSUC0_GSUWGMRR0_K1_LBSPPA1024_LBSPPB1024_LPA32_LPB16_LRVW8_MIWT2_4_NEPBS0_PLR2_SU32_SUM0_SUS256_SVW2_SKXCCM0_ULSGRO0_VWA2_VWB4_WGM8_WGMXCC1_WGMXCCGn1
    SolutionIndex: 111
    SolutionNameMin: Cijk_Ailk_Bljk_BBS_BH_UserArgs_MT128x128x64_MI16x16x1_SN_LDSB1_CLR1_GRVWA8_GRVWB8_GSU0_GSUC0_GSUWGMRR0_K1_LBSPPA2048_LBSPPB512_LPA32_LPB16_LRVW8_MIWT4_4_NEPBS16_PLR1_SU32_SUM0_SUS256_SVW2_SKXCCM8_ULSGRO1_VWA2_VWB4_WGM1_WGMXCC1_WGMXCCGn1
    SolutionIndex: 112
    SolutionNameMin: Cijk_Ailk_Bljk_BBS_BH_UserArgs_MT256x128x64_MI16x16x1_SN_LDSB1_CLR1_GRVWA8_GRVWB8_GSU0_GSUC0_GSUWGMRR0_K1_LBSPPA4096_LBSPPB512_LPA0_LPB16_LRVW8_MIWT8_4_NEPBS16_PLR1_SU32_SUM0_SUS256_SVW4_SKXCCM0_ULSGRO0_VWA4_VWB4_WGM4_WGMXCC1_WGMXCCGn1
    SolutionIndex: 113
    SolutionNameMin: Cijk_Ailk_Bljk_BBS_BH_UserArgs_MT256x256x32_MI16x16x1_SN_LDSB1_CLR1_GRVWA8_GRVWB4_GSU0_GSUC0_GSUWGMRR0_K1_LBSPPA2048_LBSPPB128_LPA0_LPB4_LRVW4_MIWT8_8_NEPBS0_PLR1_SU32_SUM0_SUS256_SVW4_SKXCCM8_ULSGRO0_VWA4_VWB2_WGM4_WGMXCC1_WGMXCCGn1
    SolutionIndex: 114
    SolutionNameMin: Cijk_Ailk_Bljk_BBS_BH_UserArgs_MT32x32x128_MI16x16x1_SN_LDSB1_CLR1_GRVWA8_GRVWB8_GSU0_GSUC0_GSUWGMRR0_K1_LBSPPA512_LBSPPB256_LPA16_LPB16_LRVW8_MIWT1_1_NEPBS16_PLR1_SU32_SUM0_SUS256_SVW1_SKXCCM0_ULSGRO0_VWA1_VWB1_WGM1_WGMXCC1_WGMXCCGn1
    SolutionIndex: 115
    SolutionNameMin: Cijk_Ailk_Bljk_BBS_BH_UserArgs_MT64x32x128_MI16x16x1_SN_LDSB1_CLR1_GRVWA8_GRVWB8_GSU0_GSUC0_GSUWGMRR0_K1_LBSPPA1024_LBSPPB256_LPA32_LPB16_LRVW8_MIWT2_1_NEPBS16_PLR2_SU32_SUM0_SUS256_SVW2_SKXCCM8_ULSGRO1_VWA2_VWB1_WGM8_WGMXCC1_WGMXCCGn1
    SolutionIndex: 116
    SolutionNameMin: Cijk_Ailk_Bljk_BBS_BH_UserArgs_MT64x64x64_MI16x16x1_SN_LDSB1_CLR1_GRVWA8_GRVWB8_GSU0_GSUC0_GSUWGMRR0_K1_LBSPPA1024_LBSPPB256_LPA32_LPB16_LRVW8_MIWT2_2_NEPBS0_PLR1_SU32_SUM0_SUS256_SVW2_SKXCCM0_ULSGRO0_VWA2_VWB2_WGM1_WGMXCC1_WGMXCCGn1
    SolutionIndex: 117
    SolutionNameMin: Cijk_Ailk_Bljk_BBS_BH_UserArgs_MT64x64x64_MI16x16x1_SN_LDSB1_CLR1_GRVWA8_GRVWB8_GSU0_GSUC0_GSUWGMRR0_K1_LBSPPA1024_LBSPPB128_LPA32_LPB16_LRVW8_MIWT2_2_NEPBS16_PLR1_SU32_SUM0_SUS256_SVW2_SKXCCM8_ULSGRO0_VWA2_VWB1_WGM1_WGMXCC1_WGMXCCGn1
    SolutionIndex: 118
    SolutionNameMin: Cijk_Ailk_Bljk_BBS_BH_UserArgs_MT64x32x128_MI16x16x1_SN_LDSB1_CLR1_GRVWA8_GRVWB8_GSU0_GSUC0_GSUWGMRR0_K1_LBSPPA1024_LBSPPB256_LPA32_LPB16_LRVW8_MIWT2_1_NEPBS16_PLR2_SU32_SUM0_SUS256_SVW2_SKXCCM0_ULSGRO0_VWA2_VWB1_WGM1_WGMXCC1_WGMXCCGn1
    SolutionIndex: 119
    SolutionNameMin: Cijk_Ailk_Bljk_BBS_BH_UserArgs_MT64x64x128_MI16x16x1_SN_LDSB1_CLR1_GRVWA8_GRVWB8_GSU0_GSUC0_GSUWGMRR0_K1_LBSPPA1024_LBSPPB256_LPA32_LPB16_LRVW8_MIWT2_2_NEPBS0_PLR2_SU32_SUM0_SUS256_SVW2_SKXCCM8_ULSGRO1_VWA2_VWB1_WGM4_WGMXCC1_WGMXCCGn1
    SolutionIndex: 120
    SolutionNameMin: Cijk_Ailk_Bljk_BBS_BH_UserArgs_MT64x128x64_MI16x16x1_SN_LDSB1_CLR1_GRVWA8_GRVWB8_GSU0_GSUC0_GSUWGMRR0_K1_LBSPPA1024_LBSPPB128_LPA32_LPB16_LRVW8_MIWT2_4_NEPBS0_PLR1_SU32_SUM0_SUS256_SVW2_SKXCCM8_ULSGRO0_VWA2_VWB1_WGM1_WGMXCC1_WGMXCCGn1
    SolutionIndex: 121
    SolutionNameMin: Cijk_Ailk_Bljk_BBS_BH_UserArgs_MT64x64x128_MI16x16x1_SN_LDSB1_CLR1_GRVWA8_GRVWB8_GSU0_GSUC0_GSUWGMRR0_K1_LBSPPA1024_LBSPPB512_LPA32_LPB16_LRVW8_MIWT2_2_NEPBS0_PLR3_SU32_SUM0_SUS256_SVW2_SKXCCM0_ULSGRO0_VWA2_VWB2_WGM1_WGMXCC1_WGMXCCGn1
    SolutionIndex: 122
    SolutionNameMin: Cijk_Ailk_Bljk_BBS_BH_UserArgs_MT64x64x128_MI16x16x1_SN_LDSB1_CLR1_GRVWA8_GRVWB8_GSU0_GSUC0_GSUWGMRR0_K1_LBSPPA1024_LBSPPB256_LPA32_LPB16_LRVW8_MIWT2_2_NEPBS16_PLR2_SU32_SUM0_SUS256_SVW2_SKXCCM8_ULSGRO1_VWA2_VWB1_WGM4_WGMXCC1_WGMXCCGn1
    SolutionIndex: 123
    SolutionNameMin: Cijk_Ailk_Bljk_BBS_BH_UserArgs_MT64x128x64_MI16x16x1_SN_LDSB1_CLR1_GRVWA8_GRVWB8_GSU0_GSUC0_GSUWGMRR0_K1_LBSPPA1024_LBSPPB256_LPA32_LPB16_LRVW8_MIWT2_4_NEPBS16_PLR1_SU32_SUM0_SUS256_SVW2_SKXCCM8_ULSGRO0_VWA2_VWB2_WGM1_WGMXCC1_WGMXCCGn1
    SolutionIndex: 124
    SolutionNameMin: Cijk_Ailk_Bljk_BBS_BH_UserArgs_MT128x64x128_MI16x16x1_SN_LDSB1_CLR1_GRVWA8_GRVWB8_GSU0_GSUC0_GSUWGMRR0_K1_LBSPPA2048_LBSPPB256_LPA0_LPB16_LRVW8_MIWT4_2_NEPBS16_PLR1_SU32_SUM0_SUS256_SVW4_SKXCCM0_ULSGRO0_VWA4_VWB1_WGM8_WGMXCC1_WGMXCCGn1
    SolutionIndex: 125
    SolutionNameMin: Cijk_Ailk_Bljk_BBS_BH_UserArgs_MT128x64x128_MI16x16x1_SN_LDSB1_CLR1_GRVWA8_GRVWB8_GSU0_GSUC0_GSUWGMRR0_K1_LBSPPA2048_LBSPPB256_LPA0_LPB16_LRVW8_MIWT4_2_NEPBS16_PLR1_SU32_SUM0_SUS256_SVW4_SKXCCM0_ULSGRO0_VWA4_VWB1_WGM4_WGMXCC1_WGMXCCGn1
    SolutionIndex: 126
    SolutionNameMin: Cijk_Ailk_Bljk_BBS_BH_UserArgs_MT128x64x128_MI16x16x1_SN_LDSB1_CLR1_GRVWA8_GRVWB8_GSU0_GSUC0_GSUWGMRR0_K1_LBSPPA2048_LBSPPB512_LPA0_LPB16_LRVW8_MIWT4_2_NEPBS0_PLR2_SU32_SUM0_SUS256_SVW4_SKXCCM8_ULSGRO1_VWA4_VWB2_WGM1_WGMXCC1_WGMXCCGn1
    SolutionIndex: 127
    SolutionNameMin: Cijk_Ailk_Bljk_BBS_BH_UserArgs_MT128x64x128_MI16x16x1_SN_LDSB1_CLR1_GRVWA8_GRVWB8_GSU0_GSUC0_GSUWGMRR0_K1_LBSPPA2048_LBSPPB256_LPA0_LPB16_LRVW8_MIWT4_2_NEPBS0_PLR2_SU32_SUM0_SUS256_SVW4_SKXCCM8_ULSGRO1_VWA4_VWB1_WGM4_WGMXCC1_WGMXCCGn1
    SolutionIndex: 128
    SolutionNameMin: Cijk_Ailk_Bljk_BBS_BH_UserArgs_MT128x128x64_MI16x16x1_SN_LDSB1_CLR1_GRVWA8_GRVWB8_GSU0_GSUC0_GSUWGMRR0_K1_LBSPPA2048_LBSPPB512_LPA0_LPB16_LRVW8_MIWT4_4_NEPBS16_PLR1_SU32_SUM0_SUS256_SVW4_SKXCCM8_ULSGRO1_VWA4_VWB4_WGM4_WGMXCC1_WGMXCCGn1
    SolutionIndex: 129
    SolutionNameMin: Cijk_Ailk_Bljk_BBS_BH_UserArgs_MT128x128x64_MI16x16x1_SN_LDSB1_CLR1_GRVWA8_GRVWB8_GSU0_GSUC0_GSUWGMRR0_K1_LBSPPA2048_LBSPPB512_LPA0_LPB16_LRVW8_MIWT4_4_NEPBS0_PLR1_SU32_SUM0_SUS256_SVW4_SKXCCM8_ULSGRO0_VWA4_VWB4_WGM1_WGMXCC1_WGMXCCGn1
    SolutionIndex: 130
    SolutionNameMin: Cijk_Ailk_Bljk_BBS_BH_UserArgs_MT128x64x128_MI16x16x1_SN_LDSB1_CLR1_GRVWA8_GRVWB8_GSU0_GSUC0_GSUWGMRR0_K1_LBSPPA2048_LBSPPB256_LPA0_LPB16_LRVW8_MIWT4_2_NEPBS16_PLR1_SU32_SUM0_SUS256_SVW4_SKXCCM0_ULSGRO0_VWA4_VWB1_WGM1_WGMXCC1_WGMXCCGn1
    SolutionIndex: 131
    SolutionNameMin: Cijk_Ailk_Bljk_BBS_BH_UserArgs_MT128x64x64_MI16x16x1_SN_LDSB1_CLR1_GRVWA8_GRVWB8_GSU0_GSUC0_GSUWGMRR0_K1_LBSPPA2048_LBSPPB128_LPA0_LPB16_LRVW8_MIWT4_2_NEPBS0_PLR1_SU32_SUM0_SUS256_SVW4_SKXCCM8_ULSGRO0_VWA4_VWB1_WGM1_WGMXCC1_WGMXCCGn1
    SolutionIndex: 132
    SolutionNameMin: Cijk_Ailk_Bljk_BBS_BH_UserArgs_MT128x128x64_MI16x16x1_SN_LDSB1_CLR1_GRVWA8_GRVWB8_GSU0_GSUC0_GSUWGMRR0_K1_LBSPPA2048_LBSPPB128_LPA0_LPB16_LRVW8_MIWT4_4_NEPBS0_PLR1_SU32_SUM0_SUS256_SVW4_SKXCCM8_ULSGRO0_VWA4_VWB1_WGM8_WGMXCC1_WGMXCCGn1
    SolutionIndex: 133
    SolutionNameMin: Cijk_Ailk_Bljk_BBS_BH_UserArgs_MT128x128x64_MI16x16x1_SN_LDSB1_CLR1_GRVWA8_GRVWB8_GSU0_GSUC0_GSUWGMRR0_K1_LBSPPA2048_LBSPPB128_LPA0_LPB16_LRVW8_MIWT4_4_NEPBS0_PLR1_SU32_SUM0_SUS256_SVW4_SKXCCM8_ULSGRO0_VWA4_VWB1_WGM1_WGMXCC1_WGMXCCGn1
    SolutionIndex: 134
    SolutionNameMin: Cijk_Ailk_Bljk_BBS_BH_UserArgs_MT128x128x64_MI16x16x1_SN_LDSB1_CLR1_GRVWA8_GRVWB8_GSU0_GSUC0_GSUWGMRR0_K1_LBSPPA2048_LBSPPB256_LPA0_LPB16_LRVW8_MIWT4_4_NEPBS0_PLR1_SU32_SUM0_SUS256_SVW4_SKXCCM8_ULSGRO1_VWA4_VWB2_WGM1_WGMXCC1_WGMXCCGn1
    SolutionIndex: 135
    SolutionNameMin: Cijk_Ailk_Bljk_BBS_BH_UserArgs_MT128x256x64_MI16x16x1_SN_LDSB1_CLR1_GRVWA8_GRVWB8_GSU0_GSUC0_GSUWGMRR0_K1_LBSPPA2048_LBSPPB128_LPA0_LPB16_LRVW8_MIWT4_8_NEPBS0_PLR1_SU32_SUM0_SUS256_SVW4_SKXCCM8_ULSGRO0_VWA4_VWB1_WGM1_WGMXCC1_WGMXCCGn1
    SolutionIndex: 136
    SolutionNameMin: Cijk_Ailk_Bljk_BBS_BH_UserArgs_MT256x128x64_MI16x16x1_SN_LDSB1_CLR1_GRVWA8_GRVWB8_GSU0_GSUC0_GSUWGMRR0_K1_LBSPPA4096_LBSPPB128_LPA0_LPB16_LRVW8_MIWT8_4_NEPBS16_PLR1_SU32_SUM0_SUS256_SVW4_SKXCCM0_ULSGRO0_VWA4_VWB1_WGM8_WGMXCC1_WGMXCCGn1
    SolutionIndex: 137
    SolutionNameMin: Cijk_Ailk_Bljk_BBS_BH_UserArgs_MT128x128x64_MI16x16x1_SN_LDSB1_CLR1_GRVWA8_GRVWB8_GSU0_GSUC0_GSUWGMRR0_K1_LBSPPA2048_LBSPPB128_LPA0_LPB16_LRVW8_MIWT4_4_NEPBS0_PLR1_SU32_SUM0_SUS256_SVW4_SKXCCM8_ULSGRO0_VWA4_VWB1_WGM4_WGMXCC1_WGMXCCGn1
    SolutionIndex: 138
    SolutionNameMin: Cijk_Ailk_Bljk_BBS_BH_UserArgs_MT128x256x64_MI16x16x1_SN_LDSB1_CLR1_GRVWA8_GRVWB8_GSU0_GSUC0_GSUWGMRR0_K1_LBSPPA2048_LBSPPB512_LPA0_LPB16_LRVW8_MIWT4_8_NEPBS16_PLR1_SU32_SUM0_SUS256_SVW4_SKXCCM8_ULSGRO0_VWA4_VWB4_WGM1_WGMXCC1_WGMXCCGn1
    SolutionIndex: 139
    SolutionNameMin: Cijk_Ailk_Bljk_BBS_BH_UserArgs_MT256x256x32_MI16x16x1_SN_LDSB1_CLR1_GRVWA8_GRVWB4_GSU0_GSUC0_GSUWGMRR0_K1_LBSPPA2048_LBSPPB256_LPA0_LPB4_LRVW4_MIWT8_8_NEPBS16_PLR1_SU32_SUM0_SUS256_SVW4_SKXCCM8_ULSGRO0_VWA4_VWB4_WGM4_WGMXCC1_WGMXCCGn1
    SolutionIndex: 140
    SolutionNameMin: Cijk_Ailk_Bljk_BBS_BH_UserArgs_MT128x256x64_MI16x16x1_SN_LDSB1_CLR1_GRVWA8_GRVWB8_GSU0_GSUC0_GSUWGMRR0_K1_LBSPPA2048_LBSPPB256_LPA32_LPB16_LRVW8_MIWT4_8_NEPBS16_PLR1_SU32_SUM0_SUS256_SVW2_SKXCCM0_ULSGRO0_VWA2_VWB2_WGM8_WGMXCC1_WGMXCCGn1
    SolutionIndex: 141
    SolutionNameMin: Cijk_Ailk_Bljk_BBS_BH_UserArgs_MT128x256x64_MI16x16x1_SN_LDSB1_CLR1_GRVWA8_GRVWB8_GSU0_GSUC0_GSUWGMRR0_K1_LBSPPA2048_LBSPPB128_LPA0_LPB16_LRVW8_MIWT4_8_NEPBS16_PLR1_SU32_SUM0_SUS256_SVW4_SKXCCM8_ULSGRO1_VWA4_VWB1_WGM1_WGMXCC1_WGMXCCGn1
    SolutionIndex: 142
    SolutionNameMin: Cijk_Ailk_Bljk_BBS_BH_UserArgs_MT128x256x64_MI16x16x1_SN_LDSB1_CLR1_GRVWA8_GRVWB8_GSU0_GSUC0_GSUWGMRR0_K1_LBSPPA2048_LBSPPB256_LPA0_LPB16_LRVW8_MIWT4_8_NEPBS16_PLR1_SU32_SUM0_SUS256_SVW4_SKXCCM8_ULSGRO0_VWA4_VWB2_WGM1_WGMXCC1_WGMXCCGn1
    SolutionIndex: 143
    SolutionNameMin: Cijk_Ailk_Bljk_BBS_BH_UserArgs_MT256x256x32_MI16x16x1_SN_LDSB1_CLR1_GRVWA8_GRVWB4_GSU0_GSUC0_GSUWGMRR0_K1_LBSPPA2048_LBSPPB128_LPA0_LPB4_LRVW4_MIWT8_8_NEPBS16_PLR1_SU32_SUM0_SUS256_SVW4_SKXCCM8_ULSGRO0_VWA4_VWB2_WGM4_WGMXCC1_WGMXCCGn1
    SolutionIndex: 144
    SolutionNameMin: Cijk_Ailk_Bljk_BBS_BH_UserArgs_MT128x128x64_MI16x16x1_SN_LDSB1_CLR1_GRVWA8_GRVWB8_GSU0_GSUC0_GSUWGMRR0_K1_LBSPPA2048_LBSPPB128_LPA0_LPB16_LRVW8_MIWT4_4_NEPBS0_PLR1_SU32_SUM0_SUS256_SVW4_SKXCCM8_ULSGRO1_VWA4_VWB1_WGM4_WGMXCC1_WGMXCCGn1
    SolutionIndex: 145
    SolutionNameMin: Cijk_Ailk_Bljk_BBS_BH_UserArgs_MT64x32x128_MI16x16x1_SN_LDSB1_CLR1_GRVWA8_GRVWB8_GSU0_GSUC0_GSUWGMRR0_K1_LBSPPA1024_LBSPPB256_LPA32_LPB16_LRVW8_MIWT2_1_NEPBS0_PLR2_SU32_SUM0_SUS256_SVW2_SKXCCM8_ULSGRO0_VWA2_VWB1_WGM4_WGMXCC1_WGMXCCGn1
    SolutionIndex: 146
    SolutionNameMin: Cijk_Ailk_Bljk_BBS_BH_UserArgs_MT64x128x64_MI16x16x1_SN_LDSB1_CLR1_GRVWA8_GRVWB8_GSU0_GSUC0_GSUWGMRR0_K1_LBSPPA1024_LBSPPB128_LPA32_LPB16_LRVW8_MIWT2_4_NEPBS16_PLR1_SU32_SUM0_SUS256_SVW2_SKXCCM0_ULSGRO1_VWA2_VWB1_WGM1_WGMXCC1_WGMXCCGn1
    SolutionIndex: 147
    SolutionNameMin: Cijk_Ailk_Bljk_BBS_BH_UserArgs_MT64x64x128_MI16x16x1_SN_LDSB1_CLR1_GRVWA8_GRVWB8_GSU0_GSUC0_GSUWGMRR0_K1_LBSPPA1024_LBSPPB256_LPA32_LPB16_LRVW8_MIWT2_2_NEPBS16_PLR2_SU32_SUM0_SUS256_SVW2_SKXCCM0_ULSGRO1_VWA2_VWB1_WGM1_WGMXCC1_WGMXCCGn1
    SolutionIndex: 148
    SolutionNameMin: Cijk_Ailk_Bljk_BBS_BH_UserArgs_MT64x64x128_MI16x16x1_SN_LDSB1_CLR1_GRVWA8_GRVWB8_GSU0_GSUC0_GSUWGMRR0_K1_LBSPPA1024_LBSPPB512_LPA32_LPB16_LRVW8_MIWT2_2_NEPBS0_PLR1_SU32_SUM0_SUS256_SVW2_SKXCCM8_ULSGRO0_VWA2_VWB2_WGM1_WGMXCC1_WGMXCCGn1
    SolutionIndex: 149
    SolutionNameMin: Cijk_Ailk_Bljk_BBS_BH_UserArgs_MT64x64x128_MI16x16x1_SN_LDSB1_CLR1_GRVWA8_GRVWB8_GSU0_GSUC0_GSUWGMRR0_K1_LBSPPA1024_LBSPPB256_LPA32_LPB16_LRVW8_MIWT2_2_NEPBS0_PLR2_SU32_SUM0_SUS256_SVW2_SKXCCM8_ULSGRO0_VWA2_VWB1_WGM4_WGMXCC1_WGMXCCGn1
    SolutionIndex: 150
    SolutionNameMin: Cijk_Ailk_Bljk_BBS_BH_UserArgs_MT64x128x64_MI16x16x1_SN_LDSB1_CLR1_GRVWA8_GRVWB8_GSU0_GSUC0_GSUWGMRR0_K1_LBSPPA1024_LBSPPB256_LPA32_LPB16_LRVW8_MIWT2_4_NEPBS0_PLR1_SU32_SUM0_SUS256_SVW2_SKXCCM8_ULSGRO0_VWA2_VWB2_WGM1_WGMXCC1_WGMXCCGn1
    SolutionIndex: 151
    SolutionNameMin: Cijk_Ailk_Bljk_BBS_BH_UserArgs_MT128x64x128_MI16x16x1_SN_LDSB1_CLR1_GRVWA8_GRVWB8_GSU0_GSUC0_GSUWGMRR0_K1_LBSPPA2048_LBSPPB256_LPA0_LPB16_LRVW8_MIWT4_2_NEPBS16_PLR1_SU32_SUM0_SUS256_SVW4_SKXCCM0_ULSGRO1_VWA4_VWB1_WGM4_WGMXCC1_WGMXCCGn1
    SolutionIndex: 152
    SolutionNameMin: Cijk_Ailk_Bljk_BBS_BH_UserArgs_MT64x128x128_MI16x16x1_SN_LDSB1_CLR1_GRVWA8_GRVWB8_GSU0_GSUC0_GSUWGMRR0_K1_LBSPPA1024_LBSPPB256_LPA32_LPB16_LRVW8_MIWT2_4_NEPBS0_PLR2_SU32_SUM0_SUS256_SVW2_SKXCCM8_ULSGRO1_VWA2_VWB1_WGM1_WGMXCC1_WGMXCCGn1
    SolutionIndex: 153
    SolutionNameMin: Cijk_Ailk_Bljk_BBS_BH_UserArgs_MT128x128x64_MI16x16x1_SN_LDSB1_CLR1_GRVWA8_GRVWB8_GSU0_GSUC0_GSUWGMRR0_K1_LBSPPA2048_LBSPPB256_LPA0_LPB16_LRVW8_MIWT4_4_NEPBS0_PLR1_SU32_SUM0_SUS256_SVW4_SKXCCM8_ULSGRO0_VWA4_VWB2_WGM8_WGMXCC1_WGMXCCGn1
    SolutionIndex: 154
    SolutionNameMin: Cijk_Ailk_Bljk_BBS_BH_UserArgs_MT128x128x64_MI16x16x1_SN_LDSB1_CLR1_GRVWA8_GRVWB8_GSU0_GSUC0_GSUWGMRR0_K1_LBSPPA2048_LBSPPB512_LPA0_LPB16_LRVW8_MIWT4_4_NEPBS0_PLR1_SU32_SUM0_SUS256_SVW4_SKXCCM8_ULSGRO1_VWA4_VWB4_WGM1_WGMXCC1_WGMXCCGn1
    SolutionIndex: 155
    SolutionNameMin: Cijk_Ailk_Bljk_BBS_BH_UserArgs_MT128x64x64_MI16x16x1_SN_LDSB1_CLR1_GRVWA8_GRVWB8_GSU0_GSUC0_GSUWGMRR0_K1_LBSPPA2048_LBSPPB128_LPA0_LPB16_LRVW8_MIWT4_2_NEPBS16_PLR1_SU32_SUM0_SUS256_SVW4_SKXCCM8_ULSGRO0_VWA4_VWB1_WGM8_WGMXCC1_WGMXCCGn1
    SolutionIndex: 156
    SolutionNameMin: Cijk_Ailk_Bljk_BBS_BH_UserArgs_MT128x128x64_MI16x16x1_SN_LDSB1_CLR1_GRVWA8_GRVWB8_GSU0_GSUC0_GSUWGMRR0_K1_LBSPPA2048_LBSPPB128_LPA0_LPB16_LRVW8_MIWT4_4_NEPBS16_PLR1_SU32_SUM0_SUS256_SVW4_SKXCCM8_ULSGRO1_VWA4_VWB1_WGM8_WGMXCC1_WGMXCCGn1
    SolutionIndex: 157
    SolutionNameMin: Cijk_Ailk_Bljk_BBS_BH_UserArgs_MT128x256x64_MI16x16x1_SN_LDSB1_CLR1_GRVWA8_GRVWB8_GSU0_GSUC0_GSUWGMRR0_K1_LBSPPA2048_LBSPPB128_LPA0_LPB16_LRVW8_MIWT4_8_NEPBS16_PLR1_SU32_SUM0_SUS256_SVW4_SKXCCM8_ULSGRO0_VWA4_VWB1_WGM8_WGMXCC1_WGMXCCGn1
    SolutionIndex: 158
    SolutionNameMin: Cijk_Ailk_Bljk_BBS_BH_UserArgs_MT128x128x64_MI16x16x1_SN_LDSB1_CLR1_GRVWA8_GRVWB8_GSU0_GSUC0_GSUWGMRR0_K1_LBSPPA2048_LBSPPB256_LPA0_LPB16_LRVW8_MIWT4_4_NEPBS16_PLR1_SU32_SUM0_SUS256_SVW4_SKXCCM0_ULSGRO0_VWA4_VWB2_WGM4_WGMXCC1_WGMXCCGn1
    SolutionIndex: 159
    SolutionNameMin: Cijk_Ailk_Bljk_BBS_BH_UserArgs_MT128x128x64_MI16x16x1_SN_LDSB1_CLR1_GRVWA8_GRVWB8_GSU0_GSUC0_GSUWGMRR0_K1_LBSPPA2048_LBSPPB128_LPA0_LPB16_LRVW8_MIWT4_4_NEPBS16_PLR1_SU32_SUM0_SUS256_SVW4_SKXCCM8_ULSGRO1_VWA4_VWB1_WGM4_WGMXCC1_WGMXCCGn1
    SolutionIndex: 160
    SolutionNameMin: Cijk_Ailk_Bljk_BBS_BH_UserArgs_MT128x256x64_MI16x16x1_SN_LDSB1_CLR1_GRVWA8_GRVWB8_GSU0_GSUC0_GSUWGMRR0_K1_LBSPPA2048_LBSPPB1024_LPA0_LPB16_LRVW8_MIWT4_8_NEPBS0_PLR1_SU32_SUM0_SUS256_SVW4_SKXCCM8_ULSGRO1_VWA4_VWB8_WGM1_WGMXCC1_WGMXCCGn1
    SolutionIndex: 161
    SolutionNameMin: Cijk_Ailk_Bljk_BBS_BH_UserArgs_MT128x256x64_MI16x16x1_SN_LDSB1_CLR1_GRVWA8_GRVWB8_GSU0_GSUC0_GSUWGMRR0_K1_LBSPPA2048_LBSPPB1024_LPA0_LPB16_LRVW8_MIWT4_8_NEPBS16_PLR1_SU32_SUM0_SUS256_SVW4_SKXCCM8_ULSGRO1_VWA4_VWB8_WGM1_WGMXCC1_WGMXCCGn1
    SolutionIndex: 162
    SolutionNameMin: Cijk_Ailk_Bljk_BBS_BH_UserArgs_MT256x256x32_MI16x16x1_SN_LDSB1_CLR1_GRVWA8_GRVWB4_GSU0_GSUC0_GSUWGMRR0_K1_LBSPPA2048_LBSPPB512_LPA0_LPB4_LRVW4_MIWT8_8_NEPBS16_PLR1_SU32_SUM0_SUS256_SVW4_SKXCCM8_ULSGRO0_VWA4_VWB8_WGM8_WGMXCC1_WGMXCCGn1
    SolutionIndex: 163
    SolutionNameMin: Cijk_Ailk_Bljk_BBS_BH_UserArgs_MT128x128x64_MI16x16x1_SN_LDSB1_CLR1_GRVWA8_GRVWB8_GSU0_GSUC0_GSUWGMRR0_K1_LBSPPA2048_LBSPPB128_LPA0_LPB16_LRVW8_MIWT4_4_NEPBS16_PLR1_SU32_SUM0_SUS256_SVW4_SKXCCM8_ULSGRO0_VWA4_VWB1_WGM8_WGMXCC1_WGMXCCGn1
    SolutionIndex: 164
    SolutionNameMin: Cijk_Ailk_Bljk_BBS_BH_UserArgs_MT128x128x64_MI16x16x1_SN_LDSB1_CLR1_GRVWA8_GRVWB8_GSU0_GSUC0_GSUWGMRR0_K1_LBSPPA2048_LBSPPB128_LPA0_LPB16_LRVW8_MIWT4_4_NEPBS16_PLR1_SU32_SUM0_SUS256_SVW4_SKXCCM8_ULSGRO0_VWA4_VWB1_WGM4_WGMXCC1_WGMXCCGn1
    SolutionIndex: 165
    SolutionNameMin: Cijk_Ailk_Bljk_BBS_BH_UserArgs_MT256x128x64_MI16x16x1_SN_LDSB1_CLR1_GRVWA8_GRVWB8_GSU0_GSUC0_GSUWGMRR0_K1_LBSPPA4096_LBSPPB128_LPA0_LPB16_LRVW8_MIWT8_4_NEPBS16_PLR1_SU32_SUM0_SUS256_SVW4_SKXCCM8_ULSGRO0_VWA4_VWB1_WGM8_WGMXCC1_WGMXCCGn1
    SolutionIndex: 166
    SolutionNameMin: Cijk_Ailk_Bljk_BBS_BH_UserArgs_MT256x256x32_MI16x16x1_SN_LDSB1_CLR1_GRVWA4_GRVWB4_GSU0_GSUC0_GSUWGMRR0_K1_LBSPPA2048_LBSPPB128_LPA0_LPB4_LRVW4_MIWT8_8_NEPBS0_PLR1_SU32_SUM0_SUS256_SVW4_SKXCCM8_ULSGRO1_VWA4_VWB1_WGM1_WGMXCC1_WGMXCCGn1
    SolutionIndex: 167
    SolutionNameMin: Cijk_Ailk_Bljk_BBS_BH_UserArgs_MT256x256x32_MI16x16x1_SN_LDSB1_CLR1_GRVWA8_GRVWB4_GSU0_GSUC0_GSUWGMRR0_K1_LBSPPA2048_LBSPPB128_LPA0_LPB4_LRVW4_MIWT8_8_NEPBS16_PLR1_SU32_SUM0_SUS256_SVW4_SKXCCM8_ULSGRO0_VWA4_VWB1_WGM1_WGMXCC1_WGMXCCGn1
    SolutionIndex: 168
    SolutionNameMin: Cijk_Ailk_Bljk_BBS_BH_UserArgs_MT128x256x64_MI16x16x1_SN_LDSB1_CLR1_GRVWA8_GRVWB8_GSU0_GSUC0_GSUWGMRR0_K1_LBSPPA2048_LBSPPB128_LPA0_LPB16_LRVW8_MIWT4_8_NEPBS0_PLR1_SU32_SUM0_SUS256_SVW4_SKXCCM8_ULSGRO0_VWA4_VWB1_WGM4_WGMXCC1_WGMXCCGn1
    SolutionIndex: 169
    SolutionNameMin: Cijk_Ailk_Bljk_BBS_BH_UserArgs_MT256x256x32_MI16x16x1_SN_LDSB1_CLR1_GRVWA4_GRVWB4_GSU0_GSUC0_GSUWGMRR0_K1_LBSPPA2048_LBSPPB256_LPA0_LPB4_LRVW4_MIWT8_8_NEPBS0_PLR1_SU32_SUM0_SUS256_SVW4_SKXCCM8_ULSGRO1_VWA4_VWB4_WGM1_WGMXCC1_WGMXCCGn1
    SolutionIndex: 170
    SolutionNameMin: Cijk_Ailk_Bljk_BBS_BH_UserArgs_MT256x256x32_MI16x16x1_SN_LDSB1_CLR1_GRVWA8_GRVWB4_GSU0_GSUC0_GSUWGMRR0_K1_LBSPPA2048_LBSPPB128_LPA0_LPB4_LRVW4_MIWT8_8_NEPBS0_PLR1_SU32_SUM0_SUS256_SVW4_SKXCCM8_ULSGRO0_VWA4_VWB2_WGM1_WGMXCC1_WGMXCCGn1
    SolutionIndex: 171
    SolutionNameMin: Cijk_Ailk_Bljk_BBS_BH_UserArgs_MT256x256x32_MI16x16x1_SN_LDSB1_CLR1_GRVWA8_GRVWB4_GSU0_GSUC0_GSUWGMRR0_K1_LBSPPA2048_LBSPPB512_LPA0_LPB4_LRVW4_MIWT8_8_NEPBS16_PLR1_SU32_SUM0_SUS256_SVW4_SKXCCM8_ULSGRO0_VWA4_VWB8_WGM1_WGMXCC1_WGMXCCGn1
    SolutionIndex: 172
    SolutionNameMin: Cijk_Ailk_Bljk_BBS_BH_UserArgs_MT128x32x128_MI16x16x1_SN_LDSB1_CLR1_GRVWA8_GRVWB8_GSU0_GSUC0_GSUWGMRR0_K1_LBSPPA2048_LBSPPB256_LPA0_LPB16_LRVW8_MIWT4_1_NEPBS0_PLR2_SU32_SUM0_SUS256_SVW4_SKXCCM8_ULSGRO0_VWA4_VWB1_WGM1_WGMXCC1_WGMXCCGn1
    SolutionIndex: 173
    SolutionNameMin: Cijk_Ailk_Bljk_BBS_BH_UserArgs_MT64x64x128_MI16x16x1_SN_LDSB1_CLR1_GRVWA8_GRVWB8_GSU0_GSUC0_GSUWGMRR0_K1_LBSPPA1024_LBSPPB256_LPA32_LPB16_LRVW8_MIWT2_2_NEPBS16_PLR2_SU32_SUM0_SUS256_SVW2_SKXCCM8_ULSGRO1_VWA2_VWB1_WGM8_WGMXCC1_WGMXCCGn1
    SolutionIndex: 174
    SolutionNameMin: Cijk_Ailk_Bljk_BBS_BH_UserArgs_MT64x128x128_MI16x16x1_SN_LDSB1_CLR1_GRVWA8_GRVWB8_GSU0_GSUC0_GSUWGMRR0_K1_LBSPPA1024_LBSPPB512_LPA32_LPB16_LRVW8_MIWT2_4_NEPBS16_PLR2_SU32_SUM0_SUS256_SVW2_SKXCCM0_ULSGRO0_VWA2_VWB2_WGM4_WGMXCC1_WGMXCCGn1
    SolutionIndex: 175
    SolutionNameMin: Cijk_Ailk_Bljk_BBS_BH_UserArgs_MT64x128x128_MI16x16x1_SN_LDSB1_CLR1_GRVWA8_GRVWB8_GSU0_GSUC0_GSUWGMRR0_K1_LBSPPA1024_LBSPPB256_LPA32_LPB16_LRVW8_MIWT2_4_NEPBS16_PLR2_SU32_SUM0_SUS256_SVW2_SKXCCM8_ULSGRO0_VWA2_VWB1_WGM1_WGMXCC1_WGMXCCGn1
    SolutionIndex: 176
    SolutionNameMin: Cijk_Ailk_Bljk_BBS_BH_UserArgs_MT64x128x128_MI16x16x1_SN_LDSB1_CLR1_GRVWA8_GRVWB8_GSU0_GSUC0_GSUWGMRR0_K1_LBSPPA1024_LBSPPB256_LPA32_LPB16_LRVW8_MIWT2_4_NEPBS16_PLR3_SU32_SUM0_SUS256_SVW2_SKXCCM8_ULSGRO1_VWA2_VWB1_WGM4_WGMXCC1_WGMXCCGn1
    SolutionIndex: 177
    SolutionNameMin: Cijk_Ailk_Bljk_BBS_BH_UserArgs_MT128x128x64_MI16x16x1_SN_LDSB1_CLR1_GRVWA8_GRVWB8_GSU0_GSUC0_GSUWGMRR0_K1_LBSPPA2048_LBSPPB256_LPA0_LPB16_LRVW8_MIWT4_4_NEPBS0_PLR1_SU32_SUM0_SUS256_SVW4_SKXCCM0_ULSGRO0_VWA4_VWB2_WGM1_WGMXCC1_WGMXCCGn1
    SolutionIndex: 178
    SolutionNameMin: Cijk_Ailk_Bljk_BBS_BH_UserArgs_MT128x64x128_MI16x16x1_SN_LDSB1_CLR1_GRVWA8_GRVWB8_GSU0_GSUC0_GSUWGMRR0_K1_LBSPPA2048_LBSPPB512_LPA0_LPB16_LRVW8_MIWT4_2_NEPBS16_PLR1_SU32_SUM0_SUS256_SVW4_SKXCCM8_ULSGRO0_VWA4_VWB2_WGM8_WGMXCC1_WGMXCCGn1
    SolutionIndex: 179
    SolutionNameMin: Cijk_Ailk_Bljk_BBS_BH_UserArgs_MT128x256x64_MI16x16x1_SN_LDSB1_CLR1_GRVWA8_GRVWB8_GSU0_GSUC0_GSUWGMRR0_K1_LBSPPA2048_LBSPPB512_LPA0_LPB16_LRVW8_MIWT4_8_NEPBS0_PLR1_SU32_SUM0_SUS256_SVW4_SKXCCM0_ULSGRO1_VWA4_VWB4_WGM8_WGMXCC1_WGMXCCGn1
    SolutionIndex: 180
    SolutionNameMin: Cijk_Ailk_Bljk_BBS_BH_UserArgs_MT128x128x64_MI16x16x1_SN_LDSB1_CLR1_GRVWA8_GRVWB8_GSU0_GSUC0_GSUWGMRR0_K1_LBSPPA2048_LBSPPB256_LPA0_LPB16_LRVW8_MIWT4_4_NEPBS16_PLR1_SU32_SUM0_SUS256_SVW4_SKXCCM0_ULSGRO1_VWA4_VWB2_WGM4_WGMXCC1_WGMXCCGn1
    SolutionIndex: 181
    SolutionNameMin: Cijk_Ailk_Bljk_BBS_BH_UserArgs_MT128x128x64_MI16x16x1_SN_LDSB1_CLR1_GRVWA8_GRVWB8_GSU0_GSUC0_GSUWGMRR0_K1_LBSPPA2048_LBSPPB512_LPA0_LPB16_LRVW8_MIWT4_4_NEPBS16_PLR1_SU32_SUM0_SUS256_SVW4_SKXCCM8_ULSGRO1_VWA4_VWB4_WGM8_WGMXCC1_WGMXCCGn1
    SolutionIndex: 182
    SolutionNameMin: Cijk_Ailk_Bljk_BBS_BH_UserArgs_MT128x256x64_MI16x16x1_SN_LDSB1_CLR1_GRVWA8_GRVWB8_GSU0_GSUC0_GSUWGMRR0_K1_LBSPPA2048_LBSPPB256_LPA0_LPB16_LRVW8_MIWT4_8_NEPBS16_PLR1_SU32_SUM0_SUS256_SVW4_SKXCCM8_ULSGRO1_VWA4_VWB2_WGM1_WGMXCC1_WGMXCCGn1
    SolutionIndex: 183
    SolutionNameMin: Cijk_Ailk_Bljk_BBS_BH_UserArgs_MT128x256x64_MI16x16x1_SN_LDSB1_CLR1_GRVWA8_GRVWB8_GSU0_GSUC0_GSUWGMRR0_K1_LBSPPA2048_LBSPPB128_LPA0_LPB16_LRVW8_MIWT4_8_NEPBS0_PLR1_SU32_SUM0_SUS256_SVW4_SKXCCM0_ULSGRO0_VWA4_VWB1_WGM1_WGMXCC1_WGMXCCGn1
    SolutionIndex: 184
    SolutionNameMin: Cijk_Ailk_Bljk_BBS_BH_UserArgs_MT128x128x64_MI16x16x1_SN_LDSB1_CLR1_GRVWA8_GRVWB8_GSU0_GSUC0_GSUWGMRR0_K1_LBSPPA2048_LBSPPB256_LPA0_LPB16_LRVW8_MIWT4_4_NEPBS16_PLR1_SU32_SUM0_SUS256_SVW4_SKXCCM8_ULSGRO0_VWA4_VWB2_WGM8_WGMXCC1_WGMXCCGn1
    SolutionIndex: 185
    SolutionNameMin: Cijk_Ailk_Bljk_BBS_BH_UserArgs_MT128x128x64_MI16x16x1_SN_LDSB1_CLR1_GRVWA8_GRVWB8_GSU0_GSUC0_GSUWGMRR0_K1_LBSPPA2048_LBSPPB256_LPA0_LPB16_LRVW8_MIWT4_4_NEPBS16_PLR1_SU32_SUM0_SUS256_SVW4_SKXCCM8_ULSGRO1_VWA4_VWB2_WGM4_WGMXCC1_WGMXCCGn1
    SolutionIndex: 186
    SolutionNameMin: Cijk_Ailk_Bljk_BBS_BH_UserArgs_MT256x128x32_MI16x16x1_SN_LDSB1_CLR1_GRVWA8_GRVWB4_GSU0_GSUC0_GSUWGMRR0_K1_LBSPPA2048_LBSPPB128_LPA0_LPB4_LRVW4_MIWT8_4_NEPBS0_PLR1_SU32_SUM0_SUS256_SVW4_SKXCCM8_ULSGRO0_VWA4_VWB1_WGM8_WGMXCC1_WGMXCCGn1
    SolutionIndex: 187
    SolutionNameMin: Cijk_Ailk_Bljk_BBS_BH_UserArgs_MT128x256x64_MI16x16x1_SN_LDSB1_CLR1_GRVWA8_GRVWB8_GSU0_GSUC0_GSUWGMRR0_K1_LBSPPA2048_LBSPPB1024_LPA0_LPB16_LRVW8_MIWT4_8_NEPBS0_PLR1_SU32_SUM0_SUS256_SVW4_SKXCCM8_ULSGRO0_VWA4_VWB8_WGM1_WGMXCC1_WGMXCCGn1
    SolutionIndex: 188
    SolutionNameMin: Cijk_Ailk_Bljk_BBS_BH_UserArgs_MT256x256x32_MI16x16x1_SN_LDSB1_CLR1_GRVWA8_GRVWB4_GSU0_GSUC0_GSUWGMRR0_K1_LBSPPA2048_LBSPPB512_LPA0_LPB4_LRVW4_MIWT8_8_NEPBS0_PLR1_SU32_SUM0_SUS256_SVW4_SKXCCM8_ULSGRO0_VWA4_VWB8_WGM1_WGMXCC1_WGMXCCGn1
    SolutionIndex: 189
    SolutionNameMin: Cijk_Ailk_Bljk_BBS_BH_UserArgs_MT256x128x32_MI16x16x1_SN_LDSB1_CLR1_GRVWA8_GRVWB4_GSU0_GSUC0_GSUWGMRR0_K1_LBSPPA2048_LBSPPB128_LPA0_LPB4_LRVW4_MIWT8_4_NEPBS16_PLR1_SU32_SUM0_SUS256_SVW4_SKXCCM8_ULSGRO0_VWA4_VWB1_WGM8_WGMXCC1_WGMXCCGn1
    SolutionIndex: 190
    SolutionNameMin: Cijk_Ailk_Bljk_BBS_BH_UserArgs_MT128x256x64_MI16x16x1_SN_LDSB1_CLR1_GRVWA8_GRVWB8_GSU0_GSUC0_GSUWGMRR0_K1_LBSPPA2048_LBSPPB256_LPA0_LPB16_LRVW8_MIWT4_8_NEPBS0_PLR1_SU32_SUM0_SUS256_SVW4_SKXCCM8_ULSGRO1_VWA4_VWB2_WGM4_WGMXCC1_WGMXCCGn1
    SolutionIndex: 191
    SolutionNameMin: Cijk_Ailk_Bljk_BBS_BH_UserArgs_MT256x128x32_MI16x16x1_SN_LDSB1_CLR1_GRVWA8_GRVWB4_GSU0_GSUC0_GSUWGMRR0_K1_LBSPPA2048_LBSPPB128_LPA0_LPB4_LRVW4_MIWT8_4_NEPBS16_PLR1_SU32_SUM0_SUS256_SVW4_SKXCCM8_ULSGRO0_VWA4_VWB2_WGM4_WGMXCC1_WGMXCCGn1
    SolutionIndex: 192
    SolutionNameMin: Cijk_Ailk_Bljk_BBS_BH_UserArgs_MT256x128x64_MI16x16x1_SN_LDSB1_CLR1_GRVWA8_GRVWB8_GSU0_GSUC0_GSUWGMRR0_K1_LBSPPA4096_LBSPPB128_LPA0_LPB16_LRVW8_MIWT8_4_NEPBS16_PLR1_SU32_SUM0_SUS256_SVW4_SKXCCM8_ULSGRO1_VWA4_VWB1_WGM4_WGMXCC1_WGMXCCGn1
    SolutionIndex: 193
    SolutionNameMin: Cijk_Ailk_Bljk_BBS_BH_UserArgs_MT256x128x32_MI16x16x1_SN_LDSB1_CLR1_GRVWA8_GRVWB4_GSU0_GSUC0_GSUWGMRR0_K1_LBSPPA2048_LBSPPB256_LPA0_LPB4_LRVW4_MIWT8_4_NEPBS0_PLR1_SU32_SUM0_SUS256_SVW4_SKXCCM8_ULSGRO0_VWA4_VWB4_WGM8_WGMXCC1_WGMXCCGn1
    SolutionIndex: 194
    SolutionNameMin: Cijk_Ailk_Bljk_BBS_BH_UserArgs_MT256x256x32_MI16x16x1_SN_LDSB1_CLR1_GRVWA8_GRVWB4_GSU0_GSUC0_GSUWGMRR0_K1_LBSPPA2048_LBSPPB512_LPA0_LPB4_LRVW4_MIWT8_8_NEPBS0_PLR1_SU32_SUM0_SUS256_SVW4_SKXCCM8_ULSGRO0_VWA4_VWB8_WGM4_WGMXCC1_WGMXCCGn1
    SolutionIndex: 195
    SolutionNameMin: Cijk_Ailk_Bljk_BBS_BH_UserArgs_MT256x256x32_MI16x16x1_SN_LDSB1_CLR1_GRVWA8_GRVWB4_GSU0_GSUC0_GSUWGMRR0_K1_LBSPPA2048_LBSPPB512_LPA0_LPB4_LRVW4_MIWT8_8_NEPBS16_PLR1_SU32_SUM0_SUS256_SVW4_SKXCCM8_ULSGRO0_VWA4_VWB8_WGM4_WGMXCC1_WGMXCCGn1
- - - [128, 128, 1, 128]
    - [35, 0.083]
  - - [128, 128, 1, 256]
    - [8, 0.105]
  - - [128, 128, 1, 512]
    - [23, 0.178]
  - - [128, 128, 1, 1024]
    - [39, 0.276]
  - - [128, 128, 1, 2048]
    - [38, 0.35]
  - - [128, 128, 1, 4096]
    - [43, 0.549]
  - - [128, 128, 1, 8192]
    - [48, 1.071]
  - - [128, 256, 1, 128]
    - [8, 0.168]
  - - [128, 256, 1, 256]
    - [7, 0.206]
  - - [128, 256, 1, 512]
    - [8, 0.35]
  - - [128, 256, 1, 1024]
    - [60, 0.534]
  - - [128, 256, 1, 2048]
    - [24, 0.822]
  - - [128, 256, 1, 4096]
    - [29, 1.544]
  - - [128, 256, 1, 8192]
    - [39, 2.852]
  - - [128, 512, 1, 128]
    - [6, 0.331]
  - - [128, 512, 1, 256]
    - [40, 0.393]
  - - [128, 512, 1, 512]
    - [59, 0.671]
  - - [128, 512, 1, 1024]
    - [38, 1.1]
  - - [128, 512, 1, 2048]
    - [10, 2.012]
  - - [128, 512, 1, 4096]
    - [30, 3.414]
  - - [128, 512, 1, 8192]
    - [63, 5.559]
  - - [128, 1024, 1, 128]
    - [9, 0.65]
  - - [128, 1024, 1, 256]
    - [7, 0.767]
  - - [128, 1024, 1, 512]
    - [38, 1.397]
  - - [128, 1024, 1, 1024]
    - [38, 2.274]
  - - [128, 1024, 1, 2048]
    - [22, 3.83]
  - - [128, 1024, 1, 4096]
    - [64, 6.123]
  - - [128, 1024, 1, 8192]
    - [36, 8.528]
  - - [128, 2048, 1, 128]
    - [20, 1.259]
  - - [128, 2048, 1, 256]
    - [18, 1.594]
  - - [128, 2048, 1, 512]
    - [59, 2.605]
  - - [128, 2048, 1, 1024]
    - [62, 4.135]
  - - [128, 2048, 1, 2048]
    - [28, 6.726]
  - - [128, 2048, 1, 4096]
    - [37, 10.033]
  - - [128, 2048, 1, 8192]
    - [47, 12.289]
  - - [128, 4096, 1, 128]
    - [17, 2.371]
  - - [128, 4096, 1, 256]
    - [17, 2.968]
  - - [128, 4096, 1, 512]
    - [35, 4.618]
  - - [128, 4096, 1, 1024]
    - [55, 7.279]
  - - [128, 4096, 1, 2048]
    - [58, 10.571]
  - - [128, 4096, 1, 4096]
    - [54, 13.615]
  - - [128, 4096, 1, 8192]
    - [11, 16.532]
  - - [128, 8192, 1, 128]
    - [15, 4.169]
  - - [128, 8192, 1, 256]
    - [3, 5.1]
  - - [128, 8192, 1, 512]
    - [53, 7.926]
  - - [128, 8192, 1, 1024]
    - [34, 11.572]
  - - [128, 8192, 1, 2048]
    - [52, 14.151]
  - - [128, 8192, 1, 4096]
    - [14, 17.812]
  - - [128, 8192, 1, 8192]
    - [0, 21.848]
  - - [256, 128, 1, 128]
    - [38, 0.167]
  - - [256, 128, 1, 256]
    - [9, 0.208]
  - - [256, 128, 1, 512]
    - [62, 0.349]
  - - [256, 128, 1, 1024]
    - [60, 0.533]
  - - [256, 128, 1, 2048]
    - [42, 0.82]
  - - [256, 128, 1, 4096]
    - [12, 1.55]
  - - [256, 128, 1, 8192]
    - [39, 2.63]
  - - [256, 256, 1, 128]
    - [7, 0.329]
  - - [256, 256, 1, 256]
    - [21, 0.409]
  - - [256, 256, 1, 512]
    - [40, 0.674]
  - - [256, 256, 1, 1024]
    - [61, 1.095]
  - - [256, 256, 1, 2048]
    - [60, 2.065]
  - - [256, 256, 1, 4096]
    - [29, 3.436]
  - - [256, 256, 1, 8192]
    - [41, 4.887]
  - - [256, 512, 1, 128]
    - [19, 0.648]
  - - [256, 512, 1, 256]
    - [19, 0.774]
  - - [256, 512, 1, 512]
    - [61, 1.428]
  - - [256, 512, 1, 1024]
    - [2, 2.33]
  - - [256, 512, 1, 2048]
    - [20, 3.916]
  - - [256, 512, 1, 4096]
    - [39, 6.015]
  - - [256, 512, 1, 8192]
    - [57, 7.945]
  - - [256, 1024, 1, 128]
    - [19, 1.266]
  - - [256, 1024, 1, 256]
    - [59, 1.599]
  - - [256, 1024, 1, 512]
    - [38, 2.598]
  - - [256, 1024, 1, 1024]
    - [58, 4.188]
  - - [256, 1024, 1, 2048]
    - [5, 6.739]
  - - [256, 1024, 1, 4096]
    - [37, 9.882]
  - - [256, 1024, 1, 8192]
    - [46, 12.423]
  - - [256, 2048, 1, 128]
    - [4, 2.398]
  - - [256, 2048, 1, 256]
    - [17, 2.952]
  - - [256, 2048, 1, 512]
    - [56, 4.691]
  - - [256, 2048, 1, 1024]
    - [56, 7.414]
  - - [256, 2048, 1, 2048]
    - [27, 10.578]
  - - [256, 2048, 1, 4096]
    - [53, 13.751]
  - - [256, 2048, 1, 8192]
    - [26, 15.858]
  - - [256, 4096, 1, 128]
    - [16, 4.056]
  - - [256, 4096, 1, 256]
    - [3, 5.076]
  - - [256, 4096, 1, 512]
    - [33, 7.98]
  - - [256, 4096, 1, 1024]
    - [34, 11.586]
  - - [256, 4096, 1, 2048]
    - [51, 15.083]
  - - [256, 4096, 1, 4096]
    - [45, 18.176]
  - - [256, 4096, 1, 8192]
    - [44, 21.53]
  - - [256, 8192, 1, 128]
    - [49, 6.332]
  - - [256, 8192, 1, 256]
    - [13, 8.234]
  - - [256, 8192, 1, 512]
    - [32, 11.131]
  - - [256, 8192, 1, 1024]
    - [50, 15.579]
  - - [256, 8192, 1, 2048]
    - [31, 18.814]
  - - [256, 8192, 1, 4096]
    - [25, 23.367]
  - - [256, 8192, 1, 8192]
    - [1, 27.019]
  - - [512, 128, 1, 128]
    - [7, 0.335]
  - - [512, 128, 1, 256]
    - [21, 0.409]
  - - [512, 128, 1, 512]
    - [40, 0.672]
  - - [512, 128, 1, 1024]
    - [48, 1.089]
  - - [512, 128, 1, 2048]
    - [38, 2.009]
  - - [512, 128, 1, 4096]
    - [65, 3.247]
  - - [512, 128, 1, 8192]
    - [66, 4.65]
  - - [512, 256, 1, 128]
    - [18, 0.659]
  - - [512, 256, 1, 256]
    - [39, 0.775]
  - - [512, 256, 1, 512]
    - [60, 1.367]
  - - [512, 256, 1, 1024]
    - [12, 2.261]
  - - [512, 256, 1, 2048]
    - [67, 3.809]
  - - [512, 256, 1, 4096]
    - [68, 5.655]
  - - [512, 256, 1, 8192]
    - [69, 7.374]
  - - [512, 512, 1, 128]
    - [39, 1.269]
  - - [512, 512, 1, 256]
    - [7, 1.611]
  - - [512, 512, 1, 512]
    - [59, 2.613]
  - - [512, 512, 1, 1024]
    - [22, 4.099]
  - - [512, 512, 1, 2048]
    - [55, 6.763]
  - - [512, 512, 1, 4096]
    - [36, 8.688]
  - - [512, 512, 1, 8192]
    - [70, 11.647]
  - - [512, 1024, 1, 128]
    - [17, 2.41]
  - - [512, 1024, 1, 256]
    - [4, 2.921]
  - - [512, 1024, 1, 512]
    - [56, 4.737]
  - - [512, 1024, 1, 1024]
    - [4, 7.228]
  - - [512, 1024, 1, 2048]
    - [58, 10.361]
  - - [512, 1024, 1, 4096]
    - [71, 13.201]
  - - [512, 1024, 1, 8192]
    - [72, 15.751]
  - - [512, 2048, 1, 128]
    - [15, 4.23]
  - - [512, 2048, 1, 256]
    - [15, 5.193]
  - - [512, 2048, 1, 512]
    - [73, 7.803]
  - - [512, 2048, 1, 1024]
    - [34, 11.657]
  - - [512, 2048, 1, 2048]
    - [34, 14.877]
  - - [512, 2048, 1, 4096]
    - [74, 17.486]
  - - [512, 2048, 1, 8192]
    - [44, 21.337]
  - - [512, 4096, 1, 128]
    - [75, 6.452]
  - - [512, 4096, 1, 256]
    - [76, 8.196]
  - - [512, 4096, 1, 512]
    - [77, 11.185]
  - - [512, 4096, 1, 1024]
    - [78, 15.898]
  - - [512, 4096, 1, 2048]
    - [79, 18.578]
  - - [512, 4096, 1, 4096]
    - [80, 22.549]
  - - [512, 4096, 1, 8192]
    - [81, 26.039]
  - - [512, 8192, 1, 128]
    - [82, 7.659]
  - - [512, 8192, 1, 256]
    - [83, 9.823]
  - - [512, 8192, 1, 512]
    - [26, 14.058]
  - - [512, 8192, 1, 1024]
    - [84, 18.513]
  - - [512, 8192, 1, 2048]
    - [25, 22.968]
  - - [512, 8192, 1, 4096]
    - [85, 27.173]
  - - [512, 8192, 1, 8192]
    - [86, 29.854]
  - - [1024, 128, 1, 128]
    - [7, 0.661]
  - - [1024, 128, 1, 256]
    - [38, 0.761]
  - - [1024, 128, 1, 512]
    - [39, 1.375]
  - - [1024, 128, 1, 1024]
    - [59, 2.288]
  - - [1024, 128, 1, 2048]
    - [63, 3.602]
  - - [1024, 128, 1, 4096]
    - [87, 5.275]
  - - [1024, 128, 1, 8192]
    - [88, 6.968]
  - - [1024, 256, 1, 128]
    - [18, 1.279]
  - - [1024, 256, 1, 256]
    - [18, 1.58]
  - - [1024, 256, 1, 512]
    - [38, 2.617]
  - - [1024, 256, 1, 1024]
    - [56, 4.217]
  - - [1024, 256, 1, 2048]
    - [89, 6.292]
  - - [1024, 256, 1, 4096]
    - [90, 8.315]
  - - [1024, 256, 1, 8192]
    - [34, 11.153]
  - - [1024, 512, 1, 128]
    - [35, 2.399]
  - - [1024, 512, 1, 256]
    - [17, 2.918]
  - - [1024, 512, 1, 512]
    - [55, 4.739]
  - - [1024, 512, 1, 1024]
    - [17, 7.208]
  - - [1024, 512, 1, 2048]
    - [91, 10.129]
  - - [1024, 512, 1, 4096]
    - [88, 12.25]
  - - [1024, 512, 1, 8192]
    - [92, 15.636]
  - - [1024, 1024, 1, 128]
    - [93, 4.191]
  - - [1024, 1024, 1, 256]
    - [94, 5.004]
  - - [1024, 1024, 1, 512]
    - [95, 7.978]
  - - [1024, 1024, 1, 1024]
    - [34, 11.52]
  - - [1024, 1024, 1, 2048]
    - [91, 13.884]
  - - [1024, 1024, 1, 4096]
    - [96, 17.055]
  - - [1024, 1024, 1, 8192]
    - [84, 21.282]
  - - [1024, 2048, 1, 128]
    - [97, 6.499]
  - - [1024, 2048, 1, 256]
    - [98, 8.242]
  - - [1024, 2048, 1, 512]
    - [99, 11.217]
  - - [1024, 2048, 1, 1024]
    - [100, 15.5]
  - - [1024, 2048, 1, 2048]
    - [101, 18.096]
  - - [1024, 2048, 1, 4096]
    - [102, 23.186]
  - - [1024, 2048, 1, 8192]
    - [103, 25.987]
  - - [1024, 4096, 1, 128]
    - [104, 7.721]
  - - [1024, 4096, 1, 256]
    - [105, 9.887]
  - - [1024, 4096, 1, 512]
    - [106, 14.139]
  - - [1024, 4096, 1, 1024]
    - [50, 18.469]
  - - [1024, 4096, 1, 2048]
    - [107, 23.017]
  - - [1024, 4096, 1, 4096]
    - [108, 27.685]
  - - [1024, 4096, 1, 8192]
    - [109, 28.455]
  - - [1024, 8192, 1, 128]
    - [110, 8.319]
  - - [1024, 8192, 1, 256]
    - [111, 12.25]
  - - [1024, 8192, 1, 512]
    - [102, 17.779]
  - - [1024, 8192, 1, 1024]
    - [44, 22.509]
  - - [1024, 8192, 1, 2048]
    - [103, 27.102]
  - - [1024, 8192, 1, 4096]
    - [112, 29.445]
  - - [1024, 8192, 1, 8192]
    - [113, 32.122]
  - - [2048, 128, 1, 128]
    - [7, 1.28]
  - - [2048, 128, 1, 256]
    - [9, 1.617]
  - - [2048, 128, 1, 512]
    - [114, 2.539]
  - - [2048, 128, 1, 1024]
    - [35, 4.213]
  - - [2048, 128, 1, 2048]
    - [115, 6.285]
  - - [2048, 128, 1, 4096]
    - [116, 8.455]
  - - [2048, 128, 1, 8192]
    - [117, 11.346]
  - - [2048, 256, 1, 128]
    - [55, 2.384]
  - - [2048, 256, 1, 256]
    - [118, 2.945]
  - - [2048, 256, 1, 512]
    - [56, 4.754]
  - - [2048, 256, 1, 1024]
    - [69, 7.224]
  - - [2048, 256, 1, 2048]
    - [119, 9.928]
  - - [2048, 256, 1, 4096]
    - [27, 12.353]
  - - [2048, 256, 1, 8192]
    - [120, 15.789]
  - - [2048, 512, 1, 128]
    - [3, 4.141]
  - - [2048, 512, 1, 256]
    - [121, 5.137]
  - - [2048, 512, 1, 512]
    - [51, 8.039]
  - - [2048, 512, 1, 1024]
    - [119, 11.345]
  - - [2048, 512, 1, 2048]
    - [122, 13.777]
  - - [2048, 512, 1, 4096]
    - [123, 17.364]
  - - [2048, 512, 1, 8192]
    - [103, 21.349]
  - - [2048, 1024, 1, 128]
    - [124, 6.479]
  - - [2048, 1024, 1, 256]
    - [125, 8.313]
  - - [2048, 1024, 1, 512]
    - [126, 11.207]
  - - [2048, 1024, 1, 1024]
    - [127, 15.298]
  - - [2048, 1024, 1, 2048]
    - [128, 17.635]
  - - [2048, 1024, 1, 4096]
    - [129, 23.02]
  - - [2048, 1024, 1, 8192]
    - [107, 26.408]
  - - [2048, 2048, 1, 128]
    - [75, 7.82]
  - - [2048, 2048, 1, 256]
    - [130, 9.889]
  - - [2048, 2048, 1, 512]
    - [131, 14.209]
  - - [2048, 2048, 1, 1024]
    - [132, 18.424]
  - - [2048, 2048, 1, 2048]
    - [133, 23.511]
  - - [2048, 2048, 1, 4096]
    - [134, 28.579]
  - - [2048, 2048, 1, 8192]
    - [135, 30.367]
  - - [2048, 4096, 1, 128]
    - [136, 8.366]
  - - [2048, 4096, 1, 256]
    - [44, 12.304]
  - - [2048, 4096, 1, 512]
    - [102, 17.383]
  - - [2048, 4096, 1, 1024]
    - [137, 22.429]
  - - [2048, 4096, 1, 2048]
    - [138, 27.777]
  - - [2048, 4096, 1, 4096]
    - [129, 28.505]
  - - [2048, 4096, 1, 8192]
    - [139, 32.31]
  - - [2048, 8192, 1, 128]
    - [140, 9.448]
  - - [2048, 8192, 1, 256]
    - [44, 14.765]
  - - [2048, 8192, 1, 512]
    - [102, 20.034]
  - - [2048, 8192, 1, 1024]
    - [141, 25.752]
  - - [2048, 8192, 1, 2048]
    - [142, 29.169]
  - - [2048, 8192, 1, 4096]
    - [143, 31.845]
  - - [2048, 8192, 1, 8192]
    - [144, 34.128]
  - - [4096, 128, 1, 128]
    - [118, 2.391]
  - - [4096, 128, 1, 256]
    - [118, 2.923]
  - - [4096, 128, 1, 512]
    - [35, 4.76]
  - - [4096, 128, 1, 1024]
    - [145, 7.222]
  - - [4096, 128, 1, 2048]
    - [54, 9.861]
  - - [4096, 128, 1, 4096]
    - [146, 12.389]
  - - [4096, 128, 1, 8192]
    - [146, 15.619]
  - - [4096, 256, 1, 128]
    - [3, 4.2]
  - - [4096, 256, 1, 256]
    - [147, 5.101]
  - - [4096, 256, 1, 512]
    - [148, 7.832]
  - - [4096, 256, 1, 1024]
    - [149, 11.194]
  - - [4096, 256, 1, 2048]
    - [119, 13.457]
  - - [4096, 256, 1, 4096]
    - [150, 17.018]
  - - [4096, 256, 1, 8192]
    - [144, 21.344]
  - - [4096, 512, 1, 128]
    - [151, 6.439]
  - - [4096, 512, 1, 256]
    - [151, 8.275]
  - - [4096, 512, 1, 512]
    - [152, 11.216]
  - - [4096, 512, 1, 1024]
    - [127, 15.182]
  - - [4096, 512, 1, 2048]
    - [153, 17.556]
  - - [4096, 512, 1, 4096]
    - [154, 22.935]
  - - [4096, 512, 1, 8192]
    - [103, 26.615]
  - - [4096, 1024, 1, 128]
    - [49, 8.031]
  - - [4096, 1024, 1, 256]
    - [125, 9.819]
  - - [4096, 1024, 1, 512]
    - [155, 13.611]
  - - [4096, 1024, 1, 1024]
    - [132, 18.426]
  - - [4096, 1024, 1, 2048]
    - [156, 22.808]
  - - [4096, 1024, 1, 4096]
    - [103, 27.814]
  - - [4096, 1024, 1, 8192]
    - [157, 28.502]
  - - [4096, 2048, 1, 128]
    - [158, 8.285]
  - - [4096, 2048, 1, 256]
    - [137, 11.907]
  - - [4096, 2048, 1, 512]
    - [132, 17.109]
  - - [4096, 2048, 1, 1024]
    - [159, 22.384]
  - - [4096, 2048, 1, 2048]
    - [160, 27.254]
  - - [4096, 2048, 1, 4096]
    - [161, 29.84]
  - - [4096, 2048, 1, 8192]
    - [162, 31.932]
  - - [4096, 4096, 1, 128]
    - [129, 9.368]
  - - [4096, 4096, 1, 256]
    - [163, 13.994]
  - - [4096, 4096, 1, 512]
    - [164, 19.404]
  - - [4096, 4096, 1, 1024]
    - [144, 25.005]
  - - [4096, 4096, 1, 2048]
    - [165, 28.196]
  - - [4096, 4096, 1, 4096]
    - [166, 31.495]
  - - [4096, 4096, 1, 8192]
    - [167, 33.878]
  - - [4096, 8192, 1, 128]
    - [108, 11.153]
  - - [4096, 8192, 1, 256]
    - [133, 16.323]
  - - [4096, 8192, 1, 512]
    - [159, 21.682]
  - - [4096, 8192, 1, 1024]
    - [168, 26.437]
  - - [4096, 8192, 1, 2048]
    - [169, 31.379]
  - - [4096, 8192, 1, 4096]
    - [170, 35.577]
  - - [4096, 8192, 1, 8192]
    - [171, 37.788]
  - - [8192, 128, 1, 128]
    - [15, 4.149]
  - - [8192, 128, 1, 256]
    - [172, 4.985]
  - - [8192, 128, 1, 512]
    - [73, 7.93]
  - - [8192, 128, 1, 1024]
    - [173, 11.033]
  - - [8192, 128, 1, 2048]
    - [91, 13.65]
  - - [8192, 128, 1, 4096]
    - [92, 17.108]
  - - [8192, 128, 1, 8192]
    - [1, 21.424]
  - - [8192, 256, 1, 128]
    - [97, 6.41]
  - - [8192, 256, 1, 256]
    - [174, 7.97]
  - - [8192, 256, 1, 512]
    - [175, 10.946]
  - - [8192, 256, 1, 1024]
    - [127, 15.411]
  - - [8192, 256, 1, 2048]
    - [176, 18.047]
  - - [8192, 256, 1, 4096]
    - [108, 22.802]
  - - [8192, 256, 1, 8192]
    - [177, 26.706]
  - - [8192, 512, 1, 128]
    - [178, 7.65]
  - - [8192, 512, 1, 256]
    - [13, 9.668]
  - - [8192, 512, 1, 512]
    - [155, 13.77]
  - - [8192, 512, 1, 1024]
    - [159, 18.242]
  - - [8192, 512, 1, 2048]
    - [133, 22.399]
  - - [8192, 512, 1, 4096]
    - [80, 27.651]
  - - [8192, 512, 1, 8192]
    - [179, 30.325]
  - - [8192, 1024, 1, 128]
    - [180, 8.083]
  - - [8192, 1024, 1, 256]
    - [163, 12.066]
  - - [8192, 1024, 1, 512]
    - [156, 17.024]
  - - [8192, 1024, 1, 1024]
    - [156, 22.319]
  - - [8192, 1024, 1, 2048]
    - [181, 27.321]
  - - [8192, 1024, 1, 4096]
    - [182, 30.132]
  - - [8192, 1024, 1, 8192]
    - [162, 32.728]
  - - [8192, 2048, 1, 128]
    - [183, 9.119]
  - - [8192, 2048, 1, 256]
    - [184, 13.854]
  - - [8192, 2048, 1, 512]
    - [185, 19.555]
  - - [8192, 2048, 1, 1024]
    - [186, 25.665]
  - - [8192, 2048, 1, 2048]
    - [187, 28.642]
  - - [8192, 2048, 1, 4096]
    - [167, 32.889]
  - - [8192, 2048, 1, 8192]
    - [188, 35.395]
  - - [8192, 4096, 1, 128]
    - [177, 11.143]
  - - [8192, 4096, 1, 256]
    - [132, 16.468]
  - - [8192, 4096, 1, 512]
    - [189, 21.991]
  - - [8192, 4096, 1, 1024]
    - [181, 26.459]
  - - [8192, 4096, 1, 2048]
    - [171, 31.443]
  - - [8192, 4096, 1, 4096]
    - [190, 35.787]
  - - [8192, 4096, 1, 8192]
    - [188, 38.031]
  - - [8192, 8192, 1, 128]
    - [86, 11.942]
  - - [8192, 8192, 1, 256]
    - [191, 16.263]
  - - [8192, 8192, 1, 512]
    - [192, 22.421]
  - - [8192, 8192, 1, 1024]
    - [193, 27.931]
  - - [8192, 8192, 1, 2048]
    - [194, 34.877]
  - - [8192, 8192, 1, 4096]
    - [113, 38.381]
  - - [8192, 8192, 1, 8192]
    - [195, 40.989]
- null
- null
- DeviceEfficiency
- GridBased
