library/src/amd_detail/rocblaslt/src/Tensile/Logic/streamk/gfx942/aquavanjaram942_Cijk_Alik_Bljk_BSS_BH_UserArgs.yaml
- {MinimumRequiredVersion: 4.33.0}
- aquavanjaram942
- gfx942
- [Device 0049, Device 0050]
    SolutionIndex: 0
    SolutionNameMin: Cijk_Alik_Bljk_BSS_BH_UserArgs_MT32x32x32_MI16x16x1_SN_LDSB0_CLR1_GSU0_GSUC0_GSUWGMRR0_K1_LBSPPA128_LBSPPB128_MIWT1_1_PLR1_SU32_SUM0_SUS256_SKXCCM0_VWA1_VWB1_WGM1_WGMXCC1_WGMXCCGn1
    SolutionIndex: 1
    SolutionNameMin: Cijk_Alik_Bljk_BSS_BH_UserArgs_MT32x32x32_MI16x16x1_SN_LDSB0_CLR0_GSU0_GSUC0_GSUWGMRR0_K1_LBSPPA128_LBSPPB128_MIWT1_1_PLR0_SU32_SUM0_SUS256_SKXCCM0_VWA1_VWB1_WGM1_WGMXCC1_WGMXCCGn1
    SolutionIndex: 2
    SolutionNameMin: Cijk_Alik_Bljk_BSS_BH_UserArgs_MT256x64x64_MI16x16x1_SN_LDSB1_CLR1_GSU0_GSUC0_GSUWGMRR0_K1_LBSPPA512_LBSPPB256_MIWT8_2_PLR1_SU32_SUM0_SUS256_SKXCCM0_VWA4_VWB2_WGM1_WGMXCC1_WGMXCCGn1
    SolutionIndex: 3
    SolutionNameMin: Cijk_Alik_Bljk_BSS_BH_UserArgs_MT256x64x64_MI16x16x1_SN_LDSB1_CLR1_GSU0_GSUC0_GSUWGMRR0_K1_LBSPPA512_LBSPPB256_MIWT8_2_PLR2_SU32_SUM0_SUS256_SKXCCM0_VWA4_VWB2_WGM1_WGMXCC1_WGMXCCGn1
    SolutionIndex: 4
    SolutionNameMin: Cijk_Alik_Bljk_BSS_BH_UserArgs_MT256x64x64_MI16x16x1_SN_LDSB1_CLR1_GSU0_GSUC0_GSUWGMRR0_K1_LBSPPA512_LBSPPB256_MIWT8_2_PLR1_SU32_SUM0_SUS256_SKXCCM0_VWA4_VWB2_WGM8_WGMXCC1_WGMXCCGn1
    SolutionIndex: 5
    SolutionNameMin: Cijk_Alik_Bljk_BSS_BH_UserArgs_MT128x128x64_MI16x16x1_SN_LDSB1_CLR1_GSU0_GSUC0_GSUWGMRR0_K1_LBSPPA512_LBSPPB128_MIWT4_4_PLR1_SU32_SUM0_SUS256_SKXCCM0_VWA4_VWB1_WGM1_WGMXCC1_WGMXCCGn1
    SolutionIndex: 6
    SolutionNameMin: Cijk_Alik_Bljk_BSS_BH_UserArgs_MT128x128x64_MI16x16x1_SN_LDSB1_CLR1_GSU0_GSUC0_GSUWGMRR0_K1_LBSPPA512_LBSPPB256_MIWT4_4_PLR1_SU32_SUM0_SUS256_SKXCCM0_VWA4_VWB2_WGM1_WGMXCC1_WGMXCCGn1
    SolutionIndex: 7
    SolutionNameMin: Cijk_Alik_Bljk_BSS_BH_UserArgs_MT128x128x64_MI16x16x1_SN_LDSB1_CLR1_GSU0_GSUC0_GSUWGMRR0_K1_LBSPPA256_LBSPPB512_MIWT4_4_PLR1_SU32_SUM0_SUS256_SKXCCM0_VWA2_VWB4_WGM1_WGMXCC1_WGMXCCGn1
    SolutionIndex: 8
    SolutionNameMin: Cijk_Alik_Bljk_BSS_BH_UserArgs_MT128x128x64_MI16x16x1_SN_LDSB1_CLR1_GSU0_GSUC0_GSUWGMRR0_K1_LBSPPA512_LBSPPB512_MIWT4_4_PLR1_SU32_SUM0_SUS256_SKXCCM0_VWA4_VWB4_WGM1_WGMXCC1_WGMXCCGn1
    SolutionIndex: 9
    SolutionNameMin: Cijk_Alik_Bljk_BSS_BH_UserArgs_MT128x128x64_MI16x16x1_SN_LDSB1_CLR1_GSU0_GSUC0_GSUWGMRR0_K1_LBSPPA512_LBSPPB128_MIWT4_4_PLR1_SU32_SUM0_SUS256_SKXCCM0_VWA4_VWB1_WGM4_WGMXCC1_WGMXCCGn1
    SolutionIndex: 10
    SolutionNameMin: Cijk_Alik_Bljk_BSS_BH_UserArgs_MT128x128x64_MI16x16x1_SN_LDSB1_CLR1_GSU0_GSUC0_GSUWGMRR0_K1_LBSPPA512_LBSPPB256_MIWT4_4_PLR1_SU32_SUM0_SUS256_SKXCCM0_VWA4_VWB2_WGM4_WGMXCC1_WGMXCCGn1
    SolutionIndex: 11
    SolutionNameMin: Cijk_Alik_Bljk_BSS_BH_UserArgs_MT128x128x64_MI16x16x1_SN_LDSB1_CLR1_GSU0_GSUC0_GSUWGMRR0_K1_LBSPPA512_LBSPPB512_MIWT4_4_PLR1_SU32_SUM0_SUS256_SKXCCM0_VWA4_VWB4_WGM4_WGMXCC1_WGMXCCGn1
    SolutionIndex: 12
    SolutionNameMin: Cijk_Alik_Bljk_BSS_BH_UserArgs_MT128x128x64_MI16x16x1_SN_LDSB1_CLR1_GSU0_GSUC0_GSUWGMRR0_K1_LBSPPA512_LBSPPB128_MIWT4_4_PLR1_SU32_SUM0_SUS256_SKXCCM0_VWA4_VWB1_WGM8_WGMXCC1_WGMXCCGn1
    SolutionIndex: 13
    SolutionNameMin: Cijk_Alik_Bljk_BSS_BH_UserArgs_MT128x128x64_MI16x16x1_SN_LDSB1_CLR1_GSU0_GSUC0_GSUWGMRR0_K1_LBSPPA512_LBSPPB256_MIWT4_4_PLR1_SU32_SUM0_SUS256_SKXCCM0_VWA4_VWB2_WGM8_WGMXCC1_WGMXCCGn1
    SolutionIndex: 14
    SolutionNameMin: Cijk_Alik_Bljk_BSS_BH_UserArgs_MT128x128x64_MI16x16x1_SN_LDSB1_CLR1_GSU0_GSUC0_GSUWGMRR0_K1_LBSPPA512_LBSPPB512_MIWT4_4_PLR1_SU32_SUM0_SUS256_SKXCCM0_VWA4_VWB4_WGM8_WGMXCC1_WGMXCCGn1
    SolutionIndex: 15
    SolutionNameMin: Cijk_Alik_Bljk_BSS_BH_UserArgs_MT64x128x64_MI16x16x1_SN_LDSB1_CLR1_GSU0_GSUC0_GSUWGMRR0_K1_LBSPPA128_LBSPPB128_MIWT2_4_PLR1_SU32_SUM0_SUS256_SKXCCM0_VWA1_VWB1_WGM1_WGMXCC1_WGMXCCGn1
    SolutionIndex: 16
    SolutionNameMin: Cijk_Alik_Bljk_BSS_BH_UserArgs_MT64x128x64_MI16x16x1_SN_LDSB1_CLR1_GSU0_GSUC0_GSUWGMRR0_K1_LBSPPA128_LBSPPB256_MIWT2_4_PLR1_SU32_SUM0_SUS256_SKXCCM0_VWA1_VWB2_WGM1_WGMXCC1_WGMXCCGn1
    SolutionIndex: 17
    SolutionNameMin: Cijk_Alik_Bljk_BSS_BH_UserArgs_MT128x64x64_MI16x16x1_SN_LDSB1_CLR1_GSU0_GSUC0_GSUWGMRR0_K1_LBSPPA512_LBSPPB128_MIWT4_2_PLR1_SU32_SUM0_SUS256_SKXCCM0_VWA4_VWB1_WGM1_WGMXCC1_WGMXCCGn1
    SolutionIndex: 18
    SolutionNameMin: Cijk_Alik_Bljk_BSS_BH_UserArgs_MT128x64x64_MI16x16x1_SN_LDSB1_CLR1_GSU0_GSUC0_GSUWGMRR0_K1_LBSPPA512_LBSPPB256_MIWT4_2_PLR1_SU32_SUM0_SUS256_SKXCCM0_VWA4_VWB2_WGM1_WGMXCC1_WGMXCCGn1
    SolutionIndex: 19
    SolutionNameMin: Cijk_Alik_Bljk_BSS_BH_UserArgs_MT128x64x64_MI16x16x1_SN_LDSB1_CLR1_GSU0_GSUC0_GSUWGMRR0_K1_LBSPPA512_LBSPPB128_MIWT4_2_PLR1_SU32_SUM0_SUS256_SKXCCM0_VWA4_VWB1_WGM4_WGMXCC1_WGMXCCGn1
    SolutionIndex: 20
    SolutionNameMin: Cijk_Alik_Bljk_BSS_BH_UserArgs_MT32x64x64_MI16x16x1_SN_LDSB0_CLR1_GSU0_GSUC0_GSUWGMRR0_K1_LBSPPA128_LBSPPB128_MIWT1_2_PLR1_SU32_SUM0_SUS256_SKXCCM0_VWA1_VWB1_WGM1_WGMXCC1_WGMXCCGn1
    SolutionIndex: 21
    SolutionNameMin: Cijk_Alik_Bljk_BSS_BH_UserArgs_MT32x32x64_MI16x16x1_SN_LDSB0_CLR1_GSU0_GSUC0_GSUWGMRR0_K1_LBSPPA128_LBSPPB128_MIWT1_1_PLR1_SU32_SUM0_SUS256_SKXCCM0_VWA1_VWB1_WGM1_WGMXCC1_WGMXCCGn1
    SolutionIndex: 22
    SolutionNameMin: Cijk_Alik_Bljk_BSS_BH_UserArgs_MT32x32x64_MI16x16x1_SN_LDSB0_CLR1_GSU0_GSUC0_GSUWGMRR0_K1_LBSPPA128_LBSPPB128_MIWT1_1_PLR2_SU32_SUM0_SUS256_SKXCCM0_VWA1_VWB1_WGM1_WGMXCC1_WGMXCCGn1
    SolutionIndex: 23
    SolutionNameMin: Cijk_Alik_Bljk_BSS_BH_UserArgs_MT128x32x128_MI16x16x1_SN_LDSB1_CLR1_GSU0_GSUC0_GSUWGMRR0_K1_LBSPPA1024_LBSPPB256_MIWT4_1_PLR1_SU32_SUM0_SUS256_SKXCCM0_VWA4_VWB1_WGM1_WGMXCC1_WGMXCCGn1
    SolutionIndex: 24
    SolutionNameMin: Cijk_Alik_Bljk_BSS_BH_UserArgs_MT128x32x128_MI16x16x1_SN_LDSB1_CLR1_GSU0_GSUC0_GSUWGMRR0_K1_LBSPPA1024_LBSPPB256_MIWT4_1_PLR1_SU32_SUM0_SUS256_SKXCCM0_VWA4_VWB1_WGM8_WGMXCC1_WGMXCCGn1
    SolutionIndex: 25
    SolutionNameMin: Cijk_Alik_Bljk_BSS_BH_UserArgs_MT64x64x128_MI16x16x1_SN_LDSB1_CLR1_GSU0_GSUC0_GSUWGMRR0_K1_LBSPPA256_LBSPPB512_MIWT2_2_PLR1_SU32_SUM0_SUS256_SKXCCM0_VWA1_VWB2_WGM4_WGMXCC1_WGMXCCGn1
    SolutionIndex: 26
    SolutionNameMin: Cijk_Alik_Bljk_BSS_BH_UserArgs_MT64x64x128_MI16x16x1_SN_LDSB1_CLR1_GSU0_GSUC0_GSUWGMRR0_K1_LBSPPA256_LBSPPB256_MIWT2_2_PLR1_SU32_SUM0_SUS256_SKXCCM0_VWA1_VWB1_WGM8_WGMXCC1_WGMXCCGn1
    SolutionIndex: 27
    SolutionNameMin: Cijk_Alik_Bljk_BSS_BH_UserArgs_MT64x64x128_MI16x16x1_SN_LDSB1_CLR1_GSU0_GSUC0_GSUWGMRR0_K1_LBSPPA256_LBSPPB512_MIWT2_2_PLR1_SU32_SUM0_SUS256_SKXCCM0_VWA1_VWB2_WGM8_WGMXCC1_WGMXCCGn1
    SolutionIndex: 28
    SolutionNameMin: Cijk_Alik_Bljk_BSS_BH_UserArgs_MT64x64x128_MI16x16x1_SN_LDSB1_CLR1_GSU0_GSUC0_GSUWGMRR0_K1_LBSPPA256_LBSPPB512_MIWT2_2_PLR2_SU32_SUM0_SUS256_SKXCCM0_VWA1_VWB2_WGM8_WGMXCC1_WGMXCCGn1
    SolutionIndex: 29
    SolutionNameMin: Cijk_Alik_Bljk_BSS_BH_UserArgs_MT32x64x128_MI16x16x1_SN_LDSB1_CLR1_GSU0_GSUC0_GSUWGMRR0_K1_LBSPPA256_LBSPPB256_MIWT1_2_PLR1_SU32_SUM0_SUS256_SKXCCM0_VWA1_VWB1_WGM1_WGMXCC1_WGMXCCGn1
    SolutionIndex: 30
    SolutionNameMin: Cijk_Alik_Bljk_BSS_BH_UserArgs_MT32x64x128_MI16x16x1_SN_LDSB1_CLR1_GSU0_GSUC0_GSUWGMRR0_K1_LBSPPA256_LBSPPB512_MIWT1_2_PLR1_SU32_SUM0_SUS256_SKXCCM0_VWA1_VWB2_WGM1_WGMXCC1_WGMXCCGn1
    SolutionIndex: 31
    SolutionNameMin: Cijk_Alik_Bljk_BSS_BH_UserArgs_MT32x64x128_MI16x16x1_SN_LDSB1_CLR1_GSU0_GSUC0_GSUWGMRR0_K1_LBSPPA256_LBSPPB512_MIWT1_2_PLR2_SU32_SUM0_SUS256_SKXCCM0_VWA1_VWB2_WGM1_WGMXCC1_WGMXCCGn1
    SolutionIndex: 32
    SolutionNameMin: Cijk_Alik_Bljk_BSS_BH_UserArgs_MT32x64x128_MI16x16x1_SN_LDSB1_CLR1_GSU0_GSUC0_GSUWGMRR0_K1_LBSPPA256_LBSPPB256_MIWT1_2_PLR1_SU32_SUM0_SUS256_SKXCCM0_VWA1_VWB1_WGM4_WGMXCC1_WGMXCCGn1
    SolutionIndex: 33
    SolutionNameMin: Cijk_Alik_Bljk_BSS_BH_UserArgs_MT32x64x128_MI16x16x1_SN_LDSB1_CLR1_GSU0_GSUC0_GSUWGMRR0_K1_LBSPPA256_LBSPPB512_MIWT1_2_PLR2_SU32_SUM0_SUS256_SKXCCM0_VWA1_VWB2_WGM4_WGMXCC1_WGMXCCGn1
    SolutionIndex: 34
    SolutionNameMin: Cijk_Alik_Bljk_BSS_BH_UserArgs_MT64x32x128_MI16x16x1_SN_LDSB1_CLR1_GSU0_GSUC0_GSUWGMRR0_K1_LBSPPA256_LBSPPB256_MIWT2_1_PLR1_SU32_SUM0_SUS256_SKXCCM0_VWA1_VWB1_WGM4_WGMXCC1_WGMXCCGn1
    SolutionIndex: 35
    SolutionNameMin: Cijk_Alik_Bljk_BSS_BH_UserArgs_MT64x32x128_MI16x16x1_SN_LDSB1_CLR1_GSU0_GSUC0_GSUWGMRR0_K1_LBSPPA256_LBSPPB256_MIWT2_1_PLR2_SU32_SUM0_SUS256_SKXCCM0_VWA1_VWB1_WGM8_WGMXCC1_WGMXCCGn1
    SolutionIndex: 36
    SolutionNameMin: Cijk_Alik_Bljk_BSS_BH_UserArgs_MT32x32x128_MI16x16x1_SN_LDSB1_CLR1_GSU0_GSUC0_GSUWGMRR0_K1_LBSPPA256_LBSPPB256_MIWT1_1_PLR1_SU32_SUM0_SUS256_SKXCCM0_VWA1_VWB1_WGM1_WGMXCC1_WGMXCCGn1
    SolutionIndex: 37
    SolutionNameMin: Cijk_Alik_Bljk_BSS_BH_UserArgs_MT32x32x128_MI16x16x1_SN_LDSB1_CLR1_GSU0_GSUC0_GSUWGMRR0_K1_LBSPPA256_LBSPPB256_MIWT1_1_PLR2_SU32_SUM0_SUS256_SKXCCM0_VWA1_VWB1_WGM1_WGMXCC1_WGMXCCGn1
    SolutionIndex: 38
    SolutionNameMin: Cijk_Alik_Bljk_BSS_BH_UserArgs_MT128x128x64_MI16x16x1_SN_LDSB1_CLR1_GSU0_GSUC0_GSUWGMRR0_K1_LBSPPA128_LBSPPB128_MIWT4_4_PLR1_SU32_SUM0_SUS256_SKXCCM8_VWA1_VWB1_WGM1_WGMXCC1_WGMXCCGn1
    SolutionIndex: 39
    SolutionNameMin: Cijk_Alik_Bljk_BSS_BH_UserArgs_MT128x128x64_MI16x16x1_SN_LDSB1_CLR1_GSU0_GSUC0_GSUWGMRR0_K1_LBSPPA512_LBSPPB128_MIWT4_4_PLR1_SU32_SUM0_SUS256_SKXCCM8_VWA4_VWB1_WGM1_WGMXCC1_WGMXCCGn1
    SolutionIndex: 40
    SolutionNameMin: Cijk_Alik_Bljk_BSS_BH_UserArgs_MT128x128x64_MI16x16x1_SN_LDSB1_CLR1_GSU0_GSUC0_GSUWGMRR0_K1_LBSPPA256_LBSPPB256_MIWT4_4_PLR1_SU32_SUM0_SUS256_SKXCCM8_VWA2_VWB2_WGM1_WGMXCC1_WGMXCCGn1
    SolutionIndex: 41
    SolutionNameMin: Cijk_Alik_Bljk_BSS_BH_UserArgs_MT128x128x64_MI16x16x1_SN_LDSB1_CLR1_GSU0_GSUC0_GSUWGMRR0_K1_LBSPPA512_LBSPPB256_MIWT4_4_PLR1_SU32_SUM0_SUS256_SKXCCM8_VWA4_VWB2_WGM1_WGMXCC1_WGMXCCGn1
    SolutionIndex: 42
    SolutionNameMin: Cijk_Alik_Bljk_BSS_BH_UserArgs_MT128x128x64_MI16x16x1_SN_LDSB1_CLR1_GSU0_GSUC0_GSUWGMRR0_K1_LBSPPA512_LBSPPB512_MIWT4_4_PLR1_SU32_SUM0_SUS256_SKXCCM8_VWA4_VWB4_WGM1_WGMXCC1_WGMXCCGn1
    SolutionIndex: 43
    SolutionNameMin: Cijk_Alik_Bljk_BSS_BH_UserArgs_MT128x128x64_MI16x16x1_SN_LDSB1_CLR1_GSU0_GSUC0_GSUWGMRR0_K1_LBSPPA128_LBSPPB128_MIWT4_4_PLR1_SU32_SUM0_SUS256_SKXCCM8_VWA1_VWB1_WGM4_WGMXCC1_WGMXCCGn1
    SolutionIndex: 44
    SolutionNameMin: Cijk_Alik_Bljk_BSS_BH_UserArgs_MT128x128x64_MI16x16x1_SN_LDSB1_CLR1_GSU0_GSUC0_GSUWGMRR0_K1_LBSPPA256_LBSPPB128_MIWT4_4_PLR1_SU32_SUM0_SUS256_SKXCCM8_VWA2_VWB1_WGM4_WGMXCC1_WGMXCCGn1
    SolutionIndex: 45
    SolutionNameMin: Cijk_Alik_Bljk_BSS_BH_UserArgs_MT128x128x64_MI16x16x1_SN_LDSB1_CLR1_GSU0_GSUC0_GSUWGMRR0_K1_LBSPPA512_LBSPPB128_MIWT4_4_PLR1_SU32_SUM0_SUS256_SKXCCM8_VWA4_VWB1_WGM4_WGMXCC1_WGMXCCGn1
    SolutionIndex: 46
    SolutionNameMin: Cijk_Alik_Bljk_BSS_BH_UserArgs_MT128x128x64_MI16x16x1_SN_LDSB1_CLR1_GSU0_GSUC0_GSUWGMRR0_K1_LBSPPA512_LBSPPB256_MIWT4_4_PLR1_SU32_SUM0_SUS256_SKXCCM8_VWA4_VWB2_WGM4_WGMXCC1_WGMXCCGn1
    SolutionIndex: 47
    SolutionNameMin: Cijk_Alik_Bljk_BSS_BH_UserArgs_MT128x128x64_MI16x16x1_SN_LDSB1_CLR1_GSU0_GSUC0_GSUWGMRR0_K1_LBSPPA512_LBSPPB512_MIWT4_4_PLR1_SU32_SUM0_SUS256_SKXCCM8_VWA4_VWB4_WGM4_WGMXCC1_WGMXCCGn1
    SolutionIndex: 48
    SolutionNameMin: Cijk_Alik_Bljk_BSS_BH_UserArgs_MT128x128x64_MI16x16x1_SN_LDSB1_CLR1_GSU0_GSUC0_GSUWGMRR0_K1_LBSPPA128_LBSPPB128_MIWT4_4_PLR1_SU32_SUM0_SUS256_SKXCCM8_VWA1_VWB1_WGM8_WGMXCC1_WGMXCCGn1
    SolutionIndex: 49
    SolutionNameMin: Cijk_Alik_Bljk_BSS_BH_UserArgs_MT128x128x64_MI16x16x1_SN_LDSB1_CLR1_GSU0_GSUC0_GSUWGMRR0_K1_LBSPPA256_LBSPPB128_MIWT4_4_PLR1_SU32_SUM0_SUS256_SKXCCM8_VWA2_VWB1_WGM8_WGMXCC1_WGMXCCGn1
    SolutionIndex: 50
    SolutionNameMin: Cijk_Alik_Bljk_BSS_BH_UserArgs_MT128x128x64_MI16x16x1_SN_LDSB1_CLR1_GSU0_GSUC0_GSUWGMRR0_K1_LBSPPA512_LBSPPB128_MIWT4_4_PLR1_SU32_SUM0_SUS256_SKXCCM8_VWA4_VWB1_WGM8_WGMXCC1_WGMXCCGn1
    SolutionIndex: 51
    SolutionNameMin: Cijk_Alik_Bljk_BSS_BH_UserArgs_MT128x128x64_MI16x16x1_SN_LDSB1_CLR1_GSU0_GSUC0_GSUWGMRR0_K1_LBSPPA128_LBSPPB256_MIWT4_4_PLR1_SU32_SUM0_SUS256_SKXCCM8_VWA1_VWB2_WGM8_WGMXCC1_WGMXCCGn1
    SolutionIndex: 52
    SolutionNameMin: Cijk_Alik_Bljk_BSS_BH_UserArgs_MT128x128x64_MI16x16x1_SN_LDSB1_CLR1_GSU0_GSUC0_GSUWGMRR0_K1_LBSPPA512_LBSPPB256_MIWT4_4_PLR1_SU32_SUM0_SUS256_SKXCCM8_VWA4_VWB2_WGM8_WGMXCC1_WGMXCCGn1
    SolutionIndex: 53
    SolutionNameMin: Cijk_Alik_Bljk_BSS_BH_UserArgs_MT128x128x64_MI16x16x1_SN_LDSB1_CLR1_GSU0_GSUC0_GSUWGMRR0_K1_LBSPPA128_LBSPPB512_MIWT4_4_PLR1_SU32_SUM0_SUS256_SKXCCM8_VWA1_VWB4_WGM8_WGMXCC1_WGMXCCGn1
    SolutionIndex: 54
    SolutionNameMin: Cijk_Alik_Bljk_BSS_BH_UserArgs_MT128x128x64_MI16x16x1_SN_LDSB1_CLR1_GSU0_GSUC0_GSUWGMRR0_K1_LBSPPA256_LBSPPB512_MIWT4_4_PLR1_SU32_SUM0_SUS256_SKXCCM8_VWA2_VWB4_WGM8_WGMXCC1_WGMXCCGn1
    SolutionIndex: 55
    SolutionNameMin: Cijk_Alik_Bljk_BSS_BH_UserArgs_MT128x128x64_MI16x16x1_SN_LDSB1_CLR1_GSU0_GSUC0_GSUWGMRR0_K1_LBSPPA512_LBSPPB512_MIWT4_4_PLR1_SU32_SUM0_SUS256_SKXCCM8_VWA4_VWB4_WGM8_WGMXCC1_WGMXCCGn1
    SolutionIndex: 56
    SolutionNameMin: Cijk_Alik_Bljk_BSS_BH_UserArgs_MT64x128x64_MI16x16x1_SN_LDSB1_CLR1_GSU0_GSUC0_GSUWGMRR0_K1_LBSPPA128_LBSPPB128_MIWT2_4_PLR1_SU32_SUM0_SUS256_SKXCCM8_VWA1_VWB1_WGM1_WGMXCC1_WGMXCCGn1
    SolutionIndex: 57
    SolutionNameMin: Cijk_Alik_Bljk_BSS_BH_UserArgs_MT64x128x64_MI16x16x1_SN_LDSB1_CLR1_GSU0_GSUC0_GSUWGMRR0_K1_LBSPPA128_LBSPPB512_MIWT2_4_PLR1_SU32_SUM0_SUS256_SKXCCM8_VWA1_VWB4_WGM1_WGMXCC1_WGMXCCGn1
    SolutionIndex: 58
    SolutionNameMin: Cijk_Alik_Bljk_BSS_BH_UserArgs_MT64x128x64_MI16x16x1_SN_LDSB1_CLR1_GSU0_GSUC0_GSUWGMRR0_K1_LBSPPA128_LBSPPB128_MIWT2_4_PLR1_SU32_SUM0_SUS256_SKXCCM8_VWA1_VWB1_WGM4_WGMXCC1_WGMXCCGn1
    SolutionIndex: 59
    SolutionNameMin: Cijk_Alik_Bljk_BSS_BH_UserArgs_MT64x128x64_MI16x16x1_SN_LDSB1_CLR1_GSU0_GSUC0_GSUWGMRR0_K1_LBSPPA128_LBSPPB128_MIWT2_4_PLR1_SU32_SUM0_SUS256_SKXCCM8_VWA1_VWB1_WGM8_WGMXCC1_WGMXCCGn1
    SolutionIndex: 60
    SolutionNameMin: Cijk_Alik_Bljk_BSS_BH_UserArgs_MT128x64x64_MI16x16x1_SN_LDSB1_CLR1_GSU0_GSUC0_GSUWGMRR0_K1_LBSPPA128_LBSPPB128_MIWT4_2_PLR1_SU32_SUM0_SUS256_SKXCCM8_VWA1_VWB1_WGM1_WGMXCC1_WGMXCCGn1
    SolutionIndex: 61
    SolutionNameMin: Cijk_Alik_Bljk_BSS_BH_UserArgs_MT128x64x64_MI16x16x1_SN_LDSB1_CLR1_GSU0_GSUC0_GSUWGMRR0_K1_LBSPPA512_LBSPPB128_MIWT4_2_PLR1_SU32_SUM0_SUS256_SKXCCM8_VWA4_VWB1_WGM1_WGMXCC1_WGMXCCGn1
    SolutionIndex: 62
    SolutionNameMin: Cijk_Alik_Bljk_BSS_BH_UserArgs_MT128x64x64_MI16x16x1_SN_LDSB1_CLR1_GSU0_GSUC0_GSUWGMRR0_K1_LBSPPA512_LBSPPB256_MIWT4_2_PLR1_SU32_SUM0_SUS256_SKXCCM8_VWA4_VWB2_WGM1_WGMXCC1_WGMXCCGn1
    SolutionIndex: 63
    SolutionNameMin: Cijk_Alik_Bljk_BSS_BH_UserArgs_MT128x64x64_MI16x16x1_SN_LDSB1_CLR1_GSU0_GSUC0_GSUWGMRR0_K1_LBSPPA512_LBSPPB128_MIWT4_2_PLR2_SU32_SUM0_SUS256_SKXCCM8_VWA4_VWB1_WGM1_WGMXCC1_WGMXCCGn1
    SolutionIndex: 64
    SolutionNameMin: Cijk_Alik_Bljk_BSS_BH_UserArgs_MT128x64x64_MI16x16x1_SN_LDSB1_CLR1_GSU0_GSUC0_GSUWGMRR0_K1_LBSPPA512_LBSPPB256_MIWT4_2_PLR2_SU32_SUM0_SUS256_SKXCCM8_VWA4_VWB2_WGM4_WGMXCC1_WGMXCCGn1
    SolutionIndex: 65
    SolutionNameMin: Cijk_Alik_Bljk_BSS_BH_UserArgs_MT128x64x64_MI16x16x1_SN_LDSB1_CLR1_GSU0_GSUC0_GSUWGMRR0_K1_LBSPPA512_LBSPPB128_MIWT4_2_PLR1_SU32_SUM0_SUS256_SKXCCM8_VWA4_VWB1_WGM8_WGMXCC1_WGMXCCGn1
    SolutionIndex: 66
    SolutionNameMin: Cijk_Alik_Bljk_BSS_BH_UserArgs_MT128x64x64_MI16x16x1_SN_LDSB1_CLR1_GSU0_GSUC0_GSUWGMRR0_K1_LBSPPA512_LBSPPB256_MIWT4_2_PLR1_SU32_SUM0_SUS256_SKXCCM8_VWA4_VWB2_WGM8_WGMXCC1_WGMXCCGn1
    SolutionIndex: 67
    SolutionNameMin: Cijk_Alik_Bljk_BSS_BH_UserArgs_MT128x64x64_MI16x16x1_SN_LDSB1_CLR1_GSU0_GSUC0_GSUWGMRR0_K1_LBSPPA512_LBSPPB128_MIWT4_2_PLR2_SU32_SUM0_SUS256_SKXCCM8_VWA4_VWB1_WGM8_WGMXCC1_WGMXCCGn1
    SolutionIndex: 68
    SolutionNameMin: Cijk_Alik_Bljk_BSS_BH_UserArgs_MT128x64x64_MI16x16x1_SN_LDSB1_CLR1_GSU0_GSUC0_GSUWGMRR0_K1_LBSPPA512_LBSPPB256_MIWT4_2_PLR2_SU32_SUM0_SUS256_SKXCCM8_VWA4_VWB2_WGM8_WGMXCC1_WGMXCCGn1
    SolutionIndex: 69
    SolutionNameMin: Cijk_Alik_Bljk_BSS_BH_UserArgs_MT64x64x64_MI16x16x1_SN_LDSB1_CLR1_GSU0_GSUC0_GSUWGMRR0_K1_LBSPPA128_LBSPPB128_MIWT2_2_PLR1_SU32_SUM0_SUS256_SKXCCM8_VWA1_VWB1_WGM1_WGMXCC1_WGMXCCGn1
    SolutionIndex: 70
    SolutionNameMin: Cijk_Alik_Bljk_BSS_BH_UserArgs_MT64x64x64_MI16x16x1_SN_LDSB1_CLR1_GSU0_GSUC0_GSUWGMRR0_K1_LBSPPA128_LBSPPB256_MIWT2_2_PLR1_SU32_SUM0_SUS256_SKXCCM8_VWA1_VWB2_WGM1_WGMXCC1_WGMXCCGn1
    SolutionIndex: 71
    SolutionNameMin: Cijk_Alik_Bljk_BSS_BH_UserArgs_MT64x64x64_MI16x16x1_SN_LDSB1_CLR1_GSU0_GSUC0_GSUWGMRR0_K1_LBSPPA128_LBSPPB128_MIWT2_2_PLR1_SU32_SUM0_SUS256_SKXCCM8_VWA1_VWB1_WGM4_WGMXCC1_WGMXCCGn1
    SolutionIndex: 72
    SolutionNameMin: Cijk_Alik_Bljk_BSS_BH_UserArgs_MT64x64x64_MI16x16x1_SN_LDSB1_CLR1_GSU0_GSUC0_GSUWGMRR0_K1_LBSPPA128_LBSPPB256_MIWT2_2_PLR1_SU32_SUM0_SUS256_SKXCCM8_VWA1_VWB2_WGM4_WGMXCC1_WGMXCCGn1
    SolutionIndex: 73
    SolutionNameMin: Cijk_Alik_Bljk_BSS_BH_UserArgs_MT64x64x64_MI16x16x1_SN_LDSB1_CLR1_GSU0_GSUC0_GSUWGMRR0_K1_LBSPPA128_LBSPPB128_MIWT2_2_PLR1_SU32_SUM0_SUS256_SKXCCM8_VWA1_VWB1_WGM8_WGMXCC1_WGMXCCGn1
    SolutionIndex: 74
    SolutionNameMin: Cijk_Alik_Bljk_BSS_BH_UserArgs_MT32x64x64_MI16x16x1_SN_LDSB0_CLR1_GSU0_GSUC0_GSUWGMRR0_K1_LBSPPA128_LBSPPB256_MIWT1_2_PLR1_SU32_SUM0_SUS256_SKXCCM8_VWA1_VWB2_WGM1_WGMXCC1_WGMXCCGn1
    SolutionIndex: 75
    SolutionNameMin: Cijk_Alik_Bljk_BSS_BH_UserArgs_MT64x32x64_MI16x16x1_SN_LDSB0_CLR1_GSU0_GSUC0_GSUWGMRR0_K1_LBSPPA128_LBSPPB128_MIWT2_1_PLR1_SU32_SUM0_SUS256_SKXCCM8_VWA1_VWB1_WGM1_WGMXCC1_WGMXCCGn1
    SolutionIndex: 76
    SolutionNameMin: Cijk_Alik_Bljk_BSS_BH_UserArgs_MT32x32x64_MI16x16x1_SN_LDSB0_CLR1_GSU0_GSUC0_GSUWGMRR0_K1_LBSPPA128_LBSPPB128_MIWT1_1_PLR1_SU32_SUM0_SUS256_SKXCCM8_VWA1_VWB1_WGM1_WGMXCC1_WGMXCCGn1
    SolutionIndex: 77
    SolutionNameMin: Cijk_Alik_Bljk_BSS_BH_UserArgs_MT32x32x64_MI16x16x1_SN_LDSB0_CLR1_GSU0_GSUC0_GSUWGMRR0_K1_LBSPPA128_LBSPPB128_MIWT1_1_PLR1_SU32_SUM0_SUS256_SKXCCM8_VWA1_VWB1_WGM4_WGMXCC1_WGMXCCGn1
    SolutionIndex: 78
    SolutionNameMin: Cijk_Alik_Bljk_BSS_BH_UserArgs_MT128x32x128_MI16x16x1_SN_LDSB1_CLR1_GSU0_GSUC0_GSUWGMRR0_K1_LBSPPA1024_LBSPPB256_MIWT4_1_PLR1_SU32_SUM0_SUS256_SKXCCM8_VWA4_VWB1_WGM1_WGMXCC1_WGMXCCGn1
    SolutionIndex: 79
    SolutionNameMin: Cijk_Alik_Bljk_BSS_BH_UserArgs_MT128x32x128_MI16x16x1_SN_LDSB1_CLR1_GSU0_GSUC0_GSUWGMRR0_K1_LBSPPA1024_LBSPPB256_MIWT4_1_PLR2_SU32_SUM0_SUS256_SKXCCM8_VWA4_VWB1_WGM1_WGMXCC1_WGMXCCGn1
    SolutionIndex: 80
    SolutionNameMin: Cijk_Alik_Bljk_BSS_BH_UserArgs_MT64x64x128_MI16x16x1_SN_LDSB1_CLR1_GSU0_GSUC0_GSUWGMRR0_K1_LBSPPA256_LBSPPB256_MIWT2_2_PLR1_SU32_SUM0_SUS256_SKXCCM8_VWA1_VWB1_WGM1_WGMXCC1_WGMXCCGn1
    SolutionIndex: 81
    SolutionNameMin: Cijk_Alik_Bljk_BSS_BH_UserArgs_MT64x64x128_MI16x16x1_SN_LDSB1_CLR1_GSU0_GSUC0_GSUWGMRR0_K1_LBSPPA256_LBSPPB512_MIWT2_2_PLR1_SU32_SUM0_SUS256_SKXCCM8_VWA1_VWB2_WGM1_WGMXCC1_WGMXCCGn1
    SolutionIndex: 82
    SolutionNameMin: Cijk_Alik_Bljk_BSS_BH_UserArgs_MT64x64x128_MI16x16x1_SN_LDSB1_CLR1_GSU0_GSUC0_GSUWGMRR0_K1_LBSPPA256_LBSPPB256_MIWT2_2_PLR2_SU32_SUM0_SUS256_SKXCCM8_VWA1_VWB1_WGM1_WGMXCC1_WGMXCCGn1
    SolutionIndex: 83
    SolutionNameMin: Cijk_Alik_Bljk_BSS_BH_UserArgs_MT64x64x128_MI16x16x1_SN_LDSB1_CLR1_GSU0_GSUC0_GSUWGMRR0_K1_LBSPPA256_LBSPPB512_MIWT2_2_PLR2_SU32_SUM0_SUS256_SKXCCM8_VWA1_VWB2_WGM1_WGMXCC1_WGMXCCGn1
    SolutionIndex: 84
    SolutionNameMin: Cijk_Alik_Bljk_BSS_BH_UserArgs_MT64x64x128_MI16x16x1_SN_LDSB1_CLR1_GSU0_GSUC0_GSUWGMRR0_K1_LBSPPA256_LBSPPB256_MIWT2_2_PLR1_SU32_SUM0_SUS256_SKXCCM8_VWA1_VWB1_WGM4_WGMXCC1_WGMXCCGn1
    SolutionIndex: 85
    SolutionNameMin: Cijk_Alik_Bljk_BSS_BH_UserArgs_MT64x64x128_MI16x16x1_SN_LDSB1_CLR1_GSU0_GSUC0_GSUWGMRR0_K1_LBSPPA256_LBSPPB512_MIWT2_2_PLR1_SU32_SUM0_SUS256_SKXCCM8_VWA1_VWB2_WGM4_WGMXCC1_WGMXCCGn1
    SolutionIndex: 86
    SolutionNameMin: Cijk_Alik_Bljk_BSS_BH_UserArgs_MT64x64x128_MI16x16x1_SN_LDSB1_CLR1_GSU0_GSUC0_GSUWGMRR0_K1_LBSPPA256_LBSPPB256_MIWT2_2_PLR2_SU32_SUM0_SUS256_SKXCCM8_VWA1_VWB1_WGM4_WGMXCC1_WGMXCCGn1
    SolutionIndex: 87
    SolutionNameMin: Cijk_Alik_Bljk_BSS_BH_UserArgs_MT64x64x128_MI16x16x1_SN_LDSB1_CLR1_GSU0_GSUC0_GSUWGMRR0_K1_LBSPPA256_LBSPPB512_MIWT2_2_PLR2_SU32_SUM0_SUS256_SKXCCM8_VWA1_VWB2_WGM4_WGMXCC1_WGMXCCGn1
    SolutionIndex: 88
    SolutionNameMin: Cijk_Alik_Bljk_BSS_BH_UserArgs_MT64x64x128_MI16x16x1_SN_LDSB1_CLR1_GSU0_GSUC0_GSUWGMRR0_K1_LBSPPA256_LBSPPB256_MIWT2_2_PLR1_SU32_SUM0_SUS256_SKXCCM8_VWA1_VWB1_WGM8_WGMXCC1_WGMXCCGn1
    SolutionIndex: 89
    SolutionNameMin: Cijk_Alik_Bljk_BSS_BH_UserArgs_MT64x64x128_MI16x16x1_SN_LDSB1_CLR1_GSU0_GSUC0_GSUWGMRR0_K1_LBSPPA512_LBSPPB256_MIWT2_2_PLR1_SU32_SUM0_SUS256_SKXCCM8_VWA2_VWB1_WGM8_WGMXCC1_WGMXCCGn1
    SolutionIndex: 90
    SolutionNameMin: Cijk_Alik_Bljk_BSS_BH_UserArgs_MT64x64x128_MI16x16x1_SN_LDSB1_CLR1_GSU0_GSUC0_GSUWGMRR0_K1_LBSPPA256_LBSPPB512_MIWT2_2_PLR1_SU32_SUM0_SUS256_SKXCCM8_VWA1_VWB2_WGM8_WGMXCC1_WGMXCCGn1
    SolutionIndex: 91
    SolutionNameMin: Cijk_Alik_Bljk_BSS_BH_UserArgs_MT64x64x128_MI16x16x1_SN_LDSB1_CLR1_GSU0_GSUC0_GSUWGMRR0_K1_LBSPPA256_LBSPPB256_MIWT2_2_PLR2_SU32_SUM0_SUS256_SKXCCM8_VWA1_VWB1_WGM8_WGMXCC1_WGMXCCGn1
    SolutionIndex: 92
    SolutionNameMin: Cijk_Alik_Bljk_BSS_BH_UserArgs_MT64x64x128_MI16x16x1_SN_LDSB1_CLR1_GSU0_GSUC0_GSUWGMRR0_K1_LBSPPA256_LBSPPB512_MIWT2_2_PLR2_SU32_SUM0_SUS256_SKXCCM8_VWA1_VWB2_WGM8_WGMXCC1_WGMXCCGn1
    SolutionIndex: 93
    SolutionNameMin: Cijk_Alik_Bljk_BSS_BH_UserArgs_MT32x64x128_MI16x16x1_SN_LDSB1_CLR1_GSU0_GSUC0_GSUWGMRR0_K1_LBSPPA256_LBSPPB512_MIWT1_2_PLR1_SU32_SUM0_SUS256_SKXCCM8_VWA1_VWB2_WGM1_WGMXCC1_WGMXCCGn1
    SolutionIndex: 94
    SolutionNameMin: Cijk_Alik_Bljk_BSS_BH_UserArgs_MT32x64x128_MI16x16x1_SN_LDSB1_CLR1_GSU0_GSUC0_GSUWGMRR0_K1_LBSPPA256_LBSPPB512_MIWT1_2_PLR2_SU32_SUM0_SUS256_SKXCCM8_VWA1_VWB2_WGM1_WGMXCC1_WGMXCCGn1
    SolutionIndex: 95
    SolutionNameMin: Cijk_Alik_Bljk_BSS_BH_UserArgs_MT32x64x128_MI16x16x1_SN_LDSB1_CLR1_GSU0_GSUC0_GSUWGMRR0_K1_LBSPPA256_LBSPPB512_MIWT1_2_PLR1_SU32_SUM0_SUS256_SKXCCM8_VWA1_VWB2_WGM4_WGMXCC1_WGMXCCGn1
    SolutionIndex: 96
    SolutionNameMin: Cijk_Alik_Bljk_BSS_BH_UserArgs_MT32x64x128_MI16x16x1_SN_LDSB1_CLR1_GSU0_GSUC0_GSUWGMRR0_K1_LBSPPA256_LBSPPB512_MIWT1_2_PLR2_SU32_SUM0_SUS256_SKXCCM8_VWA1_VWB2_WGM4_WGMXCC1_WGMXCCGn1
    SolutionIndex: 97
    SolutionNameMin: Cijk_Alik_Bljk_BSS_BH_UserArgs_MT32x64x128_MI16x16x1_SN_LDSB1_CLR1_GSU0_GSUC0_GSUWGMRR0_K1_LBSPPA256_LBSPPB512_MIWT1_2_PLR1_SU32_SUM0_SUS256_SKXCCM8_VWA1_VWB2_WGM8_WGMXCC1_WGMXCCGn1
    SolutionIndex: 98
    SolutionNameMin: Cijk_Alik_Bljk_BSS_BH_UserArgs_MT32x32x128_MI16x16x1_SN_LDSB1_CLR1_GSU0_GSUC0_GSUWGMRR0_K1_LBSPPA256_LBSPPB256_MIWT1_1_PLR1_SU32_SUM0_SUS256_SKXCCM8_VWA1_VWB1_WGM1_WGMXCC1_WGMXCCGn1
    SolutionIndex: 99
    SolutionNameMin: Cijk_Alik_Bljk_BSS_BH_UserArgs_MT32x32x128_MI16x16x1_SN_LDSB1_CLR1_GSU0_GSUC0_GSUWGMRR0_K1_LBSPPA256_LBSPPB256_MIWT1_1_PLR2_SU32_SUM0_SUS256_SKXCCM8_VWA1_VWB1_WGM1_WGMXCC1_WGMXCCGn1
    SolutionIndex: 100
    SolutionNameMin: Cijk_Alik_Bljk_BSS_BH_UserArgs_MT32x32x128_MI16x16x1_SN_LDSB1_CLR1_GSU0_GSUC0_GSUWGMRR0_K1_LBSPPA256_LBSPPB256_MIWT1_1_PLR2_SU32_SUM0_SUS256_SKXCCM8_VWA1_VWB1_WGM4_WGMXCC1_WGMXCCGn1
    SolutionIndex: 101
    SolutionNameMin: Cijk_Alik_Bljk_BSS_BH_UserArgs_MT32x32x128_MI16x16x1_SN_LDSB1_CLR1_GSU0_GSUC0_GSUWGMRR0_K1_LBSPPA256_LBSPPB256_MIWT1_1_PLR1_SU32_SUM0_SUS256_SKXCCM8_VWA1_VWB1_WGM8_WGMXCC1_WGMXCCGn1
    SolutionIndex: 102
    SolutionNameMin: Cijk_Alik_Bljk_BSS_BH_UserArgs_MT32x32x32_MI16x16x1_SN_LDSB0_CLR1_GSU0_GSUC0_GSUWGMRR0_K1_LBSPPA128_LBSPPB128_MIWT1_1_PLR1_SU32_SUM0_SUS256_SKXCCM8_VWA1_VWB1_WGM1_WGMXCC1_WGMXCCGn1
- - - [128, 128, 1, 128, 128, 128, 128, 128]
    - [98, 0.09]
  - - [128, 128, 1, 256, 128, 128, 256, 256]
    - [36, 0.108]
  - - [128, 128, 1, 512, 128, 128, 512, 512]
    - [99, 0.178]
  - - [128, 128, 1, 1024, 128, 128, 1024, 1024]
    - [99, 0.284]
  - - [128, 128, 1, 2048, 128, 128, 2048, 2048]
    - [98, 0.319]
  - - [128, 128, 1, 4096, 128, 128, 4096, 4096]
    - [0, 0.558]
  - - [128, 128, 1, 8192, 128, 128, 8192, 8192]
    - [21, 1.061]
  - - [128, 256, 1, 128, 128, 128, 128, 128]
    - [37, 0.176]
  - - [128, 256, 1, 256, 128, 128, 256, 256]
    - [36, 0.219]
  - - [128, 256, 1, 512, 128, 128, 512, 512]
    - [98, 0.364]
  - - [128, 256, 1, 1024, 128, 128, 1024, 1024]
    - [98, 0.559]
  - - [128, 256, 1, 2048, 128, 128, 2048, 2048]
    - [1, 0.826]
  - - [128, 256, 1, 4096, 128, 128, 4096, 4096]
    - [21, 1.579]
  - - [128, 256, 1, 8192, 128, 128, 8192, 8192]
    - [76, 2.999]
  - - [128, 512, 1, 128, 128, 128, 128, 128]
    - [37, 0.359]
  - - [128, 512, 1, 256, 128, 128, 256, 256]
    - [36, 0.426]
  - - [128, 512, 1, 512, 128, 128, 512, 512]
    - [99, 0.707]
  - - [128, 512, 1, 1024, 128, 128, 1024, 1024]
    - [0, 1.098]
  - - [128, 512, 1, 2048, 128, 128, 2048, 2048]
    - [22, 2.13]
  - - [128, 512, 1, 4096, 128, 128, 4096, 4096]
    - [76, 3.802]
  - - [128, 512, 1, 8192, 128, 128, 8192, 8192]
    - [99, 6.302]
  - - [128, 1024, 1, 128, 128, 128, 128, 128]
    - [36, 0.699]
  - - [128, 1024, 1, 256, 128, 128, 256, 256]
    - [98, 0.808]
  - - [128, 1024, 1, 512, 128, 128, 512, 512]
    - [36, 1.384]
  - - [128, 1024, 1, 1024, 128, 128, 1024, 1024]
    - [36, 2.464]
  - - [128, 1024, 1, 2048, 128, 128, 2048, 2048]
    - [76, 4.328]
  - - [128, 1024, 1, 4096, 128, 128, 4096, 4096]
    - [99, 7.067]
  - - [128, 1024, 1, 8192, 128, 128, 8192, 8192]
    - [99, 9.238]
  - - [128, 2048, 1, 128, 128, 128, 128, 128]
    - [36, 1.347]
  - - [128, 2048, 1, 256, 128, 128, 256, 256]
    - [36, 1.675]
  - - [128, 2048, 1, 512, 128, 128, 512, 512]
    - [37, 2.743]
  - - [128, 2048, 1, 1024, 128, 128, 1024, 1024]
    - [98, 4.56]
  - - [128, 2048, 1, 2048, 128, 128, 2048, 2048]
    - [74, 7.212]
  - - [128, 2048, 1, 4096, 128, 128, 4096, 4096]
    - [74, 10.605]
  - - [128, 2048, 1, 8192, 128, 128, 8192, 8192]
    - [79, 12.807]
  - - [128, 4096, 1, 128, 128, 128, 128, 128]
    - [32, 2.328]
  - - [128, 4096, 1, 256, 128, 128, 256, 256]
    - [30, 2.973]
  - - [128, 4096, 1, 512, 128, 128, 512, 512]
    - [93, 4.915]
  - - [128, 4096, 1, 1024, 128, 128, 1024, 1024]
    - [74, 7.72]
  - - [128, 4096, 1, 2048, 128, 128, 2048, 2048]
    - [82, 11.167]
  - - [128, 4096, 1, 4096, 128, 128, 4096, 4096]
    - [87, 14.368]
  - - [128, 4096, 1, 8192, 128, 128, 8192, 8192]
    - [17, 17.364]
  - - [128, 8192, 1, 128, 128, 128, 128, 128]
    - [23, 3.702]
  - - [128, 8192, 1, 256, 128, 128, 256, 256]
    - [23, 5.12]
  - - [128, 8192, 1, 512, 128, 128, 512, 512]
    - [80, 8.308]
  - - [128, 8192, 1, 1024, 128, 128, 1024, 1024]
    - [80, 12.183]
  - - [128, 8192, 1, 2048, 128, 128, 2048, 2048]
    - [80, 15.069]
  - - [128, 8192, 1, 4096, 128, 128, 4096, 4096]
    - [61, 18.926]
  - - [128, 8192, 1, 8192, 128, 128, 8192, 8192]
    - [19, 22.488]
  - - [256, 128, 1, 128, 256, 256, 128, 128]
    - [98, 0.18]
  - - [256, 128, 1, 256, 256, 256, 256, 256]
    - [37, 0.214]
  - - [256, 128, 1, 512, 256, 256, 512, 512]
    - [99, 0.366]
  - - [256, 128, 1, 1024, 256, 256, 1024, 1024]
    - [99, 0.523]
  - - [256, 128, 1, 2048, 256, 256, 2048, 2048]
    - [1, 0.824]
  - - [256, 128, 1, 4096, 256, 256, 4096, 4096]
    - [21, 1.586]
  - - [256, 128, 1, 8192, 256, 256, 8192, 8192]
    - [76, 2.97]
  - - [256, 256, 1, 128, 256, 256, 128, 128]
    - [36, 0.352]
  - - [256, 256, 1, 256, 256, 256, 256, 256]
    - [36, 0.42]
  - - [256, 256, 1, 512, 256, 256, 512, 512]
    - [98, 0.691]
  - - [256, 256, 1, 1024, 256, 256, 1024, 1024]
    - [76, 1.146]
  - - [256, 256, 1, 2048, 256, 256, 2048, 2048]
    - [98, 2.181]
  - - [256, 256, 1, 4096, 256, 256, 4096, 4096]
    - [99, 3.84]
  - - [256, 256, 1, 8192, 256, 256, 8192, 8192]
    - [77, 6.343]
  - - [256, 512, 1, 128, 256, 256, 128, 128]
    - [98, 0.676]
  - - [256, 512, 1, 256, 256, 256, 256, 256]
    - [99, 0.807]
  - - [256, 512, 1, 512, 256, 256, 512, 512]
    - [37, 1.397]
  - - [256, 512, 1, 1024, 256, 256, 1024, 1024]
    - [37, 2.506]
  - - [256, 512, 1, 2048, 256, 256, 2048, 2048]
    - [76, 4.322]
  - - [256, 512, 1, 4096, 256, 256, 4096, 4096]
    - [98, 7.124]
  - - [256, 512, 1, 8192, 256, 256, 8192, 8192]
    - [100, 9.126]
  - - [256, 1024, 1, 128, 256, 256, 128, 128]
    - [99, 1.324]
  - - [256, 1024, 1, 256, 256, 256, 256, 256]
    - [98, 1.656]
  - - [256, 1024, 1, 512, 256, 256, 512, 512]
    - [36, 2.766]
  - - [256, 1024, 1, 1024, 256, 256, 1024, 1024]
    - [99, 4.688]
  - - [256, 1024, 1, 2048, 256, 256, 2048, 2048]
    - [74, 7.374]
  - - [256, 1024, 1, 4096, 256, 256, 4096, 4096]
    - [93, 10.745]
  - - [256, 1024, 1, 8192, 256, 256, 8192, 8192]
    - [70, 12.835]
  - - [256, 2048, 1, 128, 256, 256, 128, 128]
    - [31, 2.375]
  - - [256, 2048, 1, 256, 256, 256, 256, 256]
    - [30, 3.023]
  - - [256, 2048, 1, 512, 256, 256, 512, 512]
    - [94, 4.923]
  - - [256, 2048, 1, 1024, 256, 256, 1024, 1024]
    - [93, 7.859]
  - - [256, 2048, 1, 2048, 256, 256, 2048, 2048]
    - [87, 11.297]
  - - [256, 2048, 1, 4096, 256, 256, 4096, 4096]
    - [70, 14.353]
  - - [256, 2048, 1, 8192, 256, 256, 8192, 8192]
    - [92, 17.372]
  - - [256, 4096, 1, 128, 256, 256, 128, 128]
    - [81, 3.775]
  - - [256, 4096, 1, 256, 256, 256, 256, 256]
    - [80, 5.157]
  - - [256, 4096, 1, 512, 256, 256, 512, 512]
    - [82, 8.176]
  - - [256, 4096, 1, 1024, 256, 256, 1024, 1024]
    - [69, 12.103]
  - - [256, 4096, 1, 2048, 256, 256, 2048, 2048]
    - [83, 15.901]
  - - [256, 4096, 1, 4096, 256, 256, 4096, 4096]
    - [66, 18.936]
  - - [256, 4096, 1, 8192, 256, 256, 8192, 8192]
    - [50, 22.19]
  - - [256, 8192, 1, 128, 256, 256, 128, 128]
    - [81, 4.877]
  - - [256, 8192, 1, 256, 256, 256, 256, 256]
    - [27, 6.628]
  - - [256, 8192, 1, 512, 256, 256, 512, 512]
    - [60, 11.013]
  - - [256, 8192, 1, 1024, 256, 256, 1024, 1024]
    - [62, 15.149]
  - - [256, 8192, 1, 2048, 256, 256, 2048, 2048]
    - [60, 18.944]
  - - [256, 8192, 1, 4096, 256, 256, 4096, 4096]
    - [55, 23.921]
  - - [256, 8192, 1, 8192, 256, 256, 8192, 8192]
    - [2, 26.943]
  - - [512, 128, 1, 128, 512, 512, 128, 128]
    - [36, 0.36]
  - - [512, 128, 1, 256, 512, 512, 256, 256]
    - [36, 0.431]
  - - [512, 128, 1, 512, 512, 512, 512, 512]
    - [98, 0.707]
  - - [512, 128, 1, 1024, 512, 512, 1024, 1024]
    - [99, 1.095]
  - - [512, 128, 1, 2048, 512, 512, 2048, 2048]
    - [21, 2.128]
  - - [512, 128, 1, 4096, 512, 512, 4096, 4096]
    - [36, 3.841]
  - - [512, 128, 1, 8192, 512, 512, 8192, 8192]
    - [101, 6.1]
  - - [512, 256, 1, 128, 512, 512, 128, 128]
    - [36, 0.701]
  - - [512, 256, 1, 256, 512, 512, 256, 256]
    - [98, 0.806]
  - - [512, 256, 1, 512, 512, 512, 512, 512]
    - [37, 1.364]
  - - [512, 256, 1, 1024, 512, 512, 1024, 1024]
    - [76, 2.418]
  - - [512, 256, 1, 2048, 512, 512, 2048, 2048]
    - [99, 4.348]
  - - [512, 256, 1, 4096, 512, 512, 4096, 4096]
    - [100, 6.944]
  - - [512, 256, 1, 8192, 512, 512, 8192, 8192]
    - [100, 9.152]
  - - [512, 512, 1, 128, 512, 512, 128, 128]
    - [36, 1.335]
  - - [512, 512, 1, 256, 512, 512, 256, 256]
    - [37, 1.667]
  - - [512, 512, 1, 512, 512, 512, 512, 512]
    - [36, 2.737]
  - - [512, 512, 1, 1024, 512, 512, 1024, 1024]
    - [21, 4.601]
  - - [512, 512, 1, 2048, 512, 512, 2048, 2048]
    - [74, 7.358]
  - - [512, 512, 1, 4096, 512, 512, 4096, 4096]
    - [96, 10.445]
  - - [512, 512, 1, 8192, 512, 512, 8192, 8192]
    - [71, 12.86]
  - - [512, 1024, 1, 128, 512, 512, 128, 128]
    - [30, 2.374]
  - - [512, 1024, 1, 256, 512, 512, 256, 256]
    - [31, 2.99]
  - - [512, 1024, 1, 512, 512, 512, 512, 512]
    - [94, 4.918]
  - - [512, 1024, 1, 1024, 512, 512, 1024, 1024]
    - [75, 7.751]
  - - [512, 1024, 1, 2048, 512, 512, 2048, 2048]
    - [81, 11.282]
  - - [512, 1024, 1, 4096, 512, 512, 4096, 4096]
    - [87, 14.252]
  - - [512, 1024, 1, 8192, 512, 512, 8192, 8192]
    - [90, 17.573]
  - - [512, 2048, 1, 128, 512, 512, 128, 128]
    - [28, 3.804]
  - - [512, 2048, 1, 256, 512, 512, 256, 256]
    - [82, 4.924]
  - - [512, 2048, 1, 512, 512, 512, 512, 512]
    - [82, 8.289]
  - - [512, 2048, 1, 1024, 512, 512, 1024, 1024]
    - [82, 12.11]
  - - [512, 2048, 1, 2048, 512, 512, 2048, 2048]
    - [81, 15.868]
  - - [512, 2048, 1, 4096, 512, 512, 4096, 4096]
    - [66, 18.693]
  - - [512, 2048, 1, 8192, 512, 512, 8192, 8192]
    - [39, 22.07]
  - - [512, 4096, 1, 128, 512, 512, 128, 128]
    - [26, 4.827]
  - - [512, 4096, 1, 256, 512, 512, 256, 256]
    - [82, 6.692]
  - - [512, 4096, 1, 512, 512, 512, 512, 512]
    - [66, 10.705]
  - - [512, 4096, 1, 1024, 512, 512, 1024, 1024]
    - [61, 15.283]
  - - [512, 4096, 1, 2048, 512, 512, 2048, 2048]
    - [56, 19.228]
  - - [512, 4096, 1, 4096, 512, 512, 4096, 4096]
    - [52, 24.352]
  - - [512, 4096, 1, 8192, 512, 512, 8192, 8192]
    - [55, 26.178]
  - - [512, 8192, 1, 128, 512, 512, 128, 128]
    - [14, 5.975]
  - - [512, 8192, 1, 256, 512, 512, 256, 256]
    - [67, 8.277]
  - - [512, 8192, 1, 512, 512, 512, 512, 512]
    - [61, 13.677]
  - - [512, 8192, 1, 1024, 512, 512, 1024, 1024]
    - [61, 18.09]
  - - [512, 8192, 1, 2048, 512, 512, 2048, 2048]
    - [50, 23.501]
  - - [512, 8192, 1, 4096, 512, 512, 4096, 4096]
    - [55, 27.165]
  - - [512, 8192, 1, 8192, 512, 512, 8192, 8192]
    - [2, 26.209]
  - - [1024, 128, 1, 128, 1024, 1024, 128, 128]
    - [36, 0.701]
  - - [1024, 128, 1, 256, 1024, 1024, 256, 256]
    - [98, 0.802]
  - - [1024, 128, 1, 512, 1024, 1024, 512, 512]
    - [98, 1.41]
  - - [1024, 128, 1, 1024, 1024, 1024, 1024, 1024]
    - [36, 2.475]
  - - [1024, 128, 1, 2048, 1024, 1024, 2048, 2048]
    - [99, 4.233]
  - - [1024, 128, 1, 4096, 1024, 1024, 4096, 4096]
    - [100, 6.747]
  - - [1024, 128, 1, 8192, 1024, 1024, 8192, 8192]
    - [100, 9.044]
  - - [1024, 256, 1, 128, 1024, 1024, 128, 128]
    - [37, 1.325]
  - - [1024, 256, 1, 256, 1024, 1024, 256, 256]
    - [37, 1.621]
  - - [1024, 256, 1, 512, 1024, 1024, 512, 512]
    - [37, 2.765]
  - - [1024, 256, 1, 1024, 1024, 1024, 1024, 1024]
    - [36, 4.662]
  - - [1024, 256, 1, 2048, 1024, 1024, 2048, 2048]
    - [31, 7.351]
  - - [1024, 256, 1, 4096, 1024, 1024, 4096, 4096]
    - [97, 10.604]
  - - [1024, 256, 1, 8192, 1024, 1024, 8192, 8192]
    - [72, 12.913]
  - - [1024, 512, 1, 128, 1024, 1024, 128, 128]
    - [35, 2.298]
  - - [1024, 512, 1, 256, 1024, 1024, 256, 256]
    - [31, 2.995]
  - - [1024, 512, 1, 512, 1024, 1024, 512, 512]
    - [93, 4.923]
  - - [1024, 512, 1, 1024, 1024, 1024, 1024, 1024]
    - [94, 7.862]
  - - [1024, 512, 1, 2048, 1024, 1024, 2048, 2048]
    - [85, 11.264]
  - - [1024, 512, 1, 4096, 1024, 1024, 4096, 4096]
    - [86, 14.363]
  - - [1024, 512, 1, 8192, 1024, 1024, 8192, 8192]
    - [88, 17.375]
  - - [1024, 1024, 1, 128, 1024, 1024, 128, 128]
    - [25, 3.846]
  - - [1024, 1024, 1, 256, 1024, 1024, 256, 256]
    - [84, 4.95]
  - - [1024, 1024, 1, 512, 1024, 1024, 512, 512]
    - [81, 8.397]
  - - [1024, 1024, 1, 1024, 1024, 1024, 1024, 1024]
    - [81, 12.082]
  - - [1024, 1024, 1, 2048, 1024, 1024, 2048, 2048]
    - [87, 15.67]
  - - [1024, 1024, 1, 4096, 1024, 1024, 4096, 4096]
    - [66, 19.054]
  - - [1024, 1024, 1, 8192, 1024, 1024, 8192, 8192]
    - [50, 22.014]
  - - [1024, 2048, 1, 128, 1024, 1024, 128, 128]
    - [25, 4.858]
  - - [1024, 2048, 1, 256, 1024, 1024, 256, 256]
    - [80, 6.738]
  - - [1024, 2048, 1, 512, 1024, 1024, 512, 512]
    - [62, 10.729]
  - - [1024, 2048, 1, 1024, 1024, 1024, 1024, 1024]
    - [61, 14.99]
  - - [1024, 2048, 1, 2048, 1024, 1024, 2048, 2048]
    - [65, 18.932]
  - - [1024, 2048, 1, 4096, 1024, 1024, 4096, 4096]
    - [50, 24.229]
  - - [1024, 2048, 1, 8192, 1024, 1024, 8192, 8192]
    - [39, 27.131]
  - - [1024, 4096, 1, 128, 1024, 1024, 128, 128]
    - [13, 5.992]
  - - [1024, 4096, 1, 256, 1024, 1024, 256, 256]
    - [68, 8.175]
  - - [1024, 4096, 1, 512, 1024, 1024, 512, 512]
    - [62, 13.854]
  - - [1024, 4096, 1, 1024, 1024, 1024, 1024, 1024]
    - [39, 18.142]
  - - [1024, 4096, 1, 2048, 1024, 1024, 2048, 2048]
    - [50, 23.56]
  - - [1024, 4096, 1, 4096, 1024, 1024, 4096, 4096]
    - [50, 27.635]
  - - [1024, 4096, 1, 8192, 1024, 1024, 8192, 8192]
    - [49, 25.701]
  - - [1024, 8192, 1, 128, 1024, 1024, 128, 128]
    - [9, 6.724]
  - - [1024, 8192, 1, 256, 1024, 1024, 256, 256]
    - [61, 10.651]
  - - [1024, 8192, 1, 512, 1024, 1024, 512, 512]
    - [39, 16.288]
  - - [1024, 8192, 1, 1024, 1024, 1024, 1024, 1024]
    - [50, 21.818]
  - - [1024, 8192, 1, 2048, 1024, 1024, 2048, 2048]
    - [38, 26.772]
  - - [1024, 8192, 1, 4096, 1024, 1024, 4096, 4096]
    - [41, 28.644]
  - - [1024, 8192, 1, 8192, 1024, 1024, 8192, 8192]
    - [49, 28.654]
  - - [2048, 128, 1, 128, 2048, 2048, 128, 128]
    - [36, 1.36]
  - - [2048, 128, 1, 256, 2048, 2048, 256, 256]
    - [36, 1.628]
  - - [2048, 128, 1, 512, 2048, 2048, 512, 512]
    - [37, 2.739]
  - - [2048, 128, 1, 1024, 2048, 2048, 1024, 1024]
    - [36, 4.64]
  - - [2048, 128, 1, 2048, 2048, 2048, 2048, 2048]
    - [30, 7.414]
  - - [2048, 128, 1, 4096, 2048, 2048, 4096, 4096]
    - [95, 10.412]
  - - [2048, 128, 1, 8192, 2048, 2048, 8192, 8192]
    - [73, 12.347]
  - - [2048, 256, 1, 128, 2048, 2048, 128, 128]
    - [29, 2.38]
  - - [2048, 256, 1, 256, 2048, 2048, 256, 256]
    - [33, 2.974]
  - - [2048, 256, 1, 512, 2048, 2048, 512, 512]
    - [93, 4.919]
  - - [2048, 256, 1, 1024, 2048, 2048, 1024, 1024]
    - [93, 7.822]
  - - [2048, 256, 1, 2048, 2048, 2048, 2048, 2048]
    - [91, 11.164]
  - - [2048, 256, 1, 4096, 2048, 2048, 4096, 4096]
    - [90, 14.434]
  - - [2048, 256, 1, 8192, 2048, 2048, 8192, 8192]
    - [56, 16.82]
  - - [2048, 512, 1, 128, 2048, 2048, 128, 128]
    - [27, 3.831]
  - - [2048, 512, 1, 256, 2048, 2048, 256, 256]
    - [78, 5.064]
  - - [2048, 512, 1, 512, 2048, 2048, 512, 512]
    - [80, 8.367]
  - - [2048, 512, 1, 1024, 2048, 2048, 1024, 1024]
    - [86, 11.994]
  - - [2048, 512, 1, 2048, 2048, 2048, 2048, 2048]
    - [90, 15.725]
  - - [2048, 512, 1, 4096, 2048, 2048, 4096, 4096]
    - [66, 18.725]
  - - [2048, 512, 1, 8192, 2048, 2048, 8192, 8192]
    - [39, 21.947]
  - - [2048, 1024, 1, 128, 2048, 2048, 128, 128]
    - [81, 5.023]
  - - [2048, 1024, 1, 256, 2048, 2048, 256, 256]
    - [79, 6.791]
  - - [2048, 1024, 1, 512, 2048, 2048, 512, 512]
    - [66, 10.65]
  - - [2048, 1024, 1, 1024, 2048, 2048, 1024, 1024]
    - [59, 15.037]
  - - [2048, 1024, 1, 2048, 2048, 2048, 2048, 2048]
    - [65, 19.061]
  - - [2048, 1024, 1, 4096, 2048, 2048, 4096, 4096]
    - [50, 24.29]
  - - [2048, 1024, 1, 8192, 2048, 2048, 8192, 8192]
    - [39, 27.864]
  - - [2048, 2048, 1, 128, 2048, 2048, 128, 128]
    - [4, 5.782]
  - - [2048, 2048, 1, 256, 2048, 2048, 256, 256]
    - [63, 8.338]
  - - [2048, 2048, 1, 512, 2048, 2048, 512, 512]
    - [61, 13.19]
  - - [2048, 2048, 1, 1024, 2048, 2048, 1024, 1024]
    - [45, 18.15]
  - - [2048, 2048, 1, 2048, 2048, 2048, 2048, 2048]
    - [39, 23.756]
  - - [2048, 2048, 1, 4096, 2048, 2048, 4096, 4096]
    - [40, 30.053]
  - - [2048, 2048, 1, 8192, 2048, 2048, 8192, 8192]
    - [41, 28.55]
  - - [2048, 4096, 1, 128, 2048, 2048, 128, 128]
    - [14, 6.625]
  - - [2048, 4096, 1, 256, 2048, 2048, 256, 256]
    - [62, 10.752]
  - - [2048, 4096, 1, 512, 2048, 2048, 512, 512]
    - [50, 16.002]
  - - [2048, 4096, 1, 1024, 2048, 2048, 1024, 1024]
    - [43, 21.803]
  - - [2048, 4096, 1, 2048, 2048, 2048, 2048, 2048]
    - [47, 26.596]
  - - [2048, 4096, 1, 4096, 2048, 2048, 4096, 4096]
    - [44, 29.048]
  - - [2048, 4096, 1, 8192, 2048, 2048, 8192, 8192]
    - [41, 28.954]
  - - [2048, 8192, 1, 128, 2048, 2048, 128, 128]
    - [17, 7.714]
  - - [2048, 8192, 1, 256, 2048, 2048, 256, 256]
    - [62, 12.426]
  - - [2048, 8192, 1, 512, 2048, 2048, 512, 512]
    - [45, 18.14]
  - - [2048, 8192, 1, 1024, 2048, 2048, 1024, 1024]
    - [55, 24.579]
  - - [2048, 8192, 1, 2048, 2048, 2048, 2048, 2048]
    - [52, 28.167]
  - - [2048, 8192, 1, 4096, 2048, 2048, 4096, 4096]
    - [55, 32.133]
  - - [2048, 8192, 1, 8192, 2048, 2048, 8192, 8192]
    - [53, 34.064]
  - - [4096, 128, 1, 128, 4096, 4096, 128, 128]
    - [29, 2.346]
  - - [4096, 128, 1, 256, 4096, 4096, 256, 256]
    - [34, 2.96]
  - - [4096, 128, 1, 512, 4096, 4096, 512, 512]
    - [93, 4.921]
  - - [4096, 128, 1, 1024, 4096, 4096, 1024, 1024]
    - [20, 7.892]
  - - [4096, 128, 1, 2048, 4096, 4096, 2048, 2048]
    - [86, 11.208]
  - - [4096, 128, 1, 4096, 4096, 4096, 4096, 4096]
    - [90, 13.925]
  - - [4096, 128, 1, 8192, 4096, 4096, 8192, 8192]
    - [16, 16.73]
  - - [4096, 256, 1, 128, 4096, 4096, 128, 128]
    - [27, 3.827]
  - - [4096, 256, 1, 256, 4096, 4096, 256, 256]
    - [27, 5.032]
  - - [4096, 256, 1, 512, 4096, 4096, 512, 512]
    - [88, 8.146]
  - - [4096, 256, 1, 1024, 4096, 4096, 1024, 1024]
    - [89, 11.989]
  - - [4096, 256, 1, 2048, 4096, 4096, 2048, 2048]
    - [88, 15.764]
  - - [4096, 256, 1, 4096, 4096, 4096, 4096, 4096]
    - [57, 18.148]
  - - [4096, 256, 1, 8192, 4096, 4096, 8192, 8192]
    - [42, 21.923]
  - - [4096, 512, 1, 128, 4096, 4096, 128, 128]
    - [78, 4.882]
  - - [4096, 512, 1, 256, 4096, 4096, 256, 256]
    - [90, 6.706]
  - - [4096, 512, 1, 512, 4096, 4096, 512, 512]
    - [66, 10.628]
  - - [4096, 512, 1, 1024, 4096, 4096, 1024, 1024]
    - [65, 15.158]
  - - [4096, 512, 1, 2048, 4096, 4096, 2048, 2048]
    - [65, 19.195]
  - - [4096, 512, 1, 4096, 4096, 4096, 4096, 4096]
    - [45, 23.368]
  - - [4096, 512, 1, 8192, 4096, 4096, 8192, 8192]
    - [42, 26.522]
  - - [4096, 1024, 1, 128, 4096, 4096, 128, 128]
    - [27, 5.615]
  - - [4096, 1024, 1, 256, 4096, 4096, 256, 256]
    - [61, 8.192]
  - - [4096, 1024, 1, 512, 4096, 4096, 512, 512]
    - [65, 13.259]
  - - [4096, 1024, 1, 1024, 4096, 4096, 1024, 1024]
    - [50, 17.769]
  - - [4096, 1024, 1, 2048, 4096, 4096, 2048, 2048]
    - [51, 23.26]
  - - [4096, 1024, 1, 4096, 4096, 4096, 4096, 4096]
    - [42, 28.43]
  - - [4096, 1024, 1, 8192, 4096, 4096, 8192, 8192]
    - [39, 29.665]
  - - [4096, 2048, 1, 128, 4096, 4096, 128, 128]
    - [10, 6.604]
  - - [4096, 2048, 1, 256, 4096, 4096, 256, 256]
    - [15, 10.313]
  - - [4096, 2048, 1, 512, 4096, 4096, 512, 512]
    - [50, 15.922]
  - - [4096, 2048, 1, 1024, 4096, 4096, 1024, 1024]
    - [45, 22.288]
  - - [4096, 2048, 1, 2048, 4096, 4096, 2048, 2048]
    - [45, 27.326]
  - - [4096, 2048, 1, 4096, 4096, 4096, 4096, 4096]
    - [45, 28.776]
  - - [4096, 2048, 1, 8192, 4096, 4096, 8192, 8192]
    - [6, 29.937]
  - - [4096, 4096, 1, 128, 4096, 4096, 128, 128]
    - [18, 7.585]
  - - [4096, 4096, 1, 256, 4096, 4096, 256, 256]
    - [47, 11.717]
  - - [4096, 4096, 1, 512, 4096, 4096, 512, 512]
    - [50, 17.948]
  - - [4096, 4096, 1, 1024, 4096, 4096, 1024, 1024]
    - [49, 23.73]
  - - [4096, 4096, 1, 2048, 4096, 4096, 2048, 2048]
    - [55, 27.985]
  - - [4096, 4096, 1, 4096, 4096, 4096, 4096, 4096]
    - [49, 31.837]
  - - [4096, 4096, 1, 8192, 4096, 4096, 8192, 8192]
    - [48, 35.026]
  - - [4096, 8192, 1, 128, 4096, 4096, 128, 128]
    - [11, 8.245]
  - - [4096, 8192, 1, 256, 4096, 4096, 256, 256]
    - [55, 12.778]
  - - [4096, 8192, 1, 512, 4096, 4096, 512, 512]
    - [50, 18.77]
  - - [4096, 8192, 1, 1024, 4096, 4096, 1024, 1024]
    - [54, 23.801]
  - - [4096, 8192, 1, 2048, 4096, 4096, 2048, 2048]
    - [55, 27.723]
  - - [4096, 8192, 1, 4096, 4096, 4096, 4096, 4096]
    - [50, 33.046]
  - - [4096, 8192, 1, 8192, 4096, 4096, 8192, 8192]
    - [48, 35.186]
  - - [8192, 128, 1, 128, 8192, 8192, 128, 128]
    - [85, 3.711]
  - - [8192, 128, 1, 256, 8192, 8192, 256, 256]
    - [82, 4.99]
  - - [8192, 128, 1, 512, 8192, 8192, 512, 512]
    - [84, 8.185]
  - - [8192, 128, 1, 1024, 8192, 8192, 1024, 1024]
    - [73, 11.94]
  - - [8192, 128, 1, 2048, 8192, 8192, 2048, 2048]
    - [88, 14.923]
  - - [8192, 128, 1, 4096, 8192, 8192, 4096, 4096]
    - [56, 18.628]
  - - [8192, 128, 1, 8192, 8192, 8192, 8192, 8192]
    - [12, 22.088]
  - - [8192, 256, 1, 128, 8192, 8192, 128, 128]
    - [24, 4.83]
  - - [8192, 256, 1, 256, 8192, 8192, 256, 256]
    - [90, 6.662]
  - - [8192, 256, 1, 512, 8192, 8192, 512, 512]
    - [58, 10.711]
  - - [8192, 256, 1, 1024, 8192, 8192, 1024, 1024]
    - [58, 14.697]
  - - [8192, 256, 1, 2048, 8192, 8192, 2048, 2048]
    - [58, 18.626]
  - - [8192, 256, 1, 4096, 8192, 8192, 4096, 4096]
    - [41, 23.205]
  - - [8192, 256, 1, 8192, 8192, 8192, 8192, 8192]
    - [41, 27.901]
  - - [8192, 512, 1, 128, 8192, 8192, 128, 128]
    - [3, 5.699]
  - - [8192, 512, 1, 256, 8192, 8192, 256, 256]
    - [64, 8.108]
  - - [8192, 512, 1, 512, 8192, 8192, 512, 512]
    - [65, 13.284]
  - - [8192, 512, 1, 1024, 8192, 8192, 1024, 1024]
    - [52, 17.951]
  - - [8192, 512, 1, 2048, 8192, 8192, 2048, 2048]
    - [41, 22.642]
  - - [8192, 512, 1, 4096, 8192, 8192, 4096, 4096]
    - [42, 28.518]
  - - [8192, 512, 1, 8192, 8192, 8192, 8192, 8192]
    - [39, 27.309]
  - - [8192, 1024, 1, 128, 8192, 8192, 128, 128]
    - [11, 6.694]
  - - [8192, 1024, 1, 256, 8192, 8192, 256, 256]
    - [55, 10.558]
  - - [8192, 1024, 1, 512, 8192, 8192, 512, 512]
    - [55, 15.919]
  - - [8192, 1024, 1, 1024, 8192, 8192, 1024, 1024]
    - [47, 21.838]
  - - [8192, 1024, 1, 2048, 8192, 8192, 2048, 2048]
    - [46, 27.327]
  - - [8192, 1024, 1, 4096, 8192, 8192, 4096, 4096]
    - [5, 28.899]
  - - [8192, 1024, 1, 8192, 8192, 8192, 8192, 8192]
    - [7, 30.13]
  - - [8192, 2048, 1, 128, 8192, 8192, 128, 128]
    - [18, 7.748]
  - - [8192, 2048, 1, 256, 8192, 8192, 256, 256]
    - [47, 11.698]
  - - [8192, 2048, 1, 512, 8192, 8192, 512, 512]
    - [47, 17.86]
  - - [8192, 2048, 1, 1024, 8192, 8192, 1024, 1024]
    - [50, 24.259]
  - - [8192, 2048, 1, 2048, 8192, 8192, 2048, 2048]
    - [45, 28.162]
  - - [8192, 2048, 1, 4096, 8192, 8192, 4096, 4096]
    - [51, 31.807]
  - - [8192, 2048, 1, 8192, 8192, 8192, 8192, 8192]
    - [52, 35.27]
  - - [8192, 4096, 1, 128, 8192, 8192, 128, 128]
    - [8, 8.642]
  - - [8192, 4096, 1, 256, 8192, 8192, 256, 256]
    - [55, 12.865]
  - - [8192, 4096, 1, 512, 8192, 8192, 512, 512]
    - [47, 18.551]
  - - [8192, 4096, 1, 1024, 8192, 8192, 1024, 1024]
    - [55, 23.911]
  - - [8192, 4096, 1, 2048, 8192, 8192, 2048, 2048]
    - [55, 28.552]
  - - [8192, 4096, 1, 4096, 8192, 8192, 4096, 4096]
    - [55, 33.84]
  - - [8192, 4096, 1, 8192, 8192, 8192, 8192, 8192]
    - [49, 35.419]
  - - [8192, 8192, 1, 128, 8192, 8192, 128, 128]
    - [11, 7.124]
  - - [8192, 8192, 1, 256, 8192, 8192, 256, 256]
    - [47, 11.449]
  - - [8192, 8192, 1, 512, 8192, 8192, 512, 512]
    - [6, 17.862]
  - - [8192, 8192, 1, 1024, 8192, 8192, 1024, 1024]
    - [50, 24.129]
  - - [8192, 8192, 1, 2048, 8192, 8192, 2048, 2048]
    - [55, 29.407]
  - - [8192, 8192, 1, 4096, 8192, 8192, 4096, 4096]
    - [52, 34.87]
  - - [8192, 8192, 1, 8192, 8192, 8192, 8192, 8192]
    - [50, 37.064]
  - - [1, 1, 1, 32, 1, 1, 32, 32]
    - [102, 0.0]
- null
- null
- DeviceEfficiency
- GridBased
