library/src/amd_detail/rocblaslt/src/Tensile/Logic/streamk/gfx942/aquavanjaram942_Cijk_Ailk_Bjlk_HSS_BH_UserArgs.yaml
- {MinimumRequiredVersion: 4.33.0}
- aquavanjaram942
- gfx942
- [Device 0049, Device 0050]
    SolutionIndex: 0
    SolutionNameMin: Cijk_Ailk_Bjlk_HSS_BH_UserArgs_MT256x256x32_MI16x16x1_SN_LDSB0_CLR1_GSU0_GSUC0_GSUWGMRR0_K1_LBSPPA2048_LBSPPB2048_LPA0_LPB0_MIWT8_8_PLR1_SU32_SUM0_SUS256_SKXCCM0_VWA4_VWB8_WGM4_WGMXCC1_WGMXCCGn1
    SolutionIndex: 1
    SolutionNameMin: Cijk_Ailk_Bjlk_HSS_BH_UserArgs_MT256x256x32_MI16x16x1_SN_LDSB0_CLR1_GSU0_GSUC0_GSUWGMRR0_K1_LBSPPA2048_LBSPPB2048_LPA0_LPB0_MIWT8_8_PLR1_SU32_SUM0_SUS256_SKXCCM0_VWA4_VWB8_WGM8_WGMXCC1_WGMXCCGn1
    SolutionIndex: 2
    SolutionNameMin: Cijk_Ailk_Bjlk_HSS_BH_UserArgs_MT128x256x32_MI16x16x1_SN_LDSB1_CLR1_GSU0_GSUC0_GSUWGMRR0_K1_LBSPPA1024_LBSPPB2048_LPA0_LPB0_MIWT4_8_PLR1_SU32_SUM0_SUS256_SKXCCM0_VWA4_VWB4_WGM1_WGMXCC1_WGMXCCGn1
    SolutionIndex: 3
    SolutionNameMin: Cijk_Ailk_Bjlk_HSS_BH_UserArgs_MT128x256x32_MI16x16x1_SN_LDSB1_CLR1_GSU0_GSUC0_GSUWGMRR0_K1_LBSPPA1024_LBSPPB2048_LPA32_LPB0_MIWT4_8_PLR1_SU32_SUM0_SUS256_SKXCCM0_VWA2_VWB8_WGM1_WGMXCC1_WGMXCCGn1
    SolutionIndex: 4
    SolutionNameMin: Cijk_Ailk_Bjlk_HSS_BH_UserArgs_MT128x256x32_MI16x16x1_SN_LDSB1_CLR1_GSU0_GSUC0_GSUWGMRR0_K1_LBSPPA1024_LBSPPB2048_LPA0_LPB0_MIWT4_8_PLR1_SU32_SUM0_SUS256_SKXCCM0_VWA4_VWB8_WGM8_WGMXCC1_WGMXCCGn1
    SolutionIndex: 5
    SolutionNameMin: Cijk_Ailk_Bjlk_HSS_BH_UserArgs_MT256x128x32_MI16x16x1_SN_LDSB1_CLR1_GSU0_GSUC0_GSUWGMRR0_K1_LBSPPA2048_LBSPPB1024_LPA0_LPB32_MIWT8_4_PLR1_SU32_SUM0_SUS256_SKXCCM0_VWA4_VWB2_WGM1_WGMXCC1_WGMXCCGn1
    SolutionIndex: 6
    SolutionNameMin: Cijk_Ailk_Bjlk_HSS_BH_UserArgs_MT128x64x32_MI16x16x1_SN_LDSB0_CLR1_GSU0_GSUC0_GSUWGMRR0_K1_LBSPPA1024_LBSPPB512_LPA0_LPB32_MIWT4_2_PLR1_SU32_SUM0_SUS256_SKXCCM0_VWA4_VWB2_WGM1_WGMXCC1_WGMXCCGn1
    SolutionIndex: 7
    SolutionNameMin: Cijk_Ailk_Bjlk_HSS_BH_UserArgs_MT32x32x32_MI16x16x1_SN_LDSB0_CLR1_GSU0_GSUC0_GSUWGMRR0_K1_LBSPPA256_LBSPPB256_LPA16_LPB16_MIWT1_1_PLR1_SU32_SUM0_SUS256_SKXCCM0_VWA1_VWB1_WGM1_WGMXCC1_WGMXCCGn1
    SolutionIndex: 8
    SolutionNameMin: Cijk_Ailk_Bjlk_HSS_BH_UserArgs_MT32x32x32_MI16x16x1_SN_LDSB0_CLR0_GSU0_GSUC0_GSUWGMRR0_K1_LBSPPA256_LBSPPB256_LPA16_LPB16_MIWT1_1_PLR0_SU32_SUM0_SUS256_SKXCCM0_VWA1_VWB1_WGM1_WGMXCC1_WGMXCCGn1
    SolutionIndex: 9
    SolutionNameMin: Cijk_Ailk_Bjlk_HSS_BH_UserArgs_MT256x256x64_MI16x16x1_SN_LDSB1_CLR1_GSU0_GSUC0_GSUWGMRR0_K1_LBSPPA2048_LBSPPB2048_LPA0_LPB0_MIWT8_8_PLR2_SU32_SUM0_SUS256_SKXCCM0_VWA4_VWB8_WGM4_WGMXCC1_WGMXCCGn1
    SolutionIndex: 10
    SolutionNameMin: Cijk_Ailk_Bjlk_HSS_BH_UserArgs_MT128x256x64_MI16x16x1_SN_LDSB1_CLR1_GSU0_GSUC0_GSUWGMRR0_K1_LBSPPA1024_LBSPPB2048_LPA0_LPB32_MIWT4_8_PLR1_SU32_SUM0_SUS256_SKXCCM0_VWA4_VWB2_WGM4_WGMXCC1_WGMXCCGn1
    SolutionIndex: 11
    SolutionNameMin: Cijk_Ailk_Bjlk_HSS_BH_UserArgs_MT256x128x64_MI16x16x1_SN_LDSB1_CLR1_GSU0_GSUC0_GSUWGMRR0_K1_LBSPPA2048_LBSPPB1024_LPA0_LPB16_MIWT8_4_PLR1_SU32_SUM0_SUS256_SKXCCM0_VWA4_VWB1_WGM1_WGMXCC1_WGMXCCGn1
    SolutionIndex: 12
    SolutionNameMin: Cijk_Ailk_Bjlk_HSS_BH_UserArgs_MT128x128x64_MI16x16x1_SN_LDSB1_CLR1_GSU0_GSUC0_GSUWGMRR0_K1_LBSPPA1024_LBSPPB1024_LPA0_LPB0_MIWT4_4_PLR1_SU32_SUM0_SUS256_SKXCCM0_VWA4_VWB4_WGM1_WGMXCC1_WGMXCCGn1
    SolutionIndex: 13
    SolutionNameMin: Cijk_Ailk_Bjlk_HSS_BH_UserArgs_MT128x128x64_MI16x16x1_SN_LDSB1_CLR1_GSU0_GSUC0_GSUWGMRR0_K1_LBSPPA1024_LBSPPB1024_LPA0_LPB0_MIWT4_4_PLR1_SU32_SUM0_SUS256_SKXCCM0_VWA4_VWB4_WGM8_WGMXCC1_WGMXCCGn1
    SolutionIndex: 14
    SolutionNameMin: Cijk_Ailk_Bjlk_HSS_BH_UserArgs_MT64x128x64_MI16x16x1_SN_LDSB1_CLR1_GSU0_GSUC0_GSUWGMRR0_K1_LBSPPA512_LBSPPB1024_LPA16_LPB0_MIWT2_4_PLR2_SU32_SUM0_SUS256_SKXCCM0_VWA1_VWB4_WGM1_WGMXCC1_WGMXCCGn1
    SolutionIndex: 15
    SolutionNameMin: Cijk_Ailk_Bjlk_HSS_BH_UserArgs_MT64x128x64_MI16x16x1_SN_LDSB1_CLR1_GSU0_GSUC0_GSUWGMRR0_K1_LBSPPA512_LBSPPB1024_LPA32_LPB0_MIWT2_4_PLR2_SU32_SUM0_SUS256_SKXCCM0_VWA2_VWB4_WGM1_WGMXCC1_WGMXCCGn1
    SolutionIndex: 16
    SolutionNameMin: Cijk_Ailk_Bjlk_HSS_BH_UserArgs_MT128x64x64_MI16x16x1_SN_LDSB1_CLR1_GSU0_GSUC0_GSUWGMRR0_K1_LBSPPA1024_LBSPPB512_LPA0_LPB32_MIWT4_2_PLR1_SU32_SUM0_SUS256_SKXCCM0_VWA4_VWB2_WGM1_WGMXCC1_WGMXCCGn1
    SolutionIndex: 17
    SolutionNameMin: Cijk_Ailk_Bjlk_HSS_BH_UserArgs_MT128x64x64_MI16x16x1_SN_LDSB1_CLR1_GSU0_GSUC0_GSUWGMRR0_K1_LBSPPA1024_LBSPPB512_LPA0_LPB32_MIWT4_2_PLR2_SU32_SUM0_SUS256_SKXCCM0_VWA4_VWB2_WGM1_WGMXCC1_WGMXCCGn1
    SolutionIndex: 18
    SolutionNameMin: Cijk_Ailk_Bjlk_HSS_BH_UserArgs_MT128x64x64_MI16x16x1_SN_LDSB1_CLR1_GSU0_GSUC0_GSUWGMRR0_K1_LBSPPA1024_LBSPPB512_LPA0_LPB32_MIWT4_2_PLR1_SU32_SUM0_SUS256_SKXCCM0_VWA4_VWB2_WGM4_WGMXCC1_WGMXCCGn1
    SolutionIndex: 19
    SolutionNameMin: Cijk_Ailk_Bjlk_HSS_BH_UserArgs_MT64x64x64_MI16x16x1_SN_LDSB1_CLR1_GSU0_GSUC0_GSUWGMRR0_K1_LBSPPA512_LBSPPB512_LPA32_LPB32_MIWT2_2_PLR1_SU32_SUM0_SUS256_SKXCCM0_VWA2_VWB2_WGM1_WGMXCC1_WGMXCCGn1
    SolutionIndex: 20
    SolutionNameMin: Cijk_Ailk_Bjlk_HSS_BH_UserArgs_MT64x64x64_MI16x16x1_SN_LDSB1_CLR1_GSU0_GSUC0_GSUWGMRR0_K1_LBSPPA512_LBSPPB512_LPA32_LPB32_MIWT2_2_PLR1_SU32_SUM0_SUS256_SKXCCM0_VWA2_VWB2_WGM8_WGMXCC1_WGMXCCGn1
    SolutionIndex: 21
    SolutionNameMin: Cijk_Ailk_Bjlk_HSS_BH_UserArgs_MT32x64x64_MI16x16x1_SN_LDSB0_CLR1_GSU0_GSUC0_GSUWGMRR0_K1_LBSPPA256_LBSPPB512_LPA16_LPB32_MIWT1_2_PLR1_SU32_SUM0_SUS256_SKXCCM0_VWA1_VWB2_WGM1_WGMXCC1_WGMXCCGn1
    SolutionIndex: 22
    SolutionNameMin: Cijk_Ailk_Bjlk_HSS_BH_UserArgs_MT32x32x64_MI16x16x1_SN_LDSB0_CLR1_GSU0_GSUC0_GSUWGMRR0_K1_LBSPPA256_LBSPPB256_LPA16_LPB16_MIWT1_1_PLR1_SU32_SUM0_SUS256_SKXCCM0_VWA1_VWB1_WGM1_WGMXCC1_WGMXCCGn1
    SolutionIndex: 23
    SolutionNameMin: Cijk_Ailk_Bjlk_HSS_BH_UserArgs_MT32x32x64_MI16x16x1_SN_LDSB0_CLR1_GSU0_GSUC0_GSUWGMRR0_K1_LBSPPA256_LBSPPB256_LPA16_LPB16_MIWT1_1_PLR2_SU32_SUM0_SUS256_SKXCCM0_VWA1_VWB1_WGM1_WGMXCC1_WGMXCCGn1
    SolutionIndex: 24
    SolutionNameMin: Cijk_Ailk_Bjlk_HSS_BH_UserArgs_MT128x128x128_MI16x16x1_SN_LDSB1_CLR1_GSU0_GSUC0_GSUWGMRR0_K1_LBSPPA1024_LBSPPB1024_LPA0_LPB0_MIWT4_4_PLR1_SU32_SUM0_SUS256_SKXCCM0_VWA4_VWB4_WGM1_WGMXCC1_WGMXCCGn1
    SolutionIndex: 25
    SolutionNameMin: Cijk_Ailk_Bjlk_HSS_BH_UserArgs_MT128x128x128_MI16x16x1_SN_LDSB1_CLR1_GSU0_GSUC0_GSUWGMRR0_K1_LBSPPA1024_LBSPPB1024_LPA0_LPB0_MIWT4_4_PLR2_SU32_SUM0_SUS256_SKXCCM0_VWA4_VWB4_WGM1_WGMXCC1_WGMXCCGn1
    SolutionIndex: 26
    SolutionNameMin: Cijk_Ailk_Bjlk_HSS_BH_UserArgs_MT128x128x128_MI16x16x1_SN_LDSB1_CLR1_GSU0_GSUC0_GSUWGMRR0_K1_LBSPPA1024_LBSPPB1024_LPA0_LPB0_MIWT4_4_PLR1_SU32_SUM0_SUS256_SKXCCM0_VWA4_VWB4_WGM4_WGMXCC1_WGMXCCGn1
    SolutionIndex: 27
    SolutionNameMin: Cijk_Ailk_Bjlk_HSS_BH_UserArgs_MT128x128x128_MI16x16x1_SN_LDSB1_CLR1_GSU0_GSUC0_GSUWGMRR0_K1_LBSPPA1024_LBSPPB1024_LPA0_LPB0_MIWT4_4_PLR2_SU32_SUM0_SUS256_SKXCCM0_VWA4_VWB4_WGM4_WGMXCC1_WGMXCCGn1
    SolutionIndex: 28
    SolutionNameMin: Cijk_Ailk_Bjlk_HSS_BH_UserArgs_MT128x128x128_MI16x16x1_SN_LDSB1_CLR1_GSU0_GSUC0_GSUWGMRR0_K1_LBSPPA1024_LBSPPB1024_LPA0_LPB0_MIWT4_4_PLR1_SU32_SUM0_SUS256_SKXCCM0_VWA4_VWB4_WGM8_WGMXCC1_WGMXCCGn1
    SolutionIndex: 29
    SolutionNameMin: Cijk_Ailk_Bjlk_HSS_BH_UserArgs_MT128x128x128_MI16x16x1_SN_LDSB1_CLR1_GSU0_GSUC0_GSUWGMRR0_K1_LBSPPA1024_LBSPPB1024_LPA0_LPB0_MIWT4_4_PLR2_SU32_SUM0_SUS256_SKXCCM0_VWA4_VWB4_WGM8_WGMXCC1_WGMXCCGn1
    SolutionIndex: 30
    SolutionNameMin: Cijk_Ailk_Bjlk_HSS_BH_UserArgs_MT64x128x128_MI16x16x1_SN_LDSB1_CLR1_GSU0_GSUC0_GSUWGMRR0_K1_LBSPPA512_LBSPPB1024_LPA16_LPB0_MIWT2_4_PLR2_SU32_SUM0_SUS256_SKXCCM0_VWA1_VWB4_WGM8_WGMXCC1_WGMXCCGn1
    SolutionIndex: 31
    SolutionNameMin: Cijk_Ailk_Bjlk_HSS_BH_UserArgs_MT128x64x128_MI16x16x1_SN_LDSB1_CLR1_GSU0_GSUC0_GSUWGMRR0_K1_LBSPPA1024_LBSPPB512_LPA0_LPB16_MIWT4_2_PLR1_SU32_SUM0_SUS256_SKXCCM0_VWA4_VWB1_WGM4_WGMXCC1_WGMXCCGn1
    SolutionIndex: 32
    SolutionNameMin: Cijk_Ailk_Bjlk_HSS_BH_UserArgs_MT128x64x128_MI16x16x1_SN_LDSB1_CLR1_GSU0_GSUC0_GSUWGMRR0_K1_LBSPPA1024_LBSPPB512_LPA0_LPB32_MIWT4_2_PLR1_SU32_SUM0_SUS256_SKXCCM0_VWA4_VWB2_WGM4_WGMXCC1_WGMXCCGn1
    SolutionIndex: 33
    SolutionNameMin: Cijk_Ailk_Bjlk_HSS_BH_UserArgs_MT128x64x128_MI16x16x1_SN_LDSB1_CLR1_GSU0_GSUC0_GSUWGMRR0_K1_LBSPPA1024_LBSPPB512_LPA0_LPB16_MIWT4_2_PLR2_SU32_SUM0_SUS256_SKXCCM0_VWA4_VWB1_WGM4_WGMXCC1_WGMXCCGn1
    SolutionIndex: 34
    SolutionNameMin: Cijk_Ailk_Bjlk_HSS_BH_UserArgs_MT128x64x128_MI16x16x1_SN_LDSB1_CLR1_GSU0_GSUC0_GSUWGMRR0_K1_LBSPPA1024_LBSPPB512_LPA0_LPB32_MIWT4_2_PLR1_SU32_SUM0_SUS256_SKXCCM0_VWA4_VWB2_WGM8_WGMXCC1_WGMXCCGn1
    SolutionIndex: 35
    SolutionNameMin: Cijk_Ailk_Bjlk_HSS_BH_UserArgs_MT128x64x128_MI16x16x1_SN_LDSB1_CLR1_GSU0_GSUC0_GSUWGMRR0_K1_LBSPPA1024_LBSPPB512_LPA0_LPB16_MIWT4_2_PLR2_SU32_SUM0_SUS256_SKXCCM0_VWA4_VWB1_WGM8_WGMXCC1_WGMXCCGn1
    SolutionIndex: 36
    SolutionNameMin: Cijk_Ailk_Bjlk_HSS_BH_UserArgs_MT128x64x128_MI16x16x1_SN_LDSB1_CLR1_GSU0_GSUC0_GSUWGMRR0_K1_LBSPPA1024_LBSPPB512_LPA32_LPB32_MIWT4_2_PLR2_SU32_SUM0_SUS256_SKXCCM0_VWA2_VWB2_WGM8_WGMXCC1_WGMXCCGn1
    SolutionIndex: 37
    SolutionNameMin: Cijk_Ailk_Bjlk_HSS_BH_UserArgs_MT128x64x128_MI16x16x1_SN_LDSB1_CLR1_GSU0_GSUC0_GSUWGMRR0_K1_LBSPPA1024_LBSPPB512_LPA0_LPB32_MIWT4_2_PLR2_SU32_SUM0_SUS256_SKXCCM0_VWA4_VWB2_WGM8_WGMXCC1_WGMXCCGn1
    SolutionIndex: 38
    SolutionNameMin: Cijk_Ailk_Bjlk_HSS_BH_UserArgs_MT128x32x128_MI16x16x1_SN_LDSB1_CLR1_GSU0_GSUC0_GSUWGMRR0_K1_LBSPPA1024_LBSPPB256_LPA0_LPB16_MIWT4_1_PLR2_SU32_SUM0_SUS256_SKXCCM0_VWA4_VWB1_WGM1_WGMXCC1_WGMXCCGn1
    SolutionIndex: 39
    SolutionNameMin: Cijk_Ailk_Bjlk_HSS_BH_UserArgs_MT64x64x128_MI16x16x1_SN_LDSB1_CLR1_GSU0_GSUC0_GSUWGMRR0_K1_LBSPPA512_LBSPPB512_LPA16_LPB32_MIWT2_2_PLR2_SU32_SUM0_SUS256_SKXCCM0_VWA1_VWB2_WGM4_WGMXCC1_WGMXCCGn1
    SolutionIndex: 40
    SolutionNameMin: Cijk_Ailk_Bjlk_HSS_BH_UserArgs_MT64x64x128_MI16x16x1_SN_LDSB1_CLR1_GSU0_GSUC0_GSUWGMRR0_K1_LBSPPA512_LBSPPB512_LPA32_LPB32_MIWT2_2_PLR2_SU32_SUM0_SUS256_SKXCCM0_VWA2_VWB2_WGM4_WGMXCC1_WGMXCCGn1
    SolutionIndex: 41
    SolutionNameMin: Cijk_Ailk_Bjlk_HSS_BH_UserArgs_MT64x64x128_MI16x16x1_SN_LDSB1_CLR1_GSU0_GSUC0_GSUWGMRR0_K1_LBSPPA512_LBSPPB512_LPA32_LPB32_MIWT2_2_PLR2_SU32_SUM0_SUS256_SKXCCM0_VWA2_VWB2_WGM8_WGMXCC1_WGMXCCGn1
    SolutionIndex: 42
    SolutionNameMin: Cijk_Ailk_Bjlk_HSS_BH_UserArgs_MT32x64x128_MI16x16x1_SN_LDSB1_CLR1_GSU0_GSUC0_GSUWGMRR0_K1_LBSPPA256_LBSPPB512_LPA16_LPB32_MIWT1_2_PLR1_SU32_SUM0_SUS256_SKXCCM0_VWA1_VWB2_WGM1_WGMXCC1_WGMXCCGn1
    SolutionIndex: 43
    SolutionNameMin: Cijk_Ailk_Bjlk_HSS_BH_UserArgs_MT32x64x128_MI16x16x1_SN_LDSB1_CLR1_GSU0_GSUC0_GSUWGMRR0_K1_LBSPPA256_LBSPPB512_LPA16_LPB32_MIWT1_2_PLR2_SU32_SUM0_SUS256_SKXCCM0_VWA1_VWB2_WGM1_WGMXCC1_WGMXCCGn1
    SolutionIndex: 44
    SolutionNameMin: Cijk_Ailk_Bjlk_HSS_BH_UserArgs_MT32x64x128_MI16x16x1_SN_LDSB1_CLR1_GSU0_GSUC0_GSUWGMRR0_K1_LBSPPA256_LBSPPB512_LPA16_LPB32_MIWT1_2_PLR2_SU32_SUM0_SUS256_SKXCCM0_VWA1_VWB2_WGM4_WGMXCC1_WGMXCCGn1
    SolutionIndex: 45
    SolutionNameMin: Cijk_Ailk_Bjlk_HSS_BH_UserArgs_MT32x64x128_MI16x16x1_SN_LDSB1_CLR1_GSU0_GSUC0_GSUWGMRR0_K1_LBSPPA256_LBSPPB512_LPA16_LPB32_MIWT1_2_PLR2_SU32_SUM0_SUS256_SKXCCM0_VWA1_VWB2_WGM8_WGMXCC1_WGMXCCGn1
    SolutionIndex: 46
    SolutionNameMin: Cijk_Ailk_Bjlk_HSS_BH_UserArgs_MT64x32x128_MI16x16x1_SN_LDSB1_CLR1_GSU0_GSUC0_GSUWGMRR0_K1_LBSPPA512_LBSPPB256_LPA32_LPB16_MIWT2_1_PLR2_SU32_SUM0_SUS256_SKXCCM0_VWA2_VWB1_WGM1_WGMXCC1_WGMXCCGn1
    SolutionIndex: 47
    SolutionNameMin: Cijk_Ailk_Bjlk_HSS_BH_UserArgs_MT64x32x128_MI16x16x1_SN_LDSB1_CLR1_GSU0_GSUC0_GSUWGMRR0_K1_LBSPPA512_LBSPPB256_LPA32_LPB16_MIWT2_1_PLR2_SU32_SUM0_SUS256_SKXCCM0_VWA2_VWB1_WGM8_WGMXCC1_WGMXCCGn1
    SolutionIndex: 48
    SolutionNameMin: Cijk_Ailk_Bjlk_HSS_BH_UserArgs_MT32x32x128_MI16x16x1_SN_LDSB1_CLR1_GSU0_GSUC0_GSUWGMRR0_K1_LBSPPA256_LBSPPB256_LPA16_LPB16_MIWT1_1_PLR1_SU32_SUM0_SUS256_SKXCCM0_VWA1_VWB1_WGM1_WGMXCC1_WGMXCCGn1
    SolutionIndex: 49
    SolutionNameMin: Cijk_Ailk_Bjlk_HSS_BH_UserArgs_MT32x32x128_MI16x16x1_SN_LDSB1_CLR1_GSU0_GSUC0_GSUWGMRR0_K1_LBSPPA256_LBSPPB256_LPA16_LPB16_MIWT1_1_PLR2_SU32_SUM0_SUS256_SKXCCM0_VWA1_VWB1_WGM1_WGMXCC1_WGMXCCGn1
    SolutionIndex: 50
    SolutionNameMin: Cijk_Ailk_Bjlk_HSS_BH_UserArgs_MT256x256x32_MI16x16x1_SN_LDSB0_CLR1_GSU0_GSUC0_GSUWGMRR0_K1_LBSPPA2048_LBSPPB2048_LPA0_LPB0_MIWT8_8_PLR1_SU32_SUM0_SUS256_SKXCCM8_VWA4_VWB8_WGM1_WGMXCC1_WGMXCCGn1
    SolutionIndex: 51
    SolutionNameMin: Cijk_Ailk_Bjlk_HSS_BH_UserArgs_MT256x256x32_MI16x16x1_SN_LDSB0_CLR1_GSU0_GSUC0_GSUWGMRR0_K1_LBSPPA2048_LBSPPB2048_LPA0_LPB0_MIWT8_8_PLR1_SU32_SUM0_SUS256_SKXCCM8_VWA4_VWB8_WGM4_WGMXCC1_WGMXCCGn1
    SolutionIndex: 52
    SolutionNameMin: Cijk_Ailk_Bjlk_HSS_BH_UserArgs_MT256x256x32_MI16x16x1_SN_LDSB0_CLR1_GSU0_GSUC0_GSUWGMRR0_K1_LBSPPA2048_LBSPPB2048_LPA0_LPB0_MIWT8_8_PLR1_SU32_SUM0_SUS256_SKXCCM8_VWA4_VWB4_WGM8_WGMXCC1_WGMXCCGn1
    SolutionIndex: 53
    SolutionNameMin: Cijk_Ailk_Bjlk_HSS_BH_UserArgs_MT256x256x32_MI16x16x1_SN_LDSB0_CLR1_GSU0_GSUC0_GSUWGMRR0_K1_LBSPPA2048_LBSPPB2048_LPA0_LPB0_MIWT8_8_PLR1_SU32_SUM0_SUS256_SKXCCM8_VWA4_VWB8_WGM8_WGMXCC1_WGMXCCGn1
    SolutionIndex: 54
    SolutionNameMin: Cijk_Ailk_Bjlk_HSS_BH_UserArgs_MT128x256x32_MI16x16x1_SN_LDSB1_CLR1_GSU0_GSUC0_GSUWGMRR0_K1_LBSPPA1024_LBSPPB2048_LPA0_LPB32_MIWT4_8_PLR1_SU32_SUM0_SUS256_SKXCCM8_VWA4_VWB2_WGM1_WGMXCC1_WGMXCCGn1
    SolutionIndex: 55
    SolutionNameMin: Cijk_Ailk_Bjlk_HSS_BH_UserArgs_MT128x256x32_MI16x16x1_SN_LDSB1_CLR1_GSU0_GSUC0_GSUWGMRR0_K1_LBSPPA1024_LBSPPB2048_LPA0_LPB0_MIWT4_8_PLR1_SU32_SUM0_SUS256_SKXCCM8_VWA4_VWB4_WGM4_WGMXCC1_WGMXCCGn1
    SolutionIndex: 56
    SolutionNameMin: Cijk_Ailk_Bjlk_HSS_BH_UserArgs_MT128x256x32_MI16x16x1_SN_LDSB1_CLR1_GSU0_GSUC0_GSUWGMRR0_K1_LBSPPA1024_LBSPPB2048_LPA0_LPB0_MIWT4_8_PLR1_SU32_SUM0_SUS256_SKXCCM8_VWA4_VWB8_WGM4_WGMXCC1_WGMXCCGn1
    SolutionIndex: 57
    SolutionNameMin: Cijk_Ailk_Bjlk_HSS_BH_UserArgs_MT128x256x32_MI16x16x1_SN_LDSB1_CLR1_GSU0_GSUC0_GSUWGMRR0_K1_LBSPPA1024_LBSPPB2048_LPA0_LPB32_MIWT4_8_PLR1_SU32_SUM0_SUS256_SKXCCM8_VWA4_VWB2_WGM8_WGMXCC1_WGMXCCGn1
    SolutionIndex: 58
    SolutionNameMin: Cijk_Ailk_Bjlk_HSS_BH_UserArgs_MT256x128x32_MI16x16x1_SN_LDSB1_CLR1_GSU0_GSUC0_GSUWGMRR0_K1_LBSPPA2048_LBSPPB1024_LPA0_LPB0_MIWT8_4_PLR1_SU32_SUM0_SUS256_SKXCCM8_VWA4_VWB4_WGM1_WGMXCC1_WGMXCCGn1
    SolutionIndex: 59
    SolutionNameMin: Cijk_Ailk_Bjlk_HSS_BH_UserArgs_MT256x128x32_MI16x16x1_SN_LDSB1_CLR1_GSU0_GSUC0_GSUWGMRR0_K1_LBSPPA2048_LBSPPB1024_LPA0_LPB0_MIWT8_4_PLR1_SU32_SUM0_SUS256_SKXCCM8_VWA4_VWB4_WGM8_WGMXCC1_WGMXCCGn1
    SolutionIndex: 60
    SolutionNameMin: Cijk_Ailk_Bjlk_HSS_BH_UserArgs_MT128x128x32_MI16x16x1_SN_LDSB0_CLR1_GSU0_GSUC0_GSUWGMRR0_K1_LBSPPA1024_LBSPPB1024_LPA0_LPB0_MIWT4_4_PLR1_SU32_SUM0_SUS256_SKXCCM8_VWA4_VWB4_WGM4_WGMXCC1_WGMXCCGn1
    SolutionIndex: 61
    SolutionNameMin: Cijk_Ailk_Bjlk_HSS_BH_UserArgs_MT128x64x32_MI16x16x1_SN_LDSB0_CLR1_GSU0_GSUC0_GSUWGMRR0_K1_LBSPPA1024_LBSPPB512_LPA0_LPB32_MIWT4_2_PLR1_SU32_SUM0_SUS256_SKXCCM8_VWA4_VWB2_WGM1_WGMXCC1_WGMXCCGn1
    SolutionIndex: 62
    SolutionNameMin: Cijk_Ailk_Bjlk_HSS_BH_UserArgs_MT128x64x32_MI16x16x1_SN_LDSB0_CLR1_GSU0_GSUC0_GSUWGMRR0_K1_LBSPPA1024_LBSPPB512_LPA0_LPB32_MIWT4_2_PLR1_SU32_SUM0_SUS256_SKXCCM8_VWA4_VWB2_WGM4_WGMXCC1_WGMXCCGn1
    SolutionIndex: 63
    SolutionNameMin: Cijk_Ailk_Bjlk_HSS_BH_UserArgs_MT128x64x32_MI16x16x1_SN_LDSB0_CLR1_GSU0_GSUC0_GSUWGMRR0_K1_LBSPPA1024_LBSPPB512_LPA0_LPB32_MIWT4_2_PLR1_SU32_SUM0_SUS256_SKXCCM8_VWA4_VWB2_WGM8_WGMXCC1_WGMXCCGn1
    SolutionIndex: 64
    SolutionNameMin: Cijk_Ailk_Bjlk_HSS_BH_UserArgs_MT32x32x32_MI16x16x1_SN_LDSB0_CLR1_GSU0_GSUC0_GSUWGMRR0_K1_LBSPPA256_LBSPPB256_LPA16_LPB16_MIWT1_1_PLR1_SU32_SUM0_SUS256_SKXCCM8_VWA1_VWB1_WGM1_WGMXCC1_WGMXCCGn1
    SolutionIndex: 65
    SolutionNameMin: Cijk_Ailk_Bjlk_HSS_BH_UserArgs_MT256x256x64_MI16x16x1_SN_LDSB1_CLR1_GSU0_GSUC0_GSUWGMRR0_K1_LBSPPA2048_LBSPPB2048_LPA0_LPB0_MIWT8_8_PLR1_SU32_SUM0_SUS256_SKXCCM8_VWA4_VWB4_WGM1_WGMXCC1_WGMXCCGn1
    SolutionIndex: 66
    SolutionNameMin: Cijk_Ailk_Bjlk_HSS_BH_UserArgs_MT256x256x64_MI16x16x1_SN_LDSB1_CLR1_GSU0_GSUC0_GSUWGMRR0_K1_LBSPPA2048_LBSPPB2048_LPA0_LPB0_MIWT8_8_PLR2_SU32_SUM0_SUS256_SKXCCM8_VWA4_VWB4_WGM1_WGMXCC1_WGMXCCGn1
    SolutionIndex: 67
    SolutionNameMin: Cijk_Ailk_Bjlk_HSS_BH_UserArgs_MT256x256x64_MI16x16x1_SN_LDSB1_CLR1_GSU0_GSUC0_GSUWGMRR0_K1_LBSPPA2048_LBSPPB2048_LPA0_LPB0_MIWT8_8_PLR1_SU32_SUM0_SUS256_SKXCCM8_VWA4_VWB4_WGM4_WGMXCC1_WGMXCCGn1
    SolutionIndex: 68
    SolutionNameMin: Cijk_Ailk_Bjlk_HSS_BH_UserArgs_MT256x256x64_MI16x16x1_SN_LDSB1_CLR1_GSU0_GSUC0_GSUWGMRR0_K1_LBSPPA2048_LBSPPB2048_LPA0_LPB0_MIWT8_8_PLR2_SU32_SUM0_SUS256_SKXCCM8_VWA4_VWB4_WGM4_WGMXCC1_WGMXCCGn1
    SolutionIndex: 69
    SolutionNameMin: Cijk_Ailk_Bjlk_HSS_BH_UserArgs_MT256x256x64_MI16x16x1_SN_LDSB1_CLR1_GSU0_GSUC0_GSUWGMRR0_K1_LBSPPA2048_LBSPPB2048_LPA0_LPB0_MIWT8_8_PLR2_SU32_SUM0_SUS256_SKXCCM8_VWA4_VWB8_WGM4_WGMXCC1_WGMXCCGn1
    SolutionIndex: 70
    SolutionNameMin: Cijk_Ailk_Bjlk_HSS_BH_UserArgs_MT256x256x64_MI16x16x1_SN_LDSB1_CLR1_GSU0_GSUC0_GSUWGMRR0_K1_LBSPPA2048_LBSPPB2048_LPA0_LPB0_MIWT8_8_PLR2_SU32_SUM0_SUS256_SKXCCM8_VWA4_VWB4_WGM8_WGMXCC1_WGMXCCGn1
    SolutionIndex: 71
    SolutionNameMin: Cijk_Ailk_Bjlk_HSS_BH_UserArgs_MT256x256x64_MI16x16x1_SN_LDSB1_CLR1_GSU0_GSUC0_GSUWGMRR0_K1_LBSPPA2048_LBSPPB2048_LPA0_LPB0_MIWT8_8_PLR2_SU32_SUM0_SUS256_SKXCCM8_VWA4_VWB8_WGM8_WGMXCC1_WGMXCCGn1
    SolutionIndex: 72
    SolutionNameMin: Cijk_Ailk_Bjlk_HSS_BH_UserArgs_MT128x256x64_MI16x16x1_SN_LDSB1_CLR1_GSU0_GSUC0_GSUWGMRR0_K1_LBSPPA1024_LBSPPB2048_LPA0_LPB32_MIWT4_8_PLR1_SU32_SUM0_SUS256_SKXCCM8_VWA4_VWB2_WGM1_WGMXCC1_WGMXCCGn1
    SolutionIndex: 73
    SolutionNameMin: Cijk_Ailk_Bjlk_HSS_BH_UserArgs_MT128x256x64_MI16x16x1_SN_LDSB1_CLR1_GSU0_GSUC0_GSUWGMRR0_K1_LBSPPA1024_LBSPPB2048_LPA0_LPB32_MIWT4_8_PLR2_SU32_SUM0_SUS256_SKXCCM8_VWA4_VWB2_WGM1_WGMXCC1_WGMXCCGn1
    SolutionIndex: 74
    SolutionNameMin: Cijk_Ailk_Bjlk_HSS_BH_UserArgs_MT128x256x64_MI16x16x1_SN_LDSB1_CLR1_GSU0_GSUC0_GSUWGMRR0_K1_LBSPPA1024_LBSPPB2048_LPA0_LPB0_MIWT4_8_PLR1_SU32_SUM0_SUS256_SKXCCM8_VWA4_VWB4_WGM4_WGMXCC1_WGMXCCGn1
    SolutionIndex: 75
    SolutionNameMin: Cijk_Ailk_Bjlk_HSS_BH_UserArgs_MT128x256x64_MI16x16x1_SN_LDSB1_CLR1_GSU0_GSUC0_GSUWGMRR0_K1_LBSPPA1024_LBSPPB2048_LPA0_LPB0_MIWT4_8_PLR1_SU32_SUM0_SUS256_SKXCCM8_VWA4_VWB8_WGM4_WGMXCC1_WGMXCCGn1
    SolutionIndex: 76
    SolutionNameMin: Cijk_Ailk_Bjlk_HSS_BH_UserArgs_MT128x256x64_MI16x16x1_SN_LDSB1_CLR1_GSU0_GSUC0_GSUWGMRR0_K1_LBSPPA1024_LBSPPB2048_LPA0_LPB32_MIWT4_8_PLR1_SU32_SUM0_SUS256_SKXCCM8_VWA4_VWB2_WGM8_WGMXCC1_WGMXCCGn1
    SolutionIndex: 77
    SolutionNameMin: Cijk_Ailk_Bjlk_HSS_BH_UserArgs_MT128x256x64_MI16x16x1_SN_LDSB1_CLR1_GSU0_GSUC0_GSUWGMRR0_K1_LBSPPA1024_LBSPPB2048_LPA0_LPB0_MIWT4_8_PLR1_SU32_SUM0_SUS256_SKXCCM8_VWA4_VWB4_WGM8_WGMXCC1_WGMXCCGn1
    SolutionIndex: 78
    SolutionNameMin: Cijk_Ailk_Bjlk_HSS_BH_UserArgs_MT256x128x64_MI16x16x1_SN_LDSB1_CLR1_GSU0_GSUC0_GSUWGMRR0_K1_LBSPPA2048_LBSPPB1024_LPA0_LPB0_MIWT8_4_PLR1_SU32_SUM0_SUS256_SKXCCM8_VWA4_VWB4_WGM1_WGMXCC1_WGMXCCGn1
    SolutionIndex: 79
    SolutionNameMin: Cijk_Ailk_Bjlk_HSS_BH_UserArgs_MT256x128x64_MI16x16x1_SN_LDSB1_CLR1_GSU0_GSUC0_GSUWGMRR0_K1_LBSPPA2048_LBSPPB1024_LPA0_LPB0_MIWT8_4_PLR1_SU32_SUM0_SUS256_SKXCCM8_VWA4_VWB4_WGM8_WGMXCC1_WGMXCCGn1
    SolutionIndex: 80
    SolutionNameMin: Cijk_Ailk_Bjlk_HSS_BH_UserArgs_MT128x128x64_MI16x16x1_SN_LDSB1_CLR1_GSU0_GSUC0_GSUWGMRR0_K1_LBSPPA1024_LBSPPB1024_LPA0_LPB0_MIWT4_4_PLR1_SU32_SUM0_SUS256_SKXCCM8_VWA4_VWB4_WGM1_WGMXCC1_WGMXCCGn1
    SolutionIndex: 81
    SolutionNameMin: Cijk_Ailk_Bjlk_HSS_BH_UserArgs_MT128x128x64_MI16x16x1_SN_LDSB1_CLR1_GSU0_GSUC0_GSUWGMRR0_K1_LBSPPA1024_LBSPPB1024_LPA0_LPB0_MIWT4_4_PLR1_SU32_SUM0_SUS256_SKXCCM8_VWA4_VWB4_WGM4_WGMXCC1_WGMXCCGn1
    SolutionIndex: 82
    SolutionNameMin: Cijk_Ailk_Bjlk_HSS_BH_UserArgs_MT128x128x64_MI16x16x1_SN_LDSB1_CLR1_GSU0_GSUC0_GSUWGMRR0_K1_LBSPPA1024_LBSPPB1024_LPA0_LPB0_MIWT4_4_PLR2_SU32_SUM0_SUS256_SKXCCM8_VWA4_VWB4_WGM4_WGMXCC1_WGMXCCGn1
    SolutionIndex: 83
    SolutionNameMin: Cijk_Ailk_Bjlk_HSS_BH_UserArgs_MT128x128x64_MI16x16x1_SN_LDSB1_CLR1_GSU0_GSUC0_GSUWGMRR0_K1_LBSPPA1024_LBSPPB1024_LPA0_LPB0_MIWT4_4_PLR1_SU32_SUM0_SUS256_SKXCCM8_VWA4_VWB4_WGM8_WGMXCC1_WGMXCCGn1
    SolutionIndex: 84
    SolutionNameMin: Cijk_Ailk_Bjlk_HSS_BH_UserArgs_MT128x128x64_MI16x16x1_SN_LDSB1_CLR1_GSU0_GSUC0_GSUWGMRR0_K1_LBSPPA1024_LBSPPB1024_LPA0_LPB0_MIWT4_4_PLR2_SU32_SUM0_SUS256_SKXCCM8_VWA4_VWB4_WGM8_WGMXCC1_WGMXCCGn1
    SolutionIndex: 85
    SolutionNameMin: Cijk_Ailk_Bjlk_HSS_BH_UserArgs_MT64x128x64_MI16x16x1_SN_LDSB1_CLR1_GSU0_GSUC0_GSUWGMRR0_K1_LBSPPA512_LBSPPB1024_LPA16_LPB0_MIWT2_4_PLR2_SU32_SUM0_SUS256_SKXCCM8_VWA1_VWB4_WGM1_WGMXCC1_WGMXCCGn1
    SolutionIndex: 86
    SolutionNameMin: Cijk_Ailk_Bjlk_HSS_BH_UserArgs_MT64x128x64_MI16x16x1_SN_LDSB1_CLR1_GSU0_GSUC0_GSUWGMRR0_K1_LBSPPA512_LBSPPB1024_LPA32_LPB0_MIWT2_4_PLR2_SU32_SUM0_SUS256_SKXCCM8_VWA2_VWB4_WGM1_WGMXCC1_WGMXCCGn1
    SolutionIndex: 87
    SolutionNameMin: Cijk_Ailk_Bjlk_HSS_BH_UserArgs_MT64x128x64_MI16x16x1_SN_LDSB1_CLR1_GSU0_GSUC0_GSUWGMRR0_K1_LBSPPA512_LBSPPB1024_LPA32_LPB0_MIWT2_4_PLR1_SU32_SUM0_SUS256_SKXCCM8_VWA2_VWB4_WGM4_WGMXCC1_WGMXCCGn1
    SolutionIndex: 88
    SolutionNameMin: Cijk_Ailk_Bjlk_HSS_BH_UserArgs_MT64x128x64_MI16x16x1_SN_LDSB1_CLR1_GSU0_GSUC0_GSUWGMRR0_K1_LBSPPA512_LBSPPB1024_LPA16_LPB0_MIWT2_4_PLR2_SU32_SUM0_SUS256_SKXCCM8_VWA1_VWB4_WGM4_WGMXCC1_WGMXCCGn1
    SolutionIndex: 89
    SolutionNameMin: Cijk_Ailk_Bjlk_HSS_BH_UserArgs_MT128x64x64_MI16x16x1_SN_LDSB1_CLR1_GSU0_GSUC0_GSUWGMRR0_K1_LBSPPA1024_LBSPPB512_LPA0_LPB32_MIWT4_2_PLR2_SU32_SUM0_SUS256_SKXCCM8_VWA4_VWB2_WGM1_WGMXCC1_WGMXCCGn1
    SolutionIndex: 90
    SolutionNameMin: Cijk_Ailk_Bjlk_HSS_BH_UserArgs_MT128x64x64_MI16x16x1_SN_LDSB1_CLR1_GSU0_GSUC0_GSUWGMRR0_K1_LBSPPA1024_LBSPPB512_LPA0_LPB32_MIWT4_2_PLR1_SU32_SUM0_SUS256_SKXCCM8_VWA4_VWB2_WGM8_WGMXCC1_WGMXCCGn1
    SolutionIndex: 91
    SolutionNameMin: Cijk_Ailk_Bjlk_HSS_BH_UserArgs_MT128x64x64_MI16x16x1_SN_LDSB1_CLR1_GSU0_GSUC0_GSUWGMRR0_K1_LBSPPA1024_LBSPPB512_LPA0_LPB32_MIWT4_2_PLR2_SU32_SUM0_SUS256_SKXCCM8_VWA4_VWB2_WGM8_WGMXCC1_WGMXCCGn1
    SolutionIndex: 92
    SolutionNameMin: Cijk_Ailk_Bjlk_HSS_BH_UserArgs_MT64x64x64_MI16x16x1_SN_LDSB1_CLR1_GSU0_GSUC0_GSUWGMRR0_K1_LBSPPA512_LBSPPB512_LPA16_LPB32_MIWT2_2_PLR1_SU32_SUM0_SUS256_SKXCCM8_VWA1_VWB2_WGM1_WGMXCC1_WGMXCCGn1
    SolutionIndex: 93
    SolutionNameMin: Cijk_Ailk_Bjlk_HSS_BH_UserArgs_MT64x64x64_MI16x16x1_SN_LDSB1_CLR1_GSU0_GSUC0_GSUWGMRR0_K1_LBSPPA512_LBSPPB512_LPA32_LPB32_MIWT2_2_PLR1_SU32_SUM0_SUS256_SKXCCM8_VWA2_VWB2_WGM1_WGMXCC1_WGMXCCGn1
    SolutionIndex: 94
    SolutionNameMin: Cijk_Ailk_Bjlk_HSS_BH_UserArgs_MT64x64x64_MI16x16x1_SN_LDSB1_CLR1_GSU0_GSUC0_GSUWGMRR0_K1_LBSPPA512_LBSPPB512_LPA32_LPB32_MIWT2_2_PLR2_SU32_SUM0_SUS256_SKXCCM8_VWA2_VWB2_WGM1_WGMXCC1_WGMXCCGn1
    SolutionIndex: 95
    SolutionNameMin: Cijk_Ailk_Bjlk_HSS_BH_UserArgs_MT64x64x64_MI16x16x1_SN_LDSB1_CLR1_GSU0_GSUC0_GSUWGMRR0_K1_LBSPPA512_LBSPPB512_LPA32_LPB32_MIWT2_2_PLR1_SU32_SUM0_SUS256_SKXCCM8_VWA2_VWB2_WGM4_WGMXCC1_WGMXCCGn1
    SolutionIndex: 96
    SolutionNameMin: Cijk_Ailk_Bjlk_HSS_BH_UserArgs_MT64x64x64_MI16x16x1_SN_LDSB1_CLR1_GSU0_GSUC0_GSUWGMRR0_K1_LBSPPA512_LBSPPB512_LPA32_LPB32_MIWT2_2_PLR2_SU32_SUM0_SUS256_SKXCCM8_VWA2_VWB2_WGM4_WGMXCC1_WGMXCCGn1
    SolutionIndex: 97
    SolutionNameMin: Cijk_Ailk_Bjlk_HSS_BH_UserArgs_MT64x64x64_MI16x16x1_SN_LDSB1_CLR1_GSU0_GSUC0_GSUWGMRR0_K1_LBSPPA512_LBSPPB512_LPA32_LPB32_MIWT2_2_PLR2_SU32_SUM0_SUS256_SKXCCM8_VWA2_VWB2_WGM8_WGMXCC1_WGMXCCGn1
    SolutionIndex: 98
    SolutionNameMin: Cijk_Ailk_Bjlk_HSS_BH_UserArgs_MT32x64x64_MI16x16x1_SN_LDSB0_CLR1_GSU0_GSUC0_GSUWGMRR0_K1_LBSPPA256_LBSPPB512_LPA16_LPB32_MIWT1_2_PLR2_SU32_SUM0_SUS256_SKXCCM8_VWA1_VWB2_WGM1_WGMXCC1_WGMXCCGn1
    SolutionIndex: 99
    SolutionNameMin: Cijk_Ailk_Bjlk_HSS_BH_UserArgs_MT32x64x64_MI16x16x1_SN_LDSB0_CLR1_GSU0_GSUC0_GSUWGMRR0_K1_LBSPPA256_LBSPPB512_LPA16_LPB32_MIWT1_2_PLR2_SU32_SUM0_SUS256_SKXCCM8_VWA1_VWB2_WGM4_WGMXCC1_WGMXCCGn1
    SolutionIndex: 100
    SolutionNameMin: Cijk_Ailk_Bjlk_HSS_BH_UserArgs_MT32x64x64_MI16x16x1_SN_LDSB0_CLR1_GSU0_GSUC0_GSUWGMRR0_K1_LBSPPA256_LBSPPB512_LPA16_LPB32_MIWT1_2_PLR2_SU32_SUM0_SUS256_SKXCCM8_VWA1_VWB2_WGM8_WGMXCC1_WGMXCCGn1
    SolutionIndex: 101
    SolutionNameMin: Cijk_Ailk_Bjlk_HSS_BH_UserArgs_MT64x32x64_MI16x16x1_SN_LDSB0_CLR1_GSU0_GSUC0_GSUWGMRR0_K1_LBSPPA512_LBSPPB256_LPA32_LPB16_MIWT2_1_PLR2_SU32_SUM0_SUS256_SKXCCM8_VWA2_VWB1_WGM8_WGMXCC1_WGMXCCGn1
    SolutionIndex: 102
    SolutionNameMin: Cijk_Ailk_Bjlk_HSS_BH_UserArgs_MT32x32x64_MI16x16x1_SN_LDSB0_CLR1_GSU0_GSUC0_GSUWGMRR0_K1_LBSPPA256_LBSPPB256_LPA16_LPB16_MIWT1_1_PLR2_SU32_SUM0_SUS256_SKXCCM8_VWA1_VWB1_WGM8_WGMXCC1_WGMXCCGn1
    SolutionIndex: 103
    SolutionNameMin: Cijk_Ailk_Bjlk_HSS_BH_UserArgs_MT128x128x128_MI16x16x1_SN_LDSB1_CLR1_GSU0_GSUC0_GSUWGMRR0_K1_LBSPPA1024_LBSPPB1024_LPA0_LPB0_MIWT4_4_PLR1_SU32_SUM0_SUS256_SKXCCM8_VWA4_VWB4_WGM1_WGMXCC1_WGMXCCGn1
    SolutionIndex: 104
    SolutionNameMin: Cijk_Ailk_Bjlk_HSS_BH_UserArgs_MT128x128x128_MI16x16x1_SN_LDSB1_CLR1_GSU0_GSUC0_GSUWGMRR0_K1_LBSPPA1024_LBSPPB1024_LPA0_LPB0_MIWT4_4_PLR2_SU32_SUM0_SUS256_SKXCCM8_VWA4_VWB4_WGM1_WGMXCC1_WGMXCCGn1
    SolutionIndex: 105
    SolutionNameMin: Cijk_Ailk_Bjlk_HSS_BH_UserArgs_MT128x128x128_MI16x16x1_SN_LDSB1_CLR1_GSU0_GSUC0_GSUWGMRR0_K1_LBSPPA1024_LBSPPB1024_LPA0_LPB0_MIWT4_4_PLR1_SU32_SUM0_SUS256_SKXCCM8_VWA4_VWB4_WGM4_WGMXCC1_WGMXCCGn1
    SolutionIndex: 106
    SolutionNameMin: Cijk_Ailk_Bjlk_HSS_BH_UserArgs_MT128x128x128_MI16x16x1_SN_LDSB1_CLR1_GSU0_GSUC0_GSUWGMRR0_K1_LBSPPA1024_LBSPPB1024_LPA0_LPB0_MIWT4_4_PLR1_SU32_SUM0_SUS256_SKXCCM8_VWA4_VWB4_WGM8_WGMXCC1_WGMXCCGn1
    SolutionIndex: 107
    SolutionNameMin: Cijk_Ailk_Bjlk_HSS_BH_UserArgs_MT128x128x128_MI16x16x1_SN_LDSB1_CLR1_GSU0_GSUC0_GSUWGMRR0_K1_LBSPPA1024_LBSPPB1024_LPA0_LPB0_MIWT4_4_PLR2_SU32_SUM0_SUS256_SKXCCM8_VWA4_VWB4_WGM8_WGMXCC1_WGMXCCGn1
    SolutionIndex: 108
    SolutionNameMin: Cijk_Ailk_Bjlk_HSS_BH_UserArgs_MT128x64x128_MI16x16x1_SN_LDSB1_CLR1_GSU0_GSUC0_GSUWGMRR0_K1_LBSPPA1024_LBSPPB512_LPA0_LPB32_MIWT4_2_PLR2_SU32_SUM0_SUS256_SKXCCM8_VWA4_VWB2_WGM1_WGMXCC1_WGMXCCGn1
    SolutionIndex: 109
    SolutionNameMin: Cijk_Ailk_Bjlk_HSS_BH_UserArgs_MT128x64x128_MI16x16x1_SN_LDSB1_CLR1_GSU0_GSUC0_GSUWGMRR0_K1_LBSPPA1024_LBSPPB512_LPA0_LPB32_MIWT4_2_PLR2_SU32_SUM0_SUS256_SKXCCM8_VWA4_VWB2_WGM8_WGMXCC1_WGMXCCGn1
    SolutionIndex: 110
    SolutionNameMin: Cijk_Ailk_Bjlk_HSS_BH_UserArgs_MT128x32x128_MI16x16x1_SN_LDSB1_CLR1_GSU0_GSUC0_GSUWGMRR0_K1_LBSPPA1024_LBSPPB256_LPA0_LPB16_MIWT4_1_PLR2_SU32_SUM0_SUS256_SKXCCM8_VWA4_VWB1_WGM1_WGMXCC1_WGMXCCGn1
    SolutionIndex: 111
    SolutionNameMin: Cijk_Ailk_Bjlk_HSS_BH_UserArgs_MT64x64x128_MI16x16x1_SN_LDSB1_CLR1_GSU0_GSUC0_GSUWGMRR0_K1_LBSPPA512_LBSPPB512_LPA32_LPB32_MIWT2_2_PLR1_SU32_SUM0_SUS256_SKXCCM8_VWA2_VWB2_WGM1_WGMXCC1_WGMXCCGn1
    SolutionIndex: 112
    SolutionNameMin: Cijk_Ailk_Bjlk_HSS_BH_UserArgs_MT64x64x128_MI16x16x1_SN_LDSB1_CLR1_GSU0_GSUC0_GSUWGMRR0_K1_LBSPPA512_LBSPPB512_LPA16_LPB32_MIWT2_2_PLR2_SU32_SUM0_SUS256_SKXCCM8_VWA1_VWB2_WGM1_WGMXCC1_WGMXCCGn1
    SolutionIndex: 113
    SolutionNameMin: Cijk_Ailk_Bjlk_HSS_BH_UserArgs_MT64x64x128_MI16x16x1_SN_LDSB1_CLR1_GSU0_GSUC0_GSUWGMRR0_K1_LBSPPA512_LBSPPB512_LPA32_LPB32_MIWT2_2_PLR2_SU32_SUM0_SUS256_SKXCCM8_VWA2_VWB2_WGM1_WGMXCC1_WGMXCCGn1
    SolutionIndex: 114
    SolutionNameMin: Cijk_Ailk_Bjlk_HSS_BH_UserArgs_MT64x64x128_MI16x16x1_SN_LDSB1_CLR1_GSU0_GSUC0_GSUWGMRR0_K1_LBSPPA512_LBSPPB512_LPA32_LPB32_MIWT2_2_PLR2_SU32_SUM0_SUS256_SKXCCM8_VWA2_VWB2_WGM4_WGMXCC1_WGMXCCGn1
    SolutionIndex: 115
    SolutionNameMin: Cijk_Ailk_Bjlk_HSS_BH_UserArgs_MT64x64x128_MI16x16x1_SN_LDSB1_CLR1_GSU0_GSUC0_GSUWGMRR0_K1_LBSPPA512_LBSPPB512_LPA32_LPB32_MIWT2_2_PLR1_SU32_SUM0_SUS256_SKXCCM8_VWA2_VWB2_WGM8_WGMXCC1_WGMXCCGn1
    SolutionIndex: 116
    SolutionNameMin: Cijk_Ailk_Bjlk_HSS_BH_UserArgs_MT64x64x128_MI16x16x1_SN_LDSB1_CLR1_GSU0_GSUC0_GSUWGMRR0_K1_LBSPPA512_LBSPPB512_LPA32_LPB32_MIWT2_2_PLR2_SU32_SUM0_SUS256_SKXCCM8_VWA2_VWB2_WGM8_WGMXCC1_WGMXCCGn1
    SolutionIndex: 117
    SolutionNameMin: Cijk_Ailk_Bjlk_HSS_BH_UserArgs_MT32x64x128_MI16x16x1_SN_LDSB1_CLR1_GSU0_GSUC0_GSUWGMRR0_K1_LBSPPA256_LBSPPB512_LPA16_LPB32_MIWT1_2_PLR1_SU32_SUM0_SUS256_SKXCCM8_VWA1_VWB2_WGM1_WGMXCC1_WGMXCCGn1
    SolutionIndex: 118
    SolutionNameMin: Cijk_Ailk_Bjlk_HSS_BH_UserArgs_MT32x64x128_MI16x16x1_SN_LDSB1_CLR1_GSU0_GSUC0_GSUWGMRR0_K1_LBSPPA256_LBSPPB512_LPA16_LPB32_MIWT1_2_PLR2_SU32_SUM0_SUS256_SKXCCM8_VWA1_VWB2_WGM1_WGMXCC1_WGMXCCGn1
    SolutionIndex: 119
    SolutionNameMin: Cijk_Ailk_Bjlk_HSS_BH_UserArgs_MT32x64x128_MI16x16x1_SN_LDSB1_CLR1_GSU0_GSUC0_GSUWGMRR0_K1_LBSPPA256_LBSPPB512_LPA16_LPB32_MIWT1_2_PLR2_SU32_SUM0_SUS256_SKXCCM8_VWA1_VWB2_WGM4_WGMXCC1_WGMXCCGn1
    SolutionIndex: 120
    SolutionNameMin: Cijk_Ailk_Bjlk_HSS_BH_UserArgs_MT64x32x128_MI16x16x1_SN_LDSB1_CLR1_GSU0_GSUC0_GSUWGMRR0_K1_LBSPPA512_LBSPPB256_LPA32_LPB16_MIWT2_1_PLR2_SU32_SUM0_SUS256_SKXCCM8_VWA2_VWB1_WGM1_WGMXCC1_WGMXCCGn1
    SolutionIndex: 121
    SolutionNameMin: Cijk_Ailk_Bjlk_HSS_BH_UserArgs_MT32x32x128_MI16x16x1_SN_LDSB1_CLR1_GSU0_GSUC0_GSUWGMRR0_K1_LBSPPA256_LBSPPB256_LPA16_LPB16_MIWT1_1_PLR1_SU32_SUM0_SUS256_SKXCCM8_VWA1_VWB1_WGM1_WGMXCC1_WGMXCCGn1
    SolutionIndex: 122
    SolutionNameMin: Cijk_Ailk_Bjlk_HSS_BH_UserArgs_MT32x32x128_MI16x16x1_SN_LDSB1_CLR1_GSU0_GSUC0_GSUWGMRR0_K1_LBSPPA256_LBSPPB256_LPA16_LPB16_MIWT1_1_PLR2_SU32_SUM0_SUS256_SKXCCM8_VWA1_VWB1_WGM1_WGMXCC1_WGMXCCGn1
    SolutionIndex: 123
    SolutionNameMin: Cijk_Ailk_Bjlk_HSS_BH_UserArgs_MT32x32x128_MI16x16x1_SN_LDSB1_CLR1_GSU0_GSUC0_GSUWGMRR0_K1_LBSPPA256_LBSPPB256_LPA16_LPB16_MIWT1_1_PLR2_SU32_SUM0_SUS256_SKXCCM8_VWA1_VWB1_WGM4_WGMXCC1_WGMXCCGn1
    SolutionIndex: 124
    SolutionNameMin: Cijk_Ailk_Bjlk_HSS_BH_UserArgs_MT32x32x128_MI16x16x1_SN_LDSB1_CLR1_GSU0_GSUC0_GSUWGMRR0_K1_LBSPPA256_LBSPPB256_LPA16_LPB16_MIWT1_1_PLR1_SU32_SUM0_SUS256_SKXCCM8_VWA1_VWB1_WGM8_WGMXCC1_WGMXCCGn1
    SolutionIndex: 125
    SolutionNameMin: Cijk_Ailk_Bjlk_HSS_BH_UserArgs_MT32x32x32_MI16x16x1_SN_LDSB0_CLR1_GSU0_GSUC0_GSUWGMRR0_K1_LBSPPA256_LBSPPB256_LPA16_LPB16_MIWT1_1_PLR1_SU32_SUM0_SUS256_SKXCCM0_VWA1_VWB1_WGM4_WGMXCC1_WGMXCCGn1
- - - [128, 128, 1, 128, 128, 128, 128, 128]
    - [49, 0.08]
  - - [128, 128, 1, 256, 128, 128, 128, 128]
    - [48, 0.103]
  - - [128, 128, 1, 512, 128, 128, 128, 128]
    - [49, 0.169]
  - - [128, 128, 1, 1024, 128, 128, 128, 128]
    - [122, 0.24]
  - - [128, 128, 1, 2048, 128, 128, 128, 128]
    - [122, 0.328]
  - - [128, 128, 1, 4096, 128, 128, 128, 128]
    - [7, 0.522]
  - - [128, 128, 1, 8192, 128, 128, 128, 128]
    - [64, 1.009]
  - - [128, 256, 1, 128, 128, 128, 128, 256]
    - [48, 0.159]
  - - [128, 256, 1, 256, 128, 128, 128, 256]
    - [48, 0.206]
  - - [128, 256, 1, 512, 128, 128, 128, 256]
    - [49, 0.334]
  - - [128, 256, 1, 1024, 128, 128, 128, 256]
    - [121, 0.498]
  - - [128, 256, 1, 2048, 128, 128, 128, 256]
    - [8, 0.788]
  - - [128, 256, 1, 4096, 128, 128, 128, 256]
    - [23, 1.455]
  - - [128, 256, 1, 8192, 128, 128, 128, 256]
    - [122, 2.487]
  - - [128, 512, 1, 128, 128, 128, 128, 512]
    - [48, 0.311]
  - - [128, 512, 1, 256, 128, 128, 128, 512]
    - [49, 0.392]
  - - [128, 512, 1, 512, 128, 128, 128, 512]
    - [121, 0.65]
  - - [128, 512, 1, 1024, 128, 128, 128, 512]
    - [8, 1.031]
  - - [128, 512, 1, 2048, 128, 128, 128, 512]
    - [48, 1.851]
  - - [128, 512, 1, 4096, 128, 128, 128, 512]
    - [122, 2.993]
  - - [128, 512, 1, 8192, 128, 128, 128, 512]
    - [98, 4.257]
  - - [128, 1024, 1, 128, 128, 128, 128, 1024]
    - [48, 0.61]
  - - [128, 1024, 1, 256, 128, 128, 128, 1024]
    - [46, 0.722]
  - - [128, 1024, 1, 512, 128, 128, 128, 1024]
    - [122, 1.282]
  - - [128, 1024, 1, 1024, 128, 128, 128, 1024]
    - [48, 2.109]
  - - [128, 1024, 1, 2048, 128, 128, 128, 1024]
    - [121, 3.291]
  - - [128, 1024, 1, 4096, 128, 128, 128, 1024]
    - [47, 4.895]
  - - [128, 1024, 1, 8192, 128, 128, 128, 1024]
    - [99, 6.798]
  - - [128, 2048, 1, 128, 128, 128, 128, 2048]
    - [122, 1.127]
  - - [128, 2048, 1, 256, 128, 128, 128, 2048]
    - [48, 1.523]
  - - [128, 2048, 1, 512, 128, 128, 128, 2048]
    - [49, 2.34]
  - - [128, 2048, 1, 1024, 128, 128, 128, 2048]
    - [118, 3.91]
  - - [128, 2048, 1, 2048, 128, 128, 128, 2048]
    - [118, 5.933]
  - - [128, 2048, 1, 4096, 128, 128, 128, 2048]
    - [20, 7.88]
  - - [128, 2048, 1, 8192, 128, 128, 128, 2048]
    - [95, 10.929]
  - - [128, 4096, 1, 128, 128, 128, 128, 4096]
    - [120, 2.091]
  - - [128, 4096, 1, 256, 128, 128, 128, 4096]
    - [44, 2.705]
  - - [128, 4096, 1, 512, 128, 128, 128, 4096]
    - [120, 4.162]
  - - [128, 4096, 1, 1024, 128, 128, 128, 4096]
    - [118, 6.485]
  - - [128, 4096, 1, 2048, 128, 128, 128, 4096]
    - [113, 9.142]
  - - [128, 4096, 1, 4096, 128, 128, 128, 4096]
    - [17, 12.272]
  - - [128, 4096, 1, 8192, 128, 128, 128, 4096]
    - [17, 15.473]
  - - [128, 8192, 1, 128, 128, 128, 128, 8192]
    - [112, 3.335]
  - - [128, 8192, 1, 256, 128, 128, 128, 8192]
    - [38, 4.596]
  - - [128, 8192, 1, 512, 128, 128, 128, 8192]
    - [111, 7.191]
  - - [128, 8192, 1, 1024, 128, 128, 128, 8192]
    - [113, 10.026]
  - - [128, 8192, 1, 2048, 128, 128, 128, 8192]
    - [17, 13.174]
  - - [128, 8192, 1, 4096, 128, 128, 128, 8192]
    - [18, 16.175]
  - - [128, 8192, 1, 8192, 128, 128, 128, 8192]
    - [13, 20.351]
  - - [256, 128, 1, 128, 256, 256, 256, 128]
    - [48, 0.157]
  - - [256, 128, 1, 256, 256, 256, 256, 128]
    - [49, 0.202]
  - - [256, 128, 1, 512, 256, 256, 256, 128]
    - [48, 0.334]
  - - [256, 128, 1, 1024, 256, 256, 256, 128]
    - [122, 0.492]
  - - [256, 128, 1, 2048, 256, 256, 256, 128]
    - [7, 0.79]
  - - [256, 128, 1, 4096, 256, 256, 256, 128]
    - [22, 1.481]
  - - [256, 128, 1, 8192, 256, 256, 256, 128]
    - [102, 2.418]
  - - [256, 256, 1, 128, 256, 256, 256, 256]
    - [49, 0.308]
  - - [256, 256, 1, 256, 256, 256, 256, 256]
    - [48, 0.394]
  - - [256, 256, 1, 512, 256, 256, 256, 256]
    - [121, 0.646]
  - - [256, 256, 1, 1024, 256, 256, 256, 256]
    - [8, 1.023]
  - - [256, 256, 1, 2048, 256, 256, 256, 256]
    - [121, 1.886]
  - - [256, 256, 1, 4096, 256, 256, 256, 256]
    - [49, 3.065]
  - - [256, 256, 1, 8192, 256, 256, 256, 256]
    - [98, 4.182]
  - - [256, 512, 1, 128, 256, 256, 256, 512]
    - [48, 0.604]
  - - [256, 512, 1, 256, 256, 256, 256, 512]
    - [49, 0.71]
  - - [256, 512, 1, 512, 256, 256, 256, 512]
    - [121, 1.272]
  - - [256, 512, 1, 1024, 256, 256, 256, 512]
    - [48, 2.1]
  - - [256, 512, 1, 2048, 256, 256, 256, 512]
    - [118, 3.406]
  - - [256, 512, 1, 4096, 256, 256, 256, 512]
    - [118, 5.333]
  - - [256, 512, 1, 8192, 256, 256, 256, 512]
    - [99, 6.805]
  - - [256, 1024, 1, 128, 256, 256, 256, 1024]
    - [48, 1.143]
  - - [256, 1024, 1, 256, 256, 256, 256, 1024]
    - [48, 1.505]
  - - [256, 1024, 1, 512, 256, 256, 256, 1024]
    - [48, 2.336]
  - - [256, 1024, 1, 1024, 256, 256, 256, 1024]
    - [117, 3.856]
  - - [256, 1024, 1, 2048, 256, 256, 256, 1024]
    - [119, 5.756]
  - - [256, 1024, 1, 4096, 256, 256, 256, 1024]
    - [93, 7.816]
  - - [256, 1024, 1, 8192, 256, 256, 256, 1024]
    - [95, 10.617]
  - - [256, 2048, 1, 128, 256, 256, 256, 2048]
    - [42, 2.076]
  - - [256, 2048, 1, 256, 256, 256, 256, 2048]
    - [43, 2.697]
  - - [256, 2048, 1, 512, 256, 256, 256, 2048]
    - [120, 4.177]
  - - [256, 2048, 1, 1024, 256, 256, 256, 2048]
    - [120, 6.295]
  - - [256, 2048, 1, 2048, 256, 256, 256, 2048]
    - [96, 8.929]
  - - [256, 2048, 1, 4096, 256, 256, 256, 2048]
    - [16, 11.842]
  - - [256, 2048, 1, 8192, 256, 256, 256, 2048]
    - [91, 14.915]
  - - [256, 4096, 1, 128, 256, 256, 256, 4096]
    - [112, 3.412]
  - - [256, 4096, 1, 256, 256, 256, 256, 4096]
    - [110, 4.703]
  - - [256, 4096, 1, 512, 256, 256, 256, 4096]
    - [113, 7.176]
  - - [256, 4096, 1, 1024, 256, 256, 256, 4096]
    - [94, 10.07]
  - - [256, 4096, 1, 2048, 256, 256, 256, 4096]
    - [63, 13.127]
  - - [256, 4096, 1, 4096, 256, 256, 256, 4096]
    - [91, 16.61]
  - - [256, 4096, 1, 8192, 256, 256, 256, 4096]
    - [81, 20.461]
  - - [256, 8192, 1, 128, 256, 256, 256, 8192]
    - [36, 5.087]
  - - [256, 8192, 1, 256, 256, 256, 256, 8192]
    - [34, 7.39]
  - - [256, 8192, 1, 512, 256, 256, 256, 8192]
    - [108, 10.343]
  - - [256, 8192, 1, 1024, 256, 256, 256, 8192]
    - [89, 13.092]
  - - [256, 8192, 1, 2048, 256, 256, 256, 8192]
    - [81, 16.677]
  - - [256, 8192, 1, 4096, 256, 256, 256, 8192]
    - [83, 21.584]
  - - [256, 8192, 1, 8192, 256, 256, 256, 8192]
    - [83, 24.195]
  - - [512, 128, 1, 128, 512, 512, 512, 128]
    - [48, 0.304]
  - - [512, 128, 1, 256, 512, 512, 512, 128]
    - [48, 0.388]
  - - [512, 128, 1, 512, 512, 512, 512, 128]
    - [121, 0.644]
  - - [512, 128, 1, 1024, 512, 512, 512, 128]
    - [7, 1.026]
  - - [512, 128, 1, 2048, 512, 512, 512, 128]
    - [22, 1.837]
  - - [512, 128, 1, 4096, 512, 512, 512, 128]
    - [123, 2.976]
  - - [512, 128, 1, 8192, 512, 512, 512, 128]
    - [98, 4.119]
  - - [512, 256, 1, 128, 512, 512, 512, 256]
    - [49, 0.593]
  - - [512, 256, 1, 256, 512, 512, 512, 256]
    - [121, 0.723]
  - - [512, 256, 1, 512, 512, 512, 512, 256]
    - [122, 1.252]
  - - [512, 256, 1, 1024, 512, 512, 512, 256]
    - [121, 2.087]
  - - [512, 256, 1, 2048, 512, 512, 512, 256]
    - [118, 3.417]
  - - [512, 256, 1, 4096, 512, 512, 512, 256]
    - [99, 5.213]
  - - [512, 256, 1, 8192, 512, 512, 512, 256]
    - [100, 6.617]
  - - [512, 512, 1, 128, 512, 512, 512, 512]
    - [48, 1.139]
  - - [512, 512, 1, 256, 512, 512, 512, 512]
    - [121, 1.463]
  - - [512, 512, 1, 512, 512, 512, 512, 512]
    - [48, 2.303]
  - - [512, 512, 1, 1024, 512, 512, 512, 512]
    - [120, 3.835]
  - - [512, 512, 1, 2048, 512, 512, 512, 512]
    - [120, 6.056]
  - - [512, 512, 1, 4096, 512, 512, 512, 512]
    - [92, 7.69]
  - - [512, 512, 1, 8192, 512, 512, 512, 512]
    - [93, 9.927]
  - - [512, 1024, 1, 128, 512, 512, 512, 1024]
    - [43, 2.06]
  - - [512, 1024, 1, 256, 512, 512, 512, 1024]
    - [118, 2.726]
  - - [512, 1024, 1, 512, 512, 512, 512, 1024]
    - [118, 4.263]
  - - [512, 1024, 1, 1024, 512, 512, 512, 1024]
    - [43, 6.385]
  - - [512, 1024, 1, 2048, 512, 512, 512, 1024]
    - [94, 9.116]
  - - [512, 1024, 1, 4096, 512, 512, 512, 1024]
    - [62, 11.407]
  - - [512, 1024, 1, 8192, 512, 512, 512, 1024]
    - [89, 14.17]
  - - [512, 2048, 1, 128, 512, 512, 512, 2048]
    - [40, 3.463]
  - - [512, 2048, 1, 256, 512, 512, 512, 2048]
    - [110, 4.654]
  - - [512, 2048, 1, 512, 512, 512, 512, 2048]
    - [113, 7.155]
  - - [512, 2048, 1, 1024, 512, 512, 512, 2048]
    - [111, 9.938]
  - - [512, 2048, 1, 2048, 512, 512, 512, 2048]
    - [89, 12.895]
  - - [512, 2048, 1, 4096, 512, 512, 512, 2048]
    - [60, 15.456]
  - - [512, 2048, 1, 8192, 512, 512, 512, 2048]
    - [80, 20.017]
  - - [512, 4096, 1, 128, 512, 512, 512, 4096]
    - [34, 5.249]
  - - [512, 4096, 1, 256, 512, 512, 512, 4096]
    - [32, 7.549]
  - - [512, 4096, 1, 512, 512, 512, 512, 4096]
    - [108, 10.425]
  - - [512, 4096, 1, 1024, 512, 512, 512, 4096]
    - [108, 13.455]
  - - [512, 4096, 1, 2048, 512, 512, 512, 4096]
    - [80, 16.562]
  - - [512, 4096, 1, 4096, 512, 512, 512, 4096]
    - [81, 21.701]
  - - [512, 4096, 1, 8192, 512, 512, 512, 4096]
    - [56, 24.016]
  - - [512, 8192, 1, 128, 512, 512, 512, 8192]
    - [29, 6.907]
  - - [512, 8192, 1, 256, 512, 512, 512, 8192]
    - [28, 10.281]
  - - [512, 8192, 1, 512, 512, 512, 512, 8192]
    - [104, 12.321]
  - - [512, 8192, 1, 1024, 512, 512, 512, 8192]
    - [80, 16.719]
  - - [512, 8192, 1, 2048, 512, 512, 512, 8192]
    - [84, 21.021]
  - - [512, 8192, 1, 4096, 512, 512, 512, 8192]
    - [5, 25.582]
  - - [512, 8192, 1, 8192, 512, 512, 512, 8192]
    - [11, 26.87]
  - - [1024, 128, 1, 128, 1024, 1024, 1024, 128]
    - [48, 0.612]
  - - [1024, 128, 1, 256, 1024, 1024, 1024, 128]
    - [122, 0.726]
  - - [1024, 128, 1, 512, 1024, 1024, 1024, 128]
    - [124, 1.278]
  - - [1024, 128, 1, 1024, 1024, 1024, 1024, 128]
    - [48, 2.134]
  - - [1024, 128, 1, 2048, 1024, 1024, 1024, 128]
    - [48, 3.267]
  - - [1024, 128, 1, 4096, 1024, 1024, 1024, 128]
    - [21, 4.765]
  - - [1024, 128, 1, 8192, 1024, 1024, 1024, 128]
    - [93, 6.58]
  - - [1024, 256, 1, 128, 1024, 1024, 1024, 256]
    - [121, 1.134]
  - - [1024, 256, 1, 256, 1024, 1024, 1024, 256]
    - [48, 1.511]
  - - [1024, 256, 1, 512, 1024, 1024, 1024, 256]
    - [48, 2.324]
  - - [1024, 256, 1, 1024, 1024, 1024, 1024, 256]
    - [118, 3.83]
  - - [1024, 256, 1, 2048, 1024, 1024, 1024, 256]
    - [101, 5.666]
  - - [1024, 256, 1, 4096, 1024, 1024, 1024, 256]
    - [97, 7.607]
  - - [1024, 256, 1, 8192, 1024, 1024, 1024, 256]
    - [93, 10.3]
  - - [1024, 512, 1, 128, 1024, 1024, 1024, 512]
    - [43, 2.133]
  - - [1024, 512, 1, 256, 1024, 1024, 1024, 512]
    - [43, 2.715]
  - - [1024, 512, 1, 512, 1024, 1024, 1024, 512]
    - [120, 4.241]
  - - [1024, 512, 1, 1024, 1024, 1024, 1024, 512]
    - [118, 6.433]
  - - [1024, 512, 1, 2048, 1024, 1024, 1024, 512]
    - [97, 8.93]
  - - [1024, 512, 1, 4096, 1024, 1024, 1024, 512]
    - [93, 11.326]
  - - [1024, 512, 1, 8192, 1024, 1024, 1024, 512]
    - [85, 13.691]
  - - [1024, 1024, 1, 128, 1024, 1024, 1024, 1024]
    - [112, 3.456]
  - - [1024, 1024, 1, 256, 1024, 1024, 1024, 1024]
    - [110, 4.609]
  - - [1024, 1024, 1, 512, 1024, 1024, 1024, 1024]
    - [112, 7.191]
  - - [1024, 1024, 1, 1024, 1024, 1024, 1024, 1024]
    - [93, 9.845]
  - - [1024, 1024, 1, 2048, 1024, 1024, 1024, 1024]
    - [61, 12.414]
  - - [1024, 1024, 1, 4096, 1024, 1024, 1024, 1024]
    - [89, 14.904]
  - - [1024, 1024, 1, 8192, 1024, 1024, 1024, 1024]
    - [81, 19.648]
  - - [1024, 2048, 1, 128, 1024, 1024, 1024, 2048]
    - [30, 5.306]
  - - [1024, 2048, 1, 256, 1024, 1024, 1024, 2048]
    - [31, 7.632]
  - - [1024, 2048, 1, 512, 1024, 1024, 1024, 2048]
    - [108, 10.324]
  - - [1024, 2048, 1, 1024, 1024, 1024, 1024, 2048]
    - [89, 13.039]
  - - [1024, 2048, 1, 2048, 1024, 1024, 1024, 2048]
    - [80, 15.979]
  - - [1024, 2048, 1, 4096, 1024, 1024, 1024, 2048]
    - [81, 20.924]
  - - [1024, 2048, 1, 8192, 1024, 1024, 1024, 2048]
    - [78, 23.147]
  - - [1024, 4096, 1, 128, 1024, 1024, 1024, 4096]
    - [28, 7.035]
  - - [1024, 4096, 1, 256, 1024, 1024, 1024, 4096]
    - [28, 10.375]
  - - [1024, 4096, 1, 512, 1024, 1024, 1024, 4096]
    - [103, 12.4]
  - - [1024, 4096, 1, 1024, 1024, 1024, 1024, 4096]
    - [80, 16.35]
  - - [1024, 4096, 1, 2048, 1024, 1024, 1024, 4096]
    - [83, 20.987]
  - - [1024, 4096, 1, 4096, 1024, 1024, 1024, 4096]
    - [58, 24.625]
  - - [1024, 4096, 1, 8192, 1024, 1024, 1024, 4096]
    - [50, 26.662]
  - - [1024, 8192, 1, 128, 1024, 1024, 1024, 8192]
    - [24, 6.929]
  - - [1024, 8192, 1, 256, 1024, 1024, 1024, 8192]
    - [24, 10.367]
  - - [1024, 8192, 1, 512, 1024, 1024, 1024, 8192]
    - [80, 14.736]
  - - [1024, 8192, 1, 1024, 1024, 1024, 1024, 8192]
    - [103, 19.698]
  - - [1024, 8192, 1, 2048, 1024, 1024, 1024, 8192]
    - [54, 23.602]
  - - [1024, 8192, 1, 4096, 1024, 1024, 1024, 8192]
    - [53, 27.277]
  - - [1024, 8192, 1, 8192, 1024, 1024, 1024, 8192]
    - [1, 30.58]
  - - [2048, 128, 1, 128, 2048, 2048, 2048, 128]
    - [122, 1.15]
  - - [2048, 128, 1, 256, 2048, 2048, 2048, 128]
    - [48, 1.486]
  - - [2048, 128, 1, 512, 2048, 2048, 2048, 128]
    - [121, 2.319]
  - - [2048, 128, 1, 1024, 2048, 2048, 2048, 128]
    - [120, 3.81]
  - - [2048, 128, 1, 2048, 2048, 2048, 2048, 128]
    - [118, 5.685]
  - - [2048, 128, 1, 4096, 2048, 2048, 2048, 128]
    - [19, 7.95]
  - - [2048, 128, 1, 8192, 2048, 2048, 2048, 128]
    - [95, 10.419]
  - - [2048, 256, 1, 128, 2048, 2048, 2048, 256]
    - [43, 2.12]
  - - [2048, 256, 1, 256, 2048, 2048, 2048, 256]
    - [43, 2.74]
  - - [2048, 256, 1, 512, 2048, 2048, 2048, 256]
    - [118, 4.148]
  - - [2048, 256, 1, 1024, 2048, 2048, 2048, 256]
    - [119, 6.314]
  - - [2048, 256, 1, 2048, 2048, 2048, 2048, 256]
    - [116, 8.798]
  - - [2048, 256, 1, 4096, 2048, 2048, 2048, 256]
    - [14, 11.447]
  - - [2048, 256, 1, 8192, 2048, 2048, 2048, 256]
    - [87, 14.234]
  - - [2048, 512, 1, 128, 2048, 2048, 2048, 512]
    - [41, 3.497]
  - - [2048, 512, 1, 256, 2048, 2048, 2048, 512]
    - [41, 4.758]
  - - [2048, 512, 1, 512, 2048, 2048, 2048, 512]
    - [112, 7.093]
  - - [2048, 512, 1, 1024, 2048, 2048, 2048, 512]
    - [96, 9.93]
  - - [2048, 512, 1, 2048, 2048, 2048, 2048, 512]
    - [63, 12.632]
  - - [2048, 512, 1, 4096, 2048, 2048, 2048, 512]
    - [88, 15.094]
  - - [2048, 512, 1, 8192, 2048, 2048, 2048, 512]
    - [80, 20.106]
  - - [2048, 1024, 1, 128, 2048, 2048, 2048, 1024]
    - [37, 5.364]
  - - [2048, 1024, 1, 256, 2048, 2048, 2048, 1024]
    - [31, 7.671]
  - - [2048, 1024, 1, 512, 2048, 2048, 2048, 1024]
    - [109, 10.143]
  - - [2048, 1024, 1, 1024, 2048, 2048, 2048, 1024]
    - [109, 13.064]
  - - [2048, 1024, 1, 2048, 2048, 2048, 2048, 1024]
    - [60, 16.119]
  - - [2048, 1024, 1, 4096, 2048, 2048, 2048, 1024]
    - [83, 20.751]
  - - [2048, 1024, 1, 8192, 2048, 2048, 2048, 1024]
    - [76, 23.075]
  - - [2048, 2048, 1, 128, 2048, 2048, 2048, 2048]
    - [28, 6.948]
  - - [2048, 2048, 1, 256, 2048, 2048, 2048, 2048]
    - [106, 10.214]
  - - [2048, 2048, 1, 512, 2048, 2048, 2048, 2048]
    - [105, 12.033]
  - - [2048, 2048, 1, 1024, 2048, 2048, 2048, 2048]
    - [83, 16.459]
  - - [2048, 2048, 1, 2048, 2048, 2048, 2048, 2048]
    - [83, 20.876]
  - - [2048, 2048, 1, 4096, 2048, 2048, 2048, 2048]
    - [73, 24.268]
  - - [2048, 2048, 1, 8192, 2048, 2048, 2048, 2048]
    - [78, 26.836]
  - - [2048, 4096, 1, 128, 2048, 2048, 2048, 4096]
    - [26, 6.846]
  - - [2048, 4096, 1, 256, 2048, 2048, 2048, 4096]
    - [27, 10.237]
  - - [2048, 4096, 1, 512, 2048, 2048, 2048, 4096]
    - [81, 14.557]
  - - [2048, 4096, 1, 1024, 2048, 2048, 2048, 4096]
    - [82, 19.458]
  - - [2048, 4096, 1, 2048, 2048, 2048, 2048, 4096]
    - [105, 23.87]
  - - [2048, 4096, 1, 4096, 2048, 2048, 2048, 4096]
    - [65, 27.279]
  - - [2048, 4096, 1, 8192, 2048, 2048, 2048, 4096]
    - [50, 30.724]
  - - [2048, 8192, 1, 128, 2048, 2048, 2048, 8192]
    - [26, 7.448]
  - - [2048, 8192, 1, 256, 2048, 2048, 2048, 8192]
    - [28, 11.447]
  - - [2048, 8192, 1, 512, 2048, 2048, 2048, 8192]
    - [28, 16.648]
  - - [2048, 8192, 1, 1024, 2048, 2048, 2048, 8192]
    - [54, 21.902]
  - - [2048, 8192, 1, 2048, 2048, 2048, 2048, 8192]
    - [53, 25.804]
  - - [2048, 8192, 1, 4096, 2048, 2048, 2048, 8192]
    - [50, 29.372]
  - - [2048, 8192, 1, 8192, 2048, 2048, 2048, 8192]
    - [9, 32.05]
  - - [4096, 128, 1, 128, 4096, 4096, 4096, 128]
    - [45, 2.078]
  - - [4096, 128, 1, 256, 4096, 4096, 4096, 128]
    - [120, 2.755]
  - - [4096, 128, 1, 512, 4096, 4096, 4096, 128]
    - [118, 4.295]
  - - [4096, 128, 1, 1024, 4096, 4096, 4096, 128]
    - [118, 6.34]
  - - [4096, 128, 1, 2048, 4096, 4096, 4096, 128]
    - [96, 8.914]
  - - [4096, 128, 1, 4096, 4096, 4096, 4096, 128]
    - [6, 11.584]
  - - [4096, 128, 1, 8192, 4096, 4096, 4096, 128]
    - [86, 14.622]
  - - [4096, 256, 1, 128, 4096, 4096, 4096, 256]
    - [41, 3.524]
  - - [4096, 256, 1, 256, 4096, 4096, 4096, 256]
    - [39, 4.711]
  - - [4096, 256, 1, 512, 4096, 4096, 4096, 256]
    - [112, 7.072]
  - - [4096, 256, 1, 1024, 4096, 4096, 4096, 256]
    - [115, 9.84]
  - - [4096, 256, 1, 2048, 4096, 4096, 4096, 256]
    - [90, 12.589]
  - - [4096, 256, 1, 4096, 4096, 4096, 4096, 256]
    - [12, 15.769]
  - - [4096, 256, 1, 8192, 4096, 4096, 4096, 256]
    - [80, 20.173]
  - - [4096, 512, 1, 128, 4096, 4096, 4096, 512]
    - [35, 5.314]
  - - [4096, 512, 1, 256, 4096, 4096, 4096, 512]
    - [33, 7.633]
  - - [4096, 512, 1, 512, 4096, 4096, 4096, 512]
    - [109, 10.167]
  - - [4096, 512, 1, 1024, 4096, 4096, 4096, 512]
    - [109, 13.15]
  - - [4096, 512, 1, 2048, 4096, 4096, 4096, 512]
    - [81, 16.181]
  - - [4096, 512, 1, 4096, 4096, 4096, 4096, 512]
    - [81, 20.917]
  - - [4096, 512, 1, 8192, 4096, 4096, 4096, 512]
    - [77, 24.036]
  - - [4096, 1024, 1, 128, 4096, 4096, 4096, 1024]
    - [106, 6.675]
  - - [4096, 1024, 1, 256, 4096, 4096, 4096, 1024]
    - [106, 9.898]
  - - [4096, 1024, 1, 512, 4096, 4096, 4096, 1024]
    - [106, 12.051]
  - - [4096, 1024, 1, 1024, 4096, 4096, 4096, 1024]
    - [83, 15.871]
  - - [4096, 1024, 1, 2048, 4096, 4096, 4096, 1024]
    - [83, 20.951]
  - - [4096, 1024, 1, 4096, 4096, 4096, 4096, 1024]
    - [2, 24.082]
  - - [4096, 1024, 1, 8192, 4096, 4096, 4096, 1024]
    - [52, 26.822]
  - - [4096, 2048, 1, 128, 4096, 4096, 4096, 2048]
    - [25, 7.103]
  - - [4096, 2048, 1, 256, 4096, 4096, 4096, 2048]
    - [27, 10.152]
  - - [4096, 2048, 1, 512, 4096, 4096, 4096, 2048]
    - [83, 14.457]
  - - [4096, 2048, 1, 1024, 4096, 4096, 4096, 2048]
    - [106, 19.544]
  - - [4096, 2048, 1, 2048, 4096, 4096, 4096, 2048]
    - [54, 23.799]
  - - [4096, 2048, 1, 4096, 4096, 4096, 4096, 2048]
    - [69, 26.837]
  - - [4096, 2048, 1, 8192, 4096, 4096, 4096, 2048]
    - [70, 30.328]
  - - [4096, 4096, 1, 128, 4096, 4096, 4096, 4096]
    - [24, 7.869]
  - - [4096, 4096, 1, 256, 4096, 4096, 4096, 4096]
    - [25, 11.359]
  - - [4096, 4096, 1, 512, 4096, 4096, 4096, 4096]
    - [75, 16.311]
  - - [4096, 4096, 1, 1024, 4096, 4096, 4096, 4096]
    - [79, 21.981]
  - - [4096, 4096, 1, 2048, 4096, 4096, 4096, 4096]
    - [74, 25.322]
  - - [4096, 4096, 1, 4096, 4096, 4096, 4096, 4096]
    - [65, 29.585]
  - - [4096, 4096, 1, 8192, 4096, 4096, 4096, 4096]
    - [66, 32.356]
  - - [4096, 8192, 1, 128, 4096, 4096, 4096, 8192]
    - [25, 8.205]
  - - [4096, 8192, 1, 256, 4096, 4096, 4096, 8192]
    - [25, 12.282]
  - - [4096, 8192, 1, 512, 4096, 4096, 4096, 8192]
    - [83, 16.625]
  - - [4096, 8192, 1, 1024, 4096, 4096, 4096, 8192]
    - [0, 21.767]
  - - [4096, 8192, 1, 2048, 4096, 4096, 4096, 8192]
    - [51, 27.639]
  - - [4096, 8192, 1, 4096, 4096, 4096, 4096, 8192]
    - [50, 32.878]
  - - [4096, 8192, 1, 8192, 4096, 4096, 4096, 8192]
    - [50, 35.71]
  - - [8192, 128, 1, 128, 8192, 8192, 8192, 128]
    - [114, 3.376]
  - - [8192, 128, 1, 256, 8192, 8192, 8192, 128]
    - [110, 4.65]
  - - [8192, 128, 1, 512, 8192, 8192, 8192, 128]
    - [114, 7.0]
  - - [8192, 128, 1, 1024, 8192, 8192, 8192, 128]
    - [95, 9.912]
  - - [8192, 128, 1, 2048, 8192, 8192, 8192, 128]
    - [15, 12.506]
  - - [8192, 128, 1, 4096, 8192, 8192, 8192, 128]
    - [12, 15.741]
  - - [8192, 128, 1, 8192, 8192, 8192, 8192, 128]
    - [12, 20.212]
  - - [8192, 256, 1, 128, 8192, 8192, 8192, 256]
    - [31, 5.103]
  - - [8192, 256, 1, 256, 8192, 8192, 8192, 256]
    - [32, 7.045]
  - - [8192, 256, 1, 512, 8192, 8192, 8192, 256]
    - [109, 10.135]
  - - [8192, 256, 1, 1024, 8192, 8192, 8192, 256]
    - [109, 12.99]
  - - [8192, 256, 1, 2048, 8192, 8192, 8192, 256]
    - [83, 16.412]
  - - [8192, 256, 1, 4096, 8192, 8192, 8192, 256]
    - [80, 21.221]
  - - [8192, 256, 1, 8192, 8192, 8192, 8192, 256]
    - [4, 24.485]
  - - [8192, 512, 1, 128, 8192, 8192, 8192, 512]
    - [28, 6.41]
  - - [8192, 512, 1, 256, 8192, 8192, 8192, 512]
    - [28, 9.432]
  - - [8192, 512, 1, 512, 8192, 8192, 8192, 512]
    - [105, 12.128]
  - - [8192, 512, 1, 1024, 8192, 8192, 8192, 512]
    - [81, 16.417]
  - - [8192, 512, 1, 2048, 8192, 8192, 8192, 512]
    - [80, 21.13]
  - - [8192, 512, 1, 4096, 8192, 8192, 8192, 512]
    - [57, 24.482]
  - - [8192, 512, 1, 8192, 8192, 8192, 8192, 512]
    - [10, 26.877]
  - - [8192, 1024, 1, 128, 8192, 8192, 8192, 1024]
    - [27, 7.411]
  - - [8192, 1024, 1, 256, 8192, 8192, 8192, 1024]
    - [24, 10.478]
  - - [8192, 1024, 1, 512, 8192, 8192, 8192, 1024]
    - [83, 14.747]
  - - [8192, 1024, 1, 1024, 8192, 8192, 8192, 1024]
    - [105, 19.806]
  - - [8192, 1024, 1, 2048, 8192, 8192, 8192, 1024]
    - [3, 24.084]
  - - [8192, 1024, 1, 4096, 8192, 8192, 8192, 1024]
    - [71, 26.956]
  - - [8192, 1024, 1, 8192, 8192, 8192, 8192, 1024]
    - [67, 29.766]
  - - [8192, 2048, 1, 128, 8192, 8192, 8192, 2048]
    - [27, 7.94]
  - - [8192, 2048, 1, 256, 8192, 8192, 8192, 2048]
    - [24, 11.65]
  - - [8192, 2048, 1, 512, 8192, 8192, 8192, 2048]
    - [106, 16.724]
  - - [8192, 2048, 1, 1024, 8192, 8192, 8192, 2048]
    - [59, 21.825]
  - - [8192, 2048, 1, 2048, 8192, 8192, 8192, 2048]
    - [72, 25.647]
  - - [8192, 2048, 1, 4096, 8192, 8192, 8192, 2048]
    - [70, 29.33]
  - - [8192, 2048, 1, 8192, 8192, 8192, 8192, 2048]
    - [50, 32.766]
  - - [8192, 4096, 1, 128, 8192, 8192, 8192, 4096]
    - [27, 8.491]
  - - [8192, 4096, 1, 256, 8192, 8192, 8192, 4096]
    - [25, 12.749]
  - - [8192, 4096, 1, 512, 8192, 8192, 8192, 4096]
    - [107, 16.596]
  - - [8192, 4096, 1, 1024, 8192, 8192, 8192, 4096]
    - [50, 21.865]
  - - [8192, 4096, 1, 2048, 8192, 8192, 8192, 4096]
    - [70, 27.568]
  - - [8192, 4096, 1, 4096, 8192, 8192, 8192, 4096]
    - [53, 32.649]
  - - [8192, 4096, 1, 8192, 8192, 8192, 8192, 4096]
    - [68, 35.376]
  - - [8192, 8192, 1, 128, 8192, 8192, 8192, 8192]
    - [12, 7.087]
  - - [8192, 8192, 1, 256, 8192, 8192, 8192, 8192]
    - [12, 11.477]
  - - [8192, 8192, 1, 512, 8192, 8192, 8192, 8192]
    - [55, 17.041]
  - - [8192, 8192, 1, 1024, 8192, 8192, 8192, 8192]
    - [51, 23.919]
  - - [8192, 8192, 1, 2048, 8192, 8192, 8192, 8192]
    - [51, 31.226]
  - - [8192, 8192, 1, 4096, 8192, 8192, 8192, 8192]
    - [51, 36.026]
  - - [8192, 8192, 1, 8192, 8192, 8192, 8192, 8192]
    - [51, 38.347]
  - - [1, 1, 1, 32, 1, 1, 1, 1]
    - [125, 0.0]
- null
- null
- DeviceEfficiency
- GridBased
