library/src/amd_detail/rocblaslt/src/Tensile/Logic/streamk/gfx942/aquavanjaram942_Cijk_Alik_Bjlk_HSS_BH_UserArgs.yaml
- {MinimumRequiredVersion: 4.33.0}
- aquavanjaram942
- gfx942
- [Device 0049, Device 0050]
    SolutionIndex: 0
    SolutionNameMin: Cijk_Alik_Bjlk_HSS_BH_UserArgs_MT256x256x32_MI16x16x1_SN_LDSB1_CLR1_GSU0_GSUC0_GSUWGMRR0_K1_LBSPPA256_LBSPPB2048_LPB0_MIWT8_8_PLR1_SU32_SUM0_SUS256_SKXCCM0_VWA4_VWB8_WGM1_WGMXCC1_WGMXCCGn1
    SolutionIndex: 1
    SolutionNameMin: Cijk_Alik_Bjlk_HSS_BH_UserArgs_MT32x32x32_MI16x16x1_SN_LDSB0_CLR1_GSU0_GSUC0_GSUWGMRR0_K1_LBSPPA128_LBSPPB256_LPB16_MIWT1_1_PLR1_SU32_SUM0_SUS256_SKXCCM0_VWA1_VWB1_WGM1_WGMXCC1_WGMXCCGn1
    SolutionIndex: 2
    SolutionNameMin: Cijk_Alik_Bjlk_HSS_BH_UserArgs_MT32x32x32_MI16x16x1_SN_LDSB0_CLR0_GSU0_GSUC0_GSUWGMRR0_K1_LBSPPA128_LBSPPB256_LPB16_MIWT1_1_PLR0_SU32_SUM0_SUS256_SKXCCM0_VWA1_VWB1_WGM1_WGMXCC1_WGMXCCGn1
    SolutionIndex: 3
    SolutionNameMin: Cijk_Alik_Bjlk_HSS_BH_UserArgs_MT128x256x64_MI16x16x1_SN_LDSB1_CLR1_GSU0_GSUC0_GSUWGMRR0_K1_LBSPPA512_LBSPPB4096_LPB32_MIWT4_8_PLR1_SU32_SUM0_SUS256_SKXCCM0_VWA4_VWB2_WGM1_WGMXCC1_WGMXCCGn1
    SolutionIndex: 4
    SolutionNameMin: Cijk_Alik_Bjlk_HSS_BH_UserArgs_MT128x256x64_MI16x16x1_SN_LDSB1_CLR1_GSU0_GSUC0_GSUWGMRR0_K1_LBSPPA512_LBSPPB4096_LPB0_MIWT4_8_PLR1_SU32_SUM0_SUS256_SKXCCM0_VWA4_VWB4_WGM4_WGMXCC1_WGMXCCGn1
    SolutionIndex: 5
    SolutionNameMin: Cijk_Alik_Bjlk_HSS_BH_UserArgs_MT256x128x64_MI16x16x1_SN_LDSB1_CLR1_GSU0_GSUC0_GSUWGMRR0_K1_LBSPPA512_LBSPPB2048_LPB0_MIWT8_4_PLR1_SU32_SUM0_SUS256_SKXCCM0_VWA4_VWB4_WGM1_WGMXCC1_WGMXCCGn1
    SolutionIndex: 6
    SolutionNameMin: Cijk_Alik_Bjlk_HSS_BH_UserArgs_MT256x128x64_MI16x16x1_SN_LDSB1_CLR1_GSU0_GSUC0_GSUWGMRR0_K1_LBSPPA128_LBSPPB2048_LPB0_MIWT8_4_PLR1_SU32_SUM0_SUS256_SKXCCM0_VWA1_VWB4_WGM8_WGMXCC1_WGMXCCGn1
    SolutionIndex: 7
    SolutionNameMin: Cijk_Alik_Bjlk_HSS_BH_UserArgs_MT128x128x64_MI16x16x1_SN_LDSB1_CLR1_GSU0_GSUC0_GSUWGMRR0_K1_LBSPPA128_LBSPPB2048_LPB0_MIWT4_4_PLR1_SU32_SUM0_SUS256_SKXCCM0_VWA1_VWB4_WGM1_WGMXCC1_WGMXCCGn1
    SolutionIndex: 8
    SolutionNameMin: Cijk_Alik_Bjlk_HSS_BH_UserArgs_MT128x128x64_MI16x16x1_SN_LDSB1_CLR1_GSU0_GSUC0_GSUWGMRR0_K1_LBSPPA256_LBSPPB2048_LPB0_MIWT4_4_PLR1_SU32_SUM0_SUS256_SKXCCM0_VWA2_VWB4_WGM1_WGMXCC1_WGMXCCGn1
    SolutionIndex: 9
    SolutionNameMin: Cijk_Alik_Bjlk_HSS_BH_UserArgs_MT128x128x64_MI16x16x1_SN_LDSB1_CLR1_GSU0_GSUC0_GSUWGMRR0_K1_LBSPPA512_LBSPPB2048_LPB0_MIWT4_4_PLR1_SU32_SUM0_SUS256_SKXCCM0_VWA4_VWB4_WGM1_WGMXCC1_WGMXCCGn1
    SolutionIndex: 10
    SolutionNameMin: Cijk_Alik_Bjlk_HSS_BH_UserArgs_MT128x128x64_MI16x16x1_SN_LDSB1_CLR1_GSU0_GSUC0_GSUWGMRR0_K1_LBSPPA512_LBSPPB2048_LPB0_MIWT4_4_PLR1_SU32_SUM0_SUS256_SKXCCM0_VWA4_VWB4_WGM4_WGMXCC1_WGMXCCGn1
    SolutionIndex: 11
    SolutionNameMin: Cijk_Alik_Bjlk_HSS_BH_UserArgs_MT128x128x64_MI16x16x1_SN_LDSB1_CLR1_GSU0_GSUC0_GSUWGMRR0_K1_LBSPPA128_LBSPPB2048_LPB0_MIWT4_4_PLR1_SU32_SUM0_SUS256_SKXCCM0_VWA1_VWB4_WGM8_WGMXCC1_WGMXCCGn1
    SolutionIndex: 12
    SolutionNameMin: Cijk_Alik_Bjlk_HSS_BH_UserArgs_MT64x64x64_MI16x16x1_SN_LDSB1_CLR1_GSU0_GSUC0_GSUWGMRR0_K1_LBSPPA128_LBSPPB1024_LPB32_MIWT2_2_PLR1_SU32_SUM0_SUS256_SKXCCM0_VWA1_VWB2_WGM8_WGMXCC1_WGMXCCGn1
    SolutionIndex: 13
    SolutionNameMin: Cijk_Alik_Bjlk_HSS_BH_UserArgs_MT32x32x64_MI16x16x1_SN_LDSB0_CLR1_GSU0_GSUC0_GSUWGMRR0_K1_LBSPPA128_LBSPPB512_LPB16_MIWT1_1_PLR1_SU32_SUM0_SUS256_SKXCCM0_VWA1_VWB1_WGM1_WGMXCC1_WGMXCCGn1
    SolutionIndex: 14
    SolutionNameMin: Cijk_Alik_Bjlk_HSS_BH_UserArgs_MT64x128x128_MI16x16x1_SN_LDSB1_CLR1_GSU0_GSUC0_GSUWGMRR0_K1_LBSPPA256_LBSPPB2048_LPB0_MIWT2_4_PLR1_SU32_SUM0_SUS256_SKXCCM0_VWA1_VWB4_WGM1_WGMXCC1_WGMXCCGn1
    SolutionIndex: 15
    SolutionNameMin: Cijk_Alik_Bjlk_HSS_BH_UserArgs_MT64x128x128_MI16x16x1_SN_LDSB1_CLR1_GSU0_GSUC0_GSUWGMRR0_K1_LBSPPA256_LBSPPB2048_LPB0_MIWT2_4_PLR2_SU32_SUM0_SUS256_SKXCCM0_VWA1_VWB4_WGM1_WGMXCC1_WGMXCCGn1
    SolutionIndex: 16
    SolutionNameMin: Cijk_Alik_Bjlk_HSS_BH_UserArgs_MT64x128x128_MI16x16x1_SN_LDSB1_CLR1_GSU0_GSUC0_GSUWGMRR0_K1_LBSPPA512_LBSPPB2048_LPB0_MIWT2_4_PLR2_SU32_SUM0_SUS256_SKXCCM0_VWA2_VWB4_WGM1_WGMXCC1_WGMXCCGn1
    SolutionIndex: 17
    SolutionNameMin: Cijk_Alik_Bjlk_HSS_BH_UserArgs_MT64x128x128_MI16x16x1_SN_LDSB1_CLR1_GSU0_GSUC0_GSUWGMRR0_K1_LBSPPA256_LBSPPB2048_LPB32_MIWT2_4_PLR1_SU32_SUM0_SUS256_SKXCCM0_VWA1_VWB2_WGM4_WGMXCC1_WGMXCCGn1
    SolutionIndex: 18
    SolutionNameMin: Cijk_Alik_Bjlk_HSS_BH_UserArgs_MT64x128x128_MI16x16x1_SN_LDSB1_CLR1_GSU0_GSUC0_GSUWGMRR0_K1_LBSPPA256_LBSPPB2048_LPB0_MIWT2_4_PLR2_SU32_SUM0_SUS256_SKXCCM0_VWA1_VWB4_WGM8_WGMXCC1_WGMXCCGn1
    SolutionIndex: 19
    SolutionNameMin: Cijk_Alik_Bjlk_HSS_BH_UserArgs_MT128x64x128_MI16x16x1_SN_LDSB1_CLR1_GSU0_GSUC0_GSUWGMRR0_K1_LBSPPA1024_LBSPPB1024_LPB16_MIWT4_2_PLR1_SU32_SUM0_SUS256_SKXCCM0_VWA4_VWB1_WGM1_WGMXCC1_WGMXCCGn1
    SolutionIndex: 20
    SolutionNameMin: Cijk_Alik_Bjlk_HSS_BH_UserArgs_MT128x64x128_MI16x16x1_SN_LDSB1_CLR1_GSU0_GSUC0_GSUWGMRR0_K1_LBSPPA1024_LBSPPB1024_LPB32_MIWT4_2_PLR1_SU32_SUM0_SUS256_SKXCCM0_VWA4_VWB2_WGM1_WGMXCC1_WGMXCCGn1
    SolutionIndex: 21
    SolutionNameMin: Cijk_Alik_Bjlk_HSS_BH_UserArgs_MT128x64x128_MI16x16x1_SN_LDSB1_CLR1_GSU0_GSUC0_GSUWGMRR0_K1_LBSPPA1024_LBSPPB1024_LPB16_MIWT4_2_PLR2_SU32_SUM0_SUS256_SKXCCM0_VWA4_VWB1_WGM1_WGMXCC1_WGMXCCGn1
    SolutionIndex: 22
    SolutionNameMin: Cijk_Alik_Bjlk_HSS_BH_UserArgs_MT128x64x128_MI16x16x1_SN_LDSB1_CLR1_GSU0_GSUC0_GSUWGMRR0_K1_LBSPPA1024_LBSPPB1024_LPB32_MIWT4_2_PLR2_SU32_SUM0_SUS256_SKXCCM0_VWA4_VWB2_WGM1_WGMXCC1_WGMXCCGn1
    SolutionIndex: 23
    SolutionNameMin: Cijk_Alik_Bjlk_HSS_BH_UserArgs_MT128x64x128_MI16x16x1_SN_LDSB1_CLR1_GSU0_GSUC0_GSUWGMRR0_K1_LBSPPA1024_LBSPPB1024_LPB16_MIWT4_2_PLR1_SU32_SUM0_SUS256_SKXCCM0_VWA4_VWB1_WGM4_WGMXCC1_WGMXCCGn1
    SolutionIndex: 24
    SolutionNameMin: Cijk_Alik_Bjlk_HSS_BH_UserArgs_MT128x64x128_MI16x16x1_SN_LDSB1_CLR1_GSU0_GSUC0_GSUWGMRR0_K1_LBSPPA1024_LBSPPB1024_LPB32_MIWT4_2_PLR1_SU32_SUM0_SUS256_SKXCCM0_VWA4_VWB2_WGM4_WGMXCC1_WGMXCCGn1
    SolutionIndex: 25
    SolutionNameMin: Cijk_Alik_Bjlk_HSS_BH_UserArgs_MT128x64x128_MI16x16x1_SN_LDSB1_CLR1_GSU0_GSUC0_GSUWGMRR0_K1_LBSPPA1024_LBSPPB1024_LPB32_MIWT4_2_PLR2_SU32_SUM0_SUS256_SKXCCM0_VWA4_VWB2_WGM4_WGMXCC1_WGMXCCGn1
    SolutionIndex: 26
    SolutionNameMin: Cijk_Alik_Bjlk_HSS_BH_UserArgs_MT128x64x128_MI16x16x1_SN_LDSB1_CLR1_GSU0_GSUC0_GSUWGMRR0_K1_LBSPPA1024_LBSPPB1024_LPB16_MIWT4_2_PLR1_SU32_SUM0_SUS256_SKXCCM0_VWA4_VWB1_WGM8_WGMXCC1_WGMXCCGn1
    SolutionIndex: 27
    SolutionNameMin: Cijk_Alik_Bjlk_HSS_BH_UserArgs_MT128x64x128_MI16x16x1_SN_LDSB1_CLR1_GSU0_GSUC0_GSUWGMRR0_K1_LBSPPA512_LBSPPB1024_LPB32_MIWT4_2_PLR2_SU32_SUM0_SUS256_SKXCCM0_VWA2_VWB2_WGM8_WGMXCC1_WGMXCCGn1
    SolutionIndex: 28
    SolutionNameMin: Cijk_Alik_Bjlk_HSS_BH_UserArgs_MT128x64x128_MI16x16x1_SN_LDSB1_CLR1_GSU0_GSUC0_GSUWGMRR0_K1_LBSPPA1024_LBSPPB1024_LPB32_MIWT4_2_PLR2_SU32_SUM0_SUS256_SKXCCM0_VWA4_VWB2_WGM8_WGMXCC1_WGMXCCGn1
    SolutionIndex: 29
    SolutionNameMin: Cijk_Alik_Bjlk_HSS_BH_UserArgs_MT128x32x128_MI16x16x1_SN_LDSB1_CLR1_GSU0_GSUC0_GSUWGMRR0_K1_LBSPPA1024_LBSPPB512_LPB16_MIWT4_1_PLR2_SU32_SUM0_SUS256_SKXCCM0_VWA4_VWB1_WGM1_WGMXCC1_WGMXCCGn1
    SolutionIndex: 30
    SolutionNameMin: Cijk_Alik_Bjlk_HSS_BH_UserArgs_MT64x64x128_MI16x16x1_SN_LDSB1_CLR1_GSU0_GSUC0_GSUWGMRR0_K1_LBSPPA256_LBSPPB1024_LPB32_MIWT2_2_PLR2_SU32_SUM0_SUS256_SKXCCM0_VWA1_VWB2_WGM4_WGMXCC1_WGMXCCGn1
    SolutionIndex: 31
    SolutionNameMin: Cijk_Alik_Bjlk_HSS_BH_UserArgs_MT64x64x128_MI16x16x1_SN_LDSB1_CLR1_GSU0_GSUC0_GSUWGMRR0_K1_LBSPPA256_LBSPPB1024_LPB32_MIWT2_2_PLR2_SU32_SUM0_SUS256_SKXCCM0_VWA1_VWB2_WGM8_WGMXCC1_WGMXCCGn1
    SolutionIndex: 32
    SolutionNameMin: Cijk_Alik_Bjlk_HSS_BH_UserArgs_MT32x64x128_MI16x16x1_SN_LDSB1_CLR1_GSU0_GSUC0_GSUWGMRR0_K1_LBSPPA256_LBSPPB1024_LPB32_MIWT1_2_PLR2_SU32_SUM0_SUS256_SKXCCM0_VWA1_VWB2_WGM1_WGMXCC1_WGMXCCGn1
    SolutionIndex: 33
    SolutionNameMin: Cijk_Alik_Bjlk_HSS_BH_UserArgs_MT32x32x128_MI16x16x1_SN_LDSB1_CLR1_GSU0_GSUC0_GSUWGMRR0_K1_LBSPPA256_LBSPPB512_LPB16_MIWT1_1_PLR1_SU32_SUM0_SUS256_SKXCCM0_VWA1_VWB1_WGM1_WGMXCC1_WGMXCCGn1
    SolutionIndex: 34
    SolutionNameMin: Cijk_Alik_Bjlk_HSS_BH_UserArgs_MT32x32x128_MI16x16x1_SN_LDSB1_CLR1_GSU0_GSUC0_GSUWGMRR0_K1_LBSPPA256_LBSPPB512_LPB16_MIWT1_1_PLR2_SU32_SUM0_SUS256_SKXCCM0_VWA1_VWB1_WGM1_WGMXCC1_WGMXCCGn1
    SolutionIndex: 35
    SolutionNameMin: Cijk_Alik_Bjlk_HSS_BH_UserArgs_MT32x32x128_MI16x16x1_SN_LDSB1_CLR1_GSU0_GSUC0_GSUWGMRR0_K1_LBSPPA256_LBSPPB512_LPB16_MIWT1_1_PLR2_SU32_SUM0_SUS256_SKXCCM0_VWA1_VWB1_WGM4_WGMXCC1_WGMXCCGn1
    SolutionIndex: 36
    SolutionNameMin: Cijk_Alik_Bjlk_HSS_BH_UserArgs_MT256x256x32_MI16x16x1_SN_LDSB1_CLR1_GSU0_GSUC0_GSUWGMRR0_K1_LBSPPA256_LBSPPB2048_LPB0_MIWT8_8_PLR1_SU32_SUM0_SUS256_SKXCCM8_VWA4_VWB4_WGM1_WGMXCC1_WGMXCCGn1
    SolutionIndex: 37
    SolutionNameMin: Cijk_Alik_Bjlk_HSS_BH_UserArgs_MT256x256x32_MI16x16x1_SN_LDSB1_CLR1_GSU0_GSUC0_GSUWGMRR0_K1_LBSPPA128_LBSPPB2048_LPB0_MIWT8_8_PLR1_SU32_SUM0_SUS256_SKXCCM8_VWA1_VWB8_WGM1_WGMXCC1_WGMXCCGn1
    SolutionIndex: 38
    SolutionNameMin: Cijk_Alik_Bjlk_HSS_BH_UserArgs_MT256x256x32_MI16x16x1_SN_LDSB1_CLR1_GSU0_GSUC0_GSUWGMRR0_K1_LBSPPA256_LBSPPB2048_LPB0_MIWT8_8_PLR1_SU32_SUM0_SUS256_SKXCCM8_VWA4_VWB8_WGM1_WGMXCC1_WGMXCCGn1
    SolutionIndex: 39
    SolutionNameMin: Cijk_Alik_Bjlk_HSS_BH_UserArgs_MT256x256x32_MI16x16x1_SN_LDSB1_CLR1_GSU0_GSUC0_GSUWGMRR0_K1_LBSPPA256_LBSPPB2048_LPB0_MIWT8_8_PLR1_SU32_SUM0_SUS256_SKXCCM8_VWA4_VWB8_WGM4_WGMXCC1_WGMXCCGn1
    SolutionIndex: 40
    SolutionNameMin: Cijk_Alik_Bjlk_HSS_BH_UserArgs_MT256x256x32_MI16x16x1_SN_LDSB1_CLR1_GSU0_GSUC0_GSUWGMRR0_K1_LBSPPA128_LBSPPB2048_LPB0_MIWT8_8_PLR1_SU32_SUM0_SUS256_SKXCCM8_VWA1_VWB4_WGM8_WGMXCC1_WGMXCCGn1
    SolutionIndex: 41
    SolutionNameMin: Cijk_Alik_Bjlk_HSS_BH_UserArgs_MT256x256x32_MI16x16x1_SN_LDSB1_CLR1_GSU0_GSUC0_GSUWGMRR0_K1_LBSPPA128_LBSPPB2048_LPB0_MIWT8_8_PLR1_SU32_SUM0_SUS256_SKXCCM8_VWA2_VWB8_WGM8_WGMXCC1_WGMXCCGn1
    SolutionIndex: 42
    SolutionNameMin: Cijk_Alik_Bjlk_HSS_BH_UserArgs_MT256x256x32_MI16x16x1_SN_LDSB1_CLR1_GSU0_GSUC0_GSUWGMRR0_K1_LBSPPA256_LBSPPB2048_LPB0_MIWT8_8_PLR1_SU32_SUM0_SUS256_SKXCCM8_VWA4_VWB8_WGM8_WGMXCC1_WGMXCCGn1
    SolutionIndex: 43
    SolutionNameMin: Cijk_Alik_Bjlk_HSS_BH_UserArgs_MT128x256x32_MI16x16x1_SN_LDSB1_CLR1_GSU0_GSUC0_GSUWGMRR0_K1_LBSPPA256_LBSPPB2048_LPB0_MIWT4_8_PLR1_SU32_SUM0_SUS256_SKXCCM8_VWA4_VWB4_WGM1_WGMXCC1_WGMXCCGn1
    SolutionIndex: 44
    SolutionNameMin: Cijk_Alik_Bjlk_HSS_BH_UserArgs_MT128x256x32_MI16x16x1_SN_LDSB1_CLR1_GSU0_GSUC0_GSUWGMRR0_K1_LBSPPA256_LBSPPB2048_LPB0_MIWT4_8_PLR1_SU32_SUM0_SUS256_SKXCCM8_VWA4_VWB4_WGM4_WGMXCC1_WGMXCCGn1
    SolutionIndex: 45
    SolutionNameMin: Cijk_Alik_Bjlk_HSS_BH_UserArgs_MT128x256x32_MI16x16x1_SN_LDSB1_CLR1_GSU0_GSUC0_GSUWGMRR0_K1_LBSPPA256_LBSPPB2048_LPB0_MIWT4_8_PLR1_SU32_SUM0_SUS256_SKXCCM8_VWA4_VWB8_WGM8_WGMXCC1_WGMXCCGn1
    SolutionIndex: 46
    SolutionNameMin: Cijk_Alik_Bjlk_HSS_BH_UserArgs_MT32x32x32_MI16x16x1_SN_LDSB0_CLR1_GSU0_GSUC0_GSUWGMRR0_K1_LBSPPA128_LBSPPB256_LPB16_MIWT1_1_PLR1_SU32_SUM0_SUS256_SKXCCM8_VWA1_VWB1_WGM1_WGMXCC1_WGMXCCGn1
    SolutionIndex: 47
    SolutionNameMin: Cijk_Alik_Bjlk_HSS_BH_UserArgs_MT128x256x64_MI16x16x1_SN_LDSB1_CLR1_GSU0_GSUC0_GSUWGMRR0_K1_LBSPPA512_LBSPPB4096_LPB32_MIWT4_8_PLR1_SU32_SUM0_SUS256_SKXCCM8_VWA4_VWB2_WGM4_WGMXCC1_WGMXCCGn1
    SolutionIndex: 48
    SolutionNameMin: Cijk_Alik_Bjlk_HSS_BH_UserArgs_MT128x256x64_MI16x16x1_SN_LDSB1_CLR1_GSU0_GSUC0_GSUWGMRR0_K1_LBSPPA512_LBSPPB4096_LPB0_MIWT4_8_PLR1_SU32_SUM0_SUS256_SKXCCM8_VWA4_VWB4_WGM4_WGMXCC1_WGMXCCGn1
    SolutionIndex: 49
    SolutionNameMin: Cijk_Alik_Bjlk_HSS_BH_UserArgs_MT128x256x64_MI16x16x1_SN_LDSB1_CLR1_GSU0_GSUC0_GSUWGMRR0_K1_LBSPPA512_LBSPPB4096_LPB32_MIWT4_8_PLR1_SU32_SUM0_SUS256_SKXCCM8_VWA4_VWB2_WGM8_WGMXCC1_WGMXCCGn1
    SolutionIndex: 50
    SolutionNameMin: Cijk_Alik_Bjlk_HSS_BH_UserArgs_MT256x128x64_MI16x16x1_SN_LDSB1_CLR1_GSU0_GSUC0_GSUWGMRR0_K1_LBSPPA512_LBSPPB2048_LPB0_MIWT8_4_PLR1_SU32_SUM0_SUS256_SKXCCM8_VWA4_VWB4_WGM1_WGMXCC1_WGMXCCGn1
    SolutionIndex: 51
    SolutionNameMin: Cijk_Alik_Bjlk_HSS_BH_UserArgs_MT256x128x64_MI16x16x1_SN_LDSB1_CLR1_GSU0_GSUC0_GSUWGMRR0_K1_LBSPPA512_LBSPPB2048_LPB32_MIWT8_4_PLR1_SU32_SUM0_SUS256_SKXCCM8_VWA4_VWB2_WGM8_WGMXCC1_WGMXCCGn1
    SolutionIndex: 52
    SolutionNameMin: Cijk_Alik_Bjlk_HSS_BH_UserArgs_MT256x128x64_MI16x16x1_SN_LDSB1_CLR1_GSU0_GSUC0_GSUWGMRR0_K1_LBSPPA128_LBSPPB2048_LPB0_MIWT8_4_PLR1_SU32_SUM0_SUS256_SKXCCM8_VWA1_VWB4_WGM8_WGMXCC1_WGMXCCGn1
    SolutionIndex: 53
    SolutionNameMin: Cijk_Alik_Bjlk_HSS_BH_UserArgs_MT256x128x64_MI16x16x1_SN_LDSB1_CLR1_GSU0_GSUC0_GSUWGMRR0_K1_LBSPPA256_LBSPPB2048_LPB0_MIWT8_4_PLR1_SU32_SUM0_SUS256_SKXCCM8_VWA2_VWB4_WGM8_WGMXCC1_WGMXCCGn1
    SolutionIndex: 54
    SolutionNameMin: Cijk_Alik_Bjlk_HSS_BH_UserArgs_MT256x128x64_MI16x16x1_SN_LDSB1_CLR1_GSU0_GSUC0_GSUWGMRR0_K1_LBSPPA512_LBSPPB2048_LPB0_MIWT8_4_PLR1_SU32_SUM0_SUS256_SKXCCM8_VWA4_VWB4_WGM8_WGMXCC1_WGMXCCGn1
    SolutionIndex: 55
    SolutionNameMin: Cijk_Alik_Bjlk_HSS_BH_UserArgs_MT128x128x64_MI16x16x1_SN_LDSB1_CLR1_GSU0_GSUC0_GSUWGMRR0_K1_LBSPPA512_LBSPPB2048_LPB0_MIWT4_4_PLR1_SU32_SUM0_SUS256_SKXCCM8_VWA4_VWB4_WGM1_WGMXCC1_WGMXCCGn1
    SolutionIndex: 56
    SolutionNameMin: Cijk_Alik_Bjlk_HSS_BH_UserArgs_MT128x128x64_MI16x16x1_SN_LDSB1_CLR1_GSU0_GSUC0_GSUWGMRR0_K1_LBSPPA512_LBSPPB2048_LPB32_MIWT4_4_PLR1_SU32_SUM0_SUS256_SKXCCM8_VWA4_VWB2_WGM4_WGMXCC1_WGMXCCGn1
    SolutionIndex: 57
    SolutionNameMin: Cijk_Alik_Bjlk_HSS_BH_UserArgs_MT128x128x64_MI16x16x1_SN_LDSB1_CLR1_GSU0_GSUC0_GSUWGMRR0_K1_LBSPPA256_LBSPPB2048_LPB0_MIWT4_4_PLR1_SU32_SUM0_SUS256_SKXCCM8_VWA2_VWB4_WGM4_WGMXCC1_WGMXCCGn1
    SolutionIndex: 58
    SolutionNameMin: Cijk_Alik_Bjlk_HSS_BH_UserArgs_MT128x128x64_MI16x16x1_SN_LDSB1_CLR1_GSU0_GSUC0_GSUWGMRR0_K1_LBSPPA512_LBSPPB2048_LPB0_MIWT4_4_PLR1_SU32_SUM0_SUS256_SKXCCM8_VWA4_VWB4_WGM4_WGMXCC1_WGMXCCGn1
    SolutionIndex: 59
    SolutionNameMin: Cijk_Alik_Bjlk_HSS_BH_UserArgs_MT128x128x64_MI16x16x1_SN_LDSB1_CLR1_GSU0_GSUC0_GSUWGMRR0_K1_LBSPPA512_LBSPPB2048_LPB32_MIWT4_4_PLR1_SU32_SUM0_SUS256_SKXCCM8_VWA4_VWB2_WGM8_WGMXCC1_WGMXCCGn1
    SolutionIndex: 60
    SolutionNameMin: Cijk_Alik_Bjlk_HSS_BH_UserArgs_MT128x128x64_MI16x16x1_SN_LDSB1_CLR1_GSU0_GSUC0_GSUWGMRR0_K1_LBSPPA128_LBSPPB2048_LPB0_MIWT4_4_PLR1_SU32_SUM0_SUS256_SKXCCM8_VWA1_VWB4_WGM8_WGMXCC1_WGMXCCGn1
    SolutionIndex: 61
    SolutionNameMin: Cijk_Alik_Bjlk_HSS_BH_UserArgs_MT128x128x64_MI16x16x1_SN_LDSB1_CLR1_GSU0_GSUC0_GSUWGMRR0_K1_LBSPPA256_LBSPPB2048_LPB0_MIWT4_4_PLR1_SU32_SUM0_SUS256_SKXCCM8_VWA2_VWB4_WGM8_WGMXCC1_WGMXCCGn1
    SolutionIndex: 62
    SolutionNameMin: Cijk_Alik_Bjlk_HSS_BH_UserArgs_MT128x128x64_MI16x16x1_SN_LDSB1_CLR1_GSU0_GSUC0_GSUWGMRR0_K1_LBSPPA512_LBSPPB2048_LPB0_MIWT4_4_PLR1_SU32_SUM0_SUS256_SKXCCM8_VWA4_VWB4_WGM8_WGMXCC1_WGMXCCGn1
    SolutionIndex: 63
    SolutionNameMin: Cijk_Alik_Bjlk_HSS_BH_UserArgs_MT64x128x64_MI16x16x1_SN_LDSB1_CLR1_GSU0_GSUC0_GSUWGMRR0_K1_LBSPPA256_LBSPPB2048_LPB0_MIWT2_4_PLR1_SU32_SUM0_SUS256_SKXCCM8_VWA2_VWB4_WGM1_WGMXCC1_WGMXCCGn1
    SolutionIndex: 64
    SolutionNameMin: Cijk_Alik_Bjlk_HSS_BH_UserArgs_MT128x64x64_MI16x16x1_SN_LDSB1_CLR1_GSU0_GSUC0_GSUWGMRR0_K1_LBSPPA512_LBSPPB1024_LPB32_MIWT4_2_PLR1_SU32_SUM0_SUS256_SKXCCM8_VWA4_VWB2_WGM1_WGMXCC1_WGMXCCGn1
    SolutionIndex: 65
    SolutionNameMin: Cijk_Alik_Bjlk_HSS_BH_UserArgs_MT128x64x64_MI16x16x1_SN_LDSB1_CLR1_GSU0_GSUC0_GSUWGMRR0_K1_LBSPPA256_LBSPPB1024_LPB32_MIWT4_2_PLR1_SU32_SUM0_SUS256_SKXCCM8_VWA2_VWB2_WGM8_WGMXCC1_WGMXCCGn1
    SolutionIndex: 66
    SolutionNameMin: Cijk_Alik_Bjlk_HSS_BH_UserArgs_MT128x64x64_MI16x16x1_SN_LDSB1_CLR1_GSU0_GSUC0_GSUWGMRR0_K1_LBSPPA512_LBSPPB1024_LPB32_MIWT4_2_PLR1_SU32_SUM0_SUS256_SKXCCM8_VWA4_VWB2_WGM8_WGMXCC1_WGMXCCGn1
    SolutionIndex: 67
    SolutionNameMin: Cijk_Alik_Bjlk_HSS_BH_UserArgs_MT64x64x64_MI16x16x1_SN_LDSB1_CLR1_GSU0_GSUC0_GSUWGMRR0_K1_LBSPPA128_LBSPPB1024_LPB32_MIWT2_2_PLR1_SU32_SUM0_SUS256_SKXCCM8_VWA1_VWB2_WGM4_WGMXCC1_WGMXCCGn1
    SolutionIndex: 68
    SolutionNameMin: Cijk_Alik_Bjlk_HSS_BH_UserArgs_MT64x64x64_MI16x16x1_SN_LDSB1_CLR1_GSU0_GSUC0_GSUWGMRR0_K1_LBSPPA128_LBSPPB1024_LPB32_MIWT2_2_PLR1_SU32_SUM0_SUS256_SKXCCM8_VWA1_VWB2_WGM8_WGMXCC1_WGMXCCGn1
    SolutionIndex: 69
    SolutionNameMin: Cijk_Alik_Bjlk_HSS_BH_UserArgs_MT32x64x64_MI16x16x1_SN_LDSB0_CLR1_GSU0_GSUC0_GSUWGMRR0_K1_LBSPPA128_LBSPPB1024_LPB32_MIWT1_2_PLR1_SU32_SUM0_SUS256_SKXCCM8_VWA1_VWB2_WGM4_WGMXCC1_WGMXCCGn1
    SolutionIndex: 70
    SolutionNameMin: Cijk_Alik_Bjlk_HSS_BH_UserArgs_MT32x32x64_MI16x16x1_SN_LDSB0_CLR1_GSU0_GSUC0_GSUWGMRR0_K1_LBSPPA128_LBSPPB512_LPB16_MIWT1_1_PLR1_SU32_SUM0_SUS256_SKXCCM8_VWA1_VWB1_WGM1_WGMXCC1_WGMXCCGn1
    SolutionIndex: 71
    SolutionNameMin: Cijk_Alik_Bjlk_HSS_BH_UserArgs_MT64x128x128_MI16x16x1_SN_LDSB1_CLR1_GSU0_GSUC0_GSUWGMRR0_K1_LBSPPA256_LBSPPB2048_LPB0_MIWT2_4_PLR2_SU32_SUM0_SUS256_SKXCCM8_VWA1_VWB4_WGM1_WGMXCC1_WGMXCCGn1
    SolutionIndex: 72
    SolutionNameMin: Cijk_Alik_Bjlk_HSS_BH_UserArgs_MT64x128x128_MI16x16x1_SN_LDSB1_CLR1_GSU0_GSUC0_GSUWGMRR0_K1_LBSPPA512_LBSPPB2048_LPB0_MIWT2_4_PLR2_SU32_SUM0_SUS256_SKXCCM8_VWA2_VWB4_WGM1_WGMXCC1_WGMXCCGn1
    SolutionIndex: 73
    SolutionNameMin: Cijk_Alik_Bjlk_HSS_BH_UserArgs_MT64x128x128_MI16x16x1_SN_LDSB1_CLR1_GSU0_GSUC0_GSUWGMRR0_K1_LBSPPA256_LBSPPB2048_LPB0_MIWT2_4_PLR2_SU32_SUM0_SUS256_SKXCCM8_VWA1_VWB4_WGM4_WGMXCC1_WGMXCCGn1
    SolutionIndex: 74
    SolutionNameMin: Cijk_Alik_Bjlk_HSS_BH_UserArgs_MT64x128x128_MI16x16x1_SN_LDSB1_CLR1_GSU0_GSUC0_GSUWGMRR0_K1_LBSPPA256_LBSPPB2048_LPB0_MIWT2_4_PLR2_SU32_SUM0_SUS256_SKXCCM8_VWA1_VWB4_WGM8_WGMXCC1_WGMXCCGn1
    SolutionIndex: 75
    SolutionNameMin: Cijk_Alik_Bjlk_HSS_BH_UserArgs_MT64x128x128_MI16x16x1_SN_LDSB1_CLR1_GSU0_GSUC0_GSUWGMRR0_K1_LBSPPA512_LBSPPB2048_LPB0_MIWT2_4_PLR2_SU32_SUM0_SUS256_SKXCCM8_VWA2_VWB4_WGM8_WGMXCC1_WGMXCCGn1
    SolutionIndex: 76
    SolutionNameMin: Cijk_Alik_Bjlk_HSS_BH_UserArgs_MT128x64x128_MI16x16x1_SN_LDSB1_CLR1_GSU0_GSUC0_GSUWGMRR0_K1_LBSPPA256_LBSPPB1024_LPB32_MIWT4_2_PLR1_SU32_SUM0_SUS256_SKXCCM8_VWA1_VWB2_WGM1_WGMXCC1_WGMXCCGn1
    SolutionIndex: 77
    SolutionNameMin: Cijk_Alik_Bjlk_HSS_BH_UserArgs_MT128x64x128_MI16x16x1_SN_LDSB1_CLR1_GSU0_GSUC0_GSUWGMRR0_K1_LBSPPA256_LBSPPB1024_LPB32_MIWT4_2_PLR2_SU32_SUM0_SUS256_SKXCCM8_VWA1_VWB2_WGM1_WGMXCC1_WGMXCCGn1
    SolutionIndex: 78
    SolutionNameMin: Cijk_Alik_Bjlk_HSS_BH_UserArgs_MT128x64x128_MI16x16x1_SN_LDSB1_CLR1_GSU0_GSUC0_GSUWGMRR0_K1_LBSPPA512_LBSPPB1024_LPB32_MIWT4_2_PLR2_SU32_SUM0_SUS256_SKXCCM8_VWA2_VWB2_WGM1_WGMXCC1_WGMXCCGn1
    SolutionIndex: 79
    SolutionNameMin: Cijk_Alik_Bjlk_HSS_BH_UserArgs_MT128x64x128_MI16x16x1_SN_LDSB1_CLR1_GSU0_GSUC0_GSUWGMRR0_K1_LBSPPA1024_LBSPPB1024_LPB32_MIWT4_2_PLR2_SU32_SUM0_SUS256_SKXCCM8_VWA4_VWB2_WGM1_WGMXCC1_WGMXCCGn1
    SolutionIndex: 80
    SolutionNameMin: Cijk_Alik_Bjlk_HSS_BH_UserArgs_MT128x64x128_MI16x16x1_SN_LDSB1_CLR1_GSU0_GSUC0_GSUWGMRR0_K1_LBSPPA256_LBSPPB1024_LPB32_MIWT4_2_PLR1_SU32_SUM0_SUS256_SKXCCM8_VWA1_VWB2_WGM4_WGMXCC1_WGMXCCGn1
    SolutionIndex: 81
    SolutionNameMin: Cijk_Alik_Bjlk_HSS_BH_UserArgs_MT128x64x128_MI16x16x1_SN_LDSB1_CLR1_GSU0_GSUC0_GSUWGMRR0_K1_LBSPPA1024_LBSPPB1024_LPB32_MIWT4_2_PLR2_SU32_SUM0_SUS256_SKXCCM8_VWA4_VWB2_WGM4_WGMXCC1_WGMXCCGn1
    SolutionIndex: 82
    SolutionNameMin: Cijk_Alik_Bjlk_HSS_BH_UserArgs_MT128x64x128_MI16x16x1_SN_LDSB1_CLR1_GSU0_GSUC0_GSUWGMRR0_K1_LBSPPA1024_LBSPPB1024_LPB32_MIWT4_2_PLR1_SU32_SUM0_SUS256_SKXCCM8_VWA4_VWB2_WGM8_WGMXCC1_WGMXCCGn1
    SolutionIndex: 83
    SolutionNameMin: Cijk_Alik_Bjlk_HSS_BH_UserArgs_MT128x64x128_MI16x16x1_SN_LDSB1_CLR1_GSU0_GSUC0_GSUWGMRR0_K1_LBSPPA1024_LBSPPB1024_LPB32_MIWT4_2_PLR2_SU32_SUM0_SUS256_SKXCCM8_VWA4_VWB2_WGM8_WGMXCC1_WGMXCCGn1
    SolutionIndex: 84
    SolutionNameMin: Cijk_Alik_Bjlk_HSS_BH_UserArgs_MT128x32x128_MI16x16x1_SN_LDSB1_CLR1_GSU0_GSUC0_GSUWGMRR0_K1_LBSPPA1024_LBSPPB512_LPB16_MIWT4_1_PLR2_SU32_SUM0_SUS256_SKXCCM8_VWA4_VWB1_WGM1_WGMXCC1_WGMXCCGn1
    SolutionIndex: 85
    SolutionNameMin: Cijk_Alik_Bjlk_HSS_BH_UserArgs_MT64x64x128_MI16x16x1_SN_LDSB1_CLR1_GSU0_GSUC0_GSUWGMRR0_K1_LBSPPA256_LBSPPB1024_LPB32_MIWT2_2_PLR1_SU32_SUM0_SUS256_SKXCCM8_VWA1_VWB2_WGM1_WGMXCC1_WGMXCCGn1
    SolutionIndex: 86
    SolutionNameMin: Cijk_Alik_Bjlk_HSS_BH_UserArgs_MT64x64x128_MI16x16x1_SN_LDSB1_CLR1_GSU0_GSUC0_GSUWGMRR0_K1_LBSPPA512_LBSPPB1024_LPB32_MIWT2_2_PLR1_SU32_SUM0_SUS256_SKXCCM8_VWA2_VWB2_WGM1_WGMXCC1_WGMXCCGn1
    SolutionIndex: 87
    SolutionNameMin: Cijk_Alik_Bjlk_HSS_BH_UserArgs_MT64x64x128_MI16x16x1_SN_LDSB1_CLR1_GSU0_GSUC0_GSUWGMRR0_K1_LBSPPA256_LBSPPB1024_LPB32_MIWT2_2_PLR2_SU32_SUM0_SUS256_SKXCCM8_VWA1_VWB2_WGM1_WGMXCC1_WGMXCCGn1
    SolutionIndex: 88
    SolutionNameMin: Cijk_Alik_Bjlk_HSS_BH_UserArgs_MT64x64x128_MI16x16x1_SN_LDSB1_CLR1_GSU0_GSUC0_GSUWGMRR0_K1_LBSPPA256_LBSPPB1024_LPB32_MIWT2_2_PLR2_SU32_SUM0_SUS256_SKXCCM8_VWA1_VWB2_WGM4_WGMXCC1_WGMXCCGn1
    SolutionIndex: 89
    SolutionNameMin: Cijk_Alik_Bjlk_HSS_BH_UserArgs_MT64x64x128_MI16x16x1_SN_LDSB1_CLR1_GSU0_GSUC0_GSUWGMRR0_K1_LBSPPA512_LBSPPB1024_LPB32_MIWT2_2_PLR2_SU32_SUM0_SUS256_SKXCCM8_VWA2_VWB2_WGM4_WGMXCC1_WGMXCCGn1
    SolutionIndex: 90
    SolutionNameMin: Cijk_Alik_Bjlk_HSS_BH_UserArgs_MT64x64x128_MI16x16x1_SN_LDSB1_CLR1_GSU0_GSUC0_GSUWGMRR0_K1_LBSPPA256_LBSPPB1024_LPB32_MIWT2_2_PLR1_SU32_SUM0_SUS256_SKXCCM8_VWA1_VWB2_WGM8_WGMXCC1_WGMXCCGn1
    SolutionIndex: 91
    SolutionNameMin: Cijk_Alik_Bjlk_HSS_BH_UserArgs_MT64x64x128_MI16x16x1_SN_LDSB1_CLR1_GSU0_GSUC0_GSUWGMRR0_K1_LBSPPA256_LBSPPB1024_LPB32_MIWT2_2_PLR2_SU32_SUM0_SUS256_SKXCCM8_VWA1_VWB2_WGM8_WGMXCC1_WGMXCCGn1
    SolutionIndex: 92
    SolutionNameMin: Cijk_Alik_Bjlk_HSS_BH_UserArgs_MT32x64x128_MI16x16x1_SN_LDSB1_CLR1_GSU0_GSUC0_GSUWGMRR0_K1_LBSPPA256_LBSPPB1024_LPB32_MIWT1_2_PLR2_SU32_SUM0_SUS256_SKXCCM8_VWA1_VWB2_WGM1_WGMXCC1_WGMXCCGn1
    SolutionIndex: 93
    SolutionNameMin: Cijk_Alik_Bjlk_HSS_BH_UserArgs_MT32x64x128_MI16x16x1_SN_LDSB1_CLR1_GSU0_GSUC0_GSUWGMRR0_K1_LBSPPA256_LBSPPB1024_LPB32_MIWT1_2_PLR2_SU32_SUM0_SUS256_SKXCCM8_VWA1_VWB2_WGM4_WGMXCC1_WGMXCCGn1
    SolutionIndex: 94
    SolutionNameMin: Cijk_Alik_Bjlk_HSS_BH_UserArgs_MT32x64x128_MI16x16x1_SN_LDSB1_CLR1_GSU0_GSUC0_GSUWGMRR0_K1_LBSPPA256_LBSPPB1024_LPB32_MIWT1_2_PLR2_SU32_SUM0_SUS256_SKXCCM8_VWA1_VWB2_WGM8_WGMXCC1_WGMXCCGn1
    SolutionIndex: 95
    SolutionNameMin: Cijk_Alik_Bjlk_HSS_BH_UserArgs_MT64x32x128_MI16x16x1_SN_LDSB1_CLR1_GSU0_GSUC0_GSUWGMRR0_K1_LBSPPA256_LBSPPB512_LPB16_MIWT2_1_PLR1_SU32_SUM0_SUS256_SKXCCM8_VWA1_VWB1_WGM1_WGMXCC1_WGMXCCGn1
    SolutionIndex: 96
    SolutionNameMin: Cijk_Alik_Bjlk_HSS_BH_UserArgs_MT64x32x128_MI16x16x1_SN_LDSB1_CLR1_GSU0_GSUC0_GSUWGMRR0_K1_LBSPPA256_LBSPPB512_LPB16_MIWT2_1_PLR2_SU32_SUM0_SUS256_SKXCCM8_VWA1_VWB1_WGM1_WGMXCC1_WGMXCCGn1
    SolutionIndex: 97
    SolutionNameMin: Cijk_Alik_Bjlk_HSS_BH_UserArgs_MT32x32x128_MI16x16x1_SN_LDSB1_CLR1_GSU0_GSUC0_GSUWGMRR0_K1_LBSPPA256_LBSPPB512_LPB16_MIWT1_1_PLR1_SU32_SUM0_SUS256_SKXCCM8_VWA1_VWB1_WGM1_WGMXCC1_WGMXCCGn1
    SolutionIndex: 98
    SolutionNameMin: Cijk_Alik_Bjlk_HSS_BH_UserArgs_MT32x32x128_MI16x16x1_SN_LDSB1_CLR1_GSU0_GSUC0_GSUWGMRR0_K1_LBSPPA256_LBSPPB512_LPB16_MIWT1_1_PLR2_SU32_SUM0_SUS256_SKXCCM8_VWA1_VWB1_WGM1_WGMXCC1_WGMXCCGn1
    SolutionIndex: 99
    SolutionNameMin: Cijk_Alik_Bjlk_HSS_BH_UserArgs_MT32x32x128_MI16x16x1_SN_LDSB1_CLR1_GSU0_GSUC0_GSUWGMRR0_K1_LBSPPA256_LBSPPB512_LPB16_MIWT1_1_PLR1_SU32_SUM0_SUS256_SKXCCM8_VWA1_VWB1_WGM4_WGMXCC1_WGMXCCGn1
    SolutionIndex: 100
    SolutionNameMin: Cijk_Alik_Bjlk_HSS_BH_UserArgs_MT32x32x128_MI16x16x1_SN_LDSB1_CLR1_GSU0_GSUC0_GSUWGMRR0_K1_LBSPPA256_LBSPPB512_LPB16_MIWT1_1_PLR2_SU32_SUM0_SUS256_SKXCCM8_VWA1_VWB1_WGM4_WGMXCC1_WGMXCCGn1
    SolutionIndex: 101
    SolutionNameMin: Cijk_Alik_Bjlk_HSS_BH_UserArgs_MT32x32x32_MI16x16x1_SN_LDSB0_CLR1_GSU0_GSUC0_GSUWGMRR0_K1_LBSPPA128_LBSPPB256_LPB16_MIWT1_1_PLR1_SU32_SUM0_SUS256_SKXCCM8_VWA1_VWB1_WGM1_WGMXCC1_WGMXCCGn1
- - - [128, 128, 1, 128, 128, 128, 128, 128]
    - [34, 0.083]
  - - [128, 128, 1, 256, 128, 128, 256, 128]
    - [34, 0.105]
  - - [128, 128, 1, 512, 128, 128, 512, 128]
    - [33, 0.176]
  - - [128, 128, 1, 1024, 128, 128, 1024, 128]
    - [97, 0.273]
  - - [128, 128, 1, 2048, 128, 128, 2048, 128]
    - [97, 0.332]
  - - [128, 128, 1, 4096, 128, 128, 4096, 128]
    - [46, 0.532]
  - - [128, 128, 1, 8192, 128, 128, 8192, 128]
    - [46, 1.047]
  - - [128, 256, 1, 128, 128, 128, 128, 256]
    - [34, 0.166]
  - - [128, 256, 1, 256, 128, 128, 256, 256]
    - [33, 0.21]
  - - [128, 256, 1, 512, 128, 128, 512, 256]
    - [98, 0.344]
  - - [128, 256, 1, 1024, 128, 128, 1024, 256]
    - [97, 0.507]
  - - [128, 256, 1, 2048, 128, 128, 2048, 256]
    - [1, 0.783]
  - - [128, 256, 1, 4096, 128, 128, 4096, 256]
    - [13, 1.503]
  - - [128, 256, 1, 8192, 128, 128, 8192, 256]
    - [98, 2.638]
  - - [128, 512, 1, 128, 128, 128, 128, 512]
    - [34, 0.331]
  - - [128, 512, 1, 256, 128, 128, 256, 512]
    - [33, 0.408]
  - - [128, 512, 1, 512, 128, 128, 512, 512]
    - [97, 0.681]
  - - [128, 512, 1, 1024, 128, 128, 1024, 512]
    - [70, 1.077]
  - - [128, 512, 1, 2048, 128, 128, 2048, 512]
    - [33, 2.001]
  - - [128, 512, 1, 4096, 128, 128, 4096, 512]
    - [98, 3.335]
  - - [128, 512, 1, 8192, 128, 128, 8192, 512]
    - [70, 4.65]
  - - [128, 1024, 1, 128, 128, 128, 128, 1024]
    - [35, 0.627]
  - - [128, 1024, 1, 256, 128, 128, 256, 1024]
    - [97, 0.764]
  - - [128, 1024, 1, 512, 128, 128, 512, 1024]
    - [97, 1.37]
  - - [128, 1024, 1, 1024, 128, 128, 1024, 1024]
    - [34, 2.262]
  - - [128, 1024, 1, 2048, 128, 128, 2048, 1024]
    - [98, 3.665]
  - - [128, 1024, 1, 4096, 128, 128, 4096, 1024]
    - [92, 5.168]
  - - [128, 1024, 1, 8192, 128, 128, 8192, 1024]
    - [69, 7.2]
  - - [128, 2048, 1, 128, 128, 128, 128, 2048]
    - [33, 1.247]
  - - [128, 2048, 1, 256, 128, 128, 256, 2048]
    - [34, 1.569]
  - - [128, 2048, 1, 512, 128, 128, 512, 2048]
    - [34, 2.537]
  - - [128, 2048, 1, 1024, 128, 128, 1024, 2048]
    - [92, 4.105]
  - - [128, 2048, 1, 2048, 128, 128, 2048, 2048]
    - [92, 6.346]
  - - [128, 2048, 1, 4096, 128, 128, 4096, 2048]
    - [12, 8.283]
  - - [128, 2048, 1, 8192, 128, 128, 8192, 2048]
    - [67, 11.454]
  - - [128, 4096, 1, 128, 128, 128, 128, 4096]
    - [92, 2.188]
  - - [128, 4096, 1, 256, 128, 128, 256, 4096]
    - [92, 2.857]
  - - [128, 4096, 1, 512, 128, 128, 512, 4096]
    - [92, 4.622]
  - - [128, 4096, 1, 1024, 128, 128, 1024, 4096]
    - [92, 7.134]
  - - [128, 4096, 1, 2048, 128, 128, 2048, 4096]
    - [87, 9.704]
  - - [128, 4096, 1, 4096, 128, 128, 4096, 4096]
    - [64, 12.591]
  - - [128, 4096, 1, 8192, 128, 128, 8192, 4096]
    - [22, 15.715]
  - - [128, 8192, 1, 128, 128, 128, 128, 8192]
    - [87, 3.563]
  - - [128, 8192, 1, 256, 128, 128, 256, 8192]
    - [29, 4.8]
  - - [128, 8192, 1, 512, 128, 128, 512, 8192]
    - [86, 7.529]
  - - [128, 8192, 1, 1024, 128, 128, 1024, 8192]
    - [87, 10.616]
  - - [128, 8192, 1, 2048, 128, 128, 2048, 8192]
    - [64, 13.476]
  - - [128, 8192, 1, 4096, 128, 128, 4096, 8192]
    - [22, 16.913]
  - - [128, 8192, 1, 8192, 128, 128, 8192, 8192]
    - [10, 21.24]
  - - [256, 128, 1, 128, 256, 256, 128, 128]
    - [34, 0.165]
  - - [256, 128, 1, 256, 256, 256, 256, 128]
    - [34, 0.207]
  - - [256, 128, 1, 512, 256, 256, 512, 128]
    - [98, 0.346]
  - - [256, 128, 1, 1024, 256, 256, 1024, 128]
    - [97, 0.52]
  - - [256, 128, 1, 2048, 256, 256, 2048, 128]
    - [2, 0.79]
  - - [256, 128, 1, 4096, 256, 256, 4096, 128]
    - [13, 1.515]
  - - [256, 128, 1, 8192, 256, 256, 8192, 128]
    - [33, 2.729]
  - - [256, 256, 1, 128, 256, 256, 128, 256]
    - [34, 0.328]
  - - [256, 256, 1, 256, 256, 256, 256, 256]
    - [98, 0.393]
  - - [256, 256, 1, 512, 256, 256, 512, 256]
    - [98, 0.676]
  - - [256, 256, 1, 1024, 256, 256, 1024, 256]
    - [97, 1.07]
  - - [256, 256, 1, 2048, 256, 256, 2048, 256]
    - [33, 2.006]
  - - [256, 256, 1, 4096, 256, 256, 4096, 256]
    - [97, 3.379]
  - - [256, 256, 1, 8192, 256, 256, 8192, 256]
    - [92, 4.756]
  - - [256, 512, 1, 128, 256, 256, 128, 512]
    - [34, 0.64]
  - - [256, 512, 1, 256, 256, 256, 256, 512]
    - [97, 0.762]
  - - [256, 512, 1, 512, 256, 256, 512, 512]
    - [33, 1.318]
  - - [256, 512, 1, 1024, 256, 256, 1024, 512]
    - [33, 2.248]
  - - [256, 512, 1, 2048, 256, 256, 2048, 512]
    - [98, 3.829]
  - - [256, 512, 1, 4096, 256, 256, 4096, 512]
    - [92, 5.72]
  - - [256, 512, 1, 8192, 256, 256, 8192, 512]
    - [69, 7.336]
  - - [256, 1024, 1, 128, 256, 256, 128, 1024]
    - [34, 1.23]
  - - [256, 1024, 1, 256, 256, 256, 256, 1024]
    - [33, 1.557]
  - - [256, 1024, 1, 512, 256, 256, 512, 1024]
    - [33, 2.518]
  - - [256, 1024, 1, 1024, 256, 256, 1024, 1024]
    - [92, 4.008]
  - - [256, 1024, 1, 2048, 256, 256, 2048, 1024]
    - [92, 6.572]
  - - [256, 1024, 1, 4096, 256, 256, 4096, 1024]
    - [87, 8.043]
  - - [256, 1024, 1, 8192, 256, 256, 8192, 1024]
    - [67, 11.531]
  - - [256, 2048, 1, 128, 256, 256, 128, 2048]
    - [32, 2.206]
  - - [256, 2048, 1, 256, 256, 256, 256, 2048]
    - [95, 2.858]
  - - [256, 2048, 1, 512, 256, 256, 512, 2048]
    - [92, 4.547]
  - - [256, 2048, 1, 1024, 256, 256, 1024, 2048]
    - [92, 7.169]
  - - [256, 2048, 1, 2048, 256, 256, 2048, 2048]
    - [87, 9.587]
  - - [256, 2048, 1, 4096, 256, 256, 4096, 2048]
    - [68, 12.348]
  - - [256, 2048, 1, 8192, 256, 256, 8192, 2048]
    - [66, 15.466]
  - - [256, 4096, 1, 128, 256, 256, 128, 4096]
    - [31, 3.457]
  - - [256, 4096, 1, 256, 256, 256, 256, 4096]
    - [31, 4.82]
  - - [256, 4096, 1, 512, 256, 256, 512, 4096]
    - [85, 7.559]
  - - [256, 4096, 1, 1024, 256, 256, 1024, 4096]
    - [87, 10.773]
  - - [256, 4096, 1, 2048, 256, 256, 2048, 4096]
    - [81, 13.671]
  - - [256, 4096, 1, 4096, 256, 256, 4096, 4096]
    - [66, 16.839]
  - - [256, 4096, 1, 8192, 256, 256, 8192, 4096]
    - [58, 21.255]
  - - [256, 8192, 1, 128, 256, 256, 128, 8192]
    - [79, 5.236]
  - - [256, 8192, 1, 256, 256, 256, 256, 8192]
    - [26, 7.456]
  - - [256, 8192, 1, 512, 256, 256, 512, 8192]
    - [77, 10.668]
  - - [256, 8192, 1, 1024, 256, 256, 1024, 8192]
    - [79, 13.935]
  - - [256, 8192, 1, 2048, 256, 256, 2048, 8192]
    - [78, 17.096]
  - - [256, 8192, 1, 4096, 256, 256, 4096, 8192]
    - [62, 22.436]
  - - [256, 8192, 1, 8192, 256, 256, 8192, 8192]
    - [5, 25.147]
  - - [512, 128, 1, 128, 512, 512, 128, 128]
    - [34, 0.33]
  - - [512, 128, 1, 256, 512, 512, 256, 128]
    - [34, 0.406]
  - - [512, 128, 1, 512, 512, 512, 512, 128]
    - [98, 0.682]
  - - [512, 128, 1, 1024, 512, 512, 1024, 128]
    - [13, 1.077]
  - - [512, 128, 1, 2048, 512, 512, 2048, 128]
    - [33, 2.044]
  - - [512, 128, 1, 4096, 512, 512, 4096, 128]
    - [33, 3.423]
  - - [512, 128, 1, 8192, 512, 512, 8192, 128]
    - [100, 5.304]
  - - [512, 256, 1, 128, 512, 512, 128, 256]
    - [34, 0.648]
  - - [512, 256, 1, 256, 512, 512, 256, 256]
    - [33, 0.758]
  - - [512, 256, 1, 512, 512, 512, 512, 256]
    - [34, 1.344]
  - - [512, 256, 1, 1024, 512, 512, 1024, 256]
    - [33, 2.306]
  - - [512, 256, 1, 2048, 512, 512, 2048, 256]
    - [98, 3.784]
  - - [512, 256, 1, 4096, 512, 512, 4096, 256]
    - [99, 5.776]
  - - [512, 256, 1, 8192, 512, 512, 8192, 256]
    - [92, 7.916]
  - - [512, 512, 1, 128, 512, 512, 128, 512]
    - [33, 1.22]
  - - [512, 512, 1, 256, 512, 512, 256, 512]
    - [33, 1.498]
  - - [512, 512, 1, 512, 512, 512, 512, 512]
    - [98, 2.523]
  - - [512, 512, 1, 1024, 512, 512, 1024, 512]
    - [92, 4.103]
  - - [512, 512, 1, 2048, 512, 512, 2048, 512]
    - [92, 6.768]
  - - [512, 512, 1, 4096, 512, 512, 4096, 512]
    - [92, 8.576]
  - - [512, 512, 1, 8192, 512, 512, 8192, 512]
    - [67, 11.605]
  - - [512, 1024, 1, 128, 512, 512, 128, 1024]
    - [32, 2.209]
  - - [512, 1024, 1, 256, 512, 512, 256, 1024]
    - [92, 2.839]
  - - [512, 1024, 1, 512, 512, 512, 512, 1024]
    - [92, 4.626]
  - - [512, 1024, 1, 1024, 512, 512, 1024, 1024]
    - [92, 7.149]
  - - [512, 1024, 1, 2048, 512, 512, 2048, 1024]
    - [91, 9.512]
  - - [512, 1024, 1, 4096, 512, 512, 4096, 1024]
    - [68, 12.338]
  - - [512, 1024, 1, 8192, 512, 512, 8192, 1024]
    - [83, 15.335]
  - - [512, 2048, 1, 128, 512, 512, 128, 2048]
    - [30, 3.618]
  - - [512, 2048, 1, 256, 512, 512, 256, 2048]
    - [87, 4.874]
  - - [512, 2048, 1, 512, 512, 512, 512, 2048]
    - [85, 7.506]
  - - [512, 2048, 1, 1024, 512, 512, 1024, 2048]
    - [87, 10.695]
  - - [512, 2048, 1, 2048, 512, 512, 2048, 2048]
    - [79, 13.658]
  - - [512, 2048, 1, 4096, 512, 512, 4096, 2048]
    - [66, 16.886]
  - - [512, 2048, 1, 8192, 512, 512, 8192, 2048]
    - [58, 21.197]
  - - [512, 4096, 1, 128, 512, 512, 128, 4096]
    - [18, 5.36]
  - - [512, 4096, 1, 256, 512, 512, 256, 4096]
    - [17, 7.436]
  - - [512, 4096, 1, 512, 512, 512, 512, 4096]
    - [81, 10.693]
  - - [512, 4096, 1, 1024, 512, 512, 1024, 4096]
    - [79, 14.285]
  - - [512, 4096, 1, 2048, 512, 512, 2048, 4096]
    - [58, 17.009]
  - - [512, 4096, 1, 4096, 512, 512, 4096, 4096]
    - [62, 22.948]
  - - [512, 4096, 1, 8192, 512, 512, 8192, 4096]
    - [51, 24.066]
  - - [512, 8192, 1, 128, 512, 512, 128, 8192]
    - [28, 6.622]
  - - [512, 8192, 1, 256, 512, 512, 256, 8192]
    - [25, 8.928]
  - - [512, 8192, 1, 512, 512, 512, 512, 8192]
    - [79, 12.55]
  - - [512, 8192, 1, 1024, 512, 512, 1024, 8192]
    - [55, 16.65]
  - - [512, 8192, 1, 2048, 512, 512, 2048, 8192]
    - [62, 21.851]
  - - [512, 8192, 1, 4096, 512, 512, 4096, 8192]
    - [45, 25.169]
  - - [512, 8192, 1, 8192, 512, 512, 8192, 8192]
    - [5, 27.458]
  - - [1024, 128, 1, 128, 1024, 1024, 128, 128]
    - [35, 0.617]
  - - [1024, 128, 1, 256, 1024, 1024, 256, 128]
    - [34, 0.76]
  - - [1024, 128, 1, 512, 1024, 1024, 512, 128]
    - [98, 1.32]
  - - [1024, 128, 1, 1024, 1024, 1024, 1024, 128]
    - [34, 2.252]
  - - [1024, 128, 1, 2048, 1024, 1024, 2048, 128]
    - [34, 3.758]
  - - [1024, 128, 1, 4096, 1024, 1024, 4096, 128]
    - [32, 5.923]
  - - [1024, 128, 1, 8192, 1024, 1024, 8192, 128]
    - [94, 8.104]
  - - [1024, 256, 1, 128, 1024, 1024, 128, 256]
    - [34, 1.231]
  - - [1024, 256, 1, 256, 1024, 1024, 256, 256]
    - [33, 1.575]
  - - [1024, 256, 1, 512, 1024, 1024, 512, 256]
    - [33, 2.521]
  - - [1024, 256, 1, 1024, 1024, 1024, 1024, 256]
    - [34, 4.051]
  - - [1024, 256, 1, 2048, 1024, 1024, 2048, 256]
    - [32, 6.648]
  - - [1024, 256, 1, 4096, 1024, 1024, 4096, 256]
    - [93, 9.16]
  - - [1024, 256, 1, 8192, 1024, 1024, 8192, 256]
    - [67, 11.737]
  - - [1024, 512, 1, 128, 1024, 1024, 128, 512]
    - [32, 2.217]
  - - [1024, 512, 1, 256, 1024, 1024, 256, 512]
    - [92, 2.844]
  - - [1024, 512, 1, 512, 1024, 1024, 512, 512]
    - [92, 4.601]
  - - [1024, 512, 1, 1024, 1024, 1024, 1024, 512]
    - [92, 7.188]
  - - [1024, 512, 1, 2048, 1024, 1024, 2048, 512]
    - [67, 9.888]
  - - [1024, 512, 1, 4096, 1024, 1024, 4096, 512]
    - [88, 12.695]
  - - [1024, 512, 1, 8192, 1024, 1024, 8192, 512]
    - [83, 15.556]
  - - [1024, 1024, 1, 128, 1024, 1024, 128, 1024]
    - [30, 3.653]
  - - [1024, 1024, 1, 256, 1024, 1024, 256, 1024]
    - [30, 4.851]
  - - [1024, 1024, 1, 512, 1024, 1024, 512, 1024]
    - [90, 7.436]
  - - [1024, 1024, 1, 1024, 1024, 1024, 1024, 1024]
    - [87, 10.633]
  - - [1024, 1024, 1, 2048, 1024, 1024, 2048, 1024]
    - [83, 13.539]
  - - [1024, 1024, 1, 4096, 1024, 1024, 4096, 1024]
    - [65, 16.701]
  - - [1024, 1024, 1, 8192, 1024, 1024, 8192, 1024]
    - [58, 20.995]
  - - [1024, 2048, 1, 128, 1024, 1024, 128, 2048]
    - [28, 5.355]
  - - [1024, 2048, 1, 256, 1024, 1024, 256, 2048]
    - [24, 7.448]
  - - [1024, 2048, 1, 512, 1024, 1024, 512, 2048]
    - [76, 10.602]
  - - [1024, 2048, 1, 1024, 1024, 1024, 1024, 2048]
    - [83, 13.85]
  - - [1024, 2048, 1, 2048, 1024, 1024, 2048, 2048]
    - [62, 16.682]
  - - [1024, 2048, 1, 4096, 1024, 1024, 4096, 2048]
    - [62, 22.674]
  - - [1024, 2048, 1, 8192, 1024, 1024, 8192, 2048]
    - [54, 24.141]
  - - [1024, 4096, 1, 128, 1024, 1024, 128, 4096]
    - [28, 6.895]
  - - [1024, 4096, 1, 256, 1024, 1024, 256, 4096]
    - [22, 9.06]
  - - [1024, 4096, 1, 512, 1024, 1024, 512, 4096]
    - [79, 12.579]
  - - [1024, 4096, 1, 1024, 1024, 1024, 1024, 4096]
    - [60, 16.321]
  - - [1024, 4096, 1, 2048, 1024, 1024, 2048, 4096]
    - [59, 21.687]
  - - [1024, 4096, 1, 4096, 1024, 1024, 4096, 4096]
    - [54, 25.366]
  - - [1024, 4096, 1, 8192, 1024, 1024, 8192, 4096]
    - [49, 27.208]
  - - [1024, 8192, 1, 128, 1024, 1024, 128, 8192]
    - [19, 6.624]
  - - [1024, 8192, 1, 256, 1024, 1024, 256, 8192]
    - [14, 10.02]
  - - [1024, 8192, 1, 512, 1024, 1024, 512, 8192]
    - [55, 15.146]
  - - [1024, 8192, 1, 1024, 1024, 1024, 1024, 8192]
    - [58, 20.354]
  - - [1024, 8192, 1, 2048, 1024, 1024, 2048, 8192]
    - [54, 24.125]
  - - [1024, 8192, 1, 4096, 1024, 1024, 4096, 8192]
    - [6, 26.752]
  - - [1024, 8192, 1, 8192, 1024, 1024, 8192, 8192]
    - [39, 30.239]
  - - [2048, 128, 1, 128, 2048, 2048, 128, 128]
    - [97, 1.237]
  - - [2048, 128, 1, 256, 2048, 2048, 256, 128]
    - [33, 1.592]
  - - [2048, 128, 1, 512, 2048, 2048, 512, 128]
    - [97, 2.552]
  - - [2048, 128, 1, 1024, 2048, 2048, 1024, 128]
    - [92, 4.158]
  - - [2048, 128, 1, 2048, 2048, 2048, 2048, 128]
    - [32, 6.793]
  - - [2048, 128, 1, 4096, 2048, 2048, 4096, 128]
    - [93, 9.247]
  - - [2048, 128, 1, 8192, 2048, 2048, 8192, 128]
    - [87, 11.318]
  - - [2048, 256, 1, 128, 2048, 2048, 128, 256]
    - [32, 2.216]
  - - [2048, 256, 1, 256, 2048, 2048, 256, 256]
    - [92, 2.884]
  - - [2048, 256, 1, 512, 2048, 2048, 512, 256]
    - [92, 4.627]
  - - [2048, 256, 1, 1024, 2048, 2048, 1024, 256]
    - [92, 7.262]
  - - [2048, 256, 1, 2048, 2048, 2048, 2048, 256]
    - [94, 9.718]
  - - [2048, 256, 1, 4096, 2048, 2048, 4096, 256]
    - [88, 13.155]
  - - [2048, 256, 1, 8192, 2048, 2048, 8192, 256]
    - [15, 14.904]
  - - [2048, 512, 1, 128, 2048, 2048, 128, 512]
    - [31, 3.674]
  - - [2048, 512, 1, 256, 2048, 2048, 256, 512]
    - [30, 4.878]
  - - [2048, 512, 1, 512, 2048, 2048, 512, 512]
    - [85, 7.606]
  - - [2048, 512, 1, 1024, 2048, 2048, 1024, 512]
    - [88, 10.714]
  - - [2048, 512, 1, 2048, 2048, 2048, 2048, 512]
    - [91, 14.026]
  - - [2048, 512, 1, 4096, 2048, 2048, 4096, 512]
    - [66, 17.282]
  - - [2048, 512, 1, 8192, 2048, 2048, 8192, 512]
    - [62, 20.701]
  - - [2048, 1024, 1, 128, 2048, 2048, 128, 1024]
    - [28, 5.503]
  - - [2048, 1024, 1, 256, 2048, 2048, 256, 1024]
    - [26, 7.485]
  - - [2048, 1024, 1, 512, 2048, 2048, 512, 1024]
    - [82, 10.585]
  - - [2048, 1024, 1, 1024, 2048, 2048, 1024, 1024]
    - [66, 13.815]
  - - [2048, 1024, 1, 2048, 2048, 2048, 2048, 1024]
    - [83, 16.669]
  - - [2048, 1024, 1, 4096, 2048, 2048, 4096, 1024]
    - [62, 22.618]
  - - [2048, 1024, 1, 8192, 2048, 2048, 8192, 1024]
    - [44, 23.802]
  - - [2048, 2048, 1, 128, 2048, 2048, 128, 2048]
    - [28, 6.807]
  - - [2048, 2048, 1, 256, 2048, 2048, 256, 2048]
    - [22, 8.89]
  - - [2048, 2048, 1, 512, 2048, 2048, 512, 2048]
    - [79, 12.129]
  - - [2048, 2048, 1, 1024, 2048, 2048, 1024, 2048]
    - [62, 16.196]
  - - [2048, 2048, 1, 2048, 2048, 2048, 2048, 2048]
    - [62, 22.063]
  - - [2048, 2048, 1, 4096, 2048, 2048, 4096, 2048]
    - [60, 25.767]
  - - [2048, 2048, 1, 8192, 2048, 2048, 8192, 2048]
    - [50, 26.65]
  - - [2048, 4096, 1, 128, 2048, 2048, 128, 4096]
    - [21, 6.54]
  - - [2048, 4096, 1, 256, 2048, 2048, 256, 4096]
    - [22, 9.989]
  - - [2048, 4096, 1, 512, 2048, 2048, 512, 4096]
    - [55, 14.661]
  - - [2048, 4096, 1, 1024, 2048, 2048, 1024, 4096]
    - [62, 20.134]
  - - [2048, 4096, 1, 2048, 2048, 2048, 2048, 4096]
    - [50, 24.896]
  - - [2048, 4096, 1, 4096, 2048, 2048, 4096, 4096]
    - [38, 26.82]
  - - [2048, 4096, 1, 8192, 2048, 2048, 8192, 4096]
    - [36, 30.605]
  - - [2048, 8192, 1, 128, 2048, 2048, 128, 8192]
    - [22, 7.313]
  - - [2048, 8192, 1, 256, 2048, 2048, 256, 8192]
    - [28, 11.711]
  - - [2048, 8192, 1, 512, 2048, 2048, 512, 8192]
    - [58, 17.057]
  - - [2048, 8192, 1, 1024, 2048, 2048, 1024, 8192]
    - [62, 22.236]
  - - [2048, 8192, 1, 2048, 2048, 2048, 2048, 8192]
    - [54, 26.106]
  - - [2048, 8192, 1, 4096, 2048, 2048, 4096, 8192]
    - [37, 29.463]
  - - [2048, 8192, 1, 8192, 2048, 2048, 8192, 8192]
    - [38, 31.674]
  - - [4096, 128, 1, 128, 4096, 4096, 128, 128]
    - [32, 2.195]
  - - [4096, 128, 1, 256, 4096, 4096, 256, 128]
    - [96, 2.923]
  - - [4096, 128, 1, 512, 4096, 4096, 512, 128]
    - [92, 4.682]
  - - [4096, 128, 1, 1024, 4096, 4096, 1024, 128]
    - [92, 7.105]
  - - [4096, 128, 1, 2048, 4096, 4096, 2048, 128]
    - [88, 9.817]
  - - [4096, 128, 1, 4096, 4096, 4096, 4096, 128]
    - [91, 12.535]
  - - [4096, 128, 1, 8192, 4096, 4096, 8192, 128]
    - [71, 15.263]
  - - [4096, 256, 1, 128, 4096, 4096, 128, 256]
    - [31, 3.641]
  - - [4096, 256, 1, 256, 4096, 4096, 256, 256]
    - [30, 4.904]
  - - [4096, 256, 1, 512, 4096, 4096, 512, 256]
    - [85, 7.448]
  - - [4096, 256, 1, 1024, 4096, 4096, 1024, 256]
    - [91, 10.69]
  - - [4096, 256, 1, 2048, 4096, 4096, 2048, 256]
    - [91, 14.125]
  - - [4096, 256, 1, 4096, 4096, 4096, 4096, 256]
    - [72, 16.232]
  - - [4096, 256, 1, 8192, 4096, 4096, 8192, 256]
    - [58, 20.734]
  - - [4096, 512, 1, 128, 4096, 4096, 128, 512]
    - [28, 5.467]
  - - [4096, 512, 1, 256, 4096, 4096, 256, 512]
    - [23, 7.589]
  - - [4096, 512, 1, 512, 4096, 4096, 512, 512]
    - [82, 10.663]
  - - [4096, 512, 1, 1024, 4096, 4096, 1024, 512]
    - [83, 13.883]
  - - [4096, 512, 1, 2048, 4096, 4096, 2048, 512]
    - [66, 17.06]
  - - [4096, 512, 1, 4096, 4096, 4096, 4096, 512]
    - [62, 21.644]
  - - [4096, 512, 1, 8192, 4096, 4096, 8192, 512]
    - [45, 24.423]
  - - [4096, 1024, 1, 128, 4096, 4096, 128, 1024]
    - [27, 6.113]
  - - [4096, 1024, 1, 256, 4096, 4096, 256, 1024]
    - [22, 8.725]
  - - [4096, 1024, 1, 512, 4096, 4096, 512, 1024]
    - [74, 12.122]
  - - [4096, 1024, 1, 1024, 4096, 4096, 1024, 1024]
    - [62, 16.238]
  - - [4096, 1024, 1, 2048, 4096, 4096, 2048, 1024]
    - [60, 21.462]
  - - [4096, 1024, 1, 4096, 4096, 4096, 4096, 1024]
    - [61, 24.841]
  - - [4096, 1024, 1, 8192, 4096, 4096, 8192, 1024]
    - [39, 26.586]
  - - [4096, 2048, 1, 128, 4096, 4096, 128, 2048]
    - [10, 6.498]
  - - [4096, 2048, 1, 256, 4096, 4096, 256, 2048]
    - [22, 9.747]
  - - [4096, 2048, 1, 512, 4096, 4096, 512, 2048]
    - [58, 14.656]
  - - [4096, 2048, 1, 1024, 4096, 4096, 1024, 2048]
    - [56, 20.013]
  - - [4096, 2048, 1, 2048, 4096, 4096, 2048, 2048]
    - [61, 24.589]
  - - [4096, 2048, 1, 4096, 4096, 4096, 4096, 2048]
    - [42, 26.759]
  - - [4096, 2048, 1, 8192, 4096, 4096, 8192, 2048]
    - [39, 30.282]
  - - [4096, 4096, 1, 128, 4096, 4096, 128, 4096]
    - [9, 7.32]
  - - [4096, 4096, 1, 256, 4096, 4096, 256, 4096]
    - [22, 11.495]
  - - [4096, 4096, 1, 512, 4096, 4096, 512, 4096]
    - [58, 16.784]
  - - [4096, 4096, 1, 1024, 4096, 4096, 1024, 4096]
    - [62, 21.98]
  - - [4096, 4096, 1, 2048, 4096, 4096, 2048, 4096]
    - [52, 25.977]
  - - [4096, 4096, 1, 4096, 4096, 4096, 4096, 4096]
    - [62, 29.716]
  - - [4096, 4096, 1, 8192, 4096, 4096, 8192, 4096]
    - [38, 32.841]
  - - [4096, 8192, 1, 128, 4096, 4096, 128, 8192]
    - [9, 8.165]
  - - [4096, 8192, 1, 256, 4096, 4096, 256, 8192]
    - [58, 12.345]
  - - [4096, 8192, 1, 512, 4096, 4096, 512, 8192]
    - [8, 17.072]
  - - [4096, 8192, 1, 1024, 4096, 4096, 1024, 8192]
    - [58, 22.319]
  - - [4096, 8192, 1, 2048, 4096, 4096, 2048, 8192]
    - [41, 27.197]
  - - [4096, 8192, 1, 4096, 4096, 4096, 4096, 8192]
    - [42, 32.746]
  - - [4096, 8192, 1, 8192, 4096, 4096, 8192, 8192]
    - [42, 35.346]
  - - [8192, 128, 1, 128, 8192, 8192, 128, 128]
    - [31, 3.512]
  - - [8192, 128, 1, 256, 8192, 8192, 256, 128]
    - [84, 4.744]
  - - [8192, 128, 1, 512, 8192, 8192, 512, 128]
    - [85, 7.488]
  - - [8192, 128, 1, 1024, 8192, 8192, 1024, 128]
    - [88, 10.542]
  - - [8192, 128, 1, 2048, 8192, 8192, 2048, 128]
    - [89, 13.329]
  - - [8192, 128, 1, 4096, 8192, 8192, 4096, 128]
    - [63, 16.599]
  - - [8192, 128, 1, 8192, 8192, 8192, 8192, 128]
    - [9, 20.976]
  - - [8192, 256, 1, 128, 8192, 8192, 128, 256]
    - [71, 5.172]
  - - [8192, 256, 1, 256, 8192, 8192, 256, 256]
    - [20, 7.191]
  - - [8192, 256, 1, 512, 8192, 8192, 512, 256]
    - [80, 10.519]
  - - [8192, 256, 1, 1024, 8192, 8192, 1024, 256]
    - [75, 13.667]
  - - [8192, 256, 1, 2048, 8192, 8192, 2048, 256]
    - [73, 17.066]
  - - [8192, 256, 1, 4096, 8192, 8192, 4096, 256]
    - [55, 21.611]
  - - [8192, 256, 1, 8192, 8192, 8192, 8192, 256]
    - [11, 24.502]
  - - [8192, 512, 1, 128, 8192, 8192, 128, 512]
    - [75, 5.954]
  - - [8192, 512, 1, 256, 8192, 8192, 256, 512]
    - [22, 8.658]
  - - [8192, 512, 1, 512, 8192, 8192, 512, 512]
    - [83, 12.298]
  - - [8192, 512, 1, 1024, 8192, 8192, 1024, 512]
    - [57, 16.249]
  - - [8192, 512, 1, 2048, 8192, 8192, 2048, 512]
    - [55, 21.253]
  - - [8192, 512, 1, 4096, 8192, 8192, 4096, 512]
    - [3, 24.882]
  - - [8192, 512, 1, 8192, 8192, 8192, 8192, 512]
    - [4, 27.794]
  - - [8192, 1024, 1, 128, 8192, 8192, 128, 1024]
    - [20, 6.677]
  - - [8192, 1024, 1, 256, 8192, 8192, 256, 1024]
    - [62, 10.003]
  - - [8192, 1024, 1, 512, 8192, 8192, 512, 1024]
    - [62, 15.102]
  - - [8192, 1024, 1, 1024, 8192, 8192, 1024, 1024]
    - [62, 20.35]
  - - [8192, 1024, 1, 2048, 8192, 8192, 2048, 1024]
    - [62, 24.53]
  - - [8192, 1024, 1, 4096, 8192, 8192, 4096, 1024]
    - [7, 27.093]
  - - [8192, 1024, 1, 8192, 8192, 8192, 8192, 1024]
    - [42, 29.848]
  - - [8192, 2048, 1, 128, 8192, 8192, 128, 2048]
    - [22, 7.476]
  - - [8192, 2048, 1, 256, 8192, 8192, 256, 2048]
    - [16, 11.423]
  - - [8192, 2048, 1, 512, 8192, 8192, 512, 2048]
    - [62, 16.74]
  - - [8192, 2048, 1, 1024, 8192, 8192, 1024, 2048]
    - [48, 22.084]
  - - [8192, 2048, 1, 2048, 8192, 8192, 2048, 2048]
    - [53, 26.609]
  - - [8192, 2048, 1, 4096, 8192, 8192, 4096, 2048]
    - [57, 29.53]
  - - [8192, 2048, 1, 8192, 8192, 8192, 8192, 2048]
    - [3, 32.058]
  - - [8192, 4096, 1, 128, 8192, 8192, 128, 4096]
    - [9, 8.366]
  - - [8192, 4096, 1, 256, 8192, 8192, 256, 4096]
    - [9, 12.216]
  - - [8192, 4096, 1, 512, 8192, 8192, 512, 4096]
    - [60, 17.203]
  - - [8192, 4096, 1, 1024, 8192, 8192, 1024, 4096]
    - [58, 22.202]
  - - [8192, 4096, 1, 2048, 8192, 8192, 2048, 4096]
    - [53, 27.617]
  - - [8192, 4096, 1, 4096, 8192, 8192, 4096, 4096]
    - [54, 32.674]
  - - [8192, 4096, 1, 8192, 8192, 8192, 8192, 4096]
    - [0, 35.693]
  - - [8192, 8192, 1, 128, 8192, 8192, 128, 8192]
    - [9, 7.127]
  - - [8192, 8192, 1, 256, 8192, 8192, 256, 8192]
    - [43, 11.422]
  - - [8192, 8192, 1, 512, 8192, 8192, 512, 8192]
    - [54, 17.223]
  - - [8192, 8192, 1, 1024, 8192, 8192, 1024, 8192]
    - [47, 23.787]
  - - [8192, 8192, 1, 2048, 8192, 8192, 2048, 8192]
    - [40, 30.645]
  - - [8192, 8192, 1, 4096, 8192, 8192, 4096, 8192]
    - [42, 35.584]
  - - [8192, 8192, 1, 8192, 8192, 8192, 8192, 8192]
    - [0, 37.86]
  - - [1, 1, 1, 32, 1, 1, 32, 1]
    - [101, 0.0]
- null
- null
- DeviceEfficiency
- GridBased
