library/src/amd_detail/rocblaslt/src/Tensile/Logic/streamk/gfx942/aquavanjaram942_Cijk_Ailk_Bljk_HSS_BH_UserArgs.yaml
- {MinimumRequiredVersion: 4.33.0}
- aquavanjaram942
- gfx942
- [Device 0049, Device 0050]
    SolutionIndex: 0
    SolutionNameMin: Cijk_Ailk_Bljk_HSS_BH_UserArgs_MT32x32x32_MI16x16x1_SN_LDSB0_CLR1_GSU0_GSUC0_GSUWGMRR0_K1_LBSPPA256_LBSPPB128_LPA16_MIWT1_1_PLR1_SU32_SUM0_SUS256_SKXCCM0_VWA1_VWB1_WGM1_WGMXCC1_WGMXCCGn1
    SolutionIndex: 1
    SolutionNameMin: Cijk_Ailk_Bljk_HSS_BH_UserArgs_MT32x32x32_MI16x16x1_SN_LDSB0_CLR0_GSU0_GSUC0_GSUWGMRR0_K1_LBSPPA256_LBSPPB128_LPA16_MIWT1_1_PLR0_SU32_SUM0_SUS256_SKXCCM0_VWA1_VWB1_WGM1_WGMXCC1_WGMXCCGn1
    SolutionIndex: 2
    SolutionNameMin: Cijk_Ailk_Bljk_HSS_BH_UserArgs_MT128x256x64_MI16x16x1_SN_LDSB1_CLR1_GSU0_GSUC0_GSUWGMRR0_K1_LBSPPA2048_LBSPPB128_LPA0_MIWT4_8_PLR1_SU32_SUM0_SUS256_SKXCCM0_VWA4_VWB1_WGM1_WGMXCC1_WGMXCCGn1
    SolutionIndex: 3
    SolutionNameMin: Cijk_Ailk_Bljk_HSS_BH_UserArgs_MT128x256x64_MI16x16x1_SN_LDSB1_CLR1_GSU0_GSUC0_GSUWGMRR0_K1_LBSPPA2048_LBSPPB512_LPA0_MIWT4_8_PLR1_SU32_SUM0_SUS256_SKXCCM0_VWA4_VWB4_WGM4_WGMXCC1_WGMXCCGn1
    SolutionIndex: 4
    SolutionNameMin: Cijk_Ailk_Bljk_HSS_BH_UserArgs_MT256x128x64_MI16x16x1_SN_LDSB1_CLR1_GSU0_GSUC0_GSUWGMRR0_K1_LBSPPA4096_LBSPPB128_LPA0_MIWT8_4_PLR1_SU32_SUM0_SUS256_SKXCCM0_VWA4_VWB1_WGM1_WGMXCC1_WGMXCCGn1
    SolutionIndex: 5
    SolutionNameMin: Cijk_Ailk_Bljk_HSS_BH_UserArgs_MT256x128x64_MI16x16x1_SN_LDSB1_CLR1_GSU0_GSUC0_GSUWGMRR0_K1_LBSPPA4096_LBSPPB256_LPA0_MIWT8_4_PLR1_SU32_SUM0_SUS256_SKXCCM0_VWA4_VWB2_WGM1_WGMXCC1_WGMXCCGn1
    SolutionIndex: 6
    SolutionNameMin: Cijk_Ailk_Bljk_HSS_BH_UserArgs_MT256x128x64_MI16x16x1_SN_LDSB1_CLR1_GSU0_GSUC0_GSUWGMRR0_K1_LBSPPA4096_LBSPPB128_LPA0_MIWT8_4_PLR1_SU32_SUM0_SUS256_SKXCCM0_VWA4_VWB1_WGM4_WGMXCC1_WGMXCCGn1
    SolutionIndex: 7
    SolutionNameMin: Cijk_Ailk_Bljk_HSS_BH_UserArgs_MT128x128x64_MI16x16x1_SN_LDSB1_CLR1_GSU0_GSUC0_GSUWGMRR0_K1_LBSPPA2048_LBSPPB256_LPA0_MIWT4_4_PLR1_SU32_SUM0_SUS256_SKXCCM0_VWA4_VWB2_WGM1_WGMXCC1_WGMXCCGn1
    SolutionIndex: 8
    SolutionNameMin: Cijk_Ailk_Bljk_HSS_BH_UserArgs_MT128x128x64_MI16x16x1_SN_LDSB1_CLR1_GSU0_GSUC0_GSUWGMRR0_K1_LBSPPA2048_LBSPPB512_LPA0_MIWT4_4_PLR1_SU32_SUM0_SUS256_SKXCCM0_VWA4_VWB4_WGM1_WGMXCC1_WGMXCCGn1
    SolutionIndex: 9
    SolutionNameMin: Cijk_Ailk_Bljk_HSS_BH_UserArgs_MT128x128x64_MI16x16x1_SN_LDSB1_CLR1_GSU0_GSUC0_GSUWGMRR0_K1_LBSPPA2048_LBSPPB128_LPA0_MIWT4_4_PLR1_SU32_SUM0_SUS256_SKXCCM0_VWA4_VWB1_WGM4_WGMXCC1_WGMXCCGn1
    SolutionIndex: 10
    SolutionNameMin: Cijk_Ailk_Bljk_HSS_BH_UserArgs_MT128x128x64_MI16x16x1_SN_LDSB1_CLR1_GSU0_GSUC0_GSUWGMRR0_K1_LBSPPA2048_LBSPPB512_LPA0_MIWT4_4_PLR1_SU32_SUM0_SUS256_SKXCCM0_VWA4_VWB4_WGM4_WGMXCC1_WGMXCCGn1
    SolutionIndex: 11
    SolutionNameMin: Cijk_Ailk_Bljk_HSS_BH_UserArgs_MT128x128x64_MI16x16x1_SN_LDSB1_CLR1_GSU0_GSUC0_GSUWGMRR0_K1_LBSPPA2048_LBSPPB128_LPA0_MIWT4_4_PLR1_SU32_SUM0_SUS256_SKXCCM0_VWA4_VWB1_WGM8_WGMXCC1_WGMXCCGn1
    SolutionIndex: 12
    SolutionNameMin: Cijk_Ailk_Bljk_HSS_BH_UserArgs_MT128x128x64_MI16x16x1_SN_LDSB1_CLR1_GSU0_GSUC0_GSUWGMRR0_K1_LBSPPA2048_LBSPPB256_LPA0_MIWT4_4_PLR1_SU32_SUM0_SUS256_SKXCCM0_VWA4_VWB2_WGM8_WGMXCC1_WGMXCCGn1
    SolutionIndex: 13
    SolutionNameMin: Cijk_Ailk_Bljk_HSS_BH_UserArgs_MT64x128x64_MI16x16x1_SN_LDSB1_CLR1_GSU0_GSUC0_GSUWGMRR0_K1_LBSPPA1024_LBSPPB128_LPA32_MIWT2_4_PLR1_SU32_SUM0_SUS256_SKXCCM0_VWA2_VWB1_WGM1_WGMXCC1_WGMXCCGn1
    SolutionIndex: 14
    SolutionNameMin: Cijk_Ailk_Bljk_HSS_BH_UserArgs_MT64x128x64_MI16x16x1_SN_LDSB1_CLR1_GSU0_GSUC0_GSUWGMRR0_K1_LBSPPA1024_LBSPPB256_LPA32_MIWT2_4_PLR1_SU32_SUM0_SUS256_SKXCCM0_VWA2_VWB2_WGM1_WGMXCC1_WGMXCCGn1
    SolutionIndex: 15
    SolutionNameMin: Cijk_Ailk_Bljk_HSS_BH_UserArgs_MT128x64x64_MI16x16x1_SN_LDSB1_CLR1_GSU0_GSUC0_GSUWGMRR0_K1_LBSPPA2048_LBSPPB256_LPA0_MIWT4_2_PLR1_SU32_SUM0_SUS256_SKXCCM0_VWA4_VWB2_WGM1_WGMXCC1_WGMXCCGn1
    SolutionIndex: 16
    SolutionNameMin: Cijk_Ailk_Bljk_HSS_BH_UserArgs_MT64x64x64_MI16x16x1_SN_LDSB1_CLR1_GSU0_GSUC0_GSUWGMRR0_K1_LBSPPA1024_LBSPPB256_LPA16_MIWT2_2_PLR1_SU32_SUM0_SUS256_SKXCCM0_VWA1_VWB2_WGM1_WGMXCC1_WGMXCCGn1
    SolutionIndex: 17
    SolutionNameMin: Cijk_Ailk_Bljk_HSS_BH_UserArgs_MT32x32x64_MI16x16x1_SN_LDSB0_CLR1_GSU0_GSUC0_GSUWGMRR0_K1_LBSPPA512_LBSPPB128_LPA16_MIWT1_1_PLR1_SU32_SUM0_SUS256_SKXCCM0_VWA1_VWB1_WGM1_WGMXCC1_WGMXCCGn1
    SolutionIndex: 18
    SolutionNameMin: Cijk_Ailk_Bljk_HSS_BH_UserArgs_MT64x128x128_MI16x16x1_SN_LDSB1_CLR1_GSU0_GSUC0_GSUWGMRR0_K1_LBSPPA1024_LBSPPB256_LPA32_MIWT2_4_PLR2_SU32_SUM0_SUS256_SKXCCM0_VWA2_VWB1_WGM1_WGMXCC1_WGMXCCGn1
    SolutionIndex: 19
    SolutionNameMin: Cijk_Ailk_Bljk_HSS_BH_UserArgs_MT64x128x128_MI16x16x1_SN_LDSB1_CLR1_GSU0_GSUC0_GSUWGMRR0_K1_LBSPPA1024_LBSPPB512_LPA16_MIWT2_4_PLR2_SU32_SUM0_SUS256_SKXCCM0_VWA1_VWB2_WGM8_WGMXCC1_WGMXCCGn1
    SolutionIndex: 20
    SolutionNameMin: Cijk_Ailk_Bljk_HSS_BH_UserArgs_MT128x64x128_MI16x16x1_SN_LDSB1_CLR1_GSU0_GSUC0_GSUWGMRR0_K1_LBSPPA2048_LBSPPB256_LPA0_MIWT4_2_PLR1_SU32_SUM0_SUS256_SKXCCM0_VWA4_VWB1_WGM1_WGMXCC1_WGMXCCGn1
    SolutionIndex: 21
    SolutionNameMin: Cijk_Ailk_Bljk_HSS_BH_UserArgs_MT128x64x128_MI16x16x1_SN_LDSB1_CLR1_GSU0_GSUC0_GSUWGMRR0_K1_LBSPPA2048_LBSPPB512_LPA0_MIWT4_2_PLR1_SU32_SUM0_SUS256_SKXCCM0_VWA4_VWB2_WGM1_WGMXCC1_WGMXCCGn1
    SolutionIndex: 22
    SolutionNameMin: Cijk_Ailk_Bljk_HSS_BH_UserArgs_MT128x64x128_MI16x16x1_SN_LDSB1_CLR1_GSU0_GSUC0_GSUWGMRR0_K1_LBSPPA2048_LBSPPB256_LPA0_MIWT4_2_PLR2_SU32_SUM0_SUS256_SKXCCM0_VWA4_VWB1_WGM1_WGMXCC1_WGMXCCGn1
    SolutionIndex: 23
    SolutionNameMin: Cijk_Ailk_Bljk_HSS_BH_UserArgs_MT128x64x128_MI16x16x1_SN_LDSB1_CLR1_GSU0_GSUC0_GSUWGMRR0_K1_LBSPPA2048_LBSPPB512_LPA0_MIWT4_2_PLR2_SU32_SUM0_SUS256_SKXCCM0_VWA4_VWB2_WGM1_WGMXCC1_WGMXCCGn1
    SolutionIndex: 24
    SolutionNameMin: Cijk_Ailk_Bljk_HSS_BH_UserArgs_MT128x64x128_MI16x16x1_SN_LDSB1_CLR1_GSU0_GSUC0_GSUWGMRR0_K1_LBSPPA2048_LBSPPB256_LPA0_MIWT4_2_PLR1_SU32_SUM0_SUS256_SKXCCM0_VWA4_VWB1_WGM4_WGMXCC1_WGMXCCGn1
    SolutionIndex: 25
    SolutionNameMin: Cijk_Ailk_Bljk_HSS_BH_UserArgs_MT128x64x128_MI16x16x1_SN_LDSB1_CLR1_GSU0_GSUC0_GSUWGMRR0_K1_LBSPPA2048_LBSPPB256_LPA0_MIWT4_2_PLR2_SU32_SUM0_SUS256_SKXCCM0_VWA4_VWB1_WGM4_WGMXCC1_WGMXCCGn1
    SolutionIndex: 26
    SolutionNameMin: Cijk_Ailk_Bljk_HSS_BH_UserArgs_MT128x64x128_MI16x16x1_SN_LDSB1_CLR1_GSU0_GSUC0_GSUWGMRR0_K1_LBSPPA2048_LBSPPB256_LPA0_MIWT4_2_PLR1_SU32_SUM0_SUS256_SKXCCM0_VWA4_VWB1_WGM8_WGMXCC1_WGMXCCGn1
    SolutionIndex: 27
    SolutionNameMin: Cijk_Ailk_Bljk_HSS_BH_UserArgs_MT128x64x128_MI16x16x1_SN_LDSB1_CLR1_GSU0_GSUC0_GSUWGMRR0_K1_LBSPPA2048_LBSPPB512_LPA0_MIWT4_2_PLR1_SU32_SUM0_SUS256_SKXCCM0_VWA4_VWB2_WGM8_WGMXCC1_WGMXCCGn1
    SolutionIndex: 28
    SolutionNameMin: Cijk_Ailk_Bljk_HSS_BH_UserArgs_MT128x64x128_MI16x16x1_SN_LDSB1_CLR1_GSU0_GSUC0_GSUWGMRR0_K1_LBSPPA2048_LBSPPB256_LPA0_MIWT4_2_PLR2_SU32_SUM0_SUS256_SKXCCM0_VWA4_VWB1_WGM8_WGMXCC1_WGMXCCGn1
    SolutionIndex: 29
    SolutionNameMin: Cijk_Ailk_Bljk_HSS_BH_UserArgs_MT128x32x128_MI16x16x1_SN_LDSB1_CLR1_GSU0_GSUC0_GSUWGMRR0_K1_LBSPPA2048_LBSPPB256_LPA0_MIWT4_1_PLR2_SU32_SUM0_SUS256_SKXCCM0_VWA4_VWB1_WGM1_WGMXCC1_WGMXCCGn1
    SolutionIndex: 30
    SolutionNameMin: Cijk_Ailk_Bljk_HSS_BH_UserArgs_MT128x32x128_MI16x16x1_SN_LDSB1_CLR1_GSU0_GSUC0_GSUWGMRR0_K1_LBSPPA2048_LBSPPB256_LPA0_MIWT4_1_PLR2_SU32_SUM0_SUS256_SKXCCM0_VWA4_VWB1_WGM4_WGMXCC1_WGMXCCGn1
    SolutionIndex: 31
    SolutionNameMin: Cijk_Ailk_Bljk_HSS_BH_UserArgs_MT128x32x128_MI16x16x1_SN_LDSB1_CLR1_GSU0_GSUC0_GSUWGMRR0_K1_LBSPPA2048_LBSPPB256_LPA0_MIWT4_1_PLR2_SU32_SUM0_SUS256_SKXCCM0_VWA4_VWB1_WGM8_WGMXCC1_WGMXCCGn1
    SolutionIndex: 32
    SolutionNameMin: Cijk_Ailk_Bljk_HSS_BH_UserArgs_MT64x64x128_MI16x16x1_SN_LDSB1_CLR1_GSU0_GSUC0_GSUWGMRR0_K1_LBSPPA1024_LBSPPB256_LPA32_MIWT2_2_PLR2_SU32_SUM0_SUS256_SKXCCM0_VWA2_VWB1_WGM4_WGMXCC1_WGMXCCGn1
    SolutionIndex: 33
    SolutionNameMin: Cijk_Ailk_Bljk_HSS_BH_UserArgs_MT64x64x128_MI16x16x1_SN_LDSB1_CLR1_GSU0_GSUC0_GSUWGMRR0_K1_LBSPPA1024_LBSPPB512_LPA32_MIWT2_2_PLR2_SU32_SUM0_SUS256_SKXCCM0_VWA2_VWB2_WGM4_WGMXCC1_WGMXCCGn1
    SolutionIndex: 34
    SolutionNameMin: Cijk_Ailk_Bljk_HSS_BH_UserArgs_MT64x64x128_MI16x16x1_SN_LDSB1_CLR1_GSU0_GSUC0_GSUWGMRR0_K1_LBSPPA1024_LBSPPB512_LPA32_MIWT2_2_PLR2_SU32_SUM0_SUS256_SKXCCM0_VWA2_VWB2_WGM8_WGMXCC1_WGMXCCGn1
    SolutionIndex: 35
    SolutionNameMin: Cijk_Ailk_Bljk_HSS_BH_UserArgs_MT32x64x128_MI16x16x1_SN_LDSB1_CLR1_GSU0_GSUC0_GSUWGMRR0_K1_LBSPPA512_LBSPPB256_LPA16_MIWT1_2_PLR1_SU32_SUM0_SUS256_SKXCCM0_VWA1_VWB1_WGM1_WGMXCC1_WGMXCCGn1
    SolutionIndex: 36
    SolutionNameMin: Cijk_Ailk_Bljk_HSS_BH_UserArgs_MT32x64x128_MI16x16x1_SN_LDSB1_CLR1_GSU0_GSUC0_GSUWGMRR0_K1_LBSPPA512_LBSPPB512_LPA16_MIWT1_2_PLR1_SU32_SUM0_SUS256_SKXCCM0_VWA1_VWB2_WGM1_WGMXCC1_WGMXCCGn1
    SolutionIndex: 37
    SolutionNameMin: Cijk_Ailk_Bljk_HSS_BH_UserArgs_MT32x64x128_MI16x16x1_SN_LDSB1_CLR1_GSU0_GSUC0_GSUWGMRR0_K1_LBSPPA512_LBSPPB512_LPA16_MIWT1_2_PLR2_SU32_SUM0_SUS256_SKXCCM0_VWA1_VWB2_WGM1_WGMXCC1_WGMXCCGn1
    SolutionIndex: 38
    SolutionNameMin: Cijk_Ailk_Bljk_HSS_BH_UserArgs_MT64x32x128_MI16x16x1_SN_LDSB1_CLR1_GSU0_GSUC0_GSUWGMRR0_K1_LBSPPA1024_LBSPPB256_LPA32_MIWT2_1_PLR2_SU32_SUM0_SUS256_SKXCCM0_VWA2_VWB1_WGM1_WGMXCC1_WGMXCCGn1
    SolutionIndex: 39
    SolutionNameMin: Cijk_Ailk_Bljk_HSS_BH_UserArgs_MT32x32x128_MI16x16x1_SN_LDSB1_CLR1_GSU0_GSUC0_GSUWGMRR0_K1_LBSPPA512_LBSPPB256_LPA16_MIWT1_1_PLR1_SU32_SUM0_SUS256_SKXCCM0_VWA1_VWB1_WGM1_WGMXCC1_WGMXCCGn1
    SolutionIndex: 40
    SolutionNameMin: Cijk_Ailk_Bljk_HSS_BH_UserArgs_MT32x32x128_MI16x16x1_SN_LDSB1_CLR1_GSU0_GSUC0_GSUWGMRR0_K1_LBSPPA512_LBSPPB256_LPA16_MIWT1_1_PLR2_SU32_SUM0_SUS256_SKXCCM0_VWA1_VWB1_WGM1_WGMXCC1_WGMXCCGn1
    SolutionIndex: 41
    SolutionNameMin: Cijk_Ailk_Bljk_HSS_BH_UserArgs_MT32x32x128_MI16x16x1_SN_LDSB1_CLR1_GSU0_GSUC0_GSUWGMRR0_K1_LBSPPA512_LBSPPB256_LPA16_MIWT1_1_PLR2_SU32_SUM0_SUS256_SKXCCM0_VWA1_VWB1_WGM8_WGMXCC1_WGMXCCGn1
    SolutionIndex: 42
    SolutionNameMin: Cijk_Ailk_Bljk_HSS_BH_UserArgs_MT256x256x32_MI16x16x1_SN_LDSB1_CLR1_GSU0_GSUC0_GSUWGMRR0_K1_LBSPPA2048_LBSPPB128_LPA0_MIWT8_8_PLR1_SU32_SUM0_SUS256_SKXCCM8_VWA4_VWB1_WGM1_WGMXCC1_WGMXCCGn1
    SolutionIndex: 43
    SolutionNameMin: Cijk_Ailk_Bljk_HSS_BH_UserArgs_MT256x256x32_MI16x16x1_SN_LDSB1_CLR1_GSU0_GSUC0_GSUWGMRR0_K1_LBSPPA2048_LBSPPB128_LPA0_MIWT8_8_PLR1_SU32_SUM0_SUS256_SKXCCM8_VWA4_VWB2_WGM1_WGMXCC1_WGMXCCGn1
    SolutionIndex: 44
    SolutionNameMin: Cijk_Ailk_Bljk_HSS_BH_UserArgs_MT256x256x32_MI16x16x1_SN_LDSB1_CLR1_GSU0_GSUC0_GSUWGMRR0_K1_LBSPPA2048_LBSPPB256_LPA0_MIWT8_8_PLR1_SU32_SUM0_SUS256_SKXCCM8_VWA4_VWB4_WGM1_WGMXCC1_WGMXCCGn1
    SolutionIndex: 45
    SolutionNameMin: Cijk_Ailk_Bljk_HSS_BH_UserArgs_MT256x256x32_MI16x16x1_SN_LDSB1_CLR1_GSU0_GSUC0_GSUWGMRR0_K1_LBSPPA2048_LBSPPB512_LPA0_MIWT8_8_PLR1_SU32_SUM0_SUS256_SKXCCM8_VWA4_VWB8_WGM1_WGMXCC1_WGMXCCGn1
    SolutionIndex: 46
    SolutionNameMin: Cijk_Ailk_Bljk_HSS_BH_UserArgs_MT256x256x32_MI16x16x1_SN_LDSB1_CLR1_GSU0_GSUC0_GSUWGMRR0_K1_LBSPPA2048_LBSPPB128_LPA0_MIWT8_8_PLR1_SU32_SUM0_SUS256_SKXCCM8_VWA4_VWB1_WGM4_WGMXCC1_WGMXCCGn1
    SolutionIndex: 47
    SolutionNameMin: Cijk_Ailk_Bljk_HSS_BH_UserArgs_MT256x256x32_MI16x16x1_SN_LDSB1_CLR1_GSU0_GSUC0_GSUWGMRR0_K1_LBSPPA2048_LBSPPB128_LPA0_MIWT8_8_PLR1_SU32_SUM0_SUS256_SKXCCM8_VWA4_VWB2_WGM4_WGMXCC1_WGMXCCGn1
    SolutionIndex: 48
    SolutionNameMin: Cijk_Ailk_Bljk_HSS_BH_UserArgs_MT256x256x32_MI16x16x1_SN_LDSB1_CLR1_GSU0_GSUC0_GSUWGMRR0_K1_LBSPPA2048_LBSPPB256_LPA0_MIWT8_8_PLR1_SU32_SUM0_SUS256_SKXCCM8_VWA4_VWB4_WGM4_WGMXCC1_WGMXCCGn1
    SolutionIndex: 49
    SolutionNameMin: Cijk_Ailk_Bljk_HSS_BH_UserArgs_MT256x256x32_MI16x16x1_SN_LDSB1_CLR1_GSU0_GSUC0_GSUWGMRR0_K1_LBSPPA2048_LBSPPB512_LPA0_MIWT8_8_PLR1_SU32_SUM0_SUS256_SKXCCM8_VWA4_VWB8_WGM4_WGMXCC1_WGMXCCGn1
    SolutionIndex: 50
    SolutionNameMin: Cijk_Ailk_Bljk_HSS_BH_UserArgs_MT256x128x32_MI16x16x1_SN_LDSB1_CLR1_GSU0_GSUC0_GSUWGMRR0_K1_LBSPPA2048_LBSPPB256_LPA0_MIWT8_4_PLR1_SU32_SUM0_SUS256_SKXCCM8_VWA4_VWB4_WGM8_WGMXCC1_WGMXCCGn1
    SolutionIndex: 51
    SolutionNameMin: Cijk_Ailk_Bljk_HSS_BH_UserArgs_MT128x256x64_MI16x16x1_SN_LDSB1_CLR1_GSU0_GSUC0_GSUWGMRR0_K1_LBSPPA2048_LBSPPB128_LPA0_MIWT4_8_PLR1_SU32_SUM0_SUS256_SKXCCM8_VWA4_VWB1_WGM1_WGMXCC1_WGMXCCGn1
    SolutionIndex: 52
    SolutionNameMin: Cijk_Ailk_Bljk_HSS_BH_UserArgs_MT128x256x64_MI16x16x1_SN_LDSB1_CLR1_GSU0_GSUC0_GSUWGMRR0_K1_LBSPPA2048_LBSPPB256_LPA16_MIWT4_8_PLR1_SU32_SUM0_SUS256_SKXCCM8_VWA1_VWB2_WGM1_WGMXCC1_WGMXCCGn1
    SolutionIndex: 53
    SolutionNameMin: Cijk_Ailk_Bljk_HSS_BH_UserArgs_MT128x256x64_MI16x16x1_SN_LDSB1_CLR1_GSU0_GSUC0_GSUWGMRR0_K1_LBSPPA2048_LBSPPB256_LPA0_MIWT4_8_PLR1_SU32_SUM0_SUS256_SKXCCM8_VWA4_VWB2_WGM1_WGMXCC1_WGMXCCGn1
    SolutionIndex: 54
    SolutionNameMin: Cijk_Ailk_Bljk_HSS_BH_UserArgs_MT128x256x64_MI16x16x1_SN_LDSB1_CLR1_GSU0_GSUC0_GSUWGMRR0_K1_LBSPPA2048_LBSPPB512_LPA0_MIWT4_8_PLR1_SU32_SUM0_SUS256_SKXCCM8_VWA4_VWB4_WGM1_WGMXCC1_WGMXCCGn1
    SolutionIndex: 55
    SolutionNameMin: Cijk_Ailk_Bljk_HSS_BH_UserArgs_MT128x256x64_MI16x16x1_SN_LDSB1_CLR1_GSU0_GSUC0_GSUWGMRR0_K1_LBSPPA2048_LBSPPB1024_LPA0_MIWT4_8_PLR1_SU32_SUM0_SUS256_SKXCCM8_VWA4_VWB8_WGM1_WGMXCC1_WGMXCCGn1
    SolutionIndex: 56
    SolutionNameMin: Cijk_Ailk_Bljk_HSS_BH_UserArgs_MT128x256x64_MI16x16x1_SN_LDSB1_CLR1_GSU0_GSUC0_GSUWGMRR0_K1_LBSPPA2048_LBSPPB128_LPA0_MIWT4_8_PLR1_SU32_SUM0_SUS256_SKXCCM8_VWA4_VWB1_WGM4_WGMXCC1_WGMXCCGn1
    SolutionIndex: 57
    SolutionNameMin: Cijk_Ailk_Bljk_HSS_BH_UserArgs_MT128x256x64_MI16x16x1_SN_LDSB1_CLR1_GSU0_GSUC0_GSUWGMRR0_K1_LBSPPA2048_LBSPPB256_LPA0_MIWT4_8_PLR1_SU32_SUM0_SUS256_SKXCCM8_VWA4_VWB2_WGM4_WGMXCC1_WGMXCCGn1
    SolutionIndex: 58
    SolutionNameMin: Cijk_Ailk_Bljk_HSS_BH_UserArgs_MT128x256x64_MI16x16x1_SN_LDSB1_CLR1_GSU0_GSUC0_GSUWGMRR0_K1_LBSPPA2048_LBSPPB512_LPA0_MIWT4_8_PLR1_SU32_SUM0_SUS256_SKXCCM8_VWA4_VWB4_WGM4_WGMXCC1_WGMXCCGn1
    SolutionIndex: 59
    SolutionNameMin: Cijk_Ailk_Bljk_HSS_BH_UserArgs_MT128x256x64_MI16x16x1_SN_LDSB1_CLR1_GSU0_GSUC0_GSUWGMRR0_K1_LBSPPA2048_LBSPPB1024_LPA0_MIWT4_8_PLR1_SU32_SUM0_SUS256_SKXCCM8_VWA4_VWB8_WGM4_WGMXCC1_WGMXCCGn1
    SolutionIndex: 60
    SolutionNameMin: Cijk_Ailk_Bljk_HSS_BH_UserArgs_MT256x128x64_MI16x16x1_SN_LDSB1_CLR1_GSU0_GSUC0_GSUWGMRR0_K1_LBSPPA4096_LBSPPB128_LPA0_MIWT8_4_PLR1_SU32_SUM0_SUS256_SKXCCM8_VWA4_VWB1_WGM8_WGMXCC1_WGMXCCGn1
    SolutionIndex: 61
    SolutionNameMin: Cijk_Ailk_Bljk_HSS_BH_UserArgs_MT256x128x64_MI16x16x1_SN_LDSB1_CLR1_GSU0_GSUC0_GSUWGMRR0_K1_LBSPPA4096_LBSPPB256_LPA0_MIWT8_4_PLR1_SU32_SUM0_SUS256_SKXCCM8_VWA4_VWB2_WGM8_WGMXCC1_WGMXCCGn1
    SolutionIndex: 62
    SolutionNameMin: Cijk_Ailk_Bljk_HSS_BH_UserArgs_MT256x128x64_MI16x16x1_SN_LDSB1_CLR1_GSU0_GSUC0_GSUWGMRR0_K1_LBSPPA4096_LBSPPB512_LPA0_MIWT8_4_PLR1_SU32_SUM0_SUS256_SKXCCM8_VWA4_VWB4_WGM8_WGMXCC1_WGMXCCGn1
    SolutionIndex: 63
    SolutionNameMin: Cijk_Ailk_Bljk_HSS_BH_UserArgs_MT128x128x64_MI16x16x1_SN_LDSB1_CLR1_GSU0_GSUC0_GSUWGMRR0_K1_LBSPPA2048_LBSPPB128_LPA0_MIWT4_4_PLR1_SU32_SUM0_SUS256_SKXCCM8_VWA4_VWB1_WGM1_WGMXCC1_WGMXCCGn1
    SolutionIndex: 64
    SolutionNameMin: Cijk_Ailk_Bljk_HSS_BH_UserArgs_MT128x128x64_MI16x16x1_SN_LDSB1_CLR1_GSU0_GSUC0_GSUWGMRR0_K1_LBSPPA2048_LBSPPB256_LPA32_MIWT4_4_PLR1_SU32_SUM0_SUS256_SKXCCM8_VWA2_VWB2_WGM1_WGMXCC1_WGMXCCGn1
    SolutionIndex: 65
    SolutionNameMin: Cijk_Ailk_Bljk_HSS_BH_UserArgs_MT128x128x64_MI16x16x1_SN_LDSB1_CLR1_GSU0_GSUC0_GSUWGMRR0_K1_LBSPPA2048_LBSPPB256_LPA0_MIWT4_4_PLR1_SU32_SUM0_SUS256_SKXCCM8_VWA4_VWB2_WGM1_WGMXCC1_WGMXCCGn1
    SolutionIndex: 66
    SolutionNameMin: Cijk_Ailk_Bljk_HSS_BH_UserArgs_MT128x128x64_MI16x16x1_SN_LDSB1_CLR1_GSU0_GSUC0_GSUWGMRR0_K1_LBSPPA2048_LBSPPB512_LPA0_MIWT4_4_PLR1_SU32_SUM0_SUS256_SKXCCM8_VWA4_VWB4_WGM1_WGMXCC1_WGMXCCGn1
    SolutionIndex: 67
    SolutionNameMin: Cijk_Ailk_Bljk_HSS_BH_UserArgs_MT128x128x64_MI16x16x1_SN_LDSB1_CLR1_GSU0_GSUC0_GSUWGMRR0_K1_LBSPPA2048_LBSPPB128_LPA0_MIWT4_4_PLR1_SU32_SUM0_SUS256_SKXCCM8_VWA4_VWB1_WGM4_WGMXCC1_WGMXCCGn1
    SolutionIndex: 68
    SolutionNameMin: Cijk_Ailk_Bljk_HSS_BH_UserArgs_MT128x128x64_MI16x16x1_SN_LDSB1_CLR1_GSU0_GSUC0_GSUWGMRR0_K1_LBSPPA2048_LBSPPB256_LPA0_MIWT4_4_PLR1_SU32_SUM0_SUS256_SKXCCM8_VWA4_VWB2_WGM4_WGMXCC1_WGMXCCGn1
    SolutionIndex: 69
    SolutionNameMin: Cijk_Ailk_Bljk_HSS_BH_UserArgs_MT128x128x64_MI16x16x1_SN_LDSB1_CLR1_GSU0_GSUC0_GSUWGMRR0_K1_LBSPPA2048_LBSPPB512_LPA0_MIWT4_4_PLR1_SU32_SUM0_SUS256_SKXCCM8_VWA4_VWB4_WGM4_WGMXCC1_WGMXCCGn1
    SolutionIndex: 70
    SolutionNameMin: Cijk_Ailk_Bljk_HSS_BH_UserArgs_MT128x128x64_MI16x16x1_SN_LDSB1_CLR1_GSU0_GSUC0_GSUWGMRR0_K1_LBSPPA2048_LBSPPB128_LPA0_MIWT4_4_PLR1_SU32_SUM0_SUS256_SKXCCM8_VWA4_VWB1_WGM8_WGMXCC1_WGMXCCGn1
    SolutionIndex: 71
    SolutionNameMin: Cijk_Ailk_Bljk_HSS_BH_UserArgs_MT128x128x64_MI16x16x1_SN_LDSB1_CLR1_GSU0_GSUC0_GSUWGMRR0_K1_LBSPPA2048_LBSPPB256_LPA0_MIWT4_4_PLR1_SU32_SUM0_SUS256_SKXCCM8_VWA4_VWB2_WGM8_WGMXCC1_WGMXCCGn1
    SolutionIndex: 72
    SolutionNameMin: Cijk_Ailk_Bljk_HSS_BH_UserArgs_MT128x128x64_MI16x16x1_SN_LDSB1_CLR1_GSU0_GSUC0_GSUWGMRR0_K1_LBSPPA2048_LBSPPB512_LPA0_MIWT4_4_PLR1_SU32_SUM0_SUS256_SKXCCM8_VWA4_VWB4_WGM8_WGMXCC1_WGMXCCGn1
    SolutionIndex: 73
    SolutionNameMin: Cijk_Ailk_Bljk_HSS_BH_UserArgs_MT64x128x64_MI16x16x1_SN_LDSB1_CLR1_GSU0_GSUC0_GSUWGMRR0_K1_LBSPPA1024_LBSPPB128_LPA32_MIWT2_4_PLR1_SU32_SUM0_SUS256_SKXCCM8_VWA2_VWB1_WGM1_WGMXCC1_WGMXCCGn1
    SolutionIndex: 74
    SolutionNameMin: Cijk_Ailk_Bljk_HSS_BH_UserArgs_MT64x128x64_MI16x16x1_SN_LDSB1_CLR1_GSU0_GSUC0_GSUWGMRR0_K1_LBSPPA1024_LBSPPB256_LPA32_MIWT2_4_PLR1_SU32_SUM0_SUS256_SKXCCM8_VWA2_VWB2_WGM1_WGMXCC1_WGMXCCGn1
    SolutionIndex: 75
    SolutionNameMin: Cijk_Ailk_Bljk_HSS_BH_UserArgs_MT64x128x64_MI16x16x1_SN_LDSB1_CLR1_GSU0_GSUC0_GSUWGMRR0_K1_LBSPPA1024_LBSPPB512_LPA32_MIWT2_4_PLR1_SU32_SUM0_SUS256_SKXCCM8_VWA2_VWB4_WGM1_WGMXCC1_WGMXCCGn1
    SolutionIndex: 76
    SolutionNameMin: Cijk_Ailk_Bljk_HSS_BH_UserArgs_MT64x128x64_MI16x16x1_SN_LDSB1_CLR1_GSU0_GSUC0_GSUWGMRR0_K1_LBSPPA1024_LBSPPB512_LPA32_MIWT2_4_PLR1_SU32_SUM0_SUS256_SKXCCM8_VWA2_VWB4_WGM8_WGMXCC1_WGMXCCGn1
    SolutionIndex: 77
    SolutionNameMin: Cijk_Ailk_Bljk_HSS_BH_UserArgs_MT128x64x64_MI16x16x1_SN_LDSB1_CLR1_GSU0_GSUC0_GSUWGMRR0_K1_LBSPPA2048_LBSPPB128_LPA0_MIWT4_2_PLR1_SU32_SUM0_SUS256_SKXCCM8_VWA4_VWB1_WGM1_WGMXCC1_WGMXCCGn1
    SolutionIndex: 78
    SolutionNameMin: Cijk_Ailk_Bljk_HSS_BH_UserArgs_MT128x64x64_MI16x16x1_SN_LDSB1_CLR1_GSU0_GSUC0_GSUWGMRR0_K1_LBSPPA2048_LBSPPB128_LPA0_MIWT4_2_PLR1_SU32_SUM0_SUS256_SKXCCM8_VWA4_VWB1_WGM8_WGMXCC1_WGMXCCGn1
    SolutionIndex: 79
    SolutionNameMin: Cijk_Ailk_Bljk_HSS_BH_UserArgs_MT128x64x64_MI16x16x1_SN_LDSB1_CLR1_GSU0_GSUC0_GSUWGMRR0_K1_LBSPPA2048_LBSPPB256_LPA0_MIWT4_2_PLR1_SU32_SUM0_SUS256_SKXCCM8_VWA4_VWB2_WGM8_WGMXCC1_WGMXCCGn1
    SolutionIndex: 80
    SolutionNameMin: Cijk_Ailk_Bljk_HSS_BH_UserArgs_MT64x64x64_MI16x16x1_SN_LDSB1_CLR1_GSU0_GSUC0_GSUWGMRR0_K1_LBSPPA1024_LBSPPB128_LPA32_MIWT2_2_PLR1_SU32_SUM0_SUS256_SKXCCM8_VWA2_VWB1_WGM1_WGMXCC1_WGMXCCGn1
    SolutionIndex: 81
    SolutionNameMin: Cijk_Ailk_Bljk_HSS_BH_UserArgs_MT64x64x64_MI16x16x1_SN_LDSB1_CLR1_GSU0_GSUC0_GSUWGMRR0_K1_LBSPPA1024_LBSPPB256_LPA32_MIWT2_2_PLR1_SU32_SUM0_SUS256_SKXCCM8_VWA2_VWB2_WGM1_WGMXCC1_WGMXCCGn1
    SolutionIndex: 82
    SolutionNameMin: Cijk_Ailk_Bljk_HSS_BH_UserArgs_MT64x64x64_MI16x16x1_SN_LDSB1_CLR1_GSU0_GSUC0_GSUWGMRR0_K1_LBSPPA1024_LBSPPB256_LPA32_MIWT2_2_PLR1_SU32_SUM0_SUS256_SKXCCM8_VWA2_VWB2_WGM4_WGMXCC1_WGMXCCGn1
    SolutionIndex: 83
    SolutionNameMin: Cijk_Ailk_Bljk_HSS_BH_UserArgs_MT64x64x64_MI16x16x1_SN_LDSB1_CLR1_GSU0_GSUC0_GSUWGMRR0_K1_LBSPPA1024_LBSPPB128_LPA32_MIWT2_2_PLR1_SU32_SUM0_SUS256_SKXCCM8_VWA2_VWB1_WGM8_WGMXCC1_WGMXCCGn1
    SolutionIndex: 84
    SolutionNameMin: Cijk_Ailk_Bljk_HSS_BH_UserArgs_MT64x32x64_MI16x16x1_SN_LDSB0_CLR1_GSU0_GSUC0_GSUWGMRR0_K1_LBSPPA1024_LBSPPB128_LPA32_MIWT2_1_PLR1_SU32_SUM0_SUS256_SKXCCM8_VWA2_VWB1_WGM4_WGMXCC1_WGMXCCGn1
    SolutionIndex: 85
    SolutionNameMin: Cijk_Ailk_Bljk_HSS_BH_UserArgs_MT32x32x64_MI16x16x1_SN_LDSB0_CLR1_GSU0_GSUC0_GSUWGMRR0_K1_LBSPPA512_LBSPPB128_LPA16_MIWT1_1_PLR1_SU32_SUM0_SUS256_SKXCCM8_VWA1_VWB1_WGM1_WGMXCC1_WGMXCCGn1
    SolutionIndex: 86
    SolutionNameMin: Cijk_Ailk_Bljk_HSS_BH_UserArgs_MT64x128x128_MI16x16x1_SN_LDSB1_CLR1_GSU0_GSUC0_GSUWGMRR0_K1_LBSPPA1024_LBSPPB512_LPA16_MIWT2_4_PLR2_SU32_SUM0_SUS256_SKXCCM8_VWA1_VWB2_WGM1_WGMXCC1_WGMXCCGn1
    SolutionIndex: 87
    SolutionNameMin: Cijk_Ailk_Bljk_HSS_BH_UserArgs_MT64x128x128_MI16x16x1_SN_LDSB1_CLR1_GSU0_GSUC0_GSUWGMRR0_K1_LBSPPA1024_LBSPPB256_LPA16_MIWT2_4_PLR2_SU32_SUM0_SUS256_SKXCCM8_VWA1_VWB1_WGM4_WGMXCC1_WGMXCCGn1
    SolutionIndex: 88
    SolutionNameMin: Cijk_Ailk_Bljk_HSS_BH_UserArgs_MT128x64x128_MI16x16x1_SN_LDSB1_CLR1_GSU0_GSUC0_GSUWGMRR0_K1_LBSPPA2048_LBSPPB512_LPA0_MIWT4_2_PLR1_SU32_SUM0_SUS256_SKXCCM8_VWA4_VWB2_WGM1_WGMXCC1_WGMXCCGn1
    SolutionIndex: 89
    SolutionNameMin: Cijk_Ailk_Bljk_HSS_BH_UserArgs_MT128x64x128_MI16x16x1_SN_LDSB1_CLR1_GSU0_GSUC0_GSUWGMRR0_K1_LBSPPA2048_LBSPPB256_LPA0_MIWT4_2_PLR2_SU32_SUM0_SUS256_SKXCCM8_VWA4_VWB1_WGM1_WGMXCC1_WGMXCCGn1
    SolutionIndex: 90
    SolutionNameMin: Cijk_Ailk_Bljk_HSS_BH_UserArgs_MT128x64x128_MI16x16x1_SN_LDSB1_CLR1_GSU0_GSUC0_GSUWGMRR0_K1_LBSPPA2048_LBSPPB512_LPA0_MIWT4_2_PLR2_SU32_SUM0_SUS256_SKXCCM8_VWA4_VWB2_WGM1_WGMXCC1_WGMXCCGn1
    SolutionIndex: 91
    SolutionNameMin: Cijk_Ailk_Bljk_HSS_BH_UserArgs_MT128x64x128_MI16x16x1_SN_LDSB1_CLR1_GSU0_GSUC0_GSUWGMRR0_K1_LBSPPA2048_LBSPPB256_LPA0_MIWT4_2_PLR1_SU32_SUM0_SUS256_SKXCCM8_VWA4_VWB1_WGM4_WGMXCC1_WGMXCCGn1
    SolutionIndex: 92
    SolutionNameMin: Cijk_Ailk_Bljk_HSS_BH_UserArgs_MT128x64x128_MI16x16x1_SN_LDSB1_CLR1_GSU0_GSUC0_GSUWGMRR0_K1_LBSPPA2048_LBSPPB256_LPA0_MIWT4_2_PLR1_SU32_SUM0_SUS256_SKXCCM8_VWA4_VWB1_WGM8_WGMXCC1_WGMXCCGn1
    SolutionIndex: 93
    SolutionNameMin: Cijk_Ailk_Bljk_HSS_BH_UserArgs_MT128x64x128_MI16x16x1_SN_LDSB1_CLR1_GSU0_GSUC0_GSUWGMRR0_K1_LBSPPA2048_LBSPPB512_LPA0_MIWT4_2_PLR1_SU32_SUM0_SUS256_SKXCCM8_VWA4_VWB2_WGM8_WGMXCC1_WGMXCCGn1
    SolutionIndex: 94
    SolutionNameMin: Cijk_Ailk_Bljk_HSS_BH_UserArgs_MT128x64x128_MI16x16x1_SN_LDSB1_CLR1_GSU0_GSUC0_GSUWGMRR0_K1_LBSPPA2048_LBSPPB256_LPA0_MIWT4_2_PLR2_SU32_SUM0_SUS256_SKXCCM8_VWA4_VWB1_WGM8_WGMXCC1_WGMXCCGn1
    SolutionIndex: 95
    SolutionNameMin: Cijk_Ailk_Bljk_HSS_BH_UserArgs_MT128x64x128_MI16x16x1_SN_LDSB1_CLR1_GSU0_GSUC0_GSUWGMRR0_K1_LBSPPA2048_LBSPPB512_LPA0_MIWT4_2_PLR2_SU32_SUM0_SUS256_SKXCCM8_VWA4_VWB2_WGM8_WGMXCC1_WGMXCCGn1
    SolutionIndex: 96
    SolutionNameMin: Cijk_Ailk_Bljk_HSS_BH_UserArgs_MT128x32x128_MI16x16x1_SN_LDSB1_CLR1_GSU0_GSUC0_GSUWGMRR0_K1_LBSPPA2048_LBSPPB256_LPA0_MIWT4_1_PLR2_SU32_SUM0_SUS256_SKXCCM8_VWA4_VWB1_WGM1_WGMXCC1_WGMXCCGn1
    SolutionIndex: 97
    SolutionNameMin: Cijk_Ailk_Bljk_HSS_BH_UserArgs_MT64x64x128_MI16x16x1_SN_LDSB1_CLR1_GSU0_GSUC0_GSUWGMRR0_K1_LBSPPA1024_LBSPPB256_LPA16_MIWT2_2_PLR2_SU32_SUM0_SUS256_SKXCCM8_VWA1_VWB1_WGM1_WGMXCC1_WGMXCCGn1
    SolutionIndex: 98
    SolutionNameMin: Cijk_Ailk_Bljk_HSS_BH_UserArgs_MT64x64x128_MI16x16x1_SN_LDSB1_CLR1_GSU0_GSUC0_GSUWGMRR0_K1_LBSPPA1024_LBSPPB256_LPA32_MIWT2_2_PLR2_SU32_SUM0_SUS256_SKXCCM8_VWA2_VWB1_WGM1_WGMXCC1_WGMXCCGn1
    SolutionIndex: 99
    SolutionNameMin: Cijk_Ailk_Bljk_HSS_BH_UserArgs_MT64x64x128_MI16x16x1_SN_LDSB1_CLR1_GSU0_GSUC0_GSUWGMRR0_K1_LBSPPA1024_LBSPPB512_LPA32_MIWT2_2_PLR2_SU32_SUM0_SUS256_SKXCCM8_VWA2_VWB2_WGM1_WGMXCC1_WGMXCCGn1
    SolutionIndex: 100
    SolutionNameMin: Cijk_Ailk_Bljk_HSS_BH_UserArgs_MT64x64x128_MI16x16x1_SN_LDSB1_CLR1_GSU0_GSUC0_GSUWGMRR0_K1_LBSPPA1024_LBSPPB256_LPA32_MIWT2_2_PLR2_SU32_SUM0_SUS256_SKXCCM8_VWA2_VWB1_WGM4_WGMXCC1_WGMXCCGn1
    SolutionIndex: 101
    SolutionNameMin: Cijk_Ailk_Bljk_HSS_BH_UserArgs_MT64x64x128_MI16x16x1_SN_LDSB1_CLR1_GSU0_GSUC0_GSUWGMRR0_K1_LBSPPA1024_LBSPPB512_LPA32_MIWT2_2_PLR2_SU32_SUM0_SUS256_SKXCCM8_VWA2_VWB2_WGM4_WGMXCC1_WGMXCCGn1
    SolutionIndex: 102
    SolutionNameMin: Cijk_Ailk_Bljk_HSS_BH_UserArgs_MT64x64x128_MI16x16x1_SN_LDSB1_CLR1_GSU0_GSUC0_GSUWGMRR0_K1_LBSPPA1024_LBSPPB256_LPA16_MIWT2_2_PLR2_SU32_SUM0_SUS256_SKXCCM8_VWA1_VWB1_WGM8_WGMXCC1_WGMXCCGn1
    SolutionIndex: 103
    SolutionNameMin: Cijk_Ailk_Bljk_HSS_BH_UserArgs_MT64x64x128_MI16x16x1_SN_LDSB1_CLR1_GSU0_GSUC0_GSUWGMRR0_K1_LBSPPA1024_LBSPPB256_LPA32_MIWT2_2_PLR2_SU32_SUM0_SUS256_SKXCCM8_VWA2_VWB1_WGM8_WGMXCC1_WGMXCCGn1
    SolutionIndex: 104
    SolutionNameMin: Cijk_Ailk_Bljk_HSS_BH_UserArgs_MT64x64x128_MI16x16x1_SN_LDSB1_CLR1_GSU0_GSUC0_GSUWGMRR0_K1_LBSPPA1024_LBSPPB512_LPA32_MIWT2_2_PLR2_SU32_SUM0_SUS256_SKXCCM8_VWA2_VWB2_WGM8_WGMXCC1_WGMXCCGn1
    SolutionIndex: 105
    SolutionNameMin: Cijk_Ailk_Bljk_HSS_BH_UserArgs_MT64x32x128_MI16x16x1_SN_LDSB1_CLR1_GSU0_GSUC0_GSUWGMRR0_K1_LBSPPA1024_LBSPPB256_LPA32_MIWT2_1_PLR2_SU32_SUM0_SUS256_SKXCCM8_VWA2_VWB1_WGM1_WGMXCC1_WGMXCCGn1
    SolutionIndex: 106
    SolutionNameMin: Cijk_Ailk_Bljk_HSS_BH_UserArgs_MT64x32x128_MI16x16x1_SN_LDSB1_CLR1_GSU0_GSUC0_GSUWGMRR0_K1_LBSPPA1024_LBSPPB256_LPA32_MIWT2_1_PLR2_SU32_SUM0_SUS256_SKXCCM8_VWA2_VWB1_WGM4_WGMXCC1_WGMXCCGn1
    SolutionIndex: 107
    SolutionNameMin: Cijk_Ailk_Bljk_HSS_BH_UserArgs_MT64x32x128_MI16x16x1_SN_LDSB1_CLR1_GSU0_GSUC0_GSUWGMRR0_K1_LBSPPA1024_LBSPPB256_LPA32_MIWT2_1_PLR2_SU32_SUM0_SUS256_SKXCCM8_VWA2_VWB1_WGM8_WGMXCC1_WGMXCCGn1
    SolutionIndex: 108
    SolutionNameMin: Cijk_Ailk_Bljk_HSS_BH_UserArgs_MT32x32x128_MI16x16x1_SN_LDSB1_CLR1_GSU0_GSUC0_GSUWGMRR0_K1_LBSPPA512_LBSPPB256_LPA16_MIWT1_1_PLR1_SU32_SUM0_SUS256_SKXCCM8_VWA1_VWB1_WGM1_WGMXCC1_WGMXCCGn1
    SolutionIndex: 109
    SolutionNameMin: Cijk_Ailk_Bljk_HSS_BH_UserArgs_MT32x32x128_MI16x16x1_SN_LDSB1_CLR1_GSU0_GSUC0_GSUWGMRR0_K1_LBSPPA512_LBSPPB256_LPA16_MIWT1_1_PLR2_SU32_SUM0_SUS256_SKXCCM8_VWA1_VWB1_WGM1_WGMXCC1_WGMXCCGn1
    SolutionIndex: 110
    SolutionNameMin: Cijk_Ailk_Bljk_HSS_BH_UserArgs_MT32x32x128_MI16x16x1_SN_LDSB1_CLR1_GSU0_GSUC0_GSUWGMRR0_K1_LBSPPA512_LBSPPB256_LPA16_MIWT1_1_PLR1_SU32_SUM0_SUS256_SKXCCM8_VWA1_VWB1_WGM4_WGMXCC1_WGMXCCGn1
    SolutionIndex: 111
    SolutionNameMin: Cijk_Ailk_Bljk_HSS_BH_UserArgs_MT32x32x128_MI16x16x1_SN_LDSB1_CLR1_GSU0_GSUC0_GSUWGMRR0_K1_LBSPPA512_LBSPPB256_LPA16_MIWT1_1_PLR1_SU32_SUM0_SUS256_SKXCCM8_VWA1_VWB1_WGM8_WGMXCC1_WGMXCCGn1
    SolutionIndex: 112
    SolutionNameMin: Cijk_Ailk_Bljk_HSS_BH_UserArgs_MT32x32x128_MI16x16x1_SN_LDSB1_CLR1_GSU0_GSUC0_GSUWGMRR0_K1_LBSPPA512_LBSPPB256_LPA16_MIWT1_1_PLR2_SU32_SUM0_SUS256_SKXCCM8_VWA1_VWB1_WGM8_WGMXCC1_WGMXCCGn1
    SolutionIndex: 113
    SolutionNameMin: Cijk_Ailk_Bljk_HSS_BH_UserArgs_MT32x32x32_MI16x16x1_SN_LDSB0_CLR1_GSU0_GSUC0_GSUWGMRR0_K1_LBSPPA256_LBSPPB128_LPA16_MIWT1_1_PLR1_SU32_SUM0_SUS256_SKXCCM8_VWA1_VWB1_WGM8_WGMXCC1_WGMXCCGn1
- - - [128, 128, 1, 128, 128, 128, 128, 128]
    - [40, 0.084]
  - - [128, 128, 1, 256, 128, 128, 128, 256]
    - [39, 0.106]
  - - [128, 128, 1, 512, 128, 128, 128, 512]
    - [39, 0.174]
  - - [128, 128, 1, 1024, 128, 128, 128, 1024]
    - [109, 0.25]
  - - [128, 128, 1, 2048, 128, 128, 128, 2048]
    - [108, 0.349]
  - - [128, 128, 1, 4096, 128, 128, 128, 4096]
    - [1, 0.524]
  - - [128, 128, 1, 8192, 128, 128, 128, 8192]
    - [17, 1.03]
  - - [128, 256, 1, 128, 128, 128, 128, 128]
    - [39, 0.168]
  - - [128, 256, 1, 256, 128, 128, 128, 256]
    - [39, 0.211]
  - - [128, 256, 1, 512, 128, 128, 128, 512]
    - [41, 0.337]
  - - [128, 256, 1, 1024, 128, 128, 128, 1024]
    - [108, 0.493]
  - - [128, 256, 1, 2048, 128, 128, 128, 2048]
    - [1, 0.794]
  - - [128, 256, 1, 4096, 128, 128, 128, 4096]
    - [17, 1.495]
  - - [128, 256, 1, 8192, 128, 128, 128, 8192]
    - [85, 2.713]
  - - [128, 512, 1, 128, 128, 128, 128, 128]
    - [40, 0.334]
  - - [128, 512, 1, 256, 128, 128, 128, 256]
    - [39, 0.406]
  - - [128, 512, 1, 512, 128, 128, 128, 512]
    - [108, 0.664]
  - - [128, 512, 1, 1024, 128, 128, 128, 1024]
    - [17, 1.032]
  - - [128, 512, 1, 2048, 128, 128, 128, 2048]
    - [17, 1.949]
  - - [128, 512, 1, 4096, 128, 128, 128, 4096]
    - [85, 3.391]
  - - [128, 512, 1, 8192, 128, 128, 128, 8192]
    - [109, 5.472]
  - - [128, 1024, 1, 128, 128, 128, 128, 128]
    - [39, 0.641]
  - - [128, 1024, 1, 256, 128, 128, 128, 256]
    - [40, 0.748]
  - - [128, 1024, 1, 512, 128, 128, 128, 512]
    - [109, 1.335]
  - - [128, 1024, 1, 1024, 128, 128, 128, 1024]
    - [108, 2.284]
  - - [128, 1024, 1, 2048, 128, 128, 128, 2048]
    - [108, 3.737]
  - - [128, 1024, 1, 4096, 128, 128, 128, 4096]
    - [38, 5.807]
  - - [128, 1024, 1, 8192, 128, 128, 128, 8192]
    - [105, 8.128]
  - - [128, 2048, 1, 128, 128, 128, 128, 128]
    - [40, 1.236]
  - - [128, 2048, 1, 256, 128, 128, 128, 256]
    - [40, 1.567]
  - - [128, 2048, 1, 512, 128, 128, 128, 512]
    - [39, 2.542]
  - - [128, 2048, 1, 1024, 128, 128, 128, 1024]
    - [108, 4.04]
  - - [128, 2048, 1, 2048, 128, 128, 128, 2048]
    - [38, 6.599]
  - - [128, 2048, 1, 4096, 128, 128, 128, 4096]
    - [105, 9.618]
  - - [128, 2048, 1, 8192, 128, 128, 128, 8192]
    - [82, 11.805]
  - - [128, 4096, 1, 128, 128, 128, 128, 128]
    - [105, 2.213]
  - - [128, 4096, 1, 256, 128, 128, 128, 256]
    - [37, 2.811]
  - - [128, 4096, 1, 512, 128, 128, 128, 512]
    - [38, 4.404]
  - - [128, 4096, 1, 1024, 128, 128, 128, 1024]
    - [105, 7.167]
  - - [128, 4096, 1, 2048, 128, 128, 128, 2048]
    - [105, 10.082]
  - - [128, 4096, 1, 4096, 128, 128, 128, 4096]
    - [15, 13.073]
  - - [128, 4096, 1, 8192, 128, 128, 128, 8192]
    - [20, 16.32]
  - - [128, 8192, 1, 128, 128, 128, 128, 128]
    - [29, 3.506]
  - - [128, 8192, 1, 256, 128, 128, 128, 256]
    - [29, 4.871]
  - - [128, 8192, 1, 512, 128, 128, 128, 512]
    - [97, 7.645]
  - - [128, 8192, 1, 1024, 128, 128, 128, 1024]
    - [98, 10.887]
  - - [128, 8192, 1, 2048, 128, 128, 128, 2048]
    - [90, 13.904]
  - - [128, 8192, 1, 4096, 128, 128, 128, 4096]
    - [15, 17.498]
  - - [128, 8192, 1, 8192, 128, 128, 128, 8192]
    - [12, 21.353]
  - - [256, 128, 1, 128, 256, 256, 256, 128]
    - [108, 0.161]
  - - [256, 128, 1, 256, 256, 256, 256, 256]
    - [39, 0.205]
  - - [256, 128, 1, 512, 256, 256, 256, 512]
    - [40, 0.35]
  - - [256, 128, 1, 1024, 256, 256, 256, 1024]
    - [111, 0.476]
  - - [256, 128, 1, 2048, 256, 256, 256, 2048]
    - [0, 0.791]
  - - [256, 128, 1, 4096, 256, 256, 256, 4096]
    - [17, 1.517]
  - - [256, 128, 1, 8192, 256, 256, 256, 8192]
    - [39, 2.557]
  - - [256, 256, 1, 128, 256, 256, 256, 128]
    - [39, 0.321]
  - - [256, 256, 1, 256, 256, 256, 256, 256]
    - [40, 0.4]
  - - [256, 256, 1, 512, 256, 256, 256, 512]
    - [108, 0.659]
  - - [256, 256, 1, 1024, 256, 256, 256, 1024]
    - [109, 1.051]
  - - [256, 256, 1, 2048, 256, 256, 256, 2048]
    - [39, 1.953]
  - - [256, 256, 1, 4096, 256, 256, 256, 4096]
    - [85, 3.375]
  - - [256, 256, 1, 8192, 256, 256, 256, 8192]
    - [110, 4.981]
  - - [256, 512, 1, 128, 256, 256, 256, 128]
    - [39, 0.627]
  - - [256, 512, 1, 256, 256, 256, 256, 256]
    - [109, 0.755]
  - - [256, 512, 1, 512, 256, 256, 256, 512]
    - [109, 1.321]
  - - [256, 512, 1, 1024, 256, 256, 256, 1024]
    - [108, 2.266]
  - - [256, 512, 1, 2048, 256, 256, 256, 2048]
    - [39, 3.811]
  - - [256, 512, 1, 4096, 256, 256, 256, 4096]
    - [108, 5.778]
  - - [256, 512, 1, 8192, 256, 256, 256, 8192]
    - [107, 7.722]
  - - [256, 1024, 1, 128, 256, 256, 256, 128]
    - [109, 1.209]
  - - [256, 1024, 1, 256, 256, 256, 256, 256]
    - [39, 1.526]
  - - [256, 1024, 1, 512, 256, 256, 256, 512]
    - [39, 2.525]
  - - [256, 1024, 1, 1024, 256, 256, 256, 1024]
    - [105, 4.094]
  - - [256, 1024, 1, 2048, 256, 256, 256, 2048]
    - [38, 6.567]
  - - [256, 1024, 1, 4096, 256, 256, 256, 4096]
    - [105, 9.608]
  - - [256, 1024, 1, 8192, 256, 256, 256, 8192]
    - [80, 11.937]
  - - [256, 2048, 1, 128, 256, 256, 256, 128]
    - [105, 2.204]
  - - [256, 2048, 1, 256, 256, 256, 256, 256]
    - [37, 2.83]
  - - [256, 2048, 1, 512, 256, 256, 256, 512]
    - [105, 4.617]
  - - [256, 2048, 1, 1024, 256, 256, 256, 1024]
    - [105, 7.173]
  - - [256, 2048, 1, 2048, 256, 256, 256, 2048]
    - [99, 10.138]
  - - [256, 2048, 1, 4096, 256, 256, 256, 4096]
    - [99, 13.187]
  - - [256, 2048, 1, 8192, 256, 256, 256, 8192]
    - [77, 15.564]
  - - [256, 4096, 1, 128, 256, 256, 256, 128]
    - [99, 3.596]
  - - [256, 4096, 1, 256, 256, 256, 256, 256]
    - [96, 4.778]
  - - [256, 4096, 1, 512, 256, 256, 256, 512]
    - [98, 7.639]
  - - [256, 4096, 1, 1024, 256, 256, 256, 1024]
    - [98, 11.116]
  - - [256, 4096, 1, 2048, 256, 256, 256, 2048]
    - [99, 14.427]
  - - [256, 4096, 1, 4096, 256, 256, 256, 4096]
    - [79, 17.704]
  - - [256, 4096, 1, 8192, 256, 256, 256, 8192]
    - [66, 21.21]
  - - [256, 8192, 1, 128, 256, 256, 256, 128]
    - [90, 5.162]
  - - [256, 8192, 1, 256, 256, 256, 256, 256]
    - [28, 7.419]
  - - [256, 8192, 1, 512, 256, 256, 256, 512]
    - [89, 10.731]
  - - [256, 8192, 1, 1024, 256, 256, 256, 1024]
    - [89, 14.272]
  - - [256, 8192, 1, 2048, 256, 256, 256, 2048]
    - [92, 17.63]
  - - [256, 8192, 1, 4096, 256, 256, 256, 4096]
    - [71, 22.692]
  - - [256, 8192, 1, 8192, 256, 256, 256, 8192]
    - [70, 25.735]
  - - [512, 128, 1, 128, 512, 512, 512, 128]
    - [40, 0.323]
  - - [512, 128, 1, 256, 512, 512, 512, 256]
    - [39, 0.408]
  - - [512, 128, 1, 512, 512, 512, 512, 512]
    - [109, 0.657]
  - - [512, 128, 1, 1024, 512, 512, 512, 1024]
    - [0, 1.057]
  - - [512, 128, 1, 2048, 512, 512, 512, 2048]
    - [17, 2.026]
  - - [512, 128, 1, 4096, 512, 512, 512, 4096]
    - [111, 3.175]
  - - [512, 128, 1, 8192, 512, 512, 512, 8192]
    - [112, 4.537]
  - - [512, 256, 1, 128, 512, 512, 512, 128]
    - [40, 0.647]
  - - [512, 256, 1, 256, 512, 512, 512, 256]
    - [40, 0.746]
  - - [512, 256, 1, 512, 512, 512, 512, 512]
    - [108, 1.334]
  - - [512, 256, 1, 1024, 512, 512, 512, 1024]
    - [108, 2.268]
  - - [512, 256, 1, 2048, 512, 512, 512, 2048]
    - [108, 3.829]
  - - [512, 256, 1, 4096, 512, 512, 512, 4096]
    - [106, 5.584]
  - - [512, 256, 1, 8192, 512, 512, 512, 8192]
    - [107, 7.393]
  - - [512, 512, 1, 128, 512, 512, 512, 128]
    - [109, 1.207]
  - - [512, 512, 1, 256, 512, 512, 512, 256]
    - [39, 1.557]
  - - [512, 512, 1, 512, 512, 512, 512, 512]
    - [40, 2.518]
  - - [512, 512, 1, 1024, 512, 512, 512, 1024]
    - [40, 4.056]
  - - [512, 512, 1, 2048, 512, 512, 512, 2048]
    - [105, 6.571]
  - - [512, 512, 1, 4096, 512, 512, 512, 4096]
    - [105, 8.489]
  - - [512, 512, 1, 8192, 512, 512, 512, 8192]
    - [80, 11.423]
  - - [512, 1024, 1, 128, 512, 512, 512, 128]
    - [105, 2.203]
  - - [512, 1024, 1, 256, 512, 512, 512, 256]
    - [106, 2.814]
  - - [512, 1024, 1, 512, 512, 512, 512, 512]
    - [105, 4.61]
  - - [512, 1024, 1, 1024, 512, 512, 512, 1024]
    - [105, 7.176]
  - - [512, 1024, 1, 2048, 512, 512, 512, 2048]
    - [105, 9.988]
  - - [512, 1024, 1, 4096, 512, 512, 512, 4096]
    - [80, 12.989]
  - - [512, 1024, 1, 8192, 512, 512, 512, 8192]
    - [77, 15.578]
  - - [512, 2048, 1, 128, 512, 512, 512, 128]
    - [34, 3.676]
  - - [512, 2048, 1, 256, 512, 512, 512, 256]
    - [31, 4.847]
  - - [512, 2048, 1, 512, 512, 512, 512, 512]
    - [98, 7.614]
  - - [512, 2048, 1, 1024, 512, 512, 512, 1024]
    - [99, 11.122]
  - - [512, 2048, 1, 2048, 512, 512, 512, 2048]
    - [99, 14.291]
  - - [512, 2048, 1, 4096, 512, 512, 512, 4096]
    - [75, 17.105]
  - - [512, 2048, 1, 8192, 512, 512, 512, 8192]
    - [66, 21.213]
  - - [512, 4096, 1, 128, 512, 512, 512, 128]
    - [28, 5.436]
  - - [512, 4096, 1, 256, 512, 512, 512, 256]
    - [24, 7.681]
  - - [512, 4096, 1, 512, 512, 512, 512, 512]
    - [88, 10.73]
  - - [512, 4096, 1, 1024, 512, 512, 512, 1024]
    - [90, 14.403]
  - - [512, 4096, 1, 2048, 512, 512, 512, 2048]
    - [90, 17.724]
  - - [512, 4096, 1, 4096, 512, 512, 512, 4096]
    - [70, 22.063]
  - - [512, 4096, 1, 8192, 512, 512, 512, 8192]
    - [59, 24.283]
  - - [512, 8192, 1, 128, 512, 512, 512, 128]
    - [28, 6.739]
  - - [512, 8192, 1, 256, 512, 512, 512, 256]
    - [28, 9.056]
  - - [512, 8192, 1, 512, 512, 512, 512, 512]
    - [89, 13.071]
  - - [512, 8192, 1, 1024, 512, 512, 512, 1024]
    - [89, 17.285]
  - - [512, 8192, 1, 2048, 512, 512, 512, 2048]
    - [72, 21.592]
  - - [512, 8192, 1, 4096, 512, 512, 512, 4096]
    - [4, 25.923]
  - - [512, 8192, 1, 8192, 512, 512, 512, 8192]
    - [6, 28.664]
  - - [1024, 128, 1, 128, 1024, 1024, 1024, 128]
    - [109, 0.608]
  - - [1024, 128, 1, 256, 1024, 1024, 1024, 256]
    - [39, 0.743]
  - - [1024, 128, 1, 512, 1024, 1024, 1024, 512]
    - [108, 1.32]
  - - [1024, 128, 1, 1024, 1024, 1024, 1024, 1024]
    - [39, 2.245]
  - - [1024, 128, 1, 2048, 1024, 1024, 1024, 2048]
    - [39, 3.532]
  - - [1024, 128, 1, 4096, 1024, 1024, 1024, 4096]
    - [84, 5.139]
  - - [1024, 128, 1, 8192, 1024, 1024, 1024, 8192]
    - [106, 6.931]
  - - [1024, 256, 1, 128, 1024, 1024, 1024, 128]
    - [108, 1.203]
  - - [1024, 256, 1, 256, 1024, 1024, 1024, 256]
    - [39, 1.565]
  - - [1024, 256, 1, 512, 1024, 1024, 1024, 512]
    - [109, 2.514]
  - - [1024, 256, 1, 1024, 1024, 1024, 1024, 1024]
    - [40, 3.949]
  - - [1024, 256, 1, 2048, 1024, 1024, 1024, 2048]
    - [106, 6.262]
  - - [1024, 256, 1, 4096, 1024, 1024, 1024, 4096]
    - [82, 8.276]
  - - [1024, 256, 1, 8192, 1024, 1024, 1024, 8192]
    - [99, 10.926]
  - - [1024, 512, 1, 128, 1024, 1024, 1024, 128]
    - [37, 2.186]
  - - [1024, 512, 1, 256, 1024, 1024, 1024, 256]
    - [37, 2.84]
  - - [1024, 512, 1, 512, 1024, 1024, 1024, 512]
    - [105, 4.562]
  - - [1024, 512, 1, 1024, 1024, 1024, 1024, 1024]
    - [105, 7.149]
  - - [1024, 512, 1, 2048, 1024, 1024, 1024, 2048]
    - [101, 9.804]
  - - [1024, 512, 1, 4096, 1024, 1024, 1024, 4096]
    - [81, 11.941]
  - - [1024, 512, 1, 8192, 1024, 1024, 1024, 8192]
    - [73, 15.386]
  - - [1024, 1024, 1, 128, 1024, 1024, 1024, 128]
    - [34, 3.631]
  - - [1024, 1024, 1, 256, 1024, 1024, 1024, 256]
    - [96, 4.741]
  - - [1024, 1024, 1, 512, 1024, 1024, 1024, 512]
    - [97, 7.433]
  - - [1024, 1024, 1, 1024, 1024, 1024, 1024, 1024]
    - [98, 11.001]
  - - [1024, 1024, 1, 2048, 1024, 1024, 1024, 2048]
    - [95, 13.252]
  - - [1024, 1024, 1, 4096, 1024, 1024, 1024, 4096]
    - [73, 16.745]
  - - [1024, 1024, 1, 8192, 1024, 1024, 1024, 8192]
    - [65, 20.934]
  - - [1024, 2048, 1, 128, 1024, 1024, 1024, 128]
    - [27, 5.488]
  - - [1024, 2048, 1, 256, 1024, 1024, 1024, 256]
    - [24, 7.756]
  - - [1024, 2048, 1, 512, 1024, 1024, 1024, 512]
    - [86, 10.671]
  - - [1024, 2048, 1, 1024, 1024, 1024, 1024, 1024]
    - [94, 13.985]
  - - [1024, 2048, 1, 2048, 1024, 1024, 1024, 2048]
    - [65, 16.97]
  - - [1024, 2048, 1, 4096, 1024, 1024, 1024, 4096]
    - [66, 22.734]
  - - [1024, 2048, 1, 8192, 1024, 1024, 1024, 8192]
    - [57, 24.062]
  - - [1024, 4096, 1, 128, 1024, 1024, 1024, 128]
    - [28, 7.014]
  - - [1024, 4096, 1, 256, 1024, 1024, 1024, 256]
    - [28, 9.046]
  - - [1024, 4096, 1, 512, 1024, 1024, 1024, 512]
    - [89, 13.114]
  - - [1024, 4096, 1, 1024, 1024, 1024, 1024, 1024]
    - [68, 16.812]
  - - [1024, 4096, 1, 2048, 1024, 1024, 1024, 2048]
    - [66, 22.173]
  - - [1024, 4096, 1, 4096, 1024, 1024, 1024, 4096]
    - [64, 25.844]
  - - [1024, 4096, 1, 8192, 1024, 1024, 1024, 8192]
    - [59, 27.889]
  - - [1024, 8192, 1, 128, 1024, 1024, 1024, 128]
    - [20, 6.858]
  - - [1024, 8192, 1, 256, 1024, 1024, 1024, 256]
    - [66, 10.384]
  - - [1024, 8192, 1, 512, 1024, 1024, 1024, 512]
    - [65, 15.397]
  - - [1024, 8192, 1, 1024, 1024, 1024, 1024, 1024]
    - [67, 20.617]
  - - [1024, 8192, 1, 2048, 1024, 1024, 1024, 2048]
    - [60, 24.974]
  - - [1024, 8192, 1, 4096, 1024, 1024, 1024, 4096]
    - [5, 27.137]
  - - [1024, 8192, 1, 8192, 1024, 1024, 1024, 8192]
    - [46, 30.211]
  - - [2048, 128, 1, 128, 2048, 2048, 2048, 128]
    - [109, 1.218]
  - - [2048, 128, 1, 256, 2048, 2048, 2048, 256]
    - [39, 1.566]
  - - [2048, 128, 1, 512, 2048, 2048, 2048, 512]
    - [108, 2.547]
  - - [2048, 128, 1, 1024, 2048, 2048, 2048, 1024]
    - [105, 4.07]
  - - [2048, 128, 1, 2048, 2048, 2048, 2048, 2048]
    - [107, 6.161]
  - - [2048, 128, 1, 4096, 2048, 2048, 2048, 4096]
    - [16, 8.213]
  - - [2048, 128, 1, 8192, 2048, 2048, 2048, 8192]
    - [104, 10.963]
  - - [2048, 256, 1, 128, 2048, 2048, 2048, 128]
    - [105, 2.216]
  - - [2048, 256, 1, 256, 2048, 2048, 2048, 256]
    - [36, 2.811]
  - - [2048, 256, 1, 512, 2048, 2048, 2048, 512]
    - [105, 4.482]
  - - [2048, 256, 1, 1024, 2048, 2048, 2048, 1024]
    - [106, 6.824]
  - - [2048, 256, 1, 2048, 2048, 2048, 2048, 2048]
    - [104, 9.633]
  - - [2048, 256, 1, 4096, 2048, 2048, 2048, 4096]
    - [83, 11.929]
  - - [2048, 256, 1, 8192, 2048, 2048, 2048, 8192]
    - [75, 15.276]
  - - [2048, 512, 1, 128, 2048, 2048, 2048, 128]
    - [32, 3.595]
  - - [2048, 512, 1, 256, 2048, 2048, 2048, 256]
    - [29, 4.845]
  - - [2048, 512, 1, 512, 2048, 2048, 2048, 512]
    - [97, 7.671]
  - - [2048, 512, 1, 1024, 2048, 2048, 2048, 1024]
    - [100, 10.758]
  - - [2048, 512, 1, 2048, 2048, 2048, 2048, 2048]
    - [93, 13.237]
  - - [2048, 512, 1, 4096, 2048, 2048, 2048, 4096]
    - [74, 16.57]
  - - [2048, 512, 1, 8192, 2048, 2048, 2048, 8192]
    - [66, 20.988]
  - - [2048, 1024, 1, 128, 2048, 2048, 2048, 128]
    - [27, 5.552]
  - - [2048, 1024, 1, 256, 2048, 2048, 2048, 256]
    - [24, 7.738]
  - - [2048, 1024, 1, 512, 2048, 2048, 2048, 512]
    - [88, 10.647]
  - - [2048, 1024, 1, 1024, 2048, 2048, 2048, 1024]
    - [94, 14.06]
  - - [2048, 1024, 1, 2048, 2048, 2048, 2048, 2048]
    - [65, 16.973]
  - - [2048, 1024, 1, 4096, 2048, 2048, 2048, 4096]
    - [63, 22.258]
  - - [2048, 1024, 1, 8192, 2048, 2048, 2048, 8192]
    - [65, 24.724]
  - - [2048, 2048, 1, 128, 2048, 2048, 2048, 128]
    - [27, 6.79]
  - - [2048, 2048, 1, 256, 2048, 2048, 2048, 256]
    - [26, 9.158]
  - - [2048, 2048, 1, 512, 2048, 2048, 2048, 512]
    - [90, 12.5]
  - - [2048, 2048, 1, 1024, 2048, 2048, 2048, 1024]
    - [72, 16.596]
  - - [2048, 2048, 1, 2048, 2048, 2048, 2048, 2048]
    - [65, 22.272]
  - - [2048, 2048, 1, 4096, 2048, 2048, 2048, 4096]
    - [65, 27.017]
  - - [2048, 2048, 1, 8192, 2048, 2048, 2048, 8192]
    - [55, 26.893]
  - - [2048, 4096, 1, 128, 2048, 2048, 2048, 128]
    - [20, 6.577]
  - - [2048, 4096, 1, 256, 2048, 2048, 2048, 256]
    - [25, 10.339]
  - - [2048, 4096, 1, 512, 2048, 2048, 2048, 512]
    - [70, 15.297]
  - - [2048, 4096, 1, 1024, 2048, 2048, 2048, 1024]
    - [69, 20.523]
  - - [2048, 4096, 1, 2048, 2048, 2048, 2048, 2048]
    - [68, 25.054]
  - - [2048, 4096, 1, 4096, 2048, 2048, 2048, 4096]
    - [43, 27.219]
  - - [2048, 4096, 1, 8192, 2048, 2048, 2048, 8192]
    - [48, 30.715]
  - - [2048, 8192, 1, 128, 2048, 2048, 2048, 128]
    - [20, 7.551]
  - - [2048, 8192, 1, 256, 2048, 2048, 2048, 256]
    - [88, 12.092]
  - - [2048, 8192, 1, 512, 2048, 2048, 2048, 512]
    - [63, 17.235]
  - - [2048, 8192, 1, 1024, 2048, 2048, 2048, 1024]
    - [67, 22.345]
  - - [2048, 8192, 1, 2048, 2048, 2048, 2048, 2048]
    - [54, 26.69]
  - - [2048, 8192, 1, 4096, 2048, 2048, 2048, 4096]
    - [68, 29.462]
  - - [2048, 8192, 1, 8192, 2048, 2048, 2048, 8192]
    - [42, 31.947]
  - - [4096, 128, 1, 128, 4096, 4096, 4096, 128]
    - [35, 2.165]
  - - [4096, 128, 1, 256, 4096, 4096, 4096, 256]
    - [105, 2.913]
  - - [4096, 128, 1, 512, 4096, 4096, 4096, 512]
    - [105, 4.613]
  - - [4096, 128, 1, 1024, 4096, 4096, 4096, 1024]
    - [106, 6.931]
  - - [4096, 128, 1, 2048, 4096, 4096, 4096, 2048]
    - [104, 9.568]
  - - [4096, 128, 1, 4096, 4096, 4096, 4096, 4096]
    - [13, 12.11]
  - - [4096, 128, 1, 8192, 4096, 4096, 4096, 8192]
    - [14, 15.475]
  - - [4096, 256, 1, 128, 4096, 4096, 4096, 128]
    - [33, 3.637]
  - - [4096, 256, 1, 256, 4096, 4096, 4096, 256]
    - [30, 4.814]
  - - [4096, 256, 1, 512, 4096, 4096, 4096, 512]
    - [98, 7.538]
  - - [4096, 256, 1, 1024, 4096, 4096, 4096, 1024]
    - [103, 10.707]
  - - [4096, 256, 1, 2048, 4096, 4096, 4096, 2048]
    - [101, 13.138]
  - - [4096, 256, 1, 4096, 4096, 4096, 4096, 4096]
    - [75, 16.403]
  - - [4096, 256, 1, 8192, 4096, 4096, 4096, 8192]
    - [70, 21.098]
  - - [4096, 512, 1, 128, 4096, 4096, 4096, 128]
    - [28, 5.472]
  - - [4096, 512, 1, 256, 4096, 4096, 4096, 256]
    - [24, 7.704]
  - - [4096, 512, 1, 512, 4096, 4096, 4096, 512]
    - [91, 10.508]
  - - [4096, 512, 1, 1024, 4096, 4096, 4096, 1024]
    - [94, 14.064]
  - - [4096, 512, 1, 2048, 4096, 4096, 4096, 2048]
    - [67, 16.83]
  - - [4096, 512, 1, 4096, 4096, 4096, 4096, 4096]
    - [65, 21.86]
  - - [4096, 512, 1, 8192, 4096, 4096, 4096, 8192]
    - [66, 25.202]
  - - [4096, 1024, 1, 128, 4096, 4096, 4096, 128]
    - [26, 6.028]
  - - [4096, 1024, 1, 256, 4096, 4096, 4096, 256]
    - [24, 9.101]
  - - [4096, 1024, 1, 512, 4096, 4096, 4096, 512]
    - [78, 12.583]
  - - [4096, 1024, 1, 1024, 4096, 4096, 4096, 1024]
    - [67, 16.892]
  - - [4096, 1024, 1, 2048, 4096, 4096, 4096, 2048]
    - [66, 21.46]
  - - [4096, 1024, 1, 4096, 4096, 4096, 4096, 4096]
    - [53, 25.69]
  - - [4096, 1024, 1, 8192, 4096, 4096, 4096, 8192]
    - [58, 27.349]
  - - [4096, 2048, 1, 128, 4096, 4096, 4096, 128]
    - [22, 6.599]
  - - [4096, 2048, 1, 256, 4096, 4096, 4096, 256]
    - [24, 10.356]
  - - [4096, 2048, 1, 512, 4096, 4096, 4096, 512]
    - [70, 15.216]
  - - [4096, 2048, 1, 1024, 4096, 4096, 4096, 1024]
    - [69, 20.562]
  - - [4096, 2048, 1, 2048, 4096, 4096, 4096, 2048]
    - [51, 25.381]
  - - [4096, 2048, 1, 4096, 4096, 4096, 4096, 4096]
    - [52, 28.11]
  - - [4096, 2048, 1, 8192, 4096, 4096, 4096, 8192]
    - [44, 30.914]
  - - [4096, 4096, 1, 128, 4096, 4096, 4096, 128]
    - [23, 7.424]
  - - [4096, 4096, 1, 256, 4096, 4096, 4096, 256]
    - [20, 11.983]
  - - [4096, 4096, 1, 512, 4096, 4096, 4096, 512]
    - [70, 17.199]
  - - [4096, 4096, 1, 1024, 4096, 4096, 4096, 1024]
    - [72, 23.438]
  - - [4096, 4096, 1, 2048, 4096, 4096, 4096, 2048]
    - [61, 26.665]
  - - [4096, 4096, 1, 4096, 4096, 4096, 4096, 4096]
    - [54, 29.514]
  - - [4096, 4096, 1, 8192, 4096, 4096, 4096, 8192]
    - [45, 32.201]
  - - [4096, 8192, 1, 128, 4096, 4096, 4096, 128]
    - [8, 8.117]
  - - [4096, 8192, 1, 256, 4096, 4096, 4096, 256]
    - [70, 12.232]
  - - [4096, 8192, 1, 512, 4096, 4096, 4096, 512]
    - [68, 17.437]
  - - [4096, 8192, 1, 1024, 4096, 4096, 4096, 1024]
    - [67, 22.449]
  - - [4096, 8192, 1, 2048, 4096, 4096, 4096, 2048]
    - [56, 27.326]
  - - [4096, 8192, 1, 4096, 4096, 4096, 4096, 4096]
    - [44, 32.671]
  - - [4096, 8192, 1, 8192, 4096, 4096, 4096, 8192]
    - [45, 35.775]
  - - [8192, 128, 1, 128, 8192, 8192, 8192, 128]
    - [102, 3.498]
  - - [8192, 128, 1, 256, 8192, 8192, 8192, 256]
    - [29, 4.782]
  - - [8192, 128, 1, 512, 8192, 8192, 8192, 512]
    - [102, 7.478]
  - - [8192, 128, 1, 1024, 8192, 8192, 8192, 1024]
    - [103, 10.528]
  - - [8192, 128, 1, 2048, 8192, 8192, 8192, 2048]
    - [104, 13.119]
  - - [8192, 128, 1, 4096, 8192, 8192, 8192, 4096]
    - [13, 16.646]
  - - [8192, 128, 1, 8192, 8192, 8192, 8192, 8192]
    - [7, 21.116]
  - - [8192, 256, 1, 128, 8192, 8192, 8192, 128]
    - [26, 5.311]
  - - [8192, 256, 1, 256, 8192, 8192, 8192, 256]
    - [19, 7.424]
  - - [8192, 256, 1, 512, 8192, 8192, 8192, 512]
    - [87, 10.371]
  - - [8192, 256, 1, 1024, 8192, 8192, 8192, 1024]
    - [78, 13.782]
  - - [8192, 256, 1, 2048, 8192, 8192, 8192, 2048]
    - [76, 17.16]
  - - [8192, 256, 1, 4096, 8192, 8192, 8192, 4096]
    - [65, 22.109]
  - - [8192, 256, 1, 8192, 8192, 8192, 8192, 8192]
    - [11, 24.965]
  - - [8192, 512, 1, 128, 8192, 8192, 8192, 128]
    - [93, 6.053]
  - - [8192, 512, 1, 256, 8192, 8192, 8192, 256]
    - [21, 8.986]
  - - [8192, 512, 1, 512, 8192, 8192, 8192, 512]
    - [92, 12.514]
  - - [8192, 512, 1, 1024, 8192, 8192, 8192, 1024]
    - [67, 16.819]
  - - [8192, 512, 1, 2048, 8192, 8192, 8192, 2048]
    - [63, 21.458]
  - - [8192, 512, 1, 4096, 8192, 8192, 8192, 4096]
    - [2, 25.891]
  - - [8192, 512, 1, 8192, 8192, 8192, 8192, 8192]
    - [3, 27.615]
  - - [8192, 1024, 1, 128, 8192, 8192, 8192, 128]
    - [23, 6.821]
  - - [8192, 1024, 1, 256, 8192, 8192, 8192, 256]
    - [18, 10.035]
  - - [8192, 1024, 1, 512, 8192, 8192, 8192, 512]
    - [69, 14.91]
  - - [8192, 1024, 1, 1024, 8192, 8192, 8192, 1024]
    - [69, 20.684]
  - - [8192, 1024, 1, 2048, 8192, 8192, 8192, 2048]
    - [51, 25.551]
  - - [8192, 1024, 1, 4096, 8192, 8192, 8192, 4096]
    - [51, 28.198]
  - - [8192, 1024, 1, 8192, 8192, 8192, 8192, 8192]
    - [45, 30.254]
  - - [8192, 2048, 1, 128, 8192, 8192, 8192, 128]
    - [21, 7.641]
  - - [8192, 2048, 1, 256, 8192, 8192, 8192, 256]
    - [18, 11.728]
  - - [8192, 2048, 1, 512, 8192, 8192, 8192, 512]
    - [62, 16.864]
  - - [8192, 2048, 1, 1024, 8192, 8192, 8192, 1024]
    - [69, 22.341]
  - - [8192, 2048, 1, 2048, 8192, 8192, 8192, 2048]
    - [54, 26.573]
  - - [8192, 2048, 1, 4096, 8192, 8192, 8192, 4096]
    - [44, 30.014]
  - - [8192, 2048, 1, 8192, 8192, 8192, 8192, 8192]
    - [45, 32.956]
  - - [8192, 4096, 1, 128, 8192, 8192, 8192, 128]
    - [8, 8.418]
  - - [8192, 4096, 1, 256, 8192, 8192, 8192, 256]
    - [72, 12.725]
  - - [8192, 4096, 1, 512, 8192, 8192, 8192, 512]
    - [72, 17.942]
  - - [8192, 4096, 1, 1024, 8192, 8192, 8192, 1024]
    - [69, 22.723]
  - - [8192, 4096, 1, 2048, 8192, 8192, 8192, 2048]
    - [45, 27.47]
  - - [8192, 4096, 1, 4096, 8192, 8192, 8192, 4096]
    - [43, 32.653]
  - - [8192, 4096, 1, 8192, 8192, 8192, 8192, 8192]
    - [45, 35.481]
  - - [8192, 8192, 1, 128, 8192, 8192, 8192, 128]
    - [10, 7.177]
  - - [8192, 8192, 1, 256, 8192, 8192, 8192, 256]
    - [9, 11.95]
  - - [8192, 8192, 1, 512, 8192, 8192, 8192, 512]
    - [50, 17.273]
  - - [8192, 8192, 1, 1024, 8192, 8192, 8192, 1024]
    - [58, 23.797]
  - - [8192, 8192, 1, 2048, 8192, 8192, 8192, 2048]
    - [47, 30.742]
  - - [8192, 8192, 1, 4096, 8192, 8192, 8192, 4096]
    - [46, 35.155]
  - - [8192, 8192, 1, 8192, 8192, 8192, 8192, 8192]
    - [49, 37.547]
  - - [1, 1, 1, 32, 1, 1, 1, 32]
    - [113, 0.0]
- null
- null
- DeviceEfficiency
- GridBased
