library/src/amd_detail/rocblaslt/src/Tensile/Logic/streamk/gfx942/aquavanjaram942_Cijk_Ailk_Bjlk_HHS_BH_UserArgs.yaml
- {MinimumRequiredVersion: 4.33.0}
- aquavanjaram942
- gfx942
- [Device 0049, Device 0050]
    SolutionIndex: 0
    SolutionNameMin: Cijk_Ailk_Bjlk_HHS_BH_UserArgs_MT256x256x32_MI16x16x1_SN_LDSB0_CLR1_GSU0_GSUC0_GSUWGMRR0_K1_LBSPPA2048_LBSPPB2048_LPA0_LPB0_MIWT8_8_PLR1_SU32_SUM0_SUS256_SKXCCM0_VWA4_VWB8_WGM1_WGMXCC1_WGMXCCGn1
    SolutionIndex: 1
    SolutionNameMin: Cijk_Ailk_Bjlk_HHS_BH_UserArgs_MT128x256x32_MI16x16x1_SN_LDSB1_CLR1_GSU0_GSUC0_GSUWGMRR0_K1_LBSPPA1024_LBSPPB2048_LPA0_LPB0_MIWT4_8_PLR1_SU32_SUM0_SUS256_SKXCCM0_VWA4_VWB4_WGM4_WGMXCC1_WGMXCCGn1
    SolutionIndex: 2
    SolutionNameMin: Cijk_Ailk_Bjlk_HHS_BH_UserArgs_MT256x128x32_MI16x16x1_SN_LDSB1_CLR1_GSU0_GSUC0_GSUWGMRR0_K1_LBSPPA2048_LBSPPB1024_LPA0_LPB0_MIWT8_4_PLR1_SU32_SUM0_SUS256_SKXCCM0_VWA4_VWB4_WGM8_WGMXCC1_WGMXCCGn1
    SolutionIndex: 3
    SolutionNameMin: Cijk_Ailk_Bjlk_HHS_BH_UserArgs_MT64x128x32_MI16x16x1_SN_LDSB0_CLR1_GSU0_GSUC0_GSUWGMRR0_K1_LBSPPA512_LBSPPB1024_LPA32_LPB0_MIWT2_4_PLR1_SU32_SUM0_SUS256_SKXCCM0_VWA2_VWB4_WGM1_WGMXCC1_WGMXCCGn1
    SolutionIndex: 4
    SolutionNameMin: Cijk_Ailk_Bjlk_HHS_BH_UserArgs_MT32x32x32_MI16x16x1_SN_LDSB0_CLR1_GSU0_GSUC0_GSUWGMRR0_K1_LBSPPA256_LBSPPB256_LPA16_LPB16_MIWT1_1_PLR1_SU32_SUM0_SUS256_SKXCCM0_VWA1_VWB1_WGM1_WGMXCC1_WGMXCCGn1
    SolutionIndex: 5
    SolutionNameMin: Cijk_Ailk_Bjlk_HHS_BH_UserArgs_MT256x256x64_MI16x16x1_SN_LDSB1_CLR1_GSU0_GSUC0_GSUWGMRR0_K1_LBSPPA2048_LBSPPB2048_LPA0_LPB0_MIWT8_8_PLR2_SU32_SUM0_SUS256_SKXCCM0_VWA4_VWB8_WGM4_WGMXCC1_WGMXCCGn1
    SolutionIndex: 6
    SolutionNameMin: Cijk_Ailk_Bjlk_HHS_BH_UserArgs_MT128x256x64_MI16x16x1_SN_LDSB1_CLR1_GSU0_GSUC0_GSUWGMRR0_K1_LBSPPA1024_LBSPPB2048_LPA0_LPB0_MIWT4_8_PLR2_SU32_SUM0_SUS256_SKXCCM0_VWA4_VWB8_WGM1_WGMXCC1_WGMXCCGn1
    SolutionIndex: 7
    SolutionNameMin: Cijk_Ailk_Bjlk_HHS_BH_UserArgs_MT256x128x64_MI16x16x1_SN_LDSB1_CLR1_GSU0_GSUC0_GSUWGMRR0_K1_LBSPPA2048_LBSPPB1024_LPA0_LPB32_MIWT8_4_PLR2_SU32_SUM0_SUS256_SKXCCM0_VWA4_VWB2_WGM1_WGMXCC1_WGMXCCGn1
    SolutionIndex: 8
    SolutionNameMin: Cijk_Ailk_Bjlk_HHS_BH_UserArgs_MT128x128x64_MI16x16x1_SN_LDSB1_CLR1_GSU0_GSUC0_GSUWGMRR0_K1_LBSPPA1024_LBSPPB1024_LPA0_LPB0_MIWT4_4_PLR1_SU32_SUM0_SUS256_SKXCCM0_VWA4_VWB4_WGM1_WGMXCC1_WGMXCCGn1
    SolutionIndex: 9
    SolutionNameMin: Cijk_Ailk_Bjlk_HHS_BH_UserArgs_MT128x128x64_MI16x16x1_SN_LDSB1_CLR1_GSU0_GSUC0_GSUWGMRR0_K1_LBSPPA1024_LBSPPB1024_LPA0_LPB0_MIWT4_4_PLR1_SU32_SUM0_SUS256_SKXCCM0_VWA4_VWB4_WGM4_WGMXCC1_WGMXCCGn1
    SolutionIndex: 10
    SolutionNameMin: Cijk_Ailk_Bjlk_HHS_BH_UserArgs_MT64x128x64_MI16x16x1_SN_LDSB1_CLR1_GSU0_GSUC0_GSUWGMRR0_K1_LBSPPA512_LBSPPB1024_LPA32_LPB0_MIWT2_4_PLR1_SU32_SUM0_SUS256_SKXCCM0_VWA2_VWB4_WGM1_WGMXCC1_WGMXCCGn1
    SolutionIndex: 11
    SolutionNameMin: Cijk_Ailk_Bjlk_HHS_BH_UserArgs_MT64x128x64_MI16x16x1_SN_LDSB1_CLR1_GSU0_GSUC0_GSUWGMRR0_K1_LBSPPA512_LBSPPB1024_LPA32_LPB0_MIWT2_4_PLR2_SU32_SUM0_SUS256_SKXCCM0_VWA2_VWB4_WGM1_WGMXCC1_WGMXCCGn1
    SolutionIndex: 12
    SolutionNameMin: Cijk_Ailk_Bjlk_HHS_BH_UserArgs_MT64x128x64_MI16x16x1_SN_LDSB1_CLR1_GSU0_GSUC0_GSUWGMRR0_K1_LBSPPA512_LBSPPB1024_LPA32_LPB0_MIWT2_4_PLR2_SU32_SUM0_SUS256_SKXCCM0_VWA2_VWB4_WGM4_WGMXCC1_WGMXCCGn1
    SolutionIndex: 13
    SolutionNameMin: Cijk_Ailk_Bjlk_HHS_BH_UserArgs_MT128x64x64_MI16x16x1_SN_LDSB1_CLR1_GSU0_GSUC0_GSUWGMRR0_K1_LBSPPA1024_LBSPPB512_LPA0_LPB32_MIWT4_2_PLR2_SU32_SUM0_SUS256_SKXCCM0_VWA4_VWB2_WGM1_WGMXCC1_WGMXCCGn1
    SolutionIndex: 14
    SolutionNameMin: Cijk_Ailk_Bjlk_HHS_BH_UserArgs_MT64x64x64_MI16x16x1_SN_LDSB1_CLR1_GSU0_GSUC0_GSUWGMRR0_K1_LBSPPA512_LBSPPB512_LPA32_LPB32_MIWT2_2_PLR2_SU32_SUM0_SUS256_SKXCCM0_VWA2_VWB2_WGM1_WGMXCC1_WGMXCCGn1
    SolutionIndex: 15
    SolutionNameMin: Cijk_Ailk_Bjlk_HHS_BH_UserArgs_MT64x64x64_MI16x16x1_SN_LDSB1_CLR1_GSU0_GSUC0_GSUWGMRR0_K1_LBSPPA512_LBSPPB512_LPA32_LPB32_MIWT2_2_PLR1_SU32_SUM0_SUS256_SKXCCM0_VWA2_VWB2_WGM8_WGMXCC1_WGMXCCGn1
    SolutionIndex: 16
    SolutionNameMin: Cijk_Ailk_Bjlk_HHS_BH_UserArgs_MT32x64x64_MI16x16x1_SN_LDSB0_CLR1_GSU0_GSUC0_GSUWGMRR0_K1_LBSPPA256_LBSPPB512_LPA16_LPB32_MIWT1_2_PLR1_SU32_SUM0_SUS256_SKXCCM0_VWA1_VWB2_WGM1_WGMXCC1_WGMXCCGn1
    SolutionIndex: 17
    SolutionNameMin: Cijk_Ailk_Bjlk_HHS_BH_UserArgs_MT64x32x64_MI16x16x1_SN_LDSB0_CLR1_GSU0_GSUC0_GSUWGMRR0_K1_LBSPPA512_LBSPPB256_LPA32_LPB16_MIWT2_1_PLR2_SU32_SUM0_SUS256_SKXCCM0_VWA2_VWB1_WGM8_WGMXCC1_WGMXCCGn1
    SolutionIndex: 18
    SolutionNameMin: Cijk_Ailk_Bjlk_HHS_BH_UserArgs_MT32x32x64_MI16x16x1_SN_LDSB0_CLR1_GSU0_GSUC0_GSUWGMRR0_K1_LBSPPA256_LBSPPB256_LPA16_LPB16_MIWT1_1_PLR1_SU32_SUM0_SUS256_SKXCCM0_VWA1_VWB1_WGM1_WGMXCC1_WGMXCCGn1
    SolutionIndex: 19
    SolutionNameMin: Cijk_Ailk_Bjlk_HHS_BH_UserArgs_MT32x32x64_MI16x16x1_SN_LDSB0_CLR1_GSU0_GSUC0_GSUWGMRR0_K1_LBSPPA256_LBSPPB256_LPA16_LPB16_MIWT1_1_PLR2_SU32_SUM0_SUS256_SKXCCM0_VWA1_VWB1_WGM1_WGMXCC1_WGMXCCGn1
    SolutionIndex: 20
    SolutionNameMin: Cijk_Ailk_Bjlk_HHS_BH_UserArgs_MT128x128x128_MI16x16x1_SN_LDSB1_CLR1_GSU0_GSUC0_GSUWGMRR0_K1_LBSPPA1024_LBSPPB1024_LPA0_LPB0_MIWT4_4_PLR1_SU32_SUM0_SUS256_SKXCCM0_VWA4_VWB4_WGM1_WGMXCC1_WGMXCCGn1
    SolutionIndex: 21
    SolutionNameMin: Cijk_Ailk_Bjlk_HHS_BH_UserArgs_MT128x128x128_MI16x16x1_SN_LDSB1_CLR1_GSU0_GSUC0_GSUWGMRR0_K1_LBSPPA1024_LBSPPB1024_LPA0_LPB0_MIWT4_4_PLR2_SU32_SUM0_SUS256_SKXCCM0_VWA4_VWB4_WGM1_WGMXCC1_WGMXCCGn1
    SolutionIndex: 22
    SolutionNameMin: Cijk_Ailk_Bjlk_HHS_BH_UserArgs_MT128x128x128_MI16x16x1_SN_LDSB1_CLR1_GSU0_GSUC0_GSUWGMRR0_K1_LBSPPA1024_LBSPPB1024_LPA0_LPB0_MIWT4_4_PLR1_SU32_SUM0_SUS256_SKXCCM0_VWA4_VWB4_WGM4_WGMXCC1_WGMXCCGn1
    SolutionIndex: 23
    SolutionNameMin: Cijk_Ailk_Bjlk_HHS_BH_UserArgs_MT128x128x128_MI16x16x1_SN_LDSB1_CLR1_GSU0_GSUC0_GSUWGMRR0_K1_LBSPPA1024_LBSPPB1024_LPA0_LPB0_MIWT4_4_PLR1_SU32_SUM0_SUS256_SKXCCM0_VWA4_VWB4_WGM8_WGMXCC1_WGMXCCGn1
    SolutionIndex: 24
    SolutionNameMin: Cijk_Ailk_Bjlk_HHS_BH_UserArgs_MT128x128x128_MI16x16x1_SN_LDSB1_CLR1_GSU0_GSUC0_GSUWGMRR0_K1_LBSPPA1024_LBSPPB1024_LPA0_LPB0_MIWT4_4_PLR2_SU32_SUM0_SUS256_SKXCCM0_VWA4_VWB4_WGM8_WGMXCC1_WGMXCCGn1
    SolutionIndex: 25
    SolutionNameMin: Cijk_Ailk_Bjlk_HHS_BH_UserArgs_MT64x128x128_MI16x16x1_SN_LDSB1_CLR1_GSU0_GSUC0_GSUWGMRR0_K1_LBSPPA512_LBSPPB1024_LPA32_LPB32_MIWT2_4_PLR1_SU32_SUM0_SUS256_SKXCCM0_VWA2_VWB2_WGM8_WGMXCC1_WGMXCCGn1
    SolutionIndex: 26
    SolutionNameMin: Cijk_Ailk_Bjlk_HHS_BH_UserArgs_MT128x64x128_MI16x16x1_SN_LDSB1_CLR1_GSU0_GSUC0_GSUWGMRR0_K1_LBSPPA1024_LBSPPB512_LPA0_LPB16_MIWT4_2_PLR1_SU32_SUM0_SUS256_SKXCCM0_VWA4_VWB1_WGM4_WGMXCC1_WGMXCCGn1
    SolutionIndex: 27
    SolutionNameMin: Cijk_Ailk_Bjlk_HHS_BH_UserArgs_MT128x64x128_MI16x16x1_SN_LDSB1_CLR1_GSU0_GSUC0_GSUWGMRR0_K1_LBSPPA1024_LBSPPB512_LPA0_LPB32_MIWT4_2_PLR1_SU32_SUM0_SUS256_SKXCCM0_VWA4_VWB2_WGM4_WGMXCC1_WGMXCCGn1
    SolutionIndex: 28
    SolutionNameMin: Cijk_Ailk_Bjlk_HHS_BH_UserArgs_MT128x64x128_MI16x16x1_SN_LDSB1_CLR1_GSU0_GSUC0_GSUWGMRR0_K1_LBSPPA1024_LBSPPB512_LPA32_LPB16_MIWT4_2_PLR2_SU32_SUM0_SUS256_SKXCCM0_VWA2_VWB1_WGM4_WGMXCC1_WGMXCCGn1
    SolutionIndex: 29
    SolutionNameMin: Cijk_Ailk_Bjlk_HHS_BH_UserArgs_MT128x64x128_MI16x16x1_SN_LDSB1_CLR1_GSU0_GSUC0_GSUWGMRR0_K1_LBSPPA1024_LBSPPB512_LPA0_LPB32_MIWT4_2_PLR1_SU32_SUM0_SUS256_SKXCCM0_VWA4_VWB2_WGM8_WGMXCC1_WGMXCCGn1
    SolutionIndex: 30
    SolutionNameMin: Cijk_Ailk_Bjlk_HHS_BH_UserArgs_MT128x64x128_MI16x16x1_SN_LDSB1_CLR1_GSU0_GSUC0_GSUWGMRR0_K1_LBSPPA1024_LBSPPB512_LPA32_LPB16_MIWT4_2_PLR2_SU32_SUM0_SUS256_SKXCCM0_VWA2_VWB1_WGM8_WGMXCC1_WGMXCCGn1
    SolutionIndex: 31
    SolutionNameMin: Cijk_Ailk_Bjlk_HHS_BH_UserArgs_MT128x64x128_MI16x16x1_SN_LDSB1_CLR1_GSU0_GSUC0_GSUWGMRR0_K1_LBSPPA1024_LBSPPB512_LPA32_LPB32_MIWT4_2_PLR2_SU32_SUM0_SUS256_SKXCCM0_VWA2_VWB2_WGM8_WGMXCC1_WGMXCCGn1
    SolutionIndex: 32
    SolutionNameMin: Cijk_Ailk_Bjlk_HHS_BH_UserArgs_MT128x64x128_MI16x16x1_SN_LDSB1_CLR1_GSU0_GSUC0_GSUWGMRR0_K1_LBSPPA1024_LBSPPB512_LPA0_LPB32_MIWT4_2_PLR2_SU32_SUM0_SUS256_SKXCCM0_VWA4_VWB2_WGM8_WGMXCC1_WGMXCCGn1
    SolutionIndex: 33
    SolutionNameMin: Cijk_Ailk_Bjlk_HHS_BH_UserArgs_MT64x64x128_MI16x16x1_SN_LDSB1_CLR1_GSU0_GSUC0_GSUWGMRR0_K1_LBSPPA512_LBSPPB512_LPA32_LPB32_MIWT2_2_PLR1_SU32_SUM0_SUS256_SKXCCM0_VWA2_VWB2_WGM1_WGMXCC1_WGMXCCGn1
    SolutionIndex: 34
    SolutionNameMin: Cijk_Ailk_Bjlk_HHS_BH_UserArgs_MT64x64x128_MI16x16x1_SN_LDSB1_CLR1_GSU0_GSUC0_GSUWGMRR0_K1_LBSPPA512_LBSPPB512_LPA32_LPB16_MIWT2_2_PLR2_SU32_SUM0_SUS256_SKXCCM0_VWA2_VWB1_WGM1_WGMXCC1_WGMXCCGn1
    SolutionIndex: 35
    SolutionNameMin: Cijk_Ailk_Bjlk_HHS_BH_UserArgs_MT64x64x128_MI16x16x1_SN_LDSB1_CLR1_GSU0_GSUC0_GSUWGMRR0_K1_LBSPPA512_LBSPPB512_LPA32_LPB32_MIWT2_2_PLR2_SU32_SUM0_SUS256_SKXCCM0_VWA2_VWB2_WGM1_WGMXCC1_WGMXCCGn1
    SolutionIndex: 36
    SolutionNameMin: Cijk_Ailk_Bjlk_HHS_BH_UserArgs_MT64x64x128_MI16x16x1_SN_LDSB1_CLR1_GSU0_GSUC0_GSUWGMRR0_K1_LBSPPA512_LBSPPB512_LPA32_LPB32_MIWT2_2_PLR2_SU32_SUM0_SUS256_SKXCCM0_VWA2_VWB2_WGM4_WGMXCC1_WGMXCCGn1
    SolutionIndex: 37
    SolutionNameMin: Cijk_Ailk_Bjlk_HHS_BH_UserArgs_MT64x64x128_MI16x16x1_SN_LDSB1_CLR1_GSU0_GSUC0_GSUWGMRR0_K1_LBSPPA512_LBSPPB512_LPA32_LPB32_MIWT2_2_PLR2_SU32_SUM0_SUS256_SKXCCM0_VWA2_VWB2_WGM8_WGMXCC1_WGMXCCGn1
    SolutionIndex: 38
    SolutionNameMin: Cijk_Ailk_Bjlk_HHS_BH_UserArgs_MT32x64x128_MI16x16x1_SN_LDSB1_CLR1_GSU0_GSUC0_GSUWGMRR0_K1_LBSPPA256_LBSPPB512_LPA16_LPB32_MIWT1_2_PLR2_SU32_SUM0_SUS256_SKXCCM0_VWA1_VWB2_WGM1_WGMXCC1_WGMXCCGn1
    SolutionIndex: 39
    SolutionNameMin: Cijk_Ailk_Bjlk_HHS_BH_UserArgs_MT64x32x128_MI16x16x1_SN_LDSB1_CLR1_GSU0_GSUC0_GSUWGMRR0_K1_LBSPPA512_LBSPPB256_LPA32_LPB16_MIWT2_1_PLR2_SU32_SUM0_SUS256_SKXCCM0_VWA2_VWB1_WGM1_WGMXCC1_WGMXCCGn1
    SolutionIndex: 40
    SolutionNameMin: Cijk_Ailk_Bjlk_HHS_BH_UserArgs_MT32x32x128_MI16x16x1_SN_LDSB1_CLR1_GSU0_GSUC0_GSUWGMRR0_K1_LBSPPA256_LBSPPB256_LPA16_LPB16_MIWT1_1_PLR1_SU32_SUM0_SUS256_SKXCCM0_VWA1_VWB1_WGM1_WGMXCC1_WGMXCCGn1
    SolutionIndex: 41
    SolutionNameMin: Cijk_Ailk_Bjlk_HHS_BH_UserArgs_MT32x32x128_MI16x16x1_SN_LDSB1_CLR1_GSU0_GSUC0_GSUWGMRR0_K1_LBSPPA256_LBSPPB256_LPA16_LPB16_MIWT1_1_PLR2_SU32_SUM0_SUS256_SKXCCM0_VWA1_VWB1_WGM1_WGMXCC1_WGMXCCGn1
    SolutionIndex: 42
    SolutionNameMin: Cijk_Ailk_Bjlk_HHS_BH_UserArgs_MT32x32x128_MI16x16x1_SN_LDSB1_CLR1_GSU0_GSUC0_GSUWGMRR0_K1_LBSPPA256_LBSPPB256_LPA16_LPB16_MIWT1_1_PLR2_SU32_SUM0_SUS256_SKXCCM0_VWA1_VWB1_WGM8_WGMXCC1_WGMXCCGn1
    SolutionIndex: 43
    SolutionNameMin: Cijk_Ailk_Bjlk_HHS_BH_UserArgs_MT256x256x32_MI16x16x1_SN_LDSB0_CLR1_GSU0_GSUC0_GSUWGMRR0_K1_LBSPPA2048_LBSPPB2048_LPA0_LPB0_MIWT8_8_PLR1_SU32_SUM0_SUS256_SKXCCM8_VWA4_VWB8_WGM1_WGMXCC1_WGMXCCGn1
    SolutionIndex: 44
    SolutionNameMin: Cijk_Ailk_Bjlk_HHS_BH_UserArgs_MT256x256x32_MI16x16x1_SN_LDSB0_CLR1_GSU0_GSUC0_GSUWGMRR0_K1_LBSPPA2048_LBSPPB2048_LPA0_LPB0_MIWT8_8_PLR1_SU32_SUM0_SUS256_SKXCCM8_VWA4_VWB4_WGM4_WGMXCC1_WGMXCCGn1
    SolutionIndex: 45
    SolutionNameMin: Cijk_Ailk_Bjlk_HHS_BH_UserArgs_MT256x256x32_MI16x16x1_SN_LDSB0_CLR1_GSU0_GSUC0_GSUWGMRR0_K1_LBSPPA2048_LBSPPB2048_LPA0_LPB0_MIWT8_8_PLR1_SU32_SUM0_SUS256_SKXCCM8_VWA4_VWB8_WGM4_WGMXCC1_WGMXCCGn1
    SolutionIndex: 46
    SolutionNameMin: Cijk_Ailk_Bjlk_HHS_BH_UserArgs_MT256x256x32_MI16x16x1_SN_LDSB1_CLR1_GSU0_GSUC0_GSUWGMRR0_K1_LBSPPA2048_LBSPPB2048_LPA0_LPB32_MIWT8_8_PLR1_SU32_SUM0_SUS256_SKXCCM8_VWA4_VWB2_WGM8_WGMXCC1_WGMXCCGn1
    SolutionIndex: 47
    SolutionNameMin: Cijk_Ailk_Bjlk_HHS_BH_UserArgs_MT256x256x32_MI16x16x1_SN_LDSB0_CLR1_GSU0_GSUC0_GSUWGMRR0_K1_LBSPPA2048_LBSPPB2048_LPA0_LPB0_MIWT8_8_PLR1_SU32_SUM0_SUS256_SKXCCM8_VWA4_VWB8_WGM8_WGMXCC1_WGMXCCGn1
    SolutionIndex: 48
    SolutionNameMin: Cijk_Ailk_Bjlk_HHS_BH_UserArgs_MT128x256x32_MI16x16x1_SN_LDSB1_CLR1_GSU0_GSUC0_GSUWGMRR0_K1_LBSPPA1024_LBSPPB2048_LPA0_LPB32_MIWT4_8_PLR1_SU32_SUM0_SUS256_SKXCCM8_VWA4_VWB2_WGM1_WGMXCC1_WGMXCCGn1
    SolutionIndex: 49
    SolutionNameMin: Cijk_Ailk_Bjlk_HHS_BH_UserArgs_MT128x256x32_MI16x16x1_SN_LDSB1_CLR1_GSU0_GSUC0_GSUWGMRR0_K1_LBSPPA1024_LBSPPB2048_LPA0_LPB32_MIWT4_8_PLR1_SU32_SUM0_SUS256_SKXCCM8_VWA4_VWB2_WGM4_WGMXCC1_WGMXCCGn1
    SolutionIndex: 50
    SolutionNameMin: Cijk_Ailk_Bjlk_HHS_BH_UserArgs_MT128x256x32_MI16x16x1_SN_LDSB1_CLR1_GSU0_GSUC0_GSUWGMRR0_K1_LBSPPA1024_LBSPPB2048_LPA32_LPB0_MIWT4_8_PLR1_SU32_SUM0_SUS256_SKXCCM8_VWA2_VWB4_WGM4_WGMXCC1_WGMXCCGn1
    SolutionIndex: 51
    SolutionNameMin: Cijk_Ailk_Bjlk_HHS_BH_UserArgs_MT128x256x32_MI16x16x1_SN_LDSB1_CLR1_GSU0_GSUC0_GSUWGMRR0_K1_LBSPPA1024_LBSPPB2048_LPA0_LPB0_MIWT4_8_PLR1_SU32_SUM0_SUS256_SKXCCM8_VWA4_VWB4_WGM4_WGMXCC1_WGMXCCGn1
    SolutionIndex: 52
    SolutionNameMin: Cijk_Ailk_Bjlk_HHS_BH_UserArgs_MT128x256x32_MI16x16x1_SN_LDSB1_CLR1_GSU0_GSUC0_GSUWGMRR0_K1_LBSPPA1024_LBSPPB2048_LPA0_LPB0_MIWT4_8_PLR1_SU32_SUM0_SUS256_SKXCCM8_VWA4_VWB8_WGM4_WGMXCC1_WGMXCCGn1
    SolutionIndex: 53
    SolutionNameMin: Cijk_Ailk_Bjlk_HHS_BH_UserArgs_MT128x256x32_MI16x16x1_SN_LDSB1_CLR1_GSU0_GSUC0_GSUWGMRR0_K1_LBSPPA1024_LBSPPB2048_LPA0_LPB32_MIWT4_8_PLR1_SU32_SUM0_SUS256_SKXCCM8_VWA4_VWB2_WGM8_WGMXCC1_WGMXCCGn1
    SolutionIndex: 54
    SolutionNameMin: Cijk_Ailk_Bjlk_HHS_BH_UserArgs_MT128x256x32_MI16x16x1_SN_LDSB1_CLR1_GSU0_GSUC0_GSUWGMRR0_K1_LBSPPA1024_LBSPPB2048_LPA0_LPB0_MIWT4_8_PLR1_SU32_SUM0_SUS256_SKXCCM8_VWA4_VWB8_WGM8_WGMXCC1_WGMXCCGn1
    SolutionIndex: 55
    SolutionNameMin: Cijk_Ailk_Bjlk_HHS_BH_UserArgs_MT256x128x32_MI16x16x1_SN_LDSB1_CLR1_GSU0_GSUC0_GSUWGMRR0_K1_LBSPPA2048_LBSPPB1024_LPA0_LPB0_MIWT8_4_PLR1_SU32_SUM0_SUS256_SKXCCM8_VWA4_VWB4_WGM1_WGMXCC1_WGMXCCGn1
    SolutionIndex: 56
    SolutionNameMin: Cijk_Ailk_Bjlk_HHS_BH_UserArgs_MT256x128x32_MI16x16x1_SN_LDSB1_CLR1_GSU0_GSUC0_GSUWGMRR0_K1_LBSPPA2048_LBSPPB1024_LPA0_LPB0_MIWT8_4_PLR1_SU32_SUM0_SUS256_SKXCCM8_VWA4_VWB4_WGM8_WGMXCC1_WGMXCCGn1
    SolutionIndex: 57
    SolutionNameMin: Cijk_Ailk_Bjlk_HHS_BH_UserArgs_MT128x128x32_MI16x16x1_SN_LDSB0_CLR1_GSU0_GSUC0_GSUWGMRR0_K1_LBSPPA1024_LBSPPB1024_LPA0_LPB0_MIWT4_4_PLR1_SU32_SUM0_SUS256_SKXCCM8_VWA4_VWB4_WGM4_WGMXCC1_WGMXCCGn1
    SolutionIndex: 58
    SolutionNameMin: Cijk_Ailk_Bjlk_HHS_BH_UserArgs_MT128x128x32_MI16x16x1_SN_LDSB0_CLR1_GSU0_GSUC0_GSUWGMRR0_K1_LBSPPA1024_LBSPPB1024_LPA0_LPB0_MIWT4_4_PLR1_SU32_SUM0_SUS256_SKXCCM8_VWA4_VWB4_WGM8_WGMXCC1_WGMXCCGn1
    SolutionIndex: 59
    SolutionNameMin: Cijk_Ailk_Bjlk_HHS_BH_UserArgs_MT128x64x32_MI16x16x1_SN_LDSB0_CLR1_GSU0_GSUC0_GSUWGMRR0_K1_LBSPPA1024_LBSPPB512_LPA0_LPB32_MIWT4_2_PLR1_SU32_SUM0_SUS256_SKXCCM8_VWA4_VWB2_WGM1_WGMXCC1_WGMXCCGn1
    SolutionIndex: 60
    SolutionNameMin: Cijk_Ailk_Bjlk_HHS_BH_UserArgs_MT128x64x32_MI16x16x1_SN_LDSB0_CLR1_GSU0_GSUC0_GSUWGMRR0_K1_LBSPPA1024_LBSPPB512_LPA0_LPB32_MIWT4_2_PLR1_SU32_SUM0_SUS256_SKXCCM8_VWA4_VWB2_WGM4_WGMXCC1_WGMXCCGn1
    SolutionIndex: 61
    SolutionNameMin: Cijk_Ailk_Bjlk_HHS_BH_UserArgs_MT128x64x32_MI16x16x1_SN_LDSB0_CLR1_GSU0_GSUC0_GSUWGMRR0_K1_LBSPPA1024_LBSPPB512_LPA0_LPB32_MIWT4_2_PLR1_SU32_SUM0_SUS256_SKXCCM8_VWA4_VWB2_WGM8_WGMXCC1_WGMXCCGn1
    SolutionIndex: 62
    SolutionNameMin: Cijk_Ailk_Bjlk_HHS_BH_UserArgs_MT32x32x32_MI16x16x1_SN_LDSB0_CLR1_GSU0_GSUC0_GSUWGMRR0_K1_LBSPPA256_LBSPPB256_LPA16_LPB16_MIWT1_1_PLR1_SU32_SUM0_SUS256_SKXCCM8_VWA1_VWB1_WGM1_WGMXCC1_WGMXCCGn1
    SolutionIndex: 63
    SolutionNameMin: Cijk_Ailk_Bjlk_HHS_BH_UserArgs_MT256x256x64_MI16x16x1_SN_LDSB1_CLR1_GSU0_GSUC0_GSUWGMRR0_K1_LBSPPA2048_LBSPPB2048_LPA0_LPB0_MIWT8_8_PLR2_SU32_SUM0_SUS256_SKXCCM8_VWA4_VWB4_WGM1_WGMXCC1_WGMXCCGn1
    SolutionIndex: 64
    SolutionNameMin: Cijk_Ailk_Bjlk_HHS_BH_UserArgs_MT256x256x64_MI16x16x1_SN_LDSB1_CLR1_GSU0_GSUC0_GSUWGMRR0_K1_LBSPPA2048_LBSPPB2048_LPA0_LPB0_MIWT8_8_PLR2_SU32_SUM0_SUS256_SKXCCM8_VWA4_VWB8_WGM1_WGMXCC1_WGMXCCGn1
    SolutionIndex: 65
    SolutionNameMin: Cijk_Ailk_Bjlk_HHS_BH_UserArgs_MT256x256x64_MI16x16x1_SN_LDSB1_CLR1_GSU0_GSUC0_GSUWGMRR0_K1_LBSPPA2048_LBSPPB2048_LPA0_LPB0_MIWT8_8_PLR1_SU32_SUM0_SUS256_SKXCCM8_VWA4_VWB4_WGM4_WGMXCC1_WGMXCCGn1
    SolutionIndex: 66
    SolutionNameMin: Cijk_Ailk_Bjlk_HHS_BH_UserArgs_MT256x256x64_MI16x16x1_SN_LDSB1_CLR1_GSU0_GSUC0_GSUWGMRR0_K1_LBSPPA2048_LBSPPB2048_LPA0_LPB0_MIWT8_8_PLR2_SU32_SUM0_SUS256_SKXCCM8_VWA4_VWB8_WGM4_WGMXCC1_WGMXCCGn1
    SolutionIndex: 67
    SolutionNameMin: Cijk_Ailk_Bjlk_HHS_BH_UserArgs_MT256x256x64_MI16x16x1_SN_LDSB1_CLR1_GSU0_GSUC0_GSUWGMRR0_K1_LBSPPA2048_LBSPPB2048_LPA0_LPB0_MIWT8_8_PLR2_SU32_SUM0_SUS256_SKXCCM8_VWA4_VWB4_WGM8_WGMXCC1_WGMXCCGn1
    SolutionIndex: 68
    SolutionNameMin: Cijk_Ailk_Bjlk_HHS_BH_UserArgs_MT256x256x64_MI16x16x1_SN_LDSB1_CLR1_GSU0_GSUC0_GSUWGMRR0_K1_LBSPPA2048_LBSPPB2048_LPA0_LPB0_MIWT8_8_PLR2_SU32_SUM0_SUS256_SKXCCM8_VWA4_VWB8_WGM8_WGMXCC1_WGMXCCGn1
    SolutionIndex: 69
    SolutionNameMin: Cijk_Ailk_Bjlk_HHS_BH_UserArgs_MT128x256x64_MI16x16x1_SN_LDSB1_CLR1_GSU0_GSUC0_GSUWGMRR0_K1_LBSPPA1024_LBSPPB2048_LPA32_LPB0_MIWT4_8_PLR2_SU32_SUM0_SUS256_SKXCCM8_VWA2_VWB4_WGM1_WGMXCC1_WGMXCCGn1
    SolutionIndex: 70
    SolutionNameMin: Cijk_Ailk_Bjlk_HHS_BH_UserArgs_MT128x256x64_MI16x16x1_SN_LDSB1_CLR1_GSU0_GSUC0_GSUWGMRR0_K1_LBSPPA1024_LBSPPB2048_LPA0_LPB32_MIWT4_8_PLR1_SU32_SUM0_SUS256_SKXCCM8_VWA4_VWB2_WGM4_WGMXCC1_WGMXCCGn1
    SolutionIndex: 71
    SolutionNameMin: Cijk_Ailk_Bjlk_HHS_BH_UserArgs_MT128x256x64_MI16x16x1_SN_LDSB1_CLR1_GSU0_GSUC0_GSUWGMRR0_K1_LBSPPA1024_LBSPPB2048_LPA0_LPB0_MIWT4_8_PLR1_SU32_SUM0_SUS256_SKXCCM8_VWA4_VWB8_WGM4_WGMXCC1_WGMXCCGn1
    SolutionIndex: 72
    SolutionNameMin: Cijk_Ailk_Bjlk_HHS_BH_UserArgs_MT128x256x64_MI16x16x1_SN_LDSB1_CLR1_GSU0_GSUC0_GSUWGMRR0_K1_LBSPPA1024_LBSPPB2048_LPA0_LPB0_MIWT4_8_PLR1_SU32_SUM0_SUS256_SKXCCM8_VWA4_VWB8_WGM8_WGMXCC1_WGMXCCGn1
    SolutionIndex: 73
    SolutionNameMin: Cijk_Ailk_Bjlk_HHS_BH_UserArgs_MT256x128x64_MI16x16x1_SN_LDSB1_CLR1_GSU0_GSUC0_GSUWGMRR0_K1_LBSPPA2048_LBSPPB1024_LPA32_LPB0_MIWT8_4_PLR1_SU32_SUM0_SUS256_SKXCCM8_VWA2_VWB4_WGM4_WGMXCC1_WGMXCCGn1
    SolutionIndex: 74
    SolutionNameMin: Cijk_Ailk_Bjlk_HHS_BH_UserArgs_MT256x128x64_MI16x16x1_SN_LDSB1_CLR1_GSU0_GSUC0_GSUWGMRR0_K1_LBSPPA2048_LBSPPB1024_LPA0_LPB32_MIWT8_4_PLR2_SU32_SUM0_SUS256_SKXCCM8_VWA4_VWB2_WGM8_WGMXCC1_WGMXCCGn1
    SolutionIndex: 75
    SolutionNameMin: Cijk_Ailk_Bjlk_HHS_BH_UserArgs_MT128x128x64_MI16x16x1_SN_LDSB1_CLR1_GSU0_GSUC0_GSUWGMRR0_K1_LBSPPA1024_LBSPPB1024_LPA0_LPB0_MIWT4_4_PLR1_SU32_SUM0_SUS256_SKXCCM8_VWA4_VWB4_WGM1_WGMXCC1_WGMXCCGn1
    SolutionIndex: 76
    SolutionNameMin: Cijk_Ailk_Bjlk_HHS_BH_UserArgs_MT128x128x64_MI16x16x1_SN_LDSB1_CLR1_GSU0_GSUC0_GSUWGMRR0_K1_LBSPPA1024_LBSPPB1024_LPA0_LPB32_MIWT4_4_PLR2_SU32_SUM0_SUS256_SKXCCM8_VWA4_VWB2_WGM1_WGMXCC1_WGMXCCGn1
    SolutionIndex: 77
    SolutionNameMin: Cijk_Ailk_Bjlk_HHS_BH_UserArgs_MT128x128x64_MI16x16x1_SN_LDSB1_CLR1_GSU0_GSUC0_GSUWGMRR0_K1_LBSPPA1024_LBSPPB1024_LPA0_LPB0_MIWT4_4_PLR2_SU32_SUM0_SUS256_SKXCCM8_VWA4_VWB4_WGM1_WGMXCC1_WGMXCCGn1
    SolutionIndex: 78
    SolutionNameMin: Cijk_Ailk_Bjlk_HHS_BH_UserArgs_MT128x128x64_MI16x16x1_SN_LDSB1_CLR1_GSU0_GSUC0_GSUWGMRR0_K1_LBSPPA1024_LBSPPB1024_LPA0_LPB0_MIWT4_4_PLR1_SU32_SUM0_SUS256_SKXCCM8_VWA4_VWB4_WGM4_WGMXCC1_WGMXCCGn1
    SolutionIndex: 79
    SolutionNameMin: Cijk_Ailk_Bjlk_HHS_BH_UserArgs_MT128x128x64_MI16x16x1_SN_LDSB1_CLR1_GSU0_GSUC0_GSUWGMRR0_K1_LBSPPA1024_LBSPPB1024_LPA0_LPB0_MIWT4_4_PLR1_SU32_SUM0_SUS256_SKXCCM8_VWA4_VWB4_WGM8_WGMXCC1_WGMXCCGn1
    SolutionIndex: 80
    SolutionNameMin: Cijk_Ailk_Bjlk_HHS_BH_UserArgs_MT128x128x64_MI16x16x1_SN_LDSB1_CLR1_GSU0_GSUC0_GSUWGMRR0_K1_LBSPPA1024_LBSPPB1024_LPA0_LPB0_MIWT4_4_PLR2_SU32_SUM0_SUS256_SKXCCM8_VWA4_VWB4_WGM8_WGMXCC1_WGMXCCGn1
    SolutionIndex: 81
    SolutionNameMin: Cijk_Ailk_Bjlk_HHS_BH_UserArgs_MT64x128x64_MI16x16x1_SN_LDSB1_CLR1_GSU0_GSUC0_GSUWGMRR0_K1_LBSPPA512_LBSPPB1024_LPA32_LPB0_MIWT2_4_PLR2_SU32_SUM0_SUS256_SKXCCM8_VWA2_VWB4_WGM4_WGMXCC1_WGMXCCGn1
    SolutionIndex: 82
    SolutionNameMin: Cijk_Ailk_Bjlk_HHS_BH_UserArgs_MT128x64x64_MI16x16x1_SN_LDSB1_CLR1_GSU0_GSUC0_GSUWGMRR0_K1_LBSPPA1024_LBSPPB512_LPA0_LPB32_MIWT4_2_PLR2_SU32_SUM0_SUS256_SKXCCM8_VWA4_VWB2_WGM1_WGMXCC1_WGMXCCGn1
    SolutionIndex: 83
    SolutionNameMin: Cijk_Ailk_Bjlk_HHS_BH_UserArgs_MT128x64x64_MI16x16x1_SN_LDSB1_CLR1_GSU0_GSUC0_GSUWGMRR0_K1_LBSPPA1024_LBSPPB512_LPA0_LPB32_MIWT4_2_PLR1_SU32_SUM0_SUS256_SKXCCM8_VWA4_VWB2_WGM8_WGMXCC1_WGMXCCGn1
    SolutionIndex: 84
    SolutionNameMin: Cijk_Ailk_Bjlk_HHS_BH_UserArgs_MT128x64x64_MI16x16x1_SN_LDSB1_CLR1_GSU0_GSUC0_GSUWGMRR0_K1_LBSPPA1024_LBSPPB512_LPA0_LPB32_MIWT4_2_PLR2_SU32_SUM0_SUS256_SKXCCM8_VWA4_VWB2_WGM8_WGMXCC1_WGMXCCGn1
    SolutionIndex: 85
    SolutionNameMin: Cijk_Ailk_Bjlk_HHS_BH_UserArgs_MT64x64x64_MI16x16x1_SN_LDSB1_CLR1_GSU0_GSUC0_GSUWGMRR0_K1_LBSPPA512_LBSPPB512_LPA32_LPB32_MIWT2_2_PLR1_SU32_SUM0_SUS256_SKXCCM8_VWA2_VWB2_WGM1_WGMXCC1_WGMXCCGn1
    SolutionIndex: 86
    SolutionNameMin: Cijk_Ailk_Bjlk_HHS_BH_UserArgs_MT64x64x64_MI16x16x1_SN_LDSB1_CLR1_GSU0_GSUC0_GSUWGMRR0_K1_LBSPPA512_LBSPPB512_LPA32_LPB32_MIWT2_2_PLR2_SU32_SUM0_SUS256_SKXCCM8_VWA2_VWB2_WGM1_WGMXCC1_WGMXCCGn1
    SolutionIndex: 87
    SolutionNameMin: Cijk_Ailk_Bjlk_HHS_BH_UserArgs_MT64x64x64_MI16x16x1_SN_LDSB1_CLR1_GSU0_GSUC0_GSUWGMRR0_K1_LBSPPA512_LBSPPB512_LPA32_LPB32_MIWT2_2_PLR1_SU32_SUM0_SUS256_SKXCCM8_VWA2_VWB2_WGM4_WGMXCC1_WGMXCCGn1
    SolutionIndex: 88
    SolutionNameMin: Cijk_Ailk_Bjlk_HHS_BH_UserArgs_MT64x64x64_MI16x16x1_SN_LDSB1_CLR1_GSU0_GSUC0_GSUWGMRR0_K1_LBSPPA512_LBSPPB512_LPA32_LPB32_MIWT2_2_PLR2_SU32_SUM0_SUS256_SKXCCM8_VWA2_VWB2_WGM4_WGMXCC1_WGMXCCGn1
    SolutionIndex: 89
    SolutionNameMin: Cijk_Ailk_Bjlk_HHS_BH_UserArgs_MT64x64x64_MI16x16x1_SN_LDSB1_CLR1_GSU0_GSUC0_GSUWGMRR0_K1_LBSPPA512_LBSPPB512_LPA32_LPB32_MIWT2_2_PLR1_SU32_SUM0_SUS256_SKXCCM8_VWA2_VWB2_WGM8_WGMXCC1_WGMXCCGn1
    SolutionIndex: 90
    SolutionNameMin: Cijk_Ailk_Bjlk_HHS_BH_UserArgs_MT64x64x64_MI16x16x1_SN_LDSB1_CLR1_GSU0_GSUC0_GSUWGMRR0_K1_LBSPPA512_LBSPPB512_LPA32_LPB32_MIWT2_2_PLR2_SU32_SUM0_SUS256_SKXCCM8_VWA2_VWB2_WGM8_WGMXCC1_WGMXCCGn1
    SolutionIndex: 91
    SolutionNameMin: Cijk_Ailk_Bjlk_HHS_BH_UserArgs_MT32x64x64_MI16x16x1_SN_LDSB0_CLR1_GSU0_GSUC0_GSUWGMRR0_K1_LBSPPA256_LBSPPB512_LPA16_LPB32_MIWT1_2_PLR1_SU32_SUM0_SUS256_SKXCCM8_VWA1_VWB2_WGM1_WGMXCC1_WGMXCCGn1
    SolutionIndex: 92
    SolutionNameMin: Cijk_Ailk_Bjlk_HHS_BH_UserArgs_MT32x64x64_MI16x16x1_SN_LDSB0_CLR1_GSU0_GSUC0_GSUWGMRR0_K1_LBSPPA256_LBSPPB512_LPA16_LPB32_MIWT1_2_PLR2_SU32_SUM0_SUS256_SKXCCM8_VWA1_VWB2_WGM1_WGMXCC1_WGMXCCGn1
    SolutionIndex: 93
    SolutionNameMin: Cijk_Ailk_Bjlk_HHS_BH_UserArgs_MT32x64x64_MI16x16x1_SN_LDSB0_CLR1_GSU0_GSUC0_GSUWGMRR0_K1_LBSPPA256_LBSPPB512_LPA16_LPB32_MIWT1_2_PLR2_SU32_SUM0_SUS256_SKXCCM8_VWA1_VWB2_WGM4_WGMXCC1_WGMXCCGn1
    SolutionIndex: 94
    SolutionNameMin: Cijk_Ailk_Bjlk_HHS_BH_UserArgs_MT64x32x64_MI16x16x1_SN_LDSB0_CLR1_GSU0_GSUC0_GSUWGMRR0_K1_LBSPPA512_LBSPPB256_LPA32_LPB16_MIWT2_1_PLR2_SU32_SUM0_SUS256_SKXCCM8_VWA2_VWB1_WGM1_WGMXCC1_WGMXCCGn1
    SolutionIndex: 95
    SolutionNameMin: Cijk_Ailk_Bjlk_HHS_BH_UserArgs_MT64x32x64_MI16x16x1_SN_LDSB0_CLR1_GSU0_GSUC0_GSUWGMRR0_K1_LBSPPA512_LBSPPB256_LPA32_LPB16_MIWT2_1_PLR2_SU32_SUM0_SUS256_SKXCCM8_VWA2_VWB1_WGM8_WGMXCC1_WGMXCCGn1
    SolutionIndex: 96
    SolutionNameMin: Cijk_Ailk_Bjlk_HHS_BH_UserArgs_MT32x32x64_MI16x16x1_SN_LDSB0_CLR1_GSU0_GSUC0_GSUWGMRR0_K1_LBSPPA256_LBSPPB256_LPA16_LPB16_MIWT1_1_PLR1_SU32_SUM0_SUS256_SKXCCM8_VWA1_VWB1_WGM1_WGMXCC1_WGMXCCGn1
    SolutionIndex: 97
    SolutionNameMin: Cijk_Ailk_Bjlk_HHS_BH_UserArgs_MT32x32x64_MI16x16x1_SN_LDSB0_CLR1_GSU0_GSUC0_GSUWGMRR0_K1_LBSPPA256_LBSPPB256_LPA16_LPB16_MIWT1_1_PLR2_SU32_SUM0_SUS256_SKXCCM8_VWA1_VWB1_WGM4_WGMXCC1_WGMXCCGn1
    SolutionIndex: 98
    SolutionNameMin: Cijk_Ailk_Bjlk_HHS_BH_UserArgs_MT32x32x64_MI16x16x1_SN_LDSB0_CLR1_GSU0_GSUC0_GSUWGMRR0_K1_LBSPPA256_LBSPPB256_LPA16_LPB16_MIWT1_1_PLR1_SU32_SUM0_SUS256_SKXCCM8_VWA1_VWB1_WGM8_WGMXCC1_WGMXCCGn1
    SolutionIndex: 99
    SolutionNameMin: Cijk_Ailk_Bjlk_HHS_BH_UserArgs_MT128x128x128_MI16x16x1_SN_LDSB1_CLR1_GSU0_GSUC0_GSUWGMRR0_K1_LBSPPA1024_LBSPPB1024_LPA0_LPB0_MIWT4_4_PLR1_SU32_SUM0_SUS256_SKXCCM8_VWA4_VWB4_WGM1_WGMXCC1_WGMXCCGn1
    SolutionIndex: 100
    SolutionNameMin: Cijk_Ailk_Bjlk_HHS_BH_UserArgs_MT128x128x128_MI16x16x1_SN_LDSB1_CLR1_GSU0_GSUC0_GSUWGMRR0_K1_LBSPPA1024_LBSPPB1024_LPA0_LPB0_MIWT4_4_PLR2_SU32_SUM0_SUS256_SKXCCM8_VWA4_VWB4_WGM1_WGMXCC1_WGMXCCGn1
    SolutionIndex: 101
    SolutionNameMin: Cijk_Ailk_Bjlk_HHS_BH_UserArgs_MT128x128x128_MI16x16x1_SN_LDSB1_CLR1_GSU0_GSUC0_GSUWGMRR0_K1_LBSPPA1024_LBSPPB1024_LPA0_LPB0_MIWT4_4_PLR1_SU32_SUM0_SUS256_SKXCCM8_VWA4_VWB4_WGM4_WGMXCC1_WGMXCCGn1
    SolutionIndex: 102
    SolutionNameMin: Cijk_Ailk_Bjlk_HHS_BH_UserArgs_MT128x128x128_MI16x16x1_SN_LDSB1_CLR1_GSU0_GSUC0_GSUWGMRR0_K1_LBSPPA1024_LBSPPB1024_LPA0_LPB0_MIWT4_4_PLR1_SU32_SUM0_SUS256_SKXCCM8_VWA4_VWB4_WGM8_WGMXCC1_WGMXCCGn1
    SolutionIndex: 103
    SolutionNameMin: Cijk_Ailk_Bjlk_HHS_BH_UserArgs_MT128x128x128_MI16x16x1_SN_LDSB1_CLR1_GSU0_GSUC0_GSUWGMRR0_K1_LBSPPA1024_LBSPPB1024_LPA0_LPB0_MIWT4_4_PLR2_SU32_SUM0_SUS256_SKXCCM8_VWA4_VWB4_WGM8_WGMXCC1_WGMXCCGn1
    SolutionIndex: 104
    SolutionNameMin: Cijk_Ailk_Bjlk_HHS_BH_UserArgs_MT128x64x128_MI16x16x1_SN_LDSB1_CLR1_GSU0_GSUC0_GSUWGMRR0_K1_LBSPPA1024_LBSPPB512_LPA32_LPB32_MIWT4_2_PLR2_SU32_SUM0_SUS256_SKXCCM8_VWA2_VWB2_WGM1_WGMXCC1_WGMXCCGn1
    SolutionIndex: 105
    SolutionNameMin: Cijk_Ailk_Bjlk_HHS_BH_UserArgs_MT128x64x128_MI16x16x1_SN_LDSB1_CLR1_GSU0_GSUC0_GSUWGMRR0_K1_LBSPPA1024_LBSPPB512_LPA0_LPB32_MIWT4_2_PLR2_SU32_SUM0_SUS256_SKXCCM8_VWA4_VWB2_WGM1_WGMXCC1_WGMXCCGn1
    SolutionIndex: 106
    SolutionNameMin: Cijk_Ailk_Bjlk_HHS_BH_UserArgs_MT128x64x128_MI16x16x1_SN_LDSB1_CLR1_GSU0_GSUC0_GSUWGMRR0_K1_LBSPPA1024_LBSPPB512_LPA0_LPB32_MIWT4_2_PLR2_SU32_SUM0_SUS256_SKXCCM8_VWA4_VWB2_WGM4_WGMXCC1_WGMXCCGn1
    SolutionIndex: 107
    SolutionNameMin: Cijk_Ailk_Bjlk_HHS_BH_UserArgs_MT128x64x128_MI16x16x1_SN_LDSB1_CLR1_GSU0_GSUC0_GSUWGMRR0_K1_LBSPPA1024_LBSPPB512_LPA0_LPB32_MIWT4_2_PLR2_SU32_SUM0_SUS256_SKXCCM8_VWA4_VWB2_WGM8_WGMXCC1_WGMXCCGn1
    SolutionIndex: 108
    SolutionNameMin: Cijk_Ailk_Bjlk_HHS_BH_UserArgs_MT64x64x128_MI16x16x1_SN_LDSB1_CLR1_GSU0_GSUC0_GSUWGMRR0_K1_LBSPPA512_LBSPPB512_LPA32_LPB32_MIWT2_2_PLR1_SU32_SUM0_SUS256_SKXCCM8_VWA2_VWB2_WGM1_WGMXCC1_WGMXCCGn1
    SolutionIndex: 109
    SolutionNameMin: Cijk_Ailk_Bjlk_HHS_BH_UserArgs_MT64x64x128_MI16x16x1_SN_LDSB1_CLR1_GSU0_GSUC0_GSUWGMRR0_K1_LBSPPA512_LBSPPB512_LPA32_LPB16_MIWT2_2_PLR2_SU32_SUM0_SUS256_SKXCCM8_VWA2_VWB1_WGM1_WGMXCC1_WGMXCCGn1
    SolutionIndex: 110
    SolutionNameMin: Cijk_Ailk_Bjlk_HHS_BH_UserArgs_MT64x64x128_MI16x16x1_SN_LDSB1_CLR1_GSU0_GSUC0_GSUWGMRR0_K1_LBSPPA512_LBSPPB512_LPA32_LPB32_MIWT2_2_PLR2_SU32_SUM0_SUS256_SKXCCM8_VWA2_VWB2_WGM1_WGMXCC1_WGMXCCGn1
    SolutionIndex: 111
    SolutionNameMin: Cijk_Ailk_Bjlk_HHS_BH_UserArgs_MT64x64x128_MI16x16x1_SN_LDSB1_CLR1_GSU0_GSUC0_GSUWGMRR0_K1_LBSPPA512_LBSPPB512_LPA32_LPB32_MIWT2_2_PLR2_SU32_SUM0_SUS256_SKXCCM8_VWA2_VWB2_WGM4_WGMXCC1_WGMXCCGn1
    SolutionIndex: 112
    SolutionNameMin: Cijk_Ailk_Bjlk_HHS_BH_UserArgs_MT64x64x128_MI16x16x1_SN_LDSB1_CLR1_GSU0_GSUC0_GSUWGMRR0_K1_LBSPPA512_LBSPPB512_LPA32_LPB32_MIWT2_2_PLR2_SU32_SUM0_SUS256_SKXCCM8_VWA2_VWB2_WGM8_WGMXCC1_WGMXCCGn1
    SolutionIndex: 113
    SolutionNameMin: Cijk_Ailk_Bjlk_HHS_BH_UserArgs_MT32x64x128_MI16x16x1_SN_LDSB1_CLR1_GSU0_GSUC0_GSUWGMRR0_K1_LBSPPA256_LBSPPB512_LPA16_LPB32_MIWT1_2_PLR2_SU32_SUM0_SUS256_SKXCCM8_VWA1_VWB2_WGM1_WGMXCC1_WGMXCCGn1
    SolutionIndex: 114
    SolutionNameMin: Cijk_Ailk_Bjlk_HHS_BH_UserArgs_MT32x64x128_MI16x16x1_SN_LDSB1_CLR1_GSU0_GSUC0_GSUWGMRR0_K1_LBSPPA256_LBSPPB512_LPA16_LPB32_MIWT1_2_PLR2_SU32_SUM0_SUS256_SKXCCM8_VWA1_VWB2_WGM8_WGMXCC1_WGMXCCGn1
    SolutionIndex: 115
    SolutionNameMin: Cijk_Ailk_Bjlk_HHS_BH_UserArgs_MT64x32x128_MI16x16x1_SN_LDSB1_CLR1_GSU0_GSUC0_GSUWGMRR0_K1_LBSPPA512_LBSPPB256_LPA32_LPB16_MIWT2_1_PLR2_SU32_SUM0_SUS256_SKXCCM8_VWA2_VWB1_WGM1_WGMXCC1_WGMXCCGn1
    SolutionIndex: 116
    SolutionNameMin: Cijk_Ailk_Bjlk_HHS_BH_UserArgs_MT64x32x128_MI16x16x1_SN_LDSB1_CLR1_GSU0_GSUC0_GSUWGMRR0_K1_LBSPPA512_LBSPPB256_LPA32_LPB16_MIWT2_1_PLR2_SU32_SUM0_SUS256_SKXCCM8_VWA2_VWB1_WGM8_WGMXCC1_WGMXCCGn1
    SolutionIndex: 117
    SolutionNameMin: Cijk_Ailk_Bjlk_HHS_BH_UserArgs_MT32x32x128_MI16x16x1_SN_LDSB1_CLR1_GSU0_GSUC0_GSUWGMRR0_K1_LBSPPA256_LBSPPB256_LPA16_LPB16_MIWT1_1_PLR1_SU32_SUM0_SUS256_SKXCCM8_VWA1_VWB1_WGM1_WGMXCC1_WGMXCCGn1
    SolutionIndex: 118
    SolutionNameMin: Cijk_Ailk_Bjlk_HHS_BH_UserArgs_MT32x32x128_MI16x16x1_SN_LDSB1_CLR1_GSU0_GSUC0_GSUWGMRR0_K1_LBSPPA256_LBSPPB256_LPA16_LPB16_MIWT1_1_PLR2_SU32_SUM0_SUS256_SKXCCM8_VWA1_VWB1_WGM1_WGMXCC1_WGMXCCGn1
    SolutionIndex: 119
    SolutionNameMin: Cijk_Ailk_Bjlk_HHS_BH_UserArgs_MT32x32x32_MI16x16x1_SN_LDSB0_CLR0_GSU0_GSUC0_GSUWGMRR0_K1_LBSPPA256_LBSPPB256_LPA16_LPB16_MIWT1_1_PLR0_SU32_SUM0_SUS256_SKXCCM0_VWA1_VWB1_WGM8_WGMXCC1_WGMXCCGn1
- - - [128, 128, 1, 128, 128, 128, 128, 128]
    - [117, 0.081]
  - - [128, 128, 1, 256, 128, 128, 128, 128]
    - [40, 0.101]
  - - [128, 128, 1, 512, 128, 128, 128, 128]
    - [41, 0.165]
  - - [128, 128, 1, 1024, 128, 128, 128, 128]
    - [118, 0.258]
  - - [128, 128, 1, 2048, 128, 128, 128, 128]
    - [117, 0.333]
  - - [128, 128, 1, 4096, 128, 128, 128, 128]
    - [4, 0.518]
  - - [128, 128, 1, 8192, 128, 128, 128, 128]
    - [62, 1.021]
  - - [128, 256, 1, 128, 128, 128, 128, 256]
    - [40, 0.159]
  - - [128, 256, 1, 256, 128, 128, 128, 256]
    - [40, 0.198]
  - - [128, 256, 1, 512, 128, 128, 128, 256]
    - [41, 0.319]
  - - [128, 256, 1, 1024, 128, 128, 128, 256]
    - [118, 0.511]
  - - [128, 256, 1, 2048, 128, 128, 128, 256]
    - [4, 0.784]
  - - [128, 256, 1, 4096, 128, 128, 128, 256]
    - [18, 1.447]
  - - [128, 256, 1, 8192, 128, 128, 128, 256]
    - [117, 2.518]
  - - [128, 512, 1, 128, 128, 128, 128, 512]
    - [40, 0.316]
  - - [128, 512, 1, 256, 128, 128, 128, 512]
    - [40, 0.388]
  - - [128, 512, 1, 512, 128, 128, 128, 512]
    - [118, 0.636]
  - - [128, 512, 1, 1024, 128, 128, 128, 512]
    - [117, 1.048]
  - - [128, 512, 1, 2048, 128, 128, 128, 512]
    - [18, 1.86]
  - - [128, 512, 1, 4096, 128, 128, 128, 512]
    - [118, 3.042]
  - - [128, 512, 1, 8192, 128, 128, 128, 512]
    - [91, 4.242]
  - - [128, 1024, 1, 128, 128, 128, 128, 1024]
    - [40, 0.619]
  - - [128, 1024, 1, 256, 128, 128, 128, 1024]
    - [40, 0.724]
  - - [128, 1024, 1, 512, 128, 128, 128, 1024]
    - [118, 1.286]
  - - [128, 1024, 1, 1024, 128, 128, 128, 1024]
    - [117, 2.098]
  - - [128, 1024, 1, 2048, 128, 128, 128, 1024]
    - [42, 3.376]
  - - [128, 1024, 1, 4096, 128, 128, 128, 1024]
    - [17, 4.984]
  - - [128, 1024, 1, 8192, 128, 128, 128, 1024]
    - [93, 6.992]
  - - [128, 2048, 1, 128, 128, 128, 128, 2048]
    - [40, 1.193]
  - - [128, 2048, 1, 256, 128, 128, 128, 2048]
    - [41, 1.484]
  - - [128, 2048, 1, 512, 128, 128, 128, 2048]
    - [40, 2.292]
  - - [128, 2048, 1, 1024, 128, 128, 128, 2048]
    - [115, 3.732]
  - - [128, 2048, 1, 2048, 128, 128, 128, 2048]
    - [115, 6.005]
  - - [128, 2048, 1, 4096, 128, 128, 128, 2048]
    - [15, 8.071]
  - - [128, 2048, 1, 8192, 128, 128, 128, 2048]
    - [87, 10.973]
  - - [128, 4096, 1, 128, 128, 128, 128, 4096]
    - [39, 2.241]
  - - [128, 4096, 1, 256, 128, 128, 128, 4096]
    - [38, 2.772]
  - - [128, 4096, 1, 512, 128, 128, 128, 4096]
    - [115, 4.323]
  - - [128, 4096, 1, 1024, 128, 128, 128, 4096]
    - [113, 6.587]
  - - [128, 4096, 1, 2048, 128, 128, 128, 4096]
    - [110, 9.173]
  - - [128, 4096, 1, 4096, 128, 128, 128, 4096]
    - [13, 12.437]
  - - [128, 4096, 1, 8192, 128, 128, 128, 4096]
    - [13, 15.298]
  - - [128, 8192, 1, 128, 128, 128, 128, 8192]
    - [35, 4.092]
  - - [128, 8192, 1, 256, 128, 128, 128, 8192]
    - [34, 4.86]
  - - [128, 8192, 1, 512, 128, 128, 128, 8192]
    - [108, 7.481]
  - - [128, 8192, 1, 1024, 128, 128, 128, 8192]
    - [85, 10.34]
  - - [128, 8192, 1, 2048, 128, 128, 128, 8192]
    - [13, 13.427]
  - - [128, 8192, 1, 4096, 128, 128, 128, 8192]
    - [82, 16.616]
  - - [128, 8192, 1, 8192, 128, 128, 128, 8192]
    - [9, 20.657]
  - - [256, 128, 1, 128, 256, 256, 256, 128]
    - [40, 0.158]
  - - [256, 128, 1, 256, 256, 256, 256, 128]
    - [41, 0.193]
  - - [256, 128, 1, 512, 256, 256, 256, 128]
    - [118, 0.326]
  - - [256, 128, 1, 1024, 256, 256, 256, 128]
    - [117, 0.475]
  - - [256, 128, 1, 2048, 256, 256, 256, 128]
    - [4, 0.798]
  - - [256, 128, 1, 4096, 256, 256, 256, 128]
    - [18, 1.496]
  - - [256, 128, 1, 8192, 256, 256, 256, 128]
    - [97, 2.434]
  - - [256, 256, 1, 128, 256, 256, 256, 256]
    - [41, 0.299]
  - - [256, 256, 1, 256, 256, 256, 256, 256]
    - [41, 0.39]
  - - [256, 256, 1, 512, 256, 256, 256, 256]
    - [118, 0.63]
  - - [256, 256, 1, 1024, 256, 256, 256, 256]
    - [117, 1.046]
  - - [256, 256, 1, 2048, 256, 256, 256, 256]
    - [118, 1.9]
  - - [256, 256, 1, 4096, 256, 256, 256, 256]
    - [96, 3.067]
  - - [256, 256, 1, 8192, 256, 256, 256, 256]
    - [113, 4.225]
  - - [256, 512, 1, 128, 256, 256, 256, 512]
    - [41, 0.605]
  - - [256, 512, 1, 256, 256, 256, 256, 512]
    - [41, 0.739]
  - - [256, 512, 1, 512, 256, 256, 256, 512]
    - [118, 1.311]
  - - [256, 512, 1, 1024, 256, 256, 256, 512]
    - [117, 2.142]
  - - [256, 512, 1, 2048, 256, 256, 256, 512]
    - [40, 3.467]
  - - [256, 512, 1, 4096, 256, 256, 256, 512]
    - [92, 5.445]
  - - [256, 512, 1, 8192, 256, 256, 256, 512]
    - [93, 6.838]
  - - [256, 1024, 1, 128, 256, 256, 256, 1024]
    - [41, 1.168]
  - - [256, 1024, 1, 256, 256, 256, 256, 1024]
    - [41, 1.528]
  - - [256, 1024, 1, 512, 256, 256, 256, 1024]
    - [117, 2.348]
  - - [256, 1024, 1, 1024, 256, 256, 256, 1024]
    - [113, 3.873]
  - - [256, 1024, 1, 2048, 256, 256, 256, 1024]
    - [113, 5.857]
  - - [256, 1024, 1, 4096, 256, 256, 256, 1024]
    - [85, 8.02]
  - - [256, 1024, 1, 8192, 256, 256, 256, 1024]
    - [88, 10.72]
  - - [256, 2048, 1, 128, 256, 256, 256, 2048]
    - [35, 2.114]
  - - [256, 2048, 1, 256, 256, 256, 256, 2048]
    - [39, 2.837]
  - - [256, 2048, 1, 512, 256, 256, 256, 2048]
    - [115, 4.237]
  - - [256, 2048, 1, 1024, 256, 256, 256, 2048]
    - [115, 6.508]
  - - [256, 2048, 1, 2048, 256, 256, 256, 2048]
    - [87, 9.277]
  - - [256, 2048, 1, 4096, 256, 256, 256, 2048]
    - [61, 11.934]
  - - [256, 2048, 1, 8192, 256, 256, 256, 2048]
    - [84, 14.887]
  - - [256, 4096, 1, 128, 256, 256, 256, 4096]
    - [36, 3.956]
  - - [256, 4096, 1, 256, 256, 256, 256, 4096]
    - [36, 4.931]
  - - [256, 4096, 1, 512, 256, 256, 256, 4096]
    - [108, 7.51]
  - - [256, 4096, 1, 1024, 256, 256, 256, 4096]
    - [86, 10.342]
  - - [256, 4096, 1, 2048, 256, 256, 256, 4096]
    - [84, 13.459]
  - - [256, 4096, 1, 4096, 256, 256, 256, 4096]
    - [83, 16.408]
  - - [256, 4096, 1, 8192, 256, 256, 256, 4096]
    - [75, 20.67]
  - - [256, 8192, 1, 128, 256, 256, 256, 8192]
    - [104, 6.265]
  - - [256, 8192, 1, 256, 256, 256, 256, 8192]
    - [29, 8.022]
  - - [256, 8192, 1, 512, 256, 256, 256, 8192]
    - [105, 10.975]
  - - [256, 8192, 1, 1024, 256, 256, 256, 8192]
    - [82, 14.127]
  - - [256, 8192, 1, 2048, 256, 256, 256, 8192]
    - [105, 17.241]
  - - [256, 8192, 1, 4096, 256, 256, 256, 8192]
    - [79, 21.738]
  - - [256, 8192, 1, 8192, 256, 256, 256, 8192]
    - [2, 24.706]
  - - [512, 128, 1, 128, 512, 512, 512, 128]
    - [41, 0.311]
  - - [512, 128, 1, 256, 512, 512, 512, 128]
    - [41, 0.386]
  - - [512, 128, 1, 512, 512, 512, 512, 128]
    - [117, 0.628]
  - - [512, 128, 1, 1024, 512, 512, 512, 128]
    - [118, 1.018]
  - - [512, 128, 1, 2048, 512, 512, 512, 128]
    - [4, 1.855]
  - - [512, 128, 1, 4096, 512, 512, 512, 128]
    - [98, 2.992]
  - - [512, 128, 1, 8192, 512, 512, 512, 128]
    - [92, 4.213]
  - - [512, 256, 1, 128, 512, 512, 512, 256]
    - [41, 0.604]
  - - [512, 256, 1, 256, 512, 512, 512, 256]
    - [118, 0.738]
  - - [512, 256, 1, 512, 512, 512, 512, 256]
    - [117, 1.33]
  - - [512, 256, 1, 1024, 512, 512, 512, 256]
    - [19, 2.086]
  - - [512, 256, 1, 2048, 512, 512, 512, 256]
    - [40, 3.453]
  - - [512, 256, 1, 4096, 512, 512, 512, 256]
    - [116, 5.204]
  - - [512, 256, 1, 8192, 512, 512, 512, 256]
    - [95, 6.58]
  - - [512, 512, 1, 128, 512, 512, 512, 512]
    - [40, 1.162]
  - - [512, 512, 1, 256, 512, 512, 512, 512]
    - [40, 1.531]
  - - [512, 512, 1, 512, 512, 512, 512, 512]
    - [117, 2.35]
  - - [512, 512, 1, 1024, 512, 512, 512, 512]
    - [113, 3.809]
  - - [512, 512, 1, 2048, 512, 512, 512, 512]
    - [92, 6.143]
  - - [512, 512, 1, 4096, 512, 512, 512, 512]
    - [110, 7.72]
  - - [512, 512, 1, 8192, 512, 512, 512, 512]
    - [85, 10.001]
  - - [512, 1024, 1, 128, 512, 512, 512, 1024]
    - [39, 2.228]
  - - [512, 1024, 1, 256, 512, 512, 512, 1024]
    - [39, 2.826]
  - - [512, 1024, 1, 512, 512, 512, 512, 1024]
    - [115, 4.356]
  - - [512, 1024, 1, 1024, 512, 512, 512, 1024]
    - [115, 6.467]
  - - [512, 1024, 1, 2048, 512, 512, 512, 1024]
    - [86, 9.328]
  - - [512, 1024, 1, 4096, 512, 512, 512, 1024]
    - [60, 11.557]
  - - [512, 1024, 1, 8192, 512, 512, 512, 1024]
    - [82, 14.307]
  - - [512, 2048, 1, 128, 512, 512, 512, 2048]
    - [35, 4.036]
  - - [512, 2048, 1, 256, 512, 512, 512, 2048]
    - [35, 5.056]
  - - [512, 2048, 1, 512, 512, 512, 512, 2048]
    - [108, 7.526]
  - - [512, 2048, 1, 1024, 512, 512, 512, 2048]
    - [86, 10.316]
  - - [512, 2048, 1, 2048, 512, 512, 512, 2048]
    - [82, 13.457]
  - - [512, 2048, 1, 4096, 512, 512, 512, 2048]
    - [84, 15.723]
  - - [512, 2048, 1, 8192, 512, 512, 512, 2048]
    - [75, 20.315]
  - - [512, 4096, 1, 128, 512, 512, 512, 4096]
    - [105, 6.271]
  - - [512, 4096, 1, 256, 512, 512, 512, 4096]
    - [32, 8.04]
  - - [512, 4096, 1, 512, 512, 512, 512, 4096]
    - [105, 11.093]
  - - [512, 4096, 1, 1024, 512, 512, 512, 4096]
    - [105, 14.299]
  - - [512, 4096, 1, 2048, 512, 512, 512, 4096]
    - [75, 17.05]
  - - [512, 4096, 1, 4096, 512, 512, 512, 4096]
    - [78, 21.494]
  - - [512, 4096, 1, 8192, 512, 512, 512, 4096]
    - [76, 24.427]
  - - [512, 8192, 1, 128, 512, 512, 512, 8192]
    - [24, 8.812]
  - - [512, 8192, 1, 256, 512, 512, 512, 8192]
    - [23, 11.902]
  - - [512, 8192, 1, 512, 512, 512, 512, 8192]
    - [99, 14.372]
  - - [512, 8192, 1, 1024, 512, 512, 512, 8192]
    - [79, 17.652]
  - - [512, 8192, 1, 2048, 512, 512, 512, 8192]
    - [79, 22.045]
  - - [512, 8192, 1, 4096, 512, 512, 512, 8192]
    - [55, 26.059]
  - - [512, 8192, 1, 8192, 512, 512, 512, 8192]
    - [7, 27.609]
  - - [1024, 128, 1, 128, 1024, 1024, 1024, 128]
    - [38, 0.583]
  - - [1024, 128, 1, 256, 1024, 1024, 1024, 128]
    - [40, 0.728]
  - - [1024, 128, 1, 512, 1024, 1024, 1024, 128]
    - [118, 1.285]
  - - [1024, 128, 1, 1024, 1024, 1024, 1024, 128]
    - [118, 2.134]
  - - [1024, 128, 1, 2048, 1024, 1024, 1024, 128]
    - [41, 3.222]
  - - [1024, 128, 1, 4096, 1024, 1024, 1024, 128]
    - [16, 4.787]
  - - [1024, 128, 1, 8192, 1024, 1024, 1024, 128]
    - [86, 6.642]
  - - [1024, 256, 1, 128, 1024, 1024, 1024, 256]
    - [40, 1.175]
  - - [1024, 256, 1, 256, 1024, 1024, 1024, 256]
    - [41, 1.515]
  - - [1024, 256, 1, 512, 1024, 1024, 1024, 256]
    - [118, 2.357]
  - - [1024, 256, 1, 1024, 1024, 1024, 1024, 256]
    - [115, 3.81]
  - - [1024, 256, 1, 2048, 1024, 1024, 1024, 256]
    - [113, 5.555]
  - - [1024, 256, 1, 4096, 1024, 1024, 1024, 256]
    - [90, 7.922]
  - - [1024, 256, 1, 8192, 1024, 1024, 1024, 256]
    - [86, 10.335]
  - - [1024, 512, 1, 128, 1024, 1024, 1024, 512]
    - [39, 2.216]
  - - [1024, 512, 1, 256, 1024, 1024, 1024, 512]
    - [39, 2.846]
  - - [1024, 512, 1, 512, 1024, 1024, 1024, 512]
    - [115, 4.313]
  - - [1024, 512, 1, 1024, 1024, 1024, 1024, 512]
    - [94, 6.454]
  - - [1024, 512, 1, 2048, 1024, 1024, 1024, 512]
    - [89, 8.932]
  - - [1024, 512, 1, 4096, 1024, 1024, 1024, 512]
    - [85, 11.336]
  - - [1024, 512, 1, 8192, 1024, 1024, 1024, 512]
    - [81, 13.766]
  - - [1024, 1024, 1, 128, 1024, 1024, 1024, 1024]
    - [33, 4.033]
  - - [1024, 1024, 1, 256, 1024, 1024, 1024, 1024]
    - [35, 4.923]
  - - [1024, 1024, 1, 512, 1024, 1024, 1024, 1024]
    - [109, 7.262]
  - - [1024, 1024, 1, 1024, 1024, 1024, 1024, 1024]
    - [85, 10.307]
  - - [1024, 1024, 1, 2048, 1024, 1024, 1024, 1024]
    - [59, 12.539]
  - - [1024, 1024, 1, 4096, 1024, 1024, 1024, 1024]
    - [82, 15.101]
  - - [1024, 1024, 1, 8192, 1024, 1024, 1024, 1024]
    - [78, 19.775]
  - - [1024, 2048, 1, 128, 1024, 1024, 1024, 2048]
    - [31, 6.337]
  - - [1024, 2048, 1, 256, 1024, 1024, 1024, 2048]
    - [29, 8.148]
  - - [1024, 2048, 1, 512, 1024, 1024, 1024, 2048]
    - [105, 11.0]
  - - [1024, 2048, 1, 1024, 1024, 1024, 1024, 2048]
    - [105, 14.108]
  - - [1024, 2048, 1, 2048, 1024, 1024, 1024, 2048]
    - [58, 16.554]
  - - [1024, 2048, 1, 4096, 1024, 1024, 1024, 2048]
    - [77, 20.979]
  - - [1024, 2048, 1, 8192, 1024, 1024, 1024, 2048]
    - [49, 23.778]
  - - [1024, 4096, 1, 128, 1024, 1024, 1024, 4096]
    - [23, 8.894]
  - - [1024, 4096, 1, 256, 1024, 1024, 1024, 4096]
    - [23, 11.727]
  - - [1024, 4096, 1, 512, 1024, 1024, 1024, 4096]
    - [99, 14.044]
  - - [1024, 4096, 1, 1024, 1024, 1024, 1024, 4096]
    - [75, 17.791]
  - - [1024, 4096, 1, 2048, 1024, 1024, 1024, 4096]
    - [79, 21.765]
  - - [1024, 4096, 1, 4096, 1024, 1024, 1024, 4096]
    - [51, 25.212]
  - - [1024, 4096, 1, 8192, 1024, 1024, 1024, 4096]
    - [64, 26.701]
  - - [1024, 8192, 1, 128, 1024, 1024, 1024, 8192]
    - [23, 10.119]
  - - [1024, 8192, 1, 256, 1024, 1024, 1024, 8192]
    - [20, 12.838]
  - - [1024, 8192, 1, 512, 1024, 1024, 1024, 8192]
    - [75, 16.902]
  - - [1024, 8192, 1, 1024, 1024, 1024, 1024, 8192]
    - [75, 21.743]
  - - [1024, 8192, 1, 2048, 1024, 1024, 1024, 8192]
    - [69, 25.432]
  - - [1024, 8192, 1, 4096, 1024, 1024, 1024, 8192]
    - [47, 27.812]
  - - [1024, 8192, 1, 8192, 1024, 1024, 1024, 8192]
    - [47, 30.882]
  - - [2048, 128, 1, 128, 2048, 2048, 2048, 128]
    - [41, 1.176]
  - - [2048, 128, 1, 256, 2048, 2048, 2048, 128]
    - [40, 1.511]
  - - [2048, 128, 1, 512, 2048, 2048, 2048, 128]
    - [117, 2.34]
  - - [2048, 128, 1, 1024, 2048, 2048, 2048, 128]
    - [115, 3.755]
  - - [2048, 128, 1, 2048, 2048, 2048, 2048, 128]
    - [113, 5.849]
  - - [2048, 128, 1, 4096, 2048, 2048, 2048, 128]
    - [14, 7.963]
  - - [2048, 128, 1, 8192, 2048, 2048, 2048, 128]
    - [87, 10.538]
  - - [2048, 256, 1, 128, 2048, 2048, 2048, 256]
    - [38, 2.104]
  - - [2048, 256, 1, 256, 2048, 2048, 2048, 256]
    - [39, 2.832]
  - - [2048, 256, 1, 512, 2048, 2048, 2048, 256]
    - [113, 4.3]
  - - [2048, 256, 1, 1024, 2048, 2048, 2048, 256]
    - [114, 6.391]
  - - [2048, 256, 1, 2048, 2048, 2048, 2048, 256]
    - [90, 8.977]
  - - [2048, 256, 1, 4096, 2048, 2048, 2048, 256]
    - [10, 11.507]
  - - [2048, 256, 1, 8192, 2048, 2048, 2048, 256]
    - [81, 14.368]
  - - [2048, 512, 1, 128, 2048, 2048, 2048, 512]
    - [37, 3.991]
  - - [2048, 512, 1, 256, 2048, 2048, 2048, 512]
    - [35, 5.044]
  - - [2048, 512, 1, 512, 2048, 2048, 2048, 512]
    - [110, 7.455]
  - - [2048, 512, 1, 1024, 2048, 2048, 2048, 512]
    - [88, 10.215]
  - - [2048, 512, 1, 2048, 2048, 2048, 2048, 512]
    - [61, 12.722]
  - - [2048, 512, 1, 4096, 2048, 2048, 2048, 512]
    - [75, 15.362]
  - - [2048, 512, 1, 8192, 2048, 2048, 2048, 512]
    - [79, 20.03]
  - - [2048, 1024, 1, 128, 2048, 2048, 2048, 1024]
    - [31, 6.337]
  - - [2048, 1024, 1, 256, 2048, 2048, 2048, 1024]
    - [27, 8.138]
  - - [2048, 1024, 1, 512, 2048, 2048, 2048, 1024]
    - [105, 10.932]
  - - [2048, 1024, 1, 1024, 2048, 2048, 2048, 1024]
    - [106, 13.88]
  - - [2048, 1024, 1, 2048, 2048, 2048, 2048, 1024]
    - [57, 16.44]
  - - [2048, 1024, 1, 4096, 2048, 2048, 2048, 1024]
    - [78, 20.966]
  - - [2048, 1024, 1, 8192, 2048, 2048, 2048, 1024]
    - [70, 23.082]
  - - [2048, 2048, 1, 128, 2048, 2048, 2048, 2048]
    - [23, 9.066]
  - - [2048, 2048, 1, 256, 2048, 2048, 2048, 2048]
    - [22, 11.827]
  - - [2048, 2048, 1, 512, 2048, 2048, 2048, 2048]
    - [101, 14.028]
  - - [2048, 2048, 1, 1024, 2048, 2048, 2048, 2048]
    - [79, 17.648]
  - - [2048, 2048, 1, 2048, 2048, 2048, 2048, 2048]
    - [75, 21.713]
  - - [2048, 2048, 1, 4096, 2048, 2048, 2048, 2048]
    - [71, 24.9]
  - - [2048, 2048, 1, 8192, 2048, 2048, 2048, 2048]
    - [45, 27.25]
  - - [2048, 4096, 1, 128, 2048, 2048, 2048, 4096]
    - [23, 10.309]
  - - [2048, 4096, 1, 256, 2048, 2048, 2048, 4096]
    - [20, 12.958]
  - - [2048, 4096, 1, 512, 2048, 2048, 2048, 4096]
    - [75, 16.676]
  - - [2048, 4096, 1, 1024, 2048, 2048, 2048, 4096]
    - [78, 21.287]
  - - [2048, 4096, 1, 2048, 2048, 2048, 2048, 4096]
    - [48, 25.156]
  - - [2048, 4096, 1, 4096, 2048, 2048, 2048, 4096]
    - [44, 27.543]
  - - [2048, 4096, 1, 8192, 2048, 2048, 2048, 4096]
    - [67, 30.852]
  - - [2048, 8192, 1, 128, 2048, 2048, 2048, 8192]
    - [20, 10.536]
  - - [2048, 8192, 1, 256, 2048, 2048, 2048, 8192]
    - [21, 14.222]
  - - [2048, 8192, 1, 512, 2048, 2048, 2048, 8192]
    - [99, 19.66]
  - - [2048, 8192, 1, 1024, 2048, 2048, 2048, 8192]
    - [52, 24.665]
  - - [2048, 8192, 1, 2048, 2048, 2048, 2048, 8192]
    - [46, 26.835]
  - - [2048, 8192, 1, 4096, 2048, 2048, 2048, 8192]
    - [67, 30.674]
  - - [2048, 8192, 1, 8192, 2048, 2048, 2048, 8192]
    - [5, 32.847]
  - - [4096, 128, 1, 128, 4096, 4096, 4096, 128]
    - [39, 2.242]
  - - [4096, 128, 1, 256, 4096, 4096, 4096, 128]
    - [39, 2.855]
  - - [4096, 128, 1, 512, 4096, 4096, 4096, 128]
    - [115, 4.358]
  - - [4096, 128, 1, 1024, 4096, 4096, 4096, 128]
    - [113, 6.499]
  - - [4096, 128, 1, 2048, 4096, 4096, 4096, 128]
    - [111, 9.063]
  - - [4096, 128, 1, 4096, 4096, 4096, 4096, 128]
    - [11, 11.901]
  - - [4096, 128, 1, 8192, 4096, 4096, 4096, 128]
    - [10, 14.686]
  - - [4096, 256, 1, 128, 4096, 4096, 4096, 256]
    - [35, 4.065]
  - - [4096, 256, 1, 256, 4096, 4096, 4096, 256]
    - [35, 5.024]
  - - [4096, 256, 1, 512, 4096, 4096, 4096, 256]
    - [108, 7.485]
  - - [4096, 256, 1, 1024, 4096, 4096, 4096, 256]
    - [112, 10.31]
  - - [4096, 256, 1, 2048, 4096, 4096, 4096, 256]
    - [3, 12.784]
  - - [4096, 256, 1, 4096, 4096, 4096, 4096, 256]
    - [8, 15.968]
  - - [4096, 256, 1, 8192, 4096, 4096, 4096, 256]
    - [78, 20.38]
  - - [4096, 512, 1, 128, 4096, 4096, 4096, 512]
    - [28, 6.317]
  - - [4096, 512, 1, 256, 4096, 4096, 4096, 512]
    - [26, 8.143]
  - - [4096, 512, 1, 512, 4096, 4096, 4096, 512]
    - [106, 10.824]
  - - [4096, 512, 1, 1024, 4096, 4096, 4096, 512]
    - [106, 14.224]
  - - [4096, 512, 1, 2048, 4096, 4096, 4096, 512]
    - [78, 16.68]
  - - [4096, 512, 1, 4096, 4096, 4096, 4096, 512]
    - [79, 21.391]
  - - [4096, 512, 1, 8192, 4096, 4096, 4096, 512]
    - [53, 24.107]
  - - [4096, 1024, 1, 128, 4096, 4096, 4096, 1024]
    - [23, 8.647]
  - - [4096, 1024, 1, 256, 4096, 4096, 4096, 1024]
    - [24, 11.841]
  - - [4096, 1024, 1, 512, 4096, 4096, 4096, 1024]
    - [102, 13.95]
  - - [4096, 1024, 1, 1024, 4096, 4096, 4096, 1024]
    - [80, 17.363]
  - - [4096, 1024, 1, 2048, 4096, 4096, 4096, 1024]
    - [75, 21.559]
  - - [4096, 1024, 1, 4096, 4096, 4096, 4096, 1024]
    - [54, 24.729]
  - - [4096, 1024, 1, 8192, 4096, 4096, 4096, 1024]
    - [45, 26.783]
  - - [4096, 2048, 1, 128, 4096, 4096, 4096, 2048]
    - [24, 9.664]
  - - [4096, 2048, 1, 256, 4096, 4096, 4096, 2048]
    - [22, 13.06]
  - - [4096, 2048, 1, 512, 4096, 4096, 4096, 2048]
    - [79, 16.194]
  - - [4096, 2048, 1, 1024, 4096, 4096, 4096, 2048]
    - [79, 21.297]
  - - [4096, 2048, 1, 2048, 4096, 4096, 4096, 2048]
    - [74, 25.127]
  - - [4096, 2048, 1, 4096, 4096, 4096, 4096, 2048]
    - [45, 27.485]
  - - [4096, 2048, 1, 8192, 4096, 4096, 4096, 2048]
    - [67, 30.707]
  - - [4096, 4096, 1, 128, 4096, 4096, 4096, 4096]
    - [21, 10.457]
  - - [4096, 4096, 1, 256, 4096, 4096, 4096, 4096]
    - [20, 14.094]
  - - [4096, 4096, 1, 512, 4096, 4096, 4096, 4096]
    - [52, 19.32]
  - - [4096, 4096, 1, 1024, 4096, 4096, 4096, 4096]
    - [55, 23.911]
  - - [4096, 4096, 1, 2048, 4096, 4096, 4096, 4096]
    - [69, 27.318]
  - - [4096, 4096, 1, 4096, 4096, 4096, 4096, 4096]
    - [43, 30.722]
  - - [4096, 4096, 1, 8192, 4096, 4096, 4096, 4096]
    - [63, 33.444]
  - - [4096, 8192, 1, 128, 4096, 4096, 4096, 8192]
    - [23, 11.667]
  - - [4096, 8192, 1, 256, 4096, 4096, 4096, 8192]
    - [100, 16.234]
  - - [4096, 8192, 1, 512, 4096, 4096, 4096, 8192]
    - [68, 21.225]
  - - [4096, 8192, 1, 1024, 4096, 4096, 4096, 8192]
    - [43, 26.16]
  - - [4096, 8192, 1, 2048, 4096, 4096, 4096, 8192]
    - [45, 31.08]
  - - [4096, 8192, 1, 4096, 4096, 4096, 4096, 8192]
    - [43, 34.53]
  - - [4096, 8192, 1, 8192, 4096, 4096, 4096, 8192]
    - [43, 36.809]
  - - [8192, 128, 1, 128, 8192, 8192, 8192, 128]
    - [35, 4.038]
  - - [8192, 128, 1, 256, 8192, 8192, 8192, 128]
    - [35, 5.037]
  - - [8192, 128, 1, 512, 8192, 8192, 8192, 128]
    - [110, 7.423]
  - - [8192, 128, 1, 1024, 8192, 8192, 8192, 128]
    - [87, 10.176]
  - - [8192, 128, 1, 2048, 8192, 8192, 8192, 128]
    - [12, 12.669]
  - - [8192, 128, 1, 4096, 8192, 8192, 8192, 128]
    - [11, 15.995]
  - - [8192, 128, 1, 8192, 8192, 8192, 8192, 128]
    - [9, 20.474]
  - - [8192, 256, 1, 128, 8192, 8192, 8192, 256]
    - [30, 6.317]
  - - [8192, 256, 1, 256, 8192, 8192, 8192, 256]
    - [25, 7.739]
  - - [8192, 256, 1, 512, 8192, 8192, 8192, 256]
    - [106, 10.85]
  - - [8192, 256, 1, 1024, 8192, 8192, 8192, 256]
    - [107, 14.122]
  - - [8192, 256, 1, 2048, 8192, 8192, 8192, 256]
    - [8, 16.864]
  - - [8192, 256, 1, 4096, 8192, 8192, 8192, 256]
    - [75, 21.546]
  - - [8192, 256, 1, 8192, 8192, 8192, 8192, 256]
    - [1, 24.331]
  - - [8192, 512, 1, 128, 8192, 8192, 8192, 512]
    - [103, 8.569]
  - - [8192, 512, 1, 256, 8192, 8192, 8192, 512]
    - [24, 11.126]
  - - [8192, 512, 1, 512, 8192, 8192, 8192, 512]
    - [101, 14.184]
  - - [8192, 512, 1, 1024, 8192, 8192, 8192, 512]
    - [78, 17.733]
  - - [8192, 512, 1, 2048, 8192, 8192, 8192, 512]
    - [20, 21.367]
  - - [8192, 512, 1, 4096, 8192, 8192, 8192, 512]
    - [54, 25.331]
  - - [8192, 512, 1, 8192, 8192, 8192, 8192, 512]
    - [49, 27.549]
  - - [8192, 1024, 1, 128, 8192, 8192, 8192, 1024]
    - [102, 9.505]
  - - [8192, 1024, 1, 256, 8192, 8192, 8192, 1024]
    - [102, 12.512]
  - - [8192, 1024, 1, 512, 8192, 8192, 8192, 1024]
    - [80, 16.589]
  - - [8192, 1024, 1, 1024, 8192, 8192, 8192, 1024]
    - [79, 21.256]
  - - [8192, 1024, 1, 2048, 8192, 8192, 8192, 1024]
    - [69, 25.741]
  - - [8192, 1024, 1, 4096, 8192, 8192, 8192, 1024]
    - [45, 27.723]
  - - [8192, 1024, 1, 8192, 8192, 8192, 8192, 1024]
    - [0, 30.853]
  - - [8192, 2048, 1, 128, 8192, 8192, 8192, 2048]
    - [20, 10.3]
  - - [8192, 2048, 1, 256, 8192, 8192, 8192, 2048]
    - [102, 13.845]
  - - [8192, 2048, 1, 512, 8192, 8192, 8192, 2048]
    - [72, 19.279]
  - - [8192, 2048, 1, 1024, 8192, 8192, 8192, 2048]
    - [52, 24.324]
  - - [8192, 2048, 1, 2048, 8192, 8192, 8192, 2048]
    - [73, 27.254]
  - - [8192, 2048, 1, 4096, 8192, 8192, 8192, 2048]
    - [46, 30.319]
  - - [8192, 2048, 1, 8192, 8192, 8192, 8192, 2048]
    - [43, 33.935]
  - - [8192, 4096, 1, 128, 8192, 8192, 8192, 4096]
    - [20, 11.321]
  - - [8192, 4096, 1, 256, 8192, 8192, 8192, 4096]
    - [79, 15.945]
  - - [8192, 4096, 1, 512, 8192, 8192, 8192, 4096]
    - [71, 21.237]
  - - [8192, 4096, 1, 1024, 8192, 8192, 8192, 4096]
    - [43, 25.981]
  - - [8192, 4096, 1, 2048, 8192, 8192, 8192, 4096]
    - [66, 30.726]
  - - [8192, 4096, 1, 4096, 8192, 8192, 8192, 4096]
    - [47, 34.266]
  - - [8192, 4096, 1, 8192, 8192, 8192, 8192, 4096]
    - [45, 36.648]
  - - [8192, 8192, 1, 128, 8192, 8192, 8192, 8192]
    - [6, 12.227]
  - - [8192, 8192, 1, 256, 8192, 8192, 8192, 8192]
    - [56, 16.279]
  - - [8192, 8192, 1, 512, 8192, 8192, 8192, 8192]
    - [50, 21.669]
  - - [8192, 8192, 1, 1024, 8192, 8192, 8192, 8192]
    - [65, 27.967]
  - - [8192, 8192, 1, 2048, 8192, 8192, 8192, 8192]
    - [45, 34.704]
  - - [8192, 8192, 1, 4096, 8192, 8192, 8192, 8192]
    - [45, 38.171]
  - - [8192, 8192, 1, 8192, 8192, 8192, 8192, 8192]
    - [66, 39.649]
  - - [1, 1, 1, 32, 1, 1, 1, 1]
    - [119, 0.0]
- null
- null
- DeviceEfficiency
- GridBased
