library/src/amd_detail/rocblaslt/src/Tensile/Logic/streamk/gfx942/aquavanjaram942_Cijk_Ailk_Bljk_HHS_BH_UserArgs.yaml
- {MinimumRequiredVersion: 4.33.0}
- aquavanjaram942
- gfx942
- [Device 0049, Device 0050]
    SolutionIndex: 0
    SolutionNameMin: Cijk_Ailk_Bljk_HHS_BH_UserArgs_MT32x32x32_MI16x16x1_SN_LDSB0_CLR1_GSU0_GSUC0_GSUWGMRR0_K1_LBSPPA256_LBSPPB128_LPA16_MIWT1_1_PLR1_SU32_SUM0_SUS256_SKXCCM0_VWA1_VWB1_WGM1_WGMXCC1_WGMXCCGn1
    SolutionIndex: 1
    SolutionNameMin: Cijk_Ailk_Bljk_HHS_BH_UserArgs_MT32x32x32_MI16x16x1_SN_LDSB0_CLR0_GSU0_GSUC0_GSUWGMRR0_K1_LBSPPA256_LBSPPB128_LPA16_MIWT1_1_PLR0_SU32_SUM0_SUS256_SKXCCM0_VWA1_VWB1_WGM1_WGMXCC1_WGMXCCGn1
    SolutionIndex: 2
    SolutionNameMin: Cijk_Ailk_Bljk_HHS_BH_UserArgs_MT128x256x64_MI16x16x1_SN_LDSB1_CLR1_GSU0_GSUC0_GSUWGMRR0_K1_LBSPPA2048_LBSPPB512_LPA0_MIWT4_8_PLR1_SU32_SUM0_SUS256_SKXCCM0_VWA4_VWB4_WGM4_WGMXCC1_WGMXCCGn1
    SolutionIndex: 3
    SolutionNameMin: Cijk_Ailk_Bljk_HHS_BH_UserArgs_MT256x128x64_MI16x16x1_SN_LDSB1_CLR1_GSU0_GSUC0_GSUWGMRR0_K1_LBSPPA4096_LBSPPB128_LPA0_MIWT8_4_PLR1_SU32_SUM0_SUS256_SKXCCM0_VWA4_VWB1_WGM1_WGMXCC1_WGMXCCGn1
    SolutionIndex: 4
    SolutionNameMin: Cijk_Ailk_Bljk_HHS_BH_UserArgs_MT256x128x64_MI16x16x1_SN_LDSB1_CLR1_GSU0_GSUC0_GSUWGMRR0_K1_LBSPPA4096_LBSPPB512_LPA0_MIWT8_4_PLR1_SU32_SUM0_SUS256_SKXCCM0_VWA4_VWB4_WGM1_WGMXCC1_WGMXCCGn1
    SolutionIndex: 5
    SolutionNameMin: Cijk_Ailk_Bljk_HHS_BH_UserArgs_MT256x128x64_MI16x16x1_SN_LDSB1_CLR1_GSU0_GSUC0_GSUWGMRR0_K1_LBSPPA4096_LBSPPB128_LPA0_MIWT8_4_PLR1_SU32_SUM0_SUS256_SKXCCM0_VWA4_VWB1_WGM4_WGMXCC1_WGMXCCGn1
    SolutionIndex: 6
    SolutionNameMin: Cijk_Ailk_Bljk_HHS_BH_UserArgs_MT256x128x64_MI16x16x1_SN_LDSB1_CLR1_GSU0_GSUC0_GSUWGMRR0_K1_LBSPPA4096_LBSPPB512_LPA0_MIWT8_4_PLR1_SU32_SUM0_SUS256_SKXCCM0_VWA4_VWB4_WGM8_WGMXCC1_WGMXCCGn1
    SolutionIndex: 7
    SolutionNameMin: Cijk_Ailk_Bljk_HHS_BH_UserArgs_MT128x128x64_MI16x16x1_SN_LDSB1_CLR1_GSU0_GSUC0_GSUWGMRR0_K1_LBSPPA2048_LBSPPB128_LPA0_MIWT4_4_PLR1_SU32_SUM0_SUS256_SKXCCM0_VWA4_VWB1_WGM1_WGMXCC1_WGMXCCGn1
    SolutionIndex: 8
    SolutionNameMin: Cijk_Ailk_Bljk_HHS_BH_UserArgs_MT128x128x64_MI16x16x1_SN_LDSB1_CLR1_GSU0_GSUC0_GSUWGMRR0_K1_LBSPPA2048_LBSPPB256_LPA0_MIWT4_4_PLR1_SU32_SUM0_SUS256_SKXCCM0_VWA4_VWB2_WGM1_WGMXCC1_WGMXCCGn1
    SolutionIndex: 9
    SolutionNameMin: Cijk_Ailk_Bljk_HHS_BH_UserArgs_MT128x128x64_MI16x16x1_SN_LDSB1_CLR1_GSU0_GSUC0_GSUWGMRR0_K1_LBSPPA2048_LBSPPB512_LPA0_MIWT4_4_PLR1_SU32_SUM0_SUS256_SKXCCM0_VWA4_VWB4_WGM1_WGMXCC1_WGMXCCGn1
    SolutionIndex: 10
    SolutionNameMin: Cijk_Ailk_Bljk_HHS_BH_UserArgs_MT128x128x64_MI16x16x1_SN_LDSB1_CLR1_GSU0_GSUC0_GSUWGMRR0_K1_LBSPPA2048_LBSPPB512_LPA0_MIWT4_4_PLR1_SU32_SUM0_SUS256_SKXCCM0_VWA4_VWB4_WGM4_WGMXCC1_WGMXCCGn1
    SolutionIndex: 11
    SolutionNameMin: Cijk_Ailk_Bljk_HHS_BH_UserArgs_MT128x128x64_MI16x16x1_SN_LDSB1_CLR1_GSU0_GSUC0_GSUWGMRR0_K1_LBSPPA2048_LBSPPB128_LPA0_MIWT4_4_PLR1_SU32_SUM0_SUS256_SKXCCM0_VWA4_VWB1_WGM8_WGMXCC1_WGMXCCGn1
    SolutionIndex: 12
    SolutionNameMin: Cijk_Ailk_Bljk_HHS_BH_UserArgs_MT64x128x64_MI16x16x1_SN_LDSB1_CLR1_GSU0_GSUC0_GSUWGMRR0_K1_LBSPPA1024_LBSPPB256_LPA32_MIWT2_4_PLR1_SU32_SUM0_SUS256_SKXCCM0_VWA2_VWB2_WGM1_WGMXCC1_WGMXCCGn1
    SolutionIndex: 13
    SolutionNameMin: Cijk_Ailk_Bljk_HHS_BH_UserArgs_MT64x64x64_MI16x16x1_SN_LDSB1_CLR1_GSU0_GSUC0_GSUWGMRR0_K1_LBSPPA1024_LBSPPB128_LPA32_MIWT2_2_PLR2_SU32_SUM0_SUS256_SKXCCM0_VWA2_VWB1_WGM1_WGMXCC1_WGMXCCGn1
    SolutionIndex: 14
    SolutionNameMin: Cijk_Ailk_Bljk_HHS_BH_UserArgs_MT32x32x64_MI16x16x1_SN_LDSB0_CLR1_GSU0_GSUC0_GSUWGMRR0_K1_LBSPPA512_LBSPPB128_LPA16_MIWT1_1_PLR1_SU32_SUM0_SUS256_SKXCCM0_VWA1_VWB1_WGM1_WGMXCC1_WGMXCCGn1
    SolutionIndex: 15
    SolutionNameMin: Cijk_Ailk_Bljk_HHS_BH_UserArgs_MT64x128x128_MI16x16x1_SN_LDSB1_CLR1_GSU0_GSUC0_GSUWGMRR0_K1_LBSPPA1024_LBSPPB1024_LPA32_MIWT2_4_PLR1_SU32_SUM0_SUS256_SKXCCM0_VWA2_VWB4_WGM1_WGMXCC1_WGMXCCGn1
    SolutionIndex: 16
    SolutionNameMin: Cijk_Ailk_Bljk_HHS_BH_UserArgs_MT64x128x128_MI16x16x1_SN_LDSB1_CLR1_GSU0_GSUC0_GSUWGMRR0_K1_LBSPPA1024_LBSPPB512_LPA32_MIWT2_4_PLR2_SU32_SUM0_SUS256_SKXCCM0_VWA2_VWB2_WGM8_WGMXCC1_WGMXCCGn1
    SolutionIndex: 17
    SolutionNameMin: Cijk_Ailk_Bljk_HHS_BH_UserArgs_MT128x64x128_MI16x16x1_SN_LDSB1_CLR1_GSU0_GSUC0_GSUWGMRR0_K1_LBSPPA2048_LBSPPB256_LPA0_MIWT4_2_PLR1_SU32_SUM0_SUS256_SKXCCM0_VWA4_VWB1_WGM1_WGMXCC1_WGMXCCGn1
    SolutionIndex: 18
    SolutionNameMin: Cijk_Ailk_Bljk_HHS_BH_UserArgs_MT128x64x128_MI16x16x1_SN_LDSB1_CLR1_GSU0_GSUC0_GSUWGMRR0_K1_LBSPPA2048_LBSPPB256_LPA0_MIWT4_2_PLR2_SU32_SUM0_SUS256_SKXCCM0_VWA4_VWB1_WGM1_WGMXCC1_WGMXCCGn1
    SolutionIndex: 19
    SolutionNameMin: Cijk_Ailk_Bljk_HHS_BH_UserArgs_MT128x64x128_MI16x16x1_SN_LDSB1_CLR1_GSU0_GSUC0_GSUWGMRR0_K1_LBSPPA2048_LBSPPB256_LPA0_MIWT4_2_PLR1_SU32_SUM0_SUS256_SKXCCM0_VWA4_VWB1_WGM4_WGMXCC1_WGMXCCGn1
    SolutionIndex: 20
    SolutionNameMin: Cijk_Ailk_Bljk_HHS_BH_UserArgs_MT128x64x128_MI16x16x1_SN_LDSB1_CLR1_GSU0_GSUC0_GSUWGMRR0_K1_LBSPPA2048_LBSPPB256_LPA0_MIWT4_2_PLR2_SU32_SUM0_SUS256_SKXCCM0_VWA4_VWB1_WGM4_WGMXCC1_WGMXCCGn1
    SolutionIndex: 21
    SolutionNameMin: Cijk_Ailk_Bljk_HHS_BH_UserArgs_MT128x64x128_MI16x16x1_SN_LDSB1_CLR1_GSU0_GSUC0_GSUWGMRR0_K1_LBSPPA2048_LBSPPB256_LPA0_MIWT4_2_PLR1_SU32_SUM0_SUS256_SKXCCM0_VWA4_VWB1_WGM8_WGMXCC1_WGMXCCGn1
    SolutionIndex: 22
    SolutionNameMin: Cijk_Ailk_Bljk_HHS_BH_UserArgs_MT128x64x128_MI16x16x1_SN_LDSB1_CLR1_GSU0_GSUC0_GSUWGMRR0_K1_LBSPPA2048_LBSPPB512_LPA0_MIWT4_2_PLR1_SU32_SUM0_SUS256_SKXCCM0_VWA4_VWB2_WGM8_WGMXCC1_WGMXCCGn1
    SolutionIndex: 23
    SolutionNameMin: Cijk_Ailk_Bljk_HHS_BH_UserArgs_MT128x64x128_MI16x16x1_SN_LDSB1_CLR1_GSU0_GSUC0_GSUWGMRR0_K1_LBSPPA2048_LBSPPB256_LPA0_MIWT4_2_PLR2_SU32_SUM0_SUS256_SKXCCM0_VWA4_VWB1_WGM8_WGMXCC1_WGMXCCGn1
    SolutionIndex: 24
    SolutionNameMin: Cijk_Ailk_Bljk_HHS_BH_UserArgs_MT128x64x128_MI16x16x1_SN_LDSB1_CLR1_GSU0_GSUC0_GSUWGMRR0_K1_LBSPPA2048_LBSPPB512_LPA0_MIWT4_2_PLR2_SU32_SUM0_SUS256_SKXCCM0_VWA4_VWB2_WGM8_WGMXCC1_WGMXCCGn1
    SolutionIndex: 25
    SolutionNameMin: Cijk_Ailk_Bljk_HHS_BH_UserArgs_MT64x64x128_MI16x16x1_SN_LDSB1_CLR1_GSU0_GSUC0_GSUWGMRR0_K1_LBSPPA1024_LBSPPB256_LPA32_MIWT2_2_PLR2_SU32_SUM0_SUS256_SKXCCM0_VWA2_VWB1_WGM1_WGMXCC1_WGMXCCGn1
    SolutionIndex: 26
    SolutionNameMin: Cijk_Ailk_Bljk_HHS_BH_UserArgs_MT64x64x128_MI16x16x1_SN_LDSB1_CLR1_GSU0_GSUC0_GSUWGMRR0_K1_LBSPPA1024_LBSPPB512_LPA32_MIWT2_2_PLR2_SU32_SUM0_SUS256_SKXCCM0_VWA2_VWB2_WGM1_WGMXCC1_WGMXCCGn1
    SolutionIndex: 27
    SolutionNameMin: Cijk_Ailk_Bljk_HHS_BH_UserArgs_MT64x64x128_MI16x16x1_SN_LDSB1_CLR1_GSU0_GSUC0_GSUWGMRR0_K1_LBSPPA1024_LBSPPB256_LPA32_MIWT2_2_PLR1_SU32_SUM0_SUS256_SKXCCM0_VWA2_VWB1_WGM4_WGMXCC1_WGMXCCGn1
    SolutionIndex: 28
    SolutionNameMin: Cijk_Ailk_Bljk_HHS_BH_UserArgs_MT64x64x128_MI16x16x1_SN_LDSB1_CLR1_GSU0_GSUC0_GSUWGMRR0_K1_LBSPPA1024_LBSPPB512_LPA32_MIWT2_2_PLR2_SU32_SUM0_SUS256_SKXCCM0_VWA2_VWB2_WGM4_WGMXCC1_WGMXCCGn1
    SolutionIndex: 29
    SolutionNameMin: Cijk_Ailk_Bljk_HHS_BH_UserArgs_MT64x32x128_MI16x16x1_SN_LDSB1_CLR1_GSU0_GSUC0_GSUWGMRR0_K1_LBSPPA1024_LBSPPB256_LPA32_MIWT2_1_PLR2_SU32_SUM0_SUS256_SKXCCM0_VWA2_VWB1_WGM1_WGMXCC1_WGMXCCGn1
    SolutionIndex: 30
    SolutionNameMin: Cijk_Ailk_Bljk_HHS_BH_UserArgs_MT32x32x128_MI16x16x1_SN_LDSB1_CLR1_GSU0_GSUC0_GSUWGMRR0_K1_LBSPPA512_LBSPPB256_LPA16_MIWT1_1_PLR1_SU32_SUM0_SUS256_SKXCCM0_VWA1_VWB1_WGM1_WGMXCC1_WGMXCCGn1
    SolutionIndex: 31
    SolutionNameMin: Cijk_Ailk_Bljk_HHS_BH_UserArgs_MT32x32x128_MI16x16x1_SN_LDSB1_CLR1_GSU0_GSUC0_GSUWGMRR0_K1_LBSPPA512_LBSPPB256_LPA16_MIWT1_1_PLR2_SU32_SUM0_SUS256_SKXCCM0_VWA1_VWB1_WGM1_WGMXCC1_WGMXCCGn1
    SolutionIndex: 32
    SolutionNameMin: Cijk_Ailk_Bljk_HHS_BH_UserArgs_MT256x256x32_MI16x16x1_SN_LDSB1_CLR1_GSU0_GSUC0_GSUWGMRR0_K1_LBSPPA2048_LBSPPB128_LPA0_MIWT8_8_PLR1_SU32_SUM0_SUS256_SKXCCM8_VWA4_VWB1_WGM1_WGMXCC1_WGMXCCGn1
    SolutionIndex: 33
    SolutionNameMin: Cijk_Ailk_Bljk_HHS_BH_UserArgs_MT256x256x32_MI16x16x1_SN_LDSB1_CLR1_GSU0_GSUC0_GSUWGMRR0_K1_LBSPPA2048_LBSPPB128_LPA0_MIWT8_8_PLR1_SU32_SUM0_SUS256_SKXCCM8_VWA4_VWB2_WGM1_WGMXCC1_WGMXCCGn1
    SolutionIndex: 34
    SolutionNameMin: Cijk_Ailk_Bljk_HHS_BH_UserArgs_MT256x256x32_MI16x16x1_SN_LDSB1_CLR1_GSU0_GSUC0_GSUWGMRR0_K1_LBSPPA2048_LBSPPB256_LPA0_MIWT8_8_PLR1_SU32_SUM0_SUS256_SKXCCM8_VWA4_VWB4_WGM1_WGMXCC1_WGMXCCGn1
    SolutionIndex: 35
    SolutionNameMin: Cijk_Ailk_Bljk_HHS_BH_UserArgs_MT256x256x32_MI16x16x1_SN_LDSB1_CLR1_GSU0_GSUC0_GSUWGMRR0_K1_LBSPPA2048_LBSPPB512_LPA0_MIWT8_8_PLR1_SU32_SUM0_SUS256_SKXCCM8_VWA4_VWB8_WGM1_WGMXCC1_WGMXCCGn1
    SolutionIndex: 36
    SolutionNameMin: Cijk_Ailk_Bljk_HHS_BH_UserArgs_MT256x256x32_MI16x16x1_SN_LDSB1_CLR1_GSU0_GSUC0_GSUWGMRR0_K1_LBSPPA2048_LBSPPB128_LPA0_MIWT8_8_PLR1_SU32_SUM0_SUS256_SKXCCM8_VWA4_VWB1_WGM4_WGMXCC1_WGMXCCGn1
    SolutionIndex: 37
    SolutionNameMin: Cijk_Ailk_Bljk_HHS_BH_UserArgs_MT256x256x32_MI16x16x1_SN_LDSB1_CLR1_GSU0_GSUC0_GSUWGMRR0_K1_LBSPPA2048_LBSPPB256_LPA0_MIWT8_8_PLR1_SU32_SUM0_SUS256_SKXCCM8_VWA4_VWB4_WGM4_WGMXCC1_WGMXCCGn1
    SolutionIndex: 38
    SolutionNameMin: Cijk_Ailk_Bljk_HHS_BH_UserArgs_MT256x256x32_MI16x16x1_SN_LDSB1_CLR1_GSU0_GSUC0_GSUWGMRR0_K1_LBSPPA2048_LBSPPB512_LPA0_MIWT8_8_PLR1_SU32_SUM0_SUS256_SKXCCM8_VWA4_VWB8_WGM4_WGMXCC1_WGMXCCGn1
    SolutionIndex: 39
    SolutionNameMin: Cijk_Ailk_Bljk_HHS_BH_UserArgs_MT256x256x32_MI16x16x1_SN_LDSB1_CLR1_GSU0_GSUC0_GSUWGMRR0_K1_LBSPPA2048_LBSPPB128_LPA0_MIWT8_8_PLR1_SU32_SUM0_SUS256_SKXCCM8_VWA4_VWB1_WGM8_WGMXCC1_WGMXCCGn1
    SolutionIndex: 40
    SolutionNameMin: Cijk_Ailk_Bljk_HHS_BH_UserArgs_MT256x256x32_MI16x16x1_SN_LDSB1_CLR1_GSU0_GSUC0_GSUWGMRR0_K1_LBSPPA2048_LBSPPB256_LPA0_MIWT8_8_PLR1_SU32_SUM0_SUS256_SKXCCM8_VWA4_VWB4_WGM8_WGMXCC1_WGMXCCGn1
    SolutionIndex: 41
    SolutionNameMin: Cijk_Ailk_Bljk_HHS_BH_UserArgs_MT256x256x32_MI16x16x1_SN_LDSB1_CLR1_GSU0_GSUC0_GSUWGMRR0_K1_LBSPPA2048_LBSPPB512_LPA0_MIWT8_8_PLR1_SU32_SUM0_SUS256_SKXCCM8_VWA4_VWB8_WGM8_WGMXCC1_WGMXCCGn1
    SolutionIndex: 42
    SolutionNameMin: Cijk_Ailk_Bljk_HHS_BH_UserArgs_MT128x256x32_MI16x16x1_SN_LDSB1_CLR1_GSU0_GSUC0_GSUWGMRR0_K1_LBSPPA1024_LBSPPB128_LPA0_MIWT4_8_PLR1_SU32_SUM0_SUS256_SKXCCM8_VWA4_VWB1_WGM4_WGMXCC1_WGMXCCGn1
    SolutionIndex: 43
    SolutionNameMin: Cijk_Ailk_Bljk_HHS_BH_UserArgs_MT256x128x32_MI16x16x1_SN_LDSB1_CLR1_GSU0_GSUC0_GSUWGMRR0_K1_LBSPPA2048_LBSPPB128_LPA0_MIWT8_4_PLR1_SU32_SUM0_SUS256_SKXCCM8_VWA4_VWB2_WGM4_WGMXCC1_WGMXCCGn1
    SolutionIndex: 44
    SolutionNameMin: Cijk_Ailk_Bljk_HHS_BH_UserArgs_MT256x128x32_MI16x16x1_SN_LDSB1_CLR1_GSU0_GSUC0_GSUWGMRR0_K1_LBSPPA2048_LBSPPB128_LPA0_MIWT8_4_PLR1_SU32_SUM0_SUS256_SKXCCM8_VWA4_VWB1_WGM8_WGMXCC1_WGMXCCGn1
    SolutionIndex: 45
    SolutionNameMin: Cijk_Ailk_Bljk_HHS_BH_UserArgs_MT32x32x32_MI16x16x1_SN_LDSB0_CLR1_GSU0_GSUC0_GSUWGMRR0_K1_LBSPPA256_LBSPPB128_LPA16_MIWT1_1_PLR1_SU32_SUM0_SUS256_SKXCCM8_VWA1_VWB1_WGM1_WGMXCC1_WGMXCCGn1
    SolutionIndex: 46
    SolutionNameMin: Cijk_Ailk_Bljk_HHS_BH_UserArgs_MT128x256x64_MI16x16x1_SN_LDSB1_CLR1_GSU0_GSUC0_GSUWGMRR0_K1_LBSPPA2048_LBSPPB128_LPA0_MIWT4_8_PLR1_SU32_SUM0_SUS256_SKXCCM8_VWA4_VWB1_WGM1_WGMXCC1_WGMXCCGn1
    SolutionIndex: 47
    SolutionNameMin: Cijk_Ailk_Bljk_HHS_BH_UserArgs_MT128x256x64_MI16x16x1_SN_LDSB1_CLR1_GSU0_GSUC0_GSUWGMRR0_K1_LBSPPA2048_LBSPPB256_LPA0_MIWT4_8_PLR1_SU32_SUM0_SUS256_SKXCCM8_VWA4_VWB2_WGM1_WGMXCC1_WGMXCCGn1
    SolutionIndex: 48
    SolutionNameMin: Cijk_Ailk_Bljk_HHS_BH_UserArgs_MT128x256x64_MI16x16x1_SN_LDSB1_CLR1_GSU0_GSUC0_GSUWGMRR0_K1_LBSPPA2048_LBSPPB512_LPA16_MIWT4_8_PLR1_SU32_SUM0_SUS256_SKXCCM8_VWA1_VWB4_WGM1_WGMXCC1_WGMXCCGn1
    SolutionIndex: 49
    SolutionNameMin: Cijk_Ailk_Bljk_HHS_BH_UserArgs_MT128x256x64_MI16x16x1_SN_LDSB1_CLR1_GSU0_GSUC0_GSUWGMRR0_K1_LBSPPA2048_LBSPPB512_LPA0_MIWT4_8_PLR1_SU32_SUM0_SUS256_SKXCCM8_VWA4_VWB4_WGM1_WGMXCC1_WGMXCCGn1
    SolutionIndex: 50
    SolutionNameMin: Cijk_Ailk_Bljk_HHS_BH_UserArgs_MT128x256x64_MI16x16x1_SN_LDSB1_CLR1_GSU0_GSUC0_GSUWGMRR0_K1_LBSPPA2048_LBSPPB1024_LPA0_MIWT4_8_PLR1_SU32_SUM0_SUS256_SKXCCM8_VWA4_VWB8_WGM1_WGMXCC1_WGMXCCGn1
    SolutionIndex: 51
    SolutionNameMin: Cijk_Ailk_Bljk_HHS_BH_UserArgs_MT128x256x64_MI16x16x1_SN_LDSB1_CLR1_GSU0_GSUC0_GSUWGMRR0_K1_LBSPPA2048_LBSPPB128_LPA0_MIWT4_8_PLR1_SU32_SUM0_SUS256_SKXCCM8_VWA4_VWB1_WGM4_WGMXCC1_WGMXCCGn1
    SolutionIndex: 52
    SolutionNameMin: Cijk_Ailk_Bljk_HHS_BH_UserArgs_MT128x256x64_MI16x16x1_SN_LDSB1_CLR1_GSU0_GSUC0_GSUWGMRR0_K1_LBSPPA2048_LBSPPB512_LPA0_MIWT4_8_PLR1_SU32_SUM0_SUS256_SKXCCM8_VWA4_VWB4_WGM4_WGMXCC1_WGMXCCGn1
    SolutionIndex: 53
    SolutionNameMin: Cijk_Ailk_Bljk_HHS_BH_UserArgs_MT256x128x64_MI16x16x1_SN_LDSB1_CLR1_GSU0_GSUC0_GSUWGMRR0_K1_LBSPPA4096_LBSPPB128_LPA0_MIWT8_4_PLR1_SU32_SUM0_SUS256_SKXCCM8_VWA4_VWB1_WGM8_WGMXCC1_WGMXCCGn1
    SolutionIndex: 54
    SolutionNameMin: Cijk_Ailk_Bljk_HHS_BH_UserArgs_MT128x128x64_MI16x16x1_SN_LDSB1_CLR1_GSU0_GSUC0_GSUWGMRR0_K1_LBSPPA2048_LBSPPB128_LPA32_MIWT4_4_PLR1_SU32_SUM0_SUS256_SKXCCM8_VWA2_VWB1_WGM1_WGMXCC1_WGMXCCGn1
    SolutionIndex: 55
    SolutionNameMin: Cijk_Ailk_Bljk_HHS_BH_UserArgs_MT128x128x64_MI16x16x1_SN_LDSB1_CLR1_GSU0_GSUC0_GSUWGMRR0_K1_LBSPPA2048_LBSPPB128_LPA0_MIWT4_4_PLR1_SU32_SUM0_SUS256_SKXCCM8_VWA4_VWB1_WGM1_WGMXCC1_WGMXCCGn1
    SolutionIndex: 56
    SolutionNameMin: Cijk_Ailk_Bljk_HHS_BH_UserArgs_MT128x128x64_MI16x16x1_SN_LDSB1_CLR1_GSU0_GSUC0_GSUWGMRR0_K1_LBSPPA2048_LBSPPB256_LPA32_MIWT4_4_PLR1_SU32_SUM0_SUS256_SKXCCM8_VWA2_VWB2_WGM1_WGMXCC1_WGMXCCGn1
    SolutionIndex: 57
    SolutionNameMin: Cijk_Ailk_Bljk_HHS_BH_UserArgs_MT128x128x64_MI16x16x1_SN_LDSB1_CLR1_GSU0_GSUC0_GSUWGMRR0_K1_LBSPPA2048_LBSPPB256_LPA0_MIWT4_4_PLR1_SU32_SUM0_SUS256_SKXCCM8_VWA4_VWB2_WGM1_WGMXCC1_WGMXCCGn1
    SolutionIndex: 58
    SolutionNameMin: Cijk_Ailk_Bljk_HHS_BH_UserArgs_MT128x128x64_MI16x16x1_SN_LDSB1_CLR1_GSU0_GSUC0_GSUWGMRR0_K1_LBSPPA2048_LBSPPB512_LPA0_MIWT4_4_PLR1_SU32_SUM0_SUS256_SKXCCM8_VWA4_VWB4_WGM1_WGMXCC1_WGMXCCGn1
    SolutionIndex: 59
    SolutionNameMin: Cijk_Ailk_Bljk_HHS_BH_UserArgs_MT128x128x64_MI16x16x1_SN_LDSB1_CLR1_GSU0_GSUC0_GSUWGMRR0_K1_LBSPPA2048_LBSPPB128_LPA0_MIWT4_4_PLR1_SU32_SUM0_SUS256_SKXCCM8_VWA4_VWB1_WGM4_WGMXCC1_WGMXCCGn1
    SolutionIndex: 60
    SolutionNameMin: Cijk_Ailk_Bljk_HHS_BH_UserArgs_MT128x128x64_MI16x16x1_SN_LDSB1_CLR1_GSU0_GSUC0_GSUWGMRR0_K1_LBSPPA2048_LBSPPB256_LPA0_MIWT4_4_PLR1_SU32_SUM0_SUS256_SKXCCM8_VWA4_VWB2_WGM4_WGMXCC1_WGMXCCGn1
    SolutionIndex: 61
    SolutionNameMin: Cijk_Ailk_Bljk_HHS_BH_UserArgs_MT128x128x64_MI16x16x1_SN_LDSB1_CLR1_GSU0_GSUC0_GSUWGMRR0_K1_LBSPPA2048_LBSPPB512_LPA0_MIWT4_4_PLR1_SU32_SUM0_SUS256_SKXCCM8_VWA4_VWB4_WGM4_WGMXCC1_WGMXCCGn1
    SolutionIndex: 62
    SolutionNameMin: Cijk_Ailk_Bljk_HHS_BH_UserArgs_MT128x128x64_MI16x16x1_SN_LDSB1_CLR1_GSU0_GSUC0_GSUWGMRR0_K1_LBSPPA2048_LBSPPB128_LPA32_MIWT4_4_PLR1_SU32_SUM0_SUS256_SKXCCM8_VWA2_VWB1_WGM8_WGMXCC1_WGMXCCGn1
    SolutionIndex: 63
    SolutionNameMin: Cijk_Ailk_Bljk_HHS_BH_UserArgs_MT128x128x64_MI16x16x1_SN_LDSB1_CLR1_GSU0_GSUC0_GSUWGMRR0_K1_LBSPPA2048_LBSPPB128_LPA0_MIWT4_4_PLR1_SU32_SUM0_SUS256_SKXCCM8_VWA4_VWB1_WGM8_WGMXCC1_WGMXCCGn1
    SolutionIndex: 64
    SolutionNameMin: Cijk_Ailk_Bljk_HHS_BH_UserArgs_MT128x128x64_MI16x16x1_SN_LDSB1_CLR1_GSU0_GSUC0_GSUWGMRR0_K1_LBSPPA2048_LBSPPB256_LPA0_MIWT4_4_PLR1_SU32_SUM0_SUS256_SKXCCM8_VWA4_VWB2_WGM8_WGMXCC1_WGMXCCGn1
    SolutionIndex: 65
    SolutionNameMin: Cijk_Ailk_Bljk_HHS_BH_UserArgs_MT128x128x64_MI16x16x1_SN_LDSB1_CLR1_GSU0_GSUC0_GSUWGMRR0_K1_LBSPPA2048_LBSPPB512_LPA0_MIWT4_4_PLR1_SU32_SUM0_SUS256_SKXCCM8_VWA4_VWB4_WGM8_WGMXCC1_WGMXCCGn1
    SolutionIndex: 66
    SolutionNameMin: Cijk_Ailk_Bljk_HHS_BH_UserArgs_MT64x128x64_MI16x16x1_SN_LDSB1_CLR1_GSU0_GSUC0_GSUWGMRR0_K1_LBSPPA1024_LBSPPB128_LPA32_MIWT2_4_PLR1_SU32_SUM0_SUS256_SKXCCM8_VWA2_VWB1_WGM1_WGMXCC1_WGMXCCGn1
    SolutionIndex: 67
    SolutionNameMin: Cijk_Ailk_Bljk_HHS_BH_UserArgs_MT64x128x64_MI16x16x1_SN_LDSB1_CLR1_GSU0_GSUC0_GSUWGMRR0_K1_LBSPPA1024_LBSPPB256_LPA32_MIWT2_4_PLR1_SU32_SUM0_SUS256_SKXCCM8_VWA2_VWB2_WGM1_WGMXCC1_WGMXCCGn1
    SolutionIndex: 68
    SolutionNameMin: Cijk_Ailk_Bljk_HHS_BH_UserArgs_MT64x128x64_MI16x16x1_SN_LDSB1_CLR1_GSU0_GSUC0_GSUWGMRR0_K1_LBSPPA1024_LBSPPB512_LPA32_MIWT2_4_PLR1_SU32_SUM0_SUS256_SKXCCM8_VWA2_VWB4_WGM1_WGMXCC1_WGMXCCGn1
    SolutionIndex: 69
    SolutionNameMin: Cijk_Ailk_Bljk_HHS_BH_UserArgs_MT64x128x64_MI16x16x1_SN_LDSB1_CLR1_GSU0_GSUC0_GSUWGMRR0_K1_LBSPPA1024_LBSPPB512_LPA32_MIWT2_4_PLR1_SU32_SUM0_SUS256_SKXCCM8_VWA2_VWB4_WGM8_WGMXCC1_WGMXCCGn1
    SolutionIndex: 70
    SolutionNameMin: Cijk_Ailk_Bljk_HHS_BH_UserArgs_MT128x64x64_MI16x16x1_SN_LDSB1_CLR1_GSU0_GSUC0_GSUWGMRR0_K1_LBSPPA2048_LBSPPB128_LPA0_MIWT4_2_PLR1_SU32_SUM0_SUS256_SKXCCM8_VWA4_VWB1_WGM1_WGMXCC1_WGMXCCGn1
    SolutionIndex: 71
    SolutionNameMin: Cijk_Ailk_Bljk_HHS_BH_UserArgs_MT128x64x64_MI16x16x1_SN_LDSB1_CLR1_GSU0_GSUC0_GSUWGMRR0_K1_LBSPPA2048_LBSPPB256_LPA0_MIWT4_2_PLR1_SU32_SUM0_SUS256_SKXCCM8_VWA4_VWB2_WGM1_WGMXCC1_WGMXCCGn1
    SolutionIndex: 72
    SolutionNameMin: Cijk_Ailk_Bljk_HHS_BH_UserArgs_MT128x64x64_MI16x16x1_SN_LDSB1_CLR1_GSU0_GSUC0_GSUWGMRR0_K1_LBSPPA2048_LBSPPB128_LPA0_MIWT4_2_PLR1_SU32_SUM0_SUS256_SKXCCM8_VWA4_VWB1_WGM4_WGMXCC1_WGMXCCGn1
    SolutionIndex: 73
    SolutionNameMin: Cijk_Ailk_Bljk_HHS_BH_UserArgs_MT128x64x64_MI16x16x1_SN_LDSB1_CLR1_GSU0_GSUC0_GSUWGMRR0_K1_LBSPPA2048_LBSPPB128_LPA0_MIWT4_2_PLR1_SU32_SUM0_SUS256_SKXCCM8_VWA4_VWB1_WGM8_WGMXCC1_WGMXCCGn1
    SolutionIndex: 74
    SolutionNameMin: Cijk_Ailk_Bljk_HHS_BH_UserArgs_MT64x64x64_MI16x16x1_SN_LDSB1_CLR1_GSU0_GSUC0_GSUWGMRR0_K1_LBSPPA1024_LBSPPB128_LPA32_MIWT2_2_PLR1_SU32_SUM0_SUS256_SKXCCM8_VWA2_VWB1_WGM1_WGMXCC1_WGMXCCGn1
    SolutionIndex: 75
    SolutionNameMin: Cijk_Ailk_Bljk_HHS_BH_UserArgs_MT64x64x64_MI16x16x1_SN_LDSB1_CLR1_GSU0_GSUC0_GSUWGMRR0_K1_LBSPPA1024_LBSPPB256_LPA32_MIWT2_2_PLR1_SU32_SUM0_SUS256_SKXCCM8_VWA2_VWB2_WGM1_WGMXCC1_WGMXCCGn1
    SolutionIndex: 76
    SolutionNameMin: Cijk_Ailk_Bljk_HHS_BH_UserArgs_MT64x64x64_MI16x16x1_SN_LDSB1_CLR1_GSU0_GSUC0_GSUWGMRR0_K1_LBSPPA1024_LBSPPB256_LPA32_MIWT2_2_PLR1_SU32_SUM0_SUS256_SKXCCM8_VWA2_VWB2_WGM4_WGMXCC1_WGMXCCGn1
    SolutionIndex: 77
    SolutionNameMin: Cijk_Ailk_Bljk_HHS_BH_UserArgs_MT64x64x64_MI16x16x1_SN_LDSB1_CLR1_GSU0_GSUC0_GSUWGMRR0_K1_LBSPPA1024_LBSPPB128_LPA32_MIWT2_2_PLR1_SU32_SUM0_SUS256_SKXCCM8_VWA2_VWB1_WGM8_WGMXCC1_WGMXCCGn1
    SolutionIndex: 78
    SolutionNameMin: Cijk_Ailk_Bljk_HHS_BH_UserArgs_MT64x32x64_MI16x16x1_SN_LDSB0_CLR1_GSU0_GSUC0_GSUWGMRR0_K1_LBSPPA1024_LBSPPB128_LPA32_MIWT2_1_PLR1_SU32_SUM0_SUS256_SKXCCM8_VWA2_VWB1_WGM1_WGMXCC1_WGMXCCGn1
    SolutionIndex: 79
    SolutionNameMin: Cijk_Ailk_Bljk_HHS_BH_UserArgs_MT32x32x64_MI16x16x1_SN_LDSB0_CLR1_GSU0_GSUC0_GSUWGMRR0_K1_LBSPPA512_LBSPPB128_LPA16_MIWT1_1_PLR1_SU32_SUM0_SUS256_SKXCCM8_VWA1_VWB1_WGM1_WGMXCC1_WGMXCCGn1
    SolutionIndex: 80
    SolutionNameMin: Cijk_Ailk_Bljk_HHS_BH_UserArgs_MT32x32x64_MI16x16x1_SN_LDSB0_CLR1_GSU0_GSUC0_GSUWGMRR0_K1_LBSPPA512_LBSPPB128_LPA16_MIWT1_1_PLR1_SU32_SUM0_SUS256_SKXCCM8_VWA1_VWB1_WGM8_WGMXCC1_WGMXCCGn1
    SolutionIndex: 81
    SolutionNameMin: Cijk_Ailk_Bljk_HHS_BH_UserArgs_MT64x128x128_MI16x16x1_SN_LDSB1_CLR1_GSU0_GSUC0_GSUWGMRR0_K1_LBSPPA1024_LBSPPB256_LPA32_MIWT2_4_PLR2_SU32_SUM0_SUS256_SKXCCM8_VWA2_VWB1_WGM1_WGMXCC1_WGMXCCGn1
    SolutionIndex: 82
    SolutionNameMin: Cijk_Ailk_Bljk_HHS_BH_UserArgs_MT128x64x128_MI16x16x1_SN_LDSB1_CLR1_GSU0_GSUC0_GSUWGMRR0_K1_LBSPPA2048_LBSPPB256_LPA0_MIWT4_2_PLR1_SU32_SUM0_SUS256_SKXCCM8_VWA4_VWB1_WGM1_WGMXCC1_WGMXCCGn1
    SolutionIndex: 83
    SolutionNameMin: Cijk_Ailk_Bljk_HHS_BH_UserArgs_MT128x64x128_MI16x16x1_SN_LDSB1_CLR1_GSU0_GSUC0_GSUWGMRR0_K1_LBSPPA2048_LBSPPB512_LPA32_MIWT4_2_PLR1_SU32_SUM0_SUS256_SKXCCM8_VWA2_VWB2_WGM1_WGMXCC1_WGMXCCGn1
    SolutionIndex: 84
    SolutionNameMin: Cijk_Ailk_Bljk_HHS_BH_UserArgs_MT128x64x128_MI16x16x1_SN_LDSB1_CLR1_GSU0_GSUC0_GSUWGMRR0_K1_LBSPPA2048_LBSPPB512_LPA0_MIWT4_2_PLR1_SU32_SUM0_SUS256_SKXCCM8_VWA4_VWB2_WGM1_WGMXCC1_WGMXCCGn1
    SolutionIndex: 85
    SolutionNameMin: Cijk_Ailk_Bljk_HHS_BH_UserArgs_MT128x64x128_MI16x16x1_SN_LDSB1_CLR1_GSU0_GSUC0_GSUWGMRR0_K1_LBSPPA2048_LBSPPB256_LPA0_MIWT4_2_PLR2_SU32_SUM0_SUS256_SKXCCM8_VWA4_VWB1_WGM1_WGMXCC1_WGMXCCGn1
    SolutionIndex: 86
    SolutionNameMin: Cijk_Ailk_Bljk_HHS_BH_UserArgs_MT128x64x128_MI16x16x1_SN_LDSB1_CLR1_GSU0_GSUC0_GSUWGMRR0_K1_LBSPPA2048_LBSPPB512_LPA32_MIWT4_2_PLR2_SU32_SUM0_SUS256_SKXCCM8_VWA2_VWB2_WGM1_WGMXCC1_WGMXCCGn1
    SolutionIndex: 87
    SolutionNameMin: Cijk_Ailk_Bljk_HHS_BH_UserArgs_MT128x64x128_MI16x16x1_SN_LDSB1_CLR1_GSU0_GSUC0_GSUWGMRR0_K1_LBSPPA2048_LBSPPB512_LPA0_MIWT4_2_PLR2_SU32_SUM0_SUS256_SKXCCM8_VWA4_VWB2_WGM1_WGMXCC1_WGMXCCGn1
    SolutionIndex: 88
    SolutionNameMin: Cijk_Ailk_Bljk_HHS_BH_UserArgs_MT128x64x128_MI16x16x1_SN_LDSB1_CLR1_GSU0_GSUC0_GSUWGMRR0_K1_LBSPPA2048_LBSPPB512_LPA0_MIWT4_2_PLR2_SU32_SUM0_SUS256_SKXCCM8_VWA4_VWB2_WGM4_WGMXCC1_WGMXCCGn1
    SolutionIndex: 89
    SolutionNameMin: Cijk_Ailk_Bljk_HHS_BH_UserArgs_MT128x64x128_MI16x16x1_SN_LDSB1_CLR1_GSU0_GSUC0_GSUWGMRR0_K1_LBSPPA2048_LBSPPB512_LPA0_MIWT4_2_PLR1_SU32_SUM0_SUS256_SKXCCM8_VWA4_VWB2_WGM8_WGMXCC1_WGMXCCGn1
    SolutionIndex: 90
    SolutionNameMin: Cijk_Ailk_Bljk_HHS_BH_UserArgs_MT128x64x128_MI16x16x1_SN_LDSB1_CLR1_GSU0_GSUC0_GSUWGMRR0_K1_LBSPPA2048_LBSPPB256_LPA0_MIWT4_2_PLR2_SU32_SUM0_SUS256_SKXCCM8_VWA4_VWB1_WGM8_WGMXCC1_WGMXCCGn1
    SolutionIndex: 91
    SolutionNameMin: Cijk_Ailk_Bljk_HHS_BH_UserArgs_MT128x64x128_MI16x16x1_SN_LDSB1_CLR1_GSU0_GSUC0_GSUWGMRR0_K1_LBSPPA2048_LBSPPB512_LPA0_MIWT4_2_PLR2_SU32_SUM0_SUS256_SKXCCM8_VWA4_VWB2_WGM8_WGMXCC1_WGMXCCGn1
    SolutionIndex: 92
    SolutionNameMin: Cijk_Ailk_Bljk_HHS_BH_UserArgs_MT64x64x128_MI16x16x1_SN_LDSB1_CLR1_GSU0_GSUC0_GSUWGMRR0_K1_LBSPPA1024_LBSPPB512_LPA32_MIWT2_2_PLR1_SU32_SUM0_SUS256_SKXCCM8_VWA2_VWB2_WGM1_WGMXCC1_WGMXCCGn1
    SolutionIndex: 93
    SolutionNameMin: Cijk_Ailk_Bljk_HHS_BH_UserArgs_MT64x64x128_MI16x16x1_SN_LDSB1_CLR1_GSU0_GSUC0_GSUWGMRR0_K1_LBSPPA1024_LBSPPB256_LPA32_MIWT2_2_PLR2_SU32_SUM0_SUS256_SKXCCM8_VWA2_VWB1_WGM1_WGMXCC1_WGMXCCGn1
    SolutionIndex: 94
    SolutionNameMin: Cijk_Ailk_Bljk_HHS_BH_UserArgs_MT64x64x128_MI16x16x1_SN_LDSB1_CLR1_GSU0_GSUC0_GSUWGMRR0_K1_LBSPPA1024_LBSPPB512_LPA32_MIWT2_2_PLR2_SU32_SUM0_SUS256_SKXCCM8_VWA2_VWB2_WGM1_WGMXCC1_WGMXCCGn1
    SolutionIndex: 95
    SolutionNameMin: Cijk_Ailk_Bljk_HHS_BH_UserArgs_MT64x64x128_MI16x16x1_SN_LDSB1_CLR1_GSU0_GSUC0_GSUWGMRR0_K1_LBSPPA1024_LBSPPB256_LPA32_MIWT2_2_PLR2_SU32_SUM0_SUS256_SKXCCM8_VWA2_VWB1_WGM4_WGMXCC1_WGMXCCGn1
    SolutionIndex: 96
    SolutionNameMin: Cijk_Ailk_Bljk_HHS_BH_UserArgs_MT64x64x128_MI16x16x1_SN_LDSB1_CLR1_GSU0_GSUC0_GSUWGMRR0_K1_LBSPPA1024_LBSPPB512_LPA32_MIWT2_2_PLR2_SU32_SUM0_SUS256_SKXCCM8_VWA2_VWB2_WGM4_WGMXCC1_WGMXCCGn1
    SolutionIndex: 97
    SolutionNameMin: Cijk_Ailk_Bljk_HHS_BH_UserArgs_MT64x64x128_MI16x16x1_SN_LDSB1_CLR1_GSU0_GSUC0_GSUWGMRR0_K1_LBSPPA1024_LBSPPB256_LPA32_MIWT2_2_PLR2_SU32_SUM0_SUS256_SKXCCM8_VWA2_VWB1_WGM8_WGMXCC1_WGMXCCGn1
    SolutionIndex: 98
    SolutionNameMin: Cijk_Ailk_Bljk_HHS_BH_UserArgs_MT64x64x128_MI16x16x1_SN_LDSB1_CLR1_GSU0_GSUC0_GSUWGMRR0_K1_LBSPPA1024_LBSPPB512_LPA32_MIWT2_2_PLR2_SU32_SUM0_SUS256_SKXCCM8_VWA2_VWB2_WGM8_WGMXCC1_WGMXCCGn1
    SolutionIndex: 99
    SolutionNameMin: Cijk_Ailk_Bljk_HHS_BH_UserArgs_MT64x32x128_MI16x16x1_SN_LDSB1_CLR1_GSU0_GSUC0_GSUWGMRR0_K1_LBSPPA1024_LBSPPB256_LPA32_MIWT2_1_PLR2_SU32_SUM0_SUS256_SKXCCM8_VWA2_VWB1_WGM1_WGMXCC1_WGMXCCGn1
    SolutionIndex: 100
    SolutionNameMin: Cijk_Ailk_Bljk_HHS_BH_UserArgs_MT64x32x128_MI16x16x1_SN_LDSB1_CLR1_GSU0_GSUC0_GSUWGMRR0_K1_LBSPPA1024_LBSPPB256_LPA32_MIWT2_1_PLR2_SU32_SUM0_SUS256_SKXCCM8_VWA2_VWB1_WGM4_WGMXCC1_WGMXCCGn1
    SolutionIndex: 101
    SolutionNameMin: Cijk_Ailk_Bljk_HHS_BH_UserArgs_MT64x32x128_MI16x16x1_SN_LDSB1_CLR1_GSU0_GSUC0_GSUWGMRR0_K1_LBSPPA1024_LBSPPB256_LPA32_MIWT2_1_PLR2_SU32_SUM0_SUS256_SKXCCM8_VWA2_VWB1_WGM8_WGMXCC1_WGMXCCGn1
    SolutionIndex: 102
    SolutionNameMin: Cijk_Ailk_Bljk_HHS_BH_UserArgs_MT32x32x128_MI16x16x1_SN_LDSB1_CLR1_GSU0_GSUC0_GSUWGMRR0_K1_LBSPPA512_LBSPPB256_LPA16_MIWT1_1_PLR1_SU32_SUM0_SUS256_SKXCCM8_VWA1_VWB1_WGM1_WGMXCC1_WGMXCCGn1
    SolutionIndex: 103
    SolutionNameMin: Cijk_Ailk_Bljk_HHS_BH_UserArgs_MT32x32x128_MI16x16x1_SN_LDSB1_CLR1_GSU0_GSUC0_GSUWGMRR0_K1_LBSPPA512_LBSPPB256_LPA16_MIWT1_1_PLR2_SU32_SUM0_SUS256_SKXCCM8_VWA1_VWB1_WGM1_WGMXCC1_WGMXCCGn1
    SolutionIndex: 104
    SolutionNameMin: Cijk_Ailk_Bljk_HHS_BH_UserArgs_MT32x32x128_MI16x16x1_SN_LDSB1_CLR1_GSU0_GSUC0_GSUWGMRR0_K1_LBSPPA512_LBSPPB256_LPA16_MIWT1_1_PLR1_SU32_SUM0_SUS256_SKXCCM8_VWA1_VWB1_WGM4_WGMXCC1_WGMXCCGn1
    SolutionIndex: 105
    SolutionNameMin: Cijk_Ailk_Bljk_HHS_BH_UserArgs_MT32x32x128_MI16x16x1_SN_LDSB1_CLR1_GSU0_GSUC0_GSUWGMRR0_K1_LBSPPA512_LBSPPB256_LPA16_MIWT1_1_PLR1_SU32_SUM0_SUS256_SKXCCM8_VWA1_VWB1_WGM8_WGMXCC1_WGMXCCGn1
    SolutionIndex: 106
    SolutionNameMin: Cijk_Ailk_Bljk_HHS_BH_UserArgs_MT32x32x32_MI16x16x1_SN_LDSB0_CLR1_GSU0_GSUC0_GSUWGMRR0_K1_LBSPPA256_LBSPPB128_LPA16_MIWT1_1_PLR1_SU32_SUM0_SUS256_SKXCCM0_VWA1_VWB1_WGM1_WGMXCC1_WGMXCCGn1
- - - [128, 128, 1, 128, 128, 128, 128, 128]
    - [103, 0.086]
  - - [128, 128, 1, 256, 128, 128, 128, 256]
    - [31, 0.105]
  - - [128, 128, 1, 512, 128, 128, 128, 512]
    - [30, 0.164]
  - - [128, 128, 1, 1024, 128, 128, 128, 1024]
    - [103, 0.256]
  - - [128, 128, 1, 2048, 128, 128, 128, 2048]
    - [103, 0.337]
  - - [128, 128, 1, 4096, 128, 128, 128, 4096]
    - [0, 0.532]
  - - [128, 128, 1, 8192, 128, 128, 128, 8192]
    - [45, 1.044]
  - - [128, 256, 1, 128, 128, 128, 128, 128]
    - [30, 0.17]
  - - [128, 256, 1, 256, 128, 128, 128, 256]
    - [30, 0.199]
  - - [128, 256, 1, 512, 128, 128, 128, 512]
    - [31, 0.328]
  - - [128, 256, 1, 1024, 128, 128, 128, 1024]
    - [103, 0.479]
  - - [128, 256, 1, 2048, 128, 128, 128, 2048]
    - [1, 0.799]
  - - [128, 256, 1, 4096, 128, 128, 128, 4096]
    - [14, 1.553]
  - - [128, 256, 1, 8192, 128, 128, 128, 8192]
    - [79, 2.731]
  - - [128, 512, 1, 128, 128, 128, 128, 128]
    - [31, 0.337]
  - - [128, 512, 1, 256, 128, 128, 128, 256]
    - [30, 0.387]
  - - [128, 512, 1, 512, 128, 128, 128, 512]
    - [103, 0.654]
  - - [128, 512, 1, 1024, 128, 128, 128, 1024]
    - [105, 1.053]
  - - [128, 512, 1, 2048, 128, 128, 128, 2048]
    - [0, 1.934]
  - - [128, 512, 1, 4096, 128, 128, 128, 4096]
    - [31, 3.371]
  - - [128, 512, 1, 8192, 128, 128, 128, 8192]
    - [79, 5.306]
  - - [128, 1024, 1, 128, 128, 128, 128, 128]
    - [103, 0.619]
  - - [128, 1024, 1, 256, 128, 128, 128, 256]
    - [31, 0.764]
  - - [128, 1024, 1, 512, 128, 128, 128, 512]
    - [103, 1.422]
  - - [128, 1024, 1, 1024, 128, 128, 128, 1024]
    - [14, 2.306]
  - - [128, 1024, 1, 2048, 128, 128, 128, 2048]
    - [31, 3.868]
  - - [128, 1024, 1, 4096, 128, 128, 128, 4096]
    - [102, 5.891]
  - - [128, 1024, 1, 8192, 128, 128, 128, 8192]
    - [99, 8.33]
  - - [128, 2048, 1, 128, 128, 128, 128, 128]
    - [30, 1.304]
  - - [128, 2048, 1, 256, 128, 128, 128, 256]
    - [31, 1.622]
  - - [128, 2048, 1, 512, 128, 128, 128, 512]
    - [102, 2.608]
  - - [128, 2048, 1, 1024, 128, 128, 128, 1024]
    - [30, 4.12]
  - - [128, 2048, 1, 2048, 128, 128, 128, 2048]
    - [29, 6.845]
  - - [128, 2048, 1, 4096, 128, 128, 128, 4096]
    - [101, 9.619]
  - - [128, 2048, 1, 8192, 128, 128, 128, 8192]
    - [76, 12.096]
  - - [128, 4096, 1, 128, 128, 128, 128, 128]
    - [29, 2.417]
  - - [128, 4096, 1, 256, 128, 128, 128, 256]
    - [99, 2.915]
  - - [128, 4096, 1, 512, 128, 128, 128, 512]
    - [99, 4.75]
  - - [128, 4096, 1, 1024, 128, 128, 128, 1024]
    - [29, 7.244]
  - - [128, 4096, 1, 2048, 128, 128, 128, 2048]
    - [74, 10.422]
  - - [128, 4096, 1, 4096, 128, 128, 128, 4096]
    - [96, 13.285]
  - - [128, 4096, 1, 8192, 128, 128, 128, 8192]
    - [17, 16.372]
  - - [128, 8192, 1, 128, 128, 128, 128, 128]
    - [25, 4.283]
  - - [128, 8192, 1, 256, 128, 128, 128, 256]
    - [26, 5.227]
  - - [128, 8192, 1, 512, 128, 128, 128, 512]
    - [92, 8.059]
  - - [128, 8192, 1, 1024, 128, 128, 128, 1024]
    - [93, 11.297]
  - - [128, 8192, 1, 2048, 128, 128, 128, 2048]
    - [91, 14.187]
  - - [128, 8192, 1, 4096, 128, 128, 128, 4096]
    - [18, 17.672]
  - - [128, 8192, 1, 8192, 128, 128, 128, 8192]
    - [55, 21.543]
  - - [256, 128, 1, 128, 256, 256, 256, 128]
    - [102, 0.167]
  - - [256, 128, 1, 256, 256, 256, 256, 256]
    - [103, 0.199]
  - - [256, 128, 1, 512, 256, 256, 256, 512]
    - [30, 0.328]
  - - [256, 128, 1, 1024, 256, 256, 256, 1024]
    - [103, 0.479]
  - - [256, 128, 1, 2048, 256, 256, 256, 2048]
    - [0, 0.8]
  - - [256, 128, 1, 4096, 256, 256, 256, 4096]
    - [14, 1.529]
  - - [256, 128, 1, 8192, 256, 256, 256, 8192]
    - [104, 2.565]
  - - [256, 256, 1, 128, 256, 256, 256, 128]
    - [30, 0.329]
  - - [256, 256, 1, 256, 256, 256, 256, 256]
    - [31, 0.412]
  - - [256, 256, 1, 512, 256, 256, 256, 512]
    - [104, 0.639]
  - - [256, 256, 1, 1024, 256, 256, 256, 1024]
    - [103, 1.077]
  - - [256, 256, 1, 2048, 256, 256, 256, 2048]
    - [30, 1.944]
  - - [256, 256, 1, 4096, 256, 256, 256, 4096]
    - [102, 3.404]
  - - [256, 256, 1, 8192, 256, 256, 256, 8192]
    - [104, 4.978]
  - - [256, 512, 1, 128, 256, 256, 256, 128]
    - [102, 0.637]
  - - [256, 512, 1, 256, 256, 256, 256, 256]
    - [31, 0.749]
  - - [256, 512, 1, 512, 256, 256, 256, 512]
    - [103, 1.381]
  - - [256, 512, 1, 1024, 256, 256, 256, 1024]
    - [102, 2.279]
  - - [256, 512, 1, 2048, 256, 256, 256, 2048]
    - [30, 3.848]
  - - [256, 512, 1, 4096, 256, 256, 256, 4096]
    - [102, 5.843]
  - - [256, 512, 1, 8192, 256, 256, 256, 8192]
    - [101, 7.751]
  - - [256, 1024, 1, 128, 256, 256, 256, 128]
    - [31, 1.279]
  - - [256, 1024, 1, 256, 256, 256, 256, 256]
    - [31, 1.615]
  - - [256, 1024, 1, 512, 256, 256, 256, 512]
    - [31, 2.457]
  - - [256, 1024, 1, 1024, 256, 256, 256, 1024]
    - [30, 4.071]
  - - [256, 1024, 1, 2048, 256, 256, 256, 2048]
    - [99, 6.72]
  - - [256, 1024, 1, 4096, 256, 256, 256, 4096]
    - [99, 9.703]
  - - [256, 1024, 1, 8192, 256, 256, 256, 8192]
    - [74, 12.211]
  - - [256, 2048, 1, 128, 256, 256, 256, 128]
    - [99, 2.301]
  - - [256, 2048, 1, 256, 256, 256, 256, 256]
    - [101, 2.932]
  - - [256, 2048, 1, 512, 256, 256, 256, 512]
    - [99, 4.681]
  - - [256, 2048, 1, 1024, 256, 256, 256, 1024]
    - [29, 7.263]
  - - [256, 2048, 1, 2048, 256, 256, 256, 2048]
    - [75, 10.218]
  - - [256, 2048, 1, 4096, 256, 256, 256, 4096]
    - [75, 13.501]
  - - [256, 2048, 1, 8192, 256, 256, 256, 8192]
    - [23, 15.631]
  - - [256, 4096, 1, 128, 256, 256, 256, 128]
    - [27, 4.156]
  - - [256, 4096, 1, 256, 256, 256, 256, 256]
    - [28, 5.112]
  - - [256, 4096, 1, 512, 256, 256, 256, 512]
    - [93, 8.039]
  - - [256, 4096, 1, 1024, 256, 256, 256, 1024]
    - [93, 11.414]
  - - [256, 4096, 1, 2048, 256, 256, 256, 2048]
    - [94, 14.844]
  - - [256, 4096, 1, 4096, 256, 256, 256, 4096]
    - [73, 17.658]
  - - [256, 4096, 1, 8192, 256, 256, 256, 8192]
    - [55, 21.409]
  - - [256, 8192, 1, 128, 256, 256, 256, 128]
    - [87, 6.593]
  - - [256, 8192, 1, 256, 256, 256, 256, 256]
    - [21, 8.196]
  - - [256, 8192, 1, 512, 256, 256, 256, 512]
    - [70, 11.313]
  - - [256, 8192, 1, 1024, 256, 256, 256, 1024]
    - [85, 15.472]
  - - [256, 8192, 1, 2048, 256, 256, 256, 2048]
    - [87, 18.351]
  - - [256, 8192, 1, 4096, 256, 256, 256, 4096]
    - [65, 23.165]
  - - [256, 8192, 1, 8192, 256, 256, 256, 8192]
    - [65, 26.696]
  - - [512, 128, 1, 128, 512, 512, 512, 128]
    - [29, 0.32]
  - - [512, 128, 1, 256, 512, 512, 512, 256]
    - [31, 0.398]
  - - [512, 128, 1, 512, 512, 512, 512, 512]
    - [104, 0.661]
  - - [512, 128, 1, 1024, 512, 512, 512, 1024]
    - [79, 1.09]
  - - [512, 128, 1, 2048, 512, 512, 512, 2048]
    - [102, 2.019]
  - - [512, 128, 1, 4096, 512, 512, 512, 4096]
    - [80, 3.23]
  - - [512, 128, 1, 8192, 512, 512, 512, 8192]
    - [80, 4.537]
  - - [512, 256, 1, 128, 512, 512, 512, 128]
    - [30, 0.646]
  - - [512, 256, 1, 256, 512, 512, 512, 256]
    - [102, 0.78]
  - - [512, 256, 1, 512, 512, 512, 512, 512]
    - [102, 1.404]
  - - [512, 256, 1, 1024, 512, 512, 512, 1024]
    - [102, 2.341]
  - - [512, 256, 1, 2048, 512, 512, 512, 2048]
    - [30, 3.756]
  - - [512, 256, 1, 4096, 512, 512, 512, 4096]
    - [101, 5.711]
  - - [512, 256, 1, 8192, 512, 512, 512, 8192]
    - [101, 7.463]
  - - [512, 512, 1, 128, 512, 512, 512, 128]
    - [30, 1.247]
  - - [512, 512, 1, 256, 512, 512, 512, 256]
    - [30, 1.618]
  - - [512, 512, 1, 512, 512, 512, 512, 512]
    - [103, 2.592]
  - - [512, 512, 1, 1024, 512, 512, 512, 1024]
    - [102, 4.036]
  - - [512, 512, 1, 2048, 512, 512, 512, 2048]
    - [78, 6.544]
  - - [512, 512, 1, 4096, 512, 512, 512, 4096]
    - [96, 8.542]
  - - [512, 512, 1, 8192, 512, 512, 512, 8192]
    - [74, 11.51]
  - - [512, 1024, 1, 128, 512, 512, 512, 128]
    - [29, 2.41]
  - - [512, 1024, 1, 256, 512, 512, 512, 256]
    - [99, 2.948]
  - - [512, 1024, 1, 512, 512, 512, 512, 512]
    - [99, 4.759]
  - - [512, 1024, 1, 1024, 512, 512, 512, 1024]
    - [99, 7.276]
  - - [512, 1024, 1, 2048, 512, 512, 512, 2048]
    - [75, 10.23]
  - - [512, 1024, 1, 4096, 512, 512, 512, 4096]
    - [75, 13.13]
  - - [512, 1024, 1, 8192, 512, 512, 512, 8192]
    - [70, 15.831]
  - - [512, 2048, 1, 128, 512, 512, 512, 128]
    - [26, 4.296]
  - - [512, 2048, 1, 256, 512, 512, 512, 256]
    - [26, 5.197]
  - - [512, 2048, 1, 512, 512, 512, 512, 512]
    - [93, 7.786]
  - - [512, 2048, 1, 1024, 512, 512, 512, 1024]
    - [93, 11.288]
  - - [512, 2048, 1, 2048, 512, 512, 512, 2048]
    - [94, 14.622]
  - - [512, 2048, 1, 4096, 512, 512, 512, 4096]
    - [68, 16.884]
  - - [512, 2048, 1, 8192, 512, 512, 512, 8192]
    - [55, 21.405]
  - - [512, 4096, 1, 128, 512, 512, 512, 128]
    - [89, 6.513]
  - - [512, 4096, 1, 256, 512, 512, 512, 256]
    - [21, 8.144]
  - - [512, 4096, 1, 512, 512, 512, 512, 512]
    - [83, 11.261]
  - - [512, 4096, 1, 1024, 512, 512, 512, 1024]
    - [82, 15.456]
  - - [512, 4096, 1, 2048, 512, 512, 512, 2048]
    - [85, 18.249]
  - - [512, 4096, 1, 4096, 512, 512, 512, 4096]
    - [57, 22.363]
  - - [512, 4096, 1, 8192, 512, 512, 512, 8192]
    - [53, 24.924]
  - - [512, 8192, 1, 128, 512, 512, 512, 128]
    - [84, 7.933]
  - - [512, 8192, 1, 256, 512, 512, 512, 256]
    - [15, 9.871]
  - - [512, 8192, 1, 512, 512, 512, 512, 512]
    - [70, 14.326]
  - - [512, 8192, 1, 1024, 512, 512, 512, 1024]
    - [57, 18.428]
  - - [512, 8192, 1, 2048, 512, 512, 512, 2048]
    - [65, 22.799]
  - - [512, 8192, 1, 4096, 512, 512, 512, 4096]
    - [11, 26.405]
  - - [512, 8192, 1, 8192, 512, 512, 512, 8192]
    - [3, 28.711]
  - - [1024, 128, 1, 128, 1024, 1024, 1024, 128]
    - [103, 0.627]
  - - [1024, 128, 1, 256, 1024, 1024, 1024, 256]
    - [30, 0.762]
  - - [1024, 128, 1, 512, 1024, 1024, 1024, 512]
    - [102, 1.391]
  - - [1024, 128, 1, 1024, 1024, 1024, 1024, 1024]
    - [102, 2.321]
  - - [1024, 128, 1, 2048, 1024, 1024, 1024, 2048]
    - [30, 3.553]
  - - [1024, 128, 1, 4096, 1024, 1024, 1024, 4096]
    - [29, 5.107]
  - - [1024, 128, 1, 8192, 1024, 1024, 1024, 8192]
    - [75, 6.931]
  - - [1024, 256, 1, 128, 1024, 1024, 1024, 128]
    - [30, 1.265]
  - - [1024, 256, 1, 256, 1024, 1024, 1024, 256]
    - [30, 1.569]
  - - [1024, 256, 1, 512, 1024, 1024, 1024, 512]
    - [102, 2.606]
  - - [1024, 256, 1, 1024, 1024, 1024, 1024, 1024]
    - [99, 4.074]
  - - [1024, 256, 1, 2048, 1024, 1024, 1024, 2048]
    - [101, 6.398]
  - - [1024, 256, 1, 4096, 1024, 1024, 1024, 4096]
    - [77, 8.385]
  - - [1024, 256, 1, 8192, 1024, 1024, 1024, 8192]
    - [94, 10.961]
  - - [1024, 512, 1, 128, 1024, 1024, 1024, 128]
    - [99, 2.392]
  - - [1024, 512, 1, 256, 1024, 1024, 1024, 256]
    - [29, 2.972]
  - - [1024, 512, 1, 512, 1024, 1024, 1024, 512]
    - [99, 4.777]
  - - [1024, 512, 1, 1024, 1024, 1024, 1024, 1024]
    - [29, 7.112]
  - - [1024, 512, 1, 2048, 1024, 1024, 1024, 2048]
    - [95, 9.903]
  - - [1024, 512, 1, 4096, 1024, 1024, 1024, 4096]
    - [74, 12.051]
  - - [1024, 512, 1, 8192, 1024, 1024, 1024, 8192]
    - [68, 15.417]
  - - [1024, 1024, 1, 128, 1024, 1024, 1024, 128]
    - [25, 4.203]
  - - [1024, 1024, 1, 256, 1024, 1024, 1024, 256]
    - [26, 5.07]
  - - [1024, 1024, 1, 512, 1024, 1024, 1024, 512]
    - [93, 7.804]
  - - [1024, 1024, 1, 1024, 1024, 1024, 1024, 1024]
    - [93, 11.235]
  - - [1024, 1024, 1, 2048, 1024, 1024, 1024, 2048]
    - [96, 13.405]
  - - [1024, 1024, 1, 4096, 1024, 1024, 1024, 4096]
    - [71, 17.362]
  - - [1024, 1024, 1, 8192, 1024, 1024, 1024, 8192]
    - [58, 21.202]
  - - [1024, 2048, 1, 128, 1024, 1024, 1024, 128]
    - [24, 6.639]
  - - [1024, 2048, 1, 256, 1024, 1024, 1024, 256]
    - [21, 8.371]
  - - [1024, 2048, 1, 512, 1024, 1024, 1024, 512]
    - [70, 11.231]
  - - [1024, 2048, 1, 1024, 1024, 1024, 1024, 1024]
    - [85, 15.28]
  - - [1024, 2048, 1, 2048, 1024, 1024, 1024, 2048]
    - [67, 17.956]
  - - [1024, 2048, 1, 4096, 1024, 1024, 1024, 4096]
    - [57, 23.166]
  - - [1024, 2048, 1, 8192, 1024, 1024, 1024, 8192]
    - [56, 24.634]
  - - [1024, 4096, 1, 128, 1024, 1024, 1024, 128]
    - [22, 8.018]
  - - [1024, 4096, 1, 256, 1024, 1024, 1024, 256]
    - [18, 10.069]
  - - [1024, 4096, 1, 512, 1024, 1024, 1024, 512]
    - [70, 14.243]
  - - [1024, 4096, 1, 1024, 1024, 1024, 1024, 1024]
    - [58, 18.449]
  - - [1024, 4096, 1, 2048, 1024, 1024, 1024, 2048]
    - [58, 23.032]
  - - [1024, 4096, 1, 4096, 1024, 1024, 1024, 4096]
    - [54, 25.492]
  - - [1024, 4096, 1, 8192, 1024, 1024, 1024, 8192]
    - [37, 27.245]
  - - [1024, 8192, 1, 128, 1024, 1024, 1024, 128]
    - [16, 8.712]
  - - [1024, 8192, 1, 256, 1024, 1024, 1024, 256]
    - [55, 12.735]
  - - [1024, 8192, 1, 512, 1024, 1024, 1024, 512]
    - [55, 18.212]
  - - [1024, 8192, 1, 1024, 1024, 1024, 1024, 1024]
    - [57, 22.466]
  - - [1024, 8192, 1, 2048, 1024, 1024, 1024, 2048]
    - [54, 25.778]
  - - [1024, 8192, 1, 4096, 1024, 1024, 1024, 4096]
    - [4, 27.891]
  - - [1024, 8192, 1, 8192, 1024, 1024, 1024, 8192]
    - [37, 30.984]
  - - [2048, 128, 1, 128, 2048, 2048, 2048, 128]
    - [31, 1.277]
  - - [2048, 128, 1, 256, 2048, 2048, 2048, 256]
    - [31, 1.605]
  - - [2048, 128, 1, 512, 2048, 2048, 2048, 512]
    - [102, 2.577]
  - - [2048, 128, 1, 1024, 2048, 2048, 2048, 1024]
    - [99, 4.098]
  - - [2048, 128, 1, 2048, 2048, 2048, 2048, 2048]
    - [101, 6.215]
  - - [2048, 128, 1, 4096, 2048, 2048, 2048, 4096]
    - [13, 8.33]
  - - [2048, 128, 1, 8192, 2048, 2048, 2048, 8192]
    - [76, 11.01]
  - - [2048, 256, 1, 128, 2048, 2048, 2048, 128]
    - [99, 2.375]
  - - [2048, 256, 1, 256, 2048, 2048, 2048, 256]
    - [29, 3.007]
  - - [2048, 256, 1, 512, 2048, 2048, 2048, 512]
    - [99, 4.713]
  - - [2048, 256, 1, 1024, 2048, 2048, 2048, 1024]
    - [100, 7.088]
  - - [2048, 256, 1, 2048, 2048, 2048, 2048, 2048]
    - [96, 9.708]
  - - [2048, 256, 1, 4096, 2048, 2048, 2048, 4096]
    - [74, 11.968]
  - - [2048, 256, 1, 8192, 2048, 2048, 2048, 8192]
    - [67, 15.436]
  - - [2048, 512, 1, 128, 2048, 2048, 2048, 128]
    - [26, 4.232]
  - - [2048, 512, 1, 256, 2048, 2048, 2048, 256]
    - [26, 5.238]
  - - [2048, 512, 1, 512, 2048, 2048, 2048, 512]
    - [93, 7.835]
  - - [2048, 512, 1, 1024, 2048, 2048, 2048, 1024]
    - [95, 11.148]
  - - [2048, 512, 1, 2048, 2048, 2048, 2048, 2048]
    - [91, 13.683]
  - - [2048, 512, 1, 4096, 2048, 2048, 2048, 4096]
    - [66, 16.562]
  - - [2048, 512, 1, 8192, 2048, 2048, 2048, 8192]
    - [55, 21.115]
  - - [2048, 1024, 1, 128, 2048, 2048, 2048, 128]
    - [22, 6.682]
  - - [2048, 1024, 1, 256, 2048, 2048, 2048, 256]
    - [19, 8.271]
  - - [2048, 1024, 1, 512, 2048, 2048, 2048, 512]
    - [84, 11.627]
  - - [2048, 1024, 1, 1024, 2048, 2048, 2048, 1024]
    - [72, 15.026]
  - - [2048, 1024, 1, 2048, 2048, 2048, 2048, 2048]
    - [58, 17.27]
  - - [2048, 1024, 1, 4096, 2048, 2048, 2048, 4096]
    - [57, 22.683]
  - - [2048, 1024, 1, 8192, 2048, 2048, 2048, 8192]
    - [57, 25.102]
  - - [2048, 2048, 1, 128, 2048, 2048, 2048, 128]
    - [87, 7.99]
  - - [2048, 2048, 1, 256, 2048, 2048, 2048, 256]
    - [23, 9.935]
  - - [2048, 2048, 1, 512, 2048, 2048, 2048, 512]
    - [87, 14.351]
  - - [2048, 2048, 1, 1024, 2048, 2048, 2048, 1024]
    - [64, 18.428]
  - - [2048, 2048, 1, 2048, 2048, 2048, 2048, 2048]
    - [57, 23.425]
  - - [2048, 2048, 1, 4096, 2048, 2048, 2048, 4096]
    - [57, 28.792]
  - - [2048, 2048, 1, 8192, 2048, 2048, 2048, 8192]
    - [49, 27.676]
  - - [2048, 4096, 1, 128, 2048, 2048, 2048, 128]
    - [24, 8.704]
  - - [2048, 4096, 1, 256, 2048, 2048, 2048, 256]
    - [55, 12.931]
  - - [2048, 4096, 1, 512, 2048, 2048, 2048, 512]
    - [55, 17.644]
  - - [2048, 4096, 1, 1024, 2048, 2048, 2048, 1024]
    - [55, 22.245]
  - - [2048, 4096, 1, 2048, 2048, 2048, 2048, 2048]
    - [49, 27.709]
  - - [2048, 4096, 1, 4096, 2048, 2048, 2048, 4096]
    - [51, 27.685]
  - - [2048, 4096, 1, 8192, 2048, 2048, 2048, 8192]
    - [38, 30.892]
  - - [2048, 8192, 1, 128, 2048, 2048, 2048, 128]
    - [9, 9.915]
  - - [2048, 8192, 1, 256, 2048, 2048, 2048, 256]
    - [57, 15.304]
  - - [2048, 8192, 1, 512, 2048, 2048, 2048, 512]
    - [55, 20.383]
  - - [2048, 8192, 1, 1024, 2048, 2048, 2048, 1024]
    - [42, 24.742]
  - - [2048, 8192, 1, 2048, 2048, 2048, 2048, 2048]
    - [46, 28.836]
  - - [2048, 8192, 1, 4096, 2048, 2048, 2048, 4096]
    - [39, 30.684]
  - - [2048, 8192, 1, 8192, 2048, 2048, 2048, 8192]
    - [36, 32.663]
  - - [4096, 128, 1, 128, 4096, 4096, 4096, 128]
    - [29, 2.395]
  - - [4096, 128, 1, 256, 4096, 4096, 4096, 256]
    - [29, 3.004]
  - - [4096, 128, 1, 512, 4096, 4096, 4096, 512]
    - [99, 4.638]
  - - [4096, 128, 1, 1024, 4096, 4096, 4096, 1024]
    - [100, 7.08]
  - - [4096, 128, 1, 2048, 4096, 4096, 4096, 2048]
    - [98, 9.816]
  - - [4096, 128, 1, 4096, 4096, 4096, 4096, 4096]
    - [12, 12.372]
  - - [4096, 128, 1, 8192, 4096, 4096, 4096, 8192]
    - [67, 15.375]
  - - [4096, 256, 1, 128, 4096, 4096, 4096, 128]
    - [26, 4.22]
  - - [4096, 256, 1, 256, 4096, 4096, 4096, 256]
    - [25, 5.119]
  - - [4096, 256, 1, 512, 4096, 4096, 4096, 512]
    - [92, 7.971]
  - - [4096, 256, 1, 1024, 4096, 4096, 4096, 1024]
    - [97, 11.072]
  - - [4096, 256, 1, 2048, 4096, 4096, 4096, 2048]
    - [98, 13.357]
  - - [4096, 256, 1, 4096, 4096, 4096, 4096, 4096]
    - [68, 16.765]
  - - [4096, 256, 1, 8192, 4096, 4096, 4096, 8192]
    - [55, 21.252]
  - - [4096, 512, 1, 128, 4096, 4096, 4096, 128]
    - [20, 6.632]
  - - [4096, 512, 1, 256, 4096, 4096, 4096, 256]
    - [19, 8.391]
  - - [4096, 512, 1, 512, 4096, 4096, 4096, 512]
    - [81, 11.289]
  - - [4096, 512, 1, 1024, 4096, 4096, 4096, 1024]
    - [88, 15.081]
  - - [4096, 512, 1, 2048, 4096, 4096, 4096, 2048]
    - [64, 17.651]
  - - [4096, 512, 1, 4096, 4096, 4096, 4096, 4096]
    - [55, 22.748]
  - - [4096, 512, 1, 8192, 4096, 4096, 4096, 8192]
    - [55, 25.743]
  - - [4096, 1024, 1, 128, 4096, 4096, 4096, 128]
    - [84, 8.345]
  - - [4096, 1024, 1, 256, 4096, 4096, 4096, 256]
    - [23, 10.117]
  - - [4096, 1024, 1, 512, 4096, 4096, 4096, 512]
    - [73, 13.875]
  - - [4096, 1024, 1, 1024, 4096, 4096, 4096, 1024]
    - [63, 18.565]
  - - [4096, 1024, 1, 2048, 4096, 4096, 4096, 2048]
    - [63, 22.823]
  - - [4096, 1024, 1, 4096, 4096, 4096, 4096, 4096]
    - [57, 27.185]
  - - [4096, 1024, 1, 8192, 4096, 4096, 4096, 8192]
    - [50, 27.531]
  - - [4096, 2048, 1, 128, 4096, 4096, 4096, 128]
    - [10, 8.584]
  - - [4096, 2048, 1, 256, 4096, 4096, 4096, 256]
    - [59, 12.54]
  - - [4096, 2048, 1, 512, 4096, 4096, 4096, 512]
    - [63, 17.469]
  - - [4096, 2048, 1, 1024, 4096, 4096, 4096, 1024]
    - [59, 22.058]
  - - [4096, 2048, 1, 2048, 4096, 4096, 4096, 2048]
    - [46, 26.54]
  - - [4096, 2048, 1, 4096, 4096, 4096, 4096, 4096]
    - [47, 28.689]
  - - [4096, 2048, 1, 8192, 4096, 4096, 4096, 8192]
    - [41, 31.435]
  - - [4096, 4096, 1, 128, 4096, 4096, 4096, 128]
    - [86, 9.725]
  - - [4096, 4096, 1, 256, 4096, 4096, 4096, 256]
    - [63, 14.497]
  - - [4096, 4096, 1, 512, 4096, 4096, 4096, 512]
    - [59, 20.091]
  - - [4096, 4096, 1, 1024, 4096, 4096, 4096, 1024]
    - [53, 25.322]
  - - [4096, 4096, 1, 2048, 4096, 4096, 4096, 2048]
    - [48, 28.044]
  - - [4096, 4096, 1, 4096, 4096, 4096, 4096, 4096]
    - [47, 30.819]
  - - [4096, 4096, 1, 8192, 4096, 4096, 4096, 8192]
    - [32, 33.277]
  - - [4096, 8192, 1, 128, 4096, 4096, 4096, 128]
    - [7, 11.769]
  - - [4096, 8192, 1, 256, 4096, 4096, 4096, 256]
    - [55, 16.906]
  - - [4096, 8192, 1, 512, 4096, 4096, 4096, 512]
    - [63, 21.886]
  - - [4096, 8192, 1, 1024, 4096, 4096, 4096, 1024]
    - [53, 26.214]
  - - [4096, 8192, 1, 2048, 4096, 4096, 4096, 2048]
    - [32, 30.895]
  - - [4096, 8192, 1, 4096, 4096, 4096, 4096, 4096]
    - [32, 34.415]
  - - [4096, 8192, 1, 8192, 4096, 4096, 4096, 8192]
    - [35, 36.774]
  - - [8192, 128, 1, 128, 8192, 8192, 8192, 128]
    - [26, 4.235]
  - - [8192, 128, 1, 256, 8192, 8192, 8192, 256]
    - [26, 5.128]
  - - [8192, 128, 1, 512, 8192, 8192, 8192, 512]
    - [92, 7.868]
  - - [8192, 128, 1, 1024, 8192, 8192, 8192, 1024]
    - [95, 10.886]
  - - [8192, 128, 1, 2048, 8192, 8192, 8192, 2048]
    - [96, 13.375]
  - - [8192, 128, 1, 4096, 8192, 8192, 8192, 4096]
    - [67, 16.964]
  - - [8192, 128, 1, 8192, 8192, 8192, 8192, 8192]
    - [9, 21.423]
  - - [8192, 256, 1, 128, 8192, 8192, 8192, 128]
    - [20, 6.642]
  - - [8192, 256, 1, 256, 8192, 8192, 8192, 256]
    - [19, 8.059]
  - - [8192, 256, 1, 512, 8192, 8192, 8192, 512]
    - [73, 11.047]
  - - [8192, 256, 1, 1024, 8192, 8192, 8192, 1024]
    - [90, 15.147]
  - - [8192, 256, 1, 2048, 8192, 8192, 8192, 2048]
    - [69, 17.812]
  - - [8192, 256, 1, 4096, 8192, 8192, 8192, 4096]
    - [55, 22.558]
  - - [8192, 256, 1, 8192, 8192, 8192, 8192, 8192]
    - [8, 25.448]
  - - [8192, 512, 1, 128, 8192, 8192, 8192, 128]
    - [89, 7.964]
  - - [8192, 512, 1, 256, 8192, 8192, 8192, 256]
    - [18, 9.809]
  - - [8192, 512, 1, 512, 8192, 8192, 8192, 512]
    - [73, 13.86]
  - - [8192, 512, 1, 1024, 8192, 8192, 8192, 1024]
    - [63, 18.146]
  - - [8192, 512, 1, 2048, 8192, 8192, 8192, 2048]
    - [57, 22.133]
  - - [8192, 512, 1, 4096, 8192, 8192, 8192, 4096]
    - [55, 26.423]
  - - [8192, 512, 1, 8192, 8192, 8192, 8192, 8192]
    - [2, 28.147]
  - - [8192, 1024, 1, 128, 8192, 8192, 8192, 128]
    - [6, 8.331]
  - - [8192, 1024, 1, 256, 8192, 8192, 8192, 256]
    - [64, 12.502]
  - - [8192, 1024, 1, 512, 8192, 8192, 8192, 512]
    - [59, 17.111]
  - - [8192, 1024, 1, 1024, 8192, 8192, 8192, 1024]
    - [61, 22.134]
  - - [8192, 1024, 1, 2048, 8192, 8192, 8192, 2048]
    - [60, 26.73]
  - - [8192, 1024, 1, 4096, 8192, 8192, 8192, 4096]
    - [49, 28.406]
  - - [8192, 1024, 1, 8192, 8192, 8192, 8192, 8192]
    - [34, 31.192]
  - - [8192, 2048, 1, 128, 8192, 8192, 8192, 128]
    - [7, 9.688]
  - - [8192, 2048, 1, 256, 8192, 8192, 8192, 256]
    - [61, 14.287]
  - - [8192, 2048, 1, 512, 8192, 8192, 8192, 512]
    - [53, 20.015]
  - - [8192, 2048, 1, 1024, 8192, 8192, 8192, 1024]
    - [63, 24.932]
  - - [8192, 2048, 1, 2048, 8192, 8192, 8192, 2048]
    - [34, 27.873]
  - - [8192, 2048, 1, 4096, 8192, 8192, 8192, 4096]
    - [34, 31.513]
  - - [8192, 2048, 1, 8192, 8192, 8192, 8192, 8192]
    - [35, 33.884]
  - - [8192, 4096, 1, 128, 8192, 8192, 8192, 128]
    - [7, 11.657]
  - - [8192, 4096, 1, 256, 8192, 8192, 8192, 256]
    - [64, 16.867]
  - - [8192, 4096, 1, 512, 8192, 8192, 8192, 512]
    - [62, 21.433]
  - - [8192, 4096, 1, 1024, 8192, 8192, 8192, 1024]
    - [44, 26.34]
  - - [8192, 4096, 1, 2048, 8192, 8192, 8192, 2048]
    - [33, 30.497]
  - - [8192, 4096, 1, 4096, 8192, 8192, 8192, 4096]
    - [33, 34.457]
  - - [8192, 4096, 1, 8192, 8192, 8192, 8192, 8192]
    - [35, 36.718]
  - - [8192, 8192, 1, 128, 8192, 8192, 8192, 128]
    - [5, 12.234]
  - - [8192, 8192, 1, 256, 8192, 8192, 8192, 256]
    - [43, 16.643]
  - - [8192, 8192, 1, 512, 8192, 8192, 8192, 512]
    - [52, 22.187]
  - - [8192, 8192, 1, 1024, 8192, 8192, 8192, 1024]
    - [51, 27.856]
  - - [8192, 8192, 1, 2048, 8192, 8192, 8192, 2048]
    - [40, 33.773]
  - - [8192, 8192, 1, 4096, 8192, 8192, 8192, 4096]
    - [36, 36.983]
  - - [8192, 8192, 1, 8192, 8192, 8192, 8192, 8192]
    - [38, 39.117]
  - - [1, 1, 1, 32, 1, 1, 1, 32]
    - [106, 0.0]
- null
- null
- DeviceEfficiency
- GridBased
