library/src/amd_detail/rocblaslt/src/Tensile/Logic/streamk/gfx942/aquavanjaram942_Cijk_Alik_Bljk_BBS_BH_UserArgs.yaml
- {MinimumRequiredVersion: 4.33.0}
- aquavanjaram942
- gfx942
- [Device 0049, Device 0050]
    SolutionIndex: 0
    SolutionNameMin: Cijk_Alik_Bljk_BBS_BH_UserArgs_MT32x32x32_MI16x16x1_SN_LDSB0_CLR1_GRVWA4_GRVWB4_GSU0_GSUC0_GSUWGMRR0_K1_LBSPPA128_LBSPPB128_LPA4_LPB4_LRVW4_MIWT1_1_NEPBS0_PLR1_SU32_SUM0_SUS256_SVW1_SKXCCM0_ULSGRO1_VWA1_VWB1_WGM1_WGMXCC1_WGMXCCGn1
    SolutionIndex: 1
    SolutionNameMin: Cijk_Alik_Bljk_BBS_BH_UserArgs_MT32x32x32_MI16x16x1_SN_LDSB0_CLR0_GRVWA4_GRVWB4_GSU0_GSUC0_GSUWGMRR0_K1_LBSPPA128_LBSPPB128_LPA4_LPB4_LRVW4_MIWT1_1_NEPBS0_PLR0_SU32_SUM0_SUS256_SVW1_SKXCCM0_ULSGRO1_VWA1_VWB1_WGM1_WGMXCC1_WGMXCCGn1
    SolutionIndex: 2
    SolutionNameMin: Cijk_Alik_Bljk_BBS_BH_UserArgs_MT128x128x64_MI16x16x1_SN_LDSB1_CLR1_GRVWA8_GRVWB8_GSU0_GSUC0_GSUWGMRR0_K1_LBSPPA512_LBSPPB256_LPA16_LPB16_LRVW8_MIWT4_4_NEPBS0_PLR1_SU32_SUM0_SUS256_SVW4_SKXCCM0_ULSGRO0_VWA4_VWB2_WGM1_WGMXCC1_WGMXCCGn1
    SolutionIndex: 3
    SolutionNameMin: Cijk_Alik_Bljk_BBS_BH_UserArgs_MT128x64x64_MI16x16x1_SN_LDSB1_CLR1_GRVWA8_GRVWB8_GSU0_GSUC0_GSUWGMRR0_K1_LBSPPA512_LBSPPB128_LPA16_LPB16_LRVW8_MIWT4_2_NEPBS0_PLR1_SU32_SUM0_SUS256_SVW4_SKXCCM0_ULSGRO0_VWA4_VWB1_WGM1_WGMXCC1_WGMXCCGn1
    SolutionIndex: 4
    SolutionNameMin: Cijk_Alik_Bljk_BBS_BH_UserArgs_MT32x32x64_MI16x16x1_SN_LDSB0_CLR1_GRVWA8_GRVWB8_GSU0_GSUC0_GSUWGMRR0_K1_LBSPPA128_LBSPPB128_LPA16_LPB16_LRVW8_MIWT1_1_NEPBS0_PLR1_SU32_SUM0_SUS256_SVW1_SKXCCM0_ULSGRO1_VWA1_VWB1_WGM1_WGMXCC1_WGMXCCGn1
    SolutionIndex: 5
    SolutionNameMin: Cijk_Alik_Bljk_BBS_BH_UserArgs_MT64x64x128_MI16x16x1_SN_LDSB1_CLR1_GRVWA8_GRVWB8_GSU0_GSUC0_GSUWGMRR0_K1_LBSPPA512_LBSPPB256_LPA16_LPB16_LRVW8_MIWT2_2_NEPBS0_PLR1_SU32_SUM0_SUS256_SVW2_SKXCCM0_ULSGRO1_VWA2_VWB1_WGM1_WGMXCC1_WGMXCCGn1
    SolutionIndex: 6
    SolutionNameMin: Cijk_Alik_Bljk_BBS_BH_UserArgs_MT32x64x128_MI16x16x1_SN_LDSB1_CLR1_GRVWA8_GRVWB8_GSU0_GSUC0_GSUWGMRR0_K1_LBSPPA256_LBSPPB256_LPA16_LPB16_LRVW8_MIWT1_2_NEPBS0_PLR1_SU32_SUM0_SUS256_SVW1_SKXCCM0_ULSGRO1_VWA1_VWB1_WGM1_WGMXCC1_WGMXCCGn1
    SolutionIndex: 7
    SolutionNameMin: Cijk_Alik_Bljk_BBS_BH_UserArgs_MT32x64x128_MI16x16x1_SN_LDSB1_CLR1_GRVWA8_GRVWB8_GSU0_GSUC0_GSUWGMRR0_K1_LBSPPA256_LBSPPB512_LPA16_LPB16_LRVW8_MIWT1_2_NEPBS0_PLR1_SU32_SUM0_SUS256_SVW1_SKXCCM0_ULSGRO1_VWA1_VWB2_WGM1_WGMXCC1_WGMXCCGn1
    SolutionIndex: 8
    SolutionNameMin: Cijk_Alik_Bljk_BBS_BH_UserArgs_MT64x32x128_MI16x16x1_SN_LDSB1_CLR1_GRVWA8_GRVWB8_GSU0_GSUC0_GSUWGMRR0_K1_LBSPPA512_LBSPPB256_LPA16_LPB16_LRVW8_MIWT2_1_NEPBS0_PLR1_SU32_SUM0_SUS256_SVW2_SKXCCM0_ULSGRO0_VWA2_VWB1_WGM1_WGMXCC1_WGMXCCGn1
    SolutionIndex: 9
    SolutionNameMin: Cijk_Alik_Bljk_BBS_BH_UserArgs_MT64x32x128_MI16x16x1_SN_LDSB1_CLR1_GRVWA8_GRVWB8_GSU0_GSUC0_GSUWGMRR0_K1_LBSPPA256_LBSPPB256_LPA16_LPB16_LRVW8_MIWT2_1_NEPBS0_PLR1_SU32_SUM0_SUS256_SVW1_SKXCCM0_ULSGRO1_VWA1_VWB1_WGM1_WGMXCC1_WGMXCCGn1
    SolutionIndex: 10
    SolutionNameMin: Cijk_Alik_Bljk_BBS_BH_UserArgs_MT64x32x128_MI16x16x1_SN_LDSB1_CLR1_GRVWA8_GRVWB8_GSU0_GSUC0_GSUWGMRR0_K1_LBSPPA256_LBSPPB256_LPA16_LPB16_LRVW8_MIWT2_1_NEPBS0_PLR2_SU32_SUM0_SUS256_SVW1_SKXCCM0_ULSGRO0_VWA1_VWB1_WGM1_WGMXCC1_WGMXCCGn1
    SolutionIndex: 11
    SolutionNameMin: Cijk_Alik_Bljk_BBS_BH_UserArgs_MT32x32x128_MI16x16x1_SN_LDSB1_CLR1_GRVWA8_GRVWB8_GSU0_GSUC0_GSUWGMRR0_K1_LBSPPA256_LBSPPB256_LPA16_LPB16_LRVW8_MIWT1_1_NEPBS0_PLR1_SU32_SUM0_SUS256_SVW1_SKXCCM0_ULSGRO0_VWA1_VWB1_WGM1_WGMXCC1_WGMXCCGn1
    SolutionIndex: 12
    SolutionNameMin: Cijk_Alik_Bljk_BBS_BH_UserArgs_MT32x32x128_MI16x16x1_SN_LDSB1_CLR1_GRVWA8_GRVWB8_GSU0_GSUC0_GSUWGMRR0_K1_LBSPPA256_LBSPPB256_LPA16_LPB16_LRVW8_MIWT1_1_NEPBS0_PLR1_SU32_SUM0_SUS256_SVW1_SKXCCM0_ULSGRO1_VWA1_VWB1_WGM1_WGMXCC1_WGMXCCGn1
    SolutionIndex: 13
    SolutionNameMin: Cijk_Alik_Bljk_BBS_BH_UserArgs_MT32x32x128_MI16x16x1_SN_LDSB1_CLR1_GRVWA8_GRVWB8_GSU0_GSUC0_GSUWGMRR0_K1_LBSPPA256_LBSPPB256_LPA16_LPB16_LRVW8_MIWT1_1_NEPBS0_PLR2_SU32_SUM0_SUS256_SVW1_SKXCCM0_ULSGRO0_VWA1_VWB1_WGM1_WGMXCC1_WGMXCCGn1
    SolutionIndex: 14
    SolutionNameMin: Cijk_Alik_Bljk_BBS_BH_UserArgs_MT32x32x128_MI16x16x1_SN_LDSB1_CLR1_GRVWA8_GRVWB8_GSU0_GSUC0_GSUWGMRR0_K1_LBSPPA256_LBSPPB256_LPA16_LPB16_LRVW8_MIWT1_1_NEPBS0_PLR2_SU32_SUM0_SUS256_SVW1_SKXCCM0_ULSGRO1_VWA1_VWB1_WGM1_WGMXCC1_WGMXCCGn1
    SolutionIndex: 15
    SolutionNameMin: Cijk_Alik_Bljk_BBS_BH_UserArgs_MT32x32x128_MI16x16x1_SN_LDSB1_CLR1_GRVWA8_GRVWB8_GSU0_GSUC0_GSUWGMRR0_K1_LBSPPA256_LBSPPB256_LPA16_LPB16_LRVW8_MIWT1_1_NEPBS0_PLR3_SU32_SUM0_SUS256_SVW1_SKXCCM0_ULSGRO0_VWA1_VWB1_WGM1_WGMXCC1_WGMXCCGn1
    SolutionIndex: 16
    SolutionNameMin: Cijk_Alik_Bljk_BBS_BH_UserArgs_MT32x32x32_MI16x16x1_SN_LDSB0_CLR1_GRVWA4_GRVWB4_GSU0_GSUC0_GSUWGMRR0_K1_LBSPPA128_LBSPPB128_LPA4_LPB4_LRVW4_MIWT1_1_NEPBS16_PLR1_SU32_SUM0_SUS256_SVW1_SKXCCM0_ULSGRO1_VWA1_VWB1_WGM1_WGMXCC1_WGMXCCGn1
    SolutionIndex: 17
    SolutionNameMin: Cijk_Alik_Bljk_BBS_BH_UserArgs_MT32x32x64_MI16x16x1_SN_LDSB0_CLR1_GRVWA8_GRVWB8_GSU0_GSUC0_GSUWGMRR0_K1_LBSPPA128_LBSPPB128_LPA16_LPB16_LRVW8_MIWT1_1_NEPBS16_PLR1_SU32_SUM0_SUS256_SVW1_SKXCCM0_ULSGRO0_VWA1_VWB1_WGM1_WGMXCC1_WGMXCCGn1
    SolutionIndex: 18
    SolutionNameMin: Cijk_Alik_Bljk_BBS_BH_UserArgs_MT32x32x64_MI16x16x1_SN_LDSB0_CLR1_GRVWA8_GRVWB8_GSU0_GSUC0_GSUWGMRR0_K1_LBSPPA128_LBSPPB128_LPA16_LPB16_LRVW8_MIWT1_1_NEPBS16_PLR2_SU32_SUM0_SUS256_SVW1_SKXCCM0_ULSGRO0_VWA1_VWB1_WGM1_WGMXCC1_WGMXCCGn1
    SolutionIndex: 19
    SolutionNameMin: Cijk_Alik_Bljk_BBS_BH_UserArgs_MT64x64x128_MI16x16x1_SN_LDSB1_CLR1_GRVWA8_GRVWB8_GSU0_GSUC0_GSUWGMRR0_K1_LBSPPA512_LBSPPB256_LPA16_LPB16_LRVW8_MIWT2_2_NEPBS16_PLR1_SU32_SUM0_SUS256_SVW2_SKXCCM0_ULSGRO1_VWA2_VWB1_WGM4_WGMXCC1_WGMXCCGn1
    SolutionIndex: 20
    SolutionNameMin: Cijk_Alik_Bljk_BBS_BH_UserArgs_MT64x64x128_MI16x16x1_SN_LDSB1_CLR1_GRVWA8_GRVWB8_GSU0_GSUC0_GSUWGMRR0_K1_LBSPPA512_LBSPPB512_LPA16_LPB16_LRVW8_MIWT2_2_NEPBS16_PLR2_SU32_SUM0_SUS256_SVW2_SKXCCM0_ULSGRO1_VWA2_VWB2_WGM4_WGMXCC1_WGMXCCGn1
    SolutionIndex: 21
    SolutionNameMin: Cijk_Alik_Bljk_BBS_BH_UserArgs_MT32x32x128_MI16x16x1_SN_LDSB1_CLR1_GRVWA8_GRVWB8_GSU0_GSUC0_GSUWGMRR0_K1_LBSPPA256_LBSPPB256_LPA16_LPB16_LRVW8_MIWT1_1_NEPBS16_PLR1_SU32_SUM0_SUS256_SVW1_SKXCCM0_ULSGRO0_VWA1_VWB1_WGM1_WGMXCC1_WGMXCCGn1
    SolutionIndex: 22
    SolutionNameMin: Cijk_Alik_Bljk_BBS_BH_UserArgs_MT32x32x128_MI16x16x1_SN_LDSB1_CLR1_GRVWA8_GRVWB8_GSU0_GSUC0_GSUWGMRR0_K1_LBSPPA256_LBSPPB256_LPA16_LPB16_LRVW8_MIWT1_1_NEPBS16_PLR1_SU32_SUM0_SUS256_SVW1_SKXCCM0_ULSGRO1_VWA1_VWB1_WGM1_WGMXCC1_WGMXCCGn1
    SolutionIndex: 23
    SolutionNameMin: Cijk_Alik_Bljk_BBS_BH_UserArgs_MT32x32x128_MI16x16x1_SN_LDSB1_CLR1_GRVWA8_GRVWB8_GSU0_GSUC0_GSUWGMRR0_K1_LBSPPA256_LBSPPB256_LPA16_LPB16_LRVW8_MIWT1_1_NEPBS16_PLR2_SU32_SUM0_SUS256_SVW1_SKXCCM0_ULSGRO0_VWA1_VWB1_WGM1_WGMXCC1_WGMXCCGn1
    SolutionIndex: 24
    SolutionNameMin: Cijk_Alik_Bljk_BBS_BH_UserArgs_MT32x32x128_MI16x16x1_SN_LDSB1_CLR1_GRVWA8_GRVWB8_GSU0_GSUC0_GSUWGMRR0_K1_LBSPPA256_LBSPPB256_LPA16_LPB16_LRVW8_MIWT1_1_NEPBS16_PLR2_SU32_SUM0_SUS256_SVW1_SKXCCM0_ULSGRO1_VWA1_VWB1_WGM1_WGMXCC1_WGMXCCGn1
    SolutionIndex: 25
    SolutionNameMin: Cijk_Alik_Bljk_BBS_BH_UserArgs_MT32x32x32_MI16x16x1_SN_LDSB0_CLR0_GRVWA4_GRVWB4_GSU0_GSUC0_GSUWGMRR0_K1_LBSPPA128_LBSPPB128_LPA4_LPB4_LRVW4_MIWT1_1_NEPBS0_PLR0_SU32_SUM0_SUS256_SVW1_SKXCCM8_ULSGRO0_VWA1_VWB1_WGM1_WGMXCC1_WGMXCCGn1
    SolutionIndex: 26
    SolutionNameMin: Cijk_Alik_Bljk_BBS_BH_UserArgs_MT128x128x64_MI16x16x1_SN_LDSB1_CLR1_GRVWA8_GRVWB8_GSU0_GSUC0_GSUWGMRR0_K1_LBSPPA512_LBSPPB256_LPA16_LPB16_LRVW8_MIWT4_4_NEPBS0_PLR1_SU32_SUM0_SUS256_SVW4_SKXCCM8_ULSGRO0_VWA4_VWB2_WGM8_WGMXCC1_WGMXCCGn1
    SolutionIndex: 27
    SolutionNameMin: Cijk_Alik_Bljk_BBS_BH_UserArgs_MT128x64x64_MI16x16x1_SN_LDSB1_CLR1_GRVWA8_GRVWB8_GSU0_GSUC0_GSUWGMRR0_K1_LBSPPA256_LBSPPB256_LPA16_LPB16_LRVW8_MIWT4_2_NEPBS0_PLR2_SU32_SUM0_SUS256_SVW2_SKXCCM8_ULSGRO1_VWA2_VWB2_WGM1_WGMXCC1_WGMXCCGn1
    SolutionIndex: 28
    SolutionNameMin: Cijk_Alik_Bljk_BBS_BH_UserArgs_MT64x64x64_MI16x16x1_SN_LDSB1_CLR1_GRVWA8_GRVWB8_GSU0_GSUC0_GSUWGMRR0_K1_LBSPPA128_LBSPPB128_LPA16_LPB16_LRVW8_MIWT2_2_NEPBS0_PLR1_SU32_SUM0_SUS256_SVW1_SKXCCM8_ULSGRO0_VWA1_VWB1_WGM1_WGMXCC1_WGMXCCGn1
    SolutionIndex: 29
    SolutionNameMin: Cijk_Alik_Bljk_BBS_BH_UserArgs_MT32x64x64_MI16x16x1_SN_LDSB0_CLR1_GRVWA8_GRVWB8_GSU0_GSUC0_GSUWGMRR0_K1_LBSPPA128_LBSPPB128_LPA16_LPB16_LRVW8_MIWT1_2_NEPBS0_PLR1_SU32_SUM0_SUS256_SVW1_SKXCCM8_ULSGRO0_VWA1_VWB1_WGM1_WGMXCC1_WGMXCCGn1
    SolutionIndex: 30
    SolutionNameMin: Cijk_Alik_Bljk_BBS_BH_UserArgs_MT32x64x64_MI16x16x1_SN_LDSB0_CLR1_GRVWA8_GRVWB8_GSU0_GSUC0_GSUWGMRR0_K1_LBSPPA128_LBSPPB256_LPA16_LPB16_LRVW8_MIWT1_2_NEPBS0_PLR1_SU32_SUM0_SUS256_SVW1_SKXCCM8_ULSGRO0_VWA1_VWB2_WGM1_WGMXCC1_WGMXCCGn1
    SolutionIndex: 31
    SolutionNameMin: Cijk_Alik_Bljk_BBS_BH_UserArgs_MT32x32x64_MI16x16x1_SN_LDSB0_CLR1_GRVWA8_GRVWB8_GSU0_GSUC0_GSUWGMRR0_K1_LBSPPA128_LBSPPB128_LPA16_LPB16_LRVW8_MIWT1_1_NEPBS0_PLR1_SU32_SUM0_SUS256_SVW1_SKXCCM8_ULSGRO0_VWA1_VWB1_WGM1_WGMXCC1_WGMXCCGn1
    SolutionIndex: 32
    SolutionNameMin: Cijk_Alik_Bljk_BBS_BH_UserArgs_MT32x32x64_MI16x16x1_SN_LDSB0_CLR1_GRVWA8_GRVWB8_GSU0_GSUC0_GSUWGMRR0_K1_LBSPPA128_LBSPPB128_LPA16_LPB16_LRVW8_MIWT1_1_NEPBS0_PLR1_SU32_SUM0_SUS256_SVW1_SKXCCM8_ULSGRO1_VWA1_VWB1_WGM1_WGMXCC1_WGMXCCGn1
    SolutionIndex: 33
    SolutionNameMin: Cijk_Alik_Bljk_BBS_BH_UserArgs_MT64x64x128_MI16x16x1_SN_LDSB1_CLR1_GRVWA8_GRVWB8_GSU0_GSUC0_GSUWGMRR0_K1_LBSPPA512_LBSPPB256_LPA16_LPB16_LRVW8_MIWT2_2_NEPBS0_PLR1_SU32_SUM0_SUS256_SVW2_SKXCCM8_ULSGRO0_VWA2_VWB1_WGM1_WGMXCC1_WGMXCCGn1
    SolutionIndex: 34
    SolutionNameMin: Cijk_Alik_Bljk_BBS_BH_UserArgs_MT64x64x128_MI16x16x1_SN_LDSB1_CLR1_GRVWA8_GRVWB8_GSU0_GSUC0_GSUWGMRR0_K1_LBSPPA512_LBSPPB512_LPA16_LPB16_LRVW8_MIWT2_2_NEPBS0_PLR1_SU32_SUM0_SUS256_SVW2_SKXCCM8_ULSGRO0_VWA2_VWB2_WGM1_WGMXCC1_WGMXCCGn1
    SolutionIndex: 35
    SolutionNameMin: Cijk_Alik_Bljk_BBS_BH_UserArgs_MT64x64x128_MI16x16x1_SN_LDSB1_CLR1_GRVWA8_GRVWB8_GSU0_GSUC0_GSUWGMRR0_K1_LBSPPA512_LBSPPB256_LPA16_LPB16_LRVW8_MIWT2_2_NEPBS0_PLR2_SU32_SUM0_SUS256_SVW2_SKXCCM8_ULSGRO0_VWA2_VWB1_WGM1_WGMXCC1_WGMXCCGn1
    SolutionIndex: 36
    SolutionNameMin: Cijk_Alik_Bljk_BBS_BH_UserArgs_MT64x64x128_MI16x16x1_SN_LDSB1_CLR1_GRVWA8_GRVWB8_GSU0_GSUC0_GSUWGMRR0_K1_LBSPPA512_LBSPPB256_LPA16_LPB16_LRVW8_MIWT2_2_NEPBS0_PLR2_SU32_SUM0_SUS256_SVW2_SKXCCM8_ULSGRO1_VWA2_VWB1_WGM1_WGMXCC1_WGMXCCGn1
    SolutionIndex: 37
    SolutionNameMin: Cijk_Alik_Bljk_BBS_BH_UserArgs_MT64x64x128_MI16x16x1_SN_LDSB1_CLR1_GRVWA8_GRVWB8_GSU0_GSUC0_GSUWGMRR0_K1_LBSPPA512_LBSPPB256_LPA16_LPB16_LRVW8_MIWT2_2_NEPBS0_PLR3_SU32_SUM0_SUS256_SVW2_SKXCCM8_ULSGRO1_VWA2_VWB1_WGM1_WGMXCC1_WGMXCCGn1
    SolutionIndex: 38
    SolutionNameMin: Cijk_Alik_Bljk_BBS_BH_UserArgs_MT64x64x128_MI16x16x1_SN_LDSB1_CLR1_GRVWA8_GRVWB8_GSU0_GSUC0_GSUWGMRR0_K1_LBSPPA512_LBSPPB512_LPA16_LPB16_LRVW8_MIWT2_2_NEPBS0_PLR2_SU32_SUM0_SUS256_SVW2_SKXCCM8_ULSGRO0_VWA2_VWB2_WGM4_WGMXCC1_WGMXCCGn1
    SolutionIndex: 39
    SolutionNameMin: Cijk_Alik_Bljk_BBS_BH_UserArgs_MT64x64x128_MI16x16x1_SN_LDSB1_CLR1_GRVWA8_GRVWB8_GSU0_GSUC0_GSUWGMRR0_K1_LBSPPA512_LBSPPB256_LPA16_LPB16_LRVW8_MIWT2_2_NEPBS0_PLR1_SU32_SUM0_SUS256_SVW2_SKXCCM8_ULSGRO1_VWA2_VWB1_WGM8_WGMXCC1_WGMXCCGn1
    SolutionIndex: 40
    SolutionNameMin: Cijk_Alik_Bljk_BBS_BH_UserArgs_MT32x64x128_MI16x16x1_SN_LDSB1_CLR1_GRVWA8_GRVWB8_GSU0_GSUC0_GSUWGMRR0_K1_LBSPPA256_LBSPPB512_LPA16_LPB16_LRVW8_MIWT1_2_NEPBS0_PLR1_SU32_SUM0_SUS256_SVW1_SKXCCM8_ULSGRO0_VWA1_VWB2_WGM1_WGMXCC1_WGMXCCGn1
    SolutionIndex: 41
    SolutionNameMin: Cijk_Alik_Bljk_BBS_BH_UserArgs_MT32x64x128_MI16x16x1_SN_LDSB1_CLR1_GRVWA8_GRVWB8_GSU0_GSUC0_GSUWGMRR0_K1_LBSPPA256_LBSPPB256_LPA16_LPB16_LRVW8_MIWT1_2_NEPBS0_PLR2_SU32_SUM0_SUS256_SVW1_SKXCCM8_ULSGRO0_VWA1_VWB1_WGM1_WGMXCC1_WGMXCCGn1
    SolutionIndex: 42
    SolutionNameMin: Cijk_Alik_Bljk_BBS_BH_UserArgs_MT32x64x128_MI16x16x1_SN_LDSB1_CLR1_GRVWA8_GRVWB8_GSU0_GSUC0_GSUWGMRR0_K1_LBSPPA256_LBSPPB512_LPA16_LPB16_LRVW8_MIWT1_2_NEPBS0_PLR2_SU32_SUM0_SUS256_SVW1_SKXCCM8_ULSGRO1_VWA1_VWB2_WGM1_WGMXCC1_WGMXCCGn1
    SolutionIndex: 43
    SolutionNameMin: Cijk_Alik_Bljk_BBS_BH_UserArgs_MT64x32x128_MI16x16x1_SN_LDSB1_CLR1_GRVWA8_GRVWB8_GSU0_GSUC0_GSUWGMRR0_K1_LBSPPA512_LBSPPB256_LPA16_LPB16_LRVW8_MIWT2_1_NEPBS0_PLR2_SU32_SUM0_SUS256_SVW2_SKXCCM8_ULSGRO0_VWA2_VWB1_WGM1_WGMXCC1_WGMXCCGn1
    SolutionIndex: 44
    SolutionNameMin: Cijk_Alik_Bljk_BBS_BH_UserArgs_MT32x32x128_MI16x16x1_SN_LDSB1_CLR1_GRVWA8_GRVWB8_GSU0_GSUC0_GSUWGMRR0_K1_LBSPPA256_LBSPPB256_LPA16_LPB16_LRVW8_MIWT1_1_NEPBS0_PLR1_SU32_SUM0_SUS256_SVW1_SKXCCM8_ULSGRO0_VWA1_VWB1_WGM1_WGMXCC1_WGMXCCGn1
    SolutionIndex: 45
    SolutionNameMin: Cijk_Alik_Bljk_BBS_BH_UserArgs_MT32x32x128_MI16x16x1_SN_LDSB1_CLR1_GRVWA8_GRVWB8_GSU0_GSUC0_GSUWGMRR0_K1_LBSPPA256_LBSPPB256_LPA16_LPB16_LRVW8_MIWT1_1_NEPBS0_PLR1_SU32_SUM0_SUS256_SVW1_SKXCCM8_ULSGRO1_VWA1_VWB1_WGM1_WGMXCC1_WGMXCCGn1
    SolutionIndex: 46
    SolutionNameMin: Cijk_Alik_Bljk_BBS_BH_UserArgs_MT32x32x128_MI16x16x1_SN_LDSB1_CLR1_GRVWA8_GRVWB8_GSU0_GSUC0_GSUWGMRR0_K1_LBSPPA256_LBSPPB256_LPA16_LPB16_LRVW8_MIWT1_1_NEPBS0_PLR2_SU32_SUM0_SUS256_SVW1_SKXCCM8_ULSGRO0_VWA1_VWB1_WGM1_WGMXCC1_WGMXCCGn1
    SolutionIndex: 47
    SolutionNameMin: Cijk_Alik_Bljk_BBS_BH_UserArgs_MT32x32x128_MI16x16x1_SN_LDSB1_CLR1_GRVWA8_GRVWB8_GSU0_GSUC0_GSUWGMRR0_K1_LBSPPA256_LBSPPB256_LPA16_LPB16_LRVW8_MIWT1_1_NEPBS0_PLR2_SU32_SUM0_SUS256_SVW1_SKXCCM8_ULSGRO1_VWA1_VWB1_WGM1_WGMXCC1_WGMXCCGn1
    SolutionIndex: 48
    SolutionNameMin: Cijk_Alik_Bljk_BBS_BH_UserArgs_MT32x32x128_MI16x16x1_SN_LDSB1_CLR1_GRVWA8_GRVWB8_GSU0_GSUC0_GSUWGMRR0_K1_LBSPPA256_LBSPPB256_LPA16_LPB16_LRVW8_MIWT1_1_NEPBS0_PLR3_SU32_SUM0_SUS256_SVW1_SKXCCM8_ULSGRO0_VWA1_VWB1_WGM1_WGMXCC1_WGMXCCGn1
    SolutionIndex: 49
    SolutionNameMin: Cijk_Alik_Bljk_BBS_BH_UserArgs_MT32x32x128_MI16x16x1_SN_LDSB1_CLR1_GRVWA8_GRVWB8_GSU0_GSUC0_GSUWGMRR0_K1_LBSPPA256_LBSPPB256_LPA16_LPB16_LRVW8_MIWT1_1_NEPBS0_PLR3_SU32_SUM0_SUS256_SVW1_SKXCCM8_ULSGRO0_VWA1_VWB1_WGM4_WGMXCC1_WGMXCCGn1
    SolutionIndex: 50
    SolutionNameMin: Cijk_Alik_Bljk_BBS_BH_UserArgs_MT32x32x32_MI16x16x1_SN_LDSB0_CLR1_GRVWA4_GRVWB4_GSU0_GSUC0_GSUWGMRR0_K1_LBSPPA128_LBSPPB128_LPA4_LPB4_LRVW4_MIWT1_1_NEPBS16_PLR1_SU32_SUM0_SUS256_SVW1_SKXCCM8_ULSGRO1_VWA1_VWB1_WGM1_WGMXCC1_WGMXCCGn1
    SolutionIndex: 51
    SolutionNameMin: Cijk_Alik_Bljk_BBS_BH_UserArgs_MT128x128x64_MI16x16x1_SN_LDSB1_CLR1_GRVWA8_GRVWB8_GSU0_GSUC0_GSUWGMRR0_K1_LBSPPA512_LBSPPB128_LPA16_LPB16_LRVW8_MIWT4_4_NEPBS16_PLR1_SU32_SUM0_SUS256_SVW4_SKXCCM8_ULSGRO0_VWA4_VWB1_WGM8_WGMXCC1_WGMXCCGn1
    SolutionIndex: 52
    SolutionNameMin: Cijk_Alik_Bljk_BBS_BH_UserArgs_MT128x64x64_MI16x16x1_SN_LDSB1_CLR1_GRVWA8_GRVWB8_GSU0_GSUC0_GSUWGMRR0_K1_LBSPPA512_LBSPPB128_LPA16_LPB16_LRVW8_MIWT4_2_NEPBS16_PLR1_SU32_SUM0_SUS256_SVW4_SKXCCM8_ULSGRO0_VWA4_VWB1_WGM1_WGMXCC1_WGMXCCGn1
    SolutionIndex: 53
    SolutionNameMin: Cijk_Alik_Bljk_BBS_BH_UserArgs_MT128x64x64_MI16x16x1_SN_LDSB1_CLR1_GRVWA8_GRVWB8_GSU0_GSUC0_GSUWGMRR0_K1_LBSPPA512_LBSPPB256_LPA16_LPB16_LRVW8_MIWT4_2_NEPBS16_PLR1_SU32_SUM0_SUS256_SVW4_SKXCCM8_ULSGRO0_VWA4_VWB2_WGM1_WGMXCC1_WGMXCCGn1
    SolutionIndex: 54
    SolutionNameMin: Cijk_Alik_Bljk_BBS_BH_UserArgs_MT128x64x64_MI16x16x1_SN_LDSB1_CLR1_GRVWA8_GRVWB8_GSU0_GSUC0_GSUWGMRR0_K1_LBSPPA512_LBSPPB256_LPA16_LPB16_LRVW8_MIWT4_2_NEPBS16_PLR1_SU32_SUM0_SUS256_SVW4_SKXCCM8_ULSGRO1_VWA4_VWB2_WGM8_WGMXCC1_WGMXCCGn1
    SolutionIndex: 55
    SolutionNameMin: Cijk_Alik_Bljk_BBS_BH_UserArgs_MT64x64x64_MI16x16x1_SN_LDSB1_CLR1_GRVWA8_GRVWB8_GSU0_GSUC0_GSUWGMRR0_K1_LBSPPA256_LBSPPB256_LPA16_LPB16_LRVW8_MIWT2_2_NEPBS16_PLR1_SU32_SUM0_SUS256_SVW2_SKXCCM8_ULSGRO1_VWA2_VWB2_WGM1_WGMXCC1_WGMXCCGn1
    SolutionIndex: 56
    SolutionNameMin: Cijk_Alik_Bljk_BBS_BH_UserArgs_MT64x64x64_MI16x16x1_SN_LDSB1_CLR1_GRVWA8_GRVWB8_GSU0_GSUC0_GSUWGMRR0_K1_LBSPPA256_LBSPPB128_LPA16_LPB16_LRVW8_MIWT2_2_NEPBS16_PLR1_SU32_SUM0_SUS256_SVW2_SKXCCM8_ULSGRO0_VWA2_VWB1_WGM4_WGMXCC1_WGMXCCGn1
    SolutionIndex: 57
    SolutionNameMin: Cijk_Alik_Bljk_BBS_BH_UserArgs_MT32x32x64_MI16x16x1_SN_LDSB0_CLR1_GRVWA8_GRVWB8_GSU0_GSUC0_GSUWGMRR0_K1_LBSPPA128_LBSPPB128_LPA16_LPB16_LRVW8_MIWT1_1_NEPBS16_PLR1_SU32_SUM0_SUS256_SVW1_SKXCCM8_ULSGRO1_VWA1_VWB1_WGM1_WGMXCC1_WGMXCCGn1
    SolutionIndex: 58
    SolutionNameMin: Cijk_Alik_Bljk_BBS_BH_UserArgs_MT32x32x64_MI16x16x1_SN_LDSB0_CLR1_GRVWA8_GRVWB8_GSU0_GSUC0_GSUWGMRR0_K1_LBSPPA128_LBSPPB128_LPA16_LPB16_LRVW8_MIWT1_1_NEPBS16_PLR1_SU32_SUM0_SUS256_SVW1_SKXCCM8_ULSGRO1_VWA1_VWB1_WGM4_WGMXCC1_WGMXCCGn1
    SolutionIndex: 59
    SolutionNameMin: Cijk_Alik_Bljk_BBS_BH_UserArgs_MT64x64x128_MI16x16x1_SN_LDSB1_CLR1_GRVWA8_GRVWB8_GSU0_GSUC0_GSUWGMRR0_K1_LBSPPA512_LBSPPB512_LPA16_LPB16_LRVW8_MIWT2_2_NEPBS16_PLR1_SU32_SUM0_SUS256_SVW2_SKXCCM8_ULSGRO0_VWA2_VWB2_WGM1_WGMXCC1_WGMXCCGn1
    SolutionIndex: 60
    SolutionNameMin: Cijk_Alik_Bljk_BBS_BH_UserArgs_MT64x64x128_MI16x16x1_SN_LDSB1_CLR1_GRVWA8_GRVWB8_GSU0_GSUC0_GSUWGMRR0_K1_LBSPPA512_LBSPPB256_LPA16_LPB16_LRVW8_MIWT2_2_NEPBS16_PLR1_SU32_SUM0_SUS256_SVW2_SKXCCM8_ULSGRO1_VWA2_VWB1_WGM1_WGMXCC1_WGMXCCGn1
    SolutionIndex: 61
    SolutionNameMin: Cijk_Alik_Bljk_BBS_BH_UserArgs_MT64x32x128_MI16x16x1_SN_LDSB1_CLR1_GRVWA8_GRVWB8_GSU0_GSUC0_GSUWGMRR0_K1_LBSPPA512_LBSPPB256_LPA16_LPB16_LRVW8_MIWT2_1_NEPBS16_PLR1_SU32_SUM0_SUS256_SVW2_SKXCCM8_ULSGRO1_VWA2_VWB1_WGM1_WGMXCC1_WGMXCCGn1
    SolutionIndex: 62
    SolutionNameMin: Cijk_Alik_Bljk_BBS_BH_UserArgs_MT64x32x128_MI16x16x1_SN_LDSB1_CLR1_GRVWA8_GRVWB8_GSU0_GSUC0_GSUWGMRR0_K1_LBSPPA512_LBSPPB256_LPA16_LPB16_LRVW8_MIWT2_1_NEPBS16_PLR3_SU32_SUM0_SUS256_SVW2_SKXCCM8_ULSGRO1_VWA2_VWB1_WGM1_WGMXCC1_WGMXCCGn1
    SolutionIndex: 63
    SolutionNameMin: Cijk_Alik_Bljk_BBS_BH_UserArgs_MT32x32x128_MI16x16x1_SN_LDSB1_CLR1_GRVWA8_GRVWB8_GSU0_GSUC0_GSUWGMRR0_K1_LBSPPA256_LBSPPB256_LPA16_LPB16_LRVW8_MIWT1_1_NEPBS16_PLR1_SU32_SUM0_SUS256_SVW1_SKXCCM8_ULSGRO0_VWA1_VWB1_WGM1_WGMXCC1_WGMXCCGn1
    SolutionIndex: 64
    SolutionNameMin: Cijk_Alik_Bljk_BBS_BH_UserArgs_MT32x32x128_MI16x16x1_SN_LDSB1_CLR1_GRVWA8_GRVWB8_GSU0_GSUC0_GSUWGMRR0_K1_LBSPPA256_LBSPPB256_LPA16_LPB16_LRVW8_MIWT1_1_NEPBS16_PLR1_SU32_SUM0_SUS256_SVW1_SKXCCM8_ULSGRO1_VWA1_VWB1_WGM1_WGMXCC1_WGMXCCGn1
    SolutionIndex: 65
    SolutionNameMin: Cijk_Alik_Bljk_BBS_BH_UserArgs_MT32x32x128_MI16x16x1_SN_LDSB1_CLR1_GRVWA8_GRVWB8_GSU0_GSUC0_GSUWGMRR0_K1_LBSPPA256_LBSPPB256_LPA16_LPB16_LRVW8_MIWT1_1_NEPBS16_PLR2_SU32_SUM0_SUS256_SVW1_SKXCCM8_ULSGRO0_VWA1_VWB1_WGM1_WGMXCC1_WGMXCCGn1
    SolutionIndex: 66
    SolutionNameMin: Cijk_Alik_Bljk_BBS_BH_UserArgs_MT32x32x128_MI16x16x1_SN_LDSB1_CLR1_GRVWA8_GRVWB8_GSU0_GSUC0_GSUWGMRR0_K1_LBSPPA256_LBSPPB256_LPA16_LPB16_LRVW8_MIWT1_1_NEPBS16_PLR2_SU32_SUM0_SUS256_SVW1_SKXCCM8_ULSGRO1_VWA1_VWB1_WGM1_WGMXCC1_WGMXCCGn1
    SolutionIndex: 67
    SolutionNameMin: Cijk_Alik_Bljk_BBS_BH_UserArgs_MT32x32x128_MI16x16x1_SN_LDSB1_CLR1_GRVWA8_GRVWB8_GSU0_GSUC0_GSUWGMRR0_K1_LBSPPA256_LBSPPB256_LPA16_LPB16_LRVW8_MIWT1_1_NEPBS16_PLR3_SU32_SUM0_SUS256_SVW1_SKXCCM8_ULSGRO0_VWA1_VWB1_WGM1_WGMXCC1_WGMXCCGn1
    SolutionIndex: 68
    SolutionNameMin: Cijk_Alik_Bljk_BBS_BH_UserArgs_MT32x32x128_MI16x16x1_SN_LDSB1_CLR1_GRVWA8_GRVWB8_GSU0_GSUC0_GSUWGMRR0_K1_LBSPPA256_LBSPPB256_LPA16_LPB16_LRVW8_MIWT1_1_NEPBS16_PLR3_SU32_SUM0_SUS256_SVW1_SKXCCM8_ULSGRO1_VWA1_VWB1_WGM1_WGMXCC1_WGMXCCGn1
    SolutionIndex: 69
    SolutionNameMin: Cijk_Alik_Bljk_BBS_BH_UserArgs_MT32x32x64_MI16x16x1_SN_LDSB0_CLR1_GRVWA8_GRVWB8_GSU0_GSUC0_GSUWGMRR0_K1_LBSPPA128_LBSPPB128_LPA16_LPB16_LRVW8_MIWT1_1_NEPBS0_PLR1_SU32_SUM0_SUS256_SVW1_SKXCCM8_ULSGRO1_VWA1_VWB1_WGM8_WGMXCC1_WGMXCCGn1
    SolutionIndex: 70
    SolutionNameMin: Cijk_Alik_Bljk_BBS_BH_UserArgs_MT32x32x64_MI16x16x1_SN_LDSB0_CLR1_GRVWA8_GRVWB8_GSU0_GSUC0_GSUWGMRR0_K1_LBSPPA128_LBSPPB128_LPA16_LPB16_LRVW8_MIWT1_1_NEPBS16_PLR1_SU32_SUM0_SUS256_SVW1_SKXCCM8_ULSGRO1_VWA1_VWB1_WGM8_WGMXCC1_WGMXCCGn1
    SolutionIndex: 71
    SolutionNameMin: Cijk_Alik_Bljk_BBS_BH_UserArgs_MT32x32x128_MI16x16x1_SN_LDSB1_CLR1_GRVWA8_GRVWB8_GSU0_GSUC0_GSUWGMRR0_K1_LBSPPA256_LBSPPB256_LPA16_LPB16_LRVW8_MIWT1_1_NEPBS16_PLR2_SU32_SUM0_SUS256_SVW1_SKXCCM8_ULSGRO0_VWA1_VWB1_WGM4_WGMXCC1_WGMXCCGn1
    SolutionIndex: 72
    SolutionNameMin: Cijk_Alik_Bljk_BBS_BH_UserArgs_MT32x64x64_MI16x16x1_SN_LDSB0_CLR1_GRVWA8_GRVWB8_GSU0_GSUC0_GSUWGMRR0_K1_LBSPPA128_LBSPPB128_LPA16_LPB16_LRVW8_MIWT1_2_NEPBS16_PLR1_SU32_SUM0_SUS256_SVW1_SKXCCM8_ULSGRO1_VWA1_VWB1_WGM1_WGMXCC1_WGMXCCGn1
    SolutionIndex: 73
    SolutionNameMin: Cijk_Alik_Bljk_BBS_BH_UserArgs_MT32x64x128_MI16x16x1_SN_LDSB1_CLR1_GRVWA8_GRVWB8_GSU0_GSUC0_GSUWGMRR0_K1_LBSPPA256_LBSPPB512_LPA16_LPB16_LRVW8_MIWT1_2_NEPBS0_PLR2_SU32_SUM0_SUS256_SVW1_SKXCCM8_ULSGRO0_VWA1_VWB2_WGM4_WGMXCC1_WGMXCCGn1
    SolutionIndex: 74
    SolutionNameMin: Cijk_Alik_Bljk_BBS_BH_UserArgs_MT64x64x64_MI16x16x1_SN_LDSB1_CLR1_GRVWA8_GRVWB8_GSU0_GSUC0_GSUWGMRR0_K1_LBSPPA128_LBSPPB128_LPA16_LPB16_LRVW8_MIWT2_2_NEPBS0_PLR1_SU32_SUM0_SUS256_SVW1_SKXCCM8_ULSGRO1_VWA1_VWB1_WGM4_WGMXCC1_WGMXCCGn1
    SolutionIndex: 75
    SolutionNameMin: Cijk_Alik_Bljk_BBS_BH_UserArgs_MT64x32x128_MI16x16x1_SN_LDSB1_CLR1_GRVWA8_GRVWB8_GSU0_GSUC0_GSUWGMRR0_K1_LBSPPA512_LBSPPB256_LPA16_LPB16_LRVW8_MIWT2_1_NEPBS16_PLR2_SU32_SUM0_SUS256_SVW2_SKXCCM0_ULSGRO0_VWA2_VWB1_WGM1_WGMXCC1_WGMXCCGn1
    SolutionIndex: 76
    SolutionNameMin: Cijk_Alik_Bljk_BBS_BH_UserArgs_MT64x32x128_MI16x16x1_SN_LDSB1_CLR1_GRVWA8_GRVWB8_GSU0_GSUC0_GSUWGMRR0_K1_LBSPPA512_LBSPPB256_LPA16_LPB16_LRVW8_MIWT2_1_NEPBS0_PLR2_SU32_SUM0_SUS256_SVW2_SKXCCM0_ULSGRO0_VWA2_VWB1_WGM1_WGMXCC1_WGMXCCGn1
    SolutionIndex: 77
    SolutionNameMin: Cijk_Alik_Bljk_BBS_BH_UserArgs_MT64x32x128_MI16x16x1_SN_LDSB1_CLR1_GRVWA8_GRVWB8_GSU0_GSUC0_GSUWGMRR0_K1_LBSPPA512_LBSPPB256_LPA16_LPB16_LRVW8_MIWT2_1_NEPBS16_PLR2_SU32_SUM0_SUS256_SVW2_SKXCCM8_ULSGRO0_VWA2_VWB1_WGM1_WGMXCC1_WGMXCCGn1
    SolutionIndex: 78
    SolutionNameMin: Cijk_Alik_Bljk_BBS_BH_UserArgs_MT32x64x64_MI16x16x1_SN_LDSB0_CLR1_GRVWA8_GRVWB8_GSU0_GSUC0_GSUWGMRR0_K1_LBSPPA128_LBSPPB256_LPA16_LPB16_LRVW8_MIWT1_2_NEPBS16_PLR1_SU32_SUM0_SUS256_SVW1_SKXCCM8_ULSGRO1_VWA1_VWB2_WGM1_WGMXCC1_WGMXCCGn1
    SolutionIndex: 79
    SolutionNameMin: Cijk_Alik_Bljk_BBS_BH_UserArgs_MT64x64x64_MI16x16x1_SN_LDSB1_CLR1_GRVWA8_GRVWB8_GSU0_GSUC0_GSUWGMRR0_K1_LBSPPA256_LBSPPB128_LPA16_LPB16_LRVW8_MIWT2_2_NEPBS16_PLR1_SU32_SUM0_SUS256_SVW2_SKXCCM8_ULSGRO1_VWA2_VWB1_WGM1_WGMXCC1_WGMXCCGn1
    SolutionIndex: 80
    SolutionNameMin: Cijk_Alik_Bljk_BBS_BH_UserArgs_MT64x64x64_MI16x16x1_SN_LDSB1_CLR1_GRVWA8_GRVWB8_GSU0_GSUC0_GSUWGMRR0_K1_LBSPPA128_LBSPPB256_LPA16_LPB16_LRVW8_MIWT2_2_NEPBS16_PLR1_SU32_SUM0_SUS256_SVW1_SKXCCM8_ULSGRO1_VWA1_VWB2_WGM4_WGMXCC1_WGMXCCGn1
    SolutionIndex: 81
    SolutionNameMin: Cijk_Alik_Bljk_BBS_BH_UserArgs_MT64x64x128_MI16x16x1_SN_LDSB1_CLR1_GRVWA8_GRVWB8_GSU0_GSUC0_GSUWGMRR0_K1_LBSPPA256_LBSPPB256_LPA16_LPB16_LRVW8_MIWT2_2_NEPBS16_PLR2_SU32_SUM0_SUS256_SVW1_SKXCCM8_ULSGRO1_VWA1_VWB1_WGM1_WGMXCC1_WGMXCCGn1
    SolutionIndex: 82
    SolutionNameMin: Cijk_Alik_Bljk_BBS_BH_UserArgs_MT64x64x128_MI16x16x1_SN_LDSB1_CLR1_GRVWA8_GRVWB8_GSU0_GSUC0_GSUWGMRR0_K1_LBSPPA512_LBSPPB256_LPA16_LPB16_LRVW8_MIWT2_2_NEPBS0_PLR1_SU32_SUM0_SUS256_SVW2_SKXCCM0_ULSGRO0_VWA2_VWB1_WGM1_WGMXCC1_WGMXCCGn1
    SolutionIndex: 83
    SolutionNameMin: Cijk_Alik_Bljk_BBS_BH_UserArgs_MT64x64x128_MI16x16x1_SN_LDSB1_CLR1_GRVWA8_GRVWB8_GSU0_GSUC0_GSUWGMRR0_K1_LBSPPA512_LBSPPB256_LPA16_LPB16_LRVW8_MIWT2_2_NEPBS16_PLR1_SU32_SUM0_SUS256_SVW2_SKXCCM0_ULSGRO0_VWA2_VWB1_WGM1_WGMXCC1_WGMXCCGn1
    SolutionIndex: 84
    SolutionNameMin: Cijk_Alik_Bljk_BBS_BH_UserArgs_MT64x64x128_MI16x16x1_SN_LDSB1_CLR1_GRVWA8_GRVWB8_GSU0_GSUC0_GSUWGMRR0_K1_LBSPPA512_LBSPPB256_LPA16_LPB16_LRVW8_MIWT2_2_NEPBS16_PLR1_SU32_SUM0_SUS256_SVW2_SKXCCM8_ULSGRO0_VWA2_VWB1_WGM1_WGMXCC1_WGMXCCGn1
    SolutionIndex: 85
    SolutionNameMin: Cijk_Alik_Bljk_BBS_BH_UserArgs_MT64x64x128_MI16x16x1_SN_LDSB1_CLR1_GRVWA8_GRVWB8_GSU0_GSUC0_GSUWGMRR0_K1_LBSPPA512_LBSPPB256_LPA16_LPB16_LRVW8_MIWT2_2_NEPBS0_PLR3_SU32_SUM0_SUS256_SVW2_SKXCCM8_ULSGRO0_VWA2_VWB1_WGM1_WGMXCC1_WGMXCCGn1
    SolutionIndex: 86
    SolutionNameMin: Cijk_Alik_Bljk_BBS_BH_UserArgs_MT128x64x64_MI16x16x1_SN_LDSB1_CLR1_GRVWA8_GRVWB8_GSU0_GSUC0_GSUWGMRR0_K1_LBSPPA512_LBSPPB256_LPA16_LPB16_LRVW8_MIWT4_2_NEPBS0_PLR1_SU32_SUM0_SUS256_SVW4_SKXCCM8_ULSGRO1_VWA4_VWB2_WGM8_WGMXCC1_WGMXCCGn1
    SolutionIndex: 87
    SolutionNameMin: Cijk_Alik_Bljk_BBS_BH_UserArgs_MT128x128x64_MI16x16x1_SN_LDSB1_CLR1_GRVWA8_GRVWB8_GSU0_GSUC0_GSUWGMRR0_K1_LBSPPA512_LBSPPB256_LPA16_LPB16_LRVW8_MIWT4_4_NEPBS0_PLR1_SU32_SUM0_SUS256_SVW4_SKXCCM8_ULSGRO1_VWA4_VWB2_WGM1_WGMXCC1_WGMXCCGn1
    SolutionIndex: 88
    SolutionNameMin: Cijk_Alik_Bljk_BBS_BH_UserArgs_MT128x64x64_MI16x16x1_SN_LDSB1_CLR1_GRVWA8_GRVWB8_GSU0_GSUC0_GSUWGMRR0_K1_LBSPPA256_LBSPPB256_LPA16_LPB16_LRVW8_MIWT4_2_NEPBS0_PLR1_SU32_SUM0_SUS256_SVW2_SKXCCM8_ULSGRO0_VWA2_VWB2_WGM1_WGMXCC1_WGMXCCGn1
    SolutionIndex: 89
    SolutionNameMin: Cijk_Alik_Bljk_BBS_BH_UserArgs_MT128x64x64_MI16x16x1_SN_LDSB1_CLR1_GRVWA8_GRVWB8_GSU0_GSUC0_GSUWGMRR0_K1_LBSPPA512_LBSPPB128_LPA16_LPB16_LRVW8_MIWT4_2_NEPBS16_PLR1_SU32_SUM0_SUS256_SVW4_SKXCCM8_ULSGRO0_VWA4_VWB1_WGM8_WGMXCC1_WGMXCCGn1
    SolutionIndex: 90
    SolutionNameMin: Cijk_Alik_Bljk_BBS_BH_UserArgs_MT128x128x64_MI16x16x1_SN_LDSB1_CLR1_GRVWA8_GRVWB8_GSU0_GSUC0_GSUWGMRR0_K1_LBSPPA512_LBSPPB512_LPA16_LPB16_LRVW8_MIWT4_4_NEPBS0_PLR1_SU32_SUM0_SUS256_SVW4_SKXCCM8_ULSGRO1_VWA4_VWB4_WGM8_WGMXCC1_WGMXCCGn1
    SolutionIndex: 91
    SolutionNameMin: Cijk_Alik_Bljk_BBS_BH_UserArgs_MT128x128x64_MI16x16x1_SN_LDSB1_CLR1_GRVWA8_GRVWB8_GSU0_GSUC0_GSUWGMRR0_K1_LBSPPA512_LBSPPB128_LPA16_LPB16_LRVW8_MIWT4_4_NEPBS0_PLR1_SU32_SUM0_SUS256_SVW4_SKXCCM8_ULSGRO0_VWA4_VWB1_WGM8_WGMXCC1_WGMXCCGn1
    SolutionIndex: 92
    SolutionNameMin: Cijk_Alik_Bljk_BBS_BH_UserArgs_MT128x128x64_MI16x16x1_SN_LDSB1_CLR1_GRVWA8_GRVWB8_GSU0_GSUC0_GSUWGMRR0_K1_LBSPPA512_LBSPPB512_LPA16_LPB16_LRVW8_MIWT4_4_NEPBS0_PLR1_SU32_SUM0_SUS256_SVW4_SKXCCM0_ULSGRO0_VWA4_VWB4_WGM8_WGMXCC1_WGMXCCGn1
    SolutionIndex: 93
    SolutionNameMin: Cijk_Alik_Bljk_BBS_BH_UserArgs_MT128x64x64_MI16x16x1_SN_LDSB1_CLR1_GRVWA8_GRVWB8_GSU0_GSUC0_GSUWGMRR0_K1_LBSPPA512_LBSPPB256_LPA16_LPB16_LRVW8_MIWT4_2_NEPBS0_PLR2_SU32_SUM0_SUS256_SVW4_SKXCCM8_ULSGRO0_VWA4_VWB2_WGM8_WGMXCC1_WGMXCCGn1
    SolutionIndex: 94
    SolutionNameMin: Cijk_Alik_Bljk_BBS_BH_UserArgs_MT128x64x64_MI16x16x1_SN_LDSB1_CLR1_GRVWA8_GRVWB8_GSU0_GSUC0_GSUWGMRR0_K1_LBSPPA512_LBSPPB256_LPA16_LPB16_LRVW8_MIWT4_2_NEPBS0_PLR1_SU32_SUM0_SUS256_SVW4_SKXCCM8_ULSGRO0_VWA4_VWB2_WGM1_WGMXCC1_WGMXCCGn1
    SolutionIndex: 95
    SolutionNameMin: Cijk_Alik_Bljk_BBS_BH_UserArgs_MT128x128x64_MI16x16x1_SN_LDSB1_CLR1_GRVWA8_GRVWB8_GSU0_GSUC0_GSUWGMRR0_K1_LBSPPA512_LBSPPB128_LPA16_LPB16_LRVW8_MIWT4_4_NEPBS16_PLR1_SU32_SUM0_SUS256_SVW4_SKXCCM8_ULSGRO1_VWA4_VWB1_WGM4_WGMXCC1_WGMXCCGn1
    SolutionIndex: 96
    SolutionNameMin: Cijk_Alik_Bljk_BBS_BH_UserArgs_MT128x128x64_MI16x16x1_SN_LDSB1_CLR1_GRVWA8_GRVWB8_GSU0_GSUC0_GSUWGMRR0_K1_LBSPPA256_LBSPPB512_LPA16_LPB16_LRVW8_MIWT4_4_NEPBS16_PLR1_SU32_SUM0_SUS256_SVW2_SKXCCM8_ULSGRO1_VWA2_VWB4_WGM8_WGMXCC1_WGMXCCGn1
    SolutionIndex: 97
    SolutionNameMin: Cijk_Alik_Bljk_BBS_BH_UserArgs_MT256x64x64_MI16x16x1_SN_LDSB1_CLR1_GRVWA8_GRVWB8_GSU0_GSUC0_GSUWGMRR0_K1_LBSPPA128_LBSPPB256_LPA16_LPB16_LRVW8_MIWT8_2_NEPBS0_PLR1_SU32_SUM0_SUS256_SVW1_SKXCCM0_ULSGRO1_VWA1_VWB2_WGM1_WGMXCC1_WGMXCCGn1
    SolutionIndex: 98
    SolutionNameMin: Cijk_Alik_Bljk_BBS_BH_UserArgs_MT32x32x128_MI16x16x1_SN_LDSB1_CLR1_GRVWA8_GRVWB8_GSU0_GSUC0_GSUWGMRR0_K1_LBSPPA256_LBSPPB256_LPA16_LPB16_LRVW8_MIWT1_1_NEPBS0_PLR1_SU32_SUM0_SUS256_SVW1_SKXCCM8_ULSGRO1_VWA1_VWB1_WGM4_WGMXCC1_WGMXCCGn1
    SolutionIndex: 99
    SolutionNameMin: Cijk_Alik_Bljk_BBS_BH_UserArgs_MT32x32x128_MI16x16x1_SN_LDSB1_CLR1_GRVWA8_GRVWB8_GSU0_GSUC0_GSUWGMRR0_K1_LBSPPA256_LBSPPB256_LPA16_LPB16_LRVW8_MIWT1_1_NEPBS16_PLR2_SU32_SUM0_SUS256_SVW1_SKXCCM8_ULSGRO1_VWA1_VWB1_WGM8_WGMXCC1_WGMXCCGn1
    SolutionIndex: 100
    SolutionNameMin: Cijk_Alik_Bljk_BBS_BH_UserArgs_MT32x64x128_MI16x16x1_SN_LDSB1_CLR1_GRVWA8_GRVWB8_GSU0_GSUC0_GSUWGMRR0_K1_LBSPPA256_LBSPPB512_LPA16_LPB16_LRVW8_MIWT1_2_NEPBS0_PLR1_SU32_SUM0_SUS256_SVW1_SKXCCM0_ULSGRO0_VWA1_VWB2_WGM1_WGMXCC1_WGMXCCGn1
    SolutionIndex: 101
    SolutionNameMin: Cijk_Alik_Bljk_BBS_BH_UserArgs_MT32x64x64_MI16x16x1_SN_LDSB0_CLR1_GRVWA8_GRVWB8_GSU0_GSUC0_GSUWGMRR0_K1_LBSPPA128_LBSPPB256_LPA16_LPB16_LRVW8_MIWT1_2_NEPBS16_PLR1_SU32_SUM0_SUS256_SVW1_SKXCCM8_ULSGRO0_VWA1_VWB2_WGM8_WGMXCC1_WGMXCCGn1
    SolutionIndex: 102
    SolutionNameMin: Cijk_Alik_Bljk_BBS_BH_UserArgs_MT64x32x128_MI16x16x1_SN_LDSB1_CLR1_GRVWA8_GRVWB8_GSU0_GSUC0_GSUWGMRR0_K1_LBSPPA512_LBSPPB256_LPA16_LPB16_LRVW8_MIWT2_1_NEPBS0_PLR2_SU32_SUM0_SUS256_SVW2_SKXCCM0_ULSGRO1_VWA2_VWB1_WGM1_WGMXCC1_WGMXCCGn1
    SolutionIndex: 103
    SolutionNameMin: Cijk_Alik_Bljk_BBS_BH_UserArgs_MT32x64x128_MI16x16x1_SN_LDSB1_CLR1_GRVWA8_GRVWB8_GSU0_GSUC0_GSUWGMRR0_K1_LBSPPA256_LBSPPB512_LPA16_LPB16_LRVW8_MIWT1_2_NEPBS0_PLR2_SU32_SUM0_SUS256_SVW1_SKXCCM0_ULSGRO1_VWA1_VWB2_WGM1_WGMXCC1_WGMXCCGn1
    SolutionIndex: 104
    SolutionNameMin: Cijk_Alik_Bljk_BBS_BH_UserArgs_MT64x32x128_MI16x16x1_SN_LDSB1_CLR1_GRVWA8_GRVWB8_GSU0_GSUC0_GSUWGMRR0_K1_LBSPPA256_LBSPPB256_LPA16_LPB16_LRVW8_MIWT2_1_NEPBS0_PLR2_SU32_SUM0_SUS256_SVW1_SKXCCM0_ULSGRO1_VWA1_VWB1_WGM1_WGMXCC1_WGMXCCGn1
    SolutionIndex: 105
    SolutionNameMin: Cijk_Alik_Bljk_BBS_BH_UserArgs_MT64x32x128_MI16x16x1_SN_LDSB1_CLR1_GRVWA8_GRVWB8_GSU0_GSUC0_GSUWGMRR0_K1_LBSPPA512_LBSPPB256_LPA16_LPB16_LRVW8_MIWT2_1_NEPBS16_PLR2_SU32_SUM0_SUS256_SVW2_SKXCCM8_ULSGRO1_VWA2_VWB1_WGM8_WGMXCC1_WGMXCCGn1
    SolutionIndex: 106
    SolutionNameMin: Cijk_Alik_Bljk_BBS_BH_UserArgs_MT64x64x128_MI16x16x1_SN_LDSB1_CLR1_GRVWA8_GRVWB8_GSU0_GSUC0_GSUWGMRR0_K1_LBSPPA256_LBSPPB512_LPA16_LPB16_LRVW8_MIWT2_2_NEPBS0_PLR1_SU32_SUM0_SUS256_SVW1_SKXCCM8_ULSGRO1_VWA1_VWB2_WGM4_WGMXCC1_WGMXCCGn1
    SolutionIndex: 107
    SolutionNameMin: Cijk_Alik_Bljk_BBS_BH_UserArgs_MT64x64x128_MI16x16x1_SN_LDSB1_CLR1_GRVWA8_GRVWB8_GSU0_GSUC0_GSUWGMRR0_K1_LBSPPA512_LBSPPB512_LPA16_LPB16_LRVW8_MIWT2_2_NEPBS16_PLR3_SU32_SUM0_SUS256_SVW2_SKXCCM8_ULSGRO0_VWA2_VWB2_WGM1_WGMXCC1_WGMXCCGn1
    SolutionIndex: 108
    SolutionNameMin: Cijk_Alik_Bljk_BBS_BH_UserArgs_MT64x64x128_MI16x16x1_SN_LDSB1_CLR1_GRVWA8_GRVWB8_GSU0_GSUC0_GSUWGMRR0_K1_LBSPPA512_LBSPPB512_LPA16_LPB16_LRVW8_MIWT2_2_NEPBS16_PLR1_SU32_SUM0_SUS256_SVW2_SKXCCM8_ULSGRO1_VWA2_VWB2_WGM4_WGMXCC1_WGMXCCGn1
    SolutionIndex: 109
    SolutionNameMin: Cijk_Alik_Bljk_BBS_BH_UserArgs_MT128x128x64_MI16x16x1_SN_LDSB1_CLR1_GRVWA8_GRVWB8_GSU0_GSUC0_GSUWGMRR0_K1_LBSPPA512_LBSPPB128_LPA16_LPB16_LRVW8_MIWT4_4_NEPBS16_PLR1_SU32_SUM0_SUS256_SVW4_SKXCCM8_ULSGRO1_VWA4_VWB1_WGM1_WGMXCC1_WGMXCCGn1
    SolutionIndex: 110
    SolutionNameMin: Cijk_Alik_Bljk_BBS_BH_UserArgs_MT128x64x64_MI16x16x1_SN_LDSB1_CLR1_GRVWA8_GRVWB8_GSU0_GSUC0_GSUWGMRR0_K1_LBSPPA256_LBSPPB256_LPA16_LPB16_LRVW8_MIWT4_2_NEPBS16_PLR1_SU32_SUM0_SUS256_SVW2_SKXCCM8_ULSGRO1_VWA2_VWB2_WGM1_WGMXCC1_WGMXCCGn1
    SolutionIndex: 111
    SolutionNameMin: Cijk_Alik_Bljk_BBS_BH_UserArgs_MT128x64x64_MI16x16x1_SN_LDSB1_CLR1_GRVWA8_GRVWB8_GSU0_GSUC0_GSUWGMRR0_K1_LBSPPA512_LBSPPB128_LPA16_LPB16_LRVW8_MIWT4_2_NEPBS0_PLR1_SU32_SUM0_SUS256_SVW4_SKXCCM8_ULSGRO1_VWA4_VWB1_WGM8_WGMXCC1_WGMXCCGn1
    SolutionIndex: 112
    SolutionNameMin: Cijk_Alik_Bljk_BBS_BH_UserArgs_MT128x64x64_MI16x16x1_SN_LDSB1_CLR1_GRVWA8_GRVWB8_GSU0_GSUC0_GSUWGMRR0_K1_LBSPPA512_LBSPPB128_LPA16_LPB16_LRVW8_MIWT4_2_NEPBS0_PLR1_SU32_SUM0_SUS256_SVW4_SKXCCM8_ULSGRO0_VWA4_VWB1_WGM8_WGMXCC1_WGMXCCGn1
    SolutionIndex: 113
    SolutionNameMin: Cijk_Alik_Bljk_BBS_BH_UserArgs_MT128x128x64_MI16x16x1_SN_LDSB1_CLR1_GRVWA8_GRVWB8_GSU0_GSUC0_GSUWGMRR0_K1_LBSPPA512_LBSPPB512_LPA16_LPB16_LRVW8_MIWT4_4_NEPBS16_PLR1_SU32_SUM0_SUS256_SVW4_SKXCCM8_ULSGRO1_VWA4_VWB4_WGM1_WGMXCC1_WGMXCCGn1
    SolutionIndex: 114
    SolutionNameMin: Cijk_Alik_Bljk_BBS_BH_UserArgs_MT128x128x64_MI16x16x1_SN_LDSB1_CLR1_GRVWA8_GRVWB8_GSU0_GSUC0_GSUWGMRR0_K1_LBSPPA512_LBSPPB256_LPA16_LPB16_LRVW8_MIWT4_4_NEPBS0_PLR1_SU32_SUM0_SUS256_SVW4_SKXCCM0_ULSGRO1_VWA4_VWB2_WGM4_WGMXCC1_WGMXCCGn1
    SolutionIndex: 115
    SolutionNameMin: Cijk_Alik_Bljk_BBS_BH_UserArgs_MT128x64x64_MI16x16x1_SN_LDSB1_CLR1_GRVWA8_GRVWB8_GSU0_GSUC0_GSUWGMRR0_K1_LBSPPA256_LBSPPB128_LPA16_LPB16_LRVW8_MIWT4_2_NEPBS0_PLR2_SU32_SUM0_SUS256_SVW2_SKXCCM8_ULSGRO0_VWA2_VWB1_WGM1_WGMXCC1_WGMXCCGn1
    SolutionIndex: 116
    SolutionNameMin: Cijk_Alik_Bljk_BBS_BH_UserArgs_MT128x64x64_MI16x16x1_SN_LDSB1_CLR1_GRVWA8_GRVWB8_GSU0_GSUC0_GSUWGMRR0_K1_LBSPPA512_LBSPPB256_LPA16_LPB16_LRVW8_MIWT4_2_NEPBS16_PLR1_SU32_SUM0_SUS256_SVW4_SKXCCM8_ULSGRO1_VWA4_VWB2_WGM1_WGMXCC1_WGMXCCGn1
    SolutionIndex: 117
    SolutionNameMin: Cijk_Alik_Bljk_BBS_BH_UserArgs_MT128x128x64_MI16x16x1_SN_LDSB1_CLR1_GRVWA8_GRVWB8_GSU0_GSUC0_GSUWGMRR0_K1_LBSPPA512_LBSPPB128_LPA16_LPB16_LRVW8_MIWT4_4_NEPBS0_PLR1_SU32_SUM0_SUS256_SVW4_SKXCCM8_ULSGRO1_VWA4_VWB1_WGM8_WGMXCC1_WGMXCCGn1
    SolutionIndex: 118
    SolutionNameMin: Cijk_Alik_Bljk_BBS_BH_UserArgs_MT128x128x64_MI16x16x1_SN_LDSB1_CLR1_GRVWA8_GRVWB8_GSU0_GSUC0_GSUWGMRR0_K1_LBSPPA512_LBSPPB512_LPA16_LPB16_LRVW8_MIWT4_4_NEPBS16_PLR1_SU32_SUM0_SUS256_SVW4_SKXCCM8_ULSGRO1_VWA4_VWB4_WGM8_WGMXCC1_WGMXCCGn1
    SolutionIndex: 119
    SolutionNameMin: Cijk_Alik_Bljk_BBS_BH_UserArgs_MT128x128x64_MI16x16x1_SN_LDSB1_CLR1_GRVWA8_GRVWB8_GSU0_GSUC0_GSUWGMRR0_K1_LBSPPA256_LBSPPB256_LPA16_LPB16_LRVW8_MIWT4_4_NEPBS0_PLR1_SU32_SUM0_SUS256_SVW2_SKXCCM8_ULSGRO1_VWA2_VWB2_WGM8_WGMXCC1_WGMXCCGn1
    SolutionIndex: 120
    SolutionNameMin: Cijk_Alik_Bljk_BBS_BH_UserArgs_MT128x128x64_MI16x16x1_SN_LDSB1_CLR1_GRVWA8_GRVWB8_GSU0_GSUC0_GSUWGMRR0_K1_LBSPPA512_LBSPPB512_LPA16_LPB16_LRVW8_MIWT4_4_NEPBS0_PLR1_SU32_SUM0_SUS256_SVW4_SKXCCM8_ULSGRO0_VWA4_VWB4_WGM1_WGMXCC1_WGMXCCGn1
    SolutionIndex: 121
    SolutionNameMin: Cijk_Alik_Bljk_BBS_BH_UserArgs_MT128x128x64_MI16x16x1_SN_LDSB1_CLR1_GRVWA8_GRVWB8_GSU0_GSUC0_GSUWGMRR0_K1_LBSPPA256_LBSPPB512_LPA16_LPB16_LRVW8_MIWT4_4_NEPBS16_PLR2_SU32_SUM0_SUS256_SVW2_SKXCCM0_ULSGRO0_VWA2_VWB4_WGM8_WGMXCC1_WGMXCCGn1
    SolutionIndex: 122
    SolutionNameMin: Cijk_Alik_Bljk_BBS_BH_UserArgs_MT128x128x64_MI16x16x1_SN_LDSB1_CLR1_GRVWA8_GRVWB8_GSU0_GSUC0_GSUWGMRR0_K1_LBSPPA256_LBSPPB128_LPA16_LPB16_LRVW8_MIWT4_4_NEPBS16_PLR1_SU32_SUM0_SUS256_SVW2_SKXCCM8_ULSGRO1_VWA2_VWB1_WGM1_WGMXCC1_WGMXCCGn1
    SolutionIndex: 123
    SolutionNameMin: Cijk_Alik_Bljk_BBS_BH_UserArgs_MT128x128x64_MI16x16x1_SN_LDSB1_CLR1_GRVWA8_GRVWB8_GSU0_GSUC0_GSUWGMRR0_K1_LBSPPA512_LBSPPB128_LPA16_LPB16_LRVW8_MIWT4_4_NEPBS0_PLR1_SU32_SUM0_SUS256_SVW4_SKXCCM8_ULSGRO1_VWA4_VWB1_WGM1_WGMXCC1_WGMXCCGn1
    SolutionIndex: 124
    SolutionNameMin: Cijk_Alik_Bljk_BBS_BH_UserArgs_MT128x128x64_MI16x16x1_SN_LDSB1_CLR1_GRVWA8_GRVWB8_GSU0_GSUC0_GSUWGMRR0_K1_LBSPPA512_LBSPPB256_LPA16_LPB16_LRVW8_MIWT4_4_NEPBS0_PLR1_SU32_SUM0_SUS256_SVW4_SKXCCM8_ULSGRO0_VWA4_VWB2_WGM1_WGMXCC1_WGMXCCGn1
    SolutionIndex: 125
    SolutionNameMin: Cijk_Alik_Bljk_BBS_BH_UserArgs_MT128x128x64_MI16x16x1_SN_LDSB1_CLR1_GRVWA8_GRVWB8_GSU0_GSUC0_GSUWGMRR0_K1_LBSPPA512_LBSPPB512_LPA16_LPB16_LRVW8_MIWT4_4_NEPBS16_PLR1_SU32_SUM0_SUS256_SVW4_SKXCCM8_ULSGRO0_VWA4_VWB4_WGM8_WGMXCC1_WGMXCCGn1
    SolutionIndex: 126
    SolutionNameMin: Cijk_Alik_Bljk_BBS_BH_UserArgs_MT128x128x64_MI16x16x1_SN_LDSB1_CLR1_GRVWA8_GRVWB8_GSU0_GSUC0_GSUWGMRR0_K1_LBSPPA512_LBSPPB512_LPA16_LPB16_LRVW8_MIWT4_4_NEPBS0_PLR1_SU32_SUM0_SUS256_SVW4_SKXCCM8_ULSGRO1_VWA4_VWB4_WGM1_WGMXCC1_WGMXCCGn1
    SolutionIndex: 127
    SolutionNameMin: Cijk_Alik_Bljk_BBS_BH_UserArgs_MT128x128x64_MI16x16x1_SN_LDSB1_CLR1_GRVWA8_GRVWB8_GSU0_GSUC0_GSUWGMRR0_K1_LBSPPA256_LBSPPB256_LPA16_LPB16_LRVW8_MIWT4_4_NEPBS0_PLR1_SU32_SUM0_SUS256_SVW2_SKXCCM0_ULSGRO0_VWA2_VWB2_WGM8_WGMXCC1_WGMXCCGn1
    SolutionIndex: 128
    SolutionNameMin: Cijk_Alik_Bljk_BBS_BH_UserArgs_MT32x64x64_MI16x16x1_SN_LDSB0_CLR1_GRVWA8_GRVWB8_GSU0_GSUC0_GSUWGMRR0_K1_LBSPPA128_LBSPPB256_LPA16_LPB16_LRVW8_MIWT1_2_NEPBS0_PLR1_SU32_SUM0_SUS256_SVW1_SKXCCM0_ULSGRO1_VWA1_VWB2_WGM1_WGMXCC1_WGMXCCGn1
    SolutionIndex: 129
    SolutionNameMin: Cijk_Alik_Bljk_BBS_BH_UserArgs_MT32x64x64_MI16x16x1_SN_LDSB0_CLR1_GRVWA8_GRVWB8_GSU0_GSUC0_GSUWGMRR0_K1_LBSPPA128_LBSPPB256_LPA16_LPB16_LRVW8_MIWT1_2_NEPBS0_PLR1_SU32_SUM0_SUS256_SVW1_SKXCCM8_ULSGRO0_VWA1_VWB2_WGM8_WGMXCC1_WGMXCCGn1
    SolutionIndex: 130
    SolutionNameMin: Cijk_Alik_Bljk_BBS_BH_UserArgs_MT32x128x64_MI16x16x1_SN_LDSB1_CLR1_GRVWA8_GRVWB8_GSU0_GSUC0_GSUWGMRR0_K1_LBSPPA128_LBSPPB512_LPA16_LPB16_LRVW8_MIWT1_4_NEPBS16_PLR1_SU32_SUM0_SUS256_SVW1_SKXCCM8_ULSGRO1_VWA1_VWB4_WGM1_WGMXCC1_WGMXCCGn1
    SolutionIndex: 131
    SolutionNameMin: Cijk_Alik_Bljk_BBS_BH_UserArgs_MT64x32x128_MI16x16x1_SN_LDSB1_CLR1_GRVWA8_GRVWB8_GSU0_GSUC0_GSUWGMRR0_K1_LBSPPA512_LBSPPB256_LPA16_LPB16_LRVW8_MIWT2_1_NEPBS16_PLR2_SU32_SUM0_SUS256_SVW2_SKXCCM0_ULSGRO1_VWA2_VWB1_WGM1_WGMXCC1_WGMXCCGn1
    SolutionIndex: 132
    SolutionNameMin: Cijk_Alik_Bljk_BBS_BH_UserArgs_MT64x32x128_MI16x16x1_SN_LDSB1_CLR1_GRVWA8_GRVWB8_GSU0_GSUC0_GSUWGMRR0_K1_LBSPPA512_LBSPPB256_LPA16_LPB16_LRVW8_MIWT2_1_NEPBS0_PLR1_SU32_SUM0_SUS256_SVW2_SKXCCM0_ULSGRO1_VWA2_VWB1_WGM1_WGMXCC1_WGMXCCGn1
    SolutionIndex: 133
    SolutionNameMin: Cijk_Alik_Bljk_BBS_BH_UserArgs_MT64x32x128_MI16x16x1_SN_LDSB1_CLR1_GRVWA8_GRVWB8_GSU0_GSUC0_GSUWGMRR0_K1_LBSPPA512_LBSPPB256_LPA16_LPB16_LRVW8_MIWT2_1_NEPBS0_PLR2_SU32_SUM0_SUS256_SVW2_SKXCCM8_ULSGRO1_VWA2_VWB1_WGM1_WGMXCC1_WGMXCCGn1
    SolutionIndex: 134
    SolutionNameMin: Cijk_Alik_Bljk_BBS_BH_UserArgs_MT32x64x128_MI16x16x1_SN_LDSB1_CLR1_GRVWA8_GRVWB8_GSU0_GSUC0_GSUWGMRR0_K1_LBSPPA256_LBSPPB512_LPA16_LPB16_LRVW8_MIWT1_2_NEPBS0_PLR2_SU32_SUM0_SUS256_SVW1_SKXCCM8_ULSGRO0_VWA1_VWB2_WGM8_WGMXCC1_WGMXCCGn1
    SolutionIndex: 135
    SolutionNameMin: Cijk_Alik_Bljk_BBS_BH_UserArgs_MT64x64x128_MI16x16x1_SN_LDSB1_CLR1_GRVWA8_GRVWB8_GSU0_GSUC0_GSUWGMRR0_K1_LBSPPA256_LBSPPB512_LPA16_LPB16_LRVW8_MIWT2_2_NEPBS0_PLR2_SU32_SUM0_SUS256_SVW1_SKXCCM8_ULSGRO0_VWA1_VWB2_WGM8_WGMXCC1_WGMXCCGn1
    SolutionIndex: 136
    SolutionNameMin: Cijk_Alik_Bljk_BBS_BH_UserArgs_MT64x128x64_MI16x16x1_SN_LDSB1_CLR1_GRVWA8_GRVWB8_GSU0_GSUC0_GSUWGMRR0_K1_LBSPPA256_LBSPPB128_LPA16_LPB16_LRVW8_MIWT2_4_NEPBS16_PLR1_SU32_SUM0_SUS256_SVW2_SKXCCM8_ULSGRO0_VWA2_VWB1_WGM1_WGMXCC1_WGMXCCGn1
    SolutionIndex: 137
    SolutionNameMin: Cijk_Alik_Bljk_BBS_BH_UserArgs_MT64x64x128_MI16x16x1_SN_LDSB1_CLR1_GRVWA8_GRVWB8_GSU0_GSUC0_GSUWGMRR0_K1_LBSPPA512_LBSPPB256_LPA16_LPB16_LRVW8_MIWT2_2_NEPBS0_PLR1_SU32_SUM0_SUS256_SVW2_SKXCCM8_ULSGRO1_VWA2_VWB1_WGM1_WGMXCC1_WGMXCCGn1
    SolutionIndex: 138
    SolutionNameMin: Cijk_Alik_Bljk_BBS_BH_UserArgs_MT64x64x128_MI16x16x1_SN_LDSB1_CLR1_GRVWA8_GRVWB8_GSU0_GSUC0_GSUWGMRR0_K1_LBSPPA512_LBSPPB256_LPA16_LPB16_LRVW8_MIWT2_2_NEPBS16_PLR3_SU32_SUM0_SUS256_SVW2_SKXCCM8_ULSGRO0_VWA2_VWB1_WGM4_WGMXCC1_WGMXCCGn1
    SolutionIndex: 139
    SolutionNameMin: Cijk_Alik_Bljk_BBS_BH_UserArgs_MT64x64x128_MI16x16x1_SN_LDSB1_CLR1_GRVWA8_GRVWB8_GSU0_GSUC0_GSUWGMRR0_K1_LBSPPA512_LBSPPB256_LPA16_LPB16_LRVW8_MIWT2_2_NEPBS16_PLR1_SU32_SUM0_SUS256_SVW2_SKXCCM8_ULSGRO1_VWA2_VWB1_WGM8_WGMXCC1_WGMXCCGn1
    SolutionIndex: 140
    SolutionNameMin: Cijk_Alik_Bljk_BBS_BH_UserArgs_MT128x128x64_MI16x16x1_SN_LDSB1_CLR1_GRVWA8_GRVWB8_GSU0_GSUC0_GSUWGMRR0_K1_LBSPPA512_LBSPPB128_LPA16_LPB16_LRVW8_MIWT4_4_NEPBS0_PLR1_SU32_SUM0_SUS256_SVW4_SKXCCM8_ULSGRO0_VWA4_VWB1_WGM1_WGMXCC1_WGMXCCGn1
    SolutionIndex: 141
    SolutionNameMin: Cijk_Alik_Bljk_BBS_BH_UserArgs_MT128x64x64_MI16x16x1_SN_LDSB1_CLR1_GRVWA8_GRVWB8_GSU0_GSUC0_GSUWGMRR0_K1_LBSPPA512_LBSPPB128_LPA16_LPB16_LRVW8_MIWT4_2_NEPBS0_PLR1_SU32_SUM0_SUS256_SVW4_SKXCCM8_ULSGRO1_VWA4_VWB1_WGM1_WGMXCC1_WGMXCCGn1
    SolutionIndex: 142
    SolutionNameMin: Cijk_Alik_Bljk_BBS_BH_UserArgs_MT128x128x64_MI16x16x1_SN_LDSB1_CLR1_GRVWA8_GRVWB8_GSU0_GSUC0_GSUWGMRR0_K1_LBSPPA512_LBSPPB256_LPA16_LPB16_LRVW8_MIWT4_4_NEPBS16_PLR1_SU32_SUM0_SUS256_SVW4_SKXCCM8_ULSGRO1_VWA4_VWB2_WGM1_WGMXCC1_WGMXCCGn1
    SolutionIndex: 143
    SolutionNameMin: Cijk_Alik_Bljk_BBS_BH_UserArgs_MT128x128x64_MI16x16x1_SN_LDSB1_CLR1_GRVWA8_GRVWB8_GSU0_GSUC0_GSUWGMRR0_K1_LBSPPA512_LBSPPB256_LPA16_LPB16_LRVW8_MIWT4_4_NEPBS0_PLR1_SU32_SUM0_SUS256_SVW4_SKXCCM0_ULSGRO0_VWA4_VWB2_WGM8_WGMXCC1_WGMXCCGn1
    SolutionIndex: 144
    SolutionNameMin: Cijk_Alik_Bljk_BBS_BH_UserArgs_MT128x64x64_MI16x16x1_SN_LDSB1_CLR1_GRVWA8_GRVWB8_GSU0_GSUC0_GSUWGMRR0_K1_LBSPPA512_LBSPPB128_LPA16_LPB16_LRVW8_MIWT4_2_NEPBS0_PLR1_SU32_SUM0_SUS256_SVW4_SKXCCM0_ULSGRO0_VWA4_VWB1_WGM8_WGMXCC1_WGMXCCGn1
    SolutionIndex: 145
    SolutionNameMin: Cijk_Alik_Bljk_BBS_BH_UserArgs_MT128x128x64_MI16x16x1_SN_LDSB1_CLR1_GRVWA8_GRVWB8_GSU0_GSUC0_GSUWGMRR0_K1_LBSPPA128_LBSPPB256_LPA16_LPB16_LRVW8_MIWT4_4_NEPBS16_PLR1_SU32_SUM0_SUS256_SVW1_SKXCCM8_ULSGRO0_VWA1_VWB2_WGM1_WGMXCC1_WGMXCCGn1
    SolutionIndex: 146
    SolutionNameMin: Cijk_Alik_Bljk_BBS_BH_UserArgs_MT128x128x64_MI16x16x1_SN_LDSB1_CLR1_GRVWA8_GRVWB8_GSU0_GSUC0_GSUWGMRR0_K1_LBSPPA256_LBSPPB256_LPA16_LPB16_LRVW8_MIWT4_4_NEPBS16_PLR1_SU32_SUM0_SUS256_SVW2_SKXCCM0_ULSGRO0_VWA2_VWB2_WGM8_WGMXCC1_WGMXCCGn1
    SolutionIndex: 147
    SolutionNameMin: Cijk_Alik_Bljk_BBS_BH_UserArgs_MT128x128x64_MI16x16x1_SN_LDSB1_CLR1_GRVWA8_GRVWB8_GSU0_GSUC0_GSUWGMRR0_K1_LBSPPA512_LBSPPB128_LPA16_LPB16_LRVW8_MIWT4_4_NEPBS0_PLR1_SU32_SUM0_SUS256_SVW4_SKXCCM8_ULSGRO0_VWA4_VWB1_WGM4_WGMXCC1_WGMXCCGn1
    SolutionIndex: 148
    SolutionNameMin: Cijk_Alik_Bljk_BBS_BH_UserArgs_MT128x128x64_MI16x16x1_SN_LDSB1_CLR1_GRVWA8_GRVWB8_GSU0_GSUC0_GSUWGMRR0_K1_LBSPPA512_LBSPPB128_LPA16_LPB16_LRVW8_MIWT4_4_NEPBS0_PLR1_SU32_SUM0_SUS256_SVW4_SKXCCM8_ULSGRO1_VWA4_VWB1_WGM4_WGMXCC1_WGMXCCGn1
    SolutionIndex: 149
    SolutionNameMin: Cijk_Alik_Bljk_BBS_BH_UserArgs_MT128x128x64_MI16x16x1_SN_LDSB1_CLR1_GRVWA8_GRVWB8_GSU0_GSUC0_GSUWGMRR0_K1_LBSPPA256_LBSPPB256_LPA16_LPB16_LRVW8_MIWT4_4_NEPBS16_PLR1_SU32_SUM0_SUS256_SVW2_SKXCCM8_ULSGRO1_VWA2_VWB2_WGM1_WGMXCC1_WGMXCCGn1
    SolutionIndex: 150
    SolutionNameMin: Cijk_Alik_Bljk_BBS_BH_UserArgs_MT128x128x64_MI16x16x1_SN_LDSB1_CLR1_GRVWA8_GRVWB8_GSU0_GSUC0_GSUWGMRR0_K1_LBSPPA512_LBSPPB128_LPA16_LPB16_LRVW8_MIWT4_4_NEPBS16_PLR1_SU32_SUM0_SUS256_SVW4_SKXCCM0_ULSGRO0_VWA4_VWB1_WGM4_WGMXCC1_WGMXCCGn1
    SolutionIndex: 151
    SolutionNameMin: Cijk_Alik_Bljk_BBS_BH_UserArgs_MT64x32x128_MI16x16x1_SN_LDSB1_CLR1_GRVWA8_GRVWB8_GSU0_GSUC0_GSUWGMRR0_K1_LBSPPA512_LBSPPB256_LPA16_LPB16_LRVW8_MIWT2_1_NEPBS16_PLR2_SU32_SUM0_SUS256_SVW2_SKXCCM8_ULSGRO1_VWA2_VWB1_WGM4_WGMXCC1_WGMXCCGn1
    SolutionIndex: 152
    SolutionNameMin: Cijk_Alik_Bljk_BBS_BH_UserArgs_MT64x64x128_MI16x16x1_SN_LDSB1_CLR1_GRVWA8_GRVWB8_GSU0_GSUC0_GSUWGMRR0_K1_LBSPPA256_LBSPPB512_LPA16_LPB16_LRVW8_MIWT2_2_NEPBS0_PLR1_SU32_SUM0_SUS256_SVW1_SKXCCM8_ULSGRO0_VWA1_VWB2_WGM8_WGMXCC1_WGMXCCGn1
    SolutionIndex: 153
    SolutionNameMin: Cijk_Alik_Bljk_BBS_BH_UserArgs_MT64x128x64_MI16x16x1_SN_LDSB1_CLR1_GRVWA8_GRVWB8_GSU0_GSUC0_GSUWGMRR0_K1_LBSPPA256_LBSPPB512_LPA16_LPB16_LRVW8_MIWT2_4_NEPBS0_PLR1_SU32_SUM0_SUS256_SVW2_SKXCCM0_ULSGRO0_VWA2_VWB4_WGM1_WGMXCC1_WGMXCCGn1
    SolutionIndex: 154
    SolutionNameMin: Cijk_Alik_Bljk_BBS_BH_UserArgs_MT64x64x128_MI16x16x1_SN_LDSB1_CLR1_GRVWA8_GRVWB8_GSU0_GSUC0_GSUWGMRR0_K1_LBSPPA512_LBSPPB256_LPA16_LPB16_LRVW8_MIWT2_2_NEPBS16_PLR1_SU32_SUM0_SUS256_SVW2_SKXCCM0_ULSGRO0_VWA2_VWB1_WGM8_WGMXCC1_WGMXCCGn1
    SolutionIndex: 155
    SolutionNameMin: Cijk_Alik_Bljk_BBS_BH_UserArgs_MT64x64x128_MI16x16x1_SN_LDSB1_CLR1_GRVWA8_GRVWB8_GSU0_GSUC0_GSUWGMRR0_K1_LBSPPA512_LBSPPB256_LPA16_LPB16_LRVW8_MIWT2_2_NEPBS16_PLR1_SU32_SUM0_SUS256_SVW2_SKXCCM8_ULSGRO0_VWA2_VWB1_WGM4_WGMXCC1_WGMXCCGn1
    SolutionIndex: 156
    SolutionNameMin: Cijk_Alik_Bljk_BBS_BH_UserArgs_MT64x128x64_MI16x16x1_SN_LDSB1_CLR1_GRVWA8_GRVWB8_GSU0_GSUC0_GSUWGMRR0_K1_LBSPPA256_LBSPPB128_LPA16_LPB16_LRVW8_MIWT2_4_NEPBS0_PLR1_SU32_SUM0_SUS256_SVW2_SKXCCM8_ULSGRO1_VWA2_VWB1_WGM1_WGMXCC1_WGMXCCGn1
    SolutionIndex: 157
    SolutionNameMin: Cijk_Alik_Bljk_BBS_BH_UserArgs_MT64x64x128_MI16x16x1_SN_LDSB1_CLR1_GRVWA8_GRVWB8_GSU0_GSUC0_GSUWGMRR0_K1_LBSPPA512_LBSPPB256_LPA16_LPB16_LRVW8_MIWT2_2_NEPBS16_PLR1_SU32_SUM0_SUS256_SVW2_SKXCCM0_ULSGRO1_VWA2_VWB1_WGM1_WGMXCC1_WGMXCCGn1
    SolutionIndex: 158
    SolutionNameMin: Cijk_Alik_Bljk_BBS_BH_UserArgs_MT128x64x64_MI16x16x1_SN_LDSB1_CLR1_GRVWA8_GRVWB8_GSU0_GSUC0_GSUWGMRR0_K1_LBSPPA256_LBSPPB256_LPA16_LPB16_LRVW8_MIWT4_2_NEPBS16_PLR1_SU32_SUM0_SUS256_SVW2_SKXCCM8_ULSGRO1_VWA2_VWB2_WGM4_WGMXCC1_WGMXCCGn1
    SolutionIndex: 159
    SolutionNameMin: Cijk_Alik_Bljk_BBS_BH_UserArgs_MT128x64x64_MI16x16x1_SN_LDSB1_CLR1_GRVWA8_GRVWB8_GSU0_GSUC0_GSUWGMRR0_K1_LBSPPA512_LBSPPB128_LPA16_LPB16_LRVW8_MIWT4_2_NEPBS16_PLR1_SU32_SUM0_SUS256_SVW4_SKXCCM8_ULSGRO1_VWA4_VWB1_WGM8_WGMXCC1_WGMXCCGn1
    SolutionIndex: 160
    SolutionNameMin: Cijk_Alik_Bljk_BBS_BH_UserArgs_MT256x64x64_MI16x16x1_SN_LDSB1_CLR1_GRVWA8_GRVWB8_GSU0_GSUC0_GSUWGMRR0_K1_LBSPPA512_LBSPPB256_LPA16_LPB16_LRVW8_MIWT8_2_NEPBS16_PLR1_SU32_SUM0_SUS256_SVW4_SKXCCM0_ULSGRO0_VWA4_VWB2_WGM8_WGMXCC1_WGMXCCGn1
    SolutionIndex: 161
    SolutionNameMin: Cijk_Alik_Bljk_BBS_BH_UserArgs_MT128x128x64_MI16x16x1_SN_LDSB1_CLR1_GRVWA8_GRVWB8_GSU0_GSUC0_GSUWGMRR0_K1_LBSPPA512_LBSPPB512_LPA16_LPB16_LRVW8_MIWT4_4_NEPBS16_PLR1_SU32_SUM0_SUS256_SVW4_SKXCCM8_ULSGRO0_VWA4_VWB4_WGM1_WGMXCC1_WGMXCCGn1
    SolutionIndex: 162
    SolutionNameMin: Cijk_Alik_Bljk_BBS_BH_UserArgs_MT256x64x64_MI16x16x1_SN_LDSB1_CLR1_GRVWA8_GRVWB8_GSU0_GSUC0_GSUWGMRR0_K1_LBSPPA256_LBSPPB256_LPA16_LPB16_LRVW8_MIWT8_2_NEPBS16_PLR2_SU32_SUM0_SUS256_SVW2_SKXCCM0_ULSGRO0_VWA2_VWB2_WGM8_WGMXCC1_WGMXCCGn1
    SolutionIndex: 163
    SolutionNameMin: Cijk_Alik_Bljk_BBS_BH_UserArgs_MT128x128x64_MI16x16x1_SN_LDSB1_CLR1_GRVWA8_GRVWB8_GSU0_GSUC0_GSUWGMRR0_K1_LBSPPA256_LBSPPB256_LPA16_LPB16_LRVW8_MIWT4_4_NEPBS16_PLR1_SU32_SUM0_SUS256_SVW2_SKXCCM8_ULSGRO1_VWA2_VWB2_WGM4_WGMXCC1_WGMXCCGn1
    SolutionIndex: 164
    SolutionNameMin: Cijk_Alik_Bljk_BBS_BH_UserArgs_MT128x128x64_MI16x16x1_SN_LDSB1_CLR1_GRVWA8_GRVWB8_GSU0_GSUC0_GSUWGMRR0_K1_LBSPPA512_LBSPPB128_LPA16_LPB16_LRVW8_MIWT4_4_NEPBS0_PLR1_SU32_SUM0_SUS256_SVW4_SKXCCM0_ULSGRO0_VWA4_VWB1_WGM1_WGMXCC1_WGMXCCGn1
    SolutionIndex: 165
    SolutionNameMin: Cijk_Alik_Bljk_BBS_BH_UserArgs_MT128x128x64_MI16x16x1_SN_LDSB1_CLR1_GRVWA8_GRVWB8_GSU0_GSUC0_GSUWGMRR0_K1_LBSPPA512_LBSPPB256_LPA16_LPB16_LRVW8_MIWT4_4_NEPBS16_PLR1_SU32_SUM0_SUS256_SVW4_SKXCCM0_ULSGRO0_VWA4_VWB2_WGM1_WGMXCC1_WGMXCCGn1
    SolutionIndex: 166
    SolutionNameMin: Cijk_Alik_Bljk_BBS_BH_UserArgs_MT128x128x64_MI16x16x1_SN_LDSB1_CLR1_GRVWA8_GRVWB8_GSU0_GSUC0_GSUWGMRR0_K1_LBSPPA512_LBSPPB256_LPA16_LPB16_LRVW8_MIWT4_4_NEPBS0_PLR1_SU32_SUM0_SUS256_SVW4_SKXCCM8_ULSGRO1_VWA4_VWB2_WGM4_WGMXCC1_WGMXCCGn1
    SolutionIndex: 167
    SolutionNameMin: Cijk_Alik_Bljk_BBS_BH_UserArgs_MT128x128x64_MI16x16x1_SN_LDSB1_CLR1_GRVWA8_GRVWB8_GSU0_GSUC0_GSUWGMRR0_K1_LBSPPA256_LBSPPB512_LPA16_LPB16_LRVW8_MIWT4_4_NEPBS0_PLR1_SU32_SUM0_SUS256_SVW2_SKXCCM0_ULSGRO0_VWA2_VWB4_WGM1_WGMXCC1_WGMXCCGn1
    SolutionIndex: 168
    SolutionNameMin: Cijk_Alik_Bljk_BBS_BH_UserArgs_MT128x128x64_MI16x16x1_SN_LDSB1_CLR1_GRVWA8_GRVWB8_GSU0_GSUC0_GSUWGMRR0_K1_LBSPPA512_LBSPPB512_LPA16_LPB16_LRVW8_MIWT4_4_NEPBS16_PLR1_SU32_SUM0_SUS256_SVW4_SKXCCM8_ULSGRO1_VWA4_VWB4_WGM4_WGMXCC1_WGMXCCGn1
    SolutionIndex: 169
    SolutionNameMin: Cijk_Alik_Bljk_BBS_BH_UserArgs_MT128x128x64_MI16x16x1_SN_LDSB1_CLR1_GRVWA8_GRVWB8_GSU0_GSUC0_GSUWGMRR0_K1_LBSPPA256_LBSPPB128_LPA16_LPB16_LRVW8_MIWT4_4_NEPBS0_PLR1_SU32_SUM0_SUS256_SVW2_SKXCCM8_ULSGRO0_VWA2_VWB1_WGM4_WGMXCC1_WGMXCCGn1
    SolutionIndex: 170
    SolutionNameMin: Cijk_Alik_Bljk_BBS_BH_UserArgs_MT128x128x64_MI16x16x1_SN_LDSB1_CLR1_GRVWA8_GRVWB8_GSU0_GSUC0_GSUWGMRR0_K1_LBSPPA512_LBSPPB256_LPA16_LPB16_LRVW8_MIWT4_4_NEPBS16_PLR1_SU32_SUM0_SUS256_SVW4_SKXCCM8_ULSGRO0_VWA4_VWB2_WGM8_WGMXCC1_WGMXCCGn1
    SolutionIndex: 171
    SolutionNameMin: Cijk_Alik_Bljk_BBS_BH_UserArgs_MT128x128x64_MI16x16x1_SN_LDSB1_CLR1_GRVWA8_GRVWB8_GSU0_GSUC0_GSUWGMRR0_K1_LBSPPA256_LBSPPB256_LPA16_LPB16_LRVW8_MIWT4_4_NEPBS0_PLR1_SU32_SUM0_SUS256_SVW2_SKXCCM0_ULSGRO0_VWA2_VWB2_WGM1_WGMXCC1_WGMXCCGn1
    SolutionIndex: 172
    SolutionNameMin: Cijk_Alik_Bljk_BBS_BH_UserArgs_MT128x128x64_MI16x16x1_SN_LDSB1_CLR1_GRVWA8_GRVWB8_GSU0_GSUC0_GSUWGMRR0_K1_LBSPPA512_LBSPPB128_LPA16_LPB16_LRVW8_MIWT4_4_NEPBS0_PLR1_SU32_SUM0_SUS256_SVW4_SKXCCM0_ULSGRO1_VWA4_VWB1_WGM1_WGMXCC1_WGMXCCGn1
    SolutionIndex: 173
    SolutionNameMin: Cijk_Alik_Bljk_BBS_BH_UserArgs_MT128x128x64_MI16x16x1_SN_LDSB1_CLR1_GRVWA8_GRVWB8_GSU0_GSUC0_GSUWGMRR0_K1_LBSPPA128_LBSPPB256_LPA16_LPB16_LRVW8_MIWT4_4_NEPBS0_PLR1_SU32_SUM0_SUS256_SVW1_SKXCCM8_ULSGRO1_VWA1_VWB2_WGM8_WGMXCC1_WGMXCCGn1
    SolutionIndex: 174
    SolutionNameMin: Cijk_Alik_Bljk_BBS_BH_UserArgs_MT128x128x64_MI16x16x1_SN_LDSB1_CLR1_GRVWA8_GRVWB8_GSU0_GSUC0_GSUWGMRR0_K1_LBSPPA512_LBSPPB128_LPA16_LPB16_LRVW8_MIWT4_4_NEPBS16_PLR1_SU32_SUM0_SUS256_SVW4_SKXCCM8_ULSGRO1_VWA4_VWB1_WGM8_WGMXCC1_WGMXCCGn1
    SolutionIndex: 175
    SolutionNameMin: Cijk_Alik_Bljk_BBS_BH_UserArgs_MT64x64x128_MI16x16x1_SN_LDSB1_CLR1_GRVWA8_GRVWB8_GSU0_GSUC0_GSUWGMRR0_K1_LBSPPA512_LBSPPB512_LPA16_LPB16_LRVW8_MIWT2_2_NEPBS0_PLR1_SU32_SUM0_SUS256_SVW2_SKXCCM0_ULSGRO1_VWA2_VWB2_WGM1_WGMXCC1_WGMXCCGn1
    SolutionIndex: 176
    SolutionNameMin: Cijk_Alik_Bljk_BBS_BH_UserArgs_MT64x64x128_MI16x16x1_SN_LDSB1_CLR1_GRVWA8_GRVWB8_GSU0_GSUC0_GSUWGMRR0_K1_LBSPPA512_LBSPPB512_LPA16_LPB16_LRVW8_MIWT2_2_NEPBS16_PLR1_SU32_SUM0_SUS256_SVW2_SKXCCM0_ULSGRO1_VWA2_VWB2_WGM1_WGMXCC1_WGMXCCGn1
    SolutionIndex: 177
    SolutionNameMin: Cijk_Alik_Bljk_BBS_BH_UserArgs_MT64x64x128_MI16x16x1_SN_LDSB1_CLR1_GRVWA8_GRVWB8_GSU0_GSUC0_GSUWGMRR0_K1_LBSPPA512_LBSPPB256_LPA16_LPB16_LRVW8_MIWT2_2_NEPBS16_PLR3_SU32_SUM0_SUS256_SVW2_SKXCCM8_ULSGRO0_VWA2_VWB1_WGM1_WGMXCC1_WGMXCCGn1
    SolutionIndex: 178
    SolutionNameMin: Cijk_Alik_Bljk_BBS_BH_UserArgs_MT64x64x64_MI16x16x1_SN_LDSB1_CLR1_GRVWA8_GRVWB8_GSU0_GSUC0_GSUWGMRR0_K1_LBSPPA256_LBSPPB128_LPA16_LPB16_LRVW8_MIWT2_2_NEPBS0_PLR1_SU32_SUM0_SUS256_SVW2_SKXCCM8_ULSGRO0_VWA2_VWB1_WGM8_WGMXCC1_WGMXCCGn1
    SolutionIndex: 179
    SolutionNameMin: Cijk_Alik_Bljk_BBS_BH_UserArgs_MT64x64x128_MI16x16x1_SN_LDSB1_CLR1_GRVWA8_GRVWB8_GSU0_GSUC0_GSUWGMRR0_K1_LBSPPA512_LBSPPB256_LPA16_LPB16_LRVW8_MIWT2_2_NEPBS16_PLR1_SU32_SUM0_SUS256_SVW2_SKXCCM8_ULSGRO1_VWA2_VWB1_WGM4_WGMXCC1_WGMXCCGn1
    SolutionIndex: 180
    SolutionNameMin: Cijk_Alik_Bljk_BBS_BH_UserArgs_MT64x128x64_MI16x16x1_SN_LDSB1_CLR1_GRVWA8_GRVWB8_GSU0_GSUC0_GSUWGMRR0_K1_LBSPPA256_LBSPPB512_LPA16_LPB16_LRVW8_MIWT2_4_NEPBS0_PLR1_SU32_SUM0_SUS256_SVW2_SKXCCM0_ULSGRO1_VWA2_VWB4_WGM1_WGMXCC1_WGMXCCGn1
    SolutionIndex: 181
    SolutionNameMin: Cijk_Alik_Bljk_BBS_BH_UserArgs_MT128x128x64_MI16x16x1_SN_LDSB1_CLR1_GRVWA8_GRVWB8_GSU0_GSUC0_GSUWGMRR0_K1_LBSPPA512_LBSPPB512_LPA16_LPB16_LRVW8_MIWT4_4_NEPBS0_PLR1_SU32_SUM0_SUS256_SVW4_SKXCCM0_ULSGRO1_VWA4_VWB4_WGM1_WGMXCC1_WGMXCCGn1
    SolutionIndex: 182
    SolutionNameMin: Cijk_Alik_Bljk_BBS_BH_UserArgs_MT128x64x64_MI16x16x1_SN_LDSB1_CLR1_GRVWA8_GRVWB8_GSU0_GSUC0_GSUWGMRR0_K1_LBSPPA256_LBSPPB128_LPA16_LPB16_LRVW8_MIWT4_2_NEPBS16_PLR1_SU32_SUM0_SUS256_SVW2_SKXCCM8_ULSGRO1_VWA2_VWB1_WGM4_WGMXCC1_WGMXCCGn1
    SolutionIndex: 183
    SolutionNameMin: Cijk_Alik_Bljk_BBS_BH_UserArgs_MT128x64x64_MI16x16x1_SN_LDSB1_CLR1_GRVWA8_GRVWB8_GSU0_GSUC0_GSUWGMRR0_K1_LBSPPA512_LBSPPB128_LPA16_LPB16_LRVW8_MIWT4_2_NEPBS16_PLR1_SU32_SUM0_SUS256_SVW4_SKXCCM8_ULSGRO1_VWA4_VWB1_WGM4_WGMXCC1_WGMXCCGn1
    SolutionIndex: 184
    SolutionNameMin: Cijk_Alik_Bljk_BBS_BH_UserArgs_MT64x128x64_MI16x16x1_SN_LDSB1_CLR1_GRVWA8_GRVWB8_GSU0_GSUC0_GSUWGMRR0_K1_LBSPPA256_LBSPPB512_LPA16_LPB16_LRVW8_MIWT2_4_NEPBS0_PLR1_SU32_SUM0_SUS256_SVW2_SKXCCM8_ULSGRO1_VWA2_VWB4_WGM8_WGMXCC1_WGMXCCGn1
    SolutionIndex: 185
    SolutionNameMin: Cijk_Alik_Bljk_BBS_BH_UserArgs_MT128x128x64_MI16x16x1_SN_LDSB1_CLR1_GRVWA8_GRVWB8_GSU0_GSUC0_GSUWGMRR0_K1_LBSPPA512_LBSPPB512_LPA16_LPB16_LRVW8_MIWT4_4_NEPBS16_PLR2_SU32_SUM0_SUS256_SVW4_SKXCCM0_ULSGRO0_VWA4_VWB4_WGM8_WGMXCC1_WGMXCCGn1
    SolutionIndex: 186
    SolutionNameMin: Cijk_Alik_Bljk_BBS_BH_UserArgs_MT128x64x64_MI16x16x1_SN_LDSB1_CLR1_GRVWA8_GRVWB8_GSU0_GSUC0_GSUWGMRR0_K1_LBSPPA512_LBSPPB128_LPA16_LPB16_LRVW8_MIWT4_2_NEPBS16_PLR2_SU32_SUM0_SUS256_SVW4_SKXCCM8_ULSGRO1_VWA4_VWB1_WGM8_WGMXCC1_WGMXCCGn1
    SolutionIndex: 187
    SolutionNameMin: Cijk_Alik_Bljk_BBS_BH_UserArgs_MT128x128x64_MI16x16x1_SN_LDSB1_CLR1_GRVWA8_GRVWB8_GSU0_GSUC0_GSUWGMRR0_K1_LBSPPA512_LBSPPB128_LPA16_LPB16_LRVW8_MIWT4_4_NEPBS16_PLR1_SU32_SUM0_SUS256_SVW4_SKXCCM8_ULSGRO0_VWA4_VWB1_WGM1_WGMXCC1_WGMXCCGn1
    SolutionIndex: 188
    SolutionNameMin: Cijk_Alik_Bljk_BBS_BH_UserArgs_MT256x64x64_MI16x16x1_SN_LDSB1_CLR1_GRVWA8_GRVWB8_GSU0_GSUC0_GSUWGMRR0_K1_LBSPPA512_LBSPPB256_LPA16_LPB16_LRVW8_MIWT8_2_NEPBS16_PLR1_SU32_SUM0_SUS256_SVW4_SKXCCM0_ULSGRO0_VWA4_VWB2_WGM4_WGMXCC1_WGMXCCGn1
    SolutionIndex: 189
    SolutionNameMin: Cijk_Alik_Bljk_BBS_BH_UserArgs_MT128x128x64_MI16x16x1_SN_LDSB1_CLR1_GRVWA8_GRVWB8_GSU0_GSUC0_GSUWGMRR0_K1_LBSPPA512_LBSPPB512_LPA16_LPB16_LRVW8_MIWT4_4_NEPBS0_PLR1_SU32_SUM0_SUS256_SVW4_SKXCCM8_ULSGRO0_VWA4_VWB4_WGM4_WGMXCC1_WGMXCCGn1
    SolutionIndex: 190
    SolutionNameMin: Cijk_Alik_Bljk_BBS_BH_UserArgs_MT128x128x64_MI16x16x1_SN_LDSB1_CLR1_GRVWA8_GRVWB8_GSU0_GSUC0_GSUWGMRR0_K1_LBSPPA512_LBSPPB256_LPA16_LPB16_LRVW8_MIWT4_4_NEPBS0_PLR1_SU32_SUM0_SUS256_SVW4_SKXCCM8_ULSGRO0_VWA4_VWB2_WGM4_WGMXCC1_WGMXCCGn1
    SolutionIndex: 191
    SolutionNameMin: Cijk_Alik_Bljk_BBS_BH_UserArgs_MT128x128x64_MI16x16x1_SN_LDSB1_CLR1_GRVWA8_GRVWB8_GSU0_GSUC0_GSUWGMRR0_K1_LBSPPA128_LBSPPB256_LPA16_LPB16_LRVW8_MIWT4_4_NEPBS16_PLR1_SU32_SUM0_SUS256_SVW1_SKXCCM0_ULSGRO0_VWA1_VWB2_WGM1_WGMXCC1_WGMXCCGn1
    SolutionIndex: 192
    SolutionNameMin: Cijk_Alik_Bljk_BBS_BH_UserArgs_MT128x128x64_MI16x16x1_SN_LDSB1_CLR1_GRVWA8_GRVWB8_GSU0_GSUC0_GSUWGMRR0_K1_LBSPPA512_LBSPPB128_LPA16_LPB16_LRVW8_MIWT4_4_NEPBS16_PLR1_SU32_SUM0_SUS256_SVW4_SKXCCM0_ULSGRO1_VWA4_VWB1_WGM1_WGMXCC1_WGMXCCGn1
    SolutionIndex: 193
    SolutionNameMin: Cijk_Alik_Bljk_BBS_BH_UserArgs_MT128x128x64_MI16x16x1_SN_LDSB1_CLR1_GRVWA8_GRVWB8_GSU0_GSUC0_GSUWGMRR0_K1_LBSPPA512_LBSPPB256_LPA16_LPB16_LRVW8_MIWT4_4_NEPBS0_PLR1_SU32_SUM0_SUS256_SVW4_SKXCCM0_ULSGRO1_VWA4_VWB2_WGM1_WGMXCC1_WGMXCCGn1
    SolutionIndex: 194
    SolutionNameMin: Cijk_Alik_Bljk_BBS_BH_UserArgs_MT128x128x64_MI16x16x1_SN_LDSB1_CLR1_GRVWA8_GRVWB8_GSU0_GSUC0_GSUWGMRR0_K1_LBSPPA512_LBSPPB512_LPA16_LPB16_LRVW8_MIWT4_4_NEPBS16_PLR1_SU32_SUM0_SUS256_SVW4_SKXCCM0_ULSGRO1_VWA4_VWB4_WGM1_WGMXCC1_WGMXCCGn1
    SolutionIndex: 195
    SolutionNameMin: Cijk_Alik_Bljk_BBS_BH_UserArgs_MT128x128x64_MI16x16x1_SN_LDSB1_CLR1_GRVWA8_GRVWB8_GSU0_GSUC0_GSUWGMRR0_K1_LBSPPA512_LBSPPB512_LPA16_LPB16_LRVW8_MIWT4_4_NEPBS0_PLR1_SU32_SUM0_SUS256_SVW4_SKXCCM0_ULSGRO0_VWA4_VWB4_WGM1_WGMXCC1_WGMXCCGn1
    SolutionIndex: 196
    SolutionNameMin: Cijk_Alik_Bljk_BBS_BH_UserArgs_MT128x128x64_MI16x16x1_SN_LDSB1_CLR1_GRVWA8_GRVWB8_GSU0_GSUC0_GSUWGMRR0_K1_LBSPPA512_LBSPPB256_LPA16_LPB16_LRVW8_MIWT4_4_NEPBS16_PLR1_SU32_SUM0_SUS256_SVW4_SKXCCM8_ULSGRO1_VWA4_VWB2_WGM8_WGMXCC1_WGMXCCGn1
    SolutionIndex: 197
    SolutionNameMin: Cijk_Alik_Bljk_BBS_BH_UserArgs_MT128x128x64_MI16x16x1_SN_LDSB1_CLR1_GRVWA8_GRVWB8_GSU0_GSUC0_GSUWGMRR0_K1_LBSPPA512_LBSPPB128_LPA16_LPB16_LRVW8_MIWT4_4_NEPBS16_PLR1_SU32_SUM0_SUS256_SVW4_SKXCCM0_ULSGRO0_VWA4_VWB1_WGM1_WGMXCC1_WGMXCCGn1
    SolutionIndex: 198
    SolutionNameMin: Cijk_Alik_Bljk_BBS_BH_UserArgs_MT128x128x64_MI16x16x1_SN_LDSB1_CLR1_GRVWA8_GRVWB8_GSU0_GSUC0_GSUWGMRR0_K1_LBSPPA256_LBSPPB256_LPA16_LPB16_LRVW8_MIWT4_4_NEPBS16_PLR1_SU32_SUM0_SUS256_SVW2_SKXCCM8_ULSGRO1_VWA2_VWB2_WGM8_WGMXCC1_WGMXCCGn1
    SolutionIndex: 199
    SolutionNameMin: Cijk_Alik_Bljk_BBS_BH_UserArgs_MT128x128x64_MI16x16x1_SN_LDSB1_CLR1_GRVWA8_GRVWB8_GSU0_GSUC0_GSUWGMRR0_K1_LBSPPA512_LBSPPB256_LPA16_LPB16_LRVW8_MIWT4_4_NEPBS16_PLR1_SU32_SUM0_SUS256_SVW4_SKXCCM0_ULSGRO1_VWA4_VWB2_WGM1_WGMXCC1_WGMXCCGn1
    SolutionIndex: 200
    SolutionNameMin: Cijk_Alik_Bljk_BBS_BH_UserArgs_MT128x128x64_MI16x16x1_SN_LDSB1_CLR1_GRVWA8_GRVWB8_GSU0_GSUC0_GSUWGMRR0_K1_LBSPPA256_LBSPPB128_LPA16_LPB16_LRVW8_MIWT4_4_NEPBS0_PLR1_SU32_SUM0_SUS256_SVW2_SKXCCM0_ULSGRO0_VWA2_VWB1_WGM1_WGMXCC1_WGMXCCGn1
- - - [1, 1, 1, 32]
    - [50, 0.0]
  - - [128, 128, 1, 128]
    - [45, 0.094]
  - - [128, 128, 1, 256]
    - [21, 0.111]
  - - [128, 128, 1, 512]
    - [44, 0.182]
  - - [128, 128, 1, 1024]
    - [45, 0.274]
  - - [128, 128, 1, 2048]
    - [47, 0.357]
  - - [128, 128, 1, 4096]
    - [0, 0.55]
  - - [128, 128, 1, 8192]
    - [25, 1.069]
  - - [128, 256, 1, 128]
    - [12, 0.182]
  - - [128, 256, 1, 256]
    - [13, 0.215]
  - - [128, 256, 1, 512]
    - [46, 0.352]
  - - [128, 256, 1, 1024]
    - [67, 0.542]
  - - [128, 256, 1, 2048]
    - [16, 0.819]
  - - [128, 256, 1, 4096]
    - [17, 1.635]
  - - [128, 256, 1, 8192]
    - [32, 3.037]
  - - [128, 512, 1, 128]
    - [24, 0.362]
  - - [128, 512, 1, 256]
    - [21, 0.426]
  - - [128, 512, 1, 512]
    - [67, 0.72]
  - - [128, 512, 1, 1024]
    - [18, 1.13]
  - - [128, 512, 1, 2048]
    - [64, 2.162]
  - - [128, 512, 1, 4096]
    - [32, 3.734]
  - - [128, 512, 1, 8192]
    - [65, 6.491]
  - - [128, 1024, 1, 128]
    - [13, 0.707]
  - - [128, 1024, 1, 256]
    - [14, 0.794]
  - - [128, 1024, 1, 512]
    - [68, 1.414]
  - - [128, 1024, 1, 1024]
    - [21, 2.436]
  - - [128, 1024, 1, 2048]
    - [11, 4.261]
  - - [128, 1024, 1, 4096]
    - [31, 6.852]
  - - [128, 1024, 1, 8192]
    - [61, 9.131]
  - - [128, 2048, 1, 128]
    - [11, 1.367]
  - - [128, 2048, 1, 256]
    - [22, 1.685]
  - - [128, 2048, 1, 512]
    - [65, 2.792]
  - - [128, 2048, 1, 1024]
    - [11, 4.633]
  - - [128, 2048, 1, 2048]
    - [29, 7.46]
  - - [128, 2048, 1, 4096]
    - [30, 10.703]
  - - [128, 2048, 1, 8192]
    - [56, 12.764]
  - - [128, 4096, 1, 128]
    - [7, 2.548]
  - - [128, 4096, 1, 256]
    - [6, 3.103]
  - - [128, 4096, 1, 512]
    - [61, 5.031]
  - - [128, 4096, 1, 1024]
    - [10, 7.763]
  - - [128, 4096, 1, 2048]
    - [42, 11.277]
  - - [128, 4096, 1, 4096]
    - [38, 14.327]
  - - [128, 4096, 1, 8192]
    - [3, 17.194]
  - - [128, 8192, 1, 128]
    - [5, 4.374]
  - - [128, 8192, 1, 256]
    - [19, 5.258]
  - - [128, 8192, 1, 512]
    - [60, 8.524]
  - - [128, 8192, 1, 1024]
    - [33, 12.313]
  - - [128, 8192, 1, 2048]
    - [35, 15.267]
  - - [128, 8192, 1, 4096]
    - [53, 18.513]
  - - [128, 8192, 1, 8192]
    - [2, 22.336]
  - - [256, 128, 1, 128]
    - [48, 0.18]
  - - [256, 128, 1, 256]
    - [12, 0.215]
  - - [256, 128, 1, 512]
    - [63, 0.36]
  - - [256, 128, 1, 1024]
    - [66, 0.547]
  - - [256, 128, 1, 2048]
    - [1, 0.817]
  - - [256, 128, 1, 4096]
    - [4, 1.595]
  - - [256, 128, 1, 8192]
    - [57, 2.991]
  - - [256, 256, 1, 128]
    - [21, 0.358]
  - - [256, 256, 1, 256]
    - [15, 0.424]
  - - [256, 256, 1, 512]
    - [47, 0.707]
  - - [256, 256, 1, 1024]
    - [32, 1.148]
  - - [256, 256, 1, 2048]
    - [68, 2.181]
  - - [256, 256, 1, 4096]
    - [23, 3.75]
  - - [256, 256, 1, 8192]
    - [58, 6.105]
  - - [256, 512, 1, 128]
    - [12, 0.709]
  - - [256, 512, 1, 256]
    - [11, 0.793]
  - - [256, 512, 1, 512]
    - [64, 1.422]
  - - [256, 512, 1, 1024]
    - [22, 2.487]
  - - [256, 512, 1, 2048]
    - [67, 4.327]
  - - [256, 512, 1, 4096]
    - [32, 7.025]
  - - [256, 512, 1, 8192]
    - [49, 9.121]
  - - [256, 1024, 1, 128]
    - [23, 1.382]
  - - [256, 1024, 1, 256]
    - [23, 1.693]
  - - [256, 1024, 1, 512]
    - [14, 2.787]
  - - [256, 1024, 1, 1024]
    - [47, 4.655]
  - - [256, 1024, 1, 2048]
    - [65, 7.301]
  - - [256, 1024, 1, 4096]
    - [43, 10.869]
  - - [256, 1024, 1, 8192]
    - [28, 13.028]
  - - [256, 2048, 1, 128]
    - [8, 2.544]
  - - [256, 2048, 1, 256]
    - [9, 3.084]
  - - [256, 2048, 1, 512]
    - [62, 5.047]
  - - [256, 2048, 1, 1024]
    - [40, 7.871]
  - - [256, 2048, 1, 2048]
    - [41, 11.321]
  - - [256, 2048, 1, 4096]
    - [55, 14.556]
  - - [256, 2048, 1, 8192]
    - [39, 17.11]
  - - [256, 4096, 1, 128]
    - [34, 4.287]
  - - [256, 4096, 1, 256]
    - [20, 5.25]
  - - [256, 4096, 1, 512]
    - [36, 8.4]
  - - [256, 4096, 1, 1024]
    - [37, 12.318]
  - - [256, 4096, 1, 2048]
    - [60, 16.015]
  - - [256, 4096, 1, 4096]
    - [54, 18.948]
  - - [256, 4096, 1, 8192]
    - [51, 22.052]
  - - [256, 8192, 1, 128]
    - [34, 5.445]
  - - [256, 8192, 1, 256]
    - [59, 7.189]
  - - [256, 8192, 1, 512]
    - [27, 11.156]
  - - [256, 8192, 1, 1024]
    - [52, 16.37]
  - - [256, 8192, 1, 2048]
    - [53, 19.341]
  - - [256, 8192, 1, 4096]
    - [26, 24.306]
  - - [256, 8192, 1, 8192]
    - [26, 27.144]
  - - [512, 128, 1, 128]
    - [11, 0.362]
  - - [512, 128, 1, 256]
    - [22, 0.422]
  - - [512, 128, 1, 512]
    - [45, 0.712]
  - - [512, 128, 1, 1024]
    - [57, 1.138]
  - - [512, 128, 1, 2048]
    - [63, 2.151]
  - - [512, 128, 1, 4096]
    - [22, 3.86]
  - - [512, 128, 1, 8192]
    - [69, 6.235]
  - - [512, 256, 1, 128]
    - [14, 0.659]
  - - [512, 256, 1, 256]
    - [47, 0.818]
  - - [512, 256, 1, 512]
    - [45, 1.488]
  - - [512, 256, 1, 1024]
    - [46, 2.511]
  - - [512, 256, 1, 2048]
    - [14, 4.329]
  - - [512, 256, 1, 4096]
    - [70, 6.857]
  - - [512, 256, 1, 8192]
    - [71, 9.172]
  - - [512, 512, 1, 128]
    - [64, 1.373]
  - - [512, 512, 1, 256]
    - [12, 1.696]
  - - [512, 512, 1, 512]
    - [45, 2.87]
  - - [512, 512, 1, 1024]
    - [12, 4.603]
  - - [512, 512, 1, 2048]
    - [72, 7.346]
  - - [512, 512, 1, 4096]
    - [73, 10.46]
  - - [512, 512, 1, 8192]
    - [74, 12.725]
  - - [512, 1024, 1, 128]
    - [75, 2.566]
  - - [512, 1024, 1, 256]
    - [76, 3.086]
  - - [512, 1024, 1, 512]
    - [77, 4.939]
  - - [512, 1024, 1, 1024]
    - [78, 8.018]
  - - [512, 1024, 1, 2048]
    - [79, 11.212]
  - - [512, 1024, 1, 4096]
    - [80, 14.32]
  - - [512, 1024, 1, 8192]
    - [81, 17.137]
  - - [512, 2048, 1, 128]
    - [82, 4.431]
  - - [512, 2048, 1, 256]
    - [83, 5.322]
  - - [512, 2048, 1, 512]
    - [84, 8.598]
  - - [512, 2048, 1, 1024]
    - [85, 12.14]
  - - [512, 2048, 1, 2048]
    - [84, 16.03]
  - - [512, 2048, 1, 4096]
    - [86, 18.782]
  - - [512, 2048, 1, 8192]
    - [87, 21.968]
  - - [512, 4096, 1, 128]
    - [34, 5.442]
  - - [512, 4096, 1, 256]
    - [33, 7.103]
  - - [512, 4096, 1, 512]
    - [88, 11.409]
  - - [512, 4096, 1, 1024]
    - [52, 16.534]
  - - [512, 4096, 1, 2048]
    - [89, 19.345]
  - - [512, 4096, 1, 4096]
    - [90, 24.106]
  - - [512, 4096, 1, 8192]
    - [91, 26.462]
  - - [512, 8192, 1, 128]
    - [92, 6.696]
  - - [512, 8192, 1, 256]
    - [93, 9.065]
  - - [512, 8192, 1, 512]
    - [94, 14.794]
  - - [512, 8192, 1, 1024]
    - [95, 18.891]
  - - [512, 8192, 1, 2048]
    - [51, 23.873]
  - - [512, 8192, 1, 4096]
    - [96, 28.054]
  - - [512, 8192, 1, 8192]
    - [97, 26.929]
  - - [1024, 128, 1, 128]
    - [22, 0.718]
  - - [1024, 128, 1, 256]
    - [21, 0.813]
  - - [1024, 128, 1, 512]
    - [48, 1.444]
  - - [1024, 128, 1, 1024]
    - [64, 2.498]
  - - [1024, 128, 1, 2048]
    - [57, 4.302]
  - - [1024, 128, 1, 4096]
    - [98, 6.854]
  - - [1024, 128, 1, 8192]
    - [99, 9.102]
  - - [1024, 256, 1, 128]
    - [11, 1.394]
  - - [1024, 256, 1, 256]
    - [23, 1.71]
  - - [1024, 256, 1, 512]
    - [12, 2.818]
  - - [1024, 256, 1, 1024]
    - [17, 4.632]
  - - [1024, 256, 1, 2048]
    - [100, 7.296]
  - - [1024, 256, 1, 4096]
    - [101, 10.58]
  - - [1024, 256, 1, 8192]
    - [74, 12.756]
  - - [1024, 512, 1, 128]
    - [102, 2.513]
  - - [1024, 512, 1, 256]
    - [103, 3.01]
  - - [1024, 512, 1, 512]
    - [77, 5.036]
  - - [1024, 512, 1, 1024]
    - [104, 7.902]
  - - [1024, 512, 1, 2048]
    - [105, 11.149]
  - - [1024, 512, 1, 4096]
    - [106, 14.363]
  - - [1024, 512, 1, 8192]
    - [89, 16.797]
  - - [1024, 1024, 1, 128]
    - [83, 4.385]
  - - [1024, 1024, 1, 256]
    - [83, 5.326]
  - - [1024, 1024, 1, 512]
    - [107, 8.401]
  - - [1024, 1024, 1, 1024]
    - [35, 12.322]
  - - [1024, 1024, 1, 2048]
    - [108, 15.726]
  - - [1024, 1024, 1, 4096]
    - [86, 18.738]
  - - [1024, 1024, 1, 8192]
    - [109, 21.897]
  - - [1024, 2048, 1, 128]
    - [84, 5.461]
  - - [1024, 2048, 1, 256]
    - [33, 7.14]
  - - [1024, 2048, 1, 512]
    - [110, 11.116]
  - - [1024, 2048, 1, 1024]
    - [111, 15.851]
  - - [1024, 2048, 1, 2048]
    - [112, 19.119]
  - - [1024, 2048, 1, 4096]
    - [26, 24.28]
  - - [1024, 2048, 1, 8192]
    - [113, 26.676]
  - - [1024, 4096, 1, 128]
    - [114, 6.646]
  - - [1024, 4096, 1, 256]
    - [115, 8.995]
  - - [1024, 4096, 1, 512]
    - [116, 14.495]
  - - [1024, 4096, 1, 1024]
    - [117, 19.17]
  - - [1024, 4096, 1, 2048]
    - [118, 24.194]
  - - [1024, 4096, 1, 4096]
    - [119, 28.322]
  - - [1024, 4096, 1, 8192]
    - [120, 26.189]
  - - [1024, 8192, 1, 128]
    - [121, 8.288]
  - - [1024, 8192, 1, 256]
    - [122, 12.426]
  - - [1024, 8192, 1, 512]
    - [123, 18.476]
  - - [1024, 8192, 1, 1024]
    - [124, 23.33]
  - - [1024, 8192, 1, 2048]
    - [125, 28.152]
  - - [1024, 8192, 1, 4096]
    - [126, 29.487]
  - - [1024, 8192, 1, 8192]
    - [127, 29.076]
  - - [2048, 128, 1, 128]
    - [21, 1.384]
  - - [2048, 128, 1, 256]
    - [45, 1.672]
  - - [2048, 128, 1, 512]
    - [64, 2.848]
  - - [2048, 128, 1, 1024]
    - [21, 4.696]
  - - [2048, 128, 1, 2048]
    - [128, 7.439]
  - - [2048, 128, 1, 4096]
    - [129, 10.738]
  - - [2048, 128, 1, 8192]
    - [130, 12.358]
  - - [2048, 256, 1, 128]
    - [131, 2.547]
  - - [2048, 256, 1, 256]
    - [132, 3.095]
  - - [2048, 256, 1, 512]
    - [133, 5.058]
  - - [2048, 256, 1, 1024]
    - [40, 7.927]
  - - [2048, 256, 1, 2048]
    - [134, 11.161]
  - - [2048, 256, 1, 4096]
    - [135, 14.422]
  - - [2048, 256, 1, 8192]
    - [136, 16.57]
  - - [2048, 512, 1, 128]
    - [82, 4.356]
  - - [2048, 512, 1, 256]
    - [83, 5.333]
  - - [2048, 512, 1, 512]
    - [137, 8.494]
  - - [2048, 512, 1, 1024]
    - [138, 12.247]
  - - [2048, 512, 1, 2048]
    - [139, 15.945]
  - - [2048, 512, 1, 4096]
    - [54, 19.063]
  - - [2048, 512, 1, 8192]
    - [140, 22.043]
  - - [2048, 1024, 1, 128]
    - [83, 5.469]
  - - [2048, 1024, 1, 256]
    - [82, 7.025]
  - - [2048, 1024, 1, 512]
    - [141, 11.631]
  - - [2048, 1024, 1, 1024]
    - [112, 16.198]
  - - [2048, 1024, 1, 2048]
    - [54, 19.515]
  - - [2048, 1024, 1, 4096]
    - [91, 24.45]
  - - [2048, 1024, 1, 8192]
    - [142, 27.042]
  - - [2048, 2048, 1, 128]
    - [143, 6.642]
  - - [2048, 2048, 1, 256]
    - [144, 9.011]
  - - [2048, 2048, 1, 512]
    - [141, 15.027]
  - - [2048, 2048, 1, 1024]
    - [26, 19.058]
  - - [2048, 2048, 1, 2048]
    - [120, 24.504]
  - - [2048, 2048, 1, 4096]
    - [124, 30.573]
  - - [2048, 2048, 1, 8192]
    - [145, 28.378]
  - - [2048, 4096, 1, 128]
    - [146, 8.338]
  - - [2048, 4096, 1, 256]
    - [109, 12.758]
  - - [2048, 4096, 1, 512]
    - [147, 17.669]
  - - [2048, 4096, 1, 1024]
    - [148, 23.375]
  - - [2048, 4096, 1, 2048]
    - [51, 28.144]
  - - [2048, 4096, 1, 4096]
    - [87, 29.318]
  - - [2048, 4096, 1, 8192]
    - [122, 29.597]
  - - [2048, 8192, 1, 128]
    - [149, 9.843]
  - - [2048, 8192, 1, 256]
    - [109, 15.175]
  - - [2048, 8192, 1, 512]
    - [140, 20.431]
  - - [2048, 8192, 1, 1024]
    - [150, 26.609]
  - - [2048, 8192, 1, 2048]
    - [148, 29.419]
  - - [2048, 8192, 1, 4096]
    - [125, 32.337]
  - - [2048, 8192, 1, 8192]
    - [118, 35.668]
  - - [4096, 128, 1, 128]
    - [76, 2.541]
  - - [4096, 128, 1, 256]
    - [133, 3.047]
  - - [4096, 128, 1, 512]
    - [133, 5.031]
  - - [4096, 128, 1, 1024]
    - [40, 7.932]
  - - [4096, 128, 1, 2048]
    - [151, 11.13]
  - - [4096, 128, 1, 4096]
    - [152, 13.822]
  - - [4096, 128, 1, 8192]
    - [153, 16.324]
  - - [4096, 256, 1, 128]
    - [82, 4.34]
  - - [4096, 256, 1, 256]
    - [154, 5.293]
  - - [4096, 256, 1, 512]
    - [33, 8.593]
  - - [4096, 256, 1, 1024]
    - [155, 12.16]
  - - [4096, 256, 1, 2048]
    - [39, 15.945]
  - - [4096, 256, 1, 4096]
    - [156, 17.942]
  - - [4096, 256, 1, 8192]
    - [109, 21.901]
  - - [4096, 512, 1, 128]
    - [157, 5.443]
  - - [4096, 512, 1, 256]
    - [137, 7.081]
  - - [4096, 512, 1, 512]
    - [158, 11.167]
  - - [4096, 512, 1, 1024]
    - [159, 16.002]
  - - [4096, 512, 1, 2048]
    - [112, 19.328]
  - - [4096, 512, 1, 4096]
    - [142, 23.536]
  - - [4096, 512, 1, 8192]
    - [109, 27.446]
  - - [4096, 1024, 1, 128]
    - [160, 6.642]
  - - [4096, 1024, 1, 256]
    - [94, 9.281]
  - - [4096, 1024, 1, 512]
    - [91, 14.171]
  - - [4096, 1024, 1, 1024]
    - [91, 19.184]
  - - [4096, 1024, 1, 2048]
    - [91, 24.093]
  - - [4096, 1024, 1, 4096]
    - [142, 28.931]
  - - [4096, 1024, 1, 8192]
    - [161, 29.607]
  - - [4096, 2048, 1, 128]
    - [162, 8.154]
  - - [4096, 2048, 1, 256]
    - [147, 12.208]
  - - [4096, 2048, 1, 512]
    - [117, 17.646]
  - - [4096, 2048, 1, 1024]
    - [91, 23.185]
  - - [4096, 2048, 1, 2048]
    - [125, 28.483]
  - - [4096, 2048, 1, 4096]
    - [163, 29.373]
  - - [4096, 2048, 1, 8192]
    - [164, 30.203]
  - - [4096, 4096, 1, 128]
    - [124, 9.701]
  - - [4096, 4096, 1, 256]
    - [165, 14.483]
  - - [4096, 4096, 1, 512]
    - [148, 20.042]
  - - [4096, 4096, 1, 1024]
    - [166, 26.078]
  - - [4096, 4096, 1, 2048]
    - [167, 29.545]
  - - [4096, 4096, 1, 4096]
    - [168, 32.769]
  - - [4096, 4096, 1, 8192]
    - [169, 35.442]
  - - [4096, 8192, 1, 128]
    - [124, 11.699]
  - - [4096, 8192, 1, 256]
    - [170, 16.909]
  - - [4096, 8192, 1, 512]
    - [171, 23.222]
  - - [4096, 8192, 1, 1024]
    - [172, 28.062]
  - - [4096, 8192, 1, 2048]
    - [164, 30.8]
  - - [4096, 8192, 1, 4096]
    - [173, 35.152]
  - - [4096, 8192, 1, 8192]
    - [174, 35.631]
  - - [8192, 128, 1, 128]
    - [175, 4.307]
  - - [8192, 128, 1, 256]
    - [176, 5.233]
  - - [8192, 128, 1, 512]
    - [177, 8.246]
  - - [8192, 128, 1, 1024]
    - [178, 11.741]
  - - [8192, 128, 1, 2048]
    - [179, 14.878]
  - - [8192, 128, 1, 4096]
    - [180, 18.026]
  - - [8192, 128, 1, 8192]
    - [181, 22.155]
  - - [8192, 256, 1, 128]
    - [137, 5.385]
  - - [8192, 256, 1, 256]
    - [34, 6.928]
  - - [8192, 256, 1, 512]
    - [182, 11.115]
  - - [8192, 256, 1, 1024]
    - [183, 15.546]
  - - [8192, 256, 1, 2048]
    - [184, 19.018]
  - - [8192, 256, 1, 4096]
    - [109, 23.209]
  - - [8192, 256, 1, 8192]
    - [124, 27.181]
  - - [8192, 512, 1, 128]
    - [185, 6.417]
  - - [8192, 512, 1, 256]
    - [186, 8.793]
  - - [8192, 512, 1, 512]
    - [111, 14.082]
  - - [8192, 512, 1, 1024]
    - [148, 18.723]
  - - [8192, 512, 1, 2048]
    - [95, 22.893]
  - - [8192, 512, 1, 4096]
    - [123, 28.992]
  - - [8192, 512, 1, 8192]
    - [187, 27.768]
  - - [8192, 1024, 1, 128]
    - [188, 8.053]
  - - [8192, 1024, 1, 256]
    - [90, 12.225]
  - - [8192, 1024, 1, 512]
    - [174, 17.765]
  - - [8192, 1024, 1, 1024]
    - [174, 23.159]
  - - [8192, 1024, 1, 2048]
    - [189, 27.695]
  - - [8192, 1024, 1, 4096]
    - [190, 29.653]
  - - [8192, 1024, 1, 8192]
    - [191, 30.615]
  - - [8192, 2048, 1, 128]
    - [192, 9.408]
  - - [8192, 2048, 1, 256]
    - [193, 14.415]
  - - [8192, 2048, 1, 512]
    - [51, 20.093]
  - - [8192, 2048, 1, 1024]
    - [194, 26.519]
  - - [8192, 2048, 1, 2048]
    - [195, 29.003]
  - - [8192, 2048, 1, 4096]
    - [196, 32.552]
  - - [8192, 2048, 1, 8192]
    - [174, 35.256]
  - - [8192, 4096, 1, 128]
    - [195, 11.471]
  - - [8192, 4096, 1, 256]
    - [51, 16.889]
  - - [8192, 4096, 1, 512]
    - [197, 23.829]
  - - [8192, 4096, 1, 1024]
    - [91, 27.65]
  - - [8192, 4096, 1, 2048]
    - [194, 30.271]
  - - [8192, 4096, 1, 4096]
    - [198, 34.644]
  - - [8192, 4096, 1, 8192]
    - [91, 35.545]
  - - [8192, 8192, 1, 128]
    - [199, 11.035]
  - - [8192, 8192, 1, 256]
    - [2, 16.249]
  - - [8192, 8192, 1, 512]
    - [193, 22.655]
  - - [8192, 8192, 1, 1024]
    - [200, 28.548]
  - - [8192, 8192, 1, 2048]
    - [199, 31.812]
  - - [8192, 8192, 1, 4096]
    - [119, 35.203]
  - - [8192, 8192, 1, 8192]
    - [117, 36.78]
- null
- null
- DeviceEfficiency
- GridBased
