library/src/amd_detail/rocblaslt/src/Tensile/Logic/streamk/gfx942/aquavanjaram942_Cijk_Ailk_Bjlk_HHS_BH_UserArgs.yaml
- {MinimumRequiredVersion: 4.33.0}
- aquavanjaram942
- gfx942
- [Device 0049, Device 0050]
    SolutionIndex: 0
    SolutionNameMin: Cijk_Ailk_Bjlk_HHS_BH_UserArgs_MT128x64x32_MI16x16x1_SN_LDSB0_CLR1_GRVWA8_GRVWB8_GSU0_GSUC0_GSUWGMRR0_K1_LBSPPA1024_LBSPPB512_LPA0_LPB32_MIWT4_2_NEPBS0_PLR1_SU32_SUM0_SUS256_SVW4_SKXCCM0_ULSGRO1_VWA4_VWB2_WGM1_WGMXCC1_WGMXCCGn1
    SolutionIndex: 1
    SolutionNameMin: Cijk_Ailk_Bjlk_HHS_BH_UserArgs_MT32x32x32_MI16x16x1_SN_LDSB0_CLR1_GRVWA4_GRVWB4_GSU0_GSUC0_GSUWGMRR0_K1_LBSPPA256_LBSPPB256_LPA16_LPB16_MIWT1_1_NEPBS0_PLR1_SU32_SUM0_SUS256_SVW1_SKXCCM0_ULSGRO0_VWA1_VWB1_WGM1_WGMXCC1_WGMXCCGn1
    SolutionIndex: 2
    SolutionNameMin: Cijk_Ailk_Bjlk_HHS_BH_UserArgs_MT32x32x32_MI16x16x1_SN_LDSB0_CLR1_GRVWA4_GRVWB4_GSU0_GSUC0_GSUWGMRR0_K1_LBSPPA256_LBSPPB256_LPA16_LPB16_MIWT1_1_NEPBS0_PLR1_SU32_SUM0_SUS256_SVW1_SKXCCM0_ULSGRO1_VWA1_VWB1_WGM1_WGMXCC1_WGMXCCGn1
    SolutionIndex: 3
    SolutionNameMin: Cijk_Ailk_Bjlk_HHS_BH_UserArgs_MT128x64x64_MI16x16x1_SN_LDSB1_CLR1_GRVWA8_GRVWB8_GSU0_GSUC0_GSUWGMRR0_K1_LBSPPA1024_LBSPPB512_LPA0_LPB32_MIWT4_2_NEPBS0_PLR1_SU32_SUM0_SUS256_SVW4_SKXCCM0_ULSGRO0_VWA4_VWB2_WGM1_WGMXCC1_WGMXCCGn1
    SolutionIndex: 4
    SolutionNameMin: Cijk_Ailk_Bjlk_HHS_BH_UserArgs_MT128x64x64_MI16x16x1_SN_LDSB1_CLR1_GRVWA8_GRVWB8_GSU0_GSUC0_GSUWGMRR0_K1_LBSPPA1024_LBSPPB512_LPA0_LPB32_MIWT4_2_NEPBS0_PLR2_SU32_SUM0_SUS256_SVW4_SKXCCM0_ULSGRO0_VWA4_VWB2_WGM1_WGMXCC1_WGMXCCGn1
    SolutionIndex: 5
    SolutionNameMin: Cijk_Ailk_Bjlk_HHS_BH_UserArgs_MT32x32x64_MI16x16x1_SN_LDSB0_CLR1_GRVWA8_GRVWB8_GSU0_GSUC0_GSUWGMRR0_K1_LBSPPA256_LBSPPB256_LPA16_LPB16_MIWT1_1_NEPBS0_PLR1_SU32_SUM0_SUS256_SVW1_SKXCCM0_ULSGRO1_VWA1_VWB1_WGM1_WGMXCC1_WGMXCCGn1
    SolutionIndex: 6
    SolutionNameMin: Cijk_Ailk_Bjlk_HHS_BH_UserArgs_MT128x64x128_MI16x16x1_SN_LDSB1_CLR1_GRVWA8_GRVWB8_GSU0_GSUC0_GSUWGMRR0_K1_LBSPPA1024_LBSPPB512_LPA0_LPB32_MIWT4_2_NEPBS0_PLR1_SU32_SUM0_SUS256_SVW4_SKXCCM0_ULSGRO1_VWA4_VWB2_WGM8_WGMXCC1_WGMXCCGn1
    SolutionIndex: 7
    SolutionNameMin: Cijk_Ailk_Bjlk_HHS_BH_UserArgs_MT64x32x128_MI16x16x1_SN_LDSB1_CLR1_GRVWA8_GRVWB8_GSU0_GSUC0_GSUWGMRR0_K1_LBSPPA512_LBSPPB256_LPA32_LPB16_MIWT2_1_NEPBS0_PLR2_SU32_SUM0_SUS256_SVW2_SKXCCM0_ULSGRO1_VWA2_VWB1_WGM1_WGMXCC1_WGMXCCGn1
    SolutionIndex: 8
    SolutionNameMin: Cijk_Ailk_Bjlk_HHS_BH_UserArgs_MT64x32x128_MI16x16x1_SN_LDSB1_CLR1_GRVWA8_GRVWB8_GSU0_GSUC0_GSUWGMRR0_K1_LBSPPA512_LBSPPB256_LPA32_LPB16_MIWT2_1_NEPBS0_PLR3_SU32_SUM0_SUS256_SVW2_SKXCCM0_ULSGRO1_VWA2_VWB1_WGM1_WGMXCC1_WGMXCCGn1
    SolutionIndex: 9
    SolutionNameMin: Cijk_Ailk_Bjlk_HHS_BH_UserArgs_MT64x32x128_MI16x16x1_SN_LDSB1_CLR1_GRVWA8_GRVWB8_GSU0_GSUC0_GSUWGMRR0_K1_LBSPPA512_LBSPPB256_LPA32_LPB16_MIWT2_1_NEPBS0_PLR2_SU32_SUM0_SUS256_SVW2_SKXCCM0_ULSGRO0_VWA2_VWB1_WGM8_WGMXCC1_WGMXCCGn1
    SolutionIndex: 10
    SolutionNameMin: Cijk_Ailk_Bjlk_HHS_BH_UserArgs_MT32x32x128_MI16x16x1_SN_LDSB1_CLR1_GRVWA8_GRVWB8_GSU0_GSUC0_GSUWGMRR0_K1_LBSPPA256_LBSPPB256_LPA16_LPB16_MIWT1_1_NEPBS0_PLR1_SU32_SUM0_SUS256_SVW1_SKXCCM0_ULSGRO0_VWA1_VWB1_WGM1_WGMXCC1_WGMXCCGn1
    SolutionIndex: 11
    SolutionNameMin: Cijk_Ailk_Bjlk_HHS_BH_UserArgs_MT32x32x128_MI16x16x1_SN_LDSB1_CLR1_GRVWA8_GRVWB8_GSU0_GSUC0_GSUWGMRR0_K1_LBSPPA256_LBSPPB256_LPA16_LPB16_MIWT1_1_NEPBS0_PLR1_SU32_SUM0_SUS256_SVW1_SKXCCM0_ULSGRO1_VWA1_VWB1_WGM1_WGMXCC1_WGMXCCGn1
    SolutionIndex: 12
    SolutionNameMin: Cijk_Ailk_Bjlk_HHS_BH_UserArgs_MT32x32x128_MI16x16x1_SN_LDSB1_CLR1_GRVWA8_GRVWB8_GSU0_GSUC0_GSUWGMRR0_K1_LBSPPA256_LBSPPB256_LPA16_LPB16_MIWT1_1_NEPBS0_PLR3_SU32_SUM0_SUS256_SVW1_SKXCCM0_ULSGRO0_VWA1_VWB1_WGM1_WGMXCC1_WGMXCCGn1
    SolutionIndex: 13
    SolutionNameMin: Cijk_Ailk_Bjlk_HHS_BH_UserArgs_MT256x128x32_MI16x16x1_SN_LDSB1_CLR1_GRVWA8_GRVWB8_GSU0_GSUC0_GSUWGMRR0_K1_LBSPPA2048_LBSPPB1024_LPA0_LPB16_MIWT8_4_NEPBS16_PLR1_SU32_SUM0_SUS256_SVW4_SKXCCM0_ULSGRO0_VWA4_VWB1_WGM1_WGMXCC1_WGMXCCGn1
    SolutionIndex: 14
    SolutionNameMin: Cijk_Ailk_Bjlk_HHS_BH_UserArgs_MT32x32x32_MI16x16x1_SN_LDSB0_CLR1_GRVWA4_GRVWB4_GSU0_GSUC0_GSUWGMRR0_K1_LBSPPA256_LBSPPB256_LPA16_LPB16_MIWT1_1_NEPBS16_PLR1_SU32_SUM0_SUS256_SVW1_SKXCCM0_ULSGRO1_VWA1_VWB1_WGM1_WGMXCC1_WGMXCCGn1
    SolutionIndex: 15
    SolutionNameMin: Cijk_Ailk_Bjlk_HHS_BH_UserArgs_MT128x128x64_MI16x16x1_SN_LDSB1_CLR1_GRVWA8_GRVWB8_GSU0_GSUC0_GSUWGMRR0_K1_LBSPPA1024_LBSPPB1024_LPA0_LPB0_MIWT4_4_NEPBS16_PLR1_SU32_SUM0_SUS256_SVW4_SKXCCM0_ULSGRO0_VWA4_VWB4_WGM1_WGMXCC1_WGMXCCGn1
    SolutionIndex: 16
    SolutionNameMin: Cijk_Ailk_Bjlk_HHS_BH_UserArgs_MT64x64x64_MI16x16x1_SN_LDSB1_CLR1_GRVWA8_GRVWB8_GSU0_GSUC0_GSUWGMRR0_K1_LBSPPA512_LBSPPB512_LPA32_LPB32_MIWT2_2_NEPBS16_PLR1_SU32_SUM0_SUS256_SVW2_SKXCCM0_ULSGRO0_VWA2_VWB2_WGM8_WGMXCC1_WGMXCCGn1
    SolutionIndex: 17
    SolutionNameMin: Cijk_Ailk_Bjlk_HHS_BH_UserArgs_MT32x32x64_MI16x16x1_SN_LDSB0_CLR1_GRVWA8_GRVWB8_GSU0_GSUC0_GSUWGMRR0_K1_LBSPPA256_LBSPPB256_LPA16_LPB16_MIWT1_1_NEPBS16_PLR3_SU32_SUM0_SUS256_SVW1_SKXCCM0_ULSGRO0_VWA1_VWB1_WGM1_WGMXCC1_WGMXCCGn1
    SolutionIndex: 18
    SolutionNameMin: Cijk_Ailk_Bjlk_HHS_BH_UserArgs_MT64x64x128_MI16x16x1_SN_LDSB1_CLR1_GRVWA8_GRVWB8_GSU0_GSUC0_GSUWGMRR0_K1_LBSPPA512_LBSPPB512_LPA32_LPB32_MIWT2_2_NEPBS16_PLR2_SU32_SUM0_SUS256_SVW2_SKXCCM0_ULSGRO0_VWA2_VWB2_WGM1_WGMXCC1_WGMXCCGn1
    SolutionIndex: 19
    SolutionNameMin: Cijk_Ailk_Bjlk_HHS_BH_UserArgs_MT64x64x128_MI16x16x1_SN_LDSB1_CLR1_GRVWA8_GRVWB8_GSU0_GSUC0_GSUWGMRR0_K1_LBSPPA512_LBSPPB512_LPA32_LPB32_MIWT2_2_NEPBS16_PLR2_SU32_SUM0_SUS256_SVW2_SKXCCM0_ULSGRO1_VWA2_VWB2_WGM1_WGMXCC1_WGMXCCGn1
    SolutionIndex: 20
    SolutionNameMin: Cijk_Ailk_Bjlk_HHS_BH_UserArgs_MT64x64x128_MI16x16x1_SN_LDSB1_CLR1_GRVWA8_GRVWB8_GSU0_GSUC0_GSUWGMRR0_K1_LBSPPA512_LBSPPB512_LPA32_LPB32_MIWT2_2_NEPBS16_PLR2_SU32_SUM0_SUS256_SVW2_SKXCCM0_ULSGRO0_VWA2_VWB2_WGM4_WGMXCC1_WGMXCCGn1
    SolutionIndex: 21
    SolutionNameMin: Cijk_Ailk_Bjlk_HHS_BH_UserArgs_MT32x64x128_MI16x16x1_SN_LDSB1_CLR1_GRVWA8_GRVWB8_GSU0_GSUC0_GSUWGMRR0_K1_LBSPPA256_LBSPPB512_LPA16_LPB32_MIWT1_2_NEPBS16_PLR3_SU32_SUM0_SUS256_SVW1_SKXCCM0_ULSGRO1_VWA1_VWB2_WGM1_WGMXCC1_WGMXCCGn1
    SolutionIndex: 22
    SolutionNameMin: Cijk_Ailk_Bjlk_HHS_BH_UserArgs_MT64x32x128_MI16x16x1_SN_LDSB1_CLR1_GRVWA8_GRVWB8_GSU0_GSUC0_GSUWGMRR0_K1_LBSPPA512_LBSPPB256_LPA32_LPB16_MIWT2_1_NEPBS16_PLR2_SU32_SUM0_SUS256_SVW2_SKXCCM0_ULSGRO1_VWA2_VWB1_WGM1_WGMXCC1_WGMXCCGn1
    SolutionIndex: 23
    SolutionNameMin: Cijk_Ailk_Bjlk_HHS_BH_UserArgs_MT64x32x128_MI16x16x1_SN_LDSB1_CLR1_GRVWA8_GRVWB8_GSU0_GSUC0_GSUWGMRR0_K1_LBSPPA512_LBSPPB256_LPA32_LPB16_MIWT2_1_NEPBS16_PLR2_SU32_SUM0_SUS256_SVW2_SKXCCM0_ULSGRO0_VWA2_VWB1_WGM8_WGMXCC1_WGMXCCGn1
    SolutionIndex: 24
    SolutionNameMin: Cijk_Ailk_Bjlk_HHS_BH_UserArgs_MT32x32x128_MI16x16x1_SN_LDSB1_CLR1_GRVWA8_GRVWB8_GSU0_GSUC0_GSUWGMRR0_K1_LBSPPA256_LBSPPB256_LPA16_LPB16_MIWT1_1_NEPBS16_PLR1_SU32_SUM0_SUS256_SVW1_SKXCCM0_ULSGRO0_VWA1_VWB1_WGM1_WGMXCC1_WGMXCCGn1
    SolutionIndex: 25
    SolutionNameMin: Cijk_Ailk_Bjlk_HHS_BH_UserArgs_MT32x32x128_MI16x16x1_SN_LDSB1_CLR1_GRVWA8_GRVWB8_GSU0_GSUC0_GSUWGMRR0_K1_LBSPPA256_LBSPPB256_LPA16_LPB16_MIWT1_1_NEPBS16_PLR1_SU32_SUM0_SUS256_SVW1_SKXCCM0_ULSGRO1_VWA1_VWB1_WGM1_WGMXCC1_WGMXCCGn1
    SolutionIndex: 26
    SolutionNameMin: Cijk_Ailk_Bjlk_HHS_BH_UserArgs_MT32x32x128_MI16x16x1_SN_LDSB1_CLR1_GRVWA8_GRVWB8_GSU0_GSUC0_GSUWGMRR0_K1_LBSPPA256_LBSPPB256_LPA16_LPB16_MIWT1_1_NEPBS16_PLR2_SU32_SUM0_SUS256_SVW1_SKXCCM0_ULSGRO0_VWA1_VWB1_WGM1_WGMXCC1_WGMXCCGn1
    SolutionIndex: 27
    SolutionNameMin: Cijk_Ailk_Bjlk_HHS_BH_UserArgs_MT32x32x128_MI16x16x1_SN_LDSB1_CLR1_GRVWA8_GRVWB8_GSU0_GSUC0_GSUWGMRR0_K1_LBSPPA256_LBSPPB256_LPA16_LPB16_MIWT1_1_NEPBS16_PLR2_SU32_SUM0_SUS256_SVW1_SKXCCM0_ULSGRO1_VWA1_VWB1_WGM1_WGMXCC1_WGMXCCGn1
    SolutionIndex: 28
    SolutionNameMin: Cijk_Ailk_Bjlk_HHS_BH_UserArgs_MT32x32x128_MI16x16x1_SN_LDSB1_CLR1_GRVWA8_GRVWB8_GSU0_GSUC0_GSUWGMRR0_K1_LBSPPA256_LBSPPB256_LPA16_LPB16_MIWT1_1_NEPBS16_PLR3_SU32_SUM0_SUS256_SVW1_SKXCCM0_ULSGRO0_VWA1_VWB1_WGM1_WGMXCC1_WGMXCCGn1
    SolutionIndex: 29
    SolutionNameMin: Cijk_Ailk_Bjlk_HHS_BH_UserArgs_MT32x32x128_MI16x16x1_SN_LDSB1_CLR1_GRVWA8_GRVWB8_GSU0_GSUC0_GSUWGMRR0_K1_LBSPPA256_LBSPPB256_LPA16_LPB16_MIWT1_1_NEPBS16_PLR3_SU32_SUM0_SUS256_SVW1_SKXCCM0_ULSGRO1_VWA1_VWB1_WGM1_WGMXCC1_WGMXCCGn1
    SolutionIndex: 30
    SolutionNameMin: Cijk_Ailk_Bjlk_HHS_BH_UserArgs_MT32x32x128_MI16x16x1_SN_LDSB1_CLR1_GRVWA8_GRVWB8_GSU0_GSUC0_GSUWGMRR0_K1_LBSPPA256_LBSPPB256_LPA16_LPB16_MIWT1_1_NEPBS16_PLR1_SU32_SUM0_SUS256_SVW1_SKXCCM0_ULSGRO0_VWA1_VWB1_WGM8_WGMXCC1_WGMXCCGn1
    SolutionIndex: 31
    SolutionNameMin: Cijk_Ailk_Bjlk_HHS_BH_UserArgs_MT128x128x64_MI16x16x1_SN_LDSB1_CLR1_GRVWA8_GRVWB8_GSU0_GSUC0_GSUWGMRR0_K1_LBSPPA1024_LBSPPB1024_LPA0_LPB0_MIWT4_4_NEPBS0_PLR1_SU32_SUM0_SUS256_SVW4_SKXCCM8_ULSGRO0_VWA4_VWB4_WGM4_WGMXCC1_WGMXCCGn1
    SolutionIndex: 32
    SolutionNameMin: Cijk_Ailk_Bjlk_HHS_BH_UserArgs_MT128x128x64_MI16x16x1_SN_LDSB1_CLR1_GRVWA8_GRVWB8_GSU0_GSUC0_GSUWGMRR0_K1_LBSPPA1024_LBSPPB1024_LPA0_LPB0_MIWT4_4_NEPBS0_PLR1_SU32_SUM0_SUS256_SVW4_SKXCCM8_ULSGRO1_VWA4_VWB4_WGM8_WGMXCC1_WGMXCCGn1
    SolutionIndex: 33
    SolutionNameMin: Cijk_Ailk_Bjlk_HHS_BH_UserArgs_MT64x64x64_MI16x16x1_SN_LDSB1_CLR1_GRVWA8_GRVWB8_GSU0_GSUC0_GSUWGMRR0_K1_LBSPPA512_LBSPPB512_LPA32_LPB32_MIWT2_2_NEPBS0_PLR2_SU32_SUM0_SUS256_SVW2_SKXCCM8_ULSGRO0_VWA2_VWB2_WGM1_WGMXCC1_WGMXCCGn1
    SolutionIndex: 34
    SolutionNameMin: Cijk_Ailk_Bjlk_HHS_BH_UserArgs_MT64x64x64_MI16x16x1_SN_LDSB1_CLR1_GRVWA8_GRVWB8_GSU0_GSUC0_GSUWGMRR0_K1_LBSPPA512_LBSPPB512_LPA32_LPB32_MIWT2_2_NEPBS0_PLR2_SU32_SUM0_SUS256_SVW2_SKXCCM8_ULSGRO0_VWA2_VWB2_WGM4_WGMXCC1_WGMXCCGn1
    SolutionIndex: 35
    SolutionNameMin: Cijk_Ailk_Bjlk_HHS_BH_UserArgs_MT32x64x64_MI16x16x1_SN_LDSB0_CLR1_GRVWA8_GRVWB8_GSU0_GSUC0_GSUWGMRR0_K1_LBSPPA256_LBSPPB512_LPA16_LPB32_MIWT1_2_NEPBS0_PLR2_SU32_SUM0_SUS256_SVW1_SKXCCM8_ULSGRO0_VWA1_VWB2_WGM1_WGMXCC1_WGMXCCGn1
    SolutionIndex: 36
    SolutionNameMin: Cijk_Ailk_Bjlk_HHS_BH_UserArgs_MT32x64x64_MI16x16x1_SN_LDSB0_CLR1_GRVWA8_GRVWB8_GSU0_GSUC0_GSUWGMRR0_K1_LBSPPA256_LBSPPB512_LPA16_LPB32_MIWT1_2_NEPBS0_PLR3_SU32_SUM0_SUS256_SVW1_SKXCCM8_ULSGRO0_VWA1_VWB2_WGM1_WGMXCC1_WGMXCCGn1
    SolutionIndex: 37
    SolutionNameMin: Cijk_Ailk_Bjlk_HHS_BH_UserArgs_MT32x64x64_MI16x16x1_SN_LDSB0_CLR1_GRVWA8_GRVWB8_GSU0_GSUC0_GSUWGMRR0_K1_LBSPPA256_LBSPPB512_LPA16_LPB32_MIWT1_2_NEPBS0_PLR2_SU32_SUM0_SUS256_SVW1_SKXCCM8_ULSGRO0_VWA1_VWB2_WGM4_WGMXCC1_WGMXCCGn1
    SolutionIndex: 38
    SolutionNameMin: Cijk_Ailk_Bjlk_HHS_BH_UserArgs_MT64x128x128_MI16x16x1_SN_LDSB1_CLR1_GRVWA8_GRVWB8_GSU0_GSUC0_GSUWGMRR0_K1_LBSPPA512_LBSPPB1024_LPA32_LPB0_MIWT2_4_NEPBS0_PLR2_SU32_SUM0_SUS256_SVW2_SKXCCM8_ULSGRO0_VWA2_VWB4_WGM1_WGMXCC1_WGMXCCGn1
    SolutionIndex: 39
    SolutionNameMin: Cijk_Ailk_Bjlk_HHS_BH_UserArgs_MT128x64x128_MI16x16x1_SN_LDSB1_CLR1_GRVWA8_GRVWB8_GSU0_GSUC0_GSUWGMRR0_K1_LBSPPA1024_LBSPPB512_LPA0_LPB32_MIWT4_2_NEPBS0_PLR2_SU32_SUM0_SUS256_SVW4_SKXCCM8_ULSGRO0_VWA4_VWB2_WGM1_WGMXCC1_WGMXCCGn1
    SolutionIndex: 40
    SolutionNameMin: Cijk_Ailk_Bjlk_HHS_BH_UserArgs_MT128x64x128_MI16x16x1_SN_LDSB1_CLR1_GRVWA8_GRVWB8_GSU0_GSUC0_GSUWGMRR0_K1_LBSPPA1024_LBSPPB512_LPA0_LPB32_MIWT4_2_NEPBS0_PLR2_SU32_SUM0_SUS256_SVW4_SKXCCM8_ULSGRO1_VWA4_VWB2_WGM1_WGMXCC1_WGMXCCGn1
    SolutionIndex: 41
    SolutionNameMin: Cijk_Ailk_Bjlk_HHS_BH_UserArgs_MT64x64x128_MI16x16x1_SN_LDSB1_CLR1_GRVWA8_GRVWB8_GSU0_GSUC0_GSUWGMRR0_K1_LBSPPA512_LBSPPB512_LPA32_LPB32_MIWT2_2_NEPBS0_PLR2_SU32_SUM0_SUS256_SVW2_SKXCCM8_ULSGRO0_VWA2_VWB2_WGM1_WGMXCC1_WGMXCCGn1
    SolutionIndex: 42
    SolutionNameMin: Cijk_Ailk_Bjlk_HHS_BH_UserArgs_MT64x64x128_MI16x16x1_SN_LDSB1_CLR1_GRVWA8_GRVWB8_GSU0_GSUC0_GSUWGMRR0_K1_LBSPPA512_LBSPPB512_LPA32_LPB32_MIWT2_2_NEPBS0_PLR3_SU32_SUM0_SUS256_SVW2_SKXCCM8_ULSGRO1_VWA2_VWB2_WGM1_WGMXCC1_WGMXCCGn1
    SolutionIndex: 43
    SolutionNameMin: Cijk_Ailk_Bjlk_HHS_BH_UserArgs_MT32x64x128_MI16x16x1_SN_LDSB1_CLR1_GRVWA8_GRVWB8_GSU0_GSUC0_GSUWGMRR0_K1_LBSPPA256_LBSPPB512_LPA16_LPB32_MIWT1_2_NEPBS0_PLR2_SU32_SUM0_SUS256_SVW1_SKXCCM8_ULSGRO0_VWA1_VWB2_WGM1_WGMXCC1_WGMXCCGn1
    SolutionIndex: 44
    SolutionNameMin: Cijk_Ailk_Bjlk_HHS_BH_UserArgs_MT64x32x128_MI16x16x1_SN_LDSB1_CLR1_GRVWA8_GRVWB8_GSU0_GSUC0_GSUWGMRR0_K1_LBSPPA512_LBSPPB256_LPA32_LPB16_MIWT2_1_NEPBS0_PLR2_SU32_SUM0_SUS256_SVW2_SKXCCM8_ULSGRO0_VWA2_VWB1_WGM1_WGMXCC1_WGMXCCGn1
    SolutionIndex: 45
    SolutionNameMin: Cijk_Ailk_Bjlk_HHS_BH_UserArgs_MT64x32x128_MI16x16x1_SN_LDSB1_CLR1_GRVWA8_GRVWB8_GSU0_GSUC0_GSUWGMRR0_K1_LBSPPA512_LBSPPB256_LPA32_LPB16_MIWT2_1_NEPBS0_PLR3_SU32_SUM0_SUS256_SVW2_SKXCCM8_ULSGRO0_VWA2_VWB1_WGM1_WGMXCC1_WGMXCCGn1
    SolutionIndex: 46
    SolutionNameMin: Cijk_Ailk_Bjlk_HHS_BH_UserArgs_MT32x32x128_MI16x16x1_SN_LDSB1_CLR1_GRVWA8_GRVWB8_GSU0_GSUC0_GSUWGMRR0_K1_LBSPPA256_LBSPPB256_LPA16_LPB16_MIWT1_1_NEPBS0_PLR1_SU32_SUM0_SUS256_SVW1_SKXCCM8_ULSGRO0_VWA1_VWB1_WGM1_WGMXCC1_WGMXCCGn1
    SolutionIndex: 47
    SolutionNameMin: Cijk_Ailk_Bjlk_HHS_BH_UserArgs_MT32x32x128_MI16x16x1_SN_LDSB1_CLR1_GRVWA8_GRVWB8_GSU0_GSUC0_GSUWGMRR0_K1_LBSPPA256_LBSPPB256_LPA16_LPB16_MIWT1_1_NEPBS0_PLR1_SU32_SUM0_SUS256_SVW1_SKXCCM8_ULSGRO1_VWA1_VWB1_WGM1_WGMXCC1_WGMXCCGn1
    SolutionIndex: 48
    SolutionNameMin: Cijk_Ailk_Bjlk_HHS_BH_UserArgs_MT32x32x128_MI16x16x1_SN_LDSB1_CLR1_GRVWA8_GRVWB8_GSU0_GSUC0_GSUWGMRR0_K1_LBSPPA256_LBSPPB256_LPA16_LPB16_MIWT1_1_NEPBS0_PLR2_SU32_SUM0_SUS256_SVW1_SKXCCM8_ULSGRO0_VWA1_VWB1_WGM1_WGMXCC1_WGMXCCGn1
    SolutionIndex: 49
    SolutionNameMin: Cijk_Ailk_Bjlk_HHS_BH_UserArgs_MT32x32x128_MI16x16x1_SN_LDSB1_CLR1_GRVWA8_GRVWB8_GSU0_GSUC0_GSUWGMRR0_K1_LBSPPA256_LBSPPB256_LPA16_LPB16_MIWT1_1_NEPBS0_PLR2_SU32_SUM0_SUS256_SVW1_SKXCCM8_ULSGRO1_VWA1_VWB1_WGM1_WGMXCC1_WGMXCCGn1
    SolutionIndex: 50
    SolutionNameMin: Cijk_Ailk_Bjlk_HHS_BH_UserArgs_MT32x32x128_MI16x16x1_SN_LDSB1_CLR1_GRVWA8_GRVWB8_GSU0_GSUC0_GSUWGMRR0_K1_LBSPPA256_LBSPPB256_LPA16_LPB16_MIWT1_1_NEPBS0_PLR3_SU32_SUM0_SUS256_SVW1_SKXCCM8_ULSGRO0_VWA1_VWB1_WGM1_WGMXCC1_WGMXCCGn1
    SolutionIndex: 51
    SolutionNameMin: Cijk_Ailk_Bjlk_HHS_BH_UserArgs_MT32x32x128_MI16x16x1_SN_LDSB1_CLR1_GRVWA8_GRVWB8_GSU0_GSUC0_GSUWGMRR0_K1_LBSPPA256_LBSPPB256_LPA16_LPB16_MIWT1_1_NEPBS0_PLR2_SU32_SUM0_SUS256_SVW1_SKXCCM8_ULSGRO0_VWA1_VWB1_WGM4_WGMXCC1_WGMXCCGn1
    SolutionIndex: 52
    SolutionNameMin: Cijk_Ailk_Bjlk_HHS_BH_UserArgs_MT128x128x64_MI16x16x1_SN_LDSB1_CLR1_GRVWA8_GRVWB8_GSU0_GSUC0_GSUWGMRR0_K1_LBSPPA1024_LBSPPB1024_LPA0_LPB0_MIWT4_4_NEPBS16_PLR1_SU32_SUM0_SUS256_SVW4_SKXCCM8_ULSGRO0_VWA4_VWB4_WGM4_WGMXCC1_WGMXCCGn1
    SolutionIndex: 53
    SolutionNameMin: Cijk_Ailk_Bjlk_HHS_BH_UserArgs_MT128x64x64_MI16x16x1_SN_LDSB1_CLR1_GRVWA8_GRVWB8_GSU0_GSUC0_GSUWGMRR0_K1_LBSPPA1024_LBSPPB512_LPA0_LPB32_MIWT4_2_NEPBS16_PLR1_SU32_SUM0_SUS256_SVW4_SKXCCM8_ULSGRO1_VWA4_VWB2_WGM1_WGMXCC1_WGMXCCGn1
    SolutionIndex: 54
    SolutionNameMin: Cijk_Ailk_Bjlk_HHS_BH_UserArgs_MT128x64x64_MI16x16x1_SN_LDSB1_CLR1_GRVWA8_GRVWB8_GSU0_GSUC0_GSUWGMRR0_K1_LBSPPA1024_LBSPPB512_LPA0_LPB32_MIWT4_2_NEPBS16_PLR2_SU32_SUM0_SUS256_SVW4_SKXCCM8_ULSGRO0_VWA4_VWB2_WGM1_WGMXCC1_WGMXCCGn1
    SolutionIndex: 55
    SolutionNameMin: Cijk_Ailk_Bjlk_HHS_BH_UserArgs_MT128x64x64_MI16x16x1_SN_LDSB1_CLR1_GRVWA8_GRVWB8_GSU0_GSUC0_GSUWGMRR0_K1_LBSPPA1024_LBSPPB512_LPA0_LPB32_MIWT4_2_NEPBS16_PLR2_SU32_SUM0_SUS256_SVW4_SKXCCM8_ULSGRO1_VWA4_VWB2_WGM8_WGMXCC1_WGMXCCGn1
    SolutionIndex: 56
    SolutionNameMin: Cijk_Ailk_Bjlk_HHS_BH_UserArgs_MT64x64x64_MI16x16x1_SN_LDSB1_CLR1_GRVWA8_GRVWB8_GSU0_GSUC0_GSUWGMRR0_K1_LBSPPA512_LBSPPB512_LPA32_LPB32_MIWT2_2_NEPBS16_PLR1_SU32_SUM0_SUS256_SVW2_SKXCCM8_ULSGRO0_VWA2_VWB2_WGM1_WGMXCC1_WGMXCCGn1
    SolutionIndex: 57
    SolutionNameMin: Cijk_Ailk_Bjlk_HHS_BH_UserArgs_MT64x64x64_MI16x16x1_SN_LDSB1_CLR1_GRVWA8_GRVWB8_GSU0_GSUC0_GSUWGMRR0_K1_LBSPPA512_LBSPPB512_LPA32_LPB32_MIWT2_2_NEPBS16_PLR2_SU32_SUM0_SUS256_SVW2_SKXCCM8_ULSGRO1_VWA2_VWB2_WGM4_WGMXCC1_WGMXCCGn1
    SolutionIndex: 58
    SolutionNameMin: Cijk_Ailk_Bjlk_HHS_BH_UserArgs_MT32x64x64_MI16x16x1_SN_LDSB0_CLR1_GRVWA8_GRVWB8_GSU0_GSUC0_GSUWGMRR0_K1_LBSPPA256_LBSPPB512_LPA16_LPB32_MIWT1_2_NEPBS16_PLR2_SU32_SUM0_SUS256_SVW1_SKXCCM8_ULSGRO0_VWA1_VWB2_WGM1_WGMXCC1_WGMXCCGn1
    SolutionIndex: 59
    SolutionNameMin: Cijk_Ailk_Bjlk_HHS_BH_UserArgs_MT32x64x64_MI16x16x1_SN_LDSB0_CLR1_GRVWA8_GRVWB8_GSU0_GSUC0_GSUWGMRR0_K1_LBSPPA256_LBSPPB512_LPA16_LPB32_MIWT1_2_NEPBS16_PLR2_SU32_SUM0_SUS256_SVW1_SKXCCM8_ULSGRO0_VWA1_VWB2_WGM4_WGMXCC1_WGMXCCGn1
    SolutionIndex: 60
    SolutionNameMin: Cijk_Ailk_Bjlk_HHS_BH_UserArgs_MT128x64x128_MI16x16x1_SN_LDSB1_CLR1_GRVWA8_GRVWB8_GSU0_GSUC0_GSUWGMRR0_K1_LBSPPA1024_LBSPPB512_LPA0_LPB32_MIWT4_2_NEPBS16_PLR2_SU32_SUM0_SUS256_SVW4_SKXCCM8_ULSGRO1_VWA4_VWB2_WGM1_WGMXCC1_WGMXCCGn1
    SolutionIndex: 61
    SolutionNameMin: Cijk_Ailk_Bjlk_HHS_BH_UserArgs_MT64x64x128_MI16x16x1_SN_LDSB1_CLR1_GRVWA8_GRVWB8_GSU0_GSUC0_GSUWGMRR0_K1_LBSPPA512_LBSPPB512_LPA32_LPB32_MIWT2_2_NEPBS16_PLR1_SU32_SUM0_SUS256_SVW2_SKXCCM8_ULSGRO1_VWA2_VWB2_WGM1_WGMXCC1_WGMXCCGn1
    SolutionIndex: 62
    SolutionNameMin: Cijk_Ailk_Bjlk_HHS_BH_UserArgs_MT64x64x128_MI16x16x1_SN_LDSB1_CLR1_GRVWA8_GRVWB8_GSU0_GSUC0_GSUWGMRR0_K1_LBSPPA512_LBSPPB512_LPA32_LPB32_MIWT2_2_NEPBS16_PLR2_SU32_SUM0_SUS256_SVW2_SKXCCM8_ULSGRO0_VWA2_VWB2_WGM1_WGMXCC1_WGMXCCGn1
    SolutionIndex: 63
    SolutionNameMin: Cijk_Ailk_Bjlk_HHS_BH_UserArgs_MT64x64x128_MI16x16x1_SN_LDSB1_CLR1_GRVWA8_GRVWB8_GSU0_GSUC0_GSUWGMRR0_K1_LBSPPA512_LBSPPB512_LPA32_LPB32_MIWT2_2_NEPBS16_PLR3_SU32_SUM0_SUS256_SVW2_SKXCCM8_ULSGRO0_VWA2_VWB2_WGM1_WGMXCC1_WGMXCCGn1
    SolutionIndex: 64
    SolutionNameMin: Cijk_Ailk_Bjlk_HHS_BH_UserArgs_MT32x64x128_MI16x16x1_SN_LDSB1_CLR1_GRVWA8_GRVWB8_GSU0_GSUC0_GSUWGMRR0_K1_LBSPPA256_LBSPPB512_LPA16_LPB32_MIWT1_2_NEPBS16_PLR2_SU32_SUM0_SUS256_SVW1_SKXCCM8_ULSGRO0_VWA1_VWB2_WGM1_WGMXCC1_WGMXCCGn1
    SolutionIndex: 65
    SolutionNameMin: Cijk_Ailk_Bjlk_HHS_BH_UserArgs_MT32x64x128_MI16x16x1_SN_LDSB1_CLR1_GRVWA8_GRVWB8_GSU0_GSUC0_GSUWGMRR0_K1_LBSPPA256_LBSPPB512_LPA16_LPB32_MIWT1_2_NEPBS16_PLR2_SU32_SUM0_SUS256_SVW1_SKXCCM8_ULSGRO1_VWA1_VWB2_WGM1_WGMXCC1_WGMXCCGn1
    SolutionIndex: 66
    SolutionNameMin: Cijk_Ailk_Bjlk_HHS_BH_UserArgs_MT64x32x128_MI16x16x1_SN_LDSB1_CLR1_GRVWA8_GRVWB8_GSU0_GSUC0_GSUWGMRR0_K1_LBSPPA512_LBSPPB256_LPA32_LPB16_MIWT2_1_NEPBS16_PLR2_SU32_SUM0_SUS256_SVW2_SKXCCM8_ULSGRO0_VWA2_VWB1_WGM1_WGMXCC1_WGMXCCGn1
    SolutionIndex: 67
    SolutionNameMin: Cijk_Ailk_Bjlk_HHS_BH_UserArgs_MT64x32x128_MI16x16x1_SN_LDSB1_CLR1_GRVWA8_GRVWB8_GSU0_GSUC0_GSUWGMRR0_K1_LBSPPA512_LBSPPB256_LPA32_LPB16_MIWT2_1_NEPBS16_PLR2_SU32_SUM0_SUS256_SVW2_SKXCCM8_ULSGRO1_VWA2_VWB1_WGM1_WGMXCC1_WGMXCCGn1
    SolutionIndex: 68
    SolutionNameMin: Cijk_Ailk_Bjlk_HHS_BH_UserArgs_MT32x32x128_MI16x16x1_SN_LDSB1_CLR1_GRVWA8_GRVWB8_GSU0_GSUC0_GSUWGMRR0_K1_LBSPPA256_LBSPPB256_LPA16_LPB16_MIWT1_1_NEPBS16_PLR1_SU32_SUM0_SUS256_SVW1_SKXCCM8_ULSGRO0_VWA1_VWB1_WGM1_WGMXCC1_WGMXCCGn1
    SolutionIndex: 69
    SolutionNameMin: Cijk_Ailk_Bjlk_HHS_BH_UserArgs_MT32x32x128_MI16x16x1_SN_LDSB1_CLR1_GRVWA8_GRVWB8_GSU0_GSUC0_GSUWGMRR0_K1_LBSPPA256_LBSPPB256_LPA16_LPB16_MIWT1_1_NEPBS16_PLR1_SU32_SUM0_SUS256_SVW1_SKXCCM8_ULSGRO1_VWA1_VWB1_WGM1_WGMXCC1_WGMXCCGn1
    SolutionIndex: 70
    SolutionNameMin: Cijk_Ailk_Bjlk_HHS_BH_UserArgs_MT32x32x128_MI16x16x1_SN_LDSB1_CLR1_GRVWA8_GRVWB8_GSU0_GSUC0_GSUWGMRR0_K1_LBSPPA256_LBSPPB256_LPA16_LPB16_MIWT1_1_NEPBS16_PLR2_SU32_SUM0_SUS256_SVW1_SKXCCM8_ULSGRO0_VWA1_VWB1_WGM1_WGMXCC1_WGMXCCGn1
    SolutionIndex: 71
    SolutionNameMin: Cijk_Ailk_Bjlk_HHS_BH_UserArgs_MT32x32x128_MI16x16x1_SN_LDSB1_CLR1_GRVWA8_GRVWB8_GSU0_GSUC0_GSUWGMRR0_K1_LBSPPA256_LBSPPB256_LPA16_LPB16_MIWT1_1_NEPBS16_PLR2_SU32_SUM0_SUS256_SVW1_SKXCCM8_ULSGRO1_VWA1_VWB1_WGM1_WGMXCC1_WGMXCCGn1
    SolutionIndex: 72
    SolutionNameMin: Cijk_Ailk_Bjlk_HHS_BH_UserArgs_MT32x32x128_MI16x16x1_SN_LDSB1_CLR1_GRVWA8_GRVWB8_GSU0_GSUC0_GSUWGMRR0_K1_LBSPPA256_LBSPPB256_LPA16_LPB16_MIWT1_1_NEPBS16_PLR3_SU32_SUM0_SUS256_SVW1_SKXCCM8_ULSGRO0_VWA1_VWB1_WGM1_WGMXCC1_WGMXCCGn1
    SolutionIndex: 73
    SolutionNameMin: Cijk_Ailk_Bjlk_HHS_BH_UserArgs_MT32x32x128_MI16x16x1_SN_LDSB1_CLR1_GRVWA8_GRVWB8_GSU0_GSUC0_GSUWGMRR0_K1_LBSPPA256_LBSPPB256_LPA16_LPB16_MIWT1_1_NEPBS16_PLR3_SU32_SUM0_SUS256_SVW1_SKXCCM8_ULSGRO1_VWA1_VWB1_WGM1_WGMXCC1_WGMXCCGn1
    SolutionIndex: 74
    SolutionNameMin: Cijk_Ailk_Bjlk_HHS_BH_UserArgs_MT32x32x64_MI16x16x1_SN_LDSB0_CLR1_GRVWA8_GRVWB8_GSU0_GSUC0_GSUWGMRR0_K1_LBSPPA256_LBSPPB256_LPA16_LPB16_MIWT1_1_NEPBS0_PLR3_SU32_SUM0_SUS256_SVW1_SKXCCM8_ULSGRO0_VWA1_VWB1_WGM1_WGMXCC1_WGMXCCGn1
    SolutionIndex: 75
    SolutionNameMin: Cijk_Ailk_Bjlk_HHS_BH_UserArgs_MT32x32x128_MI16x16x1_SN_LDSB1_CLR1_GRVWA8_GRVWB8_GSU0_GSUC0_GSUWGMRR0_K1_LBSPPA256_LBSPPB256_LPA16_LPB16_MIWT1_1_NEPBS0_PLR1_SU32_SUM0_SUS256_SVW1_SKXCCM8_ULSGRO0_VWA1_VWB1_WGM8_WGMXCC1_WGMXCCGn1
    SolutionIndex: 76
    SolutionNameMin: Cijk_Ailk_Bjlk_HHS_BH_UserArgs_MT32x64x64_MI16x16x1_SN_LDSB0_CLR1_GRVWA8_GRVWB8_GSU0_GSUC0_GSUWGMRR0_K1_LBSPPA256_LBSPPB512_LPA16_LPB32_MIWT1_2_NEPBS16_PLR2_SU32_SUM0_SUS256_SVW1_SKXCCM8_ULSGRO0_VWA1_VWB2_WGM8_WGMXCC1_WGMXCCGn1
    SolutionIndex: 77
    SolutionNameMin: Cijk_Ailk_Bjlk_HHS_BH_UserArgs_MT64x32x128_MI16x16x1_SN_LDSB1_CLR1_GRVWA8_GRVWB8_GSU0_GSUC0_GSUWGMRR0_K1_LBSPPA512_LBSPPB256_LPA32_LPB16_MIWT2_1_NEPBS16_PLR3_SU32_SUM0_SUS256_SVW2_SKXCCM8_ULSGRO0_VWA2_VWB1_WGM1_WGMXCC1_WGMXCCGn1
    SolutionIndex: 78
    SolutionNameMin: Cijk_Ailk_Bjlk_HHS_BH_UserArgs_MT64x32x64_MI16x16x1_SN_LDSB0_CLR1_GRVWA8_GRVWB8_GSU0_GSUC0_GSUWGMRR0_K1_LBSPPA512_LBSPPB256_LPA32_LPB16_MIWT2_1_NEPBS0_PLR3_SU32_SUM0_SUS256_SVW2_SKXCCM8_ULSGRO1_VWA2_VWB1_WGM8_WGMXCC1_WGMXCCGn1
    SolutionIndex: 79
    SolutionNameMin: Cijk_Ailk_Bjlk_HHS_BH_UserArgs_MT64x64x64_MI16x16x1_SN_LDSB1_CLR1_GRVWA8_GRVWB8_GSU0_GSUC0_GSUWGMRR0_K1_LBSPPA512_LBSPPB512_LPA32_LPB32_MIWT2_2_NEPBS0_PLR2_SU32_SUM0_SUS256_SVW2_SKXCCM8_ULSGRO1_VWA2_VWB2_WGM1_WGMXCC1_WGMXCCGn1
    SolutionIndex: 80
    SolutionNameMin: Cijk_Ailk_Bjlk_HHS_BH_UserArgs_MT64x64x64_MI16x16x1_SN_LDSB1_CLR1_GRVWA8_GRVWB8_GSU0_GSUC0_GSUWGMRR0_K1_LBSPPA512_LBSPPB512_LPA32_LPB32_MIWT2_2_NEPBS0_PLR1_SU32_SUM0_SUS256_SVW2_SKXCCM8_ULSGRO1_VWA2_VWB2_WGM1_WGMXCC1_WGMXCCGn1
    SolutionIndex: 81
    SolutionNameMin: Cijk_Ailk_Bjlk_HHS_BH_UserArgs_MT64x64x64_MI16x16x1_SN_LDSB1_CLR1_GRVWA8_GRVWB8_GSU0_GSUC0_GSUWGMRR0_K1_LBSPPA512_LBSPPB512_LPA32_LPB32_MIWT2_2_NEPBS16_PLR3_SU32_SUM0_SUS256_SVW2_SKXCCM8_ULSGRO1_VWA2_VWB2_WGM1_WGMXCC1_WGMXCCGn1
    SolutionIndex: 82
    SolutionNameMin: Cijk_Ailk_Bjlk_HHS_BH_UserArgs_MT64x32x128_MI16x16x1_SN_LDSB1_CLR1_GRVWA8_GRVWB8_GSU0_GSUC0_GSUWGMRR0_K1_LBSPPA512_LBSPPB256_LPA32_LPB16_MIWT2_1_NEPBS16_PLR2_SU32_SUM0_SUS256_SVW2_SKXCCM0_ULSGRO0_VWA2_VWB1_WGM1_WGMXCC1_WGMXCCGn1
    SolutionIndex: 83
    SolutionNameMin: Cijk_Ailk_Bjlk_HHS_BH_UserArgs_MT64x32x128_MI16x16x1_SN_LDSB1_CLR1_GRVWA8_GRVWB8_GSU0_GSUC0_GSUWGMRR0_K1_LBSPPA512_LBSPPB256_LPA32_LPB16_MIWT2_1_NEPBS0_PLR2_SU32_SUM0_SUS256_SVW2_SKXCCM0_ULSGRO0_VWA2_VWB1_WGM1_WGMXCC1_WGMXCCGn1
    SolutionIndex: 84
    SolutionNameMin: Cijk_Ailk_Bjlk_HHS_BH_UserArgs_MT64x64x64_MI16x16x1_SN_LDSB1_CLR1_GRVWA8_GRVWB8_GSU0_GSUC0_GSUWGMRR0_K1_LBSPPA512_LBSPPB512_LPA32_LPB32_MIWT2_2_NEPBS16_PLR2_SU32_SUM0_SUS256_SVW2_SKXCCM8_ULSGRO0_VWA2_VWB2_WGM1_WGMXCC1_WGMXCCGn1
    SolutionIndex: 85
    SolutionNameMin: Cijk_Ailk_Bjlk_HHS_BH_UserArgs_MT128x64x32_MI16x16x1_SN_LDSB0_CLR1_GRVWA8_GRVWB8_GSU0_GSUC0_GSUWGMRR0_K1_LBSPPA1024_LBSPPB512_LPA0_LPB32_MIWT4_2_NEPBS0_PLR1_SU32_SUM0_SUS256_SVW4_SKXCCM8_ULSGRO0_VWA4_VWB2_WGM4_WGMXCC1_WGMXCCGn1
    SolutionIndex: 86
    SolutionNameMin: Cijk_Ailk_Bjlk_HHS_BH_UserArgs_MT128x64x64_MI16x16x1_SN_LDSB1_CLR1_GRVWA8_GRVWB8_GSU0_GSUC0_GSUWGMRR0_K1_LBSPPA1024_LBSPPB512_LPA0_LPB32_MIWT4_2_NEPBS0_PLR2_SU32_SUM0_SUS256_SVW4_SKXCCM8_ULSGRO1_VWA4_VWB2_WGM1_WGMXCC1_WGMXCCGn1
    SolutionIndex: 87
    SolutionNameMin: Cijk_Ailk_Bjlk_HHS_BH_UserArgs_MT64x64x128_MI16x16x1_SN_LDSB1_CLR1_GRVWA8_GRVWB8_GSU0_GSUC0_GSUWGMRR0_K1_LBSPPA512_LBSPPB512_LPA32_LPB32_MIWT2_2_NEPBS0_PLR2_SU32_SUM0_SUS256_SVW2_SKXCCM0_ULSGRO0_VWA2_VWB2_WGM1_WGMXCC1_WGMXCCGn1
    SolutionIndex: 88
    SolutionNameMin: Cijk_Ailk_Bjlk_HHS_BH_UserArgs_MT64x64x128_MI16x16x1_SN_LDSB1_CLR1_GRVWA8_GRVWB8_GSU0_GSUC0_GSUWGMRR0_K1_LBSPPA512_LBSPPB512_LPA32_LPB32_MIWT2_2_NEPBS0_PLR1_SU32_SUM0_SUS256_SVW2_SKXCCM8_ULSGRO0_VWA2_VWB2_WGM1_WGMXCC1_WGMXCCGn1
    SolutionIndex: 89
    SolutionNameMin: Cijk_Ailk_Bjlk_HHS_BH_UserArgs_MT128x128x32_MI16x16x1_SN_LDSB0_CLR1_GRVWA8_GRVWB8_GSU0_GSUC0_GSUWGMRR0_K1_LBSPPA1024_LBSPPB1024_LPA0_LPB0_MIWT4_4_NEPBS0_PLR1_SU32_SUM0_SUS256_SVW4_SKXCCM8_ULSGRO1_VWA4_VWB4_WGM4_WGMXCC1_WGMXCCGn1
    SolutionIndex: 90
    SolutionNameMin: Cijk_Ailk_Bjlk_HHS_BH_UserArgs_MT128x128x64_MI16x16x1_SN_LDSB1_CLR1_GRVWA8_GRVWB8_GSU0_GSUC0_GSUWGMRR0_K1_LBSPPA1024_LBSPPB1024_LPA0_LPB0_MIWT4_4_NEPBS0_PLR1_SU32_SUM0_SUS256_SVW4_SKXCCM8_ULSGRO1_VWA4_VWB4_WGM1_WGMXCC1_WGMXCCGn1
    SolutionIndex: 91
    SolutionNameMin: Cijk_Ailk_Bjlk_HHS_BH_UserArgs_MT64x128x128_MI16x16x1_SN_LDSB1_CLR1_GRVWA8_GRVWB8_GSU0_GSUC0_GSUWGMRR0_K1_LBSPPA512_LBSPPB1024_LPA32_LPB0_MIWT2_4_NEPBS16_PLR2_SU32_SUM0_SUS256_SVW2_SKXCCM8_ULSGRO0_VWA2_VWB4_WGM1_WGMXCC1_WGMXCCGn1
    SolutionIndex: 92
    SolutionNameMin: Cijk_Ailk_Bjlk_HHS_BH_UserArgs_MT128x64x128_MI16x16x1_SN_LDSB1_CLR1_GRVWA8_GRVWB8_GSU0_GSUC0_GSUWGMRR0_K1_LBSPPA1024_LBSPPB512_LPA0_LPB32_MIWT4_2_NEPBS0_PLR1_SU32_SUM0_SUS256_SVW4_SKXCCM0_ULSGRO0_VWA4_VWB2_WGM8_WGMXCC1_WGMXCCGn1
    SolutionIndex: 93
    SolutionNameMin: Cijk_Ailk_Bjlk_HHS_BH_UserArgs_MT128x64x128_MI16x16x1_SN_LDSB1_CLR1_GRVWA8_GRVWB8_GSU0_GSUC0_GSUWGMRR0_K1_LBSPPA1024_LBSPPB512_LPA0_LPB32_MIWT4_2_NEPBS0_PLR3_SU32_SUM0_SUS256_SVW4_SKXCCM8_ULSGRO0_VWA4_VWB2_WGM1_WGMXCC1_WGMXCCGn1
    SolutionIndex: 94
    SolutionNameMin: Cijk_Ailk_Bjlk_HHS_BH_UserArgs_MT128x128x64_MI16x16x1_SN_LDSB1_CLR1_GRVWA8_GRVWB8_GSU0_GSUC0_GSUWGMRR0_K1_LBSPPA1024_LBSPPB1024_LPA0_LPB0_MIWT4_4_NEPBS0_PLR1_SU32_SUM0_SUS256_SVW4_SKXCCM8_ULSGRO0_VWA4_VWB4_WGM8_WGMXCC1_WGMXCCGn1
    SolutionIndex: 95
    SolutionNameMin: Cijk_Ailk_Bjlk_HHS_BH_UserArgs_MT128x256x64_MI16x16x1_SN_LDSB1_CLR1_GRVWA8_GRVWB8_GSU0_GSUC0_GSUWGMRR0_K1_LBSPPA1024_LBSPPB2048_LPA0_LPB0_MIWT4_8_NEPBS16_PLR2_SU32_SUM0_SUS256_SVW4_SKXCCM8_ULSGRO0_VWA4_VWB8_WGM4_WGMXCC1_WGMXCCGn1
    SolutionIndex: 96
    SolutionNameMin: Cijk_Ailk_Bjlk_HHS_BH_UserArgs_MT128x128x128_MI16x16x1_SN_LDSB1_CLR1_GRVWA8_GRVWB8_GSU0_GSUC0_GSUWGMRR0_K1_LBSPPA1024_LBSPPB1024_LPA0_LPB0_MIWT4_4_NEPBS16_PLR1_SU32_SUM0_SUS256_SVW4_SKXCCM0_ULSGRO0_VWA4_VWB4_WGM8_WGMXCC1_WGMXCCGn1
    SolutionIndex: 97
    SolutionNameMin: Cijk_Ailk_Bjlk_HHS_BH_UserArgs_MT128x128x128_MI16x16x1_SN_LDSB1_CLR1_GRVWA8_GRVWB8_GSU0_GSUC0_GSUWGMRR0_K1_LBSPPA1024_LBSPPB1024_LPA0_LPB0_MIWT4_4_NEPBS0_PLR1_SU32_SUM0_SUS256_SVW4_SKXCCM8_ULSGRO1_VWA4_VWB4_WGM1_WGMXCC1_WGMXCCGn1
    SolutionIndex: 98
    SolutionNameMin: Cijk_Ailk_Bjlk_HHS_BH_UserArgs_MT128x128x64_MI16x16x1_SN_LDSB1_CLR1_GRVWA8_GRVWB8_GSU0_GSUC0_GSUWGMRR0_K1_LBSPPA1024_LBSPPB1024_LPA0_LPB0_MIWT4_4_NEPBS16_PLR1_SU32_SUM0_SUS256_SVW4_SKXCCM8_ULSGRO1_VWA4_VWB4_WGM1_WGMXCC1_WGMXCCGn1
    SolutionIndex: 99
    SolutionNameMin: Cijk_Ailk_Bjlk_HHS_BH_UserArgs_MT128x256x64_MI16x16x1_SN_LDSB1_CLR1_GRVWA8_GRVWB8_GSU0_GSUC0_GSUWGMRR0_K1_LBSPPA1024_LBSPPB2048_LPA0_LPB0_MIWT4_8_NEPBS0_PLR3_SU32_SUM0_SUS256_SVW4_SKXCCM8_ULSGRO1_VWA4_VWB8_WGM4_WGMXCC1_WGMXCCGn1
    SolutionIndex: 100
    SolutionNameMin: Cijk_Ailk_Bjlk_HHS_BH_UserArgs_MT256x128x64_MI16x16x1_SN_LDSB1_CLR1_GRVWA8_GRVWB8_GSU0_GSUC0_GSUWGMRR0_K1_LBSPPA2048_LBSPPB1024_LPA0_LPB32_MIWT8_4_NEPBS0_PLR2_SU32_SUM0_SUS256_SVW4_SKXCCM0_ULSGRO0_VWA4_VWB2_WGM1_WGMXCC1_WGMXCCGn1
    SolutionIndex: 101
    SolutionNameMin: Cijk_Ailk_Bjlk_HHS_BH_UserArgs_MT32x64x64_MI16x16x1_SN_LDSB0_CLR1_GRVWA8_GRVWB8_GSU0_GSUC0_GSUWGMRR0_K1_LBSPPA256_LBSPPB512_LPA16_LPB32_MIWT1_2_NEPBS0_PLR3_SU32_SUM0_SUS256_SVW1_SKXCCM0_ULSGRO1_VWA1_VWB2_WGM1_WGMXCC1_WGMXCCGn1
    SolutionIndex: 102
    SolutionNameMin: Cijk_Ailk_Bjlk_HHS_BH_UserArgs_MT32x64x64_MI16x16x1_SN_LDSB0_CLR1_GRVWA8_GRVWB8_GSU0_GSUC0_GSUWGMRR0_K1_LBSPPA256_LBSPPB512_LPA16_LPB32_MIWT1_2_NEPBS0_PLR2_SU32_SUM0_SUS256_SVW1_SKXCCM8_ULSGRO1_VWA1_VWB2_WGM1_WGMXCC1_WGMXCCGn1
    SolutionIndex: 103
    SolutionNameMin: Cijk_Ailk_Bjlk_HHS_BH_UserArgs_MT64x64x64_MI16x16x1_SN_LDSB1_CLR1_GRVWA8_GRVWB8_GSU0_GSUC0_GSUWGMRR0_K1_LBSPPA512_LBSPPB512_LPA32_LPB32_MIWT2_2_NEPBS0_PLR3_SU32_SUM0_SUS256_SVW2_SKXCCM8_ULSGRO1_VWA2_VWB2_WGM8_WGMXCC1_WGMXCCGn1
    SolutionIndex: 104
    SolutionNameMin: Cijk_Ailk_Bjlk_HHS_BH_UserArgs_MT64x32x128_MI16x16x1_SN_LDSB1_CLR1_GRVWA8_GRVWB8_GSU0_GSUC0_GSUWGMRR0_K1_LBSPPA512_LBSPPB256_LPA32_LPB16_MIWT2_1_NEPBS0_PLR2_SU32_SUM0_SUS256_SVW2_SKXCCM8_ULSGRO1_VWA2_VWB1_WGM1_WGMXCC1_WGMXCCGn1
    SolutionIndex: 105
    SolutionNameMin: Cijk_Ailk_Bjlk_HHS_BH_UserArgs_MT64x64x64_MI16x16x1_SN_LDSB1_CLR1_GRVWA8_GRVWB8_GSU0_GSUC0_GSUWGMRR0_K1_LBSPPA512_LBSPPB512_LPA32_LPB32_MIWT2_2_NEPBS16_PLR3_SU32_SUM0_SUS256_SVW2_SKXCCM8_ULSGRO0_VWA2_VWB2_WGM8_WGMXCC1_WGMXCCGn1
    SolutionIndex: 106
    SolutionNameMin: Cijk_Ailk_Bjlk_HHS_BH_UserArgs_MT64x64x128_MI16x16x1_SN_LDSB1_CLR1_GRVWA8_GRVWB8_GSU0_GSUC0_GSUWGMRR0_K1_LBSPPA512_LBSPPB512_LPA32_LPB32_MIWT2_2_NEPBS0_PLR2_SU32_SUM0_SUS256_SVW2_SKXCCM0_ULSGRO1_VWA2_VWB2_WGM1_WGMXCC1_WGMXCCGn1
    SolutionIndex: 107
    SolutionNameMin: Cijk_Ailk_Bjlk_HHS_BH_UserArgs_MT128x64x64_MI16x16x1_SN_LDSB1_CLR1_GRVWA8_GRVWB8_GSU0_GSUC0_GSUWGMRR0_K1_LBSPPA1024_LBSPPB512_LPA0_LPB32_MIWT4_2_NEPBS0_PLR2_SU32_SUM0_SUS256_SVW4_SKXCCM8_ULSGRO0_VWA4_VWB2_WGM8_WGMXCC1_WGMXCCGn1
    SolutionIndex: 108
    SolutionNameMin: Cijk_Ailk_Bjlk_HHS_BH_UserArgs_MT128x128x32_MI16x16x1_SN_LDSB0_CLR1_GRVWA8_GRVWB8_GSU0_GSUC0_GSUWGMRR0_K1_LBSPPA1024_LBSPPB1024_LPA0_LPB0_MIWT4_4_NEPBS16_PLR1_SU32_SUM0_SUS256_SVW4_SKXCCM8_ULSGRO0_VWA4_VWB4_WGM1_WGMXCC1_WGMXCCGn1
    SolutionIndex: 109
    SolutionNameMin: Cijk_Ailk_Bjlk_HHS_BH_UserArgs_MT128x64x128_MI16x16x1_SN_LDSB1_CLR1_GRVWA8_GRVWB8_GSU0_GSUC0_GSUWGMRR0_K1_LBSPPA1024_LBSPPB512_LPA32_LPB32_MIWT4_2_NEPBS16_PLR2_SU32_SUM0_SUS256_SVW2_SKXCCM0_ULSGRO1_VWA2_VWB2_WGM4_WGMXCC1_WGMXCCGn1
    SolutionIndex: 110
    SolutionNameMin: Cijk_Ailk_Bjlk_HHS_BH_UserArgs_MT128x64x128_MI16x16x1_SN_LDSB1_CLR1_GRVWA8_GRVWB8_GSU0_GSUC0_GSUWGMRR0_K1_LBSPPA1024_LBSPPB512_LPA0_LPB32_MIWT4_2_NEPBS16_PLR2_SU32_SUM0_SUS256_SVW4_SKXCCM0_ULSGRO0_VWA4_VWB2_WGM8_WGMXCC1_WGMXCCGn1
    SolutionIndex: 111
    SolutionNameMin: Cijk_Ailk_Bjlk_HHS_BH_UserArgs_MT128x64x128_MI16x16x1_SN_LDSB1_CLR1_GRVWA8_GRVWB8_GSU0_GSUC0_GSUWGMRR0_K1_LBSPPA1024_LBSPPB512_LPA0_LPB32_MIWT4_2_NEPBS16_PLR2_SU32_SUM0_SUS256_SVW4_SKXCCM8_ULSGRO0_VWA4_VWB2_WGM8_WGMXCC1_WGMXCCGn1
    SolutionIndex: 112
    SolutionNameMin: Cijk_Ailk_Bjlk_HHS_BH_UserArgs_MT128x128x64_MI16x16x1_SN_LDSB1_CLR1_GRVWA8_GRVWB8_GSU0_GSUC0_GSUWGMRR0_K1_LBSPPA1024_LBSPPB1024_LPA0_LPB0_MIWT4_4_NEPBS0_PLR1_SU32_SUM0_SUS256_SVW4_SKXCCM8_ULSGRO1_VWA4_VWB4_WGM4_WGMXCC1_WGMXCCGn1
    SolutionIndex: 113
    SolutionNameMin: Cijk_Ailk_Bjlk_HHS_BH_UserArgs_MT128x128x64_MI16x16x1_SN_LDSB1_CLR1_GRVWA8_GRVWB8_GSU0_GSUC0_GSUWGMRR0_K1_LBSPPA1024_LBSPPB1024_LPA0_LPB0_MIWT4_4_NEPBS16_PLR1_SU32_SUM0_SUS256_SVW4_SKXCCM8_ULSGRO0_VWA4_VWB4_WGM8_WGMXCC1_WGMXCCGn1
    SolutionIndex: 114
    SolutionNameMin: Cijk_Ailk_Bjlk_HHS_BH_UserArgs_MT128x256x32_MI16x16x1_SN_LDSB1_CLR1_GRVWA8_GRVWB8_GSU0_GSUC0_GSUWGMRR0_K1_LBSPPA1024_LBSPPB2048_LPA0_LPB0_MIWT4_8_NEPBS16_PLR1_SU32_SUM0_SUS256_SVW4_SKXCCM8_ULSGRO0_VWA4_VWB4_WGM4_WGMXCC1_WGMXCCGn1
    SolutionIndex: 115
    SolutionNameMin: Cijk_Ailk_Bjlk_HHS_BH_UserArgs_MT128x128x128_MI16x16x1_SN_LDSB1_CLR1_GRVWA8_GRVWB8_GSU0_GSUC0_GSUWGMRR0_K1_LBSPPA1024_LBSPPB1024_LPA0_LPB0_MIWT4_4_NEPBS0_PLR1_SU32_SUM0_SUS256_SVW4_SKXCCM0_ULSGRO1_VWA4_VWB4_WGM8_WGMXCC1_WGMXCCGn1
    SolutionIndex: 116
    SolutionNameMin: Cijk_Ailk_Bjlk_HHS_BH_UserArgs_MT128x128x128_MI16x16x1_SN_LDSB1_CLR1_GRVWA8_GRVWB8_GSU0_GSUC0_GSUWGMRR0_K1_LBSPPA1024_LBSPPB1024_LPA0_LPB0_MIWT4_4_NEPBS0_PLR1_SU32_SUM0_SUS256_SVW4_SKXCCM0_ULSGRO0_VWA4_VWB4_WGM8_WGMXCC1_WGMXCCGn1
    SolutionIndex: 117
    SolutionNameMin: Cijk_Ailk_Bjlk_HHS_BH_UserArgs_MT128x128x128_MI16x16x1_SN_LDSB1_CLR1_GRVWA8_GRVWB8_GSU0_GSUC0_GSUWGMRR0_K1_LBSPPA1024_LBSPPB1024_LPA0_LPB0_MIWT4_4_NEPBS0_PLR1_SU32_SUM0_SUS256_SVW4_SKXCCM8_ULSGRO0_VWA4_VWB4_WGM1_WGMXCC1_WGMXCCGn1
    SolutionIndex: 118
    SolutionNameMin: Cijk_Ailk_Bjlk_HHS_BH_UserArgs_MT128x128x64_MI16x16x1_SN_LDSB1_CLR1_GRVWA8_GRVWB8_GSU0_GSUC0_GSUWGMRR0_K1_LBSPPA1024_LBSPPB1024_LPA0_LPB0_MIWT4_4_NEPBS0_PLR1_SU32_SUM0_SUS256_SVW4_SKXCCM8_ULSGRO0_VWA4_VWB4_WGM1_WGMXCC1_WGMXCCGn1
    SolutionIndex: 119
    SolutionNameMin: Cijk_Ailk_Bjlk_HHS_BH_UserArgs_MT128x128x64_MI16x16x1_SN_LDSB1_CLR1_GRVWA8_GRVWB8_GSU0_GSUC0_GSUWGMRR0_K1_LBSPPA1024_LBSPPB1024_LPA0_LPB0_MIWT4_4_NEPBS16_PLR1_SU32_SUM0_SUS256_SVW4_SKXCCM8_ULSGRO1_VWA4_VWB4_WGM8_WGMXCC1_WGMXCCGn1
    SolutionIndex: 120
    SolutionNameMin: Cijk_Ailk_Bjlk_HHS_BH_UserArgs_MT256x256x32_MI16x16x1_SN_LDSB0_CLR1_GRVWA8_GRVWB8_GSU0_GSUC0_GSUWGMRR0_K1_LBSPPA2048_LBSPPB2048_LPA0_LPB0_MIWT8_8_NEPBS16_PLR1_SU32_SUM0_SUS256_SVW4_SKXCCM8_ULSGRO1_VWA4_VWB8_WGM1_WGMXCC1_WGMXCCGn1
    SolutionIndex: 121
    SolutionNameMin: Cijk_Ailk_Bjlk_HHS_BH_UserArgs_MT128x128x128_MI16x16x1_SN_LDSB1_CLR1_GRVWA8_GRVWB8_GSU0_GSUC0_GSUWGMRR0_K1_LBSPPA1024_LBSPPB1024_LPA0_LPB0_MIWT4_4_NEPBS0_PLR1_SU32_SUM0_SUS256_SVW4_SKXCCM0_ULSGRO1_VWA4_VWB4_WGM1_WGMXCC1_WGMXCCGn1
    SolutionIndex: 122
    SolutionNameMin: Cijk_Ailk_Bjlk_HHS_BH_UserArgs_MT256x256x32_MI16x16x1_SN_LDSB0_CLR1_GRVWA8_GRVWB8_GSU0_GSUC0_GSUWGMRR0_K1_LBSPPA2048_LBSPPB2048_LPA0_LPB0_MIWT8_8_NEPBS16_PLR1_SU32_SUM0_SUS256_SVW4_SKXCCM8_ULSGRO1_VWA4_VWB4_WGM8_WGMXCC1_WGMXCCGn1
    SolutionIndex: 123
    SolutionNameMin: Cijk_Ailk_Bjlk_HHS_BH_UserArgs_MT32x32x128_MI16x16x1_SN_LDSB1_CLR1_GRVWA8_GRVWB8_GSU0_GSUC0_GSUWGMRR0_K1_LBSPPA256_LBSPPB256_LPA16_LPB16_MIWT1_1_NEPBS0_PLR3_SU32_SUM0_SUS256_SVW1_SKXCCM0_ULSGRO1_VWA1_VWB1_WGM1_WGMXCC1_WGMXCCGn1
    SolutionIndex: 124
    SolutionNameMin: Cijk_Ailk_Bjlk_HHS_BH_UserArgs_MT32x64x128_MI16x16x1_SN_LDSB1_CLR1_GRVWA8_GRVWB8_GSU0_GSUC0_GSUWGMRR0_K1_LBSPPA256_LBSPPB512_LPA16_LPB32_MIWT1_2_NEPBS16_PLR2_SU32_SUM0_SUS256_SVW1_SKXCCM8_ULSGRO1_VWA1_VWB2_WGM4_WGMXCC1_WGMXCCGn1
    SolutionIndex: 125
    SolutionNameMin: Cijk_Ailk_Bjlk_HHS_BH_UserArgs_MT64x64x64_MI16x16x1_SN_LDSB1_CLR1_GRVWA8_GRVWB8_GSU0_GSUC0_GSUWGMRR0_K1_LBSPPA512_LBSPPB512_LPA32_LPB32_MIWT2_2_NEPBS0_PLR1_SU32_SUM0_SUS256_SVW2_SKXCCM0_ULSGRO0_VWA2_VWB2_WGM1_WGMXCC1_WGMXCCGn1
    SolutionIndex: 126
    SolutionNameMin: Cijk_Ailk_Bjlk_HHS_BH_UserArgs_MT64x64x64_MI16x16x1_SN_LDSB1_CLR1_GRVWA8_GRVWB8_GSU0_GSUC0_GSUWGMRR0_K1_LBSPPA512_LBSPPB512_LPA32_LPB32_MIWT2_2_NEPBS0_PLR2_SU32_SUM0_SUS256_SVW2_SKXCCM8_ULSGRO1_VWA2_VWB2_WGM4_WGMXCC1_WGMXCCGn1
    SolutionIndex: 127
    SolutionNameMin: Cijk_Ailk_Bjlk_HHS_BH_UserArgs_MT64x64x128_MI16x16x1_SN_LDSB1_CLR1_GRVWA8_GRVWB8_GSU0_GSUC0_GSUWGMRR0_K1_LBSPPA512_LBSPPB512_LPA32_LPB32_MIWT2_2_NEPBS0_PLR2_SU32_SUM0_SUS256_SVW2_SKXCCM8_ULSGRO1_VWA2_VWB2_WGM8_WGMXCC1_WGMXCCGn1
    SolutionIndex: 128
    SolutionNameMin: Cijk_Ailk_Bjlk_HHS_BH_UserArgs_MT64x128x64_MI16x16x1_SN_LDSB1_CLR1_GRVWA8_GRVWB8_GSU0_GSUC0_GSUWGMRR0_K1_LBSPPA512_LBSPPB1024_LPA32_LPB0_MIWT2_4_NEPBS16_PLR2_SU32_SUM0_SUS256_SVW2_SKXCCM0_ULSGRO1_VWA2_VWB4_WGM1_WGMXCC1_WGMXCCGn1
    SolutionIndex: 129
    SolutionNameMin: Cijk_Ailk_Bjlk_HHS_BH_UserArgs_MT64x128x64_MI16x16x1_SN_LDSB1_CLR1_GRVWA8_GRVWB8_GSU0_GSUC0_GSUWGMRR0_K1_LBSPPA512_LBSPPB1024_LPA32_LPB0_MIWT2_4_NEPBS0_PLR2_SU32_SUM0_SUS256_SVW2_SKXCCM8_ULSGRO0_VWA2_VWB4_WGM1_WGMXCC1_WGMXCCGn1
    SolutionIndex: 130
    SolutionNameMin: Cijk_Ailk_Bjlk_HHS_BH_UserArgs_MT64x64x128_MI16x16x1_SN_LDSB1_CLR1_GRVWA8_GRVWB8_GSU0_GSUC0_GSUWGMRR0_K1_LBSPPA512_LBSPPB512_LPA32_LPB16_MIWT2_2_NEPBS16_PLR2_SU32_SUM0_SUS256_SVW2_SKXCCM8_ULSGRO0_VWA2_VWB1_WGM1_WGMXCC1_WGMXCCGn1
    SolutionIndex: 131
    SolutionNameMin: Cijk_Ailk_Bjlk_HHS_BH_UserArgs_MT64x64x64_MI16x16x1_SN_LDSB1_CLR1_GRVWA8_GRVWB8_GSU0_GSUC0_GSUWGMRR0_K1_LBSPPA512_LBSPPB512_LPA32_LPB32_MIWT2_2_NEPBS16_PLR2_SU32_SUM0_SUS256_SVW2_SKXCCM8_ULSGRO0_VWA2_VWB2_WGM4_WGMXCC1_WGMXCCGn1
    SolutionIndex: 132
    SolutionNameMin: Cijk_Ailk_Bjlk_HHS_BH_UserArgs_MT128x64x128_MI16x16x1_SN_LDSB1_CLR1_GRVWA8_GRVWB8_GSU0_GSUC0_GSUWGMRR0_K1_LBSPPA1024_LBSPPB512_LPA0_LPB32_MIWT4_2_NEPBS0_PLR3_SU32_SUM0_SUS256_SVW4_SKXCCM8_ULSGRO0_VWA4_VWB2_WGM8_WGMXCC1_WGMXCCGn1
    SolutionIndex: 133
    SolutionNameMin: Cijk_Ailk_Bjlk_HHS_BH_UserArgs_MT128x128x64_MI16x16x1_SN_LDSB1_CLR1_GRVWA8_GRVWB8_GSU0_GSUC0_GSUWGMRR0_K1_LBSPPA1024_LBSPPB1024_LPA0_LPB0_MIWT4_4_NEPBS0_PLR1_SU32_SUM0_SUS256_SVW4_SKXCCM0_ULSGRO1_VWA4_VWB4_WGM1_WGMXCC1_WGMXCCGn1
    SolutionIndex: 134
    SolutionNameMin: Cijk_Ailk_Bjlk_HHS_BH_UserArgs_MT128x64x128_MI16x16x1_SN_LDSB1_CLR1_GRVWA8_GRVWB8_GSU0_GSUC0_GSUWGMRR0_K1_LBSPPA1024_LBSPPB512_LPA32_LPB32_MIWT4_2_NEPBS16_PLR1_SU32_SUM0_SUS256_SVW2_SKXCCM0_ULSGRO0_VWA2_VWB2_WGM4_WGMXCC1_WGMXCCGn1
    SolutionIndex: 135
    SolutionNameMin: Cijk_Ailk_Bjlk_HHS_BH_UserArgs_MT128x64x128_MI16x16x1_SN_LDSB1_CLR1_GRVWA8_GRVWB8_GSU0_GSUC0_GSUWGMRR0_K1_LBSPPA1024_LBSPPB512_LPA0_LPB16_MIWT4_2_NEPBS0_PLR2_SU32_SUM0_SUS256_SVW4_SKXCCM0_ULSGRO1_VWA4_VWB1_WGM4_WGMXCC1_WGMXCCGn1
    SolutionIndex: 136
    SolutionNameMin: Cijk_Ailk_Bjlk_HHS_BH_UserArgs_MT128x64x128_MI16x16x1_SN_LDSB1_CLR1_GRVWA8_GRVWB8_GSU0_GSUC0_GSUWGMRR0_K1_LBSPPA1024_LBSPPB512_LPA0_LPB32_MIWT4_2_NEPBS16_PLR2_SU32_SUM0_SUS256_SVW4_SKXCCM8_ULSGRO0_VWA4_VWB2_WGM4_WGMXCC1_WGMXCCGn1
    SolutionIndex: 137
    SolutionNameMin: Cijk_Ailk_Bjlk_HHS_BH_UserArgs_MT128x256x64_MI16x16x1_SN_LDSB1_CLR1_GRVWA8_GRVWB8_GSU0_GSUC0_GSUWGMRR0_K1_LBSPPA1024_LBSPPB2048_LPA0_LPB32_MIWT4_8_NEPBS0_PLR2_SU32_SUM0_SUS256_SVW4_SKXCCM8_ULSGRO1_VWA4_VWB2_WGM8_WGMXCC1_WGMXCCGn1
    SolutionIndex: 138
    SolutionNameMin: Cijk_Ailk_Bjlk_HHS_BH_UserArgs_MT128x128x128_MI16x16x1_SN_LDSB1_CLR1_GRVWA8_GRVWB8_GSU0_GSUC0_GSUWGMRR0_K1_LBSPPA1024_LBSPPB1024_LPA0_LPB0_MIWT4_4_NEPBS16_PLR1_SU32_SUM0_SUS256_SVW4_SKXCCM0_ULSGRO1_VWA4_VWB4_WGM8_WGMXCC1_WGMXCCGn1
    SolutionIndex: 139
    SolutionNameMin: Cijk_Ailk_Bjlk_HHS_BH_UserArgs_MT128x128x128_MI16x16x1_SN_LDSB1_CLR1_GRVWA8_GRVWB8_GSU0_GSUC0_GSUWGMRR0_K1_LBSPPA1024_LBSPPB1024_LPA0_LPB0_MIWT4_4_NEPBS0_PLR1_SU32_SUM0_SUS256_SVW4_SKXCCM0_ULSGRO0_VWA4_VWB4_WGM4_WGMXCC1_WGMXCCGn1
    SolutionIndex: 140
    SolutionNameMin: Cijk_Ailk_Bjlk_HHS_BH_UserArgs_MT128x128x128_MI16x16x1_SN_LDSB1_CLR1_GRVWA8_GRVWB8_GSU0_GSUC0_GSUWGMRR0_K1_LBSPPA1024_LBSPPB1024_LPA0_LPB0_MIWT4_4_NEPBS0_PLR1_SU32_SUM0_SUS256_SVW4_SKXCCM8_ULSGRO1_VWA4_VWB4_WGM8_WGMXCC1_WGMXCCGn1
    SolutionIndex: 141
    SolutionNameMin: Cijk_Ailk_Bjlk_HHS_BH_UserArgs_MT128x128x64_MI16x16x1_SN_LDSB1_CLR1_GRVWA8_GRVWB8_GSU0_GSUC0_GSUWGMRR0_K1_LBSPPA1024_LBSPPB1024_LPA0_LPB0_MIWT4_4_NEPBS16_PLR1_SU32_SUM0_SUS256_SVW4_SKXCCM8_ULSGRO0_VWA4_VWB4_WGM1_WGMXCC1_WGMXCCGn1
    SolutionIndex: 142
    SolutionNameMin: Cijk_Ailk_Bjlk_HHS_BH_UserArgs_MT128x256x64_MI16x16x1_SN_LDSB1_CLR1_GRVWA8_GRVWB8_GSU0_GSUC0_GSUWGMRR0_K1_LBSPPA1024_LBSPPB2048_LPA0_LPB0_MIWT4_8_NEPBS16_PLR3_SU32_SUM0_SUS256_SVW4_SKXCCM8_ULSGRO0_VWA4_VWB8_WGM4_WGMXCC1_WGMXCCGn1
    SolutionIndex: 143
    SolutionNameMin: Cijk_Ailk_Bjlk_HHS_BH_UserArgs_MT256x256x32_MI16x16x1_SN_LDSB0_CLR1_GRVWA8_GRVWB8_GSU0_GSUC0_GSUWGMRR0_K1_LBSPPA2048_LBSPPB2048_LPA0_LPB0_MIWT8_8_NEPBS16_PLR1_SU32_SUM0_SUS256_SVW4_SKXCCM8_ULSGRO0_VWA4_VWB8_WGM4_WGMXCC1_WGMXCCGn1
    SolutionIndex: 144
    SolutionNameMin: Cijk_Ailk_Bjlk_HHS_BH_UserArgs_MT128x128x128_MI16x16x1_SN_LDSB1_CLR1_GRVWA8_GRVWB8_GSU0_GSUC0_GSUWGMRR0_K1_LBSPPA1024_LBSPPB1024_LPA0_LPB0_MIWT4_4_NEPBS16_PLR1_SU32_SUM0_SUS256_SVW4_SKXCCM0_ULSGRO1_VWA4_VWB4_WGM1_WGMXCC1_WGMXCCGn1
    SolutionIndex: 145
    SolutionNameMin: Cijk_Ailk_Bjlk_HHS_BH_UserArgs_MT128x128x64_MI16x16x1_SN_LDSB1_CLR1_GRVWA8_GRVWB8_GSU0_GSUC0_GSUWGMRR0_K1_LBSPPA1024_LBSPPB1024_LPA0_LPB0_MIWT4_4_NEPBS16_PLR2_SU32_SUM0_SUS256_SVW4_SKXCCM8_ULSGRO1_VWA4_VWB4_WGM1_WGMXCC1_WGMXCCGn1
    SolutionIndex: 146
    SolutionNameMin: Cijk_Ailk_Bjlk_HHS_BH_UserArgs_MT128x256x32_MI16x16x1_SN_LDSB1_CLR1_GRVWA8_GRVWB8_GSU0_GSUC0_GSUWGMRR0_K1_LBSPPA1024_LBSPPB2048_LPA0_LPB32_MIWT4_8_NEPBS16_PLR1_SU32_SUM0_SUS256_SVW4_SKXCCM8_ULSGRO0_VWA4_VWB2_WGM1_WGMXCC1_WGMXCCGn1
    SolutionIndex: 147
    SolutionNameMin: Cijk_Ailk_Bjlk_HHS_BH_UserArgs_MT256x256x32_MI16x16x1_SN_LDSB0_CLR1_GRVWA8_GRVWB8_GSU0_GSUC0_GSUWGMRR0_K1_LBSPPA2048_LBSPPB2048_LPA0_LPB0_MIWT8_8_NEPBS16_PLR1_SU32_SUM0_SUS256_SVW4_SKXCCM8_ULSGRO0_VWA4_VWB8_WGM1_WGMXCC1_WGMXCCGn1
    SolutionIndex: 148
    SolutionNameMin: Cijk_Ailk_Bjlk_HHS_BH_UserArgs_MT256x256x64_MI16x16x1_SN_LDSB1_CLR1_GRVWA8_GRVWB8_GSU0_GSUC0_GSUWGMRR0_K1_LBSPPA2048_LBSPPB2048_LPA0_LPB0_MIWT8_8_NEPBS16_PLR2_SU32_SUM0_SUS256_SVW4_SKXCCM8_ULSGRO1_VWA4_VWB4_WGM1_WGMXCC1_WGMXCCGn1
    SolutionIndex: 149
    SolutionNameMin: Cijk_Ailk_Bjlk_HHS_BH_UserArgs_MT128x128x128_MI16x16x1_SN_LDSB1_CLR1_GRVWA8_GRVWB8_GSU0_GSUC0_GSUWGMRR0_K1_LBSPPA1024_LBSPPB1024_LPA0_LPB0_MIWT4_4_NEPBS0_PLR3_SU32_SUM0_SUS256_SVW4_SKXCCM0_ULSGRO1_VWA4_VWB4_WGM1_WGMXCC1_WGMXCCGn1
    SolutionIndex: 150
    SolutionNameMin: Cijk_Ailk_Bjlk_HHS_BH_UserArgs_MT256x128x32_MI16x16x1_SN_LDSB1_CLR1_GRVWA8_GRVWB8_GSU0_GSUC0_GSUWGMRR0_K1_LBSPPA2048_LBSPPB1024_LPA0_LPB16_MIWT8_4_NEPBS0_PLR1_SU32_SUM0_SUS256_SVW4_SKXCCM8_ULSGRO1_VWA4_VWB1_WGM8_WGMXCC1_WGMXCCGn1
    SolutionIndex: 151
    SolutionNameMin: Cijk_Ailk_Bjlk_HHS_BH_UserArgs_MT256x256x64_MI16x16x1_SN_LDSB1_CLR1_GRVWA8_GRVWB8_GSU0_GSUC0_GSUWGMRR0_K1_LBSPPA2048_LBSPPB2048_LPA0_LPB0_MIWT8_8_NEPBS16_PLR2_SU32_SUM0_SUS256_SVW4_SKXCCM0_ULSGRO0_VWA4_VWB8_WGM4_WGMXCC1_WGMXCCGn1
    SolutionIndex: 152
    SolutionNameMin: Cijk_Ailk_Bjlk_HHS_BH_UserArgs_MT32x64x128_MI16x16x1_SN_LDSB1_CLR1_GRVWA8_GRVWB8_GSU0_GSUC0_GSUWGMRR0_K1_LBSPPA256_LBSPPB512_LPA16_LPB32_MIWT1_2_NEPBS0_PLR2_SU32_SUM0_SUS256_SVW1_SKXCCM8_ULSGRO1_VWA1_VWB2_WGM1_WGMXCC1_WGMXCCGn1
    SolutionIndex: 153
    SolutionNameMin: Cijk_Ailk_Bjlk_HHS_BH_UserArgs_MT64x64x128_MI16x16x1_SN_LDSB1_CLR1_GRVWA8_GRVWB8_GSU0_GSUC0_GSUWGMRR0_K1_LBSPPA512_LBSPPB512_LPA32_LPB32_MIWT2_2_NEPBS16_PLR2_SU32_SUM0_SUS256_SVW2_SKXCCM8_ULSGRO1_VWA2_VWB2_WGM4_WGMXCC1_WGMXCCGn1
    SolutionIndex: 154
    SolutionNameMin: Cijk_Ailk_Bjlk_HHS_BH_UserArgs_MT64x128x64_MI16x16x1_SN_LDSB1_CLR1_GRVWA8_GRVWB8_GSU0_GSUC0_GSUWGMRR0_K1_LBSPPA512_LBSPPB1024_LPA32_LPB0_MIWT2_4_NEPBS16_PLR2_SU32_SUM0_SUS256_SVW2_SKXCCM0_ULSGRO0_VWA2_VWB4_WGM1_WGMXCC1_WGMXCCGn1
    SolutionIndex: 155
    SolutionNameMin: Cijk_Ailk_Bjlk_HHS_BH_UserArgs_MT64x64x128_MI16x16x1_SN_LDSB1_CLR1_GRVWA8_GRVWB8_GSU0_GSUC0_GSUWGMRR0_K1_LBSPPA512_LBSPPB512_LPA32_LPB32_MIWT2_2_NEPBS0_PLR3_SU32_SUM0_SUS256_SVW2_SKXCCM0_ULSGRO0_VWA2_VWB2_WGM1_WGMXCC1_WGMXCCGn1
    SolutionIndex: 156
    SolutionNameMin: Cijk_Ailk_Bjlk_HHS_BH_UserArgs_MT64x64x64_MI16x16x1_SN_LDSB1_CLR1_GRVWA8_GRVWB8_GSU0_GSUC0_GSUWGMRR0_K1_LBSPPA512_LBSPPB512_LPA32_LPB32_MIWT2_2_NEPBS16_PLR1_SU32_SUM0_SUS256_SVW2_SKXCCM8_ULSGRO0_VWA2_VWB2_WGM8_WGMXCC1_WGMXCCGn1
    SolutionIndex: 157
    SolutionNameMin: Cijk_Ailk_Bjlk_HHS_BH_UserArgs_MT64x128x32_MI16x16x1_SN_LDSB0_CLR1_GRVWA8_GRVWB8_GSU0_GSUC0_GSUWGMRR0_K1_LBSPPA512_LBSPPB1024_LPA32_LPB0_MIWT2_4_NEPBS16_PLR1_SU32_SUM0_SUS256_SVW2_SKXCCM0_ULSGRO1_VWA2_VWB4_WGM1_WGMXCC1_WGMXCCGn1
    SolutionIndex: 158
    SolutionNameMin: Cijk_Ailk_Bjlk_HHS_BH_UserArgs_MT128x128x64_MI16x16x1_SN_LDSB1_CLR1_GRVWA8_GRVWB8_GSU0_GSUC0_GSUWGMRR0_K1_LBSPPA1024_LBSPPB1024_LPA0_LPB0_MIWT4_4_NEPBS0_PLR1_SU32_SUM0_SUS256_SVW4_SKXCCM0_ULSGRO0_VWA4_VWB4_WGM1_WGMXCC1_WGMXCCGn1
    SolutionIndex: 159
    SolutionNameMin: Cijk_Ailk_Bjlk_HHS_BH_UserArgs_MT128x64x128_MI16x16x1_SN_LDSB1_CLR1_GRVWA8_GRVWB8_GSU0_GSUC0_GSUWGMRR0_K1_LBSPPA1024_LBSPPB512_LPA32_LPB32_MIWT4_2_NEPBS16_PLR2_SU32_SUM0_SUS256_SVW2_SKXCCM0_ULSGRO0_VWA2_VWB2_WGM8_WGMXCC1_WGMXCCGn1
    SolutionIndex: 160
    SolutionNameMin: Cijk_Ailk_Bjlk_HHS_BH_UserArgs_MT128x64x128_MI16x16x1_SN_LDSB1_CLR1_GRVWA8_GRVWB8_GSU0_GSUC0_GSUWGMRR0_K1_LBSPPA1024_LBSPPB512_LPA0_LPB16_MIWT4_2_NEPBS16_PLR1_SU32_SUM0_SUS256_SVW4_SKXCCM0_ULSGRO0_VWA4_VWB1_WGM4_WGMXCC1_WGMXCCGn1
    SolutionIndex: 161
    SolutionNameMin: Cijk_Ailk_Bjlk_HHS_BH_UserArgs_MT128x256x64_MI16x16x1_SN_LDSB1_CLR1_GRVWA8_GRVWB8_GSU0_GSUC0_GSUWGMRR0_K1_LBSPPA1024_LBSPPB2048_LPA0_LPB0_MIWT4_8_NEPBS16_PLR1_SU32_SUM0_SUS256_SVW4_SKXCCM8_ULSGRO0_VWA4_VWB8_WGM1_WGMXCC1_WGMXCCGn1
    SolutionIndex: 162
    SolutionNameMin: Cijk_Ailk_Bjlk_HHS_BH_UserArgs_MT128x128x128_MI16x16x1_SN_LDSB1_CLR1_GRVWA8_GRVWB8_GSU0_GSUC0_GSUWGMRR0_K1_LBSPPA1024_LBSPPB1024_LPA0_LPB0_MIWT4_4_NEPBS16_PLR2_SU32_SUM0_SUS256_SVW4_SKXCCM0_ULSGRO0_VWA4_VWB4_WGM8_WGMXCC1_WGMXCCGn1
    SolutionIndex: 163
    SolutionNameMin: Cijk_Ailk_Bjlk_HHS_BH_UserArgs_MT128x128x128_MI16x16x1_SN_LDSB1_CLR1_GRVWA8_GRVWB8_GSU0_GSUC0_GSUWGMRR0_K1_LBSPPA1024_LBSPPB1024_LPA0_LPB0_MIWT4_4_NEPBS16_PLR1_SU32_SUM0_SUS256_SVW4_SKXCCM8_ULSGRO0_VWA4_VWB4_WGM8_WGMXCC1_WGMXCCGn1
    SolutionIndex: 164
    SolutionNameMin: Cijk_Ailk_Bjlk_HHS_BH_UserArgs_MT128x128x64_MI16x16x1_SN_LDSB1_CLR1_GRVWA8_GRVWB8_GSU0_GSUC0_GSUWGMRR0_K1_LBSPPA1024_LBSPPB1024_LPA0_LPB0_MIWT4_4_NEPBS16_PLR1_SU32_SUM0_SUS256_SVW4_SKXCCM8_ULSGRO1_VWA4_VWB4_WGM4_WGMXCC1_WGMXCCGn1
    SolutionIndex: 165
    SolutionNameMin: Cijk_Ailk_Bjlk_HHS_BH_UserArgs_MT128x256x64_MI16x16x1_SN_LDSB1_CLR1_GRVWA8_GRVWB8_GSU0_GSUC0_GSUWGMRR0_K1_LBSPPA1024_LBSPPB2048_LPA0_LPB0_MIWT4_8_NEPBS0_PLR3_SU32_SUM0_SUS256_SVW4_SKXCCM8_ULSGRO0_VWA4_VWB8_WGM8_WGMXCC1_WGMXCCGn1
    SolutionIndex: 166
    SolutionNameMin: Cijk_Ailk_Bjlk_HHS_BH_UserArgs_MT256x256x32_MI16x16x1_SN_LDSB0_CLR1_GRVWA8_GRVWB8_GSU0_GSUC0_GSUWGMRR0_K1_LBSPPA2048_LBSPPB2048_LPA0_LPB0_MIWT8_8_NEPBS0_PLR1_SU32_SUM0_SUS256_SVW4_SKXCCM8_ULSGRO0_VWA4_VWB8_WGM8_WGMXCC1_WGMXCCGn1
    SolutionIndex: 167
    SolutionNameMin: Cijk_Ailk_Bjlk_HHS_BH_UserArgs_MT128x128x128_MI16x16x1_SN_LDSB1_CLR1_GRVWA8_GRVWB8_GSU0_GSUC0_GSUWGMRR0_K1_LBSPPA1024_LBSPPB1024_LPA0_LPB0_MIWT4_4_NEPBS16_PLR1_SU32_SUM0_SUS256_SVW4_SKXCCM0_ULSGRO0_VWA4_VWB4_WGM4_WGMXCC1_WGMXCCGn1
    SolutionIndex: 168
    SolutionNameMin: Cijk_Ailk_Bjlk_HHS_BH_UserArgs_MT128x256x64_MI16x16x1_SN_LDSB1_CLR1_GRVWA8_GRVWB8_GSU0_GSUC0_GSUWGMRR0_K1_LBSPPA1024_LBSPPB2048_LPA32_LPB0_MIWT4_8_NEPBS0_PLR2_SU32_SUM0_SUS256_SVW2_SKXCCM8_ULSGRO1_VWA2_VWB4_WGM1_WGMXCC1_WGMXCCGn1
    SolutionIndex: 169
    SolutionNameMin: Cijk_Ailk_Bjlk_HHS_BH_UserArgs_MT256x256x32_MI16x16x1_SN_LDSB0_CLR1_GRVWA8_GRVWB8_GSU0_GSUC0_GSUWGMRR0_K1_LBSPPA2048_LBSPPB2048_LPA0_LPB0_MIWT8_8_NEPBS0_PLR1_SU32_SUM0_SUS256_SVW4_SKXCCM8_ULSGRO1_VWA4_VWB8_WGM4_WGMXCC1_WGMXCCGn1
    SolutionIndex: 170
    SolutionNameMin: Cijk_Ailk_Bjlk_HHS_BH_UserArgs_MT128x128x128_MI16x16x1_SN_LDSB1_CLR1_GRVWA8_GRVWB8_GSU0_GSUC0_GSUWGMRR0_K1_LBSPPA1024_LBSPPB1024_LPA0_LPB0_MIWT4_4_NEPBS0_PLR2_SU32_SUM0_SUS256_SVW4_SKXCCM0_ULSGRO0_VWA4_VWB4_WGM1_WGMXCC1_WGMXCCGn1
    SolutionIndex: 171
    SolutionNameMin: Cijk_Ailk_Bjlk_HHS_BH_UserArgs_MT128x128x128_MI16x16x1_SN_LDSB1_CLR1_GRVWA8_GRVWB8_GSU0_GSUC0_GSUWGMRR0_K1_LBSPPA1024_LBSPPB1024_LPA0_LPB0_MIWT4_4_NEPBS0_PLR2_SU32_SUM0_SUS256_SVW4_SKXCCM0_ULSGRO1_VWA4_VWB4_WGM1_WGMXCC1_WGMXCCGn1
    SolutionIndex: 172
    SolutionNameMin: Cijk_Ailk_Bjlk_HHS_BH_UserArgs_MT128x256x32_MI16x16x1_SN_LDSB1_CLR1_GRVWA8_GRVWB8_GSU0_GSUC0_GSUWGMRR0_K1_LBSPPA1024_LBSPPB2048_LPA0_LPB0_MIWT4_8_NEPBS0_PLR1_SU32_SUM0_SUS256_SVW4_SKXCCM8_ULSGRO0_VWA4_VWB8_WGM4_WGMXCC1_WGMXCCGn1
    SolutionIndex: 173
    SolutionNameMin: Cijk_Ailk_Bjlk_HHS_BH_UserArgs_MT256x256x32_MI16x16x1_SN_LDSB0_CLR1_GRVWA8_GRVWB8_GSU0_GSUC0_GSUWGMRR0_K1_LBSPPA2048_LBSPPB2048_LPA0_LPB0_MIWT8_8_NEPBS0_PLR1_SU32_SUM0_SUS256_SVW4_SKXCCM8_ULSGRO1_VWA4_VWB8_WGM8_WGMXCC1_WGMXCCGn1
    SolutionIndex: 174
    SolutionNameMin: Cijk_Ailk_Bjlk_HHS_BH_UserArgs_MT256x256x64_MI16x16x1_SN_LDSB1_CLR1_GRVWA8_GRVWB8_GSU0_GSUC0_GSUWGMRR0_K1_LBSPPA2048_LBSPPB2048_LPA0_LPB0_MIWT8_8_NEPBS0_PLR2_SU32_SUM0_SUS256_SVW4_SKXCCM8_ULSGRO0_VWA4_VWB8_WGM1_WGMXCC1_WGMXCCGn1
    SolutionIndex: 175
    SolutionNameMin: Cijk_Ailk_Bjlk_HHS_BH_UserArgs_MT128x256x32_MI16x16x1_SN_LDSB1_CLR1_GRVWA8_GRVWB8_GSU0_GSUC0_GSUWGMRR0_K1_LBSPPA1024_LBSPPB2048_LPA0_LPB0_MIWT4_8_NEPBS0_PLR1_SU32_SUM0_SUS256_SVW4_SKXCCM0_ULSGRO0_VWA4_VWB8_WGM4_WGMXCC1_WGMXCCGn1
    SolutionIndex: 176
    SolutionNameMin: Cijk_Ailk_Bjlk_HHS_BH_UserArgs_MT256x256x32_MI16x16x1_SN_LDSB0_CLR1_GRVWA8_GRVWB8_GSU0_GSUC0_GSUWGMRR0_K1_LBSPPA2048_LBSPPB2048_LPA0_LPB0_MIWT8_8_NEPBS0_PLR1_SU32_SUM0_SUS256_SVW4_SKXCCM8_ULSGRO1_VWA4_VWB8_WGM1_WGMXCC1_WGMXCCGn1
    SolutionIndex: 177
    SolutionNameMin: Cijk_Ailk_Bjlk_HHS_BH_UserArgs_MT64x64x128_MI16x16x1_SN_LDSB1_CLR1_GRVWA8_GRVWB8_GSU0_GSUC0_GSUWGMRR0_K1_LBSPPA512_LBSPPB512_LPA32_LPB32_MIWT2_2_NEPBS0_PLR3_SU32_SUM0_SUS256_SVW2_SKXCCM8_ULSGRO1_VWA2_VWB2_WGM8_WGMXCC1_WGMXCCGn1
    SolutionIndex: 178
    SolutionNameMin: Cijk_Ailk_Bjlk_HHS_BH_UserArgs_MT128x64x128_MI16x16x1_SN_LDSB1_CLR1_GRVWA8_GRVWB8_GSU0_GSUC0_GSUWGMRR0_K1_LBSPPA1024_LBSPPB512_LPA32_LPB16_MIWT4_2_NEPBS0_PLR2_SU32_SUM0_SUS256_SVW2_SKXCCM0_ULSGRO1_VWA2_VWB1_WGM8_WGMXCC1_WGMXCCGn1
    SolutionIndex: 179
    SolutionNameMin: Cijk_Ailk_Bjlk_HHS_BH_UserArgs_MT64x128x128_MI16x16x1_SN_LDSB1_CLR1_GRVWA8_GRVWB8_GSU0_GSUC0_GSUWGMRR0_K1_LBSPPA512_LBSPPB1024_LPA32_LPB0_MIWT2_4_NEPBS16_PLR1_SU32_SUM0_SUS256_SVW2_SKXCCM0_ULSGRO1_VWA2_VWB4_WGM8_WGMXCC1_WGMXCCGn1
    SolutionIndex: 180
    SolutionNameMin: Cijk_Ailk_Bjlk_HHS_BH_UserArgs_MT128x64x128_MI16x16x1_SN_LDSB1_CLR1_GRVWA8_GRVWB8_GSU0_GSUC0_GSUWGMRR0_K1_LBSPPA1024_LBSPPB512_LPA0_LPB32_MIWT4_2_NEPBS0_PLR2_SU32_SUM0_SUS256_SVW4_SKXCCM8_ULSGRO0_VWA4_VWB2_WGM8_WGMXCC1_WGMXCCGn1
    SolutionIndex: 181
    SolutionNameMin: Cijk_Ailk_Bjlk_HHS_BH_UserArgs_MT128x64x128_MI16x16x1_SN_LDSB1_CLR1_GRVWA8_GRVWB8_GSU0_GSUC0_GSUWGMRR0_K1_LBSPPA1024_LBSPPB512_LPA0_LPB32_MIWT4_2_NEPBS16_PLR3_SU32_SUM0_SUS256_SVW4_SKXCCM8_ULSGRO0_VWA4_VWB2_WGM4_WGMXCC1_WGMXCCGn1
    SolutionIndex: 182
    SolutionNameMin: Cijk_Ailk_Bjlk_HHS_BH_UserArgs_MT128x256x32_MI16x16x1_SN_LDSB1_CLR1_GRVWA8_GRVWB8_GSU0_GSUC0_GSUWGMRR0_K1_LBSPPA1024_LBSPPB2048_LPA0_LPB0_MIWT4_8_NEPBS0_PLR1_SU32_SUM0_SUS256_SVW4_SKXCCM0_ULSGRO1_VWA4_VWB8_WGM4_WGMXCC1_WGMXCCGn1
    SolutionIndex: 183
    SolutionNameMin: Cijk_Ailk_Bjlk_HHS_BH_UserArgs_MT128x128x128_MI16x16x1_SN_LDSB1_CLR1_GRVWA8_GRVWB8_GSU0_GSUC0_GSUWGMRR0_K1_LBSPPA1024_LBSPPB1024_LPA0_LPB0_MIWT4_4_NEPBS16_PLR1_SU32_SUM0_SUS256_SVW4_SKXCCM8_ULSGRO1_VWA4_VWB4_WGM8_WGMXCC1_WGMXCCGn1
    SolutionIndex: 184
    SolutionNameMin: Cijk_Ailk_Bjlk_HHS_BH_UserArgs_MT128x128x128_MI16x16x1_SN_LDSB1_CLR1_GRVWA8_GRVWB8_GSU0_GSUC0_GSUWGMRR0_K1_LBSPPA1024_LBSPPB1024_LPA0_LPB0_MIWT4_4_NEPBS16_PLR1_SU32_SUM0_SUS256_SVW4_SKXCCM8_ULSGRO0_VWA4_VWB4_WGM4_WGMXCC1_WGMXCCGn1
    SolutionIndex: 185
    SolutionNameMin: Cijk_Ailk_Bjlk_HHS_BH_UserArgs_MT128x128x128_MI16x16x1_SN_LDSB1_CLR1_GRVWA8_GRVWB8_GSU0_GSUC0_GSUWGMRR0_K1_LBSPPA1024_LBSPPB1024_LPA0_LPB0_MIWT4_4_NEPBS16_PLR2_SU32_SUM0_SUS256_SVW4_SKXCCM0_ULSGRO1_VWA4_VWB4_WGM1_WGMXCC1_WGMXCCGn1
    SolutionIndex: 186
    SolutionNameMin: Cijk_Ailk_Bjlk_HHS_BH_UserArgs_MT128x256x64_MI16x16x1_SN_LDSB1_CLR1_GRVWA8_GRVWB8_GSU0_GSUC0_GSUWGMRR0_K1_LBSPPA1024_LBSPPB2048_LPA0_LPB32_MIWT4_8_NEPBS16_PLR1_SU32_SUM0_SUS256_SVW4_SKXCCM0_ULSGRO0_VWA4_VWB2_WGM1_WGMXCC1_WGMXCCGn1
    SolutionIndex: 187
    SolutionNameMin: Cijk_Ailk_Bjlk_HHS_BH_UserArgs_MT128x256x64_MI16x16x1_SN_LDSB1_CLR1_GRVWA8_GRVWB8_GSU0_GSUC0_GSUWGMRR0_K1_LBSPPA1024_LBSPPB2048_LPA0_LPB0_MIWT4_8_NEPBS16_PLR3_SU32_SUM0_SUS256_SVW4_SKXCCM0_ULSGRO1_VWA4_VWB4_WGM1_WGMXCC1_WGMXCCGn1
    SolutionIndex: 188
    SolutionNameMin: Cijk_Ailk_Bjlk_HHS_BH_UserArgs_MT128x128x128_MI16x16x1_SN_LDSB1_CLR1_GRVWA8_GRVWB8_GSU0_GSUC0_GSUWGMRR0_K1_LBSPPA1024_LBSPPB1024_LPA0_LPB0_MIWT4_4_NEPBS16_PLR2_SU32_SUM0_SUS256_SVW4_SKXCCM8_ULSGRO1_VWA4_VWB4_WGM8_WGMXCC1_WGMXCCGn1
    SolutionIndex: 189
    SolutionNameMin: Cijk_Ailk_Bjlk_HHS_BH_UserArgs_MT128x256x64_MI16x16x1_SN_LDSB1_CLR1_GRVWA8_GRVWB8_GSU0_GSUC0_GSUWGMRR0_K1_LBSPPA1024_LBSPPB2048_LPA32_LPB0_MIWT4_8_NEPBS16_PLR2_SU32_SUM0_SUS256_SVW2_SKXCCM0_ULSGRO1_VWA2_VWB8_WGM8_WGMXCC1_WGMXCCGn1
    SolutionIndex: 190
    SolutionNameMin: Cijk_Ailk_Bjlk_HHS_BH_UserArgs_MT256x256x32_MI16x16x1_SN_LDSB0_CLR1_GRVWA8_GRVWB8_GSU0_GSUC0_GSUWGMRR0_K1_LBSPPA2048_LBSPPB2048_LPA0_LPB0_MIWT8_8_NEPBS0_PLR1_SU32_SUM0_SUS256_SVW4_SKXCCM0_ULSGRO0_VWA4_VWB4_WGM8_WGMXCC1_WGMXCCGn1
    SolutionIndex: 191
    SolutionNameMin: Cijk_Ailk_Bjlk_HHS_BH_UserArgs_MT256x256x64_MI16x16x1_SN_LDSB1_CLR1_GRVWA8_GRVWB8_GSU0_GSUC0_GSUWGMRR0_K1_LBSPPA2048_LBSPPB2048_LPA0_LPB0_MIWT8_8_NEPBS0_PLR1_SU32_SUM0_SUS256_SVW4_SKXCCM8_ULSGRO0_VWA4_VWB4_WGM4_WGMXCC1_WGMXCCGn1
    SolutionIndex: 192
    SolutionNameMin: Cijk_Ailk_Bjlk_HHS_BH_UserArgs_MT128x128x128_MI16x16x1_SN_LDSB1_CLR1_GRVWA8_GRVWB8_GSU0_GSUC0_GSUWGMRR0_K1_LBSPPA1024_LBSPPB1024_LPA0_LPB0_MIWT4_4_NEPBS16_PLR1_SU32_SUM0_SUS256_SVW4_SKXCCM0_ULSGRO0_VWA4_VWB4_WGM1_WGMXCC1_WGMXCCGn1
    SolutionIndex: 193
    SolutionNameMin: Cijk_Ailk_Bjlk_HHS_BH_UserArgs_MT128x128x128_MI16x16x1_SN_LDSB1_CLR1_GRVWA8_GRVWB8_GSU0_GSUC0_GSUWGMRR0_K1_LBSPPA1024_LBSPPB1024_LPA0_LPB0_MIWT4_4_NEPBS16_PLR2_SU32_SUM0_SUS256_SVW4_SKXCCM0_ULSGRO0_VWA4_VWB4_WGM1_WGMXCC1_WGMXCCGn1
    SolutionIndex: 194
    SolutionNameMin: Cijk_Ailk_Bjlk_HHS_BH_UserArgs_MT256x128x64_MI16x16x1_SN_LDSB1_CLR1_GRVWA8_GRVWB8_GSU0_GSUC0_GSUWGMRR0_K1_LBSPPA2048_LBSPPB1024_LPA0_LPB32_MIWT8_4_NEPBS0_PLR2_SU32_SUM0_SUS256_SVW4_SKXCCM8_ULSGRO0_VWA4_VWB2_WGM8_WGMXCC1_WGMXCCGn1
    SolutionIndex: 195
    SolutionNameMin: Cijk_Ailk_Bjlk_HHS_BH_UserArgs_MT128x256x64_MI16x16x1_SN_LDSB1_CLR1_GRVWA8_GRVWB8_GSU0_GSUC0_GSUWGMRR0_K1_LBSPPA1024_LBSPPB2048_LPA0_LPB0_MIWT4_8_NEPBS16_PLR3_SU32_SUM0_SUS256_SVW4_SKXCCM8_ULSGRO1_VWA4_VWB8_WGM4_WGMXCC1_WGMXCCGn1
    SolutionIndex: 196
    SolutionNameMin: Cijk_Ailk_Bjlk_HHS_BH_UserArgs_MT256x256x64_MI16x16x1_SN_LDSB1_CLR1_GRVWA8_GRVWB8_GSU0_GSUC0_GSUWGMRR0_K1_LBSPPA2048_LBSPPB2048_LPA0_LPB0_MIWT8_8_NEPBS16_PLR1_SU32_SUM0_SUS256_SVW4_SKXCCM8_ULSGRO1_VWA4_VWB4_WGM1_WGMXCC1_WGMXCCGn1
    SolutionIndex: 197
    SolutionNameMin: Cijk_Ailk_Bjlk_HHS_BH_UserArgs_MT256x256x64_MI16x16x1_SN_LDSB1_CLR1_GRVWA8_GRVWB8_GSU0_GSUC0_GSUWGMRR0_K1_LBSPPA2048_LBSPPB2048_LPA0_LPB0_MIWT8_8_NEPBS16_PLR2_SU32_SUM0_SUS256_SVW4_SKXCCM8_ULSGRO1_VWA4_VWB8_WGM4_WGMXCC1_WGMXCCGn1
    SolutionIndex: 198
    SolutionNameMin: Cijk_Ailk_Bjlk_HHS_BH_UserArgs_MT256x128x64_MI16x16x1_SN_LDSB1_CLR1_GRVWA8_GRVWB8_GSU0_GSUC0_GSUWGMRR0_K1_LBSPPA2048_LBSPPB1024_LPA0_LPB0_MIWT8_4_NEPBS16_PLR1_SU32_SUM0_SUS256_SVW4_SKXCCM0_ULSGRO1_VWA4_VWB4_WGM1_WGMXCC1_WGMXCCGn1
    SolutionIndex: 199
    SolutionNameMin: Cijk_Ailk_Bjlk_HHS_BH_UserArgs_MT256x128x32_MI16x16x1_SN_LDSB1_CLR1_GRVWA8_GRVWB8_GSU0_GSUC0_GSUWGMRR0_K1_LBSPPA2048_LBSPPB1024_LPA0_LPB0_MIWT8_4_NEPBS0_PLR1_SU32_SUM0_SUS256_SVW4_SKXCCM8_ULSGRO0_VWA4_VWB4_WGM4_WGMXCC1_WGMXCCGn1
    SolutionIndex: 200
    SolutionNameMin: Cijk_Ailk_Bjlk_HHS_BH_UserArgs_MT256x128x32_MI16x16x1_SN_LDSB1_CLR1_GRVWA8_GRVWB8_GSU0_GSUC0_GSUWGMRR0_K1_LBSPPA2048_LBSPPB1024_LPA32_LPB0_MIWT8_4_NEPBS0_PLR1_SU32_SUM0_SUS256_SVW2_SKXCCM8_ULSGRO1_VWA2_VWB4_WGM8_WGMXCC1_WGMXCCGn1
    SolutionIndex: 201
    SolutionNameMin: Cijk_Ailk_Bjlk_HHS_BH_UserArgs_MT256x256x32_MI16x16x1_SN_LDSB0_CLR1_GRVWA8_GRVWB8_GSU0_GSUC0_GSUWGMRR0_K1_LBSPPA2048_LBSPPB2048_LPA0_LPB0_MIWT8_8_NEPBS16_PLR1_SU32_SUM0_SUS256_SVW4_SKXCCM8_ULSGRO1_VWA4_VWB8_WGM4_WGMXCC1_WGMXCCGn1
    SolutionIndex: 202
    SolutionNameMin: Cijk_Ailk_Bjlk_HHS_BH_UserArgs_MT256x256x32_MI16x16x1_SN_LDSB0_CLR1_GRVWA8_GRVWB8_GSU0_GSUC0_GSUWGMRR0_K1_LBSPPA2048_LBSPPB2048_LPA0_LPB0_MIWT8_8_NEPBS0_PLR1_SU32_SUM0_SUS256_SVW4_SKXCCM8_ULSGRO0_VWA4_VWB8_WGM4_WGMXCC1_WGMXCCGn1
- - - [128, 128, 1, 128]
    - [25, 0.08]
  - - [128, 128, 1, 256]
    - [28, 0.102]
  - - [128, 128, 1, 512]
    - [28, 0.166]
  - - [128, 128, 1, 1024]
    - [46, 0.237]
  - - [128, 128, 1, 2048]
    - [47, 0.33]
  - - [128, 128, 1, 4096]
    - [1, 0.53]
  - - [128, 128, 1, 8192]
    - [5, 1.007]
  - - [128, 256, 1, 128]
    - [10, 0.159]
  - - [128, 256, 1, 256]
    - [28, 0.199]
  - - [128, 256, 1, 512]
    - [11, 0.322]
  - - [128, 256, 1, 1024]
    - [69, 0.469]
  - - [128, 256, 1, 2048]
    - [1, 0.784]
  - - [128, 256, 1, 4096]
    - [17, 1.469]
  - - [128, 256, 1, 8192]
    - [50, 2.522]
  - - [128, 512, 1, 128]
    - [25, 0.314]
  - - [128, 512, 1, 256]
    - [27, 0.382]
  - - [128, 512, 1, 512]
    - [46, 0.637]
  - - [128, 512, 1, 1024]
    - [68, 1.045]
  - - [128, 512, 1, 2048]
    - [14, 1.822]
  - - [128, 512, 1, 4096]
    - [70, 3.017]
  - - [128, 512, 1, 8192]
    - [36, 4.212]
  - - [128, 1024, 1, 128]
    - [11, 0.619]
  - - [128, 1024, 1, 256]
    - [73, 0.73]
  - - [128, 1024, 1, 512]
    - [72, 1.307]
  - - [128, 1024, 1, 1024]
    - [48, 2.142]
  - - [128, 1024, 1, 2048]
    - [30, 3.336]
  - - [128, 1024, 1, 4096]
    - [9, 4.814]
  - - [128, 1024, 1, 8192]
    - [59, 6.745]
  - - [128, 2048, 1, 128]
    - [25, 1.195]
  - - [128, 2048, 1, 256]
    - [12, 1.528]
  - - [128, 2048, 1, 512]
    - [46, 2.378]
  - - [128, 2048, 1, 1024]
    - [66, 3.939]
  - - [128, 2048, 1, 2048]
    - [64, 5.83]
  - - [128, 2048, 1, 4096]
    - [16, 7.909]
  - - [128, 2048, 1, 8192]
    - [57, 10.774]
  - - [128, 4096, 1, 128]
    - [22, 2.256]
  - - [128, 4096, 1, 256]
    - [21, 2.814]
  - - [128, 4096, 1, 512]
    - [65, 4.352]
  - - [128, 4096, 1, 1024]
    - [45, 6.581]
  - - [128, 4096, 1, 2048]
    - [62, 9.166]
  - - [128, 4096, 1, 4096]
    - [4, 12.11]
  - - [128, 4096, 1, 8192]
    - [3, 14.68]
  - - [128, 8192, 1, 128]
    - [18, 3.958]
  - - [128, 8192, 1, 256]
    - [19, 5.028]
  - - [128, 8192, 1, 512]
    - [61, 7.282]
  - - [128, 8192, 1, 1024]
    - [42, 10.16]
  - - [128, 8192, 1, 2048]
    - [4, 12.722]
  - - [128, 8192, 1, 4096]
    - [54, 15.724]
  - - [128, 8192, 1, 8192]
    - [15, 20.031]
  - - [256, 128, 1, 128]
    - [10, 0.157]
  - - [256, 128, 1, 256]
    - [25, 0.199]
  - - [256, 128, 1, 512]
    - [26, 0.333]
  - - [256, 128, 1, 1024]
    - [48, 0.5]
  - - [256, 128, 1, 2048]
    - [2, 0.794]
  - - [256, 128, 1, 4096]
    - [5, 1.475]
  - - [256, 128, 1, 8192]
    - [51, 2.422]
  - - [256, 256, 1, 128]
    - [24, 0.309]
  - - [256, 256, 1, 256]
    - [29, 0.387]
  - - [256, 256, 1, 512]
    - [72, 0.654]
  - - [256, 256, 1, 1024]
    - [68, 1.043]
  - - [256, 256, 1, 2048]
    - [70, 1.9]
  - - [256, 256, 1, 4096]
    - [70, 3.115]
  - - [256, 256, 1, 8192]
    - [58, 4.143]
  - - [256, 512, 1, 128]
    - [11, 0.61]
  - - [256, 512, 1, 256]
    - [49, 0.739]
  - - [256, 512, 1, 512]
    - [46, 1.313]
  - - [256, 512, 1, 1024]
    - [47, 2.124]
  - - [256, 512, 1, 2048]
    - [43, 3.448]
  - - [256, 512, 1, 4096]
    - [35, 5.284]
  - - [256, 512, 1, 8192]
    - [37, 6.708]
  - - [256, 1024, 1, 128]
    - [10, 1.178]
  - - [256, 1024, 1, 256]
    - [26, 1.514]
  - - [256, 1024, 1, 512]
    - [71, 2.388]
  - - [256, 1024, 1, 1024]
    - [66, 3.822]
  - - [256, 1024, 1, 2048]
    - [23, 5.784]
  - - [256, 1024, 1, 4096]
    - [33, 7.674]
  - - [256, 1024, 1, 8192]
    - [34, 10.412]
  - - [256, 2048, 1, 128]
    - [8, 2.242]
  - - [256, 2048, 1, 256]
    - [7, 2.819]
  - - [256, 2048, 1, 512]
    - [67, 4.359]
  - - [256, 2048, 1, 1024]
    - [44, 6.473]
  - - [256, 2048, 1, 2048]
    - [63, 9.013]
  - - [256, 2048, 1, 4096]
    - [0, 11.686]
  - - [256, 2048, 1, 8192]
    - [53, 14.346]
  - - [256, 4096, 1, 128]
    - [20, 3.951]
  - - [256, 4096, 1, 256]
    - [41, 4.948]
  - - [256, 4096, 1, 512]
    - [61, 7.322]
  - - [256, 4096, 1, 1024]
    - [56, 10.13]
  - - [256, 4096, 1, 2048]
    - [60, 13.074]
  - - [256, 4096, 1, 4096]
    - [55, 16.13]
  - - [256, 4096, 1, 8192]
    - [52, 20.279]
  - - [256, 8192, 1, 128]
    - [38, 6.282]
  - - [256, 8192, 1, 256]
    - [6, 7.711]
  - - [256, 8192, 1, 512]
    - [40, 10.827]
  - - [256, 8192, 1, 1024]
    - [39, 13.677]
  - - [256, 8192, 1, 2048]
    - [31, 16.507]
  - - [256, 8192, 1, 4096]
    - [32, 21.534]
  - - [256, 8192, 1, 8192]
    - [13, 23.897]
  - - [512, 128, 1, 128]
    - [11, 0.298]
  - - [512, 128, 1, 256]
    - [11, 0.395]
  - - [512, 128, 1, 512]
    - [69, 0.658]
  - - [512, 128, 1, 1024]
    - [74, 1.047]
  - - [512, 128, 1, 2048]
    - [68, 1.925]
  - - [512, 128, 1, 4096]
    - [75, 3.036]
  - - [512, 128, 1, 8192]
    - [76, 4.204]
  - - [512, 256, 1, 128]
    - [25, 0.611]
  - - [512, 256, 1, 256]
    - [26, 0.739]
  - - [512, 256, 1, 512]
    - [72, 1.29]
  - - [512, 256, 1, 1024]
    - [46, 2.166]
  - - [512, 256, 1, 2048]
    - [77, 3.531]
  - - [512, 256, 1, 4096]
    - [78, 5.228]
  - - [512, 256, 1, 8192]
    - [79, 6.6]
  - - [512, 512, 1, 128]
    - [47, 1.148]
  - - [512, 512, 1, 256]
    - [10, 1.516]
  - - [512, 512, 1, 512]
    - [46, 2.346]
  - - [512, 512, 1, 1024]
    - [64, 3.871]
  - - [512, 512, 1, 2048]
    - [66, 6.12]
  - - [512, 512, 1, 4096]
    - [80, 7.81]
  - - [512, 512, 1, 8192]
    - [81, 9.976]
  - - [512, 1024, 1, 128]
    - [82, 2.244]
  - - [512, 1024, 1, 256]
    - [83, 2.839]
  - - [512, 1024, 1, 512]
    - [44, 4.396]
  - - [512, 1024, 1, 1024]
    - [45, 6.609]
  - - [512, 1024, 1, 2048]
    - [84, 9.271]
  - - [512, 1024, 1, 4096]
    - [85, 11.556]
  - - [512, 1024, 1, 8192]
    - [86, 14.108]
  - - [512, 2048, 1, 128]
    - [87, 4.032]
  - - [512, 2048, 1, 256]
    - [19, 5.061]
  - - [512, 2048, 1, 512]
    - [88, 7.479]
  - - [512, 2048, 1, 1024]
    - [84, 10.173]
  - - [512, 2048, 1, 2048]
    - [54, 13.168]
  - - [512, 2048, 1, 4096]
    - [89, 15.345]
  - - [512, 2048, 1, 8192]
    - [90, 19.971]
  - - [512, 4096, 1, 128]
    - [91, 6.255]
  - - [512, 4096, 1, 256]
    - [92, 7.961]
  - - [512, 4096, 1, 512]
    - [93, 10.705]
  - - [512, 4096, 1, 1024]
    - [40, 14.235]
  - - [512, 4096, 1, 2048]
    - [90, 16.736]
  - - [512, 4096, 1, 4096]
    - [94, 21.301]
  - - [512, 4096, 1, 8192]
    - [95, 24.187]
  - - [512, 8192, 1, 128]
    - [96, 8.861]
  - - [512, 8192, 1, 256]
    - [96, 11.994]
  - - [512, 8192, 1, 512]
    - [97, 14.346]
  - - [512, 8192, 1, 1024]
    - [98, 17.413]
  - - [512, 8192, 1, 2048]
    - [94, 21.625]
  - - [512, 8192, 1, 4096]
    - [99, 25.251]
  - - [512, 8192, 1, 8192]
    - [100, 28.175]
  - - [1024, 128, 1, 128]
    - [11, 0.612]
  - - [1024, 128, 1, 256]
    - [46, 0.731]
  - - [1024, 128, 1, 512]
    - [46, 1.296]
  - - [1024, 128, 1, 1024]
    - [68, 2.151]
  - - [1024, 128, 1, 2048]
    - [11, 3.277]
  - - [1024, 128, 1, 4096]
    - [101, 4.837]
  - - [1024, 128, 1, 8192]
    - [80, 6.687]
  - - [1024, 256, 1, 128]
    - [24, 1.18]
  - - [1024, 256, 1, 256]
    - [71, 1.485]
  - - [1024, 256, 1, 512]
    - [25, 2.351]
  - - [1024, 256, 1, 1024]
    - [77, 3.917]
  - - [1024, 256, 1, 2048]
    - [102, 5.754]
  - - [1024, 256, 1, 4096]
    - [103, 7.679]
  - - [1024, 256, 1, 8192]
    - [81, 10.301]
  - - [1024, 512, 1, 128]
    - [82, 2.213]
  - - [1024, 512, 1, 256]
    - [83, 2.814]
  - - [1024, 512, 1, 512]
    - [104, 4.366]
  - - [1024, 512, 1, 1024]
    - [77, 6.614]
  - - [1024, 512, 1, 2048]
    - [105, 9.012]
  - - [1024, 512, 1, 4096]
    - [80, 11.29]
  - - [1024, 512, 1, 8192]
    - [86, 13.609]
  - - [1024, 1024, 1, 128]
    - [18, 4.031]
  - - [1024, 1024, 1, 256]
    - [106, 5.037]
  - - [1024, 1024, 1, 512]
    - [63, 7.481]
  - - [1024, 1024, 1, 1024]
    - [80, 10.222]
  - - [1024, 1024, 1, 2048]
    - [107, 12.483]
  - - [1024, 1024, 1, 4096]
    - [108, 14.889]
  - - [1024, 1024, 1, 8192]
    - [31, 19.664]
  - - [1024, 2048, 1, 128]
    - [109, 6.324]
  - - [1024, 2048, 1, 256]
    - [110, 8.042]
  - - [1024, 2048, 1, 512]
    - [111, 10.828]
  - - [1024, 2048, 1, 1024]
    - [39, 13.873]
  - - [1024, 2048, 1, 2048]
    - [112, 16.336]
  - - [1024, 2048, 1, 4096]
    - [113, 20.784]
  - - [1024, 2048, 1, 8192]
    - [114, 23.463]
  - - [1024, 4096, 1, 128]
    - [115, 8.878]
  - - [1024, 4096, 1, 256]
    - [116, 11.888]
  - - [1024, 4096, 1, 512]
    - [117, 14.085]
  - - [1024, 4096, 1, 1024]
    - [118, 17.396]
  - - [1024, 4096, 1, 2048]
    - [119, 21.362]
  - - [1024, 4096, 1, 4096]
    - [99, 25.072]
  - - [1024, 4096, 1, 8192]
    - [120, 27.124]
  - - [1024, 8192, 1, 128]
    - [96, 10.024]
  - - [1024, 8192, 1, 256]
    - [121, 12.894]
  - - [1024, 8192, 1, 512]
    - [90, 16.763]
  - - [1024, 8192, 1, 1024]
    - [90, 21.44]
  - - [1024, 8192, 1, 2048]
    - [118, 25.709]
  - - [1024, 8192, 1, 4096]
    - [122, 27.766]
  - - [1024, 8192, 1, 8192]
    - [120, 31.017]
  - - [2048, 128, 1, 128]
    - [123, 1.196]
  - - [2048, 128, 1, 256]
    - [69, 1.495]
  - - [2048, 128, 1, 512]
    - [28, 2.364]
  - - [2048, 128, 1, 1024]
    - [64, 3.914]
  - - [2048, 128, 1, 2048]
    - [124, 5.869]
  - - [2048, 128, 1, 4096]
    - [125, 7.995]
  - - [2048, 128, 1, 8192]
    - [126, 10.431]
  - - [2048, 256, 1, 128]
    - [22, 2.234]
  - - [2048, 256, 1, 256]
    - [22, 2.876]
  - - [2048, 256, 1, 512]
    - [44, 4.378]
  - - [2048, 256, 1, 1024]
    - [88, 6.579]
  - - [2048, 256, 1, 2048]
    - [127, 8.907]
  - - [2048, 256, 1, 4096]
    - [128, 11.413]
  - - [2048, 256, 1, 8192]
    - [129, 14.122]
  - - [2048, 512, 1, 128]
    - [19, 4.059]
  - - [2048, 512, 1, 256]
    - [87, 5.077]
  - - [2048, 512, 1, 512]
    - [130, 7.311]
  - - [2048, 512, 1, 1024]
    - [131, 10.105]
  - - [2048, 512, 1, 2048]
    - [132, 12.574]
  - - [2048, 512, 1, 4096]
    - [133, 15.391]
  - - [2048, 512, 1, 8192]
    - [118, 20.015]
  - - [2048, 1024, 1, 128]
    - [134, 6.305]
  - - [2048, 1024, 1, 256]
    - [135, 7.893]
  - - [2048, 1024, 1, 512]
    - [39, 10.904]
  - - [2048, 1024, 1, 1024]
    - [136, 13.675]
  - - [2048, 1024, 1, 2048]
    - [94, 16.183]
  - - [2048, 1024, 1, 4096]
    - [112, 20.774]
  - - [2048, 1024, 1, 8192]
    - [137, 23.41]
  - - [2048, 2048, 1, 128]
    - [138, 8.946]
  - - [2048, 2048, 1, 256]
    - [139, 11.971]
  - - [2048, 2048, 1, 512]
    - [140, 13.923]
  - - [2048, 2048, 1, 1024]
    - [32, 17.343]
  - - [2048, 2048, 1, 2048]
    - [141, 21.572]
  - - [2048, 2048, 1, 4096]
    - [142, 24.926]
  - - [2048, 2048, 1, 8192]
    - [143, 27.463]
  - - [2048, 4096, 1, 128]
    - [116, 10.157]
  - - [2048, 4096, 1, 256]
    - [144, 12.809]
  - - [2048, 4096, 1, 512]
    - [118, 16.439]
  - - [2048, 4096, 1, 1024]
    - [145, 20.927]
  - - [2048, 4096, 1, 2048]
    - [146, 25.012]
  - - [2048, 4096, 1, 4096]
    - [147, 27.525]
  - - [2048, 4096, 1, 8192]
    - [148, 31.143]
  - - [2048, 8192, 1, 128]
    - [144, 10.461]
  - - [2048, 8192, 1, 256]
    - [149, 14.092]
  - - [2048, 8192, 1, 512]
    - [97, 19.635]
  - - [2048, 8192, 1, 1024]
    - [150, 24.045]
  - - [2048, 8192, 1, 2048]
    - [120, 27.258]
  - - [2048, 8192, 1, 4096]
    - [120, 30.537]
  - - [2048, 8192, 1, 8192]
    - [151, 32.24]
  - - [4096, 128, 1, 128]
    - [83, 2.227]
  - - [4096, 128, 1, 256]
    - [22, 2.812]
  - - [4096, 128, 1, 512]
    - [44, 4.369]
  - - [4096, 128, 1, 1024]
    - [152, 6.541]
  - - [4096, 128, 1, 2048]
    - [153, 9.064]
  - - [4096, 128, 1, 4096]
    - [128, 11.548]
  - - [4096, 128, 1, 8192]
    - [154, 14.407]
  - - [4096, 256, 1, 128]
    - [18, 4.028]
  - - [4096, 256, 1, 256]
    - [155, 4.895]
  - - [4096, 256, 1, 512]
    - [88, 7.333]
  - - [4096, 256, 1, 1024]
    - [156, 10.078]
  - - [4096, 256, 1, 2048]
    - [157, 12.612]
  - - [4096, 256, 1, 4096]
    - [158, 15.721]
  - - [4096, 256, 1, 8192]
    - [94, 20.093]
  - - [4096, 512, 1, 128]
    - [159, 6.311]
  - - [4096, 512, 1, 256]
    - [160, 8.109]
  - - [4096, 512, 1, 512]
    - [111, 10.718]
  - - [4096, 512, 1, 1024]
    - [136, 13.722]
  - - [4096, 512, 1, 2048]
    - [31, 16.571]
  - - [4096, 512, 1, 4096]
    - [141, 21.106]
  - - [4096, 512, 1, 8192]
    - [161, 23.826]
  - - [4096, 1024, 1, 128]
    - [115, 8.638]
  - - [4096, 1024, 1, 256]
    - [162, 11.791]
  - - [4096, 1024, 1, 512]
    - [163, 14.023]
  - - [4096, 1024, 1, 1024]
    - [164, 17.163]
  - - [4096, 1024, 1, 2048]
    - [32, 21.514]
  - - [4096, 1024, 1, 4096]
    - [165, 25.201]
  - - [4096, 1024, 1, 8192]
    - [166, 26.966]
  - - [4096, 2048, 1, 128]
    - [96, 9.639]
  - - [4096, 2048, 1, 256]
    - [167, 12.883]
  - - [4096, 2048, 1, 512]
    - [112, 16.127]
  - - [4096, 2048, 1, 1024]
    - [119, 20.704]
  - - [4096, 2048, 1, 2048]
    - [168, 25.311]
  - - [4096, 2048, 1, 4096]
    - [169, 27.445]
  - - [4096, 2048, 1, 8192]
    - [122, 30.866]
  - - [4096, 4096, 1, 128]
    - [170, 10.284]
  - - [4096, 4096, 1, 256]
    - [171, 13.975]
  - - [4096, 4096, 1, 512]
    - [161, 19.081]
  - - [4096, 4096, 1, 1024]
    - [172, 23.76]
  - - [4096, 4096, 1, 2048]
    - [147, 27.672]
  - - [4096, 4096, 1, 4096]
    - [173, 30.537]
  - - [4096, 4096, 1, 8192]
    - [174, 32.772]
  - - [4096, 8192, 1, 128]
    - [97, 11.575]
  - - [4096, 8192, 1, 256]
    - [141, 16.222]
  - - [4096, 8192, 1, 512]
    - [175, 20.897]
  - - [4096, 8192, 1, 1024]
    - [176, 25.918]
  - - [4096, 8192, 1, 2048]
    - [120, 30.25]
  - - [4096, 8192, 1, 4096]
    - [147, 33.672]
  - - [4096, 8192, 1, 8192]
    - [147, 35.974]
  - - [8192, 128, 1, 128]
    - [106, 3.978]
  - - [8192, 128, 1, 256]
    - [18, 5.016]
  - - [8192, 128, 1, 512]
    - [130, 7.339]
  - - [8192, 128, 1, 1024]
    - [177, 9.909]
  - - [8192, 128, 1, 2048]
    - [127, 12.249]
  - - [8192, 128, 1, 4096]
    - [113, 15.594]
  - - [8192, 128, 1, 8192]
    - [133, 20.299]
  - - [8192, 256, 1, 128]
    - [178, 6.252]
  - - [8192, 256, 1, 256]
    - [179, 7.697]
  - - [8192, 256, 1, 512]
    - [180, 10.63]
  - - [8192, 256, 1, 1024]
    - [181, 13.731]
  - - [8192, 256, 1, 2048]
    - [133, 16.503]
  - - [8192, 256, 1, 4096]
    - [118, 21.246]
  - - [8192, 256, 1, 8192]
    - [182, 24.259]
  - - [8192, 512, 1, 128]
    - [183, 8.325]
  - - [8192, 512, 1, 256]
    - [167, 10.835]
  - - [8192, 512, 1, 512]
    - [184, 13.799]
  - - [8192, 512, 1, 1024]
    - [113, 17.189]
  - - [8192, 512, 1, 2048]
    - [185, 21.147]
  - - [8192, 512, 1, 4096]
    - [186, 25.142]
  - - [8192, 512, 1, 8192]
    - [187, 27.132]
  - - [8192, 1024, 1, 128]
    - [140, 9.317]
  - - [8192, 1024, 1, 256]
    - [188, 12.472]
  - - [8192, 1024, 1, 512]
    - [113, 16.277]
  - - [8192, 1024, 1, 1024]
    - [52, 21.101]
  - - [8192, 1024, 1, 2048]
    - [189, 24.754]
  - - [8192, 1024, 1, 4096]
    - [190, 27.086]
  - - [8192, 1024, 1, 8192]
    - [191, 30.444]
  - - [8192, 2048, 1, 128]
    - [192, 9.96]
  - - [8192, 2048, 1, 256]
    - [193, 13.542]
  - - [8192, 2048, 1, 512]
    - [194, 18.91]
  - - [8192, 2048, 1, 1024]
    - [99, 23.549]
  - - [8192, 2048, 1, 2048]
    - [195, 26.865]
  - - [8192, 2048, 1, 4096]
    - [196, 30.28]
  - - [8192, 2048, 1, 8192]
    - [147, 33.088]
  - - [8192, 4096, 1, 128]
    - [193, 11.008]
  - - [8192, 4096, 1, 256]
    - [183, 15.685]
  - - [8192, 4096, 1, 512]
    - [169, 20.679]
  - - [8192, 4096, 1, 1024]
    - [197, 26.191]
  - - [8192, 4096, 1, 2048]
    - [169, 30.306]
  - - [8192, 4096, 1, 4096]
    - [120, 33.746]
  - - [8192, 4096, 1, 8192]
    - [169, 35.598]
  - - [8192, 8192, 1, 128]
    - [198, 11.859]
  - - [8192, 8192, 1, 256]
    - [199, 15.998]
  - - [8192, 8192, 1, 512]
    - [200, 21.335]
  - - [8192, 8192, 1, 1024]
    - [143, 27.503]
  - - [8192, 8192, 1, 2048]
    - [201, 33.583]
  - - [8192, 8192, 1, 4096]
    - [202, 36.675]
  - - [8192, 8192, 1, 8192]
    - [201, 38.008]
- null
- null
- DeviceEfficiency
- GridBased
