library/src/amd_detail/rocblaslt/src/Tensile/Logic/streamk/gfx942/aquavanjaram942_Cijk_Alik_Bjlk_HHS_BH_UserArgs.yaml
- {MinimumRequiredVersion: 4.33.0}
- aquavanjaram942
- gfx942
- [Device 0049, Device 0050]
    SolutionIndex: 0
    SolutionNameMin: Cijk_Alik_Bjlk_HHS_BH_UserArgs_MT256x256x32_MI16x16x1_SN_LDSB1_CLR1_GSU0_GSUC0_GSUWGMRR0_K1_LBSPPA128_LBSPPB2048_LPB0_MIWT8_8_PLR1_SU32_SUM0_SUS256_SKXCCM0_VWA2_VWB8_WGM1_WGMXCC1_WGMXCCGn1
    SolutionIndex: 1
    SolutionNameMin: Cijk_Alik_Bjlk_HHS_BH_UserArgs_MT256x256x32_MI16x16x1_SN_LDSB1_CLR1_GSU0_GSUC0_GSUWGMRR0_K1_LBSPPA256_LBSPPB2048_LPB0_MIWT8_8_PLR1_SU32_SUM0_SUS256_SKXCCM0_VWA4_VWB8_WGM1_WGMXCC1_WGMXCCGn1
    SolutionIndex: 2
    SolutionNameMin: Cijk_Alik_Bjlk_HHS_BH_UserArgs_MT128x256x32_MI16x16x1_SN_LDSB1_CLR1_GSU0_GSUC0_GSUWGMRR0_K1_LBSPPA256_LBSPPB2048_LPB0_MIWT4_8_PLR1_SU32_SUM0_SUS256_SKXCCM0_VWA4_VWB8_WGM1_WGMXCC1_WGMXCCGn1
    SolutionIndex: 3
    SolutionNameMin: Cijk_Alik_Bjlk_HHS_BH_UserArgs_MT32x32x32_MI16x16x1_SN_LDSB0_CLR1_GSU0_GSUC0_GSUWGMRR0_K1_LBSPPA128_LBSPPB256_LPB16_MIWT1_1_PLR1_SU32_SUM0_SUS256_SKXCCM0_VWA1_VWB1_WGM1_WGMXCC1_WGMXCCGn1
    SolutionIndex: 4
    SolutionNameMin: Cijk_Alik_Bjlk_HHS_BH_UserArgs_MT128x256x64_MI16x16x1_SN_LDSB1_CLR1_GSU0_GSUC0_GSUWGMRR0_K1_LBSPPA256_LBSPPB4096_LPB0_MIWT4_8_PLR1_SU32_SUM0_SUS256_SKXCCM0_VWA2_VWB4_WGM1_WGMXCC1_WGMXCCGn1
    SolutionIndex: 5
    SolutionNameMin: Cijk_Alik_Bjlk_HHS_BH_UserArgs_MT128x256x64_MI16x16x1_SN_LDSB1_CLR1_GSU0_GSUC0_GSUWGMRR0_K1_LBSPPA512_LBSPPB4096_LPB0_MIWT4_8_PLR1_SU32_SUM0_SUS256_SKXCCM0_VWA4_VWB4_WGM1_WGMXCC1_WGMXCCGn1
    SolutionIndex: 6
    SolutionNameMin: Cijk_Alik_Bjlk_HHS_BH_UserArgs_MT128x256x64_MI16x16x1_SN_LDSB1_CLR1_GSU0_GSUC0_GSUWGMRR0_K1_LBSPPA512_LBSPPB4096_LPB32_MIWT4_8_PLR1_SU32_SUM0_SUS256_SKXCCM0_VWA4_VWB2_WGM4_WGMXCC1_WGMXCCGn1
    SolutionIndex: 7
    SolutionNameMin: Cijk_Alik_Bjlk_HHS_BH_UserArgs_MT128x256x64_MI16x16x1_SN_LDSB1_CLR1_GSU0_GSUC0_GSUWGMRR0_K1_LBSPPA512_LBSPPB4096_LPB0_MIWT4_8_PLR1_SU32_SUM0_SUS256_SKXCCM0_VWA4_VWB8_WGM8_WGMXCC1_WGMXCCGn1
    SolutionIndex: 8
    SolutionNameMin: Cijk_Alik_Bjlk_HHS_BH_UserArgs_MT256x128x64_MI16x16x1_SN_LDSB1_CLR1_GSU0_GSUC0_GSUWGMRR0_K1_LBSPPA512_LBSPPB2048_LPB16_MIWT8_4_PLR1_SU32_SUM0_SUS256_SKXCCM0_VWA4_VWB1_WGM1_WGMXCC1_WGMXCCGn1
    SolutionIndex: 9
    SolutionNameMin: Cijk_Alik_Bjlk_HHS_BH_UserArgs_MT256x128x64_MI16x16x1_SN_LDSB1_CLR1_GSU0_GSUC0_GSUWGMRR0_K1_LBSPPA256_LBSPPB2048_LPB0_MIWT8_4_PLR1_SU32_SUM0_SUS256_SKXCCM0_VWA2_VWB4_WGM1_WGMXCC1_WGMXCCGn1
    SolutionIndex: 10
    SolutionNameMin: Cijk_Alik_Bjlk_HHS_BH_UserArgs_MT256x128x64_MI16x16x1_SN_LDSB1_CLR1_GSU0_GSUC0_GSUWGMRR0_K1_LBSPPA512_LBSPPB2048_LPB0_MIWT8_4_PLR1_SU32_SUM0_SUS256_SKXCCM0_VWA4_VWB4_WGM1_WGMXCC1_WGMXCCGn1
    SolutionIndex: 11
    SolutionNameMin: Cijk_Alik_Bjlk_HHS_BH_UserArgs_MT256x128x64_MI16x16x1_SN_LDSB1_CLR1_GSU0_GSUC0_GSUWGMRR0_K1_LBSPPA512_LBSPPB2048_LPB32_MIWT8_4_PLR1_SU32_SUM0_SUS256_SKXCCM0_VWA4_VWB2_WGM4_WGMXCC1_WGMXCCGn1
    SolutionIndex: 12
    SolutionNameMin: Cijk_Alik_Bjlk_HHS_BH_UserArgs_MT256x128x64_MI16x16x1_SN_LDSB1_CLR1_GSU0_GSUC0_GSUWGMRR0_K1_LBSPPA512_LBSPPB2048_LPB0_MIWT8_4_PLR1_SU32_SUM0_SUS256_SKXCCM0_VWA4_VWB4_WGM8_WGMXCC1_WGMXCCGn1
    SolutionIndex: 13
    SolutionNameMin: Cijk_Alik_Bjlk_HHS_BH_UserArgs_MT128x128x64_MI16x16x1_SN_LDSB1_CLR1_GSU0_GSUC0_GSUWGMRR0_K1_LBSPPA256_LBSPPB2048_LPB0_MIWT4_4_PLR1_SU32_SUM0_SUS256_SKXCCM0_VWA2_VWB4_WGM1_WGMXCC1_WGMXCCGn1
    SolutionIndex: 14
    SolutionNameMin: Cijk_Alik_Bjlk_HHS_BH_UserArgs_MT128x128x64_MI16x16x1_SN_LDSB1_CLR1_GSU0_GSUC0_GSUWGMRR0_K1_LBSPPA512_LBSPPB2048_LPB0_MIWT4_4_PLR1_SU32_SUM0_SUS256_SKXCCM0_VWA4_VWB4_WGM1_WGMXCC1_WGMXCCGn1
    SolutionIndex: 15
    SolutionNameMin: Cijk_Alik_Bjlk_HHS_BH_UserArgs_MT128x128x64_MI16x16x1_SN_LDSB1_CLR1_GSU0_GSUC0_GSUWGMRR0_K1_LBSPPA512_LBSPPB2048_LPB0_MIWT4_4_PLR1_SU32_SUM0_SUS256_SKXCCM0_VWA4_VWB4_WGM4_WGMXCC1_WGMXCCGn1
    SolutionIndex: 16
    SolutionNameMin: Cijk_Alik_Bjlk_HHS_BH_UserArgs_MT64x128x64_MI16x16x1_SN_LDSB1_CLR1_GSU0_GSUC0_GSUWGMRR0_K1_LBSPPA256_LBSPPB2048_LPB0_MIWT2_4_PLR1_SU32_SUM0_SUS256_SKXCCM0_VWA2_VWB4_WGM4_WGMXCC1_WGMXCCGn1
    SolutionIndex: 17
    SolutionNameMin: Cijk_Alik_Bjlk_HHS_BH_UserArgs_MT128x64x64_MI16x16x1_SN_LDSB1_CLR1_GSU0_GSUC0_GSUWGMRR0_K1_LBSPPA512_LBSPPB1024_LPB32_MIWT4_2_PLR1_SU32_SUM0_SUS256_SKXCCM0_VWA4_VWB2_WGM1_WGMXCC1_WGMXCCGn1
    SolutionIndex: 18
    SolutionNameMin: Cijk_Alik_Bjlk_HHS_BH_UserArgs_MT64x64x64_MI16x16x1_SN_LDSB1_CLR1_GSU0_GSUC0_GSUWGMRR0_K1_LBSPPA256_LBSPPB1024_LPB32_MIWT2_2_PLR1_SU32_SUM0_SUS256_SKXCCM0_VWA2_VWB2_WGM8_WGMXCC1_WGMXCCGn1
    SolutionIndex: 19
    SolutionNameMin: Cijk_Alik_Bjlk_HHS_BH_UserArgs_MT64x128x128_MI16x16x1_SN_LDSB1_CLR1_GSU0_GSUC0_GSUWGMRR0_K1_LBSPPA512_LBSPPB2048_LPB0_MIWT2_4_PLR1_SU32_SUM0_SUS256_SKXCCM0_VWA2_VWB4_WGM1_WGMXCC1_WGMXCCGn1
    SolutionIndex: 20
    SolutionNameMin: Cijk_Alik_Bjlk_HHS_BH_UserArgs_MT64x128x128_MI16x16x1_SN_LDSB1_CLR1_GSU0_GSUC0_GSUWGMRR0_K1_LBSPPA512_LBSPPB2048_LPB0_MIWT2_4_PLR2_SU32_SUM0_SUS256_SKXCCM0_VWA2_VWB4_WGM1_WGMXCC1_WGMXCCGn1
    SolutionIndex: 21
    SolutionNameMin: Cijk_Alik_Bjlk_HHS_BH_UserArgs_MT64x128x128_MI16x16x1_SN_LDSB1_CLR1_GSU0_GSUC0_GSUWGMRR0_K1_LBSPPA512_LBSPPB2048_LPB0_MIWT2_4_PLR1_SU32_SUM0_SUS256_SKXCCM0_VWA2_VWB4_WGM8_WGMXCC1_WGMXCCGn1
    SolutionIndex: 22
    SolutionNameMin: Cijk_Alik_Bjlk_HHS_BH_UserArgs_MT128x64x128_MI16x16x1_SN_LDSB1_CLR1_GSU0_GSUC0_GSUWGMRR0_K1_LBSPPA1024_LBSPPB1024_LPB32_MIWT4_2_PLR1_SU32_SUM0_SUS256_SKXCCM0_VWA4_VWB2_WGM1_WGMXCC1_WGMXCCGn1
    SolutionIndex: 23
    SolutionNameMin: Cijk_Alik_Bjlk_HHS_BH_UserArgs_MT128x64x128_MI16x16x1_SN_LDSB1_CLR1_GSU0_GSUC0_GSUWGMRR0_K1_LBSPPA1024_LBSPPB1024_LPB32_MIWT4_2_PLR2_SU32_SUM0_SUS256_SKXCCM0_VWA4_VWB2_WGM1_WGMXCC1_WGMXCCGn1
    SolutionIndex: 24
    SolutionNameMin: Cijk_Alik_Bjlk_HHS_BH_UserArgs_MT128x64x128_MI16x16x1_SN_LDSB1_CLR1_GSU0_GSUC0_GSUWGMRR0_K1_LBSPPA1024_LBSPPB1024_LPB16_MIWT4_2_PLR1_SU32_SUM0_SUS256_SKXCCM0_VWA4_VWB1_WGM4_WGMXCC1_WGMXCCGn1
    SolutionIndex: 25
    SolutionNameMin: Cijk_Alik_Bjlk_HHS_BH_UserArgs_MT128x64x128_MI16x16x1_SN_LDSB1_CLR1_GSU0_GSUC0_GSUWGMRR0_K1_LBSPPA512_LBSPPB1024_LPB32_MIWT4_2_PLR1_SU32_SUM0_SUS256_SKXCCM0_VWA2_VWB2_WGM4_WGMXCC1_WGMXCCGn1
    SolutionIndex: 26
    SolutionNameMin: Cijk_Alik_Bjlk_HHS_BH_UserArgs_MT128x64x128_MI16x16x1_SN_LDSB1_CLR1_GSU0_GSUC0_GSUWGMRR0_K1_LBSPPA1024_LBSPPB1024_LPB32_MIWT4_2_PLR1_SU32_SUM0_SUS256_SKXCCM0_VWA4_VWB2_WGM4_WGMXCC1_WGMXCCGn1
    SolutionIndex: 27
    SolutionNameMin: Cijk_Alik_Bjlk_HHS_BH_UserArgs_MT128x64x128_MI16x16x1_SN_LDSB1_CLR1_GSU0_GSUC0_GSUWGMRR0_K1_LBSPPA512_LBSPPB1024_LPB32_MIWT4_2_PLR2_SU32_SUM0_SUS256_SKXCCM0_VWA2_VWB2_WGM4_WGMXCC1_WGMXCCGn1
    SolutionIndex: 28
    SolutionNameMin: Cijk_Alik_Bjlk_HHS_BH_UserArgs_MT128x64x128_MI16x16x1_SN_LDSB1_CLR1_GSU0_GSUC0_GSUWGMRR0_K1_LBSPPA1024_LBSPPB1024_LPB32_MIWT4_2_PLR1_SU32_SUM0_SUS256_SKXCCM0_VWA4_VWB2_WGM8_WGMXCC1_WGMXCCGn1
    SolutionIndex: 29
    SolutionNameMin: Cijk_Alik_Bjlk_HHS_BH_UserArgs_MT128x64x128_MI16x16x1_SN_LDSB1_CLR1_GSU0_GSUC0_GSUWGMRR0_K1_LBSPPA512_LBSPPB1024_LPB32_MIWT4_2_PLR2_SU32_SUM0_SUS256_SKXCCM0_VWA2_VWB2_WGM8_WGMXCC1_WGMXCCGn1
    SolutionIndex: 30
    SolutionNameMin: Cijk_Alik_Bjlk_HHS_BH_UserArgs_MT128x64x128_MI16x16x1_SN_LDSB1_CLR1_GSU0_GSUC0_GSUWGMRR0_K1_LBSPPA1024_LBSPPB1024_LPB32_MIWT4_2_PLR2_SU32_SUM0_SUS256_SKXCCM0_VWA4_VWB2_WGM8_WGMXCC1_WGMXCCGn1
    SolutionIndex: 31
    SolutionNameMin: Cijk_Alik_Bjlk_HHS_BH_UserArgs_MT64x64x128_MI16x16x1_SN_LDSB1_CLR1_GSU0_GSUC0_GSUWGMRR0_K1_LBSPPA512_LBSPPB1024_LPB32_MIWT2_2_PLR1_SU32_SUM0_SUS256_SKXCCM0_VWA2_VWB2_WGM1_WGMXCC1_WGMXCCGn1
    SolutionIndex: 32
    SolutionNameMin: Cijk_Alik_Bjlk_HHS_BH_UserArgs_MT64x64x128_MI16x16x1_SN_LDSB1_CLR1_GSU0_GSUC0_GSUWGMRR0_K1_LBSPPA512_LBSPPB1024_LPB16_MIWT2_2_PLR2_SU32_SUM0_SUS256_SKXCCM0_VWA2_VWB1_WGM1_WGMXCC1_WGMXCCGn1
    SolutionIndex: 33
    SolutionNameMin: Cijk_Alik_Bjlk_HHS_BH_UserArgs_MT64x64x128_MI16x16x1_SN_LDSB1_CLR1_GSU0_GSUC0_GSUWGMRR0_K1_LBSPPA512_LBSPPB1024_LPB32_MIWT2_2_PLR2_SU32_SUM0_SUS256_SKXCCM0_VWA2_VWB2_WGM1_WGMXCC1_WGMXCCGn1
    SolutionIndex: 34
    SolutionNameMin: Cijk_Alik_Bjlk_HHS_BH_UserArgs_MT64x64x128_MI16x16x1_SN_LDSB1_CLR1_GSU0_GSUC0_GSUWGMRR0_K1_LBSPPA512_LBSPPB1024_LPB32_MIWT2_2_PLR2_SU32_SUM0_SUS256_SKXCCM0_VWA2_VWB2_WGM4_WGMXCC1_WGMXCCGn1
    SolutionIndex: 35
    SolutionNameMin: Cijk_Alik_Bjlk_HHS_BH_UserArgs_MT64x64x128_MI16x16x1_SN_LDSB1_CLR1_GSU0_GSUC0_GSUWGMRR0_K1_LBSPPA512_LBSPPB1024_LPB32_MIWT2_2_PLR2_SU32_SUM0_SUS256_SKXCCM0_VWA2_VWB2_WGM8_WGMXCC1_WGMXCCGn1
    SolutionIndex: 36
    SolutionNameMin: Cijk_Alik_Bjlk_HHS_BH_UserArgs_MT32x64x128_MI16x16x1_SN_LDSB1_CLR1_GSU0_GSUC0_GSUWGMRR0_K1_LBSPPA256_LBSPPB1024_LPB32_MIWT1_2_PLR2_SU32_SUM0_SUS256_SKXCCM0_VWA1_VWB2_WGM1_WGMXCC1_WGMXCCGn1
    SolutionIndex: 37
    SolutionNameMin: Cijk_Alik_Bjlk_HHS_BH_UserArgs_MT64x32x128_MI16x16x1_SN_LDSB1_CLR1_GSU0_GSUC0_GSUWGMRR0_K1_LBSPPA512_LBSPPB512_LPB16_MIWT2_1_PLR2_SU32_SUM0_SUS256_SKXCCM0_VWA2_VWB1_WGM1_WGMXCC1_WGMXCCGn1
    SolutionIndex: 38
    SolutionNameMin: Cijk_Alik_Bjlk_HHS_BH_UserArgs_MT64x32x128_MI16x16x1_SN_LDSB1_CLR1_GSU0_GSUC0_GSUWGMRR0_K1_LBSPPA256_LBSPPB512_LPB16_MIWT2_1_PLR2_SU32_SUM0_SUS256_SKXCCM0_VWA1_VWB1_WGM8_WGMXCC1_WGMXCCGn1
    SolutionIndex: 39
    SolutionNameMin: Cijk_Alik_Bjlk_HHS_BH_UserArgs_MT32x32x128_MI16x16x1_SN_LDSB1_CLR1_GSU0_GSUC0_GSUWGMRR0_K1_LBSPPA256_LBSPPB512_LPB16_MIWT1_1_PLR1_SU32_SUM0_SUS256_SKXCCM0_VWA1_VWB1_WGM1_WGMXCC1_WGMXCCGn1
    SolutionIndex: 40
    SolutionNameMin: Cijk_Alik_Bjlk_HHS_BH_UserArgs_MT32x32x128_MI16x16x1_SN_LDSB1_CLR1_GSU0_GSUC0_GSUWGMRR0_K1_LBSPPA256_LBSPPB512_LPB16_MIWT1_1_PLR2_SU32_SUM0_SUS256_SKXCCM0_VWA1_VWB1_WGM1_WGMXCC1_WGMXCCGn1
    SolutionIndex: 41
    SolutionNameMin: Cijk_Alik_Bjlk_HHS_BH_UserArgs_MT32x32x128_MI16x16x1_SN_LDSB1_CLR1_GSU0_GSUC0_GSUWGMRR0_K1_LBSPPA256_LBSPPB512_LPB16_MIWT1_1_PLR2_SU32_SUM0_SUS256_SKXCCM0_VWA1_VWB1_WGM8_WGMXCC1_WGMXCCGn1
    SolutionIndex: 42
    SolutionNameMin: Cijk_Alik_Bjlk_HHS_BH_UserArgs_MT256x256x32_MI16x16x1_SN_LDSB1_CLR1_GSU0_GSUC0_GSUWGMRR0_K1_LBSPPA256_LBSPPB2048_LPB32_MIWT8_8_PLR1_SU32_SUM0_SUS256_SKXCCM8_VWA4_VWB2_WGM1_WGMXCC1_WGMXCCGn1
    SolutionIndex: 43
    SolutionNameMin: Cijk_Alik_Bjlk_HHS_BH_UserArgs_MT256x256x32_MI16x16x1_SN_LDSB1_CLR1_GSU0_GSUC0_GSUWGMRR0_K1_LBSPPA128_LBSPPB2048_LPB0_MIWT8_8_PLR1_SU32_SUM0_SUS256_SKXCCM8_VWA1_VWB8_WGM1_WGMXCC1_WGMXCCGn1
    SolutionIndex: 44
    SolutionNameMin: Cijk_Alik_Bjlk_HHS_BH_UserArgs_MT256x256x32_MI16x16x1_SN_LDSB1_CLR1_GSU0_GSUC0_GSUWGMRR0_K1_LBSPPA256_LBSPPB2048_LPB0_MIWT8_8_PLR1_SU32_SUM0_SUS256_SKXCCM8_VWA4_VWB8_WGM1_WGMXCC1_WGMXCCGn1
    SolutionIndex: 45
    SolutionNameMin: Cijk_Alik_Bjlk_HHS_BH_UserArgs_MT256x256x32_MI16x16x1_SN_LDSB1_CLR1_GSU0_GSUC0_GSUWGMRR0_K1_LBSPPA256_LBSPPB2048_LPB0_MIWT8_8_PLR1_SU32_SUM0_SUS256_SKXCCM8_VWA4_VWB4_WGM8_WGMXCC1_WGMXCCGn1
    SolutionIndex: 46
    SolutionNameMin: Cijk_Alik_Bjlk_HHS_BH_UserArgs_MT256x256x32_MI16x16x1_SN_LDSB1_CLR1_GSU0_GSUC0_GSUWGMRR0_K1_LBSPPA128_LBSPPB2048_LPB0_MIWT8_8_PLR1_SU32_SUM0_SUS256_SKXCCM8_VWA2_VWB8_WGM8_WGMXCC1_WGMXCCGn1
    SolutionIndex: 47
    SolutionNameMin: Cijk_Alik_Bjlk_HHS_BH_UserArgs_MT256x256x32_MI16x16x1_SN_LDSB1_CLR1_GSU0_GSUC0_GSUWGMRR0_K1_LBSPPA256_LBSPPB2048_LPB0_MIWT8_8_PLR1_SU32_SUM0_SUS256_SKXCCM8_VWA4_VWB8_WGM8_WGMXCC1_WGMXCCGn1
    SolutionIndex: 48
    SolutionNameMin: Cijk_Alik_Bjlk_HHS_BH_UserArgs_MT128x256x32_MI16x16x1_SN_LDSB1_CLR1_GSU0_GSUC0_GSUWGMRR0_K1_LBSPPA256_LBSPPB2048_LPB0_MIWT4_8_PLR1_SU32_SUM0_SUS256_SKXCCM8_VWA4_VWB8_WGM1_WGMXCC1_WGMXCCGn1
    SolutionIndex: 49
    SolutionNameMin: Cijk_Alik_Bjlk_HHS_BH_UserArgs_MT128x256x32_MI16x16x1_SN_LDSB1_CLR1_GSU0_GSUC0_GSUWGMRR0_K1_LBSPPA256_LBSPPB2048_LPB0_MIWT4_8_PLR1_SU32_SUM0_SUS256_SKXCCM8_VWA4_VWB8_WGM4_WGMXCC1_WGMXCCGn1
    SolutionIndex: 50
    SolutionNameMin: Cijk_Alik_Bjlk_HHS_BH_UserArgs_MT128x256x32_MI16x16x1_SN_LDSB1_CLR1_GSU0_GSUC0_GSUWGMRR0_K1_LBSPPA256_LBSPPB2048_LPB0_MIWT4_8_PLR1_SU32_SUM0_SUS256_SKXCCM8_VWA4_VWB4_WGM8_WGMXCC1_WGMXCCGn1
    SolutionIndex: 51
    SolutionNameMin: Cijk_Alik_Bjlk_HHS_BH_UserArgs_MT128x256x32_MI16x16x1_SN_LDSB1_CLR1_GSU0_GSUC0_GSUWGMRR0_K1_LBSPPA256_LBSPPB2048_LPB0_MIWT4_8_PLR1_SU32_SUM0_SUS256_SKXCCM8_VWA4_VWB8_WGM8_WGMXCC1_WGMXCCGn1
    SolutionIndex: 52
    SolutionNameMin: Cijk_Alik_Bjlk_HHS_BH_UserArgs_MT32x32x32_MI16x16x1_SN_LDSB0_CLR1_GSU0_GSUC0_GSUWGMRR0_K1_LBSPPA128_LBSPPB256_LPB16_MIWT1_1_PLR1_SU32_SUM0_SUS256_SKXCCM8_VWA1_VWB1_WGM1_WGMXCC1_WGMXCCGn1
    SolutionIndex: 53
    SolutionNameMin: Cijk_Alik_Bjlk_HHS_BH_UserArgs_MT32x32x32_MI16x16x1_SN_LDSB0_CLR0_GSU0_GSUC0_GSUWGMRR0_K1_LBSPPA128_LBSPPB256_LPB16_MIWT1_1_PLR0_SU32_SUM0_SUS256_SKXCCM8_VWA1_VWB1_WGM1_WGMXCC1_WGMXCCGn1
    SolutionIndex: 54
    SolutionNameMin: Cijk_Alik_Bjlk_HHS_BH_UserArgs_MT128x256x64_MI16x16x1_SN_LDSB1_CLR1_GSU0_GSUC0_GSUWGMRR0_K1_LBSPPA512_LBSPPB4096_LPB32_MIWT4_8_PLR1_SU32_SUM0_SUS256_SKXCCM8_VWA4_VWB2_WGM1_WGMXCC1_WGMXCCGn1
    SolutionIndex: 55
    SolutionNameMin: Cijk_Alik_Bjlk_HHS_BH_UserArgs_MT128x256x64_MI16x16x1_SN_LDSB1_CLR1_GSU0_GSUC0_GSUWGMRR0_K1_LBSPPA256_LBSPPB4096_LPB32_MIWT4_8_PLR1_SU32_SUM0_SUS256_SKXCCM8_VWA2_VWB2_WGM4_WGMXCC1_WGMXCCGn1
    SolutionIndex: 56
    SolutionNameMin: Cijk_Alik_Bjlk_HHS_BH_UserArgs_MT128x256x64_MI16x16x1_SN_LDSB1_CLR1_GSU0_GSUC0_GSUWGMRR0_K1_LBSPPA512_LBSPPB4096_LPB32_MIWT4_8_PLR1_SU32_SUM0_SUS256_SKXCCM8_VWA4_VWB2_WGM4_WGMXCC1_WGMXCCGn1
    SolutionIndex: 57
    SolutionNameMin: Cijk_Alik_Bjlk_HHS_BH_UserArgs_MT256x128x64_MI16x16x1_SN_LDSB1_CLR1_GSU0_GSUC0_GSUWGMRR0_K1_LBSPPA512_LBSPPB2048_LPB0_MIWT8_4_PLR1_SU32_SUM0_SUS256_SKXCCM8_VWA4_VWB4_WGM1_WGMXCC1_WGMXCCGn1
    SolutionIndex: 58
    SolutionNameMin: Cijk_Alik_Bjlk_HHS_BH_UserArgs_MT256x128x64_MI16x16x1_SN_LDSB1_CLR1_GSU0_GSUC0_GSUWGMRR0_K1_LBSPPA512_LBSPPB2048_LPB0_MIWT8_4_PLR1_SU32_SUM0_SUS256_SKXCCM8_VWA4_VWB4_WGM4_WGMXCC1_WGMXCCGn1
    SolutionIndex: 59
    SolutionNameMin: Cijk_Alik_Bjlk_HHS_BH_UserArgs_MT256x128x64_MI16x16x1_SN_LDSB1_CLR1_GSU0_GSUC0_GSUWGMRR0_K1_LBSPPA512_LBSPPB2048_LPB0_MIWT8_4_PLR1_SU32_SUM0_SUS256_SKXCCM8_VWA4_VWB4_WGM8_WGMXCC1_WGMXCCGn1
    SolutionIndex: 60
    SolutionNameMin: Cijk_Alik_Bjlk_HHS_BH_UserArgs_MT128x128x64_MI16x16x1_SN_LDSB1_CLR1_GSU0_GSUC0_GSUWGMRR0_K1_LBSPPA256_LBSPPB2048_LPB0_MIWT4_4_PLR1_SU32_SUM0_SUS256_SKXCCM8_VWA2_VWB4_WGM1_WGMXCC1_WGMXCCGn1
    SolutionIndex: 61
    SolutionNameMin: Cijk_Alik_Bjlk_HHS_BH_UserArgs_MT128x128x64_MI16x16x1_SN_LDSB1_CLR1_GSU0_GSUC0_GSUWGMRR0_K1_LBSPPA512_LBSPPB2048_LPB0_MIWT4_4_PLR1_SU32_SUM0_SUS256_SKXCCM8_VWA4_VWB4_WGM1_WGMXCC1_WGMXCCGn1
    SolutionIndex: 62
    SolutionNameMin: Cijk_Alik_Bjlk_HHS_BH_UserArgs_MT128x128x64_MI16x16x1_SN_LDSB1_CLR1_GSU0_GSUC0_GSUWGMRR0_K1_LBSPPA512_LBSPPB2048_LPB0_MIWT4_4_PLR1_SU32_SUM0_SUS256_SKXCCM8_VWA4_VWB4_WGM4_WGMXCC1_WGMXCCGn1
    SolutionIndex: 63
    SolutionNameMin: Cijk_Alik_Bjlk_HHS_BH_UserArgs_MT128x128x64_MI16x16x1_SN_LDSB1_CLR1_GSU0_GSUC0_GSUWGMRR0_K1_LBSPPA256_LBSPPB2048_LPB0_MIWT4_4_PLR1_SU32_SUM0_SUS256_SKXCCM8_VWA2_VWB4_WGM8_WGMXCC1_WGMXCCGn1
    SolutionIndex: 64
    SolutionNameMin: Cijk_Alik_Bjlk_HHS_BH_UserArgs_MT128x128x64_MI16x16x1_SN_LDSB1_CLR1_GSU0_GSUC0_GSUWGMRR0_K1_LBSPPA512_LBSPPB2048_LPB0_MIWT4_4_PLR1_SU32_SUM0_SUS256_SKXCCM8_VWA4_VWB4_WGM8_WGMXCC1_WGMXCCGn1
    SolutionIndex: 65
    SolutionNameMin: Cijk_Alik_Bjlk_HHS_BH_UserArgs_MT64x128x64_MI16x16x1_SN_LDSB1_CLR1_GSU0_GSUC0_GSUWGMRR0_K1_LBSPPA256_LBSPPB2048_LPB0_MIWT2_4_PLR1_SU32_SUM0_SUS256_SKXCCM8_VWA2_VWB4_WGM1_WGMXCC1_WGMXCCGn1
    SolutionIndex: 66
    SolutionNameMin: Cijk_Alik_Bjlk_HHS_BH_UserArgs_MT128x64x64_MI16x16x1_SN_LDSB1_CLR1_GSU0_GSUC0_GSUWGMRR0_K1_LBSPPA512_LBSPPB1024_LPB32_MIWT4_2_PLR1_SU32_SUM0_SUS256_SKXCCM8_VWA4_VWB2_WGM1_WGMXCC1_WGMXCCGn1
    SolutionIndex: 67
    SolutionNameMin: Cijk_Alik_Bjlk_HHS_BH_UserArgs_MT128x64x64_MI16x16x1_SN_LDSB1_CLR1_GSU0_GSUC0_GSUWGMRR0_K1_LBSPPA256_LBSPPB1024_LPB32_MIWT4_2_PLR1_SU32_SUM0_SUS256_SKXCCM8_VWA2_VWB2_WGM8_WGMXCC1_WGMXCCGn1
    SolutionIndex: 68
    SolutionNameMin: Cijk_Alik_Bjlk_HHS_BH_UserArgs_MT128x64x64_MI16x16x1_SN_LDSB1_CLR1_GSU0_GSUC0_GSUWGMRR0_K1_LBSPPA512_LBSPPB1024_LPB32_MIWT4_2_PLR1_SU32_SUM0_SUS256_SKXCCM8_VWA4_VWB2_WGM8_WGMXCC1_WGMXCCGn1
    SolutionIndex: 69
    SolutionNameMin: Cijk_Alik_Bjlk_HHS_BH_UserArgs_MT64x64x64_MI16x16x1_SN_LDSB1_CLR1_GSU0_GSUC0_GSUWGMRR0_K1_LBSPPA128_LBSPPB1024_LPB32_MIWT2_2_PLR1_SU32_SUM0_SUS256_SKXCCM8_VWA1_VWB2_WGM4_WGMXCC1_WGMXCCGn1
    SolutionIndex: 70
    SolutionNameMin: Cijk_Alik_Bjlk_HHS_BH_UserArgs_MT64x64x64_MI16x16x1_SN_LDSB1_CLR1_GSU0_GSUC0_GSUWGMRR0_K1_LBSPPA256_LBSPPB1024_LPB32_MIWT2_2_PLR1_SU32_SUM0_SUS256_SKXCCM8_VWA2_VWB2_WGM4_WGMXCC1_WGMXCCGn1
    SolutionIndex: 71
    SolutionNameMin: Cijk_Alik_Bjlk_HHS_BH_UserArgs_MT64x64x64_MI16x16x1_SN_LDSB1_CLR1_GSU0_GSUC0_GSUWGMRR0_K1_LBSPPA128_LBSPPB1024_LPB32_MIWT2_2_PLR1_SU32_SUM0_SUS256_SKXCCM8_VWA1_VWB2_WGM8_WGMXCC1_WGMXCCGn1
    SolutionIndex: 72
    SolutionNameMin: Cijk_Alik_Bjlk_HHS_BH_UserArgs_MT64x64x64_MI16x16x1_SN_LDSB1_CLR1_GSU0_GSUC0_GSUWGMRR0_K1_LBSPPA256_LBSPPB1024_LPB32_MIWT2_2_PLR1_SU32_SUM0_SUS256_SKXCCM8_VWA2_VWB2_WGM8_WGMXCC1_WGMXCCGn1
    SolutionIndex: 73
    SolutionNameMin: Cijk_Alik_Bjlk_HHS_BH_UserArgs_MT32x64x64_MI16x16x1_SN_LDSB0_CLR1_GSU0_GSUC0_GSUWGMRR0_K1_LBSPPA128_LBSPPB1024_LPB32_MIWT1_2_PLR1_SU32_SUM0_SUS256_SKXCCM8_VWA1_VWB2_WGM4_WGMXCC1_WGMXCCGn1
    SolutionIndex: 74
    SolutionNameMin: Cijk_Alik_Bjlk_HHS_BH_UserArgs_MT32x32x64_MI16x16x1_SN_LDSB0_CLR1_GSU0_GSUC0_GSUWGMRR0_K1_LBSPPA128_LBSPPB512_LPB16_MIWT1_1_PLR1_SU32_SUM0_SUS256_SKXCCM8_VWA1_VWB1_WGM1_WGMXCC1_WGMXCCGn1
    SolutionIndex: 75
    SolutionNameMin: Cijk_Alik_Bjlk_HHS_BH_UserArgs_MT64x128x128_MI16x16x1_SN_LDSB1_CLR1_GSU0_GSUC0_GSUWGMRR0_K1_LBSPPA512_LBSPPB2048_LPB0_MIWT2_4_PLR1_SU32_SUM0_SUS256_SKXCCM8_VWA2_VWB4_WGM1_WGMXCC1_WGMXCCGn1
    SolutionIndex: 76
    SolutionNameMin: Cijk_Alik_Bjlk_HHS_BH_UserArgs_MT64x128x128_MI16x16x1_SN_LDSB1_CLR1_GSU0_GSUC0_GSUWGMRR0_K1_LBSPPA512_LBSPPB2048_LPB0_MIWT2_4_PLR2_SU32_SUM0_SUS256_SKXCCM8_VWA2_VWB4_WGM1_WGMXCC1_WGMXCCGn1
    SolutionIndex: 77
    SolutionNameMin: Cijk_Alik_Bjlk_HHS_BH_UserArgs_MT64x128x128_MI16x16x1_SN_LDSB1_CLR1_GSU0_GSUC0_GSUWGMRR0_K1_LBSPPA512_LBSPPB2048_LPB0_MIWT2_4_PLR1_SU32_SUM0_SUS256_SKXCCM8_VWA2_VWB4_WGM8_WGMXCC1_WGMXCCGn1
    SolutionIndex: 78
    SolutionNameMin: Cijk_Alik_Bjlk_HHS_BH_UserArgs_MT64x128x128_MI16x16x1_SN_LDSB1_CLR1_GSU0_GSUC0_GSUWGMRR0_K1_LBSPPA256_LBSPPB2048_LPB0_MIWT2_4_PLR2_SU32_SUM0_SUS256_SKXCCM8_VWA1_VWB4_WGM8_WGMXCC1_WGMXCCGn1
    SolutionIndex: 79
    SolutionNameMin: Cijk_Alik_Bjlk_HHS_BH_UserArgs_MT128x64x128_MI16x16x1_SN_LDSB1_CLR1_GSU0_GSUC0_GSUWGMRR0_K1_LBSPPA512_LBSPPB1024_LPB32_MIWT4_2_PLR1_SU32_SUM0_SUS256_SKXCCM8_VWA2_VWB2_WGM1_WGMXCC1_WGMXCCGn1
    SolutionIndex: 80
    SolutionNameMin: Cijk_Alik_Bjlk_HHS_BH_UserArgs_MT128x64x128_MI16x16x1_SN_LDSB1_CLR1_GSU0_GSUC0_GSUWGMRR0_K1_LBSPPA1024_LBSPPB1024_LPB16_MIWT4_2_PLR2_SU32_SUM0_SUS256_SKXCCM8_VWA4_VWB1_WGM1_WGMXCC1_WGMXCCGn1
    SolutionIndex: 81
    SolutionNameMin: Cijk_Alik_Bjlk_HHS_BH_UserArgs_MT128x64x128_MI16x16x1_SN_LDSB1_CLR1_GSU0_GSUC0_GSUWGMRR0_K1_LBSPPA512_LBSPPB1024_LPB32_MIWT4_2_PLR2_SU32_SUM0_SUS256_SKXCCM8_VWA2_VWB2_WGM1_WGMXCC1_WGMXCCGn1
    SolutionIndex: 82
    SolutionNameMin: Cijk_Alik_Bjlk_HHS_BH_UserArgs_MT128x64x128_MI16x16x1_SN_LDSB1_CLR1_GSU0_GSUC0_GSUWGMRR0_K1_LBSPPA1024_LBSPPB1024_LPB32_MIWT4_2_PLR2_SU32_SUM0_SUS256_SKXCCM8_VWA4_VWB2_WGM1_WGMXCC1_WGMXCCGn1
    SolutionIndex: 83
    SolutionNameMin: Cijk_Alik_Bjlk_HHS_BH_UserArgs_MT128x64x128_MI16x16x1_SN_LDSB1_CLR1_GSU0_GSUC0_GSUWGMRR0_K1_LBSPPA1024_LBSPPB1024_LPB32_MIWT4_2_PLR2_SU32_SUM0_SUS256_SKXCCM8_VWA4_VWB2_WGM4_WGMXCC1_WGMXCCGn1
    SolutionIndex: 84
    SolutionNameMin: Cijk_Alik_Bjlk_HHS_BH_UserArgs_MT128x64x128_MI16x16x1_SN_LDSB1_CLR1_GSU0_GSUC0_GSUWGMRR0_K1_LBSPPA1024_LBSPPB1024_LPB32_MIWT4_2_PLR1_SU32_SUM0_SUS256_SKXCCM8_VWA4_VWB2_WGM8_WGMXCC1_WGMXCCGn1
    SolutionIndex: 85
    SolutionNameMin: Cijk_Alik_Bjlk_HHS_BH_UserArgs_MT128x64x128_MI16x16x1_SN_LDSB1_CLR1_GSU0_GSUC0_GSUWGMRR0_K1_LBSPPA512_LBSPPB1024_LPB32_MIWT4_2_PLR2_SU32_SUM0_SUS256_SKXCCM8_VWA2_VWB2_WGM8_WGMXCC1_WGMXCCGn1
    SolutionIndex: 86
    SolutionNameMin: Cijk_Alik_Bjlk_HHS_BH_UserArgs_MT128x64x128_MI16x16x1_SN_LDSB1_CLR1_GSU0_GSUC0_GSUWGMRR0_K1_LBSPPA1024_LBSPPB1024_LPB32_MIWT4_2_PLR2_SU32_SUM0_SUS256_SKXCCM8_VWA4_VWB2_WGM8_WGMXCC1_WGMXCCGn1
    SolutionIndex: 87
    SolutionNameMin: Cijk_Alik_Bjlk_HHS_BH_UserArgs_MT64x64x128_MI16x16x1_SN_LDSB1_CLR1_GSU0_GSUC0_GSUWGMRR0_K1_LBSPPA512_LBSPPB1024_LPB16_MIWT2_2_PLR1_SU32_SUM0_SUS256_SKXCCM8_VWA2_VWB1_WGM1_WGMXCC1_WGMXCCGn1
    SolutionIndex: 88
    SolutionNameMin: Cijk_Alik_Bjlk_HHS_BH_UserArgs_MT64x64x128_MI16x16x1_SN_LDSB1_CLR1_GSU0_GSUC0_GSUWGMRR0_K1_LBSPPA512_LBSPPB1024_LPB32_MIWT2_2_PLR1_SU32_SUM0_SUS256_SKXCCM8_VWA2_VWB2_WGM1_WGMXCC1_WGMXCCGn1
    SolutionIndex: 89
    SolutionNameMin: Cijk_Alik_Bjlk_HHS_BH_UserArgs_MT64x64x128_MI16x16x1_SN_LDSB1_CLR1_GSU0_GSUC0_GSUWGMRR0_K1_LBSPPA256_LBSPPB1024_LPB32_MIWT2_2_PLR2_SU32_SUM0_SUS256_SKXCCM8_VWA1_VWB2_WGM1_WGMXCC1_WGMXCCGn1
    SolutionIndex: 90
    SolutionNameMin: Cijk_Alik_Bjlk_HHS_BH_UserArgs_MT64x64x128_MI16x16x1_SN_LDSB1_CLR1_GSU0_GSUC0_GSUWGMRR0_K1_LBSPPA512_LBSPPB1024_LPB32_MIWT2_2_PLR2_SU32_SUM0_SUS256_SKXCCM8_VWA2_VWB2_WGM1_WGMXCC1_WGMXCCGn1
    SolutionIndex: 91
    SolutionNameMin: Cijk_Alik_Bjlk_HHS_BH_UserArgs_MT64x64x128_MI16x16x1_SN_LDSB1_CLR1_GSU0_GSUC0_GSUWGMRR0_K1_LBSPPA256_LBSPPB1024_LPB32_MIWT2_2_PLR2_SU32_SUM0_SUS256_SKXCCM8_VWA1_VWB2_WGM4_WGMXCC1_WGMXCCGn1
    SolutionIndex: 92
    SolutionNameMin: Cijk_Alik_Bjlk_HHS_BH_UserArgs_MT64x64x128_MI16x16x1_SN_LDSB1_CLR1_GSU0_GSUC0_GSUWGMRR0_K1_LBSPPA512_LBSPPB1024_LPB32_MIWT2_2_PLR2_SU32_SUM0_SUS256_SKXCCM8_VWA2_VWB2_WGM4_WGMXCC1_WGMXCCGn1
    SolutionIndex: 93
    SolutionNameMin: Cijk_Alik_Bjlk_HHS_BH_UserArgs_MT64x64x128_MI16x16x1_SN_LDSB1_CLR1_GSU0_GSUC0_GSUWGMRR0_K1_LBSPPA512_LBSPPB1024_LPB32_MIWT2_2_PLR2_SU32_SUM0_SUS256_SKXCCM8_VWA2_VWB2_WGM8_WGMXCC1_WGMXCCGn1
    SolutionIndex: 94
    SolutionNameMin: Cijk_Alik_Bjlk_HHS_BH_UserArgs_MT32x64x128_MI16x16x1_SN_LDSB1_CLR1_GSU0_GSUC0_GSUWGMRR0_K1_LBSPPA256_LBSPPB1024_LPB32_MIWT1_2_PLR2_SU32_SUM0_SUS256_SKXCCM8_VWA1_VWB2_WGM1_WGMXCC1_WGMXCCGn1
    SolutionIndex: 95
    SolutionNameMin: Cijk_Alik_Bjlk_HHS_BH_UserArgs_MT32x64x128_MI16x16x1_SN_LDSB1_CLR1_GSU0_GSUC0_GSUWGMRR0_K1_LBSPPA256_LBSPPB1024_LPB32_MIWT1_2_PLR2_SU32_SUM0_SUS256_SKXCCM8_VWA1_VWB2_WGM8_WGMXCC1_WGMXCCGn1
    SolutionIndex: 96
    SolutionNameMin: Cijk_Alik_Bjlk_HHS_BH_UserArgs_MT64x32x128_MI16x16x1_SN_LDSB1_CLR1_GSU0_GSUC0_GSUWGMRR0_K1_LBSPPA512_LBSPPB512_LPB16_MIWT2_1_PLR2_SU32_SUM0_SUS256_SKXCCM8_VWA2_VWB1_WGM1_WGMXCC1_WGMXCCGn1
    SolutionIndex: 97
    SolutionNameMin: Cijk_Alik_Bjlk_HHS_BH_UserArgs_MT32x32x128_MI16x16x1_SN_LDSB1_CLR1_GSU0_GSUC0_GSUWGMRR0_K1_LBSPPA256_LBSPPB512_LPB16_MIWT1_1_PLR1_SU32_SUM0_SUS256_SKXCCM8_VWA1_VWB1_WGM1_WGMXCC1_WGMXCCGn1
    SolutionIndex: 98
    SolutionNameMin: Cijk_Alik_Bjlk_HHS_BH_UserArgs_MT32x32x128_MI16x16x1_SN_LDSB1_CLR1_GSU0_GSUC0_GSUWGMRR0_K1_LBSPPA256_LBSPPB512_LPB16_MIWT1_1_PLR2_SU32_SUM0_SUS256_SKXCCM8_VWA1_VWB1_WGM1_WGMXCC1_WGMXCCGn1
    SolutionIndex: 99
    SolutionNameMin: Cijk_Alik_Bjlk_HHS_BH_UserArgs_MT32x32x128_MI16x16x1_SN_LDSB1_CLR1_GSU0_GSUC0_GSUWGMRR0_K1_LBSPPA256_LBSPPB512_LPB16_MIWT1_1_PLR1_SU32_SUM0_SUS256_SKXCCM8_VWA1_VWB1_WGM4_WGMXCC1_WGMXCCGn1
    SolutionIndex: 100
    SolutionNameMin: Cijk_Alik_Bjlk_HHS_BH_UserArgs_MT32x32x32_MI16x16x1_SN_LDSB0_CLR1_GSU0_GSUC0_GSUWGMRR0_K1_LBSPPA128_LBSPPB256_LPB16_MIWT1_1_PLR1_SU32_SUM0_SUS256_SKXCCM0_VWA1_VWB1_WGM1_WGMXCC1_WGMXCCGn1
- - - [128, 128, 1, 128, 128, 128, 128, 128]
    - [98, 0.086]
  - - [128, 128, 1, 256, 128, 128, 256, 128]
    - [39, 0.106]
  - - [128, 128, 1, 512, 128, 128, 512, 128]
    - [40, 0.18]
  - - [128, 128, 1, 1024, 128, 128, 1024, 128]
    - [97, 0.267]
  - - [128, 128, 1, 2048, 128, 128, 2048, 128]
    - [98, 0.34]
  - - [128, 128, 1, 4096, 128, 128, 4096, 128]
    - [3, 0.532]
  - - [128, 128, 1, 8192, 128, 128, 8192, 128]
    - [53, 1.058]
  - - [128, 256, 1, 128, 128, 128, 128, 256]
    - [39, 0.168]
  - - [128, 256, 1, 256, 128, 128, 256, 256]
    - [40, 0.208]
  - - [128, 256, 1, 512, 128, 128, 512, 256]
    - [39, 0.339]
  - - [128, 256, 1, 1024, 128, 128, 1024, 256]
    - [97, 0.509]
  - - [128, 256, 1, 2048, 128, 128, 2048, 256]
    - [3, 0.787]
  - - [128, 256, 1, 4096, 128, 128, 4096, 256]
    - [52, 1.514]
  - - [128, 256, 1, 8192, 128, 128, 8192, 256]
    - [97, 2.64]
  - - [128, 512, 1, 128, 128, 128, 128, 512]
    - [40, 0.332]
  - - [128, 512, 1, 256, 128, 128, 256, 512]
    - [39, 0.406]
  - - [128, 512, 1, 512, 128, 128, 512, 512]
    - [98, 0.673]
  - - [128, 512, 1, 1024, 128, 128, 1024, 512]
    - [74, 1.104]
  - - [128, 512, 1, 2048, 128, 128, 2048, 512]
    - [39, 2.023]
  - - [128, 512, 1, 4096, 128, 128, 4096, 512]
    - [98, 3.336]
  - - [128, 512, 1, 8192, 128, 128, 8192, 512]
    - [74, 4.683]
  - - [128, 1024, 1, 128, 128, 128, 128, 1024]
    - [40, 0.66]
  - - [128, 1024, 1, 256, 128, 128, 256, 1024]
    - [40, 0.768]
  - - [128, 1024, 1, 512, 128, 128, 512, 1024]
    - [98, 1.402]
  - - [128, 1024, 1, 1024, 128, 128, 1024, 1024]
    - [98, 2.343]
  - - [128, 1024, 1, 2048, 128, 128, 2048, 1024]
    - [41, 3.85]
  - - [128, 1024, 1, 4096, 128, 128, 4096, 1024]
    - [38, 5.271]
  - - [128, 1024, 1, 8192, 128, 128, 8192, 1024]
    - [73, 7.225]
  - - [128, 2048, 1, 128, 128, 128, 128, 2048]
    - [40, 1.259]
  - - [128, 2048, 1, 256, 128, 128, 256, 2048]
    - [97, 1.537]
  - - [128, 2048, 1, 512, 128, 128, 512, 2048]
    - [39, 2.553]
  - - [128, 2048, 1, 1024, 128, 128, 1024, 2048]
    - [94, 4.19]
  - - [128, 2048, 1, 2048, 128, 128, 2048, 2048]
    - [94, 6.595]
  - - [128, 2048, 1, 4096, 128, 128, 4096, 2048]
    - [18, 8.264]
  - - [128, 2048, 1, 8192, 128, 128, 8192, 2048]
    - [70, 11.334]
  - - [128, 4096, 1, 128, 128, 128, 128, 4096]
    - [37, 2.352]
  - - [128, 4096, 1, 256, 128, 128, 256, 4096]
    - [36, 2.942]
  - - [128, 4096, 1, 512, 128, 128, 512, 4096]
    - [94, 4.73]
  - - [128, 4096, 1, 1024, 128, 128, 1024, 4096]
    - [94, 7.157]
  - - [128, 4096, 1, 2048, 128, 128, 2048, 4096]
    - [89, 9.86]
  - - [128, 4096, 1, 4096, 128, 128, 4096, 4096]
    - [66, 12.917]
  - - [128, 4096, 1, 8192, 128, 128, 8192, 4096]
    - [23, 15.942]
  - - [128, 8192, 1, 128, 128, 128, 128, 8192]
    - [31, 4.203]
  - - [128, 8192, 1, 256, 128, 128, 256, 8192]
    - [33, 5.105]
  - - [128, 8192, 1, 512, 128, 128, 512, 8192]
    - [88, 7.858]
  - - [128, 8192, 1, 1024, 128, 128, 1024, 8192]
    - [89, 10.916]
  - - [128, 8192, 1, 2048, 128, 128, 2048, 8192]
    - [17, 13.756]
  - - [128, 8192, 1, 4096, 128, 128, 4096, 8192]
    - [68, 17.055]
  - - [128, 8192, 1, 8192, 128, 128, 8192, 8192]
    - [62, 21.162]
  - - [256, 128, 1, 128, 256, 256, 128, 128]
    - [39, 0.17]
  - - [256, 128, 1, 256, 256, 256, 256, 128]
    - [39, 0.203]
  - - [256, 128, 1, 512, 256, 256, 512, 128]
    - [97, 0.338]
  - - [256, 128, 1, 1024, 256, 256, 1024, 128]
    - [98, 0.517]
  - - [256, 128, 1, 2048, 256, 256, 2048, 128]
    - [53, 0.78]
  - - [256, 128, 1, 4096, 256, 256, 4096, 128]
    - [53, 1.501]
  - - [256, 128, 1, 8192, 256, 256, 8192, 128]
    - [39, 2.711]
  - - [256, 256, 1, 128, 256, 256, 128, 256]
    - [40, 0.325]
  - - [256, 256, 1, 256, 256, 256, 256, 256]
    - [40, 0.404]
  - - [256, 256, 1, 512, 256, 256, 512, 256]
    - [97, 0.68]
  - - [256, 256, 1, 1024, 256, 256, 1024, 256]
    - [98, 1.089]
  - - [256, 256, 1, 2048, 256, 256, 2048, 256]
    - [39, 1.996]
  - - [256, 256, 1, 4096, 256, 256, 4096, 256]
    - [74, 3.37]
  - - [256, 256, 1, 8192, 256, 256, 8192, 256]
    - [94, 4.729]
  - - [256, 512, 1, 128, 256, 256, 128, 512]
    - [40, 0.646]
  - - [256, 512, 1, 256, 256, 256, 256, 512]
    - [97, 0.765]
  - - [256, 512, 1, 512, 256, 256, 512, 512]
    - [98, 1.378]
  - - [256, 512, 1, 1024, 256, 256, 1024, 512]
    - [97, 2.276]
  - - [256, 512, 1, 2048, 256, 256, 2048, 512]
    - [39, 3.838]
  - - [256, 512, 1, 4096, 256, 256, 4096, 512]
    - [94, 5.737]
  - - [256, 512, 1, 8192, 256, 256, 8192, 512]
    - [94, 7.358]
  - - [256, 1024, 1, 128, 256, 256, 128, 1024]
    - [39, 1.207]
  - - [256, 1024, 1, 256, 256, 256, 256, 1024]
    - [40, 1.595]
  - - [256, 1024, 1, 512, 256, 256, 512, 1024]
    - [97, 2.586]
  - - [256, 1024, 1, 1024, 256, 256, 1024, 1024]
    - [94, 4.108]
  - - [256, 1024, 1, 2048, 256, 256, 2048, 1024]
    - [94, 6.538]
  - - [256, 1024, 1, 4096, 256, 256, 4096, 1024]
    - [90, 8.129]
  - - [256, 1024, 1, 8192, 256, 256, 8192, 1024]
    - [70, 11.468]
  - - [256, 2048, 1, 128, 256, 256, 128, 2048]
    - [37, 2.342]
  - - [256, 2048, 1, 256, 256, 256, 256, 2048]
    - [94, 2.957]
  - - [256, 2048, 1, 512, 256, 256, 512, 2048]
    - [94, 4.708]
  - - [256, 2048, 1, 1024, 256, 256, 1024, 2048]
    - [94, 7.247]
  - - [256, 2048, 1, 2048, 256, 256, 2048, 2048]
    - [92, 9.627]
  - - [256, 2048, 1, 4096, 256, 256, 4096, 2048]
    - [72, 12.503]
  - - [256, 2048, 1, 8192, 256, 256, 8192, 2048]
    - [68, 15.583]
  - - [256, 4096, 1, 128, 256, 256, 128, 4096]
    - [87, 4.054]
  - - [256, 4096, 1, 256, 256, 256, 256, 4096]
    - [34, 5.094]
  - - [256, 4096, 1, 512, 256, 256, 512, 4096]
    - [88, 7.858]
  - - [256, 4096, 1, 1024, 256, 256, 1024, 4096]
    - [90, 11.201]
  - - [256, 4096, 1, 2048, 256, 256, 2048, 4096]
    - [82, 14.044]
  - - [256, 4096, 1, 4096, 256, 256, 4096, 4096]
    - [68, 17.265]
  - - [256, 4096, 1, 8192, 256, 256, 8192, 4096]
    - [62, 21.289]
  - - [256, 8192, 1, 128, 256, 256, 128, 8192]
    - [20, 6.506]
  - - [256, 8192, 1, 256, 256, 256, 256, 8192]
    - [28, 7.895]
  - - [256, 8192, 1, 512, 256, 256, 512, 8192]
    - [79, 11.24]
  - - [256, 8192, 1, 1024, 256, 256, 1024, 8192]
    - [82, 15.098]
  - - [256, 8192, 1, 2048, 256, 256, 2048, 8192]
    - [82, 18.222]
  - - [256, 8192, 1, 4096, 256, 256, 4096, 8192]
    - [64, 22.777]
  - - [256, 8192, 1, 8192, 256, 256, 8192, 8192]
    - [11, 24.738]
  - - [512, 128, 1, 128, 512, 512, 128, 128]
    - [40, 0.331]
  - - [512, 128, 1, 256, 512, 512, 256, 128]
    - [39, 0.407]
  - - [512, 128, 1, 512, 512, 512, 512, 128]
    - [97, 0.676]
  - - [512, 128, 1, 1024, 512, 512, 1024, 128]
    - [97, 1.097]
  - - [512, 128, 1, 2048, 512, 512, 2048, 128]
    - [39, 1.999]
  - - [512, 128, 1, 4096, 512, 512, 4096, 128]
    - [39, 3.399]
  - - [512, 128, 1, 8192, 512, 512, 8192, 128]
    - [99, 5.33]
  - - [512, 256, 1, 128, 512, 512, 128, 256]
    - [39, 0.658]
  - - [512, 256, 1, 256, 512, 512, 256, 256]
    - [40, 0.766]
  - - [512, 256, 1, 512, 512, 512, 512, 256]
    - [97, 1.427]
  - - [512, 256, 1, 1024, 512, 512, 1024, 256]
    - [97, 2.212]
  - - [512, 256, 1, 2048, 512, 512, 2048, 256]
    - [40, 3.903]
  - - [512, 256, 1, 4096, 512, 512, 4096, 256]
    - [95, 5.848]
  - - [512, 256, 1, 8192, 512, 512, 8192, 256]
    - [94, 7.993]
  - - [512, 512, 1, 128, 512, 512, 128, 512]
    - [40, 1.259]
  - - [512, 512, 1, 256, 512, 512, 256, 512]
    - [40, 1.599]
  - - [512, 512, 1, 512, 512, 512, 512, 512]
    - [97, 2.562]
  - - [512, 512, 1, 1024, 512, 512, 1024, 512]
    - [94, 4.095]
  - - [512, 512, 1, 2048, 512, 512, 2048, 512]
    - [94, 6.701]
  - - [512, 512, 1, 4096, 512, 512, 4096, 512]
    - [91, 8.592]
  - - [512, 512, 1, 8192, 512, 512, 8192, 512]
    - [69, 11.42]
  - - [512, 1024, 1, 128, 512, 512, 128, 1024]
    - [37, 2.302]
  - - [512, 1024, 1, 256, 512, 512, 256, 1024]
    - [37, 2.926]
  - - [512, 1024, 1, 512, 512, 512, 512, 1024]
    - [94, 4.546]
  - - [512, 1024, 1, 1024, 512, 512, 1024, 1024]
    - [94, 7.174]
  - - [512, 1024, 1, 2048, 512, 512, 2048, 1024]
    - [90, 9.833]
  - - [512, 1024, 1, 4096, 512, 512, 4096, 1024]
    - [72, 12.385]
  - - [512, 1024, 1, 8192, 512, 512, 8192, 1024]
    - [86, 15.438]
  - - [512, 2048, 1, 128, 512, 512, 128, 2048]
    - [33, 4.169]
  - - [512, 2048, 1, 256, 512, 512, 256, 2048]
    - [33, 5.004]
  - - [512, 2048, 1, 512, 512, 512, 512, 2048]
    - [88, 7.856]
  - - [512, 2048, 1, 1024, 512, 512, 1024, 2048]
    - [90, 11.074]
  - - [512, 2048, 1, 2048, 512, 512, 2048, 2048]
    - [82, 13.918]
  - - [512, 2048, 1, 4096, 512, 512, 4096, 2048]
    - [68, 16.89]
  - - [512, 2048, 1, 8192, 512, 512, 8192, 2048]
    - [62, 21.099]
  - - [512, 4096, 1, 128, 512, 512, 128, 4096]
    - [21, 6.386]
  - - [512, 4096, 1, 256, 512, 512, 256, 4096]
    - [28, 8.178]
  - - [512, 4096, 1, 512, 512, 512, 512, 4096]
    - [80, 11.278]
  - - [512, 4096, 1, 1024, 512, 512, 1024, 4096]
    - [82, 15.331]
  - - [512, 4096, 1, 2048, 512, 512, 2048, 4096]
    - [83, 17.654]
  - - [512, 4096, 1, 4096, 512, 512, 4096, 4096]
    - [64, 22.55]
  - - [512, 4096, 1, 8192, 512, 512, 8192, 4096]
    - [49, 24.434]
  - - [512, 8192, 1, 128, 512, 512, 128, 8192]
    - [81, 7.698]
  - - [512, 8192, 1, 256, 512, 512, 256, 8192]
    - [19, 9.652]
  - - [512, 8192, 1, 512, 512, 512, 512, 8192]
    - [82, 13.966]
  - - [512, 8192, 1, 1024, 512, 512, 1024, 8192]
    - [61, 18.159]
  - - [512, 8192, 1, 2048, 512, 512, 2048, 8192]
    - [63, 22.205]
  - - [512, 8192, 1, 4096, 512, 512, 4096, 8192]
    - [11, 25.537]
  - - [512, 8192, 1, 8192, 512, 512, 8192, 8192]
    - [10, 27.695]
  - - [1024, 128, 1, 128, 1024, 1024, 128, 128]
    - [40, 0.656]
  - - [1024, 128, 1, 256, 1024, 1024, 256, 128]
    - [98, 0.773]
  - - [1024, 128, 1, 512, 1024, 1024, 512, 128]
    - [97, 1.406]
  - - [1024, 128, 1, 1024, 1024, 1024, 1024, 128]
    - [98, 2.262]
  - - [1024, 128, 1, 2048, 1024, 1024, 2048, 128]
    - [39, 3.879]
  - - [1024, 128, 1, 4096, 1024, 1024, 4096, 128]
    - [36, 5.872]
  - - [1024, 128, 1, 8192, 1024, 1024, 8192, 128]
    - [94, 8.107]
  - - [1024, 256, 1, 128, 1024, 1024, 128, 256]
    - [39, 1.27]
  - - [1024, 256, 1, 256, 1024, 1024, 256, 256]
    - [39, 1.597]
  - - [1024, 256, 1, 512, 1024, 1024, 512, 256]
    - [97, 2.566]
  - - [1024, 256, 1, 1024, 1024, 1024, 1024, 256]
    - [94, 4.082]
  - - [1024, 256, 1, 2048, 1024, 1024, 2048, 256]
    - [94, 6.799]
  - - [1024, 256, 1, 4096, 1024, 1024, 4096, 256]
    - [95, 9.329]
  - - [1024, 256, 1, 8192, 1024, 1024, 8192, 256]
    - [72, 11.857]
  - - [1024, 512, 1, 128, 1024, 1024, 128, 512]
    - [94, 2.296]
  - - [1024, 512, 1, 256, 1024, 1024, 256, 512]
    - [36, 2.927]
  - - [1024, 512, 1, 512, 1024, 1024, 512, 512]
    - [94, 4.648]
  - - [1024, 512, 1, 1024, 1024, 1024, 1024, 512]
    - [94, 7.146]
  - - [1024, 512, 1, 2048, 1024, 1024, 2048, 512]
    - [70, 9.987]
  - - [1024, 512, 1, 4096, 1024, 1024, 4096, 512]
    - [92, 12.757]
  - - [1024, 512, 1, 8192, 1024, 1024, 8192, 512]
    - [86, 15.484]
  - - [1024, 1024, 1, 128, 1024, 1024, 128, 1024]
    - [33, 4.213]
  - - [1024, 1024, 1, 256, 1024, 1024, 256, 1024]
    - [31, 5.15]
  - - [1024, 1024, 1, 512, 1024, 1024, 512, 1024]
    - [88, 7.846]
  - - [1024, 1024, 1, 1024, 1024, 1024, 1024, 1024]
    - [90, 10.885]
  - - [1024, 1024, 1, 2048, 1024, 1024, 2048, 1024]
    - [86, 13.844]
  - - [1024, 1024, 1, 4096, 1024, 1024, 4096, 1024]
    - [67, 16.858]
  - - [1024, 1024, 1, 8192, 1024, 1024, 8192, 1024]
    - [62, 21.491]
  - - [1024, 2048, 1, 128, 1024, 1024, 128, 2048]
    - [27, 6.461]
  - - [1024, 2048, 1, 256, 1024, 1024, 256, 2048]
    - [28, 8.254]
  - - [1024, 2048, 1, 512, 1024, 1024, 512, 2048]
    - [75, 11.26]
  - - [1024, 2048, 1, 1024, 1024, 1024, 1024, 2048]
    - [82, 15.038]
  - - [1024, 2048, 1, 2048, 1024, 1024, 2048, 2048]
    - [86, 17.547]
  - - [1024, 2048, 1, 4096, 1024, 1024, 4096, 2048]
    - [64, 22.58]
  - - [1024, 2048, 1, 8192, 1024, 1024, 8192, 2048]
    - [59, 24.535]
  - - [1024, 4096, 1, 128, 1024, 1024, 128, 4096]
    - [76, 7.85]
  - - [1024, 4096, 1, 256, 1024, 1024, 256, 4096]
    - [22, 9.797]
  - - [1024, 4096, 1, 512, 1024, 1024, 512, 4096]
    - [82, 14.023]
  - - [1024, 4096, 1, 1024, 1024, 1024, 1024, 4096]
    - [64, 17.936]
  - - [1024, 4096, 1, 2048, 1024, 1024, 2048, 4096]
    - [64, 22.929]
  - - [1024, 4096, 1, 4096, 1024, 1024, 4096, 4096]
    - [50, 25.123]
  - - [1024, 4096, 1, 8192, 1024, 1024, 8192, 4096]
    - [57, 27.174]
  - - [1024, 8192, 1, 128, 1024, 1024, 128, 8192]
    - [6, 8.416]
  - - [1024, 8192, 1, 256, 1024, 1024, 256, 8192]
    - [62, 12.521]
  - - [1024, 8192, 1, 512, 1024, 1024, 512, 8192]
    - [61, 17.336]
  - - [1024, 8192, 1, 1024, 1024, 1024, 1024, 8192]
    - [61, 22.187]
  - - [1024, 8192, 1, 2048, 1024, 1024, 2048, 8192]
    - [61, 25.848]
  - - [1024, 8192, 1, 4096, 1024, 1024, 4096, 8192]
    - [12, 27.35]
  - - [1024, 8192, 1, 8192, 1024, 1024, 8192, 8192]
    - [42, 31.214]
  - - [2048, 128, 1, 128, 2048, 2048, 128, 128]
    - [39, 1.273]
  - - [2048, 128, 1, 256, 2048, 2048, 256, 128]
    - [40, 1.61]
  - - [2048, 128, 1, 512, 2048, 2048, 512, 128]
    - [97, 2.586]
  - - [2048, 128, 1, 1024, 2048, 2048, 1024, 128]
    - [94, 4.186]
  - - [2048, 128, 1, 2048, 2048, 2048, 2048, 128]
    - [94, 6.715]
  - - [2048, 128, 1, 4096, 2048, 2048, 4096, 128]
    - [95, 9.294]
  - - [2048, 128, 1, 8192, 2048, 2048, 8192, 128]
    - [71, 11.288]
  - - [2048, 256, 1, 128, 2048, 2048, 128, 256]
    - [37, 2.388]
  - - [2048, 256, 1, 256, 2048, 2048, 256, 256]
    - [36, 2.946]
  - - [2048, 256, 1, 512, 2048, 2048, 512, 256]
    - [94, 4.642]
  - - [2048, 256, 1, 1024, 2048, 2048, 1024, 256]
    - [94, 7.214]
  - - [2048, 256, 1, 2048, 2048, 2048, 2048, 256]
    - [72, 10.084]
  - - [2048, 256, 1, 4096, 2048, 2048, 4096, 256]
    - [92, 13.398]
  - - [2048, 256, 1, 8192, 2048, 2048, 8192, 256]
    - [20, 14.983]
  - - [2048, 512, 1, 128, 2048, 2048, 128, 512]
    - [33, 4.217]
  - - [2048, 512, 1, 256, 2048, 2048, 256, 512]
    - [33, 5.155]
  - - [2048, 512, 1, 512, 2048, 2048, 512, 512]
    - [88, 7.835]
  - - [2048, 512, 1, 1024, 2048, 2048, 1024, 512]
    - [92, 11.024]
  - - [2048, 512, 1, 2048, 2048, 2048, 2048, 512]
    - [93, 14.401]
  - - [2048, 512, 1, 4096, 2048, 2048, 4096, 512]
    - [67, 17.2]
  - - [2048, 512, 1, 8192, 2048, 2048, 8192, 512]
    - [64, 21.147]
  - - [2048, 1024, 1, 128, 2048, 2048, 128, 1024]
    - [29, 6.607]
  - - [2048, 1024, 1, 256, 2048, 2048, 256, 1024]
    - [26, 8.334]
  - - [2048, 1024, 1, 512, 2048, 2048, 512, 1024]
    - [83, 11.274]
  - - [2048, 1024, 1, 1024, 2048, 2048, 1024, 1024]
    - [86, 14.874]
  - - [2048, 1024, 1, 2048, 2048, 2048, 2048, 1024]
    - [64, 17.158]
  - - [2048, 1024, 1, 4096, 2048, 2048, 4096, 1024]
    - [64, 22.925]
  - - [2048, 1024, 1, 8192, 2048, 2048, 8192, 1024]
    - [50, 23.501]
  - - [2048, 2048, 1, 128, 2048, 2048, 128, 2048]
    - [27, 8.025]
  - - [2048, 2048, 1, 256, 2048, 2048, 256, 2048]
    - [22, 9.791]
  - - [2048, 2048, 1, 512, 2048, 2048, 512, 2048]
    - [82, 13.904]
  - - [2048, 2048, 1, 1024, 2048, 2048, 1024, 2048]
    - [64, 17.723]
  - - [2048, 2048, 1, 2048, 2048, 2048, 2048, 2048]
    - [64, 23.086]
  - - [2048, 2048, 1, 4096, 2048, 2048, 4096, 2048]
    - [50, 25.274]
  - - [2048, 2048, 1, 8192, 2048, 2048, 8192, 2048]
    - [57, 27.841]
  - - [2048, 4096, 1, 128, 2048, 2048, 128, 4096]
    - [30, 8.439]
  - - [2048, 4096, 1, 256, 2048, 2048, 256, 4096]
    - [61, 12.499]
  - - [2048, 4096, 1, 512, 2048, 2048, 512, 4096]
    - [61, 17.08]
  - - [2048, 4096, 1, 1024, 2048, 2048, 1024, 4096]
    - [64, 22.228]
  - - [2048, 4096, 1, 2048, 2048, 2048, 2048, 4096]
    - [64, 26.035]
  - - [2048, 4096, 1, 4096, 2048, 2048, 4096, 4096]
    - [57, 27.238]
  - - [2048, 4096, 1, 8192, 2048, 2048, 8192, 4096]
    - [47, 30.959]
  - - [2048, 8192, 1, 128, 2048, 2048, 128, 8192]
    - [14, 9.858]
  - - [2048, 8192, 1, 256, 2048, 2048, 256, 8192]
    - [61, 14.485]
  - - [2048, 8192, 1, 512, 2048, 2048, 512, 8192]
    - [61, 19.821]
  - - [2048, 8192, 1, 1024, 2048, 2048, 1024, 8192]
    - [51, 24.609]
  - - [2048, 8192, 1, 2048, 2048, 2048, 2048, 8192]
    - [15, 27.946]
  - - [2048, 8192, 1, 4096, 2048, 2048, 4096, 8192]
    - [44, 30.774]
  - - [2048, 8192, 1, 8192, 2048, 2048, 8192, 8192]
    - [43, 32.369]
  - - [4096, 128, 1, 128, 4096, 4096, 128, 128]
    - [96, 2.315]
  - - [4096, 128, 1, 256, 4096, 4096, 256, 128]
    - [36, 2.952]
  - - [4096, 128, 1, 512, 4096, 4096, 512, 128]
    - [94, 4.744]
  - - [4096, 128, 1, 1024, 4096, 4096, 1024, 128]
    - [94, 7.335]
  - - [4096, 128, 1, 2048, 4096, 4096, 2048, 128]
    - [72, 10.203]
  - - [4096, 128, 1, 4096, 4096, 4096, 4096, 128]
    - [93, 12.671]
  - - [4096, 128, 1, 8192, 4096, 4096, 8192, 128]
    - [76, 15.324]
  - - [4096, 256, 1, 128, 4096, 4096, 128, 256]
    - [35, 4.148]
  - - [4096, 256, 1, 256, 4096, 4096, 256, 256]
    - [34, 5.099]
  - - [4096, 256, 1, 512, 4096, 4096, 512, 256]
    - [88, 7.703]
  - - [4096, 256, 1, 1024, 4096, 4096, 1024, 256]
    - [92, 10.993]
  - - [4096, 256, 1, 2048, 4096, 4096, 2048, 256]
    - [93, 14.346]
  - - [4096, 256, 1, 4096, 4096, 4096, 4096, 256]
    - [65, 16.487]
  - - [4096, 256, 1, 8192, 4096, 4096, 8192, 256]
    - [62, 21.03]
  - - [4096, 512, 1, 128, 4096, 4096, 128, 512]
    - [29, 6.617]
  - - [4096, 512, 1, 256, 4096, 4096, 256, 512]
    - [26, 8.307]
  - - [4096, 512, 1, 512, 4096, 4096, 512, 512]
    - [84, 11.311]
  - - [4096, 512, 1, 1024, 4096, 4096, 1024, 512]
    - [86, 15.045]
  - - [4096, 512, 1, 2048, 4096, 4096, 2048, 512]
    - [86, 18.156]
  - - [4096, 512, 1, 4096, 4096, 4096, 4096, 512]
    - [64, 21.866]
  - - [4096, 512, 1, 8192, 4096, 4096, 8192, 512]
    - [54, 24.332]
  - - [4096, 1024, 1, 128, 4096, 4096, 128, 1024]
    - [82, 8.264]
  - - [4096, 1024, 1, 256, 4096, 4096, 256, 1024]
    - [30, 9.902]
  - - [4096, 1024, 1, 512, 4096, 4096, 512, 1024]
    - [68, 13.453]
  - - [4096, 1024, 1, 1024, 4096, 4096, 1024, 1024]
    - [64, 17.704]
  - - [4096, 1024, 1, 2048, 4096, 4096, 2048, 1024]
    - [64, 22.832]
  - - [4096, 1024, 1, 4096, 4096, 4096, 4096, 1024]
    - [49, 25.148]
  - - [4096, 1024, 1, 8192, 4096, 4096, 8192, 1024]
    - [47, 26.738]
  - - [4096, 2048, 1, 128, 4096, 4096, 128, 2048]
    - [12, 8.315]
  - - [4096, 2048, 1, 256, 4096, 4096, 256, 2048]
    - [62, 12.125]
  - - [4096, 2048, 1, 512, 4096, 4096, 512, 2048]
    - [64, 16.729]
  - - [4096, 2048, 1, 1024, 4096, 4096, 1024, 2048]
    - [64, 21.857]
  - - [4096, 2048, 1, 2048, 4096, 4096, 2048, 2048]
    - [57, 26.074]
  - - [4096, 2048, 1, 4096, 4096, 4096, 4096, 2048]
    - [63, 27.135]
  - - [4096, 2048, 1, 8192, 4096, 4096, 8192, 2048]
    - [47, 31.098]
  - - [4096, 4096, 1, 128, 4096, 4096, 128, 4096]
    - [5, 9.499]
  - - [4096, 4096, 1, 256, 4096, 4096, 256, 4096]
    - [61, 14.39]
  - - [4096, 4096, 1, 512, 4096, 4096, 512, 4096]
    - [62, 19.816]
  - - [4096, 4096, 1, 1024, 4096, 4096, 1024, 4096]
    - [55, 24.743]
  - - [4096, 4096, 1, 2048, 4096, 4096, 2048, 4096]
    - [58, 27.545]
  - - [4096, 4096, 1, 4096, 4096, 4096, 4096, 4096]
    - [44, 31.078]
  - - [4096, 4096, 1, 8192, 4096, 4096, 8192, 4096]
    - [44, 33.628]
  - - [4096, 8192, 1, 128, 4096, 4096, 128, 8192]
    - [61, 11.711]
  - - [4096, 8192, 1, 256, 4096, 4096, 256, 8192]
    - [60, 16.583]
  - - [4096, 8192, 1, 512, 4096, 4096, 512, 8192]
    - [13, 21.28]
  - - [4096, 8192, 1, 1024, 4096, 4096, 1024, 8192]
    - [59, 26.367]
  - - [4096, 8192, 1, 2048, 4096, 4096, 2048, 8192]
    - [45, 30.77]
  - - [4096, 8192, 1, 4096, 4096, 4096, 4096, 8192]
    - [59, 34.388]
  - - [4096, 8192, 1, 8192, 4096, 4096, 8192, 8192]
    - [46, 36.198]
  - - [8192, 128, 1, 128, 8192, 8192, 128, 128]
    - [32, 4.094]
  - - [8192, 128, 1, 256, 8192, 8192, 256, 128]
    - [33, 5.155]
  - - [8192, 128, 1, 512, 8192, 8192, 512, 128]
    - [88, 7.807]
  - - [8192, 128, 1, 1024, 8192, 8192, 1024, 128]
    - [93, 10.87]
  - - [8192, 128, 1, 2048, 8192, 8192, 2048, 128]
    - [93, 13.612]
  - - [8192, 128, 1, 4096, 8192, 8192, 4096, 128]
    - [16, 16.591]
  - - [8192, 128, 1, 8192, 8192, 8192, 8192, 128]
    - [61, 21.257]
  - - [8192, 256, 1, 128, 8192, 8192, 128, 256]
    - [25, 6.508]
  - - [8192, 256, 1, 256, 8192, 8192, 256, 256]
    - [24, 8.35]
  - - [8192, 256, 1, 512, 8192, 8192, 512, 256]
    - [77, 11.156]
  - - [8192, 256, 1, 1024, 8192, 8192, 1024, 256]
    - [83, 15.108]
  - - [8192, 256, 1, 2048, 8192, 8192, 2048, 256]
    - [78, 17.672]
  - - [8192, 256, 1, 4096, 8192, 8192, 4096, 256]
    - [14, 22.025]
  - - [8192, 256, 1, 8192, 8192, 8192, 8192, 256]
    - [14, 25.463]
  - - [8192, 512, 1, 128, 8192, 8192, 128, 512]
    - [85, 7.742]
  - - [8192, 512, 1, 256, 8192, 8192, 256, 512]
    - [22, 9.614]
  - - [8192, 512, 1, 512, 8192, 8192, 512, 512]
    - [86, 13.878]
  - - [8192, 512, 1, 1024, 8192, 8192, 1024, 512]
    - [64, 17.936]
  - - [8192, 512, 1, 2048, 8192, 8192, 2048, 512]
    - [62, 21.81]
  - - [8192, 512, 1, 4096, 8192, 8192, 4096, 512]
    - [48, 25.458]
  - - [8192, 512, 1, 8192, 8192, 8192, 8192, 512]
    - [6, 28.029]
  - - [8192, 1024, 1, 128, 8192, 8192, 128, 1024]
    - [7, 8.207]
  - - [8192, 1024, 1, 256, 8192, 8192, 256, 1024]
    - [64, 12.441]
  - - [8192, 1024, 1, 512, 8192, 8192, 512, 1024]
    - [64, 17.064]
  - - [8192, 1024, 1, 1024, 8192, 8192, 1024, 1024]
    - [64, 22.194]
  - - [8192, 1024, 1, 2048, 8192, 8192, 2048, 1024]
    - [64, 26.357]
  - - [8192, 1024, 1, 4096, 8192, 8192, 4096, 1024]
    - [47, 27.562]
  - - [8192, 1024, 1, 8192, 8192, 8192, 8192, 1024]
    - [47, 30.442]
  - - [8192, 2048, 1, 128, 8192, 8192, 128, 2048]
    - [14, 9.583]
  - - [8192, 2048, 1, 256, 8192, 8192, 256, 2048]
    - [14, 14.074]
  - - [8192, 2048, 1, 512, 8192, 8192, 512, 2048]
    - [64, 19.432]
  - - [8192, 2048, 1, 1024, 8192, 8192, 1024, 2048]
    - [62, 25.137]
  - - [8192, 2048, 1, 2048, 8192, 8192, 2048, 2048]
    - [4, 28.264]
  - - [8192, 2048, 1, 4096, 8192, 8192, 4096, 2048]
    - [14, 30.691]
  - - [8192, 2048, 1, 8192, 8192, 8192, 8192, 2048]
    - [47, 32.801]
  - - [8192, 4096, 1, 128, 8192, 8192, 128, 4096]
    - [14, 11.507]
  - - [8192, 4096, 1, 256, 8192, 8192, 256, 4096]
    - [62, 16.399]
  - - [8192, 4096, 1, 512, 8192, 8192, 512, 4096]
    - [13, 21.455]
  - - [8192, 4096, 1, 1024, 8192, 8192, 1024, 4096]
    - [56, 26.298]
  - - [8192, 4096, 1, 2048, 8192, 8192, 2048, 4096]
    - [47, 30.893]
  - - [8192, 4096, 1, 4096, 8192, 8192, 4096, 4096]
    - [46, 34.73]
  - - [8192, 4096, 1, 8192, 8192, 8192, 8192, 4096]
    - [0, 36.726]
  - - [8192, 8192, 1, 128, 8192, 8192, 128, 8192]
    - [5, 12.541]
  - - [8192, 8192, 1, 256, 8192, 8192, 256, 8192]
    - [2, 16.132]
  - - [8192, 8192, 1, 512, 8192, 8192, 512, 8192]
    - [8, 22.178]
  - - [8192, 8192, 1, 1024, 8192, 8192, 1024, 8192]
    - [9, 27.779]
  - - [8192, 8192, 1, 2048, 8192, 8192, 2048, 8192]
    - [47, 34.321]
  - - [8192, 8192, 1, 4096, 8192, 8192, 4096, 8192]
    - [47, 37.89]
  - - [8192, 8192, 1, 8192, 8192, 8192, 8192, 8192]
    - [1, 39.323]
  - - [1, 1, 1, 32, 1, 1, 32, 1]
    - [100, 0.0]
- null
- null
- DeviceEfficiency
- GridBased
