library/src/amd_detail/rocblaslt/src/Tensile/Logic/streamk/gfx942/aquavanjaram942_Cijk_Ailk_Bljk_BSS_BH_UserArgs.yaml
- {MinimumRequiredVersion: 4.33.0}
- aquavanjaram942
- gfx942
- [Device 0049, Device 0050]
    SolutionIndex: 0
    SolutionNameMin: Cijk_Ailk_Bljk_BSS_BH_UserArgs_MT32x32x32_MI16x16x1_SN_LDSB0_CLR1_GRVWA4_GRVWB4_GSU0_GSUC0_GSUWGMRR0_K1_LBSPPA256_LBSPPB128_LPA16_LPB4_LRVW4_MIWT1_1_NEPBS0_PLR1_SU32_SUM0_SUS256_SVW1_SKXCCM0_ULSGRO0_VWA1_VWB1_WGM1_WGMXCC1_WGMXCCGn1
    SolutionIndex: 1
    SolutionNameMin: Cijk_Ailk_Bljk_BSS_BH_UserArgs_MT32x32x32_MI16x16x1_SN_LDSB0_CLR1_GRVWA4_GRVWB4_GSU0_GSUC0_GSUWGMRR0_K1_LBSPPA256_LBSPPB128_LPA16_LPB4_LRVW4_MIWT1_1_NEPBS0_PLR1_SU32_SUM0_SUS256_SVW1_SKXCCM0_ULSGRO1_VWA1_VWB1_WGM1_WGMXCC1_WGMXCCGn1
    SolutionIndex: 2
    SolutionNameMin: Cijk_Ailk_Bljk_BSS_BH_UserArgs_MT128x128x64_MI16x16x1_SN_LDSB1_CLR1_GRVWA8_GRVWB8_GSU0_GSUC0_GSUWGMRR0_K1_LBSPPA2048_LBSPPB256_LPA0_LPB16_LRVW8_MIWT4_4_NEPBS0_PLR1_SU32_SUM0_SUS256_SVW4_SKXCCM0_ULSGRO0_VWA4_VWB2_WGM8_WGMXCC1_WGMXCCGn1
    SolutionIndex: 3
    SolutionNameMin: Cijk_Ailk_Bljk_BSS_BH_UserArgs_MT32x32x64_MI16x16x1_SN_LDSB0_CLR1_GRVWA8_GRVWB8_GSU0_GSUC0_GSUWGMRR0_K1_LBSPPA512_LBSPPB128_LPA16_LPB16_LRVW8_MIWT1_1_NEPBS0_PLR1_SU32_SUM0_SUS256_SVW1_SKXCCM0_ULSGRO1_VWA1_VWB1_WGM1_WGMXCC1_WGMXCCGn1
    SolutionIndex: 4
    SolutionNameMin: Cijk_Ailk_Bljk_BSS_BH_UserArgs_MT128x32x128_MI16x16x1_SN_LDSB1_CLR1_GRVWA8_GRVWB8_GSU0_GSUC0_GSUWGMRR0_K1_LBSPPA2048_LBSPPB256_LPA0_LPB16_LRVW8_MIWT4_1_NEPBS0_PLR2_SU32_SUM0_SUS256_SVW4_SKXCCM0_ULSGRO0_VWA4_VWB1_WGM1_WGMXCC1_WGMXCCGn1
    SolutionIndex: 5
    SolutionNameMin: Cijk_Ailk_Bljk_BSS_BH_UserArgs_MT128x32x128_MI16x16x1_SN_LDSB1_CLR1_GRVWA8_GRVWB8_GSU0_GSUC0_GSUWGMRR0_K1_LBSPPA2048_LBSPPB256_LPA0_LPB16_LRVW8_MIWT4_1_NEPBS0_PLR2_SU32_SUM0_SUS256_SVW4_SKXCCM0_ULSGRO1_VWA4_VWB1_WGM1_WGMXCC1_WGMXCCGn1
    SolutionIndex: 6
    SolutionNameMin: Cijk_Ailk_Bljk_BSS_BH_UserArgs_MT32x32x128_MI16x16x1_SN_LDSB1_CLR1_GRVWA8_GRVWB8_GSU0_GSUC0_GSUWGMRR0_K1_LBSPPA512_LBSPPB256_LPA16_LPB16_LRVW8_MIWT1_1_NEPBS0_PLR1_SU32_SUM0_SUS256_SVW1_SKXCCM0_ULSGRO0_VWA1_VWB1_WGM1_WGMXCC1_WGMXCCGn1
    SolutionIndex: 7
    SolutionNameMin: Cijk_Ailk_Bljk_BSS_BH_UserArgs_MT32x32x128_MI16x16x1_SN_LDSB1_CLR1_GRVWA8_GRVWB8_GSU0_GSUC0_GSUWGMRR0_K1_LBSPPA512_LBSPPB256_LPA16_LPB16_LRVW8_MIWT1_1_NEPBS0_PLR1_SU32_SUM0_SUS256_SVW1_SKXCCM0_ULSGRO1_VWA1_VWB1_WGM1_WGMXCC1_WGMXCCGn1
    SolutionIndex: 8
    SolutionNameMin: Cijk_Ailk_Bljk_BSS_BH_UserArgs_MT32x32x128_MI16x16x1_SN_LDSB1_CLR1_GRVWA8_GRVWB8_GSU0_GSUC0_GSUWGMRR0_K1_LBSPPA512_LBSPPB256_LPA16_LPB16_LRVW8_MIWT1_1_NEPBS0_PLR2_SU32_SUM0_SUS256_SVW1_SKXCCM0_ULSGRO0_VWA1_VWB1_WGM1_WGMXCC1_WGMXCCGn1
    SolutionIndex: 9
    SolutionNameMin: Cijk_Ailk_Bljk_BSS_BH_UserArgs_MT32x32x128_MI16x16x1_SN_LDSB1_CLR1_GRVWA8_GRVWB8_GSU0_GSUC0_GSUWGMRR0_K1_LBSPPA512_LBSPPB256_LPA16_LPB16_LRVW8_MIWT1_1_NEPBS0_PLR2_SU32_SUM0_SUS256_SVW1_SKXCCM0_ULSGRO1_VWA1_VWB1_WGM1_WGMXCC1_WGMXCCGn1
    SolutionIndex: 10
    SolutionNameMin: Cijk_Ailk_Bljk_BSS_BH_UserArgs_MT32x32x128_MI16x16x1_SN_LDSB1_CLR1_GRVWA8_GRVWB8_GSU0_GSUC0_GSUWGMRR0_K1_LBSPPA512_LBSPPB256_LPA16_LPB16_LRVW8_MIWT1_1_NEPBS0_PLR3_SU32_SUM0_SUS256_SVW1_SKXCCM0_ULSGRO0_VWA1_VWB1_WGM1_WGMXCC1_WGMXCCGn1
    SolutionIndex: 11
    SolutionNameMin: Cijk_Ailk_Bljk_BSS_BH_UserArgs_MT32x32x32_MI16x16x1_SN_LDSB0_CLR1_GRVWA4_GRVWB4_GSU0_GSUC0_GSUWGMRR0_K1_LBSPPA256_LBSPPB128_LPA16_LPB4_LRVW4_MIWT1_1_NEPBS16_PLR1_SU32_SUM0_SUS256_SVW1_SKXCCM0_ULSGRO0_VWA1_VWB1_WGM1_WGMXCC1_WGMXCCGn1
    SolutionIndex: 12
    SolutionNameMin: Cijk_Ailk_Bljk_BSS_BH_UserArgs_MT128x128x64_MI16x16x1_SN_LDSB1_CLR1_GRVWA8_GRVWB8_GSU0_GSUC0_GSUWGMRR0_K1_LBSPPA2048_LBSPPB512_LPA0_LPB16_LRVW8_MIWT4_4_NEPBS16_PLR1_SU32_SUM0_SUS256_SVW4_SKXCCM0_ULSGRO0_VWA4_VWB4_WGM4_WGMXCC1_WGMXCCGn1
    SolutionIndex: 13
    SolutionNameMin: Cijk_Ailk_Bljk_BSS_BH_UserArgs_MT128x64x128_MI16x16x1_SN_LDSB1_CLR1_GRVWA8_GRVWB8_GSU0_GSUC0_GSUWGMRR0_K1_LBSPPA2048_LBSPPB256_LPA0_LPB16_LRVW8_MIWT4_2_NEPBS16_PLR2_SU32_SUM0_SUS256_SVW4_SKXCCM0_ULSGRO0_VWA4_VWB1_WGM1_WGMXCC1_WGMXCCGn1
    SolutionIndex: 14
    SolutionNameMin: Cijk_Ailk_Bljk_BSS_BH_UserArgs_MT128x64x128_MI16x16x1_SN_LDSB1_CLR1_GRVWA8_GRVWB8_GSU0_GSUC0_GSUWGMRR0_K1_LBSPPA2048_LBSPPB256_LPA0_LPB16_LRVW8_MIWT4_2_NEPBS16_PLR2_SU32_SUM0_SUS256_SVW4_SKXCCM0_ULSGRO0_VWA4_VWB1_WGM8_WGMXCC1_WGMXCCGn1
    SolutionIndex: 15
    SolutionNameMin: Cijk_Ailk_Bljk_BSS_BH_UserArgs_MT32x64x128_MI16x16x1_SN_LDSB1_CLR1_GRVWA8_GRVWB8_GSU0_GSUC0_GSUWGMRR0_K1_LBSPPA512_LBSPPB512_LPA16_LPB16_LRVW8_MIWT1_2_NEPBS16_PLR3_SU32_SUM0_SUS256_SVW1_SKXCCM0_ULSGRO0_VWA1_VWB2_WGM1_WGMXCC1_WGMXCCGn1
    SolutionIndex: 16
    SolutionNameMin: Cijk_Ailk_Bljk_BSS_BH_UserArgs_MT32x32x128_MI16x16x1_SN_LDSB1_CLR1_GRVWA8_GRVWB8_GSU0_GSUC0_GSUWGMRR0_K1_LBSPPA512_LBSPPB256_LPA16_LPB16_LRVW8_MIWT1_1_NEPBS16_PLR1_SU32_SUM0_SUS256_SVW1_SKXCCM0_ULSGRO0_VWA1_VWB1_WGM1_WGMXCC1_WGMXCCGn1
    SolutionIndex: 17
    SolutionNameMin: Cijk_Ailk_Bljk_BSS_BH_UserArgs_MT32x32x128_MI16x16x1_SN_LDSB1_CLR1_GRVWA8_GRVWB8_GSU0_GSUC0_GSUWGMRR0_K1_LBSPPA512_LBSPPB256_LPA16_LPB16_LRVW8_MIWT1_1_NEPBS16_PLR1_SU32_SUM0_SUS256_SVW1_SKXCCM0_ULSGRO1_VWA1_VWB1_WGM1_WGMXCC1_WGMXCCGn1
    SolutionIndex: 18
    SolutionNameMin: Cijk_Ailk_Bljk_BSS_BH_UserArgs_MT32x32x128_MI16x16x1_SN_LDSB1_CLR1_GRVWA8_GRVWB8_GSU0_GSUC0_GSUWGMRR0_K1_LBSPPA512_LBSPPB256_LPA16_LPB16_LRVW8_MIWT1_1_NEPBS16_PLR2_SU32_SUM0_SUS256_SVW1_SKXCCM0_ULSGRO0_VWA1_VWB1_WGM1_WGMXCC1_WGMXCCGn1
    SolutionIndex: 19
    SolutionNameMin: Cijk_Ailk_Bljk_BSS_BH_UserArgs_MT32x32x128_MI16x16x1_SN_LDSB1_CLR1_GRVWA8_GRVWB8_GSU0_GSUC0_GSUWGMRR0_K1_LBSPPA512_LBSPPB256_LPA16_LPB16_LRVW8_MIWT1_1_NEPBS16_PLR2_SU32_SUM0_SUS256_SVW1_SKXCCM0_ULSGRO1_VWA1_VWB1_WGM1_WGMXCC1_WGMXCCGn1
    SolutionIndex: 20
    SolutionNameMin: Cijk_Ailk_Bljk_BSS_BH_UserArgs_MT32x32x128_MI16x16x1_SN_LDSB1_CLR1_GRVWA8_GRVWB8_GSU0_GSUC0_GSUWGMRR0_K1_LBSPPA512_LBSPPB256_LPA16_LPB16_LRVW8_MIWT1_1_NEPBS16_PLR3_SU32_SUM0_SUS256_SVW1_SKXCCM0_ULSGRO0_VWA1_VWB1_WGM1_WGMXCC1_WGMXCCGn1
    SolutionIndex: 21
    SolutionNameMin: Cijk_Ailk_Bljk_BSS_BH_UserArgs_MT32x32x128_MI16x16x1_SN_LDSB1_CLR1_GRVWA8_GRVWB8_GSU0_GSUC0_GSUWGMRR0_K1_LBSPPA512_LBSPPB256_LPA16_LPB16_LRVW8_MIWT1_1_NEPBS16_PLR3_SU32_SUM0_SUS256_SVW1_SKXCCM0_ULSGRO1_VWA1_VWB1_WGM1_WGMXCC1_WGMXCCGn1
    SolutionIndex: 22
    SolutionNameMin: Cijk_Ailk_Bljk_BSS_BH_UserArgs_MT128x128x64_MI16x16x1_SN_LDSB1_CLR1_GRVWA8_GRVWB8_GSU0_GSUC0_GSUWGMRR0_K1_LBSPPA2048_LBSPPB128_LPA0_LPB16_LRVW8_MIWT4_4_NEPBS0_PLR1_SU32_SUM0_SUS256_SVW4_SKXCCM8_ULSGRO0_VWA4_VWB1_WGM8_WGMXCC1_WGMXCCGn1
    SolutionIndex: 23
    SolutionNameMin: Cijk_Ailk_Bljk_BSS_BH_UserArgs_MT128x64x64_MI16x16x1_SN_LDSB1_CLR1_GRVWA8_GRVWB8_GSU0_GSUC0_GSUWGMRR0_K1_LBSPPA2048_LBSPPB128_LPA0_LPB16_LRVW8_MIWT4_2_NEPBS0_PLR1_SU32_SUM0_SUS256_SVW4_SKXCCM8_ULSGRO0_VWA4_VWB1_WGM1_WGMXCC1_WGMXCCGn1
    SolutionIndex: 24
    SolutionNameMin: Cijk_Ailk_Bljk_BSS_BH_UserArgs_MT64x64x64_MI16x16x1_SN_LDSB1_CLR1_GRVWA8_GRVWB8_GSU0_GSUC0_GSUWGMRR0_K1_LBSPPA1024_LBSPPB256_LPA32_LPB16_LRVW8_MIWT2_2_NEPBS0_PLR1_SU32_SUM0_SUS256_SVW2_SKXCCM8_ULSGRO1_VWA2_VWB2_WGM1_WGMXCC1_WGMXCCGn1
    SolutionIndex: 25
    SolutionNameMin: Cijk_Ailk_Bljk_BSS_BH_UserArgs_MT64x64x64_MI16x16x1_SN_LDSB1_CLR1_GRVWA8_GRVWB8_GSU0_GSUC0_GSUWGMRR0_K1_LBSPPA1024_LBSPPB128_LPA32_LPB16_LRVW8_MIWT2_2_NEPBS0_PLR1_SU32_SUM0_SUS256_SVW2_SKXCCM8_ULSGRO0_VWA2_VWB1_WGM4_WGMXCC1_WGMXCCGn1
    SolutionIndex: 26
    SolutionNameMin: Cijk_Ailk_Bljk_BSS_BH_UserArgs_MT32x32x64_MI16x16x1_SN_LDSB0_CLR1_GRVWA8_GRVWB8_GSU0_GSUC0_GSUWGMRR0_K1_LBSPPA512_LBSPPB128_LPA16_LPB16_LRVW8_MIWT1_1_NEPBS0_PLR1_SU32_SUM0_SUS256_SVW1_SKXCCM8_ULSGRO0_VWA1_VWB1_WGM1_WGMXCC1_WGMXCCGn1
    SolutionIndex: 27
    SolutionNameMin: Cijk_Ailk_Bljk_BSS_BH_UserArgs_MT32x32x64_MI16x16x1_SN_LDSB0_CLR1_GRVWA8_GRVWB8_GSU0_GSUC0_GSUWGMRR0_K1_LBSPPA512_LBSPPB128_LPA16_LPB16_LRVW8_MIWT1_1_NEPBS0_PLR1_SU32_SUM0_SUS256_SVW1_SKXCCM8_ULSGRO1_VWA1_VWB1_WGM1_WGMXCC1_WGMXCCGn1
    SolutionIndex: 28
    SolutionNameMin: Cijk_Ailk_Bljk_BSS_BH_UserArgs_MT128x64x128_MI16x16x1_SN_LDSB1_CLR1_GRVWA8_GRVWB8_GSU0_GSUC0_GSUWGMRR0_K1_LBSPPA2048_LBSPPB512_LPA0_LPB16_LRVW8_MIWT4_2_NEPBS0_PLR2_SU32_SUM0_SUS256_SVW4_SKXCCM8_ULSGRO0_VWA4_VWB2_WGM1_WGMXCC1_WGMXCCGn1
    SolutionIndex: 29
    SolutionNameMin: Cijk_Ailk_Bljk_BSS_BH_UserArgs_MT64x64x128_MI16x16x1_SN_LDSB1_CLR1_GRVWA8_GRVWB8_GSU0_GSUC0_GSUWGMRR0_K1_LBSPPA1024_LBSPPB256_LPA32_LPB16_LRVW8_MIWT2_2_NEPBS0_PLR2_SU32_SUM0_SUS256_SVW2_SKXCCM8_ULSGRO0_VWA2_VWB1_WGM1_WGMXCC1_WGMXCCGn1
    SolutionIndex: 30
    SolutionNameMin: Cijk_Ailk_Bljk_BSS_BH_UserArgs_MT64x64x128_MI16x16x1_SN_LDSB1_CLR1_GRVWA8_GRVWB8_GSU0_GSUC0_GSUWGMRR0_K1_LBSPPA1024_LBSPPB512_LPA32_LPB16_LRVW8_MIWT2_2_NEPBS0_PLR2_SU32_SUM0_SUS256_SVW2_SKXCCM8_ULSGRO0_VWA2_VWB2_WGM1_WGMXCC1_WGMXCCGn1
    SolutionIndex: 31
    SolutionNameMin: Cijk_Ailk_Bljk_BSS_BH_UserArgs_MT64x64x128_MI16x16x1_SN_LDSB1_CLR1_GRVWA8_GRVWB8_GSU0_GSUC0_GSUWGMRR0_K1_LBSPPA1024_LBSPPB256_LPA32_LPB16_LRVW8_MIWT2_2_NEPBS0_PLR2_SU32_SUM0_SUS256_SVW2_SKXCCM8_ULSGRO1_VWA2_VWB1_WGM1_WGMXCC1_WGMXCCGn1
    SolutionIndex: 32
    SolutionNameMin: Cijk_Ailk_Bljk_BSS_BH_UserArgs_MT64x64x128_MI16x16x1_SN_LDSB1_CLR1_GRVWA8_GRVWB8_GSU0_GSUC0_GSUWGMRR0_K1_LBSPPA1024_LBSPPB512_LPA32_LPB16_LRVW8_MIWT2_2_NEPBS0_PLR2_SU32_SUM0_SUS256_SVW2_SKXCCM8_ULSGRO1_VWA2_VWB2_WGM1_WGMXCC1_WGMXCCGn1
    SolutionIndex: 33
    SolutionNameMin: Cijk_Ailk_Bljk_BSS_BH_UserArgs_MT64x64x128_MI16x16x1_SN_LDSB1_CLR1_GRVWA8_GRVWB8_GSU0_GSUC0_GSUWGMRR0_K1_LBSPPA1024_LBSPPB512_LPA32_LPB16_LRVW8_MIWT2_2_NEPBS0_PLR2_SU32_SUM0_SUS256_SVW2_SKXCCM8_ULSGRO0_VWA2_VWB2_WGM4_WGMXCC1_WGMXCCGn1
    SolutionIndex: 34
    SolutionNameMin: Cijk_Ailk_Bljk_BSS_BH_UserArgs_MT64x32x128_MI16x16x1_SN_LDSB1_CLR1_GRVWA8_GRVWB8_GSU0_GSUC0_GSUWGMRR0_K1_LBSPPA1024_LBSPPB256_LPA32_LPB16_LRVW8_MIWT2_1_NEPBS0_PLR2_SU32_SUM0_SUS256_SVW2_SKXCCM8_ULSGRO0_VWA2_VWB1_WGM1_WGMXCC1_WGMXCCGn1
    SolutionIndex: 35
    SolutionNameMin: Cijk_Ailk_Bljk_BSS_BH_UserArgs_MT64x32x128_MI16x16x1_SN_LDSB1_CLR1_GRVWA8_GRVWB8_GSU0_GSUC0_GSUWGMRR0_K1_LBSPPA1024_LBSPPB256_LPA32_LPB16_LRVW8_MIWT2_1_NEPBS0_PLR2_SU32_SUM0_SUS256_SVW2_SKXCCM8_ULSGRO1_VWA2_VWB1_WGM1_WGMXCC1_WGMXCCGn1
    SolutionIndex: 36
    SolutionNameMin: Cijk_Ailk_Bljk_BSS_BH_UserArgs_MT64x32x128_MI16x16x1_SN_LDSB1_CLR1_GRVWA8_GRVWB8_GSU0_GSUC0_GSUWGMRR0_K1_LBSPPA1024_LBSPPB256_LPA32_LPB16_LRVW8_MIWT2_1_NEPBS0_PLR3_SU32_SUM0_SUS256_SVW2_SKXCCM8_ULSGRO1_VWA2_VWB1_WGM1_WGMXCC1_WGMXCCGn1
    SolutionIndex: 37
    SolutionNameMin: Cijk_Ailk_Bljk_BSS_BH_UserArgs_MT64x32x128_MI16x16x1_SN_LDSB1_CLR1_GRVWA8_GRVWB8_GSU0_GSUC0_GSUWGMRR0_K1_LBSPPA1024_LBSPPB256_LPA32_LPB16_LRVW8_MIWT2_1_NEPBS0_PLR3_SU32_SUM0_SUS256_SVW2_SKXCCM8_ULSGRO0_VWA2_VWB1_WGM4_WGMXCC1_WGMXCCGn1
    SolutionIndex: 38
    SolutionNameMin: Cijk_Ailk_Bljk_BSS_BH_UserArgs_MT32x32x128_MI16x16x1_SN_LDSB1_CLR1_GRVWA8_GRVWB8_GSU0_GSUC0_GSUWGMRR0_K1_LBSPPA512_LBSPPB256_LPA16_LPB16_LRVW8_MIWT1_1_NEPBS0_PLR1_SU32_SUM0_SUS256_SVW1_SKXCCM8_ULSGRO0_VWA1_VWB1_WGM1_WGMXCC1_WGMXCCGn1
    SolutionIndex: 39
    SolutionNameMin: Cijk_Ailk_Bljk_BSS_BH_UserArgs_MT32x32x128_MI16x16x1_SN_LDSB1_CLR1_GRVWA8_GRVWB8_GSU0_GSUC0_GSUWGMRR0_K1_LBSPPA512_LBSPPB256_LPA16_LPB16_LRVW8_MIWT1_1_NEPBS0_PLR1_SU32_SUM0_SUS256_SVW1_SKXCCM8_ULSGRO1_VWA1_VWB1_WGM1_WGMXCC1_WGMXCCGn1
    SolutionIndex: 40
    SolutionNameMin: Cijk_Ailk_Bljk_BSS_BH_UserArgs_MT32x32x128_MI16x16x1_SN_LDSB1_CLR1_GRVWA8_GRVWB8_GSU0_GSUC0_GSUWGMRR0_K1_LBSPPA512_LBSPPB256_LPA16_LPB16_LRVW8_MIWT1_1_NEPBS0_PLR2_SU32_SUM0_SUS256_SVW1_SKXCCM8_ULSGRO0_VWA1_VWB1_WGM1_WGMXCC1_WGMXCCGn1
    SolutionIndex: 41
    SolutionNameMin: Cijk_Ailk_Bljk_BSS_BH_UserArgs_MT32x32x128_MI16x16x1_SN_LDSB1_CLR1_GRVWA8_GRVWB8_GSU0_GSUC0_GSUWGMRR0_K1_LBSPPA512_LBSPPB256_LPA16_LPB16_LRVW8_MIWT1_1_NEPBS0_PLR2_SU32_SUM0_SUS256_SVW1_SKXCCM8_ULSGRO1_VWA1_VWB1_WGM1_WGMXCC1_WGMXCCGn1
    SolutionIndex: 42
    SolutionNameMin: Cijk_Ailk_Bljk_BSS_BH_UserArgs_MT32x32x128_MI16x16x1_SN_LDSB1_CLR1_GRVWA8_GRVWB8_GSU0_GSUC0_GSUWGMRR0_K1_LBSPPA512_LBSPPB256_LPA16_LPB16_LRVW8_MIWT1_1_NEPBS0_PLR3_SU32_SUM0_SUS256_SVW1_SKXCCM8_ULSGRO0_VWA1_VWB1_WGM1_WGMXCC1_WGMXCCGn1
    SolutionIndex: 43
    SolutionNameMin: Cijk_Ailk_Bljk_BSS_BH_UserArgs_MT32x32x128_MI16x16x1_SN_LDSB1_CLR1_GRVWA8_GRVWB8_GSU0_GSUC0_GSUWGMRR0_K1_LBSPPA512_LBSPPB256_LPA16_LPB16_LRVW8_MIWT1_1_NEPBS0_PLR3_SU32_SUM0_SUS256_SVW1_SKXCCM8_ULSGRO1_VWA1_VWB1_WGM4_WGMXCC1_WGMXCCGn1
    SolutionIndex: 44
    SolutionNameMin: Cijk_Ailk_Bljk_BSS_BH_UserArgs_MT128x128x64_MI16x16x1_SN_LDSB1_CLR1_GRVWA8_GRVWB8_GSU0_GSUC0_GSUWGMRR0_K1_LBSPPA2048_LBSPPB512_LPA0_LPB16_LRVW8_MIWT4_4_NEPBS16_PLR1_SU32_SUM0_SUS256_SVW4_SKXCCM8_ULSGRO0_VWA4_VWB4_WGM1_WGMXCC1_WGMXCCGn1
    SolutionIndex: 45
    SolutionNameMin: Cijk_Ailk_Bljk_BSS_BH_UserArgs_MT128x64x64_MI16x16x1_SN_LDSB1_CLR1_GRVWA8_GRVWB8_GSU0_GSUC0_GSUWGMRR0_K1_LBSPPA2048_LBSPPB256_LPA0_LPB16_LRVW8_MIWT4_2_NEPBS16_PLR1_SU32_SUM0_SUS256_SVW4_SKXCCM8_ULSGRO0_VWA4_VWB2_WGM8_WGMXCC1_WGMXCCGn1
    SolutionIndex: 46
    SolutionNameMin: Cijk_Ailk_Bljk_BSS_BH_UserArgs_MT64x64x64_MI16x16x1_SN_LDSB1_CLR1_GRVWA8_GRVWB8_GSU0_GSUC0_GSUWGMRR0_K1_LBSPPA1024_LBSPPB128_LPA32_LPB16_LRVW8_MIWT2_2_NEPBS16_PLR1_SU32_SUM0_SUS256_SVW2_SKXCCM8_ULSGRO1_VWA2_VWB1_WGM1_WGMXCC1_WGMXCCGn1
    SolutionIndex: 47
    SolutionNameMin: Cijk_Ailk_Bljk_BSS_BH_UserArgs_MT32x64x64_MI16x16x1_SN_LDSB0_CLR1_GRVWA8_GRVWB8_GSU0_GSUC0_GSUWGMRR0_K1_LBSPPA512_LBSPPB128_LPA16_LPB16_LRVW8_MIWT1_2_NEPBS16_PLR1_SU32_SUM0_SUS256_SVW1_SKXCCM8_ULSGRO1_VWA1_VWB1_WGM1_WGMXCC1_WGMXCCGn1
    SolutionIndex: 48
    SolutionNameMin: Cijk_Ailk_Bljk_BSS_BH_UserArgs_MT32x32x64_MI16x16x1_SN_LDSB0_CLR1_GRVWA8_GRVWB8_GSU0_GSUC0_GSUWGMRR0_K1_LBSPPA512_LBSPPB128_LPA16_LPB16_LRVW8_MIWT1_1_NEPBS16_PLR1_SU32_SUM0_SUS256_SVW1_SKXCCM8_ULSGRO0_VWA1_VWB1_WGM1_WGMXCC1_WGMXCCGn1
    SolutionIndex: 49
    SolutionNameMin: Cijk_Ailk_Bljk_BSS_BH_UserArgs_MT32x32x64_MI16x16x1_SN_LDSB0_CLR1_GRVWA8_GRVWB8_GSU0_GSUC0_GSUWGMRR0_K1_LBSPPA512_LBSPPB128_LPA16_LPB16_LRVW8_MIWT1_1_NEPBS16_PLR1_SU32_SUM0_SUS256_SVW1_SKXCCM8_ULSGRO1_VWA1_VWB1_WGM1_WGMXCC1_WGMXCCGn1
    SolutionIndex: 50
    SolutionNameMin: Cijk_Ailk_Bljk_BSS_BH_UserArgs_MT128x64x128_MI16x16x1_SN_LDSB1_CLR1_GRVWA8_GRVWB8_GSU0_GSUC0_GSUWGMRR0_K1_LBSPPA2048_LBSPPB512_LPA0_LPB16_LRVW8_MIWT4_2_NEPBS16_PLR1_SU32_SUM0_SUS256_SVW4_SKXCCM8_ULSGRO0_VWA4_VWB2_WGM1_WGMXCC1_WGMXCCGn1
    SolutionIndex: 51
    SolutionNameMin: Cijk_Ailk_Bljk_BSS_BH_UserArgs_MT128x64x128_MI16x16x1_SN_LDSB1_CLR1_GRVWA8_GRVWB8_GSU0_GSUC0_GSUWGMRR0_K1_LBSPPA2048_LBSPPB512_LPA0_LPB16_LRVW8_MIWT4_2_NEPBS16_PLR2_SU32_SUM0_SUS256_SVW4_SKXCCM8_ULSGRO0_VWA4_VWB2_WGM1_WGMXCC1_WGMXCCGn1
    SolutionIndex: 52
    SolutionNameMin: Cijk_Ailk_Bljk_BSS_BH_UserArgs_MT128x64x128_MI16x16x1_SN_LDSB1_CLR1_GRVWA8_GRVWB8_GSU0_GSUC0_GSUWGMRR0_K1_LBSPPA2048_LBSPPB256_LPA0_LPB16_LRVW8_MIWT4_2_NEPBS16_PLR2_SU32_SUM0_SUS256_SVW4_SKXCCM8_ULSGRO1_VWA4_VWB1_WGM1_WGMXCC1_WGMXCCGn1
    SolutionIndex: 53
    SolutionNameMin: Cijk_Ailk_Bljk_BSS_BH_UserArgs_MT128x32x128_MI16x16x1_SN_LDSB1_CLR1_GRVWA8_GRVWB8_GSU0_GSUC0_GSUWGMRR0_K1_LBSPPA2048_LBSPPB256_LPA0_LPB16_LRVW8_MIWT4_1_NEPBS16_PLR2_SU32_SUM0_SUS256_SVW4_SKXCCM8_ULSGRO0_VWA4_VWB1_WGM1_WGMXCC1_WGMXCCGn1
    SolutionIndex: 54
    SolutionNameMin: Cijk_Ailk_Bljk_BSS_BH_UserArgs_MT64x64x128_MI16x16x1_SN_LDSB1_CLR1_GRVWA8_GRVWB8_GSU0_GSUC0_GSUWGMRR0_K1_LBSPPA1024_LBSPPB512_LPA32_LPB16_LRVW8_MIWT2_2_NEPBS16_PLR2_SU32_SUM0_SUS256_SVW2_SKXCCM8_ULSGRO1_VWA2_VWB2_WGM1_WGMXCC1_WGMXCCGn1
    SolutionIndex: 55
    SolutionNameMin: Cijk_Ailk_Bljk_BSS_BH_UserArgs_MT64x32x128_MI16x16x1_SN_LDSB1_CLR1_GRVWA8_GRVWB8_GSU0_GSUC0_GSUWGMRR0_K1_LBSPPA1024_LBSPPB256_LPA32_LPB16_LRVW8_MIWT2_1_NEPBS16_PLR2_SU32_SUM0_SUS256_SVW2_SKXCCM8_ULSGRO0_VWA2_VWB1_WGM1_WGMXCC1_WGMXCCGn1
    SolutionIndex: 56
    SolutionNameMin: Cijk_Ailk_Bljk_BSS_BH_UserArgs_MT64x32x128_MI16x16x1_SN_LDSB1_CLR1_GRVWA8_GRVWB8_GSU0_GSUC0_GSUWGMRR0_K1_LBSPPA1024_LBSPPB256_LPA32_LPB16_LRVW8_MIWT2_1_NEPBS16_PLR2_SU32_SUM0_SUS256_SVW2_SKXCCM8_ULSGRO1_VWA2_VWB1_WGM1_WGMXCC1_WGMXCCGn1
    SolutionIndex: 57
    SolutionNameMin: Cijk_Ailk_Bljk_BSS_BH_UserArgs_MT64x32x128_MI16x16x1_SN_LDSB1_CLR1_GRVWA8_GRVWB8_GSU0_GSUC0_GSUWGMRR0_K1_LBSPPA1024_LBSPPB256_LPA32_LPB16_LRVW8_MIWT2_1_NEPBS16_PLR3_SU32_SUM0_SUS256_SVW2_SKXCCM8_ULSGRO0_VWA2_VWB1_WGM1_WGMXCC1_WGMXCCGn1
    SolutionIndex: 58
    SolutionNameMin: Cijk_Ailk_Bljk_BSS_BH_UserArgs_MT32x32x128_MI16x16x1_SN_LDSB1_CLR1_GRVWA8_GRVWB8_GSU0_GSUC0_GSUWGMRR0_K1_LBSPPA512_LBSPPB256_LPA16_LPB16_LRVW8_MIWT1_1_NEPBS16_PLR1_SU32_SUM0_SUS256_SVW1_SKXCCM8_ULSGRO0_VWA1_VWB1_WGM1_WGMXCC1_WGMXCCGn1
    SolutionIndex: 59
    SolutionNameMin: Cijk_Ailk_Bljk_BSS_BH_UserArgs_MT32x32x128_MI16x16x1_SN_LDSB1_CLR1_GRVWA8_GRVWB8_GSU0_GSUC0_GSUWGMRR0_K1_LBSPPA512_LBSPPB256_LPA16_LPB16_LRVW8_MIWT1_1_NEPBS16_PLR1_SU32_SUM0_SUS256_SVW1_SKXCCM8_ULSGRO1_VWA1_VWB1_WGM1_WGMXCC1_WGMXCCGn1
    SolutionIndex: 60
    SolutionNameMin: Cijk_Ailk_Bljk_BSS_BH_UserArgs_MT32x32x128_MI16x16x1_SN_LDSB1_CLR1_GRVWA8_GRVWB8_GSU0_GSUC0_GSUWGMRR0_K1_LBSPPA512_LBSPPB256_LPA16_LPB16_LRVW8_MIWT1_1_NEPBS16_PLR2_SU32_SUM0_SUS256_SVW1_SKXCCM8_ULSGRO0_VWA1_VWB1_WGM1_WGMXCC1_WGMXCCGn1
    SolutionIndex: 61
    SolutionNameMin: Cijk_Ailk_Bljk_BSS_BH_UserArgs_MT32x32x128_MI16x16x1_SN_LDSB1_CLR1_GRVWA8_GRVWB8_GSU0_GSUC0_GSUWGMRR0_K1_LBSPPA512_LBSPPB256_LPA16_LPB16_LRVW8_MIWT1_1_NEPBS16_PLR3_SU32_SUM0_SUS256_SVW1_SKXCCM8_ULSGRO1_VWA1_VWB1_WGM1_WGMXCC1_WGMXCCGn1
    SolutionIndex: 62
    SolutionNameMin: Cijk_Ailk_Bljk_BSS_BH_UserArgs_MT32x32x128_MI16x16x1_SN_LDSB1_CLR1_GRVWA8_GRVWB8_GSU0_GSUC0_GSUWGMRR0_K1_LBSPPA512_LBSPPB256_LPA16_LPB16_LRVW8_MIWT1_1_NEPBS0_PLR3_SU32_SUM0_SUS256_SVW1_SKXCCM0_ULSGRO1_VWA1_VWB1_WGM1_WGMXCC1_WGMXCCGn1
    SolutionIndex: 63
    SolutionNameMin: Cijk_Ailk_Bljk_BSS_BH_UserArgs_MT32x32x128_MI16x16x1_SN_LDSB1_CLR1_GRVWA8_GRVWB8_GSU0_GSUC0_GSUWGMRR0_K1_LBSPPA512_LBSPPB256_LPA16_LPB16_LRVW8_MIWT1_1_NEPBS0_PLR1_SU32_SUM0_SUS256_SVW1_SKXCCM8_ULSGRO0_VWA1_VWB1_WGM4_WGMXCC1_WGMXCCGn1
    SolutionIndex: 64
    SolutionNameMin: Cijk_Ailk_Bljk_BSS_BH_UserArgs_MT32x32x128_MI16x16x1_SN_LDSB1_CLR1_GRVWA8_GRVWB8_GSU0_GSUC0_GSUWGMRR0_K1_LBSPPA512_LBSPPB256_LPA16_LPB16_LRVW8_MIWT1_1_NEPBS0_PLR1_SU32_SUM0_SUS256_SVW1_SKXCCM8_ULSGRO0_VWA1_VWB1_WGM8_WGMXCC1_WGMXCCGn1
    SolutionIndex: 65
    SolutionNameMin: Cijk_Ailk_Bljk_BSS_BH_UserArgs_MT64x32x128_MI16x16x1_SN_LDSB1_CLR1_GRVWA8_GRVWB8_GSU0_GSUC0_GSUWGMRR0_K1_LBSPPA1024_LBSPPB256_LPA32_LPB16_LRVW8_MIWT2_1_NEPBS0_PLR3_SU32_SUM0_SUS256_SVW2_SKXCCM8_ULSGRO0_VWA2_VWB1_WGM8_WGMXCC1_WGMXCCGn1
    SolutionIndex: 66
    SolutionNameMin: Cijk_Ailk_Bljk_BSS_BH_UserArgs_MT64x32x128_MI16x16x1_SN_LDSB1_CLR1_GRVWA8_GRVWB8_GSU0_GSUC0_GSUWGMRR0_K1_LBSPPA1024_LBSPPB256_LPA32_LPB16_LRVW8_MIWT2_1_NEPBS0_PLR2_SU32_SUM0_SUS256_SVW2_SKXCCM8_ULSGRO0_VWA2_VWB1_WGM4_WGMXCC1_WGMXCCGn1
    SolutionIndex: 67
    SolutionNameMin: Cijk_Ailk_Bljk_BSS_BH_UserArgs_MT64x32x128_MI16x16x1_SN_LDSB1_CLR1_GRVWA8_GRVWB8_GSU0_GSUC0_GSUWGMRR0_K1_LBSPPA1024_LBSPPB256_LPA32_LPB16_LRVW8_MIWT2_1_NEPBS0_PLR2_SU32_SUM0_SUS256_SVW2_SKXCCM8_ULSGRO0_VWA2_VWB1_WGM8_WGMXCC1_WGMXCCGn1
    SolutionIndex: 68
    SolutionNameMin: Cijk_Ailk_Bljk_BSS_BH_UserArgs_MT64x64x64_MI16x16x1_SN_LDSB1_CLR1_GRVWA8_GRVWB8_GSU0_GSUC0_GSUWGMRR0_K1_LBSPPA1024_LBSPPB256_LPA32_LPB16_LRVW8_MIWT2_2_NEPBS16_PLR1_SU32_SUM0_SUS256_SVW2_SKXCCM8_ULSGRO0_VWA2_VWB2_WGM1_WGMXCC1_WGMXCCGn1
    SolutionIndex: 69
    SolutionNameMin: Cijk_Ailk_Bljk_BSS_BH_UserArgs_MT64x64x128_MI16x16x1_SN_LDSB1_CLR1_GRVWA8_GRVWB8_GSU0_GSUC0_GSUWGMRR0_K1_LBSPPA1024_LBSPPB256_LPA32_LPB16_LRVW8_MIWT2_2_NEPBS0_PLR3_SU32_SUM0_SUS256_SVW2_SKXCCM8_ULSGRO0_VWA2_VWB1_WGM1_WGMXCC1_WGMXCCGn1
    SolutionIndex: 70
    SolutionNameMin: Cijk_Ailk_Bljk_BSS_BH_UserArgs_MT64x64x128_MI16x16x1_SN_LDSB1_CLR1_GRVWA8_GRVWB8_GSU0_GSUC0_GSUWGMRR0_K1_LBSPPA1024_LBSPPB512_LPA32_LPB16_LRVW8_MIWT2_2_NEPBS0_PLR2_SU32_SUM0_SUS256_SVW2_SKXCCM0_ULSGRO1_VWA2_VWB2_WGM8_WGMXCC1_WGMXCCGn1
    SolutionIndex: 71
    SolutionNameMin: Cijk_Ailk_Bljk_BSS_BH_UserArgs_MT64x64x128_MI16x16x1_SN_LDSB1_CLR1_GRVWA8_GRVWB8_GSU0_GSUC0_GSUWGMRR0_K1_LBSPPA1024_LBSPPB256_LPA16_LPB16_LRVW8_MIWT2_2_NEPBS16_PLR1_SU32_SUM0_SUS256_SVW1_SKXCCM0_ULSGRO0_VWA1_VWB1_WGM4_WGMXCC1_WGMXCCGn1
    SolutionIndex: 72
    SolutionNameMin: Cijk_Ailk_Bljk_BSS_BH_UserArgs_MT64x128x64_MI16x16x1_SN_LDSB1_CLR1_GRVWA8_GRVWB8_GSU0_GSUC0_GSUWGMRR0_K1_LBSPPA1024_LBSPPB256_LPA32_LPB16_LRVW8_MIWT2_4_NEPBS16_PLR1_SU32_SUM0_SUS256_SVW2_SKXCCM8_ULSGRO1_VWA2_VWB2_WGM1_WGMXCC1_WGMXCCGn1
    SolutionIndex: 73
    SolutionNameMin: Cijk_Ailk_Bljk_BSS_BH_UserArgs_MT128x128x64_MI16x16x1_SN_LDSB1_CLR1_GRVWA8_GRVWB8_GSU0_GSUC0_GSUWGMRR0_K1_LBSPPA2048_LBSPPB128_LPA0_LPB16_LRVW8_MIWT4_4_NEPBS0_PLR1_SU32_SUM0_SUS256_SVW4_SKXCCM8_ULSGRO0_VWA4_VWB1_WGM1_WGMXCC1_WGMXCCGn1
    SolutionIndex: 74
    SolutionNameMin: Cijk_Ailk_Bljk_BSS_BH_UserArgs_MT128x64x128_MI16x16x1_SN_LDSB1_CLR1_GRVWA8_GRVWB8_GSU0_GSUC0_GSUWGMRR0_K1_LBSPPA2048_LBSPPB256_LPA0_LPB16_LRVW8_MIWT4_2_NEPBS0_PLR1_SU32_SUM0_SUS256_SVW4_SKXCCM0_ULSGRO0_VWA4_VWB1_WGM8_WGMXCC1_WGMXCCGn1
    SolutionIndex: 75
    SolutionNameMin: Cijk_Ailk_Bljk_BSS_BH_UserArgs_MT128x64x128_MI16x16x1_SN_LDSB1_CLR1_GRVWA8_GRVWB8_GSU0_GSUC0_GSUWGMRR0_K1_LBSPPA2048_LBSPPB256_LPA0_LPB16_LRVW8_MIWT4_2_NEPBS0_PLR2_SU32_SUM0_SUS256_SVW4_SKXCCM0_ULSGRO0_VWA4_VWB1_WGM8_WGMXCC1_WGMXCCGn1
    SolutionIndex: 76
    SolutionNameMin: Cijk_Ailk_Bljk_BSS_BH_UserArgs_MT128x64x128_MI16x16x1_SN_LDSB1_CLR1_GRVWA8_GRVWB8_GSU0_GSUC0_GSUWGMRR0_K1_LBSPPA2048_LBSPPB256_LPA0_LPB16_LRVW8_MIWT4_2_NEPBS16_PLR1_SU32_SUM0_SUS256_SVW4_SKXCCM8_ULSGRO0_VWA4_VWB1_WGM1_WGMXCC1_WGMXCCGn1
    SolutionIndex: 77
    SolutionNameMin: Cijk_Ailk_Bljk_BSS_BH_UserArgs_MT128x64x128_MI16x16x1_SN_LDSB1_CLR1_GRVWA8_GRVWB8_GSU0_GSUC0_GSUWGMRR0_K1_LBSPPA2048_LBSPPB256_LPA0_LPB16_LRVW8_MIWT4_2_NEPBS0_PLR3_SU32_SUM0_SUS256_SVW4_SKXCCM8_ULSGRO0_VWA4_VWB1_WGM1_WGMXCC1_WGMXCCGn1
    SolutionIndex: 78
    SolutionNameMin: Cijk_Ailk_Bljk_BSS_BH_UserArgs_MT128x128x64_MI16x16x1_SN_LDSB1_CLR1_GRVWA8_GRVWB8_GSU0_GSUC0_GSUWGMRR0_K1_LBSPPA2048_LBSPPB512_LPA0_LPB16_LRVW8_MIWT4_4_NEPBS16_PLR1_SU32_SUM0_SUS256_SVW4_SKXCCM8_ULSGRO1_VWA4_VWB4_WGM8_WGMXCC1_WGMXCCGn1
    SolutionIndex: 79
    SolutionNameMin: Cijk_Ailk_Bljk_BSS_BH_UserArgs_MT128x128x64_MI16x16x1_SN_LDSB1_CLR1_GRVWA8_GRVWB8_GSU0_GSUC0_GSUWGMRR0_K1_LBSPPA2048_LBSPPB128_LPA0_LPB16_LRVW8_MIWT4_4_NEPBS16_PLR1_SU32_SUM0_SUS256_SVW4_SKXCCM8_ULSGRO0_VWA4_VWB1_WGM8_WGMXCC1_WGMXCCGn1
    SolutionIndex: 80
    SolutionNameMin: Cijk_Ailk_Bljk_BSS_BH_UserArgs_MT64x128x128_MI16x16x1_SN_LDSB1_CLR1_GRVWA8_GRVWB8_GSU0_GSUC0_GSUWGMRR0_K1_LBSPPA1024_LBSPPB512_LPA32_LPB16_LRVW8_MIWT2_4_NEPBS0_PLR2_SU32_SUM0_SUS256_SVW2_SKXCCM0_ULSGRO1_VWA2_VWB2_WGM8_WGMXCC1_WGMXCCGn1
    SolutionIndex: 81
    SolutionNameMin: Cijk_Ailk_Bljk_BSS_BH_UserArgs_MT128x64x128_MI16x16x1_SN_LDSB1_CLR1_GRVWA8_GRVWB8_GSU0_GSUC0_GSUWGMRR0_K1_LBSPPA2048_LBSPPB256_LPA0_LPB16_LRVW8_MIWT4_2_NEPBS16_PLR2_SU32_SUM0_SUS256_SVW4_SKXCCM0_ULSGRO1_VWA4_VWB1_WGM8_WGMXCC1_WGMXCCGn1
    SolutionIndex: 82
    SolutionNameMin: Cijk_Ailk_Bljk_BSS_BH_UserArgs_MT128x64x128_MI16x16x1_SN_LDSB1_CLR1_GRVWA8_GRVWB8_GSU0_GSUC0_GSUWGMRR0_K1_LBSPPA2048_LBSPPB256_LPA0_LPB16_LRVW8_MIWT4_2_NEPBS16_PLR3_SU32_SUM0_SUS256_SVW4_SKXCCM8_ULSGRO1_VWA4_VWB1_WGM1_WGMXCC1_WGMXCCGn1
    SolutionIndex: 83
    SolutionNameMin: Cijk_Ailk_Bljk_BSS_BH_UserArgs_MT128x128x64_MI16x16x1_SN_LDSB1_CLR1_GRVWA8_GRVWB8_GSU0_GSUC0_GSUWGMRR0_K1_LBSPPA2048_LBSPPB128_LPA0_LPB16_LRVW8_MIWT4_4_NEPBS16_PLR1_SU32_SUM0_SUS256_SVW4_SKXCCM8_ULSGRO1_VWA4_VWB1_WGM8_WGMXCC1_WGMXCCGn1
    SolutionIndex: 84
    SolutionNameMin: Cijk_Ailk_Bljk_BSS_BH_UserArgs_MT128x128x64_MI16x16x1_SN_LDSB1_CLR1_GRVWA8_GRVWB8_GSU0_GSUC0_GSUWGMRR0_K1_LBSPPA2048_LBSPPB512_LPA0_LPB16_LRVW8_MIWT4_4_NEPBS0_PLR1_SU32_SUM0_SUS256_SVW4_SKXCCM8_ULSGRO1_VWA4_VWB4_WGM8_WGMXCC1_WGMXCCGn1
    SolutionIndex: 85
    SolutionNameMin: Cijk_Ailk_Bljk_BSS_BH_UserArgs_MT256x128x64_MI16x16x1_SN_LDSB1_CLR1_GRVWA8_GRVWB8_GSU0_GSUC0_GSUWGMRR0_K1_LBSPPA4096_LBSPPB128_LPA0_LPB16_LRVW8_MIWT8_4_NEPBS16_PLR1_SU32_SUM0_SUS256_SVW4_SKXCCM0_ULSGRO1_VWA4_VWB1_WGM1_WGMXCC1_WGMXCCGn1
    SolutionIndex: 86
    SolutionNameMin: Cijk_Ailk_Bljk_BSS_BH_UserArgs_MT32x32x128_MI16x16x1_SN_LDSB1_CLR1_GRVWA8_GRVWB8_GSU0_GSUC0_GSUWGMRR0_K1_LBSPPA512_LBSPPB256_LPA16_LPB16_LRVW8_MIWT1_1_NEPBS16_PLR1_SU32_SUM0_SUS256_SVW1_SKXCCM8_ULSGRO1_VWA1_VWB1_WGM4_WGMXCC1_WGMXCCGn1
    SolutionIndex: 87
    SolutionNameMin: Cijk_Ailk_Bljk_BSS_BH_UserArgs_MT64x32x128_MI16x16x1_SN_LDSB1_CLR1_GRVWA8_GRVWB8_GSU0_GSUC0_GSUWGMRR0_K1_LBSPPA1024_LBSPPB256_LPA32_LPB16_LRVW8_MIWT2_1_NEPBS16_PLR2_SU32_SUM0_SUS256_SVW2_SKXCCM8_ULSGRO1_VWA2_VWB1_WGM4_WGMXCC1_WGMXCCGn1
    SolutionIndex: 88
    SolutionNameMin: Cijk_Ailk_Bljk_BSS_BH_UserArgs_MT64x64x64_MI16x16x1_SN_LDSB1_CLR1_GRVWA8_GRVWB8_GSU0_GSUC0_GSUWGMRR0_K1_LBSPPA1024_LBSPPB128_LPA32_LPB16_LRVW8_MIWT2_2_NEPBS0_PLR1_SU32_SUM0_SUS256_SVW2_SKXCCM8_ULSGRO1_VWA2_VWB1_WGM8_WGMXCC1_WGMXCCGn1
    SolutionIndex: 89
    SolutionNameMin: Cijk_Ailk_Bljk_BSS_BH_UserArgs_MT32x64x128_MI16x16x1_SN_LDSB1_CLR1_GRVWA8_GRVWB8_GSU0_GSUC0_GSUWGMRR0_K1_LBSPPA512_LBSPPB512_LPA16_LPB16_LRVW8_MIWT1_2_NEPBS0_PLR2_SU32_SUM0_SUS256_SVW1_SKXCCM0_ULSGRO1_VWA1_VWB2_WGM1_WGMXCC1_WGMXCCGn1
    SolutionIndex: 90
    SolutionNameMin: Cijk_Ailk_Bljk_BSS_BH_UserArgs_MT64x64x64_MI16x16x1_SN_LDSB1_CLR1_GRVWA8_GRVWB8_GSU0_GSUC0_GSUWGMRR0_K1_LBSPPA1024_LBSPPB128_LPA32_LPB16_LRVW8_MIWT2_2_NEPBS0_PLR1_SU32_SUM0_SUS256_SVW2_SKXCCM8_ULSGRO1_VWA2_VWB1_WGM1_WGMXCC1_WGMXCCGn1
    SolutionIndex: 91
    SolutionNameMin: Cijk_Ailk_Bljk_BSS_BH_UserArgs_MT64x128x64_MI16x16x1_SN_LDSB1_CLR1_GRVWA8_GRVWB8_GSU0_GSUC0_GSUWGMRR0_K1_LBSPPA1024_LBSPPB512_LPA32_LPB16_LRVW8_MIWT2_4_NEPBS16_PLR1_SU32_SUM0_SUS256_SVW2_SKXCCM8_ULSGRO0_VWA2_VWB4_WGM1_WGMXCC1_WGMXCCGn1
    SolutionIndex: 92
    SolutionNameMin: Cijk_Ailk_Bljk_BSS_BH_UserArgs_MT64x64x128_MI16x16x1_SN_LDSB1_CLR1_GRVWA8_GRVWB8_GSU0_GSUC0_GSUWGMRR0_K1_LBSPPA1024_LBSPPB512_LPA16_LPB16_LRVW8_MIWT2_2_NEPBS16_PLR2_SU32_SUM0_SUS256_SVW1_SKXCCM8_ULSGRO1_VWA1_VWB2_WGM1_WGMXCC1_WGMXCCGn1
    SolutionIndex: 93
    SolutionNameMin: Cijk_Ailk_Bljk_BSS_BH_UserArgs_MT64x64x128_MI16x16x1_SN_LDSB1_CLR1_GRVWA8_GRVWB8_GSU0_GSUC0_GSUWGMRR0_K1_LBSPPA1024_LBSPPB256_LPA32_LPB16_LRVW8_MIWT2_2_NEPBS16_PLR3_SU32_SUM0_SUS256_SVW2_SKXCCM8_ULSGRO1_VWA2_VWB1_WGM1_WGMXCC1_WGMXCCGn1
    SolutionIndex: 94
    SolutionNameMin: Cijk_Ailk_Bljk_BSS_BH_UserArgs_MT64x64x128_MI16x16x1_SN_LDSB1_CLR1_GRVWA8_GRVWB8_GSU0_GSUC0_GSUWGMRR0_K1_LBSPPA1024_LBSPPB256_LPA32_LPB16_LRVW8_MIWT2_2_NEPBS16_PLR2_SU32_SUM0_SUS256_SVW2_SKXCCM8_ULSGRO1_VWA2_VWB1_WGM4_WGMXCC1_WGMXCCGn1
    SolutionIndex: 95
    SolutionNameMin: Cijk_Ailk_Bljk_BSS_BH_UserArgs_MT128x64x64_MI16x16x1_SN_LDSB1_CLR1_GRVWA8_GRVWB8_GSU0_GSUC0_GSUWGMRR0_K1_LBSPPA2048_LBSPPB256_LPA0_LPB16_LRVW8_MIWT4_2_NEPBS0_PLR1_SU32_SUM0_SUS256_SVW4_SKXCCM8_ULSGRO0_VWA4_VWB2_WGM1_WGMXCC1_WGMXCCGn1
    SolutionIndex: 96
    SolutionNameMin: Cijk_Ailk_Bljk_BSS_BH_UserArgs_MT128x128x64_MI16x16x1_SN_LDSB1_CLR1_GRVWA8_GRVWB8_GSU0_GSUC0_GSUWGMRR0_K1_LBSPPA2048_LBSPPB512_LPA0_LPB16_LRVW8_MIWT4_4_NEPBS0_PLR1_SU32_SUM0_SUS256_SVW4_SKXCCM8_ULSGRO0_VWA4_VWB4_WGM1_WGMXCC1_WGMXCCGn1
    SolutionIndex: 97
    SolutionNameMin: Cijk_Ailk_Bljk_BSS_BH_UserArgs_MT64x128x128_MI16x16x1_SN_LDSB1_CLR1_GRVWA8_GRVWB8_GSU0_GSUC0_GSUWGMRR0_K1_LBSPPA1024_LBSPPB1024_LPA16_LPB16_LRVW8_MIWT2_4_NEPBS16_PLR2_SU32_SUM0_SUS256_SVW1_SKXCCM0_ULSGRO1_VWA1_VWB4_WGM4_WGMXCC1_WGMXCCGn1
    SolutionIndex: 98
    SolutionNameMin: Cijk_Ailk_Bljk_BSS_BH_UserArgs_MT128x64x128_MI16x16x1_SN_LDSB1_CLR1_GRVWA8_GRVWB8_GSU0_GSUC0_GSUWGMRR0_K1_LBSPPA2048_LBSPPB512_LPA0_LPB16_LRVW8_MIWT4_2_NEPBS16_PLR1_SU32_SUM0_SUS256_SVW4_SKXCCM0_ULSGRO1_VWA4_VWB2_WGM4_WGMXCC1_WGMXCCGn1
    SolutionIndex: 99
    SolutionNameMin: Cijk_Ailk_Bljk_BSS_BH_UserArgs_MT64x128x128_MI16x16x1_SN_LDSB1_CLR1_GRVWA8_GRVWB8_GSU0_GSUC0_GSUWGMRR0_K1_LBSPPA1024_LBSPPB256_LPA32_LPB16_LRVW8_MIWT2_4_NEPBS16_PLR2_SU32_SUM0_SUS256_SVW2_SKXCCM8_ULSGRO1_VWA2_VWB1_WGM1_WGMXCC1_WGMXCCGn1
    SolutionIndex: 100
    SolutionNameMin: Cijk_Ailk_Bljk_BSS_BH_UserArgs_MT128x64x64_MI16x16x1_SN_LDSB1_CLR1_GRVWA8_GRVWB8_GSU0_GSUC0_GSUWGMRR0_K1_LBSPPA2048_LBSPPB128_LPA0_LPB16_LRVW8_MIWT4_2_NEPBS16_PLR1_SU32_SUM0_SUS256_SVW4_SKXCCM8_ULSGRO1_VWA4_VWB1_WGM8_WGMXCC1_WGMXCCGn1
    SolutionIndex: 101
    SolutionNameMin: Cijk_Ailk_Bljk_BSS_BH_UserArgs_MT64x128x64_MI16x16x1_SN_LDSB1_CLR1_GRVWA8_GRVWB8_GSU0_GSUC0_GSUWGMRR0_K1_LBSPPA1024_LBSPPB256_LPA32_LPB16_LRVW8_MIWT2_4_NEPBS0_PLR1_SU32_SUM0_SUS256_SVW2_SKXCCM8_ULSGRO1_VWA2_VWB2_WGM1_WGMXCC1_WGMXCCGn1
    SolutionIndex: 102
    SolutionNameMin: Cijk_Ailk_Bljk_BSS_BH_UserArgs_MT128x128x64_MI16x16x1_SN_LDSB1_CLR1_GRVWA8_GRVWB8_GSU0_GSUC0_GSUWGMRR0_K1_LBSPPA2048_LBSPPB128_LPA0_LPB16_LRVW8_MIWT4_4_NEPBS16_PLR1_SU32_SUM0_SUS256_SVW4_SKXCCM8_ULSGRO0_VWA4_VWB1_WGM1_WGMXCC1_WGMXCCGn1
    SolutionIndex: 103
    SolutionNameMin: Cijk_Ailk_Bljk_BSS_BH_UserArgs_MT128x128x64_MI16x16x1_SN_LDSB1_CLR1_GRVWA8_GRVWB8_GSU0_GSUC0_GSUWGMRR0_K1_LBSPPA2048_LBSPPB256_LPA0_LPB16_LRVW8_MIWT4_4_NEPBS0_PLR1_SU32_SUM0_SUS256_SVW4_SKXCCM8_ULSGRO1_VWA4_VWB2_WGM1_WGMXCC1_WGMXCCGn1
    SolutionIndex: 104
    SolutionNameMin: Cijk_Ailk_Bljk_BSS_BH_UserArgs_MT128x64x128_MI16x16x1_SN_LDSB1_CLR1_GRVWA8_GRVWB8_GSU0_GSUC0_GSUWGMRR0_K1_LBSPPA2048_LBSPPB256_LPA0_LPB16_LRVW8_MIWT4_2_NEPBS0_PLR1_SU32_SUM0_SUS256_SVW4_SKXCCM0_ULSGRO1_VWA4_VWB1_WGM8_WGMXCC1_WGMXCCGn1
    SolutionIndex: 105
    SolutionNameMin: Cijk_Ailk_Bljk_BSS_BH_UserArgs_MT128x64x128_MI16x16x1_SN_LDSB1_CLR1_GRVWA8_GRVWB8_GSU0_GSUC0_GSUWGMRR0_K1_LBSPPA2048_LBSPPB256_LPA0_LPB16_LRVW8_MIWT4_2_NEPBS16_PLR2_SU32_SUM0_SUS256_SVW4_SKXCCM0_ULSGRO1_VWA4_VWB1_WGM4_WGMXCC1_WGMXCCGn1
    SolutionIndex: 106
    SolutionNameMin: Cijk_Ailk_Bljk_BSS_BH_UserArgs_MT128x128x64_MI16x16x1_SN_LDSB1_CLR1_GRVWA8_GRVWB8_GSU0_GSUC0_GSUWGMRR0_K1_LBSPPA2048_LBSPPB128_LPA0_LPB16_LRVW8_MIWT4_4_NEPBS0_PLR1_SU32_SUM0_SUS256_SVW4_SKXCCM8_ULSGRO1_VWA4_VWB1_WGM1_WGMXCC1_WGMXCCGn1
    SolutionIndex: 107
    SolutionNameMin: Cijk_Ailk_Bljk_BSS_BH_UserArgs_MT128x256x64_MI16x16x1_SN_LDSB1_CLR1_GRVWA8_GRVWB8_GSU0_GSUC0_GSUWGMRR0_K1_LBSPPA2048_LBSPPB1024_LPA0_LPB16_LRVW8_MIWT4_8_NEPBS16_PLR1_SU32_SUM0_SUS256_SVW4_SKXCCM8_ULSGRO0_VWA4_VWB8_WGM1_WGMXCC1_WGMXCCGn1
    SolutionIndex: 108
    SolutionNameMin: Cijk_Ailk_Bljk_BSS_BH_UserArgs_MT128x64x128_MI16x16x1_SN_LDSB1_CLR1_GRVWA8_GRVWB8_GSU0_GSUC0_GSUWGMRR0_K1_LBSPPA2048_LBSPPB256_LPA0_LPB16_LRVW8_MIWT4_2_NEPBS0_PLR2_SU32_SUM0_SUS256_SVW4_SKXCCM0_ULSGRO1_VWA4_VWB1_WGM1_WGMXCC1_WGMXCCGn1
    SolutionIndex: 109
    SolutionNameMin: Cijk_Ailk_Bljk_BSS_BH_UserArgs_MT128x128x64_MI16x16x1_SN_LDSB1_CLR1_GRVWA8_GRVWB8_GSU0_GSUC0_GSUWGMRR0_K1_LBSPPA2048_LBSPPB128_LPA0_LPB16_LRVW8_MIWT4_4_NEPBS16_PLR1_SU32_SUM0_SUS256_SVW4_SKXCCM8_ULSGRO1_VWA4_VWB1_WGM1_WGMXCC1_WGMXCCGn1
    SolutionIndex: 110
    SolutionNameMin: Cijk_Ailk_Bljk_BSS_BH_UserArgs_MT128x128x64_MI16x16x1_SN_LDSB1_CLR1_GRVWA8_GRVWB8_GSU0_GSUC0_GSUWGMRR0_K1_LBSPPA2048_LBSPPB512_LPA0_LPB16_LRVW8_MIWT4_4_NEPBS0_PLR1_SU32_SUM0_SUS256_SVW4_SKXCCM8_ULSGRO1_VWA4_VWB4_WGM4_WGMXCC1_WGMXCCGn1
    SolutionIndex: 111
    SolutionNameMin: Cijk_Ailk_Bljk_BSS_BH_UserArgs_MT256x128x64_MI16x16x1_SN_LDSB1_CLR1_GRVWA8_GRVWB8_GSU0_GSUC0_GSUWGMRR0_K1_LBSPPA4096_LBSPPB256_LPA0_LPB16_LRVW8_MIWT8_4_NEPBS16_PLR1_SU32_SUM0_SUS256_SVW4_SKXCCM0_ULSGRO1_VWA4_VWB2_WGM4_WGMXCC1_WGMXCCGn1
    SolutionIndex: 112
    SolutionNameMin: Cijk_Ailk_Bljk_BSS_BH_UserArgs_MT256x256x32_MI16x16x1_SN_LDSB1_CLR1_GRVWA8_GRVWB4_GSU0_GSUC0_GSUWGMRR0_K1_LBSPPA2048_LBSPPB128_LPA0_LPB4_LRVW4_MIWT8_8_NEPBS0_PLR1_SU32_SUM0_SUS256_SVW4_SKXCCM8_ULSGRO0_VWA4_VWB1_WGM8_WGMXCC1_WGMXCCGn1
    SolutionIndex: 113
    SolutionNameMin: Cijk_Ailk_Bljk_BSS_BH_UserArgs_MT64x64x128_MI16x16x1_SN_LDSB1_CLR1_GRVWA8_GRVWB8_GSU0_GSUC0_GSUWGMRR0_K1_LBSPPA1024_LBSPPB256_LPA32_LPB16_LRVW8_MIWT2_2_NEPBS16_PLR2_SU32_SUM0_SUS256_SVW2_SKXCCM8_ULSGRO0_VWA2_VWB1_WGM1_WGMXCC1_WGMXCCGn1
    SolutionIndex: 114
    SolutionNameMin: Cijk_Ailk_Bljk_BSS_BH_UserArgs_MT64x64x64_MI16x16x1_SN_LDSB1_CLR1_GRVWA8_GRVWB8_GSU0_GSUC0_GSUWGMRR0_K1_LBSPPA1024_LBSPPB128_LPA32_LPB16_LRVW8_MIWT2_2_NEPBS16_PLR1_SU32_SUM0_SUS256_SVW2_SKXCCM8_ULSGRO0_VWA2_VWB1_WGM1_WGMXCC1_WGMXCCGn1
    SolutionIndex: 115
    SolutionNameMin: Cijk_Ailk_Bljk_BSS_BH_UserArgs_MT64x32x128_MI16x16x1_SN_LDSB1_CLR1_GRVWA8_GRVWB8_GSU0_GSUC0_GSUWGMRR0_K1_LBSPPA1024_LBSPPB256_LPA32_LPB16_LRVW8_MIWT2_1_NEPBS0_PLR2_SU32_SUM0_SUS256_SVW2_SKXCCM0_ULSGRO0_VWA2_VWB1_WGM4_WGMXCC1_WGMXCCGn1
    SolutionIndex: 116
    SolutionNameMin: Cijk_Ailk_Bljk_BSS_BH_UserArgs_MT64x64x128_MI16x16x1_SN_LDSB1_CLR1_GRVWA8_GRVWB8_GSU0_GSUC0_GSUWGMRR0_K1_LBSPPA1024_LBSPPB512_LPA32_LPB16_LRVW8_MIWT2_2_NEPBS0_PLR2_SU32_SUM0_SUS256_SVW2_SKXCCM8_ULSGRO1_VWA2_VWB2_WGM8_WGMXCC1_WGMXCCGn1
    SolutionIndex: 117
    SolutionNameMin: Cijk_Ailk_Bljk_BSS_BH_UserArgs_MT64x64x64_MI16x16x1_SN_LDSB1_CLR1_GRVWA8_GRVWB8_GSU0_GSUC0_GSUWGMRR0_K1_LBSPPA1024_LBSPPB256_LPA32_LPB16_LRVW8_MIWT2_2_NEPBS16_PLR1_SU32_SUM0_SUS256_SVW2_SKXCCM8_ULSGRO1_VWA2_VWB2_WGM1_WGMXCC1_WGMXCCGn1
    SolutionIndex: 118
    SolutionNameMin: Cijk_Ailk_Bljk_BSS_BH_UserArgs_MT64x128x64_MI16x16x1_SN_LDSB1_CLR1_GRVWA8_GRVWB8_GSU0_GSUC0_GSUWGMRR0_K1_LBSPPA1024_LBSPPB256_LPA32_LPB16_LRVW8_MIWT2_4_NEPBS0_PLR1_SU32_SUM0_SUS256_SVW2_SKXCCM8_ULSGRO0_VWA2_VWB2_WGM1_WGMXCC1_WGMXCCGn1
    SolutionIndex: 119
    SolutionNameMin: Cijk_Ailk_Bljk_BSS_BH_UserArgs_MT64x64x128_MI16x16x1_SN_LDSB1_CLR1_GRVWA8_GRVWB8_GSU0_GSUC0_GSUWGMRR0_K1_LBSPPA1024_LBSPPB512_LPA32_LPB16_LRVW8_MIWT2_2_NEPBS16_PLR2_SU32_SUM0_SUS256_SVW2_SKXCCM0_ULSGRO1_VWA2_VWB2_WGM8_WGMXCC1_WGMXCCGn1
    SolutionIndex: 120
    SolutionNameMin: Cijk_Ailk_Bljk_BSS_BH_UserArgs_MT128x32x128_MI16x16x1_SN_LDSB1_CLR1_GRVWA8_GRVWB8_GSU0_GSUC0_GSUWGMRR0_K1_LBSPPA2048_LBSPPB256_LPA0_LPB16_LRVW8_MIWT4_1_NEPBS16_PLR2_SU32_SUM0_SUS256_SVW4_SKXCCM0_ULSGRO0_VWA4_VWB1_WGM4_WGMXCC1_WGMXCCGn1
    SolutionIndex: 121
    SolutionNameMin: Cijk_Ailk_Bljk_BSS_BH_UserArgs_MT64x64x128_MI16x16x1_SN_LDSB1_CLR1_GRVWA8_GRVWB8_GSU0_GSUC0_GSUWGMRR0_K1_LBSPPA1024_LBSPPB256_LPA32_LPB16_LRVW8_MIWT2_2_NEPBS16_PLR2_SU32_SUM0_SUS256_SVW2_SKXCCM8_ULSGRO0_VWA2_VWB1_WGM4_WGMXCC1_WGMXCCGn1
    SolutionIndex: 122
    SolutionNameMin: Cijk_Ailk_Bljk_BSS_BH_UserArgs_MT64x64x128_MI16x16x1_SN_LDSB1_CLR1_GRVWA8_GRVWB8_GSU0_GSUC0_GSUWGMRR0_K1_LBSPPA1024_LBSPPB256_LPA32_LPB16_LRVW8_MIWT2_2_NEPBS0_PLR2_SU32_SUM0_SUS256_SVW2_SKXCCM8_ULSGRO1_VWA2_VWB1_WGM4_WGMXCC1_WGMXCCGn1
    SolutionIndex: 123
    SolutionNameMin: Cijk_Ailk_Bljk_BSS_BH_UserArgs_MT64x128x128_MI16x16x1_SN_LDSB1_CLR1_GRVWA8_GRVWB8_GSU0_GSUC0_GSUWGMRR0_K1_LBSPPA1024_LBSPPB512_LPA16_LPB16_LRVW8_MIWT2_4_NEPBS16_PLR2_SU32_SUM0_SUS256_SVW1_SKXCCM0_ULSGRO1_VWA1_VWB2_WGM4_WGMXCC1_WGMXCCGn1
    SolutionIndex: 124
    SolutionNameMin: Cijk_Ailk_Bljk_BSS_BH_UserArgs_MT128x64x128_MI16x16x1_SN_LDSB1_CLR1_GRVWA8_GRVWB8_GSU0_GSUC0_GSUWGMRR0_K1_LBSPPA2048_LBSPPB256_LPA0_LPB16_LRVW8_MIWT4_2_NEPBS0_PLR1_SU32_SUM0_SUS256_SVW4_SKXCCM0_ULSGRO1_VWA4_VWB1_WGM4_WGMXCC1_WGMXCCGn1
    SolutionIndex: 125
    SolutionNameMin: Cijk_Ailk_Bljk_BSS_BH_UserArgs_MT128x64x128_MI16x16x1_SN_LDSB1_CLR1_GRVWA8_GRVWB8_GSU0_GSUC0_GSUWGMRR0_K1_LBSPPA2048_LBSPPB256_LPA0_LPB16_LRVW8_MIWT4_2_NEPBS0_PLR2_SU32_SUM0_SUS256_SVW4_SKXCCM8_ULSGRO1_VWA4_VWB1_WGM8_WGMXCC1_WGMXCCGn1
    SolutionIndex: 126
    SolutionNameMin: Cijk_Ailk_Bljk_BSS_BH_UserArgs_MT128x128x64_MI16x16x1_SN_LDSB1_CLR1_GRVWA8_GRVWB8_GSU0_GSUC0_GSUWGMRR0_K1_LBSPPA2048_LBSPPB256_LPA0_LPB16_LRVW8_MIWT4_4_NEPBS16_PLR1_SU32_SUM0_SUS256_SVW4_SKXCCM8_ULSGRO0_VWA4_VWB2_WGM1_WGMXCC1_WGMXCCGn1
    SolutionIndex: 127
    SolutionNameMin: Cijk_Ailk_Bljk_BSS_BH_UserArgs_MT128x128x64_MI16x16x1_SN_LDSB1_CLR1_GRVWA8_GRVWB8_GSU0_GSUC0_GSUWGMRR0_K1_LBSPPA2048_LBSPPB512_LPA0_LPB16_LRVW8_MIWT4_4_NEPBS0_PLR1_SU32_SUM0_SUS256_SVW4_SKXCCM8_ULSGRO1_VWA4_VWB4_WGM1_WGMXCC1_WGMXCCGn1
    SolutionIndex: 128
    SolutionNameMin: Cijk_Ailk_Bljk_BSS_BH_UserArgs_MT128x64x128_MI16x16x1_SN_LDSB1_CLR1_GRVWA8_GRVWB8_GSU0_GSUC0_GSUWGMRR0_K1_LBSPPA2048_LBSPPB512_LPA0_LPB16_LRVW8_MIWT4_2_NEPBS16_PLR1_SU32_SUM0_SUS256_SVW4_SKXCCM0_ULSGRO0_VWA4_VWB2_WGM8_WGMXCC1_WGMXCCGn1
    SolutionIndex: 129
    SolutionNameMin: Cijk_Ailk_Bljk_BSS_BH_UserArgs_MT128x64x128_MI16x16x1_SN_LDSB1_CLR1_GRVWA8_GRVWB8_GSU0_GSUC0_GSUWGMRR0_K1_LBSPPA2048_LBSPPB256_LPA0_LPB16_LRVW8_MIWT4_2_NEPBS0_PLR1_SU32_SUM0_SUS256_SVW4_SKXCCM0_ULSGRO0_VWA4_VWB1_WGM4_WGMXCC1_WGMXCCGn1
    SolutionIndex: 130
    SolutionNameMin: Cijk_Ailk_Bljk_BSS_BH_UserArgs_MT128x64x64_MI16x16x1_SN_LDSB1_CLR1_GRVWA8_GRVWB8_GSU0_GSUC0_GSUWGMRR0_K1_LBSPPA2048_LBSPPB128_LPA0_LPB16_LRVW8_MIWT4_2_NEPBS16_PLR1_SU32_SUM0_SUS256_SVW4_SKXCCM8_ULSGRO0_VWA4_VWB1_WGM1_WGMXCC1_WGMXCCGn1
    SolutionIndex: 131
    SolutionNameMin: Cijk_Ailk_Bljk_BSS_BH_UserArgs_MT256x128x64_MI16x16x1_SN_LDSB1_CLR1_GRVWA8_GRVWB8_GSU0_GSUC0_GSUWGMRR0_K1_LBSPPA4096_LBSPPB128_LPA0_LPB16_LRVW8_MIWT8_4_NEPBS0_PLR1_SU32_SUM0_SUS256_SVW4_SKXCCM8_ULSGRO0_VWA4_VWB1_WGM1_WGMXCC1_WGMXCCGn1
    SolutionIndex: 132
    SolutionNameMin: Cijk_Ailk_Bljk_BSS_BH_UserArgs_MT128x64x128_MI16x16x1_SN_LDSB1_CLR1_GRVWA8_GRVWB8_GSU0_GSUC0_GSUWGMRR0_K1_LBSPPA2048_LBSPPB256_LPA0_LPB16_LRVW8_MIWT4_2_NEPBS16_PLR2_SU32_SUM0_SUS256_SVW4_SKXCCM0_ULSGRO1_VWA4_VWB1_WGM1_WGMXCC1_WGMXCCGn1
    SolutionIndex: 133
    SolutionNameMin: Cijk_Ailk_Bljk_BSS_BH_UserArgs_MT128x64x128_MI16x16x1_SN_LDSB1_CLR1_GRVWA8_GRVWB8_GSU0_GSUC0_GSUWGMRR0_K1_LBSPPA2048_LBSPPB256_LPA0_LPB16_LRVW8_MIWT4_2_NEPBS0_PLR2_SU32_SUM0_SUS256_SVW4_SKXCCM0_ULSGRO0_VWA4_VWB1_WGM4_WGMXCC1_WGMXCCGn1
    SolutionIndex: 134
    SolutionNameMin: Cijk_Ailk_Bljk_BSS_BH_UserArgs_MT128x128x64_MI16x16x1_SN_LDSB1_CLR1_GRVWA8_GRVWB8_GSU0_GSUC0_GSUWGMRR0_K1_LBSPPA2048_LBSPPB128_LPA0_LPB16_LRVW8_MIWT4_4_NEPBS0_PLR1_SU32_SUM0_SUS256_SVW4_SKXCCM8_ULSGRO1_VWA4_VWB1_WGM4_WGMXCC1_WGMXCCGn1
    SolutionIndex: 135
    SolutionNameMin: Cijk_Ailk_Bljk_BSS_BH_UserArgs_MT128x128x64_MI16x16x1_SN_LDSB1_CLR1_GRVWA8_GRVWB8_GSU0_GSUC0_GSUWGMRR0_K1_LBSPPA2048_LBSPPB128_LPA0_LPB16_LRVW8_MIWT4_4_NEPBS16_PLR1_SU32_SUM0_SUS256_SVW4_SKXCCM8_ULSGRO0_VWA4_VWB1_WGM4_WGMXCC1_WGMXCCGn1
    SolutionIndex: 136
    SolutionNameMin: Cijk_Ailk_Bljk_BSS_BH_UserArgs_MT128x256x64_MI16x16x1_SN_LDSB1_CLR1_GRVWA8_GRVWB8_GSU0_GSUC0_GSUWGMRR0_K1_LBSPPA2048_LBSPPB256_LPA0_LPB16_LRVW8_MIWT4_8_NEPBS16_PLR1_SU32_SUM0_SUS256_SVW4_SKXCCM8_ULSGRO1_VWA4_VWB2_WGM1_WGMXCC1_WGMXCCGn1
    SolutionIndex: 137
    SolutionNameMin: Cijk_Ailk_Bljk_BSS_BH_UserArgs_MT128x256x64_MI16x16x1_SN_LDSB1_CLR1_GRVWA8_GRVWB8_GSU0_GSUC0_GSUWGMRR0_K1_LBSPPA2048_LBSPPB1024_LPA0_LPB16_LRVW8_MIWT4_8_NEPBS16_PLR1_SU32_SUM0_SUS256_SVW4_SKXCCM8_ULSGRO1_VWA4_VWB8_WGM1_WGMXCC1_WGMXCCGn1
    SolutionIndex: 138
    SolutionNameMin: Cijk_Ailk_Bljk_BSS_BH_UserArgs_MT256x256x32_MI16x16x1_SN_LDSB1_CLR1_GRVWA8_GRVWB4_GSU0_GSUC0_GSUWGMRR0_K1_LBSPPA2048_LBSPPB128_LPA0_LPB4_LRVW4_MIWT8_8_NEPBS0_PLR1_SU32_SUM0_SUS256_SVW4_SKXCCM8_ULSGRO0_VWA4_VWB1_WGM4_WGMXCC1_WGMXCCGn1
    SolutionIndex: 139
    SolutionNameMin: Cijk_Ailk_Bljk_BSS_BH_UserArgs_MT128x64x128_MI16x16x1_SN_LDSB1_CLR1_GRVWA8_GRVWB8_GSU0_GSUC0_GSUWGMRR0_K1_LBSPPA2048_LBSPPB256_LPA0_LPB16_LRVW8_MIWT4_2_NEPBS0_PLR2_SU32_SUM0_SUS256_SVW4_SKXCCM0_ULSGRO0_VWA4_VWB1_WGM1_WGMXCC1_WGMXCCGn1
    SolutionIndex: 140
    SolutionNameMin: Cijk_Ailk_Bljk_BSS_BH_UserArgs_MT128x64x128_MI16x16x1_SN_LDSB1_CLR1_GRVWA8_GRVWB8_GSU0_GSUC0_GSUWGMRR0_K1_LBSPPA2048_LBSPPB256_LPA0_LPB16_LRVW8_MIWT4_2_NEPBS0_PLR1_SU32_SUM0_SUS256_SVW4_SKXCCM8_ULSGRO0_VWA4_VWB1_WGM1_WGMXCC1_WGMXCCGn1
    SolutionIndex: 141
    SolutionNameMin: Cijk_Ailk_Bljk_BSS_BH_UserArgs_MT128x128x64_MI16x16x1_SN_LDSB1_CLR1_GRVWA8_GRVWB8_GSU0_GSUC0_GSUWGMRR0_K1_LBSPPA2048_LBSPPB128_LPA0_LPB16_LRVW8_MIWT4_4_NEPBS16_PLR1_SU32_SUM0_SUS256_SVW4_SKXCCM8_ULSGRO1_VWA4_VWB1_WGM4_WGMXCC1_WGMXCCGn1
    SolutionIndex: 142
    SolutionNameMin: Cijk_Ailk_Bljk_BSS_BH_UserArgs_MT256x256x32_MI16x16x1_SN_LDSB1_CLR1_GRVWA8_GRVWB4_GSU0_GSUC0_GSUWGMRR0_K1_LBSPPA2048_LBSPPB512_LPA0_LPB4_LRVW4_MIWT8_8_NEPBS16_PLR1_SU32_SUM0_SUS256_SVW4_SKXCCM8_ULSGRO0_VWA4_VWB8_WGM4_WGMXCC1_WGMXCCGn1
    SolutionIndex: 143
    SolutionNameMin: Cijk_Ailk_Bljk_BSS_BH_UserArgs_MT32x64x128_MI16x16x1_SN_LDSB1_CLR1_GRVWA8_GRVWB8_GSU0_GSUC0_GSUWGMRR0_K1_LBSPPA512_LBSPPB256_LPA16_LPB16_LRVW8_MIWT1_2_NEPBS0_PLR3_SU32_SUM0_SUS256_SVW1_SKXCCM0_ULSGRO1_VWA1_VWB1_WGM1_WGMXCC1_WGMXCCGn1
    SolutionIndex: 144
    SolutionNameMin: Cijk_Ailk_Bljk_BSS_BH_UserArgs_MT64x32x128_MI16x16x1_SN_LDSB1_CLR1_GRVWA8_GRVWB8_GSU0_GSUC0_GSUWGMRR0_K1_LBSPPA1024_LBSPPB256_LPA16_LPB16_LRVW8_MIWT2_1_NEPBS0_PLR2_SU32_SUM0_SUS256_SVW1_SKXCCM0_ULSGRO1_VWA1_VWB1_WGM8_WGMXCC1_WGMXCCGn1
    SolutionIndex: 145
    SolutionNameMin: Cijk_Ailk_Bljk_BSS_BH_UserArgs_MT64x32x128_MI16x16x1_SN_LDSB1_CLR1_GRVWA8_GRVWB8_GSU0_GSUC0_GSUWGMRR0_K1_LBSPPA1024_LBSPPB256_LPA32_LPB16_LRVW8_MIWT2_1_NEPBS16_PLR2_SU32_SUM0_SUS256_SVW2_SKXCCM8_ULSGRO0_VWA2_VWB1_WGM8_WGMXCC1_WGMXCCGn1
    SolutionIndex: 146
    SolutionNameMin: Cijk_Ailk_Bljk_BSS_BH_UserArgs_MT64x64x64_MI16x16x1_SN_LDSB1_CLR1_GRVWA8_GRVWB8_GSU0_GSUC0_GSUWGMRR0_K1_LBSPPA1024_LBSPPB256_LPA32_LPB16_LRVW8_MIWT2_2_NEPBS16_PLR1_SU32_SUM0_SUS256_SVW2_SKXCCM0_ULSGRO1_VWA2_VWB2_WGM1_WGMXCC1_WGMXCCGn1
    SolutionIndex: 147
    SolutionNameMin: Cijk_Ailk_Bljk_BSS_BH_UserArgs_MT64x128x64_MI16x16x1_SN_LDSB1_CLR1_GRVWA8_GRVWB8_GSU0_GSUC0_GSUWGMRR0_K1_LBSPPA1024_LBSPPB128_LPA32_LPB16_LRVW8_MIWT2_4_NEPBS0_PLR1_SU32_SUM0_SUS256_SVW2_SKXCCM0_ULSGRO0_VWA2_VWB1_WGM1_WGMXCC1_WGMXCCGn1
    SolutionIndex: 148
    SolutionNameMin: Cijk_Ailk_Bljk_BSS_BH_UserArgs_MT64x64x128_MI16x16x1_SN_LDSB1_CLR1_GRVWA8_GRVWB8_GSU0_GSUC0_GSUWGMRR0_K1_LBSPPA1024_LBSPPB512_LPA32_LPB16_LRVW8_MIWT2_2_NEPBS16_PLR3_SU32_SUM0_SUS256_SVW2_SKXCCM0_ULSGRO1_VWA2_VWB2_WGM8_WGMXCC1_WGMXCCGn1
    SolutionIndex: 149
    SolutionNameMin: Cijk_Ailk_Bljk_BSS_BH_UserArgs_MT128x32x128_MI16x16x1_SN_LDSB1_CLR1_GRVWA8_GRVWB8_GSU0_GSUC0_GSUWGMRR0_K1_LBSPPA2048_LBSPPB256_LPA0_LPB16_LRVW8_MIWT4_1_NEPBS16_PLR3_SU32_SUM0_SUS256_SVW4_SKXCCM8_ULSGRO1_VWA4_VWB1_WGM1_WGMXCC1_WGMXCCGn1
    SolutionIndex: 150
    SolutionNameMin: Cijk_Ailk_Bljk_BSS_BH_UserArgs_MT64x64x128_MI16x16x1_SN_LDSB1_CLR1_GRVWA8_GRVWB8_GSU0_GSUC0_GSUWGMRR0_K1_LBSPPA1024_LBSPPB512_LPA32_LPB16_LRVW8_MIWT2_2_NEPBS16_PLR2_SU32_SUM0_SUS256_SVW2_SKXCCM8_ULSGRO0_VWA2_VWB2_WGM1_WGMXCC1_WGMXCCGn1
    SolutionIndex: 151
    SolutionNameMin: Cijk_Ailk_Bljk_BSS_BH_UserArgs_MT64x64x128_MI16x16x1_SN_LDSB1_CLR1_GRVWA8_GRVWB8_GSU0_GSUC0_GSUWGMRR0_K1_LBSPPA1024_LBSPPB256_LPA32_LPB16_LRVW8_MIWT2_2_NEPBS0_PLR2_SU32_SUM0_SUS256_SVW2_SKXCCM8_ULSGRO1_VWA2_VWB1_WGM8_WGMXCC1_WGMXCCGn1
    SolutionIndex: 152
    SolutionNameMin: Cijk_Ailk_Bljk_BSS_BH_UserArgs_MT64x128x64_MI16x16x1_SN_LDSB1_CLR1_GRVWA8_GRVWB8_GSU0_GSUC0_GSUWGMRR0_K1_LBSPPA1024_LBSPPB128_LPA32_LPB16_LRVW8_MIWT2_4_NEPBS16_PLR1_SU32_SUM0_SUS256_SVW2_SKXCCM8_ULSGRO0_VWA2_VWB1_WGM1_WGMXCC1_WGMXCCGn1
    SolutionIndex: 153
    SolutionNameMin: Cijk_Ailk_Bljk_BSS_BH_UserArgs_MT64x128x128_MI16x16x1_SN_LDSB1_CLR1_GRVWA8_GRVWB8_GSU0_GSUC0_GSUWGMRR0_K1_LBSPPA1024_LBSPPB256_LPA16_LPB16_LRVW8_MIWT2_4_NEPBS16_PLR2_SU32_SUM0_SUS256_SVW1_SKXCCM0_ULSGRO1_VWA1_VWB1_WGM4_WGMXCC1_WGMXCCGn1
    SolutionIndex: 154
    SolutionNameMin: Cijk_Ailk_Bljk_BSS_BH_UserArgs_MT128x64x128_MI16x16x1_SN_LDSB1_CLR1_GRVWA8_GRVWB8_GSU0_GSUC0_GSUWGMRR0_K1_LBSPPA2048_LBSPPB512_LPA0_LPB16_LRVW8_MIWT4_2_NEPBS0_PLR1_SU32_SUM0_SUS256_SVW4_SKXCCM8_ULSGRO0_VWA4_VWB2_WGM4_WGMXCC1_WGMXCCGn1
    SolutionIndex: 155
    SolutionNameMin: Cijk_Ailk_Bljk_BSS_BH_UserArgs_MT128x64x64_MI16x16x1_SN_LDSB1_CLR1_GRVWA8_GRVWB8_GSU0_GSUC0_GSUWGMRR0_K1_LBSPPA2048_LBSPPB128_LPA0_LPB16_LRVW8_MIWT4_2_NEPBS0_PLR1_SU32_SUM0_SUS256_SVW4_SKXCCM8_ULSGRO0_VWA4_VWB1_WGM8_WGMXCC1_WGMXCCGn1
    SolutionIndex: 156
    SolutionNameMin: Cijk_Ailk_Bljk_BSS_BH_UserArgs_MT128x128x64_MI16x16x1_SN_LDSB1_CLR1_GRVWA8_GRVWB8_GSU0_GSUC0_GSUWGMRR0_K1_LBSPPA2048_LBSPPB256_LPA0_LPB16_LRVW8_MIWT4_4_NEPBS0_PLR1_SU32_SUM0_SUS256_SVW4_SKXCCM8_ULSGRO0_VWA4_VWB2_WGM1_WGMXCC1_WGMXCCGn1
    SolutionIndex: 157
    SolutionNameMin: Cijk_Ailk_Bljk_BSS_BH_UserArgs_MT128x64x128_MI16x16x1_SN_LDSB1_CLR1_GRVWA8_GRVWB8_GSU0_GSUC0_GSUWGMRR0_K1_LBSPPA2048_LBSPPB512_LPA32_LPB16_LRVW8_MIWT4_2_NEPBS16_PLR2_SU32_SUM0_SUS256_SVW2_SKXCCM0_ULSGRO1_VWA2_VWB2_WGM8_WGMXCC1_WGMXCCGn1
    SolutionIndex: 158
    SolutionNameMin: Cijk_Ailk_Bljk_BSS_BH_UserArgs_MT128x64x128_MI16x16x1_SN_LDSB1_CLR1_GRVWA8_GRVWB8_GSU0_GSUC0_GSUWGMRR0_K1_LBSPPA2048_LBSPPB512_LPA0_LPB16_LRVW8_MIWT4_2_NEPBS0_PLR2_SU32_SUM0_SUS256_SVW4_SKXCCM0_ULSGRO1_VWA4_VWB2_WGM1_WGMXCC1_WGMXCCGn1
    SolutionIndex: 159
    SolutionNameMin: Cijk_Ailk_Bljk_BSS_BH_UserArgs_MT128x64x64_MI16x16x1_SN_LDSB1_CLR1_GRVWA8_GRVWB8_GSU0_GSUC0_GSUWGMRR0_K1_LBSPPA2048_LBSPPB128_LPA0_LPB16_LRVW8_MIWT4_2_NEPBS0_PLR1_SU32_SUM0_SUS256_SVW4_SKXCCM8_ULSGRO1_VWA4_VWB1_WGM8_WGMXCC1_WGMXCCGn1
    SolutionIndex: 160
    SolutionNameMin: Cijk_Ailk_Bljk_BSS_BH_UserArgs_MT128x128x64_MI16x16x1_SN_LDSB1_CLR1_GRVWA8_GRVWB8_GSU0_GSUC0_GSUWGMRR0_K1_LBSPPA2048_LBSPPB256_LPA0_LPB16_LRVW8_MIWT4_4_NEPBS0_PLR1_SU32_SUM0_SUS256_SVW4_SKXCCM8_ULSGRO1_VWA4_VWB2_WGM8_WGMXCC1_WGMXCCGn1
    SolutionIndex: 161
    SolutionNameMin: Cijk_Ailk_Bljk_BSS_BH_UserArgs_MT128x128x64_MI16x16x1_SN_LDSB1_CLR1_GRVWA8_GRVWB8_GSU0_GSUC0_GSUWGMRR0_K1_LBSPPA2048_LBSPPB512_LPA0_LPB16_LRVW8_MIWT4_4_NEPBS16_PLR1_SU32_SUM0_SUS256_SVW4_SKXCCM8_ULSGRO1_VWA4_VWB4_WGM1_WGMXCC1_WGMXCCGn1
    SolutionIndex: 162
    SolutionNameMin: Cijk_Ailk_Bljk_BSS_BH_UserArgs_MT128x256x64_MI16x16x1_SN_LDSB1_CLR1_GRVWA8_GRVWB8_GSU0_GSUC0_GSUWGMRR0_K1_LBSPPA2048_LBSPPB512_LPA0_LPB16_LRVW8_MIWT4_8_NEPBS0_PLR1_SU32_SUM0_SUS256_SVW4_SKXCCM8_ULSGRO0_VWA4_VWB4_WGM1_WGMXCC1_WGMXCCGn1
    SolutionIndex: 163
    SolutionNameMin: Cijk_Ailk_Bljk_BSS_BH_UserArgs_MT128x64x128_MI16x16x1_SN_LDSB1_CLR1_GRVWA8_GRVWB8_GSU0_GSUC0_GSUWGMRR0_K1_LBSPPA2048_LBSPPB512_LPA0_LPB16_LRVW8_MIWT4_2_NEPBS16_PLR1_SU32_SUM0_SUS256_SVW4_SKXCCM0_ULSGRO1_VWA4_VWB2_WGM1_WGMXCC1_WGMXCCGn1
    SolutionIndex: 164
    SolutionNameMin: Cijk_Ailk_Bljk_BSS_BH_UserArgs_MT128x64x128_MI16x16x1_SN_LDSB1_CLR1_GRVWA8_GRVWB8_GSU0_GSUC0_GSUWGMRR0_K1_LBSPPA2048_LBSPPB256_LPA0_LPB16_LRVW8_MIWT4_2_NEPBS16_PLR2_SU32_SUM0_SUS256_SVW4_SKXCCM0_ULSGRO0_VWA4_VWB1_WGM4_WGMXCC1_WGMXCCGn1
    SolutionIndex: 165
    SolutionNameMin: Cijk_Ailk_Bljk_BSS_BH_UserArgs_MT128x256x64_MI16x16x1_SN_LDSB1_CLR1_GRVWA8_GRVWB8_GSU0_GSUC0_GSUWGMRR0_K1_LBSPPA2048_LBSPPB512_LPA0_LPB16_LRVW8_MIWT4_8_NEPBS0_PLR1_SU32_SUM0_SUS256_SVW4_SKXCCM8_ULSGRO1_VWA4_VWB4_WGM1_WGMXCC1_WGMXCCGn1
    SolutionIndex: 166
    SolutionNameMin: Cijk_Ailk_Bljk_BSS_BH_UserArgs_MT256x256x32_MI16x16x1_SN_LDSB1_CLR1_GRVWA4_GRVWB4_GSU0_GSUC0_GSUWGMRR0_K1_LBSPPA2048_LBSPPB128_LPA0_LPB4_LRVW4_MIWT8_8_NEPBS16_PLR1_SU32_SUM0_SUS256_SVW4_SKXCCM8_ULSGRO1_VWA4_VWB1_WGM1_WGMXCC1_WGMXCCGn1
    SolutionIndex: 167
    SolutionNameMin: Cijk_Ailk_Bljk_BSS_BH_UserArgs_MT128x64x128_MI16x16x1_SN_LDSB1_CLR1_GRVWA8_GRVWB8_GSU0_GSUC0_GSUWGMRR0_K1_LBSPPA2048_LBSPPB256_LPA0_LPB16_LRVW8_MIWT4_2_NEPBS0_PLR1_SU32_SUM0_SUS256_SVW4_SKXCCM0_ULSGRO0_VWA4_VWB1_WGM1_WGMXCC1_WGMXCCGn1
    SolutionIndex: 168
    SolutionNameMin: Cijk_Ailk_Bljk_BSS_BH_UserArgs_MT128x128x64_MI16x16x1_SN_LDSB1_CLR1_GRVWA8_GRVWB8_GSU0_GSUC0_GSUWGMRR0_K1_LBSPPA2048_LBSPPB512_LPA0_LPB16_LRVW8_MIWT4_4_NEPBS16_PLR1_SU32_SUM0_SUS256_SVW4_SKXCCM8_ULSGRO1_VWA4_VWB4_WGM4_WGMXCC1_WGMXCCGn1
    SolutionIndex: 169
    SolutionNameMin: Cijk_Ailk_Bljk_BSS_BH_UserArgs_MT128x256x64_MI16x16x1_SN_LDSB1_CLR1_GRVWA8_GRVWB8_GSU0_GSUC0_GSUWGMRR0_K1_LBSPPA2048_LBSPPB128_LPA0_LPB16_LRVW8_MIWT4_8_NEPBS16_PLR1_SU32_SUM0_SUS256_SVW4_SKXCCM8_ULSGRO0_VWA4_VWB1_WGM1_WGMXCC1_WGMXCCGn1
    SolutionIndex: 170
    SolutionNameMin: Cijk_Ailk_Bljk_BSS_BH_UserArgs_MT128x256x64_MI16x16x1_SN_LDSB1_CLR1_GRVWA8_GRVWB8_GSU0_GSUC0_GSUWGMRR0_K1_LBSPPA2048_LBSPPB128_LPA0_LPB16_LRVW8_MIWT4_8_NEPBS0_PLR1_SU32_SUM0_SUS256_SVW4_SKXCCM8_ULSGRO1_VWA4_VWB1_WGM1_WGMXCC1_WGMXCCGn1
    SolutionIndex: 171
    SolutionNameMin: Cijk_Ailk_Bljk_BSS_BH_UserArgs_MT256x256x32_MI16x16x1_SN_LDSB1_CLR1_GRVWA8_GRVWB4_GSU0_GSUC0_GSUWGMRR0_K1_LBSPPA2048_LBSPPB128_LPA0_LPB4_LRVW4_MIWT8_8_NEPBS16_PLR1_SU32_SUM0_SUS256_SVW4_SKXCCM8_ULSGRO0_VWA4_VWB1_WGM8_WGMXCC1_WGMXCCGn1
    SolutionIndex: 172
    SolutionNameMin: Cijk_Ailk_Bljk_BSS_BH_UserArgs_MT128x128x64_MI16x16x1_SN_LDSB1_CLR1_GRVWA8_GRVWB8_GSU0_GSUC0_GSUWGMRR0_K1_LBSPPA2048_LBSPPB512_LPA0_LPB16_LRVW8_MIWT4_4_NEPBS16_PLR1_SU32_SUM0_SUS256_SVW4_SKXCCM0_ULSGRO0_VWA4_VWB4_WGM1_WGMXCC1_WGMXCCGn1
    SolutionIndex: 173
    SolutionNameMin: Cijk_Ailk_Bljk_BSS_BH_UserArgs_MT128x128x64_MI16x16x1_SN_LDSB1_CLR1_GRVWA8_GRVWB8_GSU0_GSUC0_GSUWGMRR0_K1_LBSPPA2048_LBSPPB128_LPA0_LPB16_LRVW8_MIWT4_4_NEPBS16_PLR1_SU32_SUM0_SUS256_SVW4_SKXCCM0_ULSGRO1_VWA4_VWB1_WGM4_WGMXCC1_WGMXCCGn1
    SolutionIndex: 174
    SolutionNameMin: Cijk_Ailk_Bljk_BSS_BH_UserArgs_MT128x128x64_MI16x16x1_SN_LDSB1_CLR1_GRVWA8_GRVWB8_GSU0_GSUC0_GSUWGMRR0_K1_LBSPPA2048_LBSPPB256_LPA0_LPB16_LRVW8_MIWT4_4_NEPBS16_PLR1_SU32_SUM0_SUS256_SVW4_SKXCCM8_ULSGRO0_VWA4_VWB2_WGM4_WGMXCC1_WGMXCCGn1
    SolutionIndex: 175
    SolutionNameMin: Cijk_Ailk_Bljk_BSS_BH_UserArgs_MT256x256x32_MI16x16x1_SN_LDSB1_CLR1_GRVWA8_GRVWB4_GSU0_GSUC0_GSUWGMRR0_K1_LBSPPA2048_LBSPPB128_LPA0_LPB4_LRVW4_MIWT8_8_NEPBS16_PLR1_SU32_SUM0_SUS256_SVW4_SKXCCM8_ULSGRO0_VWA4_VWB1_WGM1_WGMXCC1_WGMXCCGn1
    SolutionIndex: 176
    SolutionNameMin: Cijk_Ailk_Bljk_BSS_BH_UserArgs_MT256x256x32_MI16x16x1_SN_LDSB1_CLR1_GRVWA8_GRVWB4_GSU0_GSUC0_GSUWGMRR0_K1_LBSPPA2048_LBSPPB512_LPA0_LPB4_LRVW4_MIWT8_8_NEPBS16_PLR1_SU32_SUM0_SUS256_SVW4_SKXCCM8_ULSGRO0_VWA4_VWB8_WGM1_WGMXCC1_WGMXCCGn1
    SolutionIndex: 177
    SolutionNameMin: Cijk_Ailk_Bljk_BSS_BH_UserArgs_MT256x256x32_MI16x16x1_SN_LDSB1_CLR1_GRVWA8_GRVWB4_GSU0_GSUC0_GSUWGMRR0_K1_LBSPPA2048_LBSPPB512_LPA0_LPB4_LRVW4_MIWT8_8_NEPBS0_PLR1_SU32_SUM0_SUS256_SVW4_SKXCCM8_ULSGRO0_VWA4_VWB8_WGM1_WGMXCC1_WGMXCCGn1
    SolutionIndex: 178
    SolutionNameMin: Cijk_Ailk_Bljk_BSS_BH_UserArgs_MT64x64x128_MI16x16x1_SN_LDSB1_CLR1_GRVWA8_GRVWB8_GSU0_GSUC0_GSUWGMRR0_K1_LBSPPA1024_LBSPPB512_LPA32_LPB16_LRVW8_MIWT2_2_NEPBS16_PLR2_SU32_SUM0_SUS256_SVW2_SKXCCM8_ULSGRO0_VWA2_VWB2_WGM4_WGMXCC1_WGMXCCGn1
    SolutionIndex: 179
    SolutionNameMin: Cijk_Ailk_Bljk_BSS_BH_UserArgs_MT128x128x64_MI16x16x1_SN_LDSB1_CLR1_GRVWA8_GRVWB8_GSU0_GSUC0_GSUWGMRR0_K1_LBSPPA2048_LBSPPB128_LPA0_LPB16_LRVW8_MIWT4_4_NEPBS0_PLR1_SU32_SUM0_SUS256_SVW4_SKXCCM0_ULSGRO1_VWA4_VWB1_WGM1_WGMXCC1_WGMXCCGn1
    SolutionIndex: 180
    SolutionNameMin: Cijk_Ailk_Bljk_BSS_BH_UserArgs_MT64x128x128_MI16x16x1_SN_LDSB1_CLR1_GRVWA8_GRVWB8_GSU0_GSUC0_GSUWGMRR0_K1_LBSPPA1024_LBSPPB256_LPA16_LPB16_LRVW8_MIWT2_4_NEPBS16_PLR2_SU32_SUM0_SUS256_SVW1_SKXCCM8_ULSGRO1_VWA1_VWB1_WGM1_WGMXCC1_WGMXCCGn1
    SolutionIndex: 181
    SolutionNameMin: Cijk_Ailk_Bljk_BSS_BH_UserArgs_MT128x64x128_MI16x16x1_SN_LDSB1_CLR1_GRVWA8_GRVWB8_GSU0_GSUC0_GSUWGMRR0_K1_LBSPPA2048_LBSPPB512_LPA0_LPB16_LRVW8_MIWT4_2_NEPBS0_PLR3_SU32_SUM0_SUS256_SVW4_SKXCCM8_ULSGRO0_VWA4_VWB2_WGM4_WGMXCC1_WGMXCCGn1
    SolutionIndex: 182
    SolutionNameMin: Cijk_Ailk_Bljk_BSS_BH_UserArgs_MT128x64x128_MI16x16x1_SN_LDSB1_CLR1_GRVWA8_GRVWB8_GSU0_GSUC0_GSUWGMRR0_K1_LBSPPA2048_LBSPPB256_LPA0_LPB16_LRVW8_MIWT4_2_NEPBS0_PLR2_SU32_SUM0_SUS256_SVW4_SKXCCM8_ULSGRO1_VWA4_VWB1_WGM4_WGMXCC1_WGMXCCGn1
    SolutionIndex: 183
    SolutionNameMin: Cijk_Ailk_Bljk_BSS_BH_UserArgs_MT64x128x128_MI16x16x1_SN_LDSB1_CLR1_GRVWA8_GRVWB8_GSU0_GSUC0_GSUWGMRR0_K1_LBSPPA1024_LBSPPB256_LPA32_LPB16_LRVW8_MIWT2_4_NEPBS16_PLR2_SU32_SUM0_SUS256_SVW2_SKXCCM8_ULSGRO1_VWA2_VWB1_WGM4_WGMXCC1_WGMXCCGn1
    SolutionIndex: 184
    SolutionNameMin: Cijk_Ailk_Bljk_BSS_BH_UserArgs_MT128x64x128_MI16x16x1_SN_LDSB1_CLR1_GRVWA8_GRVWB8_GSU0_GSUC0_GSUWGMRR0_K1_LBSPPA2048_LBSPPB512_LPA0_LPB16_LRVW8_MIWT4_2_NEPBS16_PLR1_SU32_SUM0_SUS256_SVW4_SKXCCM8_ULSGRO0_VWA4_VWB2_WGM8_WGMXCC1_WGMXCCGn1
    SolutionIndex: 185
    SolutionNameMin: Cijk_Ailk_Bljk_BSS_BH_UserArgs_MT128x256x64_MI16x16x1_SN_LDSB1_CLR1_GRVWA8_GRVWB8_GSU0_GSUC0_GSUWGMRR0_K1_LBSPPA2048_LBSPPB512_LPA0_LPB16_LRVW8_MIWT4_8_NEPBS16_PLR1_SU32_SUM0_SUS256_SVW4_SKXCCM8_ULSGRO1_VWA4_VWB4_WGM1_WGMXCC1_WGMXCCGn1
    SolutionIndex: 186
    SolutionNameMin: Cijk_Ailk_Bljk_BSS_BH_UserArgs_MT128x256x64_MI16x16x1_SN_LDSB1_CLR1_GRVWA8_GRVWB8_GSU0_GSUC0_GSUWGMRR0_K1_LBSPPA2048_LBSPPB1024_LPA0_LPB16_LRVW8_MIWT4_8_NEPBS0_PLR1_SU32_SUM0_SUS256_SVW4_SKXCCM0_ULSGRO0_VWA4_VWB8_WGM1_WGMXCC1_WGMXCCGn1
    SolutionIndex: 187
    SolutionNameMin: Cijk_Ailk_Bljk_BSS_BH_UserArgs_MT128x64x128_MI16x16x1_SN_LDSB1_CLR1_GRVWA8_GRVWB8_GSU0_GSUC0_GSUWGMRR0_K1_LBSPPA2048_LBSPPB512_LPA0_LPB16_LRVW8_MIWT4_2_NEPBS16_PLR1_SU32_SUM0_SUS256_SVW4_SKXCCM0_ULSGRO0_VWA4_VWB2_WGM1_WGMXCC1_WGMXCCGn1
    SolutionIndex: 188
    SolutionNameMin: Cijk_Ailk_Bljk_BSS_BH_UserArgs_MT128x128x64_MI16x16x1_SN_LDSB1_CLR1_GRVWA8_GRVWB8_GSU0_GSUC0_GSUWGMRR0_K1_LBSPPA2048_LBSPPB512_LPA0_LPB16_LRVW8_MIWT4_4_NEPBS0_PLR1_SU32_SUM0_SUS256_SVW4_SKXCCM8_ULSGRO0_VWA4_VWB4_WGM4_WGMXCC1_WGMXCCGn1
    SolutionIndex: 189
    SolutionNameMin: Cijk_Ailk_Bljk_BSS_BH_UserArgs_MT128x128x64_MI16x16x1_SN_LDSB1_CLR1_GRVWA8_GRVWB8_GSU0_GSUC0_GSUWGMRR0_K1_LBSPPA2048_LBSPPB256_LPA0_LPB16_LRVW8_MIWT4_4_NEPBS0_PLR1_SU32_SUM0_SUS256_SVW4_SKXCCM8_ULSGRO1_VWA4_VWB2_WGM4_WGMXCC1_WGMXCCGn1
    SolutionIndex: 190
    SolutionNameMin: Cijk_Ailk_Bljk_BSS_BH_UserArgs_MT64x128x128_MI16x16x1_SN_LDSB1_CLR1_GRVWA8_GRVWB8_GSU0_GSUC0_GSUWGMRR0_K1_LBSPPA1024_LBSPPB256_LPA32_LPB16_LRVW8_MIWT2_4_NEPBS0_PLR2_SU32_SUM0_SUS256_SVW2_SKXCCM0_ULSGRO0_VWA2_VWB1_WGM1_WGMXCC1_WGMXCCGn1
    SolutionIndex: 191
    SolutionNameMin: Cijk_Ailk_Bljk_BSS_BH_UserArgs_MT128x256x64_MI16x16x1_SN_LDSB1_CLR1_GRVWA8_GRVWB8_GSU0_GSUC0_GSUWGMRR0_K1_LBSPPA2048_LBSPPB512_LPA0_LPB16_LRVW8_MIWT4_8_NEPBS16_PLR1_SU32_SUM0_SUS256_SVW4_SKXCCM8_ULSGRO0_VWA4_VWB4_WGM4_WGMXCC1_WGMXCCGn1
    SolutionIndex: 192
    SolutionNameMin: Cijk_Ailk_Bljk_BSS_BH_UserArgs_MT128x128x64_MI16x16x1_SN_LDSB1_CLR1_GRVWA8_GRVWB8_GSU0_GSUC0_GSUWGMRR0_K1_LBSPPA2048_LBSPPB256_LPA0_LPB16_LRVW8_MIWT4_4_NEPBS16_PLR1_SU32_SUM0_SUS256_SVW4_SKXCCM8_ULSGRO1_VWA4_VWB2_WGM4_WGMXCC1_WGMXCCGn1
    SolutionIndex: 193
    SolutionNameMin: Cijk_Ailk_Bljk_BSS_BH_UserArgs_MT256x128x64_MI16x16x1_SN_LDSB1_CLR1_GRVWA8_GRVWB8_GSU0_GSUC0_GSUWGMRR0_K1_LBSPPA4096_LBSPPB256_LPA0_LPB16_LRVW8_MIWT8_4_NEPBS0_PLR1_SU32_SUM0_SUS256_SVW4_SKXCCM8_ULSGRO0_VWA4_VWB2_WGM4_WGMXCC1_WGMXCCGn1
    SolutionIndex: 194
    SolutionNameMin: Cijk_Ailk_Bljk_BSS_BH_UserArgs_MT128x128x64_MI16x16x1_SN_LDSB1_CLR1_GRVWA8_GRVWB8_GSU0_GSUC0_GSUWGMRR0_K1_LBSPPA2048_LBSPPB512_LPA0_LPB16_LRVW8_MIWT4_4_NEPBS16_PLR1_SU32_SUM0_SUS256_SVW4_SKXCCM0_ULSGRO1_VWA4_VWB4_WGM4_WGMXCC1_WGMXCCGn1
    SolutionIndex: 195
    SolutionNameMin: Cijk_Ailk_Bljk_BSS_BH_UserArgs_MT128x128x64_MI16x16x1_SN_LDSB1_CLR1_GRVWA8_GRVWB8_GSU0_GSUC0_GSUWGMRR0_K1_LBSPPA2048_LBSPPB128_LPA0_LPB16_LRVW8_MIWT4_4_NEPBS0_PLR1_SU32_SUM0_SUS256_SVW4_SKXCCM0_ULSGRO0_VWA4_VWB1_WGM4_WGMXCC1_WGMXCCGn1
    SolutionIndex: 196
    SolutionNameMin: Cijk_Ailk_Bljk_BSS_BH_UserArgs_MT128x128x64_MI16x16x1_SN_LDSB1_CLR1_GRVWA8_GRVWB8_GSU0_GSUC0_GSUWGMRR0_K1_LBSPPA2048_LBSPPB512_LPA0_LPB16_LRVW8_MIWT4_4_NEPBS0_PLR1_SU32_SUM0_SUS256_SVW4_SKXCCM8_ULSGRO0_VWA4_VWB4_WGM8_WGMXCC1_WGMXCCGn1
    SolutionIndex: 197
    SolutionNameMin: Cijk_Ailk_Bljk_BSS_BH_UserArgs_MT256x256x32_MI16x16x1_SN_LDSB1_CLR1_GRVWA8_GRVWB4_GSU0_GSUC0_GSUWGMRR0_K1_LBSPPA2048_LBSPPB256_LPA0_LPB4_LRVW4_MIWT8_8_NEPBS0_PLR1_SU32_SUM0_SUS256_SVW4_SKXCCM8_ULSGRO0_VWA4_VWB4_WGM8_WGMXCC1_WGMXCCGn1
    SolutionIndex: 198
    SolutionNameMin: Cijk_Ailk_Bljk_BSS_BH_UserArgs_MT128x256x64_MI16x16x1_SN_LDSB1_CLR1_GRVWA8_GRVWB8_GSU0_GSUC0_GSUWGMRR0_K1_LBSPPA2048_LBSPPB512_LPA0_LPB16_LRVW8_MIWT4_8_NEPBS0_PLR1_SU32_SUM0_SUS256_SVW4_SKXCCM8_ULSGRO0_VWA4_VWB4_WGM4_WGMXCC1_WGMXCCGn1
    SolutionIndex: 199
    SolutionNameMin: Cijk_Ailk_Bljk_BSS_BH_UserArgs_MT128x256x64_MI16x16x1_SN_LDSB1_CLR1_GRVWA8_GRVWB8_GSU0_GSUC0_GSUWGMRR0_K1_LBSPPA2048_LBSPPB1024_LPA0_LPB16_LRVW8_MIWT4_8_NEPBS16_PLR1_SU32_SUM0_SUS256_SVW4_SKXCCM8_ULSGRO0_VWA4_VWB8_WGM4_WGMXCC1_WGMXCCGn1
    SolutionIndex: 200
    SolutionNameMin: Cijk_Ailk_Bljk_BSS_BH_UserArgs_MT256x64x32_MI16x16x1_SN_LDSB1_CLR1_GRVWA4_GRVWB4_GSU0_GSUC0_GSUWGMRR0_K1_LBSPPA2048_LBSPPB128_LPA0_LPB4_LRVW4_MIWT8_2_NEPBS16_PLR1_SU32_SUM0_SUS256_SVW4_SKXCCM0_ULSGRO1_VWA4_VWB2_WGM1_WGMXCC1_WGMXCCGn1
    SolutionIndex: 201
    SolutionNameMin: Cijk_Ailk_Bljk_BSS_BH_UserArgs_MT128x256x64_MI16x16x1_SN_LDSB1_CLR1_GRVWA8_GRVWB8_GSU0_GSUC0_GSUWGMRR0_K1_LBSPPA2048_LBSPPB128_LPA0_LPB16_LRVW8_MIWT4_8_NEPBS16_PLR1_SU32_SUM0_SUS256_SVW4_SKXCCM8_ULSGRO0_VWA4_VWB1_WGM4_WGMXCC1_WGMXCCGn1
    SolutionIndex: 202
    SolutionNameMin: Cijk_Ailk_Bljk_BSS_BH_UserArgs_MT256x256x32_MI16x16x1_SN_LDSB1_CLR1_GRVWA8_GRVWB4_GSU0_GSUC0_GSUWGMRR0_K1_LBSPPA2048_LBSPPB512_LPA0_LPB4_LRVW4_MIWT8_8_NEPBS0_PLR1_SU32_SUM0_SUS256_SVW4_SKXCCM8_ULSGRO0_VWA4_VWB8_WGM4_WGMXCC1_WGMXCCGn1
- - - [128, 128, 1, 128]
    - [58, 0.086]
  - - [128, 128, 1, 256]
    - [6, 0.105]
  - - [128, 128, 1, 512]
    - [58, 0.175]
  - - [128, 128, 1, 1024]
    - [38, 0.273]
  - - [128, 128, 1, 2048]
    - [41, 0.351]
  - - [128, 128, 1, 4096]
    - [11, 0.506]
  - - [128, 128, 1, 8192]
    - [11, 1.008]
  - - [128, 256, 1, 128]
    - [7, 0.168]
  - - [128, 256, 1, 256]
    - [16, 0.203]
  - - [128, 256, 1, 512]
    - [6, 0.335]
  - - [128, 256, 1, 1024]
    - [38, 0.535]
  - - [128, 256, 1, 2048]
    - [1, 0.781]
  - - [128, 256, 1, 4096]
    - [3, 1.506]
  - - [128, 256, 1, 8192]
    - [48, 2.7]
  - - [128, 512, 1, 128]
    - [9, 0.333]
  - - [128, 512, 1, 256]
    - [17, 0.399]
  - - [128, 512, 1, 512]
    - [60, 0.662]
  - - [128, 512, 1, 1024]
    - [26, 1.107]
  - - [128, 512, 1, 2048]
    - [38, 2.019]
  - - [128, 512, 1, 4096]
    - [59, 3.459]
  - - [128, 512, 1, 8192]
    - [42, 5.538]
  - - [128, 1024, 1, 128]
    - [40, 0.626]
  - - [128, 1024, 1, 256]
    - [60, 0.762]
  - - [128, 1024, 1, 512]
    - [39, 1.356]
  - - [128, 1024, 1, 1024]
    - [58, 2.306]
  - - [128, 1024, 1, 2048]
    - [59, 3.801]
  - - [128, 1024, 1, 4096]
    - [47, 6.023]
  - - [128, 1024, 1, 8192]
    - [35, 8.66]
  - - [128, 2048, 1, 128]
    - [7, 1.255]
  - - [128, 2048, 1, 256]
    - [8, 1.585]
  - - [128, 2048, 1, 512]
    - [39, 2.533]
  - - [128, 2048, 1, 1024]
    - [56, 4.082]
  - - [128, 2048, 1, 2048]
    - [35, 6.705]
  - - [128, 2048, 1, 4096]
    - [36, 9.788]
  - - [128, 2048, 1, 8192]
    - [25, 12.152]
  - - [128, 4096, 1, 128]
    - [56, 2.262]
  - - [128, 4096, 1, 256]
    - [34, 2.857]
  - - [128, 4096, 1, 512]
    - [34, 4.444]
  - - [128, 4096, 1, 1024]
    - [35, 7.188]
  - - [128, 4096, 1, 2048]
    - [34, 10.37]
  - - [128, 4096, 1, 4096]
    - [33, 13.496]
  - - [128, 4096, 1, 8192]
    - [13, 16.6]
  - - [128, 8192, 1, 128]
    - [4, 3.558]
  - - [128, 8192, 1, 256]
    - [5, 4.904]
  - - [128, 8192, 1, 512]
    - [30, 7.55]
  - - [128, 8192, 1, 1024]
    - [31, 11.391]
  - - [128, 8192, 1, 2048]
    - [23, 14.045]
  - - [128, 8192, 1, 4096]
    - [28, 17.765]
  - - [128, 8192, 1, 8192]
    - [2, 21.734]
  - - [256, 128, 1, 128]
    - [8, 0.166]
  - - [256, 128, 1, 256]
    - [21, 0.205]
  - - [256, 128, 1, 512]
    - [39, 0.346]
  - - [256, 128, 1, 1024]
    - [38, 0.487]
  - - [256, 128, 1, 2048]
    - [0, 0.787]
  - - [256, 128, 1, 4096]
    - [3, 1.51]
  - - [256, 128, 1, 8192]
    - [39, 2.649]
  - - [256, 256, 1, 128]
    - [16, 0.33]
  - - [256, 256, 1, 256]
    - [20, 0.392]
  - - [256, 256, 1, 512]
    - [58, 0.668]
  - - [256, 256, 1, 1024]
    - [27, 1.053]
  - - [256, 256, 1, 2048]
    - [40, 1.963]
  - - [256, 256, 1, 4096]
    - [49, 3.421]
  - - [256, 256, 1, 8192]
    - [43, 4.927]
  - - [256, 512, 1, 128]
    - [6, 0.655]
  - - [256, 512, 1, 256]
    - [10, 0.757]
  - - [256, 512, 1, 512]
    - [6, 1.342]
  - - [256, 512, 1, 1024]
    - [40, 2.301]
  - - [256, 512, 1, 2048]
    - [38, 3.743]
  - - [256, 512, 1, 4096]
    - [61, 6.032]
  - - [256, 512, 1, 8192]
    - [37, 7.995]
  - - [256, 1024, 1, 128]
    - [18, 1.237]
  - - [256, 1024, 1, 256]
    - [7, 1.574]
  - - [256, 1024, 1, 512]
    - [60, 2.549]
  - - [256, 1024, 1, 1024]
    - [19, 4.04]
  - - [256, 1024, 1, 2048]
    - [35, 6.585]
  - - [256, 1024, 1, 4096]
    - [57, 9.871]
  - - [256, 1024, 1, 8192]
    - [24, 12.295]
  - - [256, 2048, 1, 128]
    - [56, 2.229]
  - - [256, 2048, 1, 256]
    - [15, 2.866]
  - - [256, 2048, 1, 512]
    - [55, 4.585]
  - - [256, 2048, 1, 1024]
    - [56, 7.289]
  - - [256, 2048, 1, 2048]
    - [46, 10.408]
  - - [256, 2048, 1, 4096]
    - [54, 13.544]
  - - [256, 2048, 1, 8192]
    - [23, 15.948]
  - - [256, 4096, 1, 128]
    - [32, 3.629]
  - - [256, 4096, 1, 256]
    - [53, 4.801]
  - - [256, 4096, 1, 512]
    - [29, 7.582]
  - - [256, 4096, 1, 1024]
    - [31, 11.447]
  - - [256, 4096, 1, 2048]
    - [54, 14.789]
  - - [256, 4096, 1, 4096]
    - [45, 18.001]
  - - [256, 4096, 1, 8192]
    - [44, 21.539]
  - - [256, 8192, 1, 128]
    - [51, 5.363]
  - - [256, 8192, 1, 256]
    - [14, 7.943]
  - - [256, 8192, 1, 512]
    - [28, 11.104]
  - - [256, 8192, 1, 1024]
    - [52, 14.573]
  - - [256, 8192, 1, 2048]
    - [50, 18.11]
  - - [256, 8192, 1, 4096]
    - [22, 23.303]
  - - [256, 8192, 1, 8192]
    - [12, 27.256]
  - - [512, 128, 1, 128]
    - [7, 0.338]
  - - [512, 128, 1, 256]
    - [16, 0.425]
  - - [512, 128, 1, 512]
    - [39, 0.684]
  - - [512, 128, 1, 1024]
    - [48, 1.101]
  - - [512, 128, 1, 2048]
    - [62, 2.002]
  - - [512, 128, 1, 4096]
    - [63, 3.278]
  - - [512, 128, 1, 8192]
    - [64, 4.725]
  - - [512, 256, 1, 128]
    - [6, 0.662]
  - - [512, 256, 1, 256]
    - [20, 0.775]
  - - [512, 256, 1, 512]
    - [16, 1.349]
  - - [512, 256, 1, 1024]
    - [59, 2.332]
  - - [512, 256, 1, 2048]
    - [6, 3.754]
  - - [512, 256, 1, 4096]
    - [65, 5.659]
  - - [512, 256, 1, 8192]
    - [66, 7.454]
  - - [512, 512, 1, 128]
    - [41, 1.25]
  - - [512, 512, 1, 256]
    - [38, 1.551]
  - - [512, 512, 1, 512]
    - [38, 2.564]
  - - [512, 512, 1, 1024]
    - [34, 4.169]
  - - [512, 512, 1, 2048]
    - [55, 6.637]
  - - [512, 512, 1, 4096]
    - [67, 8.838]
  - - [512, 512, 1, 8192]
    - [68, 11.757]
  - - [512, 1024, 1, 128]
    - [55, 2.267]
  - - [512, 1024, 1, 256]
    - [55, 2.915]
  - - [512, 1024, 1, 512]
    - [56, 4.702]
  - - [512, 1024, 1, 1024]
    - [56, 7.283]
  - - [512, 1024, 1, 2048]
    - [69, 10.468]
  - - [512, 1024, 1, 4096]
    - [24, 13.367]
  - - [512, 1024, 1, 8192]
    - [31, 16.159]
  - - [512, 2048, 1, 128]
    - [70, 3.726]
  - - [512, 2048, 1, 256]
    - [71, 4.887]
  - - [512, 2048, 1, 512]
    - [32, 7.795]
  - - [512, 2048, 1, 1024]
    - [69, 11.457]
  - - [512, 2048, 1, 2048]
    - [30, 14.631]
  - - [512, 2048, 1, 4096]
    - [72, 17.717]
  - - [512, 2048, 1, 8192]
    - [73, 21.738]
  - - [512, 4096, 1, 128]
    - [74, 5.561]
  - - [512, 4096, 1, 256]
    - [75, 7.69]
  - - [512, 4096, 1, 512]
    - [76, 10.802]
  - - [512, 4096, 1, 1024]
    - [52, 14.953]
  - - [512, 4096, 1, 2048]
    - [77, 18.312]
  - - [512, 4096, 1, 4096]
    - [78, 22.677]
  - - [512, 4096, 1, 8192]
    - [79, 26.04]
  - - [512, 8192, 1, 128]
    - [80, 6.668]
  - - [512, 8192, 1, 256]
    - [81, 9.042]
  - - [512, 8192, 1, 512]
    - [51, 13.461]
  - - [512, 8192, 1, 1024]
    - [82, 17.651]
  - - [512, 8192, 1, 2048]
    - [83, 22.268]
  - - [512, 8192, 1, 4096]
    - [84, 27.009]
  - - [512, 8192, 1, 8192]
    - [85, 30.415]
  - - [1024, 128, 1, 128]
    - [17, 0.632]
  - - [1024, 128, 1, 256]
    - [16, 0.764]
  - - [1024, 128, 1, 512]
    - [60, 1.347]
  - - [1024, 128, 1, 1024]
    - [17, 2.299]
  - - [1024, 128, 1, 2048]
    - [86, 3.581]
  - - [1024, 128, 1, 4096]
    - [66, 5.367]
  - - [1024, 128, 1, 8192]
    - [37, 7.012]
  - - [1024, 256, 1, 128]
    - [17, 1.265]
  - - [1024, 256, 1, 256]
    - [9, 1.602]
  - - [1024, 256, 1, 512]
    - [16, 2.555]
  - - [1024, 256, 1, 1024]
    - [56, 4.205]
  - - [1024, 256, 1, 2048]
    - [87, 6.484]
  - - [1024, 256, 1, 4096]
    - [88, 8.33]
  - - [1024, 256, 1, 8192]
    - [54, 11.346]
  - - [1024, 512, 1, 128]
    - [55, 2.261]
  - - [1024, 512, 1, 256]
    - [89, 2.844]
  - - [1024, 512, 1, 512]
    - [56, 4.65]
  - - [1024, 512, 1, 1024]
    - [34, 7.286]
  - - [1024, 512, 1, 2048]
    - [33, 10.106]
  - - [1024, 512, 1, 4096]
    - [90, 12.499]
  - - [1024, 512, 1, 8192]
    - [91, 15.828]
  - - [1024, 1024, 1, 128]
    - [70, 3.745]
  - - [1024, 1024, 1, 256]
    - [92, 4.899]
  - - [1024, 1024, 1, 512]
    - [30, 7.818]
  - - [1024, 1024, 1, 1024]
    - [93, 11.396]
  - - [1024, 1024, 1, 2048]
    - [94, 13.956]
  - - [1024, 1024, 1, 4096]
    - [95, 17.333]
  - - [1024, 1024, 1, 8192]
    - [96, 21.704]
  - - [1024, 2048, 1, 128]
    - [97, 5.806]
  - - [1024, 2048, 1, 256]
    - [98, 7.749]
  - - [1024, 2048, 1, 512]
    - [99, 10.9]
  - - [1024, 2048, 1, 1024]
    - [100, 14.47]
  - - [1024, 2048, 1, 2048]
    - [101, 17.953]
  - - [1024, 2048, 1, 4096]
    - [102, 23.511]
  - - [1024, 2048, 1, 8192]
    - [103, 26.253]
  - - [1024, 4096, 1, 128]
    - [104, 7.094]
  - - [1024, 4096, 1, 256]
    - [105, 9.129]
  - - [1024, 4096, 1, 512]
    - [28, 13.573]
  - - [1024, 4096, 1, 1024]
    - [106, 17.386]
  - - [1024, 4096, 1, 2048]
    - [96, 22.579]
  - - [1024, 4096, 1, 4096]
    - [103, 26.944]
  - - [1024, 4096, 1, 8192]
    - [107, 28.568]
  - - [1024, 8192, 1, 128]
    - [108, 6.828]
  - - [1024, 8192, 1, 256]
    - [96, 10.51]
  - - [1024, 8192, 1, 512]
    - [109, 15.881]
  - - [1024, 8192, 1, 1024]
    - [106, 21.22]
  - - [1024, 8192, 1, 2048]
    - [110, 26.044]
  - - [1024, 8192, 1, 4096]
    - [111, 28.909]
  - - [1024, 8192, 1, 8192]
    - [112, 31.554]
  - - [2048, 128, 1, 128]
    - [38, 1.244]
  - - [2048, 128, 1, 256]
    - [10, 1.591]
  - - [2048, 128, 1, 512]
    - [39, 2.566]
  - - [2048, 128, 1, 1024]
    - [35, 4.081]
  - - [2048, 128, 1, 2048]
    - [87, 6.417]
  - - [2048, 128, 1, 4096]
    - [113, 8.359]
  - - [2048, 128, 1, 8192]
    - [114, 11.292]
  - - [2048, 256, 1, 128]
    - [36, 2.249]
  - - [2048, 256, 1, 256]
    - [115, 2.838]
  - - [2048, 256, 1, 512]
    - [35, 4.62]
  - - [2048, 256, 1, 1024]
    - [87, 7.065]
  - - [2048, 256, 1, 2048]
    - [116, 9.995]
  - - [2048, 256, 1, 4096]
    - [117, 12.275]
  - - [2048, 256, 1, 8192]
    - [118, 15.601]
  - - [2048, 512, 1, 128]
    - [119, 3.688]
  - - [2048, 512, 1, 256]
    - [120, 4.914]
  - - [2048, 512, 1, 512]
    - [54, 7.743]
  - - [2048, 512, 1, 1024]
    - [121, 11.089]
  - - [2048, 512, 1, 2048]
    - [122, 13.588]
  - - [2048, 512, 1, 4096]
    - [72, 17.06]
  - - [2048, 512, 1, 8192]
    - [106, 21.491]
  - - [2048, 1024, 1, 128]
    - [123, 5.734]
  - - [2048, 1024, 1, 256]
    - [124, 7.839]
  - - [2048, 1024, 1, 512]
    - [52, 10.717]
  - - [2048, 1024, 1, 1024]
    - [125, 14.456]
  - - [2048, 1024, 1, 2048]
    - [102, 17.49]
  - - [2048, 1024, 1, 4096]
    - [126, 22.757]
  - - [2048, 1024, 1, 8192]
    - [127, 26.293]
  - - [2048, 2048, 1, 128]
    - [128, 6.729]
  - - [2048, 2048, 1, 256]
    - [129, 9.24]
  - - [2048, 2048, 1, 512]
    - [130, 12.643]
  - - [2048, 2048, 1, 1024]
    - [83, 17.212]
  - - [2048, 2048, 1, 2048]
    - [106, 23.01]
  - - [2048, 2048, 1, 4096]
    - [127, 28.141]
  - - [2048, 2048, 1, 8192]
    - [131, 28.399]
  - - [2048, 4096, 1, 128]
    - [132, 6.71]
  - - [2048, 4096, 1, 256]
    - [133, 10.441]
  - - [2048, 4096, 1, 512]
    - [134, 15.533]
  - - [2048, 4096, 1, 1024]
    - [135, 20.793]
  - - [2048, 4096, 1, 2048]
    - [136, 26.459]
  - - [2048, 4096, 1, 4096]
    - [137, 28.927]
  - - [2048, 4096, 1, 8192]
    - [138, 32.23]
  - - [2048, 8192, 1, 128]
    - [139, 7.55]
  - - [2048, 8192, 1, 256]
    - [140, 12.378]
  - - [2048, 8192, 1, 512]
    - [141, 17.558]
  - - [2048, 8192, 1, 1024]
    - [109, 23.511]
  - - [2048, 8192, 1, 2048]
    - [107, 27.416]
  - - [2048, 8192, 1, 4096]
    - [107, 30.89]
  - - [2048, 8192, 1, 8192]
    - [142, 33.579]
  - - [4096, 128, 1, 128]
    - [143, 2.207]
  - - [4096, 128, 1, 256]
    - [144, 2.832]
  - - [4096, 128, 1, 512]
    - [35, 4.567]
  - - [4096, 128, 1, 1024]
    - [145, 7.027]
  - - [4096, 128, 1, 2048]
    - [116, 9.865]
  - - [4096, 128, 1, 4096]
    - [146, 12.377]
  - - [4096, 128, 1, 8192]
    - [147, 15.647]
  - - [4096, 256, 1, 128]
    - [148, 3.633]
  - - [4096, 256, 1, 256]
    - [149, 4.862]
  - - [4096, 256, 1, 512]
    - [150, 7.586]
  - - [4096, 256, 1, 1024]
    - [151, 11.052]
  - - [4096, 256, 1, 2048]
    - [151, 13.589]
  - - [4096, 256, 1, 4096]
    - [152, 16.917]
  - - [4096, 256, 1, 8192]
    - [83, 21.564]
  - - [4096, 512, 1, 128]
    - [153, 5.561]
  - - [4096, 512, 1, 256]
    - [129, 7.772]
  - - [4096, 512, 1, 512]
    - [154, 10.71]
  - - [4096, 512, 1, 1024]
    - [155, 14.445]
  - - [4096, 512, 1, 2048]
    - [134, 17.134]
  - - [4096, 512, 1, 4096]
    - [103, 22.512]
  - - [4096, 512, 1, 8192]
    - [156, 26.724]
  - - [4096, 1024, 1, 128]
    - [157, 5.993]
  - - [4096, 1024, 1, 256]
    - [158, 9.032]
  - - [4096, 1024, 1, 512]
    - [159, 12.645]
  - - [4096, 1024, 1, 1024]
    - [141, 17.029]
  - - [4096, 1024, 1, 2048]
    - [160, 22.14]
  - - [4096, 1024, 1, 4096]
    - [161, 27.677]
  - - [4096, 1024, 1, 8192]
    - [162, 28.997]
  - - [4096, 2048, 1, 128]
    - [163, 6.595]
  - - [4096, 2048, 1, 256]
    - [164, 10.327]
  - - [4096, 2048, 1, 512]
    - [83, 15.265]
  - - [4096, 2048, 1, 1024]
    - [110, 20.867]
  - - [4096, 2048, 1, 2048]
    - [141, 26.554]
  - - [4096, 2048, 1, 4096]
    - [165, 29.874]
  - - [4096, 2048, 1, 8192]
    - [166, 32.379]
  - - [4096, 4096, 1, 128]
    - [167, 7.421]
  - - [4096, 4096, 1, 256]
    - [167, 12.013]
  - - [4096, 4096, 1, 512]
    - [134, 17.214]
  - - [4096, 4096, 1, 1024]
    - [168, 23.484]
  - - [4096, 4096, 1, 2048]
    - [169, 27.455]
  - - [4096, 4096, 1, 4096]
    - [170, 31.151]
  - - [4096, 4096, 1, 8192]
    - [171, 33.915]
  - - [4096, 8192, 1, 128]
    - [172, 8.277]
  - - [4096, 8192, 1, 256]
    - [173, 12.635]
  - - [4096, 8192, 1, 512]
    - [141, 18.207]
  - - [4096, 8192, 1, 1024]
    - [174, 23.182]
  - - [4096, 8192, 1, 2048]
    - [175, 28.638]
  - - [4096, 8192, 1, 4096]
    - [176, 34.255]
  - - [4096, 8192, 1, 8192]
    - [177, 37.631]
  - - [8192, 128, 1, 128]
    - [121, 3.541]
  - - [8192, 128, 1, 256]
    - [53, 4.988]
  - - [8192, 128, 1, 512]
    - [113, 7.674]
  - - [8192, 128, 1, 1024]
    - [122, 10.971]
  - - [8192, 128, 1, 2048]
    - [178, 13.561]
  - - [8192, 128, 1, 4096]
    - [118, 17.191]
  - - [8192, 128, 1, 8192]
    - [179, 21.67]
  - - [8192, 256, 1, 128]
    - [180, 5.326]
  - - [8192, 256, 1, 256]
    - [74, 7.578]
  - - [8192, 256, 1, 512]
    - [181, 10.687]
  - - [8192, 256, 1, 1024]
    - [182, 14.284]
  - - [8192, 256, 1, 2048]
    - [183, 17.751]
  - - [8192, 256, 1, 4096]
    - [106, 22.887]
  - - [8192, 256, 1, 8192]
    - [172, 26.37]
  - - [8192, 512, 1, 128]
    - [184, 6.017]
  - - [8192, 512, 1, 256]
    - [167, 9.084]
  - - [8192, 512, 1, 512]
    - [100, 12.645]
  - - [8192, 512, 1, 1024]
    - [83, 17.192]
  - - [8192, 512, 1, 2048]
    - [126, 22.236]
  - - [8192, 512, 1, 4096]
    - [185, 27.702]
  - - [8192, 512, 1, 8192]
    - [186, 29.599]
  - - [8192, 1024, 1, 128]
    - [187, 6.85]
  - - [8192, 1024, 1, 256]
    - [78, 10.137]
  - - [8192, 1024, 1, 512]
    - [188, 15.28]
  - - [8192, 1024, 1, 1024]
    - [188, 20.928]
  - - [8192, 1024, 1, 2048]
    - [189, 26.299]
  - - [8192, 1024, 1, 4096]
    - [165, 31.077]
  - - [8192, 1024, 1, 8192]
    - [175, 31.765]
  - - [8192, 2048, 1, 128]
    - [187, 7.607]
  - - [8192, 2048, 1, 256]
    - [190, 11.719]
  - - [8192, 2048, 1, 512]
    - [191, 17.177]
  - - [8192, 2048, 1, 1024]
    - [192, 23.079]
  - - [8192, 2048, 1, 2048]
    - [193, 27.209]
  - - [8192, 2048, 1, 4096]
    - [166, 31.134]
  - - [8192, 2048, 1, 8192]
    - [176, 34.995]
  - - [8192, 4096, 1, 128]
    - [194, 8.439]
  - - [8192, 4096, 1, 256]
    - [195, 12.74]
  - - [8192, 4096, 1, 512]
    - [196, 17.982]
  - - [8192, 4096, 1, 1024]
    - [188, 23.083]
  - - [8192, 4096, 1, 2048]
    - [197, 28.672]
  - - [8192, 4096, 1, 4096]
    - [198, 33.876]
  - - [8192, 4096, 1, 8192]
    - [199, 36.928]
  - - [8192, 8192, 1, 128]
    - [200, 7.272]
  - - [8192, 8192, 1, 256]
    - [173, 11.978]
  - - [8192, 8192, 1, 512]
    - [201, 18.168]
  - - [8192, 8192, 1, 1024]
    - [191, 24.474]
  - - [8192, 8192, 1, 2048]
    - [197, 31.766]
  - - [8192, 8192, 1, 4096]
    - [142, 37.241]
  - - [8192, 8192, 1, 8192]
    - [202, 40.091]
- null
- null
- DeviceEfficiency
- GridBased
