library/src/amd_detail/rocblaslt/src/Tensile/Logic/streamk/gfx942/aquavanjaram942_Cijk_Alik_Bljk_BSS_BH_UserArgs.yaml
- {MinimumRequiredVersion: 4.33.0}
- aquavanjaram942
- gfx942
- [Device 0049, Device 0050]
    SolutionIndex: 0
    SolutionNameMin: Cijk_Alik_Bljk_BSS_BH_UserArgs_MT32x32x32_MI16x16x1_SN_LDSB0_CLR1_GRVWA4_GRVWB4_GSU0_GSUC0_GSUWGMRR0_K1_LBSPPA128_LBSPPB128_LPA4_LPB4_LRVW4_MIWT1_1_NEPBS0_PLR1_SU32_SUM0_SUS256_SVW1_SKXCCM0_ULSGRO1_VWA1_VWB1_WGM1_WGMXCC1_WGMXCCGn1
    SolutionIndex: 1
    SolutionNameMin: Cijk_Alik_Bljk_BSS_BH_UserArgs_MT128x64x64_MI16x16x1_SN_LDSB1_CLR1_GRVWA8_GRVWB8_GSU0_GSUC0_GSUWGMRR0_K1_LBSPPA512_LBSPPB128_LPA16_LPB16_LRVW8_MIWT4_2_NEPBS0_PLR1_SU32_SUM0_SUS256_SVW4_SKXCCM0_ULSGRO0_VWA4_VWB1_WGM1_WGMXCC1_WGMXCCGn1
    SolutionIndex: 2
    SolutionNameMin: Cijk_Alik_Bljk_BSS_BH_UserArgs_MT32x32x64_MI16x16x1_SN_LDSB0_CLR1_GRVWA8_GRVWB8_GSU0_GSUC0_GSUWGMRR0_K1_LBSPPA128_LBSPPB128_LPA16_LPB16_LRVW8_MIWT1_1_NEPBS0_PLR1_SU32_SUM0_SUS256_SVW1_SKXCCM0_ULSGRO0_VWA1_VWB1_WGM1_WGMXCC1_WGMXCCGn1
    SolutionIndex: 3
    SolutionNameMin: Cijk_Alik_Bljk_BSS_BH_UserArgs_MT32x32x64_MI16x16x1_SN_LDSB0_CLR1_GRVWA8_GRVWB8_GSU0_GSUC0_GSUWGMRR0_K1_LBSPPA128_LBSPPB128_LPA16_LPB16_LRVW8_MIWT1_1_NEPBS0_PLR1_SU32_SUM0_SUS256_SVW1_SKXCCM0_ULSGRO1_VWA1_VWB1_WGM1_WGMXCC1_WGMXCCGn1
    SolutionIndex: 4
    SolutionNameMin: Cijk_Alik_Bljk_BSS_BH_UserArgs_MT128x32x128_MI16x16x1_SN_LDSB1_CLR1_GRVWA8_GRVWB8_GSU0_GSUC0_GSUWGMRR0_K1_LBSPPA1024_LBSPPB256_LPA16_LPB16_LRVW8_MIWT4_1_NEPBS0_PLR1_SU32_SUM0_SUS256_SVW4_SKXCCM0_ULSGRO0_VWA4_VWB1_WGM1_WGMXCC1_WGMXCCGn1
    SolutionIndex: 5
    SolutionNameMin: Cijk_Alik_Bljk_BSS_BH_UserArgs_MT32x64x128_MI16x16x1_SN_LDSB1_CLR1_GRVWA8_GRVWB8_GSU0_GSUC0_GSUWGMRR0_K1_LBSPPA256_LBSPPB256_LPA16_LPB16_LRVW8_MIWT1_2_NEPBS0_PLR1_SU32_SUM0_SUS256_SVW1_SKXCCM0_ULSGRO1_VWA1_VWB1_WGM1_WGMXCC1_WGMXCCGn1
    SolutionIndex: 6
    SolutionNameMin: Cijk_Alik_Bljk_BSS_BH_UserArgs_MT32x32x128_MI16x16x1_SN_LDSB1_CLR1_GRVWA8_GRVWB8_GSU0_GSUC0_GSUWGMRR0_K1_LBSPPA256_LBSPPB256_LPA16_LPB16_LRVW8_MIWT1_1_NEPBS0_PLR1_SU32_SUM0_SUS256_SVW1_SKXCCM0_ULSGRO0_VWA1_VWB1_WGM1_WGMXCC1_WGMXCCGn1
    SolutionIndex: 7
    SolutionNameMin: Cijk_Alik_Bljk_BSS_BH_UserArgs_MT32x32x128_MI16x16x1_SN_LDSB1_CLR1_GRVWA8_GRVWB8_GSU0_GSUC0_GSUWGMRR0_K1_LBSPPA256_LBSPPB256_LPA16_LPB16_LRVW8_MIWT1_1_NEPBS0_PLR1_SU32_SUM0_SUS256_SVW1_SKXCCM0_ULSGRO1_VWA1_VWB1_WGM1_WGMXCC1_WGMXCCGn1
    SolutionIndex: 8
    SolutionNameMin: Cijk_Alik_Bljk_BSS_BH_UserArgs_MT32x32x128_MI16x16x1_SN_LDSB1_CLR1_GRVWA8_GRVWB8_GSU0_GSUC0_GSUWGMRR0_K1_LBSPPA256_LBSPPB256_LPA16_LPB16_LRVW8_MIWT1_1_NEPBS0_PLR3_SU32_SUM0_SUS256_SVW1_SKXCCM0_ULSGRO0_VWA1_VWB1_WGM1_WGMXCC1_WGMXCCGn1
    SolutionIndex: 9
    SolutionNameMin: Cijk_Alik_Bljk_BSS_BH_UserArgs_MT32x32x128_MI16x16x1_SN_LDSB1_CLR1_GRVWA8_GRVWB8_GSU0_GSUC0_GSUWGMRR0_K1_LBSPPA256_LBSPPB256_LPA16_LPB16_LRVW8_MIWT1_1_NEPBS0_PLR3_SU32_SUM0_SUS256_SVW1_SKXCCM0_ULSGRO1_VWA1_VWB1_WGM1_WGMXCC1_WGMXCCGn1
    SolutionIndex: 10
    SolutionNameMin: Cijk_Alik_Bljk_BSS_BH_UserArgs_MT32x32x32_MI16x16x1_SN_LDSB0_CLR1_GRVWA4_GRVWB4_GSU0_GSUC0_GSUWGMRR0_K1_LBSPPA128_LBSPPB128_LPA4_LPB4_LRVW4_MIWT1_1_NEPBS16_PLR1_SU32_SUM0_SUS256_SVW1_SKXCCM0_ULSGRO1_VWA1_VWB1_WGM1_WGMXCC1_WGMXCCGn1
    SolutionIndex: 11
    SolutionNameMin: Cijk_Alik_Bljk_BSS_BH_UserArgs_MT128x128x64_MI16x16x1_SN_LDSB1_CLR1_GRVWA8_GRVWB8_GSU0_GSUC0_GSUWGMRR0_K1_LBSPPA512_LBSPPB128_LPA16_LPB16_LRVW8_MIWT4_4_NEPBS16_PLR1_SU32_SUM0_SUS256_SVW4_SKXCCM0_ULSGRO0_VWA4_VWB1_WGM1_WGMXCC1_WGMXCCGn1
    SolutionIndex: 12
    SolutionNameMin: Cijk_Alik_Bljk_BSS_BH_UserArgs_MT32x64x128_MI16x16x1_SN_LDSB1_CLR1_GRVWA8_GRVWB8_GSU0_GSUC0_GSUWGMRR0_K1_LBSPPA256_LBSPPB512_LPA16_LPB16_LRVW8_MIWT1_2_NEPBS16_PLR1_SU32_SUM0_SUS256_SVW1_SKXCCM0_ULSGRO1_VWA1_VWB2_WGM1_WGMXCC1_WGMXCCGn1
    SolutionIndex: 13
    SolutionNameMin: Cijk_Alik_Bljk_BSS_BH_UserArgs_MT64x32x128_MI16x16x1_SN_LDSB1_CLR1_GRVWA8_GRVWB8_GSU0_GSUC0_GSUWGMRR0_K1_LBSPPA256_LBSPPB256_LPA16_LPB16_LRVW8_MIWT2_1_NEPBS16_PLR2_SU32_SUM0_SUS256_SVW1_SKXCCM0_ULSGRO0_VWA1_VWB1_WGM1_WGMXCC1_WGMXCCGn1
    SolutionIndex: 14
    SolutionNameMin: Cijk_Alik_Bljk_BSS_BH_UserArgs_MT64x32x128_MI16x16x1_SN_LDSB1_CLR1_GRVWA8_GRVWB8_GSU0_GSUC0_GSUWGMRR0_K1_LBSPPA256_LBSPPB256_LPA16_LPB16_LRVW8_MIWT2_1_NEPBS16_PLR2_SU32_SUM0_SUS256_SVW1_SKXCCM0_ULSGRO0_VWA1_VWB1_WGM8_WGMXCC1_WGMXCCGn1
    SolutionIndex: 15
    SolutionNameMin: Cijk_Alik_Bljk_BSS_BH_UserArgs_MT32x32x128_MI16x16x1_SN_LDSB1_CLR1_GRVWA8_GRVWB8_GSU0_GSUC0_GSUWGMRR0_K1_LBSPPA256_LBSPPB256_LPA16_LPB16_LRVW8_MIWT1_1_NEPBS16_PLR1_SU32_SUM0_SUS256_SVW1_SKXCCM0_ULSGRO0_VWA1_VWB1_WGM1_WGMXCC1_WGMXCCGn1
    SolutionIndex: 16
    SolutionNameMin: Cijk_Alik_Bljk_BSS_BH_UserArgs_MT32x32x128_MI16x16x1_SN_LDSB1_CLR1_GRVWA8_GRVWB8_GSU0_GSUC0_GSUWGMRR0_K1_LBSPPA256_LBSPPB256_LPA16_LPB16_LRVW8_MIWT1_1_NEPBS16_PLR1_SU32_SUM0_SUS256_SVW1_SKXCCM0_ULSGRO1_VWA1_VWB1_WGM1_WGMXCC1_WGMXCCGn1
    SolutionIndex: 17
    SolutionNameMin: Cijk_Alik_Bljk_BSS_BH_UserArgs_MT32x32x128_MI16x16x1_SN_LDSB1_CLR1_GRVWA8_GRVWB8_GSU0_GSUC0_GSUWGMRR0_K1_LBSPPA256_LBSPPB256_LPA16_LPB16_LRVW8_MIWT1_1_NEPBS16_PLR2_SU32_SUM0_SUS256_SVW1_SKXCCM0_ULSGRO1_VWA1_VWB1_WGM1_WGMXCC1_WGMXCCGn1
    SolutionIndex: 18
    SolutionNameMin: Cijk_Alik_Bljk_BSS_BH_UserArgs_MT32x32x32_MI16x16x1_SN_LDSB0_CLR0_GRVWA4_GRVWB4_GSU0_GSUC0_GSUWGMRR0_K1_LBSPPA128_LBSPPB128_LPA4_LPB4_LRVW4_MIWT1_1_NEPBS0_PLR0_SU32_SUM0_SUS256_SVW1_SKXCCM8_ULSGRO1_VWA1_VWB1_WGM1_WGMXCC1_WGMXCCGn1
    SolutionIndex: 19
    SolutionNameMin: Cijk_Alik_Bljk_BSS_BH_UserArgs_MT128x128x64_MI16x16x1_SN_LDSB1_CLR1_GRVWA8_GRVWB8_GSU0_GSUC0_GSUWGMRR0_K1_LBSPPA512_LBSPPB512_LPA16_LPB16_LRVW8_MIWT4_4_NEPBS0_PLR1_SU32_SUM0_SUS256_SVW4_SKXCCM8_ULSGRO0_VWA4_VWB4_WGM8_WGMXCC1_WGMXCCGn1
    SolutionIndex: 20
    SolutionNameMin: Cijk_Alik_Bljk_BSS_BH_UserArgs_MT128x128x64_MI16x16x1_SN_LDSB1_CLR1_GRVWA8_GRVWB8_GSU0_GSUC0_GSUWGMRR0_K1_LBSPPA512_LBSPPB256_LPA16_LPB16_LRVW8_MIWT4_4_NEPBS0_PLR1_SU32_SUM0_SUS256_SVW4_SKXCCM8_ULSGRO1_VWA4_VWB2_WGM8_WGMXCC1_WGMXCCGn1
    SolutionIndex: 21
    SolutionNameMin: Cijk_Alik_Bljk_BSS_BH_UserArgs_MT64x64x64_MI16x16x1_SN_LDSB1_CLR1_GRVWA8_GRVWB8_GSU0_GSUC0_GSUWGMRR0_K1_LBSPPA128_LBSPPB128_LPA16_LPB16_LRVW8_MIWT2_2_NEPBS0_PLR1_SU32_SUM0_SUS256_SVW1_SKXCCM8_ULSGRO1_VWA1_VWB1_WGM1_WGMXCC1_WGMXCCGn1
    SolutionIndex: 22
    SolutionNameMin: Cijk_Alik_Bljk_BSS_BH_UserArgs_MT64x64x64_MI16x16x1_SN_LDSB1_CLR1_GRVWA8_GRVWB8_GSU0_GSUC0_GSUWGMRR0_K1_LBSPPA128_LBSPPB256_LPA16_LPB16_LRVW8_MIWT2_2_NEPBS0_PLR1_SU32_SUM0_SUS256_SVW1_SKXCCM8_ULSGRO1_VWA1_VWB2_WGM1_WGMXCC1_WGMXCCGn1
    SolutionIndex: 23
    SolutionNameMin: Cijk_Alik_Bljk_BSS_BH_UserArgs_MT32x64x64_MI16x16x1_SN_LDSB0_CLR1_GRVWA8_GRVWB8_GSU0_GSUC0_GSUWGMRR0_K1_LBSPPA128_LBSPPB256_LPA16_LPB16_LRVW8_MIWT1_2_NEPBS0_PLR1_SU32_SUM0_SUS256_SVW1_SKXCCM8_ULSGRO0_VWA1_VWB2_WGM1_WGMXCC1_WGMXCCGn1
    SolutionIndex: 24
    SolutionNameMin: Cijk_Alik_Bljk_BSS_BH_UserArgs_MT32x64x64_MI16x16x1_SN_LDSB0_CLR1_GRVWA8_GRVWB8_GSU0_GSUC0_GSUWGMRR0_K1_LBSPPA128_LBSPPB256_LPA16_LPB16_LRVW8_MIWT1_2_NEPBS0_PLR1_SU32_SUM0_SUS256_SVW1_SKXCCM8_ULSGRO1_VWA1_VWB2_WGM1_WGMXCC1_WGMXCCGn1
    SolutionIndex: 25
    SolutionNameMin: Cijk_Alik_Bljk_BSS_BH_UserArgs_MT32x32x64_MI16x16x1_SN_LDSB0_CLR1_GRVWA8_GRVWB8_GSU0_GSUC0_GSUWGMRR0_K1_LBSPPA128_LBSPPB128_LPA16_LPB16_LRVW8_MIWT1_1_NEPBS0_PLR1_SU32_SUM0_SUS256_SVW1_SKXCCM8_ULSGRO0_VWA1_VWB1_WGM1_WGMXCC1_WGMXCCGn1
    SolutionIndex: 26
    SolutionNameMin: Cijk_Alik_Bljk_BSS_BH_UserArgs_MT32x32x64_MI16x16x1_SN_LDSB0_CLR1_GRVWA8_GRVWB8_GSU0_GSUC0_GSUWGMRR0_K1_LBSPPA128_LBSPPB128_LPA16_LPB16_LRVW8_MIWT1_1_NEPBS0_PLR1_SU32_SUM0_SUS256_SVW1_SKXCCM8_ULSGRO1_VWA1_VWB1_WGM1_WGMXCC1_WGMXCCGn1
    SolutionIndex: 27
    SolutionNameMin: Cijk_Alik_Bljk_BSS_BH_UserArgs_MT64x64x128_MI16x16x1_SN_LDSB1_CLR1_GRVWA8_GRVWB8_GSU0_GSUC0_GSUWGMRR0_K1_LBSPPA256_LBSPPB256_LPA16_LPB16_LRVW8_MIWT2_2_NEPBS0_PLR1_SU32_SUM0_SUS256_SVW1_SKXCCM8_ULSGRO0_VWA1_VWB1_WGM1_WGMXCC1_WGMXCCGn1
    SolutionIndex: 28
    SolutionNameMin: Cijk_Alik_Bljk_BSS_BH_UserArgs_MT64x64x128_MI16x16x1_SN_LDSB1_CLR1_GRVWA8_GRVWB8_GSU0_GSUC0_GSUWGMRR0_K1_LBSPPA256_LBSPPB512_LPA16_LPB16_LRVW8_MIWT2_2_NEPBS0_PLR1_SU32_SUM0_SUS256_SVW1_SKXCCM8_ULSGRO0_VWA1_VWB2_WGM1_WGMXCC1_WGMXCCGn1
    SolutionIndex: 29
    SolutionNameMin: Cijk_Alik_Bljk_BSS_BH_UserArgs_MT64x64x128_MI16x16x1_SN_LDSB1_CLR1_GRVWA8_GRVWB8_GSU0_GSUC0_GSUWGMRR0_K1_LBSPPA256_LBSPPB256_LPA16_LPB16_LRVW8_MIWT2_2_NEPBS0_PLR1_SU32_SUM0_SUS256_SVW1_SKXCCM8_ULSGRO1_VWA1_VWB1_WGM1_WGMXCC1_WGMXCCGn1
    SolutionIndex: 30
    SolutionNameMin: Cijk_Alik_Bljk_BSS_BH_UserArgs_MT64x64x128_MI16x16x1_SN_LDSB1_CLR1_GRVWA8_GRVWB8_GSU0_GSUC0_GSUWGMRR0_K1_LBSPPA256_LBSPPB256_LPA16_LPB16_LRVW8_MIWT2_2_NEPBS0_PLR2_SU32_SUM0_SUS256_SVW1_SKXCCM8_ULSGRO1_VWA1_VWB1_WGM1_WGMXCC1_WGMXCCGn1
    SolutionIndex: 31
    SolutionNameMin: Cijk_Alik_Bljk_BSS_BH_UserArgs_MT64x64x128_MI16x16x1_SN_LDSB1_CLR1_GRVWA8_GRVWB8_GSU0_GSUC0_GSUWGMRR0_K1_LBSPPA256_LBSPPB256_LPA16_LPB16_LRVW8_MIWT2_2_NEPBS0_PLR3_SU32_SUM0_SUS256_SVW1_SKXCCM8_ULSGRO0_VWA1_VWB1_WGM1_WGMXCC1_WGMXCCGn1
    SolutionIndex: 32
    SolutionNameMin: Cijk_Alik_Bljk_BSS_BH_UserArgs_MT64x64x128_MI16x16x1_SN_LDSB1_CLR1_GRVWA8_GRVWB8_GSU0_GSUC0_GSUWGMRR0_K1_LBSPPA256_LBSPPB256_LPA16_LPB16_LRVW8_MIWT2_2_NEPBS0_PLR1_SU32_SUM0_SUS256_SVW1_SKXCCM8_ULSGRO1_VWA1_VWB1_WGM4_WGMXCC1_WGMXCCGn1
    SolutionIndex: 33
    SolutionNameMin: Cijk_Alik_Bljk_BSS_BH_UserArgs_MT64x64x128_MI16x16x1_SN_LDSB1_CLR1_GRVWA8_GRVWB8_GSU0_GSUC0_GSUWGMRR0_K1_LBSPPA256_LBSPPB256_LPA16_LPB16_LRVW8_MIWT2_2_NEPBS0_PLR1_SU32_SUM0_SUS256_SVW1_SKXCCM8_ULSGRO1_VWA1_VWB1_WGM8_WGMXCC1_WGMXCCGn1
    SolutionIndex: 34
    SolutionNameMin: Cijk_Alik_Bljk_BSS_BH_UserArgs_MT32x64x128_MI16x16x1_SN_LDSB1_CLR1_GRVWA8_GRVWB8_GSU0_GSUC0_GSUWGMRR0_K1_LBSPPA256_LBSPPB512_LPA16_LPB16_LRVW8_MIWT1_2_NEPBS0_PLR2_SU32_SUM0_SUS256_SVW1_SKXCCM8_ULSGRO1_VWA1_VWB2_WGM1_WGMXCC1_WGMXCCGn1
    SolutionIndex: 35
    SolutionNameMin: Cijk_Alik_Bljk_BSS_BH_UserArgs_MT64x32x128_MI16x16x1_SN_LDSB1_CLR1_GRVWA8_GRVWB8_GSU0_GSUC0_GSUWGMRR0_K1_LBSPPA256_LBSPPB256_LPA16_LPB16_LRVW8_MIWT2_1_NEPBS0_PLR1_SU32_SUM0_SUS256_SVW1_SKXCCM8_ULSGRO1_VWA1_VWB1_WGM1_WGMXCC1_WGMXCCGn1
    SolutionIndex: 36
    SolutionNameMin: Cijk_Alik_Bljk_BSS_BH_UserArgs_MT64x32x128_MI16x16x1_SN_LDSB1_CLR1_GRVWA8_GRVWB8_GSU0_GSUC0_GSUWGMRR0_K1_LBSPPA512_LBSPPB256_LPA16_LPB16_LRVW8_MIWT2_1_NEPBS0_PLR2_SU32_SUM0_SUS256_SVW2_SKXCCM8_ULSGRO1_VWA2_VWB1_WGM1_WGMXCC1_WGMXCCGn1
    SolutionIndex: 37
    SolutionNameMin: Cijk_Alik_Bljk_BSS_BH_UserArgs_MT32x32x128_MI16x16x1_SN_LDSB1_CLR1_GRVWA8_GRVWB8_GSU0_GSUC0_GSUWGMRR0_K1_LBSPPA256_LBSPPB256_LPA16_LPB16_LRVW8_MIWT1_1_NEPBS0_PLR1_SU32_SUM0_SUS256_SVW1_SKXCCM8_ULSGRO0_VWA1_VWB1_WGM1_WGMXCC1_WGMXCCGn1
    SolutionIndex: 38
    SolutionNameMin: Cijk_Alik_Bljk_BSS_BH_UserArgs_MT32x32x128_MI16x16x1_SN_LDSB1_CLR1_GRVWA8_GRVWB8_GSU0_GSUC0_GSUWGMRR0_K1_LBSPPA256_LBSPPB256_LPA16_LPB16_LRVW8_MIWT1_1_NEPBS0_PLR1_SU32_SUM0_SUS256_SVW1_SKXCCM8_ULSGRO1_VWA1_VWB1_WGM1_WGMXCC1_WGMXCCGn1
    SolutionIndex: 39
    SolutionNameMin: Cijk_Alik_Bljk_BSS_BH_UserArgs_MT32x32x128_MI16x16x1_SN_LDSB1_CLR1_GRVWA8_GRVWB8_GSU0_GSUC0_GSUWGMRR0_K1_LBSPPA256_LBSPPB256_LPA16_LPB16_LRVW8_MIWT1_1_NEPBS0_PLR2_SU32_SUM0_SUS256_SVW1_SKXCCM8_ULSGRO0_VWA1_VWB1_WGM1_WGMXCC1_WGMXCCGn1
    SolutionIndex: 40
    SolutionNameMin: Cijk_Alik_Bljk_BSS_BH_UserArgs_MT32x32x128_MI16x16x1_SN_LDSB1_CLR1_GRVWA8_GRVWB8_GSU0_GSUC0_GSUWGMRR0_K1_LBSPPA256_LBSPPB256_LPA16_LPB16_LRVW8_MIWT1_1_NEPBS0_PLR2_SU32_SUM0_SUS256_SVW1_SKXCCM8_ULSGRO1_VWA1_VWB1_WGM1_WGMXCC1_WGMXCCGn1
    SolutionIndex: 41
    SolutionNameMin: Cijk_Alik_Bljk_BSS_BH_UserArgs_MT32x32x128_MI16x16x1_SN_LDSB1_CLR1_GRVWA8_GRVWB8_GSU0_GSUC0_GSUWGMRR0_K1_LBSPPA256_LBSPPB256_LPA16_LPB16_LRVW8_MIWT1_1_NEPBS0_PLR3_SU32_SUM0_SUS256_SVW1_SKXCCM8_ULSGRO0_VWA1_VWB1_WGM1_WGMXCC1_WGMXCCGn1
    SolutionIndex: 42
    SolutionNameMin: Cijk_Alik_Bljk_BSS_BH_UserArgs_MT32x32x128_MI16x16x1_SN_LDSB1_CLR1_GRVWA8_GRVWB8_GSU0_GSUC0_GSUWGMRR0_K1_LBSPPA256_LBSPPB256_LPA16_LPB16_LRVW8_MIWT1_1_NEPBS0_PLR3_SU32_SUM0_SUS256_SVW1_SKXCCM8_ULSGRO1_VWA1_VWB1_WGM1_WGMXCC1_WGMXCCGn1
    SolutionIndex: 43
    SolutionNameMin: Cijk_Alik_Bljk_BSS_BH_UserArgs_MT128x128x64_MI16x16x1_SN_LDSB1_CLR1_GRVWA8_GRVWB8_GSU0_GSUC0_GSUWGMRR0_K1_LBSPPA512_LBSPPB128_LPA16_LPB16_LRVW8_MIWT4_4_NEPBS16_PLR1_SU32_SUM0_SUS256_SVW4_SKXCCM8_ULSGRO0_VWA4_VWB1_WGM4_WGMXCC1_WGMXCCGn1
    SolutionIndex: 44
    SolutionNameMin: Cijk_Alik_Bljk_BSS_BH_UserArgs_MT128x64x64_MI16x16x1_SN_LDSB1_CLR1_GRVWA8_GRVWB8_GSU0_GSUC0_GSUWGMRR0_K1_LBSPPA512_LBSPPB128_LPA16_LPB16_LRVW8_MIWT4_2_NEPBS16_PLR1_SU32_SUM0_SUS256_SVW4_SKXCCM8_ULSGRO1_VWA4_VWB1_WGM1_WGMXCC1_WGMXCCGn1
    SolutionIndex: 45
    SolutionNameMin: Cijk_Alik_Bljk_BSS_BH_UserArgs_MT128x64x64_MI16x16x1_SN_LDSB1_CLR1_GRVWA8_GRVWB8_GSU0_GSUC0_GSUWGMRR0_K1_LBSPPA512_LBSPPB256_LPA16_LPB16_LRVW8_MIWT4_2_NEPBS16_PLR1_SU32_SUM0_SUS256_SVW4_SKXCCM8_ULSGRO1_VWA4_VWB2_WGM1_WGMXCC1_WGMXCCGn1
    SolutionIndex: 46
    SolutionNameMin: Cijk_Alik_Bljk_BSS_BH_UserArgs_MT128x64x64_MI16x16x1_SN_LDSB1_CLR1_GRVWA8_GRVWB8_GSU0_GSUC0_GSUWGMRR0_K1_LBSPPA512_LBSPPB256_LPA16_LPB16_LRVW8_MIWT4_2_NEPBS16_PLR1_SU32_SUM0_SUS256_SVW4_SKXCCM8_ULSGRO0_VWA4_VWB2_WGM8_WGMXCC1_WGMXCCGn1
    SolutionIndex: 47
    SolutionNameMin: Cijk_Alik_Bljk_BSS_BH_UserArgs_MT64x64x64_MI16x16x1_SN_LDSB1_CLR1_GRVWA8_GRVWB8_GSU0_GSUC0_GSUWGMRR0_K1_LBSPPA128_LBSPPB128_LPA16_LPB16_LRVW8_MIWT2_2_NEPBS16_PLR1_SU32_SUM0_SUS256_SVW1_SKXCCM8_ULSGRO0_VWA1_VWB1_WGM4_WGMXCC1_WGMXCCGn1
    SolutionIndex: 48
    SolutionNameMin: Cijk_Alik_Bljk_BSS_BH_UserArgs_MT32x32x64_MI16x16x1_SN_LDSB0_CLR1_GRVWA8_GRVWB8_GSU0_GSUC0_GSUWGMRR0_K1_LBSPPA128_LBSPPB128_LPA16_LPB16_LRVW8_MIWT1_1_NEPBS16_PLR1_SU32_SUM0_SUS256_SVW1_SKXCCM8_ULSGRO0_VWA1_VWB1_WGM1_WGMXCC1_WGMXCCGn1
    SolutionIndex: 49
    SolutionNameMin: Cijk_Alik_Bljk_BSS_BH_UserArgs_MT32x32x64_MI16x16x1_SN_LDSB0_CLR1_GRVWA8_GRVWB8_GSU0_GSUC0_GSUWGMRR0_K1_LBSPPA128_LBSPPB128_LPA16_LPB16_LRVW8_MIWT1_1_NEPBS16_PLR1_SU32_SUM0_SUS256_SVW1_SKXCCM8_ULSGRO1_VWA1_VWB1_WGM1_WGMXCC1_WGMXCCGn1
    SolutionIndex: 50
    SolutionNameMin: Cijk_Alik_Bljk_BSS_BH_UserArgs_MT32x32x64_MI16x16x1_SN_LDSB0_CLR1_GRVWA8_GRVWB8_GSU0_GSUC0_GSUWGMRR0_K1_LBSPPA128_LBSPPB128_LPA16_LPB16_LRVW8_MIWT1_1_NEPBS16_PLR1_SU32_SUM0_SUS256_SVW1_SKXCCM8_ULSGRO1_VWA1_VWB1_WGM4_WGMXCC1_WGMXCCGn1
    SolutionIndex: 51
    SolutionNameMin: Cijk_Alik_Bljk_BSS_BH_UserArgs_MT64x64x128_MI16x16x1_SN_LDSB1_CLR1_GRVWA8_GRVWB8_GSU0_GSUC0_GSUWGMRR0_K1_LBSPPA256_LBSPPB256_LPA16_LPB16_LRVW8_MIWT2_2_NEPBS16_PLR1_SU32_SUM0_SUS256_SVW1_SKXCCM8_ULSGRO0_VWA1_VWB1_WGM1_WGMXCC1_WGMXCCGn1
    SolutionIndex: 52
    SolutionNameMin: Cijk_Alik_Bljk_BSS_BH_UserArgs_MT64x64x128_MI16x16x1_SN_LDSB1_CLR1_GRVWA8_GRVWB8_GSU0_GSUC0_GSUWGMRR0_K1_LBSPPA256_LBSPPB256_LPA16_LPB16_LRVW8_MIWT2_2_NEPBS16_PLR1_SU32_SUM0_SUS256_SVW1_SKXCCM8_ULSGRO1_VWA1_VWB1_WGM1_WGMXCC1_WGMXCCGn1
    SolutionIndex: 53
    SolutionNameMin: Cijk_Alik_Bljk_BSS_BH_UserArgs_MT64x64x128_MI16x16x1_SN_LDSB1_CLR1_GRVWA8_GRVWB8_GSU0_GSUC0_GSUWGMRR0_K1_LBSPPA256_LBSPPB512_LPA16_LPB16_LRVW8_MIWT2_2_NEPBS16_PLR1_SU32_SUM0_SUS256_SVW1_SKXCCM8_ULSGRO1_VWA1_VWB2_WGM1_WGMXCC1_WGMXCCGn1
    SolutionIndex: 54
    SolutionNameMin: Cijk_Alik_Bljk_BSS_BH_UserArgs_MT64x64x128_MI16x16x1_SN_LDSB1_CLR1_GRVWA8_GRVWB8_GSU0_GSUC0_GSUWGMRR0_K1_LBSPPA256_LBSPPB256_LPA16_LPB16_LRVW8_MIWT2_2_NEPBS16_PLR2_SU32_SUM0_SUS256_SVW1_SKXCCM8_ULSGRO1_VWA1_VWB1_WGM1_WGMXCC1_WGMXCCGn1
    SolutionIndex: 55
    SolutionNameMin: Cijk_Alik_Bljk_BSS_BH_UserArgs_MT32x64x128_MI16x16x1_SN_LDSB1_CLR1_GRVWA8_GRVWB8_GSU0_GSUC0_GSUWGMRR0_K1_LBSPPA256_LBSPPB512_LPA16_LPB16_LRVW8_MIWT1_2_NEPBS16_PLR2_SU32_SUM0_SUS256_SVW1_SKXCCM8_ULSGRO0_VWA1_VWB2_WGM1_WGMXCC1_WGMXCCGn1
    SolutionIndex: 56
    SolutionNameMin: Cijk_Alik_Bljk_BSS_BH_UserArgs_MT32x64x128_MI16x16x1_SN_LDSB1_CLR1_GRVWA8_GRVWB8_GSU0_GSUC0_GSUWGMRR0_K1_LBSPPA256_LBSPPB512_LPA16_LPB16_LRVW8_MIWT1_2_NEPBS16_PLR2_SU32_SUM0_SUS256_SVW1_SKXCCM8_ULSGRO1_VWA1_VWB2_WGM1_WGMXCC1_WGMXCCGn1
    SolutionIndex: 57
    SolutionNameMin: Cijk_Alik_Bljk_BSS_BH_UserArgs_MT64x32x128_MI16x16x1_SN_LDSB1_CLR1_GRVWA8_GRVWB8_GSU0_GSUC0_GSUWGMRR0_K1_LBSPPA512_LBSPPB256_LPA16_LPB16_LRVW8_MIWT2_1_NEPBS16_PLR1_SU32_SUM0_SUS256_SVW2_SKXCCM8_ULSGRO1_VWA2_VWB1_WGM1_WGMXCC1_WGMXCCGn1
    SolutionIndex: 58
    SolutionNameMin: Cijk_Alik_Bljk_BSS_BH_UserArgs_MT64x32x128_MI16x16x1_SN_LDSB1_CLR1_GRVWA8_GRVWB8_GSU0_GSUC0_GSUWGMRR0_K1_LBSPPA512_LBSPPB256_LPA16_LPB16_LRVW8_MIWT2_1_NEPBS16_PLR2_SU32_SUM0_SUS256_SVW2_SKXCCM8_ULSGRO1_VWA2_VWB1_WGM1_WGMXCC1_WGMXCCGn1
    SolutionIndex: 59
    SolutionNameMin: Cijk_Alik_Bljk_BSS_BH_UserArgs_MT32x32x128_MI16x16x1_SN_LDSB1_CLR1_GRVWA8_GRVWB8_GSU0_GSUC0_GSUWGMRR0_K1_LBSPPA256_LBSPPB256_LPA16_LPB16_LRVW8_MIWT1_1_NEPBS16_PLR1_SU32_SUM0_SUS256_SVW1_SKXCCM8_ULSGRO0_VWA1_VWB1_WGM1_WGMXCC1_WGMXCCGn1
    SolutionIndex: 60
    SolutionNameMin: Cijk_Alik_Bljk_BSS_BH_UserArgs_MT32x32x128_MI16x16x1_SN_LDSB1_CLR1_GRVWA8_GRVWB8_GSU0_GSUC0_GSUWGMRR0_K1_LBSPPA256_LBSPPB256_LPA16_LPB16_LRVW8_MIWT1_1_NEPBS16_PLR1_SU32_SUM0_SUS256_SVW1_SKXCCM8_ULSGRO1_VWA1_VWB1_WGM1_WGMXCC1_WGMXCCGn1
    SolutionIndex: 61
    SolutionNameMin: Cijk_Alik_Bljk_BSS_BH_UserArgs_MT32x32x128_MI16x16x1_SN_LDSB1_CLR1_GRVWA8_GRVWB8_GSU0_GSUC0_GSUWGMRR0_K1_LBSPPA256_LBSPPB256_LPA16_LPB16_LRVW8_MIWT1_1_NEPBS16_PLR2_SU32_SUM0_SUS256_SVW1_SKXCCM8_ULSGRO0_VWA1_VWB1_WGM1_WGMXCC1_WGMXCCGn1
    SolutionIndex: 62
    SolutionNameMin: Cijk_Alik_Bljk_BSS_BH_UserArgs_MT32x32x128_MI16x16x1_SN_LDSB1_CLR1_GRVWA8_GRVWB8_GSU0_GSUC0_GSUWGMRR0_K1_LBSPPA256_LBSPPB256_LPA16_LPB16_LRVW8_MIWT1_1_NEPBS16_PLR2_SU32_SUM0_SUS256_SVW1_SKXCCM8_ULSGRO1_VWA1_VWB1_WGM1_WGMXCC1_WGMXCCGn1
    SolutionIndex: 63
    SolutionNameMin: Cijk_Alik_Bljk_BSS_BH_UserArgs_MT32x32x128_MI16x16x1_SN_LDSB1_CLR1_GRVWA8_GRVWB8_GSU0_GSUC0_GSUWGMRR0_K1_LBSPPA256_LBSPPB256_LPA16_LPB16_LRVW8_MIWT1_1_NEPBS16_PLR3_SU32_SUM0_SUS256_SVW1_SKXCCM8_ULSGRO1_VWA1_VWB1_WGM1_WGMXCC1_WGMXCCGn1
    SolutionIndex: 64
    SolutionNameMin: Cijk_Alik_Bljk_BSS_BH_UserArgs_MT32x32x128_MI16x16x1_SN_LDSB1_CLR1_GRVWA8_GRVWB8_GSU0_GSUC0_GSUWGMRR0_K1_LBSPPA256_LBSPPB256_LPA16_LPB16_LRVW8_MIWT1_1_NEPBS16_PLR1_SU32_SUM0_SUS256_SVW1_SKXCCM8_ULSGRO1_VWA1_VWB1_WGM4_WGMXCC1_WGMXCCGn1
    SolutionIndex: 65
    SolutionNameMin: Cijk_Alik_Bljk_BSS_BH_UserArgs_MT32x32x64_MI16x16x1_SN_LDSB0_CLR1_GRVWA8_GRVWB8_GSU0_GSUC0_GSUWGMRR0_K1_LBSPPA128_LBSPPB128_LPA16_LPB16_LRVW8_MIWT1_1_NEPBS0_PLR1_SU32_SUM0_SUS256_SVW1_SKXCCM8_ULSGRO1_VWA1_VWB1_WGM8_WGMXCC1_WGMXCCGn1
    SolutionIndex: 66
    SolutionNameMin: Cijk_Alik_Bljk_BSS_BH_UserArgs_MT32x32x128_MI16x16x1_SN_LDSB1_CLR1_GRVWA8_GRVWB8_GSU0_GSUC0_GSUWGMRR0_K1_LBSPPA256_LBSPPB256_LPA16_LPB16_LRVW8_MIWT1_1_NEPBS16_PLR3_SU32_SUM0_SUS256_SVW1_SKXCCM8_ULSGRO0_VWA1_VWB1_WGM1_WGMXCC1_WGMXCCGn1
    SolutionIndex: 67
    SolutionNameMin: Cijk_Alik_Bljk_BSS_BH_UserArgs_MT32x32x128_MI16x16x1_SN_LDSB1_CLR1_GRVWA8_GRVWB8_GSU0_GSUC0_GSUWGMRR0_K1_LBSPPA256_LBSPPB256_LPA16_LPB16_LRVW8_MIWT1_1_NEPBS16_PLR3_SU32_SUM0_SUS256_SVW1_SKXCCM0_ULSGRO0_VWA1_VWB1_WGM1_WGMXCC1_WGMXCCGn1
    SolutionIndex: 68
    SolutionNameMin: Cijk_Alik_Bljk_BSS_BH_UserArgs_MT32x32x64_MI16x16x1_SN_LDSB0_CLR1_GRVWA8_GRVWB8_GSU0_GSUC0_GSUWGMRR0_K1_LBSPPA128_LBSPPB128_LPA16_LPB16_LRVW8_MIWT1_1_NEPBS0_PLR1_SU32_SUM0_SUS256_SVW1_SKXCCM8_ULSGRO1_VWA1_VWB1_WGM4_WGMXCC1_WGMXCCGn1
    SolutionIndex: 69
    SolutionNameMin: Cijk_Alik_Bljk_BSS_BH_UserArgs_MT32x32x128_MI16x16x1_SN_LDSB1_CLR1_GRVWA8_GRVWB8_GSU0_GSUC0_GSUWGMRR0_K1_LBSPPA256_LBSPPB256_LPA16_LPB16_LRVW8_MIWT1_1_NEPBS16_PLR2_SU32_SUM0_SUS256_SVW1_SKXCCM8_ULSGRO1_VWA1_VWB1_WGM4_WGMXCC1_WGMXCCGn1
    SolutionIndex: 70
    SolutionNameMin: Cijk_Alik_Bljk_BSS_BH_UserArgs_MT32x64x64_MI16x16x1_SN_LDSB0_CLR1_GRVWA8_GRVWB8_GSU0_GSUC0_GSUWGMRR0_K1_LBSPPA128_LBSPPB256_LPA16_LPB16_LRVW8_MIWT1_2_NEPBS16_PLR1_SU32_SUM0_SUS256_SVW1_SKXCCM8_ULSGRO0_VWA1_VWB2_WGM1_WGMXCC1_WGMXCCGn1
    SolutionIndex: 71
    SolutionNameMin: Cijk_Alik_Bljk_BSS_BH_UserArgs_MT32x64x128_MI16x16x1_SN_LDSB1_CLR1_GRVWA8_GRVWB8_GSU0_GSUC0_GSUWGMRR0_K1_LBSPPA256_LBSPPB512_LPA16_LPB16_LRVW8_MIWT1_2_NEPBS0_PLR2_SU32_SUM0_SUS256_SVW1_SKXCCM8_ULSGRO0_VWA1_VWB2_WGM4_WGMXCC1_WGMXCCGn1
    SolutionIndex: 72
    SolutionNameMin: Cijk_Alik_Bljk_BSS_BH_UserArgs_MT32x64x128_MI16x16x1_SN_LDSB1_CLR1_GRVWA8_GRVWB8_GSU0_GSUC0_GSUWGMRR0_K1_LBSPPA256_LBSPPB512_LPA16_LPB16_LRVW8_MIWT1_2_NEPBS16_PLR1_SU32_SUM0_SUS256_SVW1_SKXCCM0_ULSGRO0_VWA1_VWB2_WGM1_WGMXCC1_WGMXCCGn1
    SolutionIndex: 73
    SolutionNameMin: Cijk_Alik_Bljk_BSS_BH_UserArgs_MT32x64x128_MI16x16x1_SN_LDSB1_CLR1_GRVWA8_GRVWB8_GSU0_GSUC0_GSUWGMRR0_K1_LBSPPA256_LBSPPB256_LPA16_LPB16_LRVW8_MIWT1_2_NEPBS0_PLR1_SU32_SUM0_SUS256_SVW1_SKXCCM0_ULSGRO0_VWA1_VWB1_WGM1_WGMXCC1_WGMXCCGn1
    SolutionIndex: 74
    SolutionNameMin: Cijk_Alik_Bljk_BSS_BH_UserArgs_MT32x64x128_MI16x16x1_SN_LDSB1_CLR1_GRVWA8_GRVWB8_GSU0_GSUC0_GSUWGMRR0_K1_LBSPPA256_LBSPPB512_LPA16_LPB16_LRVW8_MIWT1_2_NEPBS0_PLR1_SU32_SUM0_SUS256_SVW1_SKXCCM8_ULSGRO1_VWA1_VWB2_WGM1_WGMXCC1_WGMXCCGn1
    SolutionIndex: 75
    SolutionNameMin: Cijk_Alik_Bljk_BSS_BH_UserArgs_MT64x32x128_MI16x16x1_SN_LDSB1_CLR1_GRVWA8_GRVWB8_GSU0_GSUC0_GSUWGMRR0_K1_LBSPPA256_LBSPPB256_LPA16_LPB16_LRVW8_MIWT2_1_NEPBS0_PLR2_SU32_SUM0_SUS256_SVW1_SKXCCM8_ULSGRO1_VWA1_VWB1_WGM1_WGMXCC1_WGMXCCGn1
    SolutionIndex: 76
    SolutionNameMin: Cijk_Alik_Bljk_BSS_BH_UserArgs_MT64x64x64_MI16x16x1_SN_LDSB1_CLR1_GRVWA8_GRVWB8_GSU0_GSUC0_GSUWGMRR0_K1_LBSPPA128_LBSPPB128_LPA16_LPB16_LRVW8_MIWT2_2_NEPBS16_PLR1_SU32_SUM0_SUS256_SVW1_SKXCCM8_ULSGRO1_VWA1_VWB1_WGM1_WGMXCC1_WGMXCCGn1
    SolutionIndex: 77
    SolutionNameMin: Cijk_Alik_Bljk_BSS_BH_UserArgs_MT64x64x128_MI16x16x1_SN_LDSB1_CLR1_GRVWA8_GRVWB8_GSU0_GSUC0_GSUWGMRR0_K1_LBSPPA256_LBSPPB256_LPA16_LPB16_LRVW8_MIWT2_2_NEPBS0_PLR2_SU32_SUM0_SUS256_SVW1_SKXCCM8_ULSGRO0_VWA1_VWB1_WGM1_WGMXCC1_WGMXCCGn1
    SolutionIndex: 78
    SolutionNameMin: Cijk_Alik_Bljk_BSS_BH_UserArgs_MT64x64x128_MI16x16x1_SN_LDSB1_CLR1_GRVWA8_GRVWB8_GSU0_GSUC0_GSUWGMRR0_K1_LBSPPA256_LBSPPB512_LPA16_LPB16_LRVW8_MIWT2_2_NEPBS16_PLR1_SU32_SUM0_SUS256_SVW1_SKXCCM0_ULSGRO0_VWA1_VWB2_WGM8_WGMXCC1_WGMXCCGn1
    SolutionIndex: 79
    SolutionNameMin: Cijk_Alik_Bljk_BSS_BH_UserArgs_MT64x64x128_MI16x16x1_SN_LDSB1_CLR1_GRVWA8_GRVWB8_GSU0_GSUC0_GSUWGMRR0_K1_LBSPPA256_LBSPPB512_LPA16_LPB16_LRVW8_MIWT2_2_NEPBS16_PLR1_SU32_SUM0_SUS256_SVW1_SKXCCM0_ULSGRO1_VWA1_VWB2_WGM8_WGMXCC1_WGMXCCGn1
    SolutionIndex: 80
    SolutionNameMin: Cijk_Alik_Bljk_BSS_BH_UserArgs_MT64x64x128_MI16x16x1_SN_LDSB1_CLR1_GRVWA8_GRVWB8_GSU0_GSUC0_GSUWGMRR0_K1_LBSPPA256_LBSPPB256_LPA16_LPB16_LRVW8_MIWT2_2_NEPBS16_PLR3_SU32_SUM0_SUS256_SVW1_SKXCCM8_ULSGRO1_VWA1_VWB1_WGM1_WGMXCC1_WGMXCCGn1
    SolutionIndex: 81
    SolutionNameMin: Cijk_Alik_Bljk_BSS_BH_UserArgs_MT64x64x128_MI16x16x1_SN_LDSB1_CLR1_GRVWA8_GRVWB8_GSU0_GSUC0_GSUWGMRR0_K1_LBSPPA256_LBSPPB512_LPA16_LPB16_LRVW8_MIWT2_2_NEPBS0_PLR1_SU32_SUM0_SUS256_SVW1_SKXCCM8_ULSGRO1_VWA1_VWB2_WGM1_WGMXCC1_WGMXCCGn1
    SolutionIndex: 82
    SolutionNameMin: Cijk_Alik_Bljk_BSS_BH_UserArgs_MT128x128x64_MI16x16x1_SN_LDSB1_CLR1_GRVWA8_GRVWB8_GSU0_GSUC0_GSUWGMRR0_K1_LBSPPA512_LBSPPB128_LPA16_LPB16_LRVW8_MIWT4_4_NEPBS16_PLR1_SU32_SUM0_SUS256_SVW4_SKXCCM8_ULSGRO1_VWA4_VWB1_WGM1_WGMXCC1_WGMXCCGn1
    SolutionIndex: 83
    SolutionNameMin: Cijk_Alik_Bljk_BSS_BH_UserArgs_MT64x64x128_MI16x16x1_SN_LDSB1_CLR1_GRVWA8_GRVWB8_GSU0_GSUC0_GSUWGMRR0_K1_LBSPPA256_LBSPPB512_LPA16_LPB16_LRVW8_MIWT2_2_NEPBS0_PLR1_SU32_SUM0_SUS256_SVW1_SKXCCM0_ULSGRO1_VWA1_VWB2_WGM8_WGMXCC1_WGMXCCGn1
    SolutionIndex: 84
    SolutionNameMin: Cijk_Alik_Bljk_BSS_BH_UserArgs_MT64x64x128_MI16x16x1_SN_LDSB1_CLR1_GRVWA8_GRVWB8_GSU0_GSUC0_GSUWGMRR0_K1_LBSPPA256_LBSPPB256_LPA16_LPB16_LRVW8_MIWT2_2_NEPBS0_PLR1_SU32_SUM0_SUS256_SVW1_SKXCCM0_ULSGRO0_VWA1_VWB1_WGM1_WGMXCC1_WGMXCCGn1
    SolutionIndex: 85
    SolutionNameMin: Cijk_Alik_Bljk_BSS_BH_UserArgs_MT128x64x64_MI16x16x1_SN_LDSB1_CLR1_GRVWA8_GRVWB8_GSU0_GSUC0_GSUWGMRR0_K1_LBSPPA512_LBSPPB128_LPA16_LPB16_LRVW8_MIWT4_2_NEPBS0_PLR1_SU32_SUM0_SUS256_SVW4_SKXCCM8_ULSGRO1_VWA4_VWB1_WGM1_WGMXCC1_WGMXCCGn1
    SolutionIndex: 86
    SolutionNameMin: Cijk_Alik_Bljk_BSS_BH_UserArgs_MT128x64x64_MI16x16x1_SN_LDSB1_CLR1_GRVWA8_GRVWB8_GSU0_GSUC0_GSUWGMRR0_K1_LBSPPA512_LBSPPB128_LPA16_LPB16_LRVW8_MIWT4_2_NEPBS0_PLR1_SU32_SUM0_SUS256_SVW4_SKXCCM8_ULSGRO0_VWA4_VWB1_WGM1_WGMXCC1_WGMXCCGn1
    SolutionIndex: 87
    SolutionNameMin: Cijk_Alik_Bljk_BSS_BH_UserArgs_MT128x64x64_MI16x16x1_SN_LDSB1_CLR1_GRVWA8_GRVWB8_GSU0_GSUC0_GSUWGMRR0_K1_LBSPPA512_LBSPPB256_LPA16_LPB16_LRVW8_MIWT4_2_NEPBS16_PLR1_SU32_SUM0_SUS256_SVW4_SKXCCM8_ULSGRO1_VWA4_VWB2_WGM8_WGMXCC1_WGMXCCGn1
    SolutionIndex: 88
    SolutionNameMin: Cijk_Alik_Bljk_BSS_BH_UserArgs_MT128x128x64_MI16x16x1_SN_LDSB1_CLR1_GRVWA8_GRVWB8_GSU0_GSUC0_GSUWGMRR0_K1_LBSPPA512_LBSPPB128_LPA16_LPB16_LRVW8_MIWT4_4_NEPBS0_PLR1_SU32_SUM0_SUS256_SVW4_SKXCCM8_ULSGRO1_VWA4_VWB1_WGM8_WGMXCC1_WGMXCCGn1
    SolutionIndex: 89
    SolutionNameMin: Cijk_Alik_Bljk_BSS_BH_UserArgs_MT128x128x64_MI16x16x1_SN_LDSB1_CLR1_GRVWA8_GRVWB8_GSU0_GSUC0_GSUWGMRR0_K1_LBSPPA512_LBSPPB512_LPA16_LPB16_LRVW8_MIWT4_4_NEPBS16_PLR1_SU32_SUM0_SUS256_SVW4_SKXCCM0_ULSGRO1_VWA4_VWB4_WGM8_WGMXCC1_WGMXCCGn1
    SolutionIndex: 90
    SolutionNameMin: Cijk_Alik_Bljk_BSS_BH_UserArgs_MT64x128x64_MI16x16x1_SN_LDSB1_CLR1_GRVWA8_GRVWB8_GSU0_GSUC0_GSUWGMRR0_K1_LBSPPA128_LBSPPB512_LPA16_LPB16_LRVW8_MIWT2_4_NEPBS16_PLR2_SU32_SUM0_SUS256_SVW1_SKXCCM8_ULSGRO1_VWA1_VWB4_WGM1_WGMXCC1_WGMXCCGn1
    SolutionIndex: 91
    SolutionNameMin: Cijk_Alik_Bljk_BSS_BH_UserArgs_MT128x64x64_MI16x16x1_SN_LDSB1_CLR1_GRVWA8_GRVWB8_GSU0_GSUC0_GSUWGMRR0_K1_LBSPPA512_LBSPPB128_LPA16_LPB16_LRVW8_MIWT4_2_NEPBS16_PLR1_SU32_SUM0_SUS256_SVW4_SKXCCM8_ULSGRO0_VWA4_VWB1_WGM1_WGMXCC1_WGMXCCGn1
    SolutionIndex: 92
    SolutionNameMin: Cijk_Alik_Bljk_BSS_BH_UserArgs_MT128x128x64_MI16x16x1_SN_LDSB1_CLR1_GRVWA8_GRVWB8_GSU0_GSUC0_GSUWGMRR0_K1_LBSPPA512_LBSPPB256_LPA16_LPB16_LRVW8_MIWT4_4_NEPBS16_PLR1_SU32_SUM0_SUS256_SVW4_SKXCCM8_ULSGRO1_VWA4_VWB2_WGM8_WGMXCC1_WGMXCCGn1
    SolutionIndex: 93
    SolutionNameMin: Cijk_Alik_Bljk_BSS_BH_UserArgs_MT256x64x64_MI16x16x1_SN_LDSB1_CLR1_GRVWA8_GRVWB8_GSU0_GSUC0_GSUWGMRR0_K1_LBSPPA512_LBSPPB128_LPA16_LPB16_LRVW8_MIWT8_2_NEPBS16_PLR1_SU32_SUM0_SUS256_SVW4_SKXCCM0_ULSGRO0_VWA4_VWB1_WGM1_WGMXCC1_WGMXCCGn1
    SolutionIndex: 94
    SolutionNameMin: Cijk_Alik_Bljk_BSS_BH_UserArgs_MT32x32x128_MI16x16x1_SN_LDSB1_CLR1_GRVWA8_GRVWB8_GSU0_GSUC0_GSUWGMRR0_K1_LBSPPA256_LBSPPB256_LPA16_LPB16_LRVW8_MIWT1_1_NEPBS0_PLR2_SU32_SUM0_SUS256_SVW1_SKXCCM8_ULSGRO1_VWA1_VWB1_WGM4_WGMXCC1_WGMXCCGn1
    SolutionIndex: 95
    SolutionNameMin: Cijk_Alik_Bljk_BSS_BH_UserArgs_MT32x32x128_MI16x16x1_SN_LDSB1_CLR1_GRVWA8_GRVWB8_GSU0_GSUC0_GSUWGMRR0_K1_LBSPPA256_LBSPPB256_LPA16_LPB16_LRVW8_MIWT1_1_NEPBS0_PLR2_SU32_SUM0_SUS256_SVW1_SKXCCM8_ULSGRO0_VWA1_VWB1_WGM4_WGMXCC1_WGMXCCGn1
    SolutionIndex: 96
    SolutionNameMin: Cijk_Alik_Bljk_BSS_BH_UserArgs_MT32x64x128_MI16x16x1_SN_LDSB1_CLR1_GRVWA8_GRVWB8_GSU0_GSUC0_GSUWGMRR0_K1_LBSPPA256_LBSPPB512_LPA16_LPB16_LRVW8_MIWT1_2_NEPBS0_PLR3_SU32_SUM0_SUS256_SVW1_SKXCCM0_ULSGRO0_VWA1_VWB2_WGM1_WGMXCC1_WGMXCCGn1
    SolutionIndex: 97
    SolutionNameMin: Cijk_Alik_Bljk_BSS_BH_UserArgs_MT32x64x128_MI16x16x1_SN_LDSB1_CLR1_GRVWA8_GRVWB8_GSU0_GSUC0_GSUWGMRR0_K1_LBSPPA256_LBSPPB512_LPA16_LPB16_LRVW8_MIWT1_2_NEPBS0_PLR2_SU32_SUM0_SUS256_SVW1_SKXCCM8_ULSGRO1_VWA1_VWB2_WGM8_WGMXCC1_WGMXCCGn1
    SolutionIndex: 98
    SolutionNameMin: Cijk_Alik_Bljk_BSS_BH_UserArgs_MT32x64x128_MI16x16x1_SN_LDSB1_CLR1_GRVWA8_GRVWB8_GSU0_GSUC0_GSUWGMRR0_K1_LBSPPA256_LBSPPB512_LPA16_LPB16_LRVW8_MIWT1_2_NEPBS0_PLR2_SU32_SUM0_SUS256_SVW1_SKXCCM8_ULSGRO1_VWA1_VWB2_WGM4_WGMXCC1_WGMXCCGn1
    SolutionIndex: 99
    SolutionNameMin: Cijk_Alik_Bljk_BSS_BH_UserArgs_MT64x64x64_MI16x16x1_SN_LDSB1_CLR1_GRVWA8_GRVWB8_GSU0_GSUC0_GSUWGMRR0_K1_LBSPPA128_LBSPPB256_LPA16_LPB16_LRVW8_MIWT2_2_NEPBS16_PLR1_SU32_SUM0_SUS256_SVW1_SKXCCM8_ULSGRO1_VWA1_VWB2_WGM4_WGMXCC1_WGMXCCGn1
    SolutionIndex: 100
    SolutionNameMin: Cijk_Alik_Bljk_BSS_BH_UserArgs_MT64x64x128_MI16x16x1_SN_LDSB1_CLR1_GRVWA8_GRVWB8_GSU0_GSUC0_GSUWGMRR0_K1_LBSPPA256_LBSPPB256_LPA16_LPB16_LRVW8_MIWT2_2_NEPBS0_PLR1_SU32_SUM0_SUS256_SVW1_SKXCCM8_ULSGRO0_VWA1_VWB1_WGM8_WGMXCC1_WGMXCCGn1
    SolutionIndex: 101
    SolutionNameMin: Cijk_Alik_Bljk_BSS_BH_UserArgs_MT64x64x128_MI16x16x1_SN_LDSB1_CLR1_GRVWA8_GRVWB8_GSU0_GSUC0_GSUWGMRR0_K1_LBSPPA256_LBSPPB512_LPA16_LPB16_LRVW8_MIWT2_2_NEPBS16_PLR1_SU32_SUM0_SUS256_SVW1_SKXCCM8_ULSGRO0_VWA1_VWB2_WGM1_WGMXCC1_WGMXCCGn1
    SolutionIndex: 102
    SolutionNameMin: Cijk_Alik_Bljk_BSS_BH_UserArgs_MT64x64x128_MI16x16x1_SN_LDSB1_CLR1_GRVWA8_GRVWB8_GSU0_GSUC0_GSUWGMRR0_K1_LBSPPA256_LBSPPB256_LPA16_LPB16_LRVW8_MIWT2_2_NEPBS16_PLR1_SU32_SUM0_SUS256_SVW1_SKXCCM8_ULSGRO1_VWA1_VWB1_WGM8_WGMXCC1_WGMXCCGn1
    SolutionIndex: 103
    SolutionNameMin: Cijk_Alik_Bljk_BSS_BH_UserArgs_MT128x128x64_MI16x16x1_SN_LDSB1_CLR1_GRVWA8_GRVWB8_GSU0_GSUC0_GSUWGMRR0_K1_LBSPPA512_LBSPPB256_LPA16_LPB16_LRVW8_MIWT4_4_NEPBS16_PLR1_SU32_SUM0_SUS256_SVW4_SKXCCM8_ULSGRO1_VWA4_VWB2_WGM1_WGMXCC1_WGMXCCGn1
    SolutionIndex: 104
    SolutionNameMin: Cijk_Alik_Bljk_BSS_BH_UserArgs_MT64x64x128_MI16x16x1_SN_LDSB1_CLR1_GRVWA8_GRVWB8_GSU0_GSUC0_GSUWGMRR0_K1_LBSPPA256_LBSPPB512_LPA16_LPB16_LRVW8_MIWT2_2_NEPBS16_PLR1_SU32_SUM0_SUS256_SVW1_SKXCCM0_ULSGRO1_VWA1_VWB2_WGM4_WGMXCC1_WGMXCCGn1
    SolutionIndex: 105
    SolutionNameMin: Cijk_Alik_Bljk_BSS_BH_UserArgs_MT128x64x64_MI16x16x1_SN_LDSB1_CLR1_GRVWA8_GRVWB8_GSU0_GSUC0_GSUWGMRR0_K1_LBSPPA512_LBSPPB128_LPA16_LPB16_LRVW8_MIWT4_2_NEPBS16_PLR2_SU32_SUM0_SUS256_SVW4_SKXCCM8_ULSGRO0_VWA4_VWB1_WGM1_WGMXCC1_WGMXCCGn1
    SolutionIndex: 106
    SolutionNameMin: Cijk_Alik_Bljk_BSS_BH_UserArgs_MT128x64x64_MI16x16x1_SN_LDSB1_CLR1_GRVWA8_GRVWB8_GSU0_GSUC0_GSUWGMRR0_K1_LBSPPA512_LBSPPB128_LPA16_LPB16_LRVW8_MIWT4_2_NEPBS0_PLR1_SU32_SUM0_SUS256_SVW4_SKXCCM8_ULSGRO1_VWA4_VWB1_WGM8_WGMXCC1_WGMXCCGn1
    SolutionIndex: 107
    SolutionNameMin: Cijk_Alik_Bljk_BSS_BH_UserArgs_MT128x128x64_MI16x16x1_SN_LDSB1_CLR1_GRVWA8_GRVWB8_GSU0_GSUC0_GSUWGMRR0_K1_LBSPPA512_LBSPPB512_LPA16_LPB16_LRVW8_MIWT4_4_NEPBS16_PLR1_SU32_SUM0_SUS256_SVW4_SKXCCM0_ULSGRO0_VWA4_VWB4_WGM8_WGMXCC1_WGMXCCGn1
    SolutionIndex: 108
    SolutionNameMin: Cijk_Alik_Bljk_BSS_BH_UserArgs_MT64x128x64_MI16x16x1_SN_LDSB1_CLR1_GRVWA8_GRVWB8_GSU0_GSUC0_GSUWGMRR0_K1_LBSPPA128_LBSPPB128_LPA16_LPB16_LRVW8_MIWT2_4_NEPBS16_PLR2_SU32_SUM0_SUS256_SVW1_SKXCCM8_ULSGRO1_VWA1_VWB1_WGM1_WGMXCC1_WGMXCCGn1
    SolutionIndex: 109
    SolutionNameMin: Cijk_Alik_Bljk_BSS_BH_UserArgs_MT128x64x64_MI16x16x1_SN_LDSB1_CLR1_GRVWA8_GRVWB8_GSU0_GSUC0_GSUWGMRR0_K1_LBSPPA512_LBSPPB256_LPA16_LPB16_LRVW8_MIWT4_2_NEPBS16_PLR1_SU32_SUM0_SUS256_SVW4_SKXCCM8_ULSGRO0_VWA4_VWB2_WGM1_WGMXCC1_WGMXCCGn1
    SolutionIndex: 110
    SolutionNameMin: Cijk_Alik_Bljk_BSS_BH_UserArgs_MT128x128x64_MI16x16x1_SN_LDSB1_CLR1_GRVWA8_GRVWB8_GSU0_GSUC0_GSUWGMRR0_K1_LBSPPA256_LBSPPB512_LPA16_LPB16_LRVW8_MIWT4_4_NEPBS16_PLR1_SU32_SUM0_SUS256_SVW2_SKXCCM8_ULSGRO1_VWA2_VWB4_WGM1_WGMXCC1_WGMXCCGn1
    SolutionIndex: 111
    SolutionNameMin: Cijk_Alik_Bljk_BSS_BH_UserArgs_MT128x128x64_MI16x16x1_SN_LDSB1_CLR1_GRVWA8_GRVWB8_GSU0_GSUC0_GSUWGMRR0_K1_LBSPPA512_LBSPPB256_LPA16_LPB16_LRVW8_MIWT4_4_NEPBS0_PLR1_SU32_SUM0_SUS256_SVW4_SKXCCM8_ULSGRO1_VWA4_VWB2_WGM1_WGMXCC1_WGMXCCGn1
    SolutionIndex: 112
    SolutionNameMin: Cijk_Alik_Bljk_BSS_BH_UserArgs_MT128x128x64_MI16x16x1_SN_LDSB1_CLR1_GRVWA8_GRVWB8_GSU0_GSUC0_GSUWGMRR0_K1_LBSPPA512_LBSPPB256_LPA16_LPB16_LRVW8_MIWT4_4_NEPBS0_PLR1_SU32_SUM0_SUS256_SVW4_SKXCCM8_ULSGRO0_VWA4_VWB2_WGM8_WGMXCC1_WGMXCCGn1
    SolutionIndex: 113
    SolutionNameMin: Cijk_Alik_Bljk_BSS_BH_UserArgs_MT128x128x64_MI16x16x1_SN_LDSB1_CLR1_GRVWA8_GRVWB8_GSU0_GSUC0_GSUWGMRR0_K1_LBSPPA512_LBSPPB256_LPA16_LPB16_LRVW8_MIWT4_4_NEPBS0_PLR1_SU32_SUM0_SUS256_SVW4_SKXCCM8_ULSGRO0_VWA4_VWB2_WGM1_WGMXCC1_WGMXCCGn1
    SolutionIndex: 114
    SolutionNameMin: Cijk_Alik_Bljk_BSS_BH_UserArgs_MT128x128x64_MI16x16x1_SN_LDSB1_CLR1_GRVWA8_GRVWB8_GSU0_GSUC0_GSUWGMRR0_K1_LBSPPA512_LBSPPB128_LPA16_LPB16_LRVW8_MIWT4_4_NEPBS0_PLR1_SU32_SUM0_SUS256_SVW4_SKXCCM0_ULSGRO1_VWA4_VWB1_WGM4_WGMXCC1_WGMXCCGn1
    SolutionIndex: 115
    SolutionNameMin: Cijk_Alik_Bljk_BSS_BH_UserArgs_MT128x128x64_MI16x16x1_SN_LDSB1_CLR1_GRVWA8_GRVWB8_GSU0_GSUC0_GSUWGMRR0_K1_LBSPPA512_LBSPPB256_LPA16_LPB16_LRVW8_MIWT4_4_NEPBS16_PLR1_SU32_SUM0_SUS256_SVW4_SKXCCM8_ULSGRO0_VWA4_VWB2_WGM1_WGMXCC1_WGMXCCGn1
    SolutionIndex: 116
    SolutionNameMin: Cijk_Alik_Bljk_BSS_BH_UserArgs_MT128x128x64_MI16x16x1_SN_LDSB1_CLR1_GRVWA8_GRVWB8_GSU0_GSUC0_GSUWGMRR0_K1_LBSPPA512_LBSPPB512_LPA16_LPB16_LRVW8_MIWT4_4_NEPBS0_PLR1_SU32_SUM0_SUS256_SVW4_SKXCCM8_ULSGRO1_VWA4_VWB4_WGM1_WGMXCC1_WGMXCCGn1
    SolutionIndex: 117
    SolutionNameMin: Cijk_Alik_Bljk_BSS_BH_UserArgs_MT128x128x64_MI16x16x1_SN_LDSB1_CLR1_GRVWA8_GRVWB8_GSU0_GSUC0_GSUWGMRR0_K1_LBSPPA512_LBSPPB128_LPA16_LPB16_LRVW8_MIWT4_4_NEPBS0_PLR1_SU32_SUM0_SUS256_SVW4_SKXCCM8_ULSGRO1_VWA4_VWB1_WGM1_WGMXCC1_WGMXCCGn1
    SolutionIndex: 118
    SolutionNameMin: Cijk_Alik_Bljk_BSS_BH_UserArgs_MT128x128x64_MI16x16x1_SN_LDSB1_CLR1_GRVWA8_GRVWB8_GSU0_GSUC0_GSUWGMRR0_K1_LBSPPA512_LBSPPB128_LPA16_LPB16_LRVW8_MIWT4_4_NEPBS0_PLR1_SU32_SUM0_SUS256_SVW4_SKXCCM8_ULSGRO0_VWA4_VWB1_WGM1_WGMXCC1_WGMXCCGn1
    SolutionIndex: 119
    SolutionNameMin: Cijk_Alik_Bljk_BSS_BH_UserArgs_MT128x128x64_MI16x16x1_SN_LDSB1_CLR1_GRVWA8_GRVWB8_GSU0_GSUC0_GSUWGMRR0_K1_LBSPPA256_LBSPPB256_LPA16_LPB16_LRVW8_MIWT4_4_NEPBS16_PLR1_SU32_SUM0_SUS256_SVW2_SKXCCM0_ULSGRO0_VWA2_VWB2_WGM8_WGMXCC1_WGMXCCGn1
    SolutionIndex: 120
    SolutionNameMin: Cijk_Alik_Bljk_BSS_BH_UserArgs_MT64x32x128_MI16x16x1_SN_LDSB1_CLR1_GRVWA8_GRVWB8_GSU0_GSUC0_GSUWGMRR0_K1_LBSPPA512_LBSPPB256_LPA16_LPB16_LRVW8_MIWT2_1_NEPBS0_PLR2_SU32_SUM0_SUS256_SVW2_SKXCCM8_ULSGRO1_VWA2_VWB1_WGM8_WGMXCC1_WGMXCCGn1
    SolutionIndex: 121
    SolutionNameMin: Cijk_Alik_Bljk_BSS_BH_UserArgs_MT64x64x64_MI16x16x1_SN_LDSB1_CLR1_GRVWA8_GRVWB8_GSU0_GSUC0_GSUWGMRR0_K1_LBSPPA128_LBSPPB128_LPA16_LPB16_LRVW8_MIWT2_2_NEPBS16_PLR1_SU32_SUM0_SUS256_SVW1_SKXCCM8_ULSGRO1_VWA1_VWB1_WGM8_WGMXCC1_WGMXCCGn1
    SolutionIndex: 122
    SolutionNameMin: Cijk_Alik_Bljk_BSS_BH_UserArgs_MT32x64x128_MI16x16x1_SN_LDSB1_CLR1_GRVWA8_GRVWB8_GSU0_GSUC0_GSUWGMRR0_K1_LBSPPA256_LBSPPB512_LPA16_LPB16_LRVW8_MIWT1_2_NEPBS16_PLR2_SU32_SUM0_SUS256_SVW1_SKXCCM0_ULSGRO1_VWA1_VWB2_WGM1_WGMXCC1_WGMXCCGn1
    SolutionIndex: 123
    SolutionNameMin: Cijk_Alik_Bljk_BSS_BH_UserArgs_MT32x64x128_MI16x16x1_SN_LDSB1_CLR1_GRVWA8_GRVWB8_GSU0_GSUC0_GSUWGMRR0_K1_LBSPPA256_LBSPPB512_LPA16_LPB16_LRVW8_MIWT1_2_NEPBS16_PLR1_SU32_SUM0_SUS256_SVW1_SKXCCM8_ULSGRO0_VWA1_VWB2_WGM1_WGMXCC1_WGMXCCGn1
    SolutionIndex: 124
    SolutionNameMin: Cijk_Alik_Bljk_BSS_BH_UserArgs_MT32x64x128_MI16x16x1_SN_LDSB1_CLR1_GRVWA8_GRVWB8_GSU0_GSUC0_GSUWGMRR0_K1_LBSPPA256_LBSPPB512_LPA16_LPB16_LRVW8_MIWT1_2_NEPBS0_PLR2_SU32_SUM0_SUS256_SVW1_SKXCCM8_ULSGRO0_VWA1_VWB2_WGM1_WGMXCC1_WGMXCCGn1
    SolutionIndex: 125
    SolutionNameMin: Cijk_Alik_Bljk_BSS_BH_UserArgs_MT64x32x128_MI16x16x1_SN_LDSB1_CLR1_GRVWA8_GRVWB8_GSU0_GSUC0_GSUWGMRR0_K1_LBSPPA256_LBSPPB256_LPA16_LPB16_LRVW8_MIWT2_1_NEPBS16_PLR1_SU32_SUM0_SUS256_SVW1_SKXCCM8_ULSGRO1_VWA1_VWB1_WGM4_WGMXCC1_WGMXCCGn1
    SolutionIndex: 126
    SolutionNameMin: Cijk_Alik_Bljk_BSS_BH_UserArgs_MT64x64x128_MI16x16x1_SN_LDSB1_CLR1_GRVWA8_GRVWB8_GSU0_GSUC0_GSUWGMRR0_K1_LBSPPA256_LBSPPB512_LPA16_LPB16_LRVW8_MIWT2_2_NEPBS0_PLR1_SU32_SUM0_SUS256_SVW1_SKXCCM8_ULSGRO0_VWA1_VWB2_WGM8_WGMXCC1_WGMXCCGn1
    SolutionIndex: 127
    SolutionNameMin: Cijk_Alik_Bljk_BSS_BH_UserArgs_MT64x128x64_MI16x16x1_SN_LDSB1_CLR1_GRVWA8_GRVWB8_GSU0_GSUC0_GSUWGMRR0_K1_LBSPPA128_LBSPPB128_LPA16_LPB16_LRVW8_MIWT2_4_NEPBS0_PLR1_SU32_SUM0_SUS256_SVW1_SKXCCM8_ULSGRO1_VWA1_VWB1_WGM1_WGMXCC1_WGMXCCGn1
    SolutionIndex: 128
    SolutionNameMin: Cijk_Alik_Bljk_BSS_BH_UserArgs_MT64x64x128_MI16x16x1_SN_LDSB1_CLR1_GRVWA8_GRVWB8_GSU0_GSUC0_GSUWGMRR0_K1_LBSPPA256_LBSPPB256_LPA16_LPB16_LRVW8_MIWT2_2_NEPBS16_PLR3_SU32_SUM0_SUS256_SVW1_SKXCCM8_ULSGRO0_VWA1_VWB1_WGM8_WGMXCC1_WGMXCCGn1
    SolutionIndex: 129
    SolutionNameMin: Cijk_Alik_Bljk_BSS_BH_UserArgs_MT64x64x128_MI16x16x1_SN_LDSB1_CLR1_GRVWA8_GRVWB8_GSU0_GSUC0_GSUWGMRR0_K1_LBSPPA256_LBSPPB256_LPA16_LPB16_LRVW8_MIWT2_2_NEPBS16_PLR2_SU32_SUM0_SUS256_SVW1_SKXCCM8_ULSGRO1_VWA1_VWB1_WGM8_WGMXCC1_WGMXCCGn1
    SolutionIndex: 130
    SolutionNameMin: Cijk_Alik_Bljk_BSS_BH_UserArgs_MT128x64x64_MI16x16x1_SN_LDSB1_CLR1_GRVWA8_GRVWB8_GSU0_GSUC0_GSUWGMRR0_K1_LBSPPA512_LBSPPB256_LPA16_LPB16_LRVW8_MIWT4_2_NEPBS0_PLR1_SU32_SUM0_SUS256_SVW4_SKXCCM8_ULSGRO0_VWA4_VWB2_WGM8_WGMXCC1_WGMXCCGn1
    SolutionIndex: 131
    SolutionNameMin: Cijk_Alik_Bljk_BSS_BH_UserArgs_MT128x32x128_MI16x16x1_SN_LDSB1_CLR1_GRVWA8_GRVWB8_GSU0_GSUC0_GSUWGMRR0_K1_LBSPPA1024_LBSPPB256_LPA16_LPB16_LRVW8_MIWT4_1_NEPBS16_PLR2_SU32_SUM0_SUS256_SVW4_SKXCCM8_ULSGRO1_VWA4_VWB1_WGM1_WGMXCC1_WGMXCCGn1
    SolutionIndex: 132
    SolutionNameMin: Cijk_Alik_Bljk_BSS_BH_UserArgs_MT128x64x64_MI16x16x1_SN_LDSB1_CLR1_GRVWA8_GRVWB8_GSU0_GSUC0_GSUWGMRR0_K1_LBSPPA512_LBSPPB128_LPA16_LPB16_LRVW8_MIWT4_2_NEPBS16_PLR2_SU32_SUM0_SUS256_SVW4_SKXCCM8_ULSGRO1_VWA4_VWB1_WGM8_WGMXCC1_WGMXCCGn1
    SolutionIndex: 133
    SolutionNameMin: Cijk_Alik_Bljk_BSS_BH_UserArgs_MT128x64x64_MI16x16x1_SN_LDSB1_CLR1_GRVWA8_GRVWB8_GSU0_GSUC0_GSUWGMRR0_K1_LBSPPA512_LBSPPB128_LPA16_LPB16_LRVW8_MIWT4_2_NEPBS16_PLR1_SU32_SUM0_SUS256_SVW4_SKXCCM8_ULSGRO0_VWA4_VWB1_WGM8_WGMXCC1_WGMXCCGn1
    SolutionIndex: 134
    SolutionNameMin: Cijk_Alik_Bljk_BSS_BH_UserArgs_MT128x64x64_MI16x16x1_SN_LDSB1_CLR1_GRVWA8_GRVWB8_GSU0_GSUC0_GSUWGMRR0_K1_LBSPPA512_LBSPPB256_LPA16_LPB16_LRVW8_MIWT4_2_NEPBS0_PLR1_SU32_SUM0_SUS256_SVW4_SKXCCM8_ULSGRO1_VWA4_VWB2_WGM8_WGMXCC1_WGMXCCGn1
    SolutionIndex: 135
    SolutionNameMin: Cijk_Alik_Bljk_BSS_BH_UserArgs_MT128x64x64_MI16x16x1_SN_LDSB1_CLR1_GRVWA8_GRVWB8_GSU0_GSUC0_GSUWGMRR0_K1_LBSPPA512_LBSPPB128_LPA16_LPB16_LRVW8_MIWT4_2_NEPBS16_PLR1_SU32_SUM0_SUS256_SVW4_SKXCCM0_ULSGRO1_VWA4_VWB1_WGM8_WGMXCC1_WGMXCCGn1
    SolutionIndex: 136
    SolutionNameMin: Cijk_Alik_Bljk_BSS_BH_UserArgs_MT128x64x64_MI16x16x1_SN_LDSB1_CLR1_GRVWA8_GRVWB8_GSU0_GSUC0_GSUWGMRR0_K1_LBSPPA128_LBSPPB128_LPA16_LPB16_LRVW8_MIWT4_2_NEPBS16_PLR2_SU32_SUM0_SUS256_SVW1_SKXCCM8_ULSGRO0_VWA1_VWB1_WGM1_WGMXCC1_WGMXCCGn1
    SolutionIndex: 137
    SolutionNameMin: Cijk_Alik_Bljk_BSS_BH_UserArgs_MT128x128x64_MI16x16x1_SN_LDSB1_CLR1_GRVWA8_GRVWB8_GSU0_GSUC0_GSUWGMRR0_K1_LBSPPA512_LBSPPB128_LPA16_LPB16_LRVW8_MIWT4_4_NEPBS16_PLR1_SU32_SUM0_SUS256_SVW4_SKXCCM8_ULSGRO1_VWA4_VWB1_WGM4_WGMXCC1_WGMXCCGn1
    SolutionIndex: 138
    SolutionNameMin: Cijk_Alik_Bljk_BSS_BH_UserArgs_MT128x128x64_MI16x16x1_SN_LDSB1_CLR1_GRVWA8_GRVWB8_GSU0_GSUC0_GSUWGMRR0_K1_LBSPPA128_LBSPPB256_LPA16_LPB16_LRVW8_MIWT4_4_NEPBS16_PLR1_SU32_SUM0_SUS256_SVW1_SKXCCM0_ULSGRO1_VWA1_VWB2_WGM8_WGMXCC1_WGMXCCGn1
    SolutionIndex: 139
    SolutionNameMin: Cijk_Alik_Bljk_BSS_BH_UserArgs_MT128x64x64_MI16x16x1_SN_LDSB1_CLR1_GRVWA8_GRVWB8_GSU0_GSUC0_GSUWGMRR0_K1_LBSPPA512_LBSPPB256_LPA16_LPB16_LRVW8_MIWT4_2_NEPBS0_PLR1_SU32_SUM0_SUS256_SVW4_SKXCCM8_ULSGRO1_VWA4_VWB2_WGM1_WGMXCC1_WGMXCCGn1
    SolutionIndex: 140
    SolutionNameMin: Cijk_Alik_Bljk_BSS_BH_UserArgs_MT128x128x64_MI16x16x1_SN_LDSB1_CLR1_GRVWA8_GRVWB8_GSU0_GSUC0_GSUWGMRR0_K1_LBSPPA512_LBSPPB128_LPA16_LPB16_LRVW8_MIWT4_4_NEPBS0_PLR1_SU32_SUM0_SUS256_SVW4_SKXCCM8_ULSGRO0_VWA4_VWB1_WGM4_WGMXCC1_WGMXCCGn1
    SolutionIndex: 141
    SolutionNameMin: Cijk_Alik_Bljk_BSS_BH_UserArgs_MT128x128x64_MI16x16x1_SN_LDSB1_CLR1_GRVWA8_GRVWB8_GSU0_GSUC0_GSUWGMRR0_K1_LBSPPA512_LBSPPB512_LPA16_LPB16_LRVW8_MIWT4_4_NEPBS0_PLR1_SU32_SUM0_SUS256_SVW4_SKXCCM8_ULSGRO1_VWA4_VWB4_WGM4_WGMXCC1_WGMXCCGn1
    SolutionIndex: 142
    SolutionNameMin: Cijk_Alik_Bljk_BSS_BH_UserArgs_MT128x128x64_MI16x16x1_SN_LDSB1_CLR1_GRVWA8_GRVWB8_GSU0_GSUC0_GSUWGMRR0_K1_LBSPPA512_LBSPPB256_LPA16_LPB16_LRVW8_MIWT4_4_NEPBS0_PLR1_SU32_SUM0_SUS256_SVW4_SKXCCM8_ULSGRO1_VWA4_VWB2_WGM4_WGMXCC1_WGMXCCGn1
    SolutionIndex: 143
    SolutionNameMin: Cijk_Alik_Bljk_BSS_BH_UserArgs_MT128x128x64_MI16x16x1_SN_LDSB1_CLR1_GRVWA8_GRVWB8_GSU0_GSUC0_GSUWGMRR0_K1_LBSPPA512_LBSPPB128_LPA16_LPB16_LRVW8_MIWT4_4_NEPBS16_PLR1_SU32_SUM0_SUS256_SVW4_SKXCCM8_ULSGRO0_VWA4_VWB1_WGM8_WGMXCC1_WGMXCCGn1
    SolutionIndex: 144
    SolutionNameMin: Cijk_Alik_Bljk_BSS_BH_UserArgs_MT128x128x64_MI16x16x1_SN_LDSB1_CLR1_GRVWA8_GRVWB8_GSU0_GSUC0_GSUWGMRR0_K1_LBSPPA512_LBSPPB512_LPA16_LPB16_LRVW8_MIWT4_4_NEPBS0_PLR1_SU32_SUM0_SUS256_SVW4_SKXCCM8_ULSGRO0_VWA4_VWB4_WGM4_WGMXCC1_WGMXCCGn1
    SolutionIndex: 145
    SolutionNameMin: Cijk_Alik_Bljk_BSS_BH_UserArgs_MT128x128x64_MI16x16x1_SN_LDSB1_CLR1_GRVWA8_GRVWB8_GSU0_GSUC0_GSUWGMRR0_K1_LBSPPA512_LBSPPB512_LPA16_LPB16_LRVW8_MIWT4_4_NEPBS16_PLR1_SU32_SUM0_SUS256_SVW4_SKXCCM8_ULSGRO0_VWA4_VWB4_WGM4_WGMXCC1_WGMXCCGn1
    SolutionIndex: 146
    SolutionNameMin: Cijk_Alik_Bljk_BSS_BH_UserArgs_MT128x128x64_MI16x16x1_SN_LDSB1_CLR1_GRVWA8_GRVWB8_GSU0_GSUC0_GSUWGMRR0_K1_LBSPPA512_LBSPPB512_LPA16_LPB16_LRVW8_MIWT4_4_NEPBS16_PLR1_SU32_SUM0_SUS256_SVW4_SKXCCM8_ULSGRO1_VWA4_VWB4_WGM8_WGMXCC1_WGMXCCGn1
    SolutionIndex: 147
    SolutionNameMin: Cijk_Alik_Bljk_BSS_BH_UserArgs_MT128x128x64_MI16x16x1_SN_LDSB1_CLR1_GRVWA8_GRVWB8_GSU0_GSUC0_GSUWGMRR0_K1_LBSPPA256_LBSPPB128_LPA16_LPB16_LRVW8_MIWT4_4_NEPBS0_PLR1_SU32_SUM0_SUS256_SVW2_SKXCCM8_ULSGRO1_VWA2_VWB1_WGM8_WGMXCC1_WGMXCCGn1
    SolutionIndex: 148
    SolutionNameMin: Cijk_Alik_Bljk_BSS_BH_UserArgs_MT32x64x128_MI16x16x1_SN_LDSB1_CLR1_GRVWA8_GRVWB8_GSU0_GSUC0_GSUWGMRR0_K1_LBSPPA256_LBSPPB256_LPA16_LPB16_LRVW8_MIWT1_2_NEPBS16_PLR1_SU32_SUM0_SUS256_SVW1_SKXCCM0_ULSGRO1_VWA1_VWB1_WGM1_WGMXCC1_WGMXCCGn1
    SolutionIndex: 149
    SolutionNameMin: Cijk_Alik_Bljk_BSS_BH_UserArgs_MT64x32x128_MI16x16x1_SN_LDSB1_CLR1_GRVWA8_GRVWB8_GSU0_GSUC0_GSUWGMRR0_K1_LBSPPA256_LBSPPB256_LPA16_LPB16_LRVW8_MIWT2_1_NEPBS0_PLR2_SU32_SUM0_SUS256_SVW1_SKXCCM0_ULSGRO1_VWA1_VWB1_WGM4_WGMXCC1_WGMXCCGn1
    SolutionIndex: 150
    SolutionNameMin: Cijk_Alik_Bljk_BSS_BH_UserArgs_MT64x32x128_MI16x16x1_SN_LDSB1_CLR1_GRVWA8_GRVWB8_GSU0_GSUC0_GSUWGMRR0_K1_LBSPPA256_LBSPPB256_LPA16_LPB16_LRVW8_MIWT2_1_NEPBS0_PLR2_SU32_SUM0_SUS256_SVW1_SKXCCM0_ULSGRO1_VWA1_VWB1_WGM1_WGMXCC1_WGMXCCGn1
    SolutionIndex: 151
    SolutionNameMin: Cijk_Alik_Bljk_BSS_BH_UserArgs_MT64x64x64_MI16x16x1_SN_LDSB1_CLR1_GRVWA8_GRVWB8_GSU0_GSUC0_GSUWGMRR0_K1_LBSPPA128_LBSPPB128_LPA16_LPB16_LRVW8_MIWT2_2_NEPBS0_PLR1_SU32_SUM0_SUS256_SVW1_SKXCCM8_ULSGRO0_VWA1_VWB1_WGM4_WGMXCC1_WGMXCCGn1
    SolutionIndex: 152
    SolutionNameMin: Cijk_Alik_Bljk_BSS_BH_UserArgs_MT64x64x128_MI16x16x1_SN_LDSB1_CLR1_GRVWA8_GRVWB8_GSU0_GSUC0_GSUWGMRR0_K1_LBSPPA256_LBSPPB512_LPA16_LPB16_LRVW8_MIWT2_2_NEPBS16_PLR1_SU32_SUM0_SUS256_SVW1_SKXCCM8_ULSGRO0_VWA1_VWB2_WGM4_WGMXCC1_WGMXCCGn1
    SolutionIndex: 153
    SolutionNameMin: Cijk_Alik_Bljk_BSS_BH_UserArgs_MT64x128x64_MI16x16x1_SN_LDSB1_CLR1_GRVWA8_GRVWB8_GSU0_GSUC0_GSUWGMRR0_K1_LBSPPA128_LBSPPB128_LPA16_LPB16_LRVW8_MIWT2_4_NEPBS0_PLR1_SU32_SUM0_SUS256_SVW1_SKXCCM0_ULSGRO0_VWA1_VWB1_WGM1_WGMXCC1_WGMXCCGn1
    SolutionIndex: 154
    SolutionNameMin: Cijk_Alik_Bljk_BSS_BH_UserArgs_MT64x64x128_MI16x16x1_SN_LDSB1_CLR1_GRVWA8_GRVWB8_GSU0_GSUC0_GSUWGMRR0_K1_LBSPPA256_LBSPPB512_LPA16_LPB16_LRVW8_MIWT2_2_NEPBS16_PLR2_SU32_SUM0_SUS256_SVW1_SKXCCM8_ULSGRO1_VWA1_VWB2_WGM1_WGMXCC1_WGMXCCGn1
    SolutionIndex: 155
    SolutionNameMin: Cijk_Alik_Bljk_BSS_BH_UserArgs_MT64x64x128_MI16x16x1_SN_LDSB1_CLR1_GRVWA8_GRVWB8_GSU0_GSUC0_GSUWGMRR0_K1_LBSPPA256_LBSPPB256_LPA16_LPB16_LRVW8_MIWT2_2_NEPBS0_PLR3_SU32_SUM0_SUS256_SVW1_SKXCCM8_ULSGRO1_VWA1_VWB1_WGM8_WGMXCC1_WGMXCCGn1
    SolutionIndex: 156
    SolutionNameMin: Cijk_Alik_Bljk_BSS_BH_UserArgs_MT64x64x128_MI16x16x1_SN_LDSB1_CLR1_GRVWA8_GRVWB8_GSU0_GSUC0_GSUWGMRR0_K1_LBSPPA256_LBSPPB512_LPA16_LPB16_LRVW8_MIWT2_2_NEPBS16_PLR2_SU32_SUM0_SUS256_SVW1_SKXCCM8_ULSGRO1_VWA1_VWB2_WGM8_WGMXCC1_WGMXCCGn1
    SolutionIndex: 157
    SolutionNameMin: Cijk_Alik_Bljk_BSS_BH_UserArgs_MT64x128x64_MI16x16x1_SN_LDSB1_CLR1_GRVWA8_GRVWB8_GSU0_GSUC0_GSUWGMRR0_K1_LBSPPA128_LBSPPB128_LPA16_LPB16_LRVW8_MIWT2_4_NEPBS0_PLR1_SU32_SUM0_SUS256_SVW1_SKXCCM8_ULSGRO0_VWA1_VWB1_WGM1_WGMXCC1_WGMXCCGn1
    SolutionIndex: 158
    SolutionNameMin: Cijk_Alik_Bljk_BSS_BH_UserArgs_MT128x32x128_MI16x16x1_SN_LDSB1_CLR1_GRVWA8_GRVWB8_GSU0_GSUC0_GSUWGMRR0_K1_LBSPPA1024_LBSPPB256_LPA16_LPB16_LRVW8_MIWT4_1_NEPBS16_PLR1_SU32_SUM0_SUS256_SVW4_SKXCCM8_ULSGRO1_VWA4_VWB1_WGM1_WGMXCC1_WGMXCCGn1
    SolutionIndex: 159
    SolutionNameMin: Cijk_Alik_Bljk_BSS_BH_UserArgs_MT64x128x64_MI16x16x1_SN_LDSB1_CLR1_GRVWA8_GRVWB8_GSU0_GSUC0_GSUWGMRR0_K1_LBSPPA128_LBSPPB128_LPA16_LPB16_LRVW8_MIWT2_4_NEPBS0_PLR1_SU32_SUM0_SUS256_SVW1_SKXCCM8_ULSGRO0_VWA1_VWB1_WGM8_WGMXCC1_WGMXCCGn1
    SolutionIndex: 160
    SolutionNameMin: Cijk_Alik_Bljk_BSS_BH_UserArgs_MT128x64x64_MI16x16x1_SN_LDSB1_CLR1_GRVWA8_GRVWB8_GSU0_GSUC0_GSUWGMRR0_K1_LBSPPA512_LBSPPB128_LPA16_LPB16_LRVW8_MIWT4_2_NEPBS0_PLR1_SU32_SUM0_SUS256_SVW4_SKXCCM8_ULSGRO0_VWA4_VWB1_WGM8_WGMXCC1_WGMXCCGn1
    SolutionIndex: 161
    SolutionNameMin: Cijk_Alik_Bljk_BSS_BH_UserArgs_MT128x64x64_MI16x16x1_SN_LDSB1_CLR1_GRVWA8_GRVWB8_GSU0_GSUC0_GSUWGMRR0_K1_LBSPPA512_LBSPPB128_LPA16_LPB16_LRVW8_MIWT4_2_NEPBS16_PLR1_SU32_SUM0_SUS256_SVW4_SKXCCM8_ULSGRO1_VWA4_VWB1_WGM8_WGMXCC1_WGMXCCGn1
    SolutionIndex: 162
    SolutionNameMin: Cijk_Alik_Bljk_BSS_BH_UserArgs_MT128x128x64_MI16x16x1_SN_LDSB1_CLR1_GRVWA8_GRVWB8_GSU0_GSUC0_GSUWGMRR0_K1_LBSPPA512_LBSPPB128_LPA16_LPB16_LRVW8_MIWT4_4_NEPBS16_PLR1_SU32_SUM0_SUS256_SVW4_SKXCCM8_ULSGRO0_VWA4_VWB1_WGM1_WGMXCC1_WGMXCCGn1
    SolutionIndex: 163
    SolutionNameMin: Cijk_Alik_Bljk_BSS_BH_UserArgs_MT128x64x64_MI16x16x1_SN_LDSB1_CLR1_GRVWA8_GRVWB8_GSU0_GSUC0_GSUWGMRR0_K1_LBSPPA128_LBSPPB128_LPA16_LPB16_LRVW8_MIWT4_2_NEPBS16_PLR2_SU32_SUM0_SUS256_SVW1_SKXCCM8_ULSGRO0_VWA1_VWB1_WGM8_WGMXCC1_WGMXCCGn1
    SolutionIndex: 164
    SolutionNameMin: Cijk_Alik_Bljk_BSS_BH_UserArgs_MT128x128x64_MI16x16x1_SN_LDSB1_CLR1_GRVWA8_GRVWB8_GSU0_GSUC0_GSUWGMRR0_K1_LBSPPA256_LBSPPB256_LPA16_LPB16_LRVW8_MIWT4_4_NEPBS0_PLR1_SU32_SUM0_SUS256_SVW2_SKXCCM8_ULSGRO1_VWA2_VWB2_WGM8_WGMXCC1_WGMXCCGn1
    SolutionIndex: 165
    SolutionNameMin: Cijk_Alik_Bljk_BSS_BH_UserArgs_MT128x128x64_MI16x16x1_SN_LDSB1_CLR1_GRVWA8_GRVWB8_GSU0_GSUC0_GSUWGMRR0_K1_LBSPPA512_LBSPPB512_LPA16_LPB16_LRVW8_MIWT4_4_NEPBS16_PLR1_SU32_SUM0_SUS256_SVW4_SKXCCM8_ULSGRO0_VWA4_VWB4_WGM1_WGMXCC1_WGMXCCGn1
    SolutionIndex: 166
    SolutionNameMin: Cijk_Alik_Bljk_BSS_BH_UserArgs_MT128x128x64_MI16x16x1_SN_LDSB1_CLR1_GRVWA8_GRVWB8_GSU0_GSUC0_GSUWGMRR0_K1_LBSPPA256_LBSPPB512_LPA16_LPB16_LRVW8_MIWT4_4_NEPBS16_PLR1_SU32_SUM0_SUS256_SVW2_SKXCCM8_ULSGRO0_VWA2_VWB4_WGM1_WGMXCC1_WGMXCCGn1
    SolutionIndex: 167
    SolutionNameMin: Cijk_Alik_Bljk_BSS_BH_UserArgs_MT128x128x64_MI16x16x1_SN_LDSB1_CLR1_GRVWA8_GRVWB8_GSU0_GSUC0_GSUWGMRR0_K1_LBSPPA512_LBSPPB512_LPA16_LPB16_LRVW8_MIWT4_4_NEPBS0_PLR1_SU32_SUM0_SUS256_SVW4_SKXCCM0_ULSGRO1_VWA4_VWB4_WGM4_WGMXCC1_WGMXCCGn1
    SolutionIndex: 168
    SolutionNameMin: Cijk_Alik_Bljk_BSS_BH_UserArgs_MT128x128x64_MI16x16x1_SN_LDSB1_CLR1_GRVWA8_GRVWB8_GSU0_GSUC0_GSUWGMRR0_K1_LBSPPA512_LBSPPB512_LPA16_LPB16_LRVW8_MIWT4_4_NEPBS16_PLR1_SU32_SUM0_SUS256_SVW4_SKXCCM8_ULSGRO0_VWA4_VWB4_WGM8_WGMXCC1_WGMXCCGn1
    SolutionIndex: 169
    SolutionNameMin: Cijk_Alik_Bljk_BSS_BH_UserArgs_MT128x128x64_MI16x16x1_SN_LDSB1_CLR1_GRVWA8_GRVWB8_GSU0_GSUC0_GSUWGMRR0_K1_LBSPPA512_LBSPPB512_LPA16_LPB16_LRVW8_MIWT4_4_NEPBS16_PLR1_SU32_SUM0_SUS256_SVW4_SKXCCM0_ULSGRO1_VWA4_VWB4_WGM1_WGMXCC1_WGMXCCGn1
    SolutionIndex: 170
    SolutionNameMin: Cijk_Alik_Bljk_BSS_BH_UserArgs_MT128x64x64_MI16x16x1_SN_LDSB1_CLR1_GRVWA8_GRVWB8_GSU0_GSUC0_GSUWGMRR0_K1_LBSPPA512_LBSPPB128_LPA16_LPB16_LRVW8_MIWT4_2_NEPBS0_PLR1_SU32_SUM0_SUS256_SVW4_SKXCCM0_ULSGRO1_VWA4_VWB1_WGM8_WGMXCC1_WGMXCCGn1
    SolutionIndex: 171
    SolutionNameMin: Cijk_Alik_Bljk_BSS_BH_UserArgs_MT128x128x64_MI16x16x1_SN_LDSB1_CLR1_GRVWA8_GRVWB8_GSU0_GSUC0_GSUWGMRR0_K1_LBSPPA512_LBSPPB128_LPA16_LPB16_LRVW8_MIWT4_4_NEPBS16_PLR1_SU32_SUM0_SUS256_SVW4_SKXCCM8_ULSGRO1_VWA4_VWB1_WGM8_WGMXCC1_WGMXCCGn1
    SolutionIndex: 172
    SolutionNameMin: Cijk_Alik_Bljk_BSS_BH_UserArgs_MT128x128x64_MI16x16x1_SN_LDSB1_CLR1_GRVWA8_GRVWB8_GSU0_GSUC0_GSUWGMRR0_K1_LBSPPA128_LBSPPB128_LPA16_LPB16_LRVW8_MIWT4_4_NEPBS16_PLR1_SU32_SUM0_SUS256_SVW1_SKXCCM8_ULSGRO1_VWA1_VWB1_WGM4_WGMXCC1_WGMXCCGn1
    SolutionIndex: 173
    SolutionNameMin: Cijk_Alik_Bljk_BSS_BH_UserArgs_MT128x128x64_MI16x16x1_SN_LDSB1_CLR1_GRVWA8_GRVWB8_GSU0_GSUC0_GSUWGMRR0_K1_LBSPPA512_LBSPPB512_LPA16_LPB16_LRVW8_MIWT4_4_NEPBS16_PLR1_SU32_SUM0_SUS256_SVW4_SKXCCM0_ULSGRO0_VWA4_VWB4_WGM1_WGMXCC1_WGMXCCGn1
    SolutionIndex: 174
    SolutionNameMin: Cijk_Alik_Bljk_BSS_BH_UserArgs_MT128x128x64_MI16x16x1_SN_LDSB1_CLR1_GRVWA8_GRVWB8_GSU0_GSUC0_GSUWGMRR0_K1_LBSPPA256_LBSPPB512_LPA16_LPB16_LRVW8_MIWT4_4_NEPBS16_PLR1_SU32_SUM0_SUS256_SVW2_SKXCCM8_ULSGRO1_VWA2_VWB4_WGM8_WGMXCC1_WGMXCCGn1
    SolutionIndex: 175
    SolutionNameMin: Cijk_Alik_Bljk_BSS_BH_UserArgs_MT64x64x128_MI16x16x1_SN_LDSB1_CLR1_GRVWA8_GRVWB8_GSU0_GSUC0_GSUWGMRR0_K1_LBSPPA256_LBSPPB512_LPA16_LPB16_LRVW8_MIWT2_2_NEPBS16_PLR1_SU32_SUM0_SUS256_SVW1_SKXCCM8_ULSGRO0_VWA1_VWB2_WGM8_WGMXCC1_WGMXCCGn1
    SolutionIndex: 176
    SolutionNameMin: Cijk_Alik_Bljk_BSS_BH_UserArgs_MT64x64x128_MI16x16x1_SN_LDSB1_CLR1_GRVWA8_GRVWB8_GSU0_GSUC0_GSUWGMRR0_K1_LBSPPA256_LBSPPB512_LPA16_LPB16_LRVW8_MIWT2_2_NEPBS0_PLR1_SU32_SUM0_SUS256_SVW1_SKXCCM8_ULSGRO1_VWA1_VWB2_WGM8_WGMXCC1_WGMXCCGn1
    SolutionIndex: 177
    SolutionNameMin: Cijk_Alik_Bljk_BSS_BH_UserArgs_MT64x64x128_MI16x16x1_SN_LDSB1_CLR1_GRVWA8_GRVWB8_GSU0_GSUC0_GSUWGMRR0_K1_LBSPPA256_LBSPPB256_LPA16_LPB16_LRVW8_MIWT2_2_NEPBS0_PLR3_SU32_SUM0_SUS256_SVW1_SKXCCM8_ULSGRO0_VWA1_VWB1_WGM4_WGMXCC1_WGMXCCGn1
    SolutionIndex: 178
    SolutionNameMin: Cijk_Alik_Bljk_BSS_BH_UserArgs_MT64x64x128_MI16x16x1_SN_LDSB1_CLR1_GRVWA8_GRVWB8_GSU0_GSUC0_GSUWGMRR0_K1_LBSPPA256_LBSPPB512_LPA16_LPB16_LRVW8_MIWT2_2_NEPBS0_PLR1_SU32_SUM0_SUS256_SVW1_SKXCCM8_ULSGRO0_VWA1_VWB2_WGM4_WGMXCC1_WGMXCCGn1
    SolutionIndex: 179
    SolutionNameMin: Cijk_Alik_Bljk_BSS_BH_UserArgs_MT64x128x64_MI16x16x1_SN_LDSB1_CLR1_GRVWA8_GRVWB8_GSU0_GSUC0_GSUWGMRR0_K1_LBSPPA256_LBSPPB256_LPA16_LPB16_LRVW8_MIWT2_4_NEPBS16_PLR1_SU32_SUM0_SUS256_SVW2_SKXCCM8_ULSGRO1_VWA2_VWB2_WGM1_WGMXCC1_WGMXCCGn1
    SolutionIndex: 180
    SolutionNameMin: Cijk_Alik_Bljk_BSS_BH_UserArgs_MT128x128x64_MI16x16x1_SN_LDSB1_CLR1_GRVWA8_GRVWB8_GSU0_GSUC0_GSUWGMRR0_K1_LBSPPA512_LBSPPB128_LPA16_LPB16_LRVW8_MIWT4_4_NEPBS16_PLR1_SU32_SUM0_SUS256_SVW4_SKXCCM0_ULSGRO1_VWA4_VWB1_WGM1_WGMXCC1_WGMXCCGn1
    SolutionIndex: 181
    SolutionNameMin: Cijk_Alik_Bljk_BSS_BH_UserArgs_MT128x32x128_MI16x16x1_SN_LDSB1_CLR1_GRVWA8_GRVWB8_GSU0_GSUC0_GSUWGMRR0_K1_LBSPPA256_LBSPPB256_LPA16_LPB16_LRVW8_MIWT4_1_NEPBS16_PLR1_SU32_SUM0_SUS256_SVW1_SKXCCM8_ULSGRO1_VWA1_VWB1_WGM1_WGMXCC1_WGMXCCGn1
    SolutionIndex: 182
    SolutionNameMin: Cijk_Alik_Bljk_BSS_BH_UserArgs_MT64x128x64_MI16x16x1_SN_LDSB1_CLR1_GRVWA8_GRVWB8_GSU0_GSUC0_GSUWGMRR0_K1_LBSPPA128_LBSPPB128_LPA16_LPB16_LRVW8_MIWT2_4_NEPBS0_PLR1_SU32_SUM0_SUS256_SVW1_SKXCCM8_ULSGRO1_VWA1_VWB1_WGM8_WGMXCC1_WGMXCCGn1
    SolutionIndex: 183
    SolutionNameMin: Cijk_Alik_Bljk_BSS_BH_UserArgs_MT64x128x64_MI16x16x1_SN_LDSB1_CLR1_GRVWA8_GRVWB8_GSU0_GSUC0_GSUWGMRR0_K1_LBSPPA128_LBSPPB128_LPA16_LPB16_LRVW8_MIWT2_4_NEPBS0_PLR1_SU32_SUM0_SUS256_SVW1_SKXCCM8_ULSGRO1_VWA1_VWB1_WGM4_WGMXCC1_WGMXCCGn1
    SolutionIndex: 184
    SolutionNameMin: Cijk_Alik_Bljk_BSS_BH_UserArgs_MT128x128x64_MI16x16x1_SN_LDSB1_CLR1_GRVWA8_GRVWB8_GSU0_GSUC0_GSUWGMRR0_K1_LBSPPA128_LBSPPB128_LPA16_LPB16_LRVW8_MIWT4_4_NEPBS0_PLR1_SU32_SUM0_SUS256_SVW1_SKXCCM8_ULSGRO0_VWA1_VWB1_WGM1_WGMXCC1_WGMXCCGn1
    SolutionIndex: 185
    SolutionNameMin: Cijk_Alik_Bljk_BSS_BH_UserArgs_MT128x128x64_MI16x16x1_SN_LDSB1_CLR1_GRVWA8_GRVWB8_GSU0_GSUC0_GSUWGMRR0_K1_LBSPPA512_LBSPPB512_LPA16_LPB16_LRVW8_MIWT4_4_NEPBS0_PLR2_SU32_SUM0_SUS256_SVW4_SKXCCM0_ULSGRO0_VWA4_VWB4_WGM4_WGMXCC1_WGMXCCGn1
    SolutionIndex: 186
    SolutionNameMin: Cijk_Alik_Bljk_BSS_BH_UserArgs_MT128x128x64_MI16x16x1_SN_LDSB1_CLR1_GRVWA8_GRVWB8_GSU0_GSUC0_GSUWGMRR0_K1_LBSPPA512_LBSPPB512_LPA16_LPB16_LRVW8_MIWT4_4_NEPBS16_PLR1_SU32_SUM0_SUS256_SVW4_SKXCCM8_ULSGRO1_VWA4_VWB4_WGM1_WGMXCC1_WGMXCCGn1
    SolutionIndex: 187
    SolutionNameMin: Cijk_Alik_Bljk_BSS_BH_UserArgs_MT128x128x64_MI16x16x1_SN_LDSB1_CLR1_GRVWA8_GRVWB8_GSU0_GSUC0_GSUWGMRR0_K1_LBSPPA128_LBSPPB128_LPA16_LPB16_LRVW8_MIWT4_4_NEPBS16_PLR1_SU32_SUM0_SUS256_SVW1_SKXCCM8_ULSGRO0_VWA1_VWB1_WGM1_WGMXCC1_WGMXCCGn1
    SolutionIndex: 188
    SolutionNameMin: Cijk_Alik_Bljk_BSS_BH_UserArgs_MT128x128x64_MI16x16x1_SN_LDSB1_CLR1_GRVWA8_GRVWB8_GSU0_GSUC0_GSUWGMRR0_K1_LBSPPA512_LBSPPB512_LPA16_LPB16_LRVW8_MIWT4_4_NEPBS16_PLR1_SU32_SUM0_SUS256_SVW4_SKXCCM0_ULSGRO0_VWA4_VWB4_WGM4_WGMXCC1_WGMXCCGn1
    SolutionIndex: 189
    SolutionNameMin: Cijk_Alik_Bljk_BSS_BH_UserArgs_MT128x128x64_MI16x16x1_SN_LDSB1_CLR1_GRVWA8_GRVWB8_GSU0_GSUC0_GSUWGMRR0_K1_LBSPPA512_LBSPPB512_LPA16_LPB16_LRVW8_MIWT4_4_NEPBS16_PLR1_SU32_SUM0_SUS256_SVW4_SKXCCM8_ULSGRO1_VWA4_VWB4_WGM4_WGMXCC1_WGMXCCGn1
    SolutionIndex: 190
    SolutionNameMin: Cijk_Alik_Bljk_BSS_BH_UserArgs_MT128x128x64_MI16x16x1_SN_LDSB1_CLR1_GRVWA8_GRVWB8_GSU0_GSUC0_GSUWGMRR0_K1_LBSPPA512_LBSPPB512_LPA16_LPB16_LRVW8_MIWT4_4_NEPBS0_PLR1_SU32_SUM0_SUS256_SVW4_SKXCCM8_ULSGRO1_VWA4_VWB4_WGM8_WGMXCC1_WGMXCCGn1
    SolutionIndex: 191
    SolutionNameMin: Cijk_Alik_Bljk_BSS_BH_UserArgs_MT128x128x64_MI16x16x1_SN_LDSB1_CLR1_GRVWA8_GRVWB8_GSU0_GSUC0_GSUWGMRR0_K1_LBSPPA128_LBSPPB256_LPA16_LPB16_LRVW8_MIWT4_4_NEPBS0_PLR1_SU32_SUM0_SUS256_SVW1_SKXCCM0_ULSGRO1_VWA1_VWB2_WGM1_WGMXCC1_WGMXCCGn1
    SolutionIndex: 192
    SolutionNameMin: Cijk_Alik_Bljk_BSS_BH_UserArgs_MT128x128x64_MI16x16x1_SN_LDSB1_CLR1_GRVWA8_GRVWB8_GSU0_GSUC0_GSUWGMRR0_K1_LBSPPA512_LBSPPB128_LPA16_LPB16_LRVW8_MIWT4_4_NEPBS0_PLR1_SU32_SUM0_SUS256_SVW4_SKXCCM8_ULSGRO0_VWA4_VWB1_WGM8_WGMXCC1_WGMXCCGn1
    SolutionIndex: 193
    SolutionNameMin: Cijk_Alik_Bljk_BSS_BH_UserArgs_MT128x128x64_MI16x16x1_SN_LDSB1_CLR1_GRVWA8_GRVWB8_GSU0_GSUC0_GSUWGMRR0_K1_LBSPPA512_LBSPPB512_LPA16_LPB16_LRVW8_MIWT4_4_NEPBS0_PLR1_SU32_SUM0_SUS256_SVW4_SKXCCM0_ULSGRO0_VWA4_VWB4_WGM1_WGMXCC1_WGMXCCGn1
    SolutionIndex: 194
    SolutionNameMin: Cijk_Alik_Bljk_BSS_BH_UserArgs_MT128x128x64_MI16x16x1_SN_LDSB1_CLR1_GRVWA8_GRVWB8_GSU0_GSUC0_GSUWGMRR0_K1_LBSPPA128_LBSPPB512_LPA16_LPB16_LRVW8_MIWT4_4_NEPBS0_PLR1_SU32_SUM0_SUS256_SVW1_SKXCCM8_ULSGRO0_VWA1_VWB4_WGM8_WGMXCC1_WGMXCCGn1
    SolutionIndex: 195
    SolutionNameMin: Cijk_Alik_Bljk_BSS_BH_UserArgs_MT128x128x64_MI16x16x1_SN_LDSB1_CLR1_GRVWA8_GRVWB8_GSU0_GSUC0_GSUWGMRR0_K1_LBSPPA512_LBSPPB512_LPA16_LPB16_LRVW8_MIWT4_4_NEPBS16_PLR1_SU32_SUM0_SUS256_SVW4_SKXCCM0_ULSGRO1_VWA4_VWB4_WGM4_WGMXCC1_WGMXCCGn1
    SolutionIndex: 196
    SolutionNameMin: Cijk_Alik_Bljk_BSS_BH_UserArgs_MT128x128x64_MI16x16x1_SN_LDSB1_CLR1_GRVWA8_GRVWB8_GSU0_GSUC0_GSUWGMRR0_K1_LBSPPA512_LBSPPB128_LPA16_LPB16_LRVW8_MIWT4_4_NEPBS0_PLR1_SU32_SUM0_SUS256_SVW4_SKXCCM0_ULSGRO0_VWA4_VWB1_WGM1_WGMXCC1_WGMXCCGn1
    SolutionIndex: 197
    SolutionNameMin: Cijk_Alik_Bljk_BSS_BH_UserArgs_MT128x128x64_MI16x16x1_SN_LDSB1_CLR1_GRVWA8_GRVWB8_GSU0_GSUC0_GSUWGMRR0_K1_LBSPPA256_LBSPPB256_LPA16_LPB16_LRVW8_MIWT4_4_NEPBS16_PLR1_SU32_SUM0_SUS256_SVW2_SKXCCM8_ULSGRO1_VWA2_VWB2_WGM8_WGMXCC1_WGMXCCGn1
- - - [1, 1, 1, 32]
    - [18, 0.0]
  - - [128, 128, 1, 128]
    - [7, 0.092]
  - - [128, 128, 1, 256]
    - [40, 0.111]
  - - [128, 128, 1, 512]
    - [9, 0.19]
  - - [128, 128, 1, 1024]
    - [39, 0.295]
  - - [128, 128, 1, 2048]
    - [35, 0.319]
  - - [128, 128, 1, 4096]
    - [10, 0.539]
  - - [128, 128, 1, 8192]
    - [3, 1.065]
  - - [128, 256, 1, 128]
    - [6, 0.184]
  - - [128, 256, 1, 256]
    - [17, 0.217]
  - - [128, 256, 1, 512]
    - [38, 0.377]
  - - [128, 256, 1, 1024]
    - [37, 0.521]
  - - [128, 256, 1, 2048]
    - [0, 0.855]
  - - [128, 256, 1, 4096]
    - [2, 1.614]
  - - [128, 256, 1, 8192]
    - [26, 3.036]
  - - [128, 512, 1, 128]
    - [7, 0.366]
  - - [128, 512, 1, 256]
    - [62, 0.424]
  - - [128, 512, 1, 512]
    - [37, 0.727]
  - - [128, 512, 1, 1024]
    - [49, 1.148]
  - - [128, 512, 1, 2048]
    - [63, 2.179]
  - - [128, 512, 1, 4096]
    - [48, 3.862]
  - - [128, 512, 1, 8192]
    - [26, 6.486]
  - - [128, 1024, 1, 128]
    - [15, 0.722]
  - - [128, 1024, 1, 256]
    - [7, 0.809]
  - - [128, 1024, 1, 512]
    - [60, 1.419]
  - - [128, 1024, 1, 1024]
    - [40, 2.504]
  - - [128, 1024, 1, 2048]
    - [3, 4.21]
  - - [128, 1024, 1, 4096]
    - [42, 6.955]
  - - [128, 1024, 1, 8192]
    - [39, 9.534]
  - - [128, 2048, 1, 128]
    - [17, 1.381]
  - - [128, 2048, 1, 256]
    - [8, 1.672]
  - - [128, 2048, 1, 512]
    - [63, 2.866]
  - - [128, 2048, 1, 1024]
    - [60, 4.711]
  - - [128, 2048, 1, 2048]
    - [24, 7.419]
  - - [128, 2048, 1, 4096]
    - [23, 10.765]
  - - [128, 2048, 1, 8192]
    - [47, 12.976]
  - - [128, 4096, 1, 128]
    - [57, 2.375]
  - - [128, 4096, 1, 256]
    - [14, 3.033]
  - - [128, 4096, 1, 512]
    - [56, 4.915]
  - - [128, 4096, 1, 1024]
    - [34, 7.941]
  - - [128, 4096, 1, 2048]
    - [21, 11.41]
  - - [128, 4096, 1, 4096]
    - [32, 14.408]
  - - [128, 4096, 1, 8192]
    - [1, 17.199]
  - - [128, 8192, 1, 128]
    - [51, 3.904]
  - - [128, 8192, 1, 256]
    - [4, 5.145]
  - - [128, 8192, 1, 512]
    - [54, 8.395]
  - - [128, 8192, 1, 1024]
    - [31, 12.462]
  - - [128, 8192, 1, 2048]
    - [27, 15.221]
  - - [128, 8192, 1, 4096]
    - [45, 18.595]
  - - [128, 8192, 1, 8192]
    - [11, 22.681]
  - - [256, 128, 1, 128]
    - [6, 0.182]
  - - [256, 128, 1, 256]
    - [7, 0.22]
  - - [256, 128, 1, 512]
    - [42, 0.373]
  - - [256, 128, 1, 1024]
    - [37, 0.509]
  - - [256, 128, 1, 2048]
    - [0, 0.858]
  - - [256, 128, 1, 4096]
    - [2, 1.633]
  - - [256, 128, 1, 8192]
    - [26, 3.039]
  - - [256, 256, 1, 128]
    - [16, 0.362]
  - - [256, 256, 1, 256]
    - [38, 0.422]
  - - [256, 256, 1, 512]
    - [38, 0.703]
  - - [256, 256, 1, 1024]
    - [25, 1.152]
  - - [256, 256, 1, 2048]
    - [38, 2.202]
  - - [256, 256, 1, 4096]
    - [62, 3.846]
  - - [256, 256, 1, 8192]
    - [50, 6.347]
  - - [256, 512, 1, 128]
    - [37, 0.695]
  - - [256, 512, 1, 256]
    - [59, 0.814]
  - - [256, 512, 1, 512]
    - [38, 1.422]
  - - [256, 512, 1, 1024]
    - [61, 2.54]
  - - [256, 512, 1, 2048]
    - [61, 4.3]
  - - [256, 512, 1, 4096]
    - [38, 7.13]
  - - [256, 512, 1, 8192]
    - [64, 9.259]
  - - [256, 1024, 1, 128]
    - [60, 1.371]
  - - [256, 1024, 1, 256]
    - [15, 1.682]
  - - [256, 1024, 1, 512]
    - [62, 2.841]
  - - [256, 1024, 1, 1024]
    - [6, 4.652]
  - - [256, 1024, 1, 2048]
    - [41, 7.413]
  - - [256, 1024, 1, 4096]
    - [36, 10.841]
  - - [256, 1024, 1, 8192]
    - [21, 13.02]
  - - [256, 2048, 1, 128]
    - [12, 2.453]
  - - [256, 2048, 1, 256]
    - [5, 3.008]
  - - [256, 2048, 1, 512]
    - [58, 4.894]
  - - [256, 2048, 1, 1024]
    - [13, 7.793]
  - - [256, 2048, 1, 2048]
    - [55, 11.394]
  - - [256, 2048, 1, 4096]
    - [22, 14.673]
  - - [256, 2048, 1, 8192]
    - [33, 17.296]
  - - [256, 4096, 1, 128]
    - [53, 3.866]
  - - [256, 4096, 1, 256]
    - [30, 5.178]
  - - [256, 4096, 1, 512]
    - [29, 8.388]
  - - [256, 4096, 1, 1024]
    - [31, 12.497]
  - - [256, 4096, 1, 2048]
    - [28, 16.075]
  - - [256, 4096, 1, 4096]
    - [46, 19.101]
  - - [256, 4096, 1, 8192]
    - [43, 22.274]
  - - [256, 8192, 1, 128]
    - [52, 4.804]
  - - [256, 8192, 1, 256]
    - [27, 6.883]
  - - [256, 8192, 1, 512]
    - [45, 11.226]
  - - [256, 8192, 1, 1024]
    - [44, 15.198]
  - - [256, 8192, 1, 2048]
    - [45, 18.905]
  - - [256, 8192, 1, 4096]
    - [20, 24.11]
  - - [256, 8192, 1, 8192]
    - [19, 27.869]
  - - [512, 128, 1, 128]
    - [15, 0.365]
  - - [512, 128, 1, 256]
    - [15, 0.426]
  - - [512, 128, 1, 512]
    - [39, 0.704]
  - - [512, 128, 1, 1024]
    - [48, 1.172]
  - - [512, 128, 1, 2048]
    - [37, 2.221]
  - - [512, 128, 1, 4096]
    - [59, 3.793]
  - - [512, 128, 1, 8192]
    - [65, 6.382]
  - - [512, 256, 1, 128]
    - [7, 0.718]
  - - [512, 256, 1, 256]
    - [66, 0.807]
  - - [512, 256, 1, 512]
    - [67, 1.423]
  - - [512, 256, 1, 1024]
    - [6, 2.502]
  - - [512, 256, 1, 2048]
    - [48, 4.292]
  - - [512, 256, 1, 4096]
    - [68, 6.78]
  - - [512, 256, 1, 8192]
    - [69, 9.341]
  - - [512, 512, 1, 128]
    - [62, 1.376]
  - - [512, 512, 1, 256]
    - [16, 1.706]
  - - [512, 512, 1, 512]
    - [59, 2.842]
  - - [512, 512, 1, 1024]
    - [59, 4.693]
  - - [512, 512, 1, 2048]
    - [70, 7.412]
  - - [512, 512, 1, 4096]
    - [71, 10.615]
  - - [512, 512, 1, 8192]
    - [47, 12.987]
  - - [512, 1024, 1, 128]
    - [72, 2.446]
  - - [512, 1024, 1, 256]
    - [73, 2.963]
  - - [512, 1024, 1, 512]
    - [74, 4.991]
  - - [512, 1024, 1, 1024]
    - [74, 7.979]
  - - [512, 1024, 1, 2048]
    - [75, 11.328]
  - - [512, 1024, 1, 4096]
    - [76, 14.457]
  - - [512, 1024, 1, 8192]
    - [77, 17.595]
  - - [512, 2048, 1, 128]
    - [78, 3.891]
  - - [512, 2048, 1, 256]
    - [79, 5.081]
  - - [512, 2048, 1, 512]
    - [30, 8.19]
  - - [512, 2048, 1, 1024]
    - [80, 12.483]
  - - [512, 2048, 1, 2048]
    - [81, 16.025]
  - - [512, 2048, 1, 4096]
    - [46, 18.856]
  - - [512, 2048, 1, 8192]
    - [82, 22.397]
  - - [512, 4096, 1, 128]
    - [83, 5.1]
  - - [512, 4096, 1, 256]
    - [84, 6.762]
  - - [512, 4096, 1, 512]
    - [85, 11.145]
  - - [512, 4096, 1, 1024]
    - [86, 15.701]
  - - [512, 4096, 1, 2048]
    - [87, 19.205]
  - - [512, 4096, 1, 4096]
    - [88, 24.279]
  - - [512, 4096, 1, 8192]
    - [19, 27.106]
  - - [512, 8192, 1, 128]
    - [89, 6.066]
  - - [512, 8192, 1, 256]
    - [90, 8.469]
  - - [512, 8192, 1, 512]
    - [44, 13.795]
  - - [512, 8192, 1, 1024]
    - [91, 18.247]
  - - [512, 8192, 1, 2048]
    - [92, 23.214]
  - - [512, 8192, 1, 4096]
    - [88, 28.127]
  - - [512, 8192, 1, 8192]
    - [93, 26.942]
  - - [1024, 128, 1, 128]
    - [16, 0.721]
  - - [1024, 128, 1, 256]
    - [62, 0.813]
  - - [1024, 128, 1, 512]
    - [38, 1.428]
  - - [1024, 128, 1, 1024]
    - [17, 2.5]
  - - [1024, 128, 1, 2048]
    - [26, 4.297]
  - - [1024, 128, 1, 4096]
    - [94, 7.029]
  - - [1024, 128, 1, 8192]
    - [95, 9.283]
  - - [1024, 256, 1, 128]
    - [7, 1.383]
  - - [1024, 256, 1, 256]
    - [7, 1.694]
  - - [1024, 256, 1, 512]
    - [38, 2.803]
  - - [1024, 256, 1, 1024]
    - [16, 4.68]
  - - [1024, 256, 1, 2048]
    - [96, 7.304]
  - - [1024, 256, 1, 4096]
    - [97, 10.468]
  - - [1024, 256, 1, 8192]
    - [47, 13.132]
  - - [1024, 512, 1, 128]
    - [72, 2.445]
  - - [1024, 512, 1, 256]
    - [5, 3.045]
  - - [1024, 512, 1, 512]
    - [36, 4.956]
  - - [1024, 512, 1, 1024]
    - [56, 7.968]
  - - [1024, 512, 1, 2048]
    - [98, 11.188]
  - - [1024, 512, 1, 4096]
    - [99, 14.413]
  - - [1024, 512, 1, 8192]
    - [100, 17.346]
  - - [1024, 1024, 1, 128]
    - [83, 3.963]
  - - [1024, 1024, 1, 256]
    - [101, 4.959]
  - - [1024, 1024, 1, 512]
    - [101, 8.299]
  - - [1024, 1024, 1, 1024]
    - [31, 12.35]
  - - [1024, 1024, 1, 2048]
    - [102, 15.774]
  - - [1024, 1024, 1, 4096]
    - [46, 19.05]
  - - [1024, 1024, 1, 8192]
    - [103, 22.208]
  - - [1024, 2048, 1, 128]
    - [104, 5.045]
  - - [1024, 2048, 1, 256]
    - [53, 6.751]
  - - [1024, 2048, 1, 512]
    - [105, 11.067]
  - - [1024, 2048, 1, 1024]
    - [106, 14.989]
  - - [1024, 2048, 1, 2048]
    - [106, 19.113]
  - - [1024, 2048, 1, 4096]
    - [20, 24.461]
  - - [1024, 2048, 1, 8192]
    - [20, 27.959]
  - - [1024, 4096, 1, 128]
    - [107, 5.962]
  - - [1024, 4096, 1, 256]
    - [108, 8.554]
  - - [1024, 4096, 1, 512]
    - [109, 13.858]
  - - [1024, 4096, 1, 1024]
    - [110, 17.642]
  - - [1024, 4096, 1, 2048]
    - [111, 23.466]
  - - [1024, 4096, 1, 4096]
    - [112, 28.3]
  - - [1024, 4096, 1, 8192]
    - [113, 26.268]
  - - [1024, 8192, 1, 128]
    - [114, 6.78]
  - - [1024, 8192, 1, 256]
    - [115, 10.784]
  - - [1024, 8192, 1, 512]
    - [82, 16.214]
  - - [1024, 8192, 1, 1024]
    - [116, 21.656]
  - - [1024, 8192, 1, 2048]
    - [117, 27.707]
  - - [1024, 8192, 1, 4096]
    - [118, 29.207]
  - - [1024, 8192, 1, 8192]
    - [119, 28.994]
  - - [2048, 128, 1, 128]
    - [6, 1.363]
  - - [2048, 128, 1, 256]
    - [39, 1.694]
  - - [2048, 128, 1, 512]
    - [16, 2.777]
  - - [2048, 128, 1, 1024]
    - [6, 4.641]
  - - [2048, 128, 1, 2048]
    - [70, 7.4]
  - - [2048, 128, 1, 4096]
    - [120, 10.393]
  - - [2048, 128, 1, 8192]
    - [121, 12.364]
  - - [2048, 256, 1, 128]
    - [122, 2.395]
  - - [2048, 256, 1, 256]
    - [123, 3.043]
  - - [2048, 256, 1, 512]
    - [124, 5.02]
  - - [2048, 256, 1, 1024]
    - [24, 7.899]
  - - [2048, 256, 1, 2048]
    - [125, 11.219]
  - - [2048, 256, 1, 4096]
    - [126, 14.454]
  - - [2048, 256, 1, 8192]
    - [127, 16.507]
  - - [2048, 512, 1, 128]
    - [83, 3.861]
  - - [2048, 512, 1, 256]
    - [29, 5.238]
  - - [2048, 512, 1, 512]
    - [52, 8.428]
  - - [2048, 512, 1, 1024]
    - [128, 12.144]
  - - [2048, 512, 1, 2048]
    - [129, 15.687]
  - - [2048, 512, 1, 4096]
    - [130, 18.921]
  - - [2048, 512, 1, 8192]
    - [103, 22.14]
  - - [2048, 1024, 1, 128]
    - [28, 5.034]
  - - [2048, 1024, 1, 256]
    - [131, 6.868]
  - - [2048, 1024, 1, 512]
    - [132, 10.68]
  - - [2048, 1024, 1, 1024]
    - [133, 15.209]
  - - [2048, 1024, 1, 2048]
    - [134, 18.881]
  - - [2048, 1024, 1, 4096]
    - [20, 24.361]
  - - [2048, 1024, 1, 8192]
    - [117, 27.393]
  - - [2048, 2048, 1, 128]
    - [135, 5.904]
  - - [2048, 2048, 1, 256]
    - [136, 8.566]
  - - [2048, 2048, 1, 512]
    - [85, 13.319]
  - - [2048, 2048, 1, 1024]
    - [137, 17.731]
  - - [2048, 2048, 1, 2048]
    - [117, 23.584]
  - - [2048, 2048, 1, 4096]
    - [111, 30.504]
  - - [2048, 2048, 1, 8192]
    - [113, 28.977]
  - - [2048, 4096, 1, 128]
    - [138, 6.769]
  - - [2048, 4096, 1, 256]
    - [139, 10.728]
  - - [2048, 4096, 1, 512]
    - [112, 16.011]
  - - [2048, 4096, 1, 1024]
    - [140, 21.83]
  - - [2048, 4096, 1, 2048]
    - [141, 27.513]
  - - [2048, 4096, 1, 4096]
    - [142, 29.172]
  - - [2048, 4096, 1, 8192]
    - [118, 29.48]
  - - [2048, 8192, 1, 128]
    - [1, 7.68]
  - - [2048, 8192, 1, 256]
    - [109, 12.471]
  - - [2048, 8192, 1, 512]
    - [143, 18.132]
  - - [2048, 8192, 1, 1024]
    - [144, 24.368]
  - - [2048, 8192, 1, 2048]
    - [145, 28.353]
  - - [2048, 8192, 1, 4096]
    - [146, 32.122]
  - - [2048, 8192, 1, 8192]
    - [147, 34.091]
  - - [4096, 128, 1, 128]
    - [148, 2.404]
  - - [4096, 128, 1, 256]
    - [149, 3.035]
  - - [4096, 128, 1, 512]
    - [150, 4.771]
  - - [4096, 128, 1, 1024]
    - [74, 7.969]
  - - [4096, 128, 1, 2048]
    - [151, 11.184]
  - - [4096, 128, 1, 4096]
    - [152, 14.105]
  - - [4096, 128, 1, 8192]
    - [153, 17.039]
  - - [4096, 256, 1, 128]
    - [104, 3.91]
  - - [4096, 256, 1, 256]
    - [154, 5.16]
  - - [4096, 256, 1, 512]
    - [29, 8.288]
  - - [4096, 256, 1, 1024]
    - [155, 12.309]
  - - [4096, 256, 1, 2048]
    - [156, 15.861]
  - - [4096, 256, 1, 4096]
    - [157, 18.492]
  - - [4096, 256, 1, 8192]
    - [117, 22.3]
  - - [4096, 512, 1, 128]
    - [158, 5.073]
  - - [4096, 512, 1, 256]
    - [101, 6.919]
  - - [4096, 512, 1, 512]
    - [159, 10.906]
  - - [4096, 512, 1, 1024]
    - [160, 15.321]
  - - [4096, 512, 1, 2048]
    - [161, 19.26]
  - - [4096, 512, 1, 4096]
    - [117, 23.307]
  - - [4096, 512, 1, 8192]
    - [162, 28.292]
  - - [4096, 1024, 1, 128]
    - [79, 5.671]
  - - [4096, 1024, 1, 256]
    - [163, 8.439]
  - - [4096, 1024, 1, 512]
    - [106, 13.477]
  - - [4096, 1024, 1, 1024]
    - [164, 17.686]
  - - [4096, 1024, 1, 2048]
    - [143, 23.074]
  - - [4096, 1024, 1, 4096]
    - [165, 29.91]
  - - [4096, 1024, 1, 8192]
    - [166, 29.38]
  - - [4096, 2048, 1, 128]
    - [167, 6.682]
  - - [4096, 2048, 1, 256]
    - [168, 10.422]
  - - [4096, 2048, 1, 512]
    - [143, 15.945]
  - - [4096, 2048, 1, 1024]
    - [140, 22.062]
  - - [4096, 2048, 1, 2048]
    - [168, 27.157]
  - - [4096, 2048, 1, 4096]
    - [20, 29.579]
  - - [4096, 2048, 1, 8192]
    - [169, 30.14]
  - - [4096, 4096, 1, 128]
    - [170, 7.588]
  - - [4096, 4096, 1, 256]
    - [168, 11.883]
  - - [4096, 4096, 1, 512]
    - [140, 18.107]
  - - [4096, 4096, 1, 1024]
    - [143, 24.976]
  - - [4096, 4096, 1, 2048]
    - [146, 28.296]
  - - [4096, 4096, 1, 4096]
    - [20, 32.152]
  - - [4096, 4096, 1, 8192]
    - [171, 35.591]
  - - [4096, 8192, 1, 128]
    - [169, 8.404]
  - - [4096, 8192, 1, 256]
    - [172, 12.517]
  - - [4096, 8192, 1, 512]
    - [43, 18.736]
  - - [4096, 8192, 1, 1024]
    - [143, 24.287]
  - - [4096, 8192, 1, 2048]
    - [173, 28.875]
  - - [4096, 8192, 1, 4096]
    - [174, 33.637]
  - - [4096, 8192, 1, 8192]
    - [88, 35.814]
  - - [8192, 128, 1, 128]
    - [175, 3.728]
  - - [8192, 128, 1, 256]
    - [101, 5.073]
  - - [8192, 128, 1, 512]
    - [176, 8.099]
  - - [8192, 128, 1, 1024]
    - [177, 11.995]
  - - [8192, 128, 1, 2048]
    - [178, 14.981]
  - - [8192, 128, 1, 4096]
    - [179, 18.311]
  - - [8192, 128, 1, 8192]
    - [180, 22.531]
  - - [8192, 256, 1, 128]
    - [181, 4.843]
  - - [8192, 256, 1, 256]
    - [27, 6.712]
  - - [8192, 256, 1, 512]
    - [159, 10.608]
  - - [8192, 256, 1, 1024]
    - [182, 14.773]
  - - [8192, 256, 1, 2048]
    - [183, 18.788]
  - - [8192, 256, 1, 4096]
    - [111, 23.471]
  - - [8192, 256, 1, 8192]
    - [184, 27.093]
  - - [8192, 512, 1, 128]
    - [185, 5.675]
  - - [8192, 512, 1, 256]
    - [108, 8.215]
  - - [8192, 512, 1, 512]
    - [160, 13.321]
  - - [8192, 512, 1, 1024]
    - [140, 17.851]
  - - [8192, 512, 1, 2048]
    - [186, 23.017]
  - - [8192, 512, 1, 4096]
    - [116, 29.034]
  - - [8192, 512, 1, 8192]
    - [187, 29.927]
  - - [8192, 1024, 1, 128]
    - [188, 6.704]
  - - [8192, 1024, 1, 256]
    - [145, 10.5]
  - - [8192, 1024, 1, 512]
    - [146, 15.928]
  - - [8192, 1024, 1, 1024]
    - [189, 22.18]
  - - [8192, 1024, 1, 2048]
    - [137, 27.471]
  - - [8192, 1024, 1, 4096]
    - [190, 29.113]
  - - [8192, 1024, 1, 8192]
    - [191, 30.93]
  - - [8192, 2048, 1, 128]
    - [167, 7.65]
  - - [8192, 2048, 1, 256]
    - [146, 12.158]
  - - [8192, 2048, 1, 512]
    - [146, 17.922]
  - - [8192, 2048, 1, 1024]
    - [190, 24.489]
  - - [8192, 2048, 1, 2048]
    - [146, 28.702]
  - - [8192, 2048, 1, 4096]
    - [143, 32.114]
  - - [8192, 2048, 1, 8192]
    - [192, 35.528]
  - - [8192, 4096, 1, 128]
    - [193, 8.664]
  - - [8192, 4096, 1, 256]
    - [190, 12.934]
  - - [8192, 4096, 1, 512]
    - [145, 18.774]
  - - [8192, 4096, 1, 1024]
    - [142, 24.229]
  - - [8192, 4096, 1, 2048]
    - [142, 28.694]
  - - [8192, 4096, 1, 4096]
    - [194, 33.929]
  - - [8192, 4096, 1, 8192]
    - [171, 35.849]
  - - [8192, 8192, 1, 128]
    - [195, 7.221]
  - - [8192, 8192, 1, 256]
    - [196, 11.626]
  - - [8192, 8192, 1, 512]
    - [137, 18.458]
  - - [8192, 8192, 1, 1024]
    - [190, 24.453]
  - - [8192, 8192, 1, 2048]
    - [88, 30.408]
  - - [8192, 8192, 1, 4096]
    - [197, 35.145]
  - - [8192, 8192, 1, 8192]
    - [171, 37.579]
- null
- null
- DeviceEfficiency
- GridBased
