library/src/amd_detail/rocblaslt/src/Tensile/Logic/streamk/gfx942/aquavanjaram942_Cijk_Alik_Bjlk_BSS_BH_UserArgs.yaml
- {MinimumRequiredVersion: 4.33.0}
- aquavanjaram942
- gfx942
- [Device 0049, Device 0050]
    SolutionIndex: 0
    SolutionNameMin: Cijk_Alik_Bjlk_BSS_BH_UserArgs_MT128x256x32_MI16x16x1_SN_LDSB1_CLR1_GSU0_GSUC0_GSUWGMRR0_K1_LBSPPA256_LBSPPB2048_LPB0_MIWT4_8_PLR1_SU32_SUM0_SUS256_SKXCCM0_VWA4_VWB8_WGM4_WGMXCC1_WGMXCCGn1
    SolutionIndex: 1
    SolutionNameMin: Cijk_Alik_Bjlk_BSS_BH_UserArgs_MT32x32x32_MI16x16x1_SN_LDSB0_CLR1_GSU0_GSUC0_GSUWGMRR0_K1_LBSPPA128_LBSPPB256_LPB16_MIWT1_1_PLR1_SU32_SUM0_SUS256_SKXCCM0_VWA1_VWB1_WGM1_WGMXCC1_WGMXCCGn1
    SolutionIndex: 2
    SolutionNameMin: Cijk_Alik_Bjlk_BSS_BH_UserArgs_MT128x256x64_MI16x16x1_SN_LDSB1_CLR1_GSU0_GSUC0_GSUWGMRR0_K1_LBSPPA512_LBSPPB4096_LPB32_MIWT4_8_PLR1_SU32_SUM0_SUS256_SKXCCM0_VWA4_VWB2_WGM4_WGMXCC1_WGMXCCGn1
    SolutionIndex: 3
    SolutionNameMin: Cijk_Alik_Bjlk_BSS_BH_UserArgs_MT128x256x64_MI16x16x1_SN_LDSB1_CLR1_GSU0_GSUC0_GSUWGMRR0_K1_LBSPPA512_LBSPPB4096_LPB32_MIWT4_8_PLR1_SU32_SUM0_SUS256_SKXCCM0_VWA4_VWB2_WGM8_WGMXCC1_WGMXCCGn1
    SolutionIndex: 4
    SolutionNameMin: Cijk_Alik_Bjlk_BSS_BH_UserArgs_MT128x256x64_MI16x16x1_SN_LDSB1_CLR1_GSU0_GSUC0_GSUWGMRR0_K1_LBSPPA128_LBSPPB4096_LPB0_MIWT4_8_PLR2_SU32_SUM0_SUS256_SKXCCM0_VWA1_VWB8_WGM8_WGMXCC1_WGMXCCGn1
    SolutionIndex: 5
    SolutionNameMin: Cijk_Alik_Bjlk_BSS_BH_UserArgs_MT256x128x64_MI16x16x1_SN_LDSB1_CLR1_GSU0_GSUC0_GSUWGMRR0_K1_LBSPPA512_LBSPPB2048_LPB0_MIWT8_4_PLR1_SU32_SUM0_SUS256_SKXCCM0_VWA4_VWB4_WGM1_WGMXCC1_WGMXCCGn1
    SolutionIndex: 6
    SolutionNameMin: Cijk_Alik_Bjlk_BSS_BH_UserArgs_MT256x128x64_MI16x16x1_SN_LDSB1_CLR1_GSU0_GSUC0_GSUWGMRR0_K1_LBSPPA512_LBSPPB2048_LPB0_MIWT8_4_PLR1_SU32_SUM0_SUS256_SKXCCM0_VWA4_VWB4_WGM4_WGMXCC1_WGMXCCGn1
    SolutionIndex: 7
    SolutionNameMin: Cijk_Alik_Bjlk_BSS_BH_UserArgs_MT256x128x64_MI16x16x1_SN_LDSB1_CLR1_GSU0_GSUC0_GSUWGMRR0_K1_LBSPPA512_LBSPPB2048_LPB0_MIWT8_4_PLR1_SU32_SUM0_SUS256_SKXCCM0_VWA4_VWB4_WGM8_WGMXCC1_WGMXCCGn1
    SolutionIndex: 8
    SolutionNameMin: Cijk_Alik_Bjlk_BSS_BH_UserArgs_MT128x128x64_MI16x16x1_SN_LDSB1_CLR1_GSU0_GSUC0_GSUWGMRR0_K1_LBSPPA256_LBSPPB2048_LPB0_MIWT4_4_PLR1_SU32_SUM0_SUS256_SKXCCM0_VWA2_VWB4_WGM1_WGMXCC1_WGMXCCGn1
    SolutionIndex: 9
    SolutionNameMin: Cijk_Alik_Bjlk_BSS_BH_UserArgs_MT128x128x64_MI16x16x1_SN_LDSB1_CLR1_GSU0_GSUC0_GSUWGMRR0_K1_LBSPPA512_LBSPPB2048_LPB0_MIWT4_4_PLR1_SU32_SUM0_SUS256_SKXCCM0_VWA4_VWB4_WGM1_WGMXCC1_WGMXCCGn1
    SolutionIndex: 10
    SolutionNameMin: Cijk_Alik_Bjlk_BSS_BH_UserArgs_MT128x128x64_MI16x16x1_SN_LDSB1_CLR1_GSU0_GSUC0_GSUWGMRR0_K1_LBSPPA512_LBSPPB2048_LPB0_MIWT4_4_PLR1_SU32_SUM0_SUS256_SKXCCM0_VWA4_VWB4_WGM4_WGMXCC1_WGMXCCGn1
    SolutionIndex: 11
    SolutionNameMin: Cijk_Alik_Bjlk_BSS_BH_UserArgs_MT128x128x64_MI16x16x1_SN_LDSB1_CLR1_GSU0_GSUC0_GSUWGMRR0_K1_LBSPPA512_LBSPPB2048_LPB0_MIWT4_4_PLR1_SU32_SUM0_SUS256_SKXCCM0_VWA4_VWB4_WGM8_WGMXCC1_WGMXCCGn1
    SolutionIndex: 12
    SolutionNameMin: Cijk_Alik_Bjlk_BSS_BH_UserArgs_MT64x128x64_MI16x16x1_SN_LDSB1_CLR1_GSU0_GSUC0_GSUWGMRR0_K1_LBSPPA256_LBSPPB2048_LPB0_MIWT2_4_PLR1_SU32_SUM0_SUS256_SKXCCM0_VWA2_VWB4_WGM1_WGMXCC1_WGMXCCGn1
    SolutionIndex: 13
    SolutionNameMin: Cijk_Alik_Bjlk_BSS_BH_UserArgs_MT128x64x64_MI16x16x1_SN_LDSB1_CLR1_GSU0_GSUC0_GSUWGMRR0_K1_LBSPPA512_LBSPPB1024_LPB32_MIWT4_2_PLR1_SU32_SUM0_SUS256_SKXCCM0_VWA4_VWB2_WGM1_WGMXCC1_WGMXCCGn1
    SolutionIndex: 14
    SolutionNameMin: Cijk_Alik_Bjlk_BSS_BH_UserArgs_MT64x64x64_MI16x16x1_SN_LDSB1_CLR1_GSU0_GSUC0_GSUWGMRR0_K1_LBSPPA128_LBSPPB1024_LPB32_MIWT2_2_PLR1_SU32_SUM0_SUS256_SKXCCM0_VWA1_VWB2_WGM8_WGMXCC1_WGMXCCGn1
    SolutionIndex: 15
    SolutionNameMin: Cijk_Alik_Bjlk_BSS_BH_UserArgs_MT32x32x64_MI16x16x1_SN_LDSB0_CLR1_GSU0_GSUC0_GSUWGMRR0_K1_LBSPPA128_LBSPPB512_LPB16_MIWT1_1_PLR1_SU32_SUM0_SUS256_SKXCCM0_VWA1_VWB1_WGM1_WGMXCC1_WGMXCCGn1
    SolutionIndex: 16
    SolutionNameMin: Cijk_Alik_Bjlk_BSS_BH_UserArgs_MT32x32x64_MI16x16x1_SN_LDSB0_CLR1_GSU0_GSUC0_GSUWGMRR0_K1_LBSPPA128_LBSPPB512_LPB16_MIWT1_1_PLR2_SU32_SUM0_SUS256_SKXCCM0_VWA1_VWB1_WGM1_WGMXCC1_WGMXCCGn1
    SolutionIndex: 17
    SolutionNameMin: Cijk_Alik_Bjlk_BSS_BH_UserArgs_MT64x128x128_MI16x16x1_SN_LDSB1_CLR1_GSU0_GSUC0_GSUWGMRR0_K1_LBSPPA256_LBSPPB2048_LPB0_MIWT2_4_PLR1_SU32_SUM0_SUS256_SKXCCM0_VWA1_VWB4_WGM1_WGMXCC1_WGMXCCGn1
    SolutionIndex: 18
    SolutionNameMin: Cijk_Alik_Bjlk_BSS_BH_UserArgs_MT64x128x128_MI16x16x1_SN_LDSB1_CLR1_GSU0_GSUC0_GSUWGMRR0_K1_LBSPPA256_LBSPPB2048_LPB0_MIWT2_4_PLR2_SU32_SUM0_SUS256_SKXCCM0_VWA1_VWB4_WGM1_WGMXCC1_WGMXCCGn1
    SolutionIndex: 19
    SolutionNameMin: Cijk_Alik_Bjlk_BSS_BH_UserArgs_MT64x128x128_MI16x16x1_SN_LDSB1_CLR1_GSU0_GSUC0_GSUWGMRR0_K1_LBSPPA256_LBSPPB2048_LPB32_MIWT2_4_PLR2_SU32_SUM0_SUS256_SKXCCM0_VWA1_VWB2_WGM4_WGMXCC1_WGMXCCGn1
    SolutionIndex: 20
    SolutionNameMin: Cijk_Alik_Bjlk_BSS_BH_UserArgs_MT64x128x128_MI16x16x1_SN_LDSB1_CLR1_GSU0_GSUC0_GSUWGMRR0_K1_LBSPPA256_LBSPPB2048_LPB0_MIWT2_4_PLR2_SU32_SUM0_SUS256_SKXCCM0_VWA1_VWB4_WGM8_WGMXCC1_WGMXCCGn1
    SolutionIndex: 21
    SolutionNameMin: Cijk_Alik_Bjlk_BSS_BH_UserArgs_MT128x64x128_MI16x16x1_SN_LDSB1_CLR1_GSU0_GSUC0_GSUWGMRR0_K1_LBSPPA1024_LBSPPB1024_LPB16_MIWT4_2_PLR2_SU32_SUM0_SUS256_SKXCCM0_VWA4_VWB1_WGM1_WGMXCC1_WGMXCCGn1
    SolutionIndex: 22
    SolutionNameMin: Cijk_Alik_Bjlk_BSS_BH_UserArgs_MT128x64x128_MI16x16x1_SN_LDSB1_CLR1_GSU0_GSUC0_GSUWGMRR0_K1_LBSPPA1024_LBSPPB1024_LPB32_MIWT4_2_PLR2_SU32_SUM0_SUS256_SKXCCM0_VWA4_VWB2_WGM1_WGMXCC1_WGMXCCGn1
    SolutionIndex: 23
    SolutionNameMin: Cijk_Alik_Bjlk_BSS_BH_UserArgs_MT128x64x128_MI16x16x1_SN_LDSB1_CLR1_GSU0_GSUC0_GSUWGMRR0_K1_LBSPPA1024_LBSPPB1024_LPB32_MIWT4_2_PLR1_SU32_SUM0_SUS256_SKXCCM0_VWA4_VWB2_WGM4_WGMXCC1_WGMXCCGn1
    SolutionIndex: 24
    SolutionNameMin: Cijk_Alik_Bjlk_BSS_BH_UserArgs_MT128x64x128_MI16x16x1_SN_LDSB1_CLR1_GSU0_GSUC0_GSUWGMRR0_K1_LBSPPA1024_LBSPPB1024_LPB32_MIWT4_2_PLR2_SU32_SUM0_SUS256_SKXCCM0_VWA4_VWB2_WGM4_WGMXCC1_WGMXCCGn1
    SolutionIndex: 25
    SolutionNameMin: Cijk_Alik_Bjlk_BSS_BH_UserArgs_MT128x64x128_MI16x16x1_SN_LDSB1_CLR1_GSU0_GSUC0_GSUWGMRR0_K1_LBSPPA1024_LBSPPB1024_LPB32_MIWT4_2_PLR1_SU32_SUM0_SUS256_SKXCCM0_VWA4_VWB2_WGM8_WGMXCC1_WGMXCCGn1
    SolutionIndex: 26
    SolutionNameMin: Cijk_Alik_Bjlk_BSS_BH_UserArgs_MT128x64x128_MI16x16x1_SN_LDSB1_CLR1_GSU0_GSUC0_GSUWGMRR0_K1_LBSPPA512_LBSPPB1024_LPB32_MIWT4_2_PLR2_SU32_SUM0_SUS256_SKXCCM0_VWA2_VWB2_WGM8_WGMXCC1_WGMXCCGn1
    SolutionIndex: 27
    SolutionNameMin: Cijk_Alik_Bjlk_BSS_BH_UserArgs_MT128x64x128_MI16x16x1_SN_LDSB1_CLR1_GSU0_GSUC0_GSUWGMRR0_K1_LBSPPA1024_LBSPPB1024_LPB32_MIWT4_2_PLR2_SU32_SUM0_SUS256_SKXCCM0_VWA4_VWB2_WGM8_WGMXCC1_WGMXCCGn1
    SolutionIndex: 28
    SolutionNameMin: Cijk_Alik_Bjlk_BSS_BH_UserArgs_MT128x32x128_MI16x16x1_SN_LDSB1_CLR1_GSU0_GSUC0_GSUWGMRR0_K1_LBSPPA1024_LBSPPB512_LPB16_MIWT4_1_PLR2_SU32_SUM0_SUS256_SKXCCM0_VWA4_VWB1_WGM1_WGMXCC1_WGMXCCGn1
    SolutionIndex: 29
    SolutionNameMin: Cijk_Alik_Bjlk_BSS_BH_UserArgs_MT64x64x128_MI16x16x1_SN_LDSB1_CLR1_GSU0_GSUC0_GSUWGMRR0_K1_LBSPPA256_LBSPPB1024_LPB32_MIWT2_2_PLR2_SU32_SUM0_SUS256_SKXCCM0_VWA1_VWB2_WGM4_WGMXCC1_WGMXCCGn1
    SolutionIndex: 30
    SolutionNameMin: Cijk_Alik_Bjlk_BSS_BH_UserArgs_MT64x64x128_MI16x16x1_SN_LDSB1_CLR1_GSU0_GSUC0_GSUWGMRR0_K1_LBSPPA256_LBSPPB1024_LPB32_MIWT2_2_PLR2_SU32_SUM0_SUS256_SKXCCM0_VWA1_VWB2_WGM8_WGMXCC1_WGMXCCGn1
    SolutionIndex: 31
    SolutionNameMin: Cijk_Alik_Bjlk_BSS_BH_UserArgs_MT32x64x128_MI16x16x1_SN_LDSB1_CLR1_GSU0_GSUC0_GSUWGMRR0_K1_LBSPPA256_LBSPPB1024_LPB32_MIWT1_2_PLR2_SU32_SUM0_SUS256_SKXCCM0_VWA1_VWB2_WGM1_WGMXCC1_WGMXCCGn1
    SolutionIndex: 32
    SolutionNameMin: Cijk_Alik_Bjlk_BSS_BH_UserArgs_MT32x32x128_MI16x16x1_SN_LDSB1_CLR1_GSU0_GSUC0_GSUWGMRR0_K1_LBSPPA256_LBSPPB512_LPB16_MIWT1_1_PLR1_SU32_SUM0_SUS256_SKXCCM0_VWA1_VWB1_WGM1_WGMXCC1_WGMXCCGn1
    SolutionIndex: 33
    SolutionNameMin: Cijk_Alik_Bjlk_BSS_BH_UserArgs_MT32x32x128_MI16x16x1_SN_LDSB1_CLR1_GSU0_GSUC0_GSUWGMRR0_K1_LBSPPA256_LBSPPB512_LPB16_MIWT1_1_PLR2_SU32_SUM0_SUS256_SKXCCM0_VWA1_VWB1_WGM1_WGMXCC1_WGMXCCGn1
    SolutionIndex: 34
    SolutionNameMin: Cijk_Alik_Bjlk_BSS_BH_UserArgs_MT32x32x128_MI16x16x1_SN_LDSB1_CLR1_GSU0_GSUC0_GSUWGMRR0_K1_LBSPPA256_LBSPPB512_LPB16_MIWT1_1_PLR2_SU32_SUM0_SUS256_SKXCCM0_VWA1_VWB1_WGM4_WGMXCC1_WGMXCCGn1
    SolutionIndex: 35
    SolutionNameMin: Cijk_Alik_Bjlk_BSS_BH_UserArgs_MT32x32x128_MI16x16x1_SN_LDSB1_CLR1_GSU0_GSUC0_GSUWGMRR0_K1_LBSPPA256_LBSPPB512_LPB16_MIWT1_1_PLR1_SU32_SUM0_SUS256_SKXCCM0_VWA1_VWB1_WGM8_WGMXCC1_WGMXCCGn1
    SolutionIndex: 36
    SolutionNameMin: Cijk_Alik_Bjlk_BSS_BH_UserArgs_MT256x256x32_MI16x16x1_SN_LDSB1_CLR1_GSU0_GSUC0_GSUWGMRR0_K1_LBSPPA256_LBSPPB2048_LPB0_MIWT8_8_PLR1_SU32_SUM0_SUS256_SKXCCM8_VWA4_VWB4_WGM1_WGMXCC1_WGMXCCGn1
    SolutionIndex: 37
    SolutionNameMin: Cijk_Alik_Bjlk_BSS_BH_UserArgs_MT256x256x32_MI16x16x1_SN_LDSB1_CLR1_GSU0_GSUC0_GSUWGMRR0_K1_LBSPPA256_LBSPPB2048_LPB0_MIWT8_8_PLR1_SU32_SUM0_SUS256_SKXCCM8_VWA4_VWB8_WGM1_WGMXCC1_WGMXCCGn1
    SolutionIndex: 38
    SolutionNameMin: Cijk_Alik_Bjlk_BSS_BH_UserArgs_MT256x256x32_MI16x16x1_SN_LDSB1_CLR1_GSU0_GSUC0_GSUWGMRR0_K1_LBSPPA256_LBSPPB2048_LPB0_MIWT8_8_PLR1_SU32_SUM0_SUS256_SKXCCM8_VWA4_VWB8_WGM4_WGMXCC1_WGMXCCGn1
    SolutionIndex: 39
    SolutionNameMin: Cijk_Alik_Bjlk_BSS_BH_UserArgs_MT256x256x32_MI16x16x1_SN_LDSB1_CLR1_GSU0_GSUC0_GSUWGMRR0_K1_LBSPPA256_LBSPPB2048_LPB32_MIWT8_8_PLR1_SU32_SUM0_SUS256_SKXCCM8_VWA4_VWB2_WGM8_WGMXCC1_WGMXCCGn1
    SolutionIndex: 40
    SolutionNameMin: Cijk_Alik_Bjlk_BSS_BH_UserArgs_MT256x256x32_MI16x16x1_SN_LDSB1_CLR1_GSU0_GSUC0_GSUWGMRR0_K1_LBSPPA256_LBSPPB2048_LPB0_MIWT8_8_PLR1_SU32_SUM0_SUS256_SKXCCM8_VWA4_VWB4_WGM8_WGMXCC1_WGMXCCGn1
    SolutionIndex: 41
    SolutionNameMin: Cijk_Alik_Bjlk_BSS_BH_UserArgs_MT256x256x32_MI16x16x1_SN_LDSB1_CLR1_GSU0_GSUC0_GSUWGMRR0_K1_LBSPPA128_LBSPPB2048_LPB0_MIWT8_8_PLR1_SU32_SUM0_SUS256_SKXCCM8_VWA2_VWB8_WGM8_WGMXCC1_WGMXCCGn1
    SolutionIndex: 42
    SolutionNameMin: Cijk_Alik_Bjlk_BSS_BH_UserArgs_MT256x256x32_MI16x16x1_SN_LDSB1_CLR1_GSU0_GSUC0_GSUWGMRR0_K1_LBSPPA256_LBSPPB2048_LPB0_MIWT8_8_PLR1_SU32_SUM0_SUS256_SKXCCM8_VWA4_VWB8_WGM8_WGMXCC1_WGMXCCGn1
    SolutionIndex: 43
    SolutionNameMin: Cijk_Alik_Bjlk_BSS_BH_UserArgs_MT128x256x32_MI16x16x1_SN_LDSB1_CLR1_GSU0_GSUC0_GSUWGMRR0_K1_LBSPPA256_LBSPPB2048_LPB32_MIWT4_8_PLR1_SU32_SUM0_SUS256_SKXCCM8_VWA4_VWB2_WGM4_WGMXCC1_WGMXCCGn1
    SolutionIndex: 44
    SolutionNameMin: Cijk_Alik_Bjlk_BSS_BH_UserArgs_MT128x256x32_MI16x16x1_SN_LDSB1_CLR1_GSU0_GSUC0_GSUWGMRR0_K1_LBSPPA256_LBSPPB2048_LPB0_MIWT4_8_PLR1_SU32_SUM0_SUS256_SKXCCM8_VWA4_VWB4_WGM4_WGMXCC1_WGMXCCGn1
    SolutionIndex: 45
    SolutionNameMin: Cijk_Alik_Bjlk_BSS_BH_UserArgs_MT128x256x32_MI16x16x1_SN_LDSB1_CLR1_GSU0_GSUC0_GSUWGMRR0_K1_LBSPPA256_LBSPPB2048_LPB0_MIWT4_8_PLR1_SU32_SUM0_SUS256_SKXCCM8_VWA4_VWB4_WGM8_WGMXCC1_WGMXCCGn1
    SolutionIndex: 46
    SolutionNameMin: Cijk_Alik_Bjlk_BSS_BH_UserArgs_MT32x32x32_MI16x16x1_SN_LDSB0_CLR1_GSU0_GSUC0_GSUWGMRR0_K1_LBSPPA128_LBSPPB256_LPB16_MIWT1_1_PLR1_SU32_SUM0_SUS256_SKXCCM8_VWA1_VWB1_WGM1_WGMXCC1_WGMXCCGn1
    SolutionIndex: 47
    SolutionNameMin: Cijk_Alik_Bjlk_BSS_BH_UserArgs_MT128x256x64_MI16x16x1_SN_LDSB1_CLR1_GSU0_GSUC0_GSUWGMRR0_K1_LBSPPA512_LBSPPB4096_LPB0_MIWT4_8_PLR1_SU32_SUM0_SUS256_SKXCCM8_VWA4_VWB4_WGM4_WGMXCC1_WGMXCCGn1
    SolutionIndex: 48
    SolutionNameMin: Cijk_Alik_Bjlk_BSS_BH_UserArgs_MT128x256x64_MI16x16x1_SN_LDSB1_CLR1_GSU0_GSUC0_GSUWGMRR0_K1_LBSPPA512_LBSPPB4096_LPB32_MIWT4_8_PLR1_SU32_SUM0_SUS256_SKXCCM8_VWA4_VWB2_WGM8_WGMXCC1_WGMXCCGn1
    SolutionIndex: 49
    SolutionNameMin: Cijk_Alik_Bjlk_BSS_BH_UserArgs_MT128x256x64_MI16x16x1_SN_LDSB1_CLR1_GSU0_GSUC0_GSUWGMRR0_K1_LBSPPA512_LBSPPB4096_LPB0_MIWT4_8_PLR1_SU32_SUM0_SUS256_SKXCCM8_VWA4_VWB4_WGM8_WGMXCC1_WGMXCCGn1
    SolutionIndex: 50
    SolutionNameMin: Cijk_Alik_Bjlk_BSS_BH_UserArgs_MT256x128x64_MI16x16x1_SN_LDSB1_CLR1_GSU0_GSUC0_GSUWGMRR0_K1_LBSPPA512_LBSPPB2048_LPB0_MIWT8_4_PLR1_SU32_SUM0_SUS256_SKXCCM8_VWA4_VWB4_WGM1_WGMXCC1_WGMXCCGn1
    SolutionIndex: 51
    SolutionNameMin: Cijk_Alik_Bjlk_BSS_BH_UserArgs_MT256x128x64_MI16x16x1_SN_LDSB1_CLR1_GSU0_GSUC0_GSUWGMRR0_K1_LBSPPA512_LBSPPB2048_LPB0_MIWT8_4_PLR1_SU32_SUM0_SUS256_SKXCCM8_VWA4_VWB4_WGM8_WGMXCC1_WGMXCCGn1
    SolutionIndex: 52
    SolutionNameMin: Cijk_Alik_Bjlk_BSS_BH_UserArgs_MT128x128x64_MI16x16x1_SN_LDSB1_CLR1_GSU0_GSUC0_GSUWGMRR0_K1_LBSPPA512_LBSPPB2048_LPB32_MIWT4_4_PLR1_SU32_SUM0_SUS256_SKXCCM8_VWA4_VWB2_WGM1_WGMXCC1_WGMXCCGn1
    SolutionIndex: 53
    SolutionNameMin: Cijk_Alik_Bjlk_BSS_BH_UserArgs_MT128x128x64_MI16x16x1_SN_LDSB1_CLR1_GSU0_GSUC0_GSUWGMRR0_K1_LBSPPA512_LBSPPB2048_LPB0_MIWT4_4_PLR1_SU32_SUM0_SUS256_SKXCCM8_VWA4_VWB4_WGM1_WGMXCC1_WGMXCCGn1
    SolutionIndex: 54
    SolutionNameMin: Cijk_Alik_Bjlk_BSS_BH_UserArgs_MT128x128x64_MI16x16x1_SN_LDSB1_CLR1_GSU0_GSUC0_GSUWGMRR0_K1_LBSPPA512_LBSPPB2048_LPB32_MIWT4_4_PLR1_SU32_SUM0_SUS256_SKXCCM8_VWA4_VWB2_WGM4_WGMXCC1_WGMXCCGn1
    SolutionIndex: 55
    SolutionNameMin: Cijk_Alik_Bjlk_BSS_BH_UserArgs_MT128x128x64_MI16x16x1_SN_LDSB1_CLR1_GSU0_GSUC0_GSUWGMRR0_K1_LBSPPA128_LBSPPB2048_LPB0_MIWT4_4_PLR1_SU32_SUM0_SUS256_SKXCCM8_VWA1_VWB4_WGM4_WGMXCC1_WGMXCCGn1
    SolutionIndex: 56
    SolutionNameMin: Cijk_Alik_Bjlk_BSS_BH_UserArgs_MT128x128x64_MI16x16x1_SN_LDSB1_CLR1_GSU0_GSUC0_GSUWGMRR0_K1_LBSPPA256_LBSPPB2048_LPB0_MIWT4_4_PLR1_SU32_SUM0_SUS256_SKXCCM8_VWA2_VWB4_WGM4_WGMXCC1_WGMXCCGn1
    SolutionIndex: 57
    SolutionNameMin: Cijk_Alik_Bjlk_BSS_BH_UserArgs_MT128x128x64_MI16x16x1_SN_LDSB1_CLR1_GSU0_GSUC0_GSUWGMRR0_K1_LBSPPA512_LBSPPB2048_LPB0_MIWT4_4_PLR1_SU32_SUM0_SUS256_SKXCCM8_VWA4_VWB4_WGM4_WGMXCC1_WGMXCCGn1
    SolutionIndex: 58
    SolutionNameMin: Cijk_Alik_Bjlk_BSS_BH_UserArgs_MT128x128x64_MI16x16x1_SN_LDSB1_CLR1_GSU0_GSUC0_GSUWGMRR0_K1_LBSPPA512_LBSPPB2048_LPB32_MIWT4_4_PLR1_SU32_SUM0_SUS256_SKXCCM8_VWA4_VWB2_WGM8_WGMXCC1_WGMXCCGn1
    SolutionIndex: 59
    SolutionNameMin: Cijk_Alik_Bjlk_BSS_BH_UserArgs_MT128x128x64_MI16x16x1_SN_LDSB1_CLR1_GSU0_GSUC0_GSUWGMRR0_K1_LBSPPA128_LBSPPB2048_LPB0_MIWT4_4_PLR1_SU32_SUM0_SUS256_SKXCCM8_VWA1_VWB4_WGM8_WGMXCC1_WGMXCCGn1
    SolutionIndex: 60
    SolutionNameMin: Cijk_Alik_Bjlk_BSS_BH_UserArgs_MT128x128x64_MI16x16x1_SN_LDSB1_CLR1_GSU0_GSUC0_GSUWGMRR0_K1_LBSPPA256_LBSPPB2048_LPB0_MIWT4_4_PLR1_SU32_SUM0_SUS256_SKXCCM8_VWA2_VWB4_WGM8_WGMXCC1_WGMXCCGn1
    SolutionIndex: 61
    SolutionNameMin: Cijk_Alik_Bjlk_BSS_BH_UserArgs_MT128x128x64_MI16x16x1_SN_LDSB1_CLR1_GSU0_GSUC0_GSUWGMRR0_K1_LBSPPA512_LBSPPB2048_LPB0_MIWT4_4_PLR1_SU32_SUM0_SUS256_SKXCCM8_VWA4_VWB4_WGM8_WGMXCC1_WGMXCCGn1
    SolutionIndex: 62
    SolutionNameMin: Cijk_Alik_Bjlk_BSS_BH_UserArgs_MT64x128x64_MI16x16x1_SN_LDSB1_CLR1_GSU0_GSUC0_GSUWGMRR0_K1_LBSPPA128_LBSPPB2048_LPB0_MIWT2_4_PLR1_SU32_SUM0_SUS256_SKXCCM8_VWA1_VWB4_WGM1_WGMXCC1_WGMXCCGn1
    SolutionIndex: 63
    SolutionNameMin: Cijk_Alik_Bjlk_BSS_BH_UserArgs_MT64x128x64_MI16x16x1_SN_LDSB1_CLR1_GSU0_GSUC0_GSUWGMRR0_K1_LBSPPA128_LBSPPB2048_LPB0_MIWT2_4_PLR1_SU32_SUM0_SUS256_SKXCCM8_VWA1_VWB4_WGM8_WGMXCC1_WGMXCCGn1
    SolutionIndex: 64
    SolutionNameMin: Cijk_Alik_Bjlk_BSS_BH_UserArgs_MT128x64x64_MI16x16x1_SN_LDSB1_CLR1_GSU0_GSUC0_GSUWGMRR0_K1_LBSPPA512_LBSPPB1024_LPB32_MIWT4_2_PLR1_SU32_SUM0_SUS256_SKXCCM8_VWA4_VWB2_WGM1_WGMXCC1_WGMXCCGn1
    SolutionIndex: 65
    SolutionNameMin: Cijk_Alik_Bjlk_BSS_BH_UserArgs_MT128x64x64_MI16x16x1_SN_LDSB1_CLR1_GSU0_GSUC0_GSUWGMRR0_K1_LBSPPA512_LBSPPB1024_LPB32_MIWT4_2_PLR1_SU32_SUM0_SUS256_SKXCCM8_VWA4_VWB2_WGM8_WGMXCC1_WGMXCCGn1
    SolutionIndex: 66
    SolutionNameMin: Cijk_Alik_Bjlk_BSS_BH_UserArgs_MT64x64x64_MI16x16x1_SN_LDSB1_CLR1_GSU0_GSUC0_GSUWGMRR0_K1_LBSPPA128_LBSPPB1024_LPB32_MIWT2_2_PLR1_SU32_SUM0_SUS256_SKXCCM8_VWA1_VWB2_WGM1_WGMXCC1_WGMXCCGn1
    SolutionIndex: 67
    SolutionNameMin: Cijk_Alik_Bjlk_BSS_BH_UserArgs_MT64x64x64_MI16x16x1_SN_LDSB1_CLR1_GSU0_GSUC0_GSUWGMRR0_K1_LBSPPA128_LBSPPB1024_LPB32_MIWT2_2_PLR1_SU32_SUM0_SUS256_SKXCCM8_VWA1_VWB2_WGM4_WGMXCC1_WGMXCCGn1
    SolutionIndex: 68
    SolutionNameMin: Cijk_Alik_Bjlk_BSS_BH_UserArgs_MT64x64x64_MI16x16x1_SN_LDSB1_CLR1_GSU0_GSUC0_GSUWGMRR0_K1_LBSPPA128_LBSPPB1024_LPB32_MIWT2_2_PLR1_SU32_SUM0_SUS256_SKXCCM8_VWA1_VWB2_WGM8_WGMXCC1_WGMXCCGn1
    SolutionIndex: 69
    SolutionNameMin: Cijk_Alik_Bjlk_BSS_BH_UserArgs_MT32x64x64_MI16x16x1_SN_LDSB0_CLR1_GSU0_GSUC0_GSUWGMRR0_K1_LBSPPA128_LBSPPB1024_LPB32_MIWT1_2_PLR1_SU32_SUM0_SUS256_SKXCCM8_VWA1_VWB2_WGM4_WGMXCC1_WGMXCCGn1
    SolutionIndex: 70
    SolutionNameMin: Cijk_Alik_Bjlk_BSS_BH_UserArgs_MT32x32x64_MI16x16x1_SN_LDSB0_CLR1_GSU0_GSUC0_GSUWGMRR0_K1_LBSPPA128_LBSPPB512_LPB16_MIWT1_1_PLR1_SU32_SUM0_SUS256_SKXCCM8_VWA1_VWB1_WGM1_WGMXCC1_WGMXCCGn1
    SolutionIndex: 71
    SolutionNameMin: Cijk_Alik_Bjlk_BSS_BH_UserArgs_MT64x128x128_MI16x16x1_SN_LDSB1_CLR1_GSU0_GSUC0_GSUWGMRR0_K1_LBSPPA256_LBSPPB2048_LPB0_MIWT2_4_PLR1_SU32_SUM0_SUS256_SKXCCM8_VWA1_VWB4_WGM1_WGMXCC1_WGMXCCGn1
    SolutionIndex: 72
    SolutionNameMin: Cijk_Alik_Bjlk_BSS_BH_UserArgs_MT64x128x128_MI16x16x1_SN_LDSB1_CLR1_GSU0_GSUC0_GSUWGMRR0_K1_LBSPPA512_LBSPPB2048_LPB0_MIWT2_4_PLR2_SU32_SUM0_SUS256_SKXCCM8_VWA2_VWB4_WGM4_WGMXCC1_WGMXCCGn1
    SolutionIndex: 73
    SolutionNameMin: Cijk_Alik_Bjlk_BSS_BH_UserArgs_MT64x128x128_MI16x16x1_SN_LDSB1_CLR1_GSU0_GSUC0_GSUWGMRR0_K1_LBSPPA256_LBSPPB2048_LPB0_MIWT2_4_PLR2_SU32_SUM0_SUS256_SKXCCM8_VWA1_VWB4_WGM8_WGMXCC1_WGMXCCGn1
    SolutionIndex: 74
    SolutionNameMin: Cijk_Alik_Bjlk_BSS_BH_UserArgs_MT128x64x128_MI16x16x1_SN_LDSB1_CLR1_GSU0_GSUC0_GSUWGMRR0_K1_LBSPPA1024_LBSPPB1024_LPB32_MIWT4_2_PLR1_SU32_SUM0_SUS256_SKXCCM8_VWA4_VWB2_WGM1_WGMXCC1_WGMXCCGn1
    SolutionIndex: 75
    SolutionNameMin: Cijk_Alik_Bjlk_BSS_BH_UserArgs_MT128x64x128_MI16x16x1_SN_LDSB1_CLR1_GSU0_GSUC0_GSUWGMRR0_K1_LBSPPA1024_LBSPPB1024_LPB32_MIWT4_2_PLR2_SU32_SUM0_SUS256_SKXCCM8_VWA4_VWB2_WGM1_WGMXCC1_WGMXCCGn1
    SolutionIndex: 76
    SolutionNameMin: Cijk_Alik_Bjlk_BSS_BH_UserArgs_MT128x64x128_MI16x16x1_SN_LDSB1_CLR1_GSU0_GSUC0_GSUWGMRR0_K1_LBSPPA1024_LBSPPB1024_LPB32_MIWT4_2_PLR1_SU32_SUM0_SUS256_SKXCCM8_VWA4_VWB2_WGM4_WGMXCC1_WGMXCCGn1
    SolutionIndex: 77
    SolutionNameMin: Cijk_Alik_Bjlk_BSS_BH_UserArgs_MT128x64x128_MI16x16x1_SN_LDSB1_CLR1_GSU0_GSUC0_GSUWGMRR0_K1_LBSPPA1024_LBSPPB1024_LPB32_MIWT4_2_PLR2_SU32_SUM0_SUS256_SKXCCM8_VWA4_VWB2_WGM4_WGMXCC1_WGMXCCGn1
    SolutionIndex: 78
    SolutionNameMin: Cijk_Alik_Bjlk_BSS_BH_UserArgs_MT128x64x128_MI16x16x1_SN_LDSB1_CLR1_GSU0_GSUC0_GSUWGMRR0_K1_LBSPPA256_LBSPPB1024_LPB32_MIWT4_2_PLR1_SU32_SUM0_SUS256_SKXCCM8_VWA1_VWB2_WGM8_WGMXCC1_WGMXCCGn1
    SolutionIndex: 79
    SolutionNameMin: Cijk_Alik_Bjlk_BSS_BH_UserArgs_MT128x64x128_MI16x16x1_SN_LDSB1_CLR1_GSU0_GSUC0_GSUWGMRR0_K1_LBSPPA1024_LBSPPB1024_LPB32_MIWT4_2_PLR1_SU32_SUM0_SUS256_SKXCCM8_VWA4_VWB2_WGM8_WGMXCC1_WGMXCCGn1
    SolutionIndex: 80
    SolutionNameMin: Cijk_Alik_Bjlk_BSS_BH_UserArgs_MT128x64x128_MI16x16x1_SN_LDSB1_CLR1_GSU0_GSUC0_GSUWGMRR0_K1_LBSPPA1024_LBSPPB1024_LPB32_MIWT4_2_PLR2_SU32_SUM0_SUS256_SKXCCM8_VWA4_VWB2_WGM8_WGMXCC1_WGMXCCGn1
    SolutionIndex: 81
    SolutionNameMin: Cijk_Alik_Bjlk_BSS_BH_UserArgs_MT64x64x128_MI16x16x1_SN_LDSB1_CLR1_GSU0_GSUC0_GSUWGMRR0_K1_LBSPPA256_LBSPPB1024_LPB16_MIWT2_2_PLR2_SU32_SUM0_SUS256_SKXCCM8_VWA1_VWB1_WGM1_WGMXCC1_WGMXCCGn1
    SolutionIndex: 82
    SolutionNameMin: Cijk_Alik_Bjlk_BSS_BH_UserArgs_MT64x64x128_MI16x16x1_SN_LDSB1_CLR1_GSU0_GSUC0_GSUWGMRR0_K1_LBSPPA256_LBSPPB1024_LPB32_MIWT2_2_PLR2_SU32_SUM0_SUS256_SKXCCM8_VWA1_VWB2_WGM1_WGMXCC1_WGMXCCGn1
    SolutionIndex: 83
    SolutionNameMin: Cijk_Alik_Bjlk_BSS_BH_UserArgs_MT64x64x128_MI16x16x1_SN_LDSB1_CLR1_GSU0_GSUC0_GSUWGMRR0_K1_LBSPPA512_LBSPPB1024_LPB32_MIWT2_2_PLR2_SU32_SUM0_SUS256_SKXCCM8_VWA2_VWB2_WGM1_WGMXCC1_WGMXCCGn1
    SolutionIndex: 84
    SolutionNameMin: Cijk_Alik_Bjlk_BSS_BH_UserArgs_MT64x64x128_MI16x16x1_SN_LDSB1_CLR1_GSU0_GSUC0_GSUWGMRR0_K1_LBSPPA256_LBSPPB1024_LPB32_MIWT2_2_PLR2_SU32_SUM0_SUS256_SKXCCM8_VWA1_VWB2_WGM4_WGMXCC1_WGMXCCGn1
    SolutionIndex: 85
    SolutionNameMin: Cijk_Alik_Bjlk_BSS_BH_UserArgs_MT64x64x128_MI16x16x1_SN_LDSB1_CLR1_GSU0_GSUC0_GSUWGMRR0_K1_LBSPPA256_LBSPPB1024_LPB32_MIWT2_2_PLR2_SU32_SUM0_SUS256_SKXCCM8_VWA1_VWB2_WGM8_WGMXCC1_WGMXCCGn1
    SolutionIndex: 86
    SolutionNameMin: Cijk_Alik_Bjlk_BSS_BH_UserArgs_MT32x64x128_MI16x16x1_SN_LDSB1_CLR1_GSU0_GSUC0_GSUWGMRR0_K1_LBSPPA256_LBSPPB1024_LPB32_MIWT1_2_PLR2_SU32_SUM0_SUS256_SKXCCM8_VWA1_VWB2_WGM1_WGMXCC1_WGMXCCGn1
    SolutionIndex: 87
    SolutionNameMin: Cijk_Alik_Bjlk_BSS_BH_UserArgs_MT32x64x128_MI16x16x1_SN_LDSB1_CLR1_GSU0_GSUC0_GSUWGMRR0_K1_LBSPPA256_LBSPPB1024_LPB32_MIWT1_2_PLR2_SU32_SUM0_SUS256_SKXCCM8_VWA1_VWB2_WGM4_WGMXCC1_WGMXCCGn1
    SolutionIndex: 88
    SolutionNameMin: Cijk_Alik_Bjlk_BSS_BH_UserArgs_MT32x64x128_MI16x16x1_SN_LDSB1_CLR1_GSU0_GSUC0_GSUWGMRR0_K1_LBSPPA256_LBSPPB1024_LPB32_MIWT1_2_PLR2_SU32_SUM0_SUS256_SKXCCM8_VWA1_VWB2_WGM8_WGMXCC1_WGMXCCGn1
    SolutionIndex: 89
    SolutionNameMin: Cijk_Alik_Bjlk_BSS_BH_UserArgs_MT32x32x128_MI16x16x1_SN_LDSB1_CLR1_GSU0_GSUC0_GSUWGMRR0_K1_LBSPPA256_LBSPPB512_LPB16_MIWT1_1_PLR1_SU32_SUM0_SUS256_SKXCCM8_VWA1_VWB1_WGM1_WGMXCC1_WGMXCCGn1
    SolutionIndex: 90
    SolutionNameMin: Cijk_Alik_Bjlk_BSS_BH_UserArgs_MT32x32x128_MI16x16x1_SN_LDSB1_CLR1_GSU0_GSUC0_GSUWGMRR0_K1_LBSPPA256_LBSPPB512_LPB16_MIWT1_1_PLR2_SU32_SUM0_SUS256_SKXCCM8_VWA1_VWB1_WGM1_WGMXCC1_WGMXCCGn1
    SolutionIndex: 91
    SolutionNameMin: Cijk_Alik_Bjlk_BSS_BH_UserArgs_MT32x32x128_MI16x16x1_SN_LDSB1_CLR1_GSU0_GSUC0_GSUWGMRR0_K1_LBSPPA256_LBSPPB512_LPB16_MIWT1_1_PLR2_SU32_SUM0_SUS256_SKXCCM8_VWA1_VWB1_WGM4_WGMXCC1_WGMXCCGn1
    SolutionIndex: 92
    SolutionNameMin: Cijk_Alik_Bjlk_BSS_BH_UserArgs_MT32x32x128_MI16x16x1_SN_LDSB1_CLR1_GSU0_GSUC0_GSUWGMRR0_K1_LBSPPA256_LBSPPB512_LPB16_MIWT1_1_PLR2_SU32_SUM0_SUS256_SKXCCM8_VWA1_VWB1_WGM8_WGMXCC1_WGMXCCGn1
    SolutionIndex: 93
    SolutionNameMin: Cijk_Alik_Bjlk_BSS_BH_UserArgs_MT32x32x32_MI16x16x1_SN_LDSB0_CLR1_GSU0_GSUC0_GSUWGMRR0_K1_LBSPPA128_LBSPPB256_LPB16_MIWT1_1_PLR1_SU32_SUM0_SUS256_SKXCCM0_VWA1_VWB1_WGM8_WGMXCC1_WGMXCCGn1
- - - [128, 128, 1, 128, 128, 128, 128, 128]
    - [89, 0.085]
  - - [128, 128, 1, 256, 128, 128, 256, 128]
    - [33, 0.106]
  - - [128, 128, 1, 512, 128, 128, 512, 128]
    - [33, 0.177]
  - - [128, 128, 1, 1024, 128, 128, 1024, 128]
    - [89, 0.268]
  - - [128, 128, 1, 2048, 128, 128, 2048, 128]
    - [90, 0.358]
  - - [128, 128, 1, 4096, 128, 128, 4096, 128]
    - [46, 0.534]
  - - [128, 128, 1, 8192, 128, 128, 8192, 128]
    - [46, 1.058]
  - - [128, 256, 1, 128, 128, 128, 128, 256]
    - [33, 0.167]
  - - [128, 256, 1, 256, 128, 128, 256, 256]
    - [32, 0.201]
  - - [128, 256, 1, 512, 128, 128, 512, 256]
    - [89, 0.351]
  - - [128, 256, 1, 1024, 128, 128, 1024, 256]
    - [89, 0.542]
  - - [128, 256, 1, 2048, 128, 128, 2048, 256]
    - [70, 0.789]
  - - [128, 256, 1, 4096, 128, 128, 4096, 256]
    - [46, 1.517]
  - - [128, 256, 1, 8192, 128, 128, 8192, 256]
    - [90, 2.679]
  - - [128, 512, 1, 128, 128, 128, 128, 512]
    - [33, 0.335]
  - - [128, 512, 1, 256, 128, 128, 256, 512]
    - [32, 0.401]
  - - [128, 512, 1, 512, 128, 128, 512, 512]
    - [89, 0.683]
  - - [128, 512, 1, 1024, 128, 128, 1024, 512]
    - [70, 1.103]
  - - [128, 512, 1, 2048, 128, 128, 2048, 512]
    - [89, 2.017]
  - - [128, 512, 1, 4096, 128, 128, 4096, 512]
    - [70, 3.327]
  - - [128, 512, 1, 8192, 128, 128, 8192, 512]
    - [89, 4.706]
  - - [128, 1024, 1, 128, 128, 128, 128, 1024]
    - [90, 0.618]
  - - [128, 1024, 1, 256, 128, 128, 256, 1024]
    - [89, 0.776]
  - - [128, 1024, 1, 512, 128, 128, 512, 1024]
    - [89, 1.372]
  - - [128, 1024, 1, 1024, 128, 128, 1024, 1024]
    - [89, 2.319]
  - - [128, 1024, 1, 2048, 128, 128, 2048, 1024]
    - [35, 3.618]
  - - [128, 1024, 1, 4096, 128, 128, 4096, 1024]
    - [86, 5.439]
  - - [128, 1024, 1, 8192, 128, 128, 8192, 1024]
    - [69, 7.228]
  - - [128, 2048, 1, 128, 128, 128, 128, 2048]
    - [33, 1.24]
  - - [128, 2048, 1, 256, 128, 128, 256, 2048]
    - [33, 1.522]
  - - [128, 2048, 1, 512, 128, 128, 512, 2048]
    - [32, 2.551]
  - - [128, 2048, 1, 1024, 128, 128, 1024, 2048]
    - [86, 4.191]
  - - [128, 2048, 1, 2048, 128, 128, 2048, 2048]
    - [86, 6.432]
  - - [128, 2048, 1, 4096, 128, 128, 4096, 2048]
    - [14, 8.389]
  - - [128, 2048, 1, 8192, 128, 128, 8192, 2048]
    - [67, 12.096]
  - - [128, 4096, 1, 128, 128, 128, 128, 4096]
    - [86, 2.197]
  - - [128, 4096, 1, 256, 128, 128, 256, 4096]
    - [86, 2.945]
  - - [128, 4096, 1, 512, 128, 128, 512, 4096]
    - [86, 4.668]
  - - [128, 4096, 1, 1024, 128, 128, 1024, 4096]
    - [86, 7.266]
  - - [128, 4096, 1, 2048, 128, 128, 2048, 4096]
    - [82, 9.91]
  - - [128, 4096, 1, 4096, 128, 128, 4096, 4096]
    - [68, 13.046]
  - - [128, 4096, 1, 8192, 128, 128, 8192, 4096]
    - [64, 16.479]
  - - [128, 8192, 1, 128, 128, 128, 128, 8192]
    - [28, 3.445]
  - - [128, 8192, 1, 256, 128, 128, 256, 8192]
    - [81, 4.885]
  - - [128, 8192, 1, 512, 128, 128, 512, 8192]
    - [82, 7.716]
  - - [128, 8192, 1, 1024, 128, 128, 1024, 8192]
    - [82, 10.885]
  - - [128, 8192, 1, 2048, 128, 128, 2048, 8192]
    - [13, 13.802]
  - - [128, 8192, 1, 4096, 128, 128, 4096, 8192]
    - [65, 17.557]
  - - [128, 8192, 1, 8192, 128, 128, 8192, 8192]
    - [10, 21.772]
  - - [256, 128, 1, 128, 256, 256, 128, 128]
    - [89, 0.163]
  - - [256, 128, 1, 256, 256, 256, 256, 128]
    - [33, 0.209]
  - - [256, 128, 1, 512, 256, 256, 512, 128]
    - [89, 0.347]
  - - [256, 128, 1, 1024, 256, 256, 1024, 128]
    - [89, 0.533]
  - - [256, 128, 1, 2048, 256, 256, 2048, 128]
    - [1, 0.806]
  - - [256, 128, 1, 4096, 256, 256, 4096, 128]
    - [15, 1.55]
  - - [256, 128, 1, 8192, 256, 256, 8192, 128]
    - [89, 2.744]
  - - [256, 256, 1, 128, 256, 256, 128, 256]
    - [33, 0.328]
  - - [256, 256, 1, 256, 256, 256, 256, 256]
    - [32, 0.408]
  - - [256, 256, 1, 512, 256, 256, 512, 256]
    - [89, 0.686]
  - - [256, 256, 1, 1024, 256, 256, 1024, 256]
    - [70, 1.106]
  - - [256, 256, 1, 2048, 256, 256, 2048, 256]
    - [89, 2.06]
  - - [256, 256, 1, 4096, 256, 256, 4096, 256]
    - [90, 3.363]
  - - [256, 256, 1, 8192, 256, 256, 8192, 256]
    - [86, 4.757]
  - - [256, 512, 1, 128, 256, 256, 128, 512]
    - [33, 0.64]
  - - [256, 512, 1, 256, 256, 256, 256, 512]
    - [33, 0.771]
  - - [256, 512, 1, 512, 256, 256, 512, 512]
    - [90, 1.341]
  - - [256, 512, 1, 1024, 256, 256, 1024, 512]
    - [89, 2.31]
  - - [256, 512, 1, 2048, 256, 256, 2048, 512]
    - [32, 3.772]
  - - [256, 512, 1, 4096, 256, 256, 4096, 512]
    - [90, 5.676]
  - - [256, 512, 1, 8192, 256, 256, 8192, 512]
    - [69, 7.503]
  - - [256, 1024, 1, 128, 256, 256, 128, 1024]
    - [89, 1.209]
  - - [256, 1024, 1, 256, 256, 256, 256, 1024]
    - [34, 1.544]
  - - [256, 1024, 1, 512, 256, 256, 512, 1024]
    - [90, 2.526]
  - - [256, 1024, 1, 1024, 256, 256, 1024, 1024]
    - [86, 4.123]
  - - [256, 1024, 1, 2048, 256, 256, 2048, 1024]
    - [86, 6.569]
  - - [256, 1024, 1, 4096, 256, 256, 4096, 1024]
    - [66, 8.576]
  - - [256, 1024, 1, 8192, 256, 256, 8192, 1024]
    - [67, 12.08]
  - - [256, 2048, 1, 128, 256, 256, 128, 2048]
    - [31, 2.225]
  - - [256, 2048, 1, 256, 256, 256, 256, 2048]
    - [86, 2.886]
  - - [256, 2048, 1, 512, 256, 256, 512, 2048]
    - [86, 4.632]
  - - [256, 2048, 1, 1024, 256, 256, 1024, 2048]
    - [88, 7.096]
  - - [256, 2048, 1, 2048, 256, 256, 2048, 2048]
    - [82, 10.14]
  - - [256, 2048, 1, 4096, 256, 256, 4096, 2048]
    - [68, 13.117]
  - - [256, 2048, 1, 8192, 256, 256, 8192, 2048]
    - [65, 16.03]
  - - [256, 4096, 1, 128, 256, 256, 128, 4096]
    - [83, 3.581]
  - - [256, 4096, 1, 256, 256, 256, 256, 4096]
    - [82, 4.909]
  - - [256, 4096, 1, 512, 256, 256, 512, 4096]
    - [82, 7.775]
  - - [256, 4096, 1, 1024, 256, 256, 1024, 4096]
    - [83, 11.062]
  - - [256, 4096, 1, 2048, 256, 256, 2048, 4096]
    - [75, 14.321]
  - - [256, 4096, 1, 4096, 256, 256, 4096, 4096]
    - [65, 18.108]
  - - [256, 4096, 1, 8192, 256, 256, 8192, 4096]
    - [57, 21.648]
  - - [256, 8192, 1, 128, 256, 256, 128, 8192]
    - [20, 5.357]
  - - [256, 8192, 1, 256, 256, 256, 256, 8192]
    - [25, 7.66]
  - - [256, 8192, 1, 512, 256, 256, 512, 8192]
    - [74, 10.718]
  - - [256, 8192, 1, 1024, 256, 256, 1024, 8192]
    - [75, 14.498]
  - - [256, 8192, 1, 2048, 256, 256, 2048, 8192]
    - [75, 18.095]
  - - [256, 8192, 1, 4096, 256, 256, 4096, 8192]
    - [61, 23.385]
  - - [256, 8192, 1, 8192, 256, 256, 8192, 8192]
    - [11, 25.916]
  - - [512, 128, 1, 128, 512, 512, 128, 128]
    - [33, 0.337]
  - - [512, 128, 1, 256, 512, 512, 256, 128]
    - [32, 0.404]
  - - [512, 128, 1, 512, 512, 512, 512, 128]
    - [89, 0.679]
  - - [512, 128, 1, 1024, 512, 512, 1024, 128]
    - [16, 1.06]
  - - [512, 128, 1, 2048, 512, 512, 2048, 128]
    - [33, 2.012]
  - - [512, 128, 1, 4096, 512, 512, 4096, 128]
    - [32, 3.446]
  - - [512, 128, 1, 8192, 512, 512, 8192, 128]
    - [92, 5.334]
  - - [512, 256, 1, 128, 512, 512, 128, 256]
    - [33, 0.648]
  - - [512, 256, 1, 256, 512, 512, 256, 256]
    - [90, 0.774]
  - - [512, 256, 1, 512, 512, 512, 512, 256]
    - [89, 1.347]
  - - [512, 256, 1, 1024, 512, 512, 1024, 256]
    - [32, 2.286]
  - - [512, 256, 1, 2048, 512, 512, 2048, 256]
    - [89, 3.804]
  - - [512, 256, 1, 4096, 512, 512, 4096, 256]
    - [31, 5.716]
  - - [512, 256, 1, 8192, 512, 512, 8192, 256]
    - [86, 7.982]
  - - [512, 512, 1, 128, 512, 512, 128, 512]
    - [32, 1.24]
  - - [512, 512, 1, 256, 512, 512, 256, 512]
    - [32, 1.552]
  - - [512, 512, 1, 512, 512, 512, 512, 512]
    - [32, 2.545]
  - - [512, 512, 1, 1024, 512, 512, 1024, 512]
    - [86, 4.109]
  - - [512, 512, 1, 2048, 512, 512, 2048, 512]
    - [86, 6.746]
  - - [512, 512, 1, 4096, 512, 512, 4096, 512]
    - [84, 8.857]
  - - [512, 512, 1, 8192, 512, 512, 8192, 512]
    - [67, 12.034]
  - - [512, 1024, 1, 128, 512, 512, 128, 1024]
    - [86, 2.197]
  - - [512, 1024, 1, 256, 512, 512, 256, 1024]
    - [31, 2.908]
  - - [512, 1024, 1, 512, 512, 512, 512, 1024]
    - [86, 4.617]
  - - [512, 1024, 1, 1024, 512, 512, 1024, 1024]
    - [86, 7.193]
  - - [512, 1024, 1, 2048, 512, 512, 2048, 1024]
    - [84, 10.06]
  - - [512, 1024, 1, 4096, 512, 512, 4096, 1024]
    - [68, 13.082]
  - - [512, 1024, 1, 8192, 512, 512, 8192, 1024]
    - [65, 16.087]
  - - [512, 2048, 1, 128, 512, 512, 128, 2048]
    - [30, 3.637]
  - - [512, 2048, 1, 256, 512, 512, 256, 2048]
    - [30, 4.839]
  - - [512, 2048, 1, 512, 512, 512, 512, 2048]
    - [82, 7.64]
  - - [512, 2048, 1, 1024, 512, 512, 1024, 2048]
    - [82, 11.011]
  - - [512, 2048, 1, 2048, 512, 512, 2048, 2048]
    - [80, 13.985]
  - - [512, 2048, 1, 4096, 512, 512, 4096, 2048]
    - [65, 17.736]
  - - [512, 2048, 1, 8192, 512, 512, 8192, 2048]
    - [57, 21.842]
  - - [512, 4096, 1, 128, 512, 512, 128, 4096]
    - [20, 5.423]
  - - [512, 4096, 1, 256, 512, 512, 256, 4096]
    - [23, 7.712]
  - - [512, 4096, 1, 512, 512, 512, 512, 4096]
    - [77, 10.888]
  - - [512, 4096, 1, 1024, 512, 512, 1024, 4096]
    - [75, 14.854]
  - - [512, 4096, 1, 2048, 512, 512, 2048, 4096]
    - [65, 17.729]
  - - [512, 4096, 1, 4096, 512, 512, 4096, 4096]
    - [61, 23.144]
  - - [512, 4096, 1, 8192, 512, 512, 8192, 4096]
    - [47, 25.365]
  - - [512, 8192, 1, 128, 512, 512, 128, 8192]
    - [27, 6.677]
  - - [512, 8192, 1, 256, 512, 512, 256, 8192]
    - [25, 9.026]
  - - [512, 8192, 1, 512, 512, 512, 512, 8192]
    - [75, 12.953]
  - - [512, 8192, 1, 1024, 512, 512, 1024, 8192]
    - [61, 17.135]
  - - [512, 8192, 1, 2048, 512, 512, 2048, 8192]
    - [61, 22.383]
  - - [512, 8192, 1, 4096, 512, 512, 4096, 8192]
    - [7, 26.782]
  - - [512, 8192, 1, 8192, 512, 512, 8192, 8192]
    - [6, 29.682]
  - - [1024, 128, 1, 128, 1024, 1024, 128, 128]
    - [32, 0.652]
  - - [1024, 128, 1, 256, 1024, 1024, 256, 128]
    - [89, 0.761]
  - - [1024, 128, 1, 512, 1024, 1024, 512, 128]
    - [89, 1.324]
  - - [1024, 128, 1, 1024, 1024, 1024, 1024, 128]
    - [90, 2.282]
  - - [1024, 128, 1, 2048, 1024, 1024, 2048, 128]
    - [32, 3.794]
  - - [1024, 128, 1, 4096, 1024, 1024, 4096, 128]
    - [91, 5.918]
  - - [1024, 128, 1, 8192, 1024, 1024, 8192, 128]
    - [88, 8.157]
  - - [1024, 256, 1, 128, 1024, 1024, 128, 256]
    - [33, 1.263]
  - - [1024, 256, 1, 256, 1024, 1024, 256, 256]
    - [89, 1.569]
  - - [1024, 256, 1, 512, 1024, 1024, 512, 256]
    - [89, 2.534]
  - - [1024, 256, 1, 1024, 1024, 1024, 1024, 256]
    - [86, 4.172]
  - - [1024, 256, 1, 2048, 1024, 1024, 2048, 256]
    - [31, 6.754]
  - - [1024, 256, 1, 4096, 1024, 1024, 4096, 256]
    - [87, 9.638]
  - - [1024, 256, 1, 8192, 1024, 1024, 8192, 256]
    - [67, 12.347]
  - - [1024, 512, 1, 128, 1024, 1024, 128, 512]
    - [31, 2.239]
  - - [1024, 512, 1, 256, 1024, 1024, 256, 512]
    - [86, 2.907]
  - - [1024, 512, 1, 512, 1024, 1024, 512, 512]
    - [86, 4.624]
  - - [1024, 512, 1, 1024, 1024, 1024, 1024, 512]
    - [86, 7.214]
  - - [1024, 512, 1, 2048, 1024, 1024, 2048, 512]
    - [84, 10.375]
  - - [1024, 512, 1, 4096, 1024, 1024, 4096, 512]
    - [68, 13.292]
  - - [1024, 512, 1, 8192, 1024, 1024, 8192, 512]
    - [65, 16.108]
  - - [1024, 1024, 1, 128, 1024, 1024, 128, 1024]
    - [29, 3.682]
  - - [1024, 1024, 1, 256, 1024, 1024, 256, 1024]
    - [29, 4.862]
  - - [1024, 1024, 1, 512, 1024, 1024, 512, 1024]
    - [82, 7.687]
  - - [1024, 1024, 1, 1024, 1024, 1024, 1024, 1024]
    - [82, 10.888]
  - - [1024, 1024, 1, 2048, 1024, 1024, 2048, 1024]
    - [80, 14.034]
  - - [1024, 1024, 1, 4096, 1024, 1024, 4096, 1024]
    - [65, 17.629]
  - - [1024, 1024, 1, 8192, 1024, 1024, 8192, 1024]
    - [57, 21.981]
  - - [1024, 2048, 1, 128, 1024, 1024, 128, 2048]
    - [27, 5.498]
  - - [1024, 2048, 1, 256, 1024, 1024, 256, 2048]
    - [24, 7.777]
  - - [1024, 2048, 1, 512, 1024, 1024, 512, 2048]
    - [76, 10.681]
  - - [1024, 2048, 1, 1024, 1024, 1024, 1024, 2048]
    - [80, 14.385]
  - - [1024, 2048, 1, 2048, 1024, 1024, 2048, 2048]
    - [61, 17.288]
  - - [1024, 2048, 1, 4096, 1024, 1024, 4096, 2048]
    - [61, 23.491]
  - - [1024, 2048, 1, 8192, 1024, 1024, 8192, 2048]
    - [51, 25.148]
  - - [1024, 4096, 1, 128, 1024, 1024, 128, 4096]
    - [27, 6.832]
  - - [1024, 4096, 1, 256, 1024, 1024, 256, 4096]
    - [22, 9.201]
  - - [1024, 4096, 1, 512, 1024, 1024, 512, 4096]
    - [75, 13.089]
  - - [1024, 4096, 1, 1024, 1024, 1024, 1024, 4096]
    - [53, 17.177]
  - - [1024, 4096, 1, 2048, 1024, 1024, 2048, 4096]
    - [59, 22.456]
  - - [1024, 4096, 1, 4096, 1024, 1024, 4096, 4096]
    - [45, 26.078]
  - - [1024, 4096, 1, 8192, 1024, 1024, 8192, 4096]
    - [7, 28.549]
  - - [1024, 8192, 1, 128, 1024, 1024, 128, 8192]
    - [21, 6.672]
  - - [1024, 8192, 1, 256, 1024, 1024, 256, 8192]
    - [17, 10.251]
  - - [1024, 8192, 1, 512, 1024, 1024, 512, 8192]
    - [52, 15.289]
  - - [1024, 8192, 1, 1024, 1024, 1024, 1024, 8192]
    - [52, 20.922]
  - - [1024, 8192, 1, 2048, 1024, 1024, 2048, 8192]
    - [51, 25.664]
  - - [1024, 8192, 1, 4096, 1024, 1024, 4096, 8192]
    - [5, 28.487]
  - - [1024, 8192, 1, 8192, 1024, 1024, 8192, 8192]
    - [36, 31.195]
  - - [2048, 128, 1, 128, 2048, 2048, 128, 128]
    - [33, 1.255]
  - - [2048, 128, 1, 256, 2048, 2048, 256, 128]
    - [90, 1.581]
  - - [2048, 128, 1, 512, 2048, 2048, 512, 128]
    - [33, 2.558]
  - - [2048, 128, 1, 1024, 2048, 2048, 1024, 128]
    - [86, 4.205]
  - - [2048, 128, 1, 2048, 2048, 2048, 2048, 128]
    - [86, 6.771]
  - - [2048, 128, 1, 4096, 2048, 2048, 4096, 128]
    - [87, 9.635]
  - - [2048, 128, 1, 8192, 2048, 2048, 8192, 128]
    - [67, 11.784]
  - - [2048, 256, 1, 128, 2048, 2048, 128, 256]
    - [86, 2.24]
  - - [2048, 256, 1, 256, 2048, 2048, 256, 256]
    - [86, 2.948]
  - - [2048, 256, 1, 512, 2048, 2048, 512, 256]
    - [86, 4.644]
  - - [2048, 256, 1, 1024, 2048, 2048, 1024, 256]
    - [86, 7.296]
  - - [2048, 256, 1, 2048, 2048, 2048, 2048, 256]
    - [68, 10.225]
  - - [2048, 256, 1, 4096, 2048, 2048, 4096, 256]
    - [67, 13.592]
  - - [2048, 256, 1, 8192, 2048, 2048, 8192, 256]
    - [63, 15.358]
  - - [2048, 512, 1, 128, 2048, 2048, 128, 512]
    - [30, 3.709]
  - - [2048, 512, 1, 256, 2048, 2048, 256, 512]
    - [82, 4.927]
  - - [2048, 512, 1, 512, 2048, 2048, 512, 512]
    - [82, 7.776]
  - - [2048, 512, 1, 1024, 2048, 2048, 1024, 512]
    - [84, 11.16]
  - - [2048, 512, 1, 2048, 2048, 2048, 2048, 512]
    - [80, 14.825]
  - - [2048, 512, 1, 4096, 2048, 2048, 4096, 512]
    - [65, 18.121]
  - - [2048, 512, 1, 8192, 2048, 2048, 8192, 512]
    - [61, 21.507]
  - - [2048, 1024, 1, 128, 2048, 2048, 128, 1024]
    - [27, 5.552]
  - - [2048, 1024, 1, 256, 2048, 2048, 256, 1024]
    - [23, 7.796]
  - - [2048, 1024, 1, 512, 2048, 2048, 512, 1024]
    - [78, 10.696]
  - - [2048, 1024, 1, 1024, 2048, 2048, 1024, 1024]
    - [65, 14.346]
  - - [2048, 1024, 1, 2048, 2048, 2048, 2048, 1024]
    - [61, 17.584]
  - - [2048, 1024, 1, 4096, 2048, 2048, 4096, 1024]
    - [61, 23.481]
  - - [2048, 1024, 1, 8192, 2048, 2048, 8192, 1024]
    - [47, 25.102]
  - - [2048, 2048, 1, 128, 2048, 2048, 128, 2048]
    - [27, 6.742]
  - - [2048, 2048, 1, 256, 2048, 2048, 256, 2048]
    - [22, 9.147]
  - - [2048, 2048, 1, 512, 2048, 2048, 512, 2048]
    - [75, 12.543]
  - - [2048, 2048, 1, 1024, 2048, 2048, 1024, 2048]
    - [61, 17.165]
  - - [2048, 2048, 1, 2048, 2048, 2048, 2048, 2048]
    - [61, 22.467]
  - - [2048, 2048, 1, 4096, 2048, 2048, 4096, 2048]
    - [48, 26.147]
  - - [2048, 2048, 1, 8192, 2048, 2048, 8192, 2048]
    - [50, 28.53]
  - - [2048, 4096, 1, 128, 2048, 2048, 128, 4096]
    - [4, 6.587]
  - - [2048, 4096, 1, 256, 2048, 2048, 256, 4096]
    - [22, 10.283]
  - - [2048, 4096, 1, 512, 2048, 2048, 512, 4096]
    - [53, 15.106]
  - - [2048, 4096, 1, 1024, 2048, 2048, 1024, 4096]
    - [58, 20.639]
  - - [2048, 4096, 1, 2048, 2048, 2048, 2048, 4096]
    - [57, 25.563]
  - - [2048, 4096, 1, 4096, 2048, 2048, 4096, 4096]
    - [37, 28.659]
  - - [2048, 4096, 1, 8192, 2048, 2048, 8192, 4096]
    - [42, 32.173]
  - - [2048, 8192, 1, 128, 2048, 2048, 128, 8192]
    - [22, 7.494]
  - - [2048, 8192, 1, 256, 2048, 2048, 256, 8192]
    - [27, 11.801]
  - - [2048, 8192, 1, 512, 2048, 2048, 512, 8192]
    - [57, 17.292]
  - - [2048, 8192, 1, 1024, 2048, 2048, 1024, 8192]
    - [58, 23.298]
  - - [2048, 8192, 1, 2048, 2048, 2048, 2048, 8192]
    - [60, 27.454]
  - - [2048, 8192, 1, 4096, 2048, 2048, 4096, 8192]
    - [37, 30.789]
  - - [2048, 8192, 1, 8192, 2048, 2048, 8192, 8192]
    - [37, 33.592]
  - - [4096, 128, 1, 128, 4096, 4096, 128, 128]
    - [86, 2.23]
  - - [4096, 128, 1, 256, 4096, 4096, 256, 128]
    - [31, 2.935]
  - - [4096, 128, 1, 512, 4096, 4096, 512, 128]
    - [86, 4.654]
  - - [4096, 128, 1, 1024, 4096, 4096, 1024, 128]
    - [86, 7.155]
  - - [4096, 128, 1, 2048, 4096, 4096, 2048, 128]
    - [68, 10.204]
  - - [4096, 128, 1, 4096, 4096, 4096, 4096, 128]
    - [84, 13.097]
  - - [4096, 128, 1, 8192, 4096, 4096, 8192, 128]
    - [12, 15.782]
  - - [4096, 256, 1, 128, 4096, 4096, 128, 256]
    - [29, 3.684]
  - - [4096, 256, 1, 256, 4096, 4096, 256, 256]
    - [29, 4.937]
  - - [4096, 256, 1, 512, 4096, 4096, 512, 256]
    - [82, 7.599]
  - - [4096, 256, 1, 1024, 4096, 4096, 1024, 256]
    - [85, 11.09]
  - - [4096, 256, 1, 2048, 4096, 4096, 2048, 256]
    - [85, 14.664]
  - - [4096, 256, 1, 4096, 4096, 4096, 4096, 256]
    - [62, 16.974]
  - - [4096, 256, 1, 8192, 4096, 4096, 8192, 256]
    - [61, 21.322]
  - - [4096, 512, 1, 128, 4096, 4096, 128, 512]
    - [25, 5.56]
  - - [4096, 512, 1, 256, 4096, 4096, 256, 512]
    - [23, 7.673]
  - - [4096, 512, 1, 512, 4096, 4096, 512, 512]
    - [79, 10.788]
  - - [4096, 512, 1, 1024, 4096, 4096, 1024, 512]
    - [80, 14.552]
  - - [4096, 512, 1, 2048, 4096, 4096, 2048, 512]
    - [73, 17.996]
  - - [4096, 512, 1, 4096, 4096, 4096, 4096, 512]
    - [57, 22.28]
  - - [4096, 512, 1, 8192, 4096, 4096, 8192, 512]
    - [61, 25.456]
  - - [4096, 1024, 1, 128, 4096, 4096, 128, 1024]
    - [26, 6.099]
  - - [4096, 1024, 1, 256, 4096, 4096, 256, 1024]
    - [22, 8.954]
  - - [4096, 1024, 1, 512, 4096, 4096, 512, 1024]
    - [73, 12.524]
  - - [4096, 1024, 1, 1024, 4096, 4096, 1024, 1024]
    - [57, 16.905]
  - - [4096, 1024, 1, 2048, 4096, 4096, 2048, 1024]
    - [61, 22.384]
  - - [4096, 1024, 1, 4096, 4096, 4096, 4096, 1024]
    - [49, 26.442]
  - - [4096, 1024, 1, 8192, 4096, 4096, 8192, 1024]
    - [49, 28.374]
  - - [4096, 2048, 1, 128, 4096, 4096, 128, 2048]
    - [22, 6.489]
  - - [4096, 2048, 1, 256, 4096, 4096, 256, 2048]
    - [18, 9.929]
  - - [4096, 2048, 1, 512, 4096, 4096, 512, 2048]
    - [61, 15.067]
  - - [4096, 2048, 1, 1024, 4096, 4096, 1024, 2048]
    - [55, 20.682]
  - - [4096, 2048, 1, 2048, 4096, 4096, 2048, 2048]
    - [57, 26.219]
  - - [4096, 2048, 1, 4096, 4096, 4096, 4096, 2048]
    - [38, 28.249]
  - - [4096, 2048, 1, 8192, 4096, 4096, 8192, 2048]
    - [38, 31.755]
  - - [4096, 4096, 1, 128, 4096, 4096, 128, 4096]
    - [22, 7.382]
  - - [4096, 4096, 1, 256, 4096, 4096, 256, 4096]
    - [22, 11.702]
  - - [4096, 4096, 1, 512, 4096, 4096, 512, 4096]
    - [57, 17.178]
  - - [4096, 4096, 1, 1024, 4096, 4096, 1024, 4096]
    - [61, 23.042]
  - - [4096, 4096, 1, 2048, 4096, 4096, 2048, 4096]
    - [61, 27.399]
  - - [4096, 4096, 1, 4096, 4096, 4096, 4096, 4096]
    - [57, 30.98]
  - - [4096, 4096, 1, 8192, 4096, 4096, 8192, 4096]
    - [37, 34.205]
  - - [4096, 8192, 1, 128, 4096, 4096, 128, 8192]
    - [9, 8.193]
  - - [4096, 8192, 1, 256, 4096, 4096, 256, 8192]
    - [61, 12.316]
  - - [4096, 8192, 1, 512, 4096, 4096, 512, 8192]
    - [56, 17.752]
  - - [4096, 8192, 1, 1024, 4096, 4096, 1024, 8192]
    - [61, 23.289]
  - - [4096, 8192, 1, 2048, 4096, 4096, 2048, 8192]
    - [42, 28.671]
  - - [4096, 8192, 1, 4096, 4096, 4096, 4096, 8192]
    - [41, 34.453]
  - - [4096, 8192, 1, 8192, 4096, 4096, 8192, 8192]
    - [42, 37.506]
  - - [8192, 128, 1, 128, 8192, 8192, 128, 128]
    - [84, 3.574]
  - - [8192, 128, 1, 256, 8192, 8192, 256, 128]
    - [82, 4.875]
  - - [8192, 128, 1, 512, 8192, 8192, 512, 128]
    - [82, 7.669]
  - - [8192, 128, 1, 1024, 8192, 8192, 1024, 128]
    - [85, 11.131]
  - - [8192, 128, 1, 2048, 8192, 8192, 2048, 128]
    - [85, 14.045]
  - - [8192, 128, 1, 4096, 8192, 8192, 4096, 128]
    - [62, 17.405]
  - - [8192, 128, 1, 8192, 8192, 8192, 8192, 128]
    - [11, 21.532]
  - - [8192, 256, 1, 128, 8192, 8192, 128, 256]
    - [71, 5.203]
  - - [8192, 256, 1, 256, 8192, 8192, 256, 256]
    - [19, 7.242]
  - - [8192, 256, 1, 512, 8192, 8192, 512, 256]
    - [78, 10.667]
  - - [8192, 256, 1, 1024, 8192, 8192, 1024, 256]
    - [77, 14.322]
  - - [8192, 256, 1, 2048, 8192, 8192, 2048, 256]
    - [73, 18.094]
  - - [8192, 256, 1, 4096, 8192, 8192, 4096, 256]
    - [53, 22.727]
  - - [8192, 256, 1, 8192, 8192, 8192, 8192, 256]
    - [11, 26.619]
  - - [8192, 512, 1, 128, 8192, 8192, 128, 512]
    - [72, 5.935]
  - - [8192, 512, 1, 256, 8192, 8192, 256, 512]
    - [22, 8.778]
  - - [8192, 512, 1, 512, 8192, 8192, 512, 512]
    - [65, 12.53]
  - - [8192, 512, 1, 1024, 8192, 8192, 1024, 512]
    - [61, 16.983]
  - - [8192, 512, 1, 2048, 8192, 8192, 2048, 512]
    - [53, 22.283]
  - - [8192, 512, 1, 4096, 8192, 8192, 4096, 512]
    - [0, 26.251]
  - - [8192, 512, 1, 8192, 8192, 8192, 8192, 512]
    - [2, 28.943]
  - - [8192, 1024, 1, 128, 8192, 8192, 128, 1024]
    - [22, 6.679]
  - - [8192, 1024, 1, 256, 8192, 8192, 256, 1024]
    - [61, 10.161]
  - - [8192, 1024, 1, 512, 8192, 8192, 512, 1024]
    - [61, 15.181]
  - - [8192, 1024, 1, 1024, 8192, 8192, 1024, 1024]
    - [57, 20.86]
  - - [8192, 1024, 1, 2048, 8192, 8192, 2048, 1024]
    - [8, 25.931]
  - - [8192, 1024, 1, 4096, 8192, 8192, 4096, 1024]
    - [3, 28.353]
  - - [8192, 1024, 1, 8192, 8192, 8192, 8192, 1024]
    - [39, 31.072]
  - - [8192, 2048, 1, 128, 8192, 8192, 128, 2048]
    - [22, 7.603]
  - - [8192, 2048, 1, 256, 8192, 8192, 256, 2048]
    - [18, 11.705]
  - - [8192, 2048, 1, 512, 8192, 8192, 512, 2048]
    - [57, 17.209]
  - - [8192, 2048, 1, 1024, 8192, 8192, 1024, 2048]
    - [54, 22.845]
  - - [8192, 2048, 1, 2048, 8192, 8192, 2048, 2048]
    - [61, 27.934]
  - - [8192, 2048, 1, 4096, 8192, 8192, 4096, 2048]
    - [61, 30.934]
  - - [8192, 2048, 1, 8192, 8192, 8192, 8192, 2048]
    - [42, 34.088]
  - - [8192, 4096, 1, 128, 8192, 8192, 128, 4096]
    - [9, 8.457]
  - - [8192, 4096, 1, 256, 8192, 8192, 256, 4096]
    - [57, 12.399]
  - - [8192, 4096, 1, 512, 8192, 8192, 512, 4096]
    - [57, 17.658]
  - - [8192, 4096, 1, 1024, 8192, 8192, 1024, 4096]
    - [9, 23.328]
  - - [8192, 4096, 1, 2048, 8192, 8192, 2048, 4096]
    - [40, 28.785]
  - - [8192, 4096, 1, 4096, 8192, 8192, 4096, 4096]
    - [51, 34.447]
  - - [8192, 4096, 1, 8192, 8192, 8192, 8192, 4096]
    - [42, 37.703]
  - - [8192, 8192, 1, 128, 8192, 8192, 128, 8192]
    - [9, 7.097]
  - - [8192, 8192, 1, 256, 8192, 8192, 256, 8192]
    - [9, 11.594]
  - - [8192, 8192, 1, 512, 8192, 8192, 512, 8192]
    - [43, 17.807]
  - - [8192, 8192, 1, 1024, 8192, 8192, 1024, 8192]
    - [44, 24.63]
  - - [8192, 8192, 1, 2048, 8192, 8192, 2048, 8192]
    - [40, 32.091]
  - - [8192, 8192, 1, 4096, 8192, 8192, 4096, 8192]
    - [42, 37.981]
  - - [8192, 8192, 1, 8192, 8192, 8192, 8192, 8192]
    - [42, 40.313]
  - - [1, 1, 1, 32, 1, 1, 32, 1]
    - [93, 0.0]
- null
- null
- DeviceEfficiency
- GridBased
