library/src/amd_detail/rocblaslt/src/Tensile/Logic/streamk/gfx942/aquavanjaram942_Cijk_Ailk_Bljk_BBS_BH_UserArgs.yaml
- {MinimumRequiredVersion: 4.33.0}
- aquavanjaram942
- gfx942
- [Device 0049, Device 0050]
    SolutionIndex: 0
    SolutionNameMin: Cijk_Ailk_Bljk_BBS_BH_UserArgs_MT256x256x32_MI16x16x1_SN_LDSB1_CLR1_GSU0_GSUC0_GSUWGMRR0_K1_LBSPPA2048_LBSPPB128_LPA32_MIWT8_8_PLR1_SU32_SUM0_SUS256_SKXCCM0_VWA2_VWB1_WGM1_WGMXCC1_WGMXCCGn1
    SolutionIndex: 1
    SolutionNameMin: Cijk_Ailk_Bljk_BBS_BH_UserArgs_MT256x128x32_MI16x16x1_SN_LDSB1_CLR1_GSU0_GSUC0_GSUWGMRR0_K1_LBSPPA2048_LBSPPB128_LPA0_MIWT8_4_PLR1_SU32_SUM0_SUS256_SKXCCM0_VWA4_VWB1_WGM1_WGMXCC1_WGMXCCGn1
    SolutionIndex: 2
    SolutionNameMin: Cijk_Ailk_Bljk_BBS_BH_UserArgs_MT32x32x32_MI16x16x1_SN_LDSB0_CLR1_GSU0_GSUC0_GSUWGMRR0_K1_LBSPPA256_LBSPPB128_LPA16_MIWT1_1_PLR1_SU32_SUM0_SUS256_SKXCCM0_VWA1_VWB1_WGM1_WGMXCC1_WGMXCCGn1
    SolutionIndex: 3
    SolutionNameMin: Cijk_Ailk_Bljk_BBS_BH_UserArgs_MT32x32x32_MI16x16x1_SN_LDSB0_CLR0_GSU0_GSUC0_GSUWGMRR0_K1_LBSPPA256_LBSPPB128_LPA16_MIWT1_1_PLR0_SU32_SUM0_SUS256_SKXCCM0_VWA1_VWB1_WGM1_WGMXCC1_WGMXCCGn1
    SolutionIndex: 4
    SolutionNameMin: Cijk_Ailk_Bljk_BBS_BH_UserArgs_MT128x256x64_MI16x16x1_SN_LDSB1_CLR1_GSU0_GSUC0_GSUWGMRR0_K1_LBSPPA2048_LBSPPB1024_LPA0_MIWT4_8_PLR1_SU32_SUM0_SUS256_SKXCCM0_VWA4_VWB8_WGM1_WGMXCC1_WGMXCCGn1
    SolutionIndex: 5
    SolutionNameMin: Cijk_Ailk_Bljk_BBS_BH_UserArgs_MT256x128x64_MI16x16x1_SN_LDSB1_CLR1_GSU0_GSUC0_GSUWGMRR0_K1_LBSPPA4096_LBSPPB256_LPA0_MIWT8_4_PLR1_SU32_SUM0_SUS256_SKXCCM0_VWA4_VWB2_WGM1_WGMXCC1_WGMXCCGn1
    SolutionIndex: 6
    SolutionNameMin: Cijk_Ailk_Bljk_BBS_BH_UserArgs_MT256x128x64_MI16x16x1_SN_LDSB1_CLR1_GSU0_GSUC0_GSUWGMRR0_K1_LBSPPA4096_LBSPPB128_LPA0_MIWT8_4_PLR1_SU32_SUM0_SUS256_SKXCCM0_VWA4_VWB1_WGM4_WGMXCC1_WGMXCCGn1
    SolutionIndex: 7
    SolutionNameMin: Cijk_Ailk_Bljk_BBS_BH_UserArgs_MT256x128x64_MI16x16x1_SN_LDSB1_CLR1_GSU0_GSUC0_GSUWGMRR0_K1_LBSPPA4096_LBSPPB512_LPA0_MIWT8_4_PLR1_SU32_SUM0_SUS256_SKXCCM0_VWA4_VWB4_WGM4_WGMXCC1_WGMXCCGn1
    SolutionIndex: 8
    SolutionNameMin: Cijk_Ailk_Bljk_BBS_BH_UserArgs_MT128x128x64_MI16x16x1_SN_LDSB1_CLR1_GSU0_GSUC0_GSUWGMRR0_K1_LBSPPA2048_LBSPPB256_LPA0_MIWT4_4_PLR1_SU32_SUM0_SUS256_SKXCCM0_VWA4_VWB2_WGM1_WGMXCC1_WGMXCCGn1
    SolutionIndex: 9
    SolutionNameMin: Cijk_Ailk_Bljk_BBS_BH_UserArgs_MT128x128x64_MI16x16x1_SN_LDSB1_CLR1_GSU0_GSUC0_GSUWGMRR0_K1_LBSPPA2048_LBSPPB512_LPA0_MIWT4_4_PLR1_SU32_SUM0_SUS256_SKXCCM0_VWA4_VWB4_WGM1_WGMXCC1_WGMXCCGn1
    SolutionIndex: 10
    SolutionNameMin: Cijk_Ailk_Bljk_BBS_BH_UserArgs_MT128x128x64_MI16x16x1_SN_LDSB1_CLR1_GSU0_GSUC0_GSUWGMRR0_K1_LBSPPA2048_LBSPPB256_LPA0_MIWT4_4_PLR1_SU32_SUM0_SUS256_SKXCCM0_VWA4_VWB2_WGM4_WGMXCC1_WGMXCCGn1
    SolutionIndex: 11
    SolutionNameMin: Cijk_Ailk_Bljk_BBS_BH_UserArgs_MT128x128x64_MI16x16x1_SN_LDSB1_CLR1_GSU0_GSUC0_GSUWGMRR0_K1_LBSPPA2048_LBSPPB256_LPA0_MIWT4_4_PLR1_SU32_SUM0_SUS256_SKXCCM0_VWA4_VWB2_WGM8_WGMXCC1_WGMXCCGn1
    SolutionIndex: 12
    SolutionNameMin: Cijk_Ailk_Bljk_BBS_BH_UserArgs_MT64x64x64_MI16x16x1_SN_LDSB1_CLR1_GSU0_GSUC0_GSUWGMRR0_K1_LBSPPA1024_LBSPPB256_LPA32_MIWT2_2_PLR1_SU32_SUM0_SUS256_SKXCCM0_VWA2_VWB2_WGM1_WGMXCC1_WGMXCCGn1
    SolutionIndex: 13
    SolutionNameMin: Cijk_Ailk_Bljk_BBS_BH_UserArgs_MT32x32x64_MI16x16x1_SN_LDSB0_CLR1_GSU0_GSUC0_GSUWGMRR0_K1_LBSPPA512_LBSPPB128_LPA16_MIWT1_1_PLR1_SU32_SUM0_SUS256_SKXCCM0_VWA1_VWB1_WGM1_WGMXCC1_WGMXCCGn1
    SolutionIndex: 14
    SolutionNameMin: Cijk_Ailk_Bljk_BBS_BH_UserArgs_MT64x128x128_MI16x16x1_SN_LDSB1_CLR1_GSU0_GSUC0_GSUWGMRR0_K1_LBSPPA1024_LBSPPB512_LPA32_MIWT2_4_PLR1_SU32_SUM0_SUS256_SKXCCM0_VWA2_VWB2_WGM1_WGMXCC1_WGMXCCGn1
    SolutionIndex: 15
    SolutionNameMin: Cijk_Ailk_Bljk_BBS_BH_UserArgs_MT64x128x128_MI16x16x1_SN_LDSB1_CLR1_GSU0_GSUC0_GSUWGMRR0_K1_LBSPPA1024_LBSPPB1024_LPA32_MIWT2_4_PLR1_SU32_SUM0_SUS256_SKXCCM0_VWA2_VWB4_WGM1_WGMXCC1_WGMXCCGn1
    SolutionIndex: 16
    SolutionNameMin: Cijk_Ailk_Bljk_BBS_BH_UserArgs_MT64x128x128_MI16x16x1_SN_LDSB1_CLR1_GSU0_GSUC0_GSUWGMRR0_K1_LBSPPA1024_LBSPPB512_LPA32_MIWT2_4_PLR2_SU32_SUM0_SUS256_SKXCCM0_VWA2_VWB2_WGM1_WGMXCC1_WGMXCCGn1
    SolutionIndex: 17
    SolutionNameMin: Cijk_Ailk_Bljk_BBS_BH_UserArgs_MT64x128x128_MI16x16x1_SN_LDSB1_CLR1_GSU0_GSUC0_GSUWGMRR0_K1_LBSPPA1024_LBSPPB512_LPA32_MIWT2_4_PLR2_SU32_SUM0_SUS256_SKXCCM0_VWA2_VWB2_WGM4_WGMXCC1_WGMXCCGn1
    SolutionIndex: 18
    SolutionNameMin: Cijk_Ailk_Bljk_BBS_BH_UserArgs_MT64x128x128_MI16x16x1_SN_LDSB1_CLR1_GSU0_GSUC0_GSUWGMRR0_K1_LBSPPA1024_LBSPPB512_LPA32_MIWT2_4_PLR2_SU32_SUM0_SUS256_SKXCCM0_VWA2_VWB2_WGM8_WGMXCC1_WGMXCCGn1
    SolutionIndex: 19
    SolutionNameMin: Cijk_Ailk_Bljk_BBS_BH_UserArgs_MT128x64x128_MI16x16x1_SN_LDSB1_CLR1_GSU0_GSUC0_GSUWGMRR0_K1_LBSPPA2048_LBSPPB256_LPA0_MIWT4_2_PLR1_SU32_SUM0_SUS256_SKXCCM0_VWA4_VWB1_WGM1_WGMXCC1_WGMXCCGn1
    SolutionIndex: 20
    SolutionNameMin: Cijk_Ailk_Bljk_BBS_BH_UserArgs_MT128x64x128_MI16x16x1_SN_LDSB1_CLR1_GSU0_GSUC0_GSUWGMRR0_K1_LBSPPA2048_LBSPPB256_LPA0_MIWT4_2_PLR2_SU32_SUM0_SUS256_SKXCCM0_VWA4_VWB1_WGM1_WGMXCC1_WGMXCCGn1
    SolutionIndex: 21
    SolutionNameMin: Cijk_Ailk_Bljk_BBS_BH_UserArgs_MT128x64x128_MI16x16x1_SN_LDSB1_CLR1_GSU0_GSUC0_GSUWGMRR0_K1_LBSPPA2048_LBSPPB512_LPA0_MIWT4_2_PLR2_SU32_SUM0_SUS256_SKXCCM0_VWA4_VWB2_WGM1_WGMXCC1_WGMXCCGn1
    SolutionIndex: 22
    SolutionNameMin: Cijk_Ailk_Bljk_BBS_BH_UserArgs_MT128x64x128_MI16x16x1_SN_LDSB1_CLR1_GSU0_GSUC0_GSUWGMRR0_K1_LBSPPA2048_LBSPPB256_LPA0_MIWT4_2_PLR1_SU32_SUM0_SUS256_SKXCCM0_VWA4_VWB1_WGM4_WGMXCC1_WGMXCCGn1
    SolutionIndex: 23
    SolutionNameMin: Cijk_Ailk_Bljk_BBS_BH_UserArgs_MT128x64x128_MI16x16x1_SN_LDSB1_CLR1_GSU0_GSUC0_GSUWGMRR0_K1_LBSPPA2048_LBSPPB256_LPA0_MIWT4_2_PLR2_SU32_SUM0_SUS256_SKXCCM0_VWA4_VWB1_WGM4_WGMXCC1_WGMXCCGn1
    SolutionIndex: 24
    SolutionNameMin: Cijk_Ailk_Bljk_BBS_BH_UserArgs_MT128x64x128_MI16x16x1_SN_LDSB1_CLR1_GSU0_GSUC0_GSUWGMRR0_K1_LBSPPA2048_LBSPPB512_LPA0_MIWT4_2_PLR2_SU32_SUM0_SUS256_SKXCCM0_VWA4_VWB2_WGM4_WGMXCC1_WGMXCCGn1
    SolutionIndex: 25
    SolutionNameMin: Cijk_Ailk_Bljk_BBS_BH_UserArgs_MT128x64x128_MI16x16x1_SN_LDSB1_CLR1_GSU0_GSUC0_GSUWGMRR0_K1_LBSPPA2048_LBSPPB256_LPA0_MIWT4_2_PLR1_SU32_SUM0_SUS256_SKXCCM0_VWA4_VWB1_WGM8_WGMXCC1_WGMXCCGn1
    SolutionIndex: 26
    SolutionNameMin: Cijk_Ailk_Bljk_BBS_BH_UserArgs_MT128x64x128_MI16x16x1_SN_LDSB1_CLR1_GSU0_GSUC0_GSUWGMRR0_K1_LBSPPA2048_LBSPPB512_LPA0_MIWT4_2_PLR1_SU32_SUM0_SUS256_SKXCCM0_VWA4_VWB2_WGM8_WGMXCC1_WGMXCCGn1
    SolutionIndex: 27
    SolutionNameMin: Cijk_Ailk_Bljk_BBS_BH_UserArgs_MT64x64x128_MI16x16x1_SN_LDSB1_CLR1_GSU0_GSUC0_GSUWGMRR0_K1_LBSPPA1024_LBSPPB256_LPA32_MIWT2_2_PLR2_SU32_SUM0_SUS256_SKXCCM0_VWA2_VWB1_WGM1_WGMXCC1_WGMXCCGn1
    SolutionIndex: 28
    SolutionNameMin: Cijk_Ailk_Bljk_BBS_BH_UserArgs_MT64x64x128_MI16x16x1_SN_LDSB1_CLR1_GSU0_GSUC0_GSUWGMRR0_K1_LBSPPA1024_LBSPPB512_LPA32_MIWT2_2_PLR2_SU32_SUM0_SUS256_SKXCCM0_VWA2_VWB2_WGM1_WGMXCC1_WGMXCCGn1
    SolutionIndex: 29
    SolutionNameMin: Cijk_Ailk_Bljk_BBS_BH_UserArgs_MT64x64x128_MI16x16x1_SN_LDSB1_CLR1_GSU0_GSUC0_GSUWGMRR0_K1_LBSPPA1024_LBSPPB512_LPA32_MIWT2_2_PLR2_SU32_SUM0_SUS256_SKXCCM0_VWA2_VWB2_WGM8_WGMXCC1_WGMXCCGn1
    SolutionIndex: 30
    SolutionNameMin: Cijk_Ailk_Bljk_BBS_BH_UserArgs_MT32x64x128_MI16x16x1_SN_LDSB1_CLR1_GSU0_GSUC0_GSUWGMRR0_K1_LBSPPA512_LBSPPB512_LPA16_MIWT1_2_PLR1_SU32_SUM0_SUS256_SKXCCM0_VWA1_VWB2_WGM1_WGMXCC1_WGMXCCGn1
    SolutionIndex: 31
    SolutionNameMin: Cijk_Ailk_Bljk_BBS_BH_UserArgs_MT32x64x128_MI16x16x1_SN_LDSB1_CLR1_GSU0_GSUC0_GSUWGMRR0_K1_LBSPPA512_LBSPPB512_LPA16_MIWT1_2_PLR2_SU32_SUM0_SUS256_SKXCCM0_VWA1_VWB2_WGM1_WGMXCC1_WGMXCCGn1
    SolutionIndex: 32
    SolutionNameMin: Cijk_Ailk_Bljk_BBS_BH_UserArgs_MT64x32x128_MI16x16x1_SN_LDSB1_CLR1_GSU0_GSUC0_GSUWGMRR0_K1_LBSPPA1024_LBSPPB256_LPA32_MIWT2_1_PLR1_SU32_SUM0_SUS256_SKXCCM0_VWA2_VWB1_WGM1_WGMXCC1_WGMXCCGn1
    SolutionIndex: 33
    SolutionNameMin: Cijk_Ailk_Bljk_BBS_BH_UserArgs_MT64x32x128_MI16x16x1_SN_LDSB1_CLR1_GSU0_GSUC0_GSUWGMRR0_K1_LBSPPA1024_LBSPPB256_LPA32_MIWT2_1_PLR2_SU32_SUM0_SUS256_SKXCCM0_VWA2_VWB1_WGM1_WGMXCC1_WGMXCCGn1
    SolutionIndex: 34
    SolutionNameMin: Cijk_Ailk_Bljk_BBS_BH_UserArgs_MT32x32x128_MI16x16x1_SN_LDSB1_CLR1_GSU0_GSUC0_GSUWGMRR0_K1_LBSPPA512_LBSPPB256_LPA16_MIWT1_1_PLR1_SU32_SUM0_SUS256_SKXCCM0_VWA1_VWB1_WGM1_WGMXCC1_WGMXCCGn1
    SolutionIndex: 35
    SolutionNameMin: Cijk_Ailk_Bljk_BBS_BH_UserArgs_MT32x32x128_MI16x16x1_SN_LDSB1_CLR1_GSU0_GSUC0_GSUWGMRR0_K1_LBSPPA512_LBSPPB256_LPA16_MIWT1_1_PLR2_SU32_SUM0_SUS256_SKXCCM0_VWA1_VWB1_WGM1_WGMXCC1_WGMXCCGn1
    SolutionIndex: 36
    SolutionNameMin: Cijk_Ailk_Bljk_BBS_BH_UserArgs_MT256x256x32_MI16x16x1_SN_LDSB1_CLR1_GSU0_GSUC0_GSUWGMRR0_K1_LBSPPA2048_LBSPPB128_LPA0_MIWT8_8_PLR1_SU32_SUM0_SUS256_SKXCCM8_VWA4_VWB2_WGM1_WGMXCC1_WGMXCCGn1
    SolutionIndex: 37
    SolutionNameMin: Cijk_Ailk_Bljk_BBS_BH_UserArgs_MT256x256x32_MI16x16x1_SN_LDSB1_CLR1_GSU0_GSUC0_GSUWGMRR0_K1_LBSPPA2048_LBSPPB256_LPA0_MIWT8_8_PLR1_SU32_SUM0_SUS256_SKXCCM8_VWA4_VWB4_WGM1_WGMXCC1_WGMXCCGn1
    SolutionIndex: 38
    SolutionNameMin: Cijk_Ailk_Bljk_BBS_BH_UserArgs_MT256x256x32_MI16x16x1_SN_LDSB1_CLR1_GSU0_GSUC0_GSUWGMRR0_K1_LBSPPA2048_LBSPPB512_LPA0_MIWT8_8_PLR1_SU32_SUM0_SUS256_SKXCCM8_VWA4_VWB8_WGM1_WGMXCC1_WGMXCCGn1
    SolutionIndex: 39
    SolutionNameMin: Cijk_Ailk_Bljk_BBS_BH_UserArgs_MT256x256x32_MI16x16x1_SN_LDSB1_CLR1_GSU0_GSUC0_GSUWGMRR0_K1_LBSPPA2048_LBSPPB128_LPA0_MIWT8_8_PLR1_SU32_SUM0_SUS256_SKXCCM8_VWA4_VWB1_WGM4_WGMXCC1_WGMXCCGn1
    SolutionIndex: 40
    SolutionNameMin: Cijk_Ailk_Bljk_BBS_BH_UserArgs_MT256x256x32_MI16x16x1_SN_LDSB1_CLR1_GSU0_GSUC0_GSUWGMRR0_K1_LBSPPA2048_LBSPPB128_LPA0_MIWT8_8_PLR1_SU32_SUM0_SUS256_SKXCCM8_VWA4_VWB2_WGM4_WGMXCC1_WGMXCCGn1
    SolutionIndex: 41
    SolutionNameMin: Cijk_Ailk_Bljk_BBS_BH_UserArgs_MT256x256x32_MI16x16x1_SN_LDSB1_CLR1_GSU0_GSUC0_GSUWGMRR0_K1_LBSPPA2048_LBSPPB256_LPA0_MIWT8_8_PLR1_SU32_SUM0_SUS256_SKXCCM8_VWA4_VWB4_WGM4_WGMXCC1_WGMXCCGn1
    SolutionIndex: 42
    SolutionNameMin: Cijk_Ailk_Bljk_BBS_BH_UserArgs_MT256x256x32_MI16x16x1_SN_LDSB1_CLR1_GSU0_GSUC0_GSUWGMRR0_K1_LBSPPA2048_LBSPPB512_LPA0_MIWT8_8_PLR1_SU32_SUM0_SUS256_SKXCCM8_VWA4_VWB8_WGM4_WGMXCC1_WGMXCCGn1
    SolutionIndex: 43
    SolutionNameMin: Cijk_Ailk_Bljk_BBS_BH_UserArgs_MT256x256x32_MI16x16x1_SN_LDSB1_CLR1_GSU0_GSUC0_GSUWGMRR0_K1_LBSPPA2048_LBSPPB256_LPA0_MIWT8_8_PLR1_SU32_SUM0_SUS256_SKXCCM8_VWA4_VWB4_WGM8_WGMXCC1_WGMXCCGn1
    SolutionIndex: 44
    SolutionNameMin: Cijk_Ailk_Bljk_BBS_BH_UserArgs_MT256x256x32_MI16x16x1_SN_LDSB1_CLR1_GSU0_GSUC0_GSUWGMRR0_K1_LBSPPA2048_LBSPPB512_LPA0_MIWT8_8_PLR1_SU32_SUM0_SUS256_SKXCCM8_VWA4_VWB8_WGM8_WGMXCC1_WGMXCCGn1
    SolutionIndex: 45
    SolutionNameMin: Cijk_Ailk_Bljk_BBS_BH_UserArgs_MT128x256x32_MI16x16x1_SN_LDSB1_CLR1_GSU0_GSUC0_GSUWGMRR0_K1_LBSPPA1024_LBSPPB256_LPA0_MIWT4_8_PLR1_SU32_SUM0_SUS256_SKXCCM8_VWA4_VWB4_WGM1_WGMXCC1_WGMXCCGn1
    SolutionIndex: 46
    SolutionNameMin: Cijk_Ailk_Bljk_BBS_BH_UserArgs_MT256x128x32_MI16x16x1_SN_LDSB1_CLR1_GSU0_GSUC0_GSUWGMRR0_K1_LBSPPA2048_LBSPPB256_LPA0_MIWT8_4_PLR1_SU32_SUM0_SUS256_SKXCCM8_VWA4_VWB4_WGM4_WGMXCC1_WGMXCCGn1
    SolutionIndex: 47
    SolutionNameMin: Cijk_Ailk_Bljk_BBS_BH_UserArgs_MT256x128x32_MI16x16x1_SN_LDSB1_CLR1_GSU0_GSUC0_GSUWGMRR0_K1_LBSPPA2048_LBSPPB128_LPA0_MIWT8_4_PLR1_SU32_SUM0_SUS256_SKXCCM8_VWA4_VWB1_WGM8_WGMXCC1_WGMXCCGn1
    SolutionIndex: 48
    SolutionNameMin: Cijk_Ailk_Bljk_BBS_BH_UserArgs_MT256x128x32_MI16x16x1_SN_LDSB1_CLR1_GSU0_GSUC0_GSUWGMRR0_K1_LBSPPA2048_LBSPPB128_LPA0_MIWT8_4_PLR1_SU32_SUM0_SUS256_SKXCCM8_VWA4_VWB2_WGM8_WGMXCC1_WGMXCCGn1
    SolutionIndex: 49
    SolutionNameMin: Cijk_Ailk_Bljk_BBS_BH_UserArgs_MT32x32x32_MI16x16x1_SN_LDSB0_CLR1_GSU0_GSUC0_GSUWGMRR0_K1_LBSPPA256_LBSPPB128_LPA16_MIWT1_1_PLR1_SU32_SUM0_SUS256_SKXCCM8_VWA1_VWB1_WGM1_WGMXCC1_WGMXCCGn1
    SolutionIndex: 50
    SolutionNameMin: Cijk_Ailk_Bljk_BBS_BH_UserArgs_MT32x32x32_MI16x16x1_SN_LDSB0_CLR0_GSU0_GSUC0_GSUWGMRR0_K1_LBSPPA256_LBSPPB128_LPA16_MIWT1_1_PLR0_SU32_SUM0_SUS256_SKXCCM8_VWA1_VWB1_WGM1_WGMXCC1_WGMXCCGn1
    SolutionIndex: 51
    SolutionNameMin: Cijk_Ailk_Bljk_BBS_BH_UserArgs_MT128x256x64_MI16x16x1_SN_LDSB1_CLR1_GSU0_GSUC0_GSUWGMRR0_K1_LBSPPA2048_LBSPPB128_LPA0_MIWT4_8_PLR1_SU32_SUM0_SUS256_SKXCCM8_VWA4_VWB1_WGM1_WGMXCC1_WGMXCCGn1
    SolutionIndex: 52
    SolutionNameMin: Cijk_Ailk_Bljk_BBS_BH_UserArgs_MT128x256x64_MI16x16x1_SN_LDSB1_CLR1_GSU0_GSUC0_GSUWGMRR0_K1_LBSPPA2048_LBSPPB256_LPA0_MIWT4_8_PLR1_SU32_SUM0_SUS256_SKXCCM8_VWA4_VWB2_WGM1_WGMXCC1_WGMXCCGn1
    SolutionIndex: 53
    SolutionNameMin: Cijk_Ailk_Bljk_BBS_BH_UserArgs_MT128x256x64_MI16x16x1_SN_LDSB1_CLR1_GSU0_GSUC0_GSUWGMRR0_K1_LBSPPA2048_LBSPPB512_LPA0_MIWT4_8_PLR1_SU32_SUM0_SUS256_SKXCCM8_VWA4_VWB4_WGM1_WGMXCC1_WGMXCCGn1
    SolutionIndex: 54
    SolutionNameMin: Cijk_Ailk_Bljk_BBS_BH_UserArgs_MT128x256x64_MI16x16x1_SN_LDSB1_CLR1_GSU0_GSUC0_GSUWGMRR0_K1_LBSPPA2048_LBSPPB1024_LPA0_MIWT4_8_PLR1_SU32_SUM0_SUS256_SKXCCM8_VWA4_VWB8_WGM1_WGMXCC1_WGMXCCGn1
    SolutionIndex: 55
    SolutionNameMin: Cijk_Ailk_Bljk_BBS_BH_UserArgs_MT128x256x64_MI16x16x1_SN_LDSB1_CLR1_GSU0_GSUC0_GSUWGMRR0_K1_LBSPPA2048_LBSPPB256_LPA0_MIWT4_8_PLR1_SU32_SUM0_SUS256_SKXCCM8_VWA4_VWB2_WGM4_WGMXCC1_WGMXCCGn1
    SolutionIndex: 56
    SolutionNameMin: Cijk_Ailk_Bljk_BBS_BH_UserArgs_MT128x256x64_MI16x16x1_SN_LDSB1_CLR1_GSU0_GSUC0_GSUWGMRR0_K1_LBSPPA2048_LBSPPB1024_LPA0_MIWT4_8_PLR1_SU32_SUM0_SUS256_SKXCCM8_VWA4_VWB8_WGM4_WGMXCC1_WGMXCCGn1
    SolutionIndex: 57
    SolutionNameMin: Cijk_Ailk_Bljk_BBS_BH_UserArgs_MT256x128x64_MI16x16x1_SN_LDSB1_CLR1_GSU0_GSUC0_GSUWGMRR0_K1_LBSPPA4096_LBSPPB256_LPA0_MIWT8_4_PLR1_SU32_SUM0_SUS256_SKXCCM8_VWA4_VWB2_WGM1_WGMXCC1_WGMXCCGn1
    SolutionIndex: 58
    SolutionNameMin: Cijk_Ailk_Bljk_BBS_BH_UserArgs_MT256x128x64_MI16x16x1_SN_LDSB1_CLR1_GSU0_GSUC0_GSUWGMRR0_K1_LBSPPA4096_LBSPPB512_LPA0_MIWT8_4_PLR1_SU32_SUM0_SUS256_SKXCCM8_VWA4_VWB4_WGM1_WGMXCC1_WGMXCCGn1
    SolutionIndex: 59
    SolutionNameMin: Cijk_Ailk_Bljk_BBS_BH_UserArgs_MT256x128x64_MI16x16x1_SN_LDSB1_CLR1_GSU0_GSUC0_GSUWGMRR0_K1_LBSPPA4096_LBSPPB128_LPA0_MIWT8_4_PLR1_SU32_SUM0_SUS256_SKXCCM8_VWA4_VWB1_WGM8_WGMXCC1_WGMXCCGn1
    SolutionIndex: 60
    SolutionNameMin: Cijk_Ailk_Bljk_BBS_BH_UserArgs_MT128x128x64_MI16x16x1_SN_LDSB1_CLR1_GSU0_GSUC0_GSUWGMRR0_K1_LBSPPA2048_LBSPPB128_LPA0_MIWT4_4_PLR1_SU32_SUM0_SUS256_SKXCCM8_VWA4_VWB1_WGM1_WGMXCC1_WGMXCCGn1
    SolutionIndex: 61
    SolutionNameMin: Cijk_Ailk_Bljk_BBS_BH_UserArgs_MT128x128x64_MI16x16x1_SN_LDSB1_CLR1_GSU0_GSUC0_GSUWGMRR0_K1_LBSPPA2048_LBSPPB256_LPA0_MIWT4_4_PLR1_SU32_SUM0_SUS256_SKXCCM8_VWA4_VWB2_WGM1_WGMXCC1_WGMXCCGn1
    SolutionIndex: 62
    SolutionNameMin: Cijk_Ailk_Bljk_BBS_BH_UserArgs_MT128x128x64_MI16x16x1_SN_LDSB1_CLR1_GSU0_GSUC0_GSUWGMRR0_K1_LBSPPA2048_LBSPPB512_LPA32_MIWT4_4_PLR1_SU32_SUM0_SUS256_SKXCCM8_VWA2_VWB4_WGM1_WGMXCC1_WGMXCCGn1
    SolutionIndex: 63
    SolutionNameMin: Cijk_Ailk_Bljk_BBS_BH_UserArgs_MT128x128x64_MI16x16x1_SN_LDSB1_CLR1_GSU0_GSUC0_GSUWGMRR0_K1_LBSPPA2048_LBSPPB512_LPA0_MIWT4_4_PLR1_SU32_SUM0_SUS256_SKXCCM8_VWA4_VWB4_WGM1_WGMXCC1_WGMXCCGn1
    SolutionIndex: 64
    SolutionNameMin: Cijk_Ailk_Bljk_BBS_BH_UserArgs_MT128x128x64_MI16x16x1_SN_LDSB1_CLR1_GSU0_GSUC0_GSUWGMRR0_K1_LBSPPA2048_LBSPPB128_LPA0_MIWT4_4_PLR1_SU32_SUM0_SUS256_SKXCCM8_VWA4_VWB1_WGM4_WGMXCC1_WGMXCCGn1
    SolutionIndex: 65
    SolutionNameMin: Cijk_Ailk_Bljk_BBS_BH_UserArgs_MT128x128x64_MI16x16x1_SN_LDSB1_CLR1_GSU0_GSUC0_GSUWGMRR0_K1_LBSPPA2048_LBSPPB128_LPA0_MIWT4_4_PLR1_SU32_SUM0_SUS256_SKXCCM8_VWA4_VWB1_WGM8_WGMXCC1_WGMXCCGn1
    SolutionIndex: 66
    SolutionNameMin: Cijk_Ailk_Bljk_BBS_BH_UserArgs_MT128x128x64_MI16x16x1_SN_LDSB1_CLR1_GSU0_GSUC0_GSUWGMRR0_K1_LBSPPA2048_LBSPPB512_LPA0_MIWT4_4_PLR1_SU32_SUM0_SUS256_SKXCCM8_VWA4_VWB4_WGM8_WGMXCC1_WGMXCCGn1
    SolutionIndex: 67
    SolutionNameMin: Cijk_Ailk_Bljk_BBS_BH_UserArgs_MT64x128x64_MI16x16x1_SN_LDSB1_CLR1_GSU0_GSUC0_GSUWGMRR0_K1_LBSPPA1024_LBSPPB128_LPA32_MIWT2_4_PLR1_SU32_SUM0_SUS256_SKXCCM8_VWA2_VWB1_WGM1_WGMXCC1_WGMXCCGn1
    SolutionIndex: 68
    SolutionNameMin: Cijk_Ailk_Bljk_BBS_BH_UserArgs_MT64x128x64_MI16x16x1_SN_LDSB1_CLR1_GSU0_GSUC0_GSUWGMRR0_K1_LBSPPA1024_LBSPPB256_LPA32_MIWT2_4_PLR1_SU32_SUM0_SUS256_SKXCCM8_VWA2_VWB2_WGM1_WGMXCC1_WGMXCCGn1
    SolutionIndex: 69
    SolutionNameMin: Cijk_Ailk_Bljk_BBS_BH_UserArgs_MT64x128x64_MI16x16x1_SN_LDSB1_CLR1_GSU0_GSUC0_GSUWGMRR0_K1_LBSPPA1024_LBSPPB512_LPA32_MIWT2_4_PLR1_SU32_SUM0_SUS256_SKXCCM8_VWA2_VWB4_WGM1_WGMXCC1_WGMXCCGn1
    SolutionIndex: 70
    SolutionNameMin: Cijk_Ailk_Bljk_BBS_BH_UserArgs_MT64x128x64_MI16x16x1_SN_LDSB1_CLR1_GSU0_GSUC0_GSUWGMRR0_K1_LBSPPA1024_LBSPPB128_LPA32_MIWT2_4_PLR1_SU32_SUM0_SUS256_SKXCCM8_VWA2_VWB1_WGM4_WGMXCC1_WGMXCCGn1
    SolutionIndex: 71
    SolutionNameMin: Cijk_Ailk_Bljk_BBS_BH_UserArgs_MT128x64x64_MI16x16x1_SN_LDSB1_CLR1_GSU0_GSUC0_GSUWGMRR0_K1_LBSPPA2048_LBSPPB128_LPA0_MIWT4_2_PLR1_SU32_SUM0_SUS256_SKXCCM8_VWA4_VWB1_WGM1_WGMXCC1_WGMXCCGn1
    SolutionIndex: 72
    SolutionNameMin: Cijk_Ailk_Bljk_BBS_BH_UserArgs_MT128x64x64_MI16x16x1_SN_LDSB1_CLR1_GSU0_GSUC0_GSUWGMRR0_K1_LBSPPA2048_LBSPPB256_LPA0_MIWT4_2_PLR1_SU32_SUM0_SUS256_SKXCCM8_VWA4_VWB2_WGM1_WGMXCC1_WGMXCCGn1
    SolutionIndex: 73
    SolutionNameMin: Cijk_Ailk_Bljk_BBS_BH_UserArgs_MT128x64x64_MI16x16x1_SN_LDSB1_CLR1_GSU0_GSUC0_GSUWGMRR0_K1_LBSPPA2048_LBSPPB128_LPA0_MIWT4_2_PLR1_SU32_SUM0_SUS256_SKXCCM8_VWA4_VWB1_WGM4_WGMXCC1_WGMXCCGn1
    SolutionIndex: 74
    SolutionNameMin: Cijk_Ailk_Bljk_BBS_BH_UserArgs_MT128x64x64_MI16x16x1_SN_LDSB1_CLR1_GSU0_GSUC0_GSUWGMRR0_K1_LBSPPA2048_LBSPPB128_LPA0_MIWT4_2_PLR1_SU32_SUM0_SUS256_SKXCCM8_VWA4_VWB1_WGM8_WGMXCC1_WGMXCCGn1
    SolutionIndex: 75
    SolutionNameMin: Cijk_Ailk_Bljk_BBS_BH_UserArgs_MT64x64x64_MI16x16x1_SN_LDSB1_CLR1_GSU0_GSUC0_GSUWGMRR0_K1_LBSPPA1024_LBSPPB128_LPA32_MIWT2_2_PLR1_SU32_SUM0_SUS256_SKXCCM8_VWA2_VWB1_WGM1_WGMXCC1_WGMXCCGn1
    SolutionIndex: 76
    SolutionNameMin: Cijk_Ailk_Bljk_BBS_BH_UserArgs_MT64x64x64_MI16x16x1_SN_LDSB1_CLR1_GSU0_GSUC0_GSUWGMRR0_K1_LBSPPA1024_LBSPPB256_LPA32_MIWT2_2_PLR1_SU32_SUM0_SUS256_SKXCCM8_VWA2_VWB2_WGM1_WGMXCC1_WGMXCCGn1
    SolutionIndex: 77
    SolutionNameMin: Cijk_Ailk_Bljk_BBS_BH_UserArgs_MT64x64x64_MI16x16x1_SN_LDSB1_CLR1_GSU0_GSUC0_GSUWGMRR0_K1_LBSPPA1024_LBSPPB128_LPA32_MIWT2_2_PLR1_SU32_SUM0_SUS256_SKXCCM8_VWA2_VWB1_WGM4_WGMXCC1_WGMXCCGn1
    SolutionIndex: 78
    SolutionNameMin: Cijk_Ailk_Bljk_BBS_BH_UserArgs_MT64x64x64_MI16x16x1_SN_LDSB1_CLR1_GSU0_GSUC0_GSUWGMRR0_K1_LBSPPA1024_LBSPPB256_LPA32_MIWT2_2_PLR1_SU32_SUM0_SUS256_SKXCCM8_VWA2_VWB2_WGM4_WGMXCC1_WGMXCCGn1
    SolutionIndex: 79
    SolutionNameMin: Cijk_Ailk_Bljk_BBS_BH_UserArgs_MT64x64x64_MI16x16x1_SN_LDSB1_CLR1_GSU0_GSUC0_GSUWGMRR0_K1_LBSPPA1024_LBSPPB128_LPA32_MIWT2_2_PLR1_SU32_SUM0_SUS256_SKXCCM8_VWA2_VWB1_WGM8_WGMXCC1_WGMXCCGn1
    SolutionIndex: 80
    SolutionNameMin: Cijk_Ailk_Bljk_BBS_BH_UserArgs_MT32x64x64_MI16x16x1_SN_LDSB0_CLR1_GSU0_GSUC0_GSUWGMRR0_K1_LBSPPA512_LBSPPB256_LPA16_MIWT1_2_PLR1_SU32_SUM0_SUS256_SKXCCM8_VWA1_VWB2_WGM1_WGMXCC1_WGMXCCGn1
    SolutionIndex: 81
    SolutionNameMin: Cijk_Ailk_Bljk_BBS_BH_UserArgs_MT32x32x64_MI16x16x1_SN_LDSB0_CLR1_GSU0_GSUC0_GSUWGMRR0_K1_LBSPPA512_LBSPPB128_LPA16_MIWT1_1_PLR1_SU32_SUM0_SUS256_SKXCCM8_VWA1_VWB1_WGM1_WGMXCC1_WGMXCCGn1
    SolutionIndex: 82
    SolutionNameMin: Cijk_Ailk_Bljk_BBS_BH_UserArgs_MT32x32x64_MI16x16x1_SN_LDSB0_CLR1_GSU0_GSUC0_GSUWGMRR0_K1_LBSPPA512_LBSPPB128_LPA16_MIWT1_1_PLR1_SU32_SUM0_SUS256_SKXCCM8_VWA1_VWB1_WGM4_WGMXCC1_WGMXCCGn1
    SolutionIndex: 83
    SolutionNameMin: Cijk_Ailk_Bljk_BBS_BH_UserArgs_MT64x128x128_MI16x16x1_SN_LDSB1_CLR1_GSU0_GSUC0_GSUWGMRR0_K1_LBSPPA1024_LBSPPB256_LPA32_MIWT2_4_PLR2_SU32_SUM0_SUS256_SKXCCM8_VWA2_VWB1_WGM1_WGMXCC1_WGMXCCGn1
    SolutionIndex: 84
    SolutionNameMin: Cijk_Ailk_Bljk_BBS_BH_UserArgs_MT128x64x128_MI16x16x1_SN_LDSB1_CLR1_GSU0_GSUC0_GSUWGMRR0_K1_LBSPPA2048_LBSPPB256_LPA0_MIWT4_2_PLR1_SU32_SUM0_SUS256_SKXCCM8_VWA4_VWB1_WGM1_WGMXCC1_WGMXCCGn1
    SolutionIndex: 85
    SolutionNameMin: Cijk_Ailk_Bljk_BBS_BH_UserArgs_MT128x64x128_MI16x16x1_SN_LDSB1_CLR1_GSU0_GSUC0_GSUWGMRR0_K1_LBSPPA2048_LBSPPB512_LPA0_MIWT4_2_PLR1_SU32_SUM0_SUS256_SKXCCM8_VWA4_VWB2_WGM1_WGMXCC1_WGMXCCGn1
    SolutionIndex: 86
    SolutionNameMin: Cijk_Ailk_Bljk_BBS_BH_UserArgs_MT128x64x128_MI16x16x1_SN_LDSB1_CLR1_GSU0_GSUC0_GSUWGMRR0_K1_LBSPPA2048_LBSPPB256_LPA0_MIWT4_2_PLR2_SU32_SUM0_SUS256_SKXCCM8_VWA4_VWB1_WGM1_WGMXCC1_WGMXCCGn1
    SolutionIndex: 87
    SolutionNameMin: Cijk_Ailk_Bljk_BBS_BH_UserArgs_MT128x64x128_MI16x16x1_SN_LDSB1_CLR1_GSU0_GSUC0_GSUWGMRR0_K1_LBSPPA2048_LBSPPB512_LPA0_MIWT4_2_PLR2_SU32_SUM0_SUS256_SKXCCM8_VWA4_VWB2_WGM1_WGMXCC1_WGMXCCGn1
    SolutionIndex: 88
    SolutionNameMin: Cijk_Ailk_Bljk_BBS_BH_UserArgs_MT128x64x128_MI16x16x1_SN_LDSB1_CLR1_GSU0_GSUC0_GSUWGMRR0_K1_LBSPPA2048_LBSPPB256_LPA0_MIWT4_2_PLR1_SU32_SUM0_SUS256_SKXCCM8_VWA4_VWB1_WGM4_WGMXCC1_WGMXCCGn1
    SolutionIndex: 89
    SolutionNameMin: Cijk_Ailk_Bljk_BBS_BH_UserArgs_MT128x64x128_MI16x16x1_SN_LDSB1_CLR1_GSU0_GSUC0_GSUWGMRR0_K1_LBSPPA2048_LBSPPB512_LPA0_MIWT4_2_PLR1_SU32_SUM0_SUS256_SKXCCM8_VWA4_VWB2_WGM8_WGMXCC1_WGMXCCGn1
    SolutionIndex: 90
    SolutionNameMin: Cijk_Ailk_Bljk_BBS_BH_UserArgs_MT128x64x128_MI16x16x1_SN_LDSB1_CLR1_GSU0_GSUC0_GSUWGMRR0_K1_LBSPPA2048_LBSPPB256_LPA0_MIWT4_2_PLR2_SU32_SUM0_SUS256_SKXCCM8_VWA4_VWB1_WGM8_WGMXCC1_WGMXCCGn1
    SolutionIndex: 91
    SolutionNameMin: Cijk_Ailk_Bljk_BBS_BH_UserArgs_MT128x64x128_MI16x16x1_SN_LDSB1_CLR1_GSU0_GSUC0_GSUWGMRR0_K1_LBSPPA2048_LBSPPB512_LPA0_MIWT4_2_PLR2_SU32_SUM0_SUS256_SKXCCM8_VWA4_VWB2_WGM8_WGMXCC1_WGMXCCGn1
    SolutionIndex: 92
    SolutionNameMin: Cijk_Ailk_Bljk_BBS_BH_UserArgs_MT64x64x128_MI16x16x1_SN_LDSB1_CLR1_GSU0_GSUC0_GSUWGMRR0_K1_LBSPPA1024_LBSPPB256_LPA32_MIWT2_2_PLR2_SU32_SUM0_SUS256_SKXCCM8_VWA2_VWB1_WGM1_WGMXCC1_WGMXCCGn1
    SolutionIndex: 93
    SolutionNameMin: Cijk_Ailk_Bljk_BBS_BH_UserArgs_MT64x64x128_MI16x16x1_SN_LDSB1_CLR1_GSU0_GSUC0_GSUWGMRR0_K1_LBSPPA1024_LBSPPB512_LPA32_MIWT2_2_PLR2_SU32_SUM0_SUS256_SKXCCM8_VWA2_VWB2_WGM1_WGMXCC1_WGMXCCGn1
    SolutionIndex: 94
    SolutionNameMin: Cijk_Ailk_Bljk_BBS_BH_UserArgs_MT64x64x128_MI16x16x1_SN_LDSB1_CLR1_GSU0_GSUC0_GSUWGMRR0_K1_LBSPPA1024_LBSPPB256_LPA32_MIWT2_2_PLR2_SU32_SUM0_SUS256_SKXCCM8_VWA2_VWB1_WGM4_WGMXCC1_WGMXCCGn1
    SolutionIndex: 95
    SolutionNameMin: Cijk_Ailk_Bljk_BBS_BH_UserArgs_MT64x64x128_MI16x16x1_SN_LDSB1_CLR1_GSU0_GSUC0_GSUWGMRR0_K1_LBSPPA1024_LBSPPB512_LPA32_MIWT2_2_PLR2_SU32_SUM0_SUS256_SKXCCM8_VWA2_VWB2_WGM4_WGMXCC1_WGMXCCGn1
    SolutionIndex: 96
    SolutionNameMin: Cijk_Ailk_Bljk_BBS_BH_UserArgs_MT64x64x128_MI16x16x1_SN_LDSB1_CLR1_GSU0_GSUC0_GSUWGMRR0_K1_LBSPPA1024_LBSPPB256_LPA32_MIWT2_2_PLR2_SU32_SUM0_SUS256_SKXCCM8_VWA2_VWB1_WGM8_WGMXCC1_WGMXCCGn1
    SolutionIndex: 97
    SolutionNameMin: Cijk_Ailk_Bljk_BBS_BH_UserArgs_MT64x64x128_MI16x16x1_SN_LDSB1_CLR1_GSU0_GSUC0_GSUWGMRR0_K1_LBSPPA1024_LBSPPB512_LPA32_MIWT2_2_PLR2_SU32_SUM0_SUS256_SKXCCM8_VWA2_VWB2_WGM8_WGMXCC1_WGMXCCGn1
    SolutionIndex: 98
    SolutionNameMin: Cijk_Ailk_Bljk_BBS_BH_UserArgs_MT32x64x128_MI16x16x1_SN_LDSB1_CLR1_GSU0_GSUC0_GSUWGMRR0_K1_LBSPPA512_LBSPPB512_LPA16_MIWT1_2_PLR2_SU32_SUM0_SUS256_SKXCCM8_VWA1_VWB2_WGM8_WGMXCC1_WGMXCCGn1
    SolutionIndex: 99
    SolutionNameMin: Cijk_Ailk_Bljk_BBS_BH_UserArgs_MT64x32x128_MI16x16x1_SN_LDSB1_CLR1_GSU0_GSUC0_GSUWGMRR0_K1_LBSPPA1024_LBSPPB256_LPA32_MIWT2_1_PLR2_SU32_SUM0_SUS256_SKXCCM8_VWA2_VWB1_WGM1_WGMXCC1_WGMXCCGn1
    SolutionIndex: 100
    SolutionNameMin: Cijk_Ailk_Bljk_BBS_BH_UserArgs_MT64x32x128_MI16x16x1_SN_LDSB1_CLR1_GSU0_GSUC0_GSUWGMRR0_K1_LBSPPA1024_LBSPPB256_LPA32_MIWT2_1_PLR1_SU32_SUM0_SUS256_SKXCCM8_VWA2_VWB1_WGM8_WGMXCC1_WGMXCCGn1
    SolutionIndex: 101
    SolutionNameMin: Cijk_Ailk_Bljk_BBS_BH_UserArgs_MT64x32x128_MI16x16x1_SN_LDSB1_CLR1_GSU0_GSUC0_GSUWGMRR0_K1_LBSPPA1024_LBSPPB256_LPA32_MIWT2_1_PLR2_SU32_SUM0_SUS256_SKXCCM8_VWA2_VWB1_WGM8_WGMXCC1_WGMXCCGn1
    SolutionIndex: 102
    SolutionNameMin: Cijk_Ailk_Bljk_BBS_BH_UserArgs_MT32x32x128_MI16x16x1_SN_LDSB1_CLR1_GSU0_GSUC0_GSUWGMRR0_K1_LBSPPA512_LBSPPB256_LPA16_MIWT1_1_PLR1_SU32_SUM0_SUS256_SKXCCM8_VWA1_VWB1_WGM1_WGMXCC1_WGMXCCGn1
    SolutionIndex: 103
    SolutionNameMin: Cijk_Ailk_Bljk_BBS_BH_UserArgs_MT32x32x128_MI16x16x1_SN_LDSB1_CLR1_GSU0_GSUC0_GSUWGMRR0_K1_LBSPPA512_LBSPPB256_LPA16_MIWT1_1_PLR2_SU32_SUM0_SUS256_SKXCCM8_VWA1_VWB1_WGM1_WGMXCC1_WGMXCCGn1
    SolutionIndex: 104
    SolutionNameMin: Cijk_Ailk_Bljk_BBS_BH_UserArgs_MT32x32x128_MI16x16x1_SN_LDSB1_CLR1_GSU0_GSUC0_GSUWGMRR0_K1_LBSPPA512_LBSPPB256_LPA16_MIWT1_1_PLR1_SU32_SUM0_SUS256_SKXCCM8_VWA1_VWB1_WGM4_WGMXCC1_WGMXCCGn1
    SolutionIndex: 105
    SolutionNameMin: Cijk_Ailk_Bljk_BBS_BH_UserArgs_MT32x32x128_MI16x16x1_SN_LDSB1_CLR1_GSU0_GSUC0_GSUWGMRR0_K1_LBSPPA512_LBSPPB256_LPA16_MIWT1_1_PLR2_SU32_SUM0_SUS256_SKXCCM8_VWA1_VWB1_WGM4_WGMXCC1_WGMXCCGn1
    SolutionIndex: 106
    SolutionNameMin: Cijk_Ailk_Bljk_BBS_BH_UserArgs_MT32x32x128_MI16x16x1_SN_LDSB1_CLR1_GSU0_GSUC0_GSUWGMRR0_K1_LBSPPA512_LBSPPB256_LPA16_MIWT1_1_PLR1_SU32_SUM0_SUS256_SKXCCM8_VWA1_VWB1_WGM8_WGMXCC1_WGMXCCGn1
    SolutionIndex: 107
    SolutionNameMin: Cijk_Ailk_Bljk_BBS_BH_UserArgs_MT32x32x32_MI16x16x1_SN_LDSB0_CLR1_GSU0_GSUC0_GSUWGMRR0_K1_LBSPPA256_LBSPPB128_LPA16_MIWT1_1_PLR1_SU32_SUM0_SUS256_SKXCCM0_VWA1_VWB1_WGM1_WGMXCC1_WGMXCCGn1
- - - [128, 128, 1, 128, 128, 128, 128, 128]
    - [34, 0.084]
  - - [128, 128, 1, 256, 128, 128, 128, 256]
    - [35, 0.104]
  - - [128, 128, 1, 512, 128, 128, 128, 512]
    - [35, 0.178]
  - - [128, 128, 1, 1024, 128, 128, 128, 1024]
    - [104, 0.262]
  - - [128, 128, 1, 2048, 128, 128, 128, 2048]
    - [105, 0.332]
  - - [128, 128, 1, 4096, 128, 128, 128, 4096]
    - [3, 0.526]
  - - [128, 128, 1, 8192, 128, 128, 128, 8192]
    - [49, 1.025]
  - - [128, 256, 1, 128, 128, 128, 128, 128]
    - [34, 0.155]
  - - [128, 256, 1, 256, 128, 128, 128, 256]
    - [35, 0.205]
  - - [128, 256, 1, 512, 128, 128, 128, 512]
    - [103, 0.329]
  - - [128, 256, 1, 1024, 128, 128, 128, 1024]
    - [102, 0.524]
  - - [128, 256, 1, 2048, 128, 128, 128, 2048]
    - [2, 0.808]
  - - [128, 256, 1, 4096, 128, 128, 128, 4096]
    - [13, 1.54]
  - - [128, 256, 1, 8192, 128, 128, 128, 8192]
    - [81, 2.691]
  - - [128, 512, 1, 128, 128, 128, 128, 128]
    - [103, 0.319]
  - - [128, 512, 1, 256, 128, 128, 128, 256]
    - [34, 0.398]
  - - [128, 512, 1, 512, 128, 128, 128, 512]
    - [102, 0.655]
  - - [128, 512, 1, 1024, 128, 128, 128, 1024]
    - [81, 1.062]
  - - [128, 512, 1, 2048, 128, 128, 128, 2048]
    - [102, 1.996]
  - - [128, 512, 1, 4096, 128, 128, 128, 4096]
    - [102, 3.348]
  - - [128, 512, 1, 8192, 128, 128, 128, 8192]
    - [81, 5.344]
  - - [128, 1024, 1, 128, 128, 128, 128, 128]
    - [35, 0.668]
  - - [128, 1024, 1, 256, 128, 128, 128, 256]
    - [102, 0.777]
  - - [128, 1024, 1, 512, 128, 128, 128, 512]
    - [102, 1.381]
  - - [128, 1024, 1, 1024, 128, 128, 128, 1024]
    - [102, 2.326]
  - - [128, 1024, 1, 2048, 128, 128, 128, 2048]
    - [35, 3.862]
  - - [128, 1024, 1, 4096, 128, 128, 128, 4096]
    - [99, 5.938]
  - - [128, 1024, 1, 8192, 128, 128, 128, 8192]
    - [99, 8.809]
  - - [128, 2048, 1, 128, 128, 128, 128, 128]
    - [106, 1.178]
  - - [128, 2048, 1, 256, 128, 128, 128, 256]
    - [35, 1.596]
  - - [128, 2048, 1, 512, 128, 128, 128, 512]
    - [35, 2.57]
  - - [128, 2048, 1, 1024, 128, 128, 128, 1024]
    - [99, 4.147]
  - - [128, 2048, 1, 2048, 128, 128, 128, 2048]
    - [99, 6.68]
  - - [128, 2048, 1, 4096, 128, 128, 128, 4096]
    - [99, 9.752]
  - - [128, 2048, 1, 8192, 128, 128, 128, 8192]
    - [77, 12.219]
  - - [128, 4096, 1, 128, 128, 128, 128, 128]
    - [33, 2.39]
  - - [128, 4096, 1, 256, 128, 128, 128, 256]
    - [30, 2.922]
  - - [128, 4096, 1, 512, 128, 128, 128, 512]
    - [99, 4.608]
  - - [128, 4096, 1, 1024, 128, 128, 128, 1024]
    - [33, 7.3]
  - - [128, 4096, 1, 2048, 128, 128, 128, 2048]
    - [76, 10.586]
  - - [128, 4096, 1, 4096, 128, 128, 128, 4096]
    - [95, 13.752]
  - - [128, 4096, 1, 8192, 128, 128, 128, 8192]
    - [19, 17.019]
  - - [128, 8192, 1, 128, 128, 128, 128, 128]
    - [27, 4.192]
  - - [128, 8192, 1, 256, 128, 128, 128, 256]
    - [27, 5.125]
  - - [128, 8192, 1, 512, 128, 128, 128, 512]
    - [92, 7.939]
  - - [128, 8192, 1, 1024, 128, 128, 128, 1024]
    - [92, 11.947]
  - - [128, 8192, 1, 2048, 128, 128, 128, 2048]
    - [87, 14.512]
  - - [128, 8192, 1, 4096, 128, 128, 128, 4096]
    - [24, 18.288]
  - - [128, 8192, 1, 8192, 128, 128, 128, 8192]
    - [21, 22.222]
  - - [256, 128, 1, 128, 256, 256, 256, 128]
    - [34, 0.164]
  - - [256, 128, 1, 256, 256, 256, 256, 256]
    - [35, 0.203]
  - - [256, 128, 1, 512, 256, 256, 256, 512]
    - [104, 0.332]
  - - [256, 128, 1, 1024, 256, 256, 256, 1024]
    - [104, 0.49]
  - - [256, 128, 1, 2048, 256, 256, 256, 2048]
    - [2, 0.775]
  - - [256, 128, 1, 4096, 256, 256, 256, 4096]
    - [50, 1.462]
  - - [256, 128, 1, 8192, 256, 256, 256, 8192]
    - [106, 2.574]
  - - [256, 256, 1, 128, 256, 256, 256, 128]
    - [34, 0.33]
  - - [256, 256, 1, 256, 256, 256, 256, 256]
    - [35, 0.405]
  - - [256, 256, 1, 512, 256, 256, 256, 512]
    - [102, 0.654]
  - - [256, 256, 1, 1024, 256, 256, 256, 1024]
    - [81, 1.079]
  - - [256, 256, 1, 2048, 256, 256, 256, 2048]
    - [102, 2.003]
  - - [256, 256, 1, 4096, 256, 256, 256, 4096]
    - [102, 3.408]
  - - [256, 256, 1, 8192, 256, 256, 256, 8192]
    - [104, 4.982]
  - - [256, 512, 1, 128, 256, 256, 256, 128]
    - [35, 0.651]
  - - [256, 512, 1, 256, 256, 256, 256, 256]
    - [35, 0.763]
  - - [256, 512, 1, 512, 256, 256, 256, 512]
    - [103, 1.368]
  - - [256, 512, 1, 1024, 256, 256, 256, 1024]
    - [102, 2.269]
  - - [256, 512, 1, 2048, 256, 256, 256, 2048]
    - [35, 3.83]
  - - [256, 512, 1, 4096, 256, 256, 256, 4096]
    - [80, 5.821]
  - - [256, 512, 1, 8192, 256, 256, 256, 8192]
    - [100, 7.957]
  - - [256, 1024, 1, 128, 256, 256, 256, 128]
    - [102, 1.258]
  - - [256, 1024, 1, 256, 256, 256, 256, 256]
    - [34, 1.588]
  - - [256, 1024, 1, 512, 256, 256, 256, 512]
    - [103, 2.574]
  - - [256, 1024, 1, 1024, 256, 256, 256, 1024]
    - [99, 4.064]
  - - [256, 1024, 1, 2048, 256, 256, 256, 2048]
    - [99, 6.586]
  - - [256, 1024, 1, 4096, 256, 256, 256, 4096]
    - [99, 10.025]
  - - [256, 1024, 1, 8192, 256, 256, 256, 8192]
    - [75, 12.291]
  - - [256, 2048, 1, 128, 256, 256, 256, 128]
    - [33, 2.412]
  - - [256, 2048, 1, 256, 256, 256, 256, 256]
    - [31, 2.849]
  - - [256, 2048, 1, 512, 256, 256, 256, 512]
    - [99, 4.706]
  - - [256, 2048, 1, 1024, 256, 256, 256, 1024]
    - [99, 7.176]
  - - [256, 2048, 1, 2048, 256, 256, 256, 2048]
    - [76, 10.507]
  - - [256, 2048, 1, 4096, 256, 256, 256, 4096]
    - [92, 13.673]
  - - [256, 2048, 1, 8192, 256, 256, 256, 8192]
    - [72, 16.135]
  - - [256, 4096, 1, 128, 256, 256, 256, 128]
    - [93, 4.076]
  - - [256, 4096, 1, 256, 256, 256, 256, 256]
    - [28, 5.031]
  - - [256, 4096, 1, 512, 256, 256, 256, 512]
    - [93, 8.056]
  - - [256, 4096, 1, 1024, 256, 256, 256, 1024]
    - [92, 11.83]
  - - [256, 4096, 1, 2048, 256, 256, 256, 2048]
    - [87, 15.316]
  - - [256, 4096, 1, 4096, 256, 256, 256, 4096]
    - [74, 18.596]
  - - [256, 4096, 1, 8192, 256, 256, 256, 8192]
    - [63, 21.685]
  - - [256, 8192, 1, 128, 256, 256, 256, 128]
    - [85, 6.414]
  - - [256, 8192, 1, 256, 256, 256, 256, 256]
    - [15, 8.205]
  - - [256, 8192, 1, 512, 256, 256, 256, 512]
    - [71, 11.107]
  - - [256, 8192, 1, 1024, 256, 256, 256, 1024]
    - [86, 15.858]
  - - [256, 8192, 1, 2048, 256, 256, 256, 2048]
    - [91, 19.055]
  - - [256, 8192, 1, 4096, 256, 256, 256, 4096]
    - [66, 23.829]
  - - [256, 8192, 1, 8192, 256, 256, 256, 8192]
    - [11, 27.551]
  - - [512, 128, 1, 128, 512, 512, 512, 128]
    - [102, 0.319]
  - - [512, 128, 1, 256, 512, 512, 512, 256]
    - [35, 0.381]
  - - [512, 128, 1, 512, 512, 512, 512, 512]
    - [102, 0.677]
  - - [512, 128, 1, 1024, 512, 512, 512, 1024]
    - [81, 1.094]
  - - [512, 128, 1, 2048, 512, 512, 512, 2048]
    - [103, 2.022]
  - - [512, 128, 1, 4096, 512, 512, 512, 4096]
    - [82, 3.181]
  - - [512, 128, 1, 8192, 512, 512, 512, 8192]
    - [104, 4.728]
  - - [512, 256, 1, 128, 512, 512, 512, 128]
    - [34, 0.646]
  - - [512, 256, 1, 256, 512, 512, 512, 256]
    - [102, 0.757]
  - - [512, 256, 1, 512, 512, 512, 512, 512]
    - [102, 1.328]
  - - [512, 256, 1, 1024, 512, 512, 512, 1024]
    - [34, 2.23]
  - - [512, 256, 1, 2048, 512, 512, 512, 2048]
    - [35, 3.912]
  - - [512, 256, 1, 4096, 512, 512, 512, 4096]
    - [101, 5.676]
  - - [512, 256, 1, 8192, 512, 512, 512, 8192]
    - [101, 7.738]
  - - [512, 512, 1, 128, 512, 512, 512, 128]
    - [34, 1.243]
  - - [512, 512, 1, 256, 512, 512, 512, 256]
    - [35, 1.608]
  - - [512, 512, 1, 512, 512, 512, 512, 512]
    - [103, 2.591]
  - - [512, 512, 1, 1024, 512, 512, 512, 1024]
    - [34, 4.083]
  - - [512, 512, 1, 2048, 512, 512, 512, 2048]
    - [99, 6.657]
  - - [512, 512, 1, 4096, 512, 512, 512, 4096]
    - [101, 8.954]
  - - [512, 512, 1, 8192, 512, 512, 512, 8192]
    - [75, 11.686]
  - - [512, 1024, 1, 128, 512, 512, 512, 128]
    - [99, 2.384]
  - - [512, 1024, 1, 256, 512, 512, 512, 256]
    - [33, 2.958]
  - - [512, 1024, 1, 512, 512, 512, 512, 512]
    - [99, 4.683]
  - - [512, 1024, 1, 1024, 512, 512, 512, 1024]
    - [99, 7.273]
  - - [512, 1024, 1, 2048, 512, 512, 512, 2048]
    - [76, 10.622]
  - - [512, 1024, 1, 4096, 512, 512, 512, 4096]
    - [93, 13.37]
  - - [512, 1024, 1, 8192, 512, 512, 512, 8192]
    - [93, 16.287]
  - - [512, 2048, 1, 128, 512, 512, 512, 128]
    - [27, 4.163]
  - - [512, 2048, 1, 256, 512, 512, 512, 256]
    - [27, 5.138]
  - - [512, 2048, 1, 512, 512, 512, 512, 512]
    - [92, 7.907]
  - - [512, 2048, 1, 1024, 512, 512, 512, 1024]
    - [92, 11.828]
  - - [512, 2048, 1, 2048, 512, 512, 512, 2048]
    - [85, 15.283]
  - - [512, 2048, 1, 4096, 512, 512, 512, 4096]
    - [67, 18.252]
  - - [512, 2048, 1, 8192, 512, 512, 512, 8192]
    - [60, 21.854]
  - - [512, 4096, 1, 128, 512, 512, 512, 128]
    - [18, 6.363]
  - - [512, 4096, 1, 256, 512, 512, 512, 256]
    - [25, 8.169]
  - - [512, 4096, 1, 512, 512, 512, 512, 512]
    - [72, 11.021]
  - - [512, 4096, 1, 1024, 512, 512, 512, 1024]
    - [84, 16.291]
  - - [512, 4096, 1, 2048, 512, 512, 512, 2048]
    - [87, 19.209]
  - - [512, 4096, 1, 4096, 512, 512, 512, 4096]
    - [65, 23.029]
  - - [512, 4096, 1, 8192, 512, 512, 512, 8192]
    - [62, 26.056]
  - - [512, 8192, 1, 128, 512, 512, 512, 128]
    - [85, 7.6]
  - - [512, 8192, 1, 256, 512, 512, 512, 256]
    - [16, 9.922]
  - - [512, 8192, 1, 512, 512, 512, 512, 512]
    - [71, 14.447]
  - - [512, 8192, 1, 1024, 512, 512, 512, 1024]
    - [84, 18.993]
  - - [512, 8192, 1, 2048, 512, 512, 512, 2048]
    - [66, 23.367]
  - - [512, 8192, 1, 4096, 512, 512, 512, 4096]
    - [10, 27.483]
  - - [512, 8192, 1, 8192, 512, 512, 512, 8192]
    - [6, 29.489]
  - - [1024, 128, 1, 128, 1024, 1024, 1024, 128]
    - [35, 0.654]
  - - [1024, 128, 1, 256, 1024, 1024, 1024, 256]
    - [103, 0.761]
  - - [1024, 128, 1, 512, 1024, 1024, 1024, 512]
    - [106, 1.328]
  - - [1024, 128, 1, 1024, 1024, 1024, 1024, 1024]
    - [102, 2.23]
  - - [1024, 128, 1, 2048, 1024, 1024, 1024, 2048]
    - [102, 3.55]
  - - [1024, 128, 1, 4096, 1024, 1024, 1024, 4096]
    - [101, 5.363]
  - - [1024, 128, 1, 8192, 1024, 1024, 1024, 8192]
    - [101, 7.025]
  - - [1024, 256, 1, 128, 1024, 1024, 1024, 128]
    - [103, 1.184]
  - - [1024, 256, 1, 256, 1024, 1024, 1024, 256]
    - [34, 1.598]
  - - [1024, 256, 1, 512, 1024, 1024, 1024, 512]
    - [103, 2.574]
  - - [1024, 256, 1, 1024, 1024, 1024, 1024, 1024]
    - [99, 4.152]
  - - [1024, 256, 1, 2048, 1024, 1024, 1024, 2048]
    - [101, 6.288]
  - - [1024, 256, 1, 4096, 1024, 1024, 1024, 4096]
    - [95, 8.407]
  - - [1024, 256, 1, 8192, 1024, 1024, 1024, 8192]
    - [76, 11.433]
  - - [1024, 512, 1, 128, 1024, 1024, 1024, 128]
    - [33, 2.335]
  - - [1024, 512, 1, 256, 1024, 1024, 1024, 256]
    - [32, 2.903]
  - - [1024, 512, 1, 512, 1024, 1024, 1024, 512]
    - [99, 4.533]
  - - [1024, 512, 1, 1024, 1024, 1024, 1024, 1024]
    - [99, 7.211]
  - - [1024, 512, 1, 2048, 1024, 1024, 1024, 2048]
    - [94, 9.964]
  - - [1024, 512, 1, 4096, 1024, 1024, 1024, 4096]
    - [76, 12.571]
  - - [1024, 512, 1, 8192, 1024, 1024, 1024, 8192]
    - [67, 16.056]
  - - [1024, 1024, 1, 128, 1024, 1024, 1024, 128]
    - [27, 4.153]
  - - [1024, 1024, 1, 256, 1024, 1024, 1024, 256]
    - [28, 5.082]
  - - [1024, 1024, 1, 512, 1024, 1024, 1024, 512]
    - [92, 7.895]
  - - [1024, 1024, 1, 1024, 1024, 1024, 1024, 1024]
    - [92, 11.705]
  - - [1024, 1024, 1, 2048, 1024, 1024, 1024, 2048]
    - [95, 14.099]
  - - [1024, 1024, 1, 4096, 1024, 1024, 1024, 4096]
    - [72, 17.685]
  - - [1024, 1024, 1, 8192, 1024, 1024, 1024, 8192]
    - [63, 21.621]
  - - [1024, 2048, 1, 128, 1024, 1024, 1024, 128]
    - [17, 6.373]
  - - [1024, 2048, 1, 256, 1024, 1024, 1024, 256]
    - [23, 8.074]
  - - [1024, 2048, 1, 512, 1024, 1024, 1024, 512]
    - [71, 11.069]
  - - [1024, 2048, 1, 1024, 1024, 1024, 1024, 1024]
    - [87, 15.776]
  - - [1024, 2048, 1, 2048, 1024, 1024, 1024, 2048]
    - [67, 18.794]
  - - [1024, 2048, 1, 4096, 1024, 1024, 1024, 4096]
    - [63, 23.915]
  - - [1024, 2048, 1, 8192, 1024, 1024, 1024, 8192]
    - [60, 26.504]
  - - [1024, 4096, 1, 128, 1024, 1024, 1024, 128]
    - [89, 7.579]
  - - [1024, 4096, 1, 256, 1024, 1024, 1024, 256]
    - [20, 10.043]
  - - [1024, 4096, 1, 512, 1024, 1024, 1024, 512]
    - [71, 14.162]
  - - [1024, 4096, 1, 1024, 1024, 1024, 1024, 1024]
    - [86, 18.835]
  - - [1024, 4096, 1, 2048, 1024, 1024, 1024, 2048]
    - [60, 23.718]
  - - [1024, 4096, 1, 4096, 1024, 1024, 1024, 4096]
    - [61, 27.038]
  - - [1024, 4096, 1, 8192, 1024, 1024, 1024, 8192]
    - [54, 28.601]
  - - [1024, 8192, 1, 128, 1024, 1024, 1024, 128]
    - [18, 8.424]
  - - [1024, 8192, 1, 256, 1024, 1024, 1024, 256]
    - [64, 12.236]
  - - [1024, 8192, 1, 512, 1024, 1024, 1024, 512]
    - [60, 18.196]
  - - [1024, 8192, 1, 1024, 1024, 1024, 1024, 1024]
    - [60, 23.156]
  - - [1024, 8192, 1, 2048, 1024, 1024, 1024, 2048]
    - [61, 27.391]
  - - [1024, 8192, 1, 4096, 1024, 1024, 1024, 4096]
    - [57, 28.823]
  - - [1024, 8192, 1, 8192, 1024, 1024, 1024, 8192]
    - [40, 32.103]
  - - [2048, 128, 1, 128, 2048, 2048, 2048, 128]
    - [35, 1.273]
  - - [2048, 128, 1, 256, 2048, 2048, 2048, 256]
    - [34, 1.598]
  - - [2048, 128, 1, 512, 2048, 2048, 2048, 512]
    - [103, 2.444]
  - - [2048, 128, 1, 1024, 2048, 2048, 2048, 1024]
    - [99, 3.995]
  - - [2048, 128, 1, 2048, 2048, 2048, 2048, 2048]
    - [101, 6.225]
  - - [2048, 128, 1, 4096, 2048, 2048, 2048, 4096]
    - [12, 8.578]
  - - [2048, 128, 1, 8192, 2048, 2048, 2048, 8192]
    - [79, 11.381]
  - - [2048, 256, 1, 128, 2048, 2048, 2048, 128]
    - [33, 2.3]
  - - [2048, 256, 1, 256, 2048, 2048, 2048, 256]
    - [33, 2.96]
  - - [2048, 256, 1, 512, 2048, 2048, 2048, 512]
    - [99, 4.672]
  - - [2048, 256, 1, 1024, 2048, 2048, 2048, 1024]
    - [98, 6.844]
  - - [2048, 256, 1, 2048, 2048, 2048, 2048, 2048]
    - [95, 9.975]
  - - [2048, 256, 1, 4096, 2048, 2048, 2048, 4096]
    - [78, 12.477]
  - - [2048, 256, 1, 8192, 2048, 2048, 2048, 8192]
    - [69, 16.104]
  - - [2048, 512, 1, 128, 2048, 2048, 2048, 128]
    - [29, 4.06]
  - - [2048, 512, 1, 256, 2048, 2048, 2048, 256]
    - [27, 5.025]
  - - [2048, 512, 1, 512, 2048, 2048, 2048, 512]
    - [92, 7.869]
  - - [2048, 512, 1, 1024, 2048, 2048, 2048, 1024]
    - [94, 11.546]
  - - [2048, 512, 1, 2048, 2048, 2048, 2048, 2048]
    - [95, 14.066]
  - - [2048, 512, 1, 4096, 2048, 2048, 2048, 4096]
    - [68, 17.595]
  - - [2048, 512, 1, 8192, 2048, 2048, 2048, 8192]
    - [60, 21.464]
  - - [2048, 1024, 1, 128, 2048, 2048, 2048, 128]
    - [25, 6.422]
  - - [2048, 1024, 1, 256, 2048, 2048, 2048, 256]
    - [23, 8.172]
  - - [2048, 1024, 1, 512, 2048, 2048, 2048, 512]
    - [87, 11.79]
  - - [2048, 1024, 1, 1024, 2048, 2048, 2048, 1024]
    - [73, 15.519]
  - - [2048, 1024, 1, 2048, 2048, 2048, 2048, 2048]
    - [71, 18.247]
  - - [2048, 1024, 1, 4096, 2048, 2048, 2048, 4096]
    - [60, 23.242]
  - - [2048, 1024, 1, 8192, 2048, 2048, 2048, 8192]
    - [63, 26.331]
  - - [2048, 2048, 1, 128, 2048, 2048, 2048, 128]
    - [23, 7.749]
  - - [2048, 2048, 1, 256, 2048, 2048, 2048, 256]
    - [14, 9.907]
  - - [2048, 2048, 1, 512, 2048, 2048, 2048, 512]
    - [71, 14.466]
  - - [2048, 2048, 1, 1024, 2048, 2048, 2048, 1024]
    - [64, 18.72]
  - - [2048, 2048, 1, 2048, 2048, 2048, 2048, 2048]
    - [63, 24.165]
  - - [2048, 2048, 1, 4096, 2048, 2048, 2048, 4096]
    - [60, 29.512]
  - - [2048, 2048, 1, 8192, 2048, 2048, 2048, 8192]
    - [51, 28.86]
  - - [2048, 4096, 1, 128, 2048, 2048, 2048, 128]
    - [26, 8.457]
  - - [2048, 4096, 1, 256, 2048, 2048, 2048, 256]
    - [60, 12.337]
  - - [2048, 4096, 1, 512, 2048, 2048, 2048, 512]
    - [60, 17.843]
  - - [2048, 4096, 1, 1024, 2048, 2048, 2048, 1024]
    - [60, 22.589]
  - - [2048, 4096, 1, 2048, 2048, 2048, 2048, 2048]
    - [51, 27.956]
  - - [2048, 4096, 1, 4096, 2048, 2048, 2048, 4096]
    - [58, 29.133]
  - - [2048, 4096, 1, 8192, 2048, 2048, 2048, 8192]
    - [40, 32.251]
  - - [2048, 8192, 1, 128, 2048, 2048, 2048, 128]
    - [85, 9.482]
  - - [2048, 8192, 1, 256, 2048, 2048, 2048, 256]
    - [60, 14.785]
  - - [2048, 8192, 1, 512, 2048, 2048, 2048, 512]
    - [60, 20.36]
  - - [2048, 8192, 1, 1024, 2048, 2048, 2048, 1024]
    - [47, 25.576]
  - - [2048, 8192, 1, 2048, 2048, 2048, 2048, 2048]
    - [46, 28.818]
  - - [2048, 8192, 1, 4096, 2048, 2048, 2048, 4096]
    - [43, 32.083]
  - - [2048, 8192, 1, 8192, 2048, 2048, 2048, 8192]
    - [39, 34.612]
  - - [4096, 128, 1, 128, 4096, 4096, 4096, 128]
    - [99, 2.347]
  - - [4096, 128, 1, 256, 4096, 4096, 4096, 256]
    - [32, 2.915]
  - - [4096, 128, 1, 512, 4096, 4096, 4096, 512]
    - [99, 4.696]
  - - [4096, 128, 1, 1024, 4096, 4096, 4096, 1024]
    - [101, 7.021]
  - - [4096, 128, 1, 2048, 4096, 4096, 4096, 2048]
    - [97, 10.085]
  - - [4096, 128, 1, 4096, 4096, 4096, 4096, 4096]
    - [76, 12.687]
  - - [4096, 128, 1, 8192, 4096, 4096, 4096, 8192]
    - [67, 16.232]
  - - [4096, 256, 1, 128, 4096, 4096, 4096, 128]
    - [28, 4.175]
  - - [4096, 256, 1, 256, 4096, 4096, 4096, 256]
    - [28, 4.925]
  - - [4096, 256, 1, 512, 4096, 4096, 4096, 512]
    - [92, 7.98]
  - - [4096, 256, 1, 1024, 4096, 4096, 4096, 1024]
    - [94, 11.386]
  - - [4096, 256, 1, 2048, 4096, 4096, 4096, 2048]
    - [95, 14.002]
  - - [4096, 256, 1, 4096, 4096, 4096, 4096, 4096]
    - [67, 17.662]
  - - [4096, 256, 1, 8192, 4096, 4096, 4096, 8192]
    - [64, 21.618]
  - - [4096, 512, 1, 128, 4096, 4096, 4096, 128]
    - [22, 6.417]
  - - [4096, 512, 1, 256, 4096, 4096, 4096, 256]
    - [23, 8.206]
  - - [4096, 512, 1, 512, 4096, 4096, 4096, 512]
    - [83, 11.185]
  - - [4096, 512, 1, 1024, 4096, 4096, 4096, 1024]
    - [88, 15.518]
  - - [4096, 512, 1, 2048, 4096, 4096, 4096, 2048]
    - [69, 18.092]
  - - [4096, 512, 1, 4096, 4096, 4096, 4096, 4096]
    - [61, 23.524]
  - - [4096, 512, 1, 8192, 4096, 4096, 4096, 8192]
    - [61, 27.86]
  - - [4096, 1024, 1, 128, 4096, 4096, 4096, 128]
    - [85, 7.72]
  - - [4096, 1024, 1, 256, 4096, 4096, 4096, 256]
    - [23, 9.988]
  - - [4096, 1024, 1, 512, 4096, 4096, 4096, 512]
    - [74, 13.911]
  - - [4096, 1024, 1, 1024, 4096, 4096, 4096, 1024]
    - [66, 18.611]
  - - [4096, 1024, 1, 2048, 4096, 4096, 4096, 2048]
    - [65, 23.415]
  - - [4096, 1024, 1, 4096, 4096, 4096, 4096, 4096]
    - [63, 28.312]
  - - [4096, 1024, 1, 8192, 4096, 4096, 4096, 8192]
    - [52, 28.692]
  - - [4096, 2048, 1, 128, 4096, 4096, 4096, 128]
    - [17, 8.333]
  - - [4096, 2048, 1, 256, 4096, 4096, 4096, 256]
    - [64, 12.073]
  - - [4096, 2048, 1, 512, 4096, 4096, 4096, 512]
    - [64, 17.501]
  - - [4096, 2048, 1, 1024, 4096, 4096, 4096, 1024]
    - [64, 22.975]
  - - [4096, 2048, 1, 2048, 4096, 4096, 4096, 2048]
    - [65, 27.404]
  - - [4096, 2048, 1, 4096, 4096, 4096, 4096, 4096]
    - [53, 29.952]
  - - [4096, 2048, 1, 8192, 4096, 4096, 4096, 8192]
    - [38, 32.785]
  - - [4096, 4096, 1, 128, 4096, 4096, 4096, 128]
    - [85, 9.5]
  - - [4096, 4096, 1, 256, 4096, 4096, 4096, 256]
    - [60, 14.166]
  - - [4096, 4096, 1, 512, 4096, 4096, 4096, 512]
    - [59, 20.088]
  - - [4096, 4096, 1, 1024, 4096, 4096, 4096, 1024]
    - [46, 25.321]
  - - [4096, 4096, 1, 2048, 4096, 4096, 4096, 2048]
    - [54, 29.095]
  - - [4096, 4096, 1, 4096, 4096, 4096, 4096, 4096]
    - [44, 32.27]
  - - [4096, 4096, 1, 8192, 4096, 4096, 4096, 8192]
    - [38, 34.837]
  - - [4096, 8192, 1, 128, 4096, 4096, 4096, 128]
    - [63, 11.37]
  - - [4096, 8192, 1, 256, 4096, 4096, 4096, 256]
    - [65, 16.848]
  - - [4096, 8192, 1, 512, 4096, 4096, 4096, 512]
    - [64, 21.648]
  - - [4096, 8192, 1, 1024, 4096, 4096, 4096, 1024]
    - [36, 26.986]
  - - [4096, 8192, 1, 2048, 4096, 4096, 4096, 2048]
    - [37, 31.886]
  - - [4096, 8192, 1, 4096, 4096, 4096, 4096, 4096]
    - [36, 36.322]
  - - [4096, 8192, 1, 8192, 4096, 4096, 4096, 8192]
    - [38, 39.034]
  - - [8192, 128, 1, 128, 8192, 8192, 8192, 128]
    - [28, 4.167]
  - - [8192, 128, 1, 256, 8192, 8192, 8192, 256]
    - [28, 5.127]
  - - [8192, 128, 1, 512, 8192, 8192, 8192, 512]
    - [92, 7.986]
  - - [8192, 128, 1, 1024, 8192, 8192, 8192, 1024]
    - [94, 11.245]
  - - [8192, 128, 1, 2048, 8192, 8192, 8192, 2048]
    - [96, 14.002]
  - - [8192, 128, 1, 4096, 8192, 8192, 8192, 4096]
    - [68, 17.609]
  - - [8192, 128, 1, 8192, 8192, 8192, 8192, 8192]
    - [9, 21.569]
  - - [8192, 256, 1, 128, 8192, 8192, 8192, 128]
    - [22, 6.396]
  - - [8192, 256, 1, 256, 8192, 8192, 8192, 256]
    - [25, 8.053]
  - - [8192, 256, 1, 512, 8192, 8192, 8192, 512]
    - [74, 10.984]
  - - [8192, 256, 1, 1024, 8192, 8192, 8192, 1024]
    - [90, 15.618]
  - - [8192, 256, 1, 2048, 8192, 8192, 8192, 2048]
    - [70, 18.725]
  - - [8192, 256, 1, 4096, 8192, 8192, 8192, 4096]
    - [63, 23.021]
  - - [8192, 256, 1, 8192, 8192, 8192, 8192, 8192]
    - [60, 26.541]
  - - [8192, 512, 1, 128, 8192, 8192, 8192, 128]
    - [89, 7.583]
  - - [8192, 512, 1, 256, 8192, 8192, 8192, 256]
    - [14, 9.837]
  - - [8192, 512, 1, 512, 8192, 8192, 8192, 512]
    - [65, 13.94]
  - - [8192, 512, 1, 1024, 8192, 8192, 8192, 1024]
    - [66, 18.61]
  - - [8192, 512, 1, 2048, 8192, 8192, 8192, 2048]
    - [66, 22.771]
  - - [8192, 512, 1, 4096, 8192, 8192, 8192, 4096]
    - [61, 28.709]
  - - [8192, 512, 1, 8192, 8192, 8192, 8192, 8192]
    - [4, 29.52]
  - - [8192, 1024, 1, 128, 8192, 8192, 8192, 128]
    - [10, 8.125]
  - - [8192, 1024, 1, 256, 8192, 8192, 8192, 256]
    - [65, 11.936]
  - - [8192, 1024, 1, 512, 8192, 8192, 8192, 512]
    - [65, 17.494]
  - - [8192, 1024, 1, 1024, 8192, 8192, 8192, 1024]
    - [65, 22.871]
  - - [8192, 1024, 1, 2048, 8192, 8192, 8192, 2048]
    - [45, 27.275]
  - - [8192, 1024, 1, 4096, 8192, 8192, 8192, 4096]
    - [51, 30.212]
  - - [8192, 1024, 1, 8192, 8192, 8192, 8192, 8192]
    - [38, 32.197]
  - - [8192, 2048, 1, 128, 8192, 8192, 8192, 128]
    - [7, 9.261]
  - - [8192, 2048, 1, 256, 8192, 8192, 8192, 256]
    - [65, 14.162]
  - - [8192, 2048, 1, 512, 8192, 8192, 8192, 512]
    - [65, 19.653]
  - - [8192, 2048, 1, 1024, 8192, 8192, 8192, 1024]
    - [48, 25.175]
  - - [8192, 2048, 1, 2048, 8192, 8192, 8192, 2048]
    - [66, 28.899]
  - - [8192, 2048, 1, 4096, 8192, 8192, 8192, 4096]
    - [38, 32.206]
  - - [8192, 2048, 1, 8192, 8192, 8192, 8192, 8192]
    - [36, 35.705]
  - - [8192, 4096, 1, 128, 8192, 8192, 8192, 128]
    - [8, 11.373]
  - - [8192, 4096, 1, 256, 8192, 8192, 8192, 256]
    - [65, 16.689]
  - - [8192, 4096, 1, 512, 8192, 8192, 8192, 512]
    - [47, 21.979]
  - - [8192, 4096, 1, 1024, 8192, 8192, 8192, 1024]
    - [47, 26.82]
  - - [8192, 4096, 1, 2048, 8192, 8192, 8192, 2048]
    - [41, 31.678]
  - - [8192, 4096, 1, 4096, 8192, 8192, 8192, 4096]
    - [55, 35.928]
  - - [8192, 4096, 1, 8192, 8192, 8192, 8192, 8192]
    - [56, 37.865]
  - - [8192, 8192, 1, 128, 8192, 8192, 8192, 128]
    - [5, 11.803]
  - - [8192, 8192, 1, 256, 8192, 8192, 8192, 256]
    - [48, 16.362]
  - - [8192, 8192, 1, 512, 8192, 8192, 8192, 512]
    - [1, 22.418]
  - - [8192, 8192, 1, 1024, 8192, 8192, 8192, 1024]
    - [0, 28.759]
  - - [8192, 8192, 1, 2048, 8192, 8192, 8192, 2048]
    - [43, 35.356]
  - - [8192, 8192, 1, 4096, 8192, 8192, 8192, 4096]
    - [39, 39.292]
  - - [8192, 8192, 1, 8192, 8192, 8192, 8192, 8192]
    - [42, 41.843]
  - - [1, 1, 1, 32, 1, 1, 1, 32]
    - [107, 0.0]
- null
- null
- DeviceEfficiency
- GridBased
