library/src/amd_detail/rocblaslt/src/Tensile/Logic/streamk/gfx942/aquavanjaram942_Cijk_Alik_Bjlk_BBS_BH_UserArgs.yaml
- {MinimumRequiredVersion: 4.33.0}
- aquavanjaram942
- gfx942
- [Device 0049, Device 0050]
    SolutionIndex: 0
    SolutionNameMin: Cijk_Alik_Bjlk_BBS_BH_UserArgs_MT256x256x32_MI16x16x1_SN_LDSB1_CLR1_GSU0_GSUC0_GSUWGMRR0_K1_LBSPPA256_LBSPPB2048_LPB0_MIWT8_8_PLR1_SU32_SUM0_SUS256_SKXCCM0_VWA4_VWB8_WGM1_WGMXCC1_WGMXCCGn1
    SolutionIndex: 1
    SolutionNameMin: Cijk_Alik_Bjlk_BBS_BH_UserArgs_MT128x256x32_MI16x16x1_SN_LDSB1_CLR1_GSU0_GSUC0_GSUWGMRR0_K1_LBSPPA256_LBSPPB2048_LPB0_MIWT4_8_PLR1_SU32_SUM0_SUS256_SKXCCM0_VWA4_VWB8_WGM1_WGMXCC1_WGMXCCGn1
    SolutionIndex: 2
    SolutionNameMin: Cijk_Alik_Bjlk_BBS_BH_UserArgs_MT32x32x32_MI16x16x1_SN_LDSB0_CLR1_GSU0_GSUC0_GSUWGMRR0_K1_LBSPPA128_LBSPPB256_LPB16_MIWT1_1_PLR1_SU32_SUM0_SUS256_SKXCCM0_VWA1_VWB1_WGM1_WGMXCC1_WGMXCCGn1
    SolutionIndex: 3
    SolutionNameMin: Cijk_Alik_Bjlk_BBS_BH_UserArgs_MT128x256x64_MI16x16x1_SN_LDSB1_CLR1_GSU0_GSUC0_GSUWGMRR0_K1_LBSPPA256_LBSPPB4096_LPB32_MIWT4_8_PLR1_SU32_SUM0_SUS256_SKXCCM0_VWA2_VWB2_WGM1_WGMXCC1_WGMXCCGn1
    SolutionIndex: 4
    SolutionNameMin: Cijk_Alik_Bjlk_BBS_BH_UserArgs_MT128x256x64_MI16x16x1_SN_LDSB1_CLR1_GSU0_GSUC0_GSUWGMRR0_K1_LBSPPA512_LBSPPB4096_LPB0_MIWT4_8_PLR1_SU32_SUM0_SUS256_SKXCCM0_VWA4_VWB4_WGM1_WGMXCC1_WGMXCCGn1
    SolutionIndex: 5
    SolutionNameMin: Cijk_Alik_Bjlk_BBS_BH_UserArgs_MT128x256x64_MI16x16x1_SN_LDSB1_CLR1_GSU0_GSUC0_GSUWGMRR0_K1_LBSPPA512_LBSPPB4096_LPB0_MIWT4_8_PLR1_SU32_SUM0_SUS256_SKXCCM0_VWA4_VWB8_WGM1_WGMXCC1_WGMXCCGn1
    SolutionIndex: 6
    SolutionNameMin: Cijk_Alik_Bjlk_BBS_BH_UserArgs_MT256x128x64_MI16x16x1_SN_LDSB1_CLR1_GSU0_GSUC0_GSUWGMRR0_K1_LBSPPA512_LBSPPB2048_LPB0_MIWT8_4_PLR1_SU32_SUM0_SUS256_SKXCCM0_VWA4_VWB4_WGM1_WGMXCC1_WGMXCCGn1
    SolutionIndex: 7
    SolutionNameMin: Cijk_Alik_Bjlk_BBS_BH_UserArgs_MT256x128x64_MI16x16x1_SN_LDSB1_CLR1_GSU0_GSUC0_GSUWGMRR0_K1_LBSPPA1024_LBSPPB2048_LPB0_MIWT8_4_PLR1_SU32_SUM0_SUS256_SKXCCM0_VWA8_VWB4_WGM1_WGMXCC1_WGMXCCGn1
    SolutionIndex: 8
    SolutionNameMin: Cijk_Alik_Bjlk_BBS_BH_UserArgs_MT256x128x64_MI16x16x1_SN_LDSB1_CLR1_GSU0_GSUC0_GSUWGMRR0_K1_LBSPPA512_LBSPPB2048_LPB0_MIWT8_4_PLR1_SU32_SUM0_SUS256_SKXCCM0_VWA4_VWB4_WGM8_WGMXCC1_WGMXCCGn1
    SolutionIndex: 9
    SolutionNameMin: Cijk_Alik_Bjlk_BBS_BH_UserArgs_MT128x128x64_MI16x16x1_SN_LDSB1_CLR1_GSU0_GSUC0_GSUWGMRR0_K1_LBSPPA512_LBSPPB2048_LPB32_MIWT4_4_PLR1_SU32_SUM0_SUS256_SKXCCM0_VWA4_VWB2_WGM1_WGMXCC1_WGMXCCGn1
    SolutionIndex: 10
    SolutionNameMin: Cijk_Alik_Bjlk_BBS_BH_UserArgs_MT128x128x64_MI16x16x1_SN_LDSB1_CLR1_GSU0_GSUC0_GSUWGMRR0_K1_LBSPPA256_LBSPPB2048_LPB0_MIWT4_4_PLR1_SU32_SUM0_SUS256_SKXCCM0_VWA2_VWB4_WGM1_WGMXCC1_WGMXCCGn1
    SolutionIndex: 11
    SolutionNameMin: Cijk_Alik_Bjlk_BBS_BH_UserArgs_MT128x128x64_MI16x16x1_SN_LDSB1_CLR1_GSU0_GSUC0_GSUWGMRR0_K1_LBSPPA512_LBSPPB2048_LPB0_MIWT4_4_PLR1_SU32_SUM0_SUS256_SKXCCM0_VWA4_VWB4_WGM1_WGMXCC1_WGMXCCGn1
    SolutionIndex: 12
    SolutionNameMin: Cijk_Alik_Bjlk_BBS_BH_UserArgs_MT128x128x64_MI16x16x1_SN_LDSB1_CLR1_GSU0_GSUC0_GSUWGMRR0_K1_LBSPPA512_LBSPPB2048_LPB0_MIWT4_4_PLR1_SU32_SUM0_SUS256_SKXCCM0_VWA4_VWB4_WGM8_WGMXCC1_WGMXCCGn1
    SolutionIndex: 13
    SolutionNameMin: Cijk_Alik_Bjlk_BBS_BH_UserArgs_MT128x64x64_MI16x16x1_SN_LDSB1_CLR1_GSU0_GSUC0_GSUWGMRR0_K1_LBSPPA512_LBSPPB1024_LPB32_MIWT4_2_PLR1_SU32_SUM0_SUS256_SKXCCM0_VWA4_VWB2_WGM1_WGMXCC1_WGMXCCGn1
    SolutionIndex: 14
    SolutionNameMin: Cijk_Alik_Bjlk_BBS_BH_UserArgs_MT32x32x64_MI16x16x1_SN_LDSB0_CLR1_GSU0_GSUC0_GSUWGMRR0_K1_LBSPPA128_LBSPPB512_LPB16_MIWT1_1_PLR1_SU32_SUM0_SUS256_SKXCCM0_VWA1_VWB1_WGM1_WGMXCC1_WGMXCCGn1
    SolutionIndex: 15
    SolutionNameMin: Cijk_Alik_Bjlk_BBS_BH_UserArgs_MT64x128x128_MI16x16x1_SN_LDSB1_CLR1_GSU0_GSUC0_GSUWGMRR0_K1_LBSPPA512_LBSPPB2048_LPB0_MIWT2_4_PLR2_SU32_SUM0_SUS256_SKXCCM0_VWA2_VWB4_WGM1_WGMXCC1_WGMXCCGn1
    SolutionIndex: 16
    SolutionNameMin: Cijk_Alik_Bjlk_BBS_BH_UserArgs_MT64x128x128_MI16x16x1_SN_LDSB1_CLR1_GSU0_GSUC0_GSUWGMRR0_K1_LBSPPA512_LBSPPB2048_LPB0_MIWT2_4_PLR2_SU32_SUM0_SUS256_SKXCCM0_VWA2_VWB4_WGM8_WGMXCC1_WGMXCCGn1
    SolutionIndex: 17
    SolutionNameMin: Cijk_Alik_Bjlk_BBS_BH_UserArgs_MT128x64x128_MI16x16x1_SN_LDSB1_CLR1_GSU0_GSUC0_GSUWGMRR0_K1_LBSPPA1024_LBSPPB1024_LPB16_MIWT4_2_PLR1_SU32_SUM0_SUS256_SKXCCM0_VWA4_VWB1_WGM1_WGMXCC1_WGMXCCGn1
    SolutionIndex: 18
    SolutionNameMin: Cijk_Alik_Bjlk_BBS_BH_UserArgs_MT128x64x128_MI16x16x1_SN_LDSB1_CLR1_GSU0_GSUC0_GSUWGMRR0_K1_LBSPPA1024_LBSPPB1024_LPB32_MIWT4_2_PLR1_SU32_SUM0_SUS256_SKXCCM0_VWA4_VWB2_WGM1_WGMXCC1_WGMXCCGn1
    SolutionIndex: 19
    SolutionNameMin: Cijk_Alik_Bjlk_BBS_BH_UserArgs_MT128x64x128_MI16x16x1_SN_LDSB1_CLR1_GSU0_GSUC0_GSUWGMRR0_K1_LBSPPA1024_LBSPPB1024_LPB32_MIWT4_2_PLR2_SU32_SUM0_SUS256_SKXCCM0_VWA4_VWB2_WGM1_WGMXCC1_WGMXCCGn1
    SolutionIndex: 20
    SolutionNameMin: Cijk_Alik_Bjlk_BBS_BH_UserArgs_MT128x64x128_MI16x16x1_SN_LDSB1_CLR1_GSU0_GSUC0_GSUWGMRR0_K1_LBSPPA1024_LBSPPB1024_LPB32_MIWT4_2_PLR2_SU32_SUM0_SUS256_SKXCCM0_VWA4_VWB2_WGM4_WGMXCC1_WGMXCCGn1
    SolutionIndex: 21
    SolutionNameMin: Cijk_Alik_Bjlk_BBS_BH_UserArgs_MT128x64x128_MI16x16x1_SN_LDSB1_CLR1_GSU0_GSUC0_GSUWGMRR0_K1_LBSPPA1024_LBSPPB1024_LPB16_MIWT4_2_PLR1_SU32_SUM0_SUS256_SKXCCM0_VWA4_VWB1_WGM8_WGMXCC1_WGMXCCGn1
    SolutionIndex: 22
    SolutionNameMin: Cijk_Alik_Bjlk_BBS_BH_UserArgs_MT128x64x128_MI16x16x1_SN_LDSB1_CLR1_GSU0_GSUC0_GSUWGMRR0_K1_LBSPPA1024_LBSPPB1024_LPB32_MIWT4_2_PLR1_SU32_SUM0_SUS256_SKXCCM0_VWA4_VWB2_WGM8_WGMXCC1_WGMXCCGn1
    SolutionIndex: 23
    SolutionNameMin: Cijk_Alik_Bjlk_BBS_BH_UserArgs_MT128x64x128_MI16x16x1_SN_LDSB1_CLR1_GSU0_GSUC0_GSUWGMRR0_K1_LBSPPA1024_LBSPPB1024_LPB32_MIWT4_2_PLR2_SU32_SUM0_SUS256_SKXCCM0_VWA4_VWB2_WGM8_WGMXCC1_WGMXCCGn1
    SolutionIndex: 24
    SolutionNameMin: Cijk_Alik_Bjlk_BBS_BH_UserArgs_MT64x64x128_MI16x16x1_SN_LDSB1_CLR1_GSU0_GSUC0_GSUWGMRR0_K1_LBSPPA512_LBSPPB1024_LPB32_MIWT2_2_PLR1_SU32_SUM0_SUS256_SKXCCM0_VWA2_VWB2_WGM1_WGMXCC1_WGMXCCGn1
    SolutionIndex: 25
    SolutionNameMin: Cijk_Alik_Bjlk_BBS_BH_UserArgs_MT64x64x128_MI16x16x1_SN_LDSB1_CLR1_GSU0_GSUC0_GSUWGMRR0_K1_LBSPPA256_LBSPPB1024_LPB32_MIWT2_2_PLR2_SU32_SUM0_SUS256_SKXCCM0_VWA1_VWB2_WGM1_WGMXCC1_WGMXCCGn1
    SolutionIndex: 26
    SolutionNameMin: Cijk_Alik_Bjlk_BBS_BH_UserArgs_MT64x64x128_MI16x16x1_SN_LDSB1_CLR1_GSU0_GSUC0_GSUWGMRR0_K1_LBSPPA512_LBSPPB1024_LPB32_MIWT2_2_PLR2_SU32_SUM0_SUS256_SKXCCM0_VWA2_VWB2_WGM1_WGMXCC1_WGMXCCGn1
    SolutionIndex: 27
    SolutionNameMin: Cijk_Alik_Bjlk_BBS_BH_UserArgs_MT64x64x128_MI16x16x1_SN_LDSB1_CLR1_GSU0_GSUC0_GSUWGMRR0_K1_LBSPPA512_LBSPPB1024_LPB32_MIWT2_2_PLR2_SU32_SUM0_SUS256_SKXCCM0_VWA2_VWB2_WGM4_WGMXCC1_WGMXCCGn1
    SolutionIndex: 28
    SolutionNameMin: Cijk_Alik_Bjlk_BBS_BH_UserArgs_MT32x64x128_MI16x16x1_SN_LDSB1_CLR1_GSU0_GSUC0_GSUWGMRR0_K1_LBSPPA256_LBSPPB1024_LPB32_MIWT1_2_PLR2_SU32_SUM0_SUS256_SKXCCM0_VWA1_VWB2_WGM1_WGMXCC1_WGMXCCGn1
    SolutionIndex: 29
    SolutionNameMin: Cijk_Alik_Bjlk_BBS_BH_UserArgs_MT64x32x128_MI16x16x1_SN_LDSB1_CLR1_GSU0_GSUC0_GSUWGMRR0_K1_LBSPPA512_LBSPPB512_LPB16_MIWT2_1_PLR2_SU32_SUM0_SUS256_SKXCCM0_VWA2_VWB1_WGM1_WGMXCC1_WGMXCCGn1
    SolutionIndex: 30
    SolutionNameMin: Cijk_Alik_Bjlk_BBS_BH_UserArgs_MT32x32x128_MI16x16x1_SN_LDSB1_CLR1_GSU0_GSUC0_GSUWGMRR0_K1_LBSPPA256_LBSPPB512_LPB16_MIWT1_1_PLR1_SU32_SUM0_SUS256_SKXCCM0_VWA1_VWB1_WGM1_WGMXCC1_WGMXCCGn1
    SolutionIndex: 31
    SolutionNameMin: Cijk_Alik_Bjlk_BBS_BH_UserArgs_MT32x32x128_MI16x16x1_SN_LDSB1_CLR1_GSU0_GSUC0_GSUWGMRR0_K1_LBSPPA256_LBSPPB512_LPB16_MIWT1_1_PLR2_SU32_SUM0_SUS256_SKXCCM0_VWA1_VWB1_WGM1_WGMXCC1_WGMXCCGn1
    SolutionIndex: 32
    SolutionNameMin: Cijk_Alik_Bjlk_BBS_BH_UserArgs_MT32x32x128_MI16x16x1_SN_LDSB1_CLR1_GSU0_GSUC0_GSUWGMRR0_K1_LBSPPA256_LBSPPB512_LPB16_MIWT1_1_PLR1_SU32_SUM0_SUS256_SKXCCM0_VWA1_VWB1_WGM8_WGMXCC1_WGMXCCGn1
    SolutionIndex: 33
    SolutionNameMin: Cijk_Alik_Bjlk_BBS_BH_UserArgs_MT256x256x32_MI16x16x1_SN_LDSB1_CLR1_GSU0_GSUC0_GSUWGMRR0_K1_LBSPPA128_LBSPPB2048_LPB0_MIWT8_8_PLR1_SU32_SUM0_SUS256_SKXCCM8_VWA1_VWB8_WGM1_WGMXCC1_WGMXCCGn1
    SolutionIndex: 34
    SolutionNameMin: Cijk_Alik_Bjlk_BBS_BH_UserArgs_MT256x256x32_MI16x16x1_SN_LDSB1_CLR1_GSU0_GSUC0_GSUWGMRR0_K1_LBSPPA256_LBSPPB2048_LPB0_MIWT8_8_PLR1_SU32_SUM0_SUS256_SKXCCM8_VWA4_VWB8_WGM1_WGMXCC1_WGMXCCGn1
    SolutionIndex: 35
    SolutionNameMin: Cijk_Alik_Bjlk_BBS_BH_UserArgs_MT256x256x32_MI16x16x1_SN_LDSB1_CLR1_GSU0_GSUC0_GSUWGMRR0_K1_LBSPPA256_LBSPPB2048_LPB0_MIWT8_8_PLR1_SU32_SUM0_SUS256_SKXCCM8_VWA4_VWB8_WGM4_WGMXCC1_WGMXCCGn1
    SolutionIndex: 36
    SolutionNameMin: Cijk_Alik_Bjlk_BBS_BH_UserArgs_MT256x256x32_MI16x16x1_SN_LDSB1_CLR1_GSU0_GSUC0_GSUWGMRR0_K1_LBSPPA256_LBSPPB2048_LPB0_MIWT8_8_PLR1_SU32_SUM0_SUS256_SKXCCM8_VWA4_VWB4_WGM8_WGMXCC1_WGMXCCGn1
    SolutionIndex: 37
    SolutionNameMin: Cijk_Alik_Bjlk_BBS_BH_UserArgs_MT256x256x32_MI16x16x1_SN_LDSB1_CLR1_GSU0_GSUC0_GSUWGMRR0_K1_LBSPPA128_LBSPPB2048_LPB0_MIWT8_8_PLR1_SU32_SUM0_SUS256_SKXCCM8_VWA2_VWB8_WGM8_WGMXCC1_WGMXCCGn1
    SolutionIndex: 38
    SolutionNameMin: Cijk_Alik_Bjlk_BBS_BH_UserArgs_MT256x256x32_MI16x16x1_SN_LDSB1_CLR1_GSU0_GSUC0_GSUWGMRR0_K1_LBSPPA256_LBSPPB2048_LPB0_MIWT8_8_PLR1_SU32_SUM0_SUS256_SKXCCM8_VWA4_VWB8_WGM8_WGMXCC1_WGMXCCGn1
    SolutionIndex: 39
    SolutionNameMin: Cijk_Alik_Bjlk_BBS_BH_UserArgs_MT128x256x32_MI16x16x1_SN_LDSB1_CLR1_GSU0_GSUC0_GSUWGMRR0_K1_LBSPPA256_LBSPPB2048_LPB32_MIWT4_8_PLR1_SU32_SUM0_SUS256_SKXCCM8_VWA4_VWB2_WGM4_WGMXCC1_WGMXCCGn1
    SolutionIndex: 40
    SolutionNameMin: Cijk_Alik_Bjlk_BBS_BH_UserArgs_MT128x256x32_MI16x16x1_SN_LDSB1_CLR1_GSU0_GSUC0_GSUWGMRR0_K1_LBSPPA128_LBSPPB2048_LPB0_MIWT4_8_PLR1_SU32_SUM0_SUS256_SKXCCM8_VWA2_VWB8_WGM4_WGMXCC1_WGMXCCGn1
    SolutionIndex: 41
    SolutionNameMin: Cijk_Alik_Bjlk_BBS_BH_UserArgs_MT256x128x32_MI16x16x1_SN_LDSB1_CLR1_GSU0_GSUC0_GSUWGMRR0_K1_LBSPPA256_LBSPPB1024_LPB0_MIWT8_4_PLR1_SU32_SUM0_SUS256_SKXCCM8_VWA4_VWB4_WGM8_WGMXCC1_WGMXCCGn1
    SolutionIndex: 42
    SolutionNameMin: Cijk_Alik_Bjlk_BBS_BH_UserArgs_MT32x32x32_MI16x16x1_SN_LDSB0_CLR1_GSU0_GSUC0_GSUWGMRR0_K1_LBSPPA128_LBSPPB256_LPB16_MIWT1_1_PLR1_SU32_SUM0_SUS256_SKXCCM8_VWA1_VWB1_WGM1_WGMXCC1_WGMXCCGn1
    SolutionIndex: 43
    SolutionNameMin: Cijk_Alik_Bjlk_BBS_BH_UserArgs_MT128x256x64_MI16x16x1_SN_LDSB1_CLR1_GSU0_GSUC0_GSUWGMRR0_K1_LBSPPA512_LBSPPB4096_LPB32_MIWT4_8_PLR1_SU32_SUM0_SUS256_SKXCCM8_VWA4_VWB2_WGM4_WGMXCC1_WGMXCCGn1
    SolutionIndex: 44
    SolutionNameMin: Cijk_Alik_Bjlk_BBS_BH_UserArgs_MT256x128x64_MI16x16x1_SN_LDSB1_CLR1_GSU0_GSUC0_GSUWGMRR0_K1_LBSPPA512_LBSPPB2048_LPB0_MIWT8_4_PLR1_SU32_SUM0_SUS256_SKXCCM8_VWA4_VWB4_WGM1_WGMXCC1_WGMXCCGn1
    SolutionIndex: 45
    SolutionNameMin: Cijk_Alik_Bjlk_BBS_BH_UserArgs_MT256x128x64_MI16x16x1_SN_LDSB1_CLR1_GSU0_GSUC0_GSUWGMRR0_K1_LBSPPA512_LBSPPB2048_LPB0_MIWT8_4_PLR1_SU32_SUM0_SUS256_SKXCCM8_VWA4_VWB4_WGM8_WGMXCC1_WGMXCCGn1
    SolutionIndex: 46
    SolutionNameMin: Cijk_Alik_Bjlk_BBS_BH_UserArgs_MT128x128x64_MI16x16x1_SN_LDSB1_CLR1_GSU0_GSUC0_GSUWGMRR0_K1_LBSPPA512_LBSPPB2048_LPB32_MIWT4_4_PLR1_SU32_SUM0_SUS256_SKXCCM8_VWA4_VWB2_WGM1_WGMXCC1_WGMXCCGn1
    SolutionIndex: 47
    SolutionNameMin: Cijk_Alik_Bjlk_BBS_BH_UserArgs_MT128x128x64_MI16x16x1_SN_LDSB1_CLR1_GSU0_GSUC0_GSUWGMRR0_K1_LBSPPA256_LBSPPB2048_LPB0_MIWT4_4_PLR1_SU32_SUM0_SUS256_SKXCCM8_VWA2_VWB4_WGM1_WGMXCC1_WGMXCCGn1
    SolutionIndex: 48
    SolutionNameMin: Cijk_Alik_Bjlk_BBS_BH_UserArgs_MT128x128x64_MI16x16x1_SN_LDSB1_CLR1_GSU0_GSUC0_GSUWGMRR0_K1_LBSPPA512_LBSPPB2048_LPB0_MIWT4_4_PLR1_SU32_SUM0_SUS256_SKXCCM8_VWA4_VWB4_WGM1_WGMXCC1_WGMXCCGn1
    SolutionIndex: 49
    SolutionNameMin: Cijk_Alik_Bjlk_BBS_BH_UserArgs_MT128x128x64_MI16x16x1_SN_LDSB1_CLR1_GSU0_GSUC0_GSUWGMRR0_K1_LBSPPA128_LBSPPB2048_LPB0_MIWT4_4_PLR1_SU32_SUM0_SUS256_SKXCCM8_VWA1_VWB4_WGM4_WGMXCC1_WGMXCCGn1
    SolutionIndex: 50
    SolutionNameMin: Cijk_Alik_Bjlk_BBS_BH_UserArgs_MT128x128x64_MI16x16x1_SN_LDSB1_CLR1_GSU0_GSUC0_GSUWGMRR0_K1_LBSPPA256_LBSPPB2048_LPB0_MIWT4_4_PLR1_SU32_SUM0_SUS256_SKXCCM8_VWA2_VWB4_WGM4_WGMXCC1_WGMXCCGn1
    SolutionIndex: 51
    SolutionNameMin: Cijk_Alik_Bjlk_BBS_BH_UserArgs_MT128x128x64_MI16x16x1_SN_LDSB1_CLR1_GSU0_GSUC0_GSUWGMRR0_K1_LBSPPA512_LBSPPB2048_LPB0_MIWT4_4_PLR1_SU32_SUM0_SUS256_SKXCCM8_VWA4_VWB4_WGM4_WGMXCC1_WGMXCCGn1
    SolutionIndex: 52
    SolutionNameMin: Cijk_Alik_Bjlk_BBS_BH_UserArgs_MT128x128x64_MI16x16x1_SN_LDSB1_CLR1_GSU0_GSUC0_GSUWGMRR0_K1_LBSPPA512_LBSPPB2048_LPB32_MIWT4_4_PLR1_SU32_SUM0_SUS256_SKXCCM8_VWA4_VWB2_WGM8_WGMXCC1_WGMXCCGn1
    SolutionIndex: 53
    SolutionNameMin: Cijk_Alik_Bjlk_BBS_BH_UserArgs_MT128x128x64_MI16x16x1_SN_LDSB1_CLR1_GSU0_GSUC0_GSUWGMRR0_K1_LBSPPA128_LBSPPB2048_LPB0_MIWT4_4_PLR1_SU32_SUM0_SUS256_SKXCCM8_VWA1_VWB4_WGM8_WGMXCC1_WGMXCCGn1
    SolutionIndex: 54
    SolutionNameMin: Cijk_Alik_Bjlk_BBS_BH_UserArgs_MT128x128x64_MI16x16x1_SN_LDSB1_CLR1_GSU0_GSUC0_GSUWGMRR0_K1_LBSPPA512_LBSPPB2048_LPB0_MIWT4_4_PLR1_SU32_SUM0_SUS256_SKXCCM8_VWA4_VWB4_WGM8_WGMXCC1_WGMXCCGn1
    SolutionIndex: 55
    SolutionNameMin: Cijk_Alik_Bjlk_BBS_BH_UserArgs_MT64x128x64_MI16x16x1_SN_LDSB1_CLR1_GSU0_GSUC0_GSUWGMRR0_K1_LBSPPA256_LBSPPB2048_LPB0_MIWT2_4_PLR1_SU32_SUM0_SUS256_SKXCCM8_VWA2_VWB4_WGM1_WGMXCC1_WGMXCCGn1
    SolutionIndex: 56
    SolutionNameMin: Cijk_Alik_Bjlk_BBS_BH_UserArgs_MT128x64x64_MI16x16x1_SN_LDSB1_CLR1_GSU0_GSUC0_GSUWGMRR0_K1_LBSPPA512_LBSPPB1024_LPB32_MIWT4_2_PLR1_SU32_SUM0_SUS256_SKXCCM8_VWA4_VWB2_WGM4_WGMXCC1_WGMXCCGn1
    SolutionIndex: 57
    SolutionNameMin: Cijk_Alik_Bjlk_BBS_BH_UserArgs_MT128x64x64_MI16x16x1_SN_LDSB1_CLR1_GSU0_GSUC0_GSUWGMRR0_K1_LBSPPA512_LBSPPB1024_LPB32_MIWT4_2_PLR1_SU32_SUM0_SUS256_SKXCCM8_VWA4_VWB2_WGM8_WGMXCC1_WGMXCCGn1
    SolutionIndex: 58
    SolutionNameMin: Cijk_Alik_Bjlk_BBS_BH_UserArgs_MT64x64x64_MI16x16x1_SN_LDSB1_CLR1_GSU0_GSUC0_GSUWGMRR0_K1_LBSPPA128_LBSPPB1024_LPB32_MIWT2_2_PLR1_SU32_SUM0_SUS256_SKXCCM8_VWA1_VWB2_WGM1_WGMXCC1_WGMXCCGn1
    SolutionIndex: 59
    SolutionNameMin: Cijk_Alik_Bjlk_BBS_BH_UserArgs_MT64x64x64_MI16x16x1_SN_LDSB1_CLR1_GSU0_GSUC0_GSUWGMRR0_K1_LBSPPA128_LBSPPB1024_LPB32_MIWT2_2_PLR1_SU32_SUM0_SUS256_SKXCCM8_VWA1_VWB2_WGM4_WGMXCC1_WGMXCCGn1
    SolutionIndex: 60
    SolutionNameMin: Cijk_Alik_Bjlk_BBS_BH_UserArgs_MT64x64x64_MI16x16x1_SN_LDSB1_CLR1_GSU0_GSUC0_GSUWGMRR0_K1_LBSPPA256_LBSPPB1024_LPB32_MIWT2_2_PLR1_SU32_SUM0_SUS256_SKXCCM8_VWA2_VWB2_WGM4_WGMXCC1_WGMXCCGn1
    SolutionIndex: 61
    SolutionNameMin: Cijk_Alik_Bjlk_BBS_BH_UserArgs_MT64x64x64_MI16x16x1_SN_LDSB1_CLR1_GSU0_GSUC0_GSUWGMRR0_K1_LBSPPA128_LBSPPB1024_LPB32_MIWT2_2_PLR1_SU32_SUM0_SUS256_SKXCCM8_VWA1_VWB2_WGM8_WGMXCC1_WGMXCCGn1
    SolutionIndex: 62
    SolutionNameMin: Cijk_Alik_Bjlk_BBS_BH_UserArgs_MT32x64x64_MI16x16x1_SN_LDSB0_CLR1_GSU0_GSUC0_GSUWGMRR0_K1_LBSPPA128_LBSPPB1024_LPB32_MIWT1_2_PLR1_SU32_SUM0_SUS256_SKXCCM8_VWA1_VWB2_WGM4_WGMXCC1_WGMXCCGn1
    SolutionIndex: 63
    SolutionNameMin: Cijk_Alik_Bjlk_BBS_BH_UserArgs_MT32x32x64_MI16x16x1_SN_LDSB0_CLR1_GSU0_GSUC0_GSUWGMRR0_K1_LBSPPA128_LBSPPB512_LPB16_MIWT1_1_PLR1_SU32_SUM0_SUS256_SKXCCM8_VWA1_VWB1_WGM1_WGMXCC1_WGMXCCGn1
    SolutionIndex: 64
    SolutionNameMin: Cijk_Alik_Bjlk_BBS_BH_UserArgs_MT32x32x64_MI16x16x1_SN_LDSB0_CLR1_GSU0_GSUC0_GSUWGMRR0_K1_LBSPPA128_LBSPPB512_LPB16_MIWT1_1_PLR1_SU32_SUM0_SUS256_SKXCCM8_VWA1_VWB1_WGM4_WGMXCC1_WGMXCCGn1
    SolutionIndex: 65
    SolutionNameMin: Cijk_Alik_Bjlk_BBS_BH_UserArgs_MT64x128x128_MI16x16x1_SN_LDSB1_CLR1_GSU0_GSUC0_GSUWGMRR0_K1_LBSPPA512_LBSPPB2048_LPB0_MIWT2_4_PLR1_SU32_SUM0_SUS256_SKXCCM8_VWA2_VWB4_WGM1_WGMXCC1_WGMXCCGn1
    SolutionIndex: 66
    SolutionNameMin: Cijk_Alik_Bjlk_BBS_BH_UserArgs_MT64x128x128_MI16x16x1_SN_LDSB1_CLR1_GSU0_GSUC0_GSUWGMRR0_K1_LBSPPA256_LBSPPB2048_LPB0_MIWT2_4_PLR2_SU32_SUM0_SUS256_SKXCCM8_VWA1_VWB4_WGM1_WGMXCC1_WGMXCCGn1
    SolutionIndex: 67
    SolutionNameMin: Cijk_Alik_Bjlk_BBS_BH_UserArgs_MT64x128x128_MI16x16x1_SN_LDSB1_CLR1_GSU0_GSUC0_GSUWGMRR0_K1_LBSPPA512_LBSPPB2048_LPB0_MIWT2_4_PLR2_SU32_SUM0_SUS256_SKXCCM8_VWA2_VWB4_WGM1_WGMXCC1_WGMXCCGn1
    SolutionIndex: 68
    SolutionNameMin: Cijk_Alik_Bjlk_BBS_BH_UserArgs_MT64x128x128_MI16x16x1_SN_LDSB1_CLR1_GSU0_GSUC0_GSUWGMRR0_K1_LBSPPA512_LBSPPB2048_LPB0_MIWT2_4_PLR1_SU32_SUM0_SUS256_SKXCCM8_VWA2_VWB4_WGM4_WGMXCC1_WGMXCCGn1
    SolutionIndex: 69
    SolutionNameMin: Cijk_Alik_Bjlk_BBS_BH_UserArgs_MT64x128x128_MI16x16x1_SN_LDSB1_CLR1_GSU0_GSUC0_GSUWGMRR0_K1_LBSPPA512_LBSPPB2048_LPB0_MIWT2_4_PLR2_SU32_SUM0_SUS256_SKXCCM8_VWA2_VWB4_WGM4_WGMXCC1_WGMXCCGn1
    SolutionIndex: 70
    SolutionNameMin: Cijk_Alik_Bjlk_BBS_BH_UserArgs_MT64x128x128_MI16x16x1_SN_LDSB1_CLR1_GSU0_GSUC0_GSUWGMRR0_K1_LBSPPA512_LBSPPB2048_LPB0_MIWT2_4_PLR1_SU32_SUM0_SUS256_SKXCCM8_VWA2_VWB4_WGM8_WGMXCC1_WGMXCCGn1
    SolutionIndex: 71
    SolutionNameMin: Cijk_Alik_Bjlk_BBS_BH_UserArgs_MT128x64x128_MI16x16x1_SN_LDSB1_CLR1_GSU0_GSUC0_GSUWGMRR0_K1_LBSPPA512_LBSPPB1024_LPB32_MIWT4_2_PLR2_SU32_SUM0_SUS256_SKXCCM8_VWA2_VWB2_WGM1_WGMXCC1_WGMXCCGn1
    SolutionIndex: 72
    SolutionNameMin: Cijk_Alik_Bjlk_BBS_BH_UserArgs_MT128x64x128_MI16x16x1_SN_LDSB1_CLR1_GSU0_GSUC0_GSUWGMRR0_K1_LBSPPA1024_LBSPPB1024_LPB32_MIWT4_2_PLR2_SU32_SUM0_SUS256_SKXCCM8_VWA4_VWB2_WGM1_WGMXCC1_WGMXCCGn1
    SolutionIndex: 73
    SolutionNameMin: Cijk_Alik_Bjlk_BBS_BH_UserArgs_MT128x64x128_MI16x16x1_SN_LDSB1_CLR1_GSU0_GSUC0_GSUWGMRR0_K1_LBSPPA1024_LBSPPB1024_LPB32_MIWT4_2_PLR2_SU32_SUM0_SUS256_SKXCCM8_VWA4_VWB2_WGM4_WGMXCC1_WGMXCCGn1
    SolutionIndex: 74
    SolutionNameMin: Cijk_Alik_Bjlk_BBS_BH_UserArgs_MT128x64x128_MI16x16x1_SN_LDSB1_CLR1_GSU0_GSUC0_GSUWGMRR0_K1_LBSPPA1024_LBSPPB1024_LPB32_MIWT4_2_PLR2_SU32_SUM0_SUS256_SKXCCM8_VWA4_VWB2_WGM8_WGMXCC1_WGMXCCGn1
    SolutionIndex: 75
    SolutionNameMin: Cijk_Alik_Bjlk_BBS_BH_UserArgs_MT64x64x128_MI16x16x1_SN_LDSB1_CLR1_GSU0_GSUC0_GSUWGMRR0_K1_LBSPPA256_LBSPPB1024_LPB32_MIWT2_2_PLR2_SU32_SUM0_SUS256_SKXCCM8_VWA1_VWB2_WGM1_WGMXCC1_WGMXCCGn1
    SolutionIndex: 76
    SolutionNameMin: Cijk_Alik_Bjlk_BBS_BH_UserArgs_MT64x64x128_MI16x16x1_SN_LDSB1_CLR1_GSU0_GSUC0_GSUWGMRR0_K1_LBSPPA512_LBSPPB1024_LPB32_MIWT2_2_PLR2_SU32_SUM0_SUS256_SKXCCM8_VWA2_VWB2_WGM1_WGMXCC1_WGMXCCGn1
    SolutionIndex: 77
    SolutionNameMin: Cijk_Alik_Bjlk_BBS_BH_UserArgs_MT64x64x128_MI16x16x1_SN_LDSB1_CLR1_GSU0_GSUC0_GSUWGMRR0_K1_LBSPPA256_LBSPPB1024_LPB32_MIWT2_2_PLR2_SU32_SUM0_SUS256_SKXCCM8_VWA1_VWB2_WGM4_WGMXCC1_WGMXCCGn1
    SolutionIndex: 78
    SolutionNameMin: Cijk_Alik_Bjlk_BBS_BH_UserArgs_MT64x64x128_MI16x16x1_SN_LDSB1_CLR1_GSU0_GSUC0_GSUWGMRR0_K1_LBSPPA512_LBSPPB1024_LPB32_MIWT2_2_PLR2_SU32_SUM0_SUS256_SKXCCM8_VWA2_VWB2_WGM4_WGMXCC1_WGMXCCGn1
    SolutionIndex: 79
    SolutionNameMin: Cijk_Alik_Bjlk_BBS_BH_UserArgs_MT64x64x128_MI16x16x1_SN_LDSB1_CLR1_GSU0_GSUC0_GSUWGMRR0_K1_LBSPPA256_LBSPPB1024_LPB32_MIWT2_2_PLR2_SU32_SUM0_SUS256_SKXCCM8_VWA1_VWB2_WGM8_WGMXCC1_WGMXCCGn1
    SolutionIndex: 80
    SolutionNameMin: Cijk_Alik_Bjlk_BBS_BH_UserArgs_MT64x64x128_MI16x16x1_SN_LDSB1_CLR1_GSU0_GSUC0_GSUWGMRR0_K1_LBSPPA512_LBSPPB1024_LPB32_MIWT2_2_PLR2_SU32_SUM0_SUS256_SKXCCM8_VWA2_VWB2_WGM8_WGMXCC1_WGMXCCGn1
    SolutionIndex: 81
    SolutionNameMin: Cijk_Alik_Bjlk_BBS_BH_UserArgs_MT32x64x128_MI16x16x1_SN_LDSB1_CLR1_GSU0_GSUC0_GSUWGMRR0_K1_LBSPPA256_LBSPPB1024_LPB32_MIWT1_2_PLR1_SU32_SUM0_SUS256_SKXCCM8_VWA1_VWB2_WGM1_WGMXCC1_WGMXCCGn1
    SolutionIndex: 82
    SolutionNameMin: Cijk_Alik_Bjlk_BBS_BH_UserArgs_MT32x64x128_MI16x16x1_SN_LDSB1_CLR1_GSU0_GSUC0_GSUWGMRR0_K1_LBSPPA256_LBSPPB1024_LPB32_MIWT1_2_PLR2_SU32_SUM0_SUS256_SKXCCM8_VWA1_VWB2_WGM1_WGMXCC1_WGMXCCGn1
    SolutionIndex: 83
    SolutionNameMin: Cijk_Alik_Bjlk_BBS_BH_UserArgs_MT32x64x128_MI16x16x1_SN_LDSB1_CLR1_GSU0_GSUC0_GSUWGMRR0_K1_LBSPPA256_LBSPPB1024_LPB32_MIWT1_2_PLR2_SU32_SUM0_SUS256_SKXCCM8_VWA1_VWB2_WGM4_WGMXCC1_WGMXCCGn1
    SolutionIndex: 84
    SolutionNameMin: Cijk_Alik_Bjlk_BBS_BH_UserArgs_MT32x64x128_MI16x16x1_SN_LDSB1_CLR1_GSU0_GSUC0_GSUWGMRR0_K1_LBSPPA256_LBSPPB1024_LPB32_MIWT1_2_PLR2_SU32_SUM0_SUS256_SKXCCM8_VWA1_VWB2_WGM8_WGMXCC1_WGMXCCGn1
    SolutionIndex: 85
    SolutionNameMin: Cijk_Alik_Bjlk_BBS_BH_UserArgs_MT32x32x128_MI16x16x1_SN_LDSB1_CLR1_GSU0_GSUC0_GSUWGMRR0_K1_LBSPPA256_LBSPPB512_LPB16_MIWT1_1_PLR1_SU32_SUM0_SUS256_SKXCCM8_VWA1_VWB1_WGM1_WGMXCC1_WGMXCCGn1
    SolutionIndex: 86
    SolutionNameMin: Cijk_Alik_Bjlk_BBS_BH_UserArgs_MT32x32x128_MI16x16x1_SN_LDSB1_CLR1_GSU0_GSUC0_GSUWGMRR0_K1_LBSPPA256_LBSPPB512_LPB16_MIWT1_1_PLR2_SU32_SUM0_SUS256_SKXCCM8_VWA1_VWB1_WGM1_WGMXCC1_WGMXCCGn1
    SolutionIndex: 87
    SolutionNameMin: Cijk_Alik_Bjlk_BBS_BH_UserArgs_MT32x32x128_MI16x16x1_SN_LDSB1_CLR1_GSU0_GSUC0_GSUWGMRR0_K1_LBSPPA256_LBSPPB512_LPB16_MIWT1_1_PLR2_SU32_SUM0_SUS256_SKXCCM8_VWA1_VWB1_WGM4_WGMXCC1_WGMXCCGn1
    SolutionIndex: 88
    SolutionNameMin: Cijk_Alik_Bjlk_BBS_BH_UserArgs_MT32x32x128_MI16x16x1_SN_LDSB1_CLR1_GSU0_GSUC0_GSUWGMRR0_K1_LBSPPA256_LBSPPB512_LPB16_MIWT1_1_PLR2_SU32_SUM0_SUS256_SKXCCM8_VWA1_VWB1_WGM8_WGMXCC1_WGMXCCGn1
    SolutionIndex: 89
    SolutionNameMin: Cijk_Alik_Bjlk_BBS_BH_UserArgs_MT32x32x32_MI16x16x1_SN_LDSB0_CLR1_GSU0_GSUC0_GSUWGMRR0_K1_LBSPPA128_LBSPPB256_LPB16_MIWT1_1_PLR1_SU32_SUM0_SUS256_SKXCCM0_VWA1_VWB1_WGM1_WGMXCC1_WGMXCCGn1
- - - [128, 128, 1, 128, 128, 128, 128, 128]
    - [85, 0.085]
  - - [128, 128, 1, 256, 128, 128, 256, 128]
    - [30, 0.104]
  - - [128, 128, 1, 512, 128, 128, 512, 128]
    - [30, 0.179]
  - - [128, 128, 1, 1024, 128, 128, 1024, 128]
    - [85, 0.266]
  - - [128, 128, 1, 2048, 128, 128, 2048, 128]
    - [85, 0.321]
  - - [128, 128, 1, 4096, 128, 128, 4096, 128]
    - [2, 0.533]
  - - [128, 128, 1, 8192, 128, 128, 8192, 128]
    - [42, 1.069]
  - - [128, 256, 1, 128, 128, 128, 128, 256]
    - [30, 0.169]
  - - [128, 256, 1, 256, 128, 128, 256, 256]
    - [30, 0.209]
  - - [128, 256, 1, 512, 128, 128, 512, 256]
    - [85, 0.339]
  - - [128, 256, 1, 1024, 128, 128, 1024, 256]
    - [85, 0.529]
  - - [128, 256, 1, 2048, 128, 128, 2048, 256]
    - [2, 0.8]
  - - [128, 256, 1, 4096, 128, 128, 4096, 256]
    - [14, 1.546]
  - - [128, 256, 1, 8192, 128, 128, 8192, 256]
    - [85, 2.647]
  - - [128, 512, 1, 128, 128, 128, 128, 512]
    - [31, 0.329]
  - - [128, 512, 1, 256, 128, 128, 256, 512]
    - [30, 0.401]
  - - [128, 512, 1, 512, 128, 128, 512, 512]
    - [85, 0.665]
  - - [128, 512, 1, 1024, 128, 128, 1024, 512]
    - [85, 1.103]
  - - [128, 512, 1, 2048, 128, 128, 2048, 512]
    - [85, 2.029]
  - - [128, 512, 1, 4096, 128, 128, 4096, 512]
    - [63, 3.184]
  - - [128, 512, 1, 8192, 128, 128, 8192, 512]
    - [86, 4.718]
  - - [128, 1024, 1, 128, 128, 128, 128, 1024]
    - [31, 0.659]
  - - [128, 1024, 1, 256, 128, 128, 256, 1024]
    - [30, 0.768]
  - - [128, 1024, 1, 512, 128, 128, 512, 1024]
    - [85, 1.409]
  - - [128, 1024, 1, 1024, 128, 128, 1024, 1024]
    - [85, 2.333]
  - - [128, 1024, 1, 2048, 128, 128, 2048, 1024]
    - [32, 3.812]
  - - [128, 1024, 1, 4096, 128, 128, 4096, 1024]
    - [82, 5.45]
  - - [128, 1024, 1, 8192, 128, 128, 8192, 1024]
    - [62, 7.272]
  - - [128, 2048, 1, 128, 128, 128, 128, 2048]
    - [31, 1.261]
  - - [128, 2048, 1, 256, 128, 128, 256, 2048]
    - [30, 1.596]
  - - [128, 2048, 1, 512, 128, 128, 512, 2048]
    - [86, 2.587]
  - - [128, 2048, 1, 1024, 128, 128, 1024, 2048]
    - [82, 4.129]
  - - [128, 2048, 1, 2048, 128, 128, 2048, 2048]
    - [82, 6.624]
  - - [128, 2048, 1, 4096, 128, 128, 4096, 2048]
    - [58, 8.427]
  - - [128, 2048, 1, 8192, 128, 128, 8192, 2048]
    - [60, 11.958]
  - - [128, 4096, 1, 128, 128, 128, 128, 4096]
    - [82, 2.324]
  - - [128, 4096, 1, 256, 128, 128, 256, 4096]
    - [82, 2.914]
  - - [128, 4096, 1, 512, 128, 128, 512, 4096]
    - [82, 4.687]
  - - [128, 4096, 1, 1024, 128, 128, 1024, 4096]
    - [82, 7.146]
  - - [128, 4096, 1, 2048, 128, 128, 2048, 4096]
    - [76, 10.13]
  - - [128, 4096, 1, 4096, 128, 128, 4096, 4096]
    - [61, 13.194]
  - - [128, 4096, 1, 8192, 128, 128, 8192, 4096]
    - [13, 16.399]
  - - [128, 8192, 1, 128, 128, 128, 128, 8192]
    - [26, 4.1]
  - - [128, 8192, 1, 256, 128, 128, 256, 8192]
    - [27, 4.905]
  - - [128, 8192, 1, 512, 128, 128, 512, 8192]
    - [76, 7.702]
  - - [128, 8192, 1, 1024, 128, 128, 1024, 8192]
    - [76, 11.028]
  - - [128, 8192, 1, 2048, 128, 128, 2048, 8192]
    - [13, 14.0]
  - - [128, 8192, 1, 4096, 128, 128, 4096, 8192]
    - [56, 17.812]
  - - [128, 8192, 1, 8192, 128, 128, 8192, 8192]
    - [11, 21.58]
  - - [256, 128, 1, 128, 256, 256, 128, 128]
    - [30, 0.168]
  - - [256, 128, 1, 256, 256, 256, 256, 128]
    - [30, 0.206]
  - - [256, 128, 1, 512, 256, 256, 512, 128]
    - [86, 0.347]
  - - [256, 128, 1, 1024, 256, 256, 1024, 128]
    - [85, 0.52]
  - - [256, 128, 1, 2048, 256, 256, 2048, 128]
    - [2, 0.802]
  - - [256, 128, 1, 4096, 256, 256, 4096, 128]
    - [14, 1.537]
  - - [256, 128, 1, 8192, 256, 256, 8192, 128]
    - [64, 2.708]
  - - [256, 256, 1, 128, 256, 256, 128, 256]
    - [30, 0.327]
  - - [256, 256, 1, 256, 256, 256, 256, 256]
    - [86, 0.387]
  - - [256, 256, 1, 512, 256, 256, 512, 256]
    - [85, 0.667]
  - - [256, 256, 1, 1024, 256, 256, 1024, 256]
    - [86, 1.098]
  - - [256, 256, 1, 2048, 256, 256, 2048, 256]
    - [85, 1.959]
  - - [256, 256, 1, 4096, 256, 256, 4096, 256]
    - [85, 3.373]
  - - [256, 256, 1, 8192, 256, 256, 8192, 256]
    - [82, 4.752]
  - - [256, 512, 1, 128, 256, 256, 128, 512]
    - [30, 0.654]
  - - [256, 512, 1, 256, 256, 256, 256, 512]
    - [86, 0.768]
  - - [256, 512, 1, 512, 256, 256, 512, 512]
    - [85, 1.38]
  - - [256, 512, 1, 1024, 256, 256, 1024, 512]
    - [14, 2.3]
  - - [256, 512, 1, 2048, 256, 256, 2048, 512]
    - [30, 3.954]
  - - [256, 512, 1, 4096, 256, 256, 4096, 512]
    - [82, 5.672]
  - - [256, 512, 1, 8192, 256, 256, 8192, 512]
    - [82, 7.589]
  - - [256, 1024, 1, 128, 256, 256, 128, 1024]
    - [31, 1.268]
  - - [256, 1024, 1, 256, 256, 256, 256, 1024]
    - [31, 1.597]
  - - [256, 1024, 1, 512, 256, 256, 512, 1024]
    - [85, 2.577]
  - - [256, 1024, 1, 1024, 256, 256, 1024, 1024]
    - [82, 4.198]
  - - [256, 1024, 1, 2048, 256, 256, 2048, 1024]
    - [82, 6.699]
  - - [256, 1024, 1, 4096, 256, 256, 4096, 1024]
    - [58, 8.636]
  - - [256, 1024, 1, 8192, 256, 256, 8192, 1024]
    - [59, 11.938]
  - - [256, 2048, 1, 128, 256, 256, 128, 2048]
    - [29, 2.325]
  - - [256, 2048, 1, 256, 256, 256, 256, 2048]
    - [82, 2.908]
  - - [256, 2048, 1, 512, 256, 256, 512, 2048]
    - [82, 4.67]
  - - [256, 2048, 1, 1024, 256, 256, 1024, 2048]
    - [82, 7.112]
  - - [256, 2048, 1, 2048, 256, 256, 2048, 2048]
    - [76, 10.115]
  - - [256, 2048, 1, 4096, 256, 256, 4096, 2048]
    - [61, 13.089]
  - - [256, 2048, 1, 8192, 256, 256, 8192, 2048]
    - [57, 15.851]
  - - [256, 4096, 1, 128, 256, 256, 128, 4096]
    - [27, 3.982]
  - - [256, 4096, 1, 256, 256, 256, 256, 4096]
    - [27, 4.996]
  - - [256, 4096, 1, 512, 256, 256, 512, 4096]
    - [76, 7.993]
  - - [256, 4096, 1, 1024, 256, 256, 1024, 4096]
    - [76, 11.513]
  - - [256, 4096, 1, 2048, 256, 256, 2048, 4096]
    - [72, 14.455]
  - - [256, 4096, 1, 4096, 256, 256, 4096, 4096]
    - [57, 17.722]
  - - [256, 4096, 1, 8192, 256, 256, 8192, 4096]
    - [51, 21.569]
  - - [256, 8192, 1, 128, 256, 256, 128, 8192]
    - [65, 6.257]
  - - [256, 8192, 1, 256, 256, 256, 256, 8192]
    - [22, 7.981]
  - - [256, 8192, 1, 512, 256, 256, 512, 8192]
    - [65, 11.208]
  - - [256, 8192, 1, 1024, 256, 256, 1024, 8192]
    - [72, 15.498]
  - - [256, 8192, 1, 2048, 256, 256, 2048, 8192]
    - [72, 18.565]
  - - [256, 8192, 1, 4096, 256, 256, 4096, 8192]
    - [54, 23.323]
  - - [256, 8192, 1, 8192, 256, 256, 8192, 8192]
    - [11, 25.637]
  - - [512, 128, 1, 128, 512, 512, 128, 128]
    - [30, 0.328]
  - - [512, 128, 1, 256, 512, 512, 256, 128]
    - [30, 0.4]
  - - [512, 128, 1, 512, 512, 512, 512, 128]
    - [85, 0.676]
  - - [512, 128, 1, 1024, 512, 512, 1024, 128]
    - [86, 1.106]
  - - [512, 128, 1, 2048, 512, 512, 2048, 128]
    - [30, 2.062]
  - - [512, 128, 1, 4096, 512, 512, 4096, 128]
    - [85, 3.462]
  - - [512, 128, 1, 8192, 512, 512, 8192, 128]
    - [87, 5.406]
  - - [512, 256, 1, 128, 512, 512, 128, 256]
    - [31, 0.65]
  - - [512, 256, 1, 256, 512, 512, 256, 256]
    - [31, 0.761]
  - - [512, 256, 1, 512, 512, 512, 512, 256]
    - [86, 1.4]
  - - [512, 256, 1, 1024, 512, 512, 1024, 256]
    - [85, 2.306]
  - - [512, 256, 1, 2048, 512, 512, 2048, 256]
    - [30, 3.812]
  - - [512, 256, 1, 4096, 512, 512, 4096, 256]
    - [88, 5.798]
  - - [512, 256, 1, 8192, 512, 512, 8192, 256]
    - [82, 7.998]
  - - [512, 512, 1, 128, 512, 512, 128, 512]
    - [30, 1.25]
  - - [512, 512, 1, 256, 512, 512, 256, 512]
    - [31, 1.587]
  - - [512, 512, 1, 512, 512, 512, 512, 512]
    - [85, 2.59]
  - - [512, 512, 1, 1024, 512, 512, 1024, 512]
    - [82, 4.216]
  - - [512, 512, 1, 2048, 512, 512, 2048, 512]
    - [82, 6.874]
  - - [512, 512, 1, 4096, 512, 512, 4096, 512]
    - [82, 8.909]
  - - [512, 512, 1, 8192, 512, 512, 8192, 512]
    - [59, 11.867]
  - - [512, 1024, 1, 128, 512, 512, 128, 1024]
    - [28, 2.329]
  - - [512, 1024, 1, 256, 512, 512, 256, 1024]
    - [82, 2.915]
  - - [512, 1024, 1, 512, 512, 512, 512, 1024]
    - [82, 4.723]
  - - [512, 1024, 1, 1024, 512, 512, 1024, 1024]
    - [82, 7.23]
  - - [512, 1024, 1, 2048, 512, 512, 2048, 1024]
    - [75, 10.094]
  - - [512, 1024, 1, 4096, 512, 512, 4096, 1024]
    - [61, 12.978]
  - - [512, 1024, 1, 8192, 512, 512, 8192, 1024]
    - [57, 15.926]
  - - [512, 2048, 1, 128, 512, 512, 128, 2048]
    - [26, 4.121]
  - - [512, 2048, 1, 256, 512, 512, 256, 2048]
    - [25, 5.01]
  - - [512, 2048, 1, 512, 512, 512, 512, 2048]
    - [76, 7.904]
  - - [512, 2048, 1, 1024, 512, 512, 1024, 2048]
    - [76, 11.35]
  - - [512, 2048, 1, 2048, 512, 512, 2048, 2048]
    - [73, 14.245]
  - - [512, 2048, 1, 4096, 512, 512, 4096, 2048]
    - [57, 17.837]
  - - [512, 2048, 1, 8192, 512, 512, 8192, 2048]
    - [51, 21.638]
  - - [512, 4096, 1, 128, 512, 512, 128, 4096]
    - [65, 6.24]
  - - [512, 4096, 1, 256, 512, 512, 256, 4096]
    - [22, 7.992]
  - - [512, 4096, 1, 512, 512, 512, 512, 4096]
    - [71, 11.252]
  - - [512, 4096, 1, 1024, 512, 512, 1024, 4096]
    - [72, 15.739]
  - - [512, 4096, 1, 2048, 512, 512, 2048, 4096]
    - [57, 18.418]
  - - [512, 4096, 1, 4096, 512, 512, 4096, 4096]
    - [54, 23.316]
  - - [512, 4096, 1, 8192, 512, 512, 8192, 4096]
    - [54, 25.341]
  - - [512, 8192, 1, 128, 512, 512, 128, 8192]
    - [23, 7.422]
  - - [512, 8192, 1, 256, 512, 512, 256, 8192]
    - [18, 9.691]
  - - [512, 8192, 1, 512, 512, 512, 512, 8192]
    - [72, 13.91]
  - - [512, 8192, 1, 1024, 512, 512, 1024, 8192]
    - [48, 18.621]
  - - [512, 8192, 1, 2048, 512, 512, 2048, 8192]
    - [54, 22.95]
  - - [512, 8192, 1, 4096, 512, 512, 4096, 8192]
    - [53, 26.628]
  - - [512, 8192, 1, 8192, 512, 512, 8192, 8192]
    - [8, 29.428]
  - - [1024, 128, 1, 128, 1024, 1024, 128, 128]
    - [30, 0.659]
  - - [1024, 128, 1, 256, 1024, 1024, 256, 128]
    - [85, 0.761]
  - - [1024, 128, 1, 512, 1024, 1024, 512, 128]
    - [86, 1.42]
  - - [1024, 128, 1, 1024, 1024, 1024, 1024, 128]
    - [85, 2.281]
  - - [1024, 128, 1, 2048, 1024, 1024, 2048, 128]
    - [30, 3.841]
  - - [1024, 128, 1, 4096, 1024, 1024, 4096, 128]
    - [82, 5.964]
  - - [1024, 128, 1, 8192, 1024, 1024, 8192, 128]
    - [84, 8.251]
  - - [1024, 256, 1, 128, 1024, 1024, 128, 256]
    - [31, 1.262]
  - - [1024, 256, 1, 256, 1024, 1024, 256, 256]
    - [31, 1.603]
  - - [1024, 256, 1, 512, 1024, 1024, 512, 256]
    - [86, 2.591]
  - - [1024, 256, 1, 1024, 1024, 1024, 1024, 256]
    - [82, 4.119]
  - - [1024, 256, 1, 2048, 1024, 1024, 2048, 256]
    - [82, 6.704]
  - - [1024, 256, 1, 4096, 1024, 1024, 4096, 256]
    - [83, 9.603]
  - - [1024, 256, 1, 8192, 1024, 1024, 8192, 256]
    - [61, 12.083]
  - - [1024, 512, 1, 128, 1024, 1024, 128, 512]
    - [82, 2.297]
  - - [1024, 512, 1, 256, 1024, 1024, 256, 512]
    - [28, 2.919]
  - - [1024, 512, 1, 512, 1024, 1024, 512, 512]
    - [82, 4.546]
  - - [1024, 512, 1, 1024, 1024, 1024, 1024, 512]
    - [82, 7.291]
  - - [1024, 512, 1, 2048, 1024, 1024, 2048, 512]
    - [78, 10.32]
  - - [1024, 512, 1, 4096, 1024, 1024, 4096, 512]
    - [79, 13.274]
  - - [1024, 512, 1, 8192, 1024, 1024, 8192, 512]
    - [57, 16.005]
  - - [1024, 1024, 1, 128, 1024, 1024, 128, 1024]
    - [26, 4.154]
  - - [1024, 1024, 1, 256, 1024, 1024, 256, 1024]
    - [26, 5.091]
  - - [1024, 1024, 1, 512, 1024, 1024, 512, 1024]
    - [76, 7.883]
  - - [1024, 1024, 1, 1024, 1024, 1024, 1024, 1024]
    - [76, 11.102]
  - - [1024, 1024, 1, 2048, 1024, 1024, 2048, 1024]
    - [74, 14.284]
  - - [1024, 1024, 1, 4096, 1024, 1024, 4096, 1024]
    - [57, 17.654]
  - - [1024, 1024, 1, 8192, 1024, 1024, 8192, 1024]
    - [54, 21.364]
  - - [1024, 2048, 1, 128, 1024, 1024, 128, 2048]
    - [20, 6.33]
  - - [1024, 2048, 1, 256, 1024, 1024, 256, 2048]
    - [23, 8.117]
  - - [1024, 2048, 1, 512, 1024, 1024, 512, 2048]
    - [71, 11.269]
  - - [1024, 2048, 1, 1024, 1024, 1024, 1024, 2048]
    - [72, 15.518]
  - - [1024, 2048, 1, 2048, 1024, 1024, 2048, 2048]
    - [57, 18.172]
  - - [1024, 2048, 1, 4096, 1024, 1024, 4096, 2048]
    - [54, 23.537]
  - - [1024, 2048, 1, 8192, 1024, 1024, 8192, 2048]
    - [50, 25.263]
  - - [1024, 4096, 1, 128, 1024, 1024, 128, 4096]
    - [67, 7.514]
  - - [1024, 4096, 1, 256, 1024, 1024, 256, 4096]
    - [18, 9.945]
  - - [1024, 4096, 1, 512, 1024, 1024, 512, 4096]
    - [72, 14.018]
  - - [1024, 4096, 1, 1024, 1024, 1024, 1024, 4096]
    - [54, 18.151]
  - - [1024, 4096, 1, 2048, 1024, 1024, 2048, 4096]
    - [54, 22.971]
  - - [1024, 4096, 1, 4096, 1024, 1024, 4096, 4096]
    - [53, 26.026]
  - - [1024, 4096, 1, 8192, 1024, 1024, 8192, 4096]
    - [44, 29.122]
  - - [1024, 8192, 1, 128, 1024, 1024, 128, 8192]
    - [16, 8.016]
  - - [1024, 8192, 1, 256, 1024, 1024, 256, 8192]
    - [54, 12.0]
  - - [1024, 8192, 1, 512, 1024, 1024, 512, 8192]
    - [48, 17.354]
  - - [1024, 8192, 1, 1024, 1024, 1024, 1024, 8192]
    - [46, 22.483]
  - - [1024, 8192, 1, 2048, 1024, 1024, 2048, 8192]
    - [54, 26.493]
  - - [1024, 8192, 1, 4096, 1024, 1024, 4096, 8192]
    - [44, 29.215]
  - - [1024, 8192, 1, 8192, 1024, 1024, 8192, 8192]
    - [34, 32.158]
  - - [2048, 128, 1, 128, 2048, 2048, 128, 128]
    - [31, 1.266]
  - - [2048, 128, 1, 256, 2048, 2048, 256, 128]
    - [30, 1.595]
  - - [2048, 128, 1, 512, 2048, 2048, 512, 128]
    - [86, 2.609]
  - - [2048, 128, 1, 1024, 2048, 2048, 1024, 128]
    - [82, 4.143]
  - - [2048, 128, 1, 2048, 2048, 2048, 2048, 128]
    - [82, 6.798]
  - - [2048, 128, 1, 4096, 2048, 2048, 4096, 128]
    - [83, 9.775]
  - - [2048, 128, 1, 8192, 2048, 2048, 8192, 128]
    - [59, 11.882]
  - - [2048, 256, 1, 128, 2048, 2048, 128, 256]
    - [28, 2.362]
  - - [2048, 256, 1, 256, 2048, 2048, 256, 256]
    - [28, 2.902]
  - - [2048, 256, 1, 512, 2048, 2048, 512, 256]
    - [82, 4.654]
  - - [2048, 256, 1, 1024, 2048, 2048, 1024, 256]
    - [82, 7.145]
  - - [2048, 256, 1, 2048, 2048, 2048, 2048, 256]
    - [84, 10.193]
  - - [2048, 256, 1, 4096, 2048, 2048, 4096, 256]
    - [77, 13.737]
  - - [2048, 256, 1, 8192, 2048, 2048, 8192, 256]
    - [15, 15.294]
  - - [2048, 512, 1, 128, 2048, 2048, 128, 512]
    - [26, 4.191]
  - - [2048, 512, 1, 256, 2048, 2048, 256, 512]
    - [24, 5.024]
  - - [2048, 512, 1, 512, 2048, 2048, 512, 512]
    - [76, 7.886]
  - - [2048, 512, 1, 1024, 2048, 2048, 1024, 512]
    - [78, 11.371]
  - - [2048, 512, 1, 2048, 2048, 2048, 2048, 512]
    - [74, 15.054]
  - - [2048, 512, 1, 4096, 2048, 2048, 4096, 512]
    - [57, 18.156]
  - - [2048, 512, 1, 8192, 2048, 2048, 8192, 512]
    - [54, 21.452]
  - - [2048, 1024, 1, 128, 2048, 2048, 128, 1024]
    - [23, 6.433]
  - - [2048, 1024, 1, 256, 2048, 2048, 256, 1024]
    - [20, 8.181]
  - - [2048, 1024, 1, 512, 2048, 2048, 512, 1024]
    - [72, 11.39]
  - - [2048, 1024, 1, 1024, 2048, 2048, 1024, 1024]
    - [74, 15.367]
  - - [2048, 1024, 1, 2048, 2048, 2048, 2048, 1024]
    - [57, 18.15]
  - - [2048, 1024, 1, 4096, 2048, 2048, 4096, 1024]
    - [54, 23.257]
  - - [2048, 1024, 1, 8192, 2048, 2048, 8192, 1024]
    - [50, 25.357]
  - - [2048, 2048, 1, 128, 2048, 2048, 128, 2048]
    - [20, 7.678]
  - - [2048, 2048, 1, 256, 2048, 2048, 256, 2048]
    - [17, 9.794]
  - - [2048, 2048, 1, 512, 2048, 2048, 512, 2048]
    - [72, 13.904]
  - - [2048, 2048, 1, 1024, 2048, 2048, 1024, 2048]
    - [54, 18.067]
  - - [2048, 2048, 1, 2048, 2048, 2048, 2048, 2048]
    - [48, 22.786]
  - - [2048, 2048, 1, 4096, 2048, 2048, 4096, 2048]
    - [44, 26.429]
  - - [2048, 2048, 1, 8192, 2048, 2048, 8192, 2048]
    - [38, 27.972]
  - - [2048, 4096, 1, 128, 2048, 2048, 128, 4096]
    - [23, 8.129]
  - - [2048, 4096, 1, 256, 2048, 2048, 256, 4096]
    - [48, 12.063]
  - - [2048, 4096, 1, 512, 2048, 2048, 512, 4096]
    - [48, 17.161]
  - - [2048, 4096, 1, 1024, 2048, 2048, 1024, 4096]
    - [54, 22.397]
  - - [2048, 4096, 1, 2048, 2048, 2048, 2048, 4096]
    - [53, 26.346]
  - - [2048, 4096, 1, 4096, 2048, 2048, 4096, 4096]
    - [35, 28.977]
  - - [2048, 4096, 1, 8192, 2048, 2048, 8192, 4096]
    - [38, 32.298]
  - - [2048, 8192, 1, 128, 2048, 2048, 128, 8192]
    - [19, 9.257]
  - - [2048, 8192, 1, 256, 2048, 2048, 256, 8192]
    - [48, 14.324]
  - - [2048, 8192, 1, 512, 2048, 2048, 512, 8192]
    - [48, 19.655]
  - - [2048, 8192, 1, 1024, 2048, 2048, 1024, 8192]
    - [39, 25.27]
  - - [2048, 8192, 1, 2048, 2048, 2048, 2048, 8192]
    - [38, 28.553]
  - - [2048, 8192, 1, 4096, 2048, 2048, 4096, 8192]
    - [33, 31.953]
  - - [2048, 8192, 1, 8192, 2048, 2048, 8192, 8192]
    - [35, 34.298]
  - - [4096, 128, 1, 128, 4096, 4096, 128, 128]
    - [81, 2.333]
  - - [4096, 128, 1, 256, 4096, 4096, 256, 128]
    - [28, 2.919]
  - - [4096, 128, 1, 512, 4096, 4096, 512, 128]
    - [82, 4.688]
  - - [4096, 128, 1, 1024, 4096, 4096, 1024, 128]
    - [82, 7.335]
  - - [4096, 128, 1, 2048, 4096, 4096, 2048, 128]
    - [78, 10.27]
  - - [4096, 128, 1, 4096, 4096, 4096, 4096, 128]
    - [79, 13.324]
  - - [4096, 128, 1, 8192, 4096, 4096, 8192, 128]
    - [66, 15.698]
  - - [4096, 256, 1, 128, 4096, 4096, 128, 256]
    - [26, 4.152]
  - - [4096, 256, 1, 256, 4096, 4096, 256, 256]
    - [27, 5.108]
  - - [4096, 256, 1, 512, 4096, 4096, 512, 256]
    - [76, 7.883]
  - - [4096, 256, 1, 1024, 4096, 4096, 1024, 256]
    - [80, 11.345]
  - - [4096, 256, 1, 2048, 4096, 4096, 2048, 256]
    - [80, 14.898]
  - - [4096, 256, 1, 4096, 4096, 4096, 4096, 256]
    - [55, 17.102]
  - - [4096, 256, 1, 8192, 4096, 4096, 8192, 256]
    - [51, 21.439]
  - - [4096, 512, 1, 128, 4096, 4096, 128, 512]
    - [23, 6.414]
  - - [4096, 512, 1, 256, 4096, 4096, 256, 512]
    - [20, 8.196]
  - - [4096, 512, 1, 512, 4096, 4096, 512, 512]
    - [70, 11.172]
  - - [4096, 512, 1, 1024, 4096, 4096, 1024, 512]
    - [73, 15.648]
  - - [4096, 512, 1, 2048, 4096, 4096, 2048, 512]
    - [57, 18.536]
  - - [4096, 512, 1, 4096, 4096, 4096, 4096, 512]
    - [51, 22.544]
  - - [4096, 512, 1, 8192, 4096, 4096, 8192, 512]
    - [49, 25.728]
  - - [4096, 1024, 1, 128, 4096, 4096, 128, 1024]
    - [72, 7.894]
  - - [4096, 1024, 1, 256, 4096, 4096, 256, 1024]
    - [21, 9.809]
  - - [4096, 1024, 1, 512, 4096, 4096, 512, 1024]
    - [54, 13.693]
  - - [4096, 1024, 1, 1024, 4096, 4096, 1024, 1024]
    - [54, 18.383]
  - - [4096, 1024, 1, 2048, 4096, 4096, 2048, 1024]
    - [54, 23.0]
  - - [4096, 1024, 1, 4096, 4096, 4096, 4096, 1024]
    - [53, 26.501]
  - - [4096, 1024, 1, 8192, 4096, 4096, 8192, 1024]
    - [43, 28.21]
  - - [4096, 2048, 1, 128, 4096, 4096, 128, 2048]
    - [8, 8.061]
  - - [4096, 2048, 1, 256, 4096, 4096, 256, 2048]
    - [51, 11.756]
  - - [4096, 2048, 1, 512, 4096, 4096, 512, 2048]
    - [51, 16.823]
  - - [4096, 2048, 1, 1024, 4096, 4096, 1024, 2048]
    - [54, 22.603]
  - - [4096, 2048, 1, 2048, 4096, 4096, 2048, 2048]
    - [44, 26.921]
  - - [4096, 2048, 1, 4096, 4096, 4096, 4096, 2048]
    - [38, 29.009]
  - - [4096, 2048, 1, 8192, 4096, 4096, 8192, 2048]
    - [36, 32.367]
  - - [4096, 4096, 1, 128, 4096, 4096, 128, 4096]
    - [48, 9.341]
  - - [4096, 4096, 1, 256, 4096, 4096, 256, 4096]
    - [54, 13.813]
  - - [4096, 4096, 1, 512, 4096, 4096, 512, 4096]
    - [45, 19.51]
  - - [4096, 4096, 1, 1024, 4096, 4096, 1024, 4096]
    - [51, 25.643]
  - - [4096, 4096, 1, 2048, 4096, 4096, 2048, 4096]
    - [40, 28.572]
  - - [4096, 4096, 1, 4096, 4096, 4096, 4096, 4096]
    - [38, 32.021]
  - - [4096, 4096, 1, 8192, 4096, 4096, 8192, 4096]
    - [34, 35.21]
  - - [4096, 8192, 1, 128, 4096, 4096, 128, 8192]
    - [48, 11.229]
  - - [4096, 8192, 1, 256, 4096, 4096, 256, 8192]
    - [47, 16.126]
  - - [4096, 8192, 1, 512, 4096, 4096, 512, 8192]
    - [11, 21.439]
  - - [4096, 8192, 1, 1024, 4096, 4096, 1024, 8192]
    - [6, 26.7]
  - - [4096, 8192, 1, 2048, 4096, 4096, 2048, 8192]
    - [38, 31.954]
  - - [4096, 8192, 1, 4096, 4096, 4096, 4096, 8192]
    - [6, 36.186]
  - - [4096, 8192, 1, 8192, 4096, 4096, 8192, 8192]
    - [38, 37.937]
  - - [8192, 128, 1, 128, 8192, 8192, 128, 128]
    - [26, 4.122]
  - - [8192, 128, 1, 256, 8192, 8192, 256, 128]
    - [26, 5.107]
  - - [8192, 128, 1, 512, 8192, 8192, 512, 128]
    - [76, 7.93]
  - - [8192, 128, 1, 1024, 8192, 8192, 1024, 128]
    - [78, 11.131]
  - - [8192, 128, 1, 2048, 8192, 8192, 2048, 128]
    - [80, 14.173]
  - - [8192, 128, 1, 4096, 8192, 8192, 4096, 128]
    - [67, 17.225]
  - - [8192, 128, 1, 8192, 8192, 8192, 8192, 128]
    - [12, 21.509]
  - - [8192, 256, 1, 128, 8192, 8192, 128, 256]
    - [23, 6.356]
  - - [8192, 256, 1, 256, 8192, 8192, 256, 256]
    - [21, 8.176]
  - - [8192, 256, 1, 512, 8192, 8192, 512, 256]
    - [70, 11.137]
  - - [8192, 256, 1, 1024, 8192, 8192, 1024, 256]
    - [74, 15.342]
  - - [8192, 256, 1, 2048, 8192, 8192, 2048, 256]
    - [68, 18.33]
  - - [8192, 256, 1, 4096, 8192, 8192, 4096, 256]
    - [48, 22.549]
  - - [8192, 256, 1, 8192, 8192, 8192, 8192, 256]
    - [11, 26.217]
  - - [8192, 512, 1, 128, 8192, 8192, 128, 512]
    - [74, 7.368]
  - - [8192, 512, 1, 256, 8192, 8192, 256, 512]
    - [18, 9.546]
  - - [8192, 512, 1, 512, 8192, 8192, 512, 512]
    - [57, 13.678]
  - - [8192, 512, 1, 1024, 8192, 8192, 1024, 512]
    - [54, 18.579]
  - - [8192, 512, 1, 2048, 8192, 8192, 2048, 512]
    - [48, 22.432]
  - - [8192, 512, 1, 4096, 8192, 8192, 4096, 512]
    - [11, 27.158]
  - - [8192, 512, 1, 8192, 8192, 8192, 8192, 512]
    - [5, 28.771]
  - - [8192, 1024, 1, 128, 8192, 8192, 128, 1024]
    - [69, 7.836]
  - - [8192, 1024, 1, 256, 8192, 8192, 256, 1024]
    - [54, 11.929]
  - - [8192, 1024, 1, 512, 8192, 8192, 512, 1024]
    - [54, 17.214]
  - - [8192, 1024, 1, 1024, 8192, 8192, 1024, 1024]
    - [51, 22.635]
  - - [8192, 1024, 1, 2048, 8192, 8192, 2048, 1024]
    - [54, 26.647]
  - - [8192, 1024, 1, 4096, 8192, 8192, 4096, 1024]
    - [11, 28.915]
  - - [8192, 1024, 1, 8192, 8192, 8192, 8192, 1024]
    - [38, 32.168]
  - - [8192, 2048, 1, 128, 8192, 8192, 128, 2048]
    - [19, 9.124]
  - - [8192, 2048, 1, 256, 8192, 8192, 256, 2048]
    - [9, 13.848]
  - - [8192, 2048, 1, 512, 8192, 8192, 512, 2048]
    - [54, 19.448]
  - - [8192, 2048, 1, 1024, 8192, 8192, 1024, 2048]
    - [11, 25.407]
  - - [8192, 2048, 1, 2048, 8192, 8192, 2048, 2048]
    - [3, 29.167]
  - - [8192, 2048, 1, 4096, 8192, 8192, 4096, 2048]
    - [4, 31.956]
  - - [8192, 2048, 1, 8192, 8192, 8192, 8192, 2048]
    - [38, 35.148]
  - - [8192, 4096, 1, 128, 8192, 8192, 128, 4096]
    - [11, 11.004]
  - - [8192, 4096, 1, 256, 8192, 8192, 256, 4096]
    - [52, 16.077]
  - - [8192, 4096, 1, 512, 8192, 8192, 512, 4096]
    - [11, 21.419]
  - - [8192, 4096, 1, 1024, 8192, 8192, 1024, 4096]
    - [10, 26.736]
  - - [8192, 4096, 1, 2048, 8192, 8192, 2048, 4096]
    - [38, 32.274]
  - - [8192, 4096, 1, 4096, 8192, 8192, 4096, 4096]
    - [3, 36.509]
  - - [8192, 4096, 1, 8192, 8192, 8192, 8192, 4096]
    - [37, 38.711]
  - - [8192, 8192, 1, 128, 8192, 8192, 128, 8192]
    - [7, 11.673]
  - - [8192, 8192, 1, 256, 8192, 8192, 256, 8192]
    - [41, 15.986]
  - - [8192, 8192, 1, 512, 8192, 8192, 512, 8192]
    - [1, 22.171]
  - - [8192, 8192, 1, 1024, 8192, 8192, 1024, 8192]
    - [6, 28.479]
  - - [8192, 8192, 1, 2048, 8192, 8192, 2048, 8192]
    - [36, 35.153]
  - - [8192, 8192, 1, 4096, 8192, 8192, 4096, 8192]
    - [38, 39.983]
  - - [8192, 8192, 1, 8192, 8192, 8192, 8192, 8192]
    - [0, 42.18]
  - - [1, 1, 1, 32, 1, 1, 32, 1]
    - [89, 0.0]
- null
- null
- DeviceEfficiency
- GridBased
