library/src/amd_detail/rocblaslt/src/Tensile/Logic/streamk/gfx942/aquavanjaram942_Cijk_Alik_Bljk_HSS_BH_UserArgs.yaml
- {MinimumRequiredVersion: 4.33.0}
- aquavanjaram942
- gfx942
- [Device 0049, Device 0050]
    SolutionIndex: 0
    SolutionNameMin: Cijk_Alik_Bljk_HSS_BH_UserArgs_MT32x32x32_MI16x16x1_SN_LDSB0_CLR1_GSU0_GSUC0_GSUWGMRR0_K1_LBSPPA128_LBSPPB128_MIWT1_1_PLR1_SU32_SUM0_SUS256_SKXCCM0_VWA1_VWB1_WGM1_WGMXCC1_WGMXCCGn1
    SolutionIndex: 1
    SolutionNameMin: Cijk_Alik_Bljk_HSS_BH_UserArgs_MT256x64x64_MI16x16x1_SN_LDSB1_CLR1_GSU0_GSUC0_GSUWGMRR0_K1_LBSPPA512_LBSPPB128_MIWT8_2_PLR1_SU32_SUM0_SUS256_SKXCCM0_VWA4_VWB1_WGM1_WGMXCC1_WGMXCCGn1
    SolutionIndex: 2
    SolutionNameMin: Cijk_Alik_Bljk_HSS_BH_UserArgs_MT256x64x64_MI16x16x1_SN_LDSB1_CLR1_GSU0_GSUC0_GSUWGMRR0_K1_LBSPPA512_LBSPPB256_MIWT8_2_PLR2_SU32_SUM0_SUS256_SKXCCM0_VWA4_VWB2_WGM1_WGMXCC1_WGMXCCGn1
    SolutionIndex: 3
    SolutionNameMin: Cijk_Alik_Bljk_HSS_BH_UserArgs_MT256x64x64_MI16x16x1_SN_LDSB1_CLR1_GSU0_GSUC0_GSUWGMRR0_K1_LBSPPA512_LBSPPB256_MIWT8_2_PLR1_SU32_SUM0_SUS256_SKXCCM0_VWA4_VWB2_WGM4_WGMXCC1_WGMXCCGn1
    SolutionIndex: 4
    SolutionNameMin: Cijk_Alik_Bljk_HSS_BH_UserArgs_MT256x64x64_MI16x16x1_SN_LDSB1_CLR1_GSU0_GSUC0_GSUWGMRR0_K1_LBSPPA256_LBSPPB128_MIWT8_2_PLR1_SU32_SUM0_SUS256_SKXCCM0_VWA2_VWB1_WGM8_WGMXCC1_WGMXCCGn1
    SolutionIndex: 5
    SolutionNameMin: Cijk_Alik_Bljk_HSS_BH_UserArgs_MT256x64x64_MI16x16x1_SN_LDSB1_CLR1_GSU0_GSUC0_GSUWGMRR0_K1_LBSPPA512_LBSPPB256_MIWT8_2_PLR2_SU32_SUM0_SUS256_SKXCCM0_VWA4_VWB2_WGM8_WGMXCC1_WGMXCCGn1
    SolutionIndex: 6
    SolutionNameMin: Cijk_Alik_Bljk_HSS_BH_UserArgs_MT128x128x64_MI16x16x1_SN_LDSB1_CLR1_GSU0_GSUC0_GSUWGMRR0_K1_LBSPPA256_LBSPPB128_MIWT4_4_PLR1_SU32_SUM0_SUS256_SKXCCM0_VWA2_VWB1_WGM1_WGMXCC1_WGMXCCGn1
    SolutionIndex: 7
    SolutionNameMin: Cijk_Alik_Bljk_HSS_BH_UserArgs_MT128x128x64_MI16x16x1_SN_LDSB1_CLR1_GSU0_GSUC0_GSUWGMRR0_K1_LBSPPA512_LBSPPB128_MIWT4_4_PLR1_SU32_SUM0_SUS256_SKXCCM0_VWA4_VWB1_WGM1_WGMXCC1_WGMXCCGn1
    SolutionIndex: 8
    SolutionNameMin: Cijk_Alik_Bljk_HSS_BH_UserArgs_MT128x128x64_MI16x16x1_SN_LDSB1_CLR1_GSU0_GSUC0_GSUWGMRR0_K1_LBSPPA128_LBSPPB256_MIWT4_4_PLR1_SU32_SUM0_SUS256_SKXCCM0_VWA1_VWB2_WGM1_WGMXCC1_WGMXCCGn1
    SolutionIndex: 9
    SolutionNameMin: Cijk_Alik_Bljk_HSS_BH_UserArgs_MT128x128x64_MI16x16x1_SN_LDSB1_CLR1_GSU0_GSUC0_GSUWGMRR0_K1_LBSPPA512_LBSPPB256_MIWT4_4_PLR1_SU32_SUM0_SUS256_SKXCCM0_VWA4_VWB2_WGM1_WGMXCC1_WGMXCCGn1
    SolutionIndex: 10
    SolutionNameMin: Cijk_Alik_Bljk_HSS_BH_UserArgs_MT128x128x64_MI16x16x1_SN_LDSB1_CLR1_GSU0_GSUC0_GSUWGMRR0_K1_LBSPPA512_LBSPPB512_MIWT4_4_PLR1_SU32_SUM0_SUS256_SKXCCM0_VWA4_VWB4_WGM1_WGMXCC1_WGMXCCGn1
    SolutionIndex: 11
    SolutionNameMin: Cijk_Alik_Bljk_HSS_BH_UserArgs_MT128x128x64_MI16x16x1_SN_LDSB1_CLR1_GSU0_GSUC0_GSUWGMRR0_K1_LBSPPA512_LBSPPB128_MIWT4_4_PLR1_SU32_SUM0_SUS256_SKXCCM0_VWA4_VWB1_WGM4_WGMXCC1_WGMXCCGn1
    SolutionIndex: 12
    SolutionNameMin: Cijk_Alik_Bljk_HSS_BH_UserArgs_MT128x128x64_MI16x16x1_SN_LDSB1_CLR1_GSU0_GSUC0_GSUWGMRR0_K1_LBSPPA512_LBSPPB512_MIWT4_4_PLR1_SU32_SUM0_SUS256_SKXCCM0_VWA4_VWB4_WGM4_WGMXCC1_WGMXCCGn1
    SolutionIndex: 13
    SolutionNameMin: Cijk_Alik_Bljk_HSS_BH_UserArgs_MT128x128x64_MI16x16x1_SN_LDSB1_CLR1_GSU0_GSUC0_GSUWGMRR0_K1_LBSPPA512_LBSPPB512_MIWT4_4_PLR2_SU32_SUM0_SUS256_SKXCCM0_VWA4_VWB4_WGM8_WGMXCC1_WGMXCCGn1
    SolutionIndex: 14
    SolutionNameMin: Cijk_Alik_Bljk_HSS_BH_UserArgs_MT64x128x64_MI16x16x1_SN_LDSB1_CLR1_GSU0_GSUC0_GSUWGMRR0_K1_LBSPPA128_LBSPPB128_MIWT2_4_PLR1_SU32_SUM0_SUS256_SKXCCM0_VWA1_VWB1_WGM1_WGMXCC1_WGMXCCGn1
    SolutionIndex: 15
    SolutionNameMin: Cijk_Alik_Bljk_HSS_BH_UserArgs_MT128x64x64_MI16x16x1_SN_LDSB1_CLR1_GSU0_GSUC0_GSUWGMRR0_K1_LBSPPA512_LBSPPB128_MIWT4_2_PLR1_SU32_SUM0_SUS256_SKXCCM0_VWA4_VWB1_WGM1_WGMXCC1_WGMXCCGn1
    SolutionIndex: 16
    SolutionNameMin: Cijk_Alik_Bljk_HSS_BH_UserArgs_MT128x64x64_MI16x16x1_SN_LDSB1_CLR1_GSU0_GSUC0_GSUWGMRR0_K1_LBSPPA512_LBSPPB256_MIWT4_2_PLR1_SU32_SUM0_SUS256_SKXCCM0_VWA4_VWB2_WGM1_WGMXCC1_WGMXCCGn1
    SolutionIndex: 17
    SolutionNameMin: Cijk_Alik_Bljk_HSS_BH_UserArgs_MT128x64x64_MI16x16x1_SN_LDSB1_CLR1_GSU0_GSUC0_GSUWGMRR0_K1_LBSPPA512_LBSPPB256_MIWT4_2_PLR1_SU32_SUM0_SUS256_SKXCCM0_VWA4_VWB2_WGM8_WGMXCC1_WGMXCCGn1
    SolutionIndex: 18
    SolutionNameMin: Cijk_Alik_Bljk_HSS_BH_UserArgs_MT32x64x64_MI16x16x1_SN_LDSB0_CLR1_GSU0_GSUC0_GSUWGMRR0_K1_LBSPPA128_LBSPPB256_MIWT1_2_PLR1_SU32_SUM0_SUS256_SKXCCM0_VWA1_VWB2_WGM1_WGMXCC1_WGMXCCGn1
    SolutionIndex: 19
    SolutionNameMin: Cijk_Alik_Bljk_HSS_BH_UserArgs_MT32x32x64_MI16x16x1_SN_LDSB0_CLR1_GSU0_GSUC0_GSUWGMRR0_K1_LBSPPA128_LBSPPB128_MIWT1_1_PLR1_SU32_SUM0_SUS256_SKXCCM0_VWA1_VWB1_WGM1_WGMXCC1_WGMXCCGn1
    SolutionIndex: 20
    SolutionNameMin: Cijk_Alik_Bljk_HSS_BH_UserArgs_MT128x32x128_MI16x16x1_SN_LDSB1_CLR1_GSU0_GSUC0_GSUWGMRR0_K1_LBSPPA1024_LBSPPB256_MIWT4_1_PLR2_SU32_SUM0_SUS256_SKXCCM0_VWA4_VWB1_WGM1_WGMXCC1_WGMXCCGn1
    SolutionIndex: 21
    SolutionNameMin: Cijk_Alik_Bljk_HSS_BH_UserArgs_MT64x64x128_MI16x16x1_SN_LDSB1_CLR1_GSU0_GSUC0_GSUWGMRR0_K1_LBSPPA256_LBSPPB512_MIWT2_2_PLR1_SU32_SUM0_SUS256_SKXCCM0_VWA1_VWB2_WGM4_WGMXCC1_WGMXCCGn1
    SolutionIndex: 22
    SolutionNameMin: Cijk_Alik_Bljk_HSS_BH_UserArgs_MT64x64x128_MI16x16x1_SN_LDSB1_CLR1_GSU0_GSUC0_GSUWGMRR0_K1_LBSPPA256_LBSPPB512_MIWT2_2_PLR1_SU32_SUM0_SUS256_SKXCCM0_VWA1_VWB2_WGM8_WGMXCC1_WGMXCCGn1
    SolutionIndex: 23
    SolutionNameMin: Cijk_Alik_Bljk_HSS_BH_UserArgs_MT64x64x128_MI16x16x1_SN_LDSB1_CLR1_GSU0_GSUC0_GSUWGMRR0_K1_LBSPPA256_LBSPPB512_MIWT2_2_PLR2_SU32_SUM0_SUS256_SKXCCM0_VWA1_VWB2_WGM8_WGMXCC1_WGMXCCGn1
    SolutionIndex: 24
    SolutionNameMin: Cijk_Alik_Bljk_HSS_BH_UserArgs_MT32x64x128_MI16x16x1_SN_LDSB1_CLR1_GSU0_GSUC0_GSUWGMRR0_K1_LBSPPA256_LBSPPB256_MIWT1_2_PLR1_SU32_SUM0_SUS256_SKXCCM0_VWA1_VWB1_WGM1_WGMXCC1_WGMXCCGn1
    SolutionIndex: 25
    SolutionNameMin: Cijk_Alik_Bljk_HSS_BH_UserArgs_MT32x64x128_MI16x16x1_SN_LDSB1_CLR1_GSU0_GSUC0_GSUWGMRR0_K1_LBSPPA256_LBSPPB512_MIWT1_2_PLR1_SU32_SUM0_SUS256_SKXCCM0_VWA1_VWB2_WGM1_WGMXCC1_WGMXCCGn1
    SolutionIndex: 26
    SolutionNameMin: Cijk_Alik_Bljk_HSS_BH_UserArgs_MT32x64x128_MI16x16x1_SN_LDSB1_CLR1_GSU0_GSUC0_GSUWGMRR0_K1_LBSPPA256_LBSPPB256_MIWT1_2_PLR2_SU32_SUM0_SUS256_SKXCCM0_VWA1_VWB1_WGM1_WGMXCC1_WGMXCCGn1
    SolutionIndex: 27
    SolutionNameMin: Cijk_Alik_Bljk_HSS_BH_UserArgs_MT64x32x128_MI16x16x1_SN_LDSB1_CLR1_GSU0_GSUC0_GSUWGMRR0_K1_LBSPPA256_LBSPPB256_MIWT2_1_PLR2_SU32_SUM0_SUS256_SKXCCM0_VWA1_VWB1_WGM1_WGMXCC1_WGMXCCGn1
    SolutionIndex: 28
    SolutionNameMin: Cijk_Alik_Bljk_HSS_BH_UserArgs_MT64x32x128_MI16x16x1_SN_LDSB1_CLR1_GSU0_GSUC0_GSUWGMRR0_K1_LBSPPA256_LBSPPB256_MIWT2_1_PLR1_SU32_SUM0_SUS256_SKXCCM0_VWA1_VWB1_WGM4_WGMXCC1_WGMXCCGn1
    SolutionIndex: 29
    SolutionNameMin: Cijk_Alik_Bljk_HSS_BH_UserArgs_MT64x32x128_MI16x16x1_SN_LDSB1_CLR1_GSU0_GSUC0_GSUWGMRR0_K1_LBSPPA256_LBSPPB256_MIWT2_1_PLR2_SU32_SUM0_SUS256_SKXCCM0_VWA1_VWB1_WGM4_WGMXCC1_WGMXCCGn1
    SolutionIndex: 30
    SolutionNameMin: Cijk_Alik_Bljk_HSS_BH_UserArgs_MT64x32x128_MI16x16x1_SN_LDSB1_CLR1_GSU0_GSUC0_GSUWGMRR0_K1_LBSPPA256_LBSPPB256_MIWT2_1_PLR1_SU32_SUM0_SUS256_SKXCCM0_VWA1_VWB1_WGM8_WGMXCC1_WGMXCCGn1
    SolutionIndex: 31
    SolutionNameMin: Cijk_Alik_Bljk_HSS_BH_UserArgs_MT32x32x128_MI16x16x1_SN_LDSB1_CLR1_GSU0_GSUC0_GSUWGMRR0_K1_LBSPPA256_LBSPPB256_MIWT1_1_PLR1_SU32_SUM0_SUS256_SKXCCM0_VWA1_VWB1_WGM1_WGMXCC1_WGMXCCGn1
    SolutionIndex: 32
    SolutionNameMin: Cijk_Alik_Bljk_HSS_BH_UserArgs_MT32x32x128_MI16x16x1_SN_LDSB1_CLR1_GSU0_GSUC0_GSUWGMRR0_K1_LBSPPA256_LBSPPB256_MIWT1_1_PLR2_SU32_SUM0_SUS256_SKXCCM0_VWA1_VWB1_WGM1_WGMXCC1_WGMXCCGn1
    SolutionIndex: 33
    SolutionNameMin: Cijk_Alik_Bljk_HSS_BH_UserArgs_MT32x32x128_MI16x16x1_SN_LDSB1_CLR1_GSU0_GSUC0_GSUWGMRR0_K1_LBSPPA256_LBSPPB256_MIWT1_1_PLR1_SU32_SUM0_SUS256_SKXCCM0_VWA1_VWB1_WGM4_WGMXCC1_WGMXCCGn1
    SolutionIndex: 34
    SolutionNameMin: Cijk_Alik_Bljk_HSS_BH_UserArgs_MT128x128x64_MI16x16x1_SN_LDSB1_CLR1_GSU0_GSUC0_GSUWGMRR0_K1_LBSPPA128_LBSPPB128_MIWT4_4_PLR1_SU32_SUM0_SUS256_SKXCCM8_VWA1_VWB1_WGM1_WGMXCC1_WGMXCCGn1
    SolutionIndex: 35
    SolutionNameMin: Cijk_Alik_Bljk_HSS_BH_UserArgs_MT128x128x64_MI16x16x1_SN_LDSB1_CLR1_GSU0_GSUC0_GSUWGMRR0_K1_LBSPPA512_LBSPPB128_MIWT4_4_PLR1_SU32_SUM0_SUS256_SKXCCM8_VWA4_VWB1_WGM1_WGMXCC1_WGMXCCGn1
    SolutionIndex: 36
    SolutionNameMin: Cijk_Alik_Bljk_HSS_BH_UserArgs_MT128x128x64_MI16x16x1_SN_LDSB1_CLR1_GSU0_GSUC0_GSUWGMRR0_K1_LBSPPA128_LBSPPB256_MIWT4_4_PLR1_SU32_SUM0_SUS256_SKXCCM8_VWA1_VWB2_WGM1_WGMXCC1_WGMXCCGn1
    SolutionIndex: 37
    SolutionNameMin: Cijk_Alik_Bljk_HSS_BH_UserArgs_MT128x128x64_MI16x16x1_SN_LDSB1_CLR1_GSU0_GSUC0_GSUWGMRR0_K1_LBSPPA512_LBSPPB256_MIWT4_4_PLR1_SU32_SUM0_SUS256_SKXCCM8_VWA4_VWB2_WGM1_WGMXCC1_WGMXCCGn1
    SolutionIndex: 38
    SolutionNameMin: Cijk_Alik_Bljk_HSS_BH_UserArgs_MT128x128x64_MI16x16x1_SN_LDSB1_CLR1_GSU0_GSUC0_GSUWGMRR0_K1_LBSPPA512_LBSPPB512_MIWT4_4_PLR1_SU32_SUM0_SUS256_SKXCCM8_VWA4_VWB4_WGM1_WGMXCC1_WGMXCCGn1
    SolutionIndex: 39
    SolutionNameMin: Cijk_Alik_Bljk_HSS_BH_UserArgs_MT128x128x64_MI16x16x1_SN_LDSB1_CLR1_GSU0_GSUC0_GSUWGMRR0_K1_LBSPPA128_LBSPPB128_MIWT4_4_PLR1_SU32_SUM0_SUS256_SKXCCM8_VWA1_VWB1_WGM4_WGMXCC1_WGMXCCGn1
    SolutionIndex: 40
    SolutionNameMin: Cijk_Alik_Bljk_HSS_BH_UserArgs_MT128x128x64_MI16x16x1_SN_LDSB1_CLR1_GSU0_GSUC0_GSUWGMRR0_K1_LBSPPA256_LBSPPB128_MIWT4_4_PLR1_SU32_SUM0_SUS256_SKXCCM8_VWA2_VWB1_WGM4_WGMXCC1_WGMXCCGn1
    SolutionIndex: 41
    SolutionNameMin: Cijk_Alik_Bljk_HSS_BH_UserArgs_MT128x128x64_MI16x16x1_SN_LDSB1_CLR1_GSU0_GSUC0_GSUWGMRR0_K1_LBSPPA512_LBSPPB128_MIWT4_4_PLR1_SU32_SUM0_SUS256_SKXCCM8_VWA4_VWB1_WGM4_WGMXCC1_WGMXCCGn1
    SolutionIndex: 42
    SolutionNameMin: Cijk_Alik_Bljk_HSS_BH_UserArgs_MT128x128x64_MI16x16x1_SN_LDSB1_CLR1_GSU0_GSUC0_GSUWGMRR0_K1_LBSPPA128_LBSPPB256_MIWT4_4_PLR1_SU32_SUM0_SUS256_SKXCCM8_VWA1_VWB2_WGM4_WGMXCC1_WGMXCCGn1
    SolutionIndex: 43
    SolutionNameMin: Cijk_Alik_Bljk_HSS_BH_UserArgs_MT128x128x64_MI16x16x1_SN_LDSB1_CLR1_GSU0_GSUC0_GSUWGMRR0_K1_LBSPPA512_LBSPPB256_MIWT4_4_PLR1_SU32_SUM0_SUS256_SKXCCM8_VWA4_VWB2_WGM4_WGMXCC1_WGMXCCGn1
    SolutionIndex: 44
    SolutionNameMin: Cijk_Alik_Bljk_HSS_BH_UserArgs_MT128x128x64_MI16x16x1_SN_LDSB1_CLR1_GSU0_GSUC0_GSUWGMRR0_K1_LBSPPA128_LBSPPB512_MIWT4_4_PLR1_SU32_SUM0_SUS256_SKXCCM8_VWA1_VWB4_WGM4_WGMXCC1_WGMXCCGn1
    SolutionIndex: 45
    SolutionNameMin: Cijk_Alik_Bljk_HSS_BH_UserArgs_MT128x128x64_MI16x16x1_SN_LDSB1_CLR1_GSU0_GSUC0_GSUWGMRR0_K1_LBSPPA512_LBSPPB512_MIWT4_4_PLR1_SU32_SUM0_SUS256_SKXCCM8_VWA4_VWB4_WGM4_WGMXCC1_WGMXCCGn1
    SolutionIndex: 46
    SolutionNameMin: Cijk_Alik_Bljk_HSS_BH_UserArgs_MT128x128x64_MI16x16x1_SN_LDSB1_CLR1_GSU0_GSUC0_GSUWGMRR0_K1_LBSPPA256_LBSPPB128_MIWT4_4_PLR1_SU32_SUM0_SUS256_SKXCCM8_VWA2_VWB1_WGM8_WGMXCC1_WGMXCCGn1
    SolutionIndex: 47
    SolutionNameMin: Cijk_Alik_Bljk_HSS_BH_UserArgs_MT128x128x64_MI16x16x1_SN_LDSB1_CLR1_GSU0_GSUC0_GSUWGMRR0_K1_LBSPPA512_LBSPPB128_MIWT4_4_PLR1_SU32_SUM0_SUS256_SKXCCM8_VWA4_VWB1_WGM8_WGMXCC1_WGMXCCGn1
    SolutionIndex: 48
    SolutionNameMin: Cijk_Alik_Bljk_HSS_BH_UserArgs_MT128x128x64_MI16x16x1_SN_LDSB1_CLR1_GSU0_GSUC0_GSUWGMRR0_K1_LBSPPA128_LBSPPB256_MIWT4_4_PLR1_SU32_SUM0_SUS256_SKXCCM8_VWA1_VWB2_WGM8_WGMXCC1_WGMXCCGn1
    SolutionIndex: 49
    SolutionNameMin: Cijk_Alik_Bljk_HSS_BH_UserArgs_MT128x128x64_MI16x16x1_SN_LDSB1_CLR1_GSU0_GSUC0_GSUWGMRR0_K1_LBSPPA512_LBSPPB256_MIWT4_4_PLR1_SU32_SUM0_SUS256_SKXCCM8_VWA4_VWB2_WGM8_WGMXCC1_WGMXCCGn1
    SolutionIndex: 50
    SolutionNameMin: Cijk_Alik_Bljk_HSS_BH_UserArgs_MT128x128x64_MI16x16x1_SN_LDSB1_CLR1_GSU0_GSUC0_GSUWGMRR0_K1_LBSPPA128_LBSPPB512_MIWT4_4_PLR1_SU32_SUM0_SUS256_SKXCCM8_VWA1_VWB4_WGM8_WGMXCC1_WGMXCCGn1
    SolutionIndex: 51
    SolutionNameMin: Cijk_Alik_Bljk_HSS_BH_UserArgs_MT128x128x64_MI16x16x1_SN_LDSB1_CLR1_GSU0_GSUC0_GSUWGMRR0_K1_LBSPPA512_LBSPPB512_MIWT4_4_PLR1_SU32_SUM0_SUS256_SKXCCM8_VWA4_VWB4_WGM8_WGMXCC1_WGMXCCGn1
    SolutionIndex: 52
    SolutionNameMin: Cijk_Alik_Bljk_HSS_BH_UserArgs_MT64x128x64_MI16x16x1_SN_LDSB1_CLR1_GSU0_GSUC0_GSUWGMRR0_K1_LBSPPA128_LBSPPB256_MIWT2_4_PLR1_SU32_SUM0_SUS256_SKXCCM8_VWA1_VWB2_WGM1_WGMXCC1_WGMXCCGn1
    SolutionIndex: 53
    SolutionNameMin: Cijk_Alik_Bljk_HSS_BH_UserArgs_MT64x128x64_MI16x16x1_SN_LDSB1_CLR1_GSU0_GSUC0_GSUWGMRR0_K1_LBSPPA128_LBSPPB512_MIWT2_4_PLR1_SU32_SUM0_SUS256_SKXCCM8_VWA1_VWB4_WGM1_WGMXCC1_WGMXCCGn1
    SolutionIndex: 54
    SolutionNameMin: Cijk_Alik_Bljk_HSS_BH_UserArgs_MT64x128x64_MI16x16x1_SN_LDSB1_CLR1_GSU0_GSUC0_GSUWGMRR0_K1_LBSPPA128_LBSPPB128_MIWT2_4_PLR1_SU32_SUM0_SUS256_SKXCCM8_VWA1_VWB1_WGM4_WGMXCC1_WGMXCCGn1
    SolutionIndex: 55
    SolutionNameMin: Cijk_Alik_Bljk_HSS_BH_UserArgs_MT64x128x64_MI16x16x1_SN_LDSB1_CLR1_GSU0_GSUC0_GSUWGMRR0_K1_LBSPPA128_LBSPPB128_MIWT2_4_PLR1_SU32_SUM0_SUS256_SKXCCM8_VWA1_VWB1_WGM8_WGMXCC1_WGMXCCGn1
    SolutionIndex: 56
    SolutionNameMin: Cijk_Alik_Bljk_HSS_BH_UserArgs_MT64x128x64_MI16x16x1_SN_LDSB1_CLR1_GSU0_GSUC0_GSUWGMRR0_K1_LBSPPA128_LBSPPB256_MIWT2_4_PLR1_SU32_SUM0_SUS256_SKXCCM8_VWA1_VWB2_WGM8_WGMXCC1_WGMXCCGn1
    SolutionIndex: 57
    SolutionNameMin: Cijk_Alik_Bljk_HSS_BH_UserArgs_MT128x64x64_MI16x16x1_SN_LDSB1_CLR1_GSU0_GSUC0_GSUWGMRR0_K1_LBSPPA512_LBSPPB128_MIWT4_2_PLR1_SU32_SUM0_SUS256_SKXCCM8_VWA4_VWB1_WGM1_WGMXCC1_WGMXCCGn1
    SolutionIndex: 58
    SolutionNameMin: Cijk_Alik_Bljk_HSS_BH_UserArgs_MT128x64x64_MI16x16x1_SN_LDSB1_CLR1_GSU0_GSUC0_GSUWGMRR0_K1_LBSPPA512_LBSPPB256_MIWT4_2_PLR1_SU32_SUM0_SUS256_SKXCCM8_VWA4_VWB2_WGM1_WGMXCC1_WGMXCCGn1
    SolutionIndex: 59
    SolutionNameMin: Cijk_Alik_Bljk_HSS_BH_UserArgs_MT128x64x64_MI16x16x1_SN_LDSB1_CLR1_GSU0_GSUC0_GSUWGMRR0_K1_LBSPPA512_LBSPPB256_MIWT4_2_PLR1_SU32_SUM0_SUS256_SKXCCM8_VWA4_VWB2_WGM4_WGMXCC1_WGMXCCGn1
    SolutionIndex: 60
    SolutionNameMin: Cijk_Alik_Bljk_HSS_BH_UserArgs_MT128x64x64_MI16x16x1_SN_LDSB1_CLR1_GSU0_GSUC0_GSUWGMRR0_K1_LBSPPA512_LBSPPB128_MIWT4_2_PLR1_SU32_SUM0_SUS256_SKXCCM8_VWA4_VWB1_WGM8_WGMXCC1_WGMXCCGn1
    SolutionIndex: 61
    SolutionNameMin: Cijk_Alik_Bljk_HSS_BH_UserArgs_MT128x64x64_MI16x16x1_SN_LDSB1_CLR1_GSU0_GSUC0_GSUWGMRR0_K1_LBSPPA512_LBSPPB256_MIWT4_2_PLR1_SU32_SUM0_SUS256_SKXCCM8_VWA4_VWB2_WGM8_WGMXCC1_WGMXCCGn1
    SolutionIndex: 62
    SolutionNameMin: Cijk_Alik_Bljk_HSS_BH_UserArgs_MT64x64x64_MI16x16x1_SN_LDSB1_CLR1_GSU0_GSUC0_GSUWGMRR0_K1_LBSPPA128_LBSPPB128_MIWT2_2_PLR1_SU32_SUM0_SUS256_SKXCCM8_VWA1_VWB1_WGM1_WGMXCC1_WGMXCCGn1
    SolutionIndex: 63
    SolutionNameMin: Cijk_Alik_Bljk_HSS_BH_UserArgs_MT64x64x64_MI16x16x1_SN_LDSB1_CLR1_GSU0_GSUC0_GSUWGMRR0_K1_LBSPPA128_LBSPPB256_MIWT2_2_PLR1_SU32_SUM0_SUS256_SKXCCM8_VWA1_VWB2_WGM1_WGMXCC1_WGMXCCGn1
    SolutionIndex: 64
    SolutionNameMin: Cijk_Alik_Bljk_HSS_BH_UserArgs_MT64x64x64_MI16x16x1_SN_LDSB1_CLR1_GSU0_GSUC0_GSUWGMRR0_K1_LBSPPA128_LBSPPB128_MIWT2_2_PLR1_SU32_SUM0_SUS256_SKXCCM8_VWA1_VWB1_WGM4_WGMXCC1_WGMXCCGn1
    SolutionIndex: 65
    SolutionNameMin: Cijk_Alik_Bljk_HSS_BH_UserArgs_MT64x64x64_MI16x16x1_SN_LDSB1_CLR1_GSU0_GSUC0_GSUWGMRR0_K1_LBSPPA128_LBSPPB256_MIWT2_2_PLR1_SU32_SUM0_SUS256_SKXCCM8_VWA1_VWB2_WGM4_WGMXCC1_WGMXCCGn1
    SolutionIndex: 66
    SolutionNameMin: Cijk_Alik_Bljk_HSS_BH_UserArgs_MT32x64x64_MI16x16x1_SN_LDSB0_CLR1_GSU0_GSUC0_GSUWGMRR0_K1_LBSPPA128_LBSPPB256_MIWT1_2_PLR1_SU32_SUM0_SUS256_SKXCCM8_VWA1_VWB2_WGM1_WGMXCC1_WGMXCCGn1
    SolutionIndex: 67
    SolutionNameMin: Cijk_Alik_Bljk_HSS_BH_UserArgs_MT32x64x64_MI16x16x1_SN_LDSB0_CLR1_GSU0_GSUC0_GSUWGMRR0_K1_LBSPPA128_LBSPPB256_MIWT1_2_PLR1_SU32_SUM0_SUS256_SKXCCM8_VWA1_VWB2_WGM4_WGMXCC1_WGMXCCGn1
    SolutionIndex: 68
    SolutionNameMin: Cijk_Alik_Bljk_HSS_BH_UserArgs_MT64x32x64_MI16x16x1_SN_LDSB0_CLR1_GSU0_GSUC0_GSUWGMRR0_K1_LBSPPA256_LBSPPB128_MIWT2_1_PLR1_SU32_SUM0_SUS256_SKXCCM8_VWA2_VWB1_WGM1_WGMXCC1_WGMXCCGn1
    SolutionIndex: 69
    SolutionNameMin: Cijk_Alik_Bljk_HSS_BH_UserArgs_MT64x32x64_MI16x16x1_SN_LDSB0_CLR1_GSU0_GSUC0_GSUWGMRR0_K1_LBSPPA256_LBSPPB128_MIWT2_1_PLR1_SU32_SUM0_SUS256_SKXCCM8_VWA2_VWB1_WGM4_WGMXCC1_WGMXCCGn1
    SolutionIndex: 70
    SolutionNameMin: Cijk_Alik_Bljk_HSS_BH_UserArgs_MT32x32x64_MI16x16x1_SN_LDSB0_CLR1_GSU0_GSUC0_GSUWGMRR0_K1_LBSPPA128_LBSPPB128_MIWT1_1_PLR1_SU32_SUM0_SUS256_SKXCCM8_VWA1_VWB1_WGM1_WGMXCC1_WGMXCCGn1
    SolutionIndex: 71
    SolutionNameMin: Cijk_Alik_Bljk_HSS_BH_UserArgs_MT32x32x64_MI16x16x1_SN_LDSB0_CLR1_GSU0_GSUC0_GSUWGMRR0_K1_LBSPPA128_LBSPPB128_MIWT1_1_PLR1_SU32_SUM0_SUS256_SKXCCM8_VWA1_VWB1_WGM4_WGMXCC1_WGMXCCGn1
    SolutionIndex: 72
    SolutionNameMin: Cijk_Alik_Bljk_HSS_BH_UserArgs_MT128x32x128_MI16x16x1_SN_LDSB1_CLR1_GSU0_GSUC0_GSUWGMRR0_K1_LBSPPA256_LBSPPB256_MIWT4_1_PLR1_SU32_SUM0_SUS256_SKXCCM8_VWA1_VWB1_WGM1_WGMXCC1_WGMXCCGn1
    SolutionIndex: 73
    SolutionNameMin: Cijk_Alik_Bljk_HSS_BH_UserArgs_MT128x32x128_MI16x16x1_SN_LDSB1_CLR1_GSU0_GSUC0_GSUWGMRR0_K1_LBSPPA1024_LBSPPB256_MIWT4_1_PLR1_SU32_SUM0_SUS256_SKXCCM8_VWA4_VWB1_WGM1_WGMXCC1_WGMXCCGn1
    SolutionIndex: 74
    SolutionNameMin: Cijk_Alik_Bljk_HSS_BH_UserArgs_MT64x64x128_MI16x16x1_SN_LDSB1_CLR1_GSU0_GSUC0_GSUWGMRR0_K1_LBSPPA256_LBSPPB256_MIWT2_2_PLR1_SU32_SUM0_SUS256_SKXCCM8_VWA1_VWB1_WGM1_WGMXCC1_WGMXCCGn1
    SolutionIndex: 75
    SolutionNameMin: Cijk_Alik_Bljk_HSS_BH_UserArgs_MT64x64x128_MI16x16x1_SN_LDSB1_CLR1_GSU0_GSUC0_GSUWGMRR0_K1_LBSPPA256_LBSPPB512_MIWT2_2_PLR1_SU32_SUM0_SUS256_SKXCCM8_VWA1_VWB2_WGM1_WGMXCC1_WGMXCCGn1
    SolutionIndex: 76
    SolutionNameMin: Cijk_Alik_Bljk_HSS_BH_UserArgs_MT64x64x128_MI16x16x1_SN_LDSB1_CLR1_GSU0_GSUC0_GSUWGMRR0_K1_LBSPPA256_LBSPPB256_MIWT2_2_PLR2_SU32_SUM0_SUS256_SKXCCM8_VWA1_VWB1_WGM1_WGMXCC1_WGMXCCGn1
    SolutionIndex: 77
    SolutionNameMin: Cijk_Alik_Bljk_HSS_BH_UserArgs_MT64x64x128_MI16x16x1_SN_LDSB1_CLR1_GSU0_GSUC0_GSUWGMRR0_K1_LBSPPA256_LBSPPB512_MIWT2_2_PLR2_SU32_SUM0_SUS256_SKXCCM8_VWA1_VWB2_WGM1_WGMXCC1_WGMXCCGn1
    SolutionIndex: 78
    SolutionNameMin: Cijk_Alik_Bljk_HSS_BH_UserArgs_MT64x64x128_MI16x16x1_SN_LDSB1_CLR1_GSU0_GSUC0_GSUWGMRR0_K1_LBSPPA256_LBSPPB256_MIWT2_2_PLR1_SU32_SUM0_SUS256_SKXCCM8_VWA1_VWB1_WGM4_WGMXCC1_WGMXCCGn1
    SolutionIndex: 79
    SolutionNameMin: Cijk_Alik_Bljk_HSS_BH_UserArgs_MT64x64x128_MI16x16x1_SN_LDSB1_CLR1_GSU0_GSUC0_GSUWGMRR0_K1_LBSPPA256_LBSPPB512_MIWT2_2_PLR1_SU32_SUM0_SUS256_SKXCCM8_VWA1_VWB2_WGM4_WGMXCC1_WGMXCCGn1
    SolutionIndex: 80
    SolutionNameMin: Cijk_Alik_Bljk_HSS_BH_UserArgs_MT64x64x128_MI16x16x1_SN_LDSB1_CLR1_GSU0_GSUC0_GSUWGMRR0_K1_LBSPPA256_LBSPPB256_MIWT2_2_PLR2_SU32_SUM0_SUS256_SKXCCM8_VWA1_VWB1_WGM4_WGMXCC1_WGMXCCGn1
    SolutionIndex: 81
    SolutionNameMin: Cijk_Alik_Bljk_HSS_BH_UserArgs_MT64x64x128_MI16x16x1_SN_LDSB1_CLR1_GSU0_GSUC0_GSUWGMRR0_K1_LBSPPA256_LBSPPB512_MIWT2_2_PLR2_SU32_SUM0_SUS256_SKXCCM8_VWA1_VWB2_WGM4_WGMXCC1_WGMXCCGn1
    SolutionIndex: 82
    SolutionNameMin: Cijk_Alik_Bljk_HSS_BH_UserArgs_MT64x64x128_MI16x16x1_SN_LDSB1_CLR1_GSU0_GSUC0_GSUWGMRR0_K1_LBSPPA256_LBSPPB256_MIWT2_2_PLR1_SU32_SUM0_SUS256_SKXCCM8_VWA1_VWB1_WGM8_WGMXCC1_WGMXCCGn1
    SolutionIndex: 83
    SolutionNameMin: Cijk_Alik_Bljk_HSS_BH_UserArgs_MT64x64x128_MI16x16x1_SN_LDSB1_CLR1_GSU0_GSUC0_GSUWGMRR0_K1_LBSPPA256_LBSPPB256_MIWT2_2_PLR2_SU32_SUM0_SUS256_SKXCCM8_VWA1_VWB1_WGM8_WGMXCC1_WGMXCCGn1
    SolutionIndex: 84
    SolutionNameMin: Cijk_Alik_Bljk_HSS_BH_UserArgs_MT32x64x128_MI16x16x1_SN_LDSB1_CLR1_GSU0_GSUC0_GSUWGMRR0_K1_LBSPPA256_LBSPPB512_MIWT1_2_PLR1_SU32_SUM0_SUS256_SKXCCM8_VWA1_VWB2_WGM1_WGMXCC1_WGMXCCGn1
    SolutionIndex: 85
    SolutionNameMin: Cijk_Alik_Bljk_HSS_BH_UserArgs_MT32x64x128_MI16x16x1_SN_LDSB1_CLR1_GSU0_GSUC0_GSUWGMRR0_K1_LBSPPA256_LBSPPB512_MIWT1_2_PLR2_SU32_SUM0_SUS256_SKXCCM8_VWA1_VWB2_WGM1_WGMXCC1_WGMXCCGn1
    SolutionIndex: 86
    SolutionNameMin: Cijk_Alik_Bljk_HSS_BH_UserArgs_MT32x64x128_MI16x16x1_SN_LDSB1_CLR1_GSU0_GSUC0_GSUWGMRR0_K1_LBSPPA256_LBSPPB512_MIWT1_2_PLR1_SU32_SUM0_SUS256_SKXCCM8_VWA1_VWB2_WGM4_WGMXCC1_WGMXCCGn1
    SolutionIndex: 87
    SolutionNameMin: Cijk_Alik_Bljk_HSS_BH_UserArgs_MT64x32x128_MI16x16x1_SN_LDSB1_CLR1_GSU0_GSUC0_GSUWGMRR0_K1_LBSPPA256_LBSPPB256_MIWT2_1_PLR1_SU32_SUM0_SUS256_SKXCCM8_VWA1_VWB1_WGM1_WGMXCC1_WGMXCCGn1
    SolutionIndex: 88
    SolutionNameMin: Cijk_Alik_Bljk_HSS_BH_UserArgs_MT64x32x128_MI16x16x1_SN_LDSB1_CLR1_GSU0_GSUC0_GSUWGMRR0_K1_LBSPPA256_LBSPPB256_MIWT2_1_PLR2_SU32_SUM0_SUS256_SKXCCM8_VWA1_VWB1_WGM1_WGMXCC1_WGMXCCGn1
    SolutionIndex: 89
    SolutionNameMin: Cijk_Alik_Bljk_HSS_BH_UserArgs_MT64x32x128_MI16x16x1_SN_LDSB1_CLR1_GSU0_GSUC0_GSUWGMRR0_K1_LBSPPA512_LBSPPB256_MIWT2_1_PLR2_SU32_SUM0_SUS256_SKXCCM8_VWA2_VWB1_WGM1_WGMXCC1_WGMXCCGn1
    SolutionIndex: 90
    SolutionNameMin: Cijk_Alik_Bljk_HSS_BH_UserArgs_MT32x32x128_MI16x16x1_SN_LDSB1_CLR1_GSU0_GSUC0_GSUWGMRR0_K1_LBSPPA256_LBSPPB256_MIWT1_1_PLR1_SU32_SUM0_SUS256_SKXCCM8_VWA1_VWB1_WGM1_WGMXCC1_WGMXCCGn1
    SolutionIndex: 91
    SolutionNameMin: Cijk_Alik_Bljk_HSS_BH_UserArgs_MT32x32x128_MI16x16x1_SN_LDSB1_CLR1_GSU0_GSUC0_GSUWGMRR0_K1_LBSPPA256_LBSPPB256_MIWT1_1_PLR2_SU32_SUM0_SUS256_SKXCCM8_VWA1_VWB1_WGM1_WGMXCC1_WGMXCCGn1
    SolutionIndex: 92
    SolutionNameMin: Cijk_Alik_Bljk_HSS_BH_UserArgs_MT32x32x128_MI16x16x1_SN_LDSB1_CLR1_GSU0_GSUC0_GSUWGMRR0_K1_LBSPPA256_LBSPPB256_MIWT1_1_PLR1_SU32_SUM0_SUS256_SKXCCM8_VWA1_VWB1_WGM4_WGMXCC1_WGMXCCGn1
    SolutionIndex: 93
    SolutionNameMin: Cijk_Alik_Bljk_HSS_BH_UserArgs_MT32x32x128_MI16x16x1_SN_LDSB1_CLR1_GSU0_GSUC0_GSUWGMRR0_K1_LBSPPA256_LBSPPB256_MIWT1_1_PLR2_SU32_SUM0_SUS256_SKXCCM8_VWA1_VWB1_WGM4_WGMXCC1_WGMXCCGn1
    SolutionIndex: 94
    SolutionNameMin: Cijk_Alik_Bljk_HSS_BH_UserArgs_MT32x32x128_MI16x16x1_SN_LDSB1_CLR1_GSU0_GSUC0_GSUWGMRR0_K1_LBSPPA256_LBSPPB256_MIWT1_1_PLR2_SU32_SUM0_SUS256_SKXCCM8_VWA1_VWB1_WGM8_WGMXCC1_WGMXCCGn1
    SolutionIndex: 95
    SolutionNameMin: Cijk_Alik_Bljk_HSS_BH_UserArgs_MT32x32x32_MI16x16x1_SN_LDSB0_CLR0_GSU0_GSUC0_GSUWGMRR0_K1_LBSPPA128_LBSPPB128_MIWT1_1_PLR0_SU32_SUM0_SUS256_SKXCCM8_VWA1_VWB1_WGM1_WGMXCC1_WGMXCCGn1
- - - [128, 128, 1, 128, 128, 128, 128, 128]
    - [90, 0.089]
  - - [128, 128, 1, 256, 128, 128, 256, 256]
    - [31, 0.108]
  - - [128, 128, 1, 512, 128, 128, 512, 512]
    - [31, 0.186]
  - - [128, 128, 1, 1024, 128, 128, 1024, 1024]
    - [31, 0.259]
  - - [128, 128, 1, 2048, 128, 128, 2048, 2048]
    - [90, 0.359]
  - - [128, 128, 1, 4096, 128, 128, 4096, 4096]
    - [0, 0.546]
  - - [128, 128, 1, 8192, 128, 128, 8192, 8192]
    - [19, 1.069]
  - - [128, 256, 1, 128, 128, 128, 128, 128]
    - [31, 0.185]
  - - [128, 256, 1, 256, 128, 128, 256, 256]
    - [32, 0.222]
  - - [128, 256, 1, 512, 128, 128, 512, 512]
    - [31, 0.37]
  - - [128, 256, 1, 1024, 128, 128, 1024, 1024]
    - [90, 0.523]
  - - [128, 256, 1, 2048, 128, 128, 2048, 2048]
    - [0, 0.825]
  - - [128, 256, 1, 4096, 128, 128, 4096, 4096]
    - [19, 1.631]
  - - [128, 256, 1, 8192, 128, 128, 8192, 8192]
    - [70, 3.014]
  - - [128, 512, 1, 128, 128, 128, 128, 128]
    - [91, 0.329]
  - - [128, 512, 1, 256, 128, 128, 256, 256]
    - [32, 0.415]
  - - [128, 512, 1, 512, 128, 128, 512, 512]
    - [90, 0.731]
  - - [128, 512, 1, 1024, 128, 128, 1024, 1024]
    - [70, 1.155]
  - - [128, 512, 1, 2048, 128, 128, 2048, 2048]
    - [91, 2.196]
  - - [128, 512, 1, 4096, 128, 128, 4096, 4096]
    - [70, 3.833]
  - - [128, 512, 1, 8192, 128, 128, 8192, 8192]
    - [91, 6.384]
  - - [128, 1024, 1, 128, 128, 128, 128, 128]
    - [31, 0.722]
  - - [128, 1024, 1, 256, 128, 128, 256, 256]
    - [90, 0.814]
  - - [128, 1024, 1, 512, 128, 128, 512, 512]
    - [90, 1.439]
  - - [128, 1024, 1, 1024, 128, 128, 1024, 1024]
    - [31, 2.454]
  - - [128, 1024, 1, 2048, 128, 128, 2048, 2048]
    - [70, 4.311]
  - - [128, 1024, 1, 4096, 128, 128, 4096, 4096]
    - [91, 7.073]
  - - [128, 1024, 1, 8192, 128, 128, 8192, 8192]
    - [91, 8.887]
  - - [128, 2048, 1, 128, 128, 128, 128, 128]
    - [31, 1.383]
  - - [128, 2048, 1, 256, 128, 128, 256, 256]
    - [91, 1.659]
  - - [128, 2048, 1, 512, 128, 128, 512, 512]
    - [31, 2.795]
  - - [128, 2048, 1, 1024, 128, 128, 1024, 1024]
    - [91, 4.708]
  - - [128, 2048, 1, 2048, 128, 128, 2048, 2048]
    - [91, 7.362]
  - - [128, 2048, 1, 4096, 128, 128, 4096, 4096]
    - [66, 10.552]
  - - [128, 2048, 1, 8192, 128, 128, 8192, 8192]
    - [65, 12.514]
  - - [128, 4096, 1, 128, 128, 128, 128, 128]
    - [89, 2.349]
  - - [128, 4096, 1, 256, 128, 128, 256, 256]
    - [30, 2.998]
  - - [128, 4096, 1, 512, 128, 128, 512, 512]
    - [85, 4.946]
  - - [128, 4096, 1, 1024, 128, 128, 1024, 1024]
    - [84, 7.859]
  - - [128, 4096, 1, 2048, 128, 128, 2048, 2048]
    - [88, 10.89]
  - - [128, 4096, 1, 4096, 128, 128, 4096, 4096]
    - [81, 13.811]
  - - [128, 4096, 1, 8192, 128, 128, 8192, 8192]
    - [15, 16.892]
  - - [128, 8192, 1, 128, 128, 128, 128, 128]
    - [75, 3.843]
  - - [128, 8192, 1, 256, 128, 128, 256, 256]
    - [20, 5.18]
  - - [128, 8192, 1, 512, 128, 128, 512, 512]
    - [74, 8.102]
  - - [128, 8192, 1, 1024, 128, 128, 1024, 1024]
    - [74, 11.807]
  - - [128, 8192, 1, 2048, 128, 128, 2048, 2048]
    - [77, 14.606]
  - - [128, 8192, 1, 4096, 128, 128, 4096, 4096]
    - [59, 18.05]
  - - [128, 8192, 1, 8192, 128, 128, 8192, 8192]
    - [7, 21.97]
  - - [256, 128, 1, 128, 256, 256, 128, 128]
    - [32, 0.184]
  - - [256, 128, 1, 256, 256, 256, 256, 256]
    - [31, 0.223]
  - - [256, 128, 1, 512, 256, 256, 512, 512]
    - [91, 0.375]
  - - [256, 128, 1, 1024, 256, 256, 1024, 1024]
    - [91, 0.556]
  - - [256, 128, 1, 2048, 256, 256, 2048, 2048]
    - [0, 0.832]
  - - [256, 128, 1, 4096, 256, 256, 4096, 4096]
    - [19, 1.652]
  - - [256, 128, 1, 8192, 256, 256, 8192, 8192]
    - [70, 2.933]
  - - [256, 256, 1, 128, 256, 256, 128, 128]
    - [31, 0.364]
  - - [256, 256, 1, 256, 256, 256, 256, 256]
    - [31, 0.428]
  - - [256, 256, 1, 512, 256, 256, 512, 512]
    - [91, 0.717]
  - - [256, 256, 1, 1024, 256, 256, 1024, 1024]
    - [70, 1.13]
  - - [256, 256, 1, 2048, 256, 256, 2048, 2048]
    - [19, 2.156]
  - - [256, 256, 1, 4096, 256, 256, 4096, 4096]
    - [70, 3.838]
  - - [256, 256, 1, 8192, 256, 256, 8192, 8192]
    - [93, 6.187]
  - - [256, 512, 1, 128, 256, 256, 128, 128]
    - [31, 0.709]
  - - [256, 512, 1, 256, 256, 256, 256, 256]
    - [91, 0.809]
  - - [256, 512, 1, 512, 256, 256, 512, 512]
    - [90, 1.421]
  - - [256, 512, 1, 1024, 256, 256, 1024, 1024]
    - [32, 2.453]
  - - [256, 512, 1, 2048, 256, 256, 2048, 2048]
    - [31, 4.317]
  - - [256, 512, 1, 4096, 256, 256, 4096, 4096]
    - [90, 6.932]
  - - [256, 512, 1, 8192, 256, 256, 8192, 8192]
    - [93, 8.572]
  - - [256, 1024, 1, 128, 256, 256, 128, 128]
    - [90, 1.349]
  - - [256, 1024, 1, 256, 256, 256, 256, 256]
    - [32, 1.656]
  - - [256, 1024, 1, 512, 256, 256, 512, 512]
    - [31, 2.7]
  - - [256, 1024, 1, 1024, 256, 256, 1024, 1024]
    - [91, 4.695]
  - - [256, 1024, 1, 2048, 256, 256, 2048, 2048]
    - [27, 7.451]
  - - [256, 1024, 1, 4096, 256, 256, 4096, 4096]
    - [68, 10.425]
  - - [256, 1024, 1, 8192, 256, 256, 8192, 8192]
    - [62, 12.569]
  - - [256, 2048, 1, 128, 256, 256, 128, 128]
    - [25, 2.427]
  - - [256, 2048, 1, 256, 256, 256, 256, 256]
    - [25, 3.031]
  - - [256, 2048, 1, 512, 256, 256, 512, 512]
    - [84, 4.936]
  - - [256, 2048, 1, 1024, 256, 256, 1024, 1024]
    - [85, 7.848]
  - - [256, 2048, 1, 2048, 256, 256, 2048, 2048]
    - [85, 10.87]
  - - [256, 2048, 1, 4096, 256, 256, 4096, 4096]
    - [63, 14.19]
  - - [256, 2048, 1, 8192, 256, 256, 8192, 8192]
    - [83, 16.656]
  - - [256, 4096, 1, 128, 256, 256, 128, 128]
    - [75, 3.83]
  - - [256, 4096, 1, 256, 256, 256, 256, 256]
    - [75, 5.081]
  - - [256, 4096, 1, 512, 256, 256, 512, 512]
    - [75, 8.06]
  - - [256, 4096, 1, 1024, 256, 256, 1024, 1024]
    - [74, 11.83]
  - - [256, 4096, 1, 2048, 256, 256, 2048, 2048]
    - [75, 15.246]
  - - [256, 4096, 1, 4096, 256, 256, 4096, 4096]
    - [61, 18.018]
  - - [256, 4096, 1, 8192, 256, 256, 8192, 8192]
    - [47, 21.229]
  - - [256, 8192, 1, 128, 256, 256, 128, 128]
    - [75, 4.77]
  - - [256, 8192, 1, 256, 256, 256, 256, 256]
    - [22, 6.676]
  - - [256, 8192, 1, 512, 256, 256, 512, 512]
    - [57, 10.833]
  - - [256, 8192, 1, 1024, 256, 256, 1024, 1024]
    - [57, 14.833]
  - - [256, 8192, 1, 2048, 256, 256, 2048, 2048]
    - [58, 18.224]
  - - [256, 8192, 1, 4096, 256, 256, 4096, 4096]
    - [49, 23.309]
  - - [256, 8192, 1, 8192, 256, 256, 8192, 8192]
    - [11, 25.562]
  - - [512, 128, 1, 128, 512, 512, 128, 128]
    - [31, 0.358]
  - - [512, 128, 1, 256, 512, 512, 256, 256]
    - [32, 0.433]
  - - [512, 128, 1, 512, 512, 512, 512, 512]
    - [90, 0.721]
  - - [512, 128, 1, 1024, 512, 512, 1024, 1024]
    - [70, 1.154]
  - - [512, 128, 1, 2048, 512, 512, 2048, 2048]
    - [90, 2.197]
  - - [512, 128, 1, 4096, 512, 512, 4096, 4096]
    - [70, 3.89]
  - - [512, 128, 1, 8192, 512, 512, 8192, 8192]
    - [71, 6.177]
  - - [512, 256, 1, 128, 512, 512, 128, 128]
    - [31, 0.716]
  - - [512, 256, 1, 256, 512, 512, 256, 256]
    - [90, 0.808]
  - - [512, 256, 1, 512, 512, 512, 512, 512]
    - [91, 1.393]
  - - [512, 256, 1, 1024, 512, 512, 1024, 1024]
    - [90, 2.49]
  - - [512, 256, 1, 2048, 512, 512, 2048, 2048]
    - [70, 4.353]
  - - [512, 256, 1, 4096, 512, 512, 4096, 4096]
    - [92, 6.885]
  - - [512, 256, 1, 8192, 512, 512, 8192, 8192]
    - [93, 8.685]
  - - [512, 512, 1, 128, 512, 512, 128, 128]
    - [31, 1.362]
  - - [512, 512, 1, 256, 512, 512, 256, 256]
    - [33, 1.583]
  - - [512, 512, 1, 512, 512, 512, 512, 512]
    - [91, 2.762]
  - - [512, 512, 1, 1024, 512, 512, 1024, 1024]
    - [90, 4.698]
  - - [512, 512, 1, 2048, 512, 512, 2048, 2048]
    - [66, 7.459]
  - - [512, 512, 1, 4096, 512, 512, 4096, 4096]
    - [69, 10.246]
  - - [512, 512, 1, 8192, 512, 512, 8192, 8192]
    - [64, 12.595]
  - - [512, 1024, 1, 128, 512, 512, 128, 128]
    - [25, 2.4]
  - - [512, 1024, 1, 256, 512, 512, 256, 256]
    - [24, 2.981]
  - - [512, 1024, 1, 512, 512, 512, 512, 512]
    - [84, 4.974]
  - - [512, 1024, 1, 1024, 512, 512, 1024, 1024]
    - [85, 7.765]
  - - [512, 1024, 1, 2048, 512, 512, 2048, 2048]
    - [77, 10.948]
  - - [512, 1024, 1, 4096, 512, 512, 4096, 4096]
    - [65, 13.929]
  - - [512, 1024, 1, 8192, 512, 512, 8192, 8192]
    - [75, 16.763]
  - - [512, 2048, 1, 128, 512, 512, 128, 128]
    - [23, 3.855]
  - - [512, 2048, 1, 256, 512, 512, 256, 256]
    - [74, 5.078]
  - - [512, 2048, 1, 512, 512, 512, 512, 512]
    - [75, 8.105]
  - - [512, 2048, 1, 1024, 512, 512, 1024, 1024]
    - [76, 11.801]
  - - [512, 2048, 1, 2048, 512, 512, 2048, 2048]
    - [75, 15.352]
  - - [512, 2048, 1, 4096, 512, 512, 4096, 4096]
    - [61, 18.31]
  - - [512, 2048, 1, 8192, 512, 512, 8192, 8192]
    - [35, 21.378]
  - - [512, 4096, 1, 128, 512, 512, 128, 128]
    - [22, 4.887]
  - - [512, 4096, 1, 256, 512, 512, 256, 256]
    - [76, 6.734]
  - - [512, 4096, 1, 512, 512, 512, 512, 512]
    - [60, 10.493]
  - - [512, 4096, 1, 1024, 512, 512, 1024, 1024]
    - [57, 14.903]
  - - [512, 4096, 1, 2048, 512, 512, 2048, 2048]
    - [58, 18.18]
  - - [512, 4096, 1, 4096, 512, 512, 4096, 4096]
    - [49, 23.505]
  - - [512, 4096, 1, 8192, 512, 512, 8192, 8192]
    - [47, 25.462]
  - - [512, 8192, 1, 128, 512, 512, 128, 128]
    - [13, 6.005]
  - - [512, 8192, 1, 256, 512, 512, 256, 256]
    - [57, 8.082]
  - - [512, 8192, 1, 512, 512, 512, 512, 512]
    - [57, 13.362]
  - - [512, 8192, 1, 1024, 512, 512, 1024, 1024]
    - [57, 17.725]
  - - [512, 8192, 1, 2048, 512, 512, 2048, 2048]
    - [47, 22.745]
  - - [512, 8192, 1, 4096, 512, 512, 4096, 4096]
    - [47, 26.051]
  - - [512, 8192, 1, 8192, 512, 512, 8192, 8192]
    - [4, 24.971]
  - - [1024, 128, 1, 128, 1024, 1024, 128, 128]
    - [31, 0.71]
  - - [1024, 128, 1, 256, 1024, 1024, 256, 256]
    - [90, 0.81]
  - - [1024, 128, 1, 512, 1024, 1024, 512, 512]
    - [90, 1.411]
  - - [1024, 128, 1, 1024, 1024, 1024, 1024, 1024]
    - [32, 2.475]
  - - [1024, 128, 1, 2048, 1024, 1024, 2048, 2048]
    - [32, 4.232]
  - - [1024, 128, 1, 4096, 1024, 1024, 4096, 4096]
    - [94, 7.012]
  - - [1024, 128, 1, 8192, 1024, 1024, 8192, 8192]
    - [86, 8.739]
  - - [1024, 256, 1, 128, 1024, 1024, 128, 128]
    - [32, 1.356]
  - - [1024, 256, 1, 256, 1024, 1024, 256, 256]
    - [31, 1.648]
  - - [1024, 256, 1, 512, 1024, 1024, 512, 512]
    - [31, 2.781]
  - - [1024, 256, 1, 1024, 1024, 1024, 1024, 1024]
    - [32, 4.638]
  - - [1024, 256, 1, 2048, 1024, 1024, 2048, 2048]
    - [25, 7.401]
  - - [1024, 256, 1, 4096, 1024, 1024, 4096, 4096]
    - [67, 10.201]
  - - [1024, 256, 1, 8192, 1024, 1024, 8192, 8192]
    - [64, 12.535]
  - - [1024, 512, 1, 128, 1024, 1024, 128, 128]
    - [89, 2.211]
  - - [1024, 512, 1, 256, 1024, 1024, 256, 256]
    - [26, 3.01]
  - - [1024, 512, 1, 512, 1024, 1024, 512, 512]
    - [87, 4.832]
  - - [1024, 512, 1, 1024, 1024, 1024, 1024, 1024]
    - [84, 7.83]
  - - [1024, 512, 1, 2048, 1024, 1024, 2048, 2048]
    - [80, 10.939]
  - - [1024, 512, 1, 4096, 1024, 1024, 4096, 4096]
    - [79, 14.013]
  - - [1024, 512, 1, 8192, 1024, 1024, 8192, 8192]
    - [82, 16.57]
  - - [1024, 1024, 1, 128, 1024, 1024, 128, 128]
    - [23, 3.883]
  - - [1024, 1024, 1, 256, 1024, 1024, 256, 256]
    - [77, 5.068]
  - - [1024, 1024, 1, 512, 1024, 1024, 512, 512]
    - [75, 7.919]
  - - [1024, 1024, 1, 1024, 1024, 1024, 1024, 1024]
    - [74, 11.676]
  - - [1024, 1024, 1, 2048, 1024, 1024, 2048, 2048]
    - [81, 15.218]
  - - [1024, 1024, 1, 4096, 1024, 1024, 4096, 4096]
    - [61, 18.281]
  - - [1024, 1024, 1, 8192, 1024, 1024, 8192, 8192]
    - [49, 21.566]
  - - [1024, 2048, 1, 128, 1024, 1024, 128, 128]
    - [21, 4.928]
  - - [1024, 2048, 1, 256, 1024, 1024, 256, 256]
    - [75, 6.924]
  - - [1024, 2048, 1, 512, 1024, 1024, 512, 512]
    - [58, 10.672]
  - - [1024, 2048, 1, 1024, 1024, 1024, 1024, 1024]
    - [60, 14.589]
  - - [1024, 2048, 1, 2048, 1024, 1024, 2048, 2048]
    - [53, 18.221]
  - - [1024, 2048, 1, 4096, 1024, 1024, 4096, 4096]
    - [51, 23.624]
  - - [1024, 2048, 1, 8192, 1024, 1024, 8192, 8192]
    - [47, 26.568]
  - - [1024, 4096, 1, 128, 1024, 1024, 128, 128]
    - [13, 5.883]
  - - [1024, 4096, 1, 256, 1024, 1024, 256, 256]
    - [57, 8.036]
  - - [1024, 4096, 1, 512, 1024, 1024, 512, 512]
    - [58, 13.644]
  - - [1024, 4096, 1, 1024, 1024, 1024, 1024, 1024]
    - [47, 17.359]
  - - [1024, 4096, 1, 2048, 1024, 1024, 2048, 2048]
    - [38, 22.923]
  - - [1024, 4096, 1, 4096, 1024, 1024, 4096, 4096]
    - [38, 26.587]
  - - [1024, 4096, 1, 8192, 1024, 1024, 8192, 8192]
    - [36, 25.902]
  - - [1024, 8192, 1, 128, 1024, 1024, 128, 128]
    - [11, 6.738]
  - - [1024, 8192, 1, 256, 1024, 1024, 256, 256]
    - [37, 10.361]
  - - [1024, 8192, 1, 512, 1024, 1024, 512, 512]
    - [35, 15.8]
  - - [1024, 8192, 1, 1024, 1024, 1024, 1024, 1024]
    - [35, 21.395]
  - - [1024, 8192, 1, 2048, 1024, 1024, 2048, 2048]
    - [44, 25.943]
  - - [1024, 8192, 1, 4096, 1024, 1024, 4096, 4096]
    - [50, 27.296]
  - - [1024, 8192, 1, 8192, 1024, 1024, 8192, 8192]
    - [49, 27.624]
  - - [2048, 128, 1, 128, 2048, 2048, 128, 128]
    - [31, 1.384]
  - - [2048, 128, 1, 256, 2048, 2048, 256, 256]
    - [31, 1.633]
  - - [2048, 128, 1, 512, 2048, 2048, 512, 512]
    - [90, 2.744]
  - - [2048, 128, 1, 1024, 2048, 2048, 1024, 1024]
    - [91, 4.617]
  - - [2048, 128, 1, 2048, 2048, 2048, 2048, 2048]
    - [66, 7.461]
  - - [2048, 128, 1, 4096, 2048, 2048, 4096, 4096]
    - [67, 10.322]
  - - [2048, 128, 1, 8192, 2048, 2048, 8192, 8192]
    - [75, 11.904]
  - - [2048, 256, 1, 128, 2048, 2048, 128, 128]
    - [26, 2.405]
  - - [2048, 256, 1, 256, 2048, 2048, 256, 256]
    - [28, 3.04]
  - - [2048, 256, 1, 512, 2048, 2048, 512, 512]
    - [84, 4.835]
  - - [2048, 256, 1, 1024, 2048, 2048, 1024, 1024]
    - [84, 7.871]
  - - [2048, 256, 1, 2048, 2048, 2048, 2048, 2048]
    - [82, 10.859]
  - - [2048, 256, 1, 4096, 2048, 2048, 4096, 4096]
    - [82, 14.11]
  - - [2048, 256, 1, 8192, 2048, 2048, 8192, 8192]
    - [53, 15.979]
  - - [2048, 512, 1, 128, 2048, 2048, 128, 128]
    - [22, 3.902]
  - - [2048, 512, 1, 256, 2048, 2048, 256, 256]
    - [77, 5.17]
  - - [2048, 512, 1, 512, 2048, 2048, 512, 512]
    - [74, 8.133]
  - - [2048, 512, 1, 1024, 2048, 2048, 1024, 1024]
    - [80, 11.676]
  - - [2048, 512, 1, 2048, 2048, 2048, 2048, 2048]
    - [82, 15.263]
  - - [2048, 512, 1, 4096, 2048, 2048, 4096, 4096]
    - [61, 18.186]
  - - [2048, 512, 1, 8192, 2048, 2048, 8192, 8192]
    - [35, 21.503]
  - - [2048, 1024, 1, 128, 2048, 2048, 128, 128]
    - [21, 4.951]
  - - [2048, 1024, 1, 256, 2048, 2048, 256, 256]
    - [74, 6.929]
  - - [2048, 1024, 1, 512, 2048, 2048, 512, 512]
    - [61, 10.516]
  - - [2048, 1024, 1, 1024, 2048, 2048, 1024, 1024]
    - [55, 14.665]
  - - [2048, 1024, 1, 2048, 2048, 2048, 2048, 2048]
    - [60, 18.204]
  - - [2048, 1024, 1, 4096, 2048, 2048, 4096, 4096]
    - [47, 23.625]
  - - [2048, 1024, 1, 8192, 2048, 2048, 8192, 8192]
    - [35, 25.827]
  - - [2048, 2048, 1, 128, 2048, 2048, 128, 128]
    - [5, 5.824]
  - - [2048, 2048, 1, 256, 2048, 2048, 256, 256]
    - [58, 8.249]
  - - [2048, 2048, 1, 512, 2048, 2048, 512, 512]
    - [57, 12.936]
  - - [2048, 2048, 1, 1024, 2048, 2048, 1024, 1024]
    - [41, 17.588]
  - - [2048, 2048, 1, 2048, 2048, 2048, 2048, 2048]
    - [37, 22.987]
  - - [2048, 2048, 1, 4096, 2048, 2048, 4096, 4096]
    - [38, 28.153]
  - - [2048, 2048, 1, 8192, 2048, 2048, 8192, 8192]
    - [35, 26.525]
  - - [2048, 4096, 1, 128, 2048, 2048, 128, 128]
    - [1, 6.556]
  - - [2048, 4096, 1, 256, 2048, 2048, 256, 256]
    - [58, 10.389]
  - - [2048, 4096, 1, 512, 2048, 2048, 512, 512]
    - [47, 15.605]
  - - [2048, 4096, 1, 1024, 2048, 2048, 1024, 1024]
    - [39, 21.115]
  - - [2048, 4096, 1, 2048, 2048, 2048, 2048, 2048]
    - [43, 25.704]
  - - [2048, 4096, 1, 4096, 2048, 2048, 4096, 4096]
    - [44, 27.23]
  - - [2048, 4096, 1, 8192, 2048, 2048, 8192, 8192]
    - [34, 28.07]
  - - [2048, 8192, 1, 128, 2048, 2048, 128, 128]
    - [15, 7.584]
  - - [2048, 8192, 1, 256, 2048, 2048, 256, 256]
    - [58, 12.224]
  - - [2048, 8192, 1, 512, 2048, 2048, 512, 512]
    - [41, 17.591]
  - - [2048, 8192, 1, 1024, 2048, 2048, 1024, 1024]
    - [12, 23.202]
  - - [2048, 8192, 1, 2048, 2048, 2048, 2048, 2048]
    - [42, 26.634]
  - - [2048, 8192, 1, 4096, 2048, 2048, 4096, 4096]
    - [38, 30.398]
  - - [2048, 8192, 1, 8192, 2048, 2048, 8192, 8192]
    - [47, 32.395]
  - - [4096, 128, 1, 128, 4096, 4096, 128, 128]
    - [24, 2.39]
  - - [4096, 128, 1, 256, 4096, 4096, 256, 256]
    - [29, 2.99]
  - - [4096, 128, 1, 512, 4096, 4096, 512, 512]
    - [85, 4.986]
  - - [4096, 128, 1, 1024, 4096, 4096, 1024, 1024]
    - [18, 7.85]
  - - [4096, 128, 1, 2048, 4096, 4096, 2048, 2048]
    - [83, 10.952]
  - - [4096, 128, 1, 4096, 4096, 4096, 4096, 4096]
    - [83, 13.366]
  - - [4096, 128, 1, 8192, 4096, 4096, 8192, 8192]
    - [52, 16.194]
  - - [4096, 256, 1, 128, 4096, 4096, 128, 128]
    - [23, 3.863]
  - - [4096, 256, 1, 256, 4096, 4096, 256, 256]
    - [22, 5.059]
  - - [4096, 256, 1, 512, 4096, 4096, 512, 512]
    - [74, 7.988]
  - - [4096, 256, 1, 1024, 4096, 4096, 1024, 1024]
    - [80, 11.717]
  - - [4096, 256, 1, 2048, 4096, 4096, 2048, 2048]
    - [79, 15.315]
  - - [4096, 256, 1, 4096, 4096, 4096, 4096, 4096]
    - [52, 17.52]
  - - [4096, 256, 1, 8192, 4096, 4096, 8192, 8192]
    - [35, 21.587]
  - - [4096, 512, 1, 128, 4096, 4096, 128, 128]
    - [73, 4.905]
  - - [4096, 512, 1, 256, 4096, 4096, 256, 256]
    - [74, 6.749]
  - - [4096, 512, 1, 512, 4096, 4096, 512, 512]
    - [60, 10.476]
  - - [4096, 512, 1, 1024, 4096, 4096, 1024, 1024]
    - [60, 14.538]
  - - [4096, 512, 1, 2048, 4096, 4096, 2048, 2048]
    - [60, 18.26]
  - - [4096, 512, 1, 4096, 4096, 4096, 4096, 4096]
    - [38, 22.495]
  - - [4096, 512, 1, 8192, 4096, 4096, 8192, 8192]
    - [37, 25.403]
  - - [4096, 1024, 1, 128, 4096, 4096, 128, 128]
    - [3, 5.573]
  - - [4096, 1024, 1, 256, 4096, 4096, 256, 256]
    - [58, 8.127]
  - - [4096, 1024, 1, 512, 4096, 4096, 512, 512]
    - [60, 13.054]
  - - [4096, 1024, 1, 1024, 4096, 4096, 1024, 1024]
    - [47, 17.468]
  - - [4096, 1024, 1, 2048, 4096, 4096, 2048, 2048]
    - [51, 22.736]
  - - [4096, 1024, 1, 4096, 4096, 4096, 4096, 4096]
    - [35, 27.625]
  - - [4096, 1024, 1, 8192, 4096, 4096, 8192, 8192]
    - [37, 26.543]
  - - [4096, 2048, 1, 128, 4096, 4096, 128, 128]
    - [12, 6.577]
  - - [4096, 2048, 1, 256, 4096, 4096, 256, 256]
    - [51, 10.209]
  - - [4096, 2048, 1, 512, 4096, 4096, 512, 512]
    - [47, 15.832]
  - - [4096, 2048, 1, 1024, 4096, 4096, 1024, 1024]
    - [47, 21.432]
  - - [4096, 2048, 1, 2048, 4096, 4096, 2048, 2048]
    - [39, 25.489]
  - - [4096, 2048, 1, 4096, 4096, 4096, 4096, 4096]
    - [39, 27.623]
  - - [4096, 2048, 1, 8192, 4096, 4096, 8192, 8192]
    - [8, 28.574]
  - - [4096, 4096, 1, 128, 4096, 4096, 128, 128]
    - [17, 7.481]
  - - [4096, 4096, 1, 256, 4096, 4096, 256, 256]
    - [57, 11.508]
  - - [4096, 4096, 1, 512, 4096, 4096, 512, 512]
    - [41, 17.528]
  - - [4096, 4096, 1, 1024, 4096, 4096, 1024, 1024]
    - [41, 23.832]
  - - [4096, 4096, 1, 2048, 4096, 4096, 2048, 2048]
    - [44, 26.687]
  - - [4096, 4096, 1, 4096, 4096, 4096, 4096, 4096]
    - [49, 30.45]
  - - [4096, 4096, 1, 8192, 4096, 4096, 8192, 8192]
    - [41, 33.0]
  - - [4096, 8192, 1, 128, 4096, 4096, 128, 128]
    - [10, 8.232]
  - - [4096, 8192, 1, 256, 4096, 4096, 256, 256]
    - [41, 12.387]
  - - [4096, 8192, 1, 512, 4096, 4096, 512, 512]
    - [47, 17.814]
  - - [4096, 8192, 1, 1024, 4096, 4096, 1024, 1024]
    - [9, 22.815]
  - - [4096, 8192, 1, 2048, 4096, 4096, 2048, 2048]
    - [7, 26.842]
  - - [4096, 8192, 1, 4096, 4096, 4096, 4096, 4096]
    - [50, 31.502]
  - - [4096, 8192, 1, 8192, 4096, 4096, 8192, 8192]
    - [49, 33.183]
  - - [8192, 128, 1, 128, 8192, 8192, 128, 128]
    - [21, 3.735]
  - - [8192, 128, 1, 256, 8192, 8192, 256, 256]
    - [77, 5.002]
  - - [8192, 128, 1, 512, 8192, 8192, 512, 512]
    - [74, 8.046]
  - - [8192, 128, 1, 1024, 8192, 8192, 1024, 1024]
    - [78, 11.598]
  - - [8192, 128, 1, 2048, 8192, 8192, 2048, 2048]
    - [81, 14.439]
  - - [8192, 128, 1, 4096, 8192, 8192, 4096, 4096]
    - [14, 17.665]
  - - [8192, 128, 1, 8192, 8192, 8192, 8192, 8192]
    - [11, 21.793]
  - - [8192, 256, 1, 128, 8192, 8192, 128, 128]
    - [72, 4.861]
  - - [8192, 256, 1, 256, 8192, 8192, 256, 256]
    - [79, 6.679]
  - - [8192, 256, 1, 512, 8192, 8192, 512, 512]
    - [56, 10.539]
  - - [8192, 256, 1, 1024, 8192, 8192, 1024, 1024]
    - [55, 14.171]
  - - [8192, 256, 1, 2048, 8192, 8192, 2048, 2048]
    - [54, 18.177]
  - - [8192, 256, 1, 4096, 8192, 8192, 4096, 4096]
    - [35, 22.829]
  - - [8192, 256, 1, 8192, 8192, 8192, 8192, 8192]
    - [35, 25.652]
  - - [8192, 512, 1, 128, 8192, 8192, 128, 128]
    - [2, 5.696]
  - - [8192, 512, 1, 256, 8192, 8192, 256, 256]
    - [61, 7.913]
  - - [8192, 512, 1, 512, 8192, 8192, 512, 512]
    - [60, 13.009]
  - - [8192, 512, 1, 1024, 8192, 8192, 1024, 1024]
    - [47, 17.525]
  - - [8192, 512, 1, 2048, 8192, 8192, 2048, 2048]
    - [35, 22.166]
  - - [8192, 512, 1, 4096, 8192, 8192, 4096, 4096]
    - [34, 27.436]
  - - [8192, 512, 1, 8192, 8192, 8192, 8192, 8192]
    - [37, 26.684]
  - - [8192, 1024, 1, 128, 8192, 8192, 128, 128]
    - [12, 6.728]
  - - [8192, 1024, 1, 256, 8192, 8192, 256, 256]
    - [51, 10.208]
  - - [8192, 1024, 1, 512, 8192, 8192, 512, 512]
    - [51, 15.438]
  - - [8192, 1024, 1, 1024, 8192, 8192, 1024, 1024]
    - [44, 21.251]
  - - [8192, 1024, 1, 2048, 8192, 8192, 2048, 2048]
    - [45, 25.783]
  - - [8192, 1024, 1, 4096, 8192, 8192, 4096, 4096]
    - [6, 27.617]
  - - [8192, 1024, 1, 8192, 8192, 8192, 8192, 8192]
    - [7, 29.289]
  - - [8192, 2048, 1, 128, 8192, 8192, 128, 128]
    - [16, 7.676]
  - - [8192, 2048, 1, 256, 8192, 8192, 256, 256]
    - [51, 11.652]
  - - [8192, 2048, 1, 512, 8192, 8192, 512, 512]
    - [45, 17.36]
  - - [8192, 2048, 1, 1024, 8192, 8192, 1024, 1024]
    - [40, 22.88]
  - - [8192, 2048, 1, 2048, 8192, 8192, 2048, 2048]
    - [10, 26.995]
  - - [8192, 2048, 1, 4096, 8192, 8192, 4096, 4096]
    - [50, 30.489]
  - - [8192, 2048, 1, 8192, 8192, 8192, 8192, 8192]
    - [48, 32.928]
  - - [8192, 4096, 1, 128, 8192, 8192, 128, 128]
    - [10, 8.561]
  - - [8192, 4096, 1, 256, 8192, 8192, 256, 256]
    - [51, 12.681]
  - - [8192, 4096, 1, 512, 8192, 8192, 512, 512]
    - [10, 17.801]
  - - [8192, 4096, 1, 1024, 8192, 8192, 1024, 1024]
    - [6, 23.008]
  - - [8192, 4096, 1, 2048, 8192, 8192, 2048, 2048]
    - [47, 27.017]
  - - [8192, 4096, 1, 4096, 8192, 8192, 4096, 4096]
    - [49, 31.851]
  - - [8192, 4096, 1, 8192, 8192, 8192, 8192, 8192]
    - [46, 33.477]
  - - [8192, 8192, 1, 128, 8192, 8192, 128, 128]
    - [9, 7.356]
  - - [8192, 8192, 1, 256, 8192, 8192, 256, 256]
    - [7, 11.482]
  - - [8192, 8192, 1, 512, 8192, 8192, 512, 512]
    - [41, 17.8]
  - - [8192, 8192, 1, 1024, 8192, 8192, 1024, 1024]
    - [51, 23.516]
  - - [8192, 8192, 1, 2048, 8192, 8192, 2048, 2048]
    - [49, 28.078]
  - - [8192, 8192, 1, 4096, 8192, 8192, 4096, 4096]
    - [47, 32.802]
  - - [8192, 8192, 1, 8192, 8192, 8192, 8192, 8192]
    - [47, 34.821]
  - - [1, 1, 1, 32, 1, 1, 32, 32]
    - [95, 0.0]
- null
- null
- DeviceEfficiency
- GridBased
