library/src/amd_detail/rocblaslt/src/Tensile/Logic/streamk/gfx942/aquavanjaram942_Cijk_Ailk_Bjlk_BSS_BH_UserArgs.yaml
- {MinimumRequiredVersion: 4.33.0}
- aquavanjaram942
- gfx942
- [Device 0049, Device 0050]
    SolutionIndex: 0
    SolutionNameMin: Cijk_Ailk_Bjlk_BSS_BH_UserArgs_MT256x256x32_MI16x16x1_SN_LDSB0_CLR1_GSU0_GSUC0_GSUWGMRR0_K1_LBSPPA2048_LBSPPB2048_LPA0_LPB0_MIWT8_8_PLR1_SU32_SUM0_SUS256_SKXCCM0_VWA4_VWB8_WGM8_WGMXCC1_WGMXCCGn1
    SolutionIndex: 1
    SolutionNameMin: Cijk_Ailk_Bjlk_BSS_BH_UserArgs_MT128x256x32_MI16x16x1_SN_LDSB1_CLR1_GSU0_GSUC0_GSUWGMRR0_K1_LBSPPA1024_LBSPPB2048_LPA0_LPB32_MIWT4_8_PLR1_SU32_SUM0_SUS256_SKXCCM0_VWA4_VWB2_WGM4_WGMXCC1_WGMXCCGn1
    SolutionIndex: 2
    SolutionNameMin: Cijk_Ailk_Bjlk_BSS_BH_UserArgs_MT128x128x32_MI16x16x1_SN_LDSB1_CLR1_GSU0_GSUC0_GSUWGMRR0_K1_LBSPPA1024_LBSPPB1024_LPA0_LPB32_MIWT4_4_PLR1_SU32_SUM0_SUS256_SKXCCM0_VWA4_VWB2_WGM1_WGMXCC1_WGMXCCGn1
    SolutionIndex: 3
    SolutionNameMin: Cijk_Ailk_Bjlk_BSS_BH_UserArgs_MT32x32x32_MI16x16x1_SN_LDSB0_CLR1_GSU0_GSUC0_GSUWGMRR0_K1_LBSPPA256_LBSPPB256_LPA16_LPB16_MIWT1_1_PLR1_SU32_SUM0_SUS256_SKXCCM0_VWA1_VWB1_WGM1_WGMXCC1_WGMXCCGn1
    SolutionIndex: 4
    SolutionNameMin: Cijk_Ailk_Bjlk_BSS_BH_UserArgs_MT256x256x64_MI16x16x1_SN_LDSB1_CLR1_GSU0_GSUC0_GSUWGMRR0_K1_LBSPPA2048_LBSPPB2048_LPA0_LPB0_MIWT8_8_PLR2_SU32_SUM0_SUS256_SKXCCM0_VWA4_VWB8_WGM4_WGMXCC1_WGMXCCGn1
    SolutionIndex: 5
    SolutionNameMin: Cijk_Ailk_Bjlk_BSS_BH_UserArgs_MT128x256x64_MI16x16x1_SN_LDSB1_CLR1_GSU0_GSUC0_GSUWGMRR0_K1_LBSPPA1024_LBSPPB2048_LPA0_LPB32_MIWT4_8_PLR2_SU32_SUM0_SUS256_SKXCCM0_VWA4_VWB2_WGM1_WGMXCC1_WGMXCCGn1
    SolutionIndex: 6
    SolutionNameMin: Cijk_Ailk_Bjlk_BSS_BH_UserArgs_MT128x256x64_MI16x16x1_SN_LDSB1_CLR1_GSU0_GSUC0_GSUWGMRR0_K1_LBSPPA1024_LBSPPB2048_LPA0_LPB32_MIWT4_8_PLR1_SU32_SUM0_SUS256_SKXCCM0_VWA4_VWB2_WGM8_WGMXCC1_WGMXCCGn1
    SolutionIndex: 7
    SolutionNameMin: Cijk_Ailk_Bjlk_BSS_BH_UserArgs_MT256x128x64_MI16x16x1_SN_LDSB1_CLR1_GSU0_GSUC0_GSUWGMRR0_K1_LBSPPA2048_LBSPPB1024_LPA0_LPB0_MIWT8_4_PLR1_SU32_SUM0_SUS256_SKXCCM0_VWA4_VWB4_WGM8_WGMXCC1_WGMXCCGn1
    SolutionIndex: 8
    SolutionNameMin: Cijk_Ailk_Bjlk_BSS_BH_UserArgs_MT128x128x64_MI16x16x1_SN_LDSB1_CLR1_GSU0_GSUC0_GSUWGMRR0_K1_LBSPPA1024_LBSPPB1024_LPA0_LPB0_MIWT4_4_PLR1_SU32_SUM0_SUS256_SKXCCM0_VWA4_VWB4_WGM1_WGMXCC1_WGMXCCGn1
    SolutionIndex: 9
    SolutionNameMin: Cijk_Ailk_Bjlk_BSS_BH_UserArgs_MT128x128x64_MI16x16x1_SN_LDSB1_CLR1_GSU0_GSUC0_GSUWGMRR0_K1_LBSPPA1024_LBSPPB1024_LPA0_LPB0_MIWT4_4_PLR1_SU32_SUM0_SUS256_SKXCCM0_VWA4_VWB4_WGM4_WGMXCC1_WGMXCCGn1
    SolutionIndex: 10
    SolutionNameMin: Cijk_Ailk_Bjlk_BSS_BH_UserArgs_MT64x128x64_MI16x16x1_SN_LDSB1_CLR1_GSU0_GSUC0_GSUWGMRR0_K1_LBSPPA512_LBSPPB1024_LPA16_LPB0_MIWT2_4_PLR2_SU32_SUM0_SUS256_SKXCCM0_VWA1_VWB4_WGM1_WGMXCC1_WGMXCCGn1
    SolutionIndex: 11
    SolutionNameMin: Cijk_Ailk_Bjlk_BSS_BH_UserArgs_MT64x128x64_MI16x16x1_SN_LDSB1_CLR1_GSU0_GSUC0_GSUWGMRR0_K1_LBSPPA512_LBSPPB1024_LPA32_LPB0_MIWT2_4_PLR2_SU32_SUM0_SUS256_SKXCCM0_VWA2_VWB4_WGM1_WGMXCC1_WGMXCCGn1
    SolutionIndex: 12
    SolutionNameMin: Cijk_Ailk_Bjlk_BSS_BH_UserArgs_MT128x64x64_MI16x16x1_SN_LDSB1_CLR1_GSU0_GSUC0_GSUWGMRR0_K1_LBSPPA1024_LBSPPB512_LPA0_LPB32_MIWT4_2_PLR2_SU32_SUM0_SUS256_SKXCCM0_VWA4_VWB2_WGM1_WGMXCC1_WGMXCCGn1
    SolutionIndex: 13
    SolutionNameMin: Cijk_Ailk_Bjlk_BSS_BH_UserArgs_MT64x64x64_MI16x16x1_SN_LDSB1_CLR1_GSU0_GSUC0_GSUWGMRR0_K1_LBSPPA512_LBSPPB512_LPA32_LPB32_MIWT2_2_PLR1_SU32_SUM0_SUS256_SKXCCM0_VWA2_VWB2_WGM1_WGMXCC1_WGMXCCGn1
    SolutionIndex: 14
    SolutionNameMin: Cijk_Ailk_Bjlk_BSS_BH_UserArgs_MT64x64x64_MI16x16x1_SN_LDSB1_CLR1_GSU0_GSUC0_GSUWGMRR0_K1_LBSPPA512_LBSPPB512_LPA32_LPB32_MIWT2_2_PLR2_SU32_SUM0_SUS256_SKXCCM0_VWA2_VWB2_WGM8_WGMXCC1_WGMXCCGn1
    SolutionIndex: 15
    SolutionNameMin: Cijk_Ailk_Bjlk_BSS_BH_UserArgs_MT32x64x64_MI16x16x1_SN_LDSB0_CLR1_GSU0_GSUC0_GSUWGMRR0_K1_LBSPPA256_LBSPPB512_LPA16_LPB32_MIWT1_2_PLR2_SU32_SUM0_SUS256_SKXCCM0_VWA1_VWB2_WGM1_WGMXCC1_WGMXCCGn1
    SolutionIndex: 16
    SolutionNameMin: Cijk_Ailk_Bjlk_BSS_BH_UserArgs_MT32x32x64_MI16x16x1_SN_LDSB0_CLR1_GSU0_GSUC0_GSUWGMRR0_K1_LBSPPA256_LBSPPB256_LPA16_LPB16_MIWT1_1_PLR1_SU32_SUM0_SUS256_SKXCCM0_VWA1_VWB1_WGM1_WGMXCC1_WGMXCCGn1
    SolutionIndex: 17
    SolutionNameMin: Cijk_Ailk_Bjlk_BSS_BH_UserArgs_MT32x32x64_MI16x16x1_SN_LDSB0_CLR1_GSU0_GSUC0_GSUWGMRR0_K1_LBSPPA256_LBSPPB256_LPA16_LPB16_MIWT1_1_PLR2_SU32_SUM0_SUS256_SKXCCM0_VWA1_VWB1_WGM1_WGMXCC1_WGMXCCGn1
    SolutionIndex: 18
    SolutionNameMin: Cijk_Ailk_Bjlk_BSS_BH_UserArgs_MT128x128x128_MI16x16x1_SN_LDSB1_CLR1_GSU0_GSUC0_GSUWGMRR0_K1_LBSPPA1024_LBSPPB1024_LPA0_LPB0_MIWT4_4_PLR1_SU32_SUM0_SUS256_SKXCCM0_VWA4_VWB4_WGM1_WGMXCC1_WGMXCCGn1
    SolutionIndex: 19
    SolutionNameMin: Cijk_Ailk_Bjlk_BSS_BH_UserArgs_MT128x128x128_MI16x16x1_SN_LDSB1_CLR1_GSU0_GSUC0_GSUWGMRR0_K1_LBSPPA1024_LBSPPB1024_LPA0_LPB0_MIWT4_4_PLR2_SU32_SUM0_SUS256_SKXCCM0_VWA4_VWB4_WGM1_WGMXCC1_WGMXCCGn1
    SolutionIndex: 20
    SolutionNameMin: Cijk_Ailk_Bjlk_BSS_BH_UserArgs_MT128x128x128_MI16x16x1_SN_LDSB1_CLR1_GSU0_GSUC0_GSUWGMRR0_K1_LBSPPA1024_LBSPPB1024_LPA0_LPB0_MIWT4_4_PLR1_SU32_SUM0_SUS256_SKXCCM0_VWA4_VWB4_WGM4_WGMXCC1_WGMXCCGn1
    SolutionIndex: 21
    SolutionNameMin: Cijk_Ailk_Bjlk_BSS_BH_UserArgs_MT128x128x128_MI16x16x1_SN_LDSB1_CLR1_GSU0_GSUC0_GSUWGMRR0_K1_LBSPPA1024_LBSPPB1024_LPA0_LPB0_MIWT4_4_PLR2_SU32_SUM0_SUS256_SKXCCM0_VWA4_VWB4_WGM4_WGMXCC1_WGMXCCGn1
    SolutionIndex: 22
    SolutionNameMin: Cijk_Ailk_Bjlk_BSS_BH_UserArgs_MT128x128x128_MI16x16x1_SN_LDSB1_CLR1_GSU0_GSUC0_GSUWGMRR0_K1_LBSPPA1024_LBSPPB1024_LPA0_LPB0_MIWT4_4_PLR1_SU32_SUM0_SUS256_SKXCCM0_VWA4_VWB4_WGM8_WGMXCC1_WGMXCCGn1
    SolutionIndex: 23
    SolutionNameMin: Cijk_Ailk_Bjlk_BSS_BH_UserArgs_MT128x128x128_MI16x16x1_SN_LDSB1_CLR1_GSU0_GSUC0_GSUWGMRR0_K1_LBSPPA1024_LBSPPB1024_LPA0_LPB0_MIWT4_4_PLR2_SU32_SUM0_SUS256_SKXCCM0_VWA4_VWB4_WGM8_WGMXCC1_WGMXCCGn1
    SolutionIndex: 24
    SolutionNameMin: Cijk_Ailk_Bjlk_BSS_BH_UserArgs_MT128x64x128_MI16x16x1_SN_LDSB1_CLR1_GSU0_GSUC0_GSUWGMRR0_K1_LBSPPA1024_LBSPPB512_LPA0_LPB32_MIWT4_2_PLR1_SU32_SUM0_SUS256_SKXCCM0_VWA4_VWB2_WGM4_WGMXCC1_WGMXCCGn1
    SolutionIndex: 25
    SolutionNameMin: Cijk_Ailk_Bjlk_BSS_BH_UserArgs_MT128x64x128_MI16x16x1_SN_LDSB1_CLR1_GSU0_GSUC0_GSUWGMRR0_K1_LBSPPA1024_LBSPPB512_LPA0_LPB16_MIWT4_2_PLR2_SU32_SUM0_SUS256_SKXCCM0_VWA4_VWB1_WGM4_WGMXCC1_WGMXCCGn1
    SolutionIndex: 26
    SolutionNameMin: Cijk_Ailk_Bjlk_BSS_BH_UserArgs_MT128x64x128_MI16x16x1_SN_LDSB1_CLR1_GSU0_GSUC0_GSUWGMRR0_K1_LBSPPA1024_LBSPPB512_LPA0_LPB32_MIWT4_2_PLR2_SU32_SUM0_SUS256_SKXCCM0_VWA4_VWB2_WGM4_WGMXCC1_WGMXCCGn1
    SolutionIndex: 27
    SolutionNameMin: Cijk_Ailk_Bjlk_BSS_BH_UserArgs_MT128x64x128_MI16x16x1_SN_LDSB1_CLR1_GSU0_GSUC0_GSUWGMRR0_K1_LBSPPA1024_LBSPPB512_LPA0_LPB16_MIWT4_2_PLR1_SU32_SUM0_SUS256_SKXCCM0_VWA4_VWB1_WGM8_WGMXCC1_WGMXCCGn1
    SolutionIndex: 28
    SolutionNameMin: Cijk_Ailk_Bjlk_BSS_BH_UserArgs_MT128x64x128_MI16x16x1_SN_LDSB1_CLR1_GSU0_GSUC0_GSUWGMRR0_K1_LBSPPA1024_LBSPPB512_LPA0_LPB16_MIWT4_2_PLR2_SU32_SUM0_SUS256_SKXCCM0_VWA4_VWB1_WGM8_WGMXCC1_WGMXCCGn1
    SolutionIndex: 29
    SolutionNameMin: Cijk_Ailk_Bjlk_BSS_BH_UserArgs_MT128x64x128_MI16x16x1_SN_LDSB1_CLR1_GSU0_GSUC0_GSUWGMRR0_K1_LBSPPA1024_LBSPPB512_LPA32_LPB32_MIWT4_2_PLR2_SU32_SUM0_SUS256_SKXCCM0_VWA2_VWB2_WGM8_WGMXCC1_WGMXCCGn1
    SolutionIndex: 30
    SolutionNameMin: Cijk_Ailk_Bjlk_BSS_BH_UserArgs_MT128x64x128_MI16x16x1_SN_LDSB1_CLR1_GSU0_GSUC0_GSUWGMRR0_K1_LBSPPA1024_LBSPPB512_LPA0_LPB32_MIWT4_2_PLR2_SU32_SUM0_SUS256_SKXCCM0_VWA4_VWB2_WGM8_WGMXCC1_WGMXCCGn1
    SolutionIndex: 31
    SolutionNameMin: Cijk_Ailk_Bjlk_BSS_BH_UserArgs_MT128x32x128_MI16x16x1_SN_LDSB1_CLR1_GSU0_GSUC0_GSUWGMRR0_K1_LBSPPA1024_LBSPPB256_LPA0_LPB16_MIWT4_1_PLR2_SU32_SUM0_SUS256_SKXCCM0_VWA4_VWB1_WGM1_WGMXCC1_WGMXCCGn1
    SolutionIndex: 32
    SolutionNameMin: Cijk_Ailk_Bjlk_BSS_BH_UserArgs_MT64x64x128_MI16x16x1_SN_LDSB1_CLR1_GSU0_GSUC0_GSUWGMRR0_K1_LBSPPA512_LBSPPB512_LPA16_LPB32_MIWT2_2_PLR1_SU32_SUM0_SUS256_SKXCCM0_VWA1_VWB2_WGM4_WGMXCC1_WGMXCCGn1
    SolutionIndex: 33
    SolutionNameMin: Cijk_Ailk_Bjlk_BSS_BH_UserArgs_MT64x64x128_MI16x16x1_SN_LDSB1_CLR1_GSU0_GSUC0_GSUWGMRR0_K1_LBSPPA512_LBSPPB512_LPA16_LPB32_MIWT2_2_PLR2_SU32_SUM0_SUS256_SKXCCM0_VWA1_VWB2_WGM4_WGMXCC1_WGMXCCGn1
    SolutionIndex: 34
    SolutionNameMin: Cijk_Ailk_Bjlk_BSS_BH_UserArgs_MT64x64x128_MI16x16x1_SN_LDSB1_CLR1_GSU0_GSUC0_GSUWGMRR0_K1_LBSPPA512_LBSPPB512_LPA16_LPB32_MIWT2_2_PLR2_SU32_SUM0_SUS256_SKXCCM0_VWA1_VWB2_WGM8_WGMXCC1_WGMXCCGn1
    SolutionIndex: 35
    SolutionNameMin: Cijk_Ailk_Bjlk_BSS_BH_UserArgs_MT64x64x128_MI16x16x1_SN_LDSB1_CLR1_GSU0_GSUC0_GSUWGMRR0_K1_LBSPPA512_LBSPPB512_LPA32_LPB32_MIWT2_2_PLR2_SU32_SUM0_SUS256_SKXCCM0_VWA2_VWB2_WGM8_WGMXCC1_WGMXCCGn1
    SolutionIndex: 36
    SolutionNameMin: Cijk_Ailk_Bjlk_BSS_BH_UserArgs_MT32x64x128_MI16x16x1_SN_LDSB1_CLR1_GSU0_GSUC0_GSUWGMRR0_K1_LBSPPA256_LBSPPB512_LPA16_LPB32_MIWT1_2_PLR2_SU32_SUM0_SUS256_SKXCCM0_VWA1_VWB2_WGM1_WGMXCC1_WGMXCCGn1
    SolutionIndex: 37
    SolutionNameMin: Cijk_Ailk_Bjlk_BSS_BH_UserArgs_MT32x64x128_MI16x16x1_SN_LDSB1_CLR1_GSU0_GSUC0_GSUWGMRR0_K1_LBSPPA256_LBSPPB512_LPA16_LPB32_MIWT1_2_PLR2_SU32_SUM0_SUS256_SKXCCM0_VWA1_VWB2_WGM4_WGMXCC1_WGMXCCGn1
    SolutionIndex: 38
    SolutionNameMin: Cijk_Ailk_Bjlk_BSS_BH_UserArgs_MT64x32x128_MI16x16x1_SN_LDSB1_CLR1_GSU0_GSUC0_GSUWGMRR0_K1_LBSPPA512_LBSPPB256_LPA32_LPB16_MIWT2_1_PLR2_SU32_SUM0_SUS256_SKXCCM0_VWA2_VWB1_WGM8_WGMXCC1_WGMXCCGn1
    SolutionIndex: 39
    SolutionNameMin: Cijk_Ailk_Bjlk_BSS_BH_UserArgs_MT32x32x128_MI16x16x1_SN_LDSB1_CLR1_GSU0_GSUC0_GSUWGMRR0_K1_LBSPPA256_LBSPPB256_LPA16_LPB16_MIWT1_1_PLR1_SU32_SUM0_SUS256_SKXCCM0_VWA1_VWB1_WGM1_WGMXCC1_WGMXCCGn1
    SolutionIndex: 40
    SolutionNameMin: Cijk_Ailk_Bjlk_BSS_BH_UserArgs_MT32x32x128_MI16x16x1_SN_LDSB1_CLR1_GSU0_GSUC0_GSUWGMRR0_K1_LBSPPA256_LBSPPB256_LPA16_LPB16_MIWT1_1_PLR2_SU32_SUM0_SUS256_SKXCCM0_VWA1_VWB1_WGM1_WGMXCC1_WGMXCCGn1
    SolutionIndex: 41
    SolutionNameMin: Cijk_Ailk_Bjlk_BSS_BH_UserArgs_MT256x256x32_MI16x16x1_SN_LDSB0_CLR1_GSU0_GSUC0_GSUWGMRR0_K1_LBSPPA2048_LBSPPB2048_LPA0_LPB0_MIWT8_8_PLR1_SU32_SUM0_SUS256_SKXCCM8_VWA4_VWB8_WGM1_WGMXCC1_WGMXCCGn1
    SolutionIndex: 42
    SolutionNameMin: Cijk_Ailk_Bjlk_BSS_BH_UserArgs_MT256x256x32_MI16x16x1_SN_LDSB0_CLR1_GSU0_GSUC0_GSUWGMRR0_K1_LBSPPA2048_LBSPPB2048_LPA0_LPB0_MIWT8_8_PLR1_SU32_SUM0_SUS256_SKXCCM8_VWA4_VWB4_WGM4_WGMXCC1_WGMXCCGn1
    SolutionIndex: 43
    SolutionNameMin: Cijk_Ailk_Bjlk_BSS_BH_UserArgs_MT256x256x32_MI16x16x1_SN_LDSB0_CLR1_GSU0_GSUC0_GSUWGMRR0_K1_LBSPPA2048_LBSPPB2048_LPA0_LPB0_MIWT8_8_PLR1_SU32_SUM0_SUS256_SKXCCM8_VWA4_VWB8_WGM4_WGMXCC1_WGMXCCGn1
    SolutionIndex: 44
    SolutionNameMin: Cijk_Ailk_Bjlk_BSS_BH_UserArgs_MT256x256x32_MI16x16x1_SN_LDSB0_CLR1_GSU0_GSUC0_GSUWGMRR0_K1_LBSPPA2048_LBSPPB2048_LPA0_LPB0_MIWT8_8_PLR1_SU32_SUM0_SUS256_SKXCCM8_VWA4_VWB4_WGM8_WGMXCC1_WGMXCCGn1
    SolutionIndex: 45
    SolutionNameMin: Cijk_Ailk_Bjlk_BSS_BH_UserArgs_MT256x256x32_MI16x16x1_SN_LDSB0_CLR1_GSU0_GSUC0_GSUWGMRR0_K1_LBSPPA2048_LBSPPB2048_LPA0_LPB0_MIWT8_8_PLR1_SU32_SUM0_SUS256_SKXCCM8_VWA4_VWB8_WGM8_WGMXCC1_WGMXCCGn1
    SolutionIndex: 46
    SolutionNameMin: Cijk_Ailk_Bjlk_BSS_BH_UserArgs_MT128x256x32_MI16x16x1_SN_LDSB1_CLR1_GSU0_GSUC0_GSUWGMRR0_K1_LBSPPA1024_LBSPPB2048_LPA0_LPB32_MIWT4_8_PLR1_SU32_SUM0_SUS256_SKXCCM8_VWA4_VWB2_WGM1_WGMXCC1_WGMXCCGn1
    SolutionIndex: 47
    SolutionNameMin: Cijk_Ailk_Bjlk_BSS_BH_UserArgs_MT128x256x32_MI16x16x1_SN_LDSB1_CLR1_GSU0_GSUC0_GSUWGMRR0_K1_LBSPPA1024_LBSPPB2048_LPA0_LPB0_MIWT4_8_PLR1_SU32_SUM0_SUS256_SKXCCM8_VWA4_VWB4_WGM4_WGMXCC1_WGMXCCGn1
    SolutionIndex: 48
    SolutionNameMin: Cijk_Ailk_Bjlk_BSS_BH_UserArgs_MT128x256x32_MI16x16x1_SN_LDSB1_CLR1_GSU0_GSUC0_GSUWGMRR0_K1_LBSPPA1024_LBSPPB2048_LPA0_LPB0_MIWT4_8_PLR1_SU32_SUM0_SUS256_SKXCCM8_VWA4_VWB8_WGM4_WGMXCC1_WGMXCCGn1
    SolutionIndex: 49
    SolutionNameMin: Cijk_Ailk_Bjlk_BSS_BH_UserArgs_MT128x256x32_MI16x16x1_SN_LDSB1_CLR1_GSU0_GSUC0_GSUWGMRR0_K1_LBSPPA1024_LBSPPB2048_LPA0_LPB32_MIWT4_8_PLR1_SU32_SUM0_SUS256_SKXCCM8_VWA4_VWB2_WGM8_WGMXCC1_WGMXCCGn1
    SolutionIndex: 50
    SolutionNameMin: Cijk_Ailk_Bjlk_BSS_BH_UserArgs_MT256x128x32_MI16x16x1_SN_LDSB1_CLR1_GSU0_GSUC0_GSUWGMRR0_K1_LBSPPA2048_LBSPPB1024_LPA0_LPB0_MIWT8_4_PLR1_SU32_SUM0_SUS256_SKXCCM8_VWA4_VWB4_WGM8_WGMXCC1_WGMXCCGn1
    SolutionIndex: 51
    SolutionNameMin: Cijk_Ailk_Bjlk_BSS_BH_UserArgs_MT128x128x32_MI16x16x1_SN_LDSB0_CLR1_GSU0_GSUC0_GSUWGMRR0_K1_LBSPPA1024_LBSPPB1024_LPA0_LPB0_MIWT4_4_PLR1_SU32_SUM0_SUS256_SKXCCM8_VWA4_VWB4_WGM1_WGMXCC1_WGMXCCGn1
    SolutionIndex: 52
    SolutionNameMin: Cijk_Ailk_Bjlk_BSS_BH_UserArgs_MT128x128x32_MI16x16x1_SN_LDSB0_CLR1_GSU0_GSUC0_GSUWGMRR0_K1_LBSPPA1024_LBSPPB1024_LPA0_LPB0_MIWT4_4_PLR1_SU32_SUM0_SUS256_SKXCCM8_VWA4_VWB4_WGM8_WGMXCC1_WGMXCCGn1
    SolutionIndex: 53
    SolutionNameMin: Cijk_Ailk_Bjlk_BSS_BH_UserArgs_MT128x64x32_MI16x16x1_SN_LDSB0_CLR1_GSU0_GSUC0_GSUWGMRR0_K1_LBSPPA1024_LBSPPB512_LPA0_LPB32_MIWT4_2_PLR1_SU32_SUM0_SUS256_SKXCCM8_VWA4_VWB2_WGM1_WGMXCC1_WGMXCCGn1
    SolutionIndex: 54
    SolutionNameMin: Cijk_Ailk_Bjlk_BSS_BH_UserArgs_MT128x64x32_MI16x16x1_SN_LDSB0_CLR1_GSU0_GSUC0_GSUWGMRR0_K1_LBSPPA1024_LBSPPB512_LPA0_LPB32_MIWT4_2_PLR1_SU32_SUM0_SUS256_SKXCCM8_VWA4_VWB2_WGM4_WGMXCC1_WGMXCCGn1
    SolutionIndex: 55
    SolutionNameMin: Cijk_Ailk_Bjlk_BSS_BH_UserArgs_MT128x64x32_MI16x16x1_SN_LDSB0_CLR1_GSU0_GSUC0_GSUWGMRR0_K1_LBSPPA1024_LBSPPB512_LPA0_LPB32_MIWT4_2_PLR1_SU32_SUM0_SUS256_SKXCCM8_VWA4_VWB2_WGM8_WGMXCC1_WGMXCCGn1
    SolutionIndex: 56
    SolutionNameMin: Cijk_Ailk_Bjlk_BSS_BH_UserArgs_MT32x32x32_MI16x16x1_SN_LDSB0_CLR1_GSU0_GSUC0_GSUWGMRR0_K1_LBSPPA256_LBSPPB256_LPA16_LPB16_MIWT1_1_PLR1_SU32_SUM0_SUS256_SKXCCM8_VWA1_VWB1_WGM1_WGMXCC1_WGMXCCGn1
    SolutionIndex: 57
    SolutionNameMin: Cijk_Ailk_Bjlk_BSS_BH_UserArgs_MT256x256x64_MI16x16x1_SN_LDSB1_CLR1_GSU0_GSUC0_GSUWGMRR0_K1_LBSPPA2048_LBSPPB2048_LPA0_LPB0_MIWT8_8_PLR1_SU32_SUM0_SUS256_SKXCCM8_VWA4_VWB4_WGM4_WGMXCC1_WGMXCCGn1
    SolutionIndex: 58
    SolutionNameMin: Cijk_Ailk_Bjlk_BSS_BH_UserArgs_MT256x256x64_MI16x16x1_SN_LDSB1_CLR1_GSU0_GSUC0_GSUWGMRR0_K1_LBSPPA2048_LBSPPB2048_LPA0_LPB0_MIWT8_8_PLR2_SU32_SUM0_SUS256_SKXCCM8_VWA4_VWB4_WGM4_WGMXCC1_WGMXCCGn1
    SolutionIndex: 59
    SolutionNameMin: Cijk_Ailk_Bjlk_BSS_BH_UserArgs_MT256x256x64_MI16x16x1_SN_LDSB1_CLR1_GSU0_GSUC0_GSUWGMRR0_K1_LBSPPA2048_LBSPPB2048_LPA0_LPB0_MIWT8_8_PLR2_SU32_SUM0_SUS256_SKXCCM8_VWA4_VWB8_WGM4_WGMXCC1_WGMXCCGn1
    SolutionIndex: 60
    SolutionNameMin: Cijk_Ailk_Bjlk_BSS_BH_UserArgs_MT256x256x64_MI16x16x1_SN_LDSB1_CLR1_GSU0_GSUC0_GSUWGMRR0_K1_LBSPPA2048_LBSPPB2048_LPA0_LPB0_MIWT8_8_PLR2_SU32_SUM0_SUS256_SKXCCM8_VWA4_VWB4_WGM8_WGMXCC1_WGMXCCGn1
    SolutionIndex: 61
    SolutionNameMin: Cijk_Ailk_Bjlk_BSS_BH_UserArgs_MT128x256x64_MI16x16x1_SN_LDSB1_CLR1_GSU0_GSUC0_GSUWGMRR0_K1_LBSPPA1024_LBSPPB2048_LPA0_LPB32_MIWT4_8_PLR1_SU32_SUM0_SUS256_SKXCCM8_VWA4_VWB2_WGM1_WGMXCC1_WGMXCCGn1
    SolutionIndex: 62
    SolutionNameMin: Cijk_Ailk_Bjlk_BSS_BH_UserArgs_MT128x256x64_MI16x16x1_SN_LDSB1_CLR1_GSU0_GSUC0_GSUWGMRR0_K1_LBSPPA1024_LBSPPB2048_LPA0_LPB32_MIWT4_8_PLR2_SU32_SUM0_SUS256_SKXCCM8_VWA4_VWB2_WGM1_WGMXCC1_WGMXCCGn1
    SolutionIndex: 63
    SolutionNameMin: Cijk_Ailk_Bjlk_BSS_BH_UserArgs_MT128x256x64_MI16x16x1_SN_LDSB1_CLR1_GSU0_GSUC0_GSUWGMRR0_K1_LBSPPA1024_LBSPPB2048_LPA0_LPB0_MIWT4_8_PLR1_SU32_SUM0_SUS256_SKXCCM8_VWA4_VWB8_WGM4_WGMXCC1_WGMXCCGn1
    SolutionIndex: 64
    SolutionNameMin: Cijk_Ailk_Bjlk_BSS_BH_UserArgs_MT128x256x64_MI16x16x1_SN_LDSB1_CLR1_GSU0_GSUC0_GSUWGMRR0_K1_LBSPPA1024_LBSPPB2048_LPA0_LPB0_MIWT4_8_PLR1_SU32_SUM0_SUS256_SKXCCM8_VWA4_VWB8_WGM8_WGMXCC1_WGMXCCGn1
    SolutionIndex: 65
    SolutionNameMin: Cijk_Ailk_Bjlk_BSS_BH_UserArgs_MT256x128x64_MI16x16x1_SN_LDSB1_CLR1_GSU0_GSUC0_GSUWGMRR0_K1_LBSPPA2048_LBSPPB1024_LPA0_LPB16_MIWT8_4_PLR1_SU32_SUM0_SUS256_SKXCCM8_VWA4_VWB1_WGM1_WGMXCC1_WGMXCCGn1
    SolutionIndex: 66
    SolutionNameMin: Cijk_Ailk_Bjlk_BSS_BH_UserArgs_MT256x128x64_MI16x16x1_SN_LDSB1_CLR1_GSU0_GSUC0_GSUWGMRR0_K1_LBSPPA2048_LBSPPB1024_LPA0_LPB32_MIWT8_4_PLR2_SU32_SUM0_SUS256_SKXCCM8_VWA4_VWB2_WGM1_WGMXCC1_WGMXCCGn1
    SolutionIndex: 67
    SolutionNameMin: Cijk_Ailk_Bjlk_BSS_BH_UserArgs_MT256x128x64_MI16x16x1_SN_LDSB1_CLR1_GSU0_GSUC0_GSUWGMRR0_K1_LBSPPA2048_LBSPPB1024_LPA0_LPB0_MIWT8_4_PLR1_SU32_SUM0_SUS256_SKXCCM8_VWA4_VWB4_WGM4_WGMXCC1_WGMXCCGn1
    SolutionIndex: 68
    SolutionNameMin: Cijk_Ailk_Bjlk_BSS_BH_UserArgs_MT256x128x64_MI16x16x1_SN_LDSB1_CLR1_GSU0_GSUC0_GSUWGMRR0_K1_LBSPPA2048_LBSPPB1024_LPA0_LPB0_MIWT8_4_PLR2_SU32_SUM0_SUS256_SKXCCM8_VWA4_VWB4_WGM4_WGMXCC1_WGMXCCGn1
    SolutionIndex: 69
    SolutionNameMin: Cijk_Ailk_Bjlk_BSS_BH_UserArgs_MT128x128x64_MI16x16x1_SN_LDSB1_CLR1_GSU0_GSUC0_GSUWGMRR0_K1_LBSPPA1024_LBSPPB1024_LPA0_LPB0_MIWT4_4_PLR1_SU32_SUM0_SUS256_SKXCCM8_VWA4_VWB4_WGM1_WGMXCC1_WGMXCCGn1
    SolutionIndex: 70
    SolutionNameMin: Cijk_Ailk_Bjlk_BSS_BH_UserArgs_MT128x128x64_MI16x16x1_SN_LDSB1_CLR1_GSU0_GSUC0_GSUWGMRR0_K1_LBSPPA1024_LBSPPB1024_LPA0_LPB0_MIWT4_4_PLR2_SU32_SUM0_SUS256_SKXCCM8_VWA4_VWB4_WGM1_WGMXCC1_WGMXCCGn1
    SolutionIndex: 71
    SolutionNameMin: Cijk_Ailk_Bjlk_BSS_BH_UserArgs_MT128x128x64_MI16x16x1_SN_LDSB1_CLR1_GSU0_GSUC0_GSUWGMRR0_K1_LBSPPA1024_LBSPPB1024_LPA0_LPB32_MIWT4_4_PLR1_SU32_SUM0_SUS256_SKXCCM8_VWA4_VWB2_WGM4_WGMXCC1_WGMXCCGn1
    SolutionIndex: 72
    SolutionNameMin: Cijk_Ailk_Bjlk_BSS_BH_UserArgs_MT128x128x64_MI16x16x1_SN_LDSB1_CLR1_GSU0_GSUC0_GSUWGMRR0_K1_LBSPPA1024_LBSPPB1024_LPA0_LPB0_MIWT4_4_PLR1_SU32_SUM0_SUS256_SKXCCM8_VWA4_VWB4_WGM4_WGMXCC1_WGMXCCGn1
    SolutionIndex: 73
    SolutionNameMin: Cijk_Ailk_Bjlk_BSS_BH_UserArgs_MT128x128x64_MI16x16x1_SN_LDSB1_CLR1_GSU0_GSUC0_GSUWGMRR0_K1_LBSPPA1024_LBSPPB1024_LPA0_LPB0_MIWT4_4_PLR2_SU32_SUM0_SUS256_SKXCCM8_VWA4_VWB4_WGM4_WGMXCC1_WGMXCCGn1
    SolutionIndex: 74
    SolutionNameMin: Cijk_Ailk_Bjlk_BSS_BH_UserArgs_MT128x128x64_MI16x16x1_SN_LDSB1_CLR1_GSU0_GSUC0_GSUWGMRR0_K1_LBSPPA1024_LBSPPB1024_LPA0_LPB0_MIWT4_4_PLR1_SU32_SUM0_SUS256_SKXCCM8_VWA4_VWB4_WGM8_WGMXCC1_WGMXCCGn1
    SolutionIndex: 75
    SolutionNameMin: Cijk_Ailk_Bjlk_BSS_BH_UserArgs_MT128x128x64_MI16x16x1_SN_LDSB1_CLR1_GSU0_GSUC0_GSUWGMRR0_K1_LBSPPA1024_LBSPPB1024_LPA0_LPB0_MIWT4_4_PLR2_SU32_SUM0_SUS256_SKXCCM8_VWA4_VWB4_WGM8_WGMXCC1_WGMXCCGn1
    SolutionIndex: 76
    SolutionNameMin: Cijk_Ailk_Bjlk_BSS_BH_UserArgs_MT64x128x64_MI16x16x1_SN_LDSB1_CLR1_GSU0_GSUC0_GSUWGMRR0_K1_LBSPPA512_LBSPPB1024_LPA16_LPB0_MIWT2_4_PLR2_SU32_SUM0_SUS256_SKXCCM8_VWA1_VWB4_WGM1_WGMXCC1_WGMXCCGn1
    SolutionIndex: 77
    SolutionNameMin: Cijk_Ailk_Bjlk_BSS_BH_UserArgs_MT64x128x64_MI16x16x1_SN_LDSB1_CLR1_GSU0_GSUC0_GSUWGMRR0_K1_LBSPPA512_LBSPPB1024_LPA32_LPB0_MIWT2_4_PLR2_SU32_SUM0_SUS256_SKXCCM8_VWA2_VWB4_WGM1_WGMXCC1_WGMXCCGn1
    SolutionIndex: 78
    SolutionNameMin: Cijk_Ailk_Bjlk_BSS_BH_UserArgs_MT128x64x64_MI16x16x1_SN_LDSB1_CLR1_GSU0_GSUC0_GSUWGMRR0_K1_LBSPPA1024_LBSPPB512_LPA0_LPB32_MIWT4_2_PLR1_SU32_SUM0_SUS256_SKXCCM8_VWA4_VWB2_WGM1_WGMXCC1_WGMXCCGn1
    SolutionIndex: 79
    SolutionNameMin: Cijk_Ailk_Bjlk_BSS_BH_UserArgs_MT128x64x64_MI16x16x1_SN_LDSB1_CLR1_GSU0_GSUC0_GSUWGMRR0_K1_LBSPPA1024_LBSPPB512_LPA0_LPB32_MIWT4_2_PLR2_SU32_SUM0_SUS256_SKXCCM8_VWA4_VWB2_WGM1_WGMXCC1_WGMXCCGn1
    SolutionIndex: 80
    SolutionNameMin: Cijk_Ailk_Bjlk_BSS_BH_UserArgs_MT128x64x64_MI16x16x1_SN_LDSB1_CLR1_GSU0_GSUC0_GSUWGMRR0_K1_LBSPPA1024_LBSPPB512_LPA0_LPB32_MIWT4_2_PLR2_SU32_SUM0_SUS256_SKXCCM8_VWA4_VWB2_WGM4_WGMXCC1_WGMXCCGn1
    SolutionIndex: 81
    SolutionNameMin: Cijk_Ailk_Bjlk_BSS_BH_UserArgs_MT128x64x64_MI16x16x1_SN_LDSB1_CLR1_GSU0_GSUC0_GSUWGMRR0_K1_LBSPPA1024_LBSPPB512_LPA0_LPB32_MIWT4_2_PLR1_SU32_SUM0_SUS256_SKXCCM8_VWA4_VWB2_WGM8_WGMXCC1_WGMXCCGn1
    SolutionIndex: 82
    SolutionNameMin: Cijk_Ailk_Bjlk_BSS_BH_UserArgs_MT128x64x64_MI16x16x1_SN_LDSB1_CLR1_GSU0_GSUC0_GSUWGMRR0_K1_LBSPPA1024_LBSPPB512_LPA0_LPB32_MIWT4_2_PLR2_SU32_SUM0_SUS256_SKXCCM8_VWA4_VWB2_WGM8_WGMXCC1_WGMXCCGn1
    SolutionIndex: 83
    SolutionNameMin: Cijk_Ailk_Bjlk_BSS_BH_UserArgs_MT64x64x64_MI16x16x1_SN_LDSB1_CLR1_GSU0_GSUC0_GSUWGMRR0_K1_LBSPPA512_LBSPPB512_LPA16_LPB32_MIWT2_2_PLR1_SU32_SUM0_SUS256_SKXCCM8_VWA1_VWB2_WGM1_WGMXCC1_WGMXCCGn1
    SolutionIndex: 84
    SolutionNameMin: Cijk_Ailk_Bjlk_BSS_BH_UserArgs_MT64x64x64_MI16x16x1_SN_LDSB1_CLR1_GSU0_GSUC0_GSUWGMRR0_K1_LBSPPA512_LBSPPB512_LPA32_LPB32_MIWT2_2_PLR1_SU32_SUM0_SUS256_SKXCCM8_VWA2_VWB2_WGM1_WGMXCC1_WGMXCCGn1
    SolutionIndex: 85
    SolutionNameMin: Cijk_Ailk_Bjlk_BSS_BH_UserArgs_MT64x64x64_MI16x16x1_SN_LDSB1_CLR1_GSU0_GSUC0_GSUWGMRR0_K1_LBSPPA512_LBSPPB512_LPA16_LPB32_MIWT2_2_PLR2_SU32_SUM0_SUS256_SKXCCM8_VWA1_VWB2_WGM1_WGMXCC1_WGMXCCGn1
    SolutionIndex: 86
    SolutionNameMin: Cijk_Ailk_Bjlk_BSS_BH_UserArgs_MT64x64x64_MI16x16x1_SN_LDSB1_CLR1_GSU0_GSUC0_GSUWGMRR0_K1_LBSPPA512_LBSPPB512_LPA32_LPB32_MIWT2_2_PLR2_SU32_SUM0_SUS256_SKXCCM8_VWA2_VWB2_WGM1_WGMXCC1_WGMXCCGn1
    SolutionIndex: 87
    SolutionNameMin: Cijk_Ailk_Bjlk_BSS_BH_UserArgs_MT64x64x64_MI16x16x1_SN_LDSB1_CLR1_GSU0_GSUC0_GSUWGMRR0_K1_LBSPPA512_LBSPPB512_LPA32_LPB32_MIWT2_2_PLR1_SU32_SUM0_SUS256_SKXCCM8_VWA2_VWB2_WGM4_WGMXCC1_WGMXCCGn1
    SolutionIndex: 88
    SolutionNameMin: Cijk_Ailk_Bjlk_BSS_BH_UserArgs_MT64x64x64_MI16x16x1_SN_LDSB1_CLR1_GSU0_GSUC0_GSUWGMRR0_K1_LBSPPA512_LBSPPB512_LPA32_LPB32_MIWT2_2_PLR2_SU32_SUM0_SUS256_SKXCCM8_VWA2_VWB2_WGM4_WGMXCC1_WGMXCCGn1
    SolutionIndex: 89
    SolutionNameMin: Cijk_Ailk_Bjlk_BSS_BH_UserArgs_MT64x64x64_MI16x16x1_SN_LDSB1_CLR1_GSU0_GSUC0_GSUWGMRR0_K1_LBSPPA512_LBSPPB512_LPA32_LPB32_MIWT2_2_PLR2_SU32_SUM0_SUS256_SKXCCM8_VWA2_VWB2_WGM8_WGMXCC1_WGMXCCGn1
    SolutionIndex: 90
    SolutionNameMin: Cijk_Ailk_Bjlk_BSS_BH_UserArgs_MT32x64x64_MI16x16x1_SN_LDSB0_CLR1_GSU0_GSUC0_GSUWGMRR0_K1_LBSPPA256_LBSPPB512_LPA16_LPB32_MIWT1_2_PLR2_SU32_SUM0_SUS256_SKXCCM8_VWA1_VWB2_WGM1_WGMXCC1_WGMXCCGn1
    SolutionIndex: 91
    SolutionNameMin: Cijk_Ailk_Bjlk_BSS_BH_UserArgs_MT32x64x64_MI16x16x1_SN_LDSB0_CLR1_GSU0_GSUC0_GSUWGMRR0_K1_LBSPPA256_LBSPPB512_LPA16_LPB32_MIWT1_2_PLR2_SU32_SUM0_SUS256_SKXCCM8_VWA1_VWB2_WGM4_WGMXCC1_WGMXCCGn1
    SolutionIndex: 92
    SolutionNameMin: Cijk_Ailk_Bjlk_BSS_BH_UserArgs_MT32x64x64_MI16x16x1_SN_LDSB0_CLR1_GSU0_GSUC0_GSUWGMRR0_K1_LBSPPA256_LBSPPB512_LPA16_LPB32_MIWT1_2_PLR2_SU32_SUM0_SUS256_SKXCCM8_VWA1_VWB2_WGM8_WGMXCC1_WGMXCCGn1
    SolutionIndex: 93
    SolutionNameMin: Cijk_Ailk_Bjlk_BSS_BH_UserArgs_MT64x32x64_MI16x16x1_SN_LDSB0_CLR1_GSU0_GSUC0_GSUWGMRR0_K1_LBSPPA512_LBSPPB256_LPA32_LPB16_MIWT2_1_PLR2_SU32_SUM0_SUS256_SKXCCM8_VWA2_VWB1_WGM1_WGMXCC1_WGMXCCGn1
    SolutionIndex: 94
    SolutionNameMin: Cijk_Ailk_Bjlk_BSS_BH_UserArgs_MT64x32x64_MI16x16x1_SN_LDSB0_CLR1_GSU0_GSUC0_GSUWGMRR0_K1_LBSPPA512_LBSPPB256_LPA32_LPB16_MIWT2_1_PLR2_SU32_SUM0_SUS256_SKXCCM8_VWA2_VWB1_WGM8_WGMXCC1_WGMXCCGn1
    SolutionIndex: 95
    SolutionNameMin: Cijk_Ailk_Bjlk_BSS_BH_UserArgs_MT128x128x128_MI16x16x1_SN_LDSB1_CLR1_GSU0_GSUC0_GSUWGMRR0_K1_LBSPPA1024_LBSPPB1024_LPA0_LPB0_MIWT4_4_PLR1_SU32_SUM0_SUS256_SKXCCM8_VWA4_VWB4_WGM1_WGMXCC1_WGMXCCGn1
    SolutionIndex: 96
    SolutionNameMin: Cijk_Ailk_Bjlk_BSS_BH_UserArgs_MT128x128x128_MI16x16x1_SN_LDSB1_CLR1_GSU0_GSUC0_GSUWGMRR0_K1_LBSPPA1024_LBSPPB1024_LPA0_LPB0_MIWT4_4_PLR2_SU32_SUM0_SUS256_SKXCCM8_VWA4_VWB4_WGM1_WGMXCC1_WGMXCCGn1
    SolutionIndex: 97
    SolutionNameMin: Cijk_Ailk_Bjlk_BSS_BH_UserArgs_MT128x128x128_MI16x16x1_SN_LDSB1_CLR1_GSU0_GSUC0_GSUWGMRR0_K1_LBSPPA1024_LBSPPB1024_LPA0_LPB0_MIWT4_4_PLR1_SU32_SUM0_SUS256_SKXCCM8_VWA4_VWB4_WGM8_WGMXCC1_WGMXCCGn1
    SolutionIndex: 98
    SolutionNameMin: Cijk_Ailk_Bjlk_BSS_BH_UserArgs_MT128x64x128_MI16x16x1_SN_LDSB1_CLR1_GSU0_GSUC0_GSUWGMRR0_K1_LBSPPA1024_LBSPPB512_LPA0_LPB32_MIWT4_2_PLR2_SU32_SUM0_SUS256_SKXCCM8_VWA4_VWB2_WGM1_WGMXCC1_WGMXCCGn1
    SolutionIndex: 99
    SolutionNameMin: Cijk_Ailk_Bjlk_BSS_BH_UserArgs_MT128x64x128_MI16x16x1_SN_LDSB1_CLR1_GSU0_GSUC0_GSUWGMRR0_K1_LBSPPA1024_LBSPPB512_LPA0_LPB32_MIWT4_2_PLR2_SU32_SUM0_SUS256_SKXCCM8_VWA4_VWB2_WGM4_WGMXCC1_WGMXCCGn1
    SolutionIndex: 100
    SolutionNameMin: Cijk_Ailk_Bjlk_BSS_BH_UserArgs_MT128x64x128_MI16x16x1_SN_LDSB1_CLR1_GSU0_GSUC0_GSUWGMRR0_K1_LBSPPA1024_LBSPPB512_LPA0_LPB32_MIWT4_2_PLR2_SU32_SUM0_SUS256_SKXCCM8_VWA4_VWB2_WGM8_WGMXCC1_WGMXCCGn1
    SolutionIndex: 101
    SolutionNameMin: Cijk_Ailk_Bjlk_BSS_BH_UserArgs_MT64x64x128_MI16x16x1_SN_LDSB1_CLR1_GSU0_GSUC0_GSUWGMRR0_K1_LBSPPA512_LBSPPB512_LPA16_LPB32_MIWT2_2_PLR2_SU32_SUM0_SUS256_SKXCCM8_VWA1_VWB2_WGM1_WGMXCC1_WGMXCCGn1
    SolutionIndex: 102
    SolutionNameMin: Cijk_Ailk_Bjlk_BSS_BH_UserArgs_MT64x64x128_MI16x16x1_SN_LDSB1_CLR1_GSU0_GSUC0_GSUWGMRR0_K1_LBSPPA512_LBSPPB512_LPA32_LPB32_MIWT2_2_PLR2_SU32_SUM0_SUS256_SKXCCM8_VWA2_VWB2_WGM1_WGMXCC1_WGMXCCGn1
    SolutionIndex: 103
    SolutionNameMin: Cijk_Ailk_Bjlk_BSS_BH_UserArgs_MT64x64x128_MI16x16x1_SN_LDSB1_CLR1_GSU0_GSUC0_GSUWGMRR0_K1_LBSPPA512_LBSPPB512_LPA32_LPB32_MIWT2_2_PLR2_SU32_SUM0_SUS256_SKXCCM8_VWA2_VWB2_WGM4_WGMXCC1_WGMXCCGn1
    SolutionIndex: 104
    SolutionNameMin: Cijk_Ailk_Bjlk_BSS_BH_UserArgs_MT64x64x128_MI16x16x1_SN_LDSB1_CLR1_GSU0_GSUC0_GSUWGMRR0_K1_LBSPPA512_LBSPPB512_LPA16_LPB32_MIWT2_2_PLR2_SU32_SUM0_SUS256_SKXCCM8_VWA1_VWB2_WGM8_WGMXCC1_WGMXCCGn1
    SolutionIndex: 105
    SolutionNameMin: Cijk_Ailk_Bjlk_BSS_BH_UserArgs_MT64x64x128_MI16x16x1_SN_LDSB1_CLR1_GSU0_GSUC0_GSUWGMRR0_K1_LBSPPA512_LBSPPB512_LPA32_LPB32_MIWT2_2_PLR2_SU32_SUM0_SUS256_SKXCCM8_VWA2_VWB2_WGM8_WGMXCC1_WGMXCCGn1
    SolutionIndex: 106
    SolutionNameMin: Cijk_Ailk_Bjlk_BSS_BH_UserArgs_MT32x64x128_MI16x16x1_SN_LDSB1_CLR1_GSU0_GSUC0_GSUWGMRR0_K1_LBSPPA256_LBSPPB512_LPA16_LPB32_MIWT1_2_PLR2_SU32_SUM0_SUS256_SKXCCM8_VWA1_VWB2_WGM1_WGMXCC1_WGMXCCGn1
    SolutionIndex: 107
    SolutionNameMin: Cijk_Ailk_Bjlk_BSS_BH_UserArgs_MT32x64x128_MI16x16x1_SN_LDSB1_CLR1_GSU0_GSUC0_GSUWGMRR0_K1_LBSPPA256_LBSPPB512_LPA16_LPB32_MIWT1_2_PLR2_SU32_SUM0_SUS256_SKXCCM8_VWA1_VWB2_WGM4_WGMXCC1_WGMXCCGn1
    SolutionIndex: 108
    SolutionNameMin: Cijk_Ailk_Bjlk_BSS_BH_UserArgs_MT32x64x128_MI16x16x1_SN_LDSB1_CLR1_GSU0_GSUC0_GSUWGMRR0_K1_LBSPPA256_LBSPPB512_LPA16_LPB32_MIWT1_2_PLR2_SU32_SUM0_SUS256_SKXCCM8_VWA1_VWB2_WGM8_WGMXCC1_WGMXCCGn1
    SolutionIndex: 109
    SolutionNameMin: Cijk_Ailk_Bjlk_BSS_BH_UserArgs_MT64x32x128_MI16x16x1_SN_LDSB1_CLR1_GSU0_GSUC0_GSUWGMRR0_K1_LBSPPA512_LBSPPB256_LPA32_LPB16_MIWT2_1_PLR2_SU32_SUM0_SUS256_SKXCCM8_VWA2_VWB1_WGM1_WGMXCC1_WGMXCCGn1
    SolutionIndex: 110
    SolutionNameMin: Cijk_Ailk_Bjlk_BSS_BH_UserArgs_MT32x32x128_MI16x16x1_SN_LDSB1_CLR1_GSU0_GSUC0_GSUWGMRR0_K1_LBSPPA256_LBSPPB256_LPA16_LPB16_MIWT1_1_PLR1_SU32_SUM0_SUS256_SKXCCM8_VWA1_VWB1_WGM1_WGMXCC1_WGMXCCGn1
    SolutionIndex: 111
    SolutionNameMin: Cijk_Ailk_Bjlk_BSS_BH_UserArgs_MT32x32x128_MI16x16x1_SN_LDSB1_CLR1_GSU0_GSUC0_GSUWGMRR0_K1_LBSPPA256_LBSPPB256_LPA16_LPB16_MIWT1_1_PLR2_SU32_SUM0_SUS256_SKXCCM8_VWA1_VWB1_WGM1_WGMXCC1_WGMXCCGn1
    SolutionIndex: 112
    SolutionNameMin: Cijk_Ailk_Bjlk_BSS_BH_UserArgs_MT32x32x128_MI16x16x1_SN_LDSB1_CLR1_GSU0_GSUC0_GSUWGMRR0_K1_LBSPPA256_LBSPPB256_LPA16_LPB16_MIWT1_1_PLR1_SU32_SUM0_SUS256_SKXCCM8_VWA1_VWB1_WGM4_WGMXCC1_WGMXCCGn1
    SolutionIndex: 113
    SolutionNameMin: Cijk_Ailk_Bjlk_BSS_BH_UserArgs_MT32x32x32_MI16x16x1_SN_LDSB0_CLR0_GSU0_GSUC0_GSUWGMRR0_K1_LBSPPA256_LBSPPB256_LPA16_LPB16_MIWT1_1_PLR0_SU32_SUM0_SUS256_SKXCCM0_VWA1_VWB1_WGM8_WGMXCC1_WGMXCCGn1
- - - [128, 128, 1, 128, 128, 128, 128, 128]
    - [40, 0.081]
  - - [128, 128, 1, 256, 128, 128, 128, 128]
    - [39, 0.103]
  - - [128, 128, 1, 512, 128, 128, 128, 128]
    - [39, 0.168]
  - - [128, 128, 1, 1024, 128, 128, 128, 128]
    - [111, 0.263]
  - - [128, 128, 1, 2048, 128, 128, 128, 128]
    - [110, 0.343]
  - - [128, 128, 1, 4096, 128, 128, 128, 128]
    - [3, 0.526]
  - - [128, 128, 1, 8192, 128, 128, 128, 128]
    - [56, 0.988]
  - - [128, 256, 1, 128, 128, 128, 128, 256]
    - [39, 0.16]
  - - [128, 256, 1, 256, 128, 128, 128, 256]
    - [39, 0.201]
  - - [128, 256, 1, 512, 128, 128, 128, 256]
    - [111, 0.332]
  - - [128, 256, 1, 1024, 128, 128, 128, 256]
    - [111, 0.521]
  - - [128, 256, 1, 2048, 128, 128, 128, 256]
    - [3, 0.78]
  - - [128, 256, 1, 4096, 128, 128, 128, 256]
    - [17, 1.461]
  - - [128, 256, 1, 8192, 128, 128, 128, 256]
    - [111, 2.495]
  - - [128, 512, 1, 128, 128, 128, 128, 512]
    - [39, 0.31]
  - - [128, 512, 1, 256, 128, 128, 128, 512]
    - [39, 0.391]
  - - [128, 512, 1, 512, 128, 128, 128, 512]
    - [111, 0.658]
  - - [128, 512, 1, 1024, 128, 128, 128, 512]
    - [3, 1.034]
  - - [128, 512, 1, 2048, 128, 128, 128, 512]
    - [40, 1.861]
  - - [128, 512, 1, 4096, 128, 128, 128, 512]
    - [111, 3.044]
  - - [128, 512, 1, 8192, 128, 128, 128, 512]
    - [90, 4.415]
  - - [128, 1024, 1, 128, 128, 128, 128, 1024]
    - [40, 0.581]
  - - [128, 1024, 1, 256, 128, 128, 128, 1024]
    - [110, 0.738]
  - - [128, 1024, 1, 512, 128, 128, 128, 1024]
    - [39, 1.281]
  - - [128, 1024, 1, 1024, 128, 128, 128, 1024]
    - [39, 2.098]
  - - [128, 1024, 1, 2048, 128, 128, 128, 1024]
    - [110, 3.3]
  - - [128, 1024, 1, 4096, 128, 128, 128, 1024]
    - [38, 5.142]
  - - [128, 1024, 1, 8192, 128, 128, 128, 1024]
    - [91, 6.96]
  - - [128, 2048, 1, 128, 128, 128, 128, 2048]
    - [39, 1.127]
  - - [128, 2048, 1, 256, 128, 128, 128, 2048]
    - [39, 1.525]
  - - [128, 2048, 1, 512, 128, 128, 128, 2048]
    - [110, 2.32]
  - - [128, 2048, 1, 1024, 128, 128, 128, 2048]
    - [109, 3.885]
  - - [128, 2048, 1, 2048, 128, 128, 128, 2048]
    - [90, 5.876]
  - - [128, 2048, 1, 4096, 128, 128, 128, 2048]
    - [14, 8.305]
  - - [128, 2048, 1, 8192, 128, 128, 128, 2048]
    - [87, 11.367]
  - - [128, 4096, 1, 128, 128, 128, 128, 4096]
    - [109, 2.083]
  - - [128, 4096, 1, 256, 128, 128, 128, 4096]
    - [37, 2.725]
  - - [128, 4096, 1, 512, 128, 128, 128, 4096]
    - [106, 4.226]
  - - [128, 4096, 1, 1024, 128, 128, 128, 4096]
    - [93, 6.393]
  - - [128, 4096, 1, 2048, 128, 128, 128, 4096]
    - [86, 9.544]
  - - [128, 4096, 1, 4096, 128, 128, 128, 4096]
    - [12, 12.655]
  - - [128, 4096, 1, 8192, 128, 128, 128, 4096]
    - [79, 15.882]
  - - [128, 8192, 1, 128, 128, 128, 128, 8192]
    - [102, 3.464]
  - - [128, 8192, 1, 256, 128, 128, 128, 8192]
    - [31, 4.725]
  - - [128, 8192, 1, 512, 128, 128, 128, 8192]
    - [102, 7.188]
  - - [128, 8192, 1, 1024, 128, 128, 128, 8192]
    - [102, 10.465]
  - - [128, 8192, 1, 2048, 128, 128, 128, 8192]
    - [79, 13.434]
  - - [128, 8192, 1, 4096, 128, 128, 128, 8192]
    - [79, 17.167]
  - - [128, 8192, 1, 8192, 128, 128, 128, 8192]
    - [8, 21.09]
  - - [256, 128, 1, 128, 256, 256, 256, 128]
    - [39, 0.158]
  - - [256, 128, 1, 256, 256, 256, 256, 128]
    - [39, 0.202]
  - - [256, 128, 1, 512, 256, 256, 256, 128]
    - [39, 0.336]
  - - [256, 128, 1, 1024, 256, 256, 256, 128]
    - [110, 0.52]
  - - [256, 128, 1, 2048, 256, 256, 256, 128]
    - [3, 0.803]
  - - [256, 128, 1, 4096, 256, 256, 256, 128]
    - [16, 1.479]
  - - [256, 128, 1, 8192, 256, 256, 256, 128]
    - [112, 2.44]
  - - [256, 256, 1, 128, 256, 256, 256, 256]
    - [39, 0.294]
  - - [256, 256, 1, 256, 256, 256, 256, 256]
    - [39, 0.382]
  - - [256, 256, 1, 512, 256, 256, 256, 256]
    - [111, 0.625]
  - - [256, 256, 1, 1024, 256, 256, 256, 256]
    - [111, 1.01]
  - - [256, 256, 1, 2048, 256, 256, 256, 256]
    - [39, 1.867]
  - - [256, 256, 1, 4096, 256, 256, 256, 256]
    - [111, 3.096]
  - - [256, 256, 1, 8192, 256, 256, 256, 256]
    - [90, 4.288]
  - - [256, 512, 1, 128, 256, 256, 256, 512]
    - [110, 0.581]
  - - [256, 512, 1, 256, 256, 256, 256, 512]
    - [110, 0.711]
  - - [256, 512, 1, 512, 256, 256, 256, 512]
    - [40, 1.27]
  - - [256, 512, 1, 1024, 256, 256, 256, 512]
    - [39, 2.142]
  - - [256, 512, 1, 2048, 256, 256, 256, 512]
    - [16, 3.366]
  - - [256, 512, 1, 4096, 256, 256, 256, 512]
    - [90, 5.353]
  - - [256, 512, 1, 8192, 256, 256, 256, 512]
    - [91, 6.818]
  - - [256, 1024, 1, 128, 256, 256, 256, 1024]
    - [39, 1.14]
  - - [256, 1024, 1, 256, 256, 256, 256, 1024]
    - [39, 1.502]
  - - [256, 1024, 1, 512, 256, 256, 256, 1024]
    - [110, 2.328]
  - - [256, 1024, 1, 1024, 256, 256, 256, 1024]
    - [106, 3.885]
  - - [256, 1024, 1, 2048, 256, 256, 256, 1024]
    - [107, 5.752]
  - - [256, 1024, 1, 4096, 256, 256, 256, 1024]
    - [86, 8.224]
  - - [256, 1024, 1, 8192, 256, 256, 256, 1024]
    - [87, 11.081]
  - - [256, 2048, 1, 128, 256, 256, 256, 2048]
    - [106, 2.064]
  - - [256, 2048, 1, 256, 256, 256, 256, 2048]
    - [36, 2.775]
  - - [256, 2048, 1, 512, 256, 256, 256, 2048]
    - [109, 4.279]
  - - [256, 2048, 1, 1024, 256, 256, 256, 2048]
    - [106, 6.456]
  - - [256, 2048, 1, 2048, 256, 256, 256, 2048]
    - [86, 9.383]
  - - [256, 2048, 1, 4096, 256, 256, 256, 2048]
    - [89, 12.428]
  - - [256, 2048, 1, 8192, 256, 256, 256, 2048]
    - [82, 15.602]
  - - [256, 4096, 1, 128, 256, 256, 256, 4096]
    - [104, 3.397]
  - - [256, 4096, 1, 256, 256, 256, 256, 4096]
    - [35, 4.673]
  - - [256, 4096, 1, 512, 256, 256, 256, 4096]
    - [102, 7.186]
  - - [256, 4096, 1, 1024, 256, 256, 256, 4096]
    - [102, 10.608]
  - - [256, 4096, 1, 2048, 256, 256, 256, 4096]
    - [53, 13.508]
  - - [256, 4096, 1, 4096, 256, 256, 256, 4096]
    - [81, 17.325]
  - - [256, 4096, 1, 8192, 256, 256, 256, 4096]
    - [72, 20.926]
  - - [256, 8192, 1, 128, 256, 256, 256, 8192]
    - [29, 5.174]
  - - [256, 8192, 1, 256, 256, 256, 256, 8192]
    - [27, 7.519]
  - - [256, 8192, 1, 512, 256, 256, 256, 8192]
    - [98, 10.624]
  - - [256, 8192, 1, 1024, 256, 256, 256, 8192]
    - [79, 13.652]
  - - [256, 8192, 1, 2048, 256, 256, 256, 8192]
    - [72, 17.331]
  - - [256, 8192, 1, 4096, 256, 256, 256, 8192]
    - [74, 22.205]
  - - [256, 8192, 1, 8192, 256, 256, 256, 8192]
    - [9, 26.436]
  - - [512, 128, 1, 128, 512, 512, 512, 128]
    - [39, 0.313]
  - - [512, 128, 1, 256, 512, 512, 512, 128]
    - [39, 0.384]
  - - [512, 128, 1, 512, 512, 512, 512, 128]
    - [111, 0.647]
  - - [512, 128, 1, 1024, 512, 512, 512, 128]
    - [3, 1.031]
  - - [512, 128, 1, 2048, 512, 512, 512, 128]
    - [110, 1.881]
  - - [512, 128, 1, 4096, 512, 512, 512, 128]
    - [3, 2.917]
  - - [512, 128, 1, 8192, 512, 512, 512, 128]
    - [92, 4.296]
  - - [512, 256, 1, 128, 512, 512, 512, 256]
    - [111, 0.577]
  - - [512, 256, 1, 256, 512, 512, 512, 256]
    - [36, 0.729]
  - - [512, 256, 1, 512, 512, 512, 512, 256]
    - [110, 1.281]
  - - [512, 256, 1, 1024, 512, 512, 512, 256]
    - [39, 2.123]
  - - [512, 256, 1, 2048, 512, 512, 512, 256]
    - [109, 3.35]
  - - [512, 256, 1, 4096, 512, 512, 512, 256]
    - [90, 5.196]
  - - [512, 256, 1, 8192, 512, 512, 512, 256]
    - [83, 6.833]
  - - [512, 512, 1, 128, 512, 512, 512, 512]
    - [39, 1.144]
  - - [512, 512, 1, 256, 512, 512, 512, 512]
    - [40, 1.512]
  - - [512, 512, 1, 512, 512, 512, 512, 512]
    - [39, 2.332]
  - - [512, 512, 1, 1024, 512, 512, 512, 512]
    - [106, 3.827]
  - - [512, 512, 1, 2048, 512, 512, 512, 512]
    - [109, 6.1]
  - - [512, 512, 1, 4096, 512, 512, 512, 512]
    - [102, 8.031]
  - - [512, 512, 1, 8192, 512, 512, 512, 512]
    - [85, 10.141]
  - - [512, 1024, 1, 128, 512, 512, 512, 1024]
    - [36, 2.101]
  - - [512, 1024, 1, 256, 512, 512, 512, 1024]
    - [36, 2.758]
  - - [512, 1024, 1, 512, 512, 512, 512, 1024]
    - [109, 4.185]
  - - [512, 1024, 1, 1024, 512, 512, 512, 1024]
    - [106, 6.461]
  - - [512, 1024, 1, 2048, 512, 512, 512, 1024]
    - [84, 9.289]
  - - [512, 1024, 1, 4096, 512, 512, 512, 1024]
    - [89, 11.78]
  - - [512, 1024, 1, 8192, 512, 512, 512, 1024]
    - [79, 14.655]
  - - [512, 2048, 1, 128, 512, 512, 512, 2048]
    - [33, 3.487]
  - - [512, 2048, 1, 256, 512, 512, 512, 2048]
    - [32, 4.672]
  - - [512, 2048, 1, 512, 512, 512, 512, 2048]
    - [102, 7.239]
  - - [512, 2048, 1, 1024, 512, 512, 512, 2048]
    - [102, 10.432]
  - - [512, 2048, 1, 2048, 512, 512, 512, 2048]
    - [55, 13.287]
  - - [512, 2048, 1, 4096, 512, 512, 512, 2048]
    - [78, 16.162]
  - - [512, 2048, 1, 8192, 512, 512, 512, 2048]
    - [69, 20.485]
  - - [512, 4096, 1, 128, 512, 512, 512, 4096]
    - [30, 5.263]
  - - [512, 4096, 1, 256, 512, 512, 512, 4096]
    - [26, 7.621]
  - - [512, 4096, 1, 512, 512, 512, 512, 4096]
    - [98, 10.605]
  - - [512, 4096, 1, 1024, 512, 512, 512, 4096]
    - [79, 13.828]
  - - [512, 4096, 1, 2048, 512, 512, 512, 4096]
    - [52, 17.184]
  - - [512, 4096, 1, 4096, 512, 512, 512, 4096]
    - [74, 21.88]
  - - [512, 4096, 1, 8192, 512, 512, 512, 4096]
    - [65, 24.967]
  - - [512, 8192, 1, 128, 512, 512, 512, 8192]
    - [22, 7.109]
  - - [512, 8192, 1, 256, 512, 512, 512, 8192]
    - [23, 10.346]
  - - [512, 8192, 1, 512, 512, 512, 512, 8192]
    - [95, 12.59]
  - - [512, 8192, 1, 1024, 512, 512, 512, 8192]
    - [70, 16.926]
  - - [512, 8192, 1, 2048, 512, 512, 512, 8192]
    - [69, 21.746]
  - - [512, 8192, 1, 4096, 512, 512, 512, 8192]
    - [74, 26.936]
  - - [512, 8192, 1, 8192, 512, 512, 512, 8192]
    - [7, 28.161]
  - - [1024, 128, 1, 128, 1024, 1024, 1024, 128]
    - [40, 0.611]
  - - [1024, 128, 1, 256, 1024, 1024, 1024, 128]
    - [40, 0.72]
  - - [1024, 128, 1, 512, 1024, 1024, 1024, 128]
    - [110, 1.267]
  - - [1024, 128, 1, 1024, 1024, 1024, 1024, 128]
    - [39, 2.126]
  - - [1024, 128, 1, 2048, 1024, 1024, 1024, 128]
    - [39, 3.219]
  - - [1024, 128, 1, 4096, 1024, 1024, 1024, 128]
    - [15, 4.91]
  - - [1024, 128, 1, 8192, 1024, 1024, 1024, 128]
    - [85, 6.67]
  - - [1024, 256, 1, 128, 1024, 1024, 1024, 256]
    - [39, 1.16]
  - - [1024, 256, 1, 256, 1024, 1024, 1024, 256]
    - [39, 1.459]
  - - [1024, 256, 1, 512, 1024, 1024, 1024, 256]
    - [40, 2.332]
  - - [1024, 256, 1, 1024, 1024, 1024, 1024, 256]
    - [106, 3.871]
  - - [1024, 256, 1, 2048, 1024, 1024, 1024, 256]
    - [94, 5.662]
  - - [1024, 256, 1, 4096, 1024, 1024, 1024, 256]
    - [88, 7.953]
  - - [1024, 256, 1, 8192, 1024, 1024, 1024, 256]
    - [84, 10.459]
  - - [1024, 512, 1, 128, 1024, 1024, 1024, 512]
    - [36, 2.122]
  - - [1024, 512, 1, 256, 1024, 1024, 1024, 512]
    - [106, 2.749]
  - - [1024, 512, 1, 512, 1024, 1024, 1024, 512]
    - [106, 4.266]
  - - [1024, 512, 1, 1024, 1024, 1024, 1024, 512]
    - [106, 6.519]
  - - [1024, 512, 1, 2048, 1024, 1024, 1024, 512]
    - [103, 9.083]
  - - [1024, 512, 1, 4096, 1024, 1024, 1024, 512]
    - [86, 11.541]
  - - [1024, 512, 1, 8192, 1024, 1024, 1024, 512]
    - [76, 14.313]
  - - [1024, 1024, 1, 128, 1024, 1024, 1024, 1024]
    - [102, 3.487]
  - - [1024, 1024, 1, 256, 1024, 1024, 1024, 1024]
    - [33, 4.676]
  - - [1024, 1024, 1, 512, 1024, 1024, 1024, 1024]
    - [102, 7.142]
  - - [1024, 1024, 1, 1024, 1024, 1024, 1024, 1024]
    - [102, 10.23]
  - - [1024, 1024, 1, 2048, 1024, 1024, 1024, 1024]
    - [53, 12.866]
  - - [1024, 1024, 1, 4096, 1024, 1024, 1024, 1024]
    - [78, 15.632]
  - - [1024, 1024, 1, 8192, 1024, 1024, 1024, 1024]
    - [72, 19.973]
  - - [1024, 2048, 1, 128, 1024, 1024, 1024, 2048]
    - [30, 5.322]
  - - [1024, 2048, 1, 256, 1024, 1024, 1024, 2048]
    - [25, 7.639]
  - - [1024, 2048, 1, 512, 1024, 1024, 1024, 2048]
    - [98, 10.532]
  - - [1024, 2048, 1, 1024, 1024, 1024, 1024, 2048]
    - [79, 13.67]
  - - [1024, 2048, 1, 2048, 1024, 1024, 1024, 2048]
    - [51, 16.762]
  - - [1024, 2048, 1, 4096, 1024, 1024, 1024, 2048]
    - [72, 21.329]
  - - [1024, 2048, 1, 8192, 1024, 1024, 1024, 2048]
    - [63, 24.651]
  - - [1024, 4096, 1, 128, 1024, 1024, 1024, 4096]
    - [22, 7.055]
  - - [1024, 4096, 1, 256, 1024, 1024, 1024, 4096]
    - [22, 10.615]
  - - [1024, 4096, 1, 512, 1024, 1024, 1024, 4096]
    - [96, 12.633]
  - - [1024, 4096, 1, 1024, 1024, 1024, 1024, 4096]
    - [74, 16.703]
  - - [1024, 4096, 1, 2048, 1024, 1024, 1024, 4096]
    - [75, 21.535]
  - - [1024, 4096, 1, 4096, 1024, 1024, 1024, 4096]
    - [66, 26.433]
  - - [1024, 4096, 1, 8192, 1024, 1024, 1024, 4096]
    - [0, 27.84]
  - - [1024, 8192, 1, 128, 1024, 1024, 1024, 8192]
    - [19, 7.01]
  - - [1024, 8192, 1, 256, 1024, 1024, 1024, 8192]
    - [18, 10.619]
  - - [1024, 8192, 1, 512, 1024, 1024, 1024, 8192]
    - [69, 15.461]
  - - [1024, 8192, 1, 1024, 1024, 1024, 1024, 8192]
    - [95, 20.651]
  - - [1024, 8192, 1, 2048, 1024, 1024, 1024, 8192]
    - [49, 24.964]
  - - [1024, 8192, 1, 4096, 1024, 1024, 1024, 8192]
    - [41, 28.489]
  - - [1024, 8192, 1, 8192, 1024, 1024, 1024, 8192]
    - [4, 31.818]
  - - [2048, 128, 1, 128, 2048, 2048, 2048, 128]
    - [39, 1.158]
  - - [2048, 128, 1, 256, 2048, 2048, 2048, 128]
    - [40, 1.511]
  - - [2048, 128, 1, 512, 2048, 2048, 2048, 128]
    - [39, 2.327]
  - - [2048, 128, 1, 1024, 2048, 2048, 2048, 128]
    - [106, 3.864]
  - - [2048, 128, 1, 2048, 2048, 2048, 2048, 128]
    - [106, 5.833]
  - - [2048, 128, 1, 4096, 2048, 2048, 2048, 128]
    - [13, 8.235]
  - - [2048, 128, 1, 8192, 2048, 2048, 2048, 128]
    - [102, 10.766]
  - - [2048, 256, 1, 128, 2048, 2048, 2048, 256]
    - [36, 2.098]
  - - [2048, 256, 1, 256, 2048, 2048, 2048, 256]
    - [36, 2.727]
  - - [2048, 256, 1, 512, 2048, 2048, 2048, 256]
    - [109, 4.273]
  - - [2048, 256, 1, 1024, 2048, 2048, 2048, 256]
    - [108, 6.274]
  - - [2048, 256, 1, 2048, 2048, 2048, 2048, 256]
    - [103, 9.208]
  - - [2048, 256, 1, 4096, 2048, 2048, 2048, 256]
    - [10, 11.793]
  - - [2048, 256, 1, 8192, 2048, 2048, 2048, 256]
    - [77, 14.879]
  - - [2048, 512, 1, 128, 2048, 2048, 2048, 512]
    - [102, 3.433]
  - - [2048, 512, 1, 256, 2048, 2048, 2048, 512]
    - [101, 4.745]
  - - [2048, 512, 1, 512, 2048, 2048, 2048, 512]
    - [102, 7.354]
  - - [2048, 512, 1, 1024, 2048, 2048, 2048, 512]
    - [103, 10.27]
  - - [2048, 512, 1, 2048, 2048, 2048, 2048, 512]
    - [55, 13.16]
  - - [2048, 512, 1, 4096, 2048, 2048, 2048, 512]
    - [77, 15.842]
  - - [2048, 512, 1, 8192, 2048, 2048, 2048, 512]
    - [69, 20.609]
  - - [2048, 1024, 1, 128, 2048, 2048, 2048, 1024]
    - [28, 5.372]
  - - [2048, 1024, 1, 256, 2048, 2048, 2048, 1024]
    - [25, 7.682]
  - - [2048, 1024, 1, 512, 2048, 2048, 2048, 1024]
    - [100, 10.392]
  - - [2048, 1024, 1, 1024, 2048, 2048, 2048, 1024]
    - [80, 13.404]
  - - [2048, 1024, 1, 2048, 2048, 2048, 2048, 1024]
    - [52, 16.78]
  - - [2048, 1024, 1, 4096, 2048, 2048, 2048, 1024]
    - [72, 21.434]
  - - [2048, 1024, 1, 8192, 2048, 2048, 2048, 1024]
    - [47, 25.014]
  - - [2048, 2048, 1, 128, 2048, 2048, 2048, 2048]
    - [22, 7.029]
  - - [2048, 2048, 1, 256, 2048, 2048, 2048, 2048]
    - [22, 10.279]
  - - [2048, 2048, 1, 512, 2048, 2048, 2048, 2048]
    - [97, 12.478]
  - - [2048, 2048, 1, 1024, 2048, 2048, 2048, 2048]
    - [72, 16.76]
  - - [2048, 2048, 1, 2048, 2048, 2048, 2048, 2048]
    - [69, 21.969]
  - - [2048, 2048, 1, 4096, 2048, 2048, 2048, 2048]
    - [68, 25.189]
  - - [2048, 2048, 1, 8192, 2048, 2048, 2048, 2048]
    - [65, 27.301]
  - - [2048, 4096, 1, 128, 2048, 2048, 2048, 4096]
    - [21, 6.859]
  - - [2048, 4096, 1, 256, 2048, 2048, 2048, 4096]
    - [20, 10.559]
  - - [2048, 4096, 1, 512, 2048, 2048, 2048, 4096]
    - [72, 15.046]
  - - [2048, 4096, 1, 1024, 2048, 2048, 2048, 4096]
    - [69, 20.357]
  - - [2048, 4096, 1, 2048, 2048, 2048, 2048, 4096]
    - [46, 25.37]
  - - [2048, 4096, 1, 4096, 2048, 2048, 2048, 4096]
    - [41, 28.177]
  - - [2048, 4096, 1, 8192, 2048, 2048, 2048, 4096]
    - [41, 32.249]
  - - [2048, 8192, 1, 128, 2048, 2048, 2048, 8192]
    - [20, 7.492]
  - - [2048, 8192, 1, 256, 2048, 2048, 2048, 8192]
    - [20, 11.604]
  - - [2048, 8192, 1, 512, 2048, 2048, 2048, 8192]
    - [23, 17.211]
  - - [2048, 8192, 1, 1024, 2048, 2048, 2048, 8192]
    - [48, 22.689]
  - - [2048, 8192, 1, 2048, 2048, 2048, 2048, 8192]
    - [61, 26.726]
  - - [2048, 8192, 1, 4096, 2048, 2048, 2048, 8192]
    - [0, 30.628]
  - - [2048, 8192, 1, 8192, 2048, 2048, 2048, 8192]
    - [45, 34.085]
  - - [4096, 128, 1, 128, 4096, 4096, 4096, 128]
    - [36, 2.086]
  - - [4096, 128, 1, 256, 4096, 4096, 4096, 128]
    - [109, 2.725]
  - - [4096, 128, 1, 512, 4096, 4096, 4096, 128]
    - [106, 4.286]
  - - [4096, 128, 1, 1024, 4096, 4096, 4096, 128]
    - [106, 6.292]
  - - [4096, 128, 1, 2048, 4096, 4096, 4096, 128]
    - [103, 9.307]
  - - [4096, 128, 1, 4096, 4096, 4096, 4096, 128]
    - [84, 11.799]
  - - [4096, 128, 1, 8192, 4096, 4096, 4096, 128]
    - [11, 15.188]
  - - [4096, 256, 1, 128, 4096, 4096, 4096, 256]
    - [35, 3.505]
  - - [4096, 256, 1, 256, 4096, 4096, 4096, 256]
    - [34, 4.738]
  - - [4096, 256, 1, 512, 4096, 4096, 4096, 256]
    - [105, 7.147]
  - - [4096, 256, 1, 1024, 4096, 4096, 4096, 256]
    - [105, 10.509]
  - - [4096, 256, 1, 2048, 4096, 4096, 4096, 256]
    - [54, 12.985]
  - - [4096, 256, 1, 4096, 4096, 4096, 4096, 256]
    - [11, 16.425]
  - - [4096, 256, 1, 8192, 4096, 4096, 4096, 256]
    - [52, 20.775]
  - - [4096, 512, 1, 128, 4096, 4096, 4096, 512]
    - [28, 5.286]
  - - [4096, 512, 1, 256, 4096, 4096, 4096, 512]
    - [25, 7.604]
  - - [4096, 512, 1, 512, 4096, 4096, 4096, 512]
    - [100, 10.397]
  - - [4096, 512, 1, 1024, 4096, 4096, 4096, 512]
    - [82, 13.514]
  - - [4096, 512, 1, 2048, 4096, 4096, 4096, 512]
    - [72, 16.917]
  - - [4096, 512, 1, 4096, 4096, 4096, 4096, 512]
    - [72, 21.597]
  - - [4096, 512, 1, 8192, 4096, 4096, 4096, 512]
    - [46, 25.743]
  - - [4096, 1024, 1, 128, 4096, 4096, 4096, 1024]
    - [97, 6.825]
  - - [4096, 1024, 1, 256, 4096, 4096, 4096, 1024]
    - [97, 9.961]
  - - [4096, 1024, 1, 512, 4096, 4096, 4096, 1024]
    - [97, 12.426]
  - - [4096, 1024, 1, 1024, 4096, 4096, 4096, 1024]
    - [74, 16.695]
  - - [4096, 1024, 1, 2048, 4096, 4096, 4096, 1024]
    - [74, 21.296]
  - - [4096, 1024, 1, 4096, 4096, 4096, 4096, 1024]
    - [49, 26.181]
  - - [4096, 1024, 1, 8192, 4096, 4096, 4096, 1024]
    - [43, 27.693]
  - - [4096, 2048, 1, 128, 4096, 4096, 4096, 2048]
    - [19, 7.213]
  - - [4096, 2048, 1, 256, 4096, 4096, 4096, 2048]
    - [21, 10.241]
  - - [4096, 2048, 1, 512, 4096, 4096, 4096, 2048]
    - [72, 14.811]
  - - [4096, 2048, 1, 1024, 4096, 4096, 4096, 2048]
    - [97, 20.06]
  - - [4096, 2048, 1, 2048, 4096, 4096, 4096, 2048]
    - [50, 24.784]
  - - [4096, 2048, 1, 4096, 4096, 4096, 4096, 2048]
    - [41, 27.943]
  - - [4096, 2048, 1, 8192, 4096, 4096, 4096, 2048]
    - [43, 31.974]
  - - [4096, 4096, 1, 128, 4096, 4096, 4096, 4096]
    - [19, 7.834]
  - - [4096, 4096, 1, 256, 4096, 4096, 4096, 4096]
    - [19, 11.612]
  - - [4096, 4096, 1, 512, 4096, 4096, 4096, 4096]
    - [64, 16.774]
  - - [4096, 4096, 1, 1024, 4096, 4096, 4096, 4096]
    - [67, 22.165]
  - - [4096, 4096, 1, 2048, 4096, 4096, 4096, 4096]
    - [62, 26.775]
  - - [4096, 4096, 1, 4096, 4096, 4096, 4096, 4096]
    - [41, 30.658]
  - - [4096, 4096, 1, 8192, 4096, 4096, 4096, 4096]
    - [0, 34.332]
  - - [4096, 8192, 1, 128, 4096, 4096, 4096, 8192]
    - [18, 8.22]
  - - [4096, 8192, 1, 256, 4096, 4096, 4096, 8192]
    - [20, 12.666]
  - - [4096, 8192, 1, 512, 4096, 4096, 4096, 8192]
    - [71, 17.225]
  - - [4096, 8192, 1, 1024, 4096, 4096, 4096, 8192]
    - [41, 22.389]
  - - [4096, 8192, 1, 2048, 4096, 4096, 4096, 8192]
    - [43, 29.123]
  - - [4096, 8192, 1, 4096, 4096, 4096, 4096, 8192]
    - [43, 34.681]
  - - [4096, 8192, 1, 8192, 4096, 4096, 4096, 8192]
    - [41, 38.322]
  - - [8192, 128, 1, 128, 8192, 8192, 8192, 128]
    - [103, 3.38]
  - - [8192, 128, 1, 256, 8192, 8192, 8192, 128]
    - [31, 4.775]
  - - [8192, 128, 1, 512, 8192, 8192, 8192, 128]
    - [102, 7.126]
  - - [8192, 128, 1, 1024, 8192, 8192, 8192, 128]
    - [105, 10.362]
  - - [8192, 128, 1, 2048, 8192, 8192, 8192, 128]
    - [77, 12.916]
  - - [8192, 128, 1, 4096, 8192, 8192, 8192, 128]
    - [11, 16.719]
  - - [8192, 128, 1, 8192, 8192, 8192, 8192, 128]
    - [9, 20.942]
  - - [8192, 256, 1, 128, 8192, 8192, 8192, 256]
    - [25, 5.084]
  - - [8192, 256, 1, 256, 8192, 8192, 8192, 256]
    - [24, 7.243]
  - - [8192, 256, 1, 512, 8192, 8192, 8192, 256]
    - [99, 10.359]
  - - [8192, 256, 1, 1024, 8192, 8192, 8192, 256]
    - [80, 13.446]
  - - [8192, 256, 1, 2048, 8192, 8192, 8192, 256]
    - [74, 17.143]
  - - [8192, 256, 1, 4096, 8192, 8192, 8192, 256]
    - [69, 21.947]
  - - [8192, 256, 1, 8192, 8192, 8192, 8192, 256]
    - [1, 25.6]
  - - [8192, 512, 1, 128, 8192, 8192, 8192, 512]
    - [97, 6.423]
  - - [8192, 512, 1, 256, 8192, 8192, 8192, 512]
    - [23, 9.549]
  - - [8192, 512, 1, 512, 8192, 8192, 8192, 512]
    - [97, 12.472]
  - - [8192, 512, 1, 1024, 8192, 8192, 8192, 512]
    - [73, 16.982]
  - - [8192, 512, 1, 2048, 8192, 8192, 8192, 512]
    - [69, 21.673]
  - - [8192, 512, 1, 4096, 8192, 8192, 8192, 512]
    - [5, 26.586]
  - - [8192, 512, 1, 8192, 8192, 8192, 8192, 512]
    - [6, 28.522]
  - - [8192, 1024, 1, 128, 8192, 8192, 8192, 1024]
    - [20, 7.464]
  - - [8192, 1024, 1, 256, 8192, 8192, 8192, 1024]
    - [18, 10.64]
  - - [8192, 1024, 1, 512, 8192, 8192, 8192, 1024]
    - [74, 15.195]
  - - [8192, 1024, 1, 1024, 8192, 8192, 8192, 1024]
    - [72, 20.37]
  - - [8192, 1024, 1, 2048, 8192, 8192, 8192, 1024]
    - [1, 25.284]
  - - [8192, 1024, 1, 4096, 8192, 8192, 8192, 1024]
    - [0, 28.539]
  - - [8192, 1024, 1, 8192, 8192, 8192, 8192, 1024]
    - [45, 31.385]
  - - [8192, 2048, 1, 128, 8192, 8192, 8192, 2048]
    - [20, 7.91]
  - - [8192, 2048, 1, 256, 8192, 8192, 8192, 2048]
    - [18, 11.897]
  - - [8192, 2048, 1, 512, 8192, 8192, 8192, 2048]
    - [97, 16.975]
  - - [8192, 2048, 1, 1024, 8192, 8192, 8192, 2048]
    - [47, 23.027]
  - - [8192, 2048, 1, 2048, 8192, 8192, 8192, 2048]
    - [61, 26.823]
  - - [8192, 2048, 1, 4096, 8192, 8192, 8192, 2048]
    - [60, 30.204]
  - - [8192, 2048, 1, 8192, 8192, 8192, 8192, 2048]
    - [41, 34.325]
  - - [8192, 4096, 1, 128, 8192, 8192, 8192, 4096]
    - [18, 8.592]
  - - [8192, 4096, 1, 256, 8192, 8192, 8192, 4096]
    - [19, 13.015]
  - - [8192, 4096, 1, 512, 8192, 8192, 8192, 4096]
    - [74, 17.461]
  - - [8192, 4096, 1, 1024, 8192, 8192, 8192, 4096]
    - [58, 22.372]
  - - [8192, 4096, 1, 2048, 8192, 8192, 8192, 4096]
    - [41, 28.99]
  - - [8192, 4096, 1, 4096, 8192, 8192, 8192, 4096]
    - [57, 34.615]
  - - [8192, 4096, 1, 8192, 8192, 8192, 8192, 4096]
    - [59, 37.405]
  - - [8192, 8192, 1, 128, 8192, 8192, 8192, 8192]
    - [2, 7.083]
  - - [8192, 8192, 1, 256, 8192, 8192, 8192, 8192]
    - [8, 11.709]
  - - [8192, 8192, 1, 512, 8192, 8192, 8192, 8192]
    - [49, 17.617]
  - - [8192, 8192, 1, 1024, 8192, 8192, 8192, 8192]
    - [44, 24.617]
  - - [8192, 8192, 1, 2048, 8192, 8192, 8192, 8192]
    - [42, 32.338]
  - - [8192, 8192, 1, 4096, 8192, 8192, 8192, 8192]
    - [43, 37.945]
  - - [8192, 8192, 1, 8192, 8192, 8192, 8192, 8192]
    - [43, 40.881]
  - - [1, 1, 1, 32, 1, 1, 1, 1]
    - [113, 0.0]
- null
- null
- DeviceEfficiency
- GridBased
