library/src/amd_detail/rocblaslt/src/Tensile/Logic/streamk/gfx942/aquavanjaram942_Cijk_Alik_Bljk_HHS_BH_UserArgs.yaml
- {MinimumRequiredVersion: 4.33.0}
- aquavanjaram942
- gfx942
- [Device 0049, Device 0050]
    SolutionIndex: 0
    SolutionNameMin: Cijk_Alik_Bljk_HHS_BH_UserArgs_MT256x64x64_MI16x16x1_SN_LDSB1_CLR1_GSU0_GSUC0_GSUWGMRR0_K1_LBSPPA128_LBSPPB256_MIWT8_2_PLR1_SU32_SUM0_SUS256_SKXCCM0_VWA1_VWB2_WGM4_WGMXCC1_WGMXCCGn1
    SolutionIndex: 1
    SolutionNameMin: Cijk_Alik_Bljk_HHS_BH_UserArgs_MT256x64x64_MI16x16x1_SN_LDSB1_CLR1_GSU0_GSUC0_GSUWGMRR0_K1_LBSPPA512_LBSPPB256_MIWT8_2_PLR2_SU32_SUM0_SUS256_SKXCCM0_VWA4_VWB2_WGM8_WGMXCC1_WGMXCCGn1
    SolutionIndex: 2
    SolutionNameMin: Cijk_Alik_Bljk_HHS_BH_UserArgs_MT128x128x64_MI16x16x1_SN_LDSB1_CLR1_GSU0_GSUC0_GSUWGMRR0_K1_LBSPPA256_LBSPPB128_MIWT4_4_PLR1_SU32_SUM0_SUS256_SKXCCM0_VWA2_VWB1_WGM1_WGMXCC1_WGMXCCGn1
    SolutionIndex: 3
    SolutionNameMin: Cijk_Alik_Bljk_HHS_BH_UserArgs_MT128x128x64_MI16x16x1_SN_LDSB1_CLR1_GSU0_GSUC0_GSUWGMRR0_K1_LBSPPA512_LBSPPB128_MIWT4_4_PLR1_SU32_SUM0_SUS256_SKXCCM0_VWA4_VWB1_WGM1_WGMXCC1_WGMXCCGn1
    SolutionIndex: 4
    SolutionNameMin: Cijk_Alik_Bljk_HHS_BH_UserArgs_MT128x128x64_MI16x16x1_SN_LDSB1_CLR1_GSU0_GSUC0_GSUWGMRR0_K1_LBSPPA256_LBSPPB256_MIWT4_4_PLR1_SU32_SUM0_SUS256_SKXCCM0_VWA2_VWB2_WGM1_WGMXCC1_WGMXCCGn1
    SolutionIndex: 5
    SolutionNameMin: Cijk_Alik_Bljk_HHS_BH_UserArgs_MT128x128x64_MI16x16x1_SN_LDSB1_CLR1_GSU0_GSUC0_GSUWGMRR0_K1_LBSPPA512_LBSPPB256_MIWT4_4_PLR1_SU32_SUM0_SUS256_SKXCCM0_VWA4_VWB2_WGM1_WGMXCC1_WGMXCCGn1
    SolutionIndex: 6
    SolutionNameMin: Cijk_Alik_Bljk_HHS_BH_UserArgs_MT128x128x64_MI16x16x1_SN_LDSB1_CLR1_GSU0_GSUC0_GSUWGMRR0_K1_LBSPPA512_LBSPPB512_MIWT4_4_PLR1_SU32_SUM0_SUS256_SKXCCM0_VWA4_VWB4_WGM1_WGMXCC1_WGMXCCGn1
    SolutionIndex: 7
    SolutionNameMin: Cijk_Alik_Bljk_HHS_BH_UserArgs_MT128x128x64_MI16x16x1_SN_LDSB1_CLR1_GSU0_GSUC0_GSUWGMRR0_K1_LBSPPA512_LBSPPB512_MIWT4_4_PLR1_SU32_SUM0_SUS256_SKXCCM0_VWA4_VWB4_WGM4_WGMXCC1_WGMXCCGn1
    SolutionIndex: 8
    SolutionNameMin: Cijk_Alik_Bljk_HHS_BH_UserArgs_MT128x128x64_MI16x16x1_SN_LDSB1_CLR1_GSU0_GSUC0_GSUWGMRR0_K1_LBSPPA512_LBSPPB128_MIWT4_4_PLR1_SU32_SUM0_SUS256_SKXCCM0_VWA4_VWB1_WGM8_WGMXCC1_WGMXCCGn1
    SolutionIndex: 9
    SolutionNameMin: Cijk_Alik_Bljk_HHS_BH_UserArgs_MT128x128x64_MI16x16x1_SN_LDSB1_CLR1_GSU0_GSUC0_GSUWGMRR0_K1_LBSPPA512_LBSPPB256_MIWT4_4_PLR1_SU32_SUM0_SUS256_SKXCCM0_VWA4_VWB2_WGM8_WGMXCC1_WGMXCCGn1
    SolutionIndex: 10
    SolutionNameMin: Cijk_Alik_Bljk_HHS_BH_UserArgs_MT128x128x64_MI16x16x1_SN_LDSB1_CLR1_GSU0_GSUC0_GSUWGMRR0_K1_LBSPPA512_LBSPPB512_MIWT4_4_PLR1_SU32_SUM0_SUS256_SKXCCM0_VWA4_VWB4_WGM8_WGMXCC1_WGMXCCGn1
    SolutionIndex: 11
    SolutionNameMin: Cijk_Alik_Bljk_HHS_BH_UserArgs_MT128x128x64_MI16x16x1_SN_LDSB1_CLR1_GSU0_GSUC0_GSUWGMRR0_K1_LBSPPA512_LBSPPB256_MIWT4_4_PLR2_SU32_SUM0_SUS256_SKXCCM0_VWA4_VWB2_WGM8_WGMXCC1_WGMXCCGn1
    SolutionIndex: 12
    SolutionNameMin: Cijk_Alik_Bljk_HHS_BH_UserArgs_MT64x128x64_MI16x16x1_SN_LDSB1_CLR1_GSU0_GSUC0_GSUWGMRR0_K1_LBSPPA128_LBSPPB128_MIWT2_4_PLR1_SU32_SUM0_SUS256_SKXCCM0_VWA1_VWB1_WGM1_WGMXCC1_WGMXCCGn1
    SolutionIndex: 13
    SolutionNameMin: Cijk_Alik_Bljk_HHS_BH_UserArgs_MT128x64x64_MI16x16x1_SN_LDSB1_CLR1_GSU0_GSUC0_GSUWGMRR0_K1_LBSPPA512_LBSPPB128_MIWT4_2_PLR1_SU32_SUM0_SUS256_SKXCCM0_VWA4_VWB1_WGM1_WGMXCC1_WGMXCCGn1
    SolutionIndex: 14
    SolutionNameMin: Cijk_Alik_Bljk_HHS_BH_UserArgs_MT32x32x64_MI16x16x1_SN_LDSB0_CLR1_GSU0_GSUC0_GSUWGMRR0_K1_LBSPPA128_LBSPPB128_MIWT1_1_PLR1_SU32_SUM0_SUS256_SKXCCM0_VWA1_VWB1_WGM1_WGMXCC1_WGMXCCGn1
    SolutionIndex: 15
    SolutionNameMin: Cijk_Alik_Bljk_HHS_BH_UserArgs_MT64x64x128_MI16x16x1_SN_LDSB1_CLR1_GSU0_GSUC0_GSUWGMRR0_K1_LBSPPA512_LBSPPB256_MIWT2_2_PLR1_SU32_SUM0_SUS256_SKXCCM0_VWA2_VWB1_WGM1_WGMXCC1_WGMXCCGn1
    SolutionIndex: 16
    SolutionNameMin: Cijk_Alik_Bljk_HHS_BH_UserArgs_MT64x64x128_MI16x16x1_SN_LDSB1_CLR1_GSU0_GSUC0_GSUWGMRR0_K1_LBSPPA512_LBSPPB256_MIWT2_2_PLR2_SU32_SUM0_SUS256_SKXCCM0_VWA2_VWB1_WGM1_WGMXCC1_WGMXCCGn1
    SolutionIndex: 17
    SolutionNameMin: Cijk_Alik_Bljk_HHS_BH_UserArgs_MT64x64x128_MI16x16x1_SN_LDSB1_CLR1_GSU0_GSUC0_GSUWGMRR0_K1_LBSPPA512_LBSPPB512_MIWT2_2_PLR2_SU32_SUM0_SUS256_SKXCCM0_VWA2_VWB2_WGM1_WGMXCC1_WGMXCCGn1
    SolutionIndex: 18
    SolutionNameMin: Cijk_Alik_Bljk_HHS_BH_UserArgs_MT64x64x128_MI16x16x1_SN_LDSB1_CLR1_GSU0_GSUC0_GSUWGMRR0_K1_LBSPPA512_LBSPPB256_MIWT2_2_PLR1_SU32_SUM0_SUS256_SKXCCM0_VWA2_VWB1_WGM4_WGMXCC1_WGMXCCGn1
    SolutionIndex: 19
    SolutionNameMin: Cijk_Alik_Bljk_HHS_BH_UserArgs_MT64x64x128_MI16x16x1_SN_LDSB1_CLR1_GSU0_GSUC0_GSUWGMRR0_K1_LBSPPA512_LBSPPB256_MIWT2_2_PLR2_SU32_SUM0_SUS256_SKXCCM0_VWA2_VWB1_WGM4_WGMXCC1_WGMXCCGn1
    SolutionIndex: 20
    SolutionNameMin: Cijk_Alik_Bljk_HHS_BH_UserArgs_MT64x64x128_MI16x16x1_SN_LDSB1_CLR1_GSU0_GSUC0_GSUWGMRR0_K1_LBSPPA512_LBSPPB256_MIWT2_2_PLR1_SU32_SUM0_SUS256_SKXCCM0_VWA2_VWB1_WGM8_WGMXCC1_WGMXCCGn1
    SolutionIndex: 21
    SolutionNameMin: Cijk_Alik_Bljk_HHS_BH_UserArgs_MT32x64x128_MI16x16x1_SN_LDSB1_CLR1_GSU0_GSUC0_GSUWGMRR0_K1_LBSPPA256_LBSPPB512_MIWT1_2_PLR1_SU32_SUM0_SUS256_SKXCCM0_VWA1_VWB2_WGM1_WGMXCC1_WGMXCCGn1
    SolutionIndex: 22
    SolutionNameMin: Cijk_Alik_Bljk_HHS_BH_UserArgs_MT32x64x128_MI16x16x1_SN_LDSB1_CLR1_GSU0_GSUC0_GSUWGMRR0_K1_LBSPPA256_LBSPPB256_MIWT1_2_PLR2_SU32_SUM0_SUS256_SKXCCM0_VWA1_VWB1_WGM1_WGMXCC1_WGMXCCGn1
    SolutionIndex: 23
    SolutionNameMin: Cijk_Alik_Bljk_HHS_BH_UserArgs_MT64x32x128_MI16x16x1_SN_LDSB1_CLR1_GSU0_GSUC0_GSUWGMRR0_K1_LBSPPA256_LBSPPB256_MIWT2_1_PLR1_SU32_SUM0_SUS256_SKXCCM0_VWA1_VWB1_WGM1_WGMXCC1_WGMXCCGn1
    SolutionIndex: 24
    SolutionNameMin: Cijk_Alik_Bljk_HHS_BH_UserArgs_MT64x32x128_MI16x16x1_SN_LDSB1_CLR1_GSU0_GSUC0_GSUWGMRR0_K1_LBSPPA512_LBSPPB256_MIWT2_1_PLR1_SU32_SUM0_SUS256_SKXCCM0_VWA2_VWB1_WGM1_WGMXCC1_WGMXCCGn1
    SolutionIndex: 25
    SolutionNameMin: Cijk_Alik_Bljk_HHS_BH_UserArgs_MT64x32x128_MI16x16x1_SN_LDSB1_CLR1_GSU0_GSUC0_GSUWGMRR0_K1_LBSPPA512_LBSPPB256_MIWT2_1_PLR2_SU32_SUM0_SUS256_SKXCCM0_VWA2_VWB1_WGM1_WGMXCC1_WGMXCCGn1
    SolutionIndex: 26
    SolutionNameMin: Cijk_Alik_Bljk_HHS_BH_UserArgs_MT32x32x128_MI16x16x1_SN_LDSB1_CLR1_GSU0_GSUC0_GSUWGMRR0_K1_LBSPPA256_LBSPPB256_MIWT1_1_PLR1_SU32_SUM0_SUS256_SKXCCM0_VWA1_VWB1_WGM1_WGMXCC1_WGMXCCGn1
    SolutionIndex: 27
    SolutionNameMin: Cijk_Alik_Bljk_HHS_BH_UserArgs_MT32x32x128_MI16x16x1_SN_LDSB1_CLR1_GSU0_GSUC0_GSUWGMRR0_K1_LBSPPA256_LBSPPB256_MIWT1_1_PLR2_SU32_SUM0_SUS256_SKXCCM0_VWA1_VWB1_WGM1_WGMXCC1_WGMXCCGn1
    SolutionIndex: 28
    SolutionNameMin: Cijk_Alik_Bljk_HHS_BH_UserArgs_MT32x32x128_MI16x16x1_SN_LDSB1_CLR1_GSU0_GSUC0_GSUWGMRR0_K1_LBSPPA256_LBSPPB256_MIWT1_1_PLR1_SU32_SUM0_SUS256_SKXCCM0_VWA1_VWB1_WGM4_WGMXCC1_WGMXCCGn1
    SolutionIndex: 29
    SolutionNameMin: Cijk_Alik_Bljk_HHS_BH_UserArgs_MT32x32x128_MI16x16x1_SN_LDSB1_CLR1_GSU0_GSUC0_GSUWGMRR0_K1_LBSPPA256_LBSPPB256_MIWT1_1_PLR2_SU32_SUM0_SUS256_SKXCCM0_VWA1_VWB1_WGM8_WGMXCC1_WGMXCCGn1
    SolutionIndex: 30
    SolutionNameMin: Cijk_Alik_Bljk_HHS_BH_UserArgs_MT32x32x32_MI16x16x1_SN_LDSB0_CLR1_GSU0_GSUC0_GSUWGMRR0_K1_LBSPPA128_LBSPPB128_MIWT1_1_PLR1_SU32_SUM0_SUS256_SKXCCM8_VWA1_VWB1_WGM1_WGMXCC1_WGMXCCGn1
    SolutionIndex: 31
    SolutionNameMin: Cijk_Alik_Bljk_HHS_BH_UserArgs_MT32x32x32_MI16x16x1_SN_LDSB0_CLR0_GSU0_GSUC0_GSUWGMRR0_K1_LBSPPA128_LBSPPB128_MIWT1_1_PLR0_SU32_SUM0_SUS256_SKXCCM8_VWA1_VWB1_WGM1_WGMXCC1_WGMXCCGn1
    SolutionIndex: 32
    SolutionNameMin: Cijk_Alik_Bljk_HHS_BH_UserArgs_MT128x128x64_MI16x16x1_SN_LDSB1_CLR1_GSU0_GSUC0_GSUWGMRR0_K1_LBSPPA128_LBSPPB128_MIWT4_4_PLR1_SU32_SUM0_SUS256_SKXCCM8_VWA1_VWB1_WGM1_WGMXCC1_WGMXCCGn1
    SolutionIndex: 33
    SolutionNameMin: Cijk_Alik_Bljk_HHS_BH_UserArgs_MT128x128x64_MI16x16x1_SN_LDSB1_CLR1_GSU0_GSUC0_GSUWGMRR0_K1_LBSPPA256_LBSPPB128_MIWT4_4_PLR1_SU32_SUM0_SUS256_SKXCCM8_VWA2_VWB1_WGM1_WGMXCC1_WGMXCCGn1
    SolutionIndex: 34
    SolutionNameMin: Cijk_Alik_Bljk_HHS_BH_UserArgs_MT128x128x64_MI16x16x1_SN_LDSB1_CLR1_GSU0_GSUC0_GSUWGMRR0_K1_LBSPPA512_LBSPPB128_MIWT4_4_PLR1_SU32_SUM0_SUS256_SKXCCM8_VWA4_VWB1_WGM1_WGMXCC1_WGMXCCGn1
    SolutionIndex: 35
    SolutionNameMin: Cijk_Alik_Bljk_HHS_BH_UserArgs_MT128x128x64_MI16x16x1_SN_LDSB1_CLR1_GSU0_GSUC0_GSUWGMRR0_K1_LBSPPA128_LBSPPB256_MIWT4_4_PLR1_SU32_SUM0_SUS256_SKXCCM8_VWA1_VWB2_WGM1_WGMXCC1_WGMXCCGn1
    SolutionIndex: 36
    SolutionNameMin: Cijk_Alik_Bljk_HHS_BH_UserArgs_MT128x128x64_MI16x16x1_SN_LDSB1_CLR1_GSU0_GSUC0_GSUWGMRR0_K1_LBSPPA512_LBSPPB256_MIWT4_4_PLR1_SU32_SUM0_SUS256_SKXCCM8_VWA4_VWB2_WGM1_WGMXCC1_WGMXCCGn1
    SolutionIndex: 37
    SolutionNameMin: Cijk_Alik_Bljk_HHS_BH_UserArgs_MT128x128x64_MI16x16x1_SN_LDSB1_CLR1_GSU0_GSUC0_GSUWGMRR0_K1_LBSPPA128_LBSPPB512_MIWT4_4_PLR1_SU32_SUM0_SUS256_SKXCCM8_VWA1_VWB4_WGM1_WGMXCC1_WGMXCCGn1
    SolutionIndex: 38
    SolutionNameMin: Cijk_Alik_Bljk_HHS_BH_UserArgs_MT128x128x64_MI16x16x1_SN_LDSB1_CLR1_GSU0_GSUC0_GSUWGMRR0_K1_LBSPPA256_LBSPPB512_MIWT4_4_PLR1_SU32_SUM0_SUS256_SKXCCM8_VWA2_VWB4_WGM1_WGMXCC1_WGMXCCGn1
    SolutionIndex: 39
    SolutionNameMin: Cijk_Alik_Bljk_HHS_BH_UserArgs_MT128x128x64_MI16x16x1_SN_LDSB1_CLR1_GSU0_GSUC0_GSUWGMRR0_K1_LBSPPA512_LBSPPB512_MIWT4_4_PLR1_SU32_SUM0_SUS256_SKXCCM8_VWA4_VWB4_WGM1_WGMXCC1_WGMXCCGn1
    SolutionIndex: 40
    SolutionNameMin: Cijk_Alik_Bljk_HHS_BH_UserArgs_MT128x128x64_MI16x16x1_SN_LDSB1_CLR1_GSU0_GSUC0_GSUWGMRR0_K1_LBSPPA128_LBSPPB128_MIWT4_4_PLR1_SU32_SUM0_SUS256_SKXCCM8_VWA1_VWB1_WGM4_WGMXCC1_WGMXCCGn1
    SolutionIndex: 41
    SolutionNameMin: Cijk_Alik_Bljk_HHS_BH_UserArgs_MT128x128x64_MI16x16x1_SN_LDSB1_CLR1_GSU0_GSUC0_GSUWGMRR0_K1_LBSPPA512_LBSPPB128_MIWT4_4_PLR1_SU32_SUM0_SUS256_SKXCCM8_VWA4_VWB1_WGM4_WGMXCC1_WGMXCCGn1
    SolutionIndex: 42
    SolutionNameMin: Cijk_Alik_Bljk_HHS_BH_UserArgs_MT128x128x64_MI16x16x1_SN_LDSB1_CLR1_GSU0_GSUC0_GSUWGMRR0_K1_LBSPPA256_LBSPPB256_MIWT4_4_PLR1_SU32_SUM0_SUS256_SKXCCM8_VWA2_VWB2_WGM4_WGMXCC1_WGMXCCGn1
    SolutionIndex: 43
    SolutionNameMin: Cijk_Alik_Bljk_HHS_BH_UserArgs_MT128x128x64_MI16x16x1_SN_LDSB1_CLR1_GSU0_GSUC0_GSUWGMRR0_K1_LBSPPA512_LBSPPB256_MIWT4_4_PLR1_SU32_SUM0_SUS256_SKXCCM8_VWA4_VWB2_WGM4_WGMXCC1_WGMXCCGn1
    SolutionIndex: 44
    SolutionNameMin: Cijk_Alik_Bljk_HHS_BH_UserArgs_MT128x128x64_MI16x16x1_SN_LDSB1_CLR1_GSU0_GSUC0_GSUWGMRR0_K1_LBSPPA256_LBSPPB512_MIWT4_4_PLR1_SU32_SUM0_SUS256_SKXCCM8_VWA2_VWB4_WGM4_WGMXCC1_WGMXCCGn1
    SolutionIndex: 45
    SolutionNameMin: Cijk_Alik_Bljk_HHS_BH_UserArgs_MT128x128x64_MI16x16x1_SN_LDSB1_CLR1_GSU0_GSUC0_GSUWGMRR0_K1_LBSPPA512_LBSPPB512_MIWT4_4_PLR1_SU32_SUM0_SUS256_SKXCCM8_VWA4_VWB4_WGM4_WGMXCC1_WGMXCCGn1
    SolutionIndex: 46
    SolutionNameMin: Cijk_Alik_Bljk_HHS_BH_UserArgs_MT128x128x64_MI16x16x1_SN_LDSB1_CLR1_GSU0_GSUC0_GSUWGMRR0_K1_LBSPPA128_LBSPPB128_MIWT4_4_PLR1_SU32_SUM0_SUS256_SKXCCM8_VWA1_VWB1_WGM8_WGMXCC1_WGMXCCGn1
    SolutionIndex: 47
    SolutionNameMin: Cijk_Alik_Bljk_HHS_BH_UserArgs_MT128x128x64_MI16x16x1_SN_LDSB1_CLR1_GSU0_GSUC0_GSUWGMRR0_K1_LBSPPA256_LBSPPB128_MIWT4_4_PLR1_SU32_SUM0_SUS256_SKXCCM8_VWA2_VWB1_WGM8_WGMXCC1_WGMXCCGn1
    SolutionIndex: 48
    SolutionNameMin: Cijk_Alik_Bljk_HHS_BH_UserArgs_MT128x128x64_MI16x16x1_SN_LDSB1_CLR1_GSU0_GSUC0_GSUWGMRR0_K1_LBSPPA512_LBSPPB128_MIWT4_4_PLR1_SU32_SUM0_SUS256_SKXCCM8_VWA4_VWB1_WGM8_WGMXCC1_WGMXCCGn1
    SolutionIndex: 49
    SolutionNameMin: Cijk_Alik_Bljk_HHS_BH_UserArgs_MT128x128x64_MI16x16x1_SN_LDSB1_CLR1_GSU0_GSUC0_GSUWGMRR0_K1_LBSPPA128_LBSPPB256_MIWT4_4_PLR1_SU32_SUM0_SUS256_SKXCCM8_VWA1_VWB2_WGM8_WGMXCC1_WGMXCCGn1
    SolutionIndex: 50
    SolutionNameMin: Cijk_Alik_Bljk_HHS_BH_UserArgs_MT128x128x64_MI16x16x1_SN_LDSB1_CLR1_GSU0_GSUC0_GSUWGMRR0_K1_LBSPPA256_LBSPPB256_MIWT4_4_PLR1_SU32_SUM0_SUS256_SKXCCM8_VWA2_VWB2_WGM8_WGMXCC1_WGMXCCGn1
    SolutionIndex: 51
    SolutionNameMin: Cijk_Alik_Bljk_HHS_BH_UserArgs_MT128x128x64_MI16x16x1_SN_LDSB1_CLR1_GSU0_GSUC0_GSUWGMRR0_K1_LBSPPA512_LBSPPB256_MIWT4_4_PLR1_SU32_SUM0_SUS256_SKXCCM8_VWA4_VWB2_WGM8_WGMXCC1_WGMXCCGn1
    SolutionIndex: 52
    SolutionNameMin: Cijk_Alik_Bljk_HHS_BH_UserArgs_MT128x128x64_MI16x16x1_SN_LDSB1_CLR1_GSU0_GSUC0_GSUWGMRR0_K1_LBSPPA512_LBSPPB512_MIWT4_4_PLR1_SU32_SUM0_SUS256_SKXCCM8_VWA4_VWB4_WGM8_WGMXCC1_WGMXCCGn1
    SolutionIndex: 53
    SolutionNameMin: Cijk_Alik_Bljk_HHS_BH_UserArgs_MT64x128x64_MI16x16x1_SN_LDSB1_CLR1_GSU0_GSUC0_GSUWGMRR0_K1_LBSPPA256_LBSPPB128_MIWT2_4_PLR1_SU32_SUM0_SUS256_SKXCCM8_VWA2_VWB1_WGM1_WGMXCC1_WGMXCCGn1
    SolutionIndex: 54
    SolutionNameMin: Cijk_Alik_Bljk_HHS_BH_UserArgs_MT64x128x64_MI16x16x1_SN_LDSB1_CLR1_GSU0_GSUC0_GSUWGMRR0_K1_LBSPPA128_LBSPPB256_MIWT2_4_PLR1_SU32_SUM0_SUS256_SKXCCM8_VWA1_VWB2_WGM1_WGMXCC1_WGMXCCGn1
    SolutionIndex: 55
    SolutionNameMin: Cijk_Alik_Bljk_HHS_BH_UserArgs_MT64x128x64_MI16x16x1_SN_LDSB1_CLR1_GSU0_GSUC0_GSUWGMRR0_K1_LBSPPA128_LBSPPB512_MIWT2_4_PLR1_SU32_SUM0_SUS256_SKXCCM8_VWA1_VWB4_WGM1_WGMXCC1_WGMXCCGn1
    SolutionIndex: 56
    SolutionNameMin: Cijk_Alik_Bljk_HHS_BH_UserArgs_MT64x128x64_MI16x16x1_SN_LDSB1_CLR1_GSU0_GSUC0_GSUWGMRR0_K1_LBSPPA256_LBSPPB512_MIWT2_4_PLR1_SU32_SUM0_SUS256_SKXCCM8_VWA2_VWB4_WGM1_WGMXCC1_WGMXCCGn1
    SolutionIndex: 57
    SolutionNameMin: Cijk_Alik_Bljk_HHS_BH_UserArgs_MT64x128x64_MI16x16x1_SN_LDSB1_CLR1_GSU0_GSUC0_GSUWGMRR0_K1_LBSPPA256_LBSPPB128_MIWT2_4_PLR1_SU32_SUM0_SUS256_SKXCCM8_VWA2_VWB1_WGM8_WGMXCC1_WGMXCCGn1
    SolutionIndex: 58
    SolutionNameMin: Cijk_Alik_Bljk_HHS_BH_UserArgs_MT128x64x64_MI16x16x1_SN_LDSB1_CLR1_GSU0_GSUC0_GSUWGMRR0_K1_LBSPPA256_LBSPPB128_MIWT4_2_PLR1_SU32_SUM0_SUS256_SKXCCM8_VWA2_VWB1_WGM1_WGMXCC1_WGMXCCGn1
    SolutionIndex: 59
    SolutionNameMin: Cijk_Alik_Bljk_HHS_BH_UserArgs_MT128x64x64_MI16x16x1_SN_LDSB1_CLR1_GSU0_GSUC0_GSUWGMRR0_K1_LBSPPA512_LBSPPB128_MIWT4_2_PLR1_SU32_SUM0_SUS256_SKXCCM8_VWA4_VWB1_WGM1_WGMXCC1_WGMXCCGn1
    SolutionIndex: 60
    SolutionNameMin: Cijk_Alik_Bljk_HHS_BH_UserArgs_MT128x64x64_MI16x16x1_SN_LDSB1_CLR1_GSU0_GSUC0_GSUWGMRR0_K1_LBSPPA256_LBSPPB256_MIWT4_2_PLR1_SU32_SUM0_SUS256_SKXCCM8_VWA2_VWB2_WGM1_WGMXCC1_WGMXCCGn1
    SolutionIndex: 61
    SolutionNameMin: Cijk_Alik_Bljk_HHS_BH_UserArgs_MT128x64x64_MI16x16x1_SN_LDSB1_CLR1_GSU0_GSUC0_GSUWGMRR0_K1_LBSPPA512_LBSPPB256_MIWT4_2_PLR1_SU32_SUM0_SUS256_SKXCCM8_VWA4_VWB2_WGM1_WGMXCC1_WGMXCCGn1
    SolutionIndex: 62
    SolutionNameMin: Cijk_Alik_Bljk_HHS_BH_UserArgs_MT128x64x64_MI16x16x1_SN_LDSB1_CLR1_GSU0_GSUC0_GSUWGMRR0_K1_LBSPPA256_LBSPPB256_MIWT4_2_PLR1_SU32_SUM0_SUS256_SKXCCM8_VWA2_VWB2_WGM4_WGMXCC1_WGMXCCGn1
    SolutionIndex: 63
    SolutionNameMin: Cijk_Alik_Bljk_HHS_BH_UserArgs_MT128x64x64_MI16x16x1_SN_LDSB1_CLR1_GSU0_GSUC0_GSUWGMRR0_K1_LBSPPA256_LBSPPB128_MIWT4_2_PLR1_SU32_SUM0_SUS256_SKXCCM8_VWA2_VWB1_WGM8_WGMXCC1_WGMXCCGn1
    SolutionIndex: 64
    SolutionNameMin: Cijk_Alik_Bljk_HHS_BH_UserArgs_MT128x64x64_MI16x16x1_SN_LDSB1_CLR1_GSU0_GSUC0_GSUWGMRR0_K1_LBSPPA512_LBSPPB128_MIWT4_2_PLR1_SU32_SUM0_SUS256_SKXCCM8_VWA4_VWB1_WGM8_WGMXCC1_WGMXCCGn1
    SolutionIndex: 65
    SolutionNameMin: Cijk_Alik_Bljk_HHS_BH_UserArgs_MT128x64x64_MI16x16x1_SN_LDSB1_CLR1_GSU0_GSUC0_GSUWGMRR0_K1_LBSPPA512_LBSPPB256_MIWT4_2_PLR1_SU32_SUM0_SUS256_SKXCCM8_VWA4_VWB2_WGM8_WGMXCC1_WGMXCCGn1
    SolutionIndex: 66
    SolutionNameMin: Cijk_Alik_Bljk_HHS_BH_UserArgs_MT64x64x64_MI16x16x1_SN_LDSB1_CLR1_GSU0_GSUC0_GSUWGMRR0_K1_LBSPPA256_LBSPPB256_MIWT2_2_PLR1_SU32_SUM0_SUS256_SKXCCM8_VWA2_VWB2_WGM1_WGMXCC1_WGMXCCGn1
    SolutionIndex: 67
    SolutionNameMin: Cijk_Alik_Bljk_HHS_BH_UserArgs_MT64x64x64_MI16x16x1_SN_LDSB1_CLR1_GSU0_GSUC0_GSUWGMRR0_K1_LBSPPA128_LBSPPB128_MIWT2_2_PLR1_SU32_SUM0_SUS256_SKXCCM8_VWA1_VWB1_WGM4_WGMXCC1_WGMXCCGn1
    SolutionIndex: 68
    SolutionNameMin: Cijk_Alik_Bljk_HHS_BH_UserArgs_MT64x64x64_MI16x16x1_SN_LDSB1_CLR1_GSU0_GSUC0_GSUWGMRR0_K1_LBSPPA256_LBSPPB128_MIWT2_2_PLR1_SU32_SUM0_SUS256_SKXCCM8_VWA2_VWB1_WGM4_WGMXCC1_WGMXCCGn1
    SolutionIndex: 69
    SolutionNameMin: Cijk_Alik_Bljk_HHS_BH_UserArgs_MT64x64x64_MI16x16x1_SN_LDSB1_CLR1_GSU0_GSUC0_GSUWGMRR0_K1_LBSPPA128_LBSPPB256_MIWT2_2_PLR1_SU32_SUM0_SUS256_SKXCCM8_VWA1_VWB2_WGM4_WGMXCC1_WGMXCCGn1
    SolutionIndex: 70
    SolutionNameMin: Cijk_Alik_Bljk_HHS_BH_UserArgs_MT64x64x64_MI16x16x1_SN_LDSB1_CLR1_GSU0_GSUC0_GSUWGMRR0_K1_LBSPPA256_LBSPPB256_MIWT2_2_PLR1_SU32_SUM0_SUS256_SKXCCM8_VWA2_VWB2_WGM4_WGMXCC1_WGMXCCGn1
    SolutionIndex: 71
    SolutionNameMin: Cijk_Alik_Bljk_HHS_BH_UserArgs_MT32x64x64_MI16x16x1_SN_LDSB0_CLR1_GSU0_GSUC0_GSUWGMRR0_K1_LBSPPA128_LBSPPB256_MIWT1_2_PLR1_SU32_SUM0_SUS256_SKXCCM8_VWA1_VWB2_WGM1_WGMXCC1_WGMXCCGn1
    SolutionIndex: 72
    SolutionNameMin: Cijk_Alik_Bljk_HHS_BH_UserArgs_MT32x64x64_MI16x16x1_SN_LDSB0_CLR1_GSU0_GSUC0_GSUWGMRR0_K1_LBSPPA128_LBSPPB256_MIWT1_2_PLR1_SU32_SUM0_SUS256_SKXCCM8_VWA1_VWB2_WGM4_WGMXCC1_WGMXCCGn1
    SolutionIndex: 73
    SolutionNameMin: Cijk_Alik_Bljk_HHS_BH_UserArgs_MT32x32x64_MI16x16x1_SN_LDSB0_CLR1_GSU0_GSUC0_GSUWGMRR0_K1_LBSPPA128_LBSPPB128_MIWT1_1_PLR1_SU32_SUM0_SUS256_SKXCCM8_VWA1_VWB1_WGM1_WGMXCC1_WGMXCCGn1
    SolutionIndex: 74
    SolutionNameMin: Cijk_Alik_Bljk_HHS_BH_UserArgs_MT32x32x64_MI16x16x1_SN_LDSB0_CLR1_GSU0_GSUC0_GSUWGMRR0_K1_LBSPPA128_LBSPPB128_MIWT1_1_PLR1_SU32_SUM0_SUS256_SKXCCM8_VWA1_VWB1_WGM8_WGMXCC1_WGMXCCGn1
    SolutionIndex: 75
    SolutionNameMin: Cijk_Alik_Bljk_HHS_BH_UserArgs_MT64x64x128_MI16x16x1_SN_LDSB1_CLR1_GSU0_GSUC0_GSUWGMRR0_K1_LBSPPA512_LBSPPB256_MIWT2_2_PLR1_SU32_SUM0_SUS256_SKXCCM8_VWA2_VWB1_WGM1_WGMXCC1_WGMXCCGn1
    SolutionIndex: 76
    SolutionNameMin: Cijk_Alik_Bljk_HHS_BH_UserArgs_MT64x64x128_MI16x16x1_SN_LDSB1_CLR1_GSU0_GSUC0_GSUWGMRR0_K1_LBSPPA512_LBSPPB512_MIWT2_2_PLR1_SU32_SUM0_SUS256_SKXCCM8_VWA2_VWB2_WGM1_WGMXCC1_WGMXCCGn1
    SolutionIndex: 77
    SolutionNameMin: Cijk_Alik_Bljk_HHS_BH_UserArgs_MT64x64x128_MI16x16x1_SN_LDSB1_CLR1_GSU0_GSUC0_GSUWGMRR0_K1_LBSPPA512_LBSPPB256_MIWT2_2_PLR2_SU32_SUM0_SUS256_SKXCCM8_VWA2_VWB1_WGM1_WGMXCC1_WGMXCCGn1
    SolutionIndex: 78
    SolutionNameMin: Cijk_Alik_Bljk_HHS_BH_UserArgs_MT64x64x128_MI16x16x1_SN_LDSB1_CLR1_GSU0_GSUC0_GSUWGMRR0_K1_LBSPPA512_LBSPPB256_MIWT2_2_PLR1_SU32_SUM0_SUS256_SKXCCM8_VWA2_VWB1_WGM4_WGMXCC1_WGMXCCGn1
    SolutionIndex: 79
    SolutionNameMin: Cijk_Alik_Bljk_HHS_BH_UserArgs_MT64x64x128_MI16x16x1_SN_LDSB1_CLR1_GSU0_GSUC0_GSUWGMRR0_K1_LBSPPA256_LBSPPB512_MIWT2_2_PLR1_SU32_SUM0_SUS256_SKXCCM8_VWA1_VWB2_WGM4_WGMXCC1_WGMXCCGn1
    SolutionIndex: 80
    SolutionNameMin: Cijk_Alik_Bljk_HHS_BH_UserArgs_MT64x64x128_MI16x16x1_SN_LDSB1_CLR1_GSU0_GSUC0_GSUWGMRR0_K1_LBSPPA512_LBSPPB512_MIWT2_2_PLR1_SU32_SUM0_SUS256_SKXCCM8_VWA2_VWB2_WGM4_WGMXCC1_WGMXCCGn1
    SolutionIndex: 81
    SolutionNameMin: Cijk_Alik_Bljk_HHS_BH_UserArgs_MT64x64x128_MI16x16x1_SN_LDSB1_CLR1_GSU0_GSUC0_GSUWGMRR0_K1_LBSPPA512_LBSPPB256_MIWT2_2_PLR2_SU32_SUM0_SUS256_SKXCCM8_VWA2_VWB1_WGM4_WGMXCC1_WGMXCCGn1
    SolutionIndex: 82
    SolutionNameMin: Cijk_Alik_Bljk_HHS_BH_UserArgs_MT64x64x128_MI16x16x1_SN_LDSB1_CLR1_GSU0_GSUC0_GSUWGMRR0_K1_LBSPPA512_LBSPPB256_MIWT2_2_PLR1_SU32_SUM0_SUS256_SKXCCM8_VWA2_VWB1_WGM8_WGMXCC1_WGMXCCGn1
    SolutionIndex: 83
    SolutionNameMin: Cijk_Alik_Bljk_HHS_BH_UserArgs_MT64x64x128_MI16x16x1_SN_LDSB1_CLR1_GSU0_GSUC0_GSUWGMRR0_K1_LBSPPA512_LBSPPB512_MIWT2_2_PLR1_SU32_SUM0_SUS256_SKXCCM8_VWA2_VWB2_WGM8_WGMXCC1_WGMXCCGn1
    SolutionIndex: 84
    SolutionNameMin: Cijk_Alik_Bljk_HHS_BH_UserArgs_MT64x64x128_MI16x16x1_SN_LDSB1_CLR1_GSU0_GSUC0_GSUWGMRR0_K1_LBSPPA512_LBSPPB256_MIWT2_2_PLR2_SU32_SUM0_SUS256_SKXCCM8_VWA2_VWB1_WGM8_WGMXCC1_WGMXCCGn1
    SolutionIndex: 85
    SolutionNameMin: Cijk_Alik_Bljk_HHS_BH_UserArgs_MT32x64x128_MI16x16x1_SN_LDSB1_CLR1_GSU0_GSUC0_GSUWGMRR0_K1_LBSPPA256_LBSPPB256_MIWT1_2_PLR1_SU32_SUM0_SUS256_SKXCCM8_VWA1_VWB1_WGM1_WGMXCC1_WGMXCCGn1
    SolutionIndex: 86
    SolutionNameMin: Cijk_Alik_Bljk_HHS_BH_UserArgs_MT32x64x128_MI16x16x1_SN_LDSB1_CLR1_GSU0_GSUC0_GSUWGMRR0_K1_LBSPPA256_LBSPPB512_MIWT1_2_PLR1_SU32_SUM0_SUS256_SKXCCM8_VWA1_VWB2_WGM1_WGMXCC1_WGMXCCGn1
    SolutionIndex: 87
    SolutionNameMin: Cijk_Alik_Bljk_HHS_BH_UserArgs_MT32x64x128_MI16x16x1_SN_LDSB1_CLR1_GSU0_GSUC0_GSUWGMRR0_K1_LBSPPA256_LBSPPB256_MIWT1_2_PLR2_SU32_SUM0_SUS256_SKXCCM8_VWA1_VWB1_WGM1_WGMXCC1_WGMXCCGn1
    SolutionIndex: 88
    SolutionNameMin: Cijk_Alik_Bljk_HHS_BH_UserArgs_MT32x64x128_MI16x16x1_SN_LDSB1_CLR1_GSU0_GSUC0_GSUWGMRR0_K1_LBSPPA256_LBSPPB512_MIWT1_2_PLR2_SU32_SUM0_SUS256_SKXCCM8_VWA1_VWB2_WGM1_WGMXCC1_WGMXCCGn1
    SolutionIndex: 89
    SolutionNameMin: Cijk_Alik_Bljk_HHS_BH_UserArgs_MT32x64x128_MI16x16x1_SN_LDSB1_CLR1_GSU0_GSUC0_GSUWGMRR0_K1_LBSPPA256_LBSPPB512_MIWT1_2_PLR2_SU32_SUM0_SUS256_SKXCCM8_VWA1_VWB2_WGM4_WGMXCC1_WGMXCCGn1
    SolutionIndex: 90
    SolutionNameMin: Cijk_Alik_Bljk_HHS_BH_UserArgs_MT64x32x128_MI16x16x1_SN_LDSB1_CLR1_GSU0_GSUC0_GSUWGMRR0_K1_LBSPPA512_LBSPPB256_MIWT2_1_PLR1_SU32_SUM0_SUS256_SKXCCM8_VWA2_VWB1_WGM1_WGMXCC1_WGMXCCGn1
    SolutionIndex: 91
    SolutionNameMin: Cijk_Alik_Bljk_HHS_BH_UserArgs_MT64x32x128_MI16x16x1_SN_LDSB1_CLR1_GSU0_GSUC0_GSUWGMRR0_K1_LBSPPA512_LBSPPB256_MIWT2_1_PLR2_SU32_SUM0_SUS256_SKXCCM8_VWA2_VWB1_WGM1_WGMXCC1_WGMXCCGn1
    SolutionIndex: 92
    SolutionNameMin: Cijk_Alik_Bljk_HHS_BH_UserArgs_MT64x32x128_MI16x16x1_SN_LDSB1_CLR1_GSU0_GSUC0_GSUWGMRR0_K1_LBSPPA512_LBSPPB256_MIWT2_1_PLR2_SU32_SUM0_SUS256_SKXCCM8_VWA2_VWB1_WGM4_WGMXCC1_WGMXCCGn1
    SolutionIndex: 93
    SolutionNameMin: Cijk_Alik_Bljk_HHS_BH_UserArgs_MT64x32x128_MI16x16x1_SN_LDSB1_CLR1_GSU0_GSUC0_GSUWGMRR0_K1_LBSPPA256_LBSPPB256_MIWT2_1_PLR2_SU32_SUM0_SUS256_SKXCCM8_VWA1_VWB1_WGM8_WGMXCC1_WGMXCCGn1
    SolutionIndex: 94
    SolutionNameMin: Cijk_Alik_Bljk_HHS_BH_UserArgs_MT64x32x128_MI16x16x1_SN_LDSB1_CLR1_GSU0_GSUC0_GSUWGMRR0_K1_LBSPPA512_LBSPPB256_MIWT2_1_PLR2_SU32_SUM0_SUS256_SKXCCM8_VWA2_VWB1_WGM8_WGMXCC1_WGMXCCGn1
    SolutionIndex: 95
    SolutionNameMin: Cijk_Alik_Bljk_HHS_BH_UserArgs_MT32x32x128_MI16x16x1_SN_LDSB1_CLR1_GSU0_GSUC0_GSUWGMRR0_K1_LBSPPA256_LBSPPB256_MIWT1_1_PLR1_SU32_SUM0_SUS256_SKXCCM8_VWA1_VWB1_WGM1_WGMXCC1_WGMXCCGn1
    SolutionIndex: 96
    SolutionNameMin: Cijk_Alik_Bljk_HHS_BH_UserArgs_MT32x32x128_MI16x16x1_SN_LDSB1_CLR1_GSU0_GSUC0_GSUWGMRR0_K1_LBSPPA256_LBSPPB256_MIWT1_1_PLR2_SU32_SUM0_SUS256_SKXCCM8_VWA1_VWB1_WGM1_WGMXCC1_WGMXCCGn1
    SolutionIndex: 97
    SolutionNameMin: Cijk_Alik_Bljk_HHS_BH_UserArgs_MT32x32x128_MI16x16x1_SN_LDSB1_CLR1_GSU0_GSUC0_GSUWGMRR0_K1_LBSPPA256_LBSPPB256_MIWT1_1_PLR1_SU32_SUM0_SUS256_SKXCCM8_VWA1_VWB1_WGM4_WGMXCC1_WGMXCCGn1
    SolutionIndex: 98
    SolutionNameMin: Cijk_Alik_Bljk_HHS_BH_UserArgs_MT32x32x128_MI16x16x1_SN_LDSB1_CLR1_GSU0_GSUC0_GSUWGMRR0_K1_LBSPPA256_LBSPPB256_MIWT1_1_PLR2_SU32_SUM0_SUS256_SKXCCM8_VWA1_VWB1_WGM4_WGMXCC1_WGMXCCGn1
    SolutionIndex: 99
    SolutionNameMin: Cijk_Alik_Bljk_HHS_BH_UserArgs_MT32x32x128_MI16x16x1_SN_LDSB1_CLR1_GSU0_GSUC0_GSUWGMRR0_K1_LBSPPA256_LBSPPB256_MIWT1_1_PLR1_SU32_SUM0_SUS256_SKXCCM8_VWA1_VWB1_WGM8_WGMXCC1_WGMXCCGn1
    SolutionIndex: 100
    SolutionNameMin: Cijk_Alik_Bljk_HHS_BH_UserArgs_MT32x32x128_MI16x16x1_SN_LDSB1_CLR1_GSU0_GSUC0_GSUWGMRR0_K1_LBSPPA256_LBSPPB256_MIWT1_1_PLR2_SU32_SUM0_SUS256_SKXCCM8_VWA1_VWB1_WGM8_WGMXCC1_WGMXCCGn1
    SolutionIndex: 101
    SolutionNameMin: Cijk_Alik_Bljk_HHS_BH_UserArgs_MT32x32x32_MI16x16x1_SN_LDSB0_CLR0_GSU0_GSUC0_GSUWGMRR0_K1_LBSPPA128_LBSPPB128_MIWT1_1_PLR0_SU32_SUM0_SUS256_SKXCCM8_VWA1_VWB1_WGM1_WGMXCC1_WGMXCCGn1
- - - [128, 128, 1, 128, 128, 128, 128, 128]
    - [26, 0.091]
  - - [128, 128, 1, 256, 128, 128, 256, 256]
    - [26, 0.108]
  - - [128, 128, 1, 512, 128, 128, 512, 512]
    - [96, 0.188]
  - - [128, 128, 1, 1024, 128, 128, 1024, 1024]
    - [95, 0.282]
  - - [128, 128, 1, 2048, 128, 128, 2048, 2048]
    - [96, 0.357]
  - - [128, 128, 1, 4096, 128, 128, 4096, 4096]
    - [30, 0.563]
  - - [128, 128, 1, 8192, 128, 128, 8192, 8192]
    - [73, 1.1]
  - - [128, 256, 1, 128, 128, 128, 128, 128]
    - [95, 0.184]
  - - [128, 256, 1, 256, 128, 128, 256, 256]
    - [27, 0.219]
  - - [128, 256, 1, 512, 128, 128, 512, 512]
    - [95, 0.369]
  - - [128, 256, 1, 1024, 128, 128, 1024, 1024]
    - [96, 0.537]
  - - [128, 256, 1, 2048, 128, 128, 2048, 2048]
    - [31, 0.867]
  - - [128, 256, 1, 4096, 128, 128, 4096, 4096]
    - [73, 1.661]
  - - [128, 256, 1, 8192, 128, 128, 8192, 8192]
    - [96, 3.052]
  - - [128, 512, 1, 128, 128, 128, 128, 128]
    - [96, 0.357]
  - - [128, 512, 1, 256, 128, 128, 256, 256]
    - [27, 0.431]
  - - [128, 512, 1, 512, 128, 128, 512, 512]
    - [95, 0.716]
  - - [128, 512, 1, 1024, 128, 128, 1024, 1024]
    - [73, 1.176]
  - - [128, 512, 1, 2048, 128, 128, 2048, 2048]
    - [95, 2.224]
  - - [128, 512, 1, 4096, 128, 128, 4096, 4096]
    - [95, 3.784]
  - - [128, 512, 1, 8192, 128, 128, 8192, 8192]
    - [95, 6.327]
  - - [128, 1024, 1, 128, 128, 128, 128, 128]
    - [27, 0.709]
  - - [128, 1024, 1, 256, 128, 128, 256, 256]
    - [27, 0.816]
  - - [128, 1024, 1, 512, 128, 128, 512, 512]
    - [99, 1.457]
  - - [128, 1024, 1, 1024, 128, 128, 1024, 1024]
    - [95, 2.513]
  - - [128, 1024, 1, 2048, 128, 128, 2048, 2048]
    - [26, 4.385]
  - - [128, 1024, 1, 4096, 128, 128, 4096, 4096]
    - [96, 7.137]
  - - [128, 1024, 1, 8192, 128, 128, 8192, 8192]
    - [96, 8.929]
  - - [128, 2048, 1, 128, 128, 128, 128, 128]
    - [96, 1.366]
  - - [128, 2048, 1, 256, 128, 128, 256, 256]
    - [27, 1.687]
  - - [128, 2048, 1, 512, 128, 128, 512, 512]
    - [96, 2.875]
  - - [128, 2048, 1, 1024, 128, 128, 1024, 1024]
    - [96, 4.687]
  - - [128, 2048, 1, 2048, 128, 128, 2048, 2048]
    - [71, 7.513]
  - - [128, 2048, 1, 4096, 128, 128, 4096, 4096]
    - [88, 10.574]
  - - [128, 2048, 1, 8192, 128, 128, 8192, 8192]
    - [68, 12.702]
  - - [128, 4096, 1, 128, 128, 128, 128, 128]
    - [24, 2.532]
  - - [128, 4096, 1, 256, 128, 128, 256, 256]
    - [22, 3.109]
  - - [128, 4096, 1, 512, 128, 128, 512, 512]
    - [24, 4.965]
  - - [128, 4096, 1, 1024, 128, 128, 1024, 1024]
    - [91, 7.974]
  - - [128, 4096, 1, 2048, 128, 128, 2048, 2048]
    - [85, 11.104]
  - - [128, 4096, 1, 4096, 128, 128, 4096, 4096]
    - [79, 14.122]
  - - [128, 4096, 1, 8192, 128, 128, 8192, 8192]
    - [13, 16.75]
  - - [128, 8192, 1, 128, 128, 128, 128, 128]
    - [15, 4.505]
  - - [128, 8192, 1, 256, 128, 128, 256, 256]
    - [15, 5.359]
  - - [128, 8192, 1, 512, 128, 128, 512, 512]
    - [75, 8.182]
  - - [128, 8192, 1, 1024, 128, 128, 1024, 1024]
    - [75, 12.116]
  - - [128, 8192, 1, 2048, 128, 128, 2048, 2048]
    - [75, 14.77]
  - - [128, 8192, 1, 4096, 128, 128, 4096, 4096]
    - [61, 18.217]
  - - [128, 8192, 1, 8192, 128, 128, 8192, 8192]
    - [3, 22.222]
  - - [256, 128, 1, 128, 256, 256, 128, 128]
    - [95, 0.184]
  - - [256, 128, 1, 256, 256, 256, 256, 256]
    - [27, 0.218]
  - - [256, 128, 1, 512, 256, 256, 512, 512]
    - [95, 0.371]
  - - [256, 128, 1, 1024, 256, 256, 1024, 1024]
    - [95, 0.549]
  - - [256, 128, 1, 2048, 256, 256, 2048, 2048]
    - [30, 0.847]
  - - [256, 128, 1, 4096, 256, 256, 4096, 4096]
    - [73, 1.639]
  - - [256, 128, 1, 8192, 256, 256, 8192, 8192]
    - [95, 3.08]
  - - [256, 256, 1, 128, 256, 256, 128, 128]
    - [29, 0.35]
  - - [256, 256, 1, 256, 256, 256, 256, 256]
    - [27, 0.432]
  - - [256, 256, 1, 512, 256, 256, 512, 512]
    - [95, 0.704]
  - - [256, 256, 1, 1024, 256, 256, 1024, 1024]
    - [95, 1.174]
  - - [256, 256, 1, 2048, 256, 256, 2048, 2048]
    - [27, 2.152]
  - - [256, 256, 1, 4096, 256, 256, 4096, 4096]
    - [73, 3.909]
  - - [256, 256, 1, 8192, 256, 256, 8192, 8192]
    - [98, 6.243]
  - - [256, 512, 1, 128, 256, 256, 128, 128]
    - [91, 0.613]
  - - [256, 512, 1, 256, 256, 256, 256, 256]
    - [26, 0.816]
  - - [256, 512, 1, 512, 256, 256, 512, 512]
    - [95, 1.469]
  - - [256, 512, 1, 1024, 256, 256, 1024, 1024]
    - [14, 2.438]
  - - [256, 512, 1, 2048, 256, 256, 2048, 2048]
    - [27, 4.452]
  - - [256, 512, 1, 4096, 256, 256, 4096, 4096]
    - [96, 7.088]
  - - [256, 512, 1, 8192, 256, 256, 8192, 8192]
    - [98, 8.722]
  - - [256, 1024, 1, 128, 256, 256, 128, 128]
    - [96, 1.372]
  - - [256, 1024, 1, 256, 256, 256, 256, 256]
    - [28, 1.661]
  - - [256, 1024, 1, 512, 256, 256, 512, 512]
    - [95, 2.834]
  - - [256, 1024, 1, 1024, 256, 256, 1024, 1024]
    - [95, 4.689]
  - - [256, 1024, 1, 2048, 256, 256, 2048, 2048]
    - [24, 7.44]
  - - [256, 1024, 1, 4096, 256, 256, 4096, 4096]
    - [88, 10.483]
  - - [256, 1024, 1, 8192, 256, 256, 8192, 8192]
    - [86, 12.46]
  - - [256, 2048, 1, 128, 256, 256, 128, 128]
    - [25, 2.55]
  - - [256, 2048, 1, 256, 256, 256, 256, 256]
    - [90, 3.136]
  - - [256, 2048, 1, 512, 256, 256, 512, 512]
    - [88, 5.062]
  - - [256, 2048, 1, 1024, 256, 256, 1024, 1024]
    - [85, 7.932]
  - - [256, 2048, 1, 2048, 256, 256, 2048, 2048]
    - [87, 11.09]
  - - [256, 2048, 1, 4096, 256, 256, 4096, 4096]
    - [66, 14.257]
  - - [256, 2048, 1, 8192, 256, 256, 8192, 8192]
    - [82, 16.546]
  - - [256, 4096, 1, 128, 256, 256, 128, 128]
    - [19, 4.307]
  - - [256, 4096, 1, 256, 256, 256, 256, 256]
    - [18, 5.33]
  - - [256, 4096, 1, 512, 256, 256, 512, 512]
    - [77, 8.349]
  - - [256, 4096, 1, 1024, 256, 256, 1024, 1024]
    - [77, 12.071]
  - - [256, 4096, 1, 2048, 256, 256, 2048, 2048]
    - [77, 15.855]
  - - [256, 4096, 1, 4096, 256, 256, 4096, 4096]
    - [64, 18.456]
  - - [256, 4096, 1, 8192, 256, 256, 8192, 8192]
    - [41, 21.712]
  - - [256, 8192, 1, 128, 256, 256, 128, 128]
    - [76, 5.521]
  - - [256, 8192, 1, 256, 256, 256, 256, 256]
    - [77, 7.189]
  - - [256, 8192, 1, 512, 256, 256, 512, 512]
    - [53, 11.413]
  - - [256, 8192, 1, 1024, 256, 256, 1024, 1024]
    - [59, 16.014]
  - - [256, 8192, 1, 2048, 256, 256, 2048, 2048]
    - [61, 18.891]
  - - [256, 8192, 1, 4096, 256, 256, 4096, 4096]
    - [48, 23.905]
  - - [256, 8192, 1, 8192, 256, 256, 8192, 8192]
    - [6, 25.665]
  - - [512, 128, 1, 128, 512, 512, 128, 128]
    - [96, 0.351]
  - - [512, 128, 1, 256, 512, 512, 256, 256]
    - [26, 0.433]
  - - [512, 128, 1, 512, 512, 512, 512, 512]
    - [95, 0.697]
  - - [512, 128, 1, 1024, 512, 512, 1024, 1024]
    - [95, 1.168]
  - - [512, 128, 1, 2048, 512, 512, 2048, 2048]
    - [27, 2.163]
  - - [512, 128, 1, 4096, 512, 512, 4096, 4096]
    - [96, 3.744]
  - - [512, 128, 1, 8192, 512, 512, 8192, 8192]
    - [74, 6.248]
  - - [512, 256, 1, 128, 512, 512, 128, 128]
    - [22, 0.66]
  - - [512, 256, 1, 256, 512, 512, 256, 256]
    - [27, 0.788]
  - - [512, 256, 1, 512, 512, 512, 512, 512]
    - [96, 1.508]
  - - [512, 256, 1, 1024, 512, 512, 1024, 1024]
    - [14, 2.524]
  - - [512, 256, 1, 2048, 512, 512, 2048, 2048]
    - [27, 4.43]
  - - [512, 256, 1, 4096, 512, 512, 4096, 4096]
    - [98, 6.787]
  - - [512, 256, 1, 8192, 512, 512, 8192, 8192]
    - [97, 8.604]
  - - [512, 512, 1, 128, 512, 512, 128, 128]
    - [26, 1.379]
  - - [512, 512, 1, 256, 512, 512, 256, 256]
    - [96, 1.644]
  - - [512, 512, 1, 512, 512, 512, 512, 512]
    - [96, 2.857]
  - - [512, 512, 1, 1024, 512, 512, 1024, 1024]
    - [96, 4.674]
  - - [512, 512, 1, 2048, 512, 512, 2048, 2048]
    - [71, 7.275]
  - - [512, 512, 1, 4096, 512, 512, 4096, 4096]
    - [72, 10.419]
  - - [512, 512, 1, 8192, 512, 512, 8192, 8192]
    - [94, 12.339]
  - - [512, 1024, 1, 128, 512, 512, 128, 128]
    - [25, 2.536]
  - - [512, 1024, 1, 256, 512, 512, 256, 256]
    - [25, 3.122]
  - - [512, 1024, 1, 512, 512, 512, 512, 512]
    - [90, 5.029]
  - - [512, 1024, 1, 1024, 512, 512, 1024, 1024]
    - [86, 7.839]
  - - [512, 1024, 1, 2048, 512, 512, 2048, 2048]
    - [91, 10.947]
  - - [512, 1024, 1, 4096, 512, 512, 4096, 4096]
    - [69, 14.083]
  - - [512, 1024, 1, 8192, 512, 512, 8192, 8192]
    - [76, 16.679]
  - - [512, 2048, 1, 128, 512, 512, 128, 128]
    - [15, 4.423]
  - - [512, 2048, 1, 256, 512, 512, 256, 256]
    - [16, 5.413]
  - - [512, 2048, 1, 512, 512, 512, 512, 512]
    - [75, 8.296]
  - - [512, 2048, 1, 1024, 512, 512, 1024, 1024]
    - [75, 12.031]
  - - [512, 2048, 1, 2048, 512, 512, 2048, 2048]
    - [77, 15.74]
  - - [512, 2048, 1, 4096, 512, 512, 4096, 4096]
    - [65, 18.13]
  - - [512, 2048, 1, 8192, 512, 512, 8192, 8192]
    - [39, 21.79]
  - - [512, 4096, 1, 128, 512, 512, 128, 128]
    - [76, 5.51]
  - - [512, 4096, 1, 256, 512, 512, 256, 256]
    - [76, 7.229]
  - - [512, 4096, 1, 512, 512, 512, 512, 512]
    - [58, 11.311]
  - - [512, 4096, 1, 1024, 512, 512, 1024, 1024]
    - [59, 16.099]
  - - [512, 4096, 1, 2048, 512, 512, 2048, 2048]
    - [64, 18.781]
  - - [512, 4096, 1, 4096, 512, 512, 4096, 4096]
    - [48, 23.79]
  - - [512, 4096, 1, 8192, 512, 512, 8192, 8192]
    - [51, 25.936]
  - - [512, 8192, 1, 128, 512, 512, 128, 128]
    - [10, 6.828]
  - - [512, 8192, 1, 256, 512, 512, 256, 256]
    - [61, 9.251]
  - - [512, 8192, 1, 512, 512, 512, 512, 512]
    - [59, 14.761]
  - - [512, 8192, 1, 1024, 512, 512, 1024, 1024]
    - [39, 18.794]
  - - [512, 8192, 1, 2048, 512, 512, 2048, 2048]
    - [48, 23.347]
  - - [512, 8192, 1, 4096, 512, 512, 4096, 4096]
    - [46, 25.893]
  - - [512, 8192, 1, 8192, 512, 512, 8192, 8192]
    - [0, 25.198]
  - - [1024, 128, 1, 128, 1024, 1024, 128, 128]
    - [27, 0.695]
  - - [1024, 128, 1, 256, 1024, 1024, 256, 256]
    - [27, 0.821]
  - - [1024, 128, 1, 512, 1024, 1024, 512, 512]
    - [95, 1.523]
  - - [1024, 128, 1, 1024, 1024, 1024, 1024, 1024]
    - [14, 2.511]
  - - [1024, 128, 1, 2048, 1024, 1024, 2048, 2048]
    - [27, 4.492]
  - - [1024, 128, 1, 4096, 1024, 1024, 4096, 4096]
    - [98, 6.934]
  - - [1024, 128, 1, 8192, 1024, 1024, 8192, 8192]
    - [100, 8.761]
  - - [1024, 256, 1, 128, 1024, 1024, 128, 128]
    - [96, 1.357]
  - - [1024, 256, 1, 256, 1024, 1024, 256, 256]
    - [96, 1.698]
  - - [1024, 256, 1, 512, 1024, 1024, 512, 512]
    - [96, 2.858]
  - - [1024, 256, 1, 1024, 1024, 1024, 1024, 1024]
    - [95, 4.68]
  - - [1024, 256, 1, 2048, 1024, 1024, 2048, 2048]
    - [71, 7.446]
  - - [1024, 256, 1, 4096, 1024, 1024, 4096, 4096]
    - [72, 10.229]
  - - [1024, 256, 1, 8192, 1024, 1024, 8192, 8192]
    - [93, 12.314]
  - - [1024, 512, 1, 128, 1024, 1024, 128, 128]
    - [25, 2.521]
  - - [1024, 512, 1, 256, 1024, 1024, 256, 256]
    - [91, 3.138]
  - - [1024, 512, 1, 512, 1024, 1024, 512, 512]
    - [91, 5.042]
  - - [1024, 512, 1, 1024, 1024, 1024, 1024, 1024]
    - [91, 7.973]
  - - [1024, 512, 1, 2048, 1024, 1024, 2048, 2048]
    - [92, 10.821]
  - - [1024, 512, 1, 4096, 1024, 1024, 4096, 4096]
    - [70, 14.113]
  - - [1024, 512, 1, 8192, 1024, 1024, 8192, 8192]
    - [82, 16.597]
  - - [1024, 1024, 1, 128, 1024, 1024, 128, 128]
    - [15, 4.385]
  - - [1024, 1024, 1, 256, 1024, 1024, 256, 256]
    - [15, 5.373]
  - - [1024, 1024, 1, 512, 1024, 1024, 512, 512]
    - [75, 8.343]
  - - [1024, 1024, 1, 1024, 1024, 1024, 1024, 1024]
    - [75, 12.165]
  - - [1024, 1024, 1, 2048, 1024, 1024, 2048, 2048]
    - [83, 15.504]
  - - [1024, 1024, 1, 4096, 1024, 1024, 4096, 4096]
    - [65, 18.573]
  - - [1024, 1024, 1, 8192, 1024, 1024, 8192, 8192]
    - [45, 21.616]
  - - [1024, 2048, 1, 128, 1024, 1024, 128, 128]
    - [76, 5.524]
  - - [1024, 2048, 1, 256, 1024, 1024, 256, 256]
    - [15, 7.17]
  - - [1024, 2048, 1, 512, 1024, 1024, 512, 512]
    - [60, 11.412]
  - - [1024, 2048, 1, 1024, 1024, 1024, 1024, 1024]
    - [59, 15.662]
  - - [1024, 2048, 1, 2048, 1024, 1024, 2048, 2048]
    - [65, 18.727]
  - - [1024, 2048, 1, 4096, 1024, 1024, 4096, 4096]
    - [36, 23.932]
  - - [1024, 2048, 1, 8192, 1024, 1024, 8192, 8192]
    - [36, 25.971]
  - - [1024, 4096, 1, 128, 1024, 1024, 128, 128]
    - [9, 6.922]
  - - [1024, 4096, 1, 256, 1024, 1024, 256, 256]
    - [61, 9.209]
  - - [1024, 4096, 1, 512, 1024, 1024, 512, 512]
    - [59, 14.745]
  - - [1024, 4096, 1, 1024, 1024, 1024, 1024, 1024]
    - [52, 18.96]
  - - [1024, 4096, 1, 2048, 1024, 1024, 2048, 2048]
    - [52, 23.951]
  - - [1024, 4096, 1, 4096, 1024, 1024, 4096, 4096]
    - [36, 26.893]
  - - [1024, 4096, 1, 8192, 1024, 1024, 8192, 8192]
    - [35, 25.329]
  - - [1024, 8192, 1, 128, 1024, 1024, 128, 128]
    - [3, 8.489]
  - - [1024, 8192, 1, 256, 1024, 1024, 256, 256]
    - [34, 12.846]
  - - [1024, 8192, 1, 512, 1024, 1024, 512, 512]
    - [34, 18.649]
  - - [1024, 8192, 1, 1024, 1024, 1024, 1024, 1024]
    - [34, 23.157]
  - - [1024, 8192, 1, 2048, 1024, 1024, 2048, 2048]
    - [36, 27.152]
  - - [1024, 8192, 1, 4096, 1024, 1024, 4096, 4096]
    - [48, 28.045]
  - - [1024, 8192, 1, 8192, 1024, 1024, 8192, 8192]
    - [37, 28.219]
  - - [2048, 128, 1, 128, 2048, 2048, 128, 128]
    - [26, 1.383]
  - - [2048, 128, 1, 256, 2048, 2048, 256, 256]
    - [95, 1.692]
  - - [2048, 128, 1, 512, 2048, 2048, 512, 512]
    - [96, 2.855]
  - - [2048, 128, 1, 1024, 2048, 2048, 1024, 1024]
    - [95, 4.611]
  - - [2048, 128, 1, 2048, 2048, 2048, 2048, 2048]
    - [71, 7.513]
  - - [2048, 128, 1, 4096, 2048, 2048, 4096, 4096]
    - [89, 10.425]
  - - [2048, 128, 1, 8192, 2048, 2048, 8192, 8192]
    - [67, 11.972]
  - - [2048, 256, 1, 128, 2048, 2048, 128, 128]
    - [24, 2.514]
  - - [2048, 256, 1, 256, 2048, 2048, 256, 256]
    - [25, 3.125]
  - - [2048, 256, 1, 512, 2048, 2048, 512, 512]
    - [21, 4.926]
  - - [2048, 256, 1, 1024, 2048, 2048, 1024, 1024]
    - [86, 7.914]
  - - [2048, 256, 1, 2048, 2048, 2048, 2048, 2048]
    - [92, 10.884]
  - - [2048, 256, 1, 4096, 2048, 2048, 4096, 4096]
    - [79, 14.198]
  - - [2048, 256, 1, 8192, 2048, 2048, 8192, 8192]
    - [54, 16.114]
  - - [2048, 512, 1, 128, 2048, 2048, 128, 128]
    - [17, 4.426]
  - - [2048, 512, 1, 256, 2048, 2048, 256, 256]
    - [15, 5.461]
  - - [2048, 512, 1, 512, 2048, 2048, 512, 512]
    - [75, 8.263]
  - - [2048, 512, 1, 1024, 2048, 2048, 1024, 1024]
    - [81, 11.969]
  - - [2048, 512, 1, 2048, 2048, 2048, 2048, 2048]
    - [83, 15.592]
  - - [2048, 512, 1, 4096, 2048, 2048, 4096, 4096]
    - [64, 18.172]
  - - [2048, 512, 1, 8192, 2048, 2048, 8192, 8192]
    - [41, 21.744]
  - - [2048, 1024, 1, 128, 2048, 2048, 128, 128]
    - [15, 5.59]
  - - [2048, 1024, 1, 256, 2048, 2048, 256, 256]
    - [15, 7.164]
  - - [2048, 1024, 1, 512, 2048, 2048, 512, 512]
    - [62, 11.221]
  - - [2048, 1024, 1, 1024, 2048, 2048, 1024, 1024]
    - [64, 15.464]
  - - [2048, 1024, 1, 2048, 2048, 2048, 2048, 2048]
    - [65, 18.715]
  - - [2048, 1024, 1, 4096, 2048, 2048, 4096, 4096]
    - [51, 23.948]
  - - [2048, 1024, 1, 8192, 2048, 2048, 8192, 8192]
    - [37, 26.041]
  - - [2048, 2048, 1, 128, 2048, 2048, 128, 128]
    - [11, 6.869]
  - - [2048, 2048, 1, 256, 2048, 2048, 256, 256]
    - [9, 9.348]
  - - [2048, 2048, 1, 512, 2048, 2048, 512, 512]
    - [59, 14.893]
  - - [2048, 2048, 1, 1024, 2048, 2048, 1024, 1024]
    - [52, 18.907]
  - - [2048, 2048, 1, 2048, 2048, 2048, 2048, 2048]
    - [39, 23.804]
  - - [2048, 2048, 1, 4096, 2048, 2048, 4096, 4096]
    - [34, 28.718]
  - - [2048, 2048, 1, 8192, 2048, 2048, 8192, 8192]
    - [38, 26.474]
  - - [2048, 4096, 1, 128, 2048, 2048, 128, 128]
    - [9, 8.577]
  - - [2048, 4096, 1, 256, 2048, 2048, 256, 256]
    - [34, 12.988]
  - - [2048, 4096, 1, 512, 2048, 2048, 512, 512]
    - [41, 17.845]
  - - [2048, 4096, 1, 1024, 2048, 2048, 1024, 1024]
    - [41, 22.993]
  - - [2048, 4096, 1, 2048, 2048, 2048, 2048, 2048]
    - [41, 27.395]
  - - [2048, 4096, 1, 4096, 2048, 2048, 4096, 4096]
    - [45, 27.837]
  - - [2048, 4096, 1, 8192, 2048, 2048, 8192, 8192]
    - [32, 28.417]
  - - [2048, 8192, 1, 128, 2048, 2048, 128, 128]
    - [6, 10.171]
  - - [2048, 8192, 1, 256, 2048, 2048, 256, 256]
    - [34, 15.537]
  - - [2048, 8192, 1, 512, 2048, 2048, 512, 512]
    - [43, 20.688]
  - - [2048, 8192, 1, 1024, 2048, 2048, 1024, 1024]
    - [7, 25.886]
  - - [2048, 8192, 1, 2048, 2048, 2048, 2048, 2048]
    - [41, 28.714]
  - - [2048, 8192, 1, 4096, 2048, 2048, 4096, 4096]
    - [3, 31.201]
  - - [2048, 8192, 1, 8192, 2048, 2048, 8192, 8192]
    - [41, 33.675]
  - - [4096, 128, 1, 128, 4096, 4096, 128, 128]
    - [24, 2.552]
  - - [4096, 128, 1, 256, 4096, 4096, 256, 256]
    - [23, 3.115]
  - - [4096, 128, 1, 512, 4096, 4096, 512, 512]
    - [91, 5.05]
  - - [4096, 128, 1, 1024, 4096, 4096, 1024, 1024]
    - [86, 8.006]
  - - [4096, 128, 1, 2048, 4096, 4096, 2048, 2048]
    - [94, 10.98]
  - - [4096, 128, 1, 4096, 4096, 4096, 4096, 4096]
    - [83, 13.539]
  - - [4096, 128, 1, 8192, 4096, 4096, 8192, 8192]
    - [12, 16.118]
  - - [4096, 256, 1, 128, 4096, 4096, 128, 128]
    - [15, 4.422]
  - - [4096, 256, 1, 256, 4096, 4096, 256, 256]
    - [18, 5.407]
  - - [4096, 256, 1, 512, 4096, 4096, 512, 512]
    - [77, 8.339]
  - - [4096, 256, 1, 1024, 4096, 4096, 1024, 1024]
    - [84, 11.939]
  - - [4096, 256, 1, 2048, 4096, 4096, 2048, 2048]
    - [80, 15.653]
  - - [4096, 256, 1, 4096, 4096, 4096, 4096, 4096]
    - [55, 17.524]
  - - [4096, 256, 1, 8192, 4096, 4096, 8192, 8192]
    - [52, 21.584]
  - - [4096, 512, 1, 128, 4096, 4096, 128, 128]
    - [75, 5.564]
  - - [4096, 512, 1, 256, 4096, 4096, 256, 256]
    - [20, 6.962]
  - - [4096, 512, 1, 512, 4096, 4096, 512, 512]
    - [64, 11.334]
  - - [4096, 512, 1, 1024, 4096, 4096, 1024, 1024]
    - [64, 15.675]
  - - [4096, 512, 1, 2048, 4096, 4096, 2048, 2048]
    - [65, 19.075]
  - - [4096, 512, 1, 4096, 4096, 4096, 4096, 4096]
    - [36, 23.248]
  - - [4096, 512, 1, 8192, 4096, 4096, 8192, 8192]
    - [34, 25.824]
  - - [4096, 1024, 1, 128, 4096, 4096, 128, 128]
    - [1, 6.777]
  - - [4096, 1024, 1, 256, 4096, 4096, 256, 256]
    - [61, 9.192]
  - - [4096, 1024, 1, 512, 4096, 4096, 512, 512]
    - [65, 14.205]
  - - [4096, 1024, 1, 1024, 4096, 4096, 1024, 1024]
    - [48, 18.941]
  - - [4096, 1024, 1, 2048, 4096, 4096, 2048, 2048]
    - [51, 23.735]
  - - [4096, 1024, 1, 4096, 4096, 4096, 4096, 4096]
    - [39, 27.516]
  - - [4096, 1024, 1, 8192, 4096, 4096, 8192, 8192]
    - [33, 27.871]
  - - [4096, 2048, 1, 128, 4096, 4096, 128, 128]
    - [1, 8.789]
  - - [4096, 2048, 1, 256, 4096, 4096, 256, 256]
    - [41, 12.835]
  - - [4096, 2048, 1, 512, 4096, 4096, 512, 512]
    - [48, 17.978]
  - - [4096, 2048, 1, 1024, 4096, 4096, 1024, 1024]
    - [43, 23.015]
  - - [4096, 2048, 1, 2048, 4096, 4096, 2048, 2048]
    - [41, 27.34]
  - - [4096, 2048, 1, 4096, 4096, 4096, 4096, 4096]
    - [41, 28.102]
  - - [4096, 2048, 1, 8192, 4096, 4096, 8192, 8192]
    - [4, 28.717]
  - - [4096, 4096, 1, 128, 4096, 4096, 128, 128]
    - [3, 9.93]
  - - [4096, 4096, 1, 256, 4096, 4096, 256, 256]
    - [3, 15.402]
  - - [4096, 4096, 1, 512, 4096, 4096, 512, 512]
    - [41, 20.658]
  - - [4096, 4096, 1, 1024, 4096, 4096, 1024, 1024]
    - [41, 26.208]
  - - [4096, 4096, 1, 2048, 4096, 4096, 2048, 2048]
    - [3, 28.543]
  - - [4096, 4096, 1, 4096, 4096, 4096, 4096, 4096]
    - [50, 31.419]
  - - [4096, 4096, 1, 8192, 4096, 4096, 8192, 8192]
    - [40, 33.937]
  - - [4096, 8192, 1, 128, 4096, 4096, 128, 128]
    - [3, 12.173]
  - - [4096, 8192, 1, 256, 4096, 4096, 256, 256]
    - [39, 17.317]
  - - [4096, 8192, 1, 512, 4096, 4096, 512, 512]
    - [47, 22.896]
  - - [4096, 8192, 1, 1024, 4096, 4096, 1024, 1024]
    - [5, 27.157]
  - - [4096, 8192, 1, 2048, 4096, 4096, 2048, 2048]
    - [5, 29.821]
  - - [4096, 8192, 1, 4096, 4096, 4096, 4096, 4096]
    - [50, 33.422]
  - - [4096, 8192, 1, 8192, 4096, 4096, 8192, 8192]
    - [48, 34.08]
  - - [8192, 128, 1, 128, 8192, 8192, 128, 128]
    - [15, 4.422]
  - - [8192, 128, 1, 256, 8192, 8192, 256, 256]
    - [15, 5.369]
  - - [8192, 128, 1, 512, 8192, 8192, 512, 512]
    - [75, 8.401]
  - - [8192, 128, 1, 1024, 8192, 8192, 1024, 1024]
    - [78, 11.831]
  - - [8192, 128, 1, 2048, 8192, 8192, 2048, 2048]
    - [82, 14.609]
  - - [8192, 128, 1, 4096, 8192, 8192, 4096, 4096]
    - [56, 17.693]
  - - [8192, 128, 1, 8192, 8192, 8192, 8192, 8192]
    - [3, 22.104]
  - - [8192, 256, 1, 128, 8192, 8192, 128, 128]
    - [75, 5.576]
  - - [8192, 256, 1, 256, 8192, 8192, 256, 256]
    - [75, 7.222]
  - - [8192, 256, 1, 512, 8192, 8192, 512, 512]
    - [63, 11.264]
  - - [8192, 256, 1, 1024, 8192, 8192, 1024, 1024]
    - [64, 15.481]
  - - [8192, 256, 1, 2048, 8192, 8192, 2048, 2048]
    - [57, 18.524]
  - - [8192, 256, 1, 4096, 8192, 8192, 4096, 4096]
    - [36, 22.893]
  - - [8192, 256, 1, 8192, 8192, 8192, 8192, 8192]
    - [36, 25.911]
  - - [8192, 512, 1, 128, 8192, 8192, 128, 128]
    - [1, 6.726]
  - - [8192, 512, 1, 256, 8192, 8192, 256, 256]
    - [8, 9.252]
  - - [8192, 512, 1, 512, 8192, 8192, 512, 512]
    - [65, 14.397]
  - - [8192, 512, 1, 1024, 8192, 8192, 1024, 1024]
    - [48, 18.701]
  - - [8192, 512, 1, 2048, 8192, 8192, 2048, 2048]
    - [48, 22.524]
  - - [8192, 512, 1, 4096, 8192, 8192, 4096, 4096]
    - [38, 27.962]
  - - [8192, 512, 1, 8192, 8192, 8192, 8192, 8192]
    - [39, 27.674]
  - - [8192, 1024, 1, 128, 8192, 8192, 128, 128]
    - [3, 8.27]
  - - [8192, 1024, 1, 256, 8192, 8192, 256, 256]
    - [41, 12.691]
  - - [8192, 1024, 1, 512, 8192, 8192, 512, 512]
    - [51, 18.109]
  - - [8192, 1024, 1, 1024, 8192, 8192, 1024, 1024]
    - [48, 22.923]
  - - [8192, 1024, 1, 2048, 8192, 8192, 2048, 2048]
    - [6, 26.893]
  - - [8192, 1024, 1, 4096, 8192, 8192, 4096, 4096]
    - [47, 27.939]
  - - [8192, 1024, 1, 8192, 8192, 8192, 8192, 8192]
    - [5, 29.507]
  - - [8192, 2048, 1, 128, 8192, 8192, 128, 128]
    - [6, 10.037]
  - - [8192, 2048, 1, 256, 8192, 8192, 256, 256]
    - [3, 15.297]
  - - [8192, 2048, 1, 512, 8192, 8192, 512, 512]
    - [48, 20.641]
  - - [8192, 2048, 1, 1024, 8192, 8192, 1024, 1024]
    - [48, 25.579]
  - - [8192, 2048, 1, 2048, 8192, 8192, 2048, 2048]
    - [42, 28.522]
  - - [8192, 2048, 1, 4096, 8192, 8192, 4096, 4096]
    - [49, 31.559]
  - - [8192, 2048, 1, 8192, 8192, 8192, 8192, 8192]
    - [48, 34.131]
  - - [8192, 4096, 1, 128, 8192, 8192, 128, 128]
    - [6, 12.186]
  - - [8192, 4096, 1, 256, 8192, 8192, 256, 256]
    - [41, 17.244]
  - - [8192, 4096, 1, 512, 8192, 8192, 512, 512]
    - [48, 22.639]
  - - [8192, 4096, 1, 1024, 8192, 8192, 1024, 1024]
    - [48, 27.389]
  - - [8192, 4096, 1, 2048, 8192, 8192, 2048, 2048]
    - [50, 29.351]
  - - [8192, 4096, 1, 4096, 8192, 8192, 4096, 4096]
    - [50, 33.594]
  - - [8192, 4096, 1, 8192, 8192, 8192, 8192, 8192]
    - [48, 34.389]
  - - [8192, 8192, 1, 128, 8192, 8192, 128, 128]
    - [3, 11.735]
  - - [8192, 8192, 1, 256, 8192, 8192, 256, 256]
    - [2, 17.729]
  - - [8192, 8192, 1, 512, 8192, 8192, 512, 512]
    - [6, 22.585]
  - - [8192, 8192, 1, 1024, 8192, 8192, 1024, 1024]
    - [3, 28.581]
  - - [8192, 8192, 1, 2048, 8192, 8192, 2048, 2048]
    - [44, 30.591]
  - - [8192, 8192, 1, 4096, 8192, 8192, 4096, 4096]
    - [51, 34.077]
  - - [8192, 8192, 1, 8192, 8192, 8192, 8192, 8192]
    - [48, 35.565]
  - - [1, 1, 1, 32, 1, 1, 32, 32]
    - [101, 0.0]
- null
- null
- DeviceEfficiency
- GridBased
