library/src/amd_detail/rocblaslt/src/Tensile/Logic/streamk/gfx942/aquavanjaram942_Cijk_Alik_Bljk_BBS_BH_UserArgs.yaml
- {MinimumRequiredVersion: 4.33.0}
- aquavanjaram942
- gfx942
- [Device 0049, Device 0050]
    SolutionIndex: 0
    SolutionNameMin: Cijk_Alik_Bljk_BBS_BH_UserArgs_MT256x64x64_MI16x16x1_SN_LDSB1_CLR1_GSU0_GSUC0_GSUWGMRR0_K1_LBSPPA1024_LBSPPB256_MIWT8_2_PLR2_SU32_SUM0_SUS256_VWA8_VWB2_WGM8_WGMXCC8_WGMXCCG304
    SolutionIndex: 1
    SolutionNameMin: Cijk_Alik_Bljk_BBS_BH_UserArgs_MT128x128x64_MI16x16x1_SN_LDSB1_CLR1_GSU0_GSUC0_GSUWGMRR0_K1_LBSPPA128_LBSPPB128_MIWT4_4_PLR1_SU32_SUM0_SUS256_VWA1_VWB1_WGM1_WGMXCC8_WGMXCCG304
    SolutionIndex: 2
    SolutionNameMin: Cijk_Alik_Bljk_BBS_BH_UserArgs_MT128x128x64_MI16x16x1_SN_LDSB1_CLR1_GSU0_GSUC0_GSUWGMRR0_K1_LBSPPA256_LBSPPB128_MIWT4_4_PLR1_SU32_SUM0_SUS256_VWA2_VWB1_WGM1_WGMXCC8_WGMXCCG304
    SolutionIndex: 3
    SolutionNameMin: Cijk_Alik_Bljk_BBS_BH_UserArgs_MT128x128x64_MI16x16x1_SN_LDSB1_CLR1_GSU0_GSUC0_GSUWGMRR0_K1_LBSPPA512_LBSPPB128_MIWT4_4_PLR1_SU32_SUM0_SUS256_VWA4_VWB1_WGM1_WGMXCC8_WGMXCCG304
    SolutionIndex: 4
    SolutionNameMin: Cijk_Alik_Bljk_BBS_BH_UserArgs_MT128x128x64_MI16x16x1_SN_LDSB1_CLR1_GSU0_GSUC0_GSUWGMRR0_K1_LBSPPA128_LBSPPB256_MIWT4_4_PLR1_SU32_SUM0_SUS256_VWA1_VWB2_WGM1_WGMXCC8_WGMXCCG304
    SolutionIndex: 5
    SolutionNameMin: Cijk_Alik_Bljk_BBS_BH_UserArgs_MT128x128x64_MI16x16x1_SN_LDSB1_CLR1_GSU0_GSUC0_GSUWGMRR0_K1_LBSPPA256_LBSPPB256_MIWT4_4_PLR1_SU32_SUM0_SUS256_VWA2_VWB2_WGM1_WGMXCC8_WGMXCCG304
    SolutionIndex: 6
    SolutionNameMin: Cijk_Alik_Bljk_BBS_BH_UserArgs_MT128x128x64_MI16x16x1_SN_LDSB1_CLR1_GSU0_GSUC0_GSUWGMRR0_K1_LBSPPA512_LBSPPB256_MIWT4_4_PLR1_SU32_SUM0_SUS256_VWA4_VWB2_WGM1_WGMXCC8_WGMXCCG304
    SolutionIndex: 7
    SolutionNameMin: Cijk_Alik_Bljk_BBS_BH_UserArgs_MT128x128x64_MI16x16x1_SN_LDSB1_CLR1_GSU0_GSUC0_GSUWGMRR0_K1_LBSPPA256_LBSPPB512_MIWT4_4_PLR1_SU32_SUM0_SUS256_VWA2_VWB4_WGM1_WGMXCC8_WGMXCCG304
    SolutionIndex: 8
    SolutionNameMin: Cijk_Alik_Bljk_BBS_BH_UserArgs_MT128x128x64_MI16x16x1_SN_LDSB1_CLR1_GSU0_GSUC0_GSUWGMRR0_K1_LBSPPA512_LBSPPB512_MIWT4_4_PLR1_SU32_SUM0_SUS256_VWA4_VWB4_WGM1_WGMXCC8_WGMXCCG304
    SolutionIndex: 9
    SolutionNameMin: Cijk_Alik_Bljk_BBS_BH_UserArgs_MT128x128x64_MI16x16x1_SN_LDSB1_CLR1_GSU0_GSUC0_GSUWGMRR0_K1_LBSPPA512_LBSPPB256_MIWT4_4_PLR2_SU32_SUM0_SUS256_VWA4_VWB2_WGM1_WGMXCC8_WGMXCCG304
    SolutionIndex: 10
    SolutionNameMin: Cijk_Alik_Bljk_BBS_BH_UserArgs_MT128x128x64_MI16x16x1_SN_LDSB1_CLR1_GSU0_GSUC0_GSUWGMRR0_K1_LBSPPA256_LBSPPB128_MIWT4_4_PLR1_SU32_SUM0_SUS256_VWA2_VWB1_WGM4_WGMXCC8_WGMXCCG304
    SolutionIndex: 11
    SolutionNameMin: Cijk_Alik_Bljk_BBS_BH_UserArgs_MT128x128x64_MI16x16x1_SN_LDSB1_CLR1_GSU0_GSUC0_GSUWGMRR0_K1_LBSPPA512_LBSPPB128_MIWT4_4_PLR1_SU32_SUM0_SUS256_VWA4_VWB1_WGM4_WGMXCC8_WGMXCCG304
    SolutionIndex: 12
    SolutionNameMin: Cijk_Alik_Bljk_BBS_BH_UserArgs_MT128x128x64_MI16x16x1_SN_LDSB1_CLR1_GSU0_GSUC0_GSUWGMRR0_K1_LBSPPA512_LBSPPB256_MIWT4_4_PLR1_SU32_SUM0_SUS256_VWA4_VWB2_WGM4_WGMXCC8_WGMXCCG304
    SolutionIndex: 13
    SolutionNameMin: Cijk_Alik_Bljk_BBS_BH_UserArgs_MT128x128x64_MI16x16x1_SN_LDSB1_CLR1_GSU0_GSUC0_GSUWGMRR0_K1_LBSPPA512_LBSPPB512_MIWT4_4_PLR1_SU32_SUM0_SUS256_VWA4_VWB4_WGM4_WGMXCC8_WGMXCCG304
    SolutionIndex: 14
    SolutionNameMin: Cijk_Alik_Bljk_BBS_BH_UserArgs_MT128x128x64_MI16x16x1_SN_LDSB1_CLR1_GSU0_GSUC0_GSUWGMRR0_K1_LBSPPA256_LBSPPB256_MIWT4_4_PLR2_SU32_SUM0_SUS256_VWA2_VWB2_WGM4_WGMXCC8_WGMXCCG304
    SolutionIndex: 15
    SolutionNameMin: Cijk_Alik_Bljk_BBS_BH_UserArgs_MT128x128x64_MI16x16x1_SN_LDSB1_CLR1_GSU0_GSUC0_GSUWGMRR0_K1_LBSPPA128_LBSPPB128_MIWT4_4_PLR1_SU32_SUM0_SUS256_VWA1_VWB1_WGM8_WGMXCC8_WGMXCCG304
    SolutionIndex: 16
    SolutionNameMin: Cijk_Alik_Bljk_BBS_BH_UserArgs_MT128x128x64_MI16x16x1_SN_LDSB1_CLR1_GSU0_GSUC0_GSUWGMRR0_K1_LBSPPA256_LBSPPB128_MIWT4_4_PLR1_SU32_SUM0_SUS256_VWA2_VWB1_WGM8_WGMXCC8_WGMXCCG304
    SolutionIndex: 17
    SolutionNameMin: Cijk_Alik_Bljk_BBS_BH_UserArgs_MT128x128x64_MI16x16x1_SN_LDSB1_CLR1_GSU0_GSUC0_GSUWGMRR0_K1_LBSPPA512_LBSPPB128_MIWT4_4_PLR1_SU32_SUM0_SUS256_VWA4_VWB1_WGM8_WGMXCC8_WGMXCCG304
    SolutionIndex: 18
    SolutionNameMin: Cijk_Alik_Bljk_BBS_BH_UserArgs_MT128x128x64_MI16x16x1_SN_LDSB1_CLR1_GSU0_GSUC0_GSUWGMRR0_K1_LBSPPA256_LBSPPB256_MIWT4_4_PLR1_SU32_SUM0_SUS256_VWA2_VWB2_WGM8_WGMXCC8_WGMXCCG304
    SolutionIndex: 19
    SolutionNameMin: Cijk_Alik_Bljk_BBS_BH_UserArgs_MT128x128x64_MI16x16x1_SN_LDSB1_CLR1_GSU0_GSUC0_GSUWGMRR0_K1_LBSPPA512_LBSPPB256_MIWT4_4_PLR1_SU32_SUM0_SUS256_VWA4_VWB2_WGM8_WGMXCC8_WGMXCCG304
    SolutionIndex: 20
    SolutionNameMin: Cijk_Alik_Bljk_BBS_BH_UserArgs_MT128x128x64_MI16x16x1_SN_LDSB1_CLR1_GSU0_GSUC0_GSUWGMRR0_K1_LBSPPA256_LBSPPB512_MIWT4_4_PLR1_SU32_SUM0_SUS256_VWA2_VWB4_WGM8_WGMXCC8_WGMXCCG304
    SolutionIndex: 21
    SolutionNameMin: Cijk_Alik_Bljk_BBS_BH_UserArgs_MT128x128x64_MI16x16x1_SN_LDSB1_CLR1_GSU0_GSUC0_GSUWGMRR0_K1_LBSPPA512_LBSPPB512_MIWT4_4_PLR1_SU32_SUM0_SUS256_VWA4_VWB4_WGM8_WGMXCC8_WGMXCCG304
    SolutionIndex: 22
    SolutionNameMin: Cijk_Alik_Bljk_BBS_BH_UserArgs_MT64x128x64_MI16x16x1_SN_LDSB1_CLR1_GSU0_GSUC0_GSUWGMRR0_K1_LBSPPA256_LBSPPB128_MIWT2_4_PLR1_SU32_SUM0_SUS256_VWA2_VWB1_WGM1_WGMXCC8_WGMXCCG304
    SolutionIndex: 23
    SolutionNameMin: Cijk_Alik_Bljk_BBS_BH_UserArgs_MT64x128x64_MI16x16x1_SN_LDSB1_CLR1_GSU0_GSUC0_GSUWGMRR0_K1_LBSPPA128_LBSPPB256_MIWT2_4_PLR1_SU32_SUM0_SUS256_VWA1_VWB2_WGM1_WGMXCC8_WGMXCCG304
    SolutionIndex: 24
    SolutionNameMin: Cijk_Alik_Bljk_BBS_BH_UserArgs_MT64x128x64_MI16x16x1_SN_LDSB1_CLR1_GSU0_GSUC0_GSUWGMRR0_K1_LBSPPA256_LBSPPB256_MIWT2_4_PLR1_SU32_SUM0_SUS256_VWA2_VWB2_WGM1_WGMXCC8_WGMXCCG304
    SolutionIndex: 25
    SolutionNameMin: Cijk_Alik_Bljk_BBS_BH_UserArgs_MT64x128x64_MI16x16x1_SN_LDSB1_CLR1_GSU0_GSUC0_GSUWGMRR0_K1_LBSPPA256_LBSPPB128_MIWT2_4_PLR1_SU32_SUM0_SUS256_VWA2_VWB1_WGM4_WGMXCC8_WGMXCCG304
    SolutionIndex: 26
    SolutionNameMin: Cijk_Alik_Bljk_BBS_BH_UserArgs_MT128x64x64_MI16x16x1_SN_LDSB1_CLR1_GSU0_GSUC0_GSUWGMRR0_K1_LBSPPA256_LBSPPB128_MIWT4_2_PLR1_SU32_SUM0_SUS256_VWA2_VWB1_WGM1_WGMXCC8_WGMXCCG304
    SolutionIndex: 27
    SolutionNameMin: Cijk_Alik_Bljk_BBS_BH_UserArgs_MT128x64x64_MI16x16x1_SN_LDSB1_CLR1_GSU0_GSUC0_GSUWGMRR0_K1_LBSPPA512_LBSPPB128_MIWT4_2_PLR1_SU32_SUM0_SUS256_VWA4_VWB1_WGM1_WGMXCC8_WGMXCCG304
    SolutionIndex: 28
    SolutionNameMin: Cijk_Alik_Bljk_BBS_BH_UserArgs_MT128x64x64_MI16x16x1_SN_LDSB1_CLR1_GSU0_GSUC0_GSUWGMRR0_K1_LBSPPA512_LBSPPB128_MIWT4_2_PLR2_SU32_SUM0_SUS256_VWA4_VWB1_WGM1_WGMXCC8_WGMXCCG304
    SolutionIndex: 29
    SolutionNameMin: Cijk_Alik_Bljk_BBS_BH_UserArgs_MT128x64x64_MI16x16x1_SN_LDSB1_CLR1_GSU0_GSUC0_GSUWGMRR0_K1_LBSPPA256_LBSPPB128_MIWT4_2_PLR1_SU32_SUM0_SUS256_VWA2_VWB1_WGM4_WGMXCC8_WGMXCCG304
    SolutionIndex: 30
    SolutionNameMin: Cijk_Alik_Bljk_BBS_BH_UserArgs_MT128x64x64_MI16x16x1_SN_LDSB1_CLR1_GSU0_GSUC0_GSUWGMRR0_K1_LBSPPA512_LBSPPB128_MIWT4_2_PLR1_SU32_SUM0_SUS256_VWA4_VWB1_WGM4_WGMXCC8_WGMXCCG304
    SolutionIndex: 31
    SolutionNameMin: Cijk_Alik_Bljk_BBS_BH_UserArgs_MT128x64x64_MI16x16x1_SN_LDSB1_CLR1_GSU0_GSUC0_GSUWGMRR0_K1_LBSPPA256_LBSPPB128_MIWT4_2_PLR1_SU32_SUM0_SUS256_VWA2_VWB1_WGM8_WGMXCC8_WGMXCCG304
    SolutionIndex: 32
    SolutionNameMin: Cijk_Alik_Bljk_BBS_BH_UserArgs_MT128x64x64_MI16x16x1_SN_LDSB1_CLR1_GSU0_GSUC0_GSUWGMRR0_K1_LBSPPA512_LBSPPB128_MIWT4_2_PLR1_SU32_SUM0_SUS256_VWA4_VWB1_WGM8_WGMXCC8_WGMXCCG304
    SolutionIndex: 33
    SolutionNameMin: Cijk_Alik_Bljk_BBS_BH_UserArgs_MT128x64x64_MI16x16x1_SN_LDSB1_CLR1_GSU0_GSUC0_GSUWGMRR0_K1_LBSPPA512_LBSPPB256_MIWT4_2_PLR1_SU32_SUM0_SUS256_VWA4_VWB2_WGM8_WGMXCC8_WGMXCCG304
    SolutionIndex: 34
    SolutionNameMin: Cijk_Alik_Bljk_BBS_BH_UserArgs_MT128x32x64_MI16x16x1_SN_LDSB1_CLR1_GSU0_GSUC0_GSUWGMRR0_K1_LBSPPA512_LBSPPB128_MIWT4_1_PLR1_SU32_SUM0_SUS256_VWA4_VWB1_WGM1_WGMXCC8_WGMXCCG304
    SolutionIndex: 35
    SolutionNameMin: Cijk_Alik_Bljk_BBS_BH_UserArgs_MT64x64x64_MI16x16x1_SN_LDSB1_CLR1_GSU0_GSUC0_GSUWGMRR0_K1_LBSPPA256_LBSPPB128_MIWT2_2_PLR1_SU32_SUM0_SUS256_VWA2_VWB1_WGM1_WGMXCC8_WGMXCCG304
    SolutionIndex: 36
    SolutionNameMin: Cijk_Alik_Bljk_BBS_BH_UserArgs_MT64x64x64_MI16x16x1_SN_LDSB1_CLR1_GSU0_GSUC0_GSUWGMRR0_K1_LBSPPA256_LBSPPB256_MIWT2_2_PLR1_SU32_SUM0_SUS256_VWA2_VWB2_WGM1_WGMXCC8_WGMXCCG304
    SolutionIndex: 37
    SolutionNameMin: Cijk_Alik_Bljk_BBS_BH_UserArgs_MT64x64x64_MI16x16x1_SN_LDSB1_CLR1_GSU0_GSUC0_GSUWGMRR0_K1_LBSPPA256_LBSPPB256_MIWT2_2_PLR1_SU32_SUM0_SUS256_VWA2_VWB2_WGM4_WGMXCC8_WGMXCCG304
    SolutionIndex: 38
    SolutionNameMin: Cijk_Alik_Bljk_BBS_BH_UserArgs_MT32x64x64_MI16x16x1_SN_LDSB0_CLR1_GSU0_GSUC0_GSUWGMRR0_K1_LBSPPA128_LBSPPB128_MIWT1_2_PLR1_SU32_SUM0_SUS256_VWA1_VWB1_WGM1_WGMXCC8_WGMXCCG304
    SolutionIndex: 39
    SolutionNameMin: Cijk_Alik_Bljk_BBS_BH_UserArgs_MT32x64x64_MI16x16x1_SN_LDSB0_CLR1_GSU0_GSUC0_GSUWGMRR0_K1_LBSPPA128_LBSPPB256_MIWT1_2_PLR1_SU32_SUM0_SUS256_VWA1_VWB2_WGM1_WGMXCC8_WGMXCCG304
    SolutionIndex: 40
    SolutionNameMin: Cijk_Alik_Bljk_BBS_BH_UserArgs_MT32x64x64_MI16x16x1_SN_LDSB0_CLR1_GSU0_GSUC0_GSUWGMRR0_K1_LBSPPA128_LBSPPB256_MIWT1_2_PLR1_SU32_SUM0_SUS256_VWA1_VWB2_WGM8_WGMXCC8_WGMXCCG304
    SolutionIndex: 41
    SolutionNameMin: Cijk_Alik_Bljk_BBS_BH_UserArgs_MT64x32x64_MI16x16x1_SN_LDSB0_CLR1_GSU0_GSUC0_GSUWGMRR0_K1_LBSPPA128_LBSPPB128_MIWT2_1_PLR1_SU32_SUM0_SUS256_VWA1_VWB1_WGM1_WGMXCC8_WGMXCCG304
    SolutionIndex: 42
    SolutionNameMin: Cijk_Alik_Bljk_BBS_BH_UserArgs_MT64x32x64_MI16x16x1_SN_LDSB0_CLR1_GSU0_GSUC0_GSUWGMRR0_K1_LBSPPA256_LBSPPB128_MIWT2_1_PLR1_SU32_SUM0_SUS256_VWA2_VWB1_WGM1_WGMXCC8_WGMXCCG304
    SolutionIndex: 43
    SolutionNameMin: Cijk_Alik_Bljk_BBS_BH_UserArgs_MT64x32x64_MI16x16x1_SN_LDSB0_CLR1_GSU0_GSUC0_GSUWGMRR0_K1_LBSPPA256_LBSPPB128_MIWT2_1_PLR1_SU32_SUM0_SUS256_VWA2_VWB1_WGM4_WGMXCC8_WGMXCCG304
    SolutionIndex: 44
    SolutionNameMin: Cijk_Alik_Bljk_BBS_BH_UserArgs_MT32x32x64_MI16x16x1_SN_LDSB0_CLR1_GSU0_GSUC0_GSUWGMRR0_K1_LBSPPA128_LBSPPB128_MIWT1_1_PLR1_SU32_SUM0_SUS256_VWA1_VWB1_WGM1_WGMXCC8_WGMXCCG304
    SolutionIndex: 45
    SolutionNameMin: Cijk_Alik_Bljk_BBS_BH_UserArgs_MT32x32x64_MI16x16x1_SN_LDSB0_CLR1_GSU0_GSUC0_GSUWGMRR0_K1_LBSPPA128_LBSPPB128_MIWT1_1_PLR2_SU32_SUM0_SUS256_VWA1_VWB1_WGM1_WGMXCC8_WGMXCCG304
    SolutionIndex: 46
    SolutionNameMin: Cijk_Alik_Bljk_BBS_BH_UserArgs_MT32x32x64_MI16x16x1_SN_LDSB0_CLR1_GSU0_GSUC0_GSUWGMRR0_K1_LBSPPA128_LBSPPB128_MIWT1_1_PLR1_SU32_SUM0_SUS256_VWA1_VWB1_WGM4_WGMXCC8_WGMXCCG304
    SolutionIndex: 47
    SolutionNameMin: Cijk_Alik_Bljk_BBS_BH_UserArgs_MT32x32x64_MI16x16x1_SN_LDSB0_CLR1_GSU0_GSUC0_GSUWGMRR0_K1_LBSPPA128_LBSPPB128_MIWT1_1_PLR1_SU32_SUM0_SUS256_VWA1_VWB1_WGM8_WGMXCC8_WGMXCCG304
    SolutionIndex: 48
    SolutionNameMin: Cijk_Alik_Bljk_BBS_BH_UserArgs_MT32x32x64_MI16x16x1_SN_LDSB0_CLR1_GSU0_GSUC0_GSUWGMRR0_K1_LBSPPA128_LBSPPB128_MIWT1_1_PLR2_SU32_SUM0_SUS256_VWA1_VWB1_WGM8_WGMXCC8_WGMXCCG304
    SolutionIndex: 49
    SolutionNameMin: Cijk_Alik_Bljk_BBS_BH_UserArgs_MT64x64x128_MI16x16x1_SN_LDSB1_CLR1_GSU0_GSUC0_GSUWGMRR0_K1_LBSPPA512_LBSPPB256_MIWT2_2_PLR1_SU32_SUM0_SUS256_VWA2_VWB1_WGM1_WGMXCC8_WGMXCCG304
    SolutionIndex: 50
    SolutionNameMin: Cijk_Alik_Bljk_BBS_BH_UserArgs_MT64x64x128_MI16x16x1_SN_LDSB1_CLR1_GSU0_GSUC0_GSUWGMRR0_K1_LBSPPA512_LBSPPB512_MIWT2_2_PLR1_SU32_SUM0_SUS256_VWA2_VWB2_WGM1_WGMXCC8_WGMXCCG304
    SolutionIndex: 51
    SolutionNameMin: Cijk_Alik_Bljk_BBS_BH_UserArgs_MT64x64x128_MI16x16x1_SN_LDSB1_CLR1_GSU0_GSUC0_GSUWGMRR0_K1_LBSPPA256_LBSPPB256_MIWT2_2_PLR2_SU32_SUM0_SUS256_VWA1_VWB1_WGM1_WGMXCC8_WGMXCCG304
    SolutionIndex: 52
    SolutionNameMin: Cijk_Alik_Bljk_BBS_BH_UserArgs_MT64x64x128_MI16x16x1_SN_LDSB1_CLR1_GSU0_GSUC0_GSUWGMRR0_K1_LBSPPA512_LBSPPB256_MIWT2_2_PLR2_SU32_SUM0_SUS256_VWA2_VWB1_WGM1_WGMXCC8_WGMXCCG304
    SolutionIndex: 53
    SolutionNameMin: Cijk_Alik_Bljk_BBS_BH_UserArgs_MT64x64x128_MI16x16x1_SN_LDSB1_CLR1_GSU0_GSUC0_GSUWGMRR0_K1_LBSPPA512_LBSPPB512_MIWT2_2_PLR2_SU32_SUM0_SUS256_VWA2_VWB2_WGM1_WGMXCC8_WGMXCCG304
    SolutionIndex: 54
    SolutionNameMin: Cijk_Alik_Bljk_BBS_BH_UserArgs_MT64x64x128_MI16x16x1_SN_LDSB1_CLR1_GSU0_GSUC0_GSUWGMRR0_K1_LBSPPA512_LBSPPB256_MIWT2_2_PLR1_SU32_SUM0_SUS256_VWA2_VWB1_WGM4_WGMXCC8_WGMXCCG304
    SolutionIndex: 55
    SolutionNameMin: Cijk_Alik_Bljk_BBS_BH_UserArgs_MT64x64x128_MI16x16x1_SN_LDSB1_CLR1_GSU0_GSUC0_GSUWGMRR0_K1_LBSPPA256_LBSPPB512_MIWT2_2_PLR1_SU32_SUM0_SUS256_VWA1_VWB2_WGM4_WGMXCC8_WGMXCCG304
    SolutionIndex: 56
    SolutionNameMin: Cijk_Alik_Bljk_BBS_BH_UserArgs_MT64x64x128_MI16x16x1_SN_LDSB1_CLR1_GSU0_GSUC0_GSUWGMRR0_K1_LBSPPA512_LBSPPB512_MIWT2_2_PLR1_SU32_SUM0_SUS256_VWA2_VWB2_WGM4_WGMXCC8_WGMXCCG304
    SolutionIndex: 57
    SolutionNameMin: Cijk_Alik_Bljk_BBS_BH_UserArgs_MT64x64x128_MI16x16x1_SN_LDSB1_CLR1_GSU0_GSUC0_GSUWGMRR0_K1_LBSPPA256_LBSPPB256_MIWT2_2_PLR2_SU32_SUM0_SUS256_VWA1_VWB1_WGM4_WGMXCC8_WGMXCCG304
    SolutionIndex: 58
    SolutionNameMin: Cijk_Alik_Bljk_BBS_BH_UserArgs_MT64x64x128_MI16x16x1_SN_LDSB1_CLR1_GSU0_GSUC0_GSUWGMRR0_K1_LBSPPA512_LBSPPB256_MIWT2_2_PLR2_SU32_SUM0_SUS256_VWA2_VWB1_WGM4_WGMXCC8_WGMXCCG304
    SolutionIndex: 59
    SolutionNameMin: Cijk_Alik_Bljk_BBS_BH_UserArgs_MT64x64x128_MI16x16x1_SN_LDSB1_CLR1_GSU0_GSUC0_GSUWGMRR0_K1_LBSPPA512_LBSPPB512_MIWT2_2_PLR2_SU32_SUM0_SUS256_VWA2_VWB2_WGM4_WGMXCC8_WGMXCCG304
    SolutionIndex: 60
    SolutionNameMin: Cijk_Alik_Bljk_BBS_BH_UserArgs_MT64x64x128_MI16x16x1_SN_LDSB1_CLR1_GSU0_GSUC0_GSUWGMRR0_K1_LBSPPA256_LBSPPB256_MIWT2_2_PLR1_SU32_SUM0_SUS256_VWA1_VWB1_WGM8_WGMXCC8_WGMXCCG304
    SolutionIndex: 61
    SolutionNameMin: Cijk_Alik_Bljk_BBS_BH_UserArgs_MT64x64x128_MI16x16x1_SN_LDSB1_CLR1_GSU0_GSUC0_GSUWGMRR0_K1_LBSPPA512_LBSPPB256_MIWT2_2_PLR1_SU32_SUM0_SUS256_VWA2_VWB1_WGM8_WGMXCC8_WGMXCCG304
    SolutionIndex: 62
    SolutionNameMin: Cijk_Alik_Bljk_BBS_BH_UserArgs_MT64x64x128_MI16x16x1_SN_LDSB1_CLR1_GSU0_GSUC0_GSUWGMRR0_K1_LBSPPA256_LBSPPB512_MIWT2_2_PLR1_SU32_SUM0_SUS256_VWA1_VWB2_WGM8_WGMXCC8_WGMXCCG304
    SolutionIndex: 63
    SolutionNameMin: Cijk_Alik_Bljk_BBS_BH_UserArgs_MT64x64x128_MI16x16x1_SN_LDSB1_CLR1_GSU0_GSUC0_GSUWGMRR0_K1_LBSPPA256_LBSPPB256_MIWT2_2_PLR2_SU32_SUM0_SUS256_VWA1_VWB1_WGM8_WGMXCC8_WGMXCCG304
    SolutionIndex: 64
    SolutionNameMin: Cijk_Alik_Bljk_BBS_BH_UserArgs_MT64x64x128_MI16x16x1_SN_LDSB1_CLR1_GSU0_GSUC0_GSUWGMRR0_K1_LBSPPA512_LBSPPB256_MIWT2_2_PLR2_SU32_SUM0_SUS256_VWA2_VWB1_WGM8_WGMXCC8_WGMXCCG304
    SolutionIndex: 65
    SolutionNameMin: Cijk_Alik_Bljk_BBS_BH_UserArgs_MT64x64x128_MI16x16x1_SN_LDSB1_CLR1_GSU0_GSUC0_GSUWGMRR0_K1_LBSPPA512_LBSPPB512_MIWT2_2_PLR2_SU32_SUM0_SUS256_VWA2_VWB2_WGM8_WGMXCC8_WGMXCCG304
    SolutionIndex: 66
    SolutionNameMin: Cijk_Alik_Bljk_BBS_BH_UserArgs_MT32x64x128_MI16x16x1_SN_LDSB1_CLR1_GSU0_GSUC0_GSUWGMRR0_K1_LBSPPA256_LBSPPB256_MIWT1_2_PLR2_SU32_SUM0_SUS256_VWA1_VWB1_WGM1_WGMXCC8_WGMXCCG304
    SolutionIndex: 67
    SolutionNameMin: Cijk_Alik_Bljk_BBS_BH_UserArgs_MT32x64x128_MI16x16x1_SN_LDSB1_CLR1_GSU0_GSUC0_GSUWGMRR0_K1_LBSPPA256_LBSPPB512_MIWT1_2_PLR2_SU32_SUM0_SUS256_VWA1_VWB2_WGM1_WGMXCC8_WGMXCCG304
    SolutionIndex: 68
    SolutionNameMin: Cijk_Alik_Bljk_BBS_BH_UserArgs_MT32x64x128_MI16x16x1_SN_LDSB1_CLR1_GSU0_GSUC0_GSUWGMRR0_K1_LBSPPA256_LBSPPB256_MIWT1_2_PLR1_SU32_SUM0_SUS256_VWA1_VWB1_WGM4_WGMXCC8_WGMXCCG304
    SolutionIndex: 69
    SolutionNameMin: Cijk_Alik_Bljk_BBS_BH_UserArgs_MT32x64x128_MI16x16x1_SN_LDSB1_CLR1_GSU0_GSUC0_GSUWGMRR0_K1_LBSPPA256_LBSPPB512_MIWT1_2_PLR2_SU32_SUM0_SUS256_VWA1_VWB2_WGM4_WGMXCC8_WGMXCCG304
    SolutionIndex: 70
    SolutionNameMin: Cijk_Alik_Bljk_BBS_BH_UserArgs_MT64x32x128_MI16x16x1_SN_LDSB1_CLR1_GSU0_GSUC0_GSUWGMRR0_K1_LBSPPA256_LBSPPB256_MIWT2_1_PLR2_SU32_SUM0_SUS256_VWA1_VWB1_WGM1_WGMXCC8_WGMXCCG304
    SolutionIndex: 71
    SolutionNameMin: Cijk_Alik_Bljk_BBS_BH_UserArgs_MT64x32x128_MI16x16x1_SN_LDSB1_CLR1_GSU0_GSUC0_GSUWGMRR0_K1_LBSPPA512_LBSPPB256_MIWT2_1_PLR2_SU32_SUM0_SUS256_VWA2_VWB1_WGM1_WGMXCC8_WGMXCCG304
    SolutionIndex: 72
    SolutionNameMin: Cijk_Alik_Bljk_BBS_BH_UserArgs_MT64x32x128_MI16x16x1_SN_LDSB1_CLR1_GSU0_GSUC0_GSUWGMRR0_K1_LBSPPA512_LBSPPB256_MIWT2_1_PLR2_SU32_SUM0_SUS256_VWA2_VWB1_WGM4_WGMXCC8_WGMXCCG304
    SolutionIndex: 73
    SolutionNameMin: Cijk_Alik_Bljk_BBS_BH_UserArgs_MT32x32x128_MI16x16x1_SN_LDSB1_CLR1_GSU0_GSUC0_GSUWGMRR0_K1_LBSPPA256_LBSPPB256_MIWT1_1_PLR1_SU32_SUM0_SUS256_VWA1_VWB1_WGM1_WGMXCC8_WGMXCCG304
    SolutionIndex: 74
    SolutionNameMin: Cijk_Alik_Bljk_BBS_BH_UserArgs_MT32x32x128_MI16x16x1_SN_LDSB1_CLR1_GSU0_GSUC0_GSUWGMRR0_K1_LBSPPA256_LBSPPB256_MIWT1_1_PLR2_SU32_SUM0_SUS256_VWA1_VWB1_WGM1_WGMXCC8_WGMXCCG304
    SolutionIndex: 75
    SolutionNameMin: Cijk_Alik_Bljk_BBS_BH_UserArgs_MT32x32x128_MI16x16x1_SN_LDSB1_CLR1_GSU0_GSUC0_GSUWGMRR0_K1_LBSPPA256_LBSPPB256_MIWT1_1_PLR1_SU32_SUM0_SUS256_VWA1_VWB1_WGM4_WGMXCC8_WGMXCCG304
    SolutionIndex: 76
    SolutionNameMin: Cijk_Alik_Bljk_BBS_BH_UserArgs_MT32x32x128_MI16x16x1_SN_LDSB1_CLR1_GSU0_GSUC0_GSUWGMRR0_K1_LBSPPA256_LBSPPB256_MIWT1_1_PLR2_SU32_SUM0_SUS256_VWA1_VWB1_WGM4_WGMXCC8_WGMXCCG304
    SolutionIndex: 77
    SolutionNameMin: Cijk_Alik_Bljk_BBS_BH_UserArgs_MT32x32x128_MI16x16x1_SN_LDSB1_CLR1_GSU0_GSUC0_GSUWGMRR0_K1_LBSPPA256_LBSPPB256_MIWT1_1_PLR1_SU32_SUM0_SUS256_VWA1_VWB1_WGM8_WGMXCC8_WGMXCCG304
    SolutionIndex: 78
    SolutionNameMin: Cijk_Alik_Bljk_BBS_BH_UserArgs_MT32x32x128_MI16x16x1_SN_LDSB1_CLR1_GSU0_GSUC0_GSUWGMRR0_K1_LBSPPA256_LBSPPB256_MIWT1_1_PLR2_SU32_SUM0_SUS256_VWA1_VWB1_WGM8_WGMXCC8_WGMXCCG304
    SolutionIndex: 79
    SolutionNameMin: Cijk_Alik_Bljk_BBS_BH_UserArgs_MT32x32x32_MI16x16x1_SN_LDSB0_CLR1_GSU0_GSUC0_GSUWGMRR0_K1_LBSPPA128_LBSPPB128_MIWT1_1_PLR1_SU32_SUM0_SUS256_VWA1_VWB1_WGM4_WGMXCC8_WGMXCCG304
- - - [128, 128, 1, 128, 128, 128, 128, 128]
    - [45, 0.088]
  - - [128, 128, 1, 256, 128, 128, 256, 256]
    - [44, 0.166]
  - - [128, 128, 1, 512, 128, 128, 512, 512]
    - [44, 0.292]
  - - [128, 128, 1, 1024, 128, 128, 1024, 1024]
    - [74, 0.461]
  - - [128, 128, 1, 2048, 128, 128, 2048, 2048]
    - [73, 0.652]
  - - [128, 128, 1, 4096, 128, 128, 4096, 4096]
    - [46, 1.111]
  - - [128, 128, 1, 8192, 128, 128, 8192, 8192]
    - [73, 1.848]
  - - [128, 256, 1, 128, 128, 128, 128, 128]
    - [48, 0.172]
  - - [128, 256, 1, 256, 128, 128, 256, 256]
    - [44, 0.342]
  - - [128, 256, 1, 512, 128, 128, 512, 512]
    - [74, 0.576]
  - - [128, 256, 1, 1024, 128, 128, 1024, 1024]
    - [73, 0.931]
  - - [128, 256, 1, 2048, 128, 128, 2048, 2048]
    - [73, 1.29]
  - - [128, 256, 1, 4096, 128, 128, 4096, 4096]
    - [44, 2.302]
  - - [128, 256, 1, 8192, 128, 128, 8192, 8192]
    - [74, 3.69]
  - - [128, 512, 1, 128, 128, 128, 128, 128]
    - [74, 0.312]
  - - [128, 512, 1, 256, 128, 128, 256, 256]
    - [73, 0.652]
  - - [128, 512, 1, 512, 128, 128, 512, 512]
    - [44, 1.165]
  - - [128, 512, 1, 1024, 128, 128, 1024, 1024]
    - [74, 1.834]
  - - [128, 512, 1, 2048, 128, 128, 2048, 2048]
    - [73, 2.599]
  - - [128, 512, 1, 4096, 128, 128, 4096, 4096]
    - [44, 4.426]
  - - [128, 512, 1, 8192, 128, 128, 8192, 8192]
    - [73, 7.074]
  - - [128, 1024, 1, 128, 128, 128, 128, 128]
    - [73, 0.674]
  - - [128, 1024, 1, 256, 128, 128, 256, 256]
    - [45, 1.293]
  - - [128, 1024, 1, 512, 128, 128, 512, 512]
    - [44, 2.291]
  - - [128, 1024, 1, 1024, 128, 128, 1024, 1024]
    - [74, 3.622]
  - - [128, 1024, 1, 2048, 128, 128, 2048, 2048]
    - [44, 4.898]
  - - [128, 1024, 1, 4096, 128, 128, 4096, 4096]
    - [73, 7.602]
  - - [128, 1024, 1, 8192, 128, 128, 8192, 8192]
    - [67, 10.492]
  - - [128, 2048, 1, 128, 128, 128, 128, 128]
    - [44, 1.364]
  - - [128, 2048, 1, 256, 128, 128, 256, 256]
    - [44, 2.58]
  - - [128, 2048, 1, 512, 128, 128, 512, 512]
    - [44, 4.379]
  - - [128, 2048, 1, 1024, 128, 128, 1024, 1024]
    - [74, 7.105]
  - - [128, 2048, 1, 2048, 128, 128, 2048, 2048]
    - [73, 9.939]
  - - [128, 2048, 1, 4096, 128, 128, 4096, 4096]
    - [73, 11.534]
  - - [128, 2048, 1, 8192, 128, 128, 8192, 8192]
    - [51, 14.32]
  - - [128, 4096, 1, 128, 128, 128, 128, 128]
    - [38, 2.538]
  - - [128, 4096, 1, 256, 128, 128, 256, 256]
    - [42, 4.62]
  - - [128, 4096, 1, 512, 128, 128, 512, 512]
    - [38, 7.804]
  - - [128, 4096, 1, 1024, 128, 128, 1024, 1024]
    - [42, 11.219]
  - - [128, 4096, 1, 2048, 128, 128, 2048, 2048]
    - [70, 13.599]
  - - [128, 4096, 1, 4096, 128, 128, 4096, 4096]
    - [53, 15.237]
  - - [128, 4096, 1, 8192, 128, 128, 8192, 8192]
    - [27, 16.907]
  - - [128, 8192, 1, 128, 128, 128, 128, 128]
    - [35, 4.466]
  - - [128, 8192, 1, 256, 128, 128, 256, 256]
    - [35, 7.877]
  - - [128, 8192, 1, 512, 128, 128, 512, 512]
    - [35, 12.096]
  - - [128, 8192, 1, 1024, 128, 128, 1024, 1024]
    - [35, 16.362]
  - - [128, 8192, 1, 2048, 128, 128, 2048, 2048]
    - [49, 17.453]
  - - [128, 8192, 1, 4096, 128, 128, 4096, 4096]
    - [53, 19.161]
  - - [128, 8192, 1, 8192, 128, 128, 8192, 8192]
    - [3, 21.839]
  - - [256, 128, 1, 128, 256, 256, 128, 128]
    - [45, 0.18]
  - - [256, 128, 1, 256, 256, 256, 256, 256]
    - [44, 0.339]
  - - [256, 128, 1, 512, 256, 256, 512, 512]
    - [44, 0.58]
  - - [256, 128, 1, 1024, 256, 256, 1024, 1024]
    - [73, 0.933]
  - - [256, 128, 1, 2048, 256, 256, 2048, 2048]
    - [74, 1.304]
  - - [256, 128, 1, 4096, 256, 256, 4096, 4096]
    - [44, 2.297]
  - - [256, 128, 1, 8192, 256, 256, 8192, 8192]
    - [73, 3.651]
  - - [256, 256, 1, 128, 256, 256, 128, 128]
    - [74, 0.354]
  - - [256, 256, 1, 256, 256, 256, 256, 256]
    - [44, 0.653]
  - - [256, 256, 1, 512, 256, 256, 512, 512]
    - [44, 1.162]
  - - [256, 256, 1, 1024, 256, 256, 1024, 1024]
    - [73, 1.854]
  - - [256, 256, 1, 2048, 256, 256, 2048, 2048]
    - [74, 2.576]
  - - [256, 256, 1, 4096, 256, 256, 4096, 4096]
    - [44, 4.424]
  - - [256, 256, 1, 8192, 256, 256, 8192, 8192]
    - [76, 6.99]
  - - [256, 512, 1, 128, 256, 256, 128, 128]
    - [73, 0.694]
  - - [256, 512, 1, 256, 256, 256, 256, 256]
    - [44, 1.325]
  - - [256, 512, 1, 512, 256, 256, 512, 512]
    - [73, 2.27]
  - - [256, 512, 1, 1024, 256, 256, 1024, 1024]
    - [73, 3.642]
  - - [256, 512, 1, 2048, 256, 256, 2048, 2048]
    - [74, 4.839]
  - - [256, 512, 1, 4096, 256, 256, 4096, 4096]
    - [73, 7.571]
  - - [256, 512, 1, 8192, 256, 256, 8192, 8192]
    - [72, 10.307]
  - - [256, 1024, 1, 128, 256, 256, 128, 128]
    - [44, 1.361]
  - - [256, 1024, 1, 256, 256, 256, 256, 256]
    - [44, 2.567]
  - - [256, 1024, 1, 512, 256, 256, 512, 512]
    - [44, 4.256]
  - - [256, 1024, 1, 1024, 256, 256, 1024, 1024]
    - [73, 7.12]
  - - [256, 1024, 1, 2048, 256, 256, 2048, 2048]
    - [73, 10.014]
  - - [256, 1024, 1, 4096, 256, 256, 4096, 4096]
    - [74, 11.556]
  - - [256, 1024, 1, 8192, 256, 256, 8192, 8192]
    - [55, 14.071]
  - - [256, 2048, 1, 128, 256, 256, 128, 128]
    - [42, 2.538]
  - - [256, 2048, 1, 256, 256, 256, 256, 256]
    - [42, 4.594]
  - - [256, 2048, 1, 512, 256, 256, 512, 512]
    - [38, 7.697]
  - - [256, 2048, 1, 1024, 256, 256, 1024, 1024]
    - [42, 11.2]
  - - [256, 2048, 1, 2048, 256, 256, 2048, 2048]
    - [71, 13.607]
  - - [256, 2048, 1, 4096, 256, 256, 4096, 4096]
    - [50, 15.816]
  - - [256, 2048, 1, 8192, 256, 256, 8192, 8192]
    - [64, 17.027]
  - - [256, 4096, 1, 128, 256, 256, 128, 128]
    - [35, 4.464]
  - - [256, 4096, 1, 256, 256, 256, 256, 256]
    - [35, 7.862]
  - - [256, 4096, 1, 512, 256, 256, 512, 512]
    - [35, 12.152]
  - - [256, 4096, 1, 1024, 256, 256, 1024, 1024]
    - [49, 16.425]
  - - [256, 4096, 1, 2048, 256, 256, 2048, 2048]
    - [49, 19.137]
  - - [256, 4096, 1, 4096, 256, 256, 4096, 4096]
    - [53, 19.792]
  - - [256, 4096, 1, 8192, 256, 256, 8192, 8192]
    - [3, 21.767]
  - - [256, 8192, 1, 128, 256, 256, 128, 128]
    - [26, 7.081]
  - - [256, 8192, 1, 256, 256, 256, 256, 256]
    - [27, 11.9]
  - - [256, 8192, 1, 512, 256, 256, 512, 512]
    - [27, 16.697]
  - - [256, 8192, 1, 1024, 256, 256, 1024, 1024]
    - [26, 21.473]
  - - [256, 8192, 1, 2048, 256, 256, 2048, 2048]
    - [26, 22.313]
  - - [256, 8192, 1, 4096, 256, 256, 4096, 4096]
    - [17, 24.012]
  - - [256, 8192, 1, 8192, 256, 256, 8192, 8192]
    - [15, 25.625]
  - - [512, 128, 1, 128, 512, 512, 128, 128]
    - [45, 0.335]
  - - [512, 128, 1, 256, 512, 512, 256, 256]
    - [73, 0.66]
  - - [512, 128, 1, 512, 512, 512, 512, 512]
    - [73, 1.161]
  - - [512, 128, 1, 1024, 512, 512, 1024, 1024]
    - [73, 1.824]
  - - [512, 128, 1, 2048, 512, 512, 2048, 2048]
    - [74, 2.577]
  - - [512, 128, 1, 4096, 512, 512, 4096, 4096]
    - [44, 4.276]
  - - [512, 128, 1, 8192, 512, 512, 8192, 8192]
    - [78, 6.994]
  - - [512, 256, 1, 128, 512, 512, 128, 128]
    - [44, 0.703]
  - - [512, 256, 1, 256, 512, 512, 256, 256]
    - [76, 1.232]
  - - [512, 256, 1, 512, 512, 512, 512, 512]
    - [73, 2.268]
  - - [512, 256, 1, 1024, 512, 512, 1024, 1024]
    - [74, 3.631]
  - - [512, 256, 1, 2048, 512, 512, 2048, 2048]
    - [73, 4.876]
  - - [512, 256, 1, 4096, 512, 512, 4096, 4096]
    - [77, 7.497]
  - - [512, 256, 1, 8192, 512, 512, 8192, 8192]
    - [72, 10.316]
  - - [512, 512, 1, 128, 512, 512, 128, 128]
    - [44, 1.367]
  - - [512, 512, 1, 256, 512, 512, 256, 256]
    - [74, 2.542]
  - - [512, 512, 1, 512, 512, 512, 512, 512]
    - [44, 4.289]
  - - [512, 512, 1, 1024, 512, 512, 1024, 1024]
    - [75, 6.649]
  - - [512, 512, 1, 2048, 512, 512, 2048, 2048]
    - [78, 9.854]
  - - [512, 512, 1, 4096, 512, 512, 4096, 4096]
    - [78, 11.383]
  - - [512, 512, 1, 8192, 512, 512, 8192, 8192]
    - [57, 14.176]
  - - [512, 1024, 1, 128, 512, 512, 128, 128]
    - [42, 2.54]
  - - [512, 1024, 1, 256, 512, 512, 256, 256]
    - [38, 4.555]
  - - [512, 1024, 1, 512, 512, 512, 512, 512]
    - [39, 7.699]
  - - [512, 1024, 1, 1024, 512, 512, 1024, 1024]
    - [43, 11.157]
  - - [512, 1024, 1, 2048, 512, 512, 2048, 2048]
    - [71, 13.603]
  - - [512, 1024, 1, 4096, 512, 512, 4096, 4096]
    - [59, 15.68]
  - - [512, 1024, 1, 8192, 512, 512, 8192, 8192]
    - [49, 17.165]
  - - [512, 2048, 1, 128, 512, 512, 128, 128]
    - [36, 4.451]
  - - [512, 2048, 1, 256, 512, 512, 256, 256]
    - [36, 7.845]
  - - [512, 2048, 1, 512, 512, 512, 512, 512]
    - [35, 12.216]
  - - [512, 2048, 1, 1024, 512, 512, 1024, 1024]
    - [49, 16.396]
  - - [512, 2048, 1, 2048, 512, 512, 2048, 2048]
    - [52, 19.198]
  - - [512, 2048, 1, 4096, 512, 512, 4096, 4096]
    - [65, 19.763]
  - - [512, 2048, 1, 8192, 512, 512, 8192, 8192]
    - [6, 21.782]
  - - [512, 4096, 1, 128, 512, 512, 128, 128]
    - [27, 6.961]
  - - [512, 4096, 1, 256, 512, 512, 256, 256]
    - [26, 11.857]
  - - [512, 4096, 1, 512, 512, 512, 512, 512]
    - [27, 16.671]
  - - [512, 4096, 1, 1024, 512, 512, 1024, 1024]
    - [26, 21.522]
  - - [512, 4096, 1, 2048, 512, 512, 2048, 2048]
    - [27, 22.905]
  - - [512, 4096, 1, 4096, 512, 512, 4096, 4096]
    - [19, 24.023]
  - - [512, 4096, 1, 8192, 512, 512, 8192, 8192]
    - [8, 26.033]
  - - [512, 8192, 1, 128, 512, 512, 128, 128]
    - [5, 9.924]
  - - [512, 8192, 1, 256, 512, 512, 256, 256]
    - [7, 15.511]
  - - [512, 8192, 1, 512, 512, 512, 512, 512]
    - [2, 22.027]
  - - [512, 8192, 1, 1024, 512, 512, 1024, 1024]
    - [2, 26.219]
  - - [512, 8192, 1, 2048, 512, 512, 2048, 2048]
    - [10, 28.524]
  - - [512, 8192, 1, 4096, 512, 512, 4096, 4096]
    - [20, 27.376]
  - - [512, 8192, 1, 8192, 512, 512, 8192, 8192]
    - [17, 25.934]
  - - [1024, 128, 1, 128, 1024, 1024, 128, 128]
    - [38, 0.628]
  - - [1024, 128, 1, 256, 1024, 1024, 256, 256]
    - [73, 1.264]
  - - [1024, 128, 1, 512, 1024, 1024, 512, 512]
    - [44, 2.253]
  - - [1024, 128, 1, 1024, 1024, 1024, 1024, 1024]
    - [74, 3.451]
  - - [1024, 128, 1, 2048, 1024, 1024, 2048, 2048]
    - [74, 4.673]
  - - [1024, 128, 1, 4096, 1024, 1024, 4096, 4096]
    - [78, 7.245]
  - - [1024, 128, 1, 8192, 1024, 1024, 8192, 8192]
    - [68, 10.271]
  - - [1024, 256, 1, 128, 1024, 1024, 128, 128]
    - [74, 1.33]
  - - [1024, 256, 1, 256, 1024, 1024, 256, 256]
    - [44, 2.524]
  - - [1024, 256, 1, 512, 1024, 1024, 512, 512]
    - [44, 4.185]
  - - [1024, 256, 1, 1024, 1024, 1024, 1024, 1024]
    - [76, 6.933]
  - - [1024, 256, 1, 2048, 1024, 1024, 2048, 2048]
    - [76, 9.767]
  - - [1024, 256, 1, 4096, 1024, 1024, 4096, 4096]
    - [76, 11.457]
  - - [1024, 256, 1, 8192, 1024, 1024, 8192, 8192]
    - [61, 14.175]
  - - [1024, 512, 1, 128, 1024, 1024, 128, 128]
    - [42, 2.521]
  - - [1024, 512, 1, 256, 1024, 1024, 256, 256]
    - [42, 4.65]
  - - [1024, 512, 1, 512, 1024, 1024, 512, 512]
    - [42, 7.522]
  - - [1024, 512, 1, 1024, 1024, 1024, 1024, 1024]
    - [66, 11.253]
  - - [1024, 512, 1, 2048, 1024, 1024, 2048, 2048]
    - [72, 13.496]
  - - [1024, 512, 1, 4096, 1024, 1024, 4096, 4096]
    - [56, 15.693]
  - - [1024, 512, 1, 8192, 1024, 1024, 8192, 8192]
    - [60, 16.912]
  - - [1024, 1024, 1, 128, 1024, 1024, 128, 128]
    - [36, 4.443]
  - - [1024, 1024, 1, 256, 1024, 1024, 256, 256]
    - [36, 7.862]
  - - [1024, 1024, 1, 512, 1024, 1024, 512, 512]
    - [35, 12.193]
  - - [1024, 1024, 1, 1024, 1024, 1024, 1024, 1024]
    - [35, 16.297]
  - - [1024, 1024, 1, 2048, 1024, 1024, 2048, 2048]
    - [54, 18.928]
  - - [1024, 1024, 1, 4096, 1024, 1024, 4096, 4096]
    - [56, 19.815]
  - - [1024, 1024, 1, 8192, 1024, 1024, 8192, 8192]
    - [11, 21.812]
  - - [1024, 2048, 1, 128, 1024, 1024, 128, 128]
    - [27, 7.057]
  - - [1024, 2048, 1, 256, 1024, 1024, 256, 256]
    - [27, 11.926]
  - - [1024, 2048, 1, 512, 1024, 1024, 512, 512]
    - [27, 16.643]
  - - [1024, 2048, 1, 1024, 1024, 1024, 1024, 1024]
    - [26, 21.435]
  - - [1024, 2048, 1, 2048, 1024, 1024, 2048, 2048]
    - [31, 22.992]
  - - [1024, 2048, 1, 4096, 1024, 1024, 4096, 4096]
    - [21, 24.003]
  - - [1024, 2048, 1, 8192, 1024, 1024, 8192, 8192]
    - [3, 26.251]
  - - [1024, 4096, 1, 128, 1024, 1024, 128, 128]
    - [5, 9.808]
  - - [1024, 4096, 1, 256, 1024, 1024, 256, 256]
    - [5, 15.498]
  - - [1024, 4096, 1, 512, 1024, 1024, 512, 512]
    - [3, 22.04]
  - - [1024, 4096, 1, 1024, 1024, 1024, 1024, 1024]
    - [3, 26.218]
  - - [1024, 4096, 1, 2048, 1024, 1024, 2048, 2048]
    - [16, 28.575]
  - - [1024, 4096, 1, 4096, 1024, 1024, 4096, 4096]
    - [4, 27.635]
  - - [1024, 4096, 1, 8192, 1024, 1024, 8192, 8192]
    - [17, 25.263]
  - - [1024, 8192, 1, 128, 1024, 1024, 128, 128]
    - [9, 11.203]
  - - [1024, 8192, 1, 256, 1024, 1024, 256, 256]
    - [27, 12.256]
  - - [1024, 8192, 1, 512, 1024, 1024, 512, 512]
    - [6, 18.071]
  - - [1024, 8192, 1, 1024, 1024, 1024, 1024, 1024]
    - [6, 23.287]
  - - [1024, 8192, 1, 2048, 1024, 1024, 2048, 2048]
    - [7, 26.531]
  - - [1024, 8192, 1, 4096, 1024, 1024, 4096, 4096]
    - [2, 26.894]
  - - [1024, 8192, 1, 8192, 1024, 1024, 8192, 8192]
    - [3, 24.778]
  - - [2048, 128, 1, 128, 2048, 2048, 128, 128]
    - [45, 1.341]
  - - [2048, 128, 1, 256, 2048, 2048, 256, 256]
    - [44, 2.549]
  - - [2048, 128, 1, 512, 2048, 2048, 512, 512]
    - [44, 4.293]
  - - [2048, 128, 1, 1024, 2048, 2048, 1024, 1024]
    - [47, 6.88]
  - - [2048, 128, 1, 2048, 2048, 2048, 2048, 2048]
    - [78, 9.533]
  - - [2048, 128, 1, 4096, 2048, 2048, 4096, 4096]
    - [75, 11.453]
  - - [2048, 128, 1, 8192, 2048, 2048, 8192, 8192]
    - [63, 14.116]
  - - [2048, 256, 1, 128, 2048, 2048, 128, 128]
    - [41, 2.546]
  - - [2048, 256, 1, 256, 2048, 2048, 256, 256]
    - [41, 4.544]
  - - [2048, 256, 1, 512, 2048, 2048, 512, 512]
    - [40, 7.588]
  - - [2048, 256, 1, 1024, 2048, 2048, 1024, 1024]
    - [39, 11.103]
  - - [2048, 256, 1, 2048, 2048, 2048, 2048, 2048]
    - [72, 13.503]
  - - [2048, 256, 1, 4096, 2048, 2048, 4096, 4096]
    - [55, 15.713]
  - - [2048, 256, 1, 8192, 2048, 2048, 8192, 8192]
    - [23, 16.396]
  - - [2048, 512, 1, 128, 2048, 2048, 128, 128]
    - [36, 4.466]
  - - [2048, 512, 1, 256, 2048, 2048, 256, 256]
    - [35, 7.833]
  - - [2048, 512, 1, 512, 2048, 2048, 512, 512]
    - [52, 12.037]
  - - [2048, 512, 1, 1024, 2048, 2048, 1024, 1024]
    - [59, 16.114]
  - - [2048, 512, 1, 2048, 2048, 2048, 2048, 2048]
    - [58, 18.964]
  - - [2048, 512, 1, 4096, 2048, 2048, 4096, 4096]
    - [65, 19.836]
  - - [2048, 512, 1, 8192, 2048, 2048, 8192, 8192]
    - [13, 21.744]
  - - [2048, 1024, 1, 128, 2048, 2048, 128, 128]
    - [27, 7.053]
  - - [2048, 1024, 1, 256, 2048, 2048, 256, 256]
    - [26, 11.905]
  - - [2048, 1024, 1, 512, 2048, 2048, 512, 512]
    - [26, 16.683]
  - - [2048, 1024, 1, 1024, 2048, 2048, 1024, 1024]
    - [30, 21.347]
  - - [2048, 1024, 1, 2048, 2048, 2048, 2048, 2048]
    - [32, 22.909]
  - - [2048, 1024, 1, 4096, 2048, 2048, 4096, 4096]
    - [17, 24.224]
  - - [2048, 1024, 1, 8192, 2048, 2048, 8192, 8192]
    - [2, 26.552]
  - - [2048, 2048, 1, 128, 2048, 2048, 128, 128]
    - [6, 9.881]
  - - [2048, 2048, 1, 256, 2048, 2048, 256, 256]
    - [2, 15.467]
  - - [2048, 2048, 1, 512, 2048, 2048, 512, 512]
    - [11, 21.67]
  - - [2048, 2048, 1, 1024, 2048, 2048, 1024, 1024]
    - [10, 25.799]
  - - [2048, 2048, 1, 2048, 2048, 2048, 2048, 2048]
    - [21, 28.432]
  - - [2048, 2048, 1, 4096, 2048, 2048, 4096, 4096]
    - [3, 30.075]
  - - [2048, 2048, 1, 8192, 2048, 2048, 8192, 8192]
    - [2, 27.76]
  - - [2048, 4096, 1, 128, 2048, 2048, 128, 128]
    - [9, 11.1]
  - - [2048, 4096, 1, 256, 2048, 2048, 256, 256]
    - [27, 12.49]
  - - [2048, 4096, 1, 512, 2048, 2048, 512, 512]
    - [3, 18.009]
  - - [2048, 4096, 1, 1024, 2048, 2048, 1024, 1024]
    - [3, 23.263]
  - - [2048, 4096, 1, 2048, 2048, 2048, 2048, 2048]
    - [6, 28.191]
  - - [2048, 4096, 1, 4096, 2048, 2048, 4096, 4096]
    - [5, 27.954]
  - - [2048, 4096, 1, 8192, 2048, 2048, 8192, 8192]
    - [7, 26.396]
  - - [2048, 8192, 1, 128, 2048, 2048, 128, 128]
    - [3, 9.953]
  - - [2048, 8192, 1, 256, 2048, 2048, 256, 256]
    - [2, 16.081]
  - - [2048, 8192, 1, 512, 2048, 2048, 512, 512]
    - [3, 20.841]
  - - [2048, 8192, 1, 1024, 2048, 2048, 1024, 1024]
    - [16, 25.782]
  - - [2048, 8192, 1, 2048, 2048, 2048, 2048, 2048]
    - [2, 27.824]
  - - [2048, 8192, 1, 4096, 2048, 2048, 4096, 4096]
    - [6, 29.471]
  - - [2048, 8192, 1, 8192, 2048, 2048, 8192, 8192]
    - [2, 30.382]
  - - [4096, 128, 1, 128, 4096, 4096, 128, 128]
    - [38, 2.544]
  - - [4096, 128, 1, 256, 4096, 4096, 256, 256]
    - [42, 4.64]
  - - [4096, 128, 1, 512, 4096, 4096, 512, 512]
    - [39, 7.572]
  - - [4096, 128, 1, 1024, 4096, 4096, 1024, 1024]
    - [39, 11.299]
  - - [4096, 128, 1, 2048, 4096, 4096, 2048, 2048]
    - [69, 13.466]
  - - [4096, 128, 1, 4096, 4096, 4096, 4096, 4096]
    - [62, 14.873]
  - - [4096, 128, 1, 8192, 4096, 4096, 8192, 8192]
    - [22, 16.321]
  - - [4096, 256, 1, 128, 4096, 4096, 128, 128]
    - [34, 4.365]
  - - [4096, 256, 1, 256, 4096, 4096, 256, 256]
    - [35, 7.632]
  - - [4096, 256, 1, 512, 4096, 4096, 512, 512]
    - [35, 12.212]
  - - [4096, 256, 1, 1024, 4096, 4096, 1024, 1024]
    - [61, 16.107]
  - - [4096, 256, 1, 2048, 4096, 4096, 2048, 2048]
    - [61, 19.029]
  - - [4096, 256, 1, 4096, 4096, 4096, 4096, 4096]
    - [59, 19.73]
  - - [4096, 256, 1, 8192, 4096, 4096, 8192, 8192]
    - [11, 21.595]
  - - [4096, 512, 1, 128, 4096, 4096, 128, 128]
    - [24, 7.014]
  - - [4096, 512, 1, 256, 4096, 4096, 256, 256]
    - [27, 11.913]
  - - [4096, 512, 1, 512, 4096, 4096, 512, 512]
    - [22, 16.596]
  - - [4096, 512, 1, 1024, 4096, 4096, 1024, 1024]
    - [29, 21.387]
  - - [4096, 512, 1, 2048, 4096, 4096, 2048, 2048]
    - [32, 22.768]
  - - [4096, 512, 1, 4096, 4096, 4096, 4096, 4096]
    - [8, 23.287]
  - - [4096, 512, 1, 8192, 4096, 4096, 8192, 8192]
    - [3, 26.911]
  - - [4096, 1024, 1, 128, 4096, 4096, 128, 128]
    - [5, 9.908]
  - - [4096, 1024, 1, 256, 4096, 4096, 256, 256]
    - [10, 15.33]
  - - [4096, 1024, 1, 512, 4096, 4096, 512, 512]
    - [10, 21.899]
  - - [4096, 1024, 1, 1024, 4096, 4096, 1024, 1024]
    - [10, 25.719]
  - - [4096, 1024, 1, 2048, 4096, 4096, 2048, 2048]
    - [16, 28.571]
  - - [4096, 1024, 1, 4096, 4096, 4096, 4096, 4096]
    - [3, 28.826]
  - - [4096, 1024, 1, 8192, 4096, 4096, 8192, 8192]
    - [1, 28.996]
  - - [4096, 2048, 1, 128, 4096, 4096, 128, 128]
    - [14, 10.983]
  - - [4096, 2048, 1, 256, 4096, 4096, 256, 256]
    - [28, 12.408]
  - - [4096, 2048, 1, 512, 4096, 4096, 512, 512]
    - [17, 17.924]
  - - [4096, 2048, 1, 1024, 4096, 4096, 1024, 1024]
    - [3, 23.24]
  - - [4096, 2048, 1, 2048, 4096, 4096, 2048, 2048]
    - [1, 29.322]
  - - [4096, 2048, 1, 4096, 4096, 4096, 4096, 4096]
    - [6, 29.127]
  - - [4096, 2048, 1, 8192, 4096, 4096, 8192, 8192]
    - [8, 29.109]
  - - [4096, 4096, 1, 128, 4096, 4096, 128, 128]
    - [8, 9.982]
  - - [4096, 4096, 1, 256, 4096, 4096, 256, 256]
    - [19, 15.55]
  - - [4096, 4096, 1, 512, 4096, 4096, 512, 512]
    - [19, 20.751]
  - - [4096, 4096, 1, 1024, 4096, 4096, 1024, 1024]
    - [19, 25.852]
  - - [4096, 4096, 1, 2048, 4096, 4096, 2048, 2048]
    - [17, 27.828]
  - - [4096, 4096, 1, 4096, 4096, 4096, 4096, 4096]
    - [4, 30.27]
  - - [4096, 4096, 1, 8192, 4096, 4096, 8192, 8192]
    - [11, 30.691]
  - - [4096, 8192, 1, 128, 4096, 4096, 128, 128]
    - [6, 11.887]
  - - [4096, 8192, 1, 256, 4096, 4096, 256, 256]
    - [2, 16.773]
  - - [4096, 8192, 1, 512, 4096, 4096, 512, 512]
    - [11, 22.526]
  - - [4096, 8192, 1, 1024, 4096, 4096, 1024, 1024]
    - [17, 26.676]
  - - [4096, 8192, 1, 2048, 4096, 4096, 2048, 2048]
    - [12, 29.35]
  - - [4096, 8192, 1, 4096, 4096, 4096, 4096, 4096]
    - [20, 32.451]
  - - [4096, 8192, 1, 8192, 4096, 4096, 8192, 8192]
    - [10, 32.391]
  - - [8192, 128, 1, 128, 8192, 8192, 128, 128]
    - [34, 4.273]
  - - [8192, 128, 1, 256, 8192, 8192, 256, 256]
    - [37, 7.507]
  - - [8192, 128, 1, 512, 8192, 8192, 512, 512]
    - [35, 12.004]
  - - [8192, 128, 1, 1024, 8192, 8192, 1024, 1024]
    - [64, 16.013]
  - - [8192, 128, 1, 2048, 8192, 8192, 2048, 2048]
    - [54, 17.492]
  - - [8192, 128, 1, 4096, 8192, 8192, 4096, 4096]
    - [8, 19.146]
  - - [8192, 128, 1, 8192, 8192, 8192, 8192, 8192]
    - [8, 21.849]
  - - [8192, 256, 1, 128, 8192, 8192, 128, 128]
    - [29, 6.897]
  - - [8192, 256, 1, 256, 8192, 8192, 256, 256]
    - [30, 11.729]
  - - [8192, 256, 1, 512, 8192, 8192, 512, 512]
    - [32, 16.455]
  - - [8192, 256, 1, 1024, 8192, 8192, 1024, 1024]
    - [32, 21.374]
  - - [8192, 256, 1, 2048, 8192, 8192, 2048, 2048]
    - [33, 20.92]
  - - [8192, 256, 1, 4096, 8192, 8192, 4096, 4096]
    - [3, 23.158]
  - - [8192, 256, 1, 8192, 8192, 8192, 8192, 8192]
    - [6, 26.86]
  - - [8192, 512, 1, 128, 8192, 8192, 128, 128]
    - [18, 9.675]
  - - [8192, 512, 1, 256, 8192, 8192, 256, 256]
    - [16, 15.254]
  - - [8192, 512, 1, 512, 8192, 8192, 512, 512]
    - [16, 21.811]
  - - [8192, 512, 1, 1024, 8192, 8192, 1024, 1024]
    - [10, 25.85]
  - - [8192, 512, 1, 2048, 8192, 8192, 2048, 2048]
    - [16, 28.102]
  - - [8192, 512, 1, 4096, 8192, 8192, 4096, 4096]
    - [7, 28.614]
  - - [8192, 512, 1, 8192, 8192, 8192, 8192, 8192]
    - [8, 27.799]
  - - [8192, 1024, 1, 128, 8192, 8192, 128, 128]
    - [0, 10.912]
  - - [8192, 1024, 1, 256, 8192, 8192, 256, 256]
    - [25, 11.731]
  - - [8192, 1024, 1, 512, 8192, 8192, 512, 512]
    - [17, 17.727]
  - - [8192, 1024, 1, 1024, 8192, 8192, 1024, 1024]
    - [19, 23.119]
  - - [8192, 1024, 1, 2048, 8192, 8192, 2048, 2048]
    - [6, 27.264]
  - - [8192, 1024, 1, 4096, 8192, 8192, 4096, 4096]
    - [6, 28.068]
  - - [8192, 1024, 1, 8192, 8192, 8192, 8192, 8192]
    - [2, 29.036]
  - - [8192, 2048, 1, 128, 8192, 8192, 128, 128]
    - [21, 9.624]
  - - [8192, 2048, 1, 256, 8192, 8192, 256, 256]
    - [21, 15.634]
  - - [8192, 2048, 1, 512, 8192, 8192, 512, 512]
    - [17, 20.717]
  - - [8192, 2048, 1, 1024, 8192, 8192, 1024, 1024]
    - [10, 25.657]
  - - [8192, 2048, 1, 2048, 8192, 8192, 2048, 2048]
    - [11, 28.177]
  - - [8192, 2048, 1, 4096, 8192, 8192, 4096, 4096]
    - [6, 29.627]
  - - [8192, 2048, 1, 8192, 8192, 8192, 8192, 8192]
    - [11, 30.292]
  - - [8192, 4096, 1, 128, 8192, 8192, 128, 128]
    - [21, 11.453]
  - - [8192, 4096, 1, 256, 8192, 8192, 256, 256]
    - [19, 16.62]
  - - [8192, 4096, 1, 512, 8192, 8192, 512, 512]
    - [17, 21.643]
  - - [8192, 4096, 1, 1024, 8192, 8192, 1024, 1024]
    - [21, 26.64]
  - - [8192, 4096, 1, 2048, 8192, 8192, 2048, 2048]
    - [20, 29.667]
  - - [8192, 4096, 1, 4096, 8192, 8192, 4096, 4096]
    - [17, 32.501]
  - - [8192, 4096, 1, 8192, 8192, 8192, 8192, 8192]
    - [10, 32.676]
  - - [8192, 8192, 1, 128, 8192, 8192, 128, 128]
    - [17, 10.711]
  - - [8192, 8192, 1, 256, 8192, 8192, 256, 256]
    - [20, 15.749]
  - - [8192, 8192, 1, 512, 8192, 8192, 512, 512]
    - [17, 21.825]
  - - [8192, 8192, 1, 1024, 8192, 8192, 1024, 1024]
    - [17, 26.916]
  - - [8192, 8192, 1, 2048, 8192, 8192, 2048, 2048]
    - [21, 30.491]
  - - [8192, 8192, 1, 4096, 8192, 8192, 4096, 4096]
    - [19, 34.724]
  - - [8192, 8192, 1, 8192, 8192, 8192, 8192, 8192]
    - [17, 35.646]
  - - [1, 1, 1, 32, 1, 1, 32, 32]
    - [79, 0.0]
- null
- null
- DeviceEfficiency
- GridBased
